70051  29.021333 100.176.176.204 -> 41.177.26.176 TCP 78 39032 > http [SYN] Seq=0 Win=5840 Len=0 MSS=1460 SACK_PERM=1 TSval=1096576603 TSecr=0 WS=4
70974  29.315194 100.176.176.204 -> 41.177.26.176 TCP 70 39032 > http [ACK] Seq=1 Ack=1 Win=5840 Len=0 TSval=1096576896 TSecr=140344498
72564  29.700943 100.176.176.204 -> 41.177.26.176 TCP 70 39032 > http [ACK] Seq=515 Ack=227 Win=6912 Len=0 TSval=1096577293 TSecr=140344538
72565  29.701154 100.176.176.204 -> 41.177.26.176 TCP 70 39032 > http [ACK] Seq=515 Ack=233 Win=6912 Len=0 TSval=1096577294 TSecr=140344538
72566  29.701324 100.176.176.204 -> 41.177.26.176 TCP 70 39032 > http [ACK] Seq=515 Ack=1681 Win=9808 Len=0 TSval=1096577294 TSecr=140344538
72567  29.701328 100.176.176.204 -> 41.177.26.176 TCP 70 39032 > http [ACK] Seq=515 Ack=3129 Win=12704 Len=0 TSval=1096577294 TSecr=140344538
73604  29.985340 100.176.176.204 -> 41.177.26.176 TCP 70 39032 > http [ACK] Seq=515 Ack=4577 Win=15600 Len=0 TSval=1096577576 TSecr=140344566
73605  29.985555 100.176.176.204 -> 41.177.26.176 TCP 70 39032 > http [ACK] Seq=515 Ack=5766 Win=18496 Len=0 TSval=1096577576 TSecr=140344566
73608  29.985627 100.176.176.204 -> 41.177.26.176 TCP 82 [TCP Dup ACK 73605#1] 39032 > http [ACK] Seq=515 Ack=5766 Win=18496 Len=0 TSval=1096577576 TSecr=140344566 SLE=7214 SRE=7972
73609  29.985631 100.176.176.204 -> 41.177.26.176 TCP 70 39032 > http [ACK] Seq=515 Ack=7972 Win=21392 Len=0 TSval=1096577576 TSecr=140344566
73610  29.985635 100.176.176.204 -> 41.177.26.176 TCP 70 39032 > http [ACK] Seq=515 Ack=9420 Win=24288 Len=0 TSval=1096577576 TSecr=140344566
73611  29.985639 100.176.176.204 -> 41.177.26.176 TCP 70 39032 > http [ACK] Seq=515 Ack=10868 Win=27184 Len=0 TSval=1096577576 TSecr=140344566
73613  29.985742 100.176.176.204 -> 41.177.26.176 TCP 70 39032 > http [ACK] Seq=515 Ack=12316 Win=30080 Len=0 TSval=1096577576 TSecr=140344566
74553  30.271896 100.176.176.204 -> 41.177.26.176 TCP 70 39032 > http [ACK] Seq=515 Ack=13764 Win=32976 Len=0 TSval=1096577861 TSecr=140344594
74554  30.271901 100.176.176.204 -> 41.177.26.176 TCP 70 39032 > http [ACK] Seq=515 Ack=15212 Win=35872 Len=0 TSval=1096577861 TSecr=140344594
74555  30.271905 100.176.176.204 -> 41.177.26.176 TCP 70 39032 > http [ACK] Seq=515 Ack=16660 Win=38768 Len=0 TSval=1096577861 TSecr=140344594
74556  30.271951 100.176.176.204 -> 41.177.26.176 TCP 82 [TCP Dup ACK 74555#1] 39032 > http [ACK] Seq=515 Ack=16660 Win=38768 Len=0 TSval=1096577861 TSecr=140344594 SLE=18108 SRE=18621
74557  30.271956 100.176.176.204 -> 41.177.26.176 TCP 70 39032 > http [ACK] Seq=515 Ack=18621 Win=41664 Len=0 TSval=1096577861 TSecr=140344594
74584  30.279478 100.176.176.204 -> 41.177.26.176 TCP 70 39032 > http [FIN, ACK] Seq=515 Ack=18621 Win=41664 Len=0 TSval=1096577867 TSecr=140344594
