116088  41.417590  106.37.77.3 -> 41.177.26.46 TCP 78 52741 > http [SYN] Seq=0 Win=65535 Len=0 MSS=1410 WS=32 SACK_PERM=1 TSval=3201051304 TSecr=0
116559  41.607177  106.37.77.3 -> 41.177.26.46 TCP 70 52741 > http [ACK] Seq=1 Ack=1 Win=65696 Len=0 TSval=3201051493 TSecr=1509549600
116941  41.807731  106.37.77.3 -> 41.177.26.46 TCP 70 52741 > http [FIN, ACK] Seq=275 Ack=421 Win=65280 Len=0 TSval=3201051694 TSecr=1509549620
116942  41.807736  106.37.77.3 -> 41.177.26.46 TCP 70 52741 > http [RST, ACK] Seq=276 Ack=421 Win=65280 Len=0 TSval=3201051694 TSecr=1509549620
117263  41.997439  106.37.77.3 -> 41.177.26.46 TCP 64 52741 > http [RST] Seq=276 Win=0 Len=0
906017 298.652455  106.37.77.3 -> 41.177.26.46 TCP 78 59945 > http [SYN] Seq=0 Win=65535 Len=0 MSS=1410 WS=32 SACK_PERM=1 TSval=3201308533 TSecr=0
906560 298.835981  106.37.77.3 -> 41.177.26.46 TCP 70 59945 > http [ACK] Seq=1 Ack=1 Win=65696 Len=0 TSval=3201308716 TSecr=1509575323
907285 299.022370  106.37.77.3 -> 41.177.26.46 TCP 70 59945 > http [FIN, ACK] Seq=326 Ack=167 Win=65536 Len=0 TSval=3201308902 TSecr=1509575342
907286 299.022375  106.37.77.3 -> 41.177.26.46 TCP 70 59945 > http [RST, ACK] Seq=327 Ack=167 Win=65536 Len=0 TSval=3201308902 TSecr=1509575342
907604 299.205814  106.37.77.3 -> 41.177.26.46 TCP 64 59945 > http [RST] Seq=327 Win=0 Len=0
