32581  13.812631 117.246.95.43 -> 244.3.160.239 TCP 66 http > 33290 [SYN, ACK] Seq=0 Ack=1 Win=5840 Len=0 MSS=1460 SACK_PERM=1
32655  13.838676 117.246.95.43 -> 244.3.160.239 TCP 64 http > 33290 [ACK] Seq=1 Ack=397 Win=6432 Len=0
32896  13.964086 117.246.95.43 -> 244.3.160.239 TCP 64 http > 33290 [FIN, ACK] Seq=544 Ack=398 Win=6432 Len=0
32935  13.976407 117.246.95.43 -> 244.3.160.239 TCP 66 http > 33291 [SYN, ACK] Seq=0 Ack=1 Win=5840 Len=0 MSS=1460 SACK_PERM=1
33083  14.001604 117.246.95.43 -> 244.3.160.239 TCP 64 http > 33291 [ACK] Seq=1 Ack=596 Win=6545 Len=0
33208  14.067275 117.246.95.43 -> 244.3.160.239 TCP 64 http > 33291 [FIN, ACK] Seq=414 Ack=597 Win=6545 Len=0
33246  14.076053 117.246.95.43 -> 244.3.160.239 TCP 66 http > 33292 [SYN, ACK] Seq=0 Ack=1 Win=5840 Len=0 MSS=1460 SACK_PERM=1
33293  14.101443 117.246.95.43 -> 244.3.160.239 TCP 64 http > 33292 [ACK] Seq=1 Ack=694 Win=6930 Len=0
33547  14.227598 117.246.95.43 -> 244.3.160.239 TCP 64 http > 33292 [FIN, ACK] Seq=495 Ack=695 Win=6930 Len=0
33569  14.236319 117.246.95.43 -> 244.3.160.239 TCP 66 http > 33293 [SYN, ACK] Seq=0 Ack=1 Win=5840 Len=0 MSS=1460 SACK_PERM=1
33602  14.261634 117.246.95.43 -> 244.3.160.239 TCP 64 http > 33293 [ACK] Seq=1 Ack=673 Win=6720 Len=0
34254  14.518315 117.246.95.43 -> 244.3.160.239 TCP 66 http > 33295 [SYN, ACK] Seq=0 Ack=1 Win=5840 Len=0 MSS=1460 SACK_PERM=1
34261  14.519097 117.246.95.43 -> 244.3.160.239 TCP 66 http > 33296 [SYN, ACK] Seq=0 Ack=1 Win=5840 Len=0 MSS=1460 SACK_PERM=1
34265  14.519513 117.246.95.43 -> 244.3.160.239 TCP 66 http > 33297 [SYN, ACK] Seq=0 Ack=1 Win=5840 Len=0 MSS=1460 SACK_PERM=1
34272  14.520510 117.246.95.43 -> 244.3.160.239 TCP 66 http > 33298 [SYN, ACK] Seq=0 Ack=1 Win=5840 Len=0 MSS=1460 SACK_PERM=1
34342  14.542170 117.246.95.43 -> 244.3.160.239 TCP 64 http > 33295 [ACK] Seq=1 Ack=565 Win=6768 Len=0
34346  14.542812 117.246.95.43 -> 244.3.160.239 TCP 70 [TCP segment of a reassembled PDU]
34348  14.543083 117.246.95.43 -> 244.3.160.239 TCP 64 http > 33296 [ACK] Seq=1 Ack=560 Win=6708 Len=0
34350  14.543632 117.246.95.43 -> 244.3.160.239 TCP 64 http > 33297 [ACK] Seq=1 Ack=573 Win=6864 Len=0
34367  14.544330 117.246.95.43 -> 244.3.160.239 TCP 64 http > 33298 [ACK] Seq=1 Ack=573 Win=6864 Len=0
34382  14.546790 117.246.95.43 -> 244.3.160.239 TCP 70 [TCP segment of a reassembled PDU]
34511  14.570040 117.246.95.43 -> 244.3.160.239 TCP 64 http > 33295 [FIN, ACK] Seq=2222 Ack=566 Win=6768 Len=0
34579  14.582039 117.246.95.43 -> 244.3.160.239 TCP 66 http > 33299 [SYN, ACK] Seq=0 Ack=1 Win=5840 Len=0 MSS=1460 SACK_PERM=1
34614  14.588593 117.246.95.43 -> 244.3.160.239 TCP 64 http > 33298 [FIN, ACK] Seq=4943 Ack=574 Win=6864 Len=0
34694  14.603252 117.246.95.43 -> 244.3.160.239 TCP 66 http > 33300 [SYN, ACK] Seq=0 Ack=1 Win=5840 Len=0 MSS=1460 SACK_PERM=1
34782  14.622514 117.246.95.43 -> 244.3.160.239 TCP 64 http > 33299 [ACK] Seq=1 Ack=563 Win=6744 Len=0
34789  14.623084 117.246.95.43 -> 244.3.160.239 TCP 70 [TCP segment of a reassembled PDU]
34864  14.640255 117.246.95.43 -> 244.3.160.239 TCP 64 http > 33300 [ACK] Seq=1 Ack=566 Win=6780 Len=0
34876  14.642111 117.246.95.43 -> 244.3.160.239 TCP 70 [TCP segment of a reassembled PDU]
34911  14.655368 117.246.95.43 -> 244.3.160.239 TCP 64 http > 33296 [FIN, ACK] Seq=40148 Ack=561 Win=6708 Len=0
34914  14.655762 117.246.95.43 -> 244.3.160.239 TCP 64 http > 33293 [FIN, ACK] Seq=62258 Ack=674 Win=6720 Len=0
34924  14.658006 117.246.95.43 -> 244.3.160.239 TCP 64 http > 33297 [FIN, ACK] Seq=42736 Ack=574 Win=6864 Len=0
34936  14.660823 117.246.95.43 -> 244.3.160.239 TCP 64 http > 33299 [FIN, ACK] Seq=4435 Ack=564 Win=6744 Len=0
34944  14.664965 117.246.95.43 -> 244.3.160.239 TCP 66 http > 33301 [SYN, ACK] Seq=0 Ack=1 Win=5840 Len=0 MSS=1460 SACK_PERM=1
34951  14.672012 117.246.95.43 -> 244.3.160.239 TCP 64 http > 33300 [FIN, ACK] Seq=4477 Ack=567 Win=6780 Len=0
35001  14.682739 117.246.95.43 -> 244.3.160.239 TCP 66 http > 33302 [SYN, ACK] Seq=0 Ack=1 Win=5840 Len=0 MSS=1460 SACK_PERM=1
35003  14.682976 117.246.95.43 -> 244.3.160.239 TCP 66 http > 33303 [SYN, ACK] Seq=0 Ack=1 Win=5840 Len=0 MSS=1460 SACK_PERM=1
35007  14.683662 117.246.95.43 -> 244.3.160.239 TCP 66 http > 33304 [SYN, ACK] Seq=0 Ack=1 Win=5840 Len=0 MSS=1460 SACK_PERM=1
35012  14.688755 117.246.95.43 -> 244.3.160.239 TCP 64 http > 33301 [ACK] Seq=1 Ack=563 Win=6744 Len=0
35042  14.706418 117.246.95.43 -> 244.3.160.239 TCP 64 http > 33302 [ACK] Seq=1 Ack=559 Win=6696 Len=0
35046  14.706915 117.246.95.43 -> 244.3.160.239 TCP 64 http > 33303 [ACK] Seq=1 Ack=563 Win=6744 Len=0
35054  14.707351 117.246.95.43 -> 244.3.160.239 TCP 64 http > 33304 [ACK] Seq=1 Ack=560 Win=6708 Len=0
35061  14.707875 117.246.95.43 -> 244.3.160.239 TCP 70 [TCP segment of a reassembled PDU]
35064  14.707950 117.246.95.43 -> 244.3.160.239 TCP 70 [TCP segment of a reassembled PDU]
35181  14.735948 117.246.95.43 -> 244.3.160.239 TCP 64 http > 33304 [FIN, ACK] Seq=2156 Ack=561 Win=6708 Len=0
35225  14.749106 117.246.95.43 -> 244.3.160.239 TCP 64 http > 33303 [FIN, ACK] Seq=6481 Ack=564 Win=6744 Len=0
35241  14.757070 117.246.95.43 -> 244.3.160.239 TCP 64 http > 33302 [FIN, ACK] Seq=9091 Ack=560 Win=6696 Len=0
35759  14.909494 117.246.95.43 -> 244.3.160.239 TCP 64 http > 33301 [FIN, ACK] Seq=158775 Ack=564 Win=6744 Len=0
35940  15.012506 117.246.95.43 -> 244.3.160.239 TCP 66 http > 33305 [SYN, ACK] Seq=0 Ack=1 Win=5840 Len=0 MSS=1460 SACK_PERM=1
35944  15.013303 117.246.95.43 -> 244.3.160.239 TCP 66 http > 33307 [SYN, ACK] Seq=0 Ack=1 Win=5840 Len=0 MSS=1460 SACK_PERM=1
35947  15.013403 117.246.95.43 -> 244.3.160.239 TCP 66 http > 33306 [SYN, ACK] Seq=0 Ack=1 Win=5840 Len=0 MSS=1460 SACK_PERM=1
35951  15.014403 117.246.95.43 -> 244.3.160.239 TCP 66 http > 33308 [SYN, ACK] Seq=0 Ack=1 Win=5840 Len=0 MSS=1460 SACK_PERM=1
36039  15.036212 117.246.95.43 -> 244.3.160.239 TCP 64 http > 33305 [ACK] Seq=1 Ack=567 Win=6792 Len=0
36042  15.036979 117.246.95.43 -> 244.3.160.239 TCP 64 http > 33307 [ACK] Seq=1 Ack=558 Win=6684 Len=0
36043  15.037294 117.246.95.43 -> 244.3.160.239 TCP 64 http > 33306 [ACK] Seq=1 Ack=557 Win=6672 Len=0
36049  15.038246 117.246.95.43 -> 244.3.160.239 TCP 64 http > 33308 [ACK] Seq=1 Ack=571 Win=6840 Len=0
36389  15.125069 117.246.95.43 -> 244.3.160.239 TCP 64 http > 33306 [FIN, ACK] Seq=373 Ack=558 Win=6672 Len=0
36396  15.125676 117.246.95.43 -> 244.3.160.239 TCP 64 http > 33305 [FIN, ACK] Seq=397 Ack=568 Win=6792 Len=0
36398  15.126035 117.246.95.43 -> 244.3.160.239 TCP 64 http > 33307 [FIN, ACK] Seq=589 Ack=559 Win=6684 Len=0
36400  15.126745 117.246.95.43 -> 244.3.160.239 TCP 64 http > 33308 [FIN, ACK] Seq=507 Ack=572 Win=6840 Len=0
36620  15.297768 117.246.95.43 -> 244.3.160.239 TCP 66 http > 33309 [SYN, ACK] Seq=0 Ack=1 Win=5840 Len=0 MSS=1460 SACK_PERM=1
36649  15.314492 117.246.95.43 -> 244.3.160.239 TCP 66 http > 33310 [SYN, ACK] Seq=0 Ack=1 Win=5840 Len=0 MSS=1460 SACK_PERM=1
36653  15.315637 117.246.95.43 -> 244.3.160.239 TCP 66 http > 33311 [SYN, ACK] Seq=0 Ack=1 Win=5840 Len=0 MSS=1460 SACK_PERM=1
36657  15.316010 117.246.95.43 -> 244.3.160.239 TCP 66 http > 33312 [SYN, ACK] Seq=0 Ack=1 Win=5840 Len=0 MSS=1460 SACK_PERM=1
36663  15.317139 117.246.95.43 -> 244.3.160.239 TCP 66 http > 33313 [SYN, ACK] Seq=0 Ack=1 Win=5840 Len=0 MSS=1460 SACK_PERM=1
36671  15.321407 117.246.95.43 -> 244.3.160.239 TCP 64 http > 33309 [ACK] Seq=1 Ack=627 Win=6886 Len=0
36690  15.338443 117.246.95.43 -> 244.3.160.239 TCP 64 http > 33310 [ACK] Seq=1 Ack=555 Win=6648 Len=0
36696  15.339226 117.246.95.43 -> 244.3.160.239 TCP 64 http > 33311 [ACK] Seq=1 Ack=560 Win=6708 Len=0
36698  15.339865 117.246.95.43 -> 244.3.160.239 TCP 64 http > 33312 [ACK] Seq=1 Ack=561 Win=6720 Len=0
36703  15.340715 117.246.95.43 -> 244.3.160.239 TCP 64 http > 33313 [ACK] Seq=1 Ack=556 Win=6660 Len=0
36894  15.396414 117.246.95.43 -> 244.3.160.239 TCP 66 http > 33314 [SYN, ACK] Seq=0 Ack=1 Win=5840 Len=0 MSS=1460 SACK_PERM=1
36898  15.396817 117.246.95.43 -> 244.3.160.239 TCP 64 http > 33310 [FIN, ACK] Seq=378 Ack=556 Win=6648 Len=0
36901  15.397116 117.246.95.43 -> 244.3.160.239 TCP 64 http > 33311 [FIN, ACK] Seq=799 Ack=561 Win=6708 Len=0
36904  15.397390 117.246.95.43 -> 244.3.160.239 TCP 64 http > 33312 [FIN, ACK] Seq=514 Ack=562 Win=6720 Len=0
36907  15.397797 117.246.95.43 -> 244.3.160.239 TCP 64 http > 33313 [FIN, ACK] Seq=424 Ack=557 Win=6660 Len=0
36913  15.400079 117.246.95.43 -> 244.3.160.239 TCP 66 http > 33315 [SYN, ACK] Seq=0 Ack=1 Win=5840 Len=0 MSS=1460 SACK_PERM=1
36917  15.400513 117.246.95.43 -> 244.3.160.239 TCP 66 http > 33316 [SYN, ACK] Seq=0 Ack=1 Win=5840 Len=0 MSS=1460 SACK_PERM=1
36925  15.402975 117.246.95.43 -> 244.3.160.239 TCP 66 http > 33317 [SYN, ACK] Seq=0 Ack=1 Win=5840 Len=0 MSS=1460 SACK_PERM=1
36959  15.419973 117.246.95.43 -> 244.3.160.239 TCP 64 http > 33314 [ACK] Seq=1 Ack=562 Win=6732 Len=0
36970  15.423792 117.246.95.43 -> 244.3.160.239 TCP 64 http > 33315 [ACK] Seq=1 Ack=557 Win=6672 Len=0
36975  15.424456 117.246.95.43 -> 244.3.160.239 TCP 64 http > 33316 [ACK] Seq=1 Ack=563 Win=6744 Len=0
36989  15.426694 117.246.95.43 -> 244.3.160.239 TCP 64 http > 33317 [ACK] Seq=1 Ack=565 Win=6768 Len=0
37049  15.447104 117.246.95.43 -> 244.3.160.239 TCP 64 http > 33309 [FIN, ACK] Seq=446 Ack=628 Win=6886 Len=0
37324  15.548403 117.246.95.43 -> 244.3.160.239 TCP 66 http > 33318 [SYN, ACK] Seq=0 Ack=1 Win=5840 Len=0 MSS=1460 SACK_PERM=1
37342  15.549345 117.246.95.43 -> 244.3.160.239 TCP 66 http > 33319 [SYN, ACK] Seq=0 Ack=1 Win=5840 Len=0 MSS=1460 SACK_PERM=1
37344  15.549602 117.246.95.43 -> 244.3.160.239 TCP 66 http > 33320 [SYN, ACK] Seq=0 Ack=1 Win=5840 Len=0 MSS=1460 SACK_PERM=1
37348  15.550761 117.246.95.43 -> 244.3.160.239 TCP 66 http > 33321 [SYN, ACK] Seq=0 Ack=1 Win=5840 Len=0 MSS=1460 SACK_PERM=1
37408  15.571968 117.246.95.43 -> 244.3.160.239 TCP 64 http > 33318 [ACK] Seq=1 Ack=561 Win=6720 Len=0
37415  15.573001 117.246.95.43 -> 244.3.160.239 TCP 64 http > 33319 [ACK] Seq=1 Ack=568 Win=6804 Len=0
37423  15.573464 117.246.95.43 -> 244.3.160.239 TCP 64 http > 33320 [ACK] Seq=1 Ack=567 Win=6792 Len=0
37430  15.574409 117.246.95.43 -> 244.3.160.239 TCP 64 http > 33321 [ACK] Seq=1 Ack=567 Win=6792 Len=0
37565  15.638479 117.246.95.43 -> 244.3.160.239 TCP 64 http > 33316 [FIN, ACK] Seq=570 Ack=564 Win=6744 Len=0
37567  15.639216 117.246.95.43 -> 244.3.160.239 TCP 64 http > 33314 [FIN, ACK] Seq=542 Ack=563 Win=6732 Len=0
37569  15.639471 117.246.95.43 -> 244.3.160.239 TCP 64 http > 33317 [FIN, ACK] Seq=703 Ack=566 Win=6768 Len=0
37589  15.641132 117.246.95.43 -> 244.3.160.239 TCP 64 http > 33315 [FIN, ACK] Seq=2423 Ack=558 Win=6672 Len=0
37652  15.650915 117.246.95.43 -> 244.3.160.239 TCP 66 http > 33322 [SYN, ACK] Seq=0 Ack=1 Win=5840 Len=0 MSS=1460 SACK_PERM=1
37667  15.657490 117.246.95.43 -> 244.3.160.239 TCP 66 http > 33323 [SYN, ACK] Seq=0 Ack=1 Win=5840 Len=0 MSS=1460 SACK_PERM=1
37670  15.658817 117.246.95.43 -> 244.3.160.239 TCP 66 http > 33324 [SYN, ACK] Seq=0 Ack=1 Win=5840 Len=0 MSS=1460 SACK_PERM=1
37672  15.659212 117.246.95.43 -> 244.3.160.239 TCP 66 http > 33325 [SYN, ACK] Seq=0 Ack=1 Win=5840 Len=0 MSS=1460 SACK_PERM=1
37710  15.674834 117.246.95.43 -> 244.3.160.239 TCP 64 http > 33322 [ACK] Seq=1 Ack=560 Win=6708 Len=0
37720  15.681331 117.246.95.43 -> 244.3.160.239 TCP 64 http > 33323 [ACK] Seq=1 Ack=560 Win=6708 Len=0
37724  15.682556 117.246.95.43 -> 244.3.160.239 TCP 64 http > 33324 [ACK] Seq=1 Ack=560 Win=6708 Len=0
37725  15.683006 117.246.95.43 -> 244.3.160.239 TCP 64 http > 33325 [ACK] Seq=1 Ack=559 Win=6696 Len=0
37851  15.746674 117.246.95.43 -> 244.3.160.239 TCP 64 http > 33318 [FIN, ACK] Seq=538 Ack=562 Win=6720 Len=0
37853  15.746945 117.246.95.43 -> 244.3.160.239 TCP 64 http > 33320 [FIN, ACK] Seq=701 Ack=568 Win=6792 Len=0
37855  15.747254 117.246.95.43 -> 244.3.160.239 TCP 64 http > 33319 [FIN, ACK] Seq=744 Ack=569 Win=6804 Len=0
37876  15.747844 117.246.95.43 -> 244.3.160.239 TCP 64 http > 33321 [FIN, ACK] Seq=590 Ack=568 Win=6792 Len=0
37993  15.762526 117.246.95.43 -> 244.3.160.239 TCP 66 http > 33326 [SYN, ACK] Seq=0 Ack=1 Win=5840 Len=0 MSS=1460 SACK_PERM=1
38015  15.771931 117.246.95.43 -> 244.3.160.239 TCP 64 http > 33322 [FIN, ACK] Seq=674 Ack=561 Win=6708 Len=0
38017  15.772036 117.246.95.43 -> 244.3.160.239 TCP 64 http > 33323 [FIN, ACK] Seq=365 Ack=561 Win=6708 Len=0
38019  15.772718 117.246.95.43 -> 244.3.160.239 TCP 64 http > 33325 [FIN, ACK] Seq=639 Ack=560 Win=6696 Len=0
38021  15.773066 117.246.95.43 -> 244.3.160.239 TCP 64 http > 33324 [FIN, ACK] Seq=373 Ack=561 Win=6708 Len=0
38041  15.778707 117.246.95.43 -> 244.3.160.239 TCP 66 http > 33327 [SYN, ACK] Seq=0 Ack=1 Win=5840 Len=0 MSS=1460 SACK_PERM=1
38044  15.779938 117.246.95.43 -> 244.3.160.239 TCP 66 http > 33328 [SYN, ACK] Seq=0 Ack=1 Win=5840 Len=0 MSS=1460 SACK_PERM=1
38047  15.780455 117.246.95.43 -> 244.3.160.239 TCP 66 http > 33329 [SYN, ACK] Seq=0 Ack=1 Win=5840 Len=0 MSS=1460 SACK_PERM=1
38063  15.786859 117.246.95.43 -> 244.3.160.239 TCP 64 http > 33326 [ACK] Seq=1 Ack=558 Win=6684 Len=0
38112  15.802812 117.246.95.43 -> 244.3.160.239 TCP 64 http > 33327 [ACK] Seq=1 Ack=557 Win=6672 Len=0
38117  15.804075 117.246.95.43 -> 244.3.160.239 TCP 64 http > 33328 [ACK] Seq=1 Ack=556 Win=6660 Len=0
38119  15.804490 117.246.95.43 -> 244.3.160.239 TCP 64 http > 33329 [ACK] Seq=1 Ack=563 Win=6744 Len=0
38462  15.900480 117.246.95.43 -> 244.3.160.239 TCP 66 http > 33330 [SYN, ACK] Seq=0 Ack=1 Win=5840 Len=0 MSS=1460 SACK_PERM=1
38465  15.901298 117.246.95.43 -> 244.3.160.239 TCP 66 http > diamondport [SYN, ACK] Seq=0 Ack=1 Win=5840 Len=0 MSS=1460 SACK_PERM=1
38467  15.901648 117.246.95.43 -> 244.3.160.239 TCP 66 http > 33332 [SYN, ACK] Seq=0 Ack=1 Win=5840 Len=0 MSS=1460 SACK_PERM=1
38495  15.918973 117.246.95.43 -> 244.3.160.239 TCP 66 http > dgi-serv [SYN, ACK] Seq=0 Ack=1 Win=5840 Len=0 MSS=1460 SACK_PERM=1
38501  15.924142 117.246.95.43 -> 244.3.160.239 TCP 64 http > 33330 [ACK] Seq=1 Ack=564 Win=6756 Len=0
38505  15.925072 117.246.95.43 -> 244.3.160.239 TCP 64 http > diamondport [ACK] Seq=1 Ack=564 Win=6756 Len=0
38512  15.925567 117.246.95.43 -> 244.3.160.239 TCP 64 http > 33332 [ACK] Seq=1 Ack=563 Win=6744 Len=0
38532  15.943019 117.246.95.43 -> 244.3.160.239 TCP 64 http > dgi-serv [ACK] Seq=1 Ack=563 Win=6744 Len=0
38675  15.986591 117.246.95.43 -> 244.3.160.239 TCP 64 http > 33326 [FIN, ACK] Seq=1405 Ack=559 Win=6684 Len=0
38679  15.987075 117.246.95.43 -> 244.3.160.239 TCP 64 http > 33327 [FIN, ACK] Seq=1431 Ack=558 Win=6672 Len=0
38685  15.987323 117.246.95.43 -> 244.3.160.239 TCP 64 http > 33328 [FIN, ACK] Seq=1303 Ack=557 Win=6660 Len=0
38687  15.987573 117.246.95.43 -> 244.3.160.239 TCP 64 http > 33329 [FIN, ACK] Seq=3921 Ack=564 Win=6744 Len=0
38727  16.001728 117.246.95.43 -> 244.3.160.239 TCP 66 http > speedtrace [SYN, ACK] Seq=0 Ack=1 Win=5840 Len=0 MSS=1460 SACK_PERM=1
38730  16.003021 117.246.95.43 -> 244.3.160.239 TCP 66 http > 33335 [SYN, ACK] Seq=0 Ack=1 Win=5840 Len=0 MSS=1460 SACK_PERM=1
38736  16.005438 117.246.95.43 -> 244.3.160.239 TCP 66 http > 33336 [SYN, ACK] Seq=0 Ack=1 Win=5840 Len=0 MSS=1460 SACK_PERM=1
38812  16.025549 117.246.95.43 -> 244.3.160.239 TCP 64 http > speedtrace [ACK] Seq=1 Ack=561 Win=6720 Len=0
38814  16.026821 117.246.95.43 -> 244.3.160.239 TCP 64 http > 33335 [ACK] Seq=1 Ack=561 Win=6720 Len=0
38821  16.029122 117.246.95.43 -> 244.3.160.239 TCP 64 http > 33336 [ACK] Seq=1 Ack=563 Win=6744 Len=0
38838  16.040300 117.246.95.43 -> 244.3.160.239 TCP 64 http > 33330 [FIN, ACK] Seq=458 Ack=565 Win=6756 Len=0
38841  16.040883 117.246.95.43 -> 244.3.160.239 TCP 64 http > diamondport [FIN, ACK] Seq=412 Ack=565 Win=6756 Len=0
38843  16.041104 117.246.95.43 -> 244.3.160.239 TCP 64 http > 33332 [FIN, ACK] Seq=472 Ack=564 Win=6744 Len=0
38846  16.041713 117.246.95.43 -> 244.3.160.239 TCP 64 http > dgi-serv [FIN, ACK] Seq=461 Ack=564 Win=6744 Len=0
39086  16.166926 117.246.95.43 -> 244.3.160.239 TCP 66 http > 33337 [SYN, ACK] Seq=0 Ack=1 Win=5840 Len=0 MSS=1460 SACK_PERM=1
39088  16.167332 117.246.95.43 -> 244.3.160.239 TCP 66 http > 33338 [SYN, ACK] Seq=0 Ack=1 Win=5840 Len=0 MSS=1460 SACK_PERM=1
39097  16.168667 117.246.95.43 -> 244.3.160.239 TCP 66 http > 33339 [SYN, ACK] Seq=0 Ack=1 Win=5840 Len=0 MSS=1460 SACK_PERM=1
39100  16.168946 117.246.95.43 -> 244.3.160.239 TCP 66 http > 33340 [SYN, ACK] Seq=0 Ack=1 Win=5840 Len=0 MSS=1460 SACK_PERM=1
39149  16.190938 117.246.95.43 -> 244.3.160.239 TCP 64 http > 33337 [ACK] Seq=1 Ack=566 Win=6780 Len=0
39150  16.191199 117.246.95.43 -> 244.3.160.239 TCP 64 http > 33338 [ACK] Seq=1 Ack=663 Win=6620 Len=0
39154  16.192480 117.246.95.43 -> 244.3.160.239 TCP 64 http > 33339 [ACK] Seq=1 Ack=567 Win=6792 Len=0
39155  16.192908 117.246.95.43 -> 244.3.160.239 TCP 64 http > 33340 [ACK] Seq=1 Ack=586 Win=6435 Len=0
39272  16.256794 117.246.95.43 -> 244.3.160.239 TCP 64 http > speedtrace [FIN, ACK] Seq=412 Ack=562 Win=6720 Len=0
39274  16.256907 117.246.95.43 -> 244.3.160.239 TCP 64 http > 33335 [FIN, ACK] Seq=509 Ack=562 Win=6720 Len=0
39276  16.257279 117.246.95.43 -> 244.3.160.239 TCP 64 http > 33336 [FIN, ACK] Seq=434 Ack=564 Win=6744 Len=0
39278  16.258336 117.246.95.43 -> 244.3.160.239 TCP 64 http > 33340 [FIN, ACK] Seq=1163 Ack=587 Win=6435 Len=0
39392  16.295135 117.246.95.43 -> 244.3.160.239 TCP 64 http > 33337 [FIN, ACK] Seq=579 Ack=567 Win=6780 Len=0
39395  16.295466 117.246.95.43 -> 244.3.160.239 TCP 64 http > 33339 [FIN, ACK] Seq=562 Ack=568 Win=6792 Len=0
39423  16.315911 117.246.95.43 -> 244.3.160.239 TCP 64 http > 33338 [FIN, ACK] Seq=226 Ack=664 Win=6620 Len=0
61775  25.280224 117.246.95.43 -> 244.3.160.239 TCP 66 http > 33449 [SYN, ACK] Seq=0 Ack=1 Win=5840 Len=0 MSS=1460 SACK_PERM=1
61804  25.304029 117.246.95.43 -> 244.3.160.239 TCP 64 http > 33449 [ACK] Seq=1 Ack=754 Win=6777 Len=0
61805  25.304406 117.246.95.43 -> 244.3.160.239 TCP 64 http > 33449 [ACK] Seq=1 Ack=2214 Win=10220 Len=0
61806  25.304411 117.246.95.43 -> 244.3.160.239 TCP 64 http > 33449 [ACK] Seq=1 Ack=2317 Win=10220 Len=0
63436  26.209666 117.246.95.43 -> 244.3.160.239 TCP 64 http > 33449 [FIN, ACK] Seq=404 Ack=2318 Win=10220 Len=0
63460  26.218771 117.246.95.43 -> 244.3.160.239 TCP 66 http > 33452 [SYN, ACK] Seq=0 Ack=1 Win=5840 Len=0 MSS=1460 SACK_PERM=1
63511  26.242610 117.246.95.43 -> 244.3.160.239 TCP 64 http > 33452 [ACK] Seq=1 Ack=742 Win=6669 Len=0
64448  26.616853 117.246.95.43 -> 244.3.160.239 TCP 85 [TCP segment of a reassembled PDU]
64449  26.617108 117.246.95.43 -> 244.3.160.239 TCP 81 [TCP segment of a reassembled PDU]
64587  26.681332 117.246.95.43 -> 244.3.160.239 TCP 66 http > 33454 [SYN, ACK] Seq=0 Ack=1 Win=5840 Len=0 MSS=1460 SACK_PERM=1
64659  26.705348 117.246.95.43 -> 244.3.160.239 TCP 64 http > 33454 [ACK] Seq=1 Ack=610 Win=6699 Len=0
64694  26.712866 117.246.95.43 -> 244.3.160.239 TCP 66 http > 33455 [SYN, ACK] Seq=0 Ack=1 Win=5840 Len=0 MSS=1460 SACK_PERM=1
64700  26.713790 117.246.95.43 -> 244.3.160.239 TCP 66 http > 33456 [SYN, ACK] Seq=0 Ack=1 Win=5840 Len=0 MSS=1460 SACK_PERM=1
64702  26.714294 117.246.95.43 -> 244.3.160.239 TCP 66 http > 33457 [SYN, ACK] Seq=0 Ack=1 Win=5840 Len=0 MSS=1460 SACK_PERM=1
64769  26.730405 117.246.95.43 -> 244.3.160.239 TCP 64 http > 33454 [FIN, ACK] Seq=247 Ack=611 Win=6699 Len=0
64796  26.737285 117.246.95.43 -> 244.3.160.239 TCP 64 http > 33455 [ACK] Seq=1 Ack=623 Win=6842 Len=0
64801  26.737724 117.246.95.43 -> 244.3.160.239 TCP 64 http > 33456 [ACK] Seq=1 Ack=615 Win=6754 Len=0
64806  26.738573 117.246.95.43 -> 244.3.160.239 TCP 64 http > 33457 [ACK] Seq=1 Ack=623 Win=6842 Len=0
64815  26.739066 117.246.95.43 -> 244.3.160.239 TCP 66 http > 33458 [SYN, ACK] Seq=0 Ack=1 Win=5840 Len=0 MSS=1460 SACK_PERM=1
64888  26.762086 117.246.95.43 -> 244.3.160.239 TCP 64 http > 33455 [FIN, ACK] Seq=233 Ack=624 Win=6842 Len=0
64890  26.763250 117.246.95.43 -> 244.3.160.239 TCP 64 http > 33458 [ACK] Seq=1 Ack=613 Win=6732 Len=0
64891  26.763727 117.246.95.43 -> 244.3.160.239 TCP 64 http > 33457 [FIN, ACK] Seq=233 Ack=624 Win=6842 Len=0
64920  26.767933 117.246.95.43 -> 244.3.160.239 TCP 64 http > 33456 [FIN, ACK] Seq=247 Ack=616 Win=6754 Len=0
64957  26.789311 117.246.95.43 -> 244.3.160.239 TCP 66 http > 33459 [SYN, ACK] Seq=0 Ack=1 Win=5840 Len=0 MSS=1460 SACK_PERM=1
64963  26.790700 117.246.95.43 -> 244.3.160.239 TCP 66 http > 33461 [SYN, ACK] Seq=0 Ack=1 Win=5840 Len=0 MSS=1460 SACK_PERM=1
64964  26.790705 117.246.95.43 -> 244.3.160.239 TCP 66 http > 33460 [SYN, ACK] Seq=0 Ack=1 Win=5840 Len=0 MSS=1460 SACK_PERM=1
64969  26.791936 117.246.95.43 -> 244.3.160.239 TCP 64 http > 33458 [FIN, ACK] Seq=247 Ack=614 Win=6732 Len=0
64978  26.798714 117.246.95.43 -> 244.3.160.239 TCP 66 http > 33462 [SYN, ACK] Seq=0 Ack=1 Win=5840 Len=0 MSS=1460 SACK_PERM=1
64987  26.813208 117.246.95.43 -> 244.3.160.239 TCP 64 http > 33459 [ACK] Seq=1 Ack=616 Win=6765 Len=0
64990  26.814618 117.246.95.43 -> 244.3.160.239 TCP 64 http > 33460 [ACK] Seq=1 Ack=613 Win=6732 Len=0
64995  26.815030 117.246.95.43 -> 244.3.160.239 TCP 64 http > 33461 [ACK] Seq=1 Ack=613 Win=6732 Len=0
65034  26.822538 117.246.95.43 -> 244.3.160.239 TCP 64 http > 33462 [ACK] Seq=1 Ack=609 Win=6688 Len=0
65061  26.838041 117.246.95.43 -> 244.3.160.239 TCP 64 http > 33459 [FIN, ACK] Seq=247 Ack=617 Win=6765 Len=0
65063  26.840476 117.246.95.43 -> 244.3.160.239 TCP 64 http > 33460 [FIN, ACK] Seq=247 Ack=614 Win=6732 Len=0
65066  26.841057 117.246.95.43 -> 244.3.160.239 TCP 64 http > 33461 [FIN, ACK] Seq=247 Ack=614 Win=6732 Len=0
65070  26.848922 117.246.95.43 -> 244.3.160.239 TCP 64 http > 33462 [FIN, ACK] Seq=247 Ack=610 Win=6688 Len=0
65129  26.878943 117.246.95.43 -> 244.3.160.239 TCP 66 http > 33463 [SYN, ACK] Seq=0 Ack=1 Win=5840 Len=0 MSS=1460 SACK_PERM=1
65172  26.902988 117.246.95.43 -> 244.3.160.239 TCP 64 http > 33463 [ACK] Seq=1 Ack=610 Win=6699 Len=0
65218  26.927758 117.246.95.43 -> 244.3.160.239 TCP 64 http > 33463 [FIN, ACK] Seq=247 Ack=611 Win=6699 Len=0
65373  26.972638 117.246.95.43 -> 244.3.160.239 TCP 66 http > 33464 [SYN, ACK] Seq=0 Ack=1 Win=5840 Len=0 MSS=1460 SACK_PERM=1
65379  26.973973 117.246.95.43 -> 244.3.160.239 TCP 66 http > 33465 [SYN, ACK] Seq=0 Ack=1 Win=5840 Len=0 MSS=1460 SACK_PERM=1
65387  26.974692 117.246.95.43 -> 244.3.160.239 TCP 66 http > 33466 [SYN, ACK] Seq=0 Ack=1 Win=5840 Len=0 MSS=1460 SACK_PERM=1
65389  26.975032 117.246.95.43 -> 244.3.160.239 TCP 66 http > 33467 [SYN, ACK] Seq=0 Ack=1 Win=5840 Len=0 MSS=1460 SACK_PERM=1
65430  26.996426 117.246.95.43 -> 244.3.160.239 TCP 64 http > 33464 [ACK] Seq=1 Ack=621 Win=6820 Len=0
65433  26.997645 117.246.95.43 -> 244.3.160.239 TCP 64 http > 33465 [ACK] Seq=1 Ack=608 Win=6677 Len=0
65439  26.998859 117.246.95.43 -> 244.3.160.239 TCP 64 http > 33466 [ACK] Seq=1 Ack=617 Win=6776 Len=0
65444  26.999509 117.246.95.43 -> 244.3.160.239 TCP 64 http > 33467 [ACK] Seq=1 Ack=607 Win=6666 Len=0
65518  27.021224 117.246.95.43 -> 244.3.160.239 TCP 64 http > 33464 [FIN, ACK] Seq=234 Ack=622 Win=6820 Len=0
65525  27.022805 117.246.95.43 -> 244.3.160.239 TCP 64 http > 33465 [FIN, ACK] Seq=234 Ack=609 Win=6677 Len=0
65537  27.024920 117.246.95.43 -> 244.3.160.239 TCP 64 http > 33467 [FIN, ACK] Seq=234 Ack=608 Win=6666 Len=0
65538  27.024925 117.246.95.43 -> 244.3.160.239 TCP 64 http > 33466 [FIN, ACK] Seq=234 Ack=618 Win=6776 Len=0
65563  27.036115 117.246.95.43 -> 244.3.160.239 TCP 66 http > 33468 [SYN, ACK] Seq=0 Ack=1 Win=5840 Len=0 MSS=1460 SACK_PERM=1
65592  27.046243 117.246.95.43 -> 244.3.160.239 TCP 66 http > 33469 [SYN, ACK] Seq=0 Ack=1 Win=5840 Len=0 MSS=1460 SACK_PERM=1
65613  27.060166 117.246.95.43 -> 244.3.160.239 TCP 64 http > 33468 [ACK] Seq=1 Ack=611 Win=6710 Len=0
65644  27.068896 117.246.95.43 -> 244.3.160.239 TCP 66 http > 33471 [SYN, ACK] Seq=0 Ack=1 Win=5840 Len=0 MSS=1460 SACK_PERM=1
65647  27.069111 117.246.95.43 -> 244.3.160.239 TCP 66 http > 33472 [SYN, ACK] Seq=0 Ack=1 Win=5840 Len=0 MSS=1460 SACK_PERM=1
65656  27.070115 117.246.95.43 -> 244.3.160.239 TCP 64 http > 33469 [ACK] Seq=1 Ack=606 Win=6655 Len=0
65705  27.085092 117.246.95.43 -> 244.3.160.239 TCP 64 http > 33468 [FIN, ACK] Seq=234 Ack=612 Win=6710 Len=0
65718  27.092927 117.246.95.43 -> 244.3.160.239 TCP 64 http > 33472 [ACK] Seq=1 Ack=605 Win=6644 Len=0
65720  27.093147 117.246.95.43 -> 244.3.160.239 TCP 64 http > 33471 [ACK] Seq=1 Ack=610 Win=6699 Len=0
65725  27.094685 117.246.95.43 -> 244.3.160.239 TCP 64 http > 33469 [FIN, ACK] Seq=234 Ack=607 Win=6655 Len=0
65742  27.097638 117.246.95.43 -> 244.3.160.239 TCP 66 http > 33473 [SYN, ACK] Seq=0 Ack=1 Win=5840 Len=0 MSS=1460 SACK_PERM=1
65764  27.105152 117.246.95.43 -> 244.3.160.239 TCP 66 http > 33474 [SYN, ACK] Seq=0 Ack=1 Win=5840 Len=0 MSS=1460 SACK_PERM=1
65798  27.118750 117.246.95.43 -> 244.3.160.239 TCP 64 http > 33471 [FIN, ACK] Seq=234 Ack=611 Win=6699 Len=0
65801  27.118917 117.246.95.43 -> 244.3.160.239 TCP 64 http > 33472 [FIN, ACK] Seq=234 Ack=606 Win=6644 Len=0
65809  27.121785 117.246.95.43 -> 244.3.160.239 TCP 64 http > 33473 [ACK] Seq=1 Ack=607 Win=6666 Len=0
65826  27.129132 117.246.95.43 -> 244.3.160.239 TCP 64 http > 33474 [ACK] Seq=1 Ack=612 Win=6721 Len=0
65834  27.130820 117.246.95.43 -> 244.3.160.239 TCP 66 http > 33475 [SYN, ACK] Seq=0 Ack=1 Win=5840 Len=0 MSS=1460 SACK_PERM=1
65842  27.132894 117.246.95.43 -> 244.3.160.239 TCP 66 http > 33476 [SYN, ACK] Seq=0 Ack=1 Win=5840 Len=0 MSS=1460 SACK_PERM=1
65879  27.146622 117.246.95.43 -> 244.3.160.239 TCP 64 http > 33473 [FIN, ACK] Seq=234 Ack=608 Win=6666 Len=0
65886  27.153948 117.246.95.43 -> 244.3.160.239 TCP 64 http > 33474 [FIN, ACK] Seq=234 Ack=613 Win=6721 Len=0
65888  27.154680 117.246.95.43 -> 244.3.160.239 TCP 64 http > 33475 [ACK] Seq=1 Ack=615 Win=6754 Len=0
65894  27.156961 117.246.95.43 -> 244.3.160.239 TCP 64 http > 33476 [ACK] Seq=1 Ack=613 Win=6732 Len=0
65899  27.158306 117.246.95.43 -> 244.3.160.239 TCP 66 http > 33477 [SYN, ACK] Seq=0 Ack=1 Win=5840 Len=0 MSS=1460 SACK_PERM=1
65917  27.162638 117.246.95.43 -> 244.3.160.239 TCP 66 http > 33479 [SYN, ACK] Seq=0 Ack=1 Win=5840 Len=0 MSS=1460 SACK_PERM=1
65947  27.179629 117.246.95.43 -> 244.3.160.239 TCP 64 http > 33475 [FIN, ACK] Seq=234 Ack=616 Win=6754 Len=0
65949  27.182623 117.246.95.43 -> 244.3.160.239 TCP 64 http > 33477 [ACK] Seq=1 Ack=618 Win=6787 Len=0
65950  27.182628 117.246.95.43 -> 244.3.160.239 TCP 64 http > 33476 [FIN, ACK] Seq=234 Ack=614 Win=6732 Len=0
65968  27.186642 117.246.95.43 -> 244.3.160.239 TCP 64 http > 33479 [ACK] Seq=1 Ack=611 Win=6710 Len=0
65974  27.189648 117.246.95.43 -> 244.3.160.239 TCP 66 http > 33480 [SYN, ACK] Seq=0 Ack=1 Win=5840 Len=0 MSS=1460 SACK_PERM=1
65984  27.192363 117.246.95.43 -> 244.3.160.239 TCP 66 http > 33481 [SYN, ACK] Seq=0 Ack=1 Win=5840 Len=0 MSS=1460 SACK_PERM=1
66011  27.207209 117.246.95.43 -> 244.3.160.239 TCP 64 http > 33477 [FIN, ACK] Seq=234 Ack=619 Win=6787 Len=0
66013  27.211785 117.246.95.43 -> 244.3.160.239 TCP 64 http > 33479 [FIN, ACK] Seq=234 Ack=612 Win=6710 Len=0
66015  27.213599 117.246.95.43 -> 244.3.160.239 TCP 64 http > 33480 [ACK] Seq=1 Ack=617 Win=6776 Len=0
66023  27.216183 117.246.95.43 -> 244.3.160.239 TCP 64 http > 33481 [ACK] Seq=1 Ack=617 Win=6776 Len=0
66028  27.217600 117.246.95.43 -> 244.3.160.239 TCP 66 http > 33482 [SYN, ACK] Seq=0 Ack=1 Win=5840 Len=0 MSS=1460 SACK_PERM=1
66048  27.221500 117.246.95.43 -> 244.3.160.239 TCP 66 http > 33483 [SYN, ACK] Seq=0 Ack=1 Win=5840 Len=0 MSS=1460 SACK_PERM=1
66078  27.238519 117.246.95.43 -> 244.3.160.239 TCP 64 http > 33480 [FIN, ACK] Seq=234 Ack=618 Win=6776 Len=0
66082  27.241326 117.246.95.43 -> 244.3.160.239 TCP 64 http > 33481 [FIN, ACK] Seq=234 Ack=618 Win=6776 Len=0
66084  27.241561 117.246.95.43 -> 244.3.160.239 TCP 64 http > 33482 [ACK] Seq=1 Ack=610 Win=6699 Len=0
66096  27.245499 117.246.95.43 -> 244.3.160.239 TCP 64 http > 33483 [ACK] Seq=1 Ack=610 Win=6699 Len=0
66116  27.250855 117.246.95.43 -> 244.3.160.239 TCP 66 http > 33484 [SYN, ACK] Seq=0 Ack=1 Win=5840 Len=0 MSS=1460 SACK_PERM=1
66123  27.251724 117.246.95.43 -> 244.3.160.239 TCP 66 http > 33485 [SYN, ACK] Seq=0 Ack=1 Win=5840 Len=0 MSS=1460 SACK_PERM=1
66142  27.266568 117.246.95.43 -> 244.3.160.239 TCP 64 http > 33482 [FIN, ACK] Seq=234 Ack=611 Win=6699 Len=0
66146  27.271216 117.246.95.43 -> 244.3.160.239 TCP 64 http > 33483 [FIN, ACK] Seq=234 Ack=611 Win=6699 Len=0
66152  27.274662 117.246.95.43 -> 244.3.160.239 TCP 64 http > 33484 [ACK] Seq=1 Ack=610 Win=6699 Len=0
66153  27.275434 117.246.95.43 -> 244.3.160.239 TCP 64 http > 33485 [ACK] Seq=1 Ack=609 Win=6688 Len=0
66155  27.276031 117.246.95.43 -> 244.3.160.239 TCP 66 http > 33487 [SYN, ACK] Seq=0 Ack=1 Win=5840 Len=0 MSS=1460 SACK_PERM=1
66198  27.285854 117.246.95.43 -> 244.3.160.239 TCP 66 http > 33488 [SYN, ACK] Seq=0 Ack=1 Win=5840 Len=0 MSS=1460 SACK_PERM=1
66243  27.299742 117.246.95.43 -> 244.3.160.239 TCP 64 http > 33487 [ACK] Seq=1 Ack=532 Win=6432 Len=0
66244  27.300673 117.246.95.43 -> 244.3.160.239 TCP 64 http > 33485 [FIN, ACK] Seq=235 Ack=610 Win=6688 Len=0
66259  27.309479 117.246.95.43 -> 244.3.160.239 TCP 64 http > 33488 [ACK] Seq=1 Ack=533 Win=6432 Len=0
66277  27.316346 117.246.95.43 -> 244.3.160.239 TCP 66 http > 33489 [SYN, ACK] Seq=0 Ack=1 Win=5840 Len=0 MSS=1460 SACK_PERM=1
66286  27.321033 117.246.95.43 -> 244.3.160.239 TCP 64 http > 33484 [FIN, ACK] Seq=234 Ack=611 Win=6699 Len=0
66302  27.330432 117.246.95.43 -> 244.3.160.239 TCP 66 http > 33490 [SYN, ACK] Seq=0 Ack=1 Win=5840 Len=0 MSS=1460 SACK_PERM=1
66339  27.340211 117.246.95.43 -> 244.3.160.239 TCP 64 http > 33489 [ACK] Seq=1 Ack=533 Win=6432 Len=0
66360  27.345980 117.246.95.43 -> 244.3.160.239 TCP 66 http > 33491 [SYN, ACK] Seq=0 Ack=1 Win=5840 Len=0 MSS=1460 SACK_PERM=1
66372  27.354044 117.246.95.43 -> 244.3.160.239 TCP 64 http > 33490 [ACK] Seq=1 Ack=538 Win=6444 Len=0
66422  27.370384 117.246.95.43 -> 244.3.160.239 TCP 64 http > 33491 [ACK] Seq=1 Ack=537 Win=6432 Len=0
66565  27.437511 117.246.95.43 -> 244.3.160.239 TCP 64 http > 33488 [FIN, ACK] Seq=484 Ack=534 Win=6432 Len=0
66587  27.456055 117.246.95.43 -> 244.3.160.239 TCP 66 http > 33492 [SYN, ACK] Seq=0 Ack=1 Win=5840 Len=0 MSS=1460 SACK_PERM=1
66591  27.458462 117.246.95.43 -> 244.3.160.239 TCP 66 http > 33493 [SYN, ACK] Seq=0 Ack=1 Win=5840 Len=0 MSS=1460 SACK_PERM=1
66594  27.459196 117.246.95.43 -> 244.3.160.239 TCP 66 http > 33494 [SYN, ACK] Seq=0 Ack=1 Win=5840 Len=0 MSS=1460 SACK_PERM=1
66597  27.460274 117.246.95.43 -> 244.3.160.239 TCP 66 http > 33495 [SYN, ACK] Seq=0 Ack=1 Win=5840 Len=0 MSS=1460 SACK_PERM=1
66635  27.479742 117.246.95.43 -> 244.3.160.239 TCP 64 http > 33492 [ACK] Seq=1 Ack=530 Win=6432 Len=0
66650  27.482822 117.246.95.43 -> 244.3.160.239 TCP 64 http > 33493 [ACK] Seq=1 Ack=534 Win=6432 Len=0
66651  27.482826 117.246.95.43 -> 244.3.160.239 TCP 64 http > 33494 [ACK] Seq=1 Ack=535 Win=6432 Len=0
66657  27.483961 117.246.95.43 -> 244.3.160.239 TCP 64 http > 33495 [ACK] Seq=1 Ack=532 Win=6432 Len=0
66848  27.546261 117.246.95.43 -> 244.3.160.239 TCP 64 http > 33487 [FIN, ACK] Seq=2170 Ack=533 Win=6432 Len=0
66851  27.546877 117.246.95.43 -> 244.3.160.239 TCP 64 http > 33489 [FIN, ACK] Seq=406 Ack=534 Win=6432 Len=0
66853  27.547286 117.246.95.43 -> 244.3.160.239 TCP 64 http > 33491 [FIN, ACK] Seq=460 Ack=538 Win=6432 Len=0
66856  27.547699 117.246.95.43 -> 244.3.160.239 TCP 64 http > 33490 [FIN, ACK] Seq=464 Ack=539 Win=6444 Len=0
66897  27.560514 117.246.95.43 -> 244.3.160.239 TCP 66 http > 33497 [SYN, ACK] Seq=0 Ack=1 Win=5840 Len=0 MSS=1460 SACK_PERM=1
66902  27.562066 117.246.95.43 -> 244.3.160.239 TCP 66 http > 33498 [SYN, ACK] Seq=0 Ack=1 Win=5840 Len=0 MSS=1460 SACK_PERM=1
66919  27.566491 117.246.95.43 -> 244.3.160.239 TCP 66 http > 33499 [SYN, ACK] Seq=0 Ack=1 Win=5840 Len=0 MSS=1460 SACK_PERM=1
66923  27.567258 117.246.95.43 -> 244.3.160.239 TCP 66 http > 33500 [SYN, ACK] Seq=0 Ack=1 Win=5840 Len=0 MSS=1460 SACK_PERM=1
66954  27.584273 117.246.95.43 -> 244.3.160.239 TCP 64 http > 33497 [ACK] Seq=1 Ack=537 Win=6432 Len=0
66962  27.585718 117.246.95.43 -> 244.3.160.239 TCP 64 http > 33498 [ACK] Seq=1 Ack=537 Win=6432 Len=0
66984  27.590080 117.246.95.43 -> 244.3.160.239 TCP 64 http > 33499 [ACK] Seq=1 Ack=534 Win=6432 Len=0
66992  27.591175 117.246.95.43 -> 244.3.160.239 TCP 64 http > 33500 [ACK] Seq=1 Ack=544 Win=6516 Len=0
67212  27.656529 117.246.95.43 -> 244.3.160.239 TCP 64 http > 33492 [FIN, ACK] Seq=1083 Ack=531 Win=6432 Len=0
67222  27.657162 117.246.95.43 -> 244.3.160.239 TCP 64 http > 33494 [FIN, ACK] Seq=469 Ack=536 Win=6432 Len=0
67224  27.657250 117.246.95.43 -> 244.3.160.239 TCP 64 http > 33493 [FIN, ACK] Seq=464 Ack=535 Win=6432 Len=0
67229  27.657577 117.246.95.43 -> 244.3.160.239 TCP 64 http > 33495 [FIN, ACK] Seq=980 Ack=533 Win=6432 Len=0
67309  27.683669 117.246.95.43 -> 244.3.160.239 TCP 66 http > 33501 [SYN, ACK] Seq=0 Ack=1 Win=5840 Len=0 MSS=1460 SACK_PERM=1
67314  27.684510 117.246.95.43 -> 244.3.160.239 TCP 66 http > 33502 [SYN, ACK] Seq=0 Ack=1 Win=5840 Len=0 MSS=1460 SACK_PERM=1
67320  27.685862 117.246.95.43 -> 244.3.160.239 TCP 66 http > 33503 [SYN, ACK] Seq=0 Ack=1 Win=5840 Len=0 MSS=1460 SACK_PERM=1
67321  27.685887 117.246.95.43 -> 244.3.160.239 TCP 66 http > 33504 [SYN, ACK] Seq=0 Ack=1 Win=5840 Len=0 MSS=1460 SACK_PERM=1
67357  27.707293 117.246.95.43 -> 244.3.160.239 TCP 64 http > 33501 [ACK] Seq=1 Ack=536 Win=6432 Len=0
67358  27.708343 117.246.95.43 -> 244.3.160.239 TCP 64 http > 33502 [ACK] Seq=1 Ack=536 Win=6432 Len=0
67361  27.709524 117.246.95.43 -> 244.3.160.239 TCP 64 http > 33504 [ACK] Seq=1 Ack=536 Win=6432 Len=0
67364  27.709681 117.246.95.43 -> 244.3.160.239 TCP 64 http > 33503 [ACK] Seq=1 Ack=537 Win=6432 Len=0
67487  27.766344 117.246.95.43 -> 244.3.160.239 TCP 64 http > 33497 [FIN, ACK] Seq=397 Ack=538 Win=6432 Len=0
67489  27.766680 117.246.95.43 -> 244.3.160.239 TCP 64 http > 33498 [FIN, ACK] Seq=382 Ack=538 Win=6432 Len=0
67492  27.767254 117.246.95.43 -> 244.3.160.239 TCP 64 http > 33499 [FIN, ACK] Seq=1249 Ack=535 Win=6432 Len=0
67496  27.767568 117.246.95.43 -> 244.3.160.239 TCP 64 http > 33500 [FIN, ACK] Seq=456 Ack=545 Win=6516 Len=0
67504  27.783140 117.246.95.43 -> 244.3.160.239 TCP 66 http > 33505 [SYN, ACK] Seq=0 Ack=1 Win=5840 Len=0 MSS=1460 SACK_PERM=1
67512  27.788500 117.246.95.43 -> 244.3.160.239 TCP 66 http > 33506 [SYN, ACK] Seq=0 Ack=1 Win=5840 Len=0 MSS=1460 SACK_PERM=1
67515  27.790690 117.246.95.43 -> 244.3.160.239 TCP 66 http > 33507 [SYN, ACK] Seq=0 Ack=1 Win=5840 Len=0 MSS=1460 SACK_PERM=1
67519  27.791874 117.246.95.43 -> 244.3.160.239 TCP 66 http > 33508 [SYN, ACK] Seq=0 Ack=1 Win=5840 Len=0 MSS=1460 SACK_PERM=1
67537  27.806973 117.246.95.43 -> 244.3.160.239 TCP 64 http > 33505 [ACK] Seq=1 Ack=534 Win=6432 Len=0
67542  27.812596 117.246.95.43 -> 244.3.160.239 TCP 64 http > 33506 [ACK] Seq=1 Ack=536 Win=6432 Len=0
67560  27.814774 117.246.95.43 -> 244.3.160.239 TCP 64 http > 33507 [ACK] Seq=1 Ack=534 Win=6432 Len=0
67566  27.815406 117.246.95.43 -> 244.3.160.239 TCP 64 http > 33508 [ACK] Seq=1 Ack=536 Win=6432 Len=0
67650  27.838179 117.246.95.43 -> 244.3.160.239 TCP 64 http > 33501 [FIN, ACK] Seq=1635 Ack=537 Win=6432 Len=0
67652  27.838508 117.246.95.43 -> 244.3.160.239 TCP 64 http > 33502 [FIN, ACK] Seq=512 Ack=537 Win=6432 Len=0
67654  27.838753 117.246.95.43 -> 244.3.160.239 TCP 64 http > 33503 [FIN, ACK] Seq=401 Ack=538 Win=6432 Len=0
67656  27.839334 117.246.95.43 -> 244.3.160.239 TCP 64 http > 33504 [FIN, ACK] Seq=512 Ack=537 Win=6432 Len=0
67663  27.841643 117.246.95.43 -> 244.3.160.239 TCP 64 http > 33505 [FIN, ACK] Seq=1103 Ack=535 Win=6432 Len=0
67665  27.841923 117.246.95.43 -> 244.3.160.239 TCP 64 http > 33506 [FIN, ACK] Seq=1567 Ack=537 Win=6432 Len=0
67681  27.850762 117.246.95.43 -> 244.3.160.239 TCP 66 http > 33509 [SYN, ACK] Seq=0 Ack=1 Win=5840 Len=0 MSS=1460 SACK_PERM=1
67686  27.853579 117.246.95.43 -> 244.3.160.239 TCP 66 http > 33510 [SYN, ACK] Seq=0 Ack=1 Win=5840 Len=0 MSS=1460 SACK_PERM=1
67702  27.866881 117.246.95.43 -> 244.3.160.239 TCP 66 http > 33511 [SYN, ACK] Seq=0 Ack=1 Win=5840 Len=0 MSS=1460 SACK_PERM=1
67705  27.867585 117.246.95.43 -> 244.3.160.239 TCP 66 http > 33512 [SYN, ACK] Seq=0 Ack=1 Win=5840 Len=0 MSS=1460 SACK_PERM=1
67723  27.874410 117.246.95.43 -> 244.3.160.239 TCP 64 http > 33509 [ACK] Seq=1 Ack=538 Win=6444 Len=0
67730  27.877319 117.246.95.43 -> 244.3.160.239 TCP 64 http > 33510 [ACK] Seq=1 Ack=532 Win=6432 Len=0
67769  27.890628 117.246.95.43 -> 244.3.160.239 TCP 64 http > 33511 [ACK] Seq=1 Ack=533 Win=6432 Len=0
67772  27.891316 117.246.95.43 -> 244.3.160.239 TCP 64 http > 33512 [ACK] Seq=1 Ack=538 Win=6444 Len=0
67929  27.946467 117.246.95.43 -> 244.3.160.239 TCP 64 http > 33507 [FIN, ACK] Seq=1121 Ack=535 Win=6432 Len=0
67932  27.946613 117.246.95.43 -> 244.3.160.239 TCP 64 http > 33508 [FIN, ACK] Seq=2471 Ack=537 Win=6432 Len=0
67988  27.967394 117.246.95.43 -> 244.3.160.239 TCP 66 http > 33513 [SYN, ACK] Seq=0 Ack=1 Win=5840 Len=0 MSS=1460 SACK_PERM=1
67991  27.967780 117.246.95.43 -> 244.3.160.239 TCP 66 http > 33514 [SYN, ACK] Seq=0 Ack=1 Win=5840 Len=0 MSS=1460 SACK_PERM=1
68030  27.991398 117.246.95.43 -> 244.3.160.239 TCP 64 http > 33513 [ACK] Seq=1 Ack=613 Win=6732 Len=0
68031  27.991808 117.246.95.43 -> 244.3.160.239 TCP 64 http > 33514 [ACK] Seq=1 Ack=614 Win=6743 Len=0
68079  28.016517 117.246.95.43 -> 244.3.160.239 TCP 64 http > 33513 [FIN, ACK] Seq=234 Ack=614 Win=6732 Len=0
68084  28.017756 117.246.95.43 -> 244.3.160.239 TCP 64 http > 33514 [FIN, ACK] Seq=234 Ack=615 Win=6743 Len=0
68141  28.056447 117.246.95.43 -> 244.3.160.239 TCP 64 http > 33509 [FIN, ACK] Seq=3047 Ack=539 Win=6444 Len=0
68146  28.056903 117.246.95.43 -> 244.3.160.239 TCP 64 http > 33510 [FIN, ACK] Seq=538 Ack=533 Win=6432 Len=0
68153  28.057123 117.246.95.43 -> 244.3.160.239 TCP 64 http > 33512 [FIN, ACK] Seq=3047 Ack=539 Win=6444 Len=0
68172  28.059401 117.246.95.43 -> 244.3.160.239 TCP 64 http > 33511 [FIN, ACK] Seq=1119 Ack=534 Win=6432 Len=0
69315  28.769235 117.246.95.43 -> 244.3.160.239 TCP 76 [TCP segment of a reassembled PDU]
69515  28.832690 117.246.95.43 -> 244.3.160.239 TCP 66 http > 33516 [SYN, ACK] Seq=0 Ack=1 Win=5840 Len=0 MSS=1460 SACK_PERM=1
69518  28.833514 117.246.95.43 -> 244.3.160.239 TCP 66 http > 33517 [SYN, ACK] Seq=0 Ack=1 Win=5840 Len=0 MSS=1460 SACK_PERM=1
69625  28.856416 117.246.95.43 -> 244.3.160.239 TCP 64 http > 33516 [ACK] Seq=1 Ack=542 Win=6492 Len=0
69631  28.857495 117.246.95.43 -> 244.3.160.239 TCP 64 http > 33517 [ACK] Seq=1 Ack=542 Win=6492 Len=0
70224  29.086170 117.246.95.43 -> 244.3.160.239 TCP 64 http > 33516 [FIN, ACK] Seq=1275 Ack=543 Win=6492 Len=0
70228  29.086763 117.246.95.43 -> 244.3.160.239 TCP 64 http > 33517 [FIN, ACK] Seq=1275 Ack=543 Win=6492 Len=0
80242  31.605473 117.246.95.43 -> 244.3.160.239 TCP 70 [TCP segment of a reassembled PDU]
80446  31.632812 117.246.95.43 -> 244.3.160.239 TCP 64 http > 33452 [FIN, ACK] Seq=96690 Ack=743 Win=6669 Len=0
80986  31.737719 117.246.95.43 -> 244.3.160.239 TCP 66 http > 33529 [SYN, ACK] Seq=0 Ack=1 Win=5840 Len=0 MSS=1460 SACK_PERM=1
80988  31.738128 117.246.95.43 -> 244.3.160.239 TCP 66 http > 33530 [SYN, ACK] Seq=0 Ack=1 Win=5840 Len=0 MSS=1460 SACK_PERM=1
80989  31.738133 117.246.95.43 -> 244.3.160.239 TCP 66 http > 33531 [SYN, ACK] Seq=0 Ack=1 Win=5840 Len=0 MSS=1460 SACK_PERM=1
80995  31.739165 117.246.95.43 -> 244.3.160.239 TCP 66 http > 33532 [SYN, ACK] Seq=0 Ack=1 Win=5840 Len=0 MSS=1460 SACK_PERM=1
81068  31.761651 117.246.95.43 -> 244.3.160.239 TCP 64 http > 33529 [ACK] Seq=1 Ack=534 Win=6432 Len=0
81070  31.761937 117.246.95.43 -> 244.3.160.239 TCP 64 http > 33530 [ACK] Seq=1 Ack=534 Win=6432 Len=0
81071  31.761942 117.246.95.43 -> 244.3.160.239 TCP 64 http > 33531 [ACK] Seq=1 Ack=535 Win=6432 Len=0
81080  31.762906 117.246.95.43 -> 244.3.160.239 TCP 64 http > 33532 [ACK] Seq=1 Ack=535 Win=6432 Len=0
81100  31.769435 117.246.95.43 -> 244.3.160.239 TCP 66 http > 33533 [SYN, ACK] Seq=0 Ack=1 Win=5840 Len=0 MSS=1460 SACK_PERM=1
81197  31.793265 117.246.95.43 -> 244.3.160.239 TCP 64 http > 33533 [ACK] Seq=1 Ack=673 Win=6720 Len=0
81198  31.793270 117.246.95.43 -> 244.3.160.239 TCP 64 http > 33533 [ACK] Seq=1 Ack=943 Win=8064 Len=0
81679  31.891444 117.246.95.43 -> 244.3.160.239 TCP 64 http > 33531 [FIN, ACK] Seq=520 Ack=536 Win=6432 Len=0
81680  31.891448 117.246.95.43 -> 244.3.160.239 TCP 64 http > 33529 [FIN, ACK] Seq=1237 Ack=535 Win=6432 Len=0
81683  31.891621 117.246.95.43 -> 244.3.160.239 TCP 64 http > 33530 [FIN, ACK] Seq=1237 Ack=535 Win=6432 Len=0
81685  31.892452 117.246.95.43 -> 244.3.160.239 TCP 64 http > 33532 [FIN, ACK] Seq=520 Ack=536 Win=6432 Len=0
81719  31.902164 117.246.95.43 -> 244.3.160.239 TCP 64 http > 33533 [FIN, ACK] Seq=384 Ack=944 Win=8064 Len=0
81799  31.920747 117.246.95.43 -> 244.3.160.239 TCP 66 http > 33538 [SYN, ACK] Seq=0 Ack=1 Win=5840 Len=0 MSS=1460 SACK_PERM=1
81803  31.921153 117.246.95.43 -> 244.3.160.239 TCP 66 http > 33539 [SYN, ACK] Seq=0 Ack=1 Win=5840 Len=0 MSS=1460 SACK_PERM=1
81913  31.944437 117.246.95.43 -> 244.3.160.239 TCP 64 http > 33538 [ACK] Seq=1 Ack=534 Win=6432 Len=0
81916  31.945097 117.246.95.43 -> 244.3.160.239 TCP 64 http > 33539 [ACK] Seq=1 Ack=534 Win=6432 Len=0
82340  32.091435 117.246.95.43 -> 244.3.160.239 TCP 66 http > 33541 [SYN, ACK] Seq=0 Ack=1 Win=5840 Len=0 MSS=1460 SACK_PERM=1
82395  32.115362 117.246.95.43 -> 244.3.160.239 TCP 64 http > 33541 [ACK] Seq=1 Ack=637 Win=6996 Len=0
82618  32.176377 117.246.95.43 -> 244.3.160.239 TCP 64 http > 33538 [FIN, ACK] Seq=418 Ack=535 Win=6432 Len=0
82620  32.176648 117.246.95.43 -> 244.3.160.239 TCP 64 http > 33539 [FIN, ACK] Seq=418 Ack=535 Win=6432 Len=0
82852  32.239587 117.246.95.43 -> 244.3.160.239 TCP 64 http > 33541 [FIN, ACK] Seq=291 Ack=638 Win=6996 Len=0
112683  40.151374 117.246.95.43 -> 244.3.160.239 TCP 66 http > 33625 [SYN, ACK] Seq=0 Ack=1 Win=5840 Len=0 MSS=1460 SACK_PERM=1
112828  40.174981 117.246.95.43 -> 244.3.160.239 TCP 64 http > 33625 [ACK] Seq=1 Ack=539 Win=6456 Len=0
113645  40.416405 117.246.95.43 -> 244.3.160.239 TCP 64 http > 33625 [FIN, ACK] Seq=551 Ack=540 Win=6456 Len=0
119211  42.754126 117.246.95.43 -> 244.3.160.239 TCP 66 http > 33626 [SYN, ACK] Seq=0 Ack=1 Win=5840 Len=0 MSS=1460 SACK_PERM=1
119322  42.780383 117.246.95.43 -> 244.3.160.239 TCP 64 http > 33626 [ACK] Seq=1 Ack=673 Win=6720 Len=0
120593  43.023018 117.246.95.43 -> 244.3.160.239 TCP 64 http > 33626 [FIN, ACK] Seq=62435 Ack=674 Win=6720 Len=0
120781  43.067701 117.246.95.43 -> 244.3.160.239 TCP 66 http > 33628 [SYN, ACK] Seq=0 Ack=1 Win=5840 Len=0 MSS=1460 SACK_PERM=1
120782  43.067706 117.246.95.43 -> 244.3.160.239 TCP 66 http > 33627 [SYN, ACK] Seq=0 Ack=1 Win=5840 Len=0 MSS=1460 SACK_PERM=1
120850  43.091425 117.246.95.43 -> 244.3.160.239 TCP 64 http > 33628 [ACK] Seq=1 Ack=627 Win=6886 Len=0
120851  43.091429 117.246.95.43 -> 244.3.160.239 TCP 64 http > 33627 [ACK] Seq=1 Ack=662 Win=6610 Len=0
121165  43.202941 117.246.95.43 -> 244.3.160.239 TCP 64 http > 33628 [FIN, ACK] Seq=449 Ack=628 Win=6886 Len=0
121196  43.214127 117.246.95.43 -> 244.3.160.239 TCP 64 http > 33627 [FIN, ACK] Seq=291 Ack=663 Win=6610 Len=0
160820  54.737630 117.246.95.43 -> 244.3.160.239 TCP 66 http > 33677 [SYN, ACK] Seq=0 Ack=1 Win=5840 Len=0 MSS=1460 SACK_PERM=1
160897  54.761311 117.246.95.43 -> 244.3.160.239 TCP 64 http > 33677 [ACK] Seq=1 Ack=754 Win=6777 Len=0
160901  54.761620 117.246.95.43 -> 244.3.160.239 TCP 64 http > 33677 [ACK] Seq=1 Ack=2214 Win=10220 Len=0
160902  54.761650 117.246.95.43 -> 244.3.160.239 TCP 64 http > 33677 [ACK] Seq=1 Ack=2323 Win=10220 Len=0
163382  55.410338 117.246.95.43 -> 244.3.160.239 TCP 64 http > 33677 [FIN, ACK] Seq=469 Ack=2324 Win=10220 Len=0
163398  55.419170 117.246.95.43 -> 244.3.160.239 TCP 66 http > 33682 [SYN, ACK] Seq=0 Ack=1 Win=5840 Len=0 MSS=1460 SACK_PERM=1
163484  55.442879 117.246.95.43 -> 244.3.160.239 TCP 64 http > 33682 [ACK] Seq=1 Ack=742 Win=6669 Len=0
165333  55.849664 117.246.95.43 -> 244.3.160.239 TCP 66 http > 33685 [SYN, ACK] Seq=0 Ack=1 Win=5840 Len=0 MSS=1460 SACK_PERM=1
165339  55.850004 117.246.95.43 -> 244.3.160.239 TCP 66 http > 33686 [SYN, ACK] Seq=0 Ack=1 Win=5840 Len=0 MSS=1460 SACK_PERM=1
165348  55.850723 117.246.95.43 -> 244.3.160.239 TCP 66 http > 33687 [SYN, ACK] Seq=0 Ack=1 Win=5840 Len=0 MSS=1460 SACK_PERM=1
165353  55.851085 117.246.95.43 -> 244.3.160.239 TCP 66 http > 33688 [SYN, ACK] Seq=0 Ack=1 Win=5840 Len=0 MSS=1460 SACK_PERM=1
165493  55.873733 117.246.95.43 -> 244.3.160.239 TCP 64 http > 33685 [ACK] Seq=1 Ack=623 Win=6842 Len=0
165496  55.874007 117.246.95.43 -> 244.3.160.239 TCP 64 http > 33686 [ACK] Seq=1 Ack=610 Win=6699 Len=0
165507  55.874732 117.246.95.43 -> 244.3.160.239 TCP 64 http > 33687 [ACK] Seq=1 Ack=615 Win=6754 Len=0
165508  55.875142 117.246.95.43 -> 244.3.160.239 TCP 64 http > 33688 [ACK] Seq=1 Ack=623 Win=6842 Len=0
165698  55.901415 117.246.95.43 -> 244.3.160.239 TCP 64 http > 33688 [FIN, ACK] Seq=233 Ack=624 Win=6842 Len=0
165699  55.901517 117.246.95.43 -> 244.3.160.239 TCP 64 http > 33686 [FIN, ACK] Seq=247 Ack=611 Win=6699 Len=0
165707  55.902191 117.246.95.43 -> 244.3.160.239 TCP 64 http > 33685 [FIN, ACK] Seq=233 Ack=624 Win=6842 Len=0
165711  55.902346 117.246.95.43 -> 244.3.160.239 TCP 64 http > 33687 [FIN, ACK] Seq=247 Ack=616 Win=6754 Len=0
165804  55.916878 117.246.95.43 -> 244.3.160.239 TCP 66 http > 33691 [SYN, ACK] Seq=0 Ack=1 Win=5840 Len=0 MSS=1460 SACK_PERM=1
165850  55.926511 117.246.95.43 -> 244.3.160.239 TCP 66 http > 33692 [SYN, ACK] Seq=0 Ack=1 Win=5840 Len=0 MSS=1460 SACK_PERM=1
165853  55.927716 117.246.95.43 -> 244.3.160.239 TCP 66 http > 33693 [SYN, ACK] Seq=0 Ack=1 Win=5840 Len=0 MSS=1460 SACK_PERM=1
165856  55.928017 117.246.95.43 -> 244.3.160.239 TCP 66 http > 33694 [SYN, ACK] Seq=0 Ack=1 Win=5840 Len=0 MSS=1460 SACK_PERM=1
165929  55.941207 117.246.95.43 -> 244.3.160.239 TCP 64 http > 33691 [ACK] Seq=1 Ack=613 Win=6732 Len=0
166017  55.950404 117.246.95.43 -> 244.3.160.239 TCP 64 http > 33692 [ACK] Seq=1 Ack=613 Win=6732 Len=0
166023  55.951603 117.246.95.43 -> 244.3.160.239 TCP 64 http > 33693 [ACK] Seq=1 Ack=616 Win=6765 Len=0
166025  55.951858 117.246.95.43 -> 244.3.160.239 TCP 64 http > 33694 [ACK] Seq=1 Ack=613 Win=6732 Len=0
166127  55.967748 117.246.95.43 -> 244.3.160.239 TCP 64 http > 33691 [FIN, ACK] Seq=247 Ack=614 Win=6732 Len=0
166203  55.975555 117.246.95.43 -> 244.3.160.239 TCP 64 http > 33692 [FIN, ACK] Seq=247 Ack=614 Win=6732 Len=0
166213  55.977402 117.246.95.43 -> 244.3.160.239 TCP 64 http > 33693 [FIN, ACK] Seq=247 Ack=617 Win=6765 Len=0
166216  55.977844 117.246.95.43 -> 244.3.160.239 TCP 64 http > 33694 [FIN, ACK] Seq=247 Ack=614 Win=6732 Len=0
166229  55.982835 117.246.95.43 -> 244.3.160.239 TCP 66 http > 33696 [SYN, ACK] Seq=0 Ack=1 Win=5840 Len=0 MSS=1460 SACK_PERM=1
166240  55.985308 117.246.95.43 -> 244.3.160.239 TCP 66 http > 33697 [SYN, ACK] Seq=0 Ack=1 Win=5840 Len=0 MSS=1460 SACK_PERM=1
166412  56.007699 117.246.95.43 -> 244.3.160.239 TCP 64 http > 33696 [ACK] Seq=1 Ack=609 Win=6688 Len=0
166429  56.009439 117.246.95.43 -> 244.3.160.239 TCP 64 http > 33697 [ACK] Seq=1 Ack=610 Win=6699 Len=0
166606  56.032345 117.246.95.43 -> 244.3.160.239 TCP 64 http > 33696 [FIN, ACK] Seq=247 Ack=610 Win=6688 Len=0
166620  56.034735 117.246.95.43 -> 244.3.160.239 TCP 64 http > 33697 [FIN, ACK] Seq=247 Ack=611 Win=6699 Len=0
166932  56.073128 117.246.95.43 -> 244.3.160.239 TCP 66 http > 33698 [SYN, ACK] Seq=0 Ack=1 Win=5840 Len=0 MSS=1460 SACK_PERM=1
166945  56.074715 117.246.95.43 -> 244.3.160.239 TCP 66 http > 33699 [SYN, ACK] Seq=0 Ack=1 Win=5840 Len=0 MSS=1460 SACK_PERM=1
166946  56.074798 117.246.95.43 -> 244.3.160.239 TCP 66 http > 33700 [SYN, ACK] Seq=0 Ack=1 Win=5840 Len=0 MSS=1460 SACK_PERM=1
166958  56.076496 117.246.95.43 -> 244.3.160.239 TCP 66 http > 33701 [SYN, ACK] Seq=0 Ack=1 Win=5840 Len=0 MSS=1460 SACK_PERM=1
167082  56.097185 117.246.95.43 -> 244.3.160.239 TCP 64 http > 33698 [ACK] Seq=1 Ack=617 Win=6776 Len=0
167101  56.098757 117.246.95.43 -> 244.3.160.239 TCP 64 http > 33699 [ACK] Seq=1 Ack=607 Win=6666 Len=0
167102  56.098892 117.246.95.43 -> 244.3.160.239 TCP 64 http > 33700 [ACK] Seq=1 Ack=621 Win=6820 Len=0
167116  56.100292 117.246.95.43 -> 244.3.160.239 TCP 64 http > 33701 [ACK] Seq=1 Ack=608 Win=6677 Len=0
167261  56.122217 117.246.95.43 -> 244.3.160.239 TCP 64 http > 33698 [FIN, ACK] Seq=234 Ack=618 Win=6776 Len=0
167284  56.124234 117.246.95.43 -> 244.3.160.239 TCP 64 http > 33699 [FIN, ACK] Seq=234 Ack=608 Win=6666 Len=0
167288  56.124670 117.246.95.43 -> 244.3.160.239 TCP 64 http > 33700 [FIN, ACK] Seq=234 Ack=622 Win=6820 Len=0
167293  56.125280 117.246.95.43 -> 244.3.160.239 TCP 64 http > 33701 [FIN, ACK] Seq=234 Ack=609 Win=6677 Len=0
167345  56.134033 117.246.95.43 -> 244.3.160.239 TCP 66 http > 33702 [SYN, ACK] Seq=0 Ack=1 Win=5840 Len=0 MSS=1460 SACK_PERM=1
167475  56.149255 117.246.95.43 -> 244.3.160.239 TCP 66 http > 33703 [SYN, ACK] Seq=0 Ack=1 Win=5840 Len=0 MSS=1460 SACK_PERM=1
167501  56.155311 117.246.95.43 -> 244.3.160.239 TCP 66 http > 33704 [SYN, ACK] Seq=0 Ack=1 Win=5840 Len=0 MSS=1460 SACK_PERM=1
167503  56.155871 117.246.95.43 -> 244.3.160.239 TCP 66 http > 33705 [SYN, ACK] Seq=0 Ack=1 Win=5840 Len=0 MSS=1460 SACK_PERM=1
167508  56.157877 117.246.95.43 -> 244.3.160.239 TCP 64 http > 33702 [ACK] Seq=1 Ack=611 Win=6710 Len=0
167599  56.173093 117.246.95.43 -> 244.3.160.239 TCP 64 http > 33703 [ACK] Seq=1 Ack=606 Win=6655 Len=0
167646  56.179508 117.246.95.43 -> 244.3.160.239 TCP 64 http > 33704 [ACK] Seq=1 Ack=610 Win=6699 Len=0
167648  56.179625 117.246.95.43 -> 244.3.160.239 TCP 64 http > 33705 [ACK] Seq=1 Ack=605 Win=6644 Len=0
167677  56.182794 117.246.95.43 -> 244.3.160.239 TCP 64 http > 33702 [FIN, ACK] Seq=234 Ack=612 Win=6710 Len=0
167781  56.198149 117.246.95.43 -> 244.3.160.239 TCP 64 http > 33703 [FIN, ACK] Seq=234 Ack=607 Win=6655 Len=0
167797  56.199376 117.246.95.43 -> 244.3.160.239 TCP 66 http > 33706 [SYN, ACK] Seq=0 Ack=1 Win=5840 Len=0 MSS=1460 SACK_PERM=1
167823  56.204914 117.246.95.43 -> 244.3.160.239 TCP 64 http > 33704 [FIN, ACK] Seq=234 Ack=611 Win=6699 Len=0
167830  56.205599 117.246.95.43 -> 244.3.160.239 TCP 64 http > 33705 [FIN, ACK] Seq=234 Ack=606 Win=6644 Len=0
167831  56.205761 117.246.95.43 -> 244.3.160.239 TCP 66 http > 33707 [SYN, ACK] Seq=0 Ack=1 Win=5840 Len=0 MSS=1460 SACK_PERM=1
167848  56.212332 117.246.95.43 -> 244.3.160.239 TCP 66 http > 33708 [SYN, ACK] Seq=0 Ack=1 Win=5840 Len=0 MSS=1460 SACK_PERM=1
167857  56.214526 117.246.95.43 -> 244.3.160.239 TCP 66 http > 33709 [SYN, ACK] Seq=0 Ack=1 Win=5840 Len=0 MSS=1460 SACK_PERM=1
167937  56.223496 117.246.95.43 -> 244.3.160.239 TCP 64 http > 33706 [ACK] Seq=1 Ack=607 Win=6666 Len=0
167990  56.229716 117.246.95.43 -> 244.3.160.239 TCP 64 http > 33707 [ACK] Seq=1 Ack=612 Win=6721 Len=0
168017  56.236398 117.246.95.43 -> 244.3.160.239 TCP 64 http > 33708 [ACK] Seq=1 Ack=615 Win=6754 Len=0
168034  56.238495 117.246.95.43 -> 244.3.160.239 TCP 64 http > 33709 [ACK] Seq=1 Ack=613 Win=6732 Len=0
168117  56.248625 117.246.95.43 -> 244.3.160.239 TCP 64 http > 33706 [FIN, ACK] Seq=234 Ack=608 Win=6666 Len=0
168166  56.254485 117.246.95.43 -> 244.3.160.239 TCP 64 http > 33707 [FIN, ACK] Seq=234 Ack=613 Win=6721 Len=0
168195  56.261252 117.246.95.43 -> 244.3.160.239 TCP 64 http > 33708 [FIN, ACK] Seq=234 Ack=616 Win=6754 Len=0
168208  56.263433 117.246.95.43 -> 244.3.160.239 TCP 64 http > 33709 [FIN, ACK] Seq=234 Ack=614 Win=6732 Len=0
168329  56.285007 117.246.95.43 -> 244.3.160.239 TCP 66 http > 33710 [SYN, ACK] Seq=0 Ack=1 Win=5840 Len=0 MSS=1460 SACK_PERM=1
168333  56.285826 117.246.95.43 -> 244.3.160.239 TCP 66 http > 33711 [SYN, ACK] Seq=0 Ack=1 Win=5840 Len=0 MSS=1460 SACK_PERM=1
168348  56.288578 117.246.95.43 -> 244.3.160.239 TCP 66 http > 33712 [SYN, ACK] Seq=0 Ack=1 Win=5840 Len=0 MSS=1460 SACK_PERM=1
168360  56.289690 117.246.95.43 -> 244.3.160.239 TCP 66 http > 33713 [SYN, ACK] Seq=0 Ack=1 Win=5840 Len=0 MSS=1460 SACK_PERM=1
168439  56.309147 117.246.95.43 -> 244.3.160.239 TCP 64 http > 33710 [ACK] Seq=1 Ack=611 Win=6710 Len=0
168442  56.309718 117.246.95.43 -> 244.3.160.239 TCP 64 http > 33711 [ACK] Seq=1 Ack=618 Win=6787 Len=0
168464  56.312602 117.246.95.43 -> 244.3.160.239 TCP 64 http > 33712 [ACK] Seq=1 Ack=617 Win=6776 Len=0
168478  56.313510 117.246.95.43 -> 244.3.160.239 TCP 64 http > 33713 [ACK] Seq=1 Ack=617 Win=6776 Len=0
168654  56.334423 117.246.95.43 -> 244.3.160.239 TCP 64 http > 33710 [FIN, ACK] Seq=234 Ack=612 Win=6710 Len=0
168661  56.335121 117.246.95.43 -> 244.3.160.239 TCP 64 http > 33711 [FIN, ACK] Seq=234 Ack=619 Win=6787 Len=0
168669  56.338029 117.246.95.43 -> 244.3.160.239 TCP 64 http > 33712 [FIN, ACK] Seq=234 Ack=618 Win=6776 Len=0
168671  56.338302 117.246.95.43 -> 244.3.160.239 TCP 64 http > 33713 [FIN, ACK] Seq=234 Ack=618 Win=6776 Len=0
168756  56.350095 117.246.95.43 -> 244.3.160.239 TCP 66 http > 33714 [SYN, ACK] Seq=0 Ack=1 Win=5840 Len=0 MSS=1460 SACK_PERM=1
168776  56.351691 117.246.95.43 -> 244.3.160.239 TCP 66 http > 33715 [SYN, ACK] Seq=0 Ack=1 Win=5840 Len=0 MSS=1460 SACK_PERM=1
168795  56.352783 117.246.95.43 -> 244.3.160.239 TCP 66 http > 33716 [SYN, ACK] Seq=0 Ack=1 Win=5840 Len=0 MSS=1460 SACK_PERM=1
168796  56.352787 117.246.95.43 -> 244.3.160.239 TCP 66 http > 33717 [SYN, ACK] Seq=0 Ack=1 Win=5840 Len=0 MSS=1460 SACK_PERM=1
168887  56.374372 117.246.95.43 -> 244.3.160.239 TCP 64 http > 33714 [ACK] Seq=1 Ack=610 Win=6699 Len=0
168892  56.375710 117.246.95.43 -> 244.3.160.239 TCP 64 http > 33715 [ACK] Seq=1 Ack=610 Win=6699 Len=0
168905  56.376995 117.246.95.43 -> 244.3.160.239 TCP 64 http > 33717 [ACK] Seq=1 Ack=610 Win=6699 Len=0
168907  56.377048 117.246.95.43 -> 244.3.160.239 TCP 64 http > 33716 [ACK] Seq=1 Ack=609 Win=6688 Len=0
169069  56.400707 117.246.95.43 -> 244.3.160.239 TCP 64 http > 33715 [FIN, ACK] Seq=234 Ack=611 Win=6699 Len=0
169078  56.401336 117.246.95.43 -> 244.3.160.239 TCP 64 http > 33714 [FIN, ACK] Seq=234 Ack=611 Win=6699 Len=0
169092  56.402315 117.246.95.43 -> 244.3.160.239 TCP 64 http > 33717 [FIN, ACK] Seq=234 Ack=611 Win=6699 Len=0
169136  56.410417 117.246.95.43 -> 244.3.160.239 TCP 64 http > 33716 [FIN, ACK] Seq=235 Ack=610 Win=6688 Len=0
169215  56.427457 117.246.95.43 -> 244.3.160.239 TCP 66 http > 33718 [SYN, ACK] Seq=0 Ack=1 Win=5840 Len=0 MSS=1460 SACK_PERM=1
169234  56.429309 117.246.95.43 -> 244.3.160.239 TCP 66 http > 33719 [SYN, ACK] Seq=0 Ack=1 Win=5840 Len=0 MSS=1460 SACK_PERM=1
169276  56.438891 117.246.95.43 -> 244.3.160.239 TCP 66 http > 33720 [SYN, ACK] Seq=0 Ack=1 Win=5840 Len=0 MSS=1460 SACK_PERM=1
169278  56.439266 117.246.95.43 -> 244.3.160.239 TCP 66 http > 33721 [SYN, ACK] Seq=0 Ack=1 Win=5840 Len=0 MSS=1460 SACK_PERM=1
169310  56.451475 117.246.95.43 -> 244.3.160.239 TCP 64 http > 33718 [ACK] Seq=1 Ack=609 Win=6688 Len=0
169336  56.453641 117.246.95.43 -> 244.3.160.239 TCP 64 http > 33719 [ACK] Seq=1 Ack=608 Win=6677 Len=0
169402  56.463040 117.246.95.43 -> 244.3.160.239 TCP 64 http > 33720 [ACK] Seq=1 Ack=609 Win=6688 Len=0
169403  56.463044 117.246.95.43 -> 244.3.160.239 TCP 64 http > 33721 [ACK] Seq=1 Ack=614 Win=6743 Len=0
169457  56.476818 117.246.95.43 -> 244.3.160.239 TCP 64 http > 33718 [FIN, ACK] Seq=234 Ack=610 Win=6688 Len=0
169467  56.478336 117.246.95.43 -> 244.3.160.239 TCP 64 http > 33719 [FIN, ACK] Seq=234 Ack=609 Win=6677 Len=0
169519  56.485087 117.246.95.43 -> 244.3.160.239 TCP 66 http > 33722 [SYN, ACK] Seq=0 Ack=1 Win=5840 Len=0 MSS=1460 SACK_PERM=1
169529  56.486421 117.246.95.43 -> 244.3.160.239 TCP 66 http > 33723 [SYN, ACK] Seq=0 Ack=1 Win=5840 Len=0 MSS=1460 SACK_PERM=1
169534  56.488868 117.246.95.43 -> 244.3.160.239 TCP 64 http > 33721 [FIN, ACK] Seq=234 Ack=615 Win=6743 Len=0
169543  56.490754 117.246.95.43 -> 244.3.160.239 TCP 64 http > 33720 [FIN, ACK] Seq=234 Ack=610 Win=6688 Len=0
169572  56.497846 117.246.95.43 -> 244.3.160.239 TCP 66 http > 33724 [SYN, ACK] Seq=0 Ack=1 Win=5840 Len=0 MSS=1460 SACK_PERM=1
169630  56.503243 117.246.95.43 -> 244.3.160.239 TCP 66 http > 33725 [SYN, ACK] Seq=0 Ack=1 Win=5840 Len=0 MSS=1460 SACK_PERM=1
169657  56.509059 117.246.95.43 -> 244.3.160.239 TCP 64 http > 33722 [ACK] Seq=1 Ack=613 Win=6732 Len=0
169664  56.510394 117.246.95.43 -> 244.3.160.239 TCP 64 http > 33723 [ACK] Seq=1 Ack=606 Win=6655 Len=0
169732  56.521878 117.246.95.43 -> 244.3.160.239 TCP 64 http > 33724 [ACK] Seq=1 Ack=610 Win=6699 Len=0
169743  56.526926 117.246.95.43 -> 244.3.160.239 TCP 64 http > 33725 [ACK] Seq=1 Ack=611 Win=6710 Len=0
169767  56.533786 117.246.95.43 -> 244.3.160.239 TCP 64 http > 33722 [FIN, ACK] Seq=234 Ack=614 Win=6732 Len=0
169773  56.535452 117.246.95.43 -> 244.3.160.239 TCP 64 http > 33723 [FIN, ACK] Seq=234 Ack=607 Win=6655 Len=0
169795  56.541586 117.246.95.43 -> 244.3.160.239 TCP 66 http > 33726 [SYN, ACK] Seq=0 Ack=1 Win=5840 Len=0 MSS=1460 SACK_PERM=1
169807  56.546279 117.246.95.43 -> 244.3.160.239 TCP 66 http > 33727 [SYN, ACK] Seq=0 Ack=1 Win=5840 Len=0 MSS=1460 SACK_PERM=1
169812  56.547010 117.246.95.43 -> 244.3.160.239 TCP 64 http > 33724 [FIN, ACK] Seq=234 Ack=611 Win=6699 Len=0
169825  56.552104 117.246.95.43 -> 244.3.160.239 TCP 64 http > 33725 [FIN, ACK] Seq=234 Ack=612 Win=6710 Len=0
169837  56.554404 117.246.95.43 -> 244.3.160.239 TCP 66 http > 33728 [SYN, ACK] Seq=0 Ack=1 Win=5840 Len=0 MSS=1460 SACK_PERM=1
169848  56.558710 117.246.95.43 -> 244.3.160.239 TCP 66 http > 33729 [SYN, ACK] Seq=0 Ack=1 Win=5840 Len=0 MSS=1460 SACK_PERM=1
169864  56.565516 117.246.95.43 -> 244.3.160.239 TCP 64 http > 33726 [ACK] Seq=1 Ack=608 Win=6677 Len=0
169891  56.570510 117.246.95.43 -> 244.3.160.239 TCP 64 http > 33727 [ACK] Seq=1 Ack=613 Win=6732 Len=0
169927  56.578219 117.246.95.43 -> 244.3.160.239 TCP 64 http > 33728 [ACK] Seq=1 Ack=613 Win=6732 Len=0
169958  56.582731 117.246.95.43 -> 244.3.160.239 TCP 64 http > 33729 [ACK] Seq=1 Ack=620 Win=6809 Len=0
170000  56.590325 117.246.95.43 -> 244.3.160.239 TCP 64 http > 33726 [FIN, ACK] Seq=234 Ack=609 Win=6677 Len=0
170032  56.595468 117.246.95.43 -> 244.3.160.239 TCP 64 http > 33727 [FIN, ACK] Seq=234 Ack=614 Win=6732 Len=0
170070  56.602489 117.246.95.43 -> 244.3.160.239 TCP 66 http > 33731 [SYN, ACK] Seq=0 Ack=1 Win=5840 Len=0 MSS=1460 SACK_PERM=1
170073  56.603344 117.246.95.43 -> 244.3.160.239 TCP 64 http > 33728 [FIN, ACK] Seq=234 Ack=614 Win=6732 Len=0
170094  56.605376 117.246.95.43 -> 244.3.160.239 TCP 66 http > 33732 [SYN, ACK] Seq=0 Ack=1 Win=5840 Len=0 MSS=1460 SACK_PERM=1
170103  56.608292 117.246.95.43 -> 244.3.160.239 TCP 64 http > 33729 [FIN, ACK] Seq=234 Ack=621 Win=6809 Len=0
170113  56.615187 117.246.95.43 -> 244.3.160.239 TCP 66 http > 33733 [SYN, ACK] Seq=0 Ack=1 Win=5840 Len=0 MSS=1460 SACK_PERM=1
170118  56.617805 117.246.95.43 -> 244.3.160.239 TCP 66 http > 33734 [SYN, ACK] Seq=0 Ack=1 Win=5840 Len=0 MSS=1460 SACK_PERM=1
170147  56.626513 117.246.95.43 -> 244.3.160.239 TCP 64 http > 33731 [ACK] Seq=1 Ack=610 Win=6699 Len=0
170166  56.629422 117.246.95.43 -> 244.3.160.239 TCP 64 http > 33732 [ACK] Seq=1 Ack=612 Win=6721 Len=0
170204  56.639164 117.246.95.43 -> 244.3.160.239 TCP 64 http > 33733 [ACK] Seq=1 Ack=612 Win=6721 Len=0
170231  56.641944 117.246.95.43 -> 244.3.160.239 TCP 64 http > 33734 [ACK] Seq=1 Ack=613 Win=6732 Len=0
170272  56.651375 117.246.95.43 -> 244.3.160.239 TCP 64 http > 33731 [FIN, ACK] Seq=234 Ack=611 Win=6699 Len=0
170323  56.656432 117.246.95.43 -> 244.3.160.239 TCP 64 http > 33732 [FIN, ACK] Seq=234 Ack=613 Win=6721 Len=0
170353  56.663526 117.246.95.43 -> 244.3.160.239 TCP 66 http > 33735 [SYN, ACK] Seq=0 Ack=1 Win=5840 Len=0 MSS=1460 SACK_PERM=1
170359  56.664013 117.246.95.43 -> 244.3.160.239 TCP 64 http > 33733 [FIN, ACK] Seq=234 Ack=613 Win=6721 Len=0
170373  56.667846 117.246.95.43 -> 244.3.160.239 TCP 64 http > 33734 [FIN, ACK] Seq=234 Ack=614 Win=6732 Len=0
170375  56.668254 117.246.95.43 -> 244.3.160.239 TCP 66 http > 33736 [SYN, ACK] Seq=0 Ack=1 Win=5840 Len=0 MSS=1460 SACK_PERM=1
170385  56.677217 117.246.95.43 -> 244.3.160.239 TCP 66 http > 33737 [SYN, ACK] Seq=0 Ack=1 Win=5840 Len=0 MSS=1460 SACK_PERM=1
170410  56.682646 117.246.95.43 -> 244.3.160.239 TCP 66 http > 33738 [SYN, ACK] Seq=0 Ack=1 Win=5840 Len=0 MSS=1460 SACK_PERM=1
170422  56.687662 117.246.95.43 -> 244.3.160.239 TCP 64 http > 33735 [ACK] Seq=1 Ack=610 Win=6699 Len=0
170442  56.692071 117.246.95.43 -> 244.3.160.239 TCP 64 http > 33736 [ACK] Seq=1 Ack=610 Win=6699 Len=0
170500  56.701034 117.246.95.43 -> 244.3.160.239 TCP 64 http > 33737 [ACK] Seq=1 Ack=612 Win=6721 Len=0
170550  56.706762 117.246.95.43 -> 244.3.160.239 TCP 64 http > 33738 [ACK] Seq=1 Ack=612 Win=6721 Len=0
170579  56.712942 117.246.95.43 -> 244.3.160.239 TCP 64 http > 33735 [FIN, ACK] Seq=234 Ack=611 Win=6699 Len=0
170592  56.717405 117.246.95.43 -> 244.3.160.239 TCP 64 http > 33736 [FIN, ACK] Seq=234 Ack=611 Win=6699 Len=0
170613  56.721795 117.246.95.43 -> 244.3.160.239 TCP 66 http > 33739 [SYN, ACK] Seq=0 Ack=1 Win=5840 Len=0 MSS=1460 SACK_PERM=1
170621  56.725860 117.246.95.43 -> 244.3.160.239 TCP 64 http > 33737 [FIN, ACK] Seq=234 Ack=613 Win=6721 Len=0
170669  56.734626 117.246.95.43 -> 244.3.160.239 TCP 64 http > 33738 [FIN, ACK] Seq=234 Ack=613 Win=6721 Len=0
170672  56.736136 117.246.95.43 -> 244.3.160.239 TCP 66 http > 33740 [SYN, ACK] Seq=0 Ack=1 Win=5840 Len=0 MSS=1460 SACK_PERM=1
170696  56.740521 117.246.95.43 -> 244.3.160.239 TCP 66 http > 33741 [SYN, ACK] Seq=0 Ack=1 Win=5840 Len=0 MSS=1460 SACK_PERM=1
170714  56.744660 117.246.95.43 -> 244.3.160.239 TCP 66 http > 33742 [SYN, ACK] Seq=0 Ack=1 Win=5840 Len=0 MSS=1460 SACK_PERM=1
170724  56.745891 117.246.95.43 -> 244.3.160.239 TCP 64 http > 33739 [ACK] Seq=1 Ack=614 Win=6743 Len=0
170828  56.760103 117.246.95.43 -> 244.3.160.239 TCP 64 http > 33740 [ACK] Seq=1 Ack=608 Win=6677 Len=0
170852  56.764587 117.246.95.43 -> 244.3.160.239 TCP 64 http > 33741 [ACK] Seq=1 Ack=609 Win=6688 Len=0
170874  56.768602 117.246.95.43 -> 244.3.160.239 TCP 64 http > 33742 [ACK] Seq=1 Ack=613 Win=6732 Len=0
170895  56.772485 117.246.95.43 -> 244.3.160.239 TCP 64 http > 33739 [FIN, ACK] Seq=234 Ack=615 Win=6743 Len=0
170926  56.779630 117.246.95.43 -> 244.3.160.239 TCP 66 http > 33744 [SYN, ACK] Seq=0 Ack=1 Win=5840 Len=0 MSS=1460 SACK_PERM=1
170999  56.784867 117.246.95.43 -> 244.3.160.239 TCP 64 http > 33740 [FIN, ACK] Seq=234 Ack=609 Win=6677 Len=0
171005  56.789379 117.246.95.43 -> 244.3.160.239 TCP 64 http > 33741 [FIN, ACK] Seq=234 Ack=610 Win=6688 Len=0
171023  56.793886 117.246.95.43 -> 244.3.160.239 TCP 64 http > 33742 [FIN, ACK] Seq=234 Ack=614 Win=6732 Len=0
171026  56.794277 117.246.95.43 -> 244.3.160.239 TCP 66 http > 33745 [SYN, ACK] Seq=0 Ack=1 Win=5840 Len=0 MSS=1460 SACK_PERM=1
171053  56.803569 117.246.95.43 -> 244.3.160.239 TCP 64 http > 33744 [ACK] Seq=1 Ack=614 Win=6743 Len=0
171111  56.818200 117.246.95.43 -> 244.3.160.239 TCP 64 http > 33745 [ACK] Seq=1 Ack=618 Win=6787 Len=0
171141  56.828406 117.246.95.43 -> 244.3.160.239 TCP 64 http > 33744 [FIN, ACK] Seq=234 Ack=615 Win=6743 Len=0
171173  56.843267 117.246.95.43 -> 244.3.160.239 TCP 64 http > 33745 [FIN, ACK] Seq=234 Ack=619 Win=6787 Len=0
172963  57.537002 117.246.95.43 -> 244.3.160.239 TCP 70 [TCP segment of a reassembled PDU]
173063  57.557682 117.246.95.43 -> 244.3.160.239 TCP 66 http > 33750 [SYN, ACK] Seq=0 Ack=1 Win=5840 Len=0 MSS=1460 SACK_PERM=1
173066  57.562286 117.246.95.43 -> 244.3.160.239 TCP 64 http > 33682 [FIN, ACK] Seq=96365 Ack=743 Win=6669 Len=0
173130  57.574005 117.246.95.43 -> 244.3.160.239 TCP 66 http > 33751 [SYN, ACK] Seq=0 Ack=1 Win=5840 Len=0 MSS=1460 SACK_PERM=1
173155  57.581777 117.246.95.43 -> 244.3.160.239 TCP 64 http > 33750 [ACK] Seq=1 Ack=611 Win=6710 Len=0
173195  57.597990 117.246.95.43 -> 244.3.160.239 TCP 64 http > 33751 [ACK] Seq=1 Ack=610 Win=6699 Len=0
173221  57.603678 117.246.95.43 -> 244.3.160.239 TCP 66 http > 33752 [SYN, ACK] Seq=0 Ack=1 Win=5840 Len=0 MSS=1460 SACK_PERM=1
173230  57.606635 117.246.95.43 -> 244.3.160.239 TCP 64 http > 33750 [FIN, ACK] Seq=234 Ack=612 Win=6710 Len=0
173318  57.623826 117.246.95.43 -> 244.3.160.239 TCP 64 http > 33751 [FIN, ACK] Seq=234 Ack=611 Win=6699 Len=0
173320  57.627432 117.246.95.43 -> 244.3.160.239 TCP 64 http > 33752 [ACK] Seq=1 Ack=673 Win=6720 Len=0
173321  57.627437 117.246.95.43 -> 244.3.160.239 TCP 64 http > 33752 [ACK] Seq=1 Ack=943 Win=8064 Len=0
173685  57.749832 117.246.95.43 -> 244.3.160.239 TCP 64 http > 33752 [FIN, ACK] Seq=449 Ack=944 Win=8064 Len=0
173706  57.761504 117.246.95.43 -> 244.3.160.239 TCP 66 http > 33756 [SYN, ACK] Seq=0 Ack=1 Win=5840 Len=0 MSS=1460 SACK_PERM=1
173774  57.785351 117.246.95.43 -> 244.3.160.239 TCP 64 http > 33756 [ACK] Seq=1 Ack=610 Win=6699 Len=0
173849  57.810456 117.246.95.43 -> 244.3.160.239 TCP 64 http > 33756 [FIN, ACK] Seq=234 Ack=611 Win=6699 Len=0
173986  57.834014 117.246.95.43 -> 244.3.160.239 TCP 66 http > 33758 [SYN, ACK] Seq=0 Ack=1 Win=5840 Len=0 MSS=1460 SACK_PERM=1
174064  57.857676 117.246.95.43 -> 244.3.160.239 TCP 64 http > 33758 [ACK] Seq=1 Ack=637 Win=6996 Len=0
174595  58.006997 117.246.95.43 -> 244.3.160.239 TCP 64 http > 33758 [FIN, ACK] Seq=291 Ack=638 Win=6996 Len=0
211966  72.951398 117.246.95.43 -> 244.3.160.239 TCP 66 http > 33908 [SYN, ACK] Seq=0 Ack=1 Win=5840 Len=0 MSS=1460 SACK_PERM=1
212065  72.975388 117.246.95.43 -> 244.3.160.239 TCP 64 http > 33908 [ACK] Seq=1 Ack=721 Win=7200 Len=0
214309  73.549499 117.246.95.43 -> 244.3.160.239 TCP 66 http > 33920 [SYN, ACK] Seq=0 Ack=1 Win=5840 Len=0 MSS=1460 SACK_PERM=1
214320  73.552222 117.246.95.43 -> 244.3.160.239 TCP 66 http > 33921 [SYN, ACK] Seq=0 Ack=1 Win=5840 Len=0 MSS=1460 SACK_PERM=1
214380  73.559929 117.246.95.43 -> 244.3.160.239 TCP 83 [TCP segment of a reassembled PDU]
214417  73.573542 117.246.95.43 -> 244.3.160.239 TCP 64 http > 33920 [ACK] Seq=1 Ack=541 Win=6480 Len=0
214438  73.576012 117.246.95.43 -> 244.3.160.239 TCP 64 http > 33921 [ACK] Seq=1 Ack=540 Win=6468 Len=0
214743  73.697006 117.246.95.43 -> 244.3.160.239 TCP 64 http > 33921 [FIN, ACK] Seq=463 Ack=541 Win=6468 Len=0
214744  73.697011 117.246.95.43 -> 244.3.160.239 TCP 64 http > 33920 [FIN, ACK] Seq=468 Ack=542 Win=6480 Len=0
216299  74.138338 117.246.95.43 -> 244.3.160.239 TCP 70 [TCP segment of a reassembled PDU]
216639  74.164826 117.246.95.43 -> 244.3.160.239 TCP 64 http > 33908 [FIN, ACK] Seq=100468 Ack=722 Win=7200 Len=0
216953  74.194627 117.246.95.43 -> 244.3.160.239 TCP 66 http > 33930 [SYN, ACK] Seq=0 Ack=1 Win=5840 Len=0 MSS=1460 SACK_PERM=1
217230  74.218383 117.246.95.43 -> 244.3.160.239 TCP 64 http > 33930 [ACK] Seq=1 Ack=678 Win=6770 Len=0
217231  74.218387 117.246.95.43 -> 244.3.160.239 TCP 64 http > 33930 [ACK] Seq=1 Ack=958 Win=8124 Len=0
217793  74.331179 117.246.95.43 -> 244.3.160.239 TCP 64 http > 33930 [FIN, ACK] Seq=449 Ack=959 Win=8124 Len=0
217878  74.358678 117.246.95.43 -> 244.3.160.239 TCP 66 http > 33932 [SYN, ACK] Seq=0 Ack=1 Win=5840 Len=0 MSS=1460 SACK_PERM=1
217929  74.382588 117.246.95.43 -> 244.3.160.239 TCP 64 http > 33932 [ACK] Seq=1 Ack=639 Win=7018 Len=0
218331  74.508161 117.246.95.43 -> 244.3.160.239 TCP 64 http > 33932 [FIN, ACK] Seq=291 Ack=640 Win=7018 Len=0
