724612 231.893388 117.194.75.153 -> 244.3.160.239 TCP 66 15746 > http [SYN] Seq=0 Win=16384 Len=0 MSS=1460 SACK_PERM=1
724665 231.909562 117.194.75.153 -> 244.3.160.239 TCP 64 15746 > http [ACK] Seq=1 Ack=1 Win=17520 Len=0
724731 231.939653 117.194.75.153 -> 244.3.160.239 TCP 64 15746 > http [ACK] Seq=405 Ack=595 Win=16927 Len=0
724732 231.940903 117.194.75.153 -> 244.3.160.239 TCP 64 15746 > http [FIN, ACK] Seq=405 Ack=595 Win=16927 Len=0
724823 231.989242 117.194.75.153 -> 244.3.160.239 TCP 66 10679 > http [SYN] Seq=0 Win=16384 Len=0 MSS=1460 SACK_PERM=1
724861 232.005320 117.194.75.153 -> 244.3.160.239 TCP 64 10679 > http [ACK] Seq=1 Ack=1 Win=17520 Len=0
725030 232.068864 117.194.75.153 -> 244.3.160.239 TCP 64 10679 > http [ACK] Seq=422 Ack=712 Win=16810 Len=0
725081 232.098733 117.194.75.153 -> 244.3.160.239 TCP 64 10679 > http [FIN, ACK] Seq=422 Ack=712 Win=16810 Len=0
756661 243.673089 117.194.75.153 -> 244.3.160.239 TCP 66 8526 > http [SYN] Seq=0 Win=16384 Len=0 MSS=1460 SACK_PERM=1
757083 243.818701 117.194.75.153 -> 244.3.160.239 TCP 64 8526 > http [ACK] Seq=1 Ack=1 Win=17520 Len=0
758651 244.246858 117.194.75.153 -> 244.3.160.239 TCP 64 8526 > http [ACK] Seq=571 Ack=721 Win=16801 Len=0
758654 244.247823 117.194.75.153 -> 244.3.160.239 TCP 64 8526 > http [FIN, ACK] Seq=571 Ack=721 Win=16801 Len=0
758657 244.248841 117.194.75.153 -> 244.3.160.239 TCP 66 11736 > http [SYN] Seq=0 Win=16384 Len=0 MSS=1460 SACK_PERM=1
759140 244.553650 117.194.75.153 -> 244.3.160.239 TCP 64 11736 > http [ACK] Seq=1 Ack=1 Win=17520 Len=0
759716 244.963787 117.194.75.153 -> 244.3.160.239 TCP 64 11736 > http [ACK] Seq=548 Ack=820 Win=16702 Len=0
759717 244.966072 117.194.75.153 -> 244.3.160.239 TCP 64 11736 > http [FIN, ACK] Seq=548 Ack=820 Win=16702 Len=0
759986 245.083251 117.194.75.153 -> 244.3.160.239 TCP 66 ddi-tcp-1 > http [SYN] Seq=0 Win=16384 Len=0 MSS=1460 SACK_PERM=1
759988 245.084415 117.194.75.153 -> 244.3.160.239 TCP 66 11433 > http [SYN] Seq=0 Win=16384 Len=0 MSS=1460 SACK_PERM=1
760701 245.373020 117.194.75.153 -> 244.3.160.239 TCP 64 ddi-tcp-1 > http [ACK] Seq=1 Ack=1 Win=17520 Len=0
760798 245.384007 117.194.75.153 -> 244.3.160.239 TCP 64 11433 > http [ACK] Seq=1 Ack=1 Win=17520 Len=0
761534 245.694971 117.194.75.153 -> 244.3.160.239 TCP 64 11433 > http [ACK] Seq=418 Ack=150 Win=17372 Len=0
761539 245.695976 117.194.75.153 -> 244.3.160.239 TCP 64 11433 > http [FIN, ACK] Seq=418 Ack=150 Win=17372 Len=0
761551 245.697980 117.194.75.153 -> 244.3.160.239 TCP 64 ddi-tcp-1 > http [ACK] Seq=658 Ack=1746 Win=17520 Len=0
761974 245.829571 117.194.75.153 -> 244.3.160.239 TCP 64 ddi-tcp-1 > http [ACK] Seq=658 Ack=3206 Win=17520 Len=0
762075 245.885481 117.194.75.153 -> 244.3.160.239 TCP 64 ddi-tcp-1 > http [ACK] Seq=658 Ack=6126 Win=17520 Len=0
762548 246.024987 117.194.75.153 -> 244.3.160.239 TCP 64 ddi-tcp-1 > http [ACK] Seq=658 Ack=7586 Win=17520 Len=0
762633 246.065949 117.194.75.153 -> 244.3.160.239 TCP 64 ddi-tcp-1 > http [ACK] Seq=658 Ack=9672 Win=17520 Len=0
762782 246.132817 117.194.75.153 -> 244.3.160.239 TCP 64 ddi-tcp-1 > http [ACK] Seq=658 Ack=12432 Win=17520 Len=0
763327 246.333476 117.194.75.153 -> 244.3.160.239 TCP 64 ddi-tcp-1 > http [ACK] Seq=658 Ack=13732 Win=16220 Len=0
763337 246.334537 117.194.75.153 -> 244.3.160.239 TCP 64 ddi-tcp-1 > http [ACK] Seq=658 Ack=16492 Win=17520 Len=0
763425 246.354660 117.194.75.153 -> 244.3.160.239 TCP 64 ddi-tcp-1 > http [ACK] Seq=658 Ack=19252 Win=17520 Len=0
763586 246.423794 117.194.75.153 -> 244.3.160.239 TCP 64 ddi-tcp-1 > http [ACK] Seq=658 Ack=22012 Win=17520 Len=0
763644 246.458396 117.194.75.153 -> 244.3.160.239 TCP 64 ddi-tcp-1 > http [ACK] Seq=658 Ack=24932 Win=17520 Len=0
764322 246.681395 117.194.75.153 -> 244.3.160.239 TCP 66 9941 > http [SYN] Seq=0 Win=16384 Len=0 MSS=1460 SACK_PERM=1
764337 246.683010 117.194.75.153 -> 244.3.160.239 TCP 64 ddi-tcp-1 > http [ACK] Seq=658 Ack=27852 Win=17520 Len=0
764340 246.684064 117.194.75.153 -> 244.3.160.239 TCP 64 ddi-tcp-1 > http [RST, ACK] Seq=658 Ack=29312 Win=0 Len=0
764978 247.011977 117.194.75.153 -> 244.3.160.239 TCP 64 9941 > http [ACK] Seq=1 Ack=1 Win=17520 Len=0
765747 247.435424 117.194.75.153 -> 244.3.160.239 TCP 64 9941 > http [ACK] Seq=584 Ack=263 Win=17258 Len=0
765765 247.448898 117.194.75.153 -> 244.3.160.239 TCP 66 4478 > http [SYN] Seq=0 Win=16384 Len=0 MSS=1460 SACK_PERM=1
765767 247.449859 117.194.75.153 -> 244.3.160.239 TCP 64 9941 > http [ACK] Seq=584 Ack=3183 Win=17520 Len=0
765784 247.451160 117.194.75.153 -> 244.3.160.239 TCP 66 15295 > http [SYN] Seq=0 Win=16384 Len=0 MSS=1460 SACK_PERM=1
765789 247.452165 117.194.75.153 -> 244.3.160.239 TCP 64 9941 > http [FIN, ACK] Seq=584 Ack=3840 Win=16863 Len=0
765907 247.523276 117.194.75.153 -> 244.3.160.239 TCP 64 9941 > http [ACK] Seq=585 Ack=3841 Win=16863 Len=0
766649 247.830238 117.194.75.153 -> 244.3.160.239 TCP 64 4478 > http [ACK] Seq=1 Ack=1 Win=17520 Len=0
766654 247.831178 117.194.75.153 -> 244.3.160.239 TCP 64 15295 > http [ACK] Seq=1 Ack=1 Win=17520 Len=0
767495 248.092063 117.194.75.153 -> 244.3.160.239 TCP 66 11327 > http [SYN] Seq=0 Win=16384 Len=0 MSS=1460 SACK_PERM=1
768534 248.547142 117.194.75.153 -> 244.3.160.239 TCP 64 11327 > http [ACK] Seq=1 Ack=1 Win=17520 Len=0
768551 248.554977 117.194.75.153 -> 244.3.160.239 TCP 64 4478 > http [ACK] Seq=588 Ack=1723 Win=17520 Len=0
768554 248.556248 117.194.75.153 -> 244.3.160.239 TCP 64 4478 > http [ACK] Seq=588 Ack=2356 Win=16888 Len=0
768556 248.557414 117.194.75.153 -> 244.3.160.239 TCP 64 4478 > http [FIN, ACK] Seq=588 Ack=2356 Win=16888 Len=0
768563 248.558506 117.194.75.153 -> 244.3.160.239 TCP 64 15295 > http [ACK] Seq=588 Ack=1602 Win=17520 Len=0
768564 248.559459 117.194.75.153 -> 244.3.160.239 TCP 64 15295 > http [FIN, ACK] Seq=588 Ack=1602 Win=17520 Len=0
768606 248.574970 117.194.75.153 -> 244.3.160.239 TCP 64 15295 > http [ACK] Seq=589 Ack=1603 Win=17520 Len=0
768690 248.613479 117.194.75.153 -> 244.3.160.239 TCP 66 8808 > http [SYN] Seq=0 Win=16384 Len=0 MSS=1460 SACK_PERM=1
769144 248.878479 117.194.75.153 -> 244.3.160.239 TCP 64 11327 > http [ACK] Seq=448 Ack=150 Win=17372 Len=0
769145 248.879985 117.194.75.153 -> 244.3.160.239 TCP 64 11327 > http [FIN, ACK] Seq=448 Ack=150 Win=17372 Len=0
769148 248.880659 117.194.75.153 -> 244.3.160.239 TCP 64 8808 > http [ACK] Seq=1 Ack=1 Win=17520 Len=0
769165 248.888639 117.194.75.153 -> 244.3.160.239 TCP 66 9518 > http [SYN] Seq=0 Win=16384 Len=0 MSS=1460 SACK_PERM=1
769179 248.890389 117.194.75.153 -> 244.3.160.239 TCP 66 12011 > http [SYN] Seq=0 Win=16384 Len=0 MSS=1460 SACK_PERM=1
769184 248.891335 117.194.75.153 -> 244.3.160.239 TCP 66 15214 > http [SYN] Seq=0 Win=16384 Len=0 MSS=1460 SACK_PERM=1
769186 248.892843 117.194.75.153 -> 244.3.160.239 TCP 66 11333 > http [SYN] Seq=0 Win=16384 Len=0 MSS=1460 SACK_PERM=1
769701 249.164176 117.194.75.153 -> 244.3.160.239 TCP 64 9518 > http [ACK] Seq=1 Ack=1 Win=17520 Len=0
769702 249.165331 117.194.75.153 -> 244.3.160.239 TCP 64 12011 > http [ACK] Seq=1 Ack=1 Win=17520 Len=0
769703 249.166321 117.194.75.153 -> 244.3.160.239 TCP 64 15214 > http [ACK] Seq=1 Ack=1 Win=17520 Len=0
769704 249.167352 117.194.75.153 -> 244.3.160.239 TCP 64 11333 > http [ACK] Seq=1 Ack=1 Win=17520 Len=0
770130 249.243849 117.194.75.153 -> 244.3.160.239 TCP 64 8808 > http [ACK] Seq=473 Ack=1624 Win=17520 Len=0
770131 249.245384 117.194.75.153 -> 244.3.160.239 TCP 64 8808 > http [FIN, ACK] Seq=473 Ack=1624 Win=17520 Len=0
771102 249.310281 117.194.75.153 -> 244.3.160.239 TCP 64 8808 > http [ACK] Seq=474 Ack=1625 Win=17520 Len=0
775985 249.778505 117.194.75.153 -> 244.3.160.239 TCP 64 9518 > http [ACK] Seq=628 Ack=1725 Win=17520 Len=0
775989 249.779613 117.194.75.153 -> 244.3.160.239 TCP 64 12011 > http [ACK] Seq=629 Ack=1725 Win=17520 Len=0
775993 249.780770 117.194.75.153 -> 244.3.160.239 TCP 64 15214 > http [ACK] Seq=630 Ack=1725 Win=17520 Len=0
776030 249.806186 117.194.75.153 -> 244.3.160.239 TCP 64 11333 > http [ACK] Seq=630 Ack=1724 Win=17520 Len=0
776239 249.952416 117.194.75.153 -> 244.3.160.239 TCP 64 9518 > http [ACK] Seq=628 Ack=3185 Win=17520 Len=0
776246 249.953704 117.194.75.153 -> 244.3.160.239 TCP 64 11333 > http [ACK] Seq=630 Ack=3184 Win=17520 Len=0
776249 249.954535 117.194.75.153 -> 244.3.160.239 TCP 64 15214 > http [ACK] Seq=630 Ack=3185 Win=17520 Len=0
776254 249.955667 117.194.75.153 -> 244.3.160.239 TCP 64 12011 > http [ACK] Seq=629 Ack=3185 Win=17520 Len=0
776430 250.067721 117.194.75.153 -> 244.3.160.239 TCP 64 9518 > http [ACK] Seq=628 Ack=6105 Win=17520 Len=0
776492 250.120672 117.194.75.153 -> 244.3.160.239 TCP 64 12011 > http [ACK] Seq=629 Ack=6105 Win=17520 Len=0
776634 250.173701 117.194.75.153 -> 244.3.160.239 TCP 64 15214 > http [ACK] Seq=630 Ack=6105 Win=17520 Len=0
776699 250.229919 117.194.75.153 -> 244.3.160.239 TCP 64 11333 > http [ACK] Seq=630 Ack=6104 Win=17520 Len=0
776706 250.247907 117.194.75.153 -> 244.3.160.239 TCP 64 9518 > http [ACK] Seq=628 Ack=7565 Win=17520 Len=0
776709 250.249082 117.194.75.153 -> 244.3.160.239 TCP 64 12011 > http [ACK] Seq=629 Ack=7565 Win=17520 Len=0
776948 250.348952 117.194.75.153 -> 244.3.160.239 TCP 64 11333 > http [ACK] Seq=630 Ack=7564 Win=17520 Len=0
776953 250.350125 117.194.75.153 -> 244.3.160.239 TCP 64 15214 > http [ACK] Seq=630 Ack=7565 Win=17520 Len=0
777132 250.385781 117.194.75.153 -> 244.3.160.239 TCP 64 9518 > http [ACK] Seq=628 Ack=10485 Win=17520 Len=0
777250 250.421357 117.194.75.153 -> 244.3.160.239 TCP 64 11333 > http [ACK] Seq=630 Ack=10484 Win=17520 Len=0
777346 250.456804 117.194.75.153 -> 244.3.160.239 TCP 64 15214 > http [ACK] Seq=630 Ack=10485 Win=17520 Len=0
777411 250.491786 117.194.75.153 -> 244.3.160.239 TCP 64 12011 > http [ACK] Seq=629 Ack=10485 Win=17520 Len=0
777947 250.699386 117.194.75.153 -> 244.3.160.239 TCP 64 9518 > http [ACK] Seq=628 Ack=13405 Win=17520 Len=0
777958 250.701530 117.194.75.153 -> 244.3.160.239 TCP 64 12011 > http [ACK] Seq=629 Ack=13405 Win=17520 Len=0
777998 250.735725 117.194.75.153 -> 244.3.160.239 TCP 64 15214 > http [ACK] Seq=630 Ack=13405 Win=17520 Len=0
778062 250.788670 117.194.75.153 -> 244.3.160.239 TCP 64 11333 > http [ACK] Seq=630 Ack=13404 Win=17520 Len=0
778162 250.824483 117.194.75.153 -> 244.3.160.239 TCP 64 9518 > http [ACK] Seq=628 Ack=16325 Win=17520 Len=0
778177 250.845481 117.194.75.153 -> 244.3.160.239 TCP 64 12011 > http [ACK] Seq=629 Ack=16325 Win=17520 Len=0
778292 250.936788 117.194.75.153 -> 244.3.160.239 TCP 64 11333 > http [ACK] Seq=630 Ack=16324 Win=17520 Len=0
778322 250.954460 117.194.75.153 -> 244.3.160.239 TCP 64 9518 > http [ACK] Seq=628 Ack=16492 Win=17353 Len=0
778326 250.955461 117.194.75.153 -> 244.3.160.239 TCP 64 15214 > http [ACK] Seq=630 Ack=14865 Win=17520 Len=0
778330 250.956670 117.194.75.153 -> 244.3.160.239 TCP 64 15214 > http [ACK] Seq=630 Ack=16492 Win=17520 Len=0
778409 251.024390 117.194.75.153 -> 244.3.160.239 TCP 64 9518 > http [ACK] Seq=628 Ack=19252 Win=17520 Len=0
778448 251.054257 117.194.75.153 -> 244.3.160.239 TCP 64 12011 > http [ACK] Seq=629 Ack=16492 Win=17353 Len=0
778450 251.055512 117.194.75.153 -> 244.3.160.239 TCP 64 11333 > http [ACK] Seq=630 Ack=16492 Win=17352 Len=0
778455 251.058261 117.194.75.153 -> 244.3.160.239 TCP 64 9518 > http [ACK] Seq=628 Ack=22012 Win=17520 Len=0
778479 251.092433 117.194.75.153 -> 244.3.160.239 TCP 64 11333 > http [ACK] Seq=630 Ack=19252 Win=17520 Len=0
778528 251.125507 117.194.75.153 -> 244.3.160.239 TCP 64 11333 > http [ACK] Seq=630 Ack=22012 Win=17520 Len=0
778661 251.159253 117.194.75.153 -> 244.3.160.239 TCP 64 15214 > http [ACK] Seq=630 Ack=19252 Win=17520 Len=0
778810 251.192923 117.194.75.153 -> 244.3.160.239 TCP 64 15214 > http [ACK] Seq=630 Ack=22012 Win=17520 Len=0
778856 251.227378 117.194.75.153 -> 244.3.160.239 TCP 64 12011 > http [ACK] Seq=629 Ack=19252 Win=17520 Len=0
778915 251.261471 117.194.75.153 -> 244.3.160.239 TCP 64 12011 > http [ACK] Seq=629 Ack=22092 Win=17520 Len=0
779227 251.517586 117.194.75.153 -> 244.3.160.239 TCP 64 9518 > http [ACK] Seq=628 Ack=24932 Win=17520 Len=0
779230 251.519222 117.194.75.153 -> 244.3.160.239 TCP 64 12011 > http [ACK] Seq=629 Ack=25012 Win=17520 Len=0
779236 251.520202 117.194.75.153 -> 244.3.160.239 TCP 64 15214 > http [ACK] Seq=630 Ack=24932 Win=17520 Len=0
779314 251.558626 117.194.75.153 -> 244.3.160.239 TCP 64 11333 > http [ACK] Seq=630 Ack=24932 Win=17520 Len=0
779365 251.593854 117.194.75.153 -> 244.3.160.239 TCP 64 9518 > http [ACK] Seq=628 Ack=27852 Win=17520 Len=0
779427 251.609809 117.194.75.153 -> 244.3.160.239 TCP 66 5290 > http [SYN] Seq=0 Win=16384 Len=0 MSS=1460 SACK_PERM=1
779508 251.656129 117.194.75.153 -> 244.3.160.239 TCP 64 15214 > http [ACK] Seq=630 Ack=26392 Win=17520 Len=0
779512 251.657206 117.194.75.153 -> 244.3.160.239 TCP 64 12011 > http [ACK] Seq=629 Ack=26472 Win=17520 Len=0
779588 251.690829 117.194.75.153 -> 244.3.160.239 TCP 64 9518 > http [ACK] Seq=628 Ack=30772 Win=17520 Len=0
779592 251.691846 117.194.75.153 -> 244.3.160.239 TCP 64 12011 > http [ACK] Seq=629 Ack=29392 Win=17520 Len=0
779597 251.696120 117.194.75.153 -> 244.3.160.239 TCP 64 11333 > http [ACK] Seq=630 Ack=27475 Win=17520 Len=0
779602 251.697064 117.194.75.153 -> 244.3.160.239 TCP 64 11333 > http [FIN, ACK] Seq=630 Ack=27475 Win=17520 Len=0
779718 251.750073 117.194.75.153 -> 244.3.160.239 TCP 64 15214 > http [ACK] Seq=630 Ack=29312 Win=17520 Len=0
779770 251.784225 117.194.75.153 -> 244.3.160.239 TCP 64 15214 > http [ACK] Seq=630 Ack=32232 Win=17520 Len=0
779947 251.857678 117.194.75.153 -> 244.3.160.239 TCP 64 9518 > http [ACK] Seq=628 Ack=32232 Win=17520 Len=0
779949 251.858607 117.194.75.153 -> 244.3.160.239 TCP 64 12011 > http [ACK] Seq=629 Ack=30852 Win=17520 Len=0
780119 251.923615 117.194.75.153 -> 244.3.160.239 TCP 64 9518 > http [ACK] Seq=628 Ack=35152 Win=17520 Len=0
780230 251.992168 117.194.75.153 -> 244.3.160.239 TCP 70 [TCP Dup ACK 779770#1] 15214 > http [ACK] Seq=630 Ack=32232 Win=17520 Len=0 SLE=33692 SRE=35152
780262 252.009885 117.194.75.153 -> 244.3.160.239 TCP 70 [TCP Dup ACK 779770#2] 15214 > http [ACK] Seq=630 Ack=32232 Win=17520 Len=0 SLE=33692 SRE=36612
780286 252.028300 117.194.75.153 -> 244.3.160.239 TCP 70 [TCP Dup ACK 779770#3] 15214 > http [ACK] Seq=630 Ack=32232 Win=17520 Len=0 SLE=33692 SRE=38072
780291 252.031981 117.194.75.153 -> 244.3.160.239 TCP 70 [TCP Dup ACK 779770#4] 15214 > http [ACK] Seq=630 Ack=32232 Win=17520 Len=0 SLE=33692 SRE=38396
780325 252.050317 117.194.75.153 -> 244.3.160.239 TCP 70 [TCP Dup ACK 779949#1] 12011 > http [ACK] Seq=629 Ack=30852 Win=17520 Len=0 SLE=32312 SRE=33772
780342 252.068050 117.194.75.153 -> 244.3.160.239 TCP 70 [TCP Dup ACK 779949#2] 12011 > http [ACK] Seq=629 Ack=30852 Win=17520 Len=0 SLE=32312 SRE=35232
780350 252.087335 117.194.75.153 -> 244.3.160.239 TCP 70 [TCP Dup ACK 779949#3] 12011 > http [ACK] Seq=629 Ack=30852 Win=17520 Len=0 SLE=32312 SRE=36692
780358 252.089998 117.194.75.153 -> 244.3.160.239 TCP 70 [TCP Dup ACK 779949#4] 12011 > http [ACK] Seq=629 Ack=30852 Win=17520 Len=0 SLE=32312 SRE=37016
780386 252.108232 117.194.75.153 -> 244.3.160.239 TCP 70 [TCP Dup ACK 779949#5] 12011 > http [ACK] Seq=629 Ack=30852 Win=17520 Len=0 SLE=32312 SRE=38476
780578 252.233402 117.194.75.153 -> 244.3.160.239 TCP 70 [TCP Dup ACK 780119#1] 9518 > http [ACK] Seq=628 Ack=35152 Win=17520 Len=0 SLE=38396 SRE=39856
780643 252.246845 117.194.75.153 -> 244.3.160.239 TCP 70 [TCP Dup ACK 780119#2] 9518 > http [ACK] Seq=628 Ack=35152 Win=17520 Len=0 SLE=38396 SRE=41316
780670 252.264015 117.194.75.153 -> 244.3.160.239 TCP 70 [TCP Dup ACK 779949#6] 12011 > http [ACK] Seq=629 Ack=30852 Win=17520 Len=0 SLE=32312 SRE=39936
780684 252.281749 117.194.75.153 -> 244.3.160.239 TCP 70 [TCP Dup ACK 779949#7] 12011 > http [ACK] Seq=629 Ack=30852 Win=17520 Len=0 SLE=32312 SRE=41396
780739 252.299189 117.194.75.153 -> 244.3.160.239 TCP 70 [TCP Dup ACK 779770#5] 15214 > http [ACK] Seq=630 Ack=32232 Win=17520 Len=0 SLE=33692 SRE=39856
780768 252.316893 117.194.75.153 -> 244.3.160.239 TCP 70 [TCP Dup ACK 779770#6] 15214 > http [ACK] Seq=630 Ack=32232 Win=17520 Len=0 SLE=33692 SRE=41316
780808 252.335217 117.194.75.153 -> 244.3.160.239 TCP 70 [TCP Dup ACK 780119#3] 9518 > http [ACK] Seq=628 Ack=35152 Win=17520 Len=0 SLE=38396 SRE=42776
780856 252.352104 117.194.75.153 -> 244.3.160.239 TCP 70 [TCP Dup ACK 780119#4] 9518 > http [ACK] Seq=628 Ack=35152 Win=17520 Len=0 SLE=38396 SRE=44236
780861 252.353363 117.194.75.153 -> 244.3.160.239 TCP 64 5290 > http [ACK] Seq=1 Ack=1 Win=17520 Len=0
780930 252.370826 117.194.75.153 -> 244.3.160.239 TCP 70 [TCP Dup ACK 779770#7] 15214 > http [ACK] Seq=630 Ack=32232 Win=17520 Len=0 SLE=33692 SRE=42776
780981 252.388669 117.194.75.153 -> 244.3.160.239 TCP 70 [TCP Dup ACK 779949#8] 12011 > http [ACK] Seq=629 Ack=30852 Win=17520 Len=0 SLE=32312 SRE=42856
781041 252.406528 117.194.75.153 -> 244.3.160.239 TCP 70 [TCP Dup ACK 780119#5] 9518 > http [ACK] Seq=628 Ack=35152 Win=17520 Len=0 SLE=38396 SRE=45696
781097 252.424221 117.194.75.153 -> 244.3.160.239 TCP 70 [TCP Dup ACK 780119#6] 9518 > http [ACK] Seq=628 Ack=35152 Win=17520 Len=0 SLE=38396 SRE=47156
781134 252.442031 117.194.75.153 -> 244.3.160.239 TCP 70 [TCP Dup ACK 779949#9] 12011 > http [ACK] Seq=629 Ack=30852 Win=17520 Len=0 SLE=32312 SRE=44316
781164 252.459578 117.194.75.153 -> 244.3.160.239 TCP 70 [TCP Dup ACK 779949#10] 12011 > http [ACK] Seq=629 Ack=30852 Win=17520 Len=0 SLE=32312 SRE=45776
781266 252.482024 117.194.75.153 -> 244.3.160.239 TCP 70 [TCP Dup ACK 779770#8] 15214 > http [ACK] Seq=630 Ack=32232 Win=17520 Len=0 SLE=33692 SRE=44236
781327 252.499970 117.194.75.153 -> 244.3.160.239 TCP 70 [TCP Dup ACK 779770#9] 15214 > http [ACK] Seq=630 Ack=32232 Win=17520 Len=0 SLE=33692 SRE=45696
781404 252.517538 117.194.75.153 -> 244.3.160.239 TCP 70 [TCP Dup ACK 779770#10] 15214 > http [ACK] Seq=630 Ack=32232 Win=17520 Len=0 SLE=33692 SRE=47156
781475 252.536164 117.194.75.153 -> 244.3.160.239 TCP 70 [TCP Dup ACK 779770#11] 15214 > http [ACK] Seq=630 Ack=32232 Win=17520 Len=0 SLE=33692 SRE=48616
781847 252.745980 117.194.75.153 -> 244.3.160.239 TCP 70 [TCP Dup ACK 780119#7] 9518 > http [ACK] Seq=628 Ack=35152 Win=17520 Len=0 SLE=38396 SRE=48616
781848 252.747336 117.194.75.153 -> 244.3.160.239 TCP 70 [TCP Dup ACK 779949#11] 12011 > http [ACK] Seq=629 Ack=30852 Win=17520 Len=0 SLE=32312 SRE=47236
781851 252.748329 117.194.75.153 -> 244.3.160.239 TCP 70 [TCP Dup ACK 780119#8] 9518 > http [ACK] Seq=628 Ack=35152 Win=17520 Len=0 SLE=38396 SRE=50076
781856 252.749359 117.194.75.153 -> 244.3.160.239 TCP 70 [TCP Dup ACK 780119#9] 9518 > http [ACK] Seq=628 Ack=35152 Win=17520 Len=0 SLE=38396 SRE=51536
781858 252.750323 117.194.75.153 -> 244.3.160.239 TCP 64 15214 > http [ACK] Seq=630 Ack=48616 Win=17520 Len=0
781866 252.751554 117.194.75.153 -> 244.3.160.239 TCP 64 12011 > http [ACK] Seq=629 Ack=47236 Win=17520 Len=0
782142 252.929294 117.194.75.153 -> 244.3.160.239 TCP 66 12959 > http [SYN] Seq=0 Win=16384 Len=0 MSS=1460 SACK_PERM=1
782170 252.942013 117.194.75.153 -> 244.3.160.239 TCP 70 9518 > http [ACK] Seq=628 Ack=38072 Win=17520 Len=0 SLE=38396 SRE=51536
782173 252.943057 117.194.75.153 -> 244.3.160.239 TCP 64 9518 > http [ACK] Seq=628 Ack=51536 Win=17520 Len=0
782179 252.944291 117.194.75.153 -> 244.3.160.239 TCP 64 5290 > http [ACK] Seq=553 Ack=112 Win=17410 Len=0
782180 252.945233 117.194.75.153 -> 244.3.160.239 TCP 64 5290 > http [FIN, ACK] Seq=553 Ack=112 Win=17410 Len=0
782242 253.033419 117.194.75.153 -> 244.3.160.239 TCP 64 15214 > http [ACK] Seq=630 Ack=51536 Win=17520 Len=0
782268 253.068906 117.194.75.153 -> 244.3.160.239 TCP 64 15214 > http [ACK] Seq=630 Ack=54456 Win=17520 Len=0
782330 253.104300 117.194.75.153 -> 244.3.160.239 TCP 64 15214 > http [ACK] Seq=630 Ack=57376 Win=17520 Len=0
782399 253.157328 117.194.75.153 -> 244.3.160.239 TCP 64 12011 > http [ACK] Seq=629 Ack=50156 Win=17520 Len=0
782451 253.192542 117.194.75.153 -> 244.3.160.239 TCP 64 12011 > http [ACK] Seq=629 Ack=53076 Win=17520 Len=0
782514 253.228052 117.194.75.153 -> 244.3.160.239 TCP 64 12011 > http [ACK] Seq=629 Ack=55996 Win=17520 Len=0
782560 253.265458 117.194.75.153 -> 244.3.160.239 TCP 64 15214 > http [ACK] Seq=630 Ack=58836 Win=17520 Len=0
782715 253.366002 117.194.75.153 -> 244.3.160.239 TCP 64 12011 > http [ACK] Seq=629 Ack=57456 Win=17520 Len=0
782739 253.379857 117.194.75.153 -> 244.3.160.239 TCP 64 12959 > http [ACK] Seq=1 Ack=1 Win=17520 Len=0
782800 253.415851 117.194.75.153 -> 244.3.160.239 TCP 64 9518 > http [ACK] Seq=628 Ack=54456 Win=17520 Len=0
782929 253.451490 117.194.75.153 -> 244.3.160.239 TCP 64 9518 > http [ACK] Seq=628 Ack=57376 Win=17520 Len=0
783010 253.486509 117.194.75.153 -> 244.3.160.239 TCP 64 9518 > http [ACK] Seq=628 Ack=60296 Win=17520 Len=0
783440 253.673915 117.194.75.153 -> 244.3.160.239 TCP 64 9518 > http [ACK] Seq=628 Ack=61756 Win=17520 Len=0
783460 253.687810 117.194.75.153 -> 244.3.160.239 TCP 64 15214 > http [ACK] Seq=630 Ack=61756 Win=17520 Len=0
783466 253.688982 117.194.75.153 -> 244.3.160.239 TCP 70 [TCP Dup ACK 783460#1] 15214 > http [ACK] Seq=630 Ack=61756 Win=17520 Len=0 SLE=63216 SRE=64676
783469 253.689928 117.194.75.153 -> 244.3.160.239 TCP 64 15214 > http [ACK] Seq=630 Ack=64676 Win=17520 Len=0
783524 253.713737 117.194.75.153 -> 244.3.160.239 TCP 64 15214 > http [ACK] Seq=630 Ack=67596 Win=17520 Len=0
783590 253.748837 117.194.75.153 -> 244.3.160.239 TCP 64 12011 > http [ACK] Seq=629 Ack=60376 Win=17520 Len=0
783653 253.784676 117.194.75.153 -> 244.3.160.239 TCP 64 12011 > http [ACK] Seq=629 Ack=63296 Win=17520 Len=0
783723 253.820401 117.194.75.153 -> 244.3.160.239 TCP 64 12011 > http [ACK] Seq=629 Ack=66216 Win=17520 Len=0
783869 253.891457 117.194.75.153 -> 244.3.160.239 TCP 64 9518 > http [ACK] Seq=628 Ack=64676 Win=17520 Len=0
783936 253.930885 117.194.75.153 -> 244.3.160.239 TCP 64 9518 > http [ACK] Seq=628 Ack=67596 Win=17520 Len=0
783985 253.948531 117.194.75.153 -> 244.3.160.239 TCP 64 12959 > http [ACK] Seq=602 Ack=1724 Win=17520 Len=0
784049 253.969889 117.194.75.153 -> 244.3.160.239 TCP 64 12011 > http [ACK] Seq=629 Ack=67676 Win=17520 Len=0
784052 253.971309 117.194.75.153 -> 244.3.160.239 TCP 64 15214 > http [ACK] Seq=630 Ack=69056 Win=17520 Len=0
784223 254.047330 117.194.75.153 -> 244.3.160.239 TCP 64 12959 > http [ACK] Seq=602 Ack=4152 Win=17520 Len=0
784313 254.103868 117.194.75.153 -> 244.3.160.239 TCP 64 9518 > http [ACK] Seq=628 Ack=69380 Win=17520 Len=0
784586 254.247483 117.194.75.153 -> 244.3.160.239 TCP 64 15214 > http [ACK] Seq=630 Ack=70840 Win=17520 Len=0
784646 254.282943 117.194.75.153 -> 244.3.160.239 TCP 64 15214 > http [ACK] Seq=630 Ack=73760 Win=17520 Len=0
784766 254.319957 117.194.75.153 -> 244.3.160.239 TCP 64 15214 > http [ACK] Seq=630 Ack=76680 Win=17520 Len=0
784823 254.355227 117.194.75.153 -> 244.3.160.239 TCP 64 12011 > http [ACK] Seq=629 Ack=70596 Win=17520 Len=0
784842 254.372452 117.194.75.153 -> 244.3.160.239 TCP 64 9518 > http [ACK] Seq=628 Ack=70840 Win=17520 Len=0
784858 254.377877 117.194.75.153 -> 244.3.160.239 TCP 64 12011 > http [ACK] Seq=629 Ack=72380 Win=17520 Len=0
784991 254.413323 117.194.75.153 -> 244.3.160.239 TCP 64 12011 > http [ACK] Seq=629 Ack=75300 Win=17520 Len=0
785198 254.448644 117.194.75.153 -> 244.3.160.239 TCP 64 9518 > http [ACK] Seq=628 Ack=73760 Win=17520 Len=0
785291 254.484230 117.194.75.153 -> 244.3.160.239 TCP 64 9518 > http [ACK] Seq=628 Ack=76680 Win=17520 Len=0
785373 254.517601 117.194.75.153 -> 244.3.160.239 TCP 64 12959 > http [ACK] Seq=602 Ack=6912 Win=17520 Len=0
785462 254.553137 117.194.75.153 -> 244.3.160.239 TCP 64 12011 > http [ACK] Seq=629 Ack=78220 Win=17520 Len=0
785546 254.588298 117.194.75.153 -> 244.3.160.239 TCP 64 15214 > http [ACK] Seq=630 Ack=79600 Win=17520 Len=0
785980 254.900194 117.194.75.153 -> 244.3.160.239 TCP 64 12959 > http [ACK] Seq=602 Ack=9672 Win=17520 Len=0
785991 254.901467 117.194.75.153 -> 244.3.160.239 TCP 64 9518 > http [ACK] Seq=628 Ack=79600 Win=17520 Len=0
786048 254.963914 117.194.75.153 -> 244.3.160.239 TCP 64 15214 > http [ACK] Seq=630 Ack=82520 Win=17520 Len=0
786118 254.998935 117.194.75.153 -> 244.3.160.239 TCP 64 15214 > http [ACK] Seq=630 Ack=85440 Win=17520 Len=0
786144 255.035669 117.194.75.153 -> 244.3.160.239 TCP 64 15214 > http [ACK] Seq=630 Ack=88360 Win=17520 Len=0
786180 255.069622 117.194.75.153 -> 244.3.160.239 TCP 64 12011 > http [ACK] Seq=629 Ack=81140 Win=17520 Len=0
786188 255.076360 117.194.75.153 -> 244.3.160.239 TCP 64 12959 > http [ACK] Seq=602 Ack=10972 Win=16220 Len=0
786248 255.104946 117.194.75.153 -> 244.3.160.239 TCP 64 9518 > http [ACK] Seq=628 Ack=82520 Win=17520 Len=0
786276 255.140105 117.194.75.153 -> 244.3.160.239 TCP 64 12011 > http [ACK] Seq=629 Ack=84060 Win=17520 Len=0
786323 255.176690 117.194.75.153 -> 244.3.160.239 TCP 64 12011 > http [ACK] Seq=629 Ack=86980 Win=17520 Len=0
786356 255.210917 117.194.75.153 -> 244.3.160.239 TCP 64 9518 > http [ACK] Seq=628 Ack=85440 Win=17520 Len=0
786396 255.246412 117.194.75.153 -> 244.3.160.239 TCP 64 9518 > http [ACK] Seq=628 Ack=88360 Win=17520 Len=0
786502 255.300088 117.194.75.153 -> 244.3.160.239 TCP 64 12959 > http [ACK] Seq=602 Ack=13732 Win=17520 Len=0
786642 255.332523 117.194.75.153 -> 244.3.160.239 TCP 64 12011 > http [ACK] Seq=629 Ack=89900 Win=17520 Len=0
786778 255.367786 117.194.75.153 -> 244.3.160.239 TCP 64 15214 > http [ACK] Seq=630 Ack=91280 Win=17520 Len=0
787070 255.480972 117.194.75.153 -> 244.3.160.239 TCP 64 12959 > http [ACK] Seq=602 Ack=15112 Win=16140 Len=0
787352 255.585826 117.194.75.153 -> 244.3.160.239 TCP 64 12959 > http [ACK] Seq=602 Ack=17952 Win=17520 Len=0
787627 255.664181 117.194.75.153 -> 244.3.160.239 TCP 64 9518 > http [ACK] Seq=628 Ack=91280 Win=17520 Len=0
787695 255.694083 117.194.75.153 -> 244.3.160.239 TCP 64 15214 > http [ACK] Seq=630 Ack=93064 Win=17520 Len=0
787879 255.780257 117.194.75.153 -> 244.3.160.239 TCP 64 12959 > http [ACK] Seq=602 Ack=19252 Win=16220 Len=0
787884 255.782486 117.194.75.153 -> 244.3.160.239 TCP 64 15214 > http [ACK] Seq=630 Ack=95984 Win=17520 Len=0
787923 255.817661 117.194.75.153 -> 244.3.160.239 TCP 64 15214 > http [ACK] Seq=630 Ack=98904 Win=17520 Len=0
787976 255.852869 117.194.75.153 -> 244.3.160.239 TCP 64 12011 > http [ACK] Seq=629 Ack=92820 Win=17520 Len=0
788042 255.886655 117.194.75.153 -> 244.3.160.239 TCP 64 12959 > http [ACK] Seq=602 Ack=22012 Win=17520 Len=0
788115 255.921995 117.194.75.153 -> 244.3.160.239 TCP 64 9518 > http [ACK] Seq=628 Ack=94200 Win=17520 Len=0
788173 255.957483 117.194.75.153 -> 244.3.160.239 TCP 64 12011 > http [ACK] Seq=629 Ack=95740 Win=17520 Len=0
788256 255.992729 117.194.75.153 -> 244.3.160.239 TCP 64 12011 > http [ACK] Seq=629 Ack=98660 Win=17520 Len=0
788406 256.028187 117.194.75.153 -> 244.3.160.239 TCP 64 9518 > http [ACK] Seq=628 Ack=97120 Win=17520 Len=0
788488 256.063701 117.194.75.153 -> 244.3.160.239 TCP 64 9518 > http [ACK] Seq=628 Ack=100040 Win=17520 Len=0
788550 256.098799 117.194.75.153 -> 244.3.160.239 TCP 64 12959 > http [ACK] Seq=602 Ack=24932 Win=17520 Len=0
788757 256.152831 117.194.75.153 -> 244.3.160.239 TCP 64 12011 > http [ACK] Seq=629 Ack=101580 Win=17520 Len=0
789171 256.188191 117.194.75.153 -> 244.3.160.239 TCP 64 15214 > http [ACK] Seq=630 Ack=101824 Win=17520 Len=0
789196 256.209607 117.194.75.153 -> 244.3.160.239 TCP 64 12959 > http [ACK] Seq=602 Ack=27852 Win=17520 Len=0
789232 256.245412 117.194.75.153 -> 244.3.160.239 TCP 64 12959 > http [ACK] Seq=602 Ack=30772 Win=17520 Len=0
789296 256.281093 117.194.75.153 -> 244.3.160.239 TCP 64 12959 > http [ACK] Seq=602 Ack=33692 Win=17520 Len=0
789309 256.303631 117.194.75.153 -> 244.3.160.239 TCP 64 9518 > http [ACK] Seq=628 Ack=101824 Win=17520 Len=0
789837 256.544282 117.194.75.153 -> 244.3.160.239 TCP 64 15214 > http [ACK] Seq=630 Ack=104744 Win=17520 Len=0
789937 256.598451 117.194.75.153 -> 244.3.160.239 TCP 64 15214 > http [ACK] Seq=630 Ack=107664 Win=17520 Len=0
790104 256.670179 117.194.75.153 -> 244.3.160.239 TCP 64 15214 > http [ACK] Seq=630 Ack=110584 Win=17520 Len=0
790154 256.685446 117.194.75.153 -> 244.3.160.239 TCP 64 12959 > http [ACK] Seq=602 Ack=35152 Win=17520 Len=0
790156 256.686775 117.194.75.153 -> 244.3.160.239 TCP 64 12011 > http [ACK] Seq=629 Ack=104500 Win=17520 Len=0
790284 256.727108 117.194.75.153 -> 244.3.160.239 TCP 64 12959 > http [ACK] Seq=602 Ack=38072 Win=17520 Len=0
790455 256.785999 117.194.75.153 -> 244.3.160.239 TCP 64 15214 > http [ACK] Seq=630 Ack=112044 Win=17520 Len=0
790753 256.887242 117.194.75.153 -> 244.3.160.239 TCP 64 12011 > http [ACK] Seq=629 Ack=104824 Win=17196 Len=0
790810 256.915340 117.194.75.153 -> 244.3.160.239 TCP 64 15214 > http [FIN, ACK] Seq=630 Ack=112044 Win=17520 Len=0
790812 256.916464 117.194.75.153 -> 244.3.160.239 TCP 64 9518 > http [FIN, ACK] Seq=628 Ack=103284 Win=17520 Len=0
790816 256.917522 117.194.75.153 -> 244.3.160.239 TCP 64 12011 > http [FIN, ACK] Seq=629 Ack=104824 Win=17196 Len=0
790821 256.918500 117.194.75.153 -> 244.3.160.239 TCP 64 12959 > http [FIN, ACK] Seq=602 Ack=39532 Win=17520 Len=0
790908 256.957170 117.194.75.153 -> 244.3.160.239 TCP 70 [TCP Dup ACK 790816#1] 12011 > http [ACK] Seq=630 Ack=104824 Win=17196 Len=0 SLE=109204 SRE=110664
790916 256.958292 117.194.75.153 -> 244.3.160.239 TCP 70 [TCP Dup ACK 790812#1] 9518 > http [ACK] Seq=629 Ack=103284 Win=17520 Len=0 SLE=104744 SRE=106204
790918 256.959375 117.194.75.153 -> 244.3.160.239 TCP 70 [TCP Dup ACK 790812#2] 9518 > http [ACK] Seq=629 Ack=103284 Win=17520 Len=0 SLE=104744 SRE=107664
790997 257.002023 117.194.75.153 -> 244.3.160.239 TCP 70 [TCP Dup ACK 790821#1] 12959 > http [ACK] Seq=603 Ack=39532 Win=17520 Len=0 SLE=40992 SRE=42452
791041 257.018090 117.194.75.153 -> 244.3.160.239 TCP 70 [TCP Dup ACK 790816#2] 12011 > http [ACK] Seq=630 Ack=104824 Win=17196 Len=0 SLE=109204 SRE=112124
791090 257.035070 117.194.75.153 -> 244.3.160.239 TCP 70 [TCP Dup ACK 790816#3] 12011 > http [ACK] Seq=630 Ack=104824 Win=17196 Len=0 SLE=109204 SRE=113584
791096 257.052767 117.194.75.153 -> 244.3.160.239 TCP 64 15214 > http [RST, ACK] Seq=631 Ack=113504 Win=0 Len=0
791126 257.088124 117.194.75.153 -> 244.3.160.239 TCP 70 [TCP Dup ACK 790821#2] 12959 > http [ACK] Seq=603 Ack=39532 Win=17520 Len=0 SLE=40992 SRE=43912
791200 257.106731 117.194.75.153 -> 244.3.160.239 TCP 70 [TCP Dup ACK 790821#3] 12959 > http [ACK] Seq=603 Ack=39532 Win=17520 Len=0 SLE=40992 SRE=45372
791228 257.131808 117.194.75.153 -> 244.3.160.239 TCP 70 [TCP Dup ACK 790821#4] 12959 > http [ACK] Seq=603 Ack=39532 Win=17520 Len=0 SLE=40992 SRE=46832
791291 257.182510 117.194.75.153 -> 244.3.160.239 TCP 78 [TCP Dup ACK 790821#5] 12959 > http [ACK] Seq=603 Ack=39532 Win=17520 Len=0 SLE=49752 SRE=51212 SLE=40992 SRE=46832
791349 257.199633 117.194.75.153 -> 244.3.160.239 TCP 78 [TCP Dup ACK 790812#3] 9518 > http [ACK] Seq=629 Ack=103284 Win=17520 Len=0 SLE=112044 SRE=113504 SLE=104744 SRE=107664
792180 257.527948 117.194.75.153 -> 244.3.160.239 TCP 78 [TCP Dup ACK 790821#6] 12959 > http [ACK] Seq=603 Ack=39532 Win=17520 Len=0 SLE=49752 SRE=52672 SLE=40992 SRE=46832
792214 257.545787 117.194.75.153 -> 244.3.160.239 TCP 70 [TCP Dup ACK 790816#4] 12011 > http [ACK] Seq=630 Ack=104824 Win=17196 Len=0 SLE=109204 SRE=115044
792238 257.563697 117.194.75.153 -> 244.3.160.239 TCP 70 [TCP Dup ACK 790816#5] 12011 > http [ACK] Seq=630 Ack=104824 Win=17196 Len=0 SLE=109204 SRE=116504
792264 257.581068 117.194.75.153 -> 244.3.160.239 TCP 78 [TCP Dup ACK 790821#7] 12959 > http [ACK] Seq=603 Ack=39532 Win=17520 Len=0 SLE=49752 SRE=54132 SLE=40992 SRE=46832
792277 257.598696 117.194.75.153 -> 244.3.160.239 TCP 78 [TCP Dup ACK 790821#8] 12959 > http [ACK] Seq=603 Ack=39532 Win=17520 Len=0 SLE=49752 SRE=55592 SLE=40992 SRE=46832
792407 257.672730 117.194.75.153 -> 244.3.160.239 TCP 70 [TCP Dup ACK 790816#6] 12011 > http [ACK] Seq=630 Ack=104824 Win=17196 Len=0 SLE=109204 SRE=117964
792410 257.673638 117.194.75.153 -> 244.3.160.239 TCP 78 [TCP Dup ACK 790812#4] 9518 > http [ACK] Seq=629 Ack=103284 Win=17520 Len=0 SLE=114964 SRE=116424 SLE=112044 SRE=113504
792412 257.674809 117.194.75.153 -> 244.3.160.239 TCP 78 [TCP Dup ACK 790821#9] 12959 > http [ACK] Seq=603 Ack=39532 Win=17520 Len=0 SLE=49752 SRE=57052 SLE=40992 SRE=46832
792441 257.691337 117.194.75.153 -> 244.3.160.239 TCP 64 12011 > http [RST, ACK] Seq=630 Ack=106284 Win=0 Len=0
792796 257.969693 117.194.75.153 -> 244.3.160.239 TCP 64 12959 > http [RST, ACK] Seq=603 Ack=40992 Win=0 Len=0
792798 257.970763 117.194.75.153 -> 244.3.160.239 TCP 64 9518 > http [RST, ACK] Seq=629 Ack=104744 Win=0 Len=0
844541 277.914843 117.194.75.153 -> 244.3.160.239 TCP 66 5334 > http [SYN] Seq=0 Win=16384 Len=0 MSS=1460 SACK_PERM=1
845266 278.345839 117.194.75.153 -> 244.3.160.239 TCP 64 5334 > http [ACK] Seq=1 Ack=1 Win=17520 Len=0
846518 278.994847 117.194.75.153 -> 244.3.160.239 TCP 64 5334 > http [ACK] Seq=403 Ack=591 Win=16931 Len=0
846519 278.995693 117.194.75.153 -> 244.3.160.239 TCP 64 5334 > http [FIN, ACK] Seq=403 Ack=591 Win=16931 Len=0
846522 278.996942 117.194.75.153 -> 244.3.160.239 TCP 66 fmpro-internal > http [SYN] Seq=0 Win=16384 Len=0 MSS=1460 SACK_PERM=1
846743 279.267641 117.194.75.153 -> 244.3.160.239 TCP 64 fmpro-internal > http [ACK] Seq=1 Ack=1 Win=17520 Len=0
847636 279.882558 117.194.75.153 -> 244.3.160.239 TCP 64 fmpro-internal > http [ACK] Seq=420 Ack=708 Win=16814 Len=0
847639 279.883376 117.194.75.153 -> 244.3.160.239 TCP 64 fmpro-internal > http [FIN, ACK] Seq=420 Ack=708 Win=16814 Len=0
916257 304.156830 117.194.75.153 -> 244.3.160.239 TCP 66 12553 > http [SYN] Seq=0 Win=16384 Len=0 MSS=1460 SACK_PERM=1
920419 305.073795 117.194.75.153 -> 244.3.160.239 TCP 64 12553 > http [ACK] Seq=1 Ack=1 Win=17520 Len=0
921510 305.742427 117.194.75.153 -> 244.3.160.239 TCP 64 12553 > http [ACK] Seq=602 Ack=816 Win=16706 Len=0
921511 305.743611 117.194.75.153 -> 244.3.160.239 TCP 64 12553 > http [FIN, ACK] Seq=602 Ack=816 Win=16706 Len=0
921635 305.820445 117.194.75.153 -> 244.3.160.239 TCP 66 9637 > http [SYN] Seq=0 Win=16384 Len=0 MSS=1460 SACK_PERM=1
