324271 111.315927 117.194.219.136 -> 244.3.160.239 TCP 82 16293 > http [SYN] Seq=0 Win=65535 Len=0 MSS=1460 WS=8 TSval=610136687 TSecr=0 SACK_PERM=1
324296 111.330666 117.194.219.136 -> 244.3.160.239 TCP 70 16293 > http [ACK] Seq=1 Ack=1 Win=524280 Len=0 TSval=610136687 TSecr=1511945632
324399 111.357782 117.194.219.136 -> 244.3.160.239 TCP 70 16293 > http [ACK] Seq=731 Ack=528 Win=524280 Len=0 TSval=610136688 TSecr=1511945634
324402 111.358780 117.194.219.136 -> 244.3.160.239 TCP 70 16293 > http [ACK] Seq=731 Ack=529 Win=524280 Len=0 TSval=610136688 TSecr=1511945634
324403 111.359840 117.194.219.136 -> 244.3.160.239 TCP 70 16293 > http [FIN, ACK] Seq=731 Ack=529 Win=524280 Len=0 TSval=610136688 TSecr=1511945634
324491 111.412263 117.194.219.136 -> 244.3.160.239 TCP 82 9329 > http [SYN] Seq=0 Win=65535 Len=0 MSS=1460 WS=8 TSval=610136688 TSecr=0 SACK_PERM=1
324532 111.427560 117.194.219.136 -> 244.3.160.239 TCP 70 9329 > http [ACK] Seq=1 Ack=1 Win=524280 Len=0 TSval=610136688 TSecr=1511945642
324590 111.460759 117.194.219.136 -> 244.3.160.239 TCP 70 9329 > http [ACK] Seq=726 Ack=645 Win=524280 Len=0 TSval=610136689 TSecr=1511945645
324592 111.461975 117.194.219.136 -> 244.3.160.239 TCP 70 9329 > http [ACK] Seq=726 Ack=646 Win=524280 Len=0 TSval=610136689 TSecr=1511945645
324593 111.462946 117.194.219.136 -> 244.3.160.239 TCP 70 9329 > http [FIN, ACK] Seq=726 Ack=646 Win=524280 Len=0 TSval=610136689 TSecr=1511945645
