443643 144.401912 117.194.116.117 -> 41.177.98.176 TCP 70 50705 > http [SYN] Seq=0 Win=8192 Len=0 MSS=1460 WS=4 SACK_PERM=1
443722 144.437749 117.194.116.117 -> 41.177.98.176 TCP 64 50705 > http [ACK] Seq=1 Ack=1 Win=17520 Len=0
444033 144.547369 117.194.116.117 -> 41.177.98.176 TCP 64 50705 > http [ACK] Seq=810 Ack=1758 Win=17520 Len=0
444242 144.612282 117.194.116.117 -> 41.177.98.176 TCP 64 50705 > http [ACK] Seq=810 Ack=4678 Win=17520 Len=0
444250 144.632420 117.194.116.117 -> 41.177.98.176 TCP 64 50705 > http [ACK] Seq=810 Ack=6808 Win=17520 Len=0
445639 144.842003 117.194.116.117 -> 41.177.98.176 TCP 70 50706 > http [SYN] Seq=0 Win=8192 Len=0 MSS=1460 WS=4 SACK_PERM=1
446472 144.907667 117.194.116.117 -> 41.177.98.176 TCP 64 50706 > http [ACK] Seq=1 Ack=1 Win=17520 Len=0
446586 144.977502 117.194.116.117 -> 41.177.98.176 TCP 64 50706 > http [ACK] Seq=824 Ack=2921 Win=17520 Len=0
446849 145.103094 117.194.116.117 -> 41.177.98.176 TCP 64 50705 > http [ACK] Seq=1616 Ack=8118 Win=16208 Len=0
447083 145.187621 117.194.116.117 -> 41.177.98.176 TCP 64 50706 > http [ACK] Seq=824 Ack=3894 Win=16544 Len=0
466043 153.368357 117.194.116.117 -> 41.177.98.176 TCP 64 50705 > http [ACK] Seq=2470 Ack=11038 Win=17520 Len=0
466137 153.401772 117.194.116.117 -> 41.177.98.176 TCP 64 50705 > http [ACK] Seq=2470 Ack=13451 Win=17520 Len=0
466155 153.437552 117.194.116.117 -> 41.177.98.176 TCP 64 50705 > http [ACK] Seq=2470 Ack=16371 Win=17520 Len=0
466289 153.501906 117.194.116.117 -> 41.177.98.176 TCP 70 50709 > http [SYN] Seq=0 Win=8192 Len=0 MSS=1460 WS=4 SACK_PERM=1
466614 153.632443 117.194.116.117 -> 41.177.98.176 TCP 64 50705 > http [ACK] Seq=2470 Ack=17831 Win=17520 Len=0
466876 153.797944 117.194.116.117 -> 41.177.98.176 TCP 64 50705 > http [ACK] Seq=2470 Ack=20039 Win=17520 Len=0
467345 153.998429 117.194.116.117 -> 41.177.98.176 TCP 64 50705 > http [ACK] Seq=2470 Ack=22959 Win=17520 Len=0
467411 154.012638 117.194.116.117 -> 41.177.98.176 TCP 64 50705 > http [ACK] Seq=2470 Ack=25167 Win=17520 Len=0
467447 154.046380 117.194.116.117 -> 41.177.98.176 TCP 64 50705 > http [ACK] Seq=2470 Ack=28087 Win=17520 Len=0
467513 154.072503 117.194.116.117 -> 41.177.98.176 TCP 64 50709 > http [ACK] Seq=1 Ack=1 Win=17520 Len=0
467916 154.267706 117.194.116.117 -> 41.177.98.176 TCP 64 50706 > http [ACK] Seq=1737 Ack=4061 Win=16380 Len=0
467927 154.272634 117.194.116.117 -> 41.177.98.176 TCP 64 50705 > http [ACK] Seq=2470 Ack=29293 Win=16312 Len=0
468194 154.448161 117.194.116.117 -> 41.177.98.176 TCP 64 50705 > http [ACK] Seq=3318 Ack=31050 Win=17520 Len=0
468230 154.452614 117.194.116.117 -> 41.177.98.176 TCP 64 50705 > http [ACK] Seq=3318 Ack=33970 Win=17520 Len=0
468355 154.482248 117.194.116.117 -> 41.177.98.176 TCP 64 50705 > http [ACK] Seq=3318 Ack=36890 Win=17520 Len=0
468517 154.522691 117.194.116.117 -> 41.177.98.176 TCP 64 50705 > http [ACK] Seq=3318 Ack=39242 Win=17520 Len=0
468548 154.532540 117.194.116.117 -> 41.177.98.176 TCP 64 50709 > http [ACK] Seq=898 Ack=169 Win=17352 Len=0
468565 154.542513 117.194.116.117 -> 41.177.98.176 TCP 64 50705 > http [ACK] Seq=3318 Ack=42162 Win=17520 Len=0
468612 154.572231 117.194.116.117 -> 41.177.98.176 TCP 64 50705 > http [ACK] Seq=3318 Ack=45082 Win=17520 Len=0
468778 154.632668 117.194.116.117 -> 41.177.98.176 TCP 64 50705 > http [ACK] Seq=3318 Ack=47434 Win=17520 Len=0
468824 154.657271 117.194.116.117 -> 41.177.98.176 TCP 64 50705 > http [ACK] Seq=3318 Ack=50354 Win=17520 Len=0
468892 154.692884 117.194.116.117 -> 41.177.98.176 TCP 64 50705 > http [ACK] Seq=3318 Ack=53274 Win=17520 Len=0
468964 154.717779 117.194.116.117 -> 41.177.98.176 TCP 64 50705 > http [ACK] Seq=3318 Ack=55626 Win=17520 Len=0
469048 154.747500 117.194.116.117 -> 41.177.98.176 TCP 64 50705 > http [ACK] Seq=3318 Ack=58205 Win=17520 Len=0
520734 168.537393 117.194.116.117 -> 41.177.98.176 TCP 64 50706 > http [ACK] Seq=1737 Ack=4062 Win=16380 Len=0
521822 169.117601 117.194.116.117 -> 41.177.98.176 TCP 64 50709 > http [ACK] Seq=898 Ack=170 Win=17352 Len=0
522453 169.397413 117.194.116.117 -> 41.177.98.176 TCP 64 50705 > http [ACK] Seq=3318 Ack=58206 Win=17520 Len=0
548042 176.867988 117.194.116.117 -> 41.177.98.176 TCP 64 50705 > http [FIN, ACK] Seq=3318 Ack=58206 Win=17520 Len=0
548095 176.872586 117.194.116.117 -> 41.177.98.176 TCP 64 50706 > http [FIN, ACK] Seq=1737 Ack=4062 Win=16380 Len=0
548218 176.878253 117.194.116.117 -> 41.177.98.176 TCP 64 50709 > http [FIN, ACK] Seq=898 Ack=170 Win=17352 Len=0
548319 176.883152 117.194.116.117 -> 41.177.98.176 TCP 70 50711 > http [SYN] Seq=0 Win=8192 Len=0 MSS=1460 WS=4 SACK_PERM=1
548782 176.922475 117.194.116.117 -> 41.177.98.176 TCP 64 50711 > http [ACK] Seq=1 Ack=1 Win=17520 Len=0
565959 180.982361 117.194.116.117 -> 41.177.98.176 TCP 64 50711 > http [ACK] Seq=1003 Ack=1461 Win=17520 Len=0
566328 181.057325 117.194.116.117 -> 41.177.98.176 TCP 64 50711 > http [ACK] Seq=1003 Ack=4381 Win=17520 Len=0
566586 181.127702 117.194.116.117 -> 41.177.98.176 TCP 64 50711 > http [ACK] Seq=1003 Ack=7301 Win=17520 Len=0
566677 181.181664 117.194.116.117 -> 41.177.98.176 TCP 64 50711 > http [ACK] Seq=1003 Ack=10221 Win=17520 Len=0
566968 181.237875 117.194.116.117 -> 41.177.98.176 TCP 64 50711 > http [ACK] Seq=1003 Ack=13141 Win=17520 Len=0
567028 181.252653 117.194.116.117 -> 41.177.98.176 TCP 70 50712 > http [SYN] Seq=0 Win=8192 Len=0 MSS=1460 WS=4 SACK_PERM=1
567231 181.291971 117.194.116.117 -> 41.177.98.176 TCP 64 50711 > http [ACK] Seq=1003 Ack=16061 Win=17520 Len=0
567286 181.307946 117.194.116.117 -> 41.177.98.176 TCP 64 50712 > http [ACK] Seq=1 Ack=1 Win=17520 Len=0
567413 181.347598 117.194.116.117 -> 41.177.98.176 TCP 64 50711 > http [ACK] Seq=1003 Ack=18981 Win=17520 Len=0
567528 181.377529 117.194.116.117 -> 41.177.98.176 TCP 64 50711 > http [ACK] Seq=1003 Ack=21901 Win=17520 Len=0
567772 181.427638 117.194.116.117 -> 41.177.98.176 TCP 64 50711 > http [ACK] Seq=1003 Ack=24821 Win=17520 Len=0
568362 181.587298 117.194.116.117 -> 41.177.98.176 TCP 64 50712 > http [ACK] Seq=946 Ack=1391 Win=16128 Len=0
568540 181.642391 117.194.116.117 -> 41.177.98.176 TCP 64 50711 > http [ACK] Seq=1003 Ack=25704 Win=16636 Len=0
606776 192.467170 117.194.116.117 -> 41.177.98.176 TCP 64 50711 > http [ACK] Seq=1003 Ack=25705 Win=16636 Len=0
614980 195.147238 117.194.116.117 -> 41.177.98.176 TCP 64 50711 > http [FIN, ACK] Seq=1003 Ack=25705 Win=16636 Len=0
617655 196.367210 117.194.116.117 -> 41.177.98.176 TCP 64 50712 > http [ACK] Seq=946 Ack=1392 Win=16128 Len=0
672149 209.486723 117.194.116.117 -> 41.177.98.176 TCP 64 50712 > http [FIN, ACK] Seq=946 Ack=1392 Win=16128 Len=0
672157 209.491321 117.194.116.117 -> 41.177.98.176 TCP 70 50714 > http [SYN] Seq=0 Win=8192 Len=0 MSS=1460 WS=4 SACK_PERM=1
672317 209.547348 117.194.116.117 -> 41.177.98.176 TCP 64 50714 > http [ACK] Seq=1 Ack=1 Win=17520 Len=0
682343 214.012327 117.194.116.117 -> 41.177.98.176 TCP 64 50714 > http [ACK] Seq=1128 Ack=1461 Win=17520 Len=0
682586 214.082426 117.194.116.117 -> 41.177.98.176 TCP 64 50714 > http [ACK] Seq=1128 Ack=4381 Win=17520 Len=0
682863 214.156497 117.194.116.117 -> 41.177.98.176 TCP 64 50714 > http [ACK] Seq=1128 Ack=7301 Win=17520 Len=0
683000 214.211465 117.194.116.117 -> 41.177.98.176 TCP 64 50714 > http [ACK] Seq=1128 Ack=10221 Win=17520 Len=0
683139 214.267328 117.194.116.117 -> 41.177.98.176 TCP 64 50714 > http [ACK] Seq=1128 Ack=13141 Win=17520 Len=0
683340 214.337209 117.194.116.117 -> 41.177.98.176 TCP 70 [TCP Dup ACK 683139#1] 50714 > http [ACK] Seq=1128 Ack=13141 Win=17520 Len=0 SLE=14601 SRE=16061
683350 214.347667 117.194.116.117 -> 41.177.98.176 TCP 70 [TCP Dup ACK 683139#2] 50714 > http [ACK] Seq=1128 Ack=13141 Win=17520 Len=0 SLE=14601 SRE=17521
683523 214.391519 117.194.116.117 -> 41.177.98.176 TCP 70 [TCP Dup ACK 683139#3] 50714 > http [ACK] Seq=1128 Ack=13141 Win=17520 Len=0 SLE=14601 SRE=18981
683668 214.422071 117.194.116.117 -> 41.177.98.176 TCP 70 [TCP Dup ACK 683139#4] 50714 > http [ACK] Seq=1128 Ack=13141 Win=17520 Len=0 SLE=14601 SRE=20050
683741 214.447628 117.194.116.117 -> 41.177.98.176 TCP 64 50714 > http [ACK] Seq=1128 Ack=20050 Win=17520 Len=0
686280 215.646569 117.194.116.117 -> 41.177.98.176 TCP 64 50714 > http [ACK] Seq=2129 Ack=20893 Win=16676 Len=0
721747 230.452684 117.194.116.117 -> 41.177.98.176 TCP 64 50714 > http [ACK] Seq=2129 Ack=20894 Win=16676 Len=0
735771 234.761832 117.194.116.117 -> 41.177.98.176 TCP 64 50714 > http [FIN, ACK] Seq=2129 Ack=20894 Win=16676 Len=0
735777 234.767098 117.194.116.117 -> 41.177.98.176 TCP 70 50718 > http [SYN] Seq=0 Win=8192 Len=0 MSS=1460 WS=4 SACK_PERM=1
735816 234.802441 117.194.116.117 -> 41.177.98.176 TCP 64 50718 > http [ACK] Seq=1 Ack=1 Win=17520 Len=0
746358 238.651595 117.194.116.117 -> 41.177.98.176 TCP 64 50718 > http [ACK] Seq=1068 Ack=1461 Win=17520 Len=0
746557 238.737531 117.194.116.117 -> 41.177.98.176 TCP 64 50718 > http [ACK] Seq=1068 Ack=4381 Win=17520 Len=0
746776 238.857122 117.194.116.117 -> 41.177.98.176 TCP 64 50718 > http [ACK] Seq=1068 Ack=7301 Win=17520 Len=0
746855 238.917650 117.194.116.117 -> 41.177.98.176 TCP 64 50718 > http [ACK] Seq=1068 Ack=10221 Win=17520 Len=0
746962 238.977636 117.194.116.117 -> 41.177.98.176 TCP 64 50718 > http [ACK] Seq=1068 Ack=13141 Win=17520 Len=0
747136 239.042200 117.194.116.117 -> 41.177.98.176 TCP 64 50718 > http [ACK] Seq=1068 Ack=16061 Win=17520 Len=0
747362 239.101808 117.194.116.117 -> 41.177.98.176 TCP 64 50718 > http [ACK] Seq=1068 Ack=18981 Win=17520 Len=0
747442 239.132314 117.194.116.117 -> 41.177.98.176 TCP 64 50718 > http [ACK] Seq=1068 Ack=21363 Win=17520 Len=0
776582 250.147274 117.194.116.117 -> 41.177.98.176 TCP 64 50718 > http [ACK] Seq=1068 Ack=21364 Win=17520 Len=0
786307 255.162466 117.194.116.117 -> 41.177.98.176 TCP 64 50718 > http [FIN, ACK] Seq=1068 Ack=21364 Win=17520 Len=0
792650 257.862280 117.194.116.117 -> 41.177.98.176 TCP 70 50720 > http [SYN] Seq=0 Win=8192 Len=0 MSS=1460 WS=4 SACK_PERM=1
792715 257.897155 117.194.116.117 -> 41.177.98.176 TCP 64 50720 > http [ACK] Seq=1 Ack=1 Win=17520 Len=0
793096 258.182325 117.194.116.117 -> 41.177.98.176 TCP 64 50720 > http [ACK] Seq=1036 Ack=2921 Win=17520 Len=0
793160 258.232433 117.194.116.117 -> 41.177.98.176 TCP 64 50720 > http [ACK] Seq=1036 Ack=5841 Win=17520 Len=0
793169 258.243244 117.194.116.117 -> 41.177.98.176 TCP 64 50720 > http [ACK] Seq=1036 Ack=8761 Win=17520 Len=0
793222 258.288251 117.194.116.117 -> 41.177.98.176 TCP 64 50720 > http [ACK] Seq=1036 Ack=11681 Win=17520 Len=0
793236 258.302354 117.194.116.117 -> 41.177.98.176 TCP 64 50720 > http [ACK] Seq=1036 Ack=14601 Win=17520 Len=0
793246 258.317696 117.194.116.117 -> 41.177.98.176 TCP 64 50720 > http [ACK] Seq=1036 Ack=17521 Win=17520 Len=0
793298 258.347266 117.194.116.117 -> 41.177.98.176 TCP 64 50720 > http [ACK] Seq=1036 Ack=20441 Win=17520 Len=0
793784 258.547350 117.194.116.117 -> 41.177.98.176 TCP 64 50720 > http [ACK] Seq=1036 Ack=21875 Win=16084 Len=0
801013 261.782505 117.194.116.117 -> 41.177.98.176 TCP 70 [TCP Dup ACK 800490#1] 50720 > http [ACK] Seq=2119 Ack=21875 Win=16084 Len=0 SLE=30128 SRE=31588
801030 261.797480 117.194.116.117 -> 41.177.98.176 TCP 70 [TCP Dup ACK 800490#2] 50720 > http [ACK] Seq=2119 Ack=21875 Win=16084 Len=0 SLE=30128 SRE=32336
801038 261.817566 117.194.116.117 -> 41.177.98.176 TCP 70 [TCP Dup ACK 800490#3] 50720 > http [ACK] Seq=2119 Ack=21875 Win=16084 Len=0 SLE=30128 SRE=33796
801045 261.822513 117.194.116.117 -> 41.177.98.176 TCP 70 [TCP Dup ACK 800490#4] 50720 > http [ACK] Seq=2119 Ack=21875 Win=16084 Len=0 SLE=30128 SRE=35256
801084 261.842492 117.194.116.117 -> 41.177.98.176 TCP 70 [TCP Dup ACK 800490#5] 50720 > http [ACK] Seq=2119 Ack=21875 Win=16084 Len=0 SLE=30128 SRE=36716
801086 261.847829 117.194.116.117 -> 41.177.98.176 TCP 70 [TCP Dup ACK 800490#6] 50720 > http [ACK] Seq=2119 Ack=21875 Win=16084 Len=0 SLE=30128 SRE=37464
801148 261.887449 117.194.116.117 -> 41.177.98.176 TCP 70 50720 > http [ACK] Seq=2119 Ack=24795 Win=17520 Len=0 SLE=30128 SRE=37464
801253 261.928244 117.194.116.117 -> 41.177.98.176 TCP 70 50720 > http [ACK] Seq=2119 Ack=27715 Win=17520 Len=0 SLE=30128 SRE=37464
801277 261.948073 117.194.116.117 -> 41.177.98.176 TCP 64 50720 > http [ACK] Seq=2119 Ack=37464 Win=17520 Len=0
801320 261.982654 117.194.116.117 -> 41.177.98.176 TCP 64 50720 > http [ACK] Seq=2119 Ack=40384 Win=17520 Len=0
801383 262.027377 117.194.116.117 -> 41.177.98.176 TCP 64 50720 > http [ACK] Seq=2119 Ack=43304 Win=17520 Len=0
801764 262.227402 117.194.116.117 -> 41.177.98.176 TCP 64 50720 > http [ACK] Seq=2119 Ack=43748 Win=17076 Len=0
827739 270.097564 117.194.116.117 -> 41.177.98.176 TCP 64 50720 > http [ACK] Seq=3082 Ack=45504 Win=17520 Len=0
827797 270.127607 117.194.116.117 -> 41.177.98.176 TCP 64 50720 > http [ACK] Seq=3082 Ack=48424 Win=17520 Len=0
827856 270.163213 117.194.116.117 -> 41.177.98.176 TCP 64 50720 > http [ACK] Seq=3082 Ack=51344 Win=17520 Len=0
827923 270.192538 117.194.116.117 -> 41.177.98.176 TCP 64 50720 > http [ACK] Seq=3082 Ack=54264 Win=17520 Len=0
827975 270.217297 117.194.116.117 -> 41.177.98.176 TCP 64 50720 > http [ACK] Seq=3082 Ack=56481 Win=17520 Len=0
828896 270.527308 117.194.116.117 -> 41.177.98.176 TCP 64 50720 > http [ACK] Seq=3910 Ack=57177 Win=16824 Len=0
863631 285.227339 117.194.116.117 -> 41.177.98.176 TCP 64 50720 > http [FIN, ACK] Seq=3910 Ack=57177 Win=16824 Len=0
863690 285.262347 117.194.116.117 -> 41.177.98.176 TCP 64 50720 > http [ACK] Seq=3911 Ack=57178 Win=16824 Len=0
925014 307.757165 117.194.116.117 -> 41.177.98.176 TCP 70 50724 > http [SYN] Seq=0 Win=8192 Len=0 MSS=1460 WS=4 SACK_PERM=1
925042 307.792595 117.194.116.117 -> 41.177.98.176 TCP 64 50724 > http [ACK] Seq=1 Ack=1 Win=17520 Len=0
927145 309.022359 117.194.116.117 -> 41.177.98.176 TCP 64 50724 > http [ACK] Seq=1047 Ack=2921 Win=17520 Len=0
927308 309.067435 117.194.116.117 -> 41.177.98.176 TCP 64 50724 > http [ACK] Seq=1047 Ack=5335 Win=17520 Len=0
927463 309.082552 117.194.116.117 -> 41.177.98.176 TCP 64 50724 > http [ACK] Seq=1047 Ack=8255 Win=17520 Len=0
927733 309.167433 117.194.116.117 -> 41.177.98.176 TCP 64 50724 > http [ACK] Seq=1047 Ack=10463 Win=17520 Len=0
927734 309.167437 117.194.116.117 -> 41.177.98.176 TCP 64 50724 > http [ACK] Seq=1047 Ack=13383 Win=17520 Len=0
927738 309.167506 117.194.116.117 -> 41.177.98.176 TCP 64 50724 > http [ACK] Seq=1047 Ack=15591 Win=17520 Len=0
928044 309.227603 117.194.116.117 -> 41.177.98.176 TCP 64 50724 > http [ACK] Seq=1047 Ack=18511 Win=17520 Len=0
928096 309.232570 117.194.116.117 -> 41.177.98.176 TCP 64 50724 > http [ACK] Seq=1047 Ack=20719 Win=17520 Len=0
928133 309.242344 117.194.116.117 -> 41.177.98.176 TCP 70 50725 > http [SYN] Seq=0 Win=8192 Len=0 MSS=1460 WS=4 SACK_PERM=1
928157 309.247582 117.194.116.117 -> 41.177.98.176 TCP 64 50724 > http [ACK] Seq=1047 Ack=23639 Win=17520 Len=0
928236 309.257570 117.194.116.117 -> 41.177.98.176 TCP 70 50726 > http [SYN] Seq=0 Win=8192 Len=0 MSS=1460 WS=4 SACK_PERM=1
928240 309.262753 117.194.116.117 -> 41.177.98.176 TCP 64 50724 > http [ACK] Seq=1047 Ack=25847 Win=17520 Len=0
928290 309.277530 117.194.116.117 -> 41.177.98.176 TCP 64 50724 > http [ACK] Seq=1047 Ack=28767 Win=17520 Len=0
928376 309.292615 117.194.116.117 -> 41.177.98.176 TCP 64 50724 > http [ACK] Seq=1047 Ack=30975 Win=17520 Len=0
928434 309.306789 117.194.116.117 -> 41.177.98.176 TCP 64 50724 > http [ACK] Seq=1047 Ack=33895 Win=17520 Len=0
928444 309.317445 117.194.116.117 -> 41.177.98.176 TCP 64 50725 > http [ACK] Seq=1 Ack=1 Win=17520 Len=0
928491 309.337372 117.194.116.117 -> 41.177.98.176 TCP 70 50727 > http [SYN] Seq=0 Win=8192 Len=0 MSS=1460 WS=4 SACK_PERM=1
928492 309.337376 117.194.116.117 -> 41.177.98.176 TCP 64 50724 > http [ACK] Seq=1047 Ack=36103 Win=17520 Len=0
928514 309.342565 117.194.116.117 -> 41.177.98.176 TCP 64 50724 > http [ACK] Seq=1047 Ack=39023 Win=17520 Len=0
928536 309.347666 117.194.116.117 -> 41.177.98.176 TCP 64 50726 > http [ACK] Seq=1 Ack=1 Win=17520 Len=0
928583 309.368365 117.194.116.117 -> 41.177.98.176 TCP 64 50724 > http [ACK] Seq=1047 Ack=41231 Win=17520 Len=0
928584 309.368369 117.194.116.117 -> 41.177.98.176 TCP 64 50724 > http [ACK] Seq=1047 Ack=44151 Win=17520 Len=0
928627 309.377441 117.194.116.117 -> 41.177.98.176 TCP 64 50724 > http [ACK] Seq=1047 Ack=46359 Win=17520 Len=0
928628 309.377446 117.194.116.117 -> 41.177.98.176 TCP 70 50728 > http [SYN] Seq=0 Win=8192 Len=0 MSS=1460 WS=4 SACK_PERM=1
928668 309.393178 117.194.116.117 -> 41.177.98.176 TCP 64 50724 > http [ACK] Seq=1047 Ack=49279 Win=17520 Len=0
928673 309.397888 117.194.116.117 -> 41.177.98.176 TCP 64 50727 > http [ACK] Seq=1 Ack=1 Win=17520 Len=0
928699 309.422611 117.194.116.117 -> 41.177.98.176 TCP 64 50728 > http [ACK] Seq=1 Ack=1 Win=17520 Len=0
929100 309.587826 117.194.116.117 -> 41.177.98.176 TCP 64 50724 > http [ACK] Seq=1047 Ack=50310 Win=16488 Len=0
929146 309.602165 117.194.116.117 -> 41.177.98.176 TCP 64 50725 > http [ACK] Seq=947 Ack=1382 Win=16136 Len=0
929165 309.607360 117.194.116.117 -> 41.177.98.176 TCP 64 50726 > http [ACK] Seq=946 Ack=1391 Win=16128 Len=0
929367 309.667302 117.194.116.117 -> 41.177.98.176 TCP 64 50727 > http [ACK] Seq=947 Ack=1382 Win=16136 Len=0
929409 309.682569 117.194.116.117 -> 41.177.98.176 TCP 64 50728 > http [ACK] Seq=946 Ack=1391 Win=16128 Len=0
973415 324.242573 117.194.116.117 -> 41.177.98.176 TCP 64 50724 > http [ACK] Seq=1047 Ack=50311 Win=16488 Len=0
974561 324.427403 117.194.116.117 -> 41.177.98.176 TCP 64 50725 > http [ACK] Seq=947 Ack=1383 Win=16136 Len=0
974575 324.433052 117.194.116.117 -> 41.177.98.176 TCP 64 50726 > http [ACK] Seq=946 Ack=1392 Win=16128 Len=0
974668 324.462339 117.194.116.117 -> 41.177.98.176 TCP 64 50728 > http [ACK] Seq=946 Ack=1392 Win=16128 Len=0
974719 324.467314 117.194.116.117 -> 41.177.98.176 TCP 64 50727 > http [ACK] Seq=947 Ack=1383 Win=16136 Len=0
990102 330.252383 117.194.116.117 -> 41.177.98.176 TCP 64 50727 > http [FIN, ACK] Seq=947 Ack=1383 Win=16136 Len=0
990115 330.257219 117.194.116.117 -> 41.177.98.176 TCP 64 50726 > http [FIN, ACK] Seq=946 Ack=1392 Win=16128 Len=0
990139 330.263206 117.194.116.117 -> 41.177.98.176 TCP 64 50725 > http [FIN, ACK] Seq=947 Ack=1383 Win=16136 Len=0
990140 330.263211 117.194.116.117 -> 41.177.98.176 TCP 64 50724 > http [FIN, ACK] Seq=1047 Ack=50311 Win=16488 Len=0
990161 330.267555 117.194.116.117 -> 41.177.98.176 TCP 64 50728 > http [FIN, ACK] Seq=946 Ack=1392 Win=16128 Len=0
