283757  95.095916 122.108.197.231 -> 41.177.26.143 TCP 78 34978 > smtp [SYN] Seq=0 Win=5840 Len=0 MSS=1460 TSval=2990061394 TSecr=0 WS=128
283904  95.133589 122.108.197.231 -> 41.177.26.143 TCP 70 34978 > smtp [ACK] Seq=1 Ack=1 Win=5888 Len=0 TSval=2990061432 TSecr=140351106
284956  95.330431 122.108.197.231 -> 41.177.26.143 TCP 70 34978 > smtp [ACK] Seq=1 Ack=45 Win=5888 Len=0 TSval=2990061629 TSecr=140351125
285870  95.590466 122.108.197.231 -> 41.177.26.143 TCP 76 [TCP segment of a reassembled PDU]
286483  95.774169 122.108.197.231 -> 41.177.26.143 TCP 76 [TCP segment of a reassembled PDU]
286756  95.824245 122.108.197.231 -> 41.177.26.143 TCP 70 34978 > smtp [FIN, ACK] Seq=631 Ack=168 Win=5888 Len=0 TSval=2990062123 TSecr=140351173
