397922 133.895602 122.37.124.39 -> 41.177.26.176 TCP 66 55413 > http [SYN] Seq=0 Win=65535 Len=0 MSS=1380 SACK_PERM=1
398046 133.930176 122.37.124.39 -> 41.177.26.176 TCP 64 55413 > http [ACK] Seq=1 Ack=1 Win=65535 Len=0
398308 134.005320 122.37.124.39 -> 41.177.26.176 TCP 64 [TCP Dup ACK 398150#1] 55413 > http [PSH, ACK] Seq=756 Ack=728 Win=64808 Len=0
398309 134.005360 122.37.124.39 -> 41.177.26.176 TCP 64 [TCP Dup ACK 398150#2] 55413 > http [PSH, ACK] Seq=756 Ack=728 Win=64808 Len=0
398313 134.006368 122.37.124.39 -> 41.177.26.176 TCP 64 55413 > http [ACK] Seq=756 Ack=998 Win=64538 Len=0
398326 134.007491 122.37.124.39 -> 41.177.26.176 TCP 64 55413 > http [ACK] Seq=756 Ack=3758 Win=65535 Len=0
398327 134.007496 122.37.124.39 -> 41.177.26.176 TCP 70 55413 > http [ACK] Seq=756 Ack=5138 Win=65535 Len=0 SLE=5731 SRE=5733
398328 134.007543 122.37.124.39 -> 41.177.26.176 TCP 70 [TCP Dup ACK 398327#1] 55413 > http [ACK] Seq=756 Ack=5138 Win=65535 Len=0 SLE=5731 SRE=5738
398329 134.007547 122.37.124.39 -> 41.177.26.176 TCP 64 55413 > http [ACK] Seq=756 Ack=5738 Win=64935 Len=0
398338 134.009693 122.37.124.39 -> 41.177.26.176 TCP 66 58314 > http [SYN] Seq=0 Win=65535 Len=0 MSS=1380 SACK_PERM=1
398388 134.040871 122.37.124.39 -> 41.177.26.176 TCP 64 [TCP Dup ACK 398329#1] 55413 > http [PSH, ACK] Seq=756 Ack=5738 Win=64935 Len=0
398393 134.042081 122.37.124.39 -> 41.177.26.176 TCP 64 55413 > http [ACK] Seq=756 Ack=7949 Win=65535 Len=0
398394 134.042509 122.37.124.39 -> 41.177.26.176 TCP 64 55413 > http [ACK] Seq=756 Ack=10882 Win=65535 Len=0
398397 134.042736 122.37.124.39 -> 41.177.26.176 TCP 64 55413 > http [ACK] Seq=756 Ack=13606 Win=65535 Len=0
398398 134.042931 122.37.124.39 -> 41.177.26.176 TCP 64 55413 > http [ACK] Seq=756 Ack=15416 Win=65535 Len=0
398401 134.043868 122.37.124.39 -> 41.177.26.176 TCP 64 58314 > http [ACK] Seq=1 Ack=1 Win=65535 Len=0
398513 134.081351 122.37.124.39 -> 41.177.26.176 TCP 64 58314 > http [ACK] Seq=366 Ack=831 Win=64705 Len=0
398580 134.118167 122.37.124.39 -> 41.177.26.176 TCP 64 58314 > http [ACK] Seq=715 Ack=2497 Win=65535 Len=0
398582 134.118272 122.37.124.39 -> 41.177.26.176 TCP 64 58314 > http [ACK] Seq=715 Ack=5257 Win=65535 Len=0
398665 134.153270 122.37.124.39 -> 41.177.26.176 TCP 64 55413 > http [ACK] Seq=1116 Ack=17097 Win=65535 Len=0
398666 134.153332 122.37.124.39 -> 41.177.26.176 TCP 64 58314 > http [ACK] Seq=715 Ack=7046 Win=65535 Len=0
398744 134.189694 122.37.124.39 -> 41.177.26.176 TCP 64 58314 > http [ACK] Seq=1071 Ack=8713 Win=65535 Len=0
398748 134.190060 122.37.124.39 -> 41.177.26.176 TCP 64 58314 > http [ACK] Seq=1071 Ack=11473 Win=65535 Len=0
398751 134.190315 122.37.124.39 -> 41.177.26.176 TCP 64 58314 > http [ACK] Seq=1071 Ack=14233 Win=65535 Len=0
398752 134.190558 122.37.124.39 -> 41.177.26.176 TCP 64 55413 > http [ACK] Seq=1467 Ack=20193 Win=65535 Len=0
398832 134.225162 122.37.124.39 -> 41.177.26.176 TCP 64 58314 > http [ACK] Seq=1071 Ack=16905 Win=65535 Len=0
398942 134.262179 122.37.124.39 -> 41.177.26.176 TCP 64 55413 > http [ACK] Seq=1816 Ack=20768 Win=64960 Len=0
399131 134.299928 122.37.124.39 -> 41.177.26.176 TCP 64 58314 > http [ACK] Seq=1421 Ack=17995 Win=64445 Len=0
399182 134.337253 122.37.124.39 -> 41.177.26.176 TCP 64 55413 > http [ACK] Seq=2165 Ack=21341 Win=64387 Len=0
399348 134.400280 122.37.124.39 -> 41.177.26.176 TCP 64 58314 > http [ACK] Seq=1772 Ack=18568 Win=65535 Len=0
399458 134.437583 122.37.124.39 -> 41.177.26.176 TCP 64 55413 > http [ACK] Seq=2517 Ack=23005 Win=65535 Len=0
399459 134.437588 122.37.124.39 -> 41.177.26.176 TCP 64 55413 > http [ACK] Seq=2517 Ack=25388 Win=65535 Len=0
399541 134.477390 122.37.124.39 -> 41.177.26.176 TCP 64 58314 > http [ACK] Seq=2130 Ack=20249 Win=65535 Len=0
399542 134.477403 122.37.124.39 -> 41.177.26.176 TCP 64 58314 > http [ACK] Seq=2130 Ack=21746 Win=65535 Len=0
399557 134.492524 122.37.124.39 -> 41.177.26.176 TCP 64 55413 > http [RST, ACK] Seq=2876 Ack=25388 Win=0 Len=0
399962 134.607130 122.37.124.39 -> 41.177.26.176 TCP 66 19908 > http [SYN] Seq=0 Win=65535 Len=0 MSS=1380 SACK_PERM=1
400146 134.643100 122.37.124.39 -> 41.177.26.176 TCP 64 19908 > http [ACK] Seq=1 Ack=1 Win=65535 Len=0
400396 134.680629 122.37.124.39 -> 41.177.26.176 TCP 64 [TCP Dup ACK 400180#1] 58314 > http [PSH, ACK] Seq=3630 Ack=22544 Win=64737 Len=0
400397 134.680703 122.37.124.39 -> 41.177.26.176 TCP 64 [TCP Dup ACK 400180#2] 58314 > http [PSH, ACK] Seq=3630 Ack=22544 Win=64737 Len=0
400399 134.680764 122.37.124.39 -> 41.177.26.176 TCP 64 [TCP Dup ACK 400180#3] 58314 > http [PSH, ACK] Seq=3630 Ack=22544 Win=64737 Len=0
400403 134.681628 122.37.124.39 -> 41.177.26.176 TCP 64 19908 > http [ACK] Seq=581 Ack=1664 Win=65535 Len=0
400412 134.682294 122.37.124.39 -> 41.177.26.176 TCP 64 58314 > http [ACK] Seq=3630 Ack=24213 Win=65535 Len=0
400414 134.682451 122.37.124.39 -> 41.177.26.176 TCP 64 58314 > http [ACK] Seq=3630 Ack=26973 Win=65535 Len=0
400417 134.682619 122.37.124.39 -> 41.177.26.176 TCP 64 58314 > http [ACK] Seq=3630 Ack=29733 Win=65535 Len=0
400421 134.682980 122.37.124.39 -> 41.177.26.176 TCP 64 58314 > http [ACK] Seq=3630 Ack=32405 Win=65535 Len=0
400427 134.683181 122.37.124.39 -> 41.177.26.176 TCP 64 58314 > http [ACK] Seq=3630 Ack=35165 Win=65535 Len=0
400429 134.683189 122.37.124.39 -> 41.177.26.176 TCP 70 58314 > http [ACK] Seq=3630 Ack=36545 Win=65535 Len=0 SLE=37925 SRE=38696
400432 134.683277 122.37.124.39 -> 41.177.26.176 TCP 64 58314 > http [ACK] Seq=3630 Ack=38696 Win=65535 Len=0
400623 134.716289 122.37.124.39 -> 41.177.26.176 TCP 64 [TCP Dup ACK 400437#1] 58314 > http [PSH, ACK] Seq=4206 Ack=38696 Win=65535 Len=0
400624 134.716294 122.37.124.39 -> 41.177.26.176 TCP 64 [TCP Dup ACK 400437#2] 58314 > http [PSH, ACK] Seq=4206 Ack=38696 Win=65535 Len=0
400626 134.716440 122.37.124.39 -> 41.177.26.176 TCP 64 [TCP Dup ACK 400437#3] 58314 > http [PSH, ACK] Seq=4206 Ack=38696 Win=65535 Len=0
400627 134.716692 122.37.124.39 -> 41.177.26.176 TCP 64 [TCP Dup ACK 400437#4] 58314 > http [PSH, ACK] Seq=4206 Ack=38696 Win=65535 Len=0
400636 134.716930 122.37.124.39 -> 41.177.26.176 TCP 64 [TCP Dup ACK 400437#5] 58314 > http [PSH, ACK] Seq=4206 Ack=38696 Win=65535 Len=0
400660 134.718576 122.37.124.39 -> 41.177.26.176 TCP 64 19908 > http [ACK] Seq=1156 Ack=3333 Win=65535 Len=0
400666 134.718985 122.37.124.39 -> 41.177.26.176 TCP 64 19908 > http [ACK] Seq=1156 Ack=6093 Win=65535 Len=0
400674 134.720644 122.37.124.39 -> 41.177.26.176 TCP 64 58314 > http [ACK] Seq=4206 Ack=40365 Win=65535 Len=0
400675 134.720734 122.37.124.39 -> 41.177.26.176 TCP 64 58314 > http [ACK] Seq=4206 Ack=43125 Win=65535 Len=0
400798 134.752413 122.37.124.39 -> 41.177.26.176 TCP 64 58314 > http [ACK] Seq=4206 Ack=45885 Win=65535 Len=0
400819 134.753918 122.37.124.39 -> 41.177.26.176 TCP 64 [TCP Dup ACK 400798#1] 58314 > http [PSH, ACK] Seq=4206 Ack=45885 Win=65535 Len=0
400820 134.754020 122.37.124.39 -> 41.177.26.176 TCP 64 19908 > http [ACK] Seq=1156 Ack=8853 Win=65535 Len=0
400823 134.754253 122.37.124.39 -> 41.177.26.176 TCP 64 19908 > http [ACK] Seq=1156 Ack=11525 Win=65535 Len=0
400826 134.754473 122.37.124.39 -> 41.177.26.176 TCP 64 19908 > http [ACK] Seq=1156 Ack=14285 Win=65535 Len=0
401040 134.787259 122.37.124.39 -> 41.177.26.176 TCP 64 58314 > http [ACK] Seq=4206 Ack=48557 Win=65535 Len=0
401054 134.789061 122.37.124.39 -> 41.177.26.176 TCP 64 19908 > http [ACK] Seq=1156 Ack=17045 Win=65535 Len=0
401056 134.789170 122.37.124.39 -> 41.177.26.176 TCP 64 19908 > http [ACK] Seq=1156 Ack=18579 Win=65535 Len=0
401263 134.823195 122.37.124.39 -> 41.177.26.176 TCP 64 58314 > http [ACK] Seq=4206 Ack=51317 Win=65535 Len=0
401303 134.825363 122.37.124.39 -> 41.177.26.176 TCP 64 19908 > http [ACK] Seq=1725 Ack=20247 Win=65535 Len=0
401362 134.825813 122.37.124.39 -> 41.177.26.176 TCP 64 19908 > http [ACK] Seq=1725 Ack=23007 Win=65535 Len=0
401381 134.826086 122.37.124.39 -> 41.177.26.176 TCP 64 19908 > http [ACK] Seq=1725 Ack=25767 Win=65535 Len=0
401382 134.826283 122.37.124.39 -> 41.177.26.176 TCP 64 19908 > http [ACK] Seq=1725 Ack=27551 Win=65535 Len=0
401562 134.858236 122.37.124.39 -> 41.177.26.176 TCP 64 58314 > http [ACK] Seq=4206 Ack=54077 Win=65535 Len=0
401566 134.861930 122.37.124.39 -> 41.177.26.176 TCP 64 19908 > http [ACK] Seq=2310 Ack=28141 Win=64945 Len=0
401796 134.892370 122.37.124.39 -> 41.177.26.176 TCP 64 58314 > http [ACK] Seq=4206 Ack=55509 Win=65535 Len=0
401822 134.899114 122.37.124.39 -> 41.177.26.176 TCP 64 19908 > http [ACK] Seq=2888 Ack=28748 Win=64338 Len=0
401952 134.931272 122.37.124.39 -> 41.177.26.176 TCP 64 58314 > http [ACK] Seq=4784 Ack=56194 Win=64850 Len=0
402009 134.936155 122.37.124.39 -> 41.177.26.176 TCP 64 19908 > http [ACK] Seq=3466 Ack=29794 Win=65535 Len=0
402175 134.967690 122.37.124.39 -> 41.177.26.176 TCP 64 58314 > http [ACK] Seq=5374 Ack=57862 Win=65535 Len=0
402176 134.967871 122.37.124.39 -> 41.177.26.176 TCP 64 58314 > http [ACK] Seq=5374 Ack=60622 Win=65535 Len=0
402213 134.971891 122.37.124.39 -> 41.177.26.176 TCP 64 19908 > http [ACK] Seq=4042 Ack=30358 Win=64971 Len=0
402335 135.002920 122.37.124.39 -> 41.177.26.176 TCP 64 58314 > http [ACK] Seq=5374 Ack=63382 Win=65535 Len=0
402340 135.003412 122.37.124.39 -> 41.177.26.176 TCP 64 58314 > http [ACK] Seq=5374 Ack=66054 Win=65535 Len=0
402512 135.040359 122.37.124.39 -> 41.177.26.176 TCP 64 58314 > http [ACK] Seq=5374 Ack=68814 Win=65535 Len=0
402517 135.040855 122.37.124.39 -> 41.177.26.176 TCP 64 58314 > http [ACK] Seq=5374 Ack=71574 Win=65535 Len=0
402689 135.082771 122.37.124.39 -> 41.177.26.176 TCP 64 58314 > http [ACK] Seq=5374 Ack=74246 Win=65535 Len=0
402690 135.082776 122.37.124.39 -> 41.177.26.176 TCP 64 58314 > http [ACK] Seq=5374 Ack=77006 Win=65535 Len=0
402790 135.118652 122.37.124.39 -> 41.177.26.176 TCP 64 58314 > http [ACK] Seq=5374 Ack=79766 Win=65535 Len=0
402791 135.118778 122.37.124.39 -> 41.177.26.176 TCP 64 58314 > http [ACK] Seq=5374 Ack=82438 Win=65535 Len=0
402880 135.153892 122.37.124.39 -> 41.177.26.176 TCP 64 58314 > http [ACK] Seq=5374 Ack=85198 Win=65535 Len=0
402881 135.154271 122.37.124.39 -> 41.177.26.176 TCP 64 58314 > http [ACK] Seq=5374 Ack=87958 Win=65535 Len=0
402884 135.154438 122.37.124.39 -> 41.177.26.176 TCP 64 58314 > http [ACK] Seq=5374 Ack=90630 Win=65535 Len=0
402976 135.190271 122.37.124.39 -> 41.177.26.176 TCP 64 58314 > http [ACK] Seq=5374 Ack=93390 Win=65535 Len=0
402978 135.190662 122.37.124.39 -> 41.177.26.176 TCP 70 58314 > http [ACK] Seq=5374 Ack=96150 Win=65535 Len=0 SLE=97442 SRE=97567
402981 135.190771 122.37.124.39 -> 41.177.26.176 TCP 64 58314 > http [ACK] Seq=5374 Ack=97567 Win=65535 Len=0
404070 135.402076 122.37.124.39 -> 41.177.26.176 TCP 64 19908 > http [ACK] Seq=5083 Ack=31189 Win=65535 Len=0
456386 148.984080 122.37.124.39 -> 41.177.26.176 TCP 66 41114 > http [SYN] Seq=0 Win=65535 Len=0 MSS=1380 SACK_PERM=1
456480 149.018471 122.37.124.39 -> 41.177.26.176 TCP 64 41114 > http [ACK] Seq=1 Ack=1 Win=65535 Len=0
457207 149.292151 122.37.124.39 -> 41.177.26.176 TCP 64 41114 > http [ACK] Seq=1072 Ack=363 Win=65173 Len=0
458233 149.740252 122.37.124.39 -> 41.177.26.176 TCP 66 7820 > http [SYN] Seq=0 Win=65535 Len=0 MSS=1380 SACK_PERM=1
458316 149.774521 122.37.124.39 -> 41.177.26.176 TCP 64 7820 > http [ACK] Seq=1 Ack=1 Win=65535 Len=0
458713 149.950145 122.37.124.39 -> 41.177.26.176 TCP 64 7820 > http [ACK] Seq=554 Ack=182 Win=65354 Len=0
458714 149.950150 122.37.124.39 -> 41.177.26.176 TCP 64 41114 > http [ACK] Seq=2151 Ack=725 Win=64811 Len=0
458771 149.973098 122.37.124.39 -> 41.177.26.176 TCP 64 58314 > http [ACK] Seq=5374 Ack=97568 Win=65535 Len=0
459354 150.229627 122.37.124.39 -> 41.177.26.176 TCP 64 58314 > http [RST, ACK] Seq=5374 Ack=97568 Win=0 Len=0
459391 150.241649 122.37.124.39 -> 41.177.26.176 TCP 64 19908 > http [ACK] Seq=5083 Ack=31190 Win=65535 Len=0
470233 155.229730 122.37.124.39 -> 41.177.26.176 TCP 64 19908 > http [RST, ACK] Seq=5083 Ack=31190 Win=0 Len=0
512639 164.780118 122.37.124.39 -> 41.177.26.176 TCP 64 41114 > http [ACK] Seq=2151 Ack=726 Win=64811 Len=0
512749 164.807835 122.37.124.39 -> 41.177.26.176 TCP 64 41114 > http [RST, ACK] Seq=2151 Ack=726 Win=0 Len=0
512799 164.820385 122.37.124.39 -> 41.177.26.176 TCP 64 7820 > http [ACK] Seq=554 Ack=183 Win=65354 Len=0
523090 169.807962 122.37.124.39 -> 41.177.26.176 TCP 64 7820 > http [RST, ACK] Seq=554 Ack=183 Win=0 Len=0
