320195 109.257702 122.68.55.143 -> 41.177.98.127 TCP 66 wacp > z39-50 [SYN] Seq=0 Win=64240 Len=0 MSS=1380 SACK_PERM=1
320433 109.317480 122.68.55.143 -> 41.177.98.127 TCP 64 wacp > z39-50 [ACK] Seq=1 Ack=1 Win=64240 Len=0
320434 109.317690 122.68.55.143 -> 41.177.98.127 TCP 149 wacp > z39-50 [PSH, ACK] Seq=1 Ack=1 Win=64240 Len=91
323091 110.666617 122.68.55.143 -> 41.177.98.127 TCP 159 wacp > z39-50 [PSH, ACK] Seq=92 Ack=71 Win=64170 Len=101
323255 110.747726 122.68.55.143 -> 41.177.98.127 TCP 66 wacp > z39-50 [PSH, ACK] Seq=193 Ack=95 Win=64146 Len=8
323357 110.812214 122.68.55.143 -> 41.177.98.127 TCP 64 wacp > z39-50 [ACK] Seq=201 Ack=96 Win=64146 Len=0
323358 110.812450 122.68.55.143 -> 41.177.98.127 TCP 64 wacp > z39-50 [FIN, ACK] Seq=201 Ack=96 Win=64146 Len=0
430379 140.647522 122.68.55.143 -> 41.177.98.127 TCP 66 prismiq-plugin > z39-50 [SYN] Seq=0 Win=64240 Len=0 MSS=1380 SACK_PERM=1
430582 140.706563 122.68.55.143 -> 41.177.98.127 TCP 64 prismiq-plugin > z39-50 [ACK] Seq=1 Ack=1 Win=64240 Len=0
430585 140.706960 122.68.55.143 -> 41.177.98.127 TCP 149 prismiq-plugin > z39-50 [PSH, ACK] Seq=1 Ack=1 Win=64240 Len=91
435723 142.108050 122.68.55.143 -> 41.177.98.127 TCP 159 prismiq-plugin > z39-50 [PSH, ACK] Seq=92 Ack=71 Win=64170 Len=101
436114 142.191025 122.68.55.143 -> 41.177.98.127 TCP 66 prismiq-plugin > z39-50 [PSH, ACK] Seq=193 Ack=95 Win=64146 Len=8
436407 142.255241 122.68.55.143 -> 41.177.98.127 TCP 64 prismiq-plugin > z39-50 [ACK] Seq=201 Ack=96 Win=64146 Len=0
436410 142.255441 122.68.55.143 -> 41.177.98.127 TCP 64 prismiq-plugin > z39-50 [FIN, ACK] Seq=201 Ack=96 Win=64146 Len=0
740665 236.510045 122.68.55.143 -> 41.177.98.127 TCP 66 xsync > z39-50 [SYN] Seq=0 Win=64240 Len=0 MSS=1380 SACK_PERM=1
740780 236.568849 122.68.55.143 -> 41.177.98.127 TCP 64 xsync > z39-50 [ACK] Seq=1 Ack=1 Win=64240 Len=0
740781 236.569244 122.68.55.143 -> 41.177.98.127 TCP 149 xsync > z39-50 [PSH, ACK] Seq=1 Ack=1 Win=64240 Len=91
744108 237.947078 122.68.55.143 -> 41.177.98.127 TCP 156 xsync > z39-50 [PSH, ACK] Seq=92 Ack=71 Win=64170 Len=98
744498 238.024764 122.68.55.143 -> 41.177.98.127 TCP 66 xsync > z39-50 [PSH, ACK] Seq=190 Ack=95 Win=64146 Len=8
744759 238.088916 122.68.55.143 -> 41.177.98.127 TCP 64 xsync > z39-50 [ACK] Seq=198 Ack=96 Win=64146 Len=0
744761 238.089343 122.68.55.143 -> 41.177.98.127 TCP 64 xsync > z39-50 [FIN, ACK] Seq=198 Ack=96 Win=64146 Len=0
