748496 239.672153 124.219.39.64 -> 41.177.26.91 TCP 78 60492 > http [SYN] Seq=0 Win=5840 Len=0 MSS=1460 SACK_PERM=1 TSval=781697707 TSecr=0 WS=128
749247 240.215333 124.219.39.64 -> 41.177.26.91 TCP 70 60492 > http [ACK] Seq=1 Ack=1 Win=5888 Len=0 TSval=781698245 TSecr=1509569425
751252 240.807302 124.219.39.64 -> 41.177.26.91 TCP 82 [TCP Dup ACK 749287#1] 60492 > http [ACK] Seq=658 Ack=1 Win=5888 Len=0 TSval=781698835 TSecr=1509569481 SLE=1449 SRE=2897
751254 240.807822 124.219.39.64 -> 41.177.26.91 TCP 82 [TCP Dup ACK 749287#2] 60492 > http [ACK] Seq=658 Ack=1 Win=5888 Len=0 TSval=781698836 TSecr=1509569481 SLE=1449 SRE=4345
752171 241.339776 124.219.39.64 -> 41.177.26.91 TCP 82 [TCP Dup ACK 749287#3] 60492 > http [ACK] Seq=658 Ack=1 Win=5888 Len=0 TSval=781699364 TSecr=1509569481 SLE=1449 SRE=5793
753890 241.952414 124.219.39.64 -> 41.177.26.91 TCP 70 60492 > http [ACK] Seq=658 Ack=5793 Win=8832 Len=0 TSval=781699986 TSecr=1509569592
754703 242.509520 124.219.39.64 -> 41.177.26.91 TCP 70 60492 > http [ACK] Seq=658 Ack=7241 Win=11648 Len=0 TSval=781700545 TSecr=1509569653
754738 242.520301 124.219.39.64 -> 41.177.26.91 TCP 70 60492 > http [ACK] Seq=658 Ack=8689 Win=14592 Len=0 TSval=781700547 TSecr=1509569653
754841 242.572040 124.219.39.64 -> 41.177.26.91 TCP 70 60492 > http [ACK] Seq=658 Ack=10137 Win=17536 Len=0 TSval=781700607 TSecr=1509569653
755991 243.292045 124.219.39.64 -> 41.177.26.91 TCP 70 60492 > http [ACK] Seq=658 Ack=11585 Win=20352 Len=0 TSval=781701314 TSecr=1509569709
755994 243.292692 124.219.39.64 -> 41.177.26.91 TCP 70 60492 > http [ACK] Seq=658 Ack=13033 Win=23296 Len=0 TSval=781701317 TSecr=1509569710
756038 243.332185 124.219.39.64 -> 41.177.26.91 TCP 70 60492 > http [ACK] Seq=658 Ack=14481 Win=26112 Len=0 TSval=781701367 TSecr=1509569715
757250 243.892341 124.219.39.64 -> 41.177.26.91 TCP 70 60492 > http [ACK] Seq=658 Ack=15929 Win=29056 Len=0 TSval=781701927 TSecr=1509569787
757499 243.959962 124.219.39.64 -> 41.177.26.91 TCP 70 60492 > http [ACK] Seq=658 Ack=17377 Win=32000 Len=0 TSval=781701995 TSecr=1509569787
757505 243.962258 124.219.39.64 -> 41.177.26.91 TCP 70 60492 > http [ACK] Seq=658 Ack=18825 Win=34816 Len=0 TSval=781701997 TSecr=1509569787
758951 244.409690 124.219.39.64 -> 41.177.26.91 TCP 82 [TCP Dup ACK 757505#1] 60492 > http [ACK] Seq=658 Ack=18825 Win=34816 Len=0 TSval=781702445 TSecr=1509569787 SLE=20273 SRE=21721
759119 244.540653 124.219.39.64 -> 41.177.26.91 TCP 82 [TCP Dup ACK 757505#2] 60492 > http [ACK] Seq=658 Ack=18825 Win=34816 Len=0 TSval=781702576 TSecr=1509569787 SLE=20273 SRE=23169
759134 244.552659 124.219.39.64 -> 41.177.26.91 TCP 90 [TCP Dup ACK 757505#3] 60492 > http [ACK] Seq=658 Ack=18825 Win=34816 Len=0 TSval=781702588 TSecr=1509569787 SLE=24617 SRE=24860 SLE=20273 SRE=23169
759527 244.832126 124.219.39.64 -> 41.177.26.91 TCP 82 [TCP Dup ACK 757505#4] 60492 > http [ACK] Seq=658 Ack=18825 Win=34816 Len=0 TSval=781702868 TSecr=1509569787 SLE=20273 SRE=24860
759972 245.079140 124.219.39.64 -> 41.177.26.91 TCP 82 [TCP Dup ACK 757505#5] 60492 > http [ACK] Seq=658 Ack=18825 Win=34816 Len=0 TSval=781703115 TSecr=1509569787 SLE=20273 SRE=26308
759982 245.080288 124.219.39.64 -> 41.177.26.91 TCP 82 [TCP Dup ACK 757505#6] 60492 > http [ACK] Seq=658 Ack=18825 Win=34816 Len=0 TSval=781703116 TSecr=1509569787 SLE=20273 SRE=27756
760187 245.170347 124.219.39.64 -> 41.177.26.91 TCP 70 60492 > http [ACK] Seq=658 Ack=27756 Win=37760 Len=0 TSval=781703206 TSecr=1509569913
760653 245.349555 124.219.39.64 -> 41.177.26.91 TCP 70 60492 > http [ACK] Seq=658 Ack=29204 Win=40704 Len=0 TSval=781703385 TSecr=1509569941
761594 245.723681 124.219.39.64 -> 41.177.26.91 TCP 70 60492 > http [ACK] Seq=658 Ack=30652 Win=43520 Len=0 TSval=781703756 TSecr=1509569966
761935 245.819750 124.219.39.64 -> 41.177.26.91 TCP 70 60492 > http [ACK] Seq=658 Ack=32100 Win=46464 Len=0 TSval=781703855 TSecr=1509569966
761947 245.822598 124.219.39.64 -> 41.177.26.91 TCP 70 60492 > http [ACK] Seq=658 Ack=33548 Win=49280 Len=0 TSval=781703858 TSecr=1509569975
762059 245.879714 124.219.39.64 -> 41.177.26.91 TCP 70 60492 > http [ACK] Seq=658 Ack=34996 Win=52224 Len=0 TSval=781703916 TSecr=1509569993
763523 246.405292 124.219.39.64 -> 41.177.26.91 TCP 70 60492 > http [ACK] Seq=658 Ack=36444 Win=55168 Len=0 TSval=781704438 TSecr=1509570030
763750 246.491320 124.219.39.64 -> 41.177.26.91 TCP 70 60492 > http [ACK] Seq=658 Ack=37892 Win=57984 Len=0 TSval=781704527 TSecr=1509570040
763846 246.509070 124.219.39.64 -> 41.177.26.91 TCP 82 [TCP Dup ACK 763750#1] 60492 > http [ACK] Seq=658 Ack=37892 Win=57984 Len=0 TSval=781704545 TSecr=1509570040 SLE=39340 SRE=40788
763849 246.511107 124.219.39.64 -> 41.177.26.91 TCP 82 [TCP Dup ACK 763750#2] 60492 > http [ACK] Seq=658 Ack=37892 Win=57984 Len=0 TSval=781704547 TSecr=1509570040 SLE=39340 SRE=42236
764789 246.922494 124.219.39.64 -> 41.177.26.91 TCP 82 [TCP Dup ACK 763750#3] 60492 > http [ACK] Seq=658 Ack=37892 Win=57984 Len=0 TSval=781704958 TSecr=1509570040 SLE=39340 SRE=43684
765563 247.311713 124.219.39.64 -> 41.177.26.91 TCP 82 [TCP Dup ACK 763750#4] 60492 > http [ACK] Seq=658 Ack=37892 Win=57984 Len=0 TSval=781705346 TSecr=1509570040 SLE=39340 SRE=45132
765570 247.316552 124.219.39.64 -> 41.177.26.91 TCP 82 [TCP Dup ACK 763750#5] 60492 > http [ACK] Seq=658 Ack=37892 Win=57984 Len=0 TSval=781705349 TSecr=1509570040 SLE=39340 SRE=46580
765579 247.319177 124.219.39.64 -> 41.177.26.91 TCP 82 [TCP Dup ACK 763750#6] 60492 > http [ACK] Seq=658 Ack=37892 Win=57984 Len=0 TSval=781705355 TSecr=1509570040 SLE=39340 SRE=48028
766650 247.830497 124.219.39.64 -> 41.177.26.91 TCP 82 [TCP Dup ACK 763750#7] 60492 > http [ACK] Seq=658 Ack=37892 Win=57984 Len=0 TSval=781705866 TSecr=1509570040 SLE=39340 SRE=49436
766835 247.903279 124.219.39.64 -> 41.177.26.91 TCP 82 [TCP Dup ACK 763750#8] 60492 > http [ACK] Seq=658 Ack=37892 Win=57984 Len=0 TSval=781705927 TSecr=1509570040 SLE=39340 SRE=50884
768187 248.362420 124.219.39.64 -> 41.177.26.91 TCP 82 [TCP Dup ACK 763750#9] 60492 > http [ACK] Seq=658 Ack=37892 Win=57984 Len=0 TSval=781706399 TSecr=1509570040 SLE=39340 SRE=52332
768459 248.520357 124.219.39.64 -> 41.177.26.91 TCP 82 [TCP Dup ACK 763750#10] 60492 > http [ACK] Seq=658 Ack=37892 Win=57984 Len=0 TSval=781706556 TSecr=1509570040 SLE=39340 SRE=53780
769203 248.900127 124.219.39.64 -> 41.177.26.91 TCP 82 [TCP Dup ACK 763750#11] 60492 > http [ACK] Seq=658 Ack=37892 Win=57984 Len=0 TSval=781706936 TSecr=1509570040 SLE=39340 SRE=55228
769307 248.970052 124.219.39.64 -> 41.177.26.91 TCP 70 60492 > http [ACK] Seq=658 Ack=55228 Win=48512 Len=0 TSval=781707006 TSecr=1509570300
774747 249.569989 124.219.39.64 -> 41.177.26.91 TCP 70 60492 > http [ACK] Seq=658 Ack=56676 Win=48512 Len=0 TSval=781707606 TSecr=1509570355
774796 249.572833 124.219.39.64 -> 41.177.26.91 TCP 70 60492 > http [ACK] Seq=658 Ack=58124 Win=47104 Len=0 TSval=781707607 TSecr=1509570355
776545 250.131567 124.219.39.64 -> 41.177.26.91 TCP 70 60492 > http [ACK] Seq=658 Ack=59572 Win=60928 Len=0 TSval=781708167 TSecr=1509570415
776649 250.180326 124.219.39.64 -> 41.177.26.91 TCP 70 60492 > http [ACK] Seq=658 Ack=61020 Win=63872 Len=0 TSval=781708216 TSecr=1509570415
776652 250.182224 124.219.39.64 -> 41.177.26.91 TCP 70 60492 > http [ACK] Seq=658 Ack=62468 Win=62720 Len=0 TSval=781708218 TSecr=1509570415
776703 250.231756 124.219.39.64 -> 41.177.26.91 TCP 70 60492 > http [ACK] Seq=658 Ack=63916 Win=64128 Len=0 TSval=781708268 TSecr=1509570415
778268 250.921036 124.219.39.64 -> 41.177.26.91 TCP 70 60492 > http [ACK] Seq=658 Ack=65364 Win=64128 Len=0 TSval=781708958 TSecr=1509570471
778351 250.969502 124.219.39.64 -> 41.177.26.91 TCP 70 60492 > http [ACK] Seq=658 Ack=66812 Win=64128 Len=0 TSval=781709006 TSecr=1509570471
778356 250.971546 124.219.39.64 -> 41.177.26.91 TCP 70 60492 > http [ACK] Seq=658 Ack=68260 Win=64128 Len=0 TSval=781709008 TSecr=1509570476
778418 251.041462 124.219.39.64 -> 41.177.26.91 TCP 70 60492 > http [ACK] Seq=658 Ack=69708 Win=64128 Len=0 TSval=781709076 TSecr=1509570476
778422 251.042077 124.219.39.64 -> 41.177.26.91 TCP 70 60492 > http [ACK] Seq=658 Ack=71156 Win=64128 Len=0 TSval=781709078 TSecr=1509570476
778938 251.269298 124.219.39.64 -> 41.177.26.91 TCP 70 60492 > http [ACK] Seq=658 Ack=72604 Win=64128 Len=0 TSval=781709306 TSecr=1509570481
779501 251.651499 124.219.39.64 -> 41.177.26.91 TCP 70 60492 > http [ACK] Seq=658 Ack=74012 Win=64128 Len=0 TSval=781709688 TSecr=1509570550
779606 251.702535 124.219.39.64 -> 41.177.26.91 TCP 70 60492 > http [ACK] Seq=658 Ack=75460 Win=64128 Len=0 TSval=781709739 TSecr=1509570555
779747 251.773423 124.219.39.64 -> 41.177.26.91 TCP 70 60492 > http [ACK] Seq=658 Ack=76908 Win=64128 Len=0 TSval=781709810 TSecr=1509570555
779811 251.790404 124.219.39.64 -> 41.177.26.91 TCP 70 60492 > http [ACK] Seq=658 Ack=78356 Win=62720 Len=0 TSval=781709827 TSecr=1509570562
780130 251.932039 124.219.39.64 -> 41.177.26.91 TCP 70 60492 > http [ACK] Seq=658 Ack=81252 Win=64128 Len=0 TSval=781709968 TSecr=1509570562
780310 252.038712 124.219.39.64 -> 41.177.26.91 TCP 70 60492 > http [ACK] Seq=658 Ack=82700 Win=64128 Len=0 TSval=781710076 TSecr=1509570585
780545 252.221963 124.219.39.64 -> 41.177.26.91 TCP 70 60492 > http [ACK] Seq=658 Ack=85596 Win=64128 Len=0 TSval=781710258 TSecr=1509570623
780755 252.309122 124.219.39.64 -> 41.177.26.91 TCP 82 [TCP Dup ACK 780545#1] 60492 > http [ACK] Seq=658 Ack=85596 Win=64128 Len=0 TSval=781710346 TSecr=1509570623 SLE=87044 SRE=88492
781260 252.480239 124.219.39.64 -> 41.177.26.91 TCP 82 [TCP Dup ACK 780545#2] 60492 > http [ACK] Seq=658 Ack=85596 Win=64128 Len=0 TSval=781710517 TSecr=1509570623 SLE=87044 SRE=89940
781532 252.569865 124.219.39.64 -> 41.177.26.91 TCP 90 [TCP Dup ACK 780545#3] 60492 > http [ACK] Seq=658 Ack=85596 Win=64128 Len=0 TSval=781710606 TSecr=1509570623 SLE=91388 SRE=92836 SLE=87044 SRE=89940
782185 252.948679 124.219.39.64 -> 41.177.26.91 TCP 90 [TCP Dup ACK 780545#4] 60492 > http [ACK] Seq=658 Ack=85596 Win=64128 Len=0 TSval=781710985 TSecr=1509570623 SLE=91388 SRE=94284 SLE=87044 SRE=89940
782186 252.950822 124.219.39.64 -> 41.177.26.91 TCP 90 [TCP Dup ACK 780545#5] 60492 > http [ACK] Seq=658 Ack=85596 Win=64128 Len=0 TSval=781710987 TSecr=1509570623 SLE=91388 SRE=95732 SLE=87044 SRE=89940
782188 252.952837 124.219.39.64 -> 41.177.26.91 TCP 90 [TCP Dup ACK 780545#6] 60492 > http [ACK] Seq=658 Ack=85596 Win=64128 Len=0 TSval=781710989 TSecr=1509570623 SLE=91388 SRE=97180 SLE=87044 SRE=89940
782238 253.021102 124.219.39.64 -> 41.177.26.91 TCP 90 [TCP Dup ACK 780545#7] 60492 > http [ACK] Seq=658 Ack=85596 Win=64128 Len=0 TSval=781711058 TSecr=1509570623 SLE=91388 SRE=98588 SLE=87044 SRE=89940
782313 253.090289 124.219.39.64 -> 41.177.26.91 TCP 90 [TCP Dup ACK 780545#8] 60492 > http [ACK] Seq=658 Ack=85596 Win=64128 Len=0 TSval=781711127 TSecr=1509570623 SLE=91388 SRE=100036 SLE=87044 SRE=89940
782318 253.092804 124.219.39.64 -> 41.177.26.91 TCP 82 60492 > http [ACK] Seq=658 Ack=89940 Win=59904 Len=0 TSval=781711129 TSecr=1509570715 SLE=91388 SRE=100036
783328 253.630538 124.219.39.64 -> 41.177.26.91 TCP 70 60492 > http [ACK] Seq=658 Ack=100036 Win=55680 Len=0 TSval=781711667 TSecr=1509570753
783336 253.633639 124.219.39.64 -> 41.177.26.91 TCP 70 60492 > http [ACK] Seq=658 Ack=101484 Win=64128 Len=0 TSval=781711670 TSecr=1509570753
783403 253.649824 124.219.39.64 -> 41.177.26.91 TCP 70 60492 > http [ACK] Seq=658 Ack=102932 Win=64128 Len=0 TSval=781711687 TSecr=1509570760
784411 254.153921 124.219.39.64 -> 41.177.26.91 TCP 82 [TCP Dup ACK 783403#1] 60492 > http [ACK] Seq=658 Ack=102932 Win=64128 Len=0 TSval=781712189 TSecr=1509570760 SLE=105828 SRE=107276
784519 254.201490 124.219.39.64 -> 41.177.26.91 TCP 90 [TCP Dup ACK 783403#2] 60492 > http [ACK] Seq=658 Ack=102932 Win=64128 Len=0 TSval=781712238 TSecr=1509570760 SLE=108724 SRE=110172 SLE=105828 SRE=107276
785836 254.801284 124.219.39.64 -> 41.177.26.91 TCP 90 [TCP Dup ACK 783403#3] 60492 > http [ACK] Seq=658 Ack=102932 Win=64128 Len=0 TSval=781712837 TSecr=1509570760 SLE=108724 SRE=111620 SLE=105828 SRE=107276
785839 254.801581 124.219.39.64 -> 41.177.26.91 TCP 90 [TCP Dup ACK 783403#4] 60492 > http [ACK] Seq=658 Ack=102932 Win=64128 Len=0 TSval=781712838 TSecr=1509570760 SLE=108724 SRE=113068 SLE=105828 SRE=107276
787099 255.494155 124.219.39.64 -> 41.177.26.91 TCP 90 60492 > http [ACK] Seq=658 Ack=104380 Win=62720 Len=0 TSval=781713531 TSecr=1509570938 SLE=108724 SRE=113068 SLE=105828 SRE=107276
787194 255.519971 124.219.39.64 -> 41.177.26.91 TCP 82 60492 > http [ACK] Seq=658 Ack=107276 Win=59904 Len=0 TSval=781713557 TSecr=1509570938 SLE=108724 SRE=113068
787199 255.521903 124.219.39.64 -> 41.177.26.91 TCP 70 60492 > http [ACK] Seq=658 Ack=113068 Win=59904 Len=0 TSval=781713559 TSecr=1509570938
788522 256.083920 124.219.39.64 -> 41.177.26.91 TCP 70 60492 > http [ACK] Seq=658 Ack=114516 Win=64128 Len=0 TSval=781714120 TSecr=1509571007
788524 256.091000 124.219.39.64 -> 41.177.26.91 TCP 70 60492 > http [ACK] Seq=658 Ack=115964 Win=64128 Len=0 TSval=781714128 TSecr=1509571010
788526 256.093264 124.219.39.64 -> 41.177.26.91 TCP 70 60492 > http [ACK] Seq=658 Ack=117412 Win=64128 Len=0 TSval=781714130 TSecr=1509571010
788842 256.160891 124.219.39.64 -> 41.177.26.91 TCP 70 60492 > http [ACK] Seq=658 Ack=118860 Win=64128 Len=0 TSval=781714198 TSecr=1509571010
790465 256.790012 124.219.39.64 -> 41.177.26.91 TCP 70 60492 > http [ACK] Seq=658 Ack=120308 Win=64128 Len=0 TSval=781714827 TSecr=1509571066
790479 256.793802 124.219.39.64 -> 41.177.26.91 TCP 70 60492 > http [ACK] Seq=658 Ack=121756 Win=64128 Len=0 TSval=781714829 TSecr=1509571067
790527 256.810831 124.219.39.64 -> 41.177.26.91 TCP 70 60492 > http [ACK] Seq=658 Ack=123164 Win=64128 Len=0 TSval=781714848 TSecr=1509571067
790538 256.813572 124.219.39.64 -> 41.177.26.91 TCP 70 60492 > http [ACK] Seq=658 Ack=124612 Win=64128 Len=0 TSval=781714851 TSecr=1509571074
791881 257.381624 124.219.39.64 -> 41.177.26.91 TCP 70 60492 > http [ACK] Seq=658 Ack=126060 Win=64128 Len=0 TSval=781715419 TSecr=1509571137
791978 257.434231 124.219.39.64 -> 41.177.26.91 TCP 70 60492 > http [ACK] Seq=658 Ack=127508 Win=64128 Len=0 TSval=781715468 TSecr=1509571137
792058 257.461655 124.219.39.64 -> 41.177.26.91 TCP 70 60492 > http [ACK] Seq=658 Ack=128956 Win=64128 Len=0 TSval=781715499 TSecr=1509571137
792178 257.523747 124.219.39.64 -> 41.177.26.91 TCP 70 60492 > http [ACK] Seq=658 Ack=130404 Win=64128 Len=0 TSval=781715558 TSecr=1509571139
792762 257.941894 124.219.39.64 -> 41.177.26.91 TCP 82 [TCP Dup ACK 792178#1] 60492 > http [ACK] Seq=658 Ack=130404 Win=64128 Len=0 TSval=781715979 TSecr=1509571139 SLE=131852 SRE=133300
792976 258.074263 124.219.39.64 -> 41.177.26.91 TCP 82 [TCP Dup ACK 792178#2] 60492 > http [ACK] Seq=658 Ack=130404 Win=64128 Len=0 TSval=781716111 TSecr=1509571139 SLE=131852 SRE=134748
793054 258.122369 124.219.39.64 -> 41.177.26.91 TCP 82 [TCP Dup ACK 792178#3] 60492 > http [ACK] Seq=658 Ack=130404 Win=64128 Len=0 TSval=781716160 TSecr=1509571139 SLE=131852 SRE=136196
793130 258.210143 124.219.39.64 -> 41.177.26.91 TCP 82 [TCP Dup ACK 792178#4] 60492 > http [ACK] Seq=658 Ack=130404 Win=64128 Len=0 TSval=781716247 TSecr=1509571139 SLE=131852 SRE=137644
793133 258.212265 124.219.39.64 -> 41.177.26.91 TCP 82 [TCP Dup ACK 792178#5] 60492 > http [ACK] Seq=658 Ack=130404 Win=64128 Len=0 TSval=781716249 TSecr=1509571139 SLE=131852 SRE=139092
793687 258.514472 124.219.39.64 -> 41.177.26.91 TCP 82 [TCP Dup ACK 792178#6] 60492 > http [ACK] Seq=658 Ack=130404 Win=64128 Len=0 TSval=781716548 TSecr=1509571139 SLE=131852 SRE=140540
794495 258.803255 124.219.39.64 -> 41.177.26.91 TCP 90 [TCP Dup ACK 792178#7] 60492 > http [ACK] Seq=658 Ack=130404 Win=64128 Len=0 TSval=781716838 TSecr=1509571139 SLE=141988 SRE=143436 SLE=131852 SRE=140540
795111 259.073187 124.219.39.64 -> 41.177.26.91 TCP 90 [TCP Dup ACK 792178#8] 60492 > http [ACK] Seq=658 Ack=130404 Win=64128 Len=0 TSval=781717111 TSecr=1509571139 SLE=141988 SRE=144884 SLE=131852 SRE=140540
795713 259.331094 124.219.39.64 -> 41.177.26.91 TCP 90 [TCP Dup ACK 792178#9] 60492 > http [ACK] Seq=658 Ack=130404 Win=64128 Len=0 TSval=781717368 TSecr=1509571139 SLE=141988 SRE=146332 SLE=131852 SRE=140540
796323 259.672849 124.219.39.64 -> 41.177.26.91 TCP 90 [TCP Dup ACK 792178#10] 60492 > http [ACK] Seq=658 Ack=130404 Win=64128 Len=0 TSval=781717709 TSecr=1509571139 SLE=141988 SRE=147740 SLE=131852 SRE=140540
796852 259.971790 124.219.39.64 -> 41.177.26.91 TCP 82 [TCP Dup ACK 792178#11] 60492 > http [ACK] Seq=658 Ack=130404 Win=64128 Len=0 TSval=781718010 TSecr=1509571139 SLE=131852 SRE=147740
796986 260.024083 124.219.39.64 -> 41.177.26.91 TCP 82 [TCP Dup ACK 792178#12] 60492 > http [ACK] Seq=658 Ack=130404 Win=64128 Len=0 TSval=781718061 TSecr=1509571139 SLE=131852 SRE=149188
797004 260.033029 124.219.39.64 -> 41.177.26.91 TCP 70 60492 > http [ACK] Seq=658 Ack=149188 Win=47104 Len=0 TSval=781718071 TSecr=1509571394
801316 261.971317 124.219.39.64 -> 41.177.26.91 TCP 70 60492 > http [ACK] Seq=658 Ack=150636 Win=64128 Len=0 TSval=781720009 TSecr=1509571585
803469 262.501680 124.219.39.64 -> 41.177.26.91 TCP 70 60492 > http [ACK] Seq=658 Ack=152084 Win=64128 Len=0 TSval=781720540 TSecr=1509571655
803502 262.512681 124.219.39.64 -> 41.177.26.91 TCP 70 60492 > http [ACK] Seq=658 Ack=153532 Win=64128 Len=0 TSval=781720550 TSecr=1509571655
804907 263.083076 124.219.39.64 -> 41.177.26.91 TCP 70 60492 > http [ACK] Seq=658 Ack=154980 Win=64128 Len=0 TSval=781721121 TSecr=1509571708
805143 263.209752 124.219.39.64 -> 41.177.26.91 TCP 70 60492 > http [ACK] Seq=658 Ack=156428 Win=64128 Len=0 TSval=781721248 TSecr=1509571708
805153 263.212067 124.219.39.64 -> 41.177.26.91 TCP 70 60492 > http [ACK] Seq=658 Ack=157876 Win=64128 Len=0 TSval=781721250 TSecr=1509571709
807172 263.671154 124.219.39.64 -> 41.177.26.91 TCP 70 60492 > http [ACK] Seq=658 Ack=159324 Win=64128 Len=0 TSval=781721709 TSecr=1509571766
808648 263.841485 124.219.39.64 -> 41.177.26.91 TCP 70 60492 > http [ACK] Seq=658 Ack=160772 Win=64128 Len=0 TSval=781721880 TSecr=1509571779
808737 263.853587 124.219.39.64 -> 41.177.26.91 TCP 70 60492 > http [ACK] Seq=658 Ack=162220 Win=64128 Len=0 TSval=781721892 TSecr=1509571779
810459 264.244214 124.219.39.64 -> 41.177.26.91 TCP 82 [TCP Dup ACK 808737#1] 60492 > http [ACK] Seq=658 Ack=162220 Win=64128 Len=0 TSval=781722281 TSecr=1509571779 SLE=163668 SRE=165116
811996 264.733308 124.219.39.64 -> 41.177.26.91 TCP 90 [TCP Dup ACK 808737#2] 60492 > http [ACK] Seq=658 Ack=162220 Win=64128 Len=0 TSval=781722769 TSecr=1509571779 SLE=166564 SRE=168012 SLE=163668 SRE=165116
813200 265.255342 124.219.39.64 -> 41.177.26.91 TCP 98 19692 > emwavemsg [ACK] Seq=1 Ack=1 Win=62721 Len=40[Packet size limited during capture]
815329 265.802305 124.219.39.64 -> 41.177.26.91 TCP 90 [TCP Dup ACK 808737#3] 60492 > http [ACK] Seq=658 Ack=162220 Win=64128 Len=0 TSval=781723841 TSecr=1509571779 SLE=163668 SRE=168012 SLE=169460 SRE=170908
815634 265.901102 124.219.39.64 -> 41.177.26.91 TCP 82 60492 > http [ACK] Seq=658 Ack=168012 Win=58496 Len=0 TSval=781723940 TSecr=1509571983 SLE=169460 SRE=170908
815639 265.903255 124.219.39.64 -> 41.177.26.91 TCP 82 [TCP Dup ACK 815634#1] 60492 > http [ACK] Seq=658 Ack=168012 Win=58496 Len=0 TSval=781723942 TSecr=1509571983 SLE=169460 SRE=172316
816663 266.402633 124.219.39.64 -> 41.177.26.91 TCP 82 [TCP Window Update] 60492 > http [ACK] Seq=658 Ack=168012 Win=61312 Len=0 TSval=781724441 TSecr=1509571983 SLE=169460 SRE=173764
816737 266.425349 124.219.39.64 -> 41.177.26.91 TCP 70 60492 > http [ACK] Seq=658 Ack=173764 Win=59904 Len=0 TSval=781724459 TSecr=1509572048
816739 266.425436 124.219.39.64 -> 41.177.26.91 TCP 70 60492 > http [ACK] Seq=658 Ack=175212 Win=61312 Len=0 TSval=781724462 TSecr=1509572048
816810 266.443807 124.219.39.64 -> 41.177.26.91 TCP 70 60492 > http [ACK] Seq=658 Ack=176660 Win=64128 Len=0 TSval=781724480 TSecr=1509572048
818170 266.953960 124.219.39.64 -> 41.177.26.91 TCP 70 60492 > http [ACK] Seq=658 Ack=178108 Win=64128 Len=0 TSval=781724992 TSecr=1509572100
818584 267.072023 124.219.39.64 -> 41.177.26.91 TCP 70 60492 > http [ACK] Seq=658 Ack=179556 Win=64128 Len=0 TSval=781725111 TSecr=1509572100
818586 267.073822 124.219.39.64 -> 41.177.26.91 TCP 70 60492 > http [ACK] Seq=658 Ack=181004 Win=62720 Len=0 TSval=781725113 TSecr=1509572100
820229 267.633983 124.219.39.64 -> 41.177.26.91 TCP 82 [TCP Window Update] 60492 > http [ACK] Seq=658 Ack=181004 Win=64128 Len=0 TSval=781725673 TSecr=1509572100 SLE=183900 SRE=185348
820270 267.652546 124.219.39.64 -> 41.177.26.91 TCP 82 [TCP Dup ACK 820229#1] 60492 > http [ACK] Seq=658 Ack=181004 Win=64128 Len=0 TSval=781725691 TSecr=1509572100 SLE=183900 SRE=186796
820651 267.792110 124.219.39.64 -> 41.177.26.91 TCP 82 [TCP Dup ACK 820229#2] 60492 > http [ACK] Seq=658 Ack=181004 Win=64128 Len=0 TSval=781725823 TSecr=1509572100 SLE=183900 SRE=188244
821764 268.249151 124.219.39.64 -> 41.177.26.91 TCP 82 60492 > http [ACK] Seq=658 Ack=182452 Win=62720 Len=0 TSval=781726281 TSecr=1509572219 SLE=183900 SRE=188244
823102 268.779882 124.219.39.64 -> 41.177.26.91 TCP 70 60492 > http [ACK] Seq=658 Ack=188244 Win=59904 Len=0 TSval=781726819 TSecr=1509572283
823114 268.784474 124.219.39.64 -> 41.177.26.91 TCP 82 [TCP Window Update] 60492 > http [ACK] Seq=658 Ack=188244 Win=64128 Len=0 TSval=781726822 TSecr=1509572283 SLE=183900 SRE=185348
825013 269.321114 124.219.39.64 -> 41.177.26.91 TCP 70 60492 > http [ACK] Seq=658 Ack=189692 Win=64128 Len=0 TSval=781727360 TSecr=1509572336
825024 269.322854 124.219.39.64 -> 41.177.26.91 TCP 70 60492 > http [ACK] Seq=658 Ack=191140 Win=62720 Len=0 TSval=781727362 TSecr=1509572336
825489 269.424081 124.219.39.64 -> 41.177.26.91 TCP 70 60492 > http [ACK] Seq=658 Ack=192588 Win=61312 Len=0 TSval=781727463 TSecr=1509572336
827070 269.894319 124.219.39.64 -> 41.177.26.91 TCP 70 60492 > http [ACK] Seq=658 Ack=194036 Win=64128 Len=0 TSval=781727933 TSecr=1509572390
827083 269.902604 124.219.39.64 -> 41.177.26.91 TCP 70 60492 > http [ACK] Seq=658 Ack=195484 Win=62720 Len=0 TSval=781727941 TSecr=1509572390
827547 270.035522 124.219.39.64 -> 41.177.26.91 TCP 70 60492 > http [ACK] Seq=658 Ack=196892 Win=64128 Len=0 TSval=781728070 TSecr=1509572400
828647 270.451756 124.219.39.64 -> 41.177.26.91 TCP 82 [TCP Dup ACK 827547#1] 60492 > http [ACK] Seq=658 Ack=196892 Win=64128 Len=0 TSval=781728491 TSecr=1509572400 SLE=199788 SRE=201236
829000 270.572349 124.219.39.64 -> 41.177.26.91 TCP 82 [TCP Dup ACK 827547#2] 60492 > http [ACK] Seq=658 Ack=196892 Win=64128 Len=0 TSval=781728612 TSecr=1509572400 SLE=199788 SRE=202684
829756 271.024766 124.219.39.64 -> 41.177.26.91 TCP 82 [TCP Dup ACK 827547#3] 60492 > http [ACK] Seq=658 Ack=196892 Win=64128 Len=0 TSval=781729063 TSecr=1509572400 SLE=199788 SRE=204132
830028 271.130735 124.219.39.64 -> 41.177.26.91 TCP 82 [TCP Dup ACK 827547#4] 60492 > http [ACK] Seq=658 Ack=196892 Win=64128 Len=0 TSval=781729170 TSecr=1509572400 SLE=199788 SRE=205580
830618 271.521109 124.219.39.64 -> 41.177.26.91 TCP 82 60492 > http [FIN, ACK] Seq=658 Ack=196892 Win=64128 Len=0 TSval=781729560 TSecr=1509572400 SLE=199788 SRE=205580
830657 271.541084 124.219.39.64 -> 41.177.26.91 TCP 64 60492 > http [RST] Seq=658 Win=0 Len=0
830658 271.542053 124.219.39.64 -> 41.177.26.91 TCP 64 60492 > http [RST] Seq=658 Win=0 Len=0
831619 271.871776 124.219.39.64 -> 41.177.26.91 TCP 64 60492 > http [RST] Seq=658 Win=0 Len=0
832278 272.131742 124.219.39.64 -> 41.177.26.91 TCP 64 60492 > http [RST] Seq=659 Win=0 Len=0
832287 272.133565 124.219.39.64 -> 41.177.26.91 TCP 64 60492 > http [RST] Seq=659 Win=0 Len=0
