7342   2.482770 128.132.91.123 -> 244.3.210.197 TCP 64 6929 > http [RST, ACK] Seq=1 Ack=1 Win=0 Len=0
7343   2.482775 128.132.91.123 -> 244.3.210.197 TCP 64 39574 > http [RST, ACK] Seq=1 Ack=1 Win=0 Len=0
7344   2.482779 128.132.91.123 -> 244.3.210.197 TCP 64 39369 > http [RST, ACK] Seq=1 Ack=1 Win=0 Len=0
7345   2.482783 128.132.91.123 -> 244.3.210.197 TCP 64 62731 > http [RST, ACK] Seq=1 Ack=1 Win=0 Len=0
7346   2.482787 128.132.91.123 -> 244.3.210.197 TCP 64 62252 > http [RST, ACK] Seq=1 Ack=1 Win=0 Len=0
7347   2.482796 128.132.91.123 -> 244.3.210.197 TCP 64 10037 > http [RST, ACK] Seq=1 Ack=1 Win=0 Len=0
7348   2.482800 128.132.91.123 -> 244.3.210.197 TCP 64 47672 > http [RST, ACK] Seq=1 Ack=1 Win=0 Len=0
