583704 185.989350 128.231.127.197 -> 41.177.98.143 TCP 71 efcp > vcom-tunnel [PSH, ACK] Seq=1 Ack=1 Win=64502 Len=13
584383 186.223012 128.231.127.197 -> 41.177.98.143 TCP 64 efcp > vcom-tunnel [ACK] Seq=14 Ack=28 Win=64496 Len=0
603083 191.311111 128.231.127.197 -> 41.177.98.143 TCP 76 efcp > vcom-tunnel [PSH, ACK] Seq=14 Ack=28 Win=64496 Len=18
603322 191.407645 128.231.127.197 -> 41.177.98.143 TCP 84 efcp > vcom-tunnel [PSH, ACK] Seq=32 Ack=100 Win=64478 Len=26
603744 191.582355 128.231.127.197 -> 41.177.98.143 TCP 64 efcp > vcom-tunnel [ACK] Seq=58 Ack=174 Win=64459 Len=0
604320 191.805406 128.231.127.197 -> 41.177.98.143 TCP 80 efcp > vcom-tunnel [PSH, ACK] Seq=58 Ack=174 Win=64459 Len=22
604800 191.901811 128.231.127.197 -> 41.177.98.143 TCP 81 efcp > vcom-tunnel [PSH, ACK] Seq=80 Ack=195 Win=64454 Len=23
605338 191.990794 128.231.127.197 -> 41.177.98.143 TCP 913 efcp > vcom-tunnel [PSH, ACK] Seq=103 Ack=195 Win=64454 Len=855
606040 192.238662 128.231.127.197 -> 41.177.98.143 TCP 64 efcp > vcom-tunnel [ACK] Seq=958 Ack=564 Win=64362 Len=0
606765 192.457396 128.231.127.197 -> 41.177.98.143 TCP 64 efcp > vcom-tunnel [ACK] Seq=958 Ack=716 Win=64324 Len=0
607319 192.676077 128.231.127.197 -> 41.177.98.143 TCP 64 efcp > vcom-tunnel [ACK] Seq=958 Ack=754 Win=64314 Len=0
607715 192.894891 128.231.127.197 -> 41.177.98.143 TCP 64 efcp > vcom-tunnel [ACK] Seq=958 Ack=792 Win=64305 Len=0
608181 193.113864 128.231.127.197 -> 41.177.98.143 TCP 64 efcp > vcom-tunnel [ACK] Seq=958 Ack=830 Win=64295 Len=0
608729 193.332422 128.231.127.197 -> 41.177.98.143 TCP 64 efcp > vcom-tunnel [ACK] Seq=958 Ack=914 Win=64274 Len=0
617909 196.504338 128.231.127.197 -> 41.177.98.143 TCP 64 efcp > vcom-tunnel [ACK] Seq=958 Ack=994 Win=64254 Len=0
618043 196.538347 128.231.127.197 -> 41.177.98.143 TCP 79 efcp > vcom-tunnel [PSH, ACK] Seq=958 Ack=1219 Win=64198 Len=21
618595 196.723058 128.231.127.197 -> 41.177.98.143 TCP 64 efcp > vcom-tunnel [ACK] Seq=979 Ack=1277 Win=64183 Len=0
622130 197.634585 128.231.127.197 -> 41.177.98.143 TCP 79 efcp > vcom-tunnel [PSH, ACK] Seq=979 Ack=1277 Win=64183 Len=21
623311 197.816855 128.231.127.197 -> 41.177.98.143 TCP 64 efcp > vcom-tunnel [ACK] Seq=1000 Ack=1335 Win=64515 Len=0
635722 200.862072 128.231.127.197 -> 41.177.98.143 TCP 84 efcp > vcom-tunnel [PSH, ACK] Seq=1000 Ack=1335 Win=64515 Len=26
636185 200.918525 128.231.127.197 -> 41.177.98.143 TCP 69 efcp > vcom-tunnel [PSH, ACK] Seq=1026 Ack=1409 Win=64496 Len=11
636444 200.953251 128.231.127.197 -> 41.177.98.143 TCP 73 efcp > vcom-tunnel [PSH, ACK] Seq=1037 Ack=2009 Win=64346 Len=15
637163 201.098053 128.231.127.197 -> 41.177.98.143 TCP 64 efcp > vcom-tunnel [ACK] Seq=1052 Ack=2900 Win=64515 Len=0
637425 201.164199 128.231.127.197 -> 41.177.98.143 TCP 143 efcp > vcom-tunnel [PSH, ACK] Seq=1052 Ack=2900 Win=64515 Len=85
637477 201.198361 128.231.127.197 -> 41.177.98.143 TCP 65 efcp > vcom-tunnel [PSH, ACK] Seq=1137 Ack=2911 Win=64512 Len=7
638085 201.395669 128.231.127.197 -> 41.177.98.143 TCP 64 efcp > vcom-tunnel [ACK] Seq=1144 Ack=4822 Win=64515 Len=0
638357 201.463846 128.231.127.197 -> 41.177.98.143 TCP 140 efcp > vcom-tunnel [PSH, ACK] Seq=1144 Ack=4822 Win=64515 Len=82
638711 201.584297 128.231.127.197 -> 41.177.98.143 TCP 132 efcp > vcom-tunnel [PSH, ACK] Seq=1226 Ack=5124 Win=64439 Len=74
639070 201.678756 128.231.127.197 -> 41.177.98.143 TCP 132 efcp > vcom-tunnel [PSH, ACK] Seq=1300 Ack=6376 Win=64515 Len=74
639250 201.747434 128.231.127.197 -> 41.177.98.143 TCP 64 [TCP Dup ACK 639070#1] efcp > vcom-tunnel [PSH, ACK] Seq=1374 Ack=6376 Win=64515 Len=0
639257 201.748263 128.231.127.197 -> 41.177.98.143 TCP 64 efcp > vcom-tunnel [ACK] Seq=1374 Ack=7817 Win=64515 Len=0
639303 201.756234 128.231.127.197 -> 41.177.98.143 TCP 132 efcp > vcom-tunnel [PSH, ACK] Seq=1374 Ack=7817 Win=64515 Len=74
639520 201.850724 128.231.127.197 -> 41.177.98.143 TCP 64 [TCP Dup ACK 639303#1] efcp > vcom-tunnel [PSH, ACK] Seq=1448 Ack=7817 Win=64515 Len=0
639525 201.851259 128.231.127.197 -> 41.177.98.143 TCP 64 efcp > vcom-tunnel [ACK] Seq=1448 Ack=10577 Win=64515 Len=0
639563 201.874173 128.231.127.197 -> 41.177.98.143 TCP 84 efcp > vcom-tunnel [PSH, ACK] Seq=1448 Ack=10721 Win=64479 Len=26
640348 202.082494 128.231.127.197 -> 41.177.98.143 TCP 64 efcp > vcom-tunnel [ACK] Seq=1474 Ack=10795 Win=64460 Len=0
672559 209.660594 128.231.127.197 -> 41.177.98.143 TCP 132 efcp > vcom-tunnel [PSH, ACK] Seq=1474 Ack=10795 Win=64460 Len=74
672788 209.764011 128.231.127.197 -> 41.177.98.143 TCP 64 efcp > vcom-tunnel [ACK] Seq=1548 Ack=13555 Win=64515 Len=0
672805 209.780197 128.231.127.197 -> 41.177.98.143 TCP 132 efcp > vcom-tunnel [PSH, ACK] Seq=1548 Ack=13899 Win=64429 Len=74
673021 209.902343 128.231.127.197 -> 41.177.98.143 TCP 132 efcp > vcom-tunnel [PSH, ACK] Seq=1622 Ack=15250 Win=64515 Len=74
673103 209.958397 128.231.127.197 -> 41.177.98.143 TCP 64 efcp > vcom-tunnel [ACK] Seq=1696 Ack=17295 Win=64515 Len=0
673107 209.969925 128.231.127.197 -> 41.177.98.143 TCP 132 efcp > vcom-tunnel [PSH, ACK] Seq=1696 Ack=17295 Win=64515 Len=74
673287 210.024946 128.231.127.197 -> 41.177.98.143 TCP 64 efcp > vcom-tunnel [ACK] Seq=1770 Ack=19422 Win=64515 Len=0
714078 227.774979 128.231.127.197 -> 41.177.98.143 TCP 132 efcp > vcom-tunnel [PSH, ACK] Seq=1770 Ack=19422 Win=64515 Len=74
714203 227.851307 128.231.127.197 -> 41.177.98.143 TCP 64 efcp > vcom-tunnel [ACK] Seq=1844 Ack=22059 Win=64515 Len=0
714224 227.864264 128.231.127.197 -> 41.177.98.143 TCP 133 efcp > vcom-tunnel [PSH, ACK] Seq=1844 Ack=22059 Win=64515 Len=75
714412 227.957724 128.231.127.197 -> 41.177.98.143 TCP 64 efcp > vcom-tunnel [ACK] Seq=1919 Ack=24819 Win=64515 Len=0
714590 228.017233 128.231.127.197 -> 41.177.98.143 TCP 133 efcp > vcom-tunnel [PSH, ACK] Seq=1919 Ack=26176 Win=64175 Len=75
714847 228.105055 128.231.127.197 -> 41.177.98.143 TCP 64 efcp > vcom-tunnel [ACK] Seq=1994 Ack=28141 Win=64515 Len=0
714868 228.116411 128.231.127.197 -> 41.177.98.143 TCP 133 efcp > vcom-tunnel [PSH, ACK] Seq=1994 Ack=28141 Win=64515 Len=75
715127 228.202689 128.231.127.197 -> 41.177.98.143 TCP 64 efcp > vcom-tunnel [ACK] Seq=2069 Ack=30714 Win=64515 Len=0
780022 251.900191 128.231.127.197 -> 41.177.98.143 TCP 133 efcp > vcom-tunnel [PSH, ACK] Seq=2069 Ack=30714 Win=64515 Len=75
780318 252.045657 128.231.127.197 -> 41.177.98.143 TCP 64 efcp > vcom-tunnel [ACK] Seq=2144 Ack=33294 Win=64515 Len=0
780330 252.058985 128.231.127.197 -> 41.177.98.143 TCP 133 efcp > vcom-tunnel [PSH, ACK] Seq=2144 Ack=33294 Win=64515 Len=75
780442 252.127183 128.231.127.197 -> 41.177.98.143 TCP 64 efcp > vcom-tunnel [ACK] Seq=2219 Ack=36054 Win=64515 Len=0
780470 252.176279 128.231.127.197 -> 41.177.98.143 TCP 133 efcp > vcom-tunnel [PSH, ACK] Seq=2219 Ack=36358 Win=64439 Len=75
780676 252.267127 128.231.127.197 -> 41.177.98.143 TCP 64 efcp > vcom-tunnel [ACK] Seq=2294 Ack=39118 Win=64515 Len=0
780677 252.267132 128.231.127.197 -> 41.177.98.143 TCP 64 efcp > vcom-tunnel [ACK] Seq=2294 Ack=40858 Win=64515 Len=0
780734 252.295854 128.231.127.197 -> 41.177.98.143 TCP 133 efcp > vcom-tunnel [PSH, ACK] Seq=2294 Ack=40858 Win=64515 Len=75
780962 252.381821 128.231.127.197 -> 41.177.98.143 TCP 64 efcp > vcom-tunnel [ACK] Seq=2369 Ack=43540 Win=64515 Len=0
793267 258.326722 128.231.127.197 -> 41.177.98.143 TCP 133 efcp > vcom-tunnel [PSH, ACK] Seq=2369 Ack=43540 Win=64515 Len=75
793377 258.381126 128.231.127.197 -> 41.177.98.143 TCP 64 [TCP Dup ACK 793267#1] efcp > vcom-tunnel [PSH, ACK] Seq=2444 Ack=43540 Win=64515 Len=0
793381 258.381569 128.231.127.197 -> 41.177.98.143 TCP 64 efcp > vcom-tunnel [ACK] Seq=2444 Ack=46300 Win=64515 Len=0
793402 258.395483 128.231.127.197 -> 41.177.98.143 TCP 133 efcp > vcom-tunnel [PSH, ACK] Seq=2444 Ack=46316 Win=64511 Len=75
793629 258.496722 128.231.127.197 -> 41.177.98.143 TCP 64 efcp > vcom-tunnel [ACK] Seq=2519 Ack=48477 Win=64515 Len=0
854547 282.490712 128.231.127.197 -> 41.177.98.143 TCP 133 efcp > vcom-tunnel [PSH, ACK] Seq=2519 Ack=48477 Win=64515 Len=75
854962 282.604887 128.231.127.197 -> 41.177.98.143 TCP 64 efcp > vcom-tunnel [ACK] Seq=2594 Ack=51237 Win=64515 Len=0
855033 282.623879 128.231.127.197 -> 41.177.98.143 TCP 133 efcp > vcom-tunnel [PSH, ACK] Seq=2594 Ack=52059 Win=64309 Len=75
855330 282.733179 128.231.127.197 -> 41.177.98.143 TCP 64 efcp > vcom-tunnel [ACK] Seq=2669 Ack=54819 Win=64515 Len=0
855331 282.733185 128.231.127.197 -> 41.177.98.143 TCP 64 efcp > vcom-tunnel [ACK] Seq=2669 Ack=56879 Win=64515 Len=0
855560 282.802095 128.231.127.197 -> 41.177.98.143 TCP 133 efcp > vcom-tunnel [PSH, ACK] Seq=2669 Ack=56879 Win=64515 Len=75
855713 282.863780 128.231.127.197 -> 41.177.98.143 TCP 64 efcp > vcom-tunnel [ACK] Seq=2744 Ack=59639 Win=64515 Len=0
855714 282.863785 128.231.127.197 -> 41.177.98.143 TCP 64 efcp > vcom-tunnel [ACK] Seq=2744 Ack=61699 Win=64515 Len=0
855789 282.885837 128.231.127.197 -> 41.177.98.143 TCP 133 efcp > vcom-tunnel [PSH, ACK] Seq=2744 Ack=61699 Win=64515 Len=75
856570 283.079295 128.231.127.197 -> 41.177.98.143 TCP 64 efcp > vcom-tunnel [ACK] Seq=2819 Ack=64459 Win=64515 Len=0
856571 283.079299 128.231.127.197 -> 41.177.98.143 TCP 64 efcp > vcom-tunnel [ACK] Seq=2819 Ack=66614 Win=64515 Len=0
864600 285.713074 128.231.127.197 -> 41.177.98.143 TCP 133 efcp > vcom-tunnel [PSH, ACK] Seq=2819 Ack=66614 Win=64515 Len=75
864751 285.786759 128.231.127.197 -> 41.177.98.143 TCP 64 efcp > vcom-tunnel [ACK] Seq=2894 Ack=69374 Win=64515 Len=0
864752 285.786764 128.231.127.197 -> 41.177.98.143 TCP 64 efcp > vcom-tunnel [ACK] Seq=2894 Ack=71442 Win=64515 Len=0
864781 285.809595 128.231.127.197 -> 41.177.98.143 TCP 133 efcp > vcom-tunnel [PSH, ACK] Seq=2894 Ack=71442 Win=64515 Len=75
864936 285.871873 128.231.127.197 -> 41.177.98.143 TCP 64 efcp > vcom-tunnel [ACK] Seq=2969 Ack=74202 Win=64515 Len=0
864937 285.871878 128.231.127.197 -> 41.177.98.143 TCP 64 efcp > vcom-tunnel [ACK] Seq=2969 Ack=76270 Win=64515 Len=0
870406 287.882714 128.231.127.197 -> 41.177.98.143 TCP 133 efcp > vcom-tunnel [PSH, ACK] Seq=2969 Ack=76270 Win=64515 Len=75
870828 287.993480 128.231.127.197 -> 41.177.98.143 TCP 64 efcp > vcom-tunnel [ACK] Seq=3044 Ack=79030 Win=64515 Len=0
870869 288.013024 128.231.127.197 -> 41.177.98.143 TCP 133 efcp > vcom-tunnel [PSH, ACK] Seq=3044 Ack=80121 Win=64242 Len=75
871042 288.086757 128.231.127.197 -> 41.177.98.143 TCP 64 efcp > vcom-tunnel [ACK] Seq=3119 Ack=82881 Win=64515 Len=0
871564 288.254695 128.231.127.197 -> 41.177.98.143 TCP 64 efcp > vcom-tunnel [ACK] Seq=3119 Ack=83176 Win=64441 Len=0
905436 298.482734 128.231.127.197 -> 41.177.98.143 TCP 133 efcp > vcom-tunnel [PSH, ACK] Seq=3119 Ack=83176 Win=64441 Len=75
905721 298.571246 128.231.127.197 -> 41.177.98.143 TCP 64 efcp > vcom-tunnel [ACK] Seq=3194 Ack=85936 Win=64515 Len=0
905722 298.571252 128.231.127.197 -> 41.177.98.143 TCP 64 efcp > vcom-tunnel [ACK] Seq=3194 Ack=87900 Win=64515 Len=0
905781 298.594169 128.231.127.197 -> 41.177.98.143 TCP 133 efcp > vcom-tunnel [PSH, ACK] Seq=3194 Ack=87900 Win=64515 Len=75
906134 298.705001 128.231.127.197 -> 41.177.98.143 TCP 64 efcp > vcom-tunnel [ACK] Seq=3269 Ack=90660 Win=64515 Len=0
906135 298.705007 128.231.127.197 -> 41.177.98.143 TCP 64 efcp > vcom-tunnel [ACK] Seq=3269 Ack=92120 Win=64515 Len=0
911662 301.599746 128.231.127.197 -> 41.177.98.143 TCP 133 efcp > vcom-tunnel [PSH, ACK] Seq=3269 Ack=92120 Win=64515 Len=75
911875 301.653543 128.231.127.197 -> 41.177.98.143 TCP 64 efcp > vcom-tunnel [ACK] Seq=3344 Ack=94880 Win=64515 Len=0
911933 301.669883 128.231.127.197 -> 41.177.98.143 TCP 133 efcp > vcom-tunnel [PSH, ACK] Seq=3344 Ack=95542 Win=64349 Len=75
912120 301.776315 128.231.127.197 -> 41.177.98.143 TCP 64 efcp > vcom-tunnel [ACK] Seq=3419 Ack=97630 Win=64515 Len=0
936305 311.883111 128.231.127.197 -> 41.177.98.143 TCP 133 efcp > vcom-tunnel [PSH, ACK] Seq=3419 Ack=97630 Win=64515 Len=75
936683 311.963251 128.231.127.197 -> 41.177.98.143 TCP 64 efcp > vcom-tunnel [ACK] Seq=3494 Ack=100383 Win=64515 Len=0
936757 311.977483 128.231.127.197 -> 41.177.98.143 TCP 133 efcp > vcom-tunnel [PSH, ACK] Seq=3494 Ack=100383 Win=64515 Len=75
937125 312.046472 128.231.127.197 -> 41.177.98.143 TCP 64 efcp > vcom-tunnel [ACK] Seq=3569 Ack=102281 Win=64515 Len=0
937225 312.088418 128.231.127.197 -> 41.177.98.143 TCP 133 efcp > vcom-tunnel [PSH, ACK] Seq=3569 Ack=102281 Win=64515 Len=75
937459 312.177507 128.231.127.197 -> 41.177.98.143 TCP 64 efcp > vcom-tunnel [ACK] Seq=3644 Ack=104462 Win=64515 Len=0
937476 312.188696 128.231.127.197 -> 41.177.98.143 TCP 133 efcp > vcom-tunnel [PSH, ACK] Seq=3644 Ack=104462 Win=64515 Len=75
937801 312.307460 128.231.127.197 -> 41.177.98.143 TCP 64 efcp > vcom-tunnel [ACK] Seq=3719 Ack=107222 Win=64515 Len=0
938147 312.426652 128.231.127.197 -> 41.177.98.143 TCP 64 efcp > vcom-tunnel [ACK] Seq=3719 Ack=107965 Win=64329 Len=0
950561 315.258817 128.231.127.197 -> 41.177.98.143 TCP 133 efcp > vcom-tunnel [PSH, ACK] Seq=3719 Ack=107965 Win=64329 Len=75
950863 315.364967 128.231.127.197 -> 41.177.98.143 TCP 64 efcp > vcom-tunnel [ACK] Seq=3794 Ack=110496 Win=64515 Len=0
950882 315.378138 128.231.127.197 -> 41.177.98.143 TCP 133 efcp > vcom-tunnel [PSH, ACK] Seq=3794 Ack=110496 Win=64515 Len=75
951095 315.447632 128.231.127.197 -> 41.177.98.143 TCP 64 efcp > vcom-tunnel [ACK] Seq=3869 Ack=112832 Win=64515 Len=0
967085 322.099625 128.231.127.197 -> 41.177.98.143 TCP 133 efcp > vcom-tunnel [PSH, ACK] Seq=3869 Ack=112832 Win=64515 Len=75
967351 322.200323 128.231.127.197 -> 41.177.98.143 TCP 64 efcp > vcom-tunnel [ACK] Seq=3944 Ack=115096 Win=64515 Len=0
967516 322.212058 128.231.127.197 -> 41.177.98.143 TCP 133 efcp > vcom-tunnel [PSH, ACK] Seq=3944 Ack=115096 Win=64515 Len=75
968181 322.346526 128.231.127.197 -> 41.177.98.143 TCP 64 efcp > vcom-tunnel [ACK] Seq=4019 Ack=117856 Win=64515 Len=0
968255 322.401761 128.231.127.197 -> 41.177.98.143 TCP 133 efcp > vcom-tunnel [PSH, ACK] Seq=4019 Ack=118833 Win=64270 Len=75
968387 322.512900 128.231.127.197 -> 41.177.98.143 TCP 64 efcp > vcom-tunnel [ACK] Seq=4094 Ack=121593 Win=64515 Len=0
968435 322.528419 128.231.127.197 -> 41.177.98.143 TCP 133 efcp > vcom-tunnel [PSH, ACK] Seq=4094 Ack=122011 Win=64410 Len=75
968681 322.624880 128.231.127.197 -> 41.177.98.143 TCP 64 efcp > vcom-tunnel [ACK] Seq=4169 Ack=123862 Win=64515 Len=0
976439 325.257579 128.231.127.197 -> 41.177.98.143 TCP 133 efcp > vcom-tunnel [PSH, ACK] Seq=4169 Ack=123862 Win=64515 Len=75
976595 325.345365 128.231.127.197 -> 41.177.98.143 TCP 64 efcp > vcom-tunnel [ACK] Seq=4244 Ack=126622 Win=64515 Len=0
976617 325.359626 128.231.127.197 -> 41.177.98.143 TCP 133 efcp > vcom-tunnel [PSH, ACK] Seq=4244 Ack=126827 Win=64463 Len=75
976977 325.528522 128.231.127.197 -> 41.177.98.143 TCP 64 efcp > vcom-tunnel [ACK] Seq=4319 Ack=129587 Win=64515 Len=0
976978 325.528527 128.231.127.197 -> 41.177.98.143 TCP 64 efcp > vcom-tunnel [ACK] Seq=4319 Ack=131266 Win=64515 Len=0
977229 325.588978 128.231.127.197 -> 41.177.98.143 TCP 133 efcp > vcom-tunnel [PSH, ACK] Seq=4319 Ack=131266 Win=64515 Len=75
977578 325.678116 128.231.127.197 -> 41.177.98.143 TCP 64 efcp > vcom-tunnel [ACK] Seq=4394 Ack=134026 Win=64515 Len=0
977579 325.678121 128.231.127.197 -> 41.177.98.143 TCP 64 efcp > vcom-tunnel [ACK] Seq=4394 Ack=136786 Win=64515 Len=0
977618 325.710910 128.231.127.197 -> 41.177.98.143 TCP 133 efcp > vcom-tunnel [PSH, ACK] Seq=4394 Ack=137692 Win=64288 Len=75
978165 325.802075 128.231.127.197 -> 41.177.98.143 TCP 64 efcp > vcom-tunnel [ACK] Seq=4469 Ack=139911 Win=64515 Len=0
985629 329.085127 128.231.127.197 -> 41.177.98.143 TCP 133 efcp > vcom-tunnel [PSH, ACK] Seq=4469 Ack=139911 Win=64515 Len=75
985958 329.175495 128.231.127.197 -> 41.177.98.143 TCP 64 efcp > vcom-tunnel [ACK] Seq=4544 Ack=142427 Win=64515 Len=0
986077 329.188820 128.231.127.197 -> 41.177.98.143 TCP 133 efcp > vcom-tunnel [PSH, ACK] Seq=4544 Ack=142427 Win=64515 Len=75
986475 329.269294 128.231.127.197 -> 41.177.98.143 TCP 64 efcp > vcom-tunnel [ACK] Seq=4619 Ack=144010 Win=64515 Len=0
1018868 343.582631 128.231.127.197 -> 41.177.98.143 TCP 133 efcp > vcom-tunnel [PSH, ACK] Seq=4619 Ack=144010 Win=64515 Len=75
1019052 343.669352 128.231.127.197 -> 41.177.98.143 TCP 64 efcp > vcom-tunnel [ACK] Seq=4694 Ack=146047 Win=64515 Len=0
1019097 343.680294 128.231.127.197 -> 41.177.98.143 TCP 133 efcp > vcom-tunnel [PSH, ACK] Seq=4694 Ack=146047 Win=64515 Len=75
1019265 343.807759 128.231.127.197 -> 41.177.98.143 TCP 64 efcp > vcom-tunnel [ACK] Seq=4769 Ack=148807 Win=64515 Len=0
1019489 343.856400 128.231.127.197 -> 41.177.98.143 TCP 133 efcp > vcom-tunnel [PSH, ACK] Seq=4769 Ack=149132 Win=64433 Len=75
1019670 343.940201 128.231.127.197 -> 41.177.98.143 TCP 64 efcp > vcom-tunnel [ACK] Seq=4844 Ack=151287 Win=64515 Len=0
1019691 343.950481 128.231.127.197 -> 41.177.98.143 TCP 133 efcp > vcom-tunnel [PSH, ACK] Seq=4844 Ack=151287 Win=64515 Len=75
1019762 343.997512 128.231.127.197 -> 41.177.98.143 TCP 64 efcp > vcom-tunnel [ACK] Seq=4919 Ack=153442 Win=64515 Len=0
