141223  48.631647 142.197.48.208 -> 41.177.98.127 TCP 66 plbserve-port > z39-50 [SYN] Seq=0 Win=64240 Len=0 MSS=1460 SACK_PERM=1
141485  48.682757 142.197.48.208 -> 41.177.98.127 TCP 64 plbserve-port > z39-50 [ACK] Seq=1 Ack=1 Win=64240 Len=0
141492  48.683545 142.197.48.208 -> 41.177.98.127 TCP 149 plbserve-port > z39-50 [PSH, ACK] Seq=1 Ack=1 Win=64240 Len=91
146012  50.044820 142.197.48.208 -> 41.177.98.127 TCP 149 plbserve-port > z39-50 [PSH, ACK] Seq=92 Ack=71 Win=64170 Len=91
146095  50.096851 142.197.48.208 -> 41.177.98.127 TCP 66 plbserve-port > z39-50 [PSH, ACK] Seq=183 Ack=111 Win=64130 Len=8
146231  50.152930 142.197.48.208 -> 41.177.98.127 TCP 64 plbserve-port > z39-50 [ACK] Seq=191 Ack=112 Win=64130 Len=0
146236  50.154014 142.197.48.208 -> 41.177.98.127 TCP 66 sunfm-port > z39-50 [SYN] Seq=0 Win=64240 Len=0 MSS=1460 SACK_PERM=1
146237  50.154157 142.197.48.208 -> 41.177.98.127 TCP 64 plbserve-port > z39-50 [FIN, ACK] Seq=191 Ack=112 Win=64130 Len=0
146419  50.204784 142.197.48.208 -> 41.177.98.127 TCP 64 sunfm-port > z39-50 [ACK] Seq=1 Ack=1 Win=64240 Len=0
146427  50.206020 142.197.48.208 -> 41.177.98.127 TCP 149 sunfm-port > z39-50 [PSH, ACK] Seq=1 Ack=1 Win=64240 Len=91
150173  51.568985 142.197.48.208 -> 41.177.98.127 TCP 149 sunfm-port > z39-50 [PSH, ACK] Seq=92 Ack=71 Win=64170 Len=91
150377  51.621073 142.197.48.208 -> 41.177.98.127 TCP 66 sunfm-port > z39-50 [PSH, ACK] Seq=183 Ack=111 Win=64130 Len=8
150597  51.678540 142.197.48.208 -> 41.177.98.127 TCP 64 sunfm-port > z39-50 [ACK] Seq=191 Ack=112 Win=64130 Len=0
150599  51.679469 142.197.48.208 -> 41.177.98.127 TCP 64 sunfm-port > z39-50 [FIN, ACK] Seq=191 Ack=112 Win=64130 Len=0
171494  56.985285 142.197.48.208 -> 41.177.98.127 TCP 66 treehopper > z39-50 [SYN] Seq=0 Win=64240 Len=0 MSS=1460 SACK_PERM=1
171572  57.036459 142.197.48.208 -> 41.177.98.127 TCP 64 treehopper > z39-50 [ACK] Seq=1 Ack=1 Win=64240 Len=0
171573  57.037405 142.197.48.208 -> 41.177.98.127 TCP 173 treehopper > z39-50 [PSH, ACK] Seq=1 Ack=1 Win=64240 Len=115
175714  58.404317 142.197.48.208 -> 41.177.98.127 TCP 152 treehopper > z39-50 [PSH, ACK] Seq=116 Ack=71 Win=64170 Len=94
175786  58.455985 142.197.48.208 -> 41.177.98.127 TCP 66 treehopper > z39-50 [PSH, ACK] Seq=210 Ack=111 Win=64130 Len=8
175909  58.511941 142.197.48.208 -> 41.177.98.127 TCP 64 treehopper > z39-50 [ACK] Seq=218 Ack=112 Win=64130 Len=0
175910  58.511946 142.197.48.208 -> 41.177.98.127 TCP 64 treehopper > z39-50 [FIN, ACK] Seq=218 Ack=112 Win=64130 Len=0
175912  58.512143 142.197.48.208 -> 41.177.98.127 TCP 66 sbi-agent > z39-50 [SYN] Seq=0 Win=64240 Len=0 MSS=1460 SACK_PERM=1
176015  58.563043 142.197.48.208 -> 41.177.98.127 TCP 64 sbi-agent > z39-50 [ACK] Seq=1 Ack=1 Win=64240 Len=0
176017  58.564071 142.197.48.208 -> 41.177.98.127 TCP 173 sbi-agent > z39-50 [PSH, ACK] Seq=1 Ack=1 Win=64240 Len=115
178519  59.945459 142.197.48.208 -> 41.177.98.127 TCP 152 sbi-agent > z39-50 [PSH, ACK] Seq=116 Ack=71 Win=64170 Len=94
178675  59.997662 142.197.48.208 -> 41.177.98.127 TCP 66 sbi-agent > z39-50 [PSH, ACK] Seq=210 Ack=111 Win=64130 Len=8
178784  60.053817 142.197.48.208 -> 41.177.98.127 TCP 64 sbi-agent > z39-50 [ACK] Seq=218 Ack=112 Win=64130 Len=0
178785  60.054042 142.197.48.208 -> 41.177.98.127 TCP 64 sbi-agent > z39-50 [FIN, ACK] Seq=218 Ack=112 Win=64130 Len=0
189074  64.488374 142.197.48.208 -> 41.177.98.127 TCP 66 acms > z39-50 [SYN] Seq=0 Win=64240 Len=0 MSS=1460 SACK_PERM=1
189175  64.539920 142.197.48.208 -> 41.177.98.127 TCP 64 acms > z39-50 [ACK] Seq=1 Ack=1 Win=64240 Len=0
189176  64.540203 142.197.48.208 -> 41.177.98.127 TCP 149 acms > z39-50 [PSH, ACK] Seq=1 Ack=1 Win=64240 Len=91
191502  65.899710 142.197.48.208 -> 41.177.98.127 TCP 149 acms > z39-50 [PSH, ACK] Seq=92 Ack=71 Win=64170 Len=91
191657  65.952217 142.197.48.208 -> 41.177.98.127 TCP 66 acms > z39-50 [PSH, ACK] Seq=183 Ack=111 Win=64130 Len=8
191775  66.008236 142.197.48.208 -> 41.177.98.127 TCP 64 acms > z39-50 [ACK] Seq=191 Ack=112 Win=64130 Len=0
191776  66.008241 142.197.48.208 -> 41.177.98.127 TCP 64 acms > z39-50 [FIN, ACK] Seq=191 Ack=112 Win=64130 Len=0
191778  66.009020 142.197.48.208 -> 41.177.98.127 TCP 66 starfish > z39-50 [SYN] Seq=0 Win=64240 Len=0 MSS=1460 SACK_PERM=1
191889  66.060340 142.197.48.208 -> 41.177.98.127 TCP 64 starfish > z39-50 [ACK] Seq=1 Ack=1 Win=64240 Len=0
191890  66.060345 142.197.48.208 -> 41.177.98.127 TCP 149 starfish > z39-50 [PSH, ACK] Seq=1 Ack=1 Win=64240 Len=91
196395  67.411167 142.197.48.208 -> 41.177.98.127 TCP 149 starfish > z39-50 [PSH, ACK] Seq=92 Ack=71 Win=64170 Len=91
196617  67.464142 142.197.48.208 -> 41.177.98.127 TCP 66 starfish > z39-50 [PSH, ACK] Seq=183 Ack=111 Win=64130 Len=8
196804  67.519861 142.197.48.208 -> 41.177.98.127 TCP 64 starfish > z39-50 [ACK] Seq=191 Ack=112 Win=64130 Len=0
196807  67.521674 142.197.48.208 -> 41.177.98.127 TCP 64 starfish > z39-50 [FIN, ACK] Seq=191 Ack=112 Win=64130 Len=0
307561 104.594524 142.197.48.208 -> 41.177.98.127 TCP 66 drmsfsd > z39-50 [SYN] Seq=0 Win=64240 Len=0 MSS=1460 SACK_PERM=1
307729 104.646526 142.197.48.208 -> 41.177.98.127 TCP 64 drmsfsd > z39-50 [ACK] Seq=1 Ack=1 Win=64240 Len=0
307730 104.646531 142.197.48.208 -> 41.177.98.127 TCP 149 drmsfsd > z39-50 [PSH, ACK] Seq=1 Ack=1 Win=64240 Len=91
310528 105.968899 142.197.48.208 -> 41.177.98.127 TCP 162 drmsfsd > z39-50 [PSH, ACK] Seq=92 Ack=71 Win=64170 Len=104
310702 106.021099 142.197.48.208 -> 41.177.98.127 TCP 66 drmsfsd > z39-50 [PSH, ACK] Seq=196 Ack=111 Win=64130 Len=8
310976 106.078119 142.197.48.208 -> 41.177.98.127 TCP 64 drmsfsd > z39-50 [ACK] Seq=204 Ack=112 Win=64130 Len=0
310977 106.078124 142.197.48.208 -> 41.177.98.127 TCP 64 drmsfsd > z39-50 [FIN, ACK] Seq=204 Ack=112 Win=64130 Len=0
310979 106.078457 142.197.48.208 -> 41.177.98.127 TCP 66 dpcp > z39-50 [SYN] Seq=0 Win=64240 Len=0 MSS=1460 SACK_PERM=1
311165 106.129446 142.197.48.208 -> 41.177.98.127 TCP 64 dpcp > z39-50 [ACK] Seq=1 Ack=1 Win=64240 Len=0
311166 106.130693 142.197.48.208 -> 41.177.98.127 TCP 149 dpcp > z39-50 [PSH, ACK] Seq=1 Ack=1 Win=64240 Len=91
314932 107.506851 142.197.48.208 -> 41.177.98.127 TCP 64 dpcp > z39-50 [ACK] Seq=92 Ack=71 Win=64170 Len=0
315017 107.546493 142.197.48.208 -> 41.177.98.127 TCP 162 dpcp > z39-50 [PSH, ACK] Seq=92 Ack=71 Win=64170 Len=104
315107 107.598545 142.197.48.208 -> 41.177.98.127 TCP 66 dpcp > z39-50 [PSH, ACK] Seq=196 Ack=111 Win=64130 Len=8
315252 107.655037 142.197.48.208 -> 41.177.98.127 TCP 64 dpcp > z39-50 [ACK] Seq=204 Ack=112 Win=64130 Len=0
315254 107.656262 142.197.48.208 -> 41.177.98.127 TCP 64 dpcp > z39-50 [FIN, ACK] Seq=204 Ack=112 Win=64130 Len=0
599490 190.093658 142.197.48.208 -> 41.177.98.127 TCP 66 ddrepl > z39-50 [SYN] Seq=0 Win=64240 Len=0 MSS=1460 SACK_PERM=1
599612 190.145373 142.197.48.208 -> 41.177.98.127 TCP 64 ddrepl > z39-50 [ACK] Seq=1 Ack=1 Win=64240 Len=0
599613 190.145894 142.197.48.208 -> 41.177.98.127 TCP 149 ddrepl > z39-50 [PSH, ACK] Seq=1 Ack=1 Win=64240 Len=91
603476 191.496665 142.197.48.208 -> 41.177.98.127 TCP 156 ddrepl > z39-50 [PSH, ACK] Seq=92 Ack=71 Win=64170 Len=98
603644 191.549190 142.197.48.208 -> 41.177.98.127 TCP 66 ddrepl > z39-50 [PSH, ACK] Seq=190 Ack=111 Win=64130 Len=8
603785 191.604356 142.197.48.208 -> 41.177.98.127 TCP 64 ddrepl > z39-50 [ACK] Seq=198 Ack=112 Win=64130 Len=0
603787 191.605348 142.197.48.208 -> 41.177.98.127 TCP 66 unikeypro > z39-50 [SYN] Seq=0 Win=64240 Len=0 MSS=1460 SACK_PERM=1
603788 191.605591 142.197.48.208 -> 41.177.98.127 TCP 64 ddrepl > z39-50 [FIN, ACK] Seq=198 Ack=112 Win=64130 Len=0
603855 191.656213 142.197.48.208 -> 41.177.98.127 TCP 64 unikeypro > z39-50 [ACK] Seq=1 Ack=1 Win=64240 Len=0
603861 191.656967 142.197.48.208 -> 41.177.98.127 TCP 149 unikeypro > z39-50 [PSH, ACK] Seq=1 Ack=1 Win=64240 Len=91
607933 193.000604 142.197.48.208 -> 41.177.98.127 TCP 156 unikeypro > z39-50 [PSH, ACK] Seq=92 Ack=71 Win=64170 Len=98
608043 193.052860 142.197.48.208 -> 41.177.98.127 TCP 66 unikeypro > z39-50 [PSH, ACK] Seq=190 Ack=111 Win=64130 Len=8
608176 193.108252 142.197.48.208 -> 41.177.98.127 TCP 64 unikeypro > z39-50 [ACK] Seq=198 Ack=112 Win=64130 Len=0
608177 193.109041 142.197.48.208 -> 41.177.98.127 TCP 64 unikeypro > z39-50 [FIN, ACK] Seq=198 Ack=112 Win=64130 Len=0
690025 217.404244 142.197.48.208 -> 41.177.98.127 TCP 66 bzr > z39-50 [SYN] Seq=0 Win=64240 Len=0 MSS=1460 SACK_PERM=1
690107 217.456162 142.197.48.208 -> 41.177.98.127 TCP 64 bzr > z39-50 [ACK] Seq=1 Ack=1 Win=64240 Len=0
692948 218.887562 142.197.48.208 -> 41.177.98.127 TCP 66 [TCP segment of a reassembled PDU]
693071 218.943797 142.197.48.208 -> 41.177.98.127 TCP 64 bzr > z39-50 [ACK] Seq=204 Ack=112 Win=64130 Len=0
693074 218.944745 142.197.48.208 -> 41.177.98.127 TCP 64 bzr > z39-50 [FIN, ACK] Seq=204 Ack=112 Win=64130 Len=0
693080 218.945051 142.197.48.208 -> 41.177.98.127 TCP 66 stat-results > z39-50 [SYN] Seq=0 Win=64240 Len=0 MSS=1460 SACK_PERM=1
693182 218.996091 142.197.48.208 -> 41.177.98.127 TCP 64 stat-results > z39-50 [ACK] Seq=1 Ack=1 Win=64240 Len=0
693183 218.996118 142.197.48.208 -> 41.177.98.127 TCP 149 stat-results > z39-50 [PSH, ACK] Seq=1 Ack=1 Win=64240 Len=91
695754 220.331273 142.197.48.208 -> 41.177.98.127 TCP 162 stat-results > z39-50 [PSH, ACK] Seq=92 Ack=71 Win=64170 Len=104
695867 220.383502 142.197.48.208 -> 41.177.98.127 TCP 66 stat-results > z39-50 [PSH, ACK] Seq=196 Ack=111 Win=64130 Len=8
695954 220.438894 142.197.48.208 -> 41.177.98.127 TCP 64 stat-results > z39-50 [ACK] Seq=204 Ack=112 Win=64130 Len=0
695955 220.439917 142.197.48.208 -> 41.177.98.127 TCP 64 stat-results > z39-50 [FIN, ACK] Seq=204 Ack=112 Win=64130 Len=0
717003 228.820941 142.197.48.208 -> 41.177.98.127 TCP 66 bccp > z39-50 [SYN] Seq=0 Win=64240 Len=0 MSS=1460 SACK_PERM=1
717140 228.870670 142.197.48.208 -> 41.177.98.127 TCP 64 bccp > z39-50 [ACK] Seq=1 Ack=1 Win=64240 Len=0
717173 228.872812 142.197.48.208 -> 41.177.98.127 TCP 149 bccp > z39-50 [PSH, ACK] Seq=1 Ack=1 Win=64240 Len=91
721163 230.212003 142.197.48.208 -> 41.177.98.127 TCP 162 bccp > z39-50 [PSH, ACK] Seq=92 Ack=71 Win=64170 Len=104
721348 230.264368 142.197.48.208 -> 41.177.98.127 TCP 66 bccp > z39-50 [PSH, ACK] Seq=196 Ack=111 Win=64130 Len=8
721452 230.321355 142.197.48.208 -> 41.177.98.127 TCP 64 bccp > z39-50 [ACK] Seq=204 Ack=112 Win=64130 Len=0
721453 230.321360 142.197.48.208 -> 41.177.98.127 TCP 64 bccp > z39-50 [FIN, ACK] Seq=204 Ack=112 Win=64130 Len=0
721455 230.322919 142.197.48.208 -> 41.177.98.127 TCP 66 wello > z39-50 [SYN] Seq=0 Win=64240 Len=0 MSS=1460 SACK_PERM=1
721592 230.373750 142.197.48.208 -> 41.177.98.127 TCP 64 wello > z39-50 [ACK] Seq=1 Ack=1 Win=64240 Len=0
721597 230.374761 142.197.48.208 -> 41.177.98.127 TCP 149 wello > z39-50 [PSH, ACK] Seq=1 Ack=1 Win=64240 Len=91
724113 231.729592 142.197.48.208 -> 41.177.98.127 TCP 162 wello > z39-50 [PSH, ACK] Seq=92 Ack=71 Win=64170 Len=104
724265 231.781360 142.197.48.208 -> 41.177.98.127 TCP 66 wello > z39-50 [PSH, ACK] Seq=196 Ack=111 Win=64130 Len=8
724466 231.837295 142.197.48.208 -> 41.177.98.127 TCP 64 wello > z39-50 [ACK] Seq=204 Ack=112 Win=64130 Len=0
724470 231.837784 142.197.48.208 -> 41.177.98.127 TCP 64 wello > z39-50 [FIN, ACK] Seq=204 Ack=112 Win=64130 Len=0
829559 270.927514 142.197.48.208 -> 41.177.98.127 TCP 66 4209 > z39-50 [SYN] Seq=0 Win=64240 Len=0 MSS=1460 SACK_PERM=1
829683 270.977995 142.197.48.208 -> 41.177.98.127 TCP 64 4209 > z39-50 [ACK] Seq=1 Ack=1 Win=64240 Len=0
829684 270.978000 142.197.48.208 -> 41.177.98.127 TCP 149 4209 > z39-50 [PSH, ACK] Seq=1 Ack=1 Win=64240 Len=91
832677 272.324594 142.197.48.208 -> 41.177.98.127 TCP 152 4209 > z39-50 [PSH, ACK] Seq=92 Ack=71 Win=64170 Len=94
832736 272.376892 142.197.48.208 -> 41.177.98.127 TCP 66 4209 > z39-50 [PSH, ACK] Seq=186 Ack=111 Win=64130 Len=8
832914 272.433077 142.197.48.208 -> 41.177.98.127 TCP 64 4209 > z39-50 [ACK] Seq=194 Ack=112 Win=64130 Len=0
832918 272.434044 142.197.48.208 -> 41.177.98.127 TCP 64 4209 > z39-50 [FIN, ACK] Seq=194 Ack=112 Win=64130 Len=0
832923 272.434314 142.197.48.208 -> 41.177.98.127 TCP 66 4210 > z39-50 [SYN] Seq=0 Win=64240 Len=0 MSS=1460 SACK_PERM=1
833129 272.485545 142.197.48.208 -> 41.177.98.127 TCP 64 4210 > z39-50 [ACK] Seq=1 Ack=1 Win=64240 Len=0
833133 272.486404 142.197.48.208 -> 41.177.98.127 TCP 149 4210 > z39-50 [PSH, ACK] Seq=1 Ack=1 Win=64240 Len=91
836314 273.845408 142.197.48.208 -> 41.177.98.127 TCP 152 4210 > z39-50 [PSH, ACK] Seq=92 Ack=71 Win=64170 Len=94
836413 273.898419 142.197.48.208 -> 41.177.98.127 TCP 66 4210 > z39-50 [PSH, ACK] Seq=186 Ack=111 Win=64130 Len=8
836530 273.955085 142.197.48.208 -> 41.177.98.127 TCP 64 4210 > z39-50 [ACK] Seq=194 Ack=112 Win=64130 Len=0
836542 273.966963 142.197.48.208 -> 41.177.98.127 TCP 64 4210 > z39-50 [FIN, ACK] Seq=194 Ack=112 Win=64130 Len=0
946301 314.093962 142.197.48.208 -> 41.177.98.127 TCP 66 4235 > z39-50 [SYN] Seq=0 Win=64240 Len=0 MSS=1460 SACK_PERM=1
946464 314.145711 142.197.48.208 -> 41.177.98.127 TCP 64 4235 > z39-50 [ACK] Seq=1 Ack=1 Win=64240 Len=0
946465 314.145715 142.197.48.208 -> 41.177.98.127 TCP 173 4235 > z39-50 [PSH, ACK] Seq=1 Ack=1 Win=64240 Len=115
951252 315.495294 142.197.48.208 -> 41.177.98.127 TCP 150 4235 > z39-50 [PSH, ACK] Seq=116 Ack=71 Win=64170 Len=92
951424 315.547678 142.197.48.208 -> 41.177.98.127 TCP 66 4235 > z39-50 [PSH, ACK] Seq=208 Ack=111 Win=64130 Len=8
951592 315.604763 142.197.48.208 -> 41.177.98.127 TCP 64 4235 > z39-50 [ACK] Seq=216 Ack=112 Win=64130 Len=0
951593 315.604988 142.197.48.208 -> 41.177.98.127 TCP 64 4235 > z39-50 [FIN, ACK] Seq=216 Ack=112 Win=64130 Len=0
951596 315.605954 142.197.48.208 -> 41.177.98.127 TCP 66 4236 > z39-50 [SYN] Seq=0 Win=64240 Len=0 MSS=1460 SACK_PERM=1
951784 315.657422 142.197.48.208 -> 41.177.98.127 TCP 64 4236 > z39-50 [ACK] Seq=1 Ack=1 Win=64240 Len=0
951785 315.657645 142.197.48.208 -> 41.177.98.127 TCP 173 4236 > z39-50 [PSH, ACK] Seq=1 Ack=1 Win=64240 Len=115
955703 317.003496 142.197.48.208 -> 41.177.98.127 TCP 150 4236 > z39-50 [PSH, ACK] Seq=116 Ack=71 Win=64170 Len=92
955926 317.055359 142.197.48.208 -> 41.177.98.127 TCP 66 4236 > z39-50 [PSH, ACK] Seq=208 Ack=111 Win=64130 Len=8
956008 317.111812 142.197.48.208 -> 41.177.98.127 TCP 64 4236 > z39-50 [ACK] Seq=216 Ack=112 Win=64130 Len=0
956009 317.111817 142.197.48.208 -> 41.177.98.127 TCP 64 4236 > z39-50 [FIN, ACK] Seq=216 Ack=112 Win=64130 Len=0
964635 321.081630 142.197.48.208 -> 41.177.98.127 TCP 66 4255 > z39-50 [SYN] Seq=0 Win=64240 Len=0 MSS=1460 SACK_PERM=1
964727 321.132753 142.197.48.208 -> 41.177.98.127 TCP 64 4255 > z39-50 [ACK] Seq=1 Ack=1 Win=64240 Len=0
964734 321.133525 142.197.48.208 -> 41.177.98.127 TCP 173 4255 > z39-50 [PSH, ACK] Seq=1 Ack=1 Win=64240 Len=115
968420 322.522203 142.197.48.208 -> 41.177.98.127 TCP 151 4255 > z39-50 [PSH, ACK] Seq=116 Ack=71 Win=64170 Len=93
968514 322.574344 142.197.48.208 -> 41.177.98.127 TCP 66 4255 > z39-50 [PSH, ACK] Seq=209 Ack=111 Win=64130 Len=8
968700 322.631966 142.197.48.208 -> 41.177.98.127 TCP 64 4255 > z39-50 [ACK] Seq=217 Ack=112 Win=64130 Len=0
968702 322.632844 142.197.48.208 -> 41.177.98.127 TCP 64 4255 > z39-50 [FIN, ACK] Seq=217 Ack=112 Win=64130 Len=0
968708 322.635606 142.197.48.208 -> 41.177.98.127 TCP 66 4256 > z39-50 [SYN] Seq=0 Win=64240 Len=0 MSS=1460 SACK_PERM=1
968826 322.687194 142.197.48.208 -> 41.177.98.127 TCP 64 4256 > z39-50 [ACK] Seq=1 Ack=1 Win=64240 Len=0
968827 322.687199 142.197.48.208 -> 41.177.98.127 TCP 173 4256 > z39-50 [PSH, ACK] Seq=1 Ack=1 Win=64240 Len=115
972024 324.033645 142.197.48.208 -> 41.177.98.127 TCP 151 4256 > z39-50 [PSH, ACK] Seq=116 Ack=71 Win=64170 Len=93
972397 324.085635 142.197.48.208 -> 41.177.98.127 TCP 66 4256 > z39-50 [PSH, ACK] Seq=209 Ack=111 Win=64130 Len=8
972935 324.141474 142.197.48.208 -> 41.177.98.127 TCP 64 4256 > z39-50 [ACK] Seq=217 Ack=112 Win=64130 Len=0
972937 324.141711 142.197.48.208 -> 41.177.98.127 TCP 64 4256 > z39-50 [FIN, ACK] Seq=217 Ack=112 Win=64130 Len=0
985536 329.043559 142.197.48.208 -> 41.177.98.127 TCP 66 4282 > z39-50 [SYN] Seq=0 Win=64240 Len=0 MSS=1460 SACK_PERM=1
985693 329.095092 142.197.48.208 -> 41.177.98.127 TCP 64 4282 > z39-50 [ACK] Seq=1 Ack=1 Win=64240 Len=0
985694 329.095333 142.197.48.208 -> 41.177.98.127 TCP 149 4282 > z39-50 [PSH, ACK] Seq=1 Ack=1 Win=64240 Len=91
990753 330.451527 142.197.48.208 -> 41.177.98.127 TCP 163 4282 > z39-50 [PSH, ACK] Seq=92 Ack=71 Win=64170 Len=105
990860 330.503918 142.197.48.208 -> 41.177.98.127 TCP 66 4282 > z39-50 [PSH, ACK] Seq=197 Ack=111 Win=64130 Len=8
991165 330.561542 142.197.48.208 -> 41.177.98.127 TCP 64 4282 > z39-50 [ACK] Seq=205 Ack=112 Win=64130 Len=0
991166 330.561547 142.197.48.208 -> 41.177.98.127 TCP 64 4282 > z39-50 [FIN, ACK] Seq=205 Ack=112 Win=64130 Len=0
991168 330.563737 142.197.48.208 -> 41.177.98.127 TCP 66 4291 > z39-50 [SYN] Seq=0 Win=64240 Len=0 MSS=1460 SACK_PERM=1
991226 330.615541 142.197.48.208 -> 41.177.98.127 TCP 64 4291 > z39-50 [ACK] Seq=1 Ack=1 Win=64240 Len=0
991227 330.615565 142.197.48.208 -> 41.177.98.127 TCP 149 4291 > z39-50 [PSH, ACK] Seq=1 Ack=1 Win=64240 Len=91
994799 331.945571 142.197.48.208 -> 41.177.98.127 TCP 163 4291 > z39-50 [PSH, ACK] Seq=92 Ack=71 Win=64170 Len=105
994966 331.997239 142.197.48.208 -> 41.177.98.127 TCP 66 4291 > z39-50 [PSH, ACK] Seq=197 Ack=111 Win=64130 Len=8
995209 332.055048 142.197.48.208 -> 41.177.98.127 TCP 64 4291 > z39-50 [ACK] Seq=205 Ack=112 Win=64130 Len=0
995213 332.056485 142.197.48.208 -> 41.177.98.127 TCP 64 4291 > z39-50 [FIN, ACK] Seq=205 Ack=112 Win=64130 Len=0
