608676 193.313015 145.251.145.84 -> 41.177.98.176 TCP 66 38007 > http [SYN] Seq=0 Win=65535 Len=0 MSS=1380 SACK_PERM=1
608788 193.353363 145.251.145.84 -> 41.177.98.176 TCP 64 38007 > http [ACK] Seq=1 Ack=1 Win=65535 Len=0
610068 193.678073 145.251.145.84 -> 41.177.98.176 TCP 64 38007 > http [ACK] Seq=430 Ack=2761 Win=65535 Len=0
610243 193.718915 145.251.145.84 -> 41.177.98.176 TCP 64 38007 > http [ACK] Seq=430 Ack=5214 Win=65535 Len=0
669949 208.683182 145.251.145.84 -> 41.177.98.176 TCP 64 38007 > http [ACK] Seq=430 Ack=5215 Win=65535 Len=0
