703127 223.618228 145.217.155.116 -> 244.3.210.197 TCP 82 hostkey > http [SYN] Seq=0 Win=65535 Len=0 MSS=1460 WS=8 TSval=1035573902 TSecr=0 SACK_PERM=1
703306 223.696133 145.217.155.116 -> 244.3.210.197 TCP 70 hostkey > http [ACK] Seq=1 Ack=1 Win=524280 Len=0 TSval=1035573903 TSecr=0
704340 224.136103 145.217.155.116 -> 244.3.210.197 TCP 70 hostkey > http [ACK] Seq=669 Ack=2897 Win=524176 Len=0 TSval=1035573907 TSecr=150408855
704536 224.216070 145.217.155.116 -> 244.3.210.197 TCP 70 hostkey > http [ACK] Seq=669 Ack=5793 Win=522728 Len=0 TSval=1035573908 TSecr=150408856
704786 224.295592 145.217.155.116 -> 244.3.210.197 TCP 70 hostkey > http [ACK] Seq=669 Ack=8689 Win=519832 Len=0 TSval=1035573909 TSecr=150408856
705023 224.368033 145.217.155.116 -> 244.3.210.197 TCP 70 hostkey > http [ACK] Seq=669 Ack=11585 Win=516936 Len=0 TSval=1035573909 TSecr=150408857
705034 224.374159 145.217.155.116 -> 244.3.210.197 TCP 70 hostkey > http [ACK] Seq=669 Ack=15420 Win=513096 Len=0 TSval=1035573910 TSecr=150408858
789398 256.384016 145.217.155.116 -> 244.3.210.197 TCP 70 hostkey > http [FIN, ACK] Seq=669 Ack=15420 Win=524280 Len=0 TSval=1035574229 TSecr=150408858
789603 256.464042 145.217.155.116 -> 244.3.210.197 TCP 70 hostkey > http [ACK] Seq=670 Ack=15421 Win=524280 Len=0 TSval=1035574230 TSecr=150409179
789611 256.468142 145.217.155.116 -> 244.3.210.197 TCP 70 [TCP Dup ACK 789603#1] hostkey > http [ACK] Seq=670 Ack=15421 Win=524280 Len=0 TSval=1035574230 TSecr=150409179
