403245 135.235560 145.67.149.108 -> 244.3.210.197 TCP 66 herodotus-net > http [SYN] Seq=0 Win=16384 Len=0 MSS=1260 SACK_PERM=1
403396 135.250834 145.67.149.108 -> 244.3.210.197 TCP 64 herodotus-net > http [ACK] Seq=1 Ack=1 Win=17640 Len=0
404521 135.548809 145.67.149.108 -> 244.3.210.197 TCP 64 herodotus-net > http [FIN, ACK] Seq=565 Ack=1261 Win=17640 Len=0
404548 135.563453 145.67.149.108 -> 244.3.210.197 TCP 64 herodotus-net > http [ACK] Seq=566 Ack=3781 Win=17640 Len=0
404570 135.567521 145.67.149.108 -> 244.3.210.197 TCP 64 herodotus-net > http [ACK] Seq=566 Ack=5041 Win=17640 Len=0
404612 135.579428 145.67.149.108 -> 244.3.210.197 TCP 64 herodotus-net > http [ACK] Seq=566 Ack=7561 Win=17640 Len=0
404625 135.583662 145.67.149.108 -> 244.3.210.197 TCP 64 herodotus-net > http [ACK] Seq=566 Ack=8821 Win=17640 Len=0
404626 135.583666 145.67.149.108 -> 244.3.210.197 TCP 64 herodotus-net > http [ACK] Seq=566 Ack=11341 Win=17640 Len=0
404705 135.597461 145.67.149.108 -> 244.3.210.197 TCP 64 herodotus-net > http [ACK] Seq=566 Ack=12601 Win=17640 Len=0
404711 135.601532 145.67.149.108 -> 244.3.210.197 TCP 64 herodotus-net > http [RST, ACK] Seq=566 Ack=12601 Win=0 Len=0
