136648  47.565178  145.95.75.2 -> 244.3.41.84  TCP 64 pslserver > telnet [ACK] Seq=64 Ack=1420 Win=17640 Len=0
245983  86.042270  145.95.75.2 -> 244.3.41.84  TCP 64 pslserver > telnet [ACK] Seq=183 Ack=2975 Win=17640 Len=0
360247 122.998491  145.95.75.2 -> 244.3.41.84  TCP 64 pslserver > telnet [ACK] Seq=301 Ack=4514 Win=17640 Len=0
489134 160.737575  145.95.75.2 -> 244.3.41.84  TCP 64 pslserver > telnet [ACK] Seq=416 Ack=6641 Win=17631 Len=0
489698 161.172019  145.95.75.2 -> 244.3.41.84  TCP 64 pslserver > telnet [ACK] Seq=424 Ack=6721 Win=17551 Len=0
490398 161.609873  145.95.75.2 -> 244.3.41.84  TCP 64 pslserver > telnet [ACK] Seq=596 Ack=6744 Win=17528 Len=0
491004 161.939706  145.95.75.2 -> 244.3.41.84  TCP 64 pslserver > telnet [ACK] Seq=768 Ack=6777 Win=17495 Len=0
491494 162.262704  145.95.75.2 -> 244.3.41.84  TCP 64 pslserver > telnet [ACK] Seq=768 Ack=7734 Win=16538 Len=0
515115 165.910170  145.95.75.2 -> 244.3.41.84  TCP 64 pslserver > telnet [FIN, ACK] Seq=768 Ack=7734 Win=16538 Len=0
515214 166.001811  145.95.75.2 -> 244.3.41.84  TCP 64 pslserver > telnet [ACK] Seq=769 Ack=7735 Win=16538 Len=0
