117339  42.049283 15.186.164.176 -> 41.177.26.46 TCP 78 53342 > http [SYN] Seq=0 Win=5840 Len=0 MSS=1460 SACK_PERM=1 TSval=1209882808 TSecr=0 WS=256
117451  42.120465 15.186.164.176 -> 41.177.26.46 TCP 70 53342 > http [ACK] Seq=1 Ack=1 Win=5888 Len=0 TSval=1209882879 TSecr=1509549663
117662  42.198126 15.186.164.176 -> 41.177.26.46 TCP 70 53342 > http [ACK] Seq=413 Ack=237 Win=6912 Len=0 TSval=1209882957 TSecr=1509549671
117712  42.212746 15.186.164.176 -> 41.177.26.46 TCP 70 53342 > http [ACK] Seq=413 Ack=1685 Win=9984 Len=0 TSval=1209882971 TSecr=1509549672
117713  42.212781 15.186.164.176 -> 41.177.26.46 TCP 70 53342 > http [ACK] Seq=413 Ack=3133 Win=12800 Len=0 TSval=1209882971 TSecr=1509549672
117834  42.269251 15.186.164.176 -> 41.177.26.46 TCP 70 53342 > http [ACK] Seq=413 Ack=4581 Win=15616 Len=0 TSval=1209883028 TSecr=1509549678
117835  42.269256 15.186.164.176 -> 41.177.26.46 TCP 70 53342 > http [ACK] Seq=413 Ack=6029 Win=18688 Len=0 TSval=1209883028 TSecr=1509549678
117871  42.283752 15.186.164.176 -> 41.177.26.46 TCP 70 53342 > http [ACK] Seq=413 Ack=7477 Win=21504 Len=0 TSval=1209883042 TSecr=1509549679
117872  42.283756 15.186.164.176 -> 41.177.26.46 TCP 70 53342 > http [ACK] Seq=413 Ack=8429 Win=24320 Len=0 TSval=1209883042 TSecr=1509549679
117874  42.283932 15.186.164.176 -> 41.177.26.46 TCP 70 53342 > http [ACK] Seq=413 Ack=9877 Win=27392 Len=0 TSval=1209883042 TSecr=1509549679
117875  42.284027 15.186.164.176 -> 41.177.26.46 TCP 70 53342 > http [ACK] Seq=413 Ack=11325 Win=27392 Len=0 TSval=1209883042 TSecr=1509549679
118006  42.340659 15.186.164.176 -> 41.177.26.46 TCP 70 53342 > http [ACK] Seq=413 Ack=12773 Win=27392 Len=0 TSval=1209883099 TSecr=1509549685
118007  42.340663 15.186.164.176 -> 41.177.26.46 TCP 70 53342 > http [ACK] Seq=413 Ack=14221 Win=27392 Len=0 TSval=1209883099 TSecr=1509549685
118008  42.340717 15.186.164.176 -> 41.177.26.46 TCP 70 53342 > http [ACK] Seq=413 Ack=15669 Win=27392 Len=0 TSval=1209883099 TSecr=1509549685
118009  42.340722 15.186.164.176 -> 41.177.26.46 TCP 70 53342 > http [FIN, ACK] Seq=413 Ack=15919 Win=27392 Len=0 TSval=1209883099 TSecr=1509549685
238731  82.841644 15.186.164.176 -> 41.177.26.46 TCP 78 56869 > http [SYN] Seq=0 Win=5840 Len=0 MSS=1460 SACK_PERM=1 TSval=1209923600 TSecr=0 WS=256
238934  82.912850 15.186.164.176 -> 41.177.26.46 TCP 70 56869 > http [ACK] Seq=1 Ack=1 Win=5888 Len=0 TSval=1209923671 TSecr=1509553742
239072  82.989958 15.186.164.176 -> 41.177.26.46 TCP 70 56869 > http [ACK] Seq=413 Ack=236 Win=6912 Len=0 TSval=1209923748 TSecr=1509553750
239096  83.019258 15.186.164.176 -> 41.177.26.46 TCP 70 56869 > http [ACK] Seq=413 Ack=1684 Win=9984 Len=0 TSval=1209923777 TSecr=1509553753
239099  83.019415 15.186.164.176 -> 41.177.26.46 TCP 70 56869 > http [ACK] Seq=413 Ack=3132 Win=12800 Len=0 TSval=1209923777 TSecr=1509553753
239163  83.061150 15.186.164.176 -> 41.177.26.46 TCP 70 56869 > http [ACK] Seq=413 Ack=4580 Win=15616 Len=0 TSval=1209923819 TSecr=1509553757
239165  83.061670 15.186.164.176 -> 41.177.26.46 TCP 70 56869 > http [ACK] Seq=413 Ack=6028 Win=18688 Len=0 TSval=1209923820 TSecr=1509553757
239218  83.090459 15.186.164.176 -> 41.177.26.46 TCP 70 56869 > http [ACK] Seq=413 Ack=7476 Win=21504 Len=0 TSval=1209923849 TSecr=1509553760
239219  83.090607 15.186.164.176 -> 41.177.26.46 TCP 70 56869 > http [ACK] Seq=413 Ack=8428 Win=24320 Len=0 TSval=1209923849 TSecr=1509553760
239220  83.090905 15.186.164.176 -> 41.177.26.46 TCP 70 56869 > http [FIN, ACK] Seq=413 Ack=9392 Win=27392 Len=0 TSval=1209923849 TSecr=1509553760
457519 149.436613 15.186.164.176 -> 41.177.26.46 TCP 78 p-net-local > http [SYN] Seq=0 Win=5840 Len=0 MSS=1460 SACK_PERM=1 TSval=1209990196 TSecr=0 WS=256
457727 149.506323 15.186.164.176 -> 41.177.26.46 TCP 70 p-net-local > http [ACK] Seq=1 Ack=1 Win=5888 Len=0 TSval=1209990266 TSecr=1509560402
457972 149.600720 15.186.164.176 -> 41.177.26.46 TCP 70 p-net-local > http [ACK] Seq=410 Ack=997 Win=7936 Len=0 TSval=1209990360 TSecr=1509560411
457974 149.601091 15.186.164.176 -> 41.177.26.46 TCP 70 p-net-local > http [FIN, ACK] Seq=410 Ack=998 Win=7936 Len=0 TSval=1209990360 TSecr=1509560411
994233 331.791687 15.186.164.176 -> 41.177.26.46 TCP 78 50433 > http [SYN] Seq=0 Win=5840 Len=0 MSS=1460 SACK_PERM=1 TSval=1210172548 TSecr=0 WS=256
994453 331.862929 15.186.164.176 -> 41.177.26.46 TCP 70 50433 > http [ACK] Seq=1 Ack=1 Win=5888 Len=0 TSval=1210172619 TSecr=1509578637
994820 331.953002 15.186.164.176 -> 41.177.26.46 TCP 70 50433 > http [ACK] Seq=413 Ack=1449 Win=8960 Len=0 TSval=1210172709 TSecr=1509578646
994821 331.953007 15.186.164.176 -> 41.177.26.46 TCP 70 50433 > http [ACK] Seq=413 Ack=2897 Win=11776 Len=0 TSval=1210172709 TSecr=1509578646
994822 331.953011 15.186.164.176 -> 41.177.26.46 TCP 70 50433 > http [ACK] Seq=413 Ack=2923 Win=11776 Len=0 TSval=1210172709 TSecr=1509578646
994829 331.953579 15.186.164.176 -> 41.177.26.46 TCP 70 50433 > http [FIN, ACK] Seq=413 Ack=2924 Win=11776 Len=0 TSval=1210172710 TSecr=1509578646
