61577  25.190217 15.186.110.41 -> 244.3.210.197 TCP 78 38842 > http [SYN] Seq=0 Win=5840 Len=0 MSS=1460 SACK_PERM=1 TSval=1208731235 TSecr=0 WS=256
61754  25.259605 15.186.110.41 -> 244.3.210.197 TCP 70 38842 > http [ACK] Seq=1 Ack=1 Win=5888 Len=0 TSval=1208731304 TSecr=0
62445  25.654752 15.186.110.41 -> 244.3.210.197 TCP 70 38842 > http [ACK] Seq=457 Ack=1449 Win=8960 Len=0 TSval=1208731699 TSecr=150404268
62446  25.654757 15.186.110.41 -> 244.3.210.197 TCP 70 38842 > http [ACK] Seq=457 Ack=2897 Win=11776 Len=0 TSval=1208731699 TSecr=150404268
62517  25.724292 15.186.110.41 -> 244.3.210.197 TCP 70 38842 > http [ACK] Seq=457 Ack=4345 Win=14592 Len=0 TSval=1208731769 TSecr=150404269
62518  25.724296 15.186.110.41 -> 244.3.210.197 TCP 70 38842 > http [ACK] Seq=457 Ack=5793 Win=17664 Len=0 TSval=1208731769 TSecr=150404269
62523  25.724482 15.186.110.41 -> 244.3.210.197 TCP 70 38842 > http [ACK] Seq=457 Ack=7241 Win=20480 Len=0 TSval=1208731769 TSecr=150404269
62524  25.724486 15.186.110.41 -> 244.3.210.197 TCP 70 38842 > http [ACK] Seq=457 Ack=8689 Win=23296 Len=0 TSval=1208731769 TSecr=150404269
62697  25.793897 15.186.110.41 -> 244.3.210.197 TCP 70 38842 > http [ACK] Seq=457 Ack=10137 Win=26112 Len=0 TSval=1208731839 TSecr=150404269
62698  25.793903 15.186.110.41 -> 244.3.210.197 TCP 70 38842 > http [ACK] Seq=457 Ack=11585 Win=26112 Len=0 TSval=1208731839 TSecr=150404269
62699  25.793907 15.186.110.41 -> 244.3.210.197 TCP 70 38842 > http [ACK] Seq=457 Ack=13033 Win=26112 Len=0 TSval=1208731839 TSecr=150404269
62700  25.793910 15.186.110.41 -> 244.3.210.197 TCP 70 38842 > http [ACK] Seq=457 Ack=15929 Win=26112 Len=0 TSval=1208731839 TSecr=150404269
62719  25.794326 15.186.110.41 -> 244.3.210.197 TCP 70 38842 > http [FIN, ACK] Seq=457 Ack=17278 Win=26112 Len=0 TSval=1208731839 TSecr=150404269
155059  52.933874 15.186.110.41 -> 244.3.210.197 TCP 78 41953 > http [SYN] Seq=0 Win=5840 Len=0 MSS=1460 SACK_PERM=1 TSval=1208758978 TSecr=0 WS=256
155300  53.003345 15.186.110.41 -> 244.3.210.197 TCP 70 41953 > http [ACK] Seq=1 Ack=1 Win=5888 Len=0 TSval=1208759047 TSecr=0
156565  53.319175 15.186.110.41 -> 244.3.210.197 TCP 70 41953 > http [ACK] Seq=424 Ack=1449 Win=8960 Len=0 TSval=1208759363 TSecr=150404545
156566  53.319180 15.186.110.41 -> 244.3.210.197 TCP 70 41953 > http [ACK] Seq=424 Ack=2897 Win=11776 Len=0 TSval=1208759363 TSecr=150404545
156771  53.388754 15.186.110.41 -> 244.3.210.197 TCP 70 41953 > http [ACK] Seq=424 Ack=4345 Win=14592 Len=0 TSval=1208759433 TSecr=150404546
156777  53.389401 15.186.110.41 -> 244.3.210.197 TCP 70 41953 > http [FIN, ACK] Seq=424 Ack=5464 Win=17664 Len=0 TSval=1208759433 TSecr=150404546
226901  77.541423 15.186.110.41 -> 244.3.210.197 TCP 78 44790 > http [SYN] Seq=0 Win=5840 Len=0 MSS=1460 SACK_PERM=1 TSval=1208783585 TSecr=0 WS=256
227036  77.610863 15.186.110.41 -> 244.3.210.197 TCP 70 44790 > http [ACK] Seq=1 Ack=1 Win=5888 Len=0 TSval=1208783654 TSecr=0
227753  78.035163 15.186.110.41 -> 244.3.210.197 TCP 70 44790 > http [ACK] Seq=502 Ack=1449 Win=8960 Len=0 TSval=1208784078 TSecr=150404792
227754  78.035167 15.186.110.41 -> 244.3.210.197 TCP 70 44790 > http [ACK] Seq=502 Ack=2897 Win=11776 Len=0 TSval=1208784079 TSecr=150404792
227841  78.104789 15.186.110.41 -> 244.3.210.197 TCP 70 44790 > http [ACK] Seq=502 Ack=4345 Win=14592 Len=0 TSval=1208784148 TSecr=150404793
227842  78.104795 15.186.110.41 -> 244.3.210.197 TCP 70 44790 > http [ACK] Seq=502 Ack=5793 Win=17664 Len=0 TSval=1208784148 TSecr=150404793
227843  78.104830 15.186.110.41 -> 244.3.210.197 TCP 70 44790 > http [ACK] Seq=502 Ack=7241 Win=20480 Len=0 TSval=1208784148 TSecr=150404793
227844  78.104834 15.186.110.41 -> 244.3.210.197 TCP 70 44790 > http [ACK] Seq=502 Ack=8689 Win=23296 Len=0 TSval=1208784148 TSecr=150404793
227937  78.174408 15.186.110.41 -> 244.3.210.197 TCP 70 44790 > http [ACK] Seq=502 Ack=10137 Win=26112 Len=0 TSval=1208784218 TSecr=150404793
227938  78.174414 15.186.110.41 -> 244.3.210.197 TCP 70 44790 > http [ACK] Seq=502 Ack=11585 Win=26112 Len=0 TSval=1208784218 TSecr=150404793
227939  78.174417 15.186.110.41 -> 244.3.210.197 TCP 70 44790 > http [ACK] Seq=502 Ack=11645 Win=26112 Len=0 TSval=1208784218 TSecr=150404793
227955  78.174782 15.186.110.41 -> 244.3.210.197 TCP 70 44790 > http [FIN, ACK] Seq=502 Ack=12287 Win=26112 Len=0 TSval=1208784218 TSecr=150404793
452363 147.349645 15.186.110.41 -> 244.3.210.197 TCP 78 52234 > http [SYN] Seq=0 Win=5840 Len=0 MSS=1460 SACK_PERM=1 TSval=1208853393 TSecr=0 WS=256
452597 147.418222 15.186.110.41 -> 244.3.210.197 TCP 70 52234 > http [ACK] Seq=1 Ack=1 Win=5888 Len=0 TSval=1208853461 TSecr=0
453186 147.787632 15.186.110.41 -> 244.3.210.197 TCP 70 52234 > http [ACK] Seq=518 Ack=1449 Win=8960 Len=0 TSval=1208853831 TSecr=150405490
453187 147.787636 15.186.110.41 -> 244.3.210.197 TCP 70 52234 > http [ACK] Seq=518 Ack=2897 Win=11776 Len=0 TSval=1208853831 TSecr=150405490
453371 147.856352 15.186.110.41 -> 244.3.210.197 TCP 70 52234 > http [ACK] Seq=518 Ack=4345 Win=14592 Len=0 TSval=1208853899 TSecr=150405490
453372 147.856356 15.186.110.41 -> 244.3.210.197 TCP 70 52234 > http [ACK] Seq=518 Ack=5793 Win=17664 Len=0 TSval=1208853899 TSecr=150405490
453375 147.856444 15.186.110.41 -> 244.3.210.197 TCP 70 52234 > http [ACK] Seq=518 Ack=7241 Win=20480 Len=0 TSval=1208853899 TSecr=150405490
453379 147.856521 15.186.110.41 -> 244.3.210.197 TCP 70 52234 > http [ACK] Seq=518 Ack=8689 Win=23296 Len=0 TSval=1208853899 TSecr=150405490
453557 147.924939 15.186.110.41 -> 244.3.210.197 TCP 70 52234 > http [ACK] Seq=518 Ack=10137 Win=26112 Len=0 TSval=1208853968 TSecr=150405491
453558 147.925039 15.186.110.41 -> 244.3.210.197 TCP 70 52234 > http [ACK] Seq=518 Ack=11585 Win=26112 Len=0 TSval=1208853968 TSecr=150405491
453565 147.925125 15.186.110.41 -> 244.3.210.197 TCP 70 52234 > http [ACK] Seq=518 Ack=13033 Win=26112 Len=0 TSval=1208853968 TSecr=150405491
453569 147.925163 15.186.110.41 -> 244.3.210.197 TCP 70 52234 > http [ACK] Seq=518 Ack=15929 Win=26112 Len=0 TSval=1208853968 TSecr=150405491
453570 147.925167 15.186.110.41 -> 244.3.210.197 TCP 70 52234 > http [ACK] Seq=518 Ack=17461 Win=26112 Len=0 TSval=1208853968 TSecr=150405491
453579 147.925438 15.186.110.41 -> 244.3.210.197 TCP 70 52234 > http [FIN, ACK] Seq=518 Ack=18063 Win=26112 Len=0 TSval=1208853968 TSecr=150405491
877298 290.832283 15.186.110.41 -> 244.3.210.197 TCP 78 38882 > http [SYN] Seq=0 Win=5840 Len=0 MSS=1460 SACK_PERM=1 TSval=1208996872 TSecr=0 WS=256
877358 290.900713 15.186.110.41 -> 244.3.210.197 TCP 70 38882 > http [ACK] Seq=1 Ack=1 Win=5888 Len=0 TSval=1208996941 TSecr=0
877944 291.348630 15.186.110.41 -> 244.3.210.197 TCP 70 38882 > http [ACK] Seq=406 Ack=1449 Win=8960 Len=0 TSval=1208997389 TSecr=150406925
877945 291.348739 15.186.110.41 -> 244.3.210.197 TCP 70 38882 > http [ACK] Seq=406 Ack=2897 Win=11776 Len=0 TSval=1208997389 TSecr=150406925
878070 291.417394 15.186.110.41 -> 244.3.210.197 TCP 70 38882 > http [ACK] Seq=406 Ack=4345 Win=14592 Len=0 TSval=1208997457 TSecr=150406926
878073 291.417549 15.186.110.41 -> 244.3.210.197 TCP 70 38882 > http [ACK] Seq=406 Ack=5793 Win=17664 Len=0 TSval=1208997457 TSecr=150406926
878074 291.417554 15.186.110.41 -> 244.3.210.197 TCP 70 38882 > http [ACK] Seq=406 Ack=7241 Win=20480 Len=0 TSval=1208997457 TSecr=150406926
878075 291.417558 15.186.110.41 -> 244.3.210.197 TCP 70 38882 > http [ACK] Seq=406 Ack=8689 Win=23296 Len=0 TSval=1208997457 TSecr=150406926
878195 291.486190 15.186.110.41 -> 244.3.210.197 TCP 70 38882 > http [ACK] Seq=406 Ack=10137 Win=26112 Len=0 TSval=1208997526 TSecr=150406926
878196 291.486195 15.186.110.41 -> 244.3.210.197 TCP 70 38882 > http [ACK] Seq=406 Ack=11585 Win=26112 Len=0 TSval=1208997526 TSecr=150406926
878197 291.486198 15.186.110.41 -> 244.3.210.197 TCP 70 38882 > http [ACK] Seq=406 Ack=13033 Win=26112 Len=0 TSval=1208997526 TSecr=150406926
878200 291.486308 15.186.110.41 -> 244.3.210.197 TCP 70 38882 > http [FIN, ACK] Seq=406 Ack=13993 Win=26112 Len=0 TSval=1208997526 TSecr=150406926
