1304   0.351237 15.186.110.142 -> 41.177.26.176 TCP 70 60031 > http [ACK] Seq=1 Ack=1449 Win=35 Len=0 TSval=708513227 TSecr=140341624
1305   0.351242 15.186.110.142 -> 41.177.26.176 TCP 70 60031 > http [ACK] Seq=1 Ack=1514 Win=35 Len=0 TSval=708513227 TSecr=140341624
1352   0.361075 15.186.110.142 -> 41.177.26.176 TCP 70 60031 > http [ACK] Seq=1 Ack=2172 Win=46 Len=0 TSval=708513236 TSecr=140341625
1353   0.361164 15.186.110.142 -> 41.177.26.176 TCP 70 60031 > http [ACK] Seq=1 Ack=2680 Win=46 Len=0 TSval=708513237 TSecr=140341625
1356   0.361496 15.186.110.142 -> 41.177.26.176 TCP 70 60031 > http [ACK] Seq=1 Ack=3812 Win=57 Len=0 TSval=708513237 TSecr=140341625
1464   0.420256 15.186.110.142 -> 41.177.26.176 TCP 70 60031 > http [ACK] Seq=1 Ack=5260 Win=69 Len=0 TSval=708513296 TSecr=140341631
1465   0.420348 15.186.110.142 -> 41.177.26.176 TCP 70 60031 > http [ACK] Seq=1 Ack=6416 Win=80 Len=0 TSval=708513296 TSecr=140341631
1466   0.420353 15.186.110.142 -> 41.177.26.176 TCP 70 60031 > http [ACK] Seq=1 Ack=7864 Win=91 Len=0 TSval=708513296 TSecr=140341631
1494   0.429842 15.186.110.142 -> 41.177.26.176 TCP 70 60031 > http [ACK] Seq=1 Ack=9312 Win=102 Len=0 TSval=708513305 TSecr=140341632
1495   0.429863 15.186.110.142 -> 41.177.26.176 TCP 70 60031 > http [FIN, ACK] Seq=1 Ack=10507 Win=102 Len=0 TSval=708513305 TSecr=140341632
5000   1.536833 15.186.110.142 -> 41.177.26.176 TCP 78 60188 > http [SYN] Seq=0 Win=5840 Len=0 MSS=1460 SACK_PERM=1 TSval=708514410 TSecr=0 WS=256
5154   1.608114 15.186.110.142 -> 41.177.26.176 TCP 70 60188 > http [ACK] Seq=1 Ack=1 Win=5888 Len=0 TSval=708514481 TSecr=140341750
6466   2.103870 15.186.110.142 -> 41.177.26.176 TCP 78 60252 > http [SYN] Seq=0 Win=5840 Len=0 MSS=1460 SACK_PERM=1 TSval=708514977 TSecr=0 WS=256
6648   2.175252 15.186.110.142 -> 41.177.26.176 TCP 70 60252 > http [ACK] Seq=1 Ack=1 Win=5888 Len=0 TSval=708515048 TSecr=140341806
7558   2.553751 15.186.110.142 -> 41.177.26.176 TCP 70 60252 > http [ACK] Seq=465 Ack=1065 Win=8192 Len=0 TSval=708515427 TSecr=140341844
7559   2.553844 15.186.110.142 -> 41.177.26.176 TCP 70 60252 > http [ACK] Seq=465 Ack=2513 Win=11008 Len=0 TSval=708515427 TSecr=140341844
7560   2.553849 15.186.110.142 -> 41.177.26.176 TCP 70 60252 > http [ACK] Seq=465 Ack=3132 Win=13824 Len=0 TSval=708515427 TSecr=140341844
7684   2.625011 15.186.110.142 -> 41.177.26.176 TCP 70 60252 > http [ACK] Seq=465 Ack=4580 Win=16896 Len=0 TSval=708515498 TSecr=140341851
7692   2.625292 15.186.110.142 -> 41.177.26.176 TCP 70 60252 > http [ACK] Seq=465 Ack=5848 Win=19712 Len=0 TSval=708515498 TSecr=140341851
7694   2.625391 15.186.110.142 -> 41.177.26.176 TCP 70 60252 > http [ACK] Seq=465 Ack=7121 Win=22528 Len=0 TSval=708515498 TSecr=140341851
7695   2.625395 15.186.110.142 -> 41.177.26.176 TCP 70 60252 > http [ACK] Seq=465 Ack=8569 Win=25344 Len=0 TSval=708515498 TSecr=140341851
7696   2.625399 15.186.110.142 -> 41.177.26.176 TCP 70 60252 > http [ACK] Seq=465 Ack=9908 Win=25344 Len=0 TSval=708515498 TSecr=140341851
7697   2.625403 15.186.110.142 -> 41.177.26.176 TCP 70 60252 > http [ACK] Seq=465 Ack=11172 Win=25344 Len=0 TSval=708515498 TSecr=140341851
7817   2.696360 15.186.110.142 -> 41.177.26.176 TCP 70 60252 > http [ACK] Seq=465 Ack=13890 Win=25344 Len=0 TSval=708515569 TSecr=140341858
7818   2.696567 15.186.110.142 -> 41.177.26.176 TCP 70 60252 > http [ACK] Seq=465 Ack=16617 Win=25344 Len=0 TSval=708515569 TSecr=140341858
7820   2.696624 15.186.110.142 -> 41.177.26.176 TCP 70 60252 > http [ACK] Seq=465 Ack=17969 Win=25344 Len=0 TSval=708515569 TSecr=140341858
7821   2.696797 15.186.110.142 -> 41.177.26.176 TCP 70 60252 > http [ACK] Seq=465 Ack=20692 Win=25344 Len=0 TSval=708515570 TSecr=140341858
7822   2.696906 15.186.110.142 -> 41.177.26.176 TCP 70 60252 > http [ACK] Seq=465 Ack=23434 Win=25344 Len=0 TSval=708515570 TSecr=140341858
7823   2.696910 15.186.110.142 -> 41.177.26.176 TCP 70 60252 > http [ACK] Seq=465 Ack=24240 Win=25344 Len=0 TSval=708515570 TSecr=140341858
7915   2.767847 15.186.110.142 -> 41.177.26.176 TCP 70 60252 > http [FIN, ACK] Seq=465 Ack=24924 Win=25344 Len=0 TSval=708515641 TSecr=140341866
8799   3.120796 15.186.110.142 -> 41.177.26.176 TCP 70 60188 > http [ACK] Seq=452 Ack=1449 Win=8960 Len=0 TSval=708515994 TSecr=140341901
8800   3.120961 15.186.110.142 -> 41.177.26.176 TCP 70 60188 > http [ACK] Seq=452 Ack=2239 Win=11776 Len=0 TSval=708515994 TSecr=140341901
8802   3.121087 15.186.110.142 -> 41.177.26.176 TCP 70 60188 > http [ACK] Seq=452 Ack=3687 Win=14592 Len=0 TSval=708515994 TSecr=140341901
8928   3.192292 15.186.110.142 -> 41.177.26.176 TCP 70 60188 > http [ACK] Seq=452 Ack=5025 Win=17664 Len=0 TSval=708516065 TSecr=140341908
8929   3.192297 15.186.110.142 -> 41.177.26.176 TCP 70 60188 > http [ACK] Seq=452 Ack=6245 Win=20480 Len=0 TSval=708516065 TSecr=140341908
8930   3.192301 15.186.110.142 -> 41.177.26.176 TCP 70 60188 > http [ACK] Seq=452 Ack=7693 Win=23296 Len=0 TSval=708516065 TSecr=140341908
8931   3.192305 15.186.110.142 -> 41.177.26.176 TCP 70 60188 > http [ACK] Seq=452 Ack=9141 Win=26112 Len=0 TSval=708516065 TSecr=140341908
8933   3.192322 15.186.110.142 -> 41.177.26.176 TCP 70 60188 > http [FIN, ACK] Seq=452 Ack=9215 Win=26112 Len=0 TSval=708516065 TSecr=140341908
21801   7.588232 15.186.110.142 -> 41.177.26.176 TCP 78 60701 > http [SYN] Seq=0 Win=5840 Len=0 MSS=1460 SACK_PERM=1 TSval=708520463 TSecr=0 WS=256
21916   7.657776 15.186.110.142 -> 41.177.26.176 TCP 70 60701 > http [ACK] Seq=1 Ack=1 Win=5888 Len=0 TSval=708520532 TSecr=140342355
28290  11.418034 15.186.110.142 -> 41.177.26.176 TCP 70 60701 > http [ACK] Seq=445 Ack=1449 Win=8960 Len=0 TSval=708524293 TSecr=140342731
28291  11.418039 15.186.110.142 -> 41.177.26.176 TCP 70 60701 > http [ACK] Seq=445 Ack=2316 Win=11776 Len=0 TSval=708524293 TSecr=140342731
28293  11.418335 15.186.110.142 -> 41.177.26.176 TCP 70 60701 > http [ACK] Seq=445 Ack=3764 Win=14592 Len=0 TSval=708524293 TSecr=140342731
28294  11.418340 15.186.110.142 -> 41.177.26.176 TCP 70 60701 > http [ACK] Seq=445 Ack=4458 Win=14592 Len=0 TSval=708524293 TSecr=140342731
28295  11.418345 15.186.110.142 -> 41.177.26.176 TCP 70 60701 > http [ACK] Seq=445 Ack=4667 Win=14592 Len=0 TSval=708524293 TSecr=140342731
28301  11.418566 15.186.110.142 -> 41.177.26.176 TCP 70 60701 > http [ACK] Seq=445 Ack=5387 Win=14592 Len=0 TSval=708524293 TSecr=140342731
28302  11.418571 15.186.110.142 -> 41.177.26.176 TCP 70 60701 > http [ACK] Seq=445 Ack=5754 Win=14592 Len=0 TSval=708524293 TSecr=140342731
28488  11.488339 15.186.110.142 -> 41.177.26.176 TCP 70 60701 > http [ACK] Seq=445 Ack=7052 Win=17664 Len=0 TSval=708524362 TSecr=140342738
28489  11.488409 15.186.110.142 -> 41.177.26.176 TCP 70 60701 > http [ACK] Seq=445 Ack=8276 Win=20480 Len=0 TSval=708524362 TSecr=140342738
28490  11.488414 15.186.110.142 -> 41.177.26.176 TCP 70 60701 > http [ACK] Seq=445 Ack=9724 Win=23296 Len=0 TSval=708524362 TSecr=140342738
28491  11.488418 15.186.110.142 -> 41.177.26.176 TCP 70 60701 > http [ACK] Seq=445 Ack=11172 Win=26112 Len=0 TSval=708524362 TSecr=140342738
28492  11.488891 15.186.110.142 -> 41.177.26.176 TCP 70 60701 > http [FIN, ACK] Seq=445 Ack=11249 Win=26112 Len=0 TSval=708524363 TSecr=140342738
49810  20.220891 15.186.110.142 -> 41.177.26.176 TCP 78 33390 > http [SYN] Seq=0 Win=5840 Len=0 MSS=1460 SACK_PERM=1 TSval=708533096 TSecr=0 WS=256
49969  20.289790 15.186.110.142 -> 41.177.26.176 TCP 70 33390 > http [ACK] Seq=1 Ack=1 Win=5888 Len=0 TSval=708533165 TSecr=140343618
51465  21.128051 15.186.110.142 -> 41.177.26.176 TCP 70 33390 > http [ACK] Seq=504 Ack=1419 Win=8704 Len=0 TSval=708534003 TSecr=140343702
51478  21.139010 15.186.110.142 -> 41.177.26.176 TCP 70 33390 > http [ACK] Seq=504 Ack=2065 Win=11520 Len=0 TSval=708534014 TSecr=140343703
51479  21.139206 15.186.110.142 -> 41.177.26.176 TCP 70 33390 > http [ACK] Seq=504 Ack=2296 Win=11520 Len=0 TSval=708534014 TSecr=140343703
51480  21.139211 15.186.110.142 -> 41.177.26.176 TCP 70 33390 > http [ACK] Seq=504 Ack=2381 Win=11520 Len=0 TSval=708534014 TSecr=140343703
51484  21.139350 15.186.110.142 -> 41.177.26.176 TCP 70 33390 > http [ACK] Seq=504 Ack=2846 Win=11520 Len=0 TSval=708534014 TSecr=140343703
51487  21.139601 15.186.110.142 -> 41.177.26.176 TCP 70 33390 > http [ACK] Seq=504 Ack=3571 Win=14592 Len=0 TSval=708534015 TSecr=140343703
51573  21.196880 15.186.110.142 -> 41.177.26.176 TCP 70 33390 > http [ACK] Seq=504 Ack=5019 Win=17408 Len=0 TSval=708534072 TSecr=140343709
51574  21.196885 15.186.110.142 -> 41.177.26.176 TCP 70 33390 > http [ACK] Seq=504 Ack=6208 Win=20224 Len=0 TSval=708534072 TSecr=140343709
51597  21.207868 15.186.110.142 -> 41.177.26.176 TCP 70 33390 > http [ACK] Seq=504 Ack=7656 Win=23040 Len=0 TSval=708534083 TSecr=140343710
51598  21.207873 15.186.110.142 -> 41.177.26.176 TCP 70 33390 > http [ACK] Seq=504 Ack=9104 Win=26112 Len=0 TSval=708534083 TSecr=140343710
51599  21.208112 15.186.110.142 -> 41.177.26.176 TCP 70 33390 > http [FIN, ACK] Seq=504 Ack=10191 Win=26112 Len=0 TSval=708534083 TSecr=140343710
56819  23.321945 15.186.110.142 -> 41.177.26.176 TCP 78 33625 > http [SYN] Seq=0 Win=5840 Len=0 MSS=1460 SACK_PERM=1 TSval=708536197 TSecr=0 WS=256
57020  23.390679 15.186.110.142 -> 41.177.26.176 TCP 70 33625 > http [ACK] Seq=1 Ack=1 Win=5888 Len=0 TSval=708536266 TSecr=140343928
59679  24.034411 15.186.110.142 -> 41.177.26.176 TCP 70 33625 > http [ACK] Seq=475 Ack=1449 Win=8960 Len=0 TSval=708536909 TSecr=140343992
59680  24.034555 15.186.110.142 -> 41.177.26.176 TCP 70 33625 > http [ACK] Seq=475 Ack=2109 Win=11776 Len=0 TSval=708536910 TSecr=140343992
59681  24.034560 15.186.110.142 -> 41.177.26.176 TCP 70 33625 > http [ACK] Seq=475 Ack=3557 Win=14592 Len=0 TSval=708536910 TSecr=140343992
59682  24.034564 15.186.110.142 -> 41.177.26.176 TCP 70 33625 > http [ACK] Seq=475 Ack=3998 Win=14592 Len=0 TSval=708536910 TSecr=140343992
59837  24.103352 15.186.110.142 -> 41.177.26.176 TCP 70 33625 > http [ACK] Seq=475 Ack=5395 Win=17664 Len=0 TSval=708536978 TSecr=140343999
59838  24.103372 15.186.110.142 -> 41.177.26.176 TCP 70 33625 > http [ACK] Seq=475 Ack=6712 Win=20480 Len=0 TSval=708536978 TSecr=140343999
59839  24.103512 15.186.110.142 -> 41.177.26.176 TCP 70 33625 > http [ACK] Seq=475 Ack=7908 Win=23296 Len=0 TSval=708536979 TSecr=140343999
59840  24.103518 15.186.110.142 -> 41.177.26.176 TCP 70 33625 > http [ACK] Seq=475 Ack=9253 Win=26112 Len=0 TSval=708536979 TSecr=140343999
59841  24.103763 15.186.110.142 -> 41.177.26.176 TCP 70 33625 > http [ACK] Seq=475 Ack=11603 Win=26112 Len=0 TSval=708536979 TSecr=140343999
59927  24.143720 15.186.110.142 -> 41.177.26.176 TCP 70 33625 > http [ACK] Seq=475 Ack=13051 Win=26112 Len=0 TSval=708537019 TSecr=140343999
59965  24.172364 15.186.110.142 -> 41.177.26.176 TCP 70 33625 > http [ACK] Seq=475 Ack=14706 Win=26112 Len=0 TSval=708537047 TSecr=140344006
59968  24.172543 15.186.110.142 -> 41.177.26.176 TCP 70 33625 > http [FIN, ACK] Seq=475 Ack=14706 Win=26112 Len=0 TSval=708537047 TSecr=140344006
64556  26.665870 15.186.110.142 -> 41.177.26.176 TCP 78 33880 > http [SYN] Seq=0 Win=5840 Len=0 MSS=1460 SACK_PERM=1 TSval=708539541 TSecr=0 WS=256
64786  26.734819 15.186.110.142 -> 41.177.26.176 TCP 70 33880 > http [ACK] Seq=1 Ack=1 Win=5888 Len=0 TSval=708539610 TSecr=140344263
68339  28.141446 15.186.110.142 -> 41.177.26.176 TCP 70 33880 > http [ACK] Seq=480 Ack=1401 Win=8704 Len=0 TSval=708541016 TSecr=140344403
68353  28.152006 15.186.110.142 -> 41.177.26.176 TCP 70 33880 > http [ACK] Seq=480 Ack=2059 Win=11520 Len=0 TSval=708541027 TSecr=140344404
68354  28.152130 15.186.110.142 -> 41.177.26.176 TCP 70 33880 > http [ACK] Seq=480 Ack=2262 Win=11520 Len=0 TSval=708541027 TSecr=140344404
68357  28.152257 15.186.110.142 -> 41.177.26.176 TCP 70 33880 > http [ACK] Seq=480 Ack=2347 Win=11520 Len=0 TSval=708541027 TSecr=140344404
68359  28.152352 15.186.110.142 -> 41.177.26.176 TCP 70 33880 > http [ACK] Seq=480 Ack=2550 Win=11520 Len=0 TSval=708541027 TSecr=140344404
68360  28.152373 15.186.110.142 -> 41.177.26.176 TCP 70 33880 > http [ACK] Seq=480 Ack=2756 Win=11520 Len=0 TSval=708541027 TSecr=140344404
68361  28.152816 15.186.110.142 -> 41.177.26.176 TCP 70 33880 > http [ACK] Seq=480 Ack=3222 Win=14336 Len=0 TSval=708541028 TSecr=140344404
68421  28.210397 15.186.110.142 -> 41.177.26.176 TCP 70 33880 > http [ACK] Seq=480 Ack=4670 Win=17152 Len=0 TSval=708541085 TSecr=140344410
68422  28.210457 15.186.110.142 -> 41.177.26.176 TCP 70 33880 > http [ACK] Seq=480 Ack=5663 Win=20224 Len=0 TSval=708541085 TSecr=140344410
68448  28.220907 15.186.110.142 -> 41.177.26.176 TCP 70 33880 > http [ACK] Seq=480 Ack=7111 Win=23040 Len=0 TSval=708541096 TSecr=140344411
68449  28.220946 15.186.110.142 -> 41.177.26.176 TCP 70 33880 > http [ACK] Seq=480 Ack=8559 Win=25856 Len=0 TSval=708541096 TSecr=140344411
68450  28.221032 15.186.110.142 -> 41.177.26.176 TCP 70 33880 > http [FIN, ACK] Seq=480 Ack=9669 Win=25856 Len=0 TSval=708541096 TSecr=140344411
84812  32.903622 15.186.110.142 -> 41.177.26.176 TCP 78 34322 > http [SYN] Seq=0 Win=5840 Len=0 MSS=1460 SACK_PERM=1 TSval=708545776 TSecr=0 WS=256
84972  32.974852 15.186.110.142 -> 41.177.26.176 TCP 70 34322 > http [ACK] Seq=1 Ack=1 Win=5888 Len=0 TSval=708545847 TSecr=140344886
88752  34.282599 15.186.110.142 -> 41.177.26.176 TCP 70 34322 > http [ACK] Seq=512 Ack=1429 Win=8704 Len=0 TSval=708547155 TSecr=140345017
88775  34.293572 15.186.110.142 -> 41.177.26.176 TCP 70 34322 > http [ACK] Seq=512 Ack=2087 Win=11776 Len=0 TSval=708547166 TSecr=140345018
88779  34.294033 15.186.110.142 -> 41.177.26.176 TCP 70 34322 > http [ACK] Seq=512 Ack=2326 Win=11776 Len=0 TSval=708547166 TSecr=140345018
88780  34.294094 15.186.110.142 -> 41.177.26.176 TCP 70 34322 > http [ACK] Seq=512 Ack=2411 Win=11776 Len=0 TSval=708547166 TSecr=140345018
88781  34.294098 15.186.110.142 -> 41.177.26.176 TCP 70 34322 > http [ACK] Seq=512 Ack=2892 Win=11776 Len=0 TSval=708547167 TSecr=140345018
88783  34.294200 15.186.110.142 -> 41.177.26.176 TCP 70 34322 > http [ACK] Seq=512 Ack=3394 Win=14592 Len=0 TSval=708547167 TSecr=140345018
88965  34.354620 15.186.110.142 -> 41.177.26.176 TCP 70 34322 > http [ACK] Seq=512 Ack=4842 Win=17408 Len=0 TSval=708547227 TSecr=140345024
88966  34.354625 15.186.110.142 -> 41.177.26.176 TCP 70 34322 > http [ACK] Seq=512 Ack=5852 Win=20224 Len=0 TSval=708547227 TSecr=140345024
88974  34.364825 15.186.110.142 -> 41.177.26.176 TCP 70 34322 > http [ACK] Seq=512 Ack=7300 Win=23296 Len=0 TSval=708547237 TSecr=140345025
88975  34.364896 15.186.110.142 -> 41.177.26.176 TCP 70 34322 > http [ACK] Seq=512 Ack=8748 Win=26112 Len=0 TSval=708547237 TSecr=140345025
88976  34.365149 15.186.110.142 -> 41.177.26.176 TCP 70 34322 > http [FIN, ACK] Seq=512 Ack=9881 Win=26112 Len=0 TSval=708547238 TSecr=140345025
101654  37.323711 15.186.110.142 -> 41.177.26.176 TCP 78 34634 > http [SYN] Seq=0 Win=5840 Len=0 MSS=1460 SACK_PERM=1 TSval=708550196 TSecr=0 WS=256
102028  37.394854 15.186.110.142 -> 41.177.26.176 TCP 70 34634 > http [ACK] Seq=1 Ack=1 Win=5888 Len=0 TSval=708550267 TSecr=140345328
105280  38.004208 15.186.110.142 -> 41.177.26.176 TCP 70 34634 > http [ACK] Seq=466 Ack=1449 Win=8960 Len=0 TSval=708550877 TSecr=140345389
105281  38.004211 15.186.110.142 -> 41.177.26.176 TCP 70 34634 > http [ACK] Seq=466 Ack=2089 Win=11776 Len=0 TSval=708550877 TSecr=140345389
105282  38.004216 15.186.110.142 -> 41.177.26.176 TCP 70 34634 > http [ACK] Seq=466 Ack=3537 Win=14592 Len=0 TSval=708550877 TSecr=140345389
105283  38.004287 15.186.110.142 -> 41.177.26.176 TCP 70 34634 > http [ACK] Seq=466 Ack=4225 Win=14592 Len=0 TSval=708550877 TSecr=140345389
105371  38.021244 15.186.110.142 -> 41.177.26.176 TCP 70 34634 > http [FIN, ACK] Seq=466 Ack=4226 Win=14592 Len=0 TSval=708550894 TSecr=140345391
118857  42.681044 15.186.110.142 -> 41.177.26.176 TCP 78 35076 > http [SYN] Seq=0 Win=5840 Len=0 MSS=1460 SACK_PERM=1 TSval=708555556 TSecr=0 WS=256
119174  42.749969 15.186.110.142 -> 41.177.26.176 TCP 70 35076 > http [ACK] Seq=1 Ack=1 Win=5888 Len=0 TSval=708555625 TSecr=140345864
122290  43.535047 15.186.110.142 -> 41.177.26.176 TCP 70 35076 > http [ACK] Seq=504 Ack=1449 Win=8960 Len=0 TSval=708556410 TSecr=140345943
122291  43.535130 15.186.110.142 -> 41.177.26.176 TCP 70 35076 > http [ACK] Seq=504 Ack=2076 Win=11776 Len=0 TSval=708556410 TSecr=140345943
122292  43.535437 15.186.110.142 -> 41.177.26.176 TCP 70 35076 > http [ACK] Seq=504 Ack=3524 Win=14592 Len=0 TSval=708556410 TSecr=140345943
122293  43.535442 15.186.110.142 -> 41.177.26.176 TCP 70 35076 > http [ACK] Seq=504 Ack=3606 Win=14592 Len=0 TSval=708556410 TSecr=140345943
122294  43.535446 15.186.110.142 -> 41.177.26.176 TCP 70 35076 > http [ACK] Seq=504 Ack=3612 Win=14592 Len=0 TSval=708556410 TSecr=140345943
122302  43.535807 15.186.110.142 -> 41.177.26.176 TCP 70 35076 > http [ACK] Seq=504 Ack=4326 Win=14592 Len=0 TSval=708556410 TSecr=140345943
122470  43.604049 15.186.110.142 -> 41.177.26.176 TCP 70 35076 > http [ACK] Seq=504 Ack=5769 Win=17664 Len=0 TSval=708556479 TSecr=140345949
122472  43.604314 15.186.110.142 -> 41.177.26.176 TCP 70 35076 > http [ACK] Seq=504 Ack=6979 Win=20480 Len=0 TSval=708556479 TSecr=140345949
122473  43.604351 15.186.110.142 -> 41.177.26.176 TCP 70 35076 > http [ACK] Seq=504 Ack=8187 Win=23296 Len=0 TSval=708556479 TSecr=140345949
122474  43.604388 15.186.110.142 -> 41.177.26.176 TCP 70 35076 > http [ACK] Seq=504 Ack=9909 Win=26112 Len=0 TSval=708556479 TSecr=140345949
122475  43.604393 15.186.110.142 -> 41.177.26.176 TCP 70 35076 > http [ACK] Seq=504 Ack=11610 Win=26112 Len=0 TSval=708556479 TSecr=140345949
122476  43.604631 15.186.110.142 -> 41.177.26.176 TCP 70 35076 > http [FIN, ACK] Seq=504 Ack=11610 Win=26112 Len=0 TSval=708556479 TSecr=140345949
135267  47.035953 15.186.110.142 -> 41.177.26.176 TCP 78 35448 > http [SYN] Seq=0 Win=5840 Len=0 MSS=1460 SACK_PERM=1 TSval=708559908 TSecr=0 WS=256
135415  47.107934 15.186.110.142 -> 41.177.26.176 TCP 70 35448 > http [ACK] Seq=1 Ack=1 Win=5888 Len=0 TSval=708559980 TSecr=140346300
136049  47.353199 15.186.110.142 -> 41.177.26.176 TCP 78 35478 > http [SYN] Seq=0 Win=5840 Len=0 MSS=1460 SACK_PERM=1 TSval=708560227 TSecr=0 WS=256
136215  47.423210 15.186.110.142 -> 41.177.26.176 TCP 70 35478 > http [ACK] Seq=1 Ack=1 Win=5888 Len=0 TSval=708560297 TSecr=140346331
137588  47.794819 15.186.110.142 -> 41.177.26.176 TCP 70 35478 > http [ACK] Seq=480 Ack=1065 Win=8192 Len=0 TSval=708560669 TSecr=140346368
137589  47.794833 15.186.110.142 -> 41.177.26.176 TCP 70 35478 > http [ACK] Seq=480 Ack=2513 Win=11008 Len=0 TSval=708560669 TSecr=140346368
137590  47.794880 15.186.110.142 -> 41.177.26.176 TCP 70 35478 > http [ACK] Seq=480 Ack=3132 Win=13824 Len=0 TSval=708560669 TSecr=140346368
137874  47.864456 15.186.110.142 -> 41.177.26.176 TCP 70 35478 > http [ACK] Seq=480 Ack=4580 Win=16896 Len=0 TSval=708560738 TSecr=140346375
137875  47.864460 15.186.110.142 -> 41.177.26.176 TCP 70 35478 > http [ACK] Seq=480 Ack=5849 Win=19712 Len=0 TSval=708560738 TSecr=140346375
137876  47.864602 15.186.110.142 -> 41.177.26.176 TCP 70 35478 > http [ACK] Seq=480 Ack=7187 Win=22528 Len=0 TSval=708560739 TSecr=140346375
137877  47.864607 15.186.110.142 -> 41.177.26.176 TCP 70 35478 > http [ACK] Seq=480 Ack=8523 Win=25344 Len=0 TSval=708560739 TSecr=140346375
137878  47.864611 15.186.110.142 -> 41.177.26.176 TCP 70 35478 > http [ACK] Seq=480 Ack=9881 Win=25344 Len=0 TSval=708560739 TSecr=140346375
137886  47.865110 15.186.110.142 -> 41.177.26.176 TCP 70 35478 > http [ACK] Seq=480 Ack=11248 Win=25344 Len=0 TSval=708560739 TSecr=140346375
138145  47.934327 15.186.110.142 -> 41.177.26.176 TCP 70 35478 > http [ACK] Seq=480 Ack=12614 Win=25344 Len=0 TSval=708560808 TSecr=140346382
138146  47.934480 15.186.110.142 -> 41.177.26.176 TCP 70 35478 > http [ACK] Seq=480 Ack=13973 Win=25344 Len=0 TSval=708560808 TSecr=140346382
138147  47.934485 15.186.110.142 -> 41.177.26.176 TCP 70 35478 > http [ACK] Seq=480 Ack=16667 Win=25344 Len=0 TSval=708560808 TSecr=140346382
138148  47.934508 15.186.110.142 -> 41.177.26.176 TCP 70 35478 > http [FIN, ACK] Seq=480 Ack=17917 Win=25344 Len=0 TSval=708560808 TSecr=140346382
138739  48.077529 15.186.110.142 -> 41.177.26.176 TCP 70 35448 > http [ACK] Seq=488 Ack=1449 Win=8960 Len=0 TSval=708560950 TSecr=140346397
138740  48.077550 15.186.110.142 -> 41.177.26.176 TCP 70 35448 > http [ACK] Seq=488 Ack=1799 Win=8960 Len=0 TSval=708560950 TSecr=140346397
138761  48.089312 15.186.110.142 -> 41.177.26.176 TCP 70 35448 > http [ACK] Seq=488 Ack=2457 Win=11776 Len=0 TSval=708560962 TSecr=140346398
138764  48.089501 15.186.110.142 -> 41.177.26.176 TCP 70 35448 > http [ACK] Seq=488 Ack=2972 Win=11776 Len=0 TSval=708560962 TSecr=140346398
138772  48.089726 15.186.110.142 -> 41.177.26.176 TCP 70 35448 > http [ACK] Seq=488 Ack=3190 Win=11776 Len=0 TSval=708560962 TSecr=140346398
138777  48.089830 15.186.110.142 -> 41.177.26.176 TCP 70 35448 > http [ACK] Seq=488 Ack=3929 Win=14592 Len=0 TSval=708560962 TSecr=140346398
139040  48.148977 15.186.110.142 -> 41.177.26.176 TCP 70 35448 > http [ACK] Seq=488 Ack=5377 Win=17664 Len=0 TSval=708561021 TSecr=140346404
139042  48.149351 15.186.110.142 -> 41.177.26.176 TCP 70 35448 > http [ACK] Seq=488 Ack=6794 Win=20480 Len=0 TSval=708561022 TSecr=140346404
139043  48.149356 15.186.110.142 -> 41.177.26.176 TCP 70 35448 > http [ACK] Seq=488 Ack=8242 Win=23296 Len=0 TSval=708561022 TSecr=140346404
139087  48.160719 15.186.110.142 -> 41.177.26.176 TCP 70 35448 > http [ACK] Seq=488 Ack=9690 Win=26112 Len=0 TSval=708561033 TSecr=140346405
139088  48.160817 15.186.110.142 -> 41.177.26.176 TCP 70 35448 > http [FIN, ACK] Seq=488 Ack=10861 Win=26112 Len=0 TSval=708561033 TSecr=140346405
143579  49.335724 15.186.110.142 -> 41.177.26.176 TCP 78 35643 > http [SYN] Seq=0 Win=5840 Len=0 MSS=1460 SACK_PERM=1 TSval=708562208 TSecr=0 WS=256
143827  49.407002 15.186.110.142 -> 41.177.26.176 TCP 70 35643 > http [ACK] Seq=1 Ack=1 Win=5888 Len=0 TSval=708562279 TSecr=140346529
148904  51.125233 15.186.110.142 -> 41.177.26.176 TCP 70 35643 > http [ACK] Seq=506 Ack=669 Win=7424 Len=0 TSval=708563997 TSecr=140346701
148905  51.125322 15.186.110.142 -> 41.177.26.176 TCP 70 35643 > http [ACK] Seq=506 Ack=1415 Win=8704 Len=0 TSval=708563998 TSecr=140346701
148941  51.147386 15.186.110.142 -> 41.177.26.176 TCP 70 35643 > http [ACK] Seq=506 Ack=2073 Win=10240 Len=0 TSval=708564020 TSecr=140346704
148942  51.147566 15.186.110.142 -> 41.177.26.176 TCP 70 35643 > http [ACK] Seq=506 Ack=2306 Win=10240 Len=0 TSval=708564020 TSecr=140346704
148943  51.147570 15.186.110.142 -> 41.177.26.176 TCP 70 35643 > http [ACK] Seq=506 Ack=2391 Win=10240 Len=0 TSval=708564020 TSecr=140346704
148944  51.147600 15.186.110.142 -> 41.177.26.176 TCP 70 35643 > http [ACK] Seq=506 Ack=2624 Win=10240 Len=0 TSval=708564020 TSecr=140346704
148945  51.147605 15.186.110.142 -> 41.177.26.176 TCP 70 35643 > http [ACK] Seq=506 Ack=2860 Win=10240 Len=0 TSval=708564020 TSecr=140346704
148946  51.147633 15.186.110.142 -> 41.177.26.176 TCP 70 35643 > http [ACK] Seq=506 Ack=3356 Win=11776 Len=0 TSval=708564020 TSecr=140346704
149048  51.196439 15.186.110.142 -> 41.177.26.176 TCP 70 35643 > http [ACK] Seq=506 Ack=4804 Win=14592 Len=0 TSval=708564069 TSecr=140346708
149049  51.196497 15.186.110.142 -> 41.177.26.176 TCP 70 35643 > http [ACK] Seq=506 Ack=5780 Win=17664 Len=0 TSval=708564069 TSecr=140346708
149050  51.196732 15.186.110.142 -> 41.177.26.176 TCP 70 35643 > http [ACK] Seq=506 Ack=7228 Win=20480 Len=0 TSval=708564069 TSecr=140346708
149075  51.218620 15.186.110.142 -> 41.177.26.176 TCP 70 35643 > http [ACK] Seq=506 Ack=8676 Win=23296 Len=0 TSval=708564091 TSecr=140346711
149076  51.218673 15.186.110.142 -> 41.177.26.176 TCP 70 35643 > http [FIN, ACK] Seq=506 Ack=9786 Win=26368 Len=0 TSval=708564091 TSecr=140346711
158889  54.108597 15.186.110.142 -> 41.177.26.176 TCP 78 36003 > http [SYN] Seq=0 Win=5840 Len=0 MSS=1460 SACK_PERM=1 TSval=708566981 TSecr=0 WS=256
159144  54.179801 15.186.110.142 -> 41.177.26.176 TCP 70 36003 > http [ACK] Seq=1 Ack=1 Win=5888 Len=0 TSval=708567052 TSecr=140347007
160549  54.669419 15.186.110.142 -> 41.177.26.176 TCP 70 36003 > http [ACK] Seq=481 Ack=557 Win=7168 Len=0 TSval=708567542 TSecr=140347056
160550  54.669713 15.186.110.142 -> 41.177.26.176 TCP 70 36003 > http [ACK] Seq=481 Ack=2005 Win=9984 Len=0 TSval=708567542 TSecr=140347056
160551  54.669805 15.186.110.142 -> 41.177.26.176 TCP 70 36003 > http [ACK] Seq=481 Ack=3453 Win=12800 Len=0 TSval=708567542 TSecr=140347056
160552  54.669906 15.186.110.142 -> 41.177.26.176 TCP 70 36003 > http [ACK] Seq=481 Ack=3797 Win=12800 Len=0 TSval=708567542 TSecr=140347056
160554  54.671516 15.186.110.142 -> 41.177.26.176 TCP 70 36003 > http [FIN, ACK] Seq=481 Ack=3798 Win=12800 Len=0 TSval=708567544 TSecr=140347056
176408  58.843135 15.186.110.142 -> 41.177.26.176 TCP 78 36316 > http [SYN] Seq=0 Win=5840 Len=0 MSS=1460 SACK_PERM=1 TSval=708571717 TSecr=0 WS=256
176487  58.912557 15.186.110.142 -> 41.177.26.176 TCP 70 36316 > http [ACK] Seq=1 Ack=1 Win=5888 Len=0 TSval=708571786 TSecr=140347480
177003  59.290600 15.186.110.142 -> 41.177.26.176 TCP 70 36316 > http [ACK] Seq=473 Ack=1449 Win=8960 Len=0 TSval=708572164 TSecr=140347518
177004  59.290604 15.186.110.142 -> 41.177.26.176 TCP 70 36316 > http [ACK] Seq=473 Ack=2358 Win=11776 Len=0 TSval=708572164 TSecr=140347518
177009  59.290831 15.186.110.142 -> 41.177.26.176 TCP 70 36316 > http [ACK] Seq=473 Ack=3806 Win=14592 Len=0 TSval=708572165 TSecr=140347518
177010  59.290835 15.186.110.142 -> 41.177.26.176 TCP 70 36316 > http [ACK] Seq=473 Ack=3828 Win=14592 Len=0 TSval=708572165 TSecr=140347518
177129  59.360497 15.186.110.142 -> 41.177.26.176 TCP 70 36316 > http [ACK] Seq=473 Ack=5276 Win=17664 Len=0 TSval=708572234 TSecr=140347525
177130  59.360502 15.186.110.142 -> 41.177.26.176 TCP 70 36316 > http [ACK] Seq=473 Ack=7443 Win=20480 Len=0 TSval=708572234 TSecr=140347525
177131  59.360506 15.186.110.142 -> 41.177.26.176 TCP 70 36316 > http [ACK] Seq=473 Ack=9440 Win=23296 Len=0 TSval=708572234 TSecr=140347525
177132  59.360510 15.186.110.142 -> 41.177.26.176 TCP 70 36316 > http [ACK] Seq=473 Ack=10397 Win=26112 Len=0 TSval=708572234 TSecr=140347525
177133  59.360734 15.186.110.142 -> 41.177.26.176 TCP 70 36316 > http [FIN, ACK] Seq=473 Ack=11068 Win=26112 Len=0 TSval=708572234 TSecr=140347525
183723  61.731117 15.186.110.142 -> 41.177.26.176 TCP 78 36531 > http [SYN] Seq=0 Win=5840 Len=0 MSS=1460 SACK_PERM=1 TSval=708574606 TSecr=0 WS=256
183890  61.800294 15.186.110.142 -> 41.177.26.176 TCP 70 36531 > http [ACK] Seq=1 Ack=1 Win=5888 Len=0 TSval=708574675 TSecr=140347769
187483  63.374516 15.186.110.142 -> 41.177.26.176 TCP 70 36531 > http [ACK] Seq=500 Ack=1394 Win=8704 Len=0 TSval=708576249 TSecr=140347926
187489  63.384308 15.186.110.142 -> 41.177.26.176 TCP 70 36531 > http [ACK] Seq=500 Ack=2052 Win=11520 Len=0 TSval=708576259 TSecr=140347927
187490  63.384313 15.186.110.142 -> 41.177.26.176 TCP 70 36531 > http [ACK] Seq=500 Ack=2279 Win=11520 Len=0 TSval=708576259 TSecr=140347927
187491  63.384317 15.186.110.142 -> 41.177.26.176 TCP 70 36531 > http [ACK] Seq=500 Ack=2506 Win=11520 Len=0 TSval=708576259 TSecr=140347927
187492  63.384321 15.186.110.142 -> 41.177.26.176 TCP 70 36531 > http [ACK] Seq=500 Ack=2591 Win=11520 Len=0 TSval=708576259 TSecr=140347927
187493  63.384593 15.186.110.142 -> 41.177.26.176 TCP 70 36531 > http [ACK] Seq=500 Ack=3317 Win=14336 Len=0 TSval=708576259 TSecr=140347927
187550  63.443331 15.186.110.142 -> 41.177.26.176 TCP 70 36531 > http [ACK] Seq=500 Ack=4765 Win=17152 Len=0 TSval=708576318 TSecr=140347933
187551  63.443517 15.186.110.142 -> 41.177.26.176 TCP 70 36531 > http [ACK] Seq=500 Ack=5803 Win=20224 Len=0 TSval=708576318 TSecr=140347933
187552  63.453147 15.186.110.142 -> 41.177.26.176 TCP 70 36531 > http [ACK] Seq=500 Ack=7251 Win=23040 Len=0 TSval=708576328 TSecr=140347934
187553  63.453152 15.186.110.142 -> 41.177.26.176 TCP 70 36531 > http [ACK] Seq=500 Ack=8699 Win=25856 Len=0 TSval=708576328 TSecr=140347934
187555  63.453291 15.186.110.142 -> 41.177.26.176 TCP 70 36531 > http [FIN, ACK] Seq=500 Ack=10099 Win=25856 Len=0 TSval=708576328 TSecr=140347934
201717  69.632650 15.186.110.142 -> 41.177.26.176 TCP 78 37155 > http [SYN] Seq=0 Win=5840 Len=0 MSS=1460 SACK_PERM=1 TSval=708582507 TSecr=0 WS=256
201901  69.701383 15.186.110.142 -> 41.177.26.176 TCP 70 37155 > http [ACK] Seq=1 Ack=1 Win=5888 Len=0 TSval=708582576 TSecr=140348559
211095  72.711764 15.186.110.142 -> 41.177.26.176 TCP 70 37155 > http [ACK] Seq=453 Ack=1449 Win=8960 Len=0 TSval=708585586 TSecr=140348860
211096  72.711785 15.186.110.142 -> 41.177.26.176 TCP 70 37155 > http [ACK] Seq=453 Ack=2359 Win=11776 Len=0 TSval=708585586 TSecr=140348860
211104  72.712075 15.186.110.142 -> 41.177.26.176 TCP 70 37155 > http [ACK] Seq=453 Ack=3807 Win=14592 Len=0 TSval=708585586 TSecr=140348860
211312  72.780854 15.186.110.142 -> 41.177.26.176 TCP 70 37155 > http [ACK] Seq=453 Ack=5237 Win=17664 Len=0 TSval=708585655 TSecr=140348867
211313  72.780859 15.186.110.142 -> 41.177.26.176 TCP 70 37155 > http [ACK] Seq=453 Ack=6685 Win=20480 Len=0 TSval=708585655 TSecr=140348867
211314  72.780864 15.186.110.142 -> 41.177.26.176 TCP 70 37155 > http [ACK] Seq=453 Ack=7594 Win=23296 Len=0 TSval=708585655 TSecr=140348867
211315  72.780886 15.186.110.142 -> 41.177.26.176 TCP 70 37155 > http [ACK] Seq=453 Ack=9042 Win=26112 Len=0 TSval=708585655 TSecr=140348867
211316  72.781106 15.186.110.142 -> 41.177.26.176 TCP 70 37155 > http [ACK] Seq=453 Ack=10490 Win=26112 Len=0 TSval=708585655 TSecr=140348867
211317  72.781238 15.186.110.142 -> 41.177.26.176 TCP 70 37155 > http [FIN, ACK] Seq=453 Ack=10546 Win=26112 Len=0 TSval=708585655 TSecr=140348867
226169  77.307684 15.186.110.142 -> 41.177.26.176 TCP 78 37711 > http [SYN] Seq=0 Win=5840 Len=0 MSS=1460 SACK_PERM=1 TSval=708590181 TSecr=0 WS=256
226410  77.377096 15.186.110.142 -> 41.177.26.176 TCP 70 37711 > http [ACK] Seq=1 Ack=1 Win=5888 Len=0 TSval=708590250 TSecr=140349327
229046  78.709638 15.186.110.142 -> 41.177.26.176 TCP 78 37796 > http [SYN] Seq=0 Win=5840 Len=0 MSS=1460 SACK_PERM=1 TSval=708591583 TSecr=0 WS=256
229192  78.779727 15.186.110.142 -> 41.177.26.176 TCP 70 37796 > http [ACK] Seq=1 Ack=1 Win=5888 Len=0 TSval=708591653 TSecr=140349467
229591  78.987315 15.186.110.142 -> 41.177.26.176 TCP 70 37711 > http [ACK] Seq=486 Ack=1449 Win=8960 Len=0 TSval=708591861 TSecr=140349488
229592  78.987412 15.186.110.142 -> 41.177.26.176 TCP 70 37711 > http [ACK] Seq=486 Ack=1494 Win=8960 Len=0 TSval=708591861 TSecr=140349488
229611  78.995427 15.186.110.142 -> 41.177.26.176 TCP 70 37711 > http [ACK] Seq=486 Ack=2122 Win=11776 Len=0 TSval=708591869 TSecr=140349488
229612  78.995431 15.186.110.142 -> 41.177.26.176 TCP 70 37711 > http [ACK] Seq=486 Ack=2335 Win=11776 Len=0 TSval=708591869 TSecr=140349489
229613  78.995436 15.186.110.142 -> 41.177.26.176 TCP 70 37711 > http [ACK] Seq=486 Ack=2420 Win=11776 Len=0 TSval=708591869 TSecr=140349489
229616  78.995808 15.186.110.142 -> 41.177.26.176 TCP 70 37711 > http [ACK] Seq=486 Ack=2633 Win=11776 Len=0 TSval=708591869 TSecr=140349489
229617  78.995885 15.186.110.142 -> 41.177.26.176 TCP 70 37711 > http [ACK] Seq=486 Ack=3726 Win=14592 Len=0 TSval=708591869 TSecr=140349489
229737  79.056842 15.186.110.142 -> 41.177.26.176 TCP 70 37711 > http [ACK] Seq=486 Ack=5174 Win=17664 Len=0 TSval=708591930 TSecr=140349495
229738  79.056848 15.186.110.142 -> 41.177.26.176 TCP 70 37711 > http [ACK] Seq=486 Ack=6326 Win=20480 Len=0 TSval=708591930 TSecr=140349495
229741  79.057117 15.186.110.142 -> 41.177.26.176 TCP 70 37711 > http [ACK] Seq=486 Ack=7774 Win=23296 Len=0 TSval=708591931 TSecr=140349495
229762  79.065093 15.186.110.142 -> 41.177.26.176 TCP 70 37711 > http [ACK] Seq=486 Ack=9222 Win=26112 Len=0 TSval=708591938 TSecr=140349495
229763  79.065204 15.186.110.142 -> 41.177.26.176 TCP 70 37711 > http [FIN, ACK] Seq=486 Ack=10225 Win=26112 Len=0 TSval=708591939 TSecr=140349495
231102  79.828023 15.186.110.142 -> 41.177.26.176 TCP 70 37796 > http [ACK] Seq=498 Ack=1394 Win=8704 Len=0 TSval=708592701 TSecr=140349572
231146  79.838214 15.186.110.142 -> 41.177.26.176 TCP 70 37796 > http [ACK] Seq=498 Ack=2052 Win=11520 Len=0 TSval=708592711 TSecr=140349573
231147  79.838218 15.186.110.142 -> 41.177.26.176 TCP 70 37796 > http [ACK] Seq=498 Ack=2277 Win=11520 Len=0 TSval=708592711 TSecr=140349573
231148  79.838221 15.186.110.142 -> 41.177.26.176 TCP 70 37796 > http [ACK] Seq=498 Ack=2362 Win=11520 Len=0 TSval=708592711 TSecr=140349573
231149  79.838335 15.186.110.142 -> 41.177.26.176 TCP 70 37796 > http [ACK] Seq=498 Ack=2815 Win=11520 Len=0 TSval=708592712 TSecr=140349573
231150  79.838340 15.186.110.142 -> 41.177.26.176 TCP 70 37796 > http [ACK] Seq=498 Ack=3529 Win=14336 Len=0 TSval=708592712 TSecr=140349573
231273  79.897803 15.186.110.142 -> 41.177.26.176 TCP 70 37796 > http [ACK] Seq=498 Ack=4977 Win=17152 Len=0 TSval=708592771 TSecr=140349579
231274  79.897808 15.186.110.142 -> 41.177.26.176 TCP 70 37796 > http [ACK] Seq=498 Ack=6098 Win=20224 Len=0 TSval=708592771 TSecr=140349579
231307  79.908159 15.186.110.142 -> 41.177.26.176 TCP 70 37796 > http [ACK] Seq=498 Ack=7546 Win=23040 Len=0 TSval=708592781 TSecr=140349580
231308  79.908163 15.186.110.142 -> 41.177.26.176 TCP 70 37796 > http [ACK] Seq=498 Ack=8994 Win=25856 Len=0 TSval=708592781 TSecr=140349580
231309  79.908167 15.186.110.142 -> 41.177.26.176 TCP 70 37796 > http [FIN, ACK] Seq=498 Ack=10061 Win=25856 Len=0 TSval=708592781 TSecr=140349580
240047  83.337487 15.186.110.142 -> 41.177.26.176 TCP 78 38094 > http [SYN] Seq=0 Win=5840 Len=0 MSS=1460 SACK_PERM=1 TSval=708596211 TSecr=0 WS=256
240260  83.406903 15.186.110.142 -> 41.177.26.176 TCP 70 38094 > http [ACK] Seq=1 Ack=1 Win=5888 Len=0 TSval=708596280 TSecr=140349930
241860  84.267382 15.186.110.142 -> 41.177.26.176 TCP 78 38148 > http [SYN] Seq=0 Win=5840 Len=0 MSS=1460 SACK_PERM=1 TSval=708597139 TSecr=0 WS=256
242343  84.338542 15.186.110.142 -> 41.177.26.176 TCP 70 38148 > http [ACK] Seq=1 Ack=1 Win=5888 Len=0 TSval=708597210 TSecr=140350023
244596  85.276351 15.186.110.142 -> 41.177.26.176 TCP 70 38148 > http [ACK] Seq=481 Ack=1449 Win=8960 Len=0 TSval=708598148 TSecr=140350116
244597  85.276355 15.186.110.142 -> 41.177.26.176 TCP 70 38148 > http [ACK] Seq=481 Ack=1475 Win=8960 Len=0 TSval=708598148 TSecr=140350116
244620  85.285616 15.186.110.142 -> 41.177.26.176 TCP 70 38148 > http [ACK] Seq=481 Ack=2145 Win=11776 Len=0 TSval=708598157 TSecr=140350117
244623  85.285994 15.186.110.142 -> 41.177.26.176 TCP 70 38148 > http [ACK] Seq=481 Ack=2434 Win=11776 Len=0 TSval=708598158 TSecr=140350117
244624  85.286021 15.186.110.142 -> 41.177.26.176 TCP 70 38148 > http [ACK] Seq=481 Ack=2638 Win=11776 Len=0 TSval=708598158 TSecr=140350117
244625  85.286134 15.186.110.142 -> 41.177.26.176 TCP 70 38148 > http [ACK] Seq=481 Ack=2845 Win=11776 Len=0 TSval=708598158 TSecr=140350117
244626  85.286156 15.186.110.142 -> 41.177.26.176 TCP 70 38148 > http [ACK] Seq=481 Ack=3764 Win=14592 Len=0 TSval=708598158 TSecr=140350117
244749  85.347772 15.186.110.142 -> 41.177.26.176 TCP 70 38148 > http [ACK] Seq=481 Ack=5212 Win=17664 Len=0 TSval=708598219 TSecr=140350124
244750  85.347777 15.186.110.142 -> 41.177.26.176 TCP 70 38148 > http [ACK] Seq=481 Ack=6499 Win=20480 Len=0 TSval=708598219 TSecr=140350124
244751  85.347781 15.186.110.142 -> 41.177.26.176 TCP 70 38148 > http [ACK] Seq=481 Ack=7947 Win=23296 Len=0 TSval=708598220 TSecr=140350124
244778  85.357041 15.186.110.142 -> 41.177.26.176 TCP 70 38148 > http [ACK] Seq=481 Ack=9395 Win=26112 Len=0 TSval=708598229 TSecr=140350124
244779  85.357046 15.186.110.142 -> 41.177.26.176 TCP 70 38148 > http [FIN, ACK] Seq=481 Ack=10515 Win=26112 Len=0 TSval=708598229 TSecr=140350124
246612  86.492945 15.186.110.142 -> 41.177.26.176 TCP 70 38094 > http [ACK] Seq=450 Ack=1449 Win=8960 Len=0 TSval=708599366 TSecr=140350238
246613  86.492949 15.186.110.142 -> 41.177.26.176 TCP 70 38094 > http [ACK] Seq=450 Ack=2359 Win=11776 Len=0 TSval=708599366 TSecr=140350238
246614  86.492954 15.186.110.142 -> 41.177.26.176 TCP 70 38094 > http [ACK] Seq=450 Ack=3807 Win=14592 Len=0 TSval=708599366 TSecr=140350238
246771  86.563096 15.186.110.142 -> 41.177.26.176 TCP 70 38094 > http [ACK] Seq=450 Ack=5153 Win=17664 Len=0 TSval=708599436 TSecr=140350245
246772  86.563101 15.186.110.142 -> 41.177.26.176 TCP 70 38094 > http [ACK] Seq=450 Ack=5549 Win=17664 Len=0 TSval=708599436 TSecr=140350245
246773  86.563105 15.186.110.142 -> 41.177.26.176 TCP 70 38094 > http [ACK] Seq=450 Ack=6997 Win=20480 Len=0 TSval=708599436 TSecr=140350245
246774  86.563109 15.186.110.142 -> 41.177.26.176 TCP 70 38094 > http [FIN, ACK] Seq=450 Ack=8365 Win=23296 Len=0 TSval=708599436 TSecr=140350245
248166  87.379301 15.186.110.142 -> 41.177.26.176 TCP 78 38385 > http [SYN] Seq=0 Win=5840 Len=0 MSS=1460 SACK_PERM=1 TSval=708600251 TSecr=0 WS=256
248387  87.450326 15.186.110.142 -> 41.177.26.176 TCP 70 38385 > http [ACK] Seq=1 Ack=1 Win=5888 Len=0 TSval=708600322 TSecr=140350334
251826  89.071647 15.186.110.142 -> 41.177.26.176 TCP 78 38539 > http [SYN] Seq=0 Win=5840 Len=0 MSS=1460 SACK_PERM=1 TSval=708601945 TSecr=0 WS=256
251980  89.141287 15.186.110.142 -> 41.177.26.176 TCP 70 38539 > http [ACK] Seq=1 Ack=1 Win=5888 Len=0 TSval=708602015 TSecr=140350503
252128  89.215890 15.186.110.142 -> 41.177.26.176 TCP 70 38539 > http [ACK] Seq=447 Ack=116 Win=5888 Len=0 TSval=708602089 TSecr=140350511
252129  89.215895 15.186.110.142 -> 41.177.26.176 TCP 70 38539 > http [FIN, ACK] Seq=447 Ack=116 Win=5888 Len=0 TSval=708602089 TSecr=140350511
252131  89.216272 15.186.110.142 -> 41.177.26.176 TCP 70 38539 > http [ACK] Seq=448 Ack=117 Win=5888 Len=0 TSval=708602089 TSecr=140350511
255010  90.569455 15.186.110.142 -> 41.177.26.176 TCP 70 38385 > http [ACK] Seq=446 Ack=1449 Win=8960 Len=0 TSval=708603441 TSecr=140350646
255011  90.569460 15.186.110.142 -> 41.177.26.176 TCP 70 38385 > http [ACK] Seq=446 Ack=2310 Win=11776 Len=0 TSval=708603441 TSecr=140350646
255012  90.569695 15.186.110.142 -> 41.177.26.176 TCP 70 38385 > http [ACK] Seq=446 Ack=3758 Win=14592 Len=0 TSval=708603441 TSecr=140350646
255202  90.640755 15.186.110.142 -> 41.177.26.176 TCP 70 38385 > http [ACK] Seq=446 Ack=5118 Win=17664 Len=0 TSval=708603512 TSecr=140350653
255203  90.641079 15.186.110.142 -> 41.177.26.176 TCP 70 38385 > http [ACK] Seq=446 Ack=6556 Win=20480 Len=0 TSval=708603513 TSecr=140350653
255204  90.641084 15.186.110.142 -> 41.177.26.176 TCP 70 38385 > http [ACK] Seq=446 Ack=7550 Win=23296 Len=0 TSval=708603513 TSecr=140350653
255206  90.641156 15.186.110.142 -> 41.177.26.176 TCP 70 38385 > http [ACK] Seq=446 Ack=8998 Win=26112 Len=0 TSval=708603513 TSecr=140350653
255207  90.641160 15.186.110.142 -> 41.177.26.176 TCP 70 38385 > http [ACK] Seq=446 Ack=10446 Win=26112 Len=0 TSval=708603513 TSecr=140350653
255208  90.641164 15.186.110.142 -> 41.177.26.176 TCP 70 38385 > http [FIN, ACK] Seq=446 Ack=10469 Win=26112 Len=0 TSval=708603513 TSecr=140350653
276106  93.101098 15.186.110.142 -> 41.177.26.176 TCP 78 38897 > http [SYN] Seq=0 Win=5792 Len=0 MSS=1460 SACK_PERM=1 TSval=708605973 TSecr=140350517 WS=256
276220  93.172410 15.186.110.142 -> 41.177.26.176 TCP 70 38897 > http [ACK] Seq=1 Ack=1 Win=5888 Len=0 TSval=708606044 TSecr=140350906
278814  94.108294 15.186.110.142 -> 41.177.26.176 TCP 70 38897 > http [ACK] Seq=508 Ack=1449 Win=8704 Len=0 TSval=708606980 TSecr=140351000
278815  94.108298 15.186.110.142 -> 41.177.26.176 TCP 70 38897 > http [ACK] Seq=508 Ack=1588 Win=11776 Len=0 TSval=708606980 TSecr=140351000
278919  94.117703 15.186.110.142 -> 41.177.26.176 TCP 70 38897 > http [ACK] Seq=508 Ack=2246 Win=14592 Len=0 TSval=708606989 TSecr=140351001
