183820  61.768071 15.186.51.17 -> 41.177.98.79 TCP 78 39248 > http [SYN] Seq=0 Win=5840 Len=0 MSS=1460 SACK_PERM=1 TSval=1213826174 TSecr=0 WS=256
184015  61.836580 15.186.51.17 -> 41.177.98.79 TCP 70 39248 > http [ACK] Seq=1 Ack=1 Win=5888 Len=0 TSval=1213826243 TSecr=1381311607
184285  61.941033 15.186.51.17 -> 41.177.98.79 TCP 70 39248 > http [ACK] Seq=432 Ack=1449 Win=8960 Len=0 TSval=1213826347 TSecr=1381311712
184286  61.941200 15.186.51.17 -> 41.177.98.79 TCP 70 39248 > http [ACK] Seq=432 Ack=2897 Win=11776 Len=0 TSval=1213826347 TSecr=1381311712
184287  61.941351 15.186.51.17 -> 41.177.98.79 TCP 70 39248 > http [ACK] Seq=432 Ack=4345 Win=14592 Len=0 TSval=1213826347 TSecr=1381311712
184292  61.942984 15.186.51.17 -> 41.177.98.79 TCP 70 39248 > http [FIN, ACK] Seq=432 Ack=5456 Win=17664 Len=0 TSval=1213826349 TSecr=1381311712
