352423 119.486593 15.197.84.144 -> 244.3.210.197 TCP 78 49855 > xmpp-server [SYN] Seq=0 Win=5840 Len=0 MSS=1460 SACK_PERM=1 TSval=34346637 TSecr=0 WS=128
358686 122.486704 15.197.84.144 -> 244.3.210.197 TCP 78 [TCP Retransmission] 49855 > xmpp-server [SYN] Seq=0 Win=5840 Len=0 MSS=1460 SACK_PERM=1 TSval=34347387 TSecr=0 WS=128
386349 128.487523 15.197.84.144 -> 244.3.210.197 TCP 78 [TCP Retransmission] 49855 > xmpp-server [SYN] Seq=0 Win=5840 Len=0 MSS=1460 SACK_PERM=1 TSval=34348887 TSecr=0 WS=128
429667 140.486261 15.197.84.144 -> 244.3.210.197 TCP 78 [TCP Retransmission] 49855 > xmpp-server [SYN] Seq=0 Win=5840 Len=0 MSS=1460 SACK_PERM=1 TSval=34351887 TSecr=0 WS=128
