42680  17.995242 15.251.180.105 -> 41.177.26.214 TCP 78 http > 38045 [SYN, ACK] Seq=0 Ack=1 Win=5792 Len=0 MSS=1460 SACK_PERM=1 TSval=957804522 TSecr=1509547253 WS=128
42747  18.040166 15.251.180.105 -> 41.177.26.214 TCP 70 http > 38045 [ACK] Seq=1 Ack=66 Win=5888 Len=0 TSval=957804533 TSecr=1509547258
42785  18.085056 15.251.180.105 -> 41.177.26.214 TCP 70 http > 38045 [ACK] Seq=1 Ack=91 Win=5888 Len=0 TSval=957804545 TSecr=1509547262
42795  18.089573 15.251.180.105 -> 41.177.26.214 TCP 70 http > 38045 [FIN, ACK] Seq=384 Ack=91 Win=5888 Len=0 TSval=957804546 TSecr=1509547262
42896  18.134529 15.251.180.105 -> 41.177.26.214 TCP 70 http > 38045 [ACK] Seq=385 Ack=92 Win=5888 Len=0 TSval=957804557 TSecr=1509547267
60152  24.294758 15.251.180.105 -> 41.177.26.214 TCP 78 http > 38049 [SYN, ACK] Seq=0 Ack=1 Win=5792 Len=0 MSS=1460 SACK_PERM=1 TSval=957806097 TSecr=1509547883 WS=128
60203  24.339653 15.251.180.105 -> 41.177.26.214 TCP 70 http > 38049 [ACK] Seq=1 Ack=66 Win=5888 Len=0 TSval=957806108 TSecr=1509547888
60307  24.384623 15.251.180.105 -> 41.177.26.214 TCP 70 http > 38049 [ACK] Seq=1 Ack=91 Win=5888 Len=0 TSval=957806119 TSecr=1509547892
60312  24.389237 15.251.180.105 -> 41.177.26.214 TCP 70 http > 38049 [FIN, ACK] Seq=383 Ack=91 Win=5888 Len=0 TSval=957806121 TSecr=1509547892
60398  24.434027 15.251.180.105 -> 41.177.26.214 TCP 70 http > 38049 [ACK] Seq=384 Ack=92 Win=5888 Len=0 TSval=957806132 TSecr=1509547897
250768  88.535653 15.251.180.105 -> 41.177.26.214 TCP 78 http > 38082 [SYN, ACK] Seq=0 Ack=1 Win=5792 Len=0 MSS=1460 SACK_PERM=1 TSval=957822157 TSecr=1509554307 WS=128
250854  88.580269 15.251.180.105 -> 41.177.26.214 TCP 70 http > 38082 [ACK] Seq=1 Ack=66 Win=5888 Len=0 TSval=957822168 TSecr=1509554312
250952  88.624728 15.251.180.105 -> 41.177.26.214 TCP 70 http > 38082 [ACK] Seq=1 Ack=91 Win=5888 Len=0 TSval=957822179 TSecr=1509554316
250960  88.629460 15.251.180.105 -> 41.177.26.214 TCP 70 http > 38082 [FIN, ACK] Seq=384 Ack=91 Win=5888 Len=0 TSval=957822180 TSecr=1509554316
251053  88.674068 15.251.180.105 -> 41.177.26.214 TCP 70 http > 38082 [ACK] Seq=385 Ack=92 Win=5888 Len=0 TSval=957822191 TSecr=1509554321
281103  94.584706 15.251.180.105 -> 41.177.26.214 TCP 78 http > 38091 [SYN, ACK] Seq=0 Ack=1 Win=5792 Len=0 MSS=1460 SACK_PERM=1 TSval=957823669 TSecr=1509554912 WS=128
281349  94.629258 15.251.180.105 -> 41.177.26.214 TCP 70 http > 38091 [ACK] Seq=1 Ack=66 Win=5888 Len=0 TSval=957823680 TSecr=1509554916
281620  94.673663 15.251.180.105 -> 41.177.26.214 TCP 70 http > 38091 [ACK] Seq=1 Ack=91 Win=5888 Len=0 TSval=957823691 TSecr=1509554921
281641  94.677713 15.251.180.105 -> 41.177.26.214 TCP 70 http > 38091 [FIN, ACK] Seq=384 Ack=91 Win=5888 Len=0 TSval=957823692 TSecr=1509554921
281878  94.722498 15.251.180.105 -> 41.177.26.214 TCP 70 http > 38091 [ACK] Seq=385 Ack=92 Win=5888 Len=0 TSval=957823703 TSecr=1509554926
397886 133.846613 15.251.180.105 -> 41.177.26.214 TCP 78 http > 38122 [SYN, ACK] Seq=0 Ack=1 Win=5792 Len=0 MSS=1460 SACK_PERM=1 TSval=957833484 TSecr=1509558838 WS=128
397920 133.891528 15.251.180.105 -> 41.177.26.214 TCP 70 http > 38122 [ACK] Seq=1 Ack=66 Win=5888 Len=0 TSval=957833495 TSecr=1509558843
398069 133.936411 15.251.180.105 -> 41.177.26.214 TCP 70 http > 38122 [ACK] Seq=1 Ack=91 Win=5888 Len=0 TSval=957833507 TSecr=1509558847
398071 133.938439 15.251.180.105 -> 41.177.26.214 TCP 70 http > 38122 [FIN, ACK] Seq=384 Ack=91 Win=5888 Len=0 TSval=957833507 TSecr=1509558847
398193 133.983323 15.251.180.105 -> 41.177.26.214 TCP 70 http > 38122 [ACK] Seq=385 Ack=92 Win=5888 Len=0 TSval=957833518 TSecr=1509558852
521799 169.086677 15.251.180.105 -> 41.177.26.214 TCP 78 http > 38129 [SYN, ACK] Seq=0 Ack=1 Win=5792 Len=0 MSS=1460 SACK_PERM=1 TSval=957842294 TSecr=1509562362 WS=128
521834 169.131525 15.251.180.105 -> 41.177.26.214 TCP 70 http > 38129 [ACK] Seq=1 Ack=66 Win=5888 Len=0 TSval=957842305 TSecr=1509562367
521886 169.176580 15.251.180.105 -> 41.177.26.214 TCP 70 http > 38129 [ACK] Seq=1 Ack=91 Win=5888 Len=0 TSval=957842316 TSecr=1509562371
521979 169.179419 15.251.180.105 -> 41.177.26.214 TCP 70 http > 38129 [FIN, ACK] Seq=384 Ack=91 Win=5888 Len=0 TSval=957842317 TSecr=1509562371
522188 169.224352 15.251.180.105 -> 41.177.26.214 TCP 70 http > 38129 [ACK] Seq=385 Ack=92 Win=5888 Len=0 TSval=957842328 TSecr=1509562376
532299 172.626844 15.251.180.105 -> 41.177.26.214 TCP 78 http > 38131 [SYN, ACK] Seq=0 Ack=1 Win=5792 Len=0 MSS=1460 SACK_PERM=1 TSval=957843179 TSecr=1509562716 WS=128
532468 172.671840 15.251.180.105 -> 41.177.26.214 TCP 70 http > 38131 [ACK] Seq=1 Ack=66 Win=5888 Len=0 TSval=957843190 TSecr=1509562721
532554 172.716590 15.251.180.105 -> 41.177.26.214 TCP 70 http > 38131 [ACK] Seq=1 Ack=91 Win=5888 Len=0 TSval=957843201 TSecr=1509562725
532559 172.718455 15.251.180.105 -> 41.177.26.214 TCP 70 http > 38131 [FIN, ACK] Seq=384 Ack=91 Win=5888 Len=0 TSval=957843202 TSecr=1509562725
532706 172.763494 15.251.180.105 -> 41.177.26.214 TCP 70 http > 38131 [ACK] Seq=385 Ack=92 Win=5888 Len=0 TSval=957843213 TSecr=1509562730
684987 215.017323 15.251.180.105 -> 41.177.26.214 TCP 78 http > 38143 [SYN, ACK] Seq=0 Ack=1 Win=5792 Len=0 MSS=1460 SACK_PERM=1 TSval=957853776 TSecr=1509566955 WS=128
685052 215.061966 15.251.180.105 -> 41.177.26.214 TCP 70 http > 38143 [ACK] Seq=1 Ack=66 Win=5888 Len=0 TSval=957853788 TSecr=1509566960
685074 215.106447 15.251.180.105 -> 41.177.26.214 TCP 70 http > 38143 [ACK] Seq=1 Ack=91 Win=5888 Len=0 TSval=957853799 TSecr=1509566964
685138 215.115361 15.251.180.105 -> 41.177.26.214 TCP 70 http > 38143 [FIN, ACK] Seq=384 Ack=91 Win=5888 Len=0 TSval=957853801 TSecr=1509566964
685232 215.159913 15.251.180.105 -> 41.177.26.214 TCP 70 http > 38143 [ACK] Seq=385 Ack=92 Win=5888 Len=0 TSval=957853812 TSecr=1509566969
709421 226.007094 15.251.180.105 -> 41.177.26.214 TCP 78 http > 38146 [SYN, ACK] Seq=0 Ack=1 Win=5792 Len=0 MSS=1460 SACK_PERM=1 TSval=957856524 TSecr=1509568054 WS=128
709561 226.051571 15.251.180.105 -> 41.177.26.214 TCP 70 http > 38146 [ACK] Seq=1 Ack=66 Win=5888 Len=0 TSval=957856535 TSecr=1509568059
709695 226.096436 15.251.180.105 -> 41.177.26.214 TCP 70 http > 38146 [ACK] Seq=1 Ack=91 Win=5888 Len=0 TSval=957856546 TSecr=1509568063
709703 226.099862 15.251.180.105 -> 41.177.26.214 TCP 70 http > 38146 [FIN, ACK] Seq=384 Ack=91 Win=5888 Len=0 TSval=957856547 TSecr=1509568063
709815 226.144313 15.251.180.105 -> 41.177.26.214 TCP 70 http > 38146 [ACK] Seq=385 Ack=92 Win=5888 Len=0 TSval=957856558 TSecr=1509568068
839399 275.168088 15.251.180.105 -> 41.177.26.214 TCP 78 http > 38157 [SYN, ACK] Seq=0 Ack=1 Win=5792 Len=0 MSS=1460 SACK_PERM=1 TSval=957868814 TSecr=1509572970 WS=128
839526 275.212540 15.251.180.105 -> 41.177.26.214 TCP 70 http > 38157 [ACK] Seq=1 Ack=66 Win=5888 Len=0 TSval=957868825 TSecr=1509572975
839631 275.257025 15.251.180.105 -> 41.177.26.214 TCP 70 http > 38157 [ACK] Seq=1 Ack=91 Win=5888 Len=0 TSval=957868836 TSecr=1509572979
839642 275.261263 15.251.180.105 -> 41.177.26.214 TCP 70 http > 38157 [FIN, ACK] Seq=384 Ack=91 Win=5888 Len=0 TSval=957868837 TSecr=1509572979
839800 275.305783 15.251.180.105 -> 41.177.26.214 TCP 70 http > 38157 [ACK] Seq=385 Ack=92 Win=5888 Len=0 TSval=957868848 TSecr=1509572984
846260 278.857766 15.251.180.105 -> 41.177.26.214 TCP 78 http > 38159 [SYN, ACK] Seq=0 Ack=1 Win=5792 Len=0 MSS=1460 SACK_PERM=1 TSval=957869736 TSecr=1509573339 WS=128
846351 278.902255 15.251.180.105 -> 41.177.26.214 TCP 70 http > 38159 [ACK] Seq=1 Ack=66 Win=5888 Len=0 TSval=957869747 TSecr=1509573343
846436 278.946629 15.251.180.105 -> 41.177.26.214 TCP 70 http > 38159 [ACK] Seq=1 Ack=91 Win=5888 Len=0 TSval=957869758 TSecr=1509573348
846454 278.952171 15.251.180.105 -> 41.177.26.214 TCP 70 http > 38159 [FIN, ACK] Seq=384 Ack=91 Win=5888 Len=0 TSval=957869760 TSecr=1509573348
846521 278.996733 15.251.180.105 -> 41.177.26.214 TCP 70 http > 38159 [ACK] Seq=385 Ack=92 Win=5888 Len=0 TSval=957869771 TSecr=1509573353
957633 317.929143 15.251.180.105 -> 41.177.26.214 TCP 78 http > 38184 [SYN, ACK] Seq=0 Ack=1 Win=5792 Len=0 MSS=1460 SACK_PERM=1 TSval=957879504 TSecr=1509577246 WS=128
957761 317.973999 15.251.180.105 -> 41.177.26.214 TCP 70 http > 38184 [ACK] Seq=1 Ack=66 Win=5888 Len=0 TSval=957879515 TSecr=1509577251
957894 318.018867 15.251.180.105 -> 41.177.26.214 TCP 70 http > 38184 [ACK] Seq=1 Ack=91 Win=5888 Len=0 TSval=957879526 TSecr=1509577255
957915 318.022794 15.251.180.105 -> 41.177.26.214 TCP 70 http > 38184 [FIN, ACK] Seq=384 Ack=91 Win=5888 Len=0 TSval=957879527 TSecr=1509577255
958059 318.067670 15.251.180.105 -> 41.177.26.214 TCP 70 http > 38184 [ACK] Seq=385 Ack=92 Win=5888 Len=0 TSval=957879538 TSecr=1509577260
