29563  12.143426 15.205.242.71 -> 244.3.210.197 TCP 64 cft-5 > http [FIN, ACK] Seq=1 Ack=1 Win=65321 Len=0
29572  12.144331 15.205.242.71 -> 244.3.210.197 TCP 66 cft-7 > http [SYN] Seq=0 Win=65535 Len=0 MSS=1460 SACK_PERM=1
29627  12.194789 15.205.242.71 -> 244.3.210.197 TCP 64 cft-5 > http [ACK] Seq=2 Ack=2 Win=65321 Len=0
29633  12.195084 15.205.242.71 -> 244.3.210.197 TCP 64 cft-7 > http [ACK] Seq=1 Ack=1 Win=65535 Len=0
29832  12.355927 15.205.242.71 -> 244.3.210.197 TCP 64 cft-7 > http [ACK] Seq=660 Ack=215 Win=65321 Len=0
225028  76.922603 15.205.242.71 -> 244.3.210.197 TCP 64 cft-7 > http [FIN, ACK] Seq=660 Ack=215 Win=65321 Len=0
225036  76.923484 15.205.242.71 -> 244.3.210.197 TCP 66 bmc-net-svc > http [SYN] Seq=0 Win=65535 Len=0 MSS=1460 SACK_PERM=1
225194  77.004251 15.205.242.71 -> 244.3.210.197 TCP 64 cft-7 > http [ACK] Seq=661 Ack=216 Win=65321 Len=0
225196  77.004811 15.205.242.71 -> 244.3.210.197 TCP 64 bmc-net-svc > http [ACK] Seq=1 Ack=1 Win=65535 Len=0
225684  77.237367 15.205.242.71 -> 244.3.210.197 TCP 64 bmc-net-svc > http [ACK] Seq=660 Ack=215 Win=65321 Len=0
434796 141.816536 15.205.242.71 -> 244.3.210.197 TCP 64 bmc-net-svc > http [FIN, ACK] Seq=660 Ack=215 Win=65321 Len=0
434799 141.816641 15.205.242.71 -> 244.3.210.197 TCP 66 powerguardian > http [SYN] Seq=0 Win=65535 Len=0 MSS=1460 SACK_PERM=1
434962 141.867254 15.205.242.71 -> 244.3.210.197 TCP 64 powerguardian > http [ACK] Seq=1 Ack=1 Win=65535 Len=0
434972 141.874717 15.205.242.71 -> 244.3.210.197 TCP 64 bmc-net-svc > http [ACK] Seq=661 Ack=216 Win=65321 Len=0
435727 142.109579 15.205.242.71 -> 244.3.210.197 TCP 64 powerguardian > http [ACK] Seq=660 Ack=215 Win=65321 Len=0
662604 206.512302 15.205.242.71 -> 244.3.210.197 TCP 64 powerguardian > http [FIN, ACK] Seq=660 Ack=215 Win=65321 Len=0
662618 206.513131 15.205.242.71 -> 244.3.210.197 TCP 66 dpkeyserv > http [SYN] Seq=0 Win=65535 Len=0 MSS=1460 SACK_PERM=1
662762 206.562820 15.205.242.71 -> 244.3.210.197 TCP 64 powerguardian > http [ACK] Seq=661 Ack=216 Win=65321 Len=0
662769 206.563318 15.205.242.71 -> 244.3.210.197 TCP 64 dpkeyserv > http [ACK] Seq=1 Ack=1 Win=65535 Len=0
663588 206.790270 15.205.242.71 -> 244.3.210.197 TCP 64 dpkeyserv > http [ACK] Seq=660 Ack=215 Win=65321 Len=0
830055 271.147310 15.205.242.71 -> 244.3.210.197 TCP 64 dpkeyserv > http [FIN, ACK] Seq=660 Ack=215 Win=65321 Len=0
830056 271.147379 15.205.242.71 -> 244.3.210.197 TCP 66 hp-hcip > http [SYN] Seq=0 Win=65535 Len=0 MSS=1460 SACK_PERM=1
830189 271.197966 15.205.242.71 -> 244.3.210.197 TCP 64 dpkeyserv > http [ACK] Seq=661 Ack=216 Win=65321 Len=0
830190 271.198018 15.205.242.71 -> 244.3.210.197 TCP 64 hp-hcip > http [ACK] Seq=1 Ack=1 Win=65535 Len=0
830368 271.362226 15.205.242.71 -> 244.3.210.197 TCP 64 hp-hcip > http [ACK] Seq=660 Ack=215 Win=65321 Len=0
1008035 337.692187 15.205.242.71 -> 244.3.210.197 TCP 64 hp-hcip > http [FIN, ACK] Seq=660 Ack=215 Win=65321 Len=0
1008036 337.692235 15.205.242.71 -> 244.3.210.197 TCP 66 finle-lm > http [SYN] Seq=0 Win=65535 Len=0 MSS=1460 SACK_PERM=1
1008200 337.742529 15.205.242.71 -> 244.3.210.197 TCP 64 finle-lm > http [ACK] Seq=1 Ack=1 Win=65535 Len=0
1008229 337.749845 15.205.242.71 -> 244.3.210.197 TCP 64 hp-hcip > http [ACK] Seq=661 Ack=216 Win=65321 Len=0
1008737 337.949812 15.205.242.71 -> 244.3.210.197 TCP 64 finle-lm > http [ACK] Seq=660 Ack=215 Win=65321 Len=0
