453827 148.019141 151.77.151.38 -> 41.177.98.176 TCP 66 icabrowser > http [SYN] Seq=0 Win=16384 Len=0 MSS=1460 SACK_PERM=1
453832 148.021773 151.77.151.38 -> 41.177.98.176 TCP 64 icabrowser > http [ACK] Seq=1 Ack=1 Win=17520 Len=0
463822 152.418201 151.77.151.38 -> 41.177.98.176 TCP 64 icabrowser > http [ACK] Seq=846 Ack=2921 Win=17520 Len=0
463823 152.418399 151.77.151.38 -> 41.177.98.176 TCP 64 icabrowser > http [ACK] Seq=846 Ack=4381 Win=17520 Len=0
463842 152.424691 151.77.151.38 -> 41.177.98.176 TCP 64 icabrowser > http [ACK] Seq=846 Ack=6795 Win=17520 Len=0
463849 152.426344 151.77.151.38 -> 41.177.98.176 TCP 64 icabrowser > http [ACK] Seq=846 Ack=8255 Win=17520 Len=0
463889 152.436043 151.77.151.38 -> 41.177.98.176 TCP 64 icabrowser > http [ACK] Seq=846 Ack=10463 Win=17520 Len=0
463919 152.453812 151.77.151.38 -> 41.177.98.176 TCP 64 icabrowser > http [ACK] Seq=846 Ack=13383 Win=17520 Len=0
463920 152.454040 151.77.151.38 -> 41.177.98.176 TCP 64 icabrowser > http [ACK] Seq=846 Ack=15591 Win=17520 Len=0
463948 152.462831 151.77.151.38 -> 41.177.98.176 TCP 64 icabrowser > http [ACK] Seq=846 Ack=18511 Win=17520 Len=0
463953 152.464578 151.77.151.38 -> 41.177.98.176 TCP 64 icabrowser > http [ACK] Seq=846 Ack=20719 Win=17520 Len=0
463994 152.474080 151.77.151.38 -> 41.177.98.176 TCP 64 icabrowser > http [ACK] Seq=846 Ack=23639 Win=17520 Len=0
464015 152.487153 151.77.151.38 -> 41.177.98.176 TCP 64 icabrowser > http [ACK] Seq=846 Ack=25847 Win=17520 Len=0
464018 152.489140 151.77.151.38 -> 41.177.98.176 TCP 64 icabrowser > http [ACK] Seq=846 Ack=28767 Win=17520 Len=0
464049 152.501763 151.77.151.38 -> 41.177.98.176 TCP 64 icabrowser > http [ACK] Seq=846 Ack=30975 Win=17520 Len=0
464066 152.504318 151.77.151.38 -> 41.177.98.176 TCP 64 icabrowser > http [ACK] Seq=846 Ack=33895 Win=17520 Len=0
464103 152.509397 151.77.151.38 -> 41.177.98.176 TCP 64 icabrowser > http [ACK] Seq=846 Ack=36103 Win=17520 Len=0
464127 152.513446 151.77.151.38 -> 41.177.98.176 TCP 64 icabrowser > http [ACK] Seq=846 Ack=39023 Win=17520 Len=0
464155 152.517803 151.77.151.38 -> 41.177.98.176 TCP 64 icabrowser > http [ACK] Seq=846 Ack=41231 Win=17520 Len=0
464196 152.532308 151.77.151.38 -> 41.177.98.176 TCP 64 icabrowser > http [ACK] Seq=846 Ack=44151 Win=17520 Len=0
464212 152.543366 151.77.151.38 -> 41.177.98.176 TCP 64 icabrowser > http [ACK] Seq=846 Ack=46359 Win=17520 Len=0
464213 152.543489 151.77.151.38 -> 41.177.98.176 TCP 64 icabrowser > http [ACK] Seq=846 Ack=49279 Win=17520 Len=0
464216 152.543714 151.77.151.38 -> 41.177.98.176 TCP 64 icabrowser > http [ACK] Seq=846 Ack=51487 Win=17520 Len=0
464217 152.543889 151.77.151.38 -> 41.177.98.176 TCP 64 icabrowser > http [ACK] Seq=846 Ack=54407 Win=17520 Len=0
464219 152.544087 151.77.151.38 -> 41.177.98.176 TCP 64 icabrowser > http [ACK] Seq=846 Ack=56615 Win=17520 Len=0
464225 152.544612 151.77.151.38 -> 41.177.98.176 TCP 64 icabrowser > http [ACK] Seq=846 Ack=59535 Win=17520 Len=0
464242 152.551202 151.77.151.38 -> 41.177.98.176 TCP 64 icabrowser > http [ACK] Seq=846 Ack=61743 Win=17520 Len=0
464277 152.562914 151.77.151.38 -> 41.177.98.176 TCP 64 icabrowser > http [ACK] Seq=846 Ack=64663 Win=17520 Len=0
464282 152.565517 151.77.151.38 -> 41.177.98.176 TCP 64 icabrowser > http [ACK] Seq=846 Ack=66871 Win=17520 Len=0
464289 152.566258 151.77.151.38 -> 41.177.98.176 TCP 64 icabrowser > http [ACK] Seq=846 Ack=69791 Win=17520 Len=0
464309 152.575453 151.77.151.38 -> 41.177.98.176 TCP 64 icabrowser > http [ACK] Seq=846 Ack=71999 Win=17520 Len=0
464368 152.592370 151.77.151.38 -> 41.177.98.176 TCP 64 icabrowser > http [ACK] Seq=846 Ack=74919 Win=17520 Len=0
464490 152.605989 151.77.151.38 -> 41.177.98.176 TCP 64 icabrowser > http [ACK] Seq=846 Ack=77127 Win=17520 Len=0
464519 152.609050 151.77.151.38 -> 41.177.98.176 TCP 64 icabrowser > http [ACK] Seq=846 Ack=80047 Win=17520 Len=0
464528 152.611603 151.77.151.38 -> 41.177.98.176 TCP 64 icabrowser > http [ACK] Seq=846 Ack=82255 Win=17520 Len=0
464533 152.616641 151.77.151.38 -> 41.177.98.176 TCP 64 icabrowser > http [ACK] Seq=846 Ack=85175 Win=17520 Len=0
464566 152.625470 151.77.151.38 -> 41.177.98.176 TCP 64 icabrowser > http [ACK] Seq=846 Ack=87383 Win=17520 Len=0
464567 152.625817 151.77.151.38 -> 41.177.98.176 TCP 64 icabrowser > http [ACK] Seq=846 Ack=90087 Win=17520 Len=0
465520 153.113732 151.77.151.38 -> 41.177.98.176 TCP 66 taurus-wh > http [SYN] Seq=0 Win=16384 Len=0 MSS=1460 SACK_PERM=1
465522 153.115112 151.77.151.38 -> 41.177.98.176 TCP 64 taurus-wh > http [ACK] Seq=1 Ack=1 Win=17520 Len=0
465523 153.115581 151.77.151.38 -> 41.177.98.176 TCP 66 ill > http [SYN] Seq=0 Win=16384 Len=0 MSS=1460 SACK_PERM=1
465528 153.116907 151.77.151.38 -> 41.177.98.176 TCP 64 ill > http [ACK] Seq=1 Ack=1 Win=17520 Len=0
465529 153.117225 151.77.151.38 -> 41.177.98.176 TCP 66 netbill-trans > http [SYN] Seq=0 Win=16384 Len=0 MSS=1460 SACK_PERM=1
465531 153.118602 151.77.151.38 -> 41.177.98.176 TCP 64 netbill-trans > http [ACK] Seq=1 Ack=1 Win=17520 Len=0
465532 153.118968 151.77.151.38 -> 41.177.98.176 TCP 66 netbill-keyrep > http [SYN] Seq=0 Win=16384 Len=0 MSS=1460 SACK_PERM=1
465537 153.120320 151.77.151.38 -> 41.177.98.176 TCP 64 netbill-keyrep > http [ACK] Seq=1 Ack=1 Win=17520 Len=0
465538 153.120766 151.77.151.38 -> 41.177.98.176 TCP 66 netbill-cred > http [SYN] Seq=0 Win=16384 Len=0 MSS=1460 SACK_PERM=1
465544 153.122099 151.77.151.38 -> 41.177.98.176 TCP 64 netbill-cred > http [ACK] Seq=1 Ack=1 Win=17520 Len=0
465960 153.341549 151.77.151.38 -> 41.177.98.176 TCP 64 netbill-cred > http [ACK] Seq=845 Ack=1382 Win=16139 Len=0
465963 153.341686 151.77.151.38 -> 41.177.98.176 TCP 64 netbill-keyrep > http [ACK] Seq=844 Ack=1391 Win=16130 Len=0
465965 153.341886 151.77.151.38 -> 41.177.98.176 TCP 64 netbill-trans > http [ACK] Seq=845 Ack=1382 Win=16139 Len=0
465967 153.342089 151.77.151.38 -> 41.177.98.176 TCP 64 ill > http [ACK] Seq=1688 Ack=2771 Win=17520 Len=0
465968 153.342287 151.77.151.38 -> 41.177.98.176 TCP 64 taurus-wh > http [ACK] Seq=1687 Ack=1944 Win=17520 Len=0
465970 153.342484 151.77.151.38 -> 41.177.98.176 TCP 64 icabrowser > http [ACK] Seq=2532 Ack=92031 Win=17520 Len=0
473703 156.218672 151.77.151.38 -> 41.177.98.176 TCP 64 netbill-trans > http [FIN, ACK] Seq=845 Ack=1382 Win=16139 Len=0
473706 156.220221 151.77.151.38 -> 41.177.98.176 TCP 64 netbill-trans > http [ACK] Seq=846 Ack=1383 Win=16139 Len=0
520041 168.166754 151.77.151.38 -> 41.177.98.176 TCP 64 netbill-cred > http [ACK] Seq=845 Ack=1383 Win=16139 Len=0
520042 168.167150 151.77.151.38 -> 41.177.98.176 TCP 64 netbill-keyrep > http [ACK] Seq=844 Ack=1392 Win=16130 Len=0
520148 168.220113 151.77.151.38 -> 41.177.98.176 TCP 64 ill > http [ACK] Seq=1688 Ack=2772 Win=17520 Len=0
520149 168.220313 151.77.151.38 -> 41.177.98.176 TCP 64 taurus-wh > http [ACK] Seq=1687 Ack=1945 Win=17520 Len=0
520150 168.220711 151.77.151.38 -> 41.177.98.176 TCP 64 icabrowser > http [ACK] Seq=2532 Ack=92032 Win=17520 Len=0
556463 179.185398 151.77.151.38 -> 41.177.98.176 TCP 64 taurus-wh > http [FIN, ACK] Seq=1687 Ack=1945 Win=17520 Len=0
556500 179.191091 151.77.151.38 -> 41.177.98.176 TCP 64 icabrowser > http [FIN, ACK] Seq=2532 Ack=92032 Win=17520 Len=0
556530 179.195883 151.77.151.38 -> 41.177.98.176 TCP 64 netbill-cred > http [FIN, ACK] Seq=845 Ack=1383 Win=16139 Len=0
556536 179.201173 151.77.151.38 -> 41.177.98.176 TCP 64 netbill-keyrep > http [FIN, ACK] Seq=844 Ack=1392 Win=16130 Len=0
556543 179.206066 151.77.151.38 -> 41.177.98.176 TCP 64 ill > http [FIN, ACK] Seq=1688 Ack=2772 Win=17520 Len=0
585272 186.478216 151.77.151.38 -> 41.177.98.176 TCP 66 nimrod-agent > http [SYN] Seq=0 Win=16384 Len=0 MSS=1460 SACK_PERM=1
585295 186.479659 151.77.151.38 -> 41.177.98.176 TCP 64 nimrod-agent > http [ACK] Seq=1 Ack=1 Win=17520 Len=0
586036 186.693692 151.77.151.38 -> 41.177.98.176 TCP 64 nimrod-agent > http [ACK] Seq=942 Ack=2921 Win=17520 Len=0
586040 186.694143 151.77.151.38 -> 41.177.98.176 TCP 64 nimrod-agent > http [ACK] Seq=942 Ack=4381 Win=17520 Len=0
586051 186.696142 151.77.151.38 -> 41.177.98.176 TCP 64 nimrod-agent > http [ACK] Seq=942 Ack=7301 Win=17520 Len=0
586053 186.696941 151.77.151.38 -> 41.177.98.176 TCP 64 nimrod-agent > http [ACK] Seq=942 Ack=8761 Win=17520 Len=0
586056 186.697203 151.77.151.38 -> 41.177.98.176 TCP 64 nimrod-agent > http [ACK] Seq=942 Ack=10463 Win=17520 Len=0
586060 186.699332 151.77.151.38 -> 41.177.98.176 TCP 64 nimrod-agent > http [ACK] Seq=942 Ack=13383 Win=17520 Len=0
586066 186.700879 151.77.151.38 -> 41.177.98.176 TCP 64 nimrod-agent > http [ACK] Seq=942 Ack=14843 Win=17520 Len=0
586079 186.701929 151.77.151.38 -> 41.177.98.176 TCP 64 nimrod-agent > http [ACK] Seq=942 Ack=17051 Win=17520 Len=0
586081 186.702477 151.77.151.38 -> 41.177.98.176 TCP 64 nimrod-agent > http [ACK] Seq=942 Ack=19971 Win=17520 Len=0
586084 186.703125 151.77.151.38 -> 41.177.98.176 TCP 64 nimrod-agent > http [ACK] Seq=942 Ack=21326 Win=16165 Len=0
586555 186.837660 151.77.151.38 -> 41.177.98.176 TCP 64 nimrod-agent > http [ACK] Seq=942 Ack=21331 Win=16160 Len=0
587004 186.987675 151.77.151.38 -> 41.177.98.176 TCP 66 faxportwinport > http [SYN] Seq=0 Win=16384 Len=0 MSS=1460 SACK_PERM=1
587022 186.989015 151.77.151.38 -> 41.177.98.176 TCP 64 faxportwinport > http [ACK] Seq=1 Ack=1 Win=17520 Len=0
587030 186.989587 151.77.151.38 -> 41.177.98.176 TCP 66 softdataphone > http [SYN] Seq=0 Win=16384 Len=0 MSS=1460 SACK_PERM=1
587055 186.991555 151.77.151.38 -> 41.177.98.176 TCP 64 softdataphone > http [ACK] Seq=1 Ack=1 Win=17520 Len=0
587067 186.993702 151.77.151.38 -> 41.177.98.176 TCP 64 faxportwinport > http [ACK] Seq=829 Ack=1563 Win=17520 Len=0
587075 186.996895 151.77.151.38 -> 41.177.98.176 TCP 64 softdataphone > http [ACK] Seq=836 Ack=1759 Win=17520 Len=0
587079 186.998992 151.77.151.38 -> 41.177.98.176 TCP 64 softdataphone > http [ACK] Seq=836 Ack=4679 Win=17520 Len=0
587083 186.999792 151.77.151.38 -> 41.177.98.176 TCP 64 softdataphone > http [ACK] Seq=836 Ack=7599 Win=17520 Len=0
587088 187.001639 151.77.151.38 -> 41.177.98.176 TCP 64 softdataphone > http [ACK] Seq=836 Ack=10519 Win=17520 Len=0
587093 187.002936 151.77.151.38 -> 41.177.98.176 TCP 64 softdataphone > http [ACK] Seq=836 Ack=11979 Win=17520 Len=0
587096 187.003486 151.77.151.38 -> 41.177.98.176 TCP 64 softdataphone > http [ACK] Seq=836 Ack=14899 Win=17520 Len=0
587102 187.004338 151.77.151.38 -> 41.177.98.176 TCP 64 softdataphone > http [ACK] Seq=836 Ack=16359 Win=17520 Len=0
587105 187.005682 151.77.151.38 -> 41.177.98.176 TCP 64 softdataphone > http [ACK] Seq=836 Ack=19279 Win=17520 Len=0
587109 187.005980 151.77.151.38 -> 41.177.98.176 TCP 64 softdataphone > http [ACK] Seq=836 Ack=20739 Win=17520 Len=0
587122 187.009226 151.77.151.38 -> 41.177.98.176 TCP 64 softdataphone > http [ACK] Seq=836 Ack=23659 Win=17520 Len=0
587125 187.009430 151.77.151.38 -> 41.177.98.176 TCP 64 softdataphone > http [ACK] Seq=836 Ack=26579 Win=17520 Len=0
587128 187.010372 151.77.151.38 -> 41.177.98.176 TCP 64 softdataphone > http [ACK] Seq=836 Ack=28039 Win=17520 Len=0
587561 187.139415 151.77.151.38 -> 41.177.98.176 TCP 64 softdataphone > http [ACK] Seq=836 Ack=28914 Win=16645 Len=0
613506 194.658233 151.77.151.38 -> 41.177.98.176 TCP 64 nimrod-agent > http [ACK] Seq=1927 Ack=24251 Win=17520 Len=0
613518 194.658797 151.77.151.38 -> 41.177.98.176 TCP 64 nimrod-agent > http [ACK] Seq=1927 Ack=25711 Win=17520 Len=0
613545 194.661040 151.77.151.38 -> 41.177.98.176 TCP 64 nimrod-agent > http [ACK] Seq=1927 Ack=28124 Win=17520 Len=0
613546 194.661481 151.77.151.38 -> 41.177.98.176 TCP 64 nimrod-agent > http [ACK] Seq=1927 Ack=31044 Win=17520 Len=0
613601 194.663931 151.77.151.38 -> 41.177.98.176 TCP 64 nimrod-agent > http [ACK] Seq=1927 Ack=33252 Win=17520 Len=0
613616 194.664643 151.77.151.38 -> 41.177.98.176 TCP 64 nimrod-agent > http [ACK] Seq=1927 Ack=36172 Win=17520 Len=0
613636 194.667849 151.77.151.38 -> 41.177.98.176 TCP 64 nimrod-agent > http [ACK] Seq=1927 Ack=38380 Win=17520 Len=0
613647 194.668322 151.77.151.38 -> 41.177.98.176 TCP 64 nimrod-agent > http [ACK] Seq=1927 Ack=41300 Win=17520 Len=0
613665 194.671331 151.77.151.38 -> 41.177.98.176 TCP 64 nimrod-agent > http [ACK] Seq=1927 Ack=43508 Win=17520 Len=0
613666 194.671811 151.77.151.38 -> 41.177.98.176 TCP 64 nimrod-agent > http [ACK] Seq=1927 Ack=46428 Win=17520 Len=0
613669 194.672108 151.77.151.38 -> 41.177.98.176 TCP 64 nimrod-agent > http [ACK] Seq=1927 Ack=46905 Win=17043 Len=0
614751 195.085981 151.77.151.38 -> 41.177.98.176 TCP 64 faxportwinport > http [ACK] Seq=1716 Ack=2095 Win=16988 Len=0
639966 202.005148 151.77.151.38 -> 41.177.98.176 TCP 64 softdataphone > http [ACK] Seq=836 Ack=28915 Win=16645 Len=0
671574 209.187429 151.77.151.38 -> 41.177.98.176 TCP 64 softdataphone > http [FIN, ACK] Seq=836 Ack=28915 Win=16645 Len=0
672719 209.734023 151.77.151.38 -> 41.177.98.176 TCP 64 nimrod-agent > http [ACK] Seq=1927 Ack=46906 Win=17043 Len=0
673097 209.947622 151.77.151.38 -> 41.177.98.176 TCP 64 faxportwinport > http [ACK] Seq=1716 Ack=2096 Win=16988 Len=0
704457 224.190614 151.77.151.38 -> 41.177.98.176 TCP 64 faxportwinport > http [FIN, ACK] Seq=1716 Ack=2096 Win=16988 Len=0
704466 224.196155 151.77.151.38 -> 41.177.98.176 TCP 64 nimrod-agent > http [FIN, ACK] Seq=1927 Ack=46906 Win=17043 Len=0
713512 227.633347 151.77.151.38 -> 41.177.98.176 TCP 66 jaleosnd > http [SYN] Seq=0 Win=16384 Len=0 MSS=1460 SACK_PERM=1
713514 227.635088 151.77.151.38 -> 41.177.98.176 TCP 64 jaleosnd > http [ACK] Seq=1 Ack=1 Win=17520 Len=0
715575 228.361445 151.77.151.38 -> 41.177.98.176 TCP 64 jaleosnd > http [ACK] Seq=1064 Ack=2921 Win=17520 Len=0
715585 228.362748 151.77.151.38 -> 41.177.98.176 TCP 64 jaleosnd > http [ACK] Seq=1064 Ack=4381 Win=17520 Len=0
715590 228.364042 151.77.151.38 -> 41.177.98.176 TCP 64 jaleosnd > http [ACK] Seq=1064 Ack=7301 Win=17520 Len=0
715599 228.366040 151.77.151.38 -> 41.177.98.176 TCP 64 jaleosnd > http [ACK] Seq=1064 Ack=8761 Win=17520 Len=0
715603 228.366837 151.77.151.38 -> 41.177.98.176 TCP 64 jaleosnd > http [ACK] Seq=1064 Ack=10463 Win=17520 Len=0
715607 228.370131 151.77.151.38 -> 41.177.98.176 TCP 64 jaleosnd > http [ACK] Seq=1064 Ack=13383 Win=17520 Len=0
715617 228.371329 151.77.151.38 -> 41.177.98.176 TCP 64 jaleosnd > http [ACK] Seq=1064 Ack=14843 Win=17520 Len=0
715625 228.372678 151.77.151.38 -> 41.177.98.176 TCP 64 jaleosnd > http [ACK] Seq=1064 Ack=17051 Win=17520 Len=0
715628 228.373276 151.77.151.38 -> 41.177.98.176 TCP 64 jaleosnd > http [ACK] Seq=1064 Ack=18171 Win=16400 Len=0
715920 228.494836 151.77.151.38 -> 41.177.98.176 TCP 64 jaleosnd > http [FIN, ACK] Seq=1064 Ack=18171 Win=16400 Len=0
715926 228.496228 151.77.151.38 -> 41.177.98.176 TCP 64 jaleosnd > http [ACK] Seq=1065 Ack=18172 Win=16400 Len=0
715936 228.500275 151.77.151.38 -> 41.177.98.176 TCP 66 svs-omagent > http [SYN] Seq=0 Win=16384 Len=0 MSS=1460 SACK_PERM=1
715938 228.501468 151.77.151.38 -> 41.177.98.176 TCP 64 svs-omagent > http [ACK] Seq=1 Ack=1 Win=17520 Len=0
717811 229.123601 151.77.151.38 -> 41.177.98.176 TCP 64 svs-omagent > http [ACK] Seq=1064 Ack=2921 Win=17520 Len=0
717814 229.124062 151.77.151.38 -> 41.177.98.176 TCP 64 svs-omagent > http [ACK] Seq=1064 Ack=4381 Win=17520 Len=0
717818 229.126046 151.77.151.38 -> 41.177.98.176 TCP 64 svs-omagent > http [ACK] Seq=1064 Ack=7301 Win=17520 Len=0
717823 229.126699 151.77.151.38 -> 41.177.98.176 TCP 64 svs-omagent > http [ACK] Seq=1064 Ack=8761 Win=17520 Len=0
717832 229.127445 151.77.151.38 -> 41.177.98.176 TCP 64 svs-omagent > http [ACK] Seq=1064 Ack=10463 Win=17520 Len=0
717843 229.129354 151.77.151.38 -> 41.177.98.176 TCP 64 svs-omagent > http [ACK] Seq=1064 Ack=13383 Win=17520 Len=0
717854 229.131539 151.77.151.38 -> 41.177.98.176 TCP 64 svs-omagent > http [ACK] Seq=1064 Ack=14843 Win=17520 Len=0
717855 229.131837 151.77.151.38 -> 41.177.98.176 TCP 64 svs-omagent > http [ACK] Seq=1064 Ack=17051 Win=17520 Len=0
717856 229.132036 151.77.151.38 -> 41.177.98.176 TCP 64 svs-omagent > http [ACK] Seq=1064 Ack=18199 Win=16372 Len=0
718413 229.373678 151.77.151.38 -> 41.177.98.176 TCP 66 oraclenet8cman > http [SYN] Seq=0 Win=16384 Len=0 MSS=1460 SACK_PERM=1
718417 229.374902 151.77.151.38 -> 41.177.98.176 TCP 64 oraclenet8cman > http [ACK] Seq=1 Ack=1 Win=17520 Len=0
718418 229.375463 151.77.151.38 -> 41.177.98.176 TCP 66 visitview > http [SYN] Seq=0 Win=16384 Len=0 MSS=1460 SACK_PERM=1
718420 229.376594 151.77.151.38 -> 41.177.98.176 TCP 64 visitview > http [ACK] Seq=1 Ack=1 Win=17520 Len=0
718421 229.378257 151.77.151.38 -> 41.177.98.176 TCP 66 pammratc > http [SYN] Seq=0 Win=16384 Len=0 MSS=1460 SACK_PERM=1
718423 229.378751 151.77.151.38 -> 41.177.98.176 TCP 66 pammrpc > http [SYN] Seq=0 Win=16384 Len=0 MSS=1460 SACK_PERM=1
718425 229.379693 151.77.151.38 -> 41.177.98.176 TCP 64 pammratc > http [ACK] Seq=1 Ack=1 Win=17520 Len=0
718431 229.381289 151.77.151.38 -> 41.177.98.176 TCP 64 pammrpc > http [ACK] Seq=1 Ack=1 Win=17520 Len=0
718453 229.386182 151.77.151.38 -> 41.177.98.176 TCP 64 oraclenet8cman > http [ACK] Seq=907 Ack=1535 Win=17520 Len=0
718456 229.386473 151.77.151.38 -> 41.177.98.176 TCP 64 visitview > http [ACK] Seq=906 Ack=2203 Win=17520 Len=0
718487 229.389056 151.77.151.38 -> 41.177.98.176 TCP 64 pammratc > http [ACK] Seq=906 Ack=1759 Win=17520 Len=0
718516 229.390783 151.77.151.38 -> 41.177.98.176 TCP 64 pammrpc > http [ACK] Seq=906 Ack=2921 Win=17520 Len=0
718533 229.392037 151.77.151.38 -> 41.177.98.176 TCP 64 pammrpc > http [ACK] Seq=906 Ack=4381 Win=17520 Len=0
718536 229.393214 151.77.151.38 -> 41.177.98.176 TCP 64 pammratc > http [ACK] Seq=906 Ack=4679 Win=17520 Len=0
718540 229.394463 151.77.151.38 -> 41.177.98.176 TCP 64 pammratc > http [ACK] Seq=906 Ack=7599 Win=17520 Len=0
718541 229.396360 151.77.151.38 -> 41.177.98.176 TCP 64 pammratc > http [ACK] Seq=906 Ack=10519 Win=17520 Len=0
718542 229.396713 151.77.151.38 -> 41.177.98.176 TCP 64 pammratc > http [ACK] Seq=906 Ack=11794 Win=16245 Len=0
719339 229.588125 151.77.151.38 -> 41.177.98.176 TCP 64 pammrpc > http [ACK] Seq=906 Ack=5431 Win=16470 Len=0
721125 230.191754 151.77.151.38 -> 41.177.98.176 TCP 64 svs-omagent > http [ACK] Seq=2005 Ack=19030 Win=17520 Len=0
758897 244.393029 151.77.151.38 -> 41.177.98.176 TCP 64 visitview > http [ACK] Seq=906 Ack=2204 Win=17520 Len=0
758898 244.393239 151.77.151.38 -> 41.177.98.176 TCP 64 pammrpc > http [ACK] Seq=906 Ack=5432 Win=16470 Len=0
758899 244.393380 151.77.151.38 -> 41.177.98.176 TCP 64 oraclenet8cman > http [ACK] Seq=907 Ack=1536 Win=17520 Len=0
758900 244.393579 151.77.151.38 -> 41.177.98.176 TCP 64 pammratc > http [ACK] Seq=906 Ack=11795 Win=16245 Len=0
759920 245.052531 151.77.151.38 -> 41.177.98.176 TCP 64 svs-omagent > http [ACK] Seq=2005 Ack=19031 Win=17520 Len=0
777122 250.381575 151.77.151.38 -> 41.177.98.176 TCP 66 cert-initiator > http [SYN] Seq=0 Win=16384 Len=0 MSS=1460 SACK_PERM=1
777125 250.382415 151.77.151.38 -> 41.177.98.176 TCP 64 svs-omagent > http [FIN, ACK] Seq=2005 Ack=19031 Win=17520 Len=0
777128 250.383018 151.77.151.38 -> 41.177.98.176 TCP 64 cert-initiator > http [ACK] Seq=1 Ack=1 Win=17520 Len=0
777150 250.392773 151.77.151.38 -> 41.177.98.176 TCP 64 pammratc > http [FIN, ACK] Seq=906 Ack=11795 Win=16245 Len=0
777153 250.392999 151.77.151.38 -> 41.177.98.176 TCP 64 pammrpc > http [FIN, ACK] Seq=906 Ack=5432 Win=16470 Len=0
777160 250.397890 151.77.151.38 -> 41.177.98.176 TCP 64 oraclenet8cman > http [FIN, ACK] Seq=907 Ack=1536 Win=17520 Len=0
777177 250.402731 151.77.151.38 -> 41.177.98.176 TCP 64 visitview > http [FIN, ACK] Seq=906 Ack=2204 Win=17520 Len=0
778688 251.166238 151.77.151.38 -> 41.177.98.176 TCP 64 cert-initiator > http [ACK] Seq=1083 Ack=2921 Win=17520 Len=0
778691 251.166784 151.77.151.38 -> 41.177.98.176 TCP 64 cert-initiator > http [ACK] Seq=1083 Ack=4381 Win=17520 Len=0
778700 251.169477 151.77.151.38 -> 41.177.98.176 TCP 64 cert-initiator > http [ACK] Seq=1083 Ack=6795 Win=17520 Len=0
778705 251.170079 151.77.151.38 -> 41.177.98.176 TCP 64 cert-initiator > http [ACK] Seq=1083 Ack=9715 Win=17520 Len=0
778710 251.172275 151.77.151.38 -> 41.177.98.176 TCP 64 cert-initiator > http [ACK] Seq=1083 Ack=11923 Win=17520 Len=0
778711 251.172574 151.77.151.38 -> 41.177.98.176 TCP 64 cert-initiator > http [ACK] Seq=1083 Ack=14843 Win=17520 Len=0
778715 251.174820 151.77.151.38 -> 41.177.98.176 TCP 64 cert-initiator > http [ACK] Seq=1083 Ack=17051 Win=17520 Len=0
778716 251.175218 151.77.151.38 -> 41.177.98.176 TCP 64 cert-initiator > http [ACK] Seq=1083 Ack=18149 Win=16422 Len=0
778953 251.278806 151.77.151.38 -> 41.177.98.176 TCP 64 cert-initiator > http [FIN, ACK] Seq=1083 Ack=18149 Win=16422 Len=0
778956 251.280105 151.77.151.38 -> 41.177.98.176 TCP 64 cert-initiator > http [ACK] Seq=1084 Ack=18150 Win=16422 Len=0
778966 251.282651 151.77.151.38 -> 41.177.98.176 TCP 66 invision > http [SYN] Seq=0 Win=16384 Len=0 MSS=1460 SACK_PERM=1
778968 251.283846 151.77.151.38 -> 41.177.98.176 TCP 64 invision > http [ACK] Seq=1 Ack=1 Win=17520 Len=0
780055 251.907634 151.77.151.38 -> 41.177.98.176 TCP 64 invision > http [ACK] Seq=1083 Ack=2921 Win=17520 Len=0
780062 251.908075 151.77.151.38 -> 41.177.98.176 TCP 64 invision > http [ACK] Seq=1083 Ack=4381 Win=17520 Len=0
780088 251.911169 151.77.151.38 -> 41.177.98.176 TCP 64 invision > http [ACK] Seq=1083 Ack=6795 Win=17520 Len=0
780091 251.911674 151.77.151.38 -> 41.177.98.176 TCP 64 invision > http [ACK] Seq=1083 Ack=9715 Win=17520 Len=0
780104 251.914214 151.77.151.38 -> 41.177.98.176 TCP 64 invision > http [ACK] Seq=1083 Ack=11923 Win=17520 Len=0
780105 251.914612 151.77.151.38 -> 41.177.98.176 TCP 64 invision > http [ACK] Seq=1083 Ack=14843 Win=17520 Len=0
780113 251.916958 151.77.151.38 -> 41.177.98.176 TCP 64 invision > http [ACK] Seq=1083 Ack=17051 Win=17520 Len=0
780118 251.922897 151.77.151.38 -> 41.177.98.176 TCP 64 invision > http [ACK] Seq=1083 Ack=18149 Win=16422 Len=0
781090 252.421838 151.77.151.38 -> 41.177.98.176 TCP 64 invision > http [ACK] Seq=1989 Ack=18770 Win=17520 Len=0
781974 252.824232 151.77.151.38 -> 41.177.98.176 TCP 64 invision > http [ACK] Seq=2930 Ack=19350 Win=16940 Len=0
820316 267.682169 151.77.151.38 -> 41.177.98.176 TCP 64 invision > http [ACK] Seq=2930 Ack=19351 Win=16940 Len=0
824335 269.195969 151.77.151.38 -> 41.177.98.176 TCP 64 invision > http [FIN, ACK] Seq=2930 Ack=19351 Win=16940 Len=0
