756104 243.399550 151.77.68.66 -> 244.3.210.197 TCP 82 60992 > http [SYN] Seq=0 Win=65535 Len=0 MSS=1460 WS=8 TSval=382282164 TSecr=0 SACK_PERM=1
756111 243.400547 151.77.68.66 -> 244.3.210.197 TCP 70 60992 > http [ACK] Seq=1 Ack=1 Win=524280 Len=0 TSval=382282164 TSecr=0
756285 243.512767 151.77.68.66 -> 244.3.210.197 TCP 70 60992 > http [ACK] Seq=382 Ack=2897 Win=524280 Len=0 TSval=382282165 TSecr=150406447
756294 243.514657 151.77.68.66 -> 244.3.210.197 TCP 70 60992 > http [ACK] Seq=382 Ack=5793 Win=522728 Len=0 TSval=382282166 TSecr=150406447
756304 243.516554 151.77.68.66 -> 244.3.210.197 TCP 70 60992 > http [ACK] Seq=382 Ack=8689 Win=519832 Len=0 TSval=382282166 TSecr=150406447
756318 243.522295 151.77.68.66 -> 244.3.210.197 TCP 70 60992 > http [ACK] Seq=382 Ack=15929 Win=524280 Len=0 TSval=382282166 TSecr=150406448
756326 243.524091 151.77.68.66 -> 244.3.210.197 TCP 70 60992 > http [ACK] Seq=382 Ack=17500 Win=524280 Len=0 TSval=382282166 TSecr=150406448
999291 334.211309 151.77.68.66 -> 244.3.210.197 TCP 70 60992 > http [FIN, ACK] Seq=382 Ack=17500 Win=524280 Len=0 TSval=382283071 TSecr=150406448
999302 334.212807 151.77.68.66 -> 244.3.210.197 TCP 70 [TCP Dup ACK 999291#1] 60992 > http [ACK] Seq=383 Ack=17500 Win=524280 Len=0 TSval=382283071 TSecr=150407354
999312 334.213354 151.77.68.66 -> 244.3.210.197 TCP 70 60992 > http [ACK] Seq=383 Ack=17501 Win=524280 Len=0 TSval=382283071 TSecr=150407354
