54792  22.682964 151.77.47.100 -> 244.3.160.239 TCP 70 12607 > http [SYN] Seq=0 Win=8192 Len=0 MSS=1460 WS=4 SACK_PERM=1
54806  22.686125 151.77.47.100 -> 244.3.160.239 TCP 64 12607 > http [ACK] Seq=1 Ack=1 Win=17520 Len=0
55342  22.874075 151.77.47.100 -> 244.3.160.239 TCP 64 12607 > http [ACK] Seq=1177 Ack=642 Win=16880 Len=0
55345  22.874474 151.77.47.100 -> 244.3.160.239 TCP 64 12607 > http [FIN, ACK] Seq=1177 Ack=642 Win=16880 Len=0
55506  22.897909 151.77.47.100 -> 41.177.98.176 TCP 70 51265 > http [SYN] Seq=0 Win=8192 Len=0 MSS=1460 WS=4 SACK_PERM=1
55540  22.904290 151.77.47.100 -> 41.177.98.176 TCP 64 51265 > http [ACK] Seq=1 Ack=1 Win=17520 Len=0
61026  24.855766 151.77.47.100 -> 41.177.98.176 TCP 64 51265 > http [ACK] Seq=1080 Ack=4381 Win=17520 Len=0
61034  24.859125 151.77.47.100 -> 41.177.98.176 TCP 64 51265 > http [ACK] Seq=1080 Ack=8133 Win=17520 Len=0
61042  24.861122 151.77.47.100 -> 41.177.98.176 TCP 64 51265 > http [ACK] Seq=1080 Ack=9715 Win=17520 Len=0
61049  24.866334 151.77.47.100 -> 41.177.98.176 TCP 64 51265 > http [ACK] Seq=1080 Ack=11923 Win=17520 Len=0
61050  24.866597 151.77.47.100 -> 41.177.98.176 TCP 64 51265 > http [ACK] Seq=1080 Ack=14843 Win=17520 Len=0
61051  24.867101 151.77.47.100 -> 41.177.98.176 TCP 64 51265 > http [ACK] Seq=1080 Ack=16768 Win=17520 Len=0
61061  24.881710 151.77.47.100 -> 41.177.98.176 TCP 70 51266 > http [SYN] Seq=0 Win=8192 Len=0 MSS=1460 WS=4 SACK_PERM=1
61063  24.882542 151.77.47.100 -> 41.177.98.176 TCP 70 51267 > http [SYN] Seq=0 Win=8192 Len=0 MSS=1460 WS=4 SACK_PERM=1
61068  24.886504 151.77.47.100 -> 41.177.98.176 TCP 64 51266 > http [ACK] Seq=1 Ack=1 Win=17520 Len=0
61069  24.889439 151.77.47.100 -> 41.177.98.176 TCP 64 51267 > http [ACK] Seq=1 Ack=1 Win=17520 Len=0
61127  24.938352 151.77.47.100 -> 41.177.98.176 TCP 64 51266 > http [ACK] Seq=823 Ack=4381 Win=17520 Len=0
61289  25.048729 151.77.47.100 -> 41.177.98.176 TCP 64 51265 > http [ACK] Seq=2716 Ack=19654 Win=17520 Len=0
61293  25.051502 151.77.47.100 -> 41.177.98.176 TCP 64 51265 > http [ACK] Seq=2716 Ack=22574 Win=17520 Len=0
61320  25.069753 151.77.47.100 -> 41.177.98.176 TCP 64 51265 > http [ACK] Seq=2716 Ack=25494 Win=17520 Len=0
61324  25.071262 151.77.47.100 -> 41.177.98.176 TCP 70 51273 > http [SYN] Seq=0 Win=8192 Len=0 MSS=1460 WS=4 SACK_PERM=1
61326  25.072538 151.77.47.100 -> 41.177.98.176 TCP 64 51265 > http [ACK] Seq=2716 Ack=27846 Win=17520 Len=0
61329  25.073114 151.77.47.100 -> 41.177.98.176 TCP 70 51274 > http [SYN] Seq=0 Win=8192 Len=0 MSS=1460 WS=4 SACK_PERM=1
61331  25.073473 151.77.47.100 -> 41.177.98.176 TCP 70 51275 > http [SYN] Seq=0 Win=8192 Len=0 MSS=1460 WS=4 SACK_PERM=1
61333  25.073967 151.77.47.100 -> 41.177.98.176 TCP 64 51265 > http [ACK] Seq=2716 Ack=32226 Win=17520 Len=0
61345  25.084559 151.77.47.100 -> 41.177.98.176 TCP 64 51267 > http [ACK] Seq=1637 Ack=4471 Win=17520 Len=0
61346  25.084840 151.77.47.100 -> 41.177.98.176 TCP 64 51267 > http [ACK] Seq=1637 Ack=5955 Win=17520 Len=0
61360  25.095337 151.77.47.100 -> 41.177.98.176 TCP 64 51265 > http [ACK] Seq=2716 Ack=37642 Win=17520 Len=0
61387  25.104994 151.77.47.100 -> 41.177.98.176 TCP 64 51265 > http [ACK] Seq=2716 Ack=41878 Win=17036 Len=0
61390  25.105387 151.77.47.100 -> 41.177.98.176 TCP 64 51273 > http [ACK] Seq=1 Ack=1 Win=17520 Len=0
61392  25.105617 151.77.47.100 -> 41.177.98.176 TCP 64 51265 > http [ACK] Seq=2716 Ack=45146 Win=17520 Len=0
61397  25.107450 151.77.47.100 -> 41.177.98.176 TCP 64 51274 > http [ACK] Seq=1 Ack=1 Win=17520 Len=0
61401  25.111752 151.77.47.100 -> 41.177.98.176 TCP 64 51275 > http [ACK] Seq=1 Ack=1 Win=17520 Len=0
61406  25.113019 151.77.47.100 -> 41.177.98.176 TCP 64 51265 > http [ACK] Seq=2716 Ack=48610 Win=17520 Len=0
61409  25.113793 151.77.47.100 -> 41.177.98.176 TCP 64 51266 > http [ACK] Seq=2464 Ack=10371 Win=17520 Len=0
61413  25.120978 151.77.47.100 -> 41.177.98.176 TCP 64 51266 > http [ACK] Seq=2464 Ack=12459 Win=17520 Len=0
61416  25.121260 151.77.47.100 -> 41.177.98.176 TCP 64 51266 > http [ACK] Seq=2464 Ack=14811 Win=17520 Len=0
61419  25.121532 151.77.47.100 -> 41.177.98.176 TCP 64 51267 > http [ACK] Seq=2464 Ack=8053 Win=17520 Len=0
61420  25.123359 151.77.47.100 -> 41.177.98.176 TCP 64 51265 > http [ACK] Seq=2716 Ack=52422 Win=17520 Len=0
61425  25.127498 151.77.47.100 -> 41.177.98.176 TCP 64 51265 > http [ACK] Seq=2716 Ack=64994 Win=8928 Len=0
61461  25.156943 151.77.47.100 -> 41.177.98.176 TCP 64 51265 > http [ACK] Seq=2716 Ack=73186 Win=736 Len=0
61471  25.160083 151.77.47.100 -> 41.177.98.176 TCP 64 51275 > http [ACK] Seq=818 Ack=3232 Win=17520 Len=0
61539  25.181991 151.77.47.100 -> 41.177.98.176 TCP 64 [TCP Window Update] 51265 > http [ACK] Seq=2716 Ack=73186 Win=4488 Len=0
61540  25.182248 151.77.47.100 -> 41.177.98.176 TCP 64 [TCP Window Update] 51265 > http [ACK] Seq=2716 Ack=73186 Win=17520 Len=0
61599  25.197265 151.77.47.100 -> 41.177.98.176 TCP 64 51274 > http [ACK] Seq=812 Ack=4381 Win=17520 Len=0
61603  25.198332 151.77.47.100 -> 41.177.98.176 TCP 64 51275 > http [ACK] Seq=818 Ack=7612 Win=17520 Len=0
61604  25.198496 151.77.47.100 -> 41.177.98.176 TCP 64 51273 > http [ACK] Seq=805 Ack=3231 Win=17520 Len=0
61616  25.200698 151.77.47.100 -> 41.177.98.176 TCP 64 51265 > http [ACK] Seq=2716 Ack=76938 Win=17520 Len=0
61619  25.201343 151.77.47.100 -> 41.177.98.176 TCP 64 51265 > http [ACK] Seq=2716 Ack=77552 Win=16904 Len=0
61638  25.216049 151.77.47.100 -> 41.177.98.176 TCP 64 51266 > http [ACK] Seq=3274 Ack=19648 Win=17520 Len=0
61639  25.216363 151.77.47.100 -> 41.177.98.176 TCP 64 51266 > http [ACK] Seq=3274 Ack=21504 Win=17520 Len=0
61644  25.217556 151.77.47.100 -> 41.177.98.176 TCP 64 51275 > http [ACK] Seq=818 Ack=10712 Win=17520 Len=0
61657  25.218797 151.77.47.100 -> 41.177.98.176 TCP 64 51273 > http [ACK] Seq=805 Ack=6151 Win=17520 Len=0
61665  25.221655 151.77.47.100 -> 41.177.98.176 TCP 64 51273 > http [ACK] Seq=805 Ack=7736 Win=17520 Len=0
61668  25.221888 151.77.47.100 -> 41.177.98.176 TCP 64 51267 > http [ACK] Seq=3273 Ack=11283 Win=17520 Len=0
61680  25.223722 151.77.47.100 -> 41.177.98.176 TCP 64 51267 > http [ACK] Seq=3273 Ack=14203 Win=17520 Len=0
61704  25.227363 151.77.47.100 -> 41.177.98.176 TCP 64 51267 > http [ACK] Seq=3273 Ack=16555 Win=17520 Len=0
61705  25.228054 151.77.47.100 -> 41.177.98.176 TCP 64 51265 > http [ACK] Seq=3523 Ack=79321 Win=17520 Len=0
61706  25.228347 151.77.47.100 -> 41.177.98.176 TCP 64 51265 > http [ACK] Seq=3523 Ack=83701 Win=17520 Len=0
61707  25.228538 151.77.47.100 -> 41.177.98.176 TCP 64 51265 > http [ACK] Seq=3523 Ack=86874 Win=17520 Len=0
61708  25.229696 151.77.47.100 -> 41.177.98.176 TCP 64 51267 > http [ACK] Seq=3273 Ack=19475 Win=17520 Len=0
61709  25.231747 151.77.47.100 -> 41.177.98.176 TCP 64 51267 > http [ACK] Seq=3273 Ack=23258 Win=17520 Len=0
61768  25.266821 151.77.47.100 -> 41.177.98.176 TCP 70 51276 > http [SYN] Seq=0 Win=8192 Len=0 MSS=1460 WS=4 SACK_PERM=1
61770  25.270882 151.77.47.100 -> 41.177.98.176 TCP 64 51276 > http [ACK] Seq=1 Ack=1 Win=17520 Len=0
62002  25.424370 151.77.47.100 -> 41.177.98.176 TCP 64 51266 > http [ACK] Seq=4079 Ack=21831 Win=17192 Len=0
62219  25.524252 151.77.47.100 -> 41.177.98.176 TCP 64 51274 > http [ACK] Seq=1652 Ack=6249 Win=17520 Len=0
62220  25.524984 151.77.47.100 -> 41.177.98.176 TCP 64 51275 > http [ACK] Seq=1658 Ack=11244 Win=16988 Len=0
62242  25.556459 151.77.47.100 -> 41.177.98.176 TCP 64 51273 > http [ACK] Seq=1643 Ack=8071 Win=17184 Len=0
62285  25.585358 151.77.47.100 -> 41.177.98.176 TCP 64 51276 > http [ACK] Seq=249 Ack=295 Win=17224 Len=0
62928  25.884818 151.77.47.100 -> 41.177.98.176 TCP 64 51265 > http [ACK] Seq=4230 Ack=87167 Win=17224 Len=0
112980  40.212702 151.77.47.100 -> 41.177.98.176 TCP 64 51267 > http [ACK] Seq=3273 Ack=23259 Win=17520 Len=0
113018  40.222087 151.77.47.100 -> 41.177.98.176 TCP 64 51266 > http [ACK] Seq=4079 Ack=21832 Win=17192 Len=0
113301  40.328588 151.77.47.100 -> 41.177.98.176 TCP 64 51274 > http [ACK] Seq=1652 Ack=6250 Win=17520 Len=0
113310  40.329277 151.77.47.100 -> 41.177.98.176 TCP 64 51275 > http [ACK] Seq=1658 Ack=11245 Win=16988 Len=0
113436  40.352301 151.77.47.100 -> 41.177.98.176 TCP 64 51273 > http [ACK] Seq=1643 Ack=8072 Win=17184 Len=0
113578  40.383184 151.77.47.100 -> 41.177.98.176 TCP 64 51276 > http [ACK] Seq=249 Ack=296 Win=17224 Len=0
114155  40.701973 151.77.47.100 -> 41.177.98.176 TCP 64 51265 > http [ACK] Seq=4230 Ack=87168 Win=17224 Len=0
123308  43.871045 151.77.47.100 -> 244.3.160.239 TCP 70 doceri-ctl > http [SYN] Seq=0 Win=8192 Len=0 MSS=1460 WS=4 SACK_PERM=1
123326  43.880005 151.77.47.100 -> 244.3.160.239 TCP 64 doceri-ctl > http [ACK] Seq=1 Ack=1 Win=17520 Len=0
124568  44.455980 151.77.47.100 -> 244.3.160.239 TCP 64 doceri-ctl > http [ACK] Seq=1233 Ack=678 Win=16844 Len=0
124573  44.462982 151.77.47.100 -> 244.3.160.239 TCP 64 doceri-ctl > http [FIN, ACK] Seq=1233 Ack=678 Win=16844 Len=0
124592  44.464514 151.77.47.100 -> 244.3.160.239 TCP 70 9588 > http [SYN] Seq=0 Win=8192 Len=0 MSS=1460 WS=4 SACK_PERM=1
124598  44.468298 151.77.47.100 -> 244.3.160.239 TCP 64 9588 > http [ACK] Seq=1 Ack=1 Win=17520 Len=0
124667  44.496240 151.77.47.100 -> 244.3.160.239 TCP 64 9588 > http [ACK] Seq=1099 Ack=678 Win=16844 Len=0
124673  44.496821 151.77.47.100 -> 244.3.160.239 TCP 64 9588 > http [FIN, ACK] Seq=1099 Ack=678 Win=16844 Len=0
124722  44.508103 151.77.47.100 -> 244.3.160.239 TCP 70 11809 > http [SYN] Seq=0 Win=8192 Len=0 MSS=1460 WS=4 SACK_PERM=1
124727  44.511119 151.77.47.100 -> 244.3.160.239 TCP 64 11809 > http [ACK] Seq=1 Ack=1 Win=17520 Len=0
162064  55.138267 151.77.47.100 -> 41.177.98.176 TCP 64 51274 > http [FIN, ACK] Seq=1652 Ack=6250 Win=17520 Len=0
162070  55.139559 151.77.47.100 -> 41.177.98.176 TCP 64 51275 > http [FIN, ACK] Seq=1658 Ack=11245 Win=16988 Len=0
162074  55.142512 151.77.47.100 -> 41.177.98.176 TCP 64 51265 > http [FIN, ACK] Seq=4230 Ack=87168 Win=17224 Len=0
162079  55.142803 151.77.47.100 -> 41.177.98.176 TCP 64 51273 > http [FIN, ACK] Seq=1643 Ack=8072 Win=17184 Len=0
162081  55.143344 151.77.47.100 -> 41.177.98.176 TCP 64 51266 > http [FIN, ACK] Seq=4079 Ack=21832 Win=17192 Len=0
162083  55.143712 151.77.47.100 -> 41.177.98.176 TCP 64 51267 > http [FIN, ACK] Seq=3273 Ack=23259 Win=17520 Len=0
192167  66.207795 151.77.47.100 -> 244.3.160.239 TCP 64 11809 > http [ACK] Seq=1082 Ack=2910 Win=17520 Len=0
192234  66.228594 151.77.47.100 -> 244.3.160.239 TCP 70 11650 > http [SYN] Seq=0 Win=8192 Len=0 MSS=1460 WS=4 SACK_PERM=1
192241  66.230777 151.77.47.100 -> 244.3.160.239 TCP 64 11650 > http [ACK] Seq=1 Ack=1 Win=17520 Len=0
192334  66.263858 151.77.47.100 -> 244.3.160.239 TCP 64 11809 > http [ACK] Seq=1082 Ack=5787 Win=17520 Len=0
192382  66.277783 151.77.47.100 -> 244.3.160.239 TCP 64 11809 > http [ACK] Seq=1082 Ack=8713 Win=17520 Len=0
192576  66.323784 151.77.47.100 -> 244.3.160.239 TCP 64 11809 > http [ACK] Seq=1082 Ack=11632 Win=17520 Len=0
192625  66.336745 151.77.47.100 -> 244.3.160.239 TCP 64 11809 > http [ACK] Seq=1082 Ack=13093 Win=17520 Len=0
193008  66.400871 151.77.47.100 -> 244.3.160.239 TCP 64 11650 > http [ACK] Seq=893 Ack=2903 Win=17520 Len=0
193009  66.401070 151.77.47.100 -> 244.3.160.239 TCP 64 11809 > http [ACK] Seq=1082 Ack=15986 Win=17520 Len=0
193013  66.406860 151.77.47.100 -> 244.3.160.239 TCP 64 11809 > http [ACK] Seq=1082 Ack=18035 Win=17520 Len=0
193143  66.451612 151.77.47.100 -> 244.3.160.239 TCP 64 11650 > http [ACK] Seq=893 Ack=4952 Win=17520 Len=0
193157  66.452658 151.77.47.100 -> 244.3.160.239 TCP 64 11809 > http [ACK] Seq=1082 Ack=19886 Win=17520 Len=0
193177  66.453314 151.77.47.100 -> 244.3.160.239 TCP 64 11809 > http [FIN, ACK] Seq=1082 Ack=19886 Win=17520 Len=0
193179  66.453764 151.77.47.100 -> 244.3.160.239 TCP 64 11650 > http [ACK] Seq=893 Ack=7001 Win=17520 Len=0
193180  66.453991 151.77.47.100 -> 244.3.160.239 TCP 64 11650 > http [ACK] Seq=893 Ack=8714 Win=17520 Len=0
193419  66.515852 151.77.47.100 -> 244.3.160.239 TCP 64 11650 > http [ACK] Seq=893 Ack=10763 Win=17520 Len=0
193422  66.517056 151.77.47.100 -> 244.3.160.239 TCP 64 11650 > http [ACK] Seq=893 Ack=12812 Win=17520 Len=0
193423  66.519213 151.77.47.100 -> 244.3.160.239 TCP 64 11650 > http [ACK] Seq=893 Ack=15123 Win=17520 Len=0
193424  66.519504 151.77.47.100 -> 244.3.160.239 TCP 64 11650 > http [FIN, ACK] Seq=893 Ack=15123 Win=17520 Len=0
193454  66.536765 151.77.47.100 -> 244.3.160.239 TCP 70 15914 > http [SYN] Seq=0 Win=8192 Len=0 MSS=1460 WS=4 SACK_PERM=1
193462  66.540128 151.77.47.100 -> 244.3.160.239 TCP 64 15914 > http [ACK] Seq=1 Ack=1 Win=17520 Len=0
193464  66.540329 151.77.47.100 -> 244.3.160.239 TCP 70 enc-tunnel > http [SYN] Seq=0 Win=8192 Len=0 MSS=1460 WS=4 SACK_PERM=1
193497  66.557264 151.77.47.100 -> 244.3.160.239 TCP 64 enc-tunnel > http [ACK] Seq=1 Ack=1 Win=17520 Len=0
193500  66.560447 151.77.47.100 -> 244.3.160.239 TCP 70 mpnjsosv > http [SYN] Seq=0 Win=8192 Len=0 MSS=1460 WS=4 SACK_PERM=1
193521  66.576947 151.77.47.100 -> 244.3.160.239 TCP 64 mpnjsosv > http [ACK] Seq=1 Ack=1 Win=17520 Len=0
193530  66.578954 151.77.47.100 -> 244.3.160.239 TCP 70 10891 > http [SYN] Seq=0 Win=8192 Len=0 MSS=1460 WS=4 SACK_PERM=1
193673  66.597240 151.77.47.100 -> 244.3.160.239 TCP 64 10891 > http [ACK] Seq=1 Ack=1 Win=17520 Len=0
193676  66.598171 151.77.47.100 -> 244.3.160.239 TCP 70 cssp > http [SYN] Seq=0 Win=8192 Len=0 MSS=1460 WS=4 SACK_PERM=1
193697  66.614673 151.77.47.100 -> 244.3.160.239 TCP 64 cssp > http [ACK] Seq=1 Ack=1 Win=17520 Len=0
193755  66.634468 151.77.47.100 -> 244.3.160.239 TCP 70 13590 > http [SYN] Seq=0 Win=8192 Len=0 MSS=1460 WS=4 SACK_PERM=1
193770  66.636809 151.77.47.100 -> 244.3.160.239 TCP 64 13590 > http [ACK] Seq=1 Ack=1 Win=17520 Len=0
193869  66.667303 151.77.47.100 -> 244.3.160.239 TCP 70 isomair > http [SYN] Seq=0 Win=8192 Len=0 MSS=1460 WS=4 SACK_PERM=1
193903  66.669727 151.77.47.100 -> 244.3.160.239 TCP 64 isomair > http [ACK] Seq=1 Ack=1 Win=17520 Len=0
194152  66.748983 151.77.47.100 -> 244.3.160.239 TCP 64 15914 > http [ACK] Seq=912 Ack=1506 Win=17520 Len=0
194153  66.750535 151.77.47.100 -> 244.3.160.239 TCP 64 enc-tunnel > http [ACK] Seq=917 Ack=1145 Win=16376 Len=0
194161  66.751858 151.77.47.100 -> 244.3.160.239 TCP 64 15914 > http [FIN, ACK] Seq=912 Ack=1506 Win=17520 Len=0
194165  66.752837 151.77.47.100 -> 244.3.160.239 TCP 64 enc-tunnel > http [FIN, ACK] Seq=917 Ack=1145 Win=16376 Len=0
194169  66.754683 151.77.47.100 -> 244.3.160.239 TCP 70 5289 > http [SYN] Seq=0 Win=8192 Len=0 MSS=1460 WS=4 SACK_PERM=1
194180  66.756655 151.77.47.100 -> 244.3.160.239 TCP 70 13780 > http [SYN] Seq=0 Win=8192 Len=0 MSS=1460 WS=4 SACK_PERM=1
194184  66.757730 151.77.47.100 -> 244.3.160.239 TCP 64 5289 > http [ACK] Seq=1 Ack=1 Win=17520 Len=0
194189  66.758787 151.77.47.100 -> 244.3.160.239 TCP 64 13780 > http [ACK] Seq=1 Ack=1 Win=17520 Len=0
194360  66.816808 151.77.47.100 -> 244.3.160.239 TCP 64 isomair > http [ACK] Seq=270 Ack=1794 Win=17520 Len=0
194388  66.827979 151.77.47.100 -> 41.177.98.176 TCP 64 51276 > http [RST, ACK] Seq=249 Ack=296 Win=0 Len=0
194389  66.831219 151.77.47.100 -> 244.3.160.239 TCP 64 isomair > http [RST, ACK] Seq=270 Ack=1794 Win=0 Len=0
194406  66.835002 151.77.47.100 -> 244.3.160.239 TCP 64 15914 > http [ACK] Seq=913 Ack=1507 Win=17520 Len=0
194407  66.835379 151.77.47.100 -> 244.3.160.239 TCP 64 enc-tunnel > http [ACK] Seq=918 Ack=1146 Win=16376 Len=0
194431  66.849296 151.77.47.100 -> 244.3.160.239 TCP 64 mpnjsosv > http [ACK] Seq=916 Ack=745 Win=16776 Len=0
194437  66.855977 151.77.47.100 -> 244.3.160.239 TCP 64 cssp > http [ACK] Seq=916 Ack=869 Win=16652 Len=0
194484  66.862942 151.77.47.100 -> 244.3.160.239 TCP 64 mpnjsosv > http [FIN, ACK] Seq=916 Ack=745 Win=16776 Len=0
194486  66.863105 151.77.47.100 -> 244.3.160.239 TCP 64 10891 > http [ACK] Seq=914 Ack=754 Win=16764 Len=0
194487  66.863184 151.77.47.100 -> 244.3.160.239 TCP 64 13590 > http [ACK] Seq=922 Ack=820 Win=16700 Len=0
194491  66.864247 151.77.47.100 -> 244.3.160.239 TCP 64 13590 > http [FIN, ACK] Seq=922 Ack=820 Win=16700 Len=0
194493  66.864696 151.77.47.100 -> 244.3.160.239 TCP 64 cssp > http [FIN, ACK] Seq=916 Ack=869 Win=16652 Len=0
194495  66.865063 151.77.47.100 -> 244.3.160.239 TCP 64 10891 > http [FIN, ACK] Seq=914 Ack=754 Win=16764 Len=0
194497  66.867045 151.77.47.100 -> 244.3.160.239 TCP 70 6430 > http [SYN] Seq=0 Win=8192 Len=0 MSS=1460 WS=4 SACK_PERM=1
194504  66.868820 151.77.47.100 -> 244.3.160.239 TCP 64 6430 > http [ACK] Seq=1 Ack=1 Win=17520 Len=0
194506  66.869328 151.77.47.100 -> 244.3.160.239 TCP 70 16180 > http [SYN] Seq=0 Win=8192 Len=0 MSS=1460 WS=4 SACK_PERM=1
194510  66.870879 151.77.47.100 -> 244.3.160.239 TCP 70 8366 > http [SYN] Seq=0 Win=8192 Len=0 MSS=1460 WS=4 SACK_PERM=1
194544  66.887538 151.77.47.100 -> 244.3.160.239 TCP 64 16180 > http [ACK] Seq=1 Ack=1 Win=17520 Len=0
194546  66.887827 151.77.47.100 -> 244.3.160.239 TCP 64 8366 > http [ACK] Seq=1 Ack=1 Win=17520 Len=0
194547  66.888431 151.77.47.100 -> 244.3.160.239 TCP 70 7225 > http [SYN] Seq=0 Win=8192 Len=0 MSS=1460 WS=4 SACK_PERM=1
194599  66.906543 151.77.47.100 -> 244.3.160.239 TCP 64 7225 > http [ACK] Seq=1 Ack=1 Win=17520 Len=0
194755  66.955770 151.77.47.100 -> 244.3.160.239 TCP 64 mpnjsosv > http [ACK] Seq=917 Ack=746 Win=16776 Len=0
194756  66.955774 151.77.47.100 -> 244.3.160.239 TCP 64 cssp > http [ACK] Seq=917 Ack=870 Win=16652 Len=0
194757  66.956106 151.77.47.100 -> 244.3.160.239 TCP 64 10891 > http [ACK] Seq=915 Ack=755 Win=16764 Len=0
194759  66.956252 151.77.47.100 -> 244.3.160.239 TCP 64 13590 > http [ACK] Seq=923 Ack=821 Win=16700 Len=0
194761  66.956435 151.77.47.100 -> 244.3.160.239 TCP 64 5289 > http [ACK] Seq=919 Ack=829 Win=16692 Len=0
194762  66.956647 151.77.47.100 -> 244.3.160.239 TCP 64 13780 > http [ACK] Seq=917 Ack=404 Win=17116 Len=0
194763  66.956873 151.77.47.100 -> 244.3.160.239 TCP 64 5289 > http [FIN, ACK] Seq=919 Ack=829 Win=16692 Len=0
194765  66.956983 151.77.47.100 -> 244.3.160.239 TCP 64 13780 > http [FIN, ACK] Seq=917 Ack=404 Win=17116 Len=0
194774  66.958542 151.77.47.100 -> 244.3.160.239 TCP 70 10374 > http [SYN] Seq=0 Win=8192 Len=0 MSS=1460 WS=4 SACK_PERM=1
194776  66.960182 151.77.47.100 -> 244.3.160.239 TCP 70 10363 > http [SYN] Seq=0 Win=8192 Len=0 MSS=1460 WS=4 SACK_PERM=1
194778  66.960761 151.77.47.100 -> 244.3.160.239 TCP 64 10374 > http [ACK] Seq=1 Ack=1 Win=17520 Len=0
194791  66.962832 151.77.47.100 -> 244.3.160.239 TCP 64 10363 > http [ACK] Seq=1 Ack=1 Win=17520 Len=0
195158  67.063996 151.77.47.100 -> 244.3.160.239 TCP 64 5289 > http [ACK] Seq=920 Ack=830 Win=16692 Len=0
195161  67.064238 151.77.47.100 -> 244.3.160.239 TCP 64 13780 > http [ACK] Seq=918 Ack=405 Win=17116 Len=0
195181  67.068603 151.77.47.100 -> 244.3.160.239 TCP 64 6430 > http [ACK] Seq=917 Ack=427 Win=17092 Len=0
195182  67.068751 151.77.47.100 -> 244.3.160.239 TCP 64 16180 > http [ACK] Seq=920 Ack=756 Win=16764 Len=0
195183  67.069772 151.77.47.100 -> 244.3.160.239 TCP 64 8366 > http [ACK] Seq=948 Ack=632 Win=16888 Len=0
195184  67.070029 151.77.47.100 -> 244.3.160.239 TCP 64 6430 > http [ACK] Seq=917 Ack=428 Win=17092 Len=0
195185  67.070115 151.77.47.100 -> 244.3.160.239 TCP 64 16180 > http [ACK] Seq=920 Ack=757 Win=16764 Len=0
195192  67.072970 151.77.47.100 -> 244.3.160.239 TCP 64 8366 > http [FIN, ACK] Seq=948 Ack=632 Win=16888 Len=0
195194  67.073629 151.77.47.100 -> 244.3.160.239 TCP 64 6430 > http [FIN, ACK] Seq=917 Ack=428 Win=17092 Len=0
195196  67.074110 151.77.47.100 -> 244.3.160.239 TCP 64 16180 > http [FIN, ACK] Seq=920 Ack=757 Win=16764 Len=0
195206  67.076286 151.77.47.100 -> 244.3.160.239 TCP 70 12792 > http [SYN] Seq=0 Win=8192 Len=0 MSS=1460 WS=4 SACK_PERM=1
195220  67.079072 151.77.47.100 -> 244.3.160.239 TCP 70 16010 > http [SYN] Seq=0 Win=8192 Len=0 MSS=1460 WS=4 SACK_PERM=1
195222  67.079361 151.77.47.100 -> 244.3.160.239 TCP 70 7331 > http [SYN] Seq=0 Win=8192 Len=0 MSS=1460 WS=4 SACK_PERM=1
195226  67.081057 151.77.47.100 -> 244.3.160.239 TCP 64 12792 > http [ACK] Seq=1 Ack=1 Win=17520 Len=0
195227  67.081279 151.77.47.100 -> 244.3.160.239 TCP 64 16010 > http [ACK] Seq=1 Ack=1 Win=17520 Len=0
195228  67.081616 151.77.47.100 -> 244.3.160.239 TCP 64 7331 > http [ACK] Seq=1 Ack=1 Win=17520 Len=0
195467  67.195035 151.77.47.100 -> 244.3.160.239 TCP 64 10374 > http [ACK] Seq=923 Ack=811 Win=16708 Len=0
195468  67.195038 151.77.47.100 -> 244.3.160.239 TCP 64 10363 > http [ACK] Seq=923 Ack=944 Win=16576 Len=0
195471  67.195161 151.77.47.100 -> 244.3.160.239 TCP 64 7225 > http [ACK] Seq=917 Ack=427 Win=17092 Len=0
195474  67.195357 151.77.47.100 -> 244.3.160.239 TCP 64 10374 > http [FIN, ACK] Seq=923 Ack=811 Win=16708 Len=0
195485  67.200625 151.77.47.100 -> 244.3.160.239 TCP 64 10363 > http [FIN, ACK] Seq=923 Ack=944 Win=16576 Len=0
195487  67.200915 151.77.47.100 -> 244.3.160.239 TCP 64 7225 > http [FIN, ACK] Seq=917 Ack=427 Win=17092 Len=0
195490  67.202595 151.77.47.100 -> 244.3.160.239 TCP 70 10126 > http [SYN] Seq=0 Win=8192 Len=0 MSS=1460 WS=4 SACK_PERM=1
195503  67.204745 151.77.47.100 -> 244.3.160.239 TCP 70 5159 > http [SYN] Seq=0 Win=8192 Len=0 MSS=1460 WS=4 SACK_PERM=1
195505  67.204846 151.77.47.100 -> 244.3.160.239 TCP 64 10126 > http [ACK] Seq=1 Ack=1 Win=17520 Len=0
195509  67.206017 151.77.47.100 -> 244.3.160.239 TCP 70 gbjd816 > http [SYN] Seq=0 Win=8192 Len=0 MSS=1460 WS=4 SACK_PERM=1
195515  67.207025 151.77.47.100 -> 244.3.160.239 TCP 64 5159 > http [ACK] Seq=1 Ack=1 Win=17520 Len=0
195516  67.207970 151.77.47.100 -> 244.3.160.239 TCP 64 gbjd816 > http [ACK] Seq=1 Ack=1 Win=17520 Len=0
195825  67.285843 151.77.47.100 -> 244.3.160.239 TCP 64 10374 > http [ACK] Seq=924 Ack=812 Win=16708 Len=0
195827  67.286313 151.77.47.100 -> 244.3.160.239 TCP 64 10363 > http [ACK] Seq=924 Ack=945 Win=16576 Len=0
195835  67.288318 151.77.47.100 -> 244.3.160.239 TCP 64 7225 > http [ACK] Seq=918 Ack=428 Win=17092 Len=0
195993  67.308374 151.77.47.100 -> 244.3.160.239 TCP 64 12792 > http [ACK] Seq=922 Ack=950 Win=16568 Len=0
195997  67.310164 151.77.47.100 -> 244.3.160.239 TCP 64 16010 > http [ACK] Seq=914 Ack=907 Win=16612 Len=0
196010  67.315236 151.77.47.100 -> 244.3.160.239 TCP 64 12792 > http [FIN, ACK] Seq=922 Ack=950 Win=16568 Len=0
196012  67.315362 151.77.47.100 -> 244.3.160.239 TCP 64 16010 > http [FIN, ACK] Seq=914 Ack=907 Win=16612 Len=0
196014  67.315516 151.77.47.100 -> 244.3.160.239 TCP 70 npds-tracker > http [SYN] Seq=0 Win=8192 Len=0 MSS=1460 WS=4 SACK_PERM=1
196016  67.315699 151.77.47.100 -> 244.3.160.239 TCP 70 15879 > http [SYN] Seq=0 Win=8192 Len=0 MSS=1460 WS=4 SACK_PERM=1
196022  67.318008 151.77.47.100 -> 244.3.160.239 TCP 64 npds-tracker > http [ACK] Seq=1 Ack=1 Win=17520 Len=0
196023  67.318261 151.77.47.100 -> 244.3.160.239 TCP 64 15879 > http [ACK] Seq=1 Ack=1 Win=17520 Len=0
196125  67.343773 151.77.47.100 -> 244.3.160.239 TCP 64 12792 > http [ACK] Seq=923 Ack=951 Win=16568 Len=0
196128  67.345436 151.77.47.100 -> 244.3.160.239 TCP 64 16010 > http [ACK] Seq=915 Ack=908 Win=16612 Len=0
196132  67.345734 151.77.47.100 -> 244.3.160.239 TCP 64 7331 > http [ACK] Seq=920 Ack=920 Win=16600 Len=0
196325  67.362103 151.77.47.100 -> 244.3.160.239 TCP 64 7331 > http [FIN, ACK] Seq=920 Ack=920 Win=16600 Len=0
196330  67.364224 151.77.47.100 -> 244.3.160.239 TCP 70 ums > http [SYN] Seq=0 Win=8192 Len=0 MSS=1460 WS=4 SACK_PERM=1
196334  67.366832 151.77.47.100 -> 244.3.160.239 TCP 64 ums > http [ACK] Seq=1 Ack=1 Win=17520 Len=0
196614  67.463736 151.77.47.100 -> 244.3.160.239 TCP 64 7331 > http [ACK] Seq=921 Ack=921 Win=16600 Len=0
196619  67.464383 151.77.47.100 -> 244.3.160.239 TCP 64 10126 > http [ACK] Seq=919 Ack=918 Win=16600 Len=0
196620  67.464388 151.77.47.100 -> 244.3.160.239 TCP 64 5159 > http [ACK] Seq=909 Ack=1752 Win=17520 Len=0
196621  67.464865 151.77.47.100 -> 244.3.160.239 TCP 64 gbjd816 > http [ACK] Seq=915 Ack=2420 Win=17520 Len=0
196622  67.465302 151.77.47.100 -> 244.3.160.239 TCP 64 10126 > http [FIN, ACK] Seq=919 Ack=918 Win=16600 Len=0
196624  67.466266 151.77.47.100 -> 244.3.160.239 TCP 64 gbjd816 > http [FIN, ACK] Seq=915 Ack=2420 Win=17520 Len=0
196629  67.466478 151.77.47.100 -> 244.3.160.239 TCP 64 5159 > http [FIN, ACK] Seq=909 Ack=1752 Win=17520 Len=0
196638  67.468344 151.77.47.100 -> 244.3.160.239 TCP 70 elanlm > http [SYN] Seq=0 Win=8192 Len=0 MSS=1460 WS=4 SACK_PERM=1
196643  67.469620 151.77.47.100 -> 244.3.160.239 TCP 70 12600 > http [SYN] Seq=0 Win=8192 Len=0 MSS=1460 WS=4 SACK_PERM=1
196646  67.470994 151.77.47.100 -> 244.3.160.239 TCP 70 12603 > http [SYN] Seq=0 Win=8192 Len=0 MSS=1460 WS=4 SACK_PERM=1
196649  67.471242 151.77.47.100 -> 244.3.160.239 TCP 64 elanlm > http [ACK] Seq=1 Ack=1 Win=17520 Len=0
196651  67.472005 151.77.47.100 -> 244.3.160.239 TCP 64 12600 > http [ACK] Seq=1 Ack=1 Win=17520 Len=0
196672  67.489032 151.77.47.100 -> 244.3.160.239 TCP 64 12603 > http [ACK] Seq=1 Ack=1 Win=17520 Len=0
196860  67.531166 151.77.47.100 -> 244.3.160.239 TCP 64 10126 > http [ACK] Seq=920 Ack=919 Win=16600 Len=0
196861  67.531503 151.77.47.100 -> 244.3.160.239 TCP 64 5159 > http [ACK] Seq=910 Ack=1753 Win=17520 Len=0
196880  67.532785 151.77.47.100 -> 244.3.160.239 TCP 64 gbjd816 > http [ACK] Seq=916 Ack=2421 Win=17520 Len=0
196938  67.536763 151.77.47.100 -> 244.3.160.239 TCP 64 ums > http [ACK] Seq=914 Ack=541 Win=16980 Len=0
196977  67.538868 151.77.47.100 -> 244.3.160.239 TCP 64 npds-tracker > http [ACK] Seq=911 Ack=317 Win=17204 Len=0
196990  67.539274 151.77.47.100 -> 244.3.160.239 TCP 64 15879 > http [ACK] Seq=913 Ack=539 Win=16980 Len=0
197214  67.614928 151.77.47.100 -> 244.3.160.239 TCP 64 ums > http [FIN, ACK] Seq=914 Ack=541 Win=16980 Len=0
197216  67.615299 151.77.47.100 -> 244.3.160.239 TCP 64 npds-tracker > http [FIN, ACK] Seq=911 Ack=317 Win=17204 Len=0
197218  67.615515 151.77.47.100 -> 244.3.160.239 TCP 64 15879 > http [FIN, ACK] Seq=913 Ack=539 Win=16980 Len=0
197224  67.617665 151.77.47.100 -> 244.3.160.239 TCP 70 4239 > http [SYN] Seq=0 Win=8192 Len=0 MSS=1460 WS=4 SACK_PERM=1
197236  67.621928 151.77.47.100 -> 244.3.160.239 TCP 70 9828 > http [SYN] Seq=0 Win=8192 Len=0 MSS=1460 WS=4 SACK_PERM=1
197238  67.622200 151.77.47.100 -> 244.3.160.239 TCP 70 ppsms > http [SYN] Seq=0 Win=8192 Len=0 MSS=1460 WS=4 SACK_PERM=1
197244  67.623770 151.77.47.100 -> 244.3.160.239 TCP 64 4239 > http [ACK] Seq=1 Ack=1 Win=17520 Len=0
197245  67.623872 151.77.47.100 -> 244.3.160.239 TCP 64 9828 > http [ACK] Seq=1 Ack=1 Win=17520 Len=0
197296  67.641144 151.77.47.100 -> 244.3.160.239 TCP 64 ppsms > http [ACK] Seq=1 Ack=1 Win=17520 Len=0
197303  67.646314 151.77.47.100 -> 244.3.160.239 TCP 64 ums > http [ACK] Seq=915 Ack=542 Win=16980 Len=0
197304  67.647229 151.77.47.100 -> 244.3.160.239 TCP 64 npds-tracker > http [ACK] Seq=912 Ack=318 Win=17204 Len=0
197309  67.649272 151.77.47.100 -> 244.3.160.239 TCP 64 15879 > http [ACK] Seq=914 Ack=540 Win=16980 Len=0
197310  67.649595 151.77.47.100 -> 244.3.160.239 TCP 64 elanlm > http [ACK] Seq=912 Ack=528 Win=16992 Len=0
197396  67.682308 151.77.47.100 -> 244.3.160.239 TCP 64 elanlm > http [FIN, ACK] Seq=912 Ack=528 Win=16992 Len=0
197406  67.684549 151.77.47.100 -> 244.3.160.239 TCP 70 7740 > http [SYN] Seq=0 Win=8192 Len=0 MSS=1460 WS=4 SACK_PERM=1
197408  67.687027 151.77.47.100 -> 244.3.160.239 TCP 64 7740 > http [ACK] Seq=1 Ack=1 Win=17520 Len=0
197611  67.752597 151.77.47.100 -> 244.3.160.239 TCP 64 elanlm > http [ACK] Seq=913 Ack=529 Win=16992 Len=0
197613  67.753295 151.77.47.100 -> 244.3.160.239 TCP 64 12600 > http [ACK] Seq=915 Ack=591 Win=16928 Len=0
197615  67.753485 151.77.47.100 -> 244.3.160.239 TCP 64 12600 > http [FIN, ACK] Seq=915 Ack=591 Win=16928 Len=0
197617  67.753632 151.77.47.100 -> 244.3.160.239 TCP 70 15140 > http [SYN] Seq=0 Win=8192 Len=0 MSS=1460 WS=4 SACK_PERM=1
197627  67.756248 151.77.47.100 -> 244.3.160.239 TCP 64 15140 > http [ACK] Seq=1 Ack=1 Win=17520 Len=0
197842  67.855428 151.77.47.100 -> 244.3.160.239 TCP 64 12600 > http [ACK] Seq=916 Ack=592 Win=16928 Len=0
197869  67.860057 151.77.47.100 -> 244.3.160.239 TCP 64 ppsms > http [ACK] Seq=911 Ack=394 Win=17124 Len=0
197882  67.869027 151.77.47.100 -> 244.3.160.239 TCP 64 7740 > http [ACK] Seq=918 Ack=392 Win=17128 Len=0
197899  67.878251 151.77.47.100 -> 244.3.160.239 TCP 64 ppsms > http [FIN, ACK] Seq=911 Ack=394 Win=17124 Len=0
197901  67.878630 151.77.47.100 -> 244.3.160.239 TCP 64 4239 > http [ACK] Seq=911 Ack=3191 Win=17520 Len=0
197902  67.878810 151.77.47.100 -> 244.3.160.239 TCP 64 9828 > http [ACK] Seq=916 Ack=350 Win=17168 Len=0
197906  67.879171 151.77.47.100 -> 244.3.160.239 TCP 64 12603 > http [ACK] Seq=912 Ack=878 Win=16644 Len=0
197909  67.879349 151.77.47.100 -> 244.3.160.239 TCP 64 ppsms > http [ACK] Seq=912 Ack=395 Win=17124 Len=0
197911  67.880316 151.77.47.100 -> 244.3.160.239 TCP 64 7740 > http [ACK] Seq=918 Ack=393 Win=17128 Len=0
197912  67.880610 151.77.47.100 -> 244.3.160.239 TCP 64 9828 > http [ACK] Seq=916 Ack=351 Win=17168 Len=0
197913  67.880996 151.77.47.100 -> 244.3.160.239 TCP 64 7740 > http [FIN, ACK] Seq=918 Ack=393 Win=17128 Len=0
197928  67.884173 151.77.47.100 -> 244.3.160.239 TCP 64 9828 > http [FIN, ACK] Seq=916 Ack=351 Win=17168 Len=0
197931  67.884429 151.77.47.100 -> 244.3.160.239 TCP 64 12603 > http [FIN, ACK] Seq=912 Ack=878 Win=16644 Len=0
197953  67.891333 151.77.47.100 -> 244.3.160.239 TCP 64 4239 > http [ACK] Seq=911 Ack=6943 Win=17520 Len=0
197954  67.892818 151.77.47.100 -> 244.3.160.239 TCP 64 4239 > http [ACK] Seq=911 Ack=8750 Win=17520 Len=0
198013  67.923323 151.77.47.100 -> 244.3.160.239 TCP 64 15140 > http [ACK] Seq=914 Ack=348 Win=17172 Len=0
198019  67.925637 151.77.47.100 -> 244.3.160.239 TCP 64 4239 > http [ACK] Seq=911 Ack=11670 Win=17520 Len=0
198024  67.926802 151.77.47.100 -> 244.3.160.239 TCP 64 15140 > http [FIN, ACK] Seq=914 Ack=348 Win=17172 Len=0
198032  67.928428 151.77.47.100 -> 244.3.160.239 TCP 64 15140 > http [ACK] Seq=915 Ack=349 Win=17172 Len=0
198033  67.928759 151.77.47.100 -> 244.3.160.239 TCP 64 4239 > http [ACK] Seq=911 Ack=14590 Win=17520 Len=0
198035  67.929129 151.77.47.100 -> 244.3.160.239 TCP 64 4239 > http [FIN, ACK] Seq=911 Ack=15955 Win=16152 Len=0
198084  67.951047 151.77.47.100 -> 244.3.160.239 TCP 70 14383 > http [SYN] Seq=0 Win=8192 Len=0 MSS=1460 WS=4 SACK_PERM=1
198091  67.955035 151.77.47.100 -> 244.3.160.239 TCP 64 14383 > http [ACK] Seq=1 Ack=1 Win=17520 Len=0
198103  67.963440 151.77.47.100 -> 244.3.160.239 TCP 70 11916 > http [SYN] Seq=0 Win=8192 Len=0 MSS=1460 WS=4 SACK_PERM=1
198116  67.974926 151.77.47.100 -> 244.3.160.239 TCP 64 11916 > http [ACK] Seq=1 Ack=1 Win=17520 Len=0
198131  67.994158 151.77.47.100 -> 244.3.160.239 TCP 70 5126 > http [SYN] Seq=0 Win=8192 Len=0 MSS=1460 WS=4 SACK_PERM=1
198136  67.996131 151.77.47.100 -> 244.3.160.239 TCP 70 empowerid > http [SYN] Seq=0 Win=8192 Len=0 MSS=1460 WS=4 SACK_PERM=1
198139  67.997093 151.77.47.100 -> 244.3.160.239 TCP 64 5126 > http [ACK] Seq=1 Ack=1 Win=17520 Len=0
198142  67.998327 151.77.47.100 -> 244.3.160.239 TCP 70 d-data-control > http [SYN] Seq=0 Win=8192 Len=0 MSS=1460 WS=4 SACK_PERM=1
198145  67.998925 151.77.47.100 -> 244.3.160.239 TCP 64 empowerid > http [ACK] Seq=1 Ack=1 Win=17520 Len=0
198147  68.000955 151.77.47.100 -> 244.3.160.239 TCP 64 d-data-control > http [ACK] Seq=1 Ack=1 Win=17520 Len=0
198148  68.001512 151.77.47.100 -> 244.3.160.239 TCP 70 12830 > http [SYN] Seq=0 Win=8192 Len=0 MSS=1460 WS=4 SACK_PERM=1
198165  68.020148 151.77.47.100 -> 244.3.160.239 TCP 64 12830 > http [ACK] Seq=1 Ack=1 Win=17520 Len=0
198225  68.040971 151.77.47.100 -> 244.3.160.239 TCP 64 4239 > http [ACK] Seq=912 Ack=15956 Win=16152 Len=0
198410  68.142970 151.77.47.100 -> 244.3.160.239 TCP 64 14383 > http [ACK] Seq=916 Ack=543 Win=16976 Len=0
198414  68.143392 151.77.47.100 -> 244.3.160.239 TCP 64 11916 > http [ACK] Seq=917 Ack=538 Win=16980 Len=0
198416  68.143769 151.77.47.100 -> 244.3.160.239 TCP 64 14383 > http [FIN, ACK] Seq=916 Ack=543 Win=16976 Len=0
198419  68.144047 151.77.47.100 -> 244.3.160.239 TCP 64 11916 > http [FIN, ACK] Seq=917 Ack=538 Win=16980 Len=0
198421  68.144790 151.77.47.100 -> 244.3.160.239 TCP 64 14383 > http [ACK] Seq=917 Ack=544 Win=16976 Len=0
198425  68.145892 151.77.47.100 -> 244.3.160.239 TCP 64 11916 > http [ACK] Seq=918 Ack=539 Win=16980 Len=0
198427  68.146193 151.77.47.100 -> 244.3.160.239 TCP 70 14865 > http [SYN] Seq=0 Win=8192 Len=0 MSS=1460 WS=4 SACK_PERM=1
198430  68.147178 151.77.47.100 -> 244.3.160.239 TCP 70 4241 > http [SYN] Seq=0 Win=8192 Len=0 MSS=1460 WS=4 SACK_PERM=1
198436  68.149559 151.77.47.100 -> 244.3.160.239 TCP 64 14865 > http [ACK] Seq=1 Ack=1 Win=17520 Len=0
198437  68.149564 151.77.47.100 -> 244.3.160.239 TCP 64 4241 > http [ACK] Seq=1 Ack=1 Win=17520 Len=0
198603  68.252731 151.77.47.100 -> 244.3.160.239 TCP 64 5126 > http [ACK] Seq=915 Ack=530 Win=16988 Len=0
198609  68.257991 151.77.47.100 -> 244.3.160.239 TCP 64 empowerid > http [ACK] Seq=918 Ack=576 Win=16944 Len=0
198637  68.264490 151.77.47.100 -> 244.3.160.239 TCP 64 d-data-control > http [ACK] Seq=919 Ack=723 Win=16796 Len=0
198639  68.265303 151.77.47.100 -> 244.3.160.239 TCP 64 12830 > http [ACK] Seq=917 Ack=748 Win=16772 Len=0
198706  68.283467 151.77.47.100 -> 244.3.160.239 TCP 64 5126 > http [FIN, ACK] Seq=915 Ack=530 Win=16988 Len=0
198710  68.284267 151.77.47.100 -> 244.3.160.239 TCP 64 12830 > http [FIN, ACK] Seq=917 Ack=748 Win=16772 Len=0
198713  68.284501 151.77.47.100 -> 244.3.160.239 TCP 64 d-data-control > http [FIN, ACK] Seq=919 Ack=723 Win=16796 Len=0
198717  68.285101 151.77.47.100 -> 244.3.160.239 TCP 64 empowerid > http [FIN, ACK] Seq=918 Ack=576 Win=16944 Len=0
198721  68.286755 151.77.47.100 -> 244.3.160.239 TCP 70 4775 > http [SYN] Seq=0 Win=8192 Len=0 MSS=1460 WS=4 SACK_PERM=1
198730  68.289265 151.77.47.100 -> 244.3.160.239 TCP 70 4246 > http [SYN] Seq=0 Win=8192 Len=0 MSS=1460 WS=4 SACK_PERM=1
198733  68.289355 151.77.47.100 -> 244.3.160.239 TCP 64 4775 > http [ACK] Seq=1 Ack=1 Win=17520 Len=0
198738  68.290781 151.77.47.100 -> 244.3.160.239 TCP 70 11864 > http [SYN] Seq=0 Win=8192 Len=0 MSS=1460 WS=4 SACK_PERM=1
198744  68.292317 151.77.47.100 -> 244.3.160.239 TCP 64 4246 > http [ACK] Seq=1 Ack=1 Win=17520 Len=0
198747  68.295514 151.77.47.100 -> 244.3.160.239 TCP 64 11864 > http [ACK] Seq=1 Ack=1 Win=17520 Len=0
198798  68.316308 151.77.47.100 -> 244.3.160.239 TCP 70 5882 > http [SYN] Seq=0 Win=8192 Len=0 MSS=1460 WS=4 SACK_PERM=1
198836  68.332116 151.77.47.100 -> 244.3.160.239 TCP 64 5882 > http [ACK] Seq=1 Ack=1 Win=17520 Len=0
198896  68.366058 151.77.47.100 -> 244.3.160.239 TCP 64 5126 > http [ACK] Seq=916 Ack=531 Win=16988 Len=0
198926  68.379187 151.77.47.100 -> 244.3.160.239 TCP 64 empowerid > http [ACK] Seq=919 Ack=577 Win=16944 Len=0
198927  68.379392 151.77.47.100 -> 244.3.160.239 TCP 64 d-data-control > http [ACK] Seq=920 Ack=724 Win=16796 Len=0
198928  68.379899 151.77.47.100 -> 244.3.160.239 TCP 64 12830 > http [ACK] Seq=918 Ack=749 Win=16772 Len=0
198929  68.380210 151.77.47.100 -> 244.3.160.239 TCP 64 14865 > http [ACK] Seq=919 Ack=837 Win=16684 Len=0
198930  68.380453 151.77.47.100 -> 244.3.160.239 TCP 64 4241 > http [ACK] Seq=925 Ack=793 Win=16728 Len=0
198967  68.402581 151.77.47.100 -> 244.3.160.239 TCP 64 4241 > http [FIN, ACK] Seq=925 Ack=793 Win=16728 Len=0
198969  68.402825 151.77.47.100 -> 244.3.160.239 TCP 64 14865 > http [FIN, ACK] Seq=919 Ack=837 Win=16684 Len=0
198974  68.404202 151.77.47.100 -> 244.3.160.239 TCP 70 12608 > http [SYN] Seq=0 Win=8192 Len=0 MSS=1460 WS=4 SACK_PERM=1
198981  68.406588 151.77.47.100 -> 244.3.160.239 TCP 64 12608 > http [ACK] Seq=1 Ack=1 Win=17520 Len=0
198984  68.407455 151.77.47.100 -> 244.3.160.239 TCP 70 tscchat > http [SYN] Seq=0 Win=8192 Len=0 MSS=1460 WS=4 SACK_PERM=1
199029  68.426377 151.77.47.100 -> 244.3.160.239 TCP 64 tscchat > http [ACK] Seq=1 Ack=1 Win=17520 Len=0
199128  68.468125 151.77.47.100 -> 244.3.160.239 TCP 64 14865 > http [ACK] Seq=920 Ack=838 Win=16684 Len=0
199129  68.468262 151.77.47.100 -> 244.3.160.239 TCP 64 4241 > http [ACK] Seq=926 Ack=794 Win=16728 Len=0
199451  68.616701 151.77.47.100 -> 244.3.160.239 TCP 64 12608 > http [ACK] Seq=917 Ack=820 Win=16700 Len=0
199452  68.617017 151.77.47.100 -> 244.3.160.239 TCP 64 4775 > http [ACK] Seq=922 Ack=809 Win=16712 Len=0
199453  68.617302 151.77.47.100 -> 244.3.160.239 TCP 64 4246 > http [ACK] Seq=926 Ack=784 Win=16736 Len=0
199454  68.617633 151.77.47.100 -> 244.3.160.239 TCP 64 11864 > http [ACK] Seq=926 Ack=903 Win=16616 Len=0
199455  68.617883 151.77.47.100 -> 244.3.160.239 TCP 64 5882 > http [ACK] Seq=925 Ack=922 Win=16596 Len=0
199456  68.618164 151.77.47.100 -> 244.3.160.239 TCP 64 12608 > http [FIN, ACK] Seq=917 Ack=820 Win=16700 Len=0
199458  68.618502 151.77.47.100 -> 244.3.160.239 TCP 64 5882 > http [FIN, ACK] Seq=925 Ack=922 Win=16596 Len=0
199463  68.619094 151.77.47.100 -> 244.3.160.239 TCP 64 11864 > http [FIN, ACK] Seq=926 Ack=903 Win=16616 Len=0
199465  68.619470 151.77.47.100 -> 244.3.160.239 TCP 64 4775 > http [FIN, ACK] Seq=922 Ack=809 Win=16712 Len=0
199467  68.620079 151.77.47.100 -> 244.3.160.239 TCP 64 4246 > http [FIN, ACK] Seq=926 Ack=784 Win=16736 Len=0
199469  68.620646 151.77.47.100 -> 244.3.160.239 TCP 70 11828 > http [SYN] Seq=0 Win=8192 Len=0 MSS=1460 WS=4 SACK_PERM=1
199471  68.621561 151.77.47.100 -> 244.3.160.239 TCP 70 5391 > http [SYN] Seq=0 Win=8192 Len=0 MSS=1460 WS=4 SACK_PERM=1
199476  68.623309 151.77.47.100 -> 244.3.160.239 TCP 64 11828 > http [ACK] Seq=1 Ack=1 Win=17520 Len=0
199479  68.623991 151.77.47.100 -> 244.3.160.239 TCP 64 5391 > http [ACK] Seq=1 Ack=1 Win=17520 Len=0
199591  68.664969 151.77.47.100 -> 244.3.160.239 TCP 64 12608 > http [ACK] Seq=918 Ack=821 Win=16700 Len=0
199593  68.665345 151.77.47.100 -> 244.3.160.239 TCP 64 4775 > http [ACK] Seq=923 Ack=810 Win=16712 Len=0
199594  68.665710 151.77.47.100 -> 244.3.160.239 TCP 64 4246 > http [ACK] Seq=927 Ack=785 Win=16736 Len=0
199596  68.666991 151.77.47.100 -> 244.3.160.239 TCP 64 11864 > http [ACK] Seq=927 Ack=904 Win=16616 Len=0
199597  68.667172 151.77.47.100 -> 244.3.160.239 TCP 64 5882 > http [ACK] Seq=926 Ack=923 Win=16596 Len=0
199598  68.669052 151.77.47.100 -> 244.3.160.239 TCP 64 tscchat > http [ACK] Seq=923 Ack=879 Win=16640 Len=0
199602  68.672898 151.77.47.100 -> 244.3.160.239 TCP 64 tscchat > http [FIN, ACK] Seq=923 Ack=879 Win=16640 Len=0
199769  68.756040 151.77.47.100 -> 244.3.160.239 TCP 64 tscchat > http [ACK] Seq=924 Ack=880 Win=16640 Len=0
199848  68.812420 151.77.47.100 -> 244.3.160.239 TCP 64 5391 > http [ACK] Seq=767 Ack=1794 Win=17520 Len=0
199849  68.812606 151.77.47.100 -> 244.3.160.239 TCP 64 5391 > http [FIN, ACK] Seq=767 Ack=1794 Win=17520 Len=0
199957  68.875633 151.77.47.100 -> 244.3.160.239 TCP 64 11828 > http [ACK] Seq=922 Ack=872 Win=16648 Len=0
199985  68.883147 151.77.47.100 -> 244.3.160.239 TCP 64 11828 > http [FIN, ACK] Seq=922 Ack=872 Win=16648 Len=0
200129  68.975480 151.77.47.100 -> 244.3.160.239 TCP 64 11828 > http [ACK] Seq=923 Ack=873 Win=16648 Len=0
200839  69.244749 151.77.47.100 -> 244.3.160.239 TCP 70 12442 > http [SYN] Seq=0 Win=8192 Len=0 MSS=1460 WS=4 SACK_PERM=1
200843  69.248247 151.77.47.100 -> 244.3.160.239 TCP 64 12442 > http [ACK] Seq=1 Ack=1 Win=17520 Len=0
201161  69.398372 151.77.47.100 -> 244.3.160.239 TCP 64 12442 > http [ACK] Seq=797 Ack=1794 Win=17520 Len=0
201162  69.398377 151.77.47.100 -> 244.3.160.239 TCP 64 12442 > http [FIN, ACK] Seq=797 Ack=1794 Win=17520 Len=0
241326  84.030779 151.77.47.100 -> 244.3.160.239 TCP 70 15556 > http [SYN] Seq=0 Win=8192 Len=0 MSS=1460 WS=4 SACK_PERM=1
241332  84.033351 151.77.47.100 -> 244.3.160.239 TCP 64 15556 > http [ACK] Seq=1 Ack=1 Win=17520 Len=0
245416  85.682905 151.77.47.100 -> 244.3.160.239 TCP 64 15556 > http [ACK] Seq=1124 Ack=2873 Win=17520 Len=0
245553  85.738708 151.77.47.100 -> 244.3.160.239 TCP 64 15556 > http [ACK] Seq=1124 Ack=5014 Win=17520 Len=0
245555  85.740763 151.77.47.100 -> 244.3.160.239 TCP 64 15556 > http [ACK] Seq=1124 Ack=7063 Win=17520 Len=0
245560  85.741531 151.77.47.100 -> 244.3.160.239 TCP 64 15556 > http [ACK] Seq=1124 Ack=8713 Win=17520 Len=0
245680  85.808368 151.77.47.100 -> 244.3.160.239 TCP 64 15556 > http [ACK] Seq=1124 Ack=11633 Win=17520 Len=0
245684  85.810452 151.77.47.100 -> 244.3.160.239 TCP 64 15556 > http [ACK] Seq=1124 Ack=13696 Win=17520 Len=0
245687  85.812005 151.77.47.100 -> 244.3.160.239 TCP 64 15556 > http [ACK] Seq=1124 Ack=15761 Win=17520 Len=0
245690  85.813604 151.77.47.100 -> 244.3.160.239 TCP 64 15556 > http [ACK] Seq=1124 Ack=17492 Win=17520 Len=0
245694  85.815942 151.77.47.100 -> 244.3.160.239 TCP 70 eapsp > http [SYN] Seq=0 Win=8192 Len=0 MSS=1460 WS=4 SACK_PERM=1
245701  85.819799 151.77.47.100 -> 244.3.160.239 TCP 64 eapsp > http [ACK] Seq=1 Ack=1 Win=17520 Len=0
245803  85.882060 151.77.47.100 -> 244.3.160.239 TCP 64 15556 > http [ACK] Seq=1124 Ack=20347 Win=17520 Len=0
245813  85.882499 151.77.47.100 -> 244.3.160.239 TCP 64 15556 > http [ACK] Seq=1124 Ack=20348 Win=17520 Len=0
245814  85.882697 151.77.47.100 -> 244.3.160.239 TCP 64 15556 > http [FIN, ACK] Seq=1124 Ack=20348 Win=17520 Len=0
245821  85.886845 151.77.47.100 -> 244.3.160.239 TCP 70 4214 > http [SYN] Seq=0 Win=8192 Len=0 MSS=1460 WS=4 SACK_PERM=1
245843  85.891404 151.77.47.100 -> 244.3.160.239 TCP 64 4214 > http [ACK] Seq=1 Ack=1 Win=17520 Len=0
245946  85.980922 151.77.47.100 -> 244.3.160.239 TCP 64 eapsp > http [ACK] Seq=864 Ack=631 Win=16888 Len=0
245947  85.984917 151.77.47.100 -> 244.3.160.239 TCP 64 eapsp > http [FIN, ACK] Seq=864 Ack=631 Win=16888 Len=0
246025  86.085927 151.77.47.100 -> 244.3.160.239 TCP 64 eapsp > http [ACK] Seq=865 Ack=632 Win=16888 Len=0
246041  86.098317 151.77.47.100 -> 244.3.160.239 TCP 64 4214 > http [ACK] Seq=865 Ack=2501 Win=17520 Len=0
246044  86.102232 151.77.47.100 -> 244.3.160.239 TCP 64 4214 > http [FIN, ACK] Seq=865 Ack=2501 Win=17520 Len=0
246232  86.194838 151.77.47.100 -> 244.3.160.239 TCP 64 4214 > http [ACK] Seq=866 Ack=2502 Win=17520 Len=0
312867 106.794695 151.77.47.100 -> 244.3.160.239 TCP 70 5515 > http [SYN] Seq=0 Win=8192 Len=0 MSS=1460 WS=4 SACK_PERM=1
312875 106.797506 151.77.47.100 -> 244.3.160.239 TCP 64 5515 > http [ACK] Seq=1 Ack=1 Win=17520 Len=0
318276 108.535758 151.77.47.100 -> 244.3.160.239 TCP 64 5515 > http [ACK] Seq=901 Ack=2873 Win=17520 Len=0
318554 108.588835 151.77.47.100 -> 244.3.160.239 TCP 64 5515 > http [ACK] Seq=901 Ack=5023 Win=17520 Len=0
318559 108.590829 151.77.47.100 -> 244.3.160.239 TCP 64 5515 > http [ACK] Seq=901 Ack=7072 Win=17520 Len=0
318569 108.594048 151.77.47.100 -> 244.3.160.239 TCP 64 5515 > http [ACK] Seq=901 Ack=8713 Win=17520 Len=0
318814 108.655756 151.77.47.100 -> 244.3.160.239 TCP 64 5515 > http [ACK] Seq=901 Ack=10764 Win=17520 Len=0
318815 108.656007 151.77.47.100 -> 244.3.160.239 TCP 64 5515 > http [ACK] Seq=901 Ack=12813 Win=17520 Len=0
318825 108.658165 151.77.47.100 -> 244.3.160.239 TCP 64 5515 > http [ACK] Seq=901 Ack=14879 Win=17520 Len=0
318840 108.658344 151.77.47.100 -> 244.3.160.239 TCP 64 5515 > http [ACK] Seq=901 Ack=17473 Win=17520 Len=0
319021 108.718187 151.77.47.100 -> 244.3.160.239 TCP 64 5515 > http [ACK] Seq=901 Ack=19522 Win=17520 Len=0
319022 108.718329 151.77.47.100 -> 244.3.160.239 TCP 64 5515 > http [ACK] Seq=901 Ack=21852 Win=17520 Len=0
319023 108.718573 151.77.47.100 -> 244.3.160.239 TCP 64 5515 > http [ACK] Seq=901 Ack=24123 Win=17520 Len=0
319024 108.720461 151.77.47.100 -> 244.3.160.239 TCP 64 5515 > http [FIN, ACK] Seq=901 Ack=24123 Win=17520 Len=0
323328 110.790967 151.77.47.100 -> 244.3.160.239 TCP 70 7079 > http [SYN] Seq=0 Win=8192 Len=0 MSS=1460 WS=4 SACK_PERM=1
323330 110.793749 151.77.47.100 -> 244.3.160.239 TCP 64 7079 > http [ACK] Seq=1 Ack=1 Win=17520 Len=0
326691 112.808406 151.77.47.100 -> 244.3.160.239 TCP 64 7079 > http [ACK] Seq=935 Ack=2873 Win=17520 Len=0
326817 112.859685 151.77.47.100 -> 244.3.160.239 TCP 64 7079 > http [ACK] Seq=935 Ack=5023 Win=17520 Len=0
326818 112.861077 151.77.47.100 -> 244.3.160.239 TCP 64 7079 > http [ACK] Seq=935 Ack=7072 Win=17520 Len=0
326819 112.863157 151.77.47.100 -> 244.3.160.239 TCP 64 7079 > http [ACK] Seq=935 Ack=8713 Win=17520 Len=0
327004 112.923555 151.77.47.100 -> 244.3.160.239 TCP 64 7079 > http [ACK] Seq=935 Ack=10764 Win=17520 Len=0
327005 112.924133 151.77.47.100 -> 244.3.160.239 TCP 64 7079 > http [ACK] Seq=935 Ack=12813 Win=17520 Len=0
327015 112.926587 151.77.47.100 -> 244.3.160.239 TCP 64 7079 > http [ACK] Seq=935 Ack=14879 Win=17520 Len=0
327021 112.928807 151.77.47.100 -> 244.3.160.239 TCP 64 7079 > http [ACK] Seq=935 Ack=17473 Win=17520 Len=0
327151 112.986163 151.77.47.100 -> 244.3.160.239 TCP 64 7079 > http [ACK] Seq=935 Ack=19580 Win=17520 Len=0
327153 112.986751 151.77.47.100 -> 244.3.160.239 TCP 64 7079 > http [FIN, ACK] Seq=935 Ack=19580 Win=17520 Len=0
351369 118.778385 151.77.47.100 -> 244.3.160.239 TCP 70 ezmeeting-2 > http [SYN] Seq=0 Win=8192 Len=0 MSS=1460 WS=4 SACK_PERM=1
351381 118.780718 151.77.47.100 -> 244.3.160.239 TCP 64 ezmeeting-2 > http [ACK] Seq=1 Ack=1 Win=17520 Len=0
353101 119.905065 151.77.47.100 -> 244.3.160.239 TCP 64 ezmeeting-2 > http [ACK] Seq=1177 Ack=642 Win=16880 Len=0
353103 119.908756 151.77.47.100 -> 244.3.160.239 TCP 64 ezmeeting-2 > http [FIN, ACK] Seq=1177 Ack=642 Win=16880 Len=0
353108 119.910789 151.77.47.100 -> 41.177.98.176 TCP 70 51337 > http [SYN] Seq=0 Win=8192 Len=0 MSS=1460 WS=4 SACK_PERM=1
353134 119.913440 151.77.47.100 -> 41.177.98.176 TCP 64 51337 > http [ACK] Seq=1 Ack=1 Win=17520 Len=0
356961 121.795974 151.77.47.100 -> 41.177.98.176 TCP 64 51337 > http [ACK] Seq=1080 Ack=4381 Win=17520 Len=0
356971 121.798581 151.77.47.100 -> 41.177.98.176 TCP 64 51337 > http [ACK] Seq=1080 Ack=6795 Win=17520 Len=0
356986 121.800624 151.77.47.100 -> 41.177.98.176 TCP 64 51337 > http [ACK] Seq=1080 Ack=10463 Win=17520 Len=0
356997 121.802786 151.77.47.100 -> 41.177.98.176 TCP 64 51337 > http [ACK] Seq=1080 Ack=13383 Win=17520 Len=0
357000 121.804704 151.77.47.100 -> 41.177.98.176 TCP 64 51337 > http [ACK] Seq=1080 Ack=16745 Win=17520 Len=0
409925 136.858296 151.77.47.100 -> 41.177.98.176 TCP 64 51337 > http [ACK] Seq=1080 Ack=16746 Win=17520 Len=0
447043 145.155901 151.77.47.100 -> 41.177.98.176 TCP 64 51337 > http [FIN, ACK] Seq=1080 Ack=16746 Win=17520 Len=0
468557 154.540990 151.77.47.100 -> 41.177.98.176 TCP 70 51338 > http [SYN] Seq=0 Win=8192 Len=0 MSS=1460 WS=4 SACK_PERM=1
468573 154.543679 151.77.47.100 -> 41.177.98.176 TCP 64 51338 > http [ACK] Seq=1 Ack=1 Win=17520 Len=0
469114 154.785558 151.77.47.100 -> 41.177.98.176 TCP 64 51338 > http [ACK] Seq=1126 Ack=4381 Win=17520 Len=0
469119 154.788552 151.77.47.100 -> 41.177.98.176 TCP 64 51338 > http [ACK] Seq=1126 Ack=7301 Win=17520 Len=0
469129 154.796478 151.77.47.100 -> 41.177.98.176 TCP 64 51338 > http [ACK] Seq=1126 Ack=10221 Win=17520 Len=0
469140 154.797736 151.77.47.100 -> 41.177.98.176 TCP 64 51338 > http [ACK] Seq=1126 Ack=13141 Win=17520 Len=0
469153 154.799457 151.77.47.100 -> 41.177.98.176 TCP 64 51338 > http [ACK] Seq=1126 Ack=16820 Win=17520 Len=0
498759 163.648261 151.77.47.100 -> 41.177.98.176 TCP 64 51338 > http [ACK] Seq=2335 Ack=20572 Win=17520 Len=0
498760 163.649462 151.77.47.100 -> 41.177.98.176 TCP 64 51338 > http [ACK] Seq=2335 Ack=22153 Win=17520 Len=0
498765 163.651223 151.77.47.100 -> 41.177.98.176 TCP 64 51338 > http [ACK] Seq=2335 Ack=25905 Win=17520 Len=0
498768 163.652421 151.77.47.100 -> 41.177.98.176 TCP 64 51338 > http [ACK] Seq=2335 Ack=27281 Win=16144 Len=0
498784 163.656815 151.77.47.100 -> 41.177.98.176 TCP 64 51338 > http [ACK] Seq=2335 Ack=31033 Win=17520 Len=0
498785 163.657012 151.77.47.100 -> 41.177.98.176 TCP 64 51338 > http [ACK] Seq=2335 Ack=32409 Win=16144 Len=0
498799 163.664259 151.77.47.100 -> 41.177.98.176 TCP 64 51338 > http [ACK] Seq=2335 Ack=35329 Win=17520 Len=0
498802 163.665199 151.77.47.100 -> 41.177.98.176 TCP 64 51338 > http [ACK] Seq=2335 Ack=37514 Win=17520 Len=0
503597 163.834062 151.77.47.100 -> 41.177.98.176 TCP 70 51339 > http [SYN] Seq=0 Win=8192 Len=0 MSS=1460 WS=4 SACK_PERM=1
503599 163.837337 151.77.47.100 -> 41.177.98.176 TCP 70 51340 > http [SYN] Seq=0 Win=8192 Len=0 MSS=1460 WS=4 SACK_PERM=1
503602 163.837566 151.77.47.100 -> 41.177.98.176 TCP 64 51339 > http [ACK] Seq=1 Ack=1 Win=17520 Len=0
504033 163.854231 151.77.47.100 -> 41.177.98.176 TCP 64 51340 > http [ACK] Seq=1 Ack=1 Win=17520 Len=0
504107 163.855903 151.77.47.100 -> 41.177.98.176 TCP 70 51341 > http [SYN] Seq=0 Win=8192 Len=0 MSS=1460 WS=4 SACK_PERM=1
504615 163.869717 151.77.47.100 -> 41.177.98.176 TCP 64 51339 > http [ACK] Seq=925 Ack=1535 Win=17520 Len=0
504626 163.869983 151.77.47.100 -> 41.177.98.176 TCP 64 51341 > http [ACK] Seq=1 Ack=1 Win=17520 Len=0
504680 163.871643 151.77.47.100 -> 41.177.98.176 TCP 70 51342 > http [SYN] Seq=0 Win=8192 Len=0 MSS=1460 WS=4 SACK_PERM=1
505118 163.888358 151.77.47.100 -> 41.177.98.176 TCP 64 51342 > http [ACK] Seq=1 Ack=1 Win=17520 Len=0
505933 163.915696 151.77.47.100 -> 41.177.98.176 TCP 64 51340 > http [ACK] Seq=924 Ack=2203 Win=17520 Len=0
506891 163.949055 151.77.47.100 -> 41.177.98.176 TCP 64 51341 > http [ACK] Seq=924 Ack=3219 Win=17520 Len=0
507036 163.954787 151.77.47.100 -> 41.177.98.176 TCP 64 51341 > http [ACK] Seq=924 Ack=6139 Win=17520 Len=0
507179 163.958538 151.77.47.100 -> 41.177.98.176 TCP 64 51341 > http [ACK] Seq=924 Ack=9059 Win=17520 Len=0
507595 163.968158 151.77.47.100 -> 41.177.98.176 TCP 64 51342 > http [ACK] Seq=924 Ack=4381 Win=17520 Len=0
507611 163.968395 151.77.47.100 -> 41.177.98.176 TCP 64 51341 > http [ACK] Seq=924 Ack=11794 Win=17520 Len=0
509553 164.036232 151.77.47.100 -> 41.177.98.176 TCP 64 51338 > http [ACK] Seq=3259 Ack=38135 Win=16896 Len=0
511356 164.166315 151.77.47.100 -> 41.177.98.176 TCP 64 51342 > http [ACK] Seq=924 Ack=5431 Win=16468 Len=0
512969 164.863435 151.77.47.100 -> 41.177.98.176 TCP 64 51338 > http [ACK] Seq=4218 Ack=39549 Win=17520 Len=0
555405 178.865626 151.77.47.100 -> 41.177.98.176 TCP 64 51339 > http [ACK] Seq=925 Ack=1536 Win=17520 Len=0
555548 178.895651 151.77.47.100 -> 41.177.98.176 TCP 64 51340 > http [ACK] Seq=924 Ack=2204 Win=17520 Len=0
555677 178.925747 151.77.47.100 -> 41.177.98.176 TCP 64 51341 > http [ACK] Seq=924 Ack=11795 Win=17520 Len=0
555798 178.960917 151.77.47.100 -> 41.177.98.176 TCP 64 51342 > http [ACK] Seq=924 Ack=5432 Win=16468 Len=0
559432 179.635777 151.77.47.100 -> 41.177.98.176 TCP 64 51338 > http [ACK] Seq=4218 Ack=39550 Win=17520 Len=0
599602 190.141134 151.77.47.100 -> 41.177.98.176 TCP 64 51338 > http [FIN, ACK] Seq=4218 Ack=39550 Win=17520 Len=0
599604 190.141421 151.77.47.100 -> 41.177.98.176 TCP 64 51342 > http [FIN, ACK] Seq=924 Ack=5432 Win=16468 Len=0
599606 190.142276 151.77.47.100 -> 41.177.98.176 TCP 64 51341 > http [FIN, ACK] Seq=924 Ack=11795 Win=17520 Len=0
599608 190.142900 151.77.47.100 -> 41.177.98.176 TCP 64 51340 > http [FIN, ACK] Seq=924 Ack=2204 Win=17520 Len=0
599610 190.143086 151.77.47.100 -> 41.177.98.176 TCP 64 51339 > http [FIN, ACK] Seq=925 Ack=1536 Win=17520 Len=0
