31841  13.433357 151.41.242.13 -> 41.177.98.127 TCP 66 42586 > z39-50 [SYN] Seq=0 Win=49640 Len=0 MSS=1460 SACK_PERM=1
31997  13.518947 151.41.242.13 -> 41.177.98.127 TCP 64 42586 > z39-50 [ACK] Seq=1 Ack=1 Win=49640 Len=0
31998  13.519822 151.41.242.13 -> 41.177.98.127 TCP 110 42586 > z39-50 [PSH, ACK] Seq=1 Ack=1 Win=49640 Len=52
35727  14.898409 151.41.242.13 -> 41.177.98.127 TCP 64 42586 > z39-50 [ACK] Seq=53 Ack=77 Win=49564 Len=0
35734  14.900299 151.41.242.13 -> 41.177.98.127 TCP 136 42586 > z39-50 [PSH, ACK] Seq=53 Ack=77 Win=49564 Len=78
35957  15.023750 151.41.242.13 -> 41.177.98.127 TCP 64 42586 > z39-50 [ACK] Seq=131 Ack=100 Win=49564 Len=0
35958  15.023954 151.41.242.13 -> 41.177.98.127 TCP 64 42586 > z39-50 [FIN, ACK] Seq=131 Ack=100 Win=49564 Len=0
36162  15.082840 151.41.242.13 -> 41.177.98.127 TCP 64 42586 > z39-50 [ACK] Seq=132 Ack=101 Win=49564 Len=0
98802  36.820193 151.41.242.13 -> 41.177.98.127 TCP 66 42608 > z39-50 [SYN] Seq=0 Win=49640 Len=0 MSS=1460 SACK_PERM=1
100170  37.035984 151.41.242.13 -> 41.177.98.127 TCP 64 42608 > z39-50 [ACK] Seq=1 Ack=1 Win=49640 Len=0
100177  37.036517 151.41.242.13 -> 41.177.98.127 TCP 110 42608 > z39-50 [PSH, ACK] Seq=1 Ack=1 Win=49640 Len=52
107018  38.547066 151.41.242.13 -> 41.177.98.127 TCP 64 42608 > z39-50 [ACK] Seq=53 Ack=77 Win=49564 Len=0
107021  38.549243 151.41.242.13 -> 41.177.98.127 TCP 133 42608 > z39-50 [PSH, ACK] Seq=53 Ack=77 Win=49564 Len=75
107798  38.758265 151.41.242.13 -> 41.177.98.127 TCP 64 42608 > z39-50 [ACK] Seq=128 Ack=100 Win=49564 Len=0
107802  38.758497 151.41.242.13 -> 41.177.98.127 TCP 64 42608 > z39-50 [FIN, ACK] Seq=128 Ack=100 Win=49564 Len=0
108202  38.923265 151.41.242.13 -> 41.177.98.127 TCP 64 42608 > z39-50 [ACK] Seq=129 Ack=101 Win=49564 Len=0
