157655  53.698469 151.77.135.142 -> 244.3.160.239 TCP 66 15950 > http [SYN] Seq=0 Win=8192 Len=0 MSS=1460 SACK_PERM=1
157659  53.700456 151.77.135.142 -> 244.3.160.239 TCP 64 15950 > http [ACK] Seq=1 Ack=1 Win=17520 Len=0
158217  53.898634 151.77.135.142 -> 244.3.160.239 TCP 64 15950 > http [ACK] Seq=385 Ack=3206 Win=17520 Len=0
158241  53.903683 151.77.135.142 -> 244.3.160.239 TCP 64 15950 > http [ACK] Seq=385 Ack=7586 Win=17520 Len=0
158255  53.906505 151.77.135.142 -> 244.3.160.239 TCP 64 15950 > http [ACK] Seq=385 Ack=10506 Win=17520 Len=0
158274  53.908504 151.77.135.142 -> 244.3.160.239 TCP 64 15950 > http [ACK] Seq=385 Ack=12352 Win=17520 Len=0
158298  53.911813 151.77.135.142 -> 244.3.160.239 TCP 64 15950 > http [ACK] Seq=385 Ack=15112 Win=16220 Len=0
158315  53.920103 151.77.135.142 -> 244.3.160.239 TCP 64 15950 > http [ACK] Seq=385 Ack=17872 Win=13460 Len=0
158360  53.935795 151.77.135.142 -> 244.3.160.239 TCP 64 15950 > http [ACK] Seq=385 Ack=20792 Win=10540 Len=0
158364  53.936471 151.77.135.142 -> 244.3.160.239 TCP 64 15950 > http [ACK] Seq=385 Ack=23712 Win=7620 Len=0
158446  53.955761 151.77.135.142 -> 244.3.160.239 TCP 64 15950 > http [ACK] Seq=385 Ack=27532 Win=3800 Len=0
158484  53.970019 151.77.135.142 -> 244.3.160.239 TCP 64 15950 > http [ACK] Seq=385 Ack=30452 Win=880 Len=0
159519  54.289892 151.77.135.142 -> 244.3.160.239 TCP 64 [TCP Window Update] 15950 > http [ACK] Seq=385 Ack=30452 Win=17520 Len=0
159566  54.310119 151.77.135.142 -> 244.3.160.239 TCP 64 15950 > http [ACK] Seq=385 Ack=34512 Win=17520 Len=0
159579  54.316845 151.77.135.142 -> 244.3.160.239 TCP 64 15950 > http [ACK] Seq=385 Ack=37432 Win=17520 Len=0
159592  54.322775 151.77.135.142 -> 244.3.160.239 TCP 64 15950 > http [ACK] Seq=385 Ack=40352 Win=17520 Len=0
159595  54.323215 151.77.135.142 -> 244.3.160.239 TCP 64 15950 > http [ACK] Seq=385 Ack=42712 Win=17520 Len=0
159607  54.326718 151.77.135.142 -> 244.3.160.239 TCP 64 15950 > http [ACK] Seq=385 Ack=47092 Win=17520 Len=0
159620  54.337661 151.77.135.142 -> 244.3.160.239 TCP 64 15950 > http [ACK] Seq=385 Ack=51472 Win=17520 Len=0
159637  54.347780 151.77.135.142 -> 244.3.160.239 TCP 64 15950 > http [ACK] Seq=385 Ack=54392 Win=17520 Len=0
159644  54.352156 151.77.135.142 -> 244.3.160.239 TCP 64 15950 > http [ACK] Seq=385 Ack=57312 Win=17520 Len=0
159645  54.352348 151.77.135.142 -> 244.3.160.239 TCP 64 15950 > http [ACK] Seq=385 Ack=60232 Win=17520 Len=0
159654  54.358828 151.77.135.142 -> 244.3.160.239 TCP 64 15950 > http [ACK] Seq=385 Ack=63152 Win=17520 Len=0
159683  54.365656 151.77.135.142 -> 244.3.160.239 TCP 64 15950 > http [ACK] Seq=385 Ack=64936 Win=17520 Len=0
159771  54.417243 151.77.135.142 -> 244.3.160.239 TCP 64 15950 > http [ACK] Seq=385 Ack=67856 Win=17520 Len=0
159774  54.417952 151.77.135.142 -> 244.3.160.239 TCP 64 15950 > http [ACK] Seq=385 Ack=72236 Win=17520 Len=0
159778  54.420175 151.77.135.142 -> 244.3.160.239 TCP 64 15950 > http [ACK] Seq=385 Ack=76616 Win=17520 Len=0
159784  54.421290 151.77.135.142 -> 244.3.160.239 TCP 64 15950 > http [ACK] Seq=385 Ack=79536 Win=17520 Len=0
159798  54.424331 151.77.135.142 -> 244.3.160.239 TCP 64 15950 > http [ACK] Seq=385 Ack=81320 Win=17520 Len=0
159843  54.447168 151.77.135.142 -> 244.3.160.239 TCP 64 15950 > http [ACK] Seq=385 Ack=84240 Win=17520 Len=0
159853  54.453744 151.77.135.142 -> 244.3.160.239 TCP 64 15950 > http [ACK] Seq=385 Ack=87160 Win=17520 Len=0
159857  54.456185 151.77.135.142 -> 244.3.160.239 TCP 64 15950 > http [ACK] Seq=385 Ack=91540 Win=17520 Len=0
159861  54.456412 151.77.135.142 -> 244.3.160.239 TCP 64 15950 > http [ACK] Seq=385 Ack=94460 Win=17520 Len=0
159887  54.458475 151.77.135.142 -> 244.3.160.239 TCP 64 15950 > http [ACK] Seq=385 Ack=97380 Win=17520 Len=0
159893  54.459096 151.77.135.142 -> 244.3.160.239 TCP 64 15950 > http [ACK] Seq=385 Ack=100300 Win=17520 Len=0
159898  54.459517 151.77.135.142 -> 244.3.160.239 TCP 64 15950 > http [ACK] Seq=385 Ack=103220 Win=17520 Len=0
159906  54.460511 151.77.135.142 -> 244.3.160.239 TCP 64 15950 > http [ACK] Seq=385 Ack=107600 Win=17520 Len=0
159911  54.461858 151.77.135.142 -> 244.3.160.239 TCP 64 15950 > http [ACK] Seq=385 Ack=110520 Win=17520 Len=0
159916  54.463718 151.77.135.142 -> 244.3.160.239 TCP 64 15950 > http [ACK] Seq=385 Ack=113440 Win=17520 Len=0
159918  54.464063 151.77.135.142 -> 244.3.160.239 TCP 64 15950 > http [ACK] Seq=385 Ack=116360 Win=17520 Len=0
159923  54.466431 151.77.135.142 -> 244.3.160.239 TCP 64 15950 > http [ACK] Seq=385 Ack=120740 Win=17520 Len=0
159928  54.468139 151.77.135.142 -> 244.3.160.239 TCP 64 15950 > http [ACK] Seq=385 Ack=123660 Win=17520 Len=0
159933  54.470120 151.77.135.142 -> 244.3.160.239 TCP 64 15950 > http [ACK] Seq=385 Ack=126904 Win=17520 Len=0
159937  54.472338 151.77.135.142 -> 244.3.160.239 TCP 64 15950 > http [ACK] Seq=385 Ack=129824 Win=17520 Len=0
159940  54.473890 151.77.135.142 -> 244.3.160.239 TCP 64 15950 > http [ACK] Seq=385 Ack=134204 Win=17520 Len=0
159948  54.475887 151.77.135.142 -> 244.3.160.239 TCP 64 15950 > http [ACK] Seq=385 Ack=138584 Win=17520 Len=0
159971  54.478535 151.77.135.142 -> 244.3.160.239 TCP 64 15950 > http [ACK] Seq=385 Ack=141504 Win=17520 Len=0
160014  54.485765 151.77.135.142 -> 244.3.160.239 TCP 64 15950 > http [ACK] Seq=385 Ack=145884 Win=17520 Len=0
160018  54.486970 151.77.135.142 -> 244.3.160.239 TCP 64 15950 > http [ACK] Seq=385 Ack=148804 Win=17520 Len=0
160025  54.488424 151.77.135.142 -> 244.3.160.239 TCP 64 15950 > http [ACK] Seq=385 Ack=151724 Win=17520 Len=0
160032  54.489131 151.77.135.142 -> 244.3.160.239 TCP 64 15950 > http [ACK] Seq=385 Ack=154644 Win=17520 Len=0
160051  54.496471 151.77.135.142 -> 244.3.160.239 TCP 64 15950 > http [ACK] Seq=385 Ack=157888 Win=17520 Len=0
160059  54.496974 151.77.135.142 -> 244.3.160.239 TCP 64 15950 > http [ACK] Seq=385 Ack=162268 Win=17520 Len=0
160108  54.507952 151.77.135.142 -> 244.3.160.239 TCP 64 15950 > http [ACK] Seq=385 Ack=168102 Win=17520 Len=0
160113  54.508896 151.77.135.142 -> 244.3.160.239 TCP 64 15950 > http [ACK] Seq=385 Ack=171022 Win=17520 Len=0
160114  54.509196 151.77.135.142 -> 244.3.160.239 TCP 64 15950 > http [ACK] Seq=385 Ack=174842 Win=17520 Len=0
160130  54.510631 151.77.135.142 -> 244.3.160.239 TCP 64 15950 > http [ACK] Seq=385 Ack=177762 Win=17520 Len=0
160137  54.511666 151.77.135.142 -> 244.3.160.239 TCP 64 15950 > http [ACK] Seq=385 Ack=180682 Win=17520 Len=0
160143  54.515866 151.77.135.142 -> 244.3.160.239 TCP 64 15950 > http [ACK] Seq=385 Ack=184502 Win=17520 Len=0
160145  54.517224 151.77.135.142 -> 244.3.160.239 TCP 64 15950 > http [ACK] Seq=385 Ack=187422 Win=17520 Len=0
160149  54.518132 151.77.135.142 -> 244.3.160.239 TCP 64 15950 > http [ACK] Seq=385 Ack=191802 Win=17520 Len=0
160154  54.519902 151.77.135.142 -> 244.3.160.239 TCP 64 15950 > http [ACK] Seq=385 Ack=194162 Win=17520 Len=0
160172  54.521779 151.77.135.142 -> 244.3.160.239 TCP 64 15950 > http [ACK] Seq=385 Ack=196922 Win=17520 Len=0
160173  54.525559 151.77.135.142 -> 244.3.160.239 TCP 64 15950 > http [ACK] Seq=385 Ack=199842 Win=17520 Len=0
160174  54.525872 151.77.135.142 -> 244.3.160.239 TCP 64 15950 > http [ACK] Seq=385 Ack=202762 Win=17520 Len=0
160177  54.527709 151.77.135.142 -> 244.3.160.239 TCP 64 15950 > http [ACK] Seq=385 Ack=205682 Win=17520 Len=0
160200  54.536138 151.77.135.142 -> 244.3.160.239 TCP 64 15950 > http [ACK] Seq=385 Ack=208042 Win=17520 Len=0
160222  54.539596 151.77.135.142 -> 244.3.160.239 TCP 64 15950 > http [ACK] Seq=385 Ack=210802 Win=17520 Len=0
160224  54.540394 151.77.135.142 -> 244.3.160.239 TCP 64 15950 > http [ACK] Seq=385 Ack=213722 Win=17520 Len=0
160225  54.541702 151.77.135.142 -> 244.3.160.239 TCP 64 15950 > http [ACK] Seq=385 Ack=216642 Win=17520 Len=0
160226  54.542501 151.77.135.142 -> 244.3.160.239 TCP 64 15950 > http [ACK] Seq=385 Ack=219002 Win=17520 Len=0
160252  54.549567 151.77.135.142 -> 244.3.160.239 TCP 64 15950 > http [ACK] Seq=385 Ack=221762 Win=17520 Len=0
160286  54.566990 151.77.135.142 -> 244.3.160.239 TCP 64 15950 > http [ACK] Seq=385 Ack=226142 Win=17520 Len=0
160289  54.568180 151.77.135.142 -> 244.3.160.239 TCP 64 15950 > http [ACK] Seq=385 Ack=229062 Win=17520 Len=0
160293  54.569084 151.77.135.142 -> 244.3.160.239 TCP 64 15950 > http [ACK] Seq=385 Ack=232882 Win=17520 Len=0
160302  54.576017 151.77.135.142 -> 244.3.160.239 TCP 64 15950 > http [ACK] Seq=385 Ack=235642 Win=17520 Len=0
160303  54.576562 151.77.135.142 -> 244.3.160.239 TCP 64 15950 > http [ACK] Seq=385 Ack=238322 Win=17520 Len=0
160369  54.593707 151.77.135.142 -> 244.3.160.239 TCP 64 15950 > http [ACK] Seq=385 Ack=241242 Win=17520 Len=0
160377  54.595076 151.77.135.142 -> 244.3.160.239 TCP 64 15950 > http [ACK] Seq=385 Ack=244162 Win=17520 Len=0
160378  54.596818 151.77.135.142 -> 244.3.160.239 TCP 64 15950 > http [ACK] Seq=385 Ack=247982 Win=17520 Len=0
160383  54.600172 151.77.135.142 -> 244.3.160.239 TCP 64 15950 > http [ACK] Seq=385 Ack=250902 Win=17520 Len=0
160385  54.602333 151.77.135.142 -> 244.3.160.239 TCP 64 15950 > http [ACK] Seq=385 Ack=255282 Win=17520 Len=0
160386  54.603551 151.77.135.142 -> 244.3.160.239 TCP 64 15950 > http [ACK] Seq=385 Ack=257642 Win=17520 Len=0
160422  54.618832 151.77.135.142 -> 244.3.160.239 TCP 64 15950 > http [ACK] Seq=385 Ack=262022 Win=17520 Len=0
160426  54.620935 151.77.135.142 -> 244.3.160.239 TCP 64 15950 > http [ACK] Seq=385 Ack=266402 Win=17520 Len=0
160431  54.623140 151.77.135.142 -> 244.3.160.239 TCP 64 15950 > http [ACK] Seq=385 Ack=270782 Win=17520 Len=0
160432  54.623809 151.77.135.142 -> 244.3.160.239 TCP 64 15950 > http [ACK] Seq=385 Ack=273702 Win=17520 Len=0
160439  54.625568 151.77.135.142 -> 244.3.160.239 TCP 64 15950 > http [ACK] Seq=385 Ack=276962 Win=17520 Len=0
160484  54.647149 151.77.135.142 -> 244.3.160.239 TCP 64 15950 > http [ACK] Seq=385 Ack=279882 Win=17520 Len=0
160487  54.648378 151.77.135.142 -> 244.3.160.239 TCP 64 15950 > http [ACK] Seq=385 Ack=282802 Win=17520 Len=0
160489  54.649624 151.77.135.142 -> 244.3.160.239 TCP 64 15950 > http [ACK] Seq=385 Ack=285322 Win=17520 Len=0
160493  54.651391 151.77.135.142 -> 244.3.160.239 TCP 64 15950 > http [ACK] Seq=385 Ack=288242 Win=17520 Len=0
160496  54.652791 151.77.135.142 -> 244.3.160.239 TCP 64 15950 > http [ACK] Seq=385 Ack=291162 Win=17520 Len=0
160499  54.653477 151.77.135.142 -> 244.3.160.239 TCP 64 15950 > http [ACK] Seq=385 Ack=293522 Win=17520 Len=0
160501  54.656569 151.77.135.142 -> 244.3.160.239 TCP 64 15950 > http [ACK] Seq=385 Ack=296282 Win=17520 Len=0
160553  54.671082 151.77.135.142 -> 244.3.160.239 TCP 64 15950 > http [ACK] Seq=385 Ack=299202 Win=17520 Len=0
160556  54.672505 151.77.135.142 -> 244.3.160.239 TCP 64 15950 > http [ACK] Seq=385 Ack=303582 Win=17520 Len=0
160559  54.673939 151.77.135.142 -> 244.3.160.239 TCP 64 15950 > http [ACK] Seq=385 Ack=305942 Win=17520 Len=0
160561  54.675616 151.77.135.142 -> 244.3.160.239 TCP 64 15950 > http [ACK] Seq=385 Ack=308702 Win=17520 Len=0
160595  54.686250 151.77.135.142 -> 244.3.160.239 TCP 64 15950 > http [ACK] Seq=385 Ack=311622 Win=17520 Len=0
160599  54.688691 151.77.135.142 -> 244.3.160.239 TCP 64 15950 > http [ACK] Seq=385 Ack=314542 Win=17520 Len=0
160636  54.697521 151.77.135.142 -> 244.3.160.239 TCP 64 15950 > http [ACK] Seq=385 Ack=317062 Win=17520 Len=0
160649  54.698984 151.77.135.142 -> 244.3.160.239 TCP 64 15950 > http [ACK] Seq=385 Ack=321442 Win=17520 Len=0
160654  54.701242 151.77.135.142 -> 244.3.160.239 TCP 64 15950 > http [ACK] Seq=385 Ack=325262 Win=17520 Len=0
160685  54.711551 151.77.135.142 -> 244.3.160.239 TCP 64 15950 > http [ACK] Seq=385 Ack=328182 Win=17520 Len=0
160690  54.714327 151.77.135.142 -> 244.3.160.239 TCP 64 15950 > http [ACK] Seq=385 Ack=331102 Win=17520 Len=0
160694  54.714856 151.77.135.142 -> 244.3.160.239 TCP 64 15950 > http [ACK] Seq=385 Ack=333542 Win=17520 Len=0
160727  54.722928 151.77.135.142 -> 244.3.160.239 TCP 64 15950 > http [ACK] Seq=385 Ack=337922 Win=17520 Len=0
160728  54.724602 151.77.135.142 -> 244.3.160.239 TCP 64 15950 > http [ACK] Seq=385 Ack=342302 Win=17520 Len=0
160822  54.737851 151.77.135.142 -> 244.3.160.239 TCP 64 15950 > http [ACK] Seq=385 Ack=344582 Win=17520 Len=0
160843  54.741900 151.77.135.142 -> 244.3.160.239 TCP 64 15950 > http [ACK] Seq=385 Ack=348962 Win=17520 Len=0
160860  54.745546 151.77.135.142 -> 244.3.160.239 TCP 64 15950 > http [ACK] Seq=385 Ack=353342 Win=17520 Len=0
160865  54.748472 151.77.135.142 -> 244.3.160.239 TCP 64 15950 > http [ACK] Seq=385 Ack=355702 Win=17520 Len=0
160868  54.750208 151.77.135.142 -> 244.3.160.239 TCP 64 15950 > http [ACK] Seq=385 Ack=358382 Win=17520 Len=0
160903  54.764322 151.77.135.142 -> 244.3.160.239 TCP 64 15950 > http [ACK] Seq=385 Ack=361302 Win=17520 Len=0
160904  54.764535 151.77.135.142 -> 244.3.160.239 TCP 64 15950 > http [ACK] Seq=385 Ack=364222 Win=17520 Len=0
160905  54.766569 151.77.135.142 -> 244.3.160.239 TCP 64 15950 > http [ACK] Seq=385 Ack=368042 Win=17520 Len=0
160925  54.773846 151.77.135.142 -> 244.3.160.239 TCP 64 15950 > http [ACK] Seq=385 Ack=370962 Win=17520 Len=0
160928  54.775733 151.77.135.142 -> 244.3.160.239 TCP 64 15950 > http [ACK] Seq=385 Ack=375342 Win=17520 Len=0
160933  54.777780 151.77.135.142 -> 244.3.160.239 TCP 64 15950 > http [ACK] Seq=385 Ack=377702 Win=17520 Len=0
160935  54.778028 151.77.135.142 -> 244.3.160.239 TCP 64 15950 > http [ACK] Seq=385 Ack=380622 Win=17520 Len=0
160936  54.779569 151.77.135.142 -> 244.3.160.239 TCP 64 15950 > http [ACK] Seq=385 Ack=383222 Win=17520 Len=0
160960  54.789482 151.77.135.142 -> 244.3.160.239 TCP 64 15950 > http [ACK] Seq=385 Ack=386142 Win=17520 Len=0
160980  54.793289 151.77.135.142 -> 244.3.160.239 TCP 64 15950 > http [ACK] Seq=385 Ack=389062 Win=17520 Len=0
160983  54.794009 151.77.135.142 -> 244.3.160.239 TCP 64 15950 > http [ACK] Seq=385 Ack=391982 Win=17520 Len=0
161004  54.799626 151.77.135.142 -> 244.3.160.239 TCP 64 15950 > http [ACK] Seq=385 Ack=397262 Win=17520 Len=0
161011  54.801936 151.77.135.142 -> 244.3.160.239 TCP 64 15950 > http [ACK] Seq=385 Ack=401642 Win=17520 Len=0
161051  54.817207 151.77.135.142 -> 244.3.160.239 TCP 64 15950 > http [ACK] Seq=385 Ack=404002 Win=17520 Len=0
161095  54.823035 151.77.135.142 -> 244.3.160.239 TCP 64 15950 > http [ACK] Seq=385 Ack=408062 Win=17520 Len=0
161102  54.828507 151.77.135.142 -> 244.3.160.239 TCP 64 15950 > http [ACK] Seq=385 Ack=412442 Win=17520 Len=0
161118  54.835072 151.77.135.142 -> 244.3.160.239 TCP 64 15950 > http [ACK] Seq=385 Ack=416822 Win=17520 Len=0
161119  54.835549 151.77.135.142 -> 244.3.160.239 TCP 64 15950 > http [ACK] Seq=385 Ack=420482 Win=17520 Len=0
161140  54.842747 151.77.135.142 -> 244.3.160.239 TCP 64 15950 > http [ACK] Seq=385 Ack=423322 Win=17520 Len=0
161141  54.843434 151.77.135.142 -> 244.3.160.239 TCP 64 15950 > http [ACK] Seq=385 Ack=426242 Win=17520 Len=0
161142  54.844751 151.77.135.142 -> 244.3.160.239 TCP 64 15950 > http [ACK] Seq=385 Ack=430622 Win=17520 Len=0
161160  54.851336 151.77.135.142 -> 244.3.160.239 TCP 64 15950 > http [ACK] Seq=385 Ack=432982 Win=17520 Len=0
161162  54.851619 151.77.135.142 -> 244.3.160.239 TCP 64 15950 > http [ACK] Seq=385 Ack=435902 Win=17520 Len=0
161175  54.854789 151.77.135.142 -> 244.3.160.239 TCP 64 15950 > http [ACK] Seq=385 Ack=440282 Win=17520 Len=0
161202  54.867569 151.77.135.142 -> 244.3.160.239 TCP 64 15950 > http [ACK] Seq=385 Ack=445322 Win=17520 Len=0
161243  54.878803 151.77.135.142 -> 244.3.160.239 TCP 64 15950 > http [ACK] Seq=385 Ack=449702 Win=17520 Len=0
161244  54.880015 151.77.135.142 -> 244.3.160.239 TCP 64 15950 > http [ACK] Seq=385 Ack=454082 Win=17520 Len=0
161246  54.880446 151.77.135.142 -> 244.3.160.239 TCP 64 15950 > http [ACK] Seq=385 Ack=457742 Win=17520 Len=0
161294  54.896401 151.77.135.142 -> 244.3.160.239 TCP 64 15950 > http [ACK] Seq=385 Ack=460662 Win=17520 Len=0
161338  54.905771 151.77.135.142 -> 244.3.160.239 TCP 64 15950 > http [ACK] Seq=385 Ack=463582 Win=17520 Len=0
161341  54.906506 151.77.135.142 -> 244.3.160.239 TCP 64 15950 > http [ACK] Seq=385 Ack=466502 Win=17520 Len=0
161346  54.909014 151.77.135.142 -> 244.3.160.239 TCP 64 15950 > http [ACK] Seq=385 Ack=470162 Win=17520 Len=0
161347  54.910811 151.77.135.142 -> 244.3.160.239 TCP 64 15950 > http [ACK] Seq=385 Ack=474542 Win=17520 Len=0
161349  54.912661 151.77.135.142 -> 244.3.160.239 TCP 64 15950 > http [ACK] Seq=385 Ack=477462 Win=17520 Len=0
161410  54.942866 151.77.135.142 -> 244.3.160.239 TCP 64 15950 > http [ACK] Seq=385 Ack=479822 Win=17520 Len=0
161439  54.962225 151.77.135.142 -> 244.3.160.239 TCP 64 15950 > http [ACK] Seq=385 Ack=482742 Win=17520 Len=0
161442  54.964674 151.77.135.142 -> 244.3.160.239 TCP 64 15950 > http [ACK] Seq=385 Ack=487122 Win=17520 Len=0
161456  54.967845 151.77.135.142 -> 244.3.160.239 TCP 64 15950 > http [ACK] Seq=385 Ack=489482 Win=17520 Len=0
161507  54.979076 151.77.135.142 -> 244.3.160.239 TCP 64 15950 > http [ACK] Seq=385 Ack=493862 Win=17520 Len=0
161513  54.981012 151.77.135.142 -> 244.3.160.239 TCP 64 15950 > http [ACK] Seq=385 Ack=496782 Win=17520 Len=0
161517  54.982848 151.77.135.142 -> 244.3.160.239 TCP 64 15950 > http [ACK] Seq=385 Ack=500602 Win=17520 Len=0
161521  54.984073 151.77.135.142 -> 244.3.160.239 TCP 64 15950 > http [ACK] Seq=385 Ack=503522 Win=17520 Len=0
161529  54.985971 151.77.135.142 -> 244.3.160.239 TCP 64 15950 > http [ACK] Seq=385 Ack=506442 Win=17520 Len=0
161539  54.988714 151.77.135.142 -> 244.3.160.239 TCP 64 15950 > http [ACK] Seq=385 Ack=508882 Win=17520 Len=0
161542  54.990809 151.77.135.142 -> 244.3.160.239 TCP 64 15950 > http [ACK] Seq=385 Ack=513262 Win=17520 Len=0
161546  54.992513 151.77.135.142 -> 244.3.160.239 TCP 64 15950 > http [ACK] Seq=385 Ack=516182 Win=17520 Len=0
161556  54.994451 151.77.135.142 -> 244.3.160.239 TCP 64 15950 > http [ACK] Seq=385 Ack=520562 Win=17520 Len=0
161577  55.010722 151.77.135.142 -> 244.3.160.239 TCP 64 15950 > http [ACK] Seq=385 Ack=523482 Win=17520 Len=0
161579  55.011027 151.77.135.142 -> 244.3.160.239 TCP 64 15950 > http [ACK] Seq=385 Ack=526402 Win=17520 Len=0
161586  55.013464 151.77.135.142 -> 244.3.160.239 TCP 64 15950 > http [ACK] Seq=385 Ack=529322 Win=17520 Len=0
161590  55.015238 151.77.135.142 -> 244.3.160.239 TCP 64 15950 > http [ACK] Seq=385 Ack=532262 Win=17520 Len=0
161593  55.016901 151.77.135.142 -> 244.3.160.239 TCP 64 15950 > http [ACK] Seq=385 Ack=536642 Win=17520 Len=0
161656  55.045556 151.77.135.142 -> 244.3.160.239 TCP 64 15950 > http [ACK] Seq=385 Ack=539242 Win=17520 Len=0
161671  55.047989 151.77.135.142 -> 244.3.160.239 TCP 64 15950 > http [ACK] Seq=385 Ack=542162 Win=17520 Len=0
161676  55.050203 151.77.135.142 -> 244.3.160.239 TCP 64 15950 > http [ACK] Seq=385 Ack=546142 Win=17520 Len=0
161683  55.051120 151.77.135.142 -> 244.3.160.239 TCP 64 15950 > http [ACK] Seq=385 Ack=549062 Win=17520 Len=0
161686  55.052698 151.77.135.142 -> 244.3.160.239 TCP 64 15950 > http [ACK] Seq=385 Ack=553442 Win=17520 Len=0
161767  55.080991 151.77.135.142 -> 244.3.160.239 TCP 64 15950 > http [ACK] Seq=385 Ack=558562 Win=17520 Len=0
161774  55.081760 151.77.135.142 -> 244.3.160.239 TCP 64 15950 > http [ACK] Seq=385 Ack=561482 Win=17520 Len=0
161782  55.083496 151.77.135.142 -> 244.3.160.239 TCP 64 15950 > http [ACK] Seq=385 Ack=565862 Win=17520 Len=0
161788  55.084609 151.77.135.142 -> 244.3.160.239 TCP 64 15950 > http [ACK] Seq=385 Ack=568222 Win=17520 Len=0
161855  55.093822 151.77.135.142 -> 244.3.160.239 TCP 64 15950 > http [ACK] Seq=385 Ack=571142 Win=17520 Len=0
161866  55.096129 151.77.135.142 -> 244.3.160.239 TCP 64 15950 > http [ACK] Seq=385 Ack=575522 Win=17520 Len=0
161872  55.096828 151.77.135.142 -> 244.3.160.239 TCP 64 15950 > http [ACK] Seq=385 Ack=578442 Win=17520 Len=0
161894  55.099588 151.77.135.142 -> 244.3.160.239 TCP 64 15950 > http [ACK] Seq=385 Ack=581942 Win=17520 Len=0
161913  55.102113 151.77.135.142 -> 244.3.160.239 TCP 64 15950 > http [ACK] Seq=385 Ack=584862 Win=17520 Len=0
161972  55.116627 151.77.135.142 -> 244.3.160.239 TCP 64 15950 > http [ACK] Seq=385 Ack=587782 Win=17520 Len=0
161980  55.117599 151.77.135.142 -> 244.3.160.239 TCP 64 15950 > http [ACK] Seq=385 Ack=590702 Win=17520 Len=0
162000  55.121310 151.77.135.142 -> 244.3.160.239 TCP 64 15950 > http [ACK] Seq=385 Ack=593622 Win=17520 Len=0
162003  55.121834 151.77.135.142 -> 244.3.160.239 TCP 64 15950 > http [ACK] Seq=385 Ack=596542 Win=17520 Len=0
162015  55.124909 151.77.135.142 -> 244.3.160.239 TCP 64 15950 > http [ACK] Seq=385 Ack=600922 Win=17520 Len=0
162073  55.142289 151.77.135.142 -> 244.3.160.239 TCP 64 15950 > http [ACK] Seq=385 Ack=603842 Win=17520 Len=0
162113  55.159895 151.77.135.142 -> 244.3.160.239 TCP 64 15950 > http [ACK] Seq=385 Ack=606762 Win=17520 Len=0
162116  55.162154 151.77.135.142 -> 244.3.160.239 TCP 64 15950 > http [ACK] Seq=385 Ack=609682 Win=17520 Len=0
162120  55.165367 151.77.135.142 -> 244.3.160.239 TCP 64 15950 > http [ACK] Seq=385 Ack=612602 Win=17520 Len=0
162122  55.165670 151.77.135.142 -> 244.3.160.239 TCP 64 15950 > http [ACK] Seq=385 Ack=615522 Win=17520 Len=0
162129  55.168574 151.77.135.142 -> 244.3.160.239 TCP 64 15950 > http [ACK] Seq=385 Ack=618442 Win=17520 Len=0
162132  55.169203 151.77.135.142 -> 244.3.160.239 TCP 64 15950 > http [ACK] Seq=385 Ack=621362 Win=17520 Len=0
162149  55.175730 151.77.135.142 -> 244.3.160.239 TCP 64 15950 > http [ACK] Seq=385 Ack=624282 Win=17520 Len=0
162157  55.181175 151.77.135.142 -> 244.3.160.239 TCP 64 15950 > http [ACK] Seq=385 Ack=627202 Win=17520 Len=0
162187  55.189027 151.77.135.142 -> 244.3.160.239 TCP 64 15950 > http [ACK] Seq=385 Ack=630122 Win=17520 Len=0
162197  55.190681 151.77.135.142 -> 244.3.160.239 TCP 64 15950 > http [ACK] Seq=385 Ack=634502 Win=17520 Len=0
162210  55.192571 151.77.135.142 -> 244.3.160.239 TCP 64 15950 > http [ACK] Seq=385 Ack=638882 Win=17520 Len=0
162232  55.193589 151.77.135.142 -> 244.3.160.239 TCP 64 15950 > http [ACK] Seq=385 Ack=641802 Win=17520 Len=0
162251  55.197460 151.77.135.142 -> 244.3.160.239 TCP 64 15950 > http [ACK] Seq=385 Ack=644722 Win=17520 Len=0
162252  55.197568 151.77.135.142 -> 244.3.160.239 TCP 64 15950 > http [ACK] Seq=385 Ack=647642 Win=17520 Len=0
162272  55.201111 151.77.135.142 -> 244.3.160.239 TCP 64 15950 > http [ACK] Seq=385 Ack=650886 Win=17520 Len=0
162278  55.206109 151.77.135.142 -> 244.3.160.239 TCP 64 15950 > http [ACK] Seq=385 Ack=655266 Win=17520 Len=0
162283  55.208494 151.77.135.142 -> 244.3.160.239 TCP 64 15950 > http [ACK] Seq=385 Ack=658186 Win=17520 Len=0
162289  55.210103 151.77.135.142 -> 244.3.160.239 TCP 64 15950 > http [ACK] Seq=385 Ack=661106 Win=17520 Len=0
162309  55.219472 151.77.135.142 -> 244.3.160.239 TCP 64 15950 > http [ACK] Seq=385 Ack=664026 Win=17520 Len=0
162328  55.227219 151.77.135.142 -> 244.3.160.239 TCP 64 15950 > http [ACK] Seq=385 Ack=666946 Win=17520 Len=0
162338  55.228935 151.77.135.142 -> 244.3.160.239 TCP 64 15950 > http [ACK] Seq=385 Ack=669866 Win=17520 Len=0
162341  55.229579 151.77.135.142 -> 244.3.160.239 TCP 64 15950 > http [ACK] Seq=385 Ack=674246 Win=17520 Len=0
162363  55.238582 151.77.135.142 -> 244.3.160.239 TCP 64 15950 > http [ACK] Seq=385 Ack=677166 Win=17520 Len=0
162399  55.244248 151.77.135.142 -> 244.3.160.239 TCP 64 15950 > http [ACK] Seq=385 Ack=678950 Win=17520 Len=0
162401  55.245006 151.77.135.142 -> 244.3.160.239 TCP 64 15950 > http [ACK] Seq=385 Ack=681302 Win=17520 Len=0
162408  55.248069 151.77.135.142 -> 244.3.160.239 TCP 64 15950 > http [ACK] Seq=385 Ack=685682 Win=17520 Len=0
162433  55.250051 151.77.135.142 -> 244.3.160.239 TCP 64 15950 > http [ACK] Seq=385 Ack=690062 Win=17520 Len=0
162447  55.251805 151.77.135.142 -> 244.3.160.239 TCP 64 15950 > http [ACK] Seq=385 Ack=692342 Win=15240 Len=0
162489  55.259702 151.77.135.142 -> 244.3.160.239 TCP 64 15950 > http [ACK] Seq=385 Ack=696722 Win=10860 Len=0
162561  55.267453 151.77.135.142 -> 244.3.160.239 TCP 64 15950 > http [ACK] Seq=385 Ack=702562 Win=5020 Len=0
162574  55.268338 151.77.135.142 -> 244.3.160.239 TCP 64 15950 > http [ACK] Seq=385 Ack=705482 Win=2100 Len=0
162970  55.331236 151.77.135.142 -> 244.3.160.239 TCP 64 15950 > http [ACK] Seq=385 Ack=706142 Win=17520 Len=0
162978  55.332047 151.77.135.142 -> 244.3.160.239 TCP 66 5712 > http [SYN] Seq=0 Win=8192 Len=0 MSS=1460 SACK_PERM=1
162994  55.334843 151.77.135.142 -> 244.3.160.239 TCP 64 15950 > http [RST, ACK] Seq=385 Ack=706142 Win=0 Len=0
163102  55.353894 151.77.135.142 -> 244.3.160.239 TCP 64 5712 > http [ACK] Seq=1 Ack=1 Win=17520 Len=0
163498  55.446649 151.77.135.142 -> 244.3.160.239 TCP 64 5712 > http [ACK] Seq=427 Ack=2692 Win=17520 Len=0
163507  55.449627 151.77.135.142 -> 244.3.160.239 TCP 64 5712 > http [ACK] Seq=427 Ack=5452 Win=17520 Len=0
163540  55.461697 151.77.135.142 -> 244.3.160.239 TCP 64 5712 > http [ACK] Seq=427 Ack=8212 Win=17520 Len=0
163595  55.472719 151.77.135.142 -> 244.3.160.239 TCP 64 5712 > http [ACK] Seq=427 Ack=10972 Win=17520 Len=0
163645  55.486670 151.77.135.142 -> 244.3.160.239 TCP 64 5712 > http [ACK] Seq=427 Ack=15112 Win=17520 Len=0
163729  55.497957 151.77.135.142 -> 244.3.160.239 TCP 64 5712 > http [ACK] Seq=427 Ack=19332 Win=17520 Len=0
163774  55.514596 151.77.135.142 -> 244.3.160.239 TCP 64 5712 > http [ACK] Seq=427 Ack=22092 Win=17520 Len=0
163806  55.533051 151.77.135.142 -> 244.3.160.239 TCP 64 5712 > http [ACK] Seq=427 Ack=24852 Win=17520 Len=0
163816  55.535096 151.77.135.142 -> 244.3.160.239 TCP 64 5712 > http [ACK] Seq=427 Ack=27532 Win=17520 Len=0
163824  55.537797 151.77.135.142 -> 244.3.160.239 TCP 64 5712 > http [ACK] Seq=427 Ack=30292 Win=17520 Len=0
163830  55.538863 151.77.135.142 -> 244.3.160.239 TCP 64 5712 > http [ACK] Seq=427 Ack=33052 Win=17520 Len=0
163838  55.539536 151.77.135.142 -> 244.3.160.239 TCP 64 5712 > http [ACK] Seq=427 Ack=35812 Win=17520 Len=0
163882  55.554370 151.77.135.142 -> 244.3.160.239 TCP 64 5712 > http [ACK] Seq=427 Ack=40032 Win=17520 Len=0
163886  55.555775 151.77.135.142 -> 244.3.160.239 TCP 64 5712 > http [ACK] Seq=427 Ack=42792 Win=17520 Len=0
163888  55.556561 151.77.135.142 -> 244.3.160.239 TCP 64 5712 > http [ACK] Seq=427 Ack=45552 Win=17520 Len=0
163921  55.559588 151.77.135.142 -> 244.3.160.239 TCP 64 5712 > http [ACK] Seq=427 Ack=49612 Win=17520 Len=0
163930  55.562153 151.77.135.142 -> 244.3.160.239 TCP 64 5712 > http [ACK] Seq=427 Ack=52372 Win=17520 Len=0
163940  55.569295 151.77.135.142 -> 244.3.160.239 TCP 64 5712 > http [ACK] Seq=427 Ack=55212 Win=17520 Len=0
163991  55.580519 151.77.135.142 -> 244.3.160.239 TCP 64 5712 > http [ACK] Seq=427 Ack=57972 Win=17520 Len=0
163998  55.584644 151.77.135.142 -> 244.3.160.239 TCP 64 5712 > http [ACK] Seq=427 Ack=62032 Win=17520 Len=0
164000  55.585013 151.77.135.142 -> 244.3.160.239 TCP 64 5712 > http [ACK] Seq=427 Ack=64792 Win=17520 Len=0
164007  55.587308 151.77.135.142 -> 244.3.160.239 TCP 64 5712 > http [ACK] Seq=427 Ack=69012 Win=17520 Len=0
164008  55.587836 151.77.135.142 -> 244.3.160.239 TCP 64 5712 > http [ACK] Seq=427 Ack=71772 Win=17520 Len=0
164018  55.590968 151.77.135.142 -> 244.3.160.239 TCP 64 5712 > http [ACK] Seq=427 Ack=75832 Win=17520 Len=0
164021  55.592556 151.77.135.142 -> 244.3.160.239 TCP 64 5712 > http [ACK] Seq=427 Ack=78592 Win=32120 Len=0
164091  55.599835 151.77.135.142 -> 244.3.160.239 TCP 64 5712 > http [ACK] Seq=427 Ack=81352 Win=33580 Len=0
164096  55.601911 151.77.135.142 -> 244.3.160.239 TCP 64 5712 > http [ACK] Seq=427 Ack=85492 Win=33580 Len=0
164104  55.604677 151.77.135.142 -> 244.3.160.239 TCP 64 5712 > http [ACK] Seq=427 Ack=89712 Win=29360 Len=0
164107  55.605125 151.77.135.142 -> 244.3.160.239 TCP 64 5712 > http [ACK] Seq=427 Ack=92472 Win=26600 Len=0
164112  55.607030 151.77.135.142 -> 244.3.160.239 TCP 64 5712 > http [ACK] Seq=427 Ack=96612 Win=22460 Len=0
164138  55.613766 151.77.135.142 -> 244.3.160.239 TCP 64 5712 > http [ACK] Seq=427 Ack=99372 Win=21900 Len=0
164176  55.625656 151.77.135.142 -> 244.3.160.239 TCP 64 5712 > http [ACK] Seq=427 Ack=102132 Win=23360 Len=0
164179  55.627009 151.77.135.142 -> 244.3.160.239 TCP 64 5712 > http [ACK] Seq=427 Ack=106192 Win=23360 Len=0
164181  55.629296 151.77.135.142 -> 244.3.160.239 TCP 64 5712 > http [ACK] Seq=427 Ack=110412 Win=21900 Len=0
164182  55.630095 151.77.135.142 -> 244.3.160.239 TCP 64 5712 > http [ACK] Seq=427 Ack=113172 Win=21900 Len=0
164183  55.632094 151.77.135.142 -> 244.3.160.239 TCP 64 5712 > http [ACK] Seq=427 Ack=115932 Win=21900 Len=0
164184  55.633547 151.77.135.142 -> 244.3.160.239 TCP 64 5712 > http [ACK] Seq=427 Ack=119992 Win=35040 Len=0
164318  55.665202 151.77.135.142 -> 244.3.160.239 TCP 64 5712 > http [ACK] Seq=427 Ack=124212 Win=35040 Len=0
164322  55.668151 151.77.135.142 -> 244.3.160.239 TCP 64 5712 > http [ACK] Seq=427 Ack=127132 Win=35040 Len=0
164327  55.669499 151.77.135.142 -> 244.3.160.239 TCP 64 5712 > http [ACK] Seq=427 Ack=131512 Win=35040 Len=0
164328  55.669838 151.77.135.142 -> 244.3.160.239 TCP 64 5712 > http [ACK] Seq=427 Ack=134432 Win=39420 Len=0
164340  55.673656 151.77.135.142 -> 244.3.160.239 TCP 64 5712 > http [ACK] Seq=427 Ack=138812 Win=39420 Len=0
164344  55.674551 151.77.135.142 -> 244.3.160.239 TCP 64 5712 > http [ACK] Seq=427 Ack=140596 Win=39420 Len=0
164449  55.682967 151.77.135.142 -> 244.3.160.239 TCP 64 5712 > http [ACK] Seq=427 Ack=144912 Win=42340 Len=0
164452  55.685554 151.77.135.142 -> 244.3.160.239 TCP 64 5712 > http [ACK] Seq=427 Ack=147672 Win=42340 Len=0
164453  55.686526 151.77.135.142 -> 244.3.160.239 TCP 64 5712 > http [ACK] Seq=427 Ack=150592 Win=42340 Len=0
164467  55.689002 151.77.135.142 -> 244.3.160.239 TCP 64 5712 > http [ACK] Seq=427 Ack=153512 Win=43800 Len=0
164472  55.692806 151.77.135.142 -> 244.3.160.239 TCP 64 5712 > http [ACK] Seq=427 Ack=156432 Win=43800 Len=0
164473  55.694166 151.77.135.142 -> 244.3.160.239 TCP 64 5712 > http [ACK] Seq=427 Ack=160812 Win=45260 Len=0
164474  55.695416 151.77.135.142 -> 244.3.160.239 TCP 64 5712 > http [ACK] Seq=427 Ack=162596 Win=45260 Len=0
164483  55.696764 151.77.135.142 -> 244.3.160.239 TCP 64 5712 > http [ACK] Seq=427 Ack=165516 Win=45260 Len=0
164569  55.721259 151.77.135.142 -> 244.3.160.239 TCP 64 5712 > http [ACK] Seq=427 Ack=166992 Win=45260 Len=0
164592  55.726237 151.77.135.142 -> 244.3.160.239 TCP 64 5712 > http [ACK] Seq=427 Ack=169672 Win=45260 Len=0
164639  55.731878 151.77.135.142 -> 244.3.160.239 TCP 64 5712 > http [ACK] Seq=427 Ack=173892 Win=43800 Len=0
164641  55.733866 151.77.135.142 -> 244.3.160.239 TCP 64 5712 > http [ACK] Seq=427 Ack=177952 Win=43800 Len=0
164645  55.736444 151.77.135.142 -> 244.3.160.239 TCP 64 5712 > http [ACK] Seq=427 Ack=180712 Win=43800 Len=0
164649  55.737783 151.77.135.142 -> 244.3.160.239 TCP 64 5712 > http [ACK] Seq=427 Ack=183472 Win=43800 Len=0
164650  55.739037 151.77.135.142 -> 244.3.160.239 TCP 64 5712 > http [ACK] Seq=427 Ack=186232 Win=43800 Len=0
164651  55.740541 151.77.135.142 -> 244.3.160.239 TCP 64 5712 > http [ACK] Seq=427 Ack=188992 Win=43800 Len=0
164654  55.741752 151.77.135.142 -> 244.3.160.239 TCP 64 5712 > http [ACK] Seq=427 Ack=191752 Win=43800 Len=0
164656  55.743631 151.77.135.142 -> 244.3.160.239 TCP 64 5712 > http [ACK] Seq=427 Ack=195972 Win=43800 Len=0
164662  55.745517 151.77.135.142 -> 244.3.160.239 TCP 64 5712 > http [ACK] Seq=427 Ack=198732 Win=45260 Len=0
164665  55.746746 151.77.135.142 -> 244.3.160.239 TCP 64 5712 > http [ACK] Seq=427 Ack=201492 Win=45260 Len=0
164685  55.750816 151.77.135.142 -> 244.3.160.239 TCP 64 5712 > http [ACK] Seq=427 Ack=204252 Win=45260 Len=0
164698  55.753045 151.77.135.142 -> 244.3.160.239 TCP 64 5712 > http [ACK] Seq=427 Ack=208392 Win=46720 Len=0
164717  55.755556 151.77.135.142 -> 244.3.160.239 TCP 64 5712 > http [ACK] Seq=427 Ack=212452 Win=46720 Len=0
164736  55.756307 151.77.135.142 -> 244.3.160.239 TCP 64 5712 > http [ACK] Seq=427 Ack=215212 Win=46720 Len=0
164752  55.758305 151.77.135.142 -> 244.3.160.239 TCP 64 5712 > http [ACK] Seq=427 Ack=217972 Win=48180 Len=0
164753  55.758920 151.77.135.142 -> 244.3.160.239 TCP 64 5712 > http [ACK] Seq=427 Ack=220732 Win=48180 Len=0
164755  55.760921 151.77.135.142 -> 244.3.160.239 TCP 64 5712 > http [ACK] Seq=427 Ack=223492 Win=48180 Len=0
164762  55.766849 151.77.135.142 -> 244.3.160.239 TCP 64 5712 > http [ACK] Seq=427 Ack=226252 Win=49640 Len=0
164763  55.768039 151.77.135.142 -> 244.3.160.239 TCP 64 5712 > http [ACK] Seq=427 Ack=229012 Win=49640 Len=0
164765  55.769654 151.77.135.142 -> 244.3.160.239 TCP 64 5712 > http [ACK] Seq=427 Ack=233232 Win=49640 Len=0
164766  55.772732 151.77.135.142 -> 244.3.160.239 TCP 64 5712 > http [ACK] Seq=427 Ack=235992 Win=49640 Len=0
164785  55.777319 151.77.135.142 -> 244.3.160.239 TCP 64 5712 > http [ACK] Seq=427 Ack=240052 Win=49640 Len=0
164786  55.777795 151.77.135.142 -> 244.3.160.239 TCP 64 5712 > http [ACK] Seq=427 Ack=242812 Win=49640 Len=0
164834  55.783940 151.77.135.142 -> 244.3.160.239 TCP 64 5712 > http [ACK] Seq=427 Ack=245652 Win=46800 Len=0
164840  55.784847 151.77.135.142 -> 244.3.160.239 TCP 64 5712 > http [ACK] Seq=427 Ack=249712 Win=48180 Len=0
164842  55.786960 151.77.135.142 -> 244.3.160.239 TCP 64 5712 > http [ACK] Seq=427 Ack=252472 Win=48180 Len=0
164845  55.788859 151.77.135.142 -> 244.3.160.239 TCP 64 5712 > http [ACK] Seq=427 Ack=256692 Win=48180 Len=0
164857  55.791019 151.77.135.142 -> 244.3.160.239 TCP 64 5712 > http [ACK] Seq=427 Ack=260752 Win=48180 Len=0
164895  55.792554 151.77.135.142 -> 244.3.160.239 TCP 64 5712 > http [ACK] Seq=427 Ack=263512 Win=48180 Len=0
165115  55.824344 151.77.135.142 -> 244.3.160.239 TCP 64 5712 > http [ACK] Seq=427 Ack=266432 Win=48180 Len=0
165116  55.824792 151.77.135.142 -> 244.3.160.239 TCP 64 5712 > http [ACK] Seq=427 Ack=269352 Win=48180 Len=0
165136  55.828775 151.77.135.142 -> 244.3.160.239 TCP 64 5712 > http [ACK] Seq=427 Ack=272272 Win=48180 Len=0
165165  55.831900 151.77.135.142 -> 244.3.160.239 TCP 64 5712 > http [ACK] Seq=427 Ack=275192 Win=49640 Len=0
165172  55.832826 151.77.135.142 -> 244.3.160.239 TCP 64 5712 > http [ACK] Seq=427 Ack=278112 Win=49640 Len=0
165184  55.833612 151.77.135.142 -> 244.3.160.239 TCP 64 5712 > http [ACK] Seq=427 Ack=279896 Win=49640 Len=0
165191  55.834639 151.77.135.142 -> 244.3.160.239 TCP 64 5712 > http [ACK] Seq=427 Ack=284276 Win=49640 Len=0
165210  55.837964 151.77.135.142 -> 244.3.160.239 TCP 64 5712 > http [ACK] Seq=427 Ack=288432 Win=51100 Len=0
165274  55.842471 151.77.135.142 -> 244.3.160.239 TCP 64 5712 > http [ACK] Seq=427 Ack=292492 Win=51100 Len=0
165302  55.844404 151.77.135.142 -> 244.3.160.239 TCP 64 5712 > http [ACK] Seq=427 Ack=295252 Win=51100 Len=0
165307  55.845895 151.77.135.142 -> 244.3.160.239 TCP 64 5712 > http [ACK] Seq=427 Ack=298012 Win=51100 Len=0
165317  55.847555 151.77.135.142 -> 244.3.160.239 TCP 64 5712 > http [ACK] Seq=427 Ack=300772 Win=51100 Len=0
165326  55.848490 151.77.135.142 -> 244.3.160.239 TCP 64 5712 > http [ACK] Seq=427 Ack=303532 Win=52560 Len=0
165345  55.850561 151.77.135.142 -> 244.3.160.239 TCP 64 5712 > http [ACK] Seq=427 Ack=306292 Win=52560 Len=0
165355  55.851247 151.77.135.142 -> 244.3.160.239 TCP 64 5712 > http [ACK] Seq=427 Ack=309052 Win=52560 Len=0
165375  55.854093 151.77.135.142 -> 244.3.160.239 TCP 64 5712 > http [ACK] Seq=427 Ack=313272 Win=52560 Len=0
165469  55.868253 151.77.135.142 -> 244.3.160.239 TCP 64 5712 > http [ACK] Seq=427 Ack=317332 Win=51100 Len=0
165474  55.869651 151.77.135.142 -> 244.3.160.239 TCP 64 5712 > http [ACK] Seq=427 Ack=320172 Win=51100 Len=0
165475  55.869788 151.77.135.142 -> 244.3.160.239 TCP 64 5712 > http [ACK] Seq=427 Ack=322932 Win=51100 Len=0
165485  55.872942 151.77.135.142 -> 244.3.160.239 TCP 64 5712 > http [ACK] Seq=427 Ack=325692 Win=51100 Len=0
165486  55.873241 151.77.135.142 -> 244.3.160.239 TCP 64 5712 > http [ACK] Seq=427 Ack=328452 Win=51100 Len=0
165518  55.876265 151.77.135.142 -> 244.3.160.239 TCP 64 5712 > http [ACK] Seq=427 Ack=332512 Win=51100 Len=0
165530  55.878914 151.77.135.142 -> 244.3.160.239 TCP 64 5712 > http [ACK] Seq=427 Ack=335272 Win=51100 Len=0
165534  55.879357 151.77.135.142 -> 244.3.160.239 TCP 64 5712 > http [ACK] Seq=427 Ack=338032 Win=52560 Len=0
165666  55.893871 151.77.135.142 -> 244.3.160.239 TCP 64 5712 > http [ACK] Seq=427 Ack=342252 Win=52560 Len=0
165669  55.895603 151.77.135.142 -> 244.3.160.239 TCP 64 5712 > http [ACK] Seq=427 Ack=345012 Win=52560 Len=0
165672  55.895814 151.77.135.142 -> 244.3.160.239 TCP 64 5712 > http [ACK] Seq=427 Ack=347772 Win=52560 Len=0
165683  55.899153 151.77.135.142 -> 244.3.160.239 TCP 64 5712 > http [ACK] Seq=427 Ack=351832 Win=52560 Len=0
165695  55.901024 151.77.135.142 -> 244.3.160.239 TCP 64 5712 > http [ACK] Seq=427 Ack=355972 Win=52560 Len=0
165717  55.903150 151.77.135.142 -> 244.3.160.239 TCP 64 5712 > http [ACK] Seq=427 Ack=360192 Win=52560 Len=0
165837  55.919695 151.77.135.142 -> 244.3.160.239 TCP 64 5712 > http [ACK] Seq=427 Ack=364252 Win=52560 Len=0
165838  55.920140 151.77.135.142 -> 244.3.160.239 TCP 64 5712 > http [ACK] Seq=427 Ack=367012 Win=49800 Len=0
165839  55.921606 151.77.135.142 -> 244.3.160.239 TCP 64 5712 > http [ACK] Seq=427 Ack=369772 Win=51100 Len=0
165863  55.929609 151.77.135.142 -> 244.3.160.239 TCP 64 5712 > http [ACK] Seq=427 Ack=372532 Win=48340 Len=0
165870  55.932988 151.77.135.142 -> 244.3.160.239 TCP 64 5712 > http [ACK] Seq=427 Ack=376752 Win=49640 Len=0
165881  55.934605 151.77.135.142 -> 244.3.160.239 TCP 64 5712 > http [ACK] Seq=427 Ack=380812 Win=49640 Len=0
165907  55.937743 151.77.135.142 -> 244.3.160.239 TCP 64 5712 > http [ACK] Seq=427 Ack=383572 Win=46880 Len=0
165910  55.938216 151.77.135.142 -> 244.3.160.239 TCP 64 5712 > http [ACK] Seq=427 Ack=386332 Win=48180 Len=0
166003  55.945738 151.77.135.142 -> 244.3.160.239 TCP 64 5712 > http [ACK] Seq=427 Ack=389092 Win=48180 Len=0
166010  55.948130 151.77.135.142 -> 244.3.160.239 TCP 64 5712 > http [ACK] Seq=427 Ack=392012 Win=48180 Len=0
166011  55.949306 151.77.135.142 -> 244.3.160.239 TCP 64 5712 > http [ACK] Seq=427 Ack=394932 Win=48180 Len=0
166013  55.949614 151.77.135.142 -> 244.3.160.239 TCP 64 5712 > http [ACK] Seq=427 Ack=397852 Win=48180 Len=0
166032  55.952944 151.77.135.142 -> 244.3.160.239 TCP 64 5712 > http [ACK] Seq=427 Ack=401512 Win=48180 Len=0
166047  55.954656 151.77.135.142 -> 244.3.160.239 TCP 64 5712 > http [ACK] Seq=427 Ack=405732 Win=48180 Len=0
166051  55.956025 151.77.135.142 -> 244.3.160.239 TCP 64 5712 > http [ACK] Seq=427 Ack=408492 Win=48180 Len=0
166112  55.965785 151.77.135.142 -> 244.3.160.239 TCP 64 5712 > http [ACK] Seq=427 Ack=411172 Win=48180 Len=0
166184  55.971325 151.77.135.142 -> 244.3.160.239 TCP 64 5712 > http [ACK] Seq=427 Ack=413932 Win=48180 Len=0
166192  55.973358 151.77.135.142 -> 244.3.160.239 TCP 64 5712 > http [ACK] Seq=427 Ack=416852 Win=48180 Len=0
166194  55.973729 151.77.135.142 -> 244.3.160.239 TCP 64 5712 > http [ACK] Seq=427 Ack=419452 Win=45580 Len=0
166244  55.985788 151.77.135.142 -> 244.3.160.239 TCP 64 5712 > http [ACK] Seq=427 Ack=422212 Win=46720 Len=0
166247  55.987504 151.77.135.142 -> 244.3.160.239 TCP 64 5712 > http [ACK] Seq=427 Ack=424972 Win=46720 Len=0
166265  55.988916 151.77.135.142 -> 244.3.160.239 TCP 64 5712 > http [ACK] Seq=427 Ack=427732 Win=46720 Len=0
166268  55.989945 151.77.135.142 -> 244.3.160.239 TCP 64 5712 > http [ACK] Seq=427 Ack=430492 Win=46720 Len=0
166276  55.991780 151.77.135.142 -> 244.3.160.239 TCP 64 5712 > http [ACK] Seq=427 Ack=434712 Win=48180 Len=0
166354  55.996401 151.77.135.142 -> 244.3.160.239 TCP 64 5712 > http [ACK] Seq=427 Ack=437472 Win=48180 Len=0
166359  55.997258 151.77.135.142 -> 244.3.160.239 TCP 64 5712 > http [ACK] Seq=427 Ack=440232 Win=48180 Len=0
166364  55.998762 151.77.135.142 -> 244.3.160.239 TCP 64 5712 > http [ACK] Seq=427 Ack=443152 Win=49640 Len=0
166444  56.012802 151.77.135.142 -> 244.3.160.239 TCP 64 5712 > http [ACK] Seq=427 Ack=445752 Win=49640 Len=0
166458  56.013997 151.77.135.142 -> 244.3.160.239 TCP 64 5712 > http [ACK] Seq=427 Ack=448512 Win=49640 Len=0
166482  56.016857 151.77.135.142 -> 244.3.160.239 TCP 64 5712 > http [ACK] Seq=427 Ack=451272 Win=46880 Len=0
166484  56.017169 151.77.135.142 -> 244.3.160.239 TCP 64 5712 > http [ACK] Seq=427 Ack=454032 Win=48180 Len=0
166500  56.019020 151.77.135.142 -> 244.3.160.239 TCP 64 5712 > http [ACK] Seq=427 Ack=456792 Win=48180 Len=0
166543  56.021002 151.77.135.142 -> 244.3.160.239 TCP 64 5712 > http [ACK] Seq=427 Ack=459552 Win=48180 Len=0
166572  56.024145 151.77.135.142 -> 244.3.160.239 TCP 64 5712 > http [ACK] Seq=427 Ack=462312 Win=48180 Len=0
166574  56.024608 151.77.135.142 -> 244.3.160.239 TCP 64 5712 > http [ACK] Seq=427 Ack=465072 Win=48180 Len=0
166584  56.027048 151.77.135.142 -> 244.3.160.239 TCP 64 5712 > http [ACK] Seq=427 Ack=467752 Win=48180 Len=0
166587  56.027432 151.77.135.142 -> 244.3.160.239 TCP 64 5712 > http [ACK] Seq=427 Ack=470512 Win=48180 Len=0
166595  56.030062 151.77.135.142 -> 244.3.160.239 TCP 64 5712 > http [ACK] Seq=427 Ack=474732 Win=49640 Len=0
166602  56.031951 151.77.135.142 -> 244.3.160.239 TCP 64 5712 > http [ACK] Seq=427 Ack=478792 Win=49640 Len=0
166624  56.035603 151.77.135.142 -> 244.3.160.239 TCP 64 5712 > http [ACK] Seq=427 Ack=481552 Win=49640 Len=0
166655  56.043173 151.77.135.142 -> 244.3.160.239 TCP 64 5712 > http [ACK] Seq=427 Ack=484312 Win=49640 Len=0
166738  56.048012 151.77.135.142 -> 244.3.160.239 TCP 64 5712 > http [ACK] Seq=427 Ack=487072 Win=49640 Len=0
166755  56.049901 151.77.135.142 -> 244.3.160.239 TCP 64 5712 > http [ACK] Seq=427 Ack=489832 Win=49640 Len=0
166779  56.051954 151.77.135.142 -> 244.3.160.239 TCP 64 5712 > http [ACK] Seq=427 Ack=494052 Win=48180 Len=0
166795  56.053790 151.77.135.142 -> 244.3.160.239 TCP 64 5712 > http [ACK] Seq=427 Ack=498112 Win=48180 Len=0
166800  56.055704 151.77.135.142 -> 244.3.160.239 TCP 64 5712 > http [ACK] Seq=427 Ack=502332 Win=48180 Len=0
166819  56.057001 151.77.135.142 -> 244.3.160.239 TCP 64 5712 > http [ACK] Seq=427 Ack=505012 Win=48180 Len=0
166880  56.068688 151.77.135.142 -> 244.3.160.239 TCP 64 5712 > http [ACK] Seq=427 Ack=507772 Win=48180 Len=0
167000  56.086100 151.77.135.142 -> 244.3.160.239 TCP 64 5712 > http [ACK] Seq=427 Ack=511992 Win=46720 Len=0
167013  56.087795 151.77.135.142 -> 244.3.160.239 TCP 64 5712 > http [ACK] Seq=427 Ack=514752 Win=46720 Len=0
167030  56.089950 151.77.135.142 -> 244.3.160.239 TCP 64 5712 > http [ACK] Seq=427 Ack=517512 Win=46720 Len=0
167043  56.091888 151.77.135.142 -> 244.3.160.239 TCP 64 5712 > http [ACK] Seq=427 Ack=520272 Win=46720 Len=0
167049  56.092616 151.77.135.142 -> 244.3.160.239 TCP 64 5712 > http [ACK] Seq=427 Ack=523032 Win=46720 Len=0
167057  56.095297 151.77.135.142 -> 244.3.160.239 TCP 64 5712 > http [ACK] Seq=427 Ack=527092 Win=46720 Len=0
167096  56.098565 151.77.135.142 -> 244.3.160.239 TCP 64 5712 > http [ACK] Seq=427 Ack=529852 Win=43960 Len=0
167115  56.100102 151.77.135.142 -> 244.3.160.239 TCP 64 5712 > http [ACK] Seq=427 Ack=532612 Win=45260 Len=0
167129  56.101566 151.77.135.142 -> 244.3.160.239 TCP 64 5712 > http [ACK] Seq=427 Ack=536832 Win=45260 Len=0
167151  56.103999 151.77.135.142 -> 244.3.160.239 TCP 64 5712 > http [ACK] Seq=427 Ack=539592 Win=45260 Len=0
167171  56.105789 151.77.135.142 -> 244.3.160.239 TCP 64 5712 > http [ACK] Seq=427 Ack=542272 Win=46720 Len=0
167196  56.110351 151.77.135.142 -> 244.3.160.239 TCP 64 5712 > http [ACK] Seq=427 Ack=545032 Win=46720 Len=0
167202  56.112726 151.77.135.142 -> 244.3.160.239 TCP 64 5712 > http [ACK] Seq=427 Ack=549252 Win=46720 Len=0
167205  56.114722 151.77.135.142 -> 244.3.160.239 TCP 64 5712 > http [ACK] Seq=427 Ack=553312 Win=46720 Len=0
167235  56.120692 151.77.135.142 -> 244.3.160.239 TCP 64 5712 > http [ACK] Seq=427 Ack=556072 Win=46720 Len=0
167292  56.125108 151.77.135.142 -> 244.3.160.239 TCP 64 5712 > http [ACK] Seq=427 Ack=560292 Win=46720 Len=0
167312  56.129130 151.77.135.142 -> 244.3.160.239 TCP 64 5712 > http [ACK] Seq=427 Ack=563052 Win=46720 Len=0
167322  56.130602 151.77.135.142 -> 244.3.160.239 TCP 64 5712 > http [ACK] Seq=427 Ack=565812 Win=46720 Len=0
167349  56.134931 151.77.135.142 -> 244.3.160.239 TCP 64 5712 > http [ACK] Seq=427 Ack=568572 Win=46720 Len=0
167363  56.138306 151.77.135.142 -> 244.3.160.239 TCP 64 5712 > http [ACK] Seq=427 Ack=572632 Win=46720 Len=0
167364  56.139585 151.77.135.142 -> 244.3.160.239 TCP 64 5712 > http [ACK] Seq=427 Ack=575392 Win=46720 Len=0
167405  56.144906 151.77.135.142 -> 244.3.160.239 TCP 64 5712 > http [ACK] Seq=427 Ack=578152 Win=43960 Len=0
167468  56.148620 151.77.135.142 -> 244.3.160.239 TCP 64 5712 > http [ACK] Seq=427 Ack=580992 Win=45260 Len=0
167479  56.152016 151.77.135.142 -> 244.3.160.239 TCP 64 5712 > http [ACK] Seq=427 Ack=585052 Win=45260 Len=0
167492  56.153982 151.77.135.142 -> 244.3.160.239 TCP 64 5712 > http [ACK] Seq=427 Ack=587812 Win=45260 Len=0
167511  56.158606 151.77.135.142 -> 244.3.160.239 TCP 64 5712 > http [ACK] Seq=427 Ack=592032 Win=45260 Len=0
167515  56.159675 151.77.135.142 -> 244.3.160.239 TCP 64 5712 > http [ACK] Seq=427 Ack=594792 Win=45260 Len=0
167516  56.160676 151.77.135.142 -> 244.3.160.239 TCP 64 5712 > http [ACK] Seq=427 Ack=598852 Win=45260 Len=0
167580  56.171084 151.77.135.142 -> 244.3.160.239 TCP 64 5712 > http [ACK] Seq=427 Ack=603072 Win=43800 Len=0
167623  56.175075 151.77.135.142 -> 244.3.160.239 TCP 64 5712 > http [ACK] Seq=427 Ack=607132 Win=43800 Len=0
167631  56.176657 151.77.135.142 -> 244.3.160.239 TCP 64 5712 > http [ACK] Seq=427 Ack=609892 Win=43800 Len=0
167662  56.181112 151.77.135.142 -> 244.3.160.239 TCP 64 5712 > http [ACK] Seq=427 Ack=612652 Win=43800 Len=0
167672  56.182565 151.77.135.142 -> 244.3.160.239 TCP 64 5712 > http [ACK] Seq=427 Ack=616872 Win=43800 Len=0
167689  56.185591 151.77.135.142 -> 244.3.160.239 TCP 64 5712 > http [ACK] Seq=427 Ack=619632 Win=43800 Len=0
167698  56.187558 151.77.135.142 -> 244.3.160.239 TCP 64 5712 > http [ACK] Seq=427 Ack=623692 Win=43800 Len=0
167753  56.195834 151.77.135.142 -> 244.3.160.239 TCP 64 5712 > http [ACK] Seq=427 Ack=626452 Win=43800 Len=0
167770  56.197635 151.77.135.142 -> 244.3.160.239 TCP 64 5712 > http [ACK] Seq=427 Ack=629212 Win=43800 Len=0
167814  56.200724 151.77.135.142 -> 244.3.160.239 TCP 64 5712 > http [ACK] Seq=427 Ack=631972 Win=43800 Len=0
167819  56.201937 151.77.135.142 -> 244.3.160.239 TCP 64 5712 > http [ACK] Seq=427 Ack=634732 Win=43800 Len=0
167820  56.204045 151.77.135.142 -> 244.3.160.239 TCP 64 5712 > http [ACK] Seq=427 Ack=638952 Win=43800 Len=0
167832  56.205766 151.77.135.142 -> 244.3.160.239 TCP 64 5712 > http [ACK] Seq=427 Ack=641632 Win=43800 Len=0
167846  56.209770 151.77.135.142 -> 244.3.160.239 TCP 64 5712 > http [ACK] Seq=427 Ack=645852 Win=45260 Len=0
167915  56.220651 151.77.135.142 -> 244.3.160.239 TCP 64 5712 > http [ACK] Seq=427 Ack=648612 Win=45260 Len=0
167950  56.224075 151.77.135.142 -> 244.3.160.239 TCP 64 5712 > http [ACK] Seq=427 Ack=652672 Win=45260 Len=0
167982  56.226988 151.77.135.142 -> 244.3.160.239 TCP 64 5712 > http [ACK] Seq=427 Ack=656812 Win=45260 Len=0
167989  56.228806 151.77.135.142 -> 244.3.160.239 TCP 64 5712 > http [ACK] Seq=427 Ack=659572 Win=45260 Len=0
168011  56.234613 151.77.135.142 -> 244.3.160.239 TCP 64 5712 > http [ACK] Seq=427 Ack=662332 Win=42500 Len=0
168035  56.238568 151.77.135.142 -> 244.3.160.239 TCP 64 5712 > http [ACK] Seq=427 Ack=665092 Win=43800 Len=0
168037  56.239077 151.77.135.142 -> 244.3.160.239 TCP 64 5712 > http [ACK] Seq=427 Ack=667852 Win=43800 Len=0
168063  56.240643 151.77.135.142 -> 244.3.160.239 TCP 64 5712 > http [ACK] Seq=427 Ack=670612 Win=43800 Len=0
168228  56.266583 151.77.135.142 -> 244.3.160.239 TCP 64 5712 > http [ACK] Seq=427 Ack=673372 Win=41040 Len=0
168232  56.266923 151.77.135.142 -> 244.3.160.239 TCP 64 5712 > http [ACK] Seq=427 Ack=676132 Win=42340 Len=0
168252  56.270332 151.77.135.142 -> 244.3.160.239 TCP 64 5712 > http [ACK] Seq=427 Ack=680352 Win=42340 Len=0
168265  56.274193 151.77.135.142 -> 244.3.160.239 TCP 64 5712 > http [ACK] Seq=427 Ack=683112 Win=45260 Len=0
168280  56.275649 151.77.135.142 -> 244.3.160.239 TCP 64 5712 > http [ACK] Seq=427 Ack=685872 Win=45260 Len=0
168295  56.277541 151.77.135.142 -> 244.3.160.239 TCP 64 5712 > http [ACK] Seq=427 Ack=688632 Win=45260 Len=0
168304  56.278284 151.77.135.142 -> 244.3.160.239 TCP 64 5712 > http [ACK] Seq=427 Ack=691312 Win=45260 Len=0
168312  56.280693 151.77.135.142 -> 244.3.160.239 TCP 64 5712 > http [ACK] Seq=427 Ack=695532 Win=45260 Len=0
168326  56.283728 151.77.135.142 -> 244.3.160.239 TCP 64 5712 > http [ACK] Seq=427 Ack=699592 Win=45260 Len=0
168328  56.284333 151.77.135.142 -> 244.3.160.239 TCP 64 5712 > http [ACK] Seq=427 Ack=702352 Win=46720 Len=0
168366  56.291572 151.77.135.142 -> 244.3.160.239 TCP 64 5712 > http [ACK] Seq=427 Ack=705112 Win=46720 Len=0
168385  56.297022 151.77.135.142 -> 244.3.160.239 TCP 64 5712 > http [ACK] Seq=427 Ack=707872 Win=43960 Len=0
168391  56.299302 151.77.135.142 -> 244.3.160.239 TCP 64 5712 > http [ACK] Seq=427 Ack=712092 Win=45260 Len=0
168394  56.299688 151.77.135.142 -> 244.3.160.239 TCP 64 5712 > http [ACK] Seq=427 Ack=714852 Win=45260 Len=0
168423  56.303419 151.77.135.142 -> 244.3.160.239 TCP 64 5712 > http [ACK] Seq=427 Ack=718992 Win=45260 Len=0
168427  56.303633 151.77.135.142 -> 244.3.160.239 TCP 64 5712 > http [ACK] Seq=427 Ack=721752 Win=45260 Len=0
168430  56.306130 151.77.135.142 -> 244.3.160.239 TCP 64 5712 > http [ACK] Seq=427 Ack=724512 Win=45260 Len=0
168438  56.308569 151.77.135.142 -> 244.3.160.239 TCP 64 5712 > http [ACK] Seq=427 Ack=728572 Win=45260 Len=0
168443  56.310023 151.77.135.142 -> 244.3.160.239 TCP 64 5712 > http [ACK] Seq=427 Ack=731332 Win=45260 Len=0
168459  56.312268 151.77.135.142 -> 244.3.160.239 TCP 64 5712 > http [ACK] Seq=427 Ack=735552 Win=45260 Len=0
168485  56.314055 151.77.135.142 -> 244.3.160.239 TCP 64 5712 > http [ACK] Seq=427 Ack=738312 Win=46720 Len=0
168534  56.320763 151.77.135.142 -> 244.3.160.239 TCP 64 5712 > http [ACK] Seq=427 Ack=741072 Win=46720 Len=0
168548  56.323395 151.77.135.142 -> 244.3.160.239 TCP 64 5712 > http [ACK] Seq=427 Ack=743832 Win=46720 Len=0
168569  56.324830 151.77.135.142 -> 244.3.160.239 TCP 64 5712 > http [ACK] Seq=427 Ack=746592 Win=46720 Len=0
168586  56.326000 151.77.135.142 -> 244.3.160.239 TCP 64 5712 > http [ACK] Seq=427 Ack=749352 Win=46720 Len=0
168605  56.327822 151.77.135.142 -> 244.3.160.239 TCP 64 5712 > http [ACK] Seq=427 Ack=752112 Win=46720 Len=0
168614  56.329475 151.77.135.142 -> 244.3.160.239 TCP 64 5712 > http [ACK] Seq=427 Ack=754872 Win=46720 Len=0
168615  56.330328 151.77.135.142 -> 244.3.160.239 TCP 64 5712 > http [ACK] Seq=427 Ack=757632 Win=46720 Len=0
168620  56.331699 151.77.135.142 -> 244.3.160.239 TCP 64 5712 > http [ACK] Seq=427 Ack=760392 Win=46720 Len=0
168668  56.336785 151.77.135.142 -> 244.3.160.239 TCP 64 5712 > http [ACK] Seq=427 Ack=764452 Win=46720 Len=0
168753  56.349402 151.77.135.142 -> 244.3.160.239 TCP 64 5712 > http [ACK] Seq=427 Ack=768592 Win=48180 Len=0
168758  56.350356 151.77.135.142 -> 244.3.160.239 TCP 64 5712 > http [ACK] Seq=427 Ack=771352 Win=45420 Len=0
168780  56.351828 151.77.135.142 -> 244.3.160.239 TCP 64 5712 > http [ACK] Seq=427 Ack=774112 Win=46720 Len=0
168804  56.353586 151.77.135.142 -> 244.3.160.239 TCP 64 5712 > http [ACK] Seq=427 Ack=778332 Win=46720 Len=0
168814  56.355575 151.77.135.142 -> 244.3.160.239 TCP 64 5712 > http [ACK] Seq=427 Ack=781092 Win=46720 Len=0
168818  56.357572 151.77.135.142 -> 244.3.160.239 TCP 64 5712 > http [ACK] Seq=427 Ack=785152 Win=46720 Len=0
168835  56.361645 151.77.135.142 -> 244.3.160.239 TCP 64 5712 > http [ACK] Seq=427 Ack=787912 Win=46720 Len=0
168889  56.375447 151.77.135.142 -> 244.3.160.239 TCP 64 5712 > http [ACK] Seq=427 Ack=790672 Win=43960 Len=0
168904  56.376942 151.77.135.142 -> 244.3.160.239 TCP 64 5712 > http [ACK] Seq=427 Ack=793432 Win=45260 Len=0
168935  56.379077 151.77.135.142 -> 244.3.160.239 TCP 64 5712 > http [ACK] Seq=427 Ack=796192 Win=45260 Len=0
168957  56.381272 151.77.135.142 -> 244.3.160.239 TCP 64 5712 > http [ACK] Seq=427 Ack=800412 Win=46720 Len=0
168985  56.383065 151.77.135.142 -> 244.3.160.239 TCP 64 5712 > http [ACK] Seq=427 Ack=804552 Win=46720 Len=0
169002  56.385096 151.77.135.142 -> 244.3.160.239 TCP 64 5712 > http [ACK] Seq=427 Ack=808612 Win=46720 Len=0
169015  56.387677 151.77.135.142 -> 244.3.160.239 TCP 64 5712 > http [ACK] Seq=427 Ack=811372 Win=48180 Len=0
169080  56.401435 151.77.135.142 -> 244.3.160.239 TCP 64 5712 > http [ACK] Seq=427 Ack=815592 Win=48180 Len=0
169083  56.401745 151.77.135.142 -> 244.3.160.239 TCP 64 5712 > http [ACK] Seq=427 Ack=818352 Win=48180 Len=0
169119  56.404145 151.77.135.142 -> 244.3.160.239 TCP 64 5712 > http [ACK] Seq=427 Ack=821112 Win=48180 Len=0
169125  56.405815 151.77.135.142 -> 244.3.160.239 TCP 64 5712 > http [ACK] Seq=427 Ack=823872 Win=48180 Len=0
169129  56.407698 151.77.135.142 -> 244.3.160.239 TCP 64 5712 > http [ACK] Seq=427 Ack=826632 Win=48180 Len=0
169132  56.409243 151.77.135.142 -> 244.3.160.239 TCP 64 5712 > http [ACK] Seq=427 Ack=829392 Win=48180 Len=0
169144  56.413037 151.77.135.142 -> 244.3.160.239 TCP 64 5712 > http [ACK] Seq=427 Ack=833452 Win=48180 Len=0
169152  56.414721 151.77.135.142 -> 244.3.160.239 TCP 64 5712 > http [ACK] Seq=427 Ack=836212 Win=48180 Len=0
169208  56.426443 151.77.135.142 -> 244.3.160.239 TCP 64 5712 > http [ACK] Seq=427 Ack=840352 Win=48180 Len=0
169213  56.427289 151.77.135.142 -> 244.3.160.239 TCP 64 5712 > http [ACK] Seq=427 Ack=843112 Win=48180 Len=0
169240  56.430069 151.77.135.142 -> 244.3.160.239 TCP 64 5712 > http [ACK] Seq=427 Ack=845872 Win=48180 Len=0
169241  56.430736 151.77.135.142 -> 244.3.160.239 TCP 64 5712 > http [ACK] Seq=427 Ack=848632 Win=48180 Len=0
169249  56.433623 151.77.135.142 -> 244.3.160.239 TCP 64 5712 > http [ACK] Seq=427 Ack=851392 Win=48180 Len=0
169250  56.433845 151.77.135.142 -> 244.3.160.239 TCP 64 5712 > http [ACK] Seq=427 Ack=854152 Win=48180 Len=0
169256  56.435721 151.77.135.142 -> 244.3.160.239 TCP 64 5712 > http [ACK] Seq=427 Ack=856912 Win=48180 Len=0
169275  56.438816 151.77.135.142 -> 244.3.160.239 TCP 64 5712 > http [ACK] Seq=427 Ack=859672 Win=48180 Len=0
169309  56.450822 151.77.135.142 -> 244.3.160.239 TCP 64 5712 > http [ACK] Seq=427 Ack=862432 Win=48180 Len=0
169318  56.452694 151.77.135.142 -> 244.3.160.239 TCP 64 5712 > http [ACK] Seq=427 Ack=865192 Win=48180 Len=0
169351  56.454951 151.77.135.142 -> 244.3.160.239 TCP 64 5712 > http [ACK] Seq=427 Ack=867952 Win=48180 Len=0
169375  56.456725 151.77.135.142 -> 244.3.160.239 TCP 64 5712 > http [ACK] Seq=427 Ack=870712 Win=48180 Len=0
169380  56.458169 151.77.135.142 -> 244.3.160.239 TCP 64 5712 > http [ACK] Seq=427 Ack=873472 Win=45420 Len=0
169388  56.460197 151.77.135.142 -> 244.3.160.239 TCP 64 5712 > http [ACK] Seq=427 Ack=877612 Win=46720 Len=0
169398  56.461675 151.77.135.142 -> 244.3.160.239 TCP 64 5712 > http [ACK] Seq=427 Ack=880372 Win=46720 Len=0
169408  56.464689 151.77.135.142 -> 244.3.160.239 TCP 64 5712 > http [ACK] Seq=427 Ack=883132 Win=46720 Len=0
169501  56.481443 151.77.135.142 -> 244.3.160.239 TCP 64 5712 > http [ACK] Seq=427 Ack=885892 Win=46720 Len=0
169505  56.481819 151.77.135.142 -> 244.3.160.239 TCP 64 5712 > http [ACK] Seq=427 Ack=888652 Win=46720 Len=0
169518  56.482890 151.77.135.142 -> 244.3.160.239 TCP 64 5712 > http [ACK] Seq=427 Ack=891412 Win=46720 Len=0
169521  56.485319 151.77.135.142 -> 244.3.160.239 TCP 64 5712 > http [ACK] Seq=427 Ack=895632 Win=46720 Len=0
169525  56.485851 151.77.135.142 -> 244.3.160.239 TCP 64 5712 > http [ACK] Seq=427 Ack=898392 Win=46720 Len=0
169533  56.488821 151.77.135.142 -> 244.3.160.239 TCP 64 5712 > http [ACK] Seq=427 Ack=901152 Win=46720 Len=0
169546  56.491965 151.77.135.142 -> 244.3.160.239 TCP 64 5712 > http [ACK] Seq=427 Ack=905212 Win=46720 Len=0
169565  56.493614 151.77.135.142 -> 244.3.160.239 TCP 64 5712 > http [ACK] Seq=427 Ack=907972 Win=46720 Len=0
169632  56.503339 151.77.135.142 -> 244.3.160.239 TCP 64 5712 > http [ACK] Seq=427 Ack=910732 Win=43960 Len=0
169637  56.503861 151.77.135.142 -> 244.3.160.239 TCP 64 5712 > http [ACK] Seq=427 Ack=913492 Win=45260 Len=0
169653  56.506905 151.77.135.142 -> 244.3.160.239 TCP 64 5712 > http [ACK] Seq=427 Ack=916332 Win=45260 Len=0
169658  56.509064 151.77.135.142 -> 244.3.160.239 TCP 64 5712 > http [ACK] Seq=427 Ack=919092 Win=45260 Len=0
169670  56.511218 151.77.135.142 -> 244.3.160.239 TCP 64 5712 > http [ACK] Seq=427 Ack=923152 Win=45260 Len=0
169674  56.511867 151.77.135.142 -> 244.3.160.239 TCP 64 5712 > http [FIN, ACK] Seq=427 Ack=924112 Win=44300 Len=0
170117  56.616729 151.77.135.142 -> 244.3.160.239 TCP 64 5712 > http [ACK] Seq=428 Ack=924113 Win=44300 Len=0
180136  60.649416 151.77.135.142 -> 244.3.160.239 TCP 66 12704 > http [SYN] Seq=0 Win=8192 Len=0 MSS=1460 SACK_PERM=1
180149  60.652013 151.77.135.142 -> 244.3.160.239 TCP 64 12704 > http [ACK] Seq=1 Ack=1 Win=17520 Len=0
180374  60.740135 151.77.135.142 -> 244.3.160.239 TCP 64 12704 > http [ACK] Seq=427 Ack=4152 Win=17520 Len=0
180384  60.751087 151.77.135.142 -> 244.3.160.239 TCP 64 12704 > http [ACK] Seq=427 Ack=8212 Win=17520 Len=0
180415  60.765956 151.77.135.142 -> 244.3.160.239 TCP 64 12704 > http [ACK] Seq=427 Ack=10972 Win=17520 Len=0
180455  60.779544 151.77.135.142 -> 244.3.160.239 TCP 64 12704 > http [ACK] Seq=427 Ack=13812 Win=17520 Len=0
180504  60.791180 151.77.135.142 -> 244.3.160.239 TCP 64 12704 > http [ACK] Seq=427 Ack=16572 Win=17520 Len=0
180517  60.793474 151.77.135.142 -> 244.3.160.239 TCP 64 12704 > http [ACK] Seq=427 Ack=19332 Win=17520 Len=0
180533  60.802459 151.77.135.142 -> 244.3.160.239 TCP 64 12704 > http [ACK] Seq=427 Ack=22092 Win=17520 Len=0
180576  60.815598 151.77.135.142 -> 244.3.160.239 TCP 64 12704 > http [ACK] Seq=427 Ack=24852 Win=17520 Len=0
180580  60.816470 151.77.135.142 -> 244.3.160.239 TCP 64 12704 > http [ACK] Seq=427 Ack=27532 Win=17520 Len=0
180592  60.819187 151.77.135.142 -> 244.3.160.239 TCP 64 12704 > http [ACK] Seq=427 Ack=30292 Win=17520 Len=0
180597  60.822155 151.77.135.142 -> 244.3.160.239 TCP 64 12704 > http [ACK] Seq=427 Ack=33052 Win=17520 Len=0
180613  60.830085 151.77.135.142 -> 244.3.160.239 TCP 64 12704 > http [ACK] Seq=427 Ack=35812 Win=17520 Len=0
180672  60.842265 151.77.135.142 -> 244.3.160.239 TCP 64 12704 > http [ACK] Seq=427 Ack=40032 Win=17520 Len=0
180674  60.843744 151.77.135.142 -> 244.3.160.239 TCP 64 12704 > http [ACK] Seq=427 Ack=42792 Win=17520 Len=0
180676  60.844065 151.77.135.142 -> 244.3.160.239 TCP 64 12704 > http [ACK] Seq=427 Ack=45552 Win=17520 Len=0
180688  60.850414 151.77.135.142 -> 244.3.160.239 TCP 64 12704 > http [ACK] Seq=427 Ack=49612 Win=17520 Len=0
180702  60.851518 151.77.135.142 -> 244.3.160.239 TCP 64 12704 > http [ACK] Seq=427 Ack=52372 Win=17520 Len=0
180719  60.855115 151.77.135.142 -> 244.3.160.239 TCP 64 12704 > http [ACK] Seq=427 Ack=56512 Win=17520 Len=0
180783  60.866129 151.77.135.142 -> 244.3.160.239 TCP 64 12704 > http [ACK] Seq=427 Ack=59352 Win=17520 Len=0
180789  60.868026 151.77.135.142 -> 244.3.160.239 TCP 64 12704 > http [ACK] Seq=427 Ack=63412 Win=17520 Len=0
180791  60.869923 151.77.135.142 -> 244.3.160.239 TCP 64 12704 > http [ACK] Seq=427 Ack=66172 Win=17520 Len=0
180792  60.870203 151.77.135.142 -> 244.3.160.239 TCP 64 12704 > http [ACK] Seq=427 Ack=68932 Win=17520 Len=0
180798  60.873960 151.77.135.142 -> 244.3.160.239 TCP 64 12704 > http [ACK] Seq=427 Ack=73152 Win=17520 Len=0
180800  60.874657 151.77.135.142 -> 244.3.160.239 TCP 64 12704 > http [ACK] Seq=427 Ack=75912 Win=17520 Len=0
180806  60.879248 151.77.135.142 -> 244.3.160.239 TCP 64 12704 > http [ACK] Seq=427 Ack=79972 Win=17520 Len=0
180860  60.895373 151.77.135.142 -> 244.3.160.239 TCP 64 12704 > http [ACK] Seq=427 Ack=82732 Win=17520 Len=0
180879  60.900545 151.77.135.142 -> 244.3.160.239 TCP 64 12704 > http [ACK] Seq=427 Ack=85492 Win=17520 Len=0
180901  60.905858 151.77.135.142 -> 244.3.160.239 TCP 64 12704 > http [ACK] Seq=427 Ack=89712 Win=17520 Len=0
180903  60.906389 151.77.135.142 -> 244.3.160.239 TCP 64 12704 > http [ACK] Seq=427 Ack=92472 Win=17520 Len=0
180911  60.909456 151.77.135.142 -> 244.3.160.239 TCP 64 12704 > http [ACK] Seq=427 Ack=96612 Win=17520 Len=0
180913  60.911435 151.77.135.142 -> 244.3.160.239 TCP 64 12704 > http [ACK] Seq=427 Ack=100672 Win=17520 Len=0
180917  60.913073 151.77.135.142 -> 244.3.160.239 TCP 64 12704 > http [ACK] Seq=427 Ack=103432 Win=17520 Len=0
180965  60.916799 151.77.135.142 -> 244.3.160.239 TCP 64 12704 > http [ACK] Seq=427 Ack=106272 Win=17520 Len=0
180968  60.918862 151.77.135.142 -> 244.3.160.239 TCP 64 12704 > http [ACK] Seq=427 Ack=110332 Win=17520 Len=0
180971  60.920442 151.77.135.142 -> 244.3.160.239 TCP 64 12704 > http [ACK] Seq=427 Ack=113092 Win=17520 Len=0
180976  60.924893 151.77.135.142 -> 244.3.160.239 TCP 64 12704 > http [ACK] Seq=427 Ack=117312 Win=17520 Len=0
180977  60.924897 151.77.135.142 -> 244.3.160.239 TCP 64 12704 > http [ACK] Seq=427 Ack=119992 Win=17520 Len=0
180978  60.925142 151.77.135.142 -> 244.3.160.239 TCP 64 12704 > http [ACK] Seq=427 Ack=122752 Win=17520 Len=0
180985  60.930107 151.77.135.142 -> 244.3.160.239 TCP 64 12704 > http [ACK] Seq=427 Ack=125512 Win=17520 Len=0
181093  60.941508 151.77.135.142 -> 244.3.160.239 TCP 64 12704 > http [ACK] Seq=427 Ack=128272 Win=17520 Len=0
181115  60.943804 151.77.135.142 -> 244.3.160.239 TCP 64 12704 > http [ACK] Seq=427 Ack=132412 Win=17520 Len=0
181128  60.944618 151.77.135.142 -> 244.3.160.239 TCP 64 12704 > http [ACK] Seq=427 Ack=135172 Win=17520 Len=0
181137  60.946117 151.77.135.142 -> 244.3.160.239 TCP 64 12704 > http [ACK] Seq=427 Ack=137932 Win=17520 Len=0
181153  60.948401 151.77.135.142 -> 244.3.160.239 TCP 64 12704 > http [ACK] Seq=427 Ack=140692 Win=17520 Len=0
181160  60.949348 151.77.135.142 -> 244.3.160.239 TCP 64 12704 > http [ACK] Seq=427 Ack=143452 Win=17520 Len=0
181171  60.950983 151.77.135.142 -> 244.3.160.239 TCP 64 12704 > http [ACK] Seq=427 Ack=146212 Win=17520 Len=0
181198  60.955996 151.77.135.142 -> 244.3.160.239 TCP 64 12704 > http [ACK] Seq=427 Ack=148972 Win=17520 Len=0
181244  60.967148 151.77.135.142 -> 244.3.160.239 TCP 64 12704 > http [ACK] Seq=427 Ack=151732 Win=17520 Len=0
181265  60.968932 151.77.135.142 -> 244.3.160.239 TCP 64 12704 > http [ACK] Seq=427 Ack=154492 Win=17520 Len=0
181278  60.970501 151.77.135.142 -> 244.3.160.239 TCP 64 12704 > http [ACK] Seq=427 Ack=157252 Win=17520 Len=0
181279  60.971418 151.77.135.142 -> 244.3.160.239 TCP 64 12704 > http [ACK] Seq=427 Ack=160012 Win=17520 Len=0
181288  60.974286 151.77.135.142 -> 244.3.160.239 TCP 64 12704 > http [ACK] Seq=427 Ack=164232 Win=17520 Len=0
181291  60.975208 151.77.135.142 -> 244.3.160.239 TCP 64 12704 > http [ACK] Seq=427 Ack=166992 Win=17520 Len=0
181295  60.976123 151.77.135.142 -> 244.3.160.239 TCP 64 12704 > http [ACK] Seq=427 Ack=169672 Win=17520 Len=0
181329  60.985378 151.77.135.142 -> 244.3.160.239 TCP 64 12704 > http [ACK] Seq=427 Ack=172432 Win=17520 Len=0
181382  60.992083 151.77.135.142 -> 244.3.160.239 TCP 64 12704 > http [ACK] Seq=427 Ack=175192 Win=17520 Len=0
181387  60.994472 151.77.135.142 -> 244.3.160.239 TCP 64 12704 > http [ACK] Seq=427 Ack=179412 Win=17520 Len=0
181393  60.996275 151.77.135.142 -> 244.3.160.239 TCP 64 12704 > http [ACK] Seq=427 Ack=182172 Win=17520 Len=0
181396  60.998137 151.77.135.142 -> 244.3.160.239 TCP 64 12704 > http [ACK] Seq=427 Ack=186232 Win=17520 Len=0
181397  60.999983 151.77.135.142 -> 244.3.160.239 TCP 64 12704 > http [ACK] Seq=427 Ack=190452 Win=17520 Len=0
181420  61.005040 151.77.135.142 -> 244.3.160.239 TCP 64 12704 > http [ACK] Seq=427 Ack=193132 Win=17520 Len=0
181494  61.019375 151.77.135.142 -> 244.3.160.239 TCP 64 12704 > http [ACK] Seq=427 Ack=195972 Win=17520 Len=0
181558  61.038122 151.77.135.142 -> 244.3.160.239 TCP 64 12704 > http [ACK] Seq=427 Ack=198732 Win=17520 Len=0
181695  61.077409 151.77.135.142 -> 244.3.160.239 TCP 64 12704 > http [ACK] Seq=427 Ack=204252 Win=17520 Len=0
181719  61.083115 151.77.135.142 -> 244.3.160.239 TCP 64 12704 > http [ACK] Seq=427 Ack=206932 Win=17520 Len=0
181723  61.086414 151.77.135.142 -> 244.3.160.239 TCP 64 12704 > http [ACK] Seq=427 Ack=209692 Win=17520 Len=0
181774  61.103487 151.77.135.142 -> 244.3.160.239 TCP 64 12704 > http [ACK] Seq=427 Ack=212452 Win=17520 Len=0
181803  61.112893 151.77.135.142 -> 244.3.160.239 TCP 64 12704 > http [ACK] Seq=427 Ack=215212 Win=17520 Len=0
181808  61.113186 151.77.135.142 -> 244.3.160.239 TCP 64 12704 > http [ACK] Seq=427 Ack=217972 Win=17520 Len=0
181821  61.119692 151.77.135.142 -> 244.3.160.239 TCP 64 12704 > http [ACK] Seq=427 Ack=220732 Win=17520 Len=0
181836  61.122748 151.77.135.142 -> 244.3.160.239 TCP 64 12704 > http [ACK] Seq=427 Ack=223492 Win=17520 Len=0
181853  61.124491 151.77.135.142 -> 244.3.160.239 TCP 64 12704 > http [ACK] Seq=427 Ack=226252 Win=17520 Len=0
181860  61.126213 151.77.135.142 -> 244.3.160.239 TCP 64 12704 > http [ACK] Seq=427 Ack=229012 Win=17520 Len=0
181863  61.130537 151.77.135.142 -> 244.3.160.239 TCP 64 12704 > http [ACK] Seq=427 Ack=231772 Win=17520 Len=0
181872  61.135344 151.77.135.142 -> 244.3.160.239 TCP 64 12704 > http [ACK] Seq=427 Ack=234692 Win=17520 Len=0
181877  61.138555 151.77.135.142 -> 244.3.160.239 TCP 64 12704 > http [ACK] Seq=427 Ack=237612 Win=17520 Len=0
181884  61.141729 151.77.135.142 -> 244.3.160.239 TCP 64 12704 > http [ACK] Seq=427 Ack=240532 Win=17520 Len=0
181889  61.143461 151.77.135.142 -> 244.3.160.239 TCP 64 12704 > http [ACK] Seq=427 Ack=243452 Win=17520 Len=0
181894  61.145963 151.77.135.142 -> 244.3.160.239 TCP 64 12704 > http [ACK] Seq=427 Ack=246372 Win=17520 Len=0
181916  61.153163 151.77.135.142 -> 244.3.160.239 TCP 64 12704 > http [ACK] Seq=427 Ack=249292 Win=17520 Len=0
181920  61.154902 151.77.135.142 -> 244.3.160.239 TCP 64 12704 > http [ACK] Seq=427 Ack=252212 Win=17520 Len=0
181935  61.162584 151.77.135.142 -> 244.3.160.239 TCP 64 12704 > http [ACK] Seq=427 Ack=255132 Win=17520 Len=0
181940  61.164335 151.77.135.142 -> 244.3.160.239 TCP 64 12704 > http [ACK] Seq=427 Ack=258052 Win=17520 Len=0
181942  61.164685 151.77.135.142 -> 244.3.160.239 TCP 64 12704 > http [ACK] Seq=427 Ack=260972 Win=17520 Len=0
181968  61.167956 151.77.135.142 -> 244.3.160.239 TCP 64 12704 > http [ACK] Seq=427 Ack=263892 Win=17520 Len=0
181976  61.172608 151.77.135.142 -> 244.3.160.239 TCP 64 12704 > http [ACK] Seq=427 Ack=266812 Win=17520 Len=0
181980  61.173339 151.77.135.142 -> 244.3.160.239 TCP 64 12704 > http [ACK] Seq=427 Ack=269732 Win=17520 Len=0
181994  61.181150 151.77.135.142 -> 244.3.160.239 TCP 64 12704 > http [ACK] Seq=427 Ack=272652 Win=17520 Len=0
182007  61.188889 151.77.135.142 -> 244.3.160.239 TCP 64 12704 > http [ACK] Seq=427 Ack=275572 Win=17520 Len=0
182011  61.190623 151.77.135.142 -> 244.3.160.239 TCP 64 12704 > http [ACK] Seq=427 Ack=278492 Win=17520 Len=0
182015  61.190980 151.77.135.142 -> 244.3.160.239 TCP 64 12704 > http [ACK] Seq=427 Ack=281412 Win=17520 Len=0
182043  61.194192 151.77.135.142 -> 244.3.160.239 TCP 64 12704 > http [ACK] Seq=427 Ack=284332 Win=17520 Len=0
182059  61.197264 151.77.135.142 -> 244.3.160.239 TCP 64 12704 > http [ACK] Seq=427 Ack=287252 Win=17520 Len=0
182074  61.201754 151.77.135.142 -> 244.3.160.239 TCP 64 12704 > http [ACK] Seq=427 Ack=290172 Win=17520 Len=0
182083  61.206827 151.77.135.142 -> 244.3.160.239 TCP 64 12704 > http [ACK] Seq=427 Ack=293092 Win=17520 Len=0
182086  61.210236 151.77.135.142 -> 244.3.160.239 TCP 64 12704 > http [ACK] Seq=427 Ack=296012 Win=17520 Len=0
182091  61.213210 151.77.135.142 -> 244.3.160.239 TCP 64 12704 > http [ACK] Seq=427 Ack=298932 Win=17520 Len=0
182097  61.216511 151.77.135.142 -> 244.3.160.239 TCP 64 12704 > http [ACK] Seq=427 Ack=301852 Win=17520 Len=0
182108  61.219530 151.77.135.142 -> 244.3.160.239 TCP 64 12704 > http [ACK] Seq=427 Ack=304772 Win=17520 Len=0
182124  61.224178 151.77.135.142 -> 244.3.160.239 TCP 64 12704 > http [ACK] Seq=427 Ack=307692 Win=17520 Len=0
182134  61.225951 151.77.135.142 -> 244.3.160.239 TCP 64 12704 > http [ACK] Seq=427 Ack=310612 Win=17520 Len=0
182159  61.231676 151.77.135.142 -> 244.3.160.239 TCP 64 12704 > http [ACK] Seq=427 Ack=313532 Win=17520 Len=0
182161  61.232023 151.77.135.142 -> 244.3.160.239 TCP 64 12704 > http [ACK] Seq=427 Ack=316452 Win=17520 Len=0
182169  61.235237 151.77.135.142 -> 244.3.160.239 TCP 64 12704 > http [ACK] Seq=427 Ack=319372 Win=17520 Len=0
182173  61.237028 151.77.135.142 -> 244.3.160.239 TCP 64 12704 > http [ACK] Seq=427 Ack=322292 Win=17520 Len=0
182192  61.241943 151.77.135.142 -> 244.3.160.239 TCP 64 12704 > http [ACK] Seq=427 Ack=325212 Win=17520 Len=0
182198  61.245076 151.77.135.142 -> 244.3.160.239 TCP 64 12704 > http [ACK] Seq=427 Ack=328132 Win=17520 Len=0
182213  61.248291 151.77.135.142 -> 244.3.160.239 TCP 64 12704 > http [ACK] Seq=427 Ack=331052 Win=17520 Len=0
182220  61.251512 151.77.135.142 -> 244.3.160.239 TCP 64 12704 > http [ACK] Seq=427 Ack=333972 Win=17520 Len=0
182239  61.255281 151.77.135.142 -> 244.3.160.239 TCP 64 12704 > http [ACK] Seq=427 Ack=336892 Win=17520 Len=0
182284  61.259184 151.77.135.142 -> 244.3.160.239 TCP 64 12704 > http [ACK] Seq=427 Ack=339812 Win=17520 Len=0
182294  61.263827 151.77.135.142 -> 244.3.160.239 TCP 64 12704 > http [ACK] Seq=427 Ack=342732 Win=17520 Len=0
182306  61.266917 151.77.135.142 -> 244.3.160.239 TCP 64 12704 > http [ACK] Seq=427 Ack=345652 Win=17520 Len=0
182307  61.267128 151.77.135.142 -> 244.3.160.239 TCP 64 12704 > http [ACK] Seq=427 Ack=348572 Win=17520 Len=0
182322  61.272077 151.77.135.142 -> 244.3.160.239 TCP 64 12704 > http [ACK] Seq=427 Ack=351492 Win=17520 Len=0
182333  61.276414 151.77.135.142 -> 244.3.160.239 TCP 64 12704 > http [ACK] Seq=427 Ack=354412 Win=17520 Len=0
182337  61.278298 151.77.135.142 -> 244.3.160.239 TCP 64 12704 > http [ACK] Seq=427 Ack=357332 Win=17520 Len=0
182353  61.283022 151.77.135.142 -> 244.3.160.239 TCP 64 12704 > http [ACK] Seq=427 Ack=360252 Win=17520 Len=0
182369  61.287682 151.77.135.142 -> 244.3.160.239 TCP 64 12704 > http [ACK] Seq=427 Ack=363172 Win=17520 Len=0
182381  61.289826 151.77.135.142 -> 244.3.160.239 TCP 64 12704 > http [ACK] Seq=427 Ack=366092 Win=17520 Len=0
182387  61.296005 151.77.135.142 -> 244.3.160.239 TCP 64 12704 > http [ACK] Seq=427 Ack=369012 Win=17520 Len=0
182393  61.297713 151.77.135.142 -> 244.3.160.239 TCP 64 12704 > http [ACK] Seq=427 Ack=371932 Win=17520 Len=0
182403  61.299286 151.77.135.142 -> 244.3.160.239 TCP 64 12704 > http [ACK] Seq=427 Ack=374852 Win=17520 Len=0
182409  61.302467 151.77.135.142 -> 244.3.160.239 TCP 64 12704 > http [ACK] Seq=427 Ack=377772 Win=17520 Len=0
182432  61.305720 151.77.135.142 -> 244.3.160.239 TCP 64 12704 > http [ACK] Seq=427 Ack=380692 Win=17520 Len=0
182446  61.311964 151.77.135.142 -> 244.3.160.239 TCP 64 12704 > http [ACK] Seq=427 Ack=383612 Win=17520 Len=0
182447  61.312064 151.77.135.142 -> 244.3.160.239 TCP 64 12704 > http [ACK] Seq=427 Ack=386532 Win=17520 Len=0
182464  61.316631 151.77.135.142 -> 244.3.160.239 TCP 64 12704 > http [ACK] Seq=427 Ack=389452 Win=17520 Len=0
182467  61.318436 151.77.135.142 -> 244.3.160.239 TCP 64 12704 > http [ACK] Seq=427 Ack=392372 Win=17520 Len=0
182480  61.326138 151.77.135.142 -> 244.3.160.239 TCP 64 12704 > http [ACK] Seq=427 Ack=395292 Win=17520 Len=0
182483  61.327892 151.77.135.142 -> 244.3.160.239 TCP 64 12704 > http [ACK] Seq=427 Ack=398212 Win=17520 Len=0
182489  61.329719 151.77.135.142 -> 244.3.160.239 TCP 64 12704 > http [ACK] Seq=427 Ack=401132 Win=17520 Len=0
182510  61.335769 151.77.135.142 -> 244.3.160.239 TCP 64 12704 > http [ACK] Seq=427 Ack=404052 Win=17520 Len=0
182514  61.337453 151.77.135.142 -> 244.3.160.239 TCP 64 12704 > http [ACK] Seq=427 Ack=406972 Win=17520 Len=0
182528  61.342771 151.77.135.142 -> 244.3.160.239 TCP 64 12704 > http [ACK] Seq=427 Ack=409892 Win=17520 Len=0
182532  61.347190 151.77.135.142 -> 244.3.160.239 TCP 64 12704 > http [ACK] Seq=427 Ack=412812 Win=17520 Len=0
182537  61.348975 151.77.135.142 -> 244.3.160.239 TCP 64 12704 > http [ACK] Seq=427 Ack=415732 Win=17520 Len=0
182546  61.352233 151.77.135.142 -> 244.3.160.239 TCP 64 12704 > http [ACK] Seq=427 Ack=418652 Win=17520 Len=0
182561  61.358081 151.77.135.142 -> 244.3.160.239 TCP 64 12704 > http [ACK] Seq=427 Ack=421572 Win=17520 Len=0
182564  61.361071 151.77.135.142 -> 244.3.160.239 TCP 64 12704 > http [ACK] Seq=427 Ack=424492 Win=17520 Len=0
182567  61.362596 151.77.135.142 -> 244.3.160.239 TCP 64 12704 > http [ACK] Seq=427 Ack=427412 Win=17520 Len=0
182586  61.371292 151.77.135.142 -> 244.3.160.239 TCP 64 12704 > http [ACK] Seq=427 Ack=433252 Win=17520 Len=0
182612  61.376083 151.77.135.142 -> 244.3.160.239 TCP 64 12704 > http [ACK] Seq=427 Ack=436172 Win=17520 Len=0
182620  61.378002 151.77.135.142 -> 244.3.160.239 TCP 64 12704 > http [ACK] Seq=427 Ack=439092 Win=17520 Len=0
182627  61.382146 151.77.135.142 -> 244.3.160.239 TCP 64 12704 > http [ACK] Seq=427 Ack=442012 Win=17520 Len=0
182633  61.385080 151.77.135.142 -> 244.3.160.239 TCP 64 12704 > http [ACK] Seq=427 Ack=444932 Win=17520 Len=0
182648  61.389295 151.77.135.142 -> 244.3.160.239 TCP 64 12704 > http [ACK] Seq=427 Ack=447852 Win=17520 Len=0
182659  61.396327 151.77.135.142 -> 244.3.160.239 TCP 64 12704 > http [ACK] Seq=427 Ack=450772 Win=17520 Len=0
182679  61.400670 151.77.135.142 -> 244.3.160.239 TCP 64 12704 > http [ACK] Seq=427 Ack=453692 Win=17520 Len=0
182685  61.405184 151.77.135.142 -> 244.3.160.239 TCP 64 12704 > http [ACK] Seq=427 Ack=456612 Win=17520 Len=0
182697  61.407951 151.77.135.142 -> 244.3.160.239 TCP 64 12704 > http [ACK] Seq=427 Ack=459532 Win=17520 Len=0
182706  61.410796 151.77.135.142 -> 244.3.160.239 TCP 64 12704 > http [ACK] Seq=427 Ack=462452 Win=17520 Len=0
182707  61.411052 151.77.135.142 -> 244.3.160.239 TCP 64 12704 > http [ACK] Seq=427 Ack=465372 Win=17520 Len=0
182718  61.414519 151.77.135.142 -> 244.3.160.239 TCP 64 12704 > http [ACK] Seq=427 Ack=467156 Win=17520 Len=0
182727  61.417404 151.77.135.142 -> 244.3.160.239 TCP 64 12704 > http [ACK] Seq=427 Ack=470076 Win=17520 Len=0
182731  61.420351 151.77.135.142 -> 244.3.160.239 TCP 64 12704 > http [ACK] Seq=427 Ack=472996 Win=17520 Len=0
182745  61.425278 151.77.135.142 -> 244.3.160.239 TCP 64 12704 > http [ACK] Seq=427 Ack=475916 Win=17520 Len=0
182788  61.431151 151.77.135.142 -> 244.3.160.239 TCP 64 12704 > http [ACK] Seq=427 Ack=478836 Win=17520 Len=0
182828  61.443239 151.77.135.142 -> 244.3.160.239 TCP 64 12704 > http [ACK] Seq=427 Ack=481756 Win=17520 Len=0
182831  61.444826 151.77.135.142 -> 244.3.160.239 TCP 64 12704 > http [ACK] Seq=427 Ack=484676 Win=17520 Len=0
182839  61.449255 151.77.135.142 -> 244.3.160.239 TCP 64 12704 > http [ACK] Seq=427 Ack=487596 Win=17520 Len=0
182859  61.453949 151.77.135.142 -> 244.3.160.239 TCP 64 12704 > http [ACK] Seq=427 Ack=490516 Win=17520 Len=0
182870  61.465032 151.77.135.142 -> 244.3.160.239 TCP 64 12704 > http [ACK] Seq=427 Ack=493436 Win=17520 Len=0
182873  61.472537 151.77.135.142 -> 244.3.160.239 TCP 64 12704 > http [ACK] Seq=427 Ack=496356 Win=17520 Len=0
182886  61.475626 151.77.135.142 -> 244.3.160.239 TCP 64 12704 > http [ACK] Seq=427 Ack=499276 Win=17520 Len=0
182940  61.479857 151.77.135.142 -> 244.3.160.239 TCP 64 12704 > http [ACK] Seq=427 Ack=502196 Win=17520 Len=0
182956  61.485427 151.77.135.142 -> 244.3.160.239 TCP 64 12704 > http [ACK] Seq=427 Ack=505116 Win=17520 Len=0
182962  61.489583 151.77.135.142 -> 244.3.160.239 TCP 64 12704 > http [ACK] Seq=427 Ack=508036 Win=17520 Len=0
182964  61.489939 151.77.135.142 -> 244.3.160.239 TCP 64 12704 > http [ACK] Seq=427 Ack=510956 Win=17520 Len=0
182967  61.490305 151.77.135.142 -> 244.3.160.239 TCP 64 12704 > http [ACK] Seq=427 Ack=513876 Win=17520 Len=0
182978  61.496078 151.77.135.142 -> 244.3.160.239 TCP 64 12704 > http [ACK] Seq=427 Ack=516796 Win=17520 Len=0
182986  61.499027 151.77.135.142 -> 244.3.160.239 TCP 64 12704 > http [ACK] Seq=427 Ack=519716 Win=17520 Len=0
182998  61.500548 151.77.135.142 -> 244.3.160.239 TCP 64 12704 > http [ACK] Seq=427 Ack=522636 Win=17520 Len=0
183006  61.504868 151.77.135.142 -> 244.3.160.239 TCP 64 12704 > http [ACK] Seq=427 Ack=525556 Win=17520 Len=0
183009  61.505302 151.77.135.142 -> 244.3.160.239 TCP 64 12704 > http [ACK] Seq=427 Ack=528476 Win=17520 Len=0
183014  61.509407 151.77.135.142 -> 244.3.160.239 TCP 64 12704 > http [ACK] Seq=427 Ack=531396 Win=17520 Len=0
183022  61.512411 151.77.135.142 -> 244.3.160.239 TCP 64 12704 > http [ACK] Seq=427 Ack=534316 Win=17520 Len=0
183044  61.515427 151.77.135.142 -> 244.3.160.239 TCP 64 12704 > http [ACK] Seq=427 Ack=537236 Win=17520 Len=0
183048  61.518366 151.77.135.142 -> 244.3.160.239 TCP 64 12704 > http [ACK] Seq=427 Ack=540156 Win=17520 Len=0
183053  61.521222 151.77.135.142 -> 244.3.160.239 TCP 64 12704 > http [ACK] Seq=427 Ack=543076 Win=17520 Len=0
183072  61.525543 151.77.135.142 -> 244.3.160.239 TCP 64 12704 > http [ACK] Seq=427 Ack=545996 Win=17520 Len=0
183075  61.527186 151.77.135.142 -> 244.3.160.239 TCP 64 12704 > http [ACK] Seq=427 Ack=548916 Win=17520 Len=0
183095  61.530018 151.77.135.142 -> 244.3.160.239 TCP 64 12704 > http [ACK] Seq=427 Ack=551836 Win=17520 Len=0
183105  61.534574 151.77.135.142 -> 244.3.160.239 TCP 64 12704 > http [ACK] Seq=427 Ack=554756 Win=17520 Len=0
183110  61.537434 151.77.135.142 -> 244.3.160.239 TCP 64 12704 > http [ACK] Seq=427 Ack=557676 Win=17520 Len=0
183122  61.540529 151.77.135.142 -> 244.3.160.239 TCP 64 12704 > http [ACK] Seq=427 Ack=560596 Win=17520 Len=0
183145  61.545071 151.77.135.142 -> 244.3.160.239 TCP 64 12704 > http [ACK] Seq=427 Ack=563516 Win=17520 Len=0
183152  61.549699 151.77.135.142 -> 244.3.160.239 TCP 64 12704 > http [ACK] Seq=427 Ack=566436 Win=17520 Len=0
183181  61.558004 151.77.135.142 -> 244.3.160.239 TCP 64 12704 > http [ACK] Seq=427 Ack=569356 Win=17520 Len=0
183184  61.559716 151.77.135.142 -> 244.3.160.239 TCP 64 12704 > http [ACK] Seq=427 Ack=572276 Win=17520 Len=0
183187  61.561741 151.77.135.142 -> 244.3.160.239 TCP 64 12704 > http [ACK] Seq=427 Ack=575196 Win=17520 Len=0
183214  61.565976 151.77.135.142 -> 244.3.160.239 TCP 64 12704 > http [ACK] Seq=427 Ack=578116 Win=17520 Len=0
183223  61.567648 151.77.135.142 -> 244.3.160.239 TCP 64 12704 > http [ACK] Seq=427 Ack=581036 Win=17520 Len=0
183244  61.572128 151.77.135.142 -> 244.3.160.239 TCP 64 12704 > http [ACK] Seq=427 Ack=583956 Win=17520 Len=0
183246  61.572435 151.77.135.142 -> 244.3.160.239 TCP 64 12704 > http [ACK] Seq=427 Ack=586876 Win=17520 Len=0
183257  61.580258 151.77.135.142 -> 244.3.160.239 TCP 64 12704 > http [ACK] Seq=427 Ack=589796 Win=17520 Len=0
183265  61.583193 151.77.135.142 -> 244.3.160.239 TCP 64 12704 > http [ACK] Seq=427 Ack=592716 Win=17520 Len=0
183272  61.586183 151.77.135.142 -> 244.3.160.239 TCP 64 12704 > http [ACK] Seq=427 Ack=595636 Win=17520 Len=0
183273  61.586307 151.77.135.142 -> 244.3.160.239 TCP 64 12704 > http [ACK] Seq=427 Ack=598556 Win=17520 Len=0
183287  61.591843 151.77.135.142 -> 244.3.160.239 TCP 64 12704 > http [ACK] Seq=427 Ack=601476 Win=17520 Len=0
183289  61.592151 151.77.135.142 -> 244.3.160.239 TCP 64 12704 > http [ACK] Seq=427 Ack=604396 Win=17520 Len=0
183294  61.595123 151.77.135.142 -> 244.3.160.239 TCP 64 12704 > http [ACK] Seq=427 Ack=607316 Win=17520 Len=0
183323  61.602688 151.77.135.142 -> 244.3.160.239 TCP 64 12704 > http [ACK] Seq=427 Ack=610236 Win=17520 Len=0
183328  61.605695 151.77.135.142 -> 244.3.160.239 TCP 64 12704 > http [ACK] Seq=427 Ack=613156 Win=17520 Len=0
183343  61.611140 151.77.135.142 -> 244.3.160.239 TCP 64 12704 > http [ACK] Seq=427 Ack=616076 Win=17520 Len=0
183344  61.611311 151.77.135.142 -> 244.3.160.239 TCP 64 12704 > http [ACK] Seq=427 Ack=618996 Win=17520 Len=0
183351  61.613169 151.77.135.142 -> 244.3.160.239 TCP 64 12704 > http [ACK] Seq=427 Ack=621916 Win=17520 Len=0
183357  61.616090 151.77.135.142 -> 244.3.160.239 TCP 64 12704 > http [ACK] Seq=427 Ack=624836 Win=17520 Len=0
183368  61.620465 151.77.135.142 -> 244.3.160.239 TCP 64 12704 > http [ACK] Seq=427 Ack=627756 Win=17520 Len=0
183386  61.624673 151.77.135.142 -> 244.3.160.239 TCP 64 12704 > http [ACK] Seq=427 Ack=630676 Win=17520 Len=0
183393  61.628751 151.77.135.142 -> 244.3.160.239 TCP 64 12704 > http [ACK] Seq=427 Ack=633596 Win=17520 Len=0
183396  61.629172 151.77.135.142 -> 244.3.160.239 TCP 64 12704 > http [ACK] Seq=427 Ack=636516 Win=17520 Len=0
183410  61.632084 151.77.135.142 -> 244.3.160.239 TCP 64 12704 > http [ACK] Seq=427 Ack=639436 Win=17520 Len=0
183421  61.637115 151.77.135.142 -> 244.3.160.239 TCP 64 12704 > http [ACK] Seq=427 Ack=642356 Win=17520 Len=0
183447  61.644246 151.77.135.142 -> 244.3.160.239 TCP 64 12704 > http [ACK] Seq=427 Ack=645276 Win=17520 Len=0
183471  61.647364 151.77.135.142 -> 244.3.160.239 TCP 64 12704 > http [ACK] Seq=427 Ack=648196 Win=17520 Len=0
183483  61.650420 151.77.135.142 -> 244.3.160.239 TCP 64 12704 > http [ACK] Seq=427 Ack=651116 Win=17520 Len=0
183492  61.653448 151.77.135.142 -> 244.3.160.239 TCP 64 12704 > http [ACK] Seq=427 Ack=654036 Win=17520 Len=0
183512  61.656364 151.77.135.142 -> 244.3.160.239 TCP 64 12704 > http [ACK] Seq=427 Ack=656956 Win=17520 Len=0
183518  61.659383 151.77.135.142 -> 244.3.160.239 TCP 64 12704 > http [ACK] Seq=427 Ack=659876 Win=17520 Len=0
183524  61.662511 151.77.135.142 -> 244.3.160.239 TCP 64 12704 > http [ACK] Seq=427 Ack=662796 Win=17520 Len=0
183539  61.667289 151.77.135.142 -> 244.3.160.239 TCP 64 12704 > http [ACK] Seq=427 Ack=665716 Win=17520 Len=0
183548  61.671240 151.77.135.142 -> 244.3.160.239 TCP 64 12704 > http [ACK] Seq=427 Ack=668636 Win=17520 Len=0
183570  61.675411 151.77.135.142 -> 244.3.160.239 TCP 64 12704 > http [ACK] Seq=427 Ack=671556 Win=17520 Len=0
183580  61.677198 151.77.135.142 -> 244.3.160.239 TCP 64 12704 > http [ACK] Seq=427 Ack=674476 Win=17520 Len=0
183599  61.681711 151.77.135.142 -> 244.3.160.239 TCP 64 12704 > http [ACK] Seq=427 Ack=677396 Win=17520 Len=0
183604  61.684746 151.77.135.142 -> 244.3.160.239 TCP 64 12704 > http [ACK] Seq=427 Ack=680316 Win=17520 Len=0
183612  61.687630 151.77.135.142 -> 244.3.160.239 TCP 64 12704 > http [ACK] Seq=427 Ack=683236 Win=17520 Len=0
183620  61.690746 151.77.135.142 -> 244.3.160.239 TCP 64 12704 > http [ACK] Seq=427 Ack=686156 Win=17520 Len=0
183636  61.693872 151.77.135.142 -> 244.3.160.239 TCP 64 12704 > http [ACK] Seq=427 Ack=689076 Win=17520 Len=0
183648  61.698366 151.77.135.142 -> 244.3.160.239 TCP 64 12704 > http [ACK] Seq=427 Ack=691996 Win=17520 Len=0
183651  61.699951 151.77.135.142 -> 244.3.160.239 TCP 64 12704 > http [ACK] Seq=427 Ack=694916 Win=17520 Len=0
183661  61.702972 151.77.135.142 -> 244.3.160.239 TCP 64 12704 > http [ACK] Seq=427 Ack=697836 Win=17520 Len=0
183691  61.711112 151.77.135.142 -> 244.3.160.239 TCP 64 12704 > http [ACK] Seq=427 Ack=700756 Win=17520 Len=0
183701  61.719570 151.77.135.142 -> 244.3.160.239 TCP 64 12704 > http [ACK] Seq=427 Ack=703676 Win=17520 Len=0
183704  61.721367 151.77.135.142 -> 244.3.160.239 TCP 64 12704 > http [ACK] Seq=427 Ack=706596 Win=17520 Len=0
183716  61.725735 151.77.135.142 -> 244.3.160.239 TCP 64 12704 > http [ACK] Seq=427 Ack=709516 Win=17520 Len=0
183720  61.728844 151.77.135.142 -> 244.3.160.239 TCP 64 12704 > http [ACK] Seq=427 Ack=712436 Win=17520 Len=0
183732  61.733164 151.77.135.142 -> 244.3.160.239 TCP 64 12704 > http [ACK] Seq=427 Ack=715356 Win=17520 Len=0
183739  61.737576 151.77.135.142 -> 244.3.160.239 TCP 64 12704 > http [ACK] Seq=427 Ack=718276 Win=17520 Len=0
183746  61.740494 151.77.135.142 -> 244.3.160.239 TCP 64 12704 > http [ACK] Seq=427 Ack=721196 Win=17520 Len=0
183756  61.743411 151.77.135.142 -> 244.3.160.239 TCP 64 12704 > http [ACK] Seq=427 Ack=724116 Win=17520 Len=0
183767  61.746528 151.77.135.142 -> 244.3.160.239 TCP 64 12704 > http [ACK] Seq=427 Ack=727036 Win=17520 Len=0
183789  61.753624 151.77.135.142 -> 244.3.160.239 TCP 64 12704 > http [ACK] Seq=427 Ack=729956 Win=17520 Len=0
183791  61.753983 151.77.135.142 -> 244.3.160.239 TCP 64 12704 > http [ACK] Seq=427 Ack=732876 Win=17520 Len=0
183797  61.758281 151.77.135.142 -> 244.3.160.239 TCP 64 12704 > http [ACK] Seq=427 Ack=735796 Win=17520 Len=0
183800  61.759863 151.77.135.142 -> 244.3.160.239 TCP 64 12704 > http [ACK] Seq=427 Ack=738716 Win=17520 Len=0
183806  61.764187 151.77.135.142 -> 244.3.160.239 TCP 64 12704 > http [ACK] Seq=427 Ack=741636 Win=17520 Len=0
183818  61.767768 151.77.135.142 -> 244.3.160.239 TCP 64 12704 > http [ACK] Seq=427 Ack=744556 Win=17520 Len=0
183827  61.770693 151.77.135.142 -> 244.3.160.239 TCP 64 12704 > http [ACK] Seq=427 Ack=747476 Win=17520 Len=0
183836  61.773685 151.77.135.142 -> 244.3.160.239 TCP 64 12704 > http [ACK] Seq=427 Ack=750396 Win=17520 Len=0
183845  61.778101 151.77.135.142 -> 244.3.160.239 TCP 64 12704 > http [ACK] Seq=427 Ack=753316 Win=17520 Len=0
183852  61.781160 151.77.135.142 -> 244.3.160.239 TCP 64 12704 > http [ACK] Seq=427 Ack=756236 Win=17520 Len=0
183865  61.785601 151.77.135.142 -> 244.3.160.239 TCP 64 12704 > http [ACK] Seq=427 Ack=759156 Win=17520 Len=0
183880  61.795598 151.77.135.142 -> 244.3.160.239 TCP 64 12704 > http [ACK] Seq=427 Ack=762076 Win=17520 Len=0
183883  61.798389 151.77.135.142 -> 244.3.160.239 TCP 64 12704 > http [ACK] Seq=427 Ack=764996 Win=17520 Len=0
183913  61.806717 151.77.135.142 -> 244.3.160.239 TCP 64 12704 > http [ACK] Seq=427 Ack=767916 Win=17520 Len=0
183914  61.806879 151.77.135.142 -> 244.3.160.239 TCP 64 12704 > http [ACK] Seq=427 Ack=770836 Win=17520 Len=0
183923  61.811718 151.77.135.142 -> 244.3.160.239 TCP 64 12704 > http [ACK] Seq=427 Ack=773756 Win=17520 Len=0
183924  61.811929 151.77.135.142 -> 244.3.160.239 TCP 64 12704 > http [ACK] Seq=427 Ack=776676 Win=17520 Len=0
183936  61.816166 151.77.135.142 -> 244.3.160.239 TCP 64 12704 > http [ACK] Seq=427 Ack=779596 Win=17520 Len=0
183940  61.817874 151.77.135.142 -> 244.3.160.239 TCP 64 12704 > http [ACK] Seq=427 Ack=782516 Win=17520 Len=0
184172  61.881802 151.77.135.142 -> 244.3.160.239 TCP 64 12704 > http [ACK] Seq=427 Ack=785436 Win=17520 Len=0
184189  61.884734 151.77.135.142 -> 244.3.160.239 TCP 64 12704 > http [ACK] Seq=427 Ack=788356 Win=17520 Len=0
184201  61.887667 151.77.135.142 -> 244.3.160.239 TCP 64 12704 > http [ACK] Seq=427 Ack=791276 Win=17520 Len=0
184210  61.892067 151.77.135.142 -> 244.3.160.239 TCP 64 12704 > http [ACK] Seq=427 Ack=794196 Win=17520 Len=0
184222  61.894901 151.77.135.142 -> 244.3.160.239 TCP 64 12704 > http [ACK] Seq=427 Ack=797116 Win=17520 Len=0
184225  61.895307 151.77.135.142 -> 244.3.160.239 TCP 64 12704 > http [ACK] Seq=427 Ack=800036 Win=17520 Len=0
184241  61.922723 151.77.135.142 -> 244.3.160.239 TCP 64 12704 > http [ACK] Seq=427 Ack=802956 Win=17520 Len=0
184247  61.929425 151.77.135.142 -> 244.3.160.239 TCP 64 12704 > http [ACK] Seq=427 Ack=805876 Win=17520 Len=0
184253  61.932329 151.77.135.142 -> 244.3.160.239 TCP 64 12704 > http [ACK] Seq=427 Ack=808796 Win=17520 Len=0
184263  61.932744 151.77.135.142 -> 244.3.160.239 TCP 64 12704 > http [ACK] Seq=427 Ack=811716 Win=17520 Len=0
184277  61.936886 151.77.135.142 -> 244.3.160.239 TCP 64 12704 > http [ACK] Seq=427 Ack=814636 Win=17520 Len=0
184280  61.939779 151.77.135.142 -> 244.3.160.239 TCP 64 12704 > http [ACK] Seq=427 Ack=817556 Win=17520 Len=0
184291  61.942845 151.77.135.142 -> 244.3.160.239 TCP 64 12704 > http [ACK] Seq=427 Ack=820476 Win=17520 Len=0
184299  61.947371 151.77.135.142 -> 244.3.160.239 TCP 64 12704 > http [ACK] Seq=427 Ack=823396 Win=17520 Len=0
184304  61.951810 151.77.135.142 -> 244.3.160.239 TCP 64 12704 > http [ACK] Seq=427 Ack=826316 Win=17520 Len=0
184308  61.953620 151.77.135.142 -> 244.3.160.239 TCP 64 12704 > http [ACK] Seq=427 Ack=829236 Win=17520 Len=0
184315  61.955238 151.77.135.142 -> 244.3.160.239 TCP 64 12704 > http [ACK] Seq=427 Ack=832156 Win=17520 Len=0
184335  61.961295 151.77.135.142 -> 244.3.160.239 TCP 64 12704 > http [ACK] Seq=427 Ack=835076 Win=17520 Len=0
184347  61.963061 151.77.135.142 -> 244.3.160.239 TCP 64 12704 > http [ACK] Seq=427 Ack=837996 Win=17520 Len=0
184366  61.968878 151.77.135.142 -> 244.3.160.239 TCP 64 12704 > http [ACK] Seq=427 Ack=840916 Win=17520 Len=0
184370  61.973783 151.77.135.142 -> 244.3.160.239 TCP 64 12704 > http [ACK] Seq=427 Ack=843836 Win=17520 Len=0
184401  61.978382 151.77.135.142 -> 244.3.160.239 TCP 64 12704 > http [ACK] Seq=427 Ack=846756 Win=17520 Len=0
184416  61.984752 151.77.135.142 -> 244.3.160.239 TCP 64 12704 > http [ACK] Seq=427 Ack=849676 Win=17520 Len=0
184424  61.990166 151.77.135.142 -> 244.3.160.239 TCP 64 12704 > http [ACK] Seq=427 Ack=852596 Win=17520 Len=0
184429  61.995862 151.77.135.142 -> 244.3.160.239 TCP 64 12704 > http [ACK] Seq=427 Ack=855516 Win=17520 Len=0
184438  62.000255 151.77.135.142 -> 244.3.160.239 TCP 64 12704 > http [ACK] Seq=427 Ack=858436 Win=17520 Len=0
184441  62.002055 151.77.135.142 -> 244.3.160.239 TCP 64 12704 > http [ACK] Seq=427 Ack=861356 Win=17520 Len=0
184472  62.008866 151.77.135.142 -> 244.3.160.239 TCP 64 12704 > http [ACK] Seq=427 Ack=864276 Win=17520 Len=0
184475  62.009392 151.77.135.142 -> 244.3.160.239 TCP 64 12704 > http [ACK] Seq=427 Ack=867196 Win=17520 Len=0
184478  62.015655 151.77.135.142 -> 244.3.160.239 TCP 64 12704 > http [ACK] Seq=427 Ack=870116 Win=17520 Len=0
184481  62.017434 151.77.135.142 -> 244.3.160.239 TCP 64 12704 > http [ACK] Seq=427 Ack=872092 Win=17520 Len=0
184508  62.022626 151.77.135.142 -> 244.3.160.239 TCP 64 12704 > http [ACK] Seq=427 Ack=874852 Win=17520 Len=0
184511  62.024263 151.77.135.142 -> 244.3.160.239 TCP 64 12704 > http [ACK] Seq=427 Ack=877612 Win=17520 Len=0
184533  62.029544 151.77.135.142 -> 244.3.160.239 TCP 64 12704 > http [ACK] Seq=427 Ack=880372 Win=17520 Len=0
184537  62.031625 151.77.135.142 -> 244.3.160.239 TCP 64 12704 > http [ACK] Seq=427 Ack=883292 Win=17520 Len=0
184543  62.035125 151.77.135.142 -> 244.3.160.239 TCP 64 12704 > http [ACK] Seq=427 Ack=886212 Win=17520 Len=0
184546  62.035427 151.77.135.142 -> 244.3.160.239 TCP 64 12704 > http [ACK] Seq=427 Ack=889132 Win=17520 Len=0
184553  62.037082 151.77.135.142 -> 244.3.160.239 TCP 64 12704 > http [ACK] Seq=427 Ack=892052 Win=17520 Len=0
184557  62.041420 151.77.135.142 -> 244.3.160.239 TCP 64 12704 > http [ACK] Seq=427 Ack=894972 Win=17520 Len=0
184564  62.047151 151.77.135.142 -> 244.3.160.239 TCP 64 12704 > http [ACK] Seq=427 Ack=897892 Win=17520 Len=0
184567  62.048628 151.77.135.142 -> 244.3.160.239 TCP 64 12704 > http [ACK] Seq=427 Ack=900812 Win=17520 Len=0
184570  62.049103 151.77.135.142 -> 244.3.160.239 TCP 64 12704 > http [ACK] Seq=427 Ack=903732 Win=17520 Len=0
184583  62.056214 151.77.135.142 -> 244.3.160.239 TCP 64 12704 > http [ACK] Seq=427 Ack=906652 Win=17520 Len=0
184586  62.059158 151.77.135.142 -> 244.3.160.239 TCP 64 12704 > http [ACK] Seq=427 Ack=909572 Win=17520 Len=0
184616  62.062404 151.77.135.142 -> 244.3.160.239 TCP 64 12704 > http [ACK] Seq=427 Ack=912492 Win=17520 Len=0
184617  62.068086 151.77.135.142 -> 244.3.160.239 TCP 64 12704 > http [ACK] Seq=427 Ack=915412 Win=17520 Len=0
184618  62.068307 151.77.135.142 -> 244.3.160.239 TCP 64 12704 > http [ACK] Seq=427 Ack=918332 Win=17520 Len=0
184674  62.074513 151.77.135.142 -> 244.3.160.239 TCP 64 12704 > http [ACK] Seq=427 Ack=921252 Win=17520 Len=0
184680  62.075148 151.77.135.142 -> 244.3.160.239 TCP 64 12704 > http [ACK] Seq=427 Ack=924112 Win=17520 Len=0
184686  62.076349 151.77.135.142 -> 244.3.160.239 TCP 64 12704 > http [FIN, ACK] Seq=427 Ack=924112 Win=17520 Len=0
185186  62.144389 151.77.135.142 -> 244.3.160.239 TCP 64 12704 > http [ACK] Seq=428 Ack=924113 Win=17520 Len=0
