195691  67.274521  151.24.45.2 -> 41.177.26.176 TCP 66 54771 > http [SYN] Seq=0 Win=16384 Len=0 MSS=1300 SACK_PERM=1
196441  67.428499  151.24.45.2 -> 41.177.26.176 TCP 64 54771 > http [ACK] Seq=1 Ack=1 Win=16900 Len=0
198490  68.184761  151.24.45.2 -> 41.177.26.176 TCP 70 [TCP Dup ACK 196523#1] 54771 > http [ACK] Seq=633 Ack=1 Win=16900 Len=0 SLE=678 SRE=1978
198492  68.186567  151.24.45.2 -> 41.177.26.176 TCP 70 [TCP Dup ACK 196523#2] 54771 > http [ACK] Seq=633 Ack=1 Win=16900 Len=0 SLE=678 SRE=3278
198494  68.189243  151.24.45.2 -> 41.177.26.176 TCP 64 54771 > http [ACK] Seq=633 Ack=3278 Win=16900 Len=0
198865  68.349534  151.24.45.2 -> 41.177.26.176 TCP 64 54771 > http [ACK] Seq=633 Ack=5548 Win=16900 Len=0
199130  68.469383  151.24.45.2 -> 41.177.26.176 TCP 64 54771 > http [ACK] Seq=633 Ack=6292 Win=16156 Len=0
239780  83.260464  151.24.45.2 -> 41.177.26.176 TCP 64 54771 > http [ACK] Seq=633 Ack=6293 Win=16156 Len=0
256249  91.133269  151.24.45.2 -> 41.177.26.176 TCP 64 54771 > http [FIN, ACK] Seq=633 Ack=6293 Win=16156 Len=0
