389299 130.006161 153.160.160.108 -> 244.3.210.197 TCP 82 12230 > http [SYN] Seq=0 Win=16384 Len=0 MSS=1460 SACK_PERM=1 WS=1 TSval=34146481 TSecr=0
389306 130.006376 153.160.160.108 -> 244.3.210.197 TCP 82 12231 > http [SYN] Seq=0 Win=16384 Len=0 MSS=1460 SACK_PERM=1 WS=1 TSval=34146481 TSecr=0
389419 130.081186 153.160.160.108 -> 244.3.210.197 TCP 70 12231 > http [ACK] Seq=1 Ack=1 Win=17520 Len=0 TSval=34146489 TSecr=0
389422 130.081314 153.160.160.108 -> 244.3.210.197 TCP 70 12230 > http [ACK] Seq=1 Ack=1 Win=17520 Len=0 TSval=34146489 TSecr=0
389593 130.158818 153.160.160.108 -> 244.3.210.197 TCP 70 12231 > http [ACK] Seq=464 Ack=2897 Win=17520 Len=0 TSval=34146496 TSecr=150407916
389622 130.168410 153.160.160.108 -> 244.3.210.197 TCP 70 12230 > http [ACK] Seq=479 Ack=2897 Win=17520 Len=0 TSval=34146497 TSecr=150407916
389751 130.234106 153.160.160.108 -> 244.3.210.197 TCP 70 12231 > http [ACK] Seq=464 Ack=3343 Win=17074 Len=0 TSval=34146504 TSecr=150407917
389776 130.244024 153.160.160.108 -> 244.3.210.197 TCP 70 12230 > http [ACK] Seq=479 Ack=5793 Win=17520 Len=0 TSval=34146505 TSecr=150407917
389999 130.319607 153.160.160.108 -> 244.3.210.197 TCP 70 12230 > http [ACK] Seq=479 Ack=8689 Win=17520 Len=0 TSval=34146513 TSecr=150407917
390000 130.319612 153.160.160.108 -> 244.3.210.197 TCP 70 12230 > http [ACK] Seq=479 Ack=11585 Win=17520 Len=0 TSval=34146513 TSecr=150407918
390015 130.320436 153.160.160.108 -> 244.3.210.197 TCP 70 12231 > http [ACK] Seq=943 Ack=6239 Win=17520 Len=0 TSval=34146513 TSecr=150407918
390016 130.320441 153.160.160.108 -> 244.3.210.197 TCP 70 12231 > http [ACK] Seq=943 Ack=9135 Win=17520 Len=0 TSval=34146513 TSecr=150407918
390231 130.394975 153.160.160.108 -> 244.3.210.197 TCP 70 12230 > http [ACK] Seq=479 Ack=12447 Win=16658 Len=0 TSval=34146520 TSecr=150407918
390237 130.395592 153.160.160.108 -> 244.3.210.197 TCP 70 12231 > http [ACK] Seq=943 Ack=11181 Win=16922 Len=0 TSval=34146520 TSecr=150407918
390423 130.479451 153.160.160.108 -> 244.3.210.197 TCP 70 12231 > http [ACK] Seq=1416 Ack=14077 Win=17520 Len=0 TSval=34146529 TSecr=150407919
390424 130.479456 153.160.160.108 -> 244.3.210.197 TCP 70 12231 > http [ACK] Seq=1416 Ack=16973 Win=17520 Len=0 TSval=34146529 TSecr=150407919
390425 130.479460 153.160.160.108 -> 244.3.210.197 TCP 70 12231 > http [ACK] Seq=1416 Ack=17698 Win=16795 Len=0 TSval=34146529 TSecr=150407919
391321 130.765558 153.160.160.108 -> 244.3.210.197 TCP 70 12230 > http [ACK] Seq=1036 Ack=12842 Win=17125 Len=0 TSval=34146557 TSecr=150407922
419089 139.091164 153.160.160.108 -> 244.3.210.197 TCP 70 12230 > http [ACK] Seq=1840 Ack=15738 Win=17520 Len=0 TSval=34147390 TSecr=150408005
419104 139.091399 153.160.160.108 -> 244.3.210.197 TCP 70 12230 > http [ACK] Seq=1840 Ack=18634 Win=17520 Len=0 TSval=34147390 TSecr=150408005
419105 139.091403 153.160.160.108 -> 244.3.210.197 TCP 70 12230 > http [ACK] Seq=1840 Ack=21530 Win=17520 Len=0 TSval=34147390 TSecr=150408005
419106 139.091407 153.160.160.108 -> 244.3.210.197 TCP 70 12230 > http [ACK] Seq=1840 Ack=24426 Win=17520 Len=0 TSval=34147390 TSecr=150408005
420282 139.166657 153.160.160.108 -> 244.3.210.197 TCP 70 12230 > http [ACK] Seq=1840 Ack=27322 Win=17520 Len=0 TSval=34147398 TSecr=150408006
420283 139.166661 153.160.160.108 -> 244.3.210.197 TCP 70 12230 > http [ACK] Seq=1840 Ack=30218 Win=17520 Len=0 TSval=34147398 TSecr=150408006
420284 139.166665 153.160.160.108 -> 244.3.210.197 TCP 70 12230 > http [ACK] Seq=1840 Ack=30539 Win=17199 Len=0 TSval=34147398 TSecr=150408006
421008 139.223282 153.160.160.108 -> 244.3.210.197 TCP 70 12231 > http [ACK] Seq=2294 Ack=20594 Win=17520 Len=0 TSval=34147404 TSecr=150408006
421009 139.223287 153.160.160.108 -> 244.3.210.197 TCP 70 12231 > http [ACK] Seq=2294 Ack=23490 Win=17520 Len=0 TSval=34147404 TSecr=150408006
421010 139.223291 153.160.160.108 -> 244.3.210.197 TCP 70 12231 > http [ACK] Seq=2294 Ack=26386 Win=17520 Len=0 TSval=34147404 TSecr=150408006
421011 139.223295 153.160.160.108 -> 244.3.210.197 TCP 70 12231 > http [ACK] Seq=2294 Ack=28079 Win=17275 Len=0 TSval=34147404 TSecr=150408006
421767 139.273655 153.160.160.108 -> 244.3.210.197 TCP 70 12230 > http [ACK] Seq=2708 Ack=33435 Win=17520 Len=0 TSval=34147409 TSecr=150408007
421770 139.273932 153.160.160.108 -> 244.3.210.197 TCP 70 12230 > http [ACK] Seq=2708 Ack=36331 Win=17520 Len=0 TSval=34147409 TSecr=150408007
421771 139.273940 153.160.160.108 -> 244.3.210.197 TCP 70 12230 > http [ACK] Seq=2708 Ack=39227 Win=17520 Len=0 TSval=34147409 TSecr=150408007
421772 139.274001 153.160.160.108 -> 244.3.210.197 TCP 70 12230 > http [ACK] Seq=2708 Ack=42123 Win=17520 Len=0 TSval=34147409 TSecr=150408007
421791 139.274190 153.160.160.108 -> 244.3.210.197 TCP 70 12230 > http [ACK] Seq=2708 Ack=45019 Win=17520 Len=0 TSval=34147409 TSecr=150408007
421792 139.274194 153.160.160.108 -> 244.3.210.197 TCP 70 12230 > http [ACK] Seq=2708 Ack=47915 Win=17520 Len=0 TSval=34147409 TSecr=150408007
422404 139.314833 153.160.160.108 -> 244.3.210.197 TCP 70 12231 > http [ACK] Seq=3168 Ack=31444 Win=14155 Len=0 TSval=34147413 TSecr=150408007
422412 139.315070 153.160.160.108 -> 244.3.210.197 TCP 70 [TCP Window Update] 12231 > http [ACK] Seq=3168 Ack=31444 Win=17520 Len=0 TSval=34147413 TSecr=150408007
422951 139.349626 153.160.160.108 -> 244.3.210.197 TCP 70 12230 > http [ACK] Seq=2708 Ack=50811 Win=17520 Len=0 TSval=34147416 TSecr=150408007
422952 139.349631 153.160.160.108 -> 244.3.210.197 TCP 70 12230 > http [ACK] Seq=2708 Ack=53707 Win=17520 Len=0 TSval=34147416 TSecr=150408007
422980 139.350286 153.160.160.108 -> 244.3.210.197 TCP 70 12230 > http [ACK] Seq=2708 Ack=56603 Win=17520 Len=0 TSval=34147416 TSecr=150408007
422981 139.350290 153.160.160.108 -> 244.3.210.197 TCP 70 12230 > http [ACK] Seq=2708 Ack=59499 Win=17520 Len=0 TSval=34147416 TSecr=150408007
422982 139.350295 153.160.160.108 -> 244.3.210.197 TCP 70 12230 > http [ACK] Seq=2708 Ack=62395 Win=17520 Len=0 TSval=34147416 TSecr=150408007
422983 139.350299 153.160.160.108 -> 244.3.210.197 TCP 70 12230 > http [ACK] Seq=2708 Ack=64781 Win=15134 Len=0 TSval=34147416 TSecr=150408007
424279 139.473745 153.160.160.108 -> 244.3.210.197 TCP 70 12230 > http [ACK] Seq=3585 Ack=67677 Win=17520 Len=0 TSval=34147429 TSecr=150408009
424280 139.473750 153.160.160.108 -> 244.3.210.197 TCP 70 12230 > http [ACK] Seq=3585 Ack=68082 Win=17115 Len=0 TSval=34147429 TSecr=150408009
424497 139.493149 153.160.160.108 -> 244.3.210.197 TCP 70 12231 > http [ACK] Seq=4045 Ack=34340 Win=17520 Len=0 TSval=34147431 TSecr=150408009
424498 139.493153 153.160.160.108 -> 244.3.210.197 TCP 70 12231 > http [ACK] Seq=4045 Ack=37236 Win=17520 Len=0 TSval=34147431 TSecr=150408009
424499 139.493157 153.160.160.108 -> 244.3.210.197 TCP 70 12231 > http [ACK] Seq=4045 Ack=40132 Win=17520 Len=0 TSval=34147431 TSecr=150408009
424526 139.493619 153.160.160.108 -> 244.3.210.197 TCP 70 12231 > http [ACK] Seq=4045 Ack=43028 Win=17520 Len=0 TSval=34147431 TSecr=150408009
424527 139.493624 153.160.160.108 -> 244.3.210.197 TCP 70 12231 > http [ACK] Seq=4045 Ack=45924 Win=17520 Len=0 TSval=34147431 TSecr=150408009
424528 139.493628 153.160.160.108 -> 244.3.210.197 TCP 70 12231 > http [ACK] Seq=4045 Ack=48820 Win=17520 Len=0 TSval=34147431 TSecr=150408009
424956 139.568363 153.160.160.108 -> 244.3.210.197 TCP 70 12231 > http [ACK] Seq=4045 Ack=51716 Win=17520 Len=0 TSval=34147438 TSecr=150408010
424965 139.568582 153.160.160.108 -> 244.3.210.197 TCP 70 12231 > http [ACK] Seq=4045 Ack=54612 Win=17520 Len=0 TSval=34147438 TSecr=150408010
424966 139.568586 153.160.160.108 -> 244.3.210.197 TCP 70 12231 > http [ACK] Seq=4045 Ack=57508 Win=17520 Len=0 TSval=34147438 TSecr=150408010
424985 139.568981 153.160.160.108 -> 244.3.210.197 TCP 70 12231 > http [ACK] Seq=4045 Ack=60404 Win=17520 Len=0 TSval=34147438 TSecr=150408010
424986 139.568984 153.160.160.108 -> 244.3.210.197 TCP 70 12231 > http [ACK] Seq=4045 Ack=63300 Win=17520 Len=0 TSval=34147438 TSecr=150408010
425006 139.569766 153.160.160.108 -> 244.3.210.197 TCP 70 12231 > http [ACK] Seq=4045 Ack=66196 Win=17520 Len=0 TSval=34147438 TSecr=150408010
425282 139.644011 153.160.160.108 -> 244.3.210.197 TCP 70 12231 > http [ACK] Seq=4045 Ack=69092 Win=17520 Len=0 TSval=34147446 TSecr=150408010
425283 139.644015 153.160.160.108 -> 244.3.210.197 TCP 70 12231 > http [ACK] Seq=4045 Ack=71988 Win=17520 Len=0 TSval=34147446 TSecr=150408010
425284 139.644020 153.160.160.108 -> 244.3.210.197 TCP 70 12231 > http [ACK] Seq=4045 Ack=74884 Win=17520 Len=0 TSval=34147446 TSecr=150408010
425285 139.644037 153.160.160.108 -> 244.3.210.197 TCP 70 12231 > http [ACK] Seq=4045 Ack=77780 Win=17520 Len=0 TSval=34147446 TSecr=150408010
425286 139.644041 153.160.160.108 -> 244.3.210.197 TCP 70 12231 > http [ACK] Seq=4045 Ack=80676 Win=17520 Len=0 TSval=34147446 TSecr=150408010
425334 139.644941 153.160.160.108 -> 244.3.210.197 TCP 70 12231 > http [ACK] Seq=4045 Ack=83572 Win=17520 Len=0 TSval=34147446 TSecr=150408010
425646 139.719379 153.160.160.108 -> 244.3.210.197 TCP 70 12231 > http [ACK] Seq=4045 Ack=86468 Win=17520 Len=0 TSval=34147453 TSecr=150408011
425647 139.719384 153.160.160.108 -> 244.3.210.197 TCP 70 12231 > http [ACK] Seq=4045 Ack=89364 Win=17520 Len=0 TSval=34147453 TSecr=150408011
425658 139.719608 153.160.160.108 -> 244.3.210.197 TCP 70 12231 > http [ACK] Seq=4045 Ack=92260 Win=17520 Len=0 TSval=34147453 TSecr=150408011
425659 139.719613 153.160.160.108 -> 244.3.210.197 TCP 70 12231 > http [ACK] Seq=4045 Ack=95156 Win=17520 Len=0 TSval=34147453 TSecr=150408011
425660 139.719617 153.160.160.108 -> 244.3.210.197 TCP 70 12231 > http [ACK] Seq=4045 Ack=98052 Win=17520 Len=0 TSval=34147453 TSecr=150408011
425688 139.720892 153.160.160.108 -> 244.3.210.197 TCP 70 12231 > http [ACK] Seq=4045 Ack=100948 Win=17520 Len=0 TSval=34147453 TSecr=150408011
426067 139.794626 153.160.160.108 -> 244.3.210.197 TCP 70 12231 > http [ACK] Seq=4045 Ack=103844 Win=17520 Len=0 TSval=34147461 TSecr=150408012
426078 139.795026 153.160.160.108 -> 244.3.210.197 TCP 70 12231 > http [ACK] Seq=4045 Ack=106740 Win=17520 Len=0 TSval=34147461 TSecr=150408012
426079 139.795031 153.160.160.108 -> 244.3.210.197 TCP 70 12231 > http [ACK] Seq=4045 Ack=109636 Win=17520 Len=0 TSval=34147461 TSecr=150408012
426080 139.795034 153.160.160.108 -> 244.3.210.197 TCP 70 12231 > http [ACK] Seq=4045 Ack=112532 Win=17520 Len=0 TSval=34147461 TSecr=150408012
426081 139.795038 153.160.160.108 -> 244.3.210.197 TCP 70 12231 > http [ACK] Seq=4045 Ack=115428 Win=17520 Len=0 TSval=34147461 TSecr=150408012
426135 139.796513 153.160.160.108 -> 244.3.210.197 TCP 70 12231 > http [ACK] Seq=4045 Ack=118324 Win=17520 Len=0 TSval=34147461 TSecr=150408012
426516 139.869955 153.160.160.108 -> 244.3.210.197 TCP 70 12231 > http [ACK] Seq=4045 Ack=121220 Win=17520 Len=0 TSval=34147468 TSecr=150408013
426524 139.870230 153.160.160.108 -> 244.3.210.197 TCP 70 12231 > http [ACK] Seq=4045 Ack=124116 Win=17520 Len=0 TSval=34147468 TSecr=150408013
426525 139.870235 153.160.160.108 -> 244.3.210.197 TCP 70 12231 > http [ACK] Seq=4045 Ack=127012 Win=17520 Len=0 TSval=34147468 TSecr=150408013
426532 139.870460 153.160.160.108 -> 244.3.210.197 TCP 70 12231 > http [ACK] Seq=4045 Ack=129908 Win=17520 Len=0 TSval=34147468 TSecr=150408013
426533 139.870464 153.160.160.108 -> 244.3.210.197 TCP 70 12231 > http [ACK] Seq=4045 Ack=132804 Win=17520 Len=0 TSval=34147468 TSecr=150408013
426556 139.871608 153.160.160.108 -> 244.3.210.197 TCP 70 12231 > http [ACK] Seq=4045 Ack=135700 Win=17520 Len=0 TSval=34147468 TSecr=150408013
426860 139.945029 153.160.160.108 -> 244.3.210.197 TCP 70 12231 > http [ACK] Seq=4045 Ack=138596 Win=17520 Len=0 TSval=34147476 TSecr=150408013
426871 139.945690 153.160.160.108 -> 244.3.210.197 TCP 70 12231 > http [ACK] Seq=4045 Ack=141492 Win=17520 Len=0 TSval=34147476 TSecr=150408013
426873 139.945739 153.160.160.108 -> 244.3.210.197 TCP 70 12231 > http [ACK] Seq=4045 Ack=144388 Win=17520 Len=0 TSval=34147476 TSecr=150408013
426874 139.945748 153.160.160.108 -> 244.3.210.197 TCP 70 12231 > http [ACK] Seq=4045 Ack=147284 Win=17520 Len=0 TSval=34147476 TSecr=150408013
426875 139.945752 153.160.160.108 -> 244.3.210.197 TCP 70 12231 > http [ACK] Seq=4045 Ack=150180 Win=17520 Len=0 TSval=34147476 TSecr=150408013
426914 139.946749 153.160.160.108 -> 244.3.210.197 TCP 70 12231 > http [ACK] Seq=4045 Ack=153076 Win=17520 Len=0 TSval=34147476 TSecr=150408013
427370 140.020862 153.160.160.108 -> 244.3.210.197 TCP 70 12231 > http [ACK] Seq=4045 Ack=155972 Win=17520 Len=0 TSval=34147483 TSecr=150408014
427378 140.021264 153.160.160.108 -> 244.3.210.197 TCP 70 12231 > http [ACK] Seq=4045 Ack=158868 Win=17520 Len=0 TSval=34147484 TSecr=150408014
427379 140.021269 153.160.160.108 -> 244.3.210.197 TCP 70 12231 > http [ACK] Seq=4045 Ack=161764 Win=17520 Len=0 TSval=34147484 TSecr=150408014
427380 140.021306 153.160.160.108 -> 244.3.210.197 TCP 70 12231 > http [ACK] Seq=4045 Ack=164660 Win=17520 Len=0 TSval=34147484 TSecr=150408014
427381 140.021310 153.160.160.108 -> 244.3.210.197 TCP 70 12231 > http [ACK] Seq=4045 Ack=165769 Win=16411 Len=0 TSval=34147484 TSecr=150408014
428184 140.163773 153.160.160.108 -> 244.3.210.197 TCP 70 12231 > http [ACK] Seq=4926 Ack=168438 Win=14851 Len=0 TSval=34147498 TSecr=150408015
428527 140.262857 153.160.160.108 -> 244.3.210.197 TCP 70 12231 > http [ACK] Seq=5801 Ack=173342 Win=12616 Len=0 TSval=34147508 TSecr=150408016
428528 140.262863 153.160.160.108 -> 244.3.210.197 TCP 70 [TCP Window Update] 12231 > http [ACK] Seq=5801 Ack=173342 Win=17520 Len=0 TSval=34147508 TSecr=150408016
428539 140.264161 153.160.160.108 -> 244.3.210.197 TCP 70 12230 > http [ACK] Seq=4460 Ack=75322 Win=17520 Len=0 TSval=34147508 TSecr=150408016
428540 140.264166 153.160.160.108 -> 244.3.210.197 TCP 70 12230 > http [ACK] Seq=4460 Ack=78218 Win=17520 Len=0 TSval=34147508 TSecr=150408016
428541 140.264170 153.160.160.108 -> 244.3.210.197 TCP 70 12230 > http [ACK] Seq=4460 Ack=81114 Win=17520 Len=0 TSval=34147508 TSecr=150408016
428542 140.264174 153.160.160.108 -> 244.3.210.197 TCP 70 12230 > http [ACK] Seq=4460 Ack=84010 Win=17520 Len=0 TSval=34147508 TSecr=150408016
428870 140.339967 153.160.160.108 -> 244.3.210.197 TCP 70 12230 > http [ACK] Seq=4460 Ack=86906 Win=17520 Len=0 TSval=34147515 TSecr=150408016
428871 140.339971 153.160.160.108 -> 244.3.210.197 TCP 70 12230 > http [ACK] Seq=4460 Ack=89802 Win=17520 Len=0 TSval=34147515 TSecr=150408017
428872 140.339975 153.160.160.108 -> 244.3.210.197 TCP 70 12230 > http [ACK] Seq=4460 Ack=92698 Win=17520 Len=0 TSval=34147515 TSecr=150408017
428873 140.339979 153.160.160.108 -> 244.3.210.197 TCP 70 12230 > http [ACK] Seq=4460 Ack=95594 Win=17520 Len=0 TSval=34147515 TSecr=150408017
428874 140.339983 153.160.160.108 -> 244.3.210.197 TCP 70 12230 > http [ACK] Seq=4460 Ack=98490 Win=17520 Len=0 TSval=34147515 TSecr=150408017
428875 140.339988 153.160.160.108 -> 244.3.210.197 TCP 70 12230 > http [ACK] Seq=4460 Ack=101386 Win=17520 Len=0 TSval=34147515 TSecr=150408017
428983 140.351941 153.160.160.108 -> 244.3.210.197 TCP 70 12231 > http [ACK] Seq=6677 Ack=180582 Win=17520 Len=0 TSval=34147517 TSecr=150408017
428995 140.352157 153.160.160.108 -> 244.3.210.197 TCP 70 12231 > http [ACK] Seq=6677 Ack=183478 Win=17520 Len=0 TSval=34147517 TSecr=150408017
428996 140.352161 153.160.160.108 -> 244.3.210.197 TCP 70 12231 > http [ACK] Seq=6677 Ack=186374 Win=17520 Len=0 TSval=34147517 TSecr=150408017
428997 140.352165 153.160.160.108 -> 244.3.210.197 TCP 70 12231 > http [ACK] Seq=6677 Ack=189270 Win=17520 Len=0 TSval=34147517 TSecr=150408017
429271 140.415417 153.160.160.108 -> 244.3.210.197 TCP 70 12230 > http [ACK] Seq=4460 Ack=104282 Win=17520 Len=0 TSval=34147523 TSecr=150408018
429272 140.415421 153.160.160.108 -> 244.3.210.197 TCP 70 12230 > http [ACK] Seq=4460 Ack=106225 Win=17025 Len=0 TSval=34147523 TSecr=150408018
429341 140.427271 153.160.160.108 -> 244.3.210.197 TCP 70 12231 > http [ACK] Seq=6677 Ack=192166 Win=17520 Len=0 TSval=34147524 TSecr=150408017
429342 140.427275 153.160.160.108 -> 244.3.210.197 TCP 70 12231 > http [ACK] Seq=6677 Ack=195062 Win=17520 Len=0 TSval=34147524 TSecr=150408018
429343 140.427279 153.160.160.108 -> 244.3.210.197 TCP 70 12231 > http [ACK] Seq=6677 Ack=197958 Win=17520 Len=0 TSval=34147524 TSecr=150408018
429350 140.427476 153.160.160.108 -> 244.3.210.197 TCP 70 12231 > http [ACK] Seq=6677 Ack=200854 Win=17520 Len=0 TSval=34147524 TSecr=150408018
429351 140.427480 153.160.160.108 -> 244.3.210.197 TCP 70 12231 > http [ACK] Seq=6677 Ack=203750 Win=17520 Len=0 TSval=34147524 TSecr=150408018
429353 140.427510 153.160.160.108 -> 244.3.210.197 TCP 70 12231 > http [ACK] Seq=6677 Ack=204254 Win=17016 Len=0 TSval=34147524 TSecr=150408018
429796 140.510342 153.160.160.108 -> 244.3.210.197 TCP 70 12231 > http [ACK] Seq=7553 Ack=215838 Win=17520 Len=0 TSval=34147532 TSecr=150408019
429797 140.510347 153.160.160.108 -> 244.3.210.197 TCP 70 12231 > http [ACK] Seq=7553 Ack=218734 Win=17520 Len=0 TSval=34147532 TSecr=150408019
429815 140.510642 153.160.160.108 -> 244.3.210.197 TCP 70 12231 > http [ACK] Seq=7553 Ack=221630 Win=17520 Len=0 TSval=34147532 TSecr=150408019
429856 140.522759 153.160.160.108 -> 244.3.210.197 TCP 70 12230 > http [ACK] Seq=5334 Ack=116894 Win=6851 Len=0 TSval=34147534 TSecr=150408019
429862 140.523019 153.160.160.108 -> 244.3.210.197 TCP 70 [TCP Window Update] 12230 > http [ACK] Seq=5334 Ack=116894 Win=17520 Len=0 TSval=34147534 TSecr=150408019
430089 140.585600 153.160.160.108 -> 244.3.210.197 TCP 70 12231 > http [ACK] Seq=7553 Ack=224526 Win=17520 Len=0 TSval=34147540 TSecr=150408020
430090 140.585605 153.160.160.108 -> 244.3.210.197 TCP 70 12231 > http [ACK] Seq=7553 Ack=227422 Win=17520 Len=0 TSval=34147540 TSecr=150408020
430106 140.586067 153.160.160.108 -> 244.3.210.197 TCP 70 12231 > http [ACK] Seq=7553 Ack=230318 Win=17520 Len=0 TSval=34147540 TSecr=150408020
430107 140.586072 153.160.160.108 -> 244.3.210.197 TCP 70 12231 > http [ACK] Seq=7553 Ack=233214 Win=17520 Len=0 TSval=34147540 TSecr=150408020
430108 140.586076 153.160.160.108 -> 244.3.210.197 TCP 70 12231 > http [ACK] Seq=7553 Ack=233501 Win=17233 Len=0 TSval=34147540 TSecr=150408020
430506 140.690022 153.160.160.108 -> 244.3.210.197 TCP 70 12231 > http [ACK] Seq=8442 Ack=236397 Win=17520 Len=0 TSval=34147550 TSecr=150408021
430507 140.690027 153.160.160.108 -> 244.3.210.197 TCP 70 12231 > http [ACK] Seq=8442 Ack=238254 Win=17111 Len=0 TSval=34147550 TSecr=150408021
430928 140.791568 153.160.160.108 -> 244.3.210.197 TCP 70 12231 > http [ACK] Seq=9319 Ack=240952 Win=14822 Len=0 TSval=34147561 TSecr=150408022
430936 140.792174 153.160.160.108 -> 244.3.210.197 TCP 70 12230 > http [ACK] Seq=6201 Ack=118917 Win=15497 Len=0 TSval=34147561 TSecr=150408022
431321 140.886594 153.160.160.108 -> 244.3.210.197 TCP 70 12231 > http [ACK] Seq=10198 Ack=248192 Win=17520 Len=0 TSval=34147570 TSecr=150408023
431324 140.886751 153.160.160.108 -> 244.3.210.197 TCP 70 12230 > http [ACK] Seq=7075 Ack=120724 Win=15713 Len=0 TSval=34147570 TSecr=150408023
431330 140.886853 153.160.160.108 -> 244.3.210.197 TCP 70 12231 > http [ACK] Seq=10198 Ack=251088 Win=17520 Len=0 TSval=34147570 TSecr=150408023
431331 140.886858 153.160.160.108 -> 244.3.210.197 TCP 70 12231 > http [ACK] Seq=10198 Ack=252027 Win=16581 Len=0 TSval=34147570 TSecr=150408023
431808 140.998424 153.160.160.108 -> 244.3.210.197 TCP 70 12231 > http [ACK] Seq=11075 Ack=254923 Win=17520 Len=0 TSval=34147581 TSecr=150408024
431809 140.998429 153.160.160.108 -> 244.3.210.197 TCP 70 12231 > http [ACK] Seq=11075 Ack=257819 Win=17520 Len=0 TSval=34147581 TSecr=150408024
431810 140.998433 153.160.160.108 -> 244.3.210.197 TCP 70 12231 > http [ACK] Seq=11075 Ack=260715 Win=17520 Len=0 TSval=34147581 TSecr=150408024
431811 140.998437 153.160.160.108 -> 244.3.210.197 TCP 70 12231 > http [ACK] Seq=11075 Ack=261780 Win=16455 Len=0 TSval=34147581 TSecr=150408024
432254 141.106630 153.160.160.108 -> 244.3.210.197 TCP 70 12231 > http [ACK] Seq=11948 Ack=270966 Win=8334 Len=0 TSval=34147592 TSecr=150408025
432255 141.106634 153.160.160.108 -> 244.3.210.197 TCP 70 [TCP Window Update] 12231 > http [ACK] Seq=11948 Ack=270966 Win=17520 Len=0 TSval=34147592 TSecr=150408025
432639 141.210733 153.160.160.108 -> 244.3.210.197 TCP 70 12231 > http [ACK] Seq=12822 Ack=274524 Win=13962 Len=0 TSval=34147603 TSecr=150408026
432640 141.210760 153.160.160.108 -> 244.3.210.197 TCP 70 [TCP Window Update] 12231 > http [ACK] Seq=12822 Ack=274524 Win=17520 Len=0 TSval=34147603 TSecr=150408026
433026 141.308854 153.160.160.108 -> 244.3.210.197 TCP 70 12231 > http [ACK] Seq=13700 Ack=277420 Win=17520 Len=0 TSval=34147612 TSecr=150408027
433027 141.308858 153.160.160.108 -> 244.3.210.197 TCP 70 12231 > http [ACK] Seq=13700 Ack=278874 Win=17514 Len=0 TSval=34147612 TSecr=150408027
433425 141.408620 153.160.160.108 -> 244.3.210.197 TCP 70 12231 > http [ACK] Seq=14572 Ack=289653 Win=6741 Len=0 TSval=34147622 TSecr=150408028
433426 141.408625 153.160.160.108 -> 244.3.210.197 TCP 70 [TCP Window Update] 12231 > http [ACK] Seq=14572 Ack=289653 Win=17520 Len=0 TSval=34147622 TSecr=150408028
433804 141.525715 153.160.160.108 -> 244.3.210.197 TCP 70 12231 > http [ACK] Seq=15446 Ack=292549 Win=17520 Len=0 TSval=34147634 TSecr=150408029
433805 141.525719 153.160.160.108 -> 244.3.210.197 TCP 70 12231 > http [ACK] Seq=15446 Ack=295445 Win=17520 Len=0 TSval=34147634 TSecr=150408029
433806 141.525736 153.160.160.108 -> 244.3.210.197 TCP 70 12231 > http [ACK] Seq=15446 Ack=298341 Win=17520 Len=0 TSval=34147634 TSecr=150408029
433807 141.525740 153.160.160.108 -> 244.3.210.197 TCP 70 12231 > http [ACK] Seq=15446 Ack=301237 Win=17520 Len=0 TSval=34147634 TSecr=150408029
433808 141.525744 153.160.160.108 -> 244.3.210.197 TCP 70 12231 > http [ACK] Seq=15446 Ack=304133 Win=17520 Len=0 TSval=34147634 TSecr=150408029
433811 141.525946 153.160.160.108 -> 244.3.210.197 TCP 70 12231 > http [ACK] Seq=15446 Ack=307029 Win=17520 Len=0 TSval=34147634 TSecr=150408029
434140 141.601088 153.160.160.108 -> 244.3.210.197 TCP 70 12231 > http [ACK] Seq=15446 Ack=309925 Win=17520 Len=0 TSval=34147642 TSecr=150408030
434141 141.601093 153.160.160.108 -> 244.3.210.197 TCP 70 12231 > http [ACK] Seq=15446 Ack=312821 Win=17520 Len=0 TSval=34147642 TSecr=150408030
434142 141.601097 153.160.160.108 -> 244.3.210.197 TCP 70 12231 > http [ACK] Seq=15446 Ack=315717 Win=17520 Len=0 TSval=34147642 TSecr=150408030
434154 141.601324 153.160.160.108 -> 244.3.210.197 TCP 70 12231 > http [ACK] Seq=15446 Ack=318613 Win=17520 Len=0 TSval=34147642 TSecr=150408030
434157 141.601336 153.160.160.108 -> 244.3.210.197 TCP 70 12231 > http [ACK] Seq=15446 Ack=321509 Win=17520 Len=0 TSval=34147642 TSecr=150408030
434180 141.602201 153.160.160.108 -> 244.3.210.197 TCP 70 12231 > http [ACK] Seq=15446 Ack=324405 Win=17520 Len=0 TSval=34147642 TSecr=150408030
434335 141.676420 153.160.160.108 -> 244.3.210.197 TCP 70 12231 > http [ACK] Seq=15446 Ack=327301 Win=17520 Len=0 TSval=34147649 TSecr=150408031
434336 141.676425 153.160.160.108 -> 244.3.210.197 TCP 70 12231 > http [ACK] Seq=15446 Ack=330197 Win=17520 Len=0 TSval=34147649 TSecr=150408031
434337 141.676429 153.160.160.108 -> 244.3.210.197 TCP 70 12231 > http [ACK] Seq=15446 Ack=333093 Win=17520 Len=0 TSval=34147649 TSecr=150408031
434351 141.676633 153.160.160.108 -> 244.3.210.197 TCP 70 12231 > http [ACK] Seq=15446 Ack=335989 Win=17520 Len=0 TSval=34147649 TSecr=150408031
434356 141.676657 153.160.160.108 -> 244.3.210.197 TCP 70 12231 > http [ACK] Seq=15446 Ack=338885 Win=17520 Len=0 TSval=34147649 TSecr=150408031
434374 141.677375 153.160.160.108 -> 244.3.210.197 TCP 70 12231 > http [ACK] Seq=15446 Ack=341781 Win=17520 Len=0 TSval=34147649 TSecr=150408031
434514 141.751447 153.160.160.108 -> 244.3.210.197 TCP 70 12231 > http [ACK] Seq=15446 Ack=344677 Win=17520 Len=0 TSval=34147657 TSecr=150408031
434520 141.751693 153.160.160.108 -> 244.3.210.197 TCP 70 12231 > http [ACK] Seq=15446 Ack=347573 Win=17520 Len=0 TSval=34147657 TSecr=150408031
434521 141.751697 153.160.160.108 -> 244.3.210.197 TCP 70 12231 > http [ACK] Seq=15446 Ack=350469 Win=17520 Len=0 TSval=34147657 TSecr=150408031
434523 141.751898 153.160.160.108 -> 244.3.210.197 TCP 70 12231 > http [ACK] Seq=15446 Ack=353365 Win=17520 Len=0 TSval=34147657 TSecr=150408031
434525 141.751906 153.160.160.108 -> 244.3.210.197 TCP 70 12231 > http [ACK] Seq=15446 Ack=354243 Win=16642 Len=0 TSval=34147657 TSecr=150408031
434912 141.859782 153.160.160.108 -> 244.3.210.197 TCP 70 12231 > http [ACK] Seq=16328 Ack=357139 Win=17520 Len=0 TSval=34147668 TSecr=150408032
434913 141.859823 153.160.160.108 -> 244.3.210.197 TCP 70 12231 > http [ACK] Seq=16328 Ack=360035 Win=17520 Len=0 TSval=34147668 TSecr=150408032
434914 141.859828 153.160.160.108 -> 244.3.210.197 TCP 70 12231 > http [ACK] Seq=16328 Ack=360106 Win=17449 Len=0 TSval=34147668 TSecr=150408032
435218 141.957088 153.160.160.108 -> 244.3.210.197 TCP 70 12231 > http [ACK] Seq=17206 Ack=363002 Win=17520 Len=0 TSval=34147677 TSecr=150408033
435225 141.957289 153.160.160.108 -> 244.3.210.197 TCP 70 12231 > http [ACK] Seq=17206 Ack=363563 Win=16959 Len=0 TSval=34147677 TSecr=150408033
435558 142.054262 153.160.160.108 -> 244.3.210.197 TCP 70 12231 > http [ACK] Seq=18077 Ack=366459 Win=17520 Len=0 TSval=34147687 TSecr=150408034
435559 142.054266 153.160.160.108 -> 244.3.210.197 TCP 70 12231 > http [ACK] Seq=18077 Ack=369355 Win=17520 Len=0 TSval=34147687 TSecr=150408034
435560 142.054270 153.160.160.108 -> 244.3.210.197 TCP 70 12231 > http [ACK] Seq=18077 Ack=372251 Win=17520 Len=0 TSval=34147687 TSecr=150408034
435561 142.054274 153.160.160.108 -> 244.3.210.197 TCP 70 12231 > http [ACK] Seq=18077 Ack=374896 Win=16323 Len=0 TSval=34147687 TSecr=150408034
435969 142.162717 153.160.160.108 -> 244.3.210.197 TCP 70 12230 > http [ACK] Seq=7970 Ack=123620 Win=17520 Len=0 TSval=34147698 TSecr=150408035
435970 142.162745 153.160.160.108 -> 244.3.210.197 TCP 70 12230 > http [ACK] Seq=7970 Ack=126516 Win=17520 Len=0 TSval=34147698 TSecr=150408035
435971 142.162750 153.160.160.108 -> 244.3.210.197 TCP 70 12230 > http [ACK] Seq=7970 Ack=129412 Win=17520 Len=0 TSval=34147698 TSecr=150408035
435985 142.162952 153.160.160.108 -> 244.3.210.197 TCP 70 12230 > http [ACK] Seq=7970 Ack=132308 Win=17520 Len=0 TSval=34147698 TSecr=150408035
435986 142.162956 153.160.160.108 -> 244.3.210.197 TCP 70 12230 > http [ACK] Seq=7970 Ack=135204 Win=17520 Len=0 TSval=34147698 TSecr=150408035
435987 142.162960 153.160.160.108 -> 244.3.210.197 TCP 70 12230 > http [ACK] Seq=7970 Ack=138100 Win=17520 Len=0 TSval=34147698 TSecr=150408035
436014 142.164488 153.160.160.108 -> 244.3.210.197 TCP 70 12231 > http [ACK] Seq=18967 Ack=377792 Win=17520 Len=0 TSval=34147698 TSecr=150408035
436015 142.164493 153.160.160.108 -> 244.3.210.197 TCP 70 12231 > http [ACK] Seq=18967 Ack=380688 Win=17520 Len=0 TSval=34147698 TSecr=150408035
436016 142.164497 153.160.160.108 -> 244.3.210.197 TCP 70 12231 > http [ACK] Seq=18967 Ack=383584 Win=17520 Len=0 TSval=34147698 TSecr=150408035
436017 142.164501 153.160.160.108 -> 244.3.210.197 TCP 70 12231 > http [ACK] Seq=18967 Ack=386480 Win=17520 Len=0 TSval=34147698 TSecr=150408035
436018 142.164505 153.160.160.108 -> 244.3.210.197 TCP 70 12231 > http [ACK] Seq=18967 Ack=389376 Win=17520 Len=0 TSval=34147698 TSecr=150408035
436019 142.164509 153.160.160.108 -> 244.3.210.197 TCP 70 12231 > http [ACK] Seq=18967 Ack=392272 Win=17520 Len=0 TSval=34147698 TSecr=150408035
436246 142.238109 153.160.160.108 -> 244.3.210.197 TCP 70 12230 > http [ACK] Seq=7970 Ack=140996 Win=17520 Len=0 TSval=34147705 TSecr=150408037
436247 142.238114 153.160.160.108 -> 244.3.210.197 TCP 70 12230 > http [ACK] Seq=7970 Ack=143892 Win=17520 Len=0 TSval=34147705 TSecr=150408037
436248 142.238118 153.160.160.108 -> 244.3.210.197 TCP 70 12230 > http [ACK] Seq=7970 Ack=146788 Win=17520 Len=0 TSval=34147705 TSecr=150408037
436265 142.238785 153.160.160.108 -> 244.3.210.197 TCP 70 12230 > http [ACK] Seq=7970 Ack=149684 Win=17520 Len=0 TSval=34147705 TSecr=150408037
436266 142.238790 153.160.160.108 -> 244.3.210.197 TCP 70 12230 > http [ACK] Seq=7970 Ack=150221 Win=16983 Len=0 TSval=34147705 TSecr=150408037
436277 142.239656 153.160.160.108 -> 244.3.210.197 TCP 70 12231 > http [ACK] Seq=18967 Ack=395168 Win=17520 Len=0 TSval=34147706 TSecr=150408037
436278 142.239661 153.160.160.108 -> 244.3.210.197 TCP 70 12231 > http [ACK] Seq=18967 Ack=398064 Win=17520 Len=0 TSval=34147706 TSecr=150408037
436282 142.239883 153.160.160.108 -> 244.3.210.197 TCP 70 12231 > http [ACK] Seq=18967 Ack=400960 Win=17520 Len=0 TSval=34147706 TSecr=150408037
436322 142.240814 153.160.160.108 -> 244.3.210.197 TCP 70 12231 > http [ACK] Seq=18967 Ack=403856 Win=17520 Len=0 TSval=34147706 TSecr=150408037
436323 142.240834 153.160.160.108 -> 244.3.210.197 TCP 70 12231 > http [ACK] Seq=18967 Ack=406752 Win=17520 Len=0 TSval=34147706 TSecr=150408037
436340 142.242035 153.160.160.108 -> 244.3.210.197 TCP 70 12231 > http [ACK] Seq=18967 Ack=409648 Win=17520 Len=0 TSval=34147706 TSecr=150408037
436570 142.315487 153.160.160.108 -> 244.3.210.197 TCP 70 12231 > http [ACK] Seq=18967 Ack=412544 Win=17520 Len=0 TSval=34147713 TSecr=150408038
436571 142.315491 153.160.160.108 -> 244.3.210.197 TCP 70 12231 > http [ACK] Seq=18967 Ack=413789 Win=16275 Len=0 TSval=34147713 TSecr=150408038
436628 142.328391 153.160.160.108 -> 244.3.210.197 TCP 70 12230 > http [ACK] Seq=8864 Ack=161065 Win=6676 Len=0 TSval=34147714 TSecr=150408038
436639 142.328840 153.160.160.108 -> 244.3.210.197 TCP 70 [TCP Window Update] 12230 > http [ACK] Seq=8864 Ack=161065 Win=17520 Len=0 TSval=34147714 TSecr=150408038
436818 142.397756 153.160.160.108 -> 244.3.210.197 TCP 70 12231 > http [ACK] Seq=19852 Ack=416685 Win=17520 Len=0 TSval=34147721 TSecr=150408039
436819 142.397761 153.160.160.108 -> 244.3.210.197 TCP 70 12231 > http [ACK] Seq=19852 Ack=416720 Win=17485 Len=0 TSval=34147721 TSecr=150408039
436929 142.439384 153.160.160.108 -> 244.3.210.197 TCP 70 12230 > http [ACK] Seq=9751 Ack=161646 Win=16939 Len=0 TSval=34147725 TSecr=150408039
437063 142.496371 153.160.160.108 -> 244.3.210.197 TCP 70 12231 > http [ACK] Seq=20731 Ack=417059 Win=17181 Len=0 TSval=34147731 TSecr=150408040
437139 142.519959 153.160.160.108 -> 244.3.210.197 TCP 70 12230 > http [ACK] Seq=10629 Ack=162771 Win=16395 Len=0 TSval=34147734 TSecr=150408040
437244 142.576398 153.160.160.108 -> 244.3.210.197 TCP 70 12231 > http [ACK] Seq=21615 Ack=417539 Win=17040 Len=0 TSval=34147739 TSecr=150408040
437519 142.661030 153.160.160.108 -> 244.3.210.197 TCP 70 12231 > http [ACK] Seq=22525 Ack=420435 Win=17520 Len=0 TSval=34147748 TSecr=150408041
437520 142.661035 153.160.160.108 -> 244.3.210.197 TCP 70 12231 > http [ACK] Seq=22525 Ack=422339 Win=17064 Len=0 TSval=34147748 TSecr=150408041
437730 142.744131 153.160.160.108 -> 244.3.210.197 TCP 70 12231 > http [ACK] Seq=23433 Ack=424432 Win=15427 Len=0 TSval=34147756 TSecr=150408042
437918 142.826119 153.160.160.108 -> 244.3.210.197 TCP 70 12231 > http [ACK] Seq=24341 Ack=426520 Win=15432 Len=0 TSval=34147764 TSecr=150408043
438150 142.908021 153.160.160.108 -> 244.3.210.197 TCP 70 12231 > http [ACK] Seq=25249 Ack=428726 Win=15314 Len=0 TSval=34147772 TSecr=150408044
438899 142.990419 153.160.160.108 -> 244.3.210.197 TCP 70 12231 > http [ACK] Seq=26157 Ack=430698 Win=15548 Len=0 TSval=34147781 TSecr=150408045
439301 143.073036 153.160.160.108 -> 244.3.210.197 TCP 70 12231 > http [ACK] Seq=27065 Ack=433038 Win=16628 Len=0 TSval=34147789 TSecr=150408045
439483 143.156287 153.160.160.108 -> 244.3.210.197 TCP 70 12231 > http [ACK] Seq=27973 Ack=435116 Win=15442 Len=0 TSval=34147797 TSecr=150408046
439726 143.237884 153.160.160.108 -> 244.3.210.197 TCP 70 12231 > http [ACK] Seq=28856 Ack=439684 Win=12952 Len=0 TSval=34147805 TSecr=150408047
439727 143.237889 153.160.160.108 -> 244.3.210.197 TCP 70 [TCP Window Update] 12231 > http [ACK] Seq=28856 Ack=439684 Win=17520 Len=0 TSval=34147805 TSecr=150408047
441023 143.574125 153.160.160.108 -> 244.3.210.197 TCP 70 12231 > http [ACK] Seq=29750 Ack=442580 Win=17520 Len=0 TSval=34147839 TSecr=150408050
441024 143.574129 153.160.160.108 -> 244.3.210.197 TCP 70 12231 > http [ACK] Seq=29750 Ack=445476 Win=17520 Len=0 TSval=34147839 TSecr=150408050
441025 143.574133 153.160.160.108 -> 244.3.210.197 TCP 70 12231 > http [ACK] Seq=29750 Ack=447230 Win=17214 Len=0 TSval=34147839 TSecr=150408050
441292 143.655035 153.160.160.108 -> 244.3.210.197 TCP 70 12231 > http [ACK] Seq=30638 Ack=450126 Win=17520 Len=0 TSval=34147847 TSecr=150408051
441293 143.655071 153.160.160.108 -> 244.3.210.197 TCP 70 12231 > http [ACK] Seq=30638 Ack=450260 Win=17386 Len=0 TSval=34147847 TSecr=150408051
488877 160.589983 153.160.160.108 -> 244.3.210.197 TCP 70 12230 > http [FIN, ACK] Seq=10629 Ack=162771 Win=17520 Len=0 TSval=34149542 TSecr=150408040
488987 160.665367 153.160.160.108 -> 244.3.210.197 TCP 70 12230 > http [ACK] Seq=10630 Ack=162772 Win=17520 Len=0 TSval=34149550 TSecr=150408221
490767 161.793292 153.160.160.108 -> 244.3.210.197 TCP 70 12231 > http [FIN, ACK] Seq=30638 Ack=450260 Win=17520 Len=0 TSval=34149663 TSecr=150408051
490899 161.868488 153.160.160.108 -> 244.3.210.197 TCP 70 12231 > http [ACK] Seq=30639 Ack=450261 Win=17520 Len=0 TSval=34149670 TSecr=150408233
602870 191.249205 153.160.160.108 -> 244.3.210.197 TCP 82 36450 > http [SYN] Seq=0 Win=16384 Len=0 MSS=1460 SACK_PERM=1 WS=1 TSval=34152611 TSecr=0
603087 191.324882 153.160.160.108 -> 244.3.210.197 TCP 70 36450 > http [ACK] Seq=1 Ack=1 Win=17520 Len=0 TSval=34152618 TSecr=0
604345 191.807485 153.160.160.108 -> 244.3.210.197 TCP 70 36450 > http [ACK] Seq=1179 Ack=2897 Win=17520 Len=0 TSval=34152666 TSecr=150408532
604661 191.882782 153.160.160.108 -> 244.3.210.197 TCP 70 36450 > http [ACK] Seq=1179 Ack=5793 Win=17520 Len=0 TSval=34152674 TSecr=150408533
605138 191.958225 153.160.160.108 -> 244.3.210.197 TCP 70 36450 > http [ACK] Seq=1179 Ack=8689 Win=17520 Len=0 TSval=34152682 TSecr=150408533
605139 191.958229 153.160.160.108 -> 244.3.210.197 TCP 70 36450 > http [ACK] Seq=1179 Ack=11585 Win=17520 Len=0 TSval=34152682 TSecr=150408533
605622 192.033900 153.160.160.108 -> 244.3.210.197 TCP 70 36450 > http [ACK] Seq=1179 Ack=14047 Win=16506 Len=0 TSval=34152689 TSecr=150408534
605907 192.169649 153.160.160.108 -> 244.3.210.197 TCP 70 36450 > http [ACK] Seq=2059 Ack=16943 Win=17520 Len=0 TSval=34152703 TSecr=150408536
605908 192.169654 153.160.160.108 -> 244.3.210.197 TCP 70 36450 > http [ACK] Seq=2059 Ack=19839 Win=17520 Len=0 TSval=34152703 TSecr=150408536
605909 192.169658 153.160.160.108 -> 244.3.210.197 TCP 70 36450 > http [ACK] Seq=2059 Ack=22735 Win=17520 Len=0 TSval=34152703 TSecr=150408536
606048 192.245091 153.160.160.108 -> 244.3.210.197 TCP 70 36450 > http [ACK] Seq=2059 Ack=25631 Win=17520 Len=0 TSval=34152710 TSecr=150408536
606057 192.245528 153.160.160.108 -> 244.3.210.197 TCP 70 36450 > http [ACK] Seq=2059 Ack=28527 Win=17520 Len=0 TSval=34152710 TSecr=150408536
606058 192.245533 153.160.160.108 -> 244.3.210.197 TCP 70 36450 > http [ACK] Seq=2059 Ack=31423 Win=17520 Len=0 TSval=34152710 TSecr=150408536
606059 192.245536 153.160.160.108 -> 244.3.210.197 TCP 70 36450 > http [ACK] Seq=2059 Ack=34319 Win=17520 Len=0 TSval=34152710 TSecr=150408536
606060 192.245540 153.160.160.108 -> 244.3.210.197 TCP 70 36450 > http [ACK] Seq=2059 Ack=37215 Win=17520 Len=0 TSval=34152710 TSecr=150408536
606469 192.320642 153.160.160.108 -> 244.3.210.197 TCP 70 36450 > http [ACK] Seq=2059 Ack=40111 Win=17520 Len=0 TSval=34152718 TSecr=150408537
606477 192.320857 153.160.160.108 -> 244.3.210.197 TCP 70 36450 > http [ACK] Seq=2059 Ack=43007 Win=17520 Len=0 TSval=34152718 TSecr=150408537
606478 192.320862 153.160.160.108 -> 244.3.210.197 TCP 70 36450 > http [ACK] Seq=2059 Ack=45903 Win=17520 Len=0 TSval=34152718 TSecr=150408537
606479 192.320898 153.160.160.108 -> 244.3.210.197 TCP 70 36450 > http [ACK] Seq=2059 Ack=48799 Win=17520 Len=0 TSval=34152718 TSecr=150408537
606491 192.321086 153.160.160.108 -> 244.3.210.197 TCP 70 36450 > http [ACK] Seq=2059 Ack=51695 Win=17520 Len=0 TSval=34152718 TSecr=150408537
606509 192.321728 153.160.160.108 -> 244.3.210.197 TCP 70 36450 > http [ACK] Seq=2059 Ack=54591 Win=17520 Len=0 TSval=34152718 TSecr=150408537
606618 192.396117 153.160.160.108 -> 244.3.210.197 TCP 70 36450 > http [ACK] Seq=2059 Ack=57487 Win=17520 Len=0 TSval=34152725 TSecr=150408538
606626 192.396339 153.160.160.108 -> 244.3.210.197 TCP 70 36450 > http [ACK] Seq=2059 Ack=60383 Win=17520 Len=0 TSval=34152725 TSecr=150408538
606629 192.396512 153.160.160.108 -> 244.3.210.197 TCP 70 36450 > http [ACK] Seq=2059 Ack=63279 Win=17520 Len=0 TSval=34152725 TSecr=150408538
606630 192.396516 153.160.160.108 -> 244.3.210.197 TCP 70 36450 > http [ACK] Seq=2059 Ack=66175 Win=17520 Len=0 TSval=34152725 TSecr=150408538
606635 192.396665 153.160.160.108 -> 244.3.210.197 TCP 70 36450 > http [ACK] Seq=2059 Ack=69071 Win=17520 Len=0 TSval=34152725 TSecr=150408538
606658 192.397132 153.160.160.108 -> 244.3.210.197 TCP 70 36450 > http [ACK] Seq=2059 Ack=71967 Win=17520 Len=0 TSval=34152726 TSecr=150408538
606792 192.471537 153.160.160.108 -> 244.3.210.197 TCP 70 36450 > http [ACK] Seq=2059 Ack=74863 Win=17520 Len=0 TSval=34152733 TSecr=150408539
606800 192.471759 153.160.160.108 -> 244.3.210.197 TCP 70 36450 > http [ACK] Seq=2059 Ack=77759 Win=17520 Len=0 TSval=34152733 TSecr=150408539
606801 192.471764 153.160.160.108 -> 244.3.210.197 TCP 70 36450 > http [ACK] Seq=2059 Ack=80655 Win=17520 Len=0 TSval=34152733 TSecr=150408539
606811 192.472024 153.160.160.108 -> 244.3.210.197 TCP 70 36450 > http [ACK] Seq=2059 Ack=83551 Win=17520 Len=0 TSval=34152733 TSecr=150408539
606812 192.472028 153.160.160.108 -> 244.3.210.197 TCP 70 36450 > http [ACK] Seq=2059 Ack=86447 Win=17520 Len=0 TSval=34152733 TSecr=150408539
606841 192.472695 153.160.160.108 -> 244.3.210.197 TCP 70 36450 > http [ACK] Seq=2059 Ack=89343 Win=17520 Len=0 TSval=34152733 TSecr=150408539
606982 192.546748 153.160.160.108 -> 244.3.210.197 TCP 70 36450 > http [ACK] Seq=2059 Ack=92239 Win=17520 Len=0 TSval=34152740 TSecr=150408539
606990 192.547498 153.160.160.108 -> 244.3.210.197 TCP 70 36450 > http [ACK] Seq=2059 Ack=95135 Win=17520 Len=0 TSval=34152741 TSecr=150408539
606991 192.547523 153.160.160.108 -> 244.3.210.197 TCP 70 36450 > http [ACK] Seq=2059 Ack=98031 Win=17520 Len=0 TSval=34152741 TSecr=150408539
606992 192.547528 153.160.160.108 -> 244.3.210.197 TCP 70 36450 > http [ACK] Seq=2059 Ack=100927 Win=17520 Len=0 TSval=34152741 TSecr=150408539
606993 192.547532 153.160.160.108 -> 244.3.210.197 TCP 70 36450 > http [ACK] Seq=2059 Ack=103823 Win=17520 Len=0 TSval=34152741 TSecr=150408539
607023 192.549245 153.160.160.108 -> 244.3.210.197 TCP 70 36450 > http [ACK] Seq=2059 Ack=106719 Win=17520 Len=0 TSval=34152741 TSecr=150408539
607183 192.622017 153.160.160.108 -> 244.3.210.197 TCP 70 36450 > http [ACK] Seq=2059 Ack=109615 Win=17520 Len=0 TSval=34152748 TSecr=150408540
607191 192.622927 153.160.160.108 -> 244.3.210.197 TCP 70 36450 > http [ACK] Seq=2059 Ack=112511 Win=17520 Len=0 TSval=34152748 TSecr=150408540
607192 192.622931 153.160.160.108 -> 244.3.210.197 TCP 70 36450 > http [ACK] Seq=2059 Ack=115407 Win=17520 Len=0 TSval=34152748 TSecr=150408540
607208 192.623152 153.160.160.108 -> 244.3.210.197 TCP 70 36450 > http [ACK] Seq=2059 Ack=118303 Win=17520 Len=0 TSval=34152748 TSecr=150408540
607209 192.623156 153.160.160.108 -> 244.3.210.197 TCP 70 36450 > http [ACK] Seq=2059 Ack=121199 Win=17520 Len=0 TSval=34152748 TSecr=150408540
607226 192.624762 153.160.160.108 -> 244.3.210.197 TCP 70 36450 > http [ACK] Seq=2059 Ack=124095 Win=17520 Len=0 TSval=34152748 TSecr=150408540
607350 192.697595 153.160.160.108 -> 244.3.210.197 TCP 70 36450 > http [ACK] Seq=2059 Ack=126991 Win=17520 Len=0 TSval=34152756 TSecr=150408541
607358 192.698340 153.160.160.108 -> 244.3.210.197 TCP 70 36450 > http [ACK] Seq=2059 Ack=129887 Win=17520 Len=0 TSval=34152756 TSecr=150408541
607366 192.698579 153.160.160.108 -> 244.3.210.197 TCP 70 36450 > http [ACK] Seq=2059 Ack=132783 Win=17520 Len=0 TSval=34152756 TSecr=150408541
607373 192.698841 153.160.160.108 -> 244.3.210.197 TCP 70 36450 > http [ACK] Seq=2059 Ack=135679 Win=17520 Len=0 TSval=34152756 TSecr=150408541
607374 192.698845 153.160.160.108 -> 244.3.210.197 TCP 70 36450 > http [ACK] Seq=2059 Ack=138575 Win=17520 Len=0 TSval=34152756 TSecr=150408541
607390 192.700272 153.160.160.108 -> 244.3.210.197 TCP 70 36450 > http [ACK] Seq=2059 Ack=141471 Win=17520 Len=0 TSval=34152756 TSecr=150408541
607504 192.773131 153.160.160.108 -> 244.3.210.197 TCP 70 36450 > http [ACK] Seq=2059 Ack=144367 Win=17520 Len=0 TSval=34152763 TSecr=150408542
607512 192.774050 153.160.160.108 -> 244.3.210.197 TCP 70 36450 > http [ACK] Seq=2059 Ack=147263 Win=17520 Len=0 TSval=34152763 TSecr=150408542
607513 192.774054 153.160.160.108 -> 244.3.210.197 TCP 70 36450 > http [ACK] Seq=2059 Ack=150159 Win=17520 Len=0 TSval=34152763 TSecr=150408542
607529 192.774352 153.160.160.108 -> 244.3.210.197 TCP 70 36450 > http [ACK] Seq=2059 Ack=153055 Win=17520 Len=0 TSval=34152763 TSecr=150408542
607530 192.774357 153.160.160.108 -> 244.3.210.197 TCP 70 36450 > http [ACK] Seq=2059 Ack=155951 Win=17520 Len=0 TSval=34152763 TSecr=150408542
607545 192.775553 153.160.160.108 -> 244.3.210.197 TCP 70 36450 > http [ACK] Seq=2059 Ack=158847 Win=17520 Len=0 TSval=34152763 TSecr=150408542
607623 192.848528 153.160.160.108 -> 244.3.210.197 TCP 70 36450 > http [ACK] Seq=2059 Ack=161743 Win=17520 Len=0 TSval=34152771 TSecr=150408542
607634 192.849573 153.160.160.108 -> 244.3.210.197 TCP 70 36450 > http [ACK] Seq=2059 Ack=164639 Win=17520 Len=0 TSval=34152771 TSecr=150408542
607635 192.849577 153.160.160.108 -> 244.3.210.197 TCP 70 36450 > http [ACK] Seq=2059 Ack=167535 Win=17520 Len=0 TSval=34152771 TSecr=150408542
607650 192.849822 153.160.160.108 -> 244.3.210.197 TCP 70 36450 > http [ACK] Seq=2059 Ack=170431 Win=17520 Len=0 TSval=34152771 TSecr=150408542
607651 192.849827 153.160.160.108 -> 244.3.210.197 TCP 70 36450 > http [ACK] Seq=2059 Ack=173327 Win=17520 Len=0 TSval=34152771 TSecr=150408542
607666 192.850911 153.160.160.108 -> 244.3.210.197 TCP 70 36450 > http [ACK] Seq=2059 Ack=176223 Win=17520 Len=0 TSval=34152771 TSecr=150408542
607752 192.924411 153.160.160.108 -> 244.3.210.197 TCP 70 36450 > http [ACK] Seq=2059 Ack=179119 Win=17520 Len=0 TSval=34152778 TSecr=150408543
607761 192.925528 153.160.160.108 -> 244.3.210.197 TCP 70 36450 > http [ACK] Seq=2059 Ack=182015 Win=17520 Len=0 TSval=34152778 TSecr=150408543
607762 192.925533 153.160.160.108 -> 244.3.210.197 TCP 70 36450 > http [ACK] Seq=2059 Ack=184911 Win=17520 Len=0 TSval=34152778 TSecr=150408543
607763 192.925537 153.160.160.108 -> 244.3.210.197 TCP 70 36450 > http [ACK] Seq=2059 Ack=187807 Win=17520 Len=0 TSval=34152778 TSecr=150408543
607764 192.925541 153.160.160.108 -> 244.3.210.197 TCP 70 36450 > http [ACK] Seq=2059 Ack=190703 Win=17520 Len=0 TSval=34152778 TSecr=150408543
607797 192.926133 153.160.160.108 -> 244.3.210.197 TCP 70 36450 > http [ACK] Seq=2059 Ack=193599 Win=17520 Len=0 TSval=34152778 TSecr=150408543
607925 193.000051 153.160.160.108 -> 244.3.210.197 TCP 70 36450 > http [ACK] Seq=2059 Ack=196495 Win=17520 Len=0 TSval=34152786 TSecr=150408544
607934 193.000812 153.160.160.108 -> 244.3.210.197 TCP 70 36450 > http [ACK] Seq=2059 Ack=199391 Win=17520 Len=0 TSval=34152786 TSecr=150408544
607943 193.001013 153.160.160.108 -> 244.3.210.197 TCP 70 36450 > http [ACK] Seq=2059 Ack=202287 Win=17520 Len=0 TSval=34152786 TSecr=150408544
607952 193.001252 153.160.160.108 -> 244.3.210.197 TCP 70 36450 > http [ACK] Seq=2059 Ack=205183 Win=17520 Len=0 TSval=34152786 TSecr=150408544
607953 193.001285 153.160.160.108 -> 244.3.210.197 TCP 70 36450 > http [ACK] Seq=2059 Ack=208079 Win=17520 Len=0 TSval=34152786 TSecr=150408544
607958 193.001482 153.160.160.108 -> 244.3.210.197 TCP 70 36450 > http [ACK] Seq=2059 Ack=210975 Win=17520 Len=0 TSval=34152786 TSecr=150408544
608070 193.075417 153.160.160.108 -> 244.3.210.197 TCP 70 36450 > http [ACK] Seq=2059 Ack=213871 Win=17520 Len=0 TSval=34152793 TSecr=150408545
608078 193.076573 153.160.160.108 -> 244.3.210.197 TCP 70 36450 > http [ACK] Seq=2059 Ack=216767 Win=17520 Len=0 TSval=34152793 TSecr=150408545
608085 193.076861 153.160.160.108 -> 244.3.210.197 TCP 70 36450 > http [ACK] Seq=2059 Ack=219663 Win=17520 Len=0 TSval=34152793 TSecr=150408545
608086 193.076866 153.160.160.108 -> 244.3.210.197 TCP 70 36450 > http [ACK] Seq=2059 Ack=222559 Win=17520 Len=0 TSval=34152794 TSecr=150408545
608087 193.076870 153.160.160.108 -> 244.3.210.197 TCP 70 36450 > http [ACK] Seq=2059 Ack=225455 Win=17520 Len=0 TSval=34152794 TSecr=150408545
608106 193.077269 153.160.160.108 -> 244.3.210.197 TCP 70 36450 > http [ACK] Seq=2059 Ack=228351 Win=17520 Len=0 TSval=34152794 TSecr=150408545
608231 193.150770 153.160.160.108 -> 244.3.210.197 TCP 70 36450 > http [ACK] Seq=2059 Ack=231247 Win=17520 Len=0 TSval=34152801 TSecr=150408545
608243 193.151961 153.160.160.108 -> 244.3.210.197 TCP 70 36450 > http [ACK] Seq=2059 Ack=234143 Win=17520 Len=0 TSval=34152801 TSecr=150408545
608251 193.152185 153.160.160.108 -> 244.3.210.197 TCP 70 36450 > http [ACK] Seq=2059 Ack=237039 Win=17520 Len=0 TSval=34152801 TSecr=150408545
608256 193.152407 153.160.160.108 -> 244.3.210.197 TCP 70 36450 > http [ACK] Seq=2059 Ack=239935 Win=17520 Len=0 TSval=34152801 TSecr=150408545
608258 193.152415 153.160.160.108 -> 244.3.210.197 TCP 70 36450 > http [ACK] Seq=2059 Ack=242831 Win=17520 Len=0 TSval=34152801 TSecr=150408545
608275 193.153134 153.160.160.108 -> 244.3.210.197 TCP 70 36450 > http [ACK] Seq=2059 Ack=245727 Win=17520 Len=0 TSval=34152801 TSecr=150408545
608390 193.226220 153.160.160.108 -> 244.3.210.197 TCP 70 36450 > http [ACK] Seq=2059 Ack=248623 Win=17520 Len=0 TSval=34152808 TSecr=150408546
608399 193.227120 153.160.160.108 -> 244.3.210.197 TCP 70 36450 > http [ACK] Seq=2059 Ack=251519 Win=17520 Len=0 TSval=34152809 TSecr=150408546
608409 193.227541 153.160.160.108 -> 244.3.210.197 TCP 70 36450 > http [ACK] Seq=2059 Ack=254415 Win=17520 Len=0 TSval=34152809 TSecr=150408546
608421 193.228009 153.160.160.108 -> 244.3.210.197 TCP 70 36450 > http [ACK] Seq=2059 Ack=257311 Win=17520 Len=0 TSval=34152809 TSecr=150408546
608422 193.228014 153.160.160.108 -> 244.3.210.197 TCP 70 36450 > http [ACK] Seq=2059 Ack=260207 Win=17520 Len=0 TSval=34152809 TSecr=150408546
608440 193.228552 153.160.160.108 -> 244.3.210.197 TCP 70 36450 > http [ACK] Seq=2059 Ack=263103 Win=17520 Len=0 TSval=34152809 TSecr=150408546
608579 193.301649 153.160.160.108 -> 244.3.210.197 TCP 70 36450 > http [ACK] Seq=2059 Ack=265999 Win=17520 Len=0 TSval=34152816 TSecr=150408547
608591 193.302518 153.160.160.108 -> 244.3.210.197 TCP 70 36450 > http [ACK] Seq=2059 Ack=268895 Win=17520 Len=0 TSval=34152816 TSecr=150408547
608602 193.303235 153.160.160.108 -> 244.3.210.197 TCP 70 36450 > http [ACK] Seq=2059 Ack=271791 Win=17520 Len=0 TSval=34152816 TSecr=150408547
608611 193.303459 153.160.160.108 -> 244.3.210.197 TCP 70 36450 > http [ACK] Seq=2059 Ack=274687 Win=17520 Len=0 TSval=34152816 TSecr=150408547
608620 193.303716 153.160.160.108 -> 244.3.210.197 TCP 70 36450 > http [ACK] Seq=2059 Ack=277583 Win=17520 Len=0 TSval=34152816 TSecr=150408547
608629 193.304419 153.160.160.108 -> 244.3.210.197 TCP 70 36450 > http [ACK] Seq=2059 Ack=280479 Win=17520 Len=0 TSval=34152816 TSecr=150408547
608885 193.376983 153.160.160.108 -> 244.3.210.197 TCP 70 36450 > http [ACK] Seq=2059 Ack=283375 Win=17520 Len=0 TSval=34152824 TSecr=150408548
608893 193.377734 153.160.160.108 -> 244.3.210.197 TCP 70 36450 > http [ACK] Seq=2059 Ack=286271 Win=17520 Len=0 TSval=34152824 TSecr=150408548
608901 193.379082 153.160.160.108 -> 244.3.210.197 TCP 70 36450 > http [ACK] Seq=2059 Ack=289167 Win=17520 Len=0 TSval=34152824 TSecr=150408548
608909 193.379538 153.160.160.108 -> 244.3.210.197 TCP 70 36450 > http [ACK] Seq=2059 Ack=292063 Win=17520 Len=0 TSval=34152824 TSecr=150408548
608910 193.379543 153.160.160.108 -> 244.3.210.197 TCP 70 36450 > http [ACK] Seq=2059 Ack=294959 Win=17520 Len=0 TSval=34152824 TSecr=150408548
608925 193.380193 153.160.160.108 -> 244.3.210.197 TCP 70 36450 > http [ACK] Seq=2059 Ack=297855 Win=17520 Len=0 TSval=34152824 TSecr=150408548
609078 193.452185 153.160.160.108 -> 244.3.210.197 TCP 70 36450 > http [ACK] Seq=2059 Ack=300751 Win=17520 Len=0 TSval=34152831 TSecr=150408548
609087 193.453253 153.160.160.108 -> 244.3.210.197 TCP 70 36450 > http [ACK] Seq=2059 Ack=303647 Win=17520 Len=0 TSval=34152831 TSecr=150408548
609102 193.454616 153.160.160.108 -> 244.3.210.197 TCP 70 36450 > http [ACK] Seq=2059 Ack=306543 Win=17520 Len=0 TSval=34152831 TSecr=150408548
609114 193.455051 153.160.160.108 -> 244.3.210.197 TCP 70 36450 > http [ACK] Seq=2059 Ack=309439 Win=17520 Len=0 TSval=34152831 TSecr=150408548
609115 193.455097 153.160.160.108 -> 244.3.210.197 TCP 70 36450 > http [ACK] Seq=2059 Ack=312335 Win=17520 Len=0 TSval=34152831 TSecr=150408548
609130 193.455555 153.160.160.108 -> 244.3.210.197 TCP 70 36450 > http [ACK] Seq=2059 Ack=315231 Win=17520 Len=0 TSval=34152831 TSecr=150408548
609351 193.527614 153.160.160.108 -> 244.3.210.197 TCP 70 36450 > http [ACK] Seq=2059 Ack=318127 Win=17520 Len=0 TSval=34152839 TSecr=150408549
609361 193.529045 153.160.160.108 -> 244.3.210.197 TCP 70 36450 > http [ACK] Seq=2059 Ack=321023 Win=17520 Len=0 TSval=34152839 TSecr=150408549
609369 193.529937 153.160.160.108 -> 244.3.210.197 TCP 70 36450 > http [ACK] Seq=2059 Ack=323919 Win=17520 Len=0 TSval=34152839 TSecr=150408549
609377 193.530487 153.160.160.108 -> 244.3.210.197 TCP 70 36450 > http [ACK] Seq=2059 Ack=326815 Win=17520 Len=0 TSval=34152839 TSecr=150408549
609385 193.530693 153.160.160.108 -> 244.3.210.197 TCP 70 36450 > http [ACK] Seq=2059 Ack=329711 Win=17520 Len=0 TSval=34152839 TSecr=150408549
609391 193.530953 153.160.160.108 -> 244.3.210.197 TCP 70 36450 > http [ACK] Seq=2059 Ack=332607 Win=17520 Len=0 TSval=34152839 TSecr=150408549
609689 193.602990 153.160.160.108 -> 244.3.210.197 TCP 70 36450 > http [ACK] Seq=2059 Ack=335503 Win=17520 Len=0 TSval=34152846 TSecr=150408550
609701 193.604686 153.160.160.108 -> 244.3.210.197 TCP 70 36450 > http [ACK] Seq=2059 Ack=338399 Win=17520 Len=0 TSval=34152846 TSecr=150408550
609726 193.605435 153.160.160.108 -> 244.3.210.197 TCP 70 36450 > http [ACK] Seq=2059 Ack=341295 Win=17520 Len=0 TSval=34152846 TSecr=150408550
609736 193.606016 153.160.160.108 -> 244.3.210.197 TCP 70 36450 > http [ACK] Seq=2059 Ack=344191 Win=17520 Len=0 TSval=34152846 TSecr=150408550
609743 193.606168 153.160.160.108 -> 244.3.210.197 TCP 70 36450 > http [ACK] Seq=2059 Ack=347087 Win=17520 Len=0 TSval=34152846 TSecr=150408550
609753 193.606686 153.160.160.108 -> 244.3.210.197 TCP 70 36450 > http [ACK] Seq=2059 Ack=349983 Win=17520 Len=0 TSval=34152846 TSecr=150408550
610076 193.678472 153.160.160.108 -> 244.3.210.197 TCP 70 36450 > http [ACK] Seq=2059 Ack=352879 Win=17520 Len=0 TSval=34152854 TSecr=150408552
610094 193.680396 153.160.160.108 -> 244.3.210.197 TCP 70 36450 > http [ACK] Seq=2059 Ack=355775 Win=17520 Len=0 TSval=34152854 TSecr=150408552
610110 193.680880 153.160.160.108 -> 244.3.210.197 TCP 70 36450 > http [ACK] Seq=2059 Ack=358671 Win=17520 Len=0 TSval=34152854 TSecr=150408552
610126 193.681507 153.160.160.108 -> 244.3.210.197 TCP 70 36450 > http [ACK] Seq=2059 Ack=361567 Win=17520 Len=0 TSval=34152854 TSecr=150408552
610127 193.681510 153.160.160.108 -> 244.3.210.197 TCP 70 36450 > http [ACK] Seq=2059 Ack=364463 Win=17520 Len=0 TSval=34152854 TSecr=150408552
610143 193.682232 153.160.160.108 -> 244.3.210.197 TCP 70 36450 > http [ACK] Seq=2059 Ack=367359 Win=17520 Len=0 TSval=34152854 TSecr=150408552
610367 193.754053 153.160.160.108 -> 244.3.210.197 TCP 70 36450 > http [ACK] Seq=2059 Ack=370255 Win=17520 Len=0 TSval=34152861 TSecr=150408552
610380 193.755971 153.160.160.108 -> 244.3.210.197 TCP 70 36450 > http [ACK] Seq=2059 Ack=373151 Win=17520 Len=0 TSval=34152862 TSecr=150408552
610388 193.756283 153.160.160.108 -> 244.3.210.197 TCP 70 36450 > http [ACK] Seq=2059 Ack=376047 Win=17520 Len=0 TSval=34152862 TSecr=150408552
610402 193.757083 153.160.160.108 -> 244.3.210.197 TCP 70 36450 > http [ACK] Seq=2059 Ack=378943 Win=17520 Len=0 TSval=34152862 TSecr=150408552
610403 193.757088 153.160.160.108 -> 244.3.210.197 TCP 70 36450 > http [ACK] Seq=2059 Ack=381839 Win=17520 Len=0 TSval=34152862 TSecr=150408552
610424 193.757563 153.160.160.108 -> 244.3.210.197 TCP 70 36450 > http [ACK] Seq=2059 Ack=384735 Win=17520 Len=0 TSval=34152862 TSecr=150408552
610638 193.829433 153.160.160.108 -> 244.3.210.197 TCP 70 36450 > http [ACK] Seq=2059 Ack=387631 Win=17520 Len=0 TSval=34152869 TSecr=150408553
610650 193.831434 153.160.160.108 -> 244.3.210.197 TCP 70 36450 > http [ACK] Seq=2059 Ack=390527 Win=17520 Len=0 TSval=34152869 TSecr=150408553
610658 193.832107 153.160.160.108 -> 244.3.210.197 TCP 70 36450 > http [ACK] Seq=2059 Ack=393423 Win=17520 Len=0 TSval=34152869 TSecr=150408553
610666 193.832328 153.160.160.108 -> 244.3.210.197 TCP 70 36450 > http [ACK] Seq=2059 Ack=396319 Win=17520 Len=0 TSval=34152869 TSecr=150408553
610671 193.832573 153.160.160.108 -> 244.3.210.197 TCP 70 36450 > http [ACK] Seq=2059 Ack=399215 Win=17520 Len=0 TSval=34152869 TSecr=150408553
610682 193.832809 153.160.160.108 -> 244.3.210.197 TCP 70 36450 > http [ACK] Seq=2059 Ack=402111 Win=17520 Len=0 TSval=34152869 TSecr=150408553
610879 193.905045 153.160.160.108 -> 244.3.210.197 TCP 70 36450 > http [ACK] Seq=2059 Ack=405007 Win=17520 Len=0 TSval=34152876 TSecr=150408554
610892 193.907106 153.160.160.108 -> 244.3.210.197 TCP 70 36450 > http [ACK] Seq=2059 Ack=407903 Win=17520 Len=0 TSval=34152877 TSecr=150408554
610902 193.907439 153.160.160.108 -> 244.3.210.197 TCP 70 36450 > http [ACK] Seq=2059 Ack=410799 Win=17520 Len=0 TSval=34152877 TSecr=150408554
610909 193.907621 153.160.160.108 -> 244.3.210.197 TCP 70 36450 > http [ACK] Seq=2059 Ack=413695 Win=17520 Len=0 TSval=34152877 TSecr=150408554
610919 193.907899 153.160.160.108 -> 244.3.210.197 TCP 70 36450 > http [ACK] Seq=2059 Ack=416591 Win=17520 Len=0 TSval=34152877 TSecr=150408554
610929 193.908193 153.160.160.108 -> 244.3.210.197 TCP 70 36450 > http [ACK] Seq=2059 Ack=419487 Win=17520 Len=0 TSval=34152877 TSecr=150408554
611195 193.980571 153.160.160.108 -> 244.3.210.197 TCP 70 36450 > http [ACK] Seq=2059 Ack=422383 Win=17520 Len=0 TSval=34152884 TSecr=150408555
611211 193.982415 153.160.160.108 -> 244.3.210.197 TCP 70 36450 > http [ACK] Seq=2059 Ack=425279 Win=17520 Len=0 TSval=34152884 TSecr=150408555
611220 193.982655 153.160.160.108 -> 244.3.210.197 TCP 70 36450 > http [ACK] Seq=2059 Ack=428175 Win=17520 Len=0 TSval=34152884 TSecr=150408555
611229 193.982904 153.160.160.108 -> 244.3.210.197 TCP 70 36450 > http [ACK] Seq=2059 Ack=431071 Win=17520 Len=0 TSval=34152884 TSecr=150408555
611238 193.983360 153.160.160.108 -> 244.3.210.197 TCP 70 36450 > http [ACK] Seq=2059 Ack=433967 Win=17520 Len=0 TSval=34152884 TSecr=150408555
611249 193.983991 153.160.160.108 -> 244.3.210.197 TCP 70 36450 > http [ACK] Seq=2059 Ack=436863 Win=17520 Len=0 TSval=34152884 TSecr=150408555
611601 194.056134 153.160.160.108 -> 244.3.210.197 TCP 70 36450 > http [ACK] Seq=2059 Ack=439759 Win=17520 Len=0 TSval=34152892 TSecr=150408555
611613 194.058489 153.160.160.108 -> 244.3.210.197 TCP 70 36450 > http [ACK] Seq=2059 Ack=442655 Win=17520 Len=0 TSval=34152892 TSecr=150408555
611614 194.058494 153.160.160.108 -> 244.3.210.197 TCP 70 36450 > http [ACK] Seq=2059 Ack=445551 Win=17520 Len=0 TSval=34152892 TSecr=150408555
611615 194.058497 153.160.160.108 -> 244.3.210.197 TCP 70 36450 > http [ACK] Seq=2059 Ack=448447 Win=17520 Len=0 TSval=34152892 TSecr=150408555
611638 194.059034 153.160.160.108 -> 244.3.210.197 TCP 70 36450 > http [ACK] Seq=2059 Ack=451343 Win=17520 Len=0 TSval=34152892 TSecr=150408555
611643 194.059409 153.160.160.108 -> 244.3.210.197 TCP 70 36450 > http [ACK] Seq=2059 Ack=454239 Win=17520 Len=0 TSval=34152892 TSecr=150408555
611833 194.131245 153.160.160.108 -> 244.3.210.197 TCP 70 36450 > http [ACK] Seq=2059 Ack=457135 Win=17520 Len=0 TSval=34152899 TSecr=150408556
611845 194.133994 153.160.160.108 -> 244.3.210.197 TCP 70 36450 > http [ACK] Seq=2059 Ack=460031 Win=17520 Len=0 TSval=34152899 TSecr=150408556
611853 194.134193 153.160.160.108 -> 244.3.210.197 TCP 70 36450 > http [ACK] Seq=2059 Ack=462927 Win=17520 Len=0 TSval=34152899 TSecr=150408556
611854 194.134224 153.160.160.108 -> 244.3.210.197 TCP 70 36450 > http [ACK] Seq=2059 Ack=465823 Win=17520 Len=0 TSval=34152899 TSecr=150408556
611869 194.134585 153.160.160.108 -> 244.3.210.197 TCP 70 36450 > http [ACK] Seq=2059 Ack=468719 Win=17520 Len=0 TSval=34152899 TSecr=150408556
611877 194.134970 153.160.160.108 -> 244.3.210.197 TCP 70 36450 > http [ACK] Seq=2059 Ack=471615 Win=17520 Len=0 TSval=34152899 TSecr=150408556
612037 194.206462 153.160.160.108 -> 244.3.210.197 TCP 70 36450 > http [ACK] Seq=2059 Ack=474511 Win=17520 Len=0 TSval=34152907 TSecr=150408557
612051 194.209561 153.160.160.108 -> 244.3.210.197 TCP 70 36450 > http [ACK] Seq=2059 Ack=477407 Win=17520 Len=0 TSval=34152907 TSecr=150408557
612052 194.209565 153.160.160.108 -> 244.3.210.197 TCP 70 36450 > http [ACK] Seq=2059 Ack=480303 Win=17520 Len=0 TSval=34152907 TSecr=150408557
612053 194.209569 153.160.160.108 -> 244.3.210.197 TCP 70 36450 > http [ACK] Seq=2059 Ack=483199 Win=17520 Len=0 TSval=34152907 TSecr=150408557
612076 194.210112 153.160.160.108 -> 244.3.210.197 TCP 70 36450 > http [ACK] Seq=2059 Ack=486095 Win=17520 Len=0 TSval=34152907 TSecr=150408557
612080 194.210344 153.160.160.108 -> 244.3.210.197 TCP 70 36450 > http [ACK] Seq=2059 Ack=488991 Win=17520 Len=0 TSval=34152907 TSecr=150408557
612245 194.281907 153.160.160.108 -> 244.3.210.197 TCP 70 36450 > http [ACK] Seq=2059 Ack=491887 Win=17520 Len=0 TSval=34152914 TSecr=150408558
612262 194.285100 153.160.160.108 -> 244.3.210.197 TCP 70 36450 > http [ACK] Seq=2059 Ack=494783 Win=17520 Len=0 TSval=34152914 TSecr=150408558
612263 194.285104 153.160.160.108 -> 244.3.210.197 TCP 70 36450 > http [ACK] Seq=2059 Ack=497679 Win=17520 Len=0 TSval=34152914 TSecr=150408558
612279 194.285303 153.160.160.108 -> 244.3.210.197 TCP 70 36450 > http [ACK] Seq=2059 Ack=500575 Win=17520 Len=0 TSval=34152914 TSecr=150408558
612282 194.285315 153.160.160.108 -> 244.3.210.197 TCP 70 36450 > http [ACK] Seq=2059 Ack=503471 Win=17520 Len=0 TSval=34152914 TSecr=150408558
612295 194.285605 153.160.160.108 -> 244.3.210.197 TCP 70 36450 > http [ACK] Seq=2059 Ack=506367 Win=17520 Len=0 TSval=34152915 TSecr=150408558
612448 194.357289 153.160.160.108 -> 244.3.210.197 TCP 70 36450 > http [ACK] Seq=2059 Ack=509263 Win=17520 Len=0 TSval=34152922 TSecr=150408558
612457 194.360305 153.160.160.108 -> 244.3.210.197 TCP 70 36450 > http [ACK] Seq=2059 Ack=512159 Win=17520 Len=0 TSval=34152922 TSecr=150408558
612458 194.360310 153.160.160.108 -> 244.3.210.197 TCP 70 36450 > http [ACK] Seq=2059 Ack=515055 Win=17520 Len=0 TSval=34152922 TSecr=150408558
612475 194.360749 153.160.160.108 -> 244.3.210.197 TCP 70 36450 > http [ACK] Seq=2059 Ack=517951 Win=17520 Len=0 TSval=34152922 TSecr=150408558
612476 194.360756 153.160.160.108 -> 244.3.210.197 TCP 70 36450 > http [ACK] Seq=2059 Ack=520847 Win=17520 Len=0 TSval=34152922 TSecr=150408558
612483 194.360969 153.160.160.108 -> 244.3.210.197 TCP 70 36450 > http [ACK] Seq=2059 Ack=523743 Win=17520 Len=0 TSval=34152922 TSecr=150408558
612701 194.432562 153.160.160.108 -> 244.3.210.197 TCP 70 36450 > http [ACK] Seq=2059 Ack=526639 Win=17520 Len=0 TSval=34152929 TSecr=150408559
612714 194.435605 153.160.160.108 -> 244.3.210.197 TCP 70 36450 > http [ACK] Seq=2059 Ack=529535 Win=17520 Len=0 TSval=34152929 TSecr=150408559
612715 194.435609 153.160.160.108 -> 244.3.210.197 TCP 70 36450 > http [ACK] Seq=2059 Ack=532431 Win=17520 Len=0 TSval=34152929 TSecr=150408559
612733 194.436230 153.160.160.108 -> 244.3.210.197 TCP 70 36450 > http [ACK] Seq=2059 Ack=535327 Win=17520 Len=0 TSval=34152930 TSecr=150408559
612734 194.436235 153.160.160.108 -> 244.3.210.197 TCP 70 36450 > http [ACK] Seq=2059 Ack=538223 Win=17520 Len=0 TSval=34152930 TSecr=150408559
612735 194.436238 153.160.160.108 -> 244.3.210.197 TCP 70 36450 > http [ACK] Seq=2059 Ack=541119 Win=17520 Len=0 TSval=34152930 TSecr=150408559
612922 194.507921 153.160.160.108 -> 244.3.210.197 TCP 70 36450 > http [ACK] Seq=2059 Ack=544015 Win=17520 Len=0 TSval=34152937 TSecr=150408560
612951 194.511104 153.160.160.108 -> 244.3.210.197 TCP 70 36450 > http [ACK] Seq=2059 Ack=546911 Win=17520 Len=0 TSval=34152937 TSecr=150408560
612952 194.511108 153.160.160.108 -> 244.3.210.197 TCP 70 36450 > http [ACK] Seq=2059 Ack=549807 Win=17520 Len=0 TSval=34152937 TSecr=150408560
612972 194.511542 153.160.160.108 -> 244.3.210.197 TCP 70 36450 > http [ACK] Seq=2059 Ack=552703 Win=17520 Len=0 TSval=34152937 TSecr=150408560
613002 194.512184 153.160.160.108 -> 244.3.210.197 TCP 70 36450 > http [ACK] Seq=2059 Ack=555599 Win=17520 Len=0 TSval=34152937 TSecr=150408560
613003 194.512188 153.160.160.108 -> 244.3.210.197 TCP 70 36450 > http [ACK] Seq=2059 Ack=558495 Win=17520 Len=0 TSval=34152937 TSecr=150408560
613238 194.583442 153.160.160.108 -> 244.3.210.197 TCP 70 36450 > http [ACK] Seq=2059 Ack=561391 Win=17520 Len=0 TSval=34152944 TSecr=150408561
613252 194.586535 153.160.160.108 -> 244.3.210.197 TCP 70 36450 > http [ACK] Seq=2059 Ack=564287 Win=17520 Len=0 TSval=34152945 TSecr=150408561
613253 194.586540 153.160.160.108 -> 244.3.210.197 TCP 70 36450 > http [ACK] Seq=2059 Ack=567183 Win=17520 Len=0 TSval=34152945 TSecr=150408561
613268 194.587432 153.160.160.108 -> 244.3.210.197 TCP 70 36450 > http [ACK] Seq=2059 Ack=570079 Win=17520 Len=0 TSval=34152945 TSecr=150408561
613279 194.587608 153.160.160.108 -> 244.3.210.197 TCP 70 36450 > http [ACK] Seq=2059 Ack=572975 Win=17520 Len=0 TSval=34152945 TSecr=150408561
613280 194.587637 153.160.160.108 -> 244.3.210.197 TCP 70 36450 > http [ACK] Seq=2059 Ack=575871 Win=17520 Len=0 TSval=34152945 TSecr=150408561
613519 194.658832 153.160.160.108 -> 244.3.210.197 TCP 70 36450 > http [ACK] Seq=2059 Ack=578767 Win=17520 Len=0 TSval=34152952 TSecr=150408561
613553 194.662073 153.160.160.108 -> 244.3.210.197 TCP 70 36450 > http [ACK] Seq=2059 Ack=581663 Win=17520 Len=0 TSval=34152952 TSecr=150408561
613554 194.662079 153.160.160.108 -> 244.3.210.197 TCP 70 36450 > http [ACK] Seq=2059 Ack=584559 Win=17520 Len=0 TSval=34152952 TSecr=150408561
613570 194.662681 153.160.160.108 -> 244.3.210.197 TCP 70 36450 > http [ACK] Seq=2059 Ack=587455 Win=17520 Len=0 TSval=34152952 TSecr=150408561
613578 194.663212 153.160.160.108 -> 244.3.210.197 TCP 70 36450 > http [ACK] Seq=2059 Ack=590351 Win=17520 Len=0 TSval=34152952 TSecr=150408561
613579 194.663216 153.160.160.108 -> 244.3.210.197 TCP 70 36450 > http [ACK] Seq=2059 Ack=593247 Win=17520 Len=0 TSval=34152952 TSecr=150408561
613809 194.733949 153.160.160.108 -> 244.3.210.197 TCP 70 36450 > http [ACK] Seq=2059 Ack=596143 Win=17520 Len=0 TSval=34152959 TSecr=150408562
613824 194.737766 153.160.160.108 -> 244.3.210.197 TCP 70 36450 > http [ACK] Seq=2059 Ack=599039 Win=17520 Len=0 TSval=34152960 TSecr=150408562
613825 194.737771 153.160.160.108 -> 244.3.210.197 TCP 70 36450 > http [ACK] Seq=2059 Ack=601935 Win=17520 Len=0 TSval=34152960 TSecr=150408562
613841 194.738722 153.160.160.108 -> 244.3.210.197 TCP 70 36450 > http [ACK] Seq=2059 Ack=604831 Win=17520 Len=0 TSval=34152960 TSecr=150408562
613854 194.738972 153.160.160.108 -> 244.3.210.197 TCP 70 36450 > http [ACK] Seq=2059 Ack=607727 Win=17520 Len=0 TSval=34152960 TSecr=150408562
613855 194.738976 153.160.160.108 -> 244.3.210.197 TCP 70 36450 > http [ACK] Seq=2059 Ack=610623 Win=17520 Len=0 TSval=34152960 TSecr=150408562
614031 194.809625 153.160.160.108 -> 244.3.210.197 TCP 70 36450 > http [ACK] Seq=2059 Ack=613519 Win=17520 Len=0 TSval=34152967 TSecr=150408563
614047 194.813012 153.160.160.108 -> 244.3.210.197 TCP 70 36450 > http [ACK] Seq=2059 Ack=616415 Win=17520 Len=0 TSval=34152967 TSecr=150408563
614055 194.813257 153.160.160.108 -> 244.3.210.197 TCP 70 36450 > http [ACK] Seq=2059 Ack=619311 Win=17520 Len=0 TSval=34152967 TSecr=150408563
614067 194.814178 153.160.160.108 -> 244.3.210.197 TCP 70 36450 > http [ACK] Seq=2059 Ack=622207 Win=17520 Len=0 TSval=34152967 TSecr=150408563
614068 194.814182 153.160.160.108 -> 244.3.210.197 TCP 70 36450 > http [ACK] Seq=2059 Ack=625103 Win=17520 Len=0 TSval=34152967 TSecr=150408563
614069 194.814186 153.160.160.108 -> 244.3.210.197 TCP 70 36450 > http [ACK] Seq=2059 Ack=627999 Win=17520 Len=0 TSval=34152967 TSecr=150408563
614223 194.885071 153.160.160.108 -> 244.3.210.197 TCP 70 36450 > http [ACK] Seq=2059 Ack=630895 Win=17520 Len=0 TSval=34152974 TSecr=150408564
614251 194.888317 153.160.160.108 -> 244.3.210.197 TCP 70 36450 > http [ACK] Seq=2059 Ack=633791 Win=17520 Len=0 TSval=34152975 TSecr=150408564
614265 194.888584 153.160.160.108 -> 244.3.210.197 TCP 70 36450 > http [ACK] Seq=2059 Ack=636687 Win=17520 Len=0 TSval=34152975 TSecr=150408564
614274 194.889472 153.160.160.108 -> 244.3.210.197 TCP 70 36450 > http [ACK] Seq=2059 Ack=639583 Win=17520 Len=0 TSval=34152975 TSecr=150408564
614275 194.889581 153.160.160.108 -> 244.3.210.197 TCP 70 36450 > http [ACK] Seq=2059 Ack=642479 Win=17520 Len=0 TSval=34152975 TSecr=150408564
614276 194.889588 153.160.160.108 -> 244.3.210.197 TCP 70 36450 > http [ACK] Seq=2059 Ack=642900 Win=17099 Len=0 TSval=34152975 TSecr=150408564
673365 210.051716 153.160.160.108 -> 244.3.210.197 TCP 70 36450 > http [FIN, ACK] Seq=2059 Ack=642900 Win=17520 Len=0 TSval=34154492 TSecr=150408564
673557 210.126751 153.160.160.108 -> 244.3.210.197 TCP 70 36450 > http [ACK] Seq=2060 Ack=642901 Win=17520 Len=0 TSval=34154500 TSecr=150408715
