586450 186.803448 154.105.77.57 -> 244.3.160.239 TCP 66 http > 34749 [SYN, ACK] Seq=0 Ack=1 Win=65535 Len=0 MSS=1460 SACK_PERM=1
587185 187.023238 154.105.77.57 -> 244.3.160.239 TCP 64 http > 34749 [ACK] Seq=1 Ack=1197 Win=64339 Len=0
588432 187.430107 154.105.77.57 -> 244.3.160.239 TCP 66 http > 34751 [SYN, ACK] Seq=0 Ack=1 Win=65535 Len=0 MSS=1460 SACK_PERM=1
588446 187.431373 154.105.77.57 -> 244.3.160.239 TCP 66 http > 34752 [SYN, ACK] Seq=0 Ack=1 Win=65535 Len=0 MSS=1460 SACK_PERM=1
588452 187.432571 154.105.77.57 -> 244.3.160.239 TCP 66 http > 34753 [SYN, ACK] Seq=0 Ack=1 Win=65535 Len=0 MSS=1460 SACK_PERM=1
588459 187.435623 154.105.77.57 -> 244.3.160.239 TCP 66 http > 34754 [SYN, ACK] Seq=0 Ack=1 Win=65535 Len=0 MSS=1460 SACK_PERM=1
588620 187.538624 154.105.77.57 -> 244.3.160.239 TCP 64 http > 34751 [ACK] Seq=1 Ack=1544 Win=65535 Len=0
588623 187.540145 154.105.77.57 -> 244.3.160.239 TCP 64 http > 34752 [ACK] Seq=1 Ack=1547 Win=65535 Len=0
588628 187.541096 154.105.77.57 -> 244.3.160.239 TCP 64 http > 34753 [ACK] Seq=1 Ack=1544 Win=65535 Len=0
588659 187.544646 154.105.77.57 -> 244.3.160.239 TCP 64 http > 34754 [ACK] Seq=1 Ack=1543 Win=65535 Len=0
588980 187.649099 154.105.77.57 -> 244.3.160.239 TCP 64 http > 34751 [ACK] Seq=272 Ack=1545 Win=65535 Len=0
588981 187.649104 154.105.77.57 -> 244.3.160.239 TCP 64 http > 34751 [FIN, ACK] Seq=272 Ack=1545 Win=65535 Len=0
588983 187.649886 154.105.77.57 -> 244.3.160.239 TCP 64 http > 34752 [ACK] Seq=274 Ack=1548 Win=65535 Len=0
588984 187.649891 154.105.77.57 -> 244.3.160.239 TCP 64 http > 34752 [FIN, ACK] Seq=274 Ack=1548 Win=65535 Len=0
588986 187.650894 154.105.77.57 -> 244.3.160.239 TCP 64 http > 34753 [ACK] Seq=273 Ack=1545 Win=65535 Len=0
588987 187.650898 154.105.77.57 -> 244.3.160.239 TCP 64 http > 34753 [FIN, ACK] Seq=273 Ack=1545 Win=65535 Len=0
588989 187.653191 154.105.77.57 -> 244.3.160.239 TCP 64 http > 34754 [ACK] Seq=274 Ack=1544 Win=65535 Len=0
588990 187.653196 154.105.77.57 -> 244.3.160.239 TCP 64 http > 34754 [FIN, ACK] Seq=274 Ack=1544 Win=65535 Len=0
590196 188.076813 154.105.77.57 -> 244.3.160.239 TCP 66 http > 34755 [SYN, ACK] Seq=0 Ack=1 Win=65535 Len=0 MSS=1460 SACK_PERM=1
590213 188.078089 154.105.77.57 -> 244.3.160.239 TCP 66 http > 34756 [SYN, ACK] Seq=0 Ack=1 Win=65535 Len=0 MSS=1460 SACK_PERM=1
590332 188.124595 154.105.77.57 -> 244.3.160.239 TCP 66 http > 34757 [SYN, ACK] Seq=0 Ack=1 Win=65535 Len=0 MSS=1460 SACK_PERM=1
590426 188.186733 154.105.77.57 -> 244.3.160.239 TCP 64 http > 34755 [ACK] Seq=1 Ack=1547 Win=65535 Len=0
590427 188.186738 154.105.77.57 -> 244.3.160.239 TCP 64 http > 34756 [ACK] Seq=1 Ack=1556 Win=65535 Len=0
590741 188.233218 154.105.77.57 -> 244.3.160.239 TCP 64 http > 34757 [ACK] Seq=1 Ack=1548 Win=65535 Len=0
591002 188.253455 154.105.77.57 -> 244.3.160.239 TCP 66 http > 34758 [SYN, ACK] Seq=0 Ack=1 Win=65535 Len=0 MSS=1460 SACK_PERM=1
591489 188.296568 154.105.77.57 -> 244.3.160.239 TCP 64 http > 34756 [ACK] Seq=274 Ack=1557 Win=65535 Len=0
591490 188.296572 154.105.77.57 -> 244.3.160.239 TCP 64 http > 34756 [FIN, ACK] Seq=274 Ack=1557 Win=65535 Len=0
591598 188.306190 154.105.77.57 -> 244.3.160.239 TCP 66 http > 34759 [SYN, ACK] Seq=0 Ack=1 Win=65535 Len=0 MSS=1460 SACK_PERM=1
592343 188.362196 154.105.77.57 -> 244.3.160.239 TCP 64 http > 34758 [ACK] Seq=1 Ack=1540 Win=65535 Len=0
593053 188.414821 154.105.77.57 -> 244.3.160.239 TCP 64 http > 34759 [ACK] Seq=1 Ack=1542 Win=65535 Len=0
593516 188.471898 154.105.77.57 -> 244.3.160.239 TCP 64 http > 34758 [ACK] Seq=273 Ack=1541 Win=65535 Len=0
593517 188.471902 154.105.77.57 -> 244.3.160.239 TCP 64 http > 34758 [FIN, ACK] Seq=273 Ack=1541 Win=65535 Len=0
594017 188.519200 154.105.77.57 -> 244.3.160.239 TCP 64 http > 34757 [ACK] Seq=537 Ack=1549 Win=65535 Len=0
594018 188.519205 154.105.77.57 -> 244.3.160.239 TCP 64 http > 34757 [FIN, ACK] Seq=537 Ack=1549 Win=65535 Len=0
594052 188.524108 154.105.77.57 -> 244.3.160.239 TCP 64 http > 34759 [ACK] Seq=273 Ack=1543 Win=65535 Len=0
594053 188.524112 154.105.77.57 -> 244.3.160.239 TCP 64 http > 34759 [FIN, ACK] Seq=273 Ack=1543 Win=65535 Len=0
594853 188.626360 154.105.77.57 -> 244.3.160.239 TCP 66 http > 34760 [SYN, ACK] Seq=0 Ack=1 Win=65535 Len=0 MSS=1460 SACK_PERM=1
595351 188.735073 154.105.77.57 -> 244.3.160.239 TCP 64 http > 34760 [ACK] Seq=1 Ack=1952 Win=65535 Len=0
595973 188.844536 154.105.77.57 -> 244.3.160.239 TCP 93 [TCP segment of a reassembled PDU]
596079 188.859374 154.105.77.57 -> 244.3.160.239 TCP 64 http > 34755 [ACK] Seq=37750 Ack=1548 Win=65535 Len=0
596080 188.859378 154.105.77.57 -> 244.3.160.239 TCP 64 http > 34755 [FIN, ACK] Seq=37750 Ack=1548 Win=65535 Len=0
596203 188.882687 154.105.77.57 -> 244.3.160.239 TCP 66 http > 34761 [SYN, ACK] Seq=0 Ack=1 Win=65535 Len=0 MSS=1460 SACK_PERM=1
596234 188.883690 154.105.77.57 -> 244.3.160.239 TCP 66 http > 34762 [SYN, ACK] Seq=0 Ack=1 Win=65535 Len=0 MSS=1460 SACK_PERM=1
596286 188.887707 154.105.77.57 -> 244.3.160.239 TCP 66 http > 34763 [SYN, ACK] Seq=0 Ack=1 Win=65535 Len=0 MSS=1460 SACK_PERM=1
596822 188.960884 154.105.77.57 -> 244.3.160.239 TCP 66 http > 34764 [SYN, ACK] Seq=0 Ack=1 Win=65535 Len=0 MSS=1460 SACK_PERM=1
596856 188.991496 154.105.77.57 -> 244.3.160.239 TCP 64 http > 34761 [ACK] Seq=1 Ack=1588 Win=65535 Len=0
596859 188.992949 154.105.77.57 -> 244.3.160.239 TCP 64 http > 34762 [ACK] Seq=1 Ack=1587 Win=65535 Len=0
596873 188.996392 154.105.77.57 -> 244.3.160.239 TCP 64 http > 34763 [ACK] Seq=1 Ack=1583 Win=65535 Len=0
597046 189.058593 154.105.77.57 -> 244.3.160.239 TCP 64 http > 34760 [ACK] Seq=392 Ack=1953 Win=65535 Len=0
597047 189.058598 154.105.77.57 -> 244.3.160.239 TCP 64 http > 34760 [FIN, ACK] Seq=392 Ack=1953 Win=65535 Len=0
597060 189.069404 154.105.77.57 -> 244.3.160.239 TCP 64 http > 34764 [ACK] Seq=1 Ack=1601 Win=65535 Len=0
597129 189.101927 154.105.77.57 -> 244.3.160.239 TCP 64 http > 34761 [ACK] Seq=273 Ack=1589 Win=65535 Len=0
597130 189.101932 154.105.77.57 -> 244.3.160.239 TCP 64 http > 34761 [FIN, ACK] Seq=273 Ack=1589 Win=65535 Len=0
597132 189.102197 154.105.77.57 -> 244.3.160.239 TCP 64 http > 34762 [ACK] Seq=272 Ack=1588 Win=65535 Len=0
597133 189.102201 154.105.77.57 -> 244.3.160.239 TCP 64 http > 34762 [FIN, ACK] Seq=272 Ack=1588 Win=65535 Len=0
597141 189.105590 154.105.77.57 -> 244.3.160.239 TCP 64 http > 34763 [ACK] Seq=273 Ack=1584 Win=65535 Len=0
597142 189.105595 154.105.77.57 -> 244.3.160.239 TCP 64 http > 34763 [FIN, ACK] Seq=273 Ack=1584 Win=65535 Len=0
597306 189.179386 154.105.77.57 -> 244.3.160.239 TCP 64 http > 34764 [ACK] Seq=273 Ack=1602 Win=65535 Len=0
597316 189.179615 154.105.77.57 -> 244.3.160.239 TCP 64 http > 34764 [FIN, ACK] Seq=273 Ack=1602 Win=65535 Len=0
597372 189.207290 154.105.77.57 -> 244.3.160.239 TCP 66 http > 34766 [SYN, ACK] Seq=0 Ack=1 Win=65535 Len=0 MSS=1460 SACK_PERM=1
597378 189.208574 154.105.77.57 -> 244.3.160.239 TCP 66 http > 34767 [SYN, ACK] Seq=0 Ack=1 Win=65535 Len=0 MSS=1460 SACK_PERM=1
597617 189.316146 154.105.77.57 -> 244.3.160.239 TCP 64 http > 34766 [ACK] Seq=1 Ack=1582 Win=65535 Len=0
597644 189.317380 154.105.77.57 -> 244.3.160.239 TCP 64 http > 34767 [ACK] Seq=1 Ack=1585 Win=65535 Len=0
597818 189.370638 154.105.77.57 -> 244.3.160.239 TCP 66 http > 34769 [SYN, ACK] Seq=0 Ack=1 Win=65535 Len=0 MSS=1460 SACK_PERM=1
597958 189.424752 154.105.77.57 -> 244.3.160.239 TCP 64 http > 34766 [ACK] Seq=274 Ack=1583 Win=65535 Len=0
597959 189.424757 154.105.77.57 -> 244.3.160.239 TCP 64 http > 34766 [FIN, ACK] Seq=274 Ack=1583 Win=65535 Len=0
597965 189.426166 154.105.77.57 -> 244.3.160.239 TCP 64 http > 34767 [ACK] Seq=273 Ack=1586 Win=65535 Len=0
597966 189.426171 154.105.77.57 -> 244.3.160.239 TCP 64 http > 34767 [FIN, ACK] Seq=273 Ack=1586 Win=65535 Len=0
598049 189.479732 154.105.77.57 -> 244.3.160.239 TCP 64 http > 34769 [ACK] Seq=1 Ack=1593 Win=65535 Len=0
598097 189.493504 154.105.77.57 -> 244.3.160.239 TCP 66 http > 34770 [SYN, ACK] Seq=0 Ack=1 Win=65535 Len=0 MSS=1460 SACK_PERM=1
598102 189.497175 154.105.77.57 -> 244.3.160.239 TCP 66 http > 34771 [SYN, ACK] Seq=0 Ack=1 Win=65535 Len=0 MSS=1460 SACK_PERM=1
598270 189.588645 154.105.77.57 -> 244.3.160.239 TCP 64 http > 34769 [ACK] Seq=274 Ack=1594 Win=65535 Len=0
598271 189.588809 154.105.77.57 -> 244.3.160.239 TCP 64 http > 34769 [FIN, ACK] Seq=274 Ack=1594 Win=65535 Len=0
598307 189.601648 154.105.77.57 -> 244.3.160.239 TCP 66 http > 34772 [SYN, ACK] Seq=0 Ack=1 Win=65535 Len=0 MSS=1460 SACK_PERM=1
598309 189.602386 154.105.77.57 -> 244.3.160.239 TCP 64 http > 34770 [ACK] Seq=1 Ack=1592 Win=65535 Len=0
598326 189.605564 154.105.77.57 -> 244.3.160.239 TCP 64 http > 34771 [ACK] Seq=1 Ack=1593 Win=65535 Len=0
598569 189.711050 154.105.77.57 -> 244.3.160.239 TCP 64 http > 34772 [ACK] Seq=1 Ack=1592 Win=65535 Len=0
598575 189.711893 154.105.77.57 -> 244.3.160.239 TCP 64 http > 34770 [ACK] Seq=274 Ack=1593 Win=65535 Len=0
598579 189.712084 154.105.77.57 -> 244.3.160.239 TCP 64 http > 34770 [FIN, ACK] Seq=274 Ack=1593 Win=65535 Len=0
598602 189.714956 154.105.77.57 -> 244.3.160.239 TCP 64 http > 34771 [ACK] Seq=274 Ack=1594 Win=65535 Len=0
598603 189.714961 154.105.77.57 -> 244.3.160.239 TCP 64 http > 34771 [FIN, ACK] Seq=274 Ack=1594 Win=65535 Len=0
598697 189.750808 154.105.77.57 -> 244.3.160.239 TCP 66 http > 34775 [SYN, ACK] Seq=0 Ack=1 Win=65535 Len=0 MSS=1460 SACK_PERM=1
598701 189.751020 154.105.77.57 -> 244.3.160.239 TCP 66 http > 34776 [SYN, ACK] Seq=0 Ack=1 Win=65535 Len=0 MSS=1460 SACK_PERM=1
598828 189.819939 154.105.77.57 -> 244.3.160.239 TCP 64 http > 34772 [ACK] Seq=273 Ack=1593 Win=65535 Len=0
598829 189.819944 154.105.77.57 -> 244.3.160.239 TCP 64 http > 34772 [FIN, ACK] Seq=273 Ack=1593 Win=65535 Len=0
598874 189.842035 154.105.77.57 -> 244.3.160.239 TCP 66 http > 34777 [SYN, ACK] Seq=0 Ack=1 Win=65535 Len=0 MSS=1460 SACK_PERM=1
598931 189.859807 154.105.77.57 -> 244.3.160.239 TCP 64 http > 34775 [ACK] Seq=1 Ack=1591 Win=65535 Len=0
599001 189.909121 154.105.77.57 -> 244.3.160.239 TCP 64 http > 34749 [FIN, ACK] Seq=143362 Ack=1197 Win=64339 Len=0
599143 189.950655 154.105.77.57 -> 244.3.160.239 TCP 64 http > 34777 [ACK] Seq=1 Ack=1591 Win=65535 Len=0
599202 189.968729 154.105.77.57 -> 244.3.160.239 TCP 64 http > 34775 [ACK] Seq=274 Ack=1592 Win=65535 Len=0
599203 189.968733 154.105.77.57 -> 244.3.160.239 TCP 64 http > 34775 [FIN, ACK] Seq=274 Ack=1592 Win=65535 Len=0
599207 189.969430 154.105.77.57 -> 244.3.160.239 TCP 64 http > 34776 [ACK] Seq=273 Ack=1600 Win=65535 Len=0
599228 189.980823 154.105.77.57 -> 244.3.160.239 TCP 66 http > 34779 [SYN, ACK] Seq=0 Ack=1 Win=65535 Len=0 MSS=1460 SACK_PERM=1
599234 189.982070 154.105.77.57 -> 244.3.160.239 TCP 66 http > 34780 [SYN, ACK] Seq=0 Ack=1 Win=65535 Len=0 MSS=1460 SACK_PERM=1
599332 190.017464 154.105.77.57 -> 244.3.160.239 TCP 64 http > 34749 [ACK] Seq=143363 Ack=1198 Win=64339 Len=0
599394 190.060091 154.105.77.57 -> 244.3.160.239 TCP 64 http > 34777 [ACK] Seq=273 Ack=1592 Win=65535 Len=0
599395 190.060096 154.105.77.57 -> 244.3.160.239 TCP 64 http > 34777 [FIN, ACK] Seq=273 Ack=1592 Win=65535 Len=0
599406 190.072232 154.105.77.57 -> 244.3.160.239 TCP 66 http > 34782 [SYN, ACK] Seq=0 Ack=1 Win=65535 Len=0 MSS=1460 SACK_PERM=1
599467 190.089703 154.105.77.57 -> 244.3.160.239 TCP 64 http > 34779 [ACK] Seq=1 Ack=1588 Win=65535 Len=0
599472 190.090557 154.105.77.57 -> 244.3.160.239 TCP 64 http > 34780 [ACK] Seq=1 Ack=1589 Win=65535 Len=0
599802 190.180970 154.105.77.57 -> 244.3.160.239 TCP 64 http > 34782 [ACK] Seq=1 Ack=1592 Win=65535 Len=0
599969 190.200379 154.105.77.57 -> 244.3.160.239 TCP 64 http > 34779 [ACK] Seq=274 Ack=1589 Win=65535 Len=0
599970 190.200383 154.105.77.57 -> 244.3.160.239 TCP 64 http > 34779 [FIN, ACK] Seq=274 Ack=1589 Win=65535 Len=0
599973 190.200560 154.105.77.57 -> 244.3.160.239 TCP 64 http > 34780 [ACK] Seq=274 Ack=1590 Win=65535 Len=0
599974 190.200565 154.105.77.57 -> 244.3.160.239 TCP 64 http > 34780 [FIN, ACK] Seq=274 Ack=1590 Win=65535 Len=0
600011 190.212712 154.105.77.57 -> 244.3.160.239 TCP 66 http > 34784 [SYN, ACK] Seq=0 Ack=1 Win=65535 Len=0 MSS=1460 SACK_PERM=1
600441 190.290388 154.105.77.57 -> 244.3.160.239 TCP 64 http > 34782 [ACK] Seq=274 Ack=1593 Win=65535 Len=0
600442 190.290393 154.105.77.57 -> 244.3.160.239 TCP 64 http > 34782 [FIN, ACK] Seq=274 Ack=1593 Win=65535 Len=0
600462 190.300190 154.105.77.57 -> 244.3.160.239 TCP 66 http > 34785 [SYN, ACK] Seq=0 Ack=1 Win=65535 Len=0 MSS=1460 SACK_PERM=1
600528 190.321154 154.105.77.57 -> 244.3.160.239 TCP 64 http > 34784 [ACK] Seq=1 Ack=1549 Win=65535 Len=0
600725 190.408723 154.105.77.57 -> 244.3.160.239 TCP 64 http > 34785 [ACK] Seq=1 Ack=1593 Win=65535 Len=0
600977 190.517542 154.105.77.57 -> 244.3.160.239 TCP 64 http > 34785 [ACK] Seq=273 Ack=1594 Win=65535 Len=0
600980 190.517791 154.105.77.57 -> 244.3.160.239 TCP 64 http > 34785 [FIN, ACK] Seq=273 Ack=1594 Win=65535 Len=0
600995 190.531276 154.105.77.57 -> 244.3.160.239 TCP 66 http > 34789 [SYN, ACK] Seq=0 Ack=1 Win=65535 Len=0 MSS=1460 SACK_PERM=1
601234 190.627470 154.105.77.57 -> 244.3.160.239 TCP 66 http > 34790 [SYN, ACK] Seq=0 Ack=1 Win=65535 Len=0 MSS=1460 SACK_PERM=1
601245 190.639891 154.105.77.57 -> 244.3.160.239 TCP 64 http > 34789 [ACK] Seq=1 Ack=1533 Win=65535 Len=0
601450 190.708646 154.105.77.57 -> 244.3.160.239 TCP 64 http > 34784 [ACK] Seq=4280 Ack=1550 Win=65535 Len=0
601451 190.708650 154.105.77.57 -> 244.3.160.239 TCP 64 http > 34784 [FIN, ACK] Seq=4280 Ack=1550 Win=65535 Len=0
601523 190.736028 154.105.77.57 -> 244.3.160.239 TCP 64 http > 34790 [ACK] Seq=1 Ack=1534 Win=65535 Len=0
602152 190.958714 154.105.77.57 -> 244.3.160.239 TCP 64 http > 34789 [ACK] Seq=1213 Ack=1534 Win=65535 Len=0
602153 190.958718 154.105.77.57 -> 244.3.160.239 TCP 64 http > 34789 [FIN, ACK] Seq=1213 Ack=1534 Win=65535 Len=0
602155 190.960441 154.105.77.57 -> 244.3.160.239 TCP 64 http > 34790 [ACK] Seq=923 Ack=1535 Win=65535 Len=0
602156 190.960713 154.105.77.57 -> 244.3.160.239 TCP 64 http > 34790 [FIN, ACK] Seq=923 Ack=1535 Win=65535 Len=0
606604 192.370836 154.105.77.57 -> 244.3.160.239 TCP 66 http > 34765 [SYN, ACK] Seq=0 Ack=1 Win=65535 Len=0 MSS=1460 SACK_PERM=1
606854 192.479652 154.105.77.57 -> 244.3.160.239 TCP 64 http > 34765 [ACK] Seq=1 Ack=1587 Win=65535 Len=0
607114 192.589144 154.105.77.57 -> 244.3.160.239 TCP 64 http > 34765 [ACK] Seq=273 Ack=1588 Win=65535 Len=0
607115 192.589148 154.105.77.57 -> 244.3.160.239 TCP 64 http > 34765 [FIN, ACK] Seq=273 Ack=1588 Win=65535 Len=0
608934 193.389639 154.105.77.57 -> 244.3.160.239 TCP 66 http > 34783 [SYN, ACK] Seq=0 Ack=1 Win=65535 Len=0 MSS=1460 SACK_PERM=1
609264 193.498312 154.105.77.57 -> 244.3.160.239 TCP 64 http > 34783 [ACK] Seq=1 Ack=1549 Win=65535 Len=0
610537 193.810108 154.105.77.57 -> 244.3.160.239 TCP 64 http > 34783 [ACK] Seq=5115 Ack=1550 Win=65535 Len=0
610538 193.810113 154.105.77.57 -> 244.3.160.239 TCP 64 http > 34783 [FIN, ACK] Seq=5115 Ack=1550 Win=65535 Len=0
626802 198.996763 154.105.77.57 -> 244.3.160.239 TCP 66 http > 34883 [SYN, ACK] Seq=0 Ack=1 Win=65535 Len=0 MSS=1460 SACK_PERM=1
627185 199.105347 154.105.77.57 -> 244.3.160.239 TCP 64 http > 34883 [ACK] Seq=1 Ack=1630 Win=65535 Len=0
629990 199.733532 154.105.77.57 -> 244.3.160.239 TCP 90 [TCP segment of a reassembled PDU]
631077 199.951703 154.105.77.57 -> 244.3.160.239 TCP 90 [TCP segment of a reassembled PDU]
631752 200.169309 154.105.77.57 -> 244.3.160.239 TCP 90 [TCP segment of a reassembled PDU]
632932 200.386245 154.105.77.57 -> 244.3.160.239 TCP 90 [TCP segment of a reassembled PDU]
634065 200.604340 154.105.77.57 -> 244.3.160.239 TCP 90 [TCP segment of a reassembled PDU]
635371 200.821320 154.105.77.57 -> 244.3.160.239 TCP 90 [TCP segment of a reassembled PDU]
636857 201.038803 154.105.77.57 -> 244.3.160.239 TCP 90 [TCP segment of a reassembled PDU]
639883 201.983800 154.105.77.57 -> 244.3.160.239 TCP 90 [TCP segment of a reassembled PDU]
641017 202.294895 154.105.77.57 -> 244.3.160.239 TCP 90 [TCP segment of a reassembled PDU]
642253 202.525731 154.105.77.57 -> 244.3.160.239 TCP 90 [TCP segment of a reassembled PDU]
644340 202.744161 154.105.77.57 -> 244.3.160.239 TCP 90 [TCP segment of a reassembled PDU]
646319 203.292001 154.105.77.57 -> 244.3.160.239 TCP 64 http > 34883 [ACK] Seq=477972 Ack=1631 Win=65535 Len=0
646320 203.292006 154.105.77.57 -> 244.3.160.239 TCP 64 http > 34883 [FIN, ACK] Seq=477972 Ack=1631 Win=65535 Len=0
