36746  15.358149 156.224.224.186 -> 41.177.26.254 TCP 78 hdl-srv > 38044 [SYN, ACK] Seq=0 Ack=1 Win=5792 Len=0 MSS=1460 SACK_PERM=1 TSval=2349161478 TSecr=1509546990 WS=128
37083  15.459800 156.224.224.186 -> 41.177.26.254 TCP 70 hdl-srv > 38044 [ACK] Seq=1 Ack=21 Win=5888 Len=0 TSval=2349161503 TSecr=1509547001
37155  15.495017 156.224.224.186 -> 41.177.26.254 TCP 70 hdl-srv > 38044 [ACK] Seq=1 Ack=74 Win=5888 Len=0 TSval=2349161512 TSecr=1509547004
37159  15.498866 156.224.224.186 -> 41.177.26.254 TCP 90 hdl-srv > 38044 [PSH, ACK] Seq=1 Ack=74 Win=5888 Len=20 TSval=2349161513 TSecr=1509547004
37161  15.499057 156.224.224.186 -> 41.177.26.254 TCP 678 hdl-srv > 38044 [FIN, PSH, ACK] Seq=21 Ack=74 Win=5888 Len=608 TSval=2349161513 TSecr=1509547004
37286  15.540887 156.224.224.186 -> 41.177.26.254 TCP 70 hdl-srv > 38044 [ACK] Seq=630 Ack=75 Win=5888 Len=0 TSval=2349161524 TSecr=1509547009
