471129 155.571510 156.224.224.225 -> 244.3.160.239 TCP 66 http > 34328 [SYN, ACK] Seq=0 Ack=1 Win=5840 Len=0 MSS=1460 SACK_PERM=1
471212 155.609547 156.224.224.225 -> 244.3.160.239 TCP 64 http > 34328 [ACK] Seq=1 Ack=1331 Win=7980 Len=0
471317 155.655074 156.224.224.225 -> 244.3.160.239 TCP 64 http > 34328 [FIN, ACK] Seq=401 Ack=1332 Win=7980 Len=0
520789 168.566563 156.224.224.225 -> 244.3.160.239 TCP 66 http > 34599 [SYN, ACK] Seq=0 Ack=1 Win=5840 Len=0 MSS=1460 SACK_PERM=1
520832 168.603987 156.224.224.225 -> 244.3.160.239 TCP 64 http > 34599 [ACK] Seq=1 Ack=1017 Win=7112 Len=0
521094 168.665685 156.224.224.225 -> 244.3.160.239 TCP 64 http > 34599 [FIN, ACK] Seq=359 Ack=1018 Win=7112 Len=0
