834525 273.194140 16.186.210.108 -> 244.3.210.197 TCP 78 48012 > http [SYN] Seq=0 Win=5840 Len=0 MSS=1460 SACK_PERM=1 TSval=1294231361 TSecr=0 WS=512
834931 273.336618 16.186.210.108 -> 244.3.210.197 TCP 70 48012 > http [ACK] Seq=1 Ack=1 Win=6144 Len=0 TSval=1294231511 TSecr=0
835887 273.642485 16.186.210.108 -> 244.3.210.197 TCP 70 48012 > http [ACK] Seq=199 Ack=1449 Win=9216 Len=0 TSval=1294231817 TSecr=150406747
835888 273.642490 16.186.210.108 -> 244.3.210.197 TCP 70 48012 > http [ACK] Seq=199 Ack=2897 Win=11776 Len=0 TSval=1294231818 TSecr=150406747
836157 273.784726 16.186.210.108 -> 244.3.210.197 TCP 70 48012 > http [ACK] Seq=199 Ack=4345 Win=14848 Len=0 TSval=1294231960 TSecr=150406749
836158 273.784731 16.186.210.108 -> 244.3.210.197 TCP 70 48012 > http [ACK] Seq=199 Ack=5793 Win=17920 Len=0 TSval=1294231960 TSecr=150406749
836159 273.784735 16.186.210.108 -> 244.3.210.197 TCP 70 48012 > http [ACK] Seq=199 Ack=5829 Win=17920 Len=0 TSval=1294231960 TSecr=150406749
836263 273.824446 16.186.210.108 -> 244.3.210.197 TCP 70 48012 > http [ACK] Seq=199 Ack=6555 Win=20480 Len=0 TSval=1294232000 TSecr=150406749
836470 273.925367 16.186.210.108 -> 244.3.210.197 TCP 70 48012 > http [FIN, ACK] Seq=199 Ack=6555 Win=20480 Len=0 TSval=1294232100 TSecr=150406749
837271 274.287294 16.186.210.108 -> 244.3.210.197 TCP 78 48873 > http [SYN] Seq=0 Win=5840 Len=0 MSS=1460 SACK_PERM=1 TSval=1294232461 TSecr=0 WS=512
837555 274.429517 16.186.210.108 -> 244.3.210.197 TCP 70 48873 > http [ACK] Seq=1 Ack=1 Win=6144 Len=0 TSval=1294232605 TSecr=0
838738 274.903928 16.186.210.108 -> 244.3.210.197 TCP 70 48873 > http [ACK] Seq=231 Ack=1449 Win=9216 Len=0 TSval=1294233079 TSecr=150406759
838739 274.903933 16.186.210.108 -> 244.3.210.197 TCP 70 48873 > http [ACK] Seq=231 Ack=2897 Win=11776 Len=0 TSval=1294233079 TSecr=150406759
839141 275.046286 16.186.210.108 -> 244.3.210.197 TCP 70 48873 > http [ACK] Seq=231 Ack=4345 Win=14848 Len=0 TSval=1294233222 TSecr=150406762
839142 275.046325 16.186.210.108 -> 244.3.210.197 TCP 70 48873 > http [ACK] Seq=231 Ack=5793 Win=17920 Len=0 TSval=1294233222 TSecr=150406762
839157 275.046595 16.186.210.108 -> 244.3.210.197 TCP 70 48873 > http [ACK] Seq=231 Ack=7241 Win=20480 Len=0 TSval=1294233222 TSecr=150406762
839158 275.046656 16.186.210.108 -> 244.3.210.197 TCP 70 48873 > http [ACK] Seq=231 Ack=8689 Win=23552 Len=0 TSval=1294233222 TSecr=150406762
839415 275.188694 16.186.210.108 -> 244.3.210.197 TCP 70 48873 > http [ACK] Seq=231 Ack=10137 Win=26112 Len=0 TSval=1294233364 TSecr=150406763
839416 275.188699 16.186.210.108 -> 244.3.210.197 TCP 70 48873 > http [ACK] Seq=231 Ack=11585 Win=29184 Len=0 TSval=1294233364 TSecr=150406763
839417 275.188703 16.186.210.108 -> 244.3.210.197 TCP 70 48873 > http [ACK] Seq=231 Ack=11645 Win=29184 Len=0 TSval=1294233364 TSecr=150406763
839594 275.228551 16.186.210.108 -> 244.3.210.197 TCP 70 48873 > http [ACK] Seq=231 Ack=12556 Win=32256 Len=0 TSval=1294233404 TSecr=150406763
840232 275.495749 16.186.210.108 -> 244.3.210.197 TCP 70 48873 > http [FIN, ACK] Seq=231 Ack=12556 Win=32256 Len=0 TSval=1294233671 TSecr=150406763
