8203   2.887526 165.138.242.66 -> 41.177.98.176 TCP 64 61177 > http [ACK] Seq=1 Ack=2 Win=65535 Len=0
41207  17.215966 165.138.242.66 -> 41.177.98.176 TCP 64 61177 > http [FIN, ACK] Seq=1 Ack=2 Win=65535 Len=0
117432  42.107394 165.138.242.66 -> 41.177.98.176 TCP 66 59145 > http [SYN] Seq=0 Win=65535 Len=0 MSS=1452 SACK_PERM=1
117535  42.157754 165.138.242.66 -> 41.177.98.176 TCP 64 59145 > http [ACK] Seq=1 Ack=1 Win=65535 Len=0
117926  42.309994 165.138.242.66 -> 41.177.98.176 TCP 64 59145 > http [ACK] Seq=976 Ack=1472 Win=65535 Len=0
135491  47.138135 165.138.242.66 -> 41.177.98.176 TCP 64 59145 > http [ACK] Seq=1954 Ack=4376 Win=65535 Len=0
135518  47.144858 165.138.242.66 -> 41.177.98.176 TCP 64 59145 > http [ACK] Seq=1954 Ack=6805 Win=65535 Len=0
135662  47.196191 165.138.242.66 -> 41.177.98.176 TCP 64 59145 > http [ACK] Seq=1954 Ack=9709 Win=65535 Len=0
135682  47.203490 165.138.242.66 -> 41.177.98.176 TCP 64 59145 > http [ACK] Seq=1954 Ack=11933 Win=65535 Len=0
135702  47.212608 165.138.242.66 -> 41.177.98.176 TCP 64 59145 > http [ACK] Seq=1954 Ack=14837 Win=65535 Len=0
135807  47.252378 165.138.242.66 -> 41.177.98.176 TCP 64 59145 > http [ACK] Seq=1954 Ack=17061 Win=65535 Len=0
135823  47.261722 165.138.242.66 -> 41.177.98.176 TCP 64 59145 > http [ACK] Seq=1954 Ack=19965 Win=65535 Len=0
135841  47.270619 165.138.242.66 -> 41.177.98.176 TCP 64 59145 > http [ACK] Seq=1954 Ack=22817 Win=65535 Len=0
175394  58.316252 165.138.242.66 -> 41.177.98.176 TCP 64 59145 > http [ACK] Seq=2992 Ack=25721 Win=65535 Len=0
175399  58.323629 165.138.242.66 -> 41.177.98.176 TCP 64 59145 > http [ACK] Seq=2992 Ack=28150 Win=65535 Len=0
175494  58.333023 165.138.242.66 -> 41.177.98.176 TCP 64 59145 > http [ACK] Seq=2992 Ack=31054 Win=65535 Len=0
175551  58.340112 165.138.242.66 -> 41.177.98.176 TCP 64 59145 > http [ACK] Seq=2992 Ack=33278 Win=65535 Len=0
175628  58.349501 165.138.242.66 -> 41.177.98.176 TCP 64 59145 > http [ACK] Seq=2992 Ack=36182 Win=65535 Len=0
175634  58.355871 165.138.242.66 -> 41.177.98.176 TCP 64 59145 > http [ACK] Seq=2992 Ack=38406 Win=65535 Len=0
175652  58.370968 165.138.242.66 -> 41.177.98.176 TCP 64 59145 > http [ACK] Seq=2992 Ack=41310 Win=65535 Len=0
175665  58.376880 165.138.242.66 -> 41.177.98.176 TCP 64 59145 > http [ACK] Seq=2992 Ack=43534 Win=65535 Len=0
175675  58.386750 165.138.242.66 -> 41.177.98.176 TCP 64 59145 > http [ACK] Seq=2992 Ack=46438 Win=65535 Len=0
175704  58.393124 165.138.242.66 -> 41.177.98.176 TCP 64 59145 > http [ACK] Seq=2992 Ack=48662 Win=65535 Len=0
175709  58.402477 165.138.242.66 -> 41.177.98.176 TCP 64 59145 > http [ACK] Seq=2992 Ack=51566 Win=65535 Len=0
175719  58.408843 165.138.242.66 -> 41.177.98.176 TCP 64 59145 > http [ACK] Seq=2992 Ack=53790 Win=65535 Len=0
175745  58.418992 165.138.242.66 -> 41.177.98.176 TCP 64 59145 > http [ACK] Seq=2992 Ack=56694 Win=65535 Len=0
175749  58.425651 165.138.242.66 -> 41.177.98.176 TCP 64 59145 > http [ACK] Seq=2992 Ack=58918 Win=65535 Len=0
175775  58.434728 165.138.242.66 -> 41.177.98.176 TCP 64 59145 > http [ACK] Seq=2992 Ack=61822 Win=65535 Len=0
175783  58.441335 165.138.242.66 -> 41.177.98.176 TCP 64 59145 > http [ACK] Seq=2992 Ack=64046 Win=65535 Len=0
175785  58.451279 165.138.242.66 -> 41.177.98.176 TCP 64 59145 > http [ACK] Seq=2992 Ack=66950 Win=65535 Len=0
175800  58.456980 165.138.242.66 -> 41.177.98.176 TCP 64 59145 > http [ACK] Seq=2992 Ack=69174 Win=65535 Len=0
175806  58.466994 165.138.242.66 -> 41.177.98.176 TCP 64 59145 > http [ACK] Seq=2992 Ack=72078 Win=65535 Len=0
175823  58.473750 165.138.242.66 -> 41.177.98.176 TCP 64 59145 > http [ACK] Seq=2992 Ack=74302 Win=65535 Len=0
175839  58.482770 165.138.242.66 -> 41.177.98.176 TCP 64 59145 > http [ACK] Seq=2992 Ack=77206 Win=65535 Len=0
175849  58.490985 165.138.242.66 -> 41.177.98.176 TCP 64 59145 > http [ACK] Seq=2992 Ack=79430 Win=65535 Len=0
175889  58.499439 165.138.242.66 -> 41.177.98.176 TCP 64 59145 > http [ACK] Seq=2992 Ack=82334 Win=65535 Len=0
175902  58.506009 165.138.242.66 -> 41.177.98.176 TCP 64 59145 > http [ACK] Seq=2992 Ack=84487 Win=65535 Len=0
183884  61.798616 165.138.242.66 -> 41.177.98.176 TCP 64 59145 > http [ACK] Seq=4120 Ack=87391 Win=65535 Len=0
183912  61.806014 165.138.242.66 -> 41.177.98.176 TCP 64 59145 > http [ACK] Seq=4120 Ack=89820 Win=65535 Len=0
183935  61.815384 165.138.242.66 -> 41.177.98.176 TCP 64 59145 > http [ACK] Seq=4120 Ack=92724 Win=65535 Len=0
183948  61.821750 165.138.242.66 -> 41.177.98.176 TCP 64 59145 > http [ACK] Seq=4120 Ack=94948 Win=65535 Len=0
183989  61.831149 165.138.242.66 -> 41.177.98.176 TCP 64 59145 > http [ACK] Seq=4120 Ack=97852 Win=65535 Len=0
184020  61.838236 165.138.242.66 -> 41.177.98.176 TCP 64 59145 > http [ACK] Seq=4120 Ack=100076 Win=65535 Len=0
184077  61.847597 165.138.242.66 -> 41.177.98.176 TCP 64 59145 > http [ACK] Seq=4120 Ack=102980 Win=65535 Len=0
184081  61.850094 165.138.242.66 -> 41.177.98.176 TCP 64 59145 > http [ACK] Seq=4120 Ack=103974 Win=64541 Len=0
186242  62.496145 165.138.242.66 -> 41.177.98.176 TCP 64 59145 > http [ACK] Seq=5116 Ack=105369 Win=65535 Len=0
225636  77.215214 165.138.242.66 -> 41.177.98.176 TCP 64 59145 > http [ACK] Seq=5116 Ack=105370 Win=65535 Len=0
271907  92.216885 165.138.242.66 -> 41.177.98.176 TCP 64 59145 > http [FIN, ACK] Seq=5116 Ack=105370 Win=65535 Len=0
464970 152.823737 165.138.242.66 -> 41.177.98.176 TCP 66 55125 > http [SYN] Seq=0 Win=65535 Len=0 MSS=1452 SACK_PERM=1
465075 152.871843 165.138.242.66 -> 41.177.98.176 TCP 64 55125 > http [ACK] Seq=1 Ack=1 Win=65535 Len=0
465614 153.168233 165.138.242.66 -> 41.177.98.176 TCP 64 55125 > http [ACK] Seq=997 Ack=1396 Win=64140 Len=0
468220 154.452127 165.138.242.66 -> 41.177.98.176 TCP 64 55125 > http [ACK] Seq=2057 Ack=4300 Win=65535 Len=0
468277 154.459226 165.138.242.66 -> 41.177.98.176 TCP 64 55125 > http [ACK] Seq=2057 Ack=6729 Win=65535 Len=0
468436 154.510734 165.138.242.66 -> 41.177.98.176 TCP 64 55125 > http [ACK] Seq=2057 Ack=9633 Win=65535 Len=0
468477 154.517333 165.138.242.66 -> 41.177.98.176 TCP 64 55125 > http [ACK] Seq=2057 Ack=11857 Win=65535 Len=0
468522 154.527225 165.138.242.66 -> 41.177.98.176 TCP 64 55125 > http [ACK] Seq=2057 Ack=14761 Win=65535 Len=0
468605 154.566348 165.138.242.66 -> 41.177.98.176 TCP 64 55125 > http [ACK] Seq=2057 Ack=16985 Win=65535 Len=0
468616 154.576000 165.138.242.66 -> 41.177.98.176 TCP 64 55125 > http [ACK] Seq=2057 Ack=19889 Win=65535 Len=0
468642 154.585361 165.138.242.66 -> 41.177.98.176 TCP 64 55125 > http [ACK] Seq=2057 Ack=22741 Win=65535 Len=0
492425 162.612456 165.138.242.66 -> 41.177.98.176 TCP 64 55125 > http [ACK] Seq=3084 Ack=25645 Win=65535 Len=0
492471 162.619829 165.138.242.66 -> 41.177.98.176 TCP 64 55125 > http [ACK] Seq=3084 Ack=28074 Win=65535 Len=0
492547 162.628968 165.138.242.66 -> 41.177.98.176 TCP 64 55125 > http [ACK] Seq=3084 Ack=30978 Win=65535 Len=0
492601 162.635615 165.138.242.66 -> 41.177.98.176 TCP 64 55125 > http [ACK] Seq=3084 Ack=33202 Win=65535 Len=0
492640 162.645466 165.138.242.66 -> 41.177.98.176 TCP 64 55125 > http [ACK] Seq=3084 Ack=36106 Win=65535 Len=0
492699 162.652122 165.138.242.66 -> 41.177.98.176 TCP 64 55125 > http [ACK] Seq=3084 Ack=38330 Win=65535 Len=0
492763 162.666132 165.138.242.66 -> 41.177.98.176 TCP 64 55125 > http [ACK] Seq=3084 Ack=41234 Win=65535 Len=0
492812 162.672984 165.138.242.66 -> 41.177.98.176 TCP 64 55125 > http [ACK] Seq=3084 Ack=43458 Win=65535 Len=0
492843 162.681823 165.138.242.66 -> 41.177.98.176 TCP 64 55125 > http [ACK] Seq=3084 Ack=46362 Win=65535 Len=0
492869 162.689365 165.138.242.66 -> 41.177.98.176 TCP 64 55125 > http [ACK] Seq=3084 Ack=48586 Win=65535 Len=0
492895 162.698469 165.138.242.66 -> 41.177.98.176 TCP 64 55125 > http [ACK] Seq=3084 Ack=51490 Win=65535 Len=0
492932 162.705071 165.138.242.66 -> 41.177.98.176 TCP 64 55125 > http [ACK] Seq=3084 Ack=53714 Win=65535 Len=0
493005 162.714217 165.138.242.66 -> 41.177.98.176 TCP 64 55125 > http [ACK] Seq=3084 Ack=56618 Win=65535 Len=0
493038 162.721618 165.138.242.66 -> 41.177.98.176 TCP 64 55125 > http [ACK] Seq=3084 Ack=58842 Win=65535 Len=0
493057 162.730954 165.138.242.66 -> 41.177.98.176 TCP 64 55125 > http [ACK] Seq=3084 Ack=61746 Win=65535 Len=0
493090 162.737365 165.138.242.66 -> 41.177.98.176 TCP 64 55125 > http [ACK] Seq=3084 Ack=63970 Win=65535 Len=0
493114 162.746720 165.138.242.66 -> 41.177.98.176 TCP 64 55125 > http [ACK] Seq=3084 Ack=66874 Win=65535 Len=0
493122 162.753897 165.138.242.66 -> 41.177.98.176 TCP 64 55125 > http [ACK] Seq=3084 Ack=69098 Win=65535 Len=0
493140 162.763251 165.138.242.66 -> 41.177.98.176 TCP 64 55125 > http [ACK] Seq=3084 Ack=72002 Win=65535 Len=0
493187 162.769574 165.138.242.66 -> 41.177.98.176 TCP 64 55125 > http [ACK] Seq=3084 Ack=74226 Win=65535 Len=0
493239 162.778965 165.138.242.66 -> 41.177.98.176 TCP 64 55125 > http [ACK] Seq=3084 Ack=77130 Win=65535 Len=0
493254 162.785374 165.138.242.66 -> 41.177.98.176 TCP 64 55125 > http [ACK] Seq=3084 Ack=79354 Win=65535 Len=0
493321 162.794735 165.138.242.66 -> 41.177.98.176 TCP 64 55125 > http [ACK] Seq=3084 Ack=82258 Win=65535 Len=0
493335 162.801158 165.138.242.66 -> 41.177.98.176 TCP 64 55125 > http [ACK] Seq=3084 Ack=84482 Win=65535 Len=0
493397 162.811254 165.138.242.66 -> 41.177.98.176 TCP 64 55125 > http [ACK] Seq=3084 Ack=87386 Win=65535 Len=0
493437 162.817641 165.138.242.66 -> 41.177.98.176 TCP 64 55125 > http [ACK] Seq=3084 Ack=89181 Win=65535 Len=0
552420 177.702000 165.138.242.66 -> 41.177.98.176 TCP 64 55125 > http [ACK] Seq=3084 Ack=89182 Win=65535 Len=0
570257 182.214372 165.138.242.66 -> 41.177.98.176 TCP 64 55125 > http [FIN, ACK] Seq=3084 Ack=89182 Win=65535 Len=0
583042 185.678441 165.138.242.66 -> 41.177.98.176 TCP 66 62297 > http [SYN] Seq=0 Win=65535 Len=0 MSS=1452 SACK_PERM=1
583169 185.727207 165.138.242.66 -> 41.177.98.176 TCP 64 62297 > http [ACK] Seq=1 Ack=1 Win=65535 Len=0
585899 186.656324 165.138.242.66 -> 41.177.98.176 TCP 64 62297 > http [ACK] Seq=1106 Ack=2905 Win=65535 Len=0
586124 186.710130 165.138.242.66 -> 41.177.98.176 TCP 64 62297 > http [ACK] Seq=1106 Ack=5809 Win=65535 Len=0
586177 186.719524 165.138.242.66 -> 41.177.98.176 TCP 64 62297 > http [ACK] Seq=1106 Ack=8713 Win=65535 Len=0
586302 186.768258 165.138.242.66 -> 41.177.98.176 TCP 64 62297 > http [ACK] Seq=1106 Ack=11617 Win=65535 Len=0
586347 186.777367 165.138.242.66 -> 41.177.98.176 TCP 64 62297 > http [ACK] Seq=1106 Ack=14521 Win=65535 Len=0
586375 186.786457 165.138.242.66 -> 41.177.98.176 TCP 64 62297 > http [ACK] Seq=1106 Ack=17425 Win=65535 Len=0
586510 186.826819 165.138.242.66 -> 41.177.98.176 TCP 64 62297 > http [ACK] Seq=1106 Ack=20206 Win=65535 Len=0
587509 187.122015 165.138.242.66 -> 41.177.98.176 TCP 64 62297 > http [ACK] Seq=2089 Ack=21742 Win=65535 Len=0
640422 202.120172 165.138.242.66 -> 41.177.98.176 TCP 64 62297 > http [ACK] Seq=2089 Ack=21743 Win=65535 Len=0
677930 212.214357 165.138.242.66 -> 41.177.98.176 TCP 64 62297 > http [FIN, ACK] Seq=2089 Ack=21743 Win=65535 Len=0
1013494 340.643128 165.138.242.66 -> 41.177.98.176 TCP 66 45929 > http [SYN] Seq=0 Win=65535 Len=0 MSS=1452 SACK_PERM=1
1013611 340.692682 165.138.242.66 -> 41.177.98.176 TCP 64 45929 > http [ACK] Seq=1 Ack=1 Win=65535 Len=0
1013960 340.856665 165.138.242.66 -> 41.177.98.176 TCP 64 45929 > http [ACK] Seq=984 Ack=1537 Win=65535 Len=0
1017905 343.162076 165.138.242.66 -> 41.177.98.176 TCP 64 45929 > http [ACK] Seq=2032 Ack=4441 Win=65535 Len=0
1017918 343.168935 165.138.242.66 -> 41.177.98.176 TCP 64 45929 > http [ACK] Seq=2032 Ack=6870 Win=65535 Len=0
1018039 343.220190 165.138.242.66 -> 41.177.98.176 TCP 64 45929 > http [ACK] Seq=2032 Ack=9774 Win=65535 Len=0
1018058 343.226925 165.138.242.66 -> 41.177.98.176 TCP 64 45929 > http [ACK] Seq=2032 Ack=11998 Win=65535 Len=0
1018085 343.236685 165.138.242.66 -> 41.177.98.176 TCP 64 45929 > http [ACK] Seq=2032 Ack=14902 Win=65535 Len=0
1018209 343.276446 165.138.242.66 -> 41.177.98.176 TCP 64 45929 > http [ACK] Seq=2032 Ack=17126 Win=65535 Len=0
1018212 343.285813 165.138.242.66 -> 41.177.98.176 TCP 64 45929 > http [ACK] Seq=2032 Ack=20030 Win=65535 Len=0
1018226 343.294818 165.138.242.66 -> 41.177.98.176 TCP 64 45929 > http [ACK] Seq=2032 Ack=22882 Win=65535 Len=0
