817496 266.736775 168.33.18.98 -> 41.177.26.91 TCP 82 52318 > http [SYN] Seq=0 Win=65535 Len=0 MSS=1380 WS=4 TSval=4164681062 TSecr=0 SACK_PERM=1
817670 266.801286 168.33.18.98 -> 41.177.26.91 TCP 70 52318 > http [ACK] Seq=1 Ack=1 Win=131328 Len=0 TSval=4164681125 TSecr=1509572131
818231 266.971659 168.33.18.98 -> 41.177.26.91 TCP 70 52318 > http [ACK] Seq=610 Ack=1369 Win=129960 Len=0 TSval=4164681296 TSecr=1509572148
818232 266.971794 168.33.18.98 -> 41.177.26.91 TCP 70 52318 > http [ACK] Seq=610 Ack=2737 Win=128592 Len=0 TSval=4164681296 TSecr=1509572148
818233 266.971798 168.33.18.98 -> 41.177.26.91 TCP 70 [TCP Window Update] 52318 > http [ACK] Seq=610 Ack=2737 Win=131328 Len=0 TSval=4164681296 TSecr=1509572148
818234 266.971802 168.33.18.98 -> 41.177.26.91 TCP 70 52318 > http [ACK] Seq=610 Ack=4105 Win=129960 Len=0 TSval=4164681296 TSecr=1509572148
818470 267.036335 168.33.18.98 -> 41.177.26.91 TCP 70 52318 > http [ACK] Seq=610 Ack=5473 Win=129960 Len=0 TSval=4164681361 TSecr=1509572155
818471 267.036340 168.33.18.98 -> 41.177.26.91 TCP 70 52318 > http [ACK] Seq=610 Ack=6841 Win=129960 Len=0 TSval=4164681361 TSecr=1509572155
818472 267.036573 168.33.18.98 -> 41.177.26.91 TCP 70 52318 > http [ACK] Seq=610 Ack=8209 Win=129960 Len=0 TSval=4164681361 TSecr=1509572155
818473 267.036578 168.33.18.98 -> 41.177.26.91 TCP 82 [TCP Dup ACK 818472#1] 52318 > http [ACK] Seq=610 Ack=8209 Win=129960 Len=0 TSval=4164681361 TSecr=1509572155 SLE=10945 SRE=11658
818474 267.036583 168.33.18.98 -> 41.177.26.91 TCP 82 52318 > http [ACK] Seq=610 Ack=9577 Win=129960 Len=0 TSval=4164681361 TSecr=1509572155 SLE=10945 SRE=11658
818476 267.037301 168.33.18.98 -> 41.177.26.91 TCP 70 52318 > http [ACK] Seq=610 Ack=11658 Win=129244 Len=0 TSval=4164681361 TSecr=1509572155
818523 267.051688 168.33.18.98 -> 41.177.26.91 TCP 82 52319 > http [SYN] Seq=0 Win=65535 Len=0 MSS=1380 WS=4 TSval=4164681375 TSecr=0 SACK_PERM=1
818640 267.109381 168.33.18.98 -> 41.177.26.91 TCP 82 [TCP Dup ACK 818496#1] 52318 > http [ACK] Seq=1075 Ack=11658 Win=131072 Len=0 TSval=4164681433 TSecr=1509572162 SLE=13026 SRE=14394
818641 267.109386 168.33.18.98 -> 41.177.26.91 TCP 70 52318 > http [ACK] Seq=1075 Ack=14394 Win=128336 Len=0 TSval=4164681433 TSecr=1509572162
818642 267.109390 168.33.18.98 -> 41.177.26.91 TCP 70 [TCP Window Update] 52318 > http [ACK] Seq=1075 Ack=14394 Win=131072 Len=0 TSval=4164681433 TSecr=1509572162
818643 267.109394 168.33.18.98 -> 41.177.26.91 TCP 70 52318 > http [ACK] Seq=1075 Ack=15762 Win=129704 Len=0 TSval=4164681433 TSecr=1509572162
818644 267.109398 168.33.18.98 -> 41.177.26.91 TCP 70 52318 > http [ACK] Seq=1075 Ack=17130 Win=129704 Len=0 TSval=4164681433 TSecr=1509572162
818645 267.109402 168.33.18.98 -> 41.177.26.91 TCP 70 52318 > http [ACK] Seq=1075 Ack=18498 Win=129704 Len=0 TSval=4164681434 TSecr=1509572162
818656 267.111493 168.33.18.98 -> 41.177.26.91 TCP 70 52318 > http [ACK] Seq=1075 Ack=19866 Win=129704 Len=0 TSval=4164681436 TSecr=1509572162
818657 267.111498 168.33.18.98 -> 41.177.26.91 TCP 70 52318 > http [ACK] Seq=1075 Ack=21234 Win=129704 Len=0 TSval=4164681436 TSecr=1509572162
818658 267.111503 168.33.18.98 -> 41.177.26.91 TCP 70 52318 > http [ACK] Seq=1075 Ack=22602 Win=129704 Len=0 TSval=4164681436 TSecr=1509572162
818659 267.111987 168.33.18.98 -> 41.177.26.91 TCP 70 52318 > http [ACK] Seq=1075 Ack=23970 Win=129704 Len=0 TSval=4164681436 TSecr=1509572162
818660 267.112192 168.33.18.98 -> 41.177.26.91 TCP 70 52318 > http [ACK] Seq=1075 Ack=25338 Win=129704 Len=0 TSval=4164681436 TSecr=1509572162
818661 267.112197 168.33.18.98 -> 41.177.26.91 TCP 70 52318 > http [ACK] Seq=1075 Ack=26706 Win=129704 Len=0 TSval=4164681436 TSecr=1509572162
818662 267.114455 168.33.18.98 -> 41.177.26.91 TCP 70 52319 > http [ACK] Seq=1 Ack=1 Win=131328 Len=0 TSval=4164681438 TSecr=1509572163
818805 267.174004 168.33.18.98 -> 41.177.26.91 TCP 70 52318 > http [ACK] Seq=1075 Ack=28074 Win=129704 Len=0 TSval=4164681498 TSecr=1509572169
818806 267.174009 168.33.18.98 -> 41.177.26.91 TCP 70 52318 > http [ACK] Seq=1075 Ack=28874 Win=128904 Len=0 TSval=4164681498 TSecr=1509572169
818823 267.181573 168.33.18.98 -> 41.177.26.91 TCP 70 52319 > http [ACK] Seq=469 Ack=909 Win=130420 Len=0 TSval=4164681505 TSecr=1509572170
818874 267.196893 168.33.18.98 -> 41.177.26.91 TCP 82 52320 > http [SYN] Seq=0 Win=65535 Len=0 MSS=1380 WS=4 TSval=4164681522 TSecr=0 SACK_PERM=1
818886 267.199856 168.33.18.98 -> 41.177.26.91 TCP 82 52321 > http [SYN] Seq=0 Win=65535 Len=0 MSS=1380 WS=4 TSval=4164681524 TSecr=0 SACK_PERM=1
818900 267.201157 168.33.18.98 -> 41.177.26.91 TCP 82 52322 > http [SYN] Seq=0 Win=65535 Len=0 MSS=1380 WS=4 TSval=4164681526 TSecr=0 SACK_PERM=1
818907 267.204704 168.33.18.98 -> 41.177.26.91 TCP 82 52323 > http [SYN] Seq=0 Win=65535 Len=0 MSS=1380 WS=4 TSval=4164681527 TSecr=0 SACK_PERM=1
819044 267.251892 168.33.18.98 -> 41.177.26.91 TCP 82 [TCP Dup ACK 818829#1] 52319 > http [ACK] Seq=943 Ack=909 Win=131072 Len=0 TSval=4164681575 TSecr=1509572176 SLE=2277 SRE=3645
819045 267.251897 168.33.18.98 -> 41.177.26.91 TCP 70 52319 > http [ACK] Seq=943 Ack=3645 Win=128336 Len=0 TSval=4164681576 TSecr=1509572177
819049 267.252163 168.33.18.98 -> 41.177.26.91 TCP 70 [TCP Window Update] 52319 > http [ACK] Seq=943 Ack=3645 Win=131072 Len=0 TSval=4164681576 TSecr=1509572177
819052 267.252552 168.33.18.98 -> 41.177.26.91 TCP 70 52319 > http [ACK] Seq=943 Ack=5013 Win=129704 Len=0 TSval=4164681576 TSecr=1509572177
819053 267.252557 168.33.18.98 -> 41.177.26.91 TCP 70 52319 > http [ACK] Seq=943 Ack=6381 Win=129704 Len=0 TSval=4164681576 TSecr=1509572177
819059 267.254157 168.33.18.98 -> 41.177.26.91 TCP 70 52318 > http [ACK] Seq=1541 Ack=29191 Win=130752 Len=0 TSval=4164681578 TSecr=1509572177
819082 267.261386 168.33.18.98 -> 41.177.26.91 TCP 70 52320 > http [ACK] Seq=1 Ack=1 Win=131328 Len=0 TSval=4164681585 TSecr=1509572177
819097 267.264898 168.33.18.98 -> 41.177.26.91 TCP 70 52322 > http [ACK] Seq=1 Ack=1 Win=131328 Len=0 TSval=4164681588 TSecr=1509572178
819098 267.264955 168.33.18.98 -> 41.177.26.91 TCP 70 52321 > http [ACK] Seq=1 Ack=1 Win=131328 Len=0 TSval=4164681588 TSecr=1509572178
819117 267.269340 168.33.18.98 -> 41.177.26.91 TCP 70 52323 > http [ACK] Seq=1 Ack=1 Win=131328 Len=0 TSval=4164681593 TSecr=1509572178
819306 267.316648 168.33.18.98 -> 41.177.26.91 TCP 70 52319 > http [ACK] Seq=943 Ack=7749 Win=129704 Len=0 TSval=4164681640 TSecr=1509572183
819307 267.316862 168.33.18.98 -> 41.177.26.91 TCP 70 52319 > http [ACK] Seq=943 Ack=9117 Win=129704 Len=0 TSval=4164681641 TSecr=1509572183
819308 267.316867 168.33.18.98 -> 41.177.26.91 TCP 70 52319 > http [ACK] Seq=943 Ack=10485 Win=129704 Len=0 TSval=4164681641 TSecr=1509572183
819310 267.317376 168.33.18.98 -> 41.177.26.91 TCP 82 [TCP Window Update] 52319 > http [ACK] Seq=943 Ack=10485 Win=131072 Len=0 TSval=4164681641 TSecr=1509572183 SLE=13221 SRE=13761
819311 267.317380 168.33.18.98 -> 41.177.26.91 TCP 82 52319 > http [ACK] Seq=943 Ack=11853 Win=129704 Len=0 TSval=4164681641 TSecr=1509572183 SLE=13221 SRE=13761
819312 267.317384 168.33.18.98 -> 41.177.26.91 TCP 70 52319 > http [ACK] Seq=943 Ack=13761 Win=129164 Len=0 TSval=4164681641 TSecr=1509572183
819338 267.326821 168.33.18.98 -> 41.177.26.91 TCP 70 52320 > http [ACK] Seq=477 Ack=1369 Win=129960 Len=0 TSval=4164681651 TSecr=1509572184
819343 267.327157 168.33.18.98 -> 41.177.26.91 TCP 70 52320 > http [ACK] Seq=477 Ack=2737 Win=129960 Len=0 TSval=4164681651 TSecr=1509572184
819349 267.329097 168.33.18.98 -> 41.177.26.91 TCP 70 52320 > http [ACK] Seq=477 Ack=4105 Win=129960 Len=0 TSval=4164681653 TSecr=1509572184
819359 267.329585 168.33.18.98 -> 41.177.26.91 TCP 70 52321 > http [ACK] Seq=473 Ack=807 Win=130520 Len=0 TSval=4164681653 TSecr=1509572184
819364 267.331624 168.33.18.98 -> 41.177.26.91 TCP 70 52322 > http [ACK] Seq=476 Ack=469 Win=130860 Len=0 TSval=4164681655 TSecr=1509572184
819412 267.341981 168.33.18.98 -> 41.177.26.91 TCP 70 52323 > http [ACK] Seq=473 Ack=469 Win=130860 Len=0 TSval=4164681665 TSecr=1509572186
819559 267.391646 168.33.18.98 -> 41.177.26.91 TCP 70 52320 > http [ACK] Seq=477 Ack=4923 Win=130508 Len=0 TSval=4164681715 TSecr=1509572190
819936 267.506639 168.33.18.98 -> 41.177.26.91 TCP 70 52320 > http [ACK] Seq=849 Ack=6291 Win=129704 Len=0 TSval=4164681830 TSecr=1509572202
819938 267.507372 168.33.18.98 -> 41.177.26.91 TCP 70 52320 > http [ACK] Seq=849 Ack=7659 Win=129704 Len=0 TSval=4164681830 TSecr=1509572202
819939 267.507377 168.33.18.98 -> 41.177.26.91 TCP 70 52320 > http [ACK] Seq=849 Ack=9027 Win=129704 Len=0 TSval=4164681831 TSecr=1509572202
819940 267.507381 168.33.18.98 -> 41.177.26.91 TCP 70 52320 > http [ACK] Seq=849 Ack=10395 Win=129704 Len=0 TSval=4164681831 TSecr=1509572202
819941 267.507385 168.33.18.98 -> 41.177.26.91 TCP 70 52320 > http [ACK] Seq=849 Ack=11518 Win=128580 Len=0 TSval=4164681831 TSecr=1509572202
