389686 130.191423 168.22.164.224 -> 244.3.160.239 TCP 66 4084 > http [SYN] Seq=0 Win=65535 Len=0 MSS=1460 SACK_PERM=1
389716 130.208316 168.22.164.224 -> 244.3.160.239 TCP 64 4084 > http [ACK] Seq=1 Ack=1 Win=65535 Len=0
389992 130.316076 168.22.164.224 -> 244.3.160.239 TCP 64 4084 > http [ACK] Seq=718 Ack=3510 Win=65535 Len=0
390030 130.321052 168.22.164.224 -> 244.3.160.239 TCP 64 4084 > http [ACK] Seq=718 Ack=4361 Win=64685 Len=0
390031 130.321057 168.22.164.224 -> 244.3.160.239 TCP 64 4084 > http [FIN, ACK] Seq=718 Ack=4361 Win=64685 Len=0
390048 130.332996 168.22.164.224 -> 244.3.160.239 TCP 66 interwise > http [SYN] Seq=0 Win=65535 Len=0 MSS=1460 SACK_PERM=1
390066 130.339693 168.22.164.224 -> 244.3.160.239 TCP 64 interwise > http [ACK] Seq=1 Ack=1 Win=65535 Len=0
390146 130.363318 168.22.164.224 -> 244.3.160.239 TCP 64 interwise > http [ACK] Seq=841 Ack=244 Win=65293 Len=0
390164 130.369176 168.22.164.224 -> 244.3.160.239 TCP 64 interwise > http [FIN, ACK] Seq=841 Ack=244 Win=65293 Len=0
390206 130.386877 168.22.164.224 -> 244.3.160.239 TCP 66 15904 > http [SYN] Seq=0 Win=65535 Len=0 MSS=1460 SACK_PERM=1
390251 130.400094 168.22.164.224 -> 244.3.160.239 TCP 64 15904 > http [ACK] Seq=1 Ack=1 Win=65535 Len=0
391069 130.694984 168.22.164.224 -> 244.3.160.239 TCP 64 15904 > http [ACK] Seq=854 Ack=2214 Win=65535 Len=0
391077 130.699885 168.22.164.224 -> 244.3.160.239 TCP 64 15904 > http [ACK] Seq=854 Ack=2298 Win=65452 Len=0
391078 130.699890 168.22.164.224 -> 244.3.160.239 TCP 64 15904 > http [FIN, ACK] Seq=854 Ack=2298 Win=65452 Len=0
391171 130.727466 168.22.164.224 -> 244.3.160.239 TCP 66 11257 > http [SYN] Seq=0 Win=65535 Len=0 MSS=1460 SACK_PERM=1
391250 130.745382 168.22.164.224 -> 244.3.160.239 TCP 64 11257 > http [ACK] Seq=1 Ack=1 Win=65535 Len=0
391917 131.029218 168.22.164.224 -> 244.3.160.239 TCP 64 11257 > http [ACK] Seq=963 Ack=1461 Win=64076 Len=0
391918 131.029223 168.22.164.224 -> 244.3.160.239 TCP 64 11257 > http [FIN, ACK] Seq=963 Ack=1461 Win=64076 Len=0
391927 131.043539 168.22.164.224 -> 244.3.160.239 TCP 66 9228 > http [SYN] Seq=0 Win=65535 Len=0 MSS=1460 SACK_PERM=1
391964 131.056377 168.22.164.224 -> 244.3.160.239 TCP 64 9228 > http [ACK] Seq=1 Ack=1 Win=65535 Len=0
392019 131.086292 168.22.164.224 -> 244.3.160.239 TCP 64 9228 > http [ACK] Seq=1039 Ack=838 Win=64699 Len=0
392022 131.089483 168.22.164.224 -> 244.3.160.239 TCP 66 13051 > http [SYN] Seq=0 Win=65535 Len=0 MSS=1460 SACK_PERM=1
392023 131.089488 168.22.164.224 -> 244.3.160.239 TCP 64 9228 > http [FIN, ACK] Seq=1039 Ack=838 Win=64699 Len=0
392045 131.099275 168.22.164.224 -> 244.3.160.239 TCP 64 13051 > http [ACK] Seq=1 Ack=1 Win=65535 Len=0
392584 131.296170 168.22.164.224 -> 244.3.160.239 TCP 64 13051 > http [ACK] Seq=980 Ack=2050 Win=65535 Len=0
392600 131.303301 168.22.164.224 -> 244.3.160.239 TCP 64 13051 > http [ACK] Seq=980 Ack=4099 Win=65535 Len=0
392610 131.313235 168.22.164.224 -> 244.3.160.239 TCP 64 13051 > http [ACK] Seq=980 Ack=7608 Win=65535 Len=0
392617 131.318907 168.22.164.224 -> 244.3.160.239 TCP 64 13051 > http [ACK] Seq=980 Ack=10345 Win=65535 Len=0
392651 131.326319 168.22.164.224 -> 244.3.160.239 TCP 64 13051 > http [ACK] Seq=980 Ack=12394 Win=65535 Len=0
392678 131.336195 168.22.164.224 -> 244.3.160.239 TCP 66 10890 > http [SYN] Seq=0 Win=65535 Len=0 MSS=1460 SACK_PERM=1
392682 131.340494 168.22.164.224 -> 244.3.160.239 TCP 64 13051 > http [ACK] Seq=980 Ack=17969 Win=65535 Len=0
392683 131.340499 168.22.164.224 -> 244.3.160.239 TCP 64 13051 > http [ACK] Seq=980 Ack=20018 Win=65535 Len=0
392684 131.340502 168.22.164.224 -> 244.3.160.239 TCP 64 13051 > http [ACK] Seq=980 Ack=22299 Win=65535 Len=0
392703 131.345187 168.22.164.224 -> 244.3.160.239 TCP 66 4922 > http [SYN] Seq=0 Win=65535 Len=0 MSS=1460 SACK_PERM=1
392704 131.345191 168.22.164.224 -> 244.3.160.239 TCP 66 8072 > http [SYN] Seq=0 Win=65535 Len=0 MSS=1460 SACK_PERM=1
392719 131.351972 168.22.164.224 -> 244.3.160.239 TCP 64 10890 > http [ACK] Seq=1 Ack=1 Win=65535 Len=0
392720 131.351977 168.22.164.224 -> 244.3.160.239 TCP 66 qbdb > http [SYN] Seq=0 Win=65535 Len=0 MSS=1460 SACK_PERM=1
392741 131.356127 168.22.164.224 -> 244.3.160.239 TCP 64 13051 > http [ACK] Seq=980 Ack=24348 Win=65535 Len=0
392742 131.356132 168.22.164.224 -> 244.3.160.239 TCP 64 13051 > http [ACK] Seq=980 Ack=26444 Win=65535 Len=0
392743 131.356136 168.22.164.224 -> 244.3.160.239 TCP 64 13051 > http [ACK] Seq=980 Ack=28493 Win=65535 Len=0
392744 131.356140 168.22.164.224 -> 244.3.160.239 TCP 64 13051 > http [ACK] Seq=980 Ack=30543 Win=65535 Len=0
392765 131.362043 168.22.164.224 -> 244.3.160.239 TCP 64 4922 > http [ACK] Seq=1 Ack=1 Win=65535 Len=0
392768 131.362215 168.22.164.224 -> 244.3.160.239 TCP 64 8072 > http [ACK] Seq=1 Ack=1 Win=65535 Len=0
392770 131.362223 168.22.164.224 -> 244.3.160.239 TCP 64 13051 > http [ACK] Seq=980 Ack=33548 Win=65535 Len=0
392801 131.368110 168.22.164.224 -> 244.3.160.239 TCP 64 13051 > http [ACK] Seq=980 Ack=34277 Win=64807 Len=0
392802 131.368114 168.22.164.224 -> 244.3.160.239 TCP 64 13051 > http [FIN, ACK] Seq=980 Ack=34277 Win=64807 Len=0
392803 131.368161 168.22.164.224 -> 244.3.160.239 TCP 64 qbdb > http [ACK] Seq=1 Ack=1 Win=65535 Len=0
392856 131.379465 168.22.164.224 -> 244.3.160.239 TCP 64 10890 > http [ACK] Seq=810 Ack=242 Win=65295 Len=0
392857 131.379470 168.22.164.224 -> 244.3.160.239 TCP 64 10890 > http [FIN, ACK] Seq=810 Ack=242 Win=65295 Len=0
392861 131.384887 168.22.164.224 -> 244.3.160.239 TCP 64 4922 > http [ACK] Seq=823 Ack=242 Win=65295 Len=0
392862 131.384967 168.22.164.224 -> 244.3.160.239 TCP 64 4922 > http [FIN, ACK] Seq=823 Ack=242 Win=65295 Len=0
392881 131.390916 168.22.164.224 -> 244.3.160.239 TCP 64 8072 > http [ACK] Seq=812 Ack=242 Win=65295 Len=0
392882 131.390920 168.22.164.224 -> 244.3.160.239 TCP 64 8072 > http [FIN, ACK] Seq=812 Ack=242 Win=65295 Len=0
392900 131.399414 168.22.164.224 -> 244.3.160.239 TCP 64 qbdb > http [ACK] Seq=810 Ack=242 Win=65295 Len=0
392901 131.399419 168.22.164.224 -> 244.3.160.239 TCP 64 qbdb > http [FIN, ACK] Seq=810 Ack=242 Win=65295 Len=0
397164 133.391571 168.22.164.224 -> 244.3.160.239 TCP 66 12555 > http [SYN] Seq=0 Win=65535 Len=0 MSS=1460 SACK_PERM=1
397175 133.400979 168.22.164.224 -> 244.3.160.239 TCP 64 12555 > http [ACK] Seq=1 Ack=1 Win=65535 Len=0
397220 133.433875 168.22.164.224 -> 244.3.160.239 TCP 64 12555 > http [ACK] Seq=711 Ack=174 Win=65363 Len=0
397221 133.433880 168.22.164.224 -> 244.3.160.239 TCP 64 12555 > http [FIN, ACK] Seq=711 Ack=174 Win=65363 Len=0
973765 324.285776 168.22.164.224 -> 244.3.160.239 TCP 66 5324 > http [SYN] Seq=0 Win=65535 Len=0 MSS=1460 SACK_PERM=1
973836 324.295765 168.22.164.224 -> 244.3.160.239 TCP 64 5324 > http [ACK] Seq=1 Ack=1 Win=65535 Len=0
976510 325.294354 168.22.164.224 -> 244.3.160.239 TCP 64 5324 > http [ACK] Seq=1860 Ack=195 Win=65342 Len=0
976511 325.294358 168.22.164.224 -> 244.3.160.239 TCP 64 5324 > http [FIN, ACK] Seq=1860 Ack=195 Win=65342 Len=0
