413158 137.946718 168.197.130.117 -> 244.3.210.197 TCP 66 glishd > http [SYN] Seq=0 Win=16384 Len=0 MSS=1260 SACK_PERM=1
413193 137.959704 168.197.130.117 -> 244.3.210.197 TCP 64 glishd > http [ACK] Seq=1 Ack=1 Win=17640 Len=0
414292 138.355025 168.197.130.117 -> 244.3.210.197 TCP 64 glishd > http [ACK] Seq=967 Ack=2521 Win=17640 Len=0
414363 138.366790 168.197.130.117 -> 244.3.210.197 TCP 64 glishd > http [ACK] Seq=967 Ack=6301 Win=17640 Len=0
414392 138.371084 168.197.130.117 -> 244.3.210.197 TCP 64 [TCP Dup ACK 414363#1] glishd > http [ACK] Seq=967 Ack=6301 Win=17640 Len=0
414403 138.374853 168.197.130.117 -> 244.3.210.197 TCP 66 evtp > http [SYN] Seq=0 Win=16384 Len=0 MSS=1260 SACK_PERM=1
414503 138.391053 168.197.130.117 -> 244.3.210.197 TCP 64 glishd > http [ACK] Seq=967 Ack=11341 Win=17640 Len=0
414536 138.394865 168.197.130.117 -> 244.3.210.197 TCP 64 [TCP Dup ACK 414503#1] glishd > http [ACK] Seq=967 Ack=11341 Win=17640 Len=0
414537 138.394870 168.197.130.117 -> 244.3.210.197 TCP 64 evtp > http [RST] Seq=1 Win=0 Len=0
414580 138.408971 168.197.130.117 -> 244.3.210.197 TCP 64 glishd > http [ACK] Seq=967 Ack=17641 Win=17640 Len=0
414589 138.412865 168.197.130.117 -> 244.3.210.197 TCP 64 [TCP Dup ACK 414580#1] glishd > http [ACK] Seq=967 Ack=17641 Win=17640 Len=0
414613 138.423054 168.197.130.117 -> 244.3.210.197 TCP 64 glishd > http [ACK] Seq=967 Ack=18901 Win=17640 Len=0
414737 138.446725 168.197.130.117 -> 244.3.210.197 TCP 66 evtp-data > http [SYN] Seq=0 Win=16384 Len=0 MSS=1260 SACK_PERM=1
414757 138.458669 168.197.130.117 -> 244.3.210.197 TCP 64 glishd > http [ACK] Seq=1684 Ack=29505 Win=17640 Len=0
414767 138.463047 168.197.130.117 -> 244.3.210.197 TCP 64 [TCP Dup ACK 414757#1] glishd > http [ACK] Seq=1684 Ack=29505 Win=17640 Len=0
414768 138.463136 168.197.130.117 -> 244.3.210.197 TCP 64 evtp-data > http [ACK] Seq=1 Ack=1 Win=17640 Len=0
414855 138.493259 168.197.130.117 -> 244.3.210.197 TCP 66 catalyst > http [SYN] Seq=0 Win=16384 Len=0 MSS=1260 SACK_PERM=1
414946 138.509016 168.197.130.117 -> 244.3.210.197 TCP 64 catalyst > http [ACK] Seq=1 Ack=1 Win=17640 Len=0
415050 138.523273 168.197.130.117 -> 244.3.210.197 TCP 66 repliweb > http [SYN] Seq=0 Win=16384 Len=0 MSS=1260 SACK_PERM=1
415051 138.523278 168.197.130.117 -> 244.3.210.197 TCP 64 evtp-data > http [ACK] Seq=708 Ack=2521 Win=17640 Len=0
415052 138.523282 168.197.130.117 -> 244.3.210.197 TCP 64 glishd > http [ACK] Seq=2397 Ack=32325 Win=17640 Len=0
415113 138.534827 168.197.130.117 -> 244.3.210.197 TCP 64 repliweb > http [ACK] Seq=1 Ack=1 Win=17640 Len=0
415114 138.534866 168.197.130.117 -> 244.3.210.197 TCP 64 evtp-data > http [ACK] Seq=708 Ack=6301 Win=17640 Len=0
415132 138.538788 168.197.130.117 -> 244.3.210.197 TCP 64 [TCP Dup ACK 415114#1] evtp-data > http [ACK] Seq=708 Ack=6301 Win=17640 Len=0
415148 138.546935 168.197.130.117 -> 244.3.210.197 TCP 64 evtp-data > http [ACK] Seq=708 Ack=11341 Win=16380 Len=0
415160 138.551118 168.197.130.117 -> 244.3.210.197 TCP 64 [TCP Dup ACK 415148#1] evtp-data > http [ACK] Seq=708 Ack=11341 Win=16380 Len=0
415211 138.569014 168.197.130.117 -> 244.3.210.197 TCP 64 evtp-data > http [ACK] Seq=708 Ack=16381 Win=11340 Len=0
415258 138.574288 168.197.130.117 -> 244.3.210.197 TCP 64 [TCP Dup ACK 415211#1] evtp-data > http [ACK] Seq=708 Ack=16381 Win=11340 Len=0
415259 138.574292 168.197.130.117 -> 244.3.210.197 TCP 66 starbot > http [SYN] Seq=0 Win=16384 Len=0 MSS=1260 SACK_PERM=1
415287 138.576845 168.197.130.117 -> 244.3.210.197 TCP 66 nmsigport > http [SYN] Seq=0 Win=16384 Len=0 MSS=1260 SACK_PERM=1
415426 138.601161 168.197.130.117 -> 244.3.210.197 TCP 64 evtp-data > http [ACK] Seq=708 Ack=23941 Win=17640 Len=0
415427 138.601165 168.197.130.117 -> 244.3.210.197 TCP 64 starbot > http [ACK] Seq=1 Ack=1 Win=17640 Len=0
415428 138.601169 168.197.130.117 -> 244.3.210.197 TCP 64 catalyst > http [ACK] Seq=717 Ack=2521 Win=17640 Len=0
415429 138.601184 168.197.130.117 -> 244.3.210.197 TCP 64 nmsigport > http [ACK] Seq=1 Ack=1 Win=17640 Len=0
415503 138.612717 168.197.130.117 -> 244.3.210.197 TCP 64 glishd > http [ACK] Seq=3109 Ack=42354 Win=17640 Len=0
415533 138.617089 168.197.130.117 -> 244.3.210.197 TCP 64 [TCP Dup ACK 415503#1] glishd > http [ACK] Seq=3109 Ack=42354 Win=17640 Len=0
415534 138.617093 168.197.130.117 -> 244.3.210.197 TCP 64 repliweb > http [ACK] Seq=721 Ack=2521 Win=17640 Len=0
415535 138.617096 168.197.130.117 -> 244.3.210.197 TCP 64 evtp-data > http [ACK] Seq=708 Ack=31501 Win=17640 Len=0
415564 138.620757 168.197.130.117 -> 244.3.210.197 TCP 64 [TCP Dup ACK 415535#1] evtp-data > http [ACK] Seq=708 Ack=31501 Win=17640 Len=0
415595 138.628971 168.197.130.117 -> 244.3.210.197 TCP 64 evtp-data > http [ACK] Seq=708 Ack=34021 Win=17640 Len=0
415747 138.672862 168.197.130.117 -> 244.3.210.197 TCP 64 starbot > http [ACK] Seq=717 Ack=2521 Win=17640 Len=0
415748 138.672886 168.197.130.117 -> 244.3.210.197 TCP 64 nmsigport > http [ACK] Seq=719 Ack=2521 Win=17640 Len=0
415846 138.686689 168.197.130.117 -> 244.3.210.197 TCP 64 starbot > http [ACK] Seq=717 Ack=6301 Win=17640 Len=0
415931 138.690985 168.197.130.117 -> 244.3.210.197 TCP 64 nmsigport > http [ACK] Seq=719 Ack=6301 Win=17640 Len=0
416020 138.702581 168.197.130.117 -> 244.3.210.197 TCP 64 starbot > http [ACK] Seq=717 Ack=11341 Win=16380 Len=0
416033 138.706862 168.197.130.117 -> 244.3.210.197 TCP 64 [TCP Dup ACK 416020#1] starbot > http [ACK] Seq=717 Ack=11341 Win=16380 Len=0
416034 138.706868 168.197.130.117 -> 244.3.210.197 TCP 64 nmsigport > http [ACK] Seq=719 Ack=10081 Win=17640 Len=0
416103 138.717274 168.197.130.117 -> 244.3.210.197 TCP 64 starbot > http [ACK] Seq=717 Ack=16381 Win=11340 Len=0
416132 138.720970 168.197.130.117 -> 244.3.210.197 TCP 64 [TCP Dup ACK 416103#1] starbot > http [ACK] Seq=717 Ack=16381 Win=11340 Len=0
416214 138.731154 168.197.130.117 -> 244.3.210.197 TCP 64 starbot > http [ACK] Seq=717 Ack=23941 Win=3780 Len=0
416231 138.735092 168.197.130.117 -> 244.3.210.197 TCP 64 [TCP Window Update] starbot > http [ACK] Seq=717 Ack=23941 Win=17640 Len=0
416290 138.745461 168.197.130.117 -> 244.3.210.197 TCP 64 starbot > http [ACK] Seq=717 Ack=31501 Win=17640 Len=0
416336 138.749952 168.197.130.117 -> 244.3.210.197 TCP 64 [TCP Dup ACK 416290#1] starbot > http [ACK] Seq=717 Ack=31501 Win=17640 Len=0
416373 138.757755 168.197.130.117 -> 244.3.210.197 TCP 64 glishd > http [ACK] Seq=3822 Ack=44874 Win=17640 Len=0
416380 138.761111 168.197.130.117 -> 244.3.210.197 TCP 64 evtp-data > http [ACK] Seq=1425 Ack=38022 Win=17640 Len=0
416381 138.761115 168.197.130.117 -> 244.3.210.197 TCP 64 starbot > http [ACK] Seq=717 Ack=40321 Win=11340 Len=0
416408 138.764877 168.197.130.117 -> 244.3.210.197 TCP 64 [TCP Dup ACK 416381#1] starbot > http [ACK] Seq=717 Ack=40321 Win=11340 Len=0
416409 138.764881 168.197.130.117 -> 244.3.210.197 TCP 64 catalyst > http [ACK] Seq=1445 Ack=7081 Win=17640 Len=0
416439 138.768991 168.197.130.117 -> 244.3.210.197 TCP 64 repliweb > http [ACK] Seq=1432 Ack=6449 Win=17640 Len=0
416494 138.776757 168.197.130.117 -> 244.3.210.197 TCP 64 starbot > http [ACK] Seq=717 Ack=51661 Win=17640 Len=0
416519 138.780765 168.197.130.117 -> 244.3.210.197 TCP 64 repliweb > http [ACK] Seq=1432 Ack=12749 Win=17640 Len=0
416532 138.785164 168.197.130.117 -> 244.3.210.197 TCP 64 [TCP Dup ACK 416519#1] repliweb > http [ACK] Seq=1432 Ack=12749 Win=17640 Len=0
416722 138.799058 168.197.130.117 -> 244.3.210.197 TCP 64 nmsigport > http [ACK] Seq=1432 Ack=18635 Win=17640 Len=0
416723 138.799062 168.197.130.117 -> 244.3.210.197 TCP 64 starbot > http [ACK] Seq=717 Ack=64261 Win=17640 Len=0
416774 138.803719 168.197.130.117 -> 244.3.210.197 TCP 64 [TCP Dup ACK 416723#1] starbot > http [ACK] Seq=717 Ack=64261 Win=17640 Len=0
416835 138.812900 168.197.130.117 -> 244.3.210.197 TCP 64 glishd > http [ACK] Seq=4538 Ack=55663 Win=17640 Len=0
416858 138.816915 168.197.130.117 -> 244.3.210.197 TCP 64 evtp-data > http [ACK] Seq=2146 Ack=44453 Win=17640 Len=0
416880 138.821560 168.197.130.117 -> 244.3.210.197 TCP 64 [TCP Dup ACK 416858#1] evtp-data > http [ACK] Seq=2146 Ack=44453 Win=17640 Len=0
416887 138.821954 168.197.130.117 -> 244.3.210.197 TCP 64 nmsigport > http [ACK] Seq=1432 Ack=26195 Win=17640 Len=0
416888 138.821958 168.197.130.117 -> 244.3.210.197 TCP 64 starbot > http [ACK] Seq=717 Ack=78121 Win=17640 Len=0
416952 138.826582 168.197.130.117 -> 244.3.210.197 TCP 64 [TCP Dup ACK 416888#1] starbot > http [ACK] Seq=717 Ack=78121 Win=17640 Len=0
416975 138.831354 168.197.130.117 -> 244.3.210.197 TCP 64 catalyst > http [ACK] Seq=2162 Ack=10573 Win=17640 Len=0
416976 138.831358 168.197.130.117 -> 244.3.210.197 TCP 64 repliweb > http [ACK] Seq=2142 Ack=21007 Win=17640 Len=0
417000 138.834964 168.197.130.117 -> 244.3.210.197 TCP 64 nmsigport > http [ACK] Seq=1432 Ack=33755 Win=17640 Len=0
417016 138.838998 168.197.130.117 -> 244.3.210.197 TCP 64 nmsigport > http [ACK] Seq=1432 Ack=36275 Win=17640 Len=0
417031 138.842805 168.197.130.117 -> 244.3.210.197 TCP 64 [TCP Dup ACK 417016#1] nmsigport > http [ACK] Seq=1432 Ack=36275 Win=17640 Len=0
417034 138.842856 168.197.130.117 -> 244.3.210.197 TCP 64 starbot > http [ACK] Seq=717 Ack=93241 Win=17640 Len=0
417073 138.846828 168.197.130.117 -> 244.3.210.197 TCP 64 [TCP Dup ACK 417034#1] starbot > http [ACK] Seq=717 Ack=93241 Win=17640 Len=0
417074 138.846881 168.197.130.117 -> 244.3.210.197 TCP 64 glishd > http [ACK] Seq=5252 Ack=73303 Win=17640 Len=0
417127 138.851081 168.197.130.117 -> 244.3.210.197 TCP 64 [TCP Dup ACK 417074#1] glishd > http [ACK] Seq=5252 Ack=73303 Win=17640 Len=0
417136 138.855170 168.197.130.117 -> 244.3.210.197 TCP 64 repliweb > http [ACK] Seq=2142 Ack=24779 Win=16388 Len=0
417151 138.859002 168.197.130.117 -> 244.3.210.197 TCP 64 [TCP Dup ACK 417136#1] repliweb > http [ACK] Seq=2142 Ack=24779 Win=16388 Len=0
417152 138.859006 168.197.130.117 -> 244.3.210.197 TCP 64 nmsigport > http [ACK] Seq=1432 Ack=48875 Win=17640 Len=0
417180 138.865233 168.197.130.117 -> 244.3.210.197 TCP 64 [TCP Dup ACK 417152#1] nmsigport > http [ACK] Seq=1432 Ack=48875 Win=17640 Len=0
417182 138.865242 168.197.130.117 -> 244.3.210.197 TCP 64 starbot > http [ACK] Seq=717 Ack=109621 Win=17640 Len=0
417211 138.869084 168.197.130.117 -> 244.3.210.197 TCP 64 [TCP Dup ACK 417182#1] starbot > http [ACK] Seq=717 Ack=109621 Win=17640 Len=0
417243 138.872773 168.197.130.117 -> 244.3.210.197 TCP 64 glishd > http [ACK] Seq=5252 Ack=89683 Win=17640 Len=0
417255 138.878498 168.197.130.117 -> 244.3.210.197 TCP 64 [TCP Dup ACK 417243#1] glishd > http [ACK] Seq=5252 Ack=89683 Win=17640 Len=0
417265 138.883010 168.197.130.117 -> 244.3.210.197 TCP 64 nmsigport > http [ACK] Seq=1432 Ack=62735 Win=17640 Len=0
417316 138.887217 168.197.130.117 -> 244.3.210.197 TCP 64 [TCP Dup ACK 417265#1] nmsigport > http [ACK] Seq=1432 Ack=62735 Win=17640 Len=0
417317 138.887313 168.197.130.117 -> 244.3.210.197 TCP 64 starbot > http [ACK] Seq=717 Ack=123481 Win=17640 Len=0
417338 138.891021 168.197.130.117 -> 244.3.210.197 TCP 64 starbot > http [ACK] Seq=717 Ack=127261 Win=17640 Len=0
417345 138.895377 168.197.130.117 -> 244.3.210.197 TCP 64 [TCP Dup ACK 417338#1] starbot > http [ACK] Seq=717 Ack=127261 Win=17640 Len=0
417355 138.898943 168.197.130.117 -> 244.3.210.197 TCP 64 glishd > http [ACK] Seq=5252 Ack=93463 Win=17640 Len=0
417356 138.898948 168.197.130.117 -> 244.3.210.197 TCP 64 nmsigport > http [ACK] Seq=1432 Ack=75335 Win=17640 Len=0
417370 138.904397 168.197.130.117 -> 244.3.210.197 TCP 64 [TCP Dup ACK 417356#1] nmsigport > http [ACK] Seq=1432 Ack=75335 Win=17640 Len=0
417371 138.904401 168.197.130.117 -> 244.3.210.197 TCP 64 starbot > http [ACK] Seq=717 Ack=134325 Win=17640 Len=0
417562 138.951263 168.197.130.117 -> 244.3.210.197 TCP 64 evtp-data > http [ACK] Seq=2860 Ack=48233 Win=17640 Len=0
417563 138.951267 168.197.130.117 -> 244.3.210.197 TCP 64 catalyst > http [ACK] Seq=2877 Ack=21589 Win=17640 Len=0
417589 138.954854 168.197.130.117 -> 244.3.210.197 TCP 64 [TCP Dup ACK 417563#1] catalyst > http [ACK] Seq=2877 Ack=21589 Win=17640 Len=0
417590 138.954859 168.197.130.117 -> 244.3.210.197 TCP 64 repliweb > http [ACK] Seq=2857 Ack=36119 Win=17640 Len=0
417624 138.958931 168.197.130.117 -> 244.3.210.197 TCP 64 [TCP Dup ACK 417590#1] repliweb > http [ACK] Seq=2857 Ack=36119 Win=17640 Len=0
417639 138.962968 168.197.130.117 -> 244.3.210.197 TCP 64 glishd > http [ACK] Seq=5965 Ack=103885 Win=17640 Len=0
417647 138.966702 168.197.130.117 -> 244.3.210.197 TCP 64 catalyst > http [ACK] Seq=2877 Ack=32929 Win=17640 Len=0
417757 138.971658 168.197.130.117 -> 244.3.210.197 TCP 64 [TCP Dup ACK 417647#1] catalyst > http [ACK] Seq=2877 Ack=32929 Win=17640 Len=0
417758 138.971663 168.197.130.117 -> 244.3.210.197 TCP 64 repliweb > http [ACK] Seq=2857 Ack=47459 Win=17640 Len=0
417786 138.974937 168.197.130.117 -> 244.3.210.197 TCP 64 [TCP Dup ACK 417758#1] repliweb > http [ACK] Seq=2857 Ack=47459 Win=17640 Len=0
418055 139.004497 168.197.130.117 -> 244.3.210.197 TCP 64 catalyst > http [ACK] Seq=2877 Ack=41749 Win=17640 Len=0
418073 139.010609 168.197.130.117 -> 244.3.210.197 TCP 64 [TCP Dup ACK 418055#1] catalyst > http [ACK] Seq=2877 Ack=41749 Win=17640 Len=0
418074 139.010614 168.197.130.117 -> 244.3.210.197 TCP 64 repliweb > http [ACK] Seq=2857 Ack=53759 Win=17640 Len=0
418290 139.025166 168.197.130.117 -> 244.3.210.197 TCP 64 nmsigport > http [ACK] Seq=2148 Ack=78184 Win=17640 Len=0
418291 139.025171 168.197.130.117 -> 244.3.210.197 TCP 64 starbot > http [ACK] Seq=1423 Ack=136634 Win=17640 Len=0
418822 139.075699 168.197.130.117 -> 244.3.210.197 TCP 64 evtp-data > http [ACK] Seq=3600 Ack=53136 Win=17640 Len=0
418956 139.082694 168.197.130.117 -> 244.3.210.197 TCP 64 evtp-data > http [ACK] Seq=3600 Ack=65736 Win=11340 Len=0
419016 139.086935 168.197.130.117 -> 244.3.210.197 TCP 64 glishd > http [ACK] Seq=6693 Ack=118333 Win=13860 Len=0
419090 139.091200 168.197.130.117 -> 244.3.210.197 TCP 64 repliweb > http [ACK] Seq=3606 Ack=57805 Win=17640 Len=0
419091 139.091236 168.197.130.117 -> 244.3.210.197 TCP 64 evtp-data > http [ACK] Seq=3600 Ack=70776 Win=6300 Len=0
419231 139.098876 168.197.130.117 -> 244.3.210.197 TCP 64 evtp-data > http [ACK] Seq=3600 Ack=75480 Win=17640 Len=0
419232 139.098880 168.197.130.117 -> 244.3.210.197 TCP 64 starbot > http [ACK] Seq=2170 Ack=138726 Win=17640 Len=0
419379 139.106688 168.197.130.117 -> 244.3.210.197 TCP 64 [TCP Dup ACK 419231#1] evtp-data > http [ACK] Seq=3600 Ack=75480 Win=17640 Len=0
419467 139.112950 168.197.130.117 -> 244.3.210.197 TCP 64 glishd > http [ACK] Seq=6693 Ack=118608 Win=17640 Len=0
419917 139.143577 168.197.130.117 -> 244.3.210.197 TCP 64 evtp-data > http [ACK] Seq=4333 Ack=85560 Win=17640 Len=0
420063 139.153735 168.197.130.117 -> 244.3.210.197 TCP 64 evtp-data > http [ACK] Seq=4333 Ack=93120 Win=17640 Len=0
420064 139.153740 168.197.130.117 -> 244.3.210.197 TCP 64 glishd > http [ACK] Seq=7420 Ack=121128 Win=17640 Len=0
420206 139.161845 168.197.130.117 -> 244.3.210.197 TCP 64 catalyst > http [ACK] Seq=4350 Ack=45088 Win=17640 Len=0
420207 139.161849 168.197.130.117 -> 244.3.210.197 TCP 64 evtp-data > http [ACK] Seq=4333 Ack=101940 Win=17640 Len=0
420248 139.165331 168.197.130.117 -> 244.3.210.197 TCP 64 evtp-data > http [ACK] Seq=4333 Ack=108240 Win=17640 Len=0
420249 139.165335 168.197.130.117 -> 244.3.210.197 TCP 64 repliweb > http [ACK] Seq=4353 Ack=61033 Win=17640 Len=0
420345 139.169791 168.197.130.117 -> 244.3.210.197 TCP 64 [TCP Dup ACK 420248#1] evtp-data > http [ACK] Seq=4333 Ack=108240 Win=17640 Len=0
420432 139.176863 168.197.130.117 -> 244.3.210.197 TCP 64 nmsigport > http [ACK] Seq=3613 Ack=80671 Win=17640 Len=0
420545 139.183848 168.197.130.117 -> 244.3.210.197 TCP 64 starbot > http [ACK] Seq=2917 Ack=141065 Win=17640 Len=0
420614 139.186714 168.197.130.117 -> 244.3.210.197 TCP 64 glishd > http [ACK] Seq=8167 Ack=123715 Win=17640 Len=0
420754 139.201019 168.197.130.117 -> 244.3.210.197 TCP 64 catalyst > http [ACK] Seq=5072 Ack=48868 Win=17640 Len=0
421943 139.280935 168.197.130.117 -> 244.3.210.197 TCP 64 evtp-data > http [ACK] Seq=4333 Ack=108717 Win=17163 Len=0
423443 139.380838 168.197.130.117 -> 244.3.210.197 TCP 64 catalyst > http [ACK] Seq=5072 Ack=49655 Win=16853 Len=0
431367 140.894893 168.197.130.117 -> 244.3.210.197 TCP 64 repliweb > http [ACK] Seq=4992 Ack=62692 Win=17640 Len=0
638887 201.641090 168.197.130.117 -> 244.3.210.197 TCP 64 evtp-data > http [RST, ACK] Seq=4333 Ack=108717 Win=0 Len=0
638888 201.641095 168.197.130.117 -> 244.3.210.197 TCP 64 nmsigport > http [RST, ACK] Seq=3613 Ack=80671 Win=0 Len=0
638889 201.641099 168.197.130.117 -> 244.3.210.197 TCP 64 starbot > http [RST, ACK] Seq=2917 Ack=141065 Win=0 Len=0
638890 201.641103 168.197.130.117 -> 244.3.210.197 TCP 64 glishd > http [RST, ACK] Seq=8167 Ack=123715 Win=0 Len=0
638891 201.641108 168.197.130.117 -> 244.3.210.197 TCP 64 catalyst > http [RST, ACK] Seq=5072 Ack=49655 Win=0 Len=0
638892 201.641112 168.197.130.117 -> 244.3.210.197 TCP 64 repliweb > http [RST, ACK] Seq=4992 Ack=62692 Win=0 Len=0
