68888  28.495045 168.117.3.145 -> 244.3.160.239 TCP 66 9794 > http [SYN] Seq=0 Win=32768 Len=0 MSS=1452 SACK_PERM=1
69004  28.546708 168.117.3.145 -> 244.3.160.239 TCP 64 9794 > http [ACK] Seq=1 Ack=1 Win=32768 Len=0
70679  29.232107 168.117.3.145 -> 244.3.160.239 TCP 64 9794 > http [ACK] Seq=1319 Ack=1743 Win=32768 Len=0
70843  29.290992 168.117.3.145 -> 244.3.160.239 TCP 64 9794 > http [ACK] Seq=1319 Ack=4647 Win=32768 Len=0
70890  29.298437 168.117.3.145 -> 244.3.160.239 TCP 64 9794 > http [ACK] Seq=1319 Ack=7551 Win=32768 Len=0
71002  29.352354 168.117.3.145 -> 244.3.160.239 TCP 64 9794 > http [ACK] Seq=1319 Ack=10455 Win=32768 Len=0
71050  29.358484 168.117.3.145 -> 244.3.160.239 TCP 64 9794 > http [ACK] Seq=1319 Ack=13359 Win=32768 Len=0
71079  29.364540 168.117.3.145 -> 244.3.160.239 TCP 64 9794 > http [ACK] Seq=1319 Ack=15384 Win=32768 Len=0
71289  29.412990 168.117.3.145 -> 244.3.160.239 TCP 64 9794 > http [ACK] Seq=1319 Ack=17744 Win=32768 Len=0
71297  29.420380 168.117.3.145 -> 244.3.160.239 TCP 64 9794 > http [ACK] Seq=1319 Ack=20648 Win=32768 Len=0
71318  29.428128 168.117.3.145 -> 244.3.160.239 TCP 64 9794 > http [ACK] Seq=1319 Ack=23552 Win=32768 Len=0
71334  29.432933 168.117.3.145 -> 244.3.160.239 TCP 64 9794 > http [ACK] Seq=1319 Ack=26456 Win=32768 Len=0
71483  29.470738 168.117.3.145 -> 244.3.160.239 TCP 64 9794 > http [ACK] Seq=1319 Ack=29360 Win=32768 Len=0
71511  29.480540 168.117.3.145 -> 244.3.160.239 TCP 64 9794 > http [ACK] Seq=1319 Ack=32264 Win=32768 Len=0
71520  29.486591 168.117.3.145 -> 244.3.160.239 TCP 64 9794 > http [ACK] Seq=1319 Ack=35168 Win=32768 Len=0
71527  29.488398 168.117.3.145 -> 244.3.160.239 TCP 64 9794 > http [ACK] Seq=1319 Ack=37032 Win=32768 Len=0
71547  29.492953 168.117.3.145 -> 244.3.160.239 TCP 64 9794 > http [ACK] Seq=1319 Ack=39936 Win=32768 Len=0
71560  29.496494 168.117.3.145 -> 244.3.160.239 TCP 64 9794 > http [ACK] Seq=1319 Ack=42840 Win=32768 Len=0
71735  29.527262 168.117.3.145 -> 244.3.160.239 TCP 64 9794 > http [ACK] Seq=1319 Ack=45744 Win=32768 Len=0
71786  29.531686 168.117.3.145 -> 244.3.160.239 TCP 64 9794 > http [ACK] Seq=1319 Ack=48648 Win=32768 Len=0
71862  29.541377 168.117.3.145 -> 244.3.160.239 TCP 64 9794 > http [ACK] Seq=1319 Ack=51552 Win=32768 Len=0
71928  29.546101 168.117.3.145 -> 244.3.160.239 TCP 64 9794 > http [ACK] Seq=1319 Ack=53416 Win=32768 Len=0
71941  29.551736 168.117.3.145 -> 244.3.160.239 TCP 64 9794 > http [ACK] Seq=1319 Ack=56320 Win=32768 Len=0
71951  29.556634 168.117.3.145 -> 244.3.160.239 TCP 64 9794 > http [ACK] Seq=1319 Ack=59224 Win=32768 Len=0
71958  29.563270 168.117.3.145 -> 244.3.160.239 TCP 64 9794 > http [ACK] Seq=1319 Ack=62128 Win=32768 Len=0
71962  29.565531 168.117.3.145 -> 244.3.160.239 TCP 64 9794 > http [ACK] Seq=1319 Ack=65032 Win=32768 Len=0
71977  29.570110 168.117.3.145 -> 244.3.160.239 TCP 64 9794 > http [ACK] Seq=1319 Ack=67936 Win=32768 Len=0
71990  29.571720 168.117.3.145 -> 244.3.160.239 TCP 64 9794 > http [ACK] Seq=1319 Ack=69800 Win=32768 Len=0
72143  29.590465 168.117.3.145 -> 244.3.160.239 TCP 64 9794 > http [ACK] Seq=1319 Ack=72704 Win=32768 Len=0
72155  29.592689 168.117.3.145 -> 244.3.160.239 TCP 64 9794 > http [ACK] Seq=1319 Ack=75608 Win=32768 Len=0
72186  29.599745 168.117.3.145 -> 244.3.160.239 TCP 64 9794 > http [ACK] Seq=1319 Ack=78000 Win=32768 Len=0
72192  29.601208 168.117.3.145 -> 244.3.160.239 TCP 64 9794 > http [ACK] Seq=1319 Ack=79468 Win=32768 Len=0
72206  29.607618 168.117.3.145 -> 244.3.160.239 TCP 64 9794 > http [ACK] Seq=1319 Ack=81820 Win=32768 Len=0
72215  29.609254 168.117.3.145 -> 244.3.160.239 TCP 64 9794 > http [ACK] Seq=1319 Ack=84724 Win=32768 Len=0
72224  29.612211 168.117.3.145 -> 244.3.160.239 TCP 64 9794 > http [ACK] Seq=1319 Ack=86192 Win=32768 Len=0
72238  29.617973 168.117.3.145 -> 244.3.160.239 TCP 64 9794 > http [ACK] Seq=1319 Ack=89096 Win=32768 Len=0
72266  29.624609 168.117.3.145 -> 244.3.160.239 TCP 64 9794 > http [ACK] Seq=1319 Ack=92000 Win=32768 Len=0
72281  29.632376 168.117.3.145 -> 244.3.160.239 TCP 64 9794 > http [ACK] Seq=1319 Ack=94904 Win=32768 Len=0
72302  29.633961 168.117.3.145 -> 244.3.160.239 TCP 64 9794 > http [ACK] Seq=1319 Ack=97808 Win=32768 Len=0
72323  29.639745 168.117.3.145 -> 244.3.160.239 TCP 64 9794 > http [ACK] Seq=1319 Ack=100712 Win=32768 Len=0
72350  29.646501 168.117.3.145 -> 244.3.160.239 TCP 64 9794 > http [ACK] Seq=1319 Ack=103616 Win=32768 Len=0
72396  29.654318 168.117.3.145 -> 244.3.160.239 TCP 64 9794 > http [ACK] Seq=1319 Ack=106520 Win=32768 Len=0
72422  29.657858 168.117.3.145 -> 244.3.160.239 TCP 64 9794 > http [ACK] Seq=1319 Ack=109424 Win=32768 Len=0
72458  29.663832 168.117.3.145 -> 244.3.160.239 TCP 64 9794 > http [ACK] Seq=1319 Ack=112328 Win=32768 Len=0
72487  29.672086 168.117.3.145 -> 244.3.160.239 TCP 64 9794 > http [ACK] Seq=1319 Ack=115232 Win=32768 Len=0
72511  29.676614 168.117.3.145 -> 244.3.160.239 TCP 64 9794 > http [ACK] Seq=1319 Ack=118136 Win=32768 Len=0
72519  29.679974 168.117.3.145 -> 244.3.160.239 TCP 64 9794 > http [ACK] Seq=1319 Ack=121040 Win=32768 Len=0
72539  29.686213 168.117.3.145 -> 244.3.160.239 TCP 64 9794 > http [ACK] Seq=1319 Ack=123944 Win=32768 Len=0
72549  29.692633 168.117.3.145 -> 244.3.160.239 TCP 64 9794 > http [ACK] Seq=1319 Ack=126848 Win=32768 Len=0
72556  29.697713 168.117.3.145 -> 244.3.160.239 TCP 64 9794 > http [ACK] Seq=1319 Ack=129752 Win=32768 Len=0
72575  29.702229 168.117.3.145 -> 244.3.160.239 TCP 64 9794 > http [ACK] Seq=1319 Ack=132656 Win=32768 Len=0
72585  29.708711 168.117.3.145 -> 244.3.160.239 TCP 64 9794 > http [ACK] Seq=1319 Ack=135560 Win=32768 Len=0
72630  29.714698 168.117.3.145 -> 244.3.160.239 TCP 64 9794 > http [ACK] Seq=1319 Ack=138464 Win=32768 Len=0
72653  29.722312 168.117.3.145 -> 244.3.160.239 TCP 64 9794 > http [ACK] Seq=1319 Ack=141368 Win=32768 Len=0
72665  29.725598 168.117.3.145 -> 244.3.160.239 TCP 64 9794 > http [ACK] Seq=1319 Ack=144272 Win=32768 Len=0
72695  29.730193 168.117.3.145 -> 244.3.160.239 TCP 64 9794 > http [ACK] Seq=1319 Ack=147176 Win=32768 Len=0
72738  29.735003 168.117.3.145 -> 244.3.160.239 TCP 64 9794 > http [ACK] Seq=1319 Ack=149040 Win=32768 Len=0
72785  29.744941 168.117.3.145 -> 244.3.160.239 TCP 64 9794 > http [ACK] Seq=1319 Ack=151944 Win=32768 Len=0
72791  29.747131 168.117.3.145 -> 244.3.160.239 TCP 64 9794 > http [ACK] Seq=1319 Ack=154848 Win=32768 Len=0
72804  29.750617 168.117.3.145 -> 244.3.160.239 TCP 64 9794 > http [ACK] Seq=1319 Ack=157752 Win=32768 Len=0
72822  29.755247 168.117.3.145 -> 244.3.160.239 TCP 64 9794 > http [ACK] Seq=1319 Ack=160656 Win=32768 Len=0
72825  29.760354 168.117.3.145 -> 244.3.160.239 TCP 64 9794 > http [ACK] Seq=1319 Ack=163560 Win=32768 Len=0
72857  29.766472 168.117.3.145 -> 244.3.160.239 TCP 64 9794 > http [ACK] Seq=1319 Ack=166464 Win=32768 Len=0
72865  29.772596 168.117.3.145 -> 244.3.160.239 TCP 64 9794 > http [ACK] Seq=1319 Ack=169368 Win=32768 Len=0
72876  29.778116 168.117.3.145 -> 244.3.160.239 TCP 64 9794 > http [ACK] Seq=1319 Ack=172272 Win=32768 Len=0
72896  29.786218 168.117.3.145 -> 244.3.160.239 TCP 64 9794 > http [ACK] Seq=1319 Ack=175176 Win=32768 Len=0
72922  29.791511 168.117.3.145 -> 244.3.160.239 TCP 64 9794 > http [ACK] Seq=1319 Ack=178080 Win=32768 Len=0
72929  29.792338 168.117.3.145 -> 244.3.160.239 TCP 64 9794 > http [ACK] Seq=1319 Ack=180984 Win=32768 Len=0
72995  29.804559 168.117.3.145 -> 244.3.160.239 TCP 64 9794 > http [ACK] Seq=1319 Ack=183888 Win=32768 Len=0
73023  29.809586 168.117.3.145 -> 244.3.160.239 TCP 64 9794 > http [ACK] Seq=1319 Ack=186792 Win=32768 Len=0
73029  29.814662 168.117.3.145 -> 244.3.160.239 TCP 64 9794 > http [ACK] Seq=1319 Ack=189696 Win=32768 Len=0
73048  29.819628 168.117.3.145 -> 244.3.160.239 TCP 64 9794 > http [ACK] Seq=1319 Ack=192600 Win=32768 Len=0
73080  29.824243 168.117.3.145 -> 244.3.160.239 TCP 64 9794 > http [ACK] Seq=1319 Ack=195504 Win=32768 Len=0
73083  29.831092 168.117.3.145 -> 244.3.160.239 TCP 64 9794 > http [ACK] Seq=1319 Ack=198408 Win=32768 Len=0
73091  29.836454 168.117.3.145 -> 244.3.160.239 TCP 64 9794 > http [ACK] Seq=1319 Ack=201312 Win=32768 Len=0
73094  29.839812 168.117.3.145 -> 244.3.160.239 TCP 64 9794 > http [ACK] Seq=1319 Ack=204216 Win=32768 Len=0
73119  29.843904 168.117.3.145 -> 244.3.160.239 TCP 64 9794 > http [ACK] Seq=1319 Ack=207120 Win=32768 Len=0
73130  29.852076 168.117.3.145 -> 244.3.160.239 TCP 64 9794 > http [ACK] Seq=1319 Ack=208984 Win=32768 Len=0
73145  29.854700 168.117.3.145 -> 244.3.160.239 TCP 64 9794 > http [ACK] Seq=1319 Ack=211888 Win=32768 Len=0
73162  29.862151 168.117.3.145 -> 244.3.160.239 TCP 64 9794 > http [ACK] Seq=1319 Ack=214792 Win=32768 Len=0
73192  29.870275 168.117.3.145 -> 244.3.160.239 TCP 64 9794 > http [ACK] Seq=1319 Ack=217696 Win=32768 Len=0
73223  29.875439 168.117.3.145 -> 244.3.160.239 TCP 64 9794 > http [ACK] Seq=1319 Ack=220600 Win=32768 Len=0
73248  29.879612 168.117.3.145 -> 244.3.160.239 TCP 64 9794 > http [ACK] Seq=1319 Ack=223504 Win=32768 Len=0
73274  29.883639 168.117.3.145 -> 244.3.160.239 TCP 64 9794 > http [ACK] Seq=1319 Ack=226408 Win=32768 Len=0
73286  29.889464 168.117.3.145 -> 244.3.160.239 TCP 64 9794 > http [ACK] Seq=1319 Ack=229312 Win=32768 Len=0
73303  29.894621 168.117.3.145 -> 244.3.160.239 TCP 64 9794 > http [ACK] Seq=1319 Ack=232216 Win=32768 Len=0
73306  29.899745 168.117.3.145 -> 244.3.160.239 TCP 64 9794 > http [ACK] Seq=1319 Ack=235120 Win=32768 Len=0
73321  29.904661 168.117.3.145 -> 244.3.160.239 TCP 64 9794 > http [ACK] Seq=1319 Ack=238024 Win=32768 Len=0
73326  29.912311 168.117.3.145 -> 244.3.160.239 TCP 64 9794 > http [ACK] Seq=1319 Ack=240928 Win=32768 Len=0
73345  29.915673 168.117.3.145 -> 244.3.160.239 TCP 64 9794 > http [ACK] Seq=1319 Ack=243832 Win=32768 Len=0
73350  29.920559 168.117.3.145 -> 244.3.160.239 TCP 64 9794 > http [ACK] Seq=1319 Ack=246736 Win=32768 Len=0
73370  29.928815 168.117.3.145 -> 244.3.160.239 TCP 64 9794 > http [ACK] Seq=1319 Ack=249640 Win=32768 Len=0
73398  29.935359 168.117.3.145 -> 244.3.160.239 TCP 64 9794 > http [ACK] Seq=1319 Ack=252544 Win=32768 Len=0
73412  29.939694 168.117.3.145 -> 244.3.160.239 TCP 64 9794 > http [ACK] Seq=1319 Ack=255448 Win=32768 Len=0
73427  29.945387 168.117.3.145 -> 244.3.160.239 TCP 64 9794 > http [ACK] Seq=1319 Ack=258352 Win=32768 Len=0
73453  29.950412 168.117.3.145 -> 244.3.160.239 TCP 64 9794 > http [ACK] Seq=1319 Ack=261256 Win=32768 Len=0
73496  29.955783 168.117.3.145 -> 244.3.160.239 TCP 64 9794 > http [ACK] Seq=1319 Ack=264160 Win=32768 Len=0
73527  29.961433 168.117.3.145 -> 244.3.160.239 TCP 64 9794 > http [ACK] Seq=1319 Ack=267064 Win=32768 Len=0
73551  29.965395 168.117.3.145 -> 244.3.160.239 TCP 64 9794 > http [ACK] Seq=1319 Ack=268928 Win=32768 Len=0
73564  29.969967 168.117.3.145 -> 244.3.160.239 TCP 64 9794 > http [ACK] Seq=1319 Ack=271832 Win=32768 Len=0
73572  29.975208 168.117.3.145 -> 244.3.160.239 TCP 64 9794 > http [ACK] Seq=1319 Ack=274736 Win=32768 Len=0
73585  29.980186 168.117.3.145 -> 244.3.160.239 TCP 64 9794 > http [ACK] Seq=1319 Ack=277640 Win=32768 Len=0
73621  29.989056 168.117.3.145 -> 244.3.160.239 TCP 64 9794 > http [ACK] Seq=1319 Ack=280544 Win=32768 Len=0
73626  29.992239 168.117.3.145 -> 244.3.160.239 TCP 64 9794 > http [ACK] Seq=1319 Ack=283448 Win=32768 Len=0
73652  29.997360 168.117.3.145 -> 244.3.160.239 TCP 64 9794 > http [ACK] Seq=1319 Ack=286352 Win=32768 Len=0
73674  30.003358 168.117.3.145 -> 244.3.160.239 TCP 64 9794 > http [ACK] Seq=1319 Ack=289256 Win=32768 Len=0
73712  30.008777 168.117.3.145 -> 244.3.160.239 TCP 64 9794 > http [ACK] Seq=1319 Ack=292160 Win=32768 Len=0
73724  30.013397 168.117.3.145 -> 244.3.160.239 TCP 64 9794 > http [ACK] Seq=1319 Ack=295064 Win=32768 Len=0
73748  30.021454 168.117.3.145 -> 244.3.160.239 TCP 64 9794 > http [ACK] Seq=1319 Ack=297968 Win=32768 Len=0
73767  30.024307 168.117.3.145 -> 244.3.160.239 TCP 64 9794 > http [ACK] Seq=1319 Ack=300872 Win=32768 Len=0
73810  30.032835 168.117.3.145 -> 244.3.160.239 TCP 64 9794 > http [ACK] Seq=1319 Ack=303776 Win=32768 Len=0
73822  30.037518 168.117.3.145 -> 244.3.160.239 TCP 64 9794 > http [ACK] Seq=1319 Ack=306680 Win=32768 Len=0
73832  30.038645 168.117.3.145 -> 244.3.160.239 TCP 64 9794 > http [ACK] Seq=1319 Ack=309584 Win=32768 Len=0
73856  30.048568 168.117.3.145 -> 244.3.160.239 TCP 64 9794 > http [ACK] Seq=1319 Ack=312488 Win=32768 Len=0
73887  30.053752 168.117.3.145 -> 244.3.160.239 TCP 64 9794 > http [ACK] Seq=1319 Ack=315392 Win=32768 Len=0
73896  30.058939 168.117.3.145 -> 244.3.160.239 TCP 64 9794 > http [ACK] Seq=1319 Ack=318296 Win=32768 Len=0
73907  30.064076 168.117.3.145 -> 244.3.160.239 TCP 64 9794 > http [ACK] Seq=1319 Ack=321200 Win=32768 Len=0
73939  30.069099 168.117.3.145 -> 244.3.160.239 TCP 64 9794 > http [ACK] Seq=1319 Ack=324104 Win=32768 Len=0
73960  30.076017 168.117.3.145 -> 244.3.160.239 TCP 64 9794 > http [ACK] Seq=1319 Ack=327008 Win=32768 Len=0
73975  30.079454 168.117.3.145 -> 244.3.160.239 TCP 64 9794 > http [ACK] Seq=1319 Ack=328872 Win=32768 Len=0
74000  30.084770 168.117.3.145 -> 244.3.160.239 TCP 64 9794 > http [ACK] Seq=1319 Ack=331776 Win=32768 Len=0
74029  30.092706 168.117.3.145 -> 244.3.160.239 TCP 64 9794 > http [ACK] Seq=1319 Ack=334680 Win=32768 Len=0
74053  30.097203 168.117.3.145 -> 244.3.160.239 TCP 64 9794 > http [ACK] Seq=1319 Ack=337584 Win=32768 Len=0
74076  30.100542 168.117.3.145 -> 244.3.160.239 TCP 64 9794 > http [ACK] Seq=1319 Ack=340488 Win=29864 Len=0
74105  30.108338 168.117.3.145 -> 244.3.160.239 TCP 64 9794 > http [ACK] Seq=1319 Ack=343392 Win=26960 Len=0
74124  30.112124 168.117.3.145 -> 244.3.160.239 TCP 64 9794 > http [ACK] Seq=1319 Ack=346296 Win=24056 Len=0
74131  30.119354 168.117.3.145 -> 244.3.160.239 TCP 64 9794 > http [ACK] Seq=1319 Ack=349200 Win=21152 Len=0
74149  30.124723 168.117.3.145 -> 244.3.160.239 TCP 64 9794 > http [ACK] Seq=1319 Ack=352104 Win=18248 Len=0
74150  30.128137 168.117.3.145 -> 244.3.160.239 TCP 64 9794 > http [ACK] Seq=1319 Ack=355008 Win=15344 Len=0
74152  30.133648 168.117.3.145 -> 244.3.160.239 TCP 64 9794 > http [ACK] Seq=1319 Ack=357912 Win=12440 Len=0
74162  30.141368 168.117.3.145 -> 244.3.160.239 TCP 64 9794 > http [ACK] Seq=1319 Ack=360816 Win=9536 Len=0
74167  30.143460 168.117.3.145 -> 244.3.160.239 TCP 64 9794 > http [ACK] Seq=1319 Ack=363720 Win=6632 Len=0
74185  30.151899 168.117.3.145 -> 244.3.160.239 TCP 64 9794 > http [ACK] Seq=1319 Ack=366624 Win=3728 Len=0
74212  30.156399 168.117.3.145 -> 244.3.160.239 TCP 64 9794 > http [ACK] Seq=1319 Ack=369528 Win=824 Len=0
75927  30.602805 168.117.3.145 -> 244.3.160.239 TCP 64 [TCP Window Update] 9794 > http [ACK] Seq=1319 Ack=369528 Win=4584 Len=0
75934  30.603959 168.117.3.145 -> 244.3.160.239 TCP 64 [TCP Window Update] 9794 > http [ACK] Seq=1319 Ack=369528 Win=32768 Len=0
76342  30.663231 168.117.3.145 -> 244.3.160.239 TCP 64 9794 > http [ACK] Seq=1319 Ack=372432 Win=32768 Len=0
76372  30.668011 168.117.3.145 -> 244.3.160.239 TCP 64 9794 > http [ACK] Seq=1319 Ack=375336 Win=32768 Len=0
76389  30.673482 168.117.3.145 -> 244.3.160.239 TCP 64 9794 > http [ACK] Seq=1319 Ack=378240 Win=32768 Len=0
76457  30.678079 168.117.3.145 -> 244.3.160.239 TCP 64 9794 > http [ACK] Seq=1319 Ack=381144 Win=32768 Len=0
76574  30.685480 168.117.3.145 -> 244.3.160.239 TCP 64 9794 > http [ACK] Seq=1319 Ack=384048 Win=32768 Len=0
76606  30.686686 168.117.3.145 -> 244.3.160.239 TCP 64 9794 > http [ACK] Seq=1319 Ack=386575 Win=32768 Len=0
76623  30.689026 168.117.3.145 -> 244.3.160.239 TCP 64 9794 > http [FIN, ACK] Seq=1319 Ack=386575 Win=32768 Len=0
255513  90.735323 168.117.3.145 -> 244.3.160.239 TCP 66 navisphere-sec > http [SYN] Seq=0 Win=32768 Len=0 MSS=1452 SACK_PERM=1
255624  90.787777 168.117.3.145 -> 244.3.160.239 TCP 64 navisphere-sec > http [ACK] Seq=1 Ack=1 Win=32768 Len=0
287439  96.013589 168.117.3.145 -> 244.3.160.239 TCP 64 navisphere-sec > http [ACK] Seq=1320 Ack=1743 Win=32768 Len=0
287479  96.016360 168.117.3.145 -> 244.3.160.239 TCP 64 navisphere-sec > http [ACK] Seq=1320 Ack=4280 Win=32768 Len=0
287638  96.075341 168.117.3.145 -> 244.3.160.239 TCP 64 navisphere-sec > http [ACK] Seq=1320 Ack=7184 Win=32768 Len=0
287689  96.083005 168.117.3.145 -> 244.3.160.239 TCP 64 navisphere-sec > http [ACK] Seq=1320 Ack=9544 Win=32768 Len=0
287714  96.086042 168.117.3.145 -> 244.3.160.239 TCP 64 navisphere-sec > http [ACK] Seq=1320 Ack=11004 Win=32768 Len=0
287808  96.134538 168.117.3.145 -> 244.3.160.239 TCP 64 navisphere-sec > http [ACK] Seq=1320 Ack=12472 Win=32768 Len=0
287826  96.140430 168.117.3.145 -> 244.3.160.239 TCP 64 navisphere-sec > http [ACK] Seq=1320 Ack=15376 Win=32768 Len=0
287859  96.146992 168.117.3.145 -> 244.3.160.239 TCP 64 navisphere-sec > http [ACK] Seq=1320 Ack=17736 Win=32768 Len=0
287896  96.154109 168.117.3.145 -> 244.3.160.239 TCP 64 navisphere-sec > http [ACK] Seq=1320 Ack=19196 Win=32768 Len=0
287899  96.155082 168.117.3.145 -> 244.3.160.239 TCP 64 navisphere-sec > http [ACK] Seq=1320 Ack=20664 Win=32768 Len=0
287997  96.191074 168.117.3.145 -> 244.3.160.239 TCP 64 navisphere-sec > http [ACK] Seq=1320 Ack=23568 Win=32768 Len=0
288001  96.196294 168.117.3.145 -> 244.3.160.239 TCP 64 navisphere-sec > http [ACK] Seq=1320 Ack=26472 Win=32768 Len=0
288016  96.204377 168.117.3.145 -> 244.3.160.239 TCP 64 navisphere-sec > http [ACK] Seq=1320 Ack=29376 Win=32768 Len=0
288024  96.207552 168.117.3.145 -> 244.3.160.239 TCP 64 navisphere-sec > http [ACK] Seq=1320 Ack=32280 Win=32768 Len=0
288034  96.214953 168.117.3.145 -> 244.3.160.239 TCP 64 navisphere-sec > http [ACK] Seq=1320 Ack=35184 Win=32768 Len=0
288047  96.217718 168.117.3.145 -> 244.3.160.239 TCP 64 navisphere-sec > http [ACK] Seq=1320 Ack=37048 Win=32768 Len=0
288129  96.246910 168.117.3.145 -> 244.3.160.239 TCP 64 navisphere-sec > http [ACK] Seq=1320 Ack=39952 Win=32768 Len=0
288162  96.255352 168.117.3.145 -> 244.3.160.239 TCP 64 navisphere-sec > http [ACK] Seq=1320 Ack=42856 Win=32768 Len=0
288166  96.260037 168.117.3.145 -> 244.3.160.239 TCP 64 navisphere-sec > http [ACK] Seq=1320 Ack=45760 Win=32768 Len=0
288186  96.265372 168.117.3.145 -> 244.3.160.239 TCP 64 navisphere-sec > http [ACK] Seq=1320 Ack=48664 Win=32768 Len=0
288191  96.270759 168.117.3.145 -> 244.3.160.239 TCP 64 navisphere-sec > http [ACK] Seq=1320 Ack=51568 Win=32768 Len=0
288202  96.277835 168.117.3.145 -> 244.3.160.239 TCP 64 navisphere-sec > http [ACK] Seq=1320 Ack=54472 Win=32768 Len=0
288217  96.280354 168.117.3.145 -> 244.3.160.239 TCP 64 navisphere-sec > http [ACK] Seq=1320 Ack=57376 Win=32768 Len=0
288223  96.284933 168.117.3.145 -> 244.3.160.239 TCP 64 navisphere-sec > http [ACK] Seq=1320 Ack=60280 Win=32768 Len=0
288230  96.286863 168.117.3.145 -> 244.3.160.239 TCP 64 [TCP Dup ACK 288223#1] navisphere-sec > http [ACK] Seq=1320 Ack=60280 Win=32768 Len=0
288234  96.288502 168.117.3.145 -> 244.3.160.239 TCP 64 navisphere-sec > http [ACK] Seq=1320 Ack=63184 Win=32768 Len=0
288280  96.304477 168.117.3.145 -> 244.3.160.239 TCP 64 navisphere-sec > http [ACK] Seq=1320 Ack=66088 Win=32768 Len=0
288283  96.305963 168.117.3.145 -> 244.3.160.239 TCP 64 navisphere-sec > http [ACK] Seq=1320 Ack=67952 Win=32768 Len=0
288311  96.314986 168.117.3.145 -> 244.3.160.239 TCP 64 navisphere-sec > http [ACK] Seq=1320 Ack=70856 Win=32768 Len=0
288326  96.319946 168.117.3.145 -> 244.3.160.239 TCP 64 navisphere-sec > http [ACK] Seq=1320 Ack=73760 Win=32768 Len=0
288340  96.325329 168.117.3.145 -> 244.3.160.239 TCP 64 navisphere-sec > http [ACK] Seq=1320 Ack=76664 Win=32768 Len=0
288354  96.330561 168.117.3.145 -> 244.3.160.239 TCP 64 navisphere-sec > http [ACK] Seq=1320 Ack=79568 Win=32768 Len=0
288367  96.337004 168.117.3.145 -> 244.3.160.239 TCP 64 navisphere-sec > http [ACK] Seq=1320 Ack=82472 Win=32768 Len=0
288393  96.344588 168.117.3.145 -> 244.3.160.239 TCP 64 navisphere-sec > http [ACK] Seq=1320 Ack=85376 Win=32768 Len=0
288401  96.346813 168.117.3.145 -> 244.3.160.239 TCP 64 navisphere-sec > http [ACK] Seq=1320 Ack=88280 Win=32768 Len=0
288411  96.351174 168.117.3.145 -> 244.3.160.239 TCP 64 navisphere-sec > http [ACK] Seq=1320 Ack=91184 Win=32768 Len=0
288421  96.354740 168.117.3.145 -> 244.3.160.239 TCP 64 navisphere-sec > http [ACK] Seq=1320 Ack=94088 Win=32768 Len=0
288447  96.361557 168.117.3.145 -> 244.3.160.239 TCP 64 navisphere-sec > http [ACK] Seq=1320 Ack=96992 Win=32768 Len=0
288456  96.365290 168.117.3.145 -> 244.3.160.239 TCP 64 navisphere-sec > http [ACK] Seq=1320 Ack=98856 Win=32768 Len=0
288466  96.371178 168.117.3.145 -> 244.3.160.239 TCP 64 navisphere-sec > http [ACK] Seq=1320 Ack=101760 Win=32768 Len=0
288486  96.376571 168.117.3.145 -> 244.3.160.239 TCP 64 navisphere-sec > http [ACK] Seq=1320 Ack=104664 Win=32768 Len=0
288501  96.382891 168.117.3.145 -> 244.3.160.239 TCP 64 navisphere-sec > http [ACK] Seq=1320 Ack=107568 Win=32768 Len=0
288524  96.387682 168.117.3.145 -> 244.3.160.239 TCP 64 navisphere-sec > http [ACK] Seq=1320 Ack=110472 Win=32768 Len=0
288537  96.393579 168.117.3.145 -> 244.3.160.239 TCP 64 navisphere-sec > http [ACK] Seq=1320 Ack=113376 Win=32768 Len=0
288565  96.402452 168.117.3.145 -> 244.3.160.239 TCP 64 navisphere-sec > http [ACK] Seq=1320 Ack=116280 Win=32768 Len=0
288595  96.410327 168.117.3.145 -> 244.3.160.239 TCP 64 navisphere-sec > http [ACK] Seq=1320 Ack=119184 Win=32768 Len=0
288606  96.415597 168.117.3.145 -> 244.3.160.239 TCP 64 navisphere-sec > http [ACK] Seq=1320 Ack=122088 Win=32768 Len=0
288633  96.420214 168.117.3.145 -> 244.3.160.239 TCP 64 navisphere-sec > http [ACK] Seq=1320 Ack=124992 Win=32768 Len=0
288643  96.426980 168.117.3.145 -> 244.3.160.239 TCP 64 navisphere-sec > http [ACK] Seq=1320 Ack=127896 Win=32768 Len=0
288648  96.428594 168.117.3.145 -> 244.3.160.239 TCP 64 navisphere-sec > http [ACK] Seq=1320 Ack=129760 Win=32768 Len=0
288662  96.433557 168.117.3.145 -> 244.3.160.239 TCP 64 navisphere-sec > http [ACK] Seq=1320 Ack=132664 Win=32768 Len=0
288683  96.438507 168.117.3.145 -> 244.3.160.239 TCP 64 navisphere-sec > http [ACK] Seq=1320 Ack=135568 Win=32768 Len=0
288688  96.443846 168.117.3.145 -> 244.3.160.239 TCP 64 navisphere-sec > http [ACK] Seq=1320 Ack=138472 Win=32768 Len=0
288696  96.448869 168.117.3.145 -> 244.3.160.239 TCP 64 navisphere-sec > http [ACK] Seq=1320 Ack=141376 Win=32768 Len=0
288710  96.451768 168.117.3.145 -> 244.3.160.239 TCP 64 navisphere-sec > http [ACK] Seq=1320 Ack=144280 Win=32768 Len=0
288742  96.458935 168.117.3.145 -> 244.3.160.239 TCP 64 navisphere-sec > http [ACK] Seq=1320 Ack=147184 Win=32768 Len=0
288844  96.466881 168.117.3.145 -> 244.3.160.239 TCP 64 navisphere-sec > http [ACK] Seq=1320 Ack=150088 Win=32768 Len=0
288920  96.472794 168.117.3.145 -> 244.3.160.239 TCP 64 navisphere-sec > http [ACK] Seq=1320 Ack=152992 Win=32768 Len=0
288983  96.477583 168.117.3.145 -> 244.3.160.239 TCP 64 navisphere-sec > http [ACK] Seq=1320 Ack=155896 Win=32768 Len=0
289023  96.484975 168.117.3.145 -> 244.3.160.239 TCP 64 navisphere-sec > http [ACK] Seq=1320 Ack=158800 Win=32768 Len=0
289045  96.490710 168.117.3.145 -> 244.3.160.239 TCP 64 navisphere-sec > http [ACK] Seq=1320 Ack=160664 Win=32768 Len=0
289057  96.495291 168.117.3.145 -> 244.3.160.239 TCP 64 navisphere-sec > http [ACK] Seq=1320 Ack=163568 Win=32768 Len=0
289073  96.500552 168.117.3.145 -> 244.3.160.239 TCP 64 navisphere-sec > http [ACK] Seq=1320 Ack=166472 Win=32768 Len=0
289100  96.505480 168.117.3.145 -> 244.3.160.239 TCP 64 navisphere-sec > http [ACK] Seq=1320 Ack=169376 Win=32768 Len=0
289122  96.510246 168.117.3.145 -> 244.3.160.239 TCP 64 navisphere-sec > http [ACK] Seq=1320 Ack=172280 Win=32768 Len=0
289135  96.515135 168.117.3.145 -> 244.3.160.239 TCP 64 navisphere-sec > http [ACK] Seq=1320 Ack=175184 Win=32768 Len=0
289142  96.518778 168.117.3.145 -> 244.3.160.239 TCP 64 navisphere-sec > http [ACK] Seq=1320 Ack=178088 Win=32768 Len=0
289152  96.524734 168.117.3.145 -> 244.3.160.239 TCP 64 navisphere-sec > http [ACK] Seq=1320 Ack=180992 Win=32768 Len=0
289164  96.532407 168.117.3.145 -> 244.3.160.239 TCP 64 navisphere-sec > http [ACK] Seq=1320 Ack=183896 Win=32768 Len=0
289174  96.538993 168.117.3.145 -> 244.3.160.239 TCP 64 navisphere-sec > http [ACK] Seq=1320 Ack=186800 Win=32768 Len=0
289190  96.543868 168.117.3.145 -> 244.3.160.239 TCP 64 navisphere-sec > http [ACK] Seq=1320 Ack=189704 Win=32768 Len=0
289199  96.546161 168.117.3.145 -> 244.3.160.239 TCP 64 navisphere-sec > http [ACK] Seq=1320 Ack=191568 Win=32768 Len=0
289221  96.552812 168.117.3.145 -> 244.3.160.239 TCP 64 navisphere-sec > http [ACK] Seq=1320 Ack=194472 Win=32768 Len=0
289233  96.558551 168.117.3.145 -> 244.3.160.239 TCP 64 navisphere-sec > http [ACK] Seq=1320 Ack=197376 Win=32768 Len=0
289249  96.568432 168.117.3.145 -> 244.3.160.239 TCP 64 navisphere-sec > http [ACK] Seq=1320 Ack=200280 Win=32768 Len=0
289257  96.569996 168.117.3.145 -> 244.3.160.239 TCP 64 navisphere-sec > http [ACK] Seq=1320 Ack=203184 Win=32768 Len=0
289261  96.573255 168.117.3.145 -> 244.3.160.239 TCP 64 navisphere-sec > http [ACK] Seq=1320 Ack=206088 Win=32768 Len=0
289264  96.578276 168.117.3.145 -> 244.3.160.239 TCP 64 navisphere-sec > http [ACK] Seq=1320 Ack=208807 Win=32768 Len=0
289266  96.579825 168.117.3.145 -> 244.3.160.239 TCP 64 navisphere-sec > http [FIN, ACK] Seq=1320 Ack=208807 Win=32768 Len=0
289582  96.666415 168.117.3.145 -> 244.3.160.239 TCP 64 navisphere-sec > http [ACK] Seq=1321 Ack=208808 Win=32768 Len=0
481245 158.654864 168.117.3.145 -> 244.3.160.239 TCP 66 6592 > http [SYN] Seq=0 Win=32768 Len=0 MSS=1452 SACK_PERM=1
481419 158.707896 168.117.3.145 -> 244.3.160.239 TCP 64 6592 > http [ACK] Seq=1 Ack=1 Win=32768 Len=0
497076 163.540182 168.117.3.145 -> 244.3.160.239 TCP 64 6592 > http [ACK] Seq=1320 Ack=1743 Win=32768 Len=0
497968 163.601519 168.117.3.145 -> 244.3.160.239 TCP 64 6592 > http [ACK] Seq=1320 Ack=4647 Win=32768 Len=0
497978 163.604189 168.117.3.145 -> 244.3.160.239 TCP 64 6592 > http [ACK] Seq=1320 Ack=7200 Win=32768 Len=0
498790 163.662666 168.117.3.145 -> 244.3.160.239 TCP 64 6592 > http [ACK] Seq=1320 Ack=9552 Win=32768 Len=0
498923 163.670025 168.117.3.145 -> 244.3.160.239 TCP 64 6592 > http [ACK] Seq=1320 Ack=12456 Win=32768 Len=0
499190 163.674895 168.117.3.145 -> 244.3.160.239 TCP 64 6592 > http [ACK] Seq=1320 Ack=13924 Win=32768 Len=0
500061 163.716679 168.117.3.145 -> 244.3.160.239 TCP 64 6592 > http [ACK] Seq=1320 Ack=16284 Win=32768 Len=0
500396 163.724613 168.117.3.145 -> 244.3.160.239 TCP 64 6592 > http [ACK] Seq=1320 Ack=17744 Win=32768 Len=0
500662 163.731069 168.117.3.145 -> 244.3.160.239 TCP 64 6592 > http [ACK] Seq=1320 Ack=20648 Win=32768 Len=0
501004 163.737963 168.117.3.145 -> 244.3.160.239 TCP 64 6592 > http [ACK] Seq=1320 Ack=23552 Win=32768 Len=0
501085 163.740469 168.117.3.145 -> 244.3.160.239 TCP 64 6592 > http [ACK] Seq=1320 Ack=26456 Win=32768 Len=0
501671 163.773772 168.117.3.145 -> 244.3.160.239 TCP 64 6592 > http [ACK] Seq=1320 Ack=29360 Win=32768 Len=0
502226 163.788658 168.117.3.145 -> 244.3.160.239 TCP 64 6592 > http [ACK] Seq=1320 Ack=32264 Win=32768 Len=0
502231 163.789799 168.117.3.145 -> 244.3.160.239 TCP 64 6592 > http [ACK] Seq=1320 Ack=35168 Win=32768 Len=0
502235 163.793636 168.117.3.145 -> 244.3.160.239 TCP 64 6592 > http [ACK] Seq=1320 Ack=37032 Win=32768 Len=0
502257 163.798519 168.117.3.145 -> 244.3.160.239 TCP 64 6592 > http [ACK] Seq=1320 Ack=39936 Win=32768 Len=0
502401 163.803488 168.117.3.145 -> 244.3.160.239 TCP 64 6592 > http [ACK] Seq=1320 Ack=42840 Win=32768 Len=0
502539 163.807960 168.117.3.145 -> 244.3.160.239 TCP 64 6592 > http [ACK] Seq=1320 Ack=45744 Win=32768 Len=0
503554 163.832811 168.117.3.145 -> 244.3.160.239 TCP 64 6592 > http [ACK] Seq=1320 Ack=48648 Win=32768 Len=0
503737 163.844868 168.117.3.145 -> 244.3.160.239 TCP 64 6592 > http [ACK] Seq=1320 Ack=51552 Win=32768 Len=0
503991 163.852428 168.117.3.145 -> 244.3.160.239 TCP 64 6592 > http [ACK] Seq=1320 Ack=54456 Win=32768 Len=0
504184 163.857660 168.117.3.145 -> 244.3.160.239 TCP 64 6592 > http [ACK] Seq=1320 Ack=57360 Win=32768 Len=0
504353 163.863125 168.117.3.145 -> 244.3.160.239 TCP 64 6592 > http [ACK] Seq=1320 Ack=60264 Win=32768 Len=0
504554 163.868248 168.117.3.145 -> 244.3.160.239 TCP 64 6592 > http [ACK] Seq=1320 Ack=63168 Win=32768 Len=0
504794 163.874228 168.117.3.145 -> 244.3.160.239 TCP 64 6592 > http [ACK] Seq=1320 Ack=66072 Win=32768 Len=0
504881 163.876617 168.117.3.145 -> 244.3.160.239 TCP 64 6592 > http [ACK] Seq=1320 Ack=67936 Win=32768 Len=0
504966 163.882367 168.117.3.145 -> 244.3.160.239 TCP 64 6592 > http [ACK] Seq=1320 Ack=70840 Win=32768 Len=0
505083 163.887017 168.117.3.145 -> 244.3.160.239 TCP 64 6592 > http [ACK] Seq=1320 Ack=73744 Win=32768 Len=0
505219 163.893733 168.117.3.145 -> 244.3.160.239 TCP 64 6592 > http [ACK] Seq=1320 Ack=76548 Win=32768 Len=0
505306 163.896424 168.117.3.145 -> 244.3.160.239 TCP 64 6592 > http [ACK] Seq=1320 Ack=79452 Win=32768 Len=0
505436 163.900625 168.117.3.145 -> 244.3.160.239 TCP 64 6592 > http [ACK] Seq=1320 Ack=80920 Win=32768 Len=0
505634 163.908005 168.117.3.145 -> 244.3.160.239 TCP 64 6592 > http [ACK] Seq=1320 Ack=83272 Win=32768 Len=0
505847 163.912910 168.117.3.145 -> 244.3.160.239 TCP 64 6592 > http [ACK] Seq=1320 Ack=84740 Win=32768 Len=0
505957 163.916224 168.117.3.145 -> 244.3.160.239 TCP 64 6592 > http [ACK] Seq=1320 Ack=87644 Win=32768 Len=0
506181 163.921080 168.117.3.145 -> 244.3.160.239 TCP 64 6592 > http [ACK] Seq=1320 Ack=90548 Win=32768 Len=0
506323 163.926286 168.117.3.145 -> 244.3.160.239 TCP 64 6592 > http [ACK] Seq=1320 Ack=93452 Win=32768 Len=0
506432 163.933925 168.117.3.145 -> 244.3.160.239 TCP 64 6592 > http [ACK] Seq=1320 Ack=96356 Win=32768 Len=0
506590 163.936967 168.117.3.145 -> 244.3.160.239 TCP 64 6592 > http [ACK] Seq=1320 Ack=99260 Win=32768 Len=0
506737 163.942222 168.117.3.145 -> 244.3.160.239 TCP 64 6592 > http [ACK] Seq=1320 Ack=102164 Win=32768 Len=0
506943 163.951304 168.117.3.145 -> 244.3.160.239 TCP 64 6592 > http [ACK] Seq=1320 Ack=104028 Win=32768 Len=0
506984 163.953632 168.117.3.145 -> 244.3.160.239 TCP 64 6592 > http [ACK] Seq=1320 Ack=106932 Win=32768 Len=0
507108 163.956713 168.117.3.145 -> 244.3.160.239 TCP 64 6592 > http [ACK] Seq=1320 Ack=109836 Win=32768 Len=0
507394 163.963224 168.117.3.145 -> 244.3.160.239 TCP 64 6592 > http [ACK] Seq=1320 Ack=112740 Win=32768 Len=0
507592 163.968102 168.117.3.145 -> 244.3.160.239 TCP 64 6592 > http [ACK] Seq=1320 Ack=115644 Win=32768 Len=0
507793 163.976057 168.117.3.145 -> 244.3.160.239 TCP 64 6592 > http [ACK] Seq=1320 Ack=118548 Win=32768 Len=0
507877 163.979235 168.117.3.145 -> 244.3.160.239 TCP 64 6592 > http [ACK] Seq=1320 Ack=121452 Win=32768 Len=0
507993 163.984626 168.117.3.145 -> 244.3.160.239 TCP 64 6592 > http [ACK] Seq=1320 Ack=124356 Win=32768 Len=0
508400 164.001632 168.117.3.145 -> 244.3.160.239 TCP 64 6592 > http [ACK] Seq=1320 Ack=127260 Win=32768 Len=0
508460 164.003357 168.117.3.145 -> 244.3.160.239 TCP 64 6592 > http [ACK] Seq=1320 Ack=130164 Win=32768 Len=0
508525 164.004402 168.117.3.145 -> 244.3.160.239 TCP 64 6592 > http [ACK] Seq=1320 Ack=133068 Win=32768 Len=0
508689 164.008242 168.117.3.145 -> 244.3.160.239 TCP 64 6592 > http [ACK] Seq=1320 Ack=135972 Win=32768 Len=0
508886 164.013430 168.117.3.145 -> 244.3.160.239 TCP 64 6592 > http [ACK] Seq=1320 Ack=138876 Win=32768 Len=0
509093 164.018559 168.117.3.145 -> 244.3.160.239 TCP 64 6592 > http [ACK] Seq=1320 Ack=141780 Win=32768 Len=0
509217 164.023117 168.117.3.145 -> 244.3.160.239 TCP 64 6592 > http [ACK] Seq=1320 Ack=144684 Win=32768 Len=0
509382 164.031037 168.117.3.145 -> 244.3.160.239 TCP 64 6592 > http [ACK] Seq=1320 Ack=147588 Win=32768 Len=0
509529 164.034585 168.117.3.145 -> 244.3.160.239 TCP 64 6592 > http [ACK] Seq=1320 Ack=149452 Win=32768 Len=0
509593 164.039313 168.117.3.145 -> 244.3.160.239 TCP 64 6592 > http [ACK] Seq=1320 Ack=152356 Win=32768 Len=0
509701 164.044194 168.117.3.145 -> 244.3.160.239 TCP 64 6592 > http [ACK] Seq=1320 Ack=155260 Win=32768 Len=0
510115 164.055875 168.117.3.145 -> 244.3.160.239 TCP 64 6592 > http [ACK] Seq=1320 Ack=157946 Win=32768 Len=0
510211 164.057293 168.117.3.145 -> 244.3.160.239 TCP 64 6592 > http [FIN, ACK] Seq=1320 Ack=157946 Win=32768 Len=0
511324 164.121603 168.117.3.145 -> 244.3.160.239 TCP 64 6592 > http [ACK] Seq=1321 Ack=157947 Win=32768 Len=0
526209 171.039226 168.117.3.145 -> 244.3.160.239 TCP 66 10570 > http [SYN] Seq=0 Win=32768 Len=0 MSS=1452 SACK_PERM=1
526356 171.091433 168.117.3.145 -> 244.3.160.239 TCP 64 10570 > http [ACK] Seq=1 Ack=1 Win=32768 Len=0
529453 172.020807 168.117.3.145 -> 244.3.160.239 TCP 64 10570 > http [ACK] Seq=1327 Ack=2050 Win=32768 Len=0
529628 172.081523 168.117.3.145 -> 244.3.160.239 TCP 64 10570 > http [ACK] Seq=1327 Ack=4626 Win=32768 Len=0
529665 172.085662 168.117.3.145 -> 244.3.160.239 TCP 64 10570 > http [ACK] Seq=1327 Ack=6083 Win=32768 Len=0
529912 172.134469 168.117.3.145 -> 244.3.160.239 TCP 64 10570 > http [ACK] Seq=1327 Ack=8074 Win=32768 Len=0
529934 172.146650 168.117.3.145 -> 244.3.160.239 TCP 64 10570 > http [ACK] Seq=1327 Ack=10260 Win=32768 Len=0
529939 172.148529 168.117.3.145 -> 244.3.160.239 TCP 64 10570 > http [ACK] Seq=1327 Ack=12966 Win=32768 Len=0
530072 172.191555 168.117.3.145 -> 244.3.160.239 TCP 64 10570 > http [ACK] Seq=1327 Ack=15015 Win=32768 Len=0
530084 172.195240 168.117.3.145 -> 244.3.160.239 TCP 64 10570 > http [ACK] Seq=1327 Ack=16852 Win=32768 Len=0
530137 172.204412 168.117.3.145 -> 244.3.160.239 TCP 64 10570 > http [ACK] Seq=1327 Ack=18901 Win=32768 Len=0
530161 172.208534 168.117.3.145 -> 244.3.160.239 TCP 64 10570 > http [ACK] Seq=1327 Ack=21224 Win=32768 Len=0
530179 172.213172 168.117.3.145 -> 244.3.160.239 TCP 64 10570 > http [ACK] Seq=1327 Ack=23528 Win=32768 Len=0
530219 172.217413 168.117.3.145 -> 244.3.160.239 TCP 64 10570 > http [ACK] Seq=1327 Ack=25585 Win=32768 Len=0
530461 172.250474 168.117.3.145 -> 244.3.160.239 TCP 64 10570 > http [ACK] Seq=1327 Ack=27634 Win=32768 Len=0
530526 172.254774 168.117.3.145 -> 244.3.160.239 TCP 64 10570 > http [ACK] Seq=1327 Ack=29754 Win=32768 Len=0
530535 172.257420 168.117.3.145 -> 244.3.160.239 TCP 64 10570 > http [ACK] Seq=1327 Ack=31803 Win=32768 Len=0
530591 172.261722 168.117.3.145 -> 244.3.160.239 TCP 64 10570 > http [ACK] Seq=1327 Ack=33852 Win=32768 Len=0
530662 172.265978 168.117.3.145 -> 244.3.160.239 TCP 64 10570 > http [ACK] Seq=1327 Ack=35901 Win=32768 Len=0
530720 172.280144 168.117.3.145 -> 244.3.160.239 TCP 66 13142 > http [SYN] Seq=0 Win=32768 Len=0 MSS=1452 SACK_PERM=1
530729 172.282337 168.117.3.145 -> 244.3.160.239 TCP 64 10570 > http [ACK] Seq=1327 Ack=38158 Win=32768 Len=0
530743 172.283719 168.117.3.145 -> 244.3.160.239 TCP 64 10570 > http [ACK] Seq=1327 Ack=40209 Win=32768 Len=0
530791 172.288054 168.117.3.145 -> 244.3.160.239 TCP 64 10570 > http [ACK] Seq=1327 Ack=42258 Win=32768 Len=0
530814 172.290889 168.117.3.145 -> 244.3.160.239 TCP 64 10570 > http [ACK] Seq=1327 Ack=44418 Win=32768 Len=0
530839 172.293071 168.117.3.145 -> 244.3.160.239 TCP 64 10570 > http [ACK] Seq=1327 Ack=46467 Win=32768 Len=0
531067 172.306377 168.117.3.145 -> 244.3.160.239 TCP 64 10570 > http [ACK] Seq=1327 Ack=48543 Win=32768 Len=0
531096 172.311305 168.117.3.145 -> 244.3.160.239 TCP 64 10570 > http [ACK] Seq=1327 Ack=50608 Win=32768 Len=0
531136 172.317220 168.117.3.145 -> 244.3.160.239 TCP 64 10570 > http [ACK] Seq=1327 Ack=52657 Win=32768 Len=0
531166 172.323630 168.117.3.145 -> 244.3.160.239 TCP 64 10570 > http [ACK] Seq=1327 Ack=54706 Win=32768 Len=0
531176 172.325065 168.117.3.145 -> 244.3.160.239 TCP 64 10570 > http [ACK] Seq=1327 Ack=56904 Win=32768 Len=0
531234 172.332073 168.117.3.145 -> 244.3.160.239 TCP 64 10570 > http [ACK] Seq=1327 Ack=58953 Win=32768 Len=0
531243 172.333203 168.117.3.145 -> 244.3.160.239 TCP 64 10570 > http [ACK] Seq=1327 Ack=61117 Win=32768 Len=0
531287 172.338169 168.117.3.145 -> 244.3.160.239 TCP 64 10570 > http [ACK] Seq=1327 Ack=63339 Win=32768 Len=0
531297 172.341572 168.117.3.145 -> 244.3.160.239 TCP 64 13142 > http [ACK] Seq=1 Ack=1 Win=32768 Len=0
531353 172.364218 168.117.3.145 -> 244.3.160.239 TCP 64 10570 > http [ACK] Seq=1327 Ack=65397 Win=32768 Len=0
531357 172.365191 168.117.3.145 -> 244.3.160.239 TCP 64 10570 > http [ACK] Seq=1327 Ack=67446 Win=32768 Len=0
531363 172.366513 168.117.3.145 -> 244.3.160.239 TCP 64 10570 > http [ACK] Seq=1327 Ack=69679 Win=32768 Len=0
531369 172.367409 168.117.3.145 -> 244.3.160.239 TCP 64 10570 > http [ACK] Seq=1327 Ack=71741 Win=32768 Len=0
531372 172.368786 168.117.3.145 -> 244.3.160.239 TCP 64 10570 > http [ACK] Seq=1327 Ack=73885 Win=32768 Len=0
531387 172.372429 168.117.3.145 -> 244.3.160.239 TCP 64 10570 > http [ACK] Seq=1327 Ack=75934 Win=32768 Len=0
531395 172.374318 168.117.3.145 -> 244.3.160.239 TCP 64 10570 > http [ACK] Seq=1327 Ack=78135 Win=32768 Len=0
531409 172.381907 168.117.3.145 -> 244.3.160.239 TCP 64 10570 > http [ACK] Seq=1327 Ack=80184 Win=32768 Len=0
531418 172.383929 168.117.3.145 -> 244.3.160.239 TCP 64 10570 > http [ACK] Seq=1327 Ack=82293 Win=32768 Len=0
531425 172.385152 168.117.3.145 -> 244.3.160.239 TCP 64 10570 > http [ACK] Seq=1327 Ack=84342 Win=32768 Len=0
531440 172.390381 168.117.3.145 -> 244.3.160.239 TCP 64 10570 > http [ACK] Seq=1327 Ack=86411 Win=32768 Len=0
531455 172.398097 168.117.3.145 -> 244.3.160.239 TCP 64 10570 > http [ACK] Seq=1327 Ack=88477 Win=32768 Len=0
531464 172.400208 168.117.3.145 -> 244.3.160.239 TCP 64 10570 > http [ACK] Seq=1327 Ack=90526 Win=32768 Len=0
531472 172.401256 168.117.3.145 -> 244.3.160.239 TCP 64 10570 > http [ACK] Seq=1327 Ack=92584 Win=32768 Len=0
531477 172.403061 168.117.3.145 -> 244.3.160.239 TCP 64 10570 > http [ACK] Seq=1327 Ack=95333 Win=32768 Len=0
531565 172.420154 168.117.3.145 -> 244.3.160.239 TCP 64 10570 > http [ACK] Seq=1327 Ack=97450 Win=32768 Len=0
531588 172.424597 168.117.3.145 -> 244.3.160.239 TCP 64 10570 > http [ACK] Seq=1327 Ack=99542 Win=32768 Len=0
531633 172.429066 168.117.3.145 -> 244.3.160.239 TCP 64 10570 > http [ACK] Seq=1327 Ack=101591 Win=32768 Len=0
531685 172.435470 168.117.3.145 -> 244.3.160.239 TCP 64 10570 > http [ACK] Seq=1327 Ack=103640 Win=32768 Len=0
531738 172.443307 168.117.3.145 -> 244.3.160.239 TCP 64 10570 > http [ACK] Seq=1327 Ack=105758 Win=32768 Len=0
531741 172.444818 168.117.3.145 -> 244.3.160.239 TCP 64 10570 > http [ACK] Seq=1327 Ack=107912 Win=32768 Len=0
531792 172.453911 168.117.3.145 -> 244.3.160.239 TCP 64 10570 > http [ACK] Seq=1327 Ack=109961 Win=32768 Len=0
531795 172.455228 168.117.3.145 -> 244.3.160.239 TCP 64 10570 > http [ACK] Seq=1327 Ack=112012 Win=32768 Len=0
531798 172.456507 168.117.3.145 -> 244.3.160.239 TCP 64 10570 > http [ACK] Seq=1327 Ack=114167 Win=32768 Len=0
531835 172.464973 168.117.3.145 -> 244.3.160.239 TCP 64 10570 > http [ACK] Seq=1327 Ack=116437 Win=32768 Len=0
531868 172.467073 168.117.3.145 -> 244.3.160.239 TCP 64 10570 > http [ACK] Seq=1327 Ack=118486 Win=32768 Len=0
531880 172.468052 168.117.3.145 -> 244.3.160.239 TCP 64 10570 > http [ACK] Seq=1327 Ack=120535 Win=32768 Len=0
531900 172.475574 168.117.3.145 -> 244.3.160.239 TCP 64 10570 > http [ACK] Seq=1327 Ack=122697 Win=32768 Len=0
531903 172.476479 168.117.3.145 -> 244.3.160.239 TCP 64 10570 > http [ACK] Seq=1327 Ack=125083 Win=32768 Len=0
531916 172.480809 168.117.3.145 -> 244.3.160.239 TCP 64 10570 > http [ACK] Seq=1327 Ack=127132 Win=32768 Len=0
531921 172.482922 168.117.3.145 -> 244.3.160.239 TCP 64 10570 > http [ACK] Seq=1327 Ack=129186 Win=32768 Len=0
531924 172.487283 168.117.3.145 -> 244.3.160.239 TCP 64 10570 > http [ACK] Seq=1327 Ack=131235 Win=32768 Len=0
531932 172.491803 168.117.3.145 -> 244.3.160.239 TCP 64 10570 > http [ACK] Seq=1327 Ack=133568 Win=32768 Len=0
531936 172.494604 168.117.3.145 -> 244.3.160.239 TCP 64 10570 > http [ACK] Seq=1327 Ack=135617 Win=32768 Len=0
531958 172.501793 168.117.3.145 -> 244.3.160.239 TCP 64 10570 > http [ACK] Seq=1327 Ack=137666 Win=32768 Len=0
