465617 153.174854 177.75.152.197 -> 41.177.26.91 TCP 66 32451 > http [SYN] Seq=0 Win=65535 Len=0 MSS=1460 SACK_PERM=1
465802 153.249891 177.75.152.197 -> 41.177.26.91 TCP 64 32451 > http [ACK] Seq=1 Ack=1 Win=1460 Len=0
466128 153.400321 177.75.152.197 -> 41.177.26.91 TCP 64 32451 > http [ACK] Seq=591 Ack=4381 Win=65535 Len=0
466232 153.476929 177.75.152.197 -> 41.177.26.91 TCP 64 32451 > http [ACK] Seq=591 Ack=7301 Win=65535 Len=0
466233 153.476934 177.75.152.197 -> 41.177.26.91 TCP 64 32451 > http [ACK] Seq=591 Ack=10221 Win=65535 Len=0
466413 153.551932 177.75.152.197 -> 41.177.26.91 TCP 64 32451 > http [ACK] Seq=591 Ack=13141 Win=65535 Len=0
466414 153.552075 177.75.152.197 -> 41.177.26.91 TCP 64 32451 > http [ACK] Seq=591 Ack=17521 Win=65535 Len=0
466603 153.627485 177.75.152.197 -> 41.177.26.91 TCP 64 32451 > http [ACK] Seq=591 Ack=21901 Win=65535 Len=0
466604 153.627489 177.75.152.197 -> 41.177.26.91 TCP 64 32451 > http [ACK] Seq=591 Ack=26341 Win=65535 Len=0
466678 153.702942 177.75.152.197 -> 41.177.26.91 TCP 64 32451 > http [ACK] Seq=591 Ack=30721 Win=65535 Len=0
466679 153.702947 177.75.152.197 -> 41.177.26.91 TCP 64 32451 > http [ACK] Seq=591 Ack=33641 Win=65535 Len=0
466680 153.702952 177.75.152.197 -> 41.177.26.91 TCP 64 32451 > http [ACK] Seq=591 Ack=36561 Win=65535 Len=0
466684 153.703182 177.75.152.197 -> 41.177.26.91 TCP 64 32451 > http [ACK] Seq=591 Ack=40941 Win=65535 Len=0
466847 153.778749 177.75.152.197 -> 41.177.26.91 TCP 64 32451 > http [ACK] Seq=591 Ack=43861 Win=65535 Len=0
466851 153.779623 177.75.152.197 -> 41.177.26.91 TCP 64 32451 > http [ACK] Seq=591 Ack=48241 Win=65535 Len=0
466856 153.780345 177.75.152.197 -> 41.177.26.91 TCP 64 32451 > http [ACK] Seq=591 Ack=52377 Win=65535 Len=0
466857 153.780371 177.75.152.197 -> 41.177.26.91 TCP 64 32451 > http [ACK] Seq=591 Ack=56757 Win=65535 Len=0
466861 153.780556 177.75.152.197 -> 41.177.26.91 TCP 64 32451 > http [ACK] Seq=591 Ack=59677 Win=65535 Len=0
467028 153.854169 177.75.152.197 -> 41.177.26.91 TCP 64 32451 > http [ACK] Seq=591 Ack=64057 Win=65535 Len=0
467029 153.854174 177.75.152.197 -> 41.177.26.91 TCP 64 32451 > http [ACK] Seq=591 Ack=66977 Win=65535 Len=0
467030 153.854311 177.75.152.197 -> 41.177.26.91 TCP 64 32451 > http [ACK] Seq=591 Ack=69897 Win=65535 Len=0
467041 153.855126 177.75.152.197 -> 41.177.26.91 TCP 64 32451 > http [ACK] Seq=591 Ack=74033 Win=65535 Len=0
467046 153.855677 177.75.152.197 -> 41.177.26.91 TCP 64 32451 > http [ACK] Seq=591 Ack=78413 Win=65535 Len=0
467048 153.855847 177.75.152.197 -> 41.177.26.91 TCP 64 32451 > http [ACK] Seq=591 Ack=81333 Win=65535 Len=0
467055 153.856572 177.75.152.197 -> 41.177.26.91 TCP 64 32451 > http [ACK] Seq=591 Ack=85713 Win=65535 Len=0
467141 153.929256 177.75.152.197 -> 41.177.26.91 TCP 64 32451 > http [ACK] Seq=591 Ack=90093 Win=65535 Len=0
467146 153.929732 177.75.152.197 -> 41.177.26.91 TCP 64 32451 > http [ACK] Seq=591 Ack=93013 Win=65535 Len=0
467150 153.929942 177.75.152.197 -> 41.177.26.91 TCP 64 32451 > http [ACK] Seq=591 Ack=97393 Win=65535 Len=0
467155 153.930803 177.75.152.197 -> 41.177.26.91 TCP 64 32451 > http [ACK] Seq=591 Ack=101529 Win=65535 Len=0
467158 153.930994 177.75.152.197 -> 41.177.26.91 TCP 64 32451 > http [ACK] Seq=591 Ack=105909 Win=65535 Len=0
467161 153.931084 177.75.152.197 -> 41.177.26.91 TCP 64 32451 > http [ACK] Seq=591 Ack=108829 Win=65535 Len=0
467169 153.931351 177.75.152.197 -> 41.177.26.91 TCP 64 32451 > http [ACK] Seq=591 Ack=113209 Win=65535 Len=0
467170 153.931356 177.75.152.197 -> 41.177.26.91 TCP 64 32451 > http [ACK] Seq=591 Ack=117589 Win=65535 Len=0
467171 153.931359 177.75.152.197 -> 41.177.26.91 TCP 64 32451 > http [ACK] Seq=591 Ack=120509 Win=65535 Len=0
467185 153.933090 177.75.152.197 -> 41.177.26.91 TCP 64 32451 > http [ACK] Seq=591 Ack=123185 Win=65535 Len=0
467350 154.003944 177.75.152.197 -> 41.177.26.91 TCP 64 32451 > http [ACK] Seq=591 Ack=126105 Win=65535 Len=0
467351 154.004073 177.75.152.197 -> 41.177.26.91 TCP 64 32451 > http [ACK] Seq=591 Ack=129025 Win=65535 Len=0
467358 154.004314 177.75.152.197 -> 41.177.26.91 TCP 64 32451 > http [ACK] Seq=591 Ack=131945 Win=65535 Len=0
467362 154.004812 177.75.152.197 -> 41.177.26.91 TCP 64 32451 > http [ACK] Seq=591 Ack=134865 Win=65535 Len=0
467366 154.005038 177.75.152.197 -> 41.177.26.91 TCP 64 32451 > http [ACK] Seq=591 Ack=139245 Win=65535 Len=0
467371 154.006044 177.75.152.197 -> 41.177.26.91 TCP 64 32451 > http [ACK] Seq=591 Ack=142165 Win=65535 Len=0
467375 154.006844 177.75.152.197 -> 41.177.26.91 TCP 64 32451 > http [ACK] Seq=591 Ack=146545 Win=65535 Len=0
467376 154.006849 177.75.152.197 -> 41.177.26.91 TCP 64 32451 > http [ACK] Seq=591 Ack=150681 Win=65535 Len=0
467377 154.006853 177.75.152.197 -> 41.177.26.91 TCP 64 32451 > http [ACK] Seq=591 Ack=153601 Win=65535 Len=0
467389 154.007588 177.75.152.197 -> 41.177.26.91 TCP 64 32451 > http [ACK] Seq=591 Ack=157981 Win=65535 Len=0
467390 154.007593 177.75.152.197 -> 41.177.26.91 TCP 64 32451 > http [ACK] Seq=591 Ack=162361 Win=65535 Len=0
467397 154.008457 177.75.152.197 -> 41.177.26.91 TCP 64 32451 > http [ACK] Seq=591 Ack=165281 Win=65535 Len=0
467398 154.008462 177.75.152.197 -> 41.177.26.91 TCP 64 32451 > http [ACK] Seq=591 Ack=169661 Win=65535 Len=0
467399 154.008466 177.75.152.197 -> 41.177.26.91 TCP 64 32451 > http [ACK] Seq=591 Ack=173797 Win=65535 Len=0
467520 154.078760 177.75.152.197 -> 41.177.26.91 TCP 64 32451 > http [ACK] Seq=591 Ack=178177 Win=65535 Len=0
467524 154.080174 177.75.152.197 -> 41.177.26.91 TCP 64 32451 > http [ACK] Seq=591 Ack=182557 Win=65535 Len=0
467525 154.080179 177.75.152.197 -> 41.177.26.91 TCP 64 32451 > http [ACK] Seq=591 Ack=185477 Win=65535 Len=0
467526 154.080183 177.75.152.197 -> 41.177.26.91 TCP 64 32451 > http [ACK] Seq=591 Ack=188397 Win=65535 Len=0
467534 154.080574 177.75.152.197 -> 41.177.26.91 TCP 64 32451 > http [ACK] Seq=591 Ack=192777 Win=65535 Len=0
467535 154.080578 177.75.152.197 -> 41.177.26.91 TCP 64 32451 > http [ACK] Seq=591 Ack=195697 Win=65535 Len=0
467541 154.081351 177.75.152.197 -> 41.177.26.91 TCP 64 32451 > http [ACK] Seq=591 Ack=198373 Win=65535 Len=0
467542 154.081356 177.75.152.197 -> 41.177.26.91 TCP 64 32451 > http [ACK] Seq=591 Ack=201293 Win=65535 Len=0
467550 154.082485 177.75.152.197 -> 41.177.26.91 TCP 64 32451 > http [ACK] Seq=591 Ack=205673 Win=65535 Len=0
467557 154.083269 177.75.152.197 -> 41.177.26.91 TCP 64 32451 > http [ACK] Seq=591 Ack=210053 Win=65535 Len=0
467558 154.083274 177.75.152.197 -> 41.177.26.91 TCP 64 32451 > http [ACK] Seq=591 Ack=212973 Win=65535 Len=0
467561 154.083467 177.75.152.197 -> 41.177.26.91 TCP 64 32451 > http [ACK] Seq=591 Ack=215893 Win=65535 Len=0
467563 154.083624 177.75.152.197 -> 41.177.26.91 TCP 64 32451 > http [ACK] Seq=591 Ack=218813 Win=65535 Len=0
467564 154.084782 177.75.152.197 -> 41.177.26.91 TCP 64 32451 > http [ACK] Seq=591 Ack=221489 Win=65535 Len=0
467565 154.085146 177.75.152.197 -> 41.177.26.91 TCP 64 32451 > http [ACK] Seq=591 Ack=225869 Win=65535 Len=0
467579 154.086454 177.75.152.197 -> 41.177.26.91 TCP 64 32451 > http [ACK] Seq=591 Ack=230249 Win=65535 Len=0
467580 154.086459 177.75.152.197 -> 41.177.26.91 TCP 64 32451 > http [ACK] Seq=591 Ack=234629 Win=65535 Len=0
467581 154.087035 177.75.152.197 -> 41.177.26.91 TCP 64 32451 > http [ACK] Seq=591 Ack=239009 Win=65535 Len=0
467711 154.155198 177.75.152.197 -> 41.177.26.91 TCP 64 32451 > http [ACK] Seq=591 Ack=241929 Win=65535 Len=0
467714 154.156917 177.75.152.197 -> 41.177.26.91 TCP 64 32451 > http [ACK] Seq=591 Ack=246065 Win=65535 Len=0
467715 154.156921 177.75.152.197 -> 41.177.26.91 TCP 64 32451 > http [ACK] Seq=591 Ack=250445 Win=65535 Len=0
467716 154.157488 177.75.152.197 -> 41.177.26.91 TCP 64 32451 > http [ACK] Seq=591 Ack=253365 Win=65535 Len=0
467717 154.158563 177.75.152.197 -> 41.177.26.91 TCP 64 32451 > http [ACK] Seq=591 Ack=256285 Win=65535 Len=0
467718 154.158576 177.75.152.197 -> 41.177.26.91 TCP 64 32451 > http [ACK] Seq=591 Ack=260665 Win=65535 Len=0
467719 154.159978 177.75.152.197 -> 41.177.26.91 TCP 64 32451 > http [ACK] Seq=591 Ack=263585 Win=65535 Len=0
467720 154.160518 177.75.152.197 -> 41.177.26.91 TCP 64 32451 > http [ACK] Seq=591 Ack=266505 Win=65535 Len=0
467723 154.162700 177.75.152.197 -> 41.177.26.91 TCP 70 32451 > http [ACK] Seq=591 Ack=267965 Win=65535 Len=0 SLE=269425 SRE=270641
467725 154.163314 177.75.152.197 -> 41.177.26.91 TCP 78 [TCP Dup ACK 467723#1] 32451 > http [ACK] Seq=591 Ack=267965 Win=65535 Len=0 SLE=272101 SRE=272452 SLE=269425 SRE=270641
478515 157.671286 177.75.152.197 -> 41.177.26.91 TCP 70 32451 > http [ACK] Seq=591 Ack=270641 Win=65535 Len=0 SLE=272101 SRE=272452
478982 157.748582 177.75.152.197 -> 41.177.26.91 TCP 64 32451 > http [ACK] Seq=591 Ack=272452 Win=65535 Len=0
