1359   0.369043 18.122.15.113 -> 41.177.98.176 TCP 64 54871 > http [ACK] Seq=1 Ack=1 Win=4356 Len=0
35459  14.821042 18.122.15.113 -> 41.177.98.176 TCP 64 54871 > http [ACK] Seq=1 Ack=2 Win=4356 Len=0
64853  26.747406 18.122.15.113 -> 41.177.98.176 TCP 64 54871 > http [RST, ACK] Seq=1 Ack=2 Win=0 Len=0
119645  42.860254 18.122.15.113 -> 41.177.98.176 TCP 64 54871 > http [RST, ACK] Seq=1 Ack=2 Win=0 Len=0
962263 319.863215 18.122.15.113 -> 41.177.98.176 TCP 70 54953 > http [SYN] Seq=0 Win=8192 Len=0 MSS=1452 WS=4 SACK_PERM=1
962525 319.912556 18.122.15.113 -> 41.177.98.176 TCP 64 54953 > http [ACK] Seq=1 Ack=1 Win=17424 Len=0
976343 325.194879 18.122.15.113 -> 41.177.98.176 TCP 70 54954 > http [SYN] Seq=0 Win=8192 Len=0 MSS=1452 WS=4 SACK_PERM=1
976345 325.195797 18.122.15.113 -> 41.177.98.176 TCP 64 54953 > http [RST, ACK] Seq=1023 Ack=1 Win=0 Len=0
976418 325.245595 18.122.15.113 -> 41.177.98.176 TCP 64 54954 > http [ACK] Seq=1 Ack=1 Win=17424 Len=0
1014478 341.173095 18.122.15.113 -> 41.177.98.176 TCP 64 54953 > http [RST, ACK] Seq=1023 Ack=1 Win=0 Len=0
