813641 265.378090 18.224.192.231 -> 41.177.26.46 TCP 66 simplement-tie > http [SYN] Seq=0 Win=65535 Len=0 MSS=1440 SACK_PERM=1
816944 266.479735 18.224.192.231 -> 41.177.26.46 TCP 64 simplement-tie > http [ACK] Seq=1 Ack=1 Win=65535 Len=0
820240 267.638208 18.224.192.231 -> 41.177.26.46 TCP 64 simplement-tie > http [ACK] Seq=561 Ack=274 Win=65262 Len=0
820524 267.758117 18.224.192.231 -> 41.177.26.46 TCP 66 cnrp > http [SYN] Seq=0 Win=65535 Len=0 MSS=1440 SACK_PERM=1
821384 268.085994 18.224.192.231 -> 41.177.26.46 TCP 64 simplement-tie > http [ACK] Seq=561 Ack=1714 Win=65535 Len=0
823135 268.805557 18.224.192.231 -> 41.177.26.46 TCP 64 simplement-tie > http [ACK] Seq=561 Ack=3154 Win=65535 Len=0
826313 269.671164 18.224.192.231 -> 41.177.26.46 TCP 64 simplement-tie > http [ACK] Seq=561 Ack=4594 Win=65535 Len=0
828624 270.445522 18.224.192.231 -> 41.177.26.46 TCP 64 simplement-tie > http [ACK] Seq=561 Ack=6034 Win=65535 Len=0
829214 270.637223 18.224.192.231 -> 41.177.26.46 TCP 66 [TCP Retransmission] cnrp > http [SYN] Seq=0 Win=65535 Len=0 MSS=1440 SACK_PERM=1
830246 271.241554 18.224.192.231 -> 41.177.26.46 TCP 70 [TCP Dup ACK 828624#1] simplement-tie > http [ACK] Seq=561 Ack=6034 Win=65535 Len=0 SLE=7474 SRE=8466
832020 271.961197 18.224.192.231 -> 41.177.26.46 TCP 64 cnrp > http [ACK] Seq=1 Ack=1 Win=65535 Len=0
832469 272.209917 18.224.192.231 -> 41.177.26.46 TCP 64 simplement-tie > http [ACK] Seq=561 Ack=8466 Win=65535 Len=0
835453 273.467328 18.224.192.231 -> 41.177.26.46 TCP 64 simplement-tie > http [ACK] Seq=561 Ack=9906 Win=65535 Len=0
836078 273.720755 18.224.192.231 -> 41.177.26.46 TCP 64 cnrp > http [ACK] Seq=398 Ack=274 Win=65262 Len=0
837412 274.357072 18.224.192.231 -> 41.177.26.46 TCP 64 simplement-tie > http [ACK] Seq=561 Ack=11346 Win=65535 Len=0
838384 274.717931 18.224.192.231 -> 41.177.26.46 TCP 64 cnrp > http [ACK] Seq=398 Ack=1714 Win=65535 Len=0
839448 275.194473 18.224.192.231 -> 41.177.26.46 TCP 70 [TCP Dup ACK 837412#1] simplement-tie > http [ACK] Seq=561 Ack=11346 Win=65535 Len=0 SLE=12786 SRE=14226
840575 275.662814 18.224.192.231 -> 41.177.26.46 TCP 64 cnrp > http [ACK] Seq=398 Ack=3154 Win=65535 Len=0
841481 276.163024 18.224.192.231 -> 41.177.26.46 TCP 64 simplement-tie > http [ACK] Seq=561 Ack=14226 Win=65535 Len=0
842265 276.790032 18.224.192.231 -> 41.177.26.46 TCP 64 cnrp > http [ACK] Seq=398 Ack=4594 Win=65535 Len=0
843526 277.306788 18.224.192.231 -> 41.177.26.46 TCP 64 simplement-tie > http [ACK] Seq=561 Ack=15666 Win=65535 Len=0
843854 277.502758 18.224.192.231 -> 41.177.26.46 TCP 64 cnrp > http [ACK] Seq=398 Ack=6034 Win=65535 Len=0
845246 278.323838 18.224.192.231 -> 41.177.26.46 TCP 64 simplement-tie > http [ACK] Seq=561 Ack=16658 Win=64543 Len=0
845483 278.462032 18.224.192.231 -> 41.177.26.46 TCP 64 cnrp > http [ACK] Seq=398 Ack=7474 Win=65535 Len=0
846721 279.256474 18.224.192.231 -> 41.177.26.46 TCP 70 [TCP Dup ACK 845246#1] simplement-tie > http [ACK] Seq=561 Ack=16658 Win=64543 Len=0 SLE=18098 SRE=19538
847402 279.676191 18.224.192.231 -> 41.177.26.46 TCP 64 cnrp > http [ACK] Seq=398 Ack=8914 Win=65535 Len=0
848188 280.225894 18.224.192.231 -> 41.177.26.46 TCP 70 [TCP Dup ACK 845246#2] simplement-tie > http [ACK] Seq=561 Ack=16658 Win=64543 Len=0 SLE=18098 SRE=20978
848310 280.307929 18.224.192.231 -> 41.177.26.46 TCP 70 [TCP Dup ACK 847402#1] cnrp > http [ACK] Seq=398 Ack=8914 Win=65535 Len=0 SLE=10354 SRE=10685
849338 280.553592 18.224.192.231 -> 41.177.26.46 TCP 64 cnrp > http [ACK] Seq=398 Ack=10685 Win=65535 Len=0
851253 281.291436 18.224.192.231 -> 41.177.26.46 TCP 70 [TCP Dup ACK 845246#3] simplement-tie > http [ACK] Seq=561 Ack=16658 Win=64543 Len=0 SLE=18098 SRE=22418
853014 281.933806 18.224.192.231 -> 41.177.26.46 TCP 64 cnrp > http [ACK] Seq=1067 Ack=12125 Win=65535 Len=0
853885 282.247574 18.224.192.231 -> 41.177.26.46 TCP 70 [TCP Dup ACK 845246#4] simplement-tie > http [ACK] Seq=561 Ack=16658 Win=64543 Len=0 SLE=18098 SRE=23858
854953 282.600685 18.224.192.231 -> 41.177.26.46 TCP 70 [TCP Dup ACK 853014#1] cnrp > http [ACK] Seq=1067 Ack=12125 Win=65535 Len=0 SLE=13565 SRE=14557
856683 283.116241 18.224.192.231 -> 41.177.26.46 TCP 70 [TCP Dup ACK 845246#5] simplement-tie > http [ACK] Seq=561 Ack=16658 Win=64543 Len=0 SLE=18098 SRE=24824
858522 283.656546 18.224.192.231 -> 41.177.26.46 TCP 64 simplement-tie > http [ACK] Seq=561 Ack=24824 Win=65535 Len=0
858829 283.708891 18.224.192.231 -> 41.177.26.46 TCP 64 cnrp > http [ACK] Seq=1067 Ack=14557 Win=65535 Len=0
862214 284.466553 18.224.192.231 -> 41.177.26.46 TCP 64 simplement-tie > http [ACK] Seq=1230 Ack=24825 Win=65535 Len=0
862220 284.469796 18.224.192.231 -> 41.177.26.46 TCP 64 simplement-tie > http [FIN, ACK] Seq=1230 Ack=24825 Win=65535 Len=0
862234 284.473242 18.224.192.231 -> 41.177.26.46 TCP 66 dicom-iscl > http [SYN] Seq=0 Win=65535 Len=0 MSS=1440 SACK_PERM=1
864173 285.501492 18.224.192.231 -> 41.177.26.46 TCP 64 dicom-iscl > http [ACK] Seq=1 Ack=1 Win=65535 Len=0
869855 287.592341 18.224.192.231 -> 41.177.26.46 TCP 64 dicom-iscl > http [ACK] Seq=1339 Ack=2497 Win=65535 Len=0
873082 288.790853 18.224.192.231 -> 41.177.26.46 TCP 64 dicom-iscl > http [ACK] Seq=1339 Ack=3937 Win=65535 Len=0
876718 290.470134 18.224.192.231 -> 41.177.26.46 TCP 64 dicom-iscl > http [ACK] Seq=2008 Ack=6793 Win=65535 Len=0
877783 291.160760 18.224.192.231 -> 41.177.26.46 TCP 64 [TCP Dup ACK 876947#1] cnrp > http [ACK] Seq=3745 Ack=16824 Win=64893 Len=0
878315 291.542353 18.224.192.231 -> 41.177.26.46 TCP 64 dicom-iscl > http [ACK] Seq=2008 Ack=7059 Win=65269 Len=0
878561 291.822842 18.224.192.231 -> 41.177.26.46 TCP 64 cnrp > http [ACK] Seq=3745 Ack=18264 Win=65535 Len=0
879925 292.713523 18.224.192.231 -> 41.177.26.46 TCP 70 cnrp > http [ACK] Seq=3745 Ack=19704 Win=65535 Len=0 SLE=21144 SRE=21546
882352 293.538451 18.224.192.231 -> 41.177.26.46 TCP 64 cnrp > http [ACK] Seq=3745 Ack=21546 Win=65535 Len=0
889898 294.697758 18.224.192.231 -> 41.177.26.46 TCP 64 dicom-iscl > http [ACK] Seq=2621 Ack=8499 Win=65535 Len=0
892259 295.304197 18.224.192.231 -> 41.177.26.46 TCP 70 [TCP Dup ACK 889898#1] dicom-iscl > http [ACK] Seq=2621 Ack=8499 Win=65535 Len=0 SLE=9939 SRE=10970
892788 295.506952 18.224.192.231 -> 41.177.26.46 TCP 64 dicom-iscl > http [ACK] Seq=2621 Ack=10970 Win=65535 Len=0
922690 306.416147 18.224.192.231 -> 41.177.26.46 TCP 64 cnrp > http [ACK] Seq=3745 Ack=21547 Win=65535 Len=0
928686 309.413543 18.224.192.231 -> 41.177.26.46 TCP 64 dicom-iscl > http [ACK] Seq=2621 Ack=10971 Win=65535 Len=0
