552077 177.576344 18.211.185.46 -> 244.3.210.197 TCP 70 50877 > http [SYN] Seq=0 Win=8192 Len=0 MSS=1460 WS=4 SACK_PERM=1
552248 177.632088 18.211.185.46 -> 244.3.210.197 TCP 64 50877 > http [ACK] Seq=1 Ack=1 Win=17520 Len=0
553146 177.999587 18.211.185.46 -> 244.3.210.197 TCP 64 50877 > http [ACK] Seq=429 Ack=2921 Win=17520 Len=0
553318 178.049862 18.211.185.46 -> 244.3.210.197 TCP 64 50877 > http [ACK] Seq=429 Ack=5841 Win=17520 Len=0
553349 178.076588 18.211.185.46 -> 244.3.210.197 TCP 70 50878 > http [SYN] Seq=0 Win=8192 Len=0 MSS=1460 WS=4 SACK_PERM=1
553482 178.107367 18.211.185.46 -> 244.3.210.197 TCP 64 50877 > http [ACK] Seq=429 Ack=8761 Win=17520 Len=0
553511 178.112233 18.211.185.46 -> 244.3.210.197 TCP 64 50877 > http [ACK] Seq=429 Ack=11681 Win=17520 Len=0
553552 178.125692 18.211.185.46 -> 244.3.210.197 TCP 64 50878 > http [ACK] Seq=1 Ack=1 Win=17520 Len=0
553581 178.157701 18.211.185.46 -> 244.3.210.197 TCP 64 50877 > http [ACK] Seq=429 Ack=14601 Win=17520 Len=0
553707 178.201442 18.211.185.46 -> 244.3.210.197 TCP 64 50878 > http [ACK] Seq=488 Ack=2921 Win=17520 Len=0
553860 178.256261 18.211.185.46 -> 244.3.210.197 TCP 64 50878 > http [ACK] Seq=488 Ack=5841 Win=17520 Len=0
553957 178.311331 18.211.185.46 -> 244.3.210.197 TCP 64 50878 > http [ACK] Seq=488 Ack=8761 Win=17520 Len=0
553979 178.316610 18.211.185.46 -> 244.3.210.197 TCP 64 50878 > http [ACK] Seq=488 Ack=10381 Win=17520 Len=0
554141 178.376343 18.211.185.46 -> 244.3.210.197 TCP 64 50877 > http [ACK] Seq=906 Ack=18340 Win=17520 Len=0
554159 178.381813 18.211.185.46 -> 244.3.210.197 TCP 64 50877 > http [ACK] Seq=906 Ack=21260 Win=17520 Len=0
554160 178.381818 18.211.185.46 -> 244.3.210.197 TCP 64 50877 > http [ACK] Seq=906 Ack=24180 Win=17520 Len=0
554161 178.381822 18.211.185.46 -> 244.3.210.197 TCP 64 50877 > http [ACK] Seq=906 Ack=27100 Win=17520 Len=0
554358 178.441392 18.211.185.46 -> 244.3.210.197 TCP 64 50877 > http [ACK] Seq=906 Ack=30020 Win=17520 Len=0
554374 178.445979 18.211.185.46 -> 244.3.210.197 TCP 64 50877 > http [ACK] Seq=906 Ack=32940 Win=17520 Len=0
554375 178.445984 18.211.185.46 -> 244.3.210.197 TCP 64 50877 > http [ACK] Seq=906 Ack=35860 Win=17520 Len=0
554376 178.445988 18.211.185.46 -> 244.3.210.197 TCP 64 50877 > http [ACK] Seq=906 Ack=38780 Win=17520 Len=0
554378 178.446008 18.211.185.46 -> 244.3.210.197 TCP 64 50877 > http [ACK] Seq=906 Ack=41700 Win=17520 Len=0
554393 178.446254 18.211.185.46 -> 244.3.210.197 TCP 64 50877 > http [ACK] Seq=906 Ack=44620 Win=17520 Len=0
554486 178.493750 18.211.185.46 -> 244.3.210.197 TCP 64 50877 > http [ACK] Seq=906 Ack=47540 Win=17520 Len=0
554537 178.515316 18.211.185.46 -> 244.3.210.197 TCP 64 50877 > http [ACK] Seq=906 Ack=49661 Win=17520 Len=0
554669 178.573311 18.211.185.46 -> 244.3.210.197 TCP 64 50878 > http [ACK] Seq=971 Ack=13301 Win=17520 Len=0
554820 178.635303 18.211.185.46 -> 244.3.210.197 TCP 64 50877 > http [ACK] Seq=1392 Ack=52581 Win=17520 Len=0
554951 178.695459 18.211.185.46 -> 244.3.210.197 TCP 64 50878 > http [ACK] Seq=1442 Ack=16665 Win=17520 Len=0
554963 178.700308 18.211.185.46 -> 244.3.210.197 TCP 64 50878 > http [ACK] Seq=1442 Ack=19585 Win=17520 Len=0
554964 178.700313 18.211.185.46 -> 244.3.210.197 TCP 64 50878 > http [ACK] Seq=1442 Ack=22505 Win=17520 Len=0
554993 178.704998 18.211.185.46 -> 244.3.210.197 TCP 64 50878 > http [ACK] Seq=1442 Ack=25425 Win=17520 Len=0
555130 178.748199 18.211.185.46 -> 244.3.210.197 TCP 64 50878 > http [ACK] Seq=1442 Ack=28345 Win=17520 Len=0
555138 178.752962 18.211.185.46 -> 244.3.210.197 TCP 64 50878 > http [ACK] Seq=1442 Ack=31265 Win=17520 Len=0
555147 178.757943 18.211.185.46 -> 244.3.210.197 TCP 64 50878 > http [ACK] Seq=1442 Ack=34185 Win=17520 Len=0
555148 178.757947 18.211.185.46 -> 244.3.210.197 TCP 64 50878 > http [ACK] Seq=1442 Ack=37105 Win=17520 Len=0
555149 178.757951 18.211.185.46 -> 244.3.210.197 TCP 64 50878 > http [ACK] Seq=1442 Ack=40025 Win=17520 Len=0
555171 178.762614 18.211.185.46 -> 244.3.210.197 TCP 64 50878 > http [ACK] Seq=1442 Ack=42945 Win=17520 Len=0
555218 178.798576 18.211.185.46 -> 244.3.210.197 TCP 64 50878 > http [ACK] Seq=1442 Ack=45865 Win=70080 Len=0
555235 178.805734 18.211.185.46 -> 244.3.210.197 TCP 64 50878 > http [ACK] Seq=1442 Ack=48785 Win=70080 Len=0
555260 178.810502 18.211.185.46 -> 244.3.210.197 TCP 64 50878 > http [ACK] Seq=1442 Ack=51705 Win=70080 Len=0
555298 178.815319 18.211.185.46 -> 244.3.210.197 TCP 64 50878 > http [ACK] Seq=1442 Ack=54625 Win=70080 Len=0
555313 178.820273 18.211.185.46 -> 244.3.210.197 TCP 64 50878 > http [ACK] Seq=1442 Ack=57545 Win=71540 Len=0
555314 178.820312 18.211.185.46 -> 244.3.210.197 TCP 64 50878 > http [ACK] Seq=1442 Ack=60465 Win=71540 Len=0
555335 178.832466 18.211.185.46 -> 244.3.210.197 TCP 64 50877 > http [ACK] Seq=1392 Ack=52961 Win=17140 Len=0
555359 178.846630 18.211.185.46 -> 244.3.210.197 TCP 64 50878 > http [ACK] Seq=1442 Ack=63385 Win=68620 Len=0
555377 178.856201 18.211.185.46 -> 244.3.210.197 TCP 64 50878 > http [ACK] Seq=1442 Ack=66305 Win=65700 Len=0
555406 178.866062 18.211.185.46 -> 244.3.210.197 TCP 64 50878 > http [ACK] Seq=1442 Ack=69225 Win=62780 Len=0
555407 178.866067 18.211.185.46 -> 244.3.210.197 TCP 64 50878 > http [ACK] Seq=1442 Ack=72145 Win=59860 Len=0
555437 178.871308 18.211.185.46 -> 244.3.210.197 TCP 64 50878 > http [ACK] Seq=1442 Ack=75065 Win=56940 Len=0
555438 178.871313 18.211.185.46 -> 244.3.210.197 TCP 64 50878 > http [ACK] Seq=1442 Ack=77985 Win=54020 Len=0
555466 178.875498 18.211.185.46 -> 244.3.210.197 TCP 64 50878 > http [ACK] Seq=1442 Ack=80905 Win=51100 Len=0
555467 178.875518 18.211.185.46 -> 244.3.210.197 TCP 64 50878 > http [ACK] Seq=1442 Ack=83825 Win=48180 Len=0
555551 178.897011 18.211.185.46 -> 244.3.210.197 TCP 64 50878 > http [ACK] Seq=1442 Ack=86745 Win=45260 Len=0
555608 178.904333 18.211.185.46 -> 244.3.210.197 TCP 64 50878 > http [ACK] Seq=1442 Ack=89665 Win=43800 Len=0
555633 178.909297 18.211.185.46 -> 244.3.210.197 TCP 64 50878 > http [ACK] Seq=1442 Ack=92585 Win=43800 Len=0
555649 178.921352 18.211.185.46 -> 244.3.210.197 TCP 64 50878 > http [ACK] Seq=1442 Ack=95505 Win=43800 Len=0
555678 178.925960 18.211.185.46 -> 244.3.210.197 TCP 64 50878 > http [ACK] Seq=1442 Ack=104265 Win=43800 Len=0
555695 178.930714 18.211.185.46 -> 244.3.210.197 TCP 64 50878 > http [ACK] Seq=1442 Ack=110105 Win=43800 Len=0
555715 178.936465 18.211.185.46 -> 244.3.210.197 TCP 64 50878 > http [ACK] Seq=1442 Ack=118865 Win=43800 Len=0
555807 178.964304 18.211.185.46 -> 244.3.210.197 TCP 64 50878 > http [ACK] Seq=1442 Ack=121785 Win=43800 Len=0
555819 178.969020 18.211.185.46 -> 244.3.210.197 TCP 64 50878 > http [ACK] Seq=1442 Ack=133465 Win=43800 Len=0
555844 178.974799 18.211.185.46 -> 244.3.210.197 TCP 64 50878 > http [ACK] Seq=1442 Ack=136385 Win=45260 Len=0
555851 178.978744 18.211.185.46 -> 244.3.210.197 TCP 64 50878 > http [ACK] Seq=1442 Ack=142225 Win=45260 Len=0
555859 178.983508 18.211.185.46 -> 244.3.210.197 TCP 64 50878 > http [ACK] Seq=1442 Ack=148065 Win=45260 Len=0
556264 179.098549 18.211.185.46 -> 244.3.210.197 TCP 64 50877 > http [ACK] Seq=1867 Ack=55629 Win=17520 Len=0
556388 179.158485 18.211.185.46 -> 244.3.210.197 TCP 64 50878 > http [ACK] Seq=1911 Ack=150989 Win=45260 Len=0
556401 179.165987 18.211.185.46 -> 244.3.210.197 TCP 64 50878 > http [ACK] Seq=1911 Ack=152972 Win=45260 Len=0
556627 179.252273 18.211.185.46 -> 244.3.210.197 TCP 64 50877 > http [ACK] Seq=2336 Ack=58549 Win=17520 Len=0
556646 179.257243 18.211.185.46 -> 244.3.210.197 TCP 64 50877 > http [ACK] Seq=2336 Ack=61469 Win=17520 Len=0
556647 179.257247 18.211.185.46 -> 244.3.210.197 TCP 64 50877 > http [ACK] Seq=2336 Ack=64389 Win=17520 Len=0
556648 179.257251 18.211.185.46 -> 244.3.210.197 TCP 64 50877 > http [ACK] Seq=2336 Ack=67309 Win=17520 Len=0
556649 179.257255 18.211.185.46 -> 244.3.210.197 TCP 64 50877 > http [ACK] Seq=2336 Ack=70229 Win=17520 Len=0
556668 179.257497 18.211.185.46 -> 244.3.210.197 TCP 64 50877 > http [ACK] Seq=2336 Ack=73149 Win=17520 Len=0
556766 179.302579 18.211.185.46 -> 244.3.210.197 TCP 64 50877 > http [ACK] Seq=2336 Ack=76069 Win=17520 Len=0
556874 179.321689 18.211.185.46 -> 244.3.210.197 TCP 64 50877 > http [ACK] Seq=2336 Ack=78989 Win=17520 Len=0
556883 179.326811 18.211.185.46 -> 244.3.210.197 TCP 64 50877 > http [ACK] Seq=2336 Ack=81909 Win=17520 Len=0
556884 179.326836 18.211.185.46 -> 244.3.210.197 TCP 64 50877 > http [ACK] Seq=2336 Ack=90669 Win=17520 Len=0
556968 179.352970 18.211.185.46 -> 244.3.210.197 TCP 64 50877 > http [ACK] Seq=2336 Ack=93589 Win=105120 Len=0
557834 179.437239 18.211.185.46 -> 244.3.210.197 TCP 64 50878 > http [ACK] Seq=2381 Ack=155892 Win=45260 Len=0
557847 179.442160 18.211.185.46 -> 244.3.210.197 TCP 64 50878 > http [ACK] Seq=2381 Ack=161732 Win=45260 Len=0
557929 179.446542 18.211.185.46 -> 244.3.210.197 TCP 64 50878 > http [ACK] Seq=2381 Ack=164652 Win=45260 Len=0
558101 179.453861 18.211.185.46 -> 244.3.210.197 TCP 64 50878 > http [ACK] Seq=2381 Ack=176332 Win=45260 Len=0
558216 179.458550 18.211.185.46 -> 244.3.210.197 TCP 64 50878 > http [ACK] Seq=2381 Ack=183883 Win=48180 Len=0
559148 179.542648 18.211.185.46 -> 244.3.210.197 TCP 64 50877 > http [ACK] Seq=2806 Ack=96691 Win=102016 Len=0
559159 179.547501 18.211.185.46 -> 244.3.210.197 TCP 64 50877 > http [ACK] Seq=2806 Ack=99611 Win=102200 Len=0
559172 179.552062 18.211.185.46 -> 244.3.210.197 TCP 64 50877 > http [ACK] Seq=2806 Ack=105451 Win=102200 Len=0
559183 179.557005 18.211.185.46 -> 244.3.210.197 TCP 64 50877 > http [ACK] Seq=2806 Ack=111291 Win=102200 Len=0
559350 179.595377 18.211.185.46 -> 244.3.210.197 TCP 64 50877 > http [ACK] Seq=2806 Ack=114211 Win=202940 Len=0
559364 179.605140 18.211.185.46 -> 244.3.210.197 TCP 64 50877 > http [ACK] Seq=2806 Ack=117131 Win=202940 Len=0
559373 179.609696 18.211.185.46 -> 244.3.210.197 TCP 64 50877 > http [ACK] Seq=2806 Ack=122971 Win=200020 Len=0
559494 179.672236 18.211.185.46 -> 244.3.210.197 TCP 64 50878 > http [ACK] Seq=2849 Ack=186803 Win=48180 Len=0
559502 179.676991 18.211.185.46 -> 244.3.210.197 TCP 64 50878 > http [ACK] Seq=2849 Ack=194551 Win=48180 Len=0
559677 179.748891 18.211.185.46 -> 244.3.210.197 TCP 64 50877 > http [ACK] Seq=3289 Ack=125937 Win=200020 Len=0
559703 179.753903 18.211.185.46 -> 244.3.210.197 TCP 64 50877 > http [ACK] Seq=3289 Ack=127769 Win=200020 Len=0
560183 179.934368 18.211.185.46 -> 244.3.210.197 TCP 64 50878 > http [ACK] Seq=3811 Ack=198684 Win=48180 Len=0
560204 179.938952 18.211.185.46 -> 244.3.210.197 TCP 64 50878 > http [ACK] Seq=3811 Ack=206838 Win=48180 Len=0
560414 179.997590 18.211.185.46 -> 244.3.210.197 TCP 64 50877 > http [ACK] Seq=4239 Ack=131306 Win=200020 Len=0
560464 180.005235 18.211.185.46 -> 244.3.210.197 TCP 64 50877 > http [ACK] Seq=4239 Ack=137146 Win=200020 Len=0
560640 180.065853 18.211.185.46 -> 244.3.210.197 TCP 64 50878 > http [ACK] Seq=4278 Ack=209758 Win=48180 Len=0
560652 180.071189 18.211.185.46 -> 244.3.210.197 TCP 64 50878 > http [ACK] Seq=4278 Ack=215598 Win=48180 Len=0
560841 180.141277 18.211.185.46 -> 244.3.210.197 TCP 64 50877 > http [ACK] Seq=4707 Ack=141058 Win=200020 Len=0
560975 180.200516 18.211.185.46 -> 244.3.210.197 TCP 64 50878 > http [ACK] Seq=4750 Ack=218943 Win=48180 Len=0
561553 180.272993 18.211.185.46 -> 244.3.210.197 TCP 64 50877 > http [ACK] Seq=5173 Ack=144615 Win=200020 Len=0
561615 180.277387 18.211.185.46 -> 244.3.210.197 TCP 64 50877 > http [ACK] Seq=5173 Ack=152473 Win=200020 Len=0
562807 180.341324 18.211.185.46 -> 244.3.210.197 TCP 64 50878 > http [ACK] Seq=5218 Ack=223292 Win=48180 Len=0
562903 180.346612 18.211.185.46 -> 244.3.210.197 TCP 64 50878 > http [ACK] Seq=5218 Ack=229132 Win=48180 Len=0
562950 180.351566 18.211.185.46 -> 244.3.210.197 TCP 64 50878 > http [ACK] Seq=5218 Ack=240812 Win=48180 Len=0
563026 180.363453 18.211.185.46 -> 244.3.210.197 TCP 64 50878 > http [ACK] Seq=5218 Ack=243732 Win=48180 Len=0
563051 180.368318 18.211.185.46 -> 244.3.210.197 TCP 64 50878 > http [ACK] Seq=5218 Ack=258332 Win=179580 Len=0
563071 180.373360 18.211.185.46 -> 244.3.210.197 TCP 64 50878 > http [ACK] Seq=5218 Ack=267092 Win=179580 Len=0
563223 180.391470 18.211.185.46 -> 244.3.210.197 TCP 64 50878 > http [ACK] Seq=5218 Ack=270012 Win=191260 Len=0
563303 180.397366 18.211.185.46 -> 244.3.210.197 TCP 64 50878 > http [ACK] Seq=5218 Ack=275852 Win=192720 Len=0
563643 180.435474 18.211.185.46 -> 244.3.210.197 TCP 64 50878 > http [ACK] Seq=5218 Ack=278772 Win=192720 Len=0
563678 180.442435 18.211.185.46 -> 244.3.210.197 TCP 64 50878 > http [ACK] Seq=5218 Ack=284612 Win=192720 Len=0
563966 180.493705 18.211.185.46 -> 244.3.210.197 TCP 64 50877 > http [ACK] Seq=5649 Ack=155393 Win=200020 Len=0
564008 180.498194 18.211.185.46 -> 244.3.210.197 TCP 64 50877 > http [ACK] Seq=5649 Ack=158313 Win=200020 Len=0
564245 180.565215 18.211.185.46 -> 244.3.210.197 TCP 64 50878 > http [ACK] Seq=5690 Ack=287881 Win=192720 Len=0
564463 180.625223 18.211.185.46 -> 244.3.210.197 TCP 64 50877 > http [ACK] Seq=6114 Ack=161255 Win=200020 Len=0
564536 180.629898 18.211.185.46 -> 244.3.210.197 TCP 64 50877 > http [ACK] Seq=6114 Ack=169667 Win=200020 Len=0
564874 180.717906 18.211.185.46 -> 244.3.210.197 TCP 64 50878 > http [ACK] Seq=6199 Ack=291337 Win=192720 Len=0
564914 180.725429 18.211.185.46 -> 244.3.210.197 TCP 64 50878 > http [ACK] Seq=6199 Ack=305937 Win=192720 Len=0
564927 180.731359 18.211.185.46 -> 244.3.210.197 TCP 64 50878 > http [ACK] Seq=6199 Ack=317617 Win=192720 Len=0
564941 180.736508 18.211.185.46 -> 244.3.210.197 TCP 64 50878 > http [ACK] Seq=6199 Ack=326377 Win=232140 Len=0
564976 180.741455 18.211.185.46 -> 244.3.210.197 TCP 64 50877 > http [ACK] Seq=6620 Ack=178427 Win=200020 Len=0
565000 180.747616 18.211.185.46 -> 244.3.210.197 TCP 64 50877 > http [ACK] Seq=6620 Ack=183099 Win=200020 Len=0
565076 180.791566 18.211.185.46 -> 244.3.210.197 TCP 64 50878 > http [ACK] Seq=6707 Ack=329948 Win=228568 Len=0
565084 180.797872 18.211.185.46 -> 244.3.210.197 TCP 64 50878 > http [ACK] Seq=6707 Ack=335788 Win=222728 Len=0
565121 180.813510 18.211.185.46 -> 244.3.210.197 TCP 64 50878 > http [ACK] Seq=6707 Ack=338708 Win=221920 Len=0
565611 180.927722 18.211.185.46 -> 244.3.210.197 TCP 64 50878 > http [ACK] Seq=7690 Ack=342185 Win=220460 Len=0
565669 180.937283 18.211.185.46 -> 244.3.210.197 TCP 64 50877 > http [ACK] Seq=8074 Ack=185998 Win=220940 Len=0
566005 180.990643 18.211.185.46 -> 244.3.210.197 TCP 64 50878 > http [ACK] Seq=8176 Ack=344844 Win=217800 Len=0
566041 180.995156 18.211.185.46 -> 244.3.210.197 TCP 64 50877 > http [ACK] Seq=8559 Ack=188811 Win=218128 Len=0
566274 181.047413 18.211.185.46 -> 244.3.210.197 TCP 64 50878 > http [ACK] Seq=8660 Ack=347764 Win=214880 Len=0
566298 181.053830 18.211.185.46 -> 244.3.210.197 TCP 64 50878 > http [ACK] Seq=8660 Ack=349832 Win=212812 Len=0
566346 181.061393 18.211.185.46 -> 244.3.210.197 TCP 64 50877 > http [ACK] Seq=9044 Ack=193542 Win=213396 Len=0
566507 181.114963 18.211.185.46 -> 244.3.210.197 TCP 64 50878 > http [ACK] Seq=9156 Ack=352414 Win=210228 Len=0
566563 181.122182 18.211.185.46 -> 244.3.210.197 TCP 64 50877 > http [ACK] Seq=9539 Ack=198596 Win=208344 Len=0
566690 181.184137 18.211.185.46 -> 244.3.210.197 TCP 64 50878 > http [ACK] Seq=9651 Ack=355334 Win=207308 Len=0
566722 181.192433 18.211.185.46 -> 244.3.210.197 TCP 64 50878 > http [ACK] Seq=9651 Ack=361174 Win=201468 Len=0
566723 181.192437 18.211.185.46 -> 244.3.210.197 TCP 64 50877 > http [ACK] Seq=10030 Ack=201337 Win=205604 Len=0
567239 181.294842 18.211.185.46 -> 244.3.210.197 TCP 64 50878 > http [ACK] Seq=10765 Ack=364559 Win=198084 Len=0
568052 181.494049 18.211.185.46 -> 244.3.210.197 TCP 64 50877 > http [ACK] Seq=12629 Ack=205876 Win=201064 Len=0
568575 181.661394 18.211.185.46 -> 244.3.210.197 TCP 64 50878 > http [ACK] Seq=12358 Ack=366104 Win=196540 Len=0
568637 181.688282 18.211.185.46 -> 244.3.210.197 TCP 64 50877 > http [ACK] Seq=12629 Ack=205985 Win=200956 Len=0
580053 184.479651 18.211.185.46 -> 244.3.210.197 TCP 64 50878 > http [ACK] Seq=13077 Ack=369024 Win=193620 Len=0
580054 184.479656 18.211.185.46 -> 244.3.210.197 TCP 64 50878 > http [ACK] Seq=13077 Ack=371944 Win=190700 Len=0
580090 184.486782 18.211.185.46 -> 244.3.210.197 TCP 64 50878 > http [ACK] Seq=13077 Ack=374864 Win=187780 Len=0
580125 184.491466 18.211.185.46 -> 244.3.210.197 TCP 64 50878 > http [ACK] Seq=13077 Ack=377784 Win=184860 Len=0
580126 184.491498 18.211.185.46 -> 244.3.210.197 TCP 64 50878 > http [ACK] Seq=13077 Ack=380704 Win=181940 Len=0
580132 184.491651 18.211.185.46 -> 244.3.210.197 TCP 64 50878 > http [ACK] Seq=13077 Ack=383624 Win=179020 Len=0
580133 184.491655 18.211.185.46 -> 244.3.210.197 TCP 64 50878 > http [ACK] Seq=13077 Ack=385528 Win=177116 Len=0
580946 184.765703 18.211.185.46 -> 244.3.210.197 TCP 64 50877 > http [ACK] Seq=13330 Ack=208905 Win=198036 Len=0
580985 184.773277 18.211.185.46 -> 244.3.210.197 TCP 64 50877 > http [ACK] Seq=13330 Ack=211825 Win=195116 Len=0
580986 184.773300 18.211.185.46 -> 244.3.210.197 TCP 64 50877 > http [ACK] Seq=13330 Ack=214745 Win=192196 Len=0
581001 184.780244 18.211.185.46 -> 244.3.210.197 TCP 64 50877 > http [ACK] Seq=13330 Ack=217665 Win=189276 Len=0
581002 184.780249 18.211.185.46 -> 244.3.210.197 TCP 64 50877 > http [ACK] Seq=13330 Ack=220585 Win=186356 Len=0
581003 184.780253 18.211.185.46 -> 244.3.210.197 TCP 64 50877 > http [ACK] Seq=13330 Ack=223505 Win=183436 Len=0
581004 184.780256 18.211.185.46 -> 244.3.210.197 TCP 64 50877 > http [ACK] Seq=13330 Ack=226425 Win=180516 Len=0
581034 184.784393 18.211.185.46 -> 244.3.210.197 TCP 64 50877 > http [ACK] Seq=13330 Ack=229345 Win=177596 Len=0
581046 184.790731 18.211.185.46 -> 244.3.210.197 TCP 64 50877 > http [ACK] Seq=13330 Ack=232109 Win=174832 Len=0
581059 184.796435 18.211.185.46 -> 244.3.210.197 TCP 64 50878 > http [ACK] Seq=13766 Ack=388448 Win=174196 Len=0
581060 184.796440 18.211.185.46 -> 244.3.210.197 TCP 64 50878 > http [ACK] Seq=13766 Ack=391368 Win=171276 Len=0
581073 184.801512 18.211.185.46 -> 244.3.210.197 TCP 64 50878 > http [ACK] Seq=13766 Ack=394288 Win=168356 Len=0
581074 184.801558 18.211.185.46 -> 244.3.210.197 TCP 64 50878 > http [ACK] Seq=13766 Ack=397208 Win=165436 Len=0
581085 184.801806 18.211.185.46 -> 244.3.210.197 TCP 64 50878 > http [ACK] Seq=13766 Ack=399663 Win=162980 Len=0
581457 185.006039 18.211.185.46 -> 244.3.210.197 TCP 64 50877 > http [ACK] Seq=14040 Ack=235029 Win=171912 Len=0
581460 185.006169 18.211.185.46 -> 244.3.210.197 TCP 64 50878 > http [ACK] Seq=14474 Ack=401755 Win=160888 Len=0
581462 185.006178 18.211.185.46 -> 244.3.210.197 TCP 64 50877 > http [ACK] Seq=14040 Ack=236911 Win=170028 Len=0
581608 185.068404 18.211.185.46 -> 244.3.210.197 TCP 64 50877 > http [ACK] Seq=14748 Ack=238999 Win=167940 Len=0
581617 185.068627 18.211.185.46 -> 244.3.210.197 TCP 64 50878 > http [ACK] Seq=15182 Ack=403961 Win=191260 Len=0
581777 185.132015 18.211.185.46 -> 244.3.210.197 TCP 64 50878 > http [ACK] Seq=15890 Ack=406300 Win=188920 Len=0
581779 185.132023 18.211.185.46 -> 244.3.210.197 TCP 64 50877 > http [ACK] Seq=15456 Ack=240971 Win=165968 Len=0
581949 185.187823 18.211.185.46 -> 244.3.210.197 TCP 64 50878 > http [ACK] Seq=16573 Ack=409220 Win=186000 Len=0
581955 185.193368 18.211.185.46 -> 244.3.210.197 TCP 64 50877 > http [ACK] Seq=16164 Ack=243049 Win=163892 Len=0
581957 185.193394 18.211.185.46 -> 244.3.210.197 TCP 64 50878 > http [ACK] Seq=16573 Ack=410867 Win=184352 Len=0
582473 185.437273 18.211.185.46 -> 244.3.210.197 TCP 64 50878 > http [ACK] Seq=17254 Ack=411205 Win=184016 Len=0
582941 185.660315 18.211.185.46 -> 244.3.210.197 TCP 64 50877 > http [ACK] Seq=16858 Ack=245969 Win=160972 Len=0
582942 185.660319 18.211.185.46 -> 244.3.210.197 TCP 64 50877 > http [ACK] Seq=16858 Ack=248889 Win=158052 Len=0
582979 185.665410 18.211.185.46 -> 244.3.210.197 TCP 64 50877 > http [ACK] Seq=16858 Ack=251809 Win=155132 Len=0
582980 185.665415 18.211.185.46 -> 244.3.210.197 TCP 64 50877 > http [ACK] Seq=16858 Ack=254729 Win=152212 Len=0
582981 185.665419 18.211.185.46 -> 244.3.210.197 TCP 64 50877 > http [ACK] Seq=16858 Ack=257649 Win=149292 Len=0
582997 185.669858 18.211.185.46 -> 244.3.210.197 TCP 64 50877 > http [ACK] Seq=16858 Ack=260569 Win=146372 Len=0
582998 185.669864 18.211.185.46 -> 244.3.210.197 TCP 64 50877 > http [ACK] Seq=16858 Ack=263489 Win=147460 Len=0
583007 185.670089 18.211.185.46 -> 244.3.210.197 TCP 64 50877 > http [ACK] Seq=16858 Ack=266409 Win=147460 Len=0
583017 185.674802 18.211.185.46 -> 244.3.210.197 TCP 64 50877 > http [ACK] Seq=16858 Ack=269329 Win=147460 Len=0
583018 185.674807 18.211.185.46 -> 244.3.210.197 TCP 64 50877 > http [ACK] Seq=16858 Ack=272249 Win=147460 Len=0
583029 185.675035 18.211.185.46 -> 244.3.210.197 TCP 64 50877 > http [ACK] Seq=16858 Ack=275169 Win=147460 Len=0
583484 185.893251 18.211.185.46 -> 244.3.210.197 TCP 64 50877 > http [ACK] Seq=16858 Ack=276286 Win=146340 Len=0
