110993  39.688272 181.163.75.192 -> 41.177.26.15 TCP 70 54780 > http [FIN, ACK] Seq=1 Ack=1 Win=1032 Len=0 TSval=2514848620 TSecr=140296687
135544  47.156664 181.163.75.192 -> 41.177.26.15 TCP 78 51652 > http [SYN] Seq=0 Win=65535 Len=0 MSS=1460 WS=64 SACK_PERM=1 TSval=2514856100 TSecr=0
135724  47.220720 181.163.75.192 -> 41.177.26.15 TCP 70 51652 > http [ACK] Seq=1 Ack=1 Win=66048 Len=0 TSval=2514856160 TSecr=140346312
136072  47.364587 181.163.75.192 -> 41.177.26.15 TCP 70 51652 > http [ACK] Seq=528 Ack=1768 Win=64576 Len=0 TSval=2514856310 TSecr=140346325
136076  47.365348 181.163.75.192 -> 41.177.26.15 TCP 70 51652 > http [ACK] Seq=528 Ack=3216 Win=66048 Len=0 TSval=2514856310 TSecr=140346326
136236  47.427215 181.163.75.192 -> 41.177.26.15 TCP 70 51652 > http [ACK] Seq=528 Ack=6112 Win=64576 Len=0 TSval=2514856370 TSecr=140346332
136240  47.428190 181.163.75.192 -> 41.177.26.15 TCP 70 51652 > http [ACK] Seq=528 Ack=7560 Win=66048 Len=0 TSval=2514856370 TSecr=140346332
136243  47.429365 181.163.75.192 -> 41.177.26.15 TCP 70 51652 > http [ACK] Seq=528 Ack=9960 Win=64576 Len=0 TSval=2514856370 TSecr=140346332
136412  47.489467 181.163.75.192 -> 41.177.26.15 TCP 70 51652 > http [ACK] Seq=528 Ack=11408 Win=66048 Len=0 TSval=2514856430 TSecr=140346339
136418  47.491055 181.163.75.192 -> 41.177.26.15 TCP 70 51652 > http [ACK] Seq=528 Ack=14304 Win=64576 Len=0 TSval=2514856430 TSecr=140346339
136424  47.491995 181.163.75.192 -> 41.177.26.15 TCP 70 51652 > http [ACK] Seq=528 Ack=15752 Win=66048 Len=0 TSval=2514856430 TSecr=140346339
136427  47.493077 181.163.75.192 -> 41.177.26.15 TCP 70 51652 > http [ACK] Seq=528 Ack=18152 Win=64576 Len=0 TSval=2514856430 TSecr=140346339
136439  47.493942 181.163.75.192 -> 41.177.26.15 TCP 70 51652 > http [ACK] Seq=528 Ack=19600 Win=66048 Len=0 TSval=2514856440 TSecr=140346339
136596  47.554245 181.163.75.192 -> 41.177.26.15 TCP 70 51652 > http [ACK] Seq=528 Ack=21048 Win=66048 Len=0 TSval=2514856500 TSecr=140346339
136609  47.559474 181.163.75.192 -> 41.177.26.15 TCP 70 51652 > http [ACK] Seq=528 Ack=23944 Win=64576 Len=0 TSval=2514856500 TSecr=140346345
136614  47.559751 181.163.75.192 -> 41.177.26.15 TCP 70 51652 > http [ACK] Seq=528 Ack=26344 Win=64576 Len=0 TSval=2514856500 TSecr=140346345
136624  47.560678 181.163.75.192 -> 41.177.26.15 TCP 70 51652 > http [ACK] Seq=528 Ack=27792 Win=66048 Len=0 TSval=2514856500 TSecr=140346345
136637  47.563484 181.163.75.192 -> 41.177.26.15 TCP 70 51652 > http [ACK] Seq=528 Ack=30688 Win=64576 Len=0 TSval=2514856500 TSecr=140346345
136651  47.567273 181.163.75.192 -> 41.177.26.15 TCP 70 51652 > http [ACK] Seq=528 Ack=32136 Win=66048 Len=0 TSval=2514856510 TSecr=140346345
136652  47.567278 181.163.75.192 -> 41.177.26.15 TCP 70 51652 > http [ACK] Seq=528 Ack=34536 Win=64576 Len=0 TSval=2514856510 TSecr=140346345
136665  47.568934 181.163.75.192 -> 41.177.26.15 TCP 70 51652 > http [ACK] Seq=528 Ack=35984 Win=66048 Len=0 TSval=2514856510 TSecr=140346345
136845  47.616703 181.163.75.192 -> 41.177.26.15 TCP 70 51652 > http [ACK] Seq=528 Ack=38880 Win=64576 Len=0 TSval=2514856560 TSecr=140346345
136847  47.617040 181.163.75.192 -> 41.177.26.15 TCP 70 51652 > http [ACK] Seq=528 Ack=40328 Win=66048 Len=0 TSval=2514856560 TSecr=140346351
136871  47.622575 181.163.75.192 -> 41.177.26.15 TCP 70 51652 > http [ACK] Seq=528 Ack=42728 Win=64576 Len=0 TSval=2514856560 TSecr=140346352
136878  47.623312 181.163.75.192 -> 41.177.26.15 TCP 70 51652 > http [ACK] Seq=528 Ack=44176 Win=66048 Len=0 TSval=2514856560 TSecr=140346352
136888  47.624826 181.163.75.192 -> 41.177.26.15 TCP 70 51652 > http [ACK] Seq=528 Ack=47072 Win=64576 Len=0 TSval=2514856570 TSecr=140346352
136898  47.625954 181.163.75.192 -> 41.177.26.15 TCP 70 51652 > http [ACK] Seq=528 Ack=48520 Win=66048 Len=0 TSval=2514856570 TSecr=140346352
136903  47.626772 181.163.75.192 -> 41.177.26.15 TCP 70 51652 > http [ACK] Seq=528 Ack=50920 Win=64576 Len=0 TSval=2514856570 TSecr=140346352
136911  47.627501 181.163.75.192 -> 41.177.26.15 TCP 70 51652 > http [ACK] Seq=528 Ack=52368 Win=66048 Len=0 TSval=2514856570 TSecr=140346352
136917  47.629156 181.163.75.192 -> 41.177.26.15 TCP 70 51652 > http [ACK] Seq=528 Ack=55264 Win=64576 Len=0 TSval=2514856570 TSecr=140346352
136929  47.629964 181.163.75.192 -> 41.177.26.15 TCP 70 51652 > http [ACK] Seq=528 Ack=56712 Win=66048 Len=0 TSval=2514856570 TSecr=140346352
136946  47.633735 181.163.75.192 -> 41.177.26.15 TCP 70 51652 > http [ACK] Seq=528 Ack=59112 Win=64576 Len=0 TSval=2514856570 TSecr=140346353
136947  47.633740 181.163.75.192 -> 41.177.26.15 TCP 70 51652 > http [ACK] Seq=528 Ack=60560 Win=66048 Len=0 TSval=2514856580 TSecr=140346353
136968  47.634956 181.163.75.192 -> 41.177.26.15 TCP 70 51652 > http [ACK] Seq=528 Ack=63456 Win=64576 Len=0 TSval=2514856580 TSecr=140346353
136992  47.635605 181.163.75.192 -> 41.177.26.15 TCP 70 51652 > http [ACK] Seq=528 Ack=64904 Win=66048 Len=0 TSval=2514856580 TSecr=140346353
137153  47.680118 181.163.75.192 -> 41.177.26.15 TCP 70 51652 > http [ACK] Seq=528 Ack=67304 Win=64576 Len=0 TSval=2514856620 TSecr=140346353
137157  47.680935 181.163.75.192 -> 41.177.26.15 TCP 70 51652 > http [ACK] Seq=528 Ack=68752 Win=66048 Len=0 TSval=2514856620 TSecr=140346358
137164  47.682653 181.163.75.192 -> 41.177.26.15 TCP 70 51652 > http [ACK] Seq=528 Ack=71648 Win=64576 Len=0 TSval=2514856620 TSecr=140346358
137168  47.683368 181.163.75.192 -> 41.177.26.15 TCP 70 51652 > http [ACK] Seq=528 Ack=73096 Win=66048 Len=0 TSval=2514856620 TSecr=140346358
137175  47.686443 181.163.75.192 -> 41.177.26.15 TCP 70 51652 > http [ACK] Seq=528 Ack=75992 Win=64576 Len=0 TSval=2514856630 TSecr=140346358
137179  47.687210 181.163.75.192 -> 41.177.26.15 TCP 70 51652 > http [ACK] Seq=528 Ack=78392 Win=64576 Len=0 TSval=2514856630 TSecr=140346358
137185  47.687816 181.163.75.192 -> 41.177.26.15 TCP 70 51652 > http [ACK] Seq=528 Ack=79840 Win=66048 Len=0 TSval=2514856630 TSecr=140346358
137195  47.692592 181.163.75.192 -> 41.177.26.15 TCP 70 51652 > http [ACK] Seq=528 Ack=82736 Win=64576 Len=0 TSval=2514856630 TSecr=140346358
137199  47.693221 181.163.75.192 -> 41.177.26.15 TCP 70 51652 > http [ACK] Seq=528 Ack=84184 Win=66048 Len=0 TSval=2514856630 TSecr=140346358
137208  47.694857 181.163.75.192 -> 41.177.26.15 TCP 70 51652 > http [ACK] Seq=528 Ack=86584 Win=64576 Len=0 TSval=2514856640 TSecr=140346359
137211  47.695524 181.163.75.192 -> 41.177.26.15 TCP 70 51652 > http [ACK] Seq=528 Ack=88032 Win=66048 Len=0 TSval=2514856640 TSecr=140346359
137219  47.697145 181.163.75.192 -> 41.177.26.15 TCP 70 51652 > http [ACK] Seq=528 Ack=90928 Win=64576 Len=0 TSval=2514856640 TSecr=140346359
137220  47.697847 181.163.75.192 -> 41.177.26.15 TCP 70 51652 > http [ACK] Seq=528 Ack=92376 Win=66048 Len=0 TSval=2514856640 TSecr=140346359
137231  47.699456 181.163.75.192 -> 41.177.26.15 TCP 70 51652 > http [ACK] Seq=528 Ack=94776 Win=64576 Len=0 TSval=2514856640 TSecr=140346359
137241  47.700411 181.163.75.192 -> 41.177.26.15 TCP 70 51652 > http [ACK] Seq=528 Ack=96224 Win=66048 Len=0 TSval=2514856640 TSecr=140346359
137247  47.701852 181.163.75.192 -> 41.177.26.15 TCP 70 51652 > http [ACK] Seq=528 Ack=99120 Win=64576 Len=0 TSval=2514856640 TSecr=140346359
137249  47.702547 181.163.75.192 -> 41.177.26.15 TCP 70 51652 > http [ACK] Seq=528 Ack=100568 Win=66048 Len=0 TSval=2514856640 TSecr=140346359
137258  47.703995 181.163.75.192 -> 41.177.26.15 TCP 70 51652 > http [ACK] Seq=528 Ack=102968 Win=64576 Len=0 TSval=2514856650 TSecr=140346359
137259  47.704877 181.163.75.192 -> 41.177.26.15 TCP 70 51652 > http [ACK] Seq=528 Ack=104416 Win=66048 Len=0 TSval=2514856650 TSecr=140346359
137270  47.707147 181.163.75.192 -> 41.177.26.15 TCP 70 51652 > http [ACK] Seq=528 Ack=107312 Win=64576 Len=0 TSval=2514856650 TSecr=140346359
137271  47.707151 181.163.75.192 -> 41.177.26.15 TCP 70 51652 > http [ACK] Seq=528 Ack=108760 Win=66048 Len=0 TSval=2514856650 TSecr=140346359
137276  47.708655 181.163.75.192 -> 41.177.26.15 TCP 70 51652 > http [ACK] Seq=528 Ack=111160 Win=64576 Len=0 TSval=2514856650 TSecr=140346359
137280  47.709366 181.163.75.192 -> 41.177.26.15 TCP 70 51652 > http [ACK] Seq=528 Ack=112608 Win=66048 Len=0 TSval=2514856650 TSecr=140346359
137284  47.710507 181.163.75.192 -> 41.177.26.15 TCP 70 51652 > http [ACK] Seq=528 Ack=115504 Win=64576 Len=0 TSval=2514856650 TSecr=140346359
137363  47.742088 181.163.75.192 -> 41.177.26.15 TCP 70 51652 > http [ACK] Seq=528 Ack=116952 Win=66048 Len=0 TSval=2514856680 TSecr=140346364
137368  47.743445 181.163.75.192 -> 41.177.26.15 TCP 70 51652 > http [ACK] Seq=528 Ack=119352 Win=64576 Len=0 TSval=2514856690 TSecr=140346364
137369  47.744189 181.163.75.192 -> 41.177.26.15 TCP 70 51652 > http [ACK] Seq=528 Ack=120800 Win=66048 Len=0 TSval=2514856690 TSecr=140346364
137383  47.746517 181.163.75.192 -> 41.177.26.15 TCP 70 51652 > http [ACK] Seq=528 Ack=123696 Win=64576 Len=0 TSval=2514856690 TSecr=140346364
137397  47.747381 181.163.75.192 -> 41.177.26.15 TCP 70 51652 > http [ACK] Seq=528 Ack=125144 Win=66048 Len=0 TSval=2514856690 TSecr=140346364
137404  47.748908 181.163.75.192 -> 41.177.26.15 TCP 70 51652 > http [ACK] Seq=528 Ack=127544 Win=64576 Len=0 TSval=2514856690 TSecr=140346364
137408  47.750064 181.163.75.192 -> 41.177.26.15 TCP 70 51652 > http [ACK] Seq=528 Ack=128992 Win=66048 Len=0 TSval=2514856690 TSecr=140346364
137412  47.751609 181.163.75.192 -> 41.177.26.15 TCP 70 51652 > http [ACK] Seq=528 Ack=131888 Win=64576 Len=0 TSval=2514856690 TSecr=140346365
137413  47.752215 181.163.75.192 -> 41.177.26.15 TCP 70 51652 > http [ACK] Seq=528 Ack=133336 Win=66048 Len=0 TSval=2514856690 TSecr=140346365
137417  47.754305 181.163.75.192 -> 41.177.26.15 TCP 70 51652 > http [ACK] Seq=528 Ack=136232 Win=64576 Len=0 TSval=2514856700 TSecr=140346365
137424  47.757136 181.163.75.192 -> 41.177.26.15 TCP 70 51652 > http [ACK] Seq=528 Ack=137680 Win=66048 Len=0 TSval=2514856700 TSecr=140346365
137430  47.758314 181.163.75.192 -> 41.177.26.15 TCP 70 51652 > http [ACK] Seq=528 Ack=140080 Win=65088 Len=0 TSval=2514856700 TSecr=140346365
137438  47.762090 181.163.75.192 -> 41.177.26.15 TCP 70 51652 > http [ACK] Seq=528 Ack=142976 Win=64576 Len=0 TSval=2514856700 TSecr=140346365
137440  47.762429 181.163.75.192 -> 41.177.26.15 TCP 70 51652 > http [ACK] Seq=528 Ack=144424 Win=66048 Len=0 TSval=2514856700 TSecr=140346365
137456  47.765837 181.163.75.192 -> 41.177.26.15 TCP 70 51652 > http [ACK] Seq=528 Ack=147320 Win=64576 Len=0 TSval=2514856710 TSecr=140346365
137457  47.766346 181.163.75.192 -> 41.177.26.15 TCP 70 51652 > http [ACK] Seq=528 Ack=149720 Win=64576 Len=0 TSval=2514856710 TSecr=140346365
137472  47.767970 181.163.75.192 -> 41.177.26.15 TCP 70 51652 > http [ACK] Seq=528 Ack=151168 Win=66048 Len=0 TSval=2514856710 TSecr=140346365
137482  47.771767 181.163.75.192 -> 41.177.26.15 TCP 70 51652 > http [ACK] Seq=528 Ack=154064 Win=64576 Len=0 TSval=2514856710 TSecr=140346365
137485  47.772657 181.163.75.192 -> 41.177.26.15 TCP 70 51652 > http [ACK] Seq=528 Ack=155512 Win=66048 Len=0 TSval=2514856710 TSecr=140346366
137495  47.774039 181.163.75.192 -> 41.177.26.15 TCP 70 51652 > http [ACK] Seq=528 Ack=157912 Win=64576 Len=0 TSval=2514856720 TSecr=140346366
137503  47.778796 181.163.75.192 -> 41.177.26.15 TCP 70 51652 > http [ACK] Seq=528 Ack=159360 Win=66048 Len=0 TSval=2514856720 TSecr=140346366
137509  47.780403 181.163.75.192 -> 41.177.26.15 TCP 70 51652 > http [ACK] Seq=528 Ack=162256 Win=64576 Len=0 TSval=2514856720 TSecr=140346366
137517  47.782131 181.163.75.192 -> 41.177.26.15 TCP 70 51652 > http [ACK] Seq=528 Ack=163704 Win=66048 Len=0 TSval=2514856720 TSecr=140346366
137521  47.783770 181.163.75.192 -> 41.177.26.15 TCP 70 51652 > http [ACK] Seq=528 Ack=166104 Win=64576 Len=0 TSval=2514856730 TSecr=140346366
137522  47.784477 181.163.75.192 -> 41.177.26.15 TCP 70 51652 > http [ACK] Seq=528 Ack=167552 Win=66048 Len=0 TSval=2514856730 TSecr=140346366
137530  47.786163 181.163.75.192 -> 41.177.26.15 TCP 70 51652 > http [ACK] Seq=528 Ack=170448 Win=64576 Len=0 TSval=2514856730 TSecr=140346366
137534  47.786807 181.163.75.192 -> 41.177.26.15 TCP 70 51652 > http [ACK] Seq=528 Ack=171896 Win=66048 Len=0 TSval=2514856730 TSecr=140346367
137542  47.788262 181.163.75.192 -> 41.177.26.15 TCP 70 51652 > http [ACK] Seq=528 Ack=174296 Win=64576 Len=0 TSval=2514856730 TSecr=140346367
137552  47.790464 181.163.75.192 -> 41.177.26.15 TCP 70 51652 > http [ACK] Seq=528 Ack=175744 Win=66048 Len=0 TSval=2514856730 TSecr=140346367
137572  47.792815 181.163.75.192 -> 41.177.26.15 TCP 70 51652 > http [ACK] Seq=528 Ack=178640 Win=64576 Len=0 TSval=2514856730 TSecr=140346367
137663  47.816940 181.163.75.192 -> 41.177.26.15 TCP 70 51652 > http [ACK] Seq=528 Ack=180088 Win=66048 Len=0 TSval=2514856750 TSecr=140346370
137667  47.817614 181.163.75.192 -> 41.177.26.15 TCP 70 51652 > http [ACK] Seq=528 Ack=182488 Win=64576 Len=0 TSval=2514856750 TSecr=140346370
137668  47.817618 181.163.75.192 -> 41.177.26.15 TCP 70 51652 > http [ACK] Seq=528 Ack=183936 Win=66048 Len=0 TSval=2514856760 TSecr=140346370
137669  47.817622 181.163.75.192 -> 41.177.26.15 TCP 70 51652 > http [ACK] Seq=528 Ack=186832 Win=64576 Len=0 TSval=2514856760 TSecr=140346370
137676  47.818764 181.163.75.192 -> 41.177.26.15 TCP 70 51652 > http [ACK] Seq=528 Ack=188280 Win=66048 Len=0 TSval=2514856760 TSecr=140346371
137686  47.820241 181.163.75.192 -> 41.177.26.15 TCP 70 51652 > http [ACK] Seq=528 Ack=190680 Win=64576 Len=0 TSval=2514856760 TSecr=140346371
137688  47.820862 181.163.75.192 -> 41.177.26.15 TCP 70 51652 > http [ACK] Seq=528 Ack=192128 Win=66048 Len=0 TSval=2514856760 TSecr=140346371
137707  47.827169 181.163.75.192 -> 41.177.26.15 TCP 70 51652 > http [ACK] Seq=528 Ack=195024 Win=64576 Len=0 TSval=2514856760 TSecr=140346371
137708  47.827174 181.163.75.192 -> 41.177.26.15 TCP 70 51652 > http [ACK] Seq=528 Ack=196472 Win=66048 Len=0 TSval=2514856770 TSecr=140346371
137709  47.827178 181.163.75.192 -> 41.177.26.15 TCP 70 51652 > http [ACK] Seq=528 Ack=199368 Win=64576 Len=0 TSval=2514856770 TSecr=140346371
137714  47.827851 181.163.75.192 -> 41.177.26.15 TCP 70 51652 > http [ACK] Seq=528 Ack=200816 Win=66048 Len=0 TSval=2514856770 TSecr=140346372
137717  47.828311 181.163.75.192 -> 41.177.26.15 TCP 70 51652 > http [ACK] Seq=528 Ack=203216 Win=65088 Len=0 TSval=2514856770 TSecr=140346372
137719  47.830621 181.163.75.192 -> 41.177.26.15 TCP 70 51652 > http [ACK] Seq=528 Ack=206112 Win=64576 Len=0 TSval=2514856770 TSecr=140346372
137724  47.831415 181.163.75.192 -> 41.177.26.15 TCP 70 51652 > http [ACK] Seq=528 Ack=207560 Win=66048 Len=0 TSval=2514856770 TSecr=140346372
137796  47.845060 181.163.75.192 -> 41.177.26.15 TCP 70 51652 > http [ACK] Seq=528 Ack=210456 Win=64576 Len=0 TSval=2514856770 TSecr=140346372
137797  47.845066 181.163.75.192 -> 41.177.26.15 TCP 70 51652 > http [ACK] Seq=528 Ack=212856 Win=64576 Len=0 TSval=2514856780 TSecr=140346373
137800  47.845773 181.163.75.192 -> 41.177.26.15 TCP 70 51652 > http [ACK] Seq=528 Ack=214304 Win=66048 Len=0 TSval=2514856780 TSecr=140346373
137801  47.845777 181.163.75.192 -> 41.177.26.15 TCP 70 51652 > http [ACK] Seq=528 Ack=217200 Win=64576 Len=0 TSval=2514856780 TSecr=140346373
137802  47.845782 181.163.75.192 -> 41.177.26.15 TCP 70 51652 > http [ACK] Seq=528 Ack=218648 Win=66048 Len=0 TSval=2514856780 TSecr=140346373
137809  47.846426 181.163.75.192 -> 41.177.26.15 TCP 70 51652 > http [ACK] Seq=528 Ack=221048 Win=64576 Len=0 TSval=2514856780 TSecr=140346373
137819  47.852722 181.163.75.192 -> 41.177.26.15 TCP 70 51652 > http [ACK] Seq=528 Ack=222496 Win=66048 Len=0 TSval=2514856790 TSecr=140346374
137835  47.855883 181.163.75.192 -> 41.177.26.15 TCP 70 51652 > http [ACK] Seq=528 Ack=225392 Win=64576 Len=0 TSval=2514856790 TSecr=140346374
137838  47.856152 181.163.75.192 -> 41.177.26.15 TCP 70 51652 > http [ACK] Seq=528 Ack=226840 Win=66048 Len=0 TSval=2514856790 TSecr=140346374
137842  47.856373 181.163.75.192 -> 41.177.26.15 TCP 70 51652 > http [ACK] Seq=528 Ack=229240 Win=64576 Len=0 TSval=2514856790 TSecr=140346374
137843  47.857294 181.163.75.192 -> 41.177.26.15 TCP 70 51652 > http [ACK] Seq=528 Ack=230688 Win=66048 Len=0 TSval=2514856790 TSecr=140346374
137850  47.857971 181.163.75.192 -> 41.177.26.15 TCP 70 51652 > http [ACK] Seq=528 Ack=233584 Win=64576 Len=0 TSval=2514856790 TSecr=140346374
137851  47.857993 181.163.75.192 -> 41.177.26.15 TCP 70 51652 > http [ACK] Seq=528 Ack=235032 Win=66048 Len=0 TSval=2514856790 TSecr=140346375
137852  47.858227 181.163.75.192 -> 41.177.26.15 TCP 70 51652 > http [ACK] Seq=528 Ack=237432 Win=64576 Len=0 TSval=2514856800 TSecr=140346375
137858  47.859159 181.163.75.192 -> 41.177.26.15 TCP 70 51652 > http [ACK] Seq=528 Ack=238880 Win=66048 Len=0 TSval=2514856800 TSecr=140346375
137860  47.859324 181.163.75.192 -> 41.177.26.15 TCP 70 51652 > http [ACK] Seq=528 Ack=241776 Win=64576 Len=0 TSval=2514856800 TSecr=140346375
137906  47.880427 181.163.75.192 -> 41.177.26.15 TCP 70 51652 > http [ACK] Seq=528 Ack=243224 Win=66048 Len=0 TSval=2514856820 TSecr=140346378
137912  47.881828 181.163.75.192 -> 41.177.26.15 TCP 70 51652 > http [ACK] Seq=528 Ack=245624 Win=64576 Len=0 TSval=2514856820 TSecr=140346378
137914  47.882447 181.163.75.192 -> 41.177.26.15 TCP 70 51652 > http [ACK] Seq=528 Ack=247072 Win=66048 Len=0 TSval=2514856820 TSecr=140346378
137934  47.884746 181.163.75.192 -> 41.177.26.15 TCP 70 51652 > http [ACK] Seq=528 Ack=249968 Win=64576 Len=0 TSval=2514856830 TSecr=140346378
137935  47.884750 181.163.75.192 -> 41.177.26.15 TCP 70 51652 > http [ACK] Seq=528 Ack=251416 Win=66048 Len=0 TSval=2514856830 TSecr=140346378
137943  47.886318 181.163.75.192 -> 41.177.26.15 TCP 70 51652 > http [ACK] Seq=528 Ack=253816 Win=64576 Len=0 TSval=2514856830 TSecr=140346378
137947  47.888398 181.163.75.192 -> 41.177.26.15 TCP 70 51652 > http [ACK] Seq=528 Ack=255264 Win=66048 Len=0 TSval=2514856830 TSecr=140346378
137954  47.890267 181.163.75.192 -> 41.177.26.15 TCP 70 51652 > http [ACK] Seq=528 Ack=258160 Win=64576 Len=0 TSval=2514856830 TSecr=140346378
137988  47.892659 181.163.75.192 -> 41.177.26.15 TCP 70 51652 > http [ACK] Seq=528 Ack=259608 Win=66048 Len=0 TSval=2514856830 TSecr=140346379
137997  47.893596 181.163.75.192 -> 41.177.26.15 TCP 70 51652 > http [ACK] Seq=528 Ack=262008 Win=64576 Len=0 TSval=2514856840 TSecr=140346379
137999  47.894257 181.163.75.192 -> 41.177.26.15 TCP 70 51652 > http [ACK] Seq=528 Ack=263456 Win=66048 Len=0 TSval=2514856840 TSecr=140346379
138006  47.896194 181.163.75.192 -> 41.177.26.15 TCP 70 51652 > http [ACK] Seq=528 Ack=266352 Win=64576 Len=0 TSval=2514856840 TSecr=140346379
138009  47.896711 181.163.75.192 -> 41.177.26.15 TCP 70 51652 > http [ACK] Seq=528 Ack=267800 Win=66048 Len=0 TSval=2514856840 TSecr=140346379
138013  47.897959 181.163.75.192 -> 41.177.26.15 TCP 70 51652 > http [ACK] Seq=528 Ack=270200 Win=64576 Len=0 TSval=2514856840 TSecr=140346379
138018  47.898695 181.163.75.192 -> 41.177.26.15 TCP 70 51652 > http [ACK] Seq=528 Ack=271648 Win=66048 Len=0 TSval=2514856840 TSecr=140346379
138035  47.906630 181.163.75.192 -> 41.177.26.15 TCP 70 51652 > http [ACK] Seq=528 Ack=274544 Win=64576 Len=0 TSval=2514856850 TSecr=140346379
138040  47.907787 181.163.75.192 -> 41.177.26.15 TCP 70 51652 > http [ACK] Seq=528 Ack=275992 Win=66048 Len=0 TSval=2514856850 TSecr=140346380
138044  47.908640 181.163.75.192 -> 41.177.26.15 TCP 70 51652 > http [ACK] Seq=528 Ack=278392 Win=64576 Len=0 TSval=2514856850 TSecr=140346380
138045  47.909599 181.163.75.192 -> 41.177.26.15 TCP 70 51652 > http [ACK] Seq=528 Ack=279840 Win=66048 Len=0 TSval=2514856850 TSecr=140346380
138057  47.911225 181.163.75.192 -> 41.177.26.15 TCP 70 51652 > http [ACK] Seq=528 Ack=282736 Win=64576 Len=0 TSval=2514856850 TSecr=140346380
138058  47.911943 181.163.75.192 -> 41.177.26.15 TCP 70 51652 > http [ACK] Seq=528 Ack=284184 Win=66048 Len=0 TSval=2514856850 TSecr=140346380
138070  47.915161 181.163.75.192 -> 41.177.26.15 TCP 70 51652 > http [ACK] Seq=528 Ack=286584 Win=64576 Len=0 TSval=2514856860 TSecr=140346381
138074  47.915971 181.163.75.192 -> 41.177.26.15 TCP 70 51652 > http [ACK] Seq=528 Ack=288032 Win=66048 Len=0 TSval=2514856860 TSecr=140346381
138084  47.918392 181.163.75.192 -> 41.177.26.15 TCP 70 51652 > http [ACK] Seq=528 Ack=290928 Win=64576 Len=0 TSval=2514856860 TSecr=140346381
138085  47.919105 181.163.75.192 -> 41.177.26.15 TCP 70 51652 > http [ACK] Seq=528 Ack=292376 Win=66048 Len=0 TSval=2514856860 TSecr=140346382
138093  47.920996 181.163.75.192 -> 41.177.26.15 TCP 70 51652 > http [ACK] Seq=528 Ack=294776 Win=64576 Len=0 TSval=2514856860 TSecr=140346382
138094  47.921695 181.163.75.192 -> 41.177.26.15 TCP 70 51652 > http [ACK] Seq=528 Ack=296224 Win=66048 Len=0 TSval=2514856860 TSecr=140346382
138103  47.923555 181.163.75.192 -> 41.177.26.15 TCP 70 51652 > http [ACK] Seq=528 Ack=299120 Win=64576 Len=0 TSval=2514856870 TSecr=140346382
138107  47.925094 181.163.75.192 -> 41.177.26.15 TCP 70 51652 > http [ACK] Seq=528 Ack=300568 Win=66048 Len=0 TSval=2514856870 TSecr=140346382
138114  47.927278 181.163.75.192 -> 41.177.26.15 TCP 70 51652 > http [ACK] Seq=528 Ack=302968 Win=64576 Len=0 TSval=2514856870 TSecr=140346382
138115  47.927283 181.163.75.192 -> 41.177.26.15 TCP 70 51652 > http [ACK] Seq=528 Ack=304416 Win=66048 Len=0 TSval=2514856870 TSecr=140346382
138175  47.948299 181.163.75.192 -> 41.177.26.15 TCP 70 51652 > http [ACK] Seq=528 Ack=307312 Win=64576 Len=0 TSval=2514856880 TSecr=140346382
138176  47.948303 181.163.75.192 -> 41.177.26.15 TCP 70 51652 > http [ACK] Seq=528 Ack=308760 Win=66048 Len=0 TSval=2514856880 TSecr=140346384
138191  47.954075 181.163.75.192 -> 41.177.26.15 TCP 70 51652 > http [ACK] Seq=528 Ack=311160 Win=64576 Len=0 TSval=2514856890 TSecr=140346384
138194  47.954311 181.163.75.192 -> 41.177.26.15 TCP 70 51652 > http [ACK] Seq=528 Ack=312608 Win=66048 Len=0 TSval=2514856890 TSecr=140346384
138195  47.954315 181.163.75.192 -> 41.177.26.15 TCP 70 51652 > http [ACK] Seq=528 Ack=315504 Win=64576 Len=0 TSval=2514856890 TSecr=140346384
138196  47.954319 181.163.75.192 -> 41.177.26.15 TCP 70 51652 > http [ACK] Seq=528 Ack=316952 Win=66048 Len=0 TSval=2514856890 TSecr=140346384
138203  47.954785 181.163.75.192 -> 41.177.26.15 TCP 70 51652 > http [ACK] Seq=528 Ack=319352 Win=64576 Len=0 TSval=2514856900 TSecr=140346385
138205  47.955685 181.163.75.192 -> 41.177.26.15 TCP 70 51652 > http [ACK] Seq=528 Ack=320800 Win=66048 Len=0 TSval=2514856900 TSecr=140346385
138215  47.958737 181.163.75.192 -> 41.177.26.15 TCP 70 51652 > http [ACK] Seq=528 Ack=323696 Win=64576 Len=0 TSval=2514856900 TSecr=140346385
138218  47.959476 181.163.75.192 -> 41.177.26.15 TCP 70 51652 > http [ACK] Seq=528 Ack=325144 Win=66048 Len=0 TSval=2514856900 TSecr=140346385
138226  47.960980 181.163.75.192 -> 41.177.26.15 TCP 70 51652 > http [ACK] Seq=528 Ack=328040 Win=64576 Len=0 TSval=2514856900 TSecr=140346385
138231  47.962025 181.163.75.192 -> 41.177.26.15 TCP 70 51652 > http [ACK] Seq=528 Ack=329488 Win=66048 Len=0 TSval=2514856900 TSecr=140346385
138235  47.963241 181.163.75.192 -> 41.177.26.15 TCP 70 51652 > http [ACK] Seq=528 Ack=331888 Win=65088 Len=0 TSval=2514856900 TSecr=140346386
138250  47.965080 181.163.75.192 -> 41.177.26.15 TCP 70 51652 > http [ACK] Seq=528 Ack=334784 Win=64576 Len=0 TSval=2514856910 TSecr=140346386
138253  47.966800 181.163.75.192 -> 41.177.26.15 TCP 70 51652 > http [ACK] Seq=528 Ack=336232 Win=66048 Len=0 TSval=2514856910 TSecr=140346386
138261  47.969590 181.163.75.192 -> 41.177.26.15 TCP 70 51652 > http [ACK] Seq=528 Ack=339128 Win=64576 Len=0 TSval=2514856910 TSecr=140346386
138267  47.970941 181.163.75.192 -> 41.177.26.15 TCP 70 51652 > http [ACK] Seq=528 Ack=341528 Win=64576 Len=0 TSval=2514856910 TSecr=140346387
138274  47.971823 181.163.75.192 -> 41.177.26.15 TCP 70 51652 > http [ACK] Seq=528 Ack=342976 Win=66048 Len=0 TSval=2514856910 TSecr=140346387
138297  47.973420 181.163.75.192 -> 41.177.26.15 TCP 70 51652 > http [ACK] Seq=528 Ack=345872 Win=64576 Len=0 TSval=2514856910 TSecr=140346387
138304  47.973879 181.163.75.192 -> 41.177.26.15 TCP 70 51652 > http [ACK] Seq=528 Ack=347320 Win=66048 Len=0 TSval=2514856920 TSecr=140346387
138311  47.975974 181.163.75.192 -> 41.177.26.15 TCP 70 51652 > http [ACK] Seq=528 Ack=349720 Win=64576 Len=0 TSval=2514856920 TSecr=140346387
138315  47.978042 181.163.75.192 -> 41.177.26.15 TCP 70 51652 > http [ACK] Seq=528 Ack=351168 Win=66048 Len=0 TSval=2514856920 TSecr=140346388
138325  47.981786 181.163.75.192 -> 41.177.26.15 TCP 70 51652 > http [ACK] Seq=528 Ack=354064 Win=64576 Len=0 TSval=2514856920 TSecr=140346388
138326  47.981978 181.163.75.192 -> 41.177.26.15 TCP 70 51652 > http [ACK] Seq=528 Ack=355512 Win=66048 Len=0 TSval=2514856920 TSecr=140346388
138340  47.986027 181.163.75.192 -> 41.177.26.15 TCP 70 51652 > http [ACK] Seq=528 Ack=357912 Win=64576 Len=0 TSval=2514856920 TSecr=140346388
138341  47.986032 181.163.75.192 -> 41.177.26.15 TCP 70 51652 > http [ACK] Seq=528 Ack=359360 Win=66048 Len=0 TSval=2514856920 TSecr=140346388
138346  47.986365 181.163.75.192 -> 41.177.26.15 TCP 70 51652 > http [ACK] Seq=528 Ack=362256 Win=64576 Len=0 TSval=2514856930 TSecr=140346388
138348  47.986842 181.163.75.192 -> 41.177.26.15 TCP 70 51652 > http [ACK] Seq=528 Ack=363704 Win=66048 Len=0 TSval=2514856930 TSecr=140346388
138352  47.988080 181.163.75.192 -> 41.177.26.15 TCP 70 51652 > http [ACK] Seq=528 Ack=366104 Win=64576 Len=0 TSval=2514856930 TSecr=140346388
138378  47.993460 181.163.75.192 -> 41.177.26.15 TCP 70 51652 > http [ACK] Seq=528 Ack=367552 Win=66048 Len=0 TSval=2514856930 TSecr=140346389
138386  47.994618 181.163.75.192 -> 41.177.26.15 TCP 70 51652 > http [ACK] Seq=528 Ack=370448 Win=64576 Len=0 TSval=2514856940 TSecr=140346389
138456  48.014144 181.163.75.192 -> 41.177.26.15 TCP 70 51652 > http [ACK] Seq=528 Ack=371896 Win=66048 Len=0 TSval=2514856960 TSecr=140346391
138471  48.015574 181.163.75.192 -> 41.177.26.15 TCP 70 51652 > http [ACK] Seq=528 Ack=374296 Win=64576 Len=0 TSval=2514856960 TSecr=140346391
138535  48.022305 181.163.75.192 -> 41.177.26.15 TCP 70 51652 > http [ACK] Seq=528 Ack=375744 Win=66048 Len=0 TSval=2514856960 TSecr=140346391
138547  48.024212 181.163.75.192 -> 41.177.26.15 TCP 70 51652 > http [ACK] Seq=528 Ack=378640 Win=64576 Len=0 TSval=2514856970 TSecr=140346391
138551  48.024919 181.163.75.192 -> 41.177.26.15 TCP 70 51652 > http [ACK] Seq=528 Ack=380088 Win=66048 Len=0 TSval=2514856970 TSecr=140346391
138558  48.026270 181.163.75.192 -> 41.177.26.15 TCP 70 51652 > http [ACK] Seq=528 Ack=382488 Win=64576 Len=0 TSval=2514856970 TSecr=140346391
138563  48.027007 181.163.75.192 -> 41.177.26.15 TCP 70 51652 > http [ACK] Seq=528 Ack=383936 Win=66048 Len=0 TSval=2514856970 TSecr=140346391
138567  48.028367 181.163.75.192 -> 41.177.26.15 TCP 70 51652 > http [ACK] Seq=528 Ack=386832 Win=64576 Len=0 TSval=2514856970 TSecr=140346391
138573  48.030661 181.163.75.192 -> 41.177.26.15 TCP 70 51652 > http [ACK] Seq=528 Ack=388280 Win=66048 Len=0 TSval=2514856970 TSecr=140346392
138583  48.032358 181.163.75.192 -> 41.177.26.15 TCP 70 51652 > http [ACK] Seq=528 Ack=391176 Win=64576 Len=0 TSval=2514856970 TSecr=140346392
138585  48.032891 181.163.75.192 -> 41.177.26.15 TCP 70 51652 > http [ACK] Seq=528 Ack=392624 Win=66048 Len=0 TSval=2514856970 TSecr=140346392
138596  48.035961 181.163.75.192 -> 41.177.26.15 TCP 70 51652 > http [ACK] Seq=528 Ack=395024 Win=65088 Len=0 TSval=2514856980 TSecr=140346392
138597  48.035966 181.163.75.192 -> 41.177.26.15 TCP 70 51652 > http [ACK] Seq=528 Ack=397920 Win=64576 Len=0 TSval=2514856980 TSecr=140346392
138603  48.036613 181.163.75.192 -> 41.177.26.15 TCP 70 51652 > http [ACK] Seq=528 Ack=399368 Win=66048 Len=0 TSval=2514856980 TSecr=140346393
138608  48.038380 181.163.75.192 -> 41.177.26.15 TCP 70 51652 > http [ACK] Seq=528 Ack=402264 Win=64576 Len=0 TSval=2514856980 TSecr=140346393
138612  48.039570 181.163.75.192 -> 41.177.26.15 TCP 70 51652 > http [ACK] Seq=528 Ack=404664 Win=64576 Len=0 TSval=2514856980 TSecr=140346393
138614  48.040368 181.163.75.192 -> 41.177.26.15 TCP 70 51652 > http [ACK] Seq=528 Ack=406112 Win=66048 Len=0 TSval=2514856980 TSecr=140346393
138624  48.042186 181.163.75.192 -> 41.177.26.15 TCP 70 51652 > http [ACK] Seq=528 Ack=409008 Win=64576 Len=0 TSval=2514856980 TSecr=140346393
138629  48.043192 181.163.75.192 -> 41.177.26.15 TCP 70 51652 > http [ACK] Seq=528 Ack=410456 Win=66048 Len=0 TSval=2514856980 TSecr=140346393
138635  48.044658 181.163.75.192 -> 41.177.26.15 TCP 70 51652 > http [ACK] Seq=528 Ack=412856 Win=64576 Len=0 TSval=2514856990 TSecr=140346393
138642  48.050746 181.163.75.192 -> 41.177.26.15 TCP 70 51652 > http [ACK] Seq=528 Ack=414304 Win=66048 Len=0 TSval=2514856990 TSecr=140346394
138643  48.050751 181.163.75.192 -> 41.177.26.15 TCP 70 51652 > http [ACK] Seq=528 Ack=417200 Win=64576 Len=0 TSval=2514856990 TSecr=140346394
138648  48.052340 181.163.75.192 -> 41.177.26.15 TCP 70 51652 > http [ACK] Seq=528 Ack=418648 Win=66048 Len=0 TSval=2514856990 TSecr=140346394
138657  48.054089 181.163.75.192 -> 41.177.26.15 TCP 70 51652 > http [ACK] Seq=528 Ack=421048 Win=64576 Len=0 TSval=2514857000 TSecr=140346394
138677  48.055033 181.163.75.192 -> 41.177.26.15 TCP 70 51652 > http [ACK] Seq=528 Ack=422496 Win=66048 Len=0 TSval=2514857000 TSecr=140346395
138683  48.056530 181.163.75.192 -> 41.177.26.15 TCP 70 51652 > http [ACK] Seq=528 Ack=425392 Win=64576 Len=0 TSval=2514857000 TSecr=140346395
138687  48.057323 181.163.75.192 -> 41.177.26.15 TCP 70 51652 > http [ACK] Seq=528 Ack=426840 Win=66048 Len=0 TSval=2514857000 TSecr=140346395
138690  48.058750 181.163.75.192 -> 41.177.26.15 TCP 70 51652 > http [ACK] Seq=528 Ack=429240 Win=64576 Len=0 TSval=2514857000 TSecr=140346395
138694  48.059698 181.163.75.192 -> 41.177.26.15 TCP 70 51652 > http [ACK] Seq=528 Ack=430688 Win=66048 Len=0 TSval=2514857000 TSecr=140346395
138702  48.061444 181.163.75.192 -> 41.177.26.15 TCP 70 51652 > http [ACK] Seq=528 Ack=433584 Win=64576 Len=0 TSval=2514857000 TSecr=140346395
138733  48.076404 181.163.75.192 -> 41.177.26.15 TCP 70 51652 > http [ACK] Seq=528 Ack=435032 Win=66048 Len=0 TSval=2514857020 TSecr=140346397
138749  48.084290 181.163.75.192 -> 41.177.26.15 TCP 70 51652 > http [ACK] Seq=528 Ack=437432 Win=64576 Len=0 TSval=2514857020 TSecr=140346397
138750  48.085450 181.163.75.192 -> 41.177.26.15 TCP 70 51652 > http [ACK] Seq=528 Ack=438880 Win=66048 Len=0 TSval=2514857030 TSecr=140346398
138758  48.087111 181.163.75.192 -> 41.177.26.15 TCP 70 51652 > http [ACK] Seq=528 Ack=441776 Win=64576 Len=0 TSval=2514857030 TSecr=140346398
138818  48.093522 181.163.75.192 -> 41.177.26.15 TCP 70 51652 > http [ACK] Seq=528 Ack=443224 Win=66048 Len=0 TSval=2514857030 TSecr=140346398
138821  48.094212 181.163.75.192 -> 41.177.26.15 TCP 70 51652 > http [ACK] Seq=528 Ack=445624 Win=64576 Len=0 TSval=2514857040 TSecr=140346398
138830  48.096404 181.163.75.192 -> 41.177.26.15 TCP 70 51652 > http [ACK] Seq=528 Ack=447072 Win=66048 Len=0 TSval=2514857040 TSecr=140346399
138831  48.096407 181.163.75.192 -> 41.177.26.15 TCP 70 51652 > http [ACK] Seq=528 Ack=449968 Win=64576 Len=0 TSval=2514857040 TSecr=140346399
138838  48.097133 181.163.75.192 -> 41.177.26.15 TCP 70 51652 > http [ACK] Seq=528 Ack=451416 Win=66048 Len=0 TSval=2514857040 TSecr=140346399
138843  48.098515 181.163.75.192 -> 41.177.26.15 TCP 70 51652 > http [ACK] Seq=528 Ack=453816 Win=64576 Len=0 TSval=2514857040 TSecr=140346399
138846  48.099478 181.163.75.192 -> 41.177.26.15 TCP 70 51652 > http [ACK] Seq=528 Ack=455264 Win=66048 Len=0 TSval=2514857040 TSecr=140346399
138873  48.101410 181.163.75.192 -> 41.177.26.15 TCP 70 51652 > http [ACK] Seq=528 Ack=458160 Win=64576 Len=0 TSval=2514857040 TSecr=140346399
138875  48.101689 181.163.75.192 -> 41.177.26.15 TCP 70 51652 > http [ACK] Seq=528 Ack=459608 Win=66048 Len=0 TSval=2514857040 TSecr=140346399
138881  48.103135 181.163.75.192 -> 41.177.26.15 TCP 70 51652 > http [ACK] Seq=528 Ack=462008 Win=64576 Len=0 TSval=2514857040 TSecr=140346400
138883  48.103903 181.163.75.192 -> 41.177.26.15 TCP 70 51652 > http [ACK] Seq=528 Ack=463456 Win=66048 Len=0 TSval=2514857050 TSecr=140346400
138890  48.105557 181.163.75.192 -> 41.177.26.15 TCP 70 51652 > http [ACK] Seq=528 Ack=466352 Win=64576 Len=0 TSval=2514857050 TSecr=140346400
138892  48.106047 181.163.75.192 -> 41.177.26.15 TCP 70 51652 > http [ACK] Seq=528 Ack=467800 Win=66048 Len=0 TSval=2514857050 TSecr=140346400
138903  48.107220 181.163.75.192 -> 41.177.26.15 TCP 70 51652 > http [ACK] Seq=528 Ack=470200 Win=64576 Len=0 TSval=2514857050 TSecr=140346400
138904  48.108302 181.163.75.192 -> 41.177.26.15 TCP 70 51652 > http [ACK] Seq=528 Ack=471648 Win=66048 Len=0 TSval=2514857050 TSecr=140346400
138916  48.113690 181.163.75.192 -> 41.177.26.15 TCP 70 51652 > http [ACK] Seq=528 Ack=474544 Win=64576 Len=0 TSval=2514857050 TSecr=140346400
138917  48.113720 181.163.75.192 -> 41.177.26.15 TCP 70 51652 > http [ACK] Seq=528 Ack=475992 Win=66048 Len=0 TSval=2514857050 TSecr=140346400
138935  48.116809 181.163.75.192 -> 41.177.26.15 TCP 70 51652 > http [ACK] Seq=528 Ack=478392 Win=64576 Len=0 TSval=2514857060 TSecr=140346401
138936  48.116814 181.163.75.192 -> 41.177.26.15 TCP 70 51652 > http [ACK] Seq=528 Ack=479840 Win=66048 Len=0 TSval=2514857060 TSecr=140346401
138940  48.118444 181.163.75.192 -> 41.177.26.15 TCP 70 51652 > http [ACK] Seq=528 Ack=482736 Win=64576 Len=0 TSval=2514857060 TSecr=140346401
138943  48.118941 181.163.75.192 -> 41.177.26.15 TCP 70 51652 > http [ACK] Seq=528 Ack=484184 Win=66048 Len=0 TSval=2514857060 TSecr=140346401
138949  48.120182 181.163.75.192 -> 41.177.26.15 TCP 70 51652 > http [ACK] Seq=528 Ack=486584 Win=64576 Len=0 TSval=2514857060 TSecr=140346401
138950  48.121109 181.163.75.192 -> 41.177.26.15 TCP 70 51652 > http [ACK] Seq=528 Ack=488032 Win=66048 Len=0 TSval=2514857060 TSecr=140346401
138962  48.123761 181.163.75.192 -> 41.177.26.15 TCP 70 51652 > http [ACK] Seq=528 Ack=490928 Win=64576 Len=0 TSval=2514857070 TSecr=140346402
138966  48.124540 181.163.75.192 -> 41.177.26.15 TCP 70 51652 > http [ACK] Seq=528 Ack=492376 Win=66048 Len=0 TSval=2514857070 TSecr=140346402
138974  48.127386 181.163.75.192 -> 41.177.26.15 TCP 70 51652 > http [ACK] Seq=528 Ack=494776 Win=64576 Len=0 TSval=2514857070 TSecr=140346402
138975  48.127943 181.163.75.192 -> 41.177.26.15 TCP 70 51652 > http [ACK] Seq=528 Ack=496224 Win=66048 Len=0 TSval=2514857070 TSecr=140346402
139018  48.138833 181.163.75.192 -> 41.177.26.15 TCP 70 51652 > http [ACK] Seq=528 Ack=499120 Win=64576 Len=0 TSval=2514857080 TSecr=140346402
139019  48.139845 181.163.75.192 -> 41.177.26.15 TCP 70 51652 > http [ACK] Seq=528 Ack=500568 Win=66048 Len=0 TSval=2514857080 TSecr=140346404
139031  48.147801 181.163.75.192 -> 41.177.26.15 TCP 70 51652 > http [ACK] Seq=528 Ack=502968 Win=64576 Len=0 TSval=2514857090 TSecr=140346404
139034  48.148469 181.163.75.192 -> 41.177.26.15 TCP 70 51652 > http [ACK] Seq=528 Ack=504416 Win=66048 Len=0 TSval=2514857090 TSecr=140346404
139069  48.157666 181.163.75.192 -> 41.177.26.15 TCP 70 51652 > http [ACK] Seq=528 Ack=507312 Win=64576 Len=0 TSval=2514857100 TSecr=140346405
139075  48.158485 181.163.75.192 -> 41.177.26.15 TCP 70 51652 > http [ACK] Seq=528 Ack=508760 Win=66048 Len=0 TSval=2514857100 TSecr=140346405
139107  48.165231 181.163.75.192 -> 41.177.26.15 TCP 70 51652 > http [ACK] Seq=528 Ack=511160 Win=64576 Len=0 TSval=2514857110 TSecr=140346406
139111  48.165939 181.163.75.192 -> 41.177.26.15 TCP 70 51652 > http [ACK] Seq=528 Ack=512608 Win=66048 Len=0 TSval=2514857110 TSecr=140346406
139115  48.167697 181.163.75.192 -> 41.177.26.15 TCP 70 51652 > http [ACK] Seq=528 Ack=515504 Win=64576 Len=0 TSval=2514857110 TSecr=140346406
139117  48.168125 181.163.75.192 -> 41.177.26.15 TCP 70 51652 > http [ACK] Seq=528 Ack=516952 Win=66048 Len=0 TSval=2514857110 TSecr=140346406
139128  48.169812 181.163.75.192 -> 41.177.26.15 TCP 70 51652 > http [ACK] Seq=528 Ack=519848 Win=64576 Len=0 TSval=2514857110 TSecr=140346406
139133  48.170677 181.163.75.192 -> 41.177.26.15 TCP 70 51652 > http [ACK] Seq=528 Ack=521296 Win=66048 Len=0 TSval=2514857110 TSecr=140346406
139141  48.173262 181.163.75.192 -> 41.177.26.15 TCP 70 51652 > http [ACK] Seq=528 Ack=523696 Win=65088 Len=0 TSval=2514857110 TSecr=140346406
139145  48.174835 181.163.75.192 -> 41.177.26.15 TCP 70 51652 > http [ACK] Seq=528 Ack=526592 Win=64576 Len=0 TSval=2514857120 TSecr=140346406
139148  48.175508 181.163.75.192 -> 41.177.26.15 TCP 70 51652 > http [ACK] Seq=528 Ack=528040 Win=66048 Len=0 TSval=2514857120 TSecr=140346406
139191  48.176964 181.163.75.192 -> 41.177.26.15 TCP 70 51652 > http [ACK] Seq=528 Ack=530936 Win=64576 Len=0 TSval=2514857120 TSecr=140346406
139205  48.178493 181.163.75.192 -> 41.177.26.15 TCP 70 51652 > http [ACK] Seq=528 Ack=533336 Win=64576 Len=0 TSval=2514857120 TSecr=140346407
139207  48.179656 181.163.75.192 -> 41.177.26.15 TCP 70 51652 > http [ACK] Seq=528 Ack=534784 Win=66048 Len=0 TSval=2514857120 TSecr=140346407
139211  48.181752 181.163.75.192 -> 41.177.26.15 TCP 70 51652 > http [ACK] Seq=528 Ack=537680 Win=64576 Len=0 TSval=2514857120 TSecr=140346407
139212  48.181780 181.163.75.192 -> 41.177.26.15 TCP 70 51652 > http [ACK] Seq=528 Ack=539128 Win=66048 Len=0 TSval=2514857120 TSecr=140346407
139217  48.183233 181.163.75.192 -> 41.177.26.15 TCP 70 51652 > http [ACK] Seq=528 Ack=541528 Win=64576 Len=0 TSval=2514857120 TSecr=140346407
139219  48.184568 181.163.75.192 -> 41.177.26.15 TCP 70 51652 > http [ACK] Seq=528 Ack=542976 Win=66048 Len=0 TSval=2514857130 TSecr=140346408
139226  48.185837 181.163.75.192 -> 41.177.26.15 TCP 70 51652 > http [ACK] Seq=528 Ack=545872 Win=64576 Len=0 TSval=2514857130 TSecr=140346408
139238  48.188882 181.163.75.192 -> 41.177.26.15 TCP 70 51652 > http [ACK] Seq=528 Ack=547320 Win=66048 Len=0 TSval=2514857130 TSecr=140346408
139244  48.189115 181.163.75.192 -> 41.177.26.15 TCP 70 51652 > http [ACK] Seq=528 Ack=549720 Win=64576 Len=0 TSval=2514857130 TSecr=140346408
139248  48.190183 181.163.75.192 -> 41.177.26.15 TCP 70 51652 > http [ACK] Seq=528 Ack=551168 Win=66048 Len=0 TSval=2514857130 TSecr=140346408
139259  48.191905 181.163.75.192 -> 41.177.26.15 TCP 70 51652 > http [ACK] Seq=528 Ack=554064 Win=64576 Len=0 TSval=2514857130 TSecr=140346408
139263  48.192650 181.163.75.192 -> 41.177.26.15 TCP 70 51652 > http [ACK] Seq=528 Ack=555512 Win=66048 Len=0 TSval=2514857130 TSecr=140346408
139270  48.193965 181.163.75.192 -> 41.177.26.15 TCP 70 51652 > http [ACK] Seq=528 Ack=557912 Win=64576 Len=0 TSval=2514857140 TSecr=140346408
139273  48.195397 181.163.75.192 -> 41.177.26.15 TCP 70 51652 > http [ACK] Seq=528 Ack=559360 Win=66048 Len=0 TSval=2514857140 TSecr=140346409
139277  48.196837 181.163.75.192 -> 41.177.26.15 TCP 70 51652 > http [ACK] Seq=528 Ack=562256 Win=64576 Len=0 TSval=2514857140 TSecr=140346409
139351  48.208110 181.163.75.192 -> 41.177.26.15 TCP 70 51652 > http [ACK] Seq=528 Ack=563704 Win=66048 Len=0 TSval=2514857150 TSecr=140346410
139360  48.209468 181.163.75.192 -> 41.177.26.15 TCP 70 51652 > http [ACK] Seq=528 Ack=566104 Win=64576 Len=0 TSval=2514857150 TSecr=140346410
139364  48.210389 181.163.75.192 -> 41.177.26.15 TCP 70 51652 > http [ACK] Seq=528 Ack=567552 Win=66048 Len=0 TSval=2514857150 TSecr=140346411
139375  48.213358 181.163.75.192 -> 41.177.26.15 TCP 70 51652 > http [ACK] Seq=528 Ack=570448 Win=64576 Len=0 TSval=2514857150 TSecr=140346411
139398  48.220509 181.163.75.192 -> 41.177.26.15 TCP 70 51652 > http [ACK] Seq=528 Ack=571896 Win=66048 Len=0 TSval=2514857160 TSecr=140346412
139406  48.221642 181.163.75.192 -> 41.177.26.15 TCP 70 51652 > http [ACK] Seq=528 Ack=574296 Win=64576 Len=0 TSval=2514857160 TSecr=140346412
139484  48.228958 181.163.75.192 -> 41.177.26.15 TCP 70 51652 > http [ACK] Seq=528 Ack=575744 Win=66048 Len=0 TSval=2514857170 TSecr=140346412
