660326 206.289909 186.45.149.67 -> 41.177.98.143 TCP 143 can-dch > vcom-tunnel [PSH, ACK] Seq=1 Ack=1 Win=32886 Len=85
660960 206.336841 186.45.149.67 -> 41.177.98.143 TCP 65 can-dch > vcom-tunnel [PSH, ACK] Seq=86 Ack=12 Win=32885 Len=7
662570 206.504956 186.45.149.67 -> 41.177.98.143 TCP 64 can-dch > vcom-tunnel [ACK] Seq=93 Ack=2532 Win=32917 Len=0
662571 206.505456 186.45.149.67 -> 41.177.98.143 TCP 64 can-dch > vcom-tunnel [ACK] Seq=93 Ack=3792 Win=32917 Len=0
663111 206.698534 186.45.149.67 -> 41.177.98.143 TCP 64 can-dch > vcom-tunnel [ACK] Seq=93 Ack=3906 Win=32903 Len=0
665040 206.933884 186.45.149.67 -> 41.177.98.143 TCP 141 can-dch > vcom-tunnel [PSH, ACK] Seq=93 Ack=3906 Win=32903 Len=83
665609 207.200260 186.45.149.67 -> 41.177.98.143 TCP 64 can-dch > vcom-tunnel [ACK] Seq=176 Ack=5025 Win=32763 Len=0
722467 230.859084 186.45.149.67 -> 41.177.98.143 TCP 71 can-dch > vcom-tunnel [PSH, ACK] Seq=176 Ack=5025 Win=32763 Len=13
722733 231.076330 186.45.149.67 -> 41.177.98.143 TCP 64 can-dch > vcom-tunnel [ACK] Seq=189 Ack=5052 Win=32917 Len=0
725531 232.331497 186.45.149.67 -> 41.177.98.143 TCP 84 can-dch > vcom-tunnel [PSH, ACK] Seq=189 Ack=5052 Win=32917 Len=26
726230 232.581109 186.45.149.67 -> 41.177.98.143 TCP 64 can-dch > vcom-tunnel [ACK] Seq=215 Ack=5126 Win=32908 Len=0
726552 232.715062 186.45.149.67 -> 41.177.98.143 TCP 81 can-dch > vcom-tunnel [PSH, ACK] Seq=215 Ack=5126 Win=32908 Len=23
726710 232.813938 186.45.149.67 -> 41.177.98.143 TCP 626 can-dch > vcom-tunnel [PSH, ACK] Seq=238 Ack=5126 Win=32908 Len=568
727048 233.082749 186.45.149.67 -> 41.177.98.143 TCP 64 can-dch > vcom-tunnel [ACK] Seq=806 Ack=5308 Win=32885 Len=0
727436 233.283410 186.45.149.67 -> 41.177.98.143 TCP 64 can-dch > vcom-tunnel [ACK] Seq=806 Ack=5582 Win=32851 Len=0
727722 233.484025 186.45.149.67 -> 41.177.98.143 TCP 64 can-dch > vcom-tunnel [ACK] Seq=806 Ack=5628 Win=32845 Len=0
728225 233.684688 186.45.149.67 -> 41.177.98.143 TCP 64 can-dch > vcom-tunnel [ACK] Seq=806 Ack=5846 Win=32818 Len=0
735921 234.927058 186.45.149.67 -> 41.177.98.143 TCP 81 can-dch > vcom-tunnel [PSH, ACK] Seq=806 Ack=5846 Win=32818 Len=23
736028 235.023782 186.45.149.67 -> 41.177.98.143 TCP 628 can-dch > vcom-tunnel [PSH, ACK] Seq=829 Ack=5846 Win=32818 Len=570
736240 235.289853 186.45.149.67 -> 41.177.98.143 TCP 64 can-dch > vcom-tunnel [ACK] Seq=1399 Ack=6026 Win=32795 Len=0
736477 235.490419 186.45.149.67 -> 41.177.98.143 TCP 64 can-dch > vcom-tunnel [ACK] Seq=1399 Ack=6300 Win=32761 Len=0
737824 235.691060 186.45.149.67 -> 41.177.98.143 TCP 64 can-dch > vcom-tunnel [ACK] Seq=1399 Ack=6564 Win=32917 Len=0
740895 236.605683 186.45.149.67 -> 41.177.98.143 TCP 81 can-dch > vcom-tunnel [PSH, ACK] Seq=1399 Ack=6564 Win=32917 Len=23
741036 236.703672 186.45.149.67 -> 41.177.98.143 TCP 570 can-dch > vcom-tunnel [PSH, ACK] Seq=1422 Ack=6564 Win=32917 Len=512
741383 236.894960 186.45.149.67 -> 41.177.98.143 TCP 64 can-dch > vcom-tunnel [ACK] Seq=1934 Ack=6742 Win=32895 Len=0
741717 237.095596 186.45.149.67 -> 41.177.98.143 TCP 64 can-dch > vcom-tunnel [ACK] Seq=1934 Ack=6856 Win=32881 Len=0
742049 237.296189 186.45.149.67 -> 41.177.98.143 TCP 64 can-dch > vcom-tunnel [ACK] Seq=1934 Ack=6894 Win=32876 Len=0
744800 238.098758 186.45.149.67 -> 41.177.98.143 TCP 64 can-dch > vcom-tunnel [ACK] Seq=1934 Ack=6932 Win=32871 Len=0
749900 240.406121 186.45.149.67 -> 41.177.98.143 TCP 64 can-dch > vcom-tunnel [ACK] Seq=1934 Ack=6970 Win=32866 Len=0
757737 244.017640 186.45.149.67 -> 41.177.98.143 TCP 64 can-dch > vcom-tunnel [ACK] Seq=1934 Ack=7008 Win=32862 Len=0
766648 247.829860 186.45.149.67 -> 41.177.98.143 TCP 64 can-dch > vcom-tunnel [ACK] Seq=1934 Ack=7046 Win=32857 Len=0
776215 249.936521 186.45.149.67 -> 41.177.98.143 TCP 64 can-dch > vcom-tunnel [ACK] Seq=1934 Ack=7084 Win=32852 Len=0
779706 251.742308 186.45.149.67 -> 41.177.98.143 TCP 64 can-dch > vcom-tunnel [ACK] Seq=1934 Ack=7122 Win=32847 Len=0
782383 253.146762 186.45.149.67 -> 41.177.98.143 TCP 64 can-dch > vcom-tunnel [ACK] Seq=1934 Ack=7161 Win=32842 Len=0
784232 254.049587 186.45.149.67 -> 41.177.98.143 TCP 64 can-dch > vcom-tunnel [ACK] Seq=1934 Ack=7200 Win=32838 Len=0
785916 254.852192 186.45.149.67 -> 41.177.98.143 TCP 64 can-dch > vcom-tunnel [ACK] Seq=1934 Ack=7221 Win=32835 Len=0
786163 255.052896 186.45.149.67 -> 41.177.98.143 TCP 64 can-dch > vcom-tunnel [ACK] Seq=1934 Ack=7297 Win=32825 Len=0
787982 255.855369 186.45.149.67 -> 41.177.98.143 TCP 64 can-dch > vcom-tunnel [ACK] Seq=1934 Ack=7381 Win=32815 Len=0
796474 259.767874 186.45.149.67 -> 41.177.98.143 TCP 64 can-dch > vcom-tunnel [ACK] Seq=1934 Ack=7412 Win=32811 Len=0
808192 263.780723 186.45.149.67 -> 41.177.98.143 TCP 64 can-dch > vcom-tunnel [ACK] Seq=1934 Ack=7443 Win=32807 Len=0
820654 267.793492 186.45.149.67 -> 41.177.98.143 TCP 64 can-dch > vcom-tunnel [ACK] Seq=1934 Ack=7474 Win=32803 Len=0
831304 271.806321 186.45.149.67 -> 41.177.98.143 TCP 64 can-dch > vcom-tunnel [ACK] Seq=1934 Ack=7505 Win=32799 Len=0
840927 275.819114 186.45.149.67 -> 41.177.98.143 TCP 64 can-dch > vcom-tunnel [ACK] Seq=1934 Ack=7536 Win=32796 Len=0
847571 279.832019 186.45.149.67 -> 41.177.98.143 TCP 64 can-dch > vcom-tunnel [ACK] Seq=1934 Ack=7568 Win=32792 Len=0
860346 283.844773 186.45.149.67 -> 41.177.98.143 TCP 64 can-dch > vcom-tunnel [ACK] Seq=1934 Ack=7600 Win=32788 Len=0
870165 287.757204 186.45.149.67 -> 41.177.98.143 TCP 64 can-dch > vcom-tunnel [ACK] Seq=1934 Ack=7633 Win=32783 Len=0
878539 291.770037 186.45.149.67 -> 41.177.98.143 TCP 64 can-dch > vcom-tunnel [ACK] Seq=1934 Ack=7666 Win=32779 Len=0
893796 295.782832 186.45.149.67 -> 41.177.98.143 TCP 64 can-dch > vcom-tunnel [ACK] Seq=1934 Ack=7699 Win=32775 Len=0
908534 299.795656 186.45.149.67 -> 41.177.98.143 TCP 64 can-dch > vcom-tunnel [ACK] Seq=1934 Ack=7732 Win=32771 Len=0
915704 303.808598 186.45.149.67 -> 41.177.98.143 TCP 64 can-dch > vcom-tunnel [ACK] Seq=1934 Ack=7765 Win=32767 Len=0
925083 307.821285 186.45.149.67 -> 41.177.98.143 TCP 64 can-dch > vcom-tunnel [ACK] Seq=1934 Ack=7798 Win=32763 Len=0
936089 311.834020 186.45.149.67 -> 41.177.98.143 TCP 64 can-dch > vcom-tunnel [ACK] Seq=1934 Ack=7831 Win=32917 Len=0
952375 315.846895 186.45.149.67 -> 41.177.98.143 TCP 64 can-dch > vcom-tunnel [ACK] Seq=1934 Ack=7864 Win=32913 Len=0
961929 319.759328 186.45.149.67 -> 41.177.98.143 TCP 64 can-dch > vcom-tunnel [ACK] Seq=1934 Ack=7898 Win=32909 Len=0
970710 323.772162 186.45.149.67 -> 41.177.98.143 TCP 64 can-dch > vcom-tunnel [ACK] Seq=1934 Ack=7932 Win=32904 Len=0
981335 327.784968 186.45.149.67 -> 41.177.98.143 TCP 64 can-dch > vcom-tunnel [ACK] Seq=1934 Ack=7966 Win=32900 Len=0
994251 331.797819 186.45.149.67 -> 41.177.98.143 TCP 64 can-dch > vcom-tunnel [ACK] Seq=1934 Ack=8000 Win=32896 Len=0
1001971 335.810599 186.45.149.67 -> 41.177.98.143 TCP 64 can-dch > vcom-tunnel [ACK] Seq=1934 Ack=8034 Win=32892 Len=0
1012075 339.824791 186.45.149.67 -> 41.177.98.143 TCP 64 can-dch > vcom-tunnel [ACK] Seq=1934 Ack=8068 Win=32887 Len=0
1019407 343.836201 186.45.149.67 -> 41.177.98.143 TCP 64 can-dch > vcom-tunnel [ACK] Seq=1934 Ack=8102 Win=32883 Len=0
