50329  20.494010 186.210.249.155 -> 41.177.26.46 TCP 66 24611 > http [SYN] Seq=0 Win=65535 Len=0 MSS=1460 SACK_PERM=1
50585  20.623658 186.210.249.155 -> 41.177.26.46 TCP 64 24611 > http [ACK] Seq=1 Ack=1 Win=65535 Len=0
50765  20.766034 186.210.249.155 -> 41.177.26.46 TCP 64 24611 > http [ACK] Seq=505 Ack=1741 Win=65535 Len=0
50770  20.769253 186.210.249.155 -> 41.177.26.46 TCP 64 24611 > http [ACK] Seq=505 Ack=3201 Win=65535 Len=0
50932  20.902760 186.210.249.155 -> 41.177.26.46 TCP 64 24611 > http [ACK] Seq=505 Ack=6121 Win=65535 Len=0
50944  20.909443 186.210.249.155 -> 41.177.26.46 TCP 64 24611 > http [ACK] Seq=505 Ack=8473 Win=65535 Len=0
50954  20.912998 186.210.249.155 -> 41.177.26.46 TCP 64 24611 > http [ACK] Seq=505 Ack=9933 Win=65535 Len=0
51246  21.039128 186.210.249.155 -> 41.177.26.46 TCP 64 24611 > http [ACK] Seq=505 Ack=12853 Win=65535 Len=0
51266  21.047168 186.210.249.155 -> 41.177.26.46 TCP 64 24611 > http [ACK] Seq=505 Ack=15773 Win=65535 Len=0
51276  21.052339 186.210.249.155 -> 41.177.26.46 TCP 64 24611 > http [ACK] Seq=505 Ack=18125 Win=65535 Len=0
51301  21.059396 186.210.249.155 -> 41.177.26.46 TCP 64 24611 > http [ACK] Seq=505 Ack=21045 Win=65535 Len=0
51539  21.175787 186.210.249.155 -> 41.177.26.46 TCP 64 24611 > http [ACK] Seq=505 Ack=23965 Win=65535 Len=0
51554  21.181956 186.210.249.155 -> 41.177.26.46 TCP 64 24611 > http [ACK] Seq=505 Ack=26317 Win=65535 Len=0
51558  21.188818 186.210.249.155 -> 41.177.26.46 TCP 64 24611 > http [ACK] Seq=505 Ack=29237 Win=65535 Len=0
51569  21.195462 186.210.249.155 -> 41.177.26.46 TCP 64 24611 > http [ACK] Seq=505 Ack=32157 Win=65535 Len=0
51578  21.200605 186.210.249.155 -> 41.177.26.46 TCP 64 24611 > http [ACK] Seq=505 Ack=34509 Win=65535 Len=0
51593  21.207513 186.210.249.155 -> 41.177.26.46 TCP 64 24611 > http [ACK] Seq=505 Ack=37429 Win=65535 Len=0
51761  21.312135 186.210.249.155 -> 41.177.26.46 TCP 64 24611 > http [ACK] Seq=505 Ack=40349 Win=65535 Len=0
51770  21.317885 186.210.249.155 -> 41.177.26.46 TCP 64 24611 > http [ACK] Seq=505 Ack=42701 Win=65535 Len=0
51778  21.324750 186.210.249.155 -> 41.177.26.46 TCP 64 24611 > http [ACK] Seq=505 Ack=45621 Win=65535 Len=0
51791  21.331368 186.210.249.155 -> 41.177.26.46 TCP 64 24611 > http [ACK] Seq=505 Ack=48541 Win=65535 Len=0
51819  21.336813 186.210.249.155 -> 41.177.26.46 TCP 64 24611 > http [ACK] Seq=505 Ack=50893 Win=63183 Len=0
51825  21.343498 186.210.249.155 -> 41.177.26.46 TCP 64 24611 > http [ACK] Seq=505 Ack=53813 Win=60263 Len=0
51840  21.349917 186.210.249.155 -> 41.177.26.46 TCP 64 24611 > http [ACK] Seq=505 Ack=56733 Win=57343 Len=0
51844  21.355549 186.210.249.155 -> 41.177.26.46 TCP 64 24611 > http [ACK] Seq=505 Ack=59085 Win=54991 Len=0
51875  21.362229 186.210.249.155 -> 41.177.26.46 TCP 64 24611 > http [ACK] Seq=505 Ack=62005 Win=52071 Len=0
52074  21.445572 186.210.249.155 -> 41.177.26.46 TCP 64 24611 > http [ACK] Seq=505 Ack=64925 Win=49151 Len=0
52091  21.451867 186.210.249.155 -> 41.177.26.46 TCP 64 24611 > http [ACK] Seq=505 Ack=67277 Win=46799 Len=0
52096  21.458299 186.210.249.155 -> 41.177.26.46 TCP 64 24611 > http [ACK] Seq=505 Ack=70197 Win=43879 Len=0
52148  21.465481 186.210.249.155 -> 41.177.26.46 TCP 64 24611 > http [ACK] Seq=505 Ack=73117 Win=40959 Len=0
52154  21.470534 186.210.249.155 -> 41.177.26.46 TCP 64 24611 > http [ACK] Seq=505 Ack=75469 Win=38607 Len=0
52168  21.477615 186.210.249.155 -> 41.177.26.46 TCP 64 24611 > http [ACK] Seq=505 Ack=78389 Win=35687 Len=0
52179  21.484468 186.210.249.155 -> 41.177.26.46 TCP 64 24611 > http [ACK] Seq=505 Ack=81309 Win=32767 Len=0
52189  21.489639 186.210.249.155 -> 41.177.26.46 TCP 64 24611 > http [ACK] Seq=505 Ack=83661 Win=30415 Len=0
52199  21.495759 186.210.249.155 -> 41.177.26.46 TCP 64 24611 > http [ACK] Seq=505 Ack=86369 Win=27707 Len=0
52808  22.049160 186.210.249.155 -> 41.177.26.46 TCP 64 [TCP Window Update] 24611 > http [ACK] Seq=505 Ack=86369 Win=32359 Len=0
52809  22.049869 186.210.249.155 -> 41.177.26.46 TCP 64 [TCP Window Update] 24611 > http [ACK] Seq=505 Ack=86369 Win=65535 Len=0
93825  35.764862 186.210.249.155 -> 41.177.26.46 TCP 64 24611 > http [ACK] Seq=505 Ack=86370 Win=65535 Len=0
93829  35.765509 186.210.249.155 -> 41.177.26.46 TCP 64 24611 > http [FIN, ACK] Seq=505 Ack=86370 Win=65535 Len=0
