521174 168.728196 188.68.72.41 -> 244.3.160.239 TCP 66 http > 34602 [SYN, ACK] Seq=0 Ack=1 Win=49640 Len=0 MSS=1460 SACK_PERM=1
521260 168.805585 188.68.72.41 -> 244.3.160.239 TCP 64 http > 34602 [ACK] Seq=1 Ack=1170 Win=48471 Len=0
521781 169.065352 188.68.72.41 -> 244.3.160.239 TCP 64 http > 34602 [ACK] Seq=600 Ack=1171 Win=48471 Len=0
521782 169.065462 188.68.72.41 -> 244.3.160.239 TCP 64 http > 34602 [FIN, ACK] Seq=600 Ack=1171 Win=48471 Len=0
521786 169.075686 188.68.72.41 -> 244.3.160.239 TCP 66 http > 34605 [SYN, ACK] Seq=0 Ack=1 Win=49640 Len=0 MSS=1460 SACK_PERM=1
521854 169.153597 188.68.72.41 -> 244.3.160.239 TCP 64 http > 34605 [ACK] Seq=1 Ack=1208 Win=48433 Len=0
524810 170.467163 188.68.72.41 -> 244.3.160.239 TCP 64 http > 34605 [ACK] Seq=28102 Ack=1209 Win=48433 Len=0
524819 170.467349 188.68.72.41 -> 244.3.160.239 TCP 64 http > 34605 [FIN, ACK] Seq=28102 Ack=1209 Win=48433 Len=0
524923 170.477004 188.68.72.41 -> 244.3.160.239 TCP 66 http > 34625 [SYN, ACK] Seq=0 Ack=1 Win=49640 Len=0 MSS=1460 SACK_PERM=1
525351 170.552783 188.68.72.41 -> 244.3.160.239 TCP 64 http > 34625 [ACK] Seq=1 Ack=919 Win=48722 Len=0
528331 171.622747 188.68.72.41 -> 244.3.160.239 TCP 66 http > 34632 [SYN, ACK] Seq=0 Ack=1 Win=49640 Len=0 MSS=1460 SACK_PERM=1
528386 171.666545 188.68.72.41 -> 244.3.160.239 TCP 64 http > 34625 [ACK] Seq=54436 Ack=920 Win=48722 Len=0
528389 171.667023 188.68.72.41 -> 244.3.160.239 TCP 64 http > 34625 [FIN, ACK] Seq=54436 Ack=920 Win=48722 Len=0
528466 171.699143 188.68.72.41 -> 244.3.160.239 TCP 64 http > 34632 [ACK] Seq=1 Ack=917 Win=48724 Len=0
528973 171.886872 188.68.72.41 -> 244.3.160.239 TCP 64 http > 34632 [ACK] Seq=356 Ack=918 Win=48724 Len=0
528974 171.887425 188.68.72.41 -> 244.3.160.239 TCP 64 http > 34632 [FIN, ACK] Seq=356 Ack=918 Win=48724 Len=0
529008 171.904508 188.68.72.41 -> 244.3.160.239 TCP 66 http > 34641 [SYN, ACK] Seq=0 Ack=1 Win=49640 Len=0 MSS=1460 SACK_PERM=1
529010 171.904805 188.68.72.41 -> 244.3.160.239 TCP 66 http > 34642 [SYN, ACK] Seq=0 Ack=1 Win=49640 Len=0 MSS=1460 SACK_PERM=1
529337 171.981758 188.68.72.41 -> 244.3.160.239 TCP 64 http > 34641 [ACK] Seq=1 Ack=925 Win=49640 Len=0
529338 171.981873 188.68.72.41 -> 244.3.160.239 TCP 64 http > 34642 [ACK] Seq=1 Ack=928 Win=48713 Len=0
529853 172.107127 188.68.72.41 -> 244.3.160.239 TCP 64 http > 34641 [ACK] Seq=393 Ack=926 Win=49640 Len=0
529855 172.107486 188.68.72.41 -> 244.3.160.239 TCP 64 http > 34642 [ACK] Seq=498 Ack=929 Win=49640 Len=0
529856 172.107491 188.68.72.41 -> 244.3.160.239 TCP 64 http > 34641 [FIN, ACK] Seq=393 Ack=926 Win=49640 Len=0
529859 172.107589 188.68.72.41 -> 244.3.160.239 TCP 64 http > 34642 [FIN, ACK] Seq=498 Ack=929 Win=49640 Len=0
529891 172.123328 188.68.72.41 -> 244.3.160.239 TCP 66 http > 34653 [SYN, ACK] Seq=0 Ack=1 Win=49640 Len=0 MSS=1460 SACK_PERM=1
529905 172.127281 188.68.72.41 -> 244.3.160.239 TCP 66 http > 34654 [SYN, ACK] Seq=0 Ack=1 Win=49640 Len=0 MSS=1460 SACK_PERM=1
530116 172.200397 188.68.72.41 -> 244.3.160.239 TCP 64 http > 34653 [ACK] Seq=1 Ack=915 Win=48726 Len=0
530122 172.202939 188.68.72.41 -> 244.3.160.239 TCP 64 http > 34654 [ACK] Seq=1 Ack=927 Win=48714 Len=0
531174 172.324877 188.68.72.41 -> 244.3.160.239 TCP 64 http > 34654 [ACK] Seq=1932 Ack=928 Win=49640 Len=0
531179 172.325285 188.68.72.41 -> 244.3.160.239 TCP 64 http > 34654 [FIN, ACK] Seq=1932 Ack=928 Win=49640 Len=0
531300 172.343457 188.68.72.41 -> 244.3.160.239 TCP 66 http > 34657 [SYN, ACK] Seq=0 Ack=1 Win=49640 Len=0 MSS=1460 SACK_PERM=1
531346 172.361321 188.68.72.41 -> 244.3.160.239 TCP 66 http > 34658 [SYN, ACK] Seq=0 Ack=1 Win=49640 Len=0 MSS=1460 SACK_PERM=1
531568 172.420980 188.68.72.41 -> 244.3.160.239 TCP 64 http > 34657 [ACK] Seq=1 Ack=937 Win=48704 Len=0
531611 172.427292 188.68.72.41 -> 244.3.160.239 TCP 64 http > 34653 [ACK] Seq=12550 Ack=916 Win=48726 Len=0
531614 172.427684 188.68.72.41 -> 244.3.160.239 TCP 64 http > 34653 [FIN, ACK] Seq=12550 Ack=916 Win=48726 Len=0
531702 172.437533 188.68.72.41 -> 244.3.160.239 TCP 64 http > 34658 [ACK] Seq=1 Ack=937 Win=48704 Len=0
532495 172.685329 188.68.72.41 -> 244.3.160.239 TCP 66 http > 34660 [SYN, ACK] Seq=0 Ack=1 Win=49640 Len=0 MSS=1460 SACK_PERM=1
532702 172.761722 188.68.72.41 -> 244.3.160.239 TCP 64 http > 34660 [ACK] Seq=1 Ack=937 Win=48704 Len=0
532724 172.776087 188.68.72.41 -> 244.3.160.239 TCP 64 http > 34657 [ACK] Seq=11757 Ack=938 Win=48704 Len=0
532725 172.776473 188.68.72.41 -> 244.3.160.239 TCP 64 http > 34657 [FIN, ACK] Seq=11757 Ack=938 Win=48704 Len=0
532745 172.800498 188.68.72.41 -> 244.3.160.239 TCP 66 http > 34661 [SYN, ACK] Seq=0 Ack=1 Win=49640 Len=0 MSS=1460 SACK_PERM=1
533062 172.877980 188.68.72.41 -> 244.3.160.239 TCP 64 http > 34661 [ACK] Seq=1 Ack=936 Win=48705 Len=0
533096 172.886219 188.68.72.41 -> 244.3.160.239 TCP 64 http > 34658 [ACK] Seq=6742 Ack=938 Win=48704 Len=0
533100 172.886540 188.68.72.41 -> 244.3.160.239 TCP 64 http > 34658 [FIN, ACK] Seq=6742 Ack=938 Win=48704 Len=0
533701 173.026597 188.68.72.41 -> 244.3.160.239 TCP 64 http > 34660 [ACK] Seq=4592 Ack=938 Win=48704 Len=0
533702 173.026631 188.68.72.41 -> 244.3.160.239 TCP 64 http > 34660 [FIN, ACK] Seq=4592 Ack=938 Win=48704 Len=0
533731 173.040906 188.68.72.41 -> 244.3.160.239 TCP 66 http > 34665 [SYN, ACK] Seq=0 Ack=1 Win=49640 Len=0 MSS=1460 SACK_PERM=1
533733 173.041231 188.68.72.41 -> 244.3.160.239 TCP 66 http > 34666 [SYN, ACK] Seq=0 Ack=1 Win=49640 Len=0 MSS=1460 SACK_PERM=1
533978 173.116948 188.68.72.41 -> 244.3.160.239 TCP 64 http > 34666 [ACK] Seq=1 Ack=930 Win=48711 Len=0
533979 173.117008 188.68.72.41 -> 244.3.160.239 TCP 64 http > 34665 [ACK] Seq=1 Ack=923 Win=48718 Len=0
534099 173.137598 188.68.72.41 -> 244.3.160.239 TCP 64 http > 34661 [ACK] Seq=517 Ack=937 Win=48705 Len=0
534102 173.138034 188.68.72.41 -> 244.3.160.239 TCP 64 http > 34661 [FIN, ACK] Seq=517 Ack=937 Win=48705 Len=0
535189 173.307781 188.68.72.41 -> 244.3.160.239 TCP 64 http > 34666 [ACK] Seq=6449 Ack=931 Win=49640 Len=0
535194 173.308151 188.68.72.41 -> 244.3.160.239 TCP 64 http > 34666 [FIN, ACK] Seq=6449 Ack=931 Win=49640 Len=0
535643 173.413329 188.68.72.41 -> 244.3.160.239 TCP 66 http > 34671 [SYN, ACK] Seq=0 Ack=1 Win=49640 Len=0 MSS=1460 SACK_PERM=1
535874 173.485618 188.68.72.41 -> 244.3.160.239 TCP 64 http > 34665 [ACK] Seq=14693 Ack=924 Win=48718 Len=0
535875 173.485915 188.68.72.41 -> 244.3.160.239 TCP 64 http > 34665 [FIN, ACK] Seq=14693 Ack=924 Win=48718 Len=0
535921 173.490227 188.68.72.41 -> 244.3.160.239 TCP 64 http > 34671 [ACK] Seq=1 Ack=928 Win=48713 Len=0
536383 173.702179 188.68.72.41 -> 244.3.160.239 TCP 66 http > 34674 [SYN, ACK] Seq=0 Ack=1 Win=49640 Len=0 MSS=1460 SACK_PERM=1
536785 173.766134 188.68.72.41 -> 244.3.160.239 TCP 64 http > 34671 [ACK] Seq=8754 Ack=929 Win=48713 Len=0
536786 173.766314 188.68.72.41 -> 244.3.160.239 TCP 64 http > 34671 [FIN, ACK] Seq=8754 Ack=929 Win=48713 Len=0
536824 173.778012 188.68.72.41 -> 244.3.160.239 TCP 64 http > 34674 [ACK] Seq=1 Ack=921 Win=48720 Len=0
537627 174.028565 188.68.72.41 -> 244.3.160.239 TCP 64 http > 34674 [ACK] Seq=15332 Ack=922 Win=48720 Len=0
537628 174.028865 188.68.72.41 -> 244.3.160.239 TCP 64 http > 34674 [FIN, ACK] Seq=15332 Ack=922 Win=48720 Len=0
537727 174.073548 188.68.72.41 -> 244.3.160.239 TCP 66 http > 34678 [SYN, ACK] Seq=0 Ack=1 Win=49640 Len=0 MSS=1460 SACK_PERM=1
537887 174.150189 188.68.72.41 -> 244.3.160.239 TCP 64 http > 34678 [ACK] Seq=1 Ack=924 Win=48717 Len=0
538256 174.356276 188.68.72.41 -> 244.3.160.239 TCP 64 http > 34678 [ACK] Seq=2150 Ack=925 Win=48717 Len=0
538257 174.356412 188.68.72.41 -> 244.3.160.239 TCP 64 http > 34678 [FIN, ACK] Seq=2150 Ack=925 Win=48717 Len=0
538471 174.453644 188.68.72.41 -> 244.3.160.239 TCP 66 http > 34686 [SYN, ACK] Seq=0 Ack=1 Win=49640 Len=0 MSS=1460 SACK_PERM=1
538474 174.454220 188.68.72.41 -> 244.3.160.239 TCP 66 http > 34687 [SYN, ACK] Seq=0 Ack=1 Win=49640 Len=0 MSS=1460 SACK_PERM=1
538616 174.530093 188.68.72.41 -> 244.3.160.239 TCP 64 http > 34686 [ACK] Seq=1 Ack=924 Win=48717 Len=0
538617 174.530233 188.68.72.41 -> 244.3.160.239 TCP 64 http > 34687 [ACK] Seq=1 Ack=921 Win=48720 Len=0
539043 174.717045 188.68.72.41 -> 244.3.160.239 TCP 66 http > 34690 [SYN, ACK] Seq=0 Ack=1 Win=49640 Len=0 MSS=1460 SACK_PERM=1
539046 174.717852 188.68.72.41 -> 244.3.160.239 TCP 66 http > 34691 [SYN, ACK] Seq=0 Ack=1 Win=49640 Len=0 MSS=1460 SACK_PERM=1
539247 174.793194 188.68.72.41 -> 244.3.160.239 TCP 64 http > 34690 [ACK] Seq=1 Ack=922 Win=48719 Len=0
539248 174.793664 188.68.72.41 -> 244.3.160.239 TCP 64 http > 34691 [ACK] Seq=1 Ack=924 Win=48717 Len=0
539313 174.817108 188.68.72.41 -> 244.3.160.239 TCP 64 http > 34687 [ACK] Seq=2177 Ack=922 Win=49640 Len=0
539314 174.817296 188.68.72.41 -> 244.3.160.239 TCP 64 http > 34686 [ACK] Seq=2559 Ack=925 Win=48717 Len=0
539315 174.817424 188.68.72.41 -> 244.3.160.239 TCP 64 http > 34687 [FIN, ACK] Seq=2177 Ack=922 Win=49640 Len=0
539317 174.817552 188.68.72.41 -> 244.3.160.239 TCP 64 http > 34686 [FIN, ACK] Seq=2559 Ack=925 Win=48717 Len=0
539600 174.975033 188.68.72.41 -> 244.3.160.239 TCP 66 http > 34694 [SYN, ACK] Seq=0 Ack=1 Win=49640 Len=0 MSS=1460 SACK_PERM=1
539605 174.976530 188.68.72.41 -> 244.3.160.239 TCP 66 http > 34695 [SYN, ACK] Seq=0 Ack=1 Win=49640 Len=0 MSS=1460 SACK_PERM=1
539755 175.050691 188.68.72.41 -> 244.3.160.239 TCP 64 http > 34694 [ACK] Seq=1 Ack=911 Win=48730 Len=0
539756 175.052486 188.68.72.41 -> 244.3.160.239 TCP 64 http > 34695 [ACK] Seq=1 Ack=927 Win=48714 Len=0
539771 175.076272 188.68.72.41 -> 244.3.160.239 TCP 64 http > 34690 [ACK] Seq=866 Ack=923 Win=48719 Len=0
539772 175.076785 188.68.72.41 -> 244.3.160.239 TCP 64 http > 34690 [FIN, ACK] Seq=866 Ack=923 Win=48719 Len=0
539773 175.076790 188.68.72.41 -> 244.3.160.239 TCP 64 http > 34691 [ACK] Seq=1556 Ack=925 Win=48717 Len=0
539775 175.076941 188.68.72.41 -> 244.3.160.239 TCP 64 http > 34691 [FIN, ACK] Seq=1556 Ack=925 Win=48717 Len=0
539982 175.195834 188.68.72.41 -> 244.3.160.239 TCP 66 http > 34696 [SYN, ACK] Seq=0 Ack=1 Win=49640 Len=0 MSS=1460 SACK_PERM=1
539985 175.196801 188.68.72.41 -> 244.3.160.239 TCP 66 http > 34697 [SYN, ACK] Seq=0 Ack=1 Win=49640 Len=0 MSS=1460 SACK_PERM=1
540066 175.271869 188.68.72.41 -> 244.3.160.239 TCP 64 http > 34696 [ACK] Seq=1 Ack=922 Win=48719 Len=0
540067 175.272537 188.68.72.41 -> 244.3.160.239 TCP 64 http > 34697 [ACK] Seq=1 Ack=922 Win=48719 Len=0
540107 175.296117 188.68.72.41 -> 244.3.160.239 TCP 64 http > 34694 [ACK] Seq=384 Ack=912 Win=48730 Len=0
540108 175.296197 188.68.72.41 -> 244.3.160.239 TCP 64 http > 34694 [FIN, ACK] Seq=384 Ack=912 Win=48730 Len=0
540110 175.296563 188.68.72.41 -> 244.3.160.239 TCP 64 http > 34695 [ACK] Seq=392 Ack=928 Win=48714 Len=0
540111 175.296846 188.68.72.41 -> 244.3.160.239 TCP 64 http > 34695 [FIN, ACK] Seq=392 Ack=928 Win=48714 Len=0
540398 175.415125 188.68.72.41 -> 244.3.160.239 TCP 66 http > 34698 [SYN, ACK] Seq=0 Ack=1 Win=49640 Len=0 MSS=1460 SACK_PERM=1
540402 175.416736 188.68.72.41 -> 244.3.160.239 TCP 66 http > 34699 [SYN, ACK] Seq=0 Ack=1 Win=49640 Len=0 MSS=1460 SACK_PERM=1
540444 175.445255 188.68.72.41 -> 244.3.160.239 TCP 64 http > 34696 [ACK] Seq=488 Ack=923 Win=48719 Len=0
540445 175.445722 188.68.72.41 -> 244.3.160.239 TCP 64 http > 34696 [FIN, ACK] Seq=488 Ack=923 Win=48719 Len=0
540446 175.445727 188.68.72.41 -> 244.3.160.239 TCP 64 http > 34697 [ACK] Seq=487 Ack=923 Win=48719 Len=0
540448 175.446196 188.68.72.41 -> 244.3.160.239 TCP 64 http > 34697 [FIN, ACK] Seq=487 Ack=923 Win=48719 Len=0
540579 175.491022 188.68.72.41 -> 244.3.160.239 TCP 64 http > 34698 [ACK] Seq=1 Ack=919 Win=49640 Len=0
540590 175.492826 188.68.72.41 -> 244.3.160.239 TCP 64 http > 34699 [ACK] Seq=1 Ack=942 Win=48699 Len=0
540899 175.583567 188.68.72.41 -> 244.3.160.239 TCP 64 http > 34698 [ACK] Seq=444 Ack=920 Win=49640 Len=0
540900 175.583684 188.68.72.41 -> 244.3.160.239 TCP 64 http > 34699 [ACK] Seq=1424 Ack=943 Win=48699 Len=0
540901 175.583773 188.68.72.41 -> 244.3.160.239 TCP 64 http > 34698 [FIN, ACK] Seq=444 Ack=920 Win=49640 Len=0
540903 175.584067 188.68.72.41 -> 244.3.160.239 TCP 64 http > 34699 [FIN, ACK] Seq=1424 Ack=943 Win=48699 Len=0
540906 175.592506 188.68.72.41 -> 244.3.160.239 TCP 66 http > 34703 [SYN, ACK] Seq=0 Ack=1 Win=49640 Len=0 MSS=1460 SACK_PERM=1
540942 175.597460 188.68.72.41 -> 244.3.160.239 TCP 66 http > 34704 [SYN, ACK] Seq=0 Ack=1 Win=49640 Len=0 MSS=1460 SACK_PERM=1
541142 175.668333 188.68.72.41 -> 244.3.160.239 TCP 64 http > 34703 [ACK] Seq=1 Ack=908 Win=48733 Len=0
541159 175.673175 188.68.72.41 -> 244.3.160.239 TCP 64 http > 34704 [ACK] Seq=1 Ack=929 Win=48712 Len=0
541599 175.770821 188.68.72.41 -> 244.3.160.239 TCP 64 http > 34703 [ACK] Seq=444 Ack=909 Win=48733 Len=0
541600 175.770969 188.68.72.41 -> 244.3.160.239 TCP 64 http > 34704 [ACK] Seq=1335 Ack=930 Win=48712 Len=0
541601 175.771050 188.68.72.41 -> 244.3.160.239 TCP 64 http > 34703 [FIN, ACK] Seq=444 Ack=909 Win=48733 Len=0
541603 175.771236 188.68.72.41 -> 244.3.160.239 TCP 64 http > 34704 [FIN, ACK] Seq=1335 Ack=930 Win=48712 Len=0
541686 175.783918 188.68.72.41 -> 244.3.160.239 TCP 66 http > 34706 [SYN, ACK] Seq=0 Ack=1 Win=49640 Len=0 MSS=1460 SACK_PERM=1
541687 175.784028 188.68.72.41 -> 244.3.160.239 TCP 66 http > 34707 [SYN, ACK] Seq=0 Ack=1 Win=49640 Len=0 MSS=1460 SACK_PERM=1
542097 175.860366 188.68.72.41 -> 244.3.160.239 TCP 64 http > 34707 [ACK] Seq=1 Ack=920 Win=48721 Len=0
542098 175.860417 188.68.72.41 -> 244.3.160.239 TCP 64 http > 34706 [ACK] Seq=1 Ack=940 Win=48701 Len=0
542557 175.962438 188.68.72.41 -> 244.3.160.239 TCP 64 http > 34706 [ACK] Seq=386 Ack=941 Win=48701 Len=0
542558 175.962819 188.68.72.41 -> 244.3.160.239 TCP 64 http > 34707 [ACK] Seq=445 Ack=921 Win=49640 Len=0
542559 175.962824 188.68.72.41 -> 244.3.160.239 TCP 64 http > 34706 [FIN, ACK] Seq=386 Ack=941 Win=48701 Len=0
542561 175.963086 188.68.72.41 -> 244.3.160.239 TCP 64 http > 34707 [FIN, ACK] Seq=445 Ack=921 Win=49640 Len=0
542657 175.985726 188.68.72.41 -> 244.3.160.239 TCP 66 http > 34708 [SYN, ACK] Seq=0 Ack=1 Win=49640 Len=0 MSS=1460 SACK_PERM=1
543232 176.061511 188.68.72.41 -> 244.3.160.239 TCP 64 http > 34708 [ACK] Seq=1 Ack=857 Win=48784 Len=0
543633 176.156827 188.68.72.41 -> 244.3.160.239 TCP 64 http > 34708 [ACK] Seq=1751 Ack=858 Win=48784 Len=0
543634 176.157047 188.68.72.41 -> 244.3.160.239 TCP 64 http > 34708 [FIN, ACK] Seq=1751 Ack=858 Win=48784 Len=0
597549 189.254512 188.68.72.41 -> 244.3.160.239 TCP 66 http > 34768 [SYN, ACK] Seq=0 Ack=1 Win=49640 Len=0 MSS=1460 SACK_PERM=1
597750 189.330263 188.68.72.41 -> 244.3.160.239 TCP 64 http > 34768 [ACK] Seq=1 Ack=1221 Win=48420 Len=0
597990 189.460767 188.68.72.41 -> 244.3.160.239 TCP 64 http > 34768 [ACK] Seq=3151 Ack=1222 Win=49640 Len=0
597991 189.460772 188.68.72.41 -> 244.3.160.239 TCP 64 http > 34768 [FIN, ACK] Seq=3151 Ack=1222 Win=49640 Len=0
598303 189.600796 188.68.72.41 -> 244.3.160.239 TCP 66 http > 34773 [SYN, ACK] Seq=0 Ack=1 Win=49640 Len=0 MSS=1460 SACK_PERM=1
598467 189.644616 188.68.72.41 -> 244.3.160.239 TCP 66 http > 34774 [SYN, ACK] Seq=0 Ack=1 Win=49640 Len=0 MSS=1460 SACK_PERM=1
598504 189.677656 188.68.72.41 -> 244.3.160.239 TCP 64 http > 34773 [ACK] Seq=1 Ack=1219 Win=48422 Len=0
598613 189.720483 188.68.72.41 -> 244.3.160.239 TCP 64 http > 34774 [ACK] Seq=1 Ack=1291 Win=49640 Len=0
599258 189.992409 188.68.72.41 -> 244.3.160.239 TCP 64 http > 34773 [ACK] Seq=17598 Ack=1220 Win=48422 Len=0
599259 189.992413 188.68.72.41 -> 244.3.160.239 TCP 64 http > 34773 [FIN, ACK] Seq=17598 Ack=1220 Win=48422 Len=0
599296 190.003247 188.68.72.41 -> 244.3.160.239 TCP 66 http > 34781 [SYN, ACK] Seq=0 Ack=1 Win=49640 Len=0 MSS=1460 SACK_PERM=1
599445 190.079220 188.68.72.41 -> 244.3.160.239 TCP 64 http > 34781 [ACK] Seq=1 Ack=949 Win=48692 Len=0
599666 190.167278 188.68.72.41 -> 244.3.160.239 TCP 64 http > 34774 [ACK] Seq=21563 Ack=1292 Win=49640 Len=0
599667 190.167509 188.68.72.41 -> 244.3.160.239 TCP 64 http > 34774 [FIN, ACK] Seq=21563 Ack=1292 Win=49640 Len=0
600418 190.284455 188.68.72.41 -> 244.3.160.239 TCP 64 http > 34781 [ACK] Seq=12548 Ack=950 Win=48692 Len=0
600420 190.284706 188.68.72.41 -> 244.3.160.239 TCP 64 http > 34781 [FIN, ACK] Seq=12548 Ack=950 Win=48692 Len=0
600855 190.456652 188.68.72.41 -> 244.3.160.239 TCP 66 http > 34787 [SYN, ACK] Seq=0 Ack=1 Win=49640 Len=0 MSS=1460 SACK_PERM=1
600857 190.456916 188.68.72.41 -> 244.3.160.239 TCP 66 http > 34788 [SYN, ACK] Seq=0 Ack=1 Win=49640 Len=0 MSS=1460 SACK_PERM=1
600999 190.532629 188.68.72.41 -> 244.3.160.239 TCP 64 http > 34787 [ACK] Seq=1 Ack=1023 Win=48618 Len=0
601000 190.532761 188.68.72.41 -> 244.3.160.239 TCP 64 http > 34788 [ACK] Seq=1 Ack=1033 Win=48608 Len=0
601407 190.688588 188.68.72.41 -> 244.3.160.239 TCP 66 http > 34791 [SYN, ACK] Seq=0 Ack=1 Win=49640 Len=0 MSS=1460 SACK_PERM=1
601426 190.691723 188.68.72.41 -> 244.3.160.239 TCP 66 http > 34792 [SYN, ACK] Seq=0 Ack=1 Win=49640 Len=0 MSS=1460 SACK_PERM=1
601624 190.764300 188.68.72.41 -> 244.3.160.239 TCP 64 http > 34791 [ACK] Seq=1 Ack=1026 Win=48615 Len=0
601633 190.768310 188.68.72.41 -> 244.3.160.239 TCP 64 http > 34792 [ACK] Seq=1 Ack=1026 Win=48615 Len=0
601673 190.785898 188.68.72.41 -> 244.3.160.239 TCP 64 http > 34787 [ACK] Seq=2256 Ack=1024 Win=48618 Len=0
601674 190.786174 188.68.72.41 -> 244.3.160.239 TCP 64 http > 34787 [FIN, ACK] Seq=2256 Ack=1024 Win=48618 Len=0
601676 190.786364 188.68.72.41 -> 244.3.160.239 TCP 64 http > 34788 [ACK] Seq=425 Ack=1034 Win=48608 Len=0
601677 190.786502 188.68.72.41 -> 244.3.160.239 TCP 64 http > 34788 [FIN, ACK] Seq=425 Ack=1034 Win=48608 Len=0
602241 191.036113 188.68.72.41 -> 244.3.160.239 TCP 64 http > 34791 [ACK] Seq=393 Ack=1027 Win=48615 Len=0
602242 191.036227 188.68.72.41 -> 244.3.160.239 TCP 64 http > 34791 [FIN, ACK] Seq=393 Ack=1027 Win=48615 Len=0
602243 191.036231 188.68.72.41 -> 244.3.160.239 TCP 64 http > 34792 [ACK] Seq=417 Ack=1027 Win=48615 Len=0
602245 191.036618 188.68.72.41 -> 244.3.160.239 TCP 64 http > 34792 [FIN, ACK] Seq=417 Ack=1027 Win=48615 Len=0
605656 192.046709 188.68.72.41 -> 244.3.160.239 TCP 66 http > 34795 [SYN, ACK] Seq=0 Ack=1 Win=49640 Len=0 MSS=1460 SACK_PERM=1
605814 192.122956 188.68.72.41 -> 244.3.160.239 TCP 64 http > 34795 [ACK] Seq=1 Ack=1242 Win=48399 Len=0
612228 194.278325 188.68.72.41 -> 244.3.160.239 TCP 78 [TCP segment of a reassembled PDU]
623525 197.892215 188.68.72.41 -> 244.3.160.239 TCP 77 [TCP segment of a reassembled PDU]
661608 206.386149 188.68.72.41 -> 244.3.160.239 TCP 78 [TCP segment of a reassembled PDU]
672964 209.861902 188.68.72.41 -> 244.3.160.239 TCP 66 http > 34988 [SYN, ACK] Seq=0 Ack=1 Win=49640 Len=0 MSS=1460 SACK_PERM=1
672996 209.892286 188.68.72.41 -> 244.3.160.239 TCP 64 http > 34795 [ACK] Seq=3211255 Ack=1243 Win=48399 Len=0
673077 209.940247 188.68.72.41 -> 244.3.160.239 TCP 64 http > 34988 [ACK] Seq=1 Ack=1249 Win=48392 Len=0
676173 211.505657 188.68.72.41 -> 244.3.160.239 TCP 78 [TCP segment of a reassembled PDU]
707729 225.349032 188.68.72.41 -> 244.3.160.239 TCP 78 [TCP segment of a reassembled PDU]
717433 228.945512 188.68.72.41 -> 244.3.160.239 TCP 64 http > 34988 [ACK] Seq=3628591 Ack=1250 Win=48392 Len=0
717434 228.945890 188.68.72.41 -> 244.3.160.239 TCP 64 http > 34988 [FIN, ACK] Seq=3628591 Ack=1250 Win=48392 Len=0
