393994 131.927296 188.68.72.38 -> 244.3.160.239 TCP 66 http > 34286 [SYN, ACK] Seq=0 Ack=1 Win=49640 Len=0 MSS=1460 SACK_PERM=1
394061 132.002972 188.68.72.38 -> 244.3.160.239 TCP 64 http > 34286 [ACK] Seq=1 Ack=1258 Win=48383 Len=0
464358 152.586333 188.68.72.38 -> 244.3.160.239 TCP 64 http > 34286 [ACK] Seq=11995 Ack=1259 Win=49640 Len=0
469531 154.937118 188.68.72.38 -> 244.3.160.239 TCP 66 http > 34325 [SYN, ACK] Seq=0 Ack=1 Win=49640 Len=0 MSS=1460 SACK_PERM=1
469716 155.014965 188.68.72.38 -> 244.3.160.239 TCP 64 http > 34325 [ACK] Seq=1 Ack=1258 Win=48383 Len=0
491580 162.321997 188.68.72.38 -> 244.3.160.239 TCP 78 [TCP segment of a reassembled PDU]
494102 163.066862 188.68.72.38 -> 244.3.160.239 TCP 64 http > 34325 [ACK] Seq=212242 Ack=1259 Win=49640 Len=0
