567303 181.321657 194.23.108.2 -> 41.177.98.176 TCP 82 49962 > http [SYN] Seq=0 Win=65535 Len=0 MSS=1460 WS=8 TSval=466093149 TSecr=0 SACK_PERM=1
567406 181.345259 194.23.108.2 -> 41.177.98.176 TCP 70 49962 > http [ACK] Seq=1 Ack=1 Win=524280 Len=0 TSval=466093149 TSecr=1558691
577554 183.418624 194.23.108.2 -> 41.177.98.176 TCP 70 49962 > http [ACK] Seq=870 Ack=2897 Win=524176 Len=0 TSval=466093170 TSecr=1558898
577559 183.419841 194.23.108.2 -> 41.177.98.176 TCP 70 49962 > http [ACK] Seq=870 Ack=4345 Win=524176 Len=0 TSval=466093170 TSecr=1558898
577591 183.427935 194.23.108.2 -> 41.177.98.176 TCP 82 49963 > http [SYN] Seq=0 Win=65535 Len=0 MSS=1460 WS=8 TSval=466093170 TSecr=0 SACK_PERM=1
577593 183.428175 194.23.108.2 -> 41.177.98.176 TCP 82 49964 > http [SYN] Seq=0 Win=65535 Len=0 MSS=1460 WS=8 TSval=466093170 TSecr=0 SACK_PERM=1
577601 183.428672 194.23.108.2 -> 41.177.98.176 TCP 82 49965 > http [SYN] Seq=0 Win=65535 Len=0 MSS=1460 WS=8 TSval=466093170 TSecr=0 SACK_PERM=1
577647 183.444442 194.23.108.2 -> 41.177.98.176 TCP 70 49962 > http [ACK] Seq=870 Ack=6783 Win=524176 Len=0 TSval=466093170 TSecr=1558901
577653 183.446954 194.23.108.2 -> 41.177.98.176 TCP 70 49962 > http [ACK] Seq=870 Ack=9679 Win=524176 Len=0 TSval=466093170 TSecr=1558901
577658 183.448631 194.23.108.2 -> 41.177.98.176 TCP 70 49962 > http [ACK] Seq=870 Ack=11579 Win=524280 Len=0 TSval=466093170 TSecr=1558901
577660 183.455145 194.23.108.2 -> 41.177.98.176 TCP 70 49963 > http [ACK] Seq=1 Ack=1 Win=524280 Len=0 TSval=466093170 TSecr=1558902
577664 183.458438 194.23.108.2 -> 41.177.98.176 TCP 70 49964 > http [ACK] Seq=1 Ack=1 Win=524280 Len=0 TSval=466093170 TSecr=1558902
577671 183.462255 194.23.108.2 -> 41.177.98.176 TCP 70 49965 > http [ACK] Seq=1 Ack=1 Win=524280 Len=0 TSval=466093170 TSecr=1558902
577696 183.483367 194.23.108.2 -> 41.177.98.176 TCP 70 49963 > http [ACK] Seq=814 Ack=719 Win=524280 Len=0 TSval=466093171 TSecr=1558905
577702 183.486594 194.23.108.2 -> 41.177.98.176 TCP 70 49964 > http [ACK] Seq=815 Ack=2897 Win=524176 Len=0 TSval=466093171 TSecr=1558905
577709 183.487855 194.23.108.2 -> 41.177.98.176 TCP 70 49964 > http [ACK] Seq=815 Ack=4345 Win=524176 Len=0 TSval=466093171 TSecr=1558905
577713 183.488930 194.23.108.2 -> 41.177.98.176 TCP 70 49965 > http [ACK] Seq=824 Ack=1118 Win=524280 Len=0 TSval=466093171 TSecr=1558906
577763 183.511269 194.23.108.2 -> 41.177.98.176 TCP 70 49964 > http [ACK] Seq=815 Ack=5480 Win=524280 Len=0 TSval=466093171 TSecr=1558908
577830 183.527768 194.23.108.2 -> 41.177.98.176 TCP 82 49966 > http [SYN] Seq=0 Win=65535 Len=0 MSS=1460 WS=8 TSval=466093171 TSecr=0 SACK_PERM=1
577832 183.527834 194.23.108.2 -> 41.177.98.176 TCP 82 49967 > http [SYN] Seq=0 Win=65535 Len=0 MSS=1460 WS=8 TSval=466093171 TSecr=0 SACK_PERM=1
577878 183.551082 194.23.108.2 -> 41.177.98.176 TCP 70 49962 > http [ACK] Seq=1677 Ack=14475 Win=524280 Len=0 TSval=466093171 TSecr=1558912
577882 183.552990 194.23.108.2 -> 41.177.98.176 TCP 70 49962 > http [ACK] Seq=1677 Ack=16815 Win=524280 Len=0 TSval=466093171 TSecr=1558912
577883 183.553659 194.23.108.2 -> 41.177.98.176 TCP 70 49963 > http [ACK] Seq=1621 Ack=1549 Win=524280 Len=0 TSval=466093171 TSecr=1558912
577888 183.555220 194.23.108.2 -> 41.177.98.176 TCP 70 49964 > http [ACK] Seq=1612 Ack=5790 Win=524280 Len=0 TSval=466093171 TSecr=1558912
577901 183.557306 194.23.108.2 -> 41.177.98.176 TCP 70 49964 > http [ACK] Seq=1612 Ack=8686 Win=524176 Len=0 TSval=466093171 TSecr=1558912
577909 183.559846 194.23.108.2 -> 41.177.98.176 TCP 70 49964 > http [ACK] Seq=1612 Ack=11582 Win=524280 Len=0 TSval=466093171 TSecr=1558912
577918 183.563045 194.23.108.2 -> 41.177.98.176 TCP 70 49964 > http [ACK] Seq=1612 Ack=13982 Win=524280 Len=0 TSval=466093171 TSecr=1558912
577919 183.563213 194.23.108.2 -> 41.177.98.176 TCP 70 49966 > http [ACK] Seq=1 Ack=1 Win=524280 Len=0 TSval=466093171 TSecr=1558912
577925 183.564549 194.23.108.2 -> 41.177.98.176 TCP 70 49967 > http [ACK] Seq=1 Ack=1 Win=524280 Len=0 TSval=466093171 TSecr=1558912
577960 183.571523 194.23.108.2 -> 41.177.98.176 TCP 70 49965 > http [ACK] Seq=1627 Ack=4014 Win=524176 Len=0 TSval=466093171 TSecr=1558912
577973 183.574222 194.23.108.2 -> 41.177.98.176 TCP 70 49965 > http [ACK] Seq=1627 Ack=5462 Win=524280 Len=0 TSval=466093171 TSecr=1558912
577975 183.575146 194.23.108.2 -> 41.177.98.176 TCP 70 49965 > http [ACK] Seq=1627 Ack=6810 Win=524272 Len=0 TSval=466093172 TSecr=1558912
578048 183.602865 194.23.108.2 -> 41.177.98.176 TCP 70 49962 > http [ACK] Seq=2495 Ack=17124 Win=524280 Len=0 TSval=466093172 TSecr=1558915
578069 183.605477 194.23.108.2 -> 41.177.98.176 TCP 70 49962 > http [ACK] Seq=2495 Ack=20020 Win=524280 Len=0 TSval=466093172 TSecr=1558915
578077 183.607915 194.23.108.2 -> 41.177.98.176 TCP 70 49962 > http [ACK] Seq=2495 Ack=22916 Win=524280 Len=0 TSval=466093172 TSecr=1558915
578081 183.610758 194.23.108.2 -> 41.177.98.176 TCP 70 49962 > http [ACK] Seq=2495 Ack=25316 Win=524280 Len=0 TSval=466093172 TSecr=1558915
578083 183.611630 194.23.108.2 -> 41.177.98.176 TCP 70 49962 > http [ACK] Seq=2495 Ack=26401 Win=524280 Len=0 TSval=466093172 TSecr=1558915
578085 183.613866 194.23.108.2 -> 41.177.98.176 TCP 70 49963 > http [ACK] Seq=2440 Ack=3647 Win=524280 Len=0 TSval=466093172 TSecr=1558915
578096 183.615530 194.23.108.2 -> 41.177.98.176 TCP 70 49964 > http [ACK] Seq=1612 Ack=16878 Win=524280 Len=0 TSval=466093172 TSecr=1558915
578111 183.617279 194.23.108.2 -> 41.177.98.176 TCP 70 49964 > http [ACK] Seq=1612 Ack=19774 Win=524280 Len=0 TSval=466093172 TSecr=1558915
578115 183.619735 194.23.108.2 -> 41.177.98.176 TCP 70 49964 > http [ACK] Seq=1612 Ack=22670 Win=524280 Len=0 TSval=466093172 TSecr=1558915
578119 183.622203 194.23.108.2 -> 41.177.98.176 TCP 70 49964 > http [ACK] Seq=1612 Ack=25566 Win=524280 Len=0 TSval=466093172 TSecr=1558915
578123 183.623331 194.23.108.2 -> 41.177.98.176 TCP 70 49964 > http [ACK] Seq=1612 Ack=27014 Win=524176 Len=0 TSval=466093172 TSecr=1558915
578132 183.624573 194.23.108.2 -> 41.177.98.176 TCP 70 49964 > http [ACK] Seq=1612 Ack=28462 Win=524176 Len=0 TSval=466093172 TSecr=1558915
578137 183.624949 194.23.108.2 -> 41.177.98.176 TCP 70 49966 > http [ACK] Seq=797 Ack=311 Win=524280 Len=0 TSval=466093172 TSecr=1558916
578172 183.628587 194.23.108.2 -> 41.177.98.176 TCP 70 49966 > http [ACK] Seq=797 Ack=3207 Win=524176 Len=0 TSval=466093172 TSecr=1558916
578179 183.631506 194.23.108.2 -> 41.177.98.176 TCP 70 49967 > http [ACK] Seq=810 Ack=312 Win=524280 Len=0 TSval=466093172 TSecr=1558916
578182 183.633969 194.23.108.2 -> 41.177.98.176 TCP 70 49967 > http [ACK] Seq=810 Ack=3208 Win=524176 Len=0 TSval=466093172 TSecr=1558916
578233 183.649219 194.23.108.2 -> 41.177.98.176 TCP 70 49965 > http [ACK] Seq=2429 Ack=9706 Win=524280 Len=0 TSval=466093172 TSecr=1558917
578239 183.650355 194.23.108.2 -> 41.177.98.176 TCP 70 49965 > http [ACK] Seq=2429 Ack=11154 Win=524176 Len=0 TSval=466093172 TSecr=1558917
578240 183.651441 194.23.108.2 -> 41.177.98.176 TCP 70 49965 > http [ACK] Seq=2429 Ack=12418 Win=524280 Len=0 TSval=466093172 TSecr=1558917
578278 183.665868 194.23.108.2 -> 41.177.98.176 TCP 70 49962 > http [ACK] Seq=3296 Ack=26711 Win=524280 Len=0 TSval=466093172 TSecr=1558921
578281 183.668448 194.23.108.2 -> 41.177.98.176 TCP 70 49962 > http [ACK] Seq=3296 Ack=29607 Win=524280 Len=0 TSval=466093172 TSecr=1558921
578282 183.670809 194.23.108.2 -> 41.177.98.176 TCP 70 49962 > http [ACK] Seq=3296 Ack=32503 Win=524280 Len=0 TSval=466093172 TSecr=1558921
578283 183.672796 194.23.108.2 -> 41.177.98.176 TCP 70 49962 > http [ACK] Seq=3296 Ack=34903 Win=524280 Len=0 TSval=466093172 TSecr=1558921
578291 183.675340 194.23.108.2 -> 41.177.98.176 TCP 70 49962 > http [ACK] Seq=3296 Ack=37799 Win=524280 Len=0 TSval=466093173 TSecr=1558921
578298 183.677836 194.23.108.2 -> 41.177.98.176 TCP 70 49962 > http [ACK] Seq=3296 Ack=40695 Win=524280 Len=0 TSval=466093173 TSecr=1558921
578299 183.678516 194.23.108.2 -> 41.177.98.176 TCP 70 49962 > http [ACK] Seq=3296 Ack=41606 Win=524280 Len=0 TSval=466093173 TSecr=1558921
578309 183.681082 194.23.108.2 -> 41.177.98.176 TCP 70 49964 > http [ACK] Seq=1612 Ack=31358 Win=524280 Len=0 TSval=466093173 TSecr=1558921
578315 183.682236 194.23.108.2 -> 41.177.98.176 TCP 70 49964 > http [ACK] Seq=1612 Ack=32806 Win=524176 Len=0 TSval=466093173 TSecr=1558921
578318 183.682521 194.23.108.2 -> 41.177.98.176 TCP 70 49963 > http [ACK] Seq=3239 Ack=3956 Win=524280 Len=0 TSval=466093173 TSecr=1558921
578329 183.685011 194.23.108.2 -> 41.177.98.176 TCP 70 49963 > http [ACK] Seq=3239 Ack=6852 Win=524176 Len=0 TSval=466093173 TSecr=1558921
578338 183.687469 194.23.108.2 -> 41.177.98.176 TCP 70 49963 > http [ACK] Seq=3239 Ack=9748 Win=524176 Len=0 TSval=466093173 TSecr=1558921
578348 183.689528 194.23.108.2 -> 41.177.98.176 TCP 70 49963 > http [ACK] Seq=3239 Ack=12148 Win=524280 Len=0 TSval=466093173 TSecr=1558921
578354 183.692030 194.23.108.2 -> 41.177.98.176 TCP 70 49964 > http [ACK] Seq=1612 Ack=35702 Win=524280 Len=0 TSval=466093173 TSecr=1558921
578364 183.693208 194.23.108.2 -> 41.177.98.176 TCP 70 49964 > http [ACK] Seq=1612 Ack=37150 Win=524176 Len=0 TSval=466093173 TSecr=1558921
578368 183.695768 194.23.108.2 -> 41.177.98.176 TCP 70 49964 > http [ACK] Seq=1612 Ack=40046 Win=524280 Len=0 TSval=466093173 TSecr=1558921
578369 183.697280 194.23.108.2 -> 41.177.98.176 TCP 70 49964 > http [ACK] Seq=1612 Ack=41494 Win=524176 Len=0 TSval=466093173 TSecr=1558921
578378 183.699698 194.23.108.2 -> 41.177.98.176 TCP 70 49964 > http [ACK] Seq=1612 Ack=44390 Win=524280 Len=0 TSval=466093173 TSecr=1558921
578381 183.700594 194.23.108.2 -> 41.177.98.176 TCP 70 49964 > http [ACK] Seq=1612 Ack=45838 Win=524176 Len=0 TSval=466093173 TSecr=1558921
578384 183.703045 194.23.108.2 -> 41.177.98.176 TCP 70 49964 > http [ACK] Seq=1612 Ack=48734 Win=524176 Len=0 TSval=466093173 TSecr=1558921
578399 183.705523 194.23.108.2 -> 41.177.98.176 TCP 70 49964 > http [ACK] Seq=1612 Ack=51630 Win=524176 Len=0 TSval=466093173 TSecr=1558922
578408 183.707955 194.23.108.2 -> 41.177.98.176 TCP 70 49966 > http [ACK] Seq=797 Ack=6103 Win=524176 Len=0 TSval=466093173 TSecr=1558922
578411 183.709420 194.23.108.2 -> 41.177.98.176 TCP 70 49966 > http [ACK] Seq=797 Ack=7736 Win=524280 Len=0 TSval=466093173 TSecr=1558922
578418 183.711919 194.23.108.2 -> 41.177.98.176 TCP 70 49967 > http [ACK] Seq=810 Ack=6104 Win=524176 Len=0 TSval=466093173 TSecr=1558922
578427 183.714327 194.23.108.2 -> 41.177.98.176 TCP 70 49967 > http [ACK] Seq=810 Ack=9000 Win=524176 Len=0 TSval=466093173 TSecr=1558923
578435 183.715587 194.23.108.2 -> 41.177.98.176 TCP 70 49967 > http [ACK] Seq=810 Ack=10448 Win=524176 Len=0 TSval=466093173 TSecr=1558923
578444 183.715923 194.23.108.2 -> 41.177.98.176 TCP 70 49965 > http [ACK] Seq=3226 Ack=12745 Win=524280 Len=0 TSval=466093173 TSecr=1558925
578501 183.719574 194.23.108.2 -> 41.177.98.176 TCP 70 49964 > http [ACK] Seq=1612 Ack=54526 Win=524280 Len=0 TSval=466093173 TSecr=1558927
578514 183.720660 194.23.108.2 -> 41.177.98.176 TCP 70 49964 > http [ACK] Seq=1612 Ack=55974 Win=524176 Len=0 TSval=466093173 TSecr=1558927
578516 183.721166 194.23.108.2 -> 41.177.98.176 TCP 70 49962 > http [ACK] Seq=4099 Ack=42161 Win=524280 Len=0 TSval=466093173 TSecr=1558927
578522 183.723724 194.23.108.2 -> 41.177.98.176 TCP 70 49964 > http [ACK] Seq=1612 Ack=58870 Win=524176 Len=0 TSval=466093173 TSecr=1558927
578523 183.724328 194.23.108.2 -> 41.177.98.176 TCP 70 49963 > http [ACK] Seq=3239 Ack=12969 Win=524280 Len=0 TSval=466093173 TSecr=1558927
578530 183.726919 194.23.108.2 -> 41.177.98.176 TCP 70 49964 > http [ACK] Seq=1612 Ack=61766 Win=524280 Len=0 TSval=466093173 TSecr=1558928
578534 183.728080 194.23.108.2 -> 41.177.98.176 TCP 70 49964 > http [ACK] Seq=1612 Ack=63214 Win=524176 Len=0 TSval=466093173 TSecr=1558928
578538 183.729756 194.23.108.2 -> 41.177.98.176 TCP 70 49964 > http [ACK] Seq=1612 Ack=65148 Win=524280 Len=0 TSval=466093173 TSecr=1558928
578572 183.735821 194.23.108.2 -> 41.177.98.176 TCP 70 49967 > http [ACK] Seq=810 Ack=10712 Win=524280 Len=0 TSval=466093173 TSecr=1558930
578574 183.736328 194.23.108.2 -> 41.177.98.176 TCP 70 49966 > http [ACK] Seq=1600 Ack=8268 Win=524280 Len=0 TSval=466093173 TSecr=1558930
578589 183.742716 194.23.108.2 -> 41.177.98.176 TCP 70 49965 > http [ACK] Seq=4029 Ack=13411 Win=524280 Len=0 TSval=466093173 TSecr=1558931
578599 183.748214 194.23.108.2 -> 41.177.98.176 TCP 70 49962 > http [ACK] Seq=4899 Ack=42496 Win=524280 Len=0 TSval=466093173 TSecr=1558932
578909 183.875046 194.23.108.2 -> 41.177.98.176 TCP 70 49962 > http [ACK] Seq=5695 Ack=42789 Win=524280 Len=0 TSval=466093175 TSecr=1558944
587667 187.164757 194.23.108.2 -> 41.177.98.176 TCP 70 49962 > http [ACK] Seq=6722 Ack=45685 Win=524176 Len=0 TSval=466093207 TSecr=1559273
587684 187.167207 194.23.108.2 -> 41.177.98.176 TCP 70 49962 > http [ACK] Seq=6722 Ack=48122 Win=524280 Len=0 TSval=466093207 TSecr=1559273
587691 187.169290 194.23.108.2 -> 41.177.98.176 TCP 70 49962 > http [ACK] Seq=6722 Ack=51018 Win=524176 Len=0 TSval=466093207 TSecr=1559273
587704 187.171203 194.23.108.2 -> 41.177.98.176 TCP 70 49962 > http [ACK] Seq=6722 Ack=53250 Win=524280 Len=0 TSval=466093207 TSecr=1559273
587708 187.173725 194.23.108.2 -> 41.177.98.176 TCP 70 49962 > http [ACK] Seq=6722 Ack=56146 Win=524280 Len=0 TSval=466093207 TSecr=1559274
587709 187.175644 194.23.108.2 -> 41.177.98.176 TCP 70 49962 > http [ACK] Seq=6722 Ack=58378 Win=524280 Len=0 TSval=466093207 TSecr=1559274
587728 187.178113 194.23.108.2 -> 41.177.98.176 TCP 70 49962 > http [ACK] Seq=6722 Ack=61274 Win=524280 Len=0 TSval=466093208 TSecr=1559274
587743 187.180070 194.23.108.2 -> 41.177.98.176 TCP 70 49962 > http [ACK] Seq=6722 Ack=63506 Win=524280 Len=0 TSval=466093208 TSecr=1559274
587749 187.182521 194.23.108.2 -> 41.177.98.176 TCP 70 49962 > http [ACK] Seq=6722 Ack=66402 Win=524280 Len=0 TSval=466093208 TSecr=1559274
587777 187.184421 194.23.108.2 -> 41.177.98.176 TCP 70 49962 > http [ACK] Seq=6722 Ack=68634 Win=524280 Len=0 TSval=466093208 TSecr=1559274
587791 187.186920 194.23.108.2 -> 41.177.98.176 TCP 70 49962 > http [ACK] Seq=6722 Ack=71530 Win=524280 Len=0 TSval=466093208 TSecr=1559274
587798 187.188797 194.23.108.2 -> 41.177.98.176 TCP 70 49962 > http [ACK] Seq=6722 Ack=73762 Win=524280 Len=0 TSval=466093208 TSecr=1559274
587805 187.191302 194.23.108.2 -> 41.177.98.176 TCP 70 49962 > http [ACK] Seq=6722 Ack=76658 Win=524280 Len=0 TSval=466093208 TSecr=1559275
587808 187.193173 194.23.108.2 -> 41.177.98.176 TCP 70 49962 > http [ACK] Seq=6722 Ack=78890 Win=524280 Len=0 TSval=466093208 TSecr=1559275
587813 187.195657 194.23.108.2 -> 41.177.98.176 TCP 70 49962 > http [ACK] Seq=6722 Ack=81786 Win=524280 Len=0 TSval=466093208 TSecr=1559276
587821 187.198842 194.23.108.2 -> 41.177.98.176 TCP 70 49962 > http [ACK] Seq=6722 Ack=85466 Win=524280 Len=0 TSval=466093208 TSecr=1559276
587830 187.201285 194.23.108.2 -> 41.177.98.176 TCP 70 49962 > http [ACK] Seq=6722 Ack=88362 Win=524280 Len=0 TSval=466093208 TSecr=1559276
587837 187.202231 194.23.108.2 -> 41.177.98.176 TCP 70 49962 > http [ACK] Seq=6722 Ack=89493 Win=524280 Len=0 TSval=466093208 TSecr=1559276
587991 187.238297 194.23.108.2 -> 41.177.98.176 TCP 70 49962 > http [ACK] Seq=7587 Ack=90048 Win=524280 Len=0 TSval=466093208 TSecr=1559281
588017 187.246504 194.23.108.2 -> 41.177.98.176 TCP 70 49963 > http [ACK] Seq=4104 Ack=13501 Win=524280 Len=0 TSval=466093208 TSecr=1559281
625411 198.556491 194.23.108.2 -> 41.177.98.176 TCP 70 49964 > http [ACK] Seq=1612 Ack=65149 Win=524280 Len=0 TSval=466093321 TSecr=1560413
625585 198.596508 194.23.108.2 -> 41.177.98.176 TCP 70 49967 > http [ACK] Seq=810 Ack=10713 Win=524280 Len=0 TSval=466093322 TSecr=1560417
626021 198.736499 194.23.108.2 -> 41.177.98.176 TCP 70 49966 > http [ACK] Seq=1600 Ack=8269 Win=524280 Len=0 TSval=466093323 TSecr=1560431
626073 198.746478 194.23.108.2 -> 41.177.98.176 TCP 70 49965 > http [ACK] Seq=4029 Ack=13412 Win=524280 Len=0 TSval=466093323 TSecr=1560432
640887 202.246656 194.23.108.2 -> 41.177.98.176 TCP 70 49963 > http [ACK] Seq=4104 Ack=13502 Win=524280 Len=0 TSval=466093358 TSecr=1560782
640888 202.246772 194.23.108.2 -> 41.177.98.176 TCP 70 49962 > http [ACK] Seq=7587 Ack=90049 Win=524280 Len=0 TSval=466093358 TSecr=1560782
689802 217.222068 194.23.108.2 -> 41.177.98.176 TCP 70 49962 > http [FIN, ACK] Seq=7587 Ack=90049 Win=524280 Len=0 TSval=466093508 TSecr=1560782
689803 217.222100 194.23.108.2 -> 41.177.98.176 TCP 70 49963 > http [FIN, ACK] Seq=4104 Ack=13502 Win=524280 Len=0 TSval=466093508 TSecr=1560782
689805 217.222218 194.23.108.2 -> 41.177.98.176 TCP 70 49964 > http [FIN, ACK] Seq=1612 Ack=65149 Win=524280 Len=0 TSval=466093508 TSecr=1560413
689807 217.222287 194.23.108.2 -> 41.177.98.176 TCP 70 49965 > http [FIN, ACK] Seq=4029 Ack=13412 Win=524280 Len=0 TSval=466093508 TSecr=1560432
689808 217.222362 194.23.108.2 -> 41.177.98.176 TCP 70 49966 > http [FIN, ACK] Seq=1600 Ack=8269 Win=524280 Len=0 TSval=466093508 TSecr=1560431
689809 217.222424 194.23.108.2 -> 41.177.98.176 TCP 70 49967 > http [FIN, ACK] Seq=810 Ack=10713 Win=524280 Len=0 TSval=466093508 TSecr=1560417
701640 222.990998 194.23.108.2 -> 41.177.98.176 TCP 82 49968 > http [SYN] Seq=0 Win=65535 Len=0 MSS=1460 WS=8 TSval=466093565 TSecr=0 SACK_PERM=1
701707 223.018005 194.23.108.2 -> 41.177.98.176 TCP 70 49968 > http [ACK] Seq=1 Ack=1 Win=524280 Len=0 TSval=466093566 TSecr=1562858
703777 223.926791 194.23.108.2 -> 41.177.98.176 TCP 70 49968 > http [ACK] Seq=1091 Ack=4345 Win=524176 Len=0 TSval=466093575 TSecr=1562949
703880 223.959697 194.23.108.2 -> 41.177.98.176 TCP 70 49968 > http [ACK] Seq=1091 Ack=6783 Win=524176 Len=0 TSval=466093575 TSecr=1562952
703890 223.962404 194.23.108.2 -> 41.177.98.176 TCP 70 49968 > http [ACK] Seq=1091 Ack=9679 Win=524176 Len=0 TSval=466093575 TSecr=1562952
703895 223.965584 194.23.108.2 -> 41.177.98.176 TCP 82 49969 > http [SYN] Seq=0 Win=65535 Len=0 MSS=1460 WS=8 TSval=466093575 TSecr=0 SACK_PERM=1
703900 223.969028 194.23.108.2 -> 41.177.98.176 TCP 82 49970 > http [SYN] Seq=0 Win=65535 Len=0 MSS=1460 WS=8 TSval=466093575 TSecr=0 SACK_PERM=1
703902 223.969495 194.23.108.2 -> 41.177.98.176 TCP 82 49971 > http [SYN] Seq=0 Win=65535 Len=0 MSS=1460 WS=8 TSval=466093575 TSecr=0 SACK_PERM=1
703904 223.969629 194.23.108.2 -> 41.177.98.176 TCP 82 49972 > http [SYN] Seq=0 Win=65535 Len=0 MSS=1460 WS=8 TSval=466093575 TSecr=0 SACK_PERM=1
703907 223.969886 194.23.108.2 -> 41.177.98.176 TCP 82 49973 > http [SYN] Seq=0 Win=65535 Len=0 MSS=1460 WS=8 TSval=466093575 TSecr=0 SACK_PERM=1
703949 223.994861 194.23.108.2 -> 41.177.98.176 TCP 70 49968 > http [ACK] Seq=1091 Ack=13359 Win=524280 Len=0 TSval=466093575 TSecr=1562955
703955 223.998129 194.23.108.2 -> 41.177.98.176 TCP 70 49969 > http [ACK] Seq=1 Ack=1 Win=524280 Len=0 TSval=466093575 TSecr=1562956
703956 223.998188 194.23.108.2 -> 41.177.98.176 TCP 70 49968 > http [ACK] Seq=1091 Ack=17039 Win=524280 Len=0 TSval=466093575 TSecr=1562956
703967 224.001070 194.23.108.2 -> 41.177.98.176 TCP 70 49970 > http [ACK] Seq=1 Ack=1 Win=524280 Len=0 TSval=466093575 TSecr=1562956
703972 224.002316 194.23.108.2 -> 41.177.98.176 TCP 70 49971 > http [ACK] Seq=1 Ack=1 Win=524280 Len=0 TSval=466093575 TSecr=1562956
703976 224.003288 194.23.108.2 -> 41.177.98.176 TCP 70 49972 > http [ACK] Seq=1 Ack=1 Win=524280 Len=0 TSval=466093575 TSecr=1562956
703977 224.003292 194.23.108.2 -> 41.177.98.176 TCP 70 49973 > http [ACK] Seq=1 Ack=1 Win=524280 Len=0 TSval=466093575 TSecr=1562956
704078 224.028863 194.23.108.2 -> 41.177.98.176 TCP 70 49968 > http [ACK] Seq=1091 Ack=18607 Win=524280 Len=0 TSval=466093576 TSecr=1562959
704104 224.032818 194.23.108.2 -> 41.177.98.176 TCP 70 49969 > http [ACK] Seq=866 Ack=623 Win=524280 Len=0 TSval=466093576 TSecr=1562959
704124 224.037264 194.23.108.2 -> 41.177.98.176 TCP 70 49970 > http [ACK] Seq=865 Ack=2203 Win=524280 Len=0 TSval=466093576 TSecr=1562960
704129 224.038665 194.23.108.2 -> 41.177.98.176 TCP 70 49972 > http [ACK] Seq=866 Ack=1535 Win=524280 Len=0 TSval=466093576 TSecr=1562960
704130 224.039182 194.23.108.2 -> 41.177.98.176 TCP 70 49973 > http [ACK] Seq=866 Ack=555 Win=524280 Len=0 TSval=466093576 TSecr=1562960
704139 224.041452 194.23.108.2 -> 41.177.98.176 TCP 70 49971 > http [ACK] Seq=865 Ack=2897 Win=524176 Len=0 TSval=466093576 TSecr=1562960
704144 224.042861 194.23.108.2 -> 41.177.98.176 TCP 70 49971 > http [ACK] Seq=865 Ack=4345 Win=524176 Len=0 TSval=466093576 TSecr=1562960
704199 224.063523 194.23.108.2 -> 41.177.98.176 TCP 70 49968 > http [ACK] Seq=1955 Ack=18904 Win=524280 Len=0 TSval=466093576 TSecr=1562962
704200 224.066136 194.23.108.2 -> 41.177.98.176 TCP 70 49968 > http [ACK] Seq=1955 Ack=21800 Win=524280 Len=0 TSval=466093576 TSecr=1562962
704201 224.068557 194.23.108.2 -> 41.177.98.176 TCP 70 49968 > http [ACK] Seq=1955 Ack=24696 Win=524280 Len=0 TSval=466093576 TSecr=1562962
704202 224.070677 194.23.108.2 -> 41.177.98.176 TCP 70 49968 > http [ACK] Seq=1955 Ack=27096 Win=524280 Len=0 TSval=466093576 TSecr=1562962
704204 224.073395 194.23.108.2 -> 41.177.98.176 TCP 70 49968 > http [ACK] Seq=1955 Ack=29992 Win=524280 Len=0 TSval=466093576 TSecr=1562962
704205 224.073696 194.23.108.2 -> 41.177.98.176 TCP 70 49968 > http [ACK] Seq=1955 Ack=30399 Win=524280 Len=0 TSval=466093576 TSecr=1562962
704215 224.075751 194.23.108.2 -> 41.177.98.176 TCP 70 49971 > http [ACK] Seq=865 Ack=5431 Win=524280 Len=0 TSval=466093576 TSecr=1562963
705847 224.616679 194.23.108.2 -> 41.177.98.176 TCP 70 49968 > http [ACK] Seq=2825 Ack=32433 Win=524280 Len=0 TSval=466093582 TSecr=1563018
721077 230.169915 194.23.108.2 -> 41.177.98.176 TCP 70 49968 > http [ACK] Seq=3833 Ack=35329 Win=524176 Len=0 TSval=466093637 TSecr=1563574
721080 230.171788 194.23.108.2 -> 41.177.98.176 TCP 70 49968 > http [ACK] Seq=3833 Ack=37652 Win=524280 Len=0 TSval=466093637 TSecr=1563574
747105 239.025042 194.23.108.2 -> 41.177.98.176 TCP 70 49969 > http [ACK] Seq=866 Ack=624 Win=524280 Len=0 TSval=466093726 TSecr=1564460
747116 239.035007 194.23.108.2 -> 41.177.98.176 TCP 70 49972 > http [ACK] Seq=866 Ack=1536 Win=524280 Len=0 TSval=466093726 TSecr=1564461
747117 239.035125 194.23.108.2 -> 41.177.98.176 TCP 70 49970 > http [ACK] Seq=865 Ack=2204 Win=524280 Len=0 TSval=466093726 TSecr=1564461
747118 239.035284 194.23.108.2 -> 41.177.98.176 TCP 70 49973 > http [ACK] Seq=866 Ack=556 Win=524280 Len=0 TSval=466093726 TSecr=1564461
747119 239.035362 194.23.108.2 -> 41.177.98.176 TCP 70 49971 > http [ACK] Seq=865 Ack=5432 Win=524280 Len=0 TSval=466093726 TSecr=1564461
760205 245.174824 194.23.108.2 -> 41.177.98.176 TCP 70 49968 > http [ACK] Seq=3833 Ack=37653 Win=524280 Len=0 TSval=466093787 TSecr=1565075
800518 261.506451 194.23.108.2 -> 41.177.98.176 TCP 70 49968 > http [FIN, ACK] Seq=3833 Ack=37653 Win=524280 Len=0 TSval=466093950 TSecr=1565075
800520 261.506579 194.23.108.2 -> 41.177.98.176 TCP 70 49969 > http [FIN, ACK] Seq=866 Ack=624 Win=524280 Len=0 TSval=466093950 TSecr=1564460
800523 261.506625 194.23.108.2 -> 41.177.98.176 TCP 70 49970 > http [FIN, ACK] Seq=865 Ack=2204 Win=524280 Len=0 TSval=466093950 TSecr=1564461
800524 261.506698 194.23.108.2 -> 41.177.98.176 TCP 70 49971 > http [FIN, ACK] Seq=865 Ack=5432 Win=524280 Len=0 TSval=466093950 TSecr=1564461
800525 261.506781 194.23.108.2 -> 41.177.98.176 TCP 70 49972 > http [FIN, ACK] Seq=866 Ack=1536 Win=524280 Len=0 TSval=466093950 TSecr=1564461
800526 261.506859 194.23.108.2 -> 41.177.98.176 TCP 70 49973 > http [FIN, ACK] Seq=866 Ack=556 Win=524280 Len=0 TSval=466093950 TSecr=1564461
800535 261.509151 194.23.108.2 -> 41.177.98.176 TCP 82 49991 > http [SYN] Seq=0 Win=65535 Len=0 MSS=1460 WS=8 TSval=466093950 TSecr=0 SACK_PERM=1
800555 261.532699 194.23.108.2 -> 41.177.98.176 TCP 70 49991 > http [ACK] Seq=1 Ack=1 Win=524280 Len=0 TSval=466093951 TSecr=1566710
801127 261.863792 194.23.108.2 -> 41.177.98.176 TCP 70 49991 > http [ACK] Seq=1009 Ack=2897 Win=524176 Len=0 TSval=466093954 TSecr=1566743
801129 261.865010 194.23.108.2 -> 41.177.98.176 TCP 70 49991 > http [ACK] Seq=1009 Ack=4345 Win=524176 Len=0 TSval=466093954 TSecr=1566743
801154 261.888192 194.23.108.2 -> 41.177.98.176 TCP 70 49991 > http [ACK] Seq=1009 Ack=5220 Win=524280 Len=0 TSval=466093954 TSecr=1566746
842620 276.863766 194.23.108.2 -> 41.177.98.176 TCP 70 49991 > http [ACK] Seq=1009 Ack=5221 Win=524280 Len=0 TSval=466094104 TSecr=1568244
868902 287.218994 194.23.108.2 -> 41.177.98.176 TCP 70 49991 > http [FIN, ACK] Seq=1009 Ack=5221 Win=524280 Len=0 TSval=466094207 TSecr=1568244
868908 287.221024 194.23.108.2 -> 41.177.98.176 TCP 82 49992 > http [SYN] Seq=0 Win=65535 Len=0 MSS=1460 WS=8 TSval=466094207 TSecr=0 SACK_PERM=1
868994 287.244549 194.23.108.2 -> 41.177.98.176 TCP 70 49992 > http [ACK] Seq=1 Ack=1 Win=524280 Len=0 TSval=466094208 TSecr=1569282
870705 287.979350 194.23.108.2 -> 41.177.98.176 TCP 70 49992 > http [ACK] Seq=1091 Ack=2897 Win=524176 Len=0 TSval=466094215 TSecr=1569355
870713 287.980490 194.23.108.2 -> 41.177.98.176 TCP 70 49992 > http [ACK] Seq=1091 Ack=4345 Win=524176 Len=0 TSval=466094215 TSecr=1569355
870846 288.005663 194.23.108.2 -> 41.177.98.176 TCP 70 49992 > http [ACK] Seq=1091 Ack=7241 Win=524176 Len=0 TSval=466094215 TSecr=1569357
870851 288.006880 194.23.108.2 -> 41.177.98.176 TCP 70 49992 > http [ACK] Seq=1091 Ack=8689 Win=524176 Len=0 TSval=466094215 TSecr=1569357
870863 288.009325 194.23.108.2 -> 41.177.98.176 TCP 70 49992 > http [ACK] Seq=1091 Ack=11585 Win=524176 Len=0 TSval=466094215 TSecr=1569358
870910 288.032007 194.23.108.2 -> 41.177.98.176 TCP 70 49992 > http [ACK] Seq=1091 Ack=14481 Win=524280 Len=0 TSval=466094216 TSecr=1569360
870913 288.033230 194.23.108.2 -> 41.177.98.176 TCP 70 49992 > http [ACK] Seq=1091 Ack=15929 Win=524176 Len=0 TSval=466094216 TSecr=1569360
870917 288.035803 194.23.108.2 -> 41.177.98.176 TCP 70 49992 > http [ACK] Seq=1091 Ack=18607 Win=524280 Len=0 TSval=466094216 TSecr=1569360
872416 288.530088 194.23.108.2 -> 41.177.98.176 TCP 70 49992 > http [ACK] Seq=1961 Ack=20641 Win=524280 Len=0 TSval=466094221 TSecr=1569410
915297 303.532678 194.23.108.2 -> 41.177.98.176 TCP 70 49992 > http [ACK] Seq=1961 Ack=20642 Win=524280 Len=0 TSval=466094370 TSecr=1570911
954657 316.572339 194.23.108.2 -> 41.177.98.176 TCP 70 49992 > http [FIN, ACK] Seq=1961 Ack=20642 Win=524280 Len=0 TSval=466094501 TSecr=1570911
954659 316.574386 194.23.108.2 -> 41.177.98.176 TCP 82 49994 > http [SYN] Seq=0 Win=65535 Len=0 MSS=1460 WS=8 TSval=466094501 TSecr=0 SACK_PERM=1
954751 316.597914 194.23.108.2 -> 41.177.98.176 TCP 70 49994 > http [ACK] Seq=1 Ack=1 Win=524280 Len=0 TSval=466094501 TSecr=1572217
955608 316.992814 194.23.108.2 -> 41.177.98.176 TCP 70 49994 > http [ACK] Seq=1028 Ack=2897 Win=524176 Len=0 TSval=466094505 TSecr=1572256
955612 316.994040 194.23.108.2 -> 41.177.98.176 TCP 70 49994 > http [ACK] Seq=1028 Ack=4345 Win=524176 Len=0 TSval=466094505 TSecr=1572256
955836 317.019064 194.23.108.2 -> 41.177.98.176 TCP 70 49994 > http [ACK] Seq=1028 Ack=7241 Win=524176 Len=0 TSval=466094505 TSecr=1572259
955840 317.020218 194.23.108.2 -> 41.177.98.176 TCP 70 49994 > http [ACK] Seq=1028 Ack=8689 Win=524176 Len=0 TSval=466094505 TSecr=1572259
955847 317.022732 194.23.108.2 -> 41.177.98.176 TCP 70 49994 > http [ACK] Seq=1028 Ack=11585 Win=524176 Len=0 TSval=466094505 TSecr=1572259
955901 317.045316 194.23.108.2 -> 41.177.98.176 TCP 70 49994 > http [ACK] Seq=1028 Ack=14481 Win=524280 Len=0 TSval=466094506 TSecr=1572262
955910 317.046564 194.23.108.2 -> 41.177.98.176 TCP 70 49994 > http [ACK] Seq=1028 Ack=15929 Win=524176 Len=0 TSval=466094506 TSecr=1572262
955915 317.048997 194.23.108.2 -> 41.177.98.176 TCP 70 49994 > http [ACK] Seq=1028 Ack=18825 Win=524176 Len=0 TSval=466094506 TSecr=1572262
955919 317.051553 194.23.108.2 -> 41.177.98.176 TCP 70 49994 > http [ACK] Seq=1028 Ack=21721 Win=524280 Len=0 TSval=466094506 TSecr=1572262
955923 317.052685 194.23.108.2 -> 41.177.98.176 TCP 70 49994 > http [ACK] Seq=1028 Ack=23169 Win=524176 Len=0 TSval=466094506 TSecr=1572262
955958 317.071648 194.23.108.2 -> 41.177.98.176 TCP 70 49994 > http [ACK] Seq=1028 Ack=26065 Win=524280 Len=0 TSval=466094506 TSecr=1572264
955963 317.072776 194.23.108.2 -> 41.177.98.176 TCP 70 49994 > http [ACK] Seq=1028 Ack=27513 Win=524176 Len=0 TSval=466094506 TSecr=1572264
955967 317.075245 194.23.108.2 -> 41.177.98.176 TCP 70 49994 > http [ACK] Seq=1028 Ack=30409 Win=524176 Len=0 TSval=466094506 TSecr=1572264
955970 317.077792 194.23.108.2 -> 41.177.98.176 TCP 70 49994 > http [ACK] Seq=1028 Ack=33305 Win=524280 Len=0 TSval=466094506 TSecr=1572265
955974 317.078937 194.23.108.2 -> 41.177.98.176 TCP 70 49994 > http [ACK] Seq=1028 Ack=34753 Win=524176 Len=0 TSval=466094506 TSecr=1572265
955976 317.081384 194.23.108.2 -> 41.177.98.176 TCP 70 49994 > http [ACK] Seq=1028 Ack=37649 Win=524280 Len=0 TSval=466094506 TSecr=1572265
955977 317.082627 194.23.108.2 -> 41.177.98.176 TCP 70 49994 > http [ACK] Seq=1028 Ack=39097 Win=524176 Len=0 TSval=466094506 TSecr=1572265
955978 317.085110 194.23.108.2 -> 41.177.98.176 TCP 70 49994 > http [ACK] Seq=1028 Ack=41993 Win=524176 Len=0 TSval=466094506 TSecr=1572265
955991 317.097917 194.23.108.2 -> 41.177.98.176 TCP 70 49994 > http [ACK] Seq=1028 Ack=44889 Win=524280 Len=0 TSval=466094506 TSecr=1572267
955996 317.099125 194.23.108.2 -> 41.177.98.176 TCP 70 49994 > http [ACK] Seq=1028 Ack=46337 Win=524176 Len=0 TSval=466094506 TSecr=1572267
955999 317.099448 194.23.108.2 -> 41.177.98.176 TCP 70 49994 > http [ACK] Seq=1028 Ack=46706 Win=524280 Len=0 TSval=466094506 TSecr=1572267
995245 332.071639 194.23.108.2 -> 41.177.98.176 TCP 70 49994 > http [ACK] Seq=1028 Ack=46707 Win=524280 Len=0 TSval=466094656 TSecr=1573765
