514975 165.810248 194.66.204.111 -> 244.3.41.84  TCP 70 pt2-discover > telnet [ACK] Seq=16 Ack=1415 Win=46537 Len=0 TSval=99014 TSecr=4292425375
638347 201.459973 194.66.204.111 -> 244.3.41.84  TCP 70 pt2-discover > telnet [ACK] Seq=26 Ack=3117 Win=46537 Len=0 TSval=99370 TSecr=4292460190
644796 202.868279 194.66.204.111 -> 244.3.41.84  TCP 70 pt2-discover > telnet [ACK] Seq=36 Ack=4096 Win=46415 Len=0 TSval=99385 TSecr=4292461417
650183 204.086368 194.66.204.111 -> 244.3.41.84  TCP 70 pt2-discover > telnet [ACK] Seq=126 Ack=5810 Win=46537 Len=0 TSval=99397 TSecr=4292462755
713739 227.713335 194.66.204.111 -> 244.3.41.84  TCP 70 pt2-discover > telnet [ACK] Seq=136 Ack=6789 Win=46415 Len=0 TSval=99633 TSecr=4292485688
716960 228.791908 194.66.204.111 -> 244.3.41.84  TCP 70 pt2-discover > telnet [ACK] Seq=226 Ack=8710 Win=46537 Len=0 TSval=99643 TSecr=4292486881
927033 308.987826 194.66.204.111 -> 244.3.41.84  TCP 70 pt2-discover > telnet [ACK] Seq=236 Ack=8916 Win=46511 Len=0 TSval=100446 TSecr=4292565034
943424 313.413667 194.66.204.111 -> 244.3.41.84  TCP 70 pt2-discover > telnet [ACK] Seq=260 Ack=10165 Win=46537 Len=0 TSval=100490 TSecr=4292569376
