  9   0.001794 197.154.128.197 -> 244.3.160.239 TCP 66 http > 33224 [SYN, ACK] Seq=0 Ack=1 Win=5840 Len=0 MSS=1460 SACK_PERM=1
 23   0.002824 197.154.128.197 -> 244.3.160.239 TCP 64 http > 33224 [ACK] Seq=1 Ack=863 Win=6896 Len=0
115   0.019885 197.154.128.197 -> 244.3.160.239 TCP 66 http > 33225 [SYN, ACK] Seq=0 Ack=1 Win=5840 Len=0 MSS=1460 SACK_PERM=1
123   0.021095 197.154.128.197 -> 244.3.160.239 TCP 64 http > 33225 [ACK] Seq=1 Ack=869 Win=6944 Len=0
223   0.045024 197.154.128.197 -> 244.3.160.239 TCP 64 http > 33224 [FIN, ACK] Seq=3799 Ack=864 Win=6896 Len=0
286   0.057074 197.154.128.197 -> 244.3.160.239 TCP 64 http > 33225 [FIN, ACK] Seq=884 Ack=870 Win=6944 Len=0
293   0.061780 197.154.128.197 -> 244.3.160.239 TCP 66 http > 33226 [SYN, ACK] Seq=0 Ack=1 Win=5840 Len=0 MSS=1460 SACK_PERM=1
296   0.062655 197.154.128.197 -> 244.3.160.239 TCP 64 http > 33226 [ACK] Seq=1 Ack=869 Win=6944 Len=0
324   0.074440 197.154.128.197 -> 244.3.160.239 TCP 64 http > 33226 [FIN, ACK] Seq=2875 Ack=870 Win=6944 Len=0
422   0.097749 197.154.128.197 -> 244.3.160.239 TCP 66 http > 33227 [SYN, ACK] Seq=0 Ack=1 Win=5840 Len=0 MSS=1460 SACK_PERM=1
430   0.098903 197.154.128.197 -> 244.3.160.239 TCP 64 http > 33227 [ACK] Seq=1 Ack=864 Win=6904 Len=0
461   0.120831 197.154.128.197 -> 244.3.160.239 TCP 64 http > 33227 [FIN, ACK] Seq=816 Ack=865 Win=6904 Len=0
558   0.141746 197.154.128.197 -> 244.3.160.239 TCP 66 http > 33228 [SYN, ACK] Seq=0 Ack=1 Win=5840 Len=0 MSS=1460 SACK_PERM=1
563   0.142787 197.154.128.197 -> 244.3.160.239 TCP 64 http > 33228 [ACK] Seq=1 Ack=870 Win=6952 Len=0
645   0.160849 197.154.128.197 -> 244.3.160.239 TCP 66 http > 33229 [SYN, ACK] Seq=0 Ack=1 Win=5840 Len=0 MSS=1460 SACK_PERM=1
648   0.161977 197.154.128.197 -> 244.3.160.239 TCP 64 http > 33229 [ACK] Seq=1 Ack=860 Win=6872 Len=0
734   0.178382 197.154.128.197 -> 244.3.160.239 TCP 64 http > 33228 [FIN, ACK] Seq=953 Ack=871 Win=6952 Len=0
870   0.209597 197.154.128.197 -> 244.3.160.239 TCP 64 http > 33229 [FIN, ACK] Seq=533 Ack=861 Win=6872 Len=0
912   0.231200 197.154.128.197 -> 244.3.160.239 TCP 66 http > 33231 [SYN, ACK] Seq=0 Ack=1 Win=5840 Len=0 MSS=1460 SACK_PERM=1
915   0.232428 197.154.128.197 -> 244.3.160.239 TCP 64 http > 33231 [ACK] Seq=1 Ack=859 Win=6864 Len=0
927   0.239654 197.154.128.197 -> 244.3.160.239 TCP 64 http > 33231 [FIN, ACK] Seq=2702 Ack=860 Win=6864 Len=0
1061   0.281688 197.154.128.197 -> 244.3.160.239 TCP 66 http > 33232 [SYN, ACK] Seq=0 Ack=1 Win=5840 Len=0 MSS=1460 SACK_PERM=1
1081   0.282719 197.154.128.197 -> 244.3.160.239 TCP 64 http > 33232 [ACK] Seq=1 Ack=852 Win=6808 Len=0
1095   0.286520 197.154.128.197 -> 244.3.160.239 TCP 64 http > 33232 [FIN, ACK] Seq=992 Ack=853 Win=6808 Len=0
1179   0.321593 197.154.128.197 -> 244.3.160.239 TCP 66 http > 33233 [SYN, ACK] Seq=0 Ack=1 Win=5840 Len=0 MSS=1460 SACK_PERM=1
1182   0.322468 197.154.128.197 -> 244.3.160.239 TCP 64 http > 33233 [ACK] Seq=1 Ack=859 Win=6864 Len=0
1256   0.337274 197.154.128.197 -> 244.3.160.239 TCP 64 http > 33233 [FIN, ACK] Seq=2246 Ack=860 Win=6864 Len=0
1438   0.414800 197.154.128.197 -> 244.3.160.239 TCP 66 http > 33236 [SYN, ACK] Seq=0 Ack=1 Win=5840 Len=0 MSS=1460 SACK_PERM=1
1443   0.415903 197.154.128.197 -> 244.3.160.239 TCP 64 http > 33236 [ACK] Seq=1 Ack=856 Win=6840 Len=0
1476   0.425385 197.154.128.197 -> 244.3.160.239 TCP 64 http > 33236 [FIN, ACK] Seq=4481 Ack=857 Win=6840 Len=0
5661   1.776157 197.154.128.197 -> 244.3.160.239 TCP 66 http > 33239 [SYN, ACK] Seq=0 Ack=1 Win=5840 Len=0 MSS=1460 SACK_PERM=1
5673   1.777691 197.154.128.197 -> 244.3.160.239 TCP 64 http > 33239 [ACK] Seq=1 Ack=865 Win=6912 Len=0
5713   1.780703 197.154.128.197 -> 244.3.160.239 TCP 64 http > 33239 [FIN, ACK] Seq=777 Ack=866 Win=6912 Len=0
5923   1.856189 197.154.128.197 -> 244.3.160.239 TCP 66 http > 33240 [SYN, ACK] Seq=0 Ack=1 Win=5840 Len=0 MSS=1460 SACK_PERM=1
5933   1.857190 197.154.128.197 -> 244.3.160.239 TCP 64 http > 33240 [ACK] Seq=1 Ack=859 Win=6864 Len=0
5946   1.861478 197.154.128.197 -> 244.3.160.239 TCP 64 http > 33240 [FIN, ACK] Seq=1017 Ack=860 Win=6864 Len=0
6062   1.904859 197.154.128.197 -> 244.3.160.239 TCP 66 http > 33241 [SYN, ACK] Seq=0 Ack=1 Win=5840 Len=0 MSS=1460 SACK_PERM=1
6066   1.905827 197.154.128.197 -> 244.3.160.239 TCP 64 http > 33241 [ACK] Seq=1 Ack=871 Win=6960 Len=0
6319   1.983248 197.154.128.197 -> 244.3.160.239 TCP 64 http > 33241 [FIN, ACK] Seq=57567 Ack=872 Win=6960 Len=0
6490   2.127854 197.154.128.197 -> 244.3.160.239 TCP 66 http > 33242 [SYN, ACK] Seq=0 Ack=1 Win=5840 Len=0 MSS=1460 SACK_PERM=1
6493   2.128824 197.154.128.197 -> 244.3.160.239 TCP 64 http > 33242 [ACK] Seq=1 Ack=869 Win=6944 Len=0
6571   2.148694 197.154.128.197 -> 244.3.160.239 TCP 64 http > 33242 [FIN, ACK] Seq=22252 Ack=870 Win=6944 Len=0
6898   2.270620 197.154.128.197 -> 244.3.160.239 TCP 66 http > 33246 [SYN, ACK] Seq=0 Ack=1 Win=5840 Len=0 MSS=1460 SACK_PERM=1
6902   2.271572 197.154.128.197 -> 244.3.160.239 TCP 64 http > 33246 [ACK] Seq=1 Ack=878 Win=7016 Len=0
6910   2.276523 197.154.128.197 -> 244.3.160.239 TCP 64 http > 33246 [FIN, ACK] Seq=723 Ack=879 Win=7016 Len=0
6969   2.310178 197.154.128.197 -> 244.3.160.239 TCP 66 http > 33247 [SYN, ACK] Seq=0 Ack=1 Win=5840 Len=0 MSS=1460 SACK_PERM=1
6972   2.311151 197.154.128.197 -> 244.3.160.239 TCP 64 http > 33247 [ACK] Seq=1 Ack=869 Win=6944 Len=0
7033   2.322580 197.154.128.197 -> 244.3.160.239 TCP 64 http > 33247 [FIN, ACK] Seq=10917 Ack=870 Win=6944 Len=0
7150   2.385950 197.154.128.197 -> 244.3.160.239 TCP 66 http > 33248 [SYN, ACK] Seq=0 Ack=1 Win=5840 Len=0 MSS=1460 SACK_PERM=1
7153   2.386960 197.154.128.197 -> 244.3.160.239 TCP 64 http > 33248 [ACK] Seq=1 Ack=872 Win=6968 Len=0
7202   2.394613 197.154.128.197 -> 244.3.160.239 TCP 66 http > 33249 [SYN, ACK] Seq=0 Ack=1 Win=5840 Len=0 MSS=1460 SACK_PERM=1
7205   2.395554 197.154.128.197 -> 244.3.160.239 TCP 64 http > 33249 [ACK] Seq=1 Ack=863 Win=6896 Len=0
7493   2.534078 197.154.128.197 -> 244.3.160.239 TCP 64 http > 33248 [FIN, ACK] Seq=5013 Ack=873 Win=6968 Len=0
7495   2.534541 197.154.128.197 -> 244.3.160.239 TCP 64 http > 33249 [FIN, ACK] Seq=425 Ack=864 Win=6896 Len=0
7631   2.586521 197.154.128.197 -> 244.3.160.239 TCP 66 http > 33253 [SYN, ACK] Seq=0 Ack=1 Win=5840 Len=0 MSS=1460 SACK_PERM=1
7635   2.587398 197.154.128.197 -> 244.3.160.239 TCP 64 http > 33253 [ACK] Seq=1 Ack=874 Win=6984 Len=0
7657   2.594036 197.154.128.197 -> 244.3.160.239 TCP 66 http > 33254 [SYN, ACK] Seq=0 Ack=1 Win=5840 Len=0 MSS=1460 SACK_PERM=1
7660   2.595032 197.154.128.197 -> 244.3.160.239 TCP 64 http > 33254 [ACK] Seq=1 Ack=861 Win=6880 Len=0
7797   2.672262 197.154.128.197 -> 244.3.160.239 TCP 66 http > 33255 [SYN, ACK] Seq=0 Ack=1 Win=5840 Len=0 MSS=1460 SACK_PERM=1
7801   2.673154 197.154.128.197 -> 244.3.160.239 TCP 64 http > 33255 [ACK] Seq=1 Ack=865 Win=6912 Len=0
7878   2.757461 197.154.128.197 -> 244.3.160.239 TCP 64 http > 33254 [FIN, ACK] Seq=580 Ack=862 Win=6880 Len=0
7967   2.780599 197.154.128.197 -> 244.3.160.239 TCP 64 http > 33255 [FIN, ACK] Seq=381 Ack=866 Win=6912 Len=0
8019   2.803794 197.154.128.197 -> 244.3.160.239 TCP 66 http > 33257 [SYN, ACK] Seq=0 Ack=1 Win=5840 Len=0 MSS=1460 SACK_PERM=1
8022   2.804732 197.154.128.197 -> 244.3.160.239 TCP 64 http > 33257 [ACK] Seq=1 Ack=865 Win=6912 Len=0
8199   2.885578 197.154.128.197 -> 244.3.160.239 TCP 64 http > 33257 [FIN, ACK] Seq=422 Ack=866 Win=6912 Len=0
8300   2.944532 197.154.128.197 -> 244.3.160.239 TCP 66 http > 33260 [SYN, ACK] Seq=0 Ack=1 Win=5840 Len=0 MSS=1460 SACK_PERM=1
8307   2.945676 197.154.128.197 -> 244.3.160.239 TCP 64 http > 33260 [ACK] Seq=1 Ack=865 Win=6912 Len=0
8348   2.970677 197.154.128.197 -> 244.3.160.239 TCP 64 http > 33260 [FIN, ACK] Seq=426 Ack=866 Win=6912 Len=0
8411   3.001065 197.154.128.197 -> 244.3.160.239 TCP 66 http > 33261 [SYN, ACK] Seq=0 Ack=1 Win=5840 Len=0 MSS=1460 SACK_PERM=1
8418   3.002392 197.154.128.197 -> 244.3.160.239 TCP 64 http > 33261 [ACK] Seq=1 Ack=865 Win=6912 Len=0
8428   3.005975 197.154.128.197 -> 244.3.160.239 TCP 66 http > 33262 [SYN, ACK] Seq=0 Ack=1 Win=5840 Len=0 MSS=1460 SACK_PERM=1
8433   3.007026 197.154.128.197 -> 244.3.160.239 TCP 64 http > 33262 [ACK] Seq=1 Ack=866 Win=6920 Len=0
8447   3.020204 197.154.128.197 -> 244.3.160.239 TCP 64 http > 33253 [FIN, ACK] Seq=7605 Ack=875 Win=6984 Len=0
8459   3.021130 197.154.128.197 -> 244.3.160.239 TCP 64 http > 33261 [FIN, ACK] Seq=413 Ack=866 Win=6912 Len=0
8462   3.021440 197.154.128.197 -> 244.3.160.239 TCP 64 http > 33262 [FIN, ACK] Seq=2212 Ack=867 Win=6920 Len=0
8663   3.054642 197.154.128.197 -> 244.3.160.239 TCP 66 http > 33267 [SYN, ACK] Seq=0 Ack=1 Win=5840 Len=0 MSS=1460 SACK_PERM=1
8672   3.055678 197.154.128.197 -> 244.3.160.239 TCP 64 http > 33267 [ACK] Seq=1 Ack=870 Win=6952 Len=0
8705   3.061960 197.154.128.197 -> 244.3.160.239 TCP 66 http > 33268 [SYN, ACK] Seq=0 Ack=1 Win=5840 Len=0 MSS=1460 SACK_PERM=1
8711   3.062867 197.154.128.197 -> 244.3.160.239 TCP 64 http > 33268 [ACK] Seq=1 Ack=862 Win=6888 Len=0
8854   3.175623 197.154.128.197 -> 244.3.160.239 TCP 64 http > 33267 [FIN, ACK] Seq=2341 Ack=871 Win=6952 Len=0
8861   3.176808 197.154.128.197 -> 244.3.160.239 TCP 64 http > 33268 [FIN, ACK] Seq=1040 Ack=863 Win=6888 Len=0
8947   3.199832 197.154.128.197 -> 244.3.160.239 TCP 66 http > 33270 [SYN, ACK] Seq=0 Ack=1 Win=5840 Len=0 MSS=1460 SACK_PERM=1
8950   3.200908 197.154.128.197 -> 244.3.160.239 TCP 64 http > 33270 [ACK] Seq=1 Ack=861 Win=6880 Len=0
8957   3.203768 197.154.128.197 -> 244.3.160.239 TCP 66 http > 33271 [SYN, ACK] Seq=0 Ack=1 Win=5840 Len=0 MSS=1460 SACK_PERM=1
8963   3.204959 197.154.128.197 -> 244.3.160.239 TCP 64 http > 33271 [ACK] Seq=1 Ack=864 Win=6904 Len=0
9186   3.328105 197.154.128.197 -> 244.3.160.239 TCP 66 http > 33273 [SYN, ACK] Seq=0 Ack=1 Win=5840 Len=0 MSS=1460 SACK_PERM=1
9192   3.329062 197.154.128.197 -> 244.3.160.239 TCP 64 http > 33273 [ACK] Seq=1 Ack=861 Win=6880 Len=0
9535   3.393971 197.154.128.197 -> 244.3.160.239 TCP 64 http > 33270 [FIN, ACK] Seq=1794 Ack=862 Win=6880 Len=0
9646   3.406622 197.154.128.197 -> 244.3.160.239 TCP 64 http > 33271 [FIN, ACK] Seq=594 Ack=865 Win=6904 Len=0
9936   3.508960 197.154.128.197 -> 244.3.160.239 TCP 64 http > 33273 [FIN, ACK] Seq=3502 Ack=862 Win=6880 Len=0
14323   4.069571 197.154.128.197 -> 244.3.160.239 TCP 66 http > 33277 [SYN, ACK] Seq=0 Ack=1 Win=5840 Len=0 MSS=1460 SACK_PERM=1
14326   4.071131 197.154.128.197 -> 244.3.160.239 TCP 64 http > 33277 [ACK] Seq=1 Ack=649 Win=7128 Len=0
15638   4.232694 197.154.128.197 -> 244.3.160.239 TCP 64 http > 33277 [FIN, ACK] Seq=1194 Ack=650 Win=7128 Len=0
52076  21.446283 197.154.128.197 -> 244.3.160.239 TCP 66 http > 33360 [SYN, ACK] Seq=0 Ack=1 Win=5840 Len=0 MSS=1460 SACK_PERM=1
52085  21.448536 197.154.128.197 -> 244.3.160.239 TCP 64 http > 33360 [ACK] Seq=1 Ack=1387 Win=8316 Len=0
53002  22.106132 197.154.128.197 -> 244.3.160.239 TCP 66 http > 33362 [SYN, ACK] Seq=0 Ack=1 Win=5840 Len=0 MSS=1460 SACK_PERM=1
53021  22.107792 197.154.128.197 -> 244.3.160.239 TCP 66 http > 33363 [SYN, ACK] Seq=0 Ack=1 Win=5840 Len=0 MSS=1460 SACK_PERM=1
53031  22.108968 197.154.128.197 -> 244.3.160.239 TCP 66 http > 33364 [SYN, ACK] Seq=0 Ack=1 Win=5840 Len=0 MSS=1460 SACK_PERM=1
53038  22.109477 197.154.128.197 -> 244.3.160.239 TCP 64 http > 33363 [ACK] Seq=1 Ack=953 Win=7616 Len=0
53041  22.110284 197.154.128.197 -> 244.3.160.239 TCP 64 http > 33362 [ACK] Seq=1 Ack=937 Win=7488 Len=0
53050  22.111136 197.154.128.197 -> 244.3.160.239 TCP 64 http > 33364 [ACK] Seq=1 Ack=953 Win=7616 Len=0
53056  22.112141 197.154.128.197 -> 244.3.160.239 TCP 66 http > 33365 [SYN, ACK] Seq=0 Ack=1 Win=5840 Len=0 MSS=1460 SACK_PERM=1
53062  22.113191 197.154.128.197 -> 244.3.160.239 TCP 64 http > 33365 [ACK] Seq=1 Ack=934 Win=7464 Len=0
53099  22.117291 197.154.128.197 -> 244.3.160.239 TCP 64 http > 33363 [FIN, ACK] Seq=354 Ack=954 Win=7616 Len=0
53100  22.117295 197.154.128.197 -> 244.3.160.239 TCP 64 http > 33362 [FIN, ACK] Seq=393 Ack=938 Win=7488 Len=0
53177  22.128033 197.154.128.197 -> 244.3.160.239 TCP 64 http > 33364 [FIN, ACK] Seq=8359 Ack=954 Win=7616 Len=0
53226  22.139988 197.154.128.197 -> 244.3.160.239 TCP 64 http > 33360 [FIN, ACK] Seq=84361 Ack=1388 Win=8316 Len=0
53235  22.140531 197.154.128.197 -> 244.3.160.239 TCP 64 http > 33365 [FIN, ACK] Seq=3225 Ack=935 Win=7464 Len=0
53253  22.142765 197.154.128.197 -> 244.3.160.239 TCP 66 http > 33366 [SYN, ACK] Seq=0 Ack=1 Win=5840 Len=0 MSS=1460 SACK_PERM=1
53260  22.144149 197.154.128.197 -> 244.3.160.239 TCP 64 http > 33366 [ACK] Seq=1 Ack=932 Win=7448 Len=0
53265  22.145187 197.154.128.197 -> 244.3.160.239 TCP 66 http > 33367 [SYN, ACK] Seq=0 Ack=1 Win=5840 Len=0 MSS=1460 SACK_PERM=1
53269  22.146439 197.154.128.197 -> 244.3.160.239 TCP 64 http > 33367 [ACK] Seq=1 Ack=946 Win=7560 Len=0
53270  22.146444 197.154.128.197 -> 244.3.160.239 TCP 66 http > 33368 [SYN, ACK] Seq=0 Ack=1 Win=5840 Len=0 MSS=1460 SACK_PERM=1
53273  22.147391 197.154.128.197 -> 244.3.160.239 TCP 64 http > 33368 [ACK] Seq=1 Ack=952 Win=7608 Len=0
53286  22.154488 197.154.128.197 -> 244.3.160.239 TCP 66 http > 33369 [SYN, ACK] Seq=0 Ack=1 Win=5840 Len=0 MSS=1460 SACK_PERM=1
53291  22.155496 197.154.128.197 -> 244.3.160.239 TCP 64 http > 33369 [ACK] Seq=1 Ack=932 Win=7448 Len=0
53316  22.165794 197.154.128.197 -> 244.3.160.239 TCP 64 http > 33367 [FIN, ACK] Seq=508 Ack=947 Win=7560 Len=0
53318  22.166813 197.154.128.197 -> 244.3.160.239 TCP 64 http > 33368 [FIN, ACK] Seq=1742 Ack=953 Win=7608 Len=0
53361  22.177994 197.154.128.197 -> 244.3.160.239 TCP 66 http > 33370 [SYN, ACK] Seq=0 Ack=1 Win=5840 Len=0 MSS=1460 SACK_PERM=1
53367  22.179065 197.154.128.197 -> 244.3.160.239 TCP 64 http > 33370 [ACK] Seq=1 Ack=948 Win=7576 Len=0
53442  22.187834 197.154.128.197 -> 244.3.160.239 TCP 66 http > 33371 [SYN, ACK] Seq=0 Ack=1 Win=5840 Len=0 MSS=1460 SACK_PERM=1
53449  22.188683 197.154.128.197 -> 244.3.160.239 TCP 64 http > 33371 [ACK] Seq=1 Ack=933 Win=7456 Len=0
53653  22.222408 197.154.128.197 -> 244.3.160.239 TCP 64 http > 33370 [FIN, ACK] Seq=1325 Ack=949 Win=7576 Len=0
53792  22.249087 197.154.128.197 -> 244.3.160.239 TCP 66 http > 33372 [SYN, ACK] Seq=0 Ack=1 Win=5840 Len=0 MSS=1460 SACK_PERM=1
53801  22.249937 197.154.128.197 -> 244.3.160.239 TCP 64 http > 33372 [ACK] Seq=1 Ack=958 Win=7656 Len=0
53895  22.276450 197.154.128.197 -> 244.3.160.239 TCP 64 http > 33369 [FIN, ACK] Seq=142534 Ack=933 Win=7448 Len=0
53903  22.282023 197.154.128.197 -> 244.3.160.239 TCP 64 http > 33371 [FIN, ACK] Seq=3333 Ack=934 Win=7456 Len=0
53926  22.293171 197.154.128.197 -> 244.3.160.239 TCP 64 http > 33372 [FIN, ACK] Seq=2768 Ack=959 Win=7656 Len=0
54111  22.355772 197.154.128.197 -> 244.3.160.239 TCP 64 http > 33366 [FIN, ACK] Seq=47722 Ack=933 Win=7448 Len=0
54537  22.584741 197.154.128.197 -> 244.3.160.239 TCP 66 http > 33374 [SYN, ACK] Seq=0 Ack=1 Win=5840 Len=0 MSS=1460 SACK_PERM=1
54544  22.586041 197.154.128.197 -> 244.3.160.239 TCP 66 http > 33375 [SYN, ACK] Seq=0 Ack=1 Win=5840 Len=0 MSS=1460 SACK_PERM=1
54547  22.586530 197.154.128.197 -> 244.3.160.239 TCP 64 http > 33374 [ACK] Seq=1 Ack=929 Win=7424 Len=0
54548  22.587110 197.154.128.197 -> 244.3.160.239 TCP 64 http > 33375 [ACK] Seq=1 Ack=944 Win=7544 Len=0
54558  22.590107 197.154.128.197 -> 244.3.160.239 TCP 66 http > 33376 [SYN, ACK] Seq=0 Ack=1 Win=5840 Len=0 MSS=1460 SACK_PERM=1
54568  22.592846 197.154.128.197 -> 244.3.160.239 TCP 64 http > 33376 [ACK] Seq=1 Ack=936 Win=7480 Len=0
54570  22.593497 197.154.128.197 -> 244.3.160.239 TCP 66 http > 33377 [SYN, ACK] Seq=0 Ack=1 Win=5840 Len=0 MSS=1460 SACK_PERM=1
54576  22.596280 197.154.128.197 -> 244.3.160.239 TCP 64 http > 33377 [ACK] Seq=1 Ack=919 Win=7344 Len=0
54630  22.622888 197.154.128.197 -> 244.3.160.239 TCP 64 http > 33375 [FIN, ACK] Seq=2857 Ack=945 Win=7544 Len=0
54723  22.666899 197.154.128.197 -> 244.3.160.239 TCP 64 http > 33374 [FIN, ACK] Seq=392 Ack=930 Win=7424 Len=0
54959  22.721921 197.154.128.197 -> 244.3.160.239 TCP 64 http > 33377 [FIN, ACK] Seq=57689 Ack=920 Win=7344 Len=0
54975  22.732110 197.154.128.197 -> 244.3.160.239 TCP 64 http > 33376 [FIN, ACK] Seq=3540 Ack=937 Win=7480 Len=0
54999  22.738994 197.154.128.197 -> 244.3.160.239 TCP 66 http > 33380 [SYN, ACK] Seq=0 Ack=1 Win=5840 Len=0 MSS=1460 SACK_PERM=1
55001  22.739244 197.154.128.197 -> 244.3.160.239 TCP 66 http > 33381 [SYN, ACK] Seq=0 Ack=1 Win=5840 Len=0 MSS=1460 SACK_PERM=1
55009  22.740105 197.154.128.197 -> 244.3.160.239 TCP 64 http > 33380 [ACK] Seq=1 Ack=932 Win=7448 Len=0
55010  22.740301 197.154.128.197 -> 244.3.160.239 TCP 64 http > 33381 [ACK] Seq=1 Ack=940 Win=7512 Len=0
55053  22.765637 197.154.128.197 -> 244.3.160.239 TCP 66 http > 33383 [SYN, ACK] Seq=0 Ack=1 Win=5840 Len=0 MSS=1460 SACK_PERM=1
55057  22.766174 197.154.128.197 -> 244.3.160.239 TCP 66 http > 33384 [SYN, ACK] Seq=0 Ack=1 Win=5840 Len=0 MSS=1460 SACK_PERM=1
55060  22.766485 197.154.128.197 -> 244.3.160.239 TCP 64 http > 33383 [ACK] Seq=1 Ack=919 Win=7344 Len=0
55062  22.767103 197.154.128.197 -> 244.3.160.239 TCP 64 http > 33384 [ACK] Seq=1 Ack=954 Win=7624 Len=0
55162  22.789331 197.154.128.197 -> 244.3.160.239 TCP 64 http > 33380 [FIN, ACK] Seq=22675 Ack=933 Win=7448 Len=0
55205  22.809441 197.154.128.197 -> 244.3.160.239 TCP 66 http > 33386 [SYN, ACK] Seq=0 Ack=1 Win=5840 Len=0 MSS=1460 SACK_PERM=1
55208  22.810368 197.154.128.197 -> 244.3.160.239 TCP 64 http > 33386 [ACK] Seq=1 Ack=947 Win=7568 Len=0
55264  22.820890 197.154.128.197 -> 244.3.160.239 TCP 66 http > 33387 [SYN, ACK] Seq=0 Ack=1 Win=5840 Len=0 MSS=1460 SACK_PERM=1
55267  22.821516 197.154.128.197 -> 244.3.160.239 TCP 66 http > 33388 [SYN, ACK] Seq=0 Ack=1 Win=5840 Len=0 MSS=1460 SACK_PERM=1
55272  22.822260 197.154.128.197 -> 244.3.160.239 TCP 64 http > 33387 [ACK] Seq=1 Ack=953 Win=7616 Len=0
55274  22.822427 197.154.128.197 -> 244.3.160.239 TCP 64 http > 33388 [ACK] Seq=1 Ack=949 Win=7584 Len=0
55276  22.822690 197.154.128.197 -> 244.3.160.239 TCP 66 http > 33389 [SYN, ACK] Seq=0 Ack=1 Win=5840 Len=0 MSS=1460 SACK_PERM=1
55280  22.823861 197.154.128.197 -> 244.3.160.239 TCP 64 http > 33389 [ACK] Seq=1 Ack=959 Win=7664 Len=0
55399  22.881457 197.154.128.197 -> 244.3.160.239 TCP 64 http > 33383 [FIN, ACK] Seq=358 Ack=920 Win=7344 Len=0
55421  22.882962 197.154.128.197 -> 244.3.160.239 TCP 64 http > 33381 [FIN, ACK] Seq=869 Ack=941 Win=7512 Len=0
55423  22.883264 197.154.128.197 -> 244.3.160.239 TCP 64 http > 33384 [FIN, ACK] Seq=587 Ack=955 Win=7624 Len=0
55462  22.889219 197.154.128.197 -> 244.3.160.239 TCP 66 http > 33390 [SYN, ACK] Seq=0 Ack=1 Win=5840 Len=0 MSS=1460 SACK_PERM=1
55467  22.890162 197.154.128.197 -> 244.3.160.239 TCP 64 http > 33390 [ACK] Seq=1 Ack=958 Win=7656 Len=0
55469  22.890611 197.154.128.197 -> 244.3.160.239 TCP 66 http > 33391 [SYN, ACK] Seq=0 Ack=1 Win=5840 Len=0 MSS=1460 SACK_PERM=1
55473  22.891229 197.154.128.197 -> 244.3.160.239 TCP 66 http > 33392 [SYN, ACK] Seq=0 Ack=1 Win=5840 Len=0 MSS=1460 SACK_PERM=1
55476  22.891560 197.154.128.197 -> 244.3.160.239 TCP 64 http > 33391 [ACK] Seq=1 Ack=960 Win=7672 Len=0
55478  22.891860 197.154.128.197 -> 244.3.160.239 TCP 66 http > 33393 [SYN, ACK] Seq=0 Ack=1 Win=5840 Len=0 MSS=1460 SACK_PERM=1
55481  22.892071 197.154.128.197 -> 244.3.160.239 TCP 64 http > 33392 [ACK] Seq=1 Ack=958 Win=7656 Len=0
55487  22.892732 197.154.128.197 -> 244.3.160.239 TCP 64 http > 33393 [ACK] Seq=1 Ack=961 Win=7680 Len=0
55780  22.947902 197.154.128.197 -> 244.3.160.239 TCP 64 http > 33388 [FIN, ACK] Seq=470 Ack=950 Win=7584 Len=0
55793  22.949351 197.154.128.197 -> 244.3.160.239 TCP 64 http > 33386 [FIN, ACK] Seq=684 Ack=948 Win=7568 Len=0
55795  22.949454 197.154.128.197 -> 244.3.160.239 TCP 64 http > 33387 [FIN, ACK] Seq=372 Ack=954 Win=7616 Len=0
55810  22.951512 197.154.128.197 -> 244.3.160.239 TCP 64 http > 33389 [FIN, ACK] Seq=900 Ack=960 Win=7664 Len=0
55840  22.955441 197.154.128.197 -> 244.3.160.239 TCP 66 http > 33394 [SYN, ACK] Seq=0 Ack=1 Win=5840 Len=0 MSS=1460 SACK_PERM=1
55843  22.955835 197.154.128.197 -> 244.3.160.239 TCP 66 http > 33395 [SYN, ACK] Seq=0 Ack=1 Win=5840 Len=0 MSS=1460 SACK_PERM=1
55849  22.956710 197.154.128.197 -> 244.3.160.239 TCP 64 http > 33395 [ACK] Seq=1 Ack=942 Win=7528 Len=0
55851  22.957162 197.154.128.197 -> 244.3.160.239 TCP 64 http > 33394 [ACK] Seq=1 Ack=956 Win=7640 Len=0
55852  22.957446 197.154.128.197 -> 244.3.160.239 TCP 66 http > 33396 [SYN, ACK] Seq=0 Ack=1 Win=5840 Len=0 MSS=1460 SACK_PERM=1
55856  22.958070 197.154.128.197 -> 244.3.160.239 TCP 66 http > 33397 [SYN, ACK] Seq=0 Ack=1 Win=5840 Len=0 MSS=1460 SACK_PERM=1
55858  22.958397 197.154.128.197 -> 244.3.160.239 TCP 64 http > 33396 [ACK] Seq=1 Ack=931 Win=7440 Len=0
55860  22.959058 197.154.128.197 -> 244.3.160.239 TCP 64 http > 33397 [ACK] Seq=1 Ack=942 Win=7528 Len=0
56142  23.065438 197.154.128.197 -> 244.3.160.239 TCP 64 http > 33390 [FIN, ACK] Seq=933 Ack=959 Win=7656 Len=0
56143  23.065443 197.154.128.197 -> 244.3.160.239 TCP 64 http > 33393 [FIN, ACK] Seq=861 Ack=962 Win=7680 Len=0
56144  23.065512 197.154.128.197 -> 244.3.160.239 TCP 64 http > 33394 [FIN, ACK] Seq=1135 Ack=957 Win=7640 Len=0
56148  23.065613 197.154.128.197 -> 244.3.160.239 TCP 64 http > 33397 [FIN, ACK] Seq=1612 Ack=943 Win=7528 Len=0
56171  23.071462 197.154.128.197 -> 244.3.160.239 TCP 66 http > 33398 [SYN, ACK] Seq=0 Ack=1 Win=5840 Len=0 MSS=1460 SACK_PERM=1
56175  23.072299 197.154.128.197 -> 244.3.160.239 TCP 64 http > 33398 [ACK] Seq=1 Ack=918 Win=7336 Len=0
56177  23.072581 197.154.128.197 -> 244.3.160.239 TCP 66 http > 33399 [SYN, ACK] Seq=0 Ack=1 Win=5840 Len=0 MSS=1460 SACK_PERM=1
56179  23.072906 197.154.128.197 -> 244.3.160.239 TCP 66 http > 33400 [SYN, ACK] Seq=0 Ack=1 Win=5840 Len=0 MSS=1460 SACK_PERM=1
56184  23.073522 197.154.128.197 -> 244.3.160.239 TCP 64 http > 33399 [ACK] Seq=1 Ack=945 Win=7552 Len=0
56187  23.073901 197.154.128.197 -> 244.3.160.239 TCP 64 http > 33400 [ACK] Seq=1 Ack=930 Win=7432 Len=0
56188  23.073906 197.154.128.197 -> 244.3.160.239 TCP 66 http > 33401 [SYN, ACK] Seq=0 Ack=1 Win=5840 Len=0 MSS=1460 SACK_PERM=1
56194  23.075234 197.154.128.197 -> 244.3.160.239 TCP 64 http > 33401 [ACK] Seq=1 Ack=925 Win=7392 Len=0
56252  23.093692 197.154.128.197 -> 244.3.160.239 TCP 64 http > 33391 [ACK] Seq=1339 Ack=961 Win=7672 Len=0
56253  23.093697 197.154.128.197 -> 244.3.160.239 TCP 64 http > 33392 [ACK] Seq=904 Ack=959 Win=7656 Len=0
56263  23.095648 197.154.128.197 -> 244.3.160.239 TCP 64 http > 33395 [ACK] Seq=388 Ack=943 Win=7528 Len=0
56290  23.117502 197.154.128.197 -> 244.3.160.239 TCP 64 http > 33391 [FIN, ACK] Seq=1339 Ack=961 Win=7672 Len=0
56345  23.127983 197.154.128.197 -> 244.3.160.239 TCP 64 http > 33392 [FIN, ACK] Seq=904 Ack=959 Win=7656 Len=0
56346  23.128036 197.154.128.197 -> 244.3.160.239 TCP 64 http > 33395 [FIN, ACK] Seq=388 Ack=943 Win=7528 Len=0
56413  23.174062 197.154.128.197 -> 244.3.160.239 TCP 66 http > 33402 [SYN, ACK] Seq=0 Ack=1 Win=5840 Len=0 MSS=1460 SACK_PERM=1
56418  23.175015 197.154.128.197 -> 244.3.160.239 TCP 66 http > 33403 [SYN, ACK] Seq=0 Ack=1 Win=5840 Len=0 MSS=1460 SACK_PERM=1
56420  23.175382 197.154.128.197 -> 244.3.160.239 TCP 64 http > 33402 [ACK] Seq=1 Ack=930 Win=7432 Len=0
56424  23.176094 197.154.128.197 -> 244.3.160.239 TCP 64 http > 33403 [ACK] Seq=1 Ack=932 Win=7448 Len=0
56449  23.188323 197.154.128.197 -> 244.3.160.239 TCP 64 http > 33396 [FIN, ACK] Seq=22487 Ack=932 Win=7440 Len=0
56618  23.273728 197.154.128.197 -> 244.3.160.239 TCP 64 http > 33400 [FIN, ACK] Seq=362 Ack=931 Win=7432 Len=0
56622  23.274031 197.154.128.197 -> 244.3.160.239 TCP 64 http > 33401 [FIN, ACK] Seq=362 Ack=926 Win=7392 Len=0
56666  23.286063 197.154.128.197 -> 244.3.160.239 TCP 66 http > 33405 [SYN, ACK] Seq=0 Ack=1 Win=5840 Len=0 MSS=1460 SACK_PERM=1
56671  23.287662 197.154.128.197 -> 244.3.160.239 TCP 66 http > 33406 [SYN, ACK] Seq=0 Ack=1 Win=5840 Len=0 MSS=1460 SACK_PERM=1
56672  23.287667 197.154.128.197 -> 244.3.160.239 TCP 66 http > 33407 [SYN, ACK] Seq=0 Ack=1 Win=5840 Len=0 MSS=1460 SACK_PERM=1
56675  23.287915 197.154.128.197 -> 244.3.160.239 TCP 64 http > 33405 [ACK] Seq=1 Ack=928 Win=7416 Len=0
56679  23.288574 197.154.128.197 -> 244.3.160.239 TCP 64 http > 33406 [ACK] Seq=1 Ack=930 Win=7432 Len=0
56680  23.288730 197.154.128.197 -> 244.3.160.239 TCP 66 http > 33408 [SYN, ACK] Seq=0 Ack=1 Win=5840 Len=0 MSS=1460 SACK_PERM=1
56681  23.288734 197.154.128.197 -> 244.3.160.239 TCP 64 http > 33407 [ACK] Seq=1 Ack=923 Win=7376 Len=0
56684  23.289610 197.154.128.197 -> 244.3.160.239 TCP 64 http > 33408 [ACK] Seq=1 Ack=928 Win=7416 Len=0
57032  23.391844 197.154.128.197 -> 244.3.160.239 TCP 64 http > 33399 [FIN, ACK] Seq=869 Ack=946 Win=7552 Len=0
57034  23.391936 197.154.128.197 -> 244.3.160.239 TCP 64 http > 33398 [FIN, ACK] Seq=304 Ack=919 Win=7336 Len=0
57035  23.391940 197.154.128.197 -> 244.3.160.239 TCP 64 http > 33403 [FIN, ACK] Seq=460 Ack=933 Win=7448 Len=0
57045  23.392814 197.154.128.197 -> 244.3.160.239 TCP 66 http > 33409 [SYN, ACK] Seq=0 Ack=1 Win=5840 Len=0 MSS=1460 SACK_PERM=1
57057  23.393989 197.154.128.197 -> 244.3.160.239 TCP 66 http > 33410 [SYN, ACK] Seq=0 Ack=1 Win=5840 Len=0 MSS=1460 SACK_PERM=1
57065  23.394705 197.154.128.197 -> 244.3.160.239 TCP 66 http > 33411 [SYN, ACK] Seq=0 Ack=1 Win=5840 Len=0 MSS=1460 SACK_PERM=1
57068  23.395066 197.154.128.197 -> 244.3.160.239 TCP 64 http > 33409 [ACK] Seq=1 Ack=924 Win=7384 Len=0
57069  23.395070 197.154.128.197 -> 244.3.160.239 TCP 66 http > 33412 [SYN, ACK] Seq=0 Ack=1 Win=5840 Len=0 MSS=1460 SACK_PERM=1
57079  23.395595 197.154.128.197 -> 244.3.160.239 TCP 64 http > 33410 [ACK] Seq=1 Ack=930 Win=7432 Len=0
57080  23.395599 197.154.128.197 -> 244.3.160.239 TCP 64 http > 33411 [ACK] Seq=1 Ack=928 Win=7416 Len=0
57086  23.395953 197.154.128.197 -> 244.3.160.239 TCP 64 http > 33412 [ACK] Seq=1 Ack=927 Win=7408 Len=0
57109  23.399069 197.154.128.197 -> 244.3.160.239 TCP 64 http > 33402 [FIN, ACK] Seq=363 Ack=931 Win=7432 Len=0
57472  23.494138 197.154.128.197 -> 244.3.160.239 TCP 64 http > 33405 [FIN, ACK] Seq=362 Ack=929 Win=7416 Len=0
57493  23.495214 197.154.128.197 -> 244.3.160.239 TCP 64 http > 33406 [FIN, ACK] Seq=390 Ack=931 Win=7432 Len=0
57516  23.495860 197.154.128.197 -> 244.3.160.239 TCP 64 http > 33407 [FIN, ACK] Seq=390 Ack=924 Win=7376 Len=0
57587  23.501153 197.154.128.197 -> 244.3.160.239 TCP 66 http > 33413 [SYN, ACK] Seq=0 Ack=1 Win=5840 Len=0 MSS=1460 SACK_PERM=1
57594  23.502128 197.154.128.197 -> 244.3.160.239 TCP 64 http > 33413 [ACK] Seq=1 Ack=922 Win=7368 Len=0
57599  23.502663 197.154.128.197 -> 244.3.160.239 TCP 64 http > 33408 [FIN, ACK] Seq=456 Ack=929 Win=7416 Len=0
57624  23.504859 197.154.128.197 -> 244.3.160.239 TCP 66 http > 33414 [SYN, ACK] Seq=0 Ack=1 Win=5840 Len=0 MSS=1460 SACK_PERM=1
57634  23.506173 197.154.128.197 -> 244.3.160.239 TCP 66 http > 33415 [SYN, ACK] Seq=0 Ack=1 Win=5840 Len=0 MSS=1460 SACK_PERM=1
57636  23.506345 197.154.128.197 -> 244.3.160.239 TCP 64 http > 33414 [ACK] Seq=1 Ack=923 Win=7376 Len=0
57644  23.507459 197.154.128.197 -> 244.3.160.239 TCP 66 http > 33416 [SYN, ACK] Seq=0 Ack=1 Win=5840 Len=0 MSS=1460 SACK_PERM=1
57646  23.507571 197.154.128.197 -> 244.3.160.239 TCP 64 http > 33415 [ACK] Seq=1 Ack=922 Win=7368 Len=0
57651  23.508406 197.154.128.197 -> 244.3.160.239 TCP 64 http > 33416 [ACK] Seq=1 Ack=923 Win=7376 Len=0
58042  23.605130 197.154.128.197 -> 244.3.160.239 TCP 64 http > 33410 [FIN, ACK] Seq=5232 Ack=931 Win=7432 Len=0
58104  23.613016 197.154.128.197 -> 244.3.160.239 TCP 66 http > 33417 [SYN, ACK] Seq=0 Ack=1 Win=5840 Len=0 MSS=1460 SACK_PERM=1
58123  23.616230 197.154.128.197 -> 244.3.160.239 TCP 64 http > 33417 [ACK] Seq=1 Ack=939 Win=7504 Len=0
58124  23.616234 197.154.128.197 -> 244.3.160.239 TCP 66 http > 33418 [SYN, ACK] Seq=0 Ack=1 Win=5840 Len=0 MSS=1460 SACK_PERM=1
58138  23.617902 197.154.128.197 -> 244.3.160.239 TCP 64 http > 33418 [ACK] Seq=1 Ack=935 Win=7472 Len=0
58139  23.617920 197.154.128.197 -> 244.3.160.239 TCP 66 http > 33419 [SYN, ACK] Seq=0 Ack=1 Win=5840 Len=0 MSS=1460 SACK_PERM=1
58145  23.618828 197.154.128.197 -> 244.3.160.239 TCP 64 http > 33419 [ACK] Seq=1 Ack=924 Win=7384 Len=0
58147  23.618888 197.154.128.197 -> 244.3.160.239 TCP 66 http > 33420 [SYN, ACK] Seq=0 Ack=1 Win=5840 Len=0 MSS=1460 SACK_PERM=1
58156  23.619811 197.154.128.197 -> 244.3.160.239 TCP 64 http > 33420 [ACK] Seq=1 Ack=939 Win=7504 Len=0
58207  23.629518 197.154.128.197 -> 244.3.160.239 TCP 64 http > 33409 [FIN, ACK] Seq=454 Ack=925 Win=7384 Len=0
58209  23.629646 197.154.128.197 -> 244.3.160.239 TCP 64 http > 33411 [FIN, ACK] Seq=438 Ack=929 Win=7416 Len=0
58210  23.629650 197.154.128.197 -> 244.3.160.239 TCP 64 http > 33412 [FIN, ACK] Seq=343 Ack=928 Win=7408 Len=0
58586  23.707430 197.154.128.197 -> 244.3.160.239 TCP 64 http > 33413 [FIN, ACK] Seq=662 Ack=923 Win=7368 Len=0
58591  23.707737 197.154.128.197 -> 244.3.160.239 TCP 64 http > 33414 [FIN, ACK] Seq=869 Ack=924 Win=7376 Len=0
58592  23.707742 197.154.128.197 -> 244.3.160.239 TCP 64 http > 33415 [FIN, ACK] Seq=1416 Ack=923 Win=7368 Len=0
58595  23.707928 197.154.128.197 -> 244.3.160.239 TCP 64 http > 33416 [FIN, ACK] Seq=447 Ack=924 Win=7376 Len=0
58717  23.726638 197.154.128.197 -> 244.3.160.239 TCP 66 http > 33421 [SYN, ACK] Seq=0 Ack=1 Win=5840 Len=0 MSS=1460 SACK_PERM=1
58719  23.727130 197.154.128.197 -> 244.3.160.239 TCP 66 http > 33422 [SYN, ACK] Seq=0 Ack=1 Win=5840 Len=0 MSS=1460 SACK_PERM=1
58725  23.728098 197.154.128.197 -> 244.3.160.239 TCP 64 http > 33422 [ACK] Seq=1 Ack=934 Win=7464 Len=0
58726  23.728103 197.154.128.197 -> 244.3.160.239 TCP 66 http > 33423 [SYN, ACK] Seq=0 Ack=1 Win=5840 Len=0 MSS=1460 SACK_PERM=1
58731  23.728676 197.154.128.197 -> 244.3.160.239 TCP 64 http > 33421 [ACK] Seq=1 Ack=923 Win=7376 Len=0
58732  23.728680 197.154.128.197 -> 244.3.160.239 TCP 66 http > 33424 [SYN, ACK] Seq=0 Ack=1 Win=5840 Len=0 MSS=1460 SACK_PERM=1
58737  23.729011 197.154.128.197 -> 244.3.160.239 TCP 64 http > 33423 [ACK] Seq=1 Ack=944 Win=7544 Len=0
58739  23.729512 197.154.128.197 -> 244.3.160.239 TCP 64 http > 33424 [ACK] Seq=1 Ack=927 Win=7408 Len=0
58965  23.815635 197.154.128.197 -> 244.3.160.239 TCP 64 http > 33419 [FIN, ACK] Seq=393 Ack=925 Win=7384 Len=0
58966  23.815727 197.154.128.197 -> 244.3.160.239 TCP 64 http > 33420 [FIN, ACK] Seq=5089 Ack=940 Win=7504 Len=0
59003  23.818426 197.154.128.197 -> 244.3.160.239 TCP 64 http > 33417 [FIN, ACK] Seq=3550 Ack=940 Win=7504 Len=0
59007  23.818604 197.154.128.197 -> 244.3.160.239 TCP 64 http > 33418 [FIN, ACK] Seq=511 Ack=936 Win=7472 Len=0
59059  23.826707 197.154.128.197 -> 244.3.160.239 TCP 66 http > 33431 [SYN, ACK] Seq=0 Ack=1 Win=5840 Len=0 MSS=1460 SACK_PERM=1
59063  23.827966 197.154.128.197 -> 244.3.160.239 TCP 66 http > 33433 [SYN, ACK] Seq=0 Ack=1 Win=5840 Len=0 MSS=1460 SACK_PERM=1
59065  23.828384 197.154.128.197 -> 244.3.160.239 TCP 64 http > 33431 [ACK] Seq=1 Ack=907 Win=7248 Len=0
59075  23.828999 197.154.128.197 -> 244.3.160.239 TCP 64 http > 33433 [ACK] Seq=1 Ack=1020 Win=7133 Len=0
59392  23.924862 197.154.128.197 -> 244.3.160.239 TCP 64 http > 33421 [FIN, ACK] Seq=1326 Ack=924 Win=7376 Len=0
59398  23.926454 197.154.128.197 -> 244.3.160.239 TCP 64 http > 33424 [FIN, ACK] Seq=2086 Ack=928 Win=7408 Len=0
59486  23.961006 197.154.128.197 -> 244.3.160.239 TCP 64 http > 33423 [FIN, ACK] Seq=2350 Ack=945 Win=7544 Len=0
59488  23.961090 197.154.128.197 -> 244.3.160.239 TCP 64 http > 33422 [FIN, ACK] Seq=638 Ack=935 Win=7464 Len=0
59702  24.055021 197.154.128.197 -> 244.3.160.239 TCP 64 http > 33431 [FIN, ACK] Seq=1724 Ack=908 Win=7248 Len=0
59743  24.070421 197.154.128.197 -> 244.3.160.239 TCP 64 http > 33433 [FIN, ACK] Seq=427 Ack=1021 Win=7133 Len=0
201765  69.641366 197.154.128.197 -> 244.3.160.239 TCP 66 http > 33895 [SYN, ACK] Seq=0 Ack=1 Win=5840 Len=0 MSS=1460 SACK_PERM=1
201768  69.642236 197.154.128.197 -> 244.3.160.239 TCP 64 http > 33895 [ACK] Seq=1 Ack=1034 Win=7231 Len=0
204013  70.205773 197.154.128.197 -> 244.3.160.239 TCP 73 [TCP segment of a reassembled PDU]
204425  70.254827 197.154.128.197 -> 244.3.160.239 TCP 64 http > 33895 [FIN, ACK] Seq=228395 Ack=1035 Win=7231 Len=0
204516  70.292388 197.154.128.197 -> 244.3.160.239 TCP 66 http > 33900 [SYN, ACK] Seq=0 Ack=1 Win=5840 Len=0 MSS=1460 SACK_PERM=1
204519  70.293366 197.154.128.197 -> 244.3.160.239 TCP 64 http > 33900 [ACK] Seq=1 Ack=1034 Win=7231 Len=0
207566  70.941356 197.154.128.197 -> 244.3.160.239 TCP 70 [TCP segment of a reassembled PDU]
207583  70.943597 197.154.128.197 -> 244.3.160.239 TCP 64 http > 33900 [FIN, ACK] Seq=512890 Ack=1035 Win=7231 Len=0
759526 244.832017 197.154.128.197 -> 244.3.160.239 TCP 66 http > 35163 [SYN, ACK] Seq=0 Ack=1 Win=5840 Len=0 MSS=1460 SACK_PERM=1
759531 244.832750 197.154.128.197 -> 244.3.160.239 TCP 64 http > 35163 [ACK] Seq=1 Ack=639 Win=7018 Len=0
759649 244.929584 197.154.128.197 -> 244.3.160.239 TCP 64 http > 35163 [FIN, ACK] Seq=389 Ack=640 Win=7018 Len=0
760453 245.281909 197.154.128.197 -> 244.3.160.239 TCP 66 http > 35164 [SYN, ACK] Seq=0 Ack=1 Win=5840 Len=0 MSS=1460 SACK_PERM=1
760458 245.282730 197.154.128.197 -> 244.3.160.239 TCP 64 http > 35164 [ACK] Seq=1 Ack=688 Win=6870 Len=0
762039 245.855995 197.154.128.197 -> 244.3.160.239 TCP 70 [TCP segment of a reassembled PDU]
762594 246.048577 197.154.128.197 -> 244.3.160.239 TCP 66 http > 35179 [SYN, ACK] Seq=0 Ack=1 Win=5840 Len=0 MSS=1460 SACK_PERM=1
762597 246.049462 197.154.128.197 -> 244.3.160.239 TCP 64 http > 35179 [ACK] Seq=1 Ack=718 Win=7170 Len=0
762621 246.061326 197.154.128.197 -> 244.3.160.239 TCP 64 http > 35179 [FIN, ACK] Seq=8359 Ack=719 Win=7170 Len=0
762640 246.070336 197.154.128.197 -> 244.3.160.239 TCP 66 http > 35180 [SYN, ACK] Seq=0 Ack=1 Win=5840 Len=0 MSS=1460 SACK_PERM=1
762643 246.071416 197.154.128.197 -> 244.3.160.239 TCP 64 http > 35180 [ACK] Seq=1 Ack=718 Win=7170 Len=0
762654 246.078566 197.154.128.197 -> 244.3.160.239 TCP 64 http > 35180 [FIN, ACK] Seq=354 Ack=719 Win=7170 Len=0
762667 246.084445 197.154.128.197 -> 244.3.160.239 TCP 66 http > 35181 [SYN, ACK] Seq=0 Ack=1 Win=5840 Len=0 MSS=1460 SACK_PERM=1
762670 246.085579 197.154.128.197 -> 244.3.160.239 TCP 64 http > 35181 [ACK] Seq=1 Ack=752 Win=6759 Len=0
762677 246.087832 197.154.128.197 -> 244.3.160.239 TCP 64 http > 35181 [FIN, ACK] Seq=195 Ack=753 Win=6759 Len=0
762736 246.102763 197.154.128.197 -> 244.3.160.239 TCP 66 http > 35182 [SYN, ACK] Seq=0 Ack=1 Win=5840 Len=0 MSS=1460 SACK_PERM=1
762739 246.104022 197.154.128.197 -> 244.3.160.239 TCP 64 http > 35182 [ACK] Seq=1 Ack=749 Win=6732 Len=0
762749 246.106875 197.154.128.197 -> 244.3.160.239 TCP 64 http > 35182 [FIN, ACK] Seq=196 Ack=750 Win=6732 Len=0
762758 246.110354 197.154.128.197 -> 244.3.160.239 TCP 66 http > 35183 [SYN, ACK] Seq=0 Ack=1 Win=5840 Len=0 MSS=1460 SACK_PERM=1
762761 246.111450 197.154.128.197 -> 244.3.160.239 TCP 64 http > 35183 [ACK] Seq=1 Ack=750 Win=6741 Len=0
762774 246.126533 197.154.128.197 -> 244.3.160.239 TCP 66 http > 35184 [SYN, ACK] Seq=0 Ack=1 Win=5840 Len=0 MSS=1460 SACK_PERM=1
762777 246.127368 197.154.128.197 -> 244.3.160.239 TCP 64 http > 35184 [ACK] Seq=1 Ack=697 Win=6960 Len=0
762783 246.132994 197.154.128.197 -> 244.3.160.239 TCP 64 http > 35183 [FIN, ACK] Seq=196 Ack=751 Win=6741 Len=0
763091 246.280088 197.154.128.197 -> 244.3.160.239 TCP 66 http > 35185 [SYN, ACK] Seq=0 Ack=1 Win=5840 Len=0 MSS=1460 SACK_PERM=1
763095 246.281051 197.154.128.197 -> 244.3.160.239 TCP 64 http > 35185 [ACK] Seq=1 Ack=699 Win=6980 Len=0
763156 246.298130 197.154.128.197 -> 244.3.160.239 TCP 66 http > 35186 [SYN, ACK] Seq=0 Ack=1 Win=5840 Len=0 MSS=1460 SACK_PERM=1
763161 246.299176 197.154.128.197 -> 244.3.160.239 TCP 64 http > 35186 [ACK] Seq=1 Ack=787 Win=7074 Len=0
763171 246.301705 197.154.128.197 -> 244.3.160.239 TCP 64 http > 35186 [FIN, ACK] Seq=196 Ack=788 Win=7074 Len=0
763244 246.313582 197.154.128.197 -> 244.3.160.239 TCP 64 http > 35164 [FIN, ACK] Seq=41894 Ack=689 Win=6870 Len=0
763267 246.318210 197.154.128.197 -> 244.3.160.239 TCP 66 http > 35187 [SYN, ACK] Seq=0 Ack=1 Win=5840 Len=0 MSS=1460 SACK_PERM=1
763273 246.318983 197.154.128.197 -> 244.3.160.239 TCP 64 http > 35187 [ACK] Seq=1 Ack=694 Win=6930 Len=0
763307 246.330164 197.154.128.197 -> 244.3.160.239 TCP 66 http > 35188 [SYN, ACK] Seq=0 Ack=1 Win=5840 Len=0 MSS=1460 SACK_PERM=1
763315 246.331326 197.154.128.197 -> 244.3.160.239 TCP 64 http > 35188 [ACK] Seq=1 Ack=763 Win=6858 Len=0
763349 246.336576 197.154.128.197 -> 244.3.160.239 TCP 64 http > 35188 [FIN, ACK] Seq=196 Ack=764 Win=6858 Len=0
763443 246.359396 197.154.128.197 -> 244.3.160.239 TCP 66 http > 35189 [SYN, ACK] Seq=0 Ack=1 Win=5840 Len=0 MSS=1460 SACK_PERM=1
763448 246.360349 197.154.128.197 -> 244.3.160.239 TCP 64 http > 35189 [ACK] Seq=1 Ack=748 Win=6723 Len=0
763456 246.364045 197.154.128.197 -> 244.3.160.239 TCP 64 http > 35189 [FIN, ACK] Seq=191 Ack=749 Win=6723 Len=0
764181 246.610284 197.154.128.197 -> 244.3.160.239 TCP 64 [TCP Keep-Alive] http > 35185 [ACK] Seq=67160 Ack=699 Win=6980 Len=0
764183 246.611127 197.154.128.197 -> 244.3.160.239 TCP 64 http > 35184 [FIN, ACK] Seq=47722 Ack=698 Win=6960 Len=0
764768 246.913894 197.154.128.197 -> 244.3.160.239 TCP 82 [TCP segment of a reassembled PDU]
764964 246.999720 197.154.128.197 -> 244.3.160.239 TCP 64 http > 35185 [FIN, ACK] Seq=83245 Ack=700 Win=6980 Len=0
765109 247.056855 197.154.128.197 -> 244.3.160.239 TCP 64 http > 35187 [FIN, ACK] Seq=48223 Ack=695 Win=6930 Len=0
765952 247.548434 197.154.128.197 -> 244.3.160.239 TCP 66 http > 35192 [SYN, ACK] Seq=0 Ack=1 Win=5840 Len=0 MSS=1460 SACK_PERM=1
765956 247.549450 197.154.128.197 -> 244.3.160.239 TCP 64 http > 35192 [ACK] Seq=1 Ack=767 Win=6894 Len=0
765972 247.558447 197.154.128.197 -> 244.3.160.239 TCP 66 http > 35193 [SYN, ACK] Seq=0 Ack=1 Win=5840 Len=0 MSS=1460 SACK_PERM=1
765977 247.559437 197.154.128.197 -> 244.3.160.239 TCP 64 http > 35193 [ACK] Seq=1 Ack=806 Win=7245 Len=0
766002 247.569239 197.154.128.197 -> 244.3.160.239 TCP 64 http > 35193 [FIN, ACK] Seq=197 Ack=807 Win=7245 Len=0
766004 247.569736 197.154.128.197 -> 244.3.160.239 TCP 64 http > 35192 [FIN, ACK] Seq=197 Ack=768 Win=6894 Len=0
766024 247.575043 197.154.128.197 -> 244.3.160.239 TCP 66 http > 35194 [SYN, ACK] Seq=0 Ack=1 Win=5840 Len=0 MSS=1460 SACK_PERM=1
766027 247.576197 197.154.128.197 -> 244.3.160.239 TCP 64 http > 35194 [ACK] Seq=1 Ack=812 Win=7299 Len=0
766034 247.580847 197.154.128.197 -> 244.3.160.239 TCP 64 http > 35194 [FIN, ACK] Seq=196 Ack=813 Win=7299 Len=0
766058 247.594520 197.154.128.197 -> 244.3.160.239 TCP 66 http > 35195 [SYN, ACK] Seq=0 Ack=1 Win=5840 Len=0 MSS=1460 SACK_PERM=1
766063 247.596012 197.154.128.197 -> 244.3.160.239 TCP 64 http > 35195 [ACK] Seq=1 Ack=808 Win=7263 Len=0
766073 247.598582 197.154.128.197 -> 244.3.160.239 TCP 66 http > 35196 [SYN, ACK] Seq=0 Ack=1 Win=5840 Len=0 MSS=1460 SACK_PERM=1
766075 247.598977 197.154.128.197 -> 244.3.160.239 TCP 64 http > 35195 [FIN, ACK] Seq=196 Ack=809 Win=7263 Len=0
766078 247.599917 197.154.128.197 -> 244.3.160.239 TCP 64 http > 35196 [ACK] Seq=1 Ack=813 Win=7308 Len=0
766092 247.603562 197.154.128.197 -> 244.3.160.239 TCP 64 http > 35196 [FIN, ACK] Seq=197 Ack=814 Win=7308 Len=0
766109 247.615995 197.154.128.197 -> 244.3.160.239 TCP 66 http > 35197 [SYN, ACK] Seq=0 Ack=1 Win=5840 Len=0 MSS=1460 SACK_PERM=1
766112 247.617331 197.154.128.197 -> 244.3.160.239 TCP 64 http > 35197 [ACK] Seq=1 Ack=791 Win=7110 Len=0
766134 247.637434 197.154.128.197 -> 244.3.160.239 TCP 64 http > 35197 [FIN, ACK] Seq=197 Ack=792 Win=7110 Len=0
766516 247.776608 197.154.128.197 -> 244.3.160.239 TCP 66 http > 35198 [SYN, ACK] Seq=0 Ack=1 Win=5840 Len=0 MSS=1460 SACK_PERM=1
766519 247.777436 197.154.128.197 -> 244.3.160.239 TCP 64 http > 35198 [ACK] Seq=1 Ack=740 Win=6651 Len=0
766534 247.790495 197.154.128.197 -> 244.3.160.239 TCP 66 http > 35199 [SYN, ACK] Seq=0 Ack=1 Win=5840 Len=0 MSS=1460 SACK_PERM=1
766537 247.791559 197.154.128.197 -> 244.3.160.239 TCP 64 http > 35199 [ACK] Seq=1 Ack=792 Win=7119 Len=0
766565 247.802599 197.154.128.197 -> 244.3.160.239 TCP 64 http > 35199 [FIN, ACK] Seq=197 Ack=793 Win=7119 Len=0
766587 247.810177 197.154.128.197 -> 244.3.160.239 TCP 66 http > 35200 [SYN, ACK] Seq=0 Ack=1 Win=5840 Len=0 MSS=1460 SACK_PERM=1
766591 247.811215 197.154.128.197 -> 244.3.160.239 TCP 64 http > 35200 [ACK] Seq=1 Ack=793 Win=7128 Len=0
766613 247.822693 197.154.128.197 -> 244.3.160.239 TCP 66 http > 35201 [SYN, ACK] Seq=0 Ack=1 Win=5840 Len=0 MSS=1460 SACK_PERM=1
766621 247.823803 197.154.128.197 -> 244.3.160.239 TCP 64 http > 35201 [ACK] Seq=1 Ack=815 Win=7326 Len=0
766631 247.825035 197.154.128.197 -> 244.3.160.239 TCP 64 http > 35200 [FIN, ACK] Seq=197 Ack=794 Win=7128 Len=0
766641 247.826446 197.154.128.197 -> 244.3.160.239 TCP 64 http > 35201 [FIN, ACK] Seq=197 Ack=816 Win=7326 Len=0
766725 247.859698 197.154.128.197 -> 244.3.160.239 TCP 66 http > 35204 [SYN, ACK] Seq=0 Ack=1 Win=5840 Len=0 MSS=1460 SACK_PERM=1
766731 247.860397 197.154.128.197 -> 244.3.160.239 TCP 66 http > 35205 [SYN, ACK] Seq=0 Ack=1 Win=5840 Len=0 MSS=1460 SACK_PERM=1
766734 247.860549 197.154.128.197 -> 244.3.160.239 TCP 64 http > 35204 [ACK] Seq=1 Ack=723 Win=7220 Len=0
766737 247.861392 197.154.128.197 -> 244.3.160.239 TCP 64 http > 35205 [ACK] Seq=1 Ack=801 Win=7200 Len=0
766758 247.865501 197.154.128.197 -> 244.3.160.239 TCP 64 http > 35205 [FIN, ACK] Seq=196 Ack=802 Win=7200 Len=0
766965 247.930778 197.154.128.197 -> 244.3.160.239 TCP 64 http > 35198 [FIN, ACK] Seq=778 Ack=741 Win=6651 Len=0
767218 248.006713 197.154.128.197 -> 244.3.160.239 TCP 66 http > 35206 [SYN, ACK] Seq=0 Ack=1 Win=5840 Len=0 MSS=1460 SACK_PERM=1
767225 248.007791 197.154.128.197 -> 244.3.160.239 TCP 64 http > 35206 [ACK] Seq=1 Ack=801 Win=7200 Len=0
767243 248.010824 197.154.128.197 -> 244.3.160.239 TCP 64 http > 35206 [FIN, ACK] Seq=197 Ack=802 Win=7200 Len=0
767260 248.024241 197.154.128.197 -> 244.3.160.239 TCP 66 http > 35207 [SYN, ACK] Seq=0 Ack=1 Win=5840 Len=0 MSS=1460 SACK_PERM=1
767263 248.025258 197.154.128.197 -> 244.3.160.239 TCP 64 http > 35207 [ACK] Seq=1 Ack=787 Win=7074 Len=0
767272 248.028256 197.154.128.197 -> 244.3.160.239 TCP 64 http > 35207 [FIN, ACK] Seq=197 Ack=788 Win=7074 Len=0
767328 248.042155 197.154.128.197 -> 244.3.160.239 TCP 66 http > 35208 [SYN, ACK] Seq=0 Ack=1 Win=5840 Len=0 MSS=1460 SACK_PERM=1
767331 248.043027 197.154.128.197 -> 244.3.160.239 TCP 64 http > 35208 [ACK] Seq=1 Ack=732 Win=6579 Len=0
767364 248.058283 197.154.128.197 -> 244.3.160.239 TCP 66 http > 35209 [SYN, ACK] Seq=0 Ack=1 Win=5840 Len=0 MSS=1460 SACK_PERM=1
767367 248.059425 197.154.128.197 -> 244.3.160.239 TCP 64 http > 35209 [ACK] Seq=1 Ack=722 Win=7210 Len=0
767411 248.075855 197.154.128.197 -> 244.3.160.239 TCP 66 http > 35210 [SYN, ACK] Seq=0 Ack=1 Win=5840 Len=0 MSS=1460 SACK_PERM=1
767414 248.076995 197.154.128.197 -> 244.3.160.239 TCP 64 http > 35210 [ACK] Seq=1 Ack=734 Win=6597 Len=0
767477 248.087298 197.154.128.197 -> 244.3.160.239 TCP 64 http > 35210 [FIN, ACK] Seq=212 Ack=734 Win=6597 Len=0
767486 248.088849 197.154.128.197 -> 244.3.160.239 TCP 64 http > 35210 [ACK] Seq=213 Ack=735 Win=6597 Len=0
767796 248.200817 197.154.128.197 -> 244.3.160.239 TCP 64 http > 35204 [FIN, ACK] Seq=9284 Ack=724 Win=7220 Len=0
767809 248.202539 197.154.128.197 -> 244.3.160.239 TCP 64 http > 35209 [FIN, ACK] Seq=387 Ack=723 Win=7210 Len=0
767871 248.238254 197.154.128.197 -> 244.3.160.239 TCP 66 http > 35211 [SYN, ACK] Seq=0 Ack=1 Win=5840 Len=0 MSS=1460 SACK_PERM=1
767874 248.239057 197.154.128.197 -> 244.3.160.239 TCP 64 http > 35211 [ACK] Seq=1 Ack=722 Win=7210 Len=0
767887 248.242562 197.154.128.197 -> 244.3.160.239 TCP 66 http > 35212 [SYN, ACK] Seq=0 Ack=1 Win=5840 Len=0 MSS=1460 SACK_PERM=1
767890 248.243485 197.154.128.197 -> 244.3.160.239 TCP 64 http > 35212 [ACK] Seq=1 Ack=723 Win=7220 Len=0
767958 248.279018 197.154.128.197 -> 244.3.160.239 TCP 66 http > 35213 [SYN, ACK] Seq=0 Ack=1 Win=5840 Len=0 MSS=1460 SACK_PERM=1
767961 248.280054 197.154.128.197 -> 244.3.160.239 TCP 64 http > 35213 [ACK] Seq=1 Ack=759 Win=6822 Len=0
767970 248.281900 197.154.128.197 -> 244.3.160.239 TCP 64 http > 35213 [FIN, ACK] Seq=196 Ack=760 Win=6822 Len=0
767993 248.297376 197.154.128.197 -> 244.3.160.239 TCP 66 http > 35214 [SYN, ACK] Seq=0 Ack=1 Win=5840 Len=0 MSS=1460 SACK_PERM=1
767997 248.298426 197.154.128.197 -> 244.3.160.239 TCP 64 http > 35214 [ACK] Seq=1 Ack=769 Win=6912 Len=0
768003 248.301247 197.154.128.197 -> 244.3.160.239 TCP 64 http > 35214 [FIN, ACK] Seq=191 Ack=770 Win=6912 Len=0
768020 248.321292 197.154.128.197 -> 244.3.160.239 TCP 66 http > 35215 [SYN, ACK] Seq=0 Ack=1 Win=5840 Len=0 MSS=1460 SACK_PERM=1
768024 248.322221 197.154.128.197 -> 244.3.160.239 TCP 64 http > 35215 [ACK] Seq=1 Ack=729 Win=7280 Len=0
768144 248.343103 197.154.128.197 -> 244.3.160.239 TCP 64 http > 35208 [FIN, ACK] Seq=8435 Ack=733 Win=6579 Len=0
768310 248.450173 197.154.128.197 -> 244.3.160.239 TCP 66 http > 35216 [SYN, ACK] Seq=0 Ack=1 Win=5840 Len=0 MSS=1460 SACK_PERM=1
768315 248.451397 197.154.128.197 -> 244.3.160.239 TCP 64 http > 35216 [ACK] Seq=1 Ack=767 Win=6894 Len=0
768348 248.470206 197.154.128.197 -> 244.3.160.239 TCP 66 http > 35217 [SYN, ACK] Seq=0 Ack=1 Win=5840 Len=0 MSS=1460 SACK_PERM=1
768350 248.470385 197.154.128.197 -> 244.3.160.239 TCP 64 http > 35216 [FIN, ACK] Seq=196 Ack=768 Win=6894 Len=0
768353 248.471199 197.154.128.197 -> 244.3.160.239 TCP 64 http > 35217 [ACK] Seq=1 Ack=762 Win=6849 Len=0
768379 248.490369 197.154.128.197 -> 244.3.160.239 TCP 66 http > 35218 [SYN, ACK] Seq=0 Ack=1 Win=5840 Len=0 MSS=1460 SACK_PERM=1
768382 248.491398 197.154.128.197 -> 244.3.160.239 TCP 64 http > 35218 [ACK] Seq=1 Ack=765 Win=6876 Len=0
768399 248.497184 197.154.128.197 -> 244.3.160.239 TCP 64 http > 35217 [FIN, ACK] Seq=196 Ack=763 Win=6849 Len=0
768406 248.502287 197.154.128.197 -> 244.3.160.239 TCP 64 http > 35218 [FIN, ACK] Seq=196 Ack=766 Win=6876 Len=0
768574 248.561637 197.154.128.197 -> 244.3.160.239 TCP 64 http > 35211 [FIN, ACK] Seq=307 Ack=723 Win=7210 Len=0
768575 248.561642 197.154.128.197 -> 244.3.160.239 TCP 64 http > 35212 [FIN, ACK] Seq=360 Ack=724 Win=7220 Len=0
768770 248.642181 197.154.128.197 -> 244.3.160.239 TCP 66 http > 35220 [SYN, ACK] Seq=0 Ack=1 Win=5840 Len=0 MSS=1460 SACK_PERM=1
768773 248.643283 197.154.128.197 -> 244.3.160.239 TCP 64 http > 35220 [ACK] Seq=1 Ack=715 Win=7140 Len=0
768784 248.650050 197.154.128.197 -> 244.3.160.239 TCP 66 http > 35221 [SYN, ACK] Seq=0 Ack=1 Win=5840 Len=0 MSS=1460 SACK_PERM=1
768790 248.651309 197.154.128.197 -> 244.3.160.239 TCP 64 http > 35221 [ACK] Seq=1 Ack=767 Win=6894 Len=0
768804 248.667981 197.154.128.197 -> 244.3.160.239 TCP 64 http > 35221 [FIN, ACK] Seq=197 Ack=768 Win=6894 Len=0
768818 248.672097 197.154.128.197 -> 244.3.160.239 TCP 64 http > 35215 [FIN, ACK] Seq=319 Ack=730 Win=7280 Len=0
768856 248.684127 197.154.128.197 -> 244.3.160.239 TCP 66 http > 35222 [SYN, ACK] Seq=0 Ack=1 Win=5840 Len=0 MSS=1460 SACK_PERM=1
768859 248.685200 197.154.128.197 -> 244.3.160.239 TCP 64 http > 35222 [ACK] Seq=1 Ack=759 Win=6822 Len=0
768872 248.687320 197.154.128.197 -> 244.3.160.239 TCP 64 http > 35222 [FIN, ACK] Seq=196 Ack=760 Win=6822 Len=0
768875 248.688326 197.154.128.197 -> 244.3.160.239 TCP 66 http > 35223 [SYN, ACK] Seq=0 Ack=1 Win=5840 Len=0 MSS=1460 SACK_PERM=1
768878 248.689480 197.154.128.197 -> 244.3.160.239 TCP 64 http > 35223 [ACK] Seq=1 Ack=798 Win=7173 Len=0
768884 248.691428 197.154.128.197 -> 244.3.160.239 TCP 64 http > 35223 [FIN, ACK] Seq=197 Ack=799 Win=7173 Len=0
768911 248.704121 197.154.128.197 -> 244.3.160.239 TCP 66 http > 35224 [SYN, ACK] Seq=0 Ack=1 Win=5840 Len=0 MSS=1460 SACK_PERM=1
768914 248.705092 197.154.128.197 -> 244.3.160.239 TCP 64 http > 35224 [ACK] Seq=1 Ack=791 Win=7110 Len=0
768927 248.707211 197.154.128.197 -> 244.3.160.239 TCP 64 http > 35224 [FIN, ACK] Seq=197 Ack=792 Win=7110 Len=0
768999 248.763221 197.154.128.197 -> 244.3.160.239 TCP 66 http > 35226 [SYN, ACK] Seq=0 Ack=1 Win=5840 Len=0 MSS=1460 SACK_PERM=1
769002 248.764355 197.154.128.197 -> 244.3.160.239 TCP 64 http > 35226 [ACK] Seq=1 Ack=759 Win=6822 Len=0
769022 248.778559 197.154.128.197 -> 244.3.160.239 TCP 64 http > 35226 [FIN, ACK] Seq=212 Ack=760 Win=6822 Len=0
769027 248.781025 197.154.128.197 -> 244.3.160.239 TCP 64 http > 35220 [FIN, ACK] Seq=446 Ack=716 Win=7140 Len=0
772669 249.418920 197.154.128.197 -> 244.3.160.239 TCP 66 http > 35232 [SYN, ACK] Seq=0 Ack=1 Win=5840 Len=0 MSS=1460 SACK_PERM=1
772694 249.419992 197.154.128.197 -> 244.3.160.239 TCP 64 http > 35232 [ACK] Seq=1 Ack=744 Win=6687 Len=0
772706 249.420518 197.154.128.197 -> 244.3.160.239 TCP 64 http > 35232 [FIN, ACK] Seq=211 Ack=744 Win=6687 Len=0
772726 249.422036 197.154.128.197 -> 244.3.160.239 TCP 64 http > 35232 [ACK] Seq=212 Ack=745 Win=6687 Len=0
775065 249.616006 197.154.128.197 -> 244.3.160.239 TCP 66 http > 35233 [SYN, ACK] Seq=0 Ack=1 Win=5840 Len=0 MSS=1460 SACK_PERM=1
775070 249.617325 197.154.128.197 -> 244.3.160.239 TCP 64 http > 35233 [ACK] Seq=1 Ack=751 Win=6750 Len=0
775117 249.620137 197.154.128.197 -> 244.3.160.239 TCP 64 http > 35233 [FIN, ACK] Seq=212 Ack=751 Win=6750 Len=0
775156 249.621916 197.154.128.197 -> 244.3.160.239 TCP 64 http > 35233 [ACK] Seq=213 Ack=752 Win=6750 Len=0
776038 249.810699 197.154.128.197 -> 244.3.160.239 TCP 66 http > 35234 [SYN, ACK] Seq=0 Ack=1 Win=5840 Len=0 MSS=1460 SACK_PERM=1
776041 249.811495 197.154.128.197 -> 244.3.160.239 TCP 64 http > 35234 [ACK] Seq=1 Ack=697 Win=6960 Len=0
776416 250.061024 197.154.128.197 -> 244.3.160.239 TCP 64 http > 35234 [FIN, ACK] Seq=22675 Ack=698 Win=6960 Len=0
777688 250.582487 197.154.128.197 -> 244.3.160.239 TCP 66 http > 35235 [SYN, ACK] Seq=0 Ack=1 Win=5840 Len=0 MSS=1460 SACK_PERM=1
777691 250.583349 197.154.128.197 -> 244.3.160.239 TCP 64 http > 35235 [ACK] Seq=1 Ack=813 Win=7308 Len=0
778123 250.820850 197.154.128.197 -> 244.3.160.239 TCP 64 http > 35235 [FIN, ACK] Seq=426 Ack=814 Win=7308 Len=0
