201924  69.731118 197.209.255.203 -> 41.177.26.91 TCP 64 57781 > http [ACK] Seq=1 Ack=1 Win=65535 Len=0
201925  69.731237 197.209.255.203 -> 41.177.26.91 TCP 64 57721 > http [ACK] Seq=1 Ack=1 Win=65535 Len=0
201930  69.731846 197.209.255.203 -> 41.177.26.91 TCP 64 57782 > http [ACK] Seq=1 Ack=1 Win=65535 Len=0
201941  69.744427 197.209.255.203 -> 41.177.26.91 TCP 64 57937 > http [ACK] Seq=1 Ack=1 Win=65535 Len=0
222480  76.230909 197.209.255.203 -> 41.177.26.91 TCP 64 57938 > http [ACK] Seq=1 Ack=1 Win=65535 Len=0
