151204  51.872387 197.154.128.255 -> 244.3.160.239 TCP 66 http > 33644 [SYN, ACK] Seq=0 Ack=1 Win=5840 Len=0 MSS=1460 SACK_PERM=1
151210  51.873438 197.154.128.255 -> 244.3.160.239 TCP 64 http > 33644 [ACK] Seq=1 Ack=631 Win=6930 Len=0
151231  51.877705 197.154.128.255 -> 244.3.160.239 TCP 64 http > 33644 [FIN, ACK] Seq=1591 Ack=632 Win=6930 Len=0
679286 212.493655 197.154.128.255 -> 244.3.160.239 TCP 66 http > 35019 [SYN, ACK] Seq=0 Ack=1 Win=5840 Len=0 MSS=1460 SACK_PERM=1
679294 212.494735 197.154.128.255 -> 244.3.160.239 TCP 64 http > 35019 [ACK] Seq=1 Ack=1018 Win=7119 Len=0
679758 212.619698 197.154.128.255 -> 244.3.160.239 TCP 64 http > 35019 [FIN, ACK] Seq=1591 Ack=1019 Win=7119 Len=0
