802878 262.324635 197.55.186.145 -> 244.3.210.197 TCP 66 4754 > http [SYN] Seq=0 Win=65535 Len=0 MSS=1450 SACK_PERM=1
803139 262.393621 197.55.186.145 -> 244.3.210.197 TCP 64 4754 > http [ACK] Seq=1 Ack=1 Win=65535 Len=0
803600 262.548832 197.55.186.145 -> 244.3.210.197 TCP 66 4755 > http [SYN] Seq=0 Win=65535 Len=0 MSS=1450 SACK_PERM=1
803717 262.600615 197.55.186.145 -> 244.3.210.197 TCP 64 4754 > http [ACK] Seq=535 Ack=351 Win=65185 Len=0
803802 262.620338 197.55.186.145 -> 244.3.210.197 TCP 64 4755 > http [ACK] Seq=1 Ack=1 Win=65535 Len=0
804753 262.975298 197.55.186.145 -> 244.3.210.197 TCP 64 4755 > http [ACK] Seq=712 Ack=2901 Win=65535 Len=0
804867 263.052619 197.55.186.145 -> 244.3.210.197 TCP 64 4755 > http [ACK] Seq=712 Ack=5801 Win=65535 Len=0
805020 263.132764 197.55.186.145 -> 244.3.210.197 TCP 64 4755 > http [ACK] Seq=712 Ack=8701 Win=65535 Len=0
805040 263.140478 197.55.186.145 -> 244.3.210.197 TCP 64 4755 > http [ACK] Seq=712 Ack=11601 Win=65535 Len=0
805148 263.211874 197.55.186.145 -> 244.3.210.197 TCP 64 4755 > http [ACK] Seq=712 Ack=14501 Win=65535 Len=0
805542 263.298411 197.55.186.145 -> 244.3.210.197 TCP 66 4757 > http [SYN] Seq=0 Win=65535 Len=0 MSS=1450 SACK_PERM=1
805543 263.298444 197.55.186.145 -> 244.3.210.197 TCP 66 4756 > http [SYN] Seq=0 Win=65535 Len=0 MSS=1450 SACK_PERM=1
805547 263.298550 197.55.186.145 -> 244.3.210.197 TCP 66 4759 > http [SYN] Seq=0 Win=65535 Len=0 MSS=1450 SACK_PERM=1
805565 263.298803 197.55.186.145 -> 244.3.210.197 TCP 66 4758 > http [SYN] Seq=0 Win=65535 Len=0 MSS=1450 SACK_PERM=1
805579 263.300440 197.55.186.145 -> 244.3.210.197 TCP 66 4760 > http [SYN] Seq=0 Win=65535 Len=0 MSS=1450 SACK_PERM=1
805887 263.371023 197.55.186.145 -> 244.3.210.197 TCP 64 4757 > http [ACK] Seq=1 Ack=1 Win=65535 Len=0
805893 263.371242 197.55.186.145 -> 244.3.210.197 TCP 64 4756 > http [ACK] Seq=1 Ack=1 Win=65535 Len=0
805895 263.371309 197.55.186.145 -> 244.3.210.197 TCP 64 4759 > http [ACK] Seq=1 Ack=1 Win=65535 Len=0
805908 263.371679 197.55.186.145 -> 244.3.210.197 TCP 64 4760 > http [ACK] Seq=1 Ack=1 Win=65535 Len=0
805909 263.371718 197.55.186.145 -> 244.3.210.197 TCP 64 4758 > http [ACK] Seq=1 Ack=1 Win=65535 Len=0
805995 263.387022 197.55.186.145 -> 244.3.210.197 TCP 64 4755 > http [ACK] Seq=1510 Ack=18320 Win=65535 Len=0
806014 263.389331 197.55.186.145 -> 244.3.210.197 TCP 64 4755 > http [ACK] Seq=1510 Ack=21220 Win=65535 Len=0
806046 263.396984 197.55.186.145 -> 244.3.210.197 TCP 64 4755 > http [ACK] Seq=1510 Ack=24120 Win=65535 Len=0
806059 263.406667 197.55.186.145 -> 244.3.210.197 TCP 64 4755 > http [ACK] Seq=1510 Ack=25800 Win=65535 Len=0
806201 263.456910 197.55.186.145 -> 244.3.210.197 TCP 64 4759 > http [ACK] Seq=783 Ack=2901 Win=65535 Len=0
806239 263.468820 197.55.186.145 -> 244.3.210.197 TCP 64 4756 > http [ACK] Seq=789 Ack=2901 Win=65535 Len=0
806313 263.484460 197.55.186.145 -> 244.3.210.197 TCP 64 4757 > http [ACK] Seq=795 Ack=2901 Win=65535 Len=0
806320 263.485026 197.55.186.145 -> 244.3.210.197 TCP 64 4758 > http [ACK] Seq=798 Ack=2901 Win=65535 Len=0
806375 263.496043 197.55.186.145 -> 244.3.210.197 TCP 64 4760 > http [ACK] Seq=787 Ack=2669 Win=65535 Len=0
806438 263.506107 197.55.186.145 -> 244.3.210.197 TCP 64 4755 > http [ACK] Seq=2304 Ack=28700 Win=65535 Len=0
806485 263.516881 197.55.186.145 -> 244.3.210.197 TCP 64 4755 > http [ACK] Seq=2304 Ack=30552 Win=65535 Len=0
806550 263.533420 197.55.186.145 -> 244.3.210.197 TCP 64 4759 > http [ACK] Seq=783 Ack=5801 Win=65535 Len=0
806644 263.550603 197.55.186.145 -> 244.3.210.197 TCP 64 4756 > http [ACK] Seq=789 Ack=5801 Win=65535 Len=0
806736 263.581567 197.55.186.145 -> 244.3.210.197 TCP 64 4760 > http [ACK] Seq=1571 Ack=5569 Win=65535 Len=0
806848 263.600889 197.55.186.145 -> 244.3.210.197 TCP 64 4755 > http [ACK] Seq=3086 Ack=33452 Win=65535 Len=0
806899 263.610436 197.55.186.145 -> 244.3.210.197 TCP 64 4755 > http [ACK] Seq=3086 Ack=36352 Win=65535 Len=0
806920 263.617072 197.55.186.145 -> 244.3.210.197 TCP 64 4760 > http [ACK] Seq=1571 Ack=7019 Win=65535 Len=0
806928 263.617361 197.55.186.145 -> 244.3.210.197 TCP 64 4759 > http [ACK] Seq=783 Ack=7251 Win=65535 Len=0
806936 263.619670 197.55.186.145 -> 244.3.210.197 TCP 64 4755 > http [ACK] Seq=3086 Ack=39252 Win=65535 Len=0
806957 263.627638 197.55.186.145 -> 244.3.210.197 TCP 64 4759 > http [ACK] Seq=783 Ack=10151 Win=65535 Len=0
807026 263.642515 197.55.186.145 -> 244.3.210.197 TCP 64 4756 > http [ACK] Seq=789 Ack=8701 Win=65535 Len=0
807087 263.651012 197.55.186.145 -> 244.3.210.197 TCP 64 4756 > http [ACK] Seq=789 Ack=11601 Win=65535 Len=0
807129 263.664248 197.55.186.145 -> 244.3.210.197 TCP 64 4757 > http [ACK] Seq=1573 Ack=6265 Win=65535 Len=0
807163 263.667322 197.55.186.145 -> 244.3.210.197 TCP 64 4758 > http [ACK] Seq=1577 Ack=6201 Win=65535 Len=0
807352 263.684750 197.55.186.145 -> 244.3.210.197 TCP 64 4760 > http [ACK] Seq=1571 Ack=9919 Win=65535 Len=0
807375 263.686409 197.55.186.145 -> 244.3.210.197 TCP 64 4757 > http [ACK] Seq=1573 Ack=9165 Win=65535 Len=0
807441 263.693492 197.55.186.145 -> 244.3.210.197 TCP 64 4760 > http [ACK] Seq=1571 Ack=12819 Win=65535 Len=0
807530 263.706151 197.55.186.145 -> 244.3.210.197 TCP 64 4759 > http [ACK] Seq=783 Ack=13051 Win=65535 Len=0
807576 263.714005 197.55.186.145 -> 244.3.210.197 TCP 64 4759 > http [ACK] Seq=783 Ack=15951 Win=65535 Len=0
807744 263.722864 197.55.186.145 -> 244.3.210.197 TCP 64 4759 > http [ACK] Seq=783 Ack=18851 Win=65535 Len=0
807766 263.729695 197.55.186.145 -> 244.3.210.197 TCP 64 4755 > http [ACK] Seq=3869 Ack=43204 Win=65535 Len=0
807846 263.745405 197.55.186.145 -> 244.3.210.197 TCP 64 4756 > http [ACK] Seq=789 Ack=14501 Win=65535 Len=0
807864 263.751067 197.55.186.145 -> 244.3.210.197 TCP 64 4756 > http [ACK] Seq=789 Ack=17401 Win=65535 Len=0
808096 263.765381 197.55.186.145 -> 244.3.210.197 TCP 64 4757 > http [ACK] Seq=1573 Ack=12065 Win=65535 Len=0
808114 263.769041 197.55.186.145 -> 244.3.210.197 TCP 64 4756 > http [ACK] Seq=789 Ack=20301 Win=65535 Len=0
808168 263.777545 197.55.186.145 -> 244.3.210.197 TCP 64 4758 > http [ACK] Seq=2354 Ack=9758 Win=65535 Len=0
808231 263.786692 197.55.186.145 -> 244.3.210.197 TCP 64 4758 > http [ACK] Seq=2354 Ack=12658 Win=65535 Len=0
808288 263.796329 197.55.186.145 -> 244.3.210.197 TCP 64 4758 > http [ACK] Seq=2354 Ack=15558 Win=65535 Len=0
808412 263.805807 197.55.186.145 -> 244.3.210.197 TCP 64 4760 > http [ACK] Seq=2351 Ack=16643 Win=65535 Len=0
808538 263.818635 197.55.186.145 -> 244.3.210.197 TCP 64 4759 > http [ACK] Seq=783 Ack=21751 Win=65535 Len=0
808576 263.822612 197.55.186.145 -> 244.3.210.197 TCP 64 4760 > http [ACK] Seq=2351 Ack=19543 Win=65535 Len=0
808632 263.837730 197.55.186.145 -> 244.3.210.197 TCP 64 4759 > http [ACK] Seq=783 Ack=24651 Win=65535 Len=0
808669 263.845145 197.55.186.145 -> 244.3.210.197 TCP 64 4755 > http [ACK] Seq=4648 Ack=47553 Win=65535 Len=0
808725 263.850794 197.55.186.145 -> 244.3.210.197 TCP 64 4760 > http [ACK] Seq=2351 Ack=22443 Win=65535 Len=0
808778 263.869987 197.55.186.145 -> 244.3.210.197 TCP 64 4756 > http [ACK] Seq=789 Ack=23201 Win=65535 Len=0
808807 263.878011 197.55.186.145 -> 244.3.210.197 TCP 64 4759 > http [ACK] Seq=783 Ack=27551 Win=65535 Len=0
808844 263.886378 197.55.186.145 -> 244.3.210.197 TCP 64 4755 > http [ACK] Seq=4648 Ack=50453 Win=65535 Len=0
808874 263.897962 197.55.186.145 -> 244.3.210.197 TCP 64 4757 > http [ACK] Seq=2360 Ack=15450 Win=65535 Len=0
808884 263.899261 197.55.186.145 -> 244.3.210.197 TCP 64 4758 > http [ACK] Seq=2354 Ack=17636 Win=65535 Len=0
808945 263.913561 197.55.186.145 -> 244.3.210.197 TCP 64 4760 > http [ACK] Seq=2351 Ack=25343 Win=65535 Len=0
808993 263.922283 197.55.186.145 -> 244.3.210.197 TCP 64 4756 > http [ACK] Seq=789 Ack=26101 Win=65535 Len=0
809065 263.938448 197.55.186.145 -> 244.3.210.197 TCP 64 4759 > http [ACK] Seq=783 Ack=30451 Win=65535 Len=0
809091 263.947128 197.55.186.145 -> 244.3.210.197 TCP 64 4755 > http [ACK] Seq=4648 Ack=53353 Win=65535 Len=0
809138 263.954690 197.55.186.145 -> 244.3.210.197 TCP 64 4757 > http [ACK] Seq=2360 Ack=18350 Win=65535 Len=0
809191 263.964237 197.55.186.145 -> 244.3.210.197 TCP 64 4760 > http [ACK] Seq=2351 Ack=28243 Win=65535 Len=0
809219 263.973988 197.55.186.145 -> 244.3.210.197 TCP 64 4756 > http [ACK] Seq=789 Ack=29001 Win=65535 Len=0
809310 263.989187 197.55.186.145 -> 244.3.210.197 TCP 64 4759 > http [ACK] Seq=783 Ack=33351 Win=65535 Len=0
809319 263.989713 197.55.186.145 -> 244.3.210.197 TCP 64 4755 > http [ACK] Seq=4648 Ack=56253 Win=65535 Len=0
809368 263.996805 197.55.186.145 -> 244.3.210.197 TCP 64 4760 > http [ACK] Seq=2351 Ack=31143 Win=65535 Len=0
809429 264.017665 197.55.186.145 -> 244.3.210.197 TCP 64 4756 > http [ACK] Seq=789 Ack=31901 Win=65535 Len=0
809456 264.025152 197.55.186.145 -> 244.3.210.197 TCP 64 4758 > http [ACK] Seq=3137 Ack=20536 Win=65535 Len=0
809544 264.037301 197.55.186.145 -> 244.3.210.197 TCP 64 4759 > http [ACK] Seq=783 Ack=36251 Win=65535 Len=0
809578 264.041934 197.55.186.145 -> 244.3.210.197 TCP 64 4755 > http [ACK] Seq=4648 Ack=59153 Win=65535 Len=0
809663 264.056852 197.55.186.145 -> 244.3.210.197 TCP 64 4760 > http [ACK] Seq=2351 Ack=34043 Win=65535 Len=0
809706 264.065993 197.55.186.145 -> 244.3.210.197 TCP 64 4756 > http [ACK] Seq=789 Ack=34242 Win=65535 Len=0
809773 264.078188 197.55.186.145 -> 244.3.210.197 TCP 64 4759 > http [ACK] Seq=783 Ack=39151 Win=65535 Len=0
809797 264.083101 197.55.186.145 -> 244.3.210.197 TCP 64 4755 > http [ACK] Seq=4648 Ack=62053 Win=65535 Len=0
809819 264.090794 197.55.186.145 -> 244.3.210.197 TCP 64 4757 > http [ACK] Seq=3136 Ack=21312 Win=65535 Len=0
809911 264.098535 197.55.186.145 -> 244.3.210.197 TCP 64 4760 > http [ACK] Seq=2351 Ack=36943 Win=65535 Len=0
810044 264.118632 197.55.186.145 -> 244.3.210.197 TCP 64 4759 > http [ACK] Seq=783 Ack=42051 Win=65535 Len=0
810054 264.123242 197.55.186.145 -> 244.3.210.197 TCP 64 4755 > http [ACK] Seq=4648 Ack=64953 Win=65535 Len=0
810085 264.130202 197.55.186.145 -> 244.3.210.197 TCP 64 4757 > http [ACK] Seq=3136 Ack=24212 Win=65535 Len=0
810091 264.130453 197.55.186.145 -> 244.3.210.197 TCP 64 4760 > http [ACK] Seq=2351 Ack=39843 Win=65535 Len=0
810206 264.155498 197.55.186.145 -> 244.3.210.197 TCP 64 4759 > http [ACK] Seq=783 Ack=44951 Win=65535 Len=0
810221 264.157623 197.55.186.145 -> 244.3.210.197 TCP 64 4755 > http [ACK] Seq=4648 Ack=67853 Win=65535 Len=0
810269 264.163576 197.55.186.145 -> 244.3.210.197 TCP 64 4757 > http [ACK] Seq=3136 Ack=27112 Win=65535 Len=0
810291 264.167666 197.55.186.145 -> 244.3.210.197 TCP 64 4760 > http [ACK] Seq=2351 Ack=42743 Win=65535 Len=0
810331 264.191358 197.55.186.145 -> 244.3.210.197 TCP 64 4759 > http [ACK] Seq=783 Ack=47851 Win=65535 Len=0
810340 264.192022 197.55.186.145 -> 244.3.210.197 TCP 64 4755 > http [ACK] Seq=4648 Ack=70753 Win=65535 Len=0
810350 264.198720 197.55.186.145 -> 244.3.210.197 TCP 64 4757 > http [ACK] Seq=3136 Ack=29744 Win=65535 Len=0
810369 264.200644 197.55.186.145 -> 244.3.210.197 TCP 64 4760 > http [ACK] Seq=2351 Ack=45643 Win=65535 Len=0
810405 264.220116 197.55.186.145 -> 244.3.210.197 TCP 64 4759 > http [ACK] Seq=783 Ack=50751 Win=65535 Len=0
810417 264.224493 197.55.186.145 -> 244.3.210.197 TCP 64 4755 > http [ACK] Seq=4648 Ack=73653 Win=65535 Len=0
810423 264.225332 197.55.186.145 -> 244.3.210.197 TCP 64 4758 > http [ACK] Seq=3137 Ack=21092 Win=64979 Len=0
810435 264.230731 197.55.186.145 -> 244.3.210.197 TCP 64 4760 > http [ACK] Seq=2351 Ack=48543 Win=65535 Len=0
810468 264.248549 197.55.186.145 -> 244.3.210.197 TCP 64 4759 > http [ACK] Seq=783 Ack=53651 Win=65535 Len=0
810477 264.248762 197.55.186.145 -> 244.3.210.197 TCP 64 4755 > http [ACK] Seq=4648 Ack=76553 Win=65535 Len=0
810494 264.257366 197.55.186.145 -> 244.3.210.197 TCP 64 4760 > http [ACK] Seq=2351 Ack=51443 Win=65535 Len=0
810517 264.271689 197.55.186.145 -> 244.3.210.197 TCP 64 4759 > http [ACK] Seq=783 Ack=56551 Win=65535 Len=0
810532 264.273084 197.55.186.145 -> 244.3.210.197 TCP 64 4755 > http [ACK] Seq=4648 Ack=79453 Win=65535 Len=0
810546 264.290071 197.55.186.145 -> 244.3.210.197 TCP 64 4759 > http [ACK] Seq=783 Ack=59451 Win=65535 Len=0
810556 264.290751 197.55.186.145 -> 244.3.210.197 TCP 64 4755 > http [ACK] Seq=4648 Ack=82353 Win=65535 Len=0
810578 264.306455 197.55.186.145 -> 244.3.210.197 TCP 64 4759 > http [ACK] Seq=783 Ack=62351 Win=65535 Len=0
810587 264.309497 197.55.186.145 -> 244.3.210.197 TCP 64 4755 > http [ACK] Seq=4648 Ack=85253 Win=65535 Len=0
810629 264.322855 197.55.186.145 -> 244.3.210.197 TCP 64 4759 > http [ACK] Seq=783 Ack=65251 Win=65535 Len=0
810652 264.330019 197.55.186.145 -> 244.3.210.197 TCP 64 4755 > http [ACK] Seq=4648 Ack=88153 Win=65535 Len=0
810664 264.338826 197.55.186.145 -> 244.3.210.197 TCP 64 4759 > http [ACK] Seq=783 Ack=68151 Win=65535 Len=0
810676 264.345215 197.55.186.145 -> 244.3.210.197 TCP 64 4755 > http [ACK] Seq=4648 Ack=91053 Win=65535 Len=0
810692 264.359113 197.55.186.145 -> 244.3.210.197 TCP 64 4759 > http [ACK] Seq=783 Ack=71051 Win=65535 Len=0
810701 264.361319 197.55.186.145 -> 244.3.210.197 TCP 64 4755 > http [ACK] Seq=4648 Ack=93953 Win=65535 Len=0
810748 264.375348 197.55.186.145 -> 244.3.210.197 TCP 64 4759 > http [ACK] Seq=783 Ack=73951 Win=65535 Len=0
810779 264.380049 197.55.186.145 -> 244.3.210.197 TCP 64 4755 > http [ACK] Seq=4648 Ack=96853 Win=65535 Len=0
810809 264.402450 197.55.186.145 -> 244.3.210.197 TCP 64 4759 > http [ACK] Seq=783 Ack=76851 Win=65535 Len=0
810818 264.402702 197.55.186.145 -> 244.3.210.197 TCP 64 4755 > http [ACK] Seq=4648 Ack=99753 Win=65535 Len=0
810864 264.423809 197.55.186.145 -> 244.3.210.197 TCP 64 4759 > http [ACK] Seq=783 Ack=79751 Win=65535 Len=0
810894 264.428433 197.55.186.145 -> 244.3.210.197 TCP 64 4755 > http [ACK] Seq=4648 Ack=102653 Win=65535 Len=0
810901 264.428609 197.55.186.145 -> 244.3.210.197 TCP 64 4760 > http [ACK] Seq=2351 Ack=51885 Win=65093 Len=0
810935 264.437943 197.55.186.145 -> 244.3.210.197 TCP 64 4759 > http [ACK] Seq=783 Ack=82651 Win=65535 Len=0
810968 264.445896 197.55.186.145 -> 244.3.210.197 TCP 64 4755 > http [ACK] Seq=4648 Ack=105553 Win=65535 Len=0
811025 264.463277 197.55.186.145 -> 244.3.210.197 TCP 64 4759 > http [ACK] Seq=783 Ack=85551 Win=65535 Len=0
811039 264.466644 197.55.186.145 -> 244.3.210.197 TCP 64 4755 > http [ACK] Seq=4648 Ack=108453 Win=65535 Len=0
811056 264.479349 197.55.186.145 -> 244.3.210.197 TCP 64 4759 > http [ACK] Seq=783 Ack=88451 Win=65535 Len=0
811087 264.489050 197.55.186.145 -> 244.3.210.197 TCP 64 4759 > http [ACK] Seq=783 Ack=91351 Win=65535 Len=0
811106 264.498585 197.55.186.145 -> 244.3.210.197 TCP 64 4759 > http [ACK] Seq=783 Ack=94251 Win=65535 Len=0
811125 264.505961 197.55.186.145 -> 244.3.210.197 TCP 64 4759 > http [ACK] Seq=783 Ack=97151 Win=65535 Len=0
811190 264.521924 197.55.186.145 -> 244.3.210.197 TCP 64 4759 > http [ACK] Seq=783 Ack=100051 Win=65535 Len=0
811232 264.533686 197.55.186.145 -> 244.3.210.197 TCP 64 4759 > http [ACK] Seq=783 Ack=102951 Win=65535 Len=0
811253 264.541158 197.55.186.145 -> 244.3.210.197 TCP 64 4759 > http [ACK] Seq=783 Ack=105851 Win=65535 Len=0
811319 264.552215 197.55.186.145 -> 244.3.210.197 TCP 64 4759 > http [ACK] Seq=783 Ack=108751 Win=65535 Len=0
811352 264.560061 197.55.186.145 -> 244.3.210.197 TCP 64 4759 > http [ACK] Seq=783 Ack=111651 Win=65535 Len=0
811404 264.574074 197.55.186.145 -> 244.3.210.197 TCP 64 4759 > http [ACK] Seq=783 Ack=114551 Win=65535 Len=0
811426 264.581264 197.55.186.145 -> 244.3.210.197 TCP 64 4759 > http [ACK] Seq=783 Ack=117451 Win=65535 Len=0
811463 264.591722 197.55.186.145 -> 244.3.210.197 TCP 64 4759 > http [ACK] Seq=783 Ack=120351 Win=65535 Len=0
811506 264.599913 197.55.186.145 -> 244.3.210.197 TCP 64 4759 > http [ACK] Seq=783 Ack=123251 Win=65535 Len=0
811557 264.608749 197.55.186.145 -> 244.3.210.197 TCP 64 4759 > http [ACK] Seq=783 Ack=126151 Win=65535 Len=0
811624 264.616568 197.55.186.145 -> 244.3.210.197 TCP 64 4759 > http [ACK] Seq=783 Ack=129051 Win=65535 Len=0
811633 264.624305 197.55.186.145 -> 244.3.210.197 TCP 64 4759 > http [ACK] Seq=783 Ack=131951 Win=65535 Len=0
811672 264.631561 197.55.186.145 -> 244.3.210.197 TCP 64 4759 > http [ACK] Seq=783 Ack=134325 Win=65535 Len=0
811673 264.631786 197.55.186.145 -> 244.3.210.197 TCP 64 4755 > http [ACK] Seq=4648 Ack=109242 Win=64746 Len=0
812163 264.801497 197.55.186.145 -> 244.3.210.197 TCP 64 4758 > http [ACK] Seq=3917 Ack=23992 Win=65535 Len=0
812213 264.808505 197.55.186.145 -> 244.3.210.197 TCP 64 4758 > http [ACK] Seq=3917 Ack=25995 Win=65535 Len=0
812443 264.912091 197.55.186.145 -> 244.3.210.197 TCP 64 4756 > http [ACK] Seq=1570 Ack=37142 Win=65535 Len=0
812462 264.925302 197.55.186.145 -> 244.3.210.197 TCP 64 4756 > http [ACK] Seq=1570 Ack=40042 Win=65535 Len=0
812494 264.944910 197.55.186.145 -> 244.3.210.197 TCP 64 4756 > http [ACK] Seq=1570 Ack=42942 Win=65535 Len=0
812503 264.945104 197.55.186.145 -> 244.3.210.197 TCP 64 4757 > http [ACK] Seq=3917 Ack=32644 Win=65535 Len=0
812536 264.952875 197.55.186.145 -> 244.3.210.197 TCP 64 4760 > http [ACK] Seq=3130 Ack=54785 Win=65535 Len=0
812590 264.973202 197.55.186.145 -> 244.3.210.197 TCP 64 4756 > http [ACK] Seq=1570 Ack=45842 Win=65535 Len=0
812605 264.975360 197.55.186.145 -> 244.3.210.197 TCP 64 4757 > http [ACK] Seq=3917 Ack=35544 Win=65535 Len=0
812619 264.983058 197.55.186.145 -> 244.3.210.197 TCP 64 4760 > http [ACK] Seq=3130 Ack=57685 Win=65535 Len=0
812654 264.997690 197.55.186.145 -> 244.3.210.197 TCP 64 4756 > http [ACK] Seq=1570 Ack=48742 Win=65535 Len=0
812671 265.006194 197.55.186.145 -> 244.3.210.197 TCP 64 4757 > http [ACK] Seq=3917 Ack=38444 Win=65535 Len=0
812677 265.007417 197.55.186.145 -> 244.3.210.197 TCP 64 4760 > http [ACK] Seq=3130 Ack=60585 Win=65535 Len=0
812710 265.037458 197.55.186.145 -> 244.3.210.197 TCP 64 4756 > http [ACK] Seq=1570 Ack=51642 Win=65535 Len=0
812716 265.039503 197.55.186.145 -> 244.3.210.197 TCP 64 4757 > http [ACK] Seq=3917 Ack=41344 Win=65535 Len=0
812722 265.042850 197.55.186.145 -> 244.3.210.197 TCP 64 4760 > http [ACK] Seq=3130 Ack=62553 Win=65535 Len=0
812748 265.056518 197.55.186.145 -> 244.3.210.197 TCP 64 4756 > http [ACK] Seq=1570 Ack=54542 Win=65535 Len=0
812754 265.058972 197.55.186.145 -> 244.3.210.197 TCP 64 4757 > http [ACK] Seq=3917 Ack=44244 Win=65535 Len=0
812812 265.078528 197.55.186.145 -> 244.3.210.197 TCP 64 4756 > http [ACK] Seq=1570 Ack=57442 Win=65535 Len=0
812818 265.079898 197.55.186.145 -> 244.3.210.197 TCP 64 4757 > http [ACK] Seq=3917 Ack=47144 Win=65535 Len=0
812879 265.096950 197.55.186.145 -> 244.3.210.197 TCP 64 4757 > http [ACK] Seq=3917 Ack=50044 Win=65535 Len=0
812880 265.096954 197.55.186.145 -> 244.3.210.197 TCP 64 4756 > http [ACK] Seq=1570 Ack=60342 Win=65535 Len=0
812919 265.112499 197.55.186.145 -> 244.3.210.197 TCP 64 4756 > http [ACK] Seq=1570 Ack=63242 Win=65535 Len=0
812927 265.116569 197.55.186.145 -> 244.3.210.197 TCP 64 4757 > http [ACK] Seq=3917 Ack=52944 Win=65535 Len=0
812937 265.127286 197.55.186.145 -> 244.3.210.197 TCP 64 4756 > http [ACK] Seq=1570 Ack=65153 Win=65535 Len=0
812948 265.132244 197.55.186.145 -> 244.3.210.197 TCP 64 4757 > http [ACK] Seq=3917 Ack=55844 Win=65535 Len=0
812960 265.140109 197.55.186.145 -> 244.3.210.197 TCP 64 4757 > http [ACK] Seq=3917 Ack=58744 Win=65535 Len=0
813652 265.389783 197.55.186.145 -> 244.3.210.197 TCP 64 4758 > http [ACK] Seq=4751 Ack=28895 Win=65535 Len=0
813746 265.406692 197.55.186.145 -> 244.3.210.197 TCP 64 4760 > http [ACK] Seq=3961 Ack=65453 Win=65535 Len=0
813759 265.407220 197.55.186.145 -> 244.3.210.197 TCP 64 4758 > http [ACK] Seq=4751 Ack=31795 Win=65535 Len=0
813819 265.425173 197.55.186.145 -> 244.3.210.197 TCP 64 4756 > http [ACK] Seq=2403 Ack=68053 Win=65535 Len=0
813853 265.434573 197.55.186.145 -> 244.3.210.197 TCP 64 4760 > http [ACK] Seq=3961 Ack=68353 Win=65535 Len=0
813872 265.444504 197.55.186.145 -> 244.3.210.197 TCP 64 4758 > http [ACK] Seq=4751 Ack=34695 Win=65535 Len=0
813894 265.452812 197.55.186.145 -> 244.3.210.197 TCP 64 4756 > http [ACK] Seq=2403 Ack=70953 Win=65535 Len=0
813920 265.466312 197.55.186.145 -> 244.3.210.197 TCP 64 4760 > http [ACK] Seq=3961 Ack=71253 Win=65535 Len=0
813932 265.475659 197.55.186.145 -> 244.3.210.197 TCP 64 4758 > http [ACK] Seq=4751 Ack=37595 Win=65535 Len=0
813998 265.483774 197.55.186.145 -> 244.3.210.197 TCP 64 4756 > http [ACK] Seq=2403 Ack=73853 Win=65535 Len=0
814017 265.493120 197.55.186.145 -> 244.3.210.197 TCP 64 4760 > http [ACK] Seq=3961 Ack=74153 Win=65535 Len=0
814034 265.499167 197.55.186.145 -> 244.3.210.197 TCP 64 4758 > http [ACK] Seq=4751 Ack=40495 Win=65535 Len=0
814090 265.511280 197.55.186.145 -> 244.3.210.197 TCP 64 4756 > http [ACK] Seq=2403 Ack=76753 Win=65535 Len=0
814175 265.523249 197.55.186.145 -> 244.3.210.197 TCP 64 4760 > http [ACK] Seq=3961 Ack=75985 Win=65535 Len=0
814237 265.551302 197.55.186.145 -> 244.3.210.197 TCP 64 4757 > http [ACK] Seq=5547 Ack=62352 Win=65535 Len=0
814243 265.551610 197.55.186.145 -> 244.3.210.197 TCP 64 4759 > http [ACK] Seq=3204 Ack=137129 Win=65535 Len=0
814249 265.551819 197.55.186.145 -> 244.3.210.197 TCP 64 4755 > http [ACK] Seq=7069 Ack=112822 Win=65535 Len=0
814271 265.557416 197.55.186.145 -> 244.3.210.197 TCP 64 4758 > http [ACK] Seq=4751 Ack=43395 Win=65535 Len=0
814365 265.566102 197.55.186.145 -> 244.3.210.197 TCP 64 4757 > http [ACK] Seq=5547 Ack=64506 Win=65535 Len=0
814465 265.573060 197.55.186.145 -> 244.3.210.197 TCP 64 4758 > http [ACK] Seq=4751 Ack=46295 Win=65535 Len=0
814497 265.582238 197.55.186.145 -> 244.3.210.197 TCP 64 4758 > http [ACK] Seq=4751 Ack=49195 Win=65535 Len=0
814514 265.592178 197.55.186.145 -> 244.3.210.197 TCP 64 4758 > http [ACK] Seq=4751 Ack=52095 Win=65535 Len=0
814524 265.600881 197.55.186.145 -> 244.3.210.197 TCP 64 4758 > http [ACK] Seq=4751 Ack=54995 Win=65535 Len=0
814542 265.610505 197.55.186.145 -> 244.3.210.197 TCP 64 4758 > http [ACK] Seq=4751 Ack=57895 Win=65535 Len=0
814616 265.619620 197.55.186.145 -> 244.3.210.197 TCP 64 4758 > http [ACK] Seq=4751 Ack=60795 Win=65535 Len=0
814632 265.631765 197.55.186.145 -> 244.3.210.197 TCP 64 4760 > http [ACK] Seq=4772 Ack=78644 Win=65535 Len=0
814669 265.639486 197.55.186.145 -> 244.3.210.197 TCP 64 4758 > http [ACK] Seq=4751 Ack=63695 Win=65535 Len=0
814687 265.647403 197.55.186.145 -> 244.3.210.197 TCP 64 4756 > http [ACK] Seq=3213 Ack=81006 Win=65535 Len=0
814769 265.666013 197.55.186.145 -> 244.3.210.197 TCP 64 4759 > http [ACK] Seq=4013 Ack=140029 Win=65535 Len=0
814775 265.667469 197.55.186.145 -> 244.3.210.197 TCP 64 4755 > http [ACK] Seq=7879 Ack=115722 Win=65535 Len=0
814825 265.685267 197.55.186.145 -> 244.3.210.197 TCP 64 4757 > http [ACK] Seq=6368 Ack=67088 Win=65535 Len=0
814862 265.690453 197.55.186.145 -> 244.3.210.197 TCP 64 4759 > http [ACK] Seq=4013 Ack=142117 Win=65535 Len=0
814878 265.690999 197.55.186.145 -> 244.3.210.197 TCP 64 4755 > http [ACK] Seq=7879 Ack=117553 Win=65535 Len=0
815014 265.715714 197.55.186.145 -> 244.3.210.197 TCP 64 4760 > http [ACK] Seq=5592 Ack=81544 Win=65535 Len=0
815056 265.727431 197.55.186.145 -> 244.3.210.197 TCP 64 4760 > http [ACK] Seq=5592 Ack=84444 Win=65535 Len=0
815110 265.735227 197.55.186.145 -> 244.3.210.197 TCP 64 4760 > http [ACK] Seq=5592 Ack=87344 Win=65535 Len=0
815150 265.748728 197.55.186.145 -> 244.3.210.197 TCP 64 4756 > http [ACK] Seq=4029 Ack=83747 Win=65535 Len=0
815497 265.850567 197.55.186.145 -> 244.3.210.197 TCP 64 4759 > http [ACK] Seq=5722 Ack=145393 Win=65535 Len=0
815705 265.941460 197.55.186.145 -> 244.3.210.197 TCP 64 4755 > http [ACK] Seq=9520 Ack=119651 Win=65535 Len=0
815844 265.984214 197.55.186.145 -> 244.3.210.197 TCP 64 4757 > http [ACK] Seq=8079 Ack=68049 Win=64574 Len=0
815850 265.984515 197.55.186.145 -> 244.3.210.197 TCP 64 4759 > http [ACK] Seq=5722 Ack=145522 Win=65406 Len=0
815858 265.984952 197.55.186.145 -> 244.3.210.197 TCP 64 4760 > http [ACK] Seq=6452 Ack=88879 Win=65535 Len=0
815859 265.984957 197.55.186.145 -> 244.3.210.197 TCP 64 4756 > http [ACK] Seq=4886 Ack=84288 Win=64994 Len=0
815862 265.985075 197.55.186.145 -> 244.3.210.197 TCP 64 4758 > http [ACK] Seq=6403 Ack=65704 Win=65017 Len=0
821280 268.025292 197.55.186.145 -> 244.3.210.197 TCP 64 4758 > http [ACK] Seq=7277 Ack=68604 Win=65535 Len=0
821311 268.033552 197.55.186.145 -> 244.3.210.197 TCP 64 4758 > http [ACK] Seq=7277 Ack=71504 Win=65535 Len=0
821329 268.046600 197.55.186.145 -> 244.3.210.197 TCP 64 4758 > http [ACK] Seq=7277 Ack=74404 Win=65535 Len=0
821342 268.054504 197.55.186.145 -> 244.3.210.197 TCP 64 4758 > http [ACK] Seq=7277 Ack=77304 Win=65535 Len=0
821364 268.064742 197.55.186.145 -> 244.3.210.197 TCP 64 4758 > http [ACK] Seq=7277 Ack=80204 Win=65535 Len=0
822061 268.400862 197.55.186.145 -> 244.3.210.197 TCP 64 4756 > http [ACK] Seq=5786 Ack=87188 Win=65535 Len=0
822144 268.412025 197.55.186.145 -> 244.3.210.197 TCP 64 4756 > http [ACK] Seq=5786 Ack=90088 Win=65535 Len=0
822211 268.445428 197.55.186.145 -> 244.3.210.197 TCP 64 4760 > http [ACK] Seq=7353 Ack=91779 Win=65535 Len=0
822225 268.447739 197.55.186.145 -> 244.3.210.197 TCP 64 4757 > http [ACK] Seq=8994 Ack=70949 Win=65535 Len=0
822232 268.448165 197.55.186.145 -> 244.3.210.197 TCP 64 4759 > http [ACK] Seq=6635 Ack=147647 Win=65535 Len=0
822252 268.453646 197.55.186.145 -> 244.3.210.197 TCP 64 4755 > http [ACK] Seq=10433 Ack=121644 Win=65535 Len=0
822283 268.457185 197.55.186.145 -> 244.3.210.197 TCP 64 4758 > http [ACK] Seq=8190 Ack=83440 Win=65535 Len=0
822284 268.457215 197.55.186.145 -> 244.3.210.197 TCP 64 4756 > http [ACK] Seq=5786 Ack=92988 Win=65535 Len=0
822387 268.478641 197.55.186.145 -> 244.3.210.197 TCP 64 4760 > http [ACK] Seq=7353 Ack=94679 Win=65535 Len=0
822411 268.487642 197.55.186.145 -> 244.3.210.197 TCP 64 4757 > http [ACK] Seq=8994 Ack=73849 Win=65535 Len=0
822426 268.488826 197.55.186.145 -> 244.3.210.197 TCP 64 4756 > http [ACK] Seq=5786 Ack=95888 Win=65535 Len=0
822475 268.512975 197.55.186.145 -> 244.3.210.197 TCP 64 4760 > http [ACK] Seq=7353 Ack=97579 Win=65535 Len=0
822513 268.527100 197.55.186.145 -> 244.3.210.197 TCP 64 4756 > http [ACK] Seq=5786 Ack=98788 Win=65535 Len=0
822538 268.539577 197.55.186.145 -> 244.3.210.197 TCP 64 4760 > http [ACK] Seq=7353 Ack=100479 Win=65535 Len=0
822553 268.545625 197.55.186.145 -> 244.3.210.197 TCP 64 4756 > http [ACK] Seq=5786 Ack=101688 Win=65535 Len=0
822581 268.559333 197.55.186.145 -> 244.3.210.197 TCP 64 4759 > http [ACK] Seq=7527 Ack=150547 Win=65535 Len=0
822597 268.567446 197.55.186.145 -> 244.3.210.197 TCP 64 4760 > http [ACK] Seq=7353 Ack=102896 Win=65535 Len=0
822632 268.580575 197.55.186.145 -> 244.3.210.197 TCP 64 4755 > http [ACK] Seq=11346 Ack=123630 Win=65535 Len=0
822656 268.585934 197.55.186.145 -> 244.3.210.197 TCP 64 4758 > http [ACK] Seq=9103 Ack=85629 Win=65535 Len=0
822672 268.592901 197.55.186.145 -> 244.3.210.197 TCP 64 4756 > http [ACK] Seq=5786 Ack=104588 Win=65535 Len=0
822678 268.593195 197.55.186.145 -> 244.3.210.197 TCP 64 4759 > http [ACK] Seq=7527 Ack=153447 Win=65535 Len=0
822721 268.608147 197.55.186.145 -> 244.3.210.197 TCP 64 4757 > http [ACK] Seq=9907 Ack=77449 Win=65535 Len=0
822736 268.616121 197.55.186.145 -> 244.3.210.197 TCP 64 4756 > http [ACK] Seq=5786 Ack=107488 Win=65535 Len=0
822744 268.617508 197.55.186.145 -> 244.3.210.197 TCP 64 4759 > http [ACK] Seq=7527 Ack=156347 Win=65535 Len=0
822770 268.633986 197.55.186.145 -> 244.3.210.197 TCP 64 4756 > http [ACK] Seq=5786 Ack=110388 Win=65535 Len=0
822782 268.636777 197.55.186.145 -> 244.3.210.197 TCP 64 4759 > http [ACK] Seq=7527 Ack=159247 Win=65535 Len=0
822861 268.652663 197.55.186.145 -> 244.3.210.197 TCP 64 4756 > http [ACK] Seq=5786 Ack=113288 Win=65535 Len=0
822875 268.654263 197.55.186.145 -> 244.3.210.197 TCP 64 4759 > http [ACK] Seq=7527 Ack=162147 Win=65535 Len=0
822913 268.673163 197.55.186.145 -> 244.3.210.197 TCP 64 4759 > http [ACK] Seq=7527 Ack=165047 Win=65535 Len=0
822920 268.673512 197.55.186.145 -> 244.3.210.197 TCP 64 4760 > http [ACK] Seq=8241 Ack=105796 Win=65535 Len=0
822958 268.684915 197.55.186.145 -> 244.3.210.197 TCP 64 4760 > http [ACK] Seq=8241 Ack=107463 Win=65535 Len=0
822985 268.691187 197.55.186.145 -> 244.3.210.197 TCP 64 4759 > http [ACK] Seq=7527 Ack=167947 Win=65535 Len=0
823153 268.827756 197.55.186.145 -> 244.3.210.197 TCP 64 4759 > http [ACK] Seq=7527 Ack=168519 Win=64963 Len=0
823159 268.828640 197.55.186.145 -> 244.3.210.197 TCP 64 4755 > http [ACK] Seq=12226 Ack=123968 Win=65197 Len=0
823162 268.828818 197.55.186.145 -> 244.3.210.197 TCP 64 4756 > http [ACK] Seq=5786 Ack=113783 Win=65040 Len=0
827419 270.014294 197.55.186.145 -> 244.3.210.197 TCP 64 4758 > http [ACK] Seq=10004 Ack=88529 Win=65535 Len=0
827502 270.027172 197.55.186.145 -> 244.3.210.197 TCP 64 4758 > http [ACK] Seq=10004 Ack=91429 Win=65535 Len=0
827548 270.035589 197.55.186.145 -> 244.3.210.197 TCP 64 4758 > http [ACK] Seq=10004 Ack=94329 Win=65535 Len=0
827585 270.044477 197.55.186.145 -> 244.3.210.197 TCP 64 4758 > http [ACK] Seq=10004 Ack=97229 Win=65535 Len=0
827620 270.053521 197.55.186.145 -> 244.3.210.197 TCP 64 4758 > http [ACK] Seq=10004 Ack=100129 Win=65535 Len=0
827649 270.063802 197.55.186.145 -> 244.3.210.197 TCP 64 4758 > http [ACK] Seq=10004 Ack=103029 Win=65535 Len=0
827665 270.068054 197.55.186.145 -> 244.3.210.197 TCP 64 4758 > http [ACK] Seq=10004 Ack=105091 Win=65535 Len=0
828515 270.420089 197.55.186.145 -> 244.3.210.197 TCP 64 4757 > http [ACK] Seq=10807 Ack=80349 Win=65535 Len=0
828610 270.437910 197.55.186.145 -> 244.3.210.197 TCP 64 4756 > http [ACK] Seq=6674 Ack=116683 Win=65535 Len=0
828630 270.448459 197.55.186.145 -> 244.3.210.197 TCP 64 4757 > http [ACK] Seq=10807 Ack=83249 Win=65535 Len=0
828721 270.478265 197.55.186.145 -> 244.3.210.197 TCP 64 4755 > http [ACK] Seq=13135 Ack=126868 Win=65535 Len=0
828727 270.478461 197.55.186.145 -> 244.3.210.197 TCP 64 4760 > http [ACK] Seq=9148 Ack=109555 Win=65535 Len=0
828755 270.483733 197.55.186.145 -> 244.3.210.197 TCP 64 4759 > http [ACK] Seq=8434 Ack=170607 Win=65535 Len=0
828774 270.488122 197.55.186.145 -> 244.3.210.197 TCP 64 4758 > http [ACK] Seq=10911 Ack=107297 Win=65535 Len=0
828796 270.494336 197.55.186.145 -> 244.3.210.197 TCP 64 4756 > http [ACK] Seq=6674 Ack=119583 Win=65535 Len=0
828835 270.512224 197.55.186.145 -> 244.3.210.197 TCP 64 4757 > http [ACK] Seq=10807 Ack=86149 Win=65535 Len=0
828875 270.519940 197.55.186.145 -> 244.3.210.197 TCP 64 4755 > http [ACK] Seq=13135 Ack=128770 Win=65535 Len=0
828913 270.533149 197.55.186.145 -> 244.3.210.197 TCP 64 4756 > http [ACK] Seq=6674 Ack=122483 Win=65535 Len=0
828936 270.541006 197.55.186.145 -> 244.3.210.197 TCP 64 4757 > http [ACK] Seq=10807 Ack=89049 Win=65535 Len=0
828976 270.558826 197.55.186.145 -> 244.3.210.197 TCP 64 4756 > http [ACK] Seq=6674 Ack=125383 Win=65535 Len=0
829002 270.578260 197.55.186.145 -> 244.3.210.197 TCP 64 4757 > http [ACK] Seq=10807 Ack=91949 Win=65535 Len=0
829088 270.601507 197.55.186.145 -> 244.3.210.197 TCP 64 4756 > http [ACK] Seq=6674 Ack=127918 Win=65535 Len=0
829160 270.615423 197.55.186.145 -> 244.3.210.197 TCP 64 4760 > http [ACK] Seq=10055 Ack=111527 Win=65535 Len=0
829177 270.620498 197.55.186.145 -> 244.3.210.197 TCP 64 4758 > http [ACK] Seq=11818 Ack=109375 Win=65535 Len=0
829183 270.620651 197.55.186.145 -> 244.3.210.197 TCP 64 4759 > http [ACK] Seq=9341 Ack=172946 Win=65535 Len=0
829199 270.626881 197.55.186.145 -> 244.3.210.197 TCP 64 4757 > http [ACK] Seq=10807 Ack=94849 Win=65535 Len=0
829228 270.642342 197.55.186.145 -> 244.3.210.197 TCP 64 4757 > http [ACK] Seq=10807 Ack=97749 Win=65535 Len=0
829239 270.660054 197.55.186.145 -> 244.3.210.197 TCP 64 4757 > http [ACK] Seq=10807 Ack=100649 Win=65535 Len=0
829292 270.680823 197.55.186.145 -> 244.3.210.197 TCP 64 4757 > http [ACK] Seq=10807 Ack=103549 Win=65535 Len=0
829439 270.797127 197.55.186.145 -> 244.3.210.197 TCP 64 4757 > http [ACK] Seq=10807 Ack=103573 Win=65511 Len=0
829760 271.026074 197.55.186.145 -> 244.3.210.197 TCP 64 4755 > http [ACK] Seq=14025 Ack=131670 Win=65535 Len=0
829783 271.035002 197.55.186.145 -> 244.3.210.197 TCP 64 4755 > http [ACK] Seq=14025 Ack=134570 Win=65535 Len=0
829813 271.048118 197.55.186.145 -> 244.3.210.197 TCP 64 4755 > http [ACK] Seq=14025 Ack=137470 Win=65535 Len=0
829842 271.055744 197.55.186.145 -> 244.3.210.197 TCP 64 4755 > http [ACK] Seq=14025 Ack=140370 Win=65535 Len=0
829862 271.064811 197.55.186.145 -> 244.3.210.197 TCP 64 4755 > http [ACK] Seq=14025 Ack=143270 Win=65535 Len=0
829927 271.078922 197.55.186.145 -> 244.3.210.197 TCP 64 4755 > http [ACK] Seq=14025 Ack=146170 Win=65535 Len=0
829948 271.088366 197.55.186.145 -> 244.3.210.197 TCP 64 4755 > http [ACK] Seq=14025 Ack=149070 Win=65535 Len=0
829963 271.096175 197.55.186.145 -> 244.3.210.197 TCP 64 4755 > http [ACK] Seq=14025 Ack=151970 Win=65535 Len=0
829981 271.100888 197.55.186.145 -> 244.3.210.197 TCP 64 4755 > http [ACK] Seq=14025 Ack=153688 Win=65535 Len=0
872282 288.500453 197.55.186.145 -> 244.3.210.197 TCP 64 4754 > http [FIN, ACK] Seq=535 Ack=351 Win=65185 Len=0
872554 288.573351 197.55.186.145 -> 244.3.210.197 TCP 64 4754 > http [ACK] Seq=536 Ack=352 Win=65185 Len=0
