720275 229.871462 198.130.142.77 -> 41.177.98.127 TCP 66 giop > z39-50 [SYN] Seq=0 Win=65535 Len=0 MSS=1380 SACK_PERM=1
720406 229.932361 198.130.142.77 -> 41.177.98.127 TCP 64 giop > z39-50 [ACK] Seq=1 Ack=1 Win=65535 Len=0
720407 229.932365 198.130.142.77 -> 41.177.98.127 TCP 149 giop > z39-50 [PSH, ACK] Seq=1 Ack=1 Win=65535 Len=91
723209 231.276291 198.130.142.77 -> 41.177.98.127 TCP 170 giop > z39-50 [PSH, ACK] Seq=92 Ack=71 Win=65465 Len=112
726665 232.782448 198.130.142.77 -> 41.177.98.127 TCP 91 giop > z39-50 [PSH, ACK] Seq=204 Ack=94 Win=65442 Len=33
726790 232.871385 198.130.142.77 -> 41.177.98.127 TCP 64 giop > z39-50 [ACK] Seq=237 Ack=1937 Win=65535 Len=0
726792 232.872484 198.130.142.77 -> 41.177.98.127 TCP 66 giop > z39-50 [PSH, ACK] Seq=237 Ack=1937 Win=65535 Len=8
726853 232.937380 198.130.142.77 -> 41.177.98.127 TCP 64 giop > z39-50 [ACK] Seq=245 Ack=1938 Win=65535 Len=0
726854 232.937385 198.130.142.77 -> 41.177.98.127 TCP 64 giop > z39-50 [FIN, ACK] Seq=245 Ack=1938 Win=65535 Len=0
