228094  78.261351 198.39.244.48 -> 41.177.26.176 TCP 82 23606 > http [SYN] Seq=0 Win=65535 Len=0 MSS=1380 WS=4 TSval=2193557840 TSecr=0 SACK_PERM=1
228213  78.316283 198.39.244.48 -> 41.177.26.176 TCP 70 23606 > http [ACK] Seq=1 Ack=1 Win=131328 Len=0 TSval=2193557894 TSecr=140349422
230479  79.585916 198.39.244.48 -> 41.177.26.176 TCP 70 23606 > http [ACK] Seq=677 Ack=1369 Win=129960 Len=0 TSval=2193559137 TSecr=140349549
230480  79.585921 198.39.244.48 -> 41.177.26.176 TCP 70 23606 > http [ACK] Seq=677 Ack=1471 Win=129856 Len=0 TSval=2193559137 TSecr=140349549
230507  79.597685 198.39.244.48 -> 41.177.26.176 TCP 70 23606 > http [ACK] Seq=677 Ack=2124 Win=130672 Len=0 TSval=2193559149 TSecr=140349550
230508  79.597689 198.39.244.48 -> 41.177.26.176 TCP 70 23606 > http [ACK] Seq=677 Ack=2524 Win=131128 Len=0 TSval=2193559149 TSecr=140349550
230509  79.597693 198.39.244.48 -> 41.177.26.176 TCP 70 23606 > http [ACK] Seq=677 Ack=2324 Win=130472 Len=0 TSval=2193559149 TSecr=140349550
230510  79.597698 198.39.244.48 -> 41.177.26.176 TCP 70 23606 > http [ACK] Seq=677 Ack=2615 Win=131036 Len=0 TSval=2193559149 TSecr=140349550
230511  79.597702 198.39.244.48 -> 41.177.26.176 TCP 70 23606 > http [ACK] Seq=677 Ack=2818 Win=130832 Len=0 TSval=2193559149 TSecr=140349550
230514  79.597965 198.39.244.48 -> 41.177.26.176 TCP 70 23606 > http [ACK] Seq=677 Ack=3508 Win=130636 Len=0 TSval=2193559149 TSecr=140349550
230599  79.643344 198.39.244.48 -> 41.177.26.176 TCP 70 23606 > http [ACK] Seq=677 Ack=4876 Win=129960 Len=0 TSval=2193559194 TSecr=140349555
230600  79.643348 198.39.244.48 -> 41.177.26.176 TCP 70 23606 > http [ACK] Seq=677 Ack=5925 Win=128908 Len=0 TSval=2193559194 TSecr=140349555
230601  79.643559 198.39.244.48 -> 41.177.26.176 TCP 70 23606 > http [ACK] Seq=677 Ack=7293 Win=129960 Len=0 TSval=2193559194 TSecr=140349555
230681  79.652274 198.39.244.48 -> 41.177.26.176 TCP 70 23606 > http [ACK] Seq=677 Ack=8661 Win=129960 Len=0 TSval=2193559203 TSecr=140349556
230682  79.652279 198.39.244.48 -> 41.177.26.176 TCP 70 23606 > http [ACK] Seq=677 Ack=9836 Win=128784 Len=0 TSval=2193559203 TSecr=140349556
231121  79.831904 198.39.244.48 -> 41.177.26.176 TCP 82 23870 > http [SYN] Seq=0 Win=65535 Len=0 MSS=1380 WS=2 TSval=2193559379 TSecr=0 SACK_PERM=1
231227  79.889589 198.39.244.48 -> 41.177.26.176 TCP 70 23870 > http [ACK] Seq=1 Ack=1 Win=65664 Len=0 TSval=2193559433 TSecr=140349579
231228  79.889682 198.39.244.48 -> 41.177.26.176 TCP 70 23606 > http [ACK] Seq=1237 Ack=10122 Win=130784 Len=0 TSval=2193559433 TSecr=140349579
231229  79.889687 198.39.244.48 -> 41.177.26.176 TCP 70 23606 > http [ACK] Seq=1237 Ack=11490 Win=129704 Len=0 TSval=2193559434 TSecr=140349579
231230  79.889691 198.39.244.48 -> 41.177.26.176 TCP 70 23606 > http [ACK] Seq=1237 Ack=12858 Win=129704 Len=0 TSval=2193559434 TSecr=140349579
231231  79.889695 198.39.244.48 -> 41.177.26.176 TCP 70 23606 > http [ACK] Seq=1237 Ack=14226 Win=129704 Len=0 TSval=2193559434 TSecr=140349579
231232  79.889699 198.39.244.48 -> 41.177.26.176 TCP 70 23606 > http [ACK] Seq=1237 Ack=15594 Win=129704 Len=0 TSval=2193559434 TSecr=140349579
231233  79.889703 198.39.244.48 -> 41.177.26.176 TCP 70 23606 > http [ACK] Seq=1237 Ack=16962 Win=129704 Len=0 TSval=2193559434 TSecr=140349579
231234  79.889707 198.39.244.48 -> 41.177.26.176 TCP 70 23606 > http [ACK] Seq=1237 Ack=18314 Win=129720 Len=0 TSval=2193559434 TSecr=140349579
231235  79.889711 198.39.244.48 -> 41.177.26.176 TCP 70 23606 > http [ACK] Seq=1237 Ack=19682 Win=129704 Len=0 TSval=2193559434 TSecr=140349579
231236  79.889715 198.39.244.48 -> 41.177.26.176 TCP 70 23606 > http [ACK] Seq=1237 Ack=21050 Win=129704 Len=0 TSval=2193559434 TSecr=140349579
231237  79.889719 198.39.244.48 -> 41.177.26.176 TCP 70 23606 > http [ACK] Seq=1237 Ack=22418 Win=129704 Len=0 TSval=2193559434 TSecr=140349579
231238  79.889724 198.39.244.48 -> 41.177.26.176 TCP 70 23606 > http [ACK] Seq=1237 Ack=23786 Win=129704 Len=0 TSval=2193559435 TSecr=140349579
231239  79.889728 198.39.244.48 -> 41.177.26.176 TCP 70 23606 > http [ACK] Seq=1237 Ack=25154 Win=129704 Len=0 TSval=2193559435 TSecr=140349579
231240  79.889732 198.39.244.48 -> 41.177.26.176 TCP 70 23606 > http [ACK] Seq=1237 Ack=26506 Win=129720 Len=0 TSval=2193559435 TSecr=140349579
231245  79.889990 198.39.244.48 -> 41.177.26.176 TCP 70 23606 > http [ACK] Seq=1237 Ack=27874 Win=129704 Len=0 TSval=2193559436 TSecr=140349579
231265  79.890388 198.39.244.48 -> 41.177.26.176 TCP 70 23606 > http [ACK] Seq=1237 Ack=29242 Win=129704 Len=0 TSval=2193559436 TSecr=140349579
231364  79.944591 198.39.244.48 -> 41.177.26.176 TCP 70 23606 > http [ACK] Seq=1237 Ack=30610 Win=129704 Len=0 TSval=2193559489 TSecr=140349585
231365  79.944596 198.39.244.48 -> 41.177.26.176 TCP 70 23606 > http [ACK] Seq=1237 Ack=31978 Win=129704 Len=0 TSval=2193559490 TSecr=140349585
231366  79.944814 198.39.244.48 -> 41.177.26.176 TCP 70 23606 > http [ACK] Seq=1237 Ack=33346 Win=129704 Len=0 TSval=2193559490 TSecr=140349585
231367  79.944982 198.39.244.48 -> 41.177.26.176 TCP 70 23606 > http [ACK] Seq=1237 Ack=34698 Win=129720 Len=0 TSval=2193559490 TSecr=140349585
231368  79.945423 198.39.244.48 -> 41.177.26.176 TCP 70 23606 > http [ACK] Seq=1237 Ack=36066 Win=129704 Len=0 TSval=2193559490 TSecr=140349585
231369  79.945427 198.39.244.48 -> 41.177.26.176 TCP 70 23606 > http [ACK] Seq=1237 Ack=37434 Win=129704 Len=0 TSval=2193559490 TSecr=140349585
231370  79.945432 198.39.244.48 -> 41.177.26.176 TCP 70 23606 > http [ACK] Seq=1237 Ack=38802 Win=129704 Len=0 TSval=2193559490 TSecr=140349585
231371  79.945436 198.39.244.48 -> 41.177.26.176 TCP 70 23606 > http [ACK] Seq=1237 Ack=40170 Win=128336 Len=0 TSval=2193559490 TSecr=140349585
231372  79.945440 198.39.244.48 -> 41.177.26.176 TCP 70 [TCP Window Update] 23606 > http [ACK] Seq=1237 Ack=40170 Win=131072 Len=0 TSval=2193559490 TSecr=140349585
231373  79.945444 198.39.244.48 -> 41.177.26.176 TCP 70 23606 > http [ACK] Seq=1237 Ack=41538 Win=129704 Len=0 TSval=2193559490 TSecr=140349585
231374  79.945448 198.39.244.48 -> 41.177.26.176 TCP 70 23606 > http [ACK] Seq=1237 Ack=42890 Win=129720 Len=0 TSval=2193559490 TSecr=140349585
231375  79.945452 198.39.244.48 -> 41.177.26.176 TCP 70 23606 > http [ACK] Seq=1237 Ack=44258 Win=129704 Len=0 TSval=2193559490 TSecr=140349585
231378  79.945843 198.39.244.48 -> 41.177.26.176 TCP 70 23606 > http [ACK] Seq=1237 Ack=45626 Win=129704 Len=0 TSval=2193559491 TSecr=140349585
231379  79.945848 198.39.244.48 -> 41.177.26.176 TCP 70 23606 > http [ACK] Seq=1237 Ack=46994 Win=129704 Len=0 TSval=2193559491 TSecr=140349585
231381  79.946114 198.39.244.48 -> 41.177.26.176 TCP 70 23606 > http [ACK] Seq=1237 Ack=48362 Win=129704 Len=0 TSval=2193559491 TSecr=140349585
231382  79.946119 198.39.244.48 -> 41.177.26.176 TCP 70 23606 > http [ACK] Seq=1237 Ack=49730 Win=129704 Len=0 TSval=2193559491 TSecr=140349585
231383  79.946330 198.39.244.48 -> 41.177.26.176 TCP 70 23606 > http [ACK] Seq=1237 Ack=51082 Win=129720 Len=0 TSval=2193559491 TSecr=140349585
231384  79.946379 198.39.244.48 -> 41.177.26.176 TCP 70 23606 > http [ACK] Seq=1237 Ack=52450 Win=129704 Len=0 TSval=2193559491 TSecr=140349585
231385  79.946384 198.39.244.48 -> 41.177.26.176 TCP 70 23606 > http [ACK] Seq=1237 Ack=53818 Win=129704 Len=0 TSval=2193559491 TSecr=140349585
231386  79.946591 198.39.244.48 -> 41.177.26.176 TCP 70 23606 > http [ACK] Seq=1237 Ack=55186 Win=129704 Len=0 TSval=2193559491 TSecr=140349585
231387  79.946596 198.39.244.48 -> 41.177.26.176 TCP 70 23606 > http [ACK] Seq=1237 Ack=56554 Win=129704 Len=0 TSval=2193559492 TSecr=140349585
231388  79.946600 198.39.244.48 -> 41.177.26.176 TCP 70 23606 > http [ACK] Seq=1237 Ack=57052 Win=130572 Len=0 TSval=2193559492 TSecr=140349585
231421  79.959355 198.39.244.48 -> 41.177.26.176 TCP 70 23870 > http [ACK] Seq=556 Ack=285 Win=65380 Len=0 TSval=2193559504 TSecr=140349586
231422  79.959365 198.39.244.48 -> 41.177.26.176 TCP 70 23870 > http [ACK] Seq=556 Ack=967 Win=64698 Len=0 TSval=2193559504 TSecr=140349586
231540  80.024866 198.39.244.48 -> 41.177.26.176 TCP 82 38718 > http [SYN] Seq=0 Win=65535 Len=0 MSS=1380 WS=2 TSval=2193559568 TSecr=0 SACK_PERM=1
231544  80.025929 198.39.244.48 -> 41.177.26.176 TCP 82 62744 > http [SYN] Seq=0 Win=65535 Len=0 MSS=1380 WS=2 TSval=2193559569 TSecr=0 SACK_PERM=1
231547  80.026888 198.39.244.48 -> 41.177.26.176 TCP 82 27547 > http [SYN] Seq=0 Win=65535 Len=0 MSS=1380 WS=2 TSval=2193559569 TSecr=0 SACK_PERM=1
231675  80.077839 198.39.244.48 -> 41.177.26.176 TCP 70 23870 > http [ACK] Seq=1153 Ack=1253 Win=65250 Len=0 TSval=2193559620 TSecr=140349598
231678  80.078276 198.39.244.48 -> 41.177.26.176 TCP 70 23606 > http [ACK] Seq=1836 Ack=57338 Win=130288 Len=0 TSval=2193559620 TSecr=140349598
231679  80.078409 198.39.244.48 -> 41.177.26.176 TCP 70 23870 > http [ACK] Seq=1153 Ack=2621 Win=64168 Len=0 TSval=2193559620 TSecr=140349598
231680  80.078414 198.39.244.48 -> 41.177.26.176 TCP 70 23870 > http [ACK] Seq=1153 Ack=3989 Win=62800 Len=0 TSval=2193559620 TSecr=140349598
231681  80.078418 198.39.244.48 -> 41.177.26.176 TCP 70 [TCP Window Update] 23870 > http [ACK] Seq=1153 Ack=3989 Win=65536 Len=0 TSval=2193559620 TSecr=140349598
231682  80.078422 198.39.244.48 -> 41.177.26.176 TCP 70 23870 > http [ACK] Seq=1153 Ack=4772 Win=64752 Len=0 TSval=2193559620 TSecr=140349598
231683  80.078583 198.39.244.48 -> 41.177.26.176 TCP 70 23606 > http [ACK] Seq=1836 Ack=58665 Win=128960 Len=0 TSval=2193559621 TSecr=140349598
231685  80.079372 198.39.244.48 -> 41.177.26.176 TCP 70 38718 > http [ACK] Seq=1 Ack=1 Win=65664 Len=0 TSval=2193559621 TSecr=140349598
231690  80.080426 198.39.244.48 -> 41.177.26.176 TCP 70 62744 > http [ACK] Seq=1 Ack=1 Win=65664 Len=0 TSval=2193559622 TSecr=140349599
231699  80.082304 198.39.244.48 -> 41.177.26.176 TCP 70 27547 > http [ACK] Seq=1 Ack=1 Win=65664 Len=0 TSval=2193559624 TSecr=140349599
231771  80.100743 198.39.244.48 -> 41.177.26.15 TCP 82 27130 > http [SYN] Seq=0 Win=65535 Len=0 MSS=1380 WS=2 TSval=2193559642 TSecr=0 SACK_PERM=1
231791  80.117338 198.39.244.48 -> 41.177.26.176 TCP 82 21415 > http [SYN] Seq=0 Win=65535 Len=0 MSS=1380 WS=4 TSval=2193559658 TSecr=0 SACK_PERM=1
231853  80.138180 198.39.244.48 -> 41.177.26.176 TCP 70 38718 > http [ACK] Seq=603 Ack=287 Win=65378 Len=0 TSval=2193559679 TSecr=140349604
231855  80.138413 198.39.244.48 -> 41.177.26.176 TCP 70 38718 > http [ACK] Seq=603 Ack=1655 Win=64296 Len=0 TSval=2193559679 TSecr=140349604
231856  80.138417 198.39.244.48 -> 41.177.26.176 TCP 70 38718 > http [ACK] Seq=603 Ack=1921 Win=64030 Len=0 TSval=2193559679 TSecr=140349604
231871  80.141995 198.39.244.48 -> 41.177.26.176 TCP 70 62744 > http [ACK] Seq=598 Ack=403 Win=65262 Len=0 TSval=2193559683 TSecr=140349604
231872  80.142200 198.39.244.48 -> 41.177.26.176 TCP 70 23870 > http [ACK] Seq=1751 Ack=5232 Win=65076 Len=0 TSval=2193559683 TSecr=140349605
231889  80.146723 198.39.244.48 -> 41.177.26.176 TCP 82 27989 > http [SYN] Seq=0 Win=65535 Len=0 MSS=1380 WS=2 TSval=2193559687 TSecr=0 SACK_PERM=1
231907  80.151527 198.39.244.48 -> 41.177.26.176 TCP 70 23606 > http [ACK] Seq=2429 Ack=59111 Win=128512 Len=0 TSval=2193559692 TSecr=140349606
231908  80.152290 198.39.244.48 -> 41.177.26.176 TCP 70 27547 > http [ACK] Seq=598 Ack=419 Win=65246 Len=0 TSval=2193559693 TSecr=140349606
231929  80.158540 198.39.244.48 -> 41.177.26.15 TCP 70 27130 > http [ACK] Seq=1 Ack=1 Win=65664 Len=0 TSval=2193559699 TSecr=140349606
231972  80.172763 198.39.244.48 -> 41.177.26.176 TCP 70 21415 > http [ACK] Seq=1 Ack=1 Win=131328 Len=0 TSval=2193559714 TSecr=140349608
232011  80.198787 198.39.244.48 -> 41.177.26.176 TCP 70 23870 > http [ACK] Seq=2348 Ack=5692 Win=65076 Len=0 TSval=2193559739 TSecr=140349610
232015  80.201276 198.39.244.48 -> 41.177.26.176 TCP 70 38718 > http [ACK] Seq=1201 Ack=2382 Win=65074 Len=0 TSval=2193559741 TSecr=140349611
232018  80.201675 198.39.244.48 -> 41.177.26.176 TCP 70 27989 > http [ACK] Seq=1 Ack=1 Win=65664 Len=0 TSval=2193559742 TSecr=140349611
232029  80.204077 198.39.244.48 -> 41.177.26.176 TCP 70 62744 > http [ACK] Seq=901 Ack=674 Win=65264 Len=0 TSval=2193559744 TSecr=140349611
232030  80.204082 198.39.244.48 -> 41.177.26.176 TCP 70 62744 > http [ACK] Seq=901 Ack=679 Win=65260 Len=0 TSval=2193559744 TSecr=140349611
232031  80.204086 198.39.244.48 -> 41.177.26.176 TCP 70 62744 > http [ACK] Seq=901 Ack=1319 Win=64620 Len=0 TSval=2193559744 TSecr=140349611
232032  80.204253 198.39.244.48 -> 41.177.26.176 TCP 70 62744 > http [ACK] Seq=901 Ack=1321 Win=65534 Len=0 TSval=2193559744 TSecr=140349611
232033  80.204258 198.39.244.48 -> 41.177.26.176 TCP 70 62744 > http [ACK] Seq=901 Ack=1326 Win=65528 Len=0 TSval=2193559744 TSecr=140349611
232034  80.204262 198.39.244.48 -> 41.177.26.176 TCP 70 62744 > http [ACK] Seq=901 Ack=2694 Win=64168 Len=0 TSval=2193559744 TSecr=140349611
232038  80.204522 198.39.244.48 -> 41.177.26.176 TCP 70 62744 > http [ACK] Seq=901 Ack=3530 Win=63332 Len=0 TSval=2193559744 TSecr=140349611
232039  80.204526 198.39.244.48 -> 41.177.26.176 TCP 70 62744 > http [ACK] Seq=901 Ack=3532 Win=63330 Len=0 TSval=2193559744 TSecr=140349611
232040  80.204530 198.39.244.48 -> 41.177.26.176 TCP 70 62744 > http [ACK] Seq=901 Ack=4900 Win=64168 Len=0 TSval=2193559744 TSecr=140349611
232068  80.211413 198.39.244.48 -> 41.177.26.176 TCP 70 27547 > http [ACK] Seq=1193 Ack=875 Win=65080 Len=0 TSval=2193559751 TSecr=140349612
232070  80.212891 198.39.244.48 -> 41.177.26.176 TCP 70 23606 > http [ACK] Seq=2972 Ack=59444 Win=128180 Len=0 TSval=2193559753 TSecr=140349612
232080  80.218871 198.39.244.48 -> 41.177.26.15 TCP 70 27130 > http [ACK] Seq=589 Ack=311 Win=65354 Len=0 TSval=2193559759 TSecr=140349612
232098  80.231132 198.39.244.48 -> 41.177.26.15 TCP 70 27130 > http [ACK] Seq=589 Ack=1679 Win=64296 Len=0 TSval=2193559771 TSecr=140349614
232100  80.231376 198.39.244.48 -> 41.177.26.15 TCP 70 27130 > http [ACK] Seq=589 Ack=3047 Win=64296 Len=0 TSval=2193559771 TSecr=140349614
232104  80.231672 198.39.244.48 -> 41.177.26.176 TCP 70 21415 > http [ACK] Seq=601 Ack=397 Win=130932 Len=0 TSval=2193559771 TSecr=140349614
232156  80.257608 198.39.244.48 -> 41.177.26.176 TCP 70 38718 > http [ACK] Seq=1743 Ack=2710 Win=130744 Len=0 TSval=2193559796 TSecr=140349616
232174  80.261406 198.39.244.48 -> 41.177.26.176 TCP 70 62744 > http [ACK] Seq=901 Ack=6137 Win=64298 Len=0 TSval=2193559800 TSecr=140349616
232175  80.261410 198.39.244.48 -> 41.177.26.176 TCP 70 62744 > http [ACK] Seq=901 Ack=7496 Win=64176 Len=0 TSval=2193559800 TSecr=140349616
232176  80.261670 198.39.244.48 -> 41.177.26.176 TCP 70 62744 > http [ACK] Seq=901 Ack=8709 Win=64322 Len=0 TSval=2193559800 TSecr=140349616
232177  80.261840 198.39.244.48 -> 41.177.26.176 TCP 70 27989 > http [ACK] Seq=605 Ack=338 Win=65326 Len=0 TSval=2193559801 TSecr=140349617
232178  80.262388 198.39.244.48 -> 41.177.26.176 TCP 70 23870 > http [ACK] Seq=2888 Ack=5978 Win=65250 Len=0 TSval=2193559801 TSecr=140349617
232179  80.262393 198.39.244.48 -> 41.177.26.176 TCP 70 23870 > http [ACK] Seq=2888 Ack=7088 Win=64140 Len=0 TSval=2193559801 TSecr=140349617
232202  80.274630 198.39.244.48 -> 41.177.26.15 TCP 70 27130 > http [ACK] Seq=589 Ack=4415 Win=64296 Len=0 TSval=2193559813 TSecr=140349618
232203  80.274635 198.39.244.48 -> 41.177.26.15 TCP 70 27130 > http [ACK] Seq=589 Ack=5783 Win=64296 Len=0 TSval=2193559813 TSecr=140349618
232231  80.286453 198.39.244.48 -> 41.177.26.15 TCP 70 27130 > http [ACK] Seq=589 Ack=7151 Win=64296 Len=0 TSval=2193559824 TSecr=140349619
232235  80.286723 198.39.244.48 -> 41.177.26.15 TCP 70 27130 > http [ACK] Seq=589 Ack=8503 Win=64312 Len=0 TSval=2193559824 TSecr=140349619
232236  80.286728 198.39.244.48 -> 41.177.26.15 TCP 70 27130 > http [ACK] Seq=589 Ack=9871 Win=64296 Len=0 TSval=2193559825 TSecr=140349619
232237  80.286732 198.39.244.48 -> 41.177.26.15 TCP 70 27130 > http [ACK] Seq=589 Ack=11239 Win=64296 Len=0 TSval=2193559825 TSecr=140349619
232334  80.332674 198.39.244.48 -> 41.177.26.15 TCP 70 27130 > http [ACK] Seq=589 Ack=12607 Win=64296 Len=0 TSval=2193559869 TSecr=140349623
232335  80.332907 198.39.244.48 -> 41.177.26.15 TCP 70 27130 > http [ACK] Seq=589 Ack=13975 Win=64296 Len=0 TSval=2193559870 TSecr=140349623
232336  80.332912 198.39.244.48 -> 41.177.26.15 TCP 70 27130 > http [ACK] Seq=589 Ack=15343 Win=62928 Len=0 TSval=2193559870 TSecr=140349623
232344  80.333161 198.39.244.48 -> 41.177.26.15 TCP 70 [TCP Window Update] 27130 > http [ACK] Seq=589 Ack=15343 Win=65664 Len=0 TSval=2193559870 TSecr=140349623
232345  80.333165 198.39.244.48 -> 41.177.26.15 TCP 70 27130 > http [ACK] Seq=589 Ack=16695 Win=64312 Len=0 TSval=2193559870 TSecr=140349623
232370  80.345537 198.39.244.48 -> 41.177.26.15 TCP 70 27130 > http [ACK] Seq=589 Ack=18063 Win=64296 Len=0 TSval=2193559882 TSecr=140349625
232373  80.346070 198.39.244.48 -> 41.177.26.15 TCP 70 27130 > http [ACK] Seq=589 Ack=19431 Win=64296 Len=0 TSval=2193559883 TSecr=140349625
232376  80.346500 198.39.244.48 -> 41.177.26.15 TCP 70 27130 > http [ACK] Seq=589 Ack=20799 Win=64296 Len=0 TSval=2193559883 TSecr=140349625
232379  80.346803 198.39.244.48 -> 41.177.26.15 TCP 70 27130 > http [ACK] Seq=589 Ack=22167 Win=64296 Len=0 TSval=2193559883 TSecr=140349625
232380  80.346807 198.39.244.48 -> 41.177.26.15 TCP 70 27130 > http [ACK] Seq=589 Ack=23535 Win=64296 Len=0 TSval=2193559883 TSecr=140349625
232386  80.347561 198.39.244.48 -> 41.177.26.15 TCP 70 27130 > http [ACK] Seq=589 Ack=24887 Win=64312 Len=0 TSval=2193559884 TSecr=140349625
232387  80.347566 198.39.244.48 -> 41.177.26.15 TCP 70 27130 > http [ACK] Seq=589 Ack=26255 Win=64296 Len=0 TSval=2193559884 TSecr=140349625
232392  80.347836 198.39.244.48 -> 41.177.26.15 TCP 70 27130 > http [ACK] Seq=589 Ack=27623 Win=64296 Len=0 TSval=2193559884 TSecr=140349625
232435  80.387443 198.39.244.48 -> 41.177.26.15 TCP 70 27130 > http [ACK] Seq=589 Ack=28991 Win=64296 Len=0 TSval=2193559923 TSecr=140349629
232436  80.387688 198.39.244.48 -> 41.177.26.15 TCP 70 27130 > http [ACK] Seq=589 Ack=30359 Win=64296 Len=0 TSval=2193559923 TSecr=140349629
232437  80.387710 198.39.244.48 -> 41.177.26.15 TCP 70 27130 > http [ACK] Seq=589 Ack=31727 Win=64296 Len=0 TSval=2193559924 TSecr=140349629
232442  80.387940 198.39.244.48 -> 41.177.26.15 TCP 70 27130 > http [ACK] Seq=589 Ack=33079 Win=64312 Len=0 TSval=2193559924 TSecr=140349629
232445  80.388136 198.39.244.48 -> 41.177.26.15 TCP 70 27130 > http [ACK] Seq=589 Ack=34447 Win=64296 Len=0 TSval=2193559924 TSecr=140349629
232446  80.388141 198.39.244.48 -> 41.177.26.15 TCP 70 27130 > http [ACK] Seq=589 Ack=35815 Win=64296 Len=0 TSval=2193559924 TSecr=140349629
232452  80.388362 198.39.244.48 -> 41.177.26.15 TCP 70 27130 > http [ACK] Seq=589 Ack=37183 Win=64296 Len=0 TSval=2193559924 TSecr=140349629
232453  80.388366 198.39.244.48 -> 41.177.26.15 TCP 70 27130 > http [ACK] Seq=589 Ack=38551 Win=62928 Len=0 TSval=2193559924 TSecr=140349629
232454  80.388378 198.39.244.48 -> 41.177.26.15 TCP 70 [TCP Window Update] 27130 > http [ACK] Seq=589 Ack=38551 Win=65664 Len=0 TSval=2193559924 TSecr=140349629
232482  80.400393 198.39.244.48 -> 41.177.26.15 TCP 70 27130 > http [ACK] Seq=589 Ack=39919 Win=64296 Len=0 TSval=2193559936 TSecr=140349630
232486  80.400791 198.39.244.48 -> 41.177.26.15 TCP 70 27130 > http [ACK] Seq=589 Ack=41271 Win=64312 Len=0 TSval=2193559936 TSecr=140349630
232490  80.401009 198.39.244.48 -> 41.177.26.15 TCP 70 27130 > http [ACK] Seq=589 Ack=42639 Win=64296 Len=0 TSval=2193559936 TSecr=140349631
232491  80.401013 198.39.244.48 -> 41.177.26.15 TCP 70 27130 > http [ACK] Seq=589 Ack=44007 Win=62928 Len=0 TSval=2193559936 TSecr=140349631
232492  80.401018 198.39.244.48 -> 41.177.26.15 TCP 70 [TCP Window Update] 27130 > http [ACK] Seq=589 Ack=44007 Win=65664 Len=0 TSval=2193559936 TSecr=140349631
232498  80.401270 198.39.244.48 -> 41.177.26.15 TCP 70 27130 > http [ACK] Seq=589 Ack=45375 Win=64296 Len=0 TSval=2193559937 TSecr=140349631
232502  80.401496 198.39.244.48 -> 41.177.26.15 TCP 70 27130 > http [ACK] Seq=589 Ack=46743 Win=64296 Len=0 TSval=2193559937 TSecr=140349631
232505  80.401734 198.39.244.48 -> 41.177.26.15 TCP 70 27130 > http [ACK] Seq=589 Ack=48111 Win=64296 Len=0 TSval=2193559937 TSecr=140349631
232506  80.401739 198.39.244.48 -> 41.177.26.15 TCP 70 27130 > http [ACK] Seq=589 Ack=49463 Win=64312 Len=0 TSval=2193559937 TSecr=140349631
232510  80.401956 198.39.244.48 -> 41.177.26.15 TCP 70 27130 > http [ACK] Seq=589 Ack=50831 Win=64296 Len=0 TSval=2193559937 TSecr=140349631
232515  80.402385 198.39.244.48 -> 41.177.26.15 TCP 70 27130 > http [ACK] Seq=589 Ack=52199 Win=64296 Len=0 TSval=2193559937 TSecr=140349631
232516  80.402413 198.39.244.48 -> 41.177.26.15 TCP 70 27130 > http [ACK] Seq=589 Ack=53567 Win=64296 Len=0 TSval=2193559938 TSecr=140349631
232517  80.402418 198.39.244.48 -> 41.177.26.15 TCP 70 27130 > http [ACK] Seq=589 Ack=54935 Win=64296 Len=0 TSval=2193559938 TSecr=140349631
232521  80.402632 198.39.244.48 -> 41.177.26.15 TCP 70 27130 > http [ACK] Seq=589 Ack=56303 Win=64296 Len=0 TSval=2193559938 TSecr=140349631
232522  80.402637 198.39.244.48 -> 41.177.26.15 TCP 70 27130 > http [ACK] Seq=589 Ack=57655 Win=64312 Len=0 TSval=2193559938 TSecr=140349631
232531  80.402870 198.39.244.48 -> 41.177.26.15 TCP 70 27130 > http [ACK] Seq=589 Ack=59023 Win=64296 Len=0 TSval=2193559938 TSecr=140349631
232534  80.403123 198.39.244.48 -> 41.177.26.15 TCP 70 27130 > http [ACK] Seq=589 Ack=60391 Win=64296 Len=0 TSval=2193559938 TSecr=140349631
232608  80.446243 198.39.244.48 -> 41.177.26.15 TCP 70 27130 > http [ACK] Seq=589 Ack=61759 Win=64296 Len=0 TSval=2193559981 TSecr=140349635
232609  80.446248 198.39.244.48 -> 41.177.26.15 TCP 70 27130 > http [ACK] Seq=589 Ack=63127 Win=64296 Len=0 TSval=2193559981 TSecr=140349635
232612  80.447732 198.39.244.48 -> 41.177.26.15 TCP 70 27130 > http [ACK] Seq=589 Ack=64495 Win=64296 Len=0 TSval=2193559981 TSecr=140349635
232614  80.448427 198.39.244.48 -> 41.177.26.15 TCP 70 27130 > http [ACK] Seq=589 Ack=65847 Win=64312 Len=0 TSval=2193559982 TSecr=140349635
232615  80.448432 198.39.244.48 -> 41.177.26.15 TCP 70 27130 > http [ACK] Seq=589 Ack=67215 Win=64296 Len=0 TSval=2193559983 TSecr=140349635
232618  80.448678 198.39.244.48 -> 41.177.26.15 TCP 70 27130 > http [ACK] Seq=589 Ack=68583 Win=64296 Len=0 TSval=2193559983 TSecr=140349635
232619  80.448887 198.39.244.48 -> 41.177.26.15 TCP 70 27130 > http [ACK] Seq=589 Ack=69951 Win=64296 Len=0 TSval=2193559983 TSecr=140349635
232622  80.449156 198.39.244.48 -> 41.177.26.15 TCP 70 27130 > http [ACK] Seq=589 Ack=71319 Win=64296 Len=0 TSval=2193559983 TSecr=140349635
232623  80.449161 198.39.244.48 -> 41.177.26.15 TCP 70 27130 > http [ACK] Seq=589 Ack=72687 Win=64296 Len=0 TSval=2193559983 TSecr=140349635
232624  80.449165 198.39.244.48 -> 41.177.26.15 TCP 70 27130 > http [ACK] Seq=589 Ack=74055 Win=64296 Len=0 TSval=2193559983 TSecr=140349635
232628  80.449611 198.39.244.48 -> 41.177.26.15 TCP 70 27130 > http [ACK] Seq=589 Ack=75423 Win=64296 Len=0 TSval=2193559984 TSecr=140349635
232630  80.449854 198.39.244.48 -> 41.177.26.15 TCP 70 27130 > http [ACK] Seq=589 Ack=76775 Win=64312 Len=0 TSval=2193559984 TSecr=140349635
232631  80.449858 198.39.244.48 -> 41.177.26.15 TCP 70 27130 > http [ACK] Seq=589 Ack=78143 Win=64296 Len=0 TSval=2193559984 TSecr=140349635
232636  80.450531 198.39.244.48 -> 41.177.26.15 TCP 70 27130 > http [ACK] Seq=589 Ack=79511 Win=64296 Len=0 TSval=2193559984 TSecr=140349635
232637  80.450536 198.39.244.48 -> 41.177.26.15 TCP 70 27130 > http [ACK] Seq=589 Ack=80879 Win=64296 Len=0 TSval=2193559984 TSecr=140349635
232638  80.450540 198.39.244.48 -> 41.177.26.15 TCP 70 27130 > http [ACK] Seq=589 Ack=82247 Win=64296 Len=0 TSval=2193559985 TSecr=140349635
232667  80.459472 198.39.244.48 -> 41.177.26.15 TCP 70 27130 > http [ACK] Seq=589 Ack=83615 Win=64296 Len=0 TSval=2193559993 TSecr=140349636
232669  80.460162 198.39.244.48 -> 41.177.26.15 TCP 82 [TCP Window Update] 27130 > http [ACK] Seq=589 Ack=83615 Win=65664 Len=0 TSval=2193559994 TSecr=140349636 SLE=84967 SRE=86335
232670  80.460167 198.39.244.48 -> 41.177.26.15 TCP 82 [TCP Dup ACK 232669#1] 27130 > http [ACK] Seq=589 Ack=83615 Win=65664 Len=0 TSval=2193559994 TSecr=140349636 SLE=84967 SRE=87703
232672  80.460646 198.39.244.48 -> 41.177.26.15 TCP 82 [TCP Dup ACK 232669#2] 27130 > http [ACK] Seq=589 Ack=83615 Win=65664 Len=0 TSval=2193559995 TSecr=140349636 SLE=84967 SRE=89071
232673  80.460651 198.39.244.48 -> 41.177.26.15 TCP 82 [TCP Dup ACK 232669#3] 27130 > http [ACK] Seq=589 Ack=83615 Win=65664 Len=0 TSval=2193559995 TSecr=140349636 SLE=84967 SRE=90439
232675  80.460890 198.39.244.48 -> 41.177.26.15 TCP 82 [TCP Dup ACK 232669#4] 27130 > http [ACK] Seq=589 Ack=83615 Win=65664 Len=0 TSval=2193559995 TSecr=140349636 SLE=84967 SRE=91807
232680  80.461085 198.39.244.48 -> 41.177.26.15 TCP 82 [TCP Dup ACK 232669#5] 27130 > http [ACK] Seq=589 Ack=83615 Win=65664 Len=0 TSval=2193559995 TSecr=140349636 SLE=84967 SRE=93159
232682  80.461533 198.39.244.48 -> 41.177.26.15 TCP 82 [TCP Dup ACK 232669#6] 27130 > http [ACK] Seq=589 Ack=83615 Win=65664 Len=0 TSval=2193559995 TSecr=140349636 SLE=84967 SRE=94527
232683  80.461555 198.39.244.48 -> 41.177.26.15 TCP 82 [TCP Dup ACK 232669#7] 27130 > http [ACK] Seq=589 Ack=83615 Win=65664 Len=0 TSval=2193559995 TSecr=140349636 SLE=84967 SRE=95895
232684  80.461783 198.39.244.48 -> 41.177.26.15 TCP 82 [TCP Dup ACK 232669#8] 27130 > http [ACK] Seq=589 Ack=83615 Win=65664 Len=0 TSval=2193559996 TSecr=140349636 SLE=84967 SRE=97263
232685  80.462000 198.39.244.48 -> 41.177.26.15 TCP 82 [TCP Dup ACK 232669#9] 27130 > http [ACK] Seq=589 Ack=83615 Win=65664 Len=0 TSval=2193559996 TSecr=140349636 SLE=84967 SRE=98631
232686  80.462496 198.39.244.48 -> 41.177.26.15 TCP 82 [TCP Dup ACK 232669#10] 27130 > http [ACK] Seq=589 Ack=83615 Win=65664 Len=0 TSval=2193559996 TSecr=140349636 SLE=84967 SRE=99999
232687  80.462502 198.39.244.48 -> 41.177.26.15 TCP 82 [TCP Dup ACK 232669#11] 27130 > http [ACK] Seq=589 Ack=83615 Win=65664 Len=0 TSval=2193559996 TSecr=140349636 SLE=84967 SRE=101351
232688  80.462506 198.39.244.48 -> 41.177.26.15 TCP 82 [TCP Dup ACK 232669#12] 27130 > http [ACK] Seq=589 Ack=83615 Win=65664 Len=0 TSval=2193559996 TSecr=140349636 SLE=84967 SRE=102719
232702  80.462941 198.39.244.48 -> 41.177.26.15 TCP 82 [TCP Dup ACK 232669#13] 27130 > http [ACK] Seq=589 Ack=83615 Win=65664 Len=0 TSval=2193559997 TSecr=140349636 SLE=84967 SRE=104087
232703  80.462945 198.39.244.48 -> 41.177.26.15 TCP 82 [TCP Dup ACK 232669#14] 27130 > http [ACK] Seq=589 Ack=83615 Win=65664 Len=0 TSval=2193559997 TSecr=140349636 SLE=84967 SRE=105455
232704  80.462949 198.39.244.48 -> 41.177.26.15 TCP 82 [TCP Dup ACK 232669#15] 27130 > http [ACK] Seq=589 Ack=83615 Win=65664 Len=0 TSval=2193559997 TSecr=140349636 SLE=84967 SRE=106823
232715  80.463625 198.39.244.48 -> 41.177.26.15 TCP 82 [TCP Dup ACK 232669#16] 27130 > http [ACK] Seq=589 Ack=83615 Win=65664 Len=0 TSval=2193559997 TSecr=140349636 SLE=84967 SRE=108191
232716  80.463833 198.39.244.48 -> 41.177.26.15 TCP 82 [TCP Dup ACK 232669#17] 27130 > http [ACK] Seq=589 Ack=83615 Win=65664 Len=0 TSval=2193559997 TSecr=140349636 SLE=84967 SRE=109543
232717  80.463837 198.39.244.48 -> 41.177.26.15 TCP 82 [TCP Dup ACK 232669#18] 27130 > http [ACK] Seq=589 Ack=83615 Win=65664 Len=0 TSval=2193559998 TSecr=140349636 SLE=84967 SRE=110911
232718  80.463842 198.39.244.48 -> 41.177.26.15 TCP 82 [TCP Dup ACK 232669#19] 27130 > http [ACK] Seq=589 Ack=83615 Win=65664 Len=0 TSval=2193559998 TSecr=140349636 SLE=84967 SRE=112279
232719  80.463845 198.39.244.48 -> 41.177.26.15 TCP 82 [TCP Dup ACK 232669#20] 27130 > http [ACK] Seq=589 Ack=83615 Win=65664 Len=0 TSval=2193559998 TSecr=140349636 SLE=84967 SRE=113647
232721  80.464062 198.39.244.48 -> 41.177.26.15 TCP 82 [TCP Dup ACK 232669#21] 27130 > http [ACK] Seq=589 Ack=83615 Win=65664 Len=0 TSval=2193559998 TSecr=140349636 SLE=84967 SRE=115015
232723  80.464532 198.39.244.48 -> 41.177.26.15 TCP 82 [TCP Dup ACK 232669#22] 27130 > http [ACK] Seq=589 Ack=83615 Win=65664 Len=0 TSval=2193559998 TSecr=140349636 SLE=84967 SRE=116383
232724  80.464790 198.39.244.48 -> 41.177.26.15 TCP 90 [TCP Dup ACK 232669#23] 27130 > http [ACK] Seq=589 Ack=83615 Win=65664 Len=0 TSval=2193559998 TSecr=140349636 SLE=117735 SRE=119103 SLE=84967 SRE=116383
232725  80.464827 198.39.244.48 -> 41.177.26.15 TCP 90 [TCP Dup ACK 232669#24] 27130 > http [ACK] Seq=589 Ack=83615 Win=65664 Len=0 TSval=2193559999 TSecr=140349636 SLE=117735 SRE=120471 SLE=84967 SRE=116383
232726  80.465073 198.39.244.48 -> 41.177.26.15 TCP 90 [TCP Dup ACK 232669#25] 27130 > http [ACK] Seq=589 Ack=83615 Win=65664 Len=0 TSval=2193559999 TSecr=140349636 SLE=117735 SRE=121839 SLE=84967 SRE=116383
232728  80.465369 198.39.244.48 -> 41.177.26.15 TCP 98 64105 > emwavemsg [ACK] Seq=1 Ack=1 Win=16512 Len=40[Packet size limited during capture]
232798  80.501110 198.39.244.48 -> 41.177.26.15 TCP 98 [TCP Retransmission] 64105 > emwavemsg [ACK] Seq=1 Ack=1 Win=16512 Len=40[Packet size limited during capture]
232799  80.501113 198.39.244.48 -> 41.177.26.15 TCP 98 [TCP Retransmission] 64105 > emwavemsg [ACK] Seq=1 Ack=1 Win=16512 Len=40[Packet size limited during capture]
232842  80.505991 198.39.244.48 -> 41.177.26.15 TCP 98 [TCP Retransmission] 64105 > emwavemsg [ACK] Seq=1 Ack=1 Win=16512 Len=40[Packet size limited during capture]
232847  80.506775 198.39.244.48 -> 41.177.26.15 TCP 98 [TCP Retransmission] 64105 > emwavemsg [ACK] Seq=1 Ack=1 Win=16512 Len=40[Packet size limited during capture]
232848  80.507004 198.39.244.48 -> 41.177.26.15 TCP 98 [TCP Retransmission] 64105 > emwavemsg [ACK] Seq=1 Ack=1 Win=16512 Len=40[Packet size limited during capture]
232849  80.507009 198.39.244.48 -> 41.177.26.15 TCP 98 [TCP Retransmission] 64105 > emwavemsg [ACK] Seq=1 Ack=1 Win=16512 Len=40[Packet size limited during capture]
232850  80.507013 198.39.244.48 -> 41.177.26.15 TCP 98 [TCP Retransmission] 64105 > emwavemsg [ACK] Seq=1 Ack=1 Win=16512 Len=40[Packet size limited during capture]
232853  80.507721 198.39.244.48 -> 41.177.26.15 TCP 98 [TCP Retransmission] 64105 > emwavemsg [ACK] Seq=1 Ack=1 Win=16512 Len=40[Packet size limited during capture]
232854  80.507725 198.39.244.48 -> 41.177.26.15 TCP 98 [TCP Retransmission] 64105 > emwavemsg [ACK] Seq=1 Ack=1 Win=16512 Len=40[Packet size limited during capture]
232855  80.507729 198.39.244.48 -> 41.177.26.15 TCP 98 [TCP Retransmission] 64105 > emwavemsg [ACK] Seq=1 Ack=1 Win=16512 Len=40[Packet size limited during capture]
232857  80.507965 198.39.244.48 -> 41.177.26.15 TCP 98 [TCP Retransmission] 64105 > emwavemsg [ACK] Seq=1 Ack=1 Win=16512 Len=40[Packet size limited during capture]
232858  80.508627 198.39.244.48 -> 41.177.26.15 TCP 98 [TCP Retransmission] 64105 > emwavemsg [ACK] Seq=1 Ack=1 Win=16512 Len=40[Packet size limited during capture]
232859  80.508632 198.39.244.48 -> 41.177.26.15 TCP 98 [TCP Retransmission] 64105 > emwavemsg [ACK] Seq=1 Ack=1 Win=16512 Len=40[Packet size limited during capture]
232860  80.508914 198.39.244.48 -> 41.177.26.15 TCP 98 [TCP Retransmission] 64105 > emwavemsg [ACK] Seq=1 Ack=1 Win=16512 Len=40[Packet size limited during capture]
232861  80.508943 198.39.244.48 -> 41.177.26.15 TCP 98 [TCP Retransmission] 64105 > emwavemsg [ACK] Seq=1 Ack=1 Win=16512 Len=40[Packet size limited during capture]
232862  80.508948 198.39.244.48 -> 41.177.26.15 TCP 98 [TCP Retransmission] 64105 > emwavemsg [ACK] Seq=1 Ack=1 Win=16512 Len=40[Packet size limited during capture]
232887  80.514583 198.39.244.48 -> 41.177.26.15 TCP 98 [TCP Retransmission] 64105 > emwavemsg [ACK] Seq=1 Ack=1 Win=16512 Len=40[Packet size limited during capture]
232895  80.515041 198.39.244.48 -> 41.177.26.15 TCP 98 [TCP Retransmission] 64105 > emwavemsg [ACK] Seq=1 Ack=1 Win=16512 Len=40[Packet size limited during capture]
232896  80.515479 198.39.244.48 -> 41.177.26.15 TCP 90 27130 > http [ACK] Seq=589 Ack=116383 Win=32896 Len=0 TSval=2193560048 TSecr=140349642 SLE=123207 SRE=149151 SLE=117735 SRE=121839
232897  80.515484 198.39.244.48 -> 41.177.26.15 TCP 90 [TCP Window Update] 27130 > http [ACK] Seq=589 Ack=116383 Win=47486 Len=0 TSval=2193560048 TSecr=140349642 SLE=123207 SRE=149151 SLE=117735 SRE=121839
232898  80.515489 198.39.244.48 -> 41.177.26.15 TCP 90 [TCP Window Update] 27130 > http [ACK] Seq=589 Ack=116383 Win=63870 Len=0 TSval=2193560048 TSecr=140349642 SLE=123207 SRE=149151 SLE=117735 SRE=121839
232914  80.520331 198.39.244.48 -> 41.177.26.15 TCP 82 27130 > http [ACK] Seq=589 Ack=121839 Win=60208 Len=0 TSval=2193560053 TSecr=140349642 SLE=123207 SRE=149151
232915  80.520335 198.39.244.48 -> 41.177.26.15 TCP 82 [TCP Window Update] 27130 > http [ACK] Seq=589 Ack=121839 Win=65664 Len=0 TSval=2193560053 TSecr=140349642 SLE=123207 SRE=149151
233053  80.555855 198.39.244.48 -> 41.177.26.15 TCP 70 27130 > http [ACK] Seq=589 Ack=149151 Win=38352 Len=0 TSval=2193560087 TSecr=140349646
233054  80.555860 198.39.244.48 -> 41.177.26.15 TCP 70 [TCP Window Update] 27130 > http [ACK] Seq=589 Ack=149151 Win=47486 Len=0 TSval=2193560088 TSecr=140349646
233055  80.555864 198.39.244.48 -> 41.177.26.15 TCP 70 [TCP Window Update] 27130 > http [ACK] Seq=589 Ack=149151 Win=63870 Len=0 TSval=2193560088 TSecr=140349646
233105  80.570265 198.39.244.48 -> 41.177.26.15 TCP 70 27130 > http [ACK] Seq=589 Ack=150519 Win=64296 Len=0 TSval=2193560102 TSecr=140349647
233110  80.570737 198.39.244.48 -> 41.177.26.15 TCP 70 27130 > http [ACK] Seq=589 Ack=151887 Win=64296 Len=0 TSval=2193560102 TSecr=140349647
233111  80.570742 198.39.244.48 -> 41.177.26.15 TCP 70 27130 > http [ACK] Seq=589 Ack=153255 Win=64296 Len=0 TSval=2193560102 TSecr=140349647
233112  80.570746 198.39.244.48 -> 41.177.26.15 TCP 70 27130 > http [ACK] Seq=589 Ack=154623 Win=64296 Len=0 TSval=2193560102 TSecr=140349647
233113  80.570964 198.39.244.48 -> 41.177.26.15 TCP 70 27130 > http [ACK] Seq=589 Ack=155975 Win=64312 Len=0 TSval=2193560102 TSecr=140349647
233115  80.571484 198.39.244.48 -> 41.177.26.15 TCP 70 27130 > http [ACK] Seq=589 Ack=157343 Win=64296 Len=0 TSval=2193560102 TSecr=140349647
233125  80.575268 198.39.244.48 -> 41.177.26.15 TCP 70 27130 > http [ACK] Seq=589 Ack=158711 Win=64296 Len=0 TSval=2193560106 TSecr=140349648
233126  80.575273 198.39.244.48 -> 41.177.26.15 TCP 70 27130 > http [ACK] Seq=589 Ack=160079 Win=62928 Len=0 TSval=2193560106 TSecr=140349648
233127  80.575311 198.39.244.48 -> 41.177.26.15 TCP 70 [TCP Window Update] 27130 > http [ACK] Seq=589 Ack=160079 Win=65664 Len=0 TSval=2193560106 TSecr=140349648
233128  80.575315 198.39.244.48 -> 41.177.26.15 TCP 70 27130 > http [ACK] Seq=589 Ack=161447 Win=64296 Len=0 TSval=2193560107 TSecr=140349648
233129  80.575643 198.39.244.48 -> 41.177.26.15 TCP 70 27130 > http [ACK] Seq=589 Ack=162815 Win=64296 Len=0 TSval=2193560107 TSecr=140349648
233130  80.575648 198.39.244.48 -> 41.177.26.15 TCP 70 27130 > http [ACK] Seq=589 Ack=164167 Win=64312 Len=0 TSval=2193560107 TSecr=140349648
233131  80.575652 198.39.244.48 -> 41.177.26.15 TCP 70 27130 > http [ACK] Seq=589 Ack=165535 Win=64296 Len=0 TSval=2193560107 TSecr=140349648
233195  80.610682 198.39.244.48 -> 41.177.26.15 TCP 70 27130 > http [ACK] Seq=589 Ack=166903 Win=64296 Len=0 TSval=2193560141 TSecr=140349651
233196  80.611219 198.39.244.48 -> 41.177.26.15 TCP 70 27130 > http [ACK] Seq=589 Ack=168271 Win=64296 Len=0 TSval=2193560141 TSecr=140349651
233197  80.611223 198.39.244.48 -> 41.177.26.15 TCP 70 27130 > http [ACK] Seq=589 Ack=169639 Win=64296 Len=0 TSval=2193560141 TSecr=140349651
233198  80.611228 198.39.244.48 -> 41.177.26.15 TCP 70 27130 > http [ACK] Seq=589 Ack=171007 Win=64296 Len=0 TSval=2193560141 TSecr=140349651
233200  80.611513 198.39.244.48 -> 41.177.26.15 TCP 70 27130 > http [ACK] Seq=589 Ack=172359 Win=64312 Len=0 TSval=2193560142 TSecr=140349651
233201  80.611518 198.39.244.48 -> 41.177.26.15 TCP 70 27130 > http [ACK] Seq=589 Ack=173727 Win=64296 Len=0 TSval=2193560142 TSecr=140349651
233203  80.611744 198.39.244.48 -> 41.177.26.15 TCP 70 27130 > http [ACK] Seq=589 Ack=175095 Win=64296 Len=0 TSval=2193560142 TSecr=140349651
233204  80.611749 198.39.244.48 -> 41.177.26.15 TCP 70 27130 > http [ACK] Seq=589 Ack=176463 Win=64296 Len=0 TSval=2193560142 TSecr=140349651
233205  80.611753 198.39.244.48 -> 41.177.26.15 TCP 70 27130 > http [ACK] Seq=589 Ack=177831 Win=64296 Len=0 TSval=2193560142 TSecr=140349651
233206  80.611757 198.39.244.48 -> 41.177.26.15 TCP 70 27130 > http [ACK] Seq=589 Ack=179199 Win=64296 Len=0 TSval=2193560142 TSecr=140349651
233207  80.611981 198.39.244.48 -> 41.177.26.15 TCP 70 27130 > http [ACK] Seq=589 Ack=180551 Win=64312 Len=0 TSval=2193560142 TSecr=140349651
233208  80.612418 198.39.244.48 -> 41.177.26.15 TCP 70 27130 > http [ACK] Seq=589 Ack=181919 Win=64296 Len=0 TSval=2193560142 TSecr=140349651
233209  80.612423 198.39.244.48 -> 41.177.26.15 TCP 70 27130 > http [ACK] Seq=589 Ack=183287 Win=64296 Len=0 TSval=2193560143 TSecr=140349651
233212  80.624981 198.39.244.48 -> 41.177.26.15 TCP 70 27130 > http [ACK] Seq=589 Ack=184457 Win=64494 Len=0 TSval=2193560155 TSecr=140349653
233316  80.697665 198.39.244.48 -> 41.177.26.176 TCP 70 23870 > http [ACK] Seq=3337 Ack=7359 Win=65264 Len=0 TSval=2193560227 TSecr=140349660
233317  80.697670 198.39.244.48 -> 41.177.26.176 TCP 70 23870 > http [ACK] Seq=3337 Ack=7364 Win=65260 Len=0 TSval=2193560227 TSecr=140349660
233318  80.697853 198.39.244.48 -> 41.177.26.176 TCP 70 23870 > http [ACK] Seq=3337 Ack=8004 Win=64896 Len=0 TSval=2193560227 TSecr=140349660
233319  80.697858 198.39.244.48 -> 41.177.26.176 TCP 70 23870 > http [ACK] Seq=3337 Ack=8011 Win=64888 Len=0 TSval=2193560227 TSecr=140349660
233320  80.697861 198.39.244.48 -> 41.177.26.176 TCP 70 23870 > http [ACK] Seq=3337 Ack=8006 Win=64894 Len=0 TSval=2193560227 TSecr=140349660
233321  80.698360 198.39.244.48 -> 41.177.26.176 TCP 70 23870 > http [ACK] Seq=3337 Ack=9379 Win=64168 Len=0 TSval=2193560227 TSecr=140349660
233322  80.698365 198.39.244.48 -> 41.177.26.176 TCP 70 23870 > http [ACK] Seq=3337 Ack=10215 Win=63332 Len=0 TSval=2193560228 TSecr=140349660
233323  80.698369 198.39.244.48 -> 41.177.26.176 TCP 70 23870 > http [ACK] Seq=3337 Ack=10217 Win=63330 Len=0 TSval=2193560228 TSecr=140349660
233324  80.699254 198.39.244.48 -> 41.177.26.176 TCP 70 23870 > http [ACK] Seq=3337 Ack=11585 Win=64168 Len=0 TSval=2193560228 TSecr=140349660
233325  80.699259 198.39.244.48 -> 41.177.26.176 TCP 70 23870 > http [ACK] Seq=3337 Ack=12805 Win=64316 Len=0 TSval=2193560228 TSecr=140349660
233326  80.699264 198.39.244.48 -> 41.177.26.176 TCP 82 [TCP Dup ACK 233325#1] 23870 > http [ACK] Seq=3337 Ack=12805 Win=64316 Len=0 TSval=2193560228 TSecr=140349660 SLE=12830 SRE=12832
233327  80.699268 198.39.244.48 -> 41.177.26.176 TCP 70 23870 > http [ACK] Seq=3337 Ack=12849 Win=64272 Len=0 TSval=2193560228 TSecr=140349660
233328  80.699271 198.39.244.48 -> 41.177.26.176 TCP 70 23870 > http [ACK] Seq=3337 Ack=12837 Win=64284 Len=0 TSval=2193560228 TSecr=140349660
233329  80.699276 198.39.244.48 -> 41.177.26.176 TCP 82 23870 > http [ACK] Seq=3337 Ack=12805 Win=64316 Len=0 TSval=2193560228 TSecr=140349660 SLE=12830 SRE=12837
233330  80.699280 198.39.244.48 -> 41.177.26.176 TCP 70 23870 > http [ACK] Seq=3337 Ack=13601 Win=63520 Len=0 TSval=2193560228 TSecr=140349660
233331  80.699284 198.39.244.48 -> 41.177.26.176 TCP 82 [TCP Dup ACK 233330#1] 23870 > http [ACK] Seq=3337 Ack=13601 Win=63520 Len=0 TSval=2193560228 TSecr=140349660 SLE=13603 SRE=13608
233332  80.699299 198.39.244.48 -> 41.177.26.176 TCP 70 23870 > http [ACK] Seq=3337 Ack=13608 Win=63512 Len=0 TSval=2193560228 TSecr=140349660
233333  80.699304 198.39.244.48 -> 41.177.26.176 TCP 70 23870 > http [ACK] Seq=3337 Ack=14202 Win=64942 Len=0 TSval=2193560228 TSecr=140349660
233334  80.699308 198.39.244.48 -> 41.177.26.176 TCP 82 [TCP Dup ACK 233333#1] 23870 > http [ACK] Seq=3337 Ack=14202 Win=64942 Len=0 TSval=2193560228 TSecr=140349660 SLE=14204 SRE=14208
233335  80.699312 198.39.244.48 -> 41.177.26.176 TCP 70 23870 > http [ACK] Seq=3337 Ack=14253 Win=65484 Len=0 TSval=2193560228 TSecr=140349660
233336  80.699327 198.39.244.48 -> 41.177.26.176 TCP 82 23870 > http [ACK] Seq=3337 Ack=14202 Win=65536 Len=0 TSval=2193560228 TSecr=140349660 SLE=14204 SRE=14253
233337  80.699545 198.39.244.48 -> 41.177.26.176 TCP 70 23870 > http [ACK] Seq=3337 Ack=14255 Win=65482 Len=0 TSval=2193560228 TSecr=140349660
233338  80.699550 198.39.244.48 -> 41.177.26.176 TCP 70 23870 > http [ACK] Seq=3337 Ack=14260 Win=65478 Len=0 TSval=2193560228 TSecr=140349660
233339  80.699746 198.39.244.48 -> 41.177.26.176 TCP 70 23870 > http [ACK] Seq=3337 Ack=15207 Win=64588 Len=0 TSval=2193560228 TSecr=140349660
233340  80.699750 198.39.244.48 -> 41.177.26.176 TCP 70 23870 > http [ACK] Seq=3337 Ack=15421 Win=65322 Len=0 TSval=2193560228 TSecr=140349660
233341  80.699754 198.39.244.48 -> 41.177.26.176 TCP 82 23870 > http [ACK] Seq=3337 Ack=15207 Win=64588 Len=0 TSval=2193560228 TSecr=140349660 SLE=15209 SRE=15421
284322  95.210514 198.39.244.48 -> 41.177.26.176 TCP 70 62744 > http [ACK] Seq=901 Ack=8710 Win=65536 Len=0 TSval=2193574441 TSecr=140351112
284323  95.210750 198.39.244.48 -> 41.177.26.176 TCP 70 62744 > http [FIN, ACK] Seq=901 Ack=8710 Win=65536 Len=0 TSval=2193574441 TSecr=140351112
284381  95.226302 198.39.244.48 -> 41.177.26.176 TCP 70 23606 > http [ACK] Seq=2972 Ack=59445 Win=128180 Len=0 TSval=2193574456 TSecr=140351113
284382  95.226307 198.39.244.48 -> 41.177.26.176 TCP 70 23606 > http [FIN, ACK] Seq=2972 Ack=59445 Win=128180 Len=0 TSval=2193574456 TSecr=140351113
284383  95.226311 198.39.244.48 -> 41.177.26.176 TCP 70 27547 > http [ACK] Seq=1193 Ack=876 Win=65536 Len=0 TSval=2193574456 TSecr=140351113
284387  95.226555 198.39.244.48 -> 41.177.26.176 TCP 70 27547 > http [FIN, ACK] Seq=1193 Ack=876 Win=65536 Len=0 TSval=2193574456 TSecr=140351113
284475  95.240607 198.39.244.48 -> 41.177.26.176 TCP 70 21415 > http [ACK] Seq=601 Ack=398 Win=131328 Len=0 TSval=2193574470 TSecr=140351115
284476  95.240611 198.39.244.48 -> 41.177.26.176 TCP 70 21415 > http [FIN, ACK] Seq=601 Ack=398 Win=131328 Len=0 TSval=2193574470 TSecr=140351115
284642  95.261020 198.39.244.48 -> 41.177.26.176 TCP 70 38718 > http [ACK] Seq=1743 Ack=2711 Win=131070 Len=0 TSval=2193574490 TSecr=140351117
284643  95.261025 198.39.244.48 -> 41.177.26.176 TCP 70 38718 > http [FIN, ACK] Seq=1743 Ack=2711 Win=131070 Len=0 TSval=2193574490 TSecr=140351117
284717  95.271903 198.39.244.48 -> 41.177.26.176 TCP 70 27989 > http [ACK] Seq=605 Ack=339 Win=65664 Len=0 TSval=2193574501 TSecr=140351118
284722  95.272181 198.39.244.48 -> 41.177.26.176 TCP 70 27989 > http [FIN, ACK] Seq=605 Ack=339 Win=65664 Len=0 TSval=2193574501 TSecr=140351118
285618  95.510596 198.39.244.48 -> 41.177.26.15 TCP 70 27130 > http [ACK] Seq=589 Ack=184458 Win=65664 Len=0 TSval=2193574735 TSecr=140351142
285619  95.510799 198.39.244.48 -> 41.177.26.15 TCP 70 27130 > http [FIN, ACK] Seq=589 Ack=184458 Win=65664 Len=0 TSval=2193574735 TSecr=140351142
286257  95.701771 198.39.244.48 -> 41.177.26.176 TCP 70 23870 > http [ACK] Seq=3337 Ack=15422 Win=65536 Len=0 TSval=2193574921 TSecr=140351161
286258  95.701776 198.39.244.48 -> 41.177.26.176 TCP 70 23870 > http [FIN, ACK] Seq=3337 Ack=15422 Win=65536 Len=0 TSval=2193574921 TSecr=140351161
294794  99.372219 198.39.244.48 -> 41.177.26.176 TCP 82 44956 > http [SYN] Seq=0 Win=65535 Len=0 MSS=1380 WS=2 TSval=2193578514 TSecr=0 SACK_PERM=1
294940  99.430141 198.39.244.48 -> 41.177.26.176 TCP 70 44956 > http [ACK] Seq=1 Ack=1 Win=65664 Len=0 TSval=2193578571 TSecr=140351533
297685 100.410711 198.39.244.48 -> 41.177.26.176 TCP 70 44956 > http [ACK] Seq=684 Ack=1369 Win=64296 Len=0 TSval=2193579531 TSecr=140351632
297686 100.410716 198.39.244.48 -> 41.177.26.176 TCP 70 44956 > http [ACK] Seq=684 Ack=1471 Win=64194 Len=0 TSval=2193579531 TSecr=140351632
297726 100.420882 198.39.244.48 -> 41.177.26.176 TCP 70 44956 > http [ACK] Seq=684 Ack=2124 Win=65010 Len=0 TSval=2193579541 TSecr=140351633
297730 100.421334 198.39.244.48 -> 41.177.26.176 TCP 70 44956 > http [ACK] Seq=684 Ack=2351 Win=65436 Len=0 TSval=2193579541 TSecr=140351633
297731 100.421339 198.39.244.48 -> 41.177.26.176 TCP 70 44956 > http [ACK] Seq=684 Ack=2578 Win=65210 Len=0 TSval=2193579541 TSecr=140351633
297732 100.421343 198.39.244.48 -> 41.177.26.176 TCP 70 44956 > http [ACK] Seq=684 Ack=2669 Win=65118 Len=0 TSval=2193579541 TSecr=140351633
297733 100.421346 198.39.244.48 -> 41.177.26.176 TCP 70 44956 > http [ACK] Seq=684 Ack=2899 Win=65434 Len=0 TSval=2193579541 TSecr=140351633
297734 100.421351 198.39.244.48 -> 41.177.26.176 TCP 70 44956 > http [ACK] Seq=684 Ack=3616 Win=64716 Len=0 TSval=2193579542 TSecr=140351633
297735 100.421828 198.39.244.48 -> 41.177.26.176 TCP 70 44956 > http [ACK] Seq=684 Ack=4984 Win=64296 Len=0 TSval=2193579542 TSecr=140351633
297992 100.466593 198.39.244.48 -> 41.177.26.176 TCP 70 44956 > http [ACK] Seq=684 Ack=6164 Win=64484 Len=0 TSval=2193579585 TSecr=140351637
297993 100.466598 198.39.244.48 -> 41.177.26.176 TCP 70 44956 > http [ACK] Seq=684 Ack=7532 Win=63116 Len=0 TSval=2193579585 TSecr=140351637
297994 100.466603 198.39.244.48 -> 41.177.26.176 TCP 70 44956 > http [ACK] Seq=684 Ack=8900 Win=64296 Len=0 TSval=2193579586 TSecr=140351637
298007 100.475922 198.39.244.48 -> 41.177.26.176 TCP 70 44956 > http [ACK] Seq=684 Ack=10197 Win=64366 Len=0 TSval=2193579595 TSecr=140351638
298617 100.664704 198.39.244.48 -> 41.177.26.15 TCP 82 61081 > http [SYN] Seq=0 Win=65535 Len=0 MSS=1380 WS=2 TSval=2193579779 TSecr=0 SACK_PERM=1
298779 100.719969 198.39.244.48 -> 41.177.26.15 TCP 70 61081 > http [ACK] Seq=1 Ack=1 Win=65664 Len=0 TSval=2193579834 TSecr=140351662
298787 100.723579 198.39.244.48 -> 41.177.26.176 TCP 70 44956 > http [ACK] Seq=1310 Ack=10684 Win=65048 Len=0 TSval=2193579837 TSecr=140351663
298873 100.779973 198.39.244.48 -> 41.177.26.15 TCP 70 61081 > http [ACK] Seq=612 Ack=311 Win=65354 Len=0 TSval=2193579892 TSecr=140351668
298949 100.795085 198.39.244.48 -> 41.177.26.15 TCP 70 61081 > http [ACK] Seq=612 Ack=1679 Win=64296 Len=0 TSval=2193579907 TSecr=140351670
298950 100.795090 198.39.244.48 -> 41.177.26.15 TCP 70 61081 > http [ACK] Seq=612 Ack=3047 Win=62928 Len=0 TSval=2193579908 TSecr=140351670
298954 100.795376 198.39.244.48 -> 41.177.26.15 TCP 70 [TCP Window Update] 61081 > http [ACK] Seq=612 Ack=3047 Win=65664 Len=0 TSval=2193579908 TSecr=140351670
299110 100.834925 198.39.244.48 -> 41.177.26.15 TCP 70 61081 > http [ACK] Seq=612 Ack=4415 Win=64296 Len=0 TSval=2193579947 TSecr=140351674
299111 100.834930 198.39.244.48 -> 41.177.26.15 TCP 70 61081 > http [ACK] Seq=612 Ack=5783 Win=64296 Len=0 TSval=2193579947 TSecr=140351674
299127 100.850271 198.39.244.48 -> 41.177.26.15 TCP 70 61081 > http [ACK] Seq=612 Ack=7151 Win=64296 Len=0 TSval=2193579962 TSecr=140351675
299128 100.850276 198.39.244.48 -> 41.177.26.15 TCP 70 61081 > http [ACK] Seq=612 Ack=8503 Win=64312 Len=0 TSval=2193579962 TSecr=140351675
299129 100.850280 198.39.244.48 -> 41.177.26.15 TCP 70 61081 > http [ACK] Seq=612 Ack=9871 Win=64296 Len=0 TSval=2193579962 TSecr=140351675
299132 100.850514 198.39.244.48 -> 41.177.26.15 TCP 70 61081 > http [ACK] Seq=612 Ack=11239 Win=64296 Len=0 TSval=2193579962 TSecr=140351675
299218 100.890958 198.39.244.48 -> 41.177.26.15 TCP 70 61081 > http [ACK] Seq=612 Ack=12607 Win=64296 Len=0 TSval=2193580002 TSecr=140351679
299219 100.890978 198.39.244.48 -> 41.177.26.15 TCP 70 61081 > http [ACK] Seq=612 Ack=13975 Win=64296 Len=0 TSval=2193580002 TSecr=140351679
299220 100.891033 198.39.244.48 -> 41.177.26.15 TCP 70 61081 > http [ACK] Seq=612 Ack=15343 Win=64296 Len=0 TSval=2193580002 TSecr=140351679
299227 100.891791 198.39.244.48 -> 41.177.26.15 TCP 70 61081 > http [ACK] Seq=612 Ack=16695 Win=64312 Len=0 TSval=2193580003 TSecr=140351679
299251 100.906616 198.39.244.48 -> 41.177.26.15 TCP 70 61081 > http [ACK] Seq=612 Ack=18063 Win=64296 Len=0 TSval=2193580016 TSecr=140351681
299255 100.906868 198.39.244.48 -> 41.177.26.15 TCP 70 61081 > http [ACK] Seq=612 Ack=19431 Win=64296 Len=0 TSval=2193580016 TSecr=140351681
299256 100.906872 198.39.244.48 -> 41.177.26.15 TCP 70 61081 > http [ACK] Seq=612 Ack=20799 Win=64296 Len=0 TSval=2193580016 TSecr=140351681
299260 100.907058 198.39.244.48 -> 41.177.26.15 TCP 70 61081 > http [ACK] Seq=612 Ack=22167 Win=64296 Len=0 TSval=2193580016 TSecr=140351681
299269 100.907309 198.39.244.48 -> 41.177.26.15 TCP 70 61081 > http [ACK] Seq=612 Ack=23535 Win=64296 Len=0 TSval=2193580017 TSecr=140351681
299272 100.907727 198.39.244.48 -> 41.177.26.15 TCP 70 61081 > http [ACK] Seq=612 Ack=24887 Win=64312 Len=0 TSval=2193580017 TSecr=140351681
299275 100.907929 198.39.244.48 -> 41.177.26.15 TCP 70 61081 > http [ACK] Seq=612 Ack=26255 Win=64296 Len=0 TSval=2193580017 TSecr=140351681
299276 100.907951 198.39.244.48 -> 41.177.26.15 TCP 70 61081 > http [ACK] Seq=612 Ack=27623 Win=64296 Len=0 TSval=2193580017 TSecr=140351681
299364 100.946301 198.39.244.48 -> 41.177.26.15 TCP 70 61081 > http [ACK] Seq=612 Ack=28991 Win=64296 Len=0 TSval=2193580056 TSecr=140351685
299365 100.946306 198.39.244.48 -> 41.177.26.15 TCP 70 61081 > http [ACK] Seq=612 Ack=30359 Win=62928 Len=0 TSval=2193580056 TSecr=140351685
299366 100.946330 198.39.244.48 -> 41.177.26.15 TCP 70 [TCP Window Update] 61081 > http [ACK] Seq=612 Ack=30359 Win=65664 Len=0 TSval=2193580056 TSecr=140351685
299367 100.946334 198.39.244.48 -> 41.177.26.15 TCP 70 61081 > http [ACK] Seq=612 Ack=31727 Win=64296 Len=0 TSval=2193580056 TSecr=140351685
299369 100.946548 198.39.244.48 -> 41.177.26.15 TCP 70 61081 > http [ACK] Seq=612 Ack=33079 Win=64312 Len=0 TSval=2193580056 TSecr=140351685
299370 100.946553 198.39.244.48 -> 41.177.26.15 TCP 70 61081 > http [ACK] Seq=612 Ack=34447 Win=64296 Len=0 TSval=2193580057 TSecr=140351685
299371 100.946557 198.39.244.48 -> 41.177.26.15 TCP 70 61081 > http [ACK] Seq=612 Ack=35815 Win=64296 Len=0 TSval=2193580057 TSecr=140351685
299384 100.947097 198.39.244.48 -> 41.177.26.15 TCP 70 61081 > http [ACK] Seq=612 Ack=37183 Win=64296 Len=0 TSval=2193580057 TSecr=140351685
299385 100.947101 198.39.244.48 -> 41.177.26.15 TCP 70 61081 > http [ACK] Seq=612 Ack=38551 Win=64296 Len=0 TSval=2193580057 TSecr=140351685
299435 100.965047 198.39.244.48 -> 41.177.26.15 TCP 70 61081 > http [ACK] Seq=612 Ack=39919 Win=64296 Len=0 TSval=2193580075 TSecr=140351687
299436 100.965052 198.39.244.48 -> 41.177.26.15 TCP 70 61081 > http [ACK] Seq=612 Ack=41271 Win=64312 Len=0 TSval=2193580075 TSecr=140351687
299437 100.965056 198.39.244.48 -> 41.177.26.15 TCP 70 61081 > http [ACK] Seq=612 Ack=42639 Win=64296 Len=0 TSval=2193580075 TSecr=140351687
299441 100.965270 198.39.244.48 -> 41.177.26.15 TCP 70 61081 > http [ACK] Seq=612 Ack=44007 Win=64296 Len=0 TSval=2193580075 TSecr=140351687
299448 100.965463 198.39.244.48 -> 41.177.26.15 TCP 70 61081 > http [ACK] Seq=612 Ack=45375 Win=64296 Len=0 TSval=2193580075 TSecr=140351687
299449 100.965467 198.39.244.48 -> 41.177.26.15 TCP 70 61081 > http [ACK] Seq=612 Ack=46743 Win=62928 Len=0 TSval=2193580075 TSecr=140351687
299450 100.965471 198.39.244.48 -> 41.177.26.15 TCP 70 [TCP Window Update] 61081 > http [ACK] Seq=612 Ack=46743 Win=65664 Len=0 TSval=2193580075 TSecr=140351687
299458 100.965715 198.39.244.48 -> 41.177.26.15 TCP 70 61081 > http [ACK] Seq=612 Ack=48111 Win=64296 Len=0 TSval=2193580075 TSecr=140351687
299459 100.965720 198.39.244.48 -> 41.177.26.15 TCP 70 61081 > http [ACK] Seq=612 Ack=49463 Win=64312 Len=0 TSval=2193580075 TSecr=140351687
299464 100.966169 198.39.244.48 -> 41.177.26.15 TCP 70 61081 > http [ACK] Seq=612 Ack=50831 Win=64296 Len=0 TSval=2193580076 TSecr=140351687
299465 100.966248 198.39.244.48 -> 41.177.26.15 TCP 70 61081 > http [ACK] Seq=612 Ack=52199 Win=64296 Len=0 TSval=2193580076 TSecr=140351687
299470 100.966533 198.39.244.48 -> 41.177.26.15 TCP 70 61081 > http [ACK] Seq=612 Ack=53567 Win=64296 Len=0 TSval=2193580076 TSecr=140351687
299473 100.966960 198.39.244.48 -> 41.177.26.15 TCP 70 61081 > http [ACK] Seq=612 Ack=54935 Win=64296 Len=0 TSval=2193580076 TSecr=140351687
299476 100.967222 198.39.244.48 -> 41.177.26.15 TCP 70 61081 > http [ACK] Seq=612 Ack=56303 Win=64296 Len=0 TSval=2193580077 TSecr=140351687
299477 100.967227 198.39.244.48 -> 41.177.26.15 TCP 70 61081 > http [ACK] Seq=612 Ack=57655 Win=62944 Len=0 TSval=2193580077 TSecr=140351687
299478 100.967231 198.39.244.48 -> 41.177.26.15 TCP 70 61081 > http [ACK] Seq=612 Ack=59023 Win=64296 Len=0 TSval=2193580077 TSecr=140351687
299480 100.967412 198.39.244.48 -> 41.177.26.15 TCP 70 61081 > http [ACK] Seq=612 Ack=60391 Win=64296 Len=0 TSval=2193580077 TSecr=140351687
299522 101.001602 198.39.244.48 -> 41.177.26.15 TCP 70 61081 > http [ACK] Seq=612 Ack=61759 Win=64296 Len=0 TSval=2193580110 TSecr=140351691
299523 101.001607 198.39.244.48 -> 41.177.26.15 TCP 70 61081 > http [ACK] Seq=612 Ack=63127 Win=64296 Len=0 TSval=2193580111 TSecr=140351691
299524 101.001805 198.39.244.48 -> 41.177.26.15 TCP 70 61081 > http [ACK] Seq=612 Ack=64495 Win=64296 Len=0 TSval=2193580111 TSecr=140351691
299526 101.002097 198.39.244.48 -> 41.177.26.15 TCP 70 61081 > http [ACK] Seq=612 Ack=65847 Win=64312 Len=0 TSval=2193580111 TSecr=140351691
299529 101.002296 198.39.244.48 -> 41.177.26.15 TCP 70 61081 > http [ACK] Seq=612 Ack=67215 Win=64296 Len=0 TSval=2193580111 TSecr=140351691
299531 101.002551 198.39.244.48 -> 41.177.26.15 TCP 70 61081 > http [ACK] Seq=612 Ack=68583 Win=65664 Len=0 TSval=2193580111 TSecr=140351691
299532 101.002555 198.39.244.48 -> 41.177.26.15 TCP 70 [TCP Window Update] 61081 > http [ACK] Seq=612 Ack=68583 Win=62928 Len=0 TSval=2193580111 TSecr=140351691
299533 101.002559 198.39.244.48 -> 41.177.26.15 TCP 70 61081 > http [ACK] Seq=612 Ack=69951 Win=64296 Len=0 TSval=2193580111 TSecr=140351691
299534 101.002563 198.39.244.48 -> 41.177.26.15 TCP 70 61081 > http [ACK] Seq=612 Ack=71319 Win=64296 Len=0 TSval=2193580111 TSecr=140351691
299538 101.002732 198.39.244.48 -> 41.177.26.15 TCP 70 61081 > http [ACK] Seq=612 Ack=72687 Win=64296 Len=0 TSval=2193580111 TSecr=140351691
299539 101.002736 198.39.244.48 -> 41.177.26.15 TCP 70 61081 > http [ACK] Seq=612 Ack=74055 Win=64296 Len=0 TSval=2193580112 TSecr=140351691
299540 101.002739 198.39.244.48 -> 41.177.26.15 TCP 70 61081 > http [ACK] Seq=612 Ack=75423 Win=64296 Len=0 TSval=2193580112 TSecr=140351691
299541 101.002744 198.39.244.48 -> 41.177.26.15 TCP 70 61081 > http [ACK] Seq=612 Ack=76775 Win=62944 Len=0 TSval=2193580112 TSecr=140351691
299542 101.002748 198.39.244.48 -> 41.177.26.15 TCP 70 61081 > http [ACK] Seq=612 Ack=78143 Win=64296 Len=0 TSval=2193580112 TSecr=140351691
299549 101.003217 198.39.244.48 -> 41.177.26.15 TCP 70 61081 > http [ACK] Seq=612 Ack=79511 Win=64296 Len=0 TSval=2193580112 TSecr=140351691
299550 101.003222 198.39.244.48 -> 41.177.26.15 TCP 70 61081 > http [ACK] Seq=612 Ack=80879 Win=64296 Len=0 TSval=2193580112 TSecr=140351691
299553 101.003459 198.39.244.48 -> 41.177.26.15 TCP 70 61081 > http [ACK] Seq=612 Ack=82247 Win=64296 Len=0 TSval=2193580112 TSecr=140351691
299624 101.022616 198.39.244.48 -> 41.177.26.15 TCP 70 61081 > http [ACK] Seq=612 Ack=83615 Win=64296 Len=0 TSval=2193580131 TSecr=140351692
299625 101.022645 198.39.244.48 -> 41.177.26.15 TCP 70 61081 > http [ACK] Seq=612 Ack=84967 Win=64312 Len=0 TSval=2193580131 TSecr=140351692
299626 101.022650 198.39.244.48 -> 41.177.26.15 TCP 70 61081 > http [ACK] Seq=612 Ack=86335 Win=64296 Len=0 TSval=2193580131 TSecr=140351692
299631 101.022891 198.39.244.48 -> 41.177.26.15 TCP 70 61081 > http [ACK] Seq=612 Ack=87703 Win=64296 Len=0 TSval=2193580131 TSecr=140351692
299634 101.023104 198.39.244.48 -> 41.177.26.15 TCP 70 61081 > http [ACK] Seq=612 Ack=89071 Win=64296 Len=0 TSval=2193580132 TSecr=140351692
299635 101.023134 198.39.244.48 -> 41.177.26.15 TCP 70 61081 > http [ACK] Seq=612 Ack=90439 Win=64296 Len=0 TSval=2193580132 TSecr=140351692
299636 101.023139 198.39.244.48 -> 41.177.26.15 TCP 70 61081 > http [ACK] Seq=612 Ack=91807 Win=64296 Len=0 TSval=2193580132 TSecr=140351692
299641 101.023359 198.39.244.48 -> 41.177.26.15 TCP 70 61081 > http [ACK] Seq=612 Ack=93159 Win=64312 Len=0 TSval=2193580132 TSecr=140351692
299642 101.023364 198.39.244.48 -> 41.177.26.15 TCP 70 61081 > http [ACK] Seq=612 Ack=94527 Win=62944 Len=0 TSval=2193580132 TSecr=140351692
299644 101.023607 198.39.244.48 -> 41.177.26.15 TCP 70 61081 > http [ACK] Seq=612 Ack=95895 Win=64296 Len=0 TSval=2193580132 TSecr=140351692
299645 101.023612 198.39.244.48 -> 41.177.26.15 TCP 70 61081 > http [ACK] Seq=612 Ack=97263 Win=64296 Len=0 TSval=2193580132 TSecr=140351692
299649 101.023802 198.39.244.48 -> 41.177.26.15 TCP 70 61081 > http [ACK] Seq=612 Ack=98631 Win=64296 Len=0 TSval=2193580132 TSecr=140351692
299651 101.023829 198.39.244.48 -> 41.177.26.15 TCP 70 61081 > http [ACK] Seq=612 Ack=99999 Win=62928 Len=0 TSval=2193580132 TSecr=140351692
299652 101.023833 198.39.244.48 -> 41.177.26.15 TCP 70 [TCP Window Update] 61081 > http [ACK] Seq=612 Ack=99999 Win=65664 Len=0 TSval=2193580133 TSecr=140351692
299653 101.023837 198.39.244.48 -> 41.177.26.15 TCP 70 61081 > http [ACK] Seq=612 Ack=101351 Win=64312 Len=0 TSval=2193580133 TSecr=140351692
299658 101.024488 198.39.244.48 -> 41.177.26.15 TCP 70 61081 > http [ACK] Seq=612 Ack=102719 Win=64296 Len=0 TSval=2193580133 TSecr=140351692
299659 101.024492 198.39.244.48 -> 41.177.26.15 TCP 70 61081 > http [ACK] Seq=612 Ack=104087 Win=64296 Len=0 TSval=2193580133 TSecr=140351692
299660 101.024496 198.39.244.48 -> 41.177.26.15 TCP 70 61081 > http [ACK] Seq=612 Ack=105455 Win=64296 Len=0 TSval=2193580133 TSecr=140351693
299661 101.024500 198.39.244.48 -> 41.177.26.15 TCP 70 61081 > http [ACK] Seq=612 Ack=106823 Win=64296 Len=0 TSval=2193580133 TSecr=140351693
299662 101.024504 198.39.244.48 -> 41.177.26.15 TCP 70 61081 > http [ACK] Seq=612 Ack=108191 Win=64296 Len=0 TSval=2193580133 TSecr=140351693
299663 101.024508 198.39.244.48 -> 41.177.26.15 TCP 70 61081 > http [ACK] Seq=612 Ack=109543 Win=64312 Len=0 TSval=2193580133 TSecr=140351693
299671 101.025216 198.39.244.48 -> 41.177.26.15 TCP 70 61081 > http [ACK] Seq=612 Ack=110911 Win=64296 Len=0 TSval=2193580133 TSecr=140351693
299673 101.025225 198.39.244.48 -> 41.177.26.15 TCP 70 61081 > http [ACK] Seq=612 Ack=112279 Win=64296 Len=0 TSval=2193580134 TSecr=140351693
299674 101.025229 198.39.244.48 -> 41.177.26.15 TCP 70 61081 > http [ACK] Seq=612 Ack=113647 Win=64296 Len=0 TSval=2193580134 TSecr=140351693
299675 101.025233 198.39.244.48 -> 41.177.26.15 TCP 70 61081 > http [ACK] Seq=612 Ack=115015 Win=64296 Len=0 TSval=2193580134 TSecr=140351693
299681 101.025532 198.39.244.48 -> 41.177.26.15 TCP 70 61081 > http [ACK] Seq=612 Ack=116383 Win=64296 Len=0 TSval=2193580134 TSecr=140351693
299683 101.025837 198.39.244.48 -> 41.177.26.15 TCP 70 61081 > http [ACK] Seq=612 Ack=117735 Win=64312 Len=0 TSval=2193580134 TSecr=140351693
299684 101.025842 198.39.244.48 -> 41.177.26.15 TCP 70 61081 > http [ACK] Seq=612 Ack=119103 Win=64296 Len=0 TSval=2193580134 TSecr=140351693
299685 101.025870 198.39.244.48 -> 41.177.26.15 TCP 70 61081 > http [ACK] Seq=612 Ack=120471 Win=64296 Len=0 TSval=2193580134 TSecr=140351693
299690 101.026777 198.39.244.48 -> 41.177.26.15 TCP 70 61081 > http [ACK] Seq=612 Ack=121839 Win=64296 Len=0 TSval=2193580135 TSecr=140351693
299691 101.026981 198.39.244.48 -> 41.177.26.15 TCP 70 61081 > http [ACK] Seq=612 Ack=123207 Win=62928 Len=0 TSval=2193580135 TSecr=140351693
299692 101.026985 198.39.244.48 -> 41.177.26.15 TCP 70 [TCP Window Update] 61081 > http [ACK] Seq=612 Ack=123207 Win=65664 Len=0 TSval=2193580135 TSecr=140351693
299693 101.027984 198.39.244.48 -> 41.177.26.15 TCP 70 61081 > http [ACK] Seq=612 Ack=124575 Win=64296 Len=0 TSval=2193580136 TSecr=140351693
299728 101.056638 198.39.244.48 -> 41.177.26.15 TCP 70 61081 > http [ACK] Seq=612 Ack=125927 Win=64312 Len=0 TSval=2193580165 TSecr=140351696
299729 101.056643 198.39.244.48 -> 41.177.26.15 TCP 70 61081 > http [ACK] Seq=612 Ack=127295 Win=64296 Len=0 TSval=2193580165 TSecr=140351696
299730 101.056872 198.39.244.48 -> 41.177.26.15 TCP 70 61081 > http [ACK] Seq=612 Ack=128663 Win=64296 Len=0 TSval=2193580165 TSecr=140351696
299731 101.057088 198.39.244.48 -> 41.177.26.15 TCP 70 61081 > http [ACK] Seq=612 Ack=130031 Win=64296 Len=0 TSval=2193580165 TSecr=140351696
299734 101.058002 198.39.244.48 -> 41.177.26.15 TCP 70 61081 > http [ACK] Seq=612 Ack=131399 Win=64296 Len=0 TSval=2193580165 TSecr=140351696
299735 101.058007 198.39.244.48 -> 41.177.26.15 TCP 70 61081 > http [ACK] Seq=612 Ack=132767 Win=64296 Len=0 TSval=2193580165 TSecr=140351696
299736 101.058011 198.39.244.48 -> 41.177.26.15 TCP 70 61081 > http [ACK] Seq=612 Ack=134119 Win=64312 Len=0 TSval=2193580165 TSecr=140351696
299737 101.058015 198.39.244.48 -> 41.177.26.15 TCP 70 61081 > http [ACK] Seq=612 Ack=135487 Win=64296 Len=0 TSval=2193580166 TSecr=140351696
299738 101.058019 198.39.244.48 -> 41.177.26.15 TCP 70 61081 > http [ACK] Seq=612 Ack=136855 Win=64296 Len=0 TSval=2193580166 TSecr=140351696
299739 101.058023 198.39.244.48 -> 41.177.26.15 TCP 70 61081 > http [ACK] Seq=612 Ack=138223 Win=64296 Len=0 TSval=2193580166 TSecr=140351696
299740 101.058027 198.39.244.48 -> 41.177.26.15 TCP 70 61081 > http [ACK] Seq=612 Ack=139591 Win=64296 Len=0 TSval=2193580166 TSecr=140351696
299742 101.058242 198.39.244.48 -> 41.177.26.15 TCP 70 61081 > http [ACK] Seq=612 Ack=140959 Win=64296 Len=0 TSval=2193580166 TSecr=140351696
299743 101.058458 198.39.244.48 -> 41.177.26.15 TCP 70 61081 > http [ACK] Seq=612 Ack=142311 Win=64312 Len=0 TSval=2193580166 TSecr=140351696
299744 101.058893 198.39.244.48 -> 41.177.26.15 TCP 70 61081 > http [ACK] Seq=612 Ack=143679 Win=64296 Len=0 TSval=2193580167 TSecr=140351696
299745 101.058898 198.39.244.48 -> 41.177.26.15 TCP 70 61081 > http [ACK] Seq=612 Ack=145047 Win=64296 Len=0 TSval=2193580167 TSecr=140351696
299746 101.059163 198.39.244.48 -> 41.177.26.15 TCP 70 61081 > http [ACK] Seq=612 Ack=146415 Win=64296 Len=0 TSval=2193580167 TSecr=140351696
299772 101.077709 198.39.244.48 -> 41.177.26.15 TCP 70 61081 > http [ACK] Seq=612 Ack=147783 Win=64296 Len=0 TSval=2193580185 TSecr=140351698
299775 101.077900 198.39.244.48 -> 41.177.26.15 TCP 70 61081 > http [ACK] Seq=612 Ack=149151 Win=64296 Len=0 TSval=2193580185 TSecr=140351698
299776 101.077904 198.39.244.48 -> 41.177.26.15 TCP 70 61081 > http [ACK] Seq=612 Ack=150519 Win=64296 Len=0 TSval=2193580185 TSecr=140351698
299777 101.077907 198.39.244.48 -> 41.177.26.15 TCP 70 61081 > http [ACK] Seq=612 Ack=151887 Win=64296 Len=0 TSval=2193580185 TSecr=140351698
299778 101.077922 198.39.244.48 -> 41.177.26.15 TCP 70 61081 > http [ACK] Seq=612 Ack=153255 Win=64296 Len=0 TSval=2193580185 TSecr=140351698
299780 101.078174 198.39.244.48 -> 41.177.26.15 TCP 70 61081 > http [ACK] Seq=612 Ack=154623 Win=62928 Len=0 TSval=2193580185 TSecr=140351698
299782 101.078199 198.39.244.48 -> 41.177.26.15 TCP 70 61081 > http [ACK] Seq=612 Ack=155975 Win=61576 Len=0 TSval=2193580185 TSecr=140351698
299783 101.078203 198.39.244.48 -> 41.177.26.15 TCP 70 [TCP Window Update] 61081 > http [ACK] Seq=612 Ack=155975 Win=65664 Len=0 TSval=2193580186 TSecr=140351698
299791 101.078671 198.39.244.48 -> 41.177.26.15 TCP 70 61081 > http [ACK] Seq=612 Ack=157343 Win=64296 Len=0 TSval=2193580186 TSecr=140351698
299792 101.078888 198.39.244.48 -> 41.177.26.15 TCP 70 61081 > http [ACK] Seq=612 Ack=158711 Win=64296 Len=0 TSval=2193580186 TSecr=140351698
299793 101.078893 198.39.244.48 -> 41.177.26.15 TCP 70 61081 > http [ACK] Seq=612 Ack=160079 Win=64296 Len=0 TSval=2193580186 TSecr=140351698
299796 101.079045 198.39.244.48 -> 41.177.26.15 TCP 70 61081 > http [ACK] Seq=612 Ack=161447 Win=64296 Len=0 TSval=2193580186 TSecr=140351698
299801 101.079338 198.39.244.48 -> 41.177.26.15 TCP 70 61081 > http [ACK] Seq=612 Ack=162815 Win=64296 Len=0 TSval=2193580187 TSecr=140351698
299805 101.079783 198.39.244.48 -> 41.177.26.15 TCP 70 61081 > http [ACK] Seq=612 Ack=164167 Win=64312 Len=0 TSval=2193580187 TSecr=140351698
299806 101.079788 198.39.244.48 -> 41.177.26.15 TCP 70 61081 > http [ACK] Seq=612 Ack=165535 Win=64296 Len=0 TSval=2193580187 TSecr=140351698
299815 101.081753 198.39.244.48 -> 41.177.26.15 TCP 70 61081 > http [ACK] Seq=612 Ack=166903 Win=64296 Len=0 TSval=2193580189 TSecr=140351698
299816 101.081976 198.39.244.48 -> 41.177.26.15 TCP 70 61081 > http [ACK] Seq=612 Ack=168271 Win=64296 Len=0 TSval=2193580189 TSecr=140351698
299817 101.081980 198.39.244.48 -> 41.177.26.15 TCP 70 61081 > http [ACK] Seq=612 Ack=169639 Win=64296 Len=0 TSval=2193580189 TSecr=140351698
299819 101.082237 198.39.244.48 -> 41.177.26.15 TCP 70 61081 > http [ACK] Seq=612 Ack=171007 Win=64296 Len=0 TSval=2193580189 TSecr=140351698
299820 101.082241 198.39.244.48 -> 41.177.26.15 TCP 70 61081 > http [ACK] Seq=612 Ack=172359 Win=64312 Len=0 TSval=2193580190 TSecr=140351698
299822 101.082681 198.39.244.48 -> 41.177.26.15 TCP 70 61081 > http [ACK] Seq=612 Ack=173727 Win=64296 Len=0 TSval=2193580190 TSecr=140351698
299823 101.082685 198.39.244.48 -> 41.177.26.15 TCP 70 61081 > http [ACK] Seq=612 Ack=175095 Win=64296 Len=0 TSval=2193580190 TSecr=140351698
299824 101.082919 198.39.244.48 -> 41.177.26.15 TCP 70 61081 > http [ACK] Seq=612 Ack=176463 Win=62928 Len=0 TSval=2193580190 TSecr=140351698
299825 101.082924 198.39.244.48 -> 41.177.26.15 TCP 70 61081 > http [ACK] Seq=612 Ack=177831 Win=61560 Len=0 TSval=2193580190 TSecr=140351698
299826 101.082928 198.39.244.48 -> 41.177.26.15 TCP 70 [TCP Window Update] 61081 > http [ACK] Seq=612 Ack=177831 Win=65664 Len=0 TSval=2193580190 TSecr=140351698
299827 101.082932 198.39.244.48 -> 41.177.26.15 TCP 70 61081 > http [ACK] Seq=612 Ack=179199 Win=64296 Len=0 TSval=2193580190 TSecr=140351698
299847 101.083460 198.39.244.48 -> 41.177.26.15 TCP 70 61081 > http [ACK] Seq=612 Ack=179959 Win=64904 Len=0 TSval=2193580191 TSecr=140351698
310309 105.912692 198.39.244.48 -> 41.177.26.176 TCP 70 44956 > http [ACK] Seq=2016 Ack=12052 Win=64168 Len=0 TSval=2193584923 TSecr=140352182
310310 105.912697 198.39.244.48 -> 41.177.26.176 TCP 70 44956 > http [ACK] Seq=2016 Ack=12154 Win=64066 Len=0 TSval=2193584923 TSecr=140352182
310349 105.922093 198.39.244.48 -> 41.177.26.176 TCP 70 44956 > http [ACK] Seq=2016 Ack=12807 Win=64882 Len=0 TSval=2193584933 TSecr=140352183
310351 105.923005 198.39.244.48 -> 41.177.26.176 TCP 70 44956 > http [ACK] Seq=2016 Ack=13034 Win=65308 Len=0 TSval=2193584933 TSecr=140352183
310352 105.923010 198.39.244.48 -> 41.177.26.176 TCP 70 44956 > http [ACK] Seq=2016 Ack=13261 Win=65082 Len=0 TSval=2193584933 TSecr=140352183
310353 105.923014 198.39.244.48 -> 41.177.26.176 TCP 70 44956 > http [ACK] Seq=2016 Ack=13352 Win=65444 Len=0 TSval=2193584933 TSecr=140352183
310358 105.923855 198.39.244.48 -> 41.177.26.176 TCP 70 44956 > http [ACK] Seq=2016 Ack=13582 Win=65306 Len=0 TSval=2193584934 TSecr=140352183
310359 105.923861 198.39.244.48 -> 41.177.26.176 TCP 70 44956 > http [ACK] Seq=2016 Ack=14299 Win=64818 Len=0 TSval=2193584934 TSecr=140352183
310360 105.924311 198.39.244.48 -> 41.177.26.176 TCP 70 44956 > http [ACK] Seq=2016 Ack=15667 Win=64168 Len=0 TSval=2193584935 TSecr=140352183
310361 105.924315 198.39.244.48 -> 41.177.26.176 TCP 70 44956 > http [ACK] Seq=2016 Ack=16118 Win=63716 Len=0 TSval=2193584935 TSecr=140352183
310525 105.968251 198.39.244.48 -> 41.177.26.176 TCP 70 44956 > http [ACK] Seq=2016 Ack=16717 Win=64936 Len=0 TSval=2193584978 TSecr=140352187
310526 105.968468 198.39.244.48 -> 41.177.26.176 TCP 70 44956 > http [ACK] Seq=2016 Ack=18085 Win=64168 Len=0 TSval=2193584978 TSecr=140352187
310527 105.968694 198.39.244.48 -> 41.177.26.176 TCP 70 44956 > http [ACK] Seq=2016 Ack=19453 Win=64168 Len=0 TSval=2193584978 TSecr=140352187
310558 105.977549 198.39.244.48 -> 41.177.26.176 TCP 70 44956 > http [ACK] Seq=2016 Ack=20628 Win=64360 Len=0 TSval=2193584987 TSecr=140352188
332666 116.060663 198.39.244.48 -> 41.177.26.15 TCP 70 61081 > http [ACK] Seq=612 Ack=179960 Win=65664 Len=0 TSval=2193594887 TSecr=140353197
332667 116.060916 198.39.244.48 -> 41.177.26.15 TCP 70 61081 > http [FIN, ACK] Seq=612 Ack=179960 Win=65664 Len=0 TSval=2193594887 TSecr=140353197
355013 121.001250 198.39.244.48 -> 41.177.26.176 TCP 70 44956 > http [ACK] Seq=2016 Ack=20629 Win=65536 Len=0 TSval=2193599738 TSecr=140353691
355014 121.001255 198.39.244.48 -> 41.177.26.176 TCP 70 44956 > http [FIN, ACK] Seq=2016 Ack=20629 Win=65536 Len=0 TSval=2193599738 TSecr=140353691
