21076   7.034375 198.222.241.108 -> 41.177.98.127 TCP 66 dpi-proxy > z39-50 [SYN] Seq=0 Win=65535 Len=0 MSS=1380 SACK_PERM=1
21097   7.055596 198.222.241.108 -> 41.177.98.127 TCP 64 dpi-proxy > z39-50 [ACK] Seq=1 Ack=1 Win=1460 Len=0
21098   7.055839 198.222.241.108 -> 41.177.98.127 TCP 149 dpi-proxy > z39-50 [PSH, ACK] Seq=1 Ack=1 Win=65535 Len=91
23167   8.418479 198.222.241.108 -> 41.177.98.127 TCP 172 dpi-proxy > z39-50 [PSH, ACK] Seq=92 Ack=71 Win=65465 Len=114
23687   8.635245 198.222.241.108 -> 41.177.98.127 TCP 91 dpi-proxy > z39-50 [PSH, ACK] Seq=206 Ack=94 Win=65442 Len=33
23827   8.718699 198.222.241.108 -> 41.177.98.127 TCP 64 dpi-proxy > z39-50 [ACK] Seq=239 Ack=2854 Win=65535 Len=0
23829   8.718924 198.222.241.108 -> 41.177.98.127 TCP 64 dpi-proxy > z39-50 [ACK] Seq=239 Ack=5614 Win=65535 Len=0
23890   8.748474 198.222.241.108 -> 41.177.98.127 TCP 64 dpi-proxy > z39-50 [ACK] Seq=239 Ack=7483 Win=65535 Len=0
23894   8.750177 198.222.241.108 -> 41.177.98.127 TCP 66 dpi-proxy > z39-50 [PSH, ACK] Seq=239 Ack=7483 Win=65535 Len=8
23973   8.777287 198.222.241.108 -> 41.177.98.127 TCP 64 dpi-proxy > z39-50 [ACK] Seq=247 Ack=7484 Win=65535 Len=0
23977   8.779079 198.222.241.108 -> 41.177.98.127 TCP 64 dpi-proxy > z39-50 [FIN, ACK] Seq=247 Ack=7484 Win=65535 Len=0
256799  91.385110 198.222.241.108 -> 41.177.98.127 TCP 66 itm-mcell-u > z39-50 [SYN] Seq=0 Win=65535 Len=0 MSS=1380 SACK_PERM=1
256812  91.405000 198.222.241.108 -> 41.177.98.127 TCP 64 itm-mcell-u > z39-50 [ACK] Seq=1 Ack=1 Win=1460 Len=0
256813  91.405085 198.222.241.108 -> 41.177.98.127 TCP 149 itm-mcell-u > z39-50 [PSH, ACK] Seq=1 Ack=1 Win=65535 Len=91
275097  92.723825 198.222.241.108 -> 41.177.98.127 TCP 177 itm-mcell-u > z39-50 [PSH, ACK] Seq=92 Ack=71 Win=65465 Len=119
275700  92.878916 198.222.241.108 -> 41.177.98.127 TCP 66 itm-mcell-u > z39-50 [PSH, ACK] Seq=211 Ack=94 Win=65442 Len=8
275732  92.903011 198.222.241.108 -> 41.177.98.127 TCP 64 itm-mcell-u > z39-50 [ACK] Seq=219 Ack=95 Win=65442 Len=0
275752  92.903573 198.222.241.108 -> 41.177.98.127 TCP 64 itm-mcell-u > z39-50 [FIN, ACK] Seq=219 Ack=95 Win=65442 Len=0
569314 181.950407 198.222.241.108 -> 41.177.98.127 TCP 66 intrastar > z39-50 [SYN] Seq=0 Win=65535 Len=0 MSS=1380 SACK_PERM=1
569364 181.979704 198.222.241.108 -> 41.177.98.127 TCP 64 intrastar > z39-50 [ACK] Seq=1 Ack=1 Win=1460 Len=0
569365 181.979934 198.222.241.108 -> 41.177.98.127 TCP 149 intrastar > z39-50 [PSH, ACK] Seq=1 Ack=1 Win=65535 Len=91
577195 183.303328 198.222.241.108 -> 41.177.98.127 TCP 177 intrastar > z39-50 [PSH, ACK] Seq=92 Ack=71 Win=65465 Len=119
577690 183.481642 198.222.241.108 -> 41.177.98.127 TCP 66 intrastar > z39-50 [PSH, ACK] Seq=211 Ack=94 Win=65442 Len=8
577762 183.509300 198.222.241.108 -> 41.177.98.127 TCP 64 intrastar > z39-50 [ACK] Seq=219 Ack=95 Win=65442 Len=0
577764 183.511375 198.222.241.108 -> 41.177.98.127 TCP 64 intrastar > z39-50 [FIN, ACK] Seq=219 Ack=95 Win=65442 Len=0
1002074 335.856004 198.222.241.108 -> 41.177.98.127 TCP 66 p2pq > z39-50 [SYN] Seq=0 Win=65535 Len=0 MSS=1380 SACK_PERM=1
1002118 335.874305 198.222.241.108 -> 41.177.98.127 TCP 64 p2pq > z39-50 [ACK] Seq=1 Ack=1 Win=1460 Len=0
1002119 335.874628 198.222.241.108 -> 41.177.98.127 TCP 149 p2pq > z39-50 [PSH, ACK] Seq=1 Ack=1 Win=65535 Len=91
1007044 337.269788 198.222.241.108 -> 41.177.98.127 TCP 174 p2pq > z39-50 [PSH, ACK] Seq=92 Ack=71 Win=65465 Len=116
1008615 337.882818 198.222.241.108 -> 41.177.98.127 TCP 66 p2pq > z39-50 [PSH, ACK] Seq=208 Ack=94 Win=65442 Len=8
1008685 337.911917 198.222.241.108 -> 41.177.98.127 TCP 64 p2pq > z39-50 [ACK] Seq=216 Ack=95 Win=65442 Len=0
1008688 337.913440 198.222.241.108 -> 41.177.98.127 TCP 64 p2pq > z39-50 [FIN, ACK] Seq=216 Ack=95 Win=65442 Len=0
