293002  98.378096 198.23.139.4 -> 41.177.98.176 TCP 82 52386 > http [SYN] Seq=0 Win=65535 Len=0 MSS=1460 WS=1 TSval=378307342 TSecr=0 SACK_PERM=1
293197  98.454756 198.23.139.4 -> 41.177.98.176 TCP 70 52386 > http [ACK] Seq=1 Ack=1 Win=65535 Len=0 TSval=378307342 TSecr=1550397
294125  99.051520 198.23.139.4 -> 41.177.98.176 TCP 70 52386 > http [ACK] Seq=837 Ack=2897 Win=65160 Len=0 TSval=378307343 TSecr=1550453
294126  99.051525 198.23.139.4 -> 41.177.98.176 TCP 70 52386 > http [ACK] Seq=837 Ack=3130 Win=65535 Len=0 TSval=378307343 TSecr=1550453
294164  99.061501 198.23.139.4 -> 41.177.98.176 TCP 70 52386 > http [ACK] Seq=837 Ack=3135 Win=65535 Len=0 TSval=378307343 TSecr=1550453
307912 104.721224 198.23.139.4 -> 41.177.98.176 TCP 82 [TCP Dup ACK 303663#1] 52386 > http [ACK] Seq=1693 Ack=3135 Win=65535 Len=0 TSval=378307355 TSecr=1550829 SLE=7479 SRE=8468
307914 104.721757 198.23.139.4 -> 41.177.98.176 TCP 82 [TCP Dup ACK 303663#2] 52386 > http [ACK] Seq=1693 Ack=3135 Win=65535 Len=0 TSval=378307355 TSecr=1550829 SLE=7479 SRE=9916
307945 104.738252 198.23.139.4 -> 41.177.98.176 TCP 82 [TCP Dup ACK 303663#3] 52386 > http [ACK] Seq=1693 Ack=3135 Win=65535 Len=0 TSval=378307355 TSecr=1550829 SLE=7479 SRE=11364
307946 104.738257 198.23.139.4 -> 41.177.98.176 TCP 82 [TCP Dup ACK 303663#4] 52386 > http [ACK] Seq=1693 Ack=3135 Win=65535 Len=0 TSval=378307355 TSecr=1550829 SLE=7479 SRE=12812
307989 104.761869 198.23.139.4 -> 41.177.98.176 TCP 82 [TCP Dup ACK 303663#5] 52386 > http [ACK] Seq=1693 Ack=3135 Win=65535 Len=0 TSval=378307355 TSecr=1550829 SLE=7479 SRE=13596
307991 104.766508 198.23.139.4 -> 41.177.98.176 TCP 82 52386 > http [ACK] Seq=1693 Ack=4583 Win=65160 Len=0 TSval=378307355 TSecr=1551033 SLE=7479 SRE=13596
307997 104.774057 198.23.139.4 -> 41.177.98.176 TCP 82 52386 > http [ACK] Seq=1693 Ack=6031 Win=65160 Len=0 TSval=378307355 TSecr=1551033 SLE=7479 SRE=13596
307998 104.774091 198.23.139.4 -> 41.177.98.176 TCP 70 52386 > http [ACK] Seq=1693 Ack=13596 Win=59043 Len=0 TSval=378307355 TSecr=1551033
308001 104.775374 198.23.139.4 -> 41.177.98.176 TCP 70 [TCP Window Update] 52386 > http [ACK] Seq=1693 Ack=13596 Win=65535 Len=0 TSval=378307355 TSecr=1551033
308027 104.796299 198.23.139.4 -> 41.177.98.176 TCP 82 52389 > http [SYN] Seq=0 Win=65535 Len=0 MSS=1460 WS=1 TSval=378307355 TSecr=0 SACK_PERM=1
308123 104.834371 198.23.139.4 -> 41.177.98.176 TCP 70 52386 > http [ACK] Seq=1693 Ack=16492 Win=65535 Len=0 TSval=378307355 TSecr=1551035
308169 104.843479 198.23.139.4 -> 41.177.98.176 TCP 82 52390 > http [SYN] Seq=0 Win=65535 Len=0 MSS=1460 WS=1 TSval=378307355 TSecr=0 SACK_PERM=1
308179 104.846640 198.23.139.4 -> 41.177.98.176 TCP 82 52391 > http [SYN] Seq=0 Win=65535 Len=0 MSS=1460 WS=1 TSval=378307355 TSecr=0 SACK_PERM=1
308189 104.847485 198.23.139.4 -> 41.177.98.176 TCP 70 52389 > http [ACK] Seq=1 Ack=1 Win=65535 Len=0 TSval=378307355 TSecr=1551039
308274 104.863208 198.23.139.4 -> 41.177.98.176 TCP 70 52386 > http [ACK] Seq=1693 Ack=20172 Win=65535 Len=0 TSval=378307355 TSecr=1551036
308320 104.875522 198.23.139.4 -> 41.177.98.176 TCP 70 52390 > http [ACK] Seq=1 Ack=1 Win=65535 Len=0 TSval=378307355 TSecr=1551043
308370 104.917506 198.23.139.4 -> 41.177.98.176 TCP 70 52391 > http [ACK] Seq=1 Ack=1 Win=65535 Len=0 TSval=378307355 TSecr=1551044
308392 104.945013 198.23.139.4 -> 41.177.98.176 TCP 70 52386 > http [ACK] Seq=1693 Ack=23068 Win=65535 Len=0 TSval=378307355 TSecr=1551042
308404 104.947366 198.23.139.4 -> 41.177.98.176 TCP 70 52389 > http [ACK] Seq=807 Ack=169 Win=65535 Len=0 TSval=378307355 TSecr=1551045
308405 104.947408 198.23.139.4 -> 41.177.98.176 TCP 70 52386 > http [ACK] Seq=1693 Ack=24296 Win=65535 Len=0 TSval=378307355 TSecr=1551045
308426 104.959888 198.23.139.4 -> 41.177.98.176 TCP 70 52390 > http [ACK] Seq=705 Ack=1563 Win=65535 Len=0 TSval=378307355 TSecr=1551050
308439 104.971314 198.23.139.4 -> 41.177.98.176 TCP 70 52391 > http [ACK] Seq=712 Ack=299 Win=65535 Len=0 TSval=378307355 TSecr=1551053
308440 104.971369 198.23.139.4 -> 41.177.98.176 TCP 70 52391 > http [ACK] Seq=712 Ack=3195 Win=65160 Len=0 TSval=378307355 TSecr=1551053
308484 105.034123 198.23.139.4 -> 41.177.98.176 TCP 70 52391 > http [ACK] Seq=712 Ack=6091 Win=65535 Len=0 TSval=378307355 TSecr=1551056
308492 105.045243 198.23.139.4 -> 41.177.98.176 TCP 70 52391 > http [ACK] Seq=712 Ack=8987 Win=65535 Len=0 TSval=378307355 TSecr=1551056
308532 105.065586 198.23.139.4 -> 41.177.98.176 TCP 70 52391 > http [ACK] Seq=712 Ack=11883 Win=65535 Len=0 TSval=378307355 TSecr=1551056
308665 105.104139 198.23.139.4 -> 41.177.98.176 TCP 70 52391 > http [ACK] Seq=712 Ack=14779 Win=65535 Len=0 TSval=378307355 TSecr=1551062
308773 105.175457 198.23.139.4 -> 41.177.98.176 TCP 70 52391 > http [ACK] Seq=712 Ack=16227 Win=65535 Len=0 TSval=378307356 TSecr=1551063
308774 105.175462 198.23.139.4 -> 41.177.98.176 TCP 70 52391 > http [ACK] Seq=712 Ack=19123 Win=65535 Len=0 TSval=378307356 TSecr=1551063
308778 105.177257 198.23.139.4 -> 41.177.98.176 TCP 70 52391 > http [ACK] Seq=712 Ack=22019 Win=65535 Len=0 TSval=378307356 TSecr=1551065
308808 105.209861 198.23.139.4 -> 41.177.98.176 TCP 70 52391 > http [ACK] Seq=712 Ack=24915 Win=65535 Len=0 TSval=378307356 TSecr=1551065
308833 105.245237 198.23.139.4 -> 41.177.98.176 TCP 70 52391 > http [ACK] Seq=712 Ack=27811 Win=65535 Len=0 TSval=378307356 TSecr=1551069
309096 105.359437 198.23.139.4 -> 41.177.98.176 TCP 70 52391 > http [ACK] Seq=712 Ack=28914 Win=65535 Len=0 TSval=378307356 TSecr=1551076
352665 119.651358 198.23.139.4 -> 41.177.98.176 TCP 70 52386 > http [ACK] Seq=1693 Ack=24297 Win=65535 Len=0 TSval=378307385 TSecr=1552519
353085 119.899749 198.23.139.4 -> 41.177.98.176 TCP 70 52389 > http [ACK] Seq=807 Ack=170 Win=65535 Len=0 TSval=378307385 TSecr=1552547
353167 119.931746 198.23.139.4 -> 41.177.98.176 TCP 70 52390 > http [ACK] Seq=705 Ack=1564 Win=65535 Len=0 TSval=378307385 TSecr=1552551
353207 119.975471 198.23.139.4 -> 41.177.98.176 TCP 70 52391 > http [ACK] Seq=712 Ack=28915 Win=65535 Len=0 TSval=378307385 TSecr=1552555
