951502 315.565873 198.98.203.213 -> 244.3.210.197 TCP 66 33310 > http [SYN] Seq=0 Win=65535 Len=0 MSS=1460 SACK_PERM=1
952060 315.755326 198.98.203.213 -> 244.3.210.197 TCP 64 33310 > http [ACK] Seq=1 Ack=1 Win=65535 Len=0
952066 315.756226 198.98.203.213 -> 244.3.210.197 TCP 64 33310 > http [FIN, ACK] Seq=1 Ack=1 Win=65535 Len=0
952242 315.810254 198.98.203.213 -> 244.3.210.197 TCP 66 52701 > http [SYN] Seq=0 Win=65535 Len=0 MSS=1460 SACK_PERM=1
952961 315.992200 198.98.203.213 -> 244.3.210.197 TCP 64 52701 > http [ACK] Seq=1 Ack=1 Win=65535 Len=0
954843 316.642858 198.98.203.213 -> 244.3.210.197 TCP 64 52701 > http [ACK] Seq=455 Ack=2921 Win=65535 Len=0
955488 316.921214 198.98.203.213 -> 244.3.210.197 TCP 64 52701 > http [ACK] Seq=455 Ack=4381 Win=65535 Len=0
955506 316.928844 198.98.203.213 -> 244.3.210.197 TCP 64 52701 > http [ACK] Seq=455 Ack=7301 Win=65535 Len=0
955861 317.025248 198.98.203.213 -> 244.3.210.197 TCP 66 44079 > http [SYN] Seq=0 Win=65535 Len=0 MSS=1460 SACK_PERM=1
955868 317.025485 198.98.203.213 -> 244.3.210.197 TCP 66 64025 > http [SYN] Seq=0 Win=65535 Len=0 MSS=1460 SACK_PERM=1
956099 317.168636 198.98.203.213 -> 244.3.210.197 TCP 64 52701 > http [ACK] Seq=455 Ack=8761 Win=65535 Len=0
956122 317.172755 198.98.203.213 -> 244.3.210.197 TCP 66 39575 > http [SYN] Seq=0 Win=65535 Len=0 MSS=1460 SACK_PERM=1
956130 317.173879 198.98.203.213 -> 244.3.210.197 TCP 66 62765 > http [SYN] Seq=0 Win=65535 Len=0 MSS=1460 SACK_PERM=1
956139 317.174814 198.98.203.213 -> 244.3.210.197 TCP 66 46880 > http [SYN] Seq=0 Win=65535 Len=0 MSS=1460 SACK_PERM=1
956155 317.191084 198.98.203.213 -> 244.3.210.197 TCP 64 52701 > http [ACK] Seq=455 Ack=11681 Win=65535 Len=0
956163 317.191732 198.98.203.213 -> 244.3.210.197 TCP 64 52701 > http [ACK] Seq=455 Ack=13141 Win=65535 Len=0
956251 317.288184 198.98.203.213 -> 244.3.210.197 TCP 64 44079 > http [ACK] Seq=1 Ack=1 Win=65535 Len=0
956252 317.288188 198.98.203.213 -> 244.3.210.197 TCP 64 64025 > http [ACK] Seq=1 Ack=1 Win=65535 Len=0
956354 317.364796 198.98.203.213 -> 244.3.210.197 TCP 64 52701 > http [ACK] Seq=455 Ack=14601 Win=65535 Len=0
956525 317.454950 198.98.203.213 -> 244.3.210.197 TCP 64 52701 > http [ACK] Seq=455 Ack=17521 Win=65535 Len=0
956546 317.463412 198.98.203.213 -> 244.3.210.197 TCP 64 39575 > http [ACK] Seq=1 Ack=1 Win=65535 Len=0
956553 317.463664 198.98.203.213 -> 244.3.210.197 TCP 64 62765 > http [ACK] Seq=1 Ack=1 Win=65535 Len=0
956554 317.463718 198.98.203.213 -> 244.3.210.197 TCP 64 46880 > http [ACK] Seq=1 Ack=1 Win=65535 Len=0
956607 317.479322 198.98.203.213 -> 244.3.210.197 TCP 64 52701 > http [ACK] Seq=455 Ack=19458 Win=65535 Len=0
956743 317.576132 198.98.203.213 -> 244.3.210.197 TCP 64 44079 > http [ACK] Seq=434 Ack=2921 Win=65535 Len=0
956755 317.583963 198.98.203.213 -> 244.3.210.197 TCP 64 64025 > http [ACK] Seq=424 Ack=2921 Win=65535 Len=0
956967 317.753845 198.98.203.213 -> 244.3.210.197 TCP 64 62765 > http [ACK] Seq=433 Ack=2921 Win=65535 Len=0
956993 317.761813 198.98.203.213 -> 244.3.210.197 TCP 64 39575 > http [ACK] Seq=430 Ack=2921 Win=65535 Len=0
957005 317.769612 198.98.203.213 -> 244.3.210.197 TCP 64 46880 > http [ACK] Seq=418 Ack=2921 Win=65535 Len=0
957018 317.775938 198.98.203.213 -> 244.3.210.197 TCP 64 52701 > http [ACK] Seq=876 Ack=22127 Win=65535 Len=0
957398 317.858558 198.98.203.213 -> 244.3.210.197 TCP 64 44079 > http [ACK] Seq=434 Ack=4381 Win=65535 Len=0
957414 317.866409 198.98.203.213 -> 244.3.210.197 TCP 64 44079 > http [ACK] Seq=434 Ack=7301 Win=65535 Len=0
957514 317.886595 198.98.203.213 -> 244.3.210.197 TCP 64 64025 > http [ACK] Seq=424 Ack=4381 Win=65535 Len=0
957537 317.894563 198.98.203.213 -> 244.3.210.197 TCP 64 64025 > http [ACK] Seq=424 Ack=7301 Win=65535 Len=0
958019 318.052520 198.98.203.213 -> 244.3.210.197 TCP 64 46880 > http [ACK] Seq=418 Ack=4381 Win=65535 Len=0
958047 318.065831 198.98.203.213 -> 244.3.210.197 TCP 64 46880 > http [ACK] Seq=418 Ack=7301 Win=65535 Len=0
958082 318.083626 198.98.203.213 -> 244.3.210.197 TCP 64 52701 > http [ACK] Seq=1305 Ack=25047 Win=65535 Len=0
958095 318.088352 198.98.203.213 -> 244.3.210.197 TCP 64 52701 > http [ACK] Seq=1305 Ack=26507 Win=65535 Len=0
958235 318.155862 198.98.203.213 -> 244.3.210.197 TCP 64 44079 > http [ACK] Seq=434 Ack=8761 Win=65535 Len=0
958299 318.169798 198.98.203.213 -> 244.3.210.197 TCP 64 64025 > http [ACK] Seq=424 Ack=8761 Win=65535 Len=0
958354 318.190071 198.98.203.213 -> 244.3.210.197 TCP 64 64025 > http [ACK] Seq=424 Ack=11681 Win=65535 Len=0
958529 318.269631 198.98.203.213 -> 244.3.210.197 TCP 64 44079 > http [ACK] Seq=434 Ack=10221 Win=65535 Len=0
958586 318.304040 198.98.203.213 -> 244.3.210.197 TCP 64 62765 > http [ACK] Seq=852 Ack=6222 Win=65535 Len=0
958595 318.306583 198.98.203.213 -> 244.3.210.197 TCP 64 62765 > http [ACK] Seq=852 Ack=7682 Win=65535 Len=0
958641 318.328301 198.98.203.213 -> 244.3.210.197 TCP 64 39575 > http [ACK] Seq=847 Ack=6286 Win=65535 Len=0
958642 318.328307 198.98.203.213 -> 244.3.210.197 TCP 64 39575 > http [ACK] Seq=847 Ack=7746 Win=65535 Len=0
958669 318.334507 198.98.203.213 -> 244.3.210.197 TCP 64 46880 > http [ACK] Seq=418 Ack=8761 Win=65535 Len=0
958685 318.338524 198.98.203.213 -> 244.3.210.197 TCP 64 46880 > http [ACK] Seq=418 Ack=11681 Win=65535 Len=0
958703 318.344162 198.98.203.213 -> 244.3.210.197 TCP 64 46880 > http [ACK] Seq=418 Ack=13141 Win=65535 Len=0
958767 318.386123 198.98.203.213 -> 244.3.210.197 TCP 64 52701 > http [ACK] Seq=1718 Ack=29800 Win=65535 Len=0
958785 318.391751 198.98.203.213 -> 244.3.210.197 TCP 64 52701 > http [ACK] Seq=1718 Ack=31260 Win=65535 Len=0
958805 318.403690 198.98.203.213 -> 244.3.210.197 TCP 64 52701 > http [ACK] Seq=1718 Ack=34180 Win=65535 Len=0
958806 318.403715 198.98.203.213 -> 244.3.210.197 TCP 64 52701 > http [ACK] Seq=1718 Ack=35640 Win=65535 Len=0
958907 318.446822 198.98.203.213 -> 244.3.210.197 TCP 70 [TCP Dup ACK 958354#1] 64025 > http [ACK] Seq=424 Ack=11681 Win=65535 Len=0 SLE=14601 SRE=16061
958913 318.448057 198.98.203.213 -> 244.3.210.197 TCP 70 [TCP Dup ACK 958354#2] 64025 > http [ACK] Seq=424 Ack=11681 Win=65535 Len=0 SLE=14601 SRE=17521
958937 318.464230 198.98.203.213 -> 244.3.210.197 TCP 70 [TCP Dup ACK 958354#3] 64025 > http [ACK] Seq=424 Ack=11681 Win=65535 Len=0 SLE=14601 SRE=18981
958955 318.470926 198.98.203.213 -> 244.3.210.197 TCP 64 46880 > http [ACK] Seq=418 Ack=14601 Win=65535 Len=0
958964 318.471110 198.98.203.213 -> 244.3.210.197 TCP 64 39575 > http [ACK] Seq=847 Ack=9206 Win=65535 Len=0
958965 318.471225 198.98.203.213 -> 244.3.210.197 TCP 64 62765 > http [ACK] Seq=852 Ack=9142 Win=65535 Len=0
958977 318.471732 198.98.203.213 -> 244.3.210.197 TCP 70 [TCP Dup ACK 958354#4] 64025 > http [ACK] Seq=424 Ack=11681 Win=65535 Len=0 SLE=14601 SRE=20441
958984 318.472220 198.98.203.213 -> 244.3.210.197 TCP 70 [TCP Dup ACK 958354#5] 64025 > http [ACK] Seq=424 Ack=11681 Win=65535 Len=0 SLE=14601 SRE=21901
959336 318.594178 198.98.203.213 -> 244.3.210.197 TCP 64 62765 > http [ACK] Seq=852 Ack=12062 Win=65535 Len=0
959370 318.598497 198.98.203.213 -> 244.3.210.197 TCP 64 62765 > http [ACK] Seq=852 Ack=14377 Win=65535 Len=0
959440 318.621620 198.98.203.213 -> 244.3.210.197 TCP 64 39575 > http [ACK] Seq=847 Ack=12126 Win=65535 Len=0
959470 318.630013 198.98.203.213 -> 244.3.210.197 TCP 64 46880 > http [ACK] Seq=418 Ack=17521 Win=65535 Len=0
959494 318.639663 198.98.203.213 -> 244.3.210.197 TCP 64 46880 > http [ACK] Seq=418 Ack=20441 Win=65535 Len=0
959516 318.643991 198.98.203.213 -> 244.3.210.197 TCP 64 46880 > http [ACK] Seq=418 Ack=21901 Win=65535 Len=0
959613 318.699443 198.98.203.213 -> 244.3.210.197 TCP 64 52701 > http [ACK] Seq=2132 Ack=38986 Win=65535 Len=0
959716 318.730296 198.98.203.213 -> 244.3.210.197 TCP 64 64025 > http [ACK] Seq=424 Ack=21901 Win=65535 Len=0
959733 318.737899 198.98.203.213 -> 244.3.210.197 TCP 70 46880 > http [ACK] Seq=418 Ack=23361 Win=65535 Len=0 SLE=24821 SRE=26281
959743 318.739345 198.98.203.213 -> 244.3.210.197 TCP 70 [TCP Dup ACK 959733#1] 46880 > http [ACK] Seq=418 Ack=23361 Win=65535 Len=0 SLE=24821 SRE=27741
959757 318.745694 198.98.203.213 -> 244.3.210.197 TCP 64 64025 > http [ACK] Seq=424 Ack=24821 Win=65535 Len=0
959766 318.747088 198.98.203.213 -> 244.3.210.197 TCP 64 64025 > http [ACK] Seq=424 Ack=26281 Win=65535 Len=0
960123 318.896804 198.98.203.213 -> 244.3.210.197 TCP 64 62765 > http [ACK] Seq=1270 Ack=17297 Win=65535 Len=0
960132 318.897925 198.98.203.213 -> 244.3.210.197 TCP 64 62765 > http [ACK] Seq=1270 Ack=18727 Win=64105 Len=0
960147 318.910272 198.98.203.213 -> 244.3.210.197 TCP 70 [TCP Dup ACK 959733#2] 46880 > http [ACK] Seq=418 Ack=23361 Win=65535 Len=0 SLE=24821 SRE=29201
960161 318.912965 198.98.203.213 -> 244.3.210.197 TCP 70 [TCP Dup ACK 959733#3] 46880 > http [ACK] Seq=418 Ack=23361 Win=65535 Len=0 SLE=24821 SRE=30661
960162 318.912970 198.98.203.213 -> 244.3.210.197 TCP 70 [TCP Dup ACK 959733#4] 46880 > http [ACK] Seq=418 Ack=23361 Win=65535 Len=0 SLE=24821 SRE=32121
960179 318.921384 198.98.203.213 -> 244.3.210.197 TCP 70 [TCP Dup ACK 959733#5] 46880 > http [ACK] Seq=418 Ack=23361 Win=65535 Len=0 SLE=24821 SRE=33581
960180 318.921388 198.98.203.213 -> 244.3.210.197 TCP 70 [TCP Dup ACK 959733#6] 46880 > http [ACK] Seq=418 Ack=23361 Win=65535 Len=0 SLE=24821 SRE=35041
960224 318.928534 198.98.203.213 -> 244.3.210.197 TCP 70 [TCP Dup ACK 959733#7] 46880 > http [ACK] Seq=418 Ack=23361 Win=65535 Len=0 SLE=24821 SRE=36501
960244 318.936702 198.98.203.213 -> 244.3.210.197 TCP 64 39575 > http [ACK] Seq=1259 Ack=16039 Win=65535 Len=0
960247 318.936822 198.98.203.213 -> 244.3.210.197 TCP 64 39575 > http [ACK] Seq=1259 Ack=17499 Win=65535 Len=0
960265 318.948800 198.98.203.213 -> 244.3.210.197 TCP 64 39575 > http [ACK] Seq=1259 Ack=20419 Win=65535 Len=0
960274 318.952402 198.98.203.213 -> 244.3.210.197 TCP 64 39575 > http [ACK] Seq=1259 Ack=21879 Win=65535 Len=0
960380 319.017979 198.98.203.213 -> 244.3.210.197 TCP 64 52701 > http [ACK] Seq=2547 Ack=42544 Win=65535 Len=0
960396 319.020052 198.98.203.213 -> 244.3.210.197 TCP 64 52701 > http [ACK] Seq=2547 Ack=44004 Win=65535 Len=0
960418 319.031908 198.98.203.213 -> 244.3.210.197 TCP 64 52701 > http [ACK] Seq=2547 Ack=46924 Win=65535 Len=0
960424 319.033732 198.98.203.213 -> 244.3.210.197 TCP 64 52701 > http [ACK] Seq=2547 Ack=48384 Win=65535 Len=0
960435 319.041889 198.98.203.213 -> 244.3.210.197 TCP 78 [TCP Dup ACK 959733#8] 46880 > http [ACK] Seq=418 Ack=23361 Win=65535 Len=0 SLE=39421 SRE=40881 SLE=24821 SRE=36501
960449 319.044151 198.98.203.213 -> 244.3.210.197 TCP 78 [TCP Dup ACK 959733#9] 46880 > http [ACK] Seq=418 Ack=23361 Win=65535 Len=0 SLE=39421 SRE=42341 SLE=24821 SRE=36501
960466 319.057211 198.98.203.213 -> 244.3.210.197 TCP 64 64025 > http [ACK] Seq=424 Ack=29201 Win=65535 Len=0
960488 319.059817 198.98.203.213 -> 244.3.210.197 TCP 64 64025 > http [ACK] Seq=424 Ack=30661 Win=65535 Len=0
960517 319.074168 198.98.203.213 -> 244.3.210.197 TCP 64 39575 > http [ACK] Seq=1259 Ack=23339 Win=65535 Len=0
960694 319.175740 198.98.203.213 -> 244.3.210.197 TCP 64 64025 > http [ACK] Seq=424 Ack=32121 Win=65535 Len=0
960700 319.175994 198.98.203.213 -> 244.3.210.197 TCP 64 52701 > http [ACK] Seq=2547 Ack=49844 Win=65535 Len=0
960726 319.194652 198.98.203.213 -> 244.3.210.197 TCP 70 46880 > http [ACK] Seq=418 Ack=36501 Win=65535 Len=0 SLE=39421 SRE=42341
960747 319.207255 198.98.203.213 -> 244.3.210.197 TCP 70 [TCP Dup ACK 960726#1] 46880 > http [ACK] Seq=418 Ack=36501 Win=65535 Len=0 SLE=39421 SRE=43801
960784 319.215171 198.98.203.213 -> 244.3.210.197 TCP 64 62765 > http [ACK] Seq=1684 Ack=21647 Win=65535 Len=0
960809 319.221601 198.98.203.213 -> 244.3.210.197 TCP 64 62765 > http [ACK] Seq=1684 Ack=23107 Win=65535 Len=0
960836 319.234060 198.98.203.213 -> 244.3.210.197 TCP 70 [TCP Dup ACK 960726#2] 46880 > http [ACK] Seq=418 Ack=36501 Win=65535 Len=0 SLE=39421 SRE=45261
960894 319.263942 198.98.203.213 -> 244.3.210.197 TCP 70 [TCP Dup ACK 960700#1] 52701 > http [ACK] Seq=2547 Ack=49844 Win=65535 Len=0 SLE=71744 SRE=73204
960910 319.269761 198.98.203.213 -> 244.3.210.197 TCP 70 [TCP Dup ACK 960700#2] 52701 > http [ACK] Seq=2547 Ack=49844 Win=65535 Len=0 SLE=71744 SRE=74664
960947 319.271643 198.98.203.213 -> 244.3.210.197 TCP 70 [TCP Dup ACK 960700#3] 52701 > http [ACK] Seq=2547 Ack=49844 Win=65535 Len=0 SLE=71744 SRE=76124
961007 319.277750 198.98.203.213 -> 244.3.210.197 TCP 70 [TCP Dup ACK 960700#4] 52701 > http [ACK] Seq=2547 Ack=49844 Win=65535 Len=0 SLE=71744 SRE=77584
961008 319.277755 198.98.203.213 -> 244.3.210.197 TCP 70 [TCP Dup ACK 960700#5] 52701 > http [ACK] Seq=2547 Ack=49844 Win=65535 Len=0 SLE=71744 SRE=77767
961045 319.280916 198.98.203.213 -> 244.3.210.197 TCP 70 [TCP Dup ACK 960726#3] 46880 > http [ACK] Seq=418 Ack=36501 Win=65535 Len=0 SLE=39421 SRE=46721
961074 319.285625 198.98.203.213 -> 244.3.210.197 TCP 70 [TCP Dup ACK 960726#4] 46880 > http [ACK] Seq=418 Ack=36501 Win=65535 Len=0 SLE=39421 SRE=48181
961144 319.301875 198.98.203.213 -> 244.3.210.197 TCP 64 64025 > http [ACK] Seq=424 Ack=34243 Win=65535 Len=0
961298 319.401591 198.98.203.213 -> 244.3.210.197 TCP 70 [TCP Dup ACK 960809#1] 62765 > http [ACK] Seq=1684 Ack=23107 Win=65535 Len=0 SLE=34787 SRE=36247
961305 319.402040 198.98.203.213 -> 244.3.210.197 TCP 70 [TCP Dup ACK 960809#2] 62765 > http [ACK] Seq=1684 Ack=23107 Win=65535 Len=0 SLE=34787 SRE=37707
961321 319.406524 198.98.203.213 -> 244.3.210.197 TCP 70 [TCP Dup ACK 960809#3] 62765 > http [ACK] Seq=1684 Ack=23107 Win=65535 Len=0 SLE=34787 SRE=39167
961390 319.415522 198.98.203.213 -> 244.3.210.197 TCP 70 [TCP Dup ACK 960809#4] 62765 > http [ACK] Seq=1684 Ack=23107 Win=65535 Len=0 SLE=34787 SRE=40627
961406 319.420853 198.98.203.213 -> 244.3.210.197 TCP 70 [TCP Dup ACK 960809#5] 62765 > http [ACK] Seq=1684 Ack=23107 Win=65535 Len=0 SLE=34787 SRE=42087
961418 319.428642 198.98.203.213 -> 244.3.210.197 TCP 64 46880 > http [ACK] Seq=418 Ack=48181 Win=65535 Len=0
961465 319.475262 198.98.203.213 -> 244.3.210.197 TCP 70 52701 > http [ACK] Seq=2547 Ack=52764 Win=65535 Len=0 SLE=71744 SRE=77767
961480 319.482750 198.98.203.213 -> 244.3.210.197 TCP 70 52701 > http [ACK] Seq=2547 Ack=55684 Win=65535 Len=0 SLE=71744 SRE=77767
961486 319.483404 198.98.203.213 -> 244.3.210.197 TCP 70 52701 > http [ACK] Seq=2547 Ack=57144 Win=65535 Len=0 SLE=71744 SRE=77767
961509 319.491735 198.98.203.213 -> 244.3.210.197 TCP 70 52701 > http [ACK] Seq=2547 Ack=60064 Win=65535 Len=0 SLE=71744 SRE=77767
961523 319.498421 198.98.203.213 -> 244.3.210.197 TCP 70 52701 > http [ACK] Seq=2547 Ack=61524 Win=65535 Len=0 SLE=71744 SRE=77767
961543 319.506393 198.98.203.213 -> 244.3.210.197 TCP 70 52701 > http [ACK] Seq=2547 Ack=64444 Win=65535 Len=0 SLE=71744 SRE=77767
961549 319.507470 198.98.203.213 -> 244.3.210.197 TCP 70 52701 > http [ACK] Seq=2547 Ack=65904 Win=65535 Len=0 SLE=71744 SRE=77767
961562 319.515644 198.98.203.213 -> 244.3.210.197 TCP 70 52701 > http [ACK] Seq=2547 Ack=68824 Win=65535 Len=0 SLE=71744 SRE=77767
961576 319.522646 198.98.203.213 -> 244.3.210.197 TCP 70 52701 > http [ACK] Seq=2547 Ack=70284 Win=65535 Len=0 SLE=71744 SRE=77767
961582 319.523079 198.98.203.213 -> 244.3.210.197 TCP 64 52701 > http [ACK] Seq=2547 Ack=77767 Win=65535 Len=0
961626 319.546284 198.98.203.213 -> 244.3.210.197 TCP 64 64025 > http [ACK] Seq=846 Ack=37163 Win=65535 Len=0
961647 319.553988 198.98.203.213 -> 244.3.210.197 TCP 64 64025 > http [ACK] Seq=846 Ack=38623 Win=65535 Len=0
961661 319.565701 198.98.203.213 -> 244.3.210.197 TCP 64 64025 > http [ACK] Seq=846 Ack=40106 Win=65535 Len=0
961753 319.628874 198.98.203.213 -> 244.3.210.197 TCP 70 62765 > http [ACK] Seq=1684 Ack=26027 Win=65535 Len=0 SLE=34787 SRE=42087
961754 319.628879 198.98.203.213 -> 244.3.210.197 TCP 70 62765 > http [ACK] Seq=1684 Ack=27487 Win=65535 Len=0 SLE=34787 SRE=42087
961772 319.636458 198.98.203.213 -> 244.3.210.197 TCP 70 62765 > http [ACK] Seq=1684 Ack=30407 Win=65535 Len=0 SLE=34787 SRE=42087
961784 319.637501 198.98.203.213 -> 244.3.210.197 TCP 70 62765 > http [ACK] Seq=1684 Ack=31867 Win=65535 Len=0 SLE=34787 SRE=42087
961797 319.644836 198.98.203.213 -> 244.3.210.197 TCP 64 62765 > http [ACK] Seq=1684 Ack=42087 Win=65535 Len=0
961819 319.655528 198.98.203.213 -> 244.3.210.197 TCP 64 46880 > http [ACK] Seq=418 Ack=51101 Win=65535 Len=0
961827 319.655860 198.98.203.213 -> 244.3.210.197 TCP 64 46880 > http [ACK] Seq=418 Ack=52561 Win=65535 Len=0
961919 319.746780 198.98.203.213 -> 244.3.210.197 TCP 64 52701 > http [ACK] Seq=2965 Ack=80687 Win=65535 Len=0
961960 319.781343 198.98.203.213 -> 244.3.210.197 TCP 64 64025 > http [ACK] Seq=1257 Ack=43026 Win=65535 Len=0
961977 319.787067 198.98.203.213 -> 244.3.210.197 TCP 64 64025 > http [ACK] Seq=1257 Ack=44486 Win=65535 Len=0
962025 319.799542 198.98.203.213 -> 244.3.210.197 TCP 64 64025 > http [ACK] Seq=1257 Ack=47406 Win=65535 Len=0
962166 319.852392 198.98.203.213 -> 244.3.210.197 TCP 64 62765 > http [ACK] Seq=1684 Ack=45007 Win=65535 Len=0
962175 319.852913 198.98.203.213 -> 244.3.210.197 TCP 64 62765 > http [ACK] Seq=1684 Ack=46467 Win=65535 Len=0
962242 319.860742 198.98.203.213 -> 244.3.210.197 TCP 64 62765 > http [ACK] Seq=1684 Ack=49387 Win=65535 Len=0
962280 319.867996 198.98.203.213 -> 244.3.210.197 TCP 64 62765 > http [ACK] Seq=1684 Ack=50847 Win=65535 Len=0
962333 319.876736 198.98.203.213 -> 244.3.210.197 TCP 64 46880 > http [ACK] Seq=418 Ack=55481 Win=65535 Len=0
962347 319.879013 198.98.203.213 -> 244.3.210.197 TCP 64 52701 > http [ACK] Seq=2965 Ack=81224 Win=64998 Len=0
962376 319.883957 198.98.203.213 -> 244.3.210.197 TCP 64 46880 > http [ACK] Seq=418 Ack=56941 Win=65535 Len=0
962654 319.976953 198.98.203.213 -> 244.3.210.197 TCP 64 64025 > http [ACK] Seq=1257 Ack=48866 Win=65535 Len=0
962662 319.979903 198.98.203.213 -> 244.3.210.197 TCP 64 62765 > http [ACK] Seq=1684 Ack=52307 Win=65535 Len=0
962679 319.990979 198.98.203.213 -> 244.3.210.197 TCP 64 64025 > http [ACK] Seq=1257 Ack=51439 Win=65535 Len=0
962732 320.042064 198.98.203.213 -> 244.3.210.197 TCP 64 62765 > http [ACK] Seq=1684 Ack=55227 Win=65535 Len=0
962750 320.049895 198.98.203.213 -> 244.3.210.197 TCP 64 62765 > http [ACK] Seq=1684 Ack=58147 Win=65535 Len=0
962762 320.055331 198.98.203.213 -> 244.3.210.197 TCP 64 62765 > http [ACK] Seq=1684 Ack=59607 Win=65535 Len=0
962775 320.072870 198.98.203.213 -> 244.3.210.197 TCP 64 46880 > http [ACK] Seq=418 Ack=59861 Win=65535 Len=0
962789 320.078141 198.98.203.213 -> 244.3.210.197 TCP 64 46880 > http [ACK] Seq=418 Ack=61321 Win=65535 Len=0
962872 320.154777 198.98.203.213 -> 244.3.210.197 TCP 64 62765 > http [ACK] Seq=1684 Ack=62527 Win=65535 Len=0
962943 320.248032 198.98.203.213 -> 244.3.210.197 TCP 64 62765 > http [ACK] Seq=1684 Ack=63987 Win=65535 Len=0
962969 320.256112 198.98.203.213 -> 244.3.210.197 TCP 64 62765 > http [ACK] Seq=1684 Ack=66907 Win=65535 Len=0
962979 320.258905 198.98.203.213 -> 244.3.210.197 TCP 64 62765 > http [ACK] Seq=1684 Ack=68367 Win=65535 Len=0
962998 320.267106 198.98.203.213 -> 244.3.210.197 TCP 64 62765 > http [ACK] Seq=1684 Ack=71287 Win=65535 Len=0
963021 320.277729 198.98.203.213 -> 244.3.210.197 TCP 64 46880 > http [ACK] Seq=418 Ack=64241 Win=65535 Len=0
963022 320.277735 198.98.203.213 -> 244.3.210.197 TCP 64 46880 > http [ACK] Seq=418 Ack=65701 Win=65535 Len=0
963121 320.361842 198.98.203.213 -> 244.3.210.197 TCP 64 62765 > http [ACK] Seq=1684 Ack=72747 Win=65535 Len=0
963148 320.382103 198.98.203.213 -> 244.3.210.197 TCP 64 46880 > http [ACK] Seq=418 Ack=67161 Win=65535 Len=0
963257 320.466155 198.98.203.213 -> 244.3.210.197 TCP 64 62765 > http [ACK] Seq=1684 Ack=75667 Win=65535 Len=0
963283 320.485119 198.98.203.213 -> 244.3.210.197 TCP 64 62765 > http [ACK] Seq=1684 Ack=77127 Win=65535 Len=0
963301 320.500457 198.98.203.213 -> 244.3.210.197 TCP 64 62765 > http [ACK] Seq=1684 Ack=80047 Win=65535 Len=0
963324 320.509775 198.98.203.213 -> 244.3.210.197 TCP 64 62765 > http [ACK] Seq=1684 Ack=81507 Win=65535 Len=0
963330 320.510194 198.98.203.213 -> 244.3.210.197 TCP 64 62765 > http [ACK] Seq=1684 Ack=83317 Win=65535 Len=0
963347 320.518269 198.98.203.213 -> 244.3.210.197 TCP 64 46880 > http [ACK] Seq=418 Ack=70081 Win=65535 Len=0
963408 320.526151 198.98.203.213 -> 244.3.210.197 TCP 64 46880 > http [ACK] Seq=418 Ack=73001 Win=65535 Len=0
963640 320.615824 198.98.203.213 -> 244.3.210.197 TCP 64 46880 > http [ACK] Seq=418 Ack=74461 Win=65535 Len=0
964009 320.755317 198.98.203.213 -> 244.3.210.197 TCP 64 46880 > http [ACK] Seq=418 Ack=77381 Win=65535 Len=0
964036 320.758805 198.98.203.213 -> 244.3.210.197 TCP 64 46880 > http [ACK] Seq=418 Ack=78841 Win=65535 Len=0
964237 320.864650 198.98.203.213 -> 244.3.210.197 TCP 64 46880 > http [ACK] Seq=418 Ack=81761 Win=65535 Len=0
964268 320.884843 198.98.203.213 -> 244.3.210.197 TCP 64 44079 > http [ACK] Seq=434 Ack=10382 Win=65374 Len=0
964453 320.998580 198.98.203.213 -> 244.3.210.197 TCP 64 46880 > http [ACK] Seq=418 Ack=83221 Win=65535 Len=0
964470 321.006612 198.98.203.213 -> 244.3.210.197 TCP 64 46880 > http [ACK] Seq=418 Ack=86141 Win=65535 Len=0
964481 321.007606 198.98.203.213 -> 244.3.210.197 TCP 64 46880 > http [ACK] Seq=418 Ack=87601 Win=65535 Len=0
964645 321.085948 198.98.203.213 -> 244.3.210.197 TCP 64 39575 > http [ACK] Seq=1259 Ack=23898 Win=64976 Len=0
964701 321.126298 198.98.203.213 -> 244.3.210.197 TCP 64 46880 > http [ACK] Seq=418 Ack=90521 Win=65535 Len=0
964921 321.227597 198.98.203.213 -> 244.3.210.197 TCP 64 46880 > http [ACK] Seq=418 Ack=91981 Win=65535 Len=0
964945 321.241789 198.98.203.213 -> 244.3.210.197 TCP 64 46880 > http [ACK] Seq=418 Ack=94901 Win=65535 Len=0
964958 321.244531 198.98.203.213 -> 244.3.210.197 TCP 64 46880 > http [ACK] Seq=418 Ack=96361 Win=65535 Len=0
965213 321.354774 198.98.203.213 -> 244.3.210.197 TCP 64 46880 > http [ACK] Seq=418 Ack=99281 Win=65535 Len=0
965232 321.358849 198.98.203.213 -> 244.3.210.197 TCP 64 46880 > http [ACK] Seq=418 Ack=100741 Win=65535 Len=0
965475 321.450621 198.98.203.213 -> 244.3.210.197 TCP 64 46880 > http [ACK] Seq=418 Ack=103661 Win=65535 Len=0
965526 321.457041 198.98.203.213 -> 244.3.210.197 TCP 64 46880 > http [ACK] Seq=418 Ack=105121 Win=65535 Len=0
965890 321.574849 198.98.203.213 -> 244.3.210.197 TCP 64 46880 > http [ACK] Seq=418 Ack=108041 Win=65535 Len=0
965891 321.574906 198.98.203.213 -> 244.3.210.197 TCP 64 46880 > http [ACK] Seq=418 Ack=109501 Win=65535 Len=0
966086 321.642802 198.98.203.213 -> 244.3.210.197 TCP 70 [TCP Dup ACK 965891#1] 46880 > http [ACK] Seq=418 Ack=109501 Win=65535 Len=0 SLE=110961 SRE=112421
966093 321.648572 198.98.203.213 -> 244.3.210.197 TCP 70 [TCP Dup ACK 965891#2] 46880 > http [ACK] Seq=418 Ack=109501 Win=65535 Len=0 SLE=110961 SRE=113881
966129 321.656179 198.98.203.213 -> 244.3.210.197 TCP 70 [TCP Dup ACK 965891#3] 46880 > http [ACK] Seq=418 Ack=109501 Win=65535 Len=0 SLE=110961 SRE=115341
966518 321.759712 198.98.203.213 -> 244.3.210.197 TCP 70 [TCP Dup ACK 965891#4] 46880 > http [ACK] Seq=418 Ack=109501 Win=65535 Len=0 SLE=110961 SRE=116801
966525 321.762562 198.98.203.213 -> 244.3.210.197 TCP 70 [TCP Dup ACK 965891#5] 46880 > http [ACK] Seq=418 Ack=109501 Win=65535 Len=0 SLE=110961 SRE=118261
966536 321.768938 198.98.203.213 -> 244.3.210.197 TCP 70 [TCP Dup ACK 965891#6] 46880 > http [ACK] Seq=418 Ack=109501 Win=65535 Len=0 SLE=110961 SRE=119721
966549 321.770591 198.98.203.213 -> 244.3.210.197 TCP 70 [TCP Dup ACK 965891#7] 46880 > http [ACK] Seq=418 Ack=109501 Win=65535 Len=0 SLE=110961 SRE=121181
966651 321.830949 198.98.203.213 -> 244.3.210.197 TCP 70 [TCP Dup ACK 965891#8] 46880 > http [ACK] Seq=418 Ack=109501 Win=65535 Len=0 SLE=110961 SRE=122641
966671 321.845932 198.98.203.213 -> 244.3.210.197 TCP 64 46880 > http [ACK] Seq=418 Ack=122641 Win=65535 Len=0
966843 321.940628 198.98.203.213 -> 244.3.210.197 TCP 64 46880 > http [ACK] Seq=418 Ack=125561 Win=65535 Len=0
966865 321.957471 198.98.203.213 -> 244.3.210.197 TCP 64 46880 > http [ACK] Seq=418 Ack=127021 Win=65535 Len=0
966973 322.009680 198.98.203.213 -> 244.3.210.197 TCP 64 46880 > http [ACK] Seq=418 Ack=129941 Win=65535 Len=0
967089 322.105217 198.98.203.213 -> 244.3.210.197 TCP 64 46880 > http [ACK] Seq=418 Ack=131401 Win=65535 Len=0
967401 322.203908 198.98.203.213 -> 244.3.210.197 TCP 64 46880 > http [ACK] Seq=418 Ack=134321 Win=65535 Len=0
968247 322.394802 198.98.203.213 -> 244.3.210.197 TCP 64 46880 > http [ACK] Seq=418 Ack=134326 Win=65530 Len=0
968338 322.477287 198.98.203.213 -> 244.3.210.197 TCP 64 52701 > http [ACK] Seq=3380 Ack=84144 Win=65535 Len=0
968348 322.480463 198.98.203.213 -> 244.3.210.197 TCP 64 52701 > http [ACK] Seq=3380 Ack=85604 Win=65535 Len=0
968569 322.595035 198.98.203.213 -> 244.3.210.197 TCP 64 52701 > http [ACK] Seq=3380 Ack=86128 Win=65011 Len=0
969237 322.809035 198.98.203.213 -> 244.3.210.197 TCP 64 64025 > http [ACK] Seq=1673 Ack=54359 Win=65535 Len=0
969256 322.814956 198.98.203.213 -> 244.3.210.197 TCP 64 64025 > http [ACK] Seq=1673 Ack=55819 Win=65535 Len=0
969276 322.827197 198.98.203.213 -> 244.3.210.197 TCP 64 64025 > http [ACK] Seq=1673 Ack=58739 Win=65535 Len=0
969285 322.827365 198.98.203.213 -> 244.3.210.197 TCP 64 64025 > http [ACK] Seq=1673 Ack=60199 Win=65535 Len=0
969300 322.830604 198.98.203.213 -> 244.3.210.197 TCP 70 [TCP Dup ACK 968461#1] 62765 > http [ACK] Seq=2100 Ack=83317 Win=65535 Len=0 SLE=90617 SRE=92077
969311 322.833350 198.98.203.213 -> 244.3.210.197 TCP 70 [TCP Dup ACK 968461#2] 62765 > http [ACK] Seq=2100 Ack=83317 Win=65535 Len=0 SLE=90617 SRE=93537
969326 322.838825 198.98.203.213 -> 244.3.210.197 TCP 78 [TCP Dup ACK 968461#3] 62765 > http [ACK] Seq=2100 Ack=83317 Win=65535 Len=0 SLE=94997 SRE=96457 SLE=90617 SRE=93537
969797 323.095577 198.98.203.213 -> 244.3.210.197 TCP 64 64025 > http [ACK] Seq=1673 Ack=63119 Win=65535 Len=0
969838 323.102482 198.98.203.213 -> 244.3.210.197 TCP 64 64025 > http [ACK] Seq=1673 Ack=64579 Win=65535 Len=0
969869 323.110313 198.98.203.213 -> 244.3.210.197 TCP 64 64025 > http [ACK] Seq=1673 Ack=67499 Win=65535 Len=0
969880 323.111280 198.98.203.213 -> 244.3.210.197 TCP 64 64025 > http [ACK] Seq=1673 Ack=68959 Win=65535 Len=0
969895 323.118356 198.98.203.213 -> 244.3.210.197 TCP 78 [TCP Dup ACK 968461#4] 62765 > http [ACK] Seq=2100 Ack=83317 Win=65535 Len=0 SLE=94997 SRE=97917 SLE=90617 SRE=93537
969909 323.126701 198.98.203.213 -> 244.3.210.197 TCP 78 62765 > http [ACK] Seq=2100 Ack=86237 Win=65535 Len=0 SLE=94997 SRE=97917 SLE=90617 SRE=93537
969915 323.127312 198.98.203.213 -> 244.3.210.197 TCP 78 62765 > http [ACK] Seq=2100 Ack=87697 Win=65535 Len=0 SLE=94997 SRE=97917 SLE=90617 SRE=93537
970189 323.374091 198.98.203.213 -> 244.3.210.197 TCP 64 64025 > http [ACK] Seq=1673 Ack=71879 Win=65535 Len=0
970222 323.380013 198.98.203.213 -> 244.3.210.197 TCP 64 64025 > http [ACK] Seq=1673 Ack=73339 Win=65535 Len=0
970267 323.404569 198.98.203.213 -> 244.3.210.197 TCP 64 64025 > http [ACK] Seq=1673 Ack=76259 Win=65535 Len=0
970274 323.405211 198.98.203.213 -> 244.3.210.197 TCP 64 64025 > http [ACK] Seq=1673 Ack=77719 Win=65535 Len=0
970515 323.601289 198.98.203.213 -> 244.3.210.197 TCP 64 64025 > http [ACK] Seq=1673 Ack=79179 Win=65535 Len=0
970527 323.622565 198.98.203.213 -> 244.3.210.197 TCP 64 64025 > http [ACK] Seq=1673 Ack=82099 Win=65535 Len=0
970747 323.802270 198.98.203.213 -> 244.3.210.197 TCP 64 64025 > http [ACK] Seq=1673 Ack=82351 Win=65283 Len=0
973843 324.305148 198.98.203.213 -> 244.3.210.197 TCP 78 62765 > http [ACK] Seq=2100 Ack=89157 Win=65535 Len=0 SLE=94997 SRE=97917 SLE=90617 SRE=93537
974739 324.470883 198.98.203.213 -> 244.3.210.197 TCP 70 62765 > http [ACK] Seq=2100 Ack=93537 Win=65535 Len=0 SLE=94997 SRE=97917
974765 324.472198 198.98.203.213 -> 244.3.210.197 TCP 70 [TCP Dup ACK 974739#1] 62765 > http [ACK] Seq=2100 Ack=93537 Win=65535 Len=0 SLE=94997 SRE=97917
975264 324.686309 198.98.203.213 -> 244.3.210.197 TCP 64 62765 > http [ACK] Seq=2100 Ack=97917 Win=65535 Len=0
975287 324.692530 198.98.203.213 -> 244.3.210.197 TCP 64 [TCP Dup ACK 975264#1] 62765 > http [ACK] Seq=2100 Ack=97917 Win=65535 Len=0
975305 324.694364 198.98.203.213 -> 244.3.210.197 TCP 64 [TCP Dup ACK 975264#2] 62765 > http [ACK] Seq=2100 Ack=97917 Win=65535 Len=0
975830 324.910092 198.98.203.213 -> 244.3.210.197 TCP 64 62765 > http [ACK] Seq=2100 Ack=100837 Win=65535 Len=0
975836 324.911304 198.98.203.213 -> 244.3.210.197 TCP 64 62765 > http [ACK] Seq=2100 Ack=102297 Win=65535 Len=0
975843 324.919269 198.98.203.213 -> 244.3.210.197 TCP 64 62765 > http [ACK] Seq=2100 Ack=103757 Win=65535 Len=0
976281 325.171572 198.98.203.213 -> 244.3.210.197 TCP 64 62765 > http [ACK] Seq=2100 Ack=106677 Win=65535 Len=0
976733 325.436539 198.98.203.213 -> 244.3.210.197 TCP 64 62765 > http [ACK] Seq=2100 Ack=109597 Win=65535 Len=0
976773 325.442758 198.98.203.213 -> 244.3.210.197 TCP 64 62765 > http [ACK] Seq=2100 Ack=111057 Win=65535 Len=0
978396 325.914034 198.98.203.213 -> 244.3.210.197 TCP 64 62765 > http [ACK] Seq=2100 Ack=112517 Win=65535 Len=0
980595 327.222277 198.98.203.213 -> 244.3.210.197 TCP 64 62765 > http [ACK] Seq=2100 Ack=112564 Win=65488 Len=0
981006 327.523571 198.98.203.213 -> 244.3.210.197 TCP 64 44079 > http [ACK] Seq=848 Ack=11842 Win=65535 Len=0
981222 327.721872 198.98.203.213 -> 244.3.210.197 TCP 64 44079 > http [ACK] Seq=848 Ack=14762 Win=65535 Len=0
981459 327.888935 198.98.203.213 -> 244.3.210.197 TCP 64 44079 > http [ACK] Seq=848 Ack=17682 Win=65535 Len=0
981888 328.087441 198.98.203.213 -> 244.3.210.197 TCP 64 44079 > http [ACK] Seq=848 Ack=19142 Win=65535 Len=0
981903 328.092129 198.98.203.213 -> 244.3.210.197 TCP 64 44079 > http [ACK] Seq=848 Ack=21051 Win=65535 Len=0
982444 328.307927 198.98.203.213 -> 244.3.210.197 TCP 64 39575 > http [ACK] Seq=1694 Ack=25756 Win=65535 Len=0
982836 328.429413 198.98.203.213 -> 244.3.210.197 TCP 64 46880 > http [ACK] Seq=843 Ack=134855 Win=65001 Len=0
983382 328.533149 198.98.203.213 -> 244.3.210.197 TCP 64 52701 > http [ACK] Seq=3851 Ack=89048 Win=65535 Len=0
983404 328.538356 198.98.203.213 -> 244.3.210.197 TCP 64 52701 > http [ACK] Seq=3851 Ack=90508 Win=65535 Len=0
983479 328.546427 198.98.203.213 -> 244.3.210.197 TCP 64 52701 > http [ACK] Seq=3851 Ack=93428 Win=65535 Len=0
983506 328.549466 198.98.203.213 -> 244.3.210.197 TCP 64 52701 > http [ACK] Seq=3851 Ack=94888 Win=65535 Len=0
983637 328.557889 198.98.203.213 -> 244.3.210.197 TCP 64 52701 > http [ACK] Seq=3851 Ack=97808 Win=65535 Len=0
983682 328.562462 198.98.203.213 -> 244.3.210.197 TCP 64 52701 > http [ACK] Seq=3851 Ack=99268 Win=65535 Len=0
983769 328.570816 198.98.203.213 -> 244.3.210.197 TCP 64 52701 > http [ACK] Seq=3851 Ack=102188 Win=65535 Len=0
983817 328.573705 198.98.203.213 -> 244.3.210.197 TCP 64 52701 > http [ACK] Seq=3851 Ack=103648 Win=65535 Len=0
983867 328.581289 198.98.203.213 -> 244.3.210.197 TCP 64 52701 > http [ACK] Seq=3851 Ack=106568 Win=65535 Len=0
984020 328.594648 198.98.203.213 -> 244.3.210.197 TCP 64 62765 > http [ACK] Seq=2559 Ack=115484 Win=65535 Len=0
984629 328.764022 198.98.203.213 -> 244.3.210.197 TCP 64 44079 > http [ACK] Seq=1328 Ack=23971 Win=65535 Len=0
984643 328.764462 198.98.203.213 -> 244.3.210.197 TCP 64 44079 > http [ACK] Seq=1328 Ack=25431 Win=65535 Len=0
984681 328.769446 198.98.203.213 -> 244.3.210.197 TCP 64 39575 > http [ACK] Seq=2172 Ack=27849 Win=65535 Len=0
984698 328.773607 198.98.203.213 -> 244.3.210.197 TCP 64 46880 > http [ACK] Seq=1321 Ack=136943 Win=65535 Len=0
984755 328.780881 198.98.203.213 -> 244.3.210.197 TCP 64 64025 > http [ACK] Seq=2610 Ack=85138 Win=65535 Len=0
984800 328.792417 198.98.203.213 -> 244.3.210.197 TCP 64 52701 > http [ACK] Seq=3851 Ack=108028 Win=65535 Len=0
984897 328.800690 198.98.203.213 -> 244.3.210.197 TCP 64 52701 > http [ACK] Seq=3851 Ack=110948 Win=65535 Len=0
984938 328.808301 198.98.203.213 -> 244.3.210.197 TCP 64 52701 > http [ACK] Seq=3851 Ack=112250 Win=64233 Len=0
985005 328.815916 198.98.203.213 -> 244.3.210.197 TCP 64 62765 > http [ACK] Seq=2559 Ack=116944 Win=65535 Len=0
985044 328.823948 198.98.203.213 -> 244.3.210.197 TCP 64 62765 > http [ACK] Seq=2559 Ack=119864 Win=65535 Len=0
985358 328.990092 198.98.203.213 -> 244.3.210.197 TCP 64 44079 > http [ACK] Seq=1806 Ack=27823 Win=65535 Len=0
985369 328.994727 198.98.203.213 -> 244.3.210.197 TCP 64 39575 > http [ACK] Seq=2650 Ack=30189 Win=65535 Len=0
985431 329.002866 198.98.203.213 -> 244.3.210.197 TCP 64 46880 > http [ACK] Seq=1799 Ack=139021 Win=65535 Len=0
985443 329.018601 198.98.203.213 -> 244.3.210.197 TCP 64 64025 > http [ACK] Seq=3063 Ack=88058 Win=65535 Len=0
985490 329.026849 198.98.203.213 -> 244.3.210.197 TCP 64 64025 > http [ACK] Seq=3063 Ack=89518 Win=65535 Len=0
985509 329.037565 198.98.203.213 -> 244.3.210.197 TCP 64 62765 > http [ACK] Seq=2559 Ack=121324 Win=65535 Len=0
985538 329.045505 198.98.203.213 -> 244.3.210.197 TCP 64 62765 > http [ACK] Seq=2559 Ack=124244 Win=65535 Len=0
985817 329.132907 198.98.203.213 -> 244.3.210.197 TCP 64 64025 > http [ACK] Seq=3063 Ack=89706 Win=65347 Len=0
986267 329.234155 198.98.203.213 -> 244.3.210.197 TCP 64 52701 > http [ACK] Seq=4302 Ack=112589 Win=65535 Len=0
986460 329.264285 198.98.203.213 -> 244.3.210.197 TCP 64 62765 > http [ACK] Seq=2559 Ack=125704 Win=65535 Len=0
987513 329.435439 198.98.203.213 -> 244.3.210.197 TCP 64 62765 > http [ACK] Seq=2559 Ack=126699 Win=64540 Len=0
995767 332.398195 198.98.203.213 -> 244.3.210.197 TCP 64 44079 > http [ACK] Seq=2266 Ack=30743 Win=65535 Len=0
996060 332.554134 198.98.203.213 -> 244.3.210.197 TCP 64 44079 > http [ACK] Seq=2266 Ack=30853 Win=65425 Len=0
1007690 337.459183 198.98.203.213 -> 244.3.210.197 TCP 64 39575 > http [ACK] Seq=3242 Ack=31849 Win=65535 Len=0
