2971   0.971352 198.177.110.202 -> 41.177.26.22 TCP 66 52860 > http [SYN] Seq=0 Win=64240 Len=0 MSS=1460 SACK_PERM=1
3091   1.037314 198.177.110.202 -> 41.177.26.22 TCP 64 52860 > http [ACK] Seq=1 Ack=1 Win=64240 Len=0
4341   1.298778 198.177.110.202 -> 41.177.26.22 TCP 64 52860 > http [ACK] Seq=199 Ack=774 Win=63467 Len=0
38935  16.111908 198.177.110.202 -> 41.177.26.22 TCP 64 52860 > http [ACK] Seq=199 Ack=775 Win=63467 Len=0
300321 101.246901 198.177.110.202 -> 41.177.26.22 TCP 64 52860 > http [FIN, ACK] Seq=199 Ack=775 Win=63467 Len=0
327812 113.389695 198.177.110.202 -> 41.177.26.22 TCP 66 53891 > http [SYN] Seq=0 Win=64240 Len=0 MSS=1460 SACK_PERM=1
327867 113.455470 198.177.110.202 -> 41.177.26.22 TCP 64 53891 > http [ACK] Seq=1 Ack=1 Win=64240 Len=0
328156 113.667835 198.177.110.202 -> 41.177.26.22 TCP 64 53891 > http [ACK] Seq=199 Ack=774 Win=63467 Len=0
386461 128.531798 198.177.110.202 -> 41.177.26.22 TCP 64 53891 > http [ACK] Seq=199 Ack=775 Win=63467 Len=0
681607 213.657413 198.177.110.202 -> 41.177.26.22 TCP 64 53891 > http [FIN, ACK] Seq=199 Ack=775 Win=63467 Len=0
744858 238.107124 198.177.110.202 -> 41.177.26.22 TCP 66 55026 > http [SYN] Seq=0 Win=64240 Len=0 MSS=1460 SACK_PERM=1
745055 238.172684 198.177.110.202 -> 41.177.26.22 TCP 64 55026 > http [ACK] Seq=1 Ack=1 Win=64240 Len=0
745721 238.389379 198.177.110.202 -> 41.177.26.22 TCP 64 55026 > http [ACK] Seq=199 Ack=774 Win=63467 Len=0
782541 253.251522 198.177.110.202 -> 41.177.26.22 TCP 64 55026 > http [ACK] Seq=199 Ack=775 Win=63467 Len=0
1009386 338.359613 198.177.110.202 -> 41.177.26.22 TCP 64 55026 > http [FIN, ACK] Seq=199 Ack=775 Win=63467 Len=0
