415520 138.615001 203.61.186.165 -> 244.3.160.239 TCP 66 12586 > http [SYN] Seq=0 Win=65535 Len=0 MSS=1380 SACK_PERM=1
415780 138.676067 203.61.186.165 -> 244.3.160.239 TCP 64 12586 > http [ACK] Seq=1 Ack=1 Win=65535 Len=0
422787 139.338889 203.61.186.165 -> 244.3.160.239 TCP 64 12586 > http [ACK] Seq=763 Ack=1634 Win=65535 Len=0
423643 139.396232 203.61.186.165 -> 244.3.160.239 TCP 64 12586 > http [ACK] Seq=763 Ack=4394 Win=65535 Len=0
423654 139.396599 203.61.186.165 -> 244.3.160.239 TCP 64 12586 > http [ACK] Seq=763 Ack=5780 Win=65535 Len=0
423971 139.452931 203.61.186.165 -> 244.3.160.239 TCP 64 12586 > http [ACK] Seq=763 Ack=7160 Win=65535 Len=0
423972 139.452935 203.61.186.165 -> 244.3.160.239 TCP 64 12586 > http [ACK] Seq=763 Ack=8700 Win=65535 Len=0
423974 139.453118 203.61.186.165 -> 244.3.160.239 TCP 64 12586 > http [ACK] Seq=763 Ack=10240 Win=65535 Len=0
423982 139.453706 203.61.186.165 -> 244.3.160.239 TCP 64 12586 > http [ACK] Seq=763 Ack=11620 Win=65535 Len=0
423994 139.454125 203.61.186.165 -> 244.3.160.239 TCP 64 12586 > http [ACK] Seq=763 Ack=13000 Win=65535 Len=0
424685 139.509763 203.61.186.165 -> 244.3.160.239 TCP 64 12586 > http [ACK] Seq=763 Ack=15760 Win=65535 Len=0
424687 139.509980 203.61.186.165 -> 244.3.160.239 TCP 64 12586 > http [ACK] Seq=763 Ack=17460 Win=65535 Len=0
424706 139.510848 203.61.186.165 -> 244.3.160.239 TCP 64 12586 > http [ACK] Seq=763 Ack=20220 Win=65535 Len=0
424710 139.511147 203.61.186.165 -> 244.3.160.239 TCP 64 12586 > http [ACK] Seq=763 Ack=21600 Win=64155 Len=0
424712 139.511279 203.61.186.165 -> 244.3.160.239 TCP 64 12586 > http [ACK] Seq=763 Ack=23380 Win=62375 Len=0
424731 139.512755 203.61.186.165 -> 244.3.160.239 TCP 64 12586 > http [ACK] Seq=763 Ack=26140 Win=59615 Len=0
424739 139.513627 203.61.186.165 -> 244.3.160.239 TCP 64 12586 > http [ACK] Seq=763 Ack=27520 Win=65535 Len=0
424934 139.567004 203.61.186.165 -> 244.3.160.239 TCP 64 12586 > http [ACK] Seq=763 Ack=30280 Win=65535 Len=0
424935 139.567037 203.61.186.165 -> 244.3.160.239 TCP 64 12586 > http [ACK] Seq=763 Ack=31660 Win=65535 Len=0
424942 139.567504 203.61.186.165 -> 244.3.160.239 TCP 64 12586 > http [ACK] Seq=763 Ack=34420 Win=65535 Len=0
424944 139.567619 203.61.186.165 -> 244.3.160.239 TCP 64 12586 > http [ACK] Seq=763 Ack=35800 Win=65535 Len=0
424952 139.568009 203.61.186.165 -> 244.3.160.239 TCP 64 12586 > http [ACK] Seq=763 Ack=38560 Win=62775 Len=0
424972 139.568722 203.61.186.165 -> 244.3.160.239 TCP 64 12586 > http [ACK] Seq=763 Ack=41144 Win=60191 Len=0
424999 139.569376 203.61.186.165 -> 244.3.160.239 TCP 64 12586 > http [ACK] Seq=763 Ack=43904 Win=57431 Len=0
425009 139.569915 203.61.186.165 -> 244.3.160.239 TCP 64 12586 > http [ACK] Seq=763 Ack=46664 Win=54671 Len=0
425021 139.570376 203.61.186.165 -> 244.3.160.239 TCP 64 12586 > http [ACK] Seq=763 Ack=49424 Win=51911 Len=0
425031 139.571120 203.61.186.165 -> 244.3.160.239 TCP 64 [TCP Window Update] 12586 > http [ACK] Seq=763 Ack=49424 Win=65535 Len=0
425037 139.571907 203.61.186.165 -> 244.3.160.239 TCP 64 12586 > http [ACK] Seq=763 Ack=52184 Win=62775 Len=0
425087 139.582819 203.61.186.165 -> 244.3.160.239 TCP 64 [TCP Window Update] 12586 > http [ACK] Seq=763 Ack=52184 Win=65535 Len=0
425183 139.623795 203.61.186.165 -> 244.3.160.239 TCP 64 12586 > http [ACK] Seq=763 Ack=54944 Win=65535 Len=0
425185 139.624092 203.61.186.165 -> 244.3.160.239 TCP 64 12586 > http [ACK] Seq=763 Ack=56148 Win=64331 Len=0
425188 139.624370 203.61.186.165 -> 244.3.160.239 TCP 64 12586 > http [ACK] Seq=763 Ack=58908 Win=65535 Len=0
425192 139.624715 203.61.186.165 -> 244.3.160.239 TCP 64 12586 > http [ACK] Seq=763 Ack=60288 Win=65535 Len=0
425198 139.625714 203.61.186.165 -> 244.3.160.239 TCP 64 12586 > http [ACK] Seq=763 Ack=63048 Win=65535 Len=0
425199 139.625719 203.61.186.165 -> 244.3.160.239 TCP 64 12586 > http [ACK] Seq=763 Ack=64428 Win=64155 Len=0
425200 139.625800 203.61.186.165 -> 244.3.160.239 TCP 64 12586 > http [ACK] Seq=763 Ack=67188 Win=61395 Len=0
425205 139.626224 203.61.186.165 -> 244.3.160.239 TCP 64 12586 > http [ACK] Seq=763 Ack=68568 Win=64775 Len=0
425209 139.626513 203.61.186.165 -> 244.3.160.239 TCP 64 12586 > http [ACK] Seq=763 Ack=71328 Win=65535 Len=0
425215 139.626909 203.61.186.165 -> 244.3.160.239 TCP 64 12586 > http [ACK] Seq=763 Ack=72708 Win=64155 Len=0
425221 139.627528 203.61.186.165 -> 244.3.160.239 TCP 64 12586 > http [ACK] Seq=763 Ack=75468 Win=61395 Len=0
425224 139.627853 203.61.186.165 -> 244.3.160.239 TCP 64 12586 > http [ACK] Seq=763 Ack=78228 Win=58635 Len=0
425230 139.628754 203.61.186.165 -> 244.3.160.239 TCP 64 12586 > http [ACK] Seq=763 Ack=80988 Win=55875 Len=0
425233 139.629144 203.61.186.165 -> 244.3.160.239 TCP 64 12586 > http [ACK] Seq=763 Ack=83748 Win=53115 Len=0
425242 139.629746 203.61.186.165 -> 244.3.160.239 TCP 64 12586 > http [ACK] Seq=763 Ack=86508 Win=50355 Len=0
425243 139.630395 203.61.186.165 -> 244.3.160.239 TCP 64 12586 > http [ACK] Seq=763 Ack=89268 Win=47595 Len=0
425258 139.634878 203.61.186.165 -> 244.3.160.239 TCP 64 12586 > http [ACK] Seq=763 Ack=90648 Win=65535 Len=0
425466 139.680150 203.61.186.165 -> 244.3.160.239 TCP 64 12586 > http [ACK] Seq=763 Ack=93232 Win=65535 Len=0
425471 139.680696 203.61.186.165 -> 244.3.160.239 TCP 64 12586 > http [ACK] Seq=763 Ack=94612 Win=65535 Len=0
425472 139.680906 203.61.186.165 -> 244.3.160.239 TCP 64 12586 > http [ACK] Seq=763 Ack=97372 Win=65535 Len=0
425477 139.681554 203.61.186.165 -> 244.3.160.239 TCP 64 12586 > http [ACK] Seq=763 Ack=98752 Win=65535 Len=0
425478 139.681827 203.61.186.165 -> 244.3.160.239 TCP 64 12586 > http [ACK] Seq=763 Ack=101512 Win=65535 Len=0
425479 139.682381 203.61.186.165 -> 244.3.160.239 TCP 64 12586 > http [ACK] Seq=763 Ack=102892 Win=65535 Len=0
425480 139.682711 203.61.186.165 -> 244.3.160.239 TCP 64 12586 > http [ACK] Seq=763 Ack=105652 Win=62775 Len=0
425481 139.683307 203.61.186.165 -> 244.3.160.239 TCP 64 12586 > http [ACK] Seq=763 Ack=108236 Win=60191 Len=0
425482 139.684240 203.61.186.165 -> 244.3.160.239 TCP 64 12586 > http [ACK] Seq=763 Ack=110996 Win=57431 Len=0
425483 139.684808 203.61.186.165 -> 244.3.160.239 TCP 64 12586 > http [ACK] Seq=763 Ack=113756 Win=54671 Len=0
425486 139.685351 203.61.186.165 -> 244.3.160.239 TCP 64 12586 > http [ACK] Seq=763 Ack=116516 Win=51911 Len=0
425487 139.685698 203.61.186.165 -> 244.3.160.239 TCP 64 12586 > http [ACK] Seq=763 Ack=119276 Win=49151 Len=0
425488 139.685811 203.61.186.165 -> 244.3.160.239 TCP 64 12586 > http [ACK] Seq=763 Ack=122036 Win=46391 Len=0
425490 139.686751 203.61.186.165 -> 244.3.160.239 TCP 64 12586 > http [ACK] Seq=763 Ack=124796 Win=43631 Len=0
425491 139.687168 203.61.186.165 -> 244.3.160.239 TCP 64 12586 > http [ACK] Seq=763 Ack=127556 Win=40871 Len=0
425503 139.687678 203.61.186.165 -> 244.3.160.239 TCP 64 12586 > http [ACK] Seq=763 Ack=130316 Win=38111 Len=0
425504 139.688171 203.61.186.165 -> 244.3.160.239 TCP 64 12586 > http [ACK] Seq=763 Ack=133076 Win=35351 Len=0
425507 139.688786 203.61.186.165 -> 244.3.160.239 TCP 64 12586 > http [ACK] Seq=763 Ack=135836 Win=32591 Len=0
425513 139.692066 203.61.186.165 -> 244.3.160.239 TCP 64 12586 > http [ACK] Seq=763 Ack=137260 Win=31167 Len=0
425516 139.692486 203.61.186.165 -> 244.3.160.239 TCP 64 [TCP Window Update] 12586 > http [ACK] Seq=763 Ack=137260 Win=65535 Len=0
425629 139.712571 203.61.186.165 -> 244.3.160.239 TCP 64 12586 > http [ACK] Seq=763 Ack=140020 Win=65535 Len=0
425630 139.712920 203.61.186.165 -> 244.3.160.239 TCP 64 12586 > http [ACK] Seq=763 Ack=142780 Win=65535 Len=0
425631 139.713637 203.61.186.165 -> 244.3.160.239 TCP 64 12586 > http [ACK] Seq=763 Ack=145540 Win=65535 Len=0
425632 139.714277 203.61.186.165 -> 244.3.160.239 TCP 64 12586 > http [ACK] Seq=763 Ack=148300 Win=62775 Len=0
425648 139.719417 203.61.186.165 -> 244.3.160.239 TCP 64 12586 > http [ACK] Seq=763 Ack=148940 Win=65535 Len=0
425699 139.722083 203.61.186.165 -> 244.3.160.239 TCP 64 12586 > http [ACK] Seq=763 Ack=151700 Win=65535 Len=0
425765 139.736626 203.61.186.165 -> 244.3.160.239 TCP 64 12586 > http [ACK] Seq=763 Ack=154460 Win=65535 Len=0
425771 139.737302 203.61.186.165 -> 244.3.160.239 TCP 64 12586 > http [ACK] Seq=763 Ack=155840 Win=65535 Len=0
425773 139.737847 203.61.186.165 -> 244.3.160.239 TCP 64 12586 > http [ACK] Seq=763 Ack=158600 Win=65535 Len=0
425775 139.738249 203.61.186.165 -> 244.3.160.239 TCP 64 12586 > http [ACK] Seq=763 Ack=159980 Win=65535 Len=0
425843 139.751869 203.61.186.165 -> 244.3.160.239 TCP 64 12586 > http [ACK] Seq=763 Ack=162000 Win=65535 Len=0
425846 139.752638 203.61.186.165 -> 244.3.160.239 TCP 64 12586 > http [ACK] Seq=763 Ack=164760 Win=65535 Len=0
425847 139.752993 203.61.186.165 -> 244.3.160.239 TCP 64 12586 > http [ACK] Seq=763 Ack=167520 Win=65535 Len=0
425852 139.753749 203.61.186.165 -> 244.3.160.239 TCP 64 12586 > http [ACK] Seq=763 Ack=170280 Win=64155 Len=0
425853 139.754195 203.61.186.165 -> 244.3.160.239 TCP 64 12586 > http [ACK] Seq=763 Ack=172300 Win=62135 Len=0
425854 139.756320 203.61.186.165 -> 244.3.160.239 TCP 64 [TCP Window Update] 12586 > http [ACK] Seq=763 Ack=172300 Win=65535 Len=0
425870 139.762222 203.61.186.165 -> 244.3.160.239 TCP 64 12586 > http [ACK] Seq=763 Ack=175060 Win=65535 Len=0
425874 139.762805 203.61.186.165 -> 244.3.160.239 TCP 64 12586 > http [ACK] Seq=763 Ack=177820 Win=65535 Len=0
425878 139.763558 203.61.186.165 -> 244.3.160.239 TCP 64 12586 > http [ACK] Seq=763 Ack=180580 Win=65535 Len=0
425881 139.763955 203.61.186.165 -> 244.3.160.239 TCP 64 12586 > http [ACK] Seq=763 Ack=183340 Win=62775 Len=0
425898 139.769972 203.61.186.165 -> 244.3.160.239 TCP 64 12586 > http [ACK] Seq=763 Ack=183980 Win=65535 Len=0
426054 139.792020 203.61.186.165 -> 244.3.160.239 TCP 64 12586 > http [ACK] Seq=763 Ack=186740 Win=65535 Len=0
426058 139.792998 203.61.186.165 -> 244.3.160.239 TCP 64 12586 > http [ACK] Seq=763 Ack=189500 Win=65535 Len=0
426063 139.793739 203.61.186.165 -> 244.3.160.239 TCP 64 12586 > http [ACK] Seq=763 Ack=192260 Win=65535 Len=0
426066 139.794622 203.61.186.165 -> 244.3.160.239 TCP 64 12586 > http [ACK] Seq=763 Ack=195020 Win=65535 Len=0
426183 139.803055 203.61.186.165 -> 244.3.160.239 TCP 64 12586 > http [ACK] Seq=763 Ack=197040 Win=65535 Len=0
426199 139.804557 203.61.186.165 -> 244.3.160.239 TCP 64 12586 > http [ACK] Seq=763 Ack=199800 Win=65535 Len=0
426200 139.804755 203.61.186.165 -> 244.3.160.239 TCP 64 12586 > http [ACK] Seq=763 Ack=202560 Win=65535 Len=0
426206 139.805752 203.61.186.165 -> 244.3.160.239 TCP 64 12586 > http [ACK] Seq=763 Ack=205320 Win=64155 Len=0
426212 139.807521 203.61.186.165 -> 244.3.160.239 TCP 64 12586 > http [ACK] Seq=763 Ack=207340 Win=62135 Len=0
426252 139.811309 203.61.186.165 -> 244.3.160.239 TCP 64 [TCP Window Update] 12586 > http [ACK] Seq=763 Ack=207340 Win=65535 Len=0
426359 139.831934 203.61.186.165 -> 244.3.160.239 TCP 64 12586 > http [ACK] Seq=763 Ack=210100 Win=65535 Len=0
426361 139.833047 203.61.186.165 -> 244.3.160.239 TCP 64 12586 > http [ACK] Seq=763 Ack=212860 Win=65535 Len=0
426362 139.833796 203.61.186.165 -> 244.3.160.239 TCP 64 12586 > http [ACK] Seq=763 Ack=215620 Win=65535 Len=0
426363 139.834207 203.61.186.165 -> 244.3.160.239 TCP 64 12586 > http [ACK] Seq=763 Ack=218380 Win=65535 Len=0
426398 139.842570 203.61.186.165 -> 244.3.160.239 TCP 64 12586 > http [ACK] Seq=763 Ack=220400 Win=63515 Len=0
426399 139.842690 203.61.186.165 -> 244.3.160.239 TCP 64 12586 > http [ACK] Seq=763 Ack=223160 Win=60755 Len=0
426400 139.843453 203.61.186.165 -> 244.3.160.239 TCP 64 12586 > http [ACK] Seq=763 Ack=225920 Win=57995 Len=0
426401 139.843457 203.61.186.165 -> 244.3.160.239 TCP 64 [TCP Window Update] 12586 > http [ACK] Seq=763 Ack=225920 Win=65535 Len=0
426402 139.843875 203.61.186.165 -> 244.3.160.239 TCP 64 12586 > http [ACK] Seq=763 Ack=228680 Win=64155 Len=0
426403 139.844224 203.61.186.165 -> 244.3.160.239 TCP 64 12586 > http [ACK] Seq=763 Ack=230700 Win=62135 Len=0
426412 139.849728 203.61.186.165 -> 244.3.160.239 TCP 64 [TCP Window Update] 12586 > http [ACK] Seq=763 Ack=230700 Win=65535 Len=0
426567 139.873361 203.61.186.165 -> 244.3.160.239 TCP 64 12586 > http [ACK] Seq=763 Ack=233460 Win=65535 Len=0
426572 139.874464 203.61.186.165 -> 244.3.160.239 TCP 64 12586 > http [ACK] Seq=763 Ack=236220 Win=65535 Len=0
426573 139.875027 203.61.186.165 -> 244.3.160.239 TCP 64 12586 > http [ACK] Seq=763 Ack=238980 Win=65535 Len=0
426574 139.875032 203.61.186.165 -> 244.3.160.239 TCP 64 12586 > http [ACK] Seq=763 Ack=241740 Win=65535 Len=0
426617 139.882515 203.61.186.165 -> 244.3.160.239 TCP 64 12586 > http [ACK] Seq=763 Ack=243760 Win=65535 Len=0
426620 139.883348 203.61.186.165 -> 244.3.160.239 TCP 64 12586 > http [ACK] Seq=763 Ack=246520 Win=65535 Len=0
426621 139.883909 203.61.186.165 -> 244.3.160.239 TCP 64 12586 > http [ACK] Seq=763 Ack=249280 Win=65535 Len=0
426622 139.884850 203.61.186.165 -> 244.3.160.239 TCP 64 12586 > http [ACK] Seq=763 Ack=252040 Win=64155 Len=0
426623 139.885174 203.61.186.165 -> 244.3.160.239 TCP 64 12586 > http [ACK] Seq=763 Ack=254060 Win=62135 Len=0
426650 139.890237 203.61.186.165 -> 244.3.160.239 TCP 64 [TCP Window Update] 12586 > http [ACK] Seq=763 Ack=254060 Win=65535 Len=0
426740 139.911921 203.61.186.165 -> 244.3.160.239 TCP 64 12586 > http [ACK] Seq=763 Ack=256820 Win=65535 Len=0
426741 139.912575 203.61.186.165 -> 244.3.160.239 TCP 64 12586 > http [ACK] Seq=763 Ack=259580 Win=65535 Len=0
426742 139.912580 203.61.186.165 -> 244.3.160.239 TCP 64 12586 > http [ACK] Seq=763 Ack=262340 Win=65535 Len=0
426743 139.913077 203.61.186.165 -> 244.3.160.239 TCP 64 12586 > http [ACK] Seq=763 Ack=265100 Win=65535 Len=0
426781 139.922841 203.61.186.165 -> 244.3.160.239 TCP 64 12586 > http [ACK] Seq=763 Ack=267120 Win=65535 Len=0
426784 139.923247 203.61.186.165 -> 244.3.160.239 TCP 64 12586 > http [ACK] Seq=763 Ack=269880 Win=65535 Len=0
426787 139.924012 203.61.186.165 -> 244.3.160.239 TCP 64 12586 > http [ACK] Seq=763 Ack=272640 Win=65535 Len=0
426788 139.924209 203.61.186.165 -> 244.3.160.239 TCP 64 12586 > http [ACK] Seq=763 Ack=275400 Win=64155 Len=0
426789 139.924740 203.61.186.165 -> 244.3.160.239 TCP 64 12586 > http [ACK] Seq=763 Ack=277420 Win=62135 Len=0
426823 139.933112 203.61.186.165 -> 244.3.160.239 TCP 64 [TCP Window Update] 12586 > http [ACK] Seq=763 Ack=277420 Win=65535 Len=0
426962 139.951760 203.61.186.165 -> 244.3.160.239 TCP 64 12586 > http [ACK] Seq=763 Ack=280180 Win=65535 Len=0
426964 139.952172 203.61.186.165 -> 244.3.160.239 TCP 64 12586 > http [ACK] Seq=763 Ack=282940 Win=65535 Len=0
426965 139.952662 203.61.186.165 -> 244.3.160.239 TCP 64 12586 > http [ACK] Seq=763 Ack=285700 Win=65535 Len=0
426966 139.953506 203.61.186.165 -> 244.3.160.239 TCP 64 12586 > http [ACK] Seq=763 Ack=288460 Win=65535 Len=0
427026 139.964654 203.61.186.165 -> 244.3.160.239 TCP 64 12586 > http [ACK] Seq=763 Ack=290480 Win=65535 Len=0
427027 139.964659 203.61.186.165 -> 244.3.160.239 TCP 64 12586 > http [ACK] Seq=763 Ack=293240 Win=65535 Len=0
427028 139.965006 203.61.186.165 -> 244.3.160.239 TCP 64 12586 > http [ACK] Seq=763 Ack=296000 Win=65535 Len=0
427036 139.966016 203.61.186.165 -> 244.3.160.239 TCP 64 12586 > http [ACK] Seq=763 Ack=298760 Win=64155 Len=0
427037 139.966021 203.61.186.165 -> 244.3.160.239 TCP 64 12586 > http [ACK] Seq=763 Ack=300780 Win=62135 Len=0
427052 139.969555 203.61.186.165 -> 244.3.160.239 TCP 64 [TCP Window Update] 12586 > http [ACK] Seq=763 Ack=300780 Win=65535 Len=0
427137 139.992682 203.61.186.165 -> 244.3.160.239 TCP 64 12586 > http [ACK] Seq=763 Ack=303540 Win=65535 Len=0
427141 139.993015 203.61.186.165 -> 244.3.160.239 TCP 64 12586 > http [ACK] Seq=763 Ack=306300 Win=65535 Len=0
427145 139.994130 203.61.186.165 -> 244.3.160.239 TCP 64 12586 > http [ACK] Seq=763 Ack=309060 Win=65535 Len=0
427153 139.994526 203.61.186.165 -> 244.3.160.239 TCP 64 12586 > http [ACK] Seq=763 Ack=311820 Win=65535 Len=0
427228 140.004133 203.61.186.165 -> 244.3.160.239 TCP 64 12586 > http [ACK] Seq=763 Ack=313840 Win=65535 Len=0
427231 140.004412 203.61.186.165 -> 244.3.160.239 TCP 64 12586 > http [ACK] Seq=763 Ack=316600 Win=65535 Len=0
427253 140.005072 203.61.186.165 -> 244.3.160.239 TCP 64 12586 > http [ACK] Seq=763 Ack=319360 Win=65535 Len=0
427267 140.005703 203.61.186.165 -> 244.3.160.239 TCP 64 12586 > http [ACK] Seq=763 Ack=322120 Win=64155 Len=0
427268 140.005969 203.61.186.165 -> 244.3.160.239 TCP 64 12586 > http [ACK] Seq=763 Ack=324140 Win=62135 Len=0
427300 140.013355 203.61.186.165 -> 244.3.160.239 TCP 64 [TCP Window Update] 12586 > http [ACK] Seq=763 Ack=324140 Win=65535 Len=0
427483 140.031509 203.61.186.165 -> 244.3.160.239 TCP 64 12586 > http [ACK] Seq=763 Ack=326900 Win=65535 Len=0
427491 140.031903 203.61.186.165 -> 244.3.160.239 TCP 64 12586 > http [ACK] Seq=763 Ack=329660 Win=65535 Len=0
427504 140.032343 203.61.186.165 -> 244.3.160.239 TCP 64 12586 > http [ACK] Seq=763 Ack=332420 Win=62775 Len=0
427522 140.033164 203.61.186.165 -> 244.3.160.239 TCP 64 12586 > http [ACK] Seq=763 Ack=335180 Win=60015 Len=0
427579 140.043589 203.61.186.165 -> 244.3.160.239 TCP 64 12586 > http [ACK] Seq=763 Ack=337200 Win=57995 Len=0
427598 140.044745 203.61.186.165 -> 244.3.160.239 TCP 64 12586 > http [ACK] Seq=763 Ack=339960 Win=55235 Len=0
427604 140.045692 203.61.186.165 -> 244.3.160.239 TCP 64 12586 > http [ACK] Seq=763 Ack=342720 Win=52475 Len=0
427605 140.046988 203.61.186.165 -> 244.3.160.239 TCP 64 12586 > http [ACK] Seq=763 Ack=345480 Win=49715 Len=0
427606 140.047058 203.61.186.165 -> 244.3.160.239 TCP 64 12586 > http [ACK] Seq=763 Ack=347500 Win=47695 Len=0
427779 140.075686 203.61.186.165 -> 244.3.160.239 TCP 64 12586 > http [ACK] Seq=763 Ack=350260 Win=44935 Len=0
427781 140.076120 203.61.186.165 -> 244.3.160.239 TCP 64 12586 > http [ACK] Seq=763 Ack=353020 Win=42175 Len=0
427784 140.076807 203.61.186.165 -> 244.3.160.239 TCP 64 12586 > http [ACK] Seq=763 Ack=355780 Win=39415 Len=0
427786 140.077266 203.61.186.165 -> 244.3.160.239 TCP 64 12586 > http [ACK] Seq=763 Ack=358540 Win=36655 Len=0
427823 140.084258 203.61.186.165 -> 244.3.160.239 TCP 64 12586 > http [ACK] Seq=763 Ack=360560 Win=34635 Len=0
427828 140.084842 203.61.186.165 -> 244.3.160.239 TCP 64 12586 > http [ACK] Seq=763 Ack=363320 Win=31875 Len=0
427829 140.085192 203.61.186.165 -> 244.3.160.239 TCP 64 12586 > http [ACK] Seq=763 Ack=366080 Win=29115 Len=0
427831 140.085772 203.61.186.165 -> 244.3.160.239 TCP 64 12586 > http [ACK] Seq=763 Ack=368840 Win=26355 Len=0
427832 140.086081 203.61.186.165 -> 244.3.160.239 TCP 64 12586 > http [ACK] Seq=763 Ack=370860 Win=24335 Len=0
427957 140.111919 203.61.186.165 -> 244.3.160.239 TCP 64 12586 > http [ACK] Seq=763 Ack=373620 Win=21575 Len=0
427968 140.112319 203.61.186.165 -> 244.3.160.239 TCP 64 12586 > http [ACK] Seq=763 Ack=376380 Win=18815 Len=0
427974 140.112907 203.61.186.165 -> 244.3.160.239 TCP 64 12586 > http [ACK] Seq=763 Ack=379140 Win=16055 Len=0
427986 140.113221 203.61.186.165 -> 244.3.160.239 TCP 64 12586 > http [ACK] Seq=763 Ack=381900 Win=13295 Len=0
427998 140.114242 203.61.186.165 -> 244.3.160.239 TCP 64 12586 > http [ACK] Seq=763 Ack=382540 Win=65535 Len=0
428056 140.124557 203.61.186.165 -> 244.3.160.239 TCP 64 12586 > http [ACK] Seq=763 Ack=385300 Win=62775 Len=0
428057 140.125422 203.61.186.165 -> 244.3.160.239 TCP 64 12586 > http [ACK] Seq=763 Ack=388060 Win=60015 Len=0
428058 140.125792 203.61.186.165 -> 244.3.160.239 TCP 64 12586 > http [ACK] Seq=763 Ack=390820 Win=57255 Len=0
428059 140.126264 203.61.186.165 -> 244.3.160.239 TCP 64 12586 > http [ACK] Seq=763 Ack=393580 Win=54495 Len=0
428060 140.129530 203.61.186.165 -> 244.3.160.239 TCP 64 12586 > http [ACK] Seq=763 Ack=394220 Win=65535 Len=0
428198 140.171926 203.61.186.165 -> 244.3.160.239 TCP 64 12586 > http [ACK] Seq=763 Ack=396980 Win=65535 Len=0
428199 140.171931 203.61.186.165 -> 244.3.160.239 TCP 64 12586 > http [ACK] Seq=763 Ack=398360 Win=65535 Len=0
428201 140.172439 203.61.186.165 -> 244.3.160.239 TCP 64 12586 > http [ACK] Seq=763 Ack=401120 Win=65535 Len=0
428203 140.172647 203.61.186.165 -> 244.3.160.239 TCP 64 12586 > http [ACK] Seq=763 Ack=402500 Win=65535 Len=0
428214 140.174592 203.61.186.165 -> 244.3.160.239 TCP 64 12586 > http [ACK] Seq=763 Ack=405260 Win=65535 Len=0
428215 140.174596 203.61.186.165 -> 244.3.160.239 TCP 64 12586 > http [ACK] Seq=763 Ack=407280 Win=65535 Len=0
428216 140.174720 203.61.186.165 -> 244.3.160.239 TCP 64 12586 > http [ACK] Seq=763 Ack=410040 Win=62775 Len=0
428219 140.174864 203.61.186.165 -> 244.3.160.239 TCP 64 12586 > http [ACK] Seq=763 Ack=412800 Win=60015 Len=0
428223 140.175695 203.61.186.165 -> 244.3.160.239 TCP 64 12586 > http [ACK] Seq=763 Ack=415560 Win=57255 Len=0
428224 140.175701 203.61.186.165 -> 244.3.160.239 TCP 64 12586 > http [ACK] Seq=763 Ack=417580 Win=55235 Len=0
428236 140.181359 203.61.186.165 -> 244.3.160.239 TCP 64 [TCP Window Update] 12586 > http [ACK] Seq=763 Ack=417580 Win=65535 Len=0
428316 140.192074 203.61.186.165 -> 244.3.160.239 TCP 64 12586 > http [ACK] Seq=763 Ack=420340 Win=65535 Len=0
428322 140.192486 203.61.186.165 -> 244.3.160.239 TCP 64 12586 > http [ACK] Seq=763 Ack=423100 Win=65535 Len=0
428330 140.193357 203.61.186.165 -> 244.3.160.239 TCP 64 12586 > http [ACK] Seq=763 Ack=425860 Win=65535 Len=0
428332 140.194450 203.61.186.165 -> 244.3.160.239 TCP 64 12586 > http [ACK] Seq=763 Ack=428620 Win=62775 Len=0
428378 140.203122 203.61.186.165 -> 244.3.160.239 TCP 64 12586 > http [ACK] Seq=763 Ack=429260 Win=65535 Len=0
428388 140.207619 203.61.186.165 -> 244.3.160.239 TCP 64 12586 > http [ACK] Seq=763 Ack=432020 Win=65535 Len=0
428389 140.207799 203.61.186.165 -> 244.3.160.239 TCP 64 12586 > http [ACK] Seq=763 Ack=434780 Win=65535 Len=0
428390 140.207804 203.61.186.165 -> 244.3.160.239 TCP 64 12586 > http [ACK] Seq=763 Ack=437540 Win=62775 Len=0
428391 140.207808 203.61.186.165 -> 244.3.160.239 TCP 64 12586 > http [ACK] Seq=763 Ack=440300 Win=60015 Len=0
428395 140.211369 203.61.186.165 -> 244.3.160.239 TCP 64 12586 > http [ACK] Seq=763 Ack=440940 Win=65535 Len=0
428466 140.232386 203.61.186.165 -> 244.3.160.239 TCP 64 12586 > http [ACK] Seq=763 Ack=443700 Win=65535 Len=0
428467 140.232828 203.61.186.165 -> 244.3.160.239 TCP 64 12586 > http [ACK] Seq=763 Ack=446460 Win=65535 Len=0
428468 140.233843 203.61.186.165 -> 244.3.160.239 TCP 64 12586 > http [ACK] Seq=763 Ack=449220 Win=65535 Len=0
428469 140.234333 203.61.186.165 -> 244.3.160.239 TCP 64 12586 > http [ACK] Seq=763 Ack=451980 Win=65535 Len=0
428493 140.248767 203.61.186.165 -> 244.3.160.239 TCP 64 12586 > http [ACK] Seq=763 Ack=454000 Win=65535 Len=0
428494 140.249986 203.61.186.165 -> 244.3.160.239 TCP 64 12586 > http [ACK] Seq=763 Ack=456760 Win=65535 Len=0
428500 140.250957 203.61.186.165 -> 244.3.160.239 TCP 64 12586 > http [ACK] Seq=763 Ack=459520 Win=65535 Len=0
428501 140.251270 203.61.186.165 -> 244.3.160.239 TCP 64 12586 > http [ACK] Seq=763 Ack=462280 Win=65535 Len=0
428502 140.251275 203.61.186.165 -> 244.3.160.239 TCP 64 12586 > http [ACK] Seq=763 Ack=464300 Win=65535 Len=0
428621 140.271986 203.61.186.165 -> 244.3.160.239 TCP 64 12586 > http [ACK] Seq=763 Ack=467060 Win=65535 Len=0
428622 140.272735 203.61.186.165 -> 244.3.160.239 TCP 64 12586 > http [ACK] Seq=763 Ack=469820 Win=65535 Len=0
428623 140.273160 203.61.186.165 -> 244.3.160.239 TCP 64 12586 > http [ACK] Seq=763 Ack=472580 Win=65535 Len=0
428624 140.273338 203.61.186.165 -> 244.3.160.239 TCP 64 12586 > http [ACK] Seq=763 Ack=475340 Win=65535 Len=0
428676 140.284338 203.61.186.165 -> 244.3.160.239 TCP 64 12586 > http [ACK] Seq=763 Ack=477360 Win=65535 Len=0
428678 140.285607 203.61.186.165 -> 244.3.160.239 TCP 64 12586 > http [ACK] Seq=763 Ack=480120 Win=65535 Len=0
428679 140.286101 203.61.186.165 -> 244.3.160.239 TCP 64 12586 > http [ACK] Seq=763 Ack=482880 Win=65535 Len=0
428691 140.286563 203.61.186.165 -> 244.3.160.239 TCP 64 12586 > http [ACK] Seq=763 Ack=485640 Win=64155 Len=0
428692 140.287179 203.61.186.165 -> 244.3.160.239 TCP 64 12586 > http [ACK] Seq=763 Ack=487660 Win=62135 Len=0
428777 140.312392 203.61.186.165 -> 244.3.160.239 TCP 64 12586 > http [ACK] Seq=763 Ack=490420 Win=59375 Len=0
428779 140.312521 203.61.186.165 -> 244.3.160.239 TCP 64 12586 > http [ACK] Seq=763 Ack=493180 Win=56615 Len=0
428781 140.313300 203.61.186.165 -> 244.3.160.239 TCP 64 12586 > http [ACK] Seq=763 Ack=495940 Win=53855 Len=0
428790 140.315019 203.61.186.165 -> 244.3.160.239 TCP 64 12586 > http [ACK] Seq=763 Ack=497320 Win=65535 Len=0
428791 140.315327 203.61.186.165 -> 244.3.160.239 TCP 64 12586 > http [ACK] Seq=763 Ack=499340 Win=63515 Len=0
428814 140.325568 203.61.186.165 -> 244.3.160.239 TCP 64 12586 > http [ACK] Seq=763 Ack=502100 Win=60755 Len=0
428816 140.326086 203.61.186.165 -> 244.3.160.239 TCP 64 12586 > http [ACK] Seq=763 Ack=504860 Win=57995 Len=0
428819 140.326874 203.61.186.165 -> 244.3.160.239 TCP 64 12586 > http [ACK] Seq=763 Ack=507620 Win=55235 Len=0
428820 140.327118 203.61.186.165 -> 244.3.160.239 TCP 64 12586 > http [ACK] Seq=763 Ack=510380 Win=52475 Len=0
428826 140.329495 203.61.186.165 -> 244.3.160.239 TCP 64 12586 > http [ACK] Seq=763 Ack=511020 Win=65535 Len=0
428982 140.351936 203.61.186.165 -> 244.3.160.239 TCP 64 12586 > http [ACK] Seq=763 Ack=513780 Win=65535 Len=0
428987 140.352120 203.61.186.165 -> 244.3.160.239 TCP 64 12586 > http [ACK] Seq=763 Ack=516540 Win=65535 Len=0
429016 140.352525 203.61.186.165 -> 244.3.160.239 TCP 64 12586 > http [ACK] Seq=763 Ack=519300 Win=65535 Len=0
429021 140.353155 203.61.186.165 -> 244.3.160.239 TCP 64 12586 > http [ACK] Seq=763 Ack=520680 Win=65535 Len=0
429022 140.353160 203.61.186.165 -> 244.3.160.239 TCP 64 12586 > http [ACK] Seq=763 Ack=522700 Win=65535 Len=0
429052 140.364620 203.61.186.165 -> 244.3.160.239 TCP 64 12586 > http [ACK] Seq=763 Ack=525460 Win=65535 Len=0
429053 140.365287 203.61.186.165 -> 244.3.160.239 TCP 64 12586 > http [ACK] Seq=763 Ack=528220 Win=65535 Len=0
429054 140.365292 203.61.186.165 -> 244.3.160.239 TCP 64 12586 > http [ACK] Seq=763 Ack=530980 Win=65535 Len=0
429055 140.366127 203.61.186.165 -> 244.3.160.239 TCP 64 12586 > http [ACK] Seq=763 Ack=533740 Win=62775 Len=0
429059 140.369644 203.61.186.165 -> 244.3.160.239 TCP 64 12586 > http [ACK] Seq=763 Ack=534380 Win=65535 Len=0
429179 140.392999 203.61.186.165 -> 244.3.160.239 TCP 64 12586 > http [ACK] Seq=763 Ack=537140 Win=65535 Len=0
429189 140.394624 203.61.186.165 -> 244.3.160.239 TCP 64 12586 > http [ACK] Seq=763 Ack=539900 Win=65535 Len=0
429201 140.395632 203.61.186.165 -> 244.3.160.239 TCP 64 12586 > http [ACK] Seq=763 Ack=542660 Win=65535 Len=0
429202 140.396428 203.61.186.165 -> 244.3.160.239 TCP 64 12586 > http [ACK] Seq=763 Ack=545420 Win=65535 Len=0
429222 140.404963 203.61.186.165 -> 244.3.160.239 TCP 64 12586 > http [ACK] Seq=763 Ack=547440 Win=63515 Len=0
429224 140.405338 203.61.186.165 -> 244.3.160.239 TCP 64 12586 > http [ACK] Seq=763 Ack=550200 Win=60755 Len=0
429225 140.405846 203.61.186.165 -> 244.3.160.239 TCP 64 12586 > http [ACK] Seq=763 Ack=552960 Win=57995 Len=0
429226 140.406101 203.61.186.165 -> 244.3.160.239 TCP 64 12586 > http [ACK] Seq=763 Ack=555720 Win=55235 Len=0
429227 140.406239 203.61.186.165 -> 244.3.160.239 TCP 64 12586 > http [ACK] Seq=763 Ack=557740 Win=53215 Len=0
429241 140.412302 203.61.186.165 -> 244.3.160.239 TCP 64 [TCP Window Update] 12586 > http [ACK] Seq=763 Ack=557740 Win=65535 Len=0
429430 140.432444 203.61.186.165 -> 244.3.160.239 TCP 64 12586 > http [ACK] Seq=763 Ack=560500 Win=65535 Len=0
429434 140.433172 203.61.186.165 -> 244.3.160.239 TCP 64 12586 > http [ACK] Seq=763 Ack=563260 Win=65535 Len=0
429435 140.433177 203.61.186.165 -> 244.3.160.239 TCP 64 12586 > http [ACK] Seq=763 Ack=566020 Win=65535 Len=0
429448 140.434057 203.61.186.165 -> 244.3.160.239 TCP 64 12586 > http [ACK] Seq=763 Ack=568780 Win=62775 Len=0
429484 140.443539 203.61.186.165 -> 244.3.160.239 TCP 64 12586 > http [ACK] Seq=763 Ack=570800 Win=60755 Len=0
429485 140.444145 203.61.186.165 -> 244.3.160.239 TCP 64 12586 > http [ACK] Seq=763 Ack=573560 Win=57995 Len=0
429486 140.444531 203.61.186.165 -> 244.3.160.239 TCP 64 12586 > http [ACK] Seq=763 Ack=576320 Win=55235 Len=0
429490 140.445285 203.61.186.165 -> 244.3.160.239 TCP 64 12586 > http [ACK] Seq=763 Ack=579080 Win=52475 Len=0
429495 140.445468 203.61.186.165 -> 244.3.160.239 TCP 64 12586 > http [ACK] Seq=763 Ack=581100 Win=50455 Len=0
429508 140.448048 203.61.186.165 -> 244.3.160.239 TCP 64 [TCP Window Update] 12586 > http [ACK] Seq=763 Ack=581100 Win=65535 Len=0
429621 140.473068 203.61.186.165 -> 244.3.160.239 TCP 64 12586 > http [ACK] Seq=763 Ack=583860 Win=65535 Len=0
429633 140.473766 203.61.186.165 -> 244.3.160.239 TCP 64 12586 > http [ACK] Seq=763 Ack=586620 Win=65535 Len=0
429634 140.474237 203.61.186.165 -> 244.3.160.239 TCP 64 12586 > http [ACK] Seq=763 Ack=589380 Win=65535 Len=0
429635 140.474390 203.61.186.165 -> 244.3.160.239 TCP 64 12586 > http [ACK] Seq=763 Ack=592140 Win=62775 Len=0
429643 140.479418 203.61.186.165 -> 244.3.160.239 TCP 64 12586 > http [ACK] Seq=763 Ack=592780 Win=65535 Len=0
429660 140.483941 203.61.186.165 -> 244.3.160.239 TCP 64 12586 > http [ACK] Seq=763 Ack=595540 Win=65535 Len=0
429661 140.484112 203.61.186.165 -> 244.3.160.239 TCP 64 12586 > http [ACK] Seq=763 Ack=598300 Win=65535 Len=0
429662 140.484653 203.61.186.165 -> 244.3.160.239 TCP 64 12586 > http [ACK] Seq=763 Ack=601060 Win=62775 Len=0
429664 140.485318 203.61.186.165 -> 244.3.160.239 TCP 64 12586 > http [ACK] Seq=763 Ack=603820 Win=60015 Len=0
429676 140.487535 203.61.186.165 -> 244.3.160.239 TCP 64 12586 > http [ACK] Seq=763 Ack=604460 Win=65535 Len=0
429832 140.512807 203.61.186.165 -> 244.3.160.239 TCP 64 12586 > http [ACK] Seq=763 Ack=607220 Win=65535 Len=0
429833 140.513704 203.61.186.165 -> 244.3.160.239 TCP 64 12586 > http [ACK] Seq=763 Ack=609980 Win=65535 Len=0
429834 140.514917 203.61.186.165 -> 244.3.160.239 TCP 64 12586 > http [ACK] Seq=763 Ack=612740 Win=65535 Len=0
429835 140.515403 203.61.186.165 -> 244.3.160.239 TCP 64 12586 > http [ACK] Seq=763 Ack=615500 Win=65535 Len=0
429869 140.526039 203.61.186.165 -> 244.3.160.239 TCP 64 12586 > http [ACK] Seq=763 Ack=617520 Win=65535 Len=0
429876 140.527388 203.61.186.165 -> 244.3.160.239 TCP 64 12586 > http [ACK] Seq=763 Ack=620280 Win=65535 Len=0
429880 140.528272 203.61.186.165 -> 244.3.160.239 TCP 64 12586 > http [ACK] Seq=763 Ack=623040 Win=65535 Len=0
429882 140.528631 203.61.186.165 -> 244.3.160.239 TCP 64 12586 > http [ACK] Seq=763 Ack=625800 Win=64155 Len=0
429883 140.529490 203.61.186.165 -> 244.3.160.239 TCP 64 12586 > http [ACK] Seq=763 Ack=627820 Win=62135 Len=0
429908 140.538195 203.61.186.165 -> 244.3.160.239 TCP 64 [TCP Window Update] 12586 > http [ACK] Seq=763 Ack=627820 Win=65535 Len=0
429981 140.551868 203.61.186.165 -> 244.3.160.239 TCP 64 12586 > http [ACK] Seq=763 Ack=630580 Win=65535 Len=0
429984 140.552500 203.61.186.165 -> 244.3.160.239 TCP 64 12586 > http [ACK] Seq=763 Ack=633340 Win=65535 Len=0
429985 140.554907 203.61.186.165 -> 244.3.160.239 TCP 64 12586 > http [ACK] Seq=763 Ack=636100 Win=65535 Len=0
429986 140.555756 203.61.186.165 -> 244.3.160.239 TCP 64 12586 > http [ACK] Seq=763 Ack=638860 Win=65535 Len=0
429995 140.565696 203.61.186.165 -> 244.3.160.239 TCP 64 12586 > http [ACK] Seq=763 Ack=640880 Win=65535 Len=0
429996 140.565700 203.61.186.165 -> 244.3.160.239 TCP 64 12586 > http [ACK] Seq=763 Ack=643640 Win=65535 Len=0
429997 140.566521 203.61.186.165 -> 244.3.160.239 TCP 64 12586 > http [ACK] Seq=763 Ack=646400 Win=65535 Len=0
429998 140.567100 203.61.186.165 -> 244.3.160.239 TCP 64 12586 > http [ACK] Seq=763 Ack=649160 Win=64155 Len=0
429999 140.567105 203.61.186.165 -> 244.3.160.239 TCP 64 12586 > http [ACK] Seq=763 Ack=651180 Win=62135 Len=0
430002 140.570089 203.61.186.165 -> 244.3.160.239 TCP 64 [TCP Window Update] 12586 > http [ACK] Seq=763 Ack=651180 Win=65535 Len=0
430200 140.597728 203.61.186.165 -> 244.3.160.239 TCP 64 12586 > http [ACK] Seq=763 Ack=653940 Win=65535 Len=0
430202 140.598151 203.61.186.165 -> 244.3.160.239 TCP 64 12586 > http [ACK] Seq=763 Ack=656700 Win=65535 Len=0
430204 140.598682 203.61.186.165 -> 244.3.160.239 TCP 64 12586 > http [ACK] Seq=763 Ack=659460 Win=65535 Len=0
430205 140.599449 203.61.186.165 -> 244.3.160.239 TCP 64 12586 > http [ACK] Seq=763 Ack=662220 Win=65535 Len=0
430232 140.605792 203.61.186.165 -> 244.3.160.239 TCP 64 12586 > http [ACK] Seq=763 Ack=664240 Win=65535 Len=0
430236 140.606608 203.61.186.165 -> 244.3.160.239 TCP 64 12586 > http [ACK] Seq=763 Ack=667000 Win=65535 Len=0
430237 140.607087 203.61.186.165 -> 244.3.160.239 TCP 64 12586 > http [ACK] Seq=763 Ack=669760 Win=65535 Len=0
430238 140.607723 203.61.186.165 -> 244.3.160.239 TCP 64 12586 > http [ACK] Seq=763 Ack=672520 Win=64155 Len=0
430239 140.608182 203.61.186.165 -> 244.3.160.239 TCP 64 12586 > http [ACK] Seq=763 Ack=674540 Win=62135 Len=0
430249 140.610850 203.61.186.165 -> 244.3.160.239 TCP 64 [TCP Window Update] 12586 > http [ACK] Seq=763 Ack=674540 Win=65535 Len=0
430361 140.633706 203.61.186.165 -> 244.3.160.239 TCP 64 12586 > http [ACK] Seq=763 Ack=677300 Win=65535 Len=0
430362 140.634727 203.61.186.165 -> 244.3.160.239 TCP 64 12586 > http [ACK] Seq=763 Ack=680060 Win=65535 Len=0
430363 140.635596 203.61.186.165 -> 244.3.160.239 TCP 64 12586 > http [ACK] Seq=763 Ack=682820 Win=65535 Len=0
430364 140.635745 203.61.186.165 -> 244.3.160.239 TCP 64 12586 > http [ACK] Seq=763 Ack=685580 Win=65535 Len=0
430375 140.646049 203.61.186.165 -> 244.3.160.239 TCP 64 12586 > http [ACK] Seq=763 Ack=687600 Win=65535 Len=0
430376 140.646491 203.61.186.165 -> 244.3.160.239 TCP 64 12586 > http [ACK] Seq=763 Ack=690360 Win=65535 Len=0
430377 140.646739 203.61.186.165 -> 244.3.160.239 TCP 64 12586 > http [ACK] Seq=763 Ack=693120 Win=65535 Len=0
430378 140.647454 203.61.186.165 -> 244.3.160.239 TCP 64 12586 > http [ACK] Seq=763 Ack=695880 Win=64155 Len=0
430381 140.648844 203.61.186.165 -> 244.3.160.239 TCP 64 12586 > http [ACK] Seq=763 Ack=697900 Win=62135 Len=0
430391 140.656024 203.61.186.165 -> 244.3.160.239 TCP 64 [TCP Window Update] 12586 > http [ACK] Seq=763 Ack=697900 Win=65535 Len=0
430449 140.672920 203.61.186.165 -> 244.3.160.239 TCP 64 12586 > http [ACK] Seq=763 Ack=700660 Win=65535 Len=0
430450 140.673816 203.61.186.165 -> 244.3.160.239 TCP 64 12586 > http [ACK] Seq=763 Ack=703420 Win=65535 Len=0
430451 140.674127 203.61.186.165 -> 244.3.160.239 TCP 64 12586 > http [ACK] Seq=763 Ack=706180 Win=65535 Len=0
430453 140.674567 203.61.186.165 -> 244.3.160.239 TCP 64 12586 > http [ACK] Seq=763 Ack=708940 Win=65535 Len=0
430498 140.685691 203.61.186.165 -> 244.3.160.239 TCP 64 12586 > http [ACK] Seq=763 Ack=710960 Win=65535 Len=0
430501 140.686721 203.61.186.165 -> 244.3.160.239 TCP 64 12586 > http [ACK] Seq=763 Ack=713720 Win=65535 Len=0
430502 140.686917 203.61.186.165 -> 244.3.160.239 TCP 64 12586 > http [ACK] Seq=763 Ack=716480 Win=65535 Len=0
430503 140.687710 203.61.186.165 -> 244.3.160.239 TCP 64 12586 > http [ACK] Seq=763 Ack=719240 Win=64155 Len=0
430504 140.687715 203.61.186.165 -> 244.3.160.239 TCP 64 12586 > http [ACK] Seq=763 Ack=721260 Win=62135 Len=0
430519 140.690897 203.61.186.165 -> 244.3.160.239 TCP 64 [TCP Window Update] 12586 > http [ACK] Seq=763 Ack=721260 Win=65535 Len=0
430622 140.714460 203.61.186.165 -> 244.3.160.239 TCP 64 12586 > http [ACK] Seq=763 Ack=724020 Win=65535 Len=0
430630 140.715224 203.61.186.165 -> 244.3.160.239 TCP 64 12586 > http [ACK] Seq=763 Ack=726780 Win=65535 Len=0
430632 140.715666 203.61.186.165 -> 244.3.160.239 TCP 64 12586 > http [ACK] Seq=763 Ack=729540 Win=65535 Len=0
430641 140.717599 203.61.186.165 -> 244.3.160.239 TCP 64 12586 > http [ACK] Seq=763 Ack=732300 Win=65535 Len=0
430676 140.729261 203.61.186.165 -> 244.3.160.239 TCP 64 12586 > http [ACK] Seq=763 Ack=734320 Win=63515 Len=0
430677 140.729447 203.61.186.165 -> 244.3.160.239 TCP 64 12586 > http [ACK] Seq=763 Ack=737080 Win=60755 Len=0
430678 140.730134 203.61.186.165 -> 244.3.160.239 TCP 64 12586 > http [ACK] Seq=763 Ack=739840 Win=57995 Len=0
430681 140.730673 203.61.186.165 -> 244.3.160.239 TCP 64 12586 > http [ACK] Seq=763 Ack=742600 Win=55235 Len=0
430682 140.731279 203.61.186.165 -> 244.3.160.239 TCP 64 12586 > http [ACK] Seq=763 Ack=744620 Win=53215 Len=0
430770 140.751226 203.61.186.165 -> 244.3.160.239 TCP 64 [TCP Window Update] 12586 > http [ACK] Seq=763 Ack=744620 Win=65535 Len=0
430787 140.754252 203.61.186.165 -> 244.3.160.239 TCP 64 12586 > http [ACK] Seq=763 Ack=747380 Win=62775 Len=0
430788 140.755113 203.61.186.165 -> 244.3.160.239 TCP 64 12586 > http [ACK] Seq=763 Ack=750140 Win=60015 Len=0
430790 140.758455 203.61.186.165 -> 244.3.160.239 TCP 64 12586 > http [ACK] Seq=763 Ack=752900 Win=57255 Len=0
430791 140.758460 203.61.186.165 -> 244.3.160.239 TCP 64 12586 > http [ACK] Seq=763 Ack=755660 Win=54495 Len=0
430803 140.760435 203.61.186.165 -> 244.3.160.239 TCP 64 12586 > http [ACK] Seq=763 Ack=756300 Win=65535 Len=0
430839 140.768552 203.61.186.165 -> 244.3.160.239 TCP 64 12586 > http [ACK] Seq=763 Ack=759060 Win=62775 Len=0
430842 140.768980 203.61.186.165 -> 244.3.160.239 TCP 64 12586 > http [ACK] Seq=763 Ack=761820 Win=60015 Len=0
430846 140.769867 203.61.186.165 -> 244.3.160.239 TCP 64 [TCP Window Update] 12586 > http [ACK] Seq=763 Ack=761820 Win=65535 Len=0
430847 140.770247 203.61.186.165 -> 244.3.160.239 TCP 64 12586 > http [ACK] Seq=763 Ack=764580 Win=65535 Len=0
430851 140.771227 203.61.186.165 -> 244.3.160.239 TCP 64 12586 > http [ACK] Seq=763 Ack=767340 Win=62775 Len=0
430872 140.777022 203.61.186.165 -> 244.3.160.239 TCP 64 12586 > http [ACK] Seq=763 Ack=767980 Win=65535 Len=0
430960 140.796395 203.61.186.165 -> 244.3.160.239 TCP 64 12586 > http [ACK] Seq=763 Ack=770740 Win=65535 Len=0
430966 140.797241 203.61.186.165 -> 244.3.160.239 TCP 64 12586 > http [ACK] Seq=763 Ack=773500 Win=65535 Len=0
430967 140.797246 203.61.186.165 -> 244.3.160.239 TCP 64 12586 > http [ACK] Seq=763 Ack=776260 Win=65535 Len=0
430972 140.797990 203.61.186.165 -> 244.3.160.239 TCP 64 12586 > http [ACK] Seq=763 Ack=779020 Win=62775 Len=0
430981 140.799583 203.61.186.165 -> 244.3.160.239 TCP 64 12586 > http [ACK] Seq=763 Ack=779660 Win=65535 Len=0
431016 140.808421 203.61.186.165 -> 244.3.160.239 TCP 64 12586 > http [ACK] Seq=763 Ack=782420 Win=65535 Len=0
431017 140.808858 203.61.186.165 -> 244.3.160.239 TCP 64 12586 > http [ACK] Seq=763 Ack=785180 Win=65535 Len=0
431031 140.809513 203.61.186.165 -> 244.3.160.239 TCP 64 12586 > http [ACK] Seq=763 Ack=787940 Win=62775 Len=0
431036 140.809769 203.61.186.165 -> 244.3.160.239 TCP 64 12586 > http [ACK] Seq=763 Ack=789320 Win=65155 Len=0
431037 140.810162 203.61.186.165 -> 244.3.160.239 TCP 64 12586 > http [ACK] Seq=763 Ack=791340 Win=65535 Len=0
431164 140.834237 203.61.186.165 -> 244.3.160.239 TCP 64 12586 > http [ACK] Seq=763 Ack=794100 Win=65535 Len=0
431166 140.834766 203.61.186.165 -> 244.3.160.239 TCP 64 12586 > http [ACK] Seq=763 Ack=796860 Win=65535 Len=0
431167 140.835308 203.61.186.165 -> 244.3.160.239 TCP 64 12586 > http [ACK] Seq=763 Ack=799620 Win=65535 Len=0
431168 140.835915 203.61.186.165 -> 244.3.160.239 TCP 64 12586 > http [ACK] Seq=763 Ack=802380 Win=65535 Len=0
431192 140.850475 203.61.186.165 -> 244.3.160.239 TCP 64 12586 > http [ACK] Seq=763 Ack=804400 Win=63515 Len=0
431193 140.850932 203.61.186.165 -> 244.3.160.239 TCP 64 12586 > http [ACK] Seq=763 Ack=807160 Win=60755 Len=0
431194 140.851628 203.61.186.165 -> 244.3.160.239 TCP 64 12586 > http [ACK] Seq=763 Ack=809920 Win=57995 Len=0
431195 140.851826 203.61.186.165 -> 244.3.160.239 TCP 64 12586 > http [ACK] Seq=763 Ack=812680 Win=55235 Len=0
431196 140.852583 203.61.186.165 -> 244.3.160.239 TCP 64 [TCP Window Update] 12586 > http [ACK] Seq=763 Ack=812680 Win=65535 Len=0
431197 140.852588 203.61.186.165 -> 244.3.160.239 TCP 64 12586 > http [ACK] Seq=763 Ack=814700 Win=63515 Len=0
