607104 192.583412 203.176.39.75 -> 244.3.210.197 TCP 78 34658 > http [SYN] Seq=0 Win=65535 Len=0 MSS=1460 WS=1 TSval=6942392 TSecr=0
607285 192.651634 203.176.39.75 -> 244.3.210.197 TCP 70 34658 > http [ACK] Seq=1 Ack=1 Win=65535 Len=0 TSval=6942392 TSecr=0
608052 193.062787 203.176.39.75 -> 244.3.210.197 TCP 70 34658 > http [ACK] Seq=932 Ack=2897 Win=64252 Len=0 TSval=6942393 TSecr=150405942
608184 193.132087 203.176.39.75 -> 244.3.210.197 TCP 70 34658 > http [ACK] Seq=932 Ack=5793 Win=64252 Len=0 TSval=6942393 TSecr=150405942
608347 193.190886 203.176.39.75 -> 244.3.210.197 TCP 70 34658 > http [ACK] Seq=932 Ack=7241 Win=65535 Len=0 TSval=6942393 TSecr=150405942
608366 193.203795 203.176.39.75 -> 244.3.210.197 TCP 70 34658 > http [ACK] Seq=932 Ack=10137 Win=64252 Len=0 TSval=6942394 TSecr=150405944
608487 193.263702 203.176.39.75 -> 244.3.210.197 TCP 70 34658 > http [ACK] Seq=932 Ack=13033 Win=64252 Len=0 TSval=6942394 TSecr=150405944
608496 193.273239 203.176.39.75 -> 244.3.210.197 TCP 70 34658 > http [ACK] Seq=932 Ack=15420 Win=64761 Len=0 TSval=6942394 TSecr=150405944
616234 195.792804 203.176.39.75 -> 244.3.210.197 TCP 70 34658 > http [ACK] Seq=1778 Ack=16232 Win=65535 Len=0 TSval=6942399 TSecr=150405969
627831 199.287022 203.176.39.75 -> 244.3.210.197 TCP 70 34658 > http [ACK] Seq=2865 Ack=19128 Win=64252 Len=0 TSval=6942406 TSecr=150406004
627847 199.292174 203.176.39.75 -> 244.3.210.197 TCP 70 34658 > http [ACK] Seq=2865 Ack=22024 Win=64252 Len=0 TSval=6942406 TSecr=150406004
627855 199.292599 203.176.39.75 -> 244.3.210.197 TCP 70 34658 > http [ACK] Seq=2865 Ack=24920 Win=64252 Len=0 TSval=6942406 TSecr=150406004
627861 199.293043 203.176.39.75 -> 244.3.210.197 TCP 70 34658 > http [ACK] Seq=2865 Ack=27816 Win=64252 Len=0 TSval=6942406 TSecr=150406004
628070 199.355702 203.176.39.75 -> 244.3.210.197 TCP 70 34658 > http [ACK] Seq=2865 Ack=30712 Win=64252 Len=0 TSval=6942406 TSecr=150406004
628079 199.356194 203.176.39.75 -> 244.3.210.197 TCP 70 34658 > http [ACK] Seq=2865 Ack=33608 Win=63379 Len=0 TSval=6942406 TSecr=150406005
628152 199.363085 203.176.39.75 -> 244.3.210.197 TCP 70 34658 > http [ACK] Seq=2865 Ack=35056 Win=65535 Len=0 TSval=6942406 TSecr=150406005
628264 199.388225 203.176.39.75 -> 244.3.210.197 TCP 70 34658 > http [ACK] Seq=2865 Ack=35694 Win=65535 Len=0 TSval=6942406 TSecr=150406005
960714 319.190517 203.176.39.75 -> 244.3.210.197 TCP 64 [TCP Keep-Alive] 34658 > http [ACK] Seq=2864 Ack=35694 Win=65535 Len=0
