513758 165.005494 203.117.197.164 -> 244.3.210.197 TCP 78 14976 > http [SYN] Seq=0 Win=65535 Len=0 MSS=1380 WS=1 TSval=1063720878 TSecr=0
513899 165.065705 203.117.197.164 -> 244.3.210.197 TCP 70 14976 > http [ACK] Seq=1 Ack=1 Win=65535 Len=0 TSval=1063720878 TSecr=0
514196 165.259165 203.117.197.164 -> 244.3.210.197 TCP 70 14976 > http [ACK] Seq=672 Ack=2737 Win=65535 Len=0 TSval=1063720878 TSecr=150405662
514247 165.315718 203.117.197.164 -> 244.3.210.197 TCP 70 14976 > http [ACK] Seq=672 Ack=5473 Win=65535 Len=0 TSval=1063720878 TSecr=150405665
514292 165.371978 203.117.197.164 -> 244.3.210.197 TCP 70 14976 > http [ACK] Seq=672 Ack=8209 Win=65535 Len=0 TSval=1063720878 TSecr=150405665
514301 165.372437 203.117.197.164 -> 244.3.210.197 TCP 70 14976 > http [ACK] Seq=672 Ack=10945 Win=65535 Len=0 TSval=1063720878 TSecr=150405666
514397 165.428518 203.117.197.164 -> 244.3.210.197 TCP 70 14976 > http [ACK] Seq=672 Ack=13681 Win=65535 Len=0 TSval=1063720878 TSecr=150405666
514406 165.428865 203.117.197.164 -> 244.3.210.197 TCP 70 14976 > http [ACK] Seq=672 Ack=16417 Win=65535 Len=0 TSval=1063720878 TSecr=150405666
514415 165.429486 203.117.197.164 -> 244.3.210.197 TCP 70 14976 > http [ACK] Seq=672 Ack=19153 Win=65535 Len=0 TSval=1063720878 TSecr=150405666
514476 165.484886 203.117.197.164 -> 244.3.210.197 TCP 70 14976 > http [ACK] Seq=672 Ack=21889 Win=65535 Len=0 TSval=1063720879 TSecr=150405667
514486 165.485504 203.117.197.164 -> 244.3.210.197 TCP 70 14976 > http [ACK] Seq=672 Ack=24625 Win=65535 Len=0 TSval=1063720879 TSecr=150405667
514495 165.485979 203.117.197.164 -> 244.3.210.197 TCP 70 14976 > http [ACK] Seq=672 Ack=27361 Win=65535 Len=0 TSval=1063720879 TSecr=150405667
514504 165.486695 203.117.197.164 -> 244.3.210.197 TCP 70 14976 > http [ACK] Seq=672 Ack=30097 Win=65535 Len=0 TSval=1063720879 TSecr=150405667
514565 165.541271 203.117.197.164 -> 244.3.210.197 TCP 70 14976 > http [ACK] Seq=672 Ack=32833 Win=65535 Len=0 TSval=1063720879 TSecr=150405667
514571 165.541520 203.117.197.164 -> 244.3.210.197 TCP 70 14976 > http [ACK] Seq=672 Ack=35569 Win=65535 Len=0 TSval=1063720879 TSecr=150405667
514720 165.659234 203.117.197.164 -> 244.3.210.197 TCP 70 14976 > http [ACK] Seq=672 Ack=36511 Win=65535 Len=0 TSval=1063720879 TSecr=150405667
