295585  99.708276 209.55.215.186 -> 244.3.210.197 TCP 66 utsftp > http [SYN] Seq=0 Win=65535 Len=0 MSS=1460 SACK_PERM=1
295586  99.708317 209.55.215.186 -> 244.3.210.197 TCP 66 vrcommerce > http [SYN] Seq=0 Win=65535 Len=0 MSS=1460 SACK_PERM=1
295672  99.751098 209.55.215.186 -> 244.3.210.197 TCP 64 utsftp > http [ACK] Seq=1 Ack=1 Win=65535 Len=0
295674  99.751124 209.55.215.186 -> 244.3.210.197 TCP 64 vrcommerce > http [ACK] Seq=1 Ack=1 Win=65535 Len=0
295783  99.800171 209.55.215.186 -> 244.3.210.197 TCP 64 vrcommerce > http [ACK] Seq=364 Ack=2921 Win=65535 Len=0
295833  99.844313 209.55.215.186 -> 244.3.210.197 TCP 64 vrcommerce > http [ACK] Seq=364 Ack=4381 Win=65535 Len=0
295834  99.844317 209.55.215.186 -> 244.3.210.197 TCP 64 vrcommerce > http [ACK] Seq=364 Ack=7301 Win=65535 Len=0
295958  99.890643 209.55.215.186 -> 244.3.210.197 TCP 64 vrcommerce > http [ACK] Seq=364 Ack=8761 Win=65535 Len=0
295959  99.890648 209.55.215.186 -> 244.3.210.197 TCP 64 vrcommerce > http [ACK] Seq=364 Ack=11681 Win=65535 Len=0
295960  99.890652 209.55.215.186 -> 244.3.210.197 TCP 64 vrcommerce > http [ACK] Seq=364 Ack=13141 Win=64075 Len=0
296072  99.932123 209.55.215.186 -> 244.3.210.197 TCP 64 vrcommerce > http [ACK] Seq=364 Ack=15017 Win=62199 Len=0
296108  99.941092 209.55.215.186 -> 244.3.210.197 TCP 64 [TCP Window Update] vrcommerce > http [ACK] Seq=364 Ack=15017 Win=65535 Len=0
297392 100.321125 209.55.215.186 -> 244.3.210.197 TCP 64 utsftp > http [ACK] Seq=756 Ack=687 Win=64849 Len=0
304894 103.205795 209.55.215.186 -> 244.3.210.197 TCP 64 vrcommerce > http [ACK] Seq=722 Ack=17937 Win=65535 Len=0
304895 103.205799 209.55.215.186 -> 244.3.210.197 TCP 64 vrcommerce > http [ACK] Seq=722 Ack=19397 Win=65535 Len=0
304913 103.210346 209.55.215.186 -> 244.3.210.197 TCP 64 vrcommerce > http [ACK] Seq=722 Ack=23777 Win=65535 Len=0
304959 103.215885 209.55.215.186 -> 244.3.210.197 TCP 64 vrcommerce > http [ACK] Seq=722 Ack=28157 Win=64075 Len=0
304983 103.220129 209.55.215.186 -> 244.3.210.197 TCP 64 [TCP Window Update] vrcommerce > http [ACK] Seq=722 Ack=28157 Win=65535 Len=0
304999 103.224892 209.55.215.186 -> 244.3.210.197 TCP 64 [TCP Dup ACK 304983#1] vrcommerce > http [ACK] Seq=722 Ack=28157 Win=65535 Len=0
305025 103.250398 209.55.215.186 -> 244.3.210.197 TCP 64 vrcommerce > http [ACK] Seq=722 Ack=31077 Win=65535 Len=0
305026 103.250403 209.55.215.186 -> 244.3.210.197 TCP 64 vrcommerce > http [ACK] Seq=722 Ack=32537 Win=65535 Len=0
305042 103.254297 209.55.215.186 -> 244.3.210.197 TCP 64 vrcommerce > http [ACK] Seq=722 Ack=36917 Win=65535 Len=0
305054 103.258163 209.55.215.186 -> 244.3.210.197 TCP 64 vrcommerce > http [ACK] Seq=722 Ack=39295 Win=65535 Len=0
305067 103.262254 209.55.215.186 -> 244.3.210.197 TCP 64 [TCP Dup ACK 305054#1] vrcommerce > http [ACK] Seq=722 Ack=39295 Win=65535 Len=0
305808 103.594296 209.55.215.186 -> 244.3.210.197 TCP 64 utsftp > http [ACK] Seq=1187 Ack=1082 Win=64454 Len=0
309894 105.770426 209.55.215.186 -> 244.3.210.197 TCP 64 vrcommerce > http [ACK] Seq=1080 Ack=42215 Win=65535 Len=0
309913 105.774763 209.55.215.186 -> 244.3.210.197 TCP 64 vrcommerce > http [ACK] Seq=1080 Ack=43675 Win=65535 Len=0
309914 105.774783 209.55.215.186 -> 244.3.210.197 TCP 64 vrcommerce > http [ACK] Seq=1080 Ack=48055 Win=65535 Len=0
309930 105.778538 209.55.215.186 -> 244.3.210.197 TCP 64 vrcommerce > http [ACK] Seq=1080 Ack=58275 Win=58235 Len=0
309944 105.782739 209.55.215.186 -> 244.3.210.197 TCP 64 [TCP Dup ACK 309930#1] vrcommerce > http [ACK] Seq=1080 Ack=58275 Win=58235 Len=0
309965 105.788312 209.55.215.186 -> 244.3.210.197 TCP 64 vrcommerce > http [ACK] Seq=1080 Ack=59638 Win=65535 Len=0
311303 106.223824 209.55.215.186 -> 244.3.210.197 TCP 64 utsftp > http [ACK] Seq=1618 Ack=1477 Win=65535 Len=0
