20219   6.664415 209.254.255.22 -> 41.177.98.127 TCP 66 18254 > z39-50 [SYN] Seq=0 Win=65535 Len=0 MSS=1460 SACK_PERM=1
20324   6.722737 209.254.255.22 -> 41.177.98.127 TCP 64 18254 > z39-50 [ACK] Seq=1 Ack=1 Win=65535 Len=0
20334   6.723590 209.254.255.22 -> 41.177.98.127 TCP 149 18254 > z39-50 [PSH, ACK] Seq=1 Ack=1 Win=65535 Len=91
22700   8.108338 209.254.255.22 -> 41.177.98.127 TCP 157 18254 > z39-50 [PSH, ACK] Seq=92 Ack=71 Win=65465 Len=99
22823   8.205995 209.254.255.22 -> 41.177.98.127 TCP 91 18254 > z39-50 [PSH, ACK] Seq=191 Ack=93 Win=65443 Len=33
22970   8.313430 209.254.255.22 -> 41.177.98.127 TCP 66 18254 > z39-50 [PSH, ACK] Seq=224 Ack=1419 Win=64117 Len=8
23130   8.377249 209.254.255.22 -> 41.177.98.127 TCP 64 18254 > z39-50 [ACK] Seq=232 Ack=1420 Win=64117 Len=0
23131   8.377269 209.254.255.22 -> 41.177.98.127 TCP 64 18254 > z39-50 [FIN, ACK] Seq=232 Ack=1420 Win=64117 Len=0
569839 182.077177 209.254.255.22 -> 41.177.98.127 TCP 66 18276 > z39-50 [SYN] Seq=0 Win=65535 Len=0 MSS=1460 SACK_PERM=1
569974 182.135299 209.254.255.22 -> 41.177.98.127 TCP 64 18276 > z39-50 [ACK] Seq=1 Ack=1 Win=65535 Len=0
569975 182.136084 209.254.255.22 -> 41.177.98.127 TCP 149 18276 > z39-50 [PSH, ACK] Seq=1 Ack=1 Win=65535 Len=91
577712 183.488760 209.254.255.22 -> 41.177.98.127 TCP 157 18276 > z39-50 [PSH, ACK] Seq=92 Ack=71 Win=65465 Len=99
577974 183.574269 209.254.255.22 -> 41.177.98.127 TCP 91 18276 > z39-50 [PSH, ACK] Seq=191 Ack=93 Win=65443 Len=33
578296 183.677647 209.254.255.22 -> 41.177.98.127 TCP 66 18276 > z39-50 [PSH, ACK] Seq=224 Ack=1373 Win=64163 Len=8
578586 183.742257 209.254.255.22 -> 41.177.98.127 TCP 64 18276 > z39-50 [ACK] Seq=232 Ack=1374 Win=64163 Len=0
578587 183.742343 209.254.255.22 -> 41.177.98.127 TCP 64 18276 > z39-50 [FIN, ACK] Seq=232 Ack=1374 Win=64163 Len=0
