384999 127.559096 210.149.157.155 -> 41.177.26.91 TCP 66 ncconfig > http [SYN] Seq=0 Win=65535 Len=0 MSS=1352 SACK_PERM=1
385356 127.712139 210.149.157.155 -> 41.177.26.91 TCP 64 ncconfig > http [ACK] Seq=1 Ack=1 Win=65535 Len=0
385632 127.909106 210.149.157.155 -> 41.177.26.91 TCP 64 ncconfig > http [ACK] Seq=417 Ack=4057 Win=65535 Len=0
385639 127.909906 210.149.157.155 -> 41.177.26.91 TCP 66 unify-adapter > http [SYN] Seq=0 Win=65535 Len=0 MSS=1352 SACK_PERM=1
385837 128.067529 210.149.157.155 -> 41.177.26.91 TCP 64 unify-adapter > http [ACK] Seq=1 Ack=1 Win=65535 Len=0
385838 128.067912 210.149.157.155 -> 41.177.26.91 TCP 64 ncconfig > http [ACK] Seq=417 Ack=6370 Win=65535 Len=0
386067 128.277054 210.149.157.155 -> 41.177.26.91 TCP 64 unify-adapter > http [ACK] Seq=157 Ack=4057 Win=65535 Len=0
386070 128.277702 210.149.157.155 -> 41.177.26.91 TCP 64 unify-adapter > http [RST, ACK] Seq=157 Ack=4057 Win=0 Len=0
386297 128.438297 210.149.157.155 -> 41.177.26.91 TCP 64 unify-adapter > http [RST] Seq=157 Win=0 Len=0
386298 128.438302 210.149.157.155 -> 41.177.26.91 TCP 64 unify-adapter > http [RST] Seq=157 Win=0 Len=0
606306 192.294694 210.149.157.155 -> 41.177.26.91 TCP 64 ncconfig > http [RST, ACK] Seq=417 Ack=6370 Win=0 Len=0
