118   0.020367 210.197.167.105 -> 41.177.26.15 TCP 64 apparenet-tps > http [ACK] Seq=1 Ack=1 Win=65535 Len=0
212   0.041001 210.197.167.105 -> 41.177.26.15 TCP 64 apparenet-tps > http [ACK] Seq=1 Ack=2905 Win=65535 Len=0
550   0.140591 210.197.167.105 -> 41.177.26.15 TCP 64 apparenet-tps > http [ACK] Seq=1 Ack=5289 Win=65535 Len=0
594   0.150338 210.197.167.105 -> 41.177.26.15 TCP 70 [TCP Dup ACK 550#1] apparenet-tps > http [ACK] Seq=1 Ack=5289 Win=65535 Len=0 SLE=6741 SRE=8193
926   0.239306 210.197.167.105 -> 41.177.26.15 TCP 70 [TCP Dup ACK 550#2] apparenet-tps > http [ACK] Seq=1 Ack=5289 Win=65535 Len=0 SLE=6741 SRE=9645
929   0.241133 210.197.167.105 -> 41.177.26.15 TCP 70 [TCP Dup ACK 550#3] apparenet-tps > http [ACK] Seq=1 Ack=5289 Win=65535 Len=0 SLE=6741 SRE=11097
945   0.249928 210.197.167.105 -> 41.177.26.15 TCP 70 [TCP Dup ACK 550#4] apparenet-tps > http [ACK] Seq=1 Ack=5289 Win=65535 Len=0 SLE=6741 SRE=12549
987   0.260896 210.197.167.105 -> 41.177.26.15 TCP 70 [TCP Dup ACK 550#5] apparenet-tps > http [ACK] Seq=1 Ack=5289 Win=65535 Len=0 SLE=6741 SRE=13481
991   0.262492 210.197.167.105 -> 41.177.26.15 TCP 70 [TCP Dup ACK 550#6] apparenet-tps > http [ACK] Seq=1 Ack=5289 Win=65535 Len=0 SLE=6741 SRE=14933
1350   0.360274 210.197.167.105 -> 41.177.26.15 TCP 70 [TCP Dup ACK 550#7] apparenet-tps > http [ACK] Seq=1 Ack=5289 Win=65535 Len=0 SLE=6741 SRE=16385
1357   0.362232 210.197.167.105 -> 41.177.26.15 TCP 70 [TCP Dup ACK 550#8] apparenet-tps > http [ACK] Seq=1 Ack=5289 Win=65535 Len=0 SLE=6741 SRE=17837
1583   0.460036 210.197.167.105 -> 41.177.26.15 TCP 64 apparenet-tps > http [ACK] Seq=1 Ack=17837 Win=65535 Len=0
1627   0.480810 210.197.167.105 -> 41.177.26.15 TCP 70 [TCP Dup ACK 1583#1] apparenet-tps > http [ACK] Seq=1 Ack=17837 Win=65535 Len=0 SLE=19289 SRE=20741
1927   0.580384 210.197.167.105 -> 41.177.26.15 TCP 70 [TCP Dup ACK 1583#2] apparenet-tps > http [ACK] Seq=1 Ack=17837 Win=65535 Len=0 SLE=19289 SRE=21673
1929   0.582362 210.197.167.105 -> 41.177.26.15 TCP 70 [TCP Dup ACK 1583#3] apparenet-tps > http [ACK] Seq=1 Ack=17837 Win=65535 Len=0 SLE=19289 SRE=23125
2264   0.680160 210.197.167.105 -> 41.177.26.15 TCP 70 [TCP Dup ACK 1583#4] apparenet-tps > http [ACK] Seq=1 Ack=17837 Win=65535 Len=0 SLE=19289 SRE=24577
2586   0.800491 210.197.167.105 -> 41.177.26.15 TCP 64 apparenet-tps > http [ACK] Seq=1 Ack=24577 Win=65535 Len=0
3069   1.019991 210.197.167.105 -> 41.177.26.15 TCP 64 apparenet-tps > http [ACK] Seq=1 Ack=27481 Win=65535 Len=0
4194   1.240091 210.197.167.105 -> 41.177.26.15 TCP 70 [TCP Dup ACK 3069#1] apparenet-tps > http [ACK] Seq=1 Ack=27481 Win=65535 Len=0 SLE=28933 SRE=29865
4200   1.242034 210.197.167.105 -> 41.177.26.15 TCP 70 [TCP Dup ACK 3069#2] apparenet-tps > http [ACK] Seq=1 Ack=27481 Win=65535 Len=0 SLE=28933 SRE=31317
5379   1.729756 210.197.167.105 -> 41.177.26.15 TCP 64 apparenet-tps > http [ACK] Seq=1 Ack=31317 Win=65535 Len=0
6190   1.949686 210.197.167.105 -> 41.177.26.15 TCP 64 apparenet-tps > http [ACK] Seq=1 Ack=34221 Win=65535 Len=0
6689   2.180457 210.197.167.105 -> 41.177.26.15 TCP 70 apparenet-tps > http [ACK] Seq=1 Ack=35673 Win=65535 Len=0 SLE=37125 SRE=38057
7218   2.399923 210.197.167.105 -> 41.177.26.15 TCP 70 [TCP Dup ACK 6689#1] apparenet-tps > http [ACK] Seq=1 Ack=35673 Win=65535 Len=0 SLE=37125 SRE=39509
8163   2.879752 210.197.167.105 -> 41.177.26.15 TCP 64 apparenet-tps > http [ACK] Seq=1 Ack=39509 Win=65535 Len=0
8782   3.099805 210.197.167.105 -> 41.177.26.15 TCP 64 apparenet-tps > http [ACK] Seq=1 Ack=42413 Win=65535 Len=0
9153   3.318372 210.197.167.105 -> 41.177.26.15 TCP 64 apparenet-tps > http [ACK] Seq=1 Ack=45317 Win=65535 Len=0
9894   3.505743 210.197.167.105 -> 41.177.26.15 TCP 64 apparenet-tps > http [ACK] Seq=1 Ack=46249 Win=64603 Len=0
10269   3.539355 210.197.167.105 -> 41.177.26.15 TCP 64 apparenet-tps > http [ACK] Seq=1 Ack=49153 Win=65535 Len=0
12295   3.759198 210.197.167.105 -> 41.177.26.15 TCP 64 apparenet-tps > http [ACK] Seq=1 Ack=52057 Win=65535 Len=0
13256   3.908048 210.197.167.105 -> 41.177.26.15 TCP 64 apparenet-tps > http [ACK] Seq=1 Ack=53509 Win=65535 Len=0
13971   3.978927 210.197.167.105 -> 41.177.26.15 TCP 64 apparenet-tps > http [ACK] Seq=1 Ack=55893 Win=65535 Len=0
14866   4.109305 210.197.167.105 -> 41.177.26.15 TCP 64 apparenet-tps > http [ACK] Seq=1 Ack=57345 Win=65535 Len=0
15273   4.199404 210.197.167.105 -> 41.177.26.15 TCP 64 apparenet-tps > http [ACK] Seq=1 Ack=60249 Win=65535 Len=0
15831   4.310624 210.197.167.105 -> 41.177.26.15 TCP 64 apparenet-tps > http [ACK] Seq=1 Ack=61701 Win=65535 Len=0
16119   4.419535 210.197.167.105 -> 41.177.26.15 TCP 64 apparenet-tps > http [ACK] Seq=1 Ack=64085 Win=65535 Len=0
16500   4.528817 210.197.167.105 -> 41.177.26.15 TCP 64 apparenet-tps > http [ACK] Seq=1 Ack=66989 Win=65535 Len=0
16787   4.639224 210.197.167.105 -> 41.177.26.15 TCP 64 apparenet-tps > http [ACK] Seq=1 Ack=69893 Win=65535 Len=0
16900   4.748905 210.197.167.105 -> 41.177.26.15 TCP 64 apparenet-tps > http [ACK] Seq=1 Ack=72277 Win=65535 Len=0
17139   4.859119 210.197.167.105 -> 41.177.26.15 TCP 64 apparenet-tps > http [ACK] Seq=1 Ack=75181 Win=65535 Len=0
17312   4.969671 210.197.167.105 -> 41.177.26.15 TCP 64 apparenet-tps > http [ACK] Seq=1 Ack=78085 Win=65535 Len=0
17430   5.079129 210.197.167.105 -> 41.177.26.15 TCP 64 apparenet-tps > http [ACK] Seq=1 Ack=80469 Win=65535 Len=0
17523   5.188740 210.197.167.105 -> 41.177.26.15 TCP 64 apparenet-tps > http [ACK] Seq=1 Ack=83373 Win=65535 Len=0
17546   5.199390 210.197.167.105 -> 41.177.26.15 TCP 64 apparenet-tps > http [ACK] Seq=1 Ack=86277 Win=65535 Len=0
17675   5.299366 210.197.167.105 -> 41.177.26.15 TCP 64 apparenet-tps > http [ACK] Seq=1 Ack=88661 Win=65535 Len=0
17792   5.408779 210.197.167.105 -> 41.177.26.15 TCP 64 apparenet-tps > http [ACK] Seq=1 Ack=91565 Win=65535 Len=0
17814   5.419129 210.197.167.105 -> 41.177.26.15 TCP 64 apparenet-tps > http [ACK] Seq=1 Ack=94469 Win=65535 Len=0
18000   5.519247 210.197.167.105 -> 41.177.26.15 TCP 64 apparenet-tps > http [ACK] Seq=1 Ack=97373 Win=65535 Len=0
18100   5.628562 210.197.167.105 -> 41.177.26.15 TCP 64 apparenet-tps > http [ACK] Seq=1 Ack=100277 Win=65535 Len=0
18116   5.639182 210.197.167.105 -> 41.177.26.15 TCP 64 apparenet-tps > http [ACK] Seq=1 Ack=102661 Win=65535 Len=0
18199   5.738228 210.197.167.105 -> 41.177.26.15 TCP 64 apparenet-tps > http [ACK] Seq=1 Ack=105565 Win=65535 Len=0
18426   5.849315 210.197.167.105 -> 41.177.26.15 TCP 64 apparenet-tps > http [ACK] Seq=1 Ack=108469 Win=65535 Len=0
18454   5.859344 210.197.167.105 -> 41.177.26.15 TCP 70 [TCP Dup ACK 18426#1] apparenet-tps > http [ACK] Seq=1 Ack=108469 Win=65535 Len=0 SLE=109401 SRE=110853
18457   5.860920 210.197.167.105 -> 41.177.26.15 TCP 70 [TCP Dup ACK 18426#2] apparenet-tps > http [ACK] Seq=1 Ack=108469 Win=65535 Len=0 SLE=109401 SRE=112305
18672   5.958901 210.197.167.105 -> 41.177.26.15 TCP 70 [TCP Dup ACK 18426#3] apparenet-tps > http [ACK] Seq=1 Ack=108469 Win=65535 Len=0 SLE=109401 SRE=113757
18678   5.960643 210.197.167.105 -> 41.177.26.15 TCP 70 [TCP Dup ACK 18426#4] apparenet-tps > http [ACK] Seq=1 Ack=108469 Win=65535 Len=0 SLE=109401 SRE=115209
18846   6.068303 210.197.167.105 -> 41.177.26.15 TCP 70 [TCP Dup ACK 18426#5] apparenet-tps > http [ACK] Seq=1 Ack=108469 Win=65535 Len=0 SLE=109401 SRE=116661
18988   6.178929 210.197.167.105 -> 41.177.26.15 TCP 64 apparenet-tps > http [ACK] Seq=1 Ack=116661 Win=65535 Len=0
18992   6.180520 210.197.167.105 -> 41.177.26.15 TCP 70 [TCP Dup ACK 18988#1] apparenet-tps > http [ACK] Seq=1 Ack=116661 Win=65535 Len=0 SLE=117593 SRE=119045
19481   6.399677 210.197.167.105 -> 41.177.26.15 TCP 78 [TCP Dup ACK 18988#2] apparenet-tps > http [ACK] Seq=1 Ack=116661 Win=65535 Len=0 SLE=120497 SRE=121949 SLE=117593 SRE=119045
19488   6.402461 210.197.167.105 -> 41.177.26.15 TCP 78 [TCP Dup ACK 18988#3] apparenet-tps > http [ACK] Seq=1 Ack=116661 Win=65535 Len=0 SLE=120497 SRE=123401 SLE=117593 SRE=119045
20101   6.617806 210.197.167.105 -> 41.177.26.15 TCP 70 apparenet-tps > http [ACK] Seq=1 Ack=119045 Win=65535 Len=0 SLE=120497 SRE=123401
20140   6.628546 210.197.167.105 -> 41.177.26.15 TCP 70 [TCP Dup ACK 20101#1] apparenet-tps > http [ACK] Seq=1 Ack=119045 Win=65535 Len=0 SLE=120497 SRE=124853
20151   6.631095 210.197.167.105 -> 41.177.26.15 TCP 70 [TCP Dup ACK 20101#2] apparenet-tps > http [ACK] Seq=1 Ack=119045 Win=65535 Len=0 SLE=120497 SRE=125785
21034   7.019142 210.197.167.105 -> 41.177.26.15 TCP 64 apparenet-tps > http [ACK] Seq=1 Ack=125785 Win=65535 Len=0
21257   7.238931 210.197.167.105 -> 41.177.26.15 TCP 64 apparenet-tps > http [ACK] Seq=1 Ack=128689 Win=65535 Len=0
21553   7.458023 210.197.167.105 -> 41.177.26.15 TCP 64 apparenet-tps > http [ACK] Seq=1 Ack=131593 Win=65535 Len=0
21859   7.629227 210.197.167.105 -> 41.177.26.15 TCP 64 apparenet-tps > http [ACK] Seq=1 Ack=133045 Win=65535 Len=0
21963   7.677743 210.197.167.105 -> 41.177.26.15 TCP 64 apparenet-tps > http [ACK] Seq=1 Ack=135429 Win=65535 Len=0
22319   7.897967 210.197.167.105 -> 41.177.26.15 TCP 64 apparenet-tps > http [ACK] Seq=1 Ack=138333 Win=65535 Len=0
22520   8.031525 210.197.167.105 -> 41.177.26.15 TCP 64 apparenet-tps > http [ACK] Seq=1 Ack=139785 Win=65535 Len=0
22714   8.118020 210.197.167.105 -> 41.177.26.15 TCP 64 apparenet-tps > http [ACK] Seq=1 Ack=142169 Win=65535 Len=0
22848   8.233617 210.197.167.105 -> 41.177.26.15 TCP 64 apparenet-tps > http [ACK] Seq=1 Ack=143621 Win=65535 Len=0
23024   8.338753 210.197.167.105 -> 41.177.26.15 TCP 64 apparenet-tps > http [ACK] Seq=1 Ack=146525 Win=65535 Len=0
23266   8.457915 210.197.167.105 -> 41.177.26.15 TCP 64 apparenet-tps > http [ACK] Seq=1 Ack=149429 Win=65535 Len=0
23558   8.558748 210.197.167.105 -> 41.177.26.15 TCP 64 apparenet-tps > http [ACK] Seq=1 Ack=151813 Win=65535 Len=0
23739   8.688446 210.197.167.105 -> 41.177.26.15 TCP 64 apparenet-tps > http [ACK] Seq=1 Ack=154717 Win=65535 Len=0
23976   8.778704 210.197.167.105 -> 41.177.26.15 TCP 64 apparenet-tps > http [ACK] Seq=1 Ack=157621 Win=65535 Len=0
24117   8.908467 210.197.167.105 -> 41.177.26.15 TCP 64 apparenet-tps > http [ACK] Seq=1 Ack=160005 Win=65535 Len=0
24197   8.998705 210.197.167.105 -> 41.177.26.15 TCP 64 apparenet-tps > http [ACK] Seq=1 Ack=162909 Win=65535 Len=0
24314   9.128235 210.197.167.105 -> 41.177.26.15 TCP 64 apparenet-tps > http [ACK] Seq=1 Ack=165813 Win=65535 Len=0
24425   9.228208 210.197.167.105 -> 41.177.26.15 TCP 64 apparenet-tps > http [ACK] Seq=1 Ack=168197 Win=65535 Len=0
24590   9.338782 210.197.167.105 -> 41.177.26.15 TCP 64 apparenet-tps > http [ACK] Seq=1 Ack=169649 Win=65535 Len=0
24610   9.347233 210.197.167.105 -> 41.177.26.15 TCP 64 apparenet-tps > http [ACK] Seq=1 Ack=172553 Win=65535 Len=0
24813   9.448093 210.197.167.105 -> 41.177.26.15 TCP 64 apparenet-tps > http [ACK] Seq=1 Ack=174937 Win=65535 Len=0
25022   9.558781 210.197.167.105 -> 41.177.26.15 TCP 64 apparenet-tps > http [ACK] Seq=1 Ack=177841 Win=65535 Len=0
25055   9.568243 210.197.167.105 -> 41.177.26.15 TCP 64 apparenet-tps > http [ACK] Seq=1 Ack=180745 Win=65535 Len=0
25173   9.668317 210.197.167.105 -> 41.177.26.15 TCP 64 apparenet-tps > http [ACK] Seq=1 Ack=183129 Win=65535 Len=0
25395   9.777450 210.197.167.105 -> 41.177.26.15 TCP 64 apparenet-tps > http [ACK] Seq=1 Ack=186033 Win=65535 Len=0
25429   9.788379 210.197.167.105 -> 41.177.26.15 TCP 64 apparenet-tps > http [ACK] Seq=1 Ack=188937 Win=65535 Len=0
25618   9.888320 210.197.167.105 -> 41.177.26.15 TCP 64 apparenet-tps > http [ACK] Seq=1 Ack=191321 Win=65535 Len=0
25781   9.998298 210.197.167.105 -> 41.177.26.15 TCP 64 apparenet-tps > http [ACK] Seq=1 Ack=194225 Win=65535 Len=0
25786  10.007949 210.197.167.105 -> 41.177.26.15 TCP 64 apparenet-tps > http [ACK] Seq=1 Ack=197129 Win=65535 Len=0
25961  10.107943 210.197.167.105 -> 41.177.26.15 TCP 64 apparenet-tps > http [ACK] Seq=1 Ack=199513 Win=65535 Len=0
26156  10.218216 210.197.167.105 -> 41.177.26.15 TCP 64 apparenet-tps > http [ACK] Seq=1 Ack=202417 Win=65535 Len=0
26172  10.228043 210.197.167.105 -> 41.177.26.15 TCP 64 apparenet-tps > http [ACK] Seq=1 Ack=205321 Win=65535 Len=0
26354  10.328072 210.197.167.105 -> 41.177.26.15 TCP 64 apparenet-tps > http [ACK] Seq=1 Ack=207705 Win=65535 Len=0
26594  10.438213 210.197.167.105 -> 41.177.26.15 TCP 64 apparenet-tps > http [ACK] Seq=1 Ack=210609 Win=65535 Len=0
26622  10.448128 210.197.167.105 -> 41.177.26.15 TCP 64 apparenet-tps > http [ACK] Seq=1 Ack=213513 Win=65535 Len=0
26636  10.457691 210.197.167.105 -> 41.177.26.15 TCP 64 apparenet-tps > http [ACK] Seq=1 Ack=215897 Win=65535 Len=0
26777  10.547927 210.197.167.105 -> 41.177.26.15 TCP 64 apparenet-tps > http [ACK] Seq=1 Ack=218801 Win=65535 Len=0
27012  10.657299 210.197.167.105 -> 41.177.26.15 TCP 64 apparenet-tps > http [ACK] Seq=1 Ack=221705 Win=65535 Len=0
27035  10.668198 210.197.167.105 -> 41.177.26.15 TCP 64 apparenet-tps > http [ACK] Seq=1 Ack=224609 Win=65535 Len=0
27065  10.677457 210.197.167.105 -> 41.177.26.15 TCP 64 apparenet-tps > http [ACK] Seq=1 Ack=227513 Win=65535 Len=0
27257  10.767800 210.197.167.105 -> 41.177.26.15 TCP 64 apparenet-tps > http [ACK] Seq=1 Ack=229897 Win=65535 Len=0
27516  10.877362 210.197.167.105 -> 41.177.26.15 TCP 64 apparenet-tps > http [ACK] Seq=1 Ack=232801 Win=65535 Len=0
27530  10.887959 210.197.167.105 -> 41.177.26.15 TCP 64 apparenet-tps > http [ACK] Seq=1 Ack=235705 Win=65535 Len=0
27553  10.897456 210.197.167.105 -> 41.177.26.15 TCP 64 apparenet-tps > http [ACK] Seq=1 Ack=238089 Win=65535 Len=0
27695  10.987882 210.197.167.105 -> 41.177.26.15 TCP 64 apparenet-tps > http [ACK] Seq=1 Ack=240993 Win=65535 Len=0
27809  11.098164 210.197.167.105 -> 41.177.26.15 TCP 64 apparenet-tps > http [ACK] Seq=1 Ack=243897 Win=65535 Len=0
27816  11.107879 210.197.167.105 -> 41.177.26.15 TCP 64 apparenet-tps > http [ACK] Seq=1 Ack=246281 Win=65535 Len=0
27854  11.116580 210.197.167.105 -> 41.177.26.15 TCP 64 apparenet-tps > http [ACK] Seq=1 Ack=249185 Win=65535 Len=0
28002  11.206739 210.197.167.105 -> 41.177.26.15 TCP 64 apparenet-tps > http [ACK] Seq=1 Ack=252089 Win=65535 Len=0
28141  11.318139 210.197.167.105 -> 41.177.26.15 TCP 64 apparenet-tps > http [ACK] Seq=1 Ack=254473 Win=65535 Len=0
28148  11.327873 210.197.167.105 -> 41.177.26.15 TCP 64 apparenet-tps > http [ACK] Seq=1 Ack=257377 Win=65535 Len=0
28166  11.337640 210.197.167.105 -> 41.177.26.15 TCP 64 apparenet-tps > http [ACK] Seq=1 Ack=260281 Win=65535 Len=0
28340  11.427233 210.197.167.105 -> 41.177.26.15 TCP 64 apparenet-tps > http [ACK] Seq=1 Ack=262665 Win=65535 Len=0
28598  11.537198 210.197.167.105 -> 41.177.26.15 TCP 64 apparenet-tps > http [ACK] Seq=1 Ack=265569 Win=65535 Len=0
28609  11.546861 210.197.167.105 -> 41.177.26.15 TCP 64 apparenet-tps > http [ACK] Seq=1 Ack=268473 Win=65535 Len=0
28624  11.557468 210.197.167.105 -> 41.177.26.15 TCP 64 apparenet-tps > http [ACK] Seq=1 Ack=270857 Win=65535 Len=0
28628  11.567536 210.197.167.105 -> 41.177.26.15 TCP 64 apparenet-tps > http [ACK] Seq=1 Ack=273761 Win=65535 Len=0
28743  11.657269 210.197.167.105 -> 41.177.26.15 TCP 64 apparenet-tps > http [ACK] Seq=1 Ack=276665 Win=65535 Len=0
28938  11.757061 210.197.167.105 -> 41.177.26.15 TCP 64 apparenet-tps > http [ACK] Seq=1 Ack=279049 Win=65535 Len=0
28976  11.767810 210.197.167.105 -> 41.177.26.15 TCP 64 apparenet-tps > http [ACK] Seq=1 Ack=281953 Win=65535 Len=0
28999  11.777141 210.197.167.105 -> 41.177.26.15 TCP 64 apparenet-tps > http [ACK] Seq=1 Ack=284857 Win=65535 Len=0
29014  11.797755 210.197.167.105 -> 41.177.26.15 TCP 64 apparenet-tps > http [ACK] Seq=1 Ack=287761 Win=65535 Len=0
29160  11.887965 210.197.167.105 -> 41.177.26.15 TCP 64 apparenet-tps > http [ACK] Seq=1 Ack=290665 Win=65535 Len=0
29332  11.977270 210.197.167.105 -> 41.177.26.15 TCP 64 apparenet-tps > http [ACK] Seq=1 Ack=293049 Win=65535 Len=0
29350  11.987526 210.197.167.105 -> 41.177.26.15 TCP 64 apparenet-tps > http [ACK] Seq=1 Ack=295953 Win=65535 Len=0
29373  11.997189 210.197.167.105 -> 41.177.26.15 TCP 64 apparenet-tps > http [ACK] Seq=1 Ack=298857 Win=65535 Len=0
29418  12.027325 210.197.167.105 -> 41.177.26.15 TCP 70 apparenet-tps > http [ACK] Seq=1 Ack=300309 Win=65535 Len=0 SLE=301241 SRE=302693
29497  12.107659 210.197.167.105 -> 41.177.26.15 TCP 70 [TCP Dup ACK 29418#1] apparenet-tps > http [ACK] Seq=1 Ack=300309 Win=65535 Len=0 SLE=301241 SRE=304145
29500  12.109826 210.197.167.105 -> 41.177.26.15 TCP 70 [TCP Dup ACK 29418#2] apparenet-tps > http [ACK] Seq=1 Ack=300309 Win=65535 Len=0 SLE=301241 SRE=305597
29639  12.198095 210.197.167.105 -> 41.177.26.15 TCP 70 [TCP Dup ACK 29418#3] apparenet-tps > http [ACK] Seq=1 Ack=300309 Win=65535 Len=0 SLE=301241 SRE=307049
29645  12.199607 210.197.167.105 -> 41.177.26.15 TCP 70 [TCP Dup ACK 29418#4] apparenet-tps > http [ACK] Seq=1 Ack=300309 Win=65535 Len=0 SLE=301241 SRE=308501
29669  12.207364 210.197.167.105 -> 41.177.26.15 TCP 70 [TCP Dup ACK 29418#5] apparenet-tps > http [ACK] Seq=1 Ack=300309 Win=65535 Len=0 SLE=301241 SRE=309433
29672  12.209318 210.197.167.105 -> 41.177.26.15 TCP 70 [TCP Dup ACK 29418#6] apparenet-tps > http [ACK] Seq=1 Ack=300309 Win=65535 Len=0 SLE=301241 SRE=310885
29683  12.217323 210.197.167.105 -> 41.177.26.15 TCP 70 [TCP Dup ACK 29418#7] apparenet-tps > http [ACK] Seq=1 Ack=300309 Win=65535 Len=0 SLE=301241 SRE=312337
29690  12.219096 210.197.167.105 -> 41.177.26.15 TCP 70 [TCP Dup ACK 29418#8] apparenet-tps > http [ACK] Seq=1 Ack=300309 Win=65535 Len=0 SLE=301241 SRE=313789
29726  12.247239 210.197.167.105 -> 41.177.26.15 TCP 70 [TCP Dup ACK 29418#9] apparenet-tps > http [ACK] Seq=1 Ack=300309 Win=65535 Len=0 SLE=301241 SRE=315241
29941  12.417291 210.197.167.105 -> 41.177.26.15 TCP 64 apparenet-tps > http [ACK] Seq=1 Ack=315241 Win=65535 Len=0
29973  12.427602 210.197.167.105 -> 41.177.26.15 TCP 64 apparenet-tps > http [ACK] Seq=1 Ack=317625 Win=65535 Len=0
30000  12.447659 210.197.167.105 -> 41.177.26.15 TCP 64 apparenet-tps > http [ACK] Seq=1 Ack=320529 Win=65535 Len=0
30291  12.636970 210.197.167.105 -> 41.177.26.15 TCP 64 apparenet-tps > http [ACK] Seq=1 Ack=323433 Win=65535 Len=0
30295  12.647674 210.197.167.105 -> 41.177.26.15 TCP 64 apparenet-tps > http [ACK] Seq=1 Ack=325817 Win=65535 Len=0
30444  12.677632 210.197.167.105 -> 41.177.26.15 TCP 64 apparenet-tps > http [ACK] Seq=1 Ack=328721 Win=65535 Len=0
30808  12.857821 210.197.167.105 -> 41.177.26.15 TCP 64 apparenet-tps > http [ACK] Seq=1 Ack=331625 Win=65535 Len=0
30830  12.867643 210.197.167.105 -> 41.177.26.15 TCP 64 apparenet-tps > http [ACK] Seq=1 Ack=334009 Win=65535 Len=0
30878  12.907509 210.197.167.105 -> 41.177.26.15 TCP 64 apparenet-tps > http [ACK] Seq=1 Ack=336913 Win=65535 Len=0
31127  13.076644 210.197.167.105 -> 41.177.26.15 TCP 64 apparenet-tps > http [ACK] Seq=1 Ack=339817 Win=65535 Len=0
31142  13.087516 210.197.167.105 -> 41.177.26.15 TCP 64 apparenet-tps > http [ACK] Seq=1 Ack=342201 Win=65535 Len=0
31166  13.127173 210.197.167.105 -> 41.177.26.15 TCP 64 apparenet-tps > http [ACK] Seq=1 Ack=345105 Win=65535 Len=0
31388  13.262303 210.197.167.105 -> 41.177.26.15 TCP 64 apparenet-tps > http [ACK] Seq=1 Ack=346557 Win=65535 Len=0
31434  13.297540 210.197.167.105 -> 41.177.26.15 TCP 64 apparenet-tps > http [ACK] Seq=1 Ack=349461 Win=65535 Len=0
31439  13.307182 210.197.167.105 -> 41.177.26.15 TCP 64 apparenet-tps > http [ACK] Seq=1 Ack=352365 Win=65535 Len=0
31492  13.356724 210.197.167.105 -> 41.177.26.15 TCP 64 apparenet-tps > http [ACK] Seq=1 Ack=355269 Win=65535 Len=0
31991  13.516738 210.197.167.105 -> 41.177.26.15 TCP 64 apparenet-tps > http [ACK] Seq=1 Ack=357653 Win=65535 Len=0
32005  13.537189 210.197.167.105 -> 41.177.26.15 TCP 64 apparenet-tps > http [ACK] Seq=1 Ack=360557 Win=65535 Len=0
32068  13.576842 210.197.167.105 -> 41.177.26.15 TCP 64 apparenet-tps > http [ACK] Seq=1 Ack=363461 Win=65535 Len=0
32071  13.579129 210.197.167.105 -> 41.177.26.15 TCP 64 apparenet-tps > http [ACK] Seq=1 Ack=365845 Win=65535 Len=0
32365  13.737429 210.197.167.105 -> 41.177.26.15 TCP 70 [TCP Dup ACK 32071#1] apparenet-tps > http [ACK] Seq=1 Ack=365845 Win=65535 Len=0 SLE=367297 SRE=368749
32408  13.755969 210.197.167.105 -> 41.177.26.15 TCP 70 [TCP Dup ACK 32071#2] apparenet-tps > http [ACK] Seq=1 Ack=365845 Win=65535 Len=0 SLE=367297 SRE=370201
32420  13.767324 210.197.167.105 -> 41.177.26.15 TCP 70 [TCP Dup ACK 32071#3] apparenet-tps > http [ACK] Seq=1 Ack=365845 Win=65535 Len=0 SLE=367297 SRE=371653
32488  13.795816 210.197.167.105 -> 41.177.26.15 TCP 70 [TCP Dup ACK 32071#4] apparenet-tps > http [ACK] Seq=1 Ack=365845 Win=65535 Len=0 SLE=367297 SRE=372585
32499  13.797608 210.197.167.105 -> 41.177.26.15 TCP 70 [TCP Dup ACK 32071#5] apparenet-tps > http [ACK] Seq=1 Ack=365845 Win=65535 Len=0 SLE=367297 SRE=374037
32511  13.799335 210.197.167.105 -> 41.177.26.15 TCP 70 [TCP Dup ACK 32071#6] apparenet-tps > http [ACK] Seq=1 Ack=365845 Win=65535 Len=0 SLE=367297 SRE=375489
32562  13.807078 210.197.167.105 -> 41.177.26.15 TCP 70 [TCP Dup ACK 32071#7] apparenet-tps > http [ACK] Seq=1 Ack=365845 Win=65535 Len=0 SLE=367297 SRE=376941
33004  13.986737 210.197.167.105 -> 41.177.26.15 TCP 64 apparenet-tps > http [ACK] Seq=1 Ack=376941 Win=65535 Len=0
33099  14.016691 210.197.167.105 -> 41.177.26.15 TCP 64 apparenet-tps > http [ACK] Seq=1 Ack=379845 Win=65535 Len=0
33112  14.027260 210.197.167.105 -> 41.177.26.15 TCP 64 apparenet-tps > http [ACK] Seq=1 Ack=382229 Win=65535 Len=0
33571  14.236572 210.197.167.105 -> 41.177.26.15 TCP 64 apparenet-tps > http [ACK] Seq=1 Ack=385133 Win=65535 Len=0
33578  14.247308 210.197.167.105 -> 41.177.26.15 TCP 64 apparenet-tps > http [ACK] Seq=1 Ack=388037 Win=65535 Len=0
33875  14.369241 210.197.167.105 -> 41.177.26.15 TCP 64 apparenet-tps > http [ACK] Seq=1 Ack=388969 Win=64603 Len=0
34050  14.456608 210.197.167.105 -> 41.177.26.15 TCP 64 apparenet-tps > http [ACK] Seq=1 Ack=391873 Win=65535 Len=0
34061  14.466971 210.197.167.105 -> 41.177.26.15 TCP 64 apparenet-tps > http [ACK] Seq=1 Ack=394777 Win=65535 Len=0
34981  14.677001 210.197.167.105 -> 41.177.26.15 TCP 64 apparenet-tps > http [ACK] Seq=1 Ack=397161 Win=65535 Len=0
34984  14.678218 210.197.167.105 -> 41.177.26.15 TCP 70 [TCP Dup ACK 34981#1] apparenet-tps > http [ACK] Seq=1 Ack=397161 Win=65535 Len=0 SLE=398613 SRE=400065
35011  14.686901 210.197.167.105 -> 41.177.26.15 TCP 70 [TCP Dup ACK 34981#2] apparenet-tps > http [ACK] Seq=1 Ack=397161 Win=65535 Len=0 SLE=398613 SRE=401517
35013  14.688876 210.197.167.105 -> 41.177.26.15 TCP 70 [TCP Dup ACK 34981#3] apparenet-tps > http [ACK] Seq=1 Ack=397161 Win=65535 Len=0 SLE=398613 SRE=402969
35725  14.897282 210.197.167.105 -> 41.177.26.15 TCP 70 [TCP Dup ACK 34981#4] apparenet-tps > http [ACK] Seq=1 Ack=397161 Win=65535 Len=0 SLE=398613 SRE=404421
35732  14.898981 210.197.167.105 -> 41.177.26.15 TCP 70 [TCP Dup ACK 34981#5] apparenet-tps > http [ACK] Seq=1 Ack=397161 Win=65535 Len=0 SLE=398613 SRE=405353
35753  14.906809 210.197.167.105 -> 41.177.26.15 TCP 64 apparenet-tps > http [ACK] Seq=1 Ack=405353 Win=65535 Len=0
36114  15.073043 210.197.167.105 -> 41.177.26.15 TCP 64 apparenet-tps > http [ACK] Seq=1 Ack=406805 Win=65535 Len=0
36340  15.117501 210.197.167.105 -> 41.177.26.15 TCP 64 apparenet-tps > http [ACK] Seq=1 Ack=409709 Win=65535 Len=0
36577  15.273655 210.197.167.105 -> 41.177.26.15 TCP 64 apparenet-tps > http [ACK] Seq=1 Ack=411161 Win=65535 Len=0
36686  15.336327 210.197.167.105 -> 41.177.26.15 TCP 64 apparenet-tps > http [ACK] Seq=1 Ack=413545 Win=65535 Len=0
37128  15.475184 210.197.167.105 -> 41.177.26.15 TCP 64 apparenet-tps > http [ACK] Seq=1 Ack=414997 Win=65535 Len=0
37387  15.556214 210.197.167.105 -> 41.177.26.15 TCP 64 apparenet-tps > http [ACK] Seq=1 Ack=417901 Win=65535 Len=0
37714  15.676222 210.197.167.105 -> 41.177.26.15 TCP 64 apparenet-tps > http [ACK] Seq=1 Ack=419353 Win=65535 Len=0
37746  15.695659 210.197.167.105 -> 41.177.26.15 TCP 64 apparenet-tps > http [ACK] Seq=1 Ack=421737 Win=65535 Len=0
38032  15.776265 210.197.167.105 -> 41.177.26.15 TCP 64 apparenet-tps > http [ACK] Seq=1 Ack=424641 Win=65535 Len=0
38492  15.916774 210.197.167.105 -> 41.177.26.15 TCP 64 apparenet-tps > http [ACK] Seq=1 Ack=427545 Win=65535 Len=0
38704  15.996190 210.197.167.105 -> 41.177.26.15 TCP 64 apparenet-tps > http [ACK] Seq=1 Ack=429929 Win=65535 Len=0
38970  16.136528 210.197.167.105 -> 41.177.26.15 TCP 64 apparenet-tps > http [ACK] Seq=1 Ack=432833 Win=65535 Len=0
39194  16.215957 210.197.167.105 -> 41.177.26.15 TCP 64 apparenet-tps > http [ACK] Seq=1 Ack=435737 Win=65535 Len=0
39198  16.217831 210.197.167.105 -> 41.177.26.15 TCP 64 apparenet-tps > http [ACK] Seq=1 Ack=438121 Win=65535 Len=0
39493  16.366238 210.197.167.105 -> 41.177.26.15 TCP 64 apparenet-tps > http [ACK] Seq=1 Ack=441025 Win=65535 Len=0
39562  16.435909 210.197.167.105 -> 41.177.26.15 TCP 64 apparenet-tps > http [ACK] Seq=1 Ack=443929 Win=65535 Len=0
39572  16.445831 210.197.167.105 -> 41.177.26.15 TCP 64 apparenet-tps > http [ACK] Seq=1 Ack=446313 Win=65535 Len=0
39914  16.586262 210.197.167.105 -> 41.177.26.15 TCP 64 apparenet-tps > http [ACK] Seq=1 Ack=449217 Win=65535 Len=0
40047  16.655995 210.197.167.105 -> 41.177.26.15 TCP 64 apparenet-tps > http [ACK] Seq=1 Ack=452121 Win=65535 Len=0
40065  16.665638 210.197.167.105 -> 41.177.26.15 TCP 64 apparenet-tps > http [ACK] Seq=1 Ack=454505 Win=65535 Len=0
40206  16.806148 210.197.167.105 -> 41.177.26.15 TCP 64 apparenet-tps > http [ACK] Seq=1 Ack=457409 Win=65535 Len=0
40317  16.875967 210.197.167.105 -> 41.177.26.15 TCP 64 apparenet-tps > http [ACK] Seq=1 Ack=460313 Win=65535 Len=0
40367  16.886544 210.197.167.105 -> 41.177.26.15 TCP 64 apparenet-tps > http [ACK] Seq=1 Ack=462697 Win=65535 Len=0
40616  17.026520 210.197.167.105 -> 41.177.26.15 TCP 64 apparenet-tps > http [ACK] Seq=1 Ack=465601 Win=65535 Len=0
40915  17.095924 210.197.167.105 -> 41.177.26.15 TCP 64 apparenet-tps > http [ACK] Seq=1 Ack=468505 Win=65535 Len=0
40945  17.106417 210.197.167.105 -> 41.177.26.15 TCP 64 apparenet-tps > http [ACK] Seq=1 Ack=470889 Win=65535 Len=0
41288  17.246296 210.197.167.105 -> 41.177.26.15 TCP 64 apparenet-tps > http [ACK] Seq=1 Ack=473793 Win=65535 Len=0
41488  17.315602 210.197.167.105 -> 41.177.26.15 TCP 64 apparenet-tps > http [ACK] Seq=1 Ack=476697 Win=65535 Len=0
41541  17.326425 210.197.167.105 -> 41.177.26.15 TCP 64 apparenet-tps > http [ACK] Seq=1 Ack=479601 Win=65535 Len=0
41572  17.336094 210.197.167.105 -> 41.177.26.15 TCP 64 apparenet-tps > http [ACK] Seq=1 Ack=482505 Win=65535 Len=0
41992  17.466052 210.197.167.105 -> 41.177.26.15 TCP 64 apparenet-tps > http [ACK] Seq=1 Ack=484889 Win=65535 Len=0
42158  17.536116 210.197.167.105 -> 41.177.26.15 TCP 64 apparenet-tps > http [ACK] Seq=1 Ack=487793 Win=65535 Len=0
42179  17.546353 210.197.167.105 -> 41.177.26.15 TCP 64 apparenet-tps > http [ACK] Seq=1 Ack=490697 Win=65535 Len=0
42185  17.555851 210.197.167.105 -> 41.177.26.15 TCP 64 apparenet-tps > http [ACK] Seq=1 Ack=493081 Win=65535 Len=0
42304  17.685985 210.197.167.105 -> 41.177.26.15 TCP 64 apparenet-tps > http [ACK] Seq=1 Ack=495985 Win=65535 Len=0
42398  17.755893 210.197.167.105 -> 41.177.26.15 TCP 64 apparenet-tps > http [ACK] Seq=1 Ack=498889 Win=65535 Len=0
42408  17.775911 210.197.167.105 -> 41.177.26.15 TCP 64 apparenet-tps > http [ACK] Seq=1 Ack=501273 Win=65535 Len=0
42411  17.777655 210.197.167.105 -> 41.177.26.15 TCP 64 apparenet-tps > http [ACK] Seq=1 Ack=504177 Win=65535 Len=0
42523  17.906083 210.197.167.105 -> 41.177.26.15 TCP 64 apparenet-tps > http [ACK] Seq=1 Ack=507081 Win=65535 Len=0
42643  17.975823 210.197.167.105 -> 41.177.26.15 TCP 64 apparenet-tps > http [ACK] Seq=1 Ack=509465 Win=65535 Len=0
42682  17.995421 210.197.167.105 -> 41.177.26.15 TCP 64 apparenet-tps > http [ACK] Seq=1 Ack=512369 Win=65535 Len=0
42700  18.005455 210.197.167.105 -> 41.177.26.15 TCP 64 apparenet-tps > http [ACK] Seq=1 Ack=515273 Win=65535 Len=0
42886  18.125566 210.197.167.105 -> 41.177.26.15 TCP 64 apparenet-tps > http [ACK] Seq=1 Ack=517657 Win=65535 Len=0
42963  18.195765 210.197.167.105 -> 41.177.26.15 TCP 64 apparenet-tps > http [ACK] Seq=1 Ack=520561 Win=65535 Len=0
42984  18.216055 210.197.167.105 -> 41.177.26.15 TCP 64 apparenet-tps > http [ACK] Seq=1 Ack=523465 Win=65535 Len=0
43002  18.226252 210.197.167.105 -> 41.177.26.15 TCP 64 apparenet-tps > http [ACK] Seq=1 Ack=525849 Win=65535 Len=0
43213  18.345480 210.197.167.105 -> 41.177.26.15 TCP 64 apparenet-tps > http [ACK] Seq=1 Ack=528753 Win=65535 Len=0
43389  18.416577 210.197.167.105 -> 41.177.26.15 TCP 64 apparenet-tps > http [ACK] Seq=1 Ack=531657 Win=65535 Len=0
43459  18.435875 210.197.167.105 -> 41.177.26.15 TCP 64 apparenet-tps > http [ACK] Seq=1 Ack=534041 Win=65535 Len=0
43492  18.445575 210.197.167.105 -> 41.177.26.15 TCP 64 apparenet-tps > http [ACK] Seq=1 Ack=536945 Win=65535 Len=0
43498  18.447946 210.197.167.105 -> 41.177.26.15 TCP 64 apparenet-tps > http [ACK] Seq=1 Ack=539849 Win=65535 Len=0
43839  18.565634 210.197.167.105 -> 41.177.26.15 TCP 64 apparenet-tps > http [ACK] Seq=1 Ack=542233 Win=65535 Len=0
44109  18.635309 210.197.167.105 -> 41.177.26.15 TCP 64 apparenet-tps > http [ACK] Seq=1 Ack=545137 Win=65535 Len=0
44192  18.655737 210.197.167.105 -> 41.177.26.15 TCP 64 apparenet-tps > http [ACK] Seq=1 Ack=548041 Win=65535 Len=0
44198  18.665476 210.197.167.105 -> 41.177.26.15 TCP 64 apparenet-tps > http [ACK] Seq=1 Ack=550425 Win=65535 Len=0
44209  18.676142 210.197.167.105 -> 41.177.26.15 TCP 64 apparenet-tps > http [ACK] Seq=1 Ack=553329 Win=65535 Len=0
44802  18.785640 210.197.167.105 -> 41.177.26.15 TCP 64 apparenet-tps > http [ACK] Seq=1 Ack=556233 Win=65535 Len=0
45053  18.855270 210.197.167.105 -> 41.177.26.15 TCP 64 apparenet-tps > http [ACK] Seq=1 Ack=558617 Win=65535 Len=0
45106  18.875733 210.197.167.105 -> 41.177.26.15 TCP 64 apparenet-tps > http [ACK] Seq=1 Ack=561521 Win=65535 Len=0
45165  18.885239 210.197.167.105 -> 41.177.26.15 TCP 64 apparenet-tps > http [ACK] Seq=1 Ack=564425 Win=65535 Len=0
45186  18.895342 210.197.167.105 -> 41.177.26.15 TCP 64 apparenet-tps > http [ACK] Seq=1 Ack=566809 Win=65535 Len=0
45392  19.005688 210.197.167.105 -> 41.177.26.15 TCP 64 apparenet-tps > http [ACK] Seq=1 Ack=569713 Win=65535 Len=0
45520  19.075326 210.197.167.105 -> 41.177.26.15 TCP 64 apparenet-tps > http [ACK] Seq=1 Ack=572617 Win=65535 Len=0
45565  19.095836 210.197.167.105 -> 41.177.26.15 TCP 64 apparenet-tps > http [ACK] Seq=1 Ack=575001 Win=65535 Len=0
45627  19.105276 210.197.167.105 -> 41.177.26.15 TCP 64 apparenet-tps > http [ACK] Seq=1 Ack=577905 Win=65535 Len=0
45644  19.115459 210.197.167.105 -> 41.177.26.15 TCP 64 apparenet-tps > http [ACK] Seq=1 Ack=580809 Win=65535 Len=0
45943  19.225552 210.197.167.105 -> 41.177.26.15 TCP 64 apparenet-tps > http [ACK] Seq=1 Ack=583193 Win=65535 Len=0
46084  19.296361 210.197.167.105 -> 41.177.26.15 TCP 64 apparenet-tps > http [ACK] Seq=1 Ack=586097 Win=65535 Len=0
46248  19.315753 210.197.167.105 -> 41.177.26.15 TCP 64 apparenet-tps > http [ACK] Seq=1 Ack=589001 Win=65535 Len=0
46312  19.325334 210.197.167.105 -> 41.177.26.15 TCP 64 apparenet-tps > http [ACK] Seq=1 Ack=591385 Win=65535 Len=0
46335  19.336060 210.197.167.105 -> 41.177.26.15 TCP 64 apparenet-tps > http [ACK] Seq=1 Ack=594289 Win=65535 Len=0
46760  19.445297 210.197.167.105 -> 41.177.26.15 TCP 64 apparenet-tps > http [ACK] Seq=1 Ack=597193 Win=65535 Len=0
47132  19.515103 210.197.167.105 -> 41.177.26.15 TCP 70 [TCP Dup ACK 46760#1] apparenet-tps > http [ACK] Seq=1 Ack=597193 Win=65535 Len=0 SLE=598645 SRE=599577
47161  19.517139 210.197.167.105 -> 41.177.26.15 TCP 70 [TCP Dup ACK 46760#2] apparenet-tps > http [ACK] Seq=1 Ack=597193 Win=65535 Len=0 SLE=598645 SRE=601029
47216  19.526152 210.197.167.105 -> 41.177.26.15 TCP 70 [TCP Dup ACK 46760#3] apparenet-tps > http [ACK] Seq=1 Ack=597193 Win=65535 Len=0 SLE=598645 SRE=602481
47248  19.535417 210.197.167.105 -> 41.177.26.15 TCP 70 [TCP Dup ACK 46760#4] apparenet-tps > http [ACK] Seq=1 Ack=597193 Win=65535 Len=0 SLE=598645 SRE=603933
47249  19.538509 210.197.167.105 -> 41.177.26.15 TCP 70 [TCP Dup ACK 46760#5] apparenet-tps > http [ACK] Seq=1 Ack=597193 Win=65535 Len=0 SLE=598645 SRE=605385
47298  19.554930 210.197.167.105 -> 41.177.26.15 TCP 70 [TCP Dup ACK 46760#6] apparenet-tps > http [ACK] Seq=1 Ack=597193 Win=65535 Len=0 SLE=598645 SRE=606837
47302  19.556985 210.197.167.105 -> 41.177.26.15 TCP 70 [TCP Dup ACK 46760#7] apparenet-tps > http [ACK] Seq=1 Ack=597193 Win=65535 Len=0 SLE=598645 SRE=608289
47315  19.565625 210.197.167.105 -> 41.177.26.15 TCP 70 [TCP Dup ACK 46760#8] apparenet-tps > http [ACK] Seq=1 Ack=597193 Win=65535 Len=0 SLE=598645 SRE=609741
47319  19.567301 210.197.167.105 -> 41.177.26.15 TCP 70 [TCP Dup ACK 46760#9] apparenet-tps > http [ACK] Seq=1 Ack=597193 Win=65535 Len=0 SLE=598645 SRE=611193
47722  19.665397 210.197.167.105 -> 41.177.26.15 TCP 70 [TCP Dup ACK 46760#10] apparenet-tps > http [ACK] Seq=1 Ack=597193 Win=65535 Len=0 SLE=598645 SRE=612645
47731  19.667443 210.197.167.105 -> 41.177.26.15 TCP 70 [TCP Dup ACK 46760#11] apparenet-tps > http [ACK] Seq=1 Ack=597193 Win=65535 Len=0 SLE=598645 SRE=613577
48100  19.755285 210.197.167.105 -> 41.177.26.15 TCP 64 apparenet-tps > http [ACK] Seq=1 Ack=613577 Win=65535 Len=0
48184  19.776050 210.197.167.105 -> 41.177.26.15 TCP 64 apparenet-tps > http [ACK] Seq=1 Ack=616481 Win=65535 Len=0
48221  19.785788 210.197.167.105 -> 41.177.26.15 TCP 64 apparenet-tps > http [ACK] Seq=1 Ack=619385 Win=65535 Len=0
48696  19.885455 210.197.167.105 -> 41.177.26.15 TCP 64 apparenet-tps > http [ACK] Seq=1 Ack=621769 Win=65535 Len=0
49121  19.996319 210.197.167.105 -> 41.177.26.15 TCP 64 apparenet-tps > http [ACK] Seq=1 Ack=624673 Win=65535 Len=0
49161  20.004626 210.197.167.105 -> 41.177.26.15 TCP 64 apparenet-tps > http [ACK] Seq=1 Ack=627577 Win=65535 Len=0
49462  20.105420 210.197.167.105 -> 41.177.26.15 TCP 64 apparenet-tps > http [ACK] Seq=1 Ack=629961 Win=65535 Len=0
49784  20.214836 210.197.167.105 -> 41.177.26.15 TCP 64 apparenet-tps > http [ACK] Seq=1 Ack=632865 Win=65535 Len=0
49814  20.225297 210.197.167.105 -> 41.177.26.15 TCP 64 apparenet-tps > http [ACK] Seq=1 Ack=635769 Win=65535 Len=0
50026  20.325172 210.197.167.105 -> 41.177.26.15 TCP 64 apparenet-tps > http [ACK] Seq=1 Ack=638153 Win=65535 Len=0
50208  20.435740 210.197.167.105 -> 41.177.26.15 TCP 64 apparenet-tps > http [ACK] Seq=1 Ack=641057 Win=65535 Len=0
50234  20.445476 210.197.167.105 -> 41.177.26.15 TCP 64 apparenet-tps > http [ACK] Seq=1 Ack=643961 Win=65535 Len=0
50238  20.447256 210.197.167.105 -> 41.177.26.15 TCP 64 apparenet-tps > http [ACK] Seq=1 Ack=646345 Win=65535 Len=0
50456  20.544985 210.197.167.105 -> 41.177.26.15 TCP 64 apparenet-tps > http [ACK] Seq=1 Ack=649249 Win=65535 Len=0
50653  20.655558 210.197.167.105 -> 41.177.26.15 TCP 64 apparenet-tps > http [ACK] Seq=1 Ack=652153 Win=65535 Len=0
50672  20.664525 210.197.167.105 -> 41.177.26.15 TCP 64 apparenet-tps > http [ACK] Seq=1 Ack=654537 Win=65535 Len=0
50684  20.674992 210.197.167.105 -> 41.177.26.15 TCP 64 apparenet-tps > http [ACK] Seq=1 Ack=657441 Win=65535 Len=0
50761  20.765127 210.197.167.105 -> 41.177.26.15 TCP 64 apparenet-tps > http [ACK] Seq=1 Ack=660345 Win=65535 Len=0
50891  20.875456 210.197.167.105 -> 41.177.26.15 TCP 64 apparenet-tps > http [ACK] Seq=1 Ack=662729 Win=65535 Len=0
50897  20.885460 210.197.167.105 -> 41.177.26.15 TCP 64 apparenet-tps > http [ACK] Seq=1 Ack=665633 Win=65535 Len=0
50927  20.894673 210.197.167.105 -> 41.177.26.15 TCP 64 apparenet-tps > http [ACK] Seq=1 Ack=668537 Win=65535 Len=0
51112  20.984649 210.197.167.105 -> 41.177.26.15 TCP 64 apparenet-tps > http [ACK] Seq=1 Ack=671441 Win=65535 Len=0
51383  21.095542 210.197.167.105 -> 41.177.26.15 TCP 64 apparenet-tps > http [ACK] Seq=1 Ack=674345 Win=65535 Len=0
51395  21.105379 210.197.167.105 -> 41.177.26.15 TCP 64 apparenet-tps > http [ACK] Seq=1 Ack=676729 Win=65535 Len=0
51444  21.114976 210.197.167.105 -> 41.177.26.15 TCP 64 apparenet-tps > http [ACK] Seq=1 Ack=679633 Win=65535 Len=0
51589  21.205240 210.197.167.105 -> 41.177.26.15 TCP 64 apparenet-tps > http [ACK] Seq=1 Ack=682537 Win=65535 Len=0
51765  21.314810 210.197.167.105 -> 41.177.26.15 TCP 70 [TCP Dup ACK 51589#1] apparenet-tps > http [ACK] Seq=1 Ack=682537 Win=65535 Len=0 SLE=683989 SRE=684921
51768  21.317094 210.197.167.105 -> 41.177.26.15 TCP 70 [TCP Dup ACK 51589#2] apparenet-tps > http [ACK] Seq=1 Ack=682537 Win=65535 Len=0 SLE=683989 SRE=686373
51786  21.325224 210.197.167.105 -> 41.177.26.15 TCP 70 [TCP Dup ACK 51589#3] apparenet-tps > http [ACK] Seq=1 Ack=682537 Win=65535 Len=0 SLE=683989 SRE=687825
51790  21.327169 210.197.167.105 -> 41.177.26.15 TCP 70 [TCP Dup ACK 51589#4] apparenet-tps > http [ACK] Seq=1 Ack=682537 Win=65535 Len=0 SLE=683989 SRE=689277
51817  21.334848 210.197.167.105 -> 41.177.26.15 TCP 70 [TCP Dup ACK 51589#5] apparenet-tps > http [ACK] Seq=1 Ack=682537 Win=65535 Len=0 SLE=683989 SRE=690729
51823  21.337553 210.197.167.105 -> 41.177.26.15 TCP 70 [TCP Dup ACK 51589#6] apparenet-tps > http [ACK] Seq=1 Ack=682537 Win=65535 Len=0 SLE=683989 SRE=692181
52003  21.424267 210.197.167.105 -> 41.177.26.15 TCP 70 [TCP Dup ACK 51589#7] apparenet-tps > http [ACK] Seq=1 Ack=682537 Win=65535 Len=0 SLE=683989 SRE=693113
52039  21.434696 210.197.167.105 -> 41.177.26.15 TCP 70 [TCP Dup ACK 51589#8] apparenet-tps > http [ACK] Seq=1 Ack=682537 Win=65535 Len=0 SLE=683989 SRE=694565
52258  21.545093 210.197.167.105 -> 41.177.26.15 TCP 64 apparenet-tps > http [ACK] Seq=1 Ack=694565 Win=65535 Len=0
52289  21.555123 210.197.167.105 -> 41.177.26.15 TCP 64 apparenet-tps > http [ACK] Seq=1 Ack=697469 Win=65535 Len=0
52461  21.654640 210.197.167.105 -> 41.177.26.15 TCP 64 apparenet-tps > http [ACK] Seq=1 Ack=700373 Win=65535 Len=0
52519  21.774776 210.197.167.105 -> 41.177.26.15 TCP 64 apparenet-tps > http [ACK] Seq=1 Ack=702757 Win=65535 Len=0
52608  21.874812 210.197.167.105 -> 41.177.26.15 TCP 64 apparenet-tps > http [ACK] Seq=1 Ack=705661 Win=65535 Len=0
52773  21.994670 210.197.167.105 -> 41.177.26.15 TCP 64 apparenet-tps > http [ACK] Seq=1 Ack=708565 Win=65535 Len=0
52967  22.095532 210.197.167.105 -> 41.177.26.15 TCP 64 apparenet-tps > http [ACK] Seq=1 Ack=710949 Win=65535 Len=0
53589  22.213948 210.197.167.105 -> 41.177.26.15 TCP 64 apparenet-tps > http [ACK] Seq=1 Ack=712401 Win=65535 Len=0
53602  22.215733 210.197.167.105 -> 41.177.26.15 TCP 64 apparenet-tps > http [ACK] Seq=1 Ack=715305 Win=65535 Len=0
53989  22.314721 210.197.167.105 -> 41.177.26.15 TCP 64 apparenet-tps > http [ACK] Seq=1 Ack=717689 Win=65535 Len=0
54170  22.434750 210.197.167.105 -> 41.177.26.15 TCP 64 apparenet-tps > http [ACK] Seq=1 Ack=720593 Win=65535 Len=0
54188  22.445369 210.197.167.105 -> 41.177.26.15 TCP 64 apparenet-tps > http [ACK] Seq=1 Ack=723497 Win=65535 Len=0
54365  22.534486 210.197.167.105 -> 41.177.26.15 TCP 64 apparenet-tps > http [ACK] Seq=1 Ack=725881 Win=65535 Len=0
54681  22.654781 210.197.167.105 -> 41.177.26.15 TCP 64 apparenet-tps > http [ACK] Seq=1 Ack=728785 Win=65535 Len=0
54711  22.665132 210.197.167.105 -> 41.177.26.15 TCP 64 apparenet-tps > http [ACK] Seq=1 Ack=731689 Win=65535 Len=0
55027  22.754354 210.197.167.105 -> 41.177.26.15 TCP 64 apparenet-tps > http [ACK] Seq=1 Ack=734593 Win=65535 Len=0
55341  22.873677 210.197.167.105 -> 41.177.26.15 TCP 64 apparenet-tps > http [ACK] Seq=1 Ack=737497 Win=65535 Len=0
55434  22.885224 210.197.167.105 -> 41.177.26.15 TCP 64 apparenet-tps > http [ACK] Seq=1 Ack=739881 Win=65535 Len=0
55908  22.974606 210.197.167.105 -> 41.177.26.15 TCP 64 apparenet-tps > http [ACK] Seq=1 Ack=742785 Win=65535 Len=0
56259  23.094558 210.197.167.105 -> 41.177.26.15 TCP 64 apparenet-tps > http [ACK] Seq=1 Ack=745689 Win=65535 Len=0
56272  23.105334 210.197.167.105 -> 41.177.26.15 TCP 64 apparenet-tps > http [ACK] Seq=1 Ack=748073 Win=65535 Len=0
