857836 283.467368 215.48.108.144 -> 244.3.210.197 TCP 82 55909 > http [SYN] Seq=0 Win=65535 Len=0 MSS=1452 WS=2 TSval=111282083 TSecr=0 SACK_PERM=1
858277 283.584209 215.48.108.144 -> 244.3.210.197 TCP 70 55909 > http [ACK] Seq=1 Ack=1 Win=66240 Len=0 TSval=111282084 TSecr=0
861628 284.130653 215.48.108.144 -> 244.3.210.197 TCP 70 55909 > http [ACK] Seq=737 Ack=2881 Win=64800 Len=0 TSval=111282089 TSecr=150409455
861640 284.135175 215.48.108.144 -> 244.3.210.197 TCP 82 55910 > http [SYN] Seq=0 Win=65535 Len=0 MSS=1452 WS=2 TSval=111282089 TSecr=0 SACK_PERM=1
861652 284.137052 215.48.108.144 -> 244.3.210.197 TCP 82 55911 > http [SYN] Seq=0 Win=65535 Len=0 MSS=1452 WS=2 TSval=111282089 TSecr=0 SACK_PERM=1
861659 284.139332 215.48.108.144 -> 244.3.210.197 TCP 82 55912 > http [SYN] Seq=0 Win=65535 Len=0 MSS=1452 WS=2 TSval=111282089 TSecr=0 SACK_PERM=1
861666 284.140608 215.48.108.144 -> 244.3.210.197 TCP 82 55913 > http [SYN] Seq=0 Win=65535 Len=0 MSS=1452 WS=2 TSval=111282089 TSecr=0 SACK_PERM=1
861808 284.254694 215.48.108.144 -> 244.3.210.197 TCP 70 55909 > http [ACK] Seq=737 Ack=4321 Win=66240 Len=0 TSval=111282090 TSecr=150409457
861816 284.255637 215.48.108.144 -> 244.3.210.197 TCP 70 55909 > http [ACK] Seq=737 Ack=5761 Win=64800 Len=0 TSval=111282090 TSecr=150409457
861826 284.257263 215.48.108.144 -> 244.3.210.197 TCP 70 55909 > http [ACK] Seq=737 Ack=7201 Win=66240 Len=0 TSval=111282090 TSecr=150409457
861834 284.258027 215.48.108.144 -> 244.3.210.197 TCP 70 55910 > http [ACK] Seq=1 Ack=1 Win=66240 Len=0 TSval=111282090 TSecr=0
861874 284.267801 215.48.108.144 -> 244.3.210.197 TCP 70 55911 > http [ACK] Seq=1 Ack=1 Win=66240 Len=0 TSval=111282090 TSecr=0
861901 284.277256 215.48.108.144 -> 244.3.210.197 TCP 70 55912 > http [ACK] Seq=1 Ack=1 Win=66240 Len=0 TSval=111282090 TSecr=0
861908 284.278212 215.48.108.144 -> 244.3.210.197 TCP 70 55913 > http [ACK] Seq=1 Ack=1 Win=66240 Len=0 TSval=111282090 TSecr=0
861995 284.373920 215.48.108.144 -> 244.3.210.197 TCP 70 55909 > http [ACK] Seq=737 Ack=8641 Win=64800 Len=0 TSval=111282092 TSecr=150409458
862005 284.377131 215.48.108.144 -> 244.3.210.197 TCP 70 55909 > http [ACK] Seq=737 Ack=10081 Win=66240 Len=0 TSval=111282092 TSecr=150409458
862015 284.380900 215.48.108.144 -> 244.3.210.197 TCP 70 55909 > http [ACK] Seq=737 Ack=12961 Win=66240 Len=0 TSval=111282092 TSecr=150409458
862027 284.386585 215.48.108.144 -> 244.3.210.197 TCP 70 55909 > http [ACK] Seq=737 Ack=15841 Win=66240 Len=0 TSval=111282092 TSecr=150409458
862038 284.390770 215.48.108.144 -> 244.3.210.197 TCP 70 55910 > http [ACK] Seq=709 Ack=2881 Win=66240 Len=0 TSval=111282092 TSecr=150409458
862049 284.398630 215.48.108.144 -> 244.3.210.197 TCP 70 55911 > http [ACK] Seq=719 Ack=2881 Win=66240 Len=0 TSval=111282092 TSecr=150409458
862068 284.410520 215.48.108.144 -> 244.3.210.197 TCP 70 55912 > http [ACK] Seq=718 Ack=2881 Win=66240 Len=0 TSval=111282092 TSecr=150409458
862085 284.418934 215.48.108.144 -> 244.3.210.197 TCP 70 55913 > http [ACK] Seq=715 Ack=2881 Win=66240 Len=0 TSval=111282092 TSecr=150409458
862278 284.497048 215.48.108.144 -> 244.3.210.197 TCP 70 55909 > http [ACK] Seq=737 Ack=18721 Win=66240 Len=0 TSval=111282093 TSecr=150409459
862285 284.498162 215.48.108.144 -> 244.3.210.197 TCP 70 55909 > http [ACK] Seq=737 Ack=19455 Win=65506 Len=0 TSval=111282093 TSecr=150409459
862291 284.499304 215.48.108.144 -> 244.3.210.197 TCP 70 55909 > http [FIN, ACK] Seq=737 Ack=19455 Win=66240 Len=0 TSval=111282093 TSecr=150409459
862318 284.510101 215.48.108.144 -> 244.3.210.197 TCP 70 55910 > http [ACK] Seq=709 Ack=4321 Win=64800 Len=0 TSval=111282093 TSecr=150409459
862328 284.512900 215.48.108.144 -> 244.3.210.197 TCP 70 55910 > http [ACK] Seq=709 Ack=5761 Win=66240 Len=0 TSval=111282093 TSecr=150409459
862339 284.514995 215.48.108.144 -> 244.3.210.197 TCP 70 55910 > http [ACK] Seq=709 Ack=7201 Win=64800 Len=0 TSval=111282093 TSecr=150409459
862383 284.519080 215.48.108.144 -> 244.3.210.197 TCP 70 55911 > http [ACK] Seq=719 Ack=4321 Win=64800 Len=0 TSval=111282093 TSecr=150409459
862399 284.520486 215.48.108.144 -> 244.3.210.197 TCP 70 55911 > http [ACK] Seq=719 Ack=5761 Win=66240 Len=0 TSval=111282093 TSecr=150409459
862409 284.522701 215.48.108.144 -> 244.3.210.197 TCP 70 55911 > http [ACK] Seq=719 Ack=7201 Win=64800 Len=0 TSval=111282093 TSecr=150409459
862433 284.528991 215.48.108.144 -> 244.3.210.197 TCP 70 55912 > http [ACK] Seq=718 Ack=3302 Win=65818 Len=0 TSval=111282093 TSecr=150409459
862443 284.529963 215.48.108.144 -> 244.3.210.197 TCP 70 55912 > http [FIN, ACK] Seq=718 Ack=3302 Win=66240 Len=0 TSval=111282093 TSecr=150409459
862455 284.536739 215.48.108.144 -> 244.3.210.197 TCP 70 55913 > http [ACK] Seq=715 Ack=3366 Win=65754 Len=0 TSval=111282093 TSecr=150409459
862511 284.586306 215.48.108.144 -> 244.3.210.197 TCP 70 55913 > http [FIN, ACK] Seq=715 Ack=3366 Win=66240 Len=0 TSval=111282094 TSecr=150409459
862555 284.616739 215.48.108.144 -> 244.3.210.197 TCP 70 [TCP Dup ACK 862291#1] 55909 > http [ACK] Seq=738 Ack=19455 Win=66240 Len=0 TSval=111282094 TSecr=150409460
862561 284.617981 215.48.108.144 -> 244.3.210.197 TCP 70 55909 > http [ACK] Seq=738 Ack=19456 Win=66240 Len=0 TSval=111282094 TSecr=150409460
862586 284.632318 215.48.108.144 -> 244.3.210.197 TCP 70 55910 > http [ACK] Seq=709 Ack=10081 Win=63360 Len=0 TSval=111282094 TSecr=150409460
862598 284.646418 215.48.108.144 -> 244.3.210.197 TCP 70 55911 > http [ACK] Seq=719 Ack=10081 Win=63360 Len=0 TSval=111282094 TSecr=150409460
862606 284.647543 215.48.108.144 -> 244.3.210.197 TCP 70 55911 > http [ACK] Seq=719 Ack=10382 Win=63058 Len=0 TSval=111282094 TSecr=150409460
862614 284.649085 215.48.108.144 -> 244.3.210.197 TCP 70 [TCP Dup ACK 862443#1] 55912 > http [ACK] Seq=719 Ack=3302 Win=66240 Len=0 TSval=111282094 TSecr=150409460
862624 284.650198 215.48.108.144 -> 244.3.210.197 TCP 70 55912 > http [ACK] Seq=719 Ack=3303 Win=66240 Len=0 TSval=111282094 TSecr=150409460
862644 284.674586 215.48.108.144 -> 244.3.210.197 TCP 70 55910 > http [ACK] Seq=709 Ack=15841 Win=66240 Len=0 TSval=111282095 TSecr=150409460
862665 284.676633 215.48.108.144 -> 244.3.210.197 TCP 70 55911 > http [FIN, ACK] Seq=719 Ack=10382 Win=66240 Len=0 TSval=111282095 TSecr=150409460
862735 284.702925 215.48.108.144 -> 244.3.210.197 TCP 70 [TCP Dup ACK 862511#1] 55913 > http [ACK] Seq=716 Ack=3366 Win=66240 Len=0 TSval=111282095 TSecr=150409461
862741 284.704154 215.48.108.144 -> 244.3.210.197 TCP 70 55913 > http [ACK] Seq=716 Ack=3367 Win=66240 Len=0 TSval=111282095 TSecr=150409461
862813 284.754511 215.48.108.144 -> 244.3.210.197 TCP 70 55910 > http [ACK] Seq=709 Ack=18721 Win=66240 Len=0 TSval=111282095 TSecr=150409462
862826 284.765002 215.48.108.144 -> 244.3.210.197 TCP 70 55910 > http [ACK] Seq=709 Ack=20161 Win=66240 Len=0 TSval=111282095 TSecr=150409462
862867 284.795993 215.48.108.144 -> 244.3.210.197 TCP 70 55910 > http [ACK] Seq=709 Ack=23041 Win=66240 Len=0 TSval=111282096 TSecr=150409462
862875 284.801057 215.48.108.144 -> 244.3.210.197 TCP 70 55910 > http [ACK] Seq=709 Ack=25921 Win=66240 Len=0 TSval=111282096 TSecr=150409462
862881 284.803004 215.48.108.144 -> 244.3.210.197 TCP 70 [TCP Dup ACK 862665#1] 55911 > http [ACK] Seq=720 Ack=10382 Win=66240 Len=0 TSval=111282096 TSecr=150409462
862892 284.806168 215.48.108.144 -> 244.3.210.197 TCP 70 55911 > http [ACK] Seq=720 Ack=10383 Win=66240 Len=0 TSval=111282096 TSecr=150409462
863041 284.878422 215.48.108.144 -> 244.3.210.197 TCP 70 55910 > http [ACK] Seq=709 Ack=28801 Win=66240 Len=0 TSval=111282097 TSecr=150409462
863047 284.879315 215.48.108.144 -> 244.3.210.197 TCP 70 55910 > http [ACK] Seq=709 Ack=31681 Win=66240 Len=0 TSval=111282097 TSecr=150409463
863061 284.884855 215.48.108.144 -> 244.3.210.197 TCP 70 55910 > http [ACK] Seq=709 Ack=33121 Win=64800 Len=0 TSval=111282097 TSecr=150409463
863068 284.887143 215.48.108.144 -> 244.3.210.197 TCP 70 55910 > http [ACK] Seq=709 Ack=34243 Win=65118 Len=0 TSval=111282097 TSecr=150409463
863076 284.887999 215.48.108.144 -> 244.3.210.197 TCP 70 55910 > http [FIN, ACK] Seq=709 Ack=34243 Win=66240 Len=0 TSval=111282097 TSecr=150409463
863295 285.004749 215.48.108.144 -> 244.3.210.197 TCP 70 [TCP Dup ACK 863076#1] 55910 > http [ACK] Seq=710 Ack=34243 Win=66240 Len=0 TSval=111282098 TSecr=150409464
863302 285.005674 215.48.108.144 -> 244.3.210.197 TCP 70 55910 > http [ACK] Seq=710 Ack=34244 Win=66240 Len=0 TSval=111282098 TSecr=150409464
863731 285.306857 215.48.108.144 -> 244.3.210.197 TCP 82 55916 > http [SYN] Seq=0 Win=65535 Len=0 MSS=1452 WS=2 TSval=111282101 TSecr=0 SACK_PERM=1
863963 285.422567 215.48.108.144 -> 244.3.210.197 TCP 70 55916 > http [ACK] Seq=1 Ack=1 Win=66240 Len=0 TSval=111282102 TSecr=0
864342 285.556687 215.48.108.144 -> 244.3.210.197 TCP 70 55916 > http [ACK] Seq=724 Ack=2881 Win=66240 Len=0 TSval=111282103 TSecr=150409469
864503 285.676852 215.48.108.144 -> 244.3.210.197 TCP 70 55916 > http [ACK] Seq=724 Ack=4321 Win=64800 Len=0 TSval=111282105 TSecr=150409471
864520 285.678602 215.48.108.144 -> 244.3.210.197 TCP 70 55916 > http [ACK] Seq=724 Ack=5761 Win=66240 Len=0 TSval=111282105 TSecr=150409471
864551 285.681036 215.48.108.144 -> 244.3.210.197 TCP 70 55916 > http [ACK] Seq=724 Ack=7201 Win=64800 Len=0 TSval=111282105 TSecr=150409471
864773 285.808257 215.48.108.144 -> 244.3.210.197 TCP 70 55916 > http [ACK] Seq=724 Ack=8641 Win=66240 Len=0 TSval=111282106 TSecr=150409472
864782 285.810311 215.48.108.144 -> 244.3.210.197 TCP 70 55916 > http [ACK] Seq=724 Ack=10081 Win=64800 Len=0 TSval=111282106 TSecr=150409472
864792 285.812726 215.48.108.144 -> 244.3.210.197 TCP 70 55916 > http [ACK] Seq=724 Ack=11521 Win=66240 Len=0 TSval=111282106 TSecr=150409472
864804 285.816644 215.48.108.144 -> 244.3.210.197 TCP 70 55916 > http [ACK] Seq=724 Ack=14401 Win=66240 Len=0 TSval=111282106 TSecr=150409472
865050 285.928605 215.48.108.144 -> 244.3.210.197 TCP 70 55916 > http [ACK] Seq=724 Ack=17281 Win=66240 Len=0 TSval=111282107 TSecr=150409472
865074 285.932421 215.48.108.144 -> 244.3.210.197 TCP 70 55916 > http [ACK] Seq=724 Ack=20161 Win=66240 Len=0 TSval=111282107 TSecr=150409473
865086 285.936627 215.48.108.144 -> 244.3.210.197 TCP 70 55916 > http [ACK] Seq=724 Ack=23041 Win=64800 Len=0 TSval=111282107 TSecr=150409473
865094 285.938780 215.48.108.144 -> 244.3.210.197 TCP 70 55916 > http [ACK] Seq=724 Ack=24891 Win=62950 Len=0 TSval=111282107 TSecr=150409473
865242 285.990858 215.48.108.144 -> 244.3.210.197 TCP 70 55916 > http [FIN, ACK] Seq=724 Ack=24891 Win=66240 Len=0 TSval=111282108 TSecr=150409473
865531 286.106820 215.48.108.144 -> 244.3.210.197 TCP 70 [TCP Dup ACK 865242#1] 55916 > http [ACK] Seq=725 Ack=24891 Win=66240 Len=0 TSval=111282109 TSecr=150409475
865557 286.108800 215.48.108.144 -> 244.3.210.197 TCP 70 55916 > http [ACK] Seq=725 Ack=24892 Win=66240 Len=0 TSval=111282109 TSecr=150409475
