713544 227.660310 219.160.224.138 -> 244.3.210.197 TCP 66 4898 > http [SYN] Seq=0 Win=65535 Len=0 MSS=1460 SACK_PERM=1
713724 227.705008 219.160.224.138 -> 244.3.210.197 TCP 64 4898 > http [ACK] Seq=1 Ack=1 Win=65535 Len=0
715156 228.209075 219.160.224.138 -> 244.3.210.197 TCP 64 4898 > http [ACK] Seq=478 Ack=2921 Win=65535 Len=0
715282 228.264273 219.160.224.138 -> 244.3.210.197 TCP 64 4898 > http [ACK] Seq=478 Ack=4381 Win=65535 Len=0
715344 228.280088 219.160.224.138 -> 244.3.210.197 TCP 64 4898 > http [ACK] Seq=478 Ack=7301 Win=65535 Len=0
715482 228.318979 219.160.224.138 -> 244.3.210.197 TCP 64 4898 > http [ACK] Seq=478 Ack=8761 Win=65535 Len=0
715517 228.334119 219.160.224.138 -> 244.3.210.197 TCP 64 4898 > http [ACK] Seq=478 Ack=11681 Win=65535 Len=0
715532 228.342997 219.160.224.138 -> 244.3.210.197 TCP 64 4898 > http [ACK] Seq=478 Ack=13141 Win=65535 Len=0
715608 228.370180 219.160.224.138 -> 244.3.210.197 TCP 64 4898 > http [ACK] Seq=478 Ack=15420 Win=65535 Len=0
715776 228.435074 219.160.224.138 -> 244.3.210.197 TCP 66 radmin-port > http [SYN] Seq=0 Win=65535 Len=0 MSS=1460 SACK_PERM=1
715870 228.481029 219.160.224.138 -> 244.3.210.197 TCP 64 radmin-port > http [ACK] Seq=1 Ack=1 Win=65535 Len=0
715929 228.498961 219.160.224.138 -> 244.3.210.197 TCP 64 4898 > http [ACK] Seq=822 Ack=18340 Win=65535 Len=0
715951 228.506112 219.160.224.138 -> 244.3.210.197 TCP 64 4898 > http [ACK] Seq=822 Ack=19800 Win=65535 Len=0
716008 228.522048 219.160.224.138 -> 244.3.210.197 TCP 64 4898 > http [ACK] Seq=822 Ack=22720 Win=65535 Len=0
716026 228.531062 219.160.224.138 -> 244.3.210.197 TCP 64 4898 > http [ACK] Seq=822 Ack=24180 Win=65535 Len=0
716048 228.539119 219.160.224.138 -> 244.3.210.197 TCP 64 4898 > http [ACK] Seq=822 Ack=25801 Win=65535 Len=0
716315 228.603105 219.160.224.138 -> 244.3.210.197 TCP 64 radmin-port > http [ACK] Seq=335 Ack=2921 Win=65535 Len=0
716386 228.621045 219.160.224.138 -> 244.3.210.197 TCP 64 4898 > http [ACK] Seq=1162 Ack=28721 Win=65535 Len=0
716608 228.689115 219.160.224.138 -> 244.3.210.197 TCP 64 radmin-port > http [ACK] Seq=335 Ack=4381 Win=65535 Len=0
716642 228.703069 219.160.224.138 -> 244.3.210.197 TCP 64 radmin-port > http [ACK] Seq=335 Ack=7301 Win=65535 Len=0
716722 228.724312 219.160.224.138 -> 244.3.210.197 TCP 64 4898 > http [ACK] Seq=1505 Ack=32086 Win=65535 Len=0
716848 228.757033 219.160.224.138 -> 244.3.210.197 TCP 64 radmin-port > http [ACK] Seq=335 Ack=8761 Win=65535 Len=0
716910 228.780194 219.160.224.138 -> 244.3.210.197 TCP 64 radmin-port > http [ACK] Seq=335 Ack=11681 Win=65535 Len=0
716919 228.788033 219.160.224.138 -> 244.3.210.197 TCP 64 radmin-port > http [ACK] Seq=335 Ack=13141 Win=65535 Len=0
716991 228.812022 219.160.224.138 -> 244.3.210.197 TCP 64 4898 > http [ACK] Seq=1848 Ack=35387 Win=65535 Len=0
717004 228.821082 219.160.224.138 -> 244.3.210.197 TCP 64 4898 > http [ACK] Seq=1848 Ack=36847 Win=65535 Len=0
717025 228.837040 219.160.224.138 -> 244.3.210.197 TCP 64 4898 > http [ACK] Seq=1848 Ack=39767 Win=65535 Len=0
717034 228.844222 219.160.224.138 -> 244.3.210.197 TCP 64 4898 > http [ACK] Seq=1848 Ack=41227 Win=65535 Len=0
717061 228.860003 219.160.224.138 -> 244.3.210.197 TCP 64 4898 > http [ACK] Seq=1848 Ack=44147 Win=65535 Len=0
717121 228.868104 219.160.224.138 -> 244.3.210.197 TCP 64 4898 > http [ACK] Seq=1848 Ack=45607 Win=65535 Len=0
717233 228.884022 219.160.224.138 -> 244.3.210.197 TCP 64 4898 > http [ACK] Seq=1848 Ack=48527 Win=65535 Len=0
717298 228.892119 219.160.224.138 -> 244.3.210.197 TCP 64 4898 > http [ACK] Seq=1848 Ack=49987 Win=65535 Len=0
717361 228.906140 219.160.224.138 -> 244.3.210.197 TCP 64 4898 > http [ACK] Seq=1848 Ack=52907 Win=65535 Len=0
717386 228.915019 219.160.224.138 -> 244.3.210.197 TCP 64 4898 > http [ACK] Seq=1848 Ack=54367 Win=65535 Len=0
717397 228.930067 219.160.224.138 -> 244.3.210.197 TCP 64 4898 > http [ACK] Seq=1848 Ack=57287 Win=65535 Len=0
717417 228.939026 219.160.224.138 -> 244.3.210.197 TCP 64 4898 > http [ACK] Seq=1848 Ack=58747 Win=65535 Len=0
717436 228.946065 219.160.224.138 -> 244.3.210.197 TCP 64 radmin-port > http [ACK] Seq=335 Ack=16061 Win=65535 Len=0
717463 228.954116 219.160.224.138 -> 244.3.210.197 TCP 64 radmin-port > http [ACK] Seq=335 Ack=17521 Win=65535 Len=0
717532 228.968999 219.160.224.138 -> 244.3.210.197 TCP 64 radmin-port > http [ACK] Seq=335 Ack=20441 Win=65535 Len=0
717558 228.978134 219.160.224.138 -> 244.3.210.197 TCP 64 radmin-port > http [ACK] Seq=335 Ack=21901 Win=65535 Len=0
717593 228.994007 219.160.224.138 -> 244.3.210.197 TCP 64 radmin-port > http [ACK] Seq=335 Ack=24821 Win=65535 Len=0
717625 229.009012 219.160.224.138 -> 244.3.210.197 TCP 64 4898 > http [ACK] Seq=1848 Ack=61667 Win=65535 Len=0
717660 229.018076 219.160.224.138 -> 244.3.210.197 TCP 64 4898 > http [ACK] Seq=1848 Ack=63127 Win=65535 Len=0
717678 229.033030 219.160.224.138 -> 244.3.210.197 TCP 64 4898 > http [ACK] Seq=1848 Ack=66047 Win=65535 Len=0
717712 229.048035 219.160.224.138 -> 244.3.210.197 TCP 64 4898 > http [ACK] Seq=1848 Ack=68967 Win=65535 Len=0
717724 229.057191 219.160.224.138 -> 244.3.210.197 TCP 64 4898 > http [ACK] Seq=1848 Ack=70427 Win=65535 Len=0
717743 229.071973 219.160.224.138 -> 244.3.210.197 TCP 64 4898 > http [ACK] Seq=1848 Ack=73347 Win=65535 Len=0
717752 229.081017 219.160.224.138 -> 244.3.210.197 TCP 64 4898 > http [ACK] Seq=1848 Ack=74807 Win=65535 Len=0
717775 229.096070 219.160.224.138 -> 244.3.210.197 TCP 64 4898 > http [ACK] Seq=1848 Ack=77727 Win=65535 Len=0
717784 229.103125 219.160.224.138 -> 244.3.210.197 TCP 64 4898 > http [ACK] Seq=1848 Ack=79187 Win=65535 Len=0
717802 229.119232 219.160.224.138 -> 244.3.210.197 TCP 64 4898 > http [ACK] Seq=1848 Ack=82107 Win=65535 Len=0
717824 229.127035 219.160.224.138 -> 244.3.210.197 TCP 64 4898 > http [ACK] Seq=1848 Ack=83567 Win=65535 Len=0
717872 229.143047 219.160.224.138 -> 244.3.210.197 TCP 64 4898 > http [ACK] Seq=1848 Ack=86487 Win=65535 Len=0
717888 229.151045 219.160.224.138 -> 244.3.210.197 TCP 64 4898 > http [ACK] Seq=1848 Ack=87947 Win=65535 Len=0
717912 229.166019 219.160.224.138 -> 244.3.210.197 TCP 64 4898 > http [ACK] Seq=1848 Ack=90867 Win=65535 Len=0
717927 229.174140 219.160.224.138 -> 244.3.210.197 TCP 64 4898 > http [ACK] Seq=1848 Ack=92327 Win=65535 Len=0
717948 229.191087 219.160.224.138 -> 244.3.210.197 TCP 64 4898 > http [ACK] Seq=1848 Ack=95247 Win=65535 Len=0
717959 229.199091 219.160.224.138 -> 244.3.210.197 TCP 64 4898 > http [ACK] Seq=1848 Ack=96707 Win=65535 Len=0
717968 229.207019 219.160.224.138 -> 244.3.210.197 TCP 64 4898 > http [ACK] Seq=1848 Ack=98271 Win=65535 Len=0
717983 229.222074 219.160.224.138 -> 244.3.210.197 TCP 64 radmin-port > http [ACK] Seq=335 Ack=26281 Win=65535 Len=0
718039 229.237179 219.160.224.138 -> 244.3.210.197 TCP 64 radmin-port > http [ACK] Seq=335 Ack=29201 Win=65535 Len=0
718047 229.245122 219.160.224.138 -> 244.3.210.197 TCP 64 radmin-port > http [ACK] Seq=335 Ack=30661 Win=65535 Len=0
718070 229.262114 219.160.224.138 -> 244.3.210.197 TCP 64 radmin-port > http [ACK] Seq=335 Ack=33581 Win=65535 Len=0
718187 229.282117 219.160.224.138 -> 244.3.210.197 TCP 64 4898 > http [ACK] Seq=1848 Ack=101191 Win=65535 Len=0
718195 229.290075 219.160.224.138 -> 244.3.210.197 TCP 64 4898 > http [ACK] Seq=1848 Ack=102651 Win=65535 Len=0
718212 229.305032 219.160.224.138 -> 244.3.210.197 TCP 64 4898 > http [ACK] Seq=1848 Ack=105571 Win=65535 Len=0
718292 229.313128 219.160.224.138 -> 244.3.210.197 TCP 64 4898 > http [ACK] Seq=1848 Ack=107031 Win=65535 Len=0
718304 229.328015 219.160.224.138 -> 244.3.210.197 TCP 64 4898 > http [ACK] Seq=1848 Ack=109951 Win=65535 Len=0
718312 229.337144 219.160.224.138 -> 244.3.210.197 TCP 64 4898 > http [ACK] Seq=1848 Ack=111411 Win=65535 Len=0
718376 229.352054 219.160.224.138 -> 244.3.210.197 TCP 64 4898 > http [ACK] Seq=1848 Ack=114331 Win=65535 Len=0
718401 229.361043 219.160.224.138 -> 244.3.210.197 TCP 64 4898 > http [ACK] Seq=1848 Ack=115791 Win=65535 Len=0
718434 229.382052 219.160.224.138 -> 244.3.210.197 TCP 64 4898 > http [ACK] Seq=1848 Ack=118711 Win=65535 Len=0
718501 229.390112 219.160.224.138 -> 244.3.210.197 TCP 64 4898 > http [ACK] Seq=1848 Ack=120171 Win=65535 Len=0
718567 229.404125 219.160.224.138 -> 244.3.210.197 TCP 64 4898 > http [ACK] Seq=1848 Ack=123091 Win=65535 Len=0
718577 229.413014 219.160.224.138 -> 244.3.210.197 TCP 64 4898 > http [ACK] Seq=1848 Ack=124551 Win=65535 Len=0
718618 229.428083 219.160.224.138 -> 244.3.210.197 TCP 64 4898 > http [ACK] Seq=1848 Ack=127471 Win=65535 Len=0
718700 229.440995 219.160.224.138 -> 244.3.210.197 TCP 64 4898 > http [ACK] Seq=1848 Ack=128931 Win=65535 Len=0
718734 229.458254 219.160.224.138 -> 244.3.210.197 TCP 64 4898 > http [ACK] Seq=1848 Ack=131851 Win=65535 Len=0
718802 229.474161 219.160.224.138 -> 244.3.210.197 TCP 64 4898 > http [ACK] Seq=1848 Ack=134771 Win=65535 Len=0
718815 229.481999 219.160.224.138 -> 244.3.210.197 TCP 64 4898 > http [ACK] Seq=1848 Ack=136231 Win=65535 Len=0
718845 229.496959 219.160.224.138 -> 244.3.210.197 TCP 64 4898 > http [ACK] Seq=1848 Ack=139151 Win=65535 Len=0
718874 229.504036 219.160.224.138 -> 244.3.210.197 TCP 64 4898 > http [ACK] Seq=1848 Ack=140611 Win=65535 Len=0
718970 229.520037 219.160.224.138 -> 244.3.210.197 TCP 64 4898 > http [ACK] Seq=1848 Ack=143531 Win=65535 Len=0
719009 229.527908 219.160.224.138 -> 244.3.210.197 TCP 64 4898 > http [ACK] Seq=1848 Ack=144991 Win=65535 Len=0
719048 229.543098 219.160.224.138 -> 244.3.210.197 TCP 64 4898 > http [ACK] Seq=1848 Ack=147911 Win=65535 Len=0
719122 229.551946 219.160.224.138 -> 244.3.210.197 TCP 64 4898 > http [ACK] Seq=1848 Ack=149371 Win=65535 Len=0
719135 229.555105 219.160.224.138 -> 244.3.210.197 TCP 64 radmin-port > http [ACK] Seq=335 Ack=34243 Win=64873 Len=0
719181 229.567091 219.160.224.138 -> 244.3.210.197 TCP 64 4898 > http [ACK] Seq=1848 Ack=152291 Win=65535 Len=0
719214 229.576078 219.160.224.138 -> 244.3.210.197 TCP 64 4898 > http [ACK] Seq=1848 Ack=153751 Win=65535 Len=0
719347 229.591031 219.160.224.138 -> 244.3.210.197 TCP 64 4898 > http [ACK] Seq=1848 Ack=156671 Win=65535 Len=0
719373 229.598984 219.160.224.138 -> 244.3.210.197 TCP 64 4898 > http [ACK] Seq=1848 Ack=158131 Win=65535 Len=0
719405 229.616038 219.160.224.138 -> 244.3.210.197 TCP 64 4898 > http [ACK] Seq=1848 Ack=161051 Win=65535 Len=0
719463 229.624114 219.160.224.138 -> 244.3.210.197 TCP 64 4898 > http [ACK] Seq=1848 Ack=162511 Win=65535 Len=0
719591 229.657149 219.160.224.138 -> 244.3.210.197 TCP 64 4898 > http [ACK] Seq=1848 Ack=165267 Win=65535 Len=0
719651 229.666023 219.160.224.138 -> 244.3.210.197 TCP 64 4898 > http [ACK] Seq=1848 Ack=166792 Win=65535 Len=0
720585 229.989026 219.160.224.138 -> 244.3.210.197 TCP 64 radmin-port > http [ACK] Seq=682 Ack=36912 Win=65535 Len=0
720921 230.110969 219.160.224.138 -> 244.3.210.197 TCP 64 4898 > http [ACK] Seq=2189 Ack=169712 Win=65535 Len=0
720944 230.118086 219.160.224.138 -> 244.3.210.197 TCP 64 4898 > http [ACK] Seq=2189 Ack=171172 Win=65535 Len=0
720969 230.141066 219.160.224.138 -> 244.3.210.197 TCP 64 radmin-port > http [ACK] Seq=1023 Ack=39832 Win=65535 Len=0
721022 230.146167 219.160.224.138 -> 244.3.210.197 TCP 64 radmin-port > http [ACK] Seq=1023 Ack=41292 Win=65535 Len=0
721048 230.161115 219.160.224.138 -> 244.3.210.197 TCP 64 radmin-port > http [ACK] Seq=1023 Ack=44212 Win=65535 Len=0
721069 230.169069 219.160.224.138 -> 244.3.210.197 TCP 64 radmin-port > http [ACK] Seq=1023 Ack=45672 Win=65535 Len=0
721112 230.185040 219.160.224.138 -> 244.3.210.197 TCP 64 radmin-port > http [ACK] Seq=1023 Ack=48592 Win=65535 Len=0
721126 230.193179 219.160.224.138 -> 244.3.210.197 TCP 64 radmin-port > http [ACK] Seq=1023 Ack=50052 Win=65535 Len=0
721157 230.208049 219.160.224.138 -> 244.3.210.197 TCP 64 radmin-port > http [ACK] Seq=1023 Ack=52972 Win=65535 Len=0
721172 230.216010 219.160.224.138 -> 244.3.210.197 TCP 64 radmin-port > http [ACK] Seq=1023 Ack=54432 Win=65535 Len=0
721256 230.232033 219.160.224.138 -> 244.3.210.197 TCP 64 radmin-port > http [ACK] Seq=1023 Ack=57352 Win=65535 Len=0
721291 230.241115 219.160.224.138 -> 244.3.210.197 TCP 64 radmin-port > http [ACK] Seq=1023 Ack=58812 Win=65535 Len=0
721320 230.256170 219.160.224.138 -> 244.3.210.197 TCP 64 radmin-port > http [ACK] Seq=1023 Ack=61732 Win=65535 Len=0
721342 230.263080 219.160.224.138 -> 244.3.210.197 TCP 64 radmin-port > http [ACK] Seq=1023 Ack=63192 Win=65535 Len=0
721386 230.284966 219.160.224.138 -> 244.3.210.197 TCP 64 radmin-port > http [ACK] Seq=1023 Ack=66112 Win=65535 Len=0
721402 230.293103 219.160.224.138 -> 244.3.210.197 TCP 64 radmin-port > http [ACK] Seq=1023 Ack=67572 Win=65535 Len=0
721442 230.316247 219.160.224.138 -> 244.3.210.197 TCP 64 4898 > http [ACK] Seq=2531 Ack=174616 Win=65535 Len=0
721457 230.324126 219.160.224.138 -> 244.3.210.197 TCP 64 4898 > http [ACK] Seq=2531 Ack=176076 Win=65535 Len=0
721478 230.341116 219.160.224.138 -> 244.3.210.197 TCP 64 4898 > http [ACK] Seq=2531 Ack=178996 Win=65535 Len=0
721486 230.348082 219.160.224.138 -> 244.3.210.197 TCP 64 4898 > http [ACK] Seq=2531 Ack=180456 Win=65535 Len=0
721534 230.363980 219.160.224.138 -> 244.3.210.197 TCP 64 4898 > http [ACK] Seq=2531 Ack=183376 Win=65535 Len=0
721586 230.370998 219.160.224.138 -> 244.3.210.197 TCP 64 4898 > http [ACK] Seq=2531 Ack=184836 Win=65535 Len=0
721609 230.387055 219.160.224.138 -> 244.3.210.197 TCP 64 4898 > http [ACK] Seq=2531 Ack=187756 Win=65535 Len=0
721633 230.396035 219.160.224.138 -> 244.3.210.197 TCP 64 4898 > http [ACK] Seq=2531 Ack=189216 Win=65535 Len=0
721679 230.411887 219.160.224.138 -> 244.3.210.197 TCP 64 4898 > http [ACK] Seq=2531 Ack=192136 Win=65535 Len=0
721692 230.418979 219.160.224.138 -> 244.3.210.197 TCP 64 4898 > http [ACK] Seq=2531 Ack=193596 Win=65535 Len=0
721705 230.433981 219.160.224.138 -> 244.3.210.197 TCP 64 4898 > http [ACK] Seq=2531 Ack=196516 Win=65535 Len=0
721730 230.442241 219.160.224.138 -> 244.3.210.197 TCP 64 4898 > http [ACK] Seq=2531 Ack=197976 Win=65535 Len=0
721761 230.459126 219.160.224.138 -> 244.3.210.197 TCP 64 4898 > http [ACK] Seq=2531 Ack=200896 Win=65535 Len=0
721770 230.467074 219.160.224.138 -> 244.3.210.197 TCP 64 radmin-port > http [ACK] Seq=1023 Ack=70492 Win=65535 Len=0
721788 230.475030 219.160.224.138 -> 244.3.210.197 TCP 64 radmin-port > http [ACK] Seq=1023 Ack=71952 Win=65535 Len=0
721817 230.496093 219.160.224.138 -> 244.3.210.197 TCP 64 radmin-port > http [ACK] Seq=1023 Ack=74872 Win=65535 Len=0
721976 230.563031 219.160.224.138 -> 244.3.210.197 TCP 64 4898 > http [ACK] Seq=2871 Ack=203863 Win=65535 Len=0
721992 230.571157 219.160.224.138 -> 244.3.210.197 TCP 64 4898 > http [ACK] Seq=2871 Ack=205323 Win=65535 Len=0
722003 230.587093 219.160.224.138 -> 244.3.210.197 TCP 64 4898 > http [ACK] Seq=2871 Ack=208243 Win=65535 Len=0
722015 230.596064 219.160.224.138 -> 244.3.210.197 TCP 64 4898 > http [ACK] Seq=2871 Ack=209703 Win=65535 Len=0
722042 230.604924 219.160.224.138 -> 244.3.210.197 TCP 64 4898 > http [ACK] Seq=2871 Ack=211612 Win=65535 Len=0
722067 230.627214 219.160.224.138 -> 244.3.210.197 TCP 64 radmin-port > http [ACK] Seq=1365 Ack=77975 Win=65535 Len=0
722085 230.635132 219.160.224.138 -> 244.3.210.197 TCP 64 radmin-port > http [ACK] Seq=1365 Ack=79435 Win=65535 Len=0
722105 230.650098 219.160.224.138 -> 244.3.210.197 TCP 64 radmin-port > http [ACK] Seq=1365 Ack=82355 Win=65535 Len=0
722113 230.659069 219.160.224.138 -> 244.3.210.197 TCP 64 radmin-port > http [ACK] Seq=1365 Ack=83815 Win=65535 Len=0
722125 230.674118 219.160.224.138 -> 244.3.210.197 TCP 64 radmin-port > http [ACK] Seq=1365 Ack=86735 Win=65535 Len=0
722140 230.681061 219.160.224.138 -> 244.3.210.197 TCP 64 radmin-port > http [ACK] Seq=1365 Ack=88195 Win=65535 Len=0
722148 230.697015 219.160.224.138 -> 244.3.210.197 TCP 64 radmin-port > http [ACK] Seq=1365 Ack=91115 Win=65535 Len=0
722165 230.705114 219.160.224.138 -> 244.3.210.197 TCP 64 radmin-port > http [ACK] Seq=1365 Ack=92575 Win=65535 Len=0
722191 230.720030 219.160.224.138 -> 244.3.210.197 TCP 64 radmin-port > http [ACK] Seq=1365 Ack=95495 Win=65535 Len=0
722207 230.727981 219.160.224.138 -> 244.3.210.197 TCP 64 radmin-port > http [ACK] Seq=1365 Ack=96955 Win=65535 Len=0
722257 230.744998 219.160.224.138 -> 244.3.210.197 TCP 64 radmin-port > http [ACK] Seq=1365 Ack=99875 Win=65535 Len=0
722273 230.752158 219.160.224.138 -> 244.3.210.197 TCP 64 radmin-port > http [ACK] Seq=1365 Ack=101335 Win=65535 Len=0
722303 230.768015 219.160.224.138 -> 244.3.210.197 TCP 64 radmin-port > http [ACK] Seq=1365 Ack=104255 Win=65535 Len=0
722326 230.775078 219.160.224.138 -> 244.3.210.197 TCP 64 radmin-port > http [ACK] Seq=1365 Ack=105715 Win=65535 Len=0
722587 230.982033 219.160.224.138 -> 244.3.210.197 TCP 64 4898 > http [ACK] Seq=3226 Ack=214532 Win=65535 Len=0
722595 230.989981 219.160.224.138 -> 244.3.210.197 TCP 64 4898 > http [ACK] Seq=3226 Ack=215992 Win=65535 Len=0
722787 231.113087 219.160.224.138 -> 244.3.210.197 TCP 64 radmin-port > http [ACK] Seq=1708 Ack=108665 Win=65535 Len=0
722847 231.142114 219.160.224.138 -> 244.3.210.197 TCP 64 4898 > http [ACK] Seq=3566 Ack=218172 Win=65535 Len=0
723162 231.252050 219.160.224.138 -> 244.3.210.197 TCP 64 radmin-port > http [ACK] Seq=2053 Ack=111585 Win=65535 Len=0
723179 231.261079 219.160.224.138 -> 244.3.210.197 TCP 64 radmin-port > http [ACK] Seq=2053 Ack=113045 Win=65535 Len=0
723205 231.276123 219.160.224.138 -> 244.3.210.197 TCP 64 radmin-port > http [ACK] Seq=2053 Ack=115965 Win=65535 Len=0
723218 231.283047 219.160.224.138 -> 244.3.210.197 TCP 64 radmin-port > http [ACK] Seq=2053 Ack=117425 Win=65535 Len=0
723241 231.296024 219.160.224.138 -> 244.3.210.197 TCP 64 radmin-port > http [ACK] Seq=2053 Ack=119740 Win=65535 Len=0
723298 231.326098 219.160.224.138 -> 244.3.210.197 TCP 64 4898 > http [ACK] Seq=3899 Ack=220195 Win=65535 Len=0
723649 231.529096 219.160.224.138 -> 244.3.210.197 TCP 64 radmin-port > http [ACK] Seq=2396 Ack=122660 Win=65535 Len=0
723659 231.535981 219.160.224.138 -> 244.3.210.197 TCP 64 radmin-port > http [ACK] Seq=2396 Ack=124120 Win=65535 Len=0
723686 231.551097 219.160.224.138 -> 244.3.210.197 TCP 64 radmin-port > http [ACK] Seq=2396 Ack=127040 Win=65535 Len=0
723711 231.559997 219.160.224.138 -> 244.3.210.197 TCP 64 radmin-port > http [ACK] Seq=2396 Ack=128500 Win=65535 Len=0
724057 231.715944 219.160.224.138 -> 244.3.210.197 TCP 64 4898 > http [ACK] Seq=4238 Ack=223115 Win=65535 Len=0
724078 231.724106 219.160.224.138 -> 244.3.210.197 TCP 64 4898 > http [ACK] Seq=4238 Ack=224575 Win=65535 Len=0
724149 231.740171 219.160.224.138 -> 244.3.210.197 TCP 64 4898 > http [ACK] Seq=4238 Ack=227495 Win=65535 Len=0
724190 231.747042 219.160.224.138 -> 244.3.210.197 TCP 64 4898 > http [ACK] Seq=4238 Ack=228955 Win=65535 Len=0
724557 231.878089 219.160.224.138 -> 244.3.210.197 TCP 64 radmin-port > http [ACK] Seq=2736 Ack=132413 Win=65535 Len=0
724833 231.997043 219.160.224.138 -> 244.3.210.197 TCP 64 4898 > http [ACK] Seq=4582 Ack=232301 Win=65535 Len=0
724853 232.004193 219.160.224.138 -> 244.3.210.197 TCP 64 4898 > http [ACK] Seq=4582 Ack=233731 Win=64105 Len=0
725108 232.121102 219.160.224.138 -> 244.3.210.197 TCP 64 radmin-port > http [ACK] Seq=3074 Ack=135971 Win=65535 Len=0
725124 232.128952 219.160.224.138 -> 244.3.210.197 TCP 64 radmin-port > http [ACK] Seq=3074 Ack=137431 Win=65535 Len=0
725175 232.145112 219.160.224.138 -> 244.3.210.197 TCP 64 radmin-port > http [ACK] Seq=3074 Ack=140351 Win=65535 Len=0
725185 232.153104 219.160.224.138 -> 244.3.210.197 TCP 64 radmin-port > http [ACK] Seq=3074 Ack=141811 Win=65535 Len=0
725203 232.164025 219.160.224.138 -> 244.3.210.197 TCP 64 radmin-port > http [ACK] Seq=3074 Ack=143830 Win=65535 Len=0
725436 232.288039 219.160.224.138 -> 244.3.210.197 TCP 64 4898 > http [ACK] Seq=4922 Ack=236651 Win=65535 Len=0
725454 232.296276 219.160.224.138 -> 244.3.210.197 TCP 64 4898 > http [ACK] Seq=4922 Ack=238111 Win=65535 Len=0
725493 232.311072 219.160.224.138 -> 244.3.210.197 TCP 64 4898 > http [ACK] Seq=4922 Ack=241031 Win=65535 Len=0
725517 232.319089 219.160.224.138 -> 244.3.210.197 TCP 64 4898 > http [ACK] Seq=4922 Ack=242491 Win=65535 Len=0
725541 232.334018 219.160.224.138 -> 244.3.210.197 TCP 64 4898 > http [ACK] Seq=4922 Ack=245411 Win=65535 Len=0
725567 232.342050 219.160.224.138 -> 244.3.210.197 TCP 64 4898 > http [ACK] Seq=4922 Ack=246871 Win=65535 Len=0
725615 232.359129 219.160.224.138 -> 244.3.210.197 TCP 64 4898 > http [ACK] Seq=4922 Ack=249791 Win=65535 Len=0
725697 232.403878 219.160.224.138 -> 244.3.210.197 TCP 64 4898 > http [ACK] Seq=4922 Ack=251251 Win=65535 Len=0
725709 232.404719 219.160.224.138 -> 244.3.210.197 TCP 64 4898 > http [ACK] Seq=4922 Ack=254171 Win=65535 Len=0
725715 232.405034 219.160.224.138 -> 244.3.210.197 TCP 64 4898 > http [ACK] Seq=4922 Ack=255631 Win=65535 Len=0
725721 232.405697 219.160.224.138 -> 244.3.210.197 TCP 64 4898 > http [ACK] Seq=4922 Ack=258551 Win=65535 Len=0
725750 232.413107 219.160.224.138 -> 244.3.210.197 TCP 64 4898 > http [ACK] Seq=4922 Ack=260011 Win=65535 Len=0
725780 232.429073 219.160.224.138 -> 244.3.210.197 TCP 64 4898 > http [ACK] Seq=4922 Ack=262931 Win=65535 Len=0
725801 232.438145 219.160.224.138 -> 244.3.210.197 TCP 64 4898 > http [ACK] Seq=4922 Ack=264391 Win=65535 Len=0
725822 232.452075 219.160.224.138 -> 244.3.210.197 TCP 64 4898 > http [ACK] Seq=4922 Ack=267311 Win=65535 Len=0
725857 232.460092 219.160.224.138 -> 244.3.210.197 TCP 64 4898 > http [ACK] Seq=4922 Ack=268771 Win=65535 Len=0
725894 232.476136 219.160.224.138 -> 244.3.210.197 TCP 64 4898 > http [ACK] Seq=4922 Ack=271691 Win=65535 Len=0
725919 232.484163 219.160.224.138 -> 244.3.210.197 TCP 64 4898 > http [ACK] Seq=4922 Ack=273151 Win=65535 Len=0
725991 232.501214 219.160.224.138 -> 244.3.210.197 TCP 64 4898 > http [ACK] Seq=4922 Ack=276071 Win=65535 Len=0
726006 232.507953 219.160.224.138 -> 244.3.210.197 TCP 64 4898 > http [ACK] Seq=4922 Ack=277531 Win=65535 Len=0
726074 232.524111 219.160.224.138 -> 244.3.210.197 TCP 64 4898 > http [ACK] Seq=4922 Ack=280451 Win=65535 Len=0
726108 232.531097 219.160.224.138 -> 244.3.210.197 TCP 64 4898 > http [ACK] Seq=4922 Ack=281911 Win=65535 Len=0
726144 232.547074 219.160.224.138 -> 244.3.210.197 TCP 64 4898 > http [ACK] Seq=4922 Ack=284831 Win=65535 Len=0
726163 232.556086 219.160.224.138 -> 244.3.210.197 TCP 64 4898 > http [ACK] Seq=4922 Ack=286291 Win=65535 Len=0
726211 232.571035 219.160.224.138 -> 244.3.210.197 TCP 64 4898 > http [ACK] Seq=4922 Ack=289211 Win=65535 Len=0
726218 232.578035 219.160.224.138 -> 244.3.210.197 TCP 64 4898 > http [ACK] Seq=4922 Ack=290671 Win=65535 Len=0
726284 232.594105 219.160.224.138 -> 244.3.210.197 TCP 64 4898 > http [ACK] Seq=4922 Ack=293591 Win=65535 Len=0
726310 232.602062 219.160.224.138 -> 244.3.210.197 TCP 64 4898 > http [ACK] Seq=4922 Ack=295051 Win=65535 Len=0
726362 232.624027 219.160.224.138 -> 244.3.210.197 TCP 64 4898 > http [ACK] Seq=4922 Ack=297971 Win=65535 Len=0
726683 232.799054 219.160.224.138 -> 244.3.210.197 TCP 64 radmin-port > http [ACK] Seq=3422 Ack=146750 Win=65535 Len=0
726701 232.806108 219.160.224.138 -> 244.3.210.197 TCP 64 radmin-port > http [ACK] Seq=3422 Ack=148210 Win=65535 Len=0
726713 232.815233 219.160.224.138 -> 244.3.210.197 TCP 64 radmin-port > http [ACK] Seq=3422 Ack=149693 Win=65535 Len=0
726745 232.838050 219.160.224.138 -> 244.3.210.197 TCP 64 4898 > http [ACK] Seq=4922 Ack=298321 Win=65185 Len=0
726840 232.934122 219.160.224.138 -> 244.3.210.197 TCP 64 4898 > http [ACK] Seq=5266 Ack=301241 Win=65535 Len=0
726996 233.043079 219.160.224.138 -> 244.3.210.197 TCP 64 radmin-port > http [ACK] Seq=3759 Ack=152613 Win=65535 Len=0
727019 233.050041 219.160.224.138 -> 244.3.210.197 TCP 64 radmin-port > http [ACK] Seq=3759 Ack=154073 Win=65535 Len=0
727033 233.066082 219.160.224.138 -> 244.3.210.197 TCP 64 radmin-port > http [ACK] Seq=3759 Ack=156993 Win=65535 Len=0
727042 233.075105 219.160.224.138 -> 244.3.210.197 TCP 64 radmin-port > http [ACK] Seq=3759 Ack=158453 Win=65535 Len=0
727050 233.088022 219.160.224.138 -> 244.3.210.197 TCP 64 radmin-port > http [ACK] Seq=3759 Ack=161026 Win=65535 Len=0
727181 233.145427 219.160.224.138 -> 244.3.210.197 TCP 64 4898 > http [FIN, ACK] Seq=5266 Ack=301778 Win=64998 Len=0
727193 233.148079 219.160.224.138 -> 244.3.210.197 TCP 66 flr-agent > http [SYN] Seq=0 Win=65535 Len=0 MSS=1460 SACK_PERM=1
727274 233.191101 219.160.224.138 -> 244.3.210.197 TCP 64 4898 > http [ACK] Seq=5267 Ack=301779 Win=64998 Len=0
727280 233.194110 219.160.224.138 -> 244.3.210.197 TCP 64 flr-agent > http [ACK] Seq=1 Ack=1 Win=65535 Len=0
727301 233.211089 219.160.224.138 -> 244.3.210.197 TCP 64 radmin-port > http [ACK] Seq=4121 Ack=163946 Win=65535 Len=0
727313 233.219128 219.160.224.138 -> 244.3.210.197 TCP 64 radmin-port > http [ACK] Seq=4121 Ack=165406 Win=65535 Len=0
727356 233.235112 219.160.224.138 -> 244.3.210.197 TCP 64 radmin-port > http [ACK] Seq=4121 Ack=168326 Win=65535 Len=0
727373 233.243105 219.160.224.138 -> 244.3.210.197 TCP 64 radmin-port > http [ACK] Seq=4121 Ack=169786 Win=65535 Len=0
727399 233.259111 219.160.224.138 -> 244.3.210.197 TCP 64 radmin-port > http [ACK] Seq=4121 Ack=172706 Win=65535 Len=0
727410 233.265999 219.160.224.138 -> 244.3.210.197 TCP 64 radmin-port > http [ACK] Seq=4121 Ack=174166 Win=65535 Len=0
727545 233.350088 219.160.224.138 -> 244.3.210.197 TCP 64 radmin-port > http [ACK] Seq=4485 Ack=177377 Win=65535 Len=0
727559 233.358066 219.160.224.138 -> 244.3.210.197 TCP 64 radmin-port > http [ACK] Seq=4485 Ack=178837 Win=65535 Len=0
727571 233.373513 219.160.224.138 -> 244.3.210.197 TCP 64 radmin-port > http [ACK] Seq=4485 Ack=181757 Win=65535 Len=0
727579 233.381019 219.160.224.138 -> 244.3.210.197 TCP 64 radmin-port > http [ACK] Seq=4485 Ack=183217 Win=65535 Len=0
727594 233.398172 219.160.224.138 -> 244.3.210.197 TCP 64 radmin-port > http [ACK] Seq=4485 Ack=186137 Win=65535 Len=0
727604 233.403989 219.160.224.138 -> 244.3.210.197 TCP 64 radmin-port > http [ACK] Seq=4485 Ack=187497 Win=64175 Len=0
727746 233.492034 219.160.224.138 -> 244.3.210.197 TCP 64 radmin-port > http [ACK] Seq=4839 Ack=189196 Win=65535 Len=0
727841 233.548020 219.160.224.138 -> 244.3.210.197 TCP 64 flr-agent > http [ACK] Seq=1364 Ack=3323 Win=65535 Len=0
727872 233.578060 219.160.224.138 -> 244.3.210.197 TCP 64 radmin-port > http [ACK] Seq=5181 Ack=191856 Win=65535 Len=0
728079 233.629051 219.160.224.138 -> 244.3.210.197 TCP 64 flr-agent > http [ACK] Seq=1704 Ack=6243 Win=65535 Len=0
728109 233.636966 219.160.224.138 -> 244.3.210.197 TCP 64 flr-agent > http [ACK] Seq=1704 Ack=7703 Win=65535 Len=0
728157 233.658192 219.160.224.138 -> 244.3.210.197 TCP 64 radmin-port > http [ACK] Seq=5522 Ack=194776 Win=65535 Len=0
728169 233.665066 219.160.224.138 -> 244.3.210.197 TCP 64 radmin-port > http [ACK] Seq=5522 Ack=196236 Win=65535 Len=0
728271 233.717062 219.160.224.138 -> 244.3.210.197 TCP 64 flr-agent > http [ACK] Seq=2045 Ack=11125 Win=65535 Len=0
728338 233.743085 219.160.224.138 -> 244.3.210.197 TCP 64 radmin-port > http [ACK] Seq=5874 Ack=199171 Win=65535 Len=0
728486 233.796198 219.160.224.138 -> 244.3.210.197 TCP 64 flr-agent > http [ACK] Seq=2396 Ack=14045 Win=65535 Len=0
728505 233.804060 219.160.224.138 -> 244.3.210.197 TCP 64 flr-agent > http [ACK] Seq=2396 Ack=15505 Win=65535 Len=0
728540 233.824015 219.160.224.138 -> 244.3.210.197 TCP 64 radmin-port > http [ACK] Seq=6225 Ack=202091 Win=65535 Len=0
728549 233.831966 219.160.224.138 -> 244.3.210.197 TCP 64 radmin-port > http [ACK] Seq=6225 Ack=203551 Win=65535 Len=0
728558 233.847084 219.160.224.138 -> 244.3.210.197 TCP 64 radmin-port > http [ACK] Seq=6225 Ack=206471 Win=65535 Len=0
728570 233.855111 219.160.224.138 -> 244.3.210.197 TCP 64 radmin-port > http [ACK] Seq=6225 Ack=207931 Win=65535 Len=0
728675 233.917040 219.160.224.138 -> 244.3.210.197 TCP 64 flr-agent > http [ACK] Seq=2743 Ack=18922 Win=65535 Len=0
729081 234.082990 219.160.224.138 -> 244.3.210.197 TCP 64 radmin-port > http [ACK] Seq=7291 Ack=212956 Win=65535 Len=0
732359 234.477123 219.160.224.138 -> 244.3.210.197 TCP 64 radmin-port > http [ACK] Seq=7982 Ack=214151 Win=64340 Len=0
732363 234.477266 219.160.224.138 -> 244.3.210.197 TCP 64 flr-agent > http [ACK] Seq=4176 Ack=20631 Win=65535 Len=0
760036 245.112121 219.160.224.138 -> 244.3.210.197 TCP 64 flr-agent > http [ACK] Seq=4871 Ack=23551 Win=65535 Len=0
760064 245.120130 219.160.224.138 -> 244.3.210.197 TCP 64 flr-agent > http [ACK] Seq=4871 Ack=25011 Win=65535 Len=0
760115 245.136106 219.160.224.138 -> 244.3.210.197 TCP 64 flr-agent > http [ACK] Seq=4871 Ack=27931 Win=65535 Len=0
760134 245.144192 219.160.224.138 -> 244.3.210.197 TCP 64 flr-agent > http [ACK] Seq=4871 Ack=29391 Win=65535 Len=0
760152 245.159106 219.160.224.138 -> 244.3.210.197 TCP 64 flr-agent > http [ACK] Seq=4871 Ack=32311 Win=65535 Len=0
760168 245.166976 219.160.224.138 -> 244.3.210.197 TCP 64 flr-agent > http [ACK] Seq=4871 Ack=33771 Win=65535 Len=0
760906 245.443067 219.160.224.138 -> 244.3.210.197 TCP 64 radmin-port > http [ACK] Seq=8572 Ack=217071 Win=65535 Len=0
760946 245.451028 219.160.224.138 -> 244.3.210.197 TCP 64 radmin-port > http [ACK] Seq=8572 Ack=218531 Win=65535 Len=0
760995 245.466999 219.160.224.138 -> 244.3.210.197 TCP 64 radmin-port > http [ACK] Seq=8572 Ack=221451 Win=65535 Len=0
761030 245.475121 219.160.224.138 -> 244.3.210.197 TCP 64 radmin-port > http [ACK] Seq=8572 Ack=222911 Win=65535 Len=0
761064 245.491121 219.160.224.138 -> 244.3.210.197 TCP 64 radmin-port > http [ACK] Seq=8572 Ack=225831 Win=65535 Len=0
761082 245.499190 219.160.224.138 -> 244.3.210.197 TCP 64 radmin-port > http [ACK] Seq=8572 Ack=227291 Win=65535 Len=0
761136 245.515107 219.160.224.138 -> 244.3.210.197 TCP 64 radmin-port > http [ACK] Seq=8572 Ack=230211 Win=65535 Len=0
761158 245.523107 219.160.224.138 -> 244.3.210.197 TCP 64 radmin-port > http [ACK] Seq=8572 Ack=231671 Win=65535 Len=0
761188 245.539085 219.160.224.138 -> 244.3.210.197 TCP 64 radmin-port > http [ACK] Seq=8572 Ack=234591 Win=65535 Len=0
761212 245.547175 219.160.224.138 -> 244.3.210.197 TCP 64 radmin-port > http [ACK] Seq=8572 Ack=236051 Win=65535 Len=0
761251 245.562134 219.160.224.138 -> 244.3.210.197 TCP 64 radmin-port > http [ACK] Seq=8572 Ack=238971 Win=65535 Len=0
761268 245.570060 219.160.224.138 -> 244.3.210.197 TCP 64 radmin-port > http [ACK] Seq=8572 Ack=240431 Win=65535 Len=0
761315 245.587088 219.160.224.138 -> 244.3.210.197 TCP 64 radmin-port > http [ACK] Seq=8572 Ack=243351 Win=65535 Len=0
761351 245.604127 219.160.224.138 -> 244.3.210.197 TCP 64 flr-agent > http [ACK] Seq=5476 Ack=36705 Win=65535 Len=0
761365 245.612475 219.160.224.138 -> 244.3.210.197 TCP 64 flr-agent > http [ACK] Seq=5476 Ack=38165 Win=65535 Len=0
761486 245.673186 219.160.224.138 -> 244.3.210.197 TCP 64 radmin-port > http [ACK] Seq=9175 Ack=245741 Win=65535 Len=0
761545 245.696116 219.160.224.138 -> 244.3.210.197 TCP 64 flr-agent > http [ACK] Seq=6079 Ack=40791 Win=65535 Len=0
761771 245.772064 219.160.224.138 -> 244.3.210.197 TCP 64 radmin-port > http [ACK] Seq=9778 Ack=247829 Win=65535 Len=0
761810 245.797458 219.160.224.138 -> 244.3.210.197 TCP 64 flr-agent > http [ACK] Seq=6682 Ack=43131 Win=65535 Len=0
762069 245.883218 219.160.224.138 -> 244.3.210.197 TCP 64 radmin-port > http [ACK] Seq=10381 Ack=249907 Win=65535 Len=0
762155 245.899479 219.160.224.138 -> 244.3.210.197 TCP 64 flr-agent > http [ACK] Seq=7260 Ack=46051 Win=65535 Len=0
762201 245.907105 219.160.224.138 -> 244.3.210.197 TCP 64 flr-agent > http [ACK] Seq=7260 Ack=47511 Win=65535 Len=0
762330 245.959424 219.160.224.138 -> 244.3.210.197 TCP 64 radmin-port > http [ACK] Seq=10984 Ack=251879 Win=65535 Len=0
762423 245.988056 219.160.224.138 -> 244.3.210.197 TCP 64 flr-agent > http [FIN, ACK] Seq=7834 Ack=48038 Win=65008 Len=0
762588 246.048038 219.160.224.138 -> 244.3.210.197 TCP 64 flr-agent > http [ACK] Seq=7835 Ack=48039 Win=65008 Len=0
791957 257.429214 219.160.224.138 -> 244.3.210.197 TCP 64 radmin-port > http [ACK] Seq=11732 Ack=254799 Win=65535 Len=0
791987 257.437082 219.160.224.138 -> 244.3.210.197 TCP 64 radmin-port > http [ACK] Seq=11732 Ack=256259 Win=65535 Len=0
792021 257.453116 219.160.224.138 -> 244.3.210.197 TCP 64 radmin-port > http [ACK] Seq=11732 Ack=259179 Win=65535 Len=0
792052 257.461122 219.160.224.138 -> 244.3.210.197 TCP 64 radmin-port > http [ACK] Seq=11732 Ack=260639 Win=65535 Len=0
792084 257.477245 219.160.224.138 -> 244.3.210.197 TCP 64 radmin-port > http [ACK] Seq=11732 Ack=263559 Win=65535 Len=0
792098 257.485148 219.160.224.138 -> 244.3.210.197 TCP 64 radmin-port > http [ACK] Seq=11732 Ack=265019 Win=65535 Len=0
792122 257.501277 219.160.224.138 -> 244.3.210.197 TCP 64 radmin-port > http [ACK] Seq=11732 Ack=267939 Win=65535 Len=0
792141 257.508050 219.160.224.138 -> 244.3.210.197 TCP 64 radmin-port > http [ACK] Seq=11732 Ack=269399 Win=65535 Len=0
792162 257.520086 219.160.224.138 -> 244.3.210.197 TCP 64 radmin-port > http [ACK] Seq=11732 Ack=271457 Win=65535 Len=0
792566 257.796135 219.160.224.138 -> 244.3.210.197 TCP 64 radmin-port > http [FIN, ACK] Seq=11732 Ack=271457 Win=65535 Len=0
792736 257.927640 219.160.224.138 -> 244.3.210.197 TCP 64 radmin-port > http [ACK] Seq=11733 Ack=271458 Win=65535 Len=0
