6191   1.949790 225.106.194.46 -> 41.177.26.176 TCP 64 33389 > http [RST, ACK] Seq=1 Ack=1 Win=0 Len=0
36800  15.373156 225.106.194.46 -> 41.177.26.176 TCP 66 33381 > http [SYN] Seq=0 Win=65535 Len=0 MSS=1460 SACK_PERM=1
37007  15.429797 225.106.194.46 -> 41.177.26.176 TCP 64 33381 > http [ACK] Seq=1 Ack=1 Win=65535 Len=0
37197  15.515689 225.106.194.46 -> 41.177.26.176 TCP 64 33381 > http [ACK] Seq=1186 Ack=2921 Win=65535 Len=0
37419  15.573222 225.106.194.46 -> 41.177.26.176 TCP 70 33381 > http [ACK] Seq=1186 Ack=4381 Win=65535 Len=0 SLE=7301 SRE=8001
37439  15.576456 225.106.194.46 -> 41.177.26.176 TCP 64 33381 > http [ACK] Seq=1186 Ack=8001 Win=65535 Len=0
37445  15.578646 225.106.194.46 -> 41.177.26.176 TCP 66 33309 > http [SYN] Seq=0 Win=65535 Len=0 MSS=1460 SACK_PERM=1
37528  15.629847 225.106.194.46 -> 41.177.26.176 TCP 70 [TCP Dup ACK 37439#1] 33381 > http [ACK] Seq=1186 Ack=8001 Win=65535 Len=0 SLE=9461 SRE=9678
37536  15.632615 225.106.194.46 -> 41.177.26.176 TCP 64 33381 > http [ACK] Seq=1186 Ack=9678 Win=65535 Len=0
37554  15.634820 225.106.194.46 -> 41.177.26.176 TCP 64 33309 > http [ACK] Seq=1 Ack=1 Win=65535 Len=0
37756  15.701716 225.106.194.46 -> 41.177.26.176 TCP 64 33309 > http [ACK] Seq=698 Ack=767 Win=64769 Len=0
38066  15.788108 225.106.194.46 -> 41.177.26.176 TCP 64 33381 > http [ACK] Seq=2587 Ack=10706 Win=64507 Len=0
38114  15.803529 225.106.194.46 -> 41.177.26.176 TCP 64 33309 > http [ACK] Seq=1396 Ack=1407 Win=64129 Len=0
38313  15.854195 225.106.194.46 -> 41.177.26.176 TCP 64 33381 > http [ACK] Seq=3288 Ack=11455 Win=65535 Len=0
38383  15.869046 225.106.194.46 -> 41.177.26.176 TCP 64 33309 > http [ACK] Seq=2093 Ack=1999 Win=65535 Len=0
42807  18.091556 225.106.194.46 -> 41.177.26.176 TCP 64 33381 > http [ACK] Seq=4310 Ack=14375 Win=65535 Len=0
42821  18.094390 225.106.194.46 -> 41.177.26.176 TCP 64 33381 > http [ACK] Seq=4310 Ack=17295 Win=65535 Len=0
42827  18.096292 225.106.194.46 -> 41.177.26.176 TCP 64 33381 > http [ACK] Seq=4310 Ack=19455 Win=65535 Len=0
42853  18.100883 225.106.194.46 -> 41.177.26.176 TCP 64 33381 > http [ACK] Seq=4310 Ack=22375 Win=65535 Len=0
42858  18.103712 225.106.194.46 -> 41.177.26.176 TCP 64 33381 > http [ACK] Seq=4310 Ack=25295 Win=65535 Len=0
42909  18.150410 225.106.194.46 -> 41.177.26.176 TCP 64 33381 > http [ACK] Seq=4310 Ack=27455 Win=65535 Len=0
42913  18.154258 225.106.194.46 -> 41.177.26.176 TCP 64 33381 > http [ACK] Seq=4310 Ack=30375 Win=65535 Len=0
42916  18.157910 225.106.194.46 -> 41.177.26.176 TCP 64 33381 > http [ACK] Seq=4310 Ack=33295 Win=65535 Len=0
42918  18.160376 225.106.194.46 -> 41.177.26.176 TCP 64 33381 > http [ACK] Seq=4310 Ack=35455 Win=65535 Len=0
42926  18.164524 225.106.194.46 -> 41.177.26.176 TCP 64 33381 > http [ACK] Seq=4310 Ack=38375 Win=65535 Len=0
42928  18.167592 225.106.194.46 -> 41.177.26.176 TCP 64 33381 > http [ACK] Seq=4310 Ack=41295 Win=65535 Len=0
42929  18.170189 225.106.194.46 -> 41.177.26.176 TCP 64 33381 > http [ACK] Seq=4310 Ack=43455 Win=65535 Len=0
42932  18.174805 225.106.194.46 -> 41.177.26.176 TCP 64 33381 > http [ACK] Seq=4310 Ack=46375 Win=65535 Len=0
42980  18.210552 225.106.194.46 -> 41.177.26.176 TCP 64 33381 > http [ACK] Seq=4310 Ack=49295 Win=65535 Len=0
43338  18.402804 225.106.194.46 -> 41.177.26.176 TCP 64 33381 > http [ACK] Seq=4310 Ack=50662 Win=64168 Len=0
49934  20.279088 225.106.194.46 -> 41.177.26.176 TCP 64 33309 > http [ACK] Seq=3270 Ack=4919 Win=65535 Len=0
49959  20.282928 225.106.194.46 -> 41.177.26.176 TCP 64 33309 > http [ACK] Seq=3270 Ack=7839 Win=65535 Len=0
49965  20.285493 225.106.194.46 -> 41.177.26.176 TCP 64 33309 > http [ACK] Seq=3270 Ack=9999 Win=65535 Len=0
50043  20.339009 225.106.194.46 -> 41.177.26.176 TCP 64 33309 > http [ACK] Seq=3270 Ack=12919 Win=65535 Len=0
50049  20.341583 225.106.194.46 -> 41.177.26.176 TCP 70 33309 > http [ACK] Seq=3270 Ack=14379 Win=65535 Len=0 SLE=17299 SRE=17999
50051  20.345533 225.106.194.46 -> 41.177.26.176 TCP 64 33309 > http [ACK] Seq=3270 Ack=17999 Win=65535 Len=0
50052  20.347016 225.106.194.46 -> 41.177.26.176 TCP 64 33309 > http [ACK] Seq=3270 Ack=19459 Win=65535 Len=0
50053  20.351442 225.106.194.46 -> 41.177.26.176 TCP 64 33309 > http [ACK] Seq=3270 Ack=22379 Win=65535 Len=0
50129  20.402281 225.106.194.46 -> 41.177.26.176 TCP 70 33309 > http [ACK] Seq=3270 Ack=23839 Win=65535 Len=0 SLE=25299 SRE=25999
50130  20.402950 225.106.194.46 -> 41.177.26.176 TCP 64 33309 > http [ACK] Seq=3270 Ack=25999 Win=65535 Len=0
50131  20.404231 225.106.194.46 -> 41.177.26.176 TCP 64 33309 > http [ACK] Seq=3270 Ack=28180 Win=65535 Len=0
59978  24.175583 225.106.194.46 -> 41.177.26.176 TCP 64 33381 > http [ACK] Seq=5612 Ack=53582 Win=65535 Len=0
59980  24.178951 225.106.194.46 -> 41.177.26.176 TCP 64 33381 > http [ACK] Seq=5612 Ack=56502 Win=65535 Len=0
59981  24.179998 225.106.194.46 -> 41.177.26.176 TCP 70 [TCP Dup ACK 59980#1] 33381 > http [ACK] Seq=5612 Ack=56502 Win=65535 Len=0 SLE=57962 SRE=58662
59982  24.180930 225.106.194.46 -> 41.177.26.176 TCP 64 33381 > http [ACK] Seq=5612 Ack=58662 Win=65535 Len=0
59987  24.185695 225.106.194.46 -> 41.177.26.176 TCP 70 33381 > http [ACK] Seq=5612 Ack=60122 Win=65535 Len=0 SLE=61582 SRE=63042
59988  24.187152 225.106.194.46 -> 41.177.26.176 TCP 70 [TCP Dup ACK 59987#1] 33381 > http [ACK] Seq=5612 Ack=60122 Win=65535 Len=0 SLE=61582 SRE=64502
59997  24.194220 225.106.194.46 -> 41.177.26.176 TCP 64 33381 > http [ACK] Seq=5612 Ack=66854 Win=65535 Len=0
60001  24.196913 225.106.194.46 -> 41.177.26.176 TCP 70 33381 > http [ACK] Seq=5612 Ack=69774 Win=65535 Len=0 SLE=71234 SRE=72694
60004  24.198894 225.106.194.46 -> 41.177.26.176 TCP 64 33381 > http [ACK] Seq=5612 Ack=72694 Win=65535 Len=0
60007  24.199750 225.106.194.46 -> 41.177.26.176 TCP 70 [TCP Dup ACK 60004#1] 33381 > http [ACK] Seq=5612 Ack=72694 Win=65535 Len=0 SLE=74154 SRE=74854
60009  24.201384 225.106.194.46 -> 41.177.26.176 TCP 64 33381 > http [ACK] Seq=5612 Ack=74854 Win=65535 Len=0
60124  24.269648 225.106.194.46 -> 41.177.26.176 TCP 64 33381 > http [ACK] Seq=5612 Ack=76795 Win=65535 Len=0
92386  35.381905 225.106.194.46 -> 41.177.26.176 TCP 64 33309 > http [ACK] Seq=3270 Ack=28181 Win=65535 Len=0
106515  38.436404 225.106.194.46 -> 41.177.26.176 TCP 64 33309 > http [FIN, ACK] Seq=3270 Ack=28181 Win=65535 Len=0
107014  38.545382 225.106.194.46 -> 41.177.26.176 TCP 64 33381 > http [ACK] Seq=6876 Ack=79715 Win=65535 Len=0
107020  38.547734 225.106.194.46 -> 41.177.26.176 TCP 70 33381 > http [ACK] Seq=6876 Ack=81175 Win=65535 Len=0 SLE=84095 SRE=84795
107025  38.552075 225.106.194.46 -> 41.177.26.176 TCP 64 33381 > http [ACK] Seq=6876 Ack=84795 Win=65535 Len=0
107048  38.555511 225.106.194.46 -> 41.177.26.176 TCP 64 33381 > http [ACK] Seq=6876 Ack=87715 Win=65535 Len=0
107052  38.559745 225.106.194.46 -> 41.177.26.176 TCP 64 33381 > http [ACK] Seq=6876 Ack=90635 Win=65535 Len=0
107053  38.560430 225.106.194.46 -> 41.177.26.176 TCP 70 [TCP Dup ACK 107052#1] 33381 > http [ACK] Seq=6876 Ack=90635 Win=65535 Len=0 SLE=92095 SRE=92795
107057  38.562039 225.106.194.46 -> 41.177.26.176 TCP 64 33381 > http [ACK] Seq=6876 Ack=92795 Win=65535 Len=0
107058  38.564837 225.106.194.46 -> 41.177.26.176 TCP 64 33381 > http [ACK] Seq=6876 Ack=95715 Win=65535 Len=0
107067  38.568823 225.106.194.46 -> 41.177.26.176 TCP 64 33381 > http [ACK] Seq=6876 Ack=98635 Win=65535 Len=0
107074  38.569956 225.106.194.46 -> 41.177.26.176 TCP 70 [TCP Dup ACK 107067#1] 33381 > http [ACK] Seq=6876 Ack=98635 Win=65535 Len=0 SLE=100095 SRE=100795
107075  38.571323 225.106.194.46 -> 41.177.26.176 TCP 64 33381 > http [ACK] Seq=6876 Ack=100795 Win=65535 Len=0
107115  38.580272 225.106.194.46 -> 41.177.26.176 TCP 66 33293 > http [SYN] Seq=0 Win=65535 Len=0 MSS=1460 SACK_PERM=1
107275  38.635693 225.106.194.46 -> 41.177.26.176 TCP 64 33381 > http [ACK] Seq=6876 Ack=103078 Win=65535 Len=0
107278  38.636606 225.106.194.46 -> 41.177.26.176 TCP 64 33293 > http [ACK] Seq=1 Ack=1 Win=65535 Len=0
107757  38.736342 225.106.194.46 -> 41.177.26.176 TCP 64 33293 > http [ACK] Seq=828 Ack=1749 Win=65535 Len=0
107783  38.753866 225.106.194.46 -> 41.177.26.176 TCP 64 33381 > http [ACK] Seq=7703 Ack=104826 Win=65535 Len=0
107797  38.757959 225.106.194.46 -> 41.177.26.176 TCP 64 33381 > http [ACK] Seq=7703 Ack=107746 Win=65535 Len=0
107801  38.758455 225.106.194.46 -> 41.177.26.176 TCP 70 [TCP Dup ACK 107797#1] 33381 > http [ACK] Seq=7703 Ack=107746 Win=65535 Len=0 SLE=109206 SRE=109762
107806  38.760120 225.106.194.46 -> 41.177.26.176 TCP 64 33381 > http [ACK] Seq=7703 Ack=109762 Win=65535 Len=0
107949  38.795317 225.106.194.46 -> 41.177.26.176 TCP 64 33293 > http [ACK] Seq=828 Ack=4669 Win=65535 Len=0
107960  38.797879 225.106.194.46 -> 41.177.26.176 TCP 64 33293 > http [ACK] Seq=828 Ack=7589 Win=65535 Len=0
108719  39.074123 225.106.194.46 -> 41.177.26.176 TCP 64 33293 > http [ACK] Seq=828 Ack=7687 Win=65437 Len=0
142593  48.995504 225.106.194.46 -> 41.177.26.176 TCP 64 33381 > http [ACK] Seq=8967 Ack=112682 Win=65535 Len=0
142596  48.997459 225.106.194.46 -> 41.177.26.176 TCP 70 33381 > http [ACK] Seq=8967 Ack=114142 Win=65535 Len=0 SLE=117062 SRE=117762
142616  49.001190 225.106.194.46 -> 41.177.26.176 TCP 64 33381 > http [ACK] Seq=8967 Ack=117762 Win=65535 Len=0
142625  49.004920 225.106.194.46 -> 41.177.26.176 TCP 64 33381 > http [ACK] Seq=8967 Ack=120682 Win=65535 Len=0
142638  49.008285 225.106.194.46 -> 41.177.26.176 TCP 64 33381 > http [ACK] Seq=8967 Ack=123602 Win=65535 Len=0
142640  49.009201 225.106.194.46 -> 41.177.26.176 TCP 70 [TCP Dup ACK 142638#1] 33381 > http [ACK] Seq=8967 Ack=123602 Win=65535 Len=0 SLE=125062 SRE=125762
142651  49.011198 225.106.194.46 -> 41.177.26.176 TCP 64 33381 > http [ACK] Seq=8967 Ack=125762 Win=65535 Len=0
142696  49.023572 225.106.194.46 -> 41.177.26.176 TCP 64 33381 > http [ACK] Seq=8967 Ack=128682 Win=65535 Len=0
142700  49.024189 225.106.194.46 -> 41.177.26.176 TCP 70 [TCP Dup ACK 142696#1] 33381 > http [ACK] Seq=8967 Ack=128682 Win=65535 Len=0 SLE=130142 SRE=131208
142704  49.024903 225.106.194.46 -> 41.177.26.176 TCP 64 33381 > http [ACK] Seq=8967 Ack=131208 Win=65535 Len=0
142929  49.107770 225.106.194.46 -> 41.177.26.176 TCP 64 33293 > http [ACK] Seq=1655 Ack=9435 Win=65535 Len=0
142979  49.111460 225.106.194.46 -> 41.177.26.176 TCP 64 33293 > http [ACK] Seq=1655 Ack=12355 Win=65535 Len=0
143670  49.355561 225.106.194.46 -> 41.177.26.176 TCP 64 33293 > http [ACK] Seq=1655 Ack=13809 Win=64081 Len=0
155978  53.195094 225.106.194.46 -> 41.177.26.176 TCP 64 33381 > http [ACK] Seq=10231 Ack=134128 Win=65535 Len=0
155984  53.198596 225.106.194.46 -> 41.177.26.176 TCP 64 33381 > http [ACK] Seq=10231 Ack=137048 Win=65535 Len=0
155987  53.199231 225.106.194.46 -> 41.177.26.176 TCP 70 [TCP Dup ACK 155984#1] 33381 > http [ACK] Seq=10231 Ack=137048 Win=65535 Len=0 SLE=138508 SRE=139208
155991  53.201334 225.106.194.46 -> 41.177.26.176 TCP 64 33381 > http [ACK] Seq=10231 Ack=139208 Win=65535 Len=0
156004  53.204481 225.106.194.46 -> 41.177.26.176 TCP 64 33381 > http [ACK] Seq=10231 Ack=142128 Win=65535 Len=0
156023  53.208676 225.106.194.46 -> 41.177.26.176 TCP 64 33381 > http [ACK] Seq=10231 Ack=145048 Win=65535 Len=0
156027  53.209894 225.106.194.46 -> 41.177.26.176 TCP 70 [TCP Dup ACK 156023#1] 33381 > http [ACK] Seq=10231 Ack=145048 Win=65535 Len=0 SLE=146508 SRE=147208
156037  53.211884 225.106.194.46 -> 41.177.26.176 TCP 64 33381 > http [ACK] Seq=10231 Ack=147208 Win=65535 Len=0
156052  53.214957 225.106.194.46 -> 41.177.26.176 TCP 64 33381 > http [ACK] Seq=10231 Ack=150128 Win=65535 Len=0
156072  53.217972 225.106.194.46 -> 41.177.26.176 TCP 64 33381 > http [ACK] Seq=10231 Ack=153048 Win=65535 Len=0
156079  53.218976 225.106.194.46 -> 41.177.26.176 TCP 70 [TCP Dup ACK 156072#1] 33381 > http [ACK] Seq=10231 Ack=153048 Win=65535 Len=0 SLE=154508 SRE=155208
156088  53.221182 225.106.194.46 -> 41.177.26.176 TCP 64 33381 > http [ACK] Seq=10231 Ack=155208 Win=65535 Len=0
156410  53.283944 225.106.194.46 -> 41.177.26.176 TCP 70 [TCP Dup ACK 156088#1] 33381 > http [ACK] Seq=10231 Ack=155208 Win=65535 Len=0 SLE=156668 SRE=157491
156434  53.285664 225.106.194.46 -> 41.177.26.176 TCP 64 33381 > http [ACK] Seq=10231 Ack=157491 Win=65535 Len=0
169911  56.574564 225.106.194.46 -> 41.177.26.176 TCP 64 33293 > http [ACK] Seq=2455 Ack=15556 Win=65535 Len=0
169918  56.577215 225.106.194.46 -> 41.177.26.176 TCP 70 33293 > http [ACK] Seq=2455 Ack=17016 Win=65535 Len=0 SLE=18476 SRE=19453
169932  56.579077 225.106.194.46 -> 41.177.26.176 TCP 64 33293 > http [ACK] Seq=2455 Ack=19453 Win=65535 Len=0
170266  56.650986 225.106.194.46 -> 41.177.26.176 TCP 64 33381 > http [ACK] Seq=10850 Ack=159236 Win=65535 Len=0
170282  56.651838 225.106.194.46 -> 41.177.26.176 TCP 70 [TCP Dup ACK 170266#1] 33381 > http [ACK] Seq=10850 Ack=159236 Win=65535 Len=0 SLE=160696 SRE=161461
170309  56.653787 225.106.194.46 -> 41.177.26.176 TCP 64 33381 > http [ACK] Seq=10850 Ack=161461 Win=65535 Len=0
170319  56.656088 225.106.194.46 -> 41.177.26.176 TCP 64 33293 > http [ACK] Seq=3073 Ack=20177 Win=64811 Len=0
170764  56.752408 225.106.194.46 -> 41.177.26.176 TCP 64 33381 > http [ACK] Seq=11473 Ack=163210 Win=65535 Len=0
170807  56.756645 225.106.194.46 -> 41.177.26.176 TCP 64 33381 > http [ACK] Seq=11473 Ack=166130 Win=65535 Len=0
170824  56.759301 225.106.194.46 -> 41.177.26.176 TCP 70 33381 > http [ACK] Seq=11473 Ack=167590 Win=65535 Len=0 SLE=169050 SRE=169942
170834  56.761049 225.106.194.46 -> 41.177.26.176 TCP 64 33381 > http [ACK] Seq=11473 Ack=169942 Win=65535 Len=0
170855  56.765094 225.106.194.46 -> 41.177.26.176 TCP 64 33381 > http [ACK] Seq=11473 Ack=172862 Win=65535 Len=0
170873  56.768478 225.106.194.46 -> 41.177.26.176 TCP 64 33381 > http [ACK] Seq=11473 Ack=175782 Win=65535 Len=0
170886  56.771255 225.106.194.46 -> 41.177.26.176 TCP 64 33381 > http [ACK] Seq=11473 Ack=178134 Win=65535 Len=0
170899  56.774604 225.106.194.46 -> 41.177.26.176 TCP 64 33381 > http [ACK] Seq=11473 Ack=181054 Win=65535 Len=0
170904  56.778103 225.106.194.46 -> 41.177.26.176 TCP 64 33381 > http [ACK] Seq=11473 Ack=183974 Win=65535 Len=0
170932  56.779847 225.106.194.46 -> 41.177.26.176 TCP 70 [TCP Dup ACK 170904#1] 33381 > http [ACK] Seq=11473 Ack=183974 Win=65535 Len=0 SLE=185434 SRE=186326
170975  56.782436 225.106.194.46 -> 41.177.26.176 TCP 64 33381 > http [ACK] Seq=11473 Ack=186326 Win=65535 Len=0
171004  56.787207 225.106.194.46 -> 41.177.26.176 TCP 64 33381 > http [ACK] Seq=11473 Ack=189246 Win=65535 Len=0
171007  56.789928 225.106.194.46 -> 41.177.26.176 TCP 70 33381 > http [ACK] Seq=11473 Ack=190706 Win=65535 Len=0 SLE=192166 SRE=192944
171016  56.792939 225.106.194.46 -> 41.177.26.176 TCP 64 33381 > http [ACK] Seq=11473 Ack=192944 Win=65535 Len=0
171244  56.860583 225.106.194.46 -> 41.177.26.176 TCP 64 33293 > http [ACK] Seq=4319 Ack=21103 Win=65535 Len=0
171293  56.869738 225.106.194.46 -> 41.177.26.176 TCP 64 33381 > http [ACK] Seq=12096 Ack=194693 Win=65535 Len=0
171300  56.873774 225.106.194.46 -> 41.177.26.176 TCP 64 33381 > http [ACK] Seq=12096 Ack=197613 Win=65535 Len=0
171316  56.876479 225.106.194.46 -> 41.177.26.176 TCP 70 33381 > http [ACK] Seq=12096 Ack=199073 Win=65535 Len=0 SLE=200533 SRE=201425
171320  56.878517 225.106.194.46 -> 41.177.26.176 TCP 64 33381 > http [ACK] Seq=12096 Ack=201425 Win=65535 Len=0
171328  56.881812 225.106.194.46 -> 41.177.26.176 TCP 64 33381 > http [ACK] Seq=12096 Ack=204345 Win=65535 Len=0
171347  56.885376 225.106.194.46 -> 41.177.26.176 TCP 64 33381 > http [ACK] Seq=12096 Ack=207265 Win=65535 Len=0
171362  56.887751 225.106.194.46 -> 41.177.26.176 TCP 64 33381 > http [ACK] Seq=12096 Ack=209617 Win=65535 Len=0
171430  56.927780 225.106.194.46 -> 41.177.26.176 TCP 64 33293 > http [ACK] Seq=4950 Ack=22851 Win=65535 Len=0
171433  56.931329 225.106.194.46 -> 41.177.26.176 TCP 64 33293 > http [ACK] Seq=4950 Ack=25771 Win=65535 Len=0
171440  56.934989 225.106.194.46 -> 41.177.26.176 TCP 64 33293 > http [ACK] Seq=4950 Ack=28601 Win=65535 Len=0
171540  57.011421 225.106.194.46 -> 41.177.26.176 TCP 64 33381 > http [ACK] Seq=12096 Ack=210983 Win=64169 Len=0
199328  68.556118 225.106.194.46 -> 41.177.26.176 TCP 64 33381 > http [ACK] Seq=13360 Ack=213903 Win=65535 Len=0
199351  68.567885 225.106.194.46 -> 41.177.26.176 TCP 70 33381 > http [ACK] Seq=13360 Ack=215363 Win=65535 Len=0 SLE=218283 SRE=218983
199354  68.568895 225.106.194.46 -> 41.177.26.176 TCP 64 33381 > http [ACK] Seq=13360 Ack=218983 Win=65535 Len=0
199356  68.570076 225.106.194.46 -> 41.177.26.176 TCP 70 33381 > http [ACK] Seq=13360 Ack=220443 Win=65535 Len=0 SLE=221903 SRE=223363
199360  68.570745 225.106.194.46 -> 41.177.26.176 TCP 64 33381 > http [ACK] Seq=13360 Ack=223363 Win=65535 Len=0
199366  68.571829 225.106.194.46 -> 41.177.26.176 TCP 70 33381 > http [ACK] Seq=13360 Ack=224823 Win=65535 Len=0 SLE=226283 SRE=226983
199373  68.572846 225.106.194.46 -> 41.177.26.176 TCP 64 33381 > http [ACK] Seq=13360 Ack=226983 Win=65535 Len=0
199378  68.575596 225.106.194.46 -> 41.177.26.176 TCP 64 33381 > http [ACK] Seq=13360 Ack=229903 Win=65535 Len=0
199381  68.579514 225.106.194.46 -> 41.177.26.176 TCP 70 33381 > http [ACK] Seq=13360 Ack=231363 Win=65535 Len=0 SLE=232823 SRE=234283
199382  68.581438 225.106.194.46 -> 41.177.26.176 TCP 64 33381 > http [ACK] Seq=13360 Ack=234283 Win=65535 Len=0
199513  68.643768 225.106.194.46 -> 41.177.26.176 TCP 70 33381 > http [ACK] Seq=13360 Ack=234983 Win=64835 Len=0 SLE=236443 SRE=237116
199525  68.646016 225.106.194.46 -> 41.177.26.176 TCP 64 33381 > http [ACK] Seq=13360 Ack=237116 Win=65535 Len=0
201102  69.371292 225.106.194.46 -> 41.177.26.176 TCP 64 33381 > http [ACK] Seq=20568 Ack=238559 Win=64092 Len=0
201389  69.480811 225.106.194.46 -> 41.177.26.176 TCP 64 33293 > http [ACK] Seq=13053 Ack=30229 Win=65535 Len=0
226015  77.296123 225.106.194.46 -> 41.177.26.176 TCP 64 33293 > http [ACK] Seq=14314 Ack=33149 Win=65535 Len=0
226020  77.299777 225.106.194.46 -> 41.177.26.176 TCP 64 33293 > http [ACK] Seq=14314 Ack=36069 Win=65535 Len=0
226040  77.300888 225.106.194.46 -> 41.177.26.176 TCP 70 [TCP Dup ACK 226020#1] 33293 > http [ACK] Seq=14314 Ack=36069 Win=65535 Len=0 SLE=37529 SRE=38229
226063  77.302118 225.106.194.46 -> 41.177.26.176 TCP 64 33293 > http [ACK] Seq=14314 Ack=38229 Win=65535 Len=0
226168  77.306142 225.106.194.46 -> 41.177.26.176 TCP 64 33293 > http [ACK] Seq=14314 Ack=41149 Win=65535 Len=0
226213  77.309542 225.106.194.46 -> 41.177.26.176 TCP 64 33293 > http [ACK] Seq=14314 Ack=44069 Win=65535 Len=0
226284  77.311825 225.106.194.46 -> 41.177.26.176 TCP 64 33293 > http [ACK] Seq=14314 Ack=46229 Win=65535 Len=0
226327  77.315549 225.106.194.46 -> 41.177.26.176 TCP 64 33293 > http [ACK] Seq=14314 Ack=49149 Win=65535 Len=0
226330  77.319695 225.106.194.46 -> 41.177.26.176 TCP 64 33293 > http [ACK] Seq=14314 Ack=52069 Win=65535 Len=0
226331  77.320362 225.106.194.46 -> 41.177.26.176 TCP 70 [TCP Dup ACK 226330#1] 33293 > http [ACK] Seq=14314 Ack=52069 Win=65535 Len=0 SLE=53529 SRE=54229
226335  77.321718 225.106.194.46 -> 41.177.26.176 TCP 64 33293 > http [ACK] Seq=14314 Ack=54229 Win=65535 Len=0
226422  77.383885 225.106.194.46 -> 41.177.26.176 TCP 70 [TCP Dup ACK 226335#1] 33293 > http [ACK] Seq=14314 Ack=54229 Win=65535 Len=0 SLE=55689 SRE=56410
226423  77.386179 225.106.194.46 -> 41.177.26.176 TCP 64 33293 > http [ACK] Seq=14314 Ack=56410 Win=65535 Len=0
227107  77.642707 225.106.194.46 -> 41.177.26.176 TCP 64 33381 > http [ACK] Seq=21480 Ack=238741 Win=65535 Len=0
240019  83.329449 225.106.194.46 -> 41.177.26.176 TCP 70 33293 > http [ACK] Seq=15132 Ack=58920 Win=65535 Len=0 SLE=61840 SRE=61980
240024  83.330207 225.106.194.46 -> 41.177.26.176 TCP 70 [TCP Dup ACK 240019#1] 33293 > http [ACK] Seq=15132 Ack=58920 Win=65535 Len=0 SLE=61840 SRE=62137
240032  83.333759 225.106.194.46 -> 41.177.26.176 TCP 64 33293 > http [ACK] Seq=15132 Ack=62137 Win=65535 Len=0
240236  83.389345 225.106.194.46 -> 41.177.26.176 TCP 64 33293 > http [ACK] Seq=15132 Ack=64872 Win=65535 Len=0
240242  83.392800 225.106.194.46 -> 41.177.26.176 TCP 64 33293 > http [ACK] Seq=15132 Ack=67093 Win=65535 Len=0
240292  83.420023 225.106.194.46 -> 41.177.26.176 TCP 64 33381 > http [ACK] Seq=22107 Ack=240488 Win=65535 Len=0
240306  83.423232 225.106.194.46 -> 41.177.26.176 TCP 64 33381 > http [ACK] Seq=22107 Ack=243408 Win=65535 Len=0
240317  83.426325 225.106.194.46 -> 41.177.26.176 TCP 70 33381 > http [ACK] Seq=22107 Ack=244868 Win=65535 Len=0 SLE=246328 SRE=247220
240338  83.428183 225.106.194.46 -> 41.177.26.176 TCP 64 33381 > http [ACK] Seq=22107 Ack=247220 Win=65535 Len=0
240363  83.431822 225.106.194.46 -> 41.177.26.176 TCP 64 33381 > http [ACK] Seq=22107 Ack=250140 Win=64075 Len=0
240374  83.432954 225.106.194.46 -> 41.177.26.176 TCP 64 [TCP Window Update] 33381 > http [ACK] Seq=22107 Ack=250140 Win=65535 Len=0
240388  83.435064 225.106.194.46 -> 41.177.26.176 TCP 64 33381 > http [ACK] Seq=22107 Ack=253060 Win=65535 Len=0
240392  83.436497 225.106.194.46 -> 41.177.26.176 TCP 70 [TCP Dup ACK 240388#1] 33381 > http [ACK] Seq=22107 Ack=253060 Win=65535 Len=0 SLE=254520 SRE=255412
240396  83.438419 225.106.194.46 -> 41.177.26.176 TCP 64 33381 > http [ACK] Seq=22107 Ack=255412 Win=65535 Len=0
240412  83.441901 225.106.194.46 -> 41.177.26.176 TCP 64 33381 > http [ACK] Seq=22107 Ack=258332 Win=65535 Len=0
240415  83.445518 225.106.194.46 -> 41.177.26.176 TCP 64 33381 > http [ACK] Seq=22107 Ack=261252 Win=65535 Len=0
240416  83.446412 225.106.194.46 -> 41.177.26.176 TCP 70 [TCP Dup ACK 240415#1] 33381 > http [ACK] Seq=22107 Ack=261252 Win=65535 Len=0 SLE=262712 SRE=263604
240417  83.448489 225.106.194.46 -> 41.177.26.176 TCP 64 33381 > http [ACK] Seq=22107 Ack=263604 Win=65535 Len=0
240418  83.452093 225.106.194.46 -> 41.177.26.176 TCP 64 33381 > http [ACK] Seq=22107 Ack=266524 Win=65535 Len=0
240439  83.454770 225.106.194.46 -> 41.177.26.176 TCP 70 33381 > http [ACK] Seq=22107 Ack=267984 Win=65535 Len=0 SLE=270904 SRE=271796
240447  83.458712 225.106.194.46 -> 41.177.26.176 TCP 64 33381 > http [ACK] Seq=22107 Ack=271796 Win=65535 Len=0
240451  83.461911 225.106.194.46 -> 41.177.26.176 TCP 64 33381 > http [ACK] Seq=22107 Ack=274716 Win=65535 Len=0
240461  83.465358 225.106.194.46 -> 41.177.26.176 TCP 64 33381 > http [ACK] Seq=22107 Ack=277636 Win=65535 Len=0
240463  83.468243 225.106.194.46 -> 41.177.26.176 TCP 64 33381 > http [ACK] Seq=22107 Ack=279988 Win=65535 Len=0
240466  83.471617 225.106.194.46 -> 41.177.26.176 TCP 64 33381 > http [ACK] Seq=22107 Ack=282340 Win=65535 Len=0
240483  83.480774 225.106.194.46 -> 41.177.26.176 TCP 64 33293 > http [ACK] Seq=15759 Ack=69427 Win=65535 Len=0
240719  83.602467 225.106.194.46 -> 41.177.26.176 TCP 70 33381 > http [ACK] Seq=23506 Ack=282805 Win=65070 Len=0 SLE=284265 SRE=284444
240723  83.604495 225.106.194.46 -> 41.177.26.176 TCP 64 33381 > http [ACK] Seq=23506 Ack=284444 Win=65535 Len=0
241185  83.918012 225.106.194.46 -> 41.177.26.176 TCP 64 33381 > http [ACK] Seq=25639 Ack=285135 Win=64844 Len=0
241325  84.027344 225.106.194.46 -> 41.177.26.176 TCP 64 33293 > http [ACK] Seq=18631 Ack=70292 Win=64670 Len=0
293766  98.762019 225.106.194.46 -> 41.177.26.176 TCP 64 33293 > http [ACK] Seq=18631 Ack=70293 Win=64670 Len=0
293822  98.812358 225.106.194.46 -> 41.177.26.176 TCP 64 33381 > http [ACK] Seq=25639 Ack=285136 Win=64844 Len=0
299194 100.872056 225.106.194.46 -> 41.177.26.176 TCP 64 33293 > http [RST, ACK] Seq=18631 Ack=70293 Win=0 Len=0
299196 100.872480 225.106.194.46 -> 41.177.26.176 TCP 64 33381 > http [RST, ACK] Seq=25639 Ack=285136 Win=0 Len=0
300452 101.293631 225.106.194.46 -> 41.177.26.176 TCP 66 33497 > http [SYN] Seq=0 Win=65535 Len=0 MSS=1460 SACK_PERM=1
300599 101.350158 225.106.194.46 -> 41.177.26.176 TCP 64 33497 > http [ACK] Seq=1 Ack=1 Win=65535 Len=0
304210 102.950803 225.106.194.46 -> 41.177.26.176 TCP 64 33497 > http [ACK] Seq=959 Ack=1578 Win=65535 Len=0
304220 102.960043 225.106.194.46 -> 41.177.26.176 TCP 70 33497 > http [ACK] Seq=959 Ack=2338 Win=64775 Len=0 SLE=2545 SRE=2636
304223 102.961131 225.106.194.46 -> 41.177.26.176 TCP 64 33497 > http [ACK] Seq=959 Ack=2636 Win=64477 Len=0
304227 102.962079 225.106.194.46 -> 41.177.26.176 TCP 64 33497 > http [ACK] Seq=959 Ack=3053 Win=65535 Len=0
304228 102.964218 225.106.194.46 -> 41.177.26.176 TCP 66 33501 > http [SYN] Seq=0 Win=65535 Len=0 MSS=1460 SACK_PERM=1
304355 103.009841 225.106.194.46 -> 41.177.26.176 TCP 64 33497 > http [ACK] Seq=959 Ack=5397 Win=65535 Len=0
304380 103.018750 225.106.194.46 -> 41.177.26.176 TCP 64 33497 > http [ACK] Seq=959 Ack=7976 Win=65535 Len=0
304400 103.021808 225.106.194.46 -> 41.177.26.176 TCP 64 33497 > http [ACK] Seq=959 Ack=10245 Win=65535 Len=0
304402 103.022577 225.106.194.46 -> 41.177.26.176 TCP 64 33501 > http [ACK] Seq=1 Ack=1 Win=65535 Len=0
304670 103.127427 225.106.194.46 -> 41.177.26.15 TCP 66 33421 > http [SYN] Seq=0 Win=65535 Len=0 MSS=1460 SACK_PERM=1
304808 103.184008 225.106.194.46 -> 41.177.26.15 TCP 64 33421 > http [ACK] Seq=1 Ack=1 Win=65535 Len=0
305084 103.264468 225.106.194.46 -> 41.177.26.15 TCP 64 33421 > http [ACK] Seq=482 Ack=1772 Win=65535 Len=0
305224 103.322712 225.106.194.46 -> 41.177.26.15 TCP 64 33421 > http [ACK] Seq=482 Ack=4692 Win=65535 Len=0
305237 103.326747 225.106.194.46 -> 41.177.26.15 TCP 64 33421 > http [ACK] Seq=482 Ack=7612 Win=65535 Len=0
305370 103.382300 225.106.194.46 -> 41.177.26.15 TCP 64 33421 > http [ACK] Seq=482 Ack=9964 Win=65535 Len=0
305388 103.385623 225.106.194.46 -> 41.177.26.15 TCP 64 33421 > http [ACK] Seq=482 Ack=12884 Win=65535 Len=0
305393 103.389412 225.106.194.46 -> 41.177.26.15 TCP 64 33421 > http [ACK] Seq=482 Ack=15804 Win=65535 Len=0
305454 103.441494 225.106.194.46 -> 41.177.26.15 TCP 64 33421 > http [ACK] Seq=482 Ack=18156 Win=65535 Len=0
305463 103.445498 225.106.194.46 -> 41.177.26.15 TCP 64 33421 > http [ACK] Seq=482 Ack=21076 Win=65535 Len=0
305467 103.449107 225.106.194.46 -> 41.177.26.15 TCP 64 33421 > http [ACK] Seq=482 Ack=23996 Win=65535 Len=0
305471 103.452497 225.106.194.46 -> 41.177.26.15 TCP 64 33421 > http [ACK] Seq=482 Ack=26348 Win=65535 Len=0
305606 103.495915 225.106.194.46 -> 41.177.26.176 TCP 64 33501 > http [ACK] Seq=2188 Ack=899 Win=64637 Len=0
305607 103.497008 225.106.194.46 -> 41.177.26.176 TCP 64 33497 > http [ACK] Seq=3987 Ack=11179 Win=64601 Len=0
305612 103.500407 225.106.194.46 -> 41.177.26.15 TCP 64 33421 > http [ACK] Seq=482 Ack=29268 Win=65535 Len=0
305616 103.503542 225.106.194.46 -> 41.177.26.15 TCP 64 33421 > http [ACK] Seq=482 Ack=32188 Win=65535 Len=0
305627 103.506978 225.106.194.46 -> 41.177.26.15 TCP 64 33421 > http [ACK] Seq=482 Ack=34540 Win=65535 Len=0
305630 103.509400 225.106.194.46 -> 41.177.26.15 TCP 64 33421 > http [ACK] Seq=482 Ack=37460 Win=65535 Len=0
305645 103.513865 225.106.194.46 -> 41.177.26.15 TCP 64 33421 > http [ACK] Seq=482 Ack=40380 Win=65535 Len=0
305656 103.516750 225.106.194.46 -> 41.177.26.15 TCP 64 33421 > http [ACK] Seq=482 Ack=42732 Win=65535 Len=0
305744 103.559068 225.106.194.46 -> 41.177.26.15 TCP 64 33421 > http [ACK] Seq=482 Ack=45652 Win=65535 Len=0
305750 103.562065 225.106.194.46 -> 41.177.26.15 TCP 64 33421 > http [ACK] Seq=482 Ack=48572 Win=65535 Len=0
305757 103.565900 225.106.194.46 -> 41.177.26.15 TCP 64 33421 > http [ACK] Seq=482 Ack=50924 Win=65535 Len=0
305761 103.568878 225.106.194.46 -> 41.177.26.15 TCP 64 33421 > http [ACK] Seq=482 Ack=53844 Win=65535 Len=0
305768 103.572728 225.106.194.46 -> 41.177.26.15 TCP 64 33421 > http [ACK] Seq=482 Ack=56764 Win=65535 Len=0
305773 103.575336 225.106.194.46 -> 41.177.26.15 TCP 64 33421 > http [ACK] Seq=482 Ack=59116 Win=65535 Len=0
305777 103.579024 225.106.194.46 -> 41.177.26.15 TCP 64 33421 > http [ACK] Seq=482 Ack=62036 Win=65535 Len=0
305781 103.581601 225.106.194.46 -> 41.177.26.15 TCP 70 33421 > http [ACK] Seq=482 Ack=63496 Win=65535 Len=0 SLE=64956 SRE=65848
305788 103.584047 225.106.194.46 -> 41.177.26.15 TCP 64 33421 > http [ACK] Seq=482 Ack=65848 Win=65535 Len=0
305793 103.585583 225.106.194.46 -> 41.177.26.15 TCP 64 33421 > http [ACK] Seq=482 Ack=67308 Win=65535 Len=0
305800 103.588702 225.106.194.46 -> 41.177.26.15 TCP 64 33421 > http [ACK] Seq=482 Ack=70228 Win=65535 Len=0
305828 103.619483 225.106.194.46 -> 41.177.26.15 TCP 64 33421 > http [ACK] Seq=482 Ack=73148 Win=65535 Len=0
305832 103.621566 225.106.194.46 -> 41.177.26.15 TCP 70 33421 > http [ACK] Seq=482 Ack=74608 Win=65535 Len=0 SLE=76068 SRE=76960
305838 103.624171 225.106.194.46 -> 41.177.26.15 TCP 64 33421 > http [ACK] Seq=482 Ack=76960 Win=65535 Len=0
305841 103.625807 225.106.194.46 -> 41.177.26.15 TCP 64 33421 > http [ACK] Seq=482 Ack=78420 Win=65535 Len=0
305843 103.628970 225.106.194.46 -> 41.177.26.15 TCP 64 33421 > http [ACK] Seq=482 Ack=81340 Win=65535 Len=0
305844 103.631626 225.106.194.46 -> 41.177.26.15 TCP 70 33421 > http [ACK] Seq=482 Ack=82800 Win=65535 Len=0 SLE=84260 SRE=85152
305847 103.634284 225.106.194.46 -> 41.177.26.15 TCP 64 33421 > http [ACK] Seq=482 Ack=85152 Win=65535 Len=0
305850 103.635411 225.106.194.46 -> 41.177.26.15 TCP 64 33421 > http [ACK] Seq=482 Ack=86612 Win=65535 Len=0
305851 103.639235 225.106.194.46 -> 41.177.26.15 TCP 64 33421 > http [ACK] Seq=482 Ack=89532 Win=65535 Len=0
305858 103.641777 225.106.194.46 -> 41.177.26.15 TCP 70 33421 > http [ACK] Seq=482 Ack=90992 Win=65535 Len=0 SLE=92452 SRE=93344
305860 103.643737 225.106.194.46 -> 41.177.26.15 TCP 64 33421 > http [ACK] Seq=482 Ack=93344 Win=65535 Len=0
305861 103.645598 225.106.194.46 -> 41.177.26.15 TCP 64 33421 > http [ACK] Seq=482 Ack=94804 Win=65535 Len=0
305863 103.649867 225.106.194.46 -> 41.177.26.15 TCP 64 33421 > http [ACK] Seq=482 Ack=97724 Win=65535 Len=0
305864 103.652537 225.106.194.46 -> 41.177.26.15 TCP 70 33421 > http [ACK] Seq=482 Ack=99184 Win=65535 Len=0 SLE=100644 SRE=101536
305865 103.654381 225.106.194.46 -> 41.177.26.15 TCP 64 33421 > http [ACK] Seq=482 Ack=101536 Win=65535 Len=0
305866 103.655503 225.106.194.46 -> 41.177.26.15 TCP 70 [TCP Dup ACK 305865#1] 33421 > http [ACK] Seq=482 Ack=101536 Win=65535 Len=0 SLE=102996 SRE=104456
305869 103.657980 225.106.194.46 -> 41.177.26.15 TCP 70 [TCP Dup ACK 305865#2] 33421 > http [ACK] Seq=482 Ack=101536 Win=65535 Len=0 SLE=102996 SRE=105916
305872 103.658911 225.106.194.46 -> 41.177.26.15 TCP 64 33421 > http [ACK] Seq=482 Ack=105916 Win=65535 Len=0
305876 103.660805 225.106.194.46 -> 41.177.26.15 TCP 70 [TCP Dup ACK 305872#1] 33421 > http [ACK] Seq=482 Ack=105916 Win=65535 Len=0 SLE=107376 SRE=108836
305877 103.662724 225.106.194.46 -> 41.177.26.15 TCP 64 33421 > http [ACK] Seq=482 Ack=108836 Win=65535 Len=0
305878 103.663906 225.106.194.46 -> 41.177.26.15 TCP 64 33421 > http [ACK] Seq=482 Ack=109728 Win=64643 Len=0
305888 103.667463 225.106.194.46 -> 41.177.26.15 TCP 64 33421 > http [ACK] Seq=482 Ack=112648 Win=65535 Len=0
305906 103.679870 225.106.194.46 -> 41.177.26.15 TCP 64 33421 > http [ACK] Seq=482 Ack=115568 Win=65535 Len=0
305907 103.682386 225.106.194.46 -> 41.177.26.15 TCP 64 33421 > http [ACK] Seq=482 Ack=117920 Win=65535 Len=0
305915 103.683710 225.106.194.46 -> 41.177.26.15 TCP 70 [TCP Dup ACK 305907#1] 33421 > http [ACK] Seq=482 Ack=117920 Win=65535 Len=0 SLE=119380 SRE=120166
305916 103.685719 225.106.194.46 -> 41.177.26.15 TCP 64 33421 > http [ACK] Seq=482 Ack=120166 Win=65535 Len=0
327062 112.951233 225.106.194.46 -> 41.177.26.176 TCP 64 33501 > http [ACK] Seq=3446 Ack=3819 Win=65535 Len=0
327071 112.953243 225.106.194.46 -> 41.177.26.176 TCP 70 33501 > http [ACK] Seq=3446 Ack=5279 Win=65535 Len=0 SLE=8199 SRE=8899
327075 112.956974 225.106.194.46 -> 41.177.26.176 TCP 64 33501 > http [ACK] Seq=3446 Ack=8899 Win=65535 Len=0
327177 113.011859 225.106.194.46 -> 41.177.26.176 TCP 64 33501 > http [ACK] Seq=3446 Ack=11819 Win=65535 Len=0
327184 113.015388 225.106.194.46 -> 41.177.26.176 TCP 64 33501 > http [ACK] Seq=3446 Ack=14739 Win=65535 Len=0
327191 113.018258 225.106.194.46 -> 41.177.26.176 TCP 64 33501 > http [ACK] Seq=3446 Ack=16899 Win=65535 Len=0
327192 113.021964 225.106.194.46 -> 41.177.26.176 TCP 64 33501 > http [ACK] Seq=3446 Ack=19819 Win=65535 Len=0
327250 113.069050 225.106.194.46 -> 41.177.26.176 TCP 70 33501 > http [ACK] Seq=3446 Ack=21279 Win=65535 Len=0 SLE=24199 SRE=24899
327258 113.073407 225.106.194.46 -> 41.177.26.176 TCP 64 33501 > http [ACK] Seq=3446 Ack=24899 Win=65535 Len=0
327259 113.074326 225.106.194.46 -> 41.177.26.176 TCP 64 33501 > http [ACK] Seq=3446 Ack=26359 Win=65535 Len=0
328286 113.777348 225.106.194.46 -> 41.177.26.176 TCP 64 33497 > http [ACK] Seq=12975 Ack=12989 Win=64269 Len=0
328413 113.886627 225.106.194.46 -> 41.177.26.176 TCP 64 33501 > http [ACK] Seq=10630 Ack=28523 Win=64994 Len=0
350899 118.572318 225.106.194.46 -> 41.177.26.15 TCP 64 33421 > http [ACK] Seq=482 Ack=120167 Win=65535 Len=0
359342 122.659651 225.106.194.46 -> 41.177.26.176 TCP 64 33501 > http [ACK] Seq=11452 Ack=30969 Win=65535 Len=0
359526 122.717821 225.106.194.46 -> 41.177.26.176 TCP 64 33501 > http [ACK] Seq=11452 Ack=33848 Win=65535 Len=0
359542 122.721632 225.106.194.46 -> 41.177.26.176 TCP 64 33501 > http [ACK] Seq=11452 Ack=36578 Win=65535 Len=0
359649 122.776866 225.106.194.46 -> 41.177.26.176 TCP 70 33501 > http [ACK] Seq=11452 Ack=37991 Win=64122 Len=0 SLE=39379 SRE=40243
359653 122.778703 225.106.194.46 -> 41.177.26.176 TCP 64 33501 > http [ACK] Seq=11452 Ack=40243 Win=65535 Len=0
359659 122.781899 225.106.194.46 -> 41.177.26.176 TCP 64 33501 > http [ACK] Seq=11452 Ack=42606 Win=65535 Len=0
359790 122.838991 225.106.194.46 -> 41.177.26.176 TCP 64 33501 > http [ACK] Seq=11452 Ack=45622 Win=65535 Len=0
361378 123.342058 225.106.194.46 -> 41.177.26.176 TCP 64 33497 > http [ACK] Seq=15904 Ack=13711 Win=65176 Len=0
361402 123.356077 225.106.194.46 -> 41.177.26.176 TCP 64 33501 > http [ACK] Seq=12196 Ack=45801 Win=65356 Len=0
361560 123.412417 225.106.194.46 -> 41.177.26.176 TCP 64 [TCP Dup ACK 361402#1] 33501 > http [ACK] Seq=12196 Ack=45801 Win=65356 Len=0
385696 127.949648 225.106.194.46 -> 41.177.26.15 TCP 64 33421 > http [RST, ACK] Seq=482 Ack=120167 Win=0 Len=0
413081 137.912446 225.106.194.46 -> 41.177.26.176 TCP 64 33501 > http [ACK] Seq=12196 Ack=45802 Win=65356 Len=0
413167 137.949236 225.106.194.46 -> 41.177.26.176 TCP 64 33501 > http [RST, ACK] Seq=12196 Ack=45802 Win=0 Len=0
413205 137.961847 225.106.194.46 -> 41.177.26.176 TCP 64 33497 > http [ACK] Seq=15904 Ack=13712 Win=65176 Len=0
438409 142.949763 225.106.194.46 -> 41.177.26.176 TCP 64 33497 > http [RST, ACK] Seq=15904 Ack=13712 Win=0 Len=0
554789 178.617075 225.106.194.46 -> 41.177.26.176 TCP 66 34497 > http [SYN] Seq=0 Win=65535 Len=0 MSS=1460 SACK_PERM=1
554917 178.673636 225.106.194.46 -> 41.177.26.176 TCP 64 34497 > http [ACK] Seq=1 Ack=1 Win=65535 Len=0
555199 178.775693 225.106.194.46 -> 41.177.26.176 TCP 64 34497 > http [ACK] Seq=1206 Ack=2921 Win=65535 Len=0
555226 178.798910 225.106.194.46 -> 41.177.26.176 TCP 66 33477 > http [SYN] Seq=0 Win=65535 Len=0 MSS=1460 SACK_PERM=1
555341 178.832939 225.106.194.46 -> 41.177.26.176 TCP 70 34497 > http [ACK] Seq=1206 Ack=4381 Win=65535 Len=0 SLE=7301 SRE=8001
555345 178.837045 225.106.194.46 -> 41.177.26.176 TCP 64 34497 > http [ACK] Seq=1206 Ack=8001 Win=65535 Len=0
555376 178.854885 225.106.194.46 -> 41.177.26.176 TCP 64 33477 > http [ACK] Seq=1 Ack=1 Win=65535 Len=0
555544 178.894110 225.106.194.46 -> 41.177.26.176 TCP 64 34497 > http [ACK] Seq=1206 Ack=10921 Win=65535 Len=0
555549 178.896187 225.106.194.46 -> 41.177.26.176 TCP 70 34497 > http [ACK] Seq=1206 Ack=12381 Win=65535 Len=0 SLE=15301 SRE=16001
555574 178.900258 225.106.194.46 -> 41.177.26.176 TCP 64 34497 > http [ACK] Seq=1206 Ack=16001 Win=65535 Len=0
555786 178.954759 225.106.194.46 -> 41.177.26.176 TCP 64 34497 > http [ACK] Seq=1206 Ack=18921 Win=65535 Len=0
556567 179.210788 225.106.194.46 -> 41.177.26.176 TCP 64 33477 > http [ACK] Seq=4128 Ack=1474 Win=65535 Len=0
556699 179.268461 225.106.194.46 -> 41.177.26.176 TCP 64 34497 > http [ACK] Seq=4497 Ack=21038 Win=65535 Len=0
556961 179.347591 225.106.194.46 -> 41.177.26.176 TCP 64 33477 > http [ACK] Seq=5735 Ack=2596 Win=64413 Len=0
557486 179.405608 225.106.194.46 -> 41.177.26.176 TCP 64 34497 > http [ACK] Seq=6101 Ack=22966 Win=65535 Len=0
557523 179.409375 225.106.194.46 -> 41.177.26.176 TCP 64 34497 > http [ACK] Seq=6101 Ack=25886 Win=65535 Len=0
557526 179.410509 225.106.194.46 -> 41.177.26.176 TCP 70 [TCP Dup ACK 557523#1] 34497 > http [ACK] Seq=6101 Ack=25886 Win=65535 Len=0 SLE=27346 SRE=28383
557539 179.412424 225.106.194.46 -> 41.177.26.176 TCP 64 34497 > http [ACK] Seq=6101 Ack=28383 Win=65535 Len=0
606672 192.409831 225.106.194.46 -> 41.177.26.176 TCP 64 33477 > http [ACK] Seq=6725 Ack=5516 Win=65535 Len=0
606681 192.411862 225.106.194.46 -> 41.177.26.176 TCP 70 [TCP Dup ACK 606672#1] 33477 > http [ACK] Seq=6725 Ack=5516 Win=65535 Len=0 SLE=8436 SRE=9896
606682 192.413336 225.106.194.46 -> 41.177.26.176 TCP 70 [TCP Dup ACK 606672#2] 33477 > http [ACK] Seq=6725 Ack=5516 Win=65535 Len=0 SLE=6976 SRE=9896
606684 192.414217 225.106.194.46 -> 41.177.26.176 TCP 70 [TCP Dup ACK 606672#3] 33477 > http [ACK] Seq=6725 Ack=5516 Win=65535 Len=0 SLE=6976 SRE=10596
606686 192.416237 225.106.194.46 -> 41.177.26.176 TCP 64 33477 > http [ACK] Seq=6725 Ack=10596 Win=65535 Len=0
606692 192.419999 225.106.194.46 -> 41.177.26.176 TCP 70 33477 > http [ACK] Seq=6725 Ack=12056 Win=65535 Len=0 SLE=14976 SRE=16436
606694 192.421915 225.106.194.46 -> 41.177.26.176 TCP 70 [TCP Dup ACK 606692#1] 33477 > http [ACK] Seq=6725 Ack=12056 Win=65535 Len=0 SLE=13516 SRE=16436
606695 192.424415 225.106.194.46 -> 41.177.26.176 TCP 64 33477 > http [ACK] Seq=6725 Ack=16436 Win=65535 Len=0
606779 192.467217 225.106.194.46 -> 41.177.26.176 TCP 70 [TCP Dup ACK 606695#1] 33477 > http [ACK] Seq=6725 Ack=16436 Win=65535 Len=0 SLE=17896 SRE=18596
606788 192.469499 225.106.194.46 -> 41.177.26.176 TCP 64 33477 > http [ACK] Seq=6725 Ack=18596 Win=65535 Len=0
606844 192.473087 225.106.194.46 -> 41.177.26.176 TCP 64 33477 > http [ACK] Seq=6725 Ack=21516 Win=65535 Len=0
606853 192.474545 225.106.194.46 -> 41.177.26.176 TCP 64 [TCP Dup ACK 606844#1] 33477 > http [ACK] Seq=6725 Ack=21516 Win=65535 Len=0
606965 192.525468 225.106.194.46 -> 41.177.26.176 TCP 64 33477 > http [ACK] Seq=6725 Ack=24436 Win=65535 Len=0
606967 192.532654 225.106.194.46 -> 41.177.26.176 TCP 70 33477 > http [ACK] Seq=6725 Ack=26596 Win=65535 Len=0 SLE=28056 SRE=28777
606968 192.533392 225.106.194.46 -> 41.177.26.176 TCP 64 33477 > http [ACK] Seq=6725 Ack=28777 Win=65535 Len=0
608068 193.073880 225.106.194.46 -> 41.177.26.176 TCP 64 33477 > http [ACK] Seq=10341 Ack=29501 Win=64811 Len=0
608069 193.074948 225.106.194.46 -> 41.177.26.176 TCP 64 34497 > http [ACK] Seq=10588 Ack=29286 Win=64632 Len=0
614852 195.111326 225.106.194.46 -> 41.177.26.176 TCP 64 34497 > http [ACK] Seq=11849 Ack=32206 Win=65535 Len=0
614864 195.113988 225.106.194.46 -> 41.177.26.176 TCP 70 34497 > http [ACK] Seq=11849 Ack=33666 Win=65535 Len=0 SLE=36586 SRE=37286
614894 195.117735 225.106.194.46 -> 41.177.26.176 TCP 64 34497 > http [ACK] Seq=11849 Ack=37286 Win=65535 Len=0
614899 195.121986 225.106.194.46 -> 41.177.26.176 TCP 70 34497 > http [ACK] Seq=11849 Ack=40206 Win=65535 Len=0 SLE=44586 SRE=45286
614903 195.123998 225.106.194.46 -> 41.177.26.176 TCP 78 [TCP Dup ACK 614899#1] 34497 > http [ACK] Seq=11849 Ack=40206 Win=65535 Len=0 SLE=41666 SRE=43126 SLE=44586 SRE=45286
614906 195.125368 225.106.194.46 -> 41.177.26.176 TCP 64 34497 > http [ACK] Seq=11849 Ack=43126 Win=65535 Len=0
614914 195.127231 225.106.194.46 -> 41.177.26.176 TCP 64 34497 > http [ACK] Seq=11849 Ack=45286 Win=65535 Len=0
614923 195.130890 225.106.194.46 -> 41.177.26.176 TCP 64 34497 > http [ACK] Seq=11849 Ack=48206 Win=65535 Len=0
614928 195.133008 225.106.194.46 -> 41.177.26.176 TCP 70 34497 > http [ACK] Seq=11849 Ack=49666 Win=65535 Len=0 SLE=52586 SRE=53286
614953 195.137257 225.106.194.46 -> 41.177.26.176 TCP 64 34497 > http [ACK] Seq=11849 Ack=53286 Win=65535 Len=0
615101 195.204174 225.106.194.46 -> 41.177.26.176 TCP 70 [TCP Dup ACK 614953#1] 34497 > http [ACK] Seq=11849 Ack=53286 Win=65535 Len=0 SLE=54746 SRE=55419
615102 195.205980 225.106.194.46 -> 41.177.26.176 TCP 64 34497 > http [ACK] Seq=11849 Ack=55419 Win=65535 Len=0
651083 204.266571 225.106.194.46 -> 41.177.26.176 TCP 64 33477 > http [ACK] Seq=11549 Ack=32421 Win=65535 Len=0
651109 204.269393 225.106.194.46 -> 41.177.26.176 TCP 64 33477 > http [ACK] Seq=11549 Ack=35341 Win=65535 Len=0
651114 204.270641 225.106.194.46 -> 41.177.26.176 TCP 70 [TCP Dup ACK 651109#1] 33477 > http [ACK] Seq=11549 Ack=35341 Win=65535 Len=0 SLE=36801 SRE=37501
651118 204.272570 225.106.194.46 -> 41.177.26.176 TCP 64 33477 > http [ACK] Seq=11549 Ack=37501 Win=65535 Len=0
651327 204.325096 225.106.194.46 -> 41.177.26.176 TCP 64 33477 > http [ACK] Seq=11549 Ack=40421 Win=65535 Len=0
651350 204.328620 225.106.194.46 -> 41.177.26.176 TCP 64 33477 > http [ACK] Seq=11549 Ack=43341 Win=65535 Len=0
651354 204.330728 225.106.194.46 -> 41.177.26.176 TCP 64 33477 > http [ACK] Seq=11549 Ack=45501 Win=65535 Len=0
651880 204.383784 225.106.194.46 -> 41.177.26.176 TCP 64 33477 > http [ACK] Seq=11549 Ack=48421 Win=65535 Len=0
653372 204.667686 225.106.194.46 -> 41.177.26.176 TCP 64 33477 > http [ACK] Seq=11549 Ack=49821 Win=64135 Len=0
673700 210.212773 225.106.194.46 -> 41.177.26.176 TCP 64 34497 > http [ACK] Seq=11849 Ack=55420 Win=65535 Len=0
683516 214.387001 225.106.194.46 -> 41.177.26.176 TCP 64 34497 > http [RST, ACK] Seq=11849 Ack=55420 Win=0 Len=0
693722 219.271809 225.106.194.46 -> 41.177.26.176 TCP 64 33477 > http [ACK] Seq=11549 Ack=49822 Win=64135 Len=0
693864 219.386954 225.106.194.46 -> 41.177.26.176 TCP 64 33477 > http [RST, ACK] Seq=11549 Ack=49822 Win=0 Len=0
711698 227.055409 225.106.194.46 -> 41.177.26.176 TCP 66 33529 > http [SYN] Seq=0 Win=65535 Len=0 MSS=1460 SACK_PERM=1
711795 227.111859 225.106.194.46 -> 41.177.26.176 TCP 64 33529 > http [ACK] Seq=1 Ack=1 Win=65535 Len=0
712162 227.215557 225.106.194.46 -> 41.177.26.176 TCP 64 33529 > http [ACK] Seq=1228 Ack=2921 Win=65535 Len=0
712305 227.274559 225.106.194.46 -> 41.177.26.176 TCP 64 33529 > http [ACK] Seq=1228 Ack=5841 Win=65535 Len=0
712311 227.277232 225.106.194.46 -> 41.177.26.176 TCP 64 33529 > http [ACK] Seq=1228 Ack=8001 Win=65535 Len=0
712664 227.334495 225.106.194.46 -> 41.177.26.176 TCP 64 33529 > http [ACK] Seq=1228 Ack=10921 Win=65535 Len=0
712678 227.339366 225.106.194.46 -> 41.177.26.176 TCP 70 33529 > http [ACK] Seq=1228 Ack=13841 Win=65535 Len=0 SLE=15301 SRE=16001
712688 227.341290 225.106.194.46 -> 41.177.26.176 TCP 64 33529 > http [ACK] Seq=1228 Ack=16001 Win=65535 Len=0
712853 227.395002 225.106.194.46 -> 41.177.26.176 TCP 64 33529 > http [ACK] Seq=1228 Ack=18921 Win=65535 Len=0
712854 227.398151 225.106.194.46 -> 41.177.26.176 TCP 64 33529 > http [ACK] Seq=1228 Ack=21841 Win=65535 Len=0
712864 227.402522 225.106.194.46 -> 41.177.26.176 TCP 64 33529 > http [ACK] Seq=1228 Ack=24001 Win=65535 Len=0
712865 227.402977 225.106.194.46 -> 41.177.26.176 TCP 64 33529 > http [ACK] Seq=1228 Ack=26134 Win=65535 Len=0
740604 236.493780 225.106.194.46 -> 41.177.26.176 TCP 70 33529 > http [ACK] Seq=2070 Ack=28543 Win=65535 Len=0 SLE=31205 SRE=31362
740636 236.498081 225.106.194.46 -> 41.177.26.176 TCP 64 33529 > http [ACK] Seq=2070 Ack=31581 Win=65535 Len=0
740642 236.498707 225.106.194.46 -> 41.177.26.176 TCP 64 33529 > http [ACK] Seq=2070 Ack=31776 Win=65340 Len=0
740667 236.511090 225.106.194.46 -> 41.177.26.176 TCP 66 33513 > http [SYN] Seq=0 Win=65535 Len=0 MSS=1460 SACK_PERM=1
740758 236.552525 225.106.194.46 -> 41.177.26.176 TCP 64 33529 > http [ACK] Seq=2070 Ack=33159 Win=65535 Len=0
740763 236.557252 225.106.194.46 -> 41.177.26.176 TCP 64 33529 > http [ACK] Seq=2070 Ack=35996 Win=65535 Len=0
740766 236.560733 225.106.194.46 -> 41.177.26.176 TCP 64 33529 > http [ACK] Seq=2070 Ack=38826 Win=65535 Len=0
740782 236.569328 225.106.194.46 -> 41.177.26.176 TCP 64 33513 > http [ACK] Seq=1 Ack=1 Win=65535 Len=0
741240 236.824160 225.106.194.46 -> 41.177.26.176 TCP 64 33513 > http [ACK] Seq=1460 Ack=362 Win=65174 Len=0
741241 236.824817 225.106.194.46 -> 41.177.26.176 TCP 64 33529 > http [ACK] Seq=4274 Ack=39366 Win=64995 Len=0
759627 244.908503 225.106.194.46 -> 41.177.26.176 TCP 64 33513 > http [ACK] Seq=2424 Ack=1876 Win=65535 Len=0
759632 244.918565 225.106.194.46 -> 41.177.26.176 TCP 64 33513 > http [ACK] Seq=2424 Ack=3144 Win=64267 Len=0
759636 244.921017 225.106.194.46 -> 41.177.26.176 TCP 64 33513 > http [ACK] Seq=2424 Ack=4257 Win=65535 Len=0
759637 244.921991 225.106.194.46 -> 41.177.26.176 TCP 70 [TCP Dup ACK 759636#1] 33513 > http [ACK] Seq=2424 Ack=4257 Win=65535 Len=0 SLE=5717 SRE=6170
759654 244.931376 225.106.194.46 -> 41.177.26.176 TCP 64 33513 > http [ACK] Seq=2424 Ack=6186 Win=65535 Len=0
759719 244.967337 225.106.194.46 -> 41.177.26.15 TCP 66 33457 > http [SYN] Seq=0 Win=65535 Len=0 MSS=1460 SACK_PERM=1
759734 244.968242 225.106.194.46 -> 41.177.26.176 TCP 64 33513 > http [ACK] Seq=2424 Ack=8285 Win=65535 Len=0
759742 244.976442 225.106.194.46 -> 41.177.26.176 TCP 70 [TCP Dup ACK 759734#1] 33513 > http [ACK] Seq=2424 Ack=8285 Win=65535 Len=0 SLE=9745 SRE=10570
759745 244.978288 225.106.194.46 -> 41.177.26.176 TCP 64 33513 > http [ACK] Seq=2424 Ack=10570 Win=65535 Len=0
759809 245.023399 225.106.194.46 -> 41.177.26.15 TCP 64 33457 > http [ACK] Seq=1 Ack=1 Win=65535 Len=0
760028 245.108174 225.106.194.46 -> 41.177.26.15 TCP 64 33457 > http [ACK] Seq=488 Ack=1772 Win=65535 Len=0
760167 245.166748 225.106.194.46 -> 41.177.26.15 TCP 64 33457 > http [ACK] Seq=488 Ack=4692 Win=65535 Len=0
760189 245.170565 225.106.194.46 -> 41.177.26.15 TCP 64 33457 > http [ACK] Seq=488 Ack=7612 Win=65535 Len=0
760366 245.226619 225.106.194.46 -> 41.177.26.15 TCP 64 33457 > http [ACK] Seq=488 Ack=9964 Win=65535 Len=0
760376 245.230093 225.106.194.46 -> 41.177.26.15 TCP 64 33457 > http [ACK] Seq=488 Ack=12884 Win=65535 Len=0
760383 245.233209 225.106.194.46 -> 41.177.26.15 TCP 64 33457 > http [ACK] Seq=488 Ack=15804 Win=65535 Len=0
760466 245.286948 225.106.194.46 -> 41.177.26.15 TCP 64 33457 > http [ACK] Seq=488 Ack=18156 Win=65535 Len=0
760495 245.290215 225.106.194.46 -> 41.177.26.15 TCP 64 33457 > http [ACK] Seq=488 Ack=21076 Win=65535 Len=0
760511 245.293825 225.106.194.46 -> 41.177.26.15 TCP 64 33457 > http [ACK] Seq=488 Ack=23996 Win=65535 Len=0
760527 245.296434 225.106.194.46 -> 41.177.26.15 TCP 64 33457 > http [ACK] Seq=488 Ack=26348 Win=65535 Len=0
760646 245.346145 225.106.194.46 -> 41.177.26.15 TCP 64 33457 > http [ACK] Seq=488 Ack=29268 Win=65535 Len=0
760652 245.349483 225.106.194.46 -> 41.177.26.15 TCP 64 33457 > http [ACK] Seq=488 Ack=32188 Win=65535 Len=0
760659 245.352218 225.106.194.46 -> 41.177.26.15 TCP 64 33457 > http [ACK] Seq=488 Ack=34540 Win=65535 Len=0
760665 245.355435 225.106.194.46 -> 41.177.26.176 TCP 64 33513 > http [ACK] Seq=4789 Ack=11107 Win=64998 Len=0
760670 245.356396 225.106.194.46 -> 41.177.26.15 TCP 64 33457 > http [ACK] Seq=488 Ack=37460 Win=65535 Len=0
760678 245.359151 225.106.194.46 -> 41.177.26.15 TCP 64 33457 > http [ACK] Seq=488 Ack=40380 Win=65535 Len=0
760682 245.362156 225.106.194.46 -> 41.177.26.15 TCP 64 33457 > http [ACK] Seq=488 Ack=42732 Win=65535 Len=0
760818 245.404640 225.106.194.46 -> 41.177.26.15 TCP 64 33457 > http [ACK] Seq=488 Ack=45652 Win=65535 Len=0
760831 245.408766 225.106.194.46 -> 41.177.26.15 TCP 64 33457 > http [ACK] Seq=488 Ack=48572 Win=65535 Len=0
760838 245.411500 225.106.194.46 -> 41.177.26.15 TCP 64 33457 > http [ACK] Seq=488 Ack=50924 Win=65535 Len=0
760842 245.415330 225.106.194.46 -> 41.177.26.15 TCP 64 33457 > http [ACK] Seq=488 Ack=53844 Win=65535 Len=0
760850 245.418525 225.106.194.46 -> 41.177.26.15 TCP 64 33457 > http [ACK] Seq=488 Ack=56764 Win=65535 Len=0
760865 245.421860 225.106.194.46 -> 41.177.26.15 TCP 64 33457 > http [ACK] Seq=488 Ack=59116 Win=65535 Len=0
760870 245.424900 225.106.194.46 -> 41.177.26.15 TCP 64 33457 > http [ACK] Seq=488 Ack=62036 Win=65535 Len=0
760875 245.427643 225.106.194.46 -> 41.177.26.15 TCP 70 33457 > http [ACK] Seq=488 Ack=63496 Win=65535 Len=0 SLE=64956 SRE=65848
760884 245.429998 225.106.194.46 -> 41.177.26.15 TCP 64 33457 > http [ACK] Seq=488 Ack=65848 Win=65535 Len=0
760892 245.431335 225.106.194.46 -> 41.177.26.15 TCP 64 33457 > http [ACK] Seq=488 Ack=67308 Win=65535 Len=0
760898 245.435807 225.106.194.46 -> 41.177.26.15 TCP 64 33457 > http [ACK] Seq=488 Ack=70228 Win=65535 Len=0
760987 245.464526 225.106.194.46 -> 41.177.26.176 TCP 64 33529 > http [ACK] Seq=7407 Ack=40084 Win=64277 Len=0
760990 245.465740 225.106.194.46 -> 41.177.26.15 TCP 64 33457 > http [ACK] Seq=488 Ack=73148 Win=65535 Len=0
761001 245.467541 225.106.194.46 -> 41.177.26.15 TCP 70 33457 > http [ACK] Seq=488 Ack=74608 Win=65535 Len=0 SLE=76068 SRE=76960
761008 245.470282 225.106.194.46 -> 41.177.26.15 TCP 64 33457 > http [ACK] Seq=488 Ack=76960 Win=65535 Len=0
761012 245.471264 225.106.194.46 -> 41.177.26.15 TCP 64 33457 > http [ACK] Seq=488 Ack=78420 Win=65535 Len=0
761027 245.474910 225.106.194.46 -> 41.177.26.15 TCP 64 33457 > http [ACK] Seq=488 Ack=81340 Win=65535 Len=0
761044 245.477732 225.106.194.46 -> 41.177.26.15 TCP 70 33457 > http [ACK] Seq=488 Ack=82800 Win=65535 Len=0 SLE=84260 SRE=85152
761048 245.479741 225.106.194.46 -> 41.177.26.15 TCP 64 33457 > http [ACK] Seq=488 Ack=85152 Win=65535 Len=0
761056 245.482152 225.106.194.46 -> 41.177.26.15 TCP 64 33457 > http [ACK] Seq=488 Ack=86612 Win=65535 Len=0
761057 245.485342 225.106.194.46 -> 41.177.26.15 TCP 64 33457 > http [ACK] Seq=488 Ack=89532 Win=65535 Len=0
761062 245.487841 225.106.194.46 -> 41.177.26.15 TCP 70 33457 > http [ACK] Seq=488 Ack=90992 Win=65535 Len=0 SLE=92452 SRE=93344
761063 245.489568 225.106.194.46 -> 41.177.26.15 TCP 64 33457 > http [ACK] Seq=488 Ack=93344 Win=65535 Len=0
761070 245.491535 225.106.194.46 -> 41.177.26.15 TCP 64 33457 > http [ACK] Seq=488 Ack=94804 Win=65535 Len=0
761077 245.495758 225.106.194.46 -> 41.177.26.15 TCP 64 33457 > http [ACK] Seq=488 Ack=97724 Win=65535 Len=0
761081 245.497315 225.106.194.46 -> 41.177.26.15 TCP 70 33457 > http [ACK] Seq=488 Ack=99184 Win=65535 Len=0 SLE=100644 SRE=101536
761091 245.500225 225.106.194.46 -> 41.177.26.15 TCP 64 33457 > http [ACK] Seq=488 Ack=101536 Win=65535 Len=0
761096 245.502829 225.106.194.46 -> 41.177.26.15 TCP 64 33457 > http [ACK] Seq=488 Ack=102996 Win=65535 Len=0
761103 245.505339 225.106.194.46 -> 41.177.26.15 TCP 64 33457 > http [ACK] Seq=488 Ack=105916 Win=65535 Len=0
761115 245.508929 225.106.194.46 -> 41.177.26.15 TCP 64 33457 > http [ACK] Seq=488 Ack=108836 Win=65535 Len=0
761126 245.512178 225.106.194.46 -> 41.177.26.15 TCP 64 33457 > http [ACK] Seq=488 Ack=111188 Win=65535 Len=0
761164 245.524002 225.106.194.46 -> 41.177.26.15 TCP 64 33457 > http [ACK] Seq=488 Ack=114108 Win=65535 Len=0
761165 245.527650 225.106.194.46 -> 41.177.26.15 TCP 64 33457 > http [ACK] Seq=488 Ack=117028 Win=65535 Len=0
761174 245.530577 225.106.194.46 -> 41.177.26.15 TCP 64 33457 > http [ACK] Seq=488 Ack=119380 Win=65535 Len=0
761184 245.533523 225.106.194.46 -> 41.177.26.15 TCP 70 33457 > http [ACK] Seq=488 Ack=120840 Win=65535 Len=0 SLE=123760 SRE=124392
761187 245.536796 225.106.194.46 -> 41.177.26.15 TCP 64 33457 > http [ACK] Seq=488 Ack=124392 Win=65535 Len=0
794790 258.922181 225.106.194.46 -> 41.177.26.176 TCP 64 33513 > http [ACK] Seq=5777 Ack=13509 Win=65535 Len=0
794794 258.922829 225.106.194.46 -> 41.177.26.176 TCP 64 33513 > http [ACK] Seq=5777 Ack=13785 Win=65259 Len=0
794796 258.924389 225.106.194.46 -> 41.177.26.176 TCP 64 33513 > http [ACK] Seq=5777 Ack=14848 Win=64196 Len=0
794854 258.982543 225.106.194.46 -> 41.177.26.176 TCP 64 33513 > http [ACK] Seq=5777 Ack=17367 Win=65535 Len=0
794866 258.989754 225.106.194.46 -> 41.177.26.176 TCP 64 33513 > http [ACK] Seq=5777 Ack=20287 Win=65535 Len=0
795041 259.060364 225.106.194.46 -> 41.177.26.15 TCP 64 33457 > http [ACK] Seq=953 Ack=126162 Win=65535 Len=0
795063 259.064349 225.106.194.46 -> 41.177.26.15 TCP 64 33457 > http [ACK] Seq=953 Ack=129082 Win=65535 Len=0
795076 259.066628 225.106.194.46 -> 41.177.26.15 TCP 70 33457 > http [ACK] Seq=953 Ack=130542 Win=65535 Len=0 SLE=132002 SRE=132894
795094 259.068596 225.106.194.46 -> 41.177.26.15 TCP 64 33457 > http [ACK] Seq=953 Ack=132894 Win=65535 Len=0
795147 259.092395 225.106.194.46 -> 41.177.26.15 TCP 64 33457 > http [ACK] Seq=953 Ack=135814 Win=65535 Len=0
795156 259.095020 225.106.194.46 -> 41.177.26.15 TCP 70 33457 > http [ACK] Seq=953 Ack=137274 Win=65535 Len=0 SLE=140194 SRE=141086
795168 259.099444 225.106.194.46 -> 41.177.26.15 TCP 64 33457 > http [ACK] Seq=953 Ack=141086 Win=65535 Len=0
795179 259.103025 225.106.194.46 -> 41.177.26.15 TCP 64 33457 > http [ACK] Seq=953 Ack=144006 Win=65535 Len=0
795200 259.106505 225.106.194.46 -> 41.177.26.15 TCP 64 33457 > http [ACK] Seq=953 Ack=146926 Win=65535 Len=0
795205 259.107712 225.106.194.46 -> 41.177.26.15 TCP 70 [TCP Dup ACK 795200#1] 33457 > http [ACK] Seq=953 Ack=146926 Win=65535 Len=0 SLE=148386 SRE=149278
795206 259.109328 225.106.194.46 -> 41.177.26.15 TCP 64 33457 > http [ACK] Seq=953 Ack=149278 Win=65535 Len=0
795211 259.113203 225.106.194.46 -> 41.177.26.15 TCP 64 33457 > http [ACK] Seq=953 Ack=152198 Win=65535 Len=0
795221 259.118081 225.106.194.46 -> 41.177.26.15 TCP 64 33457 > http [ACK] Seq=953 Ack=155118 Win=65535 Len=0
795229 259.120082 225.106.194.46 -> 41.177.26.15 TCP 64 33457 > http [ACK] Seq=953 Ack=157470 Win=65535 Len=0
795242 259.124264 225.106.194.46 -> 41.177.26.15 TCP 64 33457 > http [ACK] Seq=953 Ack=160390 Win=65535 Len=0
795245 259.128055 225.106.194.46 -> 41.177.26.15 TCP 64 33457 > http [ACK] Seq=953 Ack=163310 Win=65535 Len=0
795248 259.129032 225.106.194.46 -> 41.177.26.15 TCP 70 [TCP Dup ACK 795245#1] 33457 > http [ACK] Seq=953 Ack=163310 Win=65535 Len=0 SLE=164770 SRE=165662
795250 259.130384 225.106.194.46 -> 41.177.26.15 TCP 64 33457 > http [ACK] Seq=953 Ack=165662 Win=65535 Len=0
795255 259.134422 225.106.194.46 -> 41.177.26.15 TCP 64 33457 > http [ACK] Seq=953 Ack=168582 Win=65535 Len=0
795270 259.136128 225.106.194.46 -> 41.177.26.176 TCP 64 33513 > http [ACK] Seq=5777 Ack=21112 Win=64710 Len=0
795273 259.137313 225.106.194.46 -> 41.177.26.15 TCP 70 33457 > http [ACK] Seq=953 Ack=170042 Win=65535 Len=0 SLE=172962 SRE=173854
795287 259.140679 225.106.194.46 -> 41.177.26.15 TCP 64 33457 > http [ACK] Seq=953 Ack=173854 Win=65535 Len=0
795300 259.144015 225.106.194.46 -> 41.177.26.15 TCP 64 33457 > http [ACK] Seq=953 Ack=176774 Win=65535 Len=0
795308 259.148028 225.106.194.46 -> 41.177.26.15 TCP 64 33457 > http [ACK] Seq=953 Ack=179694 Win=65535 Len=0
795313 259.148698 225.106.194.46 -> 41.177.26.15 TCP 70 [TCP Dup ACK 795308#1] 33457 > http [ACK] Seq=953 Ack=179694 Win=65535 Len=0 SLE=181154 SRE=182046
795321 259.150839 225.106.194.46 -> 41.177.26.15 TCP 64 33457 > http [ACK] Seq=953 Ack=182046 Win=65535 Len=0
795327 259.154542 225.106.194.46 -> 41.177.26.15 TCP 64 33457 > http [ACK] Seq=953 Ack=184966 Win=65535 Len=0
795332 259.157630 225.106.194.46 -> 41.177.26.15 TCP 64 33457 > http [ACK] Seq=953 Ack=187886 Win=65535 Len=0
795336 259.162180 225.106.194.46 -> 41.177.26.15 TCP 64 33457 > http [ACK] Seq=953 Ack=190238 Win=65535 Len=0
795344 259.164781 225.106.194.46 -> 41.177.26.15 TCP 64 33457 > http [ACK] Seq=953 Ack=193158 Win=65535 Len=0
795359 259.168778 225.106.194.46 -> 41.177.26.15 TCP 64 33457 > http [ACK] Seq=953 Ack=196078 Win=65535 Len=0
795363 259.171165 225.106.194.46 -> 41.177.26.15 TCP 64 33457 > http [ACK] Seq=953 Ack=198430 Win=65535 Len=0
795372 259.174877 225.106.194.46 -> 41.177.26.15 TCP 64 33457 > http [ACK] Seq=953 Ack=201350 Win=65535 Len=0
795389 259.180195 225.106.194.46 -> 41.177.26.15 TCP 64 33457 > http [ACK] Seq=953 Ack=204270 Win=65535 Len=0
795412 259.182721 225.106.194.46 -> 41.177.26.15 TCP 64 33457 > http [ACK] Seq=953 Ack=206622 Win=65535 Len=0
795426 259.186760 225.106.194.46 -> 41.177.26.15 TCP 64 33457 > http [ACK] Seq=953 Ack=209542 Win=65535 Len=0
795434 259.190285 225.106.194.46 -> 41.177.26.15 TCP 64 33457 > http [ACK] Seq=953 Ack=212462 Win=65535 Len=0
795440 259.193271 225.106.194.46 -> 41.177.26.15 TCP 64 33457 > http [ACK] Seq=953 Ack=214814 Win=65535 Len=0
795454 259.196801 225.106.194.46 -> 41.177.26.15 TCP 64 33457 > http [ACK] Seq=953 Ack=217734 Win=65535 Len=0
795460 259.200616 225.106.194.46 -> 41.177.26.15 TCP 64 33457 > http [ACK] Seq=953 Ack=220654 Win=65535 Len=0
795461 259.204107 225.106.194.46 -> 41.177.26.15 TCP 64 33457 > http [ACK] Seq=953 Ack=223006 Win=65535 Len=0
795482 259.208015 225.106.194.46 -> 41.177.26.15 TCP 64 33457 > http [ACK] Seq=953 Ack=225926 Win=65535 Len=0
795492 259.213204 225.106.194.46 -> 41.177.26.15 TCP 64 33457 > http [ACK] Seq=953 Ack=228846 Win=65535 Len=0
795501 259.215896 225.106.194.46 -> 41.177.26.15 TCP 64 33457 > http [ACK] Seq=953 Ack=231198 Win=65535 Len=0
795509 259.219878 225.106.194.46 -> 41.177.26.15 TCP 64 33457 > http [ACK] Seq=953 Ack=234118 Win=65535 Len=0
795519 259.223671 225.106.194.46 -> 41.177.26.15 TCP 64 33457 > http [ACK] Seq=953 Ack=237038 Win=65535 Len=0
795531 259.226281 225.106.194.46 -> 41.177.26.15 TCP 64 33457 > http [ACK] Seq=953 Ack=239390 Win=65535 Len=0
795535 259.230317 225.106.194.46 -> 41.177.26.15 TCP 64 33457 > http [ACK] Seq=953 Ack=242310 Win=65535 Len=0
795536 259.234484 225.106.194.46 -> 41.177.26.15 TCP 64 33457 > http [ACK] Seq=953 Ack=245230 Win=65535 Len=0
795537 259.237115 225.106.194.46 -> 41.177.26.15 TCP 64 33457 > http [ACK] Seq=953 Ack=247582 Win=65535 Len=0
795540 259.240805 225.106.194.46 -> 41.177.26.15 TCP 64 33457 > http [ACK] Seq=953 Ack=250502 Win=65535 Len=0
795545 259.244629 225.106.194.46 -> 41.177.26.15 TCP 64 33457 > http [ACK] Seq=953 Ack=253422 Win=65535 Len=0
795551 259.247127 225.106.194.46 -> 41.177.26.15 TCP 64 33457 > http [ACK] Seq=953 Ack=255774 Win=65535 Len=0
795557 259.254922 225.106.194.46 -> 41.177.26.15 TCP 64 33457 > http [ACK] Seq=953 Ack=258694 Win=65535 Len=0
795565 259.258439 225.106.194.46 -> 41.177.26.15 TCP 64 33457 > http [ACK] Seq=953 Ack=261614 Win=65535 Len=0
795576 259.261423 225.106.194.46 -> 41.177.26.15 TCP 64 33457 > http [ACK] Seq=953 Ack=264042 Win=65535 Len=0
797650 260.191695 225.106.194.46 -> 41.177.26.176 TCP 64 33529 > http [ACK] Seq=7407 Ack=40085 Win=64277 Len=0
810467 264.246105 225.106.194.46 -> 41.177.26.176 TCP 64 33529 > http [RST, ACK] Seq=7407 Ack=40085 Win=0 Len=0
825031 269.324211 225.106.194.46 -> 41.177.26.176 TCP 70 [TCP Dup ACK 820536#1] 33513 > http [ACK] Seq=6743 Ack=21112 Win=64710 Len=0 SLE=22572 SRE=22577
825038 269.324918 225.106.194.46 -> 41.177.26.176 TCP 64 33513 > http [ACK] Seq=6743 Ack=22577 Win=65535 Len=0
825047 269.325918 225.106.194.46 -> 41.177.26.176 TCP 64 33513 > http [ACK] Seq=6743 Ack=23798 Win=64314 Len=0
825067 269.326826 225.106.194.46 -> 41.177.26.176 TCP 64 33513 > http [ACK] Seq=6743 Ack=24861 Win=65535 Len=0
825070 269.327846 225.106.194.46 -> 41.177.26.176 TCP 70 [TCP Dup ACK 825067#1] 33513 > http [ACK] Seq=6743 Ack=24861 Win=65535 Len=0 SLE=26321 SRE=26774
825074 269.328799 225.106.194.46 -> 41.177.26.176 TCP 64 33513 > http [ACK] Seq=6743 Ack=26868 Win=65535 Len=0
825307 269.389158 225.106.194.46 -> 41.177.26.176 TCP 64 33513 > http [ACK] Seq=6743 Ack=28831 Win=65535 Len=0
825318 269.390439 225.106.194.46 -> 41.177.26.176 TCP 64 33513 > http [ACK] Seq=6743 Ack=31116 Win=65535 Len=0
825845 269.513780 225.106.194.46 -> 41.177.26.15 TCP 64 33457 > http [ACK] Seq=1418 Ack=265810 Win=65535 Len=0
825846 269.515148 225.106.194.46 -> 41.177.26.15 TCP 64 33457 > http [ACK] Seq=1418 Ack=268730 Win=65535 Len=0
825847 269.516009 225.106.194.46 -> 41.177.26.15 TCP 70 [TCP Dup ACK 825846#1] 33457 > http [ACK] Seq=1418 Ack=268730 Win=65535 Len=0 SLE=271650 SRE=272542
825850 269.516806 225.106.194.46 -> 41.177.26.15 TCP 64 33457 > http [ACK] Seq=1418 Ack=272542 Win=65535 Len=0
825856 269.517706 225.106.194.46 -> 41.177.26.15 TCP 64 33457 > http [ACK] Seq=1418 Ack=275462 Win=65535 Len=0
825857 269.519063 225.106.194.46 -> 41.177.26.15 TCP 64 33457 > http [ACK] Seq=1418 Ack=278382 Win=65535 Len=0
825858 269.519810 225.106.194.46 -> 41.177.26.15 TCP 64 33457 > http [ACK] Seq=1418 Ack=280734 Win=65535 Len=0
825862 269.520916 225.106.194.46 -> 41.177.26.15 TCP 64 33457 > http [ACK] Seq=1418 Ack=283654 Win=65535 Len=0
825865 269.521859 225.106.194.46 -> 41.177.26.15 TCP 64 33457 > http [ACK] Seq=1418 Ack=286574 Win=65535 Len=0
825869 269.522778 225.106.194.46 -> 41.177.26.15 TCP 64 33457 > http [ACK] Seq=1418 Ack=288926 Win=65535 Len=0
825870 269.523676 225.106.194.46 -> 41.177.26.15 TCP 64 33457 > http [ACK] Seq=1418 Ack=291846 Win=65535 Len=0
825874 269.524649 225.106.194.46 -> 41.177.26.15 TCP 70 33457 > http [ACK] Seq=1418 Ack=293306 Win=65535 Len=0 SLE=296226 SRE=297118
825875 269.525909 225.106.194.46 -> 41.177.26.15 TCP 70 [TCP Dup ACK 825874#1] 33457 > http [ACK] Seq=1418 Ack=293306 Win=65535 Len=0 SLE=294766 SRE=297118
825877 269.526622 225.106.194.46 -> 41.177.26.15 TCP 64 33457 > http [ACK] Seq=1418 Ack=297118 Win=65535 Len=0
825880 269.527840 225.106.194.46 -> 41.177.26.15 TCP 64 33457 > http [ACK] Seq=1418 Ack=300038 Win=65535 Len=0
825883 269.528949 225.106.194.46 -> 41.177.26.15 TCP 70 33457 > http [ACK] Seq=1418 Ack=301498 Win=65535 Len=0 SLE=304418 SRE=305310
825887 269.529971 225.106.194.46 -> 41.177.26.15 TCP 64 33457 > http [ACK] Seq=1418 Ack=305310 Win=65535 Len=0
825894 269.530973 225.106.194.46 -> 41.177.26.15 TCP 64 33457 > http [ACK] Seq=1418 Ack=308230 Win=65535 Len=0
825905 269.531653 225.106.194.46 -> 41.177.26.15 TCP 64 33457 > http [ACK] Seq=1418 Ack=311150 Win=65535 Len=0
825908 269.532476 225.106.194.46 -> 41.177.26.15 TCP 70 [TCP Dup ACK 825905#1] 33457 > http [ACK] Seq=1418 Ack=311150 Win=65535 Len=0 SLE=312610 SRE=313502
825909 269.533333 225.106.194.46 -> 41.177.26.15 TCP 64 33457 > http [ACK] Seq=1418 Ack=313502 Win=65535 Len=0
825915 269.534344 225.106.194.46 -> 41.177.26.15 TCP 70 [TCP Dup ACK 825909#1] 33457 > http [ACK] Seq=1418 Ack=313502 Win=65535 Len=0 SLE=314962 SRE=315333
825920 269.535672 225.106.194.46 -> 41.177.26.15 TCP 64 33457 > http [ACK] Seq=1418 Ack=315333 Win=65535 Len=0
841388 276.101320 225.106.194.46 -> 41.177.26.176 TCP 64 33513 > http [ACK] Seq=8026 Ack=34036 Win=65535 Len=0
841393 276.103293 225.106.194.46 -> 41.177.26.176 TCP 66 33505 > http [SYN] Seq=0 Win=65535 Len=0 MSS=1460 SACK_PERM=1
841398 276.104258 225.106.194.46 -> 41.177.26.176 TCP 70 33513 > http [ACK] Seq=8026 Ack=35496 Win=65535 Len=0 SLE=38416 SRE=39116
841401 276.108047 225.106.194.46 -> 41.177.26.176 TCP 64 33513 > http [ACK] Seq=8026 Ack=39116 Win=65535 Len=0
841405 276.111962 225.106.194.46 -> 41.177.26.176 TCP 64 33513 > http [ACK] Seq=8026 Ack=42036 Win=65535 Len=0
841416 276.115076 225.106.194.46 -> 41.177.26.176 TCP 64 33513 > http [ACK] Seq=8026 Ack=44956 Win=65535 Len=0
841461 276.158629 225.106.194.46 -> 41.177.26.176 TCP 70 [TCP Dup ACK 841416#1] 33513 > http [ACK] Seq=8026 Ack=44956 Win=65535 Len=0 SLE=46416 SRE=47116
841465 276.160314 225.106.194.46 -> 41.177.26.176 TCP 64 33513 > http [ACK] Seq=8026 Ack=47116 Win=65535 Len=0
841482 276.164219 225.106.194.46 -> 41.177.26.176 TCP 64 33505 > http [ACK] Seq=1 Ack=1 Win=65535 Len=0
841485 276.165345 225.106.194.46 -> 41.177.26.176 TCP 64 33513 > http [ACK] Seq=8026 Ack=50036 Win=65535 Len=0
841512 276.176219 225.106.194.46 -> 41.177.26.176 TCP 64 33513 > http [ACK] Seq=8026 Ack=52956 Win=65535 Len=0
841514 276.177580 225.106.194.46 -> 41.177.26.176 TCP 70 [TCP Dup ACK 841512#1] 33513 > http [ACK] Seq=8026 Ack=52956 Win=65535 Len=0 SLE=54416 SRE=55116
841518 276.178398 225.106.194.46 -> 41.177.26.176 TCP 64 33513 > http [ACK] Seq=8026 Ack=55116 Win=65535 Len=0
841537 276.193791 225.106.194.46 -> 41.177.26.176 TCP 70 [TCP Dup ACK 841518#1] 33513 > http [ACK] Seq=8026 Ack=55116 Win=65535 Len=0 SLE=56576 SRE=57399
841538 276.195985 225.106.194.46 -> 41.177.26.176 TCP 64 33513 > http [ACK] Seq=8026 Ack=57399 Win=65535 Len=0
843119 277.074121 225.106.194.46 -> 41.177.26.176 TCP 64 33513 > http [ACK] Seq=16159 Ack=59027 Win=65535 Len=0
843125 277.075121 225.106.194.46 -> 41.177.26.176 TCP 64 33505 > http [ACK] Seq=9009 Ack=1808 Win=65353 Len=0
862211 284.462997 225.106.194.46 -> 41.177.26.15 TCP 64 33457 > http [ACK] Seq=1418 Ack=315334 Win=65535 Len=0
867835 286.902719 225.106.194.46 -> 41.177.26.15 TCP 64 33457 > http [RST, ACK] Seq=1418 Ack=315334 Win=0 Len=0
878619 291.862227 225.106.194.46 -> 41.177.26.176 TCP 64 33513 > http [ACK] Seq=16159 Ack=59028 Win=65535 Len=0
878689 291.901888 225.106.194.46 -> 41.177.26.176 TCP 64 33513 > http [RST, ACK] Seq=16159 Ack=59028 Win=0 Len=0
878700 291.921898 225.106.194.46 -> 41.177.26.176 TCP 64 33505 > http [ACK] Seq=9009 Ack=1809 Win=65353 Len=0
897275 296.902790 225.106.194.46 -> 41.177.26.176 TCP 64 33505 > http [RST, ACK] Seq=9009 Ack=1809 Win=0 Len=0
