532090 172.554081 23.186.72.16 -> 244.3.210.197 TCP 78 6530 > http [SYN] Seq=0 Win=65535 Len=0 MSS=1460 WS=1 TSval=40339820 TSecr=0
532181 172.595261 23.186.72.16 -> 244.3.210.197 TCP 70 6530 > http [ACK] Seq=1 Ack=1 Win=65535 Len=0 TSval=40339820 TSecr=0
533992 173.125019 23.186.72.16 -> 244.3.210.197 TCP 70 6530 > http [ACK] Seq=762 Ack=2897 Win=62804 Len=0 TSval=40339821 TSecr=150405743
534014 173.125895 23.186.72.16 -> 244.3.210.197 TCP 78 6618 > http [SYN] Seq=0 Win=65535 Len=0 MSS=1460 WS=1 TSval=40339821 TSecr=0
534020 173.126568 23.186.72.16 -> 244.3.210.197 TCP 78 kftp-data > http [SYN] Seq=0 Win=65535 Len=0 MSS=1460 WS=1 TSval=40339821 TSecr=0
534024 173.126833 23.186.72.16 -> 244.3.210.197 TCP 78 6617 > http [SYN] Seq=0 Win=65535 Len=0 MSS=1460 WS=1 TSval=40339821 TSecr=0
534026 173.126995 23.186.72.16 -> 244.3.210.197 TCP 78 odette-ftps > http [SYN] Seq=0 Win=65535 Len=0 MSS=1460 WS=1 TSval=40339821 TSecr=0
534031 173.127807 23.186.72.16 -> 244.3.210.197 TCP 78 kftp > http [SYN] Seq=0 Win=65535 Len=0 MSS=1460 WS=1 TSval=40339821 TSecr=0
534175 173.166300 23.186.72.16 -> 244.3.210.197 TCP 70 6530 > http [ACK] Seq=762 Ack=4345 Win=65535 Len=0 TSval=40339821 TSecr=150405743
534183 173.166468 23.186.72.16 -> 244.3.210.197 TCP 70 6530 > http [ACK] Seq=762 Ack=7241 Win=62804 Len=0 TSval=40339821 TSecr=150405743
534192 173.166755 23.186.72.16 -> 244.3.210.197 TCP 70 6618 > http [ACK] Seq=1 Ack=1 Win=65535 Len=0 TSval=40339821 TSecr=0
534197 173.167068 23.186.72.16 -> 244.3.210.197 TCP 78 6631 > http [SYN] Seq=0 Win=65535 Len=0 MSS=1460 WS=1 TSval=40339821 TSecr=0
534211 173.167646 23.186.72.16 -> 244.3.210.197 TCP 70 kftp-data > http [ACK] Seq=1 Ack=1 Win=65535 Len=0 TSval=40339821 TSecr=0
534225 173.168831 23.186.72.16 -> 244.3.210.197 TCP 70 6617 > http [ACK] Seq=1 Ack=1 Win=65535 Len=0 TSval=40339821 TSecr=0
534226 173.168835 23.186.72.16 -> 244.3.210.197 TCP 70 odette-ftps > http [ACK] Seq=1 Ack=1 Win=65535 Len=0 TSval=40339821 TSecr=0
534251 173.169734 23.186.72.16 -> 244.3.210.197 TCP 70 kftp > http [ACK] Seq=1 Ack=1 Win=65535 Len=0 TSval=40339821 TSecr=0
534310 173.207550 23.186.72.16 -> 244.3.210.197 TCP 70 6530 > http [ACK] Seq=762 Ack=10137 Win=62804 Len=0 TSval=40339821 TSecr=150405743
534313 173.207680 23.186.72.16 -> 244.3.210.197 TCP 70 6530 > http [ACK] Seq=762 Ack=13033 Win=62804 Len=0 TSval=40339821 TSecr=150405743
534324 173.207838 23.186.72.16 -> 244.3.210.197 TCP 70 6530 > http [ACK] Seq=762 Ack=14481 Win=65535 Len=0 TSval=40339821 TSecr=150405743
534327 173.207957 23.186.72.16 -> 244.3.210.197 TCP 78 6634 > http [SYN] Seq=0 Win=65535 Len=0 MSS=1460 WS=1 TSval=40339821 TSecr=0
534334 173.208231 23.186.72.16 -> 244.3.210.197 TCP 70 6631 > http [ACK] Seq=1 Ack=1 Win=65535 Len=0 TSval=40339821 TSecr=0
534341 173.208413 23.186.72.16 -> 244.3.210.197 TCP 78 6636 > http [SYN] Seq=0 Win=65535 Len=0 MSS=1460 WS=1 TSval=40339821 TSecr=0
534358 173.209034 23.186.72.16 -> 244.3.210.197 TCP 78 6635 > http [SYN] Seq=0 Win=65535 Len=0 MSS=1460 WS=1 TSval=40339821 TSecr=0
534365 173.209776 23.186.72.16 -> 244.3.210.197 TCP 70 6618 > http [ACK] Seq=835 Ack=2897 Win=62804 Len=0 TSval=40339821 TSecr=150405743
534374 173.210150 23.186.72.16 -> 244.3.210.197 TCP 70 kftp-data > http [ACK] Seq=830 Ack=2897 Win=62804 Len=0 TSval=40339821 TSecr=150405743
534388 173.212585 23.186.72.16 -> 244.3.210.197 TCP 70 6617 > http [ACK] Seq=839 Ack=2669 Win=63032 Len=0 TSval=40339821 TSecr=150405743
534389 173.212590 23.186.72.16 -> 244.3.210.197 TCP 70 odette-ftps > http [ACK] Seq=831 Ack=2897 Win=62804 Len=0 TSval=40339821 TSecr=150405743
534403 173.213351 23.186.72.16 -> 244.3.210.197 TCP 70 kftp > http [ACK] Seq=829 Ack=2897 Win=62804 Len=0 TSval=40339821 TSecr=150405743
534676 173.248801 23.186.72.16 -> 244.3.210.197 TCP 70 6530 > http [ACK] Seq=762 Ack=17377 Win=62804 Len=0 TSval=40339821 TSecr=150405744
534677 173.248805 23.186.72.16 -> 244.3.210.197 TCP 70 6530 > http [ACK] Seq=762 Ack=19463 Win=60718 Len=0 TSval=40339821 TSecr=150405744
534678 173.248809 23.186.72.16 -> 244.3.210.197 TCP 70 [TCP Window Update] 6530 > http [ACK] Seq=762 Ack=19463 Win=65535 Len=0 TSval=40339821 TSecr=150405744
534705 173.249941 23.186.72.16 -> 244.3.210.197 TCP 70 6634 > http [ACK] Seq=1 Ack=1 Win=65535 Len=0 TSval=40339821 TSecr=0
534718 173.250546 23.186.72.16 -> 244.3.210.197 TCP 70 6636 > http [ACK] Seq=1 Ack=1 Win=65535 Len=0 TSval=40339821 TSecr=0
534731 173.250950 23.186.72.16 -> 244.3.210.197 TCP 70 6618 > http [ACK] Seq=835 Ack=5793 Win=62804 Len=0 TSval=40339821 TSecr=150405744
534732 173.250964 23.186.72.16 -> 244.3.210.197 TCP 70 6618 > http [ACK] Seq=835 Ack=7241 Win=65371 Len=0 TSval=40339821 TSecr=150405744
534741 173.251251 23.186.72.16 -> 244.3.210.197 TCP 70 kftp-data > http [ACK] Seq=830 Ack=5793 Win=62804 Len=0 TSval=40339821 TSecr=150405744
534749 173.251509 23.186.72.16 -> 244.3.210.197 TCP 70 kftp-data > http [ACK] Seq=830 Ack=7241 Win=65371 Len=0 TSval=40339821 TSecr=150405744
534758 173.251858 23.186.72.16 -> 244.3.210.197 TCP 70 6631 > http [ACK] Seq=859 Ack=2897 Win=62804 Len=0 TSval=40339821 TSecr=150405744
534772 173.252109 23.186.72.16 -> 244.3.210.197 TCP 70 6635 > http [ACK] Seq=1 Ack=1 Win=65535 Len=0 TSval=40339821 TSecr=0
534809 173.254657 23.186.72.16 -> 244.3.210.197 TCP 70 odette-ftps > http [ACK] Seq=831 Ack=5793 Win=62804 Len=0 TSval=40339821 TSecr=150405744
534810 173.254661 23.186.72.16 -> 244.3.210.197 TCP 70 odette-ftps > http [ACK] Seq=831 Ack=7241 Win=65371 Len=0 TSval=40339821 TSecr=150405744
534834 173.255427 23.186.72.16 -> 244.3.210.197 TCP 70 kftp > http [ACK] Seq=829 Ack=5793 Win=62804 Len=0 TSval=40339821 TSecr=150405744
534835 173.255432 23.186.72.16 -> 244.3.210.197 TCP 70 kftp > http [ACK] Seq=829 Ack=7241 Win=65371 Len=0 TSval=40339821 TSecr=150405744
534975 173.291966 23.186.72.16 -> 244.3.210.197 TCP 70 6618 > http [ACK] Seq=835 Ack=9753 Win=63188 Len=0 TSval=40339821 TSecr=150405744
534981 173.292248 23.186.72.16 -> 244.3.210.197 TCP 70 kftp-data > http [ACK] Seq=830 Ack=10137 Win=62804 Len=0 TSval=40339821 TSecr=150405744
534982 173.292253 23.186.72.16 -> 244.3.210.197 TCP 70 6530 > http [ACK] Seq=1627 Ack=21541 Win=63622 Len=0 TSval=40339821 TSecr=150405744
534994 173.292517 23.186.72.16 -> 244.3.210.197 TCP 70 kftp-data > http [ACK] Seq=830 Ack=10779 Win=65535 Len=0 TSval=40339821 TSecr=150405744
535006 173.292947 23.186.72.16 -> 244.3.210.197 TCP 70 6631 > http [ACK] Seq=859 Ack=5793 Win=62804 Len=0 TSval=40339821 TSecr=150405744
535007 173.292951 23.186.72.16 -> 244.3.210.197 TCP 70 6631 > http [ACK] Seq=859 Ack=7241 Win=65347 Len=0 TSval=40339821 TSecr=150405744
535030 173.294730 23.186.72.16 -> 244.3.210.197 TCP 70 6634 > http [ACK] Seq=868 Ack=2897 Win=62804 Len=0 TSval=40339821 TSecr=150405744
535042 173.296174 23.186.72.16 -> 244.3.210.197 TCP 70 6636 > http [ACK] Seq=866 Ack=2340 Win=63361 Len=0 TSval=40339821 TSecr=150405744
535045 173.296586 23.186.72.16 -> 244.3.210.197 TCP 70 odette-ftps > http [ACK] Seq=831 Ack=9186 Win=63755 Len=0 TSval=40339821 TSecr=150405744
535052 173.297255 23.186.72.16 -> 244.3.210.197 TCP 70 6617 > http [ACK] Seq=1687 Ack=5565 Win=62804 Len=0 TSval=40339821 TSecr=150405744
535053 173.297260 23.186.72.16 -> 244.3.210.197 TCP 70 6617 > http [ACK] Seq=1687 Ack=7013 Win=65535 Len=0 TSval=40339821 TSecr=150405744
535061 173.297546 23.186.72.16 -> 244.3.210.197 TCP 70 kftp > http [ACK] Seq=829 Ack=10137 Win=62804 Len=0 TSval=40339821 TSecr=150405744
535066 173.297644 23.186.72.16 -> 244.3.210.197 TCP 70 kftp > http [ACK] Seq=829 Ack=11333 Win=65535 Len=0 TSval=40339821 TSecr=150405744
535085 173.298751 23.186.72.16 -> 244.3.210.197 TCP 70 6635 > http [ACK] Seq=866 Ack=2093 Win=63608 Len=0 TSval=40339821 TSecr=150405744
535283 173.333937 23.186.72.16 -> 244.3.210.197 TCP 70 6631 > http [ACK] Seq=859 Ack=10137 Win=62804 Len=0 TSval=40339822 TSecr=150405744
535284 173.333942 23.186.72.16 -> 244.3.210.197 TCP 70 6631 > http [ACK] Seq=859 Ack=13033 Win=59908 Len=0 TSval=40339822 TSecr=150405744
535303 173.334241 23.186.72.16 -> 244.3.210.197 TCP 70 6631 > http [ACK] Seq=859 Ack=14481 Win=65535 Len=0 TSval=40339822 TSecr=150405744
535318 173.336708 23.186.72.16 -> 244.3.210.197 TCP 70 6634 > http [ACK] Seq=868 Ack=4803 Win=63794 Len=0 TSval=40339822 TSecr=150405746
535327 173.339775 23.186.72.16 -> 244.3.210.197 TCP 70 6617 > http [ACK] Seq=1687 Ack=9909 Win=62804 Len=0 TSval=40339822 TSecr=150405746
535328 173.339779 23.186.72.16 -> 244.3.210.197 TCP 70 6617 > http [ACK] Seq=1687 Ack=12805 Win=59908 Len=0 TSval=40339822 TSecr=150405746
535331 173.339881 23.186.72.16 -> 244.3.210.197 TCP 70 6617 > http [ACK] Seq=1687 Ack=14253 Win=65535 Len=0 TSval=40339822 TSecr=150405746
535454 173.374995 23.186.72.16 -> 244.3.210.197 TCP 70 6631 > http [ACK] Seq=859 Ack=17377 Win=62804 Len=0 TSval=40339822 TSecr=150405746
535455 173.375000 23.186.72.16 -> 244.3.210.197 TCP 70 6631 > http [ACK] Seq=859 Ack=20273 Win=59908 Len=0 TSval=40339822 TSecr=150405746
535458 173.375123 23.186.72.16 -> 244.3.210.197 TCP 70 6631 > http [ACK] Seq=859 Ack=23169 Win=57611 Len=0 TSval=40339822 TSecr=150405746
535466 173.375250 23.186.72.16 -> 244.3.210.197 TCP 70 6631 > http [ACK] Seq=859 Ack=26065 Win=54715 Len=0 TSval=40339822 TSecr=150405746
535468 173.375363 23.186.72.16 -> 244.3.210.197 TCP 70 6631 > http [ACK] Seq=859 Ack=26125 Win=62847 Len=0 TSval=40339822 TSecr=150405746
535501 173.382054 23.186.72.16 -> 244.3.210.197 TCP 70 6617 > http [ACK] Seq=1687 Ack=17149 Win=64252 Len=0 TSval=40339822 TSecr=150405746
535502 173.382059 23.186.72.16 -> 244.3.210.197 TCP 70 6617 > http [ACK] Seq=1687 Ack=20045 Win=61356 Len=0 TSval=40339822 TSecr=150405746
535503 173.382063 23.186.72.16 -> 244.3.210.197 TCP 70 6617 > http [ACK] Seq=1687 Ack=22941 Win=58460 Len=0 TSval=40339822 TSecr=150405746
535504 173.382067 23.186.72.16 -> 244.3.210.197 TCP 70 6617 > http [ACK] Seq=1687 Ack=25837 Win=55564 Len=0 TSval=40339822 TSecr=150405746
535507 173.382180 23.186.72.16 -> 244.3.210.197 TCP 70 [TCP Window Update] 6617 > http [ACK] Seq=1687 Ack=25837 Win=65535 Len=0 TSval=40339822 TSecr=150405746
535651 173.424254 23.186.72.16 -> 244.3.210.197 TCP 70 6617 > http [ACK] Seq=1687 Ack=27587 Win=63950 Len=0 TSval=40339822 TSecr=150405746
880217 292.819358 23.186.72.16 -> 244.3.210.197 TCP 64 [TCP Keep-Alive] 6636 > http [ACK] Seq=865 Ack=2340 Win=65535 Len=0
880221 292.819461 23.186.72.16 -> 244.3.210.197 TCP 64 [TCP Keep-Alive] kftp-data > http [ACK] Seq=829 Ack=10779 Win=65535 Len=0
880222 292.819466 23.186.72.16 -> 244.3.210.197 TCP 64 [TCP Keep-Alive] 6618 > http [ACK] Seq=834 Ack=9753 Win=65535 Len=0
880223 292.819470 23.186.72.16 -> 244.3.210.197 TCP 64 [TCP Keep-Alive] 6530 > http [ACK] Seq=1626 Ack=21541 Win=65535 Len=0
880253 292.820477 23.186.72.16 -> 244.3.210.197 TCP 64 [TCP Keep-Alive] 6635 > http [ACK] Seq=865 Ack=2093 Win=65535 Len=0
880254 292.820482 23.186.72.16 -> 244.3.210.197 TCP 64 [TCP Keep-Alive] kftp > http [ACK] Seq=828 Ack=11333 Win=65535 Len=0
880255 292.820486 23.186.72.16 -> 244.3.210.197 TCP 64 [TCP Keep-Alive] odette-ftps > http [ACK] Seq=830 Ack=9186 Win=65535 Len=0
882001 293.319644 23.186.72.16 -> 244.3.210.197 TCP 64 [TCP Keep-Alive] 6634 > http [ACK] Seq=867 Ack=4803 Win=65535 Len=0
882002 293.319649 23.186.72.16 -> 244.3.210.197 TCP 64 [TCP Keep-Alive] 6631 > http [ACK] Seq=858 Ack=26125 Win=65535 Len=0
882017 293.320705 23.186.72.16 -> 244.3.210.197 TCP 64 [TCP Keep-Alive] 6617 > http [ACK] Seq=1686 Ack=27587 Win=65535 Len=0
