166393  56.003570 241.3.142.157 -> 41.177.98.127 TCP 66 10250 > z39-50 [SYN] Seq=0 Win=64512 Len=0 MSS=1380 SACK_PERM=1
166801  56.055880 241.3.142.157 -> 41.177.98.127 TCP 64 10250 > z39-50 [ACK] Seq=1 Ack=1 Win=64512 Len=0
166802  56.055885 241.3.142.157 -> 41.177.98.127 TCP 149 10250 > z39-50 [PSH, ACK] Seq=1 Ack=1 Win=64512 Len=91
172523  57.461326 241.3.142.157 -> 41.177.98.127 TCP 155 10250 > z39-50 [PSH, ACK] Seq=92 Ack=71 Win=64442 Len=97
173005  57.544977 241.3.142.157 -> 41.177.98.127 TCP 66 10250 > z39-50 [PSH, ACK] Seq=189 Ack=94 Win=64419 Len=8
173192  57.594339 241.3.142.157 -> 41.177.98.127 TCP 64 10250 > z39-50 [ACK] Seq=197 Ack=95 Win=64419 Len=0
173200  57.599872 241.3.142.157 -> 41.177.98.127 TCP 64 10250 > z39-50 [FIN, ACK] Seq=197 Ack=95 Win=64419 Len=0
202323  69.827525 241.3.142.157 -> 41.177.98.127 TCP 66 12914 > z39-50 [SYN] Seq=0 Win=64512 Len=0 MSS=1380 SACK_PERM=1
202483  69.876469 241.3.142.157 -> 41.177.98.127 TCP 64 12914 > z39-50 [ACK] Seq=1 Ack=1 Win=64512 Len=0
202484  69.876474 241.3.142.157 -> 41.177.98.127 TCP 149 12914 > z39-50 [PSH, ACK] Seq=1 Ack=1 Win=64512 Len=91
207957  71.275063 241.3.142.157 -> 41.177.98.127 TCP 155 12914 > z39-50 [PSH, ACK] Seq=92 Ack=71 Win=64442 Len=97
208025  71.343835 241.3.142.157 -> 41.177.98.127 TCP 66 12914 > z39-50 [PSH, ACK] Seq=189 Ack=94 Win=64419 Len=8
208086  71.394153 241.3.142.157 -> 41.177.98.127 TCP 64 12914 > z39-50 [ACK] Seq=197 Ack=95 Win=64419 Len=0
208090  71.394654 241.3.142.157 -> 41.177.98.127 TCP 64 12914 > z39-50 [FIN, ACK] Seq=197 Ack=95 Win=64419 Len=0
