6260   1.965516 241.82.197.177 -> 41.177.98.176 TCP 82 62806 > http [SYN] Seq=0 Win=16384 Len=0 MSS=1380 SACK_PERM=1 WS=1 TSval=568597612 TSecr=0
6338   1.995528 241.82.197.177 -> 41.177.98.176 TCP 70 62806 > http [ACK] Seq=1 Ack=1 Win=16560 Len=0 TSval=568597615 TSecr=1540755
16087   4.395327 241.82.197.177 -> 41.177.98.176 TCP 70 62806 > http [ACK] Seq=946 Ack=4105 Win=12662 Len=0 TSval=568597855 TSecr=1540995
16088   4.395358 241.82.197.177 -> 41.177.98.176 TCP 70 [TCP Window Update] 62806 > http [ACK] Seq=946 Ack=4105 Win=16560 Len=0 TSval=568597855 TSecr=1540995
16123   4.426208 241.82.197.177 -> 41.177.98.176 TCP 70 62806 > http [ACK] Seq=946 Ack=8071 Win=16560 Len=0 TSval=568597858 TSecr=1540998
16199   4.456856 241.82.197.177 -> 41.177.98.176 TCP 70 62806 > http [ACK] Seq=946 Ack=13199 Win=16560 Len=0 TSval=568597861 TSecr=1540998
16421   4.487049 241.82.197.177 -> 41.177.98.176 TCP 70 62806 > http [ACK] Seq=946 Ack=16953 Win=15198 Len=0 TSval=568597864 TSecr=1541001
17440   5.086322 241.82.197.177 -> 41.177.98.176 TCP 70 62806 > http [ACK] Seq=1665 Ack=17122 Win=16391 Len=0 TSval=568597924 TSecr=1541063
17744   5.377111 241.82.197.177 -> 41.177.98.176 TCP 70 62806 > http [ACK] Seq=2392 Ack=17290 Win=16392 Len=0 TSval=568597953 TSecr=1541093
18852   6.075459 241.82.197.177 -> 41.177.98.176 TCP 70 62806 > http [ACK] Seq=3107 Ack=17457 Win=16393 Len=0 TSval=568598023 TSecr=1541163
19256   6.312524 241.82.197.177 -> 41.177.98.176 TCP 70 62806 > http [ACK] Seq=3831 Ack=17623 Win=16394 Len=0 TSval=568598047 TSecr=1541187
19865   6.542235 241.82.197.177 -> 41.177.98.176 TCP 70 62806 > http [ACK] Seq=4545 Ack=17790 Win=16393 Len=0 TSval=568598070 TSecr=1541210
20531   6.796761 241.82.197.177 -> 41.177.98.176 TCP 70 62806 > http [ACK] Seq=5266 Ack=17957 Win=16393 Len=0 TSval=568598095 TSecr=1541235
21030   7.015725 241.82.197.177 -> 41.177.98.176 TCP 70 62806 > http [ACK] Seq=5993 Ack=18124 Win=16393 Len=0 TSval=568598117 TSecr=1541257
21253   7.234517 241.82.197.177 -> 41.177.98.176 TCP 70 62806 > http [ACK] Seq=6718 Ack=18291 Win=16393 Len=0 TSval=568598139 TSecr=1541279
21524   7.441837 241.82.197.177 -> 41.177.98.176 TCP 70 62806 > http [ACK] Seq=7454 Ack=18458 Win=16393 Len=0 TSval=568598160 TSecr=1541300
21968   7.682755 241.82.197.177 -> 41.177.98.176 TCP 70 62806 > http [ACK] Seq=8190 Ack=18624 Win=16394 Len=0 TSval=568598184 TSecr=1541324
24366   9.184707 241.82.197.177 -> 41.177.98.176 TCP 70 62806 > http [ACK] Seq=8909 Ack=18791 Win=16393 Len=0 TSval=568598334 TSecr=1541474
24690   9.395864 241.82.197.177 -> 41.177.98.176 TCP 70 62806 > http [ACK] Seq=9626 Ack=18958 Win=16393 Len=0 TSval=568598355 TSecr=1541495
25147   9.633871 241.82.197.177 -> 41.177.98.176 TCP 70 62806 > http [ACK] Seq=10339 Ack=19123 Win=16395 Len=0 TSval=568598379 TSecr=1541519
25777   9.983000 241.82.197.177 -> 41.177.98.176 TCP 70 62806 > http [ACK] Seq=11059 Ack=19290 Win=16393 Len=0 TSval=568598414 TSecr=1541554
26065  10.163929 241.82.197.177 -> 41.177.98.176 TCP 70 62806 > http [ACK] Seq=11777 Ack=19457 Win=16393 Len=0 TSval=568598432 TSecr=1541572
44912  18.816262 241.82.197.177 -> 41.177.98.176 TCP 70 62806 > http [ACK] Seq=12843 Ack=24790 Win=11432 Len=0 TSval=568599298 TSecr=1542430
44913  18.816286 241.82.197.177 -> 41.177.98.176 TCP 70 62806 > http [ACK] Seq=12843 Ack=29918 Win=6304 Len=0 TSval=568599298 TSecr=1542430
44914  18.816291 241.82.197.177 -> 41.177.98.176 TCP 70 62806 > http [ACK] Seq=12843 Ack=35046 Win=1176 Len=0 TSval=568599298 TSecr=1542431
44915  18.816296 241.82.197.177 -> 41.177.98.176 TCP 70 [TCP Window Update] 62806 > http [ACK] Seq=12843 Ack=35046 Win=16560 Len=0 TSval=568599298 TSecr=1542431
45039  18.850004 241.82.197.177 -> 41.177.98.176 TCP 70 62806 > http [ACK] Seq=12843 Ack=39322 Win=12284 Len=0 TSval=568599302 TSecr=1542440
45058  18.858420 241.82.197.177 -> 41.177.98.176 TCP 70 [TCP Window Update] 62806 > http [ACK] Seq=12843 Ack=39322 Win=16555 Len=0 TSval=568599303 TSecr=1542440
47933  19.711746 241.82.197.177 -> 41.177.98.176 TCP 70 62806 > http [ACK] Seq=13632 Ack=39489 Win=16393 Len=0 TSval=568599388 TSecr=1542527
49083  19.975360 241.82.197.177 -> 41.177.98.176 TCP 70 62806 > http [ACK] Seq=14421 Ack=39657 Win=16392 Len=0 TSval=568599414 TSecr=1542553
49390  20.070977 241.82.197.177 -> 41.177.98.176 TCP 70 62806 > http [ACK] Seq=15211 Ack=39826 Win=16391 Len=0 TSval=568599424 TSecr=1542563
49774  20.201528 241.82.197.177 -> 41.177.98.176 TCP 70 62806 > http [ACK] Seq=16000 Ack=39994 Win=16392 Len=0 TSval=568599437 TSecr=1542576
50431  20.517540 241.82.197.177 -> 41.177.98.176 TCP 70 62806 > http [ACK] Seq=16707 Ack=40692 Win=15862 Len=0 TSval=568599469 TSecr=1542607
92831  35.518857 241.82.197.177 -> 41.177.98.176 TCP 70 62806 > http [ACK] Seq=16707 Ack=40693 Win=16560 Len=0 TSval=568600970 TSecr=1544108
92832  35.518862 241.82.197.177 -> 41.177.98.176 TCP 70 62806 > http [FIN, ACK] Seq=16707 Ack=40693 Win=16560 Len=0 TSval=568600970 TSecr=1544108
308507 105.052199 241.82.197.177 -> 41.177.98.176 TCP 82 surveyinst > http [SYN] Seq=0 Win=16384 Len=0 MSS=1380 SACK_PERM=1 WS=1 TSval=568607929 TSecr=0
308582 105.082671 241.82.197.177 -> 41.177.98.176 TCP 70 surveyinst > http [ACK] Seq=1 Ack=1 Win=16560 Len=0 TSval=568607932 TSecr=1551064
310463 105.946902 241.82.197.177 -> 41.177.98.176 TCP 70 surveyinst > http [ACK] Seq=1067 Ack=4105 Win=12662 Len=0 TSval=568608019 TSecr=1551149
310464 105.946906 241.82.197.177 -> 41.177.98.176 TCP 70 [TCP Window Update] surveyinst > http [ACK] Seq=1067 Ack=4105 Win=16560 Len=0 TSval=568608019 TSecr=1551149
310564 105.978190 241.82.197.177 -> 41.177.98.176 TCP 70 surveyinst > http [ACK] Seq=1067 Ack=9439 Win=16560 Len=0 TSval=568608022 TSecr=1551154
310653 106.009492 241.82.197.177 -> 41.177.98.176 TCP 70 surveyinst > http [ACK] Seq=1067 Ack=15591 Win=16560 Len=0 TSval=568608025 TSecr=1551157
310814 106.041224 241.82.197.177 -> 41.177.98.176 TCP 70 surveyinst > http [ACK] Seq=1067 Ack=18327 Win=16560 Len=0 TSval=568608028 TSecr=1551160
310815 106.041229 241.82.197.177 -> 41.177.98.176 TCP 70 surveyinst > http [ACK] Seq=1067 Ack=21019 Win=15236 Len=0 TSval=568608028 TSecr=1551160
313043 106.845964 241.82.197.177 -> 41.177.98.176 TCP 82 10711 > http [SYN] Seq=0 Win=16384 Len=0 MSS=1380 SACK_PERM=1 WS=1 TSval=2481051868 TSecr=0
313105 106.877198 241.82.197.177 -> 41.177.98.176 TCP 70 10711 > http [ACK] Seq=1 Ack=1 Win=16560 Len=0 TSval=2481051871 TSecr=1551243
313188 106.912360 241.82.197.177 -> 41.177.98.176 TCP 70 10711 > http [ACK] Seq=704 Ack=623 Win=15938 Len=0 TSval=2481051875 TSecr=1551247
314526 107.350337 241.82.197.177 -> 41.177.98.176 TCP 70 surveyinst > http [ACK] Seq=1775 Ack=22469 Win=15321 Len=0 TSval=568608159 TSecr=1551291
357261 121.916130 241.82.197.177 -> 41.177.98.176 TCP 70 10711 > http [ACK] Seq=704 Ack=624 Win=16560 Len=0 TSval=2481053377 TSecr=1552748
357262 121.916134 241.82.197.177 -> 41.177.98.176 TCP 70 10711 > http [FIN, ACK] Seq=704 Ack=624 Win=16560 Len=0 TSval=2481053377 TSecr=1552748
358408 122.355391 241.82.197.177 -> 41.177.98.176 TCP 70 surveyinst > http [ACK] Seq=1775 Ack=22470 Win=16560 Len=0 TSval=568609661 TSecr=1552792
358409 122.355544 241.82.197.177 -> 41.177.98.176 TCP 70 surveyinst > http [FIN, ACK] Seq=1775 Ack=22470 Win=16560 Len=0 TSval=568609661 TSecr=1552792
435901 142.137293 241.82.197.177 -> 41.177.98.176 TCP 82 6806 > http [SYN] Seq=0 Win=16384 Len=0 MSS=1380 SACK_PERM=1 WS=1 TSval=2481802491 TSecr=0
436062 142.167580 241.82.197.177 -> 41.177.98.176 TCP 70 6806 > http [ACK] Seq=1 Ack=1 Win=16560 Len=0 TSval=2481802495 TSecr=1554773
439844 143.311405 241.82.197.177 -> 41.177.98.176 TCP 70 6806 > http [ACK] Seq=1067 Ack=4105 Win=12662 Len=0 TSval=2481802609 TSecr=1554887
439845 143.311410 241.82.197.177 -> 41.177.98.176 TCP 70 [TCP Window Update] 6806 > http [ACK] Seq=1067 Ack=4105 Win=16560 Len=0 TSval=2481802609 TSecr=1554887
439987 143.345865 241.82.197.177 -> 41.177.98.176 TCP 70 6806 > http [ACK] Seq=1067 Ack=9577 Win=11088 Len=0 TSval=2481802612 TSecr=1554890
440001 143.348990 241.82.197.177 -> 41.177.98.176 TCP 70 [TCP Window Update] 6806 > http [ACK] Seq=1067 Ack=9577 Win=16560 Len=0 TSval=2481802613 TSecr=1554890
440117 143.383343 241.82.197.177 -> 41.177.98.176 TCP 70 6806 > http [ACK] Seq=1067 Ack=16417 Win=10606 Len=0 TSval=2481802616 TSecr=1554894
440132 143.386133 241.82.197.177 -> 41.177.98.176 TCP 70 [TCP Window Update] 6806 > http [ACK] Seq=1067 Ack=16417 Win=15734 Len=0 TSval=2481802617 TSecr=1554894
440315 143.415799 241.82.197.177 -> 41.177.98.176 TCP 70 6806 > http [ACK] Seq=1067 Ack=19153 Win=16560 Len=0 TSval=2481802619 TSecr=1554897
440317 143.415836 241.82.197.177 -> 41.177.98.176 TCP 70 6806 > http [ACK] Seq=1067 Ack=19867 Win=15846 Len=0 TSval=2481802619 TSecr=1554897
480378 158.376201 241.82.197.177 -> 41.177.98.176 TCP 70 6806 > http [ACK] Seq=1067 Ack=19868 Win=16560 Len=0 TSval=2481804117 TSecr=1556394
480379 158.376206 241.82.197.177 -> 41.177.98.176 TCP 70 6806 > http [FIN, ACK] Seq=1067 Ack=19868 Win=16560 Len=0 TSval=2481804117 TSecr=1556394
949812 314.969074 241.82.197.177 -> 244.3.210.197 TCP 82 57699 > http [SYN] Seq=0 Win=16384 Len=0 MSS=1380 SACK_PERM=1 WS=1 TSval=2481072699 TSecr=0
950172 315.082444 241.82.197.177 -> 244.3.210.197 TCP 70 57699 > http [ACK] Seq=1 Ack=1 Win=16560 Len=0 TSval=2481072710 TSecr=0
950312 315.132219 241.82.197.177 -> 244.3.210.197 TCP 70 57699 > http [ACK] Seq=931 Ack=351 Win=16210 Len=0 TSval=2481072715 TSecr=150407163
956439 317.422814 241.82.197.177 -> 244.3.210.197 TCP 82 58772 > http [SYN] Seq=0 Win=16384 Len=0 MSS=1380 SACK_PERM=1 WS=1 TSval=1623265758 TSecr=0
956509 317.452808 241.82.197.177 -> 244.3.210.197 TCP 70 58772 > http [ACK] Seq=1 Ack=1 Win=16560 Len=0 TSval=1623265761 TSecr=0
957580 317.911434 241.82.197.177 -> 244.3.210.197 TCP 70 58772 > http [ACK] Seq=981 Ack=2737 Win=16560 Len=0 TSval=1623265807 TSecr=150407190
957676 317.950979 241.82.197.177 -> 244.3.210.197 TCP 70 58772 > http [ACK] Seq=981 Ack=6841 Win=16560 Len=0 TSval=1623265811 TSecr=150407192
957777 317.981451 241.82.197.177 -> 244.3.210.197 TCP 70 58772 > http [ACK] Seq=981 Ack=12313 Win=16560 Len=0 TSval=1623265814 TSecr=150407192
957865 318.011591 241.82.197.177 -> 244.3.210.197 TCP 70 58772 > http [ACK] Seq=981 Ack=15420 Win=13453 Len=0 TSval=1623265817 TSecr=150407192
957866 318.011595 241.82.197.177 -> 244.3.210.197 TCP 70 [TCP Window Update] 58772 > http [ACK] Seq=981 Ack=15420 Win=16560 Len=0 TSval=1623265817 TSecr=150407192
959355 318.596136 241.82.197.177 -> 244.3.210.197 TCP 82 59949 > http [SYN] Seq=0 Win=16384 Len=0 MSS=1380 SACK_PERM=1 WS=1 TSval=2481073062 TSecr=0
959457 318.626236 241.82.197.177 -> 244.3.210.197 TCP 70 59949 > http [ACK] Seq=1 Ack=1 Win=16560 Len=0 TSval=2481073065 TSecr=0
959567 318.658629 241.82.197.177 -> 244.3.210.197 TCP 70 59949 > http [ACK] Seq=905 Ack=213 Win=16348 Len=0 TSval=2481073068 TSecr=150407198
960280 318.953910 241.82.197.177 -> 244.3.210.197 TCP 70 58772 > http [ACK] Seq=1882 Ack=15633 Win=16347 Len=0 TSval=1623265911 TSecr=150407201
960474 319.057490 241.82.197.177 -> 244.3.210.197 TCP 70 59949 > http [ACK] Seq=1809 Ack=426 Win=16347 Len=0 TSval=2481073108 TSecr=150407202
960713 319.190432 241.82.197.177 -> 244.3.210.197 TCP 70 58772 > http [ACK] Seq=2786 Ack=15846 Win=16347 Len=0 TSval=1623265935 TSecr=150407204
961389 319.415198 241.82.197.177 -> 244.3.210.197 TCP 70 59949 > http [ACK] Seq=2716 Ack=638 Win=16348 Len=0 TSval=2481073144 TSecr=150407206
961771 319.636453 241.82.197.177 -> 244.3.210.197 TCP 70 59949 > http [ACK] Seq=3618 Ack=851 Win=16347 Len=0 TSval=2481073166 TSecr=150407208
962034 319.800726 241.82.197.177 -> 244.3.210.197 TCP 70 58772 > http [ACK] Seq=3688 Ack=16059 Win=16347 Len=0 TSval=1623265996 TSecr=150407210
962160 319.851524 241.82.197.177 -> 244.3.210.197 TCP 70 59949 > http [ACK] Seq=4521 Ack=1064 Win=16347 Len=0 TSval=2481073187 TSecr=150407210
962694 320.007791 241.82.197.177 -> 244.3.210.197 TCP 70 58772 > http [ACK] Seq=4591 Ack=16272 Win=16347 Len=0 TSval=1623266017 TSecr=150407212
962924 320.222606 241.82.197.177 -> 244.3.210.197 TCP 70 59949 > http [ACK] Seq=5421 Ack=1276 Win=16348 Len=0 TSval=2481073224 TSecr=150407214
963557 320.579362 241.82.197.177 -> 244.3.210.197 TCP 70 58772 > http [ACK] Seq=5507 Ack=16485 Win=16347 Len=0 TSval=1623266074 TSecr=150407218
964112 320.792712 241.82.197.177 -> 244.3.210.197 TCP 70 59949 > http [ACK] Seq=6325 Ack=1489 Win=16347 Len=0 TSval=2481073281 TSecr=150407220
964426 320.987075 241.82.197.177 -> 244.3.210.197 TCP 70 59949 > http [ACK] Seq=7230 Ack=1701 Win=16348 Len=0 TSval=2481073301 TSecr=150407222
964436 320.992385 241.82.197.177 -> 244.3.210.197 TCP 70 58772 > http [ACK] Seq=6401 Ack=16698 Win=16347 Len=0 TSval=1623266116 TSecr=150407222
965101 321.304942 241.82.197.177 -> 244.3.210.197 TCP 70 59949 > http [ACK] Seq=8134 Ack=1914 Win=16347 Len=0 TSval=2481073333 TSecr=150407224
965719 321.521554 241.82.197.177 -> 244.3.210.197 TCP 70 58772 > http [ACK] Seq=7301 Ack=16911 Win=16347 Len=0 TSval=1623266168 TSecr=150407227
966427 321.740630 241.82.197.177 -> 244.3.210.197 TCP 70 59949 > http [ACK] Seq=9035 Ack=2127 Win=16347 Len=0 TSval=2481073376 TSecr=150407229
966833 321.937108 241.82.197.177 -> 244.3.210.197 TCP 70 58772 > http [ACK] Seq=8206 Ack=17124 Win=16347 Len=0 TSval=1623266210 TSecr=150407231
967518 322.212664 241.82.197.177 -> 244.3.210.197 TCP 70 59949 > http [ACK] Seq=9934 Ack=2340 Win=16347 Len=0 TSval=2481073424 TSecr=150407234
968302 322.452656 241.82.197.177 -> 244.3.210.197 TCP 70 58772 > http [ACK] Seq=9107 Ack=17337 Win=16347 Len=0 TSval=1623266262 TSecr=150407236
968807 322.674237 241.82.197.177 -> 244.3.210.197 TCP 70 59949 > http [ACK] Seq=10843 Ack=2553 Win=16347 Len=0 TSval=2481073470 TSecr=150407239
970017 323.221085 241.82.197.177 -> 244.3.210.197 TCP 70 58772 > http [ACK] Seq=10012 Ack=17550 Win=16347 Len=0 TSval=1623266339 TSecr=150407244
970285 323.409899 241.82.197.177 -> 244.3.210.197 TCP 70 59949 > http [ACK] Seq=11741 Ack=2766 Win=16347 Len=0 TSval=2481073543 TSecr=150407246
970871 323.889487 241.82.197.177 -> 244.3.210.197 TCP 70 58772 > http [ACK] Seq=10928 Ack=33966 Win=16560 Len=0 TSval=1623266405 TSecr=150407251
971007 323.919881 241.82.197.177 -> 244.3.210.197 TCP 70 58772 > http [ACK] Seq=10928 Ack=50382 Win=16560 Len=0 TSval=1623266409 TSecr=150407251
971229 323.950241 241.82.197.177 -> 244.3.210.197 TCP 70 58772 > http [ACK] Seq=10928 Ack=56161 Win=12149 Len=0 TSval=1623266412 TSecr=150407252
971231 323.950250 241.82.197.177 -> 244.3.210.197 TCP 70 [TCP Window Update] 58772 > http [ACK] Seq=10928 Ack=56161 Win=16560 Len=0 TSval=1623266412 TSecr=150407252
974021 324.326556 241.82.197.177 -> 244.3.210.197 TCP 70 59949 > http [ACK] Seq=12654 Ack=16198 Win=3462 Len=0 TSval=2481073635 TSecr=150407255
974107 324.343601 241.82.197.177 -> 244.3.210.197 TCP 70 [TCP Window Update] 59949 > http [ACK] Seq=12654 Ack=16198 Win=16560 Len=0 TSval=2481073637 TSecr=150407255
976408 325.239544 241.82.197.177 -> 244.3.210.197 TCP 70 59949 > http [ACK] Seq=13569 Ack=29238 Win=3856 Len=0 TSval=2481073727 TSecr=150407264
976442 325.263200 241.82.197.177 -> 244.3.210.197 TCP 70 [TCP Window Update] 59949 > http [ACK] Seq=13569 Ack=29238 Win=16560 Len=0 TSval=2481073729 TSecr=150407264
978345 325.891307 241.82.197.177 -> 244.3.210.197 TCP 70 58772 > http [ACK] Seq=11658 Ack=57820 Win=15154 Len=0 TSval=1623266606 TSecr=150407270
1019189 343.755851 241.82.197.177 -> 244.3.210.197 TCP 70 57699 > http [FIN, ACK] Seq=931 Ack=351 Win=16560 Len=0 TSval=2481075580 TSecr=150407163
1019242 343.786266 241.82.197.177 -> 244.3.210.197 TCP 70 57699 > http [ACK] Seq=932 Ack=352 Win=16560 Len=0 TSval=2481075583 TSecr=150407450
