150967  51.807517 241.204.197.203 -> 41.177.26.176 TCP 66 25750 > http [SYN] Seq=0 Win=65535 Len=0 MSS=1380 SACK_PERM=1
151122  51.848627 241.204.197.203 -> 41.177.26.176 TCP 64 25750 > http [ACK] Seq=1 Ack=1 Win=65535 Len=0
151325  51.895394 241.204.197.203 -> 41.177.26.176 TCP 64 25750 > http [ACK] Seq=729 Ack=184 Win=65535 Len=0
194557  66.897738 241.204.197.203 -> 41.177.26.176 TCP 64 25750 > http [ACK] Seq=729 Ack=185 Win=65535 Len=0
194558  66.897787 241.204.197.203 -> 41.177.26.176 TCP 64 25750 > http [FIN, ACK] Seq=729 Ack=185 Win=65535 Len=0
499902 163.702729 241.204.197.203 -> 41.177.26.176 TCP 66 33684 > http [SYN] Seq=0 Win=65535 Len=0 MSS=1380 SACK_PERM=1
501104 163.744130 241.204.197.203 -> 41.177.26.176 TCP 64 33684 > http [ACK] Seq=1 Ack=1 Win=65535 Len=0
502230 163.789410 241.204.197.203 -> 41.177.26.176 TCP 64 33684 > http [ACK] Seq=729 Ack=184 Win=65535 Len=0
555213 178.796665 241.204.197.203 -> 41.177.26.176 TCP 64 33684 > http [ACK] Seq=729 Ack=185 Win=65535 Len=0
555215 178.796861 241.204.197.203 -> 41.177.26.176 TCP 64 33684 > http [FIN, ACK] Seq=729 Ack=185 Win=65535 Len=0
