105990  38.230712 242.106.38.181 -> 244.3.210.197 TCP 78 46993 > http [SYN] Seq=0 Win=5840 Len=0 MSS=1460 SACK_PERM=1 TSval=961524411 TSecr=0 WS=128
106060  38.274551 242.106.38.181 -> 244.3.210.197 TCP 70 46993 > http [ACK] Seq=1 Ack=1 Win=5888 Len=0 TSval=961524422 TSecr=0
107327  38.648058 242.106.38.181 -> 244.3.210.197 TCP 70 46993 > http [ACK] Seq=335 Ack=1449 Win=8832 Len=0 TSval=961524515 TSecr=150404398
107328  38.648063 242.106.38.181 -> 244.3.210.197 TCP 70 46993 > http [ACK] Seq=335 Ack=2897 Win=11648 Len=0 TSval=961524515 TSecr=150404398
107547  38.691465 242.106.38.181 -> 244.3.210.197 TCP 70 46993 > http [ACK] Seq=335 Ack=4345 Win=14592 Len=0 TSval=961524526 TSecr=150404398
107548  38.691470 242.106.38.181 -> 244.3.210.197 TCP 70 46993 > http [ACK] Seq=335 Ack=5793 Win=17536 Len=0 TSval=961524526 TSecr=150404398
107549  38.691474 242.106.38.181 -> 244.3.210.197 TCP 70 46993 > http [ACK] Seq=335 Ack=7241 Win=20352 Len=0 TSval=961524526 TSecr=150404398
107550  38.691478 242.106.38.181 -> 244.3.210.197 TCP 70 46993 > http [ACK] Seq=335 Ack=8689 Win=23296 Len=0 TSval=961524526 TSecr=150404398
107726  38.735064 242.106.38.181 -> 244.3.210.197 TCP 70 46993 > http [ACK] Seq=335 Ack=10137 Win=26112 Len=0 TSval=961524537 TSecr=150404399
107732  38.735310 242.106.38.181 -> 244.3.210.197 TCP 70 46993 > http [ACK] Seq=335 Ack=11585 Win=29056 Len=0 TSval=961524537 TSecr=150404399
107733  38.735316 242.106.38.181 -> 244.3.210.197 TCP 70 46993 > http [ACK] Seq=335 Ack=13033 Win=32000 Len=0 TSval=961524537 TSecr=150404399
107734  38.735320 242.106.38.181 -> 244.3.210.197 TCP 70 46993 > http [ACK] Seq=335 Ack=14481 Win=34816 Len=0 TSval=961524537 TSecr=150404399
107735  38.735324 242.106.38.181 -> 244.3.210.197 TCP 70 46993 > http [ACK] Seq=335 Ack=14553 Win=34816 Len=0 TSval=961524537 TSecr=150404399
107823  38.762363 242.106.38.181 -> 244.3.210.197 TCP 70 46993 > http [FIN, ACK] Seq=335 Ack=15440 Win=37760 Len=0 TSval=961524544 TSecr=150404399
125175  44.741154 242.106.38.181 -> 41.177.98.176 TCP 78 36476 > http [SYN] Seq=0 Win=5840 Len=0 MSS=1460 SACK_PERM=1 TSval=961526039 TSecr=0 WS=128
125300  44.784917 242.106.38.181 -> 41.177.98.176 TCP 70 36476 > http [ACK] Seq=1 Ack=1 Win=5888 Len=0 TSval=961526050 TSecr=1545033
126169  44.896749 242.106.38.181 -> 41.177.98.176 TCP 70 36476 > http [ACK] Seq=388 Ack=130 Win=6912 Len=0 TSval=961526077 TSecr=1545044
126170  44.896754 242.106.38.181 -> 41.177.98.176 TCP 70 36476 > http [FIN, ACK] Seq=388 Ack=130 Win=6912 Len=0 TSval=961526077 TSecr=1545044
126171  44.896758 242.106.38.181 -> 41.177.98.176 TCP 70 36476 > http [ACK] Seq=389 Ack=131 Win=6912 Len=0 TSval=961526078 TSecr=1545044
