177069  59.325878 242.64.244.34 -> 244.3.210.197 TCP 66 nim > http [SYN] Seq=0 Win=16384 Len=0 MSS=1460 SACK_PERM=1
177191  59.404211 242.64.244.34 -> 244.3.210.197 TCP 64 nim > http [ACK] Seq=1 Ack=1 Win=17520 Len=0
178204  59.826131 242.64.244.34 -> 244.3.210.197 TCP 64 nim > http [ACK] Seq=639 Ack=2921 Win=17520 Len=0
178432  59.909896 242.64.244.34 -> 244.3.210.197 TCP 64 nim > http [ACK] Seq=639 Ack=5841 Win=17520 Len=0
178615  59.987902 242.64.244.34 -> 244.3.210.197 TCP 64 nim > http [ACK] Seq=639 Ack=8761 Win=17520 Len=0
178641  59.991929 242.64.244.34 -> 244.3.210.197 TCP 64 nim > http [ACK] Seq=639 Ack=11681 Win=16060 Len=0
178693  60.006086 242.64.244.34 -> 244.3.210.197 TCP 64 [TCP Window Update] nim > http [ACK] Seq=639 Ack=11681 Win=17520 Len=0
178806  60.067942 242.64.244.34 -> 244.3.210.197 TCP 64 nim > http [ACK] Seq=639 Ack=14601 Win=17520 Len=0
178819  60.071881 242.64.244.34 -> 244.3.210.197 TCP 64 nim > http [ACK] Seq=639 Ack=17521 Win=17520 Len=0
178832  60.075937 242.64.244.34 -> 244.3.210.197 TCP 64 nim > http [ACK] Seq=639 Ack=19455 Win=17520 Len=0
186942  63.069920 242.64.244.34 -> 244.3.210.197 TCP 66 polestar > http [SYN] Seq=0 Win=16384 Len=0 MSS=1460 SACK_PERM=1
186963  63.073919 242.64.244.34 -> 244.3.210.197 TCP 66 kiosk > http [SYN] Seq=0 Win=16384 Len=0 MSS=1460 SACK_PERM=1
186986  63.077939 242.64.244.34 -> 244.3.210.197 TCP 66 veracity > http [SYN] Seq=0 Win=16384 Len=0 MSS=1460 SACK_PERM=1
187000  63.086236 242.64.244.34 -> 244.3.210.197 TCP 66 kyoceranetdev > http [SYN] Seq=0 Win=16384 Len=0 MSS=1460 SACK_PERM=1
187007  63.090267 242.64.244.34 -> 244.3.210.197 TCP 66 jstel > http [SYN] Seq=0 Win=16384 Len=0 MSS=1460 SACK_PERM=1
187065  63.148050 242.64.244.34 -> 244.3.210.197 TCP 64 polestar > http [ACK] Seq=1 Ack=1 Win=17520 Len=0
187086  63.155902 242.64.244.34 -> 244.3.210.197 TCP 64 kiosk > http [ACK] Seq=1 Ack=1 Win=17520 Len=0
187108  63.164241 242.64.244.34 -> 244.3.210.197 TCP 64 veracity > http [ACK] Seq=1 Ack=1 Win=17520 Len=0
187126  63.171889 242.64.244.34 -> 244.3.210.197 TCP 64 kyoceranetdev > http [ACK] Seq=1 Ack=1 Win=17520 Len=0
187139  63.180130 242.64.244.34 -> 244.3.210.197 TCP 64 jstel > http [ACK] Seq=1 Ack=1 Win=17520 Len=0
187711  63.513920 242.64.244.34 -> 244.3.210.197 TCP 64 kiosk > http [ACK] Seq=1928 Ack=640 Win=16881 Len=0
187718  63.518083 242.64.244.34 -> 244.3.210.197 TCP 64 jstel > http [ACK] Seq=1283 Ack=427 Win=17094 Len=0
187724  63.521904 242.64.244.34 -> 244.3.210.197 TCP 64 polestar > http [ACK] Seq=1920 Ack=640 Win=16881 Len=0
187735  63.525927 242.64.244.34 -> 244.3.210.197 TCP 64 nim > http [ACK] Seq=3217 Ack=20305 Win=16670 Len=0
187807  63.619893 242.64.244.34 -> 244.3.210.197 TCP 64 kyoceranetdev > http [ACK] Seq=1919 Ack=639 Win=16882 Len=0
187814  63.625928 242.64.244.34 -> 244.3.210.197 TCP 64 veracity > http [ACK] Seq=1921 Ack=640 Win=16881 Len=0
188803  64.276136 242.64.244.34 -> 244.3.210.197 TCP 64 jstel > http [ACK] Seq=1923 Ack=640 Win=16881 Len=0
189081  64.493933 242.64.244.34 -> 244.3.210.197 TCP 64 nim > http [ACK] Seq=3858 Ack=20518 Win=16457 Len=0
189369  64.714443 242.64.244.34 -> 244.3.210.197 TCP 64 polestar > http [ACK] Seq=2561 Ack=853 Win=16668 Len=0
189478  64.821987 242.64.244.34 -> 244.3.210.197 TCP 64 kiosk > http [ACK] Seq=2566 Ack=852 Win=16669 Len=0
189784  65.041961 242.64.244.34 -> 244.3.210.197 TCP 64 veracity > http [ACK] Seq=2563 Ack=853 Win=16668 Len=0
189792  65.046057 242.64.244.34 -> 244.3.210.197 TCP 64 kyoceranetdev > http [ACK] Seq=2551 Ack=852 Win=16669 Len=0
190212  65.294284 242.64.244.34 -> 244.3.210.197 TCP 64 jstel > http [ACK] Seq=2579 Ack=3560 Win=17520 Len=0
190221  65.298268 242.64.244.34 -> 244.3.210.197 TCP 64 jstel > http [ACK] Seq=2579 Ack=6480 Win=17520 Len=0
190345  65.374132 242.64.244.34 -> 244.3.210.197 TCP 64 jstel > http [ACK] Seq=2579 Ack=9400 Win=17520 Len=0
190356  65.378091 242.64.244.34 -> 244.3.210.197 TCP 64 jstel > http [ACK] Seq=2579 Ack=12320 Win=16060 Len=0
190366  65.382115 242.64.244.34 -> 244.3.210.197 TCP 64 jstel > http [ACK] Seq=2579 Ack=15240 Win=13140 Len=0
190481  65.454083 242.64.244.34 -> 244.3.210.197 TCP 64 jstel > http [ACK] Seq=2579 Ack=18160 Win=10220 Len=0
190495  65.458080 242.64.244.34 -> 244.3.210.197 TCP 64 jstel > http [ACK] Seq=2579 Ack=21080 Win=7300 Len=0
190502  65.462095 242.64.244.34 -> 244.3.210.197 TCP 64 jstel > http [ACK] Seq=2579 Ack=24000 Win=4380 Len=0
190508  65.466123 242.64.244.34 -> 244.3.210.197 TCP 64 jstel > http [ACK] Seq=2579 Ack=26764 Win=1616 Len=0
190649  65.532072 242.64.244.34 -> 244.3.210.197 TCP 64 [TCP Window Update] jstel > http [ACK] Seq=2579 Ack=26764 Win=17520 Len=0
190791  65.624109 242.64.244.34 -> 244.3.210.197 TCP 64 nim > http [ACK] Seq=4501 Ack=23438 Win=17520 Len=0
190806  65.627889 242.64.244.34 -> 244.3.210.197 TCP 64 nim > http [ACK] Seq=4501 Ack=26358 Win=17520 Len=0
190813  65.631946 242.64.244.34 -> 244.3.210.197 TCP 64 nim > http [ACK] Seq=4501 Ack=29278 Win=17520 Len=0
190827  65.635885 242.64.244.34 -> 244.3.210.197 TCP 64 nim > http [ACK] Seq=4501 Ack=32198 Win=17520 Len=0
190839  65.639875 242.64.244.34 -> 244.3.210.197 TCP 64 nim > http [ACK] Seq=4501 Ack=34653 Win=17520 Len=0
191173  65.809962 242.64.244.34 -> 244.3.210.197 TCP 64 polestar > http [ACK] Seq=3212 Ack=1065 Win=16456 Len=0
194900  66.999854 242.64.244.34 -> 244.3.210.197 TCP 64 veracity > http [ACK] Seq=3228 Ack=3773 Win=17520 Len=0
194926  67.003994 242.64.244.34 -> 244.3.210.197 TCP 64 veracity > http [ACK] Seq=3228 Ack=5655 Win=17520 Len=0
195302  67.119869 242.64.244.34 -> 244.3.210.197 TCP 64 kiosk > http [ACK] Seq=3210 Ack=1065 Win=16456 Len=0
195331  67.131849 242.64.244.34 -> 244.3.210.197 TCP 64 kyoceranetdev > http [ACK] Seq=3212 Ack=2944 Win=17520 Len=0
195642  67.266091 242.64.244.34 -> 244.3.210.197 TCP 64 jstel > http [ACK] Seq=3241 Ack=28852 Win=17520 Len=0
196707  67.501919 242.64.244.34 -> 244.3.210.197 TCP 64 nim > http [ACK] Seq=5163 Ack=36859 Win=17520 Len=0
197168  67.591913 242.64.244.34 -> 244.3.210.197 TCP 64 polestar > http [ACK] Seq=3873 Ack=3037 Win=17520 Len=0
197374  67.673921 242.64.244.34 -> 244.3.210.197 TCP 64 kiosk > http [ACK] Seq=3872 Ack=3404 Win=17520 Len=0
197526  67.731902 242.64.244.34 -> 244.3.210.197 TCP 64 veracity > http [ACK] Seq=3889 Ack=7733 Win=17520 Len=0
198320  68.103964 242.64.244.34 -> 244.3.210.197 TCP 64 kyoceranetdev > http [ACK] Seq=3860 Ack=3157 Win=17307 Len=0
218433  74.534050 242.64.244.34 -> 244.3.210.197 TCP 64 jstel > http [ACK] Seq=3892 Ack=31772 Win=17520 Len=0
218441  74.538139 242.64.244.34 -> 244.3.210.197 TCP 64 jstel > http [ACK] Seq=3892 Ack=34692 Win=17520 Len=0
218459  74.542129 242.64.244.34 -> 244.3.210.197 TCP 64 jstel > http [ACK] Seq=3892 Ack=37612 Win=17520 Len=0
218469  74.546091 242.64.244.34 -> 244.3.210.197 TCP 64 jstel > http [ACK] Seq=3892 Ack=40532 Win=16060 Len=0
218477  74.550149 242.64.244.34 -> 244.3.210.197 TCP 64 jstel > http [ACK] Seq=3892 Ack=43452 Win=13140 Len=0
218483  74.554079 242.64.244.34 -> 244.3.210.197 TCP 64 jstel > http [ACK] Seq=3892 Ack=46372 Win=10220 Len=0
218659  74.614090 242.64.244.34 -> 244.3.210.197 TCP 64 jstel > http [ACK] Seq=3892 Ack=49292 Win=7300 Len=0
218682  74.618114 242.64.244.34 -> 244.3.210.197 TCP 64 jstel > http [ACK] Seq=3892 Ack=52212 Win=4380 Len=0
218700  74.622088 242.64.244.34 -> 244.3.210.197 TCP 64 jstel > http [ACK] Seq=3892 Ack=53740 Win=2852 Len=0
218743  74.628047 242.64.244.34 -> 244.3.210.197 TCP 64 [TCP Window Update] jstel > http [ACK] Seq=3892 Ack=53740 Win=17520 Len=0
219221  74.885896 242.64.244.34 -> 244.3.210.197 TCP 64 nim > http [ACK] Seq=5815 Ack=37071 Win=17308 Len=0
398093 133.946306 242.64.244.34 -> 244.3.210.197 TCP 64 polestar > http [RST, ACK] Seq=3873 Ack=3037 Win=0 Len=0
398117 133.949904 242.64.244.34 -> 244.3.210.197 TCP 64 kiosk > http [RST, ACK] Seq=3872 Ack=3404 Win=0 Len=0
398131 133.953942 242.64.244.34 -> 244.3.210.197 TCP 64 veracity > http [RST, ACK] Seq=3889 Ack=7733 Win=0 Len=0
398153 133.967984 242.64.244.34 -> 244.3.210.197 TCP 64 kyoceranetdev > http [RST, ACK] Seq=3860 Ack=3157 Win=0 Len=0
418400 139.042272 242.64.244.34 -> 244.3.210.197 TCP 64 jstel > http [RST, ACK] Seq=3892 Ack=53740 Win=0 Len=0
418433 139.046049 242.64.244.34 -> 244.3.210.197 TCP 64 nim > http [RST, ACK] Seq=5815 Ack=37071 Win=0 Len=0
