684549 214.686687 244.3.90.239 -> 41.177.98.176 TCP 82 50803 > http [SYN] Seq=0 Win=65535 Len=0 MSS=1380 WS=8 TSval=406881248 TSecr=0 SACK_PERM=1
684553 214.687448 244.3.90.239 -> 41.177.98.176 TCP 70 50803 > http [ACK] Seq=1 Ack=1 Win=524280 Len=0 TSval=406881248 TSecr=1562028
684647 214.741966 244.3.90.239 -> 41.177.98.176 TCP 70 50803 > http [ACK] Seq=612 Ack=2737 Win=523944 Len=0 TSval=406881249 TSecr=1562033
684648 214.742108 244.3.90.239 -> 41.177.98.176 TCP 70 50803 > http [ACK] Seq=612 Ack=4105 Win=522576 Len=0 TSval=406881249 TSecr=1562033
684652 214.743061 244.3.90.239 -> 41.177.98.176 TCP 70 50803 > http [ACK] Seq=612 Ack=5310 Win=524104 Len=0 TSval=406881249 TSecr=1562033
684685 214.771725 244.3.90.239 -> 41.177.98.176 TCP 70 50803 > http [ACK] Seq=612 Ack=7706 Win=524280 Len=0 TSval=406881249 TSecr=1562036
684686 214.771730 244.3.90.239 -> 41.177.98.176 TCP 70 50803 > http [ACK] Seq=612 Ack=7711 Win=524272 Len=0 TSval=406881249 TSecr=1562036
691856 218.370192 244.3.90.239 -> 41.177.98.176 TCP 70 50803 > http [ACK] Seq=1283 Ack=7879 Win=524280 Len=0 TSval=406881285 TSecr=1562396
727570 233.372406 244.3.90.239 -> 41.177.98.176 TCP 70 50803 > http [ACK] Seq=1283 Ack=7880 Win=524280 Len=0 TSval=406881435 TSecr=1563897
769209 248.909101 244.3.90.239 -> 41.177.98.176 TCP 70 50803 > http [FIN, ACK] Seq=1283 Ack=7880 Win=524280 Len=0 TSval=406881590 TSecr=1563897
