50364  20.500993 244.3.31.145 -> 41.177.98.98 TCP 222 rtps-discovery > 41017 [PSH, ACK] Seq=1 Ack=360 Win=49640 Len=164
241292  83.996650 244.3.31.145 -> 41.177.98.98 TCP 222 rtps-discovery > 41017 [PSH, ACK] Seq=165 Ack=747 Win=49640 Len=164
387228 129.059318 244.3.31.145 -> 41.177.98.98 TCP 70 rtps-discovery > 41214 [SYN, ACK] Seq=0 Ack=1 Win=49640 Len=0 MSS=1460 WS=1 SACK_PERM=1
387231 129.059681 244.3.31.145 -> 41.177.98.98 TCP 64 rtps-discovery > 41214 [ACK] Seq=1 Ack=139 Win=49502 Len=0
387957 129.531066 244.3.31.145 -> 41.177.98.98 TCP 161 rtps-discovery > 41214 [PSH, ACK] Seq=1 Ack=139 Win=49640 Len=103
387960 129.531785 244.3.31.145 -> 41.177.98.98 TCP 64 rtps-discovery > 41214 [ACK] Seq=104 Ack=334 Win=49640 Len=0
388089 129.607121 244.3.31.145 -> 41.177.98.98 TCP 126 rtps-discovery > 41214 [PSH, ACK] Seq=104 Ack=334 Win=49640 Len=68
390848 130.632831 244.3.31.145 -> 41.177.98.98 TCP 126 rtps-discovery > 41214 [PSH, ACK] Seq=172 Ack=529 Win=49640 Len=68
397106 133.319109 244.3.31.145 -> 41.177.98.98 TCP 129 rtps-discovery > 41214 [PSH, ACK] Seq=240 Ack=727 Win=49640 Len=71
397473 133.633401 244.3.31.145 -> 41.177.98.98 TCP 129 rtps-discovery > 41214 [PSH, ACK] Seq=311 Ack=925 Win=49640 Len=71
397547 133.692428 244.3.31.145 -> 41.177.98.98 TCP 128 rtps-discovery > 41214 [PSH, ACK] Seq=382 Ack=1122 Win=49640 Len=70
