469950 155.118743  244.3.56.90 -> 244.3.160.239 TCP 66 14099 > http [SYN] Seq=0 Win=65535 Len=0 MSS=1380 SACK_PERM=1
469952 155.119371  244.3.56.90 -> 244.3.160.239 TCP 64 14099 > http [ACK] Seq=1 Ack=1 Win=65535 Len=0
470016 155.128360  244.3.56.90 -> 244.3.160.239 TCP 64 14099 > http [ACK] Seq=1490 Ack=839 Win=64698 Len=0
470017 155.128522  244.3.56.90 -> 244.3.160.239 TCP 64 14099 > http [FIN, ACK] Seq=1490 Ack=839 Win=64698 Len=0
470226 155.228068  244.3.56.90 -> 244.3.160.239 TCP 66 11296 > http [SYN] Seq=0 Win=65535 Len=0 MSS=1380 SACK_PERM=1
470228 155.228874  244.3.56.90 -> 244.3.160.239 TCP 64 11296 > http [ACK] Seq=1 Ack=1 Win=65535 Len=0
470252 155.236399  244.3.56.90 -> 244.3.160.239 TCP 64 11296 > http [ACK] Seq=1542 Ack=758 Win=64779 Len=0
470253 155.236662  244.3.56.90 -> 244.3.160.239 TCP 64 11296 > http [FIN, ACK] Seq=1542 Ack=758 Win=64779 Len=0
470273 155.252110  244.3.56.90 -> 244.3.160.239 TCP 66 11927 > http [SYN] Seq=0 Win=65535 Len=0 MSS=1380 SACK_PERM=1
470279 155.252925  244.3.56.90 -> 244.3.160.239 TCP 64 11927 > http [ACK] Seq=1 Ack=1 Win=65535 Len=0
470630 155.398949  244.3.56.90 -> 244.3.160.239 TCP 64 11927 > http [ACK] Seq=4829 Ack=2761 Win=65535 Len=0
470631 155.398954  244.3.56.90 -> 244.3.160.239 TCP 70 [TCP Dup ACK 470630#1] 11927 > http [ACK] Seq=4829 Ack=2761 Win=65535 Len=0 SLE=3553 SRE=4042
470632 155.398991  244.3.56.90 -> 244.3.160.239 TCP 70 [TCP Dup ACK 470630#2] 11927 > http [ACK] Seq=4829 Ack=2761 Win=65535 Len=0 SLE=3553 SRE=4043
470633 155.399029  244.3.56.90 -> 244.3.160.239 TCP 64 11927 > http [ACK] Seq=4829 Ack=4043 Win=64254 Len=0
470634 155.399261  244.3.56.90 -> 244.3.160.239 TCP 64 11927 > http [FIN, ACK] Seq=4829 Ack=4043 Win=64254 Len=0
470655 155.414089  244.3.56.90 -> 244.3.160.239 TCP 66 7387 > http [SYN] Seq=0 Win=65535 Len=0 MSS=1380 SACK_PERM=1
470657 155.414742  244.3.56.90 -> 244.3.160.239 TCP 64 7387 > http [ACK] Seq=1 Ack=1 Win=65535 Len=0
470957 155.521306  244.3.56.90 -> 244.3.160.239 TCP 64 7387 > http [ACK] Seq=4819 Ack=415 Win=65122 Len=0
470960 155.521432  244.3.56.90 -> 244.3.160.239 TCP 64 7387 > http [FIN, ACK] Seq=4819 Ack=415 Win=65122 Len=0
470983 155.531753  244.3.56.90 -> 244.3.160.239 TCP 66 5981 > http [SYN] Seq=0 Win=65535 Len=0 MSS=1380 SACK_PERM=1
470986 155.532340  244.3.56.90 -> 244.3.160.239 TCP 64 5981 > http [ACK] Seq=1 Ack=1 Win=65535 Len=0
470993 155.532842  244.3.56.90 -> 244.3.160.239 TCP 93 [TCP segment of a reassembled PDU]
471229 155.619854  244.3.56.90 -> 244.3.160.239 TCP 64 5981 > http [ACK] Seq=1416 Ack=475 Win=65062 Len=0
471230 155.619988  244.3.56.90 -> 244.3.160.239 TCP 64 5981 > http [FIN, ACK] Seq=1416 Ack=475 Win=65062 Len=0
471239 155.634147  244.3.56.90 -> 244.3.160.239 TCP 66 15811 > http [SYN] Seq=0 Win=65535 Len=0 MSS=1380 SACK_PERM=1
471242 155.634804  244.3.56.90 -> 244.3.160.239 TCP 64 15811 > http [ACK] Seq=1 Ack=1 Win=65535 Len=0
471629 155.775388  244.3.56.90 -> 244.3.160.239 TCP 70 15811 > http [ACK] Seq=4757 Ack=1381 Win=65535 Len=0 SLE=1783 SRE=1784
471630 155.775393  244.3.56.90 -> 244.3.160.239 TCP 64 15811 > http [ACK] Seq=4757 Ack=1784 Win=65133 Len=0
471631 155.775766  244.3.56.90 -> 244.3.160.239 TCP 64 15811 > http [FIN, ACK] Seq=4757 Ack=1784 Win=65133 Len=0
471645 155.777767  244.3.56.90 -> 244.3.160.239 TCP 66 16059 > http [SYN] Seq=0 Win=65535 Len=0 MSS=1380 SACK_PERM=1
471650 155.778342  244.3.56.90 -> 244.3.160.239 TCP 64 16059 > http [ACK] Seq=1 Ack=1 Win=65535 Len=0
472190 155.889324  244.3.56.90 -> 244.3.160.239 TCP 64 16059 > http [ACK] Seq=6005 Ack=1338 Win=64199 Len=0
472192 155.889467  244.3.56.90 -> 244.3.160.239 TCP 64 16059 > http [FIN, ACK] Seq=6005 Ack=1338 Win=64199 Len=0
472256 155.903546  244.3.56.90 -> 244.3.160.239 TCP 66 14112 > http [SYN] Seq=0 Win=65535 Len=0 MSS=1380 SACK_PERM=1
472258 155.904197  244.3.56.90 -> 244.3.160.239 TCP 64 14112 > http [ACK] Seq=1 Ack=1 Win=65535 Len=0
473335 156.116699  244.3.56.90 -> 244.3.160.239 TCP 64 14112 > http [ACK] Seq=2339 Ack=378 Win=65159 Len=0
473337 156.117127  244.3.56.90 -> 244.3.160.239 TCP 64 14112 > http [FIN, ACK] Seq=2339 Ack=378 Win=65159 Len=0
473412 156.128208  244.3.56.90 -> 244.3.160.239 TCP 66 7751 > http [SYN] Seq=0 Win=65535 Len=0 MSS=1380 SACK_PERM=1
473417 156.129051  244.3.56.90 -> 244.3.160.239 TCP 64 7751 > http [ACK] Seq=1 Ack=1 Win=65535 Len=0
476400 157.252152  244.3.56.90 -> 244.3.160.239 TCP 64 7751 > http [ACK] Seq=1598 Ack=2050 Win=65535 Len=0
476472 157.268300  244.3.56.90 -> 244.3.160.239 TCP 66 gaia > http [SYN] Seq=0 Win=65535 Len=0 MSS=1380 SACK_PERM=1
476476 157.268929  244.3.56.90 -> 244.3.160.239 TCP 64 gaia > http [ACK] Seq=1 Ack=1 Win=65535 Len=0
476486 157.273932  244.3.56.90 -> 244.3.160.239 TCP 66 isi-irp > http [SYN] Seq=0 Win=65535 Len=0 MSS=1380 SACK_PERM=1
476490 157.274583  244.3.56.90 -> 244.3.160.239 TCP 64 isi-irp > http [ACK] Seq=1 Ack=1 Win=65535 Len=0
476529 157.281302  244.3.56.90 -> 244.3.160.239 TCP 64 7751 > http [ACK] Seq=1598 Ack=4415 Win=65535 Len=0
476545 157.283201  244.3.56.90 -> 244.3.160.239 TCP 64 7751 > http [ACK] Seq=1598 Ack=6464 Win=65535 Len=0
476548 157.284223  244.3.56.90 -> 244.3.160.239 TCP 64 7751 > http [ACK] Seq=1598 Ack=8409 Win=65535 Len=0
476583 157.313607  244.3.56.90 -> 244.3.160.239 TCP 64 7751 > http [ACK] Seq=1598 Ack=10458 Win=65535 Len=0
476587 157.315663  244.3.56.90 -> 244.3.160.239 TCP 64 7751 > http [ACK] Seq=1598 Ack=12672 Win=65535 Len=0
476592 157.316824  244.3.56.90 -> 244.3.160.239 TCP 64 7751 > http [ACK] Seq=1598 Ack=14441 Win=65535 Len=0
476661 157.334300  244.3.56.90 -> 244.3.160.239 TCP 64 7751 > http [ACK] Seq=1598 Ack=16561 Win=65535 Len=0
476738 157.345545  244.3.56.90 -> 244.3.160.239 TCP 64 7751 > http [ACK] Seq=1598 Ack=18179 Win=65535 Len=0
476751 157.347169  244.3.56.90 -> 244.3.160.239 TCP 64 7751 > http [ACK] Seq=1598 Ack=20228 Win=65535 Len=0
476761 157.348566  244.3.56.90 -> 244.3.160.239 TCP 64 7751 > http [ACK] Seq=1598 Ack=22277 Win=65535 Len=0
476775 157.353035  244.3.56.90 -> 244.3.160.239 TCP 64 isi-irp > http [ACK] Seq=1011 Ack=2050 Win=65535 Len=0
476779 157.354207  244.3.56.90 -> 244.3.160.239 TCP 64 isi-irp > http [ACK] Seq=1011 Ack=4099 Win=65535 Len=0
476792 157.363931  244.3.56.90 -> 244.3.160.239 TCP 64 7751 > http [ACK] Seq=1598 Ack=24022 Win=65535 Len=0
476798 157.365366  244.3.56.90 -> 244.3.160.239 TCP 64 7751 > http [ACK] Seq=1598 Ack=26071 Win=65535 Len=0
476800 157.366139  244.3.56.90 -> 244.3.160.239 TCP 64 7751 > http [ACK] Seq=1598 Ack=27941 Win=65535 Len=0
476837 157.376831  244.3.56.90 -> 244.3.160.239 TCP 64 7751 > http [ACK] Seq=1598 Ack=29990 Win=65535 Len=0
476841 157.378620  244.3.56.90 -> 244.3.160.239 TCP 64 7751 > http [ACK] Seq=1598 Ack=32076 Win=65535 Len=0
476846 157.380071  244.3.56.90 -> 244.3.160.239 TCP 64 7751 > http [ACK] Seq=1598 Ack=34131 Win=65535 Len=0
476849 157.381848  244.3.56.90 -> 244.3.160.239 TCP 64 7751 > http [ACK] Seq=1598 Ack=36186 Win=65535 Len=0
476859 157.383009  244.3.56.90 -> 244.3.160.239 TCP 64 7751 > http [ACK] Seq=1598 Ack=37673 Win=65535 Len=0
476871 157.385388  244.3.56.90 -> 244.3.160.239 TCP 64 isi-irp > http [ACK] Seq=1011 Ack=5762 Win=65535 Len=0
476876 157.386698  244.3.56.90 -> 244.3.160.239 TCP 64 isi-irp > http [ACK] Seq=1011 Ack=7811 Win=65535 Len=0
476877 157.387343  244.3.56.90 -> 244.3.160.239 TCP 64 isi-irp > http [ACK] Seq=1011 Ack=9640 Win=65535 Len=0
476896 157.396362  244.3.56.90 -> 244.3.160.239 TCP 64 7751 > http [ACK] Seq=1598 Ack=39732 Win=65535 Len=0
476899 157.398194  244.3.56.90 -> 244.3.160.239 TCP 64 7751 > http [ACK] Seq=1598 Ack=42026 Win=65535 Len=0
476906 157.399614  244.3.56.90 -> 244.3.160.239 TCP 64 7751 > http [ACK] Seq=1598 Ack=44075 Win=65535 Len=0
476924 157.408893  244.3.56.90 -> 244.3.160.239 TCP 64 7751 > http [ACK] Seq=1598 Ack=45903 Win=65535 Len=0
476927 157.410459  244.3.56.90 -> 244.3.160.239 TCP 64 7751 > http [ACK] Seq=1598 Ack=47952 Win=65535 Len=0
476935 157.412098  244.3.56.90 -> 244.3.160.239 TCP 64 7751 > http [ACK] Seq=1598 Ack=50043 Win=65535 Len=0
476939 157.413827  244.3.56.90 -> 244.3.160.239 TCP 64 7751 > http [ACK] Seq=1598 Ack=52092 Win=65535 Len=0
476946 157.415391  244.3.56.90 -> 244.3.160.239 TCP 64 7751 > http [ACK] Seq=1598 Ack=54157 Win=65535 Len=0
476951 157.417028  244.3.56.90 -> 244.3.160.239 TCP 64 7751 > http [ACK] Seq=1598 Ack=56206 Win=65535 Len=0
476957 157.417993  244.3.56.90 -> 244.3.160.239 TCP 64 isi-irp > http [ACK] Seq=1011 Ack=11689 Win=65535 Len=0
476962 157.418728  244.3.56.90 -> 244.3.160.239 TCP 64 7751 > http [ACK] Seq=1598 Ack=58307 Win=65535 Len=0
476963 157.419187  244.3.56.90 -> 244.3.160.239 TCP 64 isi-irp > http [ACK] Seq=1011 Ack=13666 Win=65535 Len=0
476964 157.419221  244.3.56.90 -> 244.3.160.239 TCP 64 isi-irp > http [ACK] Seq=1011 Ack=13667 Win=65535 Len=0
476965 157.419430  244.3.56.90 -> 244.3.160.239 TCP 64 isi-irp > http [FIN, ACK] Seq=1011 Ack=13667 Win=65535 Len=0
476970 157.420495  244.3.56.90 -> 244.3.160.239 TCP 64 7751 > http [ACK] Seq=1598 Ack=60424 Win=65535 Len=0
476971 157.420642  244.3.56.90 -> 244.3.160.239 TCP 64 7751 > http [ACK] Seq=1598 Ack=61165 Win=64794 Len=0
477015 157.427427  244.3.56.90 -> 244.3.160.239 TCP 64 7751 > http [ACK] Seq=1598 Ack=63249 Win=65535 Len=0
477023 157.429064  244.3.56.90 -> 244.3.160.239 TCP 64 7751 > http [ACK] Seq=1598 Ack=65298 Win=65535 Len=0
477026 157.432590  244.3.56.90 -> 244.3.160.239 TCP 66 11454 > http [SYN] Seq=0 Win=65535 Len=0 MSS=1380 SACK_PERM=1
477028 157.433338  244.3.56.90 -> 244.3.160.239 TCP 64 11454 > http [ACK] Seq=1 Ack=1 Win=65535 Len=0
477055 157.442573  244.3.56.90 -> 244.3.160.239 TCP 64 7751 > http [ACK] Seq=1598 Ack=67984 Win=65535 Len=0
477068 157.443405  244.3.56.90 -> 244.3.160.239 TCP 64 7751 > http [ACK] Seq=1598 Ack=69672 Win=65535 Len=0
477071 157.444016  244.3.56.90 -> 244.3.160.239 TCP 64 gaia > http [ACK] Seq=719 Ack=1596 Win=65535 Len=0
477072 157.444164  244.3.56.90 -> 244.3.160.239 TCP 64 gaia > http [FIN, ACK] Seq=719 Ack=1622 Win=65509 Len=0
477088 157.445923  244.3.56.90 -> 244.3.160.239 TCP 64 7751 > http [ACK] Seq=1598 Ack=71759 Win=65535 Len=0
477101 157.447985  244.3.56.90 -> 244.3.160.239 TCP 64 7751 > http [ACK] Seq=1598 Ack=74034 Win=65535 Len=0
477111 157.449700  244.3.56.90 -> 244.3.160.239 TCP 64 7751 > http [ACK] Seq=1598 Ack=76122 Win=65535 Len=0
477122 157.451795  244.3.56.90 -> 244.3.160.239 TCP 64 7751 > http [ACK] Seq=1598 Ack=78446 Win=65535 Len=0
477130 157.454002  244.3.56.90 -> 244.3.160.239 TCP 64 7751 > http [ACK] Seq=1598 Ack=80738 Win=65535 Len=0
477144 157.455884  244.3.56.90 -> 244.3.160.239 TCP 64 7751 > http [ACK] Seq=1598 Ack=82729 Win=65535 Len=0
477177 157.460621  244.3.56.90 -> 244.3.160.239 TCP 64 7751 > http [ACK] Seq=1598 Ack=84997 Win=65535 Len=0
477182 157.462854  244.3.56.90 -> 244.3.160.239 TCP 64 7751 > http [ACK] Seq=1598 Ack=87260 Win=65535 Len=0
477190 157.464552  244.3.56.90 -> 244.3.160.239 TCP 64 7751 > http [ACK] Seq=1598 Ack=89309 Win=65535 Len=0
477214 157.473021  244.3.56.90 -> 244.3.160.239 TCP 64 7751 > http [ACK] Seq=1598 Ack=91127 Win=65535 Len=0
477215 157.473025  244.3.56.90 -> 244.3.160.239 TCP 64 7751 > http [ACK] Seq=1598 Ack=91929 Win=64733 Len=0
477229 157.477022  244.3.56.90 -> 244.3.160.239 TCP 64 7751 > http [ACK] Seq=1598 Ack=93978 Win=65535 Len=0
477246 157.479531  244.3.56.90 -> 244.3.160.239 TCP 64 7751 > http [ACK] Seq=1598 Ack=96480 Win=65535 Len=0
477265 157.481307  244.3.56.90 -> 244.3.160.239 TCP 64 7751 > http [ACK] Seq=1598 Ack=98575 Win=65535 Len=0
477271 157.483102  244.3.56.90 -> 244.3.160.239 TCP 64 7751 > http [ACK] Seq=1598 Ack=100624 Win=65535 Len=0
477287 157.484618  244.3.56.90 -> 244.3.160.239 TCP 64 7751 > http [ACK] Seq=1598 Ack=102673 Win=65535 Len=0
477306 157.486511  244.3.56.90 -> 244.3.160.239 TCP 64 7751 > http [ACK] Seq=1598 Ack=104722 Win=65535 Len=0
477307 157.486515  244.3.56.90 -> 244.3.160.239 TCP 64 gaia > http [ACK] Seq=720 Ack=1623 Win=65509 Len=0
477319 157.488054  244.3.56.90 -> 244.3.160.239 TCP 64 7751 > http [ACK] Seq=1598 Ack=106548 Win=65535 Len=0
477345 157.491924  244.3.56.90 -> 244.3.160.239 TCP 64 7751 > http [ACK] Seq=1598 Ack=108616 Win=65535 Len=0
477355 157.495744  244.3.56.90 -> 244.3.160.239 TCP 64 7751 > http [ACK] Seq=1598 Ack=110096 Win=65535 Len=0
477365 157.496563  244.3.56.90 -> 244.3.160.239 TCP 64 7751 > http [ACK] Seq=1598 Ack=112009 Win=65535 Len=0
477399 157.504192  244.3.56.90 -> 244.3.160.239 TCP 64 7751 > http [ACK] Seq=1598 Ack=114076 Win=65535 Len=0
477426 157.508558  244.3.56.90 -> 244.3.160.239 TCP 64 7751 > http [ACK] Seq=1598 Ack=116409 Win=65535 Len=0
477428 157.508768  244.3.56.90 -> 244.3.160.239 TCP 64 7751 > http [ACK] Seq=1598 Ack=117406 Win=64538 Len=0
477429 157.508773  244.3.56.90 -> 244.3.160.239 TCP 64 11454 > http [ACK] Seq=985 Ack=2050 Win=65535 Len=0
477433 157.509730  244.3.56.90 -> 244.3.160.239 TCP 64 11454 > http [ACK] Seq=985 Ack=4099 Win=65535 Len=0
477442 157.510784  244.3.56.90 -> 244.3.160.239 TCP 64 7751 > http [ACK] Seq=1598 Ack=119455 Win=65535 Len=0
477461 157.513816  244.3.56.90 -> 244.3.160.239 TCP 64 7751 > http [ACK] Seq=1598 Ack=121761 Win=65535 Len=0
477465 157.515427  244.3.56.90 -> 244.3.160.239 TCP 64 7751 > http [ACK] Seq=1598 Ack=123810 Win=65535 Len=0
477472 157.517246  244.3.56.90 -> 244.3.160.239 TCP 64 7751 > http [ACK] Seq=1598 Ack=125859 Win=65535 Len=0
477484 157.518653  244.3.56.90 -> 244.3.160.239 TCP 64 7751 > http [ACK] Seq=1598 Ack=127908 Win=65535 Len=0
477492 157.520451  244.3.56.90 -> 244.3.160.239 TCP 64 7751 > http [ACK] Seq=1598 Ack=129958 Win=65535 Len=0
477520 157.523985  244.3.56.90 -> 244.3.160.239 TCP 64 7751 > http [ACK] Seq=1598 Ack=131896 Win=65535 Len=0
477528 157.525677  244.3.56.90 -> 244.3.160.239 TCP 64 7751 > http [ACK] Seq=1598 Ack=133945 Win=65535 Len=0
477549 157.535967  244.3.56.90 -> 244.3.160.239 TCP 64 7751 > http [ACK] Seq=1598 Ack=135845 Win=65535 Len=0
477553 157.536756  244.3.56.90 -> 244.3.160.239 TCP 64 7751 > http [ACK] Seq=1598 Ack=137637 Win=65535 Len=0
477561 157.538524  244.3.56.90 -> 244.3.160.239 TCP 64 11454 > http [ACK] Seq=985 Ack=5779 Win=65535 Len=0
477567 157.539790  244.3.56.90 -> 244.3.160.239 TCP 64 11454 > http [ACK] Seq=985 Ack=7828 Win=65535 Len=0
477572 157.540469  244.3.56.90 -> 244.3.160.239 TCP 64 11454 > http [ACK] Seq=985 Ack=9630 Win=65535 Len=0
477574 157.540960  244.3.56.90 -> 244.3.160.239 TCP 64 7751 > http [ACK] Seq=1598 Ack=139686 Win=65535 Len=0
477583 157.542763  244.3.56.90 -> 244.3.160.239 TCP 64 7751 > http [ACK] Seq=1598 Ack=141738 Win=65535 Len=0
477593 157.544801  244.3.56.90 -> 244.3.160.239 TCP 64 7751 > http [ACK] Seq=1598 Ack=144090 Win=65535 Len=0
477611 157.546846  244.3.56.90 -> 244.3.160.239 TCP 64 7751 > http [ACK] Seq=1598 Ack=146420 Win=65535 Len=0
477625 157.548834  244.3.56.90 -> 244.3.160.239 TCP 64 7751 > http [ACK] Seq=1598 Ack=148577 Win=65535 Len=0
477630 157.550465  244.3.56.90 -> 244.3.160.239 TCP 64 7751 > http [ACK] Seq=1598 Ack=150626 Win=65535 Len=0
477636 157.552066  244.3.56.90 -> 244.3.160.239 TCP 64 7751 > http [ACK] Seq=1598 Ack=152675 Win=65535 Len=0
477645 157.553872  244.3.56.90 -> 244.3.160.239 TCP 64 7751 > http [ACK] Seq=1598 Ack=154724 Win=65535 Len=0
477658 157.556072  244.3.56.90 -> 244.3.160.239 TCP 64 7751 > http [ACK] Seq=1598 Ack=156798 Win=65535 Len=0
477702 157.567251  244.3.56.90 -> 244.3.160.239 TCP 64 7751 > http [ACK] Seq=1598 Ack=159044 Win=65535 Len=0
477703 157.567309  244.3.56.90 -> 244.3.160.239 TCP 70 [TCP Dup ACK 477702#1] 7751 > http [ACK] Seq=1598 Ack=159044 Win=65535 Len=0 SLE=159869 SRE=160066
477704 157.567483  244.3.56.90 -> 244.3.160.239 TCP 64 7751 > http [ACK] Seq=1598 Ack=160066 Win=64513 Len=0
477715 157.569432  244.3.56.90 -> 244.3.160.239 TCP 64 11454 > http [ACK] Seq=985 Ack=11679 Win=65535 Len=0
477729 157.570661  244.3.56.90 -> 244.3.160.239 TCP 64 11454 > http [ACK] Seq=985 Ack=13728 Win=65535 Len=0
477740 157.571701  244.3.56.90 -> 244.3.160.239 TCP 64 11454 > http [ACK] Seq=985 Ack=15511 Win=65535 Len=0
477749 157.572270  244.3.56.90 -> 244.3.160.239 TCP 64 7751 > http [ACK] Seq=1598 Ack=162164 Win=65535 Len=0
477769 157.575220  244.3.56.90 -> 244.3.160.239 TCP 64 7751 > http [ACK] Seq=1598 Ack=164323 Win=65535 Len=0
477783 157.577044  244.3.56.90 -> 244.3.160.239 TCP 64 7751 > http [ACK] Seq=1598 Ack=166372 Win=65535 Len=0
477795 157.578565  244.3.56.90 -> 244.3.160.239 TCP 64 7751 > http [ACK] Seq=1598 Ack=168421 Win=65535 Len=0
477805 157.580033  244.3.56.90 -> 244.3.160.239 TCP 64 7751 > http [ACK] Seq=1598 Ack=170470 Win=65535 Len=0
477822 157.582074  244.3.56.90 -> 244.3.160.239 TCP 64 7751 > http [ACK] Seq=1598 Ack=172803 Win=65535 Len=0
477835 157.583932  244.3.56.90 -> 244.3.160.239 TCP 70 11454 > http [ACK] Seq=985 Ack=16891 Win=65535 Len=0 SLE=17560 SRE=17822
477836 157.583937  244.3.56.90 -> 244.3.160.239 TCP 64 11454 > http [ACK] Seq=985 Ack=17822 Win=64604 Len=0
477844 157.585311  244.3.56.90 -> 244.3.160.239 TCP 64 7751 > http [ACK] Seq=1598 Ack=174858 Win=65535 Len=0
477847 157.587296  244.3.56.90 -> 244.3.160.239 TCP 64 7751 > http [ACK] Seq=1598 Ack=176983 Win=65535 Len=0
477853 157.588859  244.3.56.90 -> 244.3.160.239 TCP 64 7751 > http [ACK] Seq=1598 Ack=179062 Win=65535 Len=0
477929 157.599815  244.3.56.90 -> 244.3.160.239 TCP 64 7751 > http [ACK] Seq=1598 Ack=181227 Win=65535 Len=0
477935 157.600611  244.3.56.90 -> 244.3.160.239 TCP 64 7751 > http [ACK] Seq=1598 Ack=182915 Win=65535 Len=0
477958 157.602315  244.3.56.90 -> 244.3.160.239 TCP 64 11454 > http [ACK] Seq=985 Ack=19871 Win=65535 Len=0
477991 157.603969  244.3.56.90 -> 244.3.160.239 TCP 64 11454 > http [ACK] Seq=985 Ack=21920 Win=65535 Len=0
478004 157.604585  244.3.56.90 -> 244.3.160.239 TCP 64 11454 > http [ACK] Seq=985 Ack=22892 Win=64564 Len=0
478005 157.604590  244.3.56.90 -> 244.3.160.239 TCP 64 11454 > http [FIN, ACK] Seq=985 Ack=22892 Win=64564 Len=0
478041 157.607406  244.3.56.90 -> 244.3.160.239 TCP 64 7751 > http [ACK] Seq=1598 Ack=185150 Win=65535 Len=0
478064 157.609228  244.3.56.90 -> 244.3.160.239 TCP 64 7751 > http [ACK] Seq=1598 Ack=187199 Win=65535 Len=0
478091 157.611095  244.3.56.90 -> 244.3.160.239 TCP 64 7751 > http [ACK] Seq=1598 Ack=189248 Win=65535 Len=0
478104 157.612973  244.3.56.90 -> 244.3.160.239 TCP 64 7751 > http [ACK] Seq=1598 Ack=191315 Win=65535 Len=0
478117 157.614472  244.3.56.90 -> 244.3.160.239 TCP 64 7751 > http [ACK] Seq=1598 Ack=193364 Win=65535 Len=0
478496 157.665955  244.3.56.90 -> 244.3.160.239 TCP 66 14544 > http [SYN] Seq=0 Win=65535 Len=0 MSS=1380 SACK_PERM=1
478502 157.666635  244.3.56.90 -> 244.3.160.239 TCP 64 14544 > http [ACK] Seq=1 Ack=1 Win=65535 Len=0
478947 157.740235  244.3.56.90 -> 244.3.160.239 TCP 64 7751 > http [ACK] Seq=1598 Ack=193684 Win=65215 Len=0
478948 157.740238  244.3.56.90 -> 244.3.160.239 TCP 64 14544 > http [ACK] Seq=983 Ack=2050 Win=65535 Len=0
478957 157.741682  244.3.56.90 -> 244.3.160.239 TCP 70 14544 > http [ACK] Seq=983 Ack=3430 Win=65535 Len=0 SLE=4099 SRE=4361
478958 157.741687  244.3.56.90 -> 244.3.160.239 TCP 64 14544 > http [ACK] Seq=983 Ack=4361 Win=64604 Len=0
479025 157.770431  244.3.56.90 -> 244.3.160.239 TCP 64 14544 > http [ACK] Seq=983 Ack=6410 Win=65535 Len=0
479031 157.771532  244.3.56.90 -> 244.3.160.239 TCP 64 14544 > http [ACK] Seq=983 Ack=8171 Win=65535 Len=0
479050 157.783305  244.3.56.90 -> 244.3.160.239 TCP 64 14544 > http [ACK] Seq=983 Ack=9616 Win=65535 Len=0
479109 157.800805  244.3.56.90 -> 244.3.160.239 TCP 64 14544 > http [ACK] Seq=983 Ack=11665 Win=65535 Len=0
479112 157.802147  244.3.56.90 -> 244.3.160.239 TCP 64 14544 > http [ACK] Seq=983 Ack=13714 Win=65535 Len=0
479118 157.803604  244.3.56.90 -> 244.3.160.239 TCP 64 14544 > http [ACK] Seq=983 Ack=15763 Win=65535 Len=0
479121 157.804929  244.3.56.90 -> 244.3.160.239 TCP 64 14544 > http [ACK] Seq=983 Ack=17797 Win=65535 Len=0
479218 157.834973  244.3.56.90 -> 244.3.160.239 TCP 64 14544 > http [ACK] Seq=983 Ack=19846 Win=65535 Len=0
479224 157.836273  244.3.56.90 -> 244.3.160.239 TCP 64 14544 > http [ACK] Seq=983 Ack=21895 Win=65535 Len=0
479230 157.837551  244.3.56.90 -> 244.3.160.239 TCP 64 14544 > http [ACK] Seq=983 Ack=23944 Win=65535 Len=0
479235 157.838452  244.3.56.90 -> 244.3.160.239 TCP 64 14544 > http [ACK] Seq=983 Ack=25423 Win=65535 Len=0
479236 157.838457  244.3.56.90 -> 244.3.160.239 TCP 64 14544 > http [ACK] Seq=983 Ack=25424 Win=65535 Len=0
479237 157.838542  244.3.56.90 -> 244.3.160.239 TCP 64 14544 > http [FIN, ACK] Seq=983 Ack=25424 Win=65535 Len=0
479274 157.859611  244.3.56.90 -> 244.3.160.239 TCP 66 15410 > http [SYN] Seq=0 Win=65535 Len=0 MSS=1380 SACK_PERM=1
479277 157.860407  244.3.56.90 -> 244.3.160.239 TCP 64 15410 > http [ACK] Seq=1 Ack=1 Win=65535 Len=0
479567 157.972194  244.3.56.90 -> 244.3.160.239 TCP 70 15410 > http [ACK] Seq=991 Ack=1381 Win=65535 Len=0 SLE=2050 SRE=2148
479568 157.972267  244.3.56.90 -> 244.3.160.239 TCP 64 15410 > http [ACK] Seq=991 Ack=2149 Win=64768 Len=0
479570 157.972469  244.3.56.90 -> 244.3.160.239 TCP 64 15410 > http [FIN, ACK] Seq=991 Ack=2149 Win=64768 Len=0
479629 158.011071  244.3.56.90 -> 244.3.160.239 TCP 66 10145 > http [SYN] Seq=0 Win=65535 Len=0 MSS=1380 SACK_PERM=1
479631 158.011663  244.3.56.90 -> 244.3.160.239 TCP 64 10145 > http [ACK] Seq=1 Ack=1 Win=65535 Len=0
480672 158.505394  244.3.56.90 -> 244.3.160.239 TCP 64 7751 > http [ACK] Seq=1598 Ack=195733 Win=65535 Len=0
480691 158.507604  244.3.56.90 -> 244.3.160.239 TCP 64 7751 > http [ACK] Seq=1598 Ack=197976 Win=65535 Len=0
480705 158.510017  244.3.56.90 -> 244.3.160.239 TCP 64 7751 > http [ACK] Seq=1598 Ack=200176 Win=65535 Len=0
480709 158.511646  244.3.56.90 -> 244.3.160.239 TCP 64 7751 > http [ACK] Seq=1598 Ack=202260 Win=65535 Len=0
480718 158.513604  244.3.56.90 -> 244.3.160.239 TCP 64 7751 > http [ACK] Seq=1598 Ack=204445 Win=65535 Len=0
480730 158.515315  244.3.56.90 -> 244.3.160.239 TCP 64 7751 > http [ACK] Seq=1598 Ack=206494 Win=65535 Len=0
480737 158.517092  244.3.56.90 -> 244.3.160.239 TCP 64 7751 > http [ACK] Seq=1598 Ack=208556 Win=65535 Len=0
480748 158.518901  244.3.56.90 -> 244.3.160.239 TCP 64 7751 > http [ACK] Seq=1598 Ack=210605 Win=65535 Len=0
480757 158.520749  244.3.56.90 -> 244.3.160.239 TCP 64 7751 > http [ACK] Seq=1598 Ack=212654 Win=65535 Len=0
480761 158.522373  244.3.56.90 -> 244.3.160.239 TCP 64 7751 > http [ACK] Seq=1598 Ack=214703 Win=65535 Len=0
480765 158.524358  244.3.56.90 -> 244.3.160.239 TCP 64 7751 > http [ACK] Seq=1598 Ack=216921 Win=65535 Len=0
480768 158.525472  244.3.56.90 -> 244.3.160.239 TCP 64 7751 > http [ACK] Seq=1598 Ack=218485 Win=65535 Len=0
480794 158.537558  244.3.56.90 -> 244.3.160.239 TCP 64 7751 > http [ACK] Seq=1598 Ack=220534 Win=65535 Len=0
480798 158.539506  244.3.56.90 -> 244.3.160.239 TCP 64 7751 > http [ACK] Seq=1598 Ack=222653 Win=65535 Len=0
480817 158.541005  244.3.56.90 -> 244.3.160.239 TCP 64 7751 > http [ACK] Seq=1598 Ack=224325 Win=65535 Len=0
480860 158.545821  244.3.56.90 -> 244.3.160.239 TCP 64 7751 > http [ACK] Seq=1598 Ack=226421 Win=65535 Len=0
480873 158.547639  244.3.56.90 -> 244.3.160.239 TCP 64 7751 > http [ACK] Seq=1598 Ack=228571 Win=65535 Len=0
480888 158.549489  244.3.56.90 -> 244.3.160.239 TCP 64 7751 > http [ACK] Seq=1598 Ack=230802 Win=65535 Len=0
480896 158.551540  244.3.56.90 -> 244.3.160.239 TCP 64 7751 > http [ACK] Seq=1598 Ack=232851 Win=65535 Len=0
480908 158.553504  244.3.56.90 -> 244.3.160.239 TCP 64 7751 > http [ACK] Seq=1598 Ack=234900 Win=65535 Len=0
480931 158.555390  244.3.56.90 -> 244.3.160.239 TCP 64 7751 > http [ACK] Seq=1598 Ack=236949 Win=65535 Len=0
480941 158.558051  244.3.56.90 -> 244.3.160.239 TCP 64 7751 > http [ACK] Seq=1598 Ack=239001 Win=65535 Len=0
480945 158.560041  244.3.56.90 -> 244.3.160.239 TCP 64 7751 > http [ACK] Seq=1598 Ack=241050 Win=65535 Len=0
480964 158.568269  244.3.56.90 -> 244.3.160.239 TCP 64 7751 > http [ACK] Seq=1598 Ack=243675 Win=65535 Len=0
480970 158.569731  244.3.56.90 -> 244.3.160.239 TCP 64 7751 > http [ACK] Seq=1598 Ack=245724 Win=65535 Len=0
480974 158.571547  244.3.56.90 -> 244.3.160.239 TCP 64 7751 > http [ACK] Seq=1598 Ack=247511 Win=65535 Len=0
480975 158.572103  244.3.56.90 -> 244.3.160.239 TCP 64 7751 > http [ACK] Seq=1598 Ack=248939 Win=65535 Len=0
480990 158.578721  244.3.56.90 -> 244.3.160.239 TCP 64 7751 > http [ACK] Seq=1598 Ack=251015 Win=65535 Len=0
481002 158.581188  244.3.56.90 -> 244.3.160.239 TCP 64 7751 > http [ACK] Seq=1598 Ack=252768 Win=65535 Len=0
481013 158.582997  244.3.56.90 -> 244.3.160.239 TCP 64 7751 > http [ACK] Seq=1598 Ack=254854 Win=65535 Len=0
481031 158.584700  244.3.56.90 -> 244.3.160.239 TCP 64 7751 > http [ACK] Seq=1598 Ack=256903 Win=65535 Len=0
481038 158.587234  244.3.56.90 -> 244.3.160.239 TCP 64 7751 > http [ACK] Seq=1598 Ack=258623 Win=65535 Len=0
481039 158.587403  244.3.56.90 -> 244.3.160.239 TCP 64 7751 > http [ACK] Seq=1598 Ack=259409 Win=64749 Len=0
481047 158.591222  244.3.56.90 -> 244.3.160.239 TCP 64 7751 > http [ACK] Seq=1598 Ack=261494 Win=65535 Len=0
481050 158.593170  244.3.56.90 -> 244.3.160.239 TCP 64 7751 > http [ACK] Seq=1598 Ack=263645 Win=65535 Len=0
481060 158.594693  244.3.56.90 -> 244.3.160.239 TCP 64 7751 > http [ACK] Seq=1598 Ack=265415 Win=65535 Len=0
481096 158.601456  244.3.56.90 -> 244.3.160.239 TCP 64 7751 > http [ACK] Seq=1598 Ack=267486 Win=65535 Len=0
481120 158.603957  244.3.56.90 -> 244.3.160.239 TCP 64 7751 > http [ACK] Seq=1598 Ack=269685 Win=65535 Len=0
481132 158.607367  244.3.56.90 -> 244.3.160.239 TCP 64 7751 > http [ACK] Seq=1598 Ack=271734 Win=65535 Len=0
481140 158.608709  244.3.56.90 -> 244.3.160.239 TCP 64 7751 > http [ACK] Seq=1598 Ack=273647 Win=65535 Len=0
481149 158.611974  244.3.56.90 -> 244.3.160.239 TCP 64 7751 > http [ACK] Seq=1598 Ack=275696 Win=65535 Len=0
481161 158.618023  244.3.56.90 -> 244.3.160.239 TCP 64 7751 > http [ACK] Seq=1598 Ack=277428 Win=65535 Len=0
481162 158.618180  244.3.56.90 -> 244.3.160.239 TCP 64 7751 > http [ACK] Seq=1598 Ack=278709 Win=64254 Len=0
481165 158.618632  244.3.56.90 -> 244.3.160.239 TCP 64 7751 > http [ACK] Seq=1598 Ack=278710 Win=64254 Len=0
481166 158.618880  244.3.56.90 -> 244.3.160.239 TCP 64 7751 > http [FIN, ACK] Seq=1598 Ack=278710 Win=64254 Len=0
491614 162.324733  244.3.56.90 -> 244.3.160.239 TCP 64 10145 > http [ACK] Seq=983 Ack=2050 Win=65535 Len=0
491615 162.324828  244.3.56.90 -> 244.3.160.239 TCP 64 10145 > http [ACK] Seq=983 Ack=2355 Win=65231 Len=0
491616 162.325142  244.3.56.90 -> 244.3.160.239 TCP 64 10145 > http [FIN, ACK] Seq=983 Ack=2355 Win=65231 Len=0
491662 162.341998  244.3.56.90 -> 244.3.160.239 TCP 66 14100 > http [SYN] Seq=0 Win=65535 Len=0 MSS=1380 SACK_PERM=1
491664 162.342687  244.3.56.90 -> 244.3.160.239 TCP 64 14100 > http [ACK] Seq=1 Ack=1 Win=65535 Len=0
491785 162.424977  244.3.56.90 -> 244.3.160.239 TCP 64 14100 > http [ACK] Seq=985 Ack=2050 Win=65535 Len=0
491789 162.426057  244.3.56.90 -> 244.3.160.239 TCP 70 14100 > http [ACK] Seq=985 Ack=3430 Win=65535 Len=0 SLE=4099 SRE=4342
491790 162.426139  244.3.56.90 -> 244.3.160.239 TCP 64 14100 > http [ACK] Seq=985 Ack=4342 Win=64623 Len=0
491849 162.456740  244.3.56.90 -> 244.3.160.239 TCP 64 14100 > http [ACK] Seq=985 Ack=6391 Win=65535 Len=0
491853 162.458183  244.3.56.90 -> 244.3.160.239 TCP 64 14100 > http [ACK] Seq=985 Ack=8440 Win=65535 Len=0
491951 162.489471  244.3.56.90 -> 244.3.160.239 TCP 64 14100 > http [ACK] Seq=985 Ack=11001 Win=65535 Len=0
491957 162.490671  244.3.56.90 -> 244.3.160.239 TCP 64 14100 > http [ACK] Seq=985 Ack=13050 Win=65535 Len=0
491963 162.492145  244.3.56.90 -> 244.3.160.239 TCP 64 14100 > http [ACK] Seq=985 Ack=15099 Win=65535 Len=0
492001 162.503713  244.3.56.90 -> 244.3.160.239 TCP 64 14100 > http [ACK] Seq=985 Ack=16837 Win=65535 Len=0
492002 162.503718  244.3.56.90 -> 244.3.160.239 TCP 70 [TCP Dup ACK 492001#1] 14100 > http [ACK] Seq=985 Ack=16837 Win=65535 Len=0 SLE=17506 SRE=17827
492003 162.503723  244.3.56.90 -> 244.3.160.239 TCP 64 14100 > http [ACK] Seq=985 Ack=17827 Win=64545 Len=0
492074 162.522481  244.3.56.90 -> 244.3.160.239 TCP 64 14100 > http [ACK] Seq=985 Ack=19876 Win=65535 Len=0
492077 162.523797  244.3.56.90 -> 244.3.160.239 TCP 64 14100 > http [ACK] Seq=985 Ack=21925 Win=65535 Len=0
492080 162.524969  244.3.56.90 -> 244.3.160.239 TCP 64 14100 > http [ACK] Seq=985 Ack=23676 Win=65535 Len=0
492106 162.536454  244.3.56.90 -> 244.3.160.239 TCP 64 14100 > http [ACK] Seq=985 Ack=25725 Win=65535 Len=0
492125 162.537761  244.3.56.90 -> 244.3.160.239 TCP 64 14100 > http [ACK] Seq=985 Ack=27774 Win=65535 Len=0
492134 162.539241  244.3.56.90 -> 244.3.160.239 TCP 64 14100 > http [ACK] Seq=985 Ack=29823 Win=65535 Len=0
492213 162.555127  244.3.56.90 -> 244.3.160.239 TCP 64 14100 > http [ACK] Seq=985 Ack=31784 Win=65535 Len=0
492214 162.555132  244.3.56.90 -> 244.3.160.239 TCP 70 [TCP Dup ACK 492213#1] 14100 > http [ACK] Seq=985 Ack=31784 Win=65535 Len=0 SLE=32453 SRE=32764
492215 162.555136  244.3.56.90 -> 244.3.160.239 TCP 64 14100 > http [ACK] Seq=985 Ack=32764 Win=64555 Len=0
492235 162.558481  244.3.56.90 -> 244.3.160.239 TCP 64 14100 > http [ACK] Seq=985 Ack=34813 Win=65535 Len=0
492238 162.559598  244.3.56.90 -> 244.3.160.239 TCP 64 14100 > http [ACK] Seq=985 Ack=36862 Win=65535 Len=0
492247 162.560677  244.3.56.90 -> 244.3.160.239 TCP 64 14100 > http [ACK] Seq=985 Ack=38596 Win=65535 Len=0
492280 162.569412  244.3.56.90 -> 244.3.160.239 TCP 64 14100 > http [ACK] Seq=985 Ack=40645 Win=65535 Len=0
492284 162.571023  244.3.56.90 -> 244.3.160.239 TCP 64 14100 > http [ACK] Seq=985 Ack=42694 Win=65535 Len=0
492290 162.572015  244.3.56.90 -> 244.3.160.239 TCP 64 14100 > http [ACK] Seq=985 Ack=44743 Win=65535 Len=0
492296 162.573342  244.3.56.90 -> 244.3.160.239 TCP 64 14100 > http [ACK] Seq=985 Ack=46792 Win=65535 Len=0
492301 162.574765  244.3.56.90 -> 244.3.160.239 TCP 64 14100 > http [ACK] Seq=985 Ack=48841 Win=65535 Len=0
492304 162.575717  244.3.56.90 -> 244.3.160.239 TCP 64 14100 > http [ACK] Seq=985 Ack=50564 Win=65535 Len=0
492319 162.587671  244.3.56.90 -> 244.3.160.239 TCP 64 14100 > http [ACK] Seq=985 Ack=52613 Win=65535 Len=0
492338 162.590218  244.3.56.90 -> 244.3.160.239 TCP 64 14100 > http [ACK] Seq=985 Ack=54864 Win=65535 Len=0
492347 162.591626  244.3.56.90 -> 244.3.160.239 TCP 64 14100 > http [ACK] Seq=985 Ack=56913 Win=65535 Len=0
492351 162.593129  244.3.56.90 -> 244.3.160.239 TCP 64 14100 > http [ACK] Seq=985 Ack=58962 Win=65535 Len=0
492354 162.594402  244.3.56.90 -> 244.3.160.239 TCP 64 14100 > http [ACK] Seq=985 Ack=61011 Win=65535 Len=0
492361 162.595265  244.3.56.90 -> 244.3.160.239 TCP 64 14100 > http [ACK] Seq=985 Ack=63060 Win=65535 Len=0
492395 162.603347  244.3.56.90 -> 244.3.160.239 TCP 64 14100 > http [ACK] Seq=985 Ack=64540 Win=65535 Len=0
492401 162.604751  244.3.56.90 -> 244.3.160.239 TCP 64 14100 > http [ACK] Seq=985 Ack=66589 Win=65535 Len=0
492414 162.607077  244.3.56.90 -> 244.3.160.239 TCP 64 14100 > http [ACK] Seq=985 Ack=68638 Win=65535 Len=0
492422 162.610364  244.3.56.90 -> 244.3.160.239 TCP 64 14100 > http [ACK] Seq=985 Ack=70687 Win=65535 Len=0
492475 162.620127  244.3.56.90 -> 244.3.160.239 TCP 64 14100 > http [ACK] Seq=985 Ack=72726 Win=65535 Len=0
492483 162.621472  244.3.56.90 -> 244.3.160.239 TCP 64 14100 > http [ACK] Seq=985 Ack=74775 Win=65535 Len=0
492490 162.623058  244.3.56.90 -> 244.3.160.239 TCP 64 14100 > http [ACK] Seq=985 Ack=76824 Win=65535 Len=0
492495 162.624139  244.3.56.90 -> 244.3.160.239 TCP 64 14100 > http [ACK] Seq=985 Ack=78873 Win=65535 Len=0
492519 162.625692  244.3.56.90 -> 244.3.160.239 TCP 64 14100 > http [ACK] Seq=985 Ack=80922 Win=65535 Len=0
492540 162.627096  244.3.56.90 -> 244.3.160.239 TCP 64 14100 > http [ACK] Seq=985 Ack=82971 Win=65535 Len=0
492545 162.628600  244.3.56.90 -> 244.3.160.239 TCP 64 14100 > http [ACK] Seq=985 Ack=85020 Win=65535 Len=0
492546 162.628874  244.3.56.90 -> 244.3.160.239 TCP 64 14100 > http [ACK] Seq=985 Ack=86252 Win=64303 Len=0
492600 162.635577  244.3.56.90 -> 244.3.160.239 TCP 64 14100 > http [ACK] Seq=985 Ack=88301 Win=65535 Len=0
492609 162.637218  244.3.56.90 -> 244.3.160.239 TCP 64 14100 > http [ACK] Seq=985 Ack=90350 Win=65535 Len=0
492614 162.638370  244.3.56.90 -> 244.3.160.239 TCP 64 14100 > http [ACK] Seq=985 Ack=92399 Win=65535 Len=0
492619 162.639671  244.3.56.90 -> 244.3.160.239 TCP 64 14100 > http [ACK] Seq=985 Ack=94448 Win=65535 Len=0
492624 162.640555  244.3.56.90 -> 244.3.160.239 TCP 64 14100 > http [ACK] Seq=985 Ack=95918 Win=65535 Len=0
492711 162.653314  244.3.56.90 -> 244.3.160.239 TCP 64 14100 > http [ACK] Seq=985 Ack=97967 Win=65535 Len=0
492726 162.655978  244.3.56.90 -> 244.3.160.239 TCP 64 14100 > http [ACK] Seq=985 Ack=99645 Win=65535 Len=0
492732 162.657386  244.3.56.90 -> 244.3.160.239 TCP 64 14100 > http [ACK] Seq=985 Ack=101694 Win=65535 Len=0
492738 162.658382  244.3.56.90 -> 244.3.160.239 TCP 64 14100 > http [ACK] Seq=985 Ack=103743 Win=65535 Len=0
492748 162.660456  244.3.56.90 -> 244.3.160.239 TCP 64 14100 > http [ACK] Seq=985 Ack=105502 Win=65535 Len=0
492749 162.660461  244.3.56.90 -> 244.3.160.239 TCP 70 [TCP Dup ACK 492748#1] 14100 > http [ACK] Seq=985 Ack=105502 Win=65535 Len=0 SLE=106171 SRE=106465
492750 162.660465  244.3.56.90 -> 244.3.160.239 TCP 64 14100 > http [ACK] Seq=985 Ack=106465 Win=64572 Len=0
492780 162.667953  244.3.56.90 -> 244.3.160.239 TCP 64 14100 > http [ACK] Seq=985 Ack=108514 Win=65535 Len=0
492783 162.669327  244.3.56.90 -> 244.3.160.239 TCP 64 14100 > http [ACK] Seq=985 Ack=110563 Win=65535 Len=0
492791 162.670687  244.3.56.90 -> 244.3.160.239 TCP 64 14100 > http [ACK] Seq=985 Ack=112612 Win=65535 Len=0
492804 162.672078  244.3.56.90 -> 244.3.160.239 TCP 64 14100 > http [ACK] Seq=985 Ack=114661 Win=65535 Len=0
492816 162.673597  244.3.56.90 -> 244.3.160.239 TCP 64 14100 > http [ACK] Seq=985 Ack=116710 Win=65535 Len=0
492823 162.674858  244.3.56.90 -> 244.3.160.239 TCP 70 14100 > http [ACK] Seq=985 Ack=118090 Win=65535 Len=0 SLE=118759 SRE=119020
492824 162.674899  244.3.56.90 -> 244.3.160.239 TCP 64 14100 > http [ACK] Seq=985 Ack=119020 Win=64605 Len=0
492855 162.685719  244.3.56.90 -> 244.3.160.239 TCP 64 14100 > http [ACK] Seq=985 Ack=121069 Win=65535 Len=0
492859 162.687391  244.3.56.90 -> 244.3.160.239 TCP 64 14100 > http [ACK] Seq=985 Ack=122832 Win=65535 Len=0
492875 162.690012  244.3.56.90 -> 244.3.160.239 TCP 64 14100 > http [ACK] Seq=985 Ack=124329 Win=65535 Len=0
492876 162.690017  244.3.56.90 -> 244.3.160.239 TCP 64 14100 > http [ACK] Seq=985 Ack=124330 Win=65535 Len=0
492877 162.690021  244.3.56.90 -> 244.3.160.239 TCP 64 14100 > http [FIN, ACK] Seq=985 Ack=124330 Win=65535 Len=0
493138 162.763063  244.3.56.90 -> 244.3.160.239 TCP 66 7433 > http [SYN] Seq=0 Win=65535 Len=0 MSS=1380 SACK_PERM=1
493142 162.763606  244.3.56.90 -> 244.3.160.239 TCP 64 7433 > http [ACK] Seq=1 Ack=1 Win=65535 Len=0
493568 162.851293  244.3.56.90 -> 244.3.160.239 TCP 64 7433 > http [ACK] Seq=983 Ack=2050 Win=65535 Len=0
493588 162.852816  244.3.56.90 -> 244.3.160.239 TCP 64 7433 > http [ACK] Seq=983 Ack=4099 Win=65535 Len=0
493679 162.883257  244.3.56.90 -> 244.3.160.239 TCP 64 7433 > http [ACK] Seq=983 Ack=5739 Win=65535 Len=0
493683 162.884612  244.3.56.90 -> 244.3.160.239 TCP 64 7433 > http [ACK] Seq=983 Ack=7788 Win=65535 Len=0
493684 162.885269  244.3.56.90 -> 244.3.160.239 TCP 64 7433 > http [ACK] Seq=983 Ack=9646 Win=65535 Len=0
493741 162.915460  244.3.56.90 -> 244.3.160.239 TCP 64 7433 > http [ACK] Seq=983 Ack=11695 Win=65535 Len=0
493745 162.917667  244.3.56.90 -> 244.3.160.239 TCP 64 7433 > http [ACK] Seq=983 Ack=13905 Win=65535 Len=0
493749 162.918973  244.3.56.90 -> 244.3.160.239 TCP 64 7433 > http [ACK] Seq=983 Ack=15954 Win=65535 Len=0
493750 162.919607  244.3.56.90 -> 244.3.160.239 TCP 64 7433 > http [ACK] Seq=983 Ack=17797 Win=65535 Len=0
493832 162.947913  244.3.56.90 -> 244.3.160.239 TCP 64 7433 > http [ACK] Seq=983 Ack=19846 Win=65535 Len=0
493838 162.949301  244.3.56.90 -> 244.3.160.239 TCP 64 7433 > http [ACK] Seq=983 Ack=21895 Win=65535 Len=0
493846 162.950730  244.3.56.90 -> 244.3.160.239 TCP 64 7433 > http [ACK] Seq=983 Ack=23944 Win=65535 Len=0
493849 162.951952  244.3.56.90 -> 244.3.160.239 TCP 64 7433 > http [ACK] Seq=983 Ack=25993 Win=65535 Len=0
493853 162.953292  244.3.56.90 -> 244.3.160.239 TCP 64 7433 > http [ACK] Seq=983 Ack=28042 Win=65535 Len=0
493858 162.954628  244.3.56.90 -> 244.3.160.239 TCP 70 7433 > http [ACK] Seq=983 Ack=29422 Win=65535 Len=0 SLE=30091 SRE=30395
493859 162.954633  244.3.56.90 -> 244.3.160.239 TCP 64 7433 > http [ACK] Seq=983 Ack=30395 Win=64562 Len=0
493916 162.979965  244.3.56.90 -> 244.3.160.239 TCP 64 7433 > http [ACK] Seq=983 Ack=32444 Win=65535 Len=0
493927 162.981973  244.3.56.90 -> 244.3.160.239 TCP 64 7433 > http [ACK] Seq=983 Ack=34118 Win=65535 Len=0
493931 162.983451  244.3.56.90 -> 244.3.160.239 TCP 64 7433 > http [ACK] Seq=983 Ack=36167 Win=65535 Len=0
493939 162.984617  244.3.56.90 -> 244.3.160.239 TCP 64 7433 > http [ACK] Seq=983 Ack=38216 Win=65535 Len=0
493940 162.984621  244.3.56.90 -> 244.3.160.239 TCP 70 [TCP Dup ACK 493939#1] 7433 > http [ACK] Seq=983 Ack=38216 Win=65535 Len=0 SLE=38885 SRE=39179
493954 162.984795  244.3.56.90 -> 244.3.160.239 TCP 64 7433 > http [ACK] Seq=983 Ack=39179 Win=64572 Len=0
493955 162.984799  244.3.56.90 -> 244.3.160.239 TCP 64 7433 > http [ACK] Seq=983 Ack=39180 Win=64572 Len=0
493962 162.984922  244.3.56.90 -> 244.3.160.239 TCP 64 7433 > http [FIN, ACK] Seq=983 Ack=39180 Win=64572 Len=0
494000 163.018442  244.3.56.90 -> 244.3.160.239 TCP 66 eq-office-4940 > http [SYN] Seq=0 Win=65535 Len=0 MSS=1380 SACK_PERM=1
494005 163.019297  244.3.56.90 -> 244.3.160.239 TCP 64 eq-office-4940 > http [ACK] Seq=1 Ack=1 Win=65535 Len=0
517466 167.314108  244.3.56.90 -> 244.3.160.239 TCP 64 eq-office-4940 > http [ACK] Seq=988 Ack=2050 Win=65535 Len=0
517476 167.315261  244.3.56.90 -> 244.3.160.239 TCP 70 eq-office-4940 > http [ACK] Seq=988 Ack=3430 Win=65535 Len=0 SLE=4099 SRE=4365
517477 167.315424  244.3.56.90 -> 244.3.160.239 TCP 64 eq-office-4940 > http [ACK] Seq=988 Ack=4365 Win=64600 Len=0
517529 167.343993  244.3.56.90 -> 244.3.160.239 TCP 64 eq-office-4940 > http [ACK] Seq=988 Ack=6414 Win=65535 Len=0
517533 167.345292  244.3.56.90 -> 244.3.160.239 TCP 64 eq-office-4940 > http [ACK] Seq=988 Ack=8463 Win=65535 Len=0
517588 167.374467  244.3.56.90 -> 244.3.160.239 TCP 64 eq-office-4940 > http [ACK] Seq=988 Ack=11015 Win=65535 Len=0
517597 167.375792  244.3.56.90 -> 244.3.160.239 TCP 64 eq-office-4940 > http [ACK] Seq=988 Ack=13064 Win=65535 Len=0
517612 167.376906  244.3.56.90 -> 244.3.160.239 TCP 64 eq-office-4940 > http [ACK] Seq=988 Ack=15113 Win=65535 Len=0
517632 167.393544  244.3.56.90 -> 244.3.160.239 TCP 64 eq-office-4940 > http [ACK] Seq=988 Ack=16825 Win=65535 Len=0
517633 167.393549  244.3.56.90 -> 244.3.160.239 TCP 64 eq-office-4940 > http [ACK] Seq=988 Ack=17833 Win=64527 Len=0
517654 167.404808  244.3.56.90 -> 244.3.160.239 TCP 64 eq-office-4940 > http [ACK] Seq=988 Ack=19882 Win=65535 Len=0
517661 167.407071  244.3.56.90 -> 244.3.160.239 TCP 64 eq-office-4940 > http [ACK] Seq=988 Ack=22140 Win=65535 Len=0
517665 167.408258  244.3.56.90 -> 244.3.160.239 TCP 64 eq-office-4940 > http [ACK] Seq=988 Ack=24189 Win=65535 Len=0
517666 167.408954  244.3.56.90 -> 244.3.160.239 TCP 64 eq-office-4940 > http [ACK] Seq=988 Ack=26013 Win=65535 Len=0
517690 167.423955  244.3.56.90 -> 244.3.160.239 TCP 64 eq-office-4940 > http [ACK] Seq=988 Ack=28062 Win=65535 Len=0
517719 167.435239  244.3.56.90 -> 244.3.160.239 TCP 64 eq-office-4940 > http [ACK] Seq=988 Ack=30296 Win=65535 Len=0
517726 167.436652  244.3.56.90 -> 244.3.160.239 TCP 64 eq-office-4940 > http [ACK] Seq=988 Ack=32345 Win=65535 Len=0
517727 167.436972  244.3.56.90 -> 244.3.160.239 TCP 64 eq-office-4940 > http [ACK] Seq=988 Ack=33960 Win=65535 Len=0
517728 167.436977  244.3.56.90 -> 244.3.160.239 TCP 64 eq-office-4940 > http [ACK] Seq=988 Ack=33961 Win=65535 Len=0
517729 167.437158  244.3.56.90 -> 244.3.160.239 TCP 64 eq-office-4940 > http [FIN, ACK] Seq=988 Ack=33961 Win=65535 Len=0
517797 167.458260  244.3.56.90 -> 244.3.160.239 TCP 66 12544 > http [SYN] Seq=0 Win=65535 Len=0 MSS=1380 SACK_PERM=1
517799 167.458967  244.3.56.90 -> 244.3.160.239 TCP 64 12544 > http [ACK] Seq=1 Ack=1 Win=65535 Len=0
517944 167.548069  244.3.56.90 -> 244.3.160.239 TCP 64 12544 > http [ACK] Seq=986 Ack=2050 Win=65535 Len=0
517945 167.548073  244.3.56.90 -> 244.3.160.239 TCP 64 12544 > http [ACK] Seq=986 Ack=2466 Win=65120 Len=0
517946 167.548178  244.3.56.90 -> 244.3.160.239 TCP 64 12544 > http [FIN, ACK] Seq=986 Ack=2466 Win=65120 Len=0
517967 167.558420  244.3.56.90 -> 244.3.160.239 TCP 66 15933 > http [SYN] Seq=0 Win=65535 Len=0 MSS=1380 SACK_PERM=1
517969 167.558992  244.3.56.90 -> 244.3.160.239 TCP 64 15933 > http [ACK] Seq=1 Ack=1 Win=65535 Len=0
518257 167.659218  244.3.56.90 -> 244.3.160.239 TCP 64 15933 > http [ACK] Seq=1011 Ack=2050 Win=65535 Len=0
518263 167.660336  244.3.56.90 -> 244.3.160.239 TCP 70 15933 > http [ACK] Seq=1011 Ack=3430 Win=65535 Len=0 SLE=4099 SRE=4382
518264 167.660387  244.3.56.90 -> 244.3.160.239 TCP 64 15933 > http [ACK] Seq=1011 Ack=4382 Win=64583 Len=0
518429 167.690110  244.3.56.90 -> 244.3.160.239 TCP 64 15933 > http [ACK] Seq=1011 Ack=6431 Win=65535 Len=0
518437 167.691458  244.3.56.90 -> 244.3.160.239 TCP 64 15933 > http [ACK] Seq=1011 Ack=8480 Win=65535 Len=0
518540 167.721549  244.3.56.90 -> 244.3.160.239 TCP 64 15933 > http [ACK] Seq=1011 Ack=11042 Win=65535 Len=0
518548 167.722976  244.3.56.90 -> 244.3.160.239 TCP 64 15933 > http [ACK] Seq=1011 Ack=13091 Win=65535 Len=0
518555 167.723874  244.3.56.90 -> 244.3.160.239 TCP 64 15933 > http [ACK] Seq=1011 Ack=15140 Win=65535 Len=0
518556 167.723879  244.3.56.90 -> 244.3.160.239 TCP 64 15933 > http [ACK] Seq=1011 Ack=15470 Win=65206 Len=0
518558 167.724082  244.3.56.90 -> 244.3.160.239 TCP 64 15933 > http [FIN, ACK] Seq=1011 Ack=15470 Win=65206 Len=0
518589 167.732986  244.3.56.90 -> 244.3.160.239 TCP 66 11803 > http [SYN] Seq=0 Win=65535 Len=0 MSS=1380 SACK_PERM=1
518593 167.733702  244.3.56.90 -> 244.3.160.239 TCP 64 11803 > http [ACK] Seq=1 Ack=1 Win=65535 Len=0
518594 167.733707  244.3.56.90 -> 244.3.160.239 TCP 66 etlservicemgr > http [SYN] Seq=0 Win=65535 Len=0 MSS=1380 SACK_PERM=1
518610 167.734312  244.3.56.90 -> 244.3.160.239 TCP 64 etlservicemgr > http [ACK] Seq=1 Ack=1 Win=65535 Len=0
518966 167.812173  244.3.56.90 -> 244.3.160.239 TCP 66 8306 > http [SYN] Seq=0 Win=65535 Len=0 MSS=1380 SACK_PERM=1
518972 167.813002  244.3.56.90 -> 244.3.160.239 TCP 64 8306 > http [ACK] Seq=1 Ack=1 Win=65535 Len=0
518981 167.813816  244.3.56.90 -> 244.3.160.239 TCP 66 wap-wsp > http [SYN] Seq=0 Win=65535 Len=0 MSS=1380 SACK_PERM=1
518990 167.814665  244.3.56.90 -> 244.3.160.239 TCP 64 wap-wsp > http [ACK] Seq=1 Ack=1 Win=65535 Len=0
519036 167.818098  244.3.56.90 -> 244.3.160.239 TCP 64 11803 > http [ACK] Seq=1001 Ack=1589 Win=65535 Len=0
519037 167.818151  244.3.56.90 -> 244.3.160.239 TCP 64 etlservicemgr > http [ACK] Seq=984 Ack=253 Win=65283 Len=0
519040 167.818259  244.3.56.90 -> 244.3.160.239 TCP 64 11803 > http [ACK] Seq=1001 Ack=2222 Win=64903 Len=0
519041 167.818263  244.3.56.90 -> 244.3.160.239 TCP 64 etlservicemgr > http [ACK] Seq=984 Ack=254 Win=65283 Len=0
519043 167.818463  244.3.56.90 -> 244.3.160.239 TCP 64 etlservicemgr > http [FIN, ACK] Seq=984 Ack=254 Win=65283 Len=0
519045 167.818531  244.3.56.90 -> 244.3.160.239 TCP 64 11803 > http [FIN, ACK] Seq=1001 Ack=2222 Win=64903 Len=0
519544 167.921946  244.3.56.90 -> 244.3.160.239 TCP 64 8306 > http [ACK] Seq=1026 Ack=614 Win=64922 Len=0
519545 167.921950  244.3.56.90 -> 244.3.160.239 TCP 64 wap-wsp > http [ACK] Seq=1028 Ack=543 Win=64993 Len=0
519548 167.922246  244.3.56.90 -> 244.3.160.239 TCP 64 wap-wsp > http [FIN, ACK] Seq=1028 Ack=543 Win=64993 Len=0
519551 167.922412  244.3.56.90 -> 244.3.160.239 TCP 64 8306 > http [FIN, ACK] Seq=1026 Ack=614 Win=64922 Len=0
519557 167.922973  244.3.56.90 -> 244.3.160.239 TCP 66 8436 > http [SYN] Seq=0 Win=65535 Len=0 MSS=1380 SACK_PERM=1
519559 167.923054  244.3.56.90 -> 244.3.160.239 TCP 66 9698 > http [SYN] Seq=0 Win=65535 Len=0 MSS=1380 SACK_PERM=1
519566 167.923568  244.3.56.90 -> 244.3.160.239 TCP 64 8436 > http [ACK] Seq=1 Ack=1 Win=65535 Len=0
519567 167.923590  244.3.56.90 -> 244.3.160.239 TCP 64 9698 > http [ACK] Seq=1 Ack=1 Win=65535 Len=0
519826 168.031918  244.3.56.90 -> 244.3.160.239 TCP 64 8306 > http [ACK] Seq=1027 Ack=615 Win=64922 Len=0
519828 168.032085  244.3.56.90 -> 244.3.160.239 TCP 64 wap-wsp > http [ACK] Seq=1029 Ack=544 Win=64993 Len=0
519832 168.032473  244.3.56.90 -> 244.3.160.239 TCP 64 8436 > http [ACK] Seq=1016 Ack=319 Win=65217 Len=0
519833 168.032510  244.3.56.90 -> 244.3.160.239 TCP 64 9698 > http [ACK] Seq=1012 Ack=278 Win=65258 Len=0
519834 168.032840  244.3.56.90 -> 244.3.160.239 TCP 64 9698 > http [FIN, ACK] Seq=1012 Ack=278 Win=65258 Len=0
519835 168.032845  244.3.56.90 -> 244.3.160.239 TCP 64 8436 > http [FIN, ACK] Seq=1016 Ack=319 Win=65217 Len=0
519838 168.033483  244.3.56.90 -> 244.3.160.239 TCP 66 13098 > http [SYN] Seq=0 Win=65535 Len=0 MSS=1380 SACK_PERM=1
519839 168.033596  244.3.56.90 -> 244.3.160.239 TCP 66 13637 > http [SYN] Seq=0 Win=65535 Len=0 MSS=1380 SACK_PERM=1
519842 168.034075  244.3.56.90 -> 244.3.160.239 TCP 64 13098 > http [ACK] Seq=1 Ack=1 Win=65535 Len=0
519844 168.034375  244.3.56.90 -> 244.3.160.239 TCP 64 13637 > http [ACK] Seq=1 Ack=1 Win=65535 Len=0
519984 168.141885  244.3.56.90 -> 244.3.160.239 TCP 64 8436 > http [ACK] Seq=1017 Ack=320 Win=65217 Len=0
519986 168.142255  244.3.56.90 -> 244.3.160.239 TCP 64 9698 > http [ACK] Seq=1013 Ack=279 Win=65258 Len=0
519988 168.142718  244.3.56.90 -> 244.3.160.239 TCP 64 13098 > http [ACK] Seq=1014 Ack=602 Win=64934 Len=0
519989 168.142988  244.3.56.90 -> 244.3.160.239 TCP 64 13098 > http [FIN, ACK] Seq=1014 Ack=602 Win=64934 Len=0
519990 168.142993  244.3.56.90 -> 244.3.160.239 TCP 64 13637 > http [ACK] Seq=1025 Ack=1468 Win=65535 Len=0
519992 168.143288  244.3.56.90 -> 244.3.160.239 TCP 64 13637 > http [FIN, ACK] Seq=1025 Ack=1468 Win=65535 Len=0
519994 168.143968  244.3.56.90 -> 244.3.160.239 TCP 66 12441 > http [SYN] Seq=0 Win=65535 Len=0 MSS=1380 SACK_PERM=1
519996 168.144234  244.3.56.90 -> 244.3.160.239 TCP 66 12062 > http [SYN] Seq=0 Win=65535 Len=0 MSS=1380 SACK_PERM=1
519998 168.144528  244.3.56.90 -> 244.3.160.239 TCP 64 12441 > http [ACK] Seq=1 Ack=1 Win=65535 Len=0
520000 168.144858  244.3.56.90 -> 244.3.160.239 TCP 64 12062 > http [ACK] Seq=1 Ack=1 Win=65535 Len=0
520083 168.188091  244.3.56.90 -> 244.3.160.239 TCP 64 13098 > http [ACK] Seq=1015 Ack=603 Win=64934 Len=0
520086 168.188495  244.3.56.90 -> 244.3.160.239 TCP 64 13637 > http [ACK] Seq=1026 Ack=1469 Win=65535 Len=0
520181 168.247779  244.3.56.90 -> 244.3.160.239 TCP 66 9168 > http [SYN] Seq=0 Win=65535 Len=0 MSS=1380 SACK_PERM=1
520183 168.248424  244.3.56.90 -> 244.3.160.239 TCP 64 9168 > http [ACK] Seq=1 Ack=1 Win=65535 Len=0
520211 168.257100  244.3.56.90 -> 244.3.160.239 TCP 66 9853 > http [SYN] Seq=0 Win=65535 Len=0 MSS=1380 SACK_PERM=1
520213 168.257685  244.3.56.90 -> 244.3.160.239 TCP 64 9853 > http [ACK] Seq=1 Ack=1 Win=65535 Len=0
520249 168.292317  244.3.56.90 -> 244.3.160.239 TCP 64 12441 > http [ACK] Seq=1022 Ack=1513 Win=65535 Len=0
520250 168.292323  244.3.56.90 -> 244.3.160.239 TCP 64 12062 > http [ACK] Seq=1028 Ack=613 Win=64923 Len=0
520251 168.292648  244.3.56.90 -> 244.3.160.239 TCP 64 12062 > http [FIN, ACK] Seq=1028 Ack=613 Win=64923 Len=0
520252 168.292653  244.3.56.90 -> 244.3.160.239 TCP 64 12441 > http [FIN, ACK] Seq=1022 Ack=1513 Win=65535 Len=0
520313 168.342357  244.3.56.90 -> 244.3.160.239 TCP 66 13636 > http [SYN] Seq=0 Win=65535 Len=0 MSS=1380 SACK_PERM=1
520315 168.342977  244.3.56.90 -> 244.3.160.239 TCP 64 13636 > http [ACK] Seq=1 Ack=1 Win=65535 Len=0
520323 168.344592  244.3.56.90 -> 244.3.160.239 TCP 66 8564 > http [SYN] Seq=0 Win=65535 Len=0 MSS=1380 SACK_PERM=1
520326 168.345472  244.3.56.90 -> 244.3.160.239 TCP 64 8564 > http [ACK] Seq=1 Ack=1 Win=65535 Len=0
520432 168.401744  244.3.56.90 -> 244.3.160.239 TCP 64 12441 > http [ACK] Seq=1023 Ack=1514 Win=65535 Len=0
520433 168.402065  244.3.56.90 -> 244.3.160.239 TCP 64 12062 > http [ACK] Seq=1029 Ack=614 Win=64923 Len=0
520436 168.402620  244.3.56.90 -> 244.3.160.239 TCP 64 9168 > http [ACK] Seq=1019 Ack=262 Win=65274 Len=0
520437 168.402690  244.3.56.90 -> 244.3.160.239 TCP 64 9853 > http [ACK] Seq=1023 Ack=758 Win=64778 Len=0
520438 168.402911  244.3.56.90 -> 244.3.160.239 TCP 64 9853 > http [FIN, ACK] Seq=1023 Ack=758 Win=64778 Len=0
520439 168.402916  244.3.56.90 -> 244.3.160.239 TCP 64 9168 > http [FIN, ACK] Seq=1019 Ack=262 Win=65274 Len=0
520453 168.417512  244.3.56.90 -> 244.3.160.239 TCP 66 9527 > http [SYN] Seq=0 Win=65535 Len=0 MSS=1380 SACK_PERM=1
520455 168.418103  244.3.56.90 -> 244.3.160.239 TCP 64 9527 > http [ACK] Seq=1 Ack=1 Win=65535 Len=0
520523 168.466224  244.3.56.90 -> 244.3.160.239 TCP 66 13774 > http [SYN] Seq=0 Win=65535 Len=0 MSS=1380 SACK_PERM=1
520525 168.466851  244.3.56.90 -> 244.3.160.239 TCP 64 13774 > http [ACK] Seq=1 Ack=1 Win=65535 Len=0
520663 168.511804  244.3.56.90 -> 244.3.160.239 TCP 64 9168 > http [ACK] Seq=1020 Ack=263 Win=65274 Len=0
520669 168.512678  244.3.56.90 -> 244.3.160.239 TCP 64 9853 > http [ACK] Seq=1024 Ack=759 Win=64778 Len=0
520675 168.513461  244.3.56.90 -> 244.3.160.239 TCP 64 13636 > http [ACK] Seq=1051 Ack=1623 Win=65535 Len=0
520676 168.513465  244.3.56.90 -> 244.3.160.239 TCP 64 8564 > http [ACK] Seq=1020 Ack=404 Win=65132 Len=0
520677 168.513610  244.3.56.90 -> 244.3.160.239 TCP 64 8564 > http [ACK] Seq=1020 Ack=405 Win=65132 Len=0
520679 168.513772  244.3.56.90 -> 244.3.160.239 TCP 64 8564 > http [FIN, ACK] Seq=1020 Ack=405 Win=65132 Len=0
520681 168.514508  244.3.56.90 -> 244.3.160.239 TCP 64 13636 > http [ACK] Seq=1051 Ack=4332 Win=65535 Len=0
520683 168.514723  244.3.56.90 -> 244.3.160.239 TCP 64 13636 > http [FIN, ACK] Seq=1051 Ack=4332 Win=65535 Len=0
520744 168.541105  244.3.56.90 -> 244.3.160.239 TCP 66 12583 > http [SYN] Seq=0 Win=65535 Len=0 MSS=1380 SACK_PERM=1
520746 168.541682  244.3.56.90 -> 244.3.160.239 TCP 64 12583 > http [ACK] Seq=1 Ack=1 Win=65535 Len=0
520955 168.616755  244.3.56.90 -> 244.3.160.239 TCP 64 9527 > http [ACK] Seq=1051 Ack=1623 Win=65535 Len=0
520956 168.616760  244.3.56.90 -> 244.3.160.239 TCP 64 9527 > http [ACK] Seq=1051 Ack=2625 Win=64534 Len=0
520960 168.617090  244.3.56.90 -> 244.3.160.239 TCP 64 9527 > http [FIN, ACK] Seq=1051 Ack=2625 Win=64534 Len=0
520965 168.617875  244.3.56.90 -> 244.3.160.239 TCP 64 12583 > http [ACK] Seq=1104 Ack=385 Win=65152 Len=0
520967 168.618058  244.3.56.90 -> 244.3.160.239 TCP 64 12583 > http [FIN, ACK] Seq=1104 Ack=385 Win=65152 Len=0
520975 168.618870  244.3.56.90 -> 244.3.160.239 TCP 66 cleanerliverc > http [SYN] Seq=0 Win=65535 Len=0 MSS=1380 SACK_PERM=1
520983 168.619578  244.3.56.90 -> 244.3.160.239 TCP 64 cleanerliverc > http [ACK] Seq=1 Ack=1 Win=65535 Len=0
521209 168.752137  244.3.56.90 -> 244.3.160.239 TCP 66 11561 > http [SYN] Seq=0 Win=65535 Len=0 MSS=1380 SACK_PERM=1
521214 168.752815  244.3.56.90 -> 244.3.160.239 TCP 64 11561 > http [ACK] Seq=1 Ack=1 Win=65535 Len=0
521290 168.832332  244.3.56.90 -> 244.3.160.239 TCP 64 cleanerliverc > http [ACK] Seq=1052 Ack=1623 Win=65535 Len=0
521291 168.832436  244.3.56.90 -> 244.3.160.239 TCP 64 11561 > http [ACK] Seq=1032 Ack=264 Win=65272 Len=0
521292 168.832441  244.3.56.90 -> 244.3.160.239 TCP 64 cleanerliverc > http [ACK] Seq=1052 Ack=3073 Win=65535 Len=0
521295 168.832454  244.3.56.90 -> 244.3.160.239 TCP 64 11561 > http [ACK] Seq=1032 Ack=265 Win=65272 Len=0
521298 168.833085  244.3.56.90 -> 244.3.160.239 TCP 64 11561 > http [FIN, ACK] Seq=1032 Ack=265 Win=65272 Len=0
521299 168.833089  244.3.56.90 -> 244.3.160.239 TCP 64 cleanerliverc > http [FIN, ACK] Seq=1052 Ack=3073 Win=65535 Len=0
521302 168.834056  244.3.56.90 -> 244.3.160.239 TCP 66 8478 > http [SYN] Seq=0 Win=65535 Len=0 MSS=1380 SACK_PERM=1
521304 168.834626  244.3.56.90 -> 244.3.160.239 TCP 64 8478 > http [ACK] Seq=1 Ack=1 Win=65535 Len=0
529156 171.939924  244.3.56.90 -> 244.3.160.239 TCP 64 8478 > http [FIN, ACK] Seq=1026 Ack=1 Win=65535 Len=0
529158 171.942090  244.3.56.90 -> 244.3.160.239 TCP 66 12827 > http [SYN] Seq=0 Win=65535 Len=0 MSS=1380 SACK_PERM=1
529160 171.942640  244.3.56.90 -> 244.3.160.239 TCP 64 13774 > http [FIN, ACK] Seq=1051 Ack=1 Win=65535 Len=0
529164 171.943266  244.3.56.90 -> 244.3.160.239 TCP 66 15118 > http [SYN] Seq=0 Win=65535 Len=0 MSS=1380 SACK_PERM=1
529166 171.943654  244.3.56.90 -> 244.3.160.239 TCP 66 15875 > http [SYN] Seq=0 Win=65535 Len=0 MSS=1380 SACK_PERM=1
529168 171.944012  244.3.56.90 -> 244.3.160.239 TCP 64 15118 > http [ACK] Seq=1 Ack=1 Win=65535 Len=0
529170 171.944268  244.3.56.90 -> 244.3.160.239 TCP 64 15875 > http [ACK] Seq=1 Ack=1 Win=65535 Len=0
529282 171.963142  244.3.56.90 -> 244.3.160.239 TCP 64 15875 > http [FIN, ACK] Seq=1026 Ack=1 Win=65535 Len=0
529287 171.963935  244.3.56.90 -> 244.3.160.239 TCP 66 treehopper > http [SYN] Seq=0 Win=65535 Len=0 MSS=1380 SACK_PERM=1
529293 171.964998  244.3.56.90 -> 244.3.160.239 TCP 66 5108 > http [SYN] Seq=0 Win=65535 Len=0 MSS=1380 SACK_PERM=1
529295 171.965564  244.3.56.90 -> 244.3.160.239 TCP 64 5108 > http [ACK] Seq=1 Ack=1 Win=65535 Len=0
529299 171.967765  244.3.56.90 -> 244.3.160.239 TCP 64 5108 > http [FIN, ACK] Seq=1018 Ack=1 Win=65535 Len=0
529512 172.033636  244.3.56.90 -> 244.3.160.239 TCP 64 5108 > http [RST, ACK] Seq=1019 Ack=213 Win=0 Len=0
532743 172.793853  244.3.56.90 -> 244.3.160.239 TCP 64 13774 > http [RST, ACK] Seq=1052 Ack=243 Win=0 Len=0
534047 173.132691  244.3.56.90 -> 244.3.160.239 TCP 64 8478 > http [RST, ACK] Seq=1027 Ack=212 Win=0 Len=0
543877 176.235280  244.3.56.90 -> 244.3.160.239 TCP 64 15875 > http [RST, ACK] Seq=1027 Ack=212 Win=0 Len=0
544310 176.386597  244.3.56.90 -> 244.3.160.239 TCP 64 15118 > http [ACK] Seq=1275 Ack=1671 Win=65535 Len=0
544317 176.387768  244.3.56.90 -> 244.3.160.239 TCP 64 15118 > http [ACK] Seq=1275 Ack=4280 Win=65535 Len=0
544318 176.387772  244.3.56.90 -> 244.3.160.239 TCP 64 15118 > http [ACK] Seq=1275 Ack=7040 Win=65535 Len=0
544344 176.404056  244.3.56.90 -> 244.3.160.239 TCP 64 15118 > http [ACK] Seq=1275 Ack=8092 Win=64483 Len=0
544407 176.419049  244.3.56.90 -> 244.3.160.239 TCP 64 15118 > http [ACK] Seq=1275 Ack=10852 Win=65535 Len=0
544408 176.419248  244.3.56.90 -> 244.3.160.239 TCP 64 15118 > http [ACK] Seq=1275 Ack=12392 Win=65535 Len=0
544409 176.419434  244.3.56.90 -> 244.3.160.239 TCP 64 15118 > http [ACK] Seq=1275 Ack=13932 Win=65535 Len=0
544463 176.437286  244.3.56.90 -> 244.3.160.239 TCP 64 15118 > http [ACK] Seq=1275 Ack=16284 Win=65535 Len=0
544547 176.449580  244.3.56.90 -> 244.3.160.239 TCP 66 9620 > http [SYN] Seq=0 Win=65535 Len=0 MSS=1380 SACK_PERM=1
544560 176.450446  244.3.56.90 -> 244.3.160.239 TCP 64 9620 > http [ACK] Seq=1 Ack=1 Win=65535 Len=0
544569 176.451127  244.3.56.90 -> 244.3.160.239 TCP 64 15118 > http [ACK] Seq=1275 Ack=19044 Win=65535 Len=0
544570 176.451260  244.3.56.90 -> 244.3.160.239 TCP 64 15118 > http [ACK] Seq=1275 Ack=20584 Win=65535 Len=0
544571 176.451369  244.3.56.90 -> 244.3.160.239 TCP 64 15118 > http [ACK] Seq=1275 Ack=22124 Win=65535 Len=0
544572 176.451781  244.3.56.90 -> 244.3.160.239 TCP 64 15118 > http [ACK] Seq=1275 Ack=24476 Win=65535 Len=0
544620 176.462245  244.3.56.90 -> 244.3.160.239 TCP 64 15118 > http [ACK] Seq=1275 Ack=25936 Win=65535 Len=0
544621 176.462249  244.3.56.90 -> 244.3.160.239 TCP 64 15118 > http [RST, ACK] Seq=1275 Ack=25936 Win=0 Len=0
545710 176.636810  244.3.56.90 -> 244.3.160.239 TCP 64 9620 > http [ACK] Seq=1045 Ack=1591 Win=65535 Len=0
545718 176.637752  244.3.56.90 -> 244.3.160.239 TCP 64 9620 > http [ACK] Seq=1045 Ack=4280 Win=65535 Len=0
545822 176.652456  244.3.56.90 -> 244.3.160.239 TCP 64 9620 > http [ACK] Seq=1045 Ack=7040 Win=65535 Len=0
545903 176.664601  244.3.56.90 -> 244.3.160.239 TCP 64 9620 > http [ACK] Seq=1045 Ack=8092 Win=64483 Len=0
546113 176.682524  244.3.56.90 -> 244.3.160.239 TCP 64 9620 > http [ACK] Seq=1045 Ack=9552 Win=65535 Len=0
546148 176.684619  244.3.56.90 -> 244.3.160.239 TCP 64 9620 > http [ACK] Seq=1045 Ack=12312 Win=65535 Len=0
546255 176.697047  244.3.56.90 -> 244.3.160.239 TCP 64 9620 > http [ACK] Seq=1045 Ack=13852 Win=65535 Len=0
546256 176.697167  244.3.56.90 -> 244.3.160.239 TCP 64 9620 > http [ACK] Seq=1045 Ack=16284 Win=65535 Len=0
546335 176.712317  244.3.56.90 -> 244.3.160.239 TCP 64 9620 > http [ACK] Seq=1045 Ack=17744 Win=65535 Len=0
546402 176.716960  244.3.56.90 -> 244.3.160.239 TCP 64 9620 > http [ACK] Seq=1045 Ack=20504 Win=65535 Len=0
546532 176.730645  244.3.56.90 -> 244.3.160.239 TCP 64 9620 > http [ACK] Seq=1045 Ack=22044 Win=65535 Len=0
546533 176.730682  244.3.56.90 -> 244.3.160.239 TCP 64 9620 > http [ACK] Seq=1045 Ack=24476 Win=65535 Len=0
546535 176.730929  244.3.56.90 -> 244.3.160.239 TCP 64 9620 > http [ACK] Seq=1045 Ack=27236 Win=65535 Len=0
546536 176.731045  244.3.56.90 -> 244.3.160.239 TCP 64 9620 > http [ACK] Seq=1045 Ack=28776 Win=65535 Len=0
546537 176.731225  244.3.56.90 -> 244.3.160.239 TCP 64 9620 > http [ACK] Seq=1045 Ack=30316 Win=65535 Len=0
546672 176.749087  244.3.56.90 -> 244.3.160.239 TCP 64 9620 > http [ACK] Seq=1045 Ack=32668 Win=65535 Len=0
546794 176.762303  244.3.56.90 -> 244.3.160.239 TCP 64 9620 > http [ACK] Seq=1045 Ack=34128 Win=65535 Len=0
546821 176.763639  244.3.56.90 -> 244.3.160.239 TCP 64 9620 > http [ACK] Seq=1045 Ack=36888 Win=65535 Len=0
546827 176.763788  244.3.56.90 -> 244.3.160.239 TCP 64 9620 > http [ACK] Seq=1045 Ack=38428 Win=65535 Len=0
546829 176.763922  244.3.56.90 -> 244.3.160.239 TCP 64 9620 > http [ACK] Seq=1045 Ack=39888 Win=65535 Len=0
546832 176.764086  244.3.56.90 -> 244.3.160.239 TCP 64 9620 > http [ACK] Seq=1045 Ack=42240 Win=65535 Len=0
546837 176.764256  244.3.56.90 -> 244.3.160.239 TCP 64 9620 > http [ACK] Seq=1045 Ack=43780 Win=65535 Len=0
546838 176.764456  244.3.56.90 -> 244.3.160.239 TCP 64 9620 > http [ACK] Seq=1045 Ack=46540 Win=65535 Len=0
546840 176.764632  244.3.56.90 -> 244.3.160.239 TCP 64 9620 > http [ACK] Seq=1045 Ack=48080 Win=65535 Len=0
546841 176.764809  244.3.56.90 -> 244.3.160.239 TCP 64 9620 > http [ACK] Seq=1045 Ack=50432 Win=65535 Len=0
546842 176.764933  244.3.56.90 -> 244.3.160.239 TCP 64 9620 > http [ACK] Seq=1045 Ack=51972 Win=65535 Len=0
546940 176.781726  244.3.56.90 -> 244.3.160.239 TCP 64 9620 > http [ACK] Seq=1045 Ack=54732 Win=65535 Len=0
547026 176.795685  244.3.56.90 -> 244.3.160.239 TCP 64 9620 > http [ACK] Seq=1045 Ack=56272 Win=65535 Len=0
547037 176.796021  244.3.56.90 -> 244.3.160.239 TCP 64 9620 > http [ACK] Seq=1045 Ack=58624 Win=65535 Len=0
547043 176.796185  244.3.56.90 -> 244.3.160.239 TCP 64 9620 > http [ACK] Seq=1045 Ack=60164 Win=65535 Len=0
547056 176.796666  244.3.56.90 -> 244.3.160.239 TCP 64 9620 > http [ACK] Seq=1045 Ack=62924 Win=65535 Len=0
547065 176.797048  244.3.56.90 -> 244.3.160.239 TCP 64 9620 > http [ACK] Seq=1045 Ack=64464 Win=65535 Len=0
547066 176.797052  244.3.56.90 -> 244.3.160.239 TCP 64 9620 > http [ACK] Seq=1045 Ack=66816 Win=65535 Len=0
547070 176.797313  244.3.56.90 -> 244.3.160.239 TCP 64 9620 > http [ACK] Seq=1045 Ack=68356 Win=65535 Len=0
547078 176.797495  244.3.56.90 -> 244.3.160.239 TCP 64 9620 > http [ACK] Seq=1045 Ack=71116 Win=65535 Len=0
547089 176.797964  244.3.56.90 -> 244.3.160.239 TCP 64 9620 > http [ACK] Seq=1045 Ack=72656 Win=65535 Len=0
547090 176.798123  244.3.56.90 -> 244.3.160.239 TCP 64 9620 > http [ACK] Seq=1045 Ack=75008 Win=65535 Len=0
547092 176.798219  244.3.56.90 -> 244.3.160.239 TCP 64 9620 > http [ACK] Seq=1045 Ack=76548 Win=65535 Len=0
547374 176.814189  244.3.56.90 -> 244.3.160.239 TCP 64 9620 > http [ACK] Seq=1045 Ack=79308 Win=65535 Len=0
547517 176.828570  244.3.56.90 -> 244.3.160.239 TCP 64 9620 > http [ACK] Seq=1045 Ack=80848 Win=65535 Len=0
547523 176.828715  244.3.56.90 -> 244.3.160.239 TCP 64 9620 > http [ACK] Seq=1045 Ack=83200 Win=65535 Len=0
547526 176.828905  244.3.56.90 -> 244.3.160.239 TCP 64 9620 > http [ACK] Seq=1045 Ack=84740 Win=65535 Len=0
547532 176.829261  244.3.56.90 -> 244.3.160.239 TCP 64 9620 > http [ACK] Seq=1045 Ack=87500 Win=65535 Len=0
547551 176.830195  244.3.56.90 -> 244.3.160.239 TCP 64 9620 > http [ACK] Seq=1045 Ack=89040 Win=65535 Len=0
547555 176.830428  244.3.56.90 -> 244.3.160.239 TCP 64 9620 > http [ACK] Seq=1045 Ack=91392 Win=65535 Len=0
547556 176.830433  244.3.56.90 -> 244.3.160.239 TCP 64 9620 > http [ACK] Seq=1045 Ack=92932 Win=65535 Len=0
547558 176.830487  244.3.56.90 -> 244.3.160.239 TCP 64 9620 > http [ACK] Seq=1045 Ack=95692 Win=65535 Len=0
547560 176.830724  244.3.56.90 -> 244.3.160.239 TCP 64 9620 > http [ACK] Seq=1045 Ack=97232 Win=65535 Len=0
547564 176.831135  244.3.56.90 -> 244.3.160.239 TCP 64 9620 > http [ACK] Seq=1045 Ack=99584 Win=65535 Len=0
547565 176.831139  244.3.56.90 -> 244.3.160.239 TCP 64 9620 > http [ACK] Seq=1045 Ack=101124 Win=65535 Len=0
547711 176.846462  244.3.56.90 -> 244.3.160.239 TCP 64 9620 > http [ACK] Seq=1045 Ack=103884 Win=65535 Len=0
547905 176.861353  244.3.56.90 -> 244.3.160.239 TCP 64 9620 > http [ACK] Seq=1045 Ack=105424 Win=65535 Len=0
547906 176.861358  244.3.56.90 -> 244.3.160.239 TCP 64 9620 > http [ACK] Seq=1045 Ack=107776 Win=65535 Len=0
547907 176.861363  244.3.56.90 -> 244.3.160.239 TCP 64 9620 > http [ACK] Seq=1045 Ack=109316 Win=65535 Len=0
547914 176.861899  244.3.56.90 -> 244.3.160.239 TCP 64 9620 > http [ACK] Seq=1045 Ack=112076 Win=65535 Len=0
547970 176.862911  244.3.56.90 -> 244.3.160.239 TCP 64 9620 > http [ACK] Seq=1045 Ack=113616 Win=65535 Len=0
547978 176.863290  244.3.56.90 -> 244.3.160.239 TCP 64 9620 > http [ACK] Seq=1045 Ack=115968 Win=65535 Len=0
547979 176.863345  244.3.56.90 -> 244.3.160.239 TCP 64 9620 > http [ACK] Seq=1045 Ack=117508 Win=65535 Len=0
547985 176.863651  244.3.56.90 -> 244.3.160.239 TCP 64 9620 > http [ACK] Seq=1045 Ack=120268 Win=65535 Len=0
547988 176.863762  244.3.56.90 -> 244.3.160.239 TCP 64 9620 > http [ACK] Seq=1045 Ack=121808 Win=65535 Len=0
547993 176.863945  244.3.56.90 -> 244.3.160.239 TCP 64 9620 > http [ACK] Seq=1045 Ack=124160 Win=65535 Len=0
547998 176.864116  244.3.56.90 -> 244.3.160.239 TCP 64 9620 > http [ACK] Seq=1045 Ack=125700 Win=65535 Len=0
548226 176.878932  244.3.56.90 -> 244.3.160.239 TCP 64 9620 > http [ACK] Seq=1045 Ack=128460 Win=65535 Len=0
548476 176.893548  244.3.56.90 -> 244.3.160.239 TCP 64 9620 > http [ACK] Seq=1045 Ack=130000 Win=65535 Len=0
548479 176.893816  244.3.56.90 -> 244.3.160.239 TCP 64 9620 > http [ACK] Seq=1045 Ack=132352 Win=65535 Len=0
548484 176.894193  244.3.56.90 -> 244.3.160.239 TCP 64 9620 > http [ACK] Seq=1045 Ack=133892 Win=65535 Len=0
548486 176.894350  244.3.56.90 -> 244.3.160.239 TCP 64 9620 > http [ACK] Seq=1045 Ack=136652 Win=65535 Len=0
548509 176.896550  244.3.56.90 -> 244.3.160.239 TCP 64 9620 > http [ACK] Seq=1045 Ack=138192 Win=65535 Len=0
548513 176.896831  244.3.56.90 -> 244.3.160.239 TCP 64 9620 > http [ACK] Seq=1045 Ack=140544 Win=65535 Len=0
548517 176.897159  244.3.56.90 -> 244.3.160.239 TCP 64 9620 > http [ACK] Seq=1045 Ack=142084 Win=65535 Len=0
548518 176.897163  244.3.56.90 -> 244.3.160.239 TCP 64 9620 > http [ACK] Seq=1045 Ack=144844 Win=65535 Len=0
548519 176.897495  244.3.56.90 -> 244.3.160.239 TCP 64 9620 > http [ACK] Seq=1045 Ack=146384 Win=65535 Len=0
548520 176.897623  244.3.56.90 -> 244.3.160.239 TCP 64 9620 > http [ACK] Seq=1045 Ack=148736 Win=65535 Len=0
548521 176.897766  244.3.56.90 -> 244.3.160.239 TCP 64 9620 > http [ACK] Seq=1045 Ack=150276 Win=65535 Len=0
548671 176.911662  244.3.56.90 -> 244.3.160.239 TCP 64 9620 > http [ACK] Seq=1045 Ack=153036 Win=65535 Len=0
548803 176.926123  244.3.56.90 -> 244.3.160.239 TCP 64 9620 > http [ACK] Seq=1045 Ack=154576 Win=65535 Len=0
548806 176.926354  244.3.56.90 -> 244.3.160.239 TCP 64 9620 > http [ACK] Seq=1045 Ack=156928 Win=65535 Len=0
548807 176.926358  244.3.56.90 -> 244.3.160.239 TCP 64 9620 > http [ACK] Seq=1045 Ack=158468 Win=65535 Len=0
548809 176.926945  244.3.56.90 -> 244.3.160.239 TCP 64 9620 > http [ACK] Seq=1045 Ack=161228 Win=65535 Len=0
548829 176.928909  244.3.56.90 -> 244.3.160.239 TCP 64 9620 > http [ACK] Seq=1045 Ack=162768 Win=65535 Len=0
548844 176.929520  244.3.56.90 -> 244.3.160.239 TCP 64 9620 > http [ACK] Seq=1045 Ack=165120 Win=65535 Len=0
548845 176.929603  244.3.56.90 -> 244.3.160.239 TCP 64 9620 > http [ACK] Seq=1045 Ack=166660 Win=65535 Len=0
548846 176.929865  244.3.56.90 -> 244.3.160.239 TCP 64 9620 > http [ACK] Seq=1045 Ack=169420 Win=65535 Len=0
548849 176.930143  244.3.56.90 -> 244.3.160.239 TCP 64 9620 > http [ACK] Seq=1045 Ack=170960 Win=65535 Len=0
548892 176.942272  244.3.56.90 -> 244.3.160.239 TCP 64 9620 > http [ACK] Seq=1045 Ack=173312 Win=65535 Len=0
548914 176.944036  244.3.56.90 -> 244.3.160.239 TCP 64 9620 > http [ACK] Seq=1045 Ack=174772 Win=65535 Len=0
548915 176.944041  244.3.56.90 -> 244.3.160.239 TCP 64 9620 > http [ACK] Seq=1045 Ack=176312 Win=65535 Len=0
549000 176.958273  244.3.56.90 -> 244.3.160.239 TCP 64 9620 > http [ACK] Seq=1045 Ack=179072 Win=65535 Len=0
549020 176.959078  244.3.56.90 -> 244.3.160.239 TCP 64 9620 > http [ACK] Seq=1045 Ack=180124 Win=64483 Len=0
549024 176.959750  244.3.56.90 -> 244.3.160.239 TCP 64 9620 > http [ACK] Seq=1045 Ack=182884 Win=65535 Len=0
549025 176.959928  244.3.56.90 -> 244.3.160.239 TCP 64 9620 > http [ACK] Seq=1045 Ack=184424 Win=65535 Len=0
549026 176.959932  244.3.56.90 -> 244.3.160.239 TCP 64 9620 > http [ACK] Seq=1045 Ack=185964 Win=65535 Len=0
549035 176.961910  244.3.56.90 -> 244.3.160.239 TCP 64 9620 > http [ACK] Seq=1045 Ack=188724 Win=65535 Len=0
549225 176.986815  244.3.56.90 -> 244.3.160.239 TCP 64 9620 > http [ACK] Seq=1045 Ack=188799 Win=65461 Len=0
549229 176.987157  244.3.56.90 -> 244.3.160.239 TCP 64 9620 > http [FIN, ACK] Seq=1045 Ack=188799 Win=65461 Len=0
549534 177.039428  244.3.56.90 -> 244.3.160.239 TCP 66 fazzt-ptp > http [SYN] Seq=0 Win=65535 Len=0 MSS=1380 SACK_PERM=1
549538 177.040047  244.3.56.90 -> 244.3.160.239 TCP 64 fazzt-ptp > http [ACK] Seq=1 Ack=1 Win=65535 Len=0
567402 181.344138  244.3.56.90 -> 244.3.160.239 TCP 64 fazzt-ptp > http [ACK] Seq=735 Ack=424 Win=65113 Len=0
567403 181.344364  244.3.56.90 -> 244.3.160.239 TCP 64 fazzt-ptp > http [FIN, ACK] Seq=735 Ack=424 Win=65113 Len=0
