790929 256.962440 244.135.40.84 -> 41.177.26.46 TCP 78 49042 > http [SYN] Seq=0 Win=5840 Len=0 MSS=1460 SACK_PERM=1 TSval=472133296 TSecr=0 WS=128
791110 257.077880 244.135.40.84 -> 41.177.26.46 TCP 70 49042 > http [ACK] Seq=1 Ack=1 Win=5888 Len=0 TSval=472133411 TSecr=1509571154
791337 257.194535 244.135.40.84 -> 41.177.26.46 TCP 70 49042 > http [ACK] Seq=349 Ack=132 Win=6912 Len=0 TSval=472133528 TSecr=1509571166
791338 257.194539 244.135.40.84 -> 41.177.26.46 TCP 70 49042 > http [FIN, ACK] Seq=349 Ack=133 Win=6912 Len=0 TSval=472133528 TSecr=1509571166
