129696  45.328431 244.3.31.124 -> 244.3.34.248 TCP 78 https > 60228 [SYN, ACK] Seq=0 Ack=1 Win=5792 Len=0 MSS=1460 SACK_PERM=1 TSval=1061464584 TSecr=665226429 WS=4
129699  45.329456 244.3.31.124 -> 244.3.34.248 TCP 70 https > 60228 [ACK] Seq=1 Ack=150 Win=6864 Len=0 TSval=1061464585 TSecr=665226429
129706  45.333212 244.3.31.124 -> 244.3.34.248 TCP 70 https > 60228 [ACK] Seq=1153 Ack=348 Win=7936 Len=0 TSval=1061464588 TSecr=665226429
129744  45.349288 244.3.31.124 -> 244.3.34.248 TCP 70 https > 60228 [FIN, ACK] Seq=1654 Ack=657 Win=9008 Len=0 TSval=1061464604 TSecr=665226429
129751  45.350217 244.3.31.124 -> 244.3.34.248 TCP 70 https > 60228 [ACK] Seq=1655 Ack=695 Win=9008 Len=0 TSval=1061464605 TSecr=665226429
711523 226.962369 244.3.31.124 -> 41.177.230.224 TCP 70 https > 62412 [SYN, ACK] Seq=0 Ack=1 Win=5840 Len=0 MSS=1460 SACK_PERM=1 WS=4
711527 226.963257 244.3.31.124 -> 41.177.230.224 TCP 64 https > 62412 [ACK] Seq=1 Ack=133 Win=6912 Len=0
711907 227.142325 244.3.31.124 -> 41.177.230.224 TCP 64 https > 62412 [FIN, ACK] Seq=2136 Ack=512 Win=9056 Len=0
711913 227.143362 244.3.31.124 -> 41.177.230.224 TCP 64 https > 62412 [ACK] Seq=2137 Ack=550 Win=9056 Len=0
999942 334.469345 244.3.31.124 -> 77.197.128.194 TCP 66 https > 41021 [SYN, ACK] Seq=0 Ack=1 Win=5840 Len=0 MSS=1460 SACK_PERM=1
1000080 334.548796 244.3.31.124 -> 77.197.128.194 TCP 64 https > 41021 [ACK] Seq=1 Ack=71 Win=5840 Len=0
1000487 334.753687 244.3.31.124 -> 77.197.128.194 TCP 64 https > 41021 [ACK] Seq=1196 Ack=567 Win=7504 Len=0
