62243  25.557029 244.3.39.117 -> 41.177.98.176 TCP 66 qadmifevent > http [SYN] Seq=0 Win=65535 Len=0 MSS=1460 SACK_PERM=1
62386  25.611976 244.3.39.117 -> 41.177.98.176 TCP 64 qadmifevent > http [ACK] Seq=1 Ack=1 Win=65535 Len=0
68503  28.263993 244.3.39.117 -> 41.177.98.176 TCP 64 qadmifevent > http [ACK] Seq=743 Ack=2921 Win=65535 Len=0
68507  28.265393 244.3.39.117 -> 41.177.98.176 TCP 64 qadmifevent > http [ACK] Seq=743 Ack=5335 Win=65535 Len=0
68511  28.266702 244.3.39.117 -> 41.177.98.176 TCP 64 qadmifevent > http [ACK] Seq=743 Ack=8255 Win=65535 Len=0
68516  28.267898 244.3.39.117 -> 41.177.98.176 TCP 64 qadmifevent > http [ACK] Seq=743 Ack=10463 Win=64787 Len=0
68517  28.268051 244.3.39.117 -> 41.177.98.176 TCP 64 qadmifevent > http [ACK] Seq=743 Ack=13383 Win=61867 Len=0
68578  28.309550 244.3.39.117 -> 41.177.98.176 TCP 64 qadmifevent > http [ACK] Seq=743 Ack=14843 Win=64167 Len=0
68579  28.312188 244.3.39.117 -> 41.177.98.176 TCP 64 qadmifevent > http [ACK] Seq=743 Ack=16898 Win=65535 Len=0
121582  43.333512 244.3.39.117 -> 41.177.98.176 TCP 64 qadmifevent > http [ACK] Seq=743 Ack=16899 Win=65535 Len=0
171735  57.152135 244.3.39.117 -> 41.177.98.176 TCP 64 qadmifevent > http [FIN, ACK] Seq=743 Ack=16899 Win=65535 Len=0
245282  85.626597 244.3.39.117 -> 41.177.98.176 TCP 66 globmsgsvc > http [SYN] Seq=0 Win=65535 Len=0 MSS=1460 SACK_PERM=1
245290  85.636988 244.3.39.117 -> 41.177.98.176 TCP 64 globmsgsvc > http [ACK] Seq=1 Ack=1 Win=65535 Len=0
249280  87.967296 244.3.39.117 -> 41.177.98.176 TCP 64 globmsgsvc > http [ACK] Seq=734 Ack=4381 Win=65535 Len=0
249291  87.968956 244.3.39.117 -> 41.177.98.176 TCP 64 globmsgsvc > http [ACK] Seq=734 Ack=7301 Win=65535 Len=0
249309  87.970482 244.3.39.117 -> 41.177.98.176 TCP 64 globmsgsvc > http [ACK] Seq=734 Ack=10463 Win=65293 Len=0
249325  87.971874 244.3.39.117 -> 41.177.98.176 TCP 64 globmsgsvc > http [ACK] Seq=734 Ack=13383 Win=62373 Len=0
249351  87.973357 244.3.39.117 -> 41.177.98.176 TCP 64 globmsgsvc > http [ACK] Seq=734 Ack=15591 Win=60165 Len=0
249369  87.979439 244.3.39.117 -> 41.177.98.176 TCP 64 globmsgsvc > http [ACK] Seq=734 Ack=16682 Win=59074 Len=0
249638  88.054908 244.3.39.117 -> 41.177.98.176 TCP 64 [TCP Window Update] globmsgsvc > http [ACK] Seq=734 Ack=16682 Win=62834 Len=0
249639  88.054962 244.3.39.117 -> 41.177.98.176 TCP 64 [TCP Window Update] globmsgsvc > http [ACK] Seq=734 Ack=16682 Win=65535 Len=0
251161  88.739012 244.3.39.117 -> 41.177.98.176 TCP 64 globmsgsvc > http [ACK] Seq=1492 Ack=17262 Win=64955 Len=0
305862 103.647990 244.3.39.117 -> 41.177.98.176 TCP 64 globmsgsvc > http [ACK] Seq=1492 Ack=17263 Win=64955 Len=0
336472 117.533203 244.3.39.117 -> 41.177.98.176 TCP 64 globmsgsvc > http [FIN, ACK] Seq=1492 Ack=17263 Win=64955 Len=0
381947 127.180313 244.3.39.117 -> 41.177.98.176 TCP 66 adaptecmgr > http [SYN] Seq=0 Win=65535 Len=0 MSS=1460 SACK_PERM=1
381952 127.185839 244.3.39.117 -> 41.177.98.176 TCP 64 adaptecmgr > http [ACK] Seq=1 Ack=1 Win=65535 Len=0
384411 127.435116 244.3.39.117 -> 41.177.98.176 TCP 64 adaptecmgr > http [ACK] Seq=825 Ack=2921 Win=65535 Len=0
384424 127.436511 244.3.39.117 -> 41.177.98.176 TCP 64 adaptecmgr > http [ACK] Seq=825 Ack=5841 Win=65535 Len=0
384456 127.437764 244.3.39.117 -> 41.177.98.176 TCP 64 adaptecmgr > http [ACK] Seq=825 Ack=8761 Win=65535 Len=0
384475 127.438973 244.3.39.117 -> 41.177.98.176 TCP 64 adaptecmgr > http [ACK] Seq=825 Ack=11681 Win=65535 Len=0
384479 127.439178 244.3.39.117 -> 41.177.98.176 TCP 64 adaptecmgr > http [ACK] Seq=825 Ack=14601 Win=65535 Len=0
384497 127.440213 244.3.39.117 -> 41.177.98.176 TCP 64 adaptecmgr > http [ACK] Seq=825 Ack=17521 Win=65535 Len=0
384511 127.442400 244.3.39.117 -> 41.177.98.176 TCP 64 adaptecmgr > http [ACK] Seq=825 Ack=20441 Win=65535 Len=0
385008 127.564576 244.3.39.117 -> 41.177.98.176 TCP 64 adaptecmgr > http [ACK] Seq=825 Ack=21363 Win=64613 Len=0
385737 127.985325 244.3.39.117 -> 41.177.98.176 TCP 66 windb > http [SYN] Seq=0 Win=65535 Len=0 MSS=1460 SACK_PERM=1
385739 127.990095 244.3.39.117 -> 41.177.98.176 TCP 64 adaptecmgr > http [ACK] Seq=1548 Ack=22924 Win=65535 Len=0
385754 128.008571 244.3.39.117 -> 41.177.98.176 TCP 64 windb > http [ACK] Seq=1 Ack=1 Win=65535 Len=0
385784 128.026420 244.3.39.117 -> 41.177.98.176 TCP 64 windb > http [ACK] Seq=731 Ack=1759 Win=65535 Len=0
385788 128.027777 244.3.39.117 -> 41.177.98.176 TCP 64 windb > http [ACK] Seq=731 Ack=4679 Win=65535 Len=0
385792 128.029002 244.3.39.117 -> 41.177.98.176 TCP 64 windb > http [ACK] Seq=731 Ack=7599 Win=65535 Len=0
385796 128.030042 244.3.39.117 -> 41.177.98.176 TCP 64 windb > http [ACK] Seq=731 Ack=10519 Win=65535 Len=0
385798 128.030391 244.3.39.117 -> 41.177.98.176 TCP 64 windb > http [ACK] Seq=731 Ack=13439 Win=65535 Len=0
385804 128.031407 244.3.39.117 -> 41.177.98.176 TCP 64 windb > http [ACK] Seq=731 Ack=16359 Win=65535 Len=0
385805 128.031615 244.3.39.117 -> 41.177.98.176 TCP 64 windb > http [ACK] Seq=731 Ack=19279 Win=65535 Len=0
385809 128.031855 244.3.39.117 -> 41.177.98.176 TCP 64 windb > http [ACK] Seq=731 Ack=22199 Win=65535 Len=0
385811 128.032602 244.3.39.117 -> 41.177.98.176 TCP 64 windb > http [ACK] Seq=731 Ack=25119 Win=65535 Len=0
385814 128.033860 244.3.39.117 -> 41.177.98.176 TCP 64 windb > http [ACK] Seq=731 Ack=28039 Win=65535 Len=0
385962 128.168069 244.3.39.117 -> 41.177.98.176 TCP 64 windb > http [ACK] Seq=731 Ack=28914 Win=64660 Len=0
400265 134.663004 244.3.39.117 -> 41.177.98.176 TCP 64 adaptecmgr > http [ACK] Seq=2424 Ack=25844 Win=65535 Len=0
400275 134.665829 244.3.39.117 -> 41.177.98.176 TCP 64 adaptecmgr > http [ACK] Seq=2424 Ack=28257 Win=65535 Len=0
400276 134.665885 244.3.39.117 -> 41.177.98.176 TCP 64 adaptecmgr > http [ACK] Seq=2424 Ack=31177 Win=65535 Len=0
400288 134.668334 244.3.39.117 -> 41.177.98.176 TCP 64 adaptecmgr > http [ACK] Seq=2424 Ack=33385 Win=65535 Len=0
400289 134.668459 244.3.39.117 -> 41.177.98.176 TCP 64 adaptecmgr > http [ACK] Seq=2424 Ack=36305 Win=65535 Len=0
400296 134.671217 244.3.39.117 -> 41.177.98.176 TCP 64 adaptecmgr > http [ACK] Seq=2424 Ack=38513 Win=65535 Len=0
400297 134.671374 244.3.39.117 -> 41.177.98.176 TCP 64 adaptecmgr > http [ACK] Seq=2424 Ack=41433 Win=65535 Len=0
400333 134.674146 244.3.39.117 -> 41.177.98.176 TCP 64 adaptecmgr > http [ACK] Seq=2424 Ack=43641 Win=65535 Len=0
400334 134.674277 244.3.39.117 -> 41.177.98.176 TCP 64 adaptecmgr > http [ACK] Seq=2424 Ack=46561 Win=65535 Len=0
400357 134.677047 244.3.39.117 -> 41.177.98.176 TCP 64 adaptecmgr > http [ACK] Seq=2424 Ack=48769 Win=65535 Len=0
400358 134.677222 244.3.39.117 -> 41.177.98.176 TCP 64 adaptecmgr > http [ACK] Seq=2424 Ack=51689 Win=65535 Len=0
400393 134.679965 244.3.39.117 -> 41.177.98.176 TCP 64 adaptecmgr > http [ACK] Seq=2424 Ack=53897 Win=65535 Len=0
400395 134.680122 244.3.39.117 -> 41.177.98.176 TCP 64 adaptecmgr > http [ACK] Seq=2424 Ack=56817 Win=65535 Len=0
400418 134.682657 244.3.39.117 -> 41.177.98.176 TCP 64 adaptecmgr > http [ACK] Seq=2424 Ack=59025 Win=65535 Len=0
400423 134.683092 244.3.39.117 -> 41.177.98.176 TCP 64 adaptecmgr > http [ACK] Seq=2424 Ack=61945 Win=65535 Len=0
400446 134.685868 244.3.39.117 -> 41.177.98.176 TCP 64 adaptecmgr > http [ACK] Seq=2424 Ack=64153 Win=65535 Len=0
400447 134.686011 244.3.39.117 -> 41.177.98.176 TCP 64 adaptecmgr > http [ACK] Seq=2424 Ack=67073 Win=65535 Len=0
400452 134.687203 244.3.39.117 -> 41.177.98.176 TCP 64 adaptecmgr > http [ACK] Seq=2424 Ack=69281 Win=65535 Len=0
400490 134.688961 244.3.39.117 -> 41.177.98.176 TCP 64 adaptecmgr > http [ACK] Seq=2424 Ack=72201 Win=65535 Len=0
400502 134.691654 244.3.39.117 -> 41.177.98.176 TCP 64 adaptecmgr > http [ACK] Seq=2424 Ack=74409 Win=65535 Len=0
400507 134.691792 244.3.39.117 -> 41.177.98.176 TCP 64 adaptecmgr > http [ACK] Seq=2424 Ack=77329 Win=65535 Len=0
400508 134.692295 244.3.39.117 -> 41.177.98.176 TCP 64 adaptecmgr > http [ACK] Seq=2424 Ack=79537 Win=65535 Len=0
400513 134.694824 244.3.39.117 -> 41.177.98.176 TCP 64 adaptecmgr > http [ACK] Seq=2424 Ack=82457 Win=65535 Len=0
400528 134.697490 244.3.39.117 -> 41.177.98.176 TCP 64 adaptecmgr > http [ACK] Seq=2424 Ack=84665 Win=65535 Len=0
400530 134.697629 244.3.39.117 -> 41.177.98.176 TCP 64 adaptecmgr > http [ACK] Seq=2424 Ack=87585 Win=65535 Len=0
400547 134.700170 244.3.39.117 -> 41.177.98.176 TCP 64 adaptecmgr > http [ACK] Seq=2424 Ack=89793 Win=65535 Len=0
400549 134.700567 244.3.39.117 -> 41.177.98.176 TCP 64 adaptecmgr > http [ACK] Seq=2424 Ack=92713 Win=65535 Len=0
400560 134.703089 244.3.39.117 -> 41.177.98.176 TCP 64 adaptecmgr > http [ACK] Seq=2424 Ack=94921 Win=65535 Len=0
400562 134.703480 244.3.39.117 -> 41.177.98.176 TCP 64 adaptecmgr > http [ACK] Seq=2424 Ack=97841 Win=65535 Len=0
400576 134.706237 244.3.39.117 -> 41.177.98.176 TCP 64 adaptecmgr > http [ACK] Seq=2424 Ack=101509 Win=61867 Len=0
400577 134.706391 244.3.39.117 -> 41.177.98.176 TCP 64 [TCP Window Update] adaptecmgr > http [ACK] Seq=2424 Ack=101509 Win=65535 Len=0
400578 134.706646 244.3.39.117 -> 41.177.98.176 TCP 64 adaptecmgr > http [ACK] Seq=2424 Ack=102969 Win=65535 Len=0
400590 134.708951 244.3.39.117 -> 41.177.98.176 TCP 64 adaptecmgr > http [ACK] Seq=2424 Ack=105177 Win=65535 Len=0
400592 134.709336 244.3.39.117 -> 41.177.98.176 TCP 64 adaptecmgr > http [ACK] Seq=2424 Ack=108097 Win=65535 Len=0
400605 134.711867 244.3.39.117 -> 41.177.98.176 TCP 64 adaptecmgr > http [ACK] Seq=2424 Ack=110305 Win=65535 Len=0
400607 134.712250 244.3.39.117 -> 41.177.98.176 TCP 64 adaptecmgr > http [ACK] Seq=2424 Ack=113225 Win=65535 Len=0
400620 134.714746 244.3.39.117 -> 41.177.98.176 TCP 64 adaptecmgr > http [ACK] Seq=2424 Ack=115433 Win=65535 Len=0
400621 134.715161 244.3.39.117 -> 41.177.98.176 TCP 64 adaptecmgr > http [ACK] Seq=2424 Ack=118353 Win=65535 Len=0
400652 134.717676 244.3.39.117 -> 41.177.98.176 TCP 64 adaptecmgr > http [ACK] Seq=2424 Ack=120561 Win=65535 Len=0
400655 134.718071 244.3.39.117 -> 41.177.98.176 TCP 64 adaptecmgr > http [ACK] Seq=2424 Ack=123481 Win=65535 Len=0
400672 134.719613 244.3.39.117 -> 41.177.98.176 TCP 64 adaptecmgr > http [ACK] Seq=2424 Ack=125689 Win=65535 Len=0
400720 134.730301 244.3.39.117 -> 41.177.98.176 TCP 64 adaptecmgr > http [ACK] Seq=2424 Ack=125954 Win=65270 Len=0
439198 143.031388 244.3.39.117 -> 41.177.98.176 TCP 64 windb > http [ACK] Seq=731 Ack=28915 Win=64660 Len=0
443606 144.377685 244.3.39.117 -> 41.177.98.176 TCP 64 windb > http [FIN, ACK] Seq=731 Ack=28915 Win=64660 Len=0
451859 147.207796 244.3.39.117 -> 41.177.98.176 TCP 64 adaptecmgr > http [ACK] Seq=3374 Ack=128874 Win=65535 Len=0
451864 147.209226 244.3.39.117 -> 41.177.98.176 TCP 64 adaptecmgr > http [ACK] Seq=3374 Ack=131794 Win=65535 Len=0
451868 147.210478 244.3.39.117 -> 41.177.98.176 TCP 64 adaptecmgr > http [ACK] Seq=3374 Ack=134714 Win=65535 Len=0
451872 147.210934 244.3.39.117 -> 41.177.98.176 TCP 64 adaptecmgr > http [ACK] Seq=3374 Ack=136415 Win=65294 Len=0
451874 147.211882 244.3.39.117 -> 41.177.98.176 TCP 64 adaptecmgr > http [ACK] Seq=3374 Ack=139335 Win=62374 Len=0
451879 147.213873 244.3.39.117 -> 41.177.98.176 TCP 64 adaptecmgr > http [ACK] Seq=3374 Ack=141543 Win=60166 Len=0
451880 147.214289 244.3.39.117 -> 41.177.98.176 TCP 64 adaptecmgr > http [ACK] Seq=3374 Ack=144463 Win=57246 Len=0
451889 147.217039 244.3.39.117 -> 41.177.98.176 TCP 64 adaptecmgr > http [ACK] Seq=3374 Ack=146671 Win=55038 Len=0
451890 147.217196 244.3.39.117 -> 41.177.98.176 TCP 64 adaptecmgr > http [ACK] Seq=3374 Ack=149591 Win=52118 Len=0
451893 147.218006 244.3.39.117 -> 41.177.98.176 TCP 64 [TCP Window Update] adaptecmgr > http [ACK] Seq=3374 Ack=149591 Win=55878 Len=0
451894 147.218076 244.3.39.117 -> 41.177.98.176 TCP 64 [TCP Window Update] adaptecmgr > http [ACK] Seq=3374 Ack=149591 Win=65535 Len=0
451899 147.219964 244.3.39.117 -> 41.177.98.176 TCP 64 adaptecmgr > http [ACK] Seq=3374 Ack=151799 Win=65535 Len=0
451900 147.220120 244.3.39.117 -> 41.177.98.176 TCP 64 adaptecmgr > http [ACK] Seq=3374 Ack=154719 Win=65535 Len=0
451913 147.222891 244.3.39.117 -> 41.177.98.176 TCP 64 adaptecmgr > http [ACK] Seq=3374 Ack=156927 Win=65535 Len=0
451915 147.223050 244.3.39.117 -> 41.177.98.176 TCP 64 adaptecmgr > http [ACK] Seq=3374 Ack=159847 Win=65535 Len=0
451929 147.225813 244.3.39.117 -> 41.177.98.176 TCP 64 adaptecmgr > http [ACK] Seq=3374 Ack=162055 Win=65535 Len=0
451931 147.225965 244.3.39.117 -> 41.177.98.176 TCP 64 adaptecmgr > http [ACK] Seq=3374 Ack=164975 Win=65535 Len=0
451958 147.228729 244.3.39.117 -> 41.177.98.176 TCP 64 adaptecmgr > http [ACK] Seq=3374 Ack=167183 Win=65535 Len=0
451960 147.228874 244.3.39.117 -> 41.177.98.176 TCP 64 adaptecmgr > http [ACK] Seq=3374 Ack=170103 Win=65535 Len=0
451988 147.231638 244.3.39.117 -> 41.177.98.176 TCP 64 adaptecmgr > http [ACK] Seq=3374 Ack=172311 Win=65535 Len=0
451992 147.232051 244.3.39.117 -> 41.177.98.176 TCP 64 adaptecmgr > http [ACK] Seq=3374 Ack=175231 Win=65535 Len=0
452021 147.234554 244.3.39.117 -> 41.177.98.176 TCP 64 adaptecmgr > http [ACK] Seq=3374 Ack=177439 Win=65535 Len=0
452028 147.234996 244.3.39.117 -> 41.177.98.176 TCP 64 adaptecmgr > http [ACK] Seq=3374 Ack=180359 Win=65535 Len=0
452064 147.237487 244.3.39.117 -> 41.177.98.176 TCP 64 adaptecmgr > http [ACK] Seq=3374 Ack=182567 Win=65535 Len=0
452068 147.237886 244.3.39.117 -> 41.177.98.176 TCP 64 adaptecmgr > http [ACK] Seq=3374 Ack=185487 Win=65535 Len=0
452097 147.240374 244.3.39.117 -> 41.177.98.176 TCP 64 adaptecmgr > http [ACK] Seq=3374 Ack=187695 Win=65535 Len=0
452099 147.241029 244.3.39.117 -> 41.177.98.176 TCP 64 adaptecmgr > http [ACK] Seq=3374 Ack=190615 Win=65535 Len=0
452105 147.242096 244.3.39.117 -> 41.177.98.176 TCP 64 adaptecmgr > http [ACK] Seq=3374 Ack=192823 Win=65535 Len=0
452117 147.243836 244.3.39.117 -> 41.177.98.176 TCP 64 adaptecmgr > http [ACK] Seq=3374 Ack=195743 Win=65535 Len=0
452118 147.244778 244.3.39.117 -> 41.177.98.176 TCP 64 adaptecmgr > http [ACK] Seq=3374 Ack=197951 Win=65535 Len=0
452126 147.246735 244.3.39.117 -> 41.177.98.176 TCP 64 adaptecmgr > http [ACK] Seq=3374 Ack=200871 Win=65535 Len=0
452134 147.248178 244.3.39.117 -> 41.177.98.176 TCP 64 adaptecmgr > http [ACK] Seq=3374 Ack=203079 Win=65535 Len=0
452166 147.249648 244.3.39.117 -> 41.177.98.176 TCP 64 adaptecmgr > http [ACK] Seq=3374 Ack=205999 Win=65535 Len=0
452178 147.252332 244.3.39.117 -> 41.177.98.176 TCP 64 adaptecmgr > http [ACK] Seq=3374 Ack=209667 Win=65535 Len=0
452193 147.254986 244.3.39.117 -> 41.177.98.176 TCP 64 adaptecmgr > http [ACK] Seq=3374 Ack=213335 Win=65535 Len=0
452196 147.255406 244.3.39.117 -> 41.177.98.176 TCP 64 adaptecmgr > http [ACK] Seq=3374 Ack=216255 Win=65535 Len=0
452208 147.258151 244.3.39.117 -> 41.177.98.176 TCP 64 adaptecmgr > http [ACK] Seq=3374 Ack=218463 Win=65535 Len=0
452210 147.258309 244.3.39.117 -> 41.177.98.176 TCP 64 adaptecmgr > http [ACK] Seq=3374 Ack=221383 Win=65535 Len=0
452216 147.261806 244.3.39.117 -> 41.177.98.176 TCP 64 adaptecmgr > http [ACK] Seq=3374 Ack=225051 Win=65535 Len=0
452274 147.309698 244.3.39.117 -> 41.177.98.176 TCP 64 adaptecmgr > http [ACK] Seq=3374 Ack=226163 Win=64423 Len=0
491702 162.392109 244.3.39.117 -> 41.177.98.176 TCP 64 adaptecmgr > http [ACK] Seq=3374 Ack=226164 Win=64423 Len=0
493647 162.879970 244.3.39.117 -> 41.177.98.176 TCP 64 adaptecmgr > http [FIN, ACK] Seq=3374 Ack=226164 Win=64423 Len=0
520059 168.183581 244.3.39.117 -> 41.177.98.176 TCP 66 optiwave-lm > http [SYN] Seq=0 Win=65535 Len=0 MSS=1460 SACK_PERM=1
520067 168.185935 244.3.39.117 -> 41.177.98.176 TCP 64 optiwave-lm > http [ACK] Seq=1 Ack=1 Win=65535 Len=0
520546 168.478351 244.3.39.117 -> 41.177.98.176 TCP 64 optiwave-lm > http [ACK] Seq=981 Ack=2921 Win=65535 Len=0
520552 168.480023 244.3.39.117 -> 41.177.98.176 TCP 64 optiwave-lm > http [ACK] Seq=981 Ack=5335 Win=65535 Len=0
520555 168.481201 244.3.39.117 -> 41.177.98.176 TCP 64 optiwave-lm > http [ACK] Seq=981 Ack=8255 Win=65535 Len=0
520556 168.481448 244.3.39.117 -> 41.177.98.176 TCP 64 optiwave-lm > http [ACK] Seq=981 Ack=10463 Win=64787 Len=0
520568 168.482954 244.3.39.117 -> 41.177.98.176 TCP 64 optiwave-lm > http [ACK] Seq=981 Ack=13383 Win=61867 Len=0
520574 168.484369 244.3.39.117 -> 41.177.98.176 TCP 64 optiwave-lm > http [ACK] Seq=981 Ack=15591 Win=59659 Len=0
520584 168.485609 244.3.39.117 -> 41.177.98.176 TCP 64 optiwave-lm > http [ACK] Seq=981 Ack=18511 Win=56739 Len=0
520590 168.487575 244.3.39.117 -> 41.177.98.176 TCP 64 optiwave-lm > http [ACK] Seq=981 Ack=20719 Win=54531 Len=0
520598 168.489886 244.3.39.117 -> 41.177.98.176 TCP 64 [TCP Window Update] optiwave-lm > http [ACK] Seq=981 Ack=20719 Win=58291 Len=0
520599 168.489935 244.3.39.117 -> 41.177.98.176 TCP 64 [TCP Window Update] optiwave-lm > http [ACK] Seq=981 Ack=20719 Win=65535 Len=0
520802 168.574458 244.3.39.117 -> 41.177.98.176 TCP 64 optiwave-lm > http [ACK] Seq=981 Ack=22026 Win=64228 Len=0
530274 172.223168 244.3.39.117 -> 41.177.98.176 TCP 64 optiwave-lm > http [ACK] Seq=1944 Ack=24946 Win=65535 Len=0
530282 172.224577 244.3.39.117 -> 41.177.98.176 TCP 64 optiwave-lm > http [ACK] Seq=1944 Ack=27359 Win=65535 Len=0
530292 172.225763 244.3.39.117 -> 41.177.98.176 TCP 64 optiwave-lm > http [ACK] Seq=1944 Ack=30279 Win=65535 Len=0
530309 172.228186 244.3.39.117 -> 41.177.98.176 TCP 64 optiwave-lm > http [ACK] Seq=1944 Ack=32487 Win=65535 Len=0
530310 172.228652 244.3.39.117 -> 41.177.98.176 TCP 64 optiwave-lm > http [ACK] Seq=1944 Ack=35407 Win=64075 Len=0
530340 172.231109 244.3.39.117 -> 41.177.98.176 TCP 64 optiwave-lm > http [ACK] Seq=1944 Ack=37615 Win=61867 Len=0
530341 172.231287 244.3.39.117 -> 41.177.98.176 TCP 64 optiwave-lm > http [ACK] Seq=1944 Ack=40535 Win=58947 Len=0
530353 172.233292 244.3.39.117 -> 41.177.98.176 TCP 64 optiwave-lm > http [ACK] Seq=1944 Ack=42743 Win=56739 Len=0
530357 172.234272 244.3.39.117 -> 41.177.98.176 TCP 64 [TCP Window Update] optiwave-lm > http [ACK] Seq=1944 Ack=42743 Win=60499 Len=0
530358 172.234352 244.3.39.117 -> 41.177.98.176 TCP 64 [TCP Window Update] optiwave-lm > http [ACK] Seq=1944 Ack=42743 Win=65535 Len=0
531594 172.425251 244.3.39.117 -> 41.177.98.176 TCP 64 optiwave-lm > http [ACK] Seq=1944 Ack=44046 Win=64232 Len=0
532294 172.626397 244.3.39.117 -> 41.177.98.176 TCP 64 optiwave-lm > http [ACK] Seq=1944 Ack=44051 Win=64227 Len=0
588329 187.377227 244.3.39.117 -> 41.177.98.176 TCP 64 optiwave-lm > http [ACK] Seq=1944 Ack=44052 Win=64227 Len=0
607690 192.880551 244.3.39.117 -> 41.177.98.176 TCP 64 optiwave-lm > http [FIN, ACK] Seq=1944 Ack=44052 Win=64227 Len=0
