33625  14.276742  244.3.31.84 -> 244.3.41.84  TCP 130 61344 > 31100 [PSH, ACK] Seq=1 Ack=1 Win=32746 Len=60 TSval=1276466331 TSecr=4292218764
34001  14.440235  244.3.31.84 -> 244.3.41.84  TCP 70 61344 > 31100 [ACK] Seq=61 Ack=13 Win=32746 Len=0 TSval=1276466332 TSecr=4292277406
176905  59.249706  244.3.31.84 -> 244.3.41.84  TCP 70 31100 > worldfusion2 [ACK] Seq=1 Ack=62 Win=65493 Len=0 TSval=1276466421 TSecr=4292321308
176972  59.282385  244.3.31.84 -> 244.3.41.84  TCP 82 31100 > worldfusion2 [PSH, ACK] Seq=1 Ack=62 Win=65493 Len=12 TSval=1276466421 TSecr=4292321308
217780  74.324406  244.3.31.84 -> 244.3.41.84  TCP 130 61344 > 31100 [PSH, ACK] Seq=61 Ack=13 Win=32746 Len=60 TSval=1276466451 TSecr=4292277406
218234  74.479540  244.3.31.84 -> 244.3.41.84  TCP 70 61344 > 31100 [ACK] Seq=121 Ack=25 Win=32746 Len=0 TSval=1276466452 TSecr=4292336050
352172 119.324103  244.3.31.84 -> 244.3.41.84  TCP 82 31100 > worldfusion2 [PSH, ACK] Seq=13 Ack=123 Win=65493 Len=12 TSval=1276466541 TSecr=4292379943
399263 134.366074  244.3.31.84 -> 244.3.41.84  TCP 130 61344 > 31100 [PSH, ACK] Seq=121 Ack=25 Win=32746 Len=60 TSval=1276466571 TSecr=4292336050
399503 134.459650  244.3.31.84 -> 244.3.41.84  TCP 70 61344 > 31100 [ACK] Seq=181 Ack=37 Win=32746 Len=0 TSval=1276466572 TSecr=4292394681
557051 179.372720  244.3.31.84 -> 244.3.41.84  TCP 82 31100 > worldfusion2 [PSH, ACK] Seq=25 Ack=184 Win=65493 Len=12 TSval=1276466661 TSecr=4292438583
612604 194.414742  244.3.31.84 -> 244.3.41.84  TCP 130 61344 > 31100 [PSH, ACK] Seq=181 Ack=37 Win=32746 Len=60 TSval=1276466691 TSecr=4292394681
612802 194.458586  244.3.31.84 -> 244.3.41.84  TCP 70 61344 > 31100 [ACK] Seq=241 Ack=49 Win=32746 Len=0 TSval=1276466691 TSecr=4292453330
748062 239.407477  244.3.31.84 -> 244.3.41.84  TCP 82 31100 > worldfusion2 [PSH, ACK] Seq=37 Ack=245 Win=65493 Len=12 TSval=1276466780 TSecr=4292497218
785178 254.443442  244.3.31.84 -> 244.3.41.84  TCP 130 61344 > 31100 [PSH, ACK] Seq=241 Ack=49 Win=32746 Len=60 TSval=1276466810 TSecr=4292453330
785375 254.517910  244.3.31.84 -> 244.3.41.84  TCP 70 61344 > 31100 [ACK] Seq=301 Ack=61 Win=32746 Len=0 TSval=1276466810 TSecr=4292511944
908063 299.453347  244.3.31.84 -> 244.3.41.84  TCP 82 31100 > worldfusion2 [PSH, ACK] Seq=49 Ack=306 Win=65493 Len=12 TSval=1276466899 TSecr=4292555849
947711 314.501351  244.3.31.84 -> 244.3.41.84  TCP 130 61344 > 31100 [PSH, ACK] Seq=301 Ack=61 Win=32746 Len=60 TSval=1276466929 TSecr=4292511944
948728 314.661915  244.3.31.84 -> 244.3.41.84  TCP 70 61344 > 31100 [ACK] Seq=361 Ack=73 Win=32746 Len=0 TSval=1276466930 TSecr=4292570603
