48012  19.731119 244.3.160.128 -> 244.3.153.34 TCP 64 https > 55394 [RST] Seq=1 Win=0 Len=0
48013  19.731123 244.3.160.128 -> 244.3.153.34 TCP 64 https > 55395 [RST] Seq=1 Win=0 Len=0
48014  19.731187 244.3.160.128 -> 244.3.153.34 TCP 64 https > 55392 [RST] Seq=1 Win=0 Len=0
48015  19.731192 244.3.160.128 -> 244.3.153.34 TCP 64 https > 55391 [RST] Seq=1 Win=0 Len=0
601545 190.746625 244.3.160.128 -> 244.3.153.34 TCP 64 https > 55318 [RST] Seq=1 Win=0 Len=0
601554 190.748630 244.3.160.128 -> 244.3.153.34 TCP 70 https > 55439 [SYN, ACK] Seq=0 Ack=1 Win=5840 Len=0 MSS=1380 SACK_PERM=1 WS=1
601562 190.750822 244.3.160.128 -> 244.3.153.34 TCP 64 https > 55439 [ACK] Seq=1 Ack=144 Win=5840 Len=0
601596 190.760135 244.3.160.128 -> 244.3.153.34 TCP 64 https > 55439 [ACK] Seq=987 Ack=470 Win=6432 Len=0
601658 190.780708 244.3.160.128 -> 244.3.153.34 TCP 64 https > 55439 [ACK] Seq=1046 Ack=1787 Win=9200 Len=0
609192 193.466709 244.3.160.128 -> 244.3.153.34 TCP 64 https > 55439 [ACK] Seq=3087 Ack=3342 Win=13800 Len=0
609212 193.474405 244.3.160.128 -> 244.3.153.34 TCP 64 https > 55439 [ACK] Seq=3087 Ack=3978 Win=16100 Len=0
633478 200.505194 244.3.160.128 -> 244.3.153.34 TCP 64 https > 55439 [FIN, ACK] Seq=5070 Ack=3978 Win=16100 Len=0
