627907 199.311216 244.3.151.202 -> 244.3.160.239 TCP 66 11520 > http [SYN] Seq=0 Win=64512 Len=0 MSS=1380 SACK_PERM=1
627911 199.312621 244.3.151.202 -> 244.3.160.239 TCP 64 11520 > http [ACK] Seq=1 Ack=1 Win=64512 Len=0
627928 199.321658 244.3.151.202 -> 244.3.160.239 TCP 64 11520 > http [ACK] Seq=649 Ack=663 Win=63851 Len=0
627934 199.330158 244.3.151.202 -> 244.3.160.239 TCP 64 11520 > http [FIN, ACK] Seq=649 Ack=663 Win=63851 Len=0
627937 199.331763 244.3.151.202 -> 244.3.160.239 TCP 66 4966 > http [SYN] Seq=0 Win=64512 Len=0 MSS=1380 SACK_PERM=1
627939 199.333406 244.3.151.202 -> 244.3.160.239 TCP 64 4966 > http [ACK] Seq=1 Ack=1 Win=64512 Len=0
627988 199.341113 244.3.151.202 -> 244.3.160.239 TCP 64 4966 > http [ACK] Seq=709 Ack=582 Win=63932 Len=0
627989 199.342453 244.3.151.202 -> 244.3.160.239 TCP 64 4966 > http [FIN, ACK] Seq=709 Ack=582 Win=63932 Len=0
628012 199.346686 244.3.151.202 -> 244.3.160.239 TCP 66 12284 > http [SYN] Seq=0 Win=64512 Len=0 MSS=1380 SACK_PERM=1
628017 199.348299 244.3.151.202 -> 244.3.160.239 TCP 64 12284 > http [ACK] Seq=1 Ack=1 Win=64512 Len=0
628128 199.361766 244.3.151.202 -> 244.3.160.239 TCP 64 12284 > http [ACK] Seq=665 Ack=478 Win=64036 Len=0
628143 199.362332 244.3.151.202 -> 244.3.160.239 TCP 64 12284 > http [FIN, ACK] Seq=665 Ack=478 Win=64036 Len=0
628147 199.362524 244.3.151.202 -> 244.3.160.239 TCP 66 13656 > http [SYN] Seq=0 Win=64512 Len=0 MSS=1380 SACK_PERM=1
628162 199.364300 244.3.151.202 -> 244.3.160.239 TCP 64 13656 > http [ACK] Seq=1 Ack=1 Win=64512 Len=0
628187 199.373319 244.3.151.202 -> 244.3.160.239 TCP 64 13656 > http [ACK] Seq=801 Ack=276 Win=64238 Len=0
628196 199.374471 244.3.151.202 -> 244.3.160.239 TCP 64 13656 > http [FIN, ACK] Seq=801 Ack=276 Win=64238 Len=0
628202 199.375239 244.3.151.202 -> 244.3.160.239 TCP 66 16006 > http [SYN] Seq=0 Win=64512 Len=0 MSS=1380 SACK_PERM=1
628212 199.376042 244.3.151.202 -> 244.3.160.239 TCP 64 16006 > http [ACK] Seq=1 Ack=1 Win=64512 Len=0
628635 199.481486 244.3.151.202 -> 244.3.160.239 TCP 70 16006 > http [ACK] Seq=785 Ack=1381 Win=64512 Len=0 SLE=2100 SRE=2232
628636 199.481491 244.3.151.202 -> 244.3.160.239 TCP 64 16006 > http [ACK] Seq=785 Ack=2232 Win=63661 Len=0
628678 199.485784 244.3.151.202 -> 244.3.160.239 TCP 64 16006 > http [ACK] Seq=785 Ack=4399 Win=64512 Len=0
628686 199.486571 244.3.151.202 -> 244.3.160.239 TCP 64 16006 > http [ACK] Seq=785 Ack=6448 Win=64512 Len=0
628689 199.487215 244.3.151.202 -> 244.3.160.239 TCP 66 arepa-cas > http [SYN] Seq=0 Win=64512 Len=0 MSS=1380 SACK_PERM=1
628696 199.488299 244.3.151.202 -> 244.3.160.239 TCP 64 16006 > http [ACK] Seq=785 Ack=8579 Win=64512 Len=0
628697 199.488304 244.3.151.202 -> 244.3.160.239 TCP 64 arepa-cas > http [ACK] Seq=1 Ack=1 Win=64512 Len=0
628712 199.490285 244.3.151.202 -> 244.3.160.239 TCP 64 16006 > http [ACK] Seq=785 Ack=10628 Win=64512 Len=0
628713 199.490290 244.3.151.202 -> 244.3.160.239 TCP 64 16006 > http [ACK] Seq=785 Ack=12677 Win=64512 Len=0
628725 199.491718 244.3.151.202 -> 244.3.160.239 TCP 64 16006 > http [ACK] Seq=785 Ack=14726 Win=64512 Len=0
628729 199.492636 244.3.151.202 -> 244.3.160.239 TCP 64 16006 > http [ACK] Seq=785 Ack=16775 Win=64512 Len=0
628735 199.494027 244.3.151.202 -> 244.3.160.239 TCP 64 16006 > http [ACK] Seq=785 Ack=18824 Win=62463 Len=0
628740 199.495479 244.3.151.202 -> 244.3.160.239 TCP 64 16006 > http [ACK] Seq=785 Ack=20873 Win=60414 Len=0
628754 199.496614 244.3.151.202 -> 244.3.160.239 TCP 64 16006 > http [ACK] Seq=785 Ack=22942 Win=58345 Len=0
628759 199.497969 244.3.151.202 -> 244.3.160.239 TCP 64 16006 > http [ACK] Seq=785 Ack=24991 Win=56296 Len=0
628765 199.499206 244.3.151.202 -> 244.3.160.239 TCP 64 16006 > http [ACK] Seq=785 Ack=27147 Win=54140 Len=0
628774 199.500378 244.3.151.202 -> 244.3.160.239 TCP 64 16006 > http [ACK] Seq=785 Ack=29206 Win=52081 Len=0
628778 199.501439 244.3.151.202 -> 244.3.160.239 TCP 64 16006 > http [ACK] Seq=785 Ack=31255 Win=50032 Len=0
628797 199.502768 244.3.151.202 -> 244.3.160.239 TCP 64 16006 > http [ACK] Seq=785 Ack=33304 Win=47983 Len=0
628802 199.503131 244.3.151.202 -> 244.3.160.239 TCP 64 arepa-cas > http [ACK] Seq=515 Ack=1575 Win=64512 Len=0
628830 199.504242 244.3.151.202 -> 244.3.160.239 TCP 64 16006 > http [ACK] Seq=785 Ack=35353 Win=45934 Len=0
628838 199.504610 244.3.151.202 -> 244.3.160.239 TCP 64 arepa-cas > http [ACK] Seq=515 Ack=4335 Win=64512 Len=0
628839 199.504615 244.3.151.202 -> 244.3.160.239 TCP 64 arepa-cas > http [ACK] Seq=515 Ack=4939 Win=63909 Len=0
628840 199.504618 244.3.151.202 -> 244.3.160.239 TCP 64 arepa-cas > http [FIN, ACK] Seq=515 Ack=4939 Win=63909 Len=0
628872 199.505518 244.3.151.202 -> 244.3.160.239 TCP 64 16006 > http [ACK] Seq=785 Ack=37402 Win=43885 Len=0
628875 199.505599 244.3.151.202 -> 244.3.160.239 TCP 66 15565 > http [SYN] Seq=0 Win=64512 Len=0 MSS=1380 SACK_PERM=1
628886 199.506991 244.3.151.202 -> 244.3.160.239 TCP 64 16006 > http [ACK] Seq=785 Ack=39451 Win=41836 Len=0
628887 199.506995 244.3.151.202 -> 244.3.160.239 TCP 64 15565 > http [ACK] Seq=1 Ack=1 Win=64512 Len=0
628893 199.507164 244.3.151.202 -> 244.3.160.239 TCP 64 16006 > http [ACK] Seq=785 Ack=40111 Win=41177 Len=0
629000 199.518982 244.3.151.202 -> 244.3.160.239 TCP 64 15565 > http [ACK] Seq=509 Ack=1576 Win=64512 Len=0
629019 199.521320 244.3.151.202 -> 244.3.160.239 TCP 64 15565 > http [ACK] Seq=509 Ack=4129 Win=64512 Len=0
629023 199.521669 244.3.151.202 -> 244.3.160.239 TCP 64 15565 > http [ACK] Seq=509 Ack=6889 Win=64512 Len=0
629025 199.521890 244.3.151.202 -> 244.3.160.239 TCP 64 16006 > http [FIN, ACK] Seq=785 Ack=40111 Win=64512 Len=0
629048 199.524378 244.3.151.202 -> 244.3.160.239 TCP 64 15565 > http [ACK] Seq=509 Ack=9649 Win=64512 Len=0
629049 199.524383 244.3.151.202 -> 244.3.160.239 TCP 64 15565 > http [ACK] Seq=509 Ack=12409 Win=64512 Len=0
629064 199.525844 244.3.151.202 -> 244.3.160.239 TCP 64 15565 > http [ACK] Seq=509 Ack=15169 Win=64512 Len=0
629066 199.526199 244.3.151.202 -> 244.3.160.239 TCP 64 15565 > http [ACK] Seq=509 Ack=17929 Win=64512 Len=0
629089 199.528125 244.3.151.202 -> 244.3.160.239 TCP 64 15565 > http [ACK] Seq=509 Ack=19369 Win=64512 Len=0
629090 199.528416 244.3.151.202 -> 244.3.160.239 TCP 64 15565 > http [ACK] Seq=509 Ack=22129 Win=64512 Len=0
629092 199.528735 244.3.151.202 -> 244.3.160.239 TCP 64 15565 > http [ACK] Seq=509 Ack=24889 Win=64512 Len=0
629093 199.528760 244.3.151.202 -> 244.3.160.239 TCP 64 15565 > http [ACK] Seq=509 Ack=27612 Win=64512 Len=0
629094 199.528993 244.3.151.202 -> 244.3.160.239 TCP 64 15565 > http [FIN, ACK] Seq=509 Ack=27612 Win=64512 Len=0
629104 199.531760 244.3.151.202 -> 244.3.160.239 TCP 64 15565 > http [ACK] Seq=510 Ack=27613 Win=64512 Len=0
629117 199.538447 244.3.151.202 -> 244.3.160.239 TCP 66 nuts-dem > http [SYN] Seq=0 Win=64512 Len=0 MSS=1380 SACK_PERM=1
629120 199.539557 244.3.151.202 -> 244.3.160.239 TCP 64 nuts-dem > http [ACK] Seq=1 Ack=1 Win=64512 Len=0
629122 199.539809 244.3.151.202 -> 244.3.160.239 TCP 66 14505 > http [SYN] Seq=0 Win=64512 Len=0 MSS=1380 SACK_PERM=1
629129 199.540724 244.3.151.202 -> 244.3.160.239 TCP 64 14505 > http [ACK] Seq=1 Ack=1 Win=64512 Len=0
629238 199.582958 244.3.151.202 -> 244.3.160.239 TCP 64 nuts-dem > http [ACK] Seq=521 Ack=239 Win=64274 Len=0
629243 199.583047 244.3.151.202 -> 244.3.160.239 TCP 64 nuts-dem > http [FIN, ACK] Seq=521 Ack=239 Win=64274 Len=0
629244 199.583051 244.3.151.202 -> 244.3.160.239 TCP 64 14505 > http [ACK] Seq=515 Ack=1583 Win=64512 Len=0
629251 199.583353 244.3.151.202 -> 244.3.160.239 TCP 64 nuts-dem > http [ACK] Seq=522 Ack=240 Win=64274 Len=0
629269 199.585352 244.3.151.202 -> 244.3.160.239 TCP 64 14505 > http [ACK] Seq=515 Ack=4343 Win=64512 Len=0
629270 199.585357 244.3.151.202 -> 244.3.160.239 TCP 64 14505 > http [ACK] Seq=515 Ack=7103 Win=64132 Len=0
629271 199.585362 244.3.151.202 -> 244.3.160.239 TCP 64 [TCP Dup ACK 629270#1] 14505 > http [ACK] Seq=515 Ack=7103 Win=64132 Len=0
629294 199.586687 244.3.151.202 -> 244.3.160.239 TCP 64 14505 > http [ACK] Seq=515 Ack=9863 Win=64512 Len=0
629295 199.586924 244.3.151.202 -> 244.3.160.239 TCP 64 14505 > http [ACK] Seq=515 Ack=11243 Win=64512 Len=0
629301 199.587402 244.3.151.202 -> 244.3.160.239 TCP 64 14505 > http [ACK] Seq=515 Ack=13789 Win=64512 Len=0
629302 199.587407 244.3.151.202 -> 244.3.160.239 TCP 64 14505 > http [ACK] Seq=515 Ack=15169 Win=64512 Len=0
629303 199.587910 244.3.151.202 -> 244.3.160.239 TCP 64 14505 > http [ACK] Seq=515 Ack=16799 Win=64512 Len=0
629304 199.588012 244.3.151.202 -> 244.3.160.239 TCP 64 14505 > http [FIN, ACK] Seq=515 Ack=16799 Win=64512 Len=0
629336 199.598666 244.3.151.202 -> 244.3.160.239 TCP 66 8552 > http [SYN] Seq=0 Win=64512 Len=0 MSS=1380 SACK_PERM=1
629338 199.599625 244.3.151.202 -> 244.3.160.239 TCP 64 8552 > http [ACK] Seq=1 Ack=1 Win=64512 Len=0
629434 199.611893 244.3.151.202 -> 244.3.160.239 TCP 64 8552 > http [ACK] Seq=521 Ack=1582 Win=64512 Len=0
629435 199.611897 244.3.151.202 -> 244.3.160.239 TCP 64 8552 > http [ACK] Seq=521 Ack=3582 Win=64512 Len=0
629436 199.611901 244.3.151.202 -> 244.3.160.239 TCP 64 8552 > http [ACK] Seq=521 Ack=3583 Win=64512 Len=0
629438 199.612191 244.3.151.202 -> 244.3.160.239 TCP 64 8552 > http [FIN, ACK] Seq=521 Ack=3583 Win=64512 Len=0
629512 199.619292 244.3.151.202 -> 244.3.160.239 TCP 66 scservp > http [SYN] Seq=0 Win=64512 Len=0 MSS=1380 SACK_PERM=1
629514 199.620264 244.3.151.202 -> 244.3.160.239 TCP 64 scservp > http [ACK] Seq=1 Ack=1 Win=64512 Len=0
629594 199.640767 244.3.151.202 -> 244.3.160.239 TCP 64 scservp > http [ACK] Seq=521 Ack=1582 Win=64512 Len=0
629611 199.642123 244.3.151.202 -> 244.3.160.239 TCP 64 scservp > http [ACK] Seq=521 Ack=4342 Win=64512 Len=0
629617 199.642725 244.3.151.202 -> 244.3.160.239 TCP 64 scservp > http [ACK] Seq=521 Ack=6890 Win=64512 Len=0
629620 199.643330 244.3.151.202 -> 244.3.160.239 TCP 64 scservp > http [ACK] Seq=521 Ack=9554 Win=64228 Len=0
629621 199.643335 244.3.151.202 -> 244.3.160.239 TCP 64 [TCP Dup ACK 629620#1] scservp > http [ACK] Seq=521 Ack=9554 Win=64228 Len=0
629622 199.643514 244.3.151.202 -> 244.3.160.239 TCP 64 scservp > http [FIN, ACK] Seq=521 Ack=9554 Win=64228 Len=0
629629 199.652003 244.3.151.202 -> 244.3.160.239 TCP 64 scservp > http [ACK] Seq=522 Ack=9555 Win=64228 Len=0
629761 199.670306 244.3.151.202 -> 244.3.160.239 TCP 66 9558 > http [SYN] Seq=0 Win=64512 Len=0 MSS=1380 SACK_PERM=1
629762 199.670311 244.3.151.202 -> 244.3.160.239 TCP 66 5108 > http [SYN] Seq=0 Win=64512 Len=0 MSS=1380 SACK_PERM=1
629769 199.671295 244.3.151.202 -> 244.3.160.239 TCP 64 9558 > http [ACK] Seq=1 Ack=1 Win=64512 Len=0
629771 199.671304 244.3.151.202 -> 244.3.160.239 TCP 64 5108 > http [ACK] Seq=1 Ack=1 Win=64512 Len=0
629912 199.720224 244.3.151.202 -> 244.3.160.239 TCP 64 9558 > http [ACK] Seq=524 Ack=243 Win=64270 Len=0
629914 199.720361 244.3.151.202 -> 244.3.160.239 TCP 64 9558 > http [FIN, ACK] Seq=524 Ack=243 Win=64270 Len=0
629916 199.720640 244.3.151.202 -> 244.3.160.239 TCP 64 5108 > http [ACK] Seq=521 Ack=1576 Win=64512 Len=0
629917 199.720663 244.3.151.202 -> 244.3.160.239 TCP 64 5108 > http [ACK] Seq=521 Ack=3644 Win=64512 Len=0
629919 199.720988 244.3.151.202 -> 244.3.160.239 TCP 64 5108 > http [FIN, ACK] Seq=521 Ack=3644 Win=64512 Len=0
629921 199.721296 244.3.151.202 -> 244.3.160.239 TCP 66 8225 > http [SYN] Seq=0 Win=64512 Len=0 MSS=1380 SACK_PERM=1
629923 199.722355 244.3.151.202 -> 244.3.160.239 TCP 64 8225 > http [ACK] Seq=1 Ack=1 Win=64512 Len=0
629926 199.722924 244.3.151.202 -> 244.3.160.239 TCP 66 x11 > http [SYN] Seq=0 Win=64512 Len=0 MSS=1380 SACK_PERM=1
629938 199.723949 244.3.151.202 -> 244.3.160.239 TCP 64 x11 > http [ACK] Seq=1 Ack=1 Win=64512 Len=0
630007 199.734494 244.3.151.202 -> 244.3.160.239 TCP 64 9558 > http [ACK] Seq=525 Ack=244 Win=64270 Len=0
630032 199.735328 244.3.151.202 -> 244.3.160.239 TCP 64 5108 > http [ACK] Seq=522 Ack=3645 Win=64512 Len=0
630041 199.735742 244.3.151.202 -> 244.3.160.239 TCP 64 x11 > http [ACK] Seq=532 Ack=1576 Win=64512 Len=0
630048 199.735917 244.3.151.202 -> 244.3.160.239 TCP 64 x11 > http [FIN, ACK] Seq=532 Ack=1691 Win=64397 Len=0
630056 199.736170 244.3.151.202 -> 244.3.160.239 TCP 64 8225 > http [ACK] Seq=523 Ack=1471 Win=64512 Len=0
630073 199.736503 244.3.151.202 -> 244.3.160.239 TCP 64 8225 > http [FIN, ACK] Seq=523 Ack=1471 Win=64512 Len=0
630074 199.736507 244.3.151.202 -> 244.3.160.239 TCP 64 x11 > http [ACK] Seq=533 Ack=1692 Win=64397 Len=0
630075 199.736512 244.3.151.202 -> 244.3.160.239 TCP 64 8225 > http [ACK] Seq=524 Ack=1472 Win=64512 Len=0
630084 199.736735 244.3.151.202 -> 244.3.160.239 TCP 66 14711 > http [SYN] Seq=0 Win=64512 Len=0 MSS=1380 SACK_PERM=1
630110 199.738622 244.3.151.202 -> 244.3.160.239 TCP 66 7608 > http [SYN] Seq=0 Win=64512 Len=0 MSS=1380 SACK_PERM=1
630111 199.738626 244.3.151.202 -> 244.3.160.239 TCP 64 14711 > http [ACK] Seq=1 Ack=1 Win=64512 Len=0
630131 199.740185 244.3.151.202 -> 244.3.160.239 TCP 64 7608 > http [ACK] Seq=1 Ack=1 Win=64512 Len=0
630464 199.811785 244.3.151.202 -> 244.3.160.239 TCP 64 14711 > http [ACK] Seq=531 Ack=1576 Win=64512 Len=0
630466 199.811822 244.3.151.202 -> 244.3.160.239 TCP 64 7608 > http [ACK] Seq=528 Ack=1576 Win=64512 Len=0
630469 199.811946 244.3.151.202 -> 244.3.160.239 TCP 64 14711 > http [FIN, ACK] Seq=531 Ack=1980 Win=64108 Len=0
630470 199.811950 244.3.151.202 -> 244.3.160.239 TCP 64 7608 > http [FIN, ACK] Seq=528 Ack=1778 Win=64310 Len=0
630486 199.812900 244.3.151.202 -> 244.3.160.239 TCP 64 14711 > http [ACK] Seq=532 Ack=1981 Win=64108 Len=0
630503 199.813915 244.3.151.202 -> 244.3.160.239 TCP 64 7608 > http [ACK] Seq=529 Ack=1779 Win=64310 Len=0
630515 199.815398 244.3.151.202 -> 244.3.160.239 TCP 66 aimpp-hello > http [SYN] Seq=0 Win=64512 Len=0 MSS=1380 SACK_PERM=1
630516 199.815403 244.3.151.202 -> 244.3.160.239 TCP 66 10485 > http [SYN] Seq=0 Win=64512 Len=0 MSS=1380 SACK_PERM=1
630526 199.816246 244.3.151.202 -> 244.3.160.239 TCP 64 aimpp-hello > http [ACK] Seq=1 Ack=1 Win=64512 Len=0
630527 199.816250 244.3.151.202 -> 244.3.160.239 TCP 64 10485 > http [ACK] Seq=1 Ack=1 Win=64512 Len=0
630696 199.844776 244.3.151.202 -> 244.3.160.239 TCP 64 aimpp-hello > http [ACK] Seq=529 Ack=1576 Win=64512 Len=0
630698 199.844887 244.3.151.202 -> 244.3.160.239 TCP 64 aimpp-hello > http [FIN, ACK] Seq=529 Ack=2323 Win=63765 Len=0
630709 199.845594 244.3.151.202 -> 244.3.160.239 TCP 66 10446 > http [SYN] Seq=0 Win=64512 Len=0 MSS=1380 SACK_PERM=1
630710 199.845598 244.3.151.202 -> 244.3.160.239 TCP 64 10485 > http [ACK] Seq=529 Ack=1576 Win=64512 Len=0
630711 199.845602 244.3.151.202 -> 244.3.160.239 TCP 64 aimpp-hello > http [ACK] Seq=530 Ack=2324 Win=63765 Len=0
630712 199.845607 244.3.151.202 -> 244.3.160.239 TCP 64 10485 > http [ACK] Seq=529 Ack=2052 Win=64037 Len=0
630713 199.845611 244.3.151.202 -> 244.3.160.239 TCP 64 10485 > http [FIN, ACK] Seq=529 Ack=2052 Win=64037 Len=0
630721 199.846653 244.3.151.202 -> 244.3.160.239 TCP 64 10446 > http [ACK] Seq=1 Ack=1 Win=64512 Len=0
630724 199.848717 244.3.151.202 -> 244.3.160.239 TCP 66 15446 > http [SYN] Seq=0 Win=64512 Len=0 MSS=1380 SACK_PERM=1
630729 199.849786 244.3.151.202 -> 244.3.160.239 TCP 64 15446 > http [ACK] Seq=1 Ack=1 Win=64512 Len=0
630820 199.887549 244.3.151.202 -> 244.3.160.239 TCP 64 10446 > http [ACK] Seq=527 Ack=1576 Win=64512 Len=0
630821 199.887553 244.3.151.202 -> 244.3.160.239 TCP 64 15446 > http [ACK] Seq=528 Ack=1576 Win=64512 Len=0
630822 199.887557 244.3.151.202 -> 244.3.160.239 TCP 64 10446 > http [FIN, ACK] Seq=527 Ack=1983 Win=64105 Len=0
630824 199.887674 244.3.151.202 -> 244.3.160.239 TCP 64 15446 > http [FIN, ACK] Seq=528 Ack=2230 Win=63858 Len=0
630832 199.888645 244.3.151.202 -> 244.3.160.239 TCP 64 10446 > http [ACK] Seq=528 Ack=1984 Win=64105 Len=0
630848 199.889246 244.3.151.202 -> 244.3.160.239 TCP 64 15446 > http [ACK] Seq=529 Ack=2231 Win=63858 Len=0
630869 199.891319 244.3.151.202 -> 244.3.160.239 TCP 66 5904 > http [SYN] Seq=0 Win=64512 Len=0 MSS=1380 SACK_PERM=1
630870 199.891324 244.3.151.202 -> 244.3.160.239 TCP 66 rsms > http [SYN] Seq=0 Win=64512 Len=0 MSS=1380 SACK_PERM=1
630879 199.893480 244.3.151.202 -> 244.3.160.239 TCP 64 5904 > http [ACK] Seq=1 Ack=1 Win=64512 Len=0
630880 199.893719 244.3.151.202 -> 244.3.160.239 TCP 64 rsms > http [ACK] Seq=1 Ack=1 Win=64512 Len=0
630987 199.937692 244.3.151.202 -> 244.3.160.239 TCP 64 5904 > http [ACK] Seq=530 Ack=882 Win=63631 Len=0
630990 199.938142 244.3.151.202 -> 244.3.160.239 TCP 64 5904 > http [FIN, ACK] Seq=530 Ack=882 Win=63631 Len=0
630992 199.938308 244.3.151.202 -> 244.3.160.239 TCP 64 rsms > http [ACK] Seq=522 Ack=812 Win=63701 Len=0
630993 199.938312 244.3.151.202 -> 244.3.160.239 TCP 64 5904 > http [ACK] Seq=531 Ack=883 Win=63631 Len=0
630994 199.938317 244.3.151.202 -> 244.3.160.239 TCP 64 rsms > http [ACK] Seq=522 Ack=813 Win=63701 Len=0
630996 199.938465 244.3.151.202 -> 244.3.160.239 TCP 64 rsms > http [FIN, ACK] Seq=522 Ack=813 Win=63701 Len=0
630997 199.938469 244.3.151.202 -> 244.3.160.239 TCP 66 6391 > http [SYN] Seq=0 Win=64512 Len=0 MSS=1380 SACK_PERM=1
631004 199.939936 244.3.151.202 -> 244.3.160.239 TCP 64 6391 > http [ACK] Seq=1 Ack=1 Win=64512 Len=0
631016 199.941559 244.3.151.202 -> 244.3.160.239 TCP 66 16224 > http [SYN] Seq=0 Win=64512 Len=0 MSS=1380 SACK_PERM=1
631022 199.943214 244.3.151.202 -> 244.3.160.239 TCP 64 16224 > http [ACK] Seq=1 Ack=1 Win=64512 Len=0
631082 199.953472 244.3.151.202 -> 244.3.160.239 TCP 64 6391 > http [ACK] Seq=532 Ack=791 Win=63722 Len=0
631083 199.953476 244.3.151.202 -> 244.3.160.239 TCP 64 16224 > http [ACK] Seq=562 Ack=675 Win=63838 Len=0
631084 199.953642 244.3.151.202 -> 244.3.160.239 TCP 64 6391 > http [FIN, ACK] Seq=532 Ack=791 Win=63722 Len=0
631087 199.954784 244.3.151.202 -> 244.3.160.239 TCP 64 16224 > http [FIN, ACK] Seq=562 Ack=675 Win=63838 Len=0
631089 199.956064 244.3.151.202 -> 244.3.160.239 TCP 66 4385 > http [SYN] Seq=0 Win=64512 Len=0 MSS=1380 SACK_PERM=1
631093 199.959973 244.3.151.202 -> 244.3.160.239 TCP 64 4385 > http [ACK] Seq=1 Ack=1 Win=64512 Len=0
631158 199.964856 244.3.151.202 -> 244.3.160.239 TCP 64 6391 > http [ACK] Seq=533 Ack=792 Win=63722 Len=0
631161 199.964923 244.3.151.202 -> 244.3.160.239 TCP 64 16224 > http [ACK] Seq=563 Ack=676 Win=63838 Len=0
631351 200.041376 244.3.151.202 -> 244.3.160.239 TCP 64 4385 > http [ACK] Seq=571 Ack=1070 Win=63443 Len=0
631352 200.041380 244.3.151.202 -> 244.3.160.239 TCP 64 4385 > http [ACK] Seq=571 Ack=1071 Win=63443 Len=0
631353 200.041384 244.3.151.202 -> 244.3.160.239 TCP 64 4385 > http [FIN, ACK] Seq=571 Ack=1071 Win=63443 Len=0
639786 201.943786 244.3.151.202 -> 244.3.160.239 TCP 66 cspmulti > http [SYN] Seq=0 Win=64512 Len=0 MSS=1380 SACK_PERM=1
639788 201.944804 244.3.151.202 -> 244.3.160.239 TCP 64 cspmulti > http [ACK] Seq=1 Ack=1 Win=64512 Len=0
640680 202.209255 244.3.151.202 -> 244.3.160.239 TCP 70 cspmulti > http [ACK] Seq=980 Ack=1381 Win=64512 Len=0 SLE=2050 SRE=2355
640681 202.209260 244.3.151.202 -> 244.3.160.239 TCP 64 cspmulti > http [ACK] Seq=980 Ack=2355 Win=63538 Len=0
640689 202.210558 244.3.151.202 -> 244.3.160.239 TCP 64 cspmulti > http [ACK] Seq=980 Ack=4455 Win=64512 Len=0
640697 202.212465 244.3.151.202 -> 244.3.160.239 TCP 64 cspmulti > http [ACK] Seq=980 Ack=6596 Win=64512 Len=0
640699 202.213474 244.3.151.202 -> 244.3.160.239 TCP 64 cspmulti > http [ACK] Seq=980 Ack=8645 Win=64512 Len=0
640714 202.215524 244.3.151.202 -> 244.3.160.239 TCP 64 cspmulti > http [ACK] Seq=980 Ack=10732 Win=64512 Len=0
640721 202.216276 244.3.151.202 -> 244.3.160.239 TCP 64 cspmulti > http [ACK] Seq=980 Ack=12781 Win=62463 Len=0
640729 202.217641 244.3.151.202 -> 244.3.160.239 TCP 64 cspmulti > http [ACK] Seq=980 Ack=14830 Win=60414 Len=0
640733 202.218857 244.3.151.202 -> 244.3.160.239 TCP 64 cspmulti > http [ACK] Seq=980 Ack=16893 Win=58351 Len=0
640737 202.220069 244.3.151.202 -> 244.3.160.239 TCP 64 cspmulti > http [ACK] Seq=980 Ack=18944 Win=56300 Len=0
640749 202.221592 244.3.151.202 -> 244.3.160.239 TCP 64 cspmulti > http [ACK] Seq=980 Ack=21205 Win=54039 Len=0
640757 202.223081 244.3.151.202 -> 244.3.160.239 TCP 64 cspmulti > http [ACK] Seq=980 Ack=23269 Win=51975 Len=0
640765 202.224630 244.3.151.202 -> 244.3.160.239 TCP 64 cspmulti > http [ACK] Seq=980 Ack=25494 Win=49750 Len=0
640771 202.225577 244.3.151.202 -> 244.3.160.239 TCP 64 cspmulti > http [ACK] Seq=980 Ack=27559 Win=47685 Len=0
640775 202.226857 244.3.151.202 -> 244.3.160.239 TCP 64 cspmulti > http [ACK] Seq=980 Ack=29608 Win=45636 Len=0
640790 202.228391 244.3.151.202 -> 244.3.160.239 TCP 64 cspmulti > http [ACK] Seq=980 Ack=31657 Win=43587 Len=0
640798 202.229610 244.3.151.202 -> 244.3.160.239 TCP 64 cspmulti > http [ACK] Seq=980 Ack=33707 Win=41537 Len=0
640804 202.230777 244.3.151.202 -> 244.3.160.239 TCP 64 cspmulti > http [ACK] Seq=980 Ack=35756 Win=39488 Len=0
640809 202.231991 244.3.151.202 -> 244.3.160.239 TCP 64 cspmulti > http [ACK] Seq=980 Ack=37818 Win=37426 Len=0
640822 202.233712 244.3.151.202 -> 244.3.160.239 TCP 64 cspmulti > http [ACK] Seq=980 Ack=39869 Win=35375 Len=0
640824 202.234700 244.3.151.202 -> 244.3.160.239 TCP 64 cspmulti > http [ACK] Seq=980 Ack=41918 Win=33326 Len=0
640835 202.236071 244.3.151.202 -> 244.3.160.239 TCP 64 cspmulti > http [ACK] Seq=980 Ack=43994 Win=31250 Len=0
640842 202.237199 244.3.151.202 -> 244.3.160.239 TCP 64 cspmulti > http [ACK] Seq=980 Ack=46047 Win=29197 Len=0
640851 202.238382 244.3.151.202 -> 244.3.160.239 TCP 64 cspmulti > http [ACK] Seq=980 Ack=48096 Win=27148 Len=0
640854 202.239397 244.3.151.202 -> 244.3.160.239 TCP 64 cspmulti > http [ACK] Seq=980 Ack=50160 Win=25084 Len=0
640859 202.240556 244.3.151.202 -> 244.3.160.239 TCP 64 cspmulti > http [ACK] Seq=980 Ack=52221 Win=23023 Len=0
640868 202.242279 244.3.151.202 -> 244.3.160.239 TCP 64 cspmulti > http [ACK] Seq=980 Ack=54270 Win=20974 Len=0
640877 202.243240 244.3.151.202 -> 244.3.160.239 TCP 64 cspmulti > http [ACK] Seq=980 Ack=56325 Win=18919 Len=0
640878 202.243857 244.3.151.202 -> 244.3.160.239 TCP 64 cspmulti > http [ACK] Seq=980 Ack=57319 Win=17926 Len=0
641068 202.315201 244.3.151.202 -> 244.3.160.239 TCP 64 cspmulti > http [FIN, ACK] Seq=980 Ack=57319 Win=64512 Len=0
641074 202.321865 244.3.151.202 -> 244.3.160.239 TCP 66 13311 > http [SYN] Seq=0 Win=64512 Len=0 MSS=1380 SACK_PERM=1
641076 202.322292 244.3.151.202 -> 244.3.160.239 TCP 66 4923 > http [SYN] Seq=0 Win=64512 Len=0 MSS=1380 SACK_PERM=1
641079 202.323019 244.3.151.202 -> 244.3.160.239 TCP 64 13311 > http [ACK] Seq=1 Ack=1 Win=64512 Len=0
641081 202.323397 244.3.151.202 -> 244.3.160.239 TCP 64 4923 > http [ACK] Seq=1 Ack=1 Win=64512 Len=0
641213 202.355335 244.3.151.202 -> 244.3.160.239 TCP 64 13311 > http [ACK] Seq=699 Ack=1575 Win=64512 Len=0
641220 202.356057 244.3.151.202 -> 244.3.160.239 TCP 64 4923 > http [ACK] Seq=679 Ack=1583 Win=64512 Len=0
641233 202.356997 244.3.151.202 -> 244.3.160.239 TCP 64 13311 > http [ACK] Seq=699 Ack=4335 Win=64512 Len=0
641234 202.357002 244.3.151.202 -> 244.3.160.239 TCP 64 13311 > http [ACK] Seq=699 Ack=6890 Win=64337 Len=0
641235 202.357071 244.3.151.202 -> 244.3.160.239 TCP 64 [TCP Dup ACK 641234#1] 13311 > http [ACK] Seq=699 Ack=6890 Win=64337 Len=0
641240 202.357473 244.3.151.202 -> 244.3.160.239 TCP 64 4923 > http [ACK] Seq=679 Ack=4343 Win=64512 Len=0
641241 202.357478 244.3.151.202 -> 244.3.160.239 TCP 64 4923 > http [ACK] Seq=679 Ack=6889 Win=64346 Len=0
641242 202.357590 244.3.151.202 -> 244.3.160.239 TCP 64 [TCP Dup ACK 641241#1] 4923 > http [ACK] Seq=679 Ack=6889 Win=64346 Len=0
641256 202.358499 244.3.151.202 -> 244.3.160.239 TCP 64 13311 > http [ACK] Seq=699 Ack=7518 Win=63710 Len=0
641257 202.358503 244.3.151.202 -> 244.3.160.239 TCP 64 13311 > http [FIN, ACK] Seq=699 Ack=7518 Win=63710 Len=0
641267 202.359307 244.3.151.202 -> 244.3.160.239 TCP 64 4923 > http [ACK] Seq=679 Ack=9649 Win=64512 Len=0
641268 202.359312 244.3.151.202 -> 244.3.160.239 TCP 64 4923 > http [ACK] Seq=679 Ack=13789 Win=64512 Len=0
641269 202.359316 244.3.151.202 -> 244.3.160.239 TCP 64 4923 > http [ACK] Seq=679 Ack=11029 Win=64512 Len=0
641270 202.359320 244.3.151.202 -> 244.3.160.239 TCP 64 4923 > http [ACK] Seq=679 Ack=15169 Win=64512 Len=0
641293 202.360766 244.3.151.202 -> 244.3.160.239 TCP 64 4923 > http [ACK] Seq=679 Ack=17929 Win=64512 Len=0
641314 202.363283 244.3.151.202 -> 244.3.160.239 TCP 64 4923 > http [ACK] Seq=679 Ack=19369 Win=64512 Len=0
641315 202.363287 244.3.151.202 -> 244.3.160.239 TCP 64 4923 > http [ACK] Seq=679 Ack=24889 Win=64512 Len=0
641316 202.363332 244.3.151.202 -> 244.3.160.239 TCP 64 4923 > http [ACK] Seq=679 Ack=31129 Win=59652 Len=0
641317 202.363336 244.3.151.202 -> 244.3.160.239 TCP 64 4923 > http [ACK] Seq=679 Ack=22129 Win=64132 Len=0
641318 202.363340 244.3.151.202 -> 244.3.160.239 TCP 64 [TCP Dup ACK 641317#1] 4923 > http [ACK] Seq=679 Ack=22129 Win=64132 Len=0
641319 202.363344 244.3.151.202 -> 244.3.160.239 TCP 64 4923 > http [ACK] Seq=679 Ack=26269 Win=64512 Len=0
641320 202.363348 244.3.151.202 -> 244.3.160.239 TCP 64 4923 > http [ACK] Seq=679 Ack=28369 Win=62412 Len=0
641323 202.363624 244.3.151.202 -> 244.3.160.239 TCP 64 4923 > http [ACK] Seq=679 Ack=31129 Win=63412 Len=0
641324 202.363628 244.3.151.202 -> 244.3.160.239 TCP 64 [TCP Dup ACK 641323#1] 4923 > http [ACK] Seq=679 Ack=31129 Win=63412 Len=0
641345 202.364786 244.3.151.202 -> 244.3.160.239 TCP 64 4923 > http [ACK] Seq=679 Ack=33889 Win=64512 Len=0
641347 202.364857 244.3.151.202 -> 244.3.160.239 TCP 64 4923 > http [ACK] Seq=679 Ack=35269 Win=64512 Len=0
641357 202.365661 244.3.151.202 -> 244.3.160.239 TCP 64 4923 > http [ACK] Seq=679 Ack=37369 Win=64512 Len=0
641361 202.366071 244.3.151.202 -> 244.3.160.239 TCP 64 4923 > http [ACK] Seq=679 Ack=40129 Win=64512 Len=0
641362 202.366100 244.3.151.202 -> 244.3.160.239 TCP 64 4923 > http [ACK] Seq=679 Ack=42889 Win=64512 Len=0
641365 202.366315 244.3.151.202 -> 244.3.160.239 TCP 64 4923 > http [ACK] Seq=679 Ack=44989 Win=64512 Len=0
641390 202.368271 244.3.151.202 -> 244.3.160.239 TCP 64 4923 > http [ACK] Seq=679 Ack=47749 Win=64512 Len=0
641391 202.368482 244.3.151.202 -> 244.3.160.239 TCP 64 4923 > http [ACK] Seq=679 Ack=50509 Win=64512 Len=0
641392 202.368899 244.3.151.202 -> 244.3.160.239 TCP 64 4923 > http [ACK] Seq=679 Ack=53269 Win=64512 Len=0
641430 202.371396 244.3.151.202 -> 244.3.160.239 TCP 64 4923 > http [ACK] Seq=679 Ack=55369 Win=64512 Len=0
641435 202.371722 244.3.151.202 -> 244.3.160.239 TCP 64 4923 > http [ACK] Seq=679 Ack=58129 Win=64512 Len=0
641440 202.372126 244.3.151.202 -> 244.3.160.239 TCP 64 4923 > http [ACK] Seq=679 Ack=60889 Win=64512 Len=0
641456 202.373883 244.3.151.202 -> 244.3.160.239 TCP 64 4923 > http [ACK] Seq=679 Ack=62989 Win=64512 Len=0
641457 202.373887 244.3.151.202 -> 244.3.160.239 TCP 64 4923 > http [ACK] Seq=679 Ack=71269 Win=61752 Len=0
641458 202.373892 244.3.151.202 -> 244.3.160.239 TCP 64 4923 > http [ACK] Seq=679 Ack=71989 Win=64512 Len=0
641463 202.374174 244.3.151.202 -> 244.3.160.239 TCP 64 4923 > http [ACK] Seq=679 Ack=68509 Win=64512 Len=0
641464 202.374178 244.3.151.202 -> 244.3.160.239 TCP 64 4923 > http [ACK] Seq=679 Ack=65749 Win=64512 Len=0
641489 202.375186 244.3.151.202 -> 244.3.160.239 TCP 64 4923 > http [ACK] Seq=679 Ack=74749 Win=64512 Len=0
641490 202.375618 244.3.151.202 -> 244.3.160.239 TCP 64 4923 > http [ACK] Seq=679 Ack=77509 Win=64512 Len=0
641491 202.375765 244.3.151.202 -> 244.3.160.239 TCP 64 4923 > http [ACK] Seq=679 Ack=80269 Win=64512 Len=0
641492 202.376007 244.3.151.202 -> 244.3.160.239 TCP 64 4923 > http [ACK] Seq=679 Ack=82369 Win=64512 Len=0
641493 202.376180 244.3.151.202 -> 244.3.160.239 TCP 64 4923 > http [ACK] Seq=679 Ack=84949 Win=64512 Len=0
641494 202.376261 244.3.151.202 -> 244.3.160.239 TCP 64 4923 > http [FIN, ACK] Seq=679 Ack=84949 Win=64512 Len=0
641514 202.379942 244.3.151.202 -> 244.3.160.239 TCP 64 4923 > http [ACK] Seq=680 Ack=84950 Win=64512 Len=0
641680 202.434072 244.3.151.202 -> 244.3.160.239 TCP 66 11784 > http [SYN] Seq=0 Win=64512 Len=0 MSS=1380 SACK_PERM=1
641684 202.435311 244.3.151.202 -> 244.3.160.239 TCP 64 11784 > http [ACK] Seq=1 Ack=1 Win=64512 Len=0
641788 202.458159 244.3.151.202 -> 244.3.160.239 TCP 64 11784 > http [ACK] Seq=685 Ack=1584 Win=64512 Len=0
641797 202.459706 244.3.151.202 -> 244.3.160.239 TCP 64 11784 > http [ACK] Seq=685 Ack=4344 Win=64512 Len=0
641804 202.460691 244.3.151.202 -> 244.3.160.239 TCP 64 11784 > http [ACK] Seq=685 Ack=6888 Win=64512 Len=0
641806 202.461380 244.3.151.202 -> 244.3.160.239 TCP 64 11784 > http [ACK] Seq=685 Ack=9648 Win=64512 Len=0
641808 202.462157 244.3.151.202 -> 244.3.160.239 TCP 64 11784 > http [ACK] Seq=685 Ack=12408 Win=64512 Len=0
641829 202.464223 244.3.151.202 -> 244.3.160.239 TCP 64 11784 > http [ACK] Seq=685 Ack=15168 Win=64512 Len=0
641830 202.465080 244.3.151.202 -> 244.3.160.239 TCP 64 11784 > http [ACK] Seq=685 Ack=17928 Win=64512 Len=0
641850 202.469279 244.3.151.202 -> 244.3.160.239 TCP 64 11784 > http [ACK] Seq=685 Ack=19368 Win=64512 Len=0
641855 202.470083 244.3.151.202 -> 244.3.160.239 TCP 64 11784 > http [ACK] Seq=685 Ack=22128 Win=64512 Len=0
641857 202.470636 244.3.151.202 -> 244.3.160.239 TCP 64 11784 > http [ACK] Seq=685 Ack=24888 Win=64512 Len=0
641858 202.470800 244.3.151.202 -> 244.3.160.239 TCP 64 11784 > http [ACK] Seq=685 Ack=26988 Win=64512 Len=0
641883 202.474042 244.3.151.202 -> 244.3.160.239 TCP 64 11784 > http [ACK] Seq=685 Ack=29748 Win=64512 Len=0
641906 202.476907 244.3.151.202 -> 244.3.160.239 TCP 64 11784 > http [ACK] Seq=685 Ack=32508 Win=64512 Len=0
641907 202.477178 244.3.151.202 -> 244.3.160.239 TCP 64 11784 > http [ACK] Seq=685 Ack=35268 Win=64512 Len=0
641924 202.480775 244.3.151.202 -> 244.3.160.239 TCP 64 11784 > http [ACK] Seq=685 Ack=37368 Win=64512 Len=0
641931 202.481926 244.3.151.202 -> 244.3.160.239 TCP 64 11784 > http [ACK] Seq=685 Ack=40128 Win=64512 Len=0
641933 202.482483 244.3.151.202 -> 244.3.160.239 TCP 64 11784 > http [ACK] Seq=685 Ack=42888 Win=64512 Len=0
641935 202.482716 244.3.151.202 -> 244.3.160.239 TCP 64 11784 > http [ACK] Seq=685 Ack=44988 Win=64512 Len=0
641955 202.484645 244.3.151.202 -> 244.3.160.239 TCP 64 11784 > http [ACK] Seq=685 Ack=47748 Win=64512 Len=0
641958 202.484857 244.3.151.202 -> 244.3.160.239 TCP 64 11784 > http [ACK] Seq=685 Ack=50508 Win=64512 Len=0
641960 202.485908 244.3.151.202 -> 244.3.160.239 TCP 64 11784 > http [ACK] Seq=685 Ack=53268 Win=64512 Len=0
641983 202.490102 244.3.151.202 -> 244.3.160.239 TCP 64 11784 > http [ACK] Seq=685 Ack=55368 Win=64512 Len=0
641989 202.490905 244.3.151.202 -> 244.3.160.239 TCP 64 11784 > http [ACK] Seq=685 Ack=58128 Win=64512 Len=0
641994 202.491842 244.3.151.202 -> 244.3.160.239 TCP 64 11784 > http [ACK] Seq=685 Ack=60888 Win=64512 Len=0
641995 202.491846 244.3.151.202 -> 244.3.160.239 TCP 64 11784 > http [ACK] Seq=685 Ack=62988 Win=64512 Len=0
642006 202.493186 244.3.151.202 -> 244.3.160.239 TCP 64 11784 > http [ACK] Seq=685 Ack=65748 Win=64512 Len=0
642012 202.494189 244.3.151.202 -> 244.3.160.239 TCP 64 11784 > http [ACK] Seq=685 Ack=68508 Win=64512 Len=0
642013 202.494361 244.3.151.202 -> 244.3.160.239 TCP 64 11784 > http [ACK] Seq=685 Ack=71268 Win=64512 Len=0
642031 202.499003 244.3.151.202 -> 244.3.160.239 TCP 64 11784 > http [ACK] Seq=685 Ack=73368 Win=64512 Len=0
642037 202.499660 244.3.151.202 -> 244.3.160.239 TCP 64 11784 > http [ACK] Seq=685 Ack=76128 Win=64512 Len=0
642041 202.500231 244.3.151.202 -> 244.3.160.239 TCP 64 11784 > http [ACK] Seq=685 Ack=78888 Win=64512 Len=0
642042 202.500236 244.3.151.202 -> 244.3.160.239 TCP 64 11784 > http [ACK] Seq=685 Ack=80988 Win=64512 Len=0
642051 202.501263 244.3.151.202 -> 244.3.160.239 TCP 64 11784 > http [ACK] Seq=685 Ack=83748 Win=64512 Len=0
642061 202.501907 244.3.151.202 -> 244.3.160.239 TCP 64 11784 > http [ACK] Seq=685 Ack=86508 Win=64512 Len=0
642065 202.502660 244.3.151.202 -> 244.3.160.239 TCP 64 11784 > http [ACK] Seq=685 Ack=89268 Win=64512 Len=0
642096 202.506454 244.3.151.202 -> 244.3.160.239 TCP 64 11784 > http [ACK] Seq=685 Ack=91368 Win=64512 Len=0
642100 202.506628 244.3.151.202 -> 244.3.160.239 TCP 64 11784 > http [ACK] Seq=685 Ack=94128 Win=64512 Len=0
642105 202.507267 244.3.151.202 -> 244.3.160.239 TCP 64 11784 > http [ACK] Seq=685 Ack=96888 Win=64512 Len=0
642112 202.507618 244.3.151.202 -> 244.3.160.239 TCP 64 11784 > http [ACK] Seq=685 Ack=98988 Win=64512 Len=0
642127 202.509283 244.3.151.202 -> 244.3.160.239 TCP 64 11784 > http [ACK] Seq=685 Ack=101748 Win=64512 Len=0
642143 202.510623 244.3.151.202 -> 244.3.160.239 TCP 64 11784 > http [ACK] Seq=685 Ack=104508 Win=64512 Len=0
642161 202.511973 244.3.151.202 -> 244.3.160.239 TCP 64 11784 > http [ACK] Seq=685 Ack=107268 Win=64512 Len=0
642301 202.528291 244.3.151.202 -> 244.3.160.239 TCP 64 11784 > http [ACK] Seq=685 Ack=109368 Win=64512 Len=0
642302 202.528295 244.3.151.202 -> 244.3.160.239 TCP 64 11784 > http [ACK] Seq=685 Ack=114888 Win=64512 Len=0
642303 202.528299 244.3.151.202 -> 244.3.160.239 TCP 64 11784 > http [ACK] Seq=685 Ack=112128 Win=64512 Len=0
642304 202.528303 244.3.151.202 -> 244.3.160.239 TCP 64 11784 > http [ACK] Seq=685 Ack=116988 Win=64512 Len=0
642305 202.528425 244.3.151.202 -> 244.3.160.239 TCP 64 11784 > http [ACK] Seq=685 Ack=119748 Win=64512 Len=0
642306 202.528430 244.3.151.202 -> 244.3.160.239 TCP 64 11784 > http [ACK] Seq=685 Ack=131508 Win=62032 Len=0
642307 202.528434 244.3.151.202 -> 244.3.160.239 TCP 64 [TCP Dup ACK 642306#1] 11784 > http [ACK] Seq=685 Ack=131508 Win=62032 Len=0
642308 202.528438 244.3.151.202 -> 244.3.160.239 TCP 64 11784 > http [ACK] Seq=685 Ack=127368 Win=62412 Len=0
642310 202.528455 244.3.151.202 -> 244.3.160.239 TCP 64 11784 > http [ACK] Seq=685 Ack=131508 Win=64512 Len=0
642311 202.528459 244.3.151.202 -> 244.3.160.239 TCP 64 11784 > http [ACK] Seq=685 Ack=125268 Win=64512 Len=0
642312 202.528463 244.3.151.202 -> 244.3.160.239 TCP 64 11784 > http [ACK] Seq=685 Ack=130128 Win=59652 Len=0
642313 202.528467 244.3.151.202 -> 244.3.160.239 TCP 64 11784 > http [ACK] Seq=685 Ack=122508 Win=64512 Len=0
642324 202.530530 244.3.151.202 -> 244.3.160.239 TCP 64 11784 > http [ACK] Seq=685 Ack=134268 Win=64512 Len=0
642338 202.531892 244.3.151.202 -> 244.3.160.239 TCP 64 11784 > http [ACK] Seq=685 Ack=136368 Win=64512 Len=0
642348 202.533155 244.3.151.202 -> 244.3.160.239 TCP 64 11784 > http [ACK] Seq=685 Ack=139128 Win=64512 Len=0
642361 202.533995 244.3.151.202 -> 244.3.160.239 TCP 64 11784 > http [ACK] Seq=685 Ack=141888 Win=64512 Len=0
642365 202.534402 244.3.151.202 -> 244.3.160.239 TCP 64 11784 > http [ACK] Seq=685 Ack=143988 Win=64512 Len=0
642398 202.540204 244.3.151.202 -> 244.3.160.239 TCP 64 11784 > http [ACK] Seq=685 Ack=146748 Win=64512 Len=0
642402 202.541152 244.3.151.202 -> 244.3.160.239 TCP 64 11784 > http [ACK] Seq=685 Ack=149508 Win=64512 Len=0
642403 202.541171 244.3.151.202 -> 244.3.160.239 TCP 64 11784 > http [ACK] Seq=685 Ack=152268 Win=64512 Len=0
642419 202.542930 244.3.151.202 -> 244.3.160.239 TCP 64 11784 > http [ACK] Seq=685 Ack=154368 Win=64512 Len=0
642428 202.546803 244.3.151.202 -> 244.3.160.239 TCP 64 11784 > http [ACK] Seq=685 Ack=157128 Win=64512 Len=0
642430 202.546903 244.3.151.202 -> 244.3.160.239 TCP 64 11784 > http [ACK] Seq=685 Ack=161988 Win=64512 Len=0
642431 202.546908 244.3.151.202 -> 244.3.160.239 TCP 64 11784 > http [ACK] Seq=685 Ack=159888 Win=64512 Len=0
642457 202.550343 244.3.151.202 -> 244.3.160.239 TCP 64 11784 > http [ACK] Seq=685 Ack=164748 Win=64512 Len=0
642466 202.551269 244.3.151.202 -> 244.3.160.239 TCP 64 11784 > http [ACK] Seq=685 Ack=167508 Win=64512 Len=0
642468 202.552072 244.3.151.202 -> 244.3.160.239 TCP 64 11784 > http [ACK] Seq=685 Ack=170268 Win=64512 Len=0
642484 202.553566 244.3.151.202 -> 244.3.160.239 TCP 64 11784 > http [ACK] Seq=685 Ack=172368 Win=64512 Len=0
642511 202.554728 244.3.151.202 -> 244.3.160.239 TCP 64 11784 > http [ACK] Seq=685 Ack=175128 Win=64512 Len=0
642534 202.556724 244.3.151.202 -> 244.3.160.239 TCP 64 11784 > http [ACK] Seq=685 Ack=177888 Win=64512 Len=0
642535 202.556762 244.3.151.202 -> 244.3.160.239 TCP 64 11784 > http [ACK] Seq=685 Ack=179988 Win=64512 Len=0
642628 202.560783 244.3.151.202 -> 244.3.160.239 TCP 64 11784 > http [ACK] Seq=685 Ack=182748 Win=64512 Len=0
642649 202.562099 244.3.151.202 -> 244.3.160.239 TCP 64 11784 > http [ACK] Seq=685 Ack=185508 Win=64512 Len=0
642654 202.562666 244.3.151.202 -> 244.3.160.239 TCP 64 11784 > http [ACK] Seq=685 Ack=188268 Win=64512 Len=0
642666 202.564804 244.3.151.202 -> 244.3.160.239 TCP 64 11784 > http [ACK] Seq=685 Ack=190368 Win=64512 Len=0
642667 202.564808 244.3.151.202 -> 244.3.160.239 TCP 64 11784 > http [ACK] Seq=685 Ack=193128 Win=64512 Len=0
642694 202.565515 244.3.151.202 -> 244.3.160.239 TCP 64 11784 > http [ACK] Seq=685 Ack=195888 Win=64512 Len=0
642695 202.565520 244.3.151.202 -> 244.3.160.239 TCP 64 11784 > http [ACK] Seq=685 Ack=197988 Win=64512 Len=0
642800 202.570512 244.3.151.202 -> 244.3.160.239 TCP 64 11784 > http [ACK] Seq=685 Ack=200748 Win=64512 Len=0
642808 202.571400 244.3.151.202 -> 244.3.160.239 TCP 64 11784 > http [ACK] Seq=685 Ack=203508 Win=64512 Len=0
642809 202.571471 244.3.151.202 -> 244.3.160.239 TCP 64 11784 > http [ACK] Seq=685 Ack=206268 Win=64512 Len=0
642844 202.572718 244.3.151.202 -> 244.3.160.239 TCP 64 11784 > http [ACK] Seq=685 Ack=208368 Win=64512 Len=0
642845 202.572723 244.3.151.202 -> 244.3.160.239 TCP 64 11784 > http [ACK] Seq=685 Ack=211128 Win=64512 Len=0
642854 202.573560 244.3.151.202 -> 244.3.160.239 TCP 64 11784 > http [ACK] Seq=685 Ack=213888 Win=64512 Len=0
642855 202.573564 244.3.151.202 -> 244.3.160.239 TCP 64 11784 > http [ACK] Seq=685 Ack=215988 Win=64512 Len=0
642927 202.577778 244.3.151.202 -> 244.3.160.239 TCP 64 11784 > http [ACK] Seq=685 Ack=218748 Win=64512 Len=0
642931 202.578818 244.3.151.202 -> 244.3.160.239 TCP 64 11784 > http [ACK] Seq=685 Ack=221508 Win=64512 Len=0
642932 202.578822 244.3.151.202 -> 244.3.160.239 TCP 64 11784 > http [ACK] Seq=685 Ack=224268 Win=64512 Len=0
642958 202.581017 244.3.151.202 -> 244.3.160.239 TCP 64 11784 > http [ACK] Seq=685 Ack=226368 Win=64512 Len=0
642985 202.581824 244.3.151.202 -> 244.3.160.239 TCP 64 11784 > http [ACK] Seq=685 Ack=229128 Win=64512 Len=0
642991 202.582395 244.3.151.202 -> 244.3.160.239 TCP 64 11784 > http [ACK] Seq=685 Ack=231888 Win=64512 Len=0
643004 202.582858 244.3.151.202 -> 244.3.160.239 TCP 64 11784 > http [ACK] Seq=685 Ack=233988 Win=64512 Len=0
643105 202.588917 244.3.151.202 -> 244.3.160.239 TCP 64 11784 > http [ACK] Seq=685 Ack=236748 Win=64512 Len=0
643120 202.589759 244.3.151.202 -> 244.3.160.239 TCP 64 11784 > http [ACK] Seq=685 Ack=239508 Win=64512 Len=0
643127 202.590022 244.3.151.202 -> 244.3.160.239 TCP 64 11784 > http [ACK] Seq=685 Ack=242268 Win=64512 Len=0
643193 202.592611 244.3.151.202 -> 244.3.160.239 TCP 64 11784 > http [ACK] Seq=685 Ack=244368 Win=64512 Len=0
643194 202.592616 244.3.151.202 -> 244.3.160.239 TCP 64 11784 > http [ACK] Seq=685 Ack=247128 Win=64512 Len=0
643204 202.593664 244.3.151.202 -> 244.3.160.239 TCP 64 11784 > http [ACK] Seq=685 Ack=249888 Win=64512 Len=0
643205 202.593669 244.3.151.202 -> 244.3.160.239 TCP 64 11784 > http [ACK] Seq=685 Ack=251988 Win=64512 Len=0
643232 202.598154 244.3.151.202 -> 244.3.160.239 TCP 64 11784 > http [ACK] Seq=685 Ack=254748 Win=64512 Len=0
643237 202.598674 244.3.151.202 -> 244.3.160.239 TCP 64 11784 > http [ACK] Seq=685 Ack=257508 Win=64512 Len=0
643254 202.599728 244.3.151.202 -> 244.3.160.239 TCP 64 11784 > http [ACK] Seq=685 Ack=260268 Win=64512 Len=0
643288 202.600758 244.3.151.202 -> 244.3.160.239 TCP 64 11784 > http [ACK] Seq=685 Ack=262368 Win=64512 Len=0
643313 202.601646 244.3.151.202 -> 244.3.160.239 TCP 64 11784 > http [ACK] Seq=685 Ack=265128 Win=64512 Len=0
643316 202.601712 244.3.151.202 -> 244.3.160.239 TCP 64 11784 > http [FIN, ACK] Seq=685 Ack=265712 Win=63928 Len=0
643434 202.609164 244.3.151.202 -> 244.3.160.239 TCP 64 11784 > http [ACK] Seq=686 Ack=265713 Win=63928 Len=0
644403 202.759693 244.3.151.202 -> 244.3.160.239 TCP 66 14575 > http [SYN] Seq=0 Win=64512 Len=0 MSS=1380 SACK_PERM=1
644409 202.760808 244.3.151.202 -> 244.3.160.239 TCP 64 14575 > http [ACK] Seq=1 Ack=1 Win=64512 Len=0
644478 202.772224 244.3.151.202 -> 244.3.160.239 TCP 64 14575 > http [ACK] Seq=695 Ack=648 Win=63865 Len=0
644479 202.772590 244.3.151.202 -> 244.3.160.239 TCP 64 14575 > http [FIN, ACK] Seq=695 Ack=648 Win=63865 Len=0
644495 202.774911 244.3.151.202 -> 244.3.160.239 TCP 64 14575 > http [ACK] Seq=696 Ack=649 Win=63865 Len=0
644692 202.840459 244.3.151.202 -> 244.3.160.239 TCP 66 10229 > http [SYN] Seq=0 Win=64512 Len=0 MSS=1380 SACK_PERM=1
644696 202.841597 244.3.151.202 -> 244.3.160.239 TCP 64 10229 > http [ACK] Seq=1 Ack=1 Win=64512 Len=0
644714 202.845328 244.3.151.202 -> 244.3.160.239 TCP 66 13836 > http [SYN] Seq=0 Win=64512 Len=0 MSS=1380 SACK_PERM=1
644719 202.846568 244.3.151.202 -> 244.3.160.239 TCP 64 13836 > http [ACK] Seq=1 Ack=1 Win=64512 Len=0
644849 202.882287 244.3.151.202 -> 244.3.160.239 TCP 64 10229 > http [ACK] Seq=690 Ack=1576 Win=64512 Len=0
644850 202.882390 244.3.151.202 -> 244.3.160.239 TCP 64 10229 > http [FIN, ACK] Seq=690 Ack=1599 Win=64489 Len=0
644852 202.882555 244.3.151.202 -> 244.3.160.239 TCP 64 13836 > http [ACK] Seq=691 Ack=1576 Win=64512 Len=0
644853 202.883091 244.3.151.202 -> 244.3.160.239 TCP 64 13836 > http [FIN, ACK] Seq=691 Ack=1682 Win=64406 Len=0
644855 202.883275 244.3.151.202 -> 244.3.160.239 TCP 66 15228 > http [SYN] Seq=0 Win=64512 Len=0 MSS=1380 SACK_PERM=1
644862 202.884286 244.3.151.202 -> 244.3.160.239 TCP 64 15228 > http [ACK] Seq=1 Ack=1 Win=64512 Len=0
644872 202.885360 244.3.151.202 -> 244.3.160.239 TCP 66 13091 > http [SYN] Seq=0 Win=64512 Len=0 MSS=1380 SACK_PERM=1
644876 202.886473 244.3.151.202 -> 244.3.160.239 TCP 64 13091 > http [ACK] Seq=1 Ack=1 Win=64512 Len=0
644936 202.912079 244.3.151.202 -> 244.3.160.239 TCP 64 10229 > http [ACK] Seq=691 Ack=1600 Win=64489 Len=0
644938 202.912204 244.3.151.202 -> 244.3.160.239 TCP 64 13836 > http [ACK] Seq=692 Ack=1683 Win=64406 Len=0
644955 202.913506 244.3.151.202 -> 244.3.160.239 TCP 64 15228 > http [ACK] Seq=691 Ack=1576 Win=64512 Len=0
644956 202.913511 244.3.151.202 -> 244.3.160.239 TCP 64 15228 > http [FIN, ACK] Seq=691 Ack=1602 Win=64486 Len=0
644958 202.913751 244.3.151.202 -> 244.3.160.239 TCP 64 13091 > http [ACK] Seq=700 Ack=1576 Win=64512 Len=0
644959 202.914307 244.3.151.202 -> 244.3.160.239 TCP 64 13091 > http [FIN, ACK] Seq=700 Ack=2348 Win=63740 Len=0
644961 202.914403 244.3.151.202 -> 244.3.160.239 TCP 66 4828 > http [SYN] Seq=0 Win=64512 Len=0 MSS=1380 SACK_PERM=1
644964 202.915315 244.3.151.202 -> 244.3.160.239 TCP 64 4828 > http [ACK] Seq=1 Ack=1 Win=64512 Len=0
645048 202.923125 244.3.151.202 -> 244.3.160.239 TCP 64 15228 > http [ACK] Seq=692 Ack=1603 Win=64486 Len=0
645062 202.923682 244.3.151.202 -> 244.3.160.239 TCP 64 13091 > http [ACK] Seq=701 Ack=2349 Win=63740 Len=0
645133 202.925680 244.3.151.202 -> 244.3.160.239 TCP 64 4828 > http [ACK] Seq=692 Ack=1582 Win=64512 Len=0
645211 202.929275 244.3.151.202 -> 244.3.160.239 TCP 64 4828 > http [ACK] Seq=692 Ack=3236 Win=64512 Len=0
645212 202.929319 244.3.151.202 -> 244.3.160.239 TCP 64 4828 > http [FIN, ACK] Seq=692 Ack=3236 Win=64512 Len=0
645228 202.934494 244.3.151.202 -> 244.3.160.239 TCP 66 sky-transport > http [SYN] Seq=0 Win=64512 Len=0 MSS=1380 SACK_PERM=1
645233 202.935543 244.3.151.202 -> 244.3.160.239 TCP 64 sky-transport > http [ACK] Seq=1 Ack=1 Win=64512 Len=0
645258 202.939879 244.3.151.202 -> 244.3.160.239 TCP 64 4828 > http [ACK] Seq=693 Ack=3237 Win=64512 Len=0
645328 202.958440 244.3.151.202 -> 244.3.160.239 TCP 64 sky-transport > http [ACK] Seq=676 Ack=1582 Win=64512 Len=0
645329 202.958486 244.3.151.202 -> 244.3.160.239 TCP 64 sky-transport > http [ACK] Seq=676 Ack=3461 Win=64512 Len=0
645334 202.958954 244.3.151.202 -> 244.3.160.239 TCP 64 sky-transport > http [FIN, ACK] Seq=676 Ack=3461 Win=64512 Len=0
645362 202.962410 244.3.151.202 -> 244.3.160.239 TCP 64 sky-transport > http [ACK] Seq=677 Ack=3462 Win=64512 Len=0
645395 202.968592 244.3.151.202 -> 244.3.160.239 TCP 66 neo4j > http [SYN] Seq=0 Win=64512 Len=0 MSS=1380 SACK_PERM=1
645406 202.969161 244.3.151.202 -> 244.3.160.239 TCP 66 prp > http [SYN] Seq=0 Win=64512 Len=0 MSS=1380 SACK_PERM=1
645408 202.969718 244.3.151.202 -> 244.3.160.239 TCP 64 neo4j > http [ACK] Seq=1 Ack=1 Win=64512 Len=0
645445 202.977513 244.3.151.202 -> 244.3.160.239 TCP 64 prp > http [ACK] Seq=1 Ack=1 Win=64512 Len=0
645471 202.989388 244.3.151.202 -> 244.3.160.239 TCP 64 neo4j > http [ACK] Seq=686 Ack=277 Win=64236 Len=0
645472 202.989393 244.3.151.202 -> 244.3.160.239 TCP 64 neo4j > http [FIN, ACK] Seq=686 Ack=277 Win=64236 Len=0
645474 202.990290 244.3.151.202 -> 244.3.160.239 TCP 66 adobeserver-4 > http [SYN] Seq=0 Win=64512 Len=0 MSS=1380 SACK_PERM=1
645490 202.992946 244.3.151.202 -> 244.3.160.239 TCP 64 adobeserver-4 > http [ACK] Seq=1 Ack=1 Win=64512 Len=0
645535 202.999123 244.3.151.202 -> 244.3.160.239 TCP 64 neo4j > http [ACK] Seq=687 Ack=278 Win=64236 Len=0
645545 203.000171 244.3.151.202 -> 244.3.160.239 TCP 64 prp > http [ACK] Seq=689 Ack=774 Win=63739 Len=0
645548 203.000397 244.3.151.202 -> 244.3.160.239 TCP 64 prp > http [FIN, ACK] Seq=689 Ack=774 Win=63739 Len=0
645578 203.002378 244.3.151.202 -> 244.3.160.239 TCP 64 prp > http [ACK] Seq=690 Ack=775 Win=63739 Len=0
645583 203.003620 244.3.151.202 -> 244.3.160.239 TCP 64 adobeserver-4 > http [ACK] Seq=698 Ack=1398 Win=64512 Len=0
645584 203.003625 244.3.151.202 -> 244.3.160.239 TCP 64 adobeserver-4 > http [FIN, ACK] Seq=698 Ack=1398 Win=64512 Len=0
645629 203.015967 244.3.151.202 -> 244.3.160.239 TCP 64 adobeserver-4 > http [ACK] Seq=699 Ack=1399 Win=64512 Len=0
645729 203.062293 244.3.151.202 -> 244.3.160.239 TCP 66 4732 > http [SYN] Seq=0 Win=64512 Len=0 MSS=1380 SACK_PERM=1
645732 203.063361 244.3.151.202 -> 244.3.160.239 TCP 64 4732 > http [ACK] Seq=1 Ack=1 Win=64512 Len=0
645778 203.072969 244.3.151.202 -> 244.3.160.239 TCP 64 4732 > http [ACK] Seq=691 Ack=237 Win=64276 Len=0
645792 203.074942 244.3.151.202 -> 244.3.160.239 TCP 64 4732 > http [ACK] Seq=691 Ack=238 Win=64276 Len=0
645858 203.107019 244.3.151.202 -> 244.3.160.239 TCP 64 4732 > http [FIN, ACK] Seq=691 Ack=238 Win=64276 Len=0
675839 211.319101 244.3.151.202 -> 244.3.160.239 TCP 66 ibridge-data > http [SYN] Seq=0 Win=64512 Len=0 MSS=1380 SACK_PERM=1
675841 211.320078 244.3.151.202 -> 244.3.160.239 TCP 64 ibridge-data > http [ACK] Seq=1 Ack=1 Win=64512 Len=0
678552 212.344726 244.3.151.202 -> 244.3.160.239 TCP 64 ibridge-data > http [ACK] Seq=1616 Ack=2050 Win=64512 Len=0
678562 212.346416 244.3.151.202 -> 244.3.160.239 TCP 64 ibridge-data > http [ACK] Seq=1616 Ack=4105 Win=64512 Len=0
678584 212.349166 244.3.151.202 -> 244.3.160.239 TCP 64 ibridge-data > http [ACK] Seq=1616 Ack=6299 Win=64512 Len=0
678585 212.349170 244.3.151.202 -> 244.3.160.239 TCP 64 ibridge-data > http [ACK] Seq=1616 Ack=8348 Win=64512 Len=0
678598 212.350346 244.3.151.202 -> 244.3.160.239 TCP 64 ibridge-data > http [ACK] Seq=1616 Ack=10547 Win=64512 Len=0
678608 212.351611 244.3.151.202 -> 244.3.160.239 TCP 64 ibridge-data > http [ACK] Seq=1616 Ack=12615 Win=64512 Len=0
678624 212.353149 244.3.151.202 -> 244.3.160.239 TCP 64 ibridge-data > http [ACK] Seq=1616 Ack=14664 Win=64512 Len=0
678638 212.354713 244.3.151.202 -> 244.3.160.239 TCP 64 ibridge-data > http [ACK] Seq=1616 Ack=16713 Win=64512 Len=0
678649 212.355473 244.3.151.202 -> 244.3.160.239 TCP 64 ibridge-data > http [ACK] Seq=1616 Ack=18763 Win=64512 Len=0
678662 212.356797 244.3.151.202 -> 244.3.160.239 TCP 64 ibridge-data > http [ACK] Seq=1616 Ack=20869 Win=64512 Len=0
678673 212.357905 244.3.151.202 -> 244.3.160.239 TCP 64 ibridge-data > http [ACK] Seq=1616 Ack=22918 Win=64512 Len=0
678682 212.359358 244.3.151.202 -> 244.3.160.239 TCP 64 ibridge-data > http [ACK] Seq=1616 Ack=24967 Win=64512 Len=0
678693 212.360555 244.3.151.202 -> 244.3.160.239 TCP 64 ibridge-data > http [ACK] Seq=1616 Ack=27135 Win=64512 Len=0
678711 212.362026 244.3.151.202 -> 244.3.160.239 TCP 64 ibridge-data > http [ACK] Seq=1616 Ack=29184 Win=64512 Len=0
678720 212.363517 244.3.151.202 -> 244.3.160.239 TCP 64 ibridge-data > http [ACK] Seq=1616 Ack=31247 Win=64512 Len=0
678733 212.364628 244.3.151.202 -> 244.3.160.239 TCP 64 ibridge-data > http [ACK] Seq=1616 Ack=33296 Win=64512 Len=0
678752 212.366215 244.3.151.202 -> 244.3.160.239 TCP 64 ibridge-data > http [ACK] Seq=1616 Ack=35376 Win=64512 Len=0
678772 212.367487 244.3.151.202 -> 244.3.160.239 TCP 64 ibridge-data > http [ACK] Seq=1616 Ack=37425 Win=64512 Len=0
678782 212.368601 244.3.151.202 -> 244.3.160.239 TCP 64 ibridge-data > http [ACK] Seq=1616 Ack=39481 Win=64512 Len=0
678811 212.370137 244.3.151.202 -> 244.3.160.239 TCP 64 ibridge-data > http [ACK] Seq=1616 Ack=41530 Win=64512 Len=0
678828 212.371857 244.3.151.202 -> 244.3.160.239 TCP 64 ibridge-data > http [ACK] Seq=1616 Ack=43579 Win=64512 Len=0
678834 212.373035 244.3.151.202 -> 244.3.160.239 TCP 64 ibridge-data > http [ACK] Seq=1616 Ack=45628 Win=64512 Len=0
678844 212.374174 244.3.151.202 -> 244.3.160.239 TCP 64 ibridge-data > http [ACK] Seq=1616 Ack=47707 Win=64512 Len=0
678855 212.375635 244.3.151.202 -> 244.3.160.239 TCP 64 ibridge-data > http [ACK] Seq=1616 Ack=49756 Win=64512 Len=0
678858 212.375963 244.3.151.202 -> 244.3.160.239 TCP 64 ibridge-data > http [ACK] Seq=1616 Ack=50294 Win=63975 Len=0
678909 212.383400 244.3.151.202 -> 244.3.160.239 TCP 64 ibridge-data > http [FIN, ACK] Seq=1616 Ack=50294 Win=63975 Len=0
679938 212.679098 244.3.151.202 -> 244.3.160.239 TCP 66 13230 > http [SYN] Seq=0 Win=64512 Len=0 MSS=1380 SACK_PERM=1
679940 212.679401 244.3.151.202 -> 244.3.160.239 TCP 66 13281 > http [SYN] Seq=0 Win=64512 Len=0 MSS=1380 SACK_PERM=1
679946 212.680232 244.3.151.202 -> 244.3.160.239 TCP 64 13230 > http [ACK] Seq=1 Ack=1 Win=64512 Len=0
679950 212.680783 244.3.151.202 -> 244.3.160.239 TCP 64 13281 > http [ACK] Seq=1 Ack=1 Win=64512 Len=0
680069 212.740313 244.3.151.202 -> 244.3.160.239 TCP 64 13230 > http [ACK] Seq=746 Ack=1572 Win=64512 Len=0
680070 212.740318 244.3.151.202 -> 244.3.160.239 TCP 64 13230 > http [FIN, ACK] Seq=746 Ack=1572 Win=64512 Len=0
680074 212.740644 244.3.151.202 -> 244.3.160.239 TCP 64 13281 > http [ACK] Seq=741 Ack=252 Win=64261 Len=0
680075 212.740700 244.3.151.202 -> 244.3.160.239 TCP 64 13281 > http [FIN, ACK] Seq=741 Ack=252 Win=64261 Len=0
680141 212.764049 244.3.151.202 -> 244.3.160.239 TCP 64 13230 > http [ACK] Seq=747 Ack=1573 Win=64512 Len=0
680145 212.764267 244.3.151.202 -> 244.3.160.239 TCP 64 13281 > http [ACK] Seq=742 Ack=253 Win=64261 Len=0
689684 217.165379 244.3.151.202 -> 244.3.160.239 TCP 66 14867 > http [SYN] Seq=0 Win=64512 Len=0 MSS=1380 SACK_PERM=1
689688 217.166422 244.3.151.202 -> 244.3.160.239 TCP 64 14867 > http [ACK] Seq=1 Ack=1 Win=64512 Len=0
690372 217.577287 244.3.151.202 -> 244.3.160.239 TCP 70 14867 > http [ACK] Seq=1283 Ack=1381 Win=64512 Len=0 SLE=2156 SRE=2288
690374 217.577454 244.3.151.202 -> 244.3.160.239 TCP 64 14867 > http [ACK] Seq=1283 Ack=2288 Win=63605 Len=0
690395 217.578870 244.3.151.202 -> 244.3.160.239 TCP 64 14867 > http [ACK] Seq=1283 Ack=4337 Win=64512 Len=0
690409 217.580496 244.3.151.202 -> 244.3.160.239 TCP 64 14867 > http [ACK] Seq=1283 Ack=6492 Win=64512 Len=0
690421 217.581626 244.3.151.202 -> 244.3.160.239 TCP 64 14867 > http [ACK] Seq=1283 Ack=8698 Win=64512 Len=0
690436 217.583262 244.3.151.202 -> 244.3.160.239 TCP 64 14867 > http [ACK] Seq=1283 Ack=10773 Win=64512 Len=0
690448 217.584532 244.3.151.202 -> 244.3.160.239 TCP 64 14867 > http [ACK] Seq=1283 Ack=12946 Win=64512 Len=0
690453 217.585811 244.3.151.202 -> 244.3.160.239 TCP 64 14867 > http [ACK] Seq=1283 Ack=14995 Win=64512 Len=0
690456 217.586712 244.3.151.202 -> 244.3.160.239 TCP 64 14867 > http [ACK] Seq=1283 Ack=17044 Win=64512 Len=0
690468 217.588555 244.3.151.202 -> 244.3.160.239 TCP 64 14867 > http [ACK] Seq=1283 Ack=19093 Win=64512 Len=0
690473 217.589749 244.3.151.202 -> 244.3.160.239 TCP 64 14867 > http [ACK] Seq=1283 Ack=21156 Win=64512 Len=0
690481 217.590873 244.3.151.202 -> 244.3.160.239 TCP 64 14867 > http [ACK] Seq=1283 Ack=23205 Win=64512 Len=0
690489 217.591828 244.3.151.202 -> 244.3.160.239 TCP 64 14867 > http [ACK] Seq=1283 Ack=25256 Win=64512 Len=0
690492 217.593264 244.3.151.202 -> 244.3.160.239 TCP 64 14867 > http [ACK] Seq=1283 Ack=27305 Win=64512 Len=0
690498 217.594469 244.3.151.202 -> 244.3.160.239 TCP 64 14867 > http [ACK] Seq=1283 Ack=29354 Win=62463 Len=0
690502 217.595671 244.3.151.202 -> 244.3.160.239 TCP 64 14867 > http [ACK] Seq=1283 Ack=31460 Win=60357 Len=0
690511 217.597401 244.3.151.202 -> 244.3.160.239 TCP 64 14867 > http [ACK] Seq=1283 Ack=33699 Win=58118 Len=0
690524 217.598923 244.3.151.202 -> 244.3.160.239 TCP 64 14867 > http [ACK] Seq=1283 Ack=35971 Win=55846 Len=0
690528 217.600047 244.3.151.202 -> 244.3.160.239 TCP 64 14867 > http [ACK] Seq=1283 Ack=37083 Win=54734 Len=0
690533 217.601871 244.3.151.202 -> 244.3.160.239 TCP 64 14867 > http [ACK] Seq=1283 Ack=39132 Win=52685 Len=0
690538 217.603046 244.3.151.202 -> 244.3.160.239 TCP 64 14867 > http [ACK] Seq=1283 Ack=41181 Win=50636 Len=0
690543 217.604433 244.3.151.202 -> 244.3.160.239 TCP 64 14867 > http [ACK] Seq=1283 Ack=42923 Win=48894 Len=0
690544 217.604438 244.3.151.202 -> 244.3.160.239 TCP 64 14867 > http [ACK] Seq=1283 Ack=42924 Win=48894 Len=0
690562 217.626309 244.3.151.202 -> 244.3.160.239 TCP 64 14867 > http [FIN, ACK] Seq=1283 Ack=42924 Win=64512 Len=0
690693 217.671278 244.3.151.202 -> 244.3.160.239 TCP 66 caupc-remote > http [SYN] Seq=0 Win=64512 Len=0 MSS=1380 SACK_PERM=1
690695 217.672335 244.3.151.202 -> 244.3.160.239 TCP 64 caupc-remote > http [ACK] Seq=1 Ack=1 Win=64512 Len=0
690785 217.723923 244.3.151.202 -> 244.3.160.239 TCP 64 caupc-remote > http [ACK] Seq=831 Ack=814 Win=63699 Len=0
690789 217.724041 244.3.151.202 -> 244.3.160.239 TCP 64 caupc-remote > http [FIN, ACK] Seq=831 Ack=814 Win=63699 Len=0
690802 217.725057 244.3.151.202 -> 244.3.160.239 TCP 64 caupc-remote > http [ACK] Seq=832 Ack=815 Win=63699 Len=0
707703 225.331832 244.3.151.202 -> 244.3.160.239 TCP 66 15405 > http [SYN] Seq=0 Win=64512 Len=0 MSS=1380 SACK_PERM=1
707707 225.333097 244.3.151.202 -> 244.3.160.239 TCP 64 15405 > http [ACK] Seq=1 Ack=1 Win=64512 Len=0
712346 227.288777 244.3.151.202 -> 244.3.160.239 TCP 64 15405 > http [ACK] Seq=1365 Ack=2050 Win=64512 Len=0
712354 227.290481 244.3.151.202 -> 244.3.160.239 TCP 64 15405 > http [ACK] Seq=1365 Ack=4117 Win=64512 Len=0
712367 227.291682 244.3.151.202 -> 244.3.160.239 TCP 64 15405 > http [ACK] Seq=1365 Ack=6311 Win=64512 Len=0
712378 227.293006 244.3.151.202 -> 244.3.160.239 TCP 64 15405 > http [ACK] Seq=1365 Ack=8360 Win=64512 Len=0
712397 227.294513 244.3.151.202 -> 244.3.160.239 TCP 64 15405 > http [ACK] Seq=1365 Ack=10559 Win=64512 Len=0
712411 227.295624 244.3.151.202 -> 244.3.160.239 TCP 64 15405 > http [ACK] Seq=1365 Ack=12627 Win=64512 Len=0
712423 227.296992 244.3.151.202 -> 244.3.160.239 TCP 64 15405 > http [ACK] Seq=1365 Ack=14676 Win=64512 Len=0
712429 227.297926 244.3.151.202 -> 244.3.160.239 TCP 64 15405 > http [ACK] Seq=1365 Ack=16725 Win=64512 Len=0
712435 227.299588 244.3.151.202 -> 244.3.160.239 TCP 64 15405 > http [ACK] Seq=1365 Ack=18775 Win=64512 Len=0
712442 227.300984 244.3.151.202 -> 244.3.160.239 TCP 64 15405 > http [ACK] Seq=1365 Ack=20881 Win=64512 Len=0
712444 227.302116 244.3.151.202 -> 244.3.160.239 TCP 64 15405 > http [ACK] Seq=1365 Ack=22930 Win=64512 Len=0
712450 227.303484 244.3.151.202 -> 244.3.160.239 TCP 64 15405 > http [ACK] Seq=1365 Ack=24979 Win=62463 Len=0
712456 227.304455 244.3.151.202 -> 244.3.160.239 TCP 64 15405 > http [ACK] Seq=1365 Ack=27147 Win=60295 Len=0
712470 227.305937 244.3.151.202 -> 244.3.160.239 TCP 64 15405 > http [ACK] Seq=1365 Ack=29196 Win=58246 Len=0
712481 227.307194 244.3.151.202 -> 244.3.160.239 TCP 64 15405 > http [ACK] Seq=1365 Ack=31245 Win=56197 Len=0
712487 227.308326 244.3.151.202 -> 244.3.160.239 TCP 64 15405 > http [ACK] Seq=1365 Ack=33294 Win=54148 Len=0
712493 227.310001 244.3.151.202 -> 244.3.160.239 TCP 64 15405 > http [ACK] Seq=1365 Ack=35432 Win=52010 Len=0
712500 227.311182 244.3.151.202 -> 244.3.160.239 TCP 64 15405 > http [ACK] Seq=1365 Ack=37481 Win=49961 Len=0
712513 227.312307 244.3.151.202 -> 244.3.160.239 TCP 64 15405 > http [ACK] Seq=1365 Ack=39530 Win=47912 Len=0
712521 227.313759 244.3.151.202 -> 244.3.160.239 TCP 64 15405 > http [ACK] Seq=1365 Ack=41579 Win=45863 Len=0
712525 227.315027 244.3.151.202 -> 244.3.160.239 TCP 64 15405 > http [ACK] Seq=1365 Ack=43632 Win=43810 Len=0
712531 227.316395 244.3.151.202 -> 244.3.160.239 TCP 64 15405 > http [ACK] Seq=1365 Ack=45683 Win=41759 Len=0
712540 227.317424 244.3.151.202 -> 244.3.160.239 TCP 64 15405 > http [ACK] Seq=1365 Ack=47807 Win=39635 Len=0
712558 227.319050 244.3.151.202 -> 244.3.160.239 TCP 64 15405 > http [ACK] Seq=1365 Ack=49927 Win=37515 Len=0
712565 227.320194 244.3.151.202 -> 244.3.160.239 TCP 64 15405 > http [ACK] Seq=1365 Ack=51976 Win=35466 Len=0
712576 227.321594 244.3.151.202 -> 244.3.160.239 TCP 64 15405 > http [ACK] Seq=1365 Ack=54108 Win=33334 Len=0
712585 227.322660 244.3.151.202 -> 244.3.160.239 TCP 64 15405 > http [ACK] Seq=1365 Ack=55997 Win=31445 Len=0
712586 227.322930 244.3.151.202 -> 244.3.160.239 TCP 64 15405 > http [ACK] Seq=1365 Ack=55998 Win=31445 Len=0
712719 227.345369 244.3.151.202 -> 244.3.160.239 TCP 64 15405 > http [FIN, ACK] Seq=1365 Ack=55998 Win=64512 Len=0
713019 227.483927 244.3.151.202 -> 244.3.160.239 TCP 66 15883 > http [SYN] Seq=0 Win=64512 Len=0 MSS=1380 SACK_PERM=1
713021 227.484491 244.3.151.202 -> 244.3.160.239 TCP 66 15668 > http [SYN] Seq=0 Win=64512 Len=0 MSS=1380 SACK_PERM=1
713023 227.484985 244.3.151.202 -> 244.3.160.239 TCP 64 15883 > http [ACK] Seq=1 Ack=1 Win=64512 Len=0
713025 227.485436 244.3.151.202 -> 244.3.160.239 TCP 64 15668 > http [ACK] Seq=1 Ack=1 Win=64512 Len=0
713071 227.500995 244.3.151.202 -> 244.3.160.239 TCP 64 15883 > http [ACK] Seq=808 Ack=237 Win=64276 Len=0
713072 227.501000 244.3.151.202 -> 244.3.160.239 TCP 64 15883 > http [FIN, ACK] Seq=808 Ack=237 Win=64276 Len=0
713074 227.501796 244.3.151.202 -> 244.3.160.239 TCP 66 bfd-echo > http [SYN] Seq=0 Win=64512 Len=0 MSS=1380 SACK_PERM=1
713077 227.502706 244.3.151.202 -> 244.3.160.239 TCP 64 bfd-echo > http [ACK] Seq=1 Ack=1 Win=64512 Len=0
713117 227.516854 244.3.151.202 -> 244.3.160.239 TCP 64 15883 > http [ACK] Seq=809 Ack=238 Win=64276 Len=0
713135 227.518291 244.3.151.202 -> 244.3.160.239 TCP 64 15668 > http [ACK] Seq=814 Ack=1576 Win=64512 Len=0
713136 227.518295 244.3.151.202 -> 244.3.160.239 TCP 64 bfd-echo > http [ACK] Seq=813 Ack=1576 Win=64512 Len=0
713137 227.518299 244.3.151.202 -> 244.3.160.239 TCP 64 15668 > http [FIN, ACK] Seq=814 Ack=1817 Win=64271 Len=0
713138 227.518304 244.3.151.202 -> 244.3.160.239 TCP 64 bfd-echo > http [FIN, ACK] Seq=813 Ack=1769 Win=64319 Len=0
713152 227.519749 244.3.151.202 -> 244.3.160.239 TCP 64 15668 > http [ACK] Seq=815 Ack=1818 Win=64271 Len=0
713166 227.521206 244.3.151.202 -> 244.3.160.239 TCP 66 13909 > http [SYN] Seq=0 Win=64512 Len=0 MSS=1380 SACK_PERM=1
713167 227.521211 244.3.151.202 -> 244.3.160.239 TCP 64 bfd-echo > http [ACK] Seq=814 Ack=1770 Win=64319 Len=0
713171 227.521507 244.3.151.202 -> 244.3.160.239 TCP 66 9424 > http [SYN] Seq=0 Win=64512 Len=0 MSS=1380 SACK_PERM=1
713175 227.522120 244.3.151.202 -> 244.3.160.239 TCP 64 13909 > http [ACK] Seq=1 Ack=1 Win=64512 Len=0
713180 227.522687 244.3.151.202 -> 244.3.160.239 TCP 64 9424 > http [ACK] Seq=1 Ack=1 Win=64512 Len=0
713251 227.535921 244.3.151.202 -> 244.3.160.239 TCP 64 13909 > http [ACK] Seq=813 Ack=1576 Win=64512 Len=0
713253 227.536065 244.3.151.202 -> 244.3.160.239 TCP 64 13909 > http [FIN, ACK] Seq=813 Ack=1773 Win=64315 Len=0
713255 227.536073 244.3.151.202 -> 244.3.160.239 TCP 64 9424 > http [ACK] Seq=816 Ack=1576 Win=64512 Len=0
713256 227.536077 244.3.151.202 -> 244.3.160.239 TCP 64 13909 > http [ACK] Seq=814 Ack=1774 Win=64315 Len=0
713263 227.536334 244.3.151.202 -> 244.3.160.239 TCP 64 9424 > http [FIN, ACK] Seq=816 Ack=1773 Win=64315 Len=0
713268 227.536493 244.3.151.202 -> 244.3.160.239 TCP 64 9424 > http [ACK] Seq=817 Ack=1774 Win=64315 Len=0
836599 274.002371 244.3.151.202 -> 244.3.160.239 TCP 66 13406 > http [SYN] Seq=0 Win=64512 Len=0 MSS=1380 SACK_PERM=1
836607 274.003594 244.3.151.202 -> 244.3.160.239 TCP 64 13406 > http [ACK] Seq=1 Ack=1 Win=64512 Len=0
837944 274.549193 244.3.151.202 -> 244.3.160.239 TCP 64 13406 > http [ACK] Seq=1311 Ack=2050 Win=64512 Len=0
837980 274.556244 244.3.151.202 -> 244.3.160.239 TCP 64 13406 > http [ACK] Seq=1311 Ack=3740 Win=64512 Len=0
837982 274.556380 244.3.151.202 -> 244.3.160.239 TCP 64 13406 > http [ACK] Seq=1311 Ack=5304 Win=64512 Len=0
838009 274.561544 244.3.151.202 -> 244.3.160.239 TCP 64 13406 > http [ACK] Seq=1311 Ack=7353 Win=64512 Len=0
838012 274.563044 244.3.151.202 -> 244.3.160.239 TCP 64 13406 > http [ACK] Seq=1311 Ack=9527 Win=64512 Len=0
838021 274.564238 244.3.151.202 -> 244.3.160.239 TCP 64 13406 > http [ACK] Seq=1311 Ack=11581 Win=62458 Len=0
838030 274.566221 244.3.151.202 -> 244.3.160.239 TCP 64 13406 > http [ACK] Seq=1311 Ack=14098 Win=59941 Len=0
838031 274.566740 244.3.151.202 -> 244.3.160.239 TCP 64 13406 > http [ACK] Seq=1311 Ack=15428 Win=58611 Len=0
838039 274.568727 244.3.151.202 -> 244.3.160.239 TCP 64 13406 > http [ACK] Seq=1311 Ack=17497 Win=56542 Len=0
838043 274.569794 244.3.151.202 -> 244.3.160.239 TCP 64 13406 > http [ACK] Seq=1311 Ack=19569 Win=54470 Len=0
838046 274.571222 244.3.151.202 -> 244.3.160.239 TCP 64 13406 > http [ACK] Seq=1311 Ack=21618 Win=52421 Len=0
838056 274.573209 244.3.151.202 -> 244.3.160.239 TCP 64 13406 > http [ACK] Seq=1311 Ack=23737 Win=50302 Len=0
838058 274.573944 244.3.151.202 -> 244.3.160.239 TCP 64 13406 > http [ACK] Seq=1311 Ack=25796 Win=48243 Len=0
838064 274.575278 244.3.151.202 -> 244.3.160.239 TCP 64 13406 > http [ACK] Seq=1311 Ack=27809 Win=46230 Len=0
838083 274.592513 244.3.151.202 -> 244.3.160.239 TCP 64 13406 > http [ACK] Seq=1311 Ack=29859 Win=44180 Len=0
838090 274.593863 244.3.151.202 -> 244.3.160.239 TCP 64 13406 > http [ACK] Seq=1311 Ack=31911 Win=42128 Len=0
838093 274.595335 244.3.151.202 -> 244.3.160.239 TCP 64 13406 > http [ACK] Seq=1311 Ack=33966 Win=40073 Len=0
838097 274.596575 244.3.151.202 -> 244.3.160.239 TCP 64 13406 > http [ACK] Seq=1311 Ack=36015 Win=38024 Len=0
838101 274.597757 244.3.151.202 -> 244.3.160.239 TCP 64 13406 > http [ACK] Seq=1311 Ack=38064 Win=35975 Len=0
838106 274.599037 244.3.151.202 -> 244.3.160.239 TCP 64 13406 > http [ACK] Seq=1311 Ack=40113 Win=33926 Len=0
838114 274.600237 244.3.151.202 -> 244.3.160.239 TCP 64 13406 > http [ACK] Seq=1311 Ack=42168 Win=31871 Len=0
838139 274.606542 244.3.151.202 -> 244.3.160.239 TCP 64 13406 > http [ACK] Seq=1311 Ack=43989 Win=30050 Len=0
838140 274.607491 244.3.151.202 -> 244.3.160.239 TCP 64 13406 > http [ACK] Seq=1311 Ack=46038 Win=28001 Len=0
838150 274.608889 244.3.151.202 -> 244.3.160.239 TCP 64 13406 > http [ACK] Seq=1311 Ack=48087 Win=25952 Len=0
838155 274.610024 244.3.151.202 -> 244.3.160.239 TCP 64 13406 > http [ACK] Seq=1311 Ack=50136 Win=23903 Len=0
838171 274.615746 244.3.151.202 -> 244.3.160.239 TCP 64 13406 > http [ACK] Seq=1311 Ack=52185 Win=21854 Len=0
838179 274.617171 244.3.151.202 -> 244.3.160.239 TCP 64 13406 > http [ACK] Seq=1311 Ack=54424 Win=19615 Len=0
838180 274.617175 244.3.151.202 -> 244.3.160.239 TCP 70 [TCP Dup ACK 838179#1] 13406 > http [ACK] Seq=1311 Ack=54424 Win=19615 Len=0 SLE=55093 SRE=55272
838181 274.617179 244.3.151.202 -> 244.3.160.239 TCP 64 13406 > http [ACK] Seq=1311 Ack=55272 Win=18767 Len=0
838182 274.617583 244.3.151.202 -> 244.3.160.239 TCP 64 13406 > http [ACK] Seq=1311 Ack=55273 Win=18767 Len=0
840227 275.481979 244.3.151.202 -> 244.3.160.239 TCP 64 13406 > http [FIN, ACK] Seq=1311 Ack=55273 Win=64512 Len=0
