304356 103.010510 244.3.77.177 -> 244.3.31.168 TCP 66 mikey > https [SYN] Seq=0 Win=65535 Len=0 MSS=1260 SACK_PERM=1
304358 103.011287 244.3.77.177 -> 244.3.31.168 TCP 64 mikey > https [ACK] Seq=1 Ack=1 Win=65535 Len=0
304375 103.017783 244.3.77.177 -> 244.3.31.168 TCP 64 mikey > https [ACK] Seq=946 Ack=2643 Win=65535 Len=0
304381 103.018843 244.3.77.177 -> 244.3.31.168 TCP 64 mikey > https [ACK] Seq=946 Ack=4810 Win=65535 Len=0
304398 103.021428 244.3.77.177 -> 244.3.31.168 TCP 64 mikey > https [FIN, ACK] Seq=946 Ack=4810 Win=65535 Len=0
304403 103.022920 244.3.77.177 -> 244.3.31.168 TCP 66 starschool > https [SYN] Seq=0 Win=65535 Len=0 MSS=1260 SACK_PERM=1
304406 103.023653 244.3.77.177 -> 244.3.31.168 TCP 64 starschool > https [ACK] Seq=1 Ack=1 Win=65535 Len=0
304449 103.028920 244.3.77.177 -> 244.3.31.168 TCP 64 starschool > https [ACK] Seq=811 Ack=420 Win=65117 Len=0
304450 103.028960 244.3.77.177 -> 244.3.31.168 TCP 64 starschool > https [FIN, ACK] Seq=811 Ack=420 Win=65117 Len=0
304487 103.036064 244.3.77.177 -> 244.3.31.168 TCP 66 mmcals > https [SYN] Seq=0 Win=65535 Len=0 MSS=1260 SACK_PERM=1
304489 103.036895 244.3.77.177 -> 244.3.31.168 TCP 64 mmcals > https [ACK] Seq=1 Ack=1 Win=65535 Len=0
304512 103.042621 244.3.77.177 -> 244.3.31.168 TCP 64 mmcals > https [ACK] Seq=812 Ack=420 Win=65117 Len=0
304513 103.042734 244.3.77.177 -> 244.3.31.168 TCP 64 mmcals > https [FIN, ACK] Seq=812 Ack=420 Win=65117 Len=0
701831 223.058337 244.3.77.177 -> 244.3.31.168 TCP 66 mmcal > https [SYN] Seq=0 Win=65535 Len=0 MSS=1260 SACK_PERM=1
701834 223.059098 244.3.77.177 -> 244.3.31.168 TCP 64 mmcal > https [ACK] Seq=1 Ack=1 Win=65535 Len=0
701879 223.071899 244.3.77.177 -> 244.3.31.168 TCP 64 mmcal > https [ACK] Seq=1085 Ack=3710 Win=65535 Len=0
701884 223.072962 244.3.77.177 -> 244.3.31.168 TCP 64 mmcal > https [ACK] Seq=1085 Ack=5877 Win=65535 Len=0
701899 223.075555 244.3.77.177 -> 244.3.31.168 TCP 64 mmcal > https [FIN, ACK] Seq=1085 Ack=5877 Win=65535 Len=0
701903 223.077029 244.3.77.177 -> 244.3.31.168 TCP 66 mysql-im > https [SYN] Seq=0 Win=65535 Len=0 MSS=1260 SACK_PERM=1
701906 223.077779 244.3.77.177 -> 244.3.31.168 TCP 64 mysql-im > https [ACK] Seq=1 Ack=1 Win=65535 Len=0
701934 223.083323 244.3.77.177 -> 244.3.31.168 TCP 64 mysql-im > https [ACK] Seq=811 Ack=420 Win=65117 Len=0
701935 223.083388 244.3.77.177 -> 244.3.31.168 TCP 64 mysql-im > https [FIN, ACK] Seq=811 Ack=420 Win=65117 Len=0
701989 223.089446 244.3.77.177 -> 244.3.31.168 TCP 66 pcttunnell > https [SYN] Seq=0 Win=65535 Len=0 MSS=1260 SACK_PERM=1
701992 223.090216 244.3.77.177 -> 244.3.31.168 TCP 64 pcttunnell > https [ACK] Seq=1 Ack=1 Win=65535 Len=0
702017 223.095960 244.3.77.177 -> 244.3.31.168 TCP 64 pcttunnell > https [ACK] Seq=812 Ack=420 Win=65117 Len=0
702018 223.096024 244.3.77.177 -> 244.3.31.168 TCP 64 pcttunnell > https [FIN, ACK] Seq=812 Ack=420 Win=65117 Len=0
1017927 343.188166 244.3.77.177 -> 244.3.31.168 TCP 66 ibridge-data > https [SYN] Seq=0 Win=65535 Len=0 MSS=1260 SACK_PERM=1
1017929 343.189105 244.3.77.177 -> 244.3.31.168 TCP 64 ibridge-data > https [ACK] Seq=1 Ack=1 Win=65535 Len=0
1017947 343.195564 244.3.77.177 -> 244.3.31.168 TCP 64 ibridge-data > https [ACK] Seq=946 Ack=2643 Win=65535 Len=0
1017950 343.196640 244.3.77.177 -> 244.3.31.168 TCP 64 ibridge-data > https [ACK] Seq=946 Ack=4810 Win=65535 Len=0
1017953 343.199278 244.3.77.177 -> 244.3.31.168 TCP 64 ibridge-data > https [FIN, ACK] Seq=946 Ack=4810 Win=65535 Len=0
1017955 343.200756 244.3.77.177 -> 244.3.31.168 TCP 66 ibridge-mgmt > https [SYN] Seq=0 Win=65535 Len=0 MSS=1260 SACK_PERM=1
1017957 343.201480 244.3.77.177 -> 244.3.31.168 TCP 64 ibridge-mgmt > https [ACK] Seq=1 Ack=1 Win=65535 Len=0
1018001 343.206741 244.3.77.177 -> 244.3.31.168 TCP 64 ibridge-mgmt > https [ACK] Seq=811 Ack=420 Win=65117 Len=0
1018002 343.206789 244.3.77.177 -> 244.3.31.168 TCP 64 ibridge-mgmt > https [FIN, ACK] Seq=811 Ack=420 Win=65117 Len=0
1018012 343.214713 244.3.77.177 -> 244.3.31.168 TCP 66 bluectrlproxy > https [SYN] Seq=0 Win=65535 Len=0 MSS=1260 SACK_PERM=1
1018017 343.215480 244.3.77.177 -> 244.3.31.168 TCP 64 bluectrlproxy > https [ACK] Seq=1 Ack=1 Win=65535 Len=0
1018045 343.220917 244.3.77.177 -> 244.3.31.168 TCP 64 bluectrlproxy > https [ACK] Seq=812 Ack=420 Win=65117 Len=0
1018046 343.221003 244.3.77.177 -> 244.3.31.168 TCP 64 bluectrlproxy > https [FIN, ACK] Seq=812 Ack=420 Win=65117 Len=0
