4467   1.357897 244.3.167.79 -> 244.3.41.84  TCP 70 53720 > telnet [ACK] Seq=28 Ack=1140 Win=65521 Len=0 TSval=408846064 TSecr=4292264780
13229   3.890719 244.3.167.79 -> 244.3.41.84  TCP 70 53720 > telnet [ACK] Seq=33 Ack=2296 Win=65519 Len=0 TSval=408846089 TSecr=4292267250
17171   4.872629 244.3.167.79 -> 244.3.41.84  TCP 70 53720 > telnet [ACK] Seq=38 Ack=3368 Win=65530 Len=0 TSval=408846099 TSecr=4292268210
18092   5.606226 244.3.167.79 -> 244.3.41.84  TCP 70 53720 > telnet [ACK] Seq=43 Ack=4488 Win=65524 Len=0 TSval=408846106 TSecr=4292268929
19000   6.196108 244.3.167.79 -> 244.3.41.84  TCP 70 53720 > telnet [ACK] Seq=48 Ack=5594 Win=65525 Len=0 TSval=408846112 TSecr=4292269505
20218   6.662592 244.3.167.79 -> 244.3.41.84  TCP 70 53720 > telnet [ACK] Seq=53 Ack=6697 Win=65526 Len=0 TSval=408846117 TSecr=4292269961
21146   7.118070 244.3.167.79 -> 244.3.41.84  TCP 70 53720 > telnet [ACK] Seq=58 Ack=7828 Win=65522 Len=0 TSval=408846121 TSecr=4292270405
21781   7.559308 244.3.167.79 -> 244.3.41.84  TCP 70 53720 > telnet [ACK] Seq=63 Ack=8872 Win=65533 Len=0 TSval=408846126 TSecr=4292270836
22571   8.061355 244.3.167.79 -> 244.3.41.84  TCP 70 53720 > telnet [ACK] Seq=68 Ack=9925 Win=65532 Len=0 TSval=408846131 TSecr=4292271326
23280   8.460684 244.3.167.79 -> 244.3.41.84  TCP 70 53720 > telnet [ACK] Seq=73 Ack=11192 Win=65505 Len=0 TSval=408846135 TSecr=4292271713
24340   9.158650 244.3.167.79 -> 244.3.41.84  TCP 70 53720 > telnet [ACK] Seq=78 Ack=12276 Win=65528 Len=0 TSval=408846142 TSecr=4292272398
25029   9.559417 244.3.167.79 -> 244.3.41.84  TCP 70 53720 > telnet [ACK] Seq=83 Ack=13358 Win=65528 Len=0 TSval=408846146 TSecr=4292272789
25771   9.974446 244.3.167.79 -> 244.3.41.84  TCP 70 53720 > telnet [ACK] Seq=88 Ack=14444 Win=65528 Len=0 TSval=408846150 TSecr=4292273195
26164  10.221534 244.3.167.79 -> 244.3.41.84  TCP 70 53720 > telnet [ACK] Seq=93 Ack=15535 Win=65527 Len=0 TSval=408846152 TSecr=4292273436
26787  10.557587 244.3.167.79 -> 244.3.41.84  TCP 70 53720 > telnet [ACK] Seq=98 Ack=16581 Win=65533 Len=0 TSval=408846156 TSecr=4292273764
27785  11.062061 244.3.167.79 -> 244.3.41.84  TCP 70 53720 > telnet [ACK] Seq=103 Ack=17729 Win=65520 Len=0 TSval=408846161 TSecr=4292274257
89622  34.586208 244.3.167.79 -> 244.3.41.84  TCP 70 53720 > telnet [ACK] Seq=108 Ack=18914 Win=65515 Len=0 TSval=408846396 TSecr=4292297230
113410  40.346839 244.3.167.79 -> 244.3.41.84  TCP 70 53720 > telnet [ACK] Seq=166 Ack=20079 Win=65518 Len=0 TSval=408846453 TSecr=4292302855
135125  46.983514 244.3.167.79 -> 244.3.41.84  TCP 70 53720 > telnet [ACK] Seq=214 Ack=21556 Win=65479 Len=0 TSval=408846520 TSecr=4292309337
181525  61.027141 244.3.167.79 -> 244.3.41.84  TCP 70 53720 > telnet [ACK] Seq=288 Ack=21744 Win=65535 Len=0 TSval=408846660 TSecr=4292323051
203018  70.005471 244.3.167.79 -> 244.3.41.84  TCP 70 53720 > telnet [ACK] Seq=319 Ack=22912 Win=65518 Len=0 TSval=408846750 TSecr=4292331819
210581  72.543714 244.3.167.79 -> 244.3.41.84  TCP 70 53720 > telnet [ACK] Seq=367 Ack=23925 Win=65535 Len=0 TSval=408846775 TSecr=4292334298
245288  85.628417 244.3.167.79 -> 244.3.41.84  TCP 70 53720 > telnet [ACK] Seq=372 Ack=25110 Win=65515 Len=0 TSval=408846906 TSecr=4292347076
