970713 323.780112 244.3.79.215 -> 41.177.98.176 TCP 66 netrisk > http [SYN] Seq=0 Win=65535 Len=0 MSS=1380 SACK_PERM=1
970715 323.781055 244.3.79.215 -> 41.177.98.176 TCP 64 netrisk > http [ACK] Seq=1 Ack=1 Win=65535 Len=0
978512 325.972761 244.3.79.215 -> 41.177.98.176 TCP 64 netrisk > http [RST, ACK] Seq=986 Ack=1 Win=0 Len=0
978531 325.983022 244.3.79.215 -> 41.177.98.176 TCP 66 ansys-lm > http [SYN] Seq=0 Win=65535 Len=0 MSS=1380 SACK_PERM=1
978537 325.983808 244.3.79.215 -> 41.177.98.176 TCP 64 ansys-lm > http [ACK] Seq=1 Ack=1 Win=65535 Len=0
985616 329.083597 244.3.79.215 -> 41.177.98.176 TCP 64 ansys-lm > http [ACK] Seq=986 Ack=2761 Win=65535 Len=0
985621 329.084527 244.3.79.215 -> 41.177.98.176 TCP 64 ansys-lm > http [ACK] Seq=986 Ack=6901 Win=65535 Len=0
985630 329.085395 244.3.79.215 -> 41.177.98.176 TCP 64 ansys-lm > http [ACK] Seq=986 Ack=11041 Win=65535 Len=0
985635 329.086722 244.3.79.215 -> 41.177.98.176 TCP 64 ansys-lm > http [ACK] Seq=986 Ack=19321 Win=65535 Len=0
985649 329.089448 244.3.79.215 -> 41.177.98.176 TCP 66 concomp1 > http [SYN] Seq=0 Win=65535 Len=0 MSS=1380 SACK_PERM=1
985665 329.091079 244.3.79.215 -> 41.177.98.176 TCP 64 concomp1 > http [ACK] Seq=1 Ack=1 Win=65535 Len=0
985666 329.091084 244.3.79.215 -> 41.177.98.176 TCP 64 ansys-lm > http [ACK] Seq=986 Ack=28975 Win=65535 Len=0
985687 329.093711 244.3.79.215 -> 41.177.98.176 TCP 64 ansys-lm > http [ACK] Seq=986 Ack=38823 Win=64155 Len=0
985688 329.093716 244.3.79.215 -> 41.177.98.176 TCP 64 concomp1 > http [ACK] Seq=676 Ack=4141 Win=65535 Len=0
985692 329.094669 244.3.79.215 -> 41.177.98.176 TCP 64 ansys-lm > http [ACK] Seq=986 Ack=41191 Win=61787 Len=0
985700 329.096382 244.3.79.215 -> 41.177.98.176 TCP 64 ansys-lm > http [ACK] Seq=986 Ack=45331 Win=57647 Len=0
985710 329.101235 244.3.79.215 -> 41.177.98.176 TCP 64 ansys-lm > http [ACK] Seq=986 Ack=51447 Win=51531 Len=0
985717 329.102199 244.3.79.215 -> 41.177.98.176 TCP 64 ansys-lm > http [ACK] Seq=986 Ack=56575 Win=46403 Len=0
985722 329.103946 244.3.79.215 -> 41.177.98.176 TCP 64 [TCP Window Update] ansys-lm > http [ACK] Seq=986 Ack=56575 Win=65535 Len=0
985728 329.104955 244.3.79.215 -> 41.177.98.176 TCP 64 ansys-lm > http [ACK] Seq=986 Ack=59335 Win=65535 Len=0
985737 329.106021 244.3.79.215 -> 41.177.98.176 TCP 64 ansys-lm > http [ACK] Seq=986 Ack=61703 Win=65535 Len=0
985748 329.107956 244.3.79.215 -> 41.177.98.176 TCP 64 ansys-lm > http [ACK] Seq=986 Ack=64463 Win=65535 Len=0
985749 329.108297 244.3.79.215 -> 41.177.98.176 TCP 64 ansys-lm > http [ACK] Seq=986 Ack=66831 Win=65535 Len=0
985754 329.110847 244.3.79.215 -> 41.177.98.176 TCP 64 ansys-lm > http [ACK] Seq=986 Ack=69591 Win=65535 Len=0
985755 329.111187 244.3.79.215 -> 41.177.98.176 TCP 64 ansys-lm > http [ACK] Seq=986 Ack=71959 Win=64547 Len=0
985760 329.113827 244.3.79.215 -> 41.177.98.176 TCP 64 ansys-lm > http [ACK] Seq=986 Ack=74719 Win=61787 Len=0
985761 329.114165 244.3.79.215 -> 41.177.98.176 TCP 64 ansys-lm > http [ACK] Seq=986 Ack=77087 Win=59419 Len=0
985775 329.116790 244.3.79.215 -> 41.177.98.176 TCP 64 ansys-lm > http [ACK] Seq=986 Ack=79847 Win=56659 Len=0
985776 329.117115 244.3.79.215 -> 41.177.98.176 TCP 64 ansys-lm > http [ACK] Seq=986 Ack=82215 Win=54291 Len=0
985781 329.119733 244.3.79.215 -> 41.177.98.176 TCP 64 ansys-lm > http [ACK] Seq=986 Ack=84975 Win=51531 Len=0
985782 329.120044 244.3.79.215 -> 41.177.98.176 TCP 64 ansys-lm > http [ACK] Seq=986 Ack=87343 Win=49163 Len=0
985804 329.124291 244.3.79.215 -> 41.177.98.176 TCP 64 ansys-lm > http [ACK] Seq=986 Ack=91109 Win=45397 Len=0
985805 329.126239 244.3.79.215 -> 41.177.98.176 TCP 64 [TCP Window Update] ansys-lm > http [ACK] Seq=986 Ack=91109 Win=65535 Len=0
985851 329.141103 244.3.79.215 -> 41.177.98.176 TCP 64 concomp1 > http [ACK] Seq=2707 Ack=11763 Win=65535 Len=0
985853 329.141424 244.3.79.215 -> 41.177.98.176 TCP 64 concomp1 > http [ACK] Seq=2707 Ack=15815 Win=65535 Len=0
985860 329.142102 244.3.79.215 -> 41.177.98.176 TCP 64 concomp1 > http [ACK] Seq=2707 Ack=19955 Win=62775 Len=0
985863 329.142407 244.3.79.215 -> 41.177.98.176 TCP 64 concomp1 > http [ACK] Seq=2707 Ack=24095 Win=58635 Len=0
985867 329.142746 244.3.79.215 -> 41.177.98.176 TCP 64 concomp1 > http [ACK] Seq=2707 Ack=26855 Win=55875 Len=0
985871 329.143099 244.3.79.215 -> 41.177.98.176 TCP 64 concomp1 > http [ACK] Seq=2707 Ack=30995 Win=51735 Len=0
985876 329.143421 244.3.79.215 -> 41.177.98.176 TCP 64 concomp1 > http [ACK] Seq=2707 Ack=35135 Win=47595 Len=0
985880 329.143751 244.3.79.215 -> 41.177.98.176 TCP 64 concomp1 > http [ACK] Seq=2707 Ack=39275 Win=43455 Len=0
985885 329.144098 244.3.79.215 -> 41.177.98.176 TCP 64 concomp1 > http [ACK] Seq=2707 Ack=43415 Win=39315 Len=0
985889 329.144435 244.3.79.215 -> 41.177.98.176 TCP 64 concomp1 > http [ACK] Seq=2707 Ack=47555 Win=35175 Len=0
985894 329.144745 244.3.79.215 -> 41.177.98.176 TCP 64 concomp1 > http [ACK] Seq=2707 Ack=50315 Win=32415 Len=0
985898 329.145091 244.3.79.215 -> 41.177.98.176 TCP 64 concomp1 > http [ACK] Seq=2707 Ack=54455 Win=28275 Len=0
985902 329.145410 244.3.79.215 -> 41.177.98.176 TCP 64 concomp1 > http [ACK] Seq=2707 Ack=58595 Win=24135 Len=0
985906 329.145746 244.3.79.215 -> 41.177.98.176 TCP 64 concomp1 > http [ACK] Seq=2707 Ack=62735 Win=19995 Len=0
985907 329.146103 244.3.79.215 -> 41.177.98.176 TCP 64 concomp1 > http [ACK] Seq=2707 Ack=66981 Win=15749 Len=0
985927 329.155362 244.3.79.215 -> 41.177.98.176 TCP 64 [TCP Window Update] concomp1 > http [ACK] Seq=2707 Ack=66981 Win=19509 Len=0
985928 329.155435 244.3.79.215 -> 41.177.98.176 TCP 64 [TCP Window Update] concomp1 > http [ACK] Seq=2707 Ack=66981 Win=65535 Len=0
986069 329.183688 244.3.79.215 -> 41.177.98.176 TCP 64 concomp1 > http [ACK] Seq=3379 Ack=71430 Win=65535 Len=0
986070 329.184038 244.3.79.215 -> 41.177.98.176 TCP 64 concomp1 > http [ACK] Seq=3379 Ack=74715 Win=65535 Len=0
986078 329.188991 244.3.79.215 -> 41.177.98.176 TCP 64 ansys-lm > http [ACK] Seq=2348 Ack=96388 Win=65535 Len=0
986100 329.194069 244.3.79.215 -> 41.177.98.176 TCP 64 concomp1 > http [ACK] Seq=4064 Ack=79165 Win=65535 Len=0
986103 329.194331 244.3.79.215 -> 41.177.98.176 TCP 64 concomp1 > http [ACK] Seq=4064 Ack=81925 Win=65535 Len=0
986107 329.194658 244.3.79.215 -> 41.177.98.176 TCP 64 concomp1 > http [ACK] Seq=4064 Ack=85425 Win=65535 Len=0
986114 329.199516 244.3.79.215 -> 41.177.98.176 TCP 64 ansys-lm > http [ACK] Seq=3031 Ack=100391 Win=65535 Len=0
986118 329.199829 244.3.79.215 -> 41.177.98.176 TCP 64 ansys-lm > http [ACK] Seq=3031 Ack=102867 Win=65535 Len=0
986133 329.204000 244.3.79.215 -> 41.177.98.176 TCP 64 concomp1 > http [ACK] Seq=4758 Ack=89874 Win=65535 Len=0
986134 329.204339 244.3.79.215 -> 41.177.98.176 TCP 64 concomp1 > http [ACK] Seq=4758 Ack=92634 Win=65535 Len=0
986135 329.204678 244.3.79.215 -> 41.177.98.176 TCP 64 concomp1 > http [ACK] Seq=4758 Ack=95011 Win=65535 Len=0
986160 329.209512 244.3.79.215 -> 41.177.98.176 TCP 64 ansys-lm > http [ACK] Seq=3726 Ack=104965 Win=65535 Len=0
986185 329.212862 244.3.79.215 -> 41.177.98.176 TCP 64 concomp1 > http [ACK] Seq=5436 Ack=96700 Win=65535 Len=0
986193 329.213186 244.3.79.215 -> 41.177.98.176 TCP 64 concomp1 > http [ACK] Seq=5436 Ack=99460 Win=65535 Len=0
986216 329.217869 244.3.79.215 -> 41.177.98.176 TCP 64 ansys-lm > http [ACK] Seq=4403 Ack=109415 Win=65535 Len=0
986220 329.218199 244.3.79.215 -> 41.177.98.176 TCP 64 ansys-lm > http [ACK] Seq=4403 Ack=113467 Win=65535 Len=0
986222 329.218536 244.3.79.215 -> 41.177.98.176 TCP 64 ansys-lm > http [ACK] Seq=4403 Ack=117607 Win=65535 Len=0
986223 329.218851 244.3.79.215 -> 41.177.98.176 TCP 64 ansys-lm > http [ACK] Seq=4403 Ack=120170 Win=65535 Len=0
986346 329.236941 244.3.79.215 -> 41.177.98.176 TCP 64 concomp1 > http [ACK] Seq=6111 Ack=102308 Win=65535 Len=0
986351 329.237286 244.3.79.215 -> 41.177.98.176 TCP 64 concomp1 > http [ACK] Seq=6111 Ack=105068 Win=65535 Len=0
986361 329.237607 244.3.79.215 -> 41.177.98.176 TCP 64 concomp1 > http [ACK] Seq=6111 Ack=109941 Win=65535 Len=0
986516 329.284360 244.3.79.215 -> 41.177.98.176 TCP 64 concomp1 > http [ACK] Seq=7467 Ack=111885 Win=65535 Len=0
986539 329.289174 244.3.79.215 -> 41.177.98.176 TCP 64 concomp1 > http [ACK] Seq=8145 Ack=113274 Win=65535 Len=0
987880 329.507468 244.3.79.215 -> 41.177.98.176 TCP 64 ansys-lm > http [ACK] Seq=7112 Ack=123810 Win=65535 Len=0
988691 329.726202 244.3.79.215 -> 41.177.98.176 TCP 64 ansys-lm > http [ACK] Seq=7626 Ack=124103 Win=65242 Len=0
988692 329.726208 244.3.79.215 -> 41.177.98.176 TCP 64 concomp1 > http [ACK] Seq=8821 Ack=113609 Win=65200 Len=0
1021134 344.558329 244.3.79.215 -> 41.177.98.176 TCP 64 concomp1 > http [ACK] Seq=8821 Ack=113610 Win=65200 Len=0
1021146 344.568452 244.3.79.215 -> 41.177.98.176 TCP 64 ansys-lm > http [ACK] Seq=7626 Ack=124104 Win=65242 Len=0
