1714   0.498309 244.3.153.142 -> 41.177.46.23 TCP 64 50774 > microsoft-ds [ACK] Seq=54 Ack=54 Win=2136 Len=0
1728   0.502418 244.3.153.142 -> 244.3.176.68 TCP 64 55497 > microsoft-ds [ACK] Seq=54 Ack=54 Win=253 Len=0
27299  10.774509 244.3.153.142 -> 244.3.40.127 TCP 64 57937 > https [ACK] Seq=953 Ack=2070 Win=16387 Len=0
27329  10.778727 244.3.153.142 -> 244.3.40.127 TCP 64 57937 > https [ACK] Seq=953 Ack=4370 Win=16387 Len=0
27330  10.778832 244.3.153.142 -> 244.3.40.127 TCP 64 57937 > https [ACK] Seq=953 Ack=6670 Win=16387 Len=0
27331  10.778837 244.3.153.142 -> 244.3.40.127 TCP 64 57937 > https [ACK] Seq=953 Ack=8970 Win=16387 Len=0
27332  10.778841 244.3.153.142 -> 244.3.40.127 TCP 64 57937 > https [ACK] Seq=953 Ack=10283 Win=16387 Len=0
27445  10.856460 244.3.153.142 -> 244.3.40.127 TCP 64 57937 > https [ACK] Seq=953 Ack=12583 Win=16387 Len=0
27446  10.856530 244.3.153.142 -> 244.3.40.127 TCP 64 57937 > https [ACK] Seq=953 Ack=14883 Win=16387 Len=0
27492  10.863316 244.3.153.142 -> 244.3.40.127 TCP 64 57937 > https [ACK] Seq=953 Ack=17183 Win=16387 Len=0
27493  10.863399 244.3.153.142 -> 244.3.40.127 TCP 64 57937 > https [ACK] Seq=953 Ack=18496 Win=16387 Len=0
27494  10.863404 244.3.153.142 -> 244.3.40.127 TCP 64 57937 > https [ACK] Seq=953 Ack=20796 Win=16387 Len=0
27779  11.054398 244.3.153.142 -> 244.3.40.127 TCP 64 57937 > https [ACK] Seq=953 Ack=21014 Win=16333 Len=0
33211  14.068520 244.3.153.142 -> 244.3.40.127 TCP 64 57937 > https [ACK] Seq=1881 Ack=23083 Win=16387 Len=0
33233  14.072481 244.3.153.142 -> 244.3.40.127 TCP 64 57937 > https [ACK] Seq=1881 Ack=25383 Win=16387 Len=0
33234  14.072555 244.3.153.142 -> 244.3.40.127 TCP 64 57937 > https [ACK] Seq=1881 Ack=27683 Win=16387 Len=0
33250  14.076763 244.3.153.142 -> 244.3.40.127 TCP 64 57937 > https [ACK] Seq=1881 Ack=29983 Win=16387 Len=0
33251  14.076823 244.3.153.142 -> 244.3.40.127 TCP 64 57937 > https [ACK] Seq=1881 Ack=32283 Win=16387 Len=0
33363  14.158594 244.3.153.142 -> 244.3.40.127 TCP 64 57937 > https [ACK] Seq=1881 Ack=34494 Win=16387 Len=0
33364  14.158662 244.3.153.142 -> 244.3.40.127 TCP 64 57937 > https [ACK] Seq=1881 Ack=36794 Win=16387 Len=0
33378  14.162739 244.3.153.142 -> 244.3.40.127 TCP 64 57937 > https [ACK] Seq=1881 Ack=39094 Win=16387 Len=0
33381  14.162833 244.3.153.142 -> 244.3.40.127 TCP 70 57937 > https [ACK] Seq=1881 Ack=40244 Win=16387 Len=0 SLE=41394 SRE=41557
33382  14.162838 244.3.153.142 -> 244.3.40.127 TCP 64 57937 > https [ACK] Seq=1881 Ack=41557 Win=16387 Len=0
33576  14.246511 244.3.153.142 -> 244.3.40.127 TCP 64 57937 > https [ACK] Seq=1881 Ack=43857 Win=16387 Len=0
34014  14.446547 244.3.153.142 -> 244.3.40.127 TCP 64 57937 > https [ACK] Seq=1881 Ack=44144 Win=16315 Len=0
42873  18.116340 244.3.153.142 -> 41.177.24.241 TCP 64 51016 > xmpp-client [ACK] Seq=1 Ack=251 Win=783 Len=0
45793  19.202438 244.3.153.142 -> 41.177.24.241 TCP 64 51016 > xmpp-client [ACK] Seq=1 Ack=767 Win=781 Len=0
50547  20.588713 244.3.153.142 -> 41.177.24.241 TCP 255 51016 > xmpp-client [PSH, ACK] Seq=1 Ack=1129 Win=780 Len=197[Packet size limited during capture]
50951  20.912472 244.3.153.142 -> 244.3.40.127 TCP 64 57937 > https [ACK] Seq=2940 Ack=46213 Win=16387 Len=0
50952  20.912539 244.3.153.142 -> 244.3.40.127 TCP 64 57937 > https [ACK] Seq=2940 Ack=48513 Win=16387 Len=0
50985  20.920415 244.3.153.142 -> 244.3.40.127 TCP 64 57937 > https [ACK] Seq=2940 Ack=50813 Win=16387 Len=0
50990  20.924557 244.3.153.142 -> 244.3.40.127 TCP 64 57937 > https [ACK] Seq=2940 Ack=53113 Win=16387 Len=0
50991  20.924621 244.3.153.142 -> 244.3.40.127 TCP 64 57937 > https [ACK] Seq=2940 Ack=55413 Win=16387 Len=0
51041  20.948171 244.3.153.142 -> 41.177.24.241 TCP 64 51016 > xmpp-client [ACK] Seq=198 Ack=1411 Win=778 Len=0
51127  20.995799 244.3.153.142 -> 244.3.40.127 TCP 64 57937 > https [ACK] Seq=2940 Ack=57624 Win=16387 Len=0
51128  20.995886 244.3.153.142 -> 244.3.40.127 TCP 64 57937 > https [ACK] Seq=2940 Ack=59924 Win=16387 Len=0
51129  20.995891 244.3.153.142 -> 244.3.40.127 TCP 64 57937 > https [ACK] Seq=2940 Ack=62224 Win=16387 Len=0
51130  20.995915 244.3.153.142 -> 244.3.40.127 TCP 64 57937 > https [ACK] Seq=2940 Ack=63655 Win=16387 Len=0
68210  28.072595 244.3.153.142 -> 41.177.24.241 TCP 255 51016 > xmpp-client [PSH, ACK] Seq=198 Ack=1411 Win=778 Len=197[Packet size limited during capture]
68944  28.512744 244.3.153.142 -> 41.177.24.241 TCP 367 51016 > xmpp-client [PSH, ACK] Seq=395 Ack=1411 Win=778 Len=309[Packet size limited during capture]
69156  28.656805 244.3.153.142 -> 41.177.24.241 TCP 239 51016 > xmpp-client [PSH, ACK] Seq=704 Ack=1411 Win=778 Len=181[Packet size limited during capture]
71967  29.566360 244.3.153.142 -> 41.177.24.241 TCP 64 51985 > imaps [ACK] Seq=135 Ack=259 Win=65109 Len=0
81007  31.744431 244.3.153.142 -> 41.177.4.98  TCP 64 55446 > pdap-np [ACK] Seq=1 Ack=11 Win=63641 Len=0
84872  32.938415 244.3.153.142 -> 41.177.24.241 TCP 64 51016 > xmpp-client [ACK] Seq=885 Ack=1661 Win=777 Len=0
87782  33.980482 244.3.153.142 -> 41.177.24.241 TCP 64 51016 > xmpp-client [ACK] Seq=885 Ack=2193 Win=775 Len=0
93733  35.730600 244.3.153.142 -> 41.177.24.241 TCP 255 51016 > xmpp-client [PSH, ACK] Seq=885 Ack=2193 Win=775 Len=197[Packet size limited during capture]
97274  36.500597 244.3.153.142 -> 244.3.176.68 TCP 64 55497 > microsoft-ds [ACK] Seq=107 Ack=107 Win=253 Len=0
97275  36.500671 244.3.153.142 -> 41.177.46.23 TCP 64 50774 > microsoft-ds [ACK] Seq=107 Ack=107 Win=2136 Len=0
98238  36.666854 244.3.153.142 -> 41.177.24.241 TCP 367 51016 > xmpp-client [PSH, ACK] Seq=1082 Ack=2193 Win=775 Len=309[Packet size limited during capture]
98758  36.802612 244.3.153.142 -> 41.177.24.241 TCP 239 51016 > xmpp-client [PSH, ACK] Seq=1391 Ack=2193 Win=775 Len=181[Packet size limited during capture]
124445  44.394475 244.3.153.142 -> 41.177.24.241 TCP 64 51016 > xmpp-client [ACK] Seq=1572 Ack=2443 Win=774 Len=0
132058  45.992439 244.3.153.142 -> 41.177.24.241 TCP 64 51016 > xmpp-client [ACK] Seq=1572 Ack=2975 Win=772 Len=0
135294  47.048422 244.3.153.142 -> 41.177.24.241 TCP 64 51016 > xmpp-client [ACK] Seq=1572 Ack=3225 Win=771 Len=0
136470  47.506660 244.3.153.142 -> 41.177.24.241 TCP 255 51016 > xmpp-client [PSH, ACK] Seq=1572 Ack=3587 Win=770 Len=197[Packet size limited during capture]
137730  47.834472 244.3.153.142 -> 41.177.24.241 TCP 64 51016 > xmpp-client [ACK] Seq=1769 Ack=3869 Win=769 Len=0
144008  49.452433 244.3.153.142 -> 41.177.24.241 TCP 64 51016 > xmpp-client [ACK] Seq=1769 Ack=4401 Win=767 Len=0
154791  52.848478 244.3.153.142 -> 41.177.24.241 TCP 64 51016 > xmpp-client [ACK] Seq=1769 Ack=4651 Win=766 Len=0
161838  55.087051 244.3.153.142 -> 41.177.24.241 TCP 64 51016 > xmpp-client [ACK] Seq=1769 Ack=5183 Win=764 Len=0
174092  57.864566 244.3.153.142 -> 41.177.4.98  TCP 64 55467 > pdap-np [ACK] Seq=1 Ack=11 Win=64024 Len=0
209354  72.152466 244.3.153.142 -> 41.177.24.241 TCP 64 51016 > xmpp-client [ACK] Seq=1769 Ack=5433 Win=763 Len=0
210391  72.500619 244.3.153.142 -> 244.3.176.68 TCP 64 55497 > microsoft-ds [ACK] Seq=160 Ack=160 Win=252 Len=0
210394  72.500690 244.3.153.142 -> 41.177.46.23 TCP 64 50774 > microsoft-ds [ACK] Seq=160 Ack=160 Win=2135 Len=0
253721  89.970506 244.3.153.142 -> 41.177.24.241 TCP 64 51016 > xmpp-client [ACK] Seq=1769 Ack=6093 Win=760 Len=0
318090 108.500516 244.3.153.142 -> 244.3.176.68 TCP 64 55497 > microsoft-ds [ACK] Seq=213 Ack=213 Win=252 Len=0
318129 108.504529 244.3.153.142 -> 41.177.46.23 TCP 64 50774 > microsoft-ds [ACK] Seq=213 Ack=213 Win=2135 Len=0
370339 126.320788 244.3.153.142 -> 41.177.24.241 TCP 271 51016 > xmpp-client [PSH, ACK] Seq=1769 Ack=6455 Win=759 Len=213[Packet size limited during capture]
381139 126.754437 244.3.153.142 -> 41.177.24.241 TCP 64 51016 > xmpp-client [ACK] Seq=1982 Ack=6753 Win=758 Len=0
443916 144.500671 244.3.153.142 -> 41.177.46.23 TCP 64 50774 > microsoft-ds [ACK] Seq=266 Ack=266 Win=2135 Len=0
443930 144.504441 244.3.153.142 -> 244.3.176.68 TCP 64 55497 > microsoft-ds [ACK] Seq=266 Ack=266 Win=252 Len=0
549802 177.088784 244.3.153.142 -> 41.177.24.241 TCP 159 51016 > xmpp-client [PSH, ACK] Seq=1982 Ack=6753 Win=758 Len=101[Packet size limited during capture]
551282 177.372586 244.3.153.142 -> 41.177.24.241 TCP 64 51016 > xmpp-client [ACK] Seq=2083 Ack=7051 Win=756 Len=0
564019 180.502659 244.3.153.142 -> 244.3.176.68 TCP 64 55497 > microsoft-ds [ACK] Seq=319 Ack=319 Win=252 Len=0
564020 180.502730 244.3.153.142 -> 41.177.46.23 TCP 64 50774 > microsoft-ds [ACK] Seq=319 Ack=319 Win=2135 Len=0
665432 207.088765 244.3.153.142 -> 41.177.24.241 TCP 159 51016 > xmpp-client [PSH, ACK] Seq=2083 Ack=7051 Win=756 Len=101[Packet size limited during capture]
666022 207.370703 244.3.153.142 -> 41.177.24.241 TCP 64 51016 > xmpp-client [ACK] Seq=2184 Ack=7349 Win=755 Len=0
672426 209.608630 244.3.153.142 -> 41.177.24.241 TCP 64 51985 > imaps [ACK] Seq=269 Ack=517 Win=65045 Len=0
688445 216.502707 244.3.153.142 -> 244.3.176.68 TCP 64 55497 > microsoft-ds [ACK] Seq=372 Ack=372 Win=252 Len=0
688446 216.502782 244.3.153.142 -> 41.177.46.23 TCP 64 50774 > microsoft-ds [ACK] Seq=372 Ack=372 Win=2135 Len=0
720186 229.844734 244.3.153.142 -> 244.3.176.68 TCP 64 55497 > microsoft-ds [ACK] Seq=610 Ack=471 Win=251 Len=0
721646 230.401050 244.3.153.142 -> 41.177.24.241 TCP 271 51016 > xmpp-client [PSH, ACK] Seq=2184 Ack=7727 Win=754 Len=213[Packet size limited during capture]
722214 230.730670 244.3.153.142 -> 41.177.24.241 TCP 64 51016 > xmpp-client [ACK] Seq=2397 Ack=8025 Win=753 Len=0
746628 238.792799 244.3.153.142 -> 41.177.24.241 TCP 64 51016 > xmpp-client [ACK] Seq=2397 Ack=8355 Win=751 Len=0
750101 240.502635 244.3.153.142 -> 244.3.176.68 TCP 64 55497 > microsoft-ds [ACK] Seq=649 Ack=510 Win=251 Len=0
756686 243.676947 244.3.153.142 -> 41.177.4.98  TCP 64 55558 > pdap-np [ACK] Seq=1 Ack=11 Win=63832 Len=0
781329 252.500643 244.3.153.142 -> 41.177.46.23 TCP 64 50774 > microsoft-ds [ACK] Seq=425 Ack=425 Win=2134 Len=0
839889 275.346875 244.3.153.142 -> 244.3.31.24  TCP 64 57213 > ricardo-lm [ACK] Seq=1 Ack=11 Win=255 Len=0
846470 278.954879 244.3.153.142 -> 41.177.31.98 TCP 64 49633 > ssh [ACK] Seq=2321 Ack=273 Win=255 Len=0
853547 282.132920 244.3.153.142 -> 41.177.24.241 TCP 271 51016 > xmpp-client [PSH, ACK] Seq=2397 Ack=8733 Win=750 Len=213[Packet size limited during capture]
855503 282.780730 244.3.153.142 -> 41.177.24.241 TCP 64 51016 > xmpp-client [ACK] Seq=2610 Ack=9047 Win=749 Len=0
872291 288.502642 244.3.153.142 -> 41.177.46.23 TCP 64 50774 > microsoft-ds [ACK] Seq=478 Ack=478 Win=2134 Len=0
872307 288.506737 244.3.153.142 -> 244.3.176.68 TCP 64 55497 > microsoft-ds [ACK] Seq=702 Ack=563 Win=256 Len=0
925105 307.828603 244.3.153.142 -> 41.177.31.98 TCP 64 49633 > ssh [ACK] Seq=7913 Ack=1241 Win=256 Len=0
927358 309.070933 244.3.153.142 -> 244.3.40.127 TCP 70 57984 > https [SYN] Seq=0 Win=8192 Len=0 MSS=1150 WS=4 SACK_PERM=1
927662 309.153971 244.3.153.142 -> 244.3.40.127 TCP 64 57984 > https [ACK] Seq=1 Ack=1 Win=65548 Len=0
928752 309.458733 244.3.153.142 -> 244.3.40.127 TCP 64 57984 > https [ACK] Seq=1229 Ack=2192 Win=65548 Len=0
928971 309.542793 244.3.153.142 -> 244.3.40.127 TCP 64 57984 > https [ACK] Seq=1229 Ack=4261 Win=65548 Len=0
928972 309.542858 244.3.153.142 -> 244.3.40.127 TCP 64 57984 > https [ACK] Seq=1229 Ack=6561 Win=65548 Len=0
929250 309.625083 244.3.153.142 -> 244.3.40.127 TCP 64 57984 > https [ACK] Seq=1229 Ack=8861 Win=65548 Len=0
929251 309.625168 244.3.153.142 -> 244.3.40.127 TCP 64 57984 > https [ACK] Seq=1229 Ack=11161 Win=65548 Len=0
929252 309.625172 244.3.153.142 -> 244.3.40.127 TCP 64 57984 > https [ACK] Seq=1229 Ack=13461 Win=65548 Len=0
929532 309.706931 244.3.153.142 -> 244.3.40.127 TCP 64 57984 > https [ACK] Seq=1229 Ack=15761 Win=65548 Len=0
929536 309.707003 244.3.153.142 -> 244.3.40.127 TCP 64 57984 > https [ACK] Seq=1229 Ack=18061 Win=65548 Len=0
929537 309.707007 244.3.153.142 -> 244.3.40.127 TCP 64 57984 > https [ACK] Seq=1229 Ack=19655 Win=65548 Len=0
932869 310.750814 244.3.153.142 -> 244.3.40.127 TCP 64 57984 > https [ACK] Seq=2232 Ack=21724 Win=65548 Len=0
932914 310.755087 244.3.153.142 -> 244.3.40.127 TCP 64 57984 > https [ACK] Seq=2232 Ack=24024 Win=65548 Len=0
932915 310.755169 244.3.153.142 -> 244.3.40.127 TCP 64 57984 > https [ACK] Seq=2232 Ack=26324 Win=65548 Len=0
932916 310.755174 244.3.153.142 -> 244.3.40.127 TCP 64 57984 > https [ACK] Seq=2232 Ack=28624 Win=65548 Len=0
932917 310.755214 244.3.153.142 -> 244.3.40.127 TCP 64 57984 > https [ACK] Seq=2232 Ack=30924 Win=65548 Len=0
933112 310.837091 244.3.153.142 -> 244.3.40.127 TCP 64 57984 > https [ACK] Seq=2232 Ack=33135 Win=65548 Len=0
933113 310.837177 244.3.153.142 -> 244.3.40.127 TCP 64 57984 > https [ACK] Seq=2232 Ack=35435 Win=65548 Len=0
933114 310.837186 244.3.153.142 -> 244.3.40.127 TCP 64 57984 > https [ACK] Seq=2232 Ack=37735 Win=65548 Len=0
933116 310.837207 244.3.153.142 -> 244.3.40.127 TCP 64 57984 > https [ACK] Seq=2232 Ack=39166 Win=65548 Len=0
937900 312.344758 244.3.153.142 -> 244.3.40.127 TCP 64 57984 > https [ACK] Seq=3235 Ack=41235 Win=65548 Len=0
937926 312.348737 244.3.153.142 -> 244.3.40.127 TCP 64 57984 > https [ACK] Seq=3235 Ack=43304 Win=65548 Len=0
938151 312.426999 244.3.153.142 -> 244.3.40.127 TCP 64 57984 > https [ACK] Seq=3235 Ack=45604 Win=65548 Len=0
938152 312.427081 244.3.153.142 -> 244.3.40.127 TCP 64 57984 > https [ACK] Seq=3235 Ack=47904 Win=65548 Len=0
938153 312.427086 244.3.153.142 -> 244.3.40.127 TCP 64 57984 > https [ACK] Seq=3235 Ack=50204 Win=65548 Len=0
938169 312.430770 244.3.153.142 -> 244.3.40.127 TCP 64 57984 > https [ACK] Seq=3235 Ack=52504 Win=65548 Len=0
938170 312.430828 244.3.153.142 -> 244.3.40.127 TCP 64 57984 > https [ACK] Seq=3235 Ack=54715 Win=65548 Len=0
938185 312.434779 244.3.153.142 -> 244.3.40.127 TCP 64 57984 > https [ACK] Seq=3235 Ack=57015 Win=65548 Len=0
938186 312.434845 244.3.153.142 -> 244.3.40.127 TCP 64 57984 > https [ACK] Seq=3235 Ack=58698 Win=65548 Len=0
946759 314.236745 244.3.153.142 -> 244.3.40.127 TCP 64 57984 > https [ACK] Seq=4238 Ack=60767 Win=65548 Len=0
946786 314.240760 244.3.153.142 -> 244.3.40.127 TCP 64 57984 > https [ACK] Seq=4238 Ack=62836 Win=65548 Len=0
947041 314.318698 244.3.153.142 -> 244.3.40.127 TCP 64 57984 > https [ACK] Seq=4238 Ack=65136 Win=65548 Len=0
947056 314.323125 244.3.153.142 -> 244.3.40.127 TCP 64 57984 > https [ACK] Seq=4238 Ack=67436 Win=65548 Len=0
947057 314.323217 244.3.153.142 -> 244.3.40.127 TCP 64 57984 > https [ACK] Seq=4238 Ack=69736 Win=65548 Len=0
947059 314.323298 244.3.153.142 -> 244.3.40.127 TCP 64 57984 > https [ACK] Seq=4238 Ack=71049 Win=65548 Len=0
947060 314.323302 244.3.153.142 -> 244.3.40.127 TCP 64 57984 > https [ACK] Seq=4238 Ack=73349 Win=65548 Len=0
947061 314.323338 244.3.153.142 -> 244.3.40.127 TCP 64 57984 > https [ACK] Seq=4238 Ack=75649 Win=65548 Len=0
947068 314.326698 244.3.153.142 -> 244.3.40.127 TCP 64 57984 > https [ACK] Seq=4238 Ack=77949 Win=65548 Len=0
947857 314.526737 244.3.153.142 -> 244.3.40.127 TCP 64 57984 > https [ACK] Seq=4238 Ack=78230 Win=65268 Len=0
954901 316.669072 244.3.153.142 -> 244.3.40.127 TCP 64 57984 > https [ACK] Seq=5193 Ack=80299 Win=65548 Len=0
954903 316.669147 244.3.153.142 -> 244.3.40.127 TCP 64 57984 > https [ACK] Seq=5193 Ack=82599 Win=65548 Len=0
954905 316.669155 244.3.153.142 -> 244.3.40.127 TCP 64 57984 > https [ACK] Seq=5193 Ack=84899 Win=65548 Len=0
954907 316.669179 244.3.153.142 -> 244.3.40.127 TCP 64 57984 > https [ACK] Seq=5193 Ack=87199 Win=65548 Len=0
954933 316.672761 244.3.153.142 -> 244.3.40.127 TCP 64 57984 > https [ACK] Seq=5193 Ack=89499 Win=65548 Len=0
955091 316.752946 244.3.153.142 -> 244.3.40.127 TCP 64 57984 > https [ACK] Seq=5193 Ack=91710 Win=65548 Len=0
955092 316.753032 244.3.153.142 -> 244.3.40.127 TCP 64 57984 > https [ACK] Seq=5193 Ack=94010 Win=65548 Len=0
955093 316.753036 244.3.153.142 -> 244.3.40.127 TCP 64 57984 > https [ACK] Seq=5193 Ack=96310 Win=65548 Len=0
955106 316.756761 244.3.153.142 -> 244.3.40.127 TCP 64 57984 > https [ACK] Seq=5193 Ack=98610 Win=65548 Len=0
955265 316.832640 244.3.153.142 -> 244.3.40.127 TCP 64 57984 > https [ACK] Seq=5193 Ack=99243 Win=64916 Len=0
959074 318.508820 244.3.153.142 -> 244.3.40.127 TCP 64 57984 > https [ACK] Seq=6121 Ack=101312 Win=65548 Len=0
959113 318.513109 244.3.153.142 -> 244.3.40.127 TCP 64 57984 > https [ACK] Seq=6121 Ack=103612 Win=65548 Len=0
959114 318.513155 244.3.153.142 -> 244.3.40.127 TCP 64 57984 > https [ACK] Seq=6121 Ack=105912 Win=65548 Len=0
959115 318.513160 244.3.153.142 -> 244.3.40.127 TCP 64 57984 > https [ACK] Seq=6121 Ack=108212 Win=65548 Len=0
959116 318.513182 244.3.153.142 -> 244.3.40.127 TCP 64 57984 > https [ACK] Seq=6121 Ack=110512 Win=65548 Len=0
959332 318.592861 244.3.153.142 -> 244.3.40.127 TCP 64 57984 > https [ACK] Seq=6121 Ack=112723 Win=65548 Len=0
959333 318.592925 244.3.153.142 -> 244.3.40.127 TCP 64 57984 > https [ACK] Seq=6121 Ack=115023 Win=65548 Len=0
959367 318.596983 244.3.153.142 -> 244.3.40.127 TCP 64 57984 > https [ACK] Seq=6121 Ack=117323 Win=65548 Len=0
959368 318.597061 244.3.153.142 -> 244.3.40.127 TCP 64 57984 > https [ACK] Seq=6121 Ack=119623 Win=65548 Len=0
959369 318.597066 244.3.153.142 -> 244.3.40.127 TCP 64 57984 > https [ACK] Seq=6121 Ack=121834 Win=65548 Len=0
960090 318.878731 244.3.153.142 -> 244.3.40.127 TCP 64 57984 > https [ACK] Seq=6121 Ack=122373 Win=65008 Len=0
974833 324.504788 244.3.153.142 -> 244.3.176.68 TCP 64 55497 > microsoft-ds [ACK] Seq=755 Ack=616 Win=255 Len=0
974834 324.504881 244.3.153.142 -> 41.177.46.23 TCP 64 50774 > microsoft-ds [ACK] Seq=531 Ack=531 Win=2134 Len=0
979031 326.317214 244.3.153.142 -> 244.3.40.127 TCP 64 57984 > https [ACK] Seq=7179 Ack=124442 Win=65548 Len=0
979032 326.317301 244.3.153.142 -> 244.3.40.127 TCP 64 57984 > https [ACK] Seq=7179 Ack=126742 Win=65548 Len=0
979033 326.317307 244.3.153.142 -> 244.3.40.127 TCP 64 57984 > https [ACK] Seq=7179 Ack=129042 Win=65548 Len=0
979034 326.317325 244.3.153.142 -> 244.3.40.127 TCP 64 57984 > https [ACK] Seq=7179 Ack=131342 Win=65548 Len=0
979035 326.317347 244.3.153.142 -> 244.3.40.127 TCP 64 57984 > https [ACK] Seq=7179 Ack=133642 Win=65548 Len=0
979206 326.402842 244.3.153.142 -> 244.3.40.127 TCP 64 57984 > https [ACK] Seq=7179 Ack=135853 Win=65548 Len=0
979207 326.402899 244.3.153.142 -> 244.3.40.127 TCP 64 57984 > https [ACK] Seq=7179 Ack=138153 Win=65548 Len=0
979214 326.406781 244.3.153.142 -> 244.3.40.127 TCP 64 57984 > https [ACK] Seq=7179 Ack=140453 Win=65548 Len=0
979215 326.406843 244.3.153.142 -> 244.3.40.127 TCP 64 57984 > https [ACK] Seq=7179 Ack=141884 Win=65548 Len=0
980413 327.094181 244.3.153.142 -> 41.177.24.241 TCP 159 51016 > xmpp-client [PSH, ACK] Seq=2610 Ack=9047 Win=749 Len=101[Packet size limited during capture]
980832 327.374781 244.3.153.142 -> 41.177.24.241 TCP 64 51016 > xmpp-client [ACK] Seq=2711 Ack=9345 Win=747 Len=0
