512159 164.580695 244.3.153.204 -> 41.177.143.229 TCP 66 ksysguard > talon-engine [SYN] Seq=0 Win=65535 Len=0 MSS=1150 SACK_PERM=1
512225 164.630630 244.3.153.204 -> 41.177.143.229 TCP 64 ksysguard > talon-engine [ACK] Seq=1 Ack=1 Win=65535 Len=0
512228 164.630879 244.3.153.204 -> 41.177.143.229 TCP 144 ksysguard > talon-engine [PSH, ACK] Seq=1 Ack=1 Win=65535 Len=86
512419 164.682514 244.3.153.204 -> 41.177.143.229 TCP 64 ksysguard > talon-engine [ACK] Seq=87 Ack=1706 Win=65535 Len=0
512424 164.683570 244.3.153.204 -> 41.177.143.229 TCP 262 ksysguard > talon-engine [PSH, ACK] Seq=87 Ack=1706 Win=65535 Len=204
512507 164.739883 244.3.153.204 -> 41.177.143.229 TCP 1208 ksysguard > talon-engine [ACK] Seq=291 Ack=1773 Win=65468 Len=1150
512508 164.739913 244.3.153.204 -> 41.177.143.229 TCP 340 ksysguard > talon-engine [PSH, ACK] Seq=1441 Ack=1773 Win=65468 Len=282
512788 164.817133 244.3.153.204 -> 41.177.143.229 TCP 64 ksysguard > talon-engine [ACK] Seq=1723 Ack=3656 Win=65535 Len=0
512789 164.817188 244.3.153.204 -> 41.177.143.229 TCP 64 ksysguard > talon-engine [ACK] Seq=1723 Ack=5816 Win=65535 Len=0
512945 164.854928 244.3.153.204 -> 41.177.143.229 TCP 873 ksysguard > talon-engine [PSH, ACK] Seq=1723 Ack=5816 Win=65535 Len=815
513169 164.908676 244.3.153.204 -> 41.177.143.229 TCP 64 ksysguard > talon-engine [ACK] Seq=2538 Ack=7605 Win=65535 Len=0
513172 164.908836 244.3.153.204 -> 41.177.143.229 TCP 64 ksysguard > talon-engine [ACK] Seq=2538 Ack=9709 Win=65535 Len=0
720356 229.909356 244.3.153.204 -> 41.177.143.229 TCP 64 ksysguard > talon-engine [RST, ACK] Seq=2538 Ack=9709 Win=0 Len=0
