483441 159.585676 244.3.31.244 -> 244.3.139.251 TCP 78 https > 57474 [SYN, ACK] Seq=0 Ack=1 Win=5792 Len=0 MSS=1460 SACK_PERM=1 TSval=1061578841 TSecr=408511788 WS=4
483445 159.586697 244.3.31.244 -> 244.3.139.251 TCP 70 https > 57474 [ACK] Seq=1 Ack=85 Win=5792 Len=0 TSval=1061578842 TSecr=408511788
483457 159.592977 244.3.31.244 -> 244.3.139.251 TCP 70 https > 57474 [ACK] Seq=1144 Ack=289 Win=6864 Len=0 TSval=1061578848 TSecr=408511788
483471 159.595861 244.3.31.244 -> 244.3.139.251 TCP 70 https > 57474 [FIN, ACK] Seq=2054 Ack=761 Win=7936 Len=0 TSval=1061578851 TSecr=408511788
483478 159.597885 244.3.31.244 -> 244.3.139.251 TCP 78 https > 57475 [SYN, ACK] Seq=0 Ack=1 Win=5792 Len=0 MSS=1460 SACK_PERM=1 TSval=1061578853 TSecr=408511788 WS=4
483500 159.598874 244.3.31.244 -> 244.3.139.251 TCP 70 https > 57475 [ACK] Seq=1 Ack=85 Win=5792 Len=0 TSval=1061578854 TSecr=408511788
483515 159.605087 244.3.31.244 -> 244.3.139.251 TCP 70 https > 57475 [ACK] Seq=1144 Ack=289 Win=6864 Len=0 TSval=1061578860 TSecr=408511788
483539 159.608614 244.3.31.244 -> 244.3.139.251 TCP 70 https > 57475 [FIN, ACK] Seq=1825 Ack=804 Win=7936 Len=0 TSval=1061578864 TSecr=408511788
483578 159.614905 244.3.31.244 -> 244.3.139.251 TCP 78 https > 57476 [SYN, ACK] Seq=0 Ack=1 Win=5792 Len=0 MSS=1460 SACK_PERM=1 TSval=1061578870 TSecr=408511788 WS=4
483583 159.615747 244.3.31.244 -> 244.3.139.251 TCP 70 https > 57476 [ACK] Seq=1 Ack=85 Win=5792 Len=0 TSval=1061578871 TSecr=408511788
483607 159.621999 244.3.31.244 -> 244.3.139.251 TCP 70 https > 57476 [ACK] Seq=1144 Ack=289 Win=6864 Len=0 TSval=1061578877 TSecr=408511788
483614 159.622935 244.3.31.244 -> 244.3.139.251 TCP 70 https > 57476 [ACK] Seq=1211 Ack=1145 Win=9008 Len=0 TSval=1061578878 TSecr=408511789
483628 159.625695 244.3.31.244 -> 244.3.139.251 TCP 70 https > 57476 [FIN, ACK] Seq=2284 Ack=1145 Win=9008 Len=0 TSval=1061578881 TSecr=408511789
483639 159.628683 244.3.31.244 -> 244.3.139.251 TCP 78 https > 57477 [SYN, ACK] Seq=0 Ack=1 Win=5792 Len=0 MSS=1460 SACK_PERM=1 TSval=1061578884 TSecr=408511789 WS=4
483645 159.629575 244.3.31.244 -> 244.3.139.251 TCP 70 https > 57477 [ACK] Seq=1 Ack=85 Win=5792 Len=0 TSval=1061578885 TSecr=408511789
483658 159.636038 244.3.31.244 -> 244.3.139.251 TCP 70 https > 57477 [ACK] Seq=1144 Ack=289 Win=6864 Len=0 TSval=1061578891 TSecr=408511789
483675 159.638591 244.3.31.244 -> 244.3.139.251 TCP 70 https > 57477 [FIN, ACK] Seq=2054 Ack=761 Win=7936 Len=0 TSval=1061578894 TSecr=408511789
483684 159.640312 244.3.31.244 -> 244.3.139.251 TCP 78 https > 57478 [SYN, ACK] Seq=0 Ack=1 Win=5792 Len=0 MSS=1460 SACK_PERM=1 TSval=1061578895 TSecr=408511789 WS=4
483694 159.641106 244.3.31.244 -> 244.3.139.251 TCP 70 https > 57478 [ACK] Seq=1 Ack=85 Win=5792 Len=0 TSval=1061578896 TSecr=408511789
483721 159.647416 244.3.31.244 -> 244.3.139.251 TCP 70 https > 57478 [ACK] Seq=1144 Ack=289 Win=6864 Len=0 TSval=1061578902 TSecr=408511789
483743 159.650983 244.3.31.244 -> 244.3.139.251 TCP 70 https > 57478 [FIN, ACK] Seq=1825 Ack=804 Win=7936 Len=0 TSval=1061578906 TSecr=408511789
483760 159.655340 244.3.31.244 -> 244.3.139.251 TCP 78 https > 57479 [SYN, ACK] Seq=0 Ack=1 Win=5792 Len=0 MSS=1460 SACK_PERM=1 TSval=1061578910 TSecr=408511789 WS=4
483778 159.656133 244.3.31.244 -> 244.3.139.251 TCP 70 https > 57479 [ACK] Seq=1 Ack=85 Win=5792 Len=0 TSval=1061578911 TSecr=408511789
483827 159.662615 244.3.31.244 -> 244.3.139.251 TCP 70 https > 57479 [ACK] Seq=1144 Ack=289 Win=6864 Len=0 TSval=1061578918 TSecr=408511789
483833 159.663471 244.3.31.244 -> 244.3.139.251 TCP 70 https > 57479 [ACK] Seq=1211 Ack=1145 Win=9008 Len=0 TSval=1061578918 TSecr=408511789
483851 159.666170 244.3.31.244 -> 244.3.139.251 TCP 70 https > 57479 [FIN, ACK] Seq=2284 Ack=1145 Win=9008 Len=0 TSval=1061578921 TSecr=408511789
483868 159.668767 244.3.31.244 -> 244.3.139.251 TCP 78 https > 57480 [SYN, ACK] Seq=0 Ack=1 Win=5792 Len=0 MSS=1460 SACK_PERM=1 TSval=1061578924 TSecr=408511789 WS=4
483871 159.669709 244.3.31.244 -> 244.3.139.251 TCP 70 https > 57480 [ACK] Seq=1 Ack=85 Win=5792 Len=0 TSval=1061578925 TSecr=408511789
483910 159.675902 244.3.31.244 -> 244.3.139.251 TCP 70 https > 57480 [ACK] Seq=1144 Ack=289 Win=6864 Len=0 TSval=1061578931 TSecr=408511789
483919 159.676650 244.3.31.244 -> 244.3.139.251 TCP 70 https > 57480 [ACK] Seq=1211 Ack=956 Win=9008 Len=0 TSval=1061578932 TSecr=408511789
483939 159.678703 244.3.31.244 -> 244.3.139.251 TCP 70 https > 57480 [FIN, ACK] Seq=1984 Ack=956 Win=9008 Len=0 TSval=1061578934 TSecr=408511789
483953 159.680600 244.3.31.244 -> 244.3.139.251 TCP 78 https > 57481 [SYN, ACK] Seq=0 Ack=1 Win=5792 Len=0 MSS=1460 SACK_PERM=1 TSval=1061578936 TSecr=408511789 WS=4
483961 159.681593 244.3.31.244 -> 244.3.139.251 TCP 70 https > 57481 [ACK] Seq=1 Ack=85 Win=5792 Len=0 TSval=1061578937 TSecr=408511789
484001 159.687790 244.3.31.244 -> 244.3.139.251 TCP 70 https > 57481 [ACK] Seq=1144 Ack=289 Win=6864 Len=0 TSval=1061578943 TSecr=408511789
484009 159.688581 244.3.31.244 -> 244.3.139.251 TCP 70 https > 57481 [ACK] Seq=1211 Ack=963 Win=9008 Len=0 TSval=1061578944 TSecr=408511789
484032 159.690642 244.3.31.244 -> 244.3.139.251 TCP 70 https > 57481 [FIN, ACK] Seq=2000 Ack=963 Win=9008 Len=0 TSval=1061578946 TSecr=408511789
484046 159.692629 244.3.31.244 -> 244.3.139.251 TCP 78 https > 57482 [SYN, ACK] Seq=0 Ack=1 Win=5792 Len=0 MSS=1460 SACK_PERM=1 TSval=1061578948 TSecr=408511789 WS=4
484049 159.693571 244.3.31.244 -> 244.3.139.251 TCP 70 https > 57482 [ACK] Seq=1 Ack=85 Win=5792 Len=0 TSval=1061578949 TSecr=408511789
484086 159.699792 244.3.31.244 -> 244.3.139.251 TCP 70 https > 57482 [ACK] Seq=1144 Ack=289 Win=6864 Len=0 TSval=1061578955 TSecr=408511789
484093 159.700562 244.3.31.244 -> 244.3.139.251 TCP 70 https > 57482 [ACK] Seq=1211 Ack=969 Win=9032 Len=0 TSval=1061578956 TSecr=408511789
484116 159.703239 244.3.31.244 -> 244.3.139.251 TCP 70 https > 57482 [FIN, ACK] Seq=1923 Ack=969 Win=9032 Len=0 TSval=1061578958 TSecr=408511789
484133 159.705708 244.3.31.244 -> 244.3.139.251 TCP 78 https > 57483 [SYN, ACK] Seq=0 Ack=1 Win=5792 Len=0 MSS=1460 SACK_PERM=1 TSval=1061578961 TSecr=408511789 WS=4
484136 159.706651 244.3.31.244 -> 244.3.139.251 TCP 70 https > 57483 [ACK] Seq=1 Ack=85 Win=5792 Len=0 TSval=1061578962 TSecr=408511789
484169 159.712852 244.3.31.244 -> 244.3.139.251 TCP 70 https > 57483 [ACK] Seq=1144 Ack=289 Win=6864 Len=0 TSval=1061578968 TSecr=408511789
484194 159.715393 244.3.31.244 -> 244.3.139.251 TCP 70 https > 57483 [FIN, ACK] Seq=2054 Ack=761 Win=7936 Len=0 TSval=1061578970 TSecr=408511789
484207 159.717091 244.3.31.244 -> 244.3.139.251 TCP 78 https > 57484 [SYN, ACK] Seq=0 Ack=1 Win=5792 Len=0 MSS=1460 SACK_PERM=1 TSval=1061578972 TSecr=408511789 WS=4
484210 159.717883 244.3.31.244 -> 244.3.139.251 TCP 70 https > 57484 [ACK] Seq=1 Ack=85 Win=5792 Len=0 TSval=1061578973 TSecr=408511789
484247 159.724097 244.3.31.244 -> 244.3.139.251 TCP 70 https > 57484 [ACK] Seq=1144 Ack=289 Win=6864 Len=0 TSval=1061578979 TSecr=408511790
484275 159.727686 244.3.31.244 -> 244.3.139.251 TCP 70 https > 57484 [FIN, ACK] Seq=1825 Ack=804 Win=7936 Len=0 TSval=1061578983 TSecr=408511790
484307 159.732864 244.3.31.244 -> 244.3.139.251 TCP 78 https > 57485 [SYN, ACK] Seq=0 Ack=1 Win=5792 Len=0 MSS=1460 SACK_PERM=1 TSval=1061578988 TSecr=408511790 WS=4
484312 159.733907 244.3.31.244 -> 244.3.139.251 TCP 70 https > 57485 [ACK] Seq=1 Ack=85 Win=5792 Len=0 TSval=1061578989 TSecr=408511790
484339 159.740146 244.3.31.244 -> 244.3.139.251 TCP 70 https > 57485 [ACK] Seq=1144 Ack=289 Win=6864 Len=0 TSval=1061578995 TSecr=408511790
484351 159.740899 244.3.31.244 -> 244.3.139.251 TCP 70 https > 57485 [ACK] Seq=1211 Ack=1145 Win=9008 Len=0 TSval=1061578996 TSecr=408511790
484374 159.743920 244.3.31.244 -> 244.3.139.251 TCP 70 https > 57485 [FIN, ACK] Seq=2284 Ack=1145 Win=9008 Len=0 TSval=1061578999 TSecr=408511790
484387 159.746593 244.3.31.244 -> 244.3.139.251 TCP 78 https > 57486 [SYN, ACK] Seq=0 Ack=1 Win=5792 Len=0 MSS=1460 SACK_PERM=1 TSval=1061579002 TSecr=408511790 WS=4
484396 159.747585 244.3.31.244 -> 244.3.139.251 TCP 70 https > 57486 [ACK] Seq=1 Ack=85 Win=5792 Len=0 TSval=1061579003 TSecr=408511790
484423 159.753747 244.3.31.244 -> 244.3.139.251 TCP 70 https > 57486 [ACK] Seq=1144 Ack=289 Win=6864 Len=0 TSval=1061579009 TSecr=408511790
484444 159.756496 244.3.31.244 -> 244.3.139.251 TCP 70 https > 57486 [FIN, ACK] Seq=2054 Ack=761 Win=7936 Len=0 TSval=1061579011 TSecr=408511790
484453 159.758073 244.3.31.244 -> 244.3.139.251 TCP 78 https > 57487 [SYN, ACK] Seq=0 Ack=1 Win=5792 Len=0 MSS=1460 SACK_PERM=1 TSval=1061579013 TSecr=408511790 WS=4
484462 159.759065 244.3.31.244 -> 244.3.139.251 TCP 70 https > 57487 [ACK] Seq=1 Ack=85 Win=5792 Len=0 TSval=1061579014 TSecr=408511790
484484 159.765677 244.3.31.244 -> 244.3.139.251 TCP 70 https > 57487 [ACK] Seq=1144 Ack=289 Win=6864 Len=0 TSval=1061579021 TSecr=408511790
484507 159.769115 244.3.31.244 -> 244.3.139.251 TCP 70 https > 57487 [FIN, ACK] Seq=1825 Ack=804 Win=7936 Len=0 TSval=1061579024 TSecr=408511790
484547 159.774498 244.3.31.244 -> 244.3.139.251 TCP 78 https > 57488 [SYN, ACK] Seq=0 Ack=1 Win=5792 Len=0 MSS=1460 SACK_PERM=1 TSval=1061579029 TSecr=408511790 WS=4
484550 159.775540 244.3.31.244 -> 244.3.139.251 TCP 70 https > 57488 [ACK] Seq=1 Ack=85 Win=5792 Len=0 TSval=1061579031 TSecr=408511790
484577 159.781733 244.3.31.244 -> 244.3.139.251 TCP 70 https > 57488 [ACK] Seq=1144 Ack=289 Win=6864 Len=0 TSval=1061579037 TSecr=408511790
484617 159.784192 244.3.31.244 -> 244.3.139.251 TCP 70 https > 57488 [FIN, ACK] Seq=2054 Ack=761 Win=7936 Len=0 TSval=1061579039 TSecr=408511790
484642 159.785828 244.3.31.244 -> 244.3.139.251 TCP 78 https > 57489 [SYN, ACK] Seq=0 Ack=1 Win=5792 Len=0 MSS=1460 SACK_PERM=1 TSval=1061579041 TSecr=408511790 WS=4
484649 159.786672 244.3.31.244 -> 244.3.139.251 TCP 70 https > 57489 [ACK] Seq=1 Ack=85 Win=5792 Len=0 TSval=1061579042 TSecr=408511790
484690 159.792915 244.3.31.244 -> 244.3.139.251 TCP 70 https > 57489 [ACK] Seq=1144 Ack=289 Win=6864 Len=0 TSval=1061579048 TSecr=408511790
484713 159.796376 244.3.31.244 -> 244.3.139.251 TCP 70 https > 57489 [FIN, ACK] Seq=1825 Ack=804 Win=7936 Len=0 TSval=1061579051 TSecr=408511790
484735 159.800756 244.3.31.244 -> 244.3.139.251 TCP 78 https > 57490 [SYN, ACK] Seq=0 Ack=1 Win=5792 Len=0 MSS=1460 SACK_PERM=1 TSval=1061579056 TSecr=408511790 WS=4
484740 159.801747 244.3.31.244 -> 244.3.139.251 TCP 70 https > 57490 [ACK] Seq=1 Ack=85 Win=5792 Len=0 TSval=1061579057 TSecr=408511790
484767 159.808397 244.3.31.244 -> 244.3.139.251 TCP 70 https > 57490 [ACK] Seq=1144 Ack=289 Win=6864 Len=0 TSval=1061579063 TSecr=408511790
484791 159.810967 244.3.31.244 -> 244.3.139.251 TCP 70 https > 57490 [FIN, ACK] Seq=2054 Ack=761 Win=7936 Len=0 TSval=1061579066 TSecr=408511790
484807 159.812849 244.3.31.244 -> 244.3.139.251 TCP 78 https > 57491 [SYN, ACK] Seq=0 Ack=1 Win=5792 Len=0 MSS=1460 SACK_PERM=1 TSval=1061579068 TSecr=408511790 WS=4
484810 159.813728 244.3.31.244 -> 244.3.139.251 TCP 70 https > 57491 [ACK] Seq=1 Ack=85 Win=5792 Len=0 TSval=1061579069 TSecr=408511790
484842 159.819941 244.3.31.244 -> 244.3.139.251 TCP 70 https > 57491 [ACK] Seq=1144 Ack=289 Win=6864 Len=0 TSval=1061579075 TSecr=408511790
484880 159.823519 244.3.31.244 -> 244.3.139.251 TCP 70 https > 57491 [FIN, ACK] Seq=1825 Ack=804 Win=7936 Len=0 TSval=1061579079 TSecr=408511791
484904 159.828943 244.3.31.244 -> 244.3.139.251 TCP 78 https > 57492 [SYN, ACK] Seq=0 Ack=1 Win=5792 Len=0 MSS=1460 SACK_PERM=1 TSval=1061579084 TSecr=408511791 WS=4
484908 159.829703 244.3.31.244 -> 244.3.139.251 TCP 70 https > 57492 [ACK] Seq=1 Ack=85 Win=5792 Len=0 TSval=1061579085 TSecr=408511791
484944 159.835913 244.3.31.244 -> 244.3.139.251 TCP 70 https > 57492 [ACK] Seq=1144 Ack=289 Win=6864 Len=0 TSval=1061579091 TSecr=408511791
484969 159.838412 244.3.31.244 -> 244.3.139.251 TCP 70 https > 57492 [FIN, ACK] Seq=2054 Ack=761 Win=7936 Len=0 TSval=1061579093 TSecr=408511791
484980 159.840141 244.3.31.244 -> 244.3.139.251 TCP 78 https > 57493 [SYN, ACK] Seq=0 Ack=1 Win=5792 Len=0 MSS=1460 SACK_PERM=1 TSval=1061579095 TSecr=408511791 WS=4
484984 159.841038 244.3.31.244 -> 244.3.139.251 TCP 70 https > 57493 [ACK] Seq=1 Ack=85 Win=5792 Len=0 TSval=1061579096 TSecr=408511791
485007 159.847241 244.3.31.244 -> 244.3.139.251 TCP 70 https > 57493 [ACK] Seq=1144 Ack=289 Win=6864 Len=0 TSval=1061579102 TSecr=408511791
485031 159.850790 244.3.31.244 -> 244.3.139.251 TCP 70 https > 57493 [FIN, ACK] Seq=1825 Ack=804 Win=7936 Len=0 TSval=1061579106 TSecr=408511791
485068 159.855918 244.3.31.244 -> 244.3.139.251 TCP 78 https > 57494 [SYN, ACK] Seq=0 Ack=1 Win=5792 Len=0 MSS=1460 SACK_PERM=1 TSval=1061579111 TSecr=408511791 WS=4
485075 159.856959 244.3.31.244 -> 244.3.139.251 TCP 70 https > 57494 [ACK] Seq=1 Ack=85 Win=5792 Len=0 TSval=1061579112 TSecr=408511791
485092 159.863180 244.3.31.244 -> 244.3.139.251 TCP 70 https > 57494 [ACK] Seq=1144 Ack=289 Win=6864 Len=0 TSval=1061579118 TSecr=408511791
485097 159.863898 244.3.31.244 -> 244.3.139.251 TCP 70 https > 57494 [ACK] Seq=1211 Ack=984 Win=9116 Len=0 TSval=1061579119 TSecr=408511791
485131 159.869145 244.3.31.244 -> 244.3.139.251 TCP 78 https > 57495 [SYN, ACK] Seq=0 Ack=1 Win=5792 Len=0 MSS=1460 SACK_PERM=1 TSval=1061579124 TSecr=408511791 WS=4
485135 159.869888 244.3.31.244 -> 244.3.139.251 TCP 70 https > 57495 [ACK] Seq=1 Ack=85 Win=5792 Len=0 TSval=1061579125 TSecr=408511791
485164 159.876055 244.3.31.244 -> 244.3.139.251 TCP 70 https > 57495 [ACK] Seq=1144 Ack=289 Win=6864 Len=0 TSval=1061579131 TSecr=408511791
485172 159.876833 244.3.31.244 -> 244.3.139.251 TCP 70 https > 57495 [ACK] Seq=1211 Ack=1145 Win=9008 Len=0 TSval=1061579132 TSecr=408511791
485200 159.879560 244.3.31.244 -> 244.3.139.251 TCP 70 https > 57495 [FIN, ACK] Seq=2284 Ack=1145 Win=9008 Len=0 TSval=1061579135 TSecr=408511791
485211 159.881975 244.3.31.244 -> 244.3.139.251 TCP 78 https > 57496 [SYN, ACK] Seq=0 Ack=1 Win=5792 Len=0 MSS=1460 SACK_PERM=1 TSval=1061579137 TSecr=408511791 WS=4
485219 159.882868 244.3.31.244 -> 244.3.139.251 TCP 70 https > 57496 [ACK] Seq=1 Ack=85 Win=5792 Len=0 TSval=1061579138 TSecr=408511791
485241 159.889138 244.3.31.244 -> 244.3.139.251 TCP 70 https > 57496 [ACK] Seq=1144 Ack=289 Win=6864 Len=0 TSval=1061579144 TSecr=408511791
485249 159.889859 244.3.31.244 -> 244.3.139.251 TCP 70 https > 57496 [ACK] Seq=1211 Ack=1220 Win=9128 Len=0 TSval=1061579145 TSecr=408511791
485362 159.912478 244.3.31.244 -> 244.3.139.251 TCP 78 https > 57497 [SYN, ACK] Seq=0 Ack=1 Win=5792 Len=0 MSS=1460 SACK_PERM=1 TSval=1061579167 TSecr=408511791 WS=4
485366 159.913268 244.3.31.244 -> 244.3.139.251 TCP 70 https > 57497 [ACK] Seq=1 Ack=85 Win=5792 Len=0 TSval=1061579168 TSecr=408511791
485390 159.919890 244.3.31.244 -> 244.3.139.251 TCP 70 https > 57497 [ACK] Seq=1144 Ack=289 Win=6864 Len=0 TSval=1061579175 TSecr=408511791
485405 159.922483 244.3.31.244 -> 244.3.139.251 TCP 70 https > 57497 [FIN, ACK] Seq=2054 Ack=801 Win=7936 Len=0 TSval=1061579177 TSecr=408511792
485414 159.924307 244.3.31.244 -> 244.3.139.251 TCP 78 https > 57498 [SYN, ACK] Seq=0 Ack=1 Win=5792 Len=0 MSS=1460 SACK_PERM=1 TSval=1061579179 TSecr=408511792 WS=4
485420 159.925250 244.3.31.244 -> 244.3.139.251 TCP 70 https > 57498 [ACK] Seq=1 Ack=85 Win=5792 Len=0 TSval=1061579180 TSecr=408511792
485457 159.931457 244.3.31.244 -> 244.3.139.251 TCP 70 https > 57498 [ACK] Seq=1144 Ack=289 Win=6864 Len=0 TSval=1061579186 TSecr=408511792
485485 159.936045 244.3.31.244 -> 244.3.139.251 TCP 70 https > 57498 [FIN, ACK] Seq=1825 Ack=844 Win=7976 Len=0 TSval=1061579191 TSecr=408511792
485498 159.940832 244.3.31.244 -> 244.3.139.251 TCP 78 https > 57499 [SYN, ACK] Seq=0 Ack=1 Win=5792 Len=0 MSS=1460 SACK_PERM=1 TSval=1061579196 TSecr=408511792 WS=4
485503 159.941626 244.3.31.244 -> 244.3.139.251 TCP 70 https > 57499 [ACK] Seq=1 Ack=85 Win=5792 Len=0 TSval=1061579197 TSecr=408511792
485513 159.947845 244.3.31.244 -> 244.3.139.251 TCP 70 https > 57499 [ACK] Seq=1144 Ack=289 Win=6864 Len=0 TSval=1061579203 TSecr=408511792
485519 159.948813 244.3.31.244 -> 244.3.139.251 TCP 70 https > 57499 [ACK] Seq=1211 Ack=1185 Win=9136 Len=0 TSval=1061579204 TSecr=408511792
485534 159.952210 244.3.31.244 -> 244.3.139.251 TCP 70 https > 57499 [FIN, ACK] Seq=2364 Ack=1185 Win=9136 Len=0 TSval=1061579207 TSecr=408511792
485555 159.954866 244.3.31.244 -> 244.3.139.251 TCP 78 https > 57500 [SYN, ACK] Seq=0 Ack=1 Win=5792 Len=0 MSS=1460 SACK_PERM=1 TSval=1061579210 TSecr=408511792 WS=4
485567 159.955616 244.3.31.244 -> 244.3.139.251 TCP 70 https > 57500 [ACK] Seq=1 Ack=85 Win=5792 Len=0 TSval=1061579211 TSecr=408511792
485606 159.961840 244.3.31.244 -> 244.3.139.251 TCP 70 https > 57500 [ACK] Seq=1144 Ack=289 Win=6864 Len=0 TSval=1061579217 TSecr=408511792
485622 159.964411 244.3.31.244 -> 244.3.139.251 TCP 70 https > 57500 [FIN, ACK] Seq=2054 Ack=801 Win=7936 Len=0 TSval=1061579219 TSecr=408511792
485640 159.966187 244.3.31.244 -> 244.3.139.251 TCP 78 https > 57501 [SYN, ACK] Seq=0 Ack=1 Win=5792 Len=0 MSS=1460 SACK_PERM=1 TSval=1061579221 TSecr=408511792 WS=4
485646 159.967135 244.3.31.244 -> 244.3.139.251 TCP 70 https > 57501 [ACK] Seq=1 Ack=85 Win=5792 Len=0 TSval=1061579222 TSecr=408511792
485694 159.973493 244.3.31.244 -> 244.3.139.251 TCP 70 https > 57501 [ACK] Seq=1144 Ack=289 Win=6864 Len=0 TSval=1061579228 TSecr=408511792
485720 159.977793 244.3.31.244 -> 244.3.139.251 TCP 70 https > 57501 [FIN, ACK] Seq=1825 Ack=844 Win=7976 Len=0 TSval=1061579233 TSecr=408511792
485747 159.982667 244.3.31.244 -> 244.3.139.251 TCP 78 https > 57502 [SYN, ACK] Seq=0 Ack=1 Win=5792 Len=0 MSS=1460 SACK_PERM=1 TSval=1061579238 TSecr=408511792 WS=4
485756 159.983710 244.3.31.244 -> 244.3.139.251 TCP 70 https > 57502 [ACK] Seq=1 Ack=85 Win=5792 Len=0 TSval=1061579239 TSecr=408511792
485772 159.989930 244.3.31.244 -> 244.3.139.251 TCP 70 https > 57502 [ACK] Seq=1144 Ack=289 Win=6864 Len=0 TSval=1061579245 TSecr=408511792
485777 159.990701 244.3.31.244 -> 244.3.139.251 TCP 70 https > 57502 [ACK] Seq=1211 Ack=1185 Win=9136 Len=0 TSval=1061579246 TSecr=408511792
485796 159.994148 244.3.31.244 -> 244.3.139.251 TCP 70 https > 57502 [FIN, ACK] Seq=2364 Ack=1185 Win=9136 Len=0 TSval=1061579249 TSecr=408511792
485807 159.996691 244.3.31.244 -> 244.3.139.251 TCP 78 https > 57503 [SYN, ACK] Seq=0 Ack=1 Win=5792 Len=0 MSS=1460 SACK_PERM=1 TSval=1061579252 TSecr=408511792 WS=4
485810 159.997582 244.3.31.244 -> 244.3.139.251 TCP 70 https > 57503 [ACK] Seq=1 Ack=85 Win=5792 Len=0 TSval=1061579253 TSecr=408511792
485823 160.003851 244.3.31.244 -> 244.3.139.251 TCP 70 https > 57503 [ACK] Seq=1144 Ack=289 Win=6864 Len=0 TSval=1061579259 TSecr=408511792
485829 160.004823 244.3.31.244 -> 244.3.139.251 TCP 70 https > 57503 [ACK] Seq=1211 Ack=956 Win=9008 Len=0 TSval=1061579260 TSecr=408511792
485846 160.006815 244.3.31.244 -> 244.3.139.251 TCP 70 https > 57503 [FIN, ACK] Seq=1984 Ack=956 Win=9008 Len=0 TSval=1061579262 TSecr=408511792
485858 160.008722 244.3.31.244 -> 244.3.139.251 TCP 78 https > 57504 [SYN, ACK] Seq=0 Ack=1 Win=5792 Len=0 MSS=1460 SACK_PERM=1 TSval=1061579264 TSecr=408511792 WS=4
485865 160.009712 244.3.31.244 -> 244.3.139.251 TCP 70 https > 57504 [ACK] Seq=1 Ack=85 Win=5792 Len=0 TSval=1061579265 TSecr=408511792
485891 160.015911 244.3.31.244 -> 244.3.139.251 TCP 70 https > 57504 [ACK] Seq=1144 Ack=289 Win=6864 Len=0 TSval=1061579271 TSecr=408511792
485910 160.016723 244.3.31.244 -> 244.3.139.251 TCP 70 https > 57504 [ACK] Seq=1211 Ack=963 Win=9008 Len=0 TSval=1061579272 TSecr=408511792
485930 160.018729 244.3.31.244 -> 244.3.139.251 TCP 70 https > 57504 [FIN, ACK] Seq=2000 Ack=963 Win=9008 Len=0 TSval=1061579274 TSecr=408511792
485948 160.020552 244.3.31.244 -> 244.3.139.251 TCP 78 https > 57505 [SYN, ACK] Seq=0 Ack=1 Win=5792 Len=0 MSS=1460 SACK_PERM=1 TSval=1061579276 TSecr=408511793 WS=4
485962 160.021294 244.3.31.244 -> 244.3.139.251 TCP 70 https > 57505 [ACK] Seq=1 Ack=85 Win=5792 Len=0 TSval=1061579276 TSecr=408511793
486002 160.027559 244.3.31.244 -> 244.3.139.251 TCP 70 https > 57505 [ACK] Seq=1144 Ack=289 Win=6864 Len=0 TSval=1061579283 TSecr=408511793
486008 160.028385 244.3.31.244 -> 244.3.139.251 TCP 70 https > 57505 [ACK] Seq=1211 Ack=1009 Win=9192 Len=0 TSval=1061579283 TSecr=408511793
486026 160.031848 244.3.31.244 -> 244.3.139.251 TCP 70 https > 57505 [FIN, ACK] Seq=1963 Ack=1009 Win=9192 Len=0 TSval=1061579287 TSecr=408511793
486049 160.034802 244.3.31.244 -> 244.3.139.251 TCP 78 https > 57506 [SYN, ACK] Seq=0 Ack=1 Win=5792 Len=0 MSS=1460 SACK_PERM=1 TSval=1061579290 TSecr=408511793 WS=4
486055 160.035672 244.3.31.244 -> 244.3.139.251 TCP 70 https > 57506 [ACK] Seq=1 Ack=85 Win=5792 Len=0 TSval=1061579291 TSecr=408511793
486083 160.041918 244.3.31.244 -> 244.3.139.251 TCP 70 https > 57506 [ACK] Seq=1144 Ack=289 Win=6864 Len=0 TSval=1061579297 TSecr=408511793
486107 160.044298 244.3.31.244 -> 244.3.139.251 TCP 70 https > 57506 [FIN, ACK] Seq=2054 Ack=801 Win=7936 Len=0 TSval=1061579299 TSecr=408511793
486132 160.046010 244.3.31.244 -> 244.3.139.251 TCP 78 https > 57507 [SYN, ACK] Seq=0 Ack=1 Win=5792 Len=0 MSS=1460 SACK_PERM=1 TSval=1061579301 TSecr=408511793 WS=4
486136 160.047004 244.3.31.244 -> 244.3.139.251 TCP 70 https > 57507 [ACK] Seq=1 Ack=85 Win=5792 Len=0 TSval=1061579302 TSecr=408511793
486184 160.053529 244.3.31.244 -> 244.3.139.251 TCP 70 https > 57507 [ACK] Seq=1144 Ack=289 Win=6864 Len=0 TSval=1061579309 TSecr=408511793
486213 160.057644 244.3.31.244 -> 244.3.139.251 TCP 70 https > 57507 [FIN, ACK] Seq=1825 Ack=844 Win=7976 Len=0 TSval=1061579313 TSecr=408511793
486260 160.063132 244.3.31.244 -> 244.3.139.251 TCP 78 https > 57508 [SYN, ACK] Seq=0 Ack=1 Win=5792 Len=0 MSS=1460 SACK_PERM=1 TSval=1061579318 TSecr=408511793 WS=4
486263 160.063976 244.3.31.244 -> 244.3.139.251 TCP 70 https > 57508 [ACK] Seq=1 Ack=85 Win=5792 Len=0 TSval=1061579319 TSecr=408511793
486288 160.070278 244.3.31.244 -> 244.3.139.251 TCP 70 https > 57508 [ACK] Seq=1144 Ack=289 Win=6864 Len=0 TSval=1061579325 TSecr=408511793
486294 160.071165 244.3.31.244 -> 244.3.139.251 TCP 70 https > 57508 [ACK] Seq=1211 Ack=1185 Win=9136 Len=0 TSval=1061579326 TSecr=408511793
486324 160.074602 244.3.31.244 -> 244.3.139.251 TCP 70 https > 57508 [FIN, ACK] Seq=2364 Ack=1185 Win=9136 Len=0 TSval=1061579330 TSecr=408511793
486335 160.077112 244.3.31.244 -> 244.3.139.251 TCP 78 https > 57509 [SYN, ACK] Seq=0 Ack=1 Win=5792 Len=0 MSS=1460 SACK_PERM=1 TSval=1061579332 TSecr=408511793 WS=4
486338 160.077903 244.3.31.244 -> 244.3.139.251 TCP 70 https > 57509 [ACK] Seq=1 Ack=85 Win=5792 Len=0 TSval=1061579333 TSecr=408511793
486352 160.084089 244.3.31.244 -> 244.3.139.251 TCP 70 https > 57509 [ACK] Seq=1144 Ack=289 Win=6864 Len=0 TSval=1061579339 TSecr=408511793
486373 160.086533 244.3.31.244 -> 244.3.139.251 TCP 70 https > 57509 [FIN, ACK] Seq=2054 Ack=801 Win=7936 Len=0 TSval=1061579342 TSecr=408511793
486384 160.088092 244.3.31.244 -> 244.3.139.251 TCP 78 https > 57510 [SYN, ACK] Seq=0 Ack=1 Win=5792 Len=0 MSS=1460 SACK_PERM=1 TSval=1061579343 TSecr=408511793 WS=4
486388 160.088985 244.3.31.244 -> 244.3.139.251 TCP 70 https > 57510 [ACK] Seq=1 Ack=85 Win=5792 Len=0 TSval=1061579344 TSecr=408511793
486425 160.095177 244.3.31.244 -> 244.3.139.251 TCP 70 https > 57510 [ACK] Seq=1144 Ack=289 Win=6864 Len=0 TSval=1061579350 TSecr=408511793
486451 160.099476 244.3.31.244 -> 244.3.139.251 TCP 70 https > 57510 [FIN, ACK] Seq=1825 Ack=844 Win=7976 Len=0 TSval=1061579354 TSecr=408511793
486471 160.104917 244.3.31.244 -> 244.3.139.251 TCP 78 https > 57511 [SYN, ACK] Seq=0 Ack=1 Win=5792 Len=0 MSS=1460 SACK_PERM=1 TSval=1061579360 TSecr=408511793 WS=4
486481 160.105908 244.3.31.244 -> 244.3.139.251 TCP 70 https > 57511 [ACK] Seq=1 Ack=85 Win=5792 Len=0 TSval=1061579361 TSecr=408511793
486500 160.112183 244.3.31.244 -> 244.3.139.251 TCP 70 https > 57511 [ACK] Seq=1144 Ack=289 Win=6864 Len=0 TSval=1061579367 TSecr=408511793
486542 160.114687 244.3.31.244 -> 244.3.139.251 TCP 70 https > 57511 [FIN, ACK] Seq=2054 Ack=801 Win=7936 Len=0 TSval=1061579370 TSecr=408511793
486558 160.116297 244.3.31.244 -> 244.3.139.251 TCP 78 https > 57512 [SYN, ACK] Seq=0 Ack=1 Win=5792 Len=0 MSS=1460 SACK_PERM=1 TSval=1061579371 TSecr=408511793 WS=4
486565 160.117139 244.3.31.244 -> 244.3.139.251 TCP 70 https > 57512 [ACK] Seq=1 Ack=85 Win=5792 Len=0 TSval=1061579372 TSecr=408511793
486598 160.123356 244.3.31.244 -> 244.3.139.251 TCP 70 https > 57512 [ACK] Seq=1144 Ack=289 Win=6864 Len=0 TSval=1061579378 TSecr=408511793
486620 160.127431 244.3.31.244 -> 244.3.139.251 TCP 70 https > 57512 [FIN, ACK] Seq=1825 Ack=844 Win=7976 Len=0 TSval=1061579382 TSecr=408511794
486656 160.132473 244.3.31.244 -> 244.3.139.251 TCP 78 https > 57513 [SYN, ACK] Seq=0 Ack=1 Win=5792 Len=0 MSS=1460 SACK_PERM=1 TSval=1061579387 TSecr=408511794 WS=4
486666 160.133264 244.3.31.244 -> 244.3.139.251 TCP 70 https > 57513 [ACK] Seq=1 Ack=85 Win=5792 Len=0 TSval=1061579388 TSecr=408511794
486698 160.139466 244.3.31.244 -> 244.3.139.251 TCP 70 https > 57513 [ACK] Seq=1144 Ack=289 Win=6864 Len=0 TSval=1061579394 TSecr=408511794
486715 160.142028 244.3.31.244 -> 244.3.139.251 TCP 70 https > 57513 [FIN, ACK] Seq=2054 Ack=801 Win=7936 Len=0 TSval=1061579397 TSecr=408511794
486722 160.143754 244.3.31.244 -> 244.3.139.251 TCP 78 https > 57514 [SYN, ACK] Seq=0 Ack=1 Win=5792 Len=0 MSS=1460 SACK_PERM=1 TSval=1061579399 TSecr=408511794 WS=4
486729 160.144701 244.3.31.244 -> 244.3.139.251 TCP 70 https > 57514 [ACK] Seq=1 Ack=85 Win=5792 Len=0 TSval=1061579400 TSecr=408511794
486764 160.150901 244.3.31.244 -> 244.3.139.251 TCP 70 https > 57514 [ACK] Seq=1144 Ack=289 Win=6864 Len=0 TSval=1061579406 TSecr=408511794
486798 160.154932 244.3.31.244 -> 244.3.139.251 TCP 70 https > 57514 [FIN, ACK] Seq=1825 Ack=844 Win=7976 Len=0 TSval=1061579410 TSecr=408511794
486835 160.159430 244.3.31.244 -> 244.3.139.251 TCP 78 https > 57515 [SYN, ACK] Seq=0 Ack=1 Win=5792 Len=0 MSS=1460 SACK_PERM=1 TSval=1061579414 TSecr=408511794 WS=4
486840 160.160322 244.3.31.244 -> 244.3.139.251 TCP 70 https > 57515 [ACK] Seq=1 Ack=85 Win=5792 Len=0 TSval=1061579415 TSecr=408511794
486864 160.166572 244.3.31.244 -> 244.3.139.251 TCP 70 https > 57515 [ACK] Seq=1144 Ack=289 Win=6864 Len=0 TSval=1061579422 TSecr=408511794
486879 160.169183 244.3.31.244 -> 244.3.139.251 TCP 70 https > 57515 [FIN, ACK] Seq=2054 Ack=801 Win=7936 Len=0 TSval=1061579424 TSecr=408511794
486893 160.170958 244.3.31.244 -> 244.3.139.251 TCP 78 https > 57516 [SYN, ACK] Seq=0 Ack=1 Win=5792 Len=0 MSS=1460 SACK_PERM=1 TSval=1061579426 TSecr=408511794 WS=4
486898 160.171751 244.3.31.244 -> 244.3.139.251 TCP 70 https > 57516 [ACK] Seq=1 Ack=85 Win=5792 Len=0 TSval=1061579427 TSecr=408511794
486953 160.178222 244.3.31.244 -> 244.3.139.251 TCP 70 https > 57516 [ACK] Seq=1144 Ack=289 Win=6864 Len=0 TSval=1061579433 TSecr=408511794
486974 160.182398 244.3.31.244 -> 244.3.139.251 TCP 70 https > 57516 [FIN, ACK] Seq=1825 Ack=844 Win=7976 Len=0 TSval=1061579437 TSecr=408511794
487042 160.208551 244.3.31.244 -> 244.3.139.251 TCP 78 https > 57517 [SYN, ACK] Seq=0 Ack=1 Win=5792 Len=0 MSS=1460 SACK_PERM=1 TSval=1061579464 TSecr=408511794 WS=4
487045 160.209592 244.3.31.244 -> 244.3.139.251 TCP 70 https > 57517 [ACK] Seq=1 Ack=85 Win=5792 Len=0 TSval=1061579465 TSecr=408511794
487062 160.215845 244.3.31.244 -> 244.3.139.251 TCP 70 https > 57517 [ACK] Seq=1144 Ack=289 Win=6864 Len=0 TSval=1061579471 TSecr=408511794
487067 160.216731 244.3.31.244 -> 244.3.139.251 TCP 70 https > 57517 [ACK] Seq=1211 Ack=1024 Win=9276 Len=0 TSval=1061579472 TSecr=408511794
487102 160.222680 244.3.31.244 -> 244.3.139.251 TCP 78 https > 57518 [SYN, ACK] Seq=0 Ack=1 Win=5792 Len=0 MSS=1460 SACK_PERM=1 TSval=1061579478 TSecr=408511795 WS=4
487105 160.223420 244.3.31.244 -> 244.3.139.251 TCP 70 https > 57518 [ACK] Seq=1 Ack=85 Win=5792 Len=0 TSval=1061579478 TSecr=408511795
487117 160.229608 244.3.31.244 -> 244.3.139.251 TCP 70 https > 57518 [ACK] Seq=1144 Ack=289 Win=6864 Len=0 TSval=1061579485 TSecr=408511795
487124 160.230559 244.3.31.244 -> 244.3.139.251 TCP 70 https > 57518 [ACK] Seq=1211 Ack=1185 Win=9136 Len=0 TSval=1061579486 TSecr=408511795
487146 160.234065 244.3.31.244 -> 244.3.139.251 TCP 70 https > 57518 [FIN, ACK] Seq=2364 Ack=1185 Win=9136 Len=0 TSval=1061579489 TSecr=408511795
487165 160.237602 244.3.31.244 -> 244.3.139.251 TCP 78 https > 57519 [SYN, ACK] Seq=0 Ack=1 Win=5792 Len=0 MSS=1460 SACK_PERM=1 TSval=1061579493 TSecr=408511795 WS=4
487168 160.238744 244.3.31.244 -> 244.3.139.251 TCP 70 https > 57519 [ACK] Seq=1 Ack=85 Win=5792 Len=0 TSval=1061579494 TSecr=408511795
487224 160.244938 244.3.31.244 -> 244.3.139.251 TCP 70 https > 57519 [ACK] Seq=1144 Ack=289 Win=6864 Len=0 TSval=1061579500 TSecr=408511795
487246 160.245698 244.3.31.244 -> 244.3.139.251 TCP 70 https > 57519 [ACK] Seq=1211 Ack=1277 Win=9128 Len=0 TSval=1061579501 TSecr=408511795
487458 160.270254 244.3.31.244 -> 244.3.139.251 TCP 78 https > 57520 [SYN, ACK] Seq=0 Ack=1 Win=5792 Len=0 MSS=1460 SACK_PERM=1 TSval=1061579525 TSecr=408511795 WS=4
487465 160.271146 244.3.31.244 -> 244.3.139.251 TCP 70 https > 57520 [ACK] Seq=1 Ack=85 Win=5792 Len=0 TSval=1061579526 TSecr=408511795
487526 160.277372 244.3.31.244 -> 244.3.139.251 TCP 70 https > 57520 [ACK] Seq=1144 Ack=289 Win=6864 Len=0 TSval=1061579532 TSecr=408511795
487549 160.280013 244.3.31.244 -> 244.3.139.251 TCP 70 https > 57520 [FIN, ACK] Seq=2054 Ack=805 Win=7936 Len=0 TSval=1061579535 TSecr=408511795
487570 160.281886 244.3.31.244 -> 244.3.139.251 TCP 78 https > 57521 [SYN, ACK] Seq=0 Ack=1 Win=5792 Len=0 MSS=1460 SACK_PERM=1 TSval=1061579537 TSecr=408511795 WS=4
487576 160.282873 244.3.31.244 -> 244.3.139.251 TCP 70 https > 57521 [ACK] Seq=1 Ack=85 Win=5792 Len=0 TSval=1061579538 TSecr=408511795
487607 160.289124 244.3.31.244 -> 244.3.139.251 TCP 70 https > 57521 [ACK] Seq=1144 Ack=289 Win=6864 Len=0 TSval=1061579544 TSecr=408511795
487632 160.293271 244.3.31.244 -> 244.3.139.251 TCP 70 https > 57521 [FIN, ACK] Seq=1825 Ack=848 Win=7984 Len=0 TSval=1061579548 TSecr=408511795
487664 160.298456 244.3.31.244 -> 244.3.139.251 TCP 78 https > 57522 [SYN, ACK] Seq=0 Ack=1 Win=5792 Len=0 MSS=1460 SACK_PERM=1 TSval=1061579553 TSecr=408511795 WS=4
487668 160.299498 244.3.31.244 -> 244.3.139.251 TCP 70 https > 57522 [ACK] Seq=1 Ack=85 Win=5792 Len=0 TSval=1061579554 TSecr=408511795
487699 160.305697 244.3.31.244 -> 244.3.139.251 TCP 70 https > 57522 [ACK] Seq=1144 Ack=289 Win=6864 Len=0 TSval=1061579561 TSecr=408511795
487707 160.306658 244.3.31.244 -> 244.3.139.251 TCP 70 https > 57522 [ACK] Seq=1211 Ack=1189 Win=9152 Len=0 TSval=1061579562 TSecr=408511795
487732 160.310063 244.3.31.244 -> 244.3.139.251 TCP 70 https > 57522 [FIN, ACK] Seq=2372 Ack=1189 Win=9152 Len=0 TSval=1061579565 TSecr=408511795
487745 160.312584 244.3.31.244 -> 244.3.139.251 TCP 78 https > 57523 [SYN, ACK] Seq=0 Ack=1 Win=5792 Len=0 MSS=1460 SACK_PERM=1 TSval=1061579568 TSecr=408511795 WS=4
487749 160.313375 244.3.31.244 -> 244.3.139.251 TCP 70 https > 57523 [ACK] Seq=1 Ack=85 Win=5792 Len=0 TSval=1061579568 TSecr=408511795
487770 160.319595 244.3.31.244 -> 244.3.139.251 TCP 70 https > 57523 [ACK] Seq=1144 Ack=289 Win=6864 Len=0 TSval=1061579575 TSecr=408511795
487787 160.322019 244.3.31.244 -> 244.3.139.251 TCP 70 https > 57523 [FIN, ACK] Seq=2054 Ack=805 Win=7936 Len=0 TSval=1061579577 TSecr=408511796
487800 160.323772 244.3.31.244 -> 244.3.139.251 TCP 78 https > 57524 [SYN, ACK] Seq=0 Ack=1 Win=5792 Len=0 MSS=1460 SACK_PERM=1 TSval=1061579579 TSecr=408511796 WS=4
487808 160.324707 244.3.31.244 -> 244.3.139.251 TCP 70 https > 57524 [ACK] Seq=1 Ack=85 Win=5792 Len=0 TSval=1061579580 TSecr=408511796
487835 160.330995 244.3.31.244 -> 244.3.139.251 TCP 70 https > 57524 [ACK] Seq=1144 Ack=289 Win=6864 Len=0 TSval=1061579586 TSecr=408511796
487863 160.335199 244.3.31.244 -> 244.3.139.251 TCP 70 https > 57524 [FIN, ACK] Seq=1825 Ack=848 Win=7984 Len=0 TSval=1061579590 TSecr=408511796
487875 160.340486 244.3.31.244 -> 244.3.139.251 TCP 78 https > 57525 [SYN, ACK] Seq=0 Ack=1 Win=5792 Len=0 MSS=1460 SACK_PERM=1 TSval=1061579595 TSecr=408511796 WS=4
487878 160.341530 244.3.31.244 -> 244.3.139.251 TCP 70 https > 57525 [ACK] Seq=1 Ack=85 Win=5792 Len=0 TSval=1061579597 TSecr=408511796
487893 160.347744 244.3.31.244 -> 244.3.139.251 TCP 70 https > 57525 [ACK] Seq=1144 Ack=289 Win=6864 Len=0 TSval=1061579603 TSecr=408511796
487899 160.348467 244.3.31.244 -> 244.3.139.251 TCP 70 https > 57525 [ACK] Seq=1211 Ack=1189 Win=9152 Len=0 TSval=1061579603 TSecr=408511796
487918 160.351870 244.3.31.244 -> 244.3.139.251 TCP 70 https > 57525 [FIN, ACK] Seq=2372 Ack=1189 Win=9152 Len=0 TSval=1061579607 TSecr=408511796
487935 160.354265 244.3.31.244 -> 244.3.139.251 TCP 78 https > 57526 [SYN, ACK] Seq=0 Ack=1 Win=5792 Len=0 MSS=1460 SACK_PERM=1 TSval=1061579609 TSecr=408511796 WS=4
487938 160.355257 244.3.31.244 -> 244.3.139.251 TCP 70 https > 57526 [ACK] Seq=1 Ack=85 Win=5792 Len=0 TSval=1061579610 TSecr=408511796
487950 160.361497 244.3.31.244 -> 244.3.139.251 TCP 70 https > 57526 [ACK] Seq=1144 Ack=289 Win=6864 Len=0 TSval=1061579616 TSecr=408511796
487956 160.362648 244.3.31.244 -> 244.3.139.251 TCP 70 https > 57526 [ACK] Seq=1211 Ack=956 Win=9008 Len=0 TSval=1061579618 TSecr=408511796
487977 160.364576 244.3.31.244 -> 244.3.139.251 TCP 70 https > 57526 [FIN, ACK] Seq=1984 Ack=956 Win=9008 Len=0 TSval=1061579620 TSecr=408511796
487986 160.366595 244.3.31.244 -> 244.3.139.251 TCP 78 https > 57527 [SYN, ACK] Seq=0 Ack=1 Win=5792 Len=0 MSS=1460 SACK_PERM=1 TSval=1061579622 TSecr=408511796 WS=4
487989 160.367586 244.3.31.244 -> 244.3.139.251 TCP 70 https > 57527 [ACK] Seq=1 Ack=85 Win=5792 Len=0 TSval=1061579623 TSecr=408511796
487997 160.373759 244.3.31.244 -> 244.3.139.251 TCP 70 https > 57527 [ACK] Seq=1144 Ack=289 Win=6864 Len=0 TSval=1061579629 TSecr=408511796
488002 160.374479 244.3.31.244 -> 244.3.139.251 TCP 70 https > 57527 [ACK] Seq=1211 Ack=963 Win=9008 Len=0 TSval=1061579629 TSecr=408511796
488014 160.376469 244.3.31.244 -> 244.3.139.251 TCP 70 https > 57527 [FIN, ACK] Seq=2000 Ack=963 Win=9008 Len=0 TSval=1061579631 TSecr=408511796
488021 160.378677 244.3.31.244 -> 244.3.139.251 TCP 78 https > 57528 [SYN, ACK] Seq=0 Ack=1 Win=5792 Len=0 MSS=1460 SACK_PERM=1 TSval=1061579634 TSecr=408511796 WS=4
488024 160.379518 244.3.31.244 -> 244.3.139.251 TCP 70 https > 57528 [ACK] Seq=1 Ack=85 Win=5792 Len=0 TSval=1061579635 TSecr=408511796
488035 160.385710 244.3.31.244 -> 244.3.139.251 TCP 70 https > 57528 [ACK] Seq=1144 Ack=289 Win=6864 Len=0 TSval=1061579641 TSecr=408511796
488040 160.386558 244.3.31.244 -> 244.3.139.251 TCP 70 https > 57528 [ACK] Seq=1211 Ack=1013 Win=9208 Len=0 TSval=1061579642 TSecr=408511796
488057 160.389929 244.3.31.244 -> 244.3.139.251 TCP 70 https > 57528 [FIN, ACK] Seq=1967 Ack=1013 Win=9208 Len=0 TSval=1061579645 TSecr=408511796
488067 160.392704 244.3.31.244 -> 244.3.139.251 TCP 78 https > 57529 [SYN, ACK] Seq=0 Ack=1 Win=5792 Len=0 MSS=1460 SACK_PERM=1 TSval=1061579648 TSecr=408511796 WS=4
488071 160.393544 244.3.31.244 -> 244.3.139.251 TCP 70 https > 57529 [ACK] Seq=1 Ack=85 Win=5792 Len=0 TSval=1061579649 TSecr=408511796
488096 160.399832 244.3.31.244 -> 244.3.139.251 TCP 70 https > 57529 [ACK] Seq=1144 Ack=289 Win=6864 Len=0 TSval=1061579655 TSecr=408511796
488110 160.402409 244.3.31.244 -> 244.3.139.251 TCP 70 https > 57529 [FIN, ACK] Seq=2054 Ack=805 Win=7936 Len=0 TSval=1061579657 TSecr=408511796
488119 160.404239 244.3.31.244 -> 244.3.139.251 TCP 78 https > 57530 [SYN, ACK] Seq=0 Ack=1 Win=5792 Len=0 MSS=1460 SACK_PERM=1 TSval=1061579659 TSecr=408511796 WS=4
488127 160.405077 244.3.31.244 -> 244.3.139.251 TCP 70 https > 57530 [ACK] Seq=1 Ack=85 Win=5792 Len=0 TSval=1061579660 TSecr=408511796
488162 160.411264 244.3.31.244 -> 244.3.139.251 TCP 70 https > 57530 [ACK] Seq=1144 Ack=289 Win=6864 Len=0 TSval=1061579666 TSecr=408511796
488186 160.415564 244.3.31.244 -> 244.3.139.251 TCP 70 https > 57530 [FIN, ACK] Seq=1825 Ack=848 Win=7984 Len=0 TSval=1061579671 TSecr=408511796
488195 160.420910 244.3.31.244 -> 244.3.139.251 TCP 78 https > 57531 [SYN, ACK] Seq=0 Ack=1 Win=5792 Len=0 MSS=1460 SACK_PERM=1 TSval=1061579676 TSecr=408511797 WS=4
488198 160.422000 244.3.31.244 -> 244.3.139.251 TCP 70 https > 57531 [ACK] Seq=1 Ack=85 Win=5792 Len=0 TSval=1061579677 TSecr=408511797
488226 160.428213 244.3.31.244 -> 244.3.139.251 TCP 70 https > 57531 [ACK] Seq=1144 Ack=289 Win=6864 Len=0 TSval=1061579683 TSecr=408511797
488231 160.428892 244.3.31.244 -> 244.3.139.251 TCP 70 https > 57531 [ACK] Seq=1211 Ack=1189 Win=9152 Len=0 TSval=1061579684 TSecr=408511797
488251 160.432330 244.3.31.244 -> 244.3.139.251 TCP 70 https > 57531 [FIN, ACK] Seq=2372 Ack=1189 Win=9152 Len=0 TSval=1061579687 TSecr=408511797
488260 160.435005 244.3.31.244 -> 244.3.139.251 TCP 78 https > 57532 [SYN, ACK] Seq=0 Ack=1 Win=5792 Len=0 MSS=1460 SACK_PERM=1 TSval=1061579690 TSecr=408511797 WS=4
488268 160.435977 244.3.31.244 -> 244.3.139.251 TCP 70 https > 57532 [ACK] Seq=1 Ack=85 Win=5792 Len=0 TSval=1061579691 TSecr=408511797
488281 160.442234 244.3.31.244 -> 244.3.139.251 TCP 70 https > 57532 [ACK] Seq=1144 Ack=289 Win=6864 Len=0 TSval=1061579697 TSecr=408511797
488297 160.444690 244.3.31.244 -> 244.3.139.251 TCP 70 https > 57532 [FIN, ACK] Seq=2054 Ack=805 Win=7936 Len=0 TSval=1061579700 TSecr=408511797
488311 160.446466 244.3.31.244 -> 244.3.139.251 TCP 78 https > 57533 [SYN, ACK] Seq=0 Ack=1 Win=5792 Len=0 MSS=1460 SACK_PERM=1 TSval=1061579701 TSecr=408511797 WS=4
488318 160.447308 244.3.31.244 -> 244.3.139.251 TCP 70 https > 57533 [ACK] Seq=1 Ack=85 Win=5792 Len=0 TSval=1061579702 TSecr=408511797
488337 160.453514 244.3.31.244 -> 244.3.139.251 TCP 70 https > 57533 [ACK] Seq=1144 Ack=289 Win=6864 Len=0 TSval=1061579709 TSecr=408511797
488362 160.457642 244.3.31.244 -> 244.3.139.251 TCP 70 https > 57533 [FIN, ACK] Seq=1825 Ack=848 Win=7984 Len=0 TSval=1061579713 TSecr=408511797
488381 160.463239 244.3.31.244 -> 244.3.139.251 TCP 78 https > 57534 [SYN, ACK] Seq=0 Ack=1 Win=5792 Len=0 MSS=1460 SACK_PERM=1 TSval=1061579718 TSecr=408511797 WS=4
488390 160.464182 244.3.31.244 -> 244.3.139.251 TCP 70 https > 57534 [ACK] Seq=1 Ack=85 Win=5792 Len=0 TSval=1061579719 TSecr=408511797
488405 160.470394 244.3.31.244 -> 244.3.139.251 TCP 70 https > 57534 [ACK] Seq=1144 Ack=289 Win=6864 Len=0 TSval=1061579725 TSecr=408511797
488432 160.472996 244.3.31.244 -> 244.3.139.251 TCP 70 https > 57534 [FIN, ACK] Seq=2054 Ack=805 Win=7936 Len=0 TSval=1061579728 TSecr=408511797
488443 160.474871 244.3.31.244 -> 244.3.139.251 TCP 78 https > 57535 [SYN, ACK] Seq=0 Ack=1 Win=5792 Len=0 MSS=1460 SACK_PERM=1 TSval=1061579730 TSecr=408511797 WS=4
488451 160.475763 244.3.31.244 -> 244.3.139.251 TCP 70 https > 57535 [ACK] Seq=1 Ack=85 Win=5792 Len=0 TSval=1061579731 TSecr=408511797
488472 160.481970 244.3.31.244 -> 244.3.139.251 TCP 70 https > 57535 [ACK] Seq=1144 Ack=289 Win=6864 Len=0 TSval=1061579737 TSecr=408511797
488493 160.486045 244.3.31.244 -> 244.3.139.251 TCP 70 https > 57535 [FIN, ACK] Seq=1825 Ack=848 Win=7984 Len=0 TSval=1061579741 TSecr=408511797
488505 160.491195 244.3.31.244 -> 244.3.139.251 TCP 78 https > 57536 [SYN, ACK] Seq=0 Ack=1 Win=5792 Len=0 MSS=1460 SACK_PERM=1 TSval=1061579746 TSecr=408511797 WS=4
488508 160.492037 244.3.31.244 -> 244.3.139.251 TCP 70 https > 57536 [ACK] Seq=1 Ack=85 Win=5792 Len=0 TSval=1061579747 TSecr=408511797
488517 160.498200 244.3.31.244 -> 244.3.139.251 TCP 70 https > 57536 [ACK] Seq=1144 Ack=289 Win=6864 Len=0 TSval=1061579753 TSecr=408511797
488531 160.500850 244.3.31.244 -> 244.3.139.251 TCP 70 https > 57536 [FIN, ACK] Seq=2054 Ack=805 Win=7936 Len=0 TSval=1061579756 TSecr=408511797
488551 160.502425 244.3.31.244 -> 244.3.139.251 TCP 78 https > 57537 [SYN, ACK] Seq=0 Ack=1 Win=5792 Len=0 MSS=1460 SACK_PERM=1 TSval=1061579757 TSecr=408511797 WS=4
488555 160.503418 244.3.31.244 -> 244.3.139.251 TCP 70 https > 57537 [ACK] Seq=1 Ack=85 Win=5792 Len=0 TSval=1061579758 TSecr=408511797
488613 160.509597 244.3.31.244 -> 244.3.139.251 TCP 70 https > 57537 [ACK] Seq=1144 Ack=289 Win=6864 Len=0 TSval=1061579765 TSecr=408511797
488632 160.513706 244.3.31.244 -> 244.3.139.251 TCP 70 https > 57537 [FIN, ACK] Seq=1825 Ack=848 Win=7984 Len=0 TSval=1061579769 TSecr=408511797
488642 160.518950 244.3.31.244 -> 244.3.139.251 TCP 78 https > 57538 [SYN, ACK] Seq=0 Ack=1 Win=5792 Len=0 MSS=1460 SACK_PERM=1 TSval=1061579774 TSecr=408511797 WS=4
488645 160.519994 244.3.31.244 -> 244.3.139.251 TCP 70 https > 57538 [ACK] Seq=1 Ack=85 Win=5792 Len=0 TSval=1061579775 TSecr=408511798
488667 160.526250 244.3.31.244 -> 244.3.139.251 TCP 70 https > 57538 [ACK] Seq=1144 Ack=289 Win=6864 Len=0 TSval=1061579781 TSecr=408511798
488681 160.528851 244.3.31.244 -> 244.3.139.251 TCP 70 https > 57538 [FIN, ACK] Seq=2054 Ack=805 Win=7936 Len=0 TSval=1061579784 TSecr=408511798
488692 160.530830 244.3.31.244 -> 244.3.139.251 TCP 78 https > 57539 [SYN, ACK] Seq=0 Ack=1 Win=5792 Len=0 MSS=1460 SACK_PERM=1 TSval=1061579786 TSecr=408511798 WS=4
488695 160.531624 244.3.31.244 -> 244.3.139.251 TCP 70 https > 57539 [ACK] Seq=1 Ack=85 Win=5792 Len=0 TSval=1061579787 TSecr=408511798
488706 160.537859 244.3.31.244 -> 244.3.139.251 TCP 70 https > 57539 [ACK] Seq=1144 Ack=289 Win=6864 Len=0 TSval=1061579793 TSecr=408511798
488741 160.542078 244.3.31.244 -> 244.3.139.251 TCP 70 https > 57539 [FIN, ACK] Seq=1825 Ack=848 Win=7984 Len=0 TSval=1061579797 TSecr=408511798
488760 160.547308 244.3.31.244 -> 244.3.139.251 TCP 78 https > 57540 [SYN, ACK] Seq=0 Ack=1 Win=5792 Len=0 MSS=1460 SACK_PERM=1 TSval=1061579802 TSecr=408511798 WS=4
488763 160.548347 244.3.31.244 -> 244.3.139.251 TCP 70 https > 57540 [ACK] Seq=1 Ack=85 Win=5792 Len=0 TSval=1061579803 TSecr=408511798
488772 160.554581 244.3.31.244 -> 244.3.139.251 TCP 70 https > 57540 [ACK] Seq=1144 Ack=289 Win=6864 Len=0 TSval=1061579810 TSecr=408511798
488777 160.555487 244.3.31.244 -> 244.3.139.251 TCP 70 https > 57540 [ACK] Seq=1211 Ack=1028 Win=9292 Len=0 TSval=1061579810 TSecr=408511798
488799 160.561182 244.3.31.244 -> 244.3.139.251 TCP 78 https > 57541 [SYN, ACK] Seq=0 Ack=1 Win=5792 Len=0 MSS=1460 SACK_PERM=1 TSval=1061579816 TSecr=408511798 WS=4
488802 160.562026 244.3.31.244 -> 244.3.139.251 TCP 70 https > 57541 [ACK] Seq=1 Ack=85 Win=5792 Len=0 TSval=1061579817 TSecr=408511798
488808 160.568273 244.3.31.244 -> 244.3.139.251 TCP 70 https > 57541 [ACK] Seq=1144 Ack=289 Win=6864 Len=0 TSval=1061579823 TSecr=408511798
488813 160.569165 244.3.31.244 -> 244.3.139.251 TCP 70 https > 57541 [ACK] Seq=1211 Ack=1189 Win=9152 Len=0 TSval=1061579824 TSecr=408511798
488830 160.572586 244.3.31.244 -> 244.3.139.251 TCP 70 https > 57541 [FIN, ACK] Seq=2372 Ack=1189 Win=9152 Len=0 TSval=1061579828 TSecr=408511798
488840 160.575060 244.3.31.244 -> 244.3.139.251 TCP 78 https > 57542 [SYN, ACK] Seq=0 Ack=1 Win=5792 Len=0 MSS=1460 SACK_PERM=1 TSval=1061579830 TSecr=408511798 WS=4
488843 160.575953 244.3.31.244 -> 244.3.139.251 TCP 70 https > 57542 [ACK] Seq=1 Ack=85 Win=5792 Len=0 TSval=1061579831 TSecr=408511798
488853 160.582159 244.3.31.244 -> 244.3.139.251 TCP 70 https > 57542 [ACK] Seq=1144 Ack=289 Win=6864 Len=0 TSval=1061579837 TSecr=408511798
488860 160.582994 244.3.31.244 -> 244.3.139.251 TCP 70 https > 57542 [ACK] Seq=1211 Ack=1264 Win=9128 Len=0 TSval=1061579838 TSecr=408511798
696386 220.649976 244.3.31.244 -> 244.3.139.251 TCP 78 https > 57545 [SYN, ACK] Seq=0 Ack=1 Win=5792 Len=0 MSS=1460 SACK_PERM=1 TSval=1061639905 TSecr=408512398 WS=4
696389 220.651062 244.3.31.244 -> 244.3.139.251 TCP 70 https > 57545 [ACK] Seq=1 Ack=85 Win=5792 Len=0 TSval=1061639906 TSecr=408512398
696395 220.657672 244.3.31.244 -> 244.3.139.251 TCP 70 https > 57545 [ACK] Seq=1144 Ack=289 Win=6864 Len=0 TSval=1061639913 TSecr=408512398
696415 220.660345 244.3.31.244 -> 244.3.139.251 TCP 70 https > 57545 [FIN, ACK] Seq=2054 Ack=807 Win=7936 Len=0 TSval=1061639915 TSecr=408512398
696428 220.662248 244.3.31.244 -> 244.3.139.251 TCP 78 https > 57546 [SYN, ACK] Seq=0 Ack=1 Win=5792 Len=0 MSS=1460 SACK_PERM=1 TSval=1061639917 TSecr=408512398 WS=4
696433 220.663092 244.3.31.244 -> 244.3.139.251 TCP 70 https > 57546 [ACK] Seq=1 Ack=85 Win=5792 Len=0 TSval=1061639918 TSecr=408512398
696453 220.669360 244.3.31.244 -> 244.3.139.251 TCP 70 https > 57546 [ACK] Seq=1144 Ack=289 Win=6864 Len=0 TSval=1061639924 TSecr=408512398
696473 220.673770 244.3.31.244 -> 244.3.139.251 TCP 70 https > 57546 [FIN, ACK] Seq=1825 Ack=850 Win=7988 Len=0 TSval=1061639929 TSecr=408512398
696497 220.678723 244.3.31.244 -> 244.3.139.251 TCP 78 https > 57547 [SYN, ACK] Seq=0 Ack=1 Win=5792 Len=0 MSS=1460 SACK_PERM=1 TSval=1061639934 TSecr=408512398 WS=4
696501 220.679765 244.3.31.244 -> 244.3.139.251 TCP 70 https > 57547 [ACK] Seq=1 Ack=85 Win=5792 Len=0 TSval=1061639935 TSecr=408512398
696508 220.685934 244.3.31.244 -> 244.3.139.251 TCP 70 https > 57547 [ACK] Seq=1144 Ack=289 Win=6864 Len=0 TSval=1061639941 TSecr=408512398
696513 220.686802 244.3.31.244 -> 244.3.139.251 TCP 70 https > 57547 [ACK] Seq=1211 Ack=1191 Win=9160 Len=0 TSval=1061639942 TSecr=408512399
696525 220.690264 244.3.31.244 -> 244.3.139.251 TCP 70 https > 57547 [FIN, ACK] Seq=2376 Ack=1191 Win=9160 Len=0 TSval=1061639945 TSecr=408512399
696533 220.692852 244.3.31.244 -> 244.3.139.251 TCP 78 https > 57548 [SYN, ACK] Seq=0 Ack=1 Win=5792 Len=0 MSS=1460 SACK_PERM=1 TSval=1061639948 TSecr=408512399 WS=4
696536 220.693642 244.3.31.244 -> 244.3.139.251 TCP 70 https > 57548 [ACK] Seq=1 Ack=85 Win=5792 Len=0 TSval=1061639949 TSecr=408512399
696544 220.699879 244.3.31.244 -> 244.3.139.251 TCP 70 https > 57548 [ACK] Seq=1144 Ack=289 Win=6864 Len=0 TSval=1061639955 TSecr=408512399
696561 220.702470 244.3.31.244 -> 244.3.139.251 TCP 70 https > 57548 [FIN, ACK] Seq=2054 Ack=807 Win=7936 Len=0 TSval=1061639957 TSecr=408512399
696571 220.704280 244.3.31.244 -> 244.3.139.251 TCP 78 https > 57549 [SYN, ACK] Seq=0 Ack=1 Win=5792 Len=0 MSS=1460 SACK_PERM=1 TSval=1061639959 TSecr=408512399 WS=4
696574 220.705271 244.3.31.244 -> 244.3.139.251 TCP 70 https > 57549 [ACK] Seq=1 Ack=85 Win=5792 Len=0 TSval=1061639960 TSecr=408512399
696586 220.711563 244.3.31.244 -> 244.3.139.251 TCP 70 https > 57549 [ACK] Seq=1144 Ack=289 Win=6864 Len=0 TSval=1061639966 TSecr=408512399
696612 220.716172 244.3.31.244 -> 244.3.139.251 TCP 70 https > 57549 [FIN, ACK] Seq=1825 Ack=850 Win=7988 Len=0 TSval=1061639971 TSecr=408512399
696620 220.720654 244.3.31.244 -> 244.3.139.251 TCP 78 https > 57550 [SYN, ACK] Seq=0 Ack=1 Win=5792 Len=0 MSS=1460 SACK_PERM=1 TSval=1061639976 TSecr=408512399 WS=4
696623 220.721646 244.3.31.244 -> 244.3.139.251 TCP 70 https > 57550 [ACK] Seq=1 Ack=85 Win=5792 Len=0 TSval=1061639977 TSecr=408512399
696629 220.728012 244.3.31.244 -> 244.3.139.251 TCP 70 https > 57550 [ACK] Seq=1144 Ack=289 Win=6864 Len=0 TSval=1061639983 TSecr=408512399
696634 220.728739 244.3.31.244 -> 244.3.139.251 TCP 70 https > 57550 [ACK] Seq=1211 Ack=1191 Win=9160 Len=0 TSval=1061639984 TSecr=408512399
696650 220.732143 244.3.31.244 -> 244.3.139.251 TCP 70 https > 57550 [FIN, ACK] Seq=2376 Ack=1191 Win=9160 Len=0 TSval=1061639987 TSecr=408512399
696661 220.734583 244.3.31.244 -> 244.3.139.251 TCP 78 https > 57551 [SYN, ACK] Seq=0 Ack=1 Win=5792 Len=0 MSS=1460 SACK_PERM=1 TSval=1061639989 TSecr=408512399 WS=4
696667 220.735426 244.3.31.244 -> 244.3.139.251 TCP 70 https > 57551 [ACK] Seq=1 Ack=85 Win=5792 Len=0 TSval=1061639990 TSecr=408512399
696692 220.741705 244.3.31.244 -> 244.3.139.251 TCP 70 https > 57551 [ACK] Seq=1144 Ack=289 Win=6864 Len=0 TSval=1061639997 TSecr=408512399
696697 220.742564 244.3.31.244 -> 244.3.139.251 TCP 70 https > 57551 [ACK] Seq=1211 Ack=956 Win=9008 Len=0 TSval=1061639997 TSecr=408512399
696712 220.744555 244.3.31.244 -> 244.3.139.251 TCP 70 https > 57551 [FIN, ACK] Seq=1984 Ack=956 Win=9008 Len=0 TSval=1061639999 TSecr=408512399
696719 220.747360 244.3.31.244 -> 244.3.139.251 TCP 78 https > 57552 [SYN, ACK] Seq=0 Ack=1 Win=5792 Len=0 MSS=1460 SACK_PERM=1 TSval=1061640002 TSecr=408512399 WS=4
696722 220.748153 244.3.31.244 -> 244.3.139.251 TCP 70 https > 57552 [ACK] Seq=1 Ack=85 Win=5792 Len=0 TSval=1061640003 TSecr=408512399
696731 220.754433 244.3.31.244 -> 244.3.139.251 TCP 70 https > 57552 [ACK] Seq=1144 Ack=289 Win=6864 Len=0 TSval=1061640009 TSecr=408512399
696736 220.755345 244.3.31.244 -> 244.3.139.251 TCP 70 https > 57552 [ACK] Seq=1211 Ack=963 Win=9008 Len=0 TSval=1061640010 TSecr=408512399
696747 220.757347 244.3.31.244 -> 244.3.139.251 TCP 70 https > 57552 [FIN, ACK] Seq=2000 Ack=963 Win=9008 Len=0 TSval=1061640012 TSecr=408512399
696756 220.759442 244.3.31.244 -> 244.3.139.251 TCP 78 https > 57553 [SYN, ACK] Seq=0 Ack=1 Win=5792 Len=0 MSS=1460 SACK_PERM=1 TSval=1061640014 TSecr=408512399 WS=4
696759 220.760433 244.3.31.244 -> 244.3.139.251 TCP 70 https > 57553 [ACK] Seq=1 Ack=85 Win=5792 Len=0 TSval=1061640015 TSecr=408512399
696765 220.766646 244.3.31.244 -> 244.3.139.251 TCP 70 https > 57553 [ACK] Seq=1144 Ack=289 Win=6864 Len=0 TSval=1061640022 TSecr=408512399
696773 220.767675 244.3.31.244 -> 244.3.139.251 TCP 70 https > 57553 [ACK] Seq=1211 Ack=1015 Win=9216 Len=0 TSval=1061640023 TSecr=408512399
696790 220.771004 244.3.31.244 -> 244.3.139.251 TCP 70 https > 57553 [FIN, ACK] Seq=1969 Ack=1015 Win=9216 Len=0 TSval=1061640026 TSecr=408512399
696798 220.774118 244.3.31.244 -> 244.3.139.251 TCP 78 https > 57554 [SYN, ACK] Seq=0 Ack=1 Win=5792 Len=0 MSS=1460 SACK_PERM=1 TSval=1061640029 TSecr=408512399 WS=4
696801 220.774963 244.3.31.244 -> 244.3.139.251 TCP 70 https > 57554 [ACK] Seq=1 Ack=85 Win=5792 Len=0 TSval=1061640030 TSecr=408512399
696826 220.781158 244.3.31.244 -> 244.3.139.251 TCP 70 https > 57554 [ACK] Seq=1144 Ack=289 Win=6864 Len=0 TSval=1061640036 TSecr=408512399
696841 220.783743 244.3.31.244 -> 244.3.139.251 TCP 70 https > 57554 [FIN, ACK] Seq=2054 Ack=807 Win=7936 Len=0 TSval=1061640039 TSecr=408512399
696870 220.785500 244.3.31.244 -> 244.3.139.251 TCP 78 https > 57555 [SYN, ACK] Seq=0 Ack=1 Win=5792 Len=0 MSS=1460 SACK_PERM=1 TSval=1061640040 TSecr=408512400 WS=4
696874 220.786492 244.3.31.244 -> 244.3.139.251 TCP 70 https > 57555 [ACK] Seq=1 Ack=85 Win=5792 Len=0 TSval=1061640041 TSecr=408512400
696903 220.793123 244.3.31.244 -> 244.3.139.251 TCP 70 https > 57555 [ACK] Seq=1144 Ack=289 Win=6864 Len=0 TSval=1061640048 TSecr=408512400
696919 220.797140 244.3.31.244 -> 244.3.139.251 TCP 70 https > 57555 [FIN, ACK] Seq=1825 Ack=850 Win=7988 Len=0 TSval=1061640052 TSecr=408512400
696935 220.802023 244.3.31.244 -> 244.3.139.251 TCP 78 https > 57556 [SYN, ACK] Seq=0 Ack=1 Win=5792 Len=0 MSS=1460 SACK_PERM=1 TSval=1061640057 TSecr=408512400 WS=4
696938 220.803014 244.3.31.244 -> 244.3.139.251 TCP 70 https > 57556 [ACK] Seq=1 Ack=85 Win=5792 Len=0 TSval=1061640058 TSecr=408512400
696953 220.809484 244.3.31.244 -> 244.3.139.251 TCP 70 https > 57556 [ACK] Seq=1144 Ack=289 Win=6864 Len=0 TSval=1061640064 TSecr=408512400
696959 220.810255 244.3.31.244 -> 244.3.139.251 TCP 70 https > 57556 [ACK] Seq=1211 Ack=1191 Win=9160 Len=0 TSval=1061640065 TSecr=408512400
696979 220.813658 244.3.31.244 -> 244.3.139.251 TCP 70 https > 57556 [FIN, ACK] Seq=2376 Ack=1191 Win=9160 Len=0 TSval=1061640069 TSecr=408512400
696988 220.816103 244.3.31.244 -> 244.3.139.251 TCP 78 https > 57557 [SYN, ACK] Seq=0 Ack=1 Win=5792 Len=0 MSS=1460 SACK_PERM=1 TSval=1061640071 TSecr=408512400 WS=4
696994 220.816894 244.3.31.244 -> 244.3.139.251 TCP 70 https > 57557 [ACK] Seq=1 Ack=85 Win=5792 Len=0 TSval=1061640072 TSecr=408512400
697013 220.823183 244.3.31.244 -> 244.3.139.251 TCP 70 https > 57557 [ACK] Seq=1144 Ack=289 Win=6864 Len=0 TSval=1061640078 TSecr=408512400
697030 220.825680 244.3.31.244 -> 244.3.139.251 TCP 70 https > 57557 [FIN, ACK] Seq=2054 Ack=807 Win=7936 Len=0 TSval=1061640081 TSecr=408512400
697037 220.827335 244.3.31.244 -> 244.3.139.251 TCP 78 https > 57558 [SYN, ACK] Seq=0 Ack=1 Win=5792 Len=0 MSS=1460 SACK_PERM=1 TSval=1061640082 TSecr=408512400 WS=4
697041 220.828325 244.3.31.244 -> 244.3.139.251 TCP 70 https > 57558 [ACK] Seq=1 Ack=85 Win=5792 Len=0 TSval=1061640083 TSecr=408512400
697052 220.834571 244.3.31.244 -> 244.3.139.251 TCP 70 https > 57558 [ACK] Seq=1144 Ack=289 Win=6864 Len=0 TSval=1061640089 TSecr=408512400
697069 220.838775 244.3.31.244 -> 244.3.139.251 TCP 70 https > 57558 [FIN, ACK] Seq=1825 Ack=850 Win=7988 Len=0 TSval=1061640094 TSecr=408512400
697092 220.843356 244.3.31.244 -> 244.3.139.251 TCP 78 https > 57559 [SYN, ACK] Seq=0 Ack=1 Win=5792 Len=0 MSS=1460 SACK_PERM=1 TSval=1061640098 TSecr=408512400 WS=4
697097 220.844298 244.3.31.244 -> 244.3.139.251 TCP 70 https > 57559 [ACK] Seq=1 Ack=85 Win=5792 Len=0 TSval=1061640099 TSecr=408512400
697122 220.850509 244.3.31.244 -> 244.3.139.251 TCP 70 https > 57559 [ACK] Seq=1144 Ack=289 Win=6864 Len=0 TSval=1061640105 TSecr=408512400
697136 220.853425 244.3.31.244 -> 244.3.139.251 TCP 70 https > 57559 [FIN, ACK] Seq=2054 Ack=807 Win=7936 Len=0 TSval=1061640108 TSecr=408512400
697149 220.855286 244.3.31.244 -> 244.3.139.251 TCP 78 https > 57560 [SYN, ACK] Seq=0 Ack=1 Win=5792 Len=0 MSS=1460 SACK_PERM=1 TSval=1061640110 TSecr=408512400 WS=4
697152 220.856178 244.3.31.244 -> 244.3.139.251 TCP 70 https > 57560 [ACK] Seq=1 Ack=85 Win=5792 Len=0 TSval=1061640111 TSecr=408512400
697169 220.862429 244.3.31.244 -> 244.3.139.251 TCP 70 https > 57560 [ACK] Seq=1144 Ack=289 Win=6864 Len=0 TSval=1061640117 TSecr=408512400
697194 220.866433 244.3.31.244 -> 244.3.139.251 TCP 70 https > 57560 [FIN, ACK] Seq=1825 Ack=850 Win=7988 Len=0 TSval=1061640121 TSecr=408512400
697206 220.870911 244.3.31.244 -> 244.3.139.251 TCP 78 https > 57561 [SYN, ACK] Seq=0 Ack=1 Win=5792 Len=0 MSS=1460 SACK_PERM=1 TSval=1061640126 TSecr=408512400 WS=4
697209 220.871654 244.3.31.244 -> 244.3.139.251 TCP 70 https > 57561 [ACK] Seq=1 Ack=85 Win=5792 Len=0 TSval=1061640127 TSecr=408512400
697241 220.877782 244.3.31.244 -> 244.3.139.251 TCP 70 https > 57561 [ACK] Seq=1144 Ack=289 Win=6864 Len=0 TSval=1061640133 TSecr=408512400
697257 220.880276 244.3.31.244 -> 244.3.139.251 TCP 70 https > 57561 [FIN, ACK] Seq=2054 Ack=807 Win=7936 Len=0 TSval=1061640135 TSecr=408512400
697266 220.882112 244.3.31.244 -> 244.3.139.251 TCP 78 https > 57562 [SYN, ACK] Seq=0 Ack=1 Win=5792 Len=0 MSS=1460 SACK_PERM=1 TSval=1061640137 TSecr=408512400 WS=4
697273 220.882889 244.3.31.244 -> 244.3.139.251 TCP 70 https > 57562 [ACK] Seq=1 Ack=85 Win=5792 Len=0 TSval=1061640138 TSecr=408512400
697287 220.889196 244.3.31.244 -> 244.3.139.251 TCP 70 https > 57562 [ACK] Seq=1144 Ack=289 Win=6864 Len=0 TSval=1061640144 TSecr=408512400
697309 220.893501 244.3.31.244 -> 244.3.139.251 TCP 70 https > 57562 [FIN, ACK] Seq=1825 Ack=850 Win=7988 Len=0 TSval=1061640148 TSecr=408512401
697321 220.898118 244.3.31.244 -> 244.3.139.251 TCP 78 https > 57563 [SYN, ACK] Seq=0 Ack=1 Win=5792 Len=0 MSS=1460 SACK_PERM=1 TSval=1061640153 TSecr=408512401 WS=4
697324 220.899013 244.3.31.244 -> 244.3.139.251 TCP 70 https > 57563 [ACK] Seq=1 Ack=85 Win=5792 Len=0 TSval=1061640154 TSecr=408512401
697332 220.905226 244.3.31.244 -> 244.3.139.251 TCP 70 https > 57563 [ACK] Seq=1144 Ack=289 Win=6864 Len=0 TSval=1061640160 TSecr=408512401
697346 220.907785 244.3.31.244 -> 244.3.139.251 TCP 70 https > 57563 [FIN, ACK] Seq=2054 Ack=807 Win=7936 Len=0 TSval=1061640163 TSecr=408512401
697353 220.909549 244.3.31.244 -> 244.3.139.251 TCP 78 https > 57564 [SYN, ACK] Seq=0 Ack=1 Win=5792 Len=0 MSS=1460 SACK_PERM=1 TSval=1061640164 TSecr=408512401 WS=4
697356 220.910542 244.3.31.244 -> 244.3.139.251 TCP 70 https > 57564 [ACK] Seq=1 Ack=85 Win=5792 Len=0 TSval=1061640165 TSecr=408512401
697367 220.916690 244.3.31.244 -> 244.3.139.251 TCP 70 https > 57564 [ACK] Seq=1144 Ack=289 Win=6864 Len=0 TSval=1061640172 TSecr=408512401
697383 220.920989 244.3.31.244 -> 244.3.139.251 TCP 70 https > 57564 [FIN, ACK] Seq=1825 Ack=850 Win=7988 Len=0 TSval=1061640176 TSecr=408512401
697396 220.926023 244.3.31.244 -> 244.3.139.251 TCP 78 https > 57565 [SYN, ACK] Seq=0 Ack=1 Win=5792 Len=0 MSS=1460 SACK_PERM=1 TSval=1061640181 TSecr=408512401 WS=4
697400 220.927015 244.3.31.244 -> 244.3.139.251 TCP 70 https > 57565 [ACK] Seq=1 Ack=85 Win=5792 Len=0 TSval=1061640182 TSecr=408512401
697430 220.933228 244.3.31.244 -> 244.3.139.251 TCP 70 https > 57565 [ACK] Seq=1144 Ack=289 Win=6864 Len=0 TSval=1061640188 TSecr=408512401
697436 220.934002 244.3.31.244 -> 244.3.139.251 TCP 70 https > 57565 [ACK] Seq=1211 Ack=1030 Win=9300 Len=0 TSval=1061640189 TSecr=408512401
697469 220.939951 244.3.31.244 -> 244.3.139.251 TCP 78 https > 57566 [SYN, ACK] Seq=0 Ack=1 Win=5792 Len=0 MSS=1460 SACK_PERM=1 TSval=1061640195 TSecr=408512401 WS=4
697476 220.940805 244.3.31.244 -> 244.3.139.251 TCP 70 https > 57566 [ACK] Seq=1 Ack=85 Win=5792 Len=0 TSval=1061640196 TSecr=408512401
697487 220.947012 244.3.31.244 -> 244.3.139.251 TCP 70 https > 57566 [ACK] Seq=1144 Ack=289 Win=6864 Len=0 TSval=1061640202 TSecr=408512401
697494 220.947783 244.3.31.244 -> 244.3.139.251 TCP 70 https > 57566 [ACK] Seq=1211 Ack=1191 Win=9160 Len=0 TSval=1061640203 TSecr=408512401
697505 220.951186 244.3.31.244 -> 244.3.139.251 TCP 70 https > 57566 [FIN, ACK] Seq=2376 Ack=1191 Win=9160 Len=0 TSval=1061640206 TSecr=408512401
697518 220.953580 244.3.31.244 -> 244.3.139.251 TCP 78 https > 57567 [SYN, ACK] Seq=0 Ack=1 Win=5792 Len=0 MSS=1460 SACK_PERM=1 TSval=1061640208 TSecr=408512401 WS=4
697521 220.954421 244.3.31.244 -> 244.3.139.251 TCP 70 https > 57567 [ACK] Seq=1 Ack=85 Win=5792 Len=0 TSval=1061640209 TSecr=408512401
697539 220.960736 244.3.31.244 -> 244.3.139.251 TCP 70 https > 57567 [ACK] Seq=1144 Ack=289 Win=6864 Len=0 TSval=1061640216 TSecr=408512401
697546 220.961514 244.3.31.244 -> 244.3.139.251 TCP 70 https > 57567 [ACK] Seq=1211 Ack=1268 Win=9128 Len=0 TSval=1061640216 TSecr=408512401
