156831  53.405887  244.3.31.68 -> 41.177.3.203 TCP 64 4888 > 58491 [SYN, ACK] Seq=0 Ack=1 Win=5840 Len=0 MSS=1460
156835  53.406585  244.3.31.68 -> 41.177.3.203 TCP 64 4888 > 58491 [ACK] Seq=1 Ack=84 Win=5840 Len=0
156836  53.406864  244.3.31.68 -> 41.177.3.203 TCP 121 4888 > 58491 [PSH, ACK] Seq=1 Ack=84 Win=5840 Len=63
156837  53.406868  244.3.31.68 -> 41.177.3.203 TCP 64 4888 > 58491 [PSH, ACK] Seq=64 Ack=84 Win=5840 Len=6
157122  53.542667  244.3.31.68 -> 41.177.3.203 TCP 127 4888 > 58491 [PSH, ACK] Seq=70 Ack=84 Win=5840 Len=69
157214  53.579810  244.3.31.68 -> 41.177.3.203 TCP 64 4888 > 58491 [ACK] Seq=139 Ack=90 Win=5840 Len=0
157218  53.580146  244.3.31.68 -> 41.177.3.203 TCP 64 4888 > 58491 [ACK] Seq=139 Ack=890 Win=7200 Len=0
157271  53.594735  244.3.31.68 -> 41.177.3.203 TCP 463 4888 > 58491 [PSH, ACK] Seq=139 Ack=890 Win=7200 Len=405
157276  53.595787  244.3.31.68 -> 41.177.3.203 TCP 87 4888 > 58491 [PSH, ACK] Seq=544 Ack=919 Win=7200 Len=29
157278  53.595867  244.3.31.68 -> 41.177.3.203 TCP 64 4888 > 58491 [FIN, ACK] Seq=573 Ack=920 Win=7200 Len=0
328077 113.615116  244.3.31.68 -> 41.177.3.203 TCP 64 4888 > 58497 [SYN, ACK] Seq=0 Ack=1 Win=5840 Len=0 MSS=1460
328080 113.615934  244.3.31.68 -> 41.177.3.203 TCP 64 4888 > 58497 [ACK] Seq=1 Ack=84 Win=5840 Len=0
328081 113.616202  244.3.31.68 -> 41.177.3.203 TCP 121 4888 > 58497 [PSH, ACK] Seq=1 Ack=84 Win=5840 Len=63
328082 113.616207  244.3.31.68 -> 41.177.3.203 TCP 64 4888 > 58497 [PSH, ACK] Seq=64 Ack=84 Win=5840 Len=6
328182 113.692031  244.3.31.68 -> 41.177.3.203 TCP 127 4888 > 58497 [PSH, ACK] Seq=70 Ack=84 Win=5840 Len=69
328234 113.730983  244.3.31.68 -> 41.177.3.203 TCP 64 4888 > 58497 [ACK] Seq=139 Ack=90 Win=5840 Len=0
328239 113.731325  244.3.31.68 -> 41.177.3.203 TCP 64 4888 > 58497 [ACK] Seq=139 Ack=890 Win=7200 Len=0
328258 113.734786  244.3.31.68 -> 41.177.3.203 TCP 463 4888 > 58497 [PSH, ACK] Seq=139 Ack=890 Win=7200 Len=405
328262 113.735919  244.3.31.68 -> 41.177.3.203 TCP 87 4888 > 58497 [PSH, ACK] Seq=544 Ack=920 Win=7200 Len=29
328263 113.735993  244.3.31.68 -> 41.177.3.203 TCP 64 4888 > 58497 [FIN, ACK] Seq=573 Ack=920 Win=7200 Len=0
536775 173.764565  244.3.31.68 -> 41.177.3.203 TCP 64 4888 > 58500 [SYN, ACK] Seq=0 Ack=1 Win=5840 Len=0 MSS=1460
536780 173.765435  244.3.31.68 -> 41.177.3.203 TCP 64 4888 > 58500 [ACK] Seq=1 Ack=84 Win=5840 Len=0
536783 173.765699  244.3.31.68 -> 41.177.3.203 TCP 121 4888 > 58500 [PSH, ACK] Seq=1 Ack=84 Win=5840 Len=63
536784 173.765769  244.3.31.68 -> 41.177.3.203 TCP 1188 4888 > 58500 [PSH, ACK] Seq=64 Ack=84 Win=5840 Len=1130
536980 173.844156  244.3.31.68 -> 41.177.3.203 TCP 67 4888 > 58500 [PSH, ACK] Seq=1194 Ack=84 Win=5840 Len=9
537094 173.882152  244.3.31.68 -> 41.177.3.203 TCP 64 4888 > 58500 [ACK] Seq=1203 Ack=157 Win=5840 Len=0
537096 173.882492  244.3.31.68 -> 41.177.3.203 TCP 64 4888 > 58500 [ACK] Seq=1203 Ack=232 Win=5840 Len=0
537097 173.882761  244.3.31.68 -> 41.177.3.203 TCP 64 4888 > 58500 [PSH, ACK] Seq=1203 Ack=232 Win=5840 Len=6
537098 173.882904  244.3.31.68 -> 41.177.3.203 TCP 127 4888 > 58500 [PSH, ACK] Seq=1209 Ack=232 Win=5840 Len=69
537237 173.922144  244.3.31.68 -> 41.177.3.203 TCP 64 4888 > 58500 [ACK] Seq=1278 Ack=613 Win=6432 Len=0
537240 173.922466  244.3.31.68 -> 41.177.3.203 TCP 64 4888 > 58500 [ACK] Seq=1278 Ack=963 Win=7504 Len=0
537252 173.927006  244.3.31.68 -> 41.177.3.203 TCP 463 4888 > 58500 [PSH, ACK] Seq=1278 Ack=963 Win=7504 Len=405
537256 173.928044  244.3.31.68 -> 41.177.3.203 TCP 87 4888 > 58500 [PSH, ACK] Seq=1683 Ack=992 Win=7504 Len=29
537258 173.928173  244.3.31.68 -> 41.177.3.203 TCP 64 4888 > 58500 [FIN, ACK] Seq=1712 Ack=993 Win=7504 Len=0
728751 233.954109  244.3.31.68 -> 41.177.3.203 TCP 64 4888 > 58507 [SYN, ACK] Seq=0 Ack=1 Win=5840 Len=0 MSS=1460
728757 233.955207  244.3.31.68 -> 41.177.3.203 TCP 64 4888 > 58507 [ACK] Seq=1 Ack=84 Win=5840 Len=0
728758 233.955481  244.3.31.68 -> 41.177.3.203 TCP 121 4888 > 58507 [PSH, ACK] Seq=1 Ack=84 Win=5840 Len=63
728759 233.955486  244.3.31.68 -> 41.177.3.203 TCP 64 4888 > 58507 [PSH, ACK] Seq=64 Ack=84 Win=5840 Len=6
729318 234.120375  244.3.31.68 -> 41.177.3.203 TCP 127 4888 > 58507 [PSH, ACK] Seq=70 Ack=84 Win=5840 Len=69
729373 234.153316  244.3.31.68 -> 41.177.3.203 TCP 64 4888 > 58507 [ACK] Seq=139 Ack=90 Win=5840 Len=0
729375 234.153657  244.3.31.68 -> 41.177.3.203 TCP 64 4888 > 58507 [ACK] Seq=139 Ack=890 Win=7200 Len=0
729381 234.156868  244.3.31.68 -> 41.177.3.203 TCP 463 4888 > 58507 [PSH, ACK] Seq=139 Ack=890 Win=7200 Len=405
729384 234.157971  244.3.31.68 -> 41.177.3.203 TCP 87 4888 > 58507 [PSH, ACK] Seq=544 Ack=920 Win=7200 Len=29
729385 234.158020  244.3.31.68 -> 41.177.3.203 TCP 64 4888 > 58507 [FIN, ACK] Seq=573 Ack=920 Win=7200 Len=0
885703 294.172787  244.3.31.68 -> 41.177.3.203 TCP 64 4888 > 58510 [SYN, ACK] Seq=0 Ack=1 Win=5840 Len=0 MSS=1460
885716 294.173572  244.3.31.68 -> 41.177.3.203 TCP 64 4888 > 58510 [ACK] Seq=1 Ack=84 Win=5840 Len=0
885720 294.173899  244.3.31.68 -> 41.177.3.203 TCP 121 4888 > 58510 [PSH, ACK] Seq=1 Ack=84 Win=5840 Len=63
885722 294.173909  244.3.31.68 -> 41.177.3.203 TCP 64 4888 > 58510 [PSH, ACK] Seq=64 Ack=84 Win=5840 Len=6
886035 294.229637  244.3.31.68 -> 41.177.3.203 TCP 127 4888 > 58510 [PSH, ACK] Seq=70 Ack=84 Win=5840 Len=69
886380 294.264535  244.3.31.68 -> 41.177.3.203 TCP 64 4888 > 58510 [ACK] Seq=139 Ack=90 Win=5840 Len=0
886385 294.264847  244.3.31.68 -> 41.177.3.203 TCP 64 4888 > 58510 [ACK] Seq=139 Ack=890 Win=7200 Len=0
886539 294.284857  244.3.31.68 -> 41.177.3.203 TCP 463 4888 > 58510 [PSH, ACK] Seq=139 Ack=890 Win=7200 Len=405
886557 294.285965  244.3.31.68 -> 41.177.3.203 TCP 87 4888 > 58510 [PSH, ACK] Seq=544 Ack=920 Win=7200 Len=29
886558 294.286039  244.3.31.68 -> 41.177.3.203 TCP 64 4888 > 58510 [FIN, ACK] Seq=573 Ack=920 Win=7200 Len=0
