189260  64.602866  244.3.0.213 -> 41.177.98.176 TCP 66 minipay > http [SYN] Seq=0 Win=65535 Len=0 MSS=1380 SACK_PERM=1
189262  64.603423  244.3.0.213 -> 41.177.98.176 TCP 64 minipay > http [ACK] Seq=1 Ack=1 Win=65535 Len=0
193084  66.421471  244.3.0.213 -> 41.177.98.176 TCP 64 minipay > http [ACK] Seq=1054 Ack=2761 Win=65535 Len=0
193086  66.422269  244.3.0.213 -> 41.177.98.176 TCP 64 minipay > http [ACK] Seq=1054 Ack=5335 Win=65535 Len=0
193093  66.425370  244.3.0.213 -> 41.177.98.176 TCP 64 minipay > http [ACK] Seq=1054 Ack=8095 Win=65535 Len=0
193094  66.425475  244.3.0.213 -> 41.177.98.176 TCP 64 minipay > http [ACK] Seq=1054 Ack=9634 Win=65535 Len=0
193135  66.450844  244.3.0.213 -> 41.177.98.176 TCP 66 mzap > http [SYN] Seq=0 Win=65535 Len=0 MSS=1380 SACK_PERM=1
193144  66.452127  244.3.0.213 -> 41.177.98.176 TCP 64 mzap > http [ACK] Seq=1 Ack=1 Win=65535 Len=0
193189  66.459028  244.3.0.213 -> 41.177.98.176 TCP 64 mzap > http [ACK] Seq=807 Ack=4141 Win=65535 Len=0
193221  66.482132  244.3.0.213 -> 41.177.98.176 TCP 66 bintec-admin > http [SYN] Seq=0 Win=65535 Len=0 MSS=1380 SACK_PERM=1
193225  66.482715  244.3.0.213 -> 41.177.98.176 TCP 64 bintec-admin > http [ACK] Seq=1 Ack=1 Win=65535 Len=0
193226  66.483195  244.3.0.213 -> 41.177.98.176 TCP 66 comcam > http [SYN] Seq=0 Win=65535 Len=0 MSS=1380 SACK_PERM=1
193228  66.483842  244.3.0.213 -> 41.177.98.176 TCP 64 comcam > http [ACK] Seq=1 Ack=1 Win=65535 Len=0
193244  66.488311  244.3.0.213 -> 41.177.98.176 TCP 66 ergolight > http [SYN] Seq=0 Win=65535 Len=0 MSS=1380 SACK_PERM=1
193246  66.488743  244.3.0.213 -> 41.177.98.176 TCP 64 ergolight > http [ACK] Seq=1 Ack=1 Win=65535 Len=0
193505  66.565374  244.3.0.213 -> 41.177.98.176 TCP 64 mzap > http [ACK] Seq=807 Ack=5480 Win=64196 Len=0
193537  66.579440  244.3.0.213 -> 41.177.98.176 TCP 66 umsp > http [SYN] Seq=0 Win=65535 Len=0 MSS=1380 SACK_PERM=1
193542  66.579761  244.3.0.213 -> 41.177.98.176 TCP 64 mzap > http [ACK] Seq=1621 Ack=8240 Win=65535 Len=0
193545  66.579886  244.3.0.213 -> 41.177.98.176 TCP 64 mzap > http [ACK] Seq=1621 Ack=10716 Win=65535 Len=0
193550  66.580203  244.3.0.213 -> 41.177.98.176 TCP 64 minipay > http [ACK] Seq=2673 Ack=12445 Win=65535 Len=0
193555  66.580441  244.3.0.213 -> 41.177.98.176 TCP 64 minipay > http [ACK] Seq=2673 Ack=15205 Win=65535 Len=0
193557  66.580642  244.3.0.213 -> 41.177.98.176 TCP 64 minipay > http [ACK] Seq=2673 Ack=17965 Win=65535 Len=0
193559  66.580781  244.3.0.213 -> 41.177.98.176 TCP 64 umsp > http [ACK] Seq=1 Ack=1 Win=65535 Len=0
193562  66.580895  244.3.0.213 -> 41.177.98.176 TCP 64 minipay > http [ACK] Seq=2673 Ack=20637 Win=62863 Len=0
193571  66.581371  244.3.0.213 -> 41.177.98.176 TCP 64 comcam > http [ACK] Seq=804 Ack=1691 Win=65535 Len=0
193574  66.581589  244.3.0.213 -> 41.177.98.176 TCP 64 minipay > http [ACK] Seq=2673 Ack=23397 Win=60103 Len=0
193577  66.581821  244.3.0.213 -> 41.177.98.176 TCP 64 minipay > http [ACK] Seq=2673 Ack=26157 Win=57343 Len=0
193580  66.582052  244.3.0.213 -> 41.177.98.176 TCP 64 minipay > http [ACK] Seq=2673 Ack=28829 Win=54671 Len=0
193583  66.582256  244.3.0.213 -> 41.177.98.176 TCP 64 minipay > http [ACK] Seq=2673 Ack=31589 Win=51911 Len=0
193586  66.582505  244.3.0.213 -> 41.177.98.176 TCP 64 minipay > http [ACK] Seq=2673 Ack=34349 Win=49151 Len=0
193590  66.582826  244.3.0.213 -> 41.177.98.176 TCP 64 minipay > http [ACK] Seq=2673 Ack=37021 Win=46479 Len=0
193593  66.583057  244.3.0.213 -> 41.177.98.176 TCP 64 comcam > http [ACK] Seq=804 Ack=4451 Win=65535 Len=0
193596  66.583281  244.3.0.213 -> 41.177.98.176 TCP 64 comcam > http [ACK] Seq=804 Ack=7211 Win=65535 Len=0
193598  66.583402  244.3.0.213 -> 41.177.98.176 TCP 64 minipay > http [ACK] Seq=2673 Ack=39781 Win=43719 Len=0
193601  66.583633  244.3.0.213 -> 41.177.98.176 TCP 64 minipay > http [ACK] Seq=2673 Ack=42541 Win=40959 Len=0
193603  66.583828  244.3.0.213 -> 41.177.98.176 TCP 64 minipay > http [ACK] Seq=2673 Ack=45213 Win=38287 Len=0
193607  66.584094  244.3.0.213 -> 41.177.98.176 TCP 64 minipay > http [ACK] Seq=2673 Ack=47973 Win=35527 Len=0
193610  66.584331  244.3.0.213 -> 41.177.98.176 TCP 64 minipay > http [ACK] Seq=2673 Ack=50733 Win=32767 Len=0
193613  66.584564  244.3.0.213 -> 41.177.98.176 TCP 64 minipay > http [ACK] Seq=2673 Ack=53405 Win=30095 Len=0
193616  66.584801  244.3.0.213 -> 41.177.98.176 TCP 64 minipay > http [ACK] Seq=2673 Ack=56165 Win=27335 Len=0
193619  66.584999  244.3.0.213 -> 41.177.98.176 TCP 64 minipay > http [ACK] Seq=2673 Ack=58925 Win=24575 Len=0
193622  66.585236  244.3.0.213 -> 41.177.98.176 TCP 64 minipay > http [ACK] Seq=2673 Ack=61597 Win=21903 Len=0
193627  66.585534  244.3.0.213 -> 41.177.98.176 TCP 64 minipay > http [ACK] Seq=2673 Ack=64357 Win=19143 Len=0
193628  66.585737  244.3.0.213 -> 41.177.98.176 TCP 64 minipay > http [ACK] Seq=2673 Ack=67117 Win=16383 Len=0
193629  66.585961  244.3.0.213 -> 41.177.98.176 TCP 64 minipay > http [ACK] Seq=2673 Ack=69789 Win=13711 Len=0
193639  66.588737  244.3.0.213 -> 41.177.98.176 TCP 64 minipay > http [ACK] Seq=2673 Ack=70423 Win=18129 Len=0
193652  66.592546  244.3.0.213 -> 41.177.98.176 TCP 64 ergolight > http [ACK] Seq=817 Ack=3072 Win=65535 Len=0
193663  66.593470  244.3.0.213 -> 41.177.98.176 TCP 64 ergolight > http [ACK] Seq=817 Ack=5832 Win=65535 Len=0
193664  66.593696  244.3.0.213 -> 41.177.98.176 TCP 64 ergolight > http [ACK] Seq=817 Ack=8592 Win=65535 Len=0
193668  66.594340  244.3.0.213 -> 41.177.98.176 TCP 64 ergolight > http [ACK] Seq=817 Ack=10712 Win=63415 Len=0
193768  66.635978  244.3.0.213 -> 41.177.98.176 TCP 64 [TCP Window Update] minipay > http [ACK] Seq=2673 Ack=70423 Win=65535 Len=0
193790  66.649392  244.3.0.213 -> 41.177.98.176 TCP 64 umsp > http [ACK] Seq=826 Ack=3071 Win=65535 Len=0
193800  66.651333  244.3.0.213 -> 41.177.98.176 TCP 64 umsp > http [ACK] Seq=826 Ack=8591 Win=65535 Len=0
193840  66.663513  244.3.0.213 -> 41.177.98.176 TCP 64 [TCP Window Update] ergolight > http [ACK] Seq=817 Ack=10712 Win=65535 Len=0
193859  66.665552  244.3.0.213 -> 41.177.98.176 TCP 64 mzap > http [ACK] Seq=2447 Ack=12814 Win=65535 Len=0
193867  66.667036  244.3.0.213 -> 41.177.98.176 TCP 64 minipay > http [ACK] Seq=3483 Ack=76115 Win=65535 Len=0
193868  66.667041  244.3.0.213 -> 41.177.98.176 TCP 64 comcam > http [ACK] Seq=1613 Ack=13344 Win=65535 Len=0
193904  66.669868  244.3.0.213 -> 41.177.98.176 TCP 64 ergolight > http [ACK] Seq=1623 Ack=19213 Win=65535 Len=0
193905  66.671195  244.3.0.213 -> 41.177.98.176 TCP 64 bintec-admin > http [ACK] Seq=1623 Ack=5282 Win=65535 Len=0
193911  66.672145  244.3.0.213 -> 41.177.98.176 TCP 64 bintec-admin > http [ACK] Seq=1623 Ack=8042 Win=65535 Len=0
193917  66.674000  244.3.0.213 -> 41.177.98.176 TCP 64 bintec-admin > http [ACK] Seq=1623 Ack=16037 Win=58920 Len=0
194013  66.709986  244.3.0.213 -> 41.177.98.176 TCP 64 [TCP Window Update] bintec-admin > http [ACK] Seq=1623 Ack=16037 Win=62680 Len=0
194098  66.732902  244.3.0.213 -> 41.177.98.176 TCP 64 [TCP Window Update] bintec-admin > http [ACK] Seq=1623 Ack=16037 Win=65535 Len=0
194498  66.867180  244.3.0.213 -> 41.177.98.176 TCP 64 mzap > http [ACK] Seq=3252 Ack=13531 Win=64818 Len=0
194500  66.867188  244.3.0.213 -> 41.177.98.176 TCP 64 umsp > http [ACK] Seq=1630 Ack=9915 Win=64211 Len=0
194501  66.867192  244.3.0.213 -> 41.177.98.176 TCP 64 ergolight > http [ACK] Seq=1623 Ack=20034 Win=64714 Len=0
194798  66.967721  244.3.0.213 -> 41.177.98.176 TCP 64 minipay > http [ACK] Seq=4290 Ack=76450 Win=65200 Len=0
194799  66.967726  244.3.0.213 -> 41.177.98.176 TCP 64 comcam > http [ACK] Seq=2419 Ack=14445 Win=64434 Len=0
195652  67.269480  244.3.0.213 -> 41.177.98.176 TCP 64 bintec-admin > http [ACK] Seq=2317 Ack=16330 Win=65242 Len=0
234899  81.677626  244.3.0.213 -> 41.177.98.176 TCP 64 ergolight > http [ACK] Seq=1623 Ack=20035 Win=64714 Len=0
234986  81.737656  244.3.0.213 -> 41.177.98.176 TCP 64 umsp > http [ACK] Seq=1630 Ack=9916 Win=64211 Len=0
234989  81.737689  244.3.0.213 -> 41.177.98.176 TCP 64 mzap > http [ACK] Seq=3252 Ack=13532 Win=64818 Len=0
235097  81.817604  244.3.0.213 -> 41.177.98.176 TCP 64 comcam > http [ACK] Seq=2419 Ack=14446 Win=64434 Len=0
235149  81.867621  244.3.0.213 -> 41.177.98.176 TCP 64 minipay > http [ACK] Seq=4290 Ack=76451 Win=65200 Len=0
235533  82.116987  244.3.0.213 -> 41.177.98.176 TCP 64 ergolight > http [RST, ACK] Seq=1623 Ack=20035 Win=0 Len=0
235534  82.117062  244.3.0.213 -> 41.177.98.176 TCP 64 umsp > http [RST, ACK] Seq=1630 Ack=9916 Win=0 Len=0
235535  82.117129  244.3.0.213 -> 41.177.98.176 TCP 64 mzap > http [RST, ACK] Seq=3252 Ack=13532 Win=0 Len=0
235536  82.117205  244.3.0.213 -> 41.177.98.176 TCP 64 comcam > http [RST, ACK] Seq=2419 Ack=14446 Win=0 Len=0
235538  82.117253  244.3.0.213 -> 41.177.98.176 TCP 64 minipay > http [RST, ACK] Seq=4290 Ack=76451 Win=0 Len=0
235540  82.117679  244.3.0.213 -> 41.177.98.176 TCP 64 bintec-admin > http [ACK] Seq=2317 Ack=16331 Win=65242 Len=0
244416  85.222023  244.3.0.213 -> 41.177.98.176 TCP 64 bintec-admin > http [FIN, ACK] Seq=2317 Ack=16331 Win=65242 Len=0
244422  85.222822  244.3.0.213 -> 41.177.98.176 TCP 66 kdm > http [SYN] Seq=0 Win=65535 Len=0 MSS=1380 SACK_PERM=1
244426  85.223530  244.3.0.213 -> 41.177.98.176 TCP 64 kdm > http [ACK] Seq=1 Ack=1 Win=65535 Len=0
244866  85.427808  244.3.0.213 -> 41.177.98.176 TCP 64 kdm > http [ACK] Seq=1255 Ack=2761 Win=65535 Len=0
244868  85.428675  244.3.0.213 -> 41.177.98.176 TCP 64 kdm > http [ACK] Seq=1255 Ack=5335 Win=65535 Len=0
244873  85.431119  244.3.0.213 -> 41.177.98.176 TCP 64 kdm > http [ACK] Seq=1255 Ack=8095 Win=65535 Len=0
244874  85.431299  244.3.0.213 -> 41.177.98.176 TCP 64 kdm > http [ACK] Seq=1255 Ack=10463 Win=65535 Len=0
244906  85.441204  244.3.0.213 -> 41.177.98.176 TCP 64 kdm > http [ACK] Seq=1255 Ack=11510 Win=64488 Len=0
246017  86.078805  244.3.0.213 -> 41.177.98.176 TCP 64 kdm > http [ACK] Seq=1949 Ack=11803 Win=64195 Len=0
299453 100.965505  244.3.0.213 -> 41.177.98.176 TCP 64 kdm > http [ACK] Seq=1949 Ack=11804 Win=64195 Len=0
310505 105.959456  244.3.0.213 -> 41.177.98.176 TCP 64 kdm > http [RST, ACK] Seq=1949 Ack=11804 Win=0 Len=0
537886 174.150153  244.3.0.213 -> 41.177.98.176 TCP 66 gris > http [SYN] Seq=0 Win=65535 Len=0 MSS=1380 SACK_PERM=1
537889 174.151230  244.3.0.213 -> 41.177.98.176 TCP 64 gris > http [ACK] Seq=1 Ack=1 Win=65535 Len=0
538277 174.369246  244.3.0.213 -> 41.177.98.176 TCP 64 gris > http [ACK] Seq=1284 Ack=2761 Win=65535 Len=0
538293 174.370099  244.3.0.213 -> 41.177.98.176 TCP 64 gris > http [ACK] Seq=1284 Ack=5335 Win=65535 Len=0
538298 174.372131  244.3.0.213 -> 41.177.98.176 TCP 64 gris > http [ACK] Seq=1284 Ack=8095 Win=65535 Len=0
538299 174.372323  244.3.0.213 -> 41.177.98.176 TCP 64 gris > http [ACK] Seq=1284 Ack=10463 Win=65535 Len=0
538321 174.374058  244.3.0.213 -> 41.177.98.176 TCP 64 gris > http [ACK] Seq=1284 Ack=11491 Win=64507 Len=0
570772 182.309509  244.3.0.213 -> 41.177.98.176 TCP 64 gris > http [ACK] Seq=2332 Ack=13166 Win=65535 Len=0
570773 182.309697  244.3.0.213 -> 41.177.98.176 TCP 64 gris > http [ACK] Seq=2332 Ack=15926 Win=65535 Len=0
570774 182.309933  244.3.0.213 -> 41.177.98.176 TCP 64 gris > http [ACK] Seq=2332 Ack=18686 Win=65535 Len=0
571475 182.438934  244.3.0.213 -> 41.177.98.176 TCP 64 gris > http [ACK] Seq=2332 Ack=19265 Win=64956 Len=0
620423 197.313509  244.3.0.213 -> 41.177.98.176 TCP 64 gris > http [ACK] Seq=2332 Ack=19266 Win=64956 Len=0
623400 197.847993  244.3.0.213 -> 41.177.98.176 TCP 64 gris > http [RST, ACK] Seq=2332 Ack=19266 Win=0 Len=0
680508 212.981618  244.3.0.213 -> 41.177.98.176 TCP 66 lv-not > http [SYN] Seq=0 Win=65535 Len=0 MSS=1380 SACK_PERM=1
680510 212.982140  244.3.0.213 -> 41.177.98.176 TCP 64 lv-not > http [ACK] Seq=1 Ack=1 Win=65535 Len=0
681747 213.713753  244.3.0.213 -> 41.177.98.176 TCP 64 lv-not > http [ACK] Seq=1285 Ack=2761 Win=65535 Len=0
681755 213.714592  244.3.0.213 -> 41.177.98.176 TCP 64 lv-not > http [ACK] Seq=1285 Ack=5335 Win=65535 Len=0
681761 213.716547  244.3.0.213 -> 41.177.98.176 TCP 64 lv-not > http [ACK] Seq=1285 Ack=8095 Win=65535 Len=0
681763 213.716749  244.3.0.213 -> 41.177.98.176 TCP 64 lv-not > http [ACK] Seq=1285 Ack=10463 Win=64547 Len=0
681768 213.719683  244.3.0.213 -> 41.177.98.176 TCP 64 lv-not > http [ACK] Seq=1285 Ack=12636 Win=62374 Len=0
681776 213.722916  244.3.0.213 -> 41.177.98.176 TCP 64 [TCP Window Update] lv-not > http [ACK] Seq=1285 Ack=12636 Win=65535 Len=0
681953 213.864994  244.3.0.213 -> 41.177.98.176 TCP 66 lv-auth > http [SYN] Seq=0 Win=65535 Len=0 MSS=1380 SACK_PERM=1
681962 213.866153  244.3.0.213 -> 41.177.98.176 TCP 64 lv-auth > http [ACK] Seq=1 Ack=1 Win=65535 Len=0
681963 213.866206  244.3.0.213 -> 41.177.98.176 TCP 64 lv-not > http [ACK] Seq=2077 Ack=14313 Win=65535 Len=0
681965 213.866331  244.3.0.213 -> 41.177.98.176 TCP 66 veritas-ucl > http [SYN] Seq=0 Win=65535 Len=0 MSS=1380 SACK_PERM=1
681971 213.867372  244.3.0.213 -> 41.177.98.176 TCP 64 veritas-ucl > http [ACK] Seq=1 Ack=1 Win=65535 Len=0
681972 213.867376  244.3.0.213 -> 41.177.98.176 TCP 64 lv-not > http [ACK] Seq=2077 Ack=24390 Win=63650 Len=0
681978 213.868398  244.3.0.213 -> 41.177.98.176 TCP 64 [TCP Window Update] lv-not > http [ACK] Seq=2077 Ack=24390 Win=65535 Len=0
681979 213.868723  244.3.0.213 -> 41.177.98.176 TCP 64 lv-auth > http [ACK] Seq=793 Ack=1679 Win=65535 Len=0
681986 213.869995  244.3.0.213 -> 41.177.98.176 TCP 64 veritas-ucl > http [ACK] Seq=798 Ack=3059 Win=65535 Len=0
681987 213.870000  244.3.0.213 -> 41.177.98.176 TCP 64 lv-auth > http [ACK] Seq=793 Ack=5819 Win=65535 Len=0
681997 213.872225  244.3.0.213 -> 41.177.98.176 TCP 64 veritas-ucl > http [ACK] Seq=798 Ack=8579 Win=65535 Len=0
681998 213.872230  244.3.0.213 -> 41.177.98.176 TCP 64 lv-auth > http [ACK] Seq=793 Ack=12388 Win=64486 Len=0
682002 213.873236  244.3.0.213 -> 41.177.98.176 TCP 64 veritas-ucl > http [ACK] Seq=798 Ack=11339 Win=65535 Len=0
682374 214.024477  244.3.0.213 -> 41.177.98.176 TCP 64 veritas-ucl > http [ACK] Seq=798 Ack=12380 Win=64494 Len=0
717153 228.872440  244.3.0.213 -> 41.177.98.176 TCP 64 lv-not > http [ACK] Seq=2077 Ack=24391 Win=65535 Len=0
717179 228.872962  244.3.0.213 -> 41.177.98.176 TCP 64 lv-auth > http [ACK] Seq=793 Ack=12389 Win=64486 Len=0
717183 228.873017  244.3.0.213 -> 41.177.98.176 TCP 64 veritas-ucl > http [ACK] Seq=798 Ack=12381 Win=64494 Len=0
717189 228.873074  244.3.0.213 -> 41.177.98.176 TCP 64 lv-not > http [RST, ACK] Seq=2077 Ack=24391 Win=0 Len=0
717191 228.873273  244.3.0.213 -> 41.177.98.176 TCP 64 lv-auth > http [RST, ACK] Seq=793 Ack=12389 Win=0 Len=0
717192 228.873455  244.3.0.213 -> 41.177.98.176 TCP 64 veritas-ucl > http [RST, ACK] Seq=798 Ack=12381 Win=0 Len=0
800032 261.162219  244.3.0.213 -> 41.177.98.176 TCP 66 touchnetplus > http [SYN] Seq=0 Win=65535 Len=0 MSS=1380 SACK_PERM=1
800034 261.162721  244.3.0.213 -> 41.177.98.176 TCP 64 touchnetplus > http [ACK] Seq=1 Ack=1 Win=65535 Len=0
800398 261.395877  244.3.0.213 -> 41.177.98.176 TCP 64 touchnetplus > http [ACK] Seq=1121 Ack=2761 Win=65535 Len=0
800400 261.396690  244.3.0.213 -> 41.177.98.176 TCP 64 touchnetplus > http [ACK] Seq=1121 Ack=5335 Win=65535 Len=0
800405 261.398553  244.3.0.213 -> 41.177.98.176 TCP 64 touchnetplus > http [ACK] Seq=1121 Ack=8095 Win=65535 Len=0
800406 261.398711  244.3.0.213 -> 41.177.98.176 TCP 64 touchnetplus > http [ACK] Seq=1121 Ack=10463 Win=65535 Len=0
800411 261.401869  244.3.0.213 -> 41.177.98.176 TCP 64 touchnetplus > http [ACK] Seq=1121 Ack=15591 Win=65535 Len=0
800416 261.404579  244.3.0.213 -> 41.177.98.176 TCP 64 touchnetplus > http [ACK] Seq=1121 Ack=18351 Win=65535 Len=0
800417 261.405113  244.3.0.213 -> 41.177.98.176 TCP 64 touchnetplus > http [ACK] Seq=1121 Ack=20719 Win=65535 Len=0
800420 261.406498  244.3.0.213 -> 41.177.98.176 TCP 64 touchnetplus > http [ACK] Seq=1121 Ack=21177 Win=65077 Len=0
801149 261.887657  244.3.0.213 -> 41.177.98.176 TCP 66 gdbremote > http [SYN] Seq=0 Win=65535 Len=0 MSS=1380 SACK_PERM=1
801157 261.893083  244.3.0.213 -> 41.177.98.176 TCP 64 gdbremote > http [ACK] Seq=1 Ack=1 Win=65535 Len=0
801158 261.893088  244.3.0.213 -> 41.177.98.176 TCP 64 touchnetplus > http [ACK] Seq=1973 Ack=22738 Win=65535 Len=0
801164 261.898169  244.3.0.213 -> 41.177.98.176 TCP 64 gdbremote > http [ACK] Seq=860 Ack=3059 Win=65535 Len=0
801171 261.899287  244.3.0.213 -> 41.177.98.176 TCP 64 gdbremote > http [ACK] Seq=860 Ack=7199 Win=65535 Len=0
801178 261.900131  244.3.0.213 -> 41.177.98.176 TCP 64 gdbremote > http [ACK] Seq=860 Ack=9959 Win=65535 Len=0
801179 261.900333  244.3.0.213 -> 41.177.98.176 TCP 64 gdbremote > http [ACK] Seq=860 Ack=12719 Win=65535 Len=0
801186 261.901013  244.3.0.213 -> 41.177.98.176 TCP 64 gdbremote > http [ACK] Seq=860 Ack=15479 Win=65535 Len=0
801188 261.901215  244.3.0.213 -> 41.177.98.176 TCP 64 gdbremote > http [ACK] Seq=860 Ack=18239 Win=65535 Len=0
801193 261.901673  244.3.0.213 -> 41.177.98.176 TCP 64 gdbremote > http [ACK] Seq=860 Ack=22379 Win=65535 Len=0
801226 261.906761  244.3.0.213 -> 41.177.98.176 TCP 64 gdbremote > http [ACK] Seq=860 Ack=28914 Win=65535 Len=0
813493 265.338325  244.3.0.213 -> 41.177.98.176 TCP 64 gdbremote > http [RST, ACK] Seq=860 Ack=28914 Win=0 Len=0
813643 265.379766  244.3.0.213 -> 41.177.98.176 TCP 64 touchnetplus > http [RST, ACK] Seq=1973 Ack=22738 Win=0 Len=0
