54948  22.708589 244.3.31.108 -> 244.3.160.239 TCP 66 http > 33379 [SYN, ACK] Seq=0 Ack=1 Win=49640 Len=0 MSS=1460 SACK_PERM=1
54951  22.709424 244.3.31.108 -> 244.3.160.239 TCP 64 http > 33379 [ACK] Seq=1 Ack=1067 Win=48574 Len=0
55338  22.871770 244.3.31.108 -> 244.3.160.239 TCP 64 http > 33379 [ACK] Seq=643 Ack=1068 Win=49640 Len=0
55339  22.871775 244.3.31.108 -> 244.3.160.239 TCP 64 http > 33379 [FIN, ACK] Seq=643 Ack=1068 Win=49640 Len=0
123489  43.924201 244.3.31.108 -> 244.3.160.239 TCP 66 http > 33629 [SYN, ACK] Seq=0 Ack=1 Win=49640 Len=0 MSS=1460 SACK_PERM=1
123496  43.925042 244.3.31.108 -> 244.3.160.239 TCP 64 http > 33629 [ACK] Seq=1 Ack=1123 Win=49640 Len=0
124562  44.452626 244.3.31.108 -> 244.3.160.239 TCP 64 http > 33629 [ACK] Seq=679 Ack=1124 Win=49640 Len=0
124563  44.452630 244.3.31.108 -> 244.3.160.239 TCP 64 http > 33629 [FIN, ACK] Seq=679 Ack=1124 Win=49640 Len=0
232838  80.503771 244.3.31.108 -> 244.3.160.239 TCP 70 8717 > http [SYN] Seq=0 Win=49640 Len=0 MSS=1460 WS=1 SACK_PERM=1
232841  80.504253 244.3.31.108 -> 244.3.160.239 TCP 64 8717 > http [ACK] Seq=1 Ack=1 Win=49640 Len=0
232885  80.513425 244.3.31.108 -> 244.3.160.239 TCP 64 8717 > http [ACK] Seq=188 Ack=578 Win=49640 Len=0
232886  80.513456 244.3.31.108 -> 244.3.160.239 TCP 64 8717 > http [ACK] Seq=188 Ack=579 Win=49640 Len=0
232888  80.514621 244.3.31.108 -> 244.3.160.239 TCP 64 8717 > http [FIN, ACK] Seq=188 Ack=579 Win=49640 Len=0
232905  80.516433 244.3.31.108 -> 244.3.160.239 TCP 70 7907 > http [SYN] Seq=0 Win=49640 Len=0 MSS=1460 WS=1 SACK_PERM=1
232908  80.516893 244.3.31.108 -> 244.3.160.239 TCP 64 7907 > http [ACK] Seq=1 Ack=1 Win=49640 Len=0
232930  80.524931 244.3.31.108 -> 244.3.160.239 TCP 64 7907 > http [ACK] Seq=205 Ack=704 Win=49640 Len=0
232931  80.524936 244.3.31.108 -> 244.3.160.239 TCP 64 7907 > http [ACK] Seq=205 Ack=705 Win=49640 Len=0
232932  80.525784 244.3.31.108 -> 244.3.160.239 TCP 64 7907 > http [FIN, ACK] Seq=205 Ack=705 Win=49640 Len=0
232934  80.526514 244.3.31.108 -> 244.3.160.239 TCP 70 9273 > http [SYN] Seq=0 Win=49640 Len=0 MSS=1460 WS=1 SACK_PERM=1
232937  80.527007 244.3.31.108 -> 244.3.160.239 TCP 64 9273 > http [ACK] Seq=1 Ack=1 Win=49640 Len=0
232945  80.531525 244.3.31.108 -> 244.3.160.239 TCP 64 9273 > http [ACK] Seq=232 Ack=704 Win=49640 Len=0
232946  80.531547 244.3.31.108 -> 244.3.160.239 TCP 64 9273 > http [ACK] Seq=232 Ack=705 Win=49640 Len=0
232950  80.532291 244.3.31.108 -> 244.3.160.239 TCP 64 9273 > http [FIN, ACK] Seq=232 Ack=705 Win=49640 Len=0
232956  80.533075 244.3.31.108 -> 244.3.160.239 TCP 70 cops > http [SYN] Seq=0 Win=49640 Len=0 MSS=1460 WS=1 SACK_PERM=1
232958  80.533536 244.3.31.108 -> 244.3.160.239 TCP 64 cops > http [ACK] Seq=1 Ack=1 Win=49640 Len=0
233048  80.548904 244.3.31.108 -> 244.3.160.239 TCP 64 cops > http [ACK] Seq=232 Ack=1461 Win=48180 Len=0
233049  80.548909 244.3.31.108 -> 244.3.160.239 TCP 64 cops > http [ACK] Seq=232 Ack=2050 Win=49640 Len=0
233071  80.560377 244.3.31.108 -> 244.3.160.239 TCP 64 cops > http [ACK] Seq=232 Ack=4099 Win=49640 Len=0
233086  80.561606 244.3.31.108 -> 244.3.160.239 TCP 64 cops > http [ACK] Seq=232 Ack=4269 Win=49640 Len=0
233087  80.561611 244.3.31.108 -> 244.3.160.239 TCP 64 cops > http [FIN, ACK] Seq=232 Ack=4269 Win=49640 Len=0
325898 112.392646 244.3.31.108 -> 244.3.160.239 TCP 70 4336 > http [SYN] Seq=0 Win=49640 Len=0 MSS=1460 WS=1 SACK_PERM=1
325900 112.393328 244.3.31.108 -> 244.3.160.239 TCP 64 4336 > http [ACK] Seq=1 Ack=1 Win=49640 Len=0
325919 112.401976 244.3.31.108 -> 244.3.160.239 TCP 64 4336 > http [ACK] Seq=188 Ack=578 Win=49640 Len=0
325920 112.402023 244.3.31.108 -> 244.3.160.239 TCP 64 4336 > http [ACK] Seq=188 Ack=579 Win=49640 Len=0
325926 112.403370 244.3.31.108 -> 244.3.160.239 TCP 64 4336 > http [FIN, ACK] Seq=188 Ack=579 Win=49640 Len=0
325945 112.405012 244.3.31.108 -> 244.3.160.239 TCP 70 4512 > http [SYN] Seq=0 Win=49640 Len=0 MSS=1460 WS=1 SACK_PERM=1
325947 112.405373 244.3.31.108 -> 244.3.160.239 TCP 64 4512 > http [ACK] Seq=1 Ack=1 Win=49640 Len=0
325963 112.412280 244.3.31.108 -> 244.3.160.239 TCP 64 4512 > http [ACK] Seq=205 Ack=704 Win=49640 Len=0
325964 112.412284 244.3.31.108 -> 244.3.160.239 TCP 64 4512 > http [ACK] Seq=205 Ack=705 Win=49640 Len=0
325965 112.412737 244.3.31.108 -> 244.3.160.239 TCP 64 4512 > http [FIN, ACK] Seq=205 Ack=705 Win=49640 Len=0
325968 112.413693 244.3.31.108 -> 244.3.160.239 TCP 70 10167 > http [SYN] Seq=0 Win=49640 Len=0 MSS=1460 WS=1 SACK_PERM=1
325970 112.414126 244.3.31.108 -> 244.3.160.239 TCP 64 10167 > http [ACK] Seq=1 Ack=1 Win=49640 Len=0
325975 112.418583 244.3.31.108 -> 244.3.160.239 TCP 64 10167 > http [ACK] Seq=232 Ack=704 Win=49640 Len=0
325976 112.418587 244.3.31.108 -> 244.3.160.239 TCP 64 10167 > http [ACK] Seq=232 Ack=705 Win=49640 Len=0
325977 112.419117 244.3.31.108 -> 244.3.160.239 TCP 64 10167 > http [FIN, ACK] Seq=232 Ack=705 Win=49640 Len=0
325979 112.420127 244.3.31.108 -> 244.3.160.239 TCP 70 15969 > http [SYN] Seq=0 Win=49640 Len=0 MSS=1460 WS=1 SACK_PERM=1
325981 112.420733 244.3.31.108 -> 244.3.160.239 TCP 64 15969 > http [ACK] Seq=1 Ack=1 Win=49640 Len=0
325992 112.436091 244.3.31.108 -> 244.3.160.239 TCP 64 15969 > http [ACK] Seq=232 Ack=1461 Win=48180 Len=0
325993 112.436096 244.3.31.108 -> 244.3.160.239 TCP 64 15969 > http [ACK] Seq=232 Ack=2050 Win=49640 Len=0
325998 112.447862 244.3.31.108 -> 244.3.160.239 TCP 64 15969 > http [ACK] Seq=232 Ack=4099 Win=49640 Len=0
326001 112.448804 244.3.31.108 -> 244.3.160.239 TCP 64 15969 > http [ACK] Seq=232 Ack=4269 Win=49640 Len=0
326002 112.448960 244.3.31.108 -> 244.3.160.239 TCP 64 15969 > http [FIN, ACK] Seq=232 Ack=4269 Win=49640 Len=0
351429 118.801634 244.3.31.108 -> 244.3.160.239 TCP 66 http > 34167 [SYN, ACK] Seq=0 Ack=1 Win=49640 Len=0 MSS=1460 SACK_PERM=1
351436 118.802585 244.3.31.108 -> 244.3.160.239 TCP 64 http > 34167 [ACK] Seq=1 Ack=1067 Win=48574 Len=0
353092 119.901459 244.3.31.108 -> 244.3.160.239 TCP 64 http > 34167 [ACK] Seq=643 Ack=1068 Win=49640 Len=0
353093 119.901466 244.3.31.108 -> 244.3.160.239 TCP 64 http > 34167 [FIN, ACK] Seq=643 Ack=1068 Win=49640 Len=0
524301 170.360204 244.3.31.108 -> 244.3.160.239 TCP 66 http > 34624 [SYN, ACK] Seq=0 Ack=1 Win=49640 Len=0 MSS=1460 SACK_PERM=1
524310 170.361089 244.3.31.108 -> 244.3.160.239 TCP 64 http > 34624 [ACK] Seq=1 Ack=1064 Win=48577 Len=0
524326 170.363450 244.3.31.108 -> 244.3.160.239 TCP 64 http > 34624 [ACK] Seq=1 Ack=2524 Win=47117 Len=0
524333 170.364687 244.3.31.108 -> 244.3.160.239 TCP 64 [TCP Window Update] http > 34624 [ACK] Seq=1 Ack=2524 Win=49640 Len=0
524991 170.494560 244.3.31.108 -> 244.3.160.239 TCP 64 http > 34624 [ACK] Seq=1 Ack=3363 Win=49640 Len=0
527762 171.476898 244.3.31.108 -> 244.3.160.239 TCP 70 kofax-svr > http [SYN] Seq=0 Win=49640 Len=0 MSS=1460 WS=1 SACK_PERM=1
527764 171.477239 244.3.31.108 -> 244.3.160.239 TCP 64 kofax-svr > http [ACK] Seq=1 Ack=1 Win=49640 Len=0
527821 171.486168 244.3.31.108 -> 244.3.160.239 TCP 64 kofax-svr > http [ACK] Seq=188 Ack=578 Win=49640 Len=0
527822 171.486173 244.3.31.108 -> 244.3.160.239 TCP 64 kofax-svr > http [ACK] Seq=188 Ack=579 Win=49640 Len=0
527831 171.487308 244.3.31.108 -> 244.3.160.239 TCP 64 kofax-svr > http [FIN, ACK] Seq=188 Ack=579 Win=49640 Len=0
527842 171.489050 244.3.31.108 -> 244.3.160.239 TCP 70 ciphire-data > http [SYN] Seq=0 Win=49640 Len=0 MSS=1460 WS=1 SACK_PERM=1
527847 171.489624 244.3.31.108 -> 244.3.160.239 TCP 64 ciphire-data > http [ACK] Seq=1 Ack=1 Win=49640 Len=0
527888 171.495970 244.3.31.108 -> 244.3.160.239 TCP 64 ciphire-data > http [ACK] Seq=205 Ack=704 Win=49640 Len=0
527889 171.495975 244.3.31.108 -> 244.3.160.239 TCP 64 ciphire-data > http [ACK] Seq=205 Ack=705 Win=49640 Len=0
527894 171.496650 244.3.31.108 -> 244.3.160.239 TCP 64 ciphire-data > http [FIN, ACK] Seq=205 Ack=705 Win=49640 Len=0
527896 171.497639 244.3.31.108 -> 244.3.160.239 TCP 70 6465 > http [SYN] Seq=0 Win=49640 Len=0 MSS=1460 WS=1 SACK_PERM=1
527902 171.498236 244.3.31.108 -> 244.3.160.239 TCP 64 6465 > http [ACK] Seq=1 Ack=1 Win=49640 Len=0
527922 171.503273 244.3.31.108 -> 244.3.160.239 TCP 64 6465 > http [ACK] Seq=232 Ack=704 Win=49640 Len=0
527923 171.503278 244.3.31.108 -> 244.3.160.239 TCP 64 6465 > http [ACK] Seq=232 Ack=705 Win=49640 Len=0
527929 171.503842 244.3.31.108 -> 244.3.160.239 TCP 64 6465 > http [FIN, ACK] Seq=232 Ack=705 Win=49640 Len=0
527936 171.504911 244.3.31.108 -> 244.3.160.239 TCP 70 sccip-media > http [SYN] Seq=0 Win=49640 Len=0 MSS=1460 WS=1 SACK_PERM=1
527939 171.505390 244.3.31.108 -> 244.3.160.239 TCP 64 sccip-media > http [ACK] Seq=1 Ack=1 Win=49640 Len=0
527985 171.521092 244.3.31.108 -> 244.3.160.239 TCP 64 sccip-media > http [ACK] Seq=232 Ack=1461 Win=48180 Len=0
527986 171.521097 244.3.31.108 -> 244.3.160.239 TCP 64 sccip-media > http [ACK] Seq=232 Ack=2050 Win=49640 Len=0
528010 171.532698 244.3.31.108 -> 244.3.160.239 TCP 64 sccip-media > http [ACK] Seq=232 Ack=4099 Win=49640 Len=0
528017 171.533918 244.3.31.108 -> 244.3.160.239 TCP 64 sccip-media > http [ACK] Seq=232 Ack=4269 Win=49640 Len=0
528018 171.534087 244.3.31.108 -> 244.3.160.239 TCP 64 sccip-media > http [FIN, ACK] Seq=232 Ack=4269 Win=49640 Len=0
533218 172.911743 244.3.31.108 -> 244.3.160.239 TCP 76 [TCP segment of a reassembled PDU]
533290 172.939310 244.3.31.108 -> 244.3.160.239 TCP 66 http > 34663 [SYN, ACK] Seq=0 Ack=1 Win=49640 Len=0 MSS=1460 SACK_PERM=1
533298 172.940193 244.3.31.108 -> 244.3.160.239 TCP 64 http > 34663 [ACK] Seq=1 Ack=737 Win=48904 Len=0
533791 173.051533 244.3.31.108 -> 244.3.160.239 TCP 64 http > 34624 [ACK] Seq=40899 Ack=3364 Win=49640 Len=0
533792 173.051538 244.3.31.108 -> 244.3.160.239 TCP 64 http > 34624 [FIN, ACK] Seq=40899 Ack=3364 Win=49640 Len=0
533970 173.115927 244.3.31.108 -> 244.3.160.239 TCP 66 http > 34668 [SYN, ACK] Seq=0 Ack=1 Win=49640 Len=0 MSS=1460 SACK_PERM=1
533972 173.116087 244.3.31.108 -> 244.3.160.239 TCP 66 http > 34669 [SYN, ACK] Seq=0 Ack=1 Win=49640 Len=0 MSS=1460 SACK_PERM=1
533976 173.116797 244.3.31.108 -> 244.3.160.239 TCP 64 http > 34668 [ACK] Seq=1 Ack=730 Win=48911 Len=0
533977 173.116801 244.3.31.108 -> 244.3.160.239 TCP 64 http > 34669 [ACK] Seq=1 Ack=735 Win=48906 Len=0
534005 173.125575 244.3.31.108 -> 244.3.160.239 TCP 64 http > 34663 [ACK] Seq=1989 Ack=738 Win=49640 Len=0
534011 173.125802 244.3.31.108 -> 244.3.160.239 TCP 64 http > 34663 [FIN, ACK] Seq=1989 Ack=738 Win=49640 Len=0
534529 173.233119 244.3.31.108 -> 244.3.160.239 TCP 64 http > 34668 [ACK] Seq=3196 Ack=731 Win=49640 Len=0
534530 173.233124 244.3.31.108 -> 244.3.160.239 TCP 64 http > 34669 [ACK] Seq=5706 Ack=736 Win=49640 Len=0
534532 173.233181 244.3.31.108 -> 244.3.160.239 TCP 64 http > 34668 [FIN, ACK] Seq=3196 Ack=731 Win=49640 Len=0
534533 173.233185 244.3.31.108 -> 244.3.160.239 TCP 64 http > 34669 [FIN, ACK] Seq=5706 Ack=736 Win=49640 Len=0
535040 173.295821 244.3.31.108 -> 244.3.160.239 TCP 66 http > 34670 [SYN, ACK] Seq=0 Ack=1 Win=49640 Len=0 MSS=1460 SACK_PERM=1
535044 173.296555 244.3.31.108 -> 244.3.160.239 TCP 64 http > 34670 [ACK] Seq=1 Ack=734 Win=48907 Len=0
535634 173.412328 244.3.31.108 -> 244.3.160.239 TCP 64 http > 34670 [ACK] Seq=6912 Ack=735 Win=49640 Len=0
535635 173.412332 244.3.31.108 -> 244.3.160.239 TCP 64 http > 34670 [FIN, ACK] Seq=6912 Ack=735 Win=49640 Len=0
535844 173.477415 244.3.31.108 -> 244.3.160.239 TCP 66 http > 34672 [SYN, ACK] Seq=0 Ack=1 Win=49640 Len=0 MSS=1460 SACK_PERM=1
535847 173.478330 244.3.31.108 -> 244.3.160.239 TCP 64 http > 34672 [ACK] Seq=1 Ack=736 Win=48905 Len=0
536068 173.573400 244.3.31.108 -> 244.3.160.239 TCP 64 http > 34672 [ACK] Seq=12347 Ack=737 Win=49640 Len=0
536069 173.573405 244.3.31.108 -> 244.3.160.239 TCP 64 http > 34672 [FIN, ACK] Seq=12347 Ack=737 Win=49640 Len=0
537760 174.092290 244.3.31.108 -> 244.3.160.239 TCP 66 http > 34681 [SYN, ACK] Seq=0 Ack=1 Win=49640 Len=0 MSS=1460 SACK_PERM=1
537763 174.093117 244.3.31.108 -> 244.3.160.239 TCP 64 http > 34681 [ACK] Seq=1 Ack=738 Win=48903 Len=0
537772 174.095491 244.3.31.108 -> 244.3.160.239 TCP 66 http > 34683 [SYN, ACK] Seq=0 Ack=1 Win=49640 Len=0 MSS=1460 SACK_PERM=1
537778 174.096290 244.3.31.108 -> 244.3.160.239 TCP 64 http > 34683 [ACK] Seq=1 Ack=744 Win=48897 Len=0
538161 174.281918 244.3.31.108 -> 244.3.160.239 TCP 64 http > 34681 [ACK] Seq=1021 Ack=739 Win=49640 Len=0
538162 174.281922 244.3.31.108 -> 244.3.160.239 TCP 64 http > 34681 [FIN, ACK] Seq=1021 Ack=739 Win=49640 Len=0
538166 174.282270 244.3.31.108 -> 244.3.160.239 TCP 64 http > 34683 [ACK] Seq=662 Ack=745 Win=49640 Len=0
538167 174.282360 244.3.31.108 -> 244.3.160.239 TCP 64 http > 34683 [FIN, ACK] Seq=662 Ack=745 Win=49640 Len=0
538208 174.287333 244.3.31.108 -> 244.3.160.239 TCP 66 http > 34685 [SYN, ACK] Seq=0 Ack=1 Win=49640 Len=0 MSS=1460 SACK_PERM=1
538215 174.288136 244.3.31.108 -> 244.3.160.239 TCP 64 http > 34685 [ACK] Seq=1 Ack=659 Win=48982 Len=0
538545 174.501558 244.3.31.108 -> 244.3.160.239 TCP 64 http > 34685 [ACK] Seq=1731 Ack=660 Win=49640 Len=0
538546 174.501563 244.3.31.108 -> 244.3.160.239 TCP 64 http > 34685 [FIN, ACK] Seq=1731 Ack=660 Win=49640 Len=0
569169 181.846111 244.3.31.108 -> 244.3.160.239 TCP 66 http > 34740 [SYN, ACK] Seq=0 Ack=1 Win=49640 Len=0 MSS=1460 SACK_PERM=1
569172 181.847042 244.3.31.108 -> 244.3.160.239 TCP 64 http > 34740 [ACK] Seq=1 Ack=983 Win=48658 Len=0
571129 182.386319 244.3.31.108 -> 244.3.160.239 TCP 64 http > 34740 [ACK] Seq=715 Ack=984 Win=49640 Len=0
571130 182.386360 244.3.31.108 -> 244.3.160.239 TCP 64 http > 34740 [FIN, ACK] Seq=715 Ack=984 Win=49640 Len=0
718111 229.270318 244.3.31.108 -> 244.3.160.239 TCP 66 http > 35068 [SYN, ACK] Seq=0 Ack=1 Win=49640 Len=0 MSS=1460 SACK_PERM=1
718143 229.271861 244.3.31.108 -> 244.3.160.239 TCP 64 http > 35068 [ACK] Seq=1 Ack=983 Win=48658 Len=0
719805 229.735271 244.3.31.108 -> 244.3.160.239 TCP 64 http > 35068 [ACK] Seq=715 Ack=984 Win=49640 Len=0
719806 229.735333 244.3.31.108 -> 244.3.160.239 TCP 64 http > 35068 [FIN, ACK] Seq=715 Ack=984 Win=49640 Len=0
820378 267.708627 244.3.31.108 -> 244.3.160.239 TCP 70 6931 > http [SYN] Seq=0 Win=49640 Len=0 MSS=1460 WS=1 SACK_PERM=1
820381 267.709337 244.3.31.108 -> 244.3.160.239 TCP 64 6931 > http [ACK] Seq=1 Ack=1 Win=49640 Len=0
820389 267.711413 244.3.31.108 -> 244.3.160.239 TCP 64 6931 > http [ACK] Seq=188 Ack=578 Win=49640 Len=0
820390 267.711418 244.3.31.108 -> 244.3.160.239 TCP 64 6931 > http [ACK] Seq=188 Ack=579 Win=49640 Len=0
820395 267.712520 244.3.31.108 -> 244.3.160.239 TCP 64 6931 > http [FIN, ACK] Seq=188 Ack=579 Win=49640 Len=0
820400 267.713562 244.3.31.108 -> 244.3.160.239 TCP 70 15128 > http [SYN] Seq=0 Win=49640 Len=0 MSS=1460 WS=1 SACK_PERM=1
820403 267.713932 244.3.31.108 -> 244.3.160.239 TCP 64 15128 > http [ACK] Seq=1 Ack=1 Win=49640 Len=0
820435 267.721275 244.3.31.108 -> 244.3.160.239 TCP 64 15128 > http [ACK] Seq=205 Ack=704 Win=49640 Len=0
820436 267.721280 244.3.31.108 -> 244.3.160.239 TCP 64 15128 > http [ACK] Seq=205 Ack=705 Win=49640 Len=0
820440 267.722127 244.3.31.108 -> 244.3.160.239 TCP 64 15128 > http [FIN, ACK] Seq=205 Ack=705 Win=49640 Len=0
820443 267.723019 244.3.31.108 -> 244.3.160.239 TCP 70 9969 > http [SYN] Seq=0 Win=49640 Len=0 MSS=1460 WS=1 SACK_PERM=1
820446 267.723550 244.3.31.108 -> 244.3.160.239 TCP 64 9969 > http [ACK] Seq=1 Ack=1 Win=49640 Len=0
820459 267.727890 244.3.31.108 -> 244.3.160.239 TCP 64 9969 > http [ACK] Seq=232 Ack=704 Win=49640 Len=0
820461 267.728384 244.3.31.108 -> 244.3.160.239 TCP 64 9969 > http [ACK] Seq=232 Ack=705 Win=49640 Len=0
820462 267.728529 244.3.31.108 -> 244.3.160.239 TCP 64 9969 > http [FIN, ACK] Seq=232 Ack=705 Win=49640 Len=0
820465 267.729511 244.3.31.108 -> 244.3.160.239 TCP 70 8914 > http [SYN] Seq=0 Win=49640 Len=0 MSS=1460 WS=1 SACK_PERM=1
820467 267.729954 244.3.31.108 -> 244.3.160.239 TCP 64 8914 > http [ACK] Seq=1 Ack=1 Win=49640 Len=0
820510 267.747257 244.3.31.108 -> 244.3.160.239 TCP 64 8914 > http [ACK] Seq=232 Ack=1461 Win=48180 Len=0
820511 267.747261 244.3.31.108 -> 244.3.160.239 TCP 64 8914 > http [ACK] Seq=232 Ack=2050 Win=49640 Len=0
820528 267.759006 244.3.31.108 -> 244.3.160.239 TCP 64 8914 > http [ACK] Seq=232 Ack=4099 Win=49640 Len=0
820531 267.760128 244.3.31.108 -> 244.3.160.239 TCP 64 8914 > http [ACK] Seq=232 Ack=4269 Win=49640 Len=0
820532 267.760396 244.3.31.108 -> 244.3.160.239 TCP 64 8914 > http [FIN, ACK] Seq=232 Ack=4269 Win=49640 Len=0
846074 278.769218 244.3.31.108 -> 244.3.160.239 TCP 66 http > 35310 [SYN, ACK] Seq=0 Ack=1 Win=49640 Len=0 MSS=1460 SACK_PERM=1
846079 278.770431 244.3.31.108 -> 244.3.160.239 TCP 64 http > 35310 [ACK] Seq=1 Ack=584 Win=49057 Len=0
846098 278.776505 244.3.31.108 -> 244.3.160.239 TCP 64 http > 35310 [ACK] Seq=110 Ack=585 Win=49640 Len=0
846099 278.776510 244.3.31.108 -> 244.3.160.239 TCP 64 http > 35310 [FIN, ACK] Seq=110 Ack=585 Win=49640 Len=0
879888 292.705454 244.3.31.108 -> 244.3.160.239 TCP 70 3371 > http [SYN] Seq=0 Win=49640 Len=0 MSS=1460 WS=1 SACK_PERM=1
879893 292.705875 244.3.31.108 -> 244.3.160.239 TCP 64 3371 > http [ACK] Seq=1 Ack=1 Win=49640 Len=0
879930 292.714867 244.3.31.108 -> 244.3.160.239 TCP 64 3371 > http [ACK] Seq=188 Ack=578 Win=49640 Len=0
879931 292.714872 244.3.31.108 -> 244.3.160.239 TCP 64 3371 > http [ACK] Seq=188 Ack=579 Win=49640 Len=0
879932 292.716080 244.3.31.108 -> 244.3.160.239 TCP 64 3371 > http [FIN, ACK] Seq=188 Ack=579 Win=49640 Len=0
879935 292.717766 244.3.31.108 -> 244.3.160.239 TCP 70 espeech-rtp > http [SYN] Seq=0 Win=49640 Len=0 MSS=1460 WS=1 SACK_PERM=1
879937 292.718152 244.3.31.108 -> 244.3.160.239 TCP 64 espeech-rtp > http [ACK] Seq=1 Ack=1 Win=49640 Len=0
879942 292.726167 244.3.31.108 -> 244.3.160.239 TCP 64 espeech-rtp > http [ACK] Seq=205 Ack=704 Win=49640 Len=0
879943 292.726173 244.3.31.108 -> 244.3.160.239 TCP 64 espeech-rtp > http [ACK] Seq=205 Ack=705 Win=49640 Len=0
879946 292.726883 244.3.31.108 -> 244.3.160.239 TCP 64 espeech-rtp > http [FIN, ACK] Seq=205 Ack=705 Win=49640 Len=0
879948 292.727774 244.3.31.108 -> 244.3.160.239 TCP 70 16351 > http [SYN] Seq=0 Win=49640 Len=0 MSS=1460 WS=1 SACK_PERM=1
879950 292.728129 244.3.31.108 -> 244.3.160.239 TCP 64 16351 > http [ACK] Seq=1 Ack=1 Win=49640 Len=0
879978 292.734684 244.3.31.108 -> 244.3.160.239 TCP 64 16351 > http [ACK] Seq=232 Ack=704 Win=49640 Len=0
879979 292.734689 244.3.31.108 -> 244.3.160.239 TCP 64 16351 > http [ACK] Seq=232 Ack=705 Win=49640 Len=0
879980 292.735278 244.3.31.108 -> 244.3.160.239 TCP 64 16351 > http [FIN, ACK] Seq=232 Ack=705 Win=49640 Len=0
879983 292.736444 244.3.31.108 -> 244.3.160.239 TCP 70 12167 > http [SYN] Seq=0 Win=49640 Len=0 MSS=1460 WS=1 SACK_PERM=1
879985 292.737027 244.3.31.108 -> 244.3.160.239 TCP 64 12167 > http [ACK] Seq=1 Ack=1 Win=49640 Len=0
880043 292.752455 244.3.31.108 -> 244.3.160.239 TCP 64 12167 > http [ACK] Seq=232 Ack=1461 Win=48180 Len=0
880044 292.752459 244.3.31.108 -> 244.3.160.239 TCP 64 12167 > http [ACK] Seq=232 Ack=2050 Win=49640 Len=0
880075 292.764097 244.3.31.108 -> 244.3.160.239 TCP 64 12167 > http [ACK] Seq=232 Ack=4099 Win=49640 Len=0
880079 292.765319 244.3.31.108 -> 244.3.160.239 TCP 64 12167 > http [ACK] Seq=232 Ack=4269 Win=49640 Len=0
880080 292.765602 244.3.31.108 -> 244.3.160.239 TCP 64 12167 > http [FIN, ACK] Seq=232 Ack=4269 Win=49640 Len=0
982224 328.235679 244.3.31.108 -> 244.3.160.239 TCP 66 http > 35432 [SYN, ACK] Seq=0 Ack=1 Win=49640 Len=0 MSS=1460 SACK_PERM=1
982231 328.236531 244.3.31.108 -> 244.3.160.239 TCP 64 http > 35432 [ACK] Seq=1 Ack=1067 Win=48574 Len=0
989360 329.870980 244.3.31.108 -> 244.3.160.239 TCP 64 http > 35432 [ACK] Seq=27857 Ack=1068 Win=49640 Len=0
989361 329.871110 244.3.31.108 -> 244.3.160.239 TCP 64 http > 35432 [FIN, ACK] Seq=27857 Ack=1068 Win=49640 Len=0
989511 329.909968 244.3.31.108 -> 244.3.160.239 TCP 66 http > 35435 [SYN, ACK] Seq=0 Ack=1 Win=49640 Len=0 MSS=1460 SACK_PERM=1
989516 329.911069 244.3.31.108 -> 244.3.160.239 TCP 66 http > 35436 [SYN, ACK] Seq=0 Ack=1 Win=49640 Len=0 MSS=1460 SACK_PERM=1
989529 329.911646 244.3.31.108 -> 244.3.160.239 TCP 64 http > 35435 [ACK] Seq=1 Ack=1018 Win=49640 Len=0
989545 329.913384 244.3.31.108 -> 244.3.160.239 TCP 64 http > 35436 [ACK] Seq=1 Ack=1011 Win=48630 Len=0
989573 329.918693 244.3.31.108 -> 244.3.160.239 TCP 66 http > 35438 [SYN, ACK] Seq=0 Ack=1 Win=49640 Len=0 MSS=1460 SACK_PERM=1
989585 329.920366 244.3.31.108 -> 244.3.160.239 TCP 64 http > 35438 [ACK] Seq=1 Ack=1001 Win=48640 Len=0
989837 330.044392 244.3.31.108 -> 244.3.160.239 TCP 66 http > 35439 [SYN, ACK] Seq=0 Ack=1 Win=49640 Len=0 MSS=1460 SACK_PERM=1
989840 330.045453 244.3.31.108 -> 244.3.160.239 TCP 64 http > 35439 [ACK] Seq=1 Ack=1000 Win=48641 Len=0
989946 330.129598 244.3.31.108 -> 244.3.160.239 TCP 64 http > 35435 [ACK] Seq=1989 Ack=1019 Win=49640 Len=0
989947 330.129624 244.3.31.108 -> 244.3.160.239 TCP 64 http > 35435 [FIN, ACK] Seq=1989 Ack=1019 Win=49640 Len=0
989953 330.130051 244.3.31.108 -> 244.3.160.239 TCP 64 http > 35436 [ACK] Seq=3196 Ack=1012 Win=49640 Len=0
989955 330.130161 244.3.31.108 -> 244.3.160.239 TCP 64 http > 35436 [FIN, ACK] Seq=3196 Ack=1012 Win=49640 Len=0
989958 330.130379 244.3.31.108 -> 244.3.160.239 TCP 64 http > 35438 [ACK] Seq=5706 Ack=1002 Win=49640 Len=0
989959 330.130423 244.3.31.108 -> 244.3.160.239 TCP 64 http > 35438 [FIN, ACK] Seq=5706 Ack=1002 Win=49640 Len=0
989981 330.139345 244.3.31.108 -> 244.3.160.239 TCP 66 http > 35440 [SYN, ACK] Seq=0 Ack=1 Win=49640 Len=0 MSS=1460 SACK_PERM=1
989984 330.140227 244.3.31.108 -> 244.3.160.239 TCP 64 http > 35440 [ACK] Seq=1 Ack=1002 Win=48639 Len=0
990069 330.239570 244.3.31.108 -> 244.3.160.239 TCP 64 http > 35439 [ACK] Seq=6912 Ack=1001 Win=49640 Len=0
990070 330.239791 244.3.31.108 -> 244.3.160.239 TCP 64 http > 35439 [FIN, ACK] Seq=6912 Ack=1001 Win=49640 Len=0
990394 330.349655 244.3.31.108 -> 244.3.160.239 TCP 64 http > 35440 [ACK] Seq=12347 Ack=1003 Win=49640 Len=0
990395 330.349884 244.3.31.108 -> 244.3.160.239 TCP 64 http > 35440 [FIN, ACK] Seq=12347 Ack=1003 Win=49640 Len=0
991072 330.542737 244.3.31.108 -> 244.3.160.239 TCP 66 http > 35449 [SYN, ACK] Seq=0 Ack=1 Win=49640 Len=0 MSS=1460 SACK_PERM=1
991073 330.542741 244.3.31.108 -> 244.3.160.239 TCP 66 http > 35450 [SYN, ACK] Seq=0 Ack=1 Win=49640 Len=0 MSS=1460 SACK_PERM=1
991090 330.545860 244.3.31.108 -> 244.3.160.239 TCP 64 http > 35450 [ACK] Seq=1 Ack=1034 Win=49640 Len=0
991096 330.546290 244.3.31.108 -> 244.3.160.239 TCP 64 http > 35449 [ACK] Seq=1 Ack=1040 Win=49640 Len=0
991330 330.640470 244.3.31.108 -> 244.3.160.239 TCP 64 http > 35450 [ACK] Seq=1021 Ack=1035 Win=49640 Len=0
991336 330.640685 244.3.31.108 -> 244.3.160.239 TCP 64 http > 35450 [FIN, ACK] Seq=1021 Ack=1035 Win=49640 Len=0
991341 330.640960 244.3.31.108 -> 244.3.160.239 TCP 64 http > 35449 [ACK] Seq=662 Ack=1041 Win=49640 Len=0
991343 330.641089 244.3.31.108 -> 244.3.160.239 TCP 64 http > 35449 [FIN, ACK] Seq=662 Ack=1041 Win=49640 Len=0
991566 330.732550 244.3.31.108 -> 244.3.160.239 TCP 66 http > 35451 [SYN, ACK] Seq=0 Ack=1 Win=49640 Len=0 MSS=1460 SACK_PERM=1
991569 330.733391 244.3.31.108 -> 244.3.160.239 TCP 64 http > 35451 [ACK] Seq=1 Ack=757 Win=48884 Len=0
991885 330.859599 244.3.31.108 -> 244.3.160.239 TCP 64 http > 35451 [ACK] Seq=1731 Ack=758 Win=49640 Len=0
991886 330.859604 244.3.31.108 -> 244.3.160.239 TCP 64 http > 35451 [FIN, ACK] Seq=1731 Ack=758 Win=49640 Len=0
1007063 337.276455 244.3.31.108 -> 244.3.160.239 TCP 70 14182 > http [SYN] Seq=0 Win=49640 Len=0 MSS=1460 WS=1 SACK_PERM=1
1007065 337.276972 244.3.31.108 -> 244.3.160.239 TCP 64 14182 > http [ACK] Seq=1 Ack=1 Win=49640 Len=0
1007092 337.286196 244.3.31.108 -> 244.3.160.239 TCP 64 14182 > http [ACK] Seq=188 Ack=578 Win=49640 Len=0
1007094 337.286291 244.3.31.108 -> 244.3.160.239 TCP 64 14182 > http [ACK] Seq=188 Ack=579 Win=49640 Len=0
1007095 337.287492 244.3.31.108 -> 244.3.160.239 TCP 64 14182 > http [FIN, ACK] Seq=188 Ack=579 Win=49640 Len=0
1007102 337.289390 244.3.31.108 -> 244.3.160.239 TCP 70 12351 > http [SYN] Seq=0 Win=49640 Len=0 MSS=1460 WS=1 SACK_PERM=1
1007106 337.289930 244.3.31.108 -> 244.3.160.239 TCP 64 12351 > http [ACK] Seq=1 Ack=1 Win=49640 Len=0
1007124 337.297793 244.3.31.108 -> 244.3.160.239 TCP 64 12351 > http [ACK] Seq=205 Ack=704 Win=49640 Len=0
1007125 337.297798 244.3.31.108 -> 244.3.160.239 TCP 64 12351 > http [ACK] Seq=205 Ack=705 Win=49640 Len=0
1007127 337.298517 244.3.31.108 -> 244.3.160.239 TCP 64 12351 > http [FIN, ACK] Seq=205 Ack=705 Win=49640 Len=0
1007129 337.299516 244.3.31.108 -> 244.3.160.239 TCP 70 10448 > http [SYN] Seq=0 Win=49640 Len=0 MSS=1460 WS=1 SACK_PERM=1
1007135 337.300375 244.3.31.108 -> 244.3.160.239 TCP 64 10448 > http [ACK] Seq=1 Ack=1 Win=49640 Len=0
1007141 337.304901 244.3.31.108 -> 244.3.160.239 TCP 64 10448 > http [ACK] Seq=232 Ack=704 Win=49640 Len=0
1007142 337.304906 244.3.31.108 -> 244.3.160.239 TCP 64 10448 > http [ACK] Seq=232 Ack=705 Win=49640 Len=0
1007143 337.305685 244.3.31.108 -> 244.3.160.239 TCP 64 10448 > http [FIN, ACK] Seq=232 Ack=705 Win=49640 Len=0
1007145 337.306549 244.3.31.108 -> 244.3.160.239 TCP 70 scipticslsrvr > http [SYN] Seq=0 Win=49640 Len=0 MSS=1460 WS=1 SACK_PERM=1
1007149 337.306980 244.3.31.108 -> 244.3.160.239 TCP 64 scipticslsrvr > http [ACK] Seq=1 Ack=1 Win=49640 Len=0
1007169 337.322252 244.3.31.108 -> 244.3.160.239 TCP 64 scipticslsrvr > http [ACK] Seq=232 Ack=1461 Win=48180 Len=0
1007170 337.322524 244.3.31.108 -> 244.3.160.239 TCP 64 scipticslsrvr > http [ACK] Seq=232 Ack=2050 Win=49640 Len=0
1007223 337.333890 244.3.31.108 -> 244.3.160.239 TCP 64 scipticslsrvr > http [ACK] Seq=232 Ack=4099 Win=49640 Len=0
1007228 337.335147 244.3.31.108 -> 244.3.160.239 TCP 64 scipticslsrvr > http [ACK] Seq=232 Ack=4269 Win=49640 Len=0
1007229 337.335180 244.3.31.108 -> 244.3.160.239 TCP 64 scipticslsrvr > http [FIN, ACK] Seq=232 Ack=4269 Win=49640 Len=0
