71989  29.571715 244.3.47.145 -> 41.177.98.121 TCP 66 mvx-lm > clariion-evr01 [SYN] Seq=0 Win=64240 Len=0 MSS=1380 SACK_PERM=1
72004  29.573122 244.3.47.145 -> 41.177.98.121 TCP 64 mvx-lm > clariion-evr01 [ACK] Seq=1 Ack=1 Win=64860 Len=0
72005  29.573312 244.3.47.145 -> 41.177.98.121 TCP 341 mvx-lm > clariion-evr01 [PSH, ACK] Seq=1 Ack=1 Win=64860 Len=283
72062  29.580033 244.3.47.145 -> 41.177.98.121 TCP 64 mvx-lm > clariion-evr01 [ACK] Seq=284 Ack=94 Win=64768 Len=0
72064  29.580323 244.3.47.145 -> 41.177.98.121 TCP 64 mvx-lm > clariion-evr01 [FIN, ACK] Seq=284 Ack=94 Win=64768 Len=0
388024 129.571942 244.3.47.145 -> 41.177.98.121 TCP 66 slp > clariion-evr01 [SYN] Seq=0 Win=64240 Len=0 MSS=1380 SACK_PERM=1
388026 129.572693 244.3.47.145 -> 41.177.98.121 TCP 64 slp > clariion-evr01 [ACK] Seq=1 Ack=1 Win=64860 Len=0
388027 129.572942 244.3.47.145 -> 41.177.98.121 TCP 341 slp > clariion-evr01 [PSH, ACK] Seq=1 Ack=1 Win=64860 Len=283
388049 129.581145 244.3.47.145 -> 41.177.98.121 TCP 64 slp > clariion-evr01 [ACK] Seq=284 Ack=94 Win=64768 Len=0
388050 129.581269 244.3.47.145 -> 41.177.98.121 TCP 64 slp > clariion-evr01 [FIN, ACK] Seq=284 Ack=94 Win=64768 Len=0
719195 229.571025 244.3.47.145 -> 41.177.98.121 TCP 66 rsvp-encap-1 > clariion-evr01 [SYN] Seq=0 Win=64240 Len=0 MSS=1380 SACK_PERM=1
719199 229.571716 244.3.47.145 -> 41.177.98.121 TCP 64 rsvp-encap-1 > clariion-evr01 [ACK] Seq=1 Ack=1 Win=64860 Len=0
719200 229.571976 244.3.47.145 -> 41.177.98.121 TCP 341 rsvp-encap-1 > clariion-evr01 [PSH, ACK] Seq=1 Ack=1 Win=64860 Len=283
719243 229.581509 244.3.47.145 -> 41.177.98.121 TCP 64 rsvp-encap-1 > clariion-evr01 [ACK] Seq=284 Ack=94 Win=64768 Len=0
719244 229.581904 244.3.47.145 -> 41.177.98.121 TCP 64 rsvp-encap-1 > clariion-evr01 [FIN, ACK] Seq=284 Ack=94 Win=64768 Len=0
997983 333.570579 244.3.47.145 -> 41.177.98.121 TCP 66 psmond > clariion-evr01 [SYN] Seq=0 Win=64240 Len=0 MSS=1380 SACK_PERM=1
997988 333.571332 244.3.47.145 -> 41.177.98.121 TCP 64 psmond > clariion-evr01 [ACK] Seq=1 Ack=1 Win=64860 Len=0
997990 333.571534 244.3.47.145 -> 41.177.98.121 TCP 341 psmond > clariion-evr01 [PSH, ACK] Seq=1 Ack=1 Win=64860 Len=283
998063 333.582592 244.3.47.145 -> 41.177.98.121 TCP 64 psmond > clariion-evr01 [ACK] Seq=284 Ack=94 Win=64768 Len=0
998067 333.583008 244.3.47.145 -> 41.177.98.121 TCP 64 psmond > clariion-evr01 [FIN, ACK] Seq=284 Ack=94 Win=64768 Len=0
