106364  38.395029 244.3.79.141 -> 244.3.160.239 TCP 66 16156 > http [SYN] Seq=0 Win=65535 Len=0 MSS=1380 SACK_PERM=1
106366  38.395672 244.3.79.141 -> 244.3.160.239 TCP 64 16156 > http [ACK] Seq=1 Ack=1 Win=65535 Len=0
110523  39.574542 244.3.79.141 -> 244.3.160.239 TCP 64 16156 > http [ACK] Seq=1234 Ack=2050 Win=65535 Len=0
110532  39.575960 244.3.79.141 -> 244.3.160.239 TCP 64 16156 > http [ACK] Seq=1234 Ack=4012 Win=65535 Len=0
110666  39.610229 244.3.79.141 -> 244.3.160.239 TCP 64 16156 > http [ACK] Seq=1234 Ack=6061 Win=65535 Len=0
110672  39.611525 244.3.79.141 -> 244.3.160.239 TCP 64 16156 > http [ACK] Seq=1234 Ack=8110 Win=65535 Len=0
110676  39.612683 244.3.79.141 -> 244.3.160.239 TCP 64 16156 > http [ACK] Seq=1234 Ack=9837 Win=65535 Len=0
110812  39.646113 244.3.79.141 -> 244.3.160.239 TCP 64 16156 > http [ACK] Seq=1234 Ack=11896 Win=65535 Len=0
110818  39.647978 244.3.79.141 -> 244.3.160.239 TCP 64 16156 > http [ACK] Seq=1234 Ack=13957 Win=65535 Len=0
110827  39.649322 244.3.79.141 -> 244.3.160.239 TCP 64 16156 > http [ACK] Seq=1234 Ack=16006 Win=65535 Len=0
110831  39.650826 244.3.79.141 -> 244.3.160.239 TCP 64 16156 > http [ACK] Seq=1234 Ack=18055 Win=65535 Len=0
110841  39.652088 244.3.79.141 -> 244.3.160.239 TCP 64 16156 > http [ACK] Seq=1234 Ack=20104 Win=65535 Len=0
110846  39.653662 244.3.79.141 -> 244.3.160.239 TCP 64 16156 > http [ACK] Seq=1234 Ack=22153 Win=65535 Len=0
110962  39.684302 244.3.79.141 -> 244.3.160.239 TCP 64 16156 > http [ACK] Seq=1234 Ack=24386 Win=65535 Len=0
110971  39.685625 244.3.79.141 -> 244.3.160.239 TCP 64 16156 > http [ACK] Seq=1234 Ack=26435 Win=65535 Len=0
110977  39.687174 244.3.79.141 -> 244.3.160.239 TCP 64 16156 > http [ACK] Seq=1234 Ack=28571 Win=65535 Len=0
110994  39.688498 244.3.79.141 -> 244.3.160.239 TCP 64 16156 > http [ACK] Seq=1234 Ack=30620 Win=65535 Len=0
110996  39.688557 244.3.79.141 -> 244.3.160.239 TCP 64 16156 > http [ACK] Seq=1234 Ack=31833 Win=64322 Len=0
111002  39.690731 244.3.79.141 -> 244.3.160.239 TCP 64 16156 > http [ACK] Seq=1234 Ack=33928 Win=65535 Len=0
111011  39.692306 244.3.79.141 -> 244.3.160.239 TCP 64 16156 > http [ACK] Seq=1234 Ack=35977 Win=63486 Len=0
111024  39.693650 244.3.79.141 -> 244.3.160.239 TCP 64 16156 > http [ACK] Seq=1234 Ack=38026 Win=61437 Len=0
111053  39.695336 244.3.79.141 -> 244.3.160.239 TCP 64 16156 > http [ACK] Seq=1234 Ack=40075 Win=59388 Len=0
111069  39.696876 244.3.79.141 -> 244.3.160.239 TCP 70 16156 > http [ACK] Seq=1234 Ack=41455 Win=58008 Len=0 SLE=42124 SRE=42253
111070  39.696881 244.3.79.141 -> 244.3.160.239 TCP 64 16156 > http [ACK] Seq=1234 Ack=42253 Win=57210 Len=0
111079  39.699305 244.3.79.141 -> 244.3.160.239 TCP 64 [TCP Window Update] 16156 > http [ACK] Seq=1234 Ack=42253 Win=60970 Len=0
111080  39.699379 244.3.79.141 -> 244.3.160.239 TCP 64 [TCP Window Update] 16156 > http [ACK] Seq=1234 Ack=42253 Win=65535 Len=0
111127  39.724709 244.3.79.141 -> 244.3.160.239 TCP 64 16156 > http [ACK] Seq=1234 Ack=44588 Win=65535 Len=0
111130  39.725380 244.3.79.141 -> 244.3.160.239 TCP 64 16156 > http [ACK] Seq=1234 Ack=45360 Win=64764 Len=0
111131  39.725686 244.3.79.141 -> 244.3.160.239 TCP 64 16156 > http [FIN, ACK] Seq=1234 Ack=45360 Win=64764 Len=0
111509  39.850566 244.3.79.141 -> 244.3.160.239 TCP 66 13554 > http [SYN] Seq=0 Win=65535 Len=0 MSS=1380 SACK_PERM=1
111511  39.850773 244.3.79.141 -> 244.3.160.239 TCP 66 8906 > http [SYN] Seq=0 Win=65535 Len=0 MSS=1380 SACK_PERM=1
111512  39.850823 244.3.79.141 -> 244.3.160.239 TCP 66 15421 > http [SYN] Seq=0 Win=65535 Len=0 MSS=1380 SACK_PERM=1
111515  39.850976 244.3.79.141 -> 244.3.160.239 TCP 66 grubd > http [SYN] Seq=0 Win=65535 Len=0 MSS=1380 SACK_PERM=1
111517  39.851212 244.3.79.141 -> 244.3.160.239 TCP 64 13554 > http [ACK] Seq=1 Ack=1 Win=65535 Len=0
111518  39.851401 244.3.79.141 -> 244.3.160.239 TCP 64 8906 > http [ACK] Seq=1 Ack=1 Win=65535 Len=0
111519  39.851577 244.3.79.141 -> 244.3.160.239 TCP 64 15421 > http [ACK] Seq=1 Ack=1 Win=65535 Len=0
111520  39.851581 244.3.79.141 -> 244.3.160.239 TCP 64 grubd > http [ACK] Seq=1 Ack=1 Win=65535 Len=0
112823  40.174476 244.3.79.141 -> 244.3.160.239 TCP 64 13554 > http [ACK] Seq=1061 Ack=957 Win=64580 Len=0
112825  40.174568 244.3.79.141 -> 244.3.160.239 TCP 64 13554 > http [FIN, ACK] Seq=1061 Ack=957 Win=64580 Len=0
113201  40.283741 244.3.79.141 -> 244.3.160.239 TCP 64 8906 > http [ACK] Seq=1062 Ack=956 Win=64580 Len=0
113202  40.283829 244.3.79.141 -> 244.3.160.239 TCP 64 15421 > http [ACK] Seq=1062 Ack=956 Win=64580 Len=0
113203  40.283869 244.3.79.141 -> 244.3.160.239 TCP 64 grubd > http [ACK] Seq=1062 Ack=956 Win=64580 Len=0
113204  40.284049 244.3.79.141 -> 244.3.160.239 TCP 64 8906 > http [FIN, ACK] Seq=1062 Ack=956 Win=64580 Len=0
113205  40.284080 244.3.79.141 -> 244.3.160.239 TCP 64 grubd > http [FIN, ACK] Seq=1062 Ack=956 Win=64580 Len=0
113208  40.284218 244.3.79.141 -> 244.3.160.239 TCP 64 15421 > http [FIN, ACK] Seq=1062 Ack=956 Win=64580 Len=0
113617  40.393847 244.3.79.141 -> 244.3.160.239 TCP 64 8906 > http [ACK] Seq=1063 Ack=957 Win=64580 Len=0
113620  40.393987 244.3.79.141 -> 244.3.160.239 TCP 64 15421 > http [ACK] Seq=1063 Ack=957 Win=64580 Len=0
113623  40.394394 244.3.79.141 -> 244.3.160.239 TCP 64 grubd > http [ACK] Seq=1063 Ack=957 Win=64580 Len=0
145089  49.743546 244.3.79.141 -> 244.3.160.239 TCP 66 ofsd > http [SYN] Seq=0 Win=65535 Len=0 MSS=1380 SACK_PERM=1
145091  49.744220 244.3.79.141 -> 244.3.160.239 TCP 64 ofsd > http [ACK] Seq=1 Ack=1 Win=65535 Len=0
155861  53.135543 244.3.79.141 -> 244.3.160.239 TCP 64 ofsd > http [ACK] Seq=1340 Ack=2050 Win=65535 Len=0
155876  53.137014 244.3.79.141 -> 244.3.160.239 TCP 64 ofsd > http [ACK] Seq=1340 Ack=4099 Win=65535 Len=0
155940  53.171334 244.3.79.141 -> 244.3.160.239 TCP 64 ofsd > http [ACK] Seq=1340 Ack=5708 Win=65535 Len=0
155946  53.172700 244.3.79.141 -> 244.3.160.239 TCP 64 ofsd > http [ACK] Seq=1340 Ack=7757 Win=65535 Len=0
155949  53.174062 244.3.79.141 -> 244.3.160.239 TCP 64 ofsd > http [ACK] Seq=1340 Ack=9832 Win=65535 Len=0
156015  53.207147 244.3.79.141 -> 244.3.160.239 TCP 64 ofsd > http [ACK] Seq=1340 Ack=11538 Win=65535 Len=0
156022  53.208596 244.3.79.141 -> 244.3.160.239 TCP 64 ofsd > http [ACK] Seq=1340 Ack=13587 Win=65535 Len=0
156028  53.210209 244.3.79.141 -> 244.3.160.239 TCP 64 ofsd > http [ACK] Seq=1340 Ack=15636 Win=65535 Len=0
156036  53.211489 244.3.79.141 -> 244.3.160.239 TCP 64 ofsd > http [ACK] Seq=1340 Ack=17685 Win=65535 Len=0
156042  53.212966 244.3.79.141 -> 244.3.160.239 TCP 64 ofsd > http [ACK] Seq=1340 Ack=19734 Win=65535 Len=0
156046  53.214096 244.3.79.141 -> 244.3.160.239 TCP 64 ofsd > http [ACK] Seq=1340 Ack=21783 Win=65535 Len=0
156148  53.242845 244.3.79.141 -> 244.3.160.239 TCP 64 ofsd > http [ACK] Seq=1340 Ack=23287 Win=65535 Len=0
156155  53.244390 244.3.79.141 -> 244.3.160.239 TCP 64 ofsd > http [ACK] Seq=1340 Ack=25336 Win=65535 Len=0
156170  53.245896 244.3.79.141 -> 244.3.160.239 TCP 64 ofsd > http [ACK] Seq=1340 Ack=27385 Win=65535 Len=0
156185  53.247673 244.3.79.141 -> 244.3.160.239 TCP 64 ofsd > http [ACK] Seq=1340 Ack=29434 Win=65535 Len=0
156202  53.249083 244.3.79.141 -> 244.3.160.239 TCP 64 ofsd > http [ACK] Seq=1340 Ack=31483 Win=65535 Len=0
156237  53.250667 244.3.79.141 -> 244.3.160.239 TCP 64 ofsd > http [ACK] Seq=1340 Ack=33532 Win=65535 Len=0
156250  53.254147 244.3.79.141 -> 244.3.160.239 TCP 64 ofsd > http [ACK] Seq=1340 Ack=35613 Win=65535 Len=0
156268  53.257462 244.3.79.141 -> 244.3.160.239 TCP 64 ofsd > http [ACK] Seq=1340 Ack=38223 Win=65535 Len=0
156274  53.259106 244.3.79.141 -> 244.3.160.239 TCP 64 ofsd > http [ACK] Seq=1340 Ack=40272 Win=65535 Len=0
156284  53.260467 244.3.79.141 -> 244.3.160.239 TCP 64 ofsd > http [ACK] Seq=1340 Ack=42321 Win=65535 Len=0
156288  53.261862 244.3.79.141 -> 244.3.160.239 TCP 64 ofsd > http [ACK] Seq=1340 Ack=44370 Win=65535 Len=0
156289  53.261920 244.3.79.141 -> 244.3.160.239 TCP 64 ofsd > http [ACK] Seq=1340 Ack=45376 Win=64529 Len=0
156384  53.278948 244.3.79.141 -> 244.3.160.239 TCP 64 ofsd > http [ACK] Seq=1340 Ack=47425 Win=65535 Len=0
156394  53.281157 244.3.79.141 -> 244.3.160.239 TCP 64 ofsd > http [ACK] Seq=1340 Ack=49683 Win=65535 Len=0
156407  53.282685 244.3.79.141 -> 244.3.160.239 TCP 64 ofsd > http [ACK] Seq=1340 Ack=51761 Win=65535 Len=0
156409  53.283520 244.3.79.141 -> 244.3.160.239 TCP 64 ofsd > http [ACK] Seq=1340 Ack=53810 Win=65535 Len=0
156432  53.285248 244.3.79.141 -> 244.3.160.239 TCP 64 ofsd > http [ACK] Seq=1340 Ack=55509 Win=65535 Len=0
156433  53.285499 244.3.79.141 -> 244.3.160.239 TCP 64 ofsd > http [ACK] Seq=1340 Ack=57037 Win=65535 Len=0
156439  53.287582 244.3.79.141 -> 244.3.160.239 TCP 64 ofsd > http [ACK] Seq=1340 Ack=59086 Win=65535 Len=0
156454  53.293166 244.3.79.141 -> 244.3.160.239 TCP 64 ofsd > http [ACK] Seq=1340 Ack=61339 Win=65535 Len=0
156455  53.293361 244.3.79.141 -> 244.3.160.239 TCP 64 ofsd > http [ACK] Seq=1340 Ack=62847 Win=65535 Len=0
156462  53.295410 244.3.79.141 -> 244.3.160.239 TCP 64 ofsd > http [ACK] Seq=1340 Ack=64896 Win=65535 Len=0
156468  53.296878 244.3.79.141 -> 244.3.160.239 TCP 64 ofsd > http [ACK] Seq=1340 Ack=66945 Win=65535 Len=0
156475  53.298035 244.3.79.141 -> 244.3.160.239 TCP 64 ofsd > http [ACK] Seq=1340 Ack=68714 Win=65535 Len=0
156496  53.305241 244.3.79.141 -> 244.3.160.239 TCP 66 pim-port > http [SYN] Seq=0 Win=65535 Len=0 MSS=1380 SACK_PERM=1
156499  53.305909 244.3.79.141 -> 244.3.160.239 TCP 64 pim-port > http [ACK] Seq=1 Ack=1 Win=65535 Len=0
156522  53.314030 244.3.79.141 -> 244.3.160.239 TCP 64 ofsd > http [ACK] Seq=1340 Ack=70836 Win=65535 Len=0
156554  53.316859 244.3.79.141 -> 244.3.160.239 TCP 64 ofsd > http [ACK] Seq=1340 Ack=73032 Win=65535 Len=0
156557  53.318199 244.3.79.141 -> 244.3.160.239 TCP 64 ofsd > http [ACK] Seq=1340 Ack=75081 Win=65535 Len=0
156578  53.319441 244.3.79.141 -> 244.3.160.239 TCP 64 ofsd > http [ACK] Seq=1340 Ack=77130 Win=65535 Len=0
156586  53.321212 244.3.79.141 -> 244.3.160.239 TCP 64 ofsd > http [ACK] Seq=1340 Ack=79002 Win=63663 Len=0
156587  53.321498 244.3.79.141 -> 244.3.160.239 TCP 64 ofsd > http [ACK] Seq=1340 Ack=80530 Win=62135 Len=0
156596  53.323541 244.3.79.141 -> 244.3.160.239 TCP 64 ofsd > http [ACK] Seq=1340 Ack=82579 Win=60086 Len=0
156608  53.326935 244.3.79.141 -> 244.3.160.239 TCP 64 ofsd > http [ACK] Seq=1340 Ack=83856 Win=58809 Len=0
156609  53.327062 244.3.79.141 -> 244.3.160.239 TCP 64 ofsd > http [ACK] Seq=1340 Ack=83857 Win=58809 Len=0
156612  53.330164 244.3.79.141 -> 244.3.160.239 TCP 64 [TCP Window Update] ofsd > http [ACK] Seq=1340 Ack=83857 Win=65535 Len=0
156614  53.330464 244.3.79.141 -> 244.3.160.239 TCP 64 ofsd > http [FIN, ACK] Seq=1340 Ack=83857 Win=65535 Len=0
156877  53.427717 244.3.79.141 -> 244.3.160.239 TCP 64 pim-port > http [ACK] Seq=1078 Ack=921 Win=64616 Len=0
156879  53.427908 244.3.79.141 -> 244.3.160.239 TCP 64 pim-port > http [FIN, ACK] Seq=1078 Ack=921 Win=64616 Len=0
157005  53.486137 244.3.79.141 -> 244.3.160.239 TCP 66 15830 > http [SYN] Seq=0 Win=65535 Len=0 MSS=1380 SACK_PERM=1
157008  53.486905 244.3.79.141 -> 244.3.160.239 TCP 64 15830 > http [ACK] Seq=1 Ack=1 Win=65535 Len=0
157158  53.553363 244.3.79.141 -> 244.3.160.239 TCP 66 rets > http [SYN] Seq=0 Win=65535 Len=0 MSS=1380 SACK_PERM=1
157164  53.554075 244.3.79.141 -> 244.3.160.239 TCP 64 rets > http [ACK] Seq=1 Ack=1 Win=65535 Len=0
157195  53.569513 244.3.79.141 -> 244.3.160.239 TCP 66 x11 > http [SYN] Seq=0 Win=65535 Len=0 MSS=1380 SACK_PERM=1
157200  53.570548 244.3.79.141 -> 244.3.160.239 TCP 64 x11 > http [ACK] Seq=1 Ack=1 Win=65535 Len=0
157575  53.673804 244.3.79.141 -> 244.3.160.239 TCP 64 15830 > http [ACK] Seq=1350 Ack=1519 Win=65535 Len=0
157577  53.674073 244.3.79.141 -> 244.3.160.239 TCP 64 15830 > http [FIN, ACK] Seq=1350 Ack=2176 Win=64878 Len=0
157870  53.783429 244.3.79.141 -> 244.3.160.239 TCP 64 15830 > http [ACK] Seq=1351 Ack=2177 Win=64878 Len=0
157874  53.784570 244.3.79.141 -> 244.3.160.239 TCP 64 rets > http [ACK] Seq=1113 Ack=1674 Win=65535 Len=0
157876  53.784735 244.3.79.141 -> 244.3.160.239 TCP 64 rets > http [FIN, ACK] Seq=1113 Ack=1674 Win=65535 Len=0
158088  53.866018 244.3.79.141 -> 244.3.160.239 TCP 64 x11 > http [ACK] Seq=1361 Ack=205 Win=65332 Len=0
158185  53.893227 244.3.79.141 -> 244.3.160.239 TCP 64 rets > http [ACK] Seq=1114 Ack=1675 Win=65535 Len=0
158269  53.908105 244.3.79.141 -> 244.3.160.239 TCP 64 x11 > http [FIN, ACK] Seq=1361 Ack=205 Win=65332 Len=0
158277  53.909048 244.3.79.141 -> 244.3.160.239 TCP 66 remcap > http [SYN] Seq=0 Win=65535 Len=0 MSS=1380 SACK_PERM=1
158279  53.909259 244.3.79.141 -> 244.3.160.239 TCP 66 8550 > http [SYN] Seq=0 Win=65535 Len=0 MSS=1380 SACK_PERM=1
158280  53.909311 244.3.79.141 -> 244.3.160.239 TCP 66 balour > http [SYN] Seq=0 Win=65535 Len=0 MSS=1380 SACK_PERM=1
158283  53.909533 244.3.79.141 -> 244.3.160.239 TCP 66 sabams > http [SYN] Seq=0 Win=65535 Len=0 MSS=1380 SACK_PERM=1
158286  53.909646 244.3.79.141 -> 244.3.160.239 TCP 64 remcap > http [ACK] Seq=1 Ack=1 Win=65535 Len=0
158287  53.909768 244.3.79.141 -> 244.3.160.239 TCP 66 twsdss > http [SYN] Seq=0 Win=65535 Len=0 MSS=1380 SACK_PERM=1
158289  53.909900 244.3.79.141 -> 244.3.160.239 TCP 64 8550 > http [ACK] Seq=1 Ack=1 Win=65535 Len=0
158290  53.909905 244.3.79.141 -> 244.3.160.239 TCP 64 balour > http [ACK] Seq=1 Ack=1 Win=65535 Len=0
158293  53.910098 244.3.79.141 -> 244.3.160.239 TCP 64 sabams > http [ACK] Seq=1 Ack=1 Win=65535 Len=0
158295  53.910408 244.3.79.141 -> 244.3.160.239 TCP 64 twsdss > http [ACK] Seq=1 Ack=1 Win=65535 Len=0
158493  53.985584 244.3.79.141 -> 244.3.160.239 TCP 66 12786 > http [SYN] Seq=0 Win=65535 Len=0 MSS=1380 SACK_PERM=1
158495  53.986233 244.3.79.141 -> 244.3.160.239 TCP 64 12786 > http [ACK] Seq=1 Ack=1 Win=65535 Len=0
158917  54.127409 244.3.79.141 -> 244.3.160.239 TCP 64 twsdss > http [ACK] Seq=1132 Ack=205 Win=65332 Len=0
158918  54.127670 244.3.79.141 -> 244.3.160.239 TCP 64 twsdss > http [FIN, ACK] Seq=1132 Ack=205 Win=65332 Len=0
158929  54.129108 244.3.79.141 -> 244.3.160.239 TCP 64 balour > http [ACK] Seq=1145 Ack=218 Win=65319 Len=0
158930  54.129406 244.3.79.141 -> 244.3.160.239 TCP 64 balour > http [FIN, ACK] Seq=1145 Ack=218 Win=65319 Len=0
158975  54.142410 244.3.79.141 -> 244.3.160.239 TCP 64 remcap > http [ACK] Seq=1159 Ack=2050 Win=65535 Len=0
158981  54.143885 244.3.79.141 -> 244.3.160.239 TCP 64 remcap > http [ACK] Seq=1159 Ack=4128 Win=65535 Len=0
158985  54.145464 244.3.79.141 -> 244.3.160.239 TCP 64 remcap > http [ACK] Seq=1159 Ack=6177 Win=65535 Len=0
158991  54.146872 244.3.79.141 -> 244.3.160.239 TCP 64 remcap > http [ACK] Seq=1159 Ack=8253 Win=65535 Len=0
159007  54.148795 244.3.79.141 -> 244.3.160.239 TCP 64 remcap > http [ACK] Seq=1159 Ack=10333 Win=65535 Len=0
159018  54.150462 244.3.79.141 -> 244.3.160.239 TCP 70 remcap > http [ACK] Seq=1159 Ack=11713 Win=65535 Len=0 SLE=12382 SRE=12611
159019  54.150506 244.3.79.141 -> 244.3.160.239 TCP 64 remcap > http [ACK] Seq=1159 Ack=12611 Win=64637 Len=0
159127  54.177110 244.3.79.141 -> 244.3.160.239 TCP 64 remcap > http [ACK] Seq=1159 Ack=14660 Win=65535 Len=0
159141  54.178794 244.3.79.141 -> 244.3.160.239 TCP 64 remcap > http [ACK] Seq=1159 Ack=16753 Win=65535 Len=0
159153  54.180837 244.3.79.141 -> 244.3.160.239 TCP 64 remcap > http [ACK] Seq=1159 Ack=19123 Win=65535 Len=0
159167  54.182626 244.3.79.141 -> 244.3.160.239 TCP 64 remcap > http [ACK] Seq=1159 Ack=21188 Win=65535 Len=0
159171  54.184197 244.3.79.141 -> 244.3.160.239 TCP 64 remcap > http [ACK] Seq=1159 Ack=23243 Win=65535 Len=0
159185  54.185594 244.3.79.141 -> 244.3.160.239 TCP 64 remcap > http [ACK] Seq=1159 Ack=25292 Win=65535 Len=0
159189  54.186975 244.3.79.141 -> 244.3.160.239 TCP 64 remcap > http [ACK] Seq=1159 Ack=27341 Win=65535 Len=0
159196  54.188265 244.3.79.141 -> 244.3.160.239 TCP 64 remcap > http [ACK] Seq=1159 Ack=29390 Win=65535 Len=0
159200  54.189146 244.3.79.141 -> 244.3.160.239 TCP 64 remcap > http [ACK] Seq=1159 Ack=30657 Win=64269 Len=0
159201  54.189174 244.3.79.141 -> 244.3.160.239 TCP 64 remcap > http [FIN, ACK] Seq=1159 Ack=30657 Win=64269 Len=0
159535  54.292152 244.3.79.141 -> 244.3.160.239 TCP 64 12786 > http [ACK] Seq=917 Ack=643 Win=64894 Len=0
159536  54.292328 244.3.79.141 -> 244.3.160.239 TCP 64 12786 > http [FIN, ACK] Seq=917 Ack=643 Win=64894 Len=0
161176  54.854793 244.3.79.141 -> 244.3.160.239 TCP 64 sabams > http [ACK] Seq=1189 Ack=191 Win=65346 Len=0
161177  54.855089 244.3.79.141 -> 244.3.160.239 TCP 64 sabams > http [FIN, ACK] Seq=1189 Ack=191 Win=65346 Len=0
175077  58.213219 244.3.79.141 -> 244.3.160.239 TCP 64 8550 > http [ACK] Seq=1132 Ack=312 Win=65224 Len=0
175078  58.213325 244.3.79.141 -> 244.3.160.239 TCP 64 8550 > http [FIN, ACK] Seq=1132 Ack=312 Win=65224 Len=0
175314  58.282410 244.3.79.141 -> 244.3.160.239 TCP 64 8550 > http [ACK] Seq=1133 Ack=313 Win=65224 Len=0
274451  92.529906 244.3.79.141 -> 41.177.98.176 TCP 66 unisql > http [SYN] Seq=0 Win=65535 Len=0 MSS=1380 SACK_PERM=1
274454  92.530556 244.3.79.141 -> 41.177.98.176 TCP 64 unisql > http [ACK] Seq=1 Ack=1 Win=65535 Len=0
280388  94.474270 244.3.79.141 -> 41.177.98.176 TCP 64 unisql > http [ACK] Seq=976 Ack=2761 Win=65535 Len=0
280393  94.475093 244.3.79.141 -> 41.177.98.176 TCP 64 unisql > http [ACK] Seq=976 Ack=5335 Win=65535 Len=0
280410  94.476974 244.3.79.141 -> 41.177.98.176 TCP 64 unisql > http [ACK] Seq=976 Ack=8095 Win=65535 Len=0
280412  94.477155 244.3.79.141 -> 41.177.98.176 TCP 64 unisql > http [ACK] Seq=976 Ack=10463 Win=65535 Len=0
280428  94.479898 244.3.79.141 -> 41.177.98.176 TCP 64 unisql > http [ACK] Seq=976 Ack=13223 Win=64155 Len=0
280429  94.480059 244.3.79.141 -> 41.177.98.176 TCP 64 unisql > http [ACK] Seq=976 Ack=15591 Win=61787 Len=0
280451  94.482739 244.3.79.141 -> 41.177.98.176 TCP 64 unisql > http [ACK] Seq=976 Ack=18351 Win=59027 Len=0
280452  94.482927 244.3.79.141 -> 41.177.98.176 TCP 64 unisql > http [ACK] Seq=976 Ack=20719 Win=56659 Len=0
280473  94.485293 244.3.79.141 -> 41.177.98.176 TCP 64 unisql > http [ACK] Seq=976 Ack=22057 Win=55321 Len=0
280630  94.508625 244.3.79.141 -> 41.177.98.176 TCP 64 [TCP Window Update] unisql > http [ACK] Seq=976 Ack=22057 Win=59081 Len=0
280638  94.510473 244.3.79.141 -> 41.177.98.176 TCP 64 [TCP Window Update] unisql > http [ACK] Seq=976 Ack=22057 Win=65535 Len=0
320849 109.546870 244.3.79.141 -> 41.177.98.176 TCP 64 unisql > http [ACK] Seq=976 Ack=22058 Win=65535 Len=0
352879 119.785050 244.3.79.141 -> 41.177.98.176 TCP 64 unisql > http [FIN, ACK] Seq=976 Ack=22058 Win=65535 Len=0
414834 138.482540 244.3.79.141 -> 244.3.160.239 TCP 66 bmc-reporting > http [SYN] Seq=0 Win=65535 Len=0 MSS=1380 SACK_PERM=1
414837 138.483375 244.3.79.141 -> 244.3.160.239 TCP 64 bmc-reporting > http [ACK] Seq=1 Ack=1 Win=65535 Len=0
416065 138.711038 244.3.79.141 -> 244.3.160.239 TCP 64 bmc-reporting > http [ACK] Seq=1321 Ack=2050 Win=65535 Len=0
416069 138.712335 244.3.79.141 -> 244.3.160.239 TCP 64 bmc-reporting > http [ACK] Seq=1321 Ack=4099 Win=65535 Len=0
416077 138.713862 244.3.79.141 -> 244.3.160.239 TCP 64 bmc-reporting > http [ACK] Seq=1321 Ack=6148 Win=65535 Len=0
416088 138.715390 244.3.79.141 -> 244.3.160.239 TCP 64 bmc-reporting > http [ACK] Seq=1321 Ack=8197 Win=65535 Len=0
416099 138.717009 244.3.79.141 -> 244.3.160.239 TCP 64 bmc-reporting > http [ACK] Seq=1321 Ack=10246 Win=65535 Len=0
416116 138.718162 244.3.79.141 -> 244.3.160.239 TCP 64 bmc-reporting > http [ACK] Seq=1321 Ack=12309 Win=65535 Len=0
416126 138.719634 244.3.79.141 -> 244.3.160.239 TCP 64 bmc-reporting > http [ACK] Seq=1321 Ack=14358 Win=65535 Len=0
416131 138.720966 244.3.79.141 -> 244.3.160.239 TCP 64 bmc-reporting > http [ACK] Seq=1321 Ack=16407 Win=63486 Len=0
416143 138.722348 244.3.79.141 -> 244.3.160.239 TCP 64 bmc-reporting > http [ACK] Seq=1321 Ack=18456 Win=61437 Len=0
416151 138.723829 244.3.79.141 -> 244.3.160.239 TCP 64 bmc-reporting > http [ACK] Seq=1321 Ack=20505 Win=59388 Len=0
416170 138.727225 244.3.79.141 -> 244.3.160.239 TCP 64 bmc-reporting > http [ACK] Seq=1321 Ack=21702 Win=65535 Len=0
416288 138.745032 244.3.79.141 -> 244.3.160.239 TCP 64 bmc-reporting > http [ACK] Seq=1321 Ack=23755 Win=65535 Len=0
416332 138.749411 244.3.79.141 -> 244.3.160.239 TCP 64 bmc-reporting > http [ACK] Seq=1321 Ack=26006 Win=65535 Len=0
416350 138.750372 244.3.79.141 -> 244.3.160.239 TCP 64 bmc-reporting > http [ACK] Seq=1321 Ack=28121 Win=65535 Len=0
416351 138.750377 244.3.79.141 -> 244.3.160.239 TCP 64 bmc-reporting > http [ACK] Seq=1321 Ack=28589 Win=65068 Len=0
416352 138.750419 244.3.79.141 -> 244.3.160.239 TCP 64 bmc-reporting > http [FIN, ACK] Seq=1321 Ack=28589 Win=65068 Len=0
448314 145.653781 244.3.79.141 -> 244.3.160.239 TCP 66 10710 > http [SYN] Seq=0 Win=65535 Len=0 MSS=1380 SACK_PERM=1
448316 145.654945 244.3.79.141 -> 244.3.160.239 TCP 64 10710 > http [ACK] Seq=1 Ack=1 Win=65535 Len=0
456199 148.911155 244.3.79.141 -> 244.3.160.239 TCP 64 10710 > http [ACK] Seq=1347 Ack=2050 Win=65535 Len=0
456203 148.912497 244.3.79.141 -> 244.3.160.239 TCP 64 10710 > http [ACK] Seq=1347 Ack=3972 Win=65535 Len=0
456276 148.947335 244.3.79.141 -> 244.3.160.239 TCP 64 10710 > http [ACK] Seq=1347 Ack=6021 Win=65535 Len=0
456282 148.948640 244.3.79.141 -> 244.3.160.239 TCP 64 10710 > http [ACK] Seq=1347 Ack=8070 Win=65535 Len=0
456290 148.949769 244.3.79.141 -> 244.3.160.239 TCP 64 10710 > http [ACK] Seq=1347 Ack=9830 Win=65535 Len=0
456387 148.984291 244.3.79.141 -> 244.3.160.239 TCP 64 10710 > http [ACK] Seq=1347 Ack=11879 Win=65535 Len=0
456391 148.985811 244.3.79.141 -> 244.3.160.239 TCP 64 10710 > http [ACK] Seq=1347 Ack=13928 Win=65535 Len=0
456398 148.987254 244.3.79.141 -> 244.3.160.239 TCP 64 10710 > http [ACK] Seq=1347 Ack=15977 Win=65535 Len=0
456404 148.988750 244.3.79.141 -> 244.3.160.239 TCP 64 10710 > http [ACK] Seq=1347 Ack=18026 Win=65535 Len=0
456408 148.990185 244.3.79.141 -> 244.3.160.239 TCP 64 10710 > http [ACK] Seq=1347 Ack=20075 Win=65535 Len=0
456417 148.991943 244.3.79.141 -> 244.3.160.239 TCP 64 10710 > http [ACK] Seq=1347 Ack=22124 Win=65535 Len=0
456495 149.023952 244.3.79.141 -> 244.3.160.239 TCP 64 10710 > http [ACK] Seq=1347 Ack=24434 Win=65535 Len=0
456501 149.025354 244.3.79.141 -> 244.3.160.239 TCP 64 10710 > http [ACK] Seq=1347 Ack=26772 Win=65535 Len=0
456512 149.026930 244.3.79.141 -> 244.3.160.239 TCP 64 10710 > http [ACK] Seq=1347 Ack=28825 Win=65535 Len=0
456524 149.028515 244.3.79.141 -> 244.3.160.239 TCP 64 10710 > http [ACK] Seq=1347 Ack=30874 Win=65535 Len=0
456528 149.030137 244.3.79.141 -> 244.3.160.239 TCP 64 10710 > http [ACK] Seq=1347 Ack=32993 Win=65535 Len=0
456537 149.031573 244.3.79.141 -> 244.3.160.239 TCP 64 10710 > http [ACK] Seq=1347 Ack=35061 Win=65535 Len=0
456540 149.033209 244.3.79.141 -> 244.3.160.239 TCP 64 10710 > http [ACK] Seq=1347 Ack=37162 Win=63434 Len=0
456555 149.034747 244.3.79.141 -> 244.3.160.239 TCP 64 10710 > http [ACK] Seq=1347 Ack=39247 Win=61349 Len=0
456560 149.036435 244.3.79.141 -> 244.3.160.239 TCP 64 10710 > http [ACK] Seq=1347 Ack=41296 Win=59300 Len=0
456561 149.036440 244.3.79.141 -> 244.3.160.239 TCP 64 10710 > http [ACK] Seq=1347 Ack=41920 Win=58677 Len=0
456567 149.039924 244.3.79.141 -> 244.3.160.239 TCP 64 [TCP Window Update] 10710 > http [ACK] Seq=1347 Ack=41920 Win=63158 Len=0
456568 149.040067 244.3.79.141 -> 244.3.160.239 TCP 64 [TCP Window Update] 10710 > http [ACK] Seq=1347 Ack=41920 Win=65535 Len=0
456569 149.040199 244.3.79.141 -> 244.3.160.239 TCP 64 10710 > http [FIN, ACK] Seq=1347 Ack=41920 Win=65535 Len=0
456901 149.179243 244.3.79.141 -> 244.3.160.239 TCP 66 8586 > http [SYN] Seq=0 Win=65535 Len=0 MSS=1380 SACK_PERM=1
456905 149.179946 244.3.79.141 -> 244.3.160.239 TCP 64 8586 > http [ACK] Seq=1 Ack=1 Win=65535 Len=0
456906 149.180338 244.3.79.141 -> 244.3.160.239 TCP 66 5238 > http [SYN] Seq=0 Win=65535 Len=0 MSS=1380 SACK_PERM=1
456910 149.180919 244.3.79.141 -> 244.3.160.239 TCP 64 5238 > http [ACK] Seq=1 Ack=1 Win=65535 Len=0
457284 149.329695 244.3.79.141 -> 244.3.160.239 TCP 66 13461 > http [SYN] Seq=0 Win=65535 Len=0 MSS=1380 SACK_PERM=1
457287 149.330464 244.3.79.141 -> 244.3.160.239 TCP 64 13461 > http [ACK] Seq=1 Ack=1 Win=65535 Len=0
457497 149.422351 244.3.79.141 -> 244.3.160.239 TCP 64 8586 > http [ACK] Seq=1124 Ack=956 Win=64580 Len=0
457498 149.422494 244.3.79.141 -> 244.3.160.239 TCP 64 8586 > http [FIN, ACK] Seq=1124 Ack=956 Win=64580 Len=0
457815 149.532036 244.3.79.141 -> 244.3.160.239 TCP 64 8586 > http [ACK] Seq=1125 Ack=957 Win=64580 Len=0
457820 149.532951 244.3.79.141 -> 244.3.160.239 TCP 64 5238 > http [ACK] Seq=1124 Ack=956 Win=64580 Len=0
457821 149.532955 244.3.79.141 -> 244.3.160.239 TCP 64 13461 > http [ACK] Seq=1124 Ack=956 Win=64580 Len=0
457822 149.534001 244.3.79.141 -> 244.3.160.239 TCP 64 5238 > http [FIN, ACK] Seq=1124 Ack=956 Win=64580 Len=0
457823 149.534068 244.3.79.141 -> 244.3.160.239 TCP 64 13461 > http [FIN, ACK] Seq=1124 Ack=956 Win=64580 Len=0
458058 149.642233 244.3.79.141 -> 244.3.160.239 TCP 64 5238 > http [ACK] Seq=1125 Ack=957 Win=64580 Len=0
458059 149.642506 244.3.79.141 -> 244.3.160.239 TCP 64 13461 > http [ACK] Seq=1125 Ack=957 Win=64580 Len=0
472565 155.957541 244.3.79.141 -> 244.3.160.239 TCP 66 9439 > http [SYN] Seq=0 Win=65535 Len=0 MSS=1380 SACK_PERM=1
472574 155.958250 244.3.79.141 -> 244.3.160.239 TCP 64 9439 > http [ACK] Seq=1 Ack=1 Win=65535 Len=0
475924 157.045256 244.3.79.141 -> 244.3.160.239 TCP 64 9439 > http [ACK] Seq=1319 Ack=2050 Win=65535 Len=0
475929 157.046578 244.3.79.141 -> 244.3.160.239 TCP 64 9439 > http [ACK] Seq=1319 Ack=4099 Win=65535 Len=0
475992 157.080888 244.3.79.141 -> 244.3.160.239 TCP 64 9439 > http [ACK] Seq=1319 Ack=5502 Win=65535 Len=0
475999 157.082243 244.3.79.141 -> 244.3.160.239 TCP 64 9439 > http [ACK] Seq=1319 Ack=7551 Win=65535 Len=0
476003 157.083711 244.3.79.141 -> 244.3.160.239 TCP 64 9439 > http [ACK] Seq=1319 Ack=9601 Win=65535 Len=0
476091 157.117595 244.3.79.141 -> 244.3.160.239 TCP 64 9439 > http [ACK] Seq=1319 Ack=11334 Win=65535 Len=0
476097 157.119191 244.3.79.141 -> 244.3.160.239 TCP 64 9439 > http [ACK] Seq=1319 Ack=13383 Win=65535 Len=0
476106 157.120541 244.3.79.141 -> 244.3.160.239 TCP 64 9439 > http [ACK] Seq=1319 Ack=15432 Win=65535 Len=0
476116 157.121636 244.3.79.141 -> 244.3.160.239 TCP 64 9439 > http [ACK] Seq=1319 Ack=17481 Win=65535 Len=0
476120 157.123130 244.3.79.141 -> 244.3.160.239 TCP 64 9439 > http [ACK] Seq=1319 Ack=19530 Win=65535 Len=0
476124 157.124252 244.3.79.141 -> 244.3.160.239 TCP 64 9439 > http [ACK] Seq=1319 Ack=21736 Win=65535 Len=0
476179 157.154927 244.3.79.141 -> 244.3.160.239 TCP 64 9439 > http [ACK] Seq=1319 Ack=23785 Win=65535 Len=0
476188 157.156568 244.3.79.141 -> 244.3.160.239 TCP 64 9439 > http [ACK] Seq=1319 Ack=25834 Win=65535 Len=0
476202 157.157844 244.3.79.141 -> 244.3.160.239 TCP 64 9439 > http [ACK] Seq=1319 Ack=27883 Win=65535 Len=0
476203 157.157848 244.3.79.141 -> 244.3.160.239 TCP 64 9439 > http [ACK] Seq=1319 Ack=28395 Win=65024 Len=0
476204 157.158064 244.3.79.141 -> 244.3.160.239 TCP 64 9439 > http [FIN, ACK] Seq=1319 Ack=28395 Win=65024 Len=0
518192 167.644562 244.3.79.141 -> 244.3.160.239 TCP 66 base > http [SYN] Seq=0 Win=65535 Len=0 MSS=1380 SACK_PERM=1
518197 167.645285 244.3.79.141 -> 244.3.160.239 TCP 64 base > http [ACK] Seq=1 Ack=1 Win=65535 Len=0
522265 169.311474 244.3.79.141 -> 244.3.160.239 TCP 64 base > http [ACK] Seq=1296 Ack=2050 Win=65535 Len=0
522268 169.312618 244.3.79.141 -> 244.3.160.239 TCP 64 base > http [ACK] Seq=1296 Ack=4028 Win=65535 Len=0
522332 169.347331 244.3.79.141 -> 244.3.160.239 TCP 64 base > http [ACK] Seq=1296 Ack=6077 Win=65535 Len=0
522341 169.348797 244.3.79.141 -> 244.3.160.239 TCP 64 base > http [ACK] Seq=1296 Ack=8126 Win=65535 Len=0
522344 169.349915 244.3.79.141 -> 244.3.160.239 TCP 64 base > http [ACK] Seq=1296 Ack=9860 Win=65535 Len=0
522424 169.384506 244.3.79.141 -> 244.3.160.239 TCP 64 base > http [ACK] Seq=1296 Ack=11909 Win=65535 Len=0
522430 169.386190 244.3.79.141 -> 244.3.160.239 TCP 64 base > http [ACK] Seq=1296 Ack=14085 Win=65535 Len=0
522439 169.387576 244.3.79.141 -> 244.3.160.239 TCP 64 base > http [ACK] Seq=1296 Ack=16134 Win=65535 Len=0
522443 169.389094 244.3.79.141 -> 244.3.160.239 TCP 64 base > http [ACK] Seq=1296 Ack=18183 Win=65535 Len=0
522447 169.390474 244.3.79.141 -> 244.3.160.239 TCP 64 base > http [ACK] Seq=1296 Ack=20232 Win=65535 Len=0
522482 169.420973 244.3.79.141 -> 244.3.160.239 TCP 64 base > http [ACK] Seq=1296 Ack=22987 Win=65535 Len=0
522488 169.422522 244.3.79.141 -> 244.3.160.239 TCP 64 base > http [ACK] Seq=1296 Ack=25036 Win=65535 Len=0
522496 169.423817 244.3.79.141 -> 244.3.160.239 TCP 64 base > http [ACK] Seq=1296 Ack=27085 Win=65535 Len=0
522514 169.425235 244.3.79.141 -> 244.3.160.239 TCP 64 base > http [ACK] Seq=1296 Ack=29180 Win=65535 Len=0
522523 169.426653 244.3.79.141 -> 244.3.160.239 TCP 64 base > http [ACK] Seq=1296 Ack=31229 Win=65535 Len=0
522536 169.428415 244.3.79.141 -> 244.3.160.239 TCP 64 base > http [ACK] Seq=1296 Ack=33278 Win=65535 Len=0
522542 169.429876 244.3.79.141 -> 244.3.160.239 TCP 64 base > http [ACK] Seq=1296 Ack=35331 Win=65535 Len=0
522547 169.431107 244.3.79.141 -> 244.3.160.239 TCP 64 base > http [ACK] Seq=1296 Ack=37380 Win=65535 Len=0
522552 169.432658 244.3.79.141 -> 244.3.160.239 TCP 64 base > http [ACK] Seq=1296 Ack=39431 Win=65535 Len=0
522556 169.434198 244.3.79.141 -> 244.3.160.239 TCP 64 base > http [ACK] Seq=1296 Ack=41480 Win=65535 Len=0
522560 169.435722 244.3.79.141 -> 244.3.160.239 TCP 64 base > http [ACK] Seq=1296 Ack=43529 Win=65535 Len=0
522561 169.436166 244.3.79.141 -> 244.3.160.239 TCP 64 base > http [ACK] Seq=1296 Ack=45193 Win=65535 Len=0
522589 169.457576 244.3.79.141 -> 244.3.160.239 TCP 64 base > http [ACK] Seq=1296 Ack=47242 Win=65535 Len=0
522595 169.459205 244.3.79.141 -> 244.3.160.239 TCP 64 base > http [ACK] Seq=1296 Ack=49291 Win=65535 Len=0
522599 169.460378 244.3.79.141 -> 244.3.160.239 TCP 64 base > http [ACK] Seq=1296 Ack=51219 Win=65535 Len=0
522611 169.462751 244.3.79.141 -> 244.3.160.239 TCP 64 base > http [ACK] Seq=1296 Ack=53339 Win=65535 Len=0
522620 169.465617 244.3.79.141 -> 244.3.160.239 TCP 64 base > http [ACK] Seq=1296 Ack=55642 Win=65535 Len=0
522631 169.467932 244.3.79.141 -> 244.3.160.239 TCP 64 base > http [ACK] Seq=1296 Ack=57545 Win=65535 Len=0
522632 169.467937 244.3.79.141 -> 244.3.160.239 TCP 64 base > http [ACK] Seq=1296 Ack=57546 Win=65535 Len=0
522633 169.468024 244.3.79.141 -> 244.3.160.239 TCP 64 base > http [FIN, ACK] Seq=1296 Ack=57546 Win=65535 Len=0
522788 169.580860 244.3.79.141 -> 244.3.160.239 TCP 66 10408 > http [SYN] Seq=0 Win=65535 Len=0 MSS=1380 SACK_PERM=1
522790 169.581507 244.3.79.141 -> 244.3.160.239 TCP 64 10408 > http [ACK] Seq=1 Ack=1 Win=65535 Len=0
522799 169.596763 244.3.79.141 -> 244.3.160.239 TCP 66 14071 > http [SYN] Seq=0 Win=65535 Len=0 MSS=1380 SACK_PERM=1
522803 169.597655 244.3.79.141 -> 244.3.160.239 TCP 66 9856 > http [SYN] Seq=0 Win=65535 Len=0 MSS=1380 SACK_PERM=1
522804 169.597660 244.3.79.141 -> 244.3.160.239 TCP 64 14071 > http [ACK] Seq=1 Ack=1 Win=65535 Len=0
522805 169.597664 244.3.79.141 -> 244.3.160.239 TCP 66 4505 > http [SYN] Seq=0 Win=65535 Len=0 MSS=1380 SACK_PERM=1
522806 169.597706 244.3.79.141 -> 244.3.160.239 TCP 66 12291 > http [SYN] Seq=0 Win=65535 Len=0 MSS=1380 SACK_PERM=1
522810 169.598005 244.3.79.141 -> 244.3.160.239 TCP 66 10061 > http [SYN] Seq=0 Win=65535 Len=0 MSS=1380 SACK_PERM=1
522812 169.598253 244.3.79.141 -> 244.3.160.239 TCP 64 9856 > http [ACK] Seq=1 Ack=1 Win=65535 Len=0
522813 169.598302 244.3.79.141 -> 244.3.160.239 TCP 64 4505 > http [ACK] Seq=1 Ack=1 Win=65535 Len=0
522814 169.598386 244.3.79.141 -> 244.3.160.239 TCP 64 12291 > http [ACK] Seq=1 Ack=1 Win=65535 Len=0
522816 169.598631 244.3.79.141 -> 244.3.160.239 TCP 64 10061 > http [ACK] Seq=1 Ack=1 Win=65535 Len=0
523195 169.844676 244.3.79.141 -> 244.3.160.239 TCP 64 14071 > http [ACK] Seq=1083 Ack=957 Win=64580 Len=0
523198 169.844889 244.3.79.141 -> 244.3.160.239 TCP 64 14071 > http [FIN, ACK] Seq=1083 Ack=957 Win=64580 Len=0
523203 169.845490 244.3.79.141 -> 244.3.160.239 TCP 66 10577 > http [SYN] Seq=0 Win=65535 Len=0 MSS=1380 SACK_PERM=1
523207 169.846335 244.3.79.141 -> 244.3.160.239 TCP 64 10577 > http [ACK] Seq=1 Ack=1 Win=65535 Len=0
523377 169.935748 244.3.79.141 -> 244.3.160.239 TCP 66 15232 > http [SYN] Seq=0 Win=65535 Len=0 MSS=1380 SACK_PERM=1
523379 169.936456 244.3.79.141 -> 244.3.160.239 TCP 64 15232 > http [ACK] Seq=1 Ack=1 Win=65535 Len=0
523410 169.952215 244.3.79.141 -> 244.3.160.239 TCP 64 10408 > http [ACK] Seq=1082 Ack=956 Win=64580 Len=0
523411 169.952362 244.3.79.141 -> 244.3.160.239 TCP 64 4505 > http [ACK] Seq=1083 Ack=956 Win=64580 Len=0
523412 169.952367 244.3.79.141 -> 244.3.160.239 TCP 64 12291 > http [ACK] Seq=1083 Ack=956 Win=64580 Len=0
523413 169.952433 244.3.79.141 -> 244.3.160.239 TCP 64 10408 > http [FIN, ACK] Seq=1082 Ack=956 Win=64580 Len=0
523415 169.952807 244.3.79.141 -> 244.3.160.239 TCP 64 4505 > http [FIN, ACK] Seq=1083 Ack=956 Win=64580 Len=0
523418 169.952904 244.3.79.141 -> 244.3.160.239 TCP 64 12291 > http [FIN, ACK] Seq=1083 Ack=956 Win=64580 Len=0
523421 169.953226 244.3.79.141 -> 244.3.160.239 TCP 66 4288 > http [SYN] Seq=0 Win=65535 Len=0 MSS=1380 SACK_PERM=1
523424 169.953636 244.3.79.141 -> 244.3.160.239 TCP 66 empowerid > http [SYN] Seq=0 Win=65535 Len=0 MSS=1380 SACK_PERM=1
523427 169.953945 244.3.79.141 -> 244.3.160.239 TCP 64 4288 > http [ACK] Seq=1 Ack=1 Win=65535 Len=0
523431 169.954355 244.3.79.141 -> 244.3.160.239 TCP 64 empowerid > http [ACK] Seq=1 Ack=1 Win=65535 Len=0
523566 170.053376 244.3.79.141 -> 244.3.160.239 TCP 64 10408 > http [ACK] Seq=1083 Ack=957 Win=64580 Len=0
523569 170.054023 244.3.79.141 -> 244.3.160.239 TCP 64 4505 > http [ACK] Seq=1084 Ack=957 Win=64580 Len=0
523570 170.054028 244.3.79.141 -> 244.3.160.239 TCP 64 12291 > http [ACK] Seq=1084 Ack=957 Win=64580 Len=0
523585 170.055874 244.3.79.141 -> 244.3.160.239 TCP 64 10577 > http [ACK] Seq=1083 Ack=956 Win=64580 Len=0
523586 170.056082 244.3.79.141 -> 244.3.160.239 TCP 64 9856 > http [ACK] Seq=1083 Ack=956 Win=64580 Len=0
523587 170.056087 244.3.79.141 -> 244.3.160.239 TCP 64 10061 > http [ACK] Seq=1083 Ack=956 Win=64580 Len=0
523588 170.056091 244.3.79.141 -> 244.3.160.239 TCP 64 10577 > http [FIN, ACK] Seq=1083 Ack=956 Win=64580 Len=0
523590 170.056420 244.3.79.141 -> 244.3.160.239 TCP 64 9856 > http [FIN, ACK] Seq=1083 Ack=956 Win=64580 Len=0
523591 170.056425 244.3.79.141 -> 244.3.160.239 TCP 64 10061 > http [FIN, ACK] Seq=1083 Ack=956 Win=64580 Len=0
523817 170.161754 244.3.79.141 -> 244.3.160.239 TCP 64 10577 > http [ACK] Seq=1084 Ack=957 Win=64580 Len=0
523822 170.162154 244.3.79.141 -> 244.3.160.239 TCP 64 9856 > http [ACK] Seq=1084 Ack=957 Win=64580 Len=0
523827 170.162695 244.3.79.141 -> 244.3.160.239 TCP 64 10061 > http [ACK] Seq=1084 Ack=957 Win=64580 Len=0
523833 170.163427 244.3.79.141 -> 244.3.160.239 TCP 64 15232 > http [ACK] Seq=1083 Ack=956 Win=64580 Len=0
523834 170.163431 244.3.79.141 -> 244.3.160.239 TCP 64 4288 > http [ACK] Seq=1083 Ack=956 Win=64580 Len=0
523835 170.163525 244.3.79.141 -> 244.3.160.239 TCP 64 empowerid > http [ACK] Seq=1083 Ack=956 Win=64580 Len=0
523840 170.163643 244.3.79.141 -> 244.3.160.239 TCP 64 15232 > http [FIN, ACK] Seq=1083 Ack=956 Win=64580 Len=0
523843 170.163806 244.3.79.141 -> 244.3.160.239 TCP 64 4288 > http [FIN, ACK] Seq=1083 Ack=956 Win=64580 Len=0
523845 170.163815 244.3.79.141 -> 244.3.160.239 TCP 64 empowerid > http [FIN, ACK] Seq=1083 Ack=956 Win=64580 Len=0
524116 170.271825 244.3.79.141 -> 244.3.160.239 TCP 64 15232 > http [ACK] Seq=1084 Ack=957 Win=64580 Len=0
524120 170.272185 244.3.79.141 -> 244.3.160.239 TCP 64 4288 > http [ACK] Seq=1084 Ack=957 Win=64580 Len=0
524123 170.272700 244.3.79.141 -> 244.3.160.239 TCP 64 empowerid > http [ACK] Seq=1084 Ack=957 Win=64580 Len=0
547650 176.841057 244.3.79.141 -> 244.3.160.239 TCP 66 13649 > http [SYN] Seq=0 Win=65535 Len=0 MSS=1380 SACK_PERM=1
547662 176.841762 244.3.79.141 -> 244.3.160.239 TCP 64 13649 > http [ACK] Seq=1 Ack=1 Win=65535 Len=0
550038 177.136424 244.3.79.141 -> 244.3.160.239 TCP 64 13649 > http [ACK] Seq=1237 Ack=2050 Win=65535 Len=0
550047 177.137959 244.3.79.141 -> 244.3.160.239 TCP 64 13649 > http [ACK] Seq=1237 Ack=4099 Win=65535 Len=0
550053 177.139587 244.3.79.141 -> 244.3.160.239 TCP 64 13649 > http [ACK] Seq=1237 Ack=6148 Win=65535 Len=0
550059 177.140848 244.3.79.141 -> 244.3.160.239 TCP 64 13649 > http [ACK] Seq=1237 Ack=8197 Win=65535 Len=0
550077 177.142487 244.3.79.141 -> 244.3.160.239 TCP 64 13649 > http [ACK] Seq=1237 Ack=10246 Win=65535 Len=0
550085 177.143952 244.3.79.141 -> 244.3.160.239 TCP 64 13649 > http [ACK] Seq=1237 Ack=12302 Win=63479 Len=0
550089 177.145430 244.3.79.141 -> 244.3.160.239 TCP 64 13649 > http [ACK] Seq=1237 Ack=14351 Win=61430 Len=0
550094 177.146799 244.3.79.141 -> 244.3.160.239 TCP 64 13649 > http [ACK] Seq=1237 Ack=16400 Win=59381 Len=0
550102 177.148423 244.3.79.141 -> 244.3.160.239 TCP 64 13649 > http [ACK] Seq=1237 Ack=17780 Win=65535 Len=0
550118 177.149799 244.3.79.141 -> 244.3.160.239 TCP 64 13649 > http [ACK] Seq=1237 Ack=19829 Win=65535 Len=0
550130 177.151287 244.3.79.141 -> 244.3.160.239 TCP 64 13649 > http [ACK] Seq=1237 Ack=21878 Win=65535 Len=0
550134 177.151428 244.3.79.141 -> 244.3.160.239 TCP 64 13649 > http [ACK] Seq=1237 Ack=23046 Win=64367 Len=0
550260 177.173321 244.3.79.141 -> 244.3.160.239 TCP 64 13649 > http [ACK] Seq=1237 Ack=25095 Win=65535 Len=0
550265 177.175039 244.3.79.141 -> 244.3.160.239 TCP 64 13649 > http [ACK] Seq=1237 Ack=27144 Win=65535 Len=0
550271 177.176217 244.3.79.141 -> 244.3.160.239 TCP 64 13649 > http [ACK] Seq=1237 Ack=28947 Win=65535 Len=0
550285 177.177952 244.3.79.141 -> 244.3.160.239 TCP 64 13649 > http [ACK] Seq=1237 Ack=30996 Win=65535 Len=0
550291 177.179458 244.3.79.141 -> 244.3.160.239 TCP 64 13649 > http [ACK] Seq=1237 Ack=33045 Win=65535 Len=0
550299 177.181031 244.3.79.141 -> 244.3.160.239 TCP 64 13649 > http [ACK] Seq=1237 Ack=35094 Win=65535 Len=0
550302 177.181623 244.3.79.141 -> 244.3.160.239 TCP 64 13649 > http [ACK] Seq=1237 Ack=36051 Win=64579 Len=0
550303 177.181628 244.3.79.141 -> 244.3.160.239 TCP 64 13649 > http [FIN, ACK] Seq=1237 Ack=36051 Win=64579 Len=0
559873 179.814944 244.3.79.141 -> 244.3.160.239 TCP 66 12108 > http [SYN] Seq=0 Win=65535 Len=0 MSS=1380 SACK_PERM=1
559875 179.815671 244.3.79.141 -> 244.3.160.239 TCP 64 12108 > http [ACK] Seq=1 Ack=1 Win=65535 Len=0
565234 180.838246 244.3.79.141 -> 244.3.160.239 TCP 64 12108 > http [ACK] Seq=1287 Ack=2050 Win=65535 Len=0
565238 180.839694 244.3.79.141 -> 244.3.160.239 TCP 64 12108 > http [ACK] Seq=1287 Ack=4099 Win=65535 Len=0
565242 180.841225 244.3.79.141 -> 244.3.160.239 TCP 64 12108 > http [ACK] Seq=1287 Ack=6148 Win=65535 Len=0
565245 180.842675 244.3.79.141 -> 244.3.160.239 TCP 64 12108 > http [ACK] Seq=1287 Ack=8199 Win=65535 Len=0
565251 180.844267 244.3.79.141 -> 244.3.160.239 TCP 64 12108 > http [ACK] Seq=1287 Ack=10248 Win=65535 Len=0
565266 180.845844 244.3.79.141 -> 244.3.160.239 TCP 64 12108 > http [ACK] Seq=1287 Ack=12297 Win=63486 Len=0
565273 180.847223 244.3.79.141 -> 244.3.160.239 TCP 64 12108 > http [ACK] Seq=1287 Ack=14346 Win=61437 Len=0
565276 180.848745 244.3.79.141 -> 244.3.160.239 TCP 64 12108 > http [ACK] Seq=1287 Ack=16407 Win=59376 Len=0
565299 180.850093 244.3.79.141 -> 244.3.160.239 TCP 64 12108 > http [ACK] Seq=1287 Ack=18456 Win=57327 Len=0
565318 180.851562 244.3.79.141 -> 244.3.160.239 TCP 64 12108 > http [ACK] Seq=1287 Ack=20543 Win=55240 Len=0
565321 180.852318 244.3.79.141 -> 244.3.160.239 TCP 64 [TCP Window Update] 12108 > http [ACK] Seq=1287 Ack=20543 Win=65535 Len=0
565323 180.852970 244.3.79.141 -> 244.3.160.239 TCP 64 12108 > http [ACK] Seq=1287 Ack=22592 Win=65535 Len=0
565426 180.876404 244.3.79.141 -> 244.3.160.239 TCP 64 12108 > http [ACK] Seq=1287 Ack=24813 Win=65535 Len=0
565427 180.876594 244.3.79.141 -> 244.3.160.239 TCP 64 12108 > http [ACK] Seq=1287 Ack=26354 Win=65535 Len=0
565441 180.878664 244.3.79.141 -> 244.3.160.239 TCP 64 12108 > http [ACK] Seq=1287 Ack=28416 Win=65535 Len=0
565448 180.880048 244.3.79.141 -> 244.3.160.239 TCP 64 12108 > http [ACK] Seq=1287 Ack=30468 Win=65535 Len=0
565457 180.881538 244.3.79.141 -> 244.3.160.239 TCP 64 12108 > http [ACK] Seq=1287 Ack=32575 Win=65535 Len=0
565480 180.882847 244.3.79.141 -> 244.3.160.239 TCP 64 12108 > http [ACK] Seq=1287 Ack=34624 Win=65535 Len=0
565499 180.886375 244.3.79.141 -> 244.3.160.239 TCP 64 12108 > http [ACK] Seq=1287 Ack=36504 Win=65535 Len=0
565508 180.889894 244.3.79.141 -> 244.3.160.239 TCP 64 12108 > http [ACK] Seq=1287 Ack=38553 Win=65535 Len=0
565511 180.891513 244.3.79.141 -> 244.3.160.239 TCP 64 12108 > http [ACK] Seq=1287 Ack=40955 Win=65535 Len=0
565515 180.893082 244.3.79.141 -> 244.3.160.239 TCP 64 12108 > http [ACK] Seq=1287 Ack=43004 Win=65535 Len=0
565519 180.894685 244.3.79.141 -> 244.3.160.239 TCP 64 12108 > http [ACK] Seq=1287 Ack=45053 Win=65535 Len=0
565520 180.895370 244.3.79.141 -> 244.3.160.239 TCP 64 12108 > http [ACK] Seq=1287 Ack=46827 Win=65535 Len=0
565549 180.913776 244.3.79.141 -> 244.3.160.239 TCP 64 12108 > http [ACK] Seq=1287 Ack=48876 Win=65535 Len=0
565555 180.915199 244.3.79.141 -> 244.3.160.239 TCP 64 12108 > http [ACK] Seq=1287 Ack=50925 Win=65535 Len=0
565558 180.916516 244.3.79.141 -> 244.3.160.239 TCP 64 12108 > http [ACK] Seq=1287 Ack=52974 Win=65535 Len=0
565565 180.917198 244.3.79.141 -> 244.3.160.239 TCP 66 9514 > http [SYN] Seq=0 Win=65535 Len=0 MSS=1380 SACK_PERM=1
565569 180.917851 244.3.79.141 -> 244.3.160.239 TCP 64 12108 > http [ACK] Seq=1287 Ack=55023 Win=65535 Len=0
565570 180.917951 244.3.79.141 -> 244.3.160.239 TCP 64 9514 > http [ACK] Seq=1 Ack=1 Win=65535 Len=0
565578 180.920335 244.3.79.141 -> 244.3.160.239 TCP 64 12108 > http [ACK] Seq=1287 Ack=56968 Win=65535 Len=0
565582 180.921438 244.3.79.141 -> 244.3.160.239 TCP 64 12108 > http [ACK] Seq=1287 Ack=59017 Win=65535 Len=0
565586 180.922714 244.3.79.141 -> 244.3.160.239 TCP 64 12108 > http [ACK] Seq=1287 Ack=61066 Win=65535 Len=0
565604 180.926380 244.3.79.141 -> 244.3.160.239 TCP 64 12108 > http [ACK] Seq=1287 Ack=62803 Win=65535 Len=0
565606 180.926574 244.3.79.141 -> 244.3.160.239 TCP 64 12108 > http [ACK] Seq=1287 Ack=64307 Win=65535 Len=0
565624 180.929146 244.3.79.141 -> 244.3.160.239 TCP 64 12108 > http [ACK] Seq=1287 Ack=66356 Win=65535 Len=0
565634 180.932506 244.3.79.141 -> 244.3.160.239 TCP 64 12108 > http [ACK] Seq=1287 Ack=68639 Win=65535 Len=0
565636 180.932658 244.3.79.141 -> 244.3.160.239 TCP 64 12108 > http [ACK] Seq=1287 Ack=70175 Win=65535 Len=0
565802 180.950669 244.3.79.141 -> 244.3.160.239 TCP 64 12108 > http [ACK] Seq=1287 Ack=72255 Win=65535 Len=0
565830 180.952918 244.3.79.141 -> 244.3.160.239 TCP 64 12108 > http [ACK] Seq=1287 Ack=74589 Win=65535 Len=0
565843 180.954350 244.3.79.141 -> 244.3.160.239 TCP 64 12108 > http [ACK] Seq=1287 Ack=76638 Win=65535 Len=0
565850 180.955649 244.3.79.141 -> 244.3.160.239 TCP 64 12108 > http [ACK] Seq=1287 Ack=78687 Win=65535 Len=0
565864 180.957080 244.3.79.141 -> 244.3.160.239 TCP 64 12108 > http [ACK] Seq=1287 Ack=80736 Win=65535 Len=0
565880 180.958301 244.3.79.141 -> 244.3.160.239 TCP 64 12108 > http [ACK] Seq=1287 Ack=82785 Win=65535 Len=0
565883 180.958398 244.3.79.141 -> 244.3.160.239 TCP 64 12108 > http [ACK] Seq=1287 Ack=83932 Win=64388 Len=0
565884 180.958422 244.3.79.141 -> 244.3.160.239 TCP 64 12108 > http [ACK] Seq=1287 Ack=83933 Win=64388 Len=0
566033 180.994752 244.3.79.141 -> 244.3.160.239 TCP 64 12108 > http [FIN, ACK] Seq=1287 Ack=83933 Win=64388 Len=0
566131 181.012661 244.3.79.141 -> 244.3.160.239 TCP 64 9514 > http [ACK] Seq=1057 Ack=921 Win=64616 Len=0
566132 181.012666 244.3.79.141 -> 244.3.160.239 TCP 64 9514 > http [FIN, ACK] Seq=1057 Ack=921 Win=64616 Len=0
566660 181.177200 244.3.79.141 -> 244.3.160.239 TCP 66 15533 > http [SYN] Seq=0 Win=65535 Len=0 MSS=1380 SACK_PERM=1
566662 181.178051 244.3.79.141 -> 244.3.160.239 TCP 64 15533 > http [ACK] Seq=1 Ack=1 Win=65535 Len=0
567026 181.252147 244.3.79.141 -> 244.3.160.239 TCP 66 infocrypt > http [SYN] Seq=0 Win=65535 Len=0 MSS=1380 SACK_PERM=1
567029 181.252738 244.3.79.141 -> 244.3.160.239 TCP 64 infocrypt > http [ACK] Seq=1 Ack=1 Win=65535 Len=0
567313 181.323714 244.3.79.141 -> 244.3.160.239 TCP 66 14030 > http [SYN] Seq=0 Win=65535 Len=0 MSS=1380 SACK_PERM=1
567315 181.324645 244.3.79.141 -> 244.3.160.239 TCP 64 14030 > http [ACK] Seq=1 Ack=1 Win=65535 Len=0
567473 181.361404 244.3.79.141 -> 244.3.160.239 TCP 64 15533 > http [ACK] Seq=1329 Ack=1570 Win=65535 Len=0
567581 181.392485 244.3.79.141 -> 244.3.160.239 TCP 64 15533 > http [FIN, ACK] Seq=1329 Ack=1951 Win=65154 Len=0
567935 181.461599 244.3.79.141 -> 244.3.160.239 TCP 64 15533 > http [ACK] Seq=1330 Ack=1952 Win=65154 Len=0
568281 181.549422 244.3.79.141 -> 244.3.160.239 TCP 66 12126 > http [SYN] Seq=0 Win=65535 Len=0 MSS=1380 SACK_PERM=1
568288 181.550207 244.3.79.141 -> 244.3.160.239 TCP 64 12126 > http [ACK] Seq=1 Ack=1 Win=65535 Len=0
568338 181.572306 244.3.79.141 -> 244.3.160.239 TCP 64 infocrypt > http [ACK] Seq=1092 Ack=1674 Win=65535 Len=0
568436 181.621602 244.3.79.141 -> 244.3.160.239 TCP 64 14030 > http [ACK] Seq=1340 Ack=205 Win=65332 Len=0
568453 181.627330 244.3.79.141 -> 244.3.160.239 TCP 64 14030 > http [FIN, ACK] Seq=1340 Ack=205 Win=65332 Len=0
568454 181.627334 244.3.79.141 -> 244.3.160.239 TCP 64 infocrypt > http [FIN, ACK] Seq=1092 Ack=1674 Win=65535 Len=0
568469 181.628470 244.3.79.141 -> 244.3.160.239 TCP 66 15851 > http [SYN] Seq=0 Win=65535 Len=0 MSS=1380 SACK_PERM=1
568470 181.628475 244.3.79.141 -> 244.3.160.239 TCP 66 apc-2260 > http [SYN] Seq=0 Win=65535 Len=0 MSS=1380 SACK_PERM=1
568472 181.628603 244.3.79.141 -> 244.3.160.239 TCP 66 8172 > http [SYN] Seq=0 Win=65535 Len=0 MSS=1380 SACK_PERM=1
568476 181.628755 244.3.79.141 -> 244.3.160.239 TCP 66 10560 > http [SYN] Seq=0 Win=65535 Len=0 MSS=1380 SACK_PERM=1
568479 181.629305 244.3.79.141 -> 244.3.160.239 TCP 64 15851 > http [ACK] Seq=1 Ack=1 Win=65535 Len=0
568480 181.629309 244.3.79.141 -> 244.3.160.239 TCP 64 apc-2260 > http [ACK] Seq=1 Ack=1 Win=65535 Len=0
568481 181.629502 244.3.79.141 -> 244.3.160.239 TCP 66 13652 > http [SYN] Seq=0 Win=65535 Len=0 MSS=1380 SACK_PERM=1
568482 181.629507 244.3.79.141 -> 244.3.160.239 TCP 64 8172 > http [ACK] Seq=1 Ack=1 Win=65535 Len=0
568483 181.629512 244.3.79.141 -> 244.3.160.239 TCP 64 10560 > http [ACK] Seq=1 Ack=1 Win=65535 Len=0
568487 181.630244 244.3.79.141 -> 244.3.160.239 TCP 64 13652 > http [ACK] Seq=1 Ack=1 Win=65535 Len=0
568616 181.681828 244.3.79.141 -> 244.3.160.239 TCP 64 infocrypt > http [ACK] Seq=1093 Ack=1675 Win=65535 Len=0
568726 181.714822 244.3.79.141 -> 244.3.160.239 TCP 64 12126 > http [ACK] Seq=1138 Ack=2050 Win=65535 Len=0
568729 181.716249 244.3.79.141 -> 244.3.160.239 TCP 64 12126 > http [ACK] Seq=1138 Ack=4259 Win=65535 Len=0
568732 181.717855 244.3.79.141 -> 244.3.160.239 TCP 64 12126 > http [ACK] Seq=1138 Ack=6308 Win=65535 Len=0
568737 181.718958 244.3.79.141 -> 244.3.160.239 TCP 64 12126 > http [ACK] Seq=1138 Ack=8357 Win=65535 Len=0
568753 181.720417 244.3.79.141 -> 244.3.160.239 TCP 64 12126 > http [ACK] Seq=1138 Ack=10406 Win=63486 Len=0
568755 181.720432 244.3.79.141 -> 244.3.160.239 TCP 64 12126 > http [ACK] Seq=1138 Ack=11124 Win=62769 Len=0
568772 181.720777 244.3.79.141 -> 244.3.160.239 TCP 64 [TCP Window Update] 12126 > http [ACK] Seq=1138 Ack=11124 Win=65535 Len=0
568783 181.721949 244.3.79.141 -> 244.3.160.239 TCP 64 12126 > http [FIN, ACK] Seq=1138 Ack=11124 Win=65535 Len=0
568944 181.803573 244.3.79.141 -> 244.3.160.239 TCP 64 apc-2260 > http [ACK] Seq=1124 Ack=218 Win=65319 Len=0
568945 181.803721 244.3.79.141 -> 244.3.160.239 TCP 64 apc-2260 > http [FIN, ACK] Seq=1124 Ack=218 Win=65319 Len=0
568947 181.804209 244.3.79.141 -> 244.3.160.239 TCP 64 10560 > http [ACK] Seq=1111 Ack=205 Win=65332 Len=0
568948 181.804264 244.3.79.141 -> 244.3.160.239 TCP 64 10560 > http [FIN, ACK] Seq=1111 Ack=205 Win=65332 Len=0
569187 181.862275 244.3.79.141 -> 244.3.160.239 TCP 64 8172 > http [ACK] Seq=1168 Ack=191 Win=65346 Len=0
569188 181.862415 244.3.79.141 -> 244.3.160.239 TCP 64 8172 > http [FIN, ACK] Seq=1168 Ack=191 Win=65346 Len=0
569227 181.901674 244.3.79.141 -> 244.3.160.239 TCP 64 15851 > http [ACK] Seq=1111 Ack=312 Win=65224 Len=0
569228 181.901781 244.3.79.141 -> 244.3.160.239 TCP 64 13652 > http [ACK] Seq=896 Ack=642 Win=64894 Len=0
569229 181.901951 244.3.79.141 -> 244.3.160.239 TCP 64 15851 > http [FIN, ACK] Seq=1111 Ack=312 Win=65224 Len=0
569514 182.011640 244.3.79.141 -> 244.3.160.239 TCP 64 15851 > http [ACK] Seq=1112 Ack=313 Win=65224 Len=0
569516 182.012121 244.3.79.141 -> 244.3.160.239 TCP 64 13652 > http [ACK] Seq=896 Ack=643 Win=64894 Len=0
569517 182.012244 244.3.79.141 -> 244.3.160.239 TCP 64 13652 > http [FIN, ACK] Seq=896 Ack=643 Win=64894 Len=0
865470 286.097375 244.3.79.141 -> 244.3.160.239 TCP 66 13033 > http [SYN] Seq=0 Win=65535 Len=0 MSS=1380 SACK_PERM=1
865475 286.098115 244.3.79.141 -> 244.3.160.239 TCP 64 13033 > http [ACK] Seq=1 Ack=1 Win=65535 Len=0
874015 289.195509 244.3.79.141 -> 244.3.160.239 TCP 64 13033 > http [ACK] Seq=1231 Ack=2050 Win=65535 Len=0
874020 289.196748 244.3.79.141 -> 244.3.160.239 TCP 64 13033 > http [ACK] Seq=1231 Ack=3972 Win=65535 Len=0
874072 289.231224 244.3.79.141 -> 244.3.160.239 TCP 64 13033 > http [ACK] Seq=1231 Ack=6029 Win=65535 Len=0
874078 289.232673 244.3.79.141 -> 244.3.160.239 TCP 64 13033 > http [ACK] Seq=1231 Ack=8078 Win=65535 Len=0
874081 289.233708 244.3.79.141 -> 244.3.160.239 TCP 64 13033 > http [ACK] Seq=1231 Ack=9843 Win=65535 Len=0
874136 289.267698 244.3.79.141 -> 244.3.160.239 TCP 64 13033 > http [ACK] Seq=1231 Ack=11902 Win=65535 Len=0
874141 289.269078 244.3.79.141 -> 244.3.160.239 TCP 64 13033 > http [ACK] Seq=1231 Ack=13963 Win=65535 Len=0
874146 289.270553 244.3.79.141 -> 244.3.160.239 TCP 64 13033 > http [ACK] Seq=1231 Ack=16012 Win=65535 Len=0
874149 289.272057 244.3.79.141 -> 244.3.160.239 TCP 64 13033 > http [ACK] Seq=1231 Ack=18061 Win=65535 Len=0
874155 289.273520 244.3.79.141 -> 244.3.160.239 TCP 64 13033 > http [ACK] Seq=1231 Ack=20110 Win=65535 Len=0
874163 289.274975 244.3.79.141 -> 244.3.160.239 TCP 64 13033 > http [ACK] Seq=1231 Ack=22159 Win=65535 Len=0
874256 289.307115 244.3.79.141 -> 244.3.160.239 TCP 64 13033 > http [ACK] Seq=1231 Ack=24387 Win=65535 Len=0
874263 289.308652 244.3.79.141 -> 244.3.160.239 TCP 64 13033 > http [ACK] Seq=1231 Ack=26502 Win=65535 Len=0
874271 289.310065 244.3.79.141 -> 244.3.160.239 TCP 64 13033 > http [ACK] Seq=1231 Ack=28590 Win=65535 Len=0
874290 289.311528 244.3.79.141 -> 244.3.160.239 TCP 64 13033 > http [ACK] Seq=1231 Ack=30643 Win=65535 Len=0
874291 289.311623 244.3.79.141 -> 244.3.160.239 TCP 64 13033 > http [ACK] Seq=1231 Ack=31813 Win=64365 Len=0
874296 289.313808 244.3.79.141 -> 244.3.160.239 TCP 64 13033 > http [ACK] Seq=1231 Ack=33862 Win=65535 Len=0
874301 289.315237 244.3.79.141 -> 244.3.160.239 TCP 64 13033 > http [ACK] Seq=1231 Ack=35911 Win=65535 Len=0
874310 289.316725 244.3.79.141 -> 244.3.160.239 TCP 64 13033 > http [ACK] Seq=1231 Ack=37985 Win=65535 Len=0
874315 289.318130 244.3.79.141 -> 244.3.160.239 TCP 64 13033 > http [ACK] Seq=1231 Ack=40034 Win=65535 Len=0
874321 289.319790 244.3.79.141 -> 244.3.160.239 TCP 64 13033 > http [ACK] Seq=1231 Ack=41985 Win=65535 Len=0
874322 289.319954 244.3.79.141 -> 244.3.160.239 TCP 64 13033 > http [ACK] Seq=1231 Ack=41986 Win=65535 Len=0
874323 289.320100 244.3.79.141 -> 244.3.160.239 TCP 64 13033 > http [FIN, ACK] Seq=1231 Ack=41986 Win=65535 Len=0
952820 315.960498 244.3.79.141 -> 41.177.98.176 TCP 66 sep > http [SYN] Seq=0 Win=65535 Len=0 MSS=1380 SACK_PERM=1
952823 315.961022 244.3.79.141 -> 41.177.98.176 TCP 64 sep > http [ACK] Seq=1 Ack=1 Win=65535 Len=0
957225 317.829465 244.3.79.141 -> 41.177.98.176 TCP 64 sep > http [ACK] Seq=954 Ack=2761 Win=65535 Len=0
957238 317.830287 244.3.79.141 -> 41.177.98.176 TCP 64 sep > http [ACK] Seq=954 Ack=5335 Win=65535 Len=0
957270 317.832277 244.3.79.141 -> 41.177.98.176 TCP 64 sep > http [ACK] Seq=954 Ack=8095 Win=65535 Len=0
957271 317.832463 244.3.79.141 -> 41.177.98.176 TCP 64 sep > http [ACK] Seq=954 Ack=10463 Win=65535 Len=0
957305 317.835112 244.3.79.141 -> 41.177.98.176 TCP 64 sep > http [ACK] Seq=954 Ack=13223 Win=65535 Len=0
957307 317.835293 244.3.79.141 -> 41.177.98.176 TCP 64 sep > http [ACK] Seq=954 Ack=15591 Win=65535 Len=0
957346 317.837986 244.3.79.141 -> 41.177.98.176 TCP 64 sep > http [ACK] Seq=954 Ack=18351 Win=65535 Len=0
957347 317.838191 244.3.79.141 -> 41.177.98.176 TCP 64 sep > http [ACK] Seq=954 Ack=20719 Win=65535 Len=0
957374 317.840889 244.3.79.141 -> 41.177.98.176 TCP 64 sep > http [ACK] Seq=954 Ack=22030 Win=64224 Len=0
980104 326.964410 244.3.79.141 -> 41.177.98.176 TCP 64 sep > http [ACK] Seq=2062 Ack=24790 Win=65535 Len=0
980105 326.964617 244.3.79.141 -> 41.177.98.176 TCP 64 sep > http [ACK] Seq=2062 Ack=27363 Win=65535 Len=0
980110 326.967321 244.3.79.141 -> 41.177.98.176 TCP 64 sep > http [ACK] Seq=2062 Ack=30123 Win=65535 Len=0
980111 326.967425 244.3.79.141 -> 41.177.98.176 TCP 64 sep > http [ACK] Seq=2062 Ack=32491 Win=65535 Len=0
980118 326.970132 244.3.79.141 -> 41.177.98.176 TCP 64 sep > http [ACK] Seq=2062 Ack=35251 Win=64155 Len=0
980119 326.970309 244.3.79.141 -> 41.177.98.176 TCP 64 sep > http [ACK] Seq=2062 Ack=37619 Win=61787 Len=0
980134 326.975009 244.3.79.141 -> 41.177.98.176 TCP 64 sep > http [ACK] Seq=2062 Ack=40379 Win=59027 Len=0
980135 326.975163 244.3.79.141 -> 41.177.98.176 TCP 64 sep > http [ACK] Seq=2062 Ack=42459 Win=56947 Len=0
980136 326.976445 244.3.79.141 -> 41.177.98.176 TCP 64 sep > http [ACK] Seq=2062 Ack=42464 Win=60702 Len=0
980137 326.976501 244.3.79.141 -> 41.177.98.176 TCP 64 [TCP Window Update] sep > http [ACK] Seq=2062 Ack=42464 Win=65535 Len=0
980996 327.519023 244.3.79.141 -> 41.177.98.176 TCP 64 sep > http [ACK] Seq=3077 Ack=43723 Win=64276 Len=0
1016726 342.418163 244.3.79.141 -> 41.177.98.176 TCP 64 sep > http [ACK] Seq=3077 Ack=43724 Win=64276 Len=0
1021543 344.895056 244.3.79.141 -> 41.177.98.176 TCP 64 sep > http [FIN, ACK] Seq=3077 Ack=43724 Win=64276 Len=0
