364410 124.092937 244.153.111.194 -> 41.177.98.127 TCP 78 60571 > z39-50 [SYN] Seq=0 Win=5840 Len=0 MSS=1460 SACK_PERM=1 TSval=425122161 TSecr=0 WS=1
364830 124.264976 244.153.111.194 -> 41.177.98.127 TCP 70 60571 > z39-50 [ACK] Seq=1 Ack=1 Win=5840 Len=0 TSval=425122178 TSecr=1577443
364868 124.269348 244.153.111.194 -> 41.177.98.127 TCP 122 60571 > z39-50 [PSH, ACK] Seq=1 Ack=1 Win=5840 Len=52 TSval=425122179 TSecr=1577443
367512 125.734851 244.153.111.194 -> 41.177.98.127 TCP 70 60571 > z39-50 [ACK] Seq=53 Ack=77 Win=5840 Len=0 TSval=425122325 TSecr=1577590
367513 125.736677 244.153.111.194 -> 41.177.98.127 TCP 148 60571 > z39-50 [PSH, ACK] Seq=53 Ack=77 Win=5840 Len=78 TSval=425122325 TSecr=1577590
367847 125.947175 244.153.111.194 -> 41.177.98.127 TCP 109 60571 > z39-50 [PSH, ACK] Seq=131 Ack=100 Win=5840 Len=39 TSval=425122346 TSecr=1577611
368434 126.210727 244.153.111.194 -> 41.177.98.127 TCP 70 60571 > z39-50 [FIN, ACK] Seq=170 Ack=1280 Win=7080 Len=0 TSval=425122373 TSecr=1577638
372305 126.380983 244.153.111.194 -> 41.177.98.127 TCP 70 60571 > z39-50 [ACK] Seq=171 Ack=1281 Win=7080 Len=0 TSval=425122390 TSecr=1577655
699690 221.904304 244.153.111.194 -> 41.177.98.127 TCP 78 60540 > z39-50 [SYN] Seq=0 Win=5840 Len=0 MSS=1460 SACK_PERM=1 TSval=425131942 TSecr=0 WS=1
700120 222.072494 244.153.111.194 -> 41.177.98.127 TCP 70 60540 > z39-50 [ACK] Seq=1 Ack=1 Win=5840 Len=0 TSval=425131959 TSecr=1587224
700121 222.072498 244.153.111.194 -> 41.177.98.127 TCP 122 60540 > z39-50 [PSH, ACK] Seq=1 Ack=1 Win=5840 Len=52 TSval=425131959 TSecr=1587224
702977 223.548293 244.153.111.194 -> 41.177.98.127 TCP 70 60540 > z39-50 [ACK] Seq=53 Ack=77 Win=5840 Len=0 TSval=425132106 TSecr=1587371
702996 223.552398 244.153.111.194 -> 41.177.98.127 TCP 217 60540 > z39-50 [PSH, ACK] Seq=53 Ack=77 Win=5840 Len=147 TSval=425132107 TSecr=1587371
703380 223.726885 244.153.111.194 -> 41.177.98.127 TCP 70 60540 > z39-50 [FIN, ACK] Seq=200 Ack=144 Win=5840 Len=0 TSval=425132124 TSecr=1587389
703736 223.897032 244.153.111.194 -> 41.177.98.127 TCP 70 60540 > z39-50 [ACK] Seq=201 Ack=145 Win=5840 Len=0 TSval=425132141 TSecr=1587406
761093 245.501698 244.153.111.194 -> 41.177.98.127 TCP 78 60536 > z39-50 [SYN] Seq=0 Win=5840 Len=0 MSS=1460 SACK_PERM=1 TSval=425134302 TSecr=0 WS=1
761483 245.671320 244.153.111.194 -> 41.177.98.127 TCP 70 60536 > z39-50 [ACK] Seq=1 Ack=1 Win=5840 Len=0 TSval=425134319 TSecr=1589584
761484 245.671325 244.153.111.194 -> 41.177.98.127 TCP 122 60536 > z39-50 [PSH, ACK] Seq=1 Ack=1 Win=5840 Len=52 TSval=425134319 TSecr=1589584
765368 247.162398 244.153.111.194 -> 41.177.98.127 TCP 70 60536 > z39-50 [ACK] Seq=53 Ack=77 Win=5840 Len=0 TSval=425134468 TSecr=1589733
765369 247.164315 244.153.111.194 -> 41.177.98.127 TCP 203 60536 > z39-50 [PSH, ACK] Seq=53 Ack=77 Win=5840 Len=133 TSval=425134468 TSecr=1589733
765624 247.345544 244.153.111.194 -> 41.177.98.127 TCP 70 60536 > z39-50 [FIN, ACK] Seq=186 Ack=144 Win=5840 Len=0 TSval=425134486 TSecr=1589751
765884 247.514078 244.153.111.194 -> 41.177.98.127 TCP 70 60536 > z39-50 [ACK] Seq=187 Ack=145 Win=5840 Len=0 TSval=425134503 TSecr=1589768
