6761   2.210766 244.3.93.229 -> 41.177.98.176 TCP 64 linx > http [RST, ACK] Seq=1 Ack=1 Win=0 Len=0
41954  17.453579 244.3.93.229 -> 41.177.98.176 TCP 66 timeflies > http [SYN] Seq=0 Win=65535 Len=0 MSS=1380 SACK_PERM=1
41957  17.454320 244.3.93.229 -> 41.177.98.176 TCP 64 timeflies > http [ACK] Seq=1 Ack=1 Win=65535 Len=0
42367  17.734448 244.3.93.229 -> 41.177.98.176 TCP 64 timeflies > http [ACK] Seq=1079 Ack=2761 Win=65535 Len=0
42369  17.735295 244.3.93.229 -> 41.177.98.176 TCP 64 timeflies > http [ACK] Seq=1079 Ack=5335 Win=65535 Len=0
42374  17.737534 244.3.93.229 -> 41.177.98.176 TCP 64 timeflies > http [ACK] Seq=1079 Ack=8095 Win=65535 Len=0
42375  17.737714 244.3.93.229 -> 41.177.98.176 TCP 64 timeflies > http [ACK] Seq=1079 Ack=10463 Win=65535 Len=0
42381  17.740490 244.3.93.229 -> 41.177.98.176 TCP 64 timeflies > http [ACK] Seq=1079 Ack=13223 Win=65535 Len=0
42382  17.740679 244.3.93.229 -> 41.177.98.176 TCP 64 timeflies > http [ACK] Seq=1079 Ack=15591 Win=65535 Len=0
42389  17.744943 244.3.93.229 -> 41.177.98.176 TCP 64 timeflies > http [ACK] Seq=1079 Ack=20719 Win=65535 Len=0
42397  17.754354 244.3.93.229 -> 41.177.98.176 TCP 64 timeflies > http [ACK] Seq=1079 Ack=22075 Win=64179 Len=0
84394  32.759534 244.3.93.229 -> 41.177.98.176 TCP 64 timeflies > http [ACK] Seq=1079 Ack=22076 Win=64179 Len=0
85282  33.117720 244.3.93.229 -> 41.177.98.176 TCP 64 timeflies > http [RST, ACK] Seq=1079 Ack=22076 Win=0 Len=0
332372 115.885311 244.3.93.229 -> 41.177.98.176 TCP 66 netware-csp > http [SYN] Seq=0 Win=65535 Len=0 MSS=1380 SACK_PERM=1
332376 115.885995 244.3.93.229 -> 41.177.98.176 TCP 64 netware-csp > http [ACK] Seq=1 Ack=1 Win=65535 Len=0
332748 116.139857 244.3.93.229 -> 41.177.98.176 TCP 64 netware-csp > http [ACK] Seq=1145 Ack=2761 Win=65535 Len=0
332757 116.140734 244.3.93.229 -> 41.177.98.176 TCP 64 netware-csp > http [ACK] Seq=1145 Ack=5335 Win=65535 Len=0
332764 116.143034 244.3.93.229 -> 41.177.98.176 TCP 64 netware-csp > http [ACK] Seq=1145 Ack=8095 Win=65535 Len=0
332765 116.143230 244.3.93.229 -> 41.177.98.176 TCP 64 netware-csp > http [ACK] Seq=1145 Ack=10463 Win=65535 Len=0
332770 116.146171 244.3.93.229 -> 41.177.98.176 TCP 64 netware-csp > http [ACK] Seq=1145 Ack=13223 Win=65535 Len=0
332771 116.146371 244.3.93.229 -> 41.177.98.176 TCP 64 netware-csp > http [ACK] Seq=1145 Ack=15591 Win=65535 Len=0
332776 116.149366 244.3.93.229 -> 41.177.98.176 TCP 64 netware-csp > http [ACK] Seq=1145 Ack=18351 Win=65535 Len=0
332777 116.149545 244.3.93.229 -> 41.177.98.176 TCP 64 netware-csp > http [ACK] Seq=1145 Ack=20719 Win=65535 Len=0
332786 116.165981 244.3.93.229 -> 41.177.98.176 TCP 64 netware-csp > http [ACK] Seq=1145 Ack=22073 Win=64181 Len=0
392126 131.165858 244.3.93.229 -> 41.177.98.176 TCP 64 netware-csp > http [ACK] Seq=1145 Ack=22074 Win=64181 Len=0
392127 131.166260 244.3.93.229 -> 41.177.98.176 TCP 64 netware-csp > http [RST, ACK] Seq=1145 Ack=22074 Win=0 Len=0
425774 139.738225 244.3.93.229 -> 41.177.98.176 TCP 66 dcs > http [SYN] Seq=0 Win=65535 Len=0 MSS=1380 SACK_PERM=1
425778 139.739251 244.3.93.229 -> 41.177.98.176 TCP 64 dcs > http [ACK] Seq=1 Ack=1 Win=65535 Len=0
428301 140.190390 244.3.93.229 -> 41.177.98.176 TCP 64 dcs > http [ACK] Seq=1136 Ack=2761 Win=65535 Len=0
428311 140.191246 244.3.93.229 -> 41.177.98.176 TCP 64 dcs > http [ACK] Seq=1136 Ack=5335 Win=65535 Len=0
428329 140.193219 244.3.93.229 -> 41.177.98.176 TCP 64 dcs > http [ACK] Seq=1136 Ack=8095 Win=65535 Len=0
428331 140.193406 244.3.93.229 -> 41.177.98.176 TCP 64 dcs > http [ACK] Seq=1136 Ack=10463 Win=65535 Len=0
428337 140.196095 244.3.93.229 -> 41.177.98.176 TCP 64 dcs > http [ACK] Seq=1136 Ack=13223 Win=65535 Len=0
428338 140.196264 244.3.93.229 -> 41.177.98.176 TCP 64 dcs > http [ACK] Seq=1136 Ack=15591 Win=65535 Len=0
428379 140.203634 244.3.93.229 -> 41.177.98.176 TCP 64 dcs > http [ACK] Seq=1136 Ack=25847 Win=64547 Len=0
428384 140.204870 244.3.93.229 -> 41.177.98.176 TCP 64 dcs > http [ACK] Seq=1136 Ack=30975 Win=65535 Len=0
428393 140.208094 244.3.93.229 -> 41.177.98.176 TCP 64 dcs > http [ACK] Seq=1136 Ack=31331 Win=65179 Len=0
428844 140.335519 244.3.93.229 -> 41.177.98.176 TCP 66 screencast > http [SYN] Seq=0 Win=65535 Len=0 MSS=1380 SACK_PERM=1
428849 140.336054 244.3.93.229 -> 41.177.98.176 TCP 64 screencast > http [ACK] Seq=1 Ack=1 Win=65535 Len=0
429914 140.541409 244.3.93.229 -> 41.177.98.176 TCP 64 screencast > http [ACK] Seq=730 Ack=555 Win=64981 Len=0
429915 140.541414 244.3.93.229 -> 41.177.98.176 TCP 64 dcs > http [ACK] Seq=2595 Ack=32618 Win=65535 Len=0
470529 155.345008 244.3.93.229 -> 41.177.98.176 TCP 64 screencast > http [ACK] Seq=730 Ack=556 Win=64981 Len=0
470548 155.355052 244.3.93.229 -> 41.177.98.176 TCP 64 dcs > http [ACK] Seq=2595 Ack=32619 Win=65535 Len=0
474338 156.446375 244.3.93.229 -> 41.177.98.176 TCP 64 screencast > http [FIN, ACK] Seq=730 Ack=556 Win=64981 Len=0
474339 156.446472 244.3.93.229 -> 41.177.98.176 TCP 64 dcs > http [FIN, ACK] Seq=2595 Ack=32619 Win=65535 Len=0
474345 156.447092 244.3.93.229 -> 41.177.98.176 TCP 66 gv-us > http [SYN] Seq=0 Win=65535 Len=0 MSS=1380 SACK_PERM=1
474349 156.447615 244.3.93.229 -> 41.177.98.176 TCP 64 gv-us > http [ACK] Seq=1 Ack=1 Win=65535 Len=0
474947 156.652706 244.3.93.229 -> 41.177.98.176 TCP 64 gv-us > http [ACK] Seq=1071 Ack=2761 Win=65535 Len=0
474949 156.653628 244.3.93.229 -> 41.177.98.176 TCP 64 gv-us > http [ACK] Seq=1071 Ack=5335 Win=65535 Len=0
474963 156.655644 244.3.93.229 -> 41.177.98.176 TCP 64 gv-us > http [ACK] Seq=1071 Ack=8095 Win=65535 Len=0
474964 156.655839 244.3.93.229 -> 41.177.98.176 TCP 64 gv-us > http [ACK] Seq=1071 Ack=10463 Win=65535 Len=0
474971 156.658552 244.3.93.229 -> 41.177.98.176 TCP 64 gv-us > http [ACK] Seq=1071 Ack=13223 Win=65535 Len=0
474972 156.658766 244.3.93.229 -> 41.177.98.176 TCP 64 gv-us > http [ACK] Seq=1071 Ack=15591 Win=65535 Len=0
474991 156.661488 244.3.93.229 -> 41.177.98.176 TCP 64 gv-us > http [ACK] Seq=1071 Ack=18351 Win=65535 Len=0
474997 156.661667 244.3.93.229 -> 41.177.98.176 TCP 64 gv-us > http [ACK] Seq=1071 Ack=20719 Win=65535 Len=0
475005 156.663205 244.3.93.229 -> 41.177.98.176 TCP 64 gv-us > http [ACK] Seq=1071 Ack=21395 Win=64859 Len=0
509307 164.027317 244.3.93.229 -> 41.177.98.176 TCP 64 gv-us > http [ACK] Seq=2137 Ack=24155 Win=65535 Len=0
509312 164.027505 244.3.93.229 -> 41.177.98.176 TCP 64 gv-us > http [ACK] Seq=2137 Ack=26728 Win=65535 Len=0
509361 164.029940 244.3.93.229 -> 41.177.98.176 TCP 64 gv-us > http [ACK] Seq=2137 Ack=29488 Win=65535 Len=0
509362 164.030125 244.3.93.229 -> 41.177.98.176 TCP 64 gv-us > http [ACK] Seq=2137 Ack=31856 Win=65535 Len=0
509450 164.032714 244.3.93.229 -> 41.177.98.176 TCP 64 gv-us > http [ACK] Seq=2137 Ack=34616 Win=65535 Len=0
509458 164.032876 244.3.93.229 -> 41.177.98.176 TCP 64 gv-us > http [ACK] Seq=2137 Ack=36984 Win=65535 Len=0
509550 164.035522 244.3.93.229 -> 41.177.98.176 TCP 64 gv-us > http [ACK] Seq=2137 Ack=39744 Win=62775 Len=0
509551 164.035718 244.3.93.229 -> 41.177.98.176 TCP 64 gv-us > http [ACK] Seq=2137 Ack=42112 Win=60407 Len=0
509552 164.035958 244.3.93.229 -> 41.177.98.176 TCP 64 [TCP Window Update] gv-us > http [ACK] Seq=2137 Ack=42112 Win=64167 Len=0
509560 164.038333 244.3.93.229 -> 41.177.98.176 TCP 64 gv-us > http [ACK] Seq=2137 Ack=44872 Win=65535 Len=0
509566 164.038510 244.3.93.229 -> 41.177.98.176 TCP 64 gv-us > http [ACK] Seq=2137 Ack=47240 Win=65535 Len=0
509637 164.042412 244.3.93.229 -> 41.177.98.176 TCP 64 gv-us > http [ACK] Seq=2137 Ack=51323 Win=65535 Len=0
520827 168.602863 244.3.93.229 -> 41.177.98.176 TCP 64 gv-us > http [ACK] Seq=3258 Ack=54083 Win=65535 Len=0
520828 168.603062 244.3.93.229 -> 41.177.98.176 TCP 64 gv-us > http [ACK] Seq=3258 Ack=56656 Win=65535 Len=0
520922 168.613360 244.3.93.229 -> 41.177.98.176 TCP 64 gv-us > http [ACK] Seq=3258 Ack=72040 Win=59419 Len=0
520923 168.613482 244.3.93.229 -> 41.177.98.176 TCP 64 [TCP Window Update] gv-us > http [ACK] Seq=3258 Ack=72040 Win=65535 Len=0
520939 168.615421 244.3.93.229 -> 41.177.98.176 TCP 64 gv-us > http [ACK] Seq=3258 Ack=77168 Win=61787 Len=0
520942 168.615599 244.3.93.229 -> 41.177.98.176 TCP 64 [TCP Window Update] gv-us > http [ACK] Seq=3258 Ack=77168 Win=65535 Len=0
520985 168.619760 244.3.93.229 -> 41.177.98.176 TCP 64 gv-us > http [ACK] Seq=3258 Ack=82296 Win=65535 Len=0
520989 168.620019 244.3.93.229 -> 41.177.98.176 TCP 64 gv-us > http [ACK] Seq=3258 Ack=85056 Win=65535 Len=0
520999 168.621899 244.3.93.229 -> 41.177.98.176 TCP 64 gv-us > http [ACK] Seq=3258 Ack=87424 Win=65535 Len=0
521011 168.622920 244.3.93.229 -> 41.177.98.176 TCP 64 gv-us > http [ACK] Seq=3258 Ack=89594 Win=65535 Len=0
571796 182.501810 244.3.93.229 -> 41.177.98.176 TCP 64 gv-us > http [ACK] Seq=4326 Ack=92354 Win=65535 Len=0
571797 182.502003 244.3.93.229 -> 41.177.98.176 TCP 64 gv-us > http [ACK] Seq=4326 Ack=94927 Win=65535 Len=0
571822 182.504573 244.3.93.229 -> 41.177.98.176 TCP 64 gv-us > http [ACK] Seq=4326 Ack=97687 Win=65535 Len=0
571823 182.504764 244.3.93.229 -> 41.177.98.176 TCP 64 gv-us > http [ACK] Seq=4326 Ack=100055 Win=65535 Len=0
571837 182.507673 244.3.93.229 -> 41.177.98.176 TCP 64 gv-us > http [ACK] Seq=4326 Ack=102815 Win=65535 Len=0
571839 182.507862 244.3.93.229 -> 41.177.98.176 TCP 64 gv-us > http [ACK] Seq=4326 Ack=105183 Win=65535 Len=0
571926 182.510568 244.3.93.229 -> 41.177.98.176 TCP 64 gv-us > http [ACK] Seq=4326 Ack=107943 Win=65535 Len=0
571927 182.510763 244.3.93.229 -> 41.177.98.176 TCP 64 gv-us > http [ACK] Seq=4326 Ack=110311 Win=65535 Len=0
571936 182.514205 244.3.93.229 -> 41.177.98.176 TCP 64 gv-us > http [ACK] Seq=4326 Ack=110978 Win=64868 Len=0
621606 197.573467 244.3.93.229 -> 41.177.98.176 TCP 64 gv-us > http [ACK] Seq=4326 Ack=110979 Win=64868 Len=0
642152 202.511332 244.3.93.229 -> 41.177.98.176 TCP 64 gv-us > http [RST, ACK] Seq=4326 Ack=110979 Win=0 Len=0
656885 205.909494 244.3.93.229 -> 41.177.98.176 TCP 66 us-gv > http [SYN] Seq=0 Win=65535 Len=0 MSS=1380 SACK_PERM=1
656887 205.910055 244.3.93.229 -> 41.177.98.176 TCP 64 us-gv > http [ACK] Seq=1 Ack=1 Win=65535 Len=0
659739 206.246256 244.3.93.229 -> 41.177.98.176 TCP 64 us-gv > http [ACK] Seq=1082 Ack=2761 Win=65535 Len=0
659752 206.247085 244.3.93.229 -> 41.177.98.176 TCP 64 us-gv > http [ACK] Seq=1082 Ack=5335 Win=65535 Len=0
659795 206.248940 244.3.93.229 -> 41.177.98.176 TCP 64 us-gv > http [ACK] Seq=1082 Ack=8095 Win=65535 Len=0
659800 206.249120 244.3.93.229 -> 41.177.98.176 TCP 64 us-gv > http [ACK] Seq=1082 Ack=10463 Win=65535 Len=0
659823 206.251772 244.3.93.229 -> 41.177.98.176 TCP 64 us-gv > http [ACK] Seq=1082 Ack=13223 Win=65535 Len=0
659824 206.251956 244.3.93.229 -> 41.177.98.176 TCP 64 us-gv > http [ACK] Seq=1082 Ack=15591 Win=65535 Len=0
659864 206.254696 244.3.93.229 -> 41.177.98.176 TCP 64 us-gv > http [ACK] Seq=1082 Ack=18351 Win=62775 Len=0
659867 206.254873 244.3.93.229 -> 41.177.98.176 TCP 64 us-gv > http [ACK] Seq=1082 Ack=20719 Win=60407 Len=0
659873 206.255152 244.3.93.229 -> 41.177.98.176 TCP 64 [TCP Window Update] us-gv > http [ACK] Seq=1082 Ack=20719 Win=64167 Len=0
659915 206.256881 244.3.93.229 -> 41.177.98.176 TCP 64 us-gv > http [ACK] Seq=1082 Ack=22059 Win=65535 Len=0
698195 221.322680 244.3.93.229 -> 41.177.98.176 TCP 64 us-gv > http [ACK] Seq=1082 Ack=22060 Win=65535 Len=0
709974 226.246285 244.3.93.229 -> 41.177.98.176 TCP 64 us-gv > http [RST, ACK] Seq=1082 Ack=22060 Win=0 Len=0
909209 300.209574 244.3.93.229 -> 41.177.98.176 TCP 66 fc-cli > http [SYN] Seq=0 Win=65535 Len=0 MSS=1380 SACK_PERM=1
909211 300.210286 244.3.93.229 -> 41.177.98.176 TCP 64 fc-cli > http [ACK] Seq=1 Ack=1 Win=65535 Len=0
909731 300.511339 244.3.93.229 -> 41.177.98.176 TCP 64 fc-cli > http [ACK] Seq=1137 Ack=2761 Win=65535 Len=0
909733 300.512196 244.3.93.229 -> 41.177.98.176 TCP 64 fc-cli > http [ACK] Seq=1137 Ack=5335 Win=65535 Len=0
909739 300.514600 244.3.93.229 -> 41.177.98.176 TCP 64 fc-cli > http [ACK] Seq=1137 Ack=10463 Win=65535 Len=0
909744 300.516814 244.3.93.229 -> 41.177.98.176 TCP 64 fc-cli > http [ACK] Seq=1137 Ack=13223 Win=65535 Len=0
909745 300.517006 244.3.93.229 -> 41.177.98.176 TCP 64 fc-cli > http [ACK] Seq=1137 Ack=15591 Win=65535 Len=0
909768 300.519896 244.3.93.229 -> 41.177.98.176 TCP 64 fc-cli > http [ACK] Seq=1137 Ack=18351 Win=65535 Len=0
909770 300.519996 244.3.93.229 -> 41.177.98.176 TCP 64 fc-cli > http [ACK] Seq=1137 Ack=20719 Win=65535 Len=0
909797 300.522589 244.3.93.229 -> 41.177.98.176 TCP 64 fc-cli > http [ACK] Seq=1137 Ack=22064 Win=64190 Len=0
951528 315.579163 244.3.93.229 -> 41.177.98.176 TCP 64 fc-cli > http [ACK] Seq=1137 Ack=22065 Win=64190 Len=0
963344 320.514507 244.3.93.229 -> 41.177.98.176 TCP 64 fc-cli > http [RST, ACK] Seq=1137 Ack=22065 Win=0 Len=0
970027 323.231663 244.3.93.229 -> 41.177.98.176 TCP 66 fc-ser > http [SYN] Seq=0 Win=65535 Len=0 MSS=1380 SACK_PERM=1
970029 323.232151 244.3.93.229 -> 41.177.98.176 TCP 64 fc-ser > http [ACK] Seq=1 Ack=1 Win=65535 Len=0
970612 323.701233 244.3.93.229 -> 41.177.98.176 TCP 64 fc-ser > http [ACK] Seq=1127 Ack=2761 Win=65535 Len=0
970614 323.702091 244.3.93.229 -> 41.177.98.176 TCP 64 fc-ser > http [ACK] Seq=1127 Ack=5335 Win=65535 Len=0
970621 323.703670 244.3.93.229 -> 41.177.98.176 TCP 64 fc-ser > http [ACK] Seq=1127 Ack=8095 Win=65535 Len=0
970622 323.703855 244.3.93.229 -> 41.177.98.176 TCP 64 fc-ser > http [ACK] Seq=1127 Ack=10463 Win=65535 Len=0
970627 323.706444 244.3.93.229 -> 41.177.98.176 TCP 64 fc-ser > http [ACK] Seq=1127 Ack=13223 Win=65535 Len=0
970628 323.706637 244.3.93.229 -> 41.177.98.176 TCP 64 fc-ser > http [ACK] Seq=1127 Ack=15591 Win=65535 Len=0
970637 323.709440 244.3.93.229 -> 41.177.98.176 TCP 64 fc-ser > http [ACK] Seq=1127 Ack=18351 Win=65535 Len=0
970638 323.709646 244.3.93.229 -> 41.177.98.176 TCP 64 fc-ser > http [ACK] Seq=1127 Ack=20719 Win=65535 Len=0
970643 323.712305 244.3.93.229 -> 41.177.98.176 TCP 64 fc-ser > http [ACK] Seq=1127 Ack=23479 Win=65535 Len=0
970644 323.712483 244.3.93.229 -> 41.177.98.176 TCP 64 fc-ser > http [ACK] Seq=1127 Ack=25847 Win=65535 Len=0
970657 323.716527 244.3.93.229 -> 41.177.98.176 TCP 64 fc-ser > http [ACK] Seq=1127 Ack=28607 Win=65535 Len=0
970660 323.719707 244.3.93.229 -> 41.177.98.176 TCP 64 fc-ser > http [ACK] Seq=1127 Ack=29993 Win=65535 Len=0
1010164 338.778408 244.3.93.229 -> 41.177.98.176 TCP 64 fc-ser > http [ACK] Seq=1127 Ack=29994 Win=65535 Len=0
1019122 343.717063 244.3.93.229 -> 41.177.98.176 TCP 64 fc-ser > http [RST, ACK] Seq=1127 Ack=29994 Win=0 Len=0
