2347   0.710672 244.3.210.254 -> 41.177.244.185 UDP 112 Source port: 3283  Destination port: 3283
4806   1.457922 244.3.210.254 -> 41.177.244.90 TCP 70 19813 > ati-ip-to-ncpe [PSH, ACK] Seq=1 Ack=1 Win=65535 Len=12
6644   2.174501 244.3.210.254 -> 244.3.106.254 TCP 70 19813 > 4227 [PSH, ACK] Seq=1 Ack=1 Win=65535 Len=12
6710   2.196131 244.3.210.254 -> 244.3.77.218 TCP 64 19813 > kazaa [ACK] Seq=1 Ack=13 Win=65535 Len=0
24692   9.396306 244.3.210.254 -> 41.177.244.177 TCP 70 19813 > 54781 [ACK] Seq=1 Ack=13 Win=65535 Len=0 TSval=2134604032 TSecr=763084494
29144  11.873844 244.3.210.254 -> 41.177.244.188 TCP 82 19813 > 52599 [PSH, ACK] Seq=1 Ack=1 Win=65535 Len=12 TSval=2134604037 TSecr=1028051460
35956  15.023653 244.3.210.254 -> 41.177.244.224 TCP 82 19813 > 63522 [PSH, ACK] Seq=1 Ack=1 Win=65535 Len=12 TSval=2134604043 TSecr=1335776122
42689  17.996556 244.3.210.254 -> 41.177.244.128 TCP 64 19813 > murx [ACK] Seq=1 Ack=13 Win=65535 Len=0
49124  19.996634 244.3.210.254 -> 41.177.244.142 TCP 70 52502 > afpovertcp [ACK] Seq=1 Ack=17 Win=65535 Len=0 TSval=2134604053 TSecr=3472903953
50048  20.339935 244.3.210.254 -> 41.177.244.142 TCP 70 19813 > 4944 [PSH, ACK] Seq=1 Ack=1 Win=65535 Len=12
54687  22.655924 244.3.210.254 -> 41.177.244.117 TCP 82 19813 > 52544 [PSH, ACK] Seq=1 Ack=1 Win=65535 Len=12 TSval=2134604059 TSecr=1697479144
61070  24.889640 244.3.210.254 -> 41.177.244.220 TCP 70 19813 > dialpad-voice1 [PSH, ACK] Seq=1 Ack=1 Win=65535 Len=12
61510  25.172950 244.3.210.254 -> 244.3.3.185  TCP 70 19813 > 3Com-nsd [PSH, ACK] Seq=1 Ack=1 Win=65535 Len=12
73646  29.996901 244.3.210.254 -> 41.177.244.77 TCP 64 19813 > m2ua [ACK] Seq=1 Ack=13 Win=65535 Len=0
76769  30.708590 244.3.210.254 -> 41.177.244.185 UDP 112 Source port: 3283  Destination port: 3283
86524  33.596985 244.3.210.254 -> 41.177.244.38 TCP 64 19813 > xnds [ACK] Seq=1 Ack=13 Win=65535 Len=0
100293  37.055434 244.3.210.254 -> 41.177.244.124 TCP 82 19813 > 55919 [PSH, ACK] Seq=1 Ack=1 Win=65535 Len=12 TSval=2134604088 TSecr=130608577
110997  39.688582 244.3.210.254 -> 41.177.244.177 TCP 82 19813 > 63123 [PSH, ACK] Seq=1 Ack=1 Win=65535 Len=12 TSval=2134604093 TSecr=763084397
116544  41.597245 244.3.210.254 -> 41.177.244.90 TCP 64 19813 > ati-ip-to-ncpe [ACK] Seq=13 Ack=13 Win=65535 Len=0
117547  42.171743 244.3.210.254 -> 244.3.77.218 TCP 70 19813 > kazaa [PSH, ACK] Seq=1 Ack=13 Win=65535 Len=12
118145  42.397307 244.3.210.254 -> 244.3.106.254 TCP 64 19813 > 4227 [ACK] Seq=13 Ack=13 Win=65535 Len=0
143747  49.387901 244.3.210.254 -> 41.177.244.177 TCP 82 19813 > 54781 [PSH, ACK] Seq=1 Ack=13 Win=65535 Len=12 TSval=2134604112 TSecr=763084494
151727  51.997624 244.3.210.254 -> 41.177.244.188 TCP 70 19813 > 52599 [ACK] Seq=13 Ack=13 Win=65535 Len=0 TSval=2134604117 TSecr=1028051620
151728  51.997629 244.3.210.254 -> 41.177.244.142 TCP 70 52502 > afpovertcp [ACK] Seq=17 Ack=33 Win=65535 Len=0 TSval=2134604117 TSecr=3472904017
162258  55.197815 244.3.210.254 -> 41.177.244.224 TCP 70 19813 > 63522 [ACK] Seq=13 Ack=13 Win=65535 Len=0 TSval=2134604124 TSecr=1335776282
174229  57.903962 244.3.210.254 -> 41.177.244.128 TCP 70 19813 > murx [PSH, ACK] Seq=1 Ack=13 Win=65535 Len=12
179981  60.597951 244.3.210.254 -> 41.177.244.142 TCP 64 19813 > 4944 [ACK] Seq=13 Ack=13 Win=65535 Len=0
180287  60.706488 244.3.210.254 -> 41.177.244.185 UDP 112 Source port: 3283  Destination port: 3283
186682  62.798034 244.3.210.254 -> 41.177.244.117 TCP 70 19813 > 52544 [ACK] Seq=13 Ack=13 Win=65535 Len=0 TSval=2134604139 TSecr=1697479305
189967  65.198155 244.3.210.254 -> 41.177.244.220 TCP 64 19813 > dialpad-voice1 [ACK] Seq=13 Ack=13 Win=65535 Len=0
190387  65.398182 244.3.210.254 -> 244.3.3.185  TCP 64 19813 > 3Com-nsd [ACK] Seq=13 Ack=13 Win=65535 Len=0
202695  69.953119 244.3.210.254 -> 41.177.244.77 TCP 70 19813 > m2ua [PSH, ACK] Seq=1 Ack=13 Win=65535 Len=12
211453  72.825539 244.3.210.254 -> 244.3.3.185  TCP 112 19813 > 3Com-nsd [PSH, ACK] Seq=13 Ack=45 Win=65535 Len=54
211454  72.825640 244.3.210.254 -> 244.3.3.185  TCP 76 19813 > 3Com-nsd [PSH, ACK] Seq=67 Ack=45 Win=65535 Len=18
212201  73.000959 244.3.210.254 -> 244.3.3.185  TCP 92 19813 > 3Com-nsd [PSH, ACK] Seq=85 Ack=63 Win=65535 Len=34
213991  73.436220 244.3.210.254 -> 41.177.244.38 TCP 70 19813 > xnds [PSH, ACK] Seq=1 Ack=13 Win=65535 Len=12
215465  73.970164 244.3.210.254 -> 244.3.3.185  TCP 678 19813 > 3Com-nsd [PSH, ACK] Seq=119 Ack=99 Win=65535 Len=620
215524  73.987851 244.3.210.254 -> 244.3.3.185  TCP 72 19813 > 3Com-nsd [PSH, ACK] Seq=739 Ack=111 Win=65535 Len=14
215603  73.998415 244.3.210.254 -> 244.3.3.185  TCP 64 19813 > 3Com-nsd [ACK] Seq=753 Ack=271 Win=65535 Len=0
215618  74.007492 244.3.210.254 -> 244.3.3.185  TCP 148 19813 > 3Com-nsd [PSH, ACK] Seq=753 Ack=271 Win=65535 Len=90
215847  74.087530 244.3.210.254 -> 244.3.3.185  TCP 76 19813 > 3Com-nsd [PSH, ACK] Seq=843 Ack=431 Win=65535 Len=18
216108  74.120979 244.3.210.254 -> 244.3.3.185  TCP 1072 19813 > 3Com-nsd [PSH, ACK] Seq=861 Ack=463 Win=65535 Len=1014
216138  74.122763 244.3.210.254 -> 244.3.3.185  TCP 94 19813 > 3Com-nsd [PSH, ACK] Seq=1875 Ack=505 Win=65535 Len=36
216155  74.124186 244.3.210.254 -> 244.3.3.185  TCP 76 19813 > 3Com-nsd [PSH, ACK] Seq=1911 Ack=547 Win=65535 Len=18
216225  74.131096 244.3.210.254 -> 244.3.3.185  TCP 1072 19813 > 3Com-nsd [PSH, ACK] Seq=1929 Ack=579 Win=65535 Len=1014
216264  74.136963 244.3.210.254 -> 244.3.3.185  TCP 76 19813 > 3Com-nsd [PSH, ACK] Seq=2943 Ack=641 Win=65535 Len=18
225577  77.198556 244.3.210.254 -> 41.177.244.124 TCP 70 19813 > 55919 [ACK] Seq=13 Ack=13 Win=65535 Len=0 TSval=2134604168 TSecr=130609377
230801  79.703024 244.3.210.254 -> 244.3.3.185  TCP 76 19813 > 3Com-nsd [PSH, ACK] Seq=2961 Ack=771 Win=65535 Len=18
230802  79.703258 244.3.210.254 -> 244.3.3.185  TCP 86 19813 > 3Com-nsd [PSH, ACK] Seq=2979 Ack=771 Win=65535 Len=28
230907  79.750420 244.3.210.254 -> 244.3.3.185  TCP 76 19813 > 3Com-nsd [PSH, ACK] Seq=3007 Ack=901 Win=65535 Len=18
230908  79.750718 244.3.210.254 -> 244.3.3.185  TCP 86 19813 > 3Com-nsd [PSH, ACK] Seq=3025 Ack=901 Win=65535 Len=28
230911  79.751725 244.3.210.254 -> 244.3.3.185  TCP 344 19813 > 3Com-nsd [PSH, ACK] Seq=3053 Ack=941 Win=65535 Len=286
230934  79.765015 244.3.210.254 -> 244.3.3.185  TCP 214 19813 > 3Com-nsd [PSH, ACK] Seq=3339 Ack=977 Win=65535 Len=156
230980  79.777305 244.3.210.254 -> 244.3.3.185  TCP 76 19813 > 3Com-nsd [PSH, ACK] Seq=3495 Ack=1101 Win=65535 Len=18
230993  79.781065 244.3.210.254 -> 244.3.3.185  TCP 76 19813 > 3Com-nsd [PSH, ACK] Seq=3513 Ack=1231 Win=65535 Len=18
230996  79.781361 244.3.210.254 -> 244.3.3.185  TCP 86 19813 > 3Com-nsd [PSH, ACK] Seq=3531 Ack=1231 Win=65535 Len=28
230999  79.782301 244.3.210.254 -> 244.3.3.185  TCP 124 19813 > 3Com-nsd [PSH, ACK] Seq=3559 Ack=1271 Win=65535 Len=66
231025  79.783578 244.3.210.254 -> 244.3.3.185  TCP 76 19813 > 3Com-nsd [PSH, ACK] Seq=3625 Ack=1307 Win=65535 Len=18
231051  79.793071 244.3.210.254 -> 244.3.3.185  TCP 226 19813 > 3Com-nsd [PSH, ACK] Seq=3643 Ack=1343 Win=65535 Len=168
231053  79.794927 244.3.210.254 -> 244.3.3.185  TCP 76 19813 > 3Com-nsd [PSH, ACK] Seq=3811 Ack=1467 Win=65535 Len=18
231055  79.797193 244.3.210.254 -> 244.3.3.185  TCP 76 19813 > 3Com-nsd [PSH, ACK] Seq=3829 Ack=1515 Win=65535 Len=18
231057  79.798615 244.3.210.254 -> 244.3.3.185  TCP 64 19813 > 3Com-nsd [ACK] Seq=3847 Ack=1645 Win=65535 Len=0
231061  79.800966 244.3.210.254 -> 244.3.3.185  TCP 76 19813 > 3Com-nsd [PSH, ACK] Seq=3847 Ack=1645 Win=65535 Len=18
231063  79.801398 244.3.210.254 -> 244.3.3.185  TCP 86 19813 > 3Com-nsd [PSH, ACK] Seq=3865 Ack=1645 Win=65535 Len=28
231066  79.802629 244.3.210.254 -> 244.3.3.185  TCP 176 19813 > 3Com-nsd [PSH, ACK] Seq=3893 Ack=1685 Win=65535 Len=118
231070  79.803937 244.3.210.254 -> 244.3.3.185  TCP 76 19813 > 3Com-nsd [PSH, ACK] Seq=4011 Ack=1721 Win=65535 Len=18
231138  79.833721 244.3.210.254 -> 244.3.3.185  TCP 230 19813 > 3Com-nsd [PSH, ACK] Seq=4029 Ack=1757 Win=65535 Len=172
231140  79.835181 244.3.210.254 -> 244.3.3.185  TCP 76 19813 > 3Com-nsd [PSH, ACK] Seq=4201 Ack=1881 Win=65535 Len=18
231144  79.837280 244.3.210.254 -> 244.3.3.185  TCP 76 19813 > 3Com-nsd [PSH, ACK] Seq=4219 Ack=1929 Win=65535 Len=18
231206  79.881832 244.3.210.254 -> 244.3.3.185  TCP 76 19813 > 3Com-nsd [PSH, ACK] Seq=4237 Ack=2059 Win=65535 Len=18
231207  79.882281 244.3.210.254 -> 244.3.3.185  TCP 86 19813 > 3Com-nsd [PSH, ACK] Seq=4255 Ack=2059 Win=65535 Len=28
231212  79.883531 244.3.210.254 -> 244.3.3.185  TCP 344 19813 > 3Com-nsd [PSH, ACK] Seq=4283 Ack=2099 Win=65535 Len=286
231214  79.884875 244.3.210.254 -> 244.3.3.185  TCP 76 19813 > 3Com-nsd [PSH, ACK] Seq=4569 Ack=2135 Win=65535 Len=18
231219  79.886234 244.3.210.254 -> 244.3.3.185  TCP 214 19813 > 3Com-nsd [PSH, ACK] Seq=4587 Ack=2171 Win=65535 Len=156
231225  79.887706 244.3.210.254 -> 244.3.3.185  TCP 76 19813 > 3Com-nsd [PSH, ACK] Seq=4743 Ack=2295 Win=65535 Len=18
231248  79.890036 244.3.210.254 -> 244.3.3.185  TCP 76 19813 > 3Com-nsd [PSH, ACK] Seq=4761 Ack=2343 Win=65535 Len=18
231271  79.893751 244.3.210.254 -> 244.3.3.185  TCP 76 19813 > 3Com-nsd [PSH, ACK] Seq=4779 Ack=2473 Win=65535 Len=18
231272  79.894208 244.3.210.254 -> 244.3.3.185  TCP 86 19813 > 3Com-nsd [PSH, ACK] Seq=4797 Ack=2473 Win=65535 Len=28
231301  79.907376 244.3.210.254 -> 244.3.3.185  TCP 176 19813 > 3Com-nsd [PSH, ACK] Seq=4825 Ack=2513 Win=65535 Len=118
231312  79.908643 244.3.210.254 -> 244.3.3.185  TCP 76 19813 > 3Com-nsd [PSH, ACK] Seq=4943 Ack=2549 Win=65535 Len=18
231314  79.909905 244.3.210.254 -> 244.3.3.185  TCP 230 19813 > 3Com-nsd [PSH, ACK] Seq=4961 Ack=2585 Win=65535 Len=172
231316  79.911341 244.3.210.254 -> 244.3.3.185  TCP 76 19813 > 3Com-nsd [PSH, ACK] Seq=5133 Ack=2709 Win=65535 Len=18
231318  79.913444 244.3.210.254 -> 244.3.3.185  TCP 76 19813 > 3Com-nsd [PSH, ACK] Seq=5151 Ack=2757 Win=65535 Len=18
231320  79.916247 244.3.210.254 -> 244.3.3.185  TCP 94 19813 > 3Com-nsd [PSH, ACK] Seq=5169 Ack=2868 Win=65535 Len=36
231322  79.917478 244.3.210.254 -> 244.3.3.185  TCP 108 19813 > 3Com-nsd [PSH, ACK] Seq=5205 Ack=2900 Win=65535 Len=50
231324  79.918723 244.3.210.254 -> 244.3.3.185  TCP 344 19813 > 3Com-nsd [PSH, ACK] Seq=5255 Ack=2940 Win=65535 Len=286
231326  79.920029 244.3.210.254 -> 244.3.3.185  TCP 76 19813 > 3Com-nsd [PSH, ACK] Seq=5541 Ack=2976 Win=65535 Len=18
231329  79.921253 244.3.210.254 -> 244.3.3.185  TCP 214 19813 > 3Com-nsd [PSH, ACK] Seq=5559 Ack=3012 Win=65535 Len=156
231334  79.922813 244.3.210.254 -> 244.3.3.185  TCP 76 19813 > 3Com-nsd [PSH, ACK] Seq=5715 Ack=3123 Win=65535 Len=18
231338  79.924253 244.3.210.254 -> 244.3.3.185  TCP 76 19813 > 3Com-nsd [PSH, ACK] Seq=5733 Ack=3234 Win=65535 Len=18
231426  79.971983 244.3.210.254 -> 244.3.3.185  TCP 76 19813 > 3Com-nsd [PSH, ACK] Seq=5751 Ack=3364 Win=65535 Len=18
231427  79.972414 244.3.210.254 -> 244.3.3.185  TCP 86 19813 > 3Com-nsd [PSH, ACK] Seq=5769 Ack=3364 Win=65535 Len=28
231430  79.973653 244.3.210.254 -> 244.3.3.185  TCP 92 19813 > 3Com-nsd [PSH, ACK] Seq=5797 Ack=3404 Win=65535 Len=34
231432  79.974865 244.3.210.254 -> 244.3.3.185  TCP 76 19813 > 3Com-nsd [PSH, ACK] Seq=5831 Ack=3440 Win=65535 Len=18
231435  79.976826 244.3.210.254 -> 244.3.3.185  TCP 210 19813 > 3Com-nsd [PSH, ACK] Seq=5849 Ack=3476 Win=65535 Len=152
231440  79.979667 244.3.210.254 -> 244.3.3.185  TCP 76 19813 > 3Com-nsd [PSH, ACK] Seq=6001 Ack=3510 Win=65535 Len=18
231441  79.979764 244.3.210.254 -> 244.3.3.185  TCP 82 19813 > 3Com-nsd [PSH, ACK] Seq=6019 Ack=3510 Win=65535 Len=24
231444  79.980921 244.3.210.254 -> 244.3.3.185  TCP 92 19813 > 3Com-nsd [PSH, ACK] Seq=6043 Ack=3550 Win=65535 Len=34
231462  79.987261 244.3.210.254 -> 244.3.3.185  TCP 680 19813 > 3Com-nsd [PSH, ACK] Seq=6077 Ack=3586 Win=65535 Len=622
231468  79.990497 244.3.210.254 -> 244.3.3.185  TCP 76 19813 > 3Com-nsd [PSH, ACK] Seq=6699 Ack=3716 Win=65535 Len=18
231470  79.990845 244.3.210.254 -> 244.3.3.185  TCP 86 19813 > 3Com-nsd [PSH, ACK] Seq=6717 Ack=3716 Win=65535 Len=28
231474  79.993284 244.3.210.254 -> 244.3.3.185  TCP 92 19813 > 3Com-nsd [PSH, ACK] Seq=6745 Ack=3756 Win=65535 Len=34
231477  79.994501 244.3.210.254 -> 244.3.3.185  TCP 76 19813 > 3Com-nsd [PSH, ACK] Seq=6779 Ack=3792 Win=65535 Len=18
231480  79.995678 244.3.210.254 -> 244.3.3.185  TCP 680 19813 > 3Com-nsd [PSH, ACK] Seq=6797 Ack=3828 Win=65535 Len=622
231482  79.998679 244.3.210.254 -> 244.3.3.185  TCP 64 19813 > 3Com-nsd [ACK] Seq=7419 Ack=3952 Win=65535 Len=0
231483  79.998684 244.3.210.254 -> 41.177.244.177 TCP 70 19813 > 63123 [ACK] Seq=13 Ack=13 Win=65535 Len=0 TSval=2134604173 TSecr=763085198
231493  80.006579 244.3.210.254 -> 244.3.3.185  TCP 76 19813 > 3Com-nsd [PSH, ACK] Seq=7419 Ack=3952 Win=65535 Len=18
231498  80.008167 244.3.210.254 -> 244.3.3.185  TCP 76 19813 > 3Com-nsd [PSH, ACK] Seq=7437 Ack=4014 Win=65535 Len=18
231582  80.047565 244.3.210.254 -> 244.3.3.185  TCP 1072 19813 > 3Com-nsd [PSH, ACK] Seq=7455 Ack=4046 Win=65535 Len=1014
231613  80.051502 244.3.210.254 -> 244.3.3.185  TCP 76 19813 > 3Com-nsd [PSH, ACK] Seq=8469 Ack=4108 Win=65535 Len=18
231697  80.081978 244.3.210.254 -> 244.3.3.185  TCP 94 19813 > 3Com-nsd [PSH, ACK] Seq=8487 Ack=4219 Win=65535 Len=36
231708  80.083237 244.3.210.254 -> 244.3.3.185  TCP 108 19813 > 3Com-nsd [PSH, ACK] Seq=8523 Ack=4251 Win=65535 Len=50
231726  80.084449 244.3.210.254 -> 244.3.3.185  TCP 92 19813 > 3Com-nsd [PSH, ACK] Seq=8573 Ack=4291 Win=65535 Len=34
231736  80.085665 244.3.210.254 -> 244.3.3.185  TCP 76 19813 > 3Com-nsd [PSH, ACK] Seq=8607 Ack=4327 Win=65535 Len=18
231743  80.086934 244.3.210.254 -> 244.3.3.185  TCP 680 19813 > 3Com-nsd [PSH, ACK] Seq=8625 Ack=4363 Win=65535 Len=622
231745  80.088718 244.3.210.254 -> 244.3.3.185  TCP 273 19813 > 3Com-nsd [PSH, ACK] Seq=9247 Ack=4429 Win=65535 Len=215
231747  80.090081 244.3.210.254 -> 244.3.3.185  TCP 1072 19813 > 3Com-nsd [PSH, ACK] Seq=9462 Ack=4461 Win=65535 Len=1014
231751  80.091740 244.3.210.254 -> 244.3.3.185  TCP 76 19813 > 3Com-nsd [PSH, ACK] Seq=10476 Ack=4497 Win=65535 Len=18
231753  80.093280 244.3.210.254 -> 244.3.3.185  TCP 149 19813 > 3Com-nsd [PSH, ACK] Seq=10494 Ack=4563 Win=65535 Len=91
231755  80.094585 244.3.210.254 -> 244.3.3.185  TCP 1072 19813 > 3Com-nsd [PSH, ACK] Seq=10585 Ack=4595 Win=65535 Len=1014
231757  80.096296 244.3.210.254 -> 244.3.3.185  TCP 680 19813 > 3Com-nsd [PSH, ACK] Seq=11599 Ack=4631 Win=65535 Len=622
231761  80.097920 244.3.210.254 -> 244.3.3.185  TCP 76 19813 > 3Com-nsd [PSH, ACK] Seq=12221 Ack=4761 Win=65535 Len=18
231762  80.098020 244.3.210.254 -> 244.3.3.185  TCP 86 19813 > 3Com-nsd [PSH, ACK] Seq=12239 Ack=4761 Win=65535 Len=28
231767  80.099143 244.3.210.254 -> 244.3.3.185  TCP 92 19813 > 3Com-nsd [PSH, ACK] Seq=12267 Ack=4801 Win=65535 Len=34
231787  80.112422 244.3.210.254 -> 244.3.3.185  TCP 282 19813 > 3Com-nsd [PSH, ACK] Seq=12301 Ack=4837 Win=65535 Len=224
231789  80.113750 244.3.210.254 -> 244.3.3.185  TCP 76 19813 > 3Com-nsd [PSH, ACK] Seq=12525 Ack=4873 Win=65535 Len=18
231792  80.117342 244.3.210.254 -> 244.3.3.185  TCP 76 19813 > 3Com-nsd [PSH, ACK] Seq=12543 Ack=5003 Win=65535 Len=18
231794  80.117608 244.3.210.254 -> 244.3.3.185  TCP 86 19813 > 3Com-nsd [PSH, ACK] Seq=12561 Ack=5003 Win=65535 Len=28
231799  80.118916 244.3.210.254 -> 244.3.3.185  TCP 92 19813 > 3Com-nsd [PSH, ACK] Seq=12589 Ack=5043 Win=65535 Len=34
231804  80.120175 244.3.210.254 -> 244.3.3.185  TCP 680 19813 > 3Com-nsd [PSH, ACK] Seq=12623 Ack=5079 Win=65535 Len=622
231806  80.121860 244.3.210.254 -> 244.3.3.185  TCP 76 19813 > 3Com-nsd [PSH, ACK] Seq=13245 Ack=5209 Win=65535 Len=18
231807  80.121949 244.3.210.254 -> 244.3.3.185  TCP 86 19813 > 3Com-nsd [PSH, ACK] Seq=13263 Ack=5209 Win=65535 Len=28
231810  80.123110 244.3.210.254 -> 244.3.3.185  TCP 92 19813 > 3Com-nsd [PSH, ACK] Seq=13291 Ack=5249 Win=65535 Len=34
231813  80.124294 244.3.210.254 -> 244.3.3.185  TCP 76 19813 > 3Com-nsd [PSH, ACK] Seq=13325 Ack=5285 Win=65535 Len=18
231815  80.125533 244.3.210.254 -> 244.3.3.185  TCP 282 19813 > 3Com-nsd [PSH, ACK] Seq=13343 Ack=5321 Win=65535 Len=224
231826  80.129890 244.3.210.254 -> 244.3.3.185  TCP 76 19813 > 3Com-nsd [PSH, ACK] Seq=13567 Ack=5451 Win=65535 Len=18
231827  80.130187 244.3.210.254 -> 244.3.3.185  TCP 86 19813 > 3Com-nsd [PSH, ACK] Seq=13585 Ack=5451 Win=65535 Len=28
231836  80.131197 244.3.210.254 -> 244.3.3.185  TCP 92 19813 > 3Com-nsd [PSH, ACK] Seq=13613 Ack=5491 Win=65535 Len=34
231844  80.132537 244.3.210.254 -> 244.3.3.185  TCP 378 19813 > 3Com-nsd [PSH, ACK] Seq=13647 Ack=5527 Win=65535 Len=320
231918  80.155974 244.3.210.254 -> 244.3.3.185  TCP 76 19813 > 3Com-nsd [PSH, ACK] Seq=13967 Ack=5657 Win=65535 Len=18
231919  80.156734 244.3.210.254 -> 244.3.3.185  TCP 86 19813 > 3Com-nsd [PSH, ACK] Seq=13985 Ack=5657 Win=65535 Len=28
231924  80.157978 244.3.210.254 -> 244.3.3.185  TCP 116 19813 > 3Com-nsd [PSH, ACK] Seq=14013 Ack=5697 Win=65535 Len=58
231970  80.171792 244.3.210.254 -> 244.3.3.185  TCP 1438 19813 > 3Com-nsd [ACK] Seq=14071 Ack=5733 Win=65535 Len=1380
231971  80.171798 244.3.210.254 -> 244.3.3.185  TCP 174 19813 > 3Com-nsd [PSH, ACK] Seq=15451 Ack=5733 Win=65535 Len=116
231984  80.175424 244.3.210.254 -> 244.3.3.185  TCP 76 19813 > 3Com-nsd [PSH, ACK] Seq=15567 Ack=5857 Win=65535 Len=18
232010  80.198720 244.3.210.254 -> 244.3.3.185  TCP 64 19813 > 3Com-nsd [ACK] Seq=15585 Ack=6083 Win=65535 Len=0
232127  80.250285 244.3.210.254 -> 244.3.3.185  TCP 76 19813 > 3Com-nsd [PSH, ACK] Seq=15585 Ack=6083 Win=65535 Len=18
232131  80.251290 244.3.210.254 -> 244.3.3.185  TCP 86 19813 > 3Com-nsd [PSH, ACK] Seq=15603 Ack=6083 Win=65535 Len=28
232134  80.252548 244.3.210.254 -> 244.3.3.185  TCP 76 19813 > 3Com-nsd [PSH, ACK] Seq=15631 Ack=6119 Win=65535 Len=18
232146  80.255630 244.3.210.254 -> 244.3.3.185  TCP 76 19813 > 3Com-nsd [PSH, ACK] Seq=15649 Ack=6243 Win=65535 Len=18
232166  80.259216 244.3.210.254 -> 244.3.3.185  TCP 76 19813 > 3Com-nsd [PSH, ACK] Seq=15667 Ack=6293 Win=65535 Len=18
232187  80.266079 244.3.210.254 -> 244.3.3.185  TCP 94 19813 > 3Com-nsd [PSH, ACK] Seq=15685 Ack=6404 Win=65535 Len=36
232192  80.267297 244.3.210.254 -> 244.3.3.185  TCP 108 19813 > 3Com-nsd [PSH, ACK] Seq=15721 Ack=6436 Win=65535 Len=50
232196  80.268496 244.3.210.254 -> 244.3.3.185  TCP 116 19813 > 3Com-nsd [PSH, ACK] Seq=15771 Ack=6476 Win=65535 Len=58
232198  80.269847 244.3.210.254 -> 244.3.3.185  TCP 1438 19813 > 3Com-nsd [ACK] Seq=15829 Ack=6512 Win=65535 Len=1380
232199  80.269852 244.3.210.254 -> 244.3.3.185  TCP 174 19813 > 3Com-nsd [PSH, ACK] Seq=17209 Ack=6512 Win=65535 Len=116
232211  80.279087 244.3.210.254 -> 244.3.3.185  TCP 76 19813 > 3Com-nsd [PSH, ACK] Seq=17325 Ack=6642 Win=65535 Len=18
232212  80.280100 244.3.210.254 -> 244.3.3.185  TCP 86 19813 > 3Com-nsd [PSH, ACK] Seq=17343 Ack=6642 Win=65535 Len=28
232216  80.281365 244.3.210.254 -> 244.3.3.185  TCP 116 19813 > 3Com-nsd [PSH, ACK] Seq=17371 Ack=6682 Win=65535 Len=58
232220  80.282612 244.3.210.254 -> 244.3.3.185  TCP 76 19813 > 3Com-nsd [PSH, ACK] Seq=17429 Ack=6718 Win=65535 Len=18
232224  80.283900 244.3.210.254 -> 244.3.3.185  TCP 351 19813 > 3Com-nsd [PSH, ACK] Seq=17447 Ack=6754 Win=65535 Len=293
232229  80.285711 244.3.210.254 -> 244.3.3.185  TCP 76 19813 > 3Com-nsd [PSH, ACK] Seq=17740 Ack=6878 Win=65535 Len=18
232249  80.289851 244.3.210.254 -> 244.3.3.185  TCP 76 19813 > 3Com-nsd [PSH, ACK] Seq=17758 Ack=6928 Win=65535 Len=18
232260  80.297227 244.3.210.254 -> 244.3.3.185  TCP 94 19813 > 3Com-nsd [PSH, ACK] Seq=17776 Ack=7039 Win=65535 Len=36
232267  80.298450 244.3.210.254 -> 244.3.3.185  TCP 108 19813 > 3Com-nsd [PSH, ACK] Seq=17812 Ack=7071 Win=65535 Len=50
232270  80.299776 244.3.210.254 -> 244.3.3.185  TCP 116 19813 > 3Com-nsd [PSH, ACK] Seq=17862 Ack=7111 Win=65535 Len=58
232275  80.300999 244.3.210.254 -> 244.3.3.185  TCP 76 19813 > 3Com-nsd [PSH, ACK] Seq=17920 Ack=7147 Win=65535 Len=18
232279  80.302268 244.3.210.254 -> 244.3.3.185  TCP 1438 19813 > 3Com-nsd [ACK] Seq=17938 Ack=7183 Win=65535 Len=1380
232280  80.302272 244.3.210.254 -> 244.3.3.185  TCP 174 19813 > 3Com-nsd [PSH, ACK] Seq=19318 Ack=7183 Win=65535 Len=116
232295  80.311061 244.3.210.254 -> 244.3.3.185  TCP 76 19813 > 3Com-nsd [PSH, ACK] Seq=19434 Ack=7409 Win=65535 Len=18
232302  80.312167 244.3.210.254 -> 244.3.3.185  TCP 86 19813 > 3Com-nsd [PSH, ACK] Seq=19452 Ack=7409 Win=65535 Len=28
232308  80.313579 244.3.210.254 -> 244.3.3.185  TCP 116 19813 > 3Com-nsd [PSH, ACK] Seq=19480 Ack=7449 Win=65535 Len=58
232310  80.314797 244.3.210.254 -> 244.3.3.185  TCP 76 19813 > 3Com-nsd [PSH, ACK] Seq=19538 Ack=7485 Win=65535 Len=18
232312  80.316008 244.3.210.254 -> 244.3.3.185  TCP 351 19813 > 3Com-nsd [PSH, ACK] Seq=19556 Ack=7521 Win=65535 Len=293
232318  80.324391 244.3.210.254 -> 244.3.3.185  TCP 76 19813 > 3Com-nsd [PSH, ACK] Seq=19849 Ack=7651 Win=65535 Len=18
232321  80.325496 244.3.210.254 -> 244.3.3.185  TCP 86 19813 > 3Com-nsd [PSH, ACK] Seq=19867 Ack=7651 Win=65535 Len=28
232326  80.326730 244.3.210.254 -> 244.3.3.185  TCP 76 19813 > 3Com-nsd [PSH, ACK] Seq=19895 Ack=7687 Win=65535 Len=18
232328  80.328229 244.3.210.254 -> 244.3.3.185  TCP 76 19813 > 3Com-nsd [PSH, ACK] Seq=19913 Ack=7811 Win=65535 Len=18
232333  80.332132 244.3.210.254 -> 244.3.3.185  TCP 76 19813 > 3Com-nsd [PSH, ACK] Seq=19931 Ack=7861 Win=65535 Len=18
232352  80.337414 244.3.210.254 -> 244.3.3.185  TCP 94 19813 > 3Com-nsd [PSH, ACK] Seq=19949 Ack=7972 Win=65535 Len=36
232355  80.338613 244.3.210.254 -> 244.3.3.185  TCP 108 19813 > 3Com-nsd [PSH, ACK] Seq=19985 Ack=8004 Win=65535 Len=50
232381  80.346886 244.3.210.254 -> 244.3.3.185  TCP 76 19813 > 3Com-nsd [PSH, ACK] Seq=20035 Ack=8230 Win=65535 Len=18
232393  80.347841 244.3.210.254 -> 244.3.3.185  TCP 86 19813 > 3Com-nsd [PSH, ACK] Seq=20053 Ack=8230 Win=65535 Len=28
232398  80.349595 244.3.210.254 -> 244.3.3.185  TCP 76 19813 > 3Com-nsd [PSH, ACK] Seq=20081 Ack=8354 Win=65535 Len=18
232400  80.353638 244.3.210.254 -> 244.3.3.185  TCP 76 19813 > 3Com-nsd [PSH, ACK] Seq=20099 Ack=8404 Win=65535 Len=18
232403  80.359026 244.3.210.254 -> 244.3.3.185  TCP 94 19813 > 3Com-nsd [PSH, ACK] Seq=20117 Ack=8515 Win=65535 Len=36
232407  80.360462 244.3.210.254 -> 244.3.3.185  TCP 108 19813 > 3Com-nsd [PSH, ACK] Seq=20153 Ack=8547 Win=65535 Len=50
232412  80.362099 244.3.210.254 -> 244.3.3.185  TCP 76 19813 > 3Com-nsd [PSH, ACK] Seq=20203 Ack=8583 Win=65535 Len=18
232414  80.363302 244.3.210.254 -> 244.3.3.185  TCP 378 19813 > 3Com-nsd [PSH, ACK] Seq=20221 Ack=8619 Win=65535 Len=320
232420  80.378146 244.3.210.254 -> 244.3.3.185  TCP 76 19813 > 3Com-nsd [PSH, ACK] Seq=20541 Ack=8749 Win=65535 Len=18
232422  80.378459 244.3.210.254 -> 244.3.3.185  TCP 86 19813 > 3Com-nsd [PSH, ACK] Seq=20559 Ack=8749 Win=65535 Len=28
232425  80.379389 244.3.210.254 -> 244.3.3.185  TCP 92 19813 > 3Com-nsd [PSH, ACK] Seq=20587 Ack=8789 Win=65535 Len=34
232433  80.386759 244.3.210.254 -> 244.3.3.185  TCP 178 19813 > 3Com-nsd [PSH, ACK] Seq=20621 Ack=8825 Win=65535 Len=120
232461  80.388680 244.3.210.254 -> 244.3.3.185  TCP 76 19813 > 3Com-nsd [PSH, ACK] Seq=20741 Ack=8861 Win=65535 Len=18
232464  80.389897 244.3.210.254 -> 244.3.3.185  TCP 378 19813 > 3Com-nsd [PSH, ACK] Seq=20759 Ack=8897 Win=65535 Len=320
232468  80.392833 244.3.210.254 -> 244.3.3.185  TCP 76 19813 > 3Com-nsd [PSH, ACK] Seq=21079 Ack=9027 Win=65535 Len=18
232469  80.393132 244.3.210.254 -> 244.3.3.185  TCP 86 19813 > 3Com-nsd [PSH, ACK] Seq=21097 Ack=9027 Win=65535 Len=28
232472  80.394070 244.3.210.254 -> 244.3.3.185  TCP 92 19813 > 3Com-nsd [PSH, ACK] Seq=21125 Ack=9067 Win=65535 Len=34
232476  80.395273 244.3.210.254 -> 244.3.3.185  TCP 76 19813 > 3Com-nsd [PSH, ACK] Seq=21159 Ack=9103 Win=65535 Len=18
232478  80.396478 244.3.210.254 -> 244.3.3.185  TCP 178 19813 > 3Com-nsd [PSH, ACK] Seq=21177 Ack=9139 Win=65535 Len=120
232480  80.398760 244.3.210.254 -> 244.3.3.185  TCP 64 19813 > 3Com-nsd [ACK] Seq=21297 Ack=9269 Win=65535 Len=0
232481  80.400161 244.3.210.254 -> 244.3.3.185  TCP 76 19813 > 3Com-nsd [PSH, ACK] Seq=21297 Ack=9269 Win=65535 Len=18
232483  80.400469 244.3.210.254 -> 244.3.3.185  TCP 86 19813 > 3Com-nsd [PSH, ACK] Seq=21315 Ack=9269 Win=65535 Len=28
232499  80.401394 244.3.210.254 -> 244.3.3.185  TCP 92 19813 > 3Com-nsd [PSH, ACK] Seq=21343 Ack=9309 Win=65535 Len=34
232526  80.402699 244.3.210.254 -> 244.3.3.185  TCP 228 19813 > 3Com-nsd [PSH, ACK] Seq=21377 Ack=9345 Win=65535 Len=170
232539  80.405306 244.3.210.254 -> 244.3.3.185  TCP 76 19813 > 3Com-nsd [PSH, ACK] Seq=21547 Ack=9475 Win=65535 Len=18
232540  80.405669 244.3.210.254 -> 244.3.3.185  TCP 86 19813 > 3Com-nsd [PSH, ACK] Seq=21565 Ack=9475 Win=65535 Len=28
232543  80.406900 244.3.210.254 -> 244.3.3.185  TCP 92 19813 > 3Com-nsd [PSH, ACK] Seq=21593 Ack=9515 Win=65535 Len=34
232545  80.408092 244.3.210.254 -> 244.3.3.185  TCP 76 19813 > 3Com-nsd [PSH, ACK] Seq=21627 Ack=9551 Win=65535 Len=18
232552  80.409319 244.3.210.254 -> 244.3.3.185  TCP 228 19813 > 3Com-nsd [PSH, ACK] Seq=21645 Ack=9587 Win=65535 Len=170
232579  80.427300 244.3.210.254 -> 244.3.3.185  TCP 76 19813 > 3Com-nsd [PSH, ACK] Seq=21815 Ack=9717 Win=65535 Len=18
232580  80.427936 244.3.210.254 -> 244.3.3.185  TCP 86 19813 > 3Com-nsd [PSH, ACK] Seq=21833 Ack=9717 Win=65535 Len=28
232583  80.429180 244.3.210.254 -> 244.3.3.185  TCP 116 19813 > 3Com-nsd [PSH, ACK] Seq=21861 Ack=9757 Win=65535 Len=58
232593  80.437404 244.3.210.254 -> 244.3.3.185  TCP 232 19813 > 3Com-nsd [PSH, ACK] Seq=21919 Ack=9793 Win=65535 Len=174
232651  80.452339 244.3.210.254 -> 244.3.3.185  TCP 76 19813 > 3Com-nsd [PSH, ACK] Seq=22093 Ack=9923 Win=65535 Len=18
232652  80.452643 244.3.210.254 -> 244.3.3.185  TCP 86 19813 > 3Com-nsd [PSH, ACK] Seq=22111 Ack=9923 Win=65535 Len=28
232655  80.453877 244.3.210.254 -> 244.3.3.185  TCP 92 19813 > 3Com-nsd [PSH, ACK] Seq=22139 Ack=9963 Win=65535 Len=34
232661  80.455092 244.3.210.254 -> 244.3.3.185  TCP 76 19813 > 3Com-nsd [PSH, ACK] Seq=22173 Ack=9999 Win=65535 Len=18
232663  80.456313 244.3.210.254 -> 244.3.3.185  TCP 210 19813 > 3Com-nsd [PSH, ACK] Seq=22191 Ack=10035 Win=65535 Len=152
232751  80.489097 244.3.210.254 -> 244.3.3.185  TCP 76 19813 > 3Com-nsd [PSH, ACK] Seq=22343 Ack=10165 Win=65535 Len=18
232754  80.490724 244.3.210.254 -> 244.3.3.185  TCP 86 19813 > 3Com-nsd [PSH, ACK] Seq=22361 Ack=10165 Win=65535 Len=28
232762  80.491980 244.3.210.254 -> 244.3.3.185  TCP 284 19813 > 3Com-nsd [PSH, ACK] Seq=22389 Ack=10205 Win=65535 Len=226
232833  80.502983 244.3.210.254 -> 244.3.3.185  TCP 182 19813 > 3Com-nsd [PSH, ACK] Seq=22615 Ack=10241 Win=65535 Len=124
232843  80.506343 244.3.210.254 -> 244.3.3.185  TCP 76 19813 > 3Com-nsd [PSH, ACK] Seq=22739 Ack=10371 Win=65535 Len=18
232846  80.506668 244.3.210.254 -> 244.3.3.185  TCP 86 19813 > 3Com-nsd [PSH, ACK] Seq=22757 Ack=10371 Win=65535 Len=28
232856  80.507890 244.3.210.254 -> 244.3.3.185  TCP 100 19813 > 3Com-nsd [PSH, ACK] Seq=22785 Ack=10411 Win=65535 Len=42
232907  80.516725 244.3.210.254 -> 244.3.3.185  TCP 250 19813 > 3Com-nsd [PSH, ACK] Seq=22827 Ack=10447 Win=65535 Len=192
232912  80.519599 244.3.210.254 -> 244.3.3.185  TCP 76 19813 > 3Com-nsd [PSH, ACK] Seq=23019 Ack=10577 Win=65535 Len=18
232913  80.520110 244.3.210.254 -> 244.3.3.185  TCP 86 19813 > 3Com-nsd [PSH, ACK] Seq=23037 Ack=10577 Win=65535 Len=28
232924  80.521357 244.3.210.254 -> 244.3.3.185  TCP 92 19813 > 3Com-nsd [PSH, ACK] Seq=23065 Ack=10617 Win=65535 Len=34
232955  80.533047 244.3.210.254 -> 244.3.3.185  TCP 208 19813 > 3Com-nsd [PSH, ACK] Seq=23099 Ack=10653 Win=65535 Len=150
232964  80.534394 244.3.210.254 -> 244.3.3.185  TCP 76 19813 > 3Com-nsd [PSH, ACK] Seq=23249 Ack=10783 Win=65535 Len=18
232968  80.535603 244.3.210.254 -> 244.3.3.185  TCP 108 19813 > 3Com-nsd [PSH, ACK] Seq=23267 Ack=10815 Win=65535 Len=50
232972  80.536801 244.3.210.254 -> 244.3.3.185  TCP 76 19813 > 3Com-nsd [PSH, ACK] Seq=23317 Ack=10851 Win=65535 Len=18
232977  80.537998 244.3.210.254 -> 244.3.3.185  TCP 208 19813 > 3Com-nsd [PSH, ACK] Seq=23335 Ack=10887 Win=65535 Len=150
232979  80.539251 244.3.210.254 -> 244.3.3.185  TCP 76 19813 > 3Com-nsd [PSH, ACK] Seq=23485 Ack=10923 Win=65535 Len=18
232992  80.540457 244.3.210.254 -> 244.3.3.185  TCP 208 19813 > 3Com-nsd [PSH, ACK] Seq=23503 Ack=10959 Win=65535 Len=150
233019  80.541853 244.3.210.254 -> 244.3.3.185  TCP 76 19813 > 3Com-nsd [PSH, ACK] Seq=23653 Ack=11089 Win=65535 Len=18
233020  80.541944 244.3.210.254 -> 244.3.3.185  TCP 86 19813 > 3Com-nsd [PSH, ACK] Seq=23671 Ack=11089 Win=65535 Len=28
233029  80.543066 244.3.210.254 -> 244.3.3.185  TCP 92 19813 > 3Com-nsd [PSH, ACK] Seq=23699 Ack=11129 Win=65535 Len=34
233031  80.544373 244.3.210.254 -> 244.3.3.185  TCP 160 19813 > 3Com-nsd [PSH, ACK] Seq=23733 Ack=11165 Win=65535 Len=102
233035  80.545628 244.3.210.254 -> 244.3.3.185  TCP 76 19813 > 3Com-nsd [PSH, ACK] Seq=23835 Ack=11201 Win=65535 Len=18
233038  80.547598 244.3.210.254 -> 244.3.3.185  TCP 76 19813 > 3Com-nsd [PSH, ACK] Seq=23853 Ack=11331 Win=65535 Len=18
233039  80.547805 244.3.210.254 -> 244.3.3.185  TCP 86 19813 > 3Com-nsd [PSH, ACK] Seq=23871 Ack=11331 Win=65535 Len=28
233046  80.548824 244.3.210.254 -> 244.3.3.185  TCP 92 19813 > 3Com-nsd [PSH, ACK] Seq=23899 Ack=11371 Win=65535 Len=34
233072  80.560476 244.3.210.254 -> 244.3.3.185  TCP 228 19813 > 3Com-nsd [PSH, ACK] Seq=23933 Ack=11407 Win=65535 Len=170
233089  80.562126 244.3.210.254 -> 244.3.3.185  TCP 253 19813 > 3Com-nsd [PSH, ACK] Seq=24103 Ack=11481 Win=65535 Len=195
233095  80.563477 244.3.210.254 -> 244.3.3.185  TCP 1072 19813 > 3Com-nsd [PSH, ACK] Seq=24298 Ack=11513 Win=65535 Len=1014
233097  80.565088 244.3.210.254 -> 244.3.3.185  TCP 76 19813 > 3Com-nsd [PSH, ACK] Seq=25312 Ack=11549 Win=65535 Len=18
233099  80.569111 244.3.210.254 -> 244.3.3.185  TCP 76 19813 > 3Com-nsd [PSH, ACK] Seq=25330 Ack=11679 Win=65535 Len=18
233100  80.569402 244.3.210.254 -> 244.3.3.185  TCP 86 19813 > 3Com-nsd [PSH, ACK] Seq=25348 Ack=11679 Win=65535 Len=28
233106  80.570397 244.3.210.254 -> 244.3.3.185  TCP 92 19813 > 3Com-nsd [PSH, ACK] Seq=25376 Ack=11719 Win=65535 Len=34
233116  80.571592 244.3.210.254 -> 244.3.3.185  TCP 76 19813 > 3Com-nsd [PSH, ACK] Seq=25410 Ack=11755 Win=65535 Len=18
233124  80.572903 244.3.210.254 -> 244.3.3.185  TCP 210 19813 > 3Com-nsd [PSH, ACK] Seq=25428 Ack=11791 Win=65535 Len=152
234767  81.552323 244.3.210.254 -> 41.177.244.90 TCP 70 19813 > ati-ip-to-ncpe [PSH, ACK] Seq=13 Ack=13 Win=65535 Len=12
236363  82.318949 244.3.210.254 -> 244.3.106.254 TCP 70 19813 > 4227 [PSH, ACK] Seq=13 Ack=13 Win=65535 Len=12
237270  82.398843 244.3.210.254 -> 244.3.77.218 TCP 64 19813 > kazaa [ACK] Seq=13 Ack=25 Win=65535 Len=0
237514  82.510839 244.3.210.254 -> 244.3.3.185  TCP 76 19813 > 3Com-nsd [PSH, ACK] Seq=25580 Ack=11902 Win=65535 Len=18
237521  82.512422 244.3.210.254 -> 244.3.3.185  TCP 76 19813 > 3Com-nsd [PSH, ACK] Seq=25598 Ack=11964 Win=65535 Len=18
237606  82.542703 244.3.210.254 -> 244.3.3.185  TCP 76 19813 > 3Com-nsd [PSH, ACK] Seq=25616 Ack=12000 Win=65535 Len=18
237608  82.544197 244.3.210.254 -> 244.3.3.185  TCP 76 19813 > 3Com-nsd [PSH, ACK] Seq=25634 Ack=12036 Win=65535 Len=18
237610  82.545385 244.3.210.254 -> 244.3.3.185  TCP 76 19813 > 3Com-nsd [PSH, ACK] Seq=25652 Ack=12072 Win=65535 Len=18
237612  82.546593 244.3.210.254 -> 244.3.3.185  TCP 76 19813 > 3Com-nsd [PSH, ACK] Seq=25670 Ack=12108 Win=65535 Len=18
237614  82.547762 244.3.210.254 -> 244.3.3.185  TCP 76 19813 > 3Com-nsd [PSH, ACK] Seq=25688 Ack=12144 Win=65535 Len=18
237635  82.571008 244.3.210.254 -> 244.3.3.185  TCP 76 19813 > 3Com-nsd [PSH, ACK] Seq=25706 Ack=12180 Win=65535 Len=18
237639  82.572216 244.3.210.254 -> 244.3.3.185  TCP 76 19813 > 3Com-nsd [PSH, ACK] Seq=25724 Ack=12216 Win=65535 Len=18
237641  82.573384 244.3.210.254 -> 244.3.3.185  TCP 76 19813 > 3Com-nsd [PSH, ACK] Seq=25742 Ack=12252 Win=65535 Len=18
237645  82.574630 244.3.210.254 -> 244.3.3.185  TCP 76 19813 > 3Com-nsd [PSH, ACK] Seq=25760 Ack=12288 Win=65535 Len=18
237658  82.575816 244.3.210.254 -> 244.3.3.185  TCP 76 19813 > 3Com-nsd [PSH, ACK] Seq=25778 Ack=12324 Win=65535 Len=18
237791  82.598860 244.3.210.254 -> 244.3.3.185  TCP 64 19813 > 3Com-nsd [ACK] Seq=25796 Ack=12336 Win=65535 Len=0
241298  83.998914 244.3.210.254 -> 41.177.244.142 TCP 70 52502 > afpovertcp [ACK] Seq=49 Ack=49 Win=65535 Len=0 TSval=2134604181 TSecr=3472904081
253080  89.599033 244.3.210.254 -> 41.177.244.177 TCP 70 19813 > 54781 [ACK] Seq=13 Ack=25 Win=65535 Len=0 TSval=2134604193 TSecr=763085293
255451  90.704384 244.3.210.254 -> 41.177.244.185 UDP 112 Source port: 3283  Destination port: 3283
263134  91.901660 244.3.210.254 -> 41.177.244.188 TCP 82 19813 > 52599 [PSH, ACK] Seq=13 Ack=13 Win=65535 Len=12 TSval=2134604197 TSecr=1028051620
283381  95.034719 244.3.210.254 -> 41.177.244.224 TCP 82 19813 > 63522 [PSH, ACK] Seq=13 Ack=13 Win=65535 Len=12 TSval=2134604203 TSecr=1335776282
292617  98.199266 244.3.210.254 -> 41.177.244.128 TCP 64 19813 > murx [ACK] Seq=13 Ack=25 Win=65535 Len=0
298077 100.484329 244.3.210.254 -> 41.177.244.142 TCP 70 19813 > 4944 [PSH, ACK] Seq=13 Ack=13 Win=65535 Len=12
303636 102.684187 244.3.210.254 -> 41.177.244.117 TCP 82 19813 > 52544 [PSH, ACK] Seq=13 Ack=13 Win=65535 Len=12 TSval=2134604219 TSecr=1697479305
308483 105.034037 244.3.210.254 -> 41.177.244.220 TCP 70 19813 > dialpad-voice1 [PSH, ACK] Seq=13 Ack=13 Win=65535 Len=12
322055 110.199577 244.3.210.254 -> 41.177.244.77 TCP 64 19813 > m2ua [ACK] Seq=13 Ack=25 Win=65535 Len=0
328051 113.599661 244.3.210.254 -> 41.177.244.38 TCP 64 19813 > xnds [ACK] Seq=13 Ack=25 Win=65535 Len=0
332525 115.999774 244.3.210.254 -> 41.177.244.142 TCP 70 52502 > afpovertcp [ACK] Seq=65 Ack=65 Win=65535 Len=0 TSval=2134604245 TSecr=3472904145
334873 117.083186 244.3.210.254 -> 41.177.244.124 TCP 82 19813 > 55919 [PSH, ACK] Seq=13 Ack=13 Win=65535 Len=12 TSval=2134604248 TSecr=130609377
353005 119.832968 244.3.210.254 -> 41.177.244.177 TCP 82 19813 > 63123 [PSH, ACK] Seq=13 Ack=13 Win=65535 Len=12 TSval=2134604253 TSecr=763085198
354600 120.702269 244.3.210.254 -> 41.177.244.185 UDP 112 Source port: 3283  Destination port: 3283
356981 121.799961 244.3.210.254 -> 41.177.244.90 TCP 64 19813 > ati-ip-to-ncpe [ACK] Seq=25 Ack=25 Win=65535 Len=0
358457 122.382785 244.3.210.254 -> 244.3.77.218 TCP 70 19813 > kazaa [PSH, ACK] Seq=13 Ack=25 Win=65535 Len=12
359071 122.582776 244.3.210.254 -> 244.3.3.185  TCP 70 19813 > 3Com-nsd [PSH, ACK] Seq=25796 Ack=12336 Win=65535 Len=12
359139 122.599983 244.3.210.254 -> 244.3.106.254 TCP 64 19813 > 4227 [ACK] Seq=25 Ack=25 Win=65535 Len=0
387748 129.415634 244.3.210.254 -> 41.177.244.177 TCP 82 19813 > 54781 [PSH, ACK] Seq=13 Ack=25 Win=65535 Len=12 TSval=2134604272 TSecr=763085293
394057 132.000254 244.3.210.254 -> 41.177.244.188 TCP 70 19813 > 52599 [ACK] Seq=25 Ack=25 Win=65535 Len=0 TSval=2134604277 TSecr=1028051780
403075 135.200345 244.3.210.254 -> 41.177.244.224 TCP 70 19813 > 63522 [ACK] Seq=25 Ack=25 Win=65535 Len=0 TSval=2134604284 TSecr=1335776442
413428 138.098402 244.3.210.254 -> 41.177.244.128 TCP 70 19813 > murx [PSH, ACK] Seq=13 Ack=25 Win=65535 Len=12
430983 140.800534 244.3.210.254 -> 41.177.244.142 TCP 64 19813 > 4944 [ACK] Seq=25 Ack=25 Win=65535 Len=0
437891 142.800560 244.3.210.254 -> 41.177.244.117 TCP 70 19813 > 52544 [ACK] Seq=25 Ack=25 Win=65535 Len=0 TSval=2134604299 TSecr=1697479465
443689 144.424351 244.3.210.254 -> 145.95.177.71 TCP 78 50628 > 3283 [SYN] Seq=0 Win=65535 Len=0 MSS=1460 WS=1 TSval=2134604302 TSecr=0
447585 145.400673 244.3.210.254 -> 41.177.244.220 TCP 64 19813 > dialpad-voice1 [ACK] Seq=25 Ack=25 Win=65535 Len=0
451489 147.052598 244.3.210.254 -> 145.95.177.71 TCP 78 [TCP Retransmission] 50628 > 3283 [SYN] Seq=0 Win=65535 Len=0 MSS=1460 WS=1 TSval=2134604307 TSecr=0
453801 148.000730 244.3.210.254 -> 41.177.244.142 TCP 70 52502 > afpovertcp [ACK] Seq=81 Ack=81 Win=65535 Len=0 TSval=2134604309 TSecr=3472904209
458924 150.052616 244.3.210.254 -> 145.95.177.71 TCP 78 [TCP Retransmission] 50628 > 3283 [SYN] Seq=0 Win=65535 Len=0 MSS=1460 WS=1 TSval=2134604313 TSecr=0
459241 150.180401 244.3.210.254 -> 41.177.244.77 TCP 70 19813 > m2ua [PSH, ACK] Seq=13 Ack=25 Win=65535 Len=12
460531 150.700296 244.3.210.254 -> 41.177.244.185 UDP 112 Source port: 3283  Destination port: 3283
465414 153.052629 244.3.210.254 -> 145.95.177.71 TCP 64 [TCP Retransmission] 50628 > 3283 [SYN] Seq=0 Win=65535 Len=0 MSS=1460
466315 153.513946 244.3.210.254 -> 41.177.244.38 TCP 70 19813 > xnds [PSH, ACK] Seq=13 Ack=25 Win=65535 Len=12
473080 156.052696 244.3.210.254 -> 145.95.177.71 TCP 64 [TCP Retransmission] 50628 > 3283 [SYN] Seq=0 Win=65535 Len=0 MSS=1460
476264 157.200966 244.3.210.254 -> 41.177.244.124 TCP 70 19813 > 55919 [ACK] Seq=25 Ack=25 Win=65535 Len=0 TSval=2134604328 TSecr=130610177
482409 159.052693 244.3.210.254 -> 145.95.177.71 TCP 64 [TCP Retransmission] 50628 > 3283 [SYN] Seq=0 Win=65535 Len=0 MSS=1460
485816 160.001030 244.3.210.254 -> 41.177.244.177 TCP 70 19813 > 63123 [ACK] Seq=25 Ack=25 Win=65535 Len=0 TSval=2134604333 TSecr=763085998
490430 161.630065 244.3.210.254 -> 41.177.244.90 TCP 70 19813 > ati-ip-to-ncpe [PSH, ACK] Seq=25 Ack=25 Win=65535 Len=12
491864 162.463314 244.3.210.254 -> 244.3.106.254 TCP 70 19813 > 4227 [PSH, ACK] Seq=25 Ack=25 Win=65535 Len=12
492382 162.601132 244.3.210.254 -> 244.3.77.218 TCP 64 19813 > kazaa [ACK] Seq=25 Ack=37 Win=65535 Len=0
493336 162.801163 244.3.210.254 -> 244.3.3.185  TCP 64 19813 > 3Com-nsd [ACK] Seq=25808 Ack=12348 Win=65535 Len=0
513863 165.052704 244.3.210.254 -> 145.95.177.71 TCP 64 [TCP Retransmission] 50628 > 3283 [SYN] Seq=0 Win=65535 Len=0 MSS=1460
522828 169.601312 244.3.210.254 -> 41.177.244.177 TCP 70 19813 > 54781 [ACK] Seq=25 Ack=37 Win=65535 Len=0 TSval=2134604353 TSecr=763086093
529026 171.912697 244.3.210.254 -> 41.177.244.188 TCP 82 19813 > 52599 [PSH, ACK] Seq=25 Ack=25 Win=65535 Len=12 TSval=2134604357 TSecr=1028051780
539763 175.062429 244.3.210.254 -> 41.177.244.224 TCP 82 19813 > 63522 [PSH, ACK] Seq=25 Ack=25 Win=65535 Len=12 TSval=2134604364 TSecr=1335776442
549619 177.052797 244.3.210.254 -> 145.95.177.71 TCP 64 [TCP Retransmission] 50628 > 3283 [SYN] Seq=0 Win=65535 Len=0 MSS=1460
553708 178.201545 244.3.210.254 -> 41.177.244.128 TCP 64 19813 > murx [ACK] Seq=25 Ack=37 Win=65535 Len=0
560439 180.001582 244.3.210.254 -> 41.177.244.142 TCP 70 52502 > afpovertcp [ACK] Seq=97 Ack=97 Win=65535 Len=0 TSval=2134604373 TSecr=3472904273
564534 180.628750 244.3.210.254 -> 41.177.244.142 TCP 70 19813 > 4944 [PSH, ACK] Seq=25 Ack=25 Win=65535 Len=12
564724 180.698112 244.3.210.254 -> 41.177.244.185 UDP 112 Source port: 3283  Destination port: 3283
573457 182.728606 244.3.210.254 -> 41.177.244.117 TCP 82 19813 > 52544 [PSH, ACK] Seq=25 Ack=25 Win=65535 Len=12 TSval=2134604379 TSecr=1697479465
582143 185.255411 244.3.210.254 -> 41.177.244.220 TCP 70 19813 > dialpad-voice1 [PSH, ACK] Seq=25 Ack=25 Win=65535 Len=12
600712 190.401875 244.3.210.254 -> 41.177.244.77 TCP 64 19813 > m2ua [ACK] Seq=25 Ack=37 Win=65535 Len=0
610524 193.802001 244.3.210.254 -> 41.177.244.38 TCP 64 19813 > xnds [ACK] Seq=25 Ack=37 Win=65535 Len=0
619812 197.110930 244.3.210.254 -> 41.177.244.124 TCP 82 19813 > 55919 [PSH, ACK] Seq=25 Ack=25 Win=65535 Len=12 TSval=2134604408 TSecr=130610177
631023 199.943551 244.3.210.254 -> 41.177.244.177 TCP 82 19813 > 63123 [PSH, ACK] Seq=25 Ack=25 Win=65535 Len=12 TSval=2134604413 TSecr=763085998
636961 201.052745 244.3.210.254 -> 145.95.177.71 TCP 64 [TCP Retransmission] 50628 > 3283 [SYN] Seq=0 Win=65535 Len=0 MSS=1460
639401 201.802182 244.3.210.254 -> 41.177.244.90 TCP 64 19813 > ati-ip-to-ncpe [ACK] Seq=37 Ack=37 Win=65535 Len=0
641759 202.443888 244.3.210.254 -> 244.3.77.218 TCP 70 19813 > kazaa [PSH, ACK] Seq=25 Ack=37 Win=65535 Len=12
643970 202.677186 244.3.210.254 -> 244.3.3.185  TCP 70 19813 > 3Com-nsd [PSH, ACK] Seq=25808 Ack=12348 Win=65535 Len=12
644584 202.802241 244.3.210.254 -> 244.3.106.254 TCP 64 19813 > 4227 [ACK] Seq=37 Ack=37 Win=65535 Len=0
672094 209.460066 244.3.210.254 -> 41.177.244.177 TCP 82 19813 > 54781 [PSH, ACK] Seq=25 Ack=37 Win=65535 Len=12 TSval=2134604432 TSecr=763086093
674735 210.696008 244.3.210.254 -> 41.177.244.185 UDP 112 Source port: 3283  Destination port: 3283
677332 212.002467 244.3.210.254 -> 41.177.244.188 TCP 70 19813 > 52599 [ACK] Seq=37 Ack=37 Win=65535 Len=0 TSval=2134604437 TSecr=1028051940
677333 212.002472 244.3.210.254 -> 41.177.244.142 TCP 70 52502 > afpovertcp [ACK] Seq=113 Ack=113 Win=65535 Len=0 TSval=2134604437 TSecr=3472904337
685293 215.202553 244.3.210.254 -> 41.177.244.224 TCP 70 19813 > 63522 [ACK] Seq=37 Ack=37 Win=65535 Len=0 TSval=2134604444 TSecr=1335776602
691557 218.192294 244.3.210.254 -> 41.177.244.128 TCP 70 19813 > murx [PSH, ACK] Seq=25 Ack=37 Win=65535 Len=12
697647 221.002710 244.3.210.254 -> 41.177.244.142 TCP 64 19813 > 4944 [ACK] Seq=37 Ack=37 Win=65535 Len=0
701340 222.802780 244.3.210.254 -> 41.177.244.117 TCP 70 19813 > 52544 [ACK] Seq=37 Ack=37 Win=65535 Len=0 TSval=2134604459 TSecr=1697479625
708429 225.602896 244.3.210.254 -> 41.177.244.220 TCP 64 19813 > dialpad-voice1 [ACK] Seq=37 Ack=37 Win=65535 Len=0
721423 230.308586 244.3.210.254 -> 41.177.244.77 TCP 70 19813 > m2ua [PSH, ACK] Seq=25 Ack=37 Win=65535 Len=12
728163 233.658381 244.3.210.254 -> 41.177.244.38 TCP 70 19813 > xnds [PSH, ACK] Seq=25 Ack=37 Win=65535 Len=12
741900 237.203132 244.3.210.254 -> 41.177.244.124 TCP 70 19813 > 55919 [ACK] Seq=37 Ack=37 Win=65535 Len=0 TSval=2134604488 TSecr=130610977
749233 240.203216 244.3.210.254 -> 41.177.244.177 TCP 70 19813 > 63123 [ACK] Seq=37 Ack=37 Win=65535 Len=0 TSval=2134604494 TSecr=763086799
750857 240.693903 244.3.210.254 -> 41.177.244.185 UDP 112 Source port: 3283  Destination port: 3283
753423 241.774478 244.3.210.254 -> 41.177.244.90 TCP 70 19813 > ati-ip-to-ncpe [PSH, ACK] Seq=37 Ack=37 Win=65535 Len=12
754879 242.603300 244.3.210.254 -> 244.3.77.218 TCP 64 19813 > kazaa [ACK] Seq=37 Ack=49 Win=65535 Len=0
755099 242.674407 244.3.210.254 -> 244.3.106.254 TCP 70 19813 > 4227 [PSH, ACK] Seq=37 Ack=37 Win=65535 Len=12
755311 242.803331 244.3.210.254 -> 244.3.3.185  TCP 64 19813 > 3Com-nsd [ACK] Seq=25820 Ack=12360 Win=65535 Len=0
757633 244.003363 244.3.210.254 -> 41.177.244.142 TCP 70 52502 > afpovertcp [ACK] Seq=129 Ack=129 Win=65535 Len=0 TSval=2134604501 TSecr=3472904401
775053 249.603495 244.3.210.254 -> 41.177.244.177 TCP 70 19813 > 54781 [ACK] Seq=37 Ack=49 Win=65535 Len=0 TSval=2134604513 TSecr=763086893
779244 251.525167 244.3.210.254 -> 41.177.244.117 TCP 84 19813 > 52544 [PSH, ACK] Seq=37 Ack=49 Win=65535 Len=14 TSval=2134604516 TSecr=1697479682
779264 251.541086 244.3.210.254 -> 41.177.244.117 TCP 160 19813 > 52544 [PSH, ACK] Seq=51 Ack=209 Win=65535 Len=90 TSval=2134604516 TSecr=1697479682
779310 251.557202 244.3.210.254 -> 41.177.244.117 TCP 88 19813 > 52544 [PSH, ACK] Seq=141 Ack=369 Win=65535 Len=18 TSval=2134604517 TSecr=1697479682
779332 251.572997 244.3.210.254 -> 41.177.244.117 TCP 124 19813 > 52544 [PSH, ACK] Seq=159 Ack=401 Win=65535 Len=54 TSval=2134604517 TSecr=1697479682
779333 251.573070 244.3.210.254 -> 41.177.244.117 TCP 88 19813 > 52544 [PSH, ACK] Seq=213 Ack=401 Win=65535 Len=18 TSval=2134604517 TSecr=1697479682
779664 251.712867 244.3.210.254 -> 41.177.244.117 TCP 104 19813 > 52544 [PSH, ACK] Seq=231 Ack=419 Win=65535 Len=34 TSval=2134604517 TSecr=1697479683
780173 251.957250 244.3.210.254 -> 41.177.244.188 TCP 82 19813 > 52599 [PSH, ACK] Seq=37 Ack=37 Win=65535 Len=12 TSval=2134604517 TSecr=1028051940
780795 252.330284 244.3.210.254 -> 41.177.244.117 TCP 690 19813 > 52544 [PSH, ACK] Seq=265 Ack=455 Win=65535 Len=620 TSval=2134604518 TSecr=1697479684
780828 252.341640 244.3.210.254 -> 41.177.244.117 TCP 84 19813 > 52544 [PSH, ACK] Seq=885 Ack=467 Win=65535 Len=14 TSval=2134604518 TSecr=1697479684
780874 252.358040 244.3.210.254 -> 41.177.244.117 TCP 160 19813 > 52544 [PSH, ACK] Seq=899 Ack=627 Win=65535 Len=90 TSval=2134604518 TSecr=1697479684
780986 252.390734 244.3.210.254 -> 41.177.244.117 TCP 88 19813 > 52544 [PSH, ACK] Seq=989 Ack=787 Win=65535 Len=18 TSval=2134604518 TSecr=1697479684
781067 252.417155 244.3.210.254 -> 41.177.244.117 TCP 1084 19813 > 52544 [PSH, ACK] Seq=1007 Ack=819 Win=65535 Len=1014 TSval=2134604518 TSecr=1697479684
781081 252.420181 244.3.210.254 -> 41.177.244.117 TCP 106 19813 > 52544 [PSH, ACK] Seq=2021 Ack=861 Win=65535 Len=36 TSval=2134604518 TSecr=1697479684
781103 252.425082 244.3.210.254 -> 41.177.244.117 TCP 88 19813 > 52544 [PSH, ACK] Seq=2057 Ack=903 Win=65535 Len=18 TSval=2134604518 TSecr=1697479684
781335 252.504760 244.3.210.254 -> 41.177.244.117 TCP 1084 19813 > 52544 [PSH, ACK] Seq=2075 Ack=935 Win=65535 Len=1014 TSval=2134604518 TSecr=1697479684
781357 252.509053 244.3.210.254 -> 41.177.244.117 TCP 88 19813 > 52544 [PSH, ACK] Seq=3089 Ack=997 Win=65535 Len=18 TSval=2134604518 TSecr=1697479684
784181 254.014522 244.3.210.254 -> 41.177.244.117 TCP 88 19813 > 52544 [PSH, ACK] Seq=3107 Ack=1127 Win=65535 Len=18 TSval=2134604521 TSecr=1697479687
784183 254.014755 244.3.210.254 -> 41.177.244.117 TCP 98 19813 > 52544 [PSH, ACK] Seq=3125 Ack=1127 Win=65535 Len=28 TSval=2134604521 TSecr=1697479687
784188 254.018793 244.3.210.254 -> 41.177.244.117 TCP 88 19813 > 52544 [PSH, ACK] Seq=3153 Ack=1257 Win=65535 Len=18 TSval=2134604521 TSecr=1697479687
784189 254.019056 244.3.210.254 -> 41.177.244.117 TCP 98 19813 > 52544 [PSH, ACK] Seq=3171 Ack=1257 Win=65535 Len=28 TSval=2134604521 TSecr=1697479687
784193 254.020050 244.3.210.254 -> 41.177.244.117 TCP 104 19813 > 52544 [PSH, ACK] Seq=3199 Ack=1297 Win=65535 Len=34 TSval=2134604521 TSecr=1697479687
784212 254.037812 244.3.210.254 -> 41.177.244.117 TCP 720 19813 > 52544 [PSH, ACK] Seq=3233 Ack=1333 Win=65535 Len=650 TSval=2134604521 TSecr=1697479687
784215 254.041248 244.3.210.254 -> 41.177.244.117 TCP 88 19813 > 52544 [PSH, ACK] Seq=3883 Ack=1457 Win=65535 Len=18 TSval=2134604521 TSecr=1697479687
784226 254.047531 244.3.210.254 -> 41.177.244.117 TCP 88 19813 > 52544 [PSH, ACK] Seq=3901 Ack=1519 Win=65535 Len=18 TSval=2134604521 TSecr=1697479687
784426 254.169016 244.3.210.254 -> 41.177.244.117 TCP 1084 19813 > 52544 [PSH, ACK] Seq=3919 Ack=1551 Win=65535 Len=1014 TSval=2134604522 TSecr=1697479687
784461 254.179981 244.3.210.254 -> 41.177.244.117 TCP 88 19813 > 52544 [PSH, ACK] Seq=4933 Ack=1613 Win=65535 Len=18 TSval=2134604522 TSecr=1697479688
784650 254.285282 244.3.210.254 -> 41.177.244.117 TCP 106 19813 > 52544 [PSH, ACK] Seq=4951 Ack=1724 Win=65535 Len=36 TSval=2134604522 TSecr=1697479688
784653 254.286225 244.3.210.254 -> 41.177.244.117 TCP 120 19813 > 52544 [PSH, ACK] Seq=4987 Ack=1756 Win=65535 Len=50 TSval=2134604522 TSecr=1697479688
784656 254.287106 244.3.210.254 -> 41.177.244.117 TCP 104 19813 > 52544 [PSH, ACK] Seq=5037 Ack=1796 Win=65535 Len=34 TSval=2134604522 TSecr=1697479688
784659 254.288023 244.3.210.254 -> 41.177.244.117 TCP 88 19813 > 52544 [PSH, ACK] Seq=5071 Ack=1832 Win=65535 Len=18 TSval=2134604522 TSecr=1697479688
784662 254.288962 244.3.210.254 -> 41.177.244.117 TCP 720 19813 > 52544 [PSH, ACK] Seq=5089 Ack=1868 Win=65535 Len=650 TSval=2134604522 TSecr=1697479688
784668 254.291244 244.3.210.254 -> 41.177.244.117 TCP 285 19813 > 52544 [PSH, ACK] Seq=5739 Ack=1934 Win=65535 Len=215 TSval=2134604522 TSecr=1697479688
784671 254.292269 244.3.210.254 -> 41.177.244.117 TCP 1084 19813 > 52544 [PSH, ACK] Seq=5954 Ack=1966 Win=65535 Len=1014 TSval=2134604522 TSecr=1697479688
784674 254.293321 244.3.210.254 -> 41.177.244.117 TCP 88 19813 > 52544 [PSH, ACK] Seq=6968 Ack=2002 Win=65535 Len=18 TSval=2134604522 TSecr=1697479688
784679 254.294558 244.3.210.254 -> 41.177.244.117 TCP 161 19813 > 52544 [PSH, ACK] Seq=6986 Ack=2068 Win=65535 Len=91 TSval=2134604522 TSecr=1697479688
784706 254.295624 244.3.210.254 -> 41.177.244.117 TCP 1084 19813 > 52544 [PSH, ACK] Seq=7077 Ack=2100 Win=65535 Len=1014 TSval=2134604522 TSecr=1697479688
784709 254.297700 244.3.210.254 -> 41.177.244.117 TCP 720 19813 > 52544 [PSH, ACK] Seq=8091 Ack=2136 Win=65535 Len=650 TSval=2134604522 TSecr=1697479688
784714 254.300176 244.3.210.254 -> 41.177.244.117 TCP 88 19813 > 52544 [PSH, ACK] Seq=8741 Ack=2266 Win=65535 Len=18 TSval=2134604522 TSecr=1697479688
784715 254.300446 244.3.210.254 -> 41.177.244.117 TCP 98 19813 > 52544 [PSH, ACK] Seq=8759 Ack=2266 Win=65535 Len=28 TSval=2134604522 TSecr=1697479688
784717 254.301455 244.3.210.254 -> 41.177.244.117 TCP 104 19813 > 52544 [PSH, ACK] Seq=8787 Ack=2306 Win=65535 Len=34 TSval=2134604522 TSecr=1697479688
784719 254.302452 244.3.210.254 -> 41.177.244.117 TCP 278 19813 > 52544 [PSH, ACK] Seq=8821 Ack=2342 Win=65535 Len=208 TSval=2134604522 TSecr=1697479688
784721 254.303882 244.3.210.254 -> 41.177.244.117 TCP 88 19813 > 52544 [PSH, ACK] Seq=9029 Ack=2378 Win=65535 Len=18 TSval=2134604522 TSecr=1697479688
784727 254.308289 244.3.210.254 -> 41.177.244.117 TCP 88 19813 > 52544 [PSH, ACK] Seq=9047 Ack=2508 Win=65535 Len=18 TSval=2134604522 TSecr=1697479688
784728 254.308561 244.3.210.254 -> 41.177.244.117 TCP 98 19813 > 52544 [PSH, ACK] Seq=9065 Ack=2508 Win=65535 Len=28 TSval=2134604522 TSecr=1697479688
784730 254.309447 244.3.210.254 -> 41.177.244.117 TCP 104 19813 > 52544 [PSH, ACK] Seq=9093 Ack=2548 Win=65535 Len=34 TSval=2134604522 TSecr=1697479688
784732 254.310381 244.3.210.254 -> 41.177.244.117 TCP 720 19813 > 52544 [PSH, ACK] Seq=9127 Ack=2584 Win=65535 Len=650 TSval=2134604522 TSecr=1697479688
784734 254.312713 244.3.210.254 -> 41.177.244.117 TCP 88 19813 > 52544 [PSH, ACK] Seq=9777 Ack=2714 Win=65535 Len=18 TSval=2134604522 TSecr=1697479688
784735 254.312971 244.3.210.254 -> 41.177.244.117 TCP 98 19813 > 52544 [PSH, ACK] Seq=9795 Ack=2714 Win=65535 Len=28 TSval=2134604522 TSecr=1697479688
784742 254.313844 244.3.210.254 -> 41.177.244.117 TCP 104 19813 > 52544 [PSH, ACK] Seq=9823 Ack=2754 Win=65535 Len=34 TSval=2134604522 TSecr=1697479688
784744 254.314707 244.3.210.254 -> 41.177.244.117 TCP 88 19813 > 52544 [PSH, ACK] Seq=9857 Ack=2790 Win=65535 Len=18 TSval=2134604522 TSecr=1697479688
784746 254.315553 244.3.210.254 -> 41.177.244.117 TCP 278 19813 > 52544 [PSH, ACK] Seq=9875 Ack=2826 Win=65535 Len=208 TSval=2134604522 TSecr=1697479688
784775 254.327070 244.3.210.254 -> 41.177.244.117 TCP 88 19813 > 52544 [PSH, ACK] Seq=10083 Ack=2956 Win=65535 Len=18 TSval=2134604522 TSecr=1697479688
784776 254.327532 244.3.210.254 -> 41.177.244.117 TCP 98 19813 > 52544 [PSH, ACK] Seq=10101 Ack=2956 Win=65535 Len=28 TSval=2134604522 TSecr=1697479688
784778 254.328567 244.3.210.254 -> 41.177.244.117 TCP 108 19813 > 52544 [PSH, ACK] Seq=10129 Ack=2996 Win=65535 Len=38 TSval=2134604522 TSecr=1697479688
784780 254.329611 244.3.210.254 -> 41.177.244.117 TCP 398 19813 > 52544 [PSH, ACK] Seq=10167 Ack=3032 Win=65535 Len=328 TSval=2134604522 TSecr=1697479688
784828 254.357736 244.3.210.254 -> 41.177.244.117 TCP 88 19813 > 52544 [PSH, ACK] Seq=10495 Ack=3162 Win=65535 Len=18 TSval=2134604522 TSecr=1697479688
784830 254.358488 244.3.210.254 -> 41.177.244.117 TCP 98 19813 > 52544 [PSH, ACK] Seq=10513 Ack=3162 Win=65535 Len=28 TSval=2134604522 TSecr=1697479688
784833 254.359428 244.3.210.254 -> 41.177.244.117 TCP 164 19813 > 52544 [PSH, ACK] Seq=10541 Ack=3202 Win=65535 Len=94 TSval=2134604522 TSecr=1697479688
784846 254.373593 244.3.210.254 -> 41.177.244.117 TCP 1438 19813 > 52544 [ACK] Seq=10635 Ack=3238 Win=65535 Len=1368 TSval=2134604522 TSecr=1697479688
784847 254.373598 244.3.210.254 -> 41.177.244.117 TCP 833 19813 > 52544 [PSH, ACK] Seq=12003 Ack=3238 Win=65535 Len=763 TSval=2134604522 TSecr=1697479688
784849 254.375565 244.3.210.254 -> 41.177.244.117 TCP 88 19813 > 52544 [PSH, ACK] Seq=12766 Ack=3274 Win=65535 Len=18 TSval=2134604522 TSecr=1697479688
784852 254.376416 244.3.210.254 -> 41.177.244.117 TCP 398 19813 > 52544 [PSH, ACK] Seq=12784 Ack=3310 Win=65535 Len=328 TSval=2134604522 TSecr=1697479688
784861 254.378862 244.3.210.254 -> 41.177.244.117 TCP 88 19813 > 52544 [PSH, ACK] Seq=13112 Ack=3440 Win=65535 Len=18 TSval=2134604522 TSecr=1697479688
784862 254.379158 244.3.210.254 -> 41.177.244.117 TCP 98 19813 > 52544 [PSH, ACK] Seq=13130 Ack=3440 Win=65535 Len=28 TSval=2134604522 TSecr=1697479688
784864 254.382100 244.3.210.254 -> 41.177.244.117 TCP 88 19813 > 52544 [PSH, ACK] Seq=13158 Ack=3476 Win=65535 Len=18 TSval=2134604522 TSecr=1697479688
784947 254.403129 244.3.210.254 -> 41.177.244.117 TCP 406 19813 > 52544 [PSH, ACK] Seq=13176 Ack=3512 Win=65535 Len=336 TSval=2134604522 TSecr=1697479688
784950 254.405866 244.3.210.254 -> 41.177.244.117 TCP 88 19813 > 52544 [PSH, ACK] Seq=13512 Ack=3642 Win=65535 Len=18 TSval=2134604522 TSecr=1697479688
784953 254.406164 244.3.210.254 -> 41.177.244.117 TCP 98 19813 > 52544 [PSH, ACK] Seq=13530 Ack=3642 Win=65535 Len=28 TSval=2134604522 TSecr=1697479688
784964 254.407728 244.3.210.254 -> 41.177.244.117 TCP 88 19813 > 52544 [PSH, ACK] Seq=13558 Ack=3766 Win=65535 Len=18 TSval=2134604522 TSecr=1697479688
784980 254.410678 244.3.210.254 -> 41.177.244.117 TCP 88 19813 > 52544 [PSH, ACK] Seq=13576 Ack=3896 Win=65535 Len=18 TSval=2134604522 TSecr=1697479688
784981 254.410950 244.3.210.254 -> 41.177.244.117 TCP 98 19813 > 52544 [PSH, ACK] Seq=13594 Ack=3896 Win=65535 Len=28 TSval=2134604522 TSecr=1697479688
784988 254.411793 244.3.210.254 -> 41.177.244.117 TCP 104 19813 > 52544 [PSH, ACK] Seq=13622 Ack=3936 Win=65535 Len=34 TSval=2134604522 TSecr=1697479688
784994 254.413591 244.3.210.254 -> 41.177.244.117 TCP 88 19813 > 52544 [PSH, ACK] Seq=13656 Ack=3972 Win=65535 Len=18 TSval=2134604522 TSecr=1697479688
785060 254.427582 244.3.210.254 -> 41.177.244.117 TCP 694 19813 > 52544 [PSH, ACK] Seq=13674 Ack=4008 Win=65535 Len=624 TSval=2134604522 TSecr=1697479688
785073 254.430040 244.3.210.254 -> 41.177.244.117 TCP 88 19813 > 52544 [PSH, ACK] Seq=14298 Ack=4138 Win=65535 Len=18 TSval=2134604522 TSecr=1697479688
785077 254.430307 244.3.210.254 -> 41.177.244.117 TCP 98 19813 > 52544 [PSH, ACK] Seq=14316 Ack=4138 Win=65535 Len=28 TSval=2134604522 TSecr=1697479688
785086 254.431202 244.3.210.254 -> 41.177.244.117 TCP 104 19813 > 52544 [PSH, ACK] Seq=14344 Ack=4178 Win=65535 Len=34 TSval=2134604522 TSecr=1697479688
785090 254.432141 244.3.210.254 -> 41.177.244.117 TCP 88 19813 > 52544 [PSH, ACK] Seq=14378 Ack=4214 Win=65535 Len=18 TSval=2134604522 TSecr=1697479688
785098 254.433092 244.3.210.254 -> 41.177.244.117 TCP 278 19813 > 52544 [PSH, ACK] Seq=14396 Ack=4250 Win=65535 Len=208 TSval=2134604522 TSecr=1697479688
785109 254.435606 244.3.210.254 -> 41.177.244.117 TCP 106 19813 > 52544 [PSH, ACK] Seq=14604 Ack=4361 Win=65535 Len=36 TSval=2134604522 TSecr=1697479688
785116 254.436711 244.3.210.254 -> 41.177.244.117 TCP 120 19813 > 52544 [PSH, ACK] Seq=14640 Ack=4393 Win=65535 Len=50 TSval=2134604522 TSecr=1697479688
785122 254.437839 244.3.210.254 -> 41.177.244.117 TCP 104 19813 > 52544 [PSH, ACK] Seq=14690 Ack=4433 Win=65535 Len=34 TSval=2134604522 TSecr=1697479688
785130 254.438841 244.3.210.254 -> 41.177.244.117 TCP 88 19813 > 52544 [PSH, ACK] Seq=14724 Ack=4469 Win=65535 Len=18 TSval=2134604522 TSecr=1697479688
785140 254.439701 244.3.210.254 -> 41.177.244.117 TCP 720 19813 > 52544 [PSH, ACK] Seq=14742 Ack=4505 Win=65535 Len=650 TSval=2134604522 TSecr=1697479688
785173 254.442259 244.3.210.254 -> 41.177.244.117 TCP 88 19813 > 52544 [PSH, ACK] Seq=15392 Ack=4635 Win=65535 Len=18 TSval=2134604522 TSecr=1697479688
785174 254.442538 244.3.210.254 -> 41.177.244.117 TCP 98 19813 > 52544 [PSH, ACK] Seq=15410 Ack=4635 Win=65535 Len=28 TSval=2134604522 TSecr=1697479688
785177 254.443422 244.3.210.254 -> 41.177.244.117 TCP 104 19813 > 52544 [PSH, ACK] Seq=15438 Ack=4675 Win=65535 Len=34 TSval=2134604522 TSecr=1697479688
785181 254.444290 244.3.210.254 -> 41.177.244.117 TCP 88 19813 > 52544 [PSH, ACK] Seq=15472 Ack=4711 Win=65535 Len=18 TSval=2134604522 TSecr=1697479688
785186 254.445126 244.3.210.254 -> 41.177.244.117 TCP 278 19813 > 52544 [PSH, ACK] Seq=15490 Ack=4747 Win=65535 Len=208 TSval=2134604522 TSecr=1697479688
785193 254.446421 244.3.210.254 -> 41.177.244.117 TCP 88 19813 > 52544 [PSH, ACK] Seq=15698 Ack=4858 Win=65535 Len=18 TSval=2134604522 TSecr=1697479688
785204 254.449801 244.3.210.254 -> 41.177.244.117 TCP 88 19813 > 52544 [PSH, ACK] Seq=15716 Ack=4988 Win=65535 Len=18 TSval=2134604522 TSecr=1697479688
785206 254.450090 244.3.210.254 -> 41.177.244.117 TCP 98 19813 > 52544 [PSH, ACK] Seq=15734 Ack=4988 Win=65535 Len=28 TSval=2134604522 TSecr=1697479688
785221 254.452503 244.3.210.254 -> 41.177.244.117 TCP 88 19813 > 52544 [PSH, ACK] Seq=15762 Ack=5118 Win=65535 Len=18 TSval=2134604522 TSecr=1697479688
785222 254.452859 244.3.210.254 -> 41.177.244.117 TCP 98 19813 > 52544 [PSH, ACK] Seq=15780 Ack=5118 Win=65535 Len=28 TSval=2134604522 TSecr=1697479688
785246 254.459845 244.3.210.254 -> 41.177.244.117 TCP 88 19813 > 52544 [PSH, ACK] Seq=15808 Ack=5248 Win=65535 Len=18 TSval=2134604522 TSecr=1697479688
785248 254.460480 244.3.210.254 -> 41.177.244.117 TCP 98 19813 > 52544 [PSH, ACK] Seq=15826 Ack=5248 Win=65535 Len=28 TSval=2134604522 TSecr=1697479688
785253 254.461463 244.3.210.254 -> 41.177.244.117 TCP 176 19813 > 52544 [PSH, ACK] Seq=15854 Ack=5288 Win=65535 Len=106 TSval=2134604522 TSecr=1697479688
785271 254.472087 244.3.210.254 -> 41.177.244.117 TCP 266 19813 > 52544 [PSH, ACK] Seq=15960 Ack=5324 Win=65535 Len=196 TSval=2134604522 TSecr=1697479688
785294 254.485034 244.3.210.254 -> 41.177.244.117 TCP 88 19813 > 52544 [PSH, ACK] Seq=16156 Ack=5454 Win=65535 Len=18 TSval=2134604522 TSecr=1697479688
785295 254.485322 244.3.210.254 -> 41.177.244.117 TCP 98 19813 > 52544 [PSH, ACK] Seq=16174 Ack=5454 Win=65535 Len=28 TSval=2134604522 TSecr=1697479688
785297 254.486301 244.3.210.254 -> 41.177.244.117 TCP 108 19813 > 52544 [PSH, ACK] Seq=16202 Ack=5494 Win=65535 Len=38 TSval=2134604522 TSecr=1697479688
785312 254.498344 244.3.210.254 -> 41.177.244.117 TCP 236 19813 > 52544 [PSH, ACK] Seq=16240 Ack=5530 Win=65535 Len=166 TSval=2134604522 TSecr=1697479688
785395 254.530622 244.3.210.254 -> 41.177.244.117 TCP 88 19813 > 52544 [PSH, ACK] Seq=16406 Ack=5660 Win=65535 Len=18 TSval=2134604522 TSecr=1697479688
785400 254.532215 244.3.210.254 -> 41.177.244.117 TCP 98 19813 > 52544 [PSH, ACK] Seq=16424 Ack=5660 Win=65535 Len=28 TSval=2134604522 TSecr=1697479688
785404 254.533171 244.3.210.254 -> 41.177.244.117 TCP 264 19813 > 52544 [PSH, ACK] Seq=16452 Ack=5700 Win=65535 Len=194 TSval=2134604522 TSecr=1697479688
785426 254.541518 244.3.210.254 -> 41.177.244.117 TCP 234 19813 > 52544 [PSH, ACK] Seq=16646 Ack=5736 Win=65535 Len=164 TSval=2134604522 TSecr=1697479688
785430 254.544351 244.3.210.254 -> 41.177.244.117 TCP 88 19813 > 52544 [PSH, ACK] Seq=16810 Ack=5866 Win=65535 Len=18 TSval=2134604522 TSecr=1697479688
785432 254.544668 244.3.210.254 -> 41.177.244.117 TCP 98 19813 > 52544 [PSH, ACK] Seq=16828 Ack=5866 Win=65535 Len=28 TSval=2134604522 TSecr=1697479688
785447 254.545631 244.3.210.254 -> 41.177.244.117 TCP 112 19813 > 52544 [PSH, ACK] Seq=16856 Ack=5906 Win=65535 Len=42 TSval=2134604522 TSecr=1697479688
785482 254.559768 244.3.210.254 -> 41.177.244.117 TCP 276 19813 > 52544 [PSH, ACK] Seq=16898 Ack=5942 Win=65535 Len=206 TSval=2134604523 TSecr=1697479688
785486 254.562241 244.3.210.254 -> 41.177.244.117 TCP 88 19813 > 52544 [PSH, ACK] Seq=17104 Ack=6072 Win=65535 Len=18 TSval=2134604523 TSecr=1697479688
785489 254.562537 244.3.210.254 -> 41.177.244.117 TCP 98 19813 > 52544 [PSH, ACK] Seq=17122 Ack=6072 Win=65535 Len=28 TSval=2134604523 TSecr=1697479688
785496 254.564448 244.3.210.254 -> 41.177.244.117 TCP 88 19813 > 52544 [PSH, ACK] Seq=17150 Ack=6202 Win=65535 Len=18 TSval=2134604523 TSecr=1697479688
785497 254.564647 244.3.210.254 -> 41.177.244.117 TCP 98 19813 > 52544 [PSH, ACK] Seq=17168 Ack=6202 Win=65535 Len=28 TSval=2134604523 TSecr=1697479688
785500 254.565534 244.3.210.254 -> 41.177.244.117 TCP 104 19813 > 52544 [PSH, ACK] Seq=17196 Ack=6242 Win=65535 Len=34 TSval=2134604523 TSecr=1697479688
785514 254.573677 244.3.210.254 -> 41.177.244.117 TCP 244 19813 > 52544 [PSH, ACK] Seq=17230 Ack=6278 Win=65535 Len=174 TSval=2134604523 TSecr=1697479688
785518 254.575332 244.3.210.254 -> 41.177.244.117 TCP 265 19813 > 52544 [PSH, ACK] Seq=17404 Ack=6352 Win=65535 Len=195 TSval=2134604523 TSecr=1697479688
785522 254.576355 244.3.210.254 -> 41.177.244.117 TCP 1084 19813 > 52544 [PSH, ACK] Seq=17599 Ack=6384 Win=65535 Len=1014 TSval=2134604523 TSecr=1697479688
785524 254.577393 244.3.210.254 -> 41.177.244.117 TCP 88 19813 > 52544 [PSH, ACK] Seq=18613 Ack=6420 Win=65535 Len=18 TSval=2134604523 TSecr=1697479688
785532 254.583445 244.3.210.254 -> 41.177.244.117 TCP 88 19813 > 52544 [PSH, ACK] Seq=18631 Ack=6550 Win=65535 Len=18 TSval=2134604523 TSecr=1697479688
785533 254.583791 244.3.210.254 -> 41.177.244.117 TCP 98 19813 > 52544 [PSH, ACK] Seq=18649 Ack=6550 Win=65535 Len=28 TSval=2134604523 TSecr=1697479688
785535 254.584723 244.3.210.254 -> 41.177.244.117 TCP 108 19813 > 52544 [PSH, ACK] Seq=18677 Ack=6590 Win=65535 Len=38 TSval=2134604523 TSecr=1697479688
785539 254.585600 244.3.210.254 -> 41.177.244.117 TCP 88 19813 > 52544 [PSH, ACK] Seq=18715 Ack=6626 Win=65535 Len=18 TSval=2134604523 TSecr=1697479688
785541 254.586428 244.3.210.254 -> 41.177.244.117 TCP 236 19813 > 52544 [PSH, ACK] Seq=18733 Ack=6662 Win=65535 Len=166 TSval=2134604523 TSecr=1697479688
786208 255.090207 244.3.210.254 -> 41.177.244.224 TCP 82 19813 > 63522 [PSH, ACK] Seq=37 Ack=37 Win=65535 Len=12 TSval=2134604524 TSecr=1335776602
793413 258.403779 244.3.210.254 -> 41.177.244.128 TCP 64 19813 > murx [ACK] Seq=37 Ack=49 Win=65535 Len=0
799361 260.823116 244.3.210.254 -> 41.177.244.142 TCP 70 19813 > 4944 [PSH, ACK] Seq=37 Ack=37 Win=65535 Len=12
813864 265.439460 244.3.210.254 -> 41.177.244.220 TCP 70 19813 > dialpad-voice1 [PSH, ACK] Seq=37 Ack=37 Win=65535 Len=12
829116 270.604058 244.3.210.254 -> 41.177.244.77 TCP 64 19813 > m2ua [ACK] Seq=37 Ack=49 Win=65535 Len=0
829315 270.691806 244.3.210.254 -> 41.177.244.185 UDP 112 Source port: 3283  Destination port: 3283
836609 274.004160 244.3.210.254 -> 41.177.244.38 TCP 64 19813 > xnds [ACK] Seq=37 Ack=49 Win=65535 Len=0
841257 276.004218 244.3.210.254 -> 41.177.244.142 TCP 70 52502 > afpovertcp [ACK] Seq=145 Ack=145 Win=65535 Len=0 TSval=2134604565 TSecr=3472904465
843202 277.122013 244.3.210.254 -> 41.177.244.124 TCP 82 19813 > 55919 [PSH, ACK] Seq=37 Ack=37 Win=65535 Len=12 TSval=2134604568 TSecr=130610977
847911 280.105105 244.3.210.254 -> 41.177.244.177 TCP 82 19813 > 63123 [PSH, ACK] Seq=37 Ack=37 Win=65535 Len=12 TSval=2134604574 TSecr=763086799
853262 282.004371 244.3.210.254 -> 41.177.244.90 TCP 64 19813 > ati-ip-to-ncpe [ACK] Seq=49 Ack=49 Win=65535 Len=0
854892 282.588260 244.3.210.254 -> 244.3.77.218 TCP 70 19813 > kazaa [PSH, ACK] Seq=37 Ack=49 Win=65535 Len=12
855491 282.771977 244.3.210.254 -> 244.3.3.185  TCP 70 19813 > 3Com-nsd [PSH, ACK] Seq=25820 Ack=12360 Win=65535 Len=12
856304 283.004431 244.3.210.254 -> 244.3.106.254 TCP 64 19813 > 4227 [ACK] Seq=49 Ack=49 Win=65535 Len=0
874578 289.487805 244.3.210.254 -> 41.177.244.177 TCP 82 19813 > 54781 [PSH, ACK] Seq=37 Ack=49 Win=65535 Len=12 TSval=2134604592 TSecr=763086893
878782 292.004731 244.3.210.254 -> 41.177.244.188 TCP 70 19813 > 52599 [ACK] Seq=49 Ack=49 Win=65535 Len=0 TSval=2134604597 TSecr=1028052100
889163 294.587483 244.3.210.254 -> 41.177.244.117 TCP 82 19813 > 52544 [PSH, ACK] Seq=18899 Ack=6662 Win=65535 Len=12 TSval=2134604603 TSecr=1697479688
891984 295.204837 244.3.210.254 -> 41.177.244.224 TCP 70 19813 > 63522 [ACK] Seq=49 Ack=49 Win=65535 Len=0 TSval=2134604604 TSecr=1335776762
904608 298.256014 244.3.210.254 -> 41.177.244.128 TCP 70 19813 > murx [PSH, ACK] Seq=37 Ack=49 Win=65535 Len=12
910032 300.689722 244.3.210.254 -> 41.177.244.185 UDP 112 Source port: 3283  Destination port: 3283
910486 301.005031 244.3.210.254 -> 41.177.244.142 TCP 64 19813 > 4944 [ACK] Seq=49 Ack=49 Win=65535 Len=0
916032 304.005108 244.3.210.254 -> 41.177.244.142 TCP 70 52502 > afpovertcp [ACK] Seq=161 Ack=163 Win=65535 Len=0 TSval=2134604621 TSecr=3472904521
921249 305.605163 244.3.210.254 -> 41.177.244.220 TCP 64 19813 > dialpad-voice1 [ACK] Seq=49 Ack=49 Win=65535 Len=0
931951 310.469188 244.3.210.254 -> 41.177.244.77 TCP 70 19813 > m2ua [PSH, ACK] Seq=37 Ack=49 Win=65535 Len=12
944958 313.819449 244.3.210.254 -> 41.177.244.38 TCP 70 19813 > xnds [PSH, ACK] Seq=37 Ack=49 Win=65535 Len=12
956172 317.205505 244.3.210.254 -> 41.177.244.124 TCP 70 19813 > 55919 [ACK] Seq=49 Ack=49 Win=65535 Len=0 TSval=2134604648 TSecr=130611777
963192 320.405613 244.3.210.254 -> 41.177.244.177 TCP 70 19813 > 63123 [ACK] Seq=49 Ack=49 Win=65535 Len=0 TSval=2134604654 TSecr=763087600
966904 321.968847 244.3.210.254 -> 41.177.244.90 TCP 70 19813 > ati-ip-to-ncpe [PSH, ACK] Seq=49 Ack=49 Win=65535 Len=12
969232 322.805686 244.3.210.254 -> 244.3.77.218 TCP 64 19813 > kazaa [ACK] Seq=49 Ack=61 Win=65535 Len=0
969267 322.818769 244.3.210.254 -> 244.3.106.254 TCP 70 19813 > 4227 [PSH, ACK] Seq=49 Ack=49 Win=65535 Len=12
969671 323.005721 244.3.210.254 -> 244.3.3.185  TCP 64 19813 > 3Com-nsd [ACK] Seq=25832 Ack=12372 Win=65535 Len=0
988183 329.605899 244.3.210.254 -> 41.177.244.177 TCP 70 19813 > 54781 [ACK] Seq=49 Ack=61 Win=65535 Len=0 TSval=2134604673 TSecr=763087693
991435 330.687712 244.3.210.254 -> 41.177.244.185 UDP 112 Source port: 3283  Destination port: 3283
994868 331.968164 244.3.210.254 -> 41.177.244.188 TCP 82 19813 > 52599 [PSH, ACK] Seq=49 Ack=49 Win=65535 Len=12 TSval=2134604677 TSecr=1028052100
1000596 334.806055 244.3.210.254 -> 41.177.244.117 TCP 70 19813 > 52544 [ACK] Seq=18911 Ack=6674 Win=65535 Len=0 TSval=2134604683 TSecr=1697479848
1001068 335.117946 244.3.210.254 -> 41.177.244.224 TCP 82 19813 > 63522 [PSH, ACK] Seq=49 Ack=49 Win=65535 Len=12 TSval=2134604684 TSecr=1335776762
1009445 338.406142 244.3.210.254 -> 41.177.244.128 TCP 64 19813 > murx [ACK] Seq=49 Ack=61 Win=65535 Len=0
1012340 340.006182 244.3.210.254 -> 41.177.244.142 TCP 70 52502 > afpovertcp [ACK] Seq=193 Ack=179 Win=65535 Len=0 TSval=2134604693 TSecr=3472904593
1014061 340.917546 244.3.210.254 -> 41.177.244.142 TCP 70 19813 > 4944 [PSH, ACK] Seq=49 Ack=49 Win=65535 Len=12
