28102  11.269647 244.3.153.48 -> 244.3.176.224 TCP 64 fujitsu-dtc > microsoft-ds [ACK] Seq=54 Ack=54 Win=64503 Len=0
28104  11.269951 244.3.153.48 -> 41.177.3.117 TCP 64 vpvc > microsoft-ds [ACK] Seq=54 Ack=54 Win=64827 Len=0
29450  12.074483 244.3.153.48 -> 41.177.24.241 TCP 64 mc-client > imaps [ACK] Seq=161 Ack=327 Win=65209 Len=0
33497  14.201412 244.3.153.48 -> 41.177.24.241 TCP 132 dossier > xmpp-client [PSH, ACK] Seq=1 Ack=1 Win=48838 Len=74[Packet size limited during capture]
72761  29.739294 244.3.153.48 -> 244.3.160.80 TCP 64 nmsp > https [FIN, ACK] Seq=914 Ack=1 Win=64818 Len=0
72798  29.748594 244.3.153.48 -> 244.3.160.80 TCP 66 rsc-robot > https [SYN] Seq=0 Win=65535 Len=0 MSS=1150 SACK_PERM=1
72811  29.751948 244.3.153.48 -> 244.3.160.80 TCP 64 rsc-robot > https [ACK] Seq=1 Ack=1 Win=65535 Len=0
73577  29.978741 244.3.153.48 -> 244.3.160.80 TCP 64 rsc-robot > https [ACK] Seq=2025 Ack=2338 Win=64841 Len=0
89054  34.386451 244.3.153.48 -> 41.177.3.224 TCP 159 hello > nmsp [PSH, ACK] Seq=1 Ack=1 Win=65535 Len=101
89128  34.402362 244.3.153.48 -> 41.177.3.224 TCP 64 hello > nmsp [ACK] Seq=102 Ack=1731 Win=65535 Len=0
116648  41.646313 244.3.153.48 -> 244.3.176.224 TCP 64 fujitsu-dtc > microsoft-ds [ACK] Seq=107 Ack=107 Win=64450 Len=0
116650  41.646609 244.3.153.48 -> 41.177.3.117 TCP 64 vpvc > microsoft-ds [ACK] Seq=107 Ack=107 Win=64774 Len=0
126540  44.932734 244.3.153.48 -> 244.3.160.80 TCP 64 rsc-robot > https [ACK] Seq=2025 Ack=2362 Win=64818 Len=0
200782  69.206187 244.3.153.48 -> 41.177.24.241 TCP 132 dossier > xmpp-client [PSH, ACK] Seq=75 Ack=1 Win=48838 Len=74[Packet size limited during capture]
209146  72.023797 244.3.153.48 -> 244.3.176.224 TCP 64 fujitsu-dtc > microsoft-ds [ACK] Seq=160 Ack=160 Win=64397 Len=0
209148  72.024041 244.3.153.48 -> 41.177.3.117 TCP 64 vpvc > microsoft-ds [ACK] Seq=160 Ack=160 Win=64721 Len=0
219664  75.134917 244.3.153.48 -> 41.177.3.224 TCP 210 hello > nmsp [PSH, ACK] Seq=102 Ack=1731 Win=65535 Len=152
220171  75.342867 244.3.153.48 -> 41.177.3.224 TCP 64 hello > nmsp [ACK] Seq=254 Ack=1918 Win=65348 Len=0
293487  98.573945 244.3.153.48 -> 41.177.3.224 TCP 195 hello > nmsp [PSH, ACK] Seq=254 Ack=1918 Win=65348 Len=137
293772  98.779543 244.3.153.48 -> 41.177.3.224 TCP 64 hello > nmsp [ACK] Seq=391 Ack=2099 Win=65167 Len=0
303154 102.501950 244.3.153.48 -> 244.3.176.224 TCP 64 fujitsu-dtc > microsoft-ds [ACK] Seq=213 Ack=213 Win=65535 Len=0
303158 102.502262 244.3.153.48 -> 41.177.3.117 TCP 64 vpvc > microsoft-ds [ACK] Seq=213 Ack=213 Win=64668 Len=0
354256 120.549853 244.3.153.48 -> 41.177.117.203 TCP 195 dpkeyserv > netrisk [PSH, ACK] Seq=1 Ack=1 Win=64653 Len=137
354300 120.570633 244.3.153.48 -> 41.177.117.203 TCP 307 dpkeyserv > netrisk [PSH, ACK] Seq=138 Ack=197 Win=64457 Len=249
354305 120.573786 244.3.153.48 -> 41.177.117.203 TCP 206 dpkeyserv > netrisk [PSH, ACK] Seq=387 Ack=501 Win=65535 Len=148
354385 120.630831 244.3.153.48 -> 41.177.117.203 TCP 342 dpkeyserv > netrisk [PSH, ACK] Seq=535 Ack=585 Win=65451 Len=284
354389 120.633748 244.3.153.48 -> 41.177.117.203 TCP 206 dpkeyserv > netrisk [PSH, ACK] Seq=819 Ack=889 Win=65147 Len=148
354686 120.764122 244.3.153.48 -> 41.177.117.203 TCP 307 dpkeyserv > netrisk [PSH, ACK] Seq=967 Ack=973 Win=65063 Len=249
354698 120.767558 244.3.153.48 -> 41.177.117.203 TCP 206 dpkeyserv > netrisk [PSH, ACK] Seq=1216 Ack=1277 Win=64759 Len=148
354852 120.909345 244.3.153.48 -> 41.177.117.203 TCP 64 dpkeyserv > netrisk [ACK] Seq=1364 Ack=1361 Win=64675 Len=0
359268 122.634020 244.3.153.48 -> 41.177.117.203 TCP 195 dpkeyserv > netrisk [PSH, ACK] Seq=1364 Ack=1361 Win=64675 Len=137
359284 122.640936 244.3.153.48 -> 41.177.117.203 TCP 195 dpkeyserv > netrisk [PSH, ACK] Seq=1501 Ack=1557 Win=64479 Len=137
359734 122.819986 244.3.153.48 -> 41.177.117.203 TCP 64 dpkeyserv > netrisk [ACK] Seq=1638 Ack=1753 Win=65535 Len=0
364230 124.026904 244.3.153.48 -> 41.177.117.203 TCP 196 dpkeyserv > netrisk [PSH, ACK] Seq=1638 Ack=1753 Win=65535 Len=138
364242 124.030729 244.3.153.48 -> 41.177.117.203 TCP 64 dpkeyserv > netrisk [ACK] Seq=1776 Ack=3216 Win=65535 Len=0
364246 124.034627 244.3.153.48 -> 41.177.117.203 TCP 322 dpkeyserv > netrisk [PSH, ACK] Seq=1776 Ack=3216 Win=65535 Len=264
364451 124.101706 244.3.153.48 -> 41.177.117.203 TCP 679 dpkeyserv > netrisk [PSH, ACK] Seq=2040 Ack=3520 Win=65231 Len=621
364463 124.109416 244.3.153.48 -> 41.177.117.203 TCP 206 dpkeyserv > netrisk [PSH, ACK] Seq=2661 Ack=4411 Win=65535 Len=148
364470 124.112011 244.3.153.48 -> 41.177.117.203 TCP 137 dpkeyserv > netrisk [PSH, ACK] Seq=2809 Ack=4552 Win=65394 Len=79
364476 124.116985 244.3.153.48 -> 41.177.117.203 TCP 322 dpkeyserv > netrisk [PSH, ACK] Seq=2888 Ack=4626 Win=65320 Len=264
364552 124.146031 244.3.153.48 -> 41.177.117.203 TCP 307 dpkeyserv > netrisk [PSH, ACK] Seq=3152 Ack=5448 Win=64498 Len=249
364561 124.148908 244.3.153.48 -> 41.177.117.203 TCP 206 dpkeyserv > netrisk [PSH, ACK] Seq=3401 Ack=5752 Win=65535 Len=148
364641 124.174716 244.3.153.48 -> 41.177.117.203 TCP 344 dpkeyserv > netrisk [PSH, ACK] Seq=3549 Ack=5836 Win=65451 Len=286
364656 124.179346 244.3.153.48 -> 41.177.117.203 TCP 206 dpkeyserv > netrisk [PSH, ACK] Seq=3835 Ack=6141 Win=65146 Len=148
364693 124.209278 244.3.153.48 -> 41.177.117.203 TCP 307 dpkeyserv > netrisk [PSH, ACK] Seq=3983 Ack=6225 Win=65062 Len=249
364710 124.211287 244.3.153.48 -> 41.177.24.241 TCP 132 dossier > xmpp-client [PSH, ACK] Seq=149 Ack=1 Win=48838 Len=74[Packet size limited during capture]
364712 124.212027 244.3.153.48 -> 41.177.117.203 TCP 206 dpkeyserv > netrisk [PSH, ACK] Seq=4232 Ack=6529 Win=64758 Len=148
364953 124.328483 244.3.153.48 -> 41.177.117.203 TCP 64 dpkeyserv > netrisk [ACK] Seq=4380 Ack=6613 Win=64674 Len=0
396285 132.878749 244.3.153.48 -> 244.3.176.224 TCP 64 fujitsu-dtc > microsoft-ds [ACK] Seq=266 Ack=266 Win=65482 Len=0
396287 132.879200 244.3.153.48 -> 41.177.3.117 TCP 64 vpvc > microsoft-ds [ACK] Seq=266 Ack=266 Win=64615 Len=0
413969 138.291055 244.3.153.48 -> 41.177.3.241 TCP 66 cera-bcm > x11 [SYN] Seq=0 Win=65535 Len=0 MSS=1150 SACK_PERM=1
413975 138.293559 244.3.153.48 -> 41.177.3.241 TCP 64 cera-bcm > x11 [ACK] Seq=1 Ack=1 Win=65535 Len=0
414966 138.514328 244.3.153.48 -> 41.177.3.241 TCP 64 cera-bcm > x11 [ACK] Seq=1050 Ack=287 Win=65249 Len=0
414982 138.515598 244.3.153.48 -> 41.177.3.241 TCP 64 cera-bcm > x11 [ACK] Seq=1050 Ack=1631 Win=65535 Len=0
415028 138.520029 244.3.153.48 -> 41.177.3.241 TCP 64 cera-bcm > x11 [ACK] Seq=1050 Ack=3931 Win=65535 Len=0
415076 138.525103 244.3.153.48 -> 41.177.3.241 TCP 64 cera-bcm > x11 [ACK] Seq=1050 Ack=6231 Win=65535 Len=0
415083 138.525872 244.3.153.48 -> 41.177.3.241 TCP 64 cera-bcm > x11 [ACK] Seq=1050 Ack=8531 Win=65535 Len=0
415099 138.531335 244.3.153.48 -> 41.177.3.241 TCP 64 cera-bcm > x11 [ACK] Seq=1050 Ack=10831 Win=65535 Len=0
415112 138.534646 244.3.153.48 -> 41.177.3.241 TCP 64 cera-bcm > x11 [ACK] Seq=1050 Ack=13131 Win=65535 Len=0
415130 138.535657 244.3.153.48 -> 41.177.3.241 TCP 64 cera-bcm > x11 [ACK] Seq=1050 Ack=14408 Win=65535 Len=0
425915 139.771910 244.3.153.48 -> 41.177.3.241 TCP 64 cera-bcm > x11 [ACK] Seq=1605 Ack=15765 Win=65535 Len=0
425929 139.773679 244.3.153.48 -> 41.177.3.241 TCP 64 cera-bcm > x11 [ACK] Seq=1605 Ack=18065 Win=65535 Len=0
425963 139.776643 244.3.153.48 -> 41.177.3.241 TCP 64 cera-bcm > x11 [ACK] Seq=1605 Ack=19837 Win=65535 Len=0
425981 139.782207 244.3.153.48 -> 41.177.3.241 TCP 64 cera-bcm > x11 [ACK] Seq=1605 Ack=22137 Win=65535 Len=0
425984 139.782520 244.3.153.48 -> 41.177.3.241 TCP 64 cera-bcm > x11 [ACK] Seq=1605 Ack=23909 Win=65535 Len=0
425990 139.783058 244.3.153.48 -> 41.177.3.241 TCP 64 cera-bcm > x11 [ACK] Seq=1605 Ack=26209 Win=65535 Len=0
425998 139.783554 244.3.153.48 -> 41.177.3.241 TCP 64 cera-bcm > x11 [ACK] Seq=1605 Ack=27981 Win=65535 Len=0
426000 139.783715 244.3.153.48 -> 41.177.3.241 TCP 64 cera-bcm > x11 [ACK] Seq=1605 Ack=30281 Win=65535 Len=0
426009 139.784558 244.3.153.48 -> 41.177.3.241 TCP 64 cera-bcm > x11 [ACK] Seq=1605 Ack=32053 Win=65535 Len=0
426027 139.785491 244.3.153.48 -> 41.177.3.241 TCP 64 cera-bcm > x11 [ACK] Seq=1605 Ack=34353 Win=65535 Len=0
426065 139.794562 244.3.153.48 -> 41.177.3.241 TCP 64 cera-bcm > x11 [ACK] Seq=1605 Ack=36125 Win=65535 Len=0
426077 139.794929 244.3.153.48 -> 41.177.3.241 TCP 64 cera-bcm > x11 [ACK] Seq=1605 Ack=38425 Win=65535 Len=0
426105 139.795306 244.3.153.48 -> 41.177.3.241 TCP 64 cera-bcm > x11 [ACK] Seq=1605 Ack=40197 Win=65535 Len=0
426120 139.795754 244.3.153.48 -> 41.177.3.241 TCP 64 cera-bcm > x11 [ACK] Seq=1605 Ack=42497 Win=65535 Len=0
426125 139.796006 244.3.153.48 -> 41.177.3.241 TCP 64 cera-bcm > x11 [ACK] Seq=1605 Ack=44269 Win=65535 Len=0
426133 139.796463 244.3.153.48 -> 41.177.3.241 TCP 64 cera-bcm > x11 [ACK] Seq=1605 Ack=46569 Win=65535 Len=0
426177 139.802351 244.3.153.48 -> 41.177.3.241 TCP 64 cera-bcm > x11 [FIN, ACK] Seq=1605 Ack=47191 Win=64913 Len=0
426187 139.803291 244.3.153.48 -> 41.177.3.241 TCP 64 cera-bcm > x11 [RST, ACK] Seq=1606 Ack=48341 Win=0 Len=0
426220 139.809089 244.3.153.48 -> 41.177.3.241 TCP 66 dpi-proxy > x11 [SYN] Seq=0 Win=65535 Len=0 MSS=1150 SACK_PERM=1
426268 139.813700 244.3.153.48 -> 41.177.3.241 TCP 64 dpi-proxy > x11 [ACK] Seq=1 Ack=1 Win=65535 Len=0
426424 139.851256 244.3.153.48 -> 41.177.3.241 TCP 64 dpi-proxy > x11 [ACK] Seq=603 Ack=702 Win=64834 Len=0
426476 139.864876 244.3.153.48 -> 41.177.3.241 TCP 64 dpi-proxy > x11 [ACK] Seq=1143 Ack=2033 Win=65535 Len=0
426511 139.867937 244.3.153.48 -> 41.177.3.241 TCP 64 dpi-proxy > x11 [ACK] Seq=1143 Ack=4333 Win=65535 Len=0
426515 139.869437 244.3.153.48 -> 41.177.3.241 TCP 64 dpi-proxy > x11 [ACK] Seq=1143 Ack=5749 Win=65535 Len=0
426739 139.911410 244.3.153.48 -> 41.177.3.241 TCP 64 dpi-proxy > x11 [ACK] Seq=1772 Ack=6435 Win=64849 Len=0
427089 139.979953 244.3.153.48 -> 41.177.3.241 TCP 66 vocaltec-admin > x11 [SYN] Seq=0 Win=65535 Len=0 MSS=1150 SACK_PERM=1
427097 139.982701 244.3.153.48 -> 41.177.3.241 TCP 64 vocaltec-admin > x11 [ACK] Seq=1 Ack=1 Win=65535 Len=0
427122 139.988396 244.3.153.48 -> 41.177.3.241 TCP 64 vocaltec-admin > x11 [ACK] Seq=662 Ack=1416 Win=65535 Len=0
427136 139.992290 244.3.153.48 -> 41.177.3.241 TCP 64 vocaltec-admin > x11 [ACK] Seq=662 Ack=3716 Win=65535 Len=0
427158 139.995645 244.3.153.48 -> 41.177.3.241 TCP 64 vocaltec-admin > x11 [ACK] Seq=662 Ack=6016 Win=65535 Len=0
427177 139.997088 244.3.153.48 -> 41.177.3.241 TCP 64 vocaltec-admin > x11 [ACK] Seq=662 Ack=8316 Win=65535 Len=0
427187 139.999606 244.3.153.48 -> 41.177.3.241 TCP 64 vocaltec-admin > x11 [ACK] Seq=662 Ack=10616 Win=65535 Len=0
427214 140.002735 244.3.153.48 -> 41.177.3.241 TCP 64 vocaltec-admin > x11 [ACK] Seq=662 Ack=12916 Win=65535 Len=0
427230 140.004261 244.3.153.48 -> 41.177.3.241 TCP 64 vocaltec-admin > x11 [ACK] Seq=662 Ack=15216 Win=65535 Len=0
427271 140.007429 244.3.153.48 -> 41.177.3.241 TCP 64 dpi-proxy > x11 [ACK] Seq=2955 Ack=7912 Win=65535 Len=0
427282 140.008645 244.3.153.48 -> 41.177.3.241 TCP 64 dpi-proxy > x11 [ACK] Seq=2955 Ack=10212 Win=65535 Len=0
427293 140.012709 244.3.153.48 -> 41.177.3.241 TCP 64 vocaltec-admin > x11 [ACK] Seq=662 Ack=17516 Win=65535 Len=0
427302 140.013460 244.3.153.48 -> 41.177.3.241 TCP 64 dpi-proxy > x11 [ACK] Seq=2955 Ack=11984 Win=65535 Len=0
427308 140.013813 244.3.153.48 -> 41.177.3.241 TCP 64 dpi-proxy > x11 [ACK] Seq=2955 Ack=14284 Win=65535 Len=0
427318 140.014091 244.3.153.48 -> 41.177.3.241 TCP 64 vocaltec-admin > x11 [ACK] Seq=662 Ack=19816 Win=65535 Len=0
427352 140.016650 244.3.153.48 -> 41.177.3.241 TCP 64 vocaltec-admin > x11 [ACK] Seq=662 Ack=22116 Win=65535 Len=0
427361 140.017431 244.3.153.48 -> 41.177.3.241 TCP 64 vocaltec-admin > x11 [ACK] Seq=662 Ack=24416 Win=65535 Len=0
427403 140.021772 244.3.153.48 -> 41.177.3.241 TCP 64 dpi-proxy > x11 [ACK] Seq=2955 Ack=16056 Win=65535 Len=0
427414 140.023175 244.3.153.48 -> 41.177.3.241 TCP 64 dpi-proxy > x11 [ACK] Seq=2955 Ack=18356 Win=65535 Len=0
427432 140.026221 244.3.153.48 -> 41.177.3.241 TCP 64 dpi-proxy > x11 [ACK] Seq=2955 Ack=20656 Win=65535 Len=0
427443 140.027459 244.3.153.48 -> 41.177.3.241 TCP 64 vocaltec-admin > x11 [ACK] Seq=662 Ack=26716 Win=65535 Len=0
427446 140.027744 244.3.153.48 -> 41.177.3.241 TCP 64 vocaltec-admin > x11 [ACK] Seq=662 Ack=28826 Win=65535 Len=0
427452 140.028138 244.3.153.48 -> 41.177.3.241 TCP 64 dpi-proxy > x11 [ACK] Seq=2955 Ack=22956 Win=65535 Len=0
427457 140.028364 244.3.153.48 -> 41.177.3.241 TCP 64 dpi-proxy > x11 [ACK] Seq=2955 Ack=25256 Win=65535 Len=0
427462 140.028697 244.3.153.48 -> 41.177.3.241 TCP 64 dpi-proxy > x11 [ACK] Seq=2955 Ack=27122 Win=65535 Len=0
427469 140.029703 244.3.153.48 -> 41.177.3.241 TCP 64 vocaltec-admin > x11 [ACK] Seq=662 Ack=31126 Win=65535 Len=0
427472 140.030233 244.3.153.48 -> 41.177.3.241 TCP 64 vocaltec-admin > x11 [ACK] Seq=662 Ack=32906 Win=65535 Len=0
427475 140.030510 244.3.153.48 -> 41.177.3.241 TCP 64 vocaltec-admin > x11 [ACK] Seq=662 Ack=35206 Win=65535 Len=0
427477 140.030886 244.3.153.48 -> 41.177.3.241 TCP 64 vocaltec-admin > x11 [ACK] Seq=662 Ack=36986 Win=65535 Len=0
427481 140.031457 244.3.153.48 -> 41.177.3.241 TCP 64 dpi-proxy > x11 [ACK] Seq=2955 Ack=29422 Win=65535 Len=0
427496 140.032051 244.3.153.48 -> 41.177.3.241 TCP 64 dpi-proxy > x11 [ACK] Seq=2955 Ack=31194 Win=65535 Len=0
427538 140.037342 244.3.153.48 -> 41.177.3.241 TCP 64 vocaltec-admin > x11 [ACK] Seq=662 Ack=37446 Win=65075 Len=0
427540 140.041436 244.3.153.48 -> 41.177.3.241 TCP 64 dpi-proxy > x11 [ACK] Seq=2955 Ack=33494 Win=65535 Len=0
427542 140.041745 244.3.153.48 -> 41.177.3.241 TCP 64 dpi-proxy > x11 [ACK] Seq=2955 Ack=35266 Win=65535 Len=0
427544 140.042058 244.3.153.48 -> 41.177.3.241 TCP 64 dpi-proxy > x11 [ACK] Seq=2955 Ack=37566 Win=65535 Len=0
427558 140.042515 244.3.153.48 -> 41.177.3.241 TCP 64 dpi-proxy > x11 [ACK] Seq=2955 Ack=39338 Win=65535 Len=0
427565 140.042811 244.3.153.48 -> 41.177.3.241 TCP 64 dpi-proxy > x11 [ACK] Seq=2955 Ack=41638 Win=65535 Len=0
427585 140.043903 244.3.153.48 -> 41.177.3.241 TCP 64 dpi-proxy > x11 [ACK] Seq=2955 Ack=43410 Win=65535 Len=0
427612 140.048170 244.3.153.48 -> 41.177.3.241 TCP 64 dpi-proxy > x11 [ACK] Seq=2955 Ack=45710 Win=65535 Len=0
427615 140.048883 244.3.153.48 -> 41.177.3.241 TCP 64 dpi-proxy > x11 [ACK] Seq=2955 Ack=47482 Win=65535 Len=0
427625 140.051137 244.3.153.48 -> 41.177.3.241 TCP 64 dpi-proxy > x11 [ACK] Seq=2955 Ack=49782 Win=65535 Len=0
427628 140.052272 244.3.153.48 -> 41.177.3.241 TCP 64 dpi-proxy > x11 [ACK] Seq=2955 Ack=51554 Win=65535 Len=0
427631 140.052596 244.3.153.48 -> 41.177.3.241 TCP 64 dpi-proxy > x11 [ACK] Seq=2955 Ack=53854 Win=65535 Len=0
427652 140.054260 244.3.153.48 -> 41.177.3.241 TCP 64 dpi-proxy > x11 [ACK] Seq=2955 Ack=55626 Win=65535 Len=0
427716 140.070418 244.3.153.48 -> 41.177.3.241 TCP 64 dpi-proxy > x11 [ACK] Seq=2955 Ack=57926 Win=65535 Len=0
427723 140.070773 244.3.153.48 -> 41.177.3.241 TCP 64 dpi-proxy > x11 [ACK] Seq=2955 Ack=59698 Win=65535 Len=0
427725 140.071168 244.3.153.48 -> 41.177.3.241 TCP 64 dpi-proxy > x11 [ACK] Seq=2955 Ack=61998 Win=65535 Len=0
427731 140.071529 244.3.153.48 -> 41.177.3.241 TCP 64 dpi-proxy > x11 [ACK] Seq=2955 Ack=63770 Win=65535 Len=0
427735 140.071810 244.3.153.48 -> 41.177.3.241 TCP 64 dpi-proxy > x11 [ACK] Seq=2955 Ack=66070 Win=65535 Len=0
427743 140.072200 244.3.153.48 -> 41.177.3.241 TCP 64 dpi-proxy > x11 [ACK] Seq=2955 Ack=67842 Win=65535 Len=0
427757 140.072794 244.3.153.48 -> 41.177.3.241 TCP 64 dpi-proxy > x11 [ACK] Seq=2955 Ack=70142 Win=65535 Len=0
427764 140.073349 244.3.153.48 -> 41.177.3.241 TCP 64 dpi-proxy > x11 [ACK] Seq=2955 Ack=71914 Win=65535 Len=0
427776 140.075063 244.3.153.48 -> 41.177.3.241 TCP 64 dpi-proxy > x11 [ACK] Seq=2955 Ack=74214 Win=65535 Len=0
427797 140.079786 244.3.153.48 -> 41.177.3.241 TCP 64 dpi-proxy > x11 [ACK] Seq=2955 Ack=75986 Win=65535 Len=0
427849 140.087978 244.3.153.48 -> 41.177.3.241 TCP 64 dpi-proxy > x11 [ACK] Seq=2955 Ack=78286 Win=65535 Len=0
427851 140.088279 244.3.153.48 -> 41.177.3.241 TCP 64 dpi-proxy > x11 [ACK] Seq=2955 Ack=80058 Win=65535 Len=0
427854 140.088560 244.3.153.48 -> 41.177.3.241 TCP 64 dpi-proxy > x11 [ACK] Seq=2955 Ack=81490 Win=65535 Len=0
428001 140.114576 244.3.153.48 -> 41.177.3.241 TCP 64 vocaltec-admin > x11 [ACK] Seq=1205 Ack=38802 Win=65535 Len=0
428026 140.116139 244.3.153.48 -> 41.177.3.241 TCP 64 vocaltec-admin > x11 [ACK] Seq=1205 Ack=41102 Win=65535 Len=0
428031 140.116767 244.3.153.48 -> 41.177.3.241 TCP 64 vocaltec-admin > x11 [ACK] Seq=1205 Ack=42874 Win=65535 Len=0
428033 140.117235 244.3.153.48 -> 41.177.3.241 TCP 64 vocaltec-admin > x11 [ACK] Seq=1205 Ack=44543 Win=65535 Len=0
428950 140.348369 244.3.153.48 -> 41.177.3.241 TCP 64 dpi-proxy > x11 [ACK] Seq=3560 Ack=82846 Win=65535 Len=0
429216 140.400046 244.3.153.48 -> 41.177.3.241 TCP 64 vocaltec-admin > x11 [ACK] Seq=1748 Ack=45874 Win=65535 Len=0
429219 140.401851 244.3.153.48 -> 41.177.3.241 TCP 64 vocaltec-admin > x11 [ACK] Seq=1748 Ack=48174 Win=65535 Len=0
429221 140.402181 244.3.153.48 -> 41.177.3.241 TCP 64 vocaltec-admin > x11 [ACK] Seq=1748 Ack=49590 Win=65535 Len=0
429270 140.415412 244.3.153.48 -> 41.177.3.241 TCP 64 dpi-proxy > x11 [ACK] Seq=4106 Ack=84933 Win=65535 Len=0
429295 140.416984 244.3.153.48 -> 41.177.3.241 TCP 64 dpi-proxy > x11 [ACK] Seq=4106 Ack=86616 Win=65535 Len=0
429299 140.417711 244.3.153.48 -> 41.177.3.241 TCP 64 vocaltec-admin > x11 [ACK] Seq=2275 Ack=50921 Win=65535 Len=0
429303 140.422321 244.3.153.48 -> 41.177.3.241 TCP 64 vocaltec-admin > x11 [ACK] Seq=2275 Ack=53221 Win=65535 Len=0
429306 140.422588 244.3.153.48 -> 41.177.3.241 TCP 64 vocaltec-admin > x11 [ACK] Seq=2275 Ack=54993 Win=65535 Len=0
429308 140.423415 244.3.153.48 -> 41.177.3.241 TCP 64 vocaltec-admin > x11 [ACK] Seq=2275 Ack=56839 Win=65535 Len=0
430042 140.580188 244.3.153.48 -> 41.177.3.241 TCP 66 uma > x11 [SYN] Seq=0 Win=65535 Len=0 MSS=1150 SACK_PERM=1
430071 140.583292 244.3.153.48 -> 41.177.3.241 TCP 64 uma > x11 [ACK] Seq=1 Ack=1 Win=65535 Len=0
430091 140.585631 244.3.153.48 -> 41.177.3.241 TCP 64 dpi-proxy > x11 [ACK] Seq=4666 Ack=87632 Win=64519 Len=0
430104 140.585962 244.3.153.48 -> 41.177.3.241 TCP 64 vocaltec-admin > x11 [ACK] Seq=2831 Ack=58195 Win=65535 Len=0
430112 140.586289 244.3.153.48 -> 41.177.3.241 TCP 64 vocaltec-admin > x11 [ACK] Seq=2831 Ack=60495 Win=65535 Len=0
430144 140.589395 244.3.153.48 -> 41.177.3.241 TCP 64 uma > x11 [ACK] Seq=529 Ack=1332 Win=65535 Len=0
430182 140.593705 244.3.153.48 -> 41.177.3.241 TCP 64 uma > x11 [ACK] Seq=529 Ack=3632 Win=65535 Len=0
430193 140.596274 244.3.153.48 -> 41.177.3.241 TCP 64 uma > x11 [ACK] Seq=529 Ack=5520 Win=65535 Len=0
430241 140.608711 244.3.153.48 -> 41.177.3.241 TCP 64 dpi-proxy > x11 [ACK] Seq=5228 Ack=87935 Win=65535 Len=0
430243 140.609643 244.3.153.48 -> 41.177.3.241 TCP 64 vocaltec-admin > x11 [ACK] Seq=3393 Ack=60936 Win=65094 Len=0
494534 163.255122 244.3.153.48 -> 244.3.176.224 TCP 64 fujitsu-dtc > microsoft-ds [ACK] Seq=319 Ack=319 Win=65429 Len=0
494537 163.255343 244.3.153.48 -> 41.177.3.117 TCP 64 vpvc > microsoft-ds [ACK] Seq=319 Ack=319 Win=64562 Len=0
526358 171.091909 244.3.153.48 -> 41.177.3.241 TCP 64 dpi-proxy > x11 [ACK] Seq=5228 Ack=87936 Win=65535 Len=0
526360 171.093220 244.3.153.48 -> 41.177.3.241 TCP 64 vocaltec-admin > x11 [ACK] Seq=3393 Ack=60937 Win=65094 Len=0
526362 171.093571 244.3.153.48 -> 41.177.3.241 TCP 64 uma > x11 [ACK] Seq=529 Ack=5521 Win=65535 Len=0
556541 179.201578 244.3.153.48 -> 41.177.24.241 TCP 132 dossier > xmpp-client [PSH, ACK] Seq=223 Ack=1 Win=48838 Len=74[Packet size limited during capture]
582808 185.593889 244.3.153.48 -> 41.177.3.241 TCP 64 vocaltec-admin > x11 [FIN, ACK] Seq=3393 Ack=60937 Win=65094 Len=0
582812 185.594464 244.3.153.48 -> 41.177.3.241 TCP 64 dpi-proxy > x11 [FIN, ACK] Seq=5228 Ack=87936 Win=65535 Len=0
582816 185.594919 244.3.153.48 -> 41.177.3.241 TCP 64 uma > x11 [FIN, ACK] Seq=529 Ack=5521 Win=65535 Len=0
584394 186.225497 244.3.153.48 -> 41.177.143.210 TCP 66 etp > 7042 [SYN] Seq=0 Win=65535 Len=0 MSS=1150 SACK_PERM=1
584401 186.228650 244.3.153.48 -> 41.177.143.210 TCP 64 etp > 7042 [ACK] Seq=1 Ack=1 Win=65535 Len=0
584403 186.229721 244.3.153.48 -> 41.177.143.210 TCP 253 etp > 7042 [PSH, ACK] Seq=1 Ack=1 Win=65535 Len=195
584424 186.234211 244.3.153.48 -> 41.177.143.210 TCP 64 etp > 7042 [ACK] Seq=196 Ack=1705 Win=65535 Len=0
584426 186.235289 244.3.153.48 -> 41.177.143.210 TCP 240 etp > 7042 [PSH, ACK] Seq=196 Ack=1705 Win=65535 Len=182
584446 186.248764 244.3.153.48 -> 41.177.143.210 TCP 1208 etp > 7042 [ACK] Seq=378 Ack=1748 Win=65492 Len=1150
584448 186.249374 244.3.153.48 -> 41.177.143.210 TCP 1208 etp > 7042 [ACK] Seq=1528 Ack=1748 Win=65492 Len=1150
584450 186.249841 244.3.153.48 -> 41.177.143.210 TCP 150 etp > 7042 [PSH, ACK] Seq=2678 Ack=1748 Win=65492 Len=92
585133 186.435740 244.3.153.48 -> 41.177.143.210 TCP 64 etp > 7042 [ACK] Seq=2770 Ack=3952 Win=65535 Len=0
585185 186.441795 244.3.153.48 -> 41.177.143.210 TCP 64 etp > 7042 [ACK] Seq=2770 Ack=6252 Win=65535 Len=0
585190 186.442183 244.3.153.48 -> 41.177.143.210 TCP 64 etp > 7042 [ACK] Seq=2770 Ack=8552 Win=65535 Len=0
585198 186.445809 244.3.153.48 -> 41.177.143.210 TCP 64 etp > 7042 [ACK] Seq=2770 Ack=10852 Win=65535 Len=0
585658 186.590932 244.3.153.48 -> 41.177.143.210 TCP 64 etp > 7042 [ACK] Seq=2770 Ack=10860 Win=65527 Len=0
597419 189.219325 244.3.153.48 -> 41.177.143.210 TCP 1208 etp > 7042 [ACK] Seq=2770 Ack=10860 Win=65527 Len=1150
597423 189.220054 244.3.153.48 -> 41.177.143.210 TCP 712 etp > 7042 [PSH, ACK] Seq=3920 Ack=10860 Win=65527 Len=654
597690 189.325666 244.3.153.48 -> 41.177.143.210 TCP 64 etp > 7042 [ACK] Seq=4574 Ack=12756 Win=65535 Len=0
597716 189.327595 244.3.153.48 -> 41.177.143.210 TCP 64 etp > 7042 [ACK] Seq=4574 Ack=15056 Win=65535 Len=0
597733 189.328208 244.3.153.48 -> 41.177.143.210 TCP 64 etp > 7042 [ACK] Seq=4574 Ack=16849 Win=65535 Len=0
597755 189.331648 244.3.153.48 -> 41.177.143.210 TCP 64 etp > 7042 [ACK] Seq=4574 Ack=19149 Win=65535 Len=0
597757 189.332017 244.3.153.48 -> 41.177.143.210 TCP 64 etp > 7042 [ACK] Seq=4574 Ack=20942 Win=65535 Len=0
597759 189.332326 244.3.153.48 -> 41.177.143.210 TCP 64 etp > 7042 [ACK] Seq=4574 Ack=22387 Win=65535 Len=0
608982 193.403522 244.3.153.48 -> 41.177.143.210 TCP 1208 etp > 7042 [ACK] Seq=4574 Ack=22387 Win=65535 Len=1150
608993 193.405876 244.3.153.48 -> 41.177.143.210 TCP 598 etp > 7042 [PSH, ACK] Seq=5724 Ack=22387 Win=65535 Len=540
609059 193.447602 244.3.153.48 -> 41.177.143.210 TCP 64 etp > 7042 [ACK] Seq=6264 Ack=23806 Win=65535 Len=0
609095 193.453540 244.3.153.48 -> 41.177.143.210 TCP 1208 etp > 7042 [ACK] Seq=6264 Ack=23806 Win=65535 Len=1150
609098 193.454053 244.3.153.48 -> 41.177.143.210 TCP 1177 etp > 7042 [PSH, ACK] Seq=7414 Ack=23806 Win=65535 Len=1119
609099 193.454326 244.3.153.48 -> 41.177.143.210 TCP 66 netrisk > 7042 [SYN] Seq=0 Win=65535 Len=0 MSS=1150 SACK_PERM=1
609106 193.454735 244.3.153.48 -> 41.177.143.210 TCP 66 ansys-lm > 7042 [SYN] Seq=0 Win=65535 Len=0 MSS=1150 SACK_PERM=1
609162 193.458595 244.3.153.48 -> 41.177.143.210 TCP 64 netrisk > 7042 [ACK] Seq=1 Ack=1 Win=65535 Len=0
609166 193.459050 244.3.153.48 -> 41.177.143.210 TCP 253 netrisk > 7042 [PSH, ACK] Seq=1 Ack=1 Win=65535 Len=195
609169 193.459345 244.3.153.48 -> 41.177.143.210 TCP 64 ansys-lm > 7042 [ACK] Seq=1 Ack=1 Win=65535 Len=0
609171 193.459816 244.3.153.48 -> 41.177.143.210 TCP 253 ansys-lm > 7042 [PSH, ACK] Seq=1 Ack=1 Win=65535 Len=195
609180 193.464539 244.3.153.48 -> 41.177.143.210 TCP 1208 netrisk > 7042 [ACK] Seq=196 Ack=107 Win=65429 Len=1150
609183 193.465070 244.3.153.48 -> 41.177.143.210 TCP 1208 netrisk > 7042 [ACK] Seq=1346 Ack=107 Win=65429 Len=1150
609184 193.465075 244.3.153.48 -> 41.177.143.210 TCP 69 netrisk > 7042 [PSH, ACK] Seq=2496 Ack=107 Win=65429 Len=11
609188 193.466158 244.3.153.48 -> 41.177.143.210 TCP 1208 ansys-lm > 7042 [ACK] Seq=196 Ack=107 Win=65429 Len=1150
609191 193.466704 244.3.153.48 -> 41.177.143.210 TCP 1153 ansys-lm > 7042 [PSH, ACK] Seq=1346 Ack=107 Win=65429 Len=1095
609286 193.506599 244.3.153.48 -> 41.177.143.210 TCP 64 etp > 7042 [ACK] Seq=8533 Ack=25554 Win=65535 Len=0
609293 193.507305 244.3.153.48 -> 41.177.143.210 TCP 64 etp > 7042 [ACK] Seq=8533 Ack=26819 Win=65535 Len=0
609812 193.621377 244.3.153.48 -> 41.177.143.210 TCP 64 netrisk > 7042 [ACK] Seq=2507 Ack=2003 Win=65535 Len=0
609835 193.625663 244.3.153.48 -> 41.177.143.210 TCP 64 netrisk > 7042 [ACK] Seq=2507 Ack=4303 Win=65535 Len=0
609855 193.629399 244.3.153.48 -> 41.177.143.210 TCP 64 netrisk > 7042 [ACK] Seq=2507 Ack=6603 Win=65535 Len=0
609861 193.632570 244.3.153.48 -> 244.3.176.224 TCP 64 fujitsu-dtc > microsoft-ds [ACK] Seq=372 Ack=372 Win=65376 Len=0
609863 193.633103 244.3.153.48 -> 41.177.3.117 TCP 64 vpvc > microsoft-ds [ACK] Seq=372 Ack=372 Win=64509 Len=0
609866 193.633607 244.3.153.48 -> 41.177.143.210 TCP 64 netrisk > 7042 [ACK] Seq=2507 Ack=8903 Win=65535 Len=0
609868 193.634158 244.3.153.48 -> 41.177.143.210 TCP 64 netrisk > 7042 [ACK] Seq=2507 Ack=11203 Win=65535 Len=0
609962 193.667946 244.3.153.48 -> 41.177.143.210 TCP 64 ansys-lm > 7042 [ACK] Seq=2441 Ack=1780 Win=65535 Len=0
610010 193.671586 244.3.153.48 -> 41.177.143.210 TCP 64 ansys-lm > 7042 [ACK] Seq=2441 Ack=4080 Win=65535 Len=0
610038 193.675095 244.3.153.48 -> 41.177.143.210 TCP 64 ansys-lm > 7042 [ACK] Seq=2441 Ack=6380 Win=65535 Len=0
610088 193.679649 244.3.153.48 -> 41.177.143.210 TCP 64 ansys-lm > 7042 [ACK] Seq=2441 Ack=8680 Win=65535 Len=0
610090 193.680010 244.3.153.48 -> 41.177.143.210 TCP 64 ansys-lm > 7042 [ACK] Seq=2441 Ack=10980 Win=65535 Len=0
610093 193.680373 244.3.153.48 -> 41.177.143.210 TCP 64 ansys-lm > 7042 [ACK] Seq=2441 Ack=13280 Win=65535 Len=0
610154 193.684963 244.3.153.48 -> 41.177.143.210 TCP 64 ansys-lm > 7042 [ACK] Seq=2441 Ack=15580 Win=65535 Len=0
610156 193.686383 244.3.153.48 -> 41.177.143.210 TCP 64 ansys-lm > 7042 [ACK] Seq=2441 Ack=17880 Win=65535 Len=0
610158 193.686848 244.3.153.48 -> 41.177.143.210 TCP 64 ansys-lm > 7042 [ACK] Seq=2441 Ack=20180 Win=65535 Len=0
610160 193.687183 244.3.153.48 -> 41.177.143.210 TCP 64 ansys-lm > 7042 [ACK] Seq=2441 Ack=21175 Win=64540 Len=0
610197 193.709924 244.3.153.48 -> 41.177.143.210 TCP 1208 etp > 7042 [ACK] Seq=8533 Ack=26819 Win=65535 Len=1150
610199 193.710374 244.3.153.48 -> 41.177.143.210 TCP 900 etp > 7042 [PSH, ACK] Seq=9683 Ack=26819 Win=65535 Len=842
610201 193.711337 244.3.153.48 -> 41.177.143.210 TCP 1208 netrisk > 7042 [ACK] Seq=2507 Ack=11687 Win=65051 Len=1150
610207 193.711816 244.3.153.48 -> 41.177.143.210 TCP 906 netrisk > 7042 [PSH, ACK] Seq=3657 Ack=11687 Win=65051 Len=848
610211 193.712684 244.3.153.48 -> 41.177.143.210 TCP 1208 ansys-lm > 7042 [ACK] Seq=2441 Ack=21204 Win=64511 Len=1150
610219 193.713459 244.3.153.48 -> 41.177.143.210 TCP 906 ansys-lm > 7042 [PSH, ACK] Seq=3591 Ack=21204 Win=64511 Len=848
610235 193.716082 244.3.153.48 -> 41.177.143.210 TCP 64 etp > 7042 [ACK] Seq=10525 Ack=27184 Win=65170 Len=0
610237 193.716556 244.3.153.48 -> 41.177.143.210 TCP 64 netrisk > 7042 [ACK] Seq=4505 Ack=12078 Win=64660 Len=0
610241 193.718348 244.3.153.48 -> 41.177.143.210 TCP 64 ansys-lm > 7042 [ACK] Seq=4439 Ack=21577 Win=65535 Len=0
619116 196.872777 244.3.153.48 -> 41.177.143.210 TCP 1208 etp > 7042 [ACK] Seq=10525 Ack=27184 Win=65170 Len=1150
619118 196.873766 244.3.153.48 -> 41.177.143.210 TCP 1208 etp > 7042 [ACK] Seq=11675 Ack=27184 Win=65170 Len=1150
619124 196.874641 244.3.153.48 -> 41.177.143.210 TCP 516 etp > 7042 [PSH, ACK] Seq=12825 Ack=27184 Win=65170 Len=458
619600 197.053829 244.3.153.48 -> 41.177.143.210 TCP 64 etp > 7042 [ACK] Seq=13283 Ack=28857 Win=65535 Len=0
619603 197.054468 244.3.153.48 -> 41.177.143.210 TCP 64 etp > 7042 [ACK] Seq=13283 Ack=31157 Win=65535 Len=0
619613 197.056332 244.3.153.48 -> 41.177.143.210 TCP 64 etp > 7042 [ACK] Seq=13283 Ack=32958 Win=65535 Len=0
619615 197.056978 244.3.153.48 -> 41.177.143.210 TCP 64 etp > 7042 [ACK] Seq=13283 Ack=35258 Win=65535 Len=0
619630 197.059063 244.3.153.48 -> 41.177.143.210 TCP 64 etp > 7042 [ACK] Seq=13283 Ack=37059 Win=65535 Len=0
619641 197.063934 244.3.153.48 -> 41.177.143.210 TCP 64 etp > 7042 [ACK] Seq=13283 Ack=39359 Win=65535 Len=0
619652 197.064701 244.3.153.48 -> 41.177.143.210 TCP 64 etp > 7042 [ACK] Seq=13283 Ack=41160 Win=65535 Len=0
619660 197.065840 244.3.153.48 -> 41.177.143.210 TCP 64 etp > 7042 [ACK] Seq=13283 Ack=43460 Win=65535 Len=0
619673 197.067040 244.3.153.48 -> 41.177.143.210 TCP 64 etp > 7042 [ACK] Seq=13283 Ack=45261 Win=65535 Len=0
619679 197.068211 244.3.153.48 -> 41.177.143.210 TCP 64 etp > 7042 [ACK] Seq=13283 Ack=47561 Win=65535 Len=0
619681 197.068571 244.3.153.48 -> 41.177.143.210 TCP 64 etp > 7042 [ACK] Seq=13283 Ack=49362 Win=65535 Len=0
619685 197.068871 244.3.153.48 -> 41.177.143.210 TCP 64 etp > 7042 [ACK] Seq=13283 Ack=51662 Win=65535 Len=0
619692 197.070523 244.3.153.48 -> 41.177.143.210 TCP 64 etp > 7042 [ACK] Seq=13283 Ack=53463 Win=65535 Len=0
619705 197.071981 244.3.153.48 -> 41.177.143.210 TCP 64 etp > 7042 [ACK] Seq=13283 Ack=55763 Win=65535 Len=0
619712 197.072579 244.3.153.48 -> 41.177.143.210 TCP 64 etp > 7042 [ACK] Seq=13283 Ack=56790 Win=64508 Len=0
620288 197.253402 244.3.153.48 -> 41.177.143.210 TCP 64 etp > 7042 [ACK] Seq=13283 Ack=56819 Win=64479 Len=0
626163 198.765016 244.3.153.48 -> 41.177.143.210 TCP 1208 netrisk > 7042 [ACK] Seq=4505 Ack=12078 Win=64660 Len=1150
626179 198.771656 244.3.153.48 -> 41.177.143.210 TCP 910 netrisk > 7042 [PSH, ACK] Seq=5655 Ack=12078 Win=64660 Len=852
627139 199.095043 244.3.153.48 -> 41.177.143.210 TCP 64 netrisk > 7042 [ACK] Seq=6507 Ack=13751 Win=65535 Len=0
627164 199.101764 244.3.153.48 -> 41.177.143.210 TCP 64 netrisk > 7042 [ACK] Seq=6507 Ack=16051 Win=65535 Len=0
627169 199.102602 244.3.153.48 -> 41.177.143.210 TCP 64 netrisk > 7042 [ACK] Seq=6507 Ack=17852 Win=65535 Len=0
627187 199.106743 244.3.153.48 -> 41.177.143.210 TCP 64 netrisk > 7042 [ACK] Seq=6507 Ack=20152 Win=65535 Len=0
627189 199.107006 244.3.153.48 -> 41.177.143.210 TCP 64 netrisk > 7042 [ACK] Seq=6507 Ack=21953 Win=65535 Len=0
627213 199.110944 244.3.153.48 -> 41.177.143.210 TCP 64 netrisk > 7042 [ACK] Seq=6507 Ack=24253 Win=65535 Len=0
627262 199.114751 244.3.153.48 -> 41.177.143.210 TCP 64 netrisk > 7042 [ACK] Seq=6507 Ack=26054 Win=65535 Len=0
627271 199.116823 244.3.153.48 -> 41.177.143.210 TCP 64 netrisk > 7042 [ACK] Seq=6507 Ack=28354 Win=65535 Len=0
627277 199.119113 244.3.153.48 -> 41.177.143.210 TCP 64 netrisk > 7042 [ACK] Seq=6507 Ack=30155 Win=65535 Len=0
627287 199.122995 244.3.153.48 -> 41.177.143.210 TCP 64 netrisk > 7042 [ACK] Seq=6507 Ack=32455 Win=65535 Len=0
627294 199.123405 244.3.153.48 -> 41.177.143.210 TCP 64 netrisk > 7042 [ACK] Seq=6507 Ack=34256 Win=65535 Len=0
627314 199.126514 244.3.153.48 -> 41.177.143.210 TCP 64 netrisk > 7042 [ACK] Seq=6507 Ack=36556 Win=65535 Len=0
627338 199.135992 244.3.153.48 -> 41.177.143.210 TCP 1208 ansys-lm > 7042 [ACK] Seq=4439 Ack=21577 Win=65535 Len=1150
627339 199.136062 244.3.153.48 -> 41.177.143.210 TCP 179 ansys-lm > 7042 [PSH, ACK] Seq=5589 Ack=21577 Win=65535 Len=121
627342 199.136361 244.3.153.48 -> 41.177.143.210 TCP 64 netrisk > 7042 [ACK] Seq=6507 Ack=38357 Win=65535 Len=0
627344 199.136713 244.3.153.48 -> 41.177.143.210 TCP 64 netrisk > 7042 [ACK] Seq=6507 Ack=39338 Win=64554 Len=0
627432 199.148919 244.3.153.48 -> 41.177.143.210 TCP 64 ansys-lm > 7042 [ACK] Seq=5710 Ack=22047 Win=65065 Len=0
634956 200.749904 244.3.153.48 -> 41.177.143.210 TCP 1208 etp > 7042 [ACK] Seq=13283 Ack=56819 Win=64479 Len=1150
634962 200.750768 244.3.153.48 -> 41.177.143.210 TCP 825 etp > 7042 [PSH, ACK] Seq=14433 Ack=56819 Win=64479 Len=767
638752 201.608766 244.3.153.48 -> 41.177.143.210 TCP 64 etp > 7042 [ACK] Seq=15200 Ack=58492 Win=65535 Len=0
638767 201.610780 244.3.153.48 -> 41.177.143.210 TCP 64 etp > 7042 [ACK] Seq=15200 Ack=60792 Win=65535 Len=0
638772 201.612533 244.3.153.48 -> 41.177.143.210 TCP 64 etp > 7042 [ACK] Seq=15200 Ack=62593 Win=65535 Len=0
638782 201.613295 244.3.153.48 -> 41.177.143.210 TCP 64 etp > 7042 [ACK] Seq=15200 Ack=64893 Win=65535 Len=0
638794 201.615064 244.3.153.48 -> 41.177.143.210 TCP 64 etp > 7042 [ACK] Seq=15200 Ack=66694 Win=65535 Len=0
638810 201.616247 244.3.153.48 -> 41.177.143.210 TCP 64 etp > 7042 [ACK] Seq=15200 Ack=68994 Win=65535 Len=0
638823 201.618260 244.3.153.48 -> 41.177.143.210 TCP 64 etp > 7042 [ACK] Seq=15200 Ack=70795 Win=65535 Len=0
638827 201.618980 244.3.153.48 -> 41.177.143.210 TCP 64 etp > 7042 [ACK] Seq=15200 Ack=73095 Win=65535 Len=0
638847 201.622384 244.3.153.48 -> 41.177.143.210 TCP 64 etp > 7042 [ACK] Seq=15200 Ack=74896 Win=65535 Len=0
638849 201.622628 244.3.153.48 -> 41.177.143.210 TCP 64 etp > 7042 [ACK] Seq=15200 Ack=77196 Win=65535 Len=0
638854 201.623724 244.3.153.48 -> 41.177.143.210 TCP 64 etp > 7042 [ACK] Seq=15200 Ack=78997 Win=65535 Len=0
638858 201.624308 244.3.153.48 -> 41.177.143.210 TCP 64 etp > 7042 [ACK] Seq=15200 Ack=81297 Win=65535 Len=0
638861 201.624724 244.3.153.48 -> 41.177.143.210 TCP 64 etp > 7042 [ACK] Seq=15200 Ack=81799 Win=65033 Len=0
638976 201.656611 244.3.153.48 -> 41.177.143.210 TCP 1208 netrisk > 7042 [ACK] Seq=6507 Ack=39338 Win=64554 Len=1150
638977 201.656617 244.3.153.48 -> 41.177.143.210 TCP 172 netrisk > 7042 [PSH, ACK] Seq=7657 Ack=39338 Win=64554 Len=114
638983 201.657663 244.3.153.48 -> 41.177.143.210 TCP 1208 ansys-lm > 7042 [ACK] Seq=5710 Ack=22047 Win=65065 Len=1150
638994 201.658419 244.3.153.48 -> 41.177.143.210 TCP 168 ansys-lm > 7042 [PSH, ACK] Seq=6860 Ack=22047 Win=65065 Len=110
639027 201.669313 244.3.153.48 -> 41.177.143.210 TCP 1208 etp > 7042 [ACK] Seq=15200 Ack=81799 Win=65033 Len=1150
639030 201.669790 244.3.153.48 -> 41.177.143.210 TCP 179 etp > 7042 [PSH, ACK] Seq=16350 Ack=81799 Win=65033 Len=121
639032 201.670031 244.3.153.48 -> 41.177.143.210 TCP 64 ansys-lm > 7042 [ACK] Seq=6970 Ack=22436 Win=64676 Len=0
639034 201.670324 244.3.153.48 -> 41.177.143.210 TCP 64 netrisk > 7042 [ACK] Seq=7771 Ack=39819 Win=65535 Len=0
639089 201.684467 244.3.153.48 -> 41.177.143.210 TCP 64 etp > 7042 [ACK] Seq=16471 Ack=82206 Win=64626 Len=0
665806 207.259919 244.3.153.48 -> 41.177.143.210 TCP 1001 [TCP Previous segment not captured] ansys-lm > 7042 [PSH, ACK] Seq=8120 Ack=22436 Win=64676 Len=943
667799 208.118973 244.3.153.48 -> 41.177.143.210 TCP 1208 [TCP Retransmission] ansys-lm > 7042 [ACK] Seq=6970 Ack=22436 Win=64676 Len=1150
667894 208.141654 244.3.153.48 -> 41.177.143.210 TCP 64 ansys-lm > 7042 [ACK] Seq=9063 Ack=24371 Win=65535 Len=0
667896 208.143239 244.3.153.48 -> 41.177.143.210 TCP 64 ansys-lm > 7042 [ACK] Seq=9063 Ack=26671 Win=65535 Len=0
667898 208.143906 244.3.153.48 -> 41.177.143.210 TCP 64 ansys-lm > 7042 [ACK] Seq=9063 Ack=28464 Win=65535 Len=0
667900 208.145517 244.3.153.48 -> 41.177.143.210 TCP 64 ansys-lm > 7042 [ACK] Seq=9063 Ack=30764 Win=65535 Len=0
667902 208.146833 244.3.153.48 -> 41.177.143.210 TCP 64 ansys-lm > 7042 [ACK] Seq=9063 Ack=32557 Win=65535 Len=0
667904 208.147423 244.3.153.48 -> 41.177.143.210 TCP 64 ansys-lm > 7042 [ACK] Seq=9063 Ack=34857 Win=65535 Len=0
667918 208.159258 244.3.153.48 -> 41.177.143.210 TCP 993 netrisk > 7042 [PSH, ACK] Seq=7771 Ack=39819 Win=65535 Len=935
667931 208.167598 244.3.153.48 -> 41.177.143.210 TCP 64 netrisk > 7042 [ACK] Seq=8706 Ack=41154 Win=65535 Len=0
667933 208.167858 244.3.153.48 -> 41.177.143.210 TCP 70 netrisk > 7042 [ACK] Seq=8706 Ack=41239 Win=65450 Len=0 SLE=41262 SRE=41263
667935 208.168198 244.3.153.48 -> 41.177.143.210 TCP 64 netrisk > 7042 [ACK] Seq=8706 Ack=41263 Win=65427 Len=0
667937 208.168471 244.3.153.48 -> 41.177.143.210 TCP 81 netrisk > 7042 [PSH, ACK] Seq=8706 Ack=41263 Win=65427 Len=23
667939 208.168821 244.3.153.48 -> 41.177.143.210 TCP 64 netrisk > 7042 [RST, ACK] Seq=8729 Ack=41263 Win=0 Len=0
668353 208.317526 244.3.153.48 -> 41.177.143.210 TCP 64 ansys-lm > 7042 [ACK] Seq=9063 Ack=35448 Win=64944 Len=0
670234 208.768719 244.3.153.48 -> 41.177.46.138 TCP 66 msmq > https [SYN] Seq=0 Win=65535 Len=0 MSS=1150 SACK_PERM=1
670243 208.771265 244.3.153.48 -> 41.177.46.138 TCP 64 msmq > https [ACK] Seq=1 Ack=1 Win=65535 Len=0
670317 208.787764 244.3.153.48 -> 41.177.46.138 TCP 64 msmq > https [ACK] Seq=202 Ack=1307 Win=65535 Len=0
671042 209.052712 244.3.153.48 -> 41.177.46.138 TCP 64 msmq > https [ACK] Seq=2005 Ack=3666 Win=65535 Len=0
671055 209.055881 244.3.153.48 -> 41.177.46.138 TCP 64 msmq > https [ACK] Seq=2005 Ack=5966 Win=65535 Len=0
671063 209.056756 244.3.153.48 -> 41.177.46.138 TCP 64 msmq > https [ACK] Seq=2005 Ack=8266 Win=65535 Len=0
671074 209.059622 244.3.153.48 -> 41.177.46.138 TCP 64 msmq > https [ACK] Seq=2005 Ack=10566 Win=65535 Len=0
671088 209.063201 244.3.153.48 -> 41.177.46.138 TCP 64 msmq > https [ACK] Seq=2005 Ack=12866 Win=65535 Len=0
671106 209.063976 244.3.153.48 -> 41.177.46.138 TCP 64 msmq > https [ACK] Seq=2005 Ack=15166 Win=65535 Len=0
671130 209.067070 244.3.153.48 -> 41.177.46.138 TCP 64 msmq > https [ACK] Seq=2005 Ack=17466 Win=65535 Len=0
671141 209.068229 244.3.153.48 -> 41.177.46.138 TCP 64 msmq > https [ACK] Seq=2005 Ack=19766 Win=65535 Len=0
671149 209.068963 244.3.153.48 -> 41.177.46.138 TCP 64 msmq > https [ACK] Seq=2005 Ack=22066 Win=65535 Len=0
671161 209.070028 244.3.153.48 -> 41.177.46.138 TCP 64 msmq > https [ACK] Seq=2005 Ack=24366 Win=65535 Len=0
671177 209.074485 244.3.153.48 -> 41.177.46.138 TCP 64 msmq > https [ACK] Seq=2005 Ack=26666 Win=65535 Len=0
671190 209.075674 244.3.153.48 -> 41.177.46.138 TCP 64 msmq > https [ACK] Seq=2005 Ack=28966 Win=65535 Len=0
671198 209.076232 244.3.153.48 -> 41.177.46.138 TCP 64 msmq > https [ACK] Seq=2005 Ack=31266 Win=65535 Len=0
671202 209.076750 244.3.153.48 -> 41.177.46.138 TCP 64 msmq > https [ACK] Seq=2005 Ack=33566 Win=65535 Len=0
671207 209.078521 244.3.153.48 -> 41.177.46.138 TCP 64 msmq > https [ACK] Seq=2005 Ack=35866 Win=65535 Len=0
671210 209.079715 244.3.153.48 -> 41.177.46.138 TCP 64 msmq > https [ACK] Seq=2005 Ack=38166 Win=63235 Len=0
671214 209.081208 244.3.153.48 -> 41.177.46.138 TCP 64 [TCP Window Update] msmq > https [ACK] Seq=2005 Ack=38166 Win=65535 Len=0
671234 209.087587 244.3.153.48 -> 41.177.46.138 TCP 64 msmq > https [ACK] Seq=2005 Ack=40466 Win=65535 Len=0
671236 209.087896 244.3.153.48 -> 41.177.46.138 TCP 64 msmq > https [ACK] Seq=2005 Ack=42766 Win=65535 Len=0
671238 209.088287 244.3.153.48 -> 41.177.46.138 TCP 64 msmq > https [ACK] Seq=2005 Ack=44010 Win=65535 Len=0
671382 209.138093 244.3.153.48 -> 41.177.46.138 TCP 64 msmq > https [ACK] Seq=3770 Ack=46310 Win=65535 Len=0
671399 209.139928 244.3.153.48 -> 41.177.46.138 TCP 64 msmq > https [ACK] Seq=3770 Ack=48610 Win=65535 Len=0
671406 209.140414 244.3.153.48 -> 41.177.46.138 TCP 64 msmq > https [ACK] Seq=3770 Ack=50910 Win=65535 Len=0
671418 209.142210 244.3.153.48 -> 41.177.46.138 TCP 64 msmq > https [ACK] Seq=3770 Ack=52745 Win=65535 Len=0
671423 209.142910 244.3.153.48 -> 41.177.46.138 TCP 64 msmq > https [ACK] Seq=3770 Ack=55045 Win=65535 Len=0
671435 209.148607 244.3.153.48 -> 41.177.46.138 TCP 64 msmq > https [ACK] Seq=3770 Ack=57345 Win=65535 Len=0
671441 209.149890 244.3.153.48 -> 41.177.46.138 TCP 64 msmq > https [ACK] Seq=3770 Ack=59645 Win=65535 Len=0
671446 209.150486 244.3.153.48 -> 41.177.46.138 TCP 64 msmq > https [ACK] Seq=3770 Ack=61945 Win=65535 Len=0
671449 209.150601 244.3.153.48 -> 41.177.46.138 TCP 64 msmq > https [ACK] Seq=3770 Ack=64245 Win=65535 Len=0
671451 209.150730 244.3.153.48 -> 41.177.46.138 TCP 64 msmq > https [ACK] Seq=3770 Ack=66545 Win=64385 Len=0
671466 209.151643 244.3.153.48 -> 41.177.46.138 TCP 64 [TCP Window Update] msmq > https [ACK] Seq=3770 Ack=66545 Win=65535 Len=0
671478 209.159256 244.3.153.48 -> 41.177.46.138 TCP 64 msmq > https [ACK] Seq=3770 Ack=68845 Win=65535 Len=0
671486 209.160399 244.3.153.48 -> 41.177.46.138 TCP 64 msmq > https [ACK] Seq=3770 Ack=71145 Win=65535 Len=0
