47742  19.669862 244.3.79.176 -> 41.177.98.220 TCP 110 rap-listen > ups-onlinet [PSH, ACK] Seq=1 Ack=1 Win=65467 Len=52
55299  22.834344 244.3.79.176 -> 41.177.98.220 TCP 64 rap-listen > ups-onlinet [ACK] Seq=53 Ack=2761 Win=65535 Len=0
55301  22.834569 244.3.79.176 -> 41.177.98.220 TCP 64 rap-listen > ups-onlinet [ACK] Seq=53 Ack=5521 Win=65535 Len=0
55302  22.834800 244.3.79.176 -> 41.177.98.220 TCP 64 rap-listen > ups-onlinet [ACK] Seq=53 Ack=8281 Win=65535 Len=0
55303  22.835032 244.3.79.176 -> 41.177.98.220 TCP 64 rap-listen > ups-onlinet [ACK] Seq=53 Ack=11041 Win=65535 Len=0
55305  22.835267 244.3.79.176 -> 41.177.98.220 TCP 64 rap-listen > ups-onlinet [ACK] Seq=53 Ack=13801 Win=65535 Len=0
55306  22.835492 244.3.79.176 -> 41.177.98.220 TCP 64 rap-listen > ups-onlinet [ACK] Seq=53 Ack=16561 Win=65535 Len=0
55307  22.835739 244.3.79.176 -> 41.177.98.220 TCP 64 rap-listen > ups-onlinet [ACK] Seq=53 Ack=19321 Win=65535 Len=0
55909  22.974704 244.3.79.176 -> 41.177.98.220 TCP 64 rap-listen > ups-onlinet [ACK] Seq=53 Ack=19987 Win=65535 Len=0
90309  34.798129 244.3.79.176 -> 41.177.98.220 TCP 126 rap-listen > ups-onlinet [PSH, ACK] Seq=53 Ack=19987 Win=65535 Len=68
91045  35.012657 244.3.79.176 -> 41.177.98.220 TCP 64 rap-listen > ups-onlinet [ACK] Seq=121 Ack=20189 Win=65333 Len=0
93315  35.643522 244.3.79.176 -> 41.177.98.220 TCP 131 rap-listen > ups-onlinet [PSH, ACK] Seq=121 Ack=20189 Win=65333 Len=73
94383  35.815260 244.3.79.176 -> 41.177.98.220 TCP 64 rap-listen > ups-onlinet [ACK] Seq=194 Ack=20973 Win=65535 Len=0
121218  43.225914 244.3.79.176 -> 41.177.98.220 TCP 594 rap-listen > ups-onlinet [ACK] Seq=194 Ack=20973 Win=65535 Len=536
121219  43.225919 244.3.79.176 -> 41.177.98.220 TCP 104 rap-listen > ups-onlinet [PSH, ACK] Seq=730 Ack=20973 Win=65535 Len=46
121313  43.244280 244.3.79.176 -> 41.177.98.220 TCP 133 rap-listen > ups-onlinet [PSH, ACK] Seq=776 Ack=21572 Win=65535 Len=75
121347  43.253589 244.3.79.176 -> 41.177.98.220 TCP 594 rap-listen > ups-onlinet [ACK] Seq=851 Ack=21661 Win=65446 Len=536
121348  43.253594 244.3.79.176 -> 41.177.98.220 TCP 148 rap-listen > ups-onlinet [PSH, ACK] Seq=1387 Ack=21661 Win=65446 Len=90
122314  43.539545 244.3.79.176 -> 41.177.98.220 TCP 64 rap-listen > ups-onlinet [ACK] Seq=1477 Ack=22403 Win=65535 Len=0
130433  45.571734 244.3.79.176 -> 41.177.98.167 TCP 196 snaresecure > ncube-lm [PSH, ACK] Seq=1 Ack=1 Win=65330 Len=138
130468  45.576880 244.3.79.176 -> 41.177.98.167 TCP 85 snaresecure > ncube-lm [PSH, ACK] Seq=139 Ack=43 Win=65288 Len=27
130480  45.578334 244.3.79.176 -> 41.177.98.167 TCP 76 snaresecure > ncube-lm [PSH, ACK] Seq=166 Ack=138 Win=65193 Len=18
130486  45.579446 244.3.79.176 -> 41.177.98.167 TCP 128 snaresecure > ncube-lm [PSH, ACK] Seq=184 Ack=179 Win=65152 Len=70
130493  45.581954 244.3.79.176 -> 41.177.98.167 TCP 198 snaresecure > ncube-lm [PSH, ACK] Seq=254 Ack=1291 Win=65535 Len=140
130500  45.585182 244.3.79.176 -> 41.177.98.167 TCP 85 snaresecure > ncube-lm [PSH, ACK] Seq=394 Ack=1334 Win=65492 Len=27
130502  45.586038 244.3.79.176 -> 41.177.98.167 TCP 76 snaresecure > ncube-lm [PSH, ACK] Seq=421 Ack=1416 Win=65410 Len=18
130505  45.587021 244.3.79.176 -> 41.177.98.167 TCP 128 snaresecure > ncube-lm [PSH, ACK] Seq=439 Ack=1457 Win=65369 Len=70
130509  45.588319 244.3.79.176 -> 41.177.98.167 TCP 225 snaresecure > ncube-lm [PSH, ACK] Seq=509 Ack=1551 Win=65275 Len=167
130528  45.591825 244.3.79.176 -> 41.177.98.167 TCP 85 snaresecure > ncube-lm [PSH, ACK] Seq=676 Ack=1594 Win=65232 Len=27
130533  45.592763 244.3.79.176 -> 41.177.98.167 TCP 76 snaresecure > ncube-lm [PSH, ACK] Seq=703 Ack=1676 Win=65150 Len=18
130538  45.593776 244.3.79.176 -> 41.177.98.167 TCP 128 snaresecure > ncube-lm [PSH, ACK] Seq=721 Ack=1717 Win=65109 Len=70
130714  45.627211 244.3.79.176 -> 41.177.98.167 TCP 215 snaresecure > ncube-lm [PSH, ACK] Seq=791 Ack=1833 Win=65535 Len=157
130734  45.631331 244.3.79.176 -> 41.177.98.167 TCP 85 snaresecure > ncube-lm [PSH, ACK] Seq=948 Ack=1876 Win=65492 Len=27
130742  45.632174 244.3.79.176 -> 41.177.98.167 TCP 76 snaresecure > ncube-lm [PSH, ACK] Seq=975 Ack=1928 Win=65440 Len=18
130747  45.633260 244.3.79.176 -> 41.177.98.167 TCP 114 snaresecure > ncube-lm [PSH, ACK] Seq=993 Ack=1969 Win=65399 Len=56
130764  45.637250 244.3.79.176 -> 41.177.98.167 TCP 221 snaresecure > ncube-lm [PSH, ACK] Seq=1049 Ack=2038 Win=65330 Len=163
130772  45.640664 244.3.79.176 -> 41.177.98.167 TCP 85 snaresecure > ncube-lm [PSH, ACK] Seq=1212 Ack=2080 Win=65288 Len=27
130776  45.641504 244.3.79.176 -> 41.177.98.167 TCP 76 snaresecure > ncube-lm [PSH, ACK] Seq=1239 Ack=2132 Win=65236 Len=18
130781  45.642605 244.3.79.176 -> 41.177.98.167 TCP 114 snaresecure > ncube-lm [PSH, ACK] Seq=1257 Ack=2173 Win=65195 Len=56
130815  45.653146 244.3.79.176 -> 41.177.98.167 TCP 205 snaresecure > ncube-lm [PSH, ACK] Seq=1313 Ack=2286 Win=65082 Len=147
130833  45.656254 244.3.79.176 -> 41.177.98.167 TCP 85 snaresecure > ncube-lm [PSH, ACK] Seq=1460 Ack=2329 Win=65039 Len=27
130839  45.657238 244.3.79.176 -> 41.177.98.167 TCP 76 snaresecure > ncube-lm [PSH, ACK] Seq=1487 Ack=2425 Win=65535 Len=18
130848  45.658267 244.3.79.176 -> 41.177.98.167 TCP 128 snaresecure > ncube-lm [PSH, ACK] Seq=1505 Ack=2466 Win=65494 Len=70
130856  45.661810 244.3.79.176 -> 41.177.98.167 TCP 210 snaresecure > ncube-lm [PSH, ACK] Seq=1575 Ack=2654 Win=65306 Len=152
130868  45.665229 244.3.79.176 -> 41.177.98.167 TCP 85 snaresecure > ncube-lm [PSH, ACK] Seq=1727 Ack=2697 Win=65263 Len=27
130873  45.666100 244.3.79.176 -> 41.177.98.167 TCP 76 snaresecure > ncube-lm [PSH, ACK] Seq=1754 Ack=2749 Win=65211 Len=18
130879  45.668411 244.3.79.176 -> 41.177.98.167 TCP 114 snaresecure > ncube-lm [PSH, ACK] Seq=1772 Ack=2790 Win=65170 Len=56
131750  45.846942 244.3.79.176 -> 41.177.98.167 TCP 64 snaresecure > ncube-lm [ACK] Seq=1828 Ack=2859 Win=65101 Len=0
134133  46.620401 244.3.79.176 -> 41.177.98.167 TCP 308 cvmon > ncube-lm [PSH, ACK] Seq=1 Ack=1 Win=65009 Len=250
134158  46.630921 244.3.79.176 -> 41.177.98.167 TCP 85 cvmon > ncube-lm [PSH, ACK] Seq=251 Ack=44 Win=65535 Len=27
134160  46.631833 244.3.79.176 -> 41.177.98.167 TCP 76 cvmon > ncube-lm [PSH, ACK] Seq=278 Ack=133 Win=65446 Len=18
134162  46.632953 244.3.79.176 -> 41.177.98.167 TCP 128 cvmon > ncube-lm [PSH, ACK] Seq=296 Ack=174 Win=65405 Len=70
134172  46.635940 244.3.79.176 -> 41.177.98.167 TCP 161 cvmon > ncube-lm [PSH, ACK] Seq=366 Ack=533 Win=65046 Len=103
134181  46.638757 244.3.79.176 -> 41.177.98.167 TCP 85 cvmon > ncube-lm [PSH, ACK] Seq=469 Ack=576 Win=65003 Len=27
134186  46.639583 244.3.79.176 -> 41.177.98.167 TCP 76 cvmon > ncube-lm [PSH, ACK] Seq=496 Ack=624 Win=65535 Len=18
134189  46.640594 244.3.79.176 -> 41.177.98.167 TCP 114 cvmon > ncube-lm [PSH, ACK] Seq=514 Ack=665 Win=65494 Len=56
134245  46.660172 244.3.79.176 -> 41.177.98.167 TCP 161 cvmon > ncube-lm [PSH, ACK] Seq=570 Ack=754 Win=65405 Len=103
134253  46.663020 244.3.79.176 -> 41.177.98.167 TCP 85 cvmon > ncube-lm [PSH, ACK] Seq=673 Ack=797 Win=65362 Len=27
134255  46.663842 244.3.79.176 -> 41.177.98.167 TCP 76 cvmon > ncube-lm [PSH, ACK] Seq=700 Ack=845 Win=65314 Len=18
134259  46.664808 244.3.79.176 -> 41.177.98.167 TCP 114 cvmon > ncube-lm [PSH, ACK] Seq=718 Ack=886 Win=65273 Len=56
134263  46.666810 244.3.79.176 -> 41.177.98.167 TCP 162 cvmon > ncube-lm [PSH, ACK] Seq=774 Ack=975 Win=65184 Len=104
134269  46.669483 244.3.79.176 -> 41.177.98.167 TCP 85 cvmon > ncube-lm [PSH, ACK] Seq=878 Ack=1018 Win=65141 Len=27
134274  46.670301 244.3.79.176 -> 41.177.98.167 TCP 76 cvmon > ncube-lm [PSH, ACK] Seq=905 Ack=1066 Win=65093 Len=18
134277  46.671279 244.3.79.176 -> 41.177.98.167 TCP 114 cvmon > ncube-lm [PSH, ACK] Seq=923 Ack=1107 Win=65052 Len=56
134289  46.673292 244.3.79.176 -> 41.177.98.167 TCP 162 cvmon > ncube-lm [PSH, ACK] Seq=979 Ack=1196 Win=65535 Len=104
134328  46.675945 244.3.79.176 -> 41.177.98.167 TCP 85 cvmon > ncube-lm [PSH, ACK] Seq=1083 Ack=1239 Win=65492 Len=27
134330  46.676760 244.3.79.176 -> 41.177.98.167 TCP 76 cvmon > ncube-lm [PSH, ACK] Seq=1110 Ack=1287 Win=65444 Len=18
134336  46.677778 244.3.79.176 -> 41.177.98.167 TCP 114 cvmon > ncube-lm [PSH, ACK] Seq=1128 Ack=1328 Win=65403 Len=56
134342  46.681384 244.3.79.176 -> 41.177.98.167 TCP 196 cvmon > ncube-lm [PSH, ACK] Seq=1184 Ack=1449 Win=65282 Len=138
134355  46.684519 244.3.79.176 -> 41.177.98.167 TCP 85 cvmon > ncube-lm [PSH, ACK] Seq=1322 Ack=1492 Win=65239 Len=27
134361  46.685361 244.3.79.176 -> 41.177.98.167 TCP 76 cvmon > ncube-lm [PSH, ACK] Seq=1349 Ack=1587 Win=65144 Len=18
134367  46.686354 244.3.79.176 -> 41.177.98.167 TCP 128 cvmon > ncube-lm [PSH, ACK] Seq=1367 Ack=1628 Win=65103 Len=70
134370  46.688107 244.3.79.176 -> 41.177.98.167 TCP 64 cvmon > ncube-lm [ACK] Seq=1437 Ack=3431 Win=65535 Len=0
134377  46.689559 244.3.79.176 -> 41.177.98.167 TCP 178 cvmon > ncube-lm [PSH, ACK] Seq=1437 Ack=3431 Win=65535 Len=120
134389  46.692792 244.3.79.176 -> 41.177.98.167 TCP 85 cvmon > ncube-lm [PSH, ACK] Seq=1557 Ack=3474 Win=65492 Len=27
134393  46.693678 244.3.79.176 -> 41.177.98.167 TCP 76 cvmon > ncube-lm [PSH, ACK] Seq=1584 Ack=3563 Win=65403 Len=18
134398  46.694617 244.3.79.176 -> 41.177.98.167 TCP 128 cvmon > ncube-lm [PSH, ACK] Seq=1602 Ack=3604 Win=65362 Len=70
134402  46.695977 244.3.79.176 -> 41.177.98.167 TCP 198 cvmon > ncube-lm [PSH, ACK] Seq=1672 Ack=3693 Win=65273 Len=140
134413  46.698929 244.3.79.176 -> 41.177.98.167 TCP 85 cvmon > ncube-lm [PSH, ACK] Seq=1812 Ack=3736 Win=65230 Len=27
134418  46.701125 244.3.79.176 -> 41.177.98.167 TCP 76 cvmon > ncube-lm [PSH, ACK] Seq=1839 Ack=3818 Win=65148 Len=18
134430  46.702483 244.3.79.176 -> 41.177.98.167 TCP 128 cvmon > ncube-lm [PSH, ACK] Seq=1857 Ack=3859 Win=65107 Len=70
134460  46.711198 244.3.79.176 -> 41.177.98.167 TCP 225 cvmon > ncube-lm [PSH, ACK] Seq=1927 Ack=3953 Win=65013 Len=167
134467  46.714661 244.3.79.176 -> 41.177.98.167 TCP 85 cvmon > ncube-lm [PSH, ACK] Seq=2094 Ack=3996 Win=65535 Len=27
134470  46.715503 244.3.79.176 -> 41.177.98.167 TCP 76 cvmon > ncube-lm [PSH, ACK] Seq=2121 Ack=4078 Win=65453 Len=18
134472  46.716479 244.3.79.176 -> 41.177.98.167 TCP 128 cvmon > ncube-lm [PSH, ACK] Seq=2139 Ack=4119 Win=65412 Len=70
134772  46.850183 244.3.79.176 -> 41.177.98.167 TCP 64 cvmon > ncube-lm [ACK] Seq=2209 Ack=4188 Win=65343 Len=0
135005  46.928862 244.3.79.176 -> 41.177.98.220 TCP 125 firefox > ups-onlinet [PSH, ACK] Seq=1 Ack=1 Win=65535 Len=67
135023  46.935616 244.3.79.176 -> 41.177.98.220 TCP 124 firefox > ups-onlinet [PSH, ACK] Seq=68 Ack=71 Win=65465 Len=66
135030  46.938532 244.3.79.176 -> 41.177.98.220 TCP 129 firefox > ups-onlinet [PSH, ACK] Seq=134 Ack=141 Win=65395 Len=71
135036  46.940196 244.3.79.176 -> 41.177.98.220 TCP 594 firefox > ups-onlinet [ACK] Seq=205 Ack=211 Win=65325 Len=536
135037  46.940201 244.3.79.176 -> 41.177.98.220 TCP 516 firefox > ups-onlinet [PSH, ACK] Seq=741 Ack=211 Win=65325 Len=458
136650  47.566048 244.3.79.176 -> 41.177.98.220 TCP 188 rap-listen > ups-onlinet [PSH, ACK] Seq=1477 Ack=22403 Win=65535 Len=130
138309  47.974735 244.3.79.176 -> 41.177.98.220 TCP 64 rap-listen > ups-onlinet [ACK] Seq=1607 Ack=25163 Win=65535 Len=0
139044  48.150410 244.3.79.176 -> 41.177.98.167 TCP 196 cvmon > ncube-lm [PSH, ACK] Seq=2209 Ack=4188 Win=65343 Len=138
139052  48.153751 244.3.79.176 -> 41.177.98.167 TCP 85 cvmon > ncube-lm [PSH, ACK] Seq=2347 Ack=4230 Win=65301 Len=27
139056  48.154068 244.3.79.176 -> 41.177.98.220 TCP 64 rap-listen > ups-onlinet [ACK] Seq=1607 Ack=26193 Win=65535 Len=0
139059  48.154613 244.3.79.176 -> 41.177.98.167 TCP 76 cvmon > ncube-lm [PSH, ACK] Seq=2374 Ack=4325 Win=65206 Len=18
139061  48.155599 244.3.79.176 -> 41.177.98.167 TCP 128 cvmon > ncube-lm [PSH, ACK] Seq=2392 Ack=4366 Win=65165 Len=70
139068  48.157477 244.3.79.176 -> 41.177.98.167 TCP 64 cvmon > ncube-lm [ACK] Seq=2462 Ack=6377 Win=65535 Len=0
139086  48.159712 244.3.79.176 -> 41.177.98.167 TCP 178 cvmon > ncube-lm [PSH, ACK] Seq=2462 Ack=7304 Win=65535 Len=120
139095  48.162670 244.3.79.176 -> 41.177.98.167 TCP 85 cvmon > ncube-lm [PSH, ACK] Seq=2582 Ack=7347 Win=65492 Len=27
139099  48.163519 244.3.79.176 -> 41.177.98.167 TCP 76 cvmon > ncube-lm [PSH, ACK] Seq=2609 Ack=7436 Win=65403 Len=18
139103  48.164484 244.3.79.176 -> 41.177.98.167 TCP 128 cvmon > ncube-lm [PSH, ACK] Seq=2627 Ack=7477 Win=65362 Len=70
139110  48.165795 244.3.79.176 -> 41.177.98.167 TCP 198 cvmon > ncube-lm [PSH, ACK] Seq=2697 Ack=7566 Win=65273 Len=140
139123  48.168686 244.3.79.176 -> 41.177.98.167 TCP 85 cvmon > ncube-lm [PSH, ACK] Seq=2837 Ack=7609 Win=65230 Len=27
139127  48.169571 244.3.79.176 -> 41.177.98.167 TCP 76 cvmon > ncube-lm [PSH, ACK] Seq=2864 Ack=7691 Win=65148 Len=18
139131  48.170525 244.3.79.176 -> 41.177.98.167 TCP 128 cvmon > ncube-lm [PSH, ACK] Seq=2882 Ack=7732 Win=65107 Len=70
139232  48.187865 244.3.79.176 -> 41.177.98.167 TCP 225 cvmon > ncube-lm [PSH, ACK] Seq=2952 Ack=7826 Win=65013 Len=167
139255  48.191221 244.3.79.176 -> 41.177.98.167 TCP 85 cvmon > ncube-lm [PSH, ACK] Seq=3119 Ack=7869 Win=65535 Len=27
139260  48.192059 244.3.79.176 -> 41.177.98.167 TCP 76 cvmon > ncube-lm [PSH, ACK] Seq=3146 Ack=7951 Win=65453 Len=18
139266  48.193036 244.3.79.176 -> 41.177.98.167 TCP 128 cvmon > ncube-lm [PSH, ACK] Seq=3164 Ack=7992 Win=65412 Len=70
139676  48.254452 244.3.79.176 -> 41.177.98.220 TCP 64 firefox > ups-onlinet [ACK] Seq=1199 Ack=1305 Win=65535 Len=0
139782  48.280987 244.3.79.176 -> 41.177.98.220 TCP 125 firefox > ups-onlinet [PSH, ACK] Seq=1199 Ack=1305 Win=65535 Len=67
139793  48.282607 244.3.79.176 -> 41.177.98.220 TCP 124 firefox > ups-onlinet [PSH, ACK] Seq=1266 Ack=1375 Win=65465 Len=66
139806  48.285387 244.3.79.176 -> 41.177.98.220 TCP 129 firefox > ups-onlinet [PSH, ACK] Seq=1332 Ack=1445 Win=65395 Len=71
139899  48.294833 244.3.79.176 -> 41.177.98.220 TCP 594 firefox > ups-onlinet [ACK] Seq=1403 Ack=1515 Win=65325 Len=536
139900  48.294884 244.3.79.176 -> 41.177.98.220 TCP 594 firefox > ups-onlinet [ACK] Seq=1939 Ack=1515 Win=65325 Len=536
139901  48.294919 244.3.79.176 -> 41.177.98.220 TCP 536 firefox > ups-onlinet [PSH, ACK] Seq=2475 Ack=1515 Win=65325 Len=478
140119  48.355264 244.3.79.176 -> 41.177.98.167 TCP 64 cvmon > ncube-lm [ACK] Seq=3234 Ack=8061 Win=65343 Len=0
142620  49.002071 244.3.79.176 -> 41.177.98.220 TCP 64 firefox > ups-onlinet [ACK] Seq=2953 Ack=3241 Win=65535 Len=0
142622  49.002714 244.3.79.176 -> 41.177.98.167 TCP 196 cvmon > ncube-lm [PSH, ACK] Seq=3234 Ack=8061 Win=65343 Len=138
142641  49.009269 244.3.79.176 -> 41.177.98.167 TCP 85 cvmon > ncube-lm [PSH, ACK] Seq=3372 Ack=8103 Win=65301 Len=27
142649  49.010660 244.3.79.176 -> 41.177.98.167 TCP 76 cvmon > ncube-lm [PSH, ACK] Seq=3399 Ack=8198 Win=65206 Len=18
142654  49.012178 244.3.79.176 -> 41.177.98.167 TCP 128 cvmon > ncube-lm [PSH, ACK] Seq=3417 Ack=8239 Win=65165 Len=70
142664  49.014244 244.3.79.176 -> 41.177.98.167 TCP 64 cvmon > ncube-lm [ACK] Seq=3487 Ack=9968 Win=65535 Len=0
142667  49.015618 244.3.79.176 -> 41.177.98.167 TCP 178 cvmon > ncube-lm [PSH, ACK] Seq=3487 Ack=9968 Win=65535 Len=120
142675  49.019090 244.3.79.176 -> 41.177.98.167 TCP 85 cvmon > ncube-lm [PSH, ACK] Seq=3607 Ack=10011 Win=65492 Len=27
142681  49.019928 244.3.79.176 -> 41.177.98.167 TCP 76 cvmon > ncube-lm [PSH, ACK] Seq=3634 Ack=10100 Win=65403 Len=18
142685  49.020905 244.3.79.176 -> 41.177.98.167 TCP 128 cvmon > ncube-lm [PSH, ACK] Seq=3652 Ack=10141 Win=65362 Len=70
142724  49.029421 244.3.79.176 -> 41.177.98.167 TCP 198 cvmon > ncube-lm [PSH, ACK] Seq=3722 Ack=10230 Win=65273 Len=140
142733  49.032634 244.3.79.176 -> 41.177.98.167 TCP 85 cvmon > ncube-lm [PSH, ACK] Seq=3862 Ack=10273 Win=65230 Len=27
142740  49.033617 244.3.79.176 -> 41.177.98.167 TCP 76 cvmon > ncube-lm [PSH, ACK] Seq=3889 Ack=10355 Win=65148 Len=18
142748  49.034629 244.3.79.176 -> 41.177.98.167 TCP 128 cvmon > ncube-lm [PSH, ACK] Seq=3907 Ack=10396 Win=65107 Len=70
142820  49.051286 244.3.79.176 -> 41.177.98.167 TCP 225 cvmon > ncube-lm [PSH, ACK] Seq=3977 Ack=10490 Win=65013 Len=167
142836  49.058224 244.3.79.176 -> 41.177.98.167 TCP 85 cvmon > ncube-lm [PSH, ACK] Seq=4144 Ack=10533 Win=65535 Len=27
142842  49.059402 244.3.79.176 -> 41.177.98.167 TCP 76 cvmon > ncube-lm [PSH, ACK] Seq=4171 Ack=10615 Win=65453 Len=18
142845  49.060911 244.3.79.176 -> 41.177.98.167 TCP 128 cvmon > ncube-lm [PSH, ACK] Seq=4189 Ack=10656 Win=65412 Len=70
143041  49.136217 244.3.79.176 -> 41.177.98.220 TCP 125 firefox > ups-onlinet [PSH, ACK] Seq=2953 Ack=3241 Win=65535 Len=67
143047  49.137934 244.3.79.176 -> 41.177.98.220 TCP 124 firefox > ups-onlinet [PSH, ACK] Seq=3020 Ack=3311 Win=65465 Len=66
143050  49.140212 244.3.79.176 -> 41.177.98.220 TCP 129 firefox > ups-onlinet [PSH, ACK] Seq=3086 Ack=3381 Win=65395 Len=71
143059  49.141899 244.3.79.176 -> 41.177.98.220 TCP 594 firefox > ups-onlinet [ACK] Seq=3157 Ack=3451 Win=65325 Len=536
143060  49.141904 244.3.79.176 -> 41.177.98.220 TCP 484 firefox > ups-onlinet [PSH, ACK] Seq=3693 Ack=3451 Win=65325 Len=426
143355  49.258221 244.3.79.176 -> 41.177.98.167 TCP 64 cvmon > ncube-lm [ACK] Seq=4259 Ack=10725 Win=65343 Len=0
143867  49.419244 244.3.79.176 -> 41.177.98.167 TCP 196 cvmon > ncube-lm [PSH, ACK] Seq=4259 Ack=10725 Win=65343 Len=138
143874  49.423456 244.3.79.176 -> 41.177.98.167 TCP 85 cvmon > ncube-lm [PSH, ACK] Seq=4397 Ack=10767 Win=65301 Len=27
143886  49.424389 244.3.79.176 -> 41.177.98.167 TCP 76 cvmon > ncube-lm [PSH, ACK] Seq=4424 Ack=10862 Win=65206 Len=18
143894  49.428136 244.3.79.176 -> 41.177.98.167 TCP 128 cvmon > ncube-lm [PSH, ACK] Seq=4442 Ack=10903 Win=65165 Len=70
143900  49.430084 244.3.79.176 -> 41.177.98.167 TCP 64 cvmon > ncube-lm [ACK] Seq=4512 Ack=12914 Win=65535 Len=0
143903  49.432320 244.3.79.176 -> 41.177.98.167 TCP 178 cvmon > ncube-lm [PSH, ACK] Seq=4512 Ack=13861 Win=65535 Len=120
143917  49.435389 244.3.79.176 -> 41.177.98.167 TCP 85 cvmon > ncube-lm [PSH, ACK] Seq=4632 Ack=13904 Win=65492 Len=27
143928  49.436849 244.3.79.176 -> 41.177.98.167 TCP 76 cvmon > ncube-lm [PSH, ACK] Seq=4659 Ack=13993 Win=65403 Len=18
143943  49.437983 244.3.79.176 -> 41.177.98.167 TCP 128 cvmon > ncube-lm [PSH, ACK] Seq=4677 Ack=14034 Win=65362 Len=70
143951  49.439490 244.3.79.176 -> 41.177.98.167 TCP 198 cvmon > ncube-lm [PSH, ACK] Seq=4747 Ack=14123 Win=65273 Len=140
143973  49.445327 244.3.79.176 -> 41.177.98.167 TCP 85 cvmon > ncube-lm [PSH, ACK] Seq=4887 Ack=14166 Win=65230 Len=27
143977  49.446354 244.3.79.176 -> 41.177.98.167 TCP 76 cvmon > ncube-lm [PSH, ACK] Seq=4914 Ack=14248 Win=65148 Len=18
143979  49.447428 244.3.79.176 -> 41.177.98.167 TCP 128 cvmon > ncube-lm [PSH, ACK] Seq=4932 Ack=14289 Win=65107 Len=70
143988  49.448885 244.3.79.176 -> 41.177.98.167 TCP 225 cvmon > ncube-lm [PSH, ACK] Seq=5002 Ack=14383 Win=65013 Len=167
144023  49.455853 244.3.79.176 -> 41.177.98.167 TCP 85 cvmon > ncube-lm [PSH, ACK] Seq=5169 Ack=14426 Win=65535 Len=27
144030  49.456773 244.3.79.176 -> 41.177.98.167 TCP 76 cvmon > ncube-lm [PSH, ACK] Seq=5196 Ack=14508 Win=65453 Len=18
144040  49.458393 244.3.79.176 -> 41.177.98.167 TCP 128 cvmon > ncube-lm [PSH, ACK] Seq=5214 Ack=14549 Win=65412 Len=70
144414  49.558561 244.3.79.176 -> 41.177.98.220 TCP 64 firefox > ups-onlinet [ACK] Seq=4119 Ack=4469 Win=65535 Len=0
144446  49.563665 244.3.79.176 -> 41.177.98.220 TCP 125 firefox > ups-onlinet [PSH, ACK] Seq=4119 Ack=4469 Win=65535 Len=67
144448  49.565627 244.3.79.176 -> 41.177.98.220 TCP 124 firefox > ups-onlinet [PSH, ACK] Seq=4186 Ack=4539 Win=65465 Len=66
144453  49.568014 244.3.79.176 -> 41.177.98.220 TCP 129 firefox > ups-onlinet [PSH, ACK] Seq=4252 Ack=4609 Win=65395 Len=71
144465  49.569679 244.3.79.176 -> 41.177.98.220 TCP 594 firefox > ups-onlinet [ACK] Seq=4323 Ack=4679 Win=65325 Len=536
144466  49.569723 244.3.79.176 -> 41.177.98.220 TCP 594 firefox > ups-onlinet [ACK] Seq=4859 Ack=4679 Win=65325 Len=536
144467  49.569756 244.3.79.176 -> 41.177.98.220 TCP 546 firefox > ups-onlinet [PSH, ACK] Seq=5395 Ack=4679 Win=65325 Len=488
144791  49.658946 244.3.79.176 -> 41.177.98.167 TCP 64 cvmon > ncube-lm [ACK] Seq=5284 Ack=14618 Win=65343 Len=0
146734  50.365977 244.3.79.176 -> 41.177.98.220 TCP 64 firefox > ups-onlinet [ACK] Seq=5883 Ack=6461 Win=65535 Len=0
146736  50.366620 244.3.79.176 -> 41.177.98.167 TCP 196 cvmon > ncube-lm [PSH, ACK] Seq=5284 Ack=14618 Win=65343 Len=138
146745  50.372904 244.3.79.176 -> 41.177.98.167 TCP 85 cvmon > ncube-lm [PSH, ACK] Seq=5422 Ack=14660 Win=65301 Len=27
146749  50.373870 244.3.79.176 -> 41.177.98.167 TCP 76 cvmon > ncube-lm [PSH, ACK] Seq=5449 Ack=14755 Win=65206 Len=18
146753  50.375071 244.3.79.176 -> 41.177.98.167 TCP 128 cvmon > ncube-lm [PSH, ACK] Seq=5467 Ack=14796 Win=65165 Len=70
146760  50.377144 244.3.79.176 -> 41.177.98.167 TCP 64 cvmon > ncube-lm [ACK] Seq=5537 Ack=16807 Win=65535 Len=0
146767  50.379544 244.3.79.176 -> 41.177.98.167 TCP 178 cvmon > ncube-lm [PSH, ACK] Seq=5537 Ack=17975 Win=65535 Len=120
146779  50.385313 244.3.79.176 -> 41.177.98.167 TCP 85 cvmon > ncube-lm [PSH, ACK] Seq=5657 Ack=18018 Win=65492 Len=27
146781  50.386476 244.3.79.176 -> 41.177.98.167 TCP 76 cvmon > ncube-lm [PSH, ACK] Seq=5684 Ack=18107 Win=65403 Len=18
146783  50.387472 244.3.79.176 -> 41.177.98.167 TCP 128 cvmon > ncube-lm [PSH, ACK] Seq=5702 Ack=18148 Win=65362 Len=70
146785  50.388913 244.3.79.176 -> 41.177.98.167 TCP 198 cvmon > ncube-lm [PSH, ACK] Seq=5772 Ack=18237 Win=65273 Len=140
146792  50.393260 244.3.79.176 -> 41.177.98.167 TCP 85 cvmon > ncube-lm [PSH, ACK] Seq=5912 Ack=18280 Win=65230 Len=27
146795  50.394143 244.3.79.176 -> 41.177.98.167 TCP 76 cvmon > ncube-lm [PSH, ACK] Seq=5939 Ack=18362 Win=65148 Len=18
146800  50.395155 244.3.79.176 -> 41.177.98.167 TCP 128 cvmon > ncube-lm [PSH, ACK] Seq=5957 Ack=18403 Win=65107 Len=70
146929  50.445602 244.3.79.176 -> 41.177.98.167 TCP 225 cvmon > ncube-lm [PSH, ACK] Seq=6027 Ack=18497 Win=65013 Len=167
146935  50.451857 244.3.79.176 -> 41.177.98.167 TCP 85 cvmon > ncube-lm [PSH, ACK] Seq=6194 Ack=18540 Win=65535 Len=27
146937  50.453177 244.3.79.176 -> 41.177.98.167 TCP 76 cvmon > ncube-lm [PSH, ACK] Seq=6221 Ack=18622 Win=65453 Len=18
146944  50.454466 244.3.79.176 -> 41.177.98.167 TCP 128 cvmon > ncube-lm [PSH, ACK] Seq=6239 Ack=18663 Win=65412 Len=70
147329  50.560305 244.3.79.176 -> 41.177.98.220 TCP 125 firefox > ups-onlinet [PSH, ACK] Seq=5883 Ack=6461 Win=65535 Len=67
147336  50.561854 244.3.79.176 -> 41.177.98.167 TCP 64 cvmon > ncube-lm [ACK] Seq=6309 Ack=18821 Win=65254 Len=0
147337  50.562201 244.3.79.176 -> 41.177.98.220 TCP 124 firefox > ups-onlinet [PSH, ACK] Seq=5950 Ack=6531 Win=65465 Len=66
147339  50.564540 244.3.79.176 -> 41.177.98.220 TCP 129 firefox > ups-onlinet [PSH, ACK] Seq=6016 Ack=6601 Win=65395 Len=71
147349  50.566212 244.3.79.176 -> 41.177.98.220 TCP 594 firefox > ups-onlinet [ACK] Seq=6087 Ack=6671 Win=65325 Len=536
147350  50.566258 244.3.79.176 -> 41.177.98.220 TCP 594 firefox > ups-onlinet [ACK] Seq=6623 Ack=6671 Win=65325 Len=536
147351  50.566315 244.3.79.176 -> 41.177.98.220 TCP 594 firefox > ups-onlinet [ACK] Seq=7159 Ack=6671 Win=65325 Len=536
147352  50.566320 244.3.79.176 -> 41.177.98.220 TCP 120 firefox > ups-onlinet [PSH, ACK] Seq=7695 Ack=6671 Win=65325 Len=62
152114  52.116594 244.3.79.176 -> 41.177.98.220 TCP 64 firefox > ups-onlinet [ACK] Seq=7757 Ack=8573 Win=65535 Len=0
153268  52.453664 244.3.79.176 -> 41.177.98.220 TCP 130 rap-listen > ups-onlinet [PSH, ACK] Seq=1607 Ack=26193 Win=65535 Len=72
153817  52.567969 244.3.79.176 -> 41.177.98.220 TCP 64 rap-listen > ups-onlinet [ACK] Seq=1679 Ack=27285 Win=65535 Len=0
171484  56.971599 244.3.79.176 -> 41.177.98.220 TCP 126 rap-listen > ups-onlinet [PSH, ACK] Seq=1679 Ack=27285 Win=65535 Len=68
171810  57.182543 244.3.79.176 -> 41.177.98.220 TCP 64 rap-listen > ups-onlinet [ACK] Seq=1747 Ack=27353 Win=65467 Len=0
172967  57.537378 244.3.79.176 -> 41.177.98.220 TCP 188 rap-listen > ups-onlinet [PSH, ACK] Seq=1747 Ack=27353 Win=65467 Len=130
174129  57.872133 244.3.79.176 -> 41.177.98.220 TCP 64 rap-listen > ups-onlinet [ACK] Seq=1877 Ack=30113 Win=65535 Len=0
174525  57.985134 244.3.79.176 -> 41.177.98.220 TCP 64 rap-listen > ups-onlinet [ACK] Seq=1877 Ack=31456 Win=65535 Len=0
180490  60.787220 244.3.79.176 -> 41.177.98.220 TCP 126 rap-listen > ups-onlinet [PSH, ACK] Seq=1877 Ack=31456 Win=65535 Len=68
180856  60.894289 244.3.79.176 -> 41.177.98.220 TCP 64 rap-listen > ups-onlinet [ACK] Seq=1945 Ack=31524 Win=65467 Len=0
186118  62.413130 244.3.79.176 -> 41.177.98.220 TCP 126 rap-listen > ups-onlinet [PSH, ACK] Seq=1945 Ack=31524 Win=65467 Len=68
186485  62.599687 244.3.79.176 -> 41.177.98.220 TCP 64 rap-listen > ups-onlinet [ACK] Seq=2013 Ack=31666 Win=65325 Len=0
187190  63.209370 244.3.79.176 -> 41.177.98.220 TCP 131 rap-listen > ups-onlinet [PSH, ACK] Seq=2013 Ack=31666 Win=65325 Len=73
187504  63.402208 244.3.79.176 -> 41.177.98.220 TCP 64 rap-listen > ups-onlinet [ACK] Seq=2086 Ack=32717 Win=65535 Len=0
214933  73.763311 244.3.79.176 -> 41.177.98.220 TCP 594 rap-listen > ups-onlinet [ACK] Seq=2086 Ack=32717 Win=65535 Len=536
214934  73.763315 244.3.79.176 -> 41.177.98.220 TCP 435 rap-listen > ups-onlinet [PSH, ACK] Seq=2622 Ack=32717 Win=65535 Len=377
214990  73.792825 244.3.79.176 -> 41.177.98.220 TCP 133 rap-listen > ups-onlinet [PSH, ACK] Seq=2999 Ack=33647 Win=65535 Len=75
215002  73.799420 244.3.79.176 -> 41.177.98.220 TCP 594 rap-listen > ups-onlinet [ACK] Seq=3074 Ack=33736 Win=65446 Len=536
215003  73.799424 244.3.79.176 -> 41.177.98.220 TCP 479 rap-listen > ups-onlinet [PSH, ACK] Seq=3610 Ack=33736 Win=65446 Len=421
215694  74.035746 244.3.79.176 -> 41.177.98.220 TCP 64 rap-listen > ups-onlinet [ACK] Seq=4031 Ack=34751 Win=65535 Len=0
221306  75.858711 244.3.79.176 -> 41.177.98.167 TCP 196 snaresecure > ncube-lm [PSH, ACK] Seq=1828 Ack=2859 Win=65101 Len=138
221309  75.864701 244.3.79.176 -> 41.177.98.167 TCP 85 snaresecure > ncube-lm [PSH, ACK] Seq=1966 Ack=2901 Win=65059 Len=27
221315  75.865586 244.3.79.176 -> 41.177.98.167 TCP 76 snaresecure > ncube-lm [PSH, ACK] Seq=1993 Ack=2996 Win=65535 Len=18
221324  75.866644 244.3.79.176 -> 41.177.98.167 TCP 128 snaresecure > ncube-lm [PSH, ACK] Seq=2011 Ack=3037 Win=65494 Len=70
221349  75.868330 244.3.79.176 -> 41.177.98.167 TCP 64 snaresecure > ncube-lm [ACK] Seq=2081 Ack=4814 Win=65535 Len=0
221353  75.869796 244.3.79.176 -> 41.177.98.167 TCP 198 snaresecure > ncube-lm [PSH, ACK] Seq=2081 Ack=4814 Win=65535 Len=140
221358  75.872998 244.3.79.176 -> 41.177.98.167 TCP 85 snaresecure > ncube-lm [PSH, ACK] Seq=2221 Ack=4857 Win=65492 Len=27
221360  75.873849 244.3.79.176 -> 41.177.98.167 TCP 76 snaresecure > ncube-lm [PSH, ACK] Seq=2248 Ack=4939 Win=65410 Len=18
221362  75.874845 244.3.79.176 -> 41.177.98.167 TCP 128 snaresecure > ncube-lm [PSH, ACK] Seq=2266 Ack=4980 Win=65369 Len=70
221367  75.876140 244.3.79.176 -> 41.177.98.167 TCP 225 snaresecure > ncube-lm [PSH, ACK] Seq=2336 Ack=5074 Win=65275 Len=167
221374  75.879801 244.3.79.176 -> 41.177.98.167 TCP 85 snaresecure > ncube-lm [PSH, ACK] Seq=2503 Ack=5117 Win=65232 Len=27
221376  75.880960 244.3.79.176 -> 41.177.98.167 TCP 76 snaresecure > ncube-lm [PSH, ACK] Seq=2530 Ack=5199 Win=65150 Len=18
221381  75.882059 244.3.79.176 -> 41.177.98.167 TCP 128 snaresecure > ncube-lm [PSH, ACK] Seq=2548 Ack=5240 Win=65109 Len=70
221968  76.042212 244.3.79.176 -> 41.177.98.167 TCP 64 snaresecure > ncube-lm [ACK] Seq=2618 Ack=5356 Win=65535 Len=0
239978  83.317789 244.3.79.176 -> 41.177.98.220 TCP 157 rap-listen > ups-onlinet [PSH, ACK] Seq=4031 Ack=34751 Win=65535 Len=99
240766  83.641561 244.3.79.176 -> 41.177.98.220 TCP 64 rap-listen > ups-onlinet [ACK] Seq=4130 Ack=37511 Win=65535 Len=0
240926  83.766419 244.3.79.176 -> 41.177.98.220 TCP 64 rap-listen > ups-onlinet [ACK] Seq=4130 Ack=38851 Win=65535 Len=0
246039  86.096877 244.3.79.176 -> 41.177.98.220 TCP 130 rap-listen > ups-onlinet [PSH, ACK] Seq=4130 Ack=38851 Win=65535 Len=72
246061  86.115268 244.3.79.176 -> 41.177.98.220 TCP 132 rap-listen > ups-onlinet [PSH, ACK] Seq=4202 Ack=39170 Win=65216 Len=74
246512  86.374670 244.3.79.176 -> 41.177.98.220 TCP 64 rap-listen > ups-onlinet [ACK] Seq=4276 Ack=40484 Win=65535 Len=0
255797  90.871779 244.3.79.176 -> 41.177.98.220 TCP 157 rap-listen > ups-onlinet [PSH, ACK] Seq=4276 Ack=40484 Win=65535 Len=99
256171  91.076469 244.3.79.176 -> 41.177.98.220 TCP 64 rap-listen > ups-onlinet [ACK] Seq=4375 Ack=43244 Win=65535 Len=0
256356  91.189869 244.3.79.176 -> 41.177.98.220 TCP 64 rap-listen > ups-onlinet [ACK] Seq=4375 Ack=44584 Win=65535 Len=0
259372  91.750417 244.3.79.176 -> 41.177.98.220 TCP 122 rap-listen > ups-onlinet [PSH, ACK] Seq=4375 Ack=44584 Win=65535 Len=64
262693  91.892110 244.3.79.176 -> 41.177.98.220 TCP 64 rap-listen > ups-onlinet [ACK] Seq=4439 Ack=44815 Win=65304 Len=0
278305  94.013428 244.3.79.176 -> 41.177.98.220 TCP 122 rap-listen > ups-onlinet [PSH, ACK] Seq=4439 Ack=44815 Win=65304 Len=64
279154  94.199250 244.3.79.176 -> 41.177.98.220 TCP 64 rap-listen > ups-onlinet [ACK] Seq=4503 Ack=45047 Win=65072 Len=0
284987  95.337036 244.3.79.176 -> 41.177.98.220 TCP 133 rap-listen > ups-onlinet [PSH, ACK] Seq=4503 Ack=45047 Win=65072 Len=75
285911  95.603789 244.3.79.176 -> 41.177.98.220 TCP 64 rap-listen > ups-onlinet [ACK] Seq=4578 Ack=45950 Win=65535 Len=0
315019 107.546697 244.3.79.176 -> 41.177.98.220 TCP 157 rap-listen > ups-onlinet [PSH, ACK] Seq=4578 Ack=45950 Win=65535 Len=99
315563 107.781276 244.3.79.176 -> 41.177.98.220 TCP 64 rap-listen > ups-onlinet [ACK] Seq=4677 Ack=48710 Win=65535 Len=0
316239 107.942650 244.3.79.176 -> 41.177.98.220 TCP 64 rap-listen > ups-onlinet [ACK] Seq=4677 Ack=50050 Win=65535 Len=0
317459 108.321684 244.3.79.176 -> 41.177.98.220 TCP 130 rap-listen > ups-onlinet [PSH, ACK] Seq=4677 Ack=50050 Win=65535 Len=72
317499 108.337787 244.3.79.176 -> 41.177.98.220 TCP 132 rap-listen > ups-onlinet [PSH, ACK] Seq=4749 Ack=50369 Win=65216 Len=74
318311 108.544593 244.3.79.176 -> 41.177.98.220 TCP 64 rap-listen > ups-onlinet [ACK] Seq=4823 Ack=51683 Win=65535 Len=0
328426 113.903948 244.3.79.176 -> 41.177.98.220 TCP 594 rap-listen > ups-onlinet [ACK] Seq=4823 Ack=51683 Win=65535 Len=536
328427 113.903982 244.3.79.176 -> 41.177.98.220 TCP 543 rap-listen > ups-onlinet [PSH, ACK] Seq=5359 Ack=51683 Win=65535 Len=485
328473 113.942622 244.3.79.176 -> 41.177.98.220 TCP 594 rap-listen > ups-onlinet [ACK] Seq=5844 Ack=52721 Win=65535 Len=536
328474 113.942657 244.3.79.176 -> 41.177.98.220 TCP 561 rap-listen > ups-onlinet [PSH, ACK] Seq=6380 Ack=52721 Win=65535 Len=503
328482 113.953450 244.3.79.176 -> 41.177.98.220 TCP 594 rap-listen > ups-onlinet [ACK] Seq=6883 Ack=52801 Win=65455 Len=536
328483 113.953501 244.3.79.176 -> 41.177.98.220 TCP 594 rap-listen > ups-onlinet [ACK] Seq=7419 Ack=52801 Win=65455 Len=536
328484 113.953506 244.3.79.176 -> 41.177.98.220 TCP 72 rap-listen > ups-onlinet [PSH, ACK] Seq=7955 Ack=52801 Win=65455 Len=14
329302 114.663885 244.3.79.176 -> 41.177.98.220 TCP 64 rap-listen > ups-onlinet [ACK] Seq=7969 Ack=53995 Win=65535 Len=0
330164 114.986692 244.3.79.176 -> 41.177.98.220 TCP 157 rap-listen > ups-onlinet [PSH, ACK] Seq=7969 Ack=53995 Win=65535 Len=99
330848 115.190995 244.3.79.176 -> 41.177.98.220 TCP 64 rap-listen > ups-onlinet [ACK] Seq=8068 Ack=56755 Win=65535 Len=0
331146 115.366021 244.3.79.176 -> 41.177.98.220 TCP 64 rap-listen > ups-onlinet [ACK] Seq=8068 Ack=58095 Win=65535 Len=0
335158 117.196721 244.3.79.176 -> 41.177.98.220 TCP 126 rap-listen > ups-onlinet [PSH, ACK] Seq=8068 Ack=58095 Win=65535 Len=68
335456 117.372393 244.3.79.176 -> 41.177.98.220 TCP 64 rap-listen > ups-onlinet [ACK] Seq=8136 Ack=58163 Win=65467 Len=0
352192 119.339053 244.3.79.176 -> 41.177.98.220 TCP 126 rap-listen > ups-onlinet [PSH, ACK] Seq=8136 Ack=58163 Win=65467 Len=68
352411 119.479063 244.3.79.176 -> 41.177.98.220 TCP 64 rap-listen > ups-onlinet [ACK] Seq=8204 Ack=58300 Win=65330 Len=0
353359 120.102737 244.3.79.176 -> 41.177.98.220 TCP 131 rap-listen > ups-onlinet [PSH, ACK] Seq=8204 Ack=58300 Win=65330 Len=73
353579 120.281616 244.3.79.176 -> 41.177.98.220 TCP 64 rap-listen > ups-onlinet [ACK] Seq=8277 Ack=58943 Win=65535 Len=0
392899 131.399266 244.3.79.176 -> 41.177.98.220 TCP 531 rap-listen > ups-onlinet [PSH, ACK] Seq=8277 Ack=58943 Win=65535 Len=473
392926 131.415001 244.3.79.176 -> 41.177.98.220 TCP 133 rap-listen > ups-onlinet [PSH, ACK] Seq=8750 Ack=59433 Win=65045 Len=75
392937 131.421526 244.3.79.176 -> 41.177.98.220 TCP 575 rap-listen > ups-onlinet [PSH, ACK] Seq=8825 Ack=59522 Win=65535 Len=517
393436 131.617372 244.3.79.176 -> 41.177.98.220 TCP 64 rap-listen > ups-onlinet [ACK] Seq=9342 Ack=60091 Win=65535 Len=0
396596 133.002054 244.3.79.176 -> 41.177.98.167 TCP 196 snaresecure > ncube-lm [PSH, ACK] Seq=2618 Ack=5356 Win=65535 Len=138
396605 133.020738 244.3.79.176 -> 41.177.98.167 TCP 85 snaresecure > ncube-lm [PSH, ACK] Seq=2756 Ack=5399 Win=65492 Len=27
396607 133.021695 244.3.79.176 -> 41.177.98.167 TCP 76 snaresecure > ncube-lm [PSH, ACK] Seq=2783 Ack=5494 Win=65397 Len=18
396682 133.036866 244.3.79.176 -> 41.177.98.167 TCP 128 snaresecure > ncube-lm [PSH, ACK] Seq=2801 Ack=5535 Win=65356 Len=70
396685 133.042982 244.3.79.176 -> 41.177.98.167 TCP 198 snaresecure > ncube-lm [PSH, ACK] Seq=2871 Ack=6429 Win=65535 Len=140
396699 133.062585 244.3.79.176 -> 41.177.98.167 TCP 85 snaresecure > ncube-lm [PSH, ACK] Seq=3011 Ack=6472 Win=65492 Len=27
396709 133.065690 244.3.79.176 -> 41.177.98.167 TCP 76 snaresecure > ncube-lm [PSH, ACK] Seq=3038 Ack=6554 Win=65410 Len=18
396714 133.066819 244.3.79.176 -> 41.177.98.167 TCP 128 snaresecure > ncube-lm [PSH, ACK] Seq=3056 Ack=6595 Win=65369 Len=70
396729 133.068755 244.3.79.176 -> 41.177.98.167 TCP 225 snaresecure > ncube-lm [PSH, ACK] Seq=3126 Ack=6689 Win=65275 Len=167
396760 133.084186 244.3.79.176 -> 41.177.98.167 TCP 85 snaresecure > ncube-lm [PSH, ACK] Seq=3293 Ack=6732 Win=65232 Len=27
396763 133.085084 244.3.79.176 -> 41.177.98.167 TCP 76 snaresecure > ncube-lm [PSH, ACK] Seq=3320 Ack=6814 Win=65150 Len=18
396766 133.086088 244.3.79.176 -> 41.177.98.167 TCP 128 snaresecure > ncube-lm [PSH, ACK] Seq=3338 Ack=6855 Win=65109 Len=70
396939 133.223737 244.3.79.176 -> 41.177.98.167 TCP 64 snaresecure > ncube-lm [ACK] Seq=3408 Ack=6984 Win=65535 Len=0
410274 136.968980 244.3.79.176 -> 41.177.98.220 TCP 155 rap-listen > ups-onlinet [PSH, ACK] Seq=9342 Ack=60091 Win=65535 Len=97
412045 137.277619 244.3.79.176 -> 41.177.98.220 TCP 64 rap-listen > ups-onlinet [ACK] Seq=9439 Ack=62851 Win=65535 Len=0
412368 137.435611 244.3.79.176 -> 41.177.98.220 TCP 64 rap-listen > ups-onlinet [ACK] Seq=9439 Ack=63735 Win=65535 Len=0
422457 139.317118 244.3.79.176 -> 41.177.98.220 TCP 130 rap-listen > ups-onlinet [PSH, ACK] Seq=9439 Ack=63735 Win=65535 Len=72
424858 139.542340 244.3.79.176 -> 41.177.98.220 TCP 64 rap-listen > ups-onlinet [ACK] Seq=9511 Ack=64732 Win=65535 Len=0
442114 143.937303 244.3.79.176 -> 41.177.98.220 TCP 126 rap-listen > ups-onlinet [PSH, ACK] Seq=9511 Ack=64732 Win=65535 Len=68
442428 144.056611 244.3.79.176 -> 41.177.98.220 TCP 64 rap-listen > ups-onlinet [ACK] Seq=9579 Ack=64800 Win=65467 Len=0
443127 144.250346 244.3.79.176 -> 41.177.98.220 TCP 155 rap-listen > ups-onlinet [PSH, ACK] Seq=9579 Ack=64800 Win=65467 Len=97
444014 144.538158 244.3.79.176 -> 41.177.98.220 TCP 64 rap-listen > ups-onlinet [ACK] Seq=9676 Ack=67560 Win=65535 Len=0
444368 144.658555 244.3.79.176 -> 41.177.98.220 TCP 64 rap-listen > ups-onlinet [ACK] Seq=9676 Ack=68802 Win=65535 Len=0
448226 145.623191 244.3.79.176 -> 41.177.98.220 TCP 126 rap-listen > ups-onlinet [PSH, ACK] Seq=9676 Ack=68802 Win=65535 Len=68
448661 145.761983 244.3.79.176 -> 41.177.98.220 TCP 64 rap-listen > ups-onlinet [ACK] Seq=9744 Ack=68870 Win=65467 Len=0
452589 147.410092 244.3.79.176 -> 41.177.98.220 TCP 126 rap-listen > ups-onlinet [PSH, ACK] Seq=9744 Ack=68870 Win=65467 Len=68
452884 147.567671 244.3.79.176 -> 41.177.98.220 TCP 64 rap-listen > ups-onlinet [ACK] Seq=9812 Ack=69023 Win=65314 Len=0
454183 148.180456 244.3.79.176 -> 41.177.98.220 TCP 131 rap-listen > ups-onlinet [PSH, ACK] Seq=9812 Ack=69023 Win=65314 Len=73
454572 148.370218 244.3.79.176 -> 41.177.98.220 TCP 64 rap-listen > ups-onlinet [ACK] Seq=9885 Ack=69791 Win=65535 Len=0
468358 154.482658 244.3.79.176 -> 41.177.98.220 TCP 594 rap-listen > ups-onlinet [ACK] Seq=9885 Ack=69791 Win=65535 Len=536
468359 154.482662 244.3.79.176 -> 41.177.98.220 TCP 113 rap-listen > ups-onlinet [PSH, ACK] Seq=10421 Ack=69791 Win=65535 Len=55
468402 154.503700 244.3.79.176 -> 41.177.98.220 TCP 133 rap-listen > ups-onlinet [PSH, ACK] Seq=10476 Ack=70399 Win=65535 Len=75
468437 154.510803 244.3.79.176 -> 41.177.98.220 TCP 594 rap-listen > ups-onlinet [ACK] Seq=10551 Ack=70488 Win=65446 Len=536
468438 154.510808 244.3.79.176 -> 41.177.98.220 TCP 157 rap-listen > ups-onlinet [PSH, ACK] Seq=11087 Ack=70488 Win=65446 Len=99
469123 154.790460 244.3.79.176 -> 41.177.98.220 TCP 64 rap-listen > ups-onlinet [ACK] Seq=11186 Ack=71189 Win=65535 Len=0
471860 155.821103 244.3.79.176 -> 41.177.98.167 TCP 196 snaresecure > ncube-lm [PSH, ACK] Seq=3408 Ack=6984 Win=65535 Len=138
471875 155.826363 244.3.79.176 -> 41.177.98.167 TCP 85 snaresecure > ncube-lm [PSH, ACK] Seq=3546 Ack=7027 Win=65492 Len=27
471883 155.827257 244.3.79.176 -> 41.177.98.167 TCP 76 snaresecure > ncube-lm [PSH, ACK] Seq=3573 Ack=7122 Win=65397 Len=18
471893 155.828387 244.3.79.176 -> 41.177.98.167 TCP 128 snaresecure > ncube-lm [PSH, ACK] Seq=3591 Ack=7163 Win=65356 Len=70
471905 155.830946 244.3.79.176 -> 41.177.98.167 TCP 198 snaresecure > ncube-lm [PSH, ACK] Seq=3661 Ack=8294 Win=65535 Len=140
471922 155.834268 244.3.79.176 -> 41.177.98.167 TCP 85 snaresecure > ncube-lm [PSH, ACK] Seq=3801 Ack=8337 Win=65492 Len=27
471939 155.835217 244.3.79.176 -> 41.177.98.167 TCP 76 snaresecure > ncube-lm [PSH, ACK] Seq=3828 Ack=8419 Win=65410 Len=18
471945 155.836193 244.3.79.176 -> 41.177.98.167 TCP 128 snaresecure > ncube-lm [PSH, ACK] Seq=3846 Ack=8460 Win=65369 Len=70
471949 155.837517 244.3.79.176 -> 41.177.98.167 TCP 225 snaresecure > ncube-lm [PSH, ACK] Seq=3916 Ack=8554 Win=65275 Len=167
471980 155.845187 244.3.79.176 -> 41.177.98.167 TCP 85 snaresecure > ncube-lm [PSH, ACK] Seq=4083 Ack=8597 Win=65232 Len=27
471983 155.846183 244.3.79.176 -> 41.177.98.167 TCP 76 snaresecure > ncube-lm [PSH, ACK] Seq=4110 Ack=8679 Win=65150 Len=18
471985 155.847416 244.3.79.176 -> 41.177.98.167 TCP 128 snaresecure > ncube-lm [PSH, ACK] Seq=4128 Ack=8720 Win=65109 Len=70
471998 155.859639 244.3.79.176 -> 41.177.98.167 TCP 208 snaresecure > ncube-lm [PSH, ACK] Seq=4198 Ack=8849 Win=65535 Len=150
472020 155.866029 244.3.79.176 -> 41.177.98.167 TCP 85 snaresecure > ncube-lm [PSH, ACK] Seq=4348 Ack=8892 Win=65492 Len=27
472025 155.866875 244.3.79.176 -> 41.177.98.167 TCP 76 snaresecure > ncube-lm [PSH, ACK] Seq=4375 Ack=8944 Win=65440 Len=18
472029 155.867901 244.3.79.176 -> 41.177.98.167 TCP 114 snaresecure > ncube-lm [PSH, ACK] Seq=4393 Ack=8985 Win=65399 Len=56
472050 155.870913 244.3.79.176 -> 41.177.98.167 TCP 200 snaresecure > ncube-lm [PSH, ACK] Seq=4449 Ack=9054 Win=65330 Len=142
472080 155.874471 244.3.79.176 -> 41.177.98.167 TCP 85 snaresecure > ncube-lm [PSH, ACK] Seq=4591 Ack=9096 Win=65288 Len=27
472092 155.875284 244.3.79.176 -> 41.177.98.167 TCP 76 snaresecure > ncube-lm [PSH, ACK] Seq=4618 Ack=9148 Win=65236 Len=18
472095 155.876259 244.3.79.176 -> 41.177.98.167 TCP 114 snaresecure > ncube-lm [PSH, ACK] Seq=4636 Ack=9189 Win=65195 Len=56
472222 155.894445 244.3.79.176 -> 41.177.98.167 TCP 205 snaresecure > ncube-lm [PSH, ACK] Seq=4692 Ack=9342 Win=65042 Len=147
472237 155.897667 244.3.79.176 -> 41.177.98.167 TCP 85 snaresecure > ncube-lm [PSH, ACK] Seq=4839 Ack=9385 Win=65535 Len=27
472243 155.898527 244.3.79.176 -> 41.177.98.167 TCP 76 snaresecure > ncube-lm [PSH, ACK] Seq=4866 Ack=9481 Win=65439 Len=18
