50355  20.498056  244.3.31.33 -> 41.177.98.98 TCP 225 ndmp > 41008 [PSH, ACK] Seq=1 Ack=360 Win=49640 Len=167[Packet size limited during capture]
241269  83.987171  244.3.31.33 -> 41.177.98.98 TCP 225 ndmp > 41008 [PSH, ACK] Seq=168 Ack=747 Win=49640 Len=167[Packet size limited during capture]
375757 126.504478  244.3.31.33 -> 41.177.98.98 TCP 70 ndmp > 41210 [SYN, ACK] Seq=0 Ack=1 Win=49640 Len=0 MSS=1460 WS=1 SACK_PERM=1
375779 126.504990  244.3.31.33 -> 41.177.98.98 TCP 64 ndmp > 41210 [ACK] Seq=1 Ack=139 Win=49502 Len=0
381529 126.985193  244.3.31.33 -> 41.177.98.98 TCP 161 ndmp > 41210 [PSH, ACK] Seq=1 Ack=139 Win=49640 Len=103[Packet size limited during capture]
381532 126.986575  244.3.31.33 -> 41.177.98.98 TCP 64 ndmp > 41210 [ACK] Seq=104 Ack=331 Win=49640 Len=0
381870 127.131615  244.3.31.33 -> 41.177.98.98 TCP 126 ndmp > 41210 [PSH, ACK] Seq=104 Ack=331 Win=49640 Len=68[Packet size limited during capture]
390341 130.433557  244.3.31.33 -> 41.177.98.98 TCP 126 ndmp > 41210 [PSH, ACK] Seq=172 Ack=523 Win=49640 Len=68[Packet size limited during capture]
396726 133.067266  244.3.31.33 -> 41.177.98.98 TCP 129 ndmp > 41210 [PSH, ACK] Seq=240 Ack=718 Win=49640 Len=71[Packet size limited during capture]
397330 133.501744  244.3.31.33 -> 41.177.98.98 TCP 1288 ndmp > 41210 [PSH, ACK] Seq=311 Ack=913 Win=49640 Len=1230[Packet size limited during capture]
397534 133.680702  244.3.31.33 -> 41.177.98.98 TCP 128 ndmp > 41210 [PSH, ACK] Seq=1541 Ack=1107 Win=49640 Len=70[Packet size limited during capture]
