18730   5.977763 244.3.153.117 -> 244.3.64.12  UDP 124 Source port: 53590  Destination port: snmp
18732   5.978076 244.3.153.117 -> 244.3.64.71  UDP 124 Source port: 53590  Destination port: snmp
36418  15.135449 244.3.153.117 -> 244.3.39.242 UDP 124 Source port: 53590  Destination port: snmp
50996  20.926693 244.3.153.117 -> 41.177.24.241 TCP 70 49376 > imaps [SYN] Seq=0 Win=8192 Len=0 MSS=1150 WS=4 SACK_PERM=1
51002  20.931368 244.3.153.117 -> 41.177.24.241 TCP 64 49376 > imaps [ACK] Seq=1 Ack=1 Win=65548 Len=0
51587  21.203184 244.3.153.117 -> 41.177.24.241 TCP 64 49376 > imaps [ACK] Seq=226 Ack=456 Win=65092 Len=0
61730  25.245879 244.3.153.117 -> 244.3.39.242 UDP 124 Source port: 53590  Destination port: snmp
68313  28.129107 244.3.153.117 -> 41.177.24.241 TCP 64 49376 > imaps [ACK] Seq=906 Ack=2870 Win=65100 Len=0
92388  35.383405 244.3.153.117 -> 244.3.39.242 UDP 124 Source port: 53590  Destination port: snmp
96349  36.206746 244.3.153.117 -> 41.177.24.241 TCP 70 49379 > xmpp-client [SYN] Seq=0 Win=49152 Len=0 MSS=1150 WS=4 SACK_PERM=1
96354  36.209760 244.3.153.117 -> 41.177.24.241 TCP 64 49379 > xmpp-client [ACK] Seq=1 Ack=1 Win=49152 Len=0
96372  36.211938 244.3.153.117 -> 41.177.24.241 TCP 258 49379 > xmpp-client [PSH, ACK] Seq=1 Ack=1 Win=49152 Len=200[Packet size limited during capture]
96413  36.225404 244.3.153.117 -> 41.177.24.241 TCP 64 49379 > xmpp-client [ACK] Seq=201 Ack=365 Win=48788 Len=0
96446  36.232685 244.3.153.117 -> 41.177.24.241 TCP 109 49379 > xmpp-client [PSH, ACK] Seq=201 Ack=365 Win=48788 Len=51[Packet size limited during capture]
97004  36.428358 244.3.153.117 -> 41.177.24.241 TCP 64 49379 > xmpp-client [ACK] Seq=252 Ack=415 Win=48736 Len=0
103430  37.613567 244.3.153.117 -> 41.177.24.241 TCP 182 49379 > xmpp-client [PSH, ACK] Seq=252 Ack=415 Win=48736 Len=124[Packet size limited during capture]
103469  37.618530 244.3.153.117 -> 41.177.24.241 TCP 64 49379 > xmpp-client [ACK] Seq=376 Ack=2715 Win=49152 Len=0
103527  37.622653 244.3.153.117 -> 41.177.24.241 TCP 64 49379 > xmpp-client [ACK] Seq=376 Ack=4249 Win=49152 Len=0
103530  37.623093 244.3.153.117 -> 41.177.24.241 TCP 384 49379 > xmpp-client [PSH, ACK] Seq=376 Ack=4249 Win=49152 Len=326[Packet size limited during capture]
104290  37.732049 244.3.153.117 -> 41.177.24.241 TCP 324 49379 > xmpp-client [PSH, ACK] Seq=702 Ack=4308 Win=49092 Len=266[Packet size limited during capture]
104311  37.739045 244.3.153.117 -> 41.177.24.241 TCP 64 49379 > xmpp-client [ACK] Seq=968 Ack=4744 Win=48656 Len=0
104313  37.740129 244.3.153.117 -> 41.177.24.241 TCP 228 49379 > xmpp-client [PSH, ACK] Seq=968 Ack=4744 Win=48656 Len=170[Packet size limited during capture]
107659  38.713898 244.3.153.117 -> 41.177.24.241 TCP 324 49379 > xmpp-client [PSH, ACK] Seq=1138 Ack=4866 Win=48532 Len=266[Packet size limited during capture]
107696  38.723338 244.3.153.117 -> 41.177.24.241 TCP 64 49379 > xmpp-client [ACK] Seq=1404 Ack=5302 Win=48096 Len=0
107705  38.726394 244.3.153.117 -> 41.177.24.241 TCP 260 49379 > xmpp-client [PSH, ACK] Seq=1404 Ack=5302 Win=48096 Len=202[Packet size limited during capture]
107787  38.755642 244.3.153.117 -> 41.177.24.241 TCP 244 49379 > xmpp-client [PSH, ACK] Seq=1606 Ack=5504 Win=49152 Len=186[Packet size limited during capture]
108099  38.862663 244.3.153.117 -> 41.177.24.241 TCP 212 49379 > xmpp-client [PSH, ACK] Seq=1792 Ack=5690 Win=48964 Len=154[Packet size limited during capture]
108170  38.905849 244.3.153.117 -> 41.177.24.241 TCP 64 49379 > xmpp-client [ACK] Seq=1946 Ack=7492 Win=49152 Len=0
108319  38.973596 244.3.153.117 -> 41.177.24.241 TCP 324 49379 > xmpp-client [PSH, ACK] Seq=1946 Ack=7492 Win=49152 Len=266[Packet size limited during capture]
108508  39.030227 244.3.153.117 -> 41.177.24.241 TCP 740 49379 > xmpp-client [PSH, ACK] Seq=2212 Ack=7806 Win=48836 Len=682[Packet size limited during capture]
108525  39.033651 244.3.153.117 -> 41.177.24.241 TCP 64 49379 > xmpp-client [ACK] Seq=2894 Ack=8434 Win=48208 Len=0
108547  39.039308 244.3.153.117 -> 41.177.24.241 TCP 64 49379 > xmpp-client [ACK] Seq=2894 Ack=9142 Win=49152 Len=0
108553  39.040860 244.3.153.117 -> 41.177.24.241 TCP 64 49379 > xmpp-client [ACK] Seq=2894 Ack=10026 Win=48268 Len=0
108585  39.046776 244.3.153.117 -> 41.177.24.241 TCP 64 49379 > xmpp-client [ACK] Seq=2894 Ack=10766 Win=49152 Len=0
108602  39.050770 244.3.153.117 -> 41.177.24.241 TCP 64 49379 > xmpp-client [ACK] Seq=2894 Ack=11618 Win=48300 Len=0
108619  39.056193 244.3.153.117 -> 41.177.24.241 TCP 64 49379 > xmpp-client [ACK] Seq=2894 Ack=12326 Win=49152 Len=0
108621  39.056592 244.3.153.117 -> 41.177.24.241 TCP 64 49379 > xmpp-client [ACK] Seq=2894 Ack=12986 Win=48492 Len=0
108637  39.060476 244.3.153.117 -> 41.177.24.241 TCP 64 49379 > xmpp-client [ACK] Seq=2894 Ack=13678 Win=49152 Len=0
108650  39.063772 244.3.153.117 -> 41.177.24.241 TCP 308 49379 > xmpp-client [PSH, ACK] Seq=2894 Ack=14088 Win=48740 Len=250[Packet size limited during capture]
108664  39.066069 244.3.153.117 -> 41.177.24.241 TCP 64 49379 > xmpp-client [ACK] Seq=3144 Ack=14748 Win=48080 Len=0
108704  39.072393 244.3.153.117 -> 41.177.24.241 TCP 64 49379 > xmpp-client [ACK] Seq=3144 Ack=15360 Win=49152 Len=0
108713  39.072738 244.3.153.117 -> 41.177.24.241 TCP 64 49379 > xmpp-client [ACK] Seq=3144 Ack=16068 Win=48444 Len=0
108716  39.073557 244.3.153.117 -> 41.177.24.241 TCP 64 49379 > xmpp-client [ACK] Seq=3144 Ack=16632 Win=49152 Len=0
108755  39.080551 244.3.153.117 -> 41.177.24.241 TCP 64 49379 > xmpp-client [ACK] Seq=3144 Ack=17676 Win=48108 Len=0
108821  39.098383 244.3.153.117 -> 41.177.24.241 TCP 64 49379 > xmpp-client [ACK] Seq=3144 Ack=18592 Win=49152 Len=0
108827  39.099206 244.3.153.117 -> 41.177.24.241 TCP 64 49379 > xmpp-client [ACK] Seq=3144 Ack=19028 Win=48716 Len=0
109047  39.179621 244.3.153.117 -> 41.177.24.241 TCP 64 49379 > xmpp-client [ACK] Seq=3144 Ack=19464 Win=48280 Len=0
109282  39.225163 244.3.153.117 -> 41.177.24.241 TCP 676 49379 > xmpp-client [PSH, ACK] Seq=3144 Ack=19464 Win=48280 Len=618[Packet size limited during capture]
109431  39.276222 244.3.153.117 -> 41.177.24.241 TCP 1208 49379 > xmpp-client [PSH, ACK] Seq=3762 Ack=19464 Win=48280 Len=1150[Packet size limited during capture]
109433  39.276708 244.3.153.117 -> 41.177.24.241 TCP 1208 49379 > xmpp-client [ACK] Seq=4912 Ack=19464 Win=48280 Len=1150[Packet size limited during capture]
109436  39.277052 244.3.153.117 -> 41.177.24.241 TCP 1208 49379 > xmpp-client [ACK] Seq=6062 Ack=19464 Win=48280 Len=1150[Packet size limited during capture]
109439  39.277554 244.3.153.117 -> 41.177.24.241 TCP 1208 49379 > xmpp-client [ACK] Seq=7212 Ack=19464 Win=48280 Len=1150[Packet size limited during capture]
109446  39.279546 244.3.153.117 -> 41.177.24.241 TCP 1208 49379 > xmpp-client [ACK] Seq=8362 Ack=19464 Win=48280 Len=1150[Packet size limited during capture]
109447  39.279566 244.3.153.117 -> 41.177.24.241 TCP 216 49379 > xmpp-client [PSH, ACK] Seq=9512 Ack=19464 Win=48280 Len=158[Packet size limited during capture]
109457  39.283557 244.3.153.117 -> 41.177.24.241 TCP 1208 49379 > xmpp-client [ACK] Seq=9670 Ack=19464 Win=48280 Len=1150[Packet size limited during capture]
109459  39.283590 244.3.153.117 -> 41.177.24.241 TCP 406 49379 > xmpp-client [PSH, ACK] Seq=10820 Ack=19464 Win=48280 Len=348[Packet size limited during capture]
109496  39.288733 244.3.153.117 -> 41.177.24.241 TCP 996 49379 > xmpp-client [PSH, ACK] Seq=11168 Ack=19464 Win=48280 Len=938[Packet size limited during capture]
111023  39.693411 244.3.153.117 -> 41.177.24.241 TCP 64 49379 > xmpp-client [ACK] Seq=12106 Ack=21260 Win=49152 Len=0
112111  39.995294 244.3.153.117 -> 41.177.24.241 TCP 64 49379 > xmpp-client [ACK] Seq=12106 Ack=21654 Win=48756 Len=0
114012  40.621132 244.3.153.117 -> 41.177.24.241 TCP 64 49379 > xmpp-client [ACK] Seq=12106 Ack=22826 Win=49152 Len=0
114028  40.630162 244.3.153.117 -> 41.177.24.241 TCP 64 49379 > xmpp-client [ACK] Seq=12106 Ack=24638 Win=49152 Len=0
114085  40.647315 244.3.153.117 -> 41.177.24.241 TCP 64 49379 > xmpp-client [ACK] Seq=12106 Ack=26018 Win=49152 Len=0
114087  40.647528 244.3.153.117 -> 41.177.24.241 TCP 64 49379 > xmpp-client [ACK] Seq=12106 Ack=26678 Win=48492 Len=0
114108  40.658532 244.3.153.117 -> 41.177.24.241 TCP 64 49379 > xmpp-client [ACK] Seq=12106 Ack=28058 Win=49152 Len=0
114121  40.660437 244.3.153.117 -> 41.177.24.241 TCP 64 49379 > xmpp-client [ACK] Seq=12106 Ack=28718 Win=48492 Len=0
114123  40.660638 244.3.153.117 -> 41.177.24.241 TCP 64 49379 > xmpp-client [ACK] Seq=12106 Ack=29346 Win=49152 Len=0
114125  40.660872 244.3.153.117 -> 41.177.24.241 TCP 64 49379 > xmpp-client [ACK] Seq=12106 Ack=30038 Win=48460 Len=0
114127  40.661424 244.3.153.117 -> 41.177.24.241 TCP 64 49379 > xmpp-client [ACK] Seq=12106 Ack=30698 Win=49152 Len=0
114129  40.661654 244.3.153.117 -> 41.177.24.241 TCP 64 49379 > xmpp-client [ACK] Seq=12106 Ack=31390 Win=48460 Len=0
114229  40.754525 244.3.153.117 -> 41.177.24.241 TCP 64 49379 > xmpp-client [ACK] Seq=12106 Ack=32418 Win=49152 Len=0
114612  40.953703 244.3.153.117 -> 41.177.24.241 TCP 64 49379 > xmpp-client [ACK] Seq=12106 Ack=32828 Win=48740 Len=0
114758  41.004740 244.3.153.117 -> 41.177.24.241 TCP 64 49379 > xmpp-client [ACK] Seq=12106 Ack=33488 Win=48080 Len=0
114761  41.004998 244.3.153.117 -> 41.177.24.241 TCP 64 49379 > xmpp-client [ACK] Seq=12106 Ack=34148 Win=49152 Len=0
115491  41.196836 244.3.153.117 -> 41.177.24.241 TCP 64 49379 > xmpp-client [ACK] Seq=12106 Ack=34478 Win=48820 Len=0
119321  42.773134 244.3.153.117 -> 41.177.24.241 TCP 64 49379 > xmpp-client [ACK] Seq=12106 Ack=35538 Win=49152 Len=0
123065  43.770288 244.3.153.117 -> 41.177.24.241 TCP 64 49379 > xmpp-client [ACK] Seq=12106 Ack=36076 Win=48612 Len=0
128421  45.144548 244.3.153.117 -> 244.3.64.12  UDP 124 Source port: 53590  Destination port: snmp
128423  45.145149 244.3.153.117 -> 244.3.64.71  UDP 124 Source port: 53590  Destination port: snmp
148314  50.934883 244.3.153.117 -> 41.177.24.241 TCP 70 49380 > imaps [SYN] Seq=0 Win=8192 Len=0 MSS=1150 WS=4 SACK_PERM=1
148327  50.938092 244.3.153.117 -> 41.177.24.241 TCP 64 49380 > imaps [ACK] Seq=1 Ack=1 Win=65548 Len=0
149474  51.305520 244.3.153.117 -> 41.177.24.241 TCP 64 49376 > imaps [ACK] Seq=1032 Ack=3155 Win=64816 Len=0
150223  51.586195 244.3.153.117 -> 41.177.24.241 TCP 64 49380 > imaps [ACK] Seq=561 Ack=1763 Win=65004 Len=0
150742  51.722307 244.3.153.117 -> 41.177.3.18  TCP 70 49381 > unieng [SYN] Seq=0 Win=30732 Len=0 MSS=1150 WS=4 SACK_PERM=1
150752  51.725633 244.3.153.117 -> 41.177.3.18  TCP 64 49381 > unieng [ACK] Seq=1 Ack=1 Win=30732 Len=0
150754  51.725772 244.3.153.117 -> 41.177.3.18  TCP 64 49381 > unieng [PSH, ACK] Seq=1 Ack=1 Win=30732 Len=4
150771  51.732631 244.3.153.117 -> 41.177.3.18  TCP 78 49381 > unieng [PSH, ACK] Seq=5 Ack=5 Win=30728 Len=20
150836  51.765879 244.3.153.117 -> 41.177.3.18  TCP 74 49381 > unieng [PSH, ACK] Seq=25 Ack=31 Win=30700 Len=16
150864  51.773537 244.3.153.117 -> 41.177.3.18  TCP 64 49381 > unieng [ACK] Seq=41 Ack=2331 Win=30732 Len=0
150866  51.773931 244.3.153.117 -> 41.177.3.18  TCP 64 49381 > unieng [ACK] Seq=41 Ack=4631 Win=30732 Len=0
150880  51.776616 244.3.153.117 -> 41.177.3.18  TCP 64 49381 > unieng [ACK] Seq=41 Ack=6931 Win=30732 Len=0
150883  51.776938 244.3.153.117 -> 41.177.3.18  TCP 64 49381 > unieng [ACK] Seq=41 Ack=8389 Win=30732 Len=0
150900  51.785443 244.3.153.117 -> 41.177.3.18  TCP 97 49381 > unieng [PSH, ACK] Seq=41 Ack=8389 Win=30732 Len=39
150905  51.788321 244.3.153.117 -> 41.177.3.18  TCP 75 49381 > unieng [PSH, ACK] Seq=80 Ack=8405 Win=30716 Len=17
150915  51.791497 244.3.153.117 -> 41.177.3.18  TCP 70 49381 > unieng [PSH, ACK] Seq=97 Ack=8417 Win=30704 Len=12
150945  51.800497 244.3.153.117 -> 41.177.3.18  TCP 104 49381 > unieng [PSH, ACK] Seq=109 Ack=8445 Win=30676 Len=46
150952  51.802887 244.3.153.117 -> 41.177.3.18  TCP 97 49381 > unieng [PSH, ACK] Seq=155 Ack=8484 Win=30636 Len=39
150956  51.805244 244.3.153.117 -> 41.177.3.18  TCP 86 49381 > unieng [PSH, ACK] Seq=194 Ack=8512 Win=30608 Len=28
150966  51.807419 244.3.153.117 -> 41.177.3.18  TCP 86 49381 > unieng [PSH, ACK] Seq=222 Ack=8540 Win=30580 Len=28
150979  51.809992 244.3.153.117 -> 41.177.3.18  TCP 86 49381 > unieng [PSH, ACK] Seq=250 Ack=8599 Win=30520 Len=28
150991  51.815771 244.3.153.117 -> 41.177.3.18  TCP 117 49381 > unieng [PSH, ACK] Seq=278 Ack=8627 Win=30492 Len=59
151008  51.821875 244.3.153.117 -> 41.177.3.18  TCP 99 49381 > unieng [PSH, ACK] Seq=337 Ack=8655 Win=30464 Len=41
151026  51.824317 244.3.153.117 -> 41.177.3.18  TCP 97 49381 > unieng [PSH, ACK] Seq=378 Ack=8694 Win=30424 Len=39
151034  51.826309 244.3.153.117 -> 41.177.3.18  TCP 86 49381 > unieng [PSH, ACK] Seq=417 Ack=8722 Win=30396 Len=28
151060  51.833128 244.3.153.117 -> 41.177.3.18  TCP 104 49381 > unieng [PSH, ACK] Seq=445 Ack=8750 Win=30368 Len=46
151075  51.835614 244.3.153.117 -> 41.177.3.18  TCP 97 49381 > unieng [PSH, ACK] Seq=491 Ack=8789 Win=30332 Len=39
151082  51.837571 244.3.153.117 -> 41.177.3.18  TCP 86 49381 > unieng [PSH, ACK] Seq=530 Ack=8817 Win=30304 Len=28
151093  51.839705 244.3.153.117 -> 41.177.3.18  TCP 86 49381 > unieng [PSH, ACK] Seq=558 Ack=8845 Win=30276 Len=28
151111  51.841789 244.3.153.117 -> 41.177.3.18  TCP 86 49381 > unieng [PSH, ACK] Seq=586 Ack=8904 Win=30216 Len=28
151117  51.843666 244.3.153.117 -> 41.177.3.18  TCP 117 49381 > unieng [PSH, ACK] Seq=614 Ack=8932 Win=30188 Len=59
151124  51.849715 244.3.153.117 -> 41.177.3.18  TCP 104 49381 > unieng [PSH, ACK] Seq=673 Ack=8960 Win=30160 Len=46
151143  51.853686 244.3.153.117 -> 41.177.3.18  TCP 97 49381 > unieng [PSH, ACK] Seq=719 Ack=8999 Win=30120 Len=39
151148  51.856112 244.3.153.117 -> 41.177.3.18  TCP 86 49381 > unieng [PSH, ACK] Seq=758 Ack=9027 Win=30092 Len=28
151154  51.858120 244.3.153.117 -> 41.177.3.18  TCP 83 49381 > unieng [PSH, ACK] Seq=786 Ack=9052 Win=30068 Len=25
151185  51.869239 244.3.153.117 -> 41.177.3.18  TCP 102 49381 > unieng [PSH, ACK] Seq=811 Ack=9080 Win=30040 Len=44
151197  51.871808 244.3.153.117 -> 41.177.3.18  TCP 97 49381 > unieng [PSH, ACK] Seq=855 Ack=9119 Win=30000 Len=39
151212  51.873729 244.3.153.117 -> 41.177.3.18  TCP 86 49381 > unieng [PSH, ACK] Seq=894 Ack=9147 Win=29972 Len=28
151222  51.876695 244.3.153.117 -> 41.177.3.18  TCP 704 49381 > unieng [PSH, ACK] Seq=922 Ack=9175 Win=29944 Len=646
151243  51.882645 244.3.153.117 -> 41.177.3.18  TCP 101 49381 > unieng [PSH, ACK] Seq=1568 Ack=9208 Win=29912 Len=43
151252  51.884703 244.3.153.117 -> 41.177.3.18  TCP 88 49381 > unieng [PSH, ACK] Seq=1611 Ack=9238 Win=29880 Len=30
151365  51.909816 244.3.153.117 -> 41.177.3.18  TCP 127 49381 > unieng [PSH, ACK] Seq=1641 Ack=9268 Win=29852 Len=69
151376  51.918479 244.3.153.117 -> 41.177.3.18  TCP 132 49381 > unieng [PSH, ACK] Seq=1710 Ack=9814 Win=30732 Len=74
151383  51.922427 244.3.153.117 -> 41.177.3.18  TCP 135 49381 > unieng [PSH, ACK] Seq=1784 Ack=9846 Win=30700 Len=77
151422  51.925202 244.3.153.117 -> 41.177.3.18  TCP 129 49381 > unieng [PSH, ACK] Seq=1861 Ack=9878 Win=30668 Len=71
151475  51.932887 244.3.153.117 -> 41.177.3.18  TCP 88 49381 > unieng [PSH, ACK] Seq=1932 Ack=9977 Win=30568 Len=30
151491  51.935434 244.3.153.117 -> 41.177.3.18  TCP 88 49381 > unieng [PSH, ACK] Seq=1962 Ack=10384 Win=30160 Len=30
151496  51.937461 244.3.153.117 -> 41.177.3.18  TCP 155 49381 > unieng [PSH, ACK] Seq=1992 Ack=10591 Win=29952 Len=97
151500  51.939806 244.3.153.117 -> 41.177.3.18  TCP 86 49381 > unieng [PSH, ACK] Seq=2089 Ack=10623 Win=29920 Len=28
151540  51.943100 244.3.153.117 -> 41.177.3.18  TCP 99 49381 > unieng [PSH, ACK] Seq=2117 Ack=10743 Win=29800 Len=41
151579  51.953524 244.3.153.117 -> 41.177.3.18  TCP 86 49381 > unieng [PSH, ACK] Seq=2158 Ack=10775 Win=29768 Len=28
151639  51.982394 244.3.153.117 -> 41.177.3.18  TCP 86 49381 > unieng [PSH, ACK] Seq=2186 Ack=11068 Win=30732 Len=28
151653  51.985563 244.3.153.117 -> 41.177.3.18  TCP 107 49381 > unieng [PSH, ACK] Seq=2214 Ack=11361 Win=30436 Len=49
151661  51.987677 244.3.153.117 -> 41.177.3.18  TCP 106 49381 > unieng [PSH, ACK] Seq=2263 Ack=11409 Win=30388 Len=48
151672  51.989745 244.3.153.117 -> 41.177.3.18  TCP 314 49381 > unieng [PSH, ACK] Seq=2311 Ack=11437 Win=30360 Len=256
151696  51.992944 244.3.153.117 -> 41.177.3.18  TCP 114 49381 > unieng [PSH, ACK] Seq=2567 Ack=11465 Win=30332 Len=56
151730  51.999784 244.3.153.117 -> 41.177.3.18  TCP 86 49381 > unieng [PSH, ACK] Seq=2623 Ack=11497 Win=30300 Len=28
151749  52.003488 244.3.153.117 -> 41.177.3.18  TCP 86 49381 > unieng [PSH, ACK] Seq=2651 Ack=11799 Win=30000 Len=28
151980  52.071427 244.3.153.117 -> 41.177.3.18  TCP 152 49381 > unieng [PSH, ACK] Seq=2679 Ack=12101 Win=29696 Len=94
151987  52.074173 244.3.153.117 -> 41.177.3.18  TCP 138 49381 > unieng [PSH, ACK] Seq=2773 Ack=12132 Win=29668 Len=80
152001  52.082142 244.3.153.117 -> 41.177.3.18  TCP 90 49381 > unieng [PSH, ACK] Seq=2853 Ack=12163 Win=29636 Len=32
152005  52.083979 244.3.153.117 -> 41.177.3.18  TCP 90 49381 > unieng [PSH, ACK] Seq=2885 Ack=12201 Win=29596 Len=32
152016  52.086131 244.3.153.117 -> 41.177.3.18  TCP 96 49381 > unieng [PSH, ACK] Seq=2917 Ack=12249 Win=30732 Len=38
152022  52.091452 244.3.153.117 -> 41.177.3.18  TCP 94 49381 > unieng [PSH, ACK] Seq=2955 Ack=12436 Win=30544 Len=36
152038  52.100071 244.3.153.117 -> 41.177.3.18  TCP 227 49381 > unieng [PSH, ACK] Seq=2991 Ack=12473 Win=30508 Len=169
152044  52.103745 244.3.153.117 -> 41.177.3.18  TCP 180 49381 > unieng [PSH, ACK] Seq=3160 Ack=12656 Win=30324 Len=122
152080  52.108667 244.3.153.117 -> 41.177.3.18  TCP 133 49381 > unieng [PSH, ACK] Seq=3282 Ack=13016 Win=29964 Len=75
152116  52.116863 244.3.153.117 -> 41.177.3.18  TCP 133 49381 > unieng [PSH, ACK] Seq=3357 Ack=13063 Win=29916 Len=75
152128  52.119216 244.3.153.117 -> 41.177.3.18  TCP 94 49381 > unieng [PSH, ACK] Seq=3432 Ack=13110 Win=29868 Len=36
152145  52.121728 244.3.153.117 -> 41.177.3.18  TCP 98 49381 > unieng [PSH, ACK] Seq=3468 Ack=13146 Win=29832 Len=40
152150  52.124145 244.3.153.117 -> 41.177.3.18  TCP 90 49381 > unieng [PSH, ACK] Seq=3508 Ack=13341 Win=29640 Len=32
152158  52.127158 244.3.153.117 -> 41.177.3.18  TCP 86 49381 > unieng [PSH, ACK] Seq=3540 Ack=13369 Win=29612 Len=28
152172  52.133478 244.3.153.117 -> 41.177.3.18  TCP 86 49381 > unieng [PSH, ACK] Seq=3568 Ack=13671 Win=30732 Len=28
152607  52.255282 244.3.153.117 -> 41.177.3.18  TCP 114 49381 > unieng [PSH, ACK] Seq=3596 Ack=13703 Win=30700 Len=56
152689  52.283140 244.3.153.117 -> 41.177.3.18  TCP 101 49381 > unieng [PSH, ACK] Seq=3652 Ack=13739 Win=30664 Len=43
152789  52.316462 244.3.153.117 -> 41.177.3.18  TCP 64 49381 > unieng [ACK] Seq=3695 Ack=16039 Win=30732 Len=0
152791  52.316600 244.3.153.117 -> 41.177.3.18  TCP 64 49381 > unieng [ACK] Seq=3695 Ack=17719 Win=30732 Len=0
152819  52.321788 244.3.153.117 -> 41.177.3.18  TCP 101 49381 > unieng [PSH, ACK] Seq=3695 Ack=17719 Win=30732 Len=43
152859  52.342738 244.3.153.117 -> 41.177.3.18  TCP 64 49381 > unieng [ACK] Seq=3738 Ack=20019 Win=30732 Len=0
152862  52.343229 244.3.153.117 -> 41.177.3.18  TCP 64 49381 > unieng [ACK] Seq=3738 Ack=22217 Win=30732 Len=0
152887  52.350062 244.3.153.117 -> 41.177.3.18  TCP 64 49381 > unieng [PSH, ACK] Seq=3738 Ack=22217 Win=30732 Len=4
152906  52.353168 244.3.153.117 -> 41.177.3.18  TCP 64 49381 > unieng [ACK] Seq=3742 Ack=23760 Win=30732 Len=0
152915  52.357259 244.3.153.117 -> 41.177.3.18  TCP 101 49381 > unieng [PSH, ACK] Seq=3742 Ack=23760 Win=30732 Len=43
152941  52.365663 244.3.153.117 -> 41.177.3.18  TCP 64 49381 > unieng [ACK] Seq=3785 Ack=25160 Win=30732 Len=0
152943  52.366589 244.3.153.117 -> 41.177.3.18  TCP 90 49381 > unieng [PSH, ACK] Seq=3785 Ack=25160 Win=30732 Len=32
153052  52.389768 244.3.153.117 -> 41.177.24.241 TCP 64 49380 > imaps [ACK] Seq=1089 Ack=5242 Win=65548 Len=0
153094  52.419162 244.3.153.117 -> 41.177.24.241 TCP 64 49380 > imaps [ACK] Seq=1089 Ack=7542 Win=65548 Len=0
153096  52.419340 244.3.153.117 -> 41.177.24.241 TCP 64 49380 > imaps [ACK] Seq=1089 Ack=9842 Win=65548 Len=0
153099  52.419477 244.3.153.117 -> 41.177.24.241 TCP 64 49380 > imaps [ACK] Seq=1089 Ack=12142 Win=65548 Len=0
153101  52.419701 244.3.153.117 -> 41.177.24.241 TCP 64 49380 > imaps [ACK] Seq=1089 Ack=14442 Win=65548 Len=0
153115  52.420294 244.3.153.117 -> 41.177.24.241 TCP 70 49380 > imaps [ACK] Seq=1089 Ack=15592 Win=65548 Len=0 SLE=16742 SRE=17892
153122  52.420546 244.3.153.117 -> 41.177.24.241 TCP 64 49380 > imaps [ACK] Seq=1089 Ack=17892 Win=65548 Len=0
153126  52.420740 244.3.153.117 -> 41.177.24.241 TCP 70 [TCP Dup ACK 153122#1] 49380 > imaps [ACK] Seq=1089 Ack=17892 Win=65548 Len=0 SLE=19042 SRE=19347
153128  52.420830 244.3.153.117 -> 41.177.24.241 TCP 64 49380 > imaps [ACK] Seq=1089 Ack=19347 Win=65548 Len=0
153141  52.421342 244.3.153.117 -> 41.177.24.241 TCP 64 49380 > imaps [ACK] Seq=1089 Ack=21647 Win=65548 Len=0
153163  52.424150 244.3.153.117 -> 41.177.24.241 TCP 64 49380 > imaps [ACK] Seq=1089 Ack=23947 Win=65548 Len=0
153164  52.424268 244.3.153.117 -> 41.177.24.241 TCP 64 49380 > imaps [ACK] Seq=1089 Ack=26247 Win=65548 Len=0
153174  52.425236 244.3.153.117 -> 41.177.24.241 TCP 64 49380 > imaps [ACK] Seq=1089 Ack=28547 Win=65548 Len=0
153181  52.425785 244.3.153.117 -> 41.177.24.241 TCP 64 49380 > imaps [ACK] Seq=1089 Ack=30847 Win=65548 Len=0
153207  52.436837 244.3.153.117 -> 41.177.24.241 TCP 64 49380 > imaps [ACK] Seq=1089 Ack=33147 Win=65548 Len=0
153209  52.437315 244.3.153.117 -> 41.177.24.241 TCP 64 49380 > imaps [ACK] Seq=1089 Ack=35447 Win=65548 Len=0
153230  52.438436 244.3.153.117 -> 41.177.24.241 TCP 64 49380 > imaps [ACK] Seq=1089 Ack=37747 Win=65548 Len=0
153235  52.440284 244.3.153.117 -> 41.177.24.241 TCP 64 49380 > imaps [ACK] Seq=1089 Ack=40047 Win=65548 Len=0
153237  52.440416 244.3.153.117 -> 41.177.24.241 TCP 64 49380 > imaps [ACK] Seq=1089 Ack=42347 Win=65548 Len=0
153241  52.441327 244.3.153.117 -> 41.177.24.241 TCP 64 49380 > imaps [ACK] Seq=1089 Ack=44647 Win=65548 Len=0
153243  52.441998 244.3.153.117 -> 41.177.24.241 TCP 64 49380 > imaps [ACK] Seq=1089 Ack=46947 Win=65548 Len=0
153245  52.442618 244.3.153.117 -> 41.177.24.241 TCP 64 49380 > imaps [ACK] Seq=1089 Ack=49247 Win=65548 Len=0
153249  52.443736 244.3.153.117 -> 41.177.24.241 TCP 64 49380 > imaps [ACK] Seq=1089 Ack=51547 Win=65548 Len=0
153279  52.458365 244.3.153.117 -> 41.177.24.241 TCP 64 49380 > imaps [ACK] Seq=1089 Ack=53847 Win=65548 Len=0
153285  52.459264 244.3.153.117 -> 41.177.24.241 TCP 64 49380 > imaps [ACK] Seq=1089 Ack=56147 Win=65548 Len=0
153288  52.459464 244.3.153.117 -> 41.177.24.241 TCP 64 49380 > imaps [ACK] Seq=1089 Ack=58447 Win=65548 Len=0
153291  52.459720 244.3.153.117 -> 41.177.24.241 TCP 64 49380 > imaps [ACK] Seq=1089 Ack=60747 Win=65548 Len=0
153346  52.472207 244.3.153.117 -> 41.177.24.241 TCP 64 49380 > imaps [ACK] Seq=1089 Ack=63047 Win=65548 Len=0
153348  52.472461 244.3.153.117 -> 41.177.24.241 TCP 64 49380 > imaps [ACK] Seq=1089 Ack=65347 Win=65548 Len=0
153350  52.472658 244.3.153.117 -> 41.177.24.241 TCP 64 49380 > imaps [ACK] Seq=1089 Ack=67647 Win=65548 Len=0
153356  52.472847 244.3.153.117 -> 41.177.24.241 TCP 64 49380 > imaps [ACK] Seq=1089 Ack=69947 Win=65548 Len=0
153362  52.473113 244.3.153.117 -> 41.177.24.241 TCP 64 49380 > imaps [ACK] Seq=1089 Ack=72247 Win=65548 Len=0
153369  52.473400 244.3.153.117 -> 41.177.24.241 TCP 64 49380 > imaps [ACK] Seq=1089 Ack=74547 Win=65548 Len=0
153373  52.473497 244.3.153.117 -> 41.177.24.241 TCP 64 49380 > imaps [ACK] Seq=1089 Ack=76784 Win=65548 Len=0
153386  52.476028 244.3.153.117 -> 41.177.24.241 TCP 64 49380 > imaps [ACK] Seq=1089 Ack=77958 Win=65548 Len=0
153587  52.532014 244.3.153.117 -> 41.177.3.18  TCP 114 49381 > unieng [PSH, ACK] Seq=3817 Ack=25188 Win=30704 Len=56
153605  52.537132 244.3.153.117 -> 41.177.3.18  TCP 101 49381 > unieng [PSH, ACK] Seq=3873 Ack=25224 Win=30668 Len=43
153678  52.548470 244.3.153.117 -> 41.177.3.18  TCP 90 49381 > unieng [PSH, ACK] Seq=3916 Ack=25848 Win=30044 Len=32
153726  52.551472 244.3.153.117 -> 41.177.3.18  TCP 86 49381 > unieng [PSH, ACK] Seq=3948 Ack=25876 Win=30016 Len=28
153851  52.583212 244.3.153.117 -> 41.177.24.241 TCP 64 49380 > imaps [ACK] Seq=1289 Ack=79183 Win=65548 Len=0
154146  52.668610 244.3.153.117 -> 41.177.3.18  TCP 114 49381 > unieng [PSH, ACK] Seq=3976 Ack=26167 Win=29724 Len=56
154195  52.674402 244.3.153.117 -> 41.177.3.18  TCP 114 49381 > unieng [PSH, ACK] Seq=4032 Ack=26203 Win=29688 Len=56
154208  52.682147 244.3.153.117 -> 41.177.3.18  TCP 122 49381 > unieng [PSH, ACK] Seq=4088 Ack=26239 Win=29652 Len=64
154227  52.686267 244.3.153.117 -> 41.177.3.18  TCP 101 49381 > unieng [PSH, ACK] Seq=4152 Ack=26275 Win=29616 Len=43
154254  52.693327 244.3.153.117 -> 41.177.3.18  TCP 90 49381 > unieng [PSH, ACK] Seq=4195 Ack=26899 Win=30732 Len=32
154261  52.698683 244.3.153.117 -> 41.177.3.18  TCP 182 49381 > unieng [PSH, ACK] Seq=4227 Ack=26927 Win=30704 Len=124
154265  52.701524 244.3.153.117 -> 41.177.3.18  TCP 98 49381 > unieng [PSH, ACK] Seq=4351 Ack=26964 Win=30664 Len=40
154269  52.703530 244.3.153.117 -> 41.177.3.18  TCP 90 49381 > unieng [PSH, ACK] Seq=4391 Ack=26997 Win=30632 Len=32
154840  52.888151 244.3.153.117 -> 41.177.3.18  TCP 64 49381 > unieng [ACK] Seq=4423 Ack=27025 Win=30604 Len=0
154870  52.902064 244.3.153.117 -> 41.177.24.241 TCP 64 49380 > imaps [ACK] Seq=1432 Ack=83159 Win=65548 Len=0
163483  55.442249 244.3.153.117 -> 41.177.3.18  TCP 93 49381 > unieng [PSH, ACK] Seq=4423 Ack=27025 Win=30604 Len=35
163885  55.555253 244.3.153.117 -> 41.177.3.18  TCP 93 49381 > unieng [PSH, ACK] Seq=4458 Ack=27280 Win=30348 Len=35
164315  55.663717 244.3.153.117 -> 244.3.64.12  UDP 124 Source port: 53590  Destination port: snmp
164317  55.664268 244.3.153.117 -> 244.3.64.71  UDP 124 Source port: 53590  Destination port: snmp
164702  55.754243 244.3.153.117 -> 41.177.3.18  TCP 64 49381 > unieng [ACK] Seq=4493 Ack=27535 Win=30096 Len=0
169890  56.569958 244.3.153.117 -> 41.177.3.18  TCP 93 49381 > unieng [PSH, ACK] Seq=4493 Ack=27535 Win=30096 Len=35
169904  56.573320 244.3.153.117 -> 41.177.3.18  TCP 97 49381 > unieng [PSH, ACK] Seq=4528 Ack=28085 Win=30732 Len=39
169959  56.582846 244.3.153.117 -> 41.177.3.18  TCP 143 49381 > unieng [PSH, ACK] Seq=4567 Ack=28692 Win=30124 Len=85
170080  56.604180 244.3.153.117 -> 41.177.3.18  TCP 97 49381 > unieng [PSH, ACK] Seq=4652 Ack=28720 Win=30096 Len=39
170181  56.632733 244.3.153.117 -> 41.177.3.18  TCP 114 49381 > unieng [PSH, ACK] Seq=4691 Ack=29327 Win=30732 Len=56
170262  56.650342 244.3.153.117 -> 41.177.3.18  TCP 114 49381 > unieng [PSH, ACK] Seq=4747 Ack=29363 Win=30696 Len=56
171187  56.846860 244.3.153.117 -> 41.177.3.18  TCP 64 49381 > unieng [ACK] Seq=4803 Ack=29399 Win=30660 Len=0
189871  65.114648 244.3.153.117 -> 41.177.24.241 TCP 64 49379 > xmpp-client [ACK] Seq=12106 Ack=36470 Win=48220 Len=0
191149  65.800909 244.3.153.117 -> 244.3.64.12  UDP 124 Source port: 53590  Destination port: snmp
191153  65.801384 244.3.153.117 -> 244.3.64.71  UDP 124 Source port: 53590  Destination port: snmp
196527  67.443840 244.3.153.117 -> 41.177.3.18  TCP 138 49381 > unieng [PSH, ACK] Seq=4803 Ack=29399 Win=30660 Len=80
196550  67.447474 244.3.153.117 -> 41.177.3.18  TCP 90 49381 > unieng [PSH, ACK] Seq=4883 Ack=29436 Win=30620 Len=32
196574  67.449945 244.3.153.117 -> 41.177.3.18  TCP 138 49381 > unieng [PSH, ACK] Seq=4915 Ack=29464 Win=30592 Len=80
196882  67.532882 244.3.153.117 -> 41.177.3.18  TCP 98 49381 > unieng [PSH, ACK] Seq=4995 Ack=29501 Win=30556 Len=40
197015  67.543389 244.3.153.117 -> 41.177.3.18  TCP 64 49381 > unieng [ACK] Seq=5035 Ack=31801 Win=30732 Len=0
197018  67.544124 244.3.153.117 -> 41.177.3.18  TCP 64 49381 > unieng [PSH, ACK] Seq=5035 Ack=32315 Win=30216 Len=4
197044  67.549256 244.3.153.117 -> 41.177.3.18  TCP 64 49381 > unieng [ACK] Seq=5039 Ack=34615 Win=30732 Len=0
197051  67.550688 244.3.153.117 -> 41.177.3.18  TCP 90 49381 > unieng [PSH, ACK] Seq=5039 Ack=35314 Win=30032 Len=32
197599  67.750732 244.3.153.117 -> 41.177.3.18  TCP 64 49381 > unieng [ACK] Seq=5071 Ack=35342 Win=30004 Len=0
203574  70.175959 244.3.153.117 -> 41.177.3.18  TCP 118 49381 > unieng [PSH, ACK] Seq=5071 Ack=35342 Win=30004 Len=60
204203  70.225059 244.3.153.117 -> 41.177.3.18  TCP 101 49381 > unieng [PSH, ACK] Seq=5131 Ack=35378 Win=29968 Len=43
204268  70.239897 244.3.153.117 -> 41.177.3.18  TCP 64 49381 > unieng [ACK] Seq=5174 Ack=37563 Win=30732 Len=0
204270  70.240072 244.3.153.117 -> 41.177.3.18  TCP 90 49381 > unieng [PSH, ACK] Seq=5174 Ack=37563 Win=30732 Len=32
204461  70.261526 244.3.153.117 -> 41.177.3.18  TCP 118 49381 > unieng [PSH, ACK] Seq=5206 Ack=37591 Win=30704 Len=60
204472  70.265831 244.3.153.117 -> 41.177.3.18  TCP 98 49381 > unieng [PSH, ACK] Seq=5266 Ack=37628 Win=30664 Len=40
204483  70.268785 244.3.153.117 -> 41.177.3.18  TCP 90 49381 > unieng [PSH, ACK] Seq=5306 Ack=37717 Win=30576 Len=32
204658  70.406106 244.3.153.117 -> 41.177.3.18  TCP 98 49381 > unieng [PSH, ACK] Seq=5338 Ack=37745 Win=30548 Len=40
204665  70.410942 244.3.153.117 -> 41.177.3.18  TCP 323 49381 > unieng [PSH, ACK] Seq=5378 Ack=37801 Win=30492 Len=265
205551  70.622971 244.3.153.117 -> 41.177.3.18  TCP 64 49381 > unieng [ACK] Seq=5643 Ack=38352 Win=29940 Len=0
214837  73.734136 244.3.153.117 -> 41.177.3.18  TCP 118 49381 > unieng [PSH, ACK] Seq=5643 Ack=38352 Win=29940 Len=60
214892  73.749172 244.3.153.117 -> 41.177.3.18  TCP 101 49381 > unieng [PSH, ACK] Seq=5703 Ack=38388 Win=29904 Len=43
214911  73.756228 244.3.153.117 -> 41.177.3.18  TCP 64 49381 > unieng [ACK] Seq=5746 Ack=40024 Win=30732 Len=0
214922  73.759485 244.3.153.117 -> 41.177.3.18  TCP 90 49381 > unieng [PSH, ACK] Seq=5746 Ack=40024 Win=30732 Len=32
215101  73.824212 244.3.153.117 -> 41.177.3.18  TCP 323 49381 > unieng [PSH, ACK] Seq=5778 Ack=40052 Win=30704 Len=265
215700  74.037678 244.3.153.117 -> 41.177.3.18  TCP 64 49381 > unieng [ACK] Seq=6043 Ack=40840 Win=29916 Len=0
219730  75.146945 244.3.153.117 -> 244.3.39.242 UDP 124 Source port: 53590  Destination port: snmp
246027  86.086965 244.3.153.117 -> 244.3.39.242 UDP 124 Source port: 53590  Destination port: snmp
251886  89.088779 244.3.153.117 -> 41.177.24.241 TCP 64 49379 > xmpp-client [ACK] Seq=12106 Ack=37530 Win=49152 Len=0
252374  89.297791 244.3.153.117 -> 41.177.24.241 TCP 64 49379 > xmpp-client [ACK] Seq=12106 Ack=37924 Win=48756 Len=0
277785  93.757833 244.3.153.117 -> 41.177.24.241 TCP 132 49379 > xmpp-client [PSH, ACK] Seq=12106 Ack=37924 Win=48756 Len=74[Packet size limited during capture]
284327  95.211799 244.3.153.117 -> 244.3.39.242 UDP 124 Source port: 53590  Destination port: snmp
293107  98.420778 244.3.153.117 -> 41.177.230.41 TCP 70 49382 > ldap [SYN] Seq=0 Win=8192 Len=0 MSS=1150 WS=4 SACK_PERM=1
293129  98.423105 244.3.153.117 -> 41.177.230.41 TCP 64 49382 > ldap [ACK] Seq=1 Ack=1 Win=65548 Len=0
293133  98.423390 244.3.153.117 -> 41.177.230.41 TCP 72 49382 > ldap [PSH, ACK] Seq=1 Ack=1 Win=65548 Len=14
293212  98.467321 244.3.153.117 -> 41.177.230.41 TCP 160 49382 > ldap [PSH, ACK] Seq=15 Ack=15 Win=65536 Len=102
293237  98.473198 244.3.153.117 -> 41.177.230.41 TCP 64 49382 > ldap [ACK] Seq=117 Ack=311 Win=65240 Len=0
293243  98.473854 244.3.153.117 -> 41.177.230.41 TCP 64 49382 > ldap [ACK] Seq=117 Ack=594 Win=64956 Len=0
293267  98.477006 244.3.153.117 -> 41.177.230.41 TCP 64 49382 > ldap [ACK] Seq=117 Ack=891 Win=64660 Len=0
293274  98.477828 244.3.153.117 -> 41.177.230.41 TCP 64 49382 > ldap [ACK] Seq=117 Ack=1180 Win=65548 Len=0
293280  98.478276 244.3.153.117 -> 41.177.230.41 TCP 64 49382 > ldap [ACK] Seq=117 Ack=1483 Win=65244 Len=0
293287  98.479243 244.3.153.117 -> 41.177.230.41 TCP 64 49382 > ldap [ACK] Seq=117 Ack=1772 Win=64956 Len=0
293294  98.481247 244.3.153.117 -> 41.177.230.41 TCP 64 49382 > ldap [ACK] Seq=117 Ack=2028 Win=64700 Len=0
293296  98.481463 244.3.153.117 -> 41.177.230.41 TCP 64 49382 > ldap [ACK] Seq=117 Ack=2300 Win=64428 Len=0
293298  98.482446 244.3.153.117 -> 41.177.230.41 TCP 64 49382 > ldap [ACK] Seq=117 Ack=2612 Win=65548 Len=0
293347  98.498838 244.3.153.117 -> 41.177.230.41 TCP 64 49382 > ldap [ACK] Seq=117 Ack=2898 Win=65264 Len=0
293349  98.499011 244.3.153.117 -> 41.177.230.41 TCP 64 49382 > ldap [ACK] Seq=117 Ack=3193 Win=64968 Len=0
293352  98.499268 244.3.153.117 -> 41.177.230.41 TCP 64 49382 > ldap [ACK] Seq=117 Ack=3483 Win=64676 Len=0
293359  98.499472 244.3.153.117 -> 41.177.230.41 TCP 64 49382 > ldap [ACK] Seq=117 Ack=3645 Win=64516 Len=0
308737 105.161495 244.3.153.117 -> 244.3.64.12  UDP 124 Source port: 53590  Destination port: snmp
308739 105.162136 244.3.153.117 -> 244.3.64.71  UDP 124 Source port: 53590  Destination port: snmp
331337 115.487578 244.3.153.117 -> 244.3.64.12  UDP 124 Source port: 53590  Destination port: snmp
331339 115.487753 244.3.153.117 -> 244.3.64.71  UDP 124 Source port: 53590  Destination port: snmp
367283 125.631867 244.3.153.117 -> 244.3.64.12  UDP 124 Source port: 53590  Destination port: snmp
367285 125.632383 244.3.153.117 -> 244.3.64.71  UDP 124 Source port: 53590  Destination port: snmp
389408 130.072640 244.3.153.117 -> 41.177.24.241 TCP 64 49379 > xmpp-client [ACK] Seq=12180 Ack=38094 Win=48588 Len=0
402932 135.168614 244.3.153.117 -> 244.3.39.242 UDP 124 Source port: 53590  Destination port: snmp
448988 145.900202 244.3.153.117 -> 244.3.39.242 UDP 124 Source port: 53590  Destination port: snmp
455836 148.770813 244.3.153.117 -> 41.177.24.241 TCP 132 49379 > xmpp-client [PSH, ACK] Seq=12180 Ack=38094 Win=48588 Len=74[Packet size limited during capture]
473034 156.042240 244.3.153.117 -> 244.3.39.242 UDP 124 Source port: 53590  Destination port: snmp
490018 161.391207 244.3.153.117 -> 41.177.153.71 UDP 88 Source port: 53590  Destination port: snmp
490021 161.391466 244.3.153.117 -> 244.3.39.242 UDP 88 Source port: 53590  Destination port: snmp
490022 161.391583 244.3.153.117 -> 244.3.64.12  UDP 88 Source port: 53590  Destination port: snmp
490024 161.391809 244.3.153.117 -> 244.3.64.71  UDP 88 Source port: 53590  Destination port: snmp
514109 165.184261 244.3.153.117 -> 244.3.64.12  UDP 124 Source port: 53590  Destination port: snmp
514111 165.184922 244.3.153.117 -> 244.3.64.71  UDP 124 Source port: 53590  Destination port: snmp
527467 171.406249 244.3.153.117 -> 41.177.24.241 TCP 64 49376 > imaps [ACK] Seq=1158 Ack=3440 Win=64532 Len=0
527476 171.407529 244.3.153.117 -> 41.177.153.71 UDP 158 Source port: 53590  Destination port: snmp
527488 171.412232 244.3.153.117 -> 41.177.153.71 UDP 141 Source port: 53590  Destination port: snmp
527495 171.415284 244.3.153.117 -> 41.177.153.71 UDP 124 Source port: 53590  Destination port: snmp
527514 171.418180 244.3.153.117 -> 41.177.153.71 UDP 107 Source port: 53590  Destination port: snmp
527538 171.422163 244.3.153.117 -> 41.177.153.71 UDP 163 Source port: 53590  Destination port: snmp
527544 171.425777 244.3.153.117 -> 41.177.153.71 UDP 145 Source port: 53590  Destination port: snmp
527553 171.428590 244.3.153.117 -> 41.177.153.71 UDP 127 Source port: 53590  Destination port: snmp
527633 171.436967 244.3.153.117 -> 41.177.24.241 TCP 64 49380 > imaps [ACK] Seq=1559 Ack=83399 Win=65308 Len=0
530614 172.264355 244.3.153.117 -> 244.3.39.242 UDP 88 Source port: 53590  Destination port: snmp
530623 172.264703 244.3.153.117 -> 244.3.64.12  UDP 88 Source port: 53590  Destination port: snmp
530625 172.264827 244.3.153.117 -> 244.3.64.71  UDP 88 Source port: 53590  Destination port: snmp
540120 175.306498 244.3.153.117 -> 244.3.64.12  UDP 124 Source port: 53590  Destination port: snmp
540122 175.306736 244.3.153.117 -> 244.3.64.71  UDP 124 Source port: 53590  Destination port: snmp
567567 181.390384 244.3.153.117 -> 244.3.39.242 UDP 88 Source port: 53590  Destination port: snmp
567569 181.390626 244.3.153.117 -> 244.3.64.12  UDP 88 Source port: 53590  Destination port: snmp
567571 181.390897 244.3.153.117 -> 244.3.64.71  UDP 88 Source port: 53590  Destination port: snmp
582517 185.446851 244.3.153.117 -> 244.3.64.12  UDP 124 Source port: 53590  Destination port: snmp
582520 185.447125 244.3.153.117 -> 244.3.64.71  UDP 124 Source port: 53590  Destination port: snmp
612620 194.419424 244.3.153.117 -> 244.3.39.242 UDP 158 Source port: 53590  Destination port: snmp
612622 194.420175 244.3.153.117 -> 244.3.64.12  UDP 158 Source port: 53590  Destination port: snmp
612626 194.421706 244.3.153.117 -> 244.3.64.71  UDP 158 Source port: 53590  Destination port: snmp
615087 195.197689 244.3.153.117 -> 244.3.39.242 UDP 124 Source port: 53590  Destination port: snmp
648489 203.776891 244.3.153.117 -> 41.177.24.241 TCP 132 49379 > xmpp-client [PSH, ACK] Seq=12254 Ack=38094 Win=48588 Len=74[Packet size limited during capture]
653588 204.712897 244.3.153.117 -> 244.3.39.242 UDP 158 Source port: 53590  Destination port: snmp
653589 204.713032 244.3.153.117 -> 244.3.64.12  UDP 158 Source port: 53590  Destination port: snmp
653591 204.713244 244.3.153.117 -> 244.3.64.71  UDP 158 Source port: 53590  Destination port: snmp
656448 205.726138 244.3.153.117 -> 244.3.39.242 UDP 124 Source port: 53590  Destination port: snmp
684777 214.852586 244.3.153.117 -> 244.3.39.242 UDP 158 Source port: 53590  Destination port: snmp
684781 214.852885 244.3.153.117 -> 244.3.64.12  UDP 158 Source port: 53590  Destination port: snmp
684783 214.853167 244.3.153.117 -> 244.3.64.71  UDP 158 Source port: 53590  Destination port: snmp
686916 215.867776 244.3.153.117 -> 244.3.39.242 UDP 124 Source port: 53590  Destination port: snmp
706733 224.994900 244.3.153.117 -> 244.3.64.12  UDP 163 Source port: 53590  Destination port: snmp
706739 224.997032 244.3.153.117 -> 244.3.39.242 UDP 163 Source port: 53590  Destination port: snmp
706741 224.997346 244.3.153.117 -> 244.3.64.71  UDP 163 Source port: 53590  Destination port: snmp
707323 225.212446 244.3.153.117 -> 244.3.64.12  UDP 124 Source port: 53590  Destination port: snmp
707332 225.213161 244.3.153.117 -> 244.3.64.71  UDP 124 Source port: 53590  Destination port: snmp
736099 235.132301 244.3.153.117 -> 244.3.64.12  UDP 163 Source port: 53590  Destination port: snmp
736101 235.132844 244.3.153.117 -> 244.3.39.242 UDP 163 Source port: 53590  Destination port: snmp
736103 235.133248 244.3.153.117 -> 244.3.64.71  UDP 163 Source port: 53590  Destination port: snmp
740067 236.146920 244.3.153.117 -> 244.3.64.12  UDP 124 Source port: 53590  Destination port: snmp
740069 236.147230 244.3.153.117 -> 244.3.64.71  UDP 124 Source port: 53590  Destination port: snmp
760420 245.272666 244.3.153.117 -> 244.3.64.12  UDP 163 Source port: 53590  Destination port: snmp
760422 245.272998 244.3.153.117 -> 244.3.39.242 UDP 163 Source port: 53590  Destination port: snmp
760424 245.273608 244.3.153.117 -> 244.3.64.71  UDP 163 Source port: 53590  Destination port: snmp
760427 245.274027 244.3.153.117 -> 244.3.64.12  UDP 124 Source port: 53590  Destination port: snmp
760429 245.274423 244.3.153.117 -> 244.3.64.71  UDP 124 Source port: 53590  Destination port: snmp
786375 255.228184 244.3.153.117 -> 244.3.39.242 UDP 124 Source port: 53590  Destination port: snmp
789224 256.239721 244.3.153.117 -> 41.177.153.71 UDP 124 Source port: 53590  Destination port: snmp
794403 258.783827 244.3.153.117 -> 41.177.24.241 TCP 132 49379 > xmpp-client [PSH, ACK] Seq=12328 Ack=38094 Win=48588 Len=74[Packet size limited during capture]
814256 265.553079 244.3.153.117 -> 244.3.39.242 UDP 124 Source port: 53590  Destination port: snmp
840594 275.693428 244.3.153.117 -> 244.3.39.242 UDP 124 Source port: 53590  Destination port: snmp
863659 285.241429 244.3.153.117 -> 244.3.64.12  UDP 124 Source port: 53590  Destination port: snmp
863661 285.242267 244.3.153.117 -> 244.3.64.71  UDP 124 Source port: 53590  Destination port: snmp
877968 291.355408 244.3.153.117 -> 41.177.24.241 TCP 64 49376 > imaps [ACK] Seq=1284 Ack=3725 Win=65456 Len=0
877970 291.356069 244.3.153.117 -> 41.177.24.241 TCP 64 49380 > imaps [ACK] Seq=1686 Ack=83639 Win=65068 Len=0
894413 295.973349 244.3.153.117 -> 244.3.64.12  UDP 124 Source port: 53590  Destination port: snmp
894415 295.973621 244.3.153.117 -> 244.3.64.71  UDP 124 Source port: 53590  Destination port: snmp
922258 306.113673 244.3.153.117 -> 244.3.64.12  UDP 124 Source port: 53590  Destination port: snmp
922260 306.114349 244.3.153.117 -> 244.3.64.71  UDP 124 Source port: 53590  Destination port: snmp
944896 313.788643 244.3.153.117 -> 41.177.24.241 TCP 132 49379 > xmpp-client [PSH, ACK] Seq=12402 Ack=38094 Win=48588 Len=74[Packet size limited during capture]
950557 315.256522 244.3.153.117 -> 244.3.39.242 UDP 124 Source port: 53590  Destination port: snmp
976633 325.379582 244.3.153.117 -> 244.3.39.242 UDP 124 Source port: 53590  Destination port: snmp
1001506 335.519709 244.3.153.117 -> 244.3.39.242 UDP 124 Source port: 53590  Destination port: snmp
