760698 245.372042 244.3.56.197 -> 244.3.31.155 TCP 66 4833 > http [SYN] Seq=0 Win=65535 Len=0 MSS=1380 SACK_PERM=1
760700 245.372793 244.3.56.197 -> 244.3.31.155 TCP 64 4833 > http [ACK] Seq=1 Ack=1 Win=65535 Len=0
760732 245.378362 244.3.56.197 -> 244.3.31.155 TCP 64 4833 > http [ACK] Seq=510 Ack=1761 Win=65535 Len=0
760741 245.378690 244.3.56.197 -> 244.3.31.155 TCP 64 4833 > http [ACK] Seq=510 Ack=2551 Win=64746 Len=0
760742 245.378782 244.3.56.197 -> 244.3.31.155 TCP 64 4833 > http [FIN, ACK] Seq=510 Ack=2551 Win=64746 Len=0
