453207 147.793440   244.3.79.4 -> 41.177.98.220 TCP 131 rds2 > op-probe [PSH, ACK] Seq=1 Ack=1 Win=65013 Len=73
453250 147.826201   244.3.79.4 -> 41.177.98.220 TCP 205 rds2 > op-probe [PSH, ACK] Seq=74 Ack=110 Win=64904 Len=147
454201 148.189526   244.3.79.4 -> 41.177.98.220 TCP 64 rds2 > op-probe [ACK] Seq=221 Ack=551 Win=64463 Len=0
467212 153.953336   244.3.79.4 -> 41.177.98.220 TCP 131 rds2 > op-probe [PSH, ACK] Seq=221 Ack=551 Win=64463 Len=73
467221 153.958973   244.3.79.4 -> 41.177.98.220 TCP 205 rds2 > op-probe [PSH, ACK] Seq=294 Ack=660 Win=64354 Len=147
467765 154.188538   244.3.79.4 -> 41.177.98.220 TCP 64 rds2 > op-probe [ACK] Seq=441 Ack=999 Win=65535 Len=0
470155 155.191629   244.3.79.4 -> 41.177.98.220 TCP 174 rds2 > op-probe [PSH, ACK] Seq=441 Ack=999 Win=65535 Len=116
470556 155.361416   244.3.79.4 -> 41.177.98.220 TCP 64 rds2 > op-probe [ACK] Seq=557 Ack=1407 Win=65127 Len=0
475922 157.044317   244.3.79.4 -> 41.177.98.220 TCP 139 rds2 > op-probe [PSH, ACK] Seq=557 Ack=1407 Win=65127 Len=81
475930 157.047297   244.3.79.4 -> 41.177.98.220 TCP 128 rds2 > op-probe [PSH, ACK] Seq=638 Ack=1500 Win=65034 Len=70
475940 157.053934   244.3.79.4 -> 41.177.98.220 TCP 129 rds2 > op-probe [PSH, ACK] Seq=708 Ack=1939 Win=64595 Len=71
475972 157.070908   244.3.79.4 -> 41.177.98.220 TCP 129 rds2 > op-probe [PSH, ACK] Seq=779 Ack=2104 Win=64430 Len=71
476582 157.313472   244.3.79.4 -> 41.177.98.220 TCP 64 rds2 > op-probe [ACK] Seq=850 Ack=2583 Win=65535 Len=0
481219 158.646289   244.3.79.4 -> 41.177.98.220 TCP 135 rds2 > op-probe [PSH, ACK] Seq=850 Ack=2583 Win=65535 Len=77
481244 158.654702   244.3.79.4 -> 41.177.98.220 TCP 128 rds2 > op-probe [PSH, ACK] Seq=927 Ack=2763 Win=65355 Len=70
481270 158.659922   244.3.79.4 -> 41.177.98.220 TCP 129 rds2 > op-probe [PSH, ACK] Seq=997 Ack=3043 Win=65075 Len=71
481401 158.697805   244.3.79.4 -> 41.177.98.220 TCP 129 rds2 > op-probe [PSH, ACK] Seq=1068 Ack=3319 Win=64799 Len=71
482196 158.954083   244.3.79.4 -> 41.177.98.220 TCP 64 rds2 > op-probe [ACK] Seq=1139 Ack=3790 Win=64328 Len=0
556872 179.320943   244.3.79.4 -> 41.177.98.220 TCP 131 rds2 > op-probe [PSH, ACK] Seq=1139 Ack=3790 Win=64328 Len=73
556898 179.328925   244.3.79.4 -> 41.177.98.220 TCP 205 rds2 > op-probe [PSH, ACK] Seq=1212 Ack=3899 Win=64219 Len=147
558715 179.497994   244.3.79.4 -> 41.177.98.220 TCP 64 rds2 > op-probe [ACK] Seq=1359 Ack=4215 Win=65535 Len=0
568656 181.696145   244.3.79.4 -> 41.177.98.220 TCP 139 rds2 > op-probe [PSH, ACK] Seq=1359 Ack=4215 Win=65535 Len=81
568668 181.699855   244.3.79.4 -> 41.177.98.220 TCP 128 rds2 > op-probe [PSH, ACK] Seq=1440 Ack=4308 Win=65442 Len=70
568678 181.706336   244.3.79.4 -> 41.177.98.220 TCP 129 rds2 > op-probe [PSH, ACK] Seq=1510 Ack=4639 Win=65111 Len=71
568695 181.710986   244.3.79.4 -> 41.177.98.220 TCP 129 rds2 > op-probe [PSH, ACK] Seq=1581 Ack=4794 Win=64956 Len=71
569872 182.094548   244.3.79.4 -> 41.177.98.220 TCP 64 rds2 > op-probe [ACK] Seq=1652 Ack=5238 Win=64512 Len=0
572057 182.551491   244.3.79.4 -> 41.177.98.220 TCP 132 rds2 > op-probe [PSH, ACK] Seq=1652 Ack=5238 Win=64512 Len=74
575420 182.860186   244.3.79.4 -> 41.177.98.220 TCP 64 rds2 > op-probe [ACK] Seq=1726 Ack=5328 Win=64422 Len=0
602661 191.197791   244.3.79.4 -> 41.177.98.220 TCP 171 rds2 > op-probe [PSH, ACK] Seq=1726 Ack=5328 Win=64422 Len=113
603519 191.500780   244.3.79.4 -> 41.177.98.220 TCP 64 rds2 > op-probe [ACK] Seq=1839 Ack=5402 Win=64348 Len=0
607679 192.867666   244.3.79.4 -> 41.177.98.220 TCP 131 rds2 > op-probe [PSH, ACK] Seq=1839 Ack=5402 Win=64348 Len=73
607685 192.873185   244.3.79.4 -> 41.177.98.220 TCP 124 rds2 > op-probe [PSH, ACK] Seq=1912 Ack=5525 Win=64225 Len=66
608205 193.141344   244.3.79.4 -> 41.177.98.220 TCP 64 rds2 > op-probe [ACK] Seq=1978 Ack=6168 Win=65535 Len=0
612763 194.445783   244.3.79.4 -> 41.177.98.220 TCP 137 rds2 > op-probe [PSH, ACK] Seq=1978 Ack=6168 Win=65535 Len=79
613672 194.672626   244.3.79.4 -> 41.177.98.220 TCP 64 rds2 > op-probe [ACK] Seq=2057 Ack=6241 Win=65462 Len=0
614140 194.827203   244.3.79.4 -> 41.177.98.220 TCP 129 rds2 > op-probe [PSH, ACK] Seq=2057 Ack=6241 Win=65462 Len=71
614845 195.110108   244.3.79.4 -> 41.177.98.220 TCP 64 rds2 > op-probe [ACK] Seq=2128 Ack=6686 Win=65017 Len=0
