247   0.047385 244.3.153.239 -> 244.3.176.118 TCP 64 prp > ms-wbt-server [ACK] Seq=1 Ack=1 Win=65255 Len=0
1147   0.299415 244.3.153.239 -> 244.3.176.118 TCP 64 prp > ms-wbt-server [ACK] Seq=74 Ack=25 Win=65231 Len=0
5135   1.599475 244.3.153.239 -> 244.3.176.118 TCP 64 prp > ms-wbt-server [ACK] Seq=208 Ack=201 Win=65055 Len=0
8974   3.213385 244.3.153.239 -> 244.3.176.118 TCP 64 prp > ms-wbt-server [ACK] Seq=280 Ack=259 Win=64997 Len=0
13269   3.917620 244.3.153.239 -> 244.3.176.118 TCP 64 prp > ms-wbt-server [ACK] Seq=328 Ack=331 Win=64925 Len=0
22037   7.735433 244.3.153.239 -> 244.3.176.118 TCP 64 prp > ms-wbt-server [ACK] Seq=1021 Ack=519 Win=64737 Len=0
22443   7.987396 244.3.153.239 -> 244.3.176.118 TCP 64 prp > ms-wbt-server [ACK] Seq=1055 Ack=774 Win=64482 Len=0
24819   9.449426 244.3.153.239 -> 244.3.176.118 TCP 64 prp > ms-wbt-server [ACK] Seq=1055 Ack=1063 Win=65535 Len=0
25258   9.735456 244.3.153.239 -> 244.3.176.118 TCP 64 prp > ms-wbt-server [ACK] Seq=1055 Ack=3363 Win=65535 Len=0
25259   9.735522 244.3.153.239 -> 244.3.176.118 TCP 64 prp > ms-wbt-server [ACK] Seq=1055 Ack=5663 Win=65535 Len=0
25275   9.739520 244.3.153.239 -> 244.3.176.118 TCP 64 prp > ms-wbt-server [ACK] Seq=1055 Ack=7963 Win=65535 Len=0
25276   9.739618 244.3.153.239 -> 244.3.176.118 TCP 70 prp > ms-wbt-server [ACK] Seq=1055 Ack=9113 Win=65535 Len=0 SLE=10263 SRE=10298
25277   9.739623 244.3.153.239 -> 244.3.176.118 TCP 64 prp > ms-wbt-server [ACK] Seq=1055 Ack=10298 Win=65535 Len=0
25292   9.743488 244.3.153.239 -> 244.3.176.118 TCP 64 prp > ms-wbt-server [ACK] Seq=1055 Ack=12598 Win=65535 Len=0
25507   9.829380 244.3.153.239 -> 244.3.176.118 TCP 64 prp > ms-wbt-server [ACK] Seq=1055 Ack=14898 Win=65535 Len=0
25514   9.834257 244.3.153.239 -> 244.3.176.118 TCP 64 prp > ms-wbt-server [ACK] Seq=1055 Ack=17198 Win=65535 Len=0
25515   9.834325 244.3.153.239 -> 244.3.176.118 TCP 64 prp > ms-wbt-server [ACK] Seq=1055 Ack=19498 Win=65535 Len=0
25538   9.837544 244.3.153.239 -> 244.3.176.118 TCP 64 prp > ms-wbt-server [ACK] Seq=1055 Ack=21798 Win=65535 Len=0
25539   9.837612 244.3.153.239 -> 244.3.176.118 TCP 64 prp > ms-wbt-server [ACK] Seq=1055 Ack=24098 Win=65535 Len=0
25637   9.921387 244.3.153.239 -> 244.3.176.118 TCP 64 prp > ms-wbt-server [ACK] Seq=1055 Ack=26398 Win=65535 Len=0
25651   9.929347 244.3.153.239 -> 244.3.176.118 TCP 64 prp > ms-wbt-server [ACK] Seq=1055 Ack=28698 Win=65535 Len=0
25678   9.933351 244.3.153.239 -> 244.3.176.118 TCP 64 prp > ms-wbt-server [ACK] Seq=1055 Ack=30998 Win=65535 Len=0
25727   9.941428 244.3.153.239 -> 244.3.176.118 TCP 64 prp > ms-wbt-server [ACK] Seq=1055 Ack=33298 Win=65535 Len=0
25728   9.941516 244.3.153.239 -> 244.3.176.118 TCP 64 prp > ms-wbt-server [ACK] Seq=1055 Ack=35598 Win=65535 Len=0
25729   9.941521 244.3.153.239 -> 244.3.176.118 TCP 64 prp > ms-wbt-server [ACK] Seq=1055 Ack=37898 Win=65535 Len=0
25793  10.013462 244.3.153.239 -> 244.3.176.118 TCP 64 prp > ms-wbt-server [ACK] Seq=1055 Ack=40198 Win=65535 Len=0
25830  10.025372 244.3.153.239 -> 244.3.176.118 TCP 64 prp > ms-wbt-server [ACK] Seq=1055 Ack=42498 Win=65535 Len=0
25836  10.029378 244.3.153.239 -> 244.3.176.118 TCP 64 prp > ms-wbt-server [ACK] Seq=1055 Ack=44798 Win=65535 Len=0
25854  10.035376 244.3.153.239 -> 244.3.176.118 TCP 64 prp > ms-wbt-server [ACK] Seq=1055 Ack=47098 Win=65535 Len=0
25867  10.039457 244.3.153.239 -> 244.3.176.118 TCP 64 prp > ms-wbt-server [ACK] Seq=1055 Ack=49398 Win=65535 Len=0
25868  10.039523 244.3.153.239 -> 244.3.176.118 TCP 64 prp > ms-wbt-server [ACK] Seq=1055 Ack=51698 Win=65535 Len=0
25953  10.105359 244.3.153.239 -> 244.3.176.118 TCP 64 prp > ms-wbt-server [ACK] Seq=1055 Ack=53998 Win=65535 Len=0
25978  10.121343 244.3.153.239 -> 244.3.176.118 TCP 64 prp > ms-wbt-server [ACK] Seq=1055 Ack=56298 Win=65535 Len=0
25992  10.125346 244.3.153.239 -> 244.3.176.118 TCP 64 prp > ms-wbt-server [ACK] Seq=1055 Ack=58598 Win=65535 Len=0
26000  10.129525 244.3.153.239 -> 244.3.176.118 TCP 64 prp > ms-wbt-server [ACK] Seq=1055 Ack=60898 Win=65535 Len=0
26008  10.133358 244.3.153.239 -> 244.3.176.118 TCP 64 prp > ms-wbt-server [ACK] Seq=1055 Ack=63198 Win=65535 Len=0
26016  10.139354 244.3.153.239 -> 244.3.176.118 TCP 64 prp > ms-wbt-server [ACK] Seq=1055 Ack=65498 Win=65535 Len=0
26109  10.197464 244.3.153.239 -> 244.3.176.118 TCP 64 prp > ms-wbt-server [ACK] Seq=1055 Ack=67798 Win=65535 Len=0
26118  10.207448 244.3.153.239 -> 244.3.176.118 TCP 64 prp > ms-wbt-server [ACK] Seq=1055 Ack=70098 Win=65535 Len=0
26150  10.217568 244.3.153.239 -> 244.3.176.118 TCP 64 prp > ms-wbt-server [ACK] Seq=1055 Ack=72398 Win=65535 Len=0
26163  10.221302 244.3.153.239 -> 244.3.176.118 TCP 64 prp > ms-wbt-server [ACK] Seq=1055 Ack=74698 Win=65535 Len=0
26179  10.231353 244.3.153.239 -> 244.3.176.118 TCP 64 prp > ms-wbt-server [ACK] Seq=1055 Ack=76998 Win=65535 Len=0
26186  10.235341 244.3.153.239 -> 244.3.176.118 TCP 64 prp > ms-wbt-server [ACK] Seq=1055 Ack=79298 Win=65535 Len=0
26200  10.239499 244.3.153.239 -> 244.3.176.118 TCP 64 prp > ms-wbt-server [ACK] Seq=1055 Ack=81598 Win=65535 Len=0
26280  10.289323 244.3.153.239 -> 244.3.176.118 TCP 64 prp > ms-wbt-server [ACK] Seq=1055 Ack=83898 Win=65535 Len=0
26294  10.301356 244.3.153.239 -> 244.3.176.118 TCP 64 prp > ms-wbt-server [ACK] Seq=1055 Ack=86198 Win=65535 Len=0
26320  10.309331 244.3.153.239 -> 244.3.176.118 TCP 64 prp > ms-wbt-server [ACK] Seq=1055 Ack=88498 Win=65535 Len=0
26330  10.313482 244.3.153.239 -> 244.3.176.118 TCP 64 prp > ms-wbt-server [ACK] Seq=1055 Ack=90798 Win=65535 Len=0
26339  10.323359 244.3.153.239 -> 244.3.176.118 TCP 64 prp > ms-wbt-server [ACK] Seq=1055 Ack=93098 Win=65535 Len=0
26358  10.328427 244.3.153.239 -> 244.3.176.118 TCP 64 prp > ms-wbt-server [ACK] Seq=1055 Ack=95398 Win=65535 Len=0
26366  10.333309 244.3.153.239 -> 244.3.176.118 TCP 64 prp > ms-wbt-server [ACK] Seq=1055 Ack=97698 Win=65535 Len=0
26425  10.381415 244.3.153.239 -> 244.3.176.118 TCP 64 prp > ms-wbt-server [ACK] Seq=1055 Ack=99998 Win=65535 Len=0
26452  10.393394 244.3.153.239 -> 244.3.176.118 TCP 64 prp > ms-wbt-server [ACK] Seq=1055 Ack=102298 Win=65535 Len=0
26460  10.401342 244.3.153.239 -> 244.3.176.118 TCP 64 prp > ms-wbt-server [ACK] Seq=1055 Ack=104598 Win=65535 Len=0
26467  10.405365 244.3.153.239 -> 244.3.176.118 TCP 64 prp > ms-wbt-server [ACK] Seq=1055 Ack=106898 Win=65535 Len=0
26475  10.409330 244.3.153.239 -> 244.3.176.118 TCP 64 prp > ms-wbt-server [ACK] Seq=1055 Ack=109198 Win=65535 Len=0
26482  10.415363 244.3.153.239 -> 244.3.176.118 TCP 64 prp > ms-wbt-server [ACK] Seq=1055 Ack=111498 Win=65535 Len=0
26515  10.426199 244.3.153.239 -> 244.3.176.118 TCP 64 prp > ms-wbt-server [ACK] Seq=1055 Ack=113798 Win=65535 Len=0
26548  10.429380 244.3.153.239 -> 244.3.176.118 TCP 64 prp > ms-wbt-server [ACK] Seq=1055 Ack=116098 Win=65535 Len=0
26644  10.473363 244.3.153.239 -> 244.3.176.118 TCP 64 prp > ms-wbt-server [ACK] Seq=1055 Ack=118398 Win=65535 Len=0
26653  10.487435 244.3.153.239 -> 244.3.176.118 TCP 64 prp > ms-wbt-server [ACK] Seq=1055 Ack=120698 Win=65535 Len=0
26672  10.493318 244.3.153.239 -> 244.3.176.118 TCP 64 prp > ms-wbt-server [ACK] Seq=1055 Ack=122998 Win=65535 Len=0
26699  10.497527 244.3.153.239 -> 244.3.176.118 TCP 64 prp > ms-wbt-server [ACK] Seq=1055 Ack=125298 Win=65535 Len=0
26705  10.501484 244.3.153.239 -> 244.3.176.118 TCP 64 prp > ms-wbt-server [ACK] Seq=1055 Ack=127598 Win=65535 Len=0
26730  10.509462 244.3.153.239 -> 244.3.176.118 TCP 64 prp > ms-wbt-server [ACK] Seq=1055 Ack=129898 Win=65535 Len=0
26745  10.517457 244.3.153.239 -> 244.3.176.118 TCP 64 prp > ms-wbt-server [ACK] Seq=1055 Ack=132198 Win=65535 Len=0
26756  10.521958 244.3.153.239 -> 244.3.176.118 TCP 64 prp > ms-wbt-server [ACK] Seq=1055 Ack=134498 Win=65535 Len=0
26794  10.565384 244.3.153.239 -> 244.3.176.118 TCP 64 prp > ms-wbt-server [ACK] Seq=1055 Ack=136798 Win=65535 Len=0
26816  10.579453 244.3.153.239 -> 244.3.176.118 TCP 64 prp > ms-wbt-server [ACK] Seq=1055 Ack=139098 Win=65535 Len=0
26839  10.585341 244.3.153.239 -> 244.3.176.118 TCP 64 prp > ms-wbt-server [ACK] Seq=1055 Ack=141398 Win=65535 Len=0
26883  10.593430 244.3.153.239 -> 244.3.176.118 TCP 64 prp > ms-wbt-server [ACK] Seq=1055 Ack=143698 Win=65535 Len=0
26905  10.597594 244.3.153.239 -> 244.3.176.118 TCP 64 prp > ms-wbt-server [ACK] Seq=1055 Ack=145998 Win=65535 Len=0
26906  10.597665 244.3.153.239 -> 244.3.176.118 TCP 64 prp > ms-wbt-server [ACK] Seq=1055 Ack=148298 Win=65535 Len=0
26923  10.601319 244.3.153.239 -> 244.3.176.118 TCP 64 prp > ms-wbt-server [ACK] Seq=1055 Ack=150598 Win=65535 Len=0
26945  10.617586 244.3.153.239 -> 244.3.176.118 TCP 64 prp > ms-wbt-server [ACK] Seq=1055 Ack=152898 Win=65535 Len=0
26954  10.621406 244.3.153.239 -> 244.3.176.118 TCP 64 prp > ms-wbt-server [ACK] Seq=1055 Ack=155198 Win=65535 Len=0
27023  10.661283 244.3.153.239 -> 244.3.176.118 TCP 64 prp > ms-wbt-server [ACK] Seq=1055 Ack=157498 Win=65535 Len=0
27131  10.687342 244.3.153.239 -> 244.3.176.118 TCP 64 prp > ms-wbt-server [ACK] Seq=1055 Ack=159798 Win=65535 Len=0
27147  10.691616 244.3.153.239 -> 244.3.176.118 TCP 64 prp > ms-wbt-server [ACK] Seq=1055 Ack=162098 Win=65535 Len=0
27148  10.691705 244.3.153.239 -> 244.3.176.118 TCP 64 prp > ms-wbt-server [ACK] Seq=1055 Ack=164398 Win=65535 Len=0
27149  10.691710 244.3.153.239 -> 244.3.176.118 TCP 64 prp > ms-wbt-server [ACK] Seq=1055 Ack=166698 Win=65535 Len=0
27162  10.695474 244.3.153.239 -> 244.3.176.118 TCP 64 prp > ms-wbt-server [ACK] Seq=1055 Ack=168998 Win=65535 Len=0
27163  10.695539 244.3.153.239 -> 244.3.176.118 TCP 64 prp > ms-wbt-server [ACK] Seq=1055 Ack=171298 Win=65535 Len=0
27193  10.711341 244.3.153.239 -> 244.3.176.118 TCP 64 prp > ms-wbt-server [ACK] Seq=1055 Ack=173598 Win=65535 Len=0
27197  10.715363 244.3.153.239 -> 244.3.176.118 TCP 64 prp > ms-wbt-server [ACK] Seq=1055 Ack=175898 Win=65535 Len=0
27251  10.753327 244.3.153.239 -> 244.3.176.118 TCP 64 prp > ms-wbt-server [ACK] Seq=1055 Ack=178198 Win=65535 Len=0
27340  10.781410 244.3.153.239 -> 244.3.176.118 TCP 64 prp > ms-wbt-server [ACK] Seq=1055 Ack=180498 Win=65535 Len=0
27354  10.789319 244.3.153.239 -> 244.3.176.118 TCP 64 prp > ms-wbt-server [ACK] Seq=1055 Ack=182798 Win=65535 Len=0
27419  10.827407 244.3.153.239 -> 244.3.176.118 TCP 64 prp > ms-wbt-server [ACK] Seq=1055 Ack=183228 Win=65105 Len=0
28059  11.255411 244.3.153.239 -> 244.3.176.118 TCP 64 prp > ms-wbt-server [ACK] Seq=1055 Ack=183529 Win=64804 Len=0
28424  11.455503 244.3.153.239 -> 244.3.176.118 TCP 64 prp > ms-wbt-server [ACK] Seq=1055 Ack=183666 Win=64667 Len=0
28542  11.519312 244.3.153.239 -> 244.3.176.118 TCP 64 prp > ms-wbt-server [ACK] Seq=1055 Ack=185599 Win=65535 Len=0
28766  11.678099 244.3.153.239 -> 244.3.176.118 TCP 64 prp > ms-wbt-server [ACK] Seq=1055 Ack=187899 Win=65535 Len=0
28770  11.681457 244.3.153.239 -> 244.3.176.118 TCP 64 prp > ms-wbt-server [ACK] Seq=1055 Ack=190199 Win=65535 Len=0
28774  11.685577 244.3.153.239 -> 244.3.176.118 TCP 70 [TCP Dup ACK 28770#1] prp > ms-wbt-server [ACK] Seq=1055 Ack=190199 Win=65535 Len=0 SLE=191349 SRE=192499
28775  11.685665 244.3.153.239 -> 244.3.176.118 TCP 70 [TCP Dup ACK 28770#2] prp > ms-wbt-server [ACK] Seq=1055 Ack=190199 Win=65535 Len=0 SLE=191349 SRE=193610
28776  11.685670 244.3.153.239 -> 244.3.176.118 TCP 64 prp > ms-wbt-server [ACK] Seq=1055 Ack=193610 Win=65535 Len=0
34975  14.675414 244.3.153.239 -> 244.3.176.118 TCP 64 prp > ms-wbt-server [ACK] Seq=1055 Ack=193799 Win=65346 Len=0
57203  23.427549 244.3.153.239 -> 244.3.176.118 TCP 64 prp > ms-wbt-server [ACK] Seq=1766 Ack=193881 Win=65264 Len=0
60994  24.837615 244.3.153.239 -> 244.3.176.118 TCP 64 prp > ms-wbt-server [ACK] Seq=2054 Ack=193979 Win=65166 Len=0
61837  25.329381 244.3.153.239 -> 244.3.176.118 TCP 64 prp > ms-wbt-server [ACK] Seq=2144 Ack=194059 Win=65086 Len=0
158191  53.895618 244.3.153.239 -> 41.177.24.241 TCP 66 connect > imaps [SYN] Seq=0 Win=65535 Len=0 MSS=1150 SACK_PERM=1
158225  53.899690 244.3.153.239 -> 41.177.24.241 TCP 66 unbind-cluster > imaps [SYN] Seq=0 Win=65535 Len=0 MSS=1150 SACK_PERM=1
158239  53.903558 244.3.153.239 -> 41.177.24.241 TCP 66 ias-auth > imaps [SYN] Seq=0 Win=65535 Len=0 MSS=1150 SACK_PERM=1
158599  54.031640 244.3.153.239 -> 41.177.24.241 TCP 64 connect > imaps [ACK] Seq=1 Ack=1 Win=65535 Len=0
158620  54.035541 244.3.153.239 -> 41.177.24.241 TCP 64 unbind-cluster > imaps [ACK] Seq=1 Ack=1 Win=65535 Len=0
158621  54.035627 244.3.153.239 -> 41.177.24.241 TCP 64 ias-auth > imaps [ACK] Seq=1 Ack=1 Win=65535 Len=0
159833  54.443520 244.3.153.239 -> 41.177.24.241 TCP 64 stone-design-1 > imaps [ACK] Seq=65 Ack=81 Win=65535 Len=0
161694  55.053427 244.3.153.239 -> 41.177.24.241 TCP 64 ias-auth > imaps [ACK] Seq=244 Ack=823 Win=64713 Len=0
166983  56.081370 244.3.153.239 -> 41.177.24.241 TCP 64 connect > imaps [ACK] Seq=569 Ack=1436 Win=65253 Len=0
168325  56.283636 244.3.153.239 -> 41.177.24.241 TCP 64 unbind-cluster > imaps [ACK] Seq=551 Ack=1403 Win=65328 Len=0
169539  56.489386 244.3.153.239 -> 41.177.24.241 TCP 64 ias-auth > imaps [ACK] Seq=383 Ack=2996 Win=65535 Len=0
178937  60.141419 244.3.153.239 -> 244.3.176.118 TCP 64 prp > ms-wbt-server [ACK] Seq=3518 Ack=194823 Win=65535 Len=0
180680  60.845348 244.3.153.239 -> 41.177.24.241 TCP 64 ias-auth > imaps [ACK] Seq=469 Ack=3684 Win=64847 Len=0
200339  69.075324 244.3.153.239 -> 244.3.176.118 TCP 64 prp > ms-wbt-server [ACK] Seq=3596 Ack=195256 Win=65102 Len=0
200380  69.089447 244.3.153.239 -> 244.3.176.118 TCP 64 prp > ms-wbt-server [ACK] Seq=3596 Ack=196617 Win=65535 Len=0
211789  72.919302 244.3.153.239 -> 244.3.176.118 TCP 64 prp > ms-wbt-server [ACK] Seq=4106 Ack=197172 Win=64980 Len=0
246533  86.393362 244.3.153.239 -> 244.3.176.118 TCP 64 prp > ms-wbt-server [ACK] Seq=4199 Ack=197509 Win=64643 Len=0
251467  88.909391 244.3.153.239 -> 244.3.176.118 TCP 64 prp > ms-wbt-server [ACK] Seq=4685 Ack=197850 Win=65489 Len=0
254884  90.517473 244.3.153.239 -> 244.3.176.118 TCP 64 prp > ms-wbt-server [ACK] Seq=5115 Ack=198358 Win=64981 Len=0
256588  91.321358 244.3.153.239 -> 244.3.176.118 TCP 64 prp > ms-wbt-server [ACK] Seq=5333 Ack=198404 Win=64935 Len=0
257355  91.523345 244.3.153.239 -> 244.3.176.118 TCP 64 prp > ms-wbt-server [ACK] Seq=5333 Ack=198506 Win=64833 Len=0
274082  92.331548 244.3.153.239 -> 244.3.176.118 TCP 64 prp > ms-wbt-server [ACK] Seq=5468 Ack=198568 Win=64771 Len=0
275070  92.721347 244.3.153.239 -> 244.3.176.118 TCP 64 prp > ms-wbt-server [ACK] Seq=5544 Ack=199599 Win=65535 Len=0
299310 100.929368 244.3.153.239 -> 41.177.24.241 TCP 64 connect > imaps [FIN, ACK] Seq=603 Ack=1436 Win=65253 Len=0
299357 100.945377 244.3.153.239 -> 41.177.24.241 TCP 64 unbind-cluster > imaps [FIN, ACK] Seq=585 Ack=1403 Win=65328 Len=0
299443 100.965359 244.3.153.239 -> 41.177.24.241 TCP 64 ias-auth > imaps [FIN, ACK] Seq=503 Ack=3684 Win=64847 Len=0
299678 101.025417 244.3.153.239 -> 41.177.24.241 TCP 64 connect > imaps [RST, ACK] Seq=604 Ack=1459 Win=0 Len=0
299755 101.062115 244.3.153.239 -> 41.177.24.241 TCP 64 unbind-cluster > imaps [RST, ACK] Seq=586 Ack=1426 Win=0 Len=0
299962 101.109360 244.3.153.239 -> 41.177.24.241 TCP 64 ias-auth > imaps [RST, ACK] Seq=504 Ack=3707 Win=0 Len=0
335366 117.319368 244.3.153.239 -> 244.3.176.118 TCP 64 prp > ms-wbt-server [ACK] Seq=5748 Ack=200055 Win=65079 Len=0
339187 117.733340 244.3.153.239 -> 244.3.176.118 TCP 64 prp > ms-wbt-server [ACK] Seq=5845 Ack=200810 Win=65535 Len=0
348190 118.035349 244.3.153.239 -> 244.3.176.118 TCP 64 prp > ms-wbt-server [ACK] Seq=5862 Ack=201444 Win=64901 Len=0
352009 119.187355 244.3.153.239 -> 244.3.176.118 TCP 64 prp > ms-wbt-server [ACK] Seq=6091 Ack=201550 Win=64795 Len=0
352703 119.675414 244.3.153.239 -> 244.3.176.118 TCP 64 prp > ms-wbt-server [ACK] Seq=6153 Ack=201677 Win=64668 Len=0
352859 119.775417 244.3.153.239 -> 244.3.176.118 TCP 64 prp > ms-wbt-server [ACK] Seq=6153 Ack=201709 Win=64636 Len=0
352990 119.825316 244.3.153.239 -> 244.3.176.118 TCP 64 prp > ms-wbt-server [ACK] Seq=6153 Ack=204009 Win=65535 Len=0
353001 119.829385 244.3.153.239 -> 244.3.176.118 TCP 70 [TCP Dup ACK 352990#1] prp > ms-wbt-server [ACK] Seq=6153 Ack=204009 Win=65535 Len=0 SLE=205159 SRE=205432
353002 119.829462 244.3.153.239 -> 244.3.176.118 TCP 64 prp > ms-wbt-server [ACK] Seq=6153 Ack=205432 Win=65535 Len=0
355004 120.995361 244.3.153.239 -> 244.3.176.118 TCP 64 prp > ms-wbt-server [ACK] Seq=6316 Ack=205464 Win=65503 Len=0
399181 134.335357 244.3.153.239 -> 244.3.176.118 TCP 64 prp > ms-wbt-server [ACK] Seq=6879 Ack=205915 Win=65052 Len=0
399534 134.471411 244.3.153.239 -> 244.3.176.118 TCP 64 prp > ms-wbt-server [ACK] Seq=6896 Ack=205987 Win=64980 Len=0
439212 143.035370 244.3.153.239 -> 244.3.176.118 TCP 64 prp > ms-wbt-server [ACK] Seq=6971 Ack=206298 Win=64669 Len=0
439699 143.223343 244.3.153.239 -> 244.3.176.118 TCP 64 prp > ms-wbt-server [ACK] Seq=7005 Ack=206448 Win=64519 Len=0
440528 143.435443 244.3.153.239 -> 244.3.176.118 TCP 64 prp > ms-wbt-server [ACK] Seq=7039 Ack=206580 Win=64387 Len=0
442067 143.929375 244.3.153.239 -> 244.3.176.118 TCP 64 prp > ms-wbt-server [ACK] Seq=7090 Ack=206746 Win=65399 Len=0
466632 153.687303 244.3.153.239 -> 244.3.176.118 TCP 64 prp > ms-wbt-server [ACK] Seq=7180 Ack=206780 Win=65365 Len=0
490680 161.739333 244.3.153.239 -> 244.3.176.118 TCP 64 prp > ms-wbt-server [ACK] Seq=7511 Ack=207950 Win=65535 Len=0
491060 162.003423 244.3.153.239 -> 244.3.176.118 TCP 64 prp > ms-wbt-server [ACK] Seq=7528 Ack=208056 Win=65429 Len=0
491390 162.237507 244.3.153.239 -> 244.3.176.118 TCP 64 prp > ms-wbt-server [ACK] Seq=7528 Ack=208098 Win=65387 Len=0
491821 162.439294 244.3.153.239 -> 244.3.176.118 TCP 64 prp > ms-wbt-server [ACK] Seq=7528 Ack=208155 Win=65330 Len=0
515303 166.060140 244.3.153.239 -> 244.3.176.118 TCP 64 prp > ms-wbt-server [ACK] Seq=7714 Ack=208281 Win=65204 Len=0
516315 166.663326 244.3.153.239 -> 244.3.176.118 TCP 64 prp > ms-wbt-server [ACK] Seq=7762 Ack=208353 Win=65132 Len=0
517980 167.565444 244.3.153.239 -> 244.3.176.118 TCP 64 prp > ms-wbt-server [ACK] Seq=7810 Ack=208399 Win=65086 Len=0
519894 168.069364 244.3.153.239 -> 244.3.176.118 TCP 64 prp > ms-wbt-server [ACK] Seq=7834 Ack=208447 Win=65038 Len=0
520801 168.573314 244.3.153.239 -> 244.3.176.118 TCP 64 prp > ms-wbt-server [ACK] Seq=7858 Ack=208497 Win=64988 Len=0
521930 169.178119 244.3.153.239 -> 244.3.176.118 TCP 64 prp > ms-wbt-server [ACK] Seq=7906 Ack=208603 Win=64882 Len=0
522920 169.681317 244.3.153.239 -> 244.3.176.118 TCP 64 prp > ms-wbt-server [ACK] Seq=7930 Ack=208659 Win=64826 Len=0
524426 170.389306 244.3.153.239 -> 244.3.176.118 TCP 64 prp > ms-wbt-server [ACK] Seq=7954 Ack=208717 Win=64768 Len=0
554864 178.646067 244.3.153.239 -> 244.3.176.118 TCP 64 prp > ms-wbt-server [ACK] Seq=9275 Ack=208825 Win=64660 Len=0
555793 178.960067 244.3.153.239 -> 244.3.176.118 TCP 64 prp > ms-wbt-server [ACK] Seq=9275 Ack=208867 Win=64618 Len=0
555835 178.974089 244.3.153.239 -> 244.3.176.118 TCP 64 prp > ms-wbt-server [ACK] Seq=9275 Ack=208973 Win=64512 Len=0
556421 179.172429 244.3.153.239 -> 244.3.176.118 TCP 64 prp > ms-wbt-server [ACK] Seq=9358 Ack=209050 Win=64435 Len=0
566810 181.215417 244.3.153.239 -> 244.3.176.118 TCP 64 prp > ms-wbt-server [ACK] Seq=9489 Ack=209080 Win=64405 Len=0
580492 184.571719 244.3.153.239 -> 41.177.24.241 TCP 64 stone-design-1 > imaps [ACK] Seq=97 Ack=121 Win=65495 Len=0
656277 205.599350 244.3.153.239 -> 244.3.176.118 TCP 64 prp > ms-wbt-server [ACK] Seq=9567 Ack=210304 Win=65535 Len=0
656868 205.897581 244.3.153.239 -> 244.3.176.118 TCP 64 prp > ms-wbt-server [ACK] Seq=9582 Ack=210890 Win=64949 Len=0
666960 207.703770 244.3.153.239 -> 244.3.176.118 TCP 64 prp > ms-wbt-server [ACK] Seq=9900 Ack=211386 Win=64453 Len=0
671827 209.313275 244.3.153.239 -> 244.3.176.118 TCP 64 prp > ms-wbt-server [ACK] Seq=10357 Ack=211792 Win=65197 Len=0
677981 212.231854 244.3.153.239 -> 244.3.176.118 TCP 64 prp > ms-wbt-server [ACK] Seq=10429 Ack=211912 Win=65077 Len=0
680430 212.935290 244.3.153.239 -> 244.3.176.118 TCP 64 prp > ms-wbt-server [ACK] Seq=10477 Ack=211984 Win=65005 Len=0
681370 213.537539 244.3.153.239 -> 244.3.176.118 TCP 64 prp > ms-wbt-server [ACK] Seq=10525 Ack=212020 Win=64969 Len=0
681942 213.839438 244.3.153.239 -> 244.3.176.118 TCP 64 prp > ms-wbt-server [ACK] Seq=10549 Ack=212056 Win=64933 Len=0
683088 214.243277 244.3.153.239 -> 244.3.176.118 TCP 64 prp > ms-wbt-server [ACK] Seq=10573 Ack=212092 Win=64897 Len=0
684772 214.847294 244.3.153.239 -> 244.3.176.118 TCP 64 prp > ms-wbt-server [ACK] Seq=10621 Ack=212164 Win=64825 Len=0
685567 215.352420 244.3.153.239 -> 244.3.176.118 TCP 64 prp > ms-wbt-server [ACK] Seq=10645 Ack=212200 Win=64789 Len=0
687173 215.951841 244.3.153.239 -> 244.3.176.118 TCP 64 prp > ms-wbt-server [ACK] Seq=10693 Ack=212302 Win=64687 Len=0
690972 217.863417 244.3.153.239 -> 244.3.176.118 TCP 64 prp > ms-wbt-server [ACK] Seq=10765 Ack=212399 Win=64590 Len=0
692005 218.472390 244.3.153.239 -> 244.3.176.118 TCP 64 prp > ms-wbt-server [ACK] Seq=10813 Ack=212471 Win=64518 Len=0
693590 219.171350 244.3.153.239 -> 244.3.176.118 TCP 64 prp > ms-wbt-server [ACK] Seq=10861 Ack=212507 Win=64482 Len=0
694251 219.573886 244.3.153.239 -> 244.3.176.118 TCP 64 prp > ms-wbt-server [ACK] Seq=10885 Ack=212543 Win=64446 Len=0
694682 219.875376 244.3.153.239 -> 244.3.176.118 TCP 64 prp > ms-wbt-server [ACK] Seq=10909 Ack=212579 Win=64410 Len=0
696212 220.578817 244.3.153.239 -> 244.3.176.118 TCP 64 prp > ms-wbt-server [ACK] Seq=10957 Ack=212651 Win=65499 Len=0
697601 220.984141 244.3.153.239 -> 244.3.176.118 TCP 64 prp > ms-wbt-server [ACK] Seq=10981 Ack=212687 Win=65463 Len=0
698304 221.383349 244.3.153.239 -> 244.3.176.118 TCP 64 prp > ms-wbt-server [ACK] Seq=11005 Ack=212723 Win=65427 Len=0
701497 222.891281 244.3.153.239 -> 244.3.176.118 TCP 64 prp > ms-wbt-server [ACK] Seq=11366 Ack=212787 Win=65363 Len=0
709832 226.147316 244.3.153.239 -> 244.3.176.118 TCP 64 prp > ms-wbt-server [ACK] Seq=11819 Ack=213380 Win=64770 Len=0
712842 227.387556 244.3.153.239 -> 244.3.39.64  UDP 123 Source port: cap  Destination port: snmp
726614 232.743357 244.3.153.239 -> 244.3.176.118 TCP 64 prp > ms-wbt-server [ACK] Seq=12405 Ack=213516 Win=64634 Len=0
729708 234.284112 244.3.153.239 -> 244.3.39.64  UDP 123 Source port: cap  Destination port: snmp
748910 239.989324 244.3.153.239 -> 244.3.176.118 TCP 64 prp > ms-wbt-server [ACK] Seq=13698 Ack=213682 Win=64468 Len=0
749142 240.161319 244.3.153.239 -> 244.3.176.118 TCP 64 prp > ms-wbt-server [ACK] Seq=13715 Ack=213818 Win=65535 Len=0
749519 240.293398 244.3.153.239 -> 244.3.39.64  UDP 123 Source port: cap  Destination port: snmp
749584 240.303425 244.3.153.239 -> 244.3.176.118 TCP 64 prp > ms-wbt-server [ACK] Seq=13819 Ack=213954 Win=65399 Len=0
752136 241.321322 244.3.153.239 -> 244.3.176.118 TCP 64 prp > ms-wbt-server [ACK] Seq=14058 Ack=214083 Win=65270 Len=0
780763 252.311523 244.3.153.239 -> 244.3.39.164 UDP 123 Source port: cap  Destination port: snmp
785521 254.576086 244.3.153.239 -> 244.3.176.118 TCP 64 prp > ms-wbt-server [ACK] Seq=14075 Ack=214117 Win=65236 Len=0
795642 259.289313 244.3.153.239 -> 244.3.39.164 UDP 123 Source port: cap  Destination port: snmp
813265 265.289424 244.3.153.239 -> 244.3.39.164 UDP 123 Source port: cap  Destination port: snmp
830282 271.289421 244.3.153.239 -> 244.3.39.164 UDP 123 Source port: cap  Destination port: snmp
834503 273.187298 244.3.153.239 -> 244.3.176.118 TCP 64 prp > ms-wbt-server [ACK] Seq=14467 Ack=214159 Win=65194 Len=0
843534 277.309510 244.3.153.239 -> 41.177.153.71 UDP 123 Source port: cap  Destination port: snmp
875996 290.085303 244.3.153.239 -> 244.3.176.118 TCP 64 prp > ms-wbt-server [ACK] Seq=14963 Ack=214189 Win=65164 Len=0
876971 290.601813 244.3.153.239 -> 244.3.176.118 TCP 64 prp > ms-wbt-server [ACK] Seq=15074 Ack=214351 Win=65002 Len=0
877136 290.721273 244.3.153.239 -> 244.3.176.118 TCP 64 prp > ms-wbt-server [ACK] Seq=15091 Ack=214419 Win=64934 Len=0
877140 290.727972 244.3.153.239 -> 244.3.176.118 TCP 64 prp > ms-wbt-server [ACK] Seq=15091 Ack=215607 Win=65535 Len=0
877566 290.989308 244.3.153.239 -> 244.3.176.118 TCP 64 prp > ms-wbt-server [ACK] Seq=15091 Ack=216160 Win=64982 Len=0
900678 297.289392 244.3.153.239 -> 244.3.176.118 TCP 64 prp > ms-wbt-server [ACK] Seq=16026 Ack=216272 Win=64870 Len=0
901748 297.529239 244.3.153.239 -> 244.3.176.118 TCP 64 prp > ms-wbt-server [ACK] Seq=16043 Ack=216321 Win=64821 Len=0
902311 297.685319 244.3.153.239 -> 244.3.176.118 TCP 64 prp > ms-wbt-server [ACK] Seq=16043 Ack=216418 Win=64724 Len=0
910299 300.851658 244.3.153.239 -> 244.3.176.118 TCP 64 prp > ms-wbt-server [ACK] Seq=16621 Ack=216480 Win=64662 Len=0
912246 301.853296 244.3.153.239 -> 244.3.176.118 TCP 64 prp > ms-wbt-server [ACK] Seq=16738 Ack=216636 Win=64506 Len=0
916188 304.081460 244.3.153.239 -> 244.3.176.118 TCP 64 prp > ms-wbt-server [ACK] Seq=17288 Ack=216768 Win=65535 Len=0
916306 304.187411 244.3.153.239 -> 244.3.176.118 TCP 64 prp > ms-wbt-server [ACK] Seq=17288 Ack=216904 Win=65399 Len=0
916851 304.507441 244.3.153.239 -> 244.3.176.118 TCP 64 prp > ms-wbt-server [ACK] Seq=17288 Ack=216972 Win=65331 Len=0
916915 304.523266 244.3.153.239 -> 244.3.176.118 TCP 64 prp > ms-wbt-server [ACK] Seq=17288 Ack=217085 Win=65218 Len=0
920932 305.427442 244.3.153.239 -> 41.177.24.241 TCP 64 stone-design-1 > imaps [ACK] Seq=129 Ack=161 Win=65455 Len=0
923963 307.083287 244.3.153.239 -> 244.3.176.118 TCP 64 prp > ms-wbt-server [ACK] Seq=18033 Ack=217257 Win=65046 Len=0
924482 307.478112 244.3.153.239 -> 244.3.176.118 TCP 64 prp > ms-wbt-server [ACK] Seq=18033 Ack=217414 Win=64889 Len=0
927917 309.203420 244.3.153.239 -> 244.3.176.118 TCP 64 prp > ms-wbt-server [ACK] Seq=18352 Ack=217493 Win=64810 Len=0
929741 309.741326 244.3.153.239 -> 244.3.176.118 TCP 64 prp > ms-wbt-server [ACK] Seq=18442 Ack=217589 Win=64714 Len=0
931645 310.403257 244.3.153.239 -> 244.3.176.118 TCP 64 prp > ms-wbt-server [ACK] Seq=18459 Ack=217623 Win=64680 Len=0
932369 310.605318 244.3.153.239 -> 244.3.176.118 TCP 64 prp > ms-wbt-server [ACK] Seq=18459 Ack=217639 Win=64664 Len=0
932605 310.678761 244.3.153.239 -> 244.3.176.118 TCP 64 prp > ms-wbt-server [ACK] Seq=18459 Ack=219666 Win=65535 Len=0
948551 314.627361 244.3.153.239 -> 244.3.176.118 TCP 64 prp > ms-wbt-server [ACK] Seq=18459 Ack=219705 Win=65496 Len=0
954568 316.539411 244.3.153.239 -> 244.3.176.118 TCP 64 prp > ms-wbt-server [ACK] Seq=18459 Ack=219721 Win=65480 Len=0
961629 319.547314 244.3.153.239 -> 244.3.176.118 TCP 64 prp > ms-wbt-server [ACK] Seq=18459 Ack=221240 Win=65535 Len=0
964738 321.137428 244.3.153.239 -> 244.3.176.118 TCP 64 prp > ms-wbt-server [ACK] Seq=18459 Ack=223540 Win=65535 Len=0
964744 321.141304 244.3.153.239 -> 244.3.176.118 TCP 64 prp > ms-wbt-server [ACK] Seq=18459 Ack=225840 Win=65535 Len=0
964989 321.266752 244.3.153.239 -> 244.3.176.118 TCP 64 prp > ms-wbt-server [ACK] Seq=18459 Ack=226813 Win=64562 Len=0
965130 321.325321 244.3.153.239 -> 244.3.176.118 TCP 70 [TCP Dup ACK 964989#1] prp > ms-wbt-server [ACK] Seq=18459 Ack=226813 Win=64562 Len=0 SLE=227004 SRE=227056
965396 321.425269 244.3.153.239 -> 244.3.176.118 TCP 70 [TCP Dup ACK 964989#2] prp > ms-wbt-server [ACK] Seq=18459 Ack=226813 Win=64562 Len=0 SLE=227004 SRE=228147
967240 322.165832 244.3.153.239 -> 244.3.176.118 TCP 64 prp > ms-wbt-server [ACK] Seq=18459 Ack=228147 Win=65535 Len=0
979870 326.797411 244.3.153.239 -> 244.3.176.118 TCP 64 prp > ms-wbt-server [ACK] Seq=18688 Ack=228189 Win=65493 Len=0
