3506   1.140184 244.3.194.118 -> 244.3.41.84  TCP 64 iclpv-nlc > telnet [ACK] Seq=29 Ack=2415 Win=65535 Len=0
17573   5.224234 244.3.194.118 -> 244.3.41.84  TCP 64 iclpv-nlc > telnet [ACK] Seq=108 Ack=4074 Win=65535 Len=0
17911   5.467884 244.3.194.118 -> 244.3.41.84  TCP 64 iclpv-nlc > telnet [ACK] Seq=118 Ack=6359 Win=65535 Len=0
22447   7.994419 244.3.194.118 -> 244.3.41.84  TCP 64 iclpv-nlc > telnet [ACK] Seq=595 Ack=6931 Win=64963 Len=0
35454  14.820302 244.3.194.118 -> 244.3.41.84  TCP 64 [TCP Dup ACK 33945#1] iclpv-nlc > telnet [ACK] Seq=701 Ack=6931 Win=64963 Len=0
35455  14.820414 244.3.194.118 -> 244.3.41.84  TCP 64 iclpv-nlc > telnet [ACK] Seq=701 Ack=9345 Win=65535 Len=0
40254  16.838264 244.3.194.118 -> 244.3.41.84  TCP 64 iclpv-nlc > telnet [ACK] Seq=780 Ack=9551 Win=65329 Len=0
42597  17.947648 244.3.194.118 -> 244.3.41.84  TCP 64 iclpv-nlc > telnet [ACK] Seq=797 Ack=10520 Win=64360 Len=0
83374  32.423414 244.3.194.118 -> 244.3.41.84  TCP 64 iclpv-nlc > telnet [ACK] Seq=836 Ack=13009 Win=65535 Len=0
89424  34.535455 244.3.194.118 -> 244.3.41.84  TCP 64 iclpv-nlc > telnet [ACK] Seq=846 Ack=15498 Win=65535 Len=0
91249  35.075980 244.3.194.118 -> 244.3.41.84  TCP 64 iclpv-nlc > telnet [ACK] Seq=856 Ack=17987 Win=65535 Len=0
95115  35.975286 244.3.194.118 -> 244.3.41.84  TCP 64 iclpv-nlc > telnet [ACK] Seq=866 Ack=20476 Win=65535 Len=0
98400  36.713523 244.3.194.118 -> 244.3.41.84  TCP 64 iclpv-nlc > telnet [ACK] Seq=876 Ack=22965 Win=65535 Len=0
103230  37.585462 244.3.194.118 -> 244.3.41.84  TCP 64 iclpv-nlc > telnet [ACK] Seq=886 Ack=25454 Win=65535 Len=0
106998  38.542360 244.3.194.118 -> 244.3.41.84  TCP 64 iclpv-nlc > telnet [ACK] Seq=896 Ack=27943 Win=65535 Len=0
109984  39.394317 244.3.194.118 -> 244.3.41.84  TCP 64 iclpv-nlc > telnet [ACK] Seq=906 Ack=30432 Win=65535 Len=0
117966  42.324641 244.3.194.118 -> 244.3.41.84  TCP 64 iclpv-nlc > telnet [ACK] Seq=916 Ack=32921 Win=65535 Len=0
120052  42.938827 244.3.194.118 -> 244.3.41.84  TCP 64 iclpv-nlc > telnet [ACK] Seq=926 Ack=35410 Win=65535 Len=0
162837  55.311739 244.3.194.118 -> 244.3.41.84  TCP 64 iclpv-nlc > telnet [ACK] Seq=960 Ack=37899 Win=65535 Len=0
175979  58.539572 244.3.194.118 -> 244.3.41.84  TCP 64 iclpv-nlc > telnet [ACK] Seq=970 Ack=40388 Win=65535 Len=0
190719  65.577148 244.3.194.118 -> 244.3.41.84  TCP 64 iclpv-nlc > telnet [ACK] Seq=980 Ack=42877 Win=65535 Len=0
221044  75.745494 244.3.194.118 -> 244.3.41.84  TCP 64 iclpv-nlc > telnet [ACK] Seq=1014 Ack=45367 Win=65535 Len=0
238780  82.881375 244.3.194.118 -> 244.3.41.84  TCP 64 iclpv-nlc > telnet [ACK] Seq=1024 Ack=47856 Win=65535 Len=0
239808  83.263788 244.3.194.118 -> 244.3.41.84  TCP 64 iclpv-nlc > telnet [ACK] Seq=1034 Ack=50345 Win=65535 Len=0
240913  83.753065 244.3.194.118 -> 244.3.41.84  TCP 64 iclpv-nlc > telnet [ACK] Seq=1044 Ack=52834 Win=65535 Len=0
274145  92.357271 244.3.194.118 -> 244.3.41.84  TCP 64 iclpv-nlc > telnet [ACK] Seq=1078 Ack=55323 Win=65535 Len=0
287292  95.965629 244.3.194.118 -> 244.3.41.84  TCP 64 iclpv-nlc > telnet [ACK] Seq=1088 Ack=57812 Win=65535 Len=0
287780  96.126026 244.3.194.118 -> 244.3.41.84  TCP 64 iclpv-nlc > telnet [ACK] Seq=1098 Ack=60301 Win=65535 Len=0
288183  96.263729 244.3.194.118 -> 244.3.41.84  TCP 64 iclpv-nlc > telnet [ACK] Seq=1108 Ack=62790 Win=65535 Len=0
288651  96.429002 244.3.194.118 -> 244.3.41.84  TCP 64 iclpv-nlc > telnet [ACK] Seq=1118 Ack=65279 Win=65535 Len=0
289246  96.564698 244.3.194.118 -> 244.3.41.84  TCP 64 iclpv-nlc > telnet [ACK] Seq=1128 Ack=67768 Win=65535 Len=0
289751  96.727647 244.3.194.118 -> 244.3.41.84  TCP 64 iclpv-nlc > telnet [ACK] Seq=1138 Ack=70257 Win=65535 Len=0
290297  96.848999 244.3.194.118 -> 244.3.41.84  TCP 64 iclpv-nlc > telnet [ACK] Seq=1148 Ack=72746 Win=65535 Len=0
290550  97.019522 244.3.194.118 -> 244.3.41.84  TCP 64 iclpv-nlc > telnet [ACK] Seq=1158 Ack=75235 Win=65535 Len=0
290951  97.130341 244.3.194.118 -> 244.3.41.84  TCP 64 iclpv-nlc > telnet [ACK] Seq=1169 Ack=77724 Win=65535 Len=0
291329  97.339520 244.3.194.118 -> 244.3.41.84  TCP 64 iclpv-nlc > telnet [ACK] Seq=1179 Ack=80213 Win=65535 Len=0
291508  97.452187 244.3.194.118 -> 244.3.41.84  TCP 64 iclpv-nlc > telnet [ACK] Seq=1189 Ack=82702 Win=65535 Len=0
291742  97.606021 244.3.194.118 -> 244.3.41.84  TCP 64 iclpv-nlc > telnet [ACK] Seq=1199 Ack=85191 Win=65535 Len=0
291988  97.754890 244.3.194.118 -> 244.3.41.84  TCP 64 iclpv-nlc > telnet [ACK] Seq=1209 Ack=87680 Win=65535 Len=0
292177  97.861377 244.3.194.118 -> 244.3.41.84  TCP 64 iclpv-nlc > telnet [ACK] Seq=1219 Ack=90169 Win=65535 Len=0
293176  98.437099 244.3.194.118 -> 244.3.41.84  TCP 64 iclpv-nlc > telnet [ACK] Seq=1229 Ack=92658 Win=65535 Len=0
293671  98.685551 244.3.194.118 -> 244.3.41.84  TCP 64 iclpv-nlc > telnet [ACK] Seq=1239 Ack=95147 Win=65535 Len=0
293784  98.791763 244.3.194.118 -> 244.3.41.84  TCP 64 iclpv-nlc > telnet [ACK] Seq=1249 Ack=97636 Win=65535 Len=0
293931  98.871274 244.3.194.118 -> 244.3.41.84  TCP 64 iclpv-nlc > telnet [ACK] Seq=1259 Ack=100125 Win=65535 Len=0
294110  99.015886 244.3.194.118 -> 244.3.41.84  TCP 64 iclpv-nlc > telnet [ACK] Seq=1269 Ack=102614 Win=65535 Len=0
294397  99.173969 244.3.194.118 -> 244.3.41.84  TCP 64 iclpv-nlc > telnet [ACK] Seq=1279 Ack=105103 Win=65535 Len=0
294572  99.309873 244.3.194.118 -> 244.3.41.84  TCP 64 iclpv-nlc > telnet [ACK] Seq=1289 Ack=107592 Win=65535 Len=0
295061  99.481459 244.3.194.118 -> 244.3.41.84  TCP 64 iclpv-nlc > telnet [ACK] Seq=1299 Ack=110081 Win=65535 Len=0
295492  99.617232 244.3.194.118 -> 244.3.41.84  TCP 64 iclpv-nlc > telnet [ACK] Seq=1309 Ack=112570 Win=65535 Len=0
295639  99.729987 244.3.194.118 -> 244.3.41.84  TCP 64 iclpv-nlc > telnet [ACK] Seq=1319 Ack=115059 Win=65535 Len=0
296012  99.902215 244.3.194.118 -> 244.3.41.84  TCP 64 iclpv-nlc > telnet [ACK] Seq=1329 Ack=117548 Win=65535 Len=0
296320 100.060734 244.3.194.118 -> 244.3.41.84  TCP 64 iclpv-nlc > telnet [ACK] Seq=1339 Ack=120037 Win=65535 Len=0
298591 100.653154 244.3.194.118 -> 244.3.41.84  TCP 64 iclpv-nlc > telnet [ACK] Seq=1349 Ack=122526 Win=65535 Len=0
299702 101.035431 244.3.194.118 -> 244.3.41.84  TCP 64 iclpv-nlc > telnet [ACK] Seq=1359 Ack=125015 Win=65535 Len=0
301649 101.730455 244.3.194.118 -> 244.3.41.84  TCP 64 iclpv-nlc > telnet [ACK] Seq=1369 Ack=127504 Win=65535 Len=0
303341 102.534541 244.3.194.118 -> 244.3.41.84  TCP 64 iclpv-nlc > telnet [ACK] Seq=1379 Ack=129993 Win=65535 Len=0
305518 103.471704 244.3.194.118 -> 244.3.41.84  TCP 64 iclpv-nlc > telnet [ACK] Seq=1389 Ack=132482 Win=65535 Len=0
324531 111.427101 244.3.194.118 -> 244.3.41.84  TCP 64 iclpv-nlc > telnet [ACK] Seq=1423 Ack=134971 Win=65535 Len=0
352346 119.432745 244.3.194.118 -> 244.3.41.84  TCP 64 iclpv-nlc > telnet [ACK] Seq=1433 Ack=135177 Win=65329 Len=0
355352 121.182759 244.3.194.118 -> 244.3.41.84  TCP 64 iclpv-nlc > telnet [ACK] Seq=1450 Ack=136146 Win=64360 Len=0
370278 126.319703 244.3.194.118 -> 244.3.41.84  TCP 64 iclpv-nlc > telnet [ACK] Seq=1489 Ack=138635 Win=65535 Len=0
385292 127.674265 244.3.194.118 -> 244.3.41.84  TCP 64 iclpv-nlc > telnet [ACK] Seq=1499 Ack=141124 Win=65535 Len=0
386279 128.421559 244.3.194.118 -> 244.3.41.84  TCP 64 iclpv-nlc > telnet [ACK] Seq=1509 Ack=143613 Win=65535 Len=0
386991 128.882667 244.3.194.118 -> 244.3.41.84  TCP 64 iclpv-nlc > telnet [ACK] Seq=1519 Ack=146102 Win=65535 Len=0
387600 129.328320 244.3.194.118 -> 244.3.41.84  TCP 64 iclpv-nlc > telnet [ACK] Seq=1529 Ack=148591 Win=65535 Len=0
389279 129.983550 244.3.194.118 -> 244.3.41.84  TCP 64 iclpv-nlc > telnet [ACK] Seq=1539 Ack=151080 Win=65535 Len=0
390372 130.452603 244.3.194.118 -> 244.3.41.84  TCP 64 iclpv-nlc > telnet [ACK] Seq=1549 Ack=153569 Win=65535 Len=0
413413 138.093053 244.3.194.118 -> 244.3.41.84  TCP 64 iclpv-nlc > telnet [ACK] Seq=1583 Ack=156058 Win=65535 Len=0
449334 146.010609 244.3.194.118 -> 244.3.41.84  TCP 64 iclpv-nlc > telnet [ACK] Seq=1593 Ack=158547 Win=65535 Len=0
449765 146.209395 244.3.194.118 -> 244.3.41.84  TCP 64 iclpv-nlc > telnet [ACK] Seq=1603 Ack=161036 Win=65535 Len=0
450058 146.377036 244.3.194.118 -> 244.3.41.84  TCP 64 iclpv-nlc > telnet [ACK] Seq=1613 Ack=163525 Win=65535 Len=0
450358 146.497308 244.3.194.118 -> 244.3.41.84  TCP 64 iclpv-nlc > telnet [ACK] Seq=1623 Ack=166014 Win=65535 Len=0
450672 146.643691 244.3.194.118 -> 244.3.41.84  TCP 64 iclpv-nlc > telnet [ACK] Seq=1633 Ack=168503 Win=65535 Len=0
450926 146.750696 244.3.194.118 -> 244.3.41.84  TCP 64 iclpv-nlc > telnet [ACK] Seq=1643 Ack=170992 Win=65535 Len=0
451260 146.941352 244.3.194.118 -> 244.3.41.84  TCP 64 iclpv-nlc > telnet [ACK] Seq=1653 Ack=173481 Win=65535 Len=0
451622 147.072144 244.3.194.118 -> 244.3.41.84  TCP 64 iclpv-nlc > telnet [ACK] Seq=1663 Ack=175970 Win=65535 Len=0
451793 147.185299 244.3.194.118 -> 244.3.41.84  TCP 64 iclpv-nlc > telnet [ACK] Seq=1673 Ack=178459 Win=65535 Len=0
452409 147.360186 244.3.194.118 -> 244.3.41.84  TCP 64 iclpv-nlc > telnet [ACK] Seq=1683 Ack=180948 Win=65535 Len=0
452765 147.490601 244.3.194.118 -> 244.3.41.84  TCP 64 iclpv-nlc > telnet [ACK] Seq=1693 Ack=183437 Win=65535 Len=0
452980 147.649934 244.3.194.118 -> 244.3.41.84  TCP 64 iclpv-nlc > telnet [ACK] Seq=1703 Ack=185926 Win=65535 Len=0
453229 147.804416 244.3.194.118 -> 244.3.41.84  TCP 64 iclpv-nlc > telnet [ACK] Seq=1713 Ack=188415 Win=65535 Len=0
453539 147.921733 244.3.194.118 -> 244.3.41.84  TCP 64 iclpv-nlc > telnet [ACK] Seq=1723 Ack=190904 Win=65535 Len=0
453984 148.098172 244.3.194.118 -> 244.3.41.84  TCP 64 iclpv-nlc > telnet [ACK] Seq=1733 Ack=193393 Win=65535 Len=0
454262 148.236412 244.3.194.118 -> 244.3.41.84  TCP 64 iclpv-nlc > telnet [ACK] Seq=1743 Ack=195882 Win=65535 Len=0
454556 148.361747 244.3.194.118 -> 244.3.41.84  TCP 64 iclpv-nlc > telnet [ACK] Seq=1753 Ack=198371 Win=65535 Len=0
455088 148.534887 244.3.194.118 -> 244.3.41.84  TCP 64 iclpv-nlc > telnet [ACK] Seq=1763 Ack=200860 Win=65535 Len=0
455419 148.635723 244.3.194.118 -> 244.3.41.84  TCP 64 iclpv-nlc > telnet [ACK] Seq=1773 Ack=203349 Win=65535 Len=0
455952 148.818603 244.3.194.118 -> 244.3.41.84  TCP 64 iclpv-nlc > telnet [ACK] Seq=1783 Ack=205838 Win=65535 Len=0
456403 148.988427 244.3.194.118 -> 244.3.41.84  TCP 64 iclpv-nlc > telnet [ACK] Seq=1793 Ack=208327 Win=65535 Len=0
456918 149.181544 244.3.194.118 -> 244.3.41.84  TCP 64 iclpv-nlc > telnet [ACK] Seq=1803 Ack=210816 Win=65535 Len=0
457241 149.308610 244.3.194.118 -> 244.3.41.84  TCP 64 iclpv-nlc > telnet [ACK] Seq=1813 Ack=213305 Win=65535 Len=0
458282 149.763646 244.3.194.118 -> 244.3.41.84  TCP 64 iclpv-nlc > telnet [ACK] Seq=1823 Ack=215794 Win=65535 Len=0
459390 150.241644 244.3.194.118 -> 244.3.41.84  TCP 64 iclpv-nlc > telnet [ACK] Seq=1833 Ack=218283 Win=65535 Len=0
459840 150.428210 244.3.194.118 -> 244.3.41.84  TCP 64 iclpv-nlc > telnet [ACK] Seq=1843 Ack=220772 Win=65535 Len=0
460677 150.735597 244.3.194.118 -> 244.3.41.84  TCP 64 iclpv-nlc > telnet [ACK] Seq=1853 Ack=223261 Win=65535 Len=0
462108 151.515418 244.3.194.118 -> 244.3.41.84  TCP 64 iclpv-nlc > telnet [ACK] Seq=1863 Ack=225750 Win=65535 Len=0
463247 152.118028 244.3.194.118 -> 244.3.41.84  TCP 64 iclpv-nlc > telnet [ACK] Seq=1873 Ack=228239 Win=65535 Len=0
465216 152.923605 244.3.194.118 -> 244.3.41.84  TCP 64 iclpv-nlc > telnet [ACK] Seq=1883 Ack=230728 Win=65535 Len=0
466278 153.498067 244.3.194.118 -> 244.3.41.84  TCP 64 iclpv-nlc > telnet [ACK] Seq=1893 Ack=233217 Win=65535 Len=0
467741 154.182056 244.3.194.118 -> 244.3.41.84  TCP 64 iclpv-nlc > telnet [ACK] Seq=1903 Ack=235706 Win=65535 Len=0
469488 154.930845 244.3.194.118 -> 244.3.41.84  TCP 64 iclpv-nlc > telnet [ACK] Seq=1913 Ack=238195 Win=65535 Len=0
471198 155.592537 244.3.194.118 -> 244.3.41.84  TCP 64 iclpv-nlc > telnet [ACK] Seq=1923 Ack=240684 Win=65535 Len=0
498800 163.664772 244.3.194.118 -> 244.3.41.84  TCP 64 iclpv-nlc > telnet [ACK] Seq=1957 Ack=243173 Win=65535 Len=0
525575 170.686800 244.3.194.118 -> 244.3.41.84  TCP 64 iclpv-nlc > telnet [ACK] Seq=1967 Ack=245662 Win=65535 Len=0
527243 171.313176 244.3.194.118 -> 244.3.41.84  TCP 64 iclpv-nlc > telnet [ACK] Seq=1977 Ack=248151 Win=65535 Len=0
528559 171.749788 244.3.194.118 -> 244.3.41.84  TCP 64 iclpv-nlc > telnet [ACK] Seq=1987 Ack=250640 Win=65535 Len=0
531220 172.331194 244.3.194.118 -> 244.3.41.84  TCP 64 iclpv-nlc > telnet [ACK] Seq=1997 Ack=253129 Win=65535 Len=0
533769 173.047454 244.3.194.118 -> 244.3.41.84  TCP 64 iclpv-nlc > telnet [ACK] Seq=2007 Ack=255618 Win=65535 Len=0
536206 173.627901 244.3.194.118 -> 244.3.41.84  TCP 64 iclpv-nlc > telnet [ACK] Seq=2017 Ack=258107 Win=65535 Len=0
538128 174.256283 244.3.194.118 -> 244.3.41.84  TCP 64 iclpv-nlc > telnet [ACK] Seq=2027 Ack=260596 Win=65535 Len=0
539037 174.708927 244.3.194.118 -> 244.3.41.84  TCP 64 iclpv-nlc > telnet [ACK] Seq=2037 Ack=263085 Win=65535 Len=0
540125 175.308746 244.3.194.118 -> 244.3.41.84  TCP 64 iclpv-nlc > telnet [ACK] Seq=2047 Ack=265574 Win=65535 Len=0
542113 175.865614 244.3.194.118 -> 244.3.41.84  TCP 64 iclpv-nlc > telnet [ACK] Seq=2057 Ack=268063 Win=65535 Len=0
569313 181.949439 244.3.194.118 -> 244.3.41.84  TCP 64 iclpv-nlc > telnet [ACK] Seq=2091 Ack=270552 Win=65535 Len=0
583502 185.902715 244.3.194.118 -> 244.3.41.84  TCP 64 iclpv-nlc > telnet [ACK] Seq=2101 Ack=273041 Win=65535 Len=0
584111 186.141534 244.3.194.118 -> 244.3.41.84  TCP 64 iclpv-nlc > telnet [ACK] Seq=2111 Ack=275530 Win=65535 Len=0
584589 186.289382 244.3.194.118 -> 244.3.41.84  TCP 64 iclpv-nlc > telnet [ACK] Seq=2121 Ack=278019 Win=65535 Len=0
585056 186.418823 244.3.194.118 -> 244.3.41.84  TCP 64 iclpv-nlc > telnet [ACK] Seq=2131 Ack=280508 Win=65535 Len=0
585590 186.562507 244.3.194.118 -> 244.3.41.84  TCP 64 iclpv-nlc > telnet [ACK] Seq=2141 Ack=282997 Win=65535 Len=0
586270 186.753066 244.3.194.118 -> 244.3.41.84  TCP 64 iclpv-nlc > telnet [ACK] Seq=2151 Ack=285486 Win=65535 Len=0
586507 186.823622 244.3.194.118 -> 244.3.41.84  TCP 64 iclpv-nlc > telnet [ACK] Seq=2161 Ack=287975 Win=65535 Len=0
586936 186.959122 244.3.194.118 -> 244.3.41.84  TCP 64 iclpv-nlc > telnet [ACK] Seq=2171 Ack=290464 Win=65535 Len=0
587558 187.138923 244.3.194.118 -> 244.3.41.84  TCP 64 iclpv-nlc > telnet [ACK] Seq=2181 Ack=292953 Win=65535 Len=0
588048 187.254777 244.3.194.118 -> 244.3.41.84  TCP 64 iclpv-nlc > telnet [ACK] Seq=2191 Ack=295442 Win=65535 Len=0
588445 187.431320 244.3.194.118 -> 244.3.41.84  TCP 64 iclpv-nlc > telnet [ACK] Seq=2201 Ack=297931 Win=65535 Len=0
588833 187.598413 244.3.194.118 -> 244.3.41.84  TCP 64 iclpv-nlc > telnet [ACK] Seq=2211 Ack=300420 Win=65535 Len=0
589116 187.723651 244.3.194.118 -> 244.3.41.84  TCP 64 iclpv-nlc > telnet [ACK] Seq=2221 Ack=302909 Win=65535 Len=0
589302 187.832703 244.3.194.118 -> 244.3.41.84  TCP 64 iclpv-nlc > telnet [ACK] Seq=2231 Ack=305398 Win=65535 Len=0
589847 188.000807 244.3.194.118 -> 244.3.41.84  TCP 64 iclpv-nlc > telnet [ACK] Seq=2241 Ack=307887 Win=65535 Len=0
590500 188.213407 244.3.194.118 -> 244.3.41.84  TCP 64 iclpv-nlc > telnet [ACK] Seq=2251 Ack=310376 Win=65535 Len=0
591494 188.296689 244.3.194.118 -> 244.3.41.84  TCP 64 iclpv-nlc > telnet [ACK] Seq=2261 Ack=312865 Win=65535 Len=0
593799 188.496673 244.3.194.118 -> 244.3.41.84  TCP 64 iclpv-nlc > telnet [ACK] Seq=2271 Ack=315354 Win=65535 Len=0
595071 188.668346 244.3.194.118 -> 244.3.41.84  TCP 64 iclpv-nlc > telnet [ACK] Seq=2281 Ack=317843 Win=65535 Len=0
595953 188.820275 244.3.194.118 -> 244.3.41.84  TCP 64 iclpv-nlc > telnet [ACK] Seq=2291 Ack=320332 Win=65535 Len=0
596538 188.913624 244.3.194.118 -> 244.3.41.84  TCP 64 iclpv-nlc > telnet [ACK] Seq=2301 Ack=322821 Win=65535 Len=0
596965 189.024055 244.3.194.118 -> 244.3.41.84  TCP 64 iclpv-nlc > telnet [ACK] Seq=2311 Ack=325310 Win=65535 Len=0
597395 189.211198 244.3.194.118 -> 244.3.41.84  TCP 64 iclpv-nlc > telnet [ACK] Seq=2321 Ack=327799 Win=65535 Len=0
597790 189.353272 244.3.194.118 -> 244.3.41.84  TCP 64 iclpv-nlc > telnet [ACK] Seq=2331 Ack=330288 Win=65535 Len=0
597985 189.457500 244.3.194.118 -> 244.3.41.84  TCP 64 iclpv-nlc > telnet [ACK] Seq=2341 Ack=332777 Win=65535 Len=0
598477 189.647841 244.3.194.118 -> 244.3.41.84  TCP 64 iclpv-nlc > telnet [ACK] Seq=2351 Ack=335266 Win=65535 Len=0
598737 189.767429 244.3.194.118 -> 244.3.41.84  TCP 64 iclpv-nlc > telnet [ACK] Seq=2361 Ack=337755 Win=65535 Len=0
598985 189.873383 244.3.194.118 -> 244.3.41.84  TCP 64 iclpv-nlc > telnet [ACK] Seq=2371 Ack=340244 Win=65535 Len=0
599455 190.083128 244.3.194.118 -> 244.3.41.84  TCP 64 iclpv-nlc > telnet [ACK] Seq=2381 Ack=342733 Win=65535 Len=0
599671 190.170286 244.3.194.118 -> 244.3.41.84  TCP 64 iclpv-nlc > telnet [ACK] Seq=2391 Ack=345222 Win=65535 Len=0
600633 190.383161 244.3.194.118 -> 244.3.41.84  TCP 64 iclpv-nlc > telnet [ACK] Seq=2401 Ack=347711 Win=65535 Len=0
600919 190.498832 244.3.194.118 -> 244.3.41.84  TCP 64 iclpv-nlc > telnet [ACK] Seq=2411 Ack=350200 Win=65535 Len=0
601424 190.690338 244.3.194.118 -> 244.3.41.84  TCP 64 iclpv-nlc > telnet [ACK] Seq=2421 Ack=352689 Win=65535 Len=0
602971 191.274869 244.3.194.118 -> 244.3.41.84  TCP 64 iclpv-nlc > telnet [ACK] Seq=2431 Ack=355178 Win=65535 Len=0
603307 191.384853 244.3.194.118 -> 244.3.41.84  TCP 64 iclpv-nlc > telnet [ACK] Seq=2441 Ack=357667 Win=65535 Len=0
603641 191.543729 244.3.194.118 -> 244.3.41.84  TCP 64 iclpv-nlc > telnet [ACK] Seq=2451 Ack=360156 Win=65535 Len=0
603860 191.656751 244.3.194.118 -> 244.3.41.84  TCP 64 iclpv-nlc > telnet [ACK] Seq=2461 Ack=362645 Win=65535 Len=0
604213 191.760325 244.3.194.118 -> 244.3.41.84  TCP 64 iclpv-nlc > telnet [ACK] Seq=2471 Ack=365134 Win=65535 Len=0
606272 192.290762 244.3.194.118 -> 244.3.41.84  TCP 64 iclpv-nlc > telnet [ACK] Seq=2481 Ack=367623 Win=65535 Len=0
606585 192.364863 244.3.194.118 -> 244.3.41.84  TCP 64 iclpv-nlc > telnet [ACK] Seq=2491 Ack=370112 Win=65535 Len=0
606895 192.504125 244.3.194.118 -> 244.3.41.84  TCP 64 iclpv-nlc > telnet [ACK] Seq=2501 Ack=372601 Win=65535 Len=0
607122 192.592450 244.3.194.118 -> 244.3.41.84  TCP 64 iclpv-nlc > telnet [ACK] Seq=2511 Ack=375090 Win=65535 Len=0
607433 192.736402 244.3.194.118 -> 244.3.41.84  TCP 64 iclpv-nlc > telnet [ACK] Seq=2521 Ack=377579 Win=65535 Len=0
607732 192.911181 244.3.194.118 -> 244.3.41.84  TCP 64 iclpv-nlc > telnet [ACK] Seq=2531 Ack=380068 Win=65535 Len=0
608041 193.049489 244.3.194.118 -> 244.3.41.84  TCP 64 iclpv-nlc > telnet [ACK] Seq=2541 Ack=382557 Win=65535 Len=0
608309 193.168117 244.3.194.118 -> 244.3.41.84  TCP 64 iclpv-nlc > telnet [ACK] Seq=2551 Ack=385046 Win=65535 Len=0
608691 193.319693 244.3.194.118 -> 244.3.41.84  TCP 64 iclpv-nlc > telnet [ACK] Seq=2561 Ack=387535 Win=65535 Len=0
609246 193.492603 244.3.194.118 -> 244.3.41.84  TCP 64 iclpv-nlc > telnet [ACK] Seq=2571 Ack=390024 Win=65535 Len=0
609789 193.613204 244.3.194.118 -> 244.3.41.84  TCP 64 iclpv-nlc > telnet [ACK] Seq=2581 Ack=392513 Win=65535 Len=0
610474 193.782296 244.3.194.118 -> 244.3.41.84  TCP 64 iclpv-nlc > telnet [ACK] Seq=2591 Ack=395002 Win=65535 Len=0
611017 193.952270 244.3.194.118 -> 244.3.41.84  TCP 64 iclpv-nlc > telnet [ACK] Seq=2601 Ack=397491 Win=65535 Len=0
613190 194.574115 244.3.194.118 -> 244.3.41.84  TCP 64 iclpv-nlc > telnet [ACK] Seq=2611 Ack=399980 Win=65535 Len=0
614143 194.833952 244.3.194.118 -> 244.3.41.84  TCP 64 iclpv-nlc > telnet [ACK] Seq=2621 Ack=402469 Win=65535 Len=0
615059 195.178991 244.3.194.118 -> 244.3.41.84  TCP 64 iclpv-nlc > telnet [ACK] Seq=2631 Ack=404958 Win=65535 Len=0
615708 195.553246 244.3.194.118 -> 244.3.41.84  TCP 64 iclpv-nlc > telnet [ACK] Seq=2641 Ack=407447 Win=65535 Len=0
616688 195.984898 244.3.194.118 -> 244.3.41.84  TCP 64 iclpv-nlc > telnet [ACK] Seq=2651 Ack=409936 Win=65535 Len=0
617482 196.276879 244.3.194.118 -> 244.3.41.84  TCP 64 iclpv-nlc > telnet [ACK] Seq=2661 Ack=412425 Win=65535 Len=0
619237 196.923920 244.3.194.118 -> 244.3.41.84  TCP 64 iclpv-nlc > telnet [ACK] Seq=2671 Ack=414914 Win=65535 Len=0
624600 198.284033 244.3.194.118 -> 244.3.41.84  TCP 64 iclpv-nlc > telnet [ACK] Seq=2681 Ack=417403 Win=65535 Len=0
662566 206.500371 244.3.194.118 -> 244.3.41.84  TCP 64 iclpv-nlc > telnet [ACK] Seq=2715 Ack=419892 Win=65535 Len=0
673237 210.004185 244.3.194.118 -> 244.3.41.84  TCP 64 iclpv-nlc > telnet [ACK] Seq=2725 Ack=422381 Win=65535 Len=0
674395 210.572888 244.3.194.118 -> 244.3.41.84  TCP 64 iclpv-nlc > telnet [ACK] Seq=2735 Ack=424870 Win=65535 Len=0
674888 210.807299 244.3.194.118 -> 244.3.41.84  TCP 64 iclpv-nlc > telnet [ACK] Seq=2745 Ack=427359 Win=65535 Len=0
675162 210.976181 244.3.194.118 -> 244.3.41.84  TCP 64 iclpv-nlc > telnet [ACK] Seq=2755 Ack=429848 Win=65535 Len=0
693106 218.953697 244.3.194.118 -> 244.3.41.84  TCP 64 iclpv-nlc > telnet [ACK] Seq=2789 Ack=432337 Win=65535 Len=0
698467 221.474543 244.3.194.118 -> 244.3.41.84  TCP 64 iclpv-nlc > telnet [ACK] Seq=2799 Ack=434826 Win=65535 Len=0
699953 221.996015 244.3.194.118 -> 244.3.41.84  TCP 64 iclpv-nlc > telnet [ACK] Seq=2809 Ack=437315 Win=65535 Len=0
700788 222.514432 244.3.194.118 -> 244.3.41.84  TCP 64 iclpv-nlc > telnet [ACK] Seq=2819 Ack=439804 Win=65535 Len=0
701905 223.077526 244.3.194.118 -> 244.3.41.84  TCP 64 iclpv-nlc > telnet [ACK] Seq=2829 Ack=442293 Win=65535 Len=0
702882 223.516905 244.3.194.118 -> 244.3.41.84  TCP 64 iclpv-nlc > telnet [ACK] Seq=2839 Ack=444782 Win=65535 Len=0
703942 223.986175 244.3.194.118 -> 244.3.41.84  TCP 64 iclpv-nlc > telnet [ACK] Seq=2849 Ack=447271 Win=65535 Len=0
705097 224.396960 244.3.194.118 -> 244.3.41.84  TCP 64 iclpv-nlc > telnet [ACK] Seq=2859 Ack=449760 Win=65535 Len=0
706440 224.885247 244.3.194.118 -> 244.3.41.84  TCP 64 iclpv-nlc > telnet [ACK] Seq=2869 Ack=452249 Win=65535 Len=0
707827 225.395954 244.3.194.118 -> 244.3.41.84  TCP 64 iclpv-nlc > telnet [ACK] Seq=2879 Ack=454738 Win=65535 Len=0
708965 225.900826 244.3.194.118 -> 244.3.41.84  TCP 64 iclpv-nlc > telnet [ACK] Seq=2889 Ack=457227 Win=65535 Len=0
710246 226.348960 244.3.194.118 -> 244.3.41.84  TCP 64 iclpv-nlc > telnet [ACK] Seq=2899 Ack=459716 Win=65535 Len=0
711501 226.954067 244.3.194.118 -> 244.3.41.84  TCP 64 iclpv-nlc > telnet [ACK] Seq=2909 Ack=462205 Win=65535 Len=0
727041 233.067598 244.3.194.118 -> 244.3.41.84  TCP 64 iclpv-nlc > telnet [ACK] Seq=2943 Ack=464694 Win=65535 Len=0
751772 241.042320 244.3.194.118 -> 244.3.41.84  TCP 64 iclpv-nlc > telnet [ACK] Seq=2977 Ack=467183 Win=65535 Len=0
763270 246.318395 244.3.194.118 -> 244.3.41.84  TCP 64 iclpv-nlc > telnet [ACK] Seq=2987 Ack=469672 Win=65535 Len=0
763695 246.472486 244.3.194.118 -> 244.3.41.84  TCP 64 iclpv-nlc > telnet [ACK] Seq=2997 Ack=472161 Win=65535 Len=0
764191 246.616354 244.3.194.118 -> 244.3.41.84  TCP 64 iclpv-nlc > telnet [ACK] Seq=3007 Ack=474650 Win=65535 Len=0
764588 246.814658 244.3.194.118 -> 244.3.41.84  TCP 64 iclpv-nlc > telnet [ACK] Seq=3017 Ack=477139 Win=65535 Len=0
764873 246.950041 244.3.194.118 -> 244.3.41.84  TCP 64 iclpv-nlc > telnet [ACK] Seq=3027 Ack=479628 Win=65535 Len=0
765129 247.074555 244.3.194.118 -> 244.3.41.84  TCP 64 iclpv-nlc > telnet [ACK] Seq=3037 Ack=482117 Win=65535 Len=0
765506 247.259342 244.3.194.118 -> 244.3.41.84  TCP 64 iclpv-nlc > telnet [ACK] Seq=3047 Ack=484606 Win=65535 Len=0
765795 247.457341 244.3.194.118 -> 244.3.41.84  TCP 64 iclpv-nlc > telnet [ACK] Seq=3057 Ack=487095 Win=65535 Len=0
765955 247.549171 244.3.194.118 -> 244.3.41.84  TCP 64 iclpv-nlc > telnet [ACK] Seq=3067 Ack=489584 Win=65535 Len=0
766343 247.703544 244.3.194.118 -> 244.3.41.84  TCP 64 iclpv-nlc > telnet [ACK] Seq=3077 Ack=492073 Win=65535 Len=0
766743 247.862567 244.3.194.118 -> 244.3.41.84  TCP 64 iclpv-nlc > telnet [ACK] Seq=3087 Ack=494562 Win=65535 Len=0
767305 248.035718 244.3.194.118 -> 244.3.41.84  TCP 64 iclpv-nlc > telnet [ACK] Seq=3097 Ack=497051 Win=65535 Len=0
767695 248.150890 244.3.194.118 -> 244.3.41.84  TCP 64 iclpv-nlc > telnet [ACK] Seq=3107 Ack=499540 Win=65535 Len=0
768048 248.331949 244.3.194.118 -> 244.3.41.84  TCP 64 iclpv-nlc > telnet [ACK] Seq=3117 Ack=502029 Win=65535 Len=0
768469 248.526267 244.3.194.118 -> 244.3.41.84  TCP 64 iclpv-nlc > telnet [ACK] Seq=3127 Ack=504518 Win=65535 Len=0
768828 248.674943 244.3.194.118 -> 244.3.41.84  TCP 64 iclpv-nlc > telnet [ACK] Seq=3137 Ack=507007 Win=65535 Len=0
769060 248.805644 244.3.194.118 -> 244.3.41.84  TCP 64 iclpv-nlc > telnet [ACK] Seq=3147 Ack=509496 Win=65535 Len=0
769326 248.984048 244.3.194.118 -> 244.3.41.84  TCP 64 iclpv-nlc > telnet [ACK] Seq=3157 Ack=511985 Win=65535 Len=0
769662 249.120737 244.3.194.118 -> 244.3.41.84  TCP 64 iclpv-nlc > telnet [ACK] Seq=3167 Ack=514474 Win=65535 Len=0
771496 249.332815 244.3.194.118 -> 244.3.41.84  TCP 64 iclpv-nlc > telnet [ACK] Seq=3177 Ack=516963 Win=65535 Len=0
773274 249.471752 244.3.194.118 -> 244.3.41.84  TCP 64 iclpv-nlc > telnet [ACK] Seq=3187 Ack=519452 Win=65535 Len=0
775061 249.610122 244.3.194.118 -> 244.3.41.84  TCP 64 iclpv-nlc > telnet [ACK] Seq=3197 Ack=521941 Win=65535 Len=0
775973 249.772650 244.3.194.118 -> 244.3.41.84  TCP 64 iclpv-nlc > telnet [ACK] Seq=3207 Ack=524430 Win=65535 Len=0
776197 249.920053 244.3.194.118 -> 244.3.41.84  TCP 64 iclpv-nlc > telnet [ACK] Seq=3217 Ack=526919 Win=65535 Len=0
776476 250.114568 244.3.194.118 -> 244.3.41.84  TCP 64 iclpv-nlc > telnet [ACK] Seq=3227 Ack=529408 Win=65535 Len=0
776789 250.280749 244.3.194.118 -> 244.3.41.84  TCP 64 iclpv-nlc > telnet [ACK] Seq=3237 Ack=531897 Win=65535 Len=0
777266 250.422132 244.3.194.118 -> 244.3.41.84  TCP 64 iclpv-nlc > telnet [ACK] Seq=3247 Ack=534386 Win=65535 Len=0
777643 250.563120 244.3.194.118 -> 244.3.41.84  TCP 64 iclpv-nlc > telnet [ACK] Seq=3257 Ack=536875 Win=65535 Len=0
778002 250.736482 244.3.194.118 -> 244.3.41.84  TCP 64 iclpv-nlc > telnet [ACK] Seq=3267 Ack=539364 Win=65535 Len=0
778281 250.933599 244.3.194.118 -> 244.3.41.84  TCP 64 iclpv-nlc > telnet [ACK] Seq=3277 Ack=541853 Win=65535 Len=0
778454 251.056885 244.3.194.118 -> 244.3.41.84  TCP 64 iclpv-nlc > telnet [ACK] Seq=3287 Ack=544342 Win=65535 Len=0
778809 251.190961 244.3.194.118 -> 244.3.41.84  TCP 64 iclpv-nlc > telnet [ACK] Seq=3297 Ack=546831 Win=65535 Len=0
779040 251.381832 244.3.194.118 -> 244.3.41.84  TCP 64 iclpv-nlc > telnet [ACK] Seq=3307 Ack=549320 Win=65535 Len=0
779329 251.569283 244.3.194.118 -> 244.3.41.84  TCP 64 iclpv-nlc > telnet [ACK] Seq=3317 Ack=551809 Win=65535 Len=0
779521 251.664416 244.3.194.118 -> 244.3.41.84  TCP 64 iclpv-nlc > telnet [ACK] Seq=3327 Ack=554298 Win=65535 Len=0
779894 251.828301 244.3.194.118 -> 244.3.41.84  TCP 64 iclpv-nlc > telnet [ACK] Seq=3337 Ack=556787 Win=65535 Len=0
780192 251.972565 244.3.194.118 -> 244.3.41.84  TCP 64 iclpv-nlc > telnet [ACK] Seq=3347 Ack=559276 Win=65535 Len=0
781627 252.632468 244.3.194.118 -> 244.3.41.84  TCP 64 iclpv-nlc > telnet [ACK] Seq=3357 Ack=561765 Win=65535 Len=0
781846 252.742409 244.3.194.118 -> 244.3.41.84  TCP 64 iclpv-nlc > telnet [ACK] Seq=3367 Ack=564254 Win=65535 Len=0
782146 252.931400 244.3.194.118 -> 244.3.41.84  TCP 64 iclpv-nlc > telnet [ACK] Seq=3377 Ack=566743 Win=65535 Len=0
782950 253.465679 244.3.194.118 -> 244.3.41.84  TCP 64 iclpv-nlc > telnet [ACK] Seq=3387 Ack=569232 Win=65535 Len=0
784231 254.048169 244.3.194.118 -> 244.3.41.84  TCP 64 iclpv-nlc > telnet [ACK] Seq=3397 Ack=571721 Win=65535 Len=0
785513 254.573656 244.3.194.118 -> 244.3.41.84  TCP 64 iclpv-nlc > telnet [ACK] Seq=3407 Ack=574210 Win=65535 Len=0
786185 255.072613 244.3.194.118 -> 244.3.41.84  TCP 64 iclpv-nlc > telnet [ACK] Seq=3417 Ack=576699 Win=65535 Len=0
787875 255.774892 244.3.194.118 -> 244.3.41.84  TCP 64 iclpv-nlc > telnet [ACK] Seq=3427 Ack=579188 Win=65535 Len=0
789501 256.422537 244.3.194.118 -> 244.3.41.84  TCP 64 iclpv-nlc > telnet [ACK] Seq=3437 Ack=581677 Win=65535 Len=0
790941 256.974204 244.3.194.118 -> 244.3.41.84  TCP 64 iclpv-nlc > telnet [ACK] Seq=3447 Ack=584166 Win=65535 Len=0
792319 257.633795 244.3.194.118 -> 244.3.41.84  TCP 64 iclpv-nlc > telnet [ACK] Seq=3457 Ack=586655 Win=65535 Len=0
818368 267.007793 244.3.194.118 -> 244.3.41.84  TCP 64 iclpv-nlc > telnet [ACK] Seq=3491 Ack=589144 Win=65535 Len=0
829736 271.018744 244.3.194.118 -> 244.3.41.84  TCP 64 iclpv-nlc > telnet [ACK] Seq=3501 Ack=591633 Win=65535 Len=0
830271 271.263275 244.3.194.118 -> 244.3.41.84  TCP 64 iclpv-nlc > telnet [ACK] Seq=3511 Ack=594122 Win=65535 Len=0
830416 271.407889 244.3.194.118 -> 244.3.41.84  TCP 64 iclpv-nlc > telnet [ACK] Seq=3521 Ack=596611 Win=65535 Len=0
831682 271.888754 244.3.194.118 -> 244.3.41.84  TCP 64 iclpv-nlc > telnet [ACK] Seq=3531 Ack=599100 Win=65535 Len=0
831938 271.929360 244.3.194.118 -> 244.3.41.84  TCP 64 iclpv-nlc > telnet [ACK] Seq=3541 Ack=601589 Win=65535 Len=0
832052 271.987375 244.3.194.118 -> 244.3.41.84  TCP 64 iclpv-nlc > telnet [ACK] Seq=3551 Ack=604078 Win=65535 Len=0
832110 272.023753 244.3.194.118 -> 244.3.41.84  TCP 64 iclpv-nlc > telnet [ACK] Seq=3561 Ack=606567 Win=65535 Len=0
832442 272.198986 244.3.194.118 -> 244.3.41.84  TCP 64 iclpv-nlc > telnet [ACK] Seq=3571 Ack=609056 Win=65535 Len=0
832628 272.287110 244.3.194.118 -> 244.3.41.84  TCP 64 iclpv-nlc > telnet [ACK] Seq=3581 Ack=611545 Win=65535 Len=0
833151 272.490206 244.3.194.118 -> 244.3.41.84  TCP 64 iclpv-nlc > telnet [ACK] Seq=3591 Ack=614034 Win=65535 Len=0
833380 272.588683 244.3.194.118 -> 244.3.41.84  TCP 64 iclpv-nlc > telnet [ACK] Seq=3601 Ack=616523 Win=65535 Len=0
833845 272.775914 244.3.194.118 -> 244.3.41.84  TCP 64 iclpv-nlc > telnet [ACK] Seq=3611 Ack=619012 Win=65535 Len=0
834030 272.880744 244.3.194.118 -> 244.3.41.84  TCP 64 iclpv-nlc > telnet [ACK] Seq=3621 Ack=621501 Win=65535 Len=0
834328 273.052219 244.3.194.118 -> 244.3.41.84  TCP 64 iclpv-nlc > telnet [ACK] Seq=3631 Ack=623990 Win=65535 Len=0
834451 273.158125 244.3.194.118 -> 244.3.41.84  TCP 64 iclpv-nlc > telnet [ACK] Seq=3641 Ack=626479 Win=65535 Len=0
834939 273.342343 244.3.194.118 -> 244.3.41.84  TCP 64 iclpv-nlc > telnet [ACK] Seq=3651 Ack=628968 Win=65535 Len=0
835448 273.449987 244.3.194.118 -> 244.3.41.84  TCP 64 iclpv-nlc > telnet [ACK] Seq=3661 Ack=631457 Win=65535 Len=0
835876 273.634819 244.3.194.118 -> 244.3.41.84  TCP 64 iclpv-nlc > telnet [ACK] Seq=3671 Ack=633946 Win=65535 Len=0
836073 273.712458 244.3.194.118 -> 244.3.41.84  TCP 64 iclpv-nlc > telnet [ACK] Seq=3681 Ack=636435 Win=65535 Len=0
836445 273.911449 244.3.194.118 -> 244.3.41.84  TCP 64 iclpv-nlc > telnet [ACK] Seq=3691 Ack=638924 Win=65535 Len=0
836779 274.046001 244.3.194.118 -> 244.3.41.84  TCP 64 iclpv-nlc > telnet [ACK] Seq=3701 Ack=641413 Win=65535 Len=0
836997 274.134226 244.3.194.118 -> 244.3.41.84  TCP 64 iclpv-nlc > telnet [ACK] Seq=3711 Ack=643902 Win=65535 Len=0
837418 274.365272 244.3.194.118 -> 244.3.41.84  TCP 64 iclpv-nlc > telnet [ACK] Seq=3721 Ack=646391 Win=65535 Len=0
837753 274.494512 244.3.194.118 -> 244.3.41.84  TCP 64 iclpv-nlc > telnet [ACK] Seq=3731 Ack=648880 Win=65535 Len=0
838546 274.817348 244.3.194.118 -> 244.3.41.84  TCP 64 iclpv-nlc > telnet [ACK] Seq=3741 Ack=651369 Win=65535 Len=0
838924 274.962492 244.3.194.118 -> 244.3.41.84  TCP 64 iclpv-nlc > telnet [ACK] Seq=3751 Ack=653858 Win=65535 Len=0
839337 275.116681 244.3.194.118 -> 244.3.41.84  TCP 64 iclpv-nlc > telnet [ACK] Seq=3761 Ack=656347 Win=65535 Len=0
839568 275.221670 244.3.194.118 -> 244.3.41.84  TCP 64 iclpv-nlc > telnet [ACK] Seq=3771 Ack=658836 Win=65535 Len=0
840670 275.755185 244.3.194.118 -> 244.3.41.84  TCP 64 iclpv-nlc > telnet [ACK] Seq=3781 Ack=661325 Win=65535 Len=0
841459 276.158080 244.3.194.118 -> 244.3.41.84  TCP 64 iclpv-nlc > telnet [ACK] Seq=3791 Ack=663814 Win=65535 Len=0
841838 276.476727 244.3.194.118 -> 244.3.41.84  TCP 64 iclpv-nlc > telnet [ACK] Seq=3801 Ack=666303 Win=65535 Len=0
842403 276.820455 244.3.194.118 -> 244.3.41.84  TCP 64 iclpv-nlc > telnet [ACK] Seq=3811 Ack=668792 Win=65535 Len=0
843753 277.418271 244.3.194.118 -> 244.3.41.84  TCP 64 iclpv-nlc > telnet [ACK] Seq=3821 Ack=671281 Win=65535 Len=0
844625 277.965113 244.3.194.118 -> 244.3.41.84  TCP 64 iclpv-nlc > telnet [ACK] Seq=3831 Ack=673770 Win=65535 Len=0
845724 278.578337 244.3.194.118 -> 244.3.41.84  TCP 64 iclpv-nlc > telnet [ACK] Seq=3841 Ack=676259 Win=65535 Len=0
864161 285.495737 244.3.194.118 -> 244.3.41.84  TCP 64 iclpv-nlc > telnet [ACK] Seq=3875 Ack=678749 Win=65535 Len=0
874618 289.532710 244.3.194.118 -> 244.3.41.84  TCP 64 iclpv-nlc > telnet [ACK] Seq=3885 Ack=681238 Win=65535 Len=0
875319 289.817778 244.3.194.118 -> 244.3.41.84  TCP 64 iclpv-nlc > telnet [ACK] Seq=3895 Ack=683727 Win=65535 Len=0
879991 292.741423 244.3.194.118 -> 244.3.41.84  TCP 64 iclpv-nlc > telnet [ACK] Seq=3905 Ack=686216 Win=65535 Len=0
924570 307.529567 244.3.194.118 -> 244.3.41.84  TCP 64 iclpv-nlc > telnet [ACK] Seq=3915 Ack=688705 Win=65535 Len=0
925158 307.890186 244.3.194.118 -> 244.3.41.84  TCP 64 iclpv-nlc > telnet [ACK] Seq=3925 Ack=691194 Win=65535 Len=0
925596 308.256262 244.3.194.118 -> 244.3.41.84  TCP 64 iclpv-nlc > telnet [ACK] Seq=3935 Ack=693683 Win=65535 Len=0
926259 308.615750 244.3.194.118 -> 244.3.41.84  TCP 64 iclpv-nlc > telnet [ACK] Seq=3945 Ack=696172 Win=65535 Len=0
927144 309.017951 244.3.194.118 -> 244.3.41.84  TCP 64 iclpv-nlc > telnet [ACK] Seq=3955 Ack=698661 Win=65535 Len=0
928105 309.235955 244.3.194.118 -> 244.3.41.84  TCP 64 iclpv-nlc > telnet [ACK] Seq=3965 Ack=701150 Win=65535 Len=0
929030 309.558070 244.3.194.118 -> 244.3.41.84  TCP 64 iclpv-nlc > telnet [ACK] Seq=3975 Ack=703639 Win=65535 Len=0
931248 310.296244 244.3.194.118 -> 244.3.41.84  TCP 64 iclpv-nlc > telnet [ACK] Seq=3985 Ack=706128 Win=65535 Len=0
932789 310.736095 244.3.194.118 -> 244.3.41.84  TCP 64 iclpv-nlc > telnet [ACK] Seq=3995 Ack=708617 Win=65535 Len=0
933512 311.037252 244.3.194.118 -> 244.3.41.84  TCP 64 iclpv-nlc > telnet [ACK] Seq=4006 Ack=711106 Win=65535 Len=0
934373 311.275623 244.3.194.118 -> 244.3.41.84  TCP 64 iclpv-nlc > telnet [ACK] Seq=4016 Ack=713595 Win=65535 Len=0
934838 311.426665 244.3.194.118 -> 244.3.41.84  TCP 64 iclpv-nlc > telnet [ACK] Seq=4026 Ack=716084 Win=65535 Len=0
936751 311.974017 244.3.194.118 -> 244.3.41.84  TCP 64 iclpv-nlc > telnet [ACK] Seq=4036 Ack=718573 Win=65535 Len=0
938172 312.431560 244.3.194.118 -> 244.3.41.84  TCP 64 iclpv-nlc > telnet [ACK] Seq=4046 Ack=721062 Win=65535 Len=0
939440 312.756490 244.3.194.118 -> 244.3.41.84  TCP 64 iclpv-nlc > telnet [ACK] Seq=4056 Ack=723551 Win=65535 Len=0
942619 313.285756 244.3.194.118 -> 244.3.41.84  TCP 64 iclpv-nlc > telnet [ACK] Seq=4066 Ack=726040 Win=65535 Len=0
966075 321.629194 244.3.194.118 -> 244.3.41.84  TCP 64 iclpv-nlc > telnet [ACK] Seq=4100 Ack=728529 Win=65535 Len=0
976631 325.378469 244.3.194.118 -> 244.3.41.84  TCP 64 iclpv-nlc > telnet [ACK] Seq=4110 Ack=731018 Win=65535 Len=0
977275 325.592068 244.3.194.118 -> 244.3.41.84  TCP 64 iclpv-nlc > telnet [ACK] Seq=4120 Ack=733507 Win=65535 Len=0
977612 325.703427 244.3.194.118 -> 244.3.41.84  TCP 64 iclpv-nlc > telnet [ACK] Seq=4130 Ack=735996 Win=65535 Len=0
978355 325.893297 244.3.194.118 -> 244.3.41.84  TCP 64 iclpv-nlc > telnet [ACK] Seq=4140 Ack=738485 Win=65535 Len=0
978656 326.073025 244.3.194.118 -> 244.3.41.84  TCP 64 iclpv-nlc > telnet [ACK] Seq=4150 Ack=740974 Win=65535 Len=0
978803 326.168548 244.3.194.118 -> 244.3.41.84  TCP 64 iclpv-nlc > telnet [ACK] Seq=4160 Ack=743463 Win=65535 Len=0
979152 326.371603 244.3.194.118 -> 244.3.41.84  TCP 64 iclpv-nlc > telnet [ACK] Seq=4170 Ack=745952 Win=65535 Len=0
979462 326.531045 244.3.194.118 -> 244.3.41.84  TCP 64 iclpv-nlc > telnet [ACK] Seq=4180 Ack=748441 Win=65535 Len=0
979899 326.806641 244.3.194.118 -> 244.3.41.84  TCP 64 iclpv-nlc > telnet [ACK] Seq=4190 Ack=750930 Win=65535 Len=0
980140 326.978221 244.3.194.118 -> 244.3.41.84  TCP 64 iclpv-nlc > telnet [ACK] Seq=4200 Ack=753419 Win=65535 Len=0
980430 327.109732 244.3.194.118 -> 244.3.41.84  TCP 64 iclpv-nlc > telnet [ACK] Seq=4210 Ack=755908 Win=65535 Len=0
980731 327.288614 244.3.194.118 -> 244.3.41.84  TCP 64 iclpv-nlc > telnet [ACK] Seq=4220 Ack=758397 Win=65535 Len=0
980867 327.398068 244.3.194.118 -> 244.3.41.84  TCP 64 iclpv-nlc > telnet [ACK] Seq=4230 Ack=760886 Win=65535 Len=0
981045 327.538575 244.3.194.118 -> 244.3.41.84  TCP 64 iclpv-nlc > telnet [ACK] Seq=4240 Ack=763375 Win=65535 Len=0
981249 327.729550 244.3.194.118 -> 244.3.41.84  TCP 64 iclpv-nlc > telnet [ACK] Seq=4250 Ack=765864 Win=65535 Len=0
981518 327.911706 244.3.194.118 -> 244.3.41.84  TCP 64 iclpv-nlc > telnet [ACK] Seq=4260 Ack=768353 Win=65535 Len=0
981912 328.106111 244.3.194.118 -> 244.3.41.84  TCP 64 iclpv-nlc > telnet [ACK] Seq=4270 Ack=770842 Win=65535 Len=0
982271 328.243773 244.3.194.118 -> 244.3.41.84  TCP 64 iclpv-nlc > telnet [ACK] Seq=4280 Ack=773331 Win=65535 Len=0
985250 328.914518 244.3.194.118 -> 244.3.41.84  TCP 64 iclpv-nlc > telnet [ACK] Seq=4290 Ack=775820 Win=65535 Len=0
985727 329.104705 244.3.194.118 -> 244.3.41.84  TCP 64 iclpv-nlc > telnet [ACK] Seq=4300 Ack=778309 Win=65535 Len=0
986511 329.283249 244.3.194.118 -> 244.3.41.84  TCP 64 iclpv-nlc > telnet [ACK] Seq=4310 Ack=780798 Win=65535 Len=0
987202 329.378964 244.3.194.118 -> 244.3.41.84  TCP 64 iclpv-nlc > telnet [ACK] Seq=4320 Ack=783287 Win=65535 Len=0
987770 329.464434 244.3.194.118 -> 244.3.41.84  TCP 64 iclpv-nlc > telnet [ACK] Seq=4330 Ack=785776 Win=65535 Len=0
988413 329.659458 244.3.194.118 -> 244.3.41.84  TCP 64 iclpv-nlc > telnet [ACK] Seq=4340 Ack=788265 Win=65535 Len=0
988803 329.754971 244.3.194.118 -> 244.3.41.84  TCP 64 iclpv-nlc > telnet [ACK] Seq=4350 Ack=790754 Win=65535 Len=0
989447 329.893341 244.3.194.118 -> 244.3.41.84  TCP 64 iclpv-nlc > telnet [ACK] Seq=4360 Ack=793243 Win=65535 Len=0
989829 330.038490 244.3.194.118 -> 244.3.41.84  TCP 64 iclpv-nlc > telnet [ACK] Seq=4370 Ack=795732 Win=65535 Len=0
993331 331.467369 244.3.194.118 -> 244.3.41.84  TCP 64 iclpv-nlc > telnet [ACK] Seq=4380 Ack=798221 Win=65535 Len=0
1011673 339.477267 244.3.194.118 -> 244.3.41.84  TCP 64 iclpv-nlc > telnet [ACK] Seq=4414 Ack=800710 Win=65535 Len=0
