167   0.033544 244.155.128.186 -> 244.3.210.197 TCP 64 serverview-asn > http [ACK] Seq=1 Ack=1 Win=17520 Len=0
177   0.038900 244.155.128.186 -> 244.3.210.197 TCP 64 serverview-as > http [ACK] Seq=1 Ack=1 Win=17520 Len=0
178   0.038942 244.155.128.186 -> 244.3.210.197 TCP 64 serverview-as > http [ACK] Seq=1 Ack=1648 Win=17520 Len=0
503   0.135878 244.155.128.186 -> 244.3.210.197 TCP 64 serverview-asn > http [ACK] Seq=913 Ack=3501 Win=17520 Len=0
506   0.135995 244.155.128.186 -> 244.3.210.197 TCP 64 serverview-asn > http [ACK] Seq=913 Ack=6421 Win=17520 Len=0
542   0.139785 244.155.128.186 -> 244.3.210.197 TCP 64 serverview-asn > http [ACK] Seq=913 Ack=9341 Win=17520 Len=0
566   0.144891 244.155.128.186 -> 244.3.210.197 TCP 64 serverview-asn > http [ACK] Seq=913 Ack=12261 Win=17520 Len=0
571   0.145071 244.155.128.186 -> 244.3.210.197 TCP 64 serverview-asn > http [ACK] Seq=913 Ack=15181 Win=17520 Len=0
579   0.147770 244.155.128.186 -> 244.3.210.197 TCP 64 serverview-as > http [ACK] Seq=906 Ack=4906 Win=17520 Len=0
740   0.178871 244.155.128.186 -> 244.3.210.197 TCP 64 serverview-asn > http [ACK] Seq=913 Ack=18101 Win=17520 Len=0
750   0.180584 244.155.128.186 -> 244.3.210.197 TCP 64 serverview-asn > http [ACK] Seq=913 Ack=21021 Win=17520 Len=0
974   0.260117 244.155.128.186 -> 244.3.210.197 TCP 64 serverview-as > http [ACK] Seq=906 Ack=5015 Win=17411 Len=0
1360   0.369498 244.155.128.186 -> 244.3.210.197 TCP 64 serverview-asn > http [ACK] Seq=913 Ack=21453 Win=17088 Len=0
1633   0.488555 244.155.128.186 -> 244.3.210.197 TCP 64 serverview-as > http [ACK] Seq=1406 Ack=6674 Win=17520 Len=0
180318  60.728824 244.155.128.186 -> 244.3.210.197 TCP 64 serverview-asn > http [RST, ACK] Seq=913 Ack=21453 Win=0 Len=0
180319  60.728906 244.155.128.186 -> 244.3.210.197 TCP 64 serverview-as > http [RST, ACK] Seq=1406 Ack=6674 Win=0 Len=0
691334 218.047628 244.155.128.186 -> 244.3.210.197 TCP 66 netwatcher-mon > http [SYN] Seq=0 Win=16384 Len=0 MSS=1460 SACK_PERM=1
691401 218.087889 244.155.128.186 -> 244.3.210.197 TCP 64 netwatcher-mon > http [ACK] Seq=1 Ack=1 Win=17520 Len=0
691960 218.429973 244.155.128.186 -> 244.3.210.197 TCP 64 netwatcher-mon > http [ACK] Seq=971 Ack=2921 Win=17520 Len=0
692006 218.474290 244.155.128.186 -> 244.3.210.197 TCP 64 netwatcher-mon > http [ACK] Seq=971 Ack=5841 Win=17520 Len=0
692130 218.521234 244.155.128.186 -> 244.3.210.197 TCP 64 netwatcher-mon > http [ACK] Seq=971 Ack=8761 Win=17520 Len=0
692131 218.521306 244.155.128.186 -> 244.3.210.197 TCP 64 netwatcher-mon > http [ACK] Seq=971 Ack=11681 Win=17520 Len=0
692184 218.565542 244.155.128.186 -> 244.3.210.197 TCP 64 netwatcher-mon > http [ACK] Seq=971 Ack=14601 Win=17520 Len=0
692190 218.566282 244.155.128.186 -> 244.3.210.197 TCP 64 netwatcher-mon > http [ACK] Seq=971 Ack=16929 Win=17520 Len=0
693908 219.421816 244.155.128.186 -> 244.3.210.197 TCP 64 netwatcher-mon > http [ACK] Seq=1659 Ack=19849 Win=17520 Len=0
693909 219.421849 244.155.128.186 -> 244.3.210.197 TCP 64 netwatcher-mon > http [ACK] Seq=1659 Ack=22769 Win=17520 Len=0
693910 219.421898 244.155.128.186 -> 244.3.210.197 TCP 64 netwatcher-mon > http [ACK] Seq=1659 Ack=25689 Win=17520 Len=0
693914 219.421974 244.155.128.186 -> 244.3.210.197 TCP 64 netwatcher-mon > http [ACK] Seq=1659 Ack=28609 Win=17520 Len=0
694048 219.465935 244.155.128.186 -> 244.3.210.197 TCP 64 netwatcher-mon > http [ACK] Seq=1659 Ack=31529 Win=17520 Len=0
694054 219.468576 244.155.128.186 -> 244.3.210.197 TCP 64 netwatcher-mon > http [ACK] Seq=1659 Ack=34449 Win=17520 Len=0
694061 219.471150 244.155.128.186 -> 244.3.210.197 TCP 64 netwatcher-mon > http [ACK] Seq=1659 Ack=37369 Win=17520 Len=0
694067 219.473824 244.155.128.186 -> 244.3.210.197 TCP 64 netwatcher-mon > http [ACK] Seq=1659 Ack=40289 Win=17520 Len=0
694073 219.474026 244.155.128.186 -> 244.3.210.197 TCP 64 netwatcher-mon > http [ACK] Seq=1659 Ack=41847 Win=17520 Len=0
850170 280.900266 244.155.128.186 -> 244.3.210.197 TCP 64 netwatcher-mon > http [RST, ACK] Seq=1659 Ack=41847 Win=0 Len=0
