25143   9.629034 244.3.124.153 -> 244.3.153.142 TCP 64 ssh > 55544 [ACK] Seq=1 Ack=73 Win=501 Len=0
47643  19.631002 244.3.124.153 -> 244.3.153.142 TCP 64 ssh > 55544 [ACK] Seq=1 Ack=145 Win=501 Len=0
72272  29.631044 244.3.124.153 -> 244.3.153.142 TCP 64 ssh > 55544 [ACK] Seq=1 Ack=217 Win=501 Len=0
110763  39.631063 244.3.124.153 -> 244.3.153.142 TCP 64 ssh > 55544 [ACK] Seq=1 Ack=289 Win=501 Len=0
144678  49.631026 244.3.124.153 -> 244.3.153.142 TCP 64 ssh > 55544 [ACK] Seq=1 Ack=361 Win=501 Len=0
177573  59.633139 244.3.124.153 -> 244.3.153.142 TCP 64 ssh > 55544 [ACK] Seq=1 Ack=433 Win=501 Len=0
201719  69.633083 244.3.124.153 -> 244.3.153.142 TCP 64 ssh > 55544 [ACK] Seq=1 Ack=505 Win=501 Len=0
230595  79.635513 244.3.124.153 -> 244.3.153.142 TCP 64 ssh > 55544 [ACK] Seq=1 Ack=577 Win=501 Len=0
253157  89.635010 244.3.124.153 -> 244.3.153.142 TCP 64 ssh > 55544 [ACK] Seq=1 Ack=649 Win=501 Len=0
295503  99.635051 244.3.124.153 -> 244.3.153.142 TCP 64 ssh > 55544 [ACK] Seq=1 Ack=721 Win=501 Len=0
321061 109.637123 244.3.124.153 -> 244.3.153.142 TCP 64 ssh > 55544 [ACK] Seq=1 Ack=793 Win=501 Len=0
352621 119.637124 244.3.124.153 -> 244.3.153.142 TCP 64 ssh > 55544 [ACK] Seq=1 Ack=865 Win=501 Len=0
388310 129.637075 244.3.124.153 -> 244.3.153.142 TCP 64 ssh > 55544 [ACK] Seq=1 Ack=937 Win=501 Len=0
425271 139.639166 244.3.124.153 -> 244.3.153.142 TCP 64 ssh > 55544 [ACK] Seq=1 Ack=1009 Win=501 Len=0
458079 149.643882 244.3.124.153 -> 244.3.153.142 TCP 64 ssh > 55544 [ACK] Seq=1 Ack=1081 Win=501 Len=0
483695 159.641129 244.3.124.153 -> 244.3.153.142 TCP 64 ssh > 55544 [ACK] Seq=1 Ack=1153 Win=501 Len=0
522881 169.641076 244.3.124.153 -> 244.3.153.142 TCP 64 ssh > 55544 [ACK] Seq=1 Ack=1225 Win=501 Len=0
559440 179.643987 244.3.124.153 -> 244.3.153.142 TCP 64 ssh > 55544 [ACK] Seq=1 Ack=1297 Win=501 Len=0
598440 189.641166 244.3.124.153 -> 244.3.153.142 TCP 64 ssh > 55544 [ACK] Seq=1 Ack=1369 Win=501 Len=0
629618 199.643087 244.3.124.153 -> 244.3.153.142 TCP 64 ssh > 55544 [ACK] Seq=1 Ack=1441 Win=501 Len=0
672481 209.643182 244.3.124.153 -> 244.3.153.142 TCP 64 ssh > 55544 [ACK] Seq=1 Ack=1513 Win=501 Len=0
694372 219.643113 244.3.124.153 -> 244.3.153.142 TCP 64 ssh > 55544 [ACK] Seq=1 Ack=1585 Win=501 Len=0
719573 229.645148 244.3.124.153 -> 244.3.153.142 TCP 64 ssh > 55544 [ACK] Seq=1 Ack=1657 Win=501 Len=0
748437 239.645282 244.3.124.153 -> 244.3.153.142 TCP 64 ssh > 55544 [ACK] Seq=1 Ack=1729 Win=501 Len=0
775472 249.645347 244.3.124.153 -> 244.3.153.142 TCP 64 ssh > 55544 [ACK] Seq=1 Ack=1801 Win=501 Len=0
796213 259.647205 244.3.124.153 -> 244.3.153.142 TCP 64 ssh > 55544 [ACK] Seq=1 Ack=1873 Win=501 Len=0
826227 269.647371 244.3.124.153 -> 244.3.153.142 TCP 64 ssh > 55544 [ACK] Seq=1 Ack=1945 Win=501 Len=0
847253 279.649239 244.3.124.153 -> 244.3.153.142 TCP 64 ssh > 55544 [ACK] Seq=1 Ack=2017 Win=501 Len=0
874746 289.649203 244.3.124.153 -> 244.3.153.142 TCP 64 ssh > 55544 [ACK] Seq=1 Ack=2089 Win=501 Len=0
908274 299.649279 244.3.124.153 -> 244.3.153.142 TCP 64 ssh > 55544 [ACK] Seq=1 Ack=2161 Win=501 Len=0
929337 309.651283 244.3.124.153 -> 244.3.153.142 TCP 64 ssh > 55544 [ACK] Seq=1 Ack=2233 Win=501 Len=0
961816 319.651491 244.3.124.153 -> 244.3.153.142 TCP 64 ssh > 55544 [ACK] Seq=1 Ack=2305 Win=501 Len=0
988399 329.651270 244.3.124.153 -> 244.3.153.142 TCP 64 ssh > 55544 [ACK] Seq=1 Ack=2377 Win=501 Len=0
1011896 339.653362 244.3.124.153 -> 244.3.153.142 TCP 64 ssh > 55544 [ACK] Seq=1 Ack=2449 Win=501 Len=0
