716095 228.553679 244.3.31.155 -> 41.177.248.120 TCP 66 http > sent-lm [SYN, ACK] Seq=0 Ack=1 Win=5840 Len=0 MSS=1460 SACK_PERM=1
716103 228.555101 244.3.31.155 -> 41.177.248.120 TCP 64 http > sent-lm [ACK] Seq=1 Ack=382 Win=6432 Len=0
716112 228.556589 244.3.31.155 -> 41.177.248.120 TCP 64 http > sent-lm [ACK] Seq=2551 Ack=383 Win=6432 Len=0
760699 245.372161 244.3.31.155 -> 244.3.56.197 TCP 66 http > 4833 [SYN, ACK] Seq=0 Ack=1 Win=5840 Len=0 MSS=1460 SACK_PERM=1
760704 245.373142 244.3.31.155 -> 244.3.56.197 TCP 64 http > 4833 [ACK] Seq=1 Ack=510 Win=6432 Len=0
760743 245.378876 244.3.31.155 -> 244.3.56.197 TCP 64 http > 4833 [ACK] Seq=2551 Ack=511 Win=6432 Len=0
