1639   0.491580 244.3.160.204 -> 244.3.160.89 TCP 64 8839 > dls-monitor [SYN] Seq=0 Win=8760 Len=0 MSS=1460
1641   0.491865 244.3.160.204 -> 244.3.160.89 TCP 64 8840 > http [SYN] Seq=0 Win=8760 Len=0 MSS=1460
1643   0.492219 244.3.160.204 -> 244.3.160.89 TCP 64 8841 > https [SYN] Seq=0 Win=8760 Len=0 MSS=1460
1645   0.492429 244.3.160.204 -> 244.3.160.89 TCP 64 8842 > www-dev [SYN] Seq=0 Win=8760 Len=0 MSS=1460
1647   0.492639 244.3.160.204 -> 244.3.160.89 TCP 64 8843 > aic-np [SYN] Seq=0 Win=8760 Len=0 MSS=1460
1649   0.492914 244.3.160.204 -> 244.3.160.89 TCP 64 8844 > terabase [SYN] Seq=0 Win=8760 Len=0 MSS=1460
1651   0.493199 244.3.160.204 -> 244.3.160.254 TCP 64 8845 > pxc-spvr-ft [SYN] Seq=0 Win=8760 Len=0 MSS=1460
1653   0.493483 244.3.160.204 -> 244.3.160.254 TCP 64 8846 > dls-monitor [SYN] Seq=0 Win=8760 Len=0 MSS=1460
1655   0.493705 244.3.160.204 -> 244.3.160.254 TCP 64 8847 > https [SYN] Seq=0 Win=8760 Len=0 MSS=1460
1657   0.493992 244.3.160.204 -> 244.3.160.254 TCP 64 8848 > http [SYN] Seq=0 Win=8760 Len=0 MSS=1460
1659   0.494276 244.3.160.204 -> 244.3.160.254 TCP 64 8849 > www-dev [SYN] Seq=0 Win=8760 Len=0 MSS=1460
1662   0.494510 244.3.160.204 -> 244.3.160.254 TCP 64 8850 > aic-np [SYN] Seq=0 Win=8760 Len=0 MSS=1460
1668   0.494801 244.3.160.204 -> 244.3.160.239 TCP 64 8851 > https [SYN] Seq=0 Win=8760 Len=0 MSS=1460
1670   0.495058 244.3.160.204 -> 244.3.160.239 TCP 64 8852 > http-alt [SYN] Seq=0 Win=8760 Len=0 MSS=1460
1672   0.495301 244.3.160.204 -> 244.3.160.239 TCP 64 8853 > http [SYN] Seq=0 Win=8760 Len=0 MSS=1460
1918   0.578256 244.3.160.204 -> 244.3.160.89 TCP 64 8840 > http [ACK] Seq=1 Ack=1 Win=8760 Len=0
1919   0.578401 244.3.160.204 -> 244.3.160.89 TCP 64 8840 > http [FIN, ACK] Seq=1 Ack=1 Win=8760 Len=0
1930   0.582522 244.3.160.204 -> 244.3.160.254 TCP 64 8847 > https [ACK] Seq=1 Ack=1 Win=8760 Len=0
1932   0.582702 244.3.160.204 -> 244.3.160.254 TCP 64 8847 > https [FIN, ACK] Seq=1 Ack=1 Win=8760 Len=0
1936   0.583890 244.3.160.204 -> 244.3.160.254 TCP 64 8848 > http [ACK] Seq=1 Ack=1 Win=8760 Len=0
1937   0.583894 244.3.160.204 -> 244.3.160.254 TCP 64 8848 > http [FIN, ACK] Seq=1 Ack=1 Win=8760 Len=0
1941   0.586421 244.3.160.204 -> 244.3.160.239 TCP 64 8851 > https [ACK] Seq=1 Ack=1 Win=8760 Len=0
1942   0.586574 244.3.160.204 -> 244.3.160.239 TCP 64 8851 > https [FIN, ACK] Seq=1 Ack=1 Win=8760 Len=0
1944   0.588229 244.3.160.204 -> 244.3.160.239 TCP 64 8853 > http [ACK] Seq=1 Ack=1 Win=8760 Len=0
1945   0.588371 244.3.160.204 -> 244.3.160.239 TCP 64 8853 > http [FIN, ACK] Seq=1 Ack=1 Win=8760 Len=0
2121   0.643725 244.3.160.204 -> 244.3.160.89 TCP 64 8840 > http [ACK] Seq=2 Ack=2 Win=8760 Len=0
2140   0.646737 244.3.160.204 -> 244.3.160.254 TCP 64 8847 > https [ACK] Seq=2 Ack=2 Win=8760 Len=0
2144   0.647629 244.3.160.204 -> 244.3.160.254 TCP 64 8848 > http [ACK] Seq=2 Ack=2 Win=8760 Len=0
2145   0.651647 244.3.160.204 -> 244.3.160.239 TCP 64 8853 > http [ACK] Seq=2 Ack=2 Win=8760 Len=0
2151   0.654331 244.3.160.204 -> 244.3.160.89 TCP 64 8841 > https [FIN, ACK] Seq=49 Ack=1461 Win=8760 Len=0
2154   0.655074 244.3.160.204 -> 244.3.160.89 TCP 64 [TCP Out-Of-Order] 8841 > https [FIN, ACK] Seq=49 Ack=2921 Win=8760 Len=0
2294   0.689804 244.3.160.204 -> 244.3.160.89 TCP 64 8841 > https [ACK] Seq=50 Ack=2987 Win=8695 Len=0
2304   0.695593 244.3.160.204 -> 244.3.160.239 TCP 64 8851 > https [ACK] Seq=2 Ack=2 Win=8760 Len=0
7395   2.491440 244.3.160.204 -> 244.3.160.89 TCP 64 9173 > newoak [SYN] Seq=0 Win=8760 Len=0 MSS=1460
7397   2.491689 244.3.160.204 -> 244.3.160.89 TCP 64 9174 > pxc-spvr-ft [SYN] Seq=0 Win=8760 Len=0 MSS=1460
7399   2.491998 244.3.160.204 -> 244.3.160.89 TCP 64 9175 > dls-monitor [SYN] Seq=0 Win=8760 Len=0 MSS=1460
7401   2.492244 244.3.160.204 -> 244.3.160.89 TCP 64 9176 > http [SYN] Seq=0 Win=8760 Len=0 MSS=1460
7403   2.492501 244.3.160.204 -> 244.3.160.89 TCP 64 9177 > https [SYN] Seq=0 Win=8760 Len=0 MSS=1460
7405   2.492757 244.3.160.204 -> 244.3.160.89 TCP 64 9178 > www-dev [SYN] Seq=0 Win=8760 Len=0 MSS=1460
7407   2.493055 244.3.160.204 -> 244.3.160.254 TCP 64 9179 > terabase [SYN] Seq=0 Win=8760 Len=0 MSS=1460
7409   2.493309 244.3.160.204 -> 244.3.160.254 TCP 64 9180 > newoak [SYN] Seq=0 Win=8760 Len=0 MSS=1460
7411   2.493557 244.3.160.204 -> 244.3.160.254 TCP 64 9181 > pxc-spvr-ft [SYN] Seq=0 Win=8760 Len=0 MSS=1460
7413   2.493831 244.3.160.204 -> 244.3.160.254 TCP 64 9182 > dls-monitor [SYN] Seq=0 Win=8760 Len=0 MSS=1460
7415   2.494107 244.3.160.204 -> 244.3.160.254 TCP 64 9183 > https [SYN] Seq=0 Win=8760 Len=0 MSS=1460
7417   2.494356 244.3.160.204 -> 244.3.160.254 TCP 64 9184 > http [SYN] Seq=0 Win=8760 Len=0 MSS=1460
7431   2.494643 244.3.160.204 -> 244.3.160.239 TCP 64 9185 > https [SYN] Seq=0 Win=8760 Len=0 MSS=1460
7434   2.494916 244.3.160.204 -> 244.3.160.239 TCP 64 9186 > http-alt [SYN] Seq=0 Win=8760 Len=0 MSS=1460
7437   2.495183 244.3.160.204 -> 244.3.160.239 TCP 64 9187 > http [SYN] Seq=0 Win=8760 Len=0 MSS=1460
7613   2.581747 244.3.160.204 -> 244.3.160.89 TCP 64 9176 > http [ACK] Seq=1 Ack=1 Win=8760 Len=0
7614   2.581921 244.3.160.204 -> 244.3.160.89 TCP 64 9176 > http [FIN, ACK] Seq=1 Ack=1 Win=8760 Len=0
7622   2.583669 244.3.160.204 -> 244.3.160.254 TCP 64 9179 > terabase [ACK] Seq=1 Ack=1 Win=8760 Len=0
7623   2.583792 244.3.160.204 -> 244.3.160.254 TCP 64 9179 > terabase [FIN, ACK] Seq=1 Ack=1 Win=8760 Len=0
7634   2.587316 244.3.160.204 -> 244.3.160.254 TCP 64 9183 > https [ACK] Seq=1 Ack=1 Win=8760 Len=0
7636   2.587454 244.3.160.204 -> 244.3.160.254 TCP 64 9183 > https [FIN, ACK] Seq=1 Ack=1 Win=8760 Len=0
7638   2.588068 244.3.160.204 -> 244.3.160.254 TCP 64 9184 > http [ACK] Seq=1 Ack=1 Win=8760 Len=0
7639   2.588203 244.3.160.204 -> 244.3.160.254 TCP 64 9184 > http [FIN, ACK] Seq=1 Ack=1 Win=8760 Len=0
7644   2.589210 244.3.160.204 -> 244.3.160.239 TCP 64 9185 > https [ACK] Seq=1 Ack=1 Win=8760 Len=0
7645   2.589385 244.3.160.204 -> 244.3.160.239 TCP 64 9185 > https [FIN, ACK] Seq=1 Ack=1 Win=8760 Len=0
7647   2.590814 244.3.160.204 -> 244.3.160.239 TCP 64 9187 > http [ACK] Seq=1 Ack=1 Win=8760 Len=0
7648   2.590983 244.3.160.204 -> 244.3.160.239 TCP 64 9187 > http [FIN, ACK] Seq=1 Ack=1 Win=8760 Len=0
7722   2.647083 244.3.160.204 -> 244.3.160.89 TCP 64 9176 > http [ACK] Seq=2 Ack=2 Win=8760 Len=0
7723   2.649773 244.3.160.204 -> 244.3.160.254 TCP 64 9179 > terabase [ACK] Seq=2 Ack=2 Win=8760 Len=0
7733   2.652043 244.3.160.204 -> 244.3.160.254 TCP 64 9183 > https [ACK] Seq=2 Ack=2 Win=8760 Len=0
7741   2.652907 244.3.160.204 -> 244.3.160.254 TCP 64 9184 > http [ACK] Seq=2 Ack=2 Win=8760 Len=0
7742   2.654922 244.3.160.204 -> 244.3.160.239 TCP 64 9187 > http [ACK] Seq=2 Ack=2 Win=8760 Len=0
7764   2.659283 244.3.160.204 -> 244.3.160.89 TCP 64 9177 > https [FIN, ACK] Seq=49 Ack=1461 Win=8760 Len=0
7770   2.659815 244.3.160.204 -> 244.3.160.89 TCP 64 [TCP Out-Of-Order] 9177 > https [FIN, ACK] Seq=49 Ack=2921 Win=8760 Len=0
7809   2.683134 244.3.160.204 -> 244.3.160.239 TCP 64 9185 > https [ACK] Seq=2 Ack=2 Win=8760 Len=0
7816   2.694978 244.3.160.204 -> 244.3.160.89 TCP 64 9177 > https [ACK] Seq=50 Ack=2987 Win=8695 Len=0
16429   4.491248 244.3.160.204 -> 244.3.160.89 TCP 64 9509 > aic-np [SYN] Seq=0 Win=8760 Len=0 MSS=1460
16431   4.491479 244.3.160.204 -> 244.3.160.89 TCP 64 9510 > terabase [SYN] Seq=0 Win=8760 Len=0 MSS=1460
16433   4.491722 244.3.160.204 -> 244.3.160.89 TCP 64 9511 > newoak [SYN] Seq=0 Win=8760 Len=0 MSS=1460
16435   4.492048 244.3.160.204 -> 244.3.160.89 TCP 64 9512 > pxc-spvr-ft [SYN] Seq=0 Win=8760 Len=0 MSS=1460
16437   4.492286 244.3.160.204 -> 244.3.160.89 TCP 64 9513 > dls-monitor [SYN] Seq=0 Win=8760 Len=0 MSS=1460
16439   4.492527 244.3.160.204 -> 244.3.160.89 TCP 64 9514 > http [SYN] Seq=0 Win=8760 Len=0 MSS=1460
16443   4.492797 244.3.160.204 -> 244.3.160.254 TCP 64 9515 > www-dev [SYN] Seq=0 Win=8760 Len=0 MSS=1460
16445   4.493076 244.3.160.204 -> 244.3.160.254 TCP 64 9516 > aic-np [SYN] Seq=0 Win=8760 Len=0 MSS=1460
16447   4.493328 244.3.160.204 -> 244.3.160.254 TCP 64 9517 > terabase [SYN] Seq=0 Win=8760 Len=0 MSS=1460
16449   4.493598 244.3.160.204 -> 244.3.160.254 TCP 64 9518 > newoak [SYN] Seq=0 Win=8760 Len=0 MSS=1460
16452   4.493843 244.3.160.204 -> 244.3.160.254 TCP 64 9519 > pxc-spvr-ft [SYN] Seq=0 Win=8760 Len=0 MSS=1460
16455   4.494130 244.3.160.204 -> 244.3.160.254 TCP 64 9520 > dls-monitor [SYN] Seq=0 Win=8760 Len=0 MSS=1460
16458   4.494389 244.3.160.204 -> 244.3.160.239 TCP 64 9521 > https [SYN] Seq=0 Win=8760 Len=0 MSS=1460
16460   4.494649 244.3.160.204 -> 244.3.160.239 TCP 64 9522 > http-alt [SYN] Seq=0 Win=8760 Len=0 MSS=1460
16462   4.494905 244.3.160.204 -> 244.3.160.239 TCP 64 9523 > http [SYN] Seq=0 Win=8760 Len=0 MSS=1460
16661   4.578566 244.3.160.204 -> 244.3.160.89 TCP 64 9514 > http [ACK] Seq=1 Ack=1 Win=8760 Len=0
16662   4.578739 244.3.160.204 -> 244.3.160.89 TCP 64 9514 > http [FIN, ACK] Seq=1 Ack=1 Win=8760 Len=0
16679   4.580830 244.3.160.204 -> 244.3.160.254 TCP 64 9517 > terabase [ACK] Seq=1 Ack=1 Win=8760 Len=0
16681   4.580960 244.3.160.204 -> 244.3.160.254 TCP 64 9517 > terabase [FIN, ACK] Seq=1 Ack=1 Win=8760 Len=0
16713   4.583968 244.3.160.204 -> 244.3.160.239 TCP 64 9521 > https [ACK] Seq=1 Ack=1 Win=8760 Len=0
16714   4.584139 244.3.160.204 -> 244.3.160.239 TCP 64 9521 > https [FIN, ACK] Seq=1 Ack=1 Win=8760 Len=0
16728   4.585602 244.3.160.204 -> 244.3.160.239 TCP 64 9523 > http [ACK] Seq=1 Ack=1 Win=8760 Len=0
16732   4.585713 244.3.160.204 -> 244.3.160.239 TCP 64 9523 > http [FIN, ACK] Seq=1 Ack=1 Win=8760 Len=0
16786   4.639014 244.3.160.204 -> 244.3.160.89 TCP 64 9514 > http [ACK] Seq=2 Ack=2 Win=8760 Len=0
16797   4.640571 244.3.160.204 -> 244.3.160.254 TCP 64 9517 > terabase [ACK] Seq=2 Ack=2 Win=8760 Len=0
16806   4.644489 244.3.160.204 -> 244.3.160.239 TCP 64 9523 > http [ACK] Seq=2 Ack=2 Win=8760 Len=0
16809   4.651235 244.3.160.204 -> 244.3.160.239 TCP 64 9521 > https [ACK] Seq=2 Ack=2 Win=8760 Len=0
19720   6.491142 244.3.160.204 -> 244.3.160.89 TCP 64 9840 > https [SYN] Seq=0 Win=8760 Len=0 MSS=1460
19723   6.491413 244.3.160.204 -> 244.3.160.89 TCP 64 9841 > www-dev [SYN] Seq=0 Win=8760 Len=0 MSS=1460
19725   6.491635 244.3.160.204 -> 244.3.160.89 TCP 64 9842 > aic-np [SYN] Seq=0 Win=8760 Len=0 MSS=1460
19727   6.491875 244.3.160.204 -> 244.3.160.89 TCP 64 9843 > terabase [SYN] Seq=0 Win=8760 Len=0 MSS=1460
19729   6.492220 244.3.160.204 -> 244.3.160.89 TCP 64 9844 > newoak [SYN] Seq=0 Win=8760 Len=0 MSS=1460
19732   6.492426 244.3.160.204 -> 244.3.160.89 TCP 64 9845 > pxc-spvr-ft [SYN] Seq=0 Win=8760 Len=0 MSS=1460
19735   6.492702 244.3.160.204 -> 244.3.160.254 TCP 64 9846 > https [SYN] Seq=0 Win=8760 Len=0 MSS=1460
19738   6.492933 244.3.160.204 -> 244.3.160.254 TCP 64 9847 > http [SYN] Seq=0 Win=8760 Len=0 MSS=1460
19740   6.493259 244.3.160.204 -> 244.3.160.254 TCP 64 9848 > www-dev [SYN] Seq=0 Win=8760 Len=0 MSS=1460
19743   6.493482 244.3.160.204 -> 244.3.160.254 TCP 64 9849 > aic-np [SYN] Seq=0 Win=8760 Len=0 MSS=1460
19746   6.493713 244.3.160.204 -> 244.3.160.254 TCP 64 9850 > terabase [SYN] Seq=0 Win=8760 Len=0 MSS=1460
19748   6.493971 244.3.160.204 -> 244.3.160.254 TCP 64 9851 > newoak [SYN] Seq=0 Win=8760 Len=0 MSS=1460
19751   6.494270 244.3.160.204 -> 244.3.160.239 TCP 64 9852 > https [SYN] Seq=0 Win=8760 Len=0 MSS=1460
19753   6.494548 244.3.160.204 -> 244.3.160.239 TCP 64 9853 > http-alt [SYN] Seq=0 Win=8760 Len=0 MSS=1460
19761   6.494820 244.3.160.204 -> 244.3.160.239 TCP 64 9854 > http [SYN] Seq=0 Win=8760 Len=0 MSS=1460
19995   6.580112 244.3.160.204 -> 244.3.160.254 TCP 64 9846 > https [ACK] Seq=1 Ack=1 Win=8760 Len=0
19996   6.580275 244.3.160.204 -> 244.3.160.254 TCP 64 9846 > https [FIN, ACK] Seq=1 Ack=1 Win=8760 Len=0
19998   6.581182 244.3.160.204 -> 244.3.160.254 TCP 64 9847 > http [ACK] Seq=1 Ack=1 Win=8760 Len=0
20000   6.581325 244.3.160.204 -> 244.3.160.254 TCP 64 9847 > http [FIN, ACK] Seq=1 Ack=1 Win=8760 Len=0
20006   6.583268 244.3.160.204 -> 244.3.160.254 TCP 64 9850 > terabase [ACK] Seq=1 Ack=1 Win=8760 Len=0
20007   6.583403 244.3.160.204 -> 244.3.160.254 TCP 64 9850 > terabase [FIN, ACK] Seq=1 Ack=1 Win=8760 Len=0
20010   6.584838 244.3.160.204 -> 244.3.160.239 TCP 64 9852 > https [ACK] Seq=1 Ack=1 Win=8760 Len=0
20011   6.584976 244.3.160.204 -> 244.3.160.239 TCP 64 9852 > https [FIN, ACK] Seq=1 Ack=1 Win=8760 Len=0
20013   6.586716 244.3.160.204 -> 244.3.160.239 TCP 64 9854 > http [ACK] Seq=1 Ack=1 Win=8760 Len=0
20014   6.586848 244.3.160.204 -> 244.3.160.239 TCP 64 9854 > http [FIN, ACK] Seq=1 Ack=1 Win=8760 Len=0
20187   6.646090 244.3.160.204 -> 244.3.160.254 TCP 64 9846 > https [ACK] Seq=2 Ack=2 Win=8760 Len=0
20188   6.646908 244.3.160.204 -> 244.3.160.254 TCP 64 9847 > http [ACK] Seq=2 Ack=2 Win=8760 Len=0
20192   6.648282 244.3.160.204 -> 244.3.160.254 TCP 64 9850 > terabase [ACK] Seq=2 Ack=2 Win=8760 Len=0
20195   6.651086 244.3.160.204 -> 244.3.160.239 TCP 64 9854 > http [ACK] Seq=2 Ack=2 Win=8760 Len=0
20196   6.653663 244.3.160.204 -> 244.3.160.89 TCP 64 9840 > https [FIN, ACK] Seq=49 Ack=1461 Win=8760 Len=0
20199   6.654673 244.3.160.204 -> 244.3.160.89 TCP 64 [TCP Out-Of-Order] 9840 > https [FIN, ACK] Seq=49 Ack=2921 Win=8760 Len=0
20221   6.664832 244.3.160.204 -> 244.3.160.239 TCP 64 9852 > https [ACK] Seq=2 Ack=2 Win=8760 Len=0
20265   6.692693 244.3.160.204 -> 244.3.160.89 TCP 64 9840 > https [ACK] Seq=50 Ack=2987 Win=8695 Len=0
23355   8.491899 244.3.160.204 -> 244.3.160.89 TCP 64 10179 > dls-monitor [SYN] Seq=0 Win=8760 Len=0 MSS=1460
23361   8.492188 244.3.160.204 -> 244.3.160.89 TCP 64 10180 > http [SYN] Seq=0 Win=8760 Len=0 MSS=1460
23363   8.492471 244.3.160.204 -> 244.3.160.89 TCP 64 10181 > https [SYN] Seq=0 Win=8760 Len=0 MSS=1460
23368   8.492688 244.3.160.204 -> 244.3.160.89 TCP 64 10182 > www-dev [SYN] Seq=0 Win=8760 Len=0 MSS=1460
23370   8.492936 244.3.160.204 -> 244.3.160.89 TCP 64 10183 > aic-np [SYN] Seq=0 Win=8760 Len=0 MSS=1460
23374   8.493183 244.3.160.204 -> 244.3.160.89 TCP 64 10184 > terabase [SYN] Seq=0 Win=8760 Len=0 MSS=1460
23376   8.493485 244.3.160.204 -> 244.3.160.254 TCP 64 10185 > pxc-spvr-ft [SYN] Seq=0 Win=8760 Len=0 MSS=1460
23378   8.493735 244.3.160.204 -> 244.3.160.254 TCP 64 10186 > dls-monitor [SYN] Seq=0 Win=8760 Len=0 MSS=1460
23381   8.494011 244.3.160.204 -> 244.3.160.254 TCP 64 10187 > https [SYN] Seq=0 Win=8760 Len=0 MSS=1460
23393   8.494260 244.3.160.204 -> 244.3.160.254 TCP 64 10188 > http [SYN] Seq=0 Win=8760 Len=0 MSS=1460
23398   8.494628 244.3.160.204 -> 244.3.160.254 TCP 64 10189 > www-dev [SYN] Seq=0 Win=8760 Len=0 MSS=1460
23407   8.494936 244.3.160.204 -> 244.3.160.254 TCP 64 10190 > aic-np [SYN] Seq=0 Win=8760 Len=0 MSS=1460
23408   8.495069 244.3.160.204 -> 244.3.160.239 TCP 64 10191 > https [SYN] Seq=0 Win=8760 Len=0 MSS=1460
23419   8.495350 244.3.160.204 -> 244.3.160.239 TCP 64 10192 > http-alt [SYN] Seq=0 Win=8760 Len=0 MSS=1460
23421   8.495639 244.3.160.204 -> 244.3.160.239 TCP 64 10193 > http [SYN] Seq=0 Win=8760 Len=0 MSS=1460
23585   8.578185 244.3.160.204 -> 244.3.160.89 TCP 64 10180 > http [ACK] Seq=1 Ack=1 Win=8760 Len=0
23586   8.578339 244.3.160.204 -> 244.3.160.89 TCP 64 10180 > http [FIN, ACK] Seq=1 Ack=1 Win=8760 Len=0
23600   8.582384 244.3.160.204 -> 244.3.160.254 TCP 64 10187 > https [ACK] Seq=1 Ack=1 Win=8760 Len=0
23601   8.582539 244.3.160.204 -> 244.3.160.254 TCP 64 10187 > https [FIN, ACK] Seq=1 Ack=1 Win=8760 Len=0
23604   8.583429 244.3.160.204 -> 244.3.160.254 TCP 64 10188 > http [ACK] Seq=1 Ack=1 Win=8760 Len=0
23607   8.583591 244.3.160.204 -> 244.3.160.254 TCP 64 10188 > http [FIN, ACK] Seq=1 Ack=1 Win=8760 Len=0
23615   8.586235 244.3.160.204 -> 244.3.160.239 TCP 64 10191 > https [ACK] Seq=1 Ack=1 Win=8760 Len=0
23616   8.586407 244.3.160.204 -> 244.3.160.239 TCP 64 10191 > https [FIN, ACK] Seq=1 Ack=1 Win=8760 Len=0
23619   8.587867 244.3.160.204 -> 244.3.160.239 TCP 64 10193 > http [ACK] Seq=1 Ack=1 Win=8760 Len=0
23620   8.587999 244.3.160.204 -> 244.3.160.239 TCP 64 10193 > http [FIN, ACK] Seq=1 Ack=1 Win=8760 Len=0
23692   8.643923 244.3.160.204 -> 244.3.160.89 TCP 64 10180 > http [ACK] Seq=2 Ack=2 Win=8760 Len=0
23693   8.646948 244.3.160.204 -> 244.3.160.254 TCP 64 10187 > https [ACK] Seq=2 Ack=2 Win=8760 Len=0
23694   8.647950 244.3.160.204 -> 244.3.160.254 TCP 64 10188 > http [ACK] Seq=2 Ack=2 Win=8760 Len=0
23700   8.651484 244.3.160.204 -> 244.3.160.239 TCP 64 10193 > http [ACK] Seq=2 Ack=2 Win=8760 Len=0
23706   8.654451 244.3.160.204 -> 244.3.160.89 TCP 64 10181 > https [FIN, ACK] Seq=49 Ack=1461 Win=8760 Len=0
23709   8.655072 244.3.160.204 -> 244.3.160.89 TCP 64 [TCP Out-Of-Order] 10181 > https [FIN, ACK] Seq=49 Ack=2921 Win=8760 Len=0
23732   8.682814 244.3.160.204 -> 244.3.160.239 TCP 64 10191 > https [ACK] Seq=2 Ack=2 Win=8760 Len=0
23748   8.690247 244.3.160.204 -> 244.3.160.89 TCP 64 10181 > https [ACK] Seq=50 Ack=2987 Win=8695 Len=0
26661  10.492180 244.3.160.204 -> 244.3.160.89 TCP 64 10510 > newoak [SYN] Seq=0 Win=8760 Len=0 MSS=1460
26664  10.492449 244.3.160.204 -> 244.3.160.89 TCP 64 10511 > pxc-spvr-ft [SYN] Seq=0 Win=8760 Len=0 MSS=1460
26666  10.492669 244.3.160.204 -> 244.3.160.89 TCP 64 10512 > dls-monitor [SYN] Seq=0 Win=8760 Len=0 MSS=1460
26668  10.492946 244.3.160.204 -> 244.3.160.89 TCP 64 10513 > http [SYN] Seq=0 Win=8760 Len=0 MSS=1460
26671  10.493236 244.3.160.204 -> 244.3.160.89 TCP 64 10514 > https [SYN] Seq=0 Win=8760 Len=0 MSS=1460
26674  10.493406 244.3.160.204 -> 244.3.160.89 TCP 64 10515 > www-dev [SYN] Seq=0 Win=8760 Len=0 MSS=1460
26676  10.493712 244.3.160.204 -> 244.3.160.254 TCP 64 10516 > terabase [SYN] Seq=0 Win=8760 Len=0 MSS=1460
26680  10.493978 244.3.160.204 -> 244.3.160.254 TCP 64 10517 > newoak [SYN] Seq=0 Win=8760 Len=0 MSS=1460
26684  10.494248 244.3.160.204 -> 244.3.160.254 TCP 64 10518 > pxc-spvr-ft [SYN] Seq=0 Win=8760 Len=0 MSS=1460
26686  10.494536 244.3.160.204 -> 244.3.160.254 TCP 64 10519 > dls-monitor [SYN] Seq=0 Win=8760 Len=0 MSS=1460
26688  10.494769 244.3.160.204 -> 244.3.160.254 TCP 64 10520 > https [SYN] Seq=0 Win=8760 Len=0 MSS=1460
26690  10.495030 244.3.160.204 -> 244.3.160.254 TCP 64 10521 > http [SYN] Seq=0 Win=8760 Len=0 MSS=1460
26692  10.495322 244.3.160.204 -> 244.3.160.239 TCP 64 10522 > https [SYN] Seq=0 Win=8760 Len=0 MSS=1460
26694  10.495610 244.3.160.204 -> 244.3.160.239 TCP 64 10523 > http-alt [SYN] Seq=0 Win=8760 Len=0 MSS=1460
26696  10.495853 244.3.160.204 -> 244.3.160.239 TCP 64 10524 > http [SYN] Seq=0 Win=8760 Len=0 MSS=1460
26821  10.581062 244.3.160.204 -> 244.3.160.89 TCP 64 10513 > http [ACK] Seq=1 Ack=1 Win=8760 Len=0
26822  10.581205 244.3.160.204 -> 244.3.160.89 TCP 64 10513 > http [FIN, ACK] Seq=1 Ack=1 Win=8760 Len=0
26833  10.582660 244.3.160.204 -> 244.3.160.254 TCP 64 10516 > terabase [ACK] Seq=1 Ack=1 Win=8760 Len=0
26835  10.582836 244.3.160.204 -> 244.3.160.254 TCP 64 10516 > terabase [FIN, ACK] Seq=1 Ack=1 Win=8760 Len=0
26843  10.586194 244.3.160.204 -> 244.3.160.254 TCP 64 10520 > https [ACK] Seq=1 Ack=1 Win=8760 Len=0
26845  10.586341 244.3.160.204 -> 244.3.160.254 TCP 64 10520 > https [FIN, ACK] Seq=1 Ack=1 Win=8760 Len=0
26848  10.587333 244.3.160.204 -> 244.3.160.254 TCP 64 10521 > http [ACK] Seq=1 Ack=1 Win=8760 Len=0
26849  10.587464 244.3.160.204 -> 244.3.160.254 TCP 64 10521 > http [FIN, ACK] Seq=1 Ack=1 Win=8760 Len=0
26858  10.588357 244.3.160.204 -> 244.3.160.239 TCP 64 10522 > https [ACK] Seq=1 Ack=1 Win=8760 Len=0
26859  10.588513 244.3.160.204 -> 244.3.160.239 TCP 64 10522 > https [FIN, ACK] Seq=1 Ack=1 Win=8760 Len=0
26861  10.590142 244.3.160.204 -> 244.3.160.239 TCP 64 10524 > http [ACK] Seq=1 Ack=1 Win=8760 Len=0
26862  10.590283 244.3.160.204 -> 244.3.160.239 TCP 64 10524 > http [FIN, ACK] Seq=1 Ack=1 Win=8760 Len=0
26995  10.646580 244.3.160.204 -> 244.3.160.89 TCP 64 10513 > http [ACK] Seq=2 Ack=2 Win=8760 Len=0
26998  10.648944 244.3.160.204 -> 244.3.160.254 TCP 64 10516 > terabase [ACK] Seq=2 Ack=2 Win=8760 Len=0
27003  10.651998 244.3.160.204 -> 244.3.160.254 TCP 64 10520 > https [ACK] Seq=2 Ack=2 Win=8760 Len=0
27004  10.653143 244.3.160.204 -> 244.3.160.254 TCP 64 10521 > http [ACK] Seq=2 Ack=2 Win=8760 Len=0
27011  10.655009 244.3.160.204 -> 244.3.160.239 TCP 64 10524 > http [ACK] Seq=2 Ack=2 Win=8760 Len=0
27019  10.660924 244.3.160.204 -> 244.3.160.89 TCP 64 10514 > https [FIN, ACK] Seq=49 Ack=1461 Win=8760 Len=0
27027  10.662128 244.3.160.204 -> 244.3.160.89 TCP 64 [TCP Out-Of-Order] 10514 > https [FIN, ACK] Seq=49 Ack=2921 Win=8760 Len=0
27143  10.689694 244.3.160.204 -> 244.3.160.239 TCP 64 10522 > https [ACK] Seq=2 Ack=2 Win=8760 Len=0
27175  10.696326 244.3.160.204 -> 244.3.160.89 TCP 64 10514 > https [ACK] Seq=50 Ack=2987 Win=8695 Len=0
30041  12.491755 244.3.160.204 -> 244.3.160.89 TCP 64 10844 > aic-np [SYN] Seq=0 Win=8760 Len=0 MSS=1460
30043  12.492032 244.3.160.204 -> 244.3.160.89 TCP 64 10845 > terabase [SYN] Seq=0 Win=8760 Len=0 MSS=1460
30045  12.492282 244.3.160.204 -> 244.3.160.89 TCP 64 10846 > newoak [SYN] Seq=0 Win=8760 Len=0 MSS=1460
30047  12.492531 244.3.160.204 -> 244.3.160.89 TCP 64 10847 > pxc-spvr-ft [SYN] Seq=0 Win=8760 Len=0 MSS=1460
30049  12.492793 244.3.160.204 -> 244.3.160.89 TCP 64 10848 > dls-monitor [SYN] Seq=0 Win=8760 Len=0 MSS=1460
30051  12.493050 244.3.160.204 -> 244.3.160.89 TCP 64 10849 > http [SYN] Seq=0 Win=8760 Len=0 MSS=1460
30053  12.493336 244.3.160.204 -> 244.3.160.254 TCP 64 10850 > www-dev [SYN] Seq=0 Win=8760 Len=0 MSS=1460
30055  12.493579 244.3.160.204 -> 244.3.160.254 TCP 64 10851 > aic-np [SYN] Seq=0 Win=8760 Len=0 MSS=1460
30057  12.493856 244.3.160.204 -> 244.3.160.254 TCP 64 10852 > terabase [SYN] Seq=0 Win=8760 Len=0 MSS=1460
30059  12.494112 244.3.160.204 -> 244.3.160.254 TCP 64 10853 > newoak [SYN] Seq=0 Win=8760 Len=0 MSS=1460
30061  12.494360 244.3.160.204 -> 244.3.160.254 TCP 64 10854 > pxc-spvr-ft [SYN] Seq=0 Win=8760 Len=0 MSS=1460
30064  12.494616 244.3.160.204 -> 244.3.160.254 TCP 64 10855 > dls-monitor [SYN] Seq=0 Win=8760 Len=0 MSS=1460
30067  12.494935 244.3.160.204 -> 244.3.160.239 TCP 64 10856 > https [SYN] Seq=0 Win=8760 Len=0 MSS=1460
30069  12.495170 244.3.160.204 -> 244.3.160.239 TCP 64 10857 > http-alt [SYN] Seq=0 Win=8760 Len=0 MSS=1460
30071  12.495429 244.3.160.204 -> 244.3.160.239 TCP 64 10858 > http [SYN] Seq=0 Win=8760 Len=0 MSS=1460
30210  12.582459 244.3.160.204 -> 244.3.160.89 TCP 64 10849 > http [ACK] Seq=1 Ack=1 Win=8760 Len=0
30211  12.582568 244.3.160.204 -> 244.3.160.89 TCP 64 10849 > http [FIN, ACK] Seq=1 Ack=1 Win=8760 Len=0
30214  12.584379 244.3.160.204 -> 244.3.160.254 TCP 64 10852 > terabase [ACK] Seq=1 Ack=1 Win=8760 Len=0
30215  12.584511 244.3.160.204 -> 244.3.160.254 TCP 64 10852 > terabase [FIN, ACK] Seq=1 Ack=1 Win=8760 Len=0
30220  12.587913 244.3.160.204 -> 244.3.160.239 TCP 64 10856 > https [ACK] Seq=1 Ack=1 Win=8760 Len=0
30221  12.588046 244.3.160.204 -> 244.3.160.239 TCP 64 10856 > https [FIN, ACK] Seq=1 Ack=1 Win=8760 Len=0
30233  12.589712 244.3.160.204 -> 244.3.160.239 TCP 64 10858 > http [ACK] Seq=1 Ack=1 Win=8760 Len=0
30234  12.589869 244.3.160.204 -> 244.3.160.239 TCP 64 10858 > http [FIN, ACK] Seq=1 Ack=1 Win=8760 Len=0
30294  12.646517 244.3.160.204 -> 244.3.160.89 TCP 64 10849 > http [ACK] Seq=2 Ack=2 Win=8760 Len=0
30298  12.647887 244.3.160.204 -> 244.3.160.254 TCP 64 10852 > terabase [ACK] Seq=2 Ack=2 Win=8760 Len=0
30337  12.652586 244.3.160.204 -> 244.3.160.239 TCP 64 10858 > http [ACK] Seq=2 Ack=2 Win=8760 Len=0
30465  12.689363 244.3.160.204 -> 244.3.160.239 TCP 64 10856 > https [ACK] Seq=2 Ack=2 Win=8760 Len=0
34129  14.492201 244.3.160.204 -> 244.3.160.89 TCP 64 11180 > https [SYN] Seq=0 Win=8760 Len=0 MSS=1460
34134  14.492462 244.3.160.204 -> 244.3.160.89 TCP 64 11181 > www-dev [SYN] Seq=0 Win=8760 Len=0 MSS=1460
34140  14.492695 244.3.160.204 -> 244.3.160.89 TCP 64 11182 > aic-np [SYN] Seq=0 Win=8760 Len=0 MSS=1460
34143  14.493015 244.3.160.204 -> 244.3.160.89 TCP 64 11183 > terabase [SYN] Seq=0 Win=8760 Len=0 MSS=1460
34145  14.493225 244.3.160.204 -> 244.3.160.89 TCP 64 11184 > newoak [SYN] Seq=0 Win=8760 Len=0 MSS=1460
34149  14.493473 244.3.160.204 -> 244.3.160.89 TCP 64 11185 > pxc-spvr-ft [SYN] Seq=0 Win=8760 Len=0 MSS=1460
34153  14.493761 244.3.160.204 -> 244.3.160.254 TCP 64 11186 > https [SYN] Seq=0 Win=8760 Len=0 MSS=1460
34162  14.494039 244.3.160.204 -> 244.3.160.254 TCP 64 11187 > http [SYN] Seq=0 Win=8760 Len=0 MSS=1460
34165  14.494288 244.3.160.204 -> 244.3.160.254 TCP 64 11188 > www-dev [SYN] Seq=0 Win=8760 Len=0 MSS=1460
34168  14.494563 244.3.160.204 -> 244.3.160.254 TCP 64 11189 > aic-np [SYN] Seq=0 Win=8760 Len=0 MSS=1460
34173  14.494823 244.3.160.204 -> 244.3.160.254 TCP 64 11190 > terabase [SYN] Seq=0 Win=8760 Len=0 MSS=1460
34177  14.495084 244.3.160.204 -> 244.3.160.254 TCP 64 11191 > newoak [SYN] Seq=0 Win=8760 Len=0 MSS=1460
34179  14.495363 244.3.160.204 -> 244.3.160.239 TCP 64 11192 > https [SYN] Seq=0 Win=8760 Len=0 MSS=1460
34183  14.495639 244.3.160.204 -> 244.3.160.239 TCP 64 11193 > http-alt [SYN] Seq=0 Win=8760 Len=0 MSS=1460
34187  14.495911 244.3.160.204 -> 244.3.160.239 TCP 64 11194 > http [SYN] Seq=0 Win=8760 Len=0 MSS=1460
34570  14.580039 244.3.160.204 -> 244.3.160.254 TCP 64 11186 > https [ACK] Seq=1 Ack=1 Win=8760 Len=0
34572  14.580194 244.3.160.204 -> 244.3.160.254 TCP 64 11186 > https [FIN, ACK] Seq=1 Ack=1 Win=8760 Len=0
34576  14.581076 244.3.160.204 -> 244.3.160.254 TCP 64 11187 > http [ACK] Seq=1 Ack=1 Win=8760 Len=0
34577  14.581210 244.3.160.204 -> 244.3.160.254 TCP 64 11187 > http [FIN, ACK] Seq=1 Ack=1 Win=8760 Len=0
34583  14.583096 244.3.160.204 -> 244.3.160.254 TCP 64 11190 > terabase [ACK] Seq=1 Ack=1 Win=8760 Len=0
34584  14.583235 244.3.160.204 -> 244.3.160.254 TCP 64 11190 > terabase [FIN, ACK] Seq=1 Ack=1 Win=8760 Len=0
34593  14.585338 244.3.160.204 -> 244.3.160.239 TCP 64 11192 > https [ACK] Seq=1 Ack=1 Win=8760 Len=0
34594  14.585461 244.3.160.204 -> 244.3.160.239 TCP 64 11192 > https [FIN, ACK] Seq=1 Ack=1 Win=8760 Len=0
34603  14.586943 244.3.160.204 -> 244.3.160.239 TCP 64 11194 > http [ACK] Seq=1 Ack=1 Win=8760 Len=0
34604  14.587076 244.3.160.204 -> 244.3.160.239 TCP 64 11194 > http [FIN, ACK] Seq=1 Ack=1 Win=8760 Len=0
34891  14.650286 244.3.160.204 -> 244.3.160.89 TCP 64 11180 > https [FIN, ACK] Seq=49 Ack=1461 Win=8760 Len=0
34894  14.650713 244.3.160.204 -> 244.3.160.89 TCP 64 [TCP Out-Of-Order] 11180 > https [FIN, ACK] Seq=49 Ack=2921 Win=8760 Len=0
34901  14.652014 244.3.160.204 -> 244.3.160.239 TCP 64 11194 > http [ACK] Seq=2 Ack=2 Win=8760 Len=0
34908  14.653647 244.3.160.204 -> 244.3.160.239 TCP 64 11192 > https [ACK] Seq=2 Ack=2 Win=8760 Len=0
34930  14.658927 244.3.160.204 -> 244.3.160.254 TCP 64 11187 > http [ACK] Seq=2 Ack=2 Win=8760 Len=0
34964  14.674483 244.3.160.204 -> 244.3.160.254 TCP 64 11186 > https [ACK] Seq=2 Ack=2 Win=8760 Len=0
34966  14.674897 244.3.160.204 -> 244.3.160.254 TCP 64 11190 > terabase [ACK] Seq=2 Ack=2 Win=8760 Len=0
35010  14.684739 244.3.160.204 -> 244.3.160.89 TCP 64 11180 > https [ACK] Seq=50 Ack=2987 Win=8695 Len=0
39617  16.492251 244.3.160.204 -> 244.3.160.89 TCP 64 11511 > dls-monitor [SYN] Seq=0 Win=8760 Len=0 MSS=1460
39619  16.492472 244.3.160.204 -> 244.3.160.89 TCP 64 11512 > http [SYN] Seq=0 Win=8760 Len=0 MSS=1460
39621  16.492707 244.3.160.204 -> 244.3.160.89 TCP 64 11513 > https [SYN] Seq=0 Win=8760 Len=0 MSS=1460
39625  16.492969 244.3.160.204 -> 244.3.160.89 TCP 64 11514 > www-dev [SYN] Seq=0 Win=8760 Len=0 MSS=1460
39627  16.493240 244.3.160.204 -> 244.3.160.89 TCP 64 11515 > aic-np [SYN] Seq=0 Win=8760 Len=0 MSS=1460
39629  16.493471 244.3.160.204 -> 244.3.160.89 TCP 64 11516 > terabase [SYN] Seq=0 Win=8760 Len=0 MSS=1460
39631  16.493722 244.3.160.204 -> 244.3.160.254 TCP 64 11517 > pxc-spvr-ft [SYN] Seq=0 Win=8760 Len=0 MSS=1460
39633  16.494063 244.3.160.204 -> 244.3.160.254 TCP 64 11518 > dls-monitor [SYN] Seq=0 Win=8760 Len=0 MSS=1460
39635  16.494280 244.3.160.204 -> 244.3.160.254 TCP 64 11519 > https [SYN] Seq=0 Win=8760 Len=0 MSS=1460
39637  16.494501 244.3.160.204 -> 244.3.160.254 TCP 64 11520 > http [SYN] Seq=0 Win=8760 Len=0 MSS=1460
39639  16.494750 244.3.160.204 -> 244.3.160.254 TCP 64 11521 > www-dev [SYN] Seq=0 Win=8760 Len=0 MSS=1460
39641  16.495074 244.3.160.204 -> 244.3.160.254 TCP 64 11522 > aic-np [SYN] Seq=0 Win=8760 Len=0 MSS=1460
39643  16.495321 244.3.160.204 -> 244.3.160.239 TCP 64 11523 > https [SYN] Seq=0 Win=8760 Len=0 MSS=1460
39645  16.495573 244.3.160.204 -> 244.3.160.239 TCP 64 11524 > http-alt [SYN] Seq=0 Win=8760 Len=0 MSS=1460
39647  16.495828 244.3.160.204 -> 244.3.160.239 TCP 64 11525 > http [SYN] Seq=0 Win=8760 Len=0 MSS=1460
39884  16.578920 244.3.160.204 -> 244.3.160.89 TCP 64 11512 > http [ACK] Seq=1 Ack=1 Win=8760 Len=0
39885  16.579097 244.3.160.204 -> 244.3.160.89 TCP 64 11512 > http [FIN, ACK] Seq=1 Ack=1 Win=8760 Len=0
39896  16.583048 244.3.160.204 -> 244.3.160.254 TCP 64 11519 > https [ACK] Seq=1 Ack=1 Win=8760 Len=0
39897  16.583159 244.3.160.204 -> 244.3.160.254 TCP 64 11519 > https [FIN, ACK] Seq=1 Ack=1 Win=8760 Len=0
39903  16.584070 244.3.160.204 -> 244.3.160.254 TCP 64 11520 > http [ACK] Seq=1 Ack=1 Win=8760 Len=0
39906  16.584206 244.3.160.204 -> 244.3.160.254 TCP 64 11520 > http [FIN, ACK] Seq=1 Ack=1 Win=8760 Len=0
39912  16.586126 244.3.160.204 -> 244.3.160.239 TCP 64 11523 > https [ACK] Seq=1 Ack=1 Win=8760 Len=0
39913  16.586237 244.3.160.204 -> 244.3.160.239 TCP 64 11523 > https [FIN, ACK] Seq=1 Ack=1 Win=8760 Len=0
39919  16.588480 244.3.160.204 -> 244.3.160.239 TCP 64 11525 > http [ACK] Seq=1 Ack=1 Win=8760 Len=0
39920  16.588601 244.3.160.204 -> 244.3.160.239 TCP 64 11525 > http [FIN, ACK] Seq=1 Ack=1 Win=8760 Len=0
40029  16.644798 244.3.160.204 -> 244.3.160.89 TCP 64 11512 > http [ACK] Seq=2 Ack=2 Win=8760 Len=0
40038  16.647987 244.3.160.204 -> 244.3.160.254 TCP 64 11519 > https [ACK] Seq=2 Ack=2 Win=8760 Len=0
40040  16.648769 244.3.160.204 -> 244.3.160.254 TCP 64 11520 > http [ACK] Seq=2 Ack=2 Win=8760 Len=0
40041  16.651490 244.3.160.204 -> 244.3.160.239 TCP 64 11525 > http [ACK] Seq=2 Ack=2 Win=8760 Len=0
40042  16.654929 244.3.160.204 -> 244.3.160.89 TCP 64 11513 > https [FIN, ACK] Seq=49 Ack=1461 Win=8760 Len=0
40045  16.655628 244.3.160.204 -> 244.3.160.89 TCP 64 [TCP Out-Of-Order] 11513 > https [FIN, ACK] Seq=49 Ack=2921 Win=8760 Len=0
40080  16.692529 244.3.160.204 -> 244.3.160.89 TCP 64 11513 > https [ACK] Seq=50 Ack=2987 Win=8695 Len=0
40084  16.694036 244.3.160.204 -> 244.3.160.239 TCP 64 11523 > https [ACK] Seq=2 Ack=2 Win=8760 Len=0
43630  18.492358 244.3.160.204 -> 244.3.160.89 TCP 64 11850 > newoak [SYN] Seq=0 Win=8760 Len=0 MSS=1460
43636  18.492626 244.3.160.204 -> 244.3.160.89 TCP 64 11851 > pxc-spvr-ft [SYN] Seq=0 Win=8760 Len=0 MSS=1460
43639  18.492864 244.3.160.204 -> 244.3.160.89 TCP 64 11852 > dls-monitor [SYN] Seq=0 Win=8760 Len=0 MSS=1460
43643  18.493097 244.3.160.204 -> 244.3.160.89 TCP 64 11853 > http [SYN] Seq=0 Win=8760 Len=0 MSS=1460
43645  18.493363 244.3.160.204 -> 244.3.160.89 TCP 64 11854 > https [SYN] Seq=0 Win=8760 Len=0 MSS=1460
43648  18.493614 244.3.160.204 -> 244.3.160.89 TCP 64 11855 > www-dev [SYN] Seq=0 Win=8760 Len=0 MSS=1460
43651  18.493879 244.3.160.204 -> 244.3.160.254 TCP 64 11856 > terabase [SYN] Seq=0 Win=8760 Len=0 MSS=1460
43656  18.494159 244.3.160.204 -> 244.3.160.254 TCP 64 11857 > newoak [SYN] Seq=0 Win=8760 Len=0 MSS=1460
43660  18.494403 244.3.160.204 -> 244.3.160.254 TCP 64 11858 > pxc-spvr-ft [SYN] Seq=0 Win=8760 Len=0 MSS=1460
43663  18.494653 244.3.160.204 -> 244.3.160.254 TCP 64 11859 > dls-monitor [SYN] Seq=0 Win=8760 Len=0 MSS=1460
43667  18.494917 244.3.160.204 -> 244.3.160.254 TCP 64 11860 > https [SYN] Seq=0 Win=8760 Len=0 MSS=1460
43671  18.495194 244.3.160.204 -> 244.3.160.254 TCP 64 11861 > http [SYN] Seq=0 Win=8760 Len=0 MSS=1460
43673  18.495469 244.3.160.204 -> 244.3.160.239 TCP 64 11862 > https [SYN] Seq=0 Win=8760 Len=0 MSS=1460
43675  18.495746 244.3.160.204 -> 244.3.160.239 TCP 64 11863 > http-alt [SYN] Seq=0 Win=8760 Len=0 MSS=1460
43677  18.495983 244.3.160.204 -> 244.3.160.239 TCP 64 11864 > http [SYN] Seq=0 Win=8760 Len=0 MSS=1460
43893  18.579838 244.3.160.204 -> 244.3.160.89 TCP 64 11853 > http [ACK] Seq=1 Ack=1 Win=8760 Len=0
43895  18.579957 244.3.160.204 -> 244.3.160.89 TCP 64 11853 > http [FIN, ACK] Seq=1 Ack=1 Win=8760 Len=0
43919  18.581471 244.3.160.204 -> 244.3.160.254 TCP 64 11856 > terabase [ACK] Seq=1 Ack=1 Win=8760 Len=0
43922  18.581544 244.3.160.204 -> 244.3.160.254 TCP 64 11856 > terabase [FIN, ACK] Seq=1 Ack=1 Win=8760 Len=0
43937  18.584006 244.3.160.204 -> 244.3.160.254 TCP 64 11860 > https [ACK] Seq=1 Ack=1 Win=8760 Len=0
43938  18.584158 244.3.160.204 -> 244.3.160.254 TCP 64 11860 > https [FIN, ACK] Seq=1 Ack=1 Win=8760 Len=0
43940  18.584885 244.3.160.204 -> 244.3.160.254 TCP 64 11861 > http [ACK] Seq=1 Ack=1 Win=8760 Len=0
43941  18.585016 244.3.160.204 -> 244.3.160.254 TCP 64 11861 > http [FIN, ACK] Seq=1 Ack=1 Win=8760 Len=0
43945  18.586289 244.3.160.204 -> 244.3.160.239 TCP 64 11862 > https [ACK] Seq=1 Ack=1 Win=8760 Len=0
43946  18.586431 244.3.160.204 -> 244.3.160.239 TCP 64 11862 > https [FIN, ACK] Seq=1 Ack=1 Win=8760 Len=0
43948  18.588248 244.3.160.204 -> 244.3.160.239 TCP 64 11864 > http [ACK] Seq=1 Ack=1 Win=8760 Len=0
43949  18.588379 244.3.160.204 -> 244.3.160.239 TCP 64 11864 > http [FIN, ACK] Seq=1 Ack=1 Win=8760 Len=0
44123  18.642993 244.3.160.204 -> 244.3.160.89 TCP 64 11853 > http [ACK] Seq=2 Ack=2 Win=8760 Len=0
44149  18.644301 244.3.160.204 -> 244.3.160.254 TCP 64 11856 > terabase [ACK] Seq=2 Ack=2 Win=8760 Len=0
44156  18.646916 244.3.160.204 -> 244.3.160.254 TCP 64 11860 > https [ACK] Seq=2 Ack=2 Win=8760 Len=0
44158  18.647354 244.3.160.204 -> 244.3.160.254 TCP 64 11861 > http [ACK] Seq=2 Ack=2 Win=8760 Len=0
44164  18.649362 244.3.160.204 -> 244.3.160.239 TCP 64 11864 > http [ACK] Seq=2 Ack=2 Win=8760 Len=0
44184  18.653773 244.3.160.204 -> 244.3.160.89 TCP 64 11854 > https [FIN, ACK] Seq=49 Ack=1461 Win=8760 Len=0
44189  18.654884 244.3.160.204 -> 244.3.160.89 TCP 64 [TCP Out-Of-Order] 11854 > https [FIN, ACK] Seq=49 Ack=2921 Win=8760 Len=0
44223  18.687071 244.3.160.204 -> 244.3.160.89 TCP 64 11854 > https [ACK] Seq=50 Ack=2987 Win=8695 Len=0
44256  18.695869 244.3.160.204 -> 244.3.160.239 TCP 64 11862 > https [ACK] Seq=2 Ack=2 Win=8760 Len=0
50322  20.493188 244.3.160.204 -> 244.3.160.89 TCP 64 12181 > aic-np [SYN] Seq=0 Win=8760 Len=0 MSS=1460
50324  20.493458 244.3.160.204 -> 244.3.160.89 TCP 64 12182 > terabase [SYN] Seq=0 Win=8760 Len=0 MSS=1460
50326  20.493705 244.3.160.204 -> 244.3.160.89 TCP 64 12183 > newoak [SYN] Seq=0 Win=8760 Len=0 MSS=1460
50328  20.493966 244.3.160.204 -> 244.3.160.89 TCP 64 12184 > pxc-spvr-ft [SYN] Seq=0 Win=8760 Len=0 MSS=1460
50331  20.494211 244.3.160.204 -> 244.3.160.89 TCP 64 12185 > dls-monitor [SYN] Seq=0 Win=8760 Len=0 MSS=1460
50334  20.494476 244.3.160.204 -> 244.3.160.89 TCP 64 12186 > http [SYN] Seq=0 Win=8760 Len=0 MSS=1460
50337  20.494756 244.3.160.204 -> 244.3.160.254 TCP 64 12187 > www-dev [SYN] Seq=0 Win=8760 Len=0 MSS=1460
50339  20.495018 244.3.160.204 -> 244.3.160.254 TCP 64 12188 > aic-np [SYN] Seq=0 Win=8760 Len=0 MSS=1460
50341  20.495262 244.3.160.204 -> 244.3.160.254 TCP 64 12189 > terabase [SYN] Seq=0 Win=8760 Len=0 MSS=1460
50343  20.495561 244.3.160.204 -> 244.3.160.254 TCP 64 12190 > newoak [SYN] Seq=0 Win=8760 Len=0 MSS=1460
50345  20.495799 244.3.160.204 -> 244.3.160.254 TCP 64 12191 > pxc-spvr-ft [SYN] Seq=0 Win=8760 Len=0 MSS=1460
50347  20.496060 244.3.160.204 -> 244.3.160.254 TCP 64 12192 > dls-monitor [SYN] Seq=0 Win=8760 Len=0 MSS=1460
50349  20.496362 244.3.160.204 -> 244.3.160.239 TCP 64 12193 > https [SYN] Seq=0 Win=8760 Len=0 MSS=1460
50351  20.496619 244.3.160.204 -> 244.3.160.239 TCP 64 12194 > http-alt [SYN] Seq=0 Win=8760 Len=0 MSS=1460
50353  20.496874 244.3.160.204 -> 244.3.160.239 TCP 64 12195 > http [SYN] Seq=0 Win=8760 Len=0 MSS=1460
50511  20.582709 244.3.160.204 -> 244.3.160.89 TCP 64 12186 > http [ACK] Seq=1 Ack=1 Win=8760 Len=0
50512  20.582839 244.3.160.204 -> 244.3.160.89 TCP 64 12186 > http [FIN, ACK] Seq=1 Ack=1 Win=8760 Len=0
50538  20.585152 244.3.160.204 -> 244.3.160.254 TCP 64 12189 > terabase [ACK] Seq=1 Ack=1 Win=8760 Len=0
50539  20.585274 244.3.160.204 -> 244.3.160.254 TCP 64 12189 > terabase [FIN, ACK] Seq=1 Ack=1 Win=8760 Len=0
50542  20.588050 244.3.160.204 -> 244.3.160.239 TCP 64 12193 > https [ACK] Seq=1 Ack=1 Win=8760 Len=0
50544  20.588206 244.3.160.204 -> 244.3.160.239 TCP 64 12193 > https [FIN, ACK] Seq=1 Ack=1 Win=8760 Len=0
50548  20.589702 244.3.160.204 -> 244.3.160.239 TCP 64 12195 > http [ACK] Seq=1 Ack=1 Win=8760 Len=0
50549  20.589831 244.3.160.204 -> 244.3.160.239 TCP 64 12195 > http [FIN, ACK] Seq=1 Ack=1 Win=8760 Len=0
50641  20.643820 244.3.160.204 -> 244.3.160.89 TCP 64 12186 > http [ACK] Seq=2 Ack=2 Win=8760 Len=0
50644  20.645165 244.3.160.204 -> 244.3.160.254 TCP 64 12189 > terabase [ACK] Seq=2 Ack=2 Win=8760 Len=0
50647  20.649151 244.3.160.204 -> 244.3.160.239 TCP 64 12195 > http [ACK] Seq=2 Ack=2 Win=8760 Len=0
50683  20.672215 244.3.160.204 -> 244.3.160.239 TCP 64 12193 > https [ACK] Seq=2 Ack=2 Win=8760 Len=0
54263  22.492768 244.3.160.204 -> 244.3.160.89 TCP 64 12515 > https [SYN] Seq=0 Win=8760 Len=0 MSS=1460
54265  22.493010 244.3.160.204 -> 244.3.160.89 TCP 64 12516 > www-dev [SYN] Seq=0 Win=8760 Len=0 MSS=1460
54267  22.493305 244.3.160.204 -> 244.3.160.89 TCP 64 12517 > aic-np [SYN] Seq=0 Win=8760 Len=0 MSS=1460
54269  22.493519 244.3.160.204 -> 244.3.160.89 TCP 64 12518 > terabase [SYN] Seq=0 Win=8760 Len=0 MSS=1460
54271  22.493770 244.3.160.204 -> 244.3.160.89 TCP 64 12519 > newoak [SYN] Seq=0 Win=8760 Len=0 MSS=1460
54273  22.494014 244.3.160.204 -> 244.3.160.89 TCP 64 12520 > pxc-spvr-ft [SYN] Seq=0 Win=8760 Len=0 MSS=1460
54275  22.494327 244.3.160.204 -> 244.3.160.254 TCP 64 12521 > https [SYN] Seq=0 Win=8760 Len=0 MSS=1460
54277  22.494569 244.3.160.204 -> 244.3.160.254 TCP 64 12522 > http [SYN] Seq=0 Win=8760 Len=0 MSS=1460
54280  22.494819 244.3.160.204 -> 244.3.160.254 TCP 64 12523 > www-dev [SYN] Seq=0 Win=8760 Len=0 MSS=1460
54283  22.495086 244.3.160.204 -> 244.3.160.254 TCP 64 12524 > aic-np [SYN] Seq=0 Win=8760 Len=0 MSS=1460
54285  22.495344 244.3.160.204 -> 244.3.160.254 TCP 64 12525 > terabase [SYN] Seq=0 Win=8760 Len=0 MSS=1460
54287  22.495605 244.3.160.204 -> 244.3.160.254 TCP 64 12526 > newoak [SYN] Seq=0 Win=8760 Len=0 MSS=1460
54289  22.495880 244.3.160.204 -> 244.3.160.239 TCP 64 12527 > https [SYN] Seq=0 Win=8760 Len=0 MSS=1460
54291  22.496163 244.3.160.204 -> 244.3.160.239 TCP 64 12528 > http-alt [SYN] Seq=0 Win=8760 Len=0 MSS=1460
54293  22.496410 244.3.160.204 -> 244.3.160.239 TCP 64 12529 > http [SYN] Seq=0 Win=8760 Len=0 MSS=1460
54528  22.584066 244.3.160.204 -> 244.3.160.254 TCP 64 12521 > https [ACK] Seq=1 Ack=1 Win=8760 Len=0
54530  22.584198 244.3.160.204 -> 244.3.160.254 TCP 64 12521 > https [FIN, ACK] Seq=1 Ack=1 Win=8760 Len=0
54539  22.585063 244.3.160.204 -> 244.3.160.254 TCP 64 12522 > http [ACK] Seq=1 Ack=1 Win=8760 Len=0
54540  22.585182 244.3.160.204 -> 244.3.160.254 TCP 64 12522 > http [FIN, ACK] Seq=1 Ack=1 Win=8760 Len=0
54549  22.587594 244.3.160.204 -> 244.3.160.254 TCP 64 12525 > terabase [ACK] Seq=1 Ack=1 Win=8760 Len=0
54550  22.587721 244.3.160.204 -> 244.3.160.254 TCP 64 12525 > terabase [FIN, ACK] Seq=1 Ack=1 Win=8760 Len=0
54555  22.589505 244.3.160.204 -> 244.3.160.239 TCP 64 12527 > https [ACK] Seq=1 Ack=1 Win=8760 Len=0
54556  22.589632 244.3.160.204 -> 244.3.160.239 TCP 64 12527 > https [FIN, ACK] Seq=1 Ack=1 Win=8760 Len=0
54561  22.591084 244.3.160.204 -> 244.3.160.239 TCP 64 12529 > http [ACK] Seq=1 Ack=1 Win=8760 Len=0
54563  22.591219 244.3.160.204 -> 244.3.160.239 TCP 64 12529 > http [FIN, ACK] Seq=1 Ack=1 Win=8760 Len=0
54680  22.653446 244.3.160.204 -> 244.3.160.254 TCP 64 12525 > terabase [ACK] Seq=2 Ack=2 Win=8760 Len=0
