2301   0.693729  244.3.31.67 -> 244.3.41.84  TCP 193 commonspace > kana [PSH, ACK] Seq=1 Ack=184 Win=65535 Len=135
2322   0.700667  244.3.31.67 -> 244.3.41.84  TCP 193 commonspace > interpathpanel [PSH, ACK] Seq=1 Ack=184 Win=65535 Len=135
2345   0.709190  244.3.31.67 -> 244.3.41.84  TCP 1066 commonspace > kana [PSH, ACK] Seq=136 Ack=766 Win=65535 Len=1008
2361   0.719243  244.3.31.67 -> 244.3.41.84  TCP 1066 commonspace > interpathpanel [PSH, ACK] Seq=136 Ack=766 Win=65535 Len=1008
2404   0.737387  244.3.31.67 -> 244.3.41.84  TCP 248 commonspace > kana [PSH, ACK] Seq=1144 Ack=963 Win=65535 Len=190
2413   0.740227  244.3.31.67 -> 244.3.41.84  TCP 248 commonspace > interpathpanel [PSH, ACK] Seq=1144 Ack=963 Win=65535 Len=190
2432   0.748040  244.3.31.67 -> 244.3.41.84  TCP 362 commonspace > interpathpanel [PSH, ACK] Seq=1334 Ack=1127 Win=65535 Len=304
2558   0.778705  244.3.31.67 -> 244.3.41.84  TCP 64 commonspace > kana [ACK] Seq=1334 Ack=1350 Win=65535 Len=0
2677   0.867939  244.3.31.67 -> 244.3.41.84  TCP 359 commonspace > kana [PSH, ACK] Seq=1334 Ack=1350 Win=65535 Len=301
2721   0.882041  244.3.31.67 -> 244.3.41.84  TCP 78 commonspace > interpathpanel [PSH, ACK] Seq=1638 Ack=1471 Win=65535 Len=20
2757   0.900249  244.3.31.67 -> 244.3.41.84  TCP 73 commonspace > interpathpanel [PSH, ACK] Seq=1658 Ack=1484 Win=65535 Len=15
2969   0.965736  244.3.31.67 -> 244.3.41.84  TCP 193 commonspace > gbjd816 [PSH, ACK] Seq=1 Ack=184 Win=65535 Len=135
3012   0.985526  244.3.31.67 -> 244.3.41.84  TCP 1066 commonspace > gbjd816 [PSH, ACK] Seq=136 Ack=766 Win=65535 Len=1008
3043   0.996695  244.3.31.67 -> 244.3.41.84  TCP 248 commonspace > gbjd816 [PSH, ACK] Seq=1144 Ack=963 Win=65535 Len=190
3061   1.007799  244.3.31.67 -> 244.3.41.84  TCP 362 commonspace > gbjd816 [PSH, ACK] Seq=1334 Ack=1127 Win=65535 Len=304
3082   1.029623  244.3.31.67 -> 244.3.41.84  TCP 692 commonspace > kana [PSH, ACK] Seq=1635 Ack=3335 Win=65535 Len=634
3090   1.036481  244.3.31.67 -> 244.3.41.84  TCP 78 commonspace > gbjd816 [PSH, ACK] Seq=1638 Ack=1471 Win=65535 Len=20
3106   1.049162  244.3.31.67 -> 244.3.41.84  TCP 727 commonspace > kana [PSH, ACK] Seq=2269 Ack=4428 Win=65535 Len=669
3124   1.052368  244.3.31.67 -> 244.3.41.84  TCP 73 commonspace > gbjd816 [PSH, ACK] Seq=1658 Ack=1484 Win=65535 Len=15
3312   1.090562  244.3.31.67 -> 244.3.41.84  TCP 299 commonspace > kana [PSH, ACK] Seq=2938 Ack=4930 Win=65535 Len=241
3341   1.101844  244.3.31.67 -> 244.3.41.84  TCP 158 commonspace > kana [PSH, ACK] Seq=3179 Ack=4951 Win=65535 Len=100
3357   1.106736  244.3.31.67 -> 244.3.41.84  TCP 193 commonspace > sitaraserver [PSH, ACK] Seq=1 Ack=184 Win=65535 Len=135
3425   1.123582  244.3.31.67 -> 244.3.41.84  TCP 1066 commonspace > sitaraserver [PSH, ACK] Seq=136 Ack=767 Win=65535 Len=1008
3460   1.128623  244.3.31.67 -> 244.3.41.84  TCP 78 commonspace > kana [PSH, ACK] Seq=3279 Ack=5295 Win=65535 Len=20
3581   1.144543  244.3.31.67 -> 244.3.41.84  TCP 248 commonspace > sitaraserver [PSH, ACK] Seq=1144 Ack=964 Win=65535 Len=190
3749   1.149649  244.3.31.67 -> 244.3.41.84  TCP 362 commonspace > sitaraserver [PSH, ACK] Seq=1334 Ack=1128 Win=65535 Len=304
3870   1.158968  244.3.31.67 -> 244.3.41.84  TCP 73 commonspace > kana [PSH, ACK] Seq=3299 Ack=5308 Win=65535 Len=15
4026   1.190711  244.3.31.67 -> 244.3.41.84  TCP 78 commonspace > sitaraserver [PSH, ACK] Seq=1638 Ack=1472 Win=65535 Len=20
4051   1.201737  244.3.31.67 -> 244.3.41.84  TCP 73 commonspace > sitaraserver [PSH, ACK] Seq=1658 Ack=1485 Win=65535 Len=15
15201   4.152402  244.3.31.67 -> 244.3.41.84  TCP 193 commonspace > gbjd816 [PSH, ACK] Seq=1673 Ack=1667 Win=65535 Len=135
15215   4.165461  244.3.31.67 -> 244.3.41.84  TCP 1066 commonspace > gbjd816 [PSH, ACK] Seq=1808 Ack=2249 Win=65535 Len=1008
15238   4.175909  244.3.31.67 -> 244.3.41.84  TCP 248 commonspace > gbjd816 [PSH, ACK] Seq=2816 Ack=2446 Win=65535 Len=190
15758   4.260060  244.3.31.67 -> 244.3.41.84  TCP 64 commonspace > gbjd816 [ACK] Seq=3006 Ack=2833 Win=65535 Len=0
15803   4.290433  244.3.31.67 -> 244.3.41.84  TCP 359 commonspace > gbjd816 [PSH, ACK] Seq=3006 Ack=2833 Win=65535 Len=301
16514   4.552398  244.3.31.67 -> 244.3.41.84  TCP 692 commonspace > gbjd816 [PSH, ACK] Seq=3307 Ack=4818 Win=65535 Len=634
16552   4.567814  244.3.31.67 -> 244.3.41.84  TCP 692 commonspace > gbjd816 [PSH, ACK] Seq=3941 Ack=5911 Win=65535 Len=634
16705   4.583209  244.3.31.67 -> 244.3.41.84  TCP 78 commonspace > gbjd816 [PSH, ACK] Seq=4575 Ack=6255 Win=65535 Len=20
16765   4.607495  244.3.31.67 -> 244.3.41.84  TCP 73 commonspace > gbjd816 [PSH, ACK] Seq=4595 Ack=6268 Win=65535 Len=15
17224   4.912519  244.3.31.67 -> 244.3.41.84  TCP 193 commonspace > gte-samp [PSH, ACK] Seq=1 Ack=184 Win=65535 Len=135
17232   4.924659  244.3.31.67 -> 244.3.41.84  TCP 1066 commonspace > gte-samp [PSH, ACK] Seq=136 Ack=766 Win=65535 Len=1008
17263   4.937255  244.3.31.67 -> 244.3.41.84  TCP 248 commonspace > gte-samp [PSH, ACK] Seq=1144 Ack=963 Win=65535 Len=190
17279   4.943371  244.3.31.67 -> 244.3.41.84  TCP 362 commonspace > gte-samp [PSH, ACK] Seq=1334 Ack=1127 Win=65535 Len=304
17560   5.213031  244.3.31.67 -> 244.3.41.84  TCP 78 commonspace > gte-samp [PSH, ACK] Seq=1638 Ack=1471 Win=65535 Len=20
17590   5.236585  244.3.31.67 -> 244.3.41.84  TCP 73 commonspace > gte-samp [PSH, ACK] Seq=1658 Ack=1484 Win=65535 Len=15
17650   5.276364  244.3.31.67 -> 244.3.41.84  TCP 193 commonspace > gbjd816 [PSH, ACK] Seq=4610 Ack=6451 Win=65535 Len=135
17661   5.287579  244.3.31.67 -> 244.3.41.84  TCP 1066 commonspace > gbjd816 [PSH, ACK] Seq=4745 Ack=7033 Win=65535 Len=1008
17674   5.298010  244.3.31.67 -> 244.3.41.84  TCP 248 commonspace > gbjd816 [PSH, ACK] Seq=5753 Ack=7230 Win=65535 Len=190
17681   5.302259  244.3.31.67 -> 244.3.41.84  TCP 362 commonspace > gbjd816 [PSH, ACK] Seq=5943 Ack=7394 Win=65535 Len=304
17700   5.336389  244.3.31.67 -> 244.3.41.84  TCP 78 commonspace > gbjd816 [PSH, ACK] Seq=6247 Ack=7738 Win=65535 Len=20
17716   5.346962  244.3.31.67 -> 244.3.41.84  TCP 73 commonspace > gbjd816 [PSH, ACK] Seq=6267 Ack=7751 Win=65535 Len=15
17755   5.385359  244.3.31.67 -> 244.3.41.84  TCP 193 commonspace > interpathpanel [PSH, ACK] Seq=1673 Ack=1667 Win=65535 Len=135
17778   5.397428  244.3.31.67 -> 244.3.41.84  TCP 1066 commonspace > interpathpanel [PSH, ACK] Seq=1808 Ack=2249 Win=65535 Len=1008
17790   5.408229  244.3.31.67 -> 244.3.41.84  TCP 248 commonspace > interpathpanel [PSH, ACK] Seq=2816 Ack=2446 Win=65535 Len=190
17807   5.414914  244.3.31.67 -> 244.3.41.84  TCP 362 commonspace > interpathpanel [PSH, ACK] Seq=3006 Ack=2610 Win=65535 Len=304
17897   5.454810  244.3.31.67 -> 244.3.41.84  TCP 78 commonspace > interpathpanel [PSH, ACK] Seq=3310 Ack=2954 Win=65535 Len=20
17931   5.474311  244.3.31.67 -> 244.3.41.84  TCP 73 commonspace > interpathpanel [PSH, ACK] Seq=3330 Ack=2967 Win=65535 Len=15
21834   7.602306  244.3.31.67 -> 244.3.41.84  TCP 193 commonspace > gbjd816 [PSH, ACK] Seq=6282 Ack=7934 Win=65535 Len=135
21844   7.614934  244.3.31.67 -> 244.3.41.84  TCP 1066 commonspace > gbjd816 [PSH, ACK] Seq=6417 Ack=8516 Win=65535 Len=1008
21847   7.624325  244.3.31.67 -> 244.3.41.84  TCP 248 commonspace > gbjd816 [PSH, ACK] Seq=7425 Ack=8713 Win=65535 Len=190
21851   7.626893  244.3.31.67 -> 244.3.41.84  TCP 362 commonspace > gbjd816 [PSH, ACK] Seq=7615 Ack=8877 Win=65535 Len=304
22090   7.755100  244.3.31.67 -> 244.3.41.84  TCP 284 commonspace > gbjd816 [PSH, ACK] Seq=7919 Ack=9123 Win=65535 Len=226
22188   7.818445  244.3.31.67 -> 244.3.41.84  TCP 173 commonspace > gbjd816 [PSH, ACK] Seq=8145 Ack=9627 Win=65535 Len=115
22235   7.849856  244.3.31.67 -> 244.3.41.84  TCP 78 commonspace > gbjd816 [PSH, ACK] Seq=8260 Ack=9971 Win=65535 Len=20
22253   7.871977  244.3.31.67 -> 244.3.41.84  TCP 78 commonspace > gbjd816 [PSH, ACK] Seq=8280 Ack=10315 Win=65535 Len=20
22302   7.892057  244.3.31.67 -> 244.3.41.84  TCP 73 commonspace > gbjd816 [PSH, ACK] Seq=8300 Ack=10328 Win=65535 Len=15
25208   9.693539  244.3.31.67 -> 244.3.41.84  TCP 193 commonspace > gbjd816 [PSH, ACK] Seq=8315 Ack=10511 Win=65535 Len=135
25212   9.705629  244.3.31.67 -> 244.3.41.84  TCP 1066 commonspace > gbjd816 [PSH, ACK] Seq=8450 Ack=11094 Win=65535 Len=1008
25220   9.717127  244.3.31.67 -> 244.3.41.84  TCP 248 commonspace > gbjd816 [PSH, ACK] Seq=9458 Ack=11291 Win=65535 Len=190
25475   9.814417  244.3.31.67 -> 244.3.41.84  TCP 64 commonspace > gbjd816 [ACK] Seq=9648 Ack=11678 Win=65535 Len=0
25505   9.826880  244.3.31.67 -> 244.3.41.84  TCP 359 commonspace > gbjd816 [PSH, ACK] Seq=9648 Ack=11678 Win=65535 Len=301
26335  10.318958  244.3.31.67 -> 244.3.41.84  TCP 692 commonspace > gbjd816 [PSH, ACK] Seq=9949 Ack=13663 Win=65535 Len=634
26371  10.334531  244.3.31.67 -> 244.3.41.84  TCP 727 commonspace > gbjd816 [PSH, ACK] Seq=10583 Ack=14756 Win=65535 Len=669
26407  10.362276  244.3.31.67 -> 244.3.41.84  TCP 299 commonspace > gbjd816 [PSH, ACK] Seq=11252 Ack=15258 Win=65535 Len=241
26418  10.369492  244.3.31.67 -> 244.3.41.84  TCP 158 commonspace > gbjd816 [PSH, ACK] Seq=11493 Ack=15279 Win=65535 Len=100
26423  10.379843  244.3.31.67 -> 244.3.41.84  TCP 78 commonspace > gbjd816 [PSH, ACK] Seq=11593 Ack=15623 Win=65535 Len=20
26465  10.405188  244.3.31.67 -> 244.3.41.84  TCP 73 commonspace > gbjd816 [PSH, ACK] Seq=11613 Ack=15636 Win=65535 Len=15
28485  11.485808  244.3.31.67 -> 244.3.41.84  TCP 193 commonspace > gbjd816 [PSH, ACK] Seq=11628 Ack=15819 Win=65535 Len=135
28501  11.497029  244.3.31.67 -> 244.3.41.84  TCP 1066 commonspace > gbjd816 [PSH, ACK] Seq=11763 Ack=16401 Win=65535 Len=1008
28533  11.509364  244.3.31.67 -> 244.3.41.84  TCP 248 commonspace > gbjd816 [PSH, ACK] Seq=12771 Ack=16598 Win=65535 Len=190
28760  11.674192  244.3.31.67 -> 244.3.41.84  TCP 64 commonspace > gbjd816 [ACK] Seq=12961 Ack=16985 Win=65535 Len=0
28789  11.696503  244.3.31.67 -> 244.3.41.84  TCP 359 commonspace > gbjd816 [PSH, ACK] Seq=12961 Ack=16985 Win=65535 Len=301
30010  12.461667  244.3.31.67 -> 244.3.41.84  TCP 692 commonspace > gbjd816 [PSH, ACK] Seq=13262 Ack=18970 Win=65535 Len=634
30029  12.478981  244.3.31.67 -> 244.3.41.84  TCP 692 commonspace > gbjd816 [PSH, ACK] Seq=13896 Ack=20063 Win=65535 Len=634
30086  12.504140  244.3.31.67 -> 244.3.41.84  TCP 64 commonspace > gbjd816 [ACK] Seq=14530 Ack=20407 Win=65535 Len=0
30095  12.509939  244.3.31.67 -> 244.3.41.84  TCP 78 commonspace > gbjd816 [PSH, ACK] Seq=14530 Ack=20407 Win=65535 Len=20
30124  12.542155  244.3.31.67 -> 244.3.41.84  TCP 73 commonspace > gbjd816 [PSH, ACK] Seq=14550 Ack=20420 Win=65535 Len=15
30872  12.906114  244.3.31.67 -> 244.3.41.84  TCP 193 commonspace > gbjd816 [PSH, ACK] Seq=14565 Ack=20603 Win=65535 Len=135
30911  12.917563  244.3.31.67 -> 244.3.41.84  TCP 1066 commonspace > gbjd816 [PSH, ACK] Seq=14700 Ack=21185 Win=65535 Len=1008
30950  12.928335  244.3.31.67 -> 244.3.41.84  TCP 248 commonspace > gbjd816 [PSH, ACK] Seq=15708 Ack=21382 Win=65535 Len=190
31074  13.040724  244.3.31.67 -> 244.3.41.84  TCP 359 commonspace > gbjd816 [PSH, ACK] Seq=15898 Ack=21769 Win=65535 Len=301
31169  13.129983  244.3.31.67 -> 244.3.41.84  TCP 692 commonspace > gbjd816 [PSH, ACK] Seq=16199 Ack=23754 Win=65535 Len=634
31194  13.144707  244.3.31.67 -> 244.3.41.84  TCP 692 commonspace > gbjd816 [PSH, ACK] Seq=16833 Ack=24847 Win=65535 Len=634
31209  13.158149  244.3.31.67 -> 244.3.41.84  TCP 78 commonspace > gbjd816 [PSH, ACK] Seq=17467 Ack=25191 Win=65535 Len=20
31236  13.181050  244.3.31.67 -> 244.3.41.84  TCP 73 commonspace > gbjd816 [PSH, ACK] Seq=17487 Ack=25204 Win=65535 Len=15
34060  14.466463  244.3.31.67 -> 244.3.41.84  TCP 193 commonspace > gbjd816 [PSH, ACK] Seq=17502 Ack=25387 Win=65535 Len=135
34096  14.477746  244.3.31.67 -> 244.3.41.84  TCP 1066 commonspace > gbjd816 [PSH, ACK] Seq=17637 Ack=25969 Win=65535 Len=1008
34119  14.489676  244.3.31.67 -> 244.3.41.84  TCP 248 commonspace > gbjd816 [PSH, ACK] Seq=18645 Ack=26166 Win=65535 Len=190
34208  14.502474  244.3.31.67 -> 244.3.41.84  TCP 362 commonspace > gbjd816 [PSH, ACK] Seq=18835 Ack=26330 Win=65535 Len=304
34298  14.530973  244.3.31.67 -> 244.3.41.84  TCP 78 commonspace > gbjd816 [PSH, ACK] Seq=19139 Ack=26674 Win=65535 Len=20
34339  14.541229  244.3.31.67 -> 244.3.41.84  TCP 73 commonspace > gbjd816 [PSH, ACK] Seq=19159 Ack=26687 Win=65535 Len=15
34493  14.566674  244.3.31.67 -> 244.3.41.84  TCP 193 commonspace > kana [PSH, ACK] Seq=3314 Ack=5491 Win=65535 Len=135
34566  14.578751  244.3.31.67 -> 244.3.41.84  TCP 1066 commonspace > kana [PSH, ACK] Seq=3449 Ack=6073 Win=65535 Len=1008
34627  14.590794  244.3.31.67 -> 244.3.41.84  TCP 248 commonspace > kana [PSH, ACK] Seq=4457 Ack=6270 Win=65535 Len=190
35082  14.712010  244.3.31.67 -> 244.3.41.84  TCP 359 commonspace > kana [PSH, ACK] Seq=4647 Ack=6657 Win=65535 Len=301
35234  14.753415  244.3.31.67 -> 244.3.41.84  TCP 692 commonspace > kana [PSH, ACK] Seq=4948 Ack=8642 Win=65535 Len=634
35292  14.773222  244.3.31.67 -> 244.3.41.84  TCP 727 commonspace > kana [PSH, ACK] Seq=5582 Ack=9735 Win=65535 Len=669
35337  14.786789  244.3.31.67 -> 244.3.41.84  TCP 299 commonspace > kana [PSH, ACK] Seq=6251 Ack=10237 Win=65535 Len=241
35371  14.795550  244.3.31.67 -> 244.3.41.84  TCP 158 commonspace > kana [PSH, ACK] Seq=6492 Ack=10258 Win=65535 Len=100
35410  14.809690  244.3.31.67 -> 244.3.41.84  TCP 78 commonspace > kana [PSH, ACK] Seq=6592 Ack=10602 Win=65535 Len=20
35496  14.831554  244.3.31.67 -> 244.3.41.84  TCP 73 commonspace > kana [PSH, ACK] Seq=6612 Ack=10615 Win=65535 Len=15
42255  17.638348  244.3.31.67 -> 244.3.41.84  TCP 193 commonspace > gte-samp [PSH, ACK] Seq=1673 Ack=1667 Win=65535 Len=135
42265  17.651553  244.3.31.67 -> 244.3.41.84  TCP 1066 commonspace > gte-samp [PSH, ACK] Seq=1808 Ack=2249 Win=65535 Len=1008
42297  17.663678  244.3.31.67 -> 244.3.41.84  TCP 248 commonspace > gte-samp [PSH, ACK] Seq=2816 Ack=2446 Win=65535 Len=190
42302  17.669682  244.3.31.67 -> 244.3.41.84  TCP 362 commonspace > gte-samp [PSH, ACK] Seq=3006 Ack=2610 Win=65535 Len=304
42940  18.175575  244.3.31.67 -> 244.3.41.84  TCP 299 commonspace > gte-samp [PSH, ACK] Seq=3310 Ack=2836 Win=65535 Len=241
43020  18.238283  244.3.31.67 -> 244.3.41.84  TCP 78 commonspace > gte-samp [PSH, ACK] Seq=3551 Ack=3180 Win=65535 Len=20
43048  18.265105  244.3.31.67 -> 244.3.41.84  TCP 73 commonspace > gte-samp [PSH, ACK] Seq=3571 Ack=3193 Win=65535 Len=15
52470  21.671131  244.3.31.67 -> 244.3.41.84  TCP 193 commonspace > gbjd816 [PSH, ACK] Seq=19174 Ack=26870 Win=65535 Len=135
52480  21.692019  244.3.31.67 -> 244.3.41.84  TCP 1066 commonspace > gbjd816 [PSH, ACK] Seq=19309 Ack=27453 Win=65535 Len=1008
52483  21.706169  244.3.31.67 -> 244.3.41.84  TCP 248 commonspace > gbjd816 [PSH, ACK] Seq=20317 Ack=27650 Win=65535 Len=190
52487  21.712101  244.3.31.67 -> 244.3.41.84  TCP 362 commonspace > gbjd816 [PSH, ACK] Seq=20507 Ack=27814 Win=65535 Len=304
52494  21.729011  244.3.31.67 -> 244.3.41.84  TCP 78 commonspace > gbjd816 [PSH, ACK] Seq=20811 Ack=28158 Win=65535 Len=20
52510  21.741879  244.3.31.67 -> 244.3.41.84  TCP 73 commonspace > gbjd816 [PSH, ACK] Seq=20831 Ack=28171 Win=65535 Len=15
62554  25.750053  244.3.31.67 -> 244.3.41.84  TCP 193 commonspace > solve [PSH, ACK] Seq=1 Ack=184 Win=65535 Len=135
62592  25.764782  244.3.31.67 -> 244.3.41.84  TCP 1066 commonspace > solve [PSH, ACK] Seq=136 Ack=766 Win=65535 Len=1008
62675  25.779269  244.3.31.67 -> 244.3.41.84  TCP 248 commonspace > solve [PSH, ACK] Seq=1144 Ack=963 Win=65535 Len=190
62932  25.891081  244.3.31.67 -> 244.3.41.84  TCP 64 commonspace > solve [ACK] Seq=1334 Ack=1632 Win=65535 Len=0
62972  25.918173  244.3.31.67 -> 244.3.41.84  TCP 803 commonspace > solve [PSH, ACK] Seq=1334 Ack=1632 Win=65535 Len=745
63031  25.942843  244.3.31.67 -> 244.3.41.84  TCP 78 commonspace > solve [PSH, ACK] Seq=2079 Ack=1976 Win=65535 Len=20
63044  25.959314  244.3.31.67 -> 244.3.41.84  TCP 73 commonspace > solve [PSH, ACK] Seq=2099 Ack=1989 Win=65535 Len=15
63045  25.961656  244.3.31.67 -> 244.3.41.84  TCP 193 commonspace > gbjd816 [PSH, ACK] Seq=20846 Ack=28354 Win=65535 Len=135
63060  25.976798  244.3.31.67 -> 244.3.41.84  TCP 1066 commonspace > gbjd816 [PSH, ACK] Seq=20981 Ack=28936 Win=65535 Len=1008
63097  25.989430  244.3.31.67 -> 244.3.41.84  TCP 248 commonspace > gbjd816 [PSH, ACK] Seq=21989 Ack=29133 Win=65535 Len=190
63114  25.997118  244.3.31.67 -> 244.3.41.84  TCP 362 commonspace > gbjd816 [PSH, ACK] Seq=22179 Ack=29297 Win=65535 Len=304
64020  26.427841  244.3.31.67 -> 244.3.41.84  TCP 165 commonspace > gbjd816 [PSH, ACK] Seq=22483 Ack=29322 Win=65535 Len=107
64051  26.440406  244.3.31.67 -> 244.3.41.84  TCP 78 commonspace > gbjd816 [PSH, ACK] Seq=22590 Ack=29666 Win=65535 Len=20
64174  26.475399  244.3.31.67 -> 244.3.41.84  TCP 73 commonspace > gbjd816 [PSH, ACK] Seq=22610 Ack=29679 Win=65535 Len=15
72347  29.646085  244.3.31.67 -> 244.3.41.84  TCP 193 commonspace > sitaraserver [PSH, ACK] Seq=1673 Ack=1668 Win=65535 Len=135
72466  29.665369  244.3.31.67 -> 244.3.41.84  TCP 1066 commonspace > sitaraserver [PSH, ACK] Seq=1808 Ack=2250 Win=65535 Len=1008
72516  29.677755  244.3.31.67 -> 244.3.41.84  TCP 248 commonspace > sitaraserver [PSH, ACK] Seq=2816 Ack=2447 Win=65535 Len=190
72938  29.797313  244.3.31.67 -> 244.3.41.84  TCP 803 commonspace > sitaraserver [PSH, ACK] Seq=3006 Ack=3116 Win=65535 Len=745
73178  29.866058  244.3.31.67 -> 244.3.41.84  TCP 78 commonspace > sitaraserver [PSH, ACK] Seq=3751 Ack=3460 Win=65535 Len=20
73261  29.882234  244.3.31.67 -> 244.3.41.84  TCP 73 commonspace > sitaraserver [PSH, ACK] Seq=3771 Ack=3473 Win=65535 Len=15
92185  35.313038  244.3.31.67 -> 244.3.41.84  TCP 193 commonspace > gbjd816 [PSH, ACK] Seq=22625 Ack=29862 Win=65535 Len=135
92223  35.325356  244.3.31.67 -> 244.3.41.84  TCP 1066 commonspace > gbjd816 [PSH, ACK] Seq=22760 Ack=30444 Win=65535 Len=1008
92252  35.336216  244.3.31.67 -> 244.3.41.84  TCP 248 commonspace > gbjd816 [PSH, ACK] Seq=23768 Ack=30641 Win=65535 Len=190
92309  35.357646  244.3.31.67 -> 244.3.41.84  TCP 64 commonspace > gbjd816 [ACK] Seq=23958 Ack=31028 Win=65535 Len=0
92569  35.444420  244.3.31.67 -> 244.3.41.84  TCP 359 commonspace > gbjd816 [PSH, ACK] Seq=23958 Ack=31028 Win=65535 Len=301
93268  35.633013  244.3.31.67 -> 244.3.41.84  TCP 692 commonspace > gbjd816 [PSH, ACK] Seq=24259 Ack=33013 Win=65535 Len=634
93330  35.645999  244.3.31.67 -> 244.3.41.84  TCP 692 commonspace > gbjd816 [PSH, ACK] Seq=24893 Ack=34106 Win=65535 Len=634
93408  35.670831  244.3.31.67 -> 244.3.41.84  TCP 78 commonspace > gbjd816 [PSH, ACK] Seq=25527 Ack=34450 Win=65535 Len=20
93469  35.692637  244.3.31.67 -> 244.3.41.84  TCP 73 commonspace > gbjd816 [PSH, ACK] Seq=25547 Ack=34463 Win=65535 Len=15
124370  44.355283  244.3.31.67 -> 244.3.41.84  TCP 193 commonspace > gbjd816 [PSH, ACK] Seq=25562 Ack=34646 Win=65535 Len=135
124411  44.368067  244.3.31.67 -> 244.3.41.84  TCP 1066 commonspace > gbjd816 [PSH, ACK] Seq=25697 Ack=35228 Win=65535 Len=1008
124427  44.379100  244.3.31.67 -> 244.3.41.84  TCP 248 commonspace > gbjd816 [PSH, ACK] Seq=26705 Ack=35425 Win=65535 Len=190
124581  44.464038  244.3.31.67 -> 244.3.41.84  TCP 64 commonspace > gbjd816 [ACK] Seq=26895 Ack=35812 Win=65535 Len=0
124641  44.491973  244.3.31.67 -> 244.3.41.84  TCP 359 commonspace > gbjd816 [PSH, ACK] Seq=26895 Ack=35812 Win=65535 Len=301
124737  44.523018  244.3.31.67 -> 244.3.41.84  TCP 692 commonspace > gbjd816 [PSH, ACK] Seq=27196 Ack=37797 Win=65535 Len=634
124785  44.541310  244.3.31.67 -> 244.3.41.84  TCP 727 commonspace > gbjd816 [PSH, ACK] Seq=27830 Ack=38890 Win=65535 Len=669
124804  44.566213  244.3.31.67 -> 244.3.41.84  TCP 299 commonspace > gbjd816 [PSH, ACK] Seq=28499 Ack=39392 Win=65535 Len=241
124843  44.593100  244.3.31.67 -> 244.3.41.84  TCP 158 commonspace > gbjd816 [PSH, ACK] Seq=28740 Ack=39413 Win=65535 Len=100
124948  44.609725  244.3.31.67 -> 244.3.41.84  TCP 78 commonspace > gbjd816 [PSH, ACK] Seq=28840 Ack=39757 Win=65535 Len=20
125003  44.632828  244.3.31.67 -> 244.3.41.84  TCP 73 commonspace > gbjd816 [PSH, ACK] Seq=28860 Ack=39770 Win=65535 Len=15
125158  44.727197  244.3.31.67 -> 244.3.41.84  TCP 193 commonspace > interpathpanel [PSH, ACK] Seq=3345 Ack=3150 Win=65535 Len=135
125182  44.745338  244.3.31.67 -> 244.3.41.84  TCP 1066 commonspace > interpathpanel [PSH, ACK] Seq=3480 Ack=3732 Win=65535 Len=1008
125213  44.756455  244.3.31.67 -> 244.3.41.84  TCP 248 commonspace > interpathpanel [PSH, ACK] Seq=4488 Ack=3929 Win=65535 Len=190
125952  44.875499  244.3.31.67 -> 244.3.41.84  TCP 359 commonspace > interpathpanel [PSH, ACK] Seq=4678 Ack=4316 Win=65535 Len=301
129539  45.275791  244.3.31.67 -> 244.3.41.84  TCP 727 commonspace > interpathpanel [PSH, ACK] Seq=4979 Ack=6301 Win=65535 Len=669
129630  45.294303  244.3.31.67 -> 244.3.41.84  TCP 64 commonspace > interpathpanel [ACK] Seq=5648 Ack=6832 Win=65535 Len=0
129640  45.303574  244.3.31.67 -> 244.3.41.84  TCP 298 commonspace > interpathpanel [PSH, ACK] Seq=5648 Ack=6832 Win=65535 Len=240
129659  45.311365  244.3.31.67 -> 244.3.41.84  TCP 158 commonspace > interpathpanel [PSH, ACK] Seq=5888 Ack=6853 Win=65535 Len=100
129707  45.333537  244.3.31.67 -> 244.3.41.84  TCP 727 commonspace > interpathpanel [PSH, ACK] Seq=5988 Ack=7946 Win=65535 Len=669
129788  45.371004  244.3.31.67 -> 244.3.41.84  TCP 298 commonspace > interpathpanel [PSH, ACK] Seq=6657 Ack=8448 Win=65535 Len=240
129839  45.388187  244.3.31.67 -> 244.3.41.84  TCP 158 commonspace > interpathpanel [PSH, ACK] Seq=6897 Ack=8469 Win=65535 Len=100
129928  45.412826  244.3.31.67 -> 244.3.41.84  TCP 78 commonspace > interpathpanel [PSH, ACK] Seq=6997 Ack=8813 Win=65535 Len=20
130120  45.461817  244.3.31.67 -> 244.3.41.84  TCP 73 commonspace > interpathpanel [PSH, ACK] Seq=7017 Ack=8826 Win=65535 Len=15
130373  45.550762  244.3.31.67 -> 244.3.41.84  TCP 193 commonspace > interpathpanel [PSH, ACK] Seq=7032 Ack=9009 Win=65535 Len=135
130417  45.567647  244.3.31.67 -> 244.3.41.84  TCP 1066 commonspace > interpathpanel [PSH, ACK] Seq=7167 Ack=9591 Win=65535 Len=1008
130483  45.579046  244.3.31.67 -> 244.3.41.84  TCP 248 commonspace > interpathpanel [PSH, ACK] Seq=8175 Ack=9788 Win=65535 Len=190
130951  45.701591  244.3.31.67 -> 244.3.41.84  TCP 359 commonspace > interpathpanel [PSH, ACK] Seq=8365 Ack=10175 Win=65535 Len=301
132315  46.093203  244.3.31.67 -> 244.3.41.84  TCP 727 commonspace > interpathpanel [PSH, ACK] Seq=8666 Ack=12160 Win=65535 Len=669
132363  46.114007  244.3.31.67 -> 244.3.41.84  TCP 64 commonspace > interpathpanel [ACK] Seq=9335 Ack=12662 Win=65535 Len=0
132370  46.116141  244.3.31.67 -> 244.3.41.84  TCP 299 commonspace > interpathpanel [PSH, ACK] Seq=9335 Ack=12662 Win=65535 Len=241
132386  46.123759  244.3.31.67 -> 244.3.41.84  TCP 158 commonspace > interpathpanel [PSH, ACK] Seq=9576 Ack=12683 Win=65535 Len=100
132412  46.135922  244.3.31.67 -> 244.3.41.84  TCP 727 commonspace > interpathpanel [PSH, ACK] Seq=9676 Ack=13776 Win=65535 Len=669
132464  46.157320  244.3.31.67 -> 244.3.41.84  TCP 298 commonspace > interpathpanel [PSH, ACK] Seq=10345 Ack=14278 Win=65535 Len=240
132485  46.165317  244.3.31.67 -> 244.3.41.84  TCP 158 commonspace > interpathpanel [PSH, ACK] Seq=10585 Ack=14299 Win=65535 Len=100
132545  46.183962  244.3.31.67 -> 244.3.41.84  TCP 78 commonspace > interpathpanel [PSH, ACK] Seq=10685 Ack=14643 Win=65535 Len=20
132623  46.211227  244.3.31.67 -> 244.3.41.84  TCP 73 commonspace > interpathpanel [PSH, ACK] Seq=10705 Ack=14656 Win=65535 Len=15
132762  46.274948  244.3.31.67 -> 244.3.41.84  TCP 193 commonspace > interpathpanel [PSH, ACK] Seq=10720 Ack=14839 Win=65535 Len=135
132852  46.285454  244.3.31.67 -> 244.3.41.84  TCP 1066 commonspace > interpathpanel [PSH, ACK] Seq=10855 Ack=15422 Win=65535 Len=1008
132866  46.294723  244.3.31.67 -> 244.3.41.84  TCP 248 commonspace > interpathpanel [PSH, ACK] Seq=11863 Ack=15619 Win=65535 Len=190
132911  46.324184  244.3.31.67 -> 244.3.41.84  TCP 64 commonspace > interpathpanel [ACK] Seq=12053 Ack=16006 Win=65535 Len=0
133224  46.426524  244.3.31.67 -> 244.3.41.84  TCP 359 commonspace > interpathpanel [PSH, ACK] Seq=12053 Ack=16006 Win=65535 Len=301
135024  46.936095  244.3.31.67 -> 244.3.41.84  TCP 692 commonspace > interpathpanel [PSH, ACK] Seq=12354 Ack=17991 Win=65535 Len=634
135066  46.944009  244.3.31.67 -> 244.3.41.84  TCP 64 commonspace > interpathpanel [ACK] Seq=12988 Ack=19084 Win=65535 Len=0
135067  46.949510  244.3.31.67 -> 244.3.41.84  TCP 692 commonspace > interpathpanel [PSH, ACK] Seq=12988 Ack=19084 Win=65535 Len=634
135086  46.962250  244.3.31.67 -> 244.3.41.84  TCP 78 commonspace > interpathpanel [PSH, ACK] Seq=13622 Ack=19428 Win=65535 Len=20
135162  46.994136  244.3.31.67 -> 244.3.41.84  TCP 73 commonspace > interpathpanel [PSH, ACK] Seq=13642 Ack=19441 Win=65535 Len=15
135292  47.048139  244.3.31.67 -> 244.3.41.84  TCP 193 commonspace > interpathpanel [PSH, ACK] Seq=13657 Ack=19624 Win=65535 Len=135
135316  47.058251  244.3.31.67 -> 244.3.41.84  TCP 1066 commonspace > interpathpanel [PSH, ACK] Seq=13792 Ack=20206 Win=65535 Len=1008
135328  47.069252  244.3.31.67 -> 244.3.41.84  TCP 248 commonspace > interpathpanel [PSH, ACK] Seq=14800 Ack=20403 Win=65535 Len=190
135539  47.154002  244.3.31.67 -> 244.3.41.84  TCP 64 commonspace > interpathpanel [ACK] Seq=14990 Ack=20790 Win=65535 Len=0
135603  47.183676  244.3.31.67 -> 244.3.41.84  TCP 359 commonspace > interpathpanel [PSH, ACK] Seq=14990 Ack=20790 Win=65535 Len=301
136260  47.432404  244.3.31.67 -> 244.3.41.84  TCP 692 commonspace > interpathpanel [PSH, ACK] Seq=15291 Ack=22775 Win=65535 Len=634
136280  47.447159  244.3.31.67 -> 244.3.41.84  TCP 692 commonspace > interpathpanel [PSH, ACK] Seq=15925 Ack=23868 Win=65535 Len=634
136326  47.461177  244.3.31.67 -> 244.3.41.84  TCP 78 commonspace > interpathpanel [PSH, ACK] Seq=16559 Ack=24212 Win=65535 Len=20
136396  47.484563  244.3.31.67 -> 244.3.41.84  TCP 73 commonspace > interpathpanel [PSH, ACK] Seq=16579 Ack=24225 Win=65535 Len=15
146918  50.437666  244.3.31.67 -> 244.3.41.84  TCP 193 commonspace > kana [PSH, ACK] Seq=6627 Ack=10798 Win=65535 Len=135
146933  50.451066  244.3.31.67 -> 244.3.41.84  TCP 1066 commonspace > kana [PSH, ACK] Seq=6762 Ack=11380 Win=65535 Len=1008
146966  50.463651  244.3.31.67 -> 244.3.41.84  TCP 248 commonspace > kana [PSH, ACK] Seq=7770 Ack=11577 Win=65535 Len=190
147469  50.600227  244.3.31.67 -> 244.3.41.84  TCP 359 commonspace > kana [PSH, ACK] Seq=7960 Ack=11964 Win=65535 Len=301
147509  50.622563  244.3.31.67 -> 244.3.41.84  TCP 727 commonspace > kana [PSH, ACK] Seq=8261 Ack=13949 Win=65535 Len=669
147562  50.646236  244.3.31.67 -> 244.3.41.84  TCP 299 commonspace > kana [PSH, ACK] Seq=8930 Ack=14480 Win=65535 Len=241
147606  50.662464  244.3.31.67 -> 244.3.41.84  TCP 219 commonspace > kana [PSH, ACK] Seq=9171 Ack=14501 Win=65535 Len=161
147620  50.670107  244.3.31.67 -> 244.3.41.84  TCP 154 commonspace > kana [PSH, ACK] Seq=9332 Ack=14558 Win=65535 Len=96
147642  50.682777  244.3.31.67 -> 244.3.41.84  TCP 727 commonspace > kana [PSH, ACK] Seq=9428 Ack=15651 Win=65535 Len=669
147708  50.700537  244.3.31.67 -> 244.3.41.84  TCP 299 commonspace > kana [PSH, ACK] Seq=10097 Ack=16153 Win=65535 Len=241
147732  50.706868  244.3.31.67 -> 244.3.41.84  TCP 236 commonspace > kana [PSH, ACK] Seq=10338 Ack=16174 Win=65535 Len=178
147748  50.717202  244.3.31.67 -> 244.3.41.84  TCP 155 commonspace > kana [PSH, ACK] Seq=10516 Ack=16231 Win=65535 Len=97
147830  50.728663  244.3.31.67 -> 244.3.41.84  TCP 154 commonspace > kana [PSH, ACK] Seq=10613 Ack=16288 Win=65535 Len=96
147840  50.734332  244.3.31.67 -> 244.3.41.84  TCP 219 commonspace > kana [PSH, ACK] Seq=10709 Ack=16309 Win=65535 Len=161
147852  50.750888  244.3.31.67 -> 244.3.41.84  TCP 155 commonspace > kana [PSH, ACK] Seq=10870 Ack=16366 Win=65535 Len=97
147867  50.766451  244.3.31.67 -> 244.3.41.84  TCP 78 commonspace > kana [PSH, ACK] Seq=10967 Ack=16710 Win=65535 Len=20
147950  50.788796  244.3.31.67 -> 244.3.41.84  TCP 73 commonspace > kana [PSH, ACK] Seq=10987 Ack=16723 Win=65535 Len=15
178991  60.153140  244.3.31.67 -> 244.3.41.84  TCP 193 commonspace > gbjd816 [PSH, ACK] Seq=28875 Ack=39953 Win=65535 Len=135
179017  60.174282  244.3.31.67 -> 244.3.41.84  TCP 1066 commonspace > gbjd816 [PSH, ACK] Seq=29010 Ack=40536 Win=65535 Len=1008
179047  60.194550  244.3.31.67 -> 244.3.41.84  TCP 248 commonspace > gbjd816 [PSH, ACK] Seq=30018 Ack=40733 Win=65535 Len=190
179367  60.347486  244.3.31.67 -> 244.3.41.84  TCP 359 commonspace > gbjd816 [PSH, ACK] Seq=30208 Ack=41120 Win=65535 Len=301
180090  60.633032  244.3.31.67 -> 244.3.41.84  TCP 692 commonspace > gbjd816 [PSH, ACK] Seq=30509 Ack=43105 Win=65535 Len=634
180150  60.652131  244.3.31.67 -> 244.3.41.84  TCP 692 commonspace > gbjd816 [PSH, ACK] Seq=31143 Ack=44198 Win=65535 Len=634
180262  60.686449  244.3.31.67 -> 244.3.41.84  TCP 78 commonspace > gbjd816 [PSH, ACK] Seq=31777 Ack=44542 Win=65535 Len=20
180313  60.723120  244.3.31.67 -> 244.3.41.84  TCP 73 commonspace > gbjd816 [PSH, ACK] Seq=31797 Ack=44555 Win=65535 Len=15
182501  61.333744  244.3.31.67 -> 244.3.41.84  TCP 193 commonspace > gbjd816 [PSH, ACK] Seq=31812 Ack=44738 Win=65535 Len=135
182545  61.351185  244.3.31.67 -> 244.3.41.84  TCP 1066 commonspace > gbjd816 [PSH, ACK] Seq=31947 Ack=45320 Win=65535 Len=1008
182573  61.364309  244.3.31.67 -> 244.3.41.84  TCP 248 commonspace > gbjd816 [PSH, ACK] Seq=32955 Ack=45517 Win=65535 Len=190
182743  61.423953  244.3.31.67 -> 244.3.41.84  TCP 64 commonspace > gbjd816 [ACK] Seq=33145 Ack=45904 Win=65535 Len=0
182949  61.480579  244.3.31.67 -> 244.3.41.84  TCP 359 commonspace > gbjd816 [PSH, ACK] Seq=33145 Ack=45904 Win=65535 Len=301
183416  61.633952  244.3.31.67 -> 244.3.41.84  TCP 64 commonspace > gbjd816 [ACK] Seq=33446 Ack=47889 Win=65535 Len=0
183434  61.641353  244.3.31.67 -> 244.3.41.84  TCP 692 commonspace > gbjd816 [PSH, ACK] Seq=33446 Ack=47889 Win=65535 Len=634
183517  61.659335  244.3.31.67 -> 244.3.41.84  TCP 692 commonspace > gbjd816 [PSH, ACK] Seq=34080 Ack=48982 Win=65535 Len=634
183611  61.687563  244.3.31.67 -> 244.3.41.84  TCP 78 commonspace > gbjd816 [PSH, ACK] Seq=34714 Ack=49326 Win=65535 Len=20
183695  61.712921  244.3.31.67 -> 244.3.41.84  TCP 73 commonspace > gbjd816 [PSH, ACK] Seq=34734 Ack=49339 Win=65535 Len=15
198493  68.187572  244.3.31.67 -> 244.3.41.84  TCP 193 commonspace > solve [PSH, ACK] Seq=2114 Ack=2172 Win=65535 Len=135
198514  68.203566  244.3.31.67 -> 244.3.41.84  TCP 1066 commonspace > solve [PSH, ACK] Seq=2249 Ack=2754 Win=65535 Len=1008
198536  68.215323  244.3.31.67 -> 244.3.41.84  TCP 248 commonspace > solve [PSH, ACK] Seq=3257 Ack=2951 Win=65535 Len=190
198654  68.268169  244.3.31.67 -> 244.3.41.84  TCP 64 commonspace > solve [ACK] Seq=3447 Ack=3620 Win=65535 Len=0
198882  68.356454  244.3.31.67 -> 244.3.41.84  TCP 803 commonspace > solve [PSH, ACK] Seq=3447 Ack=3620 Win=65535 Len=745
198964  68.401556  244.3.31.67 -> 244.3.41.84  TCP 78 commonspace > solve [PSH, ACK] Seq=4192 Ack=3964 Win=65535 Len=20
199004  68.414667  244.3.31.67 -> 244.3.41.84  TCP 73 commonspace > solve [PSH, ACK] Seq=4212 Ack=3977 Win=65535 Len=15
203555  70.164301  244.3.31.67 -> 244.3.41.84  TCP 193 commonspace > gbjd816 [PSH, ACK] Seq=34749 Ack=49522 Win=65535 Len=135
203575  70.176797  244.3.31.67 -> 244.3.41.84  TCP 1066 commonspace > gbjd816 [PSH, ACK] Seq=34884 Ack=50105 Win=65535 Len=1008
203662  70.189220  244.3.31.67 -> 244.3.41.84  TCP 248 commonspace > gbjd816 [PSH, ACK] Seq=35892 Ack=50302 Win=65535 Len=190
204547  70.340174  244.3.31.67 -> 244.3.41.84  TCP 714 commonspace > gbjd816 [PSH, ACK] Seq=36082 Ack=52057 Win=65535 Len=656
204565  70.353931  244.3.31.67 -> 244.3.41.84  TCP 64 commonspace > gbjd816 [ACK] Seq=36738 Ack=52401 Win=65535 Len=0
204566  70.354661  244.3.31.67 -> 244.3.41.84  TCP 78 commonspace > gbjd816 [PSH, ACK] Seq=36738 Ack=52401 Win=65535 Len=20
204593  70.384203  244.3.31.67 -> 244.3.41.84  TCP 73 commonspace > gbjd816 [PSH, ACK] Seq=36758 Ack=52414 Win=65535 Len=15
235628  82.146701  244.3.31.67 -> 244.3.41.84  TCP 193 commonspace > gbjd816 [PSH, ACK] Seq=36773 Ack=52597 Win=65535 Len=135
235662  82.159749  244.3.31.67 -> 244.3.41.84  TCP 1066 commonspace > gbjd816 [PSH, ACK] Seq=36908 Ack=53179 Win=65535 Len=1008
235668  82.173467  244.3.31.67 -> 244.3.41.84  TCP 248 commonspace > gbjd816 [PSH, ACK] Seq=37916 Ack=53376 Win=65535 Len=190
235992  82.289520  244.3.31.67 -> 244.3.41.84  TCP 359 commonspace > gbjd816 [PSH, ACK] Seq=38106 Ack=53763 Win=65535 Len=301
236179  82.303854  244.3.31.67 -> 244.3.41.84  TCP 64 commonspace > gbjd816 [ACK] Seq=38407 Ack=55748 Win=65535 Len=0
236270  82.312410  244.3.31.67 -> 244.3.41.84  TCP 727 commonspace > gbjd816 [PSH, ACK] Seq=38407 Ack=55748 Win=65535 Len=669
236433  82.327534  244.3.31.67 -> 244.3.41.84  TCP 299 commonspace > gbjd816 [PSH, ACK] Seq=39076 Ack=56250 Win=65535 Len=241
236598  82.341230  244.3.31.67 -> 244.3.41.84  TCP 158 commonspace > gbjd816 [PSH, ACK] Seq=39317 Ack=56271 Win=65535 Len=100
236725  82.351988  244.3.31.67 -> 244.3.41.84  TCP 692 commonspace > gbjd816 [PSH, ACK] Seq=39417 Ack=57364 Win=65535 Len=634
236893  82.365230  244.3.31.67 -> 244.3.41.84  TCP 78 commonspace > gbjd816 [PSH, ACK] Seq=40051 Ack=57708 Win=65535 Len=20
237186  82.391096  244.3.31.67 -> 244.3.41.84  TCP 73 commonspace > gbjd816 [PSH, ACK] Seq=40071 Ack=57721 Win=65535 Len=15
245054  85.486996  244.3.31.67 -> 244.3.41.84  TCP 193 commonspace > gbjd816 [PSH, ACK] Seq=40086 Ack=57904 Win=65535 Len=135
245079  85.499689  244.3.31.67 -> 244.3.41.84  TCP 1066 commonspace > gbjd816 [PSH, ACK] Seq=40221 Ack=58486 Win=65535 Len=1008
245109  85.511437  244.3.31.67 -> 244.3.41.84  TCP 248 commonspace > gbjd816 [PSH, ACK] Seq=41229 Ack=58683 Win=65535 Len=190
245256  85.603857  244.3.31.67 -> 244.3.41.84  TCP 64 commonspace > gbjd816 [ACK] Seq=41419 Ack=59070 Win=65535 Len=0
245310  85.639838  244.3.31.67 -> 244.3.41.84  TCP 359 commonspace > gbjd816 [PSH, ACK] Seq=41419 Ack=59070 Win=65535 Len=301
245853  85.900409  244.3.31.67 -> 244.3.41.84  TCP 692 commonspace > gbjd816 [PSH, ACK] Seq=41720 Ack=61055 Win=65535 Len=634
245872  85.920818  244.3.31.67 -> 244.3.41.84  TCP 692 commonspace > gbjd816 [PSH, ACK] Seq=42354 Ack=62148 Win=65535 Len=634
245906  85.942309  244.3.31.67 -> 244.3.41.84  TCP 78 commonspace > gbjd816 [PSH, ACK] Seq=42988 Ack=62492 Win=65535 Len=20
245942  85.971397  244.3.31.67 -> 244.3.41.84  TCP 73 commonspace > gbjd816 [PSH, ACK] Seq=43008 Ack=62505 Win=65535 Len=15
253348  89.693662  244.3.31.67 -> 244.3.41.84  TCP 193 commonspace > gbjd816 [PSH, ACK] Seq=43023 Ack=62688 Win=65535 Len=135
253371  89.707439  244.3.31.67 -> 244.3.41.84  TCP 1066 commonspace > gbjd816 [PSH, ACK] Seq=43158 Ack=63270 Win=65535 Len=1008
253397  89.719749  244.3.31.67 -> 244.3.41.84  TCP 248 commonspace > gbjd816 [PSH, ACK] Seq=44166 Ack=63467 Win=65535 Len=190
253466  89.773851  244.3.31.67 -> 244.3.41.84  TCP 64 commonspace > gbjd816 [ACK] Seq=44356 Ack=63854 Win=65535 Len=0
253536  89.832967  244.3.31.67 -> 244.3.41.84  TCP 359 commonspace > gbjd816 [PSH, ACK] Seq=44356 Ack=63854 Win=65535 Len=301
253693  89.946104  244.3.31.67 -> 244.3.41.84  TCP 692 commonspace > gbjd816 [PSH, ACK] Seq=44657 Ack=65839 Win=65535 Len=634
253705  89.959793  244.3.31.67 -> 244.3.41.84  TCP 692 commonspace > gbjd816 [PSH, ACK] Seq=45291 Ack=66932 Win=65535 Len=634
253725  89.974551  244.3.31.67 -> 244.3.41.84  TCP 78 commonspace > gbjd816 [PSH, ACK] Seq=45925 Ack=67276 Win=65535 Len=20
253752  90.000362  244.3.31.67 -> 244.3.41.84  TCP 73 commonspace > gbjd816 [PSH, ACK] Seq=45945 Ack=67289 Win=65535 Len=15
258713  91.679614  244.3.31.67 -> 244.3.41.84  TCP 193 commonspace > gbjd816 [PSH, ACK] Seq=45960 Ack=67472 Win=65535 Len=135
258738  91.694908  244.3.31.67 -> 244.3.41.84  TCP 1066 commonspace > gbjd816 [PSH, ACK] Seq=46095 Ack=68054 Win=65535 Len=1008
258763  91.707164  244.3.31.67 -> 244.3.41.84  TCP 248 commonspace > gbjd816 [PSH, ACK] Seq=47103 Ack=68251 Win=65535 Len=190
261174  91.837749  244.3.31.67 -> 244.3.41.84  TCP 359 commonspace > gbjd816 [PSH, ACK] Seq=47293 Ack=68638 Win=65535 Len=301
269585  92.129899  244.3.31.67 -> 244.3.41.84  TCP 692 commonspace > gbjd816 [PSH, ACK] Seq=47594 Ack=70623 Win=65535 Len=634
269980  92.144647  244.3.31.67 -> 244.3.41.84  TCP 692 commonspace > gbjd816 [PSH, ACK] Seq=48228 Ack=71716 Win=65535 Len=634
270430  92.165592  244.3.31.67 -> 244.3.41.84  TCP 78 commonspace > gbjd816 [PSH, ACK] Seq=48862 Ack=72060 Win=65535 Len=20
271431  92.190391  244.3.31.67 -> 244.3.41.84  TCP 73 commonspace > gbjd816 [PSH, ACK] Seq=48882 Ack=72073 Win=65535 Len=15
287342  95.981036  244.3.31.67 -> 244.3.41.84  TCP 193 commonspace > interpathpanel [PSH, ACK] Seq=16594 Ack=24408 Win=65535 Len=135
287365  95.994786  244.3.31.67 -> 244.3.41.84  TCP 1066 commonspace > interpathpanel [PSH, ACK] Seq=16729 Ack=24990 Win=65535 Len=1008
287415  96.011889  244.3.31.67 -> 244.3.41.84  TCP 248 commonspace > interpathpanel [PSH, ACK] Seq=17737 Ack=25187 Win=65535 Len=190
287485  96.016647  244.3.31.67 -> 244.3.41.84  TCP 362 commonspace > interpathpanel [PSH, ACK] Seq=17927 Ack=25351 Win=65535 Len=304
287727  96.090798  244.3.31.67 -> 244.3.41.84  TCP 78 commonspace > interpathpanel [PSH, ACK] Seq=18231 Ack=25695 Win=65535 Len=20
287766  96.119874  244.3.31.67 -> 244.3.41.84  TCP 73 commonspace > interpathpanel [PSH, ACK] Seq=18251 Ack=25708 Win=65535 Len=15
289318  96.594710  244.3.31.67 -> 244.3.41.84  TCP 193 commonspace > solve [PSH, ACK] Seq=4227 Ack=4160 Win=65535 Len=135
289352  96.606815  244.3.31.67 -> 244.3.41.84  TCP 1066 commonspace > solve [PSH, ACK] Seq=4362 Ack=4742 Win=65535 Len=1008
289411  96.620488  244.3.31.67 -> 244.3.41.84  TCP 248 commonspace > solve [PSH, ACK] Seq=5370 Ack=4939 Win=65535 Len=190
289867  96.765849  244.3.31.67 -> 244.3.41.84  TCP 858 commonspace > solve [PSH, ACK] Seq=5560 Ack=5608 Win=65535 Len=800
290465  96.964027  244.3.31.67 -> 244.3.41.84  TCP 658 commonspace > solve [PSH, ACK] Seq=6360 Ack=6270 Win=65535 Len=600
290504  96.987399  244.3.31.67 -> 244.3.41.84  TCP 158 commonspace > solve [PSH, ACK] Seq=6960 Ack=6291 Win=65535 Len=100
290541  97.014133  244.3.31.67 -> 244.3.41.84  TCP 64 commonspace > solve [ACK] Seq=7060 Ack=6635 Win=65535 Len=0
290542  97.014903  244.3.31.67 -> 244.3.41.84  TCP 78 commonspace > solve [PSH, ACK] Seq=7060 Ack=6635 Win=65535 Len=20
290601  97.039083  244.3.31.67 -> 244.3.41.84  TCP 73 commonspace > solve [PSH, ACK] Seq=7080 Ack=6648 Win=65535 Len=15
298107 100.492404  244.3.31.67 -> 244.3.41.84  TCP 193 commonspace > gbjd816 [PSH, ACK] Seq=48897 Ack=72256 Win=65535 Len=135
298235 100.509904  244.3.31.67 -> 244.3.41.84  TCP 1066 commonspace > gbjd816 [PSH, ACK] Seq=49032 Ack=72838 Win=65535 Len=1008
298296 100.522352  244.3.31.67 -> 244.3.41.84  TCP 248 commonspace > gbjd816 [PSH, ACK] Seq=50040 Ack=73035 Win=65535 Len=190
298307 100.527598  244.3.31.67 -> 244.3.41.84  TCP 362 commonspace > gbjd816 [PSH, ACK] Seq=50230 Ack=73199 Win=65535 Len=304
298725 100.688513  244.3.31.67 -> 244.3.41.84  TCP 78 commonspace > gbjd816 [PSH, ACK] Seq=50534 Ack=73543 Win=65535 Len=20
298774 100.714550  244.3.31.67 -> 244.3.41.84  TCP 73 commonspace > gbjd816 [PSH, ACK] Seq=50554 Ack=73556 Win=65535 Len=15
309950 105.783356  244.3.31.67 -> 244.3.41.84  TCP 193 commonspace > gbjd816 [PSH, ACK] Seq=50569 Ack=73739 Win=65535 Len=135
309989 105.795242  244.3.31.67 -> 244.3.41.84  TCP 1066 commonspace > gbjd816 [PSH, ACK] Seq=50704 Ack=74321 Win=65535 Len=1008
310017 105.808542  244.3.31.67 -> 244.3.41.84  TCP 248 commonspace > gbjd816 [PSH, ACK] Seq=51712 Ack=74518 Win=65535 Len=190
310028 105.814040  244.3.31.67 -> 244.3.41.84  TCP 362 commonspace > gbjd816 [PSH, ACK] Seq=51902 Ack=74682 Win=65535 Len=304
310093 105.846356  244.3.31.67 -> 244.3.41.84  TCP 78 commonspace > gbjd816 [PSH, ACK] Seq=52206 Ack=75026 Win=65535 Len=20
