44976  18.827132 244.3.185.235 -> 41.177.98.220 TCP 630 icon-discover > ups-onlinet [PSH, ACK] Seq=1 Ack=1 Win=65535 Len=572
45198  18.906263 244.3.185.235 -> 41.177.98.220 TCP 648 icon-discover > ups-onlinet [PSH, ACK] Seq=573 Ack=590 Win=64946 Len=590
45231  18.915079 244.3.185.235 -> 41.177.98.220 TCP 635 icon-discover > ups-onlinet [PSH, ACK] Seq=1163 Ack=670 Win=64866 Len=577
46154  19.305839 244.3.185.235 -> 41.177.98.220 TCP 64 icon-discover > ups-onlinet [ACK] Seq=1740 Ack=1310 Win=64226 Len=0
49059  19.955399 244.3.185.235 -> 41.177.98.220 TCP 695 icon-discover > ups-onlinet [PSH, ACK] Seq=1740 Ack=1310 Win=64226 Len=637
49931  20.267759 244.3.185.235 -> 41.177.98.220 TCP 64 icon-discover > ups-onlinet [ACK] Seq=2377 Ack=1999 Win=65535 Len=0
114022  40.627365 244.3.185.235 -> 41.177.98.220 TCP 624 icon-discover > ups-onlinet [PSH, ACK] Seq=2377 Ack=1999 Win=65535 Len=566
114151  40.697725 244.3.185.235 -> 41.177.98.220 TCP 642 icon-discover > ups-onlinet [PSH, ACK] Seq=2943 Ack=2582 Win=64952 Len=584
114167  40.705449 244.3.185.235 -> 41.177.98.220 TCP 629 icon-discover > ups-onlinet [PSH, ACK] Seq=3527 Ack=2662 Win=64872 Len=571
114640  40.978001 244.3.185.235 -> 41.177.98.220 TCP 64 icon-discover > ups-onlinet [ACK] Seq=4098 Ack=3408 Win=65535 Len=0
116229  41.475658 244.3.185.235 -> 41.177.98.220 TCP 689 icon-discover > ups-onlinet [PSH, ACK] Seq=4098 Ack=3408 Win=65535 Len=631
117496  42.143169 244.3.185.235 -> 41.177.98.220 TCP 64 icon-discover > ups-onlinet [ACK] Seq=4729 Ack=4159 Win=64784 Len=0
207966  71.291846 244.3.185.235 -> 41.177.98.220 TCP 671 icon-discover > ups-onlinet [PSH, ACK] Seq=4729 Ack=4159 Win=64784 Len=613
208041  71.363190 244.3.185.235 -> 41.177.98.220 TCP 689 icon-discover > ups-onlinet [PSH, ACK] Seq=5342 Ack=4789 Win=65535 Len=631
208046  71.371937 244.3.185.235 -> 41.177.98.220 TCP 676 icon-discover > ups-onlinet [PSH, ACK] Seq=5973 Ack=4869 Win=65455 Len=618
208670  71.728421 244.3.185.235 -> 41.177.98.220 TCP 64 icon-discover > ups-onlinet [ACK] Seq=6591 Ack=5498 Win=64826 Len=0
211501  72.844120 244.3.185.235 -> 41.177.98.220 TCP 736 icon-discover > ups-onlinet [PSH, ACK] Seq=6591 Ack=5498 Win=64826 Len=678
219189  74.862253 244.3.185.235 -> 41.177.98.220 TCP 64 icon-discover > ups-onlinet [ACK] Seq=7269 Ack=6356 Win=65535 Len=0
264095  91.940167 244.3.185.235 -> 41.177.98.220 TCP 703 icon-discover > ups-onlinet [PSH, ACK] Seq=7269 Ack=6356 Win=65535 Len=645
266465  92.025972 244.3.185.235 -> 41.177.98.220 TCP 721 icon-discover > ups-onlinet [PSH, ACK] Seq=7914 Ack=7018 Win=64873 Len=663
266783  92.033984 244.3.185.235 -> 41.177.98.220 TCP 708 icon-discover > ups-onlinet [PSH, ACK] Seq=8577 Ack=7098 Win=64793 Len=650
274230  92.416210 244.3.185.235 -> 41.177.98.220 TCP 64 icon-discover > ups-onlinet [ACK] Seq=9227 Ack=7944 Win=65535 Len=0
275644  92.844438 244.3.185.235 -> 41.177.98.220 TCP 768 icon-discover > ups-onlinet [PSH, ACK] Seq=9227 Ack=7944 Win=65535 Len=710
277623  93.698447 244.3.185.235 -> 41.177.98.220 TCP 64 icon-discover > ups-onlinet [ACK] Seq=9937 Ack=8720 Win=64759 Len=0
329194 114.596430 244.3.185.235 -> 41.177.98.220 TCP 662 icon-discover > ups-onlinet [PSH, ACK] Seq=9937 Ack=8720 Win=64759 Len=604
329334 114.676980 244.3.185.235 -> 41.177.98.220 TCP 680 icon-discover > ups-onlinet [PSH, ACK] Seq=10541 Ack=9341 Win=65535 Len=622
329358 114.685274 244.3.185.235 -> 41.177.98.220 TCP 667 icon-discover > ups-onlinet [PSH, ACK] Seq=11163 Ack=9421 Win=65455 Len=609
330518 115.057136 244.3.185.235 -> 41.177.98.220 TCP 64 icon-discover > ups-onlinet [ACK] Seq=11772 Ack=10141 Win=64735 Len=0
331511 115.580758 244.3.185.235 -> 41.177.98.220 TCP 727 icon-discover > ups-onlinet [PSH, ACK] Seq=11772 Ack=10141 Win=64735 Len=669
334276 116.878454 244.3.185.235 -> 41.177.98.220 TCP 64 icon-discover > ups-onlinet [ACK] Seq=12441 Ack=10882 Win=65535 Len=0
435059 141.909050 244.3.185.235 -> 41.177.98.220 TCP 1005 icon-discover > ups-onlinet [PSH, ACK] Seq=12441 Ack=10882 Win=65535 Len=947
435350 142.005673 244.3.185.235 -> 41.177.98.220 TCP 1023 icon-discover > ups-onlinet [PSH, ACK] Seq=13388 Ack=11846 Win=64571 Len=965
435444 142.015098 244.3.185.235 -> 41.177.98.220 TCP 1010 icon-discover > ups-onlinet [PSH, ACK] Seq=14353 Ack=11926 Win=64491 Len=952
436906 142.416890 244.3.185.235 -> 41.177.98.220 TCP 64 icon-discover > ups-onlinet [ACK] Seq=15305 Ack=13027 Win=65535 Len=0
439278 143.069477 244.3.185.235 -> 41.177.98.220 TCP 1070 icon-discover > ups-onlinet [PSH, ACK] Seq=15305 Ack=13027 Win=65535 Len=1012
440285 143.410093 244.3.185.235 -> 41.177.98.220 TCP 64 icon-discover > ups-onlinet [ACK] Seq=16317 Ack=14526 Win=65535 Len=0
521869 169.173193 244.3.185.235 -> 41.177.98.220 TCP 694 icon-discover > ups-onlinet [PSH, ACK] Seq=16317 Ack=14526 Win=65535 Len=636
522206 169.251446 244.3.185.235 -> 41.177.98.220 TCP 712 icon-discover > ups-onlinet [PSH, ACK] Seq=16953 Ack=15179 Win=64882 Len=654
522217 169.259562 244.3.185.235 -> 41.177.98.220 TCP 699 icon-discover > ups-onlinet [PSH, ACK] Seq=17607 Ack=15259 Win=64802 Len=641
527443 171.401688 244.3.185.235 -> 41.177.98.220 TCP 64 icon-discover > ups-onlinet [ACK] Seq=18248 Ack=16008 Win=65535 Len=0
529364 171.997529 244.3.185.235 -> 41.177.98.220 TCP 759 icon-discover > ups-onlinet [PSH, ACK] Seq=18248 Ack=16008 Win=65535 Len=701
531890 172.473015 244.3.185.235 -> 41.177.98.220 TCP 64 icon-discover > ups-onlinet [ACK] Seq=18949 Ack=16821 Win=64722 Len=0
611012 193.949586 244.3.185.235 -> 41.177.98.220 TCP 741 icon-discover > ups-onlinet [PSH, ACK] Seq=18949 Ack=16821 Win=64722 Len=683
611420 194.033072 244.3.185.235 -> 41.177.98.220 TCP 759 icon-discover > ups-onlinet [PSH, ACK] Seq=19632 Ack=17521 Win=65535 Len=701
611464 194.042009 244.3.185.235 -> 41.177.98.220 TCP 746 icon-discover > ups-onlinet [PSH, ACK] Seq=20333 Ack=17601 Win=65455 Len=688
620984 197.448932 244.3.185.235 -> 41.177.98.220 TCP 64 icon-discover > ups-onlinet [ACK] Seq=21021 Ack=18520 Win=64536 Len=0
624271 198.165904 244.3.185.235 -> 41.177.98.220 TCP 806 icon-discover > ups-onlinet [PSH, ACK] Seq=21021 Ack=18520 Win=64536 Len=748
625694 198.629579 244.3.185.235 -> 41.177.98.220 TCP 64 icon-discover > ups-onlinet [ACK] Seq=21769 Ack=19376 Win=65535 Len=0
700685 222.469771 244.3.185.235 -> 41.177.98.220 TCP 571 icon-discover > ups-onlinet [PSH, ACK] Seq=21769 Ack=19376 Win=65535 Len=513
700853 222.529026 244.3.185.235 -> 41.177.98.220 TCP 589 icon-discover > ups-onlinet [PSH, ACK] Seq=22282 Ack=19906 Win=65005 Len=531
700872 222.538051 244.3.185.235 -> 41.177.98.220 TCP 576 icon-discover > ups-onlinet [PSH, ACK] Seq=22813 Ack=19986 Win=64925 Len=518
701416 222.839981 244.3.185.235 -> 41.177.98.220 TCP 64 icon-discover > ups-onlinet [ACK] Seq=23331 Ack=20500 Win=64411 Len=0
702640 223.398058 244.3.185.235 -> 41.177.98.220 TCP 636 icon-discover > ups-onlinet [PSH, ACK] Seq=23331 Ack=20500 Win=64411 Len=578
703276 223.684613 244.3.185.235 -> 41.177.98.220 TCP 64 icon-discover > ups-onlinet [ACK] Seq=23909 Ack=21160 Win=65535 Len=0
758649 244.246057 244.3.185.235 -> 41.177.98.220 TCP 604 icon-discover > ups-onlinet [PSH, ACK] Seq=23909 Ack=21160 Win=65535 Len=546
758797 244.312380 244.3.185.235 -> 41.177.98.220 TCP 622 icon-discover > ups-onlinet [PSH, ACK] Seq=24455 Ack=21723 Win=64972 Len=564
758830 244.320706 244.3.185.235 -> 41.177.98.220 TCP 609 icon-discover > ups-onlinet [PSH, ACK] Seq=25019 Ack=21803 Win=64892 Len=551
759347 244.715169 244.3.185.235 -> 41.177.98.220 TCP 64 icon-discover > ups-onlinet [ACK] Seq=25570 Ack=22516 Win=64179 Len=0
760960 245.454375 244.3.185.235 -> 41.177.98.220 TCP 669 icon-discover > ups-onlinet [PSH, ACK] Seq=25570 Ack=22516 Win=64179 Len=611
762095 245.888039 244.3.185.235 -> 41.177.98.220 TCP 64 icon-discover > ups-onlinet [ACK] Seq=26181 Ack=23237 Win=65535 Len=0
815340 265.806463 244.3.185.235 -> 41.177.98.220 TCP 697 icon-discover > ups-onlinet [PSH, ACK] Seq=26181 Ack=23237 Win=65535 Len=639
815581 265.882253 244.3.185.235 -> 41.177.98.220 TCP 715 icon-discover > ups-onlinet [PSH, ACK] Seq=26820 Ack=23893 Win=64879 Len=657
815642 265.908082 244.3.185.235 -> 41.177.98.220 TCP 702 icon-discover > ups-onlinet [PSH, ACK] Seq=27477 Ack=23973 Win=64799 Len=644
816187 266.168586 244.3.185.235 -> 41.177.98.220 TCP 64 icon-discover > ups-onlinet [ACK] Seq=28121 Ack=24724 Win=65535 Len=0
817628 266.774769 244.3.185.235 -> 41.177.98.220 TCP 762 icon-discover > ups-onlinet [PSH, ACK] Seq=28121 Ack=24724 Win=65535 Len=704
819000 267.239889 244.3.185.235 -> 41.177.98.220 TCP 64 icon-discover > ups-onlinet [ACK] Seq=28825 Ack=25608 Win=64651 Len=0
865466 286.086893 244.3.185.235 -> 41.177.98.220 TCP 843 icon-discover > ups-onlinet [PSH, ACK] Seq=28825 Ack=25608 Win=64651 Len=785
865725 286.190682 244.3.185.235 -> 41.177.98.220 TCP 861 icon-discover > ups-onlinet [PSH, ACK] Seq=29610 Ack=26410 Win=65535 Len=803
865751 286.199520 244.3.185.235 -> 41.177.98.220 TCP 848 icon-discover > ups-onlinet [PSH, ACK] Seq=30413 Ack=26490 Win=65455 Len=790
866231 286.395243 244.3.185.235 -> 41.177.98.220 TCP 64 icon-discover > ups-onlinet [ACK] Seq=31203 Ack=28076 Win=65535 Len=0
869146 287.303212 244.3.185.235 -> 41.177.98.220 TCP 908 icon-discover > ups-onlinet [PSH, ACK] Seq=31203 Ack=28076 Win=65535 Len=850
870464 287.912054 244.3.185.235 -> 41.177.98.220 TCP 64 icon-discover > ups-onlinet [ACK] Seq=32053 Ack=29108 Win=64503 Len=0
916237 304.135172 244.3.185.235 -> 41.177.98.220 TCP 869 icon-discover > ups-onlinet [PSH, ACK] Seq=32053 Ack=29108 Win=64503 Len=811
916382 304.254461 244.3.185.235 -> 41.177.98.220 TCP 887 icon-discover > ups-onlinet [PSH, ACK] Seq=32864 Ack=29936 Win=65535 Len=829
916397 304.263822 244.3.185.235 -> 41.177.98.220 TCP 874 icon-discover > ups-onlinet [PSH, ACK] Seq=33693 Ack=30016 Win=65455 Len=816
918036 304.684756 244.3.185.235 -> 41.177.98.220 TCP 64 icon-discover > ups-onlinet [ACK] Seq=34509 Ack=31324 Win=65535 Len=0
920455 305.095438 244.3.185.235 -> 41.177.98.220 TCP 934 icon-discover > ups-onlinet [PSH, ACK] Seq=34509 Ack=31324 Win=65535 Len=876
922397 306.193563 244.3.185.235 -> 41.177.98.220 TCP 64 icon-discover > ups-onlinet [ACK] Seq=35385 Ack=32440 Win=64419 Len=0
996706 332.871431 244.3.185.235 -> 41.177.98.220 TCP 742 icon-discover > ups-onlinet [PSH, ACK] Seq=35385 Ack=32440 Win=64419 Len=684
996877 332.966545 244.3.185.235 -> 41.177.98.220 TCP 760 icon-discover > ups-onlinet [PSH, ACK] Seq=36069 Ack=33141 Win=65535 Len=702
996902 332.975524 244.3.185.235 -> 41.177.98.220 TCP 747 icon-discover > ups-onlinet [PSH, ACK] Seq=36771 Ack=33221 Win=65455 Len=689
997694 333.466393 244.3.185.235 -> 41.177.98.220 TCP 64 icon-discover > ups-onlinet [ACK] Seq=37460 Ack=34280 Win=64396 Len=0
999038 334.087706 244.3.185.235 -> 41.177.98.220 TCP 807 icon-discover > ups-onlinet [PSH, ACK] Seq=37460 Ack=34280 Win=64396 Len=749
1000047 334.529885 244.3.185.235 -> 41.177.98.220 TCP 64 icon-discover > ups-onlinet [ACK] Seq=38209 Ack=35217 Win=65535 Len=0
