566011 180.991191  244.3.77.47 -> 41.177.3.224 TCP 66 client-ctrl > 9831 [SYN] Seq=0 Win=65535 Len=0 MSS=1260 SACK_PERM=1
566013 180.992172  244.3.77.47 -> 41.177.3.224 TCP 64 client-ctrl > 9831 [ACK] Seq=1 Ack=1 Win=65535 Len=0
566014 180.992383  244.3.77.47 -> 41.177.3.224 TCP 90 client-ctrl > 9831 [PSH, ACK] Seq=1 Ack=1 Win=65535 Len=32
566025 180.993765  244.3.77.47 -> 41.177.3.224 TCP 64 client-ctrl > 9831 [FIN, ACK] Seq=33 Ack=397 Win=65139 Len=0
566032 180.994580  244.3.77.47 -> 41.177.3.224 TCP 64 client-ctrl > 9831 [ACK] Seq=34 Ack=398 Win=65139 Len=0
566040 180.994971  244.3.77.47 -> 41.177.3.224 TCP 66 smap > 9834 [SYN] Seq=0 Win=65535 Len=0 MSS=1260 SACK_PERM=1
566060 180.995938  244.3.77.47 -> 41.177.3.224 TCP 64 smap > 9834 [ACK] Seq=1 Ack=1 Win=65535 Len=0
566066 180.996857  244.3.77.47 -> 41.177.3.224 TCP 274 smap > 9834 [PSH, ACK] Seq=1 Ack=1 Win=65535 Len=216
566074 180.998282  244.3.77.47 -> 41.177.3.224 TCP 362 smap > 9834 [PSH, ACK] Seq=217 Ack=273 Win=65263 Len=304
566080 180.999652  244.3.77.47 -> 41.177.3.224 TCP 262 smap > 9834 [PSH, ACK] Seq=521 Ack=449 Win=65087 Len=204
566086 181.001662  244.3.77.47 -> 41.177.3.224 TCP 894 smap > 9834 [PSH, ACK] Seq=725 Ack=637 Win=64899 Len=836
566152 181.016260  244.3.77.47 -> 41.177.3.224 TCP 64 smap > 9834 [ACK] Seq=1561 Ack=3157 Win=65535 Len=0
566153 181.016400  244.3.77.47 -> 41.177.3.224 TCP 64 smap > 9834 [ACK] Seq=1561 Ack=5677 Win=65535 Len=0
566154 181.016786  244.3.77.47 -> 41.177.3.224 TCP 64 smap > 9834 [ACK] Seq=1561 Ack=8197 Win=65535 Len=0
566164 181.017917  244.3.77.47 -> 41.177.3.224 TCP 64 smap > 9834 [ACK] Seq=1561 Ack=10717 Win=65535 Len=0
566165 181.018623  244.3.77.47 -> 41.177.3.224 TCP 64 smap > 9834 [ACK] Seq=1561 Ack=13237 Win=65535 Len=0
566166 181.018734  244.3.77.47 -> 41.177.3.224 TCP 64 smap > 9834 [ACK] Seq=1561 Ack=15757 Win=65535 Len=0
566167 181.019333  244.3.77.47 -> 41.177.3.224 TCP 64 smap > 9834 [ACK] Seq=1561 Ack=18277 Win=65535 Len=0
566168 181.019443  244.3.77.47 -> 41.177.3.224 TCP 64 smap > 9834 [ACK] Seq=1561 Ack=20797 Win=65535 Len=0
566186 181.020875  244.3.77.47 -> 41.177.3.224 TCP 64 smap > 9834 [ACK] Seq=1561 Ack=23317 Win=65535 Len=0
566190 181.021394  244.3.77.47 -> 41.177.3.224 TCP 64 smap > 9834 [ACK] Seq=1561 Ack=25837 Win=65535 Len=0
566192 181.021505  244.3.77.47 -> 41.177.3.224 TCP 64 smap > 9834 [ACK] Seq=1561 Ack=28357 Win=65535 Len=0
566196 181.022005  244.3.77.47 -> 41.177.3.224 TCP 64 smap > 9834 [ACK] Seq=1561 Ack=29617 Win=65535 Len=0
566197 181.022081  244.3.77.47 -> 41.177.3.224 TCP 64 [TCP Dup ACK 566196#1] smap > 9834 [ACK] Seq=1561 Ack=29617 Win=65535 Len=0
566199 181.022174  244.3.77.47 -> 41.177.3.224 TCP 64 smap > 9834 [ACK] Seq=1561 Ack=33397 Win=65535 Len=0
566204 181.022261  244.3.77.47 -> 41.177.3.224 TCP 64 [TCP Dup ACK 566199#1] smap > 9834 [ACK] Seq=1561 Ack=33397 Win=65535 Len=0
566205 181.022318  244.3.77.47 -> 41.177.3.224 TCP 64 smap > 9834 [ACK] Seq=1561 Ack=35917 Win=65535 Len=0
566211 181.022679  244.3.77.47 -> 41.177.3.224 TCP 64 smap > 9834 [ACK] Seq=1561 Ack=38437 Win=65535 Len=0
566212 181.022742  244.3.77.47 -> 41.177.3.224 TCP 64 [TCP Dup ACK 566211#1] smap > 9834 [ACK] Seq=1561 Ack=38437 Win=65535 Len=0
566213 181.022834  244.3.77.47 -> 41.177.3.224 TCP 64 smap > 9834 [ACK] Seq=1561 Ack=40125 Win=65535 Len=0
572065 182.554389  244.3.77.47 -> 41.177.3.224 TCP 894 smap > 9834 [PSH, ACK] Seq=1561 Ack=40125 Win=65535 Len=836
572177 182.566084  244.3.77.47 -> 41.177.3.224 TCP 64 smap > 9834 [ACK] Seq=2397 Ack=42645 Win=65535 Len=0
572178 182.566545  244.3.77.47 -> 41.177.3.224 TCP 64 smap > 9834 [ACK] Seq=2397 Ack=45165 Win=65535 Len=0
572179 182.566653  244.3.77.47 -> 41.177.3.224 TCP 64 smap > 9834 [ACK] Seq=2397 Ack=47685 Win=65535 Len=0
572180 182.567148  244.3.77.47 -> 41.177.3.224 TCP 64 smap > 9834 [ACK] Seq=2397 Ack=50205 Win=65535 Len=0
572181 182.567211  244.3.77.47 -> 41.177.3.224 TCP 64 [TCP Dup ACK 572180#1] smap > 9834 [ACK] Seq=2397 Ack=50205 Win=65535 Len=0
572182 182.567285  244.3.77.47 -> 41.177.3.224 TCP 64 smap > 9834 [ACK] Seq=2397 Ack=52725 Win=65535 Len=0
572183 182.567353  244.3.77.47 -> 41.177.3.224 TCP 64 [TCP Dup ACK 572182#1] smap > 9834 [ACK] Seq=2397 Ack=52725 Win=65535 Len=0
572184 182.567413  244.3.77.47 -> 41.177.3.224 TCP 64 [TCP Dup ACK 572182#2] smap > 9834 [ACK] Seq=2397 Ack=52725 Win=65535 Len=0
572185 182.567501  244.3.77.47 -> 41.177.3.224 TCP 64 smap > 9834 [ACK] Seq=2397 Ack=56505 Win=65535 Len=0
572186 182.567824  244.3.77.47 -> 41.177.3.224 TCP 64 smap > 9834 [ACK] Seq=2397 Ack=59025 Win=65535 Len=0
572187 182.567878  244.3.77.47 -> 41.177.3.224 TCP 64 [TCP Dup ACK 572186#1] smap > 9834 [ACK] Seq=2397 Ack=59025 Win=65535 Len=0
572188 182.567951  244.3.77.47 -> 41.177.3.224 TCP 64 [TCP Dup ACK 572186#2] smap > 9834 [ACK] Seq=2397 Ack=59025 Win=65535 Len=0
572189 182.568024  244.3.77.47 -> 41.177.3.224 TCP 64 smap > 9834 [ACK] Seq=2397 Ack=61545 Win=65535 Len=0
572190 182.568077  244.3.77.47 -> 41.177.3.224 TCP 64 [TCP Dup ACK 572189#1] smap > 9834 [ACK] Seq=2397 Ack=61545 Win=65535 Len=0
572191 182.568141  244.3.77.47 -> 41.177.3.224 TCP 64 [TCP Dup ACK 572189#2] smap > 9834 [ACK] Seq=2397 Ack=61545 Win=65535 Len=0
572192 182.568511  244.3.77.47 -> 41.177.3.224 TCP 64 [TCP Dup ACK 572189#3] smap > 9834 [ACK] Seq=2397 Ack=61545 Win=65535 Len=0
572193 182.568595  244.3.77.47 -> 41.177.3.224 TCP 64 smap > 9834 [ACK] Seq=2397 Ack=67845 Win=65535 Len=0
572210 182.569868  244.3.77.47 -> 41.177.3.224 TCP 64 smap > 9834 [ACK] Seq=2397 Ack=69105 Win=65535 Len=0
572211 182.569938  244.3.77.47 -> 41.177.3.224 TCP 64 [TCP Dup ACK 572210#1] smap > 9834 [ACK] Seq=2397 Ack=69105 Win=65535 Len=0
572216 182.570648  244.3.77.47 -> 41.177.3.224 TCP 64 smap > 9834 [ACK] Seq=2397 Ack=71625 Win=65535 Len=0
572217 182.570760  244.3.77.47 -> 41.177.3.224 TCP 64 smap > 9834 [ACK] Seq=2397 Ack=74145 Win=65535 Len=0
572218 182.570862  244.3.77.47 -> 41.177.3.224 TCP 64 smap > 9834 [ACK] Seq=2397 Ack=76665 Win=65535 Len=0
572219 182.571003  244.3.77.47 -> 41.177.3.224 TCP 64 smap > 9834 [ACK] Seq=2397 Ack=79185 Win=65535 Len=0
573264 182.718260  244.3.77.47 -> 41.177.3.224 TCP 64 smap > 9834 [ACK] Seq=2397 Ack=79613 Win=65107 Len=0
602179 190.987096  244.3.77.47 -> 41.177.3.224 TCP 1078 smap > 9834 [PSH, ACK] Seq=2397 Ack=79613 Win=65107 Len=1020
602589 191.167740  244.3.77.47 -> 41.177.3.224 TCP 64 smap > 9834 [ACK] Seq=3417 Ack=79921 Win=64799 Len=0
639517 201.848593  244.3.77.47 -> 41.177.3.224 TCP 1074 smap > 9834 [PSH, ACK] Seq=3417 Ack=79921 Win=64799 Len=1016
640080 202.031054  244.3.77.47 -> 41.177.3.224 TCP 64 smap > 9834 [ACK] Seq=4433 Ack=80169 Win=64551 Len=0
727240 233.178168  244.3.77.47 -> 41.177.3.224 TCP 1070 smap > 9834 [PSH, ACK] Seq=4433 Ack=80169 Win=64551 Len=1012
727273 233.191096  244.3.77.47 -> 41.177.3.224 TCP 64 smap > 9834 [ACK] Seq=5445 Ack=82689 Win=65535 Len=0
727493 233.313370  244.3.77.47 -> 41.177.3.224 TCP 64 smap > 9834 [ACK] Seq=5445 Ack=83089 Win=65135 Len=0
1019288 343.820274  244.3.77.47 -> 41.177.3.224 TCP 894 smap > 9834 [PSH, ACK] Seq=5445 Ack=83089 Win=65135 Len=836
1019403 343.835701  244.3.77.47 -> 41.177.3.224 TCP 64 smap > 9834 [ACK] Seq=6281 Ack=85609 Win=65535 Len=0
1019404 343.835851  244.3.77.47 -> 41.177.3.224 TCP 64 smap > 9834 [ACK] Seq=6281 Ack=88129 Win=65535 Len=0
1019405 343.836059  244.3.77.47 -> 41.177.3.224 TCP 64 smap > 9834 [ACK] Seq=6281 Ack=90649 Win=65535 Len=0
1019406 343.836160  244.3.77.47 -> 41.177.3.224 TCP 64 smap > 9834 [ACK] Seq=6281 Ack=91909 Win=65535 Len=0
1019408 343.836234  244.3.77.47 -> 41.177.3.224 TCP 64 [TCP Dup ACK 1019406#1] smap > 9834 [ACK] Seq=6281 Ack=91909 Win=65535 Len=0
1019409 343.836704  244.3.77.47 -> 41.177.3.224 TCP 64 [TCP Dup ACK 1019406#2] smap > 9834 [ACK] Seq=6281 Ack=91909 Win=65535 Len=0
1019410 343.836763  244.3.77.47 -> 41.177.3.224 TCP 64 smap > 9834 [ACK] Seq=6281 Ack=96949 Win=65535 Len=0
1019411 343.836830  244.3.77.47 -> 41.177.3.224 TCP 64 [TCP Dup ACK 1019410#1] smap > 9834 [ACK] Seq=6281 Ack=96949 Win=65535 Len=0
1019412 343.836894  244.3.77.47 -> 41.177.3.224 TCP 64 [TCP Dup ACK 1019410#2] smap > 9834 [ACK] Seq=6281 Ack=96949 Win=65535 Len=0
1019413 343.836954  244.3.77.47 -> 41.177.3.224 TCP 64 [TCP Dup ACK 1019410#3] smap > 9834 [ACK] Seq=6281 Ack=96949 Win=65535 Len=0
1019414 343.837024  244.3.77.47 -> 41.177.3.224 TCP 64 [TCP Dup ACK 1019410#4] smap > 9834 [ACK] Seq=6281 Ack=96949 Win=65535 Len=0
1019416 343.837232  244.3.77.47 -> 41.177.3.224 TCP 64 smap > 9834 [ACK] Seq=6281 Ack=103249 Win=65535 Len=0
1019426 343.838282  244.3.77.47 -> 41.177.3.224 TCP 64 [TCP Dup ACK 1019416#1] smap > 9834 [ACK] Seq=6281 Ack=103249 Win=65535 Len=0
1019428 343.838685  244.3.77.47 -> 41.177.3.224 TCP 64 smap > 9834 [ACK] Seq=6281 Ack=105769 Win=65535 Len=0
1019429 343.838929  244.3.77.47 -> 41.177.3.224 TCP 64 smap > 9834 [ACK] Seq=6281 Ack=108289 Win=65535 Len=0
1019430 343.839035  244.3.77.47 -> 41.177.3.224 TCP 64 smap > 9834 [ACK] Seq=6281 Ack=110809 Win=65535 Len=0
1019431 343.839278  244.3.77.47 -> 41.177.3.224 TCP 64 smap > 9834 [ACK] Seq=6281 Ack=113329 Win=65535 Len=0
1019432 343.839627  244.3.77.47 -> 41.177.3.224 TCP 64 smap > 9834 [ACK] Seq=6281 Ack=115849 Win=65535 Len=0
1019439 343.841013  244.3.77.47 -> 41.177.3.224 TCP 64 smap > 9834 [ACK] Seq=6281 Ack=118369 Win=65535 Len=0
1019440 343.841384  244.3.77.47 -> 41.177.3.224 TCP 64 smap > 9834 [ACK] Seq=6281 Ack=120889 Win=65535 Len=0
1019441 343.841449  244.3.77.47 -> 41.177.3.224 TCP 64 [TCP Dup ACK 1019440#1] smap > 9834 [ACK] Seq=6281 Ack=120889 Win=65535 Len=0
1019442 343.841540  244.3.77.47 -> 41.177.3.224 TCP 64 smap > 9834 [ACK] Seq=6281 Ack=122577 Win=65535 Len=0
