6077   1.909619 244.3.142.57 -> 41.177.98.220 TCP 1236 idmaps > ups-onlinet [PSH, ACK] Seq=1 Ack=1 Win=65535 Len=1178
6434   2.062718 244.3.142.57 -> 41.177.98.220 TCP 64 idmaps > ups-onlinet [ACK] Seq=1179 Ack=1196 Win=64340 Len=0
6473   2.112127 244.3.142.57 -> 41.177.98.220 TCP 1254 idmaps > ups-onlinet [PSH, ACK] Seq=1179 Ack=1196 Win=64340 Len=1196
6485   2.123185 244.3.142.57 -> 41.177.98.220 TCP 1295 idmaps > ups-onlinet [PSH, ACK] Seq=2375 Ack=1276 Win=64260 Len=1237
8162   2.873223 244.3.142.57 -> 41.177.98.220 TCP 64 idmaps > ups-onlinet [ACK] Seq=3612 Ack=2717 Win=65535 Len=0
54195  22.450726 244.3.142.57 -> 41.177.98.220 TCP 1292 idmaps > ups-onlinet [PSH, ACK] Seq=3612 Ack=2717 Win=65535 Len=1234
54514  22.581936 244.3.142.57 -> 41.177.98.220 TCP 64 idmaps > ups-onlinet [ACK] Seq=4846 Ack=3968 Win=64284 Len=0
54650  22.640736 244.3.142.57 -> 41.177.98.220 TCP 1310 idmaps > ups-onlinet [PSH, ACK] Seq=4846 Ack=3968 Win=64284 Len=1252
54678  22.652132 244.3.142.57 -> 41.177.98.220 TCP 1349 idmaps > ups-onlinet [PSH, ACK] Seq=6098 Ack=4048 Win=64204 Len=1291
56231  23.086795 244.3.142.57 -> 41.177.98.220 TCP 64 idmaps > ups-onlinet [ACK] Seq=7389 Ack=5501 Win=65535 Len=0
108005  38.817924 244.3.142.57 -> 41.177.98.220 TCP 866 idmaps > ups-onlinet [PSH, ACK] Seq=7389 Ack=5501 Win=65535 Len=808
108320  38.974350 244.3.142.57 -> 41.177.98.220 TCP 884 idmaps > ups-onlinet [PSH, ACK] Seq=8197 Ack=6326 Win=64710 Len=826
108355  38.986234 244.3.142.57 -> 41.177.98.220 TCP 920 idmaps > ups-onlinet [PSH, ACK] Seq=9023 Ack=6406 Win=64630 Len=862
109914  39.379522 244.3.142.57 -> 41.177.98.220 TCP 64 idmaps > ups-onlinet [ACK] Seq=9885 Ack=7371 Win=65535 Len=0
212018  72.957774 244.3.142.57 -> 41.177.98.220 TCP 1056 idmaps > ups-onlinet [PSH, ACK] Seq=9885 Ack=7371 Win=65535 Len=998
212608  73.075332 244.3.142.57 -> 41.177.98.220 TCP 64 idmaps > ups-onlinet [ACK] Seq=10883 Ack=8386 Win=64520 Len=0
213111  73.157246 244.3.142.57 -> 41.177.98.220 TCP 1074 idmaps > ups-onlinet [PSH, ACK] Seq=10883 Ack=8386 Win=64520 Len=1016
213184  73.168962 244.3.142.57 -> 41.177.98.220 TCP 1114 idmaps > ups-onlinet [PSH, ACK] Seq=11899 Ack=8466 Win=64440 Len=1056
214448  73.578230 244.3.142.57 -> 41.177.98.220 TCP 64 idmaps > ups-onlinet [ACK] Seq=12955 Ack=9599 Win=65535 Len=0
255407  90.696681 244.3.142.57 -> 41.177.98.220 TCP 1026 idmaps > ups-onlinet [PSH, ACK] Seq=12955 Ack=9599 Win=65535 Len=968
255800  90.872197 244.3.142.57 -> 41.177.98.220 TCP 1044 idmaps > ups-onlinet [PSH, ACK] Seq=13923 Ack=10584 Win=64550 Len=986
255806  90.883587 244.3.142.57 -> 41.177.98.220 TCP 1085 idmaps > ups-onlinet [PSH, ACK] Seq=14909 Ack=10664 Win=64470 Len=1027
257137  91.482282 244.3.142.57 -> 41.177.98.220 TCP 64 idmaps > ups-onlinet [ACK] Seq=15936 Ack=11749 Win=65535 Len=0
466328 153.519399 244.3.142.57 -> 41.177.98.220 TCP 1061 idmaps > ups-onlinet [PSH, ACK] Seq=15936 Ack=11749 Win=65535 Len=1003
466617 153.643618 244.3.142.57 -> 41.177.98.220 TCP 64 idmaps > ups-onlinet [ACK] Seq=16939 Ack=12769 Win=64515 Len=0
466706 153.707284 244.3.142.57 -> 41.177.98.220 TCP 1079 idmaps > ups-onlinet [PSH, ACK] Seq=16939 Ack=12769 Win=64515 Len=1021
466724 153.720514 244.3.142.57 -> 41.177.98.220 TCP 1120 idmaps > ups-onlinet [PSH, ACK] Seq=17960 Ack=12849 Win=64435 Len=1062
467448 154.052615 244.3.142.57 -> 41.177.98.220 TCP 64 idmaps > ups-onlinet [ACK] Seq=19022 Ack=13975 Win=65535 Len=0
549375 177.007965 244.3.142.57 -> 41.177.98.220 TCP 903 idmaps > ups-onlinet [PSH, ACK] Seq=19022 Ack=13975 Win=65535 Len=845
550242 177.170206 244.3.142.57 -> 41.177.98.220 TCP 921 idmaps > ups-onlinet [PSH, ACK] Seq=19867 Ack=14837 Win=64673 Len=863
550304 177.181674 244.3.142.57 -> 41.177.98.220 TCP 961 idmaps > ups-onlinet [PSH, ACK] Seq=20730 Ack=14917 Win=64593 Len=903
552618 177.784686 244.3.142.57 -> 41.177.98.220 TCP 64 idmaps > ups-onlinet [ACK] Seq=21633 Ack=15991 Win=65535 Len=0
586806 186.930072 244.3.142.57 -> 41.177.98.220 TCP 880 idmaps > ups-onlinet [PSH, ACK] Seq=21633 Ack=15991 Win=65535 Len=822
587273 187.039436 244.3.142.57 -> 41.177.98.220 TCP 64 idmaps > ups-onlinet [ACK] Seq=22455 Ack=16830 Win=64696 Len=0
587393 187.075479 244.3.142.57 -> 41.177.98.220 TCP 898 idmaps > ups-onlinet [PSH, ACK] Seq=22455 Ack=16830 Win=64696 Len=840
587404 187.085843 244.3.142.57 -> 41.177.98.220 TCP 939 idmaps > ups-onlinet [PSH, ACK] Seq=23295 Ack=16910 Win=64616 Len=881
588465 187.443724 244.3.142.57 -> 41.177.98.220 TCP 64 idmaps > ups-onlinet [ACK] Seq=24176 Ack=17935 Win=65535 Len=0
905482 298.501230 244.3.142.57 -> 41.177.98.220 TCP 142 idmaps > ups-onlinet [PSH, ACK] Seq=24176 Ack=17935 Win=65535 Len=84
906282 298.769859 244.3.142.57 -> 41.177.98.220 TCP 64 idmaps > ups-onlinet [ACK] Seq=24260 Ack=20855 Win=65535 Len=0
906463 298.818170 244.3.142.57 -> 41.177.98.220 TCP 129 idmaps > ups-onlinet [PSH, ACK] Seq=24260 Ack=21801 Win=64589 Len=71
906489 298.820285 244.3.142.57 -> 41.177.98.220 TCP 64 idmaps > ups-onlinet [ACK] Seq=24331 Ack=24721 Win=65535 Len=0
906508 298.825913 244.3.142.57 -> 41.177.98.220 TCP 130 idmaps > ups-onlinet [PSH, ACK] Seq=24331 Ack=25666 Win=64590 Len=72
906530 298.827652 244.3.142.57 -> 41.177.98.220 TCP 64 idmaps > ups-onlinet [ACK] Seq=24403 Ack=28586 Win=65535 Len=0
906554 298.832798 244.3.142.57 -> 41.177.98.220 TCP 130 idmaps > ups-onlinet [PSH, ACK] Seq=24403 Ack=29574 Win=64547 Len=72
906558 298.834577 244.3.142.57 -> 41.177.98.220 TCP 64 idmaps > ups-onlinet [ACK] Seq=24475 Ack=32494 Win=65535 Len=0
906566 298.839839 244.3.142.57 -> 41.177.98.220 TCP 130 idmaps > ups-onlinet [PSH, ACK] Seq=24475 Ack=33536 Win=64493 Len=72
906570 298.841496 244.3.142.57 -> 41.177.98.220 TCP 64 idmaps > ups-onlinet [ACK] Seq=24547 Ack=36456 Win=65535 Len=0
906577 298.846352 244.3.142.57 -> 41.177.98.220 TCP 130 idmaps > ups-onlinet [PSH, ACK] Seq=24547 Ack=37463 Win=64528 Len=72
906583 298.848171 244.3.142.57 -> 41.177.98.220 TCP 64 idmaps > ups-onlinet [ACK] Seq=24619 Ack=40383 Win=65535 Len=0
906599 298.852946 244.3.142.57 -> 41.177.98.220 TCP 130 idmaps > ups-onlinet [PSH, ACK] Seq=24619 Ack=41448 Win=64470 Len=72
906604 298.855097 244.3.142.57 -> 41.177.98.220 TCP 64 idmaps > ups-onlinet [ACK] Seq=24691 Ack=44368 Win=65535 Len=0
906619 298.859746 244.3.142.57 -> 41.177.98.220 TCP 130 idmaps > ups-onlinet [PSH, ACK] Seq=24691 Ack=45347 Win=64556 Len=72
906653 298.861567 244.3.142.57 -> 41.177.98.220 TCP 64 idmaps > ups-onlinet [ACK] Seq=24763 Ack=48267 Win=65535 Len=0
906671 298.866798 244.3.142.57 -> 41.177.98.220 TCP 130 idmaps > ups-onlinet [PSH, ACK] Seq=24763 Ack=49379 Win=64423 Len=72
906684 298.868434 244.3.142.57 -> 41.177.98.220 TCP 64 idmaps > ups-onlinet [ACK] Seq=24835 Ack=52299 Win=65535 Len=0
906693 298.873427 244.3.142.57 -> 41.177.98.220 TCP 130 idmaps > ups-onlinet [PSH, ACK] Seq=24835 Ack=53509 Win=64325 Len=72
906701 298.875204 244.3.142.57 -> 41.177.98.220 TCP 64 idmaps > ups-onlinet [ACK] Seq=24907 Ack=56429 Win=65535 Len=0
906715 298.879938 244.3.142.57 -> 41.177.98.220 TCP 130 idmaps > ups-onlinet [PSH, ACK] Seq=24907 Ack=57479 Win=64485 Len=72
906758 298.881728 244.3.142.57 -> 41.177.98.220 TCP 64 idmaps > ups-onlinet [ACK] Seq=24979 Ack=60399 Win=65535 Len=0
906776 298.886572 244.3.142.57 -> 41.177.98.220 TCP 130 idmaps > ups-onlinet [PSH, ACK] Seq=24979 Ack=61499 Win=64435 Len=72
906793 298.888335 244.3.142.57 -> 41.177.98.220 TCP 64 idmaps > ups-onlinet [ACK] Seq=25051 Ack=64419 Win=65535 Len=0
906811 298.893126 244.3.142.57 -> 41.177.98.220 TCP 130 idmaps > ups-onlinet [PSH, ACK] Seq=25051 Ack=65282 Win=64672 Len=72
906822 298.894709 244.3.142.57 -> 41.177.98.220 TCP 64 idmaps > ups-onlinet [ACK] Seq=25123 Ack=68202 Win=65535 Len=0
906823 298.894843 244.3.142.57 -> 41.177.98.220 TCP 64 idmaps > ups-onlinet [ACK] Seq=25123 Ack=69887 Win=65535 Len=0
906856 298.899808 244.3.142.57 -> 41.177.98.220 TCP 130 idmaps > ups-onlinet [PSH, ACK] Seq=25123 Ack=69887 Win=65535 Len=72
906870 298.901561 244.3.142.57 -> 41.177.98.220 TCP 64 idmaps > ups-onlinet [ACK] Seq=25195 Ack=72807 Win=65535 Len=0
906898 298.906807 244.3.142.57 -> 41.177.98.220 TCP 130 idmaps > ups-onlinet [PSH, ACK] Seq=25195 Ack=73908 Win=64434 Len=72
906902 298.908589 244.3.142.57 -> 41.177.98.220 TCP 64 idmaps > ups-onlinet [ACK] Seq=25267 Ack=76828 Win=65535 Len=0
906912 298.913402 244.3.142.57 -> 41.177.98.220 TCP 130 idmaps > ups-onlinet [PSH, ACK] Seq=25267 Ack=77722 Win=64641 Len=72
906919 298.915136 244.3.142.57 -> 41.177.98.220 TCP 64 idmaps > ups-onlinet [ACK] Seq=25339 Ack=80642 Win=65535 Len=0
906931 298.920488 244.3.142.57 -> 41.177.98.220 TCP 130 idmaps > ups-onlinet [PSH, ACK] Seq=25339 Ack=81790 Win=64387 Len=72
906950 298.922235 244.3.142.57 -> 41.177.98.220 TCP 64 idmaps > ups-onlinet [ACK] Seq=25411 Ack=84710 Win=65535 Len=0
906959 298.927000 244.3.142.57 -> 41.177.98.220 TCP 130 idmaps > ups-onlinet [PSH, ACK] Seq=25411 Ack=85696 Win=64549 Len=72
906964 298.928739 244.3.142.57 -> 41.177.98.220 TCP 64 idmaps > ups-onlinet [ACK] Seq=25483 Ack=88616 Win=65535 Len=0
906995 298.933759 244.3.142.57 -> 41.177.98.220 TCP 130 idmaps > ups-onlinet [PSH, ACK] Seq=25483 Ack=89729 Win=64422 Len=72
907003 298.935451 244.3.142.57 -> 41.177.98.220 TCP 64 idmaps > ups-onlinet [ACK] Seq=25555 Ack=92649 Win=65535 Len=0
907008 298.940065 244.3.142.57 -> 41.177.98.220 TCP 130 idmaps > ups-onlinet [PSH, ACK] Seq=25555 Ack=93394 Win=64790 Len=72
907012 298.941843 244.3.142.57 -> 41.177.98.220 TCP 64 idmaps > ups-onlinet [ACK] Seq=25627 Ack=96314 Win=65535 Len=0
907022 298.946579 244.3.142.57 -> 41.177.98.220 TCP 131 idmaps > ups-onlinet [PSH, ACK] Seq=25627 Ack=97216 Win=64633 Len=73
907037 298.948324 244.3.142.57 -> 41.177.98.220 TCP 64 idmaps > ups-onlinet [ACK] Seq=25700 Ack=100136 Win=65535 Len=0
907052 298.953174 244.3.142.57 -> 41.177.98.220 TCP 131 idmaps > ups-onlinet [PSH, ACK] Seq=25700 Ack=101121 Win=64550 Len=73
907056 298.954869 244.3.142.57 -> 41.177.98.220 TCP 64 idmaps > ups-onlinet [ACK] Seq=25773 Ack=104041 Win=65535 Len=0
907060 298.959522 244.3.142.57 -> 41.177.98.220 TCP 131 idmaps > ups-onlinet [PSH, ACK] Seq=25773 Ack=105050 Win=64526 Len=73
907064 298.961261 244.3.142.57 -> 41.177.98.220 TCP 64 idmaps > ups-onlinet [ACK] Seq=25846 Ack=107970 Win=65535 Len=0
907104 298.967019 244.3.142.57 -> 41.177.98.220 TCP 131 idmaps > ups-onlinet [PSH, ACK] Seq=25846 Ack=109099 Win=64406 Len=73
907122 298.968758 244.3.142.57 -> 41.177.98.220 TCP 64 idmaps > ups-onlinet [ACK] Seq=25919 Ack=112019 Win=65535 Len=0
907127 298.973745 244.3.142.57 -> 41.177.98.220 TCP 131 idmaps > ups-onlinet [PSH, ACK] Seq=25919 Ack=112829 Win=64725 Len=73
907143 298.975513 244.3.142.57 -> 41.177.98.220 TCP 64 idmaps > ups-onlinet [ACK] Seq=25992 Ack=115749 Win=65535 Len=0
907154 298.980905 244.3.142.57 -> 41.177.98.220 TCP 131 idmaps > ups-onlinet [PSH, ACK] Seq=25992 Ack=116780 Win=64504 Len=73
907176 298.982600 244.3.142.57 -> 41.177.98.220 TCP 64 idmaps > ups-onlinet [ACK] Seq=26065 Ack=119700 Win=65535 Len=0
907216 298.987457 244.3.142.57 -> 41.177.98.220 TCP 131 idmaps > ups-onlinet [PSH, ACK] Seq=26065 Ack=120846 Win=64389 Len=73
907585 299.190113 244.3.142.57 -> 41.177.98.220 TCP 64 idmaps > ups-onlinet [ACK] Seq=26138 Ack=121777 Win=65535 Len=0
