74819  30.333887 244.3.246.71 -> 244.3.160.239 TCP 66 12883 > http [SYN] Seq=0 Win=65535 Len=0 MSS=1260 SACK_PERM=1
74824  30.334933 244.3.246.71 -> 244.3.160.239 TCP 64 12883 > http [ACK] Seq=1 Ack=1 Win=65535 Len=0
75601  30.525194 244.3.246.71 -> 244.3.160.239 TCP 66 14824 > http [SYN] Seq=0 Win=65535 Len=0 MSS=1260 SACK_PERM=1
75603  30.526153 244.3.246.71 -> 244.3.160.239 TCP 64 14824 > http [ACK] Seq=1 Ack=1 Win=65535 Len=0
75964  30.606212 244.3.246.71 -> 244.3.160.239 TCP 64 14824 > http [ACK] Seq=1554 Ack=922 Win=64614 Len=0
76787  30.713921 244.3.246.71 -> 244.3.160.239 TCP 64 14824 > http [ACK] Seq=1554 Ack=923 Win=64614 Len=0
76800  30.715844 244.3.246.71 -> 244.3.160.239 TCP 64 14824 > http [FIN, ACK] Seq=1554 Ack=923 Win=64614 Len=0
77368  30.876077 244.3.246.71 -> 244.3.160.239 TCP 64 12883 > http [ACK] Seq=1489 Ack=2050 Win=65535 Len=0
77453  30.900224 244.3.246.71 -> 244.3.160.239 TCP 64 12883 > http [ACK] Seq=1489 Ack=3849 Win=65535 Len=0
77454  30.900617 244.3.246.71 -> 244.3.160.239 TCP 64 12883 > http [ACK] Seq=1489 Ack=5518 Win=65535 Len=0
77497  30.916547 244.3.246.71 -> 244.3.160.239 TCP 64 12883 > http [ACK] Seq=1489 Ack=7567 Win=65535 Len=0
77528  30.925586 244.3.246.71 -> 244.3.160.239 TCP 64 12883 > http [ACK] Seq=1489 Ack=9698 Win=65535 Len=0
77529  30.925774 244.3.246.71 -> 244.3.160.239 TCP 64 12883 > http [ACK] Seq=1489 Ack=11358 Win=65535 Len=0
77556  30.935785 244.3.246.71 -> 244.3.160.239 TCP 64 12883 > http [ACK] Seq=1489 Ack=12818 Win=65535 Len=0
77569  30.950958 244.3.246.71 -> 244.3.160.239 TCP 64 12883 > http [ACK] Seq=1489 Ack=14867 Win=64746 Len=0
77628  30.966704 244.3.246.71 -> 244.3.160.239 TCP 64 12883 > http [ACK] Seq=1489 Ack=16998 Win=62615 Len=0
77632  30.967165 244.3.246.71 -> 244.3.160.239 TCP 64 12883 > http [ACK] Seq=1489 Ack=18651 Win=60962 Len=0
77668  30.976204 244.3.246.71 -> 244.3.160.239 TCP 64 12883 > http [ACK] Seq=1489 Ack=20709 Win=58904 Len=0
77702  30.986652 244.3.246.71 -> 244.3.160.239 TCP 64 12883 > http [ACK] Seq=1489 Ack=22863 Win=56750 Len=0
77714  30.988619 244.3.246.71 -> 244.3.160.239 TCP 64 12883 > http [ACK] Seq=1489 Ack=24949 Win=54664 Len=0
77715  30.988980 244.3.246.71 -> 244.3.160.239 TCP 64 12883 > http [ACK] Seq=1489 Ack=26008 Win=53605 Len=0
77792  31.012636 244.3.246.71 -> 244.3.160.239 TCP 64 12883 > http [ACK] Seq=1489 Ack=28057 Win=51556 Len=0
77793  31.012640 244.3.246.71 -> 244.3.160.239 TCP 64 [TCP Window Update] 12883 > http [ACK] Seq=1489 Ack=28057 Win=65535 Len=0
77801  31.014524 244.3.246.71 -> 244.3.160.239 TCP 66 autobuild > http [SYN] Seq=0 Win=65535 Len=0 MSS=1260 SACK_PERM=1
77803  31.015668 244.3.246.71 -> 244.3.160.239 TCP 64 autobuild > http [ACK] Seq=1 Ack=1 Win=65535 Len=0
77813  31.026418 244.3.246.71 -> 244.3.160.239 TCP 64 12883 > http [ACK] Seq=1489 Ack=30157 Win=65535 Len=0
77816  31.028665 244.3.246.71 -> 244.3.160.239 TCP 64 12883 > http [ACK] Seq=1489 Ack=32206 Win=65535 Len=0
77828  31.030531 244.3.246.71 -> 244.3.160.239 TCP 64 12883 > http [ACK] Seq=1489 Ack=34255 Win=65535 Len=0
77969  31.052224 244.3.246.71 -> 244.3.160.239 TCP 64 12883 > http [ACK] Seq=1489 Ack=36128 Win=65535 Len=0
77970  31.052691 244.3.246.71 -> 244.3.160.239 TCP 64 12883 > http [ACK] Seq=1489 Ack=37775 Win=65535 Len=0
78018  31.066706 244.3.246.71 -> 244.3.160.239 TCP 64 12883 > http [ACK] Seq=1489 Ack=39824 Win=65535 Len=0
78033  31.069038 244.3.246.71 -> 244.3.160.239 TCP 64 12883 > http [ACK] Seq=1489 Ack=41945 Win=65535 Len=0
78037  31.069998 244.3.246.71 -> 244.3.160.239 TCP 64 autobuild > http [ACK] Seq=1310 Ack=103 Win=65434 Len=0
78038  31.070046 244.3.246.71 -> 244.3.160.239 TCP 64 autobuild > http [FIN, ACK] Seq=1310 Ack=103 Win=65434 Len=0
78044  31.072614 244.3.246.71 -> 244.3.160.239 TCP 64 12883 > http [ACK] Seq=1489 Ack=43994 Win=65535 Len=0
78093  31.090577 244.3.246.71 -> 244.3.160.239 TCP 64 12883 > http [ACK] Seq=1489 Ack=46348 Win=65535 Len=0
78101  31.097617 244.3.246.71 -> 244.3.160.239 TCP 66 16281 > http [SYN] Seq=0 Win=65535 Len=0 MSS=1260 SACK_PERM=1
78104  31.098508 244.3.246.71 -> 244.3.160.239 TCP 64 16281 > http [ACK] Seq=1 Ack=1 Win=65535 Len=0
78106  31.098714 244.3.246.71 -> 244.3.160.239 TCP 84 [TCP segment of a reassembled PDU]
78159  31.110185 244.3.246.71 -> 244.3.160.239 TCP 64 12883 > http [ACK] Seq=1489 Ack=47808 Win=65535 Len=0
78162  31.110295 244.3.246.71 -> 244.3.160.239 TCP 64 12883 > http [ACK] Seq=1489 Ack=49900 Win=65535 Len=0
78177  31.111695 244.3.246.71 -> 244.3.160.239 TCP 64 12883 > http [ACK] Seq=1489 Ack=51949 Win=65535 Len=0
78229  31.115054 244.3.246.71 -> 244.3.160.239 TCP 64 12883 > http [ACK] Seq=1489 Ack=53998 Win=65535 Len=0
78243  31.115671 244.3.246.71 -> 244.3.160.239 TCP 64 12883 > http [ACK] Seq=1489 Ack=56047 Win=65535 Len=0
78276  31.131496 244.3.246.71 -> 244.3.160.239 TCP 64 12883 > http [ACK] Seq=1489 Ack=57854 Win=65535 Len=0
78283  31.134131 244.3.246.71 -> 244.3.160.239 TCP 64 12883 > http [ACK] Seq=1489 Ack=59903 Win=65535 Len=0
78288  31.136443 244.3.246.71 -> 244.3.160.239 TCP 64 12883 > http [ACK] Seq=1489 Ack=61952 Win=65535 Len=0
78298  31.138283 244.3.246.71 -> 244.3.160.239 TCP 64 12883 > http [ACK] Seq=1489 Ack=64099 Win=65535 Len=0
78340  31.146240 244.3.246.71 -> 244.3.160.239 TCP 64 12883 > http [ACK] Seq=1489 Ack=66148 Win=65535 Len=0
78344  31.146438 244.3.246.71 -> 244.3.160.239 TCP 64 12883 > http [ACK] Seq=1489 Ack=68198 Win=65535 Len=0
78345  31.146442 244.3.246.71 -> 244.3.160.239 TCP 64 12883 > http [ACK] Seq=1489 Ack=69989 Win=65535 Len=0
78370  31.151959 244.3.246.71 -> 244.3.160.239 TCP 64 16281 > http [ACK] Seq=1287 Ack=103 Win=65434 Len=0
78371  31.152189 244.3.246.71 -> 244.3.160.239 TCP 64 16281 > http [FIN, ACK] Seq=1287 Ack=103 Win=65434 Len=0
78472  31.163869 244.3.246.71 -> 244.3.160.239 TCP 64 12883 > http [ACK] Seq=1489 Ack=72038 Win=65535 Len=0
78517  31.167786 244.3.246.71 -> 244.3.160.239 TCP 64 12883 > http [ACK] Seq=1489 Ack=73755 Win=65535 Len=0
78518  31.167842 244.3.246.71 -> 244.3.160.239 TCP 64 12883 > http [ACK] Seq=1489 Ack=73756 Win=65535 Len=0
78625  31.213246 244.3.246.71 -> 244.3.160.239 TCP 66 signal > http [SYN] Seq=0 Win=65535 Len=0 MSS=1260 SACK_PERM=1
78630  31.214198 244.3.246.71 -> 244.3.160.239 TCP 64 signal > http [ACK] Seq=1 Ack=1 Win=65535 Len=0
78639  31.214699 244.3.246.71 -> 244.3.160.239 TCP 96 [TCP segment of a reassembled PDU]
78654  31.219063 244.3.246.71 -> 244.3.160.239 TCP 66 10946 > http [SYN] Seq=0 Win=65535 Len=0 MSS=1260 SACK_PERM=1
78667  31.220044 244.3.246.71 -> 244.3.160.239 TCP 64 10946 > http [ACK] Seq=1 Ack=1 Win=65535 Len=0
78672  31.220419 244.3.246.71 -> 244.3.160.239 TCP 91 [TCP segment of a reassembled PDU]
78682  31.221913 244.3.246.71 -> 244.3.160.239 TCP 66 14305 > http [SYN] Seq=0 Win=65535 Len=0 MSS=1260 SACK_PERM=1
78689  31.222808 244.3.246.71 -> 244.3.160.239 TCP 64 14305 > http [ACK] Seq=1 Ack=1 Win=65535 Len=0
78691  31.223316 244.3.246.71 -> 244.3.160.239 TCP 93 [TCP segment of a reassembled PDU]
78771  31.246841 244.3.246.71 -> 244.3.160.239 TCP 64 12883 > http [FIN, ACK] Seq=1489 Ack=73756 Win=65535 Len=0
78857  31.268458 244.3.246.71 -> 244.3.160.239 TCP 64 signal > http [ACK] Seq=1299 Ack=103 Win=65434 Len=0
78858  31.268521 244.3.246.71 -> 244.3.160.239 TCP 64 signal > http [FIN, ACK] Seq=1299 Ack=103 Win=65434 Len=0
78876  31.273397 244.3.246.71 -> 244.3.160.239 TCP 64 10946 > http [ACK] Seq=1294 Ack=103 Win=65434 Len=0
78878  31.274958 244.3.246.71 -> 244.3.160.239 TCP 64 10946 > http [FIN, ACK] Seq=1294 Ack=103 Win=65434 Len=0
78891  31.281176 244.3.246.71 -> 244.3.160.239 TCP 64 14305 > http [ACK] Seq=1296 Ack=103 Win=65434 Len=0
78892  31.281244 244.3.246.71 -> 244.3.160.239 TCP 64 14305 > http [FIN, ACK] Seq=1296 Ack=103 Win=65434 Len=0
79118  31.346205 244.3.246.71 -> 244.3.160.239 TCP 66 11585 > http [SYN] Seq=0 Win=65535 Len=0 MSS=1260 SACK_PERM=1
79121  31.347176 244.3.246.71 -> 244.3.160.239 TCP 64 11585 > http [ACK] Seq=1 Ack=1 Win=65535 Len=0
79126  31.347647 244.3.246.71 -> 244.3.160.239 TCP 75 [TCP segment of a reassembled PDU]
79247  31.402995 244.3.246.71 -> 244.3.160.239 TCP 64 11585 > http [ACK] Seq=1278 Ack=103 Win=65434 Len=0
79250  31.403231 244.3.246.71 -> 244.3.160.239 TCP 64 11585 > http [FIN, ACK] Seq=1278 Ack=103 Win=65434 Len=0
79403  31.447161 244.3.246.71 -> 244.3.160.239 TCP 66 15738 > http [SYN] Seq=0 Win=65535 Len=0 MSS=1260 SACK_PERM=1
79405  31.448135 244.3.246.71 -> 244.3.160.239 TCP 64 15738 > http [ACK] Seq=1 Ack=1 Win=65535 Len=0
79406  31.450376 244.3.246.71 -> 244.3.160.239 TCP 66 9816 > http [SYN] Seq=0 Win=65535 Len=0 MSS=1260 SACK_PERM=1
79408  31.451230 244.3.246.71 -> 244.3.160.239 TCP 64 9816 > http [ACK] Seq=1 Ack=1 Win=65535 Len=0
79409  31.452290 244.3.246.71 -> 244.3.160.239 TCP 66 15855 > http [SYN] Seq=0 Win=65535 Len=0 MSS=1260 SACK_PERM=1
79412  31.453193 244.3.246.71 -> 244.3.160.239 TCP 64 15855 > http [ACK] Seq=1 Ack=1 Win=65535 Len=0
79419  31.454806 244.3.246.71 -> 244.3.160.239 TCP 64 [TCP segment of a reassembled PDU]
79646  31.516360 244.3.246.71 -> 244.3.160.239 TCP 64 9816 > http [ACK] Seq=1267 Ack=2050 Win=65535 Len=0
79649  31.516778 244.3.246.71 -> 244.3.160.239 TCP 64 9816 > http [ACK] Seq=1267 Ack=2788 Win=64798 Len=0
79656  31.518842 244.3.246.71 -> 244.3.160.239 TCP 64 9816 > http [FIN, ACK] Seq=1267 Ack=2788 Win=64798 Len=0
79664  31.520427 244.3.246.71 -> 244.3.160.239 TCP 64 15738 > http [ACK] Seq=1411 Ack=2050 Win=65535 Len=0
79666  31.520904 244.3.246.71 -> 244.3.160.239 TCP 64 15855 > http [ACK] Seq=1372 Ack=2050 Win=65535 Len=0
79741  31.545194 244.3.246.71 -> 244.3.160.239 TCP 64 15738 > http [ACK] Seq=1411 Ack=4042 Win=65535 Len=0
79743  31.545594 244.3.246.71 -> 244.3.160.239 TCP 64 15855 > http [ACK] Seq=1372 Ack=4070 Win=65535 Len=0
79754  31.546864 244.3.246.71 -> 244.3.160.239 TCP 64 15738 > http [ACK] Seq=1411 Ack=6091 Win=65535 Len=0
79765  31.547691 244.3.246.71 -> 244.3.160.239 TCP 64 15855 > http [ACK] Seq=1372 Ack=6119 Win=65535 Len=0
79774  31.548478 244.3.246.71 -> 244.3.160.239 TCP 64 15738 > http [ACK] Seq=1411 Ack=8140 Win=65535 Len=0
79778  31.549337 244.3.246.71 -> 244.3.160.239 TCP 64 15855 > http [ACK] Seq=1372 Ack=8168 Win=65535 Len=0
79876  31.569878 244.3.246.71 -> 244.3.160.239 TCP 64 15738 > http [ACK] Seq=1411 Ack=9882 Win=65535 Len=0
79878  31.570373 244.3.246.71 -> 244.3.160.239 TCP 64 15855 > http [ACK] Seq=1372 Ack=9882 Win=65535 Len=0
79885  31.571639 244.3.246.71 -> 244.3.160.239 TCP 64 15738 > http [ACK] Seq=1411 Ack=11931 Win=65535 Len=0
79887  31.572415 244.3.246.71 -> 244.3.160.239 TCP 64 15855 > http [ACK] Seq=1372 Ack=11931 Win=65535 Len=0
79895  31.573609 244.3.246.71 -> 244.3.160.239 TCP 64 15738 > http [ACK] Seq=1411 Ack=13980 Win=65535 Len=0
79901  31.574412 244.3.246.71 -> 244.3.160.239 TCP 64 15855 > http [ACK] Seq=1372 Ack=13980 Win=65535 Len=0
79906  31.575342 244.3.246.71 -> 244.3.160.239 TCP 64 15738 > http [ACK] Seq=1411 Ack=16029 Win=65535 Len=0
79912  31.575693 244.3.246.71 -> 244.3.160.239 TCP 64 15738 > http [ACK] Seq=1411 Ack=17382 Win=65535 Len=0
79914  31.576102 244.3.246.71 -> 244.3.160.239 TCP 64 15855 > http [ACK] Seq=1372 Ack=16029 Win=65535 Len=0
79916  31.576428 244.3.246.71 -> 244.3.160.239 TCP 64 15855 > http [ACK] Seq=1372 Ack=17382 Win=65535 Len=0
80086  31.595083 244.3.246.71 -> 244.3.160.239 TCP 64 15738 > http [ACK] Seq=1411 Ack=19431 Win=65535 Len=0
80096  31.595475 244.3.246.71 -> 244.3.160.239 TCP 64 15855 > http [ACK] Seq=1372 Ack=19431 Win=65535 Len=0
80131  31.597068 244.3.246.71 -> 244.3.160.239 TCP 64 15738 > http [ACK] Seq=1411 Ack=21480 Win=65535 Len=0
80143  31.597563 244.3.246.71 -> 244.3.160.239 TCP 64 15855 > http [ACK] Seq=1372 Ack=21480 Win=65535 Len=0
80168  31.598794 244.3.246.71 -> 244.3.160.239 TCP 64 15738 > http [ACK] Seq=1411 Ack=23529 Win=65535 Len=0
80182  31.599782 244.3.246.71 -> 244.3.160.239 TCP 64 15855 > http [ACK] Seq=1372 Ack=23529 Win=65535 Len=0
80207  31.601241 244.3.246.71 -> 244.3.160.239 TCP 64 15738 > http [ACK] Seq=1411 Ack=25578 Win=65535 Len=0
80213  31.601498 244.3.246.71 -> 244.3.160.239 TCP 64 15855 > http [ACK] Seq=1372 Ack=25578 Win=65535 Len=0
80218  31.602299 244.3.246.71 -> 244.3.160.239 TCP 64 15738 > http [ACK] Seq=1411 Ack=27627 Win=65535 Len=0
80232  31.603366 244.3.246.71 -> 244.3.160.239 TCP 64 15855 > http [ACK] Seq=1372 Ack=27627 Win=65535 Len=0
80235  31.603818 244.3.246.71 -> 244.3.160.239 TCP 64 15738 > http [ACK] Seq=1411 Ack=29102 Win=65535 Len=0
80267  31.609496 244.3.246.71 -> 244.3.160.239 TCP 64 15855 > http [ACK] Seq=1372 Ack=29062 Win=65535 Len=0
80327  31.617818 244.3.246.71 -> 244.3.160.239 TCP 64 15855 > http [ACK] Seq=1372 Ack=30557 Win=65535 Len=0
80349  31.620281 244.3.246.71 -> 244.3.160.239 TCP 64 15738 > http [ACK] Seq=1411 Ack=30522 Win=65535 Len=0
80350  31.620286 244.3.246.71 -> 244.3.160.239 TCP 64 15855 > http [ACK] Seq=1372 Ack=32606 Win=65535 Len=0
80351  31.620471 244.3.246.71 -> 244.3.160.239 TCP 64 15738 > http [ACK] Seq=1411 Ack=32571 Win=65535 Len=0
80370  31.623894 244.3.246.71 -> 244.3.160.239 TCP 64 15738 > http [ACK] Seq=1411 Ack=34620 Win=65535 Len=0
80371  31.623938 244.3.246.71 -> 244.3.160.239 TCP 64 15855 > http [ACK] Seq=1372 Ack=34728 Win=65535 Len=0
80376  31.624394 244.3.246.71 -> 244.3.160.239 TCP 64 15738 > http [ACK] Seq=1411 Ack=36669 Win=65535 Len=0
80387  31.625312 244.3.246.71 -> 244.3.160.239 TCP 64 15855 > http [ACK] Seq=1372 Ack=36777 Win=65535 Len=0
80398  31.626190 244.3.246.71 -> 244.3.160.239 TCP 64 15738 > http [ACK] Seq=1411 Ack=38718 Win=65535 Len=0
80406  31.627237 244.3.246.71 -> 244.3.160.239 TCP 64 15855 > http [ACK] Seq=1372 Ack=38826 Win=65535 Len=0
80411  31.628066 244.3.246.71 -> 244.3.160.239 TCP 64 15738 > http [ACK] Seq=1411 Ack=40767 Win=65535 Len=0
80428  31.629034 244.3.246.71 -> 244.3.160.239 TCP 64 15855 > http [ACK] Seq=1372 Ack=40875 Win=65535 Len=0
80431  31.630116 244.3.246.71 -> 244.3.160.239 TCP 64 15738 > http [ACK] Seq=1411 Ack=42816 Win=65535 Len=0
80437  31.631023 244.3.246.71 -> 244.3.160.239 TCP 64 15855 > http [ACK] Seq=1372 Ack=42924 Win=65535 Len=0
80439  31.631952 244.3.246.71 -> 244.3.160.239 TCP 64 15738 > http [ACK] Seq=1411 Ack=44865 Win=65535 Len=0
80453  31.632954 244.3.246.71 -> 244.3.160.239 TCP 64 15855 > http [ACK] Seq=1372 Ack=44973 Win=65535 Len=0
80458  31.633907 244.3.246.71 -> 244.3.160.239 TCP 64 15738 > http [ACK] Seq=1411 Ack=46914 Win=65535 Len=0
80477  31.641812 244.3.246.71 -> 244.3.160.239 TCP 64 15855 > http [ACK] Seq=1372 Ack=47022 Win=65535 Len=0
80478  31.641915 244.3.246.71 -> 244.3.160.239 TCP 64 15855 > http [ACK] Seq=1372 Ack=48079 Win=64478 Len=0
80506  31.645249 244.3.246.71 -> 244.3.160.239 TCP 64 15855 > http [ACK] Seq=1372 Ack=50128 Win=65535 Len=0
80509  31.645584 244.3.246.71 -> 244.3.160.239 TCP 64 15738 > http [ACK] Seq=1411 Ack=49321 Win=65535 Len=0
80522  31.647417 244.3.246.71 -> 244.3.160.239 TCP 64 15855 > http [ACK] Seq=1372 Ack=52177 Win=65535 Len=0
80523  31.647615 244.3.246.71 -> 244.3.160.239 TCP 64 15738 > http [ACK] Seq=1411 Ack=51370 Win=65535 Len=0
80536  31.649452 244.3.246.71 -> 244.3.160.239 TCP 64 15855 > http [ACK] Seq=1372 Ack=54226 Win=65535 Len=0
80537  31.649457 244.3.246.71 -> 244.3.160.239 TCP 64 15738 > http [ACK] Seq=1411 Ack=53419 Win=65535 Len=0
80557  31.651158 244.3.246.71 -> 244.3.160.239 TCP 64 15855 > http [ACK] Seq=1372 Ack=56275 Win=65535 Len=0
80565  31.651670 244.3.246.71 -> 244.3.160.239 TCP 64 15738 > http [ACK] Seq=1411 Ack=55468 Win=65535 Len=0
80595  31.653260 244.3.246.71 -> 244.3.160.239 TCP 64 15855 > http [ACK] Seq=1372 Ack=58324 Win=65535 Len=0
80598  31.653319 244.3.246.71 -> 244.3.160.239 TCP 64 15738 > http [ACK] Seq=1411 Ack=57517 Win=65535 Len=0
80604  31.653499 244.3.246.71 -> 244.3.160.239 TCP 64 15738 > http [ACK] Seq=1411 Ack=58204 Win=64849 Len=0
80606  31.653816 244.3.246.71 -> 244.3.160.239 TCP 64 15738 > http [FIN, ACK] Seq=1411 Ack=58204 Win=64849 Len=0
80627  31.656015 244.3.246.71 -> 244.3.160.239 TCP 64 15855 > http [ACK] Seq=1372 Ack=60373 Win=65535 Len=0
80660  31.658460 244.3.246.71 -> 244.3.160.239 TCP 64 15855 > http [ACK] Seq=1372 Ack=62422 Win=65535 Len=0
80668  31.659077 244.3.246.71 -> 244.3.160.239 TCP 64 15855 > http [ACK] Seq=1372 Ack=64471 Win=65535 Len=0
80690  31.660909 244.3.246.71 -> 244.3.160.239 TCP 64 15855 > http [ACK] Seq=1372 Ack=66520 Win=65535 Len=0
80702  31.662851 244.3.246.71 -> 244.3.160.239 TCP 64 15855 > http [ACK] Seq=1372 Ack=68569 Win=65535 Len=0
80725  31.664630 244.3.246.71 -> 244.3.160.239 TCP 64 15855 > http [ACK] Seq=1372 Ack=70618 Win=65535 Len=0
80778  31.669872 244.3.246.71 -> 244.3.160.239 TCP 64 15855 > http [ACK] Seq=1372 Ack=72662 Win=65535 Len=0
80785  31.671539 244.3.246.71 -> 244.3.160.239 TCP 64 15855 > http [ACK] Seq=1372 Ack=74711 Win=65535 Len=0
80786  31.672047 244.3.246.71 -> 244.3.160.239 TCP 64 15855 > http [ACK] Seq=1372 Ack=75609 Win=64637 Len=0
80787  31.672052 244.3.246.71 -> 244.3.160.239 TCP 64 15855 > http [ACK] Seq=1372 Ack=75610 Win=64637 Len=0
80789  31.672268 244.3.246.71 -> 244.3.160.239 TCP 64 15855 > http [FIN, ACK] Seq=1372 Ack=75610 Win=64637 Len=0
81105  31.769749 244.3.246.71 -> 244.3.160.239 TCP 66 pmcp > http [SYN] Seq=0 Win=65535 Len=0 MSS=1260 SACK_PERM=1
81116  31.770774 244.3.246.71 -> 244.3.160.239 TCP 64 pmcp > http [ACK] Seq=1 Ack=1 Win=65535 Len=0
81118  31.771188 244.3.246.71 -> 244.3.160.239 TCP 91 [TCP segment of a reassembled PDU]
81383  31.816251 244.3.246.71 -> 244.3.160.239 TCP 66 13959 > http [SYN] Seq=0 Win=65535 Len=0 MSS=1260 SACK_PERM=1
81394  31.817262 244.3.246.71 -> 244.3.160.239 TCP 64 13959 > http [ACK] Seq=1 Ack=1 Win=65535 Len=0
81409  31.824640 244.3.246.71 -> 244.3.160.239 TCP 84 [TCP segment of a reassembled PDU]
81412  31.825489 244.3.246.71 -> 244.3.160.239 TCP 64 pmcp > http [ACK] Seq=1294 Ack=103 Win=65434 Len=0
81423  31.828581 244.3.246.71 -> 244.3.160.239 TCP 66 11919 > http [SYN] Seq=0 Win=65535 Len=0 MSS=1260 SACK_PERM=1
81427  31.829225 244.3.246.71 -> 244.3.160.239 TCP 64 11919 > http [ACK] Seq=1 Ack=1 Win=65535 Len=0
81434  31.829955 244.3.246.71 -> 244.3.160.239 TCP 64 pmcp > http [FIN, ACK] Seq=1294 Ack=103 Win=65434 Len=0
81466  31.841831 244.3.246.71 -> 244.3.160.239 TCP 66 11837 > http [SYN] Seq=0 Win=65535 Len=0 MSS=1260 SACK_PERM=1
81468  31.842765 244.3.246.71 -> 244.3.160.239 TCP 64 11837 > http [ACK] Seq=1 Ack=1 Win=65535 Len=0
81875  31.940015 244.3.246.71 -> 244.3.160.239 TCP 64 11837 > http [ACK] Seq=1245 Ack=536 Win=65000 Len=0
81888  31.940416 244.3.246.71 -> 244.3.160.239 TCP 64 11919 > http [ACK] Seq=1313 Ack=1377 Win=65535 Len=0
81889  31.940421 244.3.246.71 -> 244.3.160.239 TCP 64 13959 > http [ACK] Seq=1287 Ack=1466 Win=65535 Len=0
81890  31.940425 244.3.246.71 -> 244.3.160.239 TCP 64 11837 > http [ACK] Seq=1245 Ack=537 Win=65000 Len=0
81891  31.940615 244.3.246.71 -> 244.3.160.239 TCP 64 11919 > http [FIN, ACK] Seq=1313 Ack=1377 Win=65535 Len=0
81895  31.941092 244.3.246.71 -> 244.3.160.239 TCP 64 13959 > http [ACK] Seq=1287 Ack=1838 Win=65164 Len=0
81897  31.941442 244.3.246.71 -> 244.3.160.239 TCP 64 11919 > http [ACK] Seq=1314 Ack=1378 Win=65535 Len=0
81911  31.943752 244.3.246.71 -> 244.3.160.239 TCP 64 13959 > http [FIN, ACK] Seq=1287 Ack=1838 Win=65164 Len=0
81935  31.948025 244.3.246.71 -> 244.3.160.239 TCP 64 11837 > http [FIN, ACK] Seq=1245 Ack=537 Win=65000 Len=0
82660  32.199906 244.3.246.71 -> 244.3.160.239 TCP 66 6197 > http [SYN] Seq=0 Win=65535 Len=0 MSS=1260 SACK_PERM=1
82662  32.200822 244.3.246.71 -> 244.3.160.239 TCP 64 6197 > http [ACK] Seq=1 Ack=1 Win=65535 Len=0
82684  32.208433 244.3.246.71 -> 244.3.160.239 TCP 66 7942 > http [SYN] Seq=0 Win=65535 Len=0 MSS=1260 SACK_PERM=1
82687  32.209395 244.3.246.71 -> 244.3.160.239 TCP 64 7942 > http [ACK] Seq=1 Ack=1 Win=65535 Len=0
82785  32.225969 244.3.246.71 -> 244.3.160.239 TCP 66 pspserver > http [SYN] Seq=0 Win=65535 Len=0 MSS=1260 SACK_PERM=1
82787  32.226904 244.3.246.71 -> 244.3.160.239 TCP 64 pspserver > http [ACK] Seq=1 Ack=1 Win=65535 Len=0
82884  32.259409 244.3.246.71 -> 244.3.160.239 TCP 66 canon-bjnp2 > http [SYN] Seq=0 Win=65535 Len=0 MSS=1260 SACK_PERM=1
82888  32.260500 244.3.246.71 -> 244.3.160.239 TCP 64 canon-bjnp2 > http [ACK] Seq=1 Ack=1 Win=65535 Len=0
82889  32.260610 244.3.246.71 -> 244.3.160.239 TCP 66 10343 > http [SYN] Seq=0 Win=65535 Len=0 MSS=1260 SACK_PERM=1
82896  32.261419 244.3.246.71 -> 244.3.160.239 TCP 64 6197 > http [ACK] Seq=2250 Ack=1487 Win=65535 Len=0
82897  32.261424 244.3.246.71 -> 244.3.160.239 TCP 64 10343 > http [ACK] Seq=1 Ack=1 Win=65535 Len=0
82902  32.262373 244.3.246.71 -> 244.3.160.239 TCP 66 9905 > http [SYN] Seq=0 Win=65535 Len=0 MSS=1260 SACK_PERM=1
82907  32.263228 244.3.246.71 -> 244.3.160.239 TCP 64 9905 > http [ACK] Seq=1 Ack=1 Win=65535 Len=0
82968  32.278880 244.3.246.71 -> 244.3.160.239 TCP 66 flukeserver > http [SYN] Seq=0 Win=65535 Len=0 MSS=1260 SACK_PERM=1
82974  32.279745 244.3.246.71 -> 244.3.160.239 TCP 64 flukeserver > http [ACK] Seq=1 Ack=1 Win=65535 Len=0
82980  32.280994 244.3.246.71 -> 244.3.160.239 TCP 64 pspserver > http [ACK] Seq=1315 Ack=103 Win=65434 Len=0
82981  32.281099 244.3.246.71 -> 244.3.160.239 TCP 64 pspserver > http [FIN, ACK] Seq=1315 Ack=103 Win=65434 Len=0
83115  32.315877 244.3.246.71 -> 244.3.160.239 TCP 64 canon-bjnp2 > http [ACK] Seq=1305 Ack=103 Win=65434 Len=0
83116  32.315881 244.3.246.71 -> 244.3.160.239 TCP 64 10343 > http [ACK] Seq=1306 Ack=103 Win=65434 Len=0
83121  32.316026 244.3.246.71 -> 244.3.160.239 TCP 64 canon-bjnp2 > http [FIN, ACK] Seq=1305 Ack=103 Win=65434 Len=0
83125  32.316519 244.3.246.71 -> 244.3.160.239 TCP 64 10343 > http [FIN, ACK] Seq=1306 Ack=103 Win=65434 Len=0
83127  32.316804 244.3.246.71 -> 244.3.160.239 TCP 64 9905 > http [ACK] Seq=1308 Ack=103 Win=65434 Len=0
83128  32.316809 244.3.246.71 -> 244.3.160.239 TCP 64 9905 > http [FIN, ACK] Seq=1308 Ack=103 Win=65434 Len=0
83157  32.333855 244.3.246.71 -> 244.3.160.239 TCP 64 flukeserver > http [ACK] Seq=1109 Ack=103 Win=65434 Len=0
83158  32.333860 244.3.246.71 -> 244.3.160.239 TCP 64 flukeserver > http [FIN, ACK] Seq=1109 Ack=103 Win=65434 Len=0
83259  32.373770 244.3.246.71 -> 244.3.160.239 TCP 64 6197 > http [ACK] Seq=2250 Ack=1531 Win=65492 Len=0
83260  32.373988 244.3.246.71 -> 244.3.160.239 TCP 64 6197 > http [FIN, ACK] Seq=2250 Ack=1531 Win=65492 Len=0
83264  32.374978 244.3.246.71 -> 244.3.160.239 TCP 64 7942 > http [ACK] Seq=1245 Ack=1437 Win=65535 Len=0
83518  32.483673 244.3.246.71 -> 244.3.160.239 TCP 64 7942 > http [ACK] Seq=1245 Ack=1438 Win=65535 Len=0
83519  32.485269 244.3.246.71 -> 244.3.160.239 TCP 64 7942 > http [FIN, ACK] Seq=1245 Ack=1438 Win=65535 Len=0
84645  32.821194 244.3.246.71 -> 244.3.160.239 TCP 66 arena-server > http [SYN] Seq=0 Win=65535 Len=0 MSS=1260 SACK_PERM=1
84647  32.822087 244.3.246.71 -> 244.3.160.239 TCP 64 arena-server > http [ACK] Seq=1 Ack=1 Win=65535 Len=0
84731  32.876722 244.3.246.71 -> 244.3.160.239 TCP 64 arena-server > http [ACK] Seq=1311 Ack=103 Win=65434 Len=0
84732  32.876727 244.3.246.71 -> 244.3.160.239 TCP 64 arena-server > http [FIN, ACK] Seq=1311 Ack=103 Win=65434 Len=0
84892  32.946840 244.3.246.71 -> 244.3.160.239 TCP 66 14111 > http [SYN] Seq=0 Win=65535 Len=0 MSS=1260 SACK_PERM=1
84894  32.947828 244.3.246.71 -> 244.3.160.239 TCP 64 14111 > http [ACK] Seq=1 Ack=1 Win=65535 Len=0
85185  33.083797 244.3.246.71 -> 244.3.160.239 TCP 64 14111 > http [ACK] Seq=1308 Ack=588 Win=64948 Len=0
85427  33.193563 244.3.246.71 -> 244.3.160.239 TCP 64 14111 > http [ACK] Seq=1308 Ack=589 Win=64948 Len=0
85428  33.193643 244.3.246.71 -> 244.3.160.239 TCP 64 14111 > http [FIN, ACK] Seq=1308 Ack=589 Win=64948 Len=0
139292  48.199693 244.3.246.71 -> 244.3.160.239 TCP 66 10392 > http [SYN] Seq=0 Win=65535 Len=0 MSS=1260 SACK_PERM=1
139297  48.200752 244.3.246.71 -> 244.3.160.239 TCP 64 10392 > http [ACK] Seq=1 Ack=1 Win=65535 Len=0
139995  48.313886 244.3.246.71 -> 244.3.160.239 TCP 64 10392 > http [ACK] Seq=1245 Ack=1347 Win=65535 Len=0
140307  48.391947 244.3.246.71 -> 244.3.160.239 TCP 64 10392 > http [ACK] Seq=1245 Ack=1348 Win=65535 Len=0
140326  48.394956 244.3.246.71 -> 244.3.160.239 TCP 64 10392 > http [FIN, ACK] Seq=1245 Ack=1348 Win=65535 Len=0
173672  57.743064 244.3.246.71 -> 244.3.160.239 TCP 66 6923 > http [SYN] Seq=0 Win=65535 Len=0 MSS=1260 SACK_PERM=1
173674  57.743980 244.3.246.71 -> 244.3.160.239 TCP 64 6923 > http [ACK] Seq=1 Ack=1 Win=65535 Len=0
173832  57.800774 244.3.246.71 -> 244.3.160.239 TCP 64 6923 > http [ACK] Seq=1385 Ack=517 Win=65020 Len=0
173833  57.801197 244.3.246.71 -> 244.3.160.239 TCP 64 6923 > http [FIN, ACK] Seq=1385 Ack=517 Win=65020 Len=0
173851  57.810561 244.3.246.71 -> 244.3.160.239 TCP 66 scenccs > http [SYN] Seq=0 Win=65535 Len=0 MSS=1260 SACK_PERM=1
173859  57.811450 244.3.246.71 -> 244.3.160.239 TCP 64 scenccs > http [ACK] Seq=1 Ack=1 Win=65535 Len=0
173946  57.829363 244.3.246.71 -> 244.3.160.239 TCP 66 4541 > http [SYN] Seq=0 Win=65535 Len=0 MSS=1260 SACK_PERM=1
173961  57.830881 244.3.246.71 -> 244.3.160.239 TCP 64 4541 > http [ACK] Seq=1 Ack=1 Win=65535 Len=0
174420  57.956676 244.3.246.71 -> 244.3.160.239 TCP 64 scenccs > http [ACK] Seq=4589 Ack=988 Win=64549 Len=0
174423  57.957155 244.3.246.71 -> 244.3.160.239 TCP 64 scenccs > http [FIN, ACK] Seq=4589 Ack=988 Win=64549 Len=0
174427  57.957944 244.3.246.71 -> 244.3.160.239 TCP 66 15131 > http [SYN] Seq=0 Win=65535 Len=0 MSS=1260 SACK_PERM=1
174429  57.958883 244.3.246.71 -> 244.3.160.239 TCP 64 15131 > http [ACK] Seq=1 Ack=1 Win=65535 Len=0
174564  57.993455 244.3.246.71 -> 244.3.160.239 TCP 64 4541 > http [ACK] Seq=1670 Ack=932 Win=64604 Len=0
174738  58.063793 244.3.246.71 -> 244.3.160.239 TCP 64 15131 > http [ACK] Seq=5037 Ack=701 Win=64836 Len=0
174739  58.064269 244.3.246.71 -> 244.3.160.239 TCP 64 15131 > http [FIN, ACK] Seq=5037 Ack=701 Win=64836 Len=0
174747  58.067435 244.3.246.71 -> 244.3.160.239 TCP 66 watchdoc > http [SYN] Seq=0 Win=65535 Len=0 MSS=1260 SACK_PERM=1
174753  58.068411 244.3.246.71 -> 244.3.160.239 TCP 64 watchdoc > http [ACK] Seq=1 Ack=1 Win=65535 Len=0
174820  58.103446 244.3.246.71 -> 244.3.160.239 TCP 64 4541 > http [ACK] Seq=1670 Ack=933 Win=64604 Len=0
174821  58.105165 244.3.246.71 -> 244.3.160.239 TCP 64 4541 > http [FIN, ACK] Seq=1670 Ack=933 Win=64604 Len=0
175160  58.241810 244.3.246.71 -> 244.3.160.239 TCP 64 watchdoc > http [ACK] Seq=1536 Ack=378 Win=65159 Len=0
175163  58.242199 244.3.246.71 -> 244.3.160.239 TCP 64 watchdoc > http [FIN, ACK] Seq=1536 Ack=378 Win=65159 Len=0
175174  58.243830 244.3.246.71 -> 244.3.160.239 TCP 66 16121 > http [SYN] Seq=0 Win=65535 Len=0 MSS=1260 SACK_PERM=1
175190  58.244859 244.3.246.71 -> 244.3.160.239 TCP 64 16121 > http [ACK] Seq=1 Ack=1 Win=65535 Len=0
177445  59.550852 244.3.246.71 -> 244.3.160.239 TCP 64 16121 > http [ACK] Seq=1432 Ack=2050 Win=65535 Len=0
177498  59.579856 244.3.246.71 -> 244.3.160.239 TCP 64 16121 > http [ACK] Seq=1432 Ack=4348 Win=65535 Len=0
177500  59.581603 244.3.246.71 -> 244.3.160.239 TCP 64 16121 > http [ACK] Seq=1432 Ack=6115 Win=65535 Len=0
177504  59.583390 244.3.246.71 -> 244.3.160.239 TCP 64 16121 > http [ACK] Seq=1432 Ack=8401 Win=65535 Len=0
177540  59.610873 244.3.246.71 -> 244.3.160.239 TCP 66 11280 > http [SYN] Seq=0 Win=65535 Len=0 MSS=1260 SACK_PERM=1
177542  59.611336 244.3.246.71 -> 244.3.160.239 TCP 64 16121 > http [ACK] Seq=1432 Ack=9730 Win=65535 Len=0
177544  59.611796 244.3.246.71 -> 244.3.160.239 TCP 64 11280 > http [ACK] Seq=1 Ack=1 Win=65535 Len=0
177551  59.615956 244.3.246.71 -> 244.3.160.239 TCP 64 16121 > http [ACK] Seq=1432 Ack=11779 Win=65535 Len=0
177556  59.617622 244.3.246.71 -> 244.3.160.239 TCP 64 16121 > http [ACK] Seq=1432 Ack=13993 Win=65535 Len=0
177566  59.625518 244.3.246.71 -> 244.3.160.239 TCP 64 16121 > http [ACK] Seq=1432 Ack=15710 Win=65535 Len=0
177567  59.625522 244.3.246.71 -> 244.3.160.239 TCP 64 16121 > http [ACK] Seq=1432 Ack=16706 Win=64539 Len=0
177571  59.632897 244.3.246.71 -> 244.3.160.239 TCP 66 7635 > http [SYN] Seq=0 Win=65535 Len=0 MSS=1260 SACK_PERM=1
177577  59.633802 244.3.246.71 -> 244.3.160.239 TCP 64 7635 > http [ACK] Seq=1 Ack=1 Win=65535 Len=0
177604  59.643538 244.3.246.71 -> 244.3.160.239 TCP 64 16121 > http [ACK] Seq=1432 Ack=18758 Win=65535 Len=0
177612  59.646851 244.3.246.71 -> 244.3.160.239 TCP 64 16121 > http [ACK] Seq=1432 Ack=20861 Win=65535 Len=0
177617  59.648059 244.3.246.71 -> 244.3.160.239 TCP 64 16121 > http [ACK] Seq=1432 Ack=22931 Win=65535 Len=0
177624  59.649275 244.3.246.71 -> 244.3.160.239 TCP 64 16121 > http [ACK] Seq=1432 Ack=24980 Win=65535 Len=0
177638  59.656376 244.3.246.71 -> 244.3.160.239 TCP 64 16121 > http [ACK] Seq=1432 Ack=26254 Win=65535 Len=0
177639  59.657659 244.3.246.71 -> 244.3.160.239 TCP 64 16121 > http [ACK] Seq=1432 Ack=27997 Win=65535 Len=0
177692  59.675888 244.3.246.71 -> 244.3.160.239 TCP 64 16121 > http [ACK] Seq=1432 Ack=30269 Win=65535 Len=0
177699  59.677578 244.3.246.71 -> 244.3.160.239 TCP 64 16121 > http [ACK] Seq=1432 Ack=32480 Win=65535 Len=0
177703  59.679196 244.3.246.71 -> 244.3.160.239 TCP 64 16121 > http [ACK] Seq=1432 Ack=34546 Win=65535 Len=0
177709  59.680914 244.3.246.71 -> 244.3.160.239 TCP 64 16121 > http [ACK] Seq=1432 Ack=36652 Win=65535 Len=0
177712  59.682530 244.3.246.71 -> 244.3.160.239 TCP 64 16121 > http [ACK] Seq=1432 Ack=38703 Win=65535 Len=0
177717  59.684082 244.3.246.71 -> 244.3.160.239 TCP 64 16121 > http [ACK] Seq=1432 Ack=40636 Win=65535 Len=0
177735  59.689870 244.3.246.71 -> 244.3.160.239 TCP 64 16121 > http [ACK] Seq=1432 Ack=42685 Win=65535 Len=0
177749  59.692579 244.3.246.71 -> 244.3.160.239 TCP 64 16121 > http [ACK] Seq=1432 Ack=44498 Win=65535 Len=0
177750  59.692584 244.3.246.71 -> 244.3.160.239 TCP 64 11280 > http [ACK] Seq=1430 Ack=2050 Win=65535 Len=0
177753  59.695198 244.3.246.71 -> 244.3.160.239 TCP 64 11280 > http [ACK] Seq=1430 Ack=4382 Win=65535 Len=0
177774  59.704966 244.3.246.71 -> 244.3.160.239 TCP 64 16121 > http [ACK] Seq=1432 Ack=45983 Win=65535 Len=0
177787  59.707986 244.3.246.71 -> 244.3.160.239 TCP 64 16121 > http [ACK] Seq=1432 Ack=48032 Win=65535 Len=0
177793  59.709486 244.3.246.71 -> 244.3.160.239 TCP 64 16121 > http [ACK] Seq=1432 Ack=50081 Win=65535 Len=0
177799  59.711050 244.3.246.71 -> 244.3.160.239 TCP 64 16121 > http [ACK] Seq=1432 Ack=52146 Win=65535 Len=0
177817  59.712446 244.3.246.71 -> 244.3.160.239 TCP 64 16121 > http [ACK] Seq=1432 Ack=54195 Win=65535 Len=0
177832  59.718375 244.3.246.71 -> 244.3.160.239 TCP 64 16121 > http [ACK] Seq=1432 Ack=56300 Win=65535 Len=0
177833  59.718380 244.3.246.71 -> 244.3.160.239 TCP 64 16121 > http [ACK] Seq=1432 Ack=58349 Win=65535 Len=0
177834  59.718409 244.3.246.71 -> 244.3.160.239 TCP 64 16121 > http [ACK] Seq=1432 Ack=60442 Win=65535 Len=0
177840  59.719452 244.3.246.71 -> 244.3.160.239 TCP 64 16121 > http [ACK] Seq=1432 Ack=62595 Win=65535 Len=0
177849  59.721059 244.3.246.71 -> 244.3.160.239 TCP 64 16121 > http [ACK] Seq=1432 Ack=64796 Win=65535 Len=0
177857  59.722758 244.3.246.71 -> 244.3.160.239 TCP 64 7635 > http [ACK] Seq=1419 Ack=2050 Win=65535 Len=0
177861  59.723484 244.3.246.71 -> 244.3.160.239 TCP 64 11280 > http [ACK] Seq=1430 Ack=6431 Win=65535 Len=0
177862  59.723800 244.3.246.71 -> 244.3.160.239 TCP 64 7635 > http [ACK] Seq=1419 Ack=4099 Win=65535 Len=0
177900  59.734886 244.3.246.71 -> 244.3.160.239 TCP 64 11280 > http [ACK] Seq=1430 Ack=8579 Win=65535 Len=0
177902  59.735193 244.3.246.71 -> 244.3.160.239 TCP 70 [TCP Dup ACK 177900#1] 11280 > http [ACK] Seq=1430 Ack=8579 Win=65535 Len=0 SLE=9368 SRE=9640
177903  59.735197 244.3.246.71 -> 244.3.160.239 TCP 64 11280 > http [ACK] Seq=1430 Ack=9640 Win=64474 Len=0
177904  59.735239 244.3.246.71 -> 244.3.160.239 TCP 64 16121 > http [ACK] Seq=1432 Ack=66652 Win=65535 Len=0
177907  59.735608 244.3.246.71 -> 244.3.160.239 TCP 64 16121 > http [ACK] Seq=1432 Ack=67989 Win=65535 Len=0
177914  59.737435 244.3.246.71 -> 244.3.160.239 TCP 64 16121 > http [ACK] Seq=1432 Ack=70038 Win=65535 Len=0
177919  59.739310 244.3.246.71 -> 244.3.160.239 TCP 64 16121 > http [ACK] Seq=1432 Ack=72286 Win=65535 Len=0
177937  59.742145 244.3.246.71 -> 244.3.160.239 TCP 64 16121 > http [ACK] Seq=1432 Ack=74374 Win=65535 Len=0
177941  59.743161 244.3.246.71 -> 244.3.160.239 TCP 64 16121 > http [ACK] Seq=1432 Ack=76504 Win=65535 Len=0
177949  59.745314 244.3.246.71 -> 244.3.160.239 TCP 64 16121 > http [ACK] Seq=1432 Ack=78730 Win=65535 Len=0
177955  59.747183 244.3.246.71 -> 244.3.160.239 TCP 64 16121 > http [ACK] Seq=1432 Ack=80779 Win=65535 Len=0
177960  59.748507 244.3.246.71 -> 244.3.160.239 TCP 64 16121 > http [ACK] Seq=1432 Ack=82828 Win=65535 Len=0
177966  59.750085 244.3.246.71 -> 244.3.160.239 TCP 64 16121 > http [ACK] Seq=1432 Ack=84877 Win=65535 Len=0
177970  59.751532 244.3.246.71 -> 244.3.160.239 TCP 64 16121 > http [ACK] Seq=1432 Ack=86926 Win=65535 Len=0
177981  59.753196 244.3.246.71 -> 244.3.160.239 TCP 64 16121 > http [ACK] Seq=1432 Ack=88975 Win=65535 Len=0
177989  59.754384 244.3.246.71 -> 244.3.160.239 TCP 64 7635 > http [ACK] Seq=1419 Ack=5659 Win=65535 Len=0
177992  59.754781 244.3.246.71 -> 244.3.160.239 TCP 64 11280 > http [ACK] Seq=1430 Ack=11689 Win=65535 Len=0
178000  59.755581 244.3.246.71 -> 244.3.160.239 TCP 64 7635 > http [ACK] Seq=1419 Ack=7708 Win=65535 Len=0
178001  59.755988 244.3.246.71 -> 244.3.160.239 TCP 64 11280 > http [ACK] Seq=1430 Ack=13666 Win=65535 Len=0
178002  59.756250 244.3.246.71 -> 244.3.160.239 TCP 64 7635 > http [ACK] Seq=1419 Ack=9630 Win=65535 Len=0
178003  59.756282 244.3.246.71 -> 244.3.160.239 TCP 64 11280 > http [ACK] Seq=1430 Ack=13667 Win=65535 Len=0
178004  59.759104 244.3.246.71 -> 244.3.160.239 TCP 64 11280 > http [FIN, ACK] Seq=1430 Ack=13667 Win=65535 Len=0
178012  59.765372 244.3.246.71 -> 244.3.160.239 TCP 64 16121 > http [ACK] Seq=1432 Ack=90600 Win=65535 Len=0
178013  59.765376 244.3.246.71 -> 244.3.160.239 TCP 64 16121 > http [ACK] Seq=1432 Ack=91730 Win=64405 Len=0
178026  59.769375 244.3.246.71 -> 244.3.160.239 TCP 64 16121 > http [ACK] Seq=1432 Ack=93779 Win=65535 Len=0
178035  59.772624 244.3.246.71 -> 244.3.160.239 TCP 64 16121 > http [ACK] Seq=1432 Ack=95908 Win=65535 Len=0
178040  59.773785 244.3.246.71 -> 244.3.160.239 TCP 64 16121 > http [ACK] Seq=1432 Ack=97957 Win=65535 Len=0
178044  59.775353 244.3.246.71 -> 244.3.160.239 TCP 64 16121 > http [ACK] Seq=1432 Ack=100006 Win=65535 Len=0
178063  59.776923 244.3.246.71 -> 244.3.160.239 TCP 64 16121 > http [ACK] Seq=1432 Ack=102057 Win=65535 Len=0
178074  59.778817 244.3.246.71 -> 244.3.160.239 TCP 64 16121 > http [ACK] Seq=1432 Ack=104106 Win=65535 Len=0
178077  59.780147 244.3.246.71 -> 244.3.160.239 TCP 64 16121 > http [ACK] Seq=1432 Ack=106155 Win=65535 Len=0
178080  59.781168 244.3.246.71 -> 244.3.160.239 TCP 64 16121 > http [ACK] Seq=1432 Ack=108204 Win=65535 Len=0
178098  59.786719 244.3.246.71 -> 244.3.160.239 TCP 64 7635 > http [ACK] Seq=1419 Ack=11679 Win=65535 Len=0
178103  59.788575 244.3.246.71 -> 244.3.160.239 TCP 64 7635 > http [ACK] Seq=1419 Ack=13847 Win=65535 Len=0
178111  59.791014 244.3.246.71 -> 244.3.160.239 TCP 64 7635 > http [ACK] Seq=1419 Ack=15896 Win=65535 Len=0
178112  59.791018 244.3.246.71 -> 244.3.160.239 TCP 64 7635 > http [ACK] Seq=1419 Ack=17822 Win=65535 Len=0
178175  59.819068 244.3.246.71 -> 244.3.160.239 TCP 64 7635 > http [ACK] Seq=1419 Ack=19871 Win=65535 Len=0
178186  59.821982 244.3.246.71 -> 244.3.160.239 TCP 64 7635 > http [ACK] Seq=1419 Ack=22058 Win=65535 Len=0
178187  59.821986 244.3.246.71 -> 244.3.160.239 TCP 70 [TCP Dup ACK 178186#1] 7635 > http [ACK] Seq=1419 Ack=22058 Win=65535 Len=0 SLE=22847 SRE=22891
178188  59.821991 244.3.246.71 -> 244.3.160.239 TCP 64 7635 > http [ACK] Seq=1419 Ack=22891 Win=64702 Len=0
178189  59.822060 244.3.246.71 -> 244.3.160.239 TCP 64 7635 > http [ACK] Seq=1419 Ack=22892 Win=64702 Len=0
178190  59.822369 244.3.246.71 -> 244.3.160.239 TCP 64 7635 > http [FIN, ACK] Seq=1419 Ack=22892 Win=64702 Len=0
178245  59.838684 244.3.246.71 -> 244.3.160.239 TCP 66 10921 > http [SYN] Seq=0 Win=65535 Len=0 MSS=1260 SACK_PERM=1
178251  59.839897 244.3.246.71 -> 244.3.160.239 TCP 64 10921 > http [ACK] Seq=1 Ack=1 Win=65535 Len=0
178462  59.921320 244.3.246.71 -> 244.3.160.239 TCP 64 10921 > http [ACK] Seq=1367 Ack=2050 Win=65535 Len=0
178467  59.922404 244.3.246.71 -> 244.3.160.239 TCP 64 10921 > http [ACK] Seq=1367 Ack=4099 Win=65535 Len=0
178528  59.954874 244.3.246.71 -> 244.3.160.239 TCP 64 10921 > http [ACK] Seq=1367 Ack=5621 Win=65535 Len=0
178529  59.955171 244.3.246.71 -> 244.3.160.239 TCP 64 10921 > http [ACK] Seq=1367 Ack=7279 Win=65535 Len=0
178548  59.970742 244.3.246.71 -> 244.3.160.239 TCP 64 16121 > http [ACK] Seq=1432 Ack=108264 Win=65475 Len=0
178555  59.974705 244.3.246.71 -> 244.3.160.239 TCP 64 10921 > http [ACK] Seq=1367 Ack=9431 Win=65535 Len=0
178581  59.979137 244.3.246.71 -> 244.3.160.239 TCP 64 16121 > http [ACK] Seq=1432 Ack=110313 Win=65535 Len=0
178584  59.980443 244.3.246.71 -> 244.3.160.239 TCP 64 16121 > http [ACK] Seq=1432 Ack=112362 Win=65535 Len=0
178594  59.981902 244.3.246.71 -> 244.3.160.239 TCP 64 16121 > http [ACK] Seq=1432 Ack=114411 Win=65535 Len=0
178600  59.984139 244.3.246.71 -> 244.3.160.239 TCP 64 16121 > http [ACK] Seq=1432 Ack=116634 Win=65535 Len=0
178606  59.985729 244.3.246.71 -> 244.3.160.239 TCP 64 16121 > http [ACK] Seq=1432 Ack=118683 Win=65535 Len=0
178612  59.987442 244.3.246.71 -> 244.3.160.239 TCP 64 16121 > http [ACK] Seq=1432 Ack=120732 Win=65535 Len=0
178626  59.988463 244.3.246.71 -> 244.3.160.239 TCP 64 10921 > http [ACK] Seq=1367 Ack=10876 Win=65535 Len=0
178628  59.988680 244.3.246.71 -> 244.3.160.239 TCP 64 10921 > http [ACK] Seq=1367 Ack=12569 Win=65535 Len=0
178632  59.989394 244.3.246.71 -> 244.3.160.239 TCP 64 16121 > http [ACK] Seq=1432 Ack=122953 Win=65535 Len=0
178639  59.991297 244.3.246.71 -> 244.3.160.239 TCP 64 16121 > http [ACK] Seq=1432 Ack=125002 Win=65535 Len=0
178676  59.998211 244.3.246.71 -> 244.3.160.239 TCP 64 10921 > http [ACK] Seq=1367 Ack=14618 Win=65535 Len=0
178677  59.998215 244.3.246.71 -> 244.3.160.239 TCP 64 16121 > http [ACK] Seq=1432 Ack=127051 Win=65535 Len=0
178678  59.998219 244.3.246.71 -> 244.3.160.239 TCP 64 10921 > http [ACK] Seq=1367 Ack=16667 Win=65535 Len=0
178679  59.998224 244.3.246.71 -> 244.3.160.239 TCP 64 16121 > http [ACK] Seq=1432 Ack=129100 Win=65535 Len=0
178680  59.998228 244.3.246.71 -> 244.3.160.239 TCP 64 16121 > http [ACK] Seq=1432 Ack=131201 Win=65535 Len=0
178681  59.998287 244.3.246.71 -> 244.3.160.239 TCP 64 16121 > http [ACK] Seq=1432 Ack=133073 Win=65535 Len=0
178715  60.012455 244.3.246.71 -> 244.3.160.239 TCP 64 16121 > http [ACK] Seq=1432 Ack=135122 Win=65535 Len=0
178723  60.014178 244.3.246.71 -> 244.3.160.239 TCP 64 16121 > http [ACK] Seq=1432 Ack=137171 Win=65535 Len=0
178724  60.014307 244.3.246.71 -> 244.3.160.239 TCP 64 16121 > http [ACK] Seq=1432 Ack=137457 Win=65250 Len=0
178737  60.021744 244.3.246.71 -> 244.3.160.239 TCP 64 10921 > http [ACK] Seq=1367 Ack=19057 Win=65535 Len=0
178740  60.022066 244.3.246.71 -> 244.3.160.239 TCP 64 10921 > http [ACK] Seq=1367 Ack=20761 Win=65535 Len=0
178748  60.024801 244.3.246.71 -> 244.3.160.239 TCP 64 10921 > http [ACK] Seq=1367 Ack=22810 Win=65535 Len=0
178753  60.025888 244.3.246.71 -> 244.3.160.239 TCP 64 10921 > http [ACK] Seq=1367 Ack=24562 Win=65535 Len=0
178757  60.027340 244.3.246.71 -> 244.3.160.239 TCP 64 10921 > http [ACK] Seq=1367 Ack=25424 Win=64674 Len=0
178758  60.027460 244.3.246.71 -> 244.3.160.239 TCP 64 10921 > http [FIN, ACK] Seq=1367 Ack=25424 Win=64674 Len=0
178773  60.046597 244.3.246.71 -> 244.3.160.239 TCP 64 16121 > http [FIN, ACK] Seq=1432 Ack=137457 Win=65250 Len=0
178775  60.048528 244.3.246.71 -> 244.3.160.239 TCP 66 5960 > http [SYN] Seq=0 Win=65535 Len=0 MSS=1260 SACK_PERM=1
178777  60.049225 244.3.246.71 -> 244.3.160.239 TCP 64 5960 > http [ACK] Seq=1 Ack=1 Win=65535 Len=0
