30820  12.867100 244.3.79.163 -> 41.177.98.220 TCP 437 mc-client > ups-onlinet [PSH, ACK] Seq=1 Ack=1 Win=65535 Len=379
30821  12.867105 244.3.79.163 -> 41.177.98.220 TCP 594 [TCP Out-Of-Order] mc-client > ups-onlinet [ACK] Seq=4294966761 Ack=1 Win=65535 Len=536
31005  12.988293 244.3.79.163 -> 41.177.98.220 TCP 64 mc-client > ups-onlinet [ACK] Seq=380 Ack=933 Win=65535 Len=0
31012  12.996660 244.3.79.163 -> 41.177.98.220 TCP 594 mc-client > ups-onlinet [ACK] Seq=380 Ack=933 Win=65535 Len=536
31013  12.996665 244.3.79.163 -> 41.177.98.220 TCP 455 mc-client > ups-onlinet [PSH, ACK] Seq=916 Ack=933 Win=65535 Len=397
31031  13.007201 244.3.79.163 -> 41.177.98.220 TCP 594 mc-client > ups-onlinet [ACK] Seq=1313 Ack=1013 Win=65455 Len=536
31032  13.007206 244.3.79.163 -> 41.177.98.220 TCP 442 mc-client > ups-onlinet [PSH, ACK] Seq=1849 Ack=1013 Win=65455 Len=384
31406  13.288623 244.3.79.163 -> 41.177.98.220 TCP 64 mc-client > ups-onlinet [ACK] Seq=2233 Ack=2216 Win=65535 Len=0
33272  14.083841 244.3.79.163 -> 41.177.98.220 TCP 594 mc-client > ups-onlinet [ACK] Seq=2233 Ack=2216 Win=65535 Len=536
33273  14.083846 244.3.79.163 -> 41.177.98.220 TCP 500 mc-client > ups-onlinet [PSH, ACK] Seq=2769 Ack=2216 Win=65535 Len=442
35023  14.690652 244.3.79.163 -> 41.177.98.220 TCP 64 mc-client > ups-onlinet [ACK] Seq=3211 Ack=3378 Win=65535 Len=0
39488  16.365412 244.3.79.163 -> 41.177.98.220 TCP 151 mc-client > ups-onlinet [PSH, ACK] Seq=3211 Ack=3378 Win=65535 Len=93
39524  16.392693 244.3.79.163 -> 41.177.98.220 TCP 64 mc-client > ups-onlinet [ACK] Seq=3304 Ack=6138 Win=65535 Len=0
39525  16.392880 244.3.79.163 -> 41.177.98.220 TCP 64 mc-client > ups-onlinet [ACK] Seq=3304 Ack=8668 Win=65535 Len=0
39610  16.486540 244.3.79.163 -> 41.177.98.220 TCP 129 mc-client > ups-onlinet [PSH, ACK] Seq=3304 Ack=8668 Win=65535 Len=71
39615  16.489018 244.3.79.163 -> 41.177.98.220 TCP 64 mc-client > ups-onlinet [ACK] Seq=3375 Ack=11428 Win=65535 Len=0
39616  16.489192 244.3.79.163 -> 41.177.98.220 TCP 64 mc-client > ups-onlinet [ACK] Seq=3375 Ack=13550 Win=65535 Len=0
39669  16.504920 244.3.79.163 -> 41.177.98.220 TCP 130 mc-client > ups-onlinet [PSH, ACK] Seq=3375 Ack=13550 Win=65535 Len=72
39675  16.506994 244.3.79.163 -> 41.177.98.220 TCP 64 mc-client > ups-onlinet [ACK] Seq=3447 Ack=16310 Win=65535 Len=0
39676  16.507192 244.3.79.163 -> 41.177.98.220 TCP 64 mc-client > ups-onlinet [ACK] Seq=3447 Ack=18675 Win=65535 Len=0
39682  16.511312 244.3.79.163 -> 41.177.98.220 TCP 130 mc-client > ups-onlinet [PSH, ACK] Seq=3447 Ack=18675 Win=65535 Len=72
39687  16.513303 244.3.79.163 -> 41.177.98.220 TCP 64 mc-client > ups-onlinet [ACK] Seq=3519 Ack=21435 Win=65535 Len=0
39688  16.513485 244.3.79.163 -> 41.177.98.220 TCP 64 mc-client > ups-onlinet [ACK] Seq=3519 Ack=23552 Win=65535 Len=0
39694  16.517790 244.3.79.163 -> 41.177.98.220 TCP 130 mc-client > ups-onlinet [PSH, ACK] Seq=3519 Ack=23552 Win=65535 Len=72
39701  16.519898 244.3.79.163 -> 41.177.98.220 TCP 64 mc-client > ups-onlinet [ACK] Seq=3591 Ack=26312 Win=65535 Len=0
39702  16.520090 244.3.79.163 -> 41.177.98.220 TCP 64 mc-client > ups-onlinet [ACK] Seq=3591 Ack=28716 Win=65535 Len=0
39709  16.524854 244.3.79.163 -> 41.177.98.220 TCP 130 mc-client > ups-onlinet [PSH, ACK] Seq=3591 Ack=28716 Win=65535 Len=72
39725  16.526865 244.3.79.163 -> 41.177.98.220 TCP 64 mc-client > ups-onlinet [ACK] Seq=3663 Ack=31476 Win=65535 Len=0
39726  16.527070 244.3.79.163 -> 41.177.98.220 TCP 64 mc-client > ups-onlinet [ACK] Seq=3663 Ack=33886 Win=65535 Len=0
39763  16.531368 244.3.79.163 -> 41.177.98.220 TCP 130 mc-client > ups-onlinet [PSH, ACK] Seq=3663 Ack=33886 Win=65535 Len=72
39778  16.533384 244.3.79.163 -> 41.177.98.220 TCP 64 mc-client > ups-onlinet [ACK] Seq=3735 Ack=36646 Win=65535 Len=0
39779  16.533594 244.3.79.163 -> 41.177.98.220 TCP 64 mc-client > ups-onlinet [ACK] Seq=3735 Ack=39157 Win=65535 Len=0
39782  16.537741 244.3.79.163 -> 41.177.98.220 TCP 130 mc-client > ups-onlinet [PSH, ACK] Seq=3735 Ack=39157 Win=65535 Len=72
39790  16.539816 244.3.79.163 -> 41.177.98.220 TCP 64 mc-client > ups-onlinet [ACK] Seq=3807 Ack=41917 Win=65535 Len=0
39791  16.540006 244.3.79.163 -> 41.177.98.220 TCP 64 mc-client > ups-onlinet [ACK] Seq=3807 Ack=44470 Win=65535 Len=0
39801  16.544535 244.3.79.163 -> 41.177.98.220 TCP 130 mc-client > ups-onlinet [PSH, ACK] Seq=3807 Ack=44470 Win=65535 Len=72
39806  16.546565 244.3.79.163 -> 41.177.98.220 TCP 64 mc-client > ups-onlinet [ACK] Seq=3879 Ack=47230 Win=65535 Len=0
39807  16.546755 244.3.79.163 -> 41.177.98.220 TCP 64 mc-client > ups-onlinet [ACK] Seq=3879 Ack=49813 Win=65535 Len=0
39827  16.550883 244.3.79.163 -> 41.177.98.220 TCP 130 mc-client > ups-onlinet [PSH, ACK] Seq=3879 Ack=49813 Win=65535 Len=72
39842  16.552887 244.3.79.163 -> 41.177.98.220 TCP 64 mc-client > ups-onlinet [ACK] Seq=3951 Ack=52573 Win=65535 Len=0
39843  16.553086 244.3.79.163 -> 41.177.98.220 TCP 64 mc-client > ups-onlinet [ACK] Seq=3951 Ack=54906 Win=65535 Len=0
39853  16.557464 244.3.79.163 -> 41.177.98.220 TCP 130 mc-client > ups-onlinet [PSH, ACK] Seq=3951 Ack=54906 Win=65535 Len=72
40083  16.693505 244.3.79.163 -> 41.177.98.220 TCP 64 mc-client > ups-onlinet [ACK] Seq=4023 Ack=55226 Win=65215 Len=0
429119 140.384941 244.3.79.163 -> 41.177.98.220 TCP 132 mc-client > ups-onlinet [PSH, ACK] Seq=4023 Ack=55226 Win=65215 Len=74
429228 140.408266 244.3.79.163 -> 41.177.98.220 TCP 132 mc-client > ups-onlinet [PSH, ACK] Seq=4097 Ack=55702 Win=65535 Len=74
429568 140.466063 244.3.79.163 -> 41.177.98.220 TCP 64 mc-client > ups-onlinet [ACK] Seq=4171 Ack=57463 Win=65535 Len=0
525544 170.665770 244.3.79.163 -> 41.177.98.220 TCP 594 mc-client > ups-onlinet [ACK] Seq=4171 Ack=57463 Win=65535 Len=536
525545 170.665813 244.3.79.163 -> 41.177.98.220 TCP 594 mc-client > ups-onlinet [ACK] Seq=4707 Ack=57463 Win=65535 Len=536
525546 170.665818 244.3.79.163 -> 41.177.98.220 TCP 117 mc-client > ups-onlinet [PSH, ACK] Seq=5243 Ack=57463 Win=65535 Len=59
525791 170.813558 244.3.79.163 -> 41.177.98.220 TCP 64 mc-client > ups-onlinet [ACK] Seq=5302 Ack=58611 Win=65535 Len=0
525805 170.830637 244.3.79.163 -> 41.177.98.220 TCP 594 mc-client > ups-onlinet [ACK] Seq=5302 Ack=58611 Win=65535 Len=536
525806 170.830680 244.3.79.163 -> 41.177.98.220 TCP 594 mc-client > ups-onlinet [ACK] Seq=5838 Ack=58611 Win=65535 Len=536
525807 170.830685 244.3.79.163 -> 41.177.98.220 TCP 135 mc-client > ups-onlinet [PSH, ACK] Seq=6374 Ack=58611 Win=65535 Len=77
525819 170.841559 244.3.79.163 -> 41.177.98.220 TCP 594 mc-client > ups-onlinet [ACK] Seq=6451 Ack=58691 Win=65455 Len=536
525820 170.841612 244.3.79.163 -> 41.177.98.220 TCP 594 mc-client > ups-onlinet [ACK] Seq=6987 Ack=58691 Win=65455 Len=536
525821 170.841617 244.3.79.163 -> 41.177.98.220 TCP 122 mc-client > ups-onlinet [PSH, ACK] Seq=7523 Ack=58691 Win=65455 Len=64
526394 171.113914 244.3.79.163 -> 41.177.98.220 TCP 64 mc-client > ups-onlinet [ACK] Seq=7587 Ack=59723 Win=65535 Len=0
527423 171.386350 244.3.79.163 -> 41.177.98.220 TCP 594 mc-client > ups-onlinet [ACK] Seq=7587 Ack=59723 Win=65535 Len=536
527424 171.386401 244.3.79.163 -> 41.177.98.220 TCP 594 mc-client > ups-onlinet [ACK] Seq=8123 Ack=59723 Win=65535 Len=536
527425 171.386406 244.3.79.163 -> 41.177.98.220 TCP 180 mc-client > ups-onlinet [PSH, ACK] Seq=8659 Ack=59723 Win=65535 Len=122
528676 171.797338 244.3.79.163 -> 41.177.98.220 TCP 64 mc-client > ups-onlinet [ACK] Seq=8781 Ack=61247 Win=65535 Len=0
554650 178.552567 244.3.79.163 -> 41.177.98.220 TCP 132 mc-client > ups-onlinet [PSH, ACK] Seq=8781 Ack=61247 Win=65535 Len=74
554728 178.587678 244.3.79.163 -> 41.177.98.220 TCP 132 mc-client > ups-onlinet [PSH, ACK] Seq=8855 Ack=61720 Win=65062 Len=74
554779 178.607856 244.3.79.163 -> 41.177.98.220 TCP 64 mc-client > ups-onlinet [ACK] Seq=8929 Ack=63471 Win=65535 Len=0
589236 187.793552 244.3.79.163 -> 41.177.98.220 TCP 594 mc-client > ups-onlinet [ACK] Seq=8929 Ack=63471 Win=65535 Len=536
589237 187.793591 244.3.79.163 -> 41.177.98.220 TCP 594 mc-client > ups-onlinet [ACK] Seq=9465 Ack=63471 Win=65535 Len=536
589238 187.793596 244.3.79.163 -> 41.177.98.220 TCP 110 mc-client > ups-onlinet [PSH, ACK] Seq=10001 Ack=63471 Win=65535 Len=52
589532 187.938018 244.3.79.163 -> 41.177.98.220 TCP 64 mc-client > ups-onlinet [ACK] Seq=10053 Ack=64612 Win=65535 Len=0
589607 187.959747 244.3.79.163 -> 41.177.98.220 TCP 594 mc-client > ups-onlinet [ACK] Seq=10053 Ack=64612 Win=65535 Len=536
589608 187.959798 244.3.79.163 -> 41.177.98.220 TCP 594 mc-client > ups-onlinet [ACK] Seq=10589 Ack=64612 Win=65535 Len=536
589609 187.959803 244.3.79.163 -> 41.177.98.220 TCP 128 mc-client > ups-onlinet [PSH, ACK] Seq=11125 Ack=64612 Win=65535 Len=70
589720 187.970529 244.3.79.163 -> 41.177.98.220 TCP 594 mc-client > ups-onlinet [ACK] Seq=11195 Ack=64692 Win=65455 Len=536
589722 187.970583 244.3.79.163 -> 41.177.98.220 TCP 594 mc-client > ups-onlinet [ACK] Seq=11731 Ack=64692 Win=65455 Len=536
589723 187.970587 244.3.79.163 -> 41.177.98.220 TCP 115 mc-client > ups-onlinet [PSH, ACK] Seq=12267 Ack=64692 Win=65455 Len=57
590820 188.238355 244.3.79.163 -> 41.177.98.220 TCP 64 mc-client > ups-onlinet [ACK] Seq=12324 Ack=65705 Win=65535 Len=0
593921 188.506186 244.3.79.163 -> 41.177.98.220 TCP 594 mc-client > ups-onlinet [ACK] Seq=12324 Ack=65705 Win=65535 Len=536
593922 188.506240 244.3.79.163 -> 41.177.98.220 TCP 594 mc-client > ups-onlinet [ACK] Seq=12860 Ack=65705 Win=65535 Len=536
593923 188.506245 244.3.79.163 -> 41.177.98.220 TCP 173 mc-client > ups-onlinet [PSH, ACK] Seq=13396 Ack=65705 Win=65535 Len=115
595978 188.845578 244.3.79.163 -> 41.177.98.220 TCP 64 mc-client > ups-onlinet [ACK] Seq=13511 Ack=67218 Win=65535 Len=0
613400 194.616352 244.3.79.163 -> 41.177.98.220 TCP 132 mc-client > ups-onlinet [PSH, ACK] Seq=13511 Ack=67218 Win=65535 Len=74
613450 194.640114 244.3.79.163 -> 41.177.98.220 TCP 132 mc-client > ups-onlinet [PSH, ACK] Seq=13585 Ack=67712 Win=65041 Len=74
613761 194.722612 244.3.79.163 -> 41.177.98.220 TCP 64 mc-client > ups-onlinet [ACK] Seq=13659 Ack=69598 Win=65535 Len=0
658617 206.161537 244.3.79.163 -> 41.177.98.220 TCP 594 mc-client > ups-onlinet [ACK] Seq=13659 Ack=69598 Win=65535 Len=536
658618 206.161573 244.3.79.163 -> 41.177.98.220 TCP 594 mc-client > ups-onlinet [ACK] Seq=14195 Ack=69598 Win=65535 Len=536
658619 206.161578 244.3.79.163 -> 41.177.98.220 TCP 208 mc-client > ups-onlinet [PSH, ACK] Seq=14731 Ack=69598 Win=65535 Len=150
660964 206.337202 244.3.79.163 -> 41.177.98.220 TCP 594 mc-client > ups-onlinet [ACK] Seq=14881 Ack=70837 Win=65535 Len=536
660965 206.337235 244.3.79.163 -> 41.177.98.220 TCP 594 mc-client > ups-onlinet [ACK] Seq=15417 Ack=70837 Win=65535 Len=536
660966 206.337239 244.3.79.163 -> 41.177.98.220 TCP 226 mc-client > ups-onlinet [PSH, ACK] Seq=15953 Ack=70837 Win=65535 Len=168
661111 206.347384 244.3.79.163 -> 41.177.98.220 TCP 594 mc-client > ups-onlinet [ACK] Seq=16121 Ack=70917 Win=65455 Len=536
661114 206.347434 244.3.79.163 -> 41.177.98.220 TCP 594 mc-client > ups-onlinet [ACK] Seq=16657 Ack=70917 Win=65455 Len=536
661115 206.347439 244.3.79.163 -> 41.177.98.220 TCP 213 mc-client > ups-onlinet [PSH, ACK] Seq=17193 Ack=70917 Win=65455 Len=155
662776 206.564536 244.3.79.163 -> 41.177.98.220 TCP 64 mc-client > ups-onlinet [ACK] Seq=17348 Ack=71993 Win=65535 Len=0
664583 206.858124 244.3.79.163 -> 41.177.98.220 TCP 594 mc-client > ups-onlinet [ACK] Seq=17348 Ack=71993 Win=65535 Len=536
664584 206.858214 244.3.79.163 -> 41.177.98.220 TCP 594 mc-client > ups-onlinet [ACK] Seq=17884 Ack=71993 Win=65535 Len=536
664585 206.858219 244.3.79.163 -> 41.177.98.220 TCP 271 mc-client > ups-onlinet [PSH, ACK] Seq=18420 Ack=71993 Win=65535 Len=213
665746 207.253431 244.3.79.163 -> 41.177.98.220 TCP 64 mc-client > ups-onlinet [ACK] Seq=18633 Ack=73642 Win=65535 Len=0
670195 208.752914 244.3.79.163 -> 41.177.98.220 TCP 151 mc-client > ups-onlinet [PSH, ACK] Seq=18633 Ack=73642 Win=65535 Len=93
670235 208.768724 244.3.79.163 -> 41.177.98.220 TCP 64 mc-client > ups-onlinet [ACK] Seq=18726 Ack=76402 Win=65535 Len=0
670237 208.768923 244.3.79.163 -> 41.177.98.220 TCP 64 mc-client > ups-onlinet [ACK] Seq=18726 Ack=78932 Win=65535 Len=0
670614 208.862459 244.3.79.163 -> 41.177.98.220 TCP 129 mc-client > ups-onlinet [PSH, ACK] Seq=18726 Ack=78932 Win=65535 Len=71
670623 208.864599 244.3.79.163 -> 41.177.98.220 TCP 64 mc-client > ups-onlinet [ACK] Seq=18797 Ack=81692 Win=65535 Len=0
670624 208.864780 244.3.79.163 -> 41.177.98.220 TCP 64 mc-client > ups-onlinet [ACK] Seq=18797 Ack=83814 Win=65535 Len=0
670640 208.880723 244.3.79.163 -> 41.177.98.220 TCP 130 mc-client > ups-onlinet [PSH, ACK] Seq=18797 Ack=83814 Win=65535 Len=72
670645 208.882755 244.3.79.163 -> 41.177.98.220 TCP 64 mc-client > ups-onlinet [ACK] Seq=18869 Ack=86574 Win=65535 Len=0
670646 208.882948 244.3.79.163 -> 41.177.98.220 TCP 64 mc-client > ups-onlinet [ACK] Seq=18869 Ack=88939 Win=65535 Len=0
670648 208.887230 244.3.79.163 -> 41.177.98.220 TCP 130 mc-client > ups-onlinet [PSH, ACK] Seq=18869 Ack=88939 Win=65535 Len=72
670654 208.889235 244.3.79.163 -> 41.177.98.220 TCP 64 mc-client > ups-onlinet [ACK] Seq=18941 Ack=91699 Win=65535 Len=0
670655 208.889457 244.3.79.163 -> 41.177.98.220 TCP 64 mc-client > ups-onlinet [ACK] Seq=18941 Ack=93816 Win=65535 Len=0
670657 208.893622 244.3.79.163 -> 41.177.98.220 TCP 130 mc-client > ups-onlinet [PSH, ACK] Seq=18941 Ack=93816 Win=65535 Len=72
670662 208.895684 244.3.79.163 -> 41.177.98.220 TCP 64 mc-client > ups-onlinet [ACK] Seq=19013 Ack=96576 Win=65535 Len=0
670663 208.895890 244.3.79.163 -> 41.177.98.220 TCP 64 mc-client > ups-onlinet [ACK] Seq=19013 Ack=99076 Win=65535 Len=0
670701 208.900336 244.3.79.163 -> 41.177.98.220 TCP 130 mc-client > ups-onlinet [PSH, ACK] Seq=19013 Ack=99076 Win=65535 Len=72
670717 208.902308 244.3.79.163 -> 41.177.98.220 TCP 64 mc-client > ups-onlinet [ACK] Seq=19085 Ack=101836 Win=65535 Len=0
670718 208.902514 244.3.79.163 -> 41.177.98.220 TCP 64 mc-client > ups-onlinet [ACK] Seq=19085 Ack=104217 Win=65535 Len=0
670748 208.906623 244.3.79.163 -> 41.177.98.220 TCP 130 mc-client > ups-onlinet [PSH, ACK] Seq=19085 Ack=104217 Win=65535 Len=72
670758 208.908648 244.3.79.163 -> 41.177.98.220 TCP 64 mc-client > ups-onlinet [ACK] Seq=19157 Ack=106977 Win=65535 Len=0
670759 208.908815 244.3.79.163 -> 41.177.98.220 TCP 64 mc-client > ups-onlinet [ACK] Seq=19157 Ack=109561 Win=65535 Len=0
670768 208.913149 244.3.79.163 -> 41.177.98.220 TCP 130 mc-client > ups-onlinet [PSH, ACK] Seq=19157 Ack=109561 Win=65535 Len=72
670787 208.915177 244.3.79.163 -> 41.177.98.220 TCP 64 mc-client > ups-onlinet [ACK] Seq=19229 Ack=112321 Win=65535 Len=0
670789 208.915400 244.3.79.163 -> 41.177.98.220 TCP 64 mc-client > ups-onlinet [ACK] Seq=19229 Ack=114823 Win=65535 Len=0
670802 208.920068 244.3.79.163 -> 41.177.98.220 TCP 130 mc-client > ups-onlinet [PSH, ACK] Seq=19229 Ack=114823 Win=65535 Len=72
670810 208.922028 244.3.79.163 -> 41.177.98.220 TCP 64 mc-client > ups-onlinet [ACK] Seq=19301 Ack=117583 Win=65535 Len=0
670811 208.922244 244.3.79.163 -> 41.177.98.220 TCP 64 mc-client > ups-onlinet [ACK] Seq=19301 Ack=120081 Win=65535 Len=0
670815 208.926516 244.3.79.163 -> 41.177.98.220 TCP 130 mc-client > ups-onlinet [PSH, ACK] Seq=19301 Ack=120081 Win=65535 Len=72
670823 208.928460 244.3.79.163 -> 41.177.98.220 TCP 64 mc-client > ups-onlinet [ACK] Seq=19373 Ack=122841 Win=65535 Len=0
670824 208.928633 244.3.79.163 -> 41.177.98.220 TCP 64 mc-client > ups-onlinet [ACK] Seq=19373 Ack=124866 Win=65535 Len=0
782283 253.079772 244.3.79.163 -> 41.177.98.220 TCP 132 mc-client > ups-onlinet [PSH, ACK] Seq=19373 Ack=124866 Win=65535 Len=74
782329 253.103033 244.3.79.163 -> 41.177.98.220 TCP 132 mc-client > ups-onlinet [PSH, ACK] Seq=19447 Ack=125226 Win=65175 Len=74
782472 253.217254 244.3.79.163 -> 41.177.98.220 TCP 64 mc-client > ups-onlinet [ACK] Seq=19521 Ack=127986 Win=65535 Len=0
782674 253.331282 244.3.79.163 -> 41.177.98.220 TCP 64 mc-client > ups-onlinet [ACK] Seq=19521 Ack=128948 Win=65535 Len=0
954046 316.362742 244.3.79.163 -> 41.177.98.220 TCP 594 mc-client > ups-onlinet [ACK] Seq=19521 Ack=128948 Win=65535 Len=536
954047 316.362782 244.3.79.163 -> 41.177.98.220 TCP 594 mc-client > ups-onlinet [ACK] Seq=20057 Ack=128948 Win=65535 Len=536
954048 316.362832 244.3.79.163 -> 41.177.98.220 TCP 594 mc-client > ups-onlinet [ACK] Seq=20593 Ack=128948 Win=65535 Len=536
954049 316.362885 244.3.79.163 -> 41.177.98.220 TCP 594 mc-client > ups-onlinet [ACK] Seq=21129 Ack=128948 Win=65535 Len=536
954050 316.362932 244.3.79.163 -> 41.177.98.220 TCP 594 mc-client > ups-onlinet [ACK] Seq=21665 Ack=128948 Win=65535 Len=536
954051 316.362985 244.3.79.163 -> 41.177.98.220 TCP 594 mc-client > ups-onlinet [ACK] Seq=22201 Ack=128948 Win=65535 Len=536
954052 316.362990 244.3.79.163 -> 41.177.98.220 TCP 253 mc-client > ups-onlinet [PSH, ACK] Seq=22737 Ack=128948 Win=65535 Len=195
954068 316.367854 244.3.79.163 -> 41.177.98.220 TCP 64 mc-client > ups-onlinet [ACK] Seq=22932 Ack=131708 Win=65535 Len=0
954482 316.521509 244.3.79.163 -> 41.177.98.220 TCP 64 mc-client > ups-onlinet [ACK] Seq=22932 Ack=132376 Win=65535 Len=0
955138 316.774928 244.3.79.163 -> 41.177.98.220 TCP 594 mc-client > ups-onlinet [ACK] Seq=22932 Ack=132376 Win=65535 Len=536
955139 316.774976 244.3.79.163 -> 41.177.98.220 TCP 594 mc-client > ups-onlinet [ACK] Seq=23468 Ack=132376 Win=65535 Len=536
955140 316.775027 244.3.79.163 -> 41.177.98.220 TCP 594 mc-client > ups-onlinet [ACK] Seq=24004 Ack=132376 Win=65535 Len=536
955141 316.775075 244.3.79.163 -> 41.177.98.220 TCP 594 mc-client > ups-onlinet [ACK] Seq=24540 Ack=132376 Win=65535 Len=536
955142 316.775136 244.3.79.163 -> 41.177.98.220 TCP 594 mc-client > ups-onlinet [ACK] Seq=25076 Ack=132376 Win=65535 Len=536
955144 316.775177 244.3.79.163 -> 41.177.98.220 TCP 594 mc-client > ups-onlinet [ACK] Seq=25612 Ack=132376 Win=65535 Len=536
955146 316.775186 244.3.79.163 -> 41.177.98.220 TCP 271 mc-client > ups-onlinet [PSH, ACK] Seq=26148 Ack=132376 Win=65535 Len=213
955190 316.788736 244.3.79.163 -> 41.177.98.220 TCP 594 mc-client > ups-onlinet [ACK] Seq=26361 Ack=132456 Win=65455 Len=536
955191 316.788741 244.3.79.163 -> 41.177.98.220 TCP 594 [TCP Previous segment not captured] mc-client > ups-onlinet [ACK] Seq=27433 Ack=132456 Win=65455 Len=536
955192 316.788768 244.3.79.163 -> 41.177.98.220 TCP 594 [TCP Out-Of-Order] mc-client > ups-onlinet [ACK] Seq=26897 Ack=132456 Win=65455 Len=536
955193 316.788772 244.3.79.163 -> 41.177.98.220 TCP 594 mc-client > ups-onlinet [ACK] Seq=27969 Ack=132456 Win=65455 Len=536
955194 316.788807 244.3.79.163 -> 41.177.98.220 TCP 594 mc-client > ups-onlinet [ACK] Seq=28505 Ack=132456 Win=65455 Len=536
955195 316.788852 244.3.79.163 -> 41.177.98.220 TCP 594 mc-client > ups-onlinet [ACK] Seq=29041 Ack=132456 Win=65455 Len=536
955196 316.788856 244.3.79.163 -> 41.177.98.220 TCP 258 mc-client > ups-onlinet [PSH, ACK] Seq=29577 Ack=132456 Win=65455 Len=200
955956 317.071090 244.3.79.163 -> 41.177.98.220 TCP 64 mc-client > ups-onlinet [ACK] Seq=29777 Ack=135216 Win=65535 Len=0
955957 317.071197 244.3.79.163 -> 41.177.98.220 TCP 64 mc-client > ups-onlinet [ACK] Seq=29777 Ack=136731 Win=65535 Len=0
956781 317.610969 244.3.79.163 -> 41.177.98.220 TCP 594 mc-client > ups-onlinet [ACK] Seq=29777 Ack=136731 Win=65535 Len=536
956782 317.611005 244.3.79.163 -> 41.177.98.220 TCP 594 mc-client > ups-onlinet [ACK] Seq=30313 Ack=136731 Win=65535 Len=536
956783 317.611035 244.3.79.163 -> 41.177.98.220 TCP 594 mc-client > ups-onlinet [ACK] Seq=30849 Ack=136731 Win=65535 Len=536
956784 317.611105 244.3.79.163 -> 41.177.98.220 TCP 594 mc-client > ups-onlinet [ACK] Seq=31385 Ack=136731 Win=65535 Len=536
956786 317.611133 244.3.79.163 -> 41.177.98.220 TCP 594 mc-client > ups-onlinet [ACK] Seq=31921 Ack=136731 Win=65535 Len=536
956788 317.611206 244.3.79.163 -> 41.177.98.220 TCP 594 mc-client > ups-onlinet [ACK] Seq=32457 Ack=136731 Win=65535 Len=536
956789 317.611210 244.3.79.163 -> 41.177.98.220 TCP 316 mc-client > ups-onlinet [PSH, ACK] Seq=32993 Ack=136731 Win=65535 Len=258
958763 318.372878 244.3.79.163 -> 41.177.98.220 TCP 64 mc-client > ups-onlinet [ACK] Seq=33251 Ack=139491 Win=65535 Len=0
959164 318.524325 244.3.79.163 -> 41.177.98.220 TCP 64 mc-client > ups-onlinet [ACK] Seq=33251 Ack=140291 Win=65535 Len=0
963860 320.696018 244.3.79.163 -> 41.177.98.220 TCP 151 mc-client > ups-onlinet [PSH, ACK] Seq=33251 Ack=140291 Win=65535 Len=93
963893 320.712565 244.3.79.163 -> 41.177.98.220 TCP 64 mc-client > ups-onlinet [ACK] Seq=33344 Ack=143051 Win=65535 Len=0
963894 320.712763 244.3.79.163 -> 41.177.98.220 TCP 64 mc-client > ups-onlinet [ACK] Seq=33344 Ack=145581 Win=65535 Len=0
964144 320.805975 244.3.79.163 -> 41.177.98.220 TCP 129 mc-client > ups-onlinet [PSH, ACK] Seq=33344 Ack=145581 Win=65535 Len=71
964150 320.808532 244.3.79.163 -> 41.177.98.220 TCP 64 mc-client > ups-onlinet [ACK] Seq=33415 Ack=148341 Win=65535 Len=0
964151 320.808705 244.3.79.163 -> 41.177.98.220 TCP 64 mc-client > ups-onlinet [ACK] Seq=33415 Ack=150463 Win=65535 Len=0
964152 320.823070 244.3.79.163 -> 41.177.98.220 TCP 130 mc-client > ups-onlinet [PSH, ACK] Seq=33415 Ack=150463 Win=65535 Len=72
964159 320.825961 244.3.79.163 -> 41.177.98.220 TCP 64 mc-client > ups-onlinet [ACK] Seq=33487 Ack=153223 Win=65535 Len=0
964160 320.826162 244.3.79.163 -> 41.177.98.220 TCP 64 mc-client > ups-onlinet [ACK] Seq=33487 Ack=155588 Win=65535 Len=0
964164 320.830542 244.3.79.163 -> 41.177.98.220 TCP 130 mc-client > ups-onlinet [PSH, ACK] Seq=33487 Ack=155588 Win=65535 Len=72
964170 320.832531 244.3.79.163 -> 41.177.98.220 TCP 64 mc-client > ups-onlinet [ACK] Seq=33559 Ack=158348 Win=65535 Len=0
964172 320.832715 244.3.79.163 -> 41.177.98.220 TCP 64 mc-client > ups-onlinet [ACK] Seq=33559 Ack=160465 Win=65535 Len=0
964178 320.836977 244.3.79.163 -> 41.177.98.220 TCP 130 mc-client > ups-onlinet [PSH, ACK] Seq=33559 Ack=160465 Win=65535 Len=72
964183 320.839652 244.3.79.163 -> 41.177.98.220 TCP 64 mc-client > ups-onlinet [ACK] Seq=33631 Ack=163225 Win=65535 Len=0
964184 320.839835 244.3.79.163 -> 41.177.98.220 TCP 64 mc-client > ups-onlinet [ACK] Seq=33631 Ack=165725 Win=65535 Len=0
964188 320.844080 244.3.79.163 -> 41.177.98.220 TCP 130 mc-client > ups-onlinet [PSH, ACK] Seq=33631 Ack=165725 Win=65535 Len=72
964195 320.846351 244.3.79.163 -> 41.177.98.220 TCP 64 mc-client > ups-onlinet [ACK] Seq=33703 Ack=168485 Win=65535 Len=0
964197 320.846548 244.3.79.163 -> 41.177.98.220 TCP 64 mc-client > ups-onlinet [ACK] Seq=33703 Ack=170877 Win=65535 Len=0
964211 320.851064 244.3.79.163 -> 41.177.98.220 TCP 130 mc-client > ups-onlinet [PSH, ACK] Seq=33703 Ack=170877 Win=65535 Len=72
964219 320.853737 244.3.79.163 -> 41.177.98.220 TCP 64 mc-client > ups-onlinet [ACK] Seq=33775 Ack=173637 Win=65535 Len=0
964220 320.853923 244.3.79.163 -> 41.177.98.220 TCP 64 mc-client > ups-onlinet [ACK] Seq=33775 Ack=176204 Win=65535 Len=0
964223 320.858443 244.3.79.163 -> 41.177.98.220 TCP 130 mc-client > ups-onlinet [PSH, ACK] Seq=33775 Ack=176204 Win=65535 Len=72
964232 320.860738 244.3.79.163 -> 41.177.98.220 TCP 64 mc-client > ups-onlinet [ACK] Seq=33847 Ack=178964 Win=65535 Len=0
964233 320.860963 244.3.79.163 -> 41.177.98.220 TCP 64 mc-client > ups-onlinet [ACK] Seq=33847 Ack=181477 Win=65535 Len=0
964245 320.865103 244.3.79.163 -> 41.177.98.220 TCP 130 mc-client > ups-onlinet [PSH, ACK] Seq=33847 Ack=181477 Win=65535 Len=72
964250 320.867583 244.3.79.163 -> 41.177.98.220 TCP 64 mc-client > ups-onlinet [ACK] Seq=33919 Ack=184237 Win=65535 Len=0
964251 320.867792 244.3.79.163 -> 41.177.98.220 TCP 64 mc-client > ups-onlinet [ACK] Seq=33919 Ack=186730 Win=65535 Len=0
964252 320.872106 244.3.79.163 -> 41.177.98.220 TCP 130 mc-client > ups-onlinet [PSH, ACK] Seq=33919 Ack=186730 Win=65535 Len=72
964257 320.874318 244.3.79.163 -> 41.177.98.220 TCP 64 mc-client > ups-onlinet [ACK] Seq=33991 Ack=189490 Win=65535 Len=0
964258 320.874464 244.3.79.163 -> 41.177.98.220 TCP 64 mc-client > ups-onlinet [ACK] Seq=33991 Ack=191414 Win=65535 Len=0
1018639 343.430841 244.3.79.163 -> 41.177.98.220 TCP 132 mc-client > ups-onlinet [PSH, ACK] Seq=33991 Ack=191414 Win=65535 Len=74
1018658 343.453728 244.3.79.163 -> 41.177.98.220 TCP 132 mc-client > ups-onlinet [PSH, ACK] Seq=34065 Ack=191811 Win=65138 Len=74
1018867 343.582532 244.3.79.163 -> 41.177.98.220 TCP 64 mc-client > ups-onlinet [ACK] Seq=34139 Ack=194377 Win=65535 Len=0
