326644 112.768510 244.3.142.210 -> 41.177.98.176 TCP 66 predatar-comms > http [SYN] Seq=0 Win=65535 Len=0 MSS=1460 SACK_PERM=1
326646 112.769120 244.3.142.210 -> 41.177.98.176 TCP 64 predatar-comms > http [ACK] Seq=1 Ack=1 Win=65535 Len=0
329226 114.607698 244.3.142.210 -> 41.177.98.176 TCP 64 predatar-comms > http [ACK] Seq=833 Ack=4381 Win=65535 Len=0
329234 114.610646 244.3.142.210 -> 41.177.98.176 TCP 64 predatar-comms > http [ACK] Seq=833 Ack=8255 Win=65535 Len=0
329236 114.611598 244.3.142.210 -> 41.177.98.176 TCP 64 predatar-comms > http [ACK] Seq=833 Ack=10463 Win=65535 Len=0
329241 114.613415 244.3.142.210 -> 41.177.98.176 TCP 64 predatar-comms > http [ACK] Seq=833 Ack=13383 Win=65535 Len=0
329242 114.613614 244.3.142.210 -> 41.177.98.176 TCP 64 predatar-comms > http [ACK] Seq=833 Ack=15591 Win=65535 Len=0
329253 114.616240 244.3.142.210 -> 41.177.98.176 TCP 64 predatar-comms > http [ACK] Seq=833 Ack=18511 Win=65535 Len=0
329254 114.616411 244.3.142.210 -> 41.177.98.176 TCP 64 predatar-comms > http [ACK] Seq=833 Ack=20719 Win=65535 Len=0
329257 114.618453 244.3.142.210 -> 41.177.98.176 TCP 64 predatar-comms > http [ACK] Seq=833 Ack=21177 Win=65077 Len=0
330211 115.015197 244.3.142.210 -> 41.177.98.176 TCP 66 capfast-lmd > http [SYN] Seq=0 Win=65535 Len=0 MSS=1460 SACK_PERM=1
330249 115.015849 244.3.142.210 -> 41.177.98.176 TCP 64 capfast-lmd > http [ACK] Seq=1 Ack=1 Win=65535 Len=0
330271 115.019012 244.3.142.210 -> 41.177.98.176 TCP 66 tftp-mcast > http [SYN] Seq=0 Win=65535 Len=0 MSS=1460 SACK_PERM=1
330282 115.019633 244.3.142.210 -> 41.177.98.176 TCP 64 tftp-mcast > http [ACK] Seq=1 Ack=1 Win=65535 Len=0
330286 115.020312 244.3.142.210 -> 41.177.98.176 TCP 66 www-ldap-gw > http [SYN] Seq=0 Win=65535 Len=0 MSS=1460 SACK_PERM=1
330287 115.020369 244.3.142.210 -> 41.177.98.176 TCP 66 spss-lm > http [SYN] Seq=0 Win=65535 Len=0 MSS=1460 SACK_PERM=1
330291 115.020654 244.3.142.210 -> 41.177.98.176 TCP 64 www-ldap-gw > http [ACK] Seq=1 Ack=1 Win=65535 Len=0
330293 115.020828 244.3.142.210 -> 41.177.98.176 TCP 64 spss-lm > http [ACK] Seq=1 Ack=1 Win=65535 Len=0
330294 115.021092 244.3.142.210 -> 41.177.98.176 TCP 66 cft-0 > http [SYN] Seq=0 Win=65535 Len=0 MSS=1460 SACK_PERM=1
330302 115.022038 244.3.142.210 -> 41.177.98.176 TCP 64 cft-0 > http [ACK] Seq=1 Ack=1 Win=65535 Len=0
330468 115.043889 244.3.142.210 -> 41.177.98.176 TCP 64 capfast-lmd > http [ACK] Seq=1354 Ack=3090 Win=65535 Len=0
330470 115.044042 244.3.142.210 -> 41.177.98.176 TCP 64 capfast-lmd > http [ACK] Seq=1354 Ack=5778 Win=65535 Len=0
330827 115.164345 244.3.142.210 -> 41.177.98.176 TCP 64 predatar-comms > http [ACK] Seq=3570 Ack=21846 Win=64408 Len=0
330828 115.164353 244.3.142.210 -> 41.177.98.176 TCP 64 tftp-mcast > http [ACK] Seq=2054 Ack=501 Win=65035 Len=0
330829 115.164553 244.3.142.210 -> 41.177.98.176 TCP 64 www-ldap-gw > http [ACK] Seq=1355 Ack=334 Win=65202 Len=0
330830 115.164558 244.3.142.210 -> 41.177.98.176 TCP 64 spss-lm > http [ACK] Seq=1355 Ack=336 Win=65200 Len=0
330831 115.164562 244.3.142.210 -> 41.177.98.176 TCP 64 cft-0 > http [ACK] Seq=1350 Ack=338 Win=65198 Len=0
364549 124.144796 244.3.142.210 -> 41.177.98.176 TCP 64 capfast-lmd > http [ACK] Seq=2341 Ack=8698 Win=65535 Len=0
364550 124.144949 244.3.142.210 -> 41.177.98.176 TCP 64 capfast-lmd > http [ACK] Seq=2341 Ack=11111 Win=65535 Len=0
364559 124.147558 244.3.142.210 -> 41.177.98.176 TCP 64 capfast-lmd > http [ACK] Seq=2341 Ack=15491 Win=65535 Len=0
364568 124.150143 244.3.142.210 -> 41.177.98.176 TCP 64 capfast-lmd > http [ACK] Seq=2341 Ack=17699 Win=65535 Len=0
364569 124.150328 244.3.142.210 -> 41.177.98.176 TCP 64 capfast-lmd > http [ACK] Seq=2341 Ack=20619 Win=65535 Len=0
364580 124.153157 244.3.142.210 -> 41.177.98.176 TCP 64 capfast-lmd > http [ACK] Seq=2341 Ack=24287 Win=65535 Len=0
364581 124.153349 244.3.142.210 -> 41.177.98.176 TCP 64 capfast-lmd > http [ACK] Seq=2341 Ack=26495 Win=65535 Len=0
364589 124.155770 244.3.142.210 -> 41.177.98.176 TCP 64 capfast-lmd > http [ACK] Seq=2341 Ack=29415 Win=65535 Len=0
364590 124.155931 244.3.142.210 -> 41.177.98.176 TCP 64 capfast-lmd > http [ACK] Seq=2341 Ack=31623 Win=65535 Len=0
364597 124.158977 244.3.142.210 -> 41.177.98.176 TCP 64 capfast-lmd > http [ACK] Seq=2341 Ack=34543 Win=65535 Len=0
364598 124.159134 244.3.142.210 -> 41.177.98.176 TCP 64 capfast-lmd > http [ACK] Seq=2341 Ack=36751 Win=65535 Len=0
364603 124.161964 244.3.142.210 -> 41.177.98.176 TCP 64 capfast-lmd > http [ACK] Seq=2341 Ack=41131 Win=65535 Len=0
364608 124.164761 244.3.142.210 -> 41.177.98.176 TCP 64 capfast-lmd > http [ACK] Seq=2341 Ack=44799 Win=65535 Len=0
364609 124.164937 244.3.142.210 -> 41.177.98.176 TCP 64 capfast-lmd > http [ACK] Seq=2341 Ack=47007 Win=65535 Len=0
364614 124.167557 244.3.142.210 -> 41.177.98.176 TCP 64 capfast-lmd > http [ACK] Seq=2341 Ack=49927 Win=65535 Len=0
364615 124.167737 244.3.142.210 -> 41.177.98.176 TCP 64 capfast-lmd > http [ACK] Seq=2341 Ack=52135 Win=65535 Len=0
364625 124.170548 244.3.142.210 -> 41.177.98.176 TCP 64 capfast-lmd > http [ACK] Seq=2341 Ack=55055 Win=65535 Len=0
364626 124.170737 244.3.142.210 -> 41.177.98.176 TCP 64 capfast-lmd > http [ACK] Seq=2341 Ack=57263 Win=65535 Len=0
364638 124.173377 244.3.142.210 -> 41.177.98.176 TCP 64 capfast-lmd > http [ACK] Seq=2341 Ack=60183 Win=65535 Len=0
364639 124.173534 244.3.142.210 -> 41.177.98.176 TCP 64 capfast-lmd > http [ACK] Seq=2341 Ack=62391 Win=65535 Len=0
364646 124.176373 244.3.142.210 -> 41.177.98.176 TCP 64 capfast-lmd > http [ACK] Seq=2341 Ack=66771 Win=65535 Len=0
364654 124.179175 244.3.142.210 -> 41.177.98.176 TCP 64 capfast-lmd > http [ACK] Seq=2341 Ack=70439 Win=65535 Len=0
364655 124.179342 244.3.142.210 -> 41.177.98.176 TCP 64 capfast-lmd > http [ACK] Seq=2341 Ack=72647 Win=64787 Len=0
364661 124.181170 244.3.142.210 -> 41.177.98.176 TCP 64 capfast-lmd > http [ACK] Seq=2341 Ack=73465 Win=63969 Len=0
364671 124.192613 244.3.142.210 -> 41.177.98.176 TCP 64 [TCP Window Update] capfast-lmd > http [ACK] Seq=2341 Ack=73465 Win=65535 Len=0
365091 124.418138 244.3.142.210 -> 41.177.98.176 TCP 64 cft-0 > http [ACK] Seq=2133 Ack=506 Win=65030 Len=0
365092 124.418142 244.3.142.210 -> 41.177.98.176 TCP 64 www-ldap-gw > http [ACK] Seq=2139 Ack=502 Win=65034 Len=0
365093 124.418146 244.3.142.210 -> 41.177.98.176 TCP 64 spss-lm > http [ACK] Seq=2139 Ack=504 Win=65032 Len=0
389371 130.046067 244.3.142.210 -> 41.177.98.176 TCP 64 predatar-comms > http [ACK] Seq=3570 Ack=21847 Win=64408 Len=0
389375 130.046659 244.3.142.210 -> 41.177.98.176 TCP 64 tftp-mcast > http [ACK] Seq=2054 Ack=502 Win=65035 Len=0
397170 133.400111 244.3.142.210 -> 41.177.98.176 TCP 64 predatar-comms > http [FIN, ACK] Seq=3570 Ack=21847 Win=64408 Len=0
397171 133.400158 244.3.142.210 -> 41.177.98.176 TCP 64 tftp-mcast > http [FIN, ACK] Seq=2054 Ack=502 Win=65035 Len=0
397494 133.660324 244.3.142.210 -> 41.177.98.176 TCP 64 capfast-lmd > http [ACK] Seq=3454 Ack=76385 Win=65535 Len=0
397495 133.660466 244.3.142.210 -> 41.177.98.176 TCP 64 capfast-lmd > http [ACK] Seq=3454 Ack=78798 Win=65535 Len=0
397502 133.663072 244.3.142.210 -> 41.177.98.176 TCP 64 capfast-lmd > http [ACK] Seq=3454 Ack=81718 Win=65535 Len=0
397504 133.663268 244.3.142.210 -> 41.177.98.176 TCP 64 capfast-lmd > http [ACK] Seq=3454 Ack=83926 Win=64787 Len=0
397509 133.666080 244.3.142.210 -> 41.177.98.176 TCP 64 capfast-lmd > http [ACK] Seq=3454 Ack=88306 Win=60407 Len=0
397520 133.669073 244.3.142.210 -> 41.177.98.176 TCP 64 capfast-lmd > http [ACK] Seq=3454 Ack=93434 Win=55279 Len=0
397527 133.671265 244.3.142.210 -> 41.177.98.176 TCP 64 capfast-lmd > http [ACK] Seq=3454 Ack=95493 Win=53220 Len=0
397533 133.679772 244.3.142.210 -> 41.177.98.176 TCP 64 [TCP Window Update] capfast-lmd > http [ACK] Seq=3454 Ack=95493 Win=65535 Len=0
421368 139.245839 244.3.142.210 -> 41.177.98.176 TCP 64 www-ldap-gw > http [ACK] Seq=2139 Ack=503 Win=65034 Len=0
421369 139.245843 244.3.142.210 -> 41.177.98.176 TCP 64 spss-lm > http [ACK] Seq=2139 Ack=505 Win=65032 Len=0
422019 139.285803 244.3.142.210 -> 41.177.98.176 TCP 64 cft-0 > http [ACK] Seq=2133 Ack=507 Win=65030 Len=0
442162 143.949207 244.3.142.210 -> 41.177.98.176 TCP 64 spss-lm > http [RST, ACK] Seq=2139 Ack=505 Win=0 Len=0
442163 143.949281 244.3.142.210 -> 41.177.98.176 TCP 64 www-ldap-gw > http [RST, ACK] Seq=2139 Ack=503 Win=0 Len=0
442164 143.949338 244.3.142.210 -> 41.177.98.176 TCP 64 cft-0 > http [RST, ACK] Seq=2133 Ack=507 Win=0 Len=0
455673 148.735507 244.3.142.210 -> 41.177.98.176 TCP 64 capfast-lmd > http [ACK] Seq=3454 Ack=95494 Win=65535 Len=0
456285 148.949159 244.3.142.210 -> 41.177.98.176 TCP 64 capfast-lmd > http [RST, ACK] Seq=3454 Ack=95494 Win=0 Len=0
553271 178.031065 244.3.142.210 -> 41.177.98.176 TCP 66 bmc-net-svc > http [SYN] Seq=0 Win=65535 Len=0 MSS=1460 SACK_PERM=1
553273 178.032430 244.3.142.210 -> 41.177.98.176 TCP 64 bmc-net-svc > http [ACK] Seq=1 Ack=1 Win=65535 Len=0
553798 178.222965 244.3.142.210 -> 41.177.98.176 TCP 64 bmc-net-svc > http [ACK] Seq=1054 Ack=2921 Win=65535 Len=0
553800 178.224118 244.3.142.210 -> 41.177.98.176 TCP 64 bmc-net-svc > http [ACK] Seq=1054 Ack=5335 Win=65535 Len=0
553805 178.225509 244.3.142.210 -> 41.177.98.176 TCP 64 bmc-net-svc > http [ACK] Seq=1054 Ack=8255 Win=65535 Len=0
553806 178.225713 244.3.142.210 -> 41.177.98.176 TCP 64 bmc-net-svc > http [ACK] Seq=1054 Ack=10463 Win=64787 Len=0
553811 178.228516 244.3.142.210 -> 41.177.98.176 TCP 64 bmc-net-svc > http [ACK] Seq=1054 Ack=14843 Win=60407 Len=0
553817 178.231307 244.3.142.210 -> 41.177.98.176 TCP 64 bmc-net-svc > http [ACK] Seq=1054 Ack=18511 Win=56739 Len=0
553818 178.231504 244.3.142.210 -> 41.177.98.176 TCP 64 bmc-net-svc > http [ACK] Seq=1054 Ack=20719 Win=54531 Len=0
553821 178.232917 244.3.142.210 -> 41.177.98.176 TCP 64 bmc-net-svc > http [ACK] Seq=1054 Ack=21171 Win=54079 Len=0
553855 178.250360 244.3.142.210 -> 41.177.98.176 TCP 64 [TCP Window Update] bmc-net-svc > http [ACK] Seq=1054 Ack=21171 Win=65535 Len=0
598657 189.737202 244.3.142.210 -> 41.177.98.176 TCP 64 bmc-net-svc > http [ACK] Seq=2256 Ack=25551 Win=65535 Len=0
598662 189.739762 244.3.142.210 -> 41.177.98.176 TCP 64 bmc-net-svc > http [ACK] Seq=2256 Ack=30884 Win=65535 Len=0
598671 189.742560 244.3.142.210 -> 41.177.98.176 TCP 64 bmc-net-svc > http [ACK] Seq=2256 Ack=36012 Win=60407 Len=0
598682 189.745544 244.3.142.210 -> 41.177.98.176 TCP 64 bmc-net-svc > http [ACK] Seq=2256 Ack=39680 Win=56739 Len=0
598687 189.745737 244.3.142.210 -> 41.177.98.176 TCP 64 bmc-net-svc > http [ACK] Seq=2256 Ack=41888 Win=54531 Len=0
598693 189.748362 244.3.142.210 -> 41.177.98.176 TCP 64 bmc-net-svc > http [ACK] Seq=2256 Ack=44808 Win=51611 Len=0
598694 189.748540 244.3.142.210 -> 41.177.98.176 TCP 64 bmc-net-svc > http [ACK] Seq=2256 Ack=47016 Win=49403 Len=0
598703 189.751547 244.3.142.210 -> 41.177.98.176 TCP 64 bmc-net-svc > http [ACK] Seq=2256 Ack=51396 Win=45023 Len=0
598713 189.754538 244.3.142.210 -> 41.177.98.176 TCP 64 bmc-net-svc > http [ACK] Seq=2256 Ack=54742 Win=41677 Len=0
598772 189.775430 244.3.142.210 -> 41.177.98.176 TCP 64 [TCP Window Update] bmc-net-svc > http [ACK] Seq=2256 Ack=54742 Win=65535 Len=0
654058 204.813397 244.3.142.210 -> 41.177.98.176 TCP 64 bmc-net-svc > http [ACK] Seq=2256 Ack=54743 Win=65535 Len=0
672721 209.736513 244.3.142.210 -> 41.177.98.176 TCP 64 bmc-net-svc > http [RST, ACK] Seq=2256 Ack=54743 Win=0 Len=0
755371 242.868356 244.3.142.210 -> 41.177.98.176 TCP 66 1775 > http [SYN] Seq=0 Win=65535 Len=0 MSS=1460 SACK_PERM=1
755373 242.869039 244.3.142.210 -> 41.177.98.176 TCP 64 1775 > http [ACK] Seq=1 Ack=1 Win=65535 Len=0
755375 242.869390 244.3.142.210 -> 41.177.98.176 TCP 80 [TCP segment of a reassembled PDU]
758926 244.399197 244.3.142.210 -> 41.177.98.176 TCP 64 1775 > http [ACK] Seq=1483 Ack=4381 Win=65535 Len=0
758931 244.401734 244.3.142.210 -> 41.177.98.176 TCP 64 1775 > http [ACK] Seq=1483 Ack=8255 Win=65535 Len=0
758935 244.402717 244.3.142.210 -> 41.177.98.176 TCP 64 1775 > http [ACK] Seq=1483 Ack=10463 Win=65535 Len=0
758941 244.404731 244.3.142.210 -> 41.177.98.176 TCP 64 1775 > http [ACK] Seq=1483 Ack=13383 Win=65535 Len=0
758942 244.404918 244.3.142.210 -> 41.177.98.176 TCP 64 1775 > http [ACK] Seq=1483 Ack=15591 Win=65535 Len=0
758948 244.407749 244.3.142.210 -> 41.177.98.176 TCP 64 1775 > http [ACK] Seq=1483 Ack=20719 Win=65535 Len=0
758956 244.410358 244.3.142.210 -> 41.177.98.176 TCP 64 1775 > http [ACK] Seq=1483 Ack=22560 Win=65535 Len=0
759633 244.918660 244.3.142.210 -> 41.177.98.176 TCP 64 1775 > http [ACK] Seq=5412 Ack=23838 Win=64257 Len=0
796456 259.761411 244.3.142.210 -> 41.177.98.176 TCP 64 1775 > http [ACK] Seq=5412 Ack=23839 Win=64257 Len=0
796899 259.996685 244.3.142.210 -> 41.177.98.176 TCP 64 1775 > http [RST, ACK] Seq=5412 Ack=23839 Win=0 Len=0
