1652   0.493279 244.3.160.254 -> 244.3.160.204 TCP 64 pxc-spvr-ft > 8845 [RST, ACK] Seq=1 Ack=1 Win=0 Len=0
1654   0.493552 244.3.160.254 -> 244.3.160.204 TCP 64 dls-monitor > 8846 [RST, ACK] Seq=1 Ack=1 Win=0 Len=0
1656   0.493804 244.3.160.254 -> 244.3.160.204 TCP 64 https > 8847 [SYN, ACK] Seq=0 Ack=1 Win=24820 Len=0 MSS=1460
1658   0.494088 244.3.160.254 -> 244.3.160.204 TCP 64 http > 8848 [SYN, ACK] Seq=0 Ack=1 Win=24820 Len=0 MSS=1460
1660   0.494343 244.3.160.254 -> 244.3.160.204 TCP 64 www-dev > 8849 [RST, ACK] Seq=1 Ack=1 Win=0 Len=0
1664   0.494582 244.3.160.254 -> 244.3.160.204 TCP 64 aic-np > 8850 [RST, ACK] Seq=1 Ack=1 Win=0 Len=0
1933   0.582780 244.3.160.254 -> 244.3.160.204 TCP 64 https > 8847 [ACK] Seq=1 Ack=2 Win=24820 Len=0
1938   0.583909 244.3.160.254 -> 244.3.160.204 TCP 64 https > 8847 [FIN, ACK] Seq=1 Ack=2 Win=24820 Len=0
1939   0.583989 244.3.160.254 -> 244.3.160.204 TCP 64 http > 8848 [ACK] Seq=1 Ack=2 Win=24820 Len=0
1940   0.584296 244.3.160.254 -> 244.3.160.204 TCP 64 http > 8848 [FIN, ACK] Seq=1 Ack=2 Win=24820 Len=0
7408   2.493153 244.3.160.254 -> 244.3.160.204 TCP 64 terabase > 9179 [SYN, ACK] Seq=0 Ack=1 Win=24820 Len=0 MSS=1460
7410   2.493381 244.3.160.254 -> 244.3.160.204 TCP 64 newoak > 9180 [RST, ACK] Seq=1 Ack=1 Win=0 Len=0
7412   2.493672 244.3.160.254 -> 244.3.160.204 TCP 64 pxc-spvr-ft > 9181 [RST, ACK] Seq=1 Ack=1 Win=0 Len=0
7414   2.493900 244.3.160.254 -> 244.3.160.204 TCP 64 dls-monitor > 9182 [RST, ACK] Seq=1 Ack=1 Win=0 Len=0
7416   2.494198 244.3.160.254 -> 244.3.160.204 TCP 64 https > 9183 [SYN, ACK] Seq=0 Ack=1 Win=24820 Len=0 MSS=1460
7423   2.494484 244.3.160.254 -> 244.3.160.204 TCP 64 http > 9184 [SYN, ACK] Seq=0 Ack=1 Win=24820 Len=0 MSS=1460
7624   2.583867 244.3.160.254 -> 244.3.160.204 TCP 64 terabase > 9179 [ACK] Seq=1 Ack=2 Win=24820 Len=0
7626   2.584975 244.3.160.254 -> 244.3.160.204 TCP 64 terabase > 9179 [FIN, ACK] Seq=1 Ack=2 Win=24820 Len=0
7637   2.587542 244.3.160.254 -> 244.3.160.204 TCP 64 https > 9183 [ACK] Seq=1 Ack=2 Win=24820 Len=0
7641   2.588272 244.3.160.254 -> 244.3.160.204 TCP 64 http > 9184 [ACK] Seq=1 Ack=2 Win=24820 Len=0
7642   2.588421 244.3.160.254 -> 244.3.160.204 TCP 64 https > 9183 [FIN, ACK] Seq=1 Ack=2 Win=24820 Len=0
7643   2.588784 244.3.160.254 -> 244.3.160.204 TCP 64 http > 9184 [FIN, ACK] Seq=1 Ack=2 Win=24820 Len=0
16444   4.492868 244.3.160.254 -> 244.3.160.204 TCP 64 www-dev > 9515 [RST, ACK] Seq=1 Ack=1 Win=0 Len=0
16446   4.493148 244.3.160.254 -> 244.3.160.204 TCP 64 aic-np > 9516 [RST, ACK] Seq=1 Ack=1 Win=0 Len=0
16448   4.493429 244.3.160.254 -> 244.3.160.204 TCP 64 terabase > 9517 [SYN, ACK] Seq=0 Ack=1 Win=24820 Len=0 MSS=1460
16450   4.493669 244.3.160.254 -> 244.3.160.204 TCP 64 newoak > 9518 [RST, ACK] Seq=1 Ack=1 Win=0 Len=0
16453   4.493924 244.3.160.254 -> 244.3.160.204 TCP 64 pxc-spvr-ft > 9519 [RST, ACK] Seq=1 Ack=1 Win=0 Len=0
16457   4.494185 244.3.160.254 -> 244.3.160.204 TCP 64 dls-monitor > 9520 [RST, ACK] Seq=1 Ack=1 Win=0 Len=0
16685   4.581100 244.3.160.254 -> 244.3.160.204 TCP 64 terabase > 9517 [ACK] Seq=1 Ack=2 Win=24820 Len=0
16694   4.581301 244.3.160.254 -> 244.3.160.204 TCP 64 terabase > 9517 [FIN, ACK] Seq=1 Ack=2 Win=24820 Len=0
19737   6.492791 244.3.160.254 -> 244.3.160.204 TCP 64 https > 9846 [SYN, ACK] Seq=0 Ack=1 Win=24820 Len=0 MSS=1460
19739   6.493034 244.3.160.254 -> 244.3.160.204 TCP 64 http > 9847 [SYN, ACK] Seq=0 Ack=1 Win=24820 Len=0 MSS=1460
19741   6.493333 244.3.160.254 -> 244.3.160.204 TCP 64 www-dev > 9848 [RST, ACK] Seq=1 Ack=1 Win=0 Len=0
19745   6.493548 244.3.160.254 -> 244.3.160.204 TCP 64 aic-np > 9849 [RST, ACK] Seq=1 Ack=1 Win=0 Len=0
19747   6.493812 244.3.160.254 -> 244.3.160.204 TCP 64 terabase > 9850 [SYN, ACK] Seq=0 Ack=1 Win=24820 Len=0 MSS=1460
19749   6.494040 244.3.160.254 -> 244.3.160.204 TCP 64 newoak > 9851 [RST, ACK] Seq=1 Ack=1 Win=0 Len=0
19997   6.580357 244.3.160.254 -> 244.3.160.204 TCP 64 https > 9846 [ACK] Seq=1 Ack=2 Win=24820 Len=0
19999   6.581242 244.3.160.254 -> 244.3.160.204 TCP 64 https > 9846 [FIN, ACK] Seq=1 Ack=2 Win=24820 Len=0
20001   6.581444 244.3.160.254 -> 244.3.160.204 TCP 64 http > 9847 [ACK] Seq=1 Ack=2 Win=24820 Len=0
20002   6.581738 244.3.160.254 -> 244.3.160.204 TCP 64 http > 9847 [FIN, ACK] Seq=1 Ack=2 Win=24820 Len=0
20008   6.583506 244.3.160.254 -> 244.3.160.204 TCP 64 terabase > 9850 [ACK] Seq=1 Ack=2 Win=24820 Len=0
20009   6.583736 244.3.160.254 -> 244.3.160.204 TCP 64 terabase > 9850 [FIN, ACK] Seq=1 Ack=2 Win=24820 Len=0
23377   8.493560 244.3.160.254 -> 244.3.160.204 TCP 64 pxc-spvr-ft > 10185 [RST, ACK] Seq=1 Ack=1 Win=0 Len=0
23379   8.493806 244.3.160.254 -> 244.3.160.204 TCP 64 dls-monitor > 10186 [RST, ACK] Seq=1 Ack=1 Win=0 Len=0
23386   8.494111 244.3.160.254 -> 244.3.160.204 TCP 64 https > 10187 [SYN, ACK] Seq=0 Ack=1 Win=24820 Len=0 MSS=1460
23394   8.494347 244.3.160.254 -> 244.3.160.204 TCP 64 http > 10188 [SYN, ACK] Seq=0 Ack=1 Win=24820 Len=0 MSS=1460
23403   8.494828 244.3.160.254 -> 244.3.160.204 TCP 64 www-dev > 10189 [RST, ACK] Seq=1 Ack=1 Win=0 Len=0
23413   8.495199 244.3.160.254 -> 244.3.160.204 TCP 64 aic-np > 10190 [RST, ACK] Seq=1 Ack=1 Win=0 Len=0
23602   8.582620 244.3.160.254 -> 244.3.160.204 TCP 64 https > 10187 [ACK] Seq=1 Ack=2 Win=24820 Len=0
23606   8.583532 244.3.160.254 -> 244.3.160.204 TCP 64 https > 10187 [FIN, ACK] Seq=1 Ack=2 Win=24820 Len=0
23609   8.583705 244.3.160.254 -> 244.3.160.204 TCP 64 http > 10188 [ACK] Seq=1 Ack=2 Win=24820 Len=0
23610   8.583918 244.3.160.254 -> 244.3.160.204 TCP 64 http > 10188 [FIN, ACK] Seq=1 Ack=2 Win=24820 Len=0
26677  10.493849 244.3.160.254 -> 244.3.160.204 TCP 64 terabase > 10516 [SYN, ACK] Seq=0 Ack=1 Win=24820 Len=0 MSS=1460
26681  10.494048 244.3.160.254 -> 244.3.160.204 TCP 64 newoak > 10517 [RST, ACK] Seq=1 Ack=1 Win=0 Len=0
26685  10.494292 244.3.160.254 -> 244.3.160.204 TCP 64 pxc-spvr-ft > 10518 [RST, ACK] Seq=1 Ack=1 Win=0 Len=0
26687  10.494606 244.3.160.254 -> 244.3.160.204 TCP 64 dls-monitor > 10519 [RST, ACK] Seq=1 Ack=1 Win=0 Len=0
26689  10.494869 244.3.160.254 -> 244.3.160.204 TCP 64 https > 10520 [SYN, ACK] Seq=0 Ack=1 Win=24820 Len=0 MSS=1460
26691  10.495131 244.3.160.254 -> 244.3.160.204 TCP 64 http > 10521 [SYN, ACK] Seq=0 Ack=1 Win=24820 Len=0 MSS=1460
26836  10.582909 244.3.160.254 -> 244.3.160.204 TCP 64 terabase > 10516 [ACK] Seq=1 Ack=2 Win=24820 Len=0
26837  10.583168 244.3.160.254 -> 244.3.160.204 TCP 64 terabase > 10516 [FIN, ACK] Seq=1 Ack=2 Win=24820 Len=0
26846  10.586418 244.3.160.254 -> 244.3.160.204 TCP 64 https > 10520 [ACK] Seq=1 Ack=2 Win=24820 Len=0
26847  10.587267 244.3.160.254 -> 244.3.160.204 TCP 64 https > 10520 [FIN, ACK] Seq=1 Ack=2 Win=24820 Len=0
26850  10.587551 244.3.160.254 -> 244.3.160.204 TCP 64 http > 10521 [ACK] Seq=1 Ack=2 Win=24820 Len=0
26851  10.587738 244.3.160.254 -> 244.3.160.204 TCP 64 http > 10521 [FIN, ACK] Seq=1 Ack=2 Win=24820 Len=0
30054  12.493406 244.3.160.254 -> 244.3.160.204 TCP 64 www-dev > 10850 [RST, ACK] Seq=1 Ack=1 Win=0 Len=0
30056  12.493643 244.3.160.254 -> 244.3.160.204 TCP 64 aic-np > 10851 [RST, ACK] Seq=1 Ack=1 Win=0 Len=0
30058  12.493948 244.3.160.254 -> 244.3.160.204 TCP 64 terabase > 10852 [SYN, ACK] Seq=0 Ack=1 Win=24820 Len=0 MSS=1460
30060  12.494180 244.3.160.254 -> 244.3.160.204 TCP 64 newoak > 10853 [RST, ACK] Seq=1 Ack=1 Win=0 Len=0
30062  12.494427 244.3.160.254 -> 244.3.160.204 TCP 64 pxc-spvr-ft > 10854 [RST, ACK] Seq=1 Ack=1 Win=0 Len=0
30065  12.494685 244.3.160.254 -> 244.3.160.204 TCP 64 dls-monitor > 10855 [RST, ACK] Seq=1 Ack=1 Win=0 Len=0
30216  12.584661 244.3.160.254 -> 244.3.160.204 TCP 64 terabase > 10852 [ACK] Seq=1 Ack=2 Win=24820 Len=0
30217  12.584894 244.3.160.254 -> 244.3.160.204 TCP 64 terabase > 10852 [FIN, ACK] Seq=1 Ack=2 Win=24820 Len=0
34155  14.493877 244.3.160.254 -> 244.3.160.204 TCP 64 https > 11186 [SYN, ACK] Seq=0 Ack=1 Win=24820 Len=0 MSS=1460
34164  14.494138 244.3.160.254 -> 244.3.160.204 TCP 64 http > 11187 [SYN, ACK] Seq=0 Ack=1 Win=24820 Len=0 MSS=1460
34166  14.494368 244.3.160.254 -> 244.3.160.204 TCP 64 www-dev > 11188 [RST, ACK] Seq=1 Ack=1 Win=0 Len=0
34170  14.494678 244.3.160.254 -> 244.3.160.204 TCP 64 aic-np > 11189 [RST, ACK] Seq=1 Ack=1 Win=0 Len=0
34175  14.494928 244.3.160.254 -> 244.3.160.204 TCP 64 terabase > 11190 [SYN, ACK] Seq=0 Ack=1 Win=24820 Len=0 MSS=1460
34178  14.495194 244.3.160.254 -> 244.3.160.204 TCP 64 newoak > 11191 [RST, ACK] Seq=1 Ack=1 Win=0 Len=0
34573  14.580269 244.3.160.254 -> 244.3.160.204 TCP 64 https > 11186 [ACK] Seq=1 Ack=2 Win=24820 Len=0
34578  14.581281 244.3.160.254 -> 244.3.160.204 TCP 64 http > 11187 [ACK] Seq=1 Ack=2 Win=24820 Len=0
34585  14.583310 244.3.160.254 -> 244.3.160.204 TCP 64 terabase > 11190 [ACK] Seq=1 Ack=2 Win=24820 Len=0
34677  14.598907 244.3.160.254 -> 244.3.160.204 TCP 64 http > 11187 [FIN, ACK] Seq=1 Ack=2 Win=24820 Len=0
34757  14.616196 244.3.160.254 -> 244.3.160.204 TCP 64 https > 11186 [FIN, ACK] Seq=1 Ack=2 Win=24820 Len=0
34759  14.616424 244.3.160.254 -> 244.3.160.204 TCP 64 terabase > 11190 [FIN, ACK] Seq=1 Ack=2 Win=24820 Len=0
39632  16.493788 244.3.160.254 -> 244.3.160.204 TCP 64 pxc-spvr-ft > 11517 [RST, ACK] Seq=1 Ack=1 Win=0 Len=0
39634  16.494125 244.3.160.254 -> 244.3.160.204 TCP 64 dls-monitor > 11518 [RST, ACK] Seq=1 Ack=1 Win=0 Len=0
39636  16.494376 244.3.160.254 -> 244.3.160.204 TCP 64 https > 11519 [SYN, ACK] Seq=0 Ack=1 Win=24820 Len=0 MSS=1460
39638  16.494594 244.3.160.254 -> 244.3.160.204 TCP 64 http > 11520 [SYN, ACK] Seq=0 Ack=1 Win=24820 Len=0 MSS=1460
39640  16.494821 244.3.160.254 -> 244.3.160.204 TCP 64 www-dev > 11521 [RST, ACK] Seq=1 Ack=1 Win=0 Len=0
39642  16.495142 244.3.160.254 -> 244.3.160.204 TCP 64 aic-np > 11522 [RST, ACK] Seq=1 Ack=1 Win=0 Len=0
39898  16.583234 244.3.160.254 -> 244.3.160.204 TCP 64 https > 11519 [ACK] Seq=1 Ack=2 Win=24820 Len=0
39905  16.584182 244.3.160.254 -> 244.3.160.204 TCP 64 https > 11519 [FIN, ACK] Seq=1 Ack=2 Win=24820 Len=0
39907  16.584283 244.3.160.254 -> 244.3.160.204 TCP 64 http > 11520 [ACK] Seq=1 Ack=2 Win=24820 Len=0
39908  16.584561 244.3.160.254 -> 244.3.160.204 TCP 64 http > 11520 [FIN, ACK] Seq=1 Ack=2 Win=24820 Len=0
43652  18.493980 244.3.160.254 -> 244.3.160.204 TCP 64 terabase > 11856 [SYN, ACK] Seq=0 Ack=1 Win=24820 Len=0 MSS=1460
43658  18.494295 244.3.160.254 -> 244.3.160.204 TCP 64 newoak > 11857 [RST, ACK] Seq=1 Ack=1 Win=0 Len=0
43662  18.494485 244.3.160.254 -> 244.3.160.204 TCP 64 pxc-spvr-ft > 11858 [RST, ACK] Seq=1 Ack=1 Win=0 Len=0
43665  18.494726 244.3.160.254 -> 244.3.160.204 TCP 64 dls-monitor > 11859 [RST, ACK] Seq=1 Ack=1 Win=0 Len=0
43670  18.495017 244.3.160.254 -> 244.3.160.204 TCP 64 https > 11860 [SYN, ACK] Seq=0 Ack=1 Win=24820 Len=0 MSS=1460
43672  18.495291 244.3.160.254 -> 244.3.160.204 TCP 64 http > 11861 [SYN, ACK] Seq=0 Ack=1 Win=24820 Len=0 MSS=1460
43924  18.581622 244.3.160.254 -> 244.3.160.204 TCP 64 terabase > 11856 [ACK] Seq=1 Ack=2 Win=24820 Len=0
43931  18.581961 244.3.160.254 -> 244.3.160.204 TCP 64 terabase > 11856 [FIN, ACK] Seq=1 Ack=2 Win=24820 Len=0
43939  18.584235 244.3.160.254 -> 244.3.160.204 TCP 64 https > 11860 [ACK] Seq=1 Ack=2 Win=24820 Len=0
43942  18.585090 244.3.160.254 -> 244.3.160.204 TCP 64 http > 11861 [ACK] Seq=1 Ack=2 Win=24820 Len=0
43943  18.585125 244.3.160.254 -> 244.3.160.204 TCP 64 https > 11860 [FIN, ACK] Seq=1 Ack=2 Win=24820 Len=0
43944  18.585449 244.3.160.254 -> 244.3.160.204 TCP 64 http > 11861 [FIN, ACK] Seq=1 Ack=2 Win=24820 Len=0
50338  20.494829 244.3.160.254 -> 244.3.160.204 TCP 64 www-dev > 12187 [RST, ACK] Seq=1 Ack=1 Win=0 Len=0
50340  20.495086 244.3.160.254 -> 244.3.160.204 TCP 64 aic-np > 12188 [RST, ACK] Seq=1 Ack=1 Win=0 Len=0
50342  20.495359 244.3.160.254 -> 244.3.160.204 TCP 64 terabase > 12189 [SYN, ACK] Seq=0 Ack=1 Win=24820 Len=0 MSS=1460
50344  20.495628 244.3.160.254 -> 244.3.160.204 TCP 64 newoak > 12190 [RST, ACK] Seq=1 Ack=1 Win=0 Len=0
50346  20.495869 244.3.160.254 -> 244.3.160.204 TCP 64 pxc-spvr-ft > 12191 [RST, ACK] Seq=1 Ack=1 Win=0 Len=0
50348  20.496129 244.3.160.254 -> 244.3.160.204 TCP 64 dls-monitor > 12192 [RST, ACK] Seq=1 Ack=1 Win=0 Len=0
50540  20.585414 244.3.160.254 -> 244.3.160.204 TCP 64 terabase > 12189 [ACK] Seq=1 Ack=2 Win=24820 Len=0
50541  20.585643 244.3.160.254 -> 244.3.160.204 TCP 64 terabase > 12189 [FIN, ACK] Seq=1 Ack=2 Win=24820 Len=0
54276  22.494476 244.3.160.254 -> 244.3.160.204 TCP 64 https > 12521 [SYN, ACK] Seq=0 Ack=1 Win=24820 Len=0 MSS=1460
54279  22.494676 244.3.160.254 -> 244.3.160.204 TCP 64 http > 12522 [SYN, ACK] Seq=0 Ack=1 Win=24820 Len=0 MSS=1460
54282  22.494892 244.3.160.254 -> 244.3.160.204 TCP 64 www-dev > 12523 [RST, ACK] Seq=1 Ack=1 Win=0 Len=0
54284  22.495156 244.3.160.254 -> 244.3.160.204 TCP 64 aic-np > 12524 [RST, ACK] Seq=1 Ack=1 Win=0 Len=0
54286  22.495436 244.3.160.254 -> 244.3.160.204 TCP 64 terabase > 12525 [SYN, ACK] Seq=0 Ack=1 Win=24820 Len=0 MSS=1460
54288  22.495674 244.3.160.254 -> 244.3.160.204 TCP 64 newoak > 12526 [RST, ACK] Seq=1 Ack=1 Win=0 Len=0
54533  22.584343 244.3.160.254 -> 244.3.160.204 TCP 64 https > 12521 [ACK] Seq=1 Ack=2 Win=24820 Len=0
54541  22.585254 244.3.160.254 -> 244.3.160.204 TCP 64 http > 12522 [ACK] Seq=1 Ack=2 Win=24820 Len=0
54551  22.587795 244.3.160.254 -> 244.3.160.204 TCP 64 terabase > 12525 [ACK] Seq=1 Ack=2 Win=24820 Len=0
54554  22.588871 244.3.160.254 -> 244.3.160.204 TCP 64 terabase > 12525 [FIN, ACK] Seq=1 Ack=2 Win=24820 Len=0
54567  22.592841 244.3.160.254 -> 244.3.160.204 TCP 64 https > 12521 [FIN, ACK] Seq=1 Ack=2 Win=24820 Len=0
54569  22.593123 244.3.160.254 -> 244.3.160.204 TCP 64 http > 12522 [FIN, ACK] Seq=1 Ack=2 Win=24820 Len=0
60516  24.494714 244.3.160.254 -> 244.3.160.204 TCP 64 pxc-spvr-ft > 12857 [RST, ACK] Seq=1 Ack=1 Win=0 Len=0
60518  24.494974 244.3.160.254 -> 244.3.160.204 TCP 64 dls-monitor > 12858 [RST, ACK] Seq=1 Ack=1 Win=0 Len=0
60523  24.495376 244.3.160.254 -> 244.3.160.204 TCP 64 https > 12859 [SYN, ACK] Seq=0 Ack=1 Win=24820 Len=0 MSS=1460
60525  24.495644 244.3.160.254 -> 244.3.160.204 TCP 64 http > 12860 [SYN, ACK] Seq=0 Ack=1 Win=24820 Len=0 MSS=1460
60528  24.495768 244.3.160.254 -> 244.3.160.204 TCP 64 www-dev > 12861 [RST, ACK] Seq=1 Ack=1 Win=0 Len=0
60532  24.496238 244.3.160.254 -> 244.3.160.204 TCP 64 aic-np > 12862 [RST, ACK] Seq=1 Ack=1 Win=0 Len=0
60670  24.582479 244.3.160.254 -> 244.3.160.204 TCP 64 https > 12859 [ACK] Seq=1 Ack=2 Win=24820 Len=0
60673  24.583483 244.3.160.254 -> 244.3.160.204 TCP 64 http > 12860 [ACK] Seq=1 Ack=2 Win=24820 Len=0
60674  24.583488 244.3.160.254 -> 244.3.160.204 TCP 64 https > 12859 [FIN, ACK] Seq=1 Ack=2 Win=24820 Len=0
60675  24.583797 244.3.160.254 -> 244.3.160.204 TCP 64 http > 12860 [FIN, ACK] Seq=1 Ack=2 Win=24820 Len=0
64212  26.494996 244.3.160.254 -> 244.3.160.204 TCP 64 terabase > 13188 [SYN, ACK] Seq=0 Ack=1 Win=24820 Len=0 MSS=1460
64214  26.495226 244.3.160.254 -> 244.3.160.204 TCP 64 newoak > 13189 [RST, ACK] Seq=1 Ack=1 Win=0 Len=0
64216  26.495483 244.3.160.254 -> 244.3.160.204 TCP 64 pxc-spvr-ft > 13190 [RST, ACK] Seq=1 Ack=1 Win=0 Len=0
64218  26.495739 244.3.160.254 -> 244.3.160.204 TCP 64 dls-monitor > 13191 [RST, ACK] Seq=1 Ack=1 Win=0 Len=0
64220  26.496049 244.3.160.254 -> 244.3.160.204 TCP 64 https > 13192 [SYN, ACK] Seq=0 Ack=1 Win=24820 Len=0 MSS=1460
64222  26.496342 244.3.160.254 -> 244.3.160.204 TCP 64 http > 13193 [SYN, ACK] Seq=0 Ack=1 Win=24820 Len=0 MSS=1460
64384  26.584532 244.3.160.254 -> 244.3.160.204 TCP 64 terabase > 13188 [ACK] Seq=1 Ack=2 Win=24820 Len=0
64385  26.584811 244.3.160.254 -> 244.3.160.204 TCP 64 terabase > 13188 [FIN, ACK] Seq=1 Ack=2 Win=24820 Len=0
64388  26.587056 244.3.160.254 -> 244.3.160.204 TCP 64 https > 13192 [ACK] Seq=1 Ack=2 Win=24820 Len=0
64392  26.588026 244.3.160.254 -> 244.3.160.204 TCP 64 https > 13192 [FIN, ACK] Seq=1 Ack=2 Win=24820 Len=0
64395  26.588559 244.3.160.254 -> 244.3.160.204 TCP 64 http > 13193 [ACK] Seq=1 Ack=2 Win=24820 Len=0
64396  26.588820 244.3.160.254 -> 244.3.160.204 TCP 64 http > 13193 [FIN, ACK] Seq=1 Ack=2 Win=24820 Len=0
68887  28.494953 244.3.160.254 -> 244.3.160.204 TCP 64 www-dev > 13527 [RST, ACK] Seq=1 Ack=1 Win=0 Len=0
68892  28.495246 244.3.160.254 -> 244.3.160.204 TCP 64 aic-np > 13528 [RST, ACK] Seq=1 Ack=1 Win=0 Len=0
68894  28.495525 244.3.160.254 -> 244.3.160.204 TCP 64 terabase > 13529 [SYN, ACK] Seq=0 Ack=1 Win=24820 Len=0 MSS=1460
68896  28.495766 244.3.160.254 -> 244.3.160.204 TCP 64 newoak > 13530 [RST, ACK] Seq=1 Ack=1 Win=0 Len=0
68899  28.496050 244.3.160.254 -> 244.3.160.204 TCP 64 pxc-spvr-ft > 13531 [RST, ACK] Seq=1 Ack=1 Win=0 Len=0
68901  28.496298 244.3.160.254 -> 244.3.160.204 TCP 64 dls-monitor > 13532 [RST, ACK] Seq=1 Ack=1 Win=0 Len=0
69030  28.584037 244.3.160.254 -> 244.3.160.204 TCP 64 terabase > 13529 [ACK] Seq=1 Ack=2 Win=24820 Len=0
69031  28.584256 244.3.160.254 -> 244.3.160.204 TCP 64 terabase > 13529 [FIN, ACK] Seq=1 Ack=2 Win=24820 Len=0
75465  30.495675 244.3.160.254 -> 244.3.160.204 TCP 64 https > 13858 [SYN, ACK] Seq=0 Ack=1 Win=24820 Len=0 MSS=1460
75467  30.495944 244.3.160.254 -> 244.3.160.204 TCP 64 http > 13859 [SYN, ACK] Seq=0 Ack=1 Win=24820 Len=0 MSS=1460
75471  30.496191 244.3.160.254 -> 244.3.160.204 TCP 64 www-dev > 13860 [RST, ACK] Seq=1 Ack=1 Win=0 Len=0
75475  30.496475 244.3.160.254 -> 244.3.160.204 TCP 64 aic-np > 13861 [RST, ACK] Seq=1 Ack=1 Win=0 Len=0
75478  30.496779 244.3.160.254 -> 244.3.160.204 TCP 64 terabase > 13862 [SYN, ACK] Seq=0 Ack=1 Win=24820 Len=0 MSS=1460
75481  30.496978 244.3.160.254 -> 244.3.160.204 TCP 64 newoak > 13863 [RST, ACK] Seq=1 Ack=1 Win=0 Len=0
75818  30.583469 244.3.160.254 -> 244.3.160.204 TCP 64 https > 13858 [ACK] Seq=1 Ack=2 Win=24820 Len=0
75822  30.584571 244.3.160.254 -> 244.3.160.204 TCP 64 http > 13859 [ACK] Seq=1 Ack=2 Win=24820 Len=0
75823  30.584801 244.3.160.254 -> 244.3.160.204 TCP 64 https > 13858 [FIN, ACK] Seq=1 Ack=2 Win=24820 Len=0
75828  30.585209 244.3.160.254 -> 244.3.160.204 TCP 64 http > 13859 [FIN, ACK] Seq=1 Ack=2 Win=24820 Len=0
75853  30.587587 244.3.160.254 -> 244.3.160.204 TCP 64 terabase > 13862 [ACK] Seq=1 Ack=2 Win=24820 Len=0
75854  30.587786 244.3.160.254 -> 244.3.160.204 TCP 64 terabase > 13862 [FIN, ACK] Seq=1 Ack=2 Win=24820 Len=0
83555  32.495263 244.3.160.254 -> 244.3.160.204 TCP 64 pxc-spvr-ft > 14192 [RST, ACK] Seq=1 Ack=1 Win=0 Len=0
83557  32.495550 244.3.160.254 -> 244.3.160.204 TCP 64 dls-monitor > 14193 [RST, ACK] Seq=1 Ack=1 Win=0 Len=0
83559  32.495836 244.3.160.254 -> 244.3.160.204 TCP 64 https > 14194 [SYN, ACK] Seq=0 Ack=1 Win=24820 Len=0 MSS=1460
83561  32.496123 244.3.160.254 -> 244.3.160.204 TCP 64 http > 14195 [SYN, ACK] Seq=0 Ack=1 Win=24820 Len=0 MSS=1460
83563  32.496366 244.3.160.254 -> 244.3.160.204 TCP 64 www-dev > 14196 [RST, ACK] Seq=1 Ack=1 Win=0 Len=0
83565  32.496614 244.3.160.254 -> 244.3.160.204 TCP 64 aic-np > 14197 [RST, ACK] Seq=1 Ack=1 Win=0 Len=0
83869  32.586963 244.3.160.254 -> 244.3.160.204 TCP 64 https > 14194 [ACK] Seq=1 Ack=2 Win=24820 Len=0
83870  32.587832 244.3.160.254 -> 244.3.160.204 TCP 64 https > 14194 [FIN, ACK] Seq=1 Ack=2 Win=24820 Len=0
83875  32.588769 244.3.160.254 -> 244.3.160.204 TCP 64 http > 14195 [ACK] Seq=1 Ack=2 Win=24820 Len=0
83877  32.588958 244.3.160.254 -> 244.3.160.204 TCP 64 http > 14195 [FIN, ACK] Seq=1 Ack=2 Win=24820 Len=0
89320  34.495963 244.3.160.254 -> 244.3.160.204 TCP 64 terabase > 14528 [SYN, ACK] Seq=0 Ack=1 Win=24820 Len=0 MSS=1460
89322  34.496187 244.3.160.254 -> 244.3.160.204 TCP 64 newoak > 14529 [RST, ACK] Seq=1 Ack=1 Win=0 Len=0
89326  34.496452 244.3.160.254 -> 244.3.160.204 TCP 64 pxc-spvr-ft > 14530 [RST, ACK] Seq=1 Ack=1 Win=0 Len=0
89329  34.496797 244.3.160.254 -> 244.3.160.204 TCP 64 dls-monitor > 14531 [RST, ACK] Seq=1 Ack=1 Win=0 Len=0
89332  34.497082 244.3.160.254 -> 244.3.160.204 TCP 64 https > 14532 [SYN, ACK] Seq=0 Ack=1 Win=24820 Len=0 MSS=1460
89335  34.497295 244.3.160.254 -> 244.3.160.204 TCP 64 http > 14533 [SYN, ACK] Seq=0 Ack=1 Win=24820 Len=0 MSS=1460
89613  34.583230 244.3.160.254 -> 244.3.160.204 TCP 64 terabase > 14528 [ACK] Seq=1 Ack=2 Win=24820 Len=0
89614  34.583547 244.3.160.254 -> 244.3.160.204 TCP 64 terabase > 14528 [FIN, ACK] Seq=1 Ack=2 Win=24820 Len=0
89621  34.585902 244.3.160.254 -> 244.3.160.204 TCP 64 https > 14532 [ACK] Seq=1 Ack=2 Win=24820 Len=0
89624  34.586634 244.3.160.254 -> 244.3.160.204 TCP 64 https > 14532 [FIN, ACK] Seq=1 Ack=2 Win=24820 Len=0
89641  34.587159 244.3.160.254 -> 244.3.160.204 TCP 64 http > 14533 [ACK] Seq=1 Ack=2 Win=24820 Len=0
89642  34.587320 244.3.160.254 -> 244.3.160.204 TCP 64 http > 14533 [FIN, ACK] Seq=1 Ack=2 Win=24820 Len=0
90222  34.783936 244.3.160.254 -> 41.177.26.211 TCP 66 33553 > hdl-srv [SYN] Seq=0 Win=24820 Len=0 SACK_PERM=1 MSS=1460
90223  34.784014 244.3.160.254 -> 41.177.26.211 TCP 66 [TCP Out-Of-Order] 33553 > hdl-srv [SYN] Seq=0 Win=24820 Len=0 SACK_PERM=1 MSS=1460
90240  34.784478 244.3.160.254 -> 41.177.26.211 TCP 64 33553 > hdl-srv [ACK] Seq=1 Ack=1 Win=24820 Len=0
90241  34.784529 244.3.160.254 -> 41.177.26.211 TCP 64 [TCP Dup ACK 90240#1] 33553 > hdl-srv [ACK] Seq=1 Ack=1 Win=24820 Len=0
90648  34.893015 244.3.160.254 -> 41.177.26.211 TCP 78 33553 > hdl-srv [PSH, ACK] Seq=1 Ack=1 Win=24820 Len=20
90649  34.893066 244.3.160.254 -> 41.177.26.211 TCP 78 [TCP Retransmission] 33553 > hdl-srv [PSH, ACK] Seq=1 Ack=1 Win=24820 Len=20
90652  34.893355 244.3.160.254 -> 41.177.26.211 TCP 111 33553 > hdl-srv [PSH, ACK] Seq=21 Ack=1 Win=24820 Len=53
90653  34.893410 244.3.160.254 -> 41.177.26.211 TCP 111 [TCP Retransmission] 33553 > hdl-srv [PSH, ACK] Seq=21 Ack=1 Win=24820 Len=53
90684  34.897371 244.3.160.254 -> 41.177.26.211 TCP 64 33553 > hdl-srv [ACK] Seq=74 Ack=21 Win=24820 Len=0
90686  34.897481 244.3.160.254 -> 41.177.26.211 TCP 64 [TCP Dup ACK 90684#1] 33553 > hdl-srv [ACK] Seq=74 Ack=21 Win=24820 Len=0
90688  34.897670 244.3.160.254 -> 41.177.26.211 TCP 64 33553 > hdl-srv [ACK] Seq=74 Ack=178 Win=24820 Len=0
90689  34.897724 244.3.160.254 -> 41.177.26.211 TCP 64 [TCP Dup ACK 90688#1] 33553 > hdl-srv [ACK] Seq=74 Ack=178 Win=24820 Len=0
90915  34.967555 244.3.160.254 -> 41.177.26.211 TCP 64 33553 > hdl-srv [FIN, ACK] Seq=74 Ack=178 Win=24820 Len=0
90916  34.967613 244.3.160.254 -> 41.177.26.211 TCP 64 [TCP Out-Of-Order] 33553 > hdl-srv [FIN, ACK] Seq=74 Ack=178 Win=24820 Len=0
91022  35.004194 244.3.160.254 -> 41.177.26.211 TCP 66 33554 > hdl-srv [SYN] Seq=0 Win=24820 Len=0 SACK_PERM=1 MSS=1460
91023  35.004268 244.3.160.254 -> 41.177.26.211 TCP 66 [TCP Out-Of-Order] 33554 > hdl-srv [SYN] Seq=0 Win=24820 Len=0 SACK_PERM=1 MSS=1460
91026  35.004698 244.3.160.254 -> 41.177.26.211 TCP 64 33554 > hdl-srv [ACK] Seq=1 Ack=1 Win=24820 Len=0
91027  35.004745 244.3.160.254 -> 41.177.26.211 TCP 64 [TCP Dup ACK 91026#1] 33554 > hdl-srv [ACK] Seq=1 Ack=1 Win=24820 Len=0
91379  35.112952 244.3.160.254 -> 41.177.26.211 TCP 78 33554 > hdl-srv [PSH, ACK] Seq=1 Ack=1 Win=24820 Len=20
91381  35.113019 244.3.160.254 -> 41.177.26.211 TCP 78 [TCP Retransmission] 33554 > hdl-srv [PSH, ACK] Seq=1 Ack=1 Win=24820 Len=20
91384  35.113304 244.3.160.254 -> 41.177.26.211 TCP 178 33554 > hdl-srv [PSH, ACK] Seq=21 Ack=1 Win=24820 Len=120
91385  35.113369 244.3.160.254 -> 41.177.26.211 TCP 178 [TCP Retransmission] 33554 > hdl-srv [PSH, ACK] Seq=21 Ack=1 Win=24820 Len=120
92255  35.337398 244.3.160.254 -> 41.177.26.211 TCP 64 33554 > hdl-srv [ACK] Seq=141 Ack=21 Win=24820 Len=0
92256  35.337449 244.3.160.254 -> 41.177.26.211 TCP 64 [TCP Dup ACK 92255#1] 33554 > hdl-srv [ACK] Seq=141 Ack=21 Win=24820 Len=0
92259  35.337790 244.3.160.254 -> 41.177.26.211 TCP 64 33554 > hdl-srv [ACK] Seq=141 Ack=153 Win=24820 Len=0
92260  35.337843 244.3.160.254 -> 41.177.26.211 TCP 64 [TCP Dup ACK 92259#1] 33554 > hdl-srv [ACK] Seq=141 Ack=153 Win=24820 Len=0
92754  35.492008 244.3.160.254 -> 41.177.26.211 TCP 64 33554 > hdl-srv [ACK] Seq=141 Ack=268 Win=24820 Len=0
92755  35.492081 244.3.160.254 -> 41.177.26.211 TCP 64 [TCP Dup ACK 92754#1] 33554 > hdl-srv [ACK] Seq=141 Ack=268 Win=24820 Len=0
93272  35.636589 244.3.160.254 -> 41.177.26.211 TCP 64 33554 > hdl-srv [FIN, ACK] Seq=141 Ack=268 Win=24820 Len=0
93273  35.636640 244.3.160.254 -> 41.177.26.211 TCP 64 [TCP Out-Of-Order] 33554 > hdl-srv [FIN, ACK] Seq=141 Ack=268 Win=24820 Len=0
97243  36.496075 244.3.160.254 -> 244.3.160.204 TCP 64 www-dev > 14859 [RST, ACK] Seq=1 Ack=1 Win=0 Len=0
97245  36.496309 244.3.160.254 -> 244.3.160.204 TCP 64 aic-np > 14860 [RST, ACK] Seq=1 Ack=1 Win=0 Len=0
97247  36.496605 244.3.160.254 -> 244.3.160.204 TCP 64 terabase > 14861 [SYN, ACK] Seq=0 Ack=1 Win=24820 Len=0 MSS=1460
97249  36.496853 244.3.160.254 -> 244.3.160.204 TCP 64 newoak > 14862 [RST, ACK] Seq=1 Ack=1 Win=0 Len=0
97256  36.497170 244.3.160.254 -> 244.3.160.204 TCP 64 pxc-spvr-ft > 14863 [RST, ACK] Seq=1 Ack=1 Win=0 Len=0
97258  36.497393 244.3.160.254 -> 244.3.160.204 TCP 64 dls-monitor > 14864 [RST, ACK] Seq=1 Ack=1 Win=0 Len=0
97937  36.587979 244.3.160.254 -> 244.3.160.204 TCP 64 terabase > 14861 [ACK] Seq=1 Ack=2 Win=24820 Len=0
97942  36.588196 244.3.160.254 -> 244.3.160.204 TCP 64 terabase > 14861 [FIN, ACK] Seq=1 Ack=2 Win=24820 Len=0
106853  38.495668 244.3.160.254 -> 244.3.160.204 TCP 64 https > 15198 [SYN, ACK] Seq=0 Ack=1 Win=24820 Len=0 MSS=1460
106855  38.495941 244.3.160.254 -> 244.3.160.204 TCP 64 http > 15199 [SYN, ACK] Seq=0 Ack=1 Win=24820 Len=0 MSS=1460
106857  38.496168 244.3.160.254 -> 244.3.160.204 TCP 64 www-dev > 15200 [RST, ACK] Seq=1 Ack=1 Win=0 Len=0
106859  38.496423 244.3.160.254 -> 244.3.160.204 TCP 64 aic-np > 15201 [RST, ACK] Seq=1 Ack=1 Win=0 Len=0
106861  38.496714 244.3.160.254 -> 244.3.160.204 TCP 64 terabase > 15202 [SYN, ACK] Seq=0 Ack=1 Win=24820 Len=0 MSS=1460
106863  38.496953 244.3.160.254 -> 244.3.160.204 TCP 64 newoak > 15203 [RST, ACK] Seq=1 Ack=1 Win=0 Len=0
107124  38.583420 244.3.160.254 -> 244.3.160.204 TCP 64 https > 15198 [ACK] Seq=1 Ack=2 Win=24820 Len=0
107128  38.584356 244.3.160.254 -> 244.3.160.204 TCP 64 https > 15198 [FIN, ACK] Seq=1 Ack=2 Win=24820 Len=0
107129  38.584418 244.3.160.254 -> 244.3.160.204 TCP 64 http > 15199 [ACK] Seq=1 Ack=2 Win=24820 Len=0
107130  38.584727 244.3.160.254 -> 244.3.160.204 TCP 64 http > 15199 [FIN, ACK] Seq=1 Ack=2 Win=24820 Len=0
107136  38.586802 244.3.160.254 -> 244.3.160.204 TCP 64 terabase > 15202 [ACK] Seq=1 Ack=2 Win=24820 Len=0
107137  38.587064 244.3.160.254 -> 244.3.160.204 TCP 64 terabase > 15202 [FIN, ACK] Seq=1 Ack=2 Win=24820 Len=0
113815  40.496549 244.3.160.254 -> 244.3.160.204 TCP 64 pxc-spvr-ft > 15529 [RST, ACK] Seq=1 Ack=1 Win=0 Len=0
113817  40.496814 244.3.160.254 -> 244.3.160.204 TCP 64 dls-monitor > 15530 [RST, ACK] Seq=1 Ack=1 Win=0 Len=0
113819  40.497112 244.3.160.254 -> 244.3.160.204 TCP 64 https > 15531 [SYN, ACK] Seq=0 Ack=1 Win=24820 Len=0 MSS=1460
113821  40.497410 244.3.160.254 -> 244.3.160.204 TCP 64 http > 15532 [SYN, ACK] Seq=0 Ack=1 Win=24820 Len=0 MSS=1460
113823  40.497668 244.3.160.254 -> 244.3.160.204 TCP 64 www-dev > 15533 [RST, ACK] Seq=1 Ack=1 Win=0 Len=0
113825  40.497858 244.3.160.254 -> 244.3.160.204 TCP 64 aic-np > 15534 [RST, ACK] Seq=1 Ack=1 Win=0 Len=0
113960  40.586987 244.3.160.254 -> 244.3.160.204 TCP 64 https > 15531 [ACK] Seq=1 Ack=2 Win=24820 Len=0
113968  40.587860 244.3.160.254 -> 244.3.160.204 TCP 64 https > 15531 [FIN, ACK] Seq=1 Ack=2 Win=24820 Len=0
113970  40.588037 244.3.160.254 -> 244.3.160.204 TCP 64 http > 15532 [ACK] Seq=1 Ack=2 Win=24820 Len=0
113971  40.588253 244.3.160.254 -> 244.3.160.204 TCP 64 http > 15532 [FIN, ACK] Seq=1 Ack=2 Win=24820 Len=0
118363  42.496257 244.3.160.254 -> 244.3.160.204 TCP 64 terabase > 15863 [SYN, ACK] Seq=0 Ack=1 Win=24820 Len=0 MSS=1460
118365  42.496486 244.3.160.254 -> 244.3.160.204 TCP 64 newoak > 15864 [RST, ACK] Seq=1 Ack=1 Win=0 Len=0
118367  42.496741 244.3.160.254 -> 244.3.160.204 TCP 64 pxc-spvr-ft > 15865 [RST, ACK] Seq=1 Ack=1 Win=0 Len=0
118375  42.497005 244.3.160.254 -> 244.3.160.204 TCP 64 dls-monitor > 15866 [RST, ACK] Seq=1 Ack=1 Win=0 Len=0
118377  42.497316 244.3.160.254 -> 244.3.160.204 TCP 64 https > 15867 [SYN, ACK] Seq=0 Ack=1 Win=24820 Len=0 MSS=1460
118379  42.497578 244.3.160.254 -> 244.3.160.204 TCP 64 http > 15868 [SYN, ACK] Seq=0 Ack=1 Win=24820 Len=0 MSS=1460
118609  42.594941 244.3.160.254 -> 244.3.160.204 TCP 64 terabase > 15863 [ACK] Seq=1 Ack=2 Win=24820 Len=0
118610  42.595278 244.3.160.254 -> 244.3.160.204 TCP 64 terabase > 15863 [FIN, ACK] Seq=1 Ack=2 Win=24820 Len=0
118613  42.597853 244.3.160.254 -> 244.3.160.204 TCP 64 https > 15867 [ACK] Seq=1 Ack=2 Win=24820 Len=0
118614  42.598672 244.3.160.254 -> 244.3.160.204 TCP 64 https > 15867 [FIN, ACK] Seq=1 Ack=2 Win=24820 Len=0
118618  42.599476 244.3.160.254 -> 244.3.160.204 TCP 64 http > 15868 [ACK] Seq=1 Ack=2 Win=24820 Len=0
118619  42.599662 244.3.160.254 -> 244.3.160.204 TCP 64 http > 15868 [FIN, ACK] Seq=1 Ack=2 Win=24820 Len=0
124670  44.496509 244.3.160.254 -> 244.3.160.204 TCP 64 www-dev > 16199 [RST, ACK] Seq=1 Ack=1 Win=0 Len=0
124672  44.496761 244.3.160.254 -> 244.3.160.204 TCP 64 aic-np > 16200 [RST, ACK] Seq=1 Ack=1 Win=0 Len=0
124678  44.497053 244.3.160.254 -> 244.3.160.204 TCP 64 terabase > 16201 [SYN, ACK] Seq=0 Ack=1 Win=24820 Len=0 MSS=1460
124681  44.497270 244.3.160.254 -> 244.3.160.204 TCP 64 newoak > 16202 [RST, ACK] Seq=1 Ack=1 Win=0 Len=0
124685  44.497568 244.3.160.254 -> 244.3.160.204 TCP 64 pxc-spvr-ft > 16203 [RST, ACK] Seq=1 Ack=1 Win=0 Len=0
124687  44.497802 244.3.160.254 -> 244.3.160.204 TCP 64 dls-monitor > 16204 [RST, ACK] Seq=1 Ack=1 Win=0 Len=0
124840  44.592770 244.3.160.254 -> 244.3.160.204 TCP 64 terabase > 16201 [ACK] Seq=1 Ack=2 Win=24820 Len=0
124842  44.593061 244.3.160.254 -> 244.3.160.204 TCP 64 terabase > 16201 [FIN, ACK] Seq=1 Ack=2 Win=24820 Len=0
133477  46.498914 244.3.160.254 -> 244.3.160.204 TCP 64 https > 16530 [SYN, ACK] Seq=0 Ack=1 Win=24820 Len=0 MSS=1460
133481  46.499189 244.3.160.254 -> 244.3.160.204 TCP 64 http > 16531 [SYN, ACK] Seq=0 Ack=1 Win=24820 Len=0 MSS=1460
133486  46.499462 244.3.160.254 -> 244.3.160.204 TCP 64 www-dev > 16532 [RST, ACK] Seq=1 Ack=1 Win=0 Len=0
133491  46.499723 244.3.160.254 -> 244.3.160.204 TCP 64 aic-np > 16533 [RST, ACK] Seq=1 Ack=1 Win=0 Len=0
133495  46.500026 244.3.160.254 -> 244.3.160.204 TCP 64 terabase > 16534 [SYN, ACK] Seq=0 Ack=1 Win=24820 Len=0 MSS=1460
133498  46.500280 244.3.160.254 -> 244.3.160.204 TCP 64 newoak > 16535 [RST, ACK] Seq=1 Ack=1 Win=0 Len=0
134090  46.605545 244.3.160.254 -> 244.3.160.204 TCP 64 https > 16530 [ACK] Seq=1 Ack=2 Win=24820 Len=0
134096  46.606499 244.3.160.254 -> 244.3.160.204 TCP 64 http > 16531 [ACK] Seq=1 Ack=2 Win=24820 Len=0
134097  46.607968 244.3.160.254 -> 244.3.160.204 TCP 64 https > 16530 [FIN, ACK] Seq=1 Ack=2 Win=24820 Len=0
134100  46.608356 244.3.160.254 -> 244.3.160.204 TCP 64 http > 16531 [FIN, ACK] Seq=1 Ack=2 Win=24820 Len=0
134105  46.609378 244.3.160.254 -> 244.3.160.204 TCP 64 terabase > 16534 [ACK] Seq=1 Ack=2 Win=24820 Len=0
134106  46.609644 244.3.160.254 -> 244.3.160.204 TCP 64 terabase > 16534 [FIN, ACK] Seq=1 Ack=2 Win=24820 Len=0
140644  48.497708 244.3.160.254 -> 244.3.160.204 TCP 64 pxc-spvr-ft > 16869 [RST, ACK] Seq=1 Ack=1 Win=0 Len=0
140646  48.497960 244.3.160.254 -> 244.3.160.204 TCP 64 dls-monitor > 16870 [RST, ACK] Seq=1 Ack=1 Win=0 Len=0
140648  48.498242 244.3.160.254 -> 244.3.160.204 TCP 64 https > 16871 [SYN, ACK] Seq=0 Ack=1 Win=24820 Len=0 MSS=1460
140650  48.498506 244.3.160.254 -> 244.3.160.204 TCP 64 http > 16872 [SYN, ACK] Seq=0 Ack=1 Win=24820 Len=0 MSS=1460
140652  48.498760 244.3.160.254 -> 244.3.160.204 TCP 64 www-dev > 16873 [RST, ACK] Seq=1 Ack=1 Win=0 Len=0
140654  48.499013 244.3.160.254 -> 244.3.160.204 TCP 64 aic-np > 16874 [RST, ACK] Seq=1 Ack=1 Win=0 Len=0
140944  48.586620 244.3.160.254 -> 244.3.160.204 TCP 64 https > 16871 [ACK] Seq=1 Ack=2 Win=24820 Len=0
140948  48.587439 244.3.160.254 -> 244.3.160.204 TCP 64 https > 16871 [FIN, ACK] Seq=1 Ack=2 Win=24820 Len=0
140950  48.587613 244.3.160.254 -> 244.3.160.204 TCP 64 http > 16872 [ACK] Seq=1 Ack=2 Win=24820 Len=0
140951  48.587831 244.3.160.254 -> 244.3.160.204 TCP 64 http > 16872 [FIN, ACK] Seq=1 Ack=2 Win=24820 Len=0
147085  50.498658 244.3.160.254 -> 244.3.160.204 TCP 64 terabase > 17200 [SYN, ACK] Seq=0 Ack=1 Win=24820 Len=0 MSS=1460
147087  50.498918 244.3.160.254 -> 244.3.160.204 TCP 64 newoak > 17201 [RST, ACK] Seq=1 Ack=1 Win=0 Len=0
147090  50.499192 244.3.160.254 -> 244.3.160.204 TCP 64 pxc-spvr-ft > 17202 [RST, ACK] Seq=1 Ack=1 Win=0 Len=0
147092  50.499437 244.3.160.254 -> 244.3.160.204 TCP 64 dls-monitor > 17203 [RST, ACK] Seq=1 Ack=1 Win=0 Len=0
147094  50.499725 244.3.160.254 -> 244.3.160.204 TCP 64 https > 17204 [SYN, ACK] Seq=0 Ack=1 Win=24820 Len=0 MSS=1460
147096  50.500023 244.3.160.254 -> 244.3.160.204 TCP 64 http > 17205 [SYN, ACK] Seq=0 Ack=1 Win=24820 Len=0 MSS=1460
147441  50.588504 244.3.160.254 -> 244.3.160.204 TCP 64 terabase > 17200 [ACK] Seq=1 Ack=2 Win=24820 Len=0
147443  50.588866 244.3.160.254 -> 244.3.160.204 TCP 64 terabase > 17200 [FIN, ACK] Seq=1 Ack=2 Win=24820 Len=0
147450  50.591792 244.3.160.254 -> 244.3.160.204 TCP 64 https > 17204 [ACK] Seq=1 Ack=2 Win=24820 Len=0
147453  50.592681 244.3.160.254 -> 244.3.160.204 TCP 64 https > 17204 [FIN, ACK] Seq=1 Ack=2 Win=24820 Len=0
147455  50.592870 244.3.160.254 -> 244.3.160.204 TCP 64 http > 17205 [ACK] Seq=1 Ack=2 Win=24820 Len=0
147456  50.593136 244.3.160.254 -> 244.3.160.204 TCP 64 http > 17205 [FIN, ACK] Seq=1 Ack=2 Win=24820 Len=0
153462  52.497747 244.3.160.254 -> 244.3.160.204 TCP 64 www-dev > 17534 [RST, ACK] Seq=1 Ack=1 Win=0 Len=0
153465  52.498024 244.3.160.254 -> 244.3.160.204 TCP 64 aic-np > 17535 [RST, ACK] Seq=1 Ack=1 Win=0 Len=0
153468  52.498314 244.3.160.254 -> 244.3.160.204 TCP 64 terabase > 17536 [SYN, ACK] Seq=0 Ack=1 Win=24820 Len=0 MSS=1460
153471  52.498558 244.3.160.254 -> 244.3.160.204 TCP 64 newoak > 17537 [RST, ACK] Seq=1 Ack=1 Win=0 Len=0
153475  52.498794 244.3.160.254 -> 244.3.160.204 TCP 64 pxc-spvr-ft > 17538 [RST, ACK] Seq=1 Ack=1 Win=0 Len=0
153478  52.499078 244.3.160.254 -> 244.3.160.204 TCP 64 dls-monitor > 17539 [RST, ACK] Seq=1 Ack=1 Win=0 Len=0
153879  52.589818 244.3.160.254 -> 244.3.160.204 TCP 64 terabase > 17536 [ACK] Seq=1 Ack=2 Win=24820 Len=0
153880  52.590085 244.3.160.254 -> 244.3.160.204 TCP 64 terabase > 17536 [FIN, ACK] Seq=1 Ack=2 Win=24820 Len=0
160072  54.498257 244.3.160.254 -> 244.3.160.204 TCP 64 https > 17870 [SYN, ACK] Seq=0 Ack=1 Win=24820 Len=0 MSS=1460
160074  54.498517 244.3.160.254 -> 244.3.160.204 TCP 64 http > 17871 [SYN, ACK] Seq=0 Ack=1 Win=24820 Len=0 MSS=1460
160076  54.498742 244.3.160.254 -> 244.3.160.204 TCP 64 www-dev > 17872 [RST, ACK] Seq=1 Ack=1 Win=0 Len=0
160078  54.498996 244.3.160.254 -> 244.3.160.204 TCP 64 aic-np > 17873 [RST, ACK] Seq=1 Ack=1 Win=0 Len=0
160080  54.499309 244.3.160.254 -> 244.3.160.204 TCP 64 terabase > 17874 [SYN, ACK] Seq=0 Ack=1 Win=24820 Len=0 MSS=1460
160082  54.499537 244.3.160.254 -> 244.3.160.204 TCP 64 newoak > 17875 [RST, ACK] Seq=1 Ack=1 Win=0 Len=0
160315  54.584997 244.3.160.254 -> 244.3.160.204 TCP 64 https > 17870 [ACK] Seq=1 Ack=2 Win=24820 Len=0
160317  54.585732 244.3.160.254 -> 244.3.160.204 TCP 64 https > 17870 [FIN, ACK] Seq=1 Ack=2 Win=24820 Len=0
160319  54.585931 244.3.160.254 -> 244.3.160.204 TCP 64 http > 17871 [ACK] Seq=1 Ack=2 Win=24820 Len=0
160320  54.586137 244.3.160.254 -> 244.3.160.204 TCP 64 http > 17871 [FIN, ACK] Seq=1 Ack=2 Win=24820 Len=0
160357  54.589446 244.3.160.254 -> 244.3.160.204 TCP 64 terabase > 17874 [ACK] Seq=1 Ack=2 Win=24820 Len=0
160358  54.589451 244.3.160.254 -> 244.3.160.204 TCP 64 terabase > 17874 [FIN, ACK] Seq=1 Ack=2 Win=24820 Len=0
169592  56.498923 244.3.160.254 -> 244.3.160.204 TCP 64 pxc-spvr-ft > 18201 [RST, ACK] Seq=1 Ack=1 Win=0 Len=0
169593  56.498943 244.3.160.254 -> 244.3.160.204 TCP 64 dls-monitor > 18202 [RST, ACK] Seq=1 Ack=1 Win=0 Len=0
169597  56.499419 244.3.160.254 -> 244.3.160.204 TCP 64 https > 18203 [SYN, ACK] Seq=0 Ack=1 Win=24820 Len=0 MSS=1460
169603  56.499783 244.3.160.254 -> 244.3.160.204 TCP 64 http > 18204 [SYN, ACK] Seq=0 Ack=1 Win=24820 Len=0 MSS=1460
169604  56.499787 244.3.160.254 -> 244.3.160.204 TCP 64 www-dev > 18205 [RST, ACK] Seq=1 Ack=1 Win=0 Len=0
169608  56.500004 244.3.160.254 -> 244.3.160.204 TCP 64 aic-np > 18206 [RST, ACK] Seq=1 Ack=1 Win=0 Len=0
169983  56.588319 244.3.160.254 -> 244.3.160.204 TCP 64 https > 18203 [ACK] Seq=1 Ack=2 Win=24820 Len=0
169991  56.589369 244.3.160.254 -> 244.3.160.204 TCP 64 http > 18204 [ACK] Seq=1 Ack=2 Win=24820 Len=0
169998  56.589735 244.3.160.254 -> 244.3.160.204 TCP 64 https > 18203 [FIN, ACK] Seq=1 Ack=2 Win=24820 Len=0
170001  56.590474 244.3.160.254 -> 244.3.160.204 TCP 64 http > 18204 [FIN, ACK] Seq=1 Ack=2 Win=24820 Len=0
175876  58.498127 244.3.160.254 -> 244.3.160.204 TCP 64 terabase > 18540 [SYN, ACK] Seq=0 Ack=1 Win=24820 Len=0 MSS=1460
175878  58.498349 244.3.160.254 -> 244.3.160.204 TCP 64 newoak > 18541 [RST, ACK] Seq=1 Ack=1 Win=0 Len=0
175882  58.498662 244.3.160.254 -> 244.3.160.204 TCP 64 pxc-spvr-ft > 18542 [RST, ACK] Seq=1 Ack=1 Win=0 Len=0
175884  58.498904 244.3.160.254 -> 244.3.160.204 TCP 64 dls-monitor > 18543 [RST, ACK] Seq=1 Ack=1 Win=0 Len=0
175886  58.499172 244.3.160.254 -> 244.3.160.204 TCP 64 https > 18544 [SYN, ACK] Seq=0 Ack=1 Win=24820 Len=0 MSS=1460
175888  58.499434 244.3.160.254 -> 244.3.160.204 TCP 64 http > 18545 [SYN, ACK] Seq=0 Ack=1 Win=24820 Len=0 MSS=1460
176050  58.586234 244.3.160.254 -> 244.3.160.204 TCP 64 terabase > 18540 [ACK] Seq=1 Ack=2 Win=24820 Len=0
176052  58.586496 244.3.160.254 -> 244.3.160.204 TCP 64 terabase > 18540 [FIN, ACK] Seq=1 Ack=2 Win=24820 Len=0
176060  58.589224 244.3.160.254 -> 244.3.160.204 TCP 64 https > 18544 [ACK] Seq=1 Ack=2 Win=24820 Len=0
176061  58.590080 244.3.160.254 -> 244.3.160.204 TCP 64 https > 18544 [FIN, ACK] Seq=1 Ack=2 Win=24820 Len=0
176064  58.590742 244.3.160.254 -> 244.3.160.204 TCP 64 http > 18545 [ACK] Seq=1 Ack=2 Win=24820 Len=0
176065  58.590915 244.3.160.254 -> 244.3.160.204 TCP 64 http > 18545 [FIN, ACK] Seq=1 Ack=2 Win=24820 Len=0
179680  60.499369 244.3.160.254 -> 244.3.160.204 TCP 64 www-dev > 18871 [RST, ACK] Seq=1 Ack=1 Win=0 Len=0
179682  60.499652 244.3.160.254 -> 244.3.160.204 TCP 64 aic-np > 18872 [RST, ACK] Seq=1 Ack=1 Win=0 Len=0
179684  60.499946 244.3.160.254 -> 244.3.160.204 TCP 64 terabase > 18873 [SYN, ACK] Seq=0 Ack=1 Win=24820 Len=0 MSS=1460
179686  60.500185 244.3.160.254 -> 244.3.160.204 TCP 64 newoak > 18874 [RST, ACK] Seq=1 Ack=1 Win=0 Len=0
179688  60.500455 244.3.160.254 -> 244.3.160.204 TCP 64 pxc-spvr-ft > 18875 [RST, ACK] Seq=1 Ack=1 Win=0 Len=0
179692  60.500941 244.3.160.254 -> 244.3.160.204 TCP 64 dls-monitor > 18876 [RST, ACK] Seq=1 Ack=1 Win=0 Len=0
179970  60.594960 244.3.160.254 -> 244.3.160.204 TCP 64 terabase > 18873 [ACK] Seq=1 Ack=2 Win=24820 Len=0
179971  60.595202 244.3.160.254 -> 244.3.160.204 TCP 64 terabase > 18873 [FIN, ACK] Seq=1 Ack=2 Win=24820 Len=0
186259  62.499298 244.3.160.254 -> 244.3.160.204 TCP 64 https > 19205 [SYN, ACK] Seq=0 Ack=1 Win=24820 Len=0 MSS=1460
186261  62.499556 244.3.160.254 -> 244.3.160.204 TCP 64 http > 19206 [SYN, ACK] Seq=0 Ack=1 Win=24820 Len=0 MSS=1460
186264  62.499813 244.3.160.254 -> 244.3.160.204 TCP 64 www-dev > 19207 [RST, ACK] Seq=1 Ack=1 Win=0 Len=0
186269  62.500087 244.3.160.254 -> 244.3.160.204 TCP 64 aic-np > 19208 [RST, ACK] Seq=1 Ack=1 Win=0 Len=0
186281  62.500388 244.3.160.254 -> 244.3.160.204 TCP 64 terabase > 19209 [SYN, ACK] Seq=0 Ack=1 Win=24820 Len=0 MSS=1460
186287  62.500603 244.3.160.254 -> 244.3.160.204 TCP 64 newoak > 19210 [RST, ACK] Seq=1 Ack=1 Win=0 Len=0
186445  62.590064 244.3.160.254 -> 244.3.160.204 TCP 64 https > 19205 [ACK] Seq=1 Ack=2 Win=24820 Len=0
186454  62.591023 244.3.160.254 -> 244.3.160.204 TCP 64 https > 19205 [FIN, ACK] Seq=1 Ack=2 Win=24820 Len=0
