596   0.152641 244.3.210.197 -> 244.253.127.211 TCP 92 [TCP segment of a reassembled PDU]
1197   0.329369 244.3.210.197 -> 106.37.181.3 TCP 70 [TCP ACKed unseen segment] http > 55080 [ACK] Seq=1 Ack=2 Win=65200 Len=0 TSval=150406618 TSecr=3200278917
10291   3.548244 244.3.210.197 -> 77.197.210.51 TCP 66 http > 22598 [SYN, ACK] Seq=0 Ack=1 Win=16384 Len=0 MSS=1460 SACK_PERM=1
12302   3.762427 244.3.210.197 -> 77.197.210.51 TCP 64 http > 22598 [ACK] Seq=1 Ack=338 Win=65198 Len=0
14544   4.094328 244.3.210.197 -> 77.197.128.223 TCP 66 http > 43512 [SYN, ACK] Seq=0 Ack=1 Win=16384 Len=0 MSS=1460 SACK_PERM=1
15919   4.324957 244.3.210.197 -> 77.197.128.223 TCP 64 http > 43512 [ACK] Seq=1 Ack=335 Win=65201 Len=0
16480   4.499438 244.3.210.197 -> 106.37.181.3 TCP 70 [TCP ACKed unseen segment] http > 55080 [ACK] Seq=1 Ack=324 Win=64878 Len=0 TSval=150406660 TSecr=3200333514
16754   4.597718 244.3.210.197 -> 68.157.168.82 TCP 70 http > 41764 [ACK] Seq=1 Ack=2 Win=65276 Len=0 TSval=150404058 TSecr=3043404904
16755   4.597722 244.3.210.197 -> 68.157.168.82 TCP 70 http > 41764 [FIN, ACK] Seq=1 Ack=2 Win=65276 Len=0 TSval=150404058 TSecr=3043404904
17362   4.991710 244.3.210.197 -> 106.37.181.3 TCP 70 http > 55080 [ACK] Seq=15970 Ack=325 Win=64878 Len=0 TSval=150406665 TSecr=3200334301
17366   4.991745 244.3.210.197 -> 106.37.181.3 TCP 70 http > 55080 [FIN, ACK] Seq=15970 Ack=325 Win=64878 Len=0 TSval=150406665 TSecr=3200334301
20853   6.898188 244.3.210.197 -> 46.90.205.219 TCP 66 http > dzoglserver [SYN, ACK] Seq=0 Ack=1 Win=16384 Len=0 MSS=1460 SACK_PERM=1
21042   7.019495 244.3.210.197 -> 244.3.2.111  TCP 64 http > terabase [ACK] Seq=1 Ack=1181 Win=64355 Len=0
21182   7.153051 244.3.210.197 -> 46.90.205.219 TCP 64 http > dzoglserver [ACK] Seq=1 Ack=609 Win=64927 Len=0
21854   7.628228 244.3.210.197 -> 46.90.205.219 TCP 66 http > ovsam-mgmt [SYN, ACK] Seq=0 Ack=1 Win=16384 Len=0 MSS=1460 SACK_PERM=1
22169   7.802206 244.3.210.197 -> 46.90.205.219 TCP 64 http > ovsam-mgmt [ACK] Seq=7301 Ack=830 Win=64707 Len=0
22180   7.806175 244.3.210.197 -> 46.90.205.219 TCP 66 http > avocent-adsap [SYN, ACK] Seq=0 Ack=1 Win=16384 Len=0 MSS=1460 SACK_PERM=1
22346   7.920062 244.3.210.197 -> 46.90.205.219 TCP 64 http > dzoglserver [ACK] Seq=28111 Ack=1435 Win=64102 Len=0
22347   7.920067 244.3.210.197 -> 46.90.205.219 TCP 64 http > dzoglserver [FIN, ACK] Seq=28111 Ack=1435 Win=64102 Len=0
22350   7.920089 244.3.210.197 -> 46.90.205.219 TCP 66 http > fagordnc [SYN, ACK] Seq=0 Ack=1 Win=16384 Len=0 MSS=1460 SACK_PERM=1
22678   8.096276 244.3.210.197 -> 46.90.205.219 TCP 64 http > fagordnc [ACK] Seq=3301 Ack=830 Win=64707 Len=0
22679   8.096280 244.3.210.197 -> 46.90.205.219 TCP 64 http > fagordnc [FIN, ACK] Seq=3301 Ack=830 Win=64707 Len=0
22746   8.158548 244.3.210.197 -> 219.93.25.120 TCP 64 http > 47471 [RST, ACK] Seq=1 Ack=1 Win=0 Len=0
22747   8.158573 244.3.210.197 -> 219.93.25.120 TCP 64 http > 47482 [RST, ACK] Seq=1 Ack=1 Win=0 Len=0
22748   8.158600 244.3.210.197 -> 219.93.25.120 TCP 64 http > 47473 [RST, ACK] Seq=1 Ack=1 Win=0 Len=0
22749   8.158627 244.3.210.197 -> 219.93.25.120 TCP 64 http > 47476 [RST, ACK] Seq=1 Ack=1 Win=0 Len=0
22750   8.158659 244.3.210.197 -> 219.93.25.120 TCP 64 http > 47477 [RST, ACK] Seq=1 Ack=1 Win=0 Len=0
22751   8.158680 244.3.210.197 -> 219.93.25.120 TCP 64 http > 47481 [RST, ACK] Seq=1 Ack=1 Win=0 Len=0
22752   8.158724 244.3.210.197 -> 219.93.25.120 TCP 64 http > 47480 [RST, ACK] Seq=1 Ack=1 Win=0 Len=0
22753   8.158729 244.3.210.197 -> 219.93.25.120 TCP 64 http > 47475 [RST, ACK] Seq=1 Ack=1 Win=0 Len=0
22754   8.158767 244.3.210.197 -> 219.93.25.120 TCP 64 http > 47474 [RST, ACK] Seq=1 Ack=1 Win=0 Len=0
22755   8.158772 244.3.210.197 -> 219.93.25.120 TCP 64 http > 47485 [RST, ACK] Seq=1 Ack=1 Win=0 Len=0
22756   8.158795 244.3.210.197 -> 219.93.25.120 TCP 64 http > 47470 [RST, ACK] Seq=1 Ack=1 Win=0 Len=0
22757   8.158815 244.3.210.197 -> 219.93.25.120 TCP 64 http > 47478 [RST, ACK] Seq=1 Ack=1 Win=0 Len=0
24229   9.031991 244.3.210.197 -> 46.90.205.219 TCP 66 http > pnbscada [SYN, ACK] Seq=0 Ack=1 Win=16384 Len=0 MSS=1460 SACK_PERM=1
24313   9.121799 244.3.210.197 -> 244.3.2.111  TCP 64 http > newoak [ACK] Seq=1 Ack=1107 Win=64429 Len=0
24398   9.208004 244.3.210.197 -> 46.90.205.219 TCP 64 http > pnbscada [FIN, ACK] Seq=2669 Ack=833 Win=64704 Len=0
24399   9.208009 244.3.210.197 -> 46.90.205.219 TCP 64 [TCP Dup ACK 24398#1] http > pnbscada [ACK] Seq=2670 Ack=833 Win=64704 Len=0
24435   9.246229 244.3.210.197 -> 46.90.205.219 TCP 66 http > xmpcr-interface [SYN, ACK] Seq=0 Ack=1 Win=16384 Len=0 MSS=1460 SACK_PERM=1
24628   9.354405 244.3.210.197 -> 46.90.205.219 TCP 66 http > appss-lm [SYN, ACK] Seq=0 Ack=1 Win=16384 Len=0 MSS=1460 SACK_PERM=1
24746   9.424183 244.3.210.197 -> 46.90.205.219 TCP 64 http > xmpcr-interface [ACK] Seq=4904 Ack=828 Win=64709 Len=0
24748   9.424192 244.3.210.197 -> 46.90.205.219 TCP 64 http > xmpcr-interface [FIN, ACK] Seq=4904 Ack=828 Win=64709 Len=0
25014   9.552173 244.3.210.197 -> 46.90.205.219 TCP 66 http > idac [SYN, ACK] Seq=0 Ack=1 Win=16384 Len=0 MSS=1460 SACK_PERM=1
25180   9.674807 244.3.210.197 -> 46.90.205.219 TCP 66 http > vrpn [SYN, ACK] Seq=0 Ack=1 Win=16384 Len=0 MSS=1460 SACK_PERM=1
25234   9.727954 244.3.210.197 -> 46.90.205.219 TCP 64 http > idac [ACK] Seq=7301 Ack=829 Win=64708 Len=0
25317   9.752141 244.3.210.197 -> 46.90.205.219 TCP 66 http > topflow-ssl [SYN, ACK] Seq=0 Ack=1 Win=16384 Len=0 MSS=1460 SACK_PERM=1
25564   9.851938 244.3.210.197 -> 46.90.205.219 TCP 64 http > vrpn [ACK] Seq=7301 Ack=829 Win=64708 Len=0
25695   9.936437 244.3.210.197 -> 46.90.205.219 TCP 64 http > topflow-ssl [ACK] Seq=7301 Ack=826 Win=64711 Len=0
25880  10.060222 244.3.210.197 -> 46.90.205.219 TCP 66 http > gbmt-stars [SYN, ACK] Seq=0 Ack=1 Win=16384 Len=0 MSS=1460 SACK_PERM=1
26206  10.240142 244.3.210.197 -> 46.90.205.219 TCP 64 http > gbmt-stars [ACK] Seq=4753 Ack=842 Win=64695 Len=0
26207  10.240146 244.3.210.197 -> 46.90.205.219 TCP 64 http > gbmt-stars [FIN, ACK] Seq=4753 Ack=842 Win=64695 Len=0
26270  10.278248 244.3.210.197 -> 46.90.205.219 TCP 66 http > listcrt-port-2 [SYN, ACK] Seq=0 Ack=1 Win=16384 Len=0 MSS=1460 SACK_PERM=1
26501  10.424158 244.3.210.197 -> 46.90.205.219 TCP 66 http > wysdmc [SYN, ACK] Seq=0 Ack=1 Win=16384 Len=0 MSS=1460 SACK_PERM=1
26869  10.592840 244.3.210.197 -> 46.90.205.219 TCP 64 http > listcrt-port-2 [ACK] Seq=2698 Ack=830 Win=64707 Len=0
26870  10.592871 244.3.210.197 -> 46.90.205.219 TCP 64 http > listcrt-port-2 [FIN, ACK] Seq=2698 Ack=830 Win=64707 Len=0
26894  10.596244 244.3.210.197 -> 46.90.205.219 TCP 66 http > pktcablemmcops [SYN, ACK] Seq=0 Ack=1 Win=16384 Len=0 MSS=1460 SACK_PERM=1
27108  10.684794 244.3.210.197 -> 46.90.205.219 TCP 66 http > exasoftport1 [SYN, ACK] Seq=0 Ack=1 Win=16384 Len=0 MSS=1460 SACK_PERM=1
27116  10.684996 244.3.210.197 -> 46.90.205.219 TCP 64 http > wysdmc [ACK] Seq=2023 Ack=820 Win=64717 Len=0
27117  10.685001 244.3.210.197 -> 46.90.205.219 TCP 64 http > wysdmc [FIN, ACK] Seq=2023 Ack=820 Win=64717 Len=0
27296  10.774497 244.3.210.197 -> 46.90.205.219 TCP 64 http > pktcablemmcops [ACK] Seq=1807 Ack=827 Win=64710 Len=0
27298  10.774506 244.3.210.197 -> 46.90.205.219 TCP 64 http > pktcablemmcops [FIN, ACK] Seq=1807 Ack=827 Win=64710 Len=0
27466  10.860334 244.3.210.197 -> 46.90.205.219 TCP 64 http > exasoftport1 [ACK] Seq=7301 Ack=831 Win=64706 Len=0
27626  10.938890 244.3.210.197 -> 46.90.205.219 TCP 66 http > sor-update [SYN, ACK] Seq=0 Ack=1 Win=16384 Len=0 MSS=1460 SACK_PERM=1
27678  10.961551 244.3.210.197 -> 68.157.168.82 TCP 82 http > 62221 [SYN, ACK] Seq=0 Ack=1 Win=16384 Len=0 MSS=1460 WS=1 TSval=0 TSecr=0 SACK_PERM=1
27806  11.090649 244.3.210.197 -> 68.157.168.82 TCP 70 http > 62221 [ACK] Seq=1 Ack=344 Win=65192 Len=0 TSval=150404124 TSecr=3043411310
27873  11.119336 244.3.210.197 -> 46.90.205.219 TCP 64 http > sor-update [ACK] Seq=7301 Ack=830 Win=64707 Len=0
27932  11.165927 244.3.210.197 -> 46.90.205.219 TCP 66 http > mpl-gprs-port [SYN, ACK] Seq=0 Ack=1 Win=16384 Len=0 MSS=1460 SACK_PERM=1
28170  11.338028 244.3.210.197 -> 46.90.205.219 TCP 64 http > mpl-gprs-port [ACK] Seq=7301 Ack=826 Win=64711 Len=0
28434  11.462227 244.3.210.197 -> 46.90.205.219 TCP 66 http > winport [SYN, ACK] Seq=0 Ack=1 Win=16384 Len=0 MSS=1460 SACK_PERM=1
28725  11.642290 244.3.210.197 -> 46.90.205.219 TCP 64 http > winport [ACK] Seq=3558 Ack=827 Win=64710 Len=0
28726  11.642295 244.3.210.197 -> 46.90.205.219 TCP 64 http > winport [FIN, ACK] Seq=3558 Ack=827 Win=64710 Len=0
28876  11.738281 244.3.210.197 -> 46.90.205.219 TCP 66 http > netboot-pxe [SYN, ACK] Seq=0 Ack=1 Win=16384 Len=0 MSS=1460 SACK_PERM=1
29259  11.916591 244.3.210.197 -> 46.90.205.219 TCP 64 http > netboot-pxe [ACK] Seq=4350 Ack=831 Win=64706 Len=0
29261  11.916600 244.3.210.197 -> 46.90.205.219 TCP 64 http > netboot-pxe [FIN, ACK] Seq=4350 Ack=831 Win=64706 Len=0
29507  12.119956 244.3.210.197 -> 46.90.205.219 TCP 66 http > syam-webserver [SYN, ACK] Seq=0 Ack=1 Win=16384 Len=0 MSS=1460 SACK_PERM=1
29567  12.143549 244.3.210.197 -> 15.205.242.71 TCP 64 http > cft-5 [ACK] Seq=1 Ack=2 Win=64876 Len=0
29568  12.143569 244.3.210.197 -> 15.205.242.71 TCP 64 http > cft-5 [FIN, ACK] Seq=1 Ack=2 Win=64876 Len=0
29575  12.144447 244.3.210.197 -> 15.205.242.71 TCP 66 http > cft-7 [SYN, ACK] Seq=0 Ack=1 Win=16384 Len=0 MSS=1460 SACK_PERM=1
30206  12.579440 244.3.210.197 -> 215.43.132.151 TCP 66 http > 21748 [SYN, ACK] Seq=0 Ack=1 Win=16384 Len=0 MSS=1460 SACK_PERM=1
30392  12.666084 244.3.210.197 -> 46.90.205.219 TCP 64 http > syam-webserver [ACK] Seq=8974 Ack=1649 Win=65535 Len=0
30576  12.740126 244.3.210.197 -> 46.90.205.219 TCP 66 http > dyn-site [SYN, ACK] Seq=0 Ack=1 Win=16384 Len=0 MSS=1460 SACK_PERM=1
30697  12.775162 244.3.210.197 -> 215.43.132.151 TCP 66 http > 21750 [SYN, ACK] Seq=0 Ack=1 Win=16384 Len=0 MSS=1460 SACK_PERM=1
30919  12.922038 244.3.210.197 -> 46.90.205.219 TCP 80 [TCP segment of a reassembled PDU]
30939  12.925992 244.3.210.197 -> 46.90.205.219 TCP 64 http > dyn-site [ACK] Seq=5863 Ack=835 Win=64702 Len=0
30941  12.925999 244.3.210.197 -> 46.90.205.219 TCP 64 http > dyn-site [FIN, ACK] Seq=5863 Ack=835 Win=64702 Len=0
30966  12.962155 244.3.210.197 -> 46.90.205.219 TCP 66 http > sunfm-port [SYN, ACK] Seq=0 Ack=1 Win=16384 Len=0 MSS=1460 SACK_PERM=1
31094  13.049170 244.3.210.197 -> 215.43.132.151 TCP 64 http > 21750 [ACK] Seq=1 Ack=896 Win=64640 Len=0
31182  13.138123 244.3.210.197 -> 46.90.205.219 TCP 64 http > sunfm-port [ACK] Seq=3457 Ack=831 Win=64706 Len=0
31184  13.138133 244.3.210.197 -> 46.90.205.219 TCP 64 http > sunfm-port [FIN, ACK] Seq=3457 Ack=831 Win=64706 Len=0
31210  13.158541 244.3.210.197 -> 219.93.25.120 TCP 64 http > 47469 [RST, ACK] Seq=1 Ack=1 Win=0 Len=0
31211  13.158593 244.3.210.197 -> 219.93.25.120 TCP 64 http > 47484 [RST, ACK] Seq=1 Ack=1 Win=0 Len=0
31212  13.158598 244.3.210.197 -> 219.93.25.120 TCP 64 http > 47483 [RST, ACK] Seq=1 Ack=1 Win=0 Len=0
31213  13.158620 244.3.210.197 -> 219.93.25.120 TCP 64 http > 47491 [RST, ACK] Seq=1 Ack=1 Win=0 Len=0
31214  13.158646 244.3.210.197 -> 219.93.25.120 TCP 64 http > 47468 [RST, ACK] Seq=1 Ack=1 Win=0 Len=0
31215  13.158676 244.3.210.197 -> 219.93.25.120 TCP 64 http > 47497 [RST, ACK] Seq=1 Ack=1 Win=0 Len=0
31216  13.158702 244.3.210.197 -> 219.93.25.120 TCP 64 http > 48123 [RST, ACK] Seq=1 Ack=1 Win=0 Len=0
31217  13.158738 244.3.210.197 -> 219.93.25.120 TCP 64 http > 47389 [RST, ACK] Seq=1 Ack=1 Win=0 Len=0
31218  13.158759 244.3.210.197 -> 219.93.25.120 TCP 64 http > 47496 [RST, ACK] Seq=1 Ack=1 Win=0 Len=0
31219  13.158780 244.3.210.197 -> 219.93.25.120 TCP 64 http > 47699 [RST, ACK] Seq=1 Ack=1 Win=0 Len=0
31220  13.158813 244.3.210.197 -> 219.93.25.120 TCP 64 http > 47479 [RST, ACK] Seq=1 Ack=1 Win=0 Len=0
31221  13.158837 244.3.210.197 -> 219.93.25.120 TCP 64 http > 47472 [RST, ACK] Seq=1 Ack=1 Win=0 Len=0
31256  13.209920 244.3.210.197 -> 46.90.205.219 TCP 66 http > proaxess [SYN, ACK] Seq=0 Ack=1 Win=16384 Len=0 MSS=1460 SACK_PERM=1
31501  13.357654 244.3.210.197 -> 215.43.132.151 TCP 66 http > 21755 [SYN, ACK] Seq=0 Ack=1 Win=16384 Len=0 MSS=1460 SACK_PERM=1
31747  13.388049 244.3.210.197 -> 46.90.205.219 TCP 64 http > proaxess [ACK] Seq=7301 Ack=824 Win=64713 Len=0
32115  13.626264 244.3.210.197 -> 46.90.205.219 TCP 66 http > thrp [SYN, ACK] Seq=0 Ack=1 Win=16384 Len=0 MSS=1460 SACK_PERM=1
32329  13.721975 244.3.210.197 -> 46.90.205.219 TCP 66 http > ati-ip-to-ncpe [SYN, ACK] Seq=0 Ack=1 Win=16384 Len=0 MSS=1460 SACK_PERM=1
32524  13.802132 244.3.210.197 -> 46.90.205.219 TCP 64 http > thrp [ACK] Seq=7301 Ack=837 Win=64700 Len=0
32549  13.806830 244.3.210.197 -> 46.90.205.219 TCP 66 http > ppsms [SYN, ACK] Seq=0 Ack=1 Win=16384 Len=0 MSS=1460 SACK_PERM=1
32802  13.898185 244.3.210.197 -> 46.90.205.219 TCP 64 http > ati-ip-to-ncpe [ACK] Seq=7301 Ack=830 Win=64707 Len=0
32803  13.898188 244.3.210.197 -> 46.90.205.219 TCP 66 http > landmarks [SYN, ACK] Seq=0 Ack=1 Win=16384 Len=0 MSS=1460 SACK_PERM=1
33255  14.078062 244.3.210.197 -> 46.90.205.219 TCP 64 http > ppsms [ACK] Seq=7752 Ack=1688 Win=65535 Len=0
33257  14.078071 244.3.210.197 -> 46.90.205.219 TCP 64 http > ppsms [FIN, ACK] Seq=7752 Ack=1688 Win=65535 Len=0
33259  14.078086 244.3.210.197 -> 46.90.205.219 TCP 66 http > lanrevserver [SYN, ACK] Seq=0 Ack=1 Win=16384 Len=0 MSS=1460 SACK_PERM=1
33628  14.278185 244.3.210.197 -> 46.90.205.219 TCP 64 http > lanrevserver [ACK] Seq=2130 Ack=849 Win=64688 Len=0
33629  14.278190 244.3.210.197 -> 46.90.205.219 TCP 64 http > lanrevserver [FIN, ACK] Seq=2130 Ack=849 Win=64688 Len=0
33694  14.312216 244.3.210.197 -> 46.90.205.219 TCP 64 http > landmarks [ACK] Seq=2332 Ack=1678 Win=65535 Len=0
33696  14.312225 244.3.210.197 -> 46.90.205.219 TCP 64 http > landmarks [FIN, ACK] Seq=2332 Ack=1678 Win=65535 Len=0
34016  14.446804 244.3.210.197 -> 68.159.161.47 TCP 70 http > 47517 [SYN, ACK] Seq=0 Ack=1 Win=16384 Len=0 MSS=1460 WS=1 SACK_PERM=1
34708  14.606194 244.3.210.197 -> 68.159.161.47 TCP 64 http > 47517 [ACK] Seq=1 Ack=320 Win=65216 Len=0
36136  15.077070 244.3.210.197 -> 68.159.161.47 TCP 64 http > 47517 [ACK] Seq=21849 Ack=321 Win=65216 Len=0
41048  17.144053 244.3.210.197 -> 46.90.205.219 TCP 66 http > opswmanager [SYN, ACK] Seq=0 Ack=1 Win=16384 Len=0 MSS=1460 SACK_PERM=1
41524  17.319979 244.3.210.197 -> 46.90.205.219 TCP 64 http > opswmanager [ACK] Seq=3030 Ack=840 Win=64697 Len=0
41525  17.320041 244.3.210.197 -> 46.90.205.219 TCP 64 http > opswmanager [FIN, ACK] Seq=3030 Ack=840 Win=64697 Len=0
41657  17.369949 244.3.210.197 -> 68.157.168.82 TCP 70 http > 62221 [ACK] Seq=14816 Ack=345 Win=65192 Len=0 TSval=150404186 TSecr=3043417675
41658  17.369954 244.3.210.197 -> 68.157.168.82 TCP 70 http > 62221 [FIN, ACK] Seq=14816 Ack=345 Win=65192 Len=0 TSval=150404186 TSecr=3043417675
42241  17.626242 244.3.210.197 -> 77.197.128.223 TCP 66 http > 51861 [SYN, ACK] Seq=0 Ack=1 Win=16384 Len=0 MSS=1460 SACK_PERM=1
42646  17.977946 244.3.210.197 -> 215.43.132.151 TCP 64 http > 21750 [ACK] Seq=58731 Ack=21461 Win=64504 Len=0
42691  17.996828 244.3.210.197 -> 77.197.128.223 TCP 64 http > 51861 [ACK] Seq=1 Ack=249 Win=65287 Len=0
45092  18.872441 244.3.210.197 -> 85.224.39.201 TCP 70 http > 40462 [SYN, ACK] Seq=0 Ack=1 Win=16384 Len=0 MSS=1460 WS=1 SACK_PERM=1
45543  19.084419 244.3.210.197 -> 85.224.39.201 TCP 64 http > 40462 [ACK] Seq=1 Ack=1120 Win=64416 Len=0
46792  19.451648 244.3.210.197 -> 85.224.39.201 TCP 70 http > 40499 [SYN, ACK] Seq=0 Ack=1 Win=16384 Len=0 MSS=1460 WS=1 SACK_PERM=1
48574  19.841502 244.3.210.197 -> 85.224.39.201 TCP 64 [TCP segment of a reassembled PDU]
51536  21.173444 244.3.210.197 -> 85.224.39.201 TCP 81 [TCP segment of a reassembled PDU]
56018  23.030223 244.3.210.197 -> 90.123.22.163 TCP 64 http > cs-services [ACK] Seq=1 Ack=2 Win=64605 Len=0
56019  23.030257 244.3.210.197 -> 90.123.22.163 TCP 64 http > cs-services [FIN, ACK] Seq=1 Ack=2 Win=64605 Len=0
61580  25.190332 244.3.210.197 -> 15.186.110.41 TCP 82 http > 38842 [SYN, ACK] Seq=0 Ack=1 Win=16384 Len=0 MSS=1460 WS=1 TSval=0 TSecr=0 SACK_PERM=1
61829  25.320761 244.3.210.197 -> 215.43.132.151 TCP 64 http > 21755 [ACK] Seq=74692 Ack=28568 Win=64477 Len=0
62016  25.434346 244.3.210.197 -> 15.186.110.41 TCP 70 http > 38842 [ACK] Seq=1 Ack=457 Win=65079 Len=0 TSval=150404267 TSecr=1208731304
62722  25.794422 244.3.210.197 -> 15.186.110.41 TCP 70 http > 38842 [ACK] Seq=17278 Ack=458 Win=65079 Len=0 TSval=150404270 TSecr=1208731839
65232  26.936764 244.3.210.197 -> 18.106.181.41 TCP 66 http > fast-rem-serv [SYN, ACK] Seq=0 Ack=1 Win=16384 Len=0 MSS=1460 SACK_PERM=1
65937  27.168848 244.3.210.197 -> 18.106.181.41 TCP 64 http > fast-rem-serv [ACK] Seq=1 Ack=677 Win=64859 Len=0
68118  28.040457 244.3.210.197 -> 90.123.22.163 TCP 64 http > distcc [ACK] Seq=1 Ack=2 Win=64252 Len=0
68119  28.040488 244.3.210.197 -> 90.123.22.163 TCP 64 http > distcc [FIN, ACK] Seq=1 Ack=2 Win=64252 Len=0
68377  28.158540 244.3.210.197 -> 165.176.177.194 TCP 64 http > 59313 [RST, ACK] Seq=1 Ack=1 Win=0 Len=0
68378  28.158579 244.3.210.197 -> 165.176.177.194 TCP 64 http > 59315 [RST, ACK] Seq=1 Ack=1 Win=0 Len=0
68379  28.158584 244.3.210.197 -> 165.176.177.194 TCP 64 http > 59314 [RST, ACK] Seq=1 Ack=1 Win=0 Len=0
68380  28.158612 244.3.210.197 -> 165.176.177.194 TCP 64 http > 59312 [RST, ACK] Seq=1 Ack=1 Win=0 Len=0
69614  28.853798 244.3.210.197 -> 168.91.64.164 TCP 66 http > 38480 [SYN, ACK] Seq=0 Ack=1 Win=16384 Len=0 MSS=1460 SACK_PERM=1
69670  28.892210 244.3.210.197 -> 68.157.168.82 TCP 82 http > 35806 [SYN, ACK] Seq=0 Ack=1 Win=16384 Len=0 MSS=1460 WS=1 TSval=0 TSecr=0 SACK_PERM=1
70064  29.042426 244.3.210.197 -> 168.91.64.164 TCP 64 http > 38480 [ACK] Seq=1 Ack=55 Win=65481 Len=0
70323  29.137498 244.3.210.197 -> 68.157.168.82 TCP 70 http > 35806 [ACK] Seq=1 Ack=299 Win=65237 Len=0 TSval=150404304 TSecr=3043429240
70457  29.171939 244.3.210.197 -> 48.244.75.47 TCP 64 [TCP Dup ACK 69124#1] http > 7773 [ACK] Seq=3457 Ack=2052 Win=64457 Len=0
70475  29.178059 244.3.210.197 -> 68.157.168.82 TCP 70 [TCP Dup ACK 70323#1] http > 35806 [ACK] Seq=1 Ack=299 Win=65237 Len=0 TSval=150404304 TSecr=3043429240
71159  29.377791 244.3.210.197 -> 41.177.177.210 TCP 66 http > fjippol-cnsl [SYN, ACK] Seq=0 Ack=1 Win=16384 Len=0 MSS=1460 SACK_PERM=1
71203  29.387023 244.3.210.197 -> 41.177.177.210 TCP 66 http > fjippol-port1 [SYN, ACK] Seq=0 Ack=1 Win=16384 Len=0 MSS=1460 SACK_PERM=1
72595  29.710936 244.3.210.197 -> 41.177.244.46 TCP 66 http > nm-asses-admin [SYN, ACK] Seq=0 Ack=1 Win=16384 Len=0 MSS=1460 SACK_PERM=1
85358  33.165144 244.3.210.197 -> 18.106.181.41 TCP 66 http > quaddb [SYN, ACK] Seq=0 Ack=1 Win=16384 Len=0 MSS=1460 SACK_PERM=1
86281  33.525908 244.3.210.197 -> 77.197.128.215 TCP 66 http > 51341 [SYN, ACK] Seq=0 Ack=1 Win=16384 Len=0 MSS=1460 SACK_PERM=1
86404  33.568753 244.3.210.197 -> 145.30.75.25 TCP 66 http > 42620 [SYN, ACK] Seq=0 Ack=1 Win=16384 Len=0 MSS=1460 SACK_PERM=1
86560  33.604020 244.3.210.197 -> 219.24.194.210 TCP 70 http > 45832 [ACK] Seq=1 Ack=2 Win=65535 Len=0 TSval=150406951 TSecr=387637667
86561  33.604064 244.3.210.197 -> 219.24.194.210 TCP 70 http > 45832 [FIN, ACK] Seq=1 Ack=2 Win=65535 Len=0 TSval=150406951 TSecr=387637667
86606  33.608000 244.3.210.197 -> 77.197.128.215 TCP 64 http > 51341 [FIN, ACK] Seq=206 Ack=222 Win=65314 Len=0
87730  33.950009 244.3.210.197 -> 145.30.75.25 TCP 64 http > 42620 [ACK] Seq=1 Ack=925 Win=64611 Len=0
88156  34.121103 244.3.210.197 -> 145.30.75.25 TCP 66 http > 42741 [SYN, ACK] Seq=0 Ack=1 Win=16384 Len=0 MSS=1460 SACK_PERM=1
88208  34.138116 244.3.210.197 -> 68.83.197.15 TCP 66 http > 29278 [SYN, ACK] Seq=0 Ack=1 Win=16384 Len=0 MSS=1460 SACK_PERM=1
88733  34.278181 244.3.210.197 -> 68.83.197.15 TCP 64 http > 29278 [ACK] Seq=1 Ack=562 Win=64974 Len=0
89397  34.533130 244.3.210.197 -> 68.83.197.15 TCP 66 http > 29279 [SYN, ACK] Seq=0 Ack=1 Win=16384 Len=0 MSS=1460 SACK_PERM=1
89416  34.534895 244.3.210.197 -> 68.83.197.15 TCP 66 http > 29280 [SYN, ACK] Seq=0 Ack=1 Win=16384 Len=0 MSS=1460 SACK_PERM=1
89427  34.536299 244.3.210.197 -> 68.83.197.15 TCP 66 http > 29281 [SYN, ACK] Seq=0 Ack=1 Win=16384 Len=0 MSS=1460 SACK_PERM=1
89436  34.538156 244.3.210.197 -> 68.83.197.15 TCP 66 http > 29282 [SYN, ACK] Seq=0 Ack=1 Win=16384 Len=0 MSS=1460 SACK_PERM=1
89457  34.540628 244.3.210.197 -> 68.83.197.15 TCP 66 http > 29283 [SYN, ACK] Seq=0 Ack=1 Win=16384 Len=0 MSS=1460 SACK_PERM=1
91258  35.077495 244.3.210.197 -> 85.224.39.201 TCP 64 http > 40462 [ACK] Seq=328950 Ack=13681 Win=65535 Len=0
91514  35.145797 244.3.210.197 -> 68.157.168.82 TCP 70 http > 35806 [ACK] Seq=16031 Ack=300 Win=65237 Len=0 TSval=150404363 TSecr=3043435450
91517  35.145843 244.3.210.197 -> 68.157.168.82 TCP 70 http > 35806 [FIN, ACK] Seq=16031 Ack=300 Win=65237 Len=0 TSval=150404363 TSecr=3043435450
93651  35.725444 244.3.210.197 -> 41.235.38.38 TCP 64 http > 21638 [SYN, ACK] Seq=0 Ack=1 Win=16384 Len=0 MSS=1460
94359  35.814130 244.3.210.197 -> 85.224.39.201 TCP 64 [TCP segment of a reassembled PDU]
95134  35.982985 244.3.210.197 -> 41.235.38.38 TCP 64 http > 21638 [ACK] Seq=1 Ack=959 Win=64577 Len=0
98130  36.638987 244.3.210.197 -> 41.235.38.38 TCP 64 http > 21639 [SYN, ACK] Seq=0 Ack=1 Win=16384 Len=0 MSS=1460
98148  36.640209 244.3.210.197 -> 41.235.38.38 TCP 64 http > 21640 [SYN, ACK] Seq=0 Ack=1 Win=16384 Len=0 MSS=1460
98203  36.651604 244.3.210.197 -> 41.235.38.38 TCP 64 http > 21641 [SYN, ACK] Seq=0 Ack=1 Win=16384 Len=0 MSS=1460
100659  37.135956 244.3.210.197 -> 85.224.39.201 TCP 81 [TCP segment of a reassembled PDU]
102321  37.431137 244.3.210.197 -> 68.83.197.15 TCP 79 [TCP segment of a reassembled PDU]
105638  38.106333 244.3.210.197 -> 145.30.75.25 TCP 64 http > 42741 [ACK] Seq=31366 Ack=23012 Win=65535 Len=0
105993  38.230829 244.3.210.197 -> 242.106.38.181 TCP 82 http > 46993 [SYN, ACK] Seq=0 Ack=1 Win=16384 Len=0 MSS=1460 WS=1 TSval=0 TSecr=0 SACK_PERM=1
106528  38.437923 244.3.210.197 -> 242.106.38.181 TCP 70 http > 46993 [ACK] Seq=1 Ack=335 Win=65201 Len=0 TSval=150404397 TSecr=961524422
107790  38.756410 244.3.210.197 -> 77.197.128.215 TCP 66 http > 55197 [SYN, ACK] Seq=0 Ack=1 Win=16384 Len=0 MSS=1460 SACK_PERM=1
107827  38.762453 244.3.210.197 -> 242.106.38.181 TCP 70 http > 46993 [ACK] Seq=15440 Ack=336 Win=65201 Len=0 TSval=150404399 TSecr=961524544
108383  38.996907 244.3.210.197 -> 77.197.128.215 TCP 64 http > 55197 [ACK] Seq=1 Ack=281 Win=65255 Len=0
112696  40.154214 244.3.210.197 -> 41.67.197.204 TCP 66 http > vaprtm [SYN, ACK] Seq=0 Ack=1 Win=16384 Len=0 MSS=1460 SACK_PERM=1
113835  40.509144 244.3.210.197 -> 41.67.197.204 TCP 64 http > vaprtm [ACK] Seq=1 Ack=886 Win=64650 Len=0
116841  41.769226 244.3.210.197 -> 41.67.197.204 TCP 66 http > abatemgr [SYN, ACK] Seq=0 Ack=1 Win=16384 Len=0 MSS=1460 SACK_PERM=1
117302  42.019882 244.3.210.197 -> 41.67.197.204 TCP 64 http > abatemgr [ACK] Seq=1 Ack=954 Win=64582 Len=0
118210  42.424026 244.3.210.197 -> 41.67.197.204 TCP 66 http > abatjss [SYN, ACK] Seq=0 Ack=1 Win=16384 Len=0 MSS=1460 SACK_PERM=1
118219  42.424935 244.3.210.197 -> 41.67.197.204 TCP 66 http > immedianet-bcn [SYN, ACK] Seq=0 Ack=1 Win=16384 Len=0 MSS=1460 SACK_PERM=1
118221  42.424961 244.3.210.197 -> 41.67.197.204 TCP 66 http > ps-ams [SYN, ACK] Seq=0 Ack=1 Win=16384 Len=0 MSS=1460 SACK_PERM=1
118231  42.425212 244.3.210.197 -> 41.67.197.204 TCP 66 http > apple-sasl [SYN, ACK] Seq=0 Ack=1 Win=16384 Len=0 MSS=1460 SACK_PERM=1
118256  42.445681 244.3.210.197 -> 41.67.197.204 TCP 66 http > can-nds-ssl [SYN, ACK] Seq=0 Ack=1 Win=16384 Len=0 MSS=1460 SACK_PERM=1
119364  42.793912 244.3.210.197 -> 41.67.197.204 TCP 81 [TCP segment of a reassembled PDU]
120574  43.017950 244.3.210.197 -> 41.67.197.204 TCP 64 [TCP segment of a reassembled PDU]
139076  48.158554 244.3.210.197 -> 151.117.210.81 TCP 64 http > 50622 [RST, ACK] Seq=1 Ack=1 Win=0 Len=0
139077  48.158587 244.3.210.197 -> 151.117.210.81 TCP 64 http > 50624 [RST, ACK] Seq=1 Ack=1 Win=0 Len=0
139078  48.158608 244.3.210.197 -> 151.117.210.81 TCP 64 http > 50616 [RST, ACK] Seq=1 Ack=1 Win=0 Len=0
139080  48.158668 244.3.210.197 -> 151.117.210.81 TCP 64 http > 50625 [RST, ACK] Seq=1 Ack=1 Win=0 Len=0
139082  48.158675 244.3.210.197 -> 151.117.210.81 TCP 64 http > 50619 [RST, ACK] Seq=1 Ack=1 Win=0 Len=0
145957  50.028492 244.3.210.197 -> 68.83.197.15 TCP 64 http > 29281 [ACK] Seq=77618 Ack=5474 Win=65535 Len=0
145960  50.028542 244.3.210.197 -> 92.194.214.155 TCP 66 http > prolink [SYN, ACK] Seq=0 Ack=1 Win=16384 Len=0 MSS=1460 SACK_PERM=1
145969  50.030329 244.3.210.197 -> 92.194.214.155 TCP 66 http > darcorp-lm [SYN, ACK] Seq=0 Ack=1 Win=16384 Len=0 MSS=1460 SACK_PERM=1
147413  50.575096 244.3.210.197 -> 92.194.214.155 TCP 64 http > darcorp-lm [ACK] Seq=2693 Ack=805 Win=64731 Len=0
153639  52.543837 244.3.210.197 -> 77.55.145.124 TCP 70 http > 22283 [ACK] Seq=1 Ack=1189 Win=65535 Len=0 TSval=150404538 TSecr=492122210
154049  52.632763 244.3.210.197 -> 77.55.145.124 TCP 70 http > 22283 [ACK] Seq=1 Ack=3565 Win=65535 Len=0 TSval=150404538 TSecr=492122212
154362  52.726451 244.3.210.197 -> 77.55.145.124 TCP 70 http > 22283 [ACK] Seq=1 Ack=5941 Win=65535 Len=0 TSval=150404539 TSecr=492122213
154368  52.726658 244.3.210.197 -> 77.55.145.124 TCP 70 http > 22283 [ACK] Seq=1 Ack=8317 Win=65535 Len=0 TSval=150404539 TSecr=492122213
154698  52.824452 244.3.210.197 -> 77.55.145.124 TCP 70 http > 22283 [ACK] Seq=1 Ack=10693 Win=65535 Len=0 TSval=150404540 TSecr=492122214
154708  52.824618 244.3.210.197 -> 77.55.145.124 TCP 70 http > 22283 [ACK] Seq=1 Ack=13069 Win=65535 Len=0 TSval=150404540 TSecr=492122214
154726  52.825384 244.3.210.197 -> 77.55.145.124 TCP 70 http > 22283 [ACK] Seq=1 Ack=15445 Win=65535 Len=0 TSval=150404540 TSecr=492122214
154738  52.825661 244.3.210.197 -> 77.55.145.124 TCP 70 http > 22283 [ACK] Seq=1 Ack=17821 Win=65535 Len=0 TSval=150404540 TSecr=492122214
154957  52.917633 244.3.210.197 -> 77.55.145.124 TCP 70 http > 22283 [ACK] Seq=1 Ack=20197 Win=65535 Len=0 TSval=150404541 TSecr=492122215
154972  52.918140 244.3.210.197 -> 77.55.145.124 TCP 70 http > 22283 [ACK] Seq=1 Ack=22573 Win=65535 Len=0 TSval=150404541 TSecr=492122215
154979  52.918571 244.3.210.197 -> 77.55.145.124 TCP 70 http > 22283 [ACK] Seq=1 Ack=24949 Win=65535 Len=0 TSval=150404541 TSecr=492122215
154983  52.918794 244.3.210.197 -> 77.55.145.124 TCP 70 http > 22283 [ACK] Seq=1 Ack=27325 Win=65535 Len=0 TSval=150404541 TSecr=492122215
155006  52.919304 244.3.210.197 -> 77.55.145.124 TCP 70 http > 22283 [ACK] Seq=1 Ack=29701 Win=65535 Len=0 TSval=150404541 TSecr=492122215
155015  52.919753 244.3.210.197 -> 77.55.145.124 TCP 70 http > 22283 [ACK] Seq=1 Ack=32077 Win=65535 Len=0 TSval=150404541 TSecr=492122215
155064  52.933975 244.3.210.197 -> 15.186.110.41 TCP 82 http > 41953 [SYN, ACK] Seq=0 Ack=1 Win=16384 Len=0 MSS=1460 WS=1 TSval=0 TSecr=0 SACK_PERM=1
155730  53.090940 244.3.210.197 -> 15.186.110.41 TCP 70 http > 41953 [ACK] Seq=1 Ack=424 Win=65112 Len=0 TSval=150404544 TSecr=1208759047
156778  53.389495 244.3.210.197 -> 15.186.110.41 TCP 70 http > 41953 [ACK] Seq=5464 Ack=425 Win=65112 Len=0 TSval=150404546 TSecr=1208759433
174935  58.158546 244.3.210.197 -> 128.132.91.123 TCP 64 http > 10558 [RST, ACK] Seq=1 Ack=1 Win=0 Len=0
175627  58.348683 244.3.210.197 -> 41.177.244.197 TCP 70 http > 49983 [ACK] Seq=1 Ack=930 Win=64606 Len=0 TSval=150404596 TSecr=547595742
177070  59.325996 244.3.210.197 -> 242.64.244.34 TCP 66 http > nim [SYN, ACK] Seq=0 Ack=1 Win=16384 Len=0 MSS=1460 SACK_PERM=1
177434  59.543946 244.3.210.197 -> 242.64.244.34 TCP 64 http > nim [ACK] Seq=1 Ack=639 Win=64897 Len=0
177510  59.587049 244.3.210.197 -> 106.37.181.3 TCP 82 http > 50129 [SYN, ACK] Seq=0 Ack=1 Win=16384 Len=0 MSS=1460 WS=1 TSval=0 TSecr=0 SACK_PERM=1
178495  59.932000 244.3.210.197 -> 106.37.181.3 TCP 70 http > 50129 [ACK] Seq=1 Ack=359 Win=65177 Len=0 TSval=150407215 TSecr=3200389084
181254  60.968800 244.3.210.197 -> 106.37.181.3 TCP 70 http > 50129 [ACK] Seq=17311 Ack=360 Win=65177 Len=0 TSval=150407225 TSecr=3200390277
183317  61.600563 244.3.210.197 -> 68.157.168.82 TCP 82 http > 53646 [SYN, ACK] Seq=0 Ack=1 Win=16384 Len=0 MSS=1460 WS=1 TSval=0 TSecr=0 SACK_PERM=1
184030  61.840773 244.3.210.197 -> 68.157.168.82 TCP 70 http > 53646 [ACK] Seq=1 Ack=304 Win=65232 Len=0 TSval=150404631 TSecr=3043461947
184687  62.076353 244.3.210.197 -> 77.197.176.180 TCP 66 http > 30173 [SYN, ACK] Seq=0 Ack=1 Win=16384 Len=0 MSS=1460 SACK_PERM=1
186000  62.334155 244.3.210.197 -> 77.197.176.180 TCP 66 http > 30185 [SYN, ACK] Seq=0 Ack=1 Win=16384 Len=0 MSS=1460 SACK_PERM=1
186947  63.070044 244.3.210.197 -> 242.64.244.34 TCP 66 http > polestar [SYN, ACK] Seq=0 Ack=1 Win=16384 Len=0 MSS=1460 SACK_PERM=1
186964  63.074012 244.3.210.197 -> 242.64.244.34 TCP 66 http > kiosk [SYN, ACK] Seq=0 Ack=1 Win=16384 Len=0 MSS=1460 SACK_PERM=1
186989  63.078050 244.3.210.197 -> 242.64.244.34 TCP 66 http > veracity [SYN, ACK] Seq=0 Ack=1 Win=16384 Len=0 MSS=1460 SACK_PERM=1
187002  63.086333 244.3.210.197 -> 242.64.244.34 TCP 66 http > kyoceranetdev [SYN, ACK] Seq=0 Ack=1 Win=16384 Len=0 MSS=1460 SACK_PERM=1
187010  63.090370 244.3.210.197 -> 242.64.244.34 TCP 66 http > jstel [SYN, ACK] Seq=0 Ack=1 Win=16384 Len=0 MSS=1460 SACK_PERM=1
187827  63.636748 244.3.210.197 -> 77.197.128.127 TCP 66 http > 34468 [SYN, ACK] Seq=0 Ack=1 Win=16384 Len=0 MSS=1460 SACK_PERM=1
188173  63.918961 244.3.210.197 -> 77.197.128.127 TCP 64 http > 34468 [ACK] Seq=1 Ack=331 Win=65205 Len=0
188315  64.003501 244.3.210.197 -> 15.186.13.152 TCP 78 http > 46038 [SYN, ACK] Seq=0 Ack=1 Win=57344 Len=0 MSS=1460 WS=1 TSval=1451830038 TSecr=556993526
188721  64.221960 244.3.210.197 -> 77.197.210.67 TCP 66 http > 24982 [SYN, ACK] Seq=0 Ack=1 Win=16384 Len=0 MSS=1460 SACK_PERM=1
188815  64.279393 244.3.210.197 -> 15.186.13.152 TCP 70 http > 46038 [ACK] Seq=11242 Ack=428 Win=57456 Len=0 TSval=1451830066 TSecr=556993802
189027  64.448584 244.3.210.197 -> 77.197.210.67 TCP 64 http > 24982 [ACK] Seq=1 Ack=337 Win=65199 Len=0
189623  64.918862 244.3.210.197 -> 77.197.210.67 TCP 67 [TCP segment of a reassembled PDU]
197776  67.841396 244.3.210.197 -> 68.157.168.82 TCP 70 http > 53646 [ACK] Seq=15420 Ack=305 Win=65232 Len=0 TSval=150404690 TSecr=3043468145
197777  67.841401 244.3.210.197 -> 68.157.168.82 TCP 70 http > 53646 [FIN, ACK] Seq=15420 Ack=305 Win=65232 Len=0 TSval=150404690 TSecr=3043468145
198842  68.335708 244.3.210.197 -> 68.83.160.23 TCP 78 odeumservlink > bb [SYN] Seq=0 Win=57344 Len=0 MSS=1460 WS=1 TSval=1451830471 TSecr=0
199281  68.532588 244.3.210.197 -> 197.154.223.202 TCP 78 http > 26077 [SYN, ACK] Seq=0 Ack=1 Win=16384 Len=0 MSS=1460 WS=1 TSval=0 TSecr=0
199887  68.840823 244.3.210.197 -> 197.154.223.202 TCP 70 http > 26077 [ACK] Seq=1 Ack=481 Win=65055 Len=0 TSval=150404701 TSecr=488226709
200210  69.013819 244.3.210.197 -> 197.154.223.202 TCP 78 http > 26106 [SYN, ACK] Seq=0 Ack=1 Win=16384 Len=0 MSS=1460 WS=1 TSval=0 TSecr=0
200215  69.014583 244.3.210.197 -> 197.154.223.202 TCP 78 http > 26107 [SYN, ACK] Seq=0 Ack=1 Win=16384 Len=0 MSS=1460 WS=1 TSval=0 TSecr=0
200222  69.014785 244.3.210.197 -> 197.154.223.202 TCP 78 http > 26108 [SYN, ACK] Seq=0 Ack=1 Win=16384 Len=0 MSS=1460 WS=1 TSval=0 TSecr=0
202842  69.981393 244.3.210.197 -> 254.40.33.71 TCP 64 http > 36169 [RST, ACK] Seq=1 Ack=1 Win=0 Len=0
202843  69.981428 244.3.210.197 -> 254.40.33.71 TCP 64 http > 64881 [RST, ACK] Seq=1 Ack=1 Win=0 Len=0
202844  69.981432 244.3.210.197 -> 254.40.33.71 TCP 64 http > 61765 [RST, ACK] Seq=1 Ack=1 Win=0 Len=0
202845  69.981451 244.3.210.197 -> 254.40.33.71 TCP 64 http > 59713 [RST, ACK] Seq=1 Ack=1 Win=0 Len=0
202846  69.981485 244.3.210.197 -> 254.40.33.71 TCP 64 http > 61773 [RST, ACK] Seq=1 Ack=1 Win=0 Len=0
202847  69.981500 244.3.210.197 -> 254.40.33.71 TCP 64 http > 64861 [RST, ACK] Seq=1 Ack=1 Win=0 Len=0
203522  70.152021 244.3.210.197 -> 68.89.213.164 TCP 66 http > 59443 [SYN, ACK] Seq=0 Ack=1 Win=16384 Len=0 MSS=1460 SACK_PERM=1
204595  70.386004 244.3.210.197 -> 68.89.213.164 TCP 64 http > 59443 [ACK] Seq=1 Ack=724 Win=64812 Len=0
205370  70.591045 244.3.210.197 -> 197.154.223.202 TCP 70 http > 26106 [ACK] Seq=112512 Ack=4702 Win=65535 Len=0 TSval=150404719 TSecr=488226713
207065  70.872992 244.3.210.197 -> 68.89.213.164 TCP 66 http > 59444 [SYN, ACK] Seq=0 Ack=1 Win=16384 Len=0 MSS=1460 SACK_PERM=1
208047  71.372061 244.3.210.197 -> 41.177.244.197 TCP 70 http > 49983 [ACK] Seq=16114 Ack=1881 Win=65535 Len=0 TSval=150404726 TSecr=547595873
208136  71.434859 244.3.210.197 -> 68.83.197.15 TCP 64 http > 29280 [ACK] Seq=110561 Ack=5219 Win=65535 Len=0
208137  71.434875 244.3.210.197 -> 68.83.197.15 TCP 64 http > 29280 [FIN, ACK] Seq=110561 Ack=5219 Win=65535 Len=0
208143  71.436132 244.3.210.197 -> 68.83.197.15 TCP 64 http > 29278 [ACK] Seq=118737 Ack=10417 Win=65535 Len=0
208145  71.436140 244.3.210.197 -> 68.83.197.15 TCP 64 http > 29278 [FIN, ACK] Seq=118737 Ack=10417 Win=65535 Len=0
208150  71.436822 244.3.210.197 -> 68.83.197.15 TCP 64 http > 29279 [ACK] Seq=98105 Ack=8361 Win=65535 Len=0
208151  71.436843 244.3.210.197 -> 68.83.197.15 TCP 64 http > 29279 [FIN, ACK] Seq=98105 Ack=8361 Win=65535 Len=0
208154  71.437036 244.3.210.197 -> 68.83.197.15 TCP 64 http > 29281 [ACK] Seq=101364 Ack=7241 Win=65535 Len=0
208155  71.437041 244.3.210.197 -> 68.83.197.15 TCP 64 http > 29281 [FIN, ACK] Seq=101364 Ack=7241 Win=65535 Len=0
208156  71.437045 244.3.210.197 -> 68.83.197.15 TCP 64 http > 29283 [ACK] Seq=172485 Ack=6229 Win=64659 Len=0
208157  71.437049 244.3.210.197 -> 68.83.197.15 TCP 64 http > 29283 [FIN, ACK] Seq=172485 Ack=6229 Win=64659 Len=0
208165  71.437281 244.3.210.197 -> 68.83.197.15 TCP 64 http > 29282 [ACK] Seq=77962 Ack=7424 Win=65535 Len=0
208167  71.437289 244.3.210.197 -> 68.83.197.15 TCP 64 http > 29282 [FIN, ACK] Seq=77962 Ack=7424 Win=65535 Len=0
208220  71.447753 244.3.210.197 -> 68.83.197.15 TCP 64 http > 29283 [RST] Seq=172486 Win=0 Len=0
208221  71.447757 244.3.210.197 -> 68.83.197.15 TCP 64 http > 29282 [RST] Seq=77963 Win=0 Len=0
208594  71.672069 244.3.210.197 -> 40.193.255.164 TCP 66 http > 33677 [SYN, ACK] Seq=0 Ack=1 Win=16384 Len=0 MSS=1460 SACK_PERM=1
212503  73.053377 244.3.210.197 -> 41.177.244.197 TCP 82 [TCP Out-Of-Order] [TCP segment of a reassembled PDU]
215030  73.811655 244.3.210.197 -> 197.154.223.202 TCP 70 http > 26077 [ACK] Seq=169314 Ack=6901 Win=64905 Len=0 TSval=150404750 TSecr=488226720
215031  73.811680 244.3.210.197 -> 197.154.223.202 TCP 70 http > 26077 [FIN, ACK] Seq=169314 Ack=6901 Win=64905 Len=0 TSval=150404750 TSecr=488226720
215032  73.811684 244.3.210.197 -> 197.154.223.202 TCP 70 http > 26106 [FIN, ACK] Seq=119192 Ack=5341 Win=64897 Len=0 TSval=150404750 TSecr=488226720
215034  73.811692 244.3.210.197 -> 197.154.223.202 TCP 70 [TCP Keep-Alive] http > 26106 [ACK] Seq=119192 Ack=5341 Win=64897 Len=0 TSval=150404750 TSecr=488226720
215043  73.811833 244.3.210.197 -> 197.154.223.202 TCP 70 http > 26107 [ACK] Seq=176547 Ack=3821 Win=64893 Len=0 TSval=150404750 TSecr=488226720
215044  73.811836 244.3.210.197 -> 197.154.223.202 TCP 70 http > 26107 [FIN, ACK] Seq=176547 Ack=3821 Win=64893 Len=0 TSval=150404750 TSecr=488226720
215053  73.812166 244.3.210.197 -> 197.154.223.202 TCP 70 http > 26108 [ACK] Seq=164861 Ack=3432 Win=65535 Len=0 TSval=150404750 TSecr=488226720
215054  73.812170 244.3.210.197 -> 197.154.223.202 TCP 70 http > 26108 [FIN, ACK] Seq=164861 Ack=3432 Win=65535 Len=0 TSval=150404750 TSecr=488226720
218032  74.434513 244.3.210.197 -> 197.154.223.202 TCP 70 [TCP Retransmission] http > 26106 [FIN, ACK] Seq=119192 Ack=5341 Win=64897 Len=0 TSval=150404757 TSecr=488226720
222630  76.278286 244.3.210.197 -> 77.55.145.124 TCP 70 http > 22283 [ACK] Seq=108614 Ack=33904 Win=65535 Len=0 TSval=150404775 TSecr=492122447
223219  76.451671 244.3.210.197 -> 77.55.145.124 TCP 70 http > 22283 [ACK] Seq=108614 Ack=36280 Win=65535 Len=0 TSval=150404777 TSecr=492122451
224072  76.630052 244.3.210.197 -> 77.55.145.124 TCP 70 http > 22283 [ACK] Seq=108614 Ack=38656 Win=65535 Len=0 TSval=150404779 TSecr=492122452
224086  76.630999 244.3.210.197 -> 77.55.145.124 TCP 70 http > 22283 [ACK] Seq=108614 Ack=41032 Win=65535 Len=0 TSval=150404779 TSecr=492122452
224491  76.731504 244.3.210.197 -> 41.177.244.197 TCP 70 http > 49983 [ACK] Seq=51506 Ack=2845 Win=64571 Len=0 TSval=150404780 TSecr=547595927
224632  76.820799 244.3.210.197 -> 77.55.145.124 TCP 70 http > 22283 [ACK] Seq=108614 Ack=43408 Win=65535 Len=0 TSval=150404780 TSecr=492122454
224647  76.821569 244.3.210.197 -> 77.55.145.124 TCP 70 http > 22283 [ACK] Seq=108614 Ack=45784 Win=65535 Len=0 TSval=150404780 TSecr=492122454
224660  76.823719 244.3.210.197 -> 77.55.145.124 TCP 70 http > 22283 [ACK] Seq=108614 Ack=48160 Win=65535 Len=0 TSval=150404780 TSecr=492122454
224676  76.824404 244.3.210.197 -> 77.55.145.124 TCP 70 http > 22283 [ACK] Seq=108614 Ack=50536 Win=65535 Len=0 TSval=150404780 TSecr=492122454
225031  76.922724 244.3.210.197 -> 15.205.242.71 TCP 64 http > cft-7 [ACK] Seq=215 Ack=661 Win=64876 Len=0
225032  76.922736 244.3.210.197 -> 15.205.242.71 TCP 64 http > cft-7 [FIN, ACK] Seq=215 Ack=661 Win=64876 Len=0
225039  76.923598 244.3.210.197 -> 15.205.242.71 TCP 66 http > bmc-net-svc [SYN, ACK] Seq=0 Ack=1 Win=16384 Len=0 MSS=1460 SACK_PERM=1
225224  77.016125 244.3.210.197 -> 77.55.145.124 TCP 70 http > 22283 [ACK] Seq=108614 Ack=52912 Win=65535 Len=0 TSval=150404782 TSecr=492122456
225228  77.016857 244.3.210.197 -> 77.55.145.124 TCP 70 http > 22283 [ACK] Seq=108614 Ack=55288 Win=65535 Len=0 TSval=150404782 TSecr=492122456
225230  77.017180 244.3.210.197 -> 77.55.145.124 TCP 70 http > 22283 [ACK] Seq=108614 Ack=57664 Win=65535 Len=0 TSval=150404782 TSecr=492122456
225233  77.017872 244.3.210.197 -> 77.55.145.124 TCP 70 http > 22283 [ACK] Seq=108614 Ack=60040 Win=65535 Len=0 TSval=150404782 TSecr=492122456
225236  77.018529 244.3.210.197 -> 77.55.145.124 TCP 70 http > 22283 [ACK] Seq=108614 Ack=62416 Win=65535 Len=0 TSval=150404782 TSecr=492122456
225240  77.018773 244.3.210.197 -> 77.55.145.124 TCP 70 http > 22283 [ACK] Seq=108614 Ack=64792 Win=65535 Len=0 TSval=150404782 TSecr=492122456
225943  77.292905 244.3.210.197 -> 77.55.145.124 TCP 82 [TCP Retransmission] [TCP segment of a reassembled PDU]
226196  77.308605 244.3.210.197 -> 41.177.244.197 TCP 90 [TCP segment of a reassembled PDU]
226523  77.483022 244.3.210.197 -> 41.177.244.197 TCP 82 http > 50021 [SYN, ACK] Seq=0 Ack=1 Win=16384 Len=0 MSS=1460 WS=1 TSval=0 TSecr=0 SACK_PERM=1
226537  77.483842 244.3.210.197 -> 41.177.244.197 TCP 82 http > 50022 [SYN, ACK] Seq=0 Ack=1 Win=16384 Len=0 MSS=1460 WS=1 TSval=0 TSecr=0 SACK_PERM=1
226547  77.484109 244.3.210.197 -> 41.177.244.197 TCP 82 http > 50023 [SYN, ACK] Seq=0 Ack=1 Win=16384 Len=0 MSS=1460 WS=1 TSval=0 TSecr=0 SACK_PERM=1
226557  77.484399 244.3.210.197 -> 41.177.244.197 TCP 82 http > 50024 [SYN, ACK] Seq=0 Ack=1 Win=16384 Len=0 MSS=1460 WS=1 TSval=0 TSecr=0 SACK_PERM=1
226570  77.484723 244.3.210.197 -> 41.177.244.197 TCP 82 http > 50025 [SYN, ACK] Seq=0 Ack=1 Win=16384 Len=0 MSS=1460 WS=1 TSval=0 TSecr=0 SACK_PERM=1
226903  77.541529 244.3.210.197 -> 15.186.110.41 TCP 82 http > 44790 [SYN, ACK] Seq=0 Ack=1 Win=16384 Len=0 MSS=1460 WS=1 TSval=0 TSecr=0 SACK_PERM=1
227475  77.926734 244.3.210.197 -> 15.186.110.41 TCP 70 http > 44790 [ACK] Seq=1 Ack=502 Win=65034 Len=0 TSval=150404792 TSecr=1208783654
227770  78.035526 244.3.210.197 -> 68.89.213.164 TCP 64 http > 59443 [ACK] Seq=58922 Ack=20417 Win=65535 Len=0
227956  78.174880 244.3.210.197 -> 15.186.110.41 TCP 70 http > 44790 [ACK] Seq=12287 Ack=503 Win=65034 Len=0 TSval=150404794 TSecr=1208784218
228945  78.684598 244.3.210.197 -> 77.55.145.124 TCP 70 http > 22283 [ACK] Seq=217119 Ack=66193 Win=65535 Len=0 TSval=150404799 TSecr=492122471
