1145   0.299180 244.3.185.121 -> 41.177.98.220 TCP 1297 caspssl > ups-onlinet [PSH, ACK] Seq=1 Ack=1 Win=65348 Len=1239
1409   0.401245 244.3.185.121 -> 41.177.98.220 TCP 1315 caspssl > ups-onlinet [PSH, ACK] Seq=1240 Ack=1257 Win=65535 Len=1257
1427   0.411461 244.3.185.121 -> 41.177.98.220 TCP 1303 caspssl > ups-onlinet [PSH, ACK] Seq=2497 Ack=1337 Win=65455 Len=1245
1902   0.569994 244.3.185.121 -> 41.177.98.220 TCP 64 caspssl > ups-onlinet [ACK] Seq=3742 Ack=3158 Win=65535 Len=0
7483   2.530781 244.3.185.121 -> 41.177.98.220 TCP 130 caspssl > ups-onlinet [PSH, ACK] Seq=3742 Ack=3158 Win=65535 Len=72
7504   2.536404 244.3.185.121 -> 41.177.98.220 TCP 1345 caspssl > ups-onlinet [PSH, ACK] Seq=3814 Ack=3246 Win=65447 Len=1287
8811   3.137941 244.3.185.121 -> 41.177.98.220 TCP 64 caspssl > ups-onlinet [ACK] Seq=5101 Ack=4674 Win=65535 Len=0
17503   5.169398 244.3.185.121 -> 41.177.98.220 TCP 136 caspssl > ups-onlinet [PSH, ACK] Seq=5101 Ack=4674 Win=65535 Len=78
17508   5.172655 244.3.185.121 -> 41.177.98.220 TCP 214 caspssl > ups-onlinet [PSH, ACK] Seq=5179 Ack=4751 Win=65458 Len=156
17828   5.430105 244.3.185.121 -> 41.177.98.220 TCP 64 caspssl > ups-onlinet [ACK] Seq=5335 Ack=4912 Win=65297 Len=0
57192  23.418265 244.3.185.121 -> 41.177.98.220 TCP 157 caspssl > ups-onlinet [PSH, ACK] Seq=5335 Ack=4912 Win=65297 Len=99
57196  23.420528 244.3.185.121 -> 41.177.98.220 TCP 261 caspssl > ups-onlinet [PSH, ACK] Seq=5434 Ack=5010 Win=65199 Len=203
57236  23.435592 244.3.185.121 -> 41.177.98.220 TCP 131 caspssl > ups-onlinet [PSH, ACK] Seq=5637 Ack=5230 Win=64979 Len=73
57254  23.442650 244.3.185.121 -> 41.177.98.220 TCP 307 caspssl > ups-onlinet [PSH, ACK] Seq=5710 Ack=5319 Win=64890 Len=249
58450  23.665363 244.3.185.121 -> 41.177.98.220 TCP 64 caspssl > ups-onlinet [ACK] Seq=5959 Ack=5626 Win=64583 Len=0
60640  24.557655 244.3.185.121 -> 41.177.98.220 TCP 130 caspssl > ups-onlinet [PSH, ACK] Seq=5959 Ack=5626 Win=64583 Len=72
60812  24.695721 244.3.185.121 -> 41.177.98.220 TCP 64 caspssl > ups-onlinet [ACK] Seq=6031 Ack=5913 Win=64296 Len=0
62463  25.658144 244.3.185.121 -> 41.177.98.220 TCP 129 caspssl > ups-onlinet [PSH, ACK] Seq=6031 Ack=5913 Win=64296 Len=71
62477  25.680586 244.3.185.121 -> 41.177.98.220 TCP 130 caspssl > ups-onlinet [PSH, ACK] Seq=6102 Ack=5983 Win=64226 Len=72
63115  26.008133 244.3.185.121 -> 41.177.98.220 TCP 64 caspssl > ups-onlinet [ACK] Seq=6174 Ack=6270 Win=65535 Len=0
204299  70.244004 244.3.185.121 -> 41.177.98.220 TCP 233 caspssl > ups-onlinet [PSH, ACK] Seq=6174 Ack=6270 Win=65535 Len=175
204671  70.414186 244.3.185.121 -> 41.177.98.220 TCP 64 caspssl > ups-onlinet [ACK] Seq=6349 Ack=6338 Win=65467 Len=0
208363  71.515088 244.3.185.121 -> 41.177.98.220 TCP 239 caspssl > ups-onlinet [PSH, ACK] Seq=6349 Ack=6338 Win=65467 Len=181
208790  71.797964 244.3.185.121 -> 41.177.98.220 TCP 64 caspssl > ups-onlinet [ACK] Seq=6530 Ack=6457 Win=65348 Len=0
