22385   7.947937 244.3.153.25 -> 244.3.160.80 TCP 64 50315 > https [ACK] Seq=1 Ack=39 Win=16358 Len=0
56823  23.322884 244.3.153.25 -> 244.3.160.80 TCP 64 50314 > https [FIN, ACK] Seq=1 Ack=1 Win=16146 Len=0
56853  23.347534 244.3.153.25 -> 244.3.160.80 TCP 70 50317 > https [SYN] Seq=0 Win=8192 Len=0 MSS=1150 WS=4 SACK_PERM=1
56871  23.354831 244.3.153.25 -> 244.3.160.80 TCP 64 50317 > https [ACK] Seq=1 Ack=1 Win=65548 Len=0
57796  23.549677 244.3.153.25 -> 244.3.160.80 TCP 64 50317 > https [ACK] Seq=1062 Ack=3311 Win=65548 Len=0
57925  23.576487 244.3.153.25 -> 244.3.160.80 TCP 64 50315 > https [FIN, ACK] Seq=454 Ack=39 Win=16358 Len=0
58057  23.606299 244.3.153.25 -> 244.3.160.80 TCP 70 50318 > https [SYN] Seq=0 Win=8192 Len=0 MSS=1150 WS=4 SACK_PERM=1
58088  23.610534 244.3.153.25 -> 244.3.160.80 TCP 64 50318 > https [ACK] Seq=1 Ack=1 Win=65548 Len=0
69076  28.613409 244.3.153.25 -> 244.3.160.80 TCP 64 50310 > https [RST, ACK] Seq=1 Ack=1151 Win=0 Len=0
87116  33.723398 244.3.153.25 -> 244.3.160.80 TCP 64 50317 > https [ACK] Seq=1952 Ack=4873 Win=65548 Len=0
87964  34.061118 244.3.153.25 -> 244.3.160.80 TCP 64 50317 > https [ACK] Seq=3652 Ack=7549 Win=65548 Len=0
88757  34.284306 244.3.153.25 -> 244.3.160.80 TCP 64 50317 > https [ACK] Seq=4542 Ack=9431 Win=65548 Len=0
89388  34.522255 244.3.153.25 -> 244.3.160.80 TCP 64 50317 > https [ACK] Seq=5432 Ack=11313 Win=65548 Len=0
89766  34.629153 244.3.153.25 -> 244.3.160.80 TCP 64 50317 > https [ACK] Seq=6322 Ack=13195 Win=65548 Len=0
90480  34.841151 244.3.153.25 -> 244.3.160.80 TCP 64 50317 > https [ACK] Seq=7212 Ack=15077 Win=65548 Len=0
117329  42.038558 244.3.153.25 -> 41.177.24.241 TCP 132 49421 > xmpp-client [PSH, ACK] Seq=1 Ack=1 Win=12209 Len=74[Packet size limited during capture]
145460  49.847049 244.3.153.25 -> 244.3.160.80 TCP 64 50317 > https [ACK] Seq=7212 Ack=15115 Win=65512 Len=0
159105  54.172446 244.3.153.25 -> 244.3.160.80 TCP 64 50318 > https [FIN, ACK] Seq=1062 Ack=965 Win=64584 Len=0
159235  54.207351 244.3.153.25 -> 244.3.160.80 TCP 64 50317 > https [FIN, ACK] Seq=7665 Ack=15115 Win=65512 Len=0
159305  54.230814 244.3.153.25 -> 244.3.160.80 TCP 70 50321 > https [SYN] Seq=0 Win=8192 Len=0 MSS=1150 WS=4 SACK_PERM=1
159324  54.235237 244.3.153.25 -> 244.3.160.80 TCP 64 50321 > https [ACK] Seq=1 Ack=1 Win=65548 Len=0
189139  64.511996 244.3.153.25 -> 244.3.160.80 TCP 64 50314 > https [RST, ACK] Seq=2 Ack=1151 Win=0 Len=0
243379  84.784290 244.3.153.25 -> 244.3.160.80 TCP 64 50321 > https [FIN, ACK] Seq=1062 Ack=965 Win=64584 Len=0
243430  84.812580 244.3.153.25 -> 244.3.160.80 TCP 70 50323 > https [SYN] Seq=0 Win=8192 Len=0 MSS=1150 WS=4 SACK_PERM=1
243446  84.817250 244.3.153.25 -> 244.3.160.80 TCP 64 50323 > https [ACK] Seq=1 Ack=1 Win=65548 Len=0
244675  85.329452 244.3.153.25 -> 244.3.160.80 TCP 64 50323 > https [ACK] Seq=1094 Ack=4415 Win=65548 Len=0
244677  85.329869 244.3.153.25 -> 244.3.160.80 TCP 64 50323 > https [ACK] Seq=1094 Ack=6715 Win=65548 Len=0
244706  85.336556 244.3.153.25 -> 244.3.160.80 TCP 64 50323 > https [ACK] Seq=1094 Ack=11315 Win=65548 Len=0
244709  85.337191 244.3.153.25 -> 244.3.160.80 TCP 64 50323 > https [ACK] Seq=1094 Ack=13615 Win=65548 Len=0
244737  85.342767 244.3.153.25 -> 244.3.160.80 TCP 64 50323 > https [ACK] Seq=1094 Ack=15915 Win=65548 Len=0
244739  85.343202 244.3.153.25 -> 244.3.160.80 TCP 64 50323 > https [ACK] Seq=1094 Ack=20515 Win=65548 Len=0
244741  85.343856 244.3.153.25 -> 244.3.160.80 TCP 64 50323 > https [ACK] Seq=1094 Ack=22121 Win=65548 Len=0
245383  85.675464 244.3.153.25 -> 244.3.160.80 TCP 64 50323 > https [ACK] Seq=1904 Ack=24421 Win=65548 Len=0
245385  85.675822 244.3.153.25 -> 244.3.160.80 TCP 64 50323 > https [ACK] Seq=1904 Ack=26721 Win=65548 Len=0
245388  85.676248 244.3.153.25 -> 244.3.160.80 TCP 64 50323 > https [ACK] Seq=1904 Ack=29021 Win=65548 Len=0
245393  85.676584 244.3.153.25 -> 244.3.160.80 TCP 64 50323 > https [ACK] Seq=1904 Ack=31697 Win=64400 Len=0
245398  85.677120 244.3.153.25 -> 244.3.160.80 TCP 64 50323 > https [ACK] Seq=1904 Ack=33997 Win=62100 Len=0
245418  85.683536 244.3.153.25 -> 244.3.160.80 TCP 64 50323 > https [ACK] Seq=1904 Ack=37447 Win=58648 Len=0
245420  85.683795 244.3.153.25 -> 244.3.160.80 TCP 64 [TCP Window Update] 50323 > https [ACK] Seq=1904 Ack=37447 Win=65548 Len=0
246134  86.146130 244.3.153.25 -> 244.3.160.80 TCP 64 50323 > https [ACK] Seq=2714 Ack=39924 Win=65548 Len=0
246136  86.148277 244.3.153.25 -> 244.3.160.80 TCP 64 50323 > https [ACK] Seq=2714 Ack=43374 Win=65548 Len=0
246138  86.148681 244.3.153.25 -> 244.3.160.80 TCP 70 50323 > https [ACK] Seq=2714 Ack=44524 Win=65548 Len=0 SLE=45674 SRE=46050
246140  86.149055 244.3.153.25 -> 244.3.160.80 TCP 64 50323 > https [ACK] Seq=2714 Ack=46050 Win=65548 Len=0
246143  86.150049 244.3.153.25 -> 244.3.160.80 TCP 64 50323 > https [ACK] Seq=2714 Ack=50650 Win=60948 Len=0
246148  86.152566 244.3.153.25 -> 244.3.160.80 TCP 70 [TCP Dup ACK 246143#1] 50323 > https [ACK] Seq=2714 Ack=50650 Win=60948 Len=0 SLE=51800 SRE=51959
246150  86.152815 244.3.153.25 -> 244.3.160.80 TCP 64 50323 > https [ACK] Seq=2714 Ack=51959 Win=59640 Len=0
246164  86.154053 244.3.153.25 -> 244.3.160.80 TCP 64 [TCP Window Update] 50323 > https [ACK] Seq=2714 Ack=51959 Win=65548 Len=0
246511  86.371015 244.3.153.25 -> 244.3.160.80 TCP 64 50323 > https [ACK] Seq=3524 Ack=53393 Win=65548 Len=0
246895  86.620064 244.3.153.25 -> 244.3.160.80 TCP 64 50323 > https [ACK] Seq=4334 Ack=56747 Win=65548 Len=0
247162  86.816480 244.3.153.25 -> 244.3.160.80 TCP 64 50323 > https [ACK] Seq=5144 Ack=59047 Win=65548 Len=0
248252  87.419354 244.3.153.25 -> 244.3.160.80 TCP 64 50323 > https [ACK] Seq=5954 Ack=62401 Win=65548 Len=0
248261  87.424124 244.3.153.25 -> 244.3.160.80 TCP 64 50323 > https [ACK] Seq=5954 Ack=65851 Win=65548 Len=0
248284  87.430615 244.3.153.25 -> 244.3.160.80 TCP 64 50323 > https [ACK] Seq=5954 Ack=68527 Win=65548 Len=0
248292  87.431923 244.3.153.25 -> 244.3.160.80 TCP 64 50323 > https [ACK] Seq=5954 Ack=71601 Win=65548 Len=0
248310  87.436480 244.3.153.25 -> 244.3.160.80 TCP 64 50323 > https [ACK] Seq=5954 Ack=73901 Win=65548 Len=0
248313  87.437329 244.3.153.25 -> 244.3.160.80 TCP 64 50323 > https [ACK] Seq=5954 Ack=76740 Win=65548 Len=0
248339  87.440038 244.3.153.25 -> 244.3.160.80 TCP 64 50323 > https [ACK] Seq=5954 Ack=79651 Win=65548 Len=0
248361  87.443504 244.3.153.25 -> 244.3.160.80 TCP 64 50323 > https [ACK] Seq=5954 Ack=81951 Win=65548 Len=0
248369  87.444905 244.3.153.25 -> 244.3.160.80 TCP 64 50323 > https [ACK] Seq=5954 Ack=85401 Win=65548 Len=0
248372  87.445197 244.3.153.25 -> 244.3.160.80 TCP 64 50323 > https [ACK] Seq=5954 Ack=87701 Win=65548 Len=0
248390  87.450662 244.3.153.25 -> 244.3.160.80 TCP 64 50323 > https [ACK] Seq=5954 Ack=90001 Win=65548 Len=0
248393  87.451193 244.3.153.25 -> 244.3.160.80 TCP 64 50323 > https [ACK] Seq=5954 Ack=92301 Win=65548 Len=0
248406  87.455188 244.3.153.25 -> 244.3.160.80 TCP 64 50323 > https [ACK] Seq=5954 Ack=94601 Win=65548 Len=0
248408  87.455538 244.3.153.25 -> 244.3.160.80 TCP 64 50323 > https [ACK] Seq=5954 Ack=95763 Win=65548 Len=0
249198  87.949117 244.3.153.25 -> 244.3.160.80 TCP 64 50323 > https [ACK] Seq=6764 Ack=98063 Win=65548 Len=0
249203  87.949983 244.3.153.25 -> 244.3.160.80 TCP 64 50323 > https [ACK] Seq=6764 Ack=101513 Win=65548 Len=0
249216  87.952422 244.3.153.25 -> 244.3.160.80 TCP 64 50323 > https [ACK] Seq=6764 Ack=104189 Win=65548 Len=0
249236  87.953493 244.3.153.25 -> 244.3.160.80 TCP 64 50323 > https [ACK] Seq=6764 Ack=106489 Win=63248 Len=0
249242  87.955337 244.3.153.25 -> 244.3.160.80 TCP 64 50323 > https [ACK] Seq=6764 Ack=108789 Win=60948 Len=0
249244  87.957317 244.3.153.25 -> 244.3.160.80 TCP 70 50323 > https [ACK] Seq=6764 Ack=111089 Win=58648 Len=0 SLE=112239 SRE=112402
249248  87.958069 244.3.153.25 -> 244.3.160.80 TCP 64 50323 > https [ACK] Seq=6764 Ack=112402 Win=57336 Len=0
249253  87.959419 244.3.153.25 -> 244.3.160.80 TCP 64 50323 > https [ACK] Seq=6764 Ack=115852 Win=53884 Len=0
249256  87.960078 244.3.153.25 -> 244.3.160.80 TCP 64 50323 > https [ACK] Seq=6764 Ack=118152 Win=51584 Len=0
249261  87.961412 244.3.153.25 -> 244.3.160.80 TCP 64 50323 > https [ACK] Seq=6764 Ack=120452 Win=49284 Len=0
249265  87.962095 244.3.153.25 -> 244.3.160.80 TCP 64 50323 > https [ACK] Seq=6764 Ack=122752 Win=46984 Len=0
249368  87.978558 244.3.153.25 -> 244.3.160.80 TCP 64 50323 > https [ACK] Seq=6764 Ack=123468 Win=65548 Len=0
250306  88.275376 244.3.153.25 -> 244.3.160.80 TCP 64 50323 > https [ACK] Seq=7574 Ack=126918 Win=65548 Len=0
250308  88.276171 244.3.153.25 -> 244.3.160.80 TCP 64 50323 > https [ACK] Seq=7574 Ack=128870 Win=65548 Len=0
250678  88.493443 244.3.153.25 -> 244.3.160.80 TCP 64 50323 > https [ACK] Seq=8416 Ack=131170 Win=65548 Len=0
250680  88.494024 244.3.153.25 -> 244.3.160.80 TCP 64 50323 > https [ACK] Seq=8416 Ack=135328 Win=65548 Len=0
251195  88.769367 244.3.153.25 -> 244.3.160.80 TCP 64 50323 > https [ACK] Seq=9258 Ack=137628 Win=65548 Len=0
251197  88.769798 244.3.153.25 -> 244.3.160.80 TCP 64 50323 > https [ACK] Seq=9258 Ack=139928 Win=65548 Len=0
251199  88.770609 244.3.153.25 -> 244.3.160.80 TCP 64 50323 > https [ACK] Seq=9258 Ack=142228 Win=65548 Len=0
251201  88.771394 244.3.153.25 -> 244.3.160.80 TCP 70 [TCP Dup ACK 251199#1] 50323 > https [ACK] Seq=9258 Ack=142228 Win=65548 Len=0 SLE=143378 SRE=143754
251203  88.771712 244.3.153.25 -> 244.3.160.80 TCP 64 50323 > https [ACK] Seq=9258 Ack=143754 Win=65548 Len=0
251207  88.772591 244.3.153.25 -> 244.3.160.80 TCP 64 50323 > https [ACK] Seq=9258 Ack=144911 Win=64392 Len=0
251226  88.776143 244.3.153.25 -> 244.3.160.80 TCP 64 [TCP Window Update] 50323 > https [ACK] Seq=9258 Ack=144911 Win=65548 Len=0
252564  89.377378 244.3.153.25 -> 244.3.160.80 TCP 64 50323 > https [ACK] Seq=10116 Ack=148361 Win=65548 Len=0
252588  89.384360 244.3.153.25 -> 244.3.160.80 TCP 64 50323 > https [ACK] Seq=10116 Ack=151811 Win=65548 Len=0
252664  89.389612 244.3.153.25 -> 244.3.160.80 TCP 64 50323 > https [ACK] Seq=10116 Ack=155261 Win=65548 Len=0
252673  89.391048 244.3.153.25 -> 244.3.160.80 TCP 64 50323 > https [ACK] Seq=10116 Ack=157561 Win=65548 Len=0
253430  89.738594 244.3.153.25 -> 244.3.160.80 TCP 64 50323 > https [ACK] Seq=11006 Ack=160602 Win=65548 Len=0
253432  89.739048 244.3.153.25 -> 244.3.160.80 TCP 64 50323 > https [ACK] Seq=11006 Ack=164088 Win=65548 Len=0
253812  90.031179 244.3.153.25 -> 244.3.160.80 TCP 64 50323 > https [ACK] Seq=11896 Ack=167840 Win=65548 Len=0
253814  90.032402 244.3.153.25 -> 244.3.160.80 TCP 64 50323 > https [ACK] Seq=11896 Ack=169838 Win=65548 Len=0
253816  90.033426 244.3.153.25 -> 244.3.160.80 TCP 64 50323 > https [ACK] Seq=11896 Ack=172018 Win=65548 Len=0
254428  90.336899 244.3.153.25 -> 244.3.160.80 TCP 64 50323 > https [ACK] Seq=12786 Ack=174318 Win=65548 Len=0
254430  90.337471 244.3.153.25 -> 244.3.160.80 TCP 64 50323 > https [ACK] Seq=12786 Ack=177768 Win=65548 Len=0
254433  90.338047 244.3.153.25 -> 244.3.160.80 TCP 64 50323 > https [ACK] Seq=12786 Ack=181594 Win=64400 Len=0
254449  90.344403 244.3.153.25 -> 244.3.160.80 TCP 64 50323 > https [ACK] Seq=12786 Ack=182161 Win=65548 Len=0
255141  90.610218 244.3.153.25 -> 244.3.160.80 TCP 64 50323 > https [ACK] Seq=13676 Ack=185611 Win=65548 Len=0
255150  90.612799 244.3.153.25 -> 244.3.160.80 TCP 64 50323 > https [ACK] Seq=13676 Ack=187911 Win=65548 Len=0
255152  90.613122 244.3.153.25 -> 244.3.160.80 TCP 64 50323 > https [ACK] Seq=13676 Ack=190059 Win=65548 Len=0
255747  90.851217 244.3.153.25 -> 244.3.160.80 TCP 64 50323 > https [ACK] Seq=14582 Ack=192359 Win=65548 Len=0
255753  90.851711 244.3.153.25 -> 244.3.160.80 TCP 64 50323 > https [ACK] Seq=14582 Ack=194659 Win=65548 Len=0
255764  90.852548 244.3.153.25 -> 244.3.160.80 TCP 64 50323 > https [ACK] Seq=14582 Ack=196959 Win=65548 Len=0
256172  91.076598 244.3.153.25 -> 244.3.160.80 TCP 64 50323 > https [ACK] Seq=15472 Ack=199297 Win=65548 Len=0
256176  91.077282 244.3.153.25 -> 244.3.160.80 TCP 64 50323 > https [ACK] Seq=15472 Ack=202747 Win=65548 Len=0
256632  91.348343 244.3.153.25 -> 244.3.160.80 TCP 64 50323 > https [ACK] Seq=16282 Ack=207321 Win=65548 Len=0
256634  91.349011 244.3.153.25 -> 244.3.160.80 TCP 64 50323 > https [ACK] Seq=16282 Ack=211375 Win=65548 Len=0
256637  91.349590 244.3.153.25 -> 244.3.160.80 TCP 64 50323 > https [ACK] Seq=16282 Ack=213342 Win=63580 Len=0
256641  91.355534 244.3.153.25 -> 244.3.160.80 TCP 64 [TCP Window Update] 50323 > https [ACK] Seq=16282 Ack=213342 Win=65548 Len=0
258717  91.683537 244.3.153.25 -> 244.3.160.80 TCP 64 50323 > https [ACK] Seq=17092 Ack=216792 Win=65548 Len=0
258721  91.684941 244.3.153.25 -> 244.3.160.80 TCP 64 50323 > https [ACK] Seq=17092 Ack=220846 Win=65548 Len=0
258724  91.685548 244.3.153.25 -> 244.3.160.80 TCP 64 50323 > https [ACK] Seq=17092 Ack=221768 Win=64628 Len=0
258726  91.686057 244.3.153.25 -> 244.3.160.80 TCP 64 50323 > https [ACK] Seq=17092 Ack=224068 Win=62328 Len=0
258728  91.687402 244.3.153.25 -> 244.3.160.80 TCP 70 50323 > https [ACK] Seq=17092 Ack=225218 Win=61176 Len=0 SLE=226368 SRE=226525
258730  91.687719 244.3.153.25 -> 244.3.160.80 TCP 64 50323 > https [ACK] Seq=17092 Ack=226525 Win=59868 Len=0
258732  91.688815 244.3.153.25 -> 244.3.160.80 TCP 64 [TCP Window Update] 50323 > https [ACK] Seq=17092 Ack=226525 Win=65548 Len=0
263569  91.920321 244.3.153.25 -> 244.3.160.80 TCP 64 50323 > https [ACK] Seq=17902 Ack=230839 Win=65548 Len=0
272017  92.219355 244.3.153.25 -> 244.3.160.80 TCP 64 50323 > https [ACK] Seq=18760 Ack=234591 Win=65548 Len=0
272073  92.220476 244.3.153.25 -> 244.3.160.80 TCP 64 50323 > https [ACK] Seq=18760 Ack=236589 Win=65548 Len=0
272111  92.221318 244.3.153.25 -> 244.3.160.80 TCP 64 50323 > https [ACK] Seq=18760 Ack=239265 Win=65548 Len=0
272164  92.222468 244.3.153.25 -> 244.3.160.80 TCP 64 50323 > https [ACK] Seq=18760 Ack=241565 Win=63248 Len=0
272237  92.224114 244.3.153.25 -> 244.3.160.80 TCP 64 50323 > https [ACK] Seq=18760 Ack=243865 Win=60948 Len=0
272543  92.232445 244.3.153.25 -> 244.3.160.80 TCP 64 50323 > https [ACK] Seq=18760 Ack=245014 Win=65548 Len=0
275010  92.704306 244.3.153.25 -> 244.3.160.80 TCP 64 50323 > https [ACK] Seq=19570 Ack=247314 Win=65548 Len=0
275012  92.704858 244.3.153.25 -> 244.3.160.80 TCP 64 50323 > https [ACK] Seq=19570 Ack=251914 Win=65548 Len=0
275015  92.705760 244.3.153.25 -> 244.3.160.80 TCP 64 50323 > https [ACK] Seq=19570 Ack=253440 Win=65548 Len=0
275023  92.707455 244.3.153.25 -> 244.3.160.80 TCP 64 50323 > https [ACK] Seq=19570 Ack=255740 Win=63248 Len=0
275028  92.708347 244.3.153.25 -> 244.3.160.80 TCP 64 50323 > https [ACK] Seq=19570 Ack=258040 Win=60948 Len=0
275040  92.709756 244.3.153.25 -> 244.3.160.80 TCP 64 50323 > https [ACK] Seq=19570 Ack=260340 Win=58648 Len=0
275044  92.710596 244.3.153.25 -> 244.3.160.80 TCP 70 [TCP Dup ACK 275040#1] 50323 > https [ACK] Seq=19570 Ack=260340 Win=58648 Len=0 SLE=261490 SRE=261653
275046  92.711227 244.3.153.25 -> 244.3.160.80 TCP 64 50323 > https [ACK] Seq=19570 Ack=261653 Win=57336 Len=0
275051  92.713265 244.3.153.25 -> 244.3.160.80 TCP 64 50323 > https [ACK] Seq=19570 Ack=265103 Win=53884 Len=0
275053  92.713819 244.3.153.25 -> 244.3.160.80 TCP 64 50323 > https [ACK] Seq=19570 Ack=266253 Win=65548 Len=0
275064  92.720618 244.3.153.25 -> 244.3.160.80 TCP 64 50323 > https [ACK] Seq=19570 Ack=267403 Win=65548 Len=0
275266  92.759460 244.3.153.25 -> 244.3.160.80 TCP 70 50323 > https [ACK] Seq=19570 Ack=268553 Win=65548 Len=0 SLE=269703 SRE=269866
275268  92.759714 244.3.153.25 -> 244.3.160.80 TCP 64 50323 > https [ACK] Seq=19570 Ack=269866 Win=65548 Len=0
275974  92.990878 244.3.153.25 -> 244.3.160.80 TCP 64 50323 > https [ACK] Seq=20396 Ack=272331 Win=65548 Len=0
276126  93.113838 244.3.153.25 -> 244.3.160.80 TCP 64 50323 > https [ACK] Seq=21222 Ack=276867 Win=65548 Len=0
276461  93.312135 244.3.153.25 -> 244.3.160.80 TCP 64 50323 > https [ACK] Seq=22032 Ack=280079 Win=65548 Len=0
276693  93.440519 244.3.153.25 -> 244.3.160.80 TCP 70 50323 > https [ACK] Seq=22842 Ack=282601 Win=65548 Len=0 SLE=283751 SRE=283847
276708  93.441105 244.3.153.25 -> 244.3.160.80 TCP 64 50323 > https [ACK] Seq=22842 Ack=283847 Win=65548 Len=0
280243  94.438657 244.3.153.25 -> 244.3.160.80 TCP 64 50318 > https [RST, ACK] Seq=1063 Ack=2115 Win=0 Len=0
290603  97.042068 244.3.153.25 -> 41.177.24.241 TCP 132 49421 > xmpp-client [PSH, ACK] Seq=75 Ack=1 Win=12209 Len=74[Packet size limited during capture]
302195 101.907980 244.3.153.25 -> 244.3.160.80 TCP 64 50323 > https [ACK] Seq=1542058 Ack=288724 Win=65548 Len=0
302225 101.915060 244.3.153.25 -> 244.3.160.80 TCP 64 50323 > https [ACK] Seq=1542058 Ack=292174 Win=65548 Len=0
302437 102.112181 244.3.153.25 -> 244.3.160.80 TCP 64 50323 > https [ACK] Seq=1542996 Ack=295607 Win=65548 Len=0
302439 102.113282 244.3.153.25 -> 244.3.160.80 TCP 64 50323 > https [ACK] Seq=1542996 Ack=298149 Win=65548 Len=0
302735 102.277559 244.3.153.25 -> 244.3.160.80 TCP 64 50323 > https [ACK] Seq=1543918 Ack=301901 Win=65548 Len=0
302737 102.277781 244.3.153.25 -> 244.3.160.80 TCP 64 50323 > https [ACK] Seq=1543918 Ack=305049 Win=65548 Len=0
302750 102.279178 244.3.153.25 -> 244.3.160.80 TCP 64 50323 > https [ACK] Seq=1543918 Ack=306575 Win=65548 Len=0
302752 102.279843 244.3.153.25 -> 244.3.160.80 TCP 64 50323 > https [ACK] Seq=1543918 Ack=308468 Win=63656 Len=0
302762 102.284562 244.3.153.25 -> 244.3.160.80 TCP 64 [TCP Window Update] 50323 > https [ACK] Seq=1543918 Ack=308468 Win=65548 Len=0
303224 102.513611 244.3.153.25 -> 244.3.160.80 TCP 64 50323 > https [ACK] Seq=1544856 Ack=312220 Win=65548 Len=0
303226 102.513916 244.3.153.25 -> 244.3.160.80 TCP 64 50323 > https [ACK] Seq=1544856 Ack=313246 Win=64524 Len=0
303583 102.662270 244.3.153.25 -> 244.3.160.80 TCP 64 50323 > https [ACK] Seq=1545794 Ack=316998 Win=65548 Len=0
303585 102.663115 244.3.153.25 -> 244.3.160.80 TCP 64 50323 > https [ACK] Seq=1545794 Ack=318996 Win=65548 Len=0
303966 102.862283 244.3.153.25 -> 244.3.160.80 TCP 64 50323 > https [ACK] Seq=1546716 Ack=322690 Win=65548 Len=0
304629 103.067472 244.3.153.25 -> 244.3.160.80 TCP 64 50323 > https [ACK] Seq=1547654 Ack=324524 Win=65548 Len=0
305444 103.424365 244.3.153.25 -> 244.3.160.80 TCP 64 50323 > https [ACK] Seq=1548251 Ack=324785 Win=65288 Len=0
349718 118.229901 244.3.153.25 -> 244.3.160.80 TCP 64 50323 > https [ACK] Seq=1548251 Ack=324823 Win=65252 Len=0
361642 123.440973 244.3.153.25 -> 244.3.160.80 TCP 64 50321 > https [RST, ACK] Seq=1063 Ack=2115 Win=0 Len=0
463096 152.048319 244.3.153.25 -> 41.177.24.241 TCP 132 49421 > xmpp-client [PSH, ACK] Seq=149 Ack=1 Win=12209 Len=74[Packet size limited during capture]
665280 207.053844 244.3.153.25 -> 41.177.24.241 TCP 132 49421 > xmpp-client [PSH, ACK] Seq=223 Ack=1 Win=12209 Len=74[Packet size limited during capture]
787378 255.594688 244.3.153.25 -> 244.3.160.80 TCP 64 50323 > https [FIN, ACK] Seq=1548752 Ack=324823 Win=65252 Len=0
787470 255.620314 244.3.153.25 -> 244.3.160.80 TCP 70 50337 > https [SYN] Seq=0 Win=8192 Len=0 MSS=1150 WS=4 SACK_PERM=1
787483 255.625293 244.3.153.25 -> 244.3.160.80 TCP 64 50337 > https [ACK] Seq=1 Ack=1 Win=65548 Len=0
788301 256.003440 244.3.153.25 -> 244.3.160.80 TCP 64 50337 > https [ACK] Seq=1110 Ack=4717 Win=65548 Len=0
788306 256.004198 244.3.153.25 -> 244.3.160.80 TCP 64 50337 > https [ACK] Seq=1110 Ack=5919 Win=65548 Len=0
789655 256.490475 244.3.153.25 -> 244.3.160.80 TCP 64 50337 > https [ACK] Seq=1952 Ack=8219 Win=65548 Len=0
790213 256.696857 244.3.153.25 -> 244.3.160.80 TCP 64 50337 > https [ACK] Seq=2794 Ack=11653 Win=65548 Len=0
790215 256.698165 244.3.153.25 -> 244.3.160.80 TCP 64 50337 > https [ACK] Seq=2794 Ack=13763 Win=65548 Len=0
793389 258.385876 244.3.153.25 -> 244.3.160.80 TCP 64 50337 > https [ACK] Seq=3636 Ack=16063 Win=65548 Len=0
793391 258.386795 244.3.153.25 -> 244.3.160.80 TCP 64 50337 > https [ACK] Seq=3636 Ack=19513 Win=65548 Len=0
793393 258.387497 244.3.153.25 -> 244.3.160.80 TCP 70 50337 > https [ACK] Seq=3636 Ack=20663 Win=65548 Len=0 SLE=21813 SRE=22189
793395 258.387804 244.3.153.25 -> 244.3.160.80 TCP 64 50337 > https [ACK] Seq=3636 Ack=22189 Win=65548 Len=0
793824 258.580053 244.3.153.25 -> 244.3.160.80 TCP 64 50337 > https [ACK] Seq=3636 Ack=22402 Win=65336 Len=0
795083 259.067599 244.3.153.25 -> 244.3.160.80 TCP 64 50337 > https [ACK] Seq=4510 Ack=25852 Win=65548 Len=0
795572 259.259758 244.3.153.25 -> 244.3.160.80 TCP 64 50337 > https [ACK] Seq=4510 Ack=26284 Win=65116 Len=0
801419 262.067957 244.3.153.25 -> 41.177.24.241 TCP 132 49421 > xmpp-client [PSH, ACK] Seq=297 Ack=1 Win=12209 Len=74[Packet size limited during capture]
802949 262.346739 244.3.153.25 -> 244.3.160.80 TCP 64 50337 > https [ACK] Seq=5368 Ack=29734 Win=65548 Len=0
802963 262.352065 244.3.153.25 -> 244.3.160.80 TCP 64 50337 > https [ACK] Seq=5368 Ack=32034 Win=65548 Len=0
802972 262.353639 244.3.153.25 -> 244.3.160.80 TCP 64 50337 > https [ACK] Seq=5368 Ack=34334 Win=65548 Len=0
802987 262.357806 244.3.153.25 -> 244.3.160.80 TCP 64 50337 > https [ACK] Seq=5368 Ack=36634 Win=65548 Len=0
802994 262.358888 244.3.153.25 -> 244.3.160.80 TCP 64 50337 > https [ACK] Seq=5368 Ack=40084 Win=65548 Len=0
803009 262.363128 244.3.153.25 -> 244.3.160.80 TCP 64 50337 > https [ACK] Seq=5368 Ack=42384 Win=65548 Len=0
803014 262.364089 244.3.153.25 -> 244.3.160.80 TCP 64 50337 > https [ACK] Seq=5368 Ack=44684 Win=65548 Len=0
803019 262.364839 244.3.153.25 -> 244.3.160.80 TCP 64 50337 > https [ACK] Seq=5368 Ack=48134 Win=65548 Len=0
803049 262.370592 244.3.153.25 -> 244.3.160.80 TCP 64 50337 > https [ACK] Seq=5368 Ack=50434 Win=65548 Len=0
803056 262.371140 244.3.153.25 -> 244.3.160.80 TCP 64 50337 > https [ACK] Seq=5368 Ack=52734 Win=65548 Len=0
803058 262.371419 244.3.153.25 -> 244.3.160.80 TCP 64 50337 > https [ACK] Seq=5368 Ack=56184 Win=65548 Len=0
803077 262.372424 244.3.153.25 -> 244.3.160.80 TCP 64 50337 > https [ACK] Seq=5368 Ack=60784 Win=64700 Len=0
803124 262.378062 244.3.153.25 -> 244.3.160.80 TCP 64 50337 > https [ACK] Seq=5368 Ack=63084 Win=62400 Len=0
803126 262.379296 244.3.153.25 -> 244.3.160.80 TCP 64 50337 > https [ACK] Seq=5368 Ack=66534 Win=58952 Len=0
803128 262.379999 244.3.153.25 -> 244.3.160.80 TCP 64 50337 > https [ACK] Seq=5368 Ack=68834 Win=56652 Len=0
803130 262.380961 244.3.153.25 -> 244.3.160.80 TCP 64 50337 > https [ACK] Seq=5368 Ack=69984 Win=65548 Len=0
803697 262.581283 244.3.153.25 -> 244.3.160.80 TCP 64 50337 > https [ACK] Seq=5368 Ack=70351 Win=65180 Len=0
805797 263.340157 244.3.153.25 -> 244.3.160.80 TCP 64 50337 > https [ACK] Seq=6226 Ack=72651 Win=65548 Len=0
805802 263.342223 244.3.153.25 -> 244.3.160.80 TCP 64 50337 > https [ACK] Seq=6226 Ack=75289 Win=65548 Len=0
806718 263.571355 244.3.153.25 -> 244.3.160.80 TCP 64 50337 > https [ACK] Seq=7100 Ack=77589 Win=65548 Len=0
806723 263.572726 244.3.153.25 -> 244.3.160.80 TCP 64 50337 > https [ACK] Seq=7100 Ack=79107 Win=65548 Len=0
808177 263.777897 244.3.153.25 -> 244.3.160.80 TCP 64 50337 > https [ACK] Seq=7958 Ack=80605 Win=65548 Len=0
808801 263.876246 244.3.153.25 -> 244.3.160.80 TCP 64 50337 > https [ACK] Seq=8832 Ack=82103 Win=65548 Len=0
810298 264.170706 244.3.153.25 -> 244.3.160.80 TCP 64 50337 > https [ACK] Seq=9690 Ack=85553 Win=65548 Len=0
810300 264.171268 244.3.153.25 -> 244.3.160.80 TCP 64 50337 > https [ACK] Seq=9690 Ack=87853 Win=65548 Len=0
810743 264.371231 244.3.153.25 -> 244.3.160.80 TCP 64 50337 > https [ACK] Seq=9690 Ack=88385 Win=65016 Len=0
830376 271.364301 244.3.153.25 -> 244.3.160.80 TCP 64 50337 > https [ACK] Seq=10532 Ack=89947 Win=65548 Len=0
831071 271.753388 244.3.153.25 -> 244.3.160.80 TCP 64 50337 > https [ACK] Seq=12136 Ack=92623 Win=65548 Len=0
831599 271.867300 244.3.153.25 -> 244.3.160.80 TCP 64 50337 > https [ACK] Seq=12978 Ack=94505 Win=65548 Len=0
867741 286.876202 244.3.153.25 -> 244.3.160.80 TCP 64 50337 > https [ACK] Seq=12978 Ack=94543 Win=65512 Len=0
955945 317.066329 244.3.153.25 -> 41.177.24.241 TCP 132 49421 > xmpp-client [PSH, ACK] Seq=371 Ack=1 Win=12209 Len=74[Packet size limited during capture]
