6891   2.268294 244.3.199.164 -> 41.177.98.220 TCP 159 bbn-mmc > ups-onlinet [PSH, ACK] Seq=1 Ack=1 Win=64216 Len=101
6897   2.270285 244.3.199.164 -> 41.177.98.220 TCP 307 bbn-mmc > ups-onlinet [PSH, ACK] Seq=102 Ack=101 Win=65535 Len=249
6914   2.283462 244.3.199.164 -> 41.177.98.220 TCP 129 bbn-mmc > ups-onlinet [PSH, ACK] Seq=351 Ack=367 Win=65269 Len=71
6923   2.289479 244.3.199.164 -> 41.177.98.220 TCP 351 bbn-mmc > ups-onlinet [PSH, ACK] Seq=422 Ack=456 Win=65180 Len=293
7336   2.480136 244.3.199.164 -> 41.177.98.220 TCP 64 bbn-mmc > ups-onlinet [ACK] Seq=715 Ack=809 Win=64827 Len=0
8797   3.113775 244.3.199.164 -> 41.177.98.220 TCP 130 bbn-mmc > ups-onlinet [PSH, ACK] Seq=715 Ack=809 Win=64827 Len=72
9015   3.245743 244.3.199.164 -> 41.177.98.220 TCP 64 bbn-mmc > ups-onlinet [ACK] Seq=787 Ack=1076 Win=64560 Len=0
18068   5.571848 244.3.199.164 -> 41.177.98.220 TCP 136 bbn-mmc > ups-onlinet [PSH, ACK] Seq=787 Ack=1076 Win=64560 Len=78
18241   5.761320 244.3.199.164 -> 41.177.98.220 TCP 64 bbn-mmc > ups-onlinet [ACK] Seq=865 Ack=1215 Win=64421 Len=0
59726  24.068038 244.3.199.164 -> 41.177.98.220 TCP 159 bbn-mmc > ups-onlinet [PSH, ACK] Seq=865 Ack=1215 Win=64421 Len=101
59742  24.070371 244.3.199.164 -> 41.177.98.220 TCP 325 bbn-mmc > ups-onlinet [PSH, ACK] Seq=966 Ack=1315 Win=64321 Len=267
59829  24.096624 244.3.199.164 -> 41.177.98.220 TCP 129 bbn-mmc > ups-onlinet [PSH, ACK] Seq=1233 Ack=1599 Win=65535 Len=71
59859  24.106231 244.3.199.164 -> 41.177.98.220 TCP 369 bbn-mmc > ups-onlinet [PSH, ACK] Seq=1304 Ack=1688 Win=65446 Len=311
60258  24.354718 244.3.199.164 -> 41.177.98.220 TCP 64 bbn-mmc > ups-onlinet [ACK] Seq=1615 Ack=2059 Win=65075 Len=0
62785  25.833424 244.3.199.164 -> 41.177.98.220 TCP 130 bbn-mmc > ups-onlinet [PSH, ACK] Seq=1615 Ack=2059 Win=65075 Len=72
63109  25.995311 244.3.199.164 -> 41.177.98.220 TCP 64 bbn-mmc > ups-onlinet [ACK] Seq=1687 Ack=2333 Win=64801 Len=0
68001  27.971558 244.3.199.164 -> 41.177.98.220 TCP 136 bbn-mmc > ups-onlinet [PSH, ACK] Seq=1687 Ack=2333 Win=64801 Len=78
68403  28.182765 244.3.199.164 -> 41.177.98.220 TCP 64 bbn-mmc > ups-onlinet [ACK] Seq=1765 Ack=2534 Win=64600 Len=0
69857  28.943342 244.3.199.164 -> 41.177.98.220 TCP 133 bbn-mmc > ups-onlinet [PSH, ACK] Seq=1765 Ack=2534 Win=64600 Len=75
69913  28.980037 244.3.199.164 -> 41.177.98.220 TCP 130 bbn-mmc > ups-onlinet [PSH, ACK] Seq=1840 Ack=3085 Win=65535 Len=72
70452  29.167119 244.3.199.164 -> 41.177.98.220 TCP 64 bbn-mmc > ups-onlinet [ACK] Seq=1912 Ack=3352 Win=65268 Len=0
95203  36.011833 244.3.199.164 -> 41.177.98.220 TCP 138 bbn-mmc > ups-onlinet [PSH, ACK] Seq=1912 Ack=3352 Win=65268 Len=80
95273  36.019710 244.3.199.164 -> 41.177.98.220 TCP 159 bbn-mmc > ups-onlinet [PSH, ACK] Seq=1992 Ack=3673 Win=64947 Len=101
95306  36.021470 244.3.199.164 -> 41.177.98.220 TCP 404 bbn-mmc > ups-onlinet [PSH, ACK] Seq=2093 Ack=3773 Win=64847 Len=346
96136  36.166992 244.3.199.164 -> 41.177.98.220 TCP 64 bbn-mmc > ups-onlinet [ACK] Seq=2439 Ack=4136 Win=64484 Len=0
157707  53.715623 244.3.199.164 -> 41.177.98.220 TCP 138 bbn-mmc > ups-onlinet [PSH, ACK] Seq=2439 Ack=4136 Win=64484 Len=80
157721  53.724628 244.3.199.164 -> 41.177.98.220 TCP 159 bbn-mmc > ups-onlinet [PSH, ACK] Seq=2519 Ack=4457 Win=64163 Len=101
157724  53.726481 244.3.199.164 -> 41.177.98.220 TCP 413 bbn-mmc > ups-onlinet [PSH, ACK] Seq=2620 Ack=4557 Win=65535 Len=355
157787  53.753146 244.3.199.164 -> 41.177.98.220 TCP 480 bbn-mmc > ups-onlinet [PSH, ACK] Seq=2975 Ack=4929 Win=65163 Len=422
158510  53.994770 244.3.199.164 -> 41.177.98.220 TCP 64 bbn-mmc > ups-onlinet [ACK] Seq=3397 Ack=5339 Win=64753 Len=0
