76390  30.673919 244.3.185.201 -> 41.177.98.220 TCP 129 airsync > ups-onlinet [PSH, ACK] Seq=1 Ack=1 Win=65040 Len=71
76847  30.733897 244.3.185.201 -> 41.177.98.220 TCP 130 airsync > ups-onlinet [PSH, ACK] Seq=72 Ack=71 Win=64970 Len=72
77455  30.900689 244.3.185.201 -> 41.177.98.220 TCP 64 airsync > ups-onlinet [ACK] Seq=144 Ack=264 Win=64777 Len=0
148495  50.987510 244.3.185.201 -> 41.177.98.220 TCP 216 airsync > ups-onlinet [PSH, ACK] Seq=144 Ack=264 Win=64777 Len=158
148927  51.135269 244.3.185.201 -> 41.177.98.220 TCP 64 airsync > ups-onlinet [ACK] Seq=302 Ack=380 Win=64661 Len=0
254629  90.431597 244.3.185.201 -> 41.177.98.220 TCP 129 airsync > ups-onlinet [PSH, ACK] Seq=302 Ack=380 Win=64661 Len=71
254776  90.494495 244.3.185.201 -> 41.177.98.220 TCP 130 airsync > ups-onlinet [PSH, ACK] Seq=373 Ack=450 Win=64591 Len=72
255162  90.620032 244.3.185.201 -> 41.177.98.220 TCP 64 airsync > ups-onlinet [ACK] Seq=445 Ack=643 Win=64398 Len=0
458339 149.791518 244.3.185.201 -> 41.177.98.220 TCP 216 airsync > ups-onlinet [PSH, ACK] Seq=445 Ack=643 Win=64398 Len=158
458850 150.011257 244.3.185.201 -> 41.177.98.220 TCP 64 airsync > ups-onlinet [ACK] Seq=603 Ack=759 Win=64282 Len=0
569675 182.043919 244.3.185.201 -> 41.177.98.220 TCP 129 airsync > ups-onlinet [PSH, ACK] Seq=603 Ack=759 Win=64282 Len=71
569903 182.111092 244.3.185.201 -> 41.177.98.220 TCP 130 airsync > ups-onlinet [PSH, ACK] Seq=674 Ack=829 Win=64212 Len=72
570564 182.277191 244.3.185.201 -> 41.177.98.220 TCP 64 airsync > ups-onlinet [ACK] Seq=746 Ack=1022 Win=65535 Len=0
632262 200.333584 244.3.185.201 -> 41.177.98.220 TCP 217 airsync > ups-onlinet [PSH, ACK] Seq=746 Ack=1022 Win=65535 Len=159
633608 200.543019 244.3.185.201 -> 41.177.98.220 TCP 64 airsync > ups-onlinet [ACK] Seq=905 Ack=1138 Win=65419 Len=0
952642 315.926185 244.3.185.201 -> 41.177.98.220 TCP 145 airsync > ups-onlinet [PSH, ACK] Seq=905 Ack=1138 Win=65419 Len=87
952879 315.979492 244.3.185.201 -> 41.177.98.220 TCP 132 airsync > ups-onlinet [PSH, ACK] Seq=992 Ack=1372 Win=65185 Len=74
953558 316.200402 244.3.185.201 -> 41.177.98.220 TCP 64 airsync > ups-onlinet [ACK] Seq=1066 Ack=2139 Win=64418 Len=0
958113 318.101658 244.3.185.201 -> 41.177.98.220 TCP 136 airsync > ups-onlinet [PSH, ACK] Seq=1066 Ack=2139 Win=64418 Len=78
958119 318.104673 244.3.185.201 -> 41.177.98.220 TCP 133 airsync > ups-onlinet [PSH, ACK] Seq=1144 Ack=2267 Win=64290 Len=75
958413 318.228415 244.3.185.201 -> 41.177.98.220 TCP 130 airsync > ups-onlinet [PSH, ACK] Seq=1219 Ack=2869 Win=65535 Len=72
958781 318.387940 244.3.185.201 -> 41.177.98.220 TCP 64 airsync > ups-onlinet [ACK] Seq=1291 Ack=3047 Win=65357 Len=0
961463 319.470472 244.3.185.201 -> 41.177.98.220 TCP 129 airsync > ups-onlinet [PSH, ACK] Seq=1291 Ack=3047 Win=65357 Len=71
961593 319.525382 244.3.185.201 -> 41.177.98.220 TCP 130 airsync > ups-onlinet [PSH, ACK] Seq=1362 Ack=3117 Win=65287 Len=72
961892 319.700446 244.3.185.201 -> 41.177.98.220 TCP 64 airsync > ups-onlinet [ACK] Seq=1434 Ack=3295 Win=65109 Len=0
1002066 335.848180 244.3.185.201 -> 41.177.98.220 TCP 216 airsync > ups-onlinet [PSH, ACK] Seq=1434 Ack=3295 Win=65109 Len=158
1002448 335.997482 244.3.185.201 -> 41.177.98.220 TCP 64 airsync > ups-onlinet [ACK] Seq=1592 Ack=3411 Win=64993 Len=0
