45742  19.188848  244.3.90.94 -> 244.3.41.84  TCP 66 4574 > telnet [SYN] Seq=0 Win=65535 Len=0 MSS=1380 SACK_PERM=1
45746  19.190281  244.3.90.94 -> 244.3.41.84  TCP 64 4574 > telnet [ACK] Seq=1 Ack=1 Win=65535 Len=0
46476  19.396737  244.3.90.94 -> 244.3.41.84  TCP 64 4574 > telnet [ACK] Seq=33 Ack=49 Win=65487 Len=0
47596  19.615490  244.3.90.94 -> 244.3.41.84  TCP 64 4574 > telnet [ACK] Seq=41 Ack=121 Win=65415 Len=0
48539  19.834259  244.3.90.94 -> 244.3.41.84  TCP 64 4574 > telnet [ACK] Seq=169 Ack=144 Win=65392 Len=0
49388  20.068642  244.3.90.94 -> 244.3.41.84  TCP 64 4574 > telnet [ACK] Seq=297 Ack=177 Win=65359 Len=0
49932  20.271757  244.3.90.94 -> 244.3.41.84  TCP 64 4574 > telnet [ACK] Seq=297 Ack=1134 Win=64402 Len=0
52788  22.012143  244.3.90.94 -> 244.3.41.84  TCP 64 4574 > telnet [ACK] Seq=307 Ack=3853 Win=65535 Len=0
60150  24.294280  244.3.90.94 -> 244.3.41.84  TCP 64 4574 > telnet [ACK] Seq=325 Ack=5356 Win=65535 Len=0
73640  29.994779  244.3.90.94 -> 244.3.41.84  TCP 64 4574 > telnet [ACK] Seq=359 Ack=7090 Win=65535 Len=0
