17330   4.982144 244.3.47.184 -> 244.3.41.84  TCP 99 loaprobe > 923 [PSH, ACK] Seq=1 Ack=30 Win=64754 Len=29 TSval=7175846 TSecr=4292268319
17678   5.301048 244.3.47.184 -> 244.3.41.84  TCP 70 loaprobe > 923 [ACK] Seq=30 Ack=59 Win=64725 Len=0 TSval=7175849 TSecr=4292268322
78819  31.258272 244.3.47.184 -> 244.3.41.38  TCP 99 invision > 923 [PSH, ACK] Seq=1 Ack=30 Win=64754 Len=29 TSval=7176109 TSecr=4292293979
79323  31.426314 244.3.47.184 -> 244.3.41.38  TCP 70 invision > 923 [ACK] Seq=30 Ack=59 Win=64725 Len=0 TSval=7176111 TSecr=4292293982
