797302 260.137378 244.3.31.157 -> 244.3.31.168 TCP 70 42035 > smtp [SYN] Seq=0 Win=5840 Len=0 MSS=1380 SACK_PERM=1 WS=8
797304 260.137734 244.3.31.157 -> 244.3.31.168 TCP 64 42035 > smtp [ACK] Seq=1 Ack=1 Win=5840 Len=0
797515 260.157483 244.3.31.157 -> 244.3.31.168 TCP 64 42035 > smtp [ACK] Seq=1 Ack=41 Win=5840 Len=0
799991 261.149536 244.3.31.157 -> 244.3.31.168 TCP 79 [TCP segment of a reassembled PDU]
799998 261.149898 244.3.31.157 -> 244.3.31.168 TCP 64 42035 > smtp [ACK] Seq=22 Ack=67 Win=5840 Len=0
800167 261.230562 244.3.31.157 -> 244.3.31.168 TCP 64 42035 > smtp [ACK] Seq=73 Ack=75 Win=5840 Len=0
800320 261.309383 244.3.31.157 -> 244.3.31.168 TCP 64 42035 > smtp [ACK] Seq=112 Ack=83 Win=5840 Len=0
800506 261.479573 244.3.31.157 -> 244.3.31.168 TCP 64 [TCP segment of a reassembled PDU]
800544 261.519023 244.3.31.157 -> 244.3.31.168 TCP 64 42035 > smtp [ACK] Seq=118 Ack=120 Win=5840 Len=0
801522 262.178045 244.3.31.157 -> 244.3.31.168 TCP 64 42035 > smtp [ACK] Seq=1899 Ack=151 Win=5840 Len=0
801550 262.206523 244.3.31.157 -> 244.3.31.168 TCP 64 [TCP segment of a reassembled PDU]
801911 262.241777 244.3.31.157 -> 244.3.31.168 TCP 64 42035 > smtp [RST, ACK] Seq=1905 Ack=161 Win=5840 Len=0
