328005 113.560749 244.43.108.186 -> 41.177.26.176 TCP 78 8237 > http [SYN] Seq=0 Win=65535 Len=0 MSS=1380 WS=1 TSval=110072341 TSecr=0
328177 113.686099 244.43.108.186 -> 41.177.26.176 TCP 70 8237 > http [ACK] Seq=1 Ack=1 Win=65535 Len=0 TSval=110072461 TSecr=140352952
329311 114.671225 244.43.108.186 -> 41.177.26.176 TCP 70 8237 > http [ACK] Seq=659 Ack=1492 Win=64561 Len=0 TSval=110073451 TSecr=140353050
329347 114.682625 244.43.108.186 -> 41.177.26.176 TCP 70 8237 > http [ACK] Seq=659 Ack=2362 Win=65535 Len=0 TSval=110073461 TSecr=140353051
329348 114.682660 244.43.108.186 -> 41.177.26.176 TCP 70 8237 > http [ACK] Seq=659 Ack=2670 Win=65527 Len=0 TSval=110073461 TSecr=140353051
329353 114.683263 244.43.108.186 -> 41.177.26.176 TCP 70 8237 > http [ACK] Seq=659 Ack=3587 Win=65355 Len=0 TSval=110073461 TSecr=140353052
329633 114.798002 244.43.108.186 -> 41.177.26.176 TCP 70 8237 > http [ACK] Seq=659 Ack=6047 Win=64960 Len=0 TSval=110073571 TSecr=140353063
329640 114.810232 244.43.108.186 -> 41.177.26.176 TCP 70 8237 > http [ACK] Seq=659 Ack=8783 Win=64684 Len=0 TSval=110073591 TSecr=140353064
329929 114.890486 244.43.108.186 -> 41.177.26.15 TCP 78 15244 > http [SYN] Seq=0 Win=65535 Len=0 MSS=1380 WS=1 TSval=110073671 TSecr=0
330013 114.908580 244.43.108.186 -> 41.177.26.176 TCP 70 8237 > http [ACK] Seq=659 Ack=10066 Win=65535 Len=0 TSval=110073691 TSecr=140353064
330245 115.015638 244.43.108.186 -> 41.177.26.15 TCP 70 15244 > http [ACK] Seq=1 Ack=1 Win=65535 Len=0 TSval=110073791 TSecr=140353085
330834 115.167552 244.43.108.186 -> 41.177.26.15 TCP 70 15244 > http [ACK] Seq=448 Ack=1679 Win=64684 Len=0 TSval=110073941 TSecr=140353098
330926 115.258634 244.43.108.186 -> 41.177.26.15 TCP 70 15244 > http [ACK] Seq=448 Ack=3047 Win=65535 Len=0 TSval=110074041 TSecr=140353100
331005 115.293987 244.43.108.186 -> 41.177.26.15 TCP 70 15244 > http [ACK] Seq=448 Ack=5783 Win=64684 Len=0 TSval=110074071 TSecr=140353113
331143 115.358661 244.43.108.186 -> 41.177.26.15 TCP 70 15244 > http [ACK] Seq=448 Ack=7151 Win=65535 Len=0 TSval=110074141 TSecr=140353113
331163 115.385924 244.43.108.186 -> 41.177.26.15 TCP 70 15244 > http [ACK] Seq=448 Ack=9871 Win=64684 Len=0 TSval=110074161 TSecr=140353122
331224 115.420794 244.43.108.186 -> 41.177.26.15 TCP 70 15244 > http [ACK] Seq=448 Ack=12607 Win=64684 Len=0 TSval=110074201 TSecr=140353125
331332 115.486750 244.43.108.186 -> 41.177.26.15 TCP 70 15244 > http [ACK] Seq=448 Ack=15343 Win=64684 Len=0 TSval=110074261 TSecr=140353125
331403 115.512444 244.43.108.186 -> 41.177.26.15 TCP 70 15244 > http [ACK] Seq=448 Ack=18063 Win=64684 Len=0 TSval=110074291 TSecr=140353132
331407 115.513000 244.43.108.186 -> 41.177.26.15 TCP 70 15244 > http [ACK] Seq=448 Ack=20799 Win=64684 Len=0 TSval=110074291 TSecr=140353135
331470 115.547436 244.43.108.186 -> 41.177.26.15 TCP 70 15244 > http [ACK] Seq=448 Ack=23535 Win=64684 Len=0 TSval=110074321 TSecr=140353138
331532 115.608539 244.43.108.186 -> 41.177.26.15 TCP 70 15244 > http [ACK] Seq=448 Ack=24887 Win=65535 Len=0 TSval=110074391 TSecr=140353138
331539 115.613502 244.43.108.186 -> 41.177.26.15 TCP 70 15244 > http [ACK] Seq=448 Ack=27623 Win=64684 Len=0 TSval=110074391 TSecr=140353145
331644 115.638979 244.43.108.186 -> 41.177.26.15 TCP 70 15244 > http [ACK] Seq=448 Ack=30359 Win=64684 Len=0 TSval=110074411 TSecr=140353145
331645 115.638984 244.43.108.186 -> 41.177.26.15 TCP 70 15244 > http [ACK] Seq=448 Ack=33079 Win=64700 Len=0 TSval=110074421 TSecr=140353147
331655 115.639865 244.43.108.186 -> 41.177.26.15 TCP 70 15244 > http [ACK] Seq=448 Ack=35815 Win=64684 Len=0 TSval=110074421 TSecr=140353147
331822 115.674285 244.43.108.186 -> 41.177.26.15 TCP 70 15244 > http [ACK] Seq=448 Ack=38551 Win=64684 Len=0 TSval=110074451 TSecr=140353147
331823 115.674289 244.43.108.186 -> 41.177.26.15 TCP 70 15244 > http [ACK] Seq=448 Ack=41271 Win=64700 Len=0 TSval=110074451 TSecr=140353151
331993 115.735424 244.43.108.186 -> 41.177.26.15 TCP 70 15244 > http [ACK] Seq=448 Ack=44007 Win=64684 Len=0 TSval=110074511 TSecr=140353157
332000 115.739593 244.43.108.186 -> 41.177.26.15 TCP 70 15244 > http [ACK] Seq=448 Ack=46743 Win=64684 Len=0 TSval=110074521 TSecr=140353157
332113 115.765191 244.43.108.186 -> 41.177.26.15 TCP 70 15244 > http [ACK] Seq=448 Ack=49463 Win=64700 Len=0 TSval=110074541 TSecr=140353157
332114 115.765197 244.43.108.186 -> 41.177.26.15 TCP 70 15244 > http [ACK] Seq=448 Ack=52199 Win=64684 Len=0 TSval=110074541 TSecr=140353160
332123 115.765847 244.43.108.186 -> 41.177.26.15 TCP 70 15244 > http [ACK] Seq=448 Ack=54935 Win=64684 Len=0 TSval=110074541 TSecr=140353160
332127 115.766922 244.43.108.186 -> 41.177.26.15 TCP 70 15244 > http [ACK] Seq=448 Ack=57655 Win=64700 Len=0 TSval=110074541 TSecr=140353160
332128 115.766928 244.43.108.186 -> 41.177.26.15 TCP 70 15244 > http [ACK] Seq=448 Ack=60391 Win=64684 Len=0 TSval=110074541 TSecr=140353160
332244 115.800303 244.43.108.186 -> 41.177.26.15 TCP 70 15244 > http [ACK] Seq=448 Ack=63127 Win=64684 Len=0 TSval=110074581 TSecr=140353163
332248 115.800974 244.43.108.186 -> 41.177.26.15 TCP 70 15244 > http [ACK] Seq=448 Ack=65847 Win=64700 Len=0 TSval=110074581 TSecr=140353163
332249 115.801014 244.43.108.186 -> 41.177.26.15 TCP 70 15244 > http [ACK] Seq=448 Ack=68583 Win=64684 Len=0 TSval=110074581 TSecr=140353163
332324 115.861949 244.43.108.186 -> 41.177.26.15 TCP 70 15244 > http [ACK] Seq=448 Ack=71319 Win=64684 Len=0 TSval=110074641 TSecr=140353169
332344 115.864994 244.43.108.186 -> 41.177.26.15 TCP 70 15244 > http [ACK] Seq=448 Ack=74055 Win=64684 Len=0 TSval=110074641 TSecr=140353169
332351 115.865706 244.43.108.186 -> 41.177.26.15 TCP 70 15244 > http [ACK] Seq=448 Ack=76775 Win=64700 Len=0 TSval=110074641 TSecr=140353170
332381 115.890910 244.43.108.186 -> 41.177.26.15 TCP 70 15244 > http [ACK] Seq=448 Ack=79511 Win=64684 Len=0 TSval=110074671 TSecr=140353172
332382 115.891383 244.43.108.186 -> 41.177.26.15 TCP 70 15244 > http [ACK] Seq=448 Ack=82247 Win=61948 Len=0 TSval=110074671 TSecr=140353172
332383 115.891936 244.43.108.186 -> 41.177.26.15 TCP 70 15244 > http [ACK] Seq=448 Ack=84967 Win=61717 Len=0 TSval=110074671 TSecr=140353172
332384 115.891941 244.43.108.186 -> 41.177.26.15 TCP 70 [TCP Window Update] 15244 > http [ACK] Seq=448 Ack=84967 Win=65535 Len=0 TSval=110074671 TSecr=140353172
332385 115.893051 244.43.108.186 -> 41.177.26.15 TCP 70 15244 > http [ACK] Seq=448 Ack=87703 Win=64684 Len=0 TSval=110074671 TSecr=140353172
332386 115.893056 244.43.108.186 -> 41.177.26.15 TCP 70 15244 > http [ACK] Seq=448 Ack=90439 Win=64684 Len=0 TSval=110074671 TSecr=140353172
332387 115.893473 244.43.108.186 -> 41.177.26.15 TCP 70 15244 > http [ACK] Seq=448 Ack=93159 Win=64700 Len=0 TSval=110074671 TSecr=140353173
332388 115.893478 244.43.108.186 -> 41.177.26.15 TCP 70 15244 > http [ACK] Seq=448 Ack=95895 Win=64684 Len=0 TSval=110074671 TSecr=140353173
332450 115.927464 244.43.108.186 -> 41.177.26.15 TCP 70 15244 > http [ACK] Seq=448 Ack=98631 Win=64684 Len=0 TSval=110074701 TSecr=140353173
332451 115.927468 244.43.108.186 -> 41.177.26.15 TCP 70 15244 > http [ACK] Seq=448 Ack=101351 Win=64700 Len=0 TSval=110074701 TSecr=140353176
332452 115.927472 244.43.108.186 -> 41.177.26.15 TCP 70 15244 > http [ACK] Seq=448 Ack=104087 Win=64684 Len=0 TSval=110074701 TSecr=140353176
332453 115.927504 244.43.108.186 -> 41.177.26.15 TCP 70 15244 > http [ACK] Seq=448 Ack=106823 Win=64684 Len=0 TSval=110074701 TSecr=140353176
332455 115.928488 244.43.108.186 -> 41.177.26.15 TCP 70 15244 > http [ACK] Seq=448 Ack=109543 Win=64700 Len=0 TSval=110074701 TSecr=140353176
332515 115.988374 244.43.108.186 -> 41.177.26.15 TCP 70 15244 > http [ACK] Seq=448 Ack=110925 Win=64670 Len=0 TSval=110074761 TSecr=140353182
388888 129.761736 244.43.108.186 -> 41.177.26.176 TCP 70 8237 > http [ACK] Seq=659 Ack=10067 Win=65535 Len=0 TSval=110088541 TSecr=140354560
391430 130.801966 244.43.108.186 -> 41.177.26.15 TCP 70 15244 > http [ACK] Seq=448 Ack=110926 Win=65535 Len=0 TSval=110089581 TSecr=140354664
