293544  98.604728 244.3.79.224 -> 41.177.98.220 TCP 159 here-lm > dpserve [PSH, ACK] Seq=1 Ack=1 Win=65535 Len=101
293634  98.650847 244.3.79.224 -> 41.177.98.220 TCP 127 here-lm > dpserve [PSH, ACK] Seq=102 Ack=199 Win=65337 Len=69
293636  98.654253 244.3.79.224 -> 41.177.98.220 TCP 129 here-lm > dpserve [PSH, ACK] Seq=171 Ack=463 Win=65073 Len=71
293642  98.657904 244.3.79.224 -> 41.177.98.220 TCP 126 here-lm > dpserve [PSH, ACK] Seq=242 Ack=645 Win=64891 Len=68
293675  98.689226 244.3.79.224 -> 41.177.98.220 TCP 128 here-lm > dpserve [PSH, ACK] Seq=310 Ack=855 Win=64681 Len=70
293687  98.692926 244.3.79.224 -> 41.177.98.220 TCP 127 here-lm > dpserve [PSH, ACK] Seq=380 Ack=988 Win=64548 Len=69
293689  98.696835 244.3.79.224 -> 41.177.98.220 TCP 127 here-lm > dpserve [PSH, ACK] Seq=449 Ack=1252 Win=64284 Len=69
294100  99.006880 244.3.79.224 -> 41.177.98.220 TCP 64 here-lm > dpserve [ACK] Seq=518 Ack=1441 Win=65535 Len=0
359743 122.821943 244.3.79.224 -> 41.177.98.220 TCP 127 here-lm > dpserve [PSH, ACK] Seq=518 Ack=1441 Win=65535 Len=69
359757 122.828822 244.3.79.224 -> 41.177.98.220 TCP 126 here-lm > dpserve [PSH, ACK] Seq=587 Ack=1705 Win=65271 Len=68
360154 122.965514 244.3.79.224 -> 41.177.98.220 TCP 127 here-lm > dpserve [PSH, ACK] Seq=655 Ack=1785 Win=65191 Len=69
360186 122.978272 244.3.79.224 -> 41.177.98.220 TCP 122 here-lm > dpserve [PSH, ACK] Seq=724 Ack=1959 Win=65017 Len=64
360197 122.984373 244.3.79.224 -> 41.177.98.220 TCP 133 here-lm > dpserve [PSH, ACK] Seq=788 Ack=2024 Win=64952 Len=75
361203 123.288589 244.3.79.224 -> 41.177.98.220 TCP 64 here-lm > dpserve [ACK] Seq=863 Ack=2695 Win=64281 Len=0
385708 127.965422 244.3.79.224 -> 41.177.98.220 TCP 241 here-lm > dpserve [PSH, ACK] Seq=863 Ack=2695 Win=64281 Len=183
386008 128.210553 244.3.79.224 -> 41.177.98.220 TCP 64 here-lm > dpserve [ACK] Seq=1046 Ack=2781 Win=64195 Len=0
392981 131.453558 244.3.79.224 -> 41.177.98.220 TCP 126 here-lm > dpserve [PSH, ACK] Seq=1046 Ack=2781 Win=64195 Len=68
393000 131.467603 244.3.79.224 -> 41.177.98.220 TCP 153 here-lm > dpserve [PSH, ACK] Seq=1114 Ack=2991 Win=65535 Len=95
393764 131.789743 244.3.79.224 -> 41.177.98.220 TCP 64 here-lm > dpserve [ACK] Seq=1209 Ack=3107 Win=65419 Len=0
395238 132.426574 244.3.79.224 -> 41.177.98.220 TCP 127 here-lm > dpserve [PSH, ACK] Seq=1209 Ack=3107 Win=65419 Len=69
396058 132.726283 244.3.79.224 -> 41.177.98.220 TCP 64 here-lm > dpserve [ACK] Seq=1278 Ack=3230 Win=65296 Len=0
398545 134.093489 244.3.79.224 -> 41.177.98.220 TCP 126 here-lm > dpserve [PSH, ACK] Seq=1278 Ack=3230 Win=65296 Len=68
398596 134.131806 244.3.79.224 -> 41.177.98.220 TCP 126 here-lm > dpserve [PSH, ACK] Seq=1346 Ack=3440 Win=65086 Len=68
398631 134.144313 244.3.79.224 -> 41.177.98.220 TCP 142 here-lm > dpserve [PSH, ACK] Seq=1414 Ack=3650 Win=64876 Len=84
398749 134.190086 244.3.79.224 -> 41.177.98.220 TCP 140 here-lm > dpserve [PSH, ACK] Seq=1498 Ack=3926 Win=64600 Len=82
398763 134.197217 244.3.79.224 -> 41.177.98.220 TCP 140 here-lm > dpserve [PSH, ACK] Seq=1580 Ack=3997 Win=64529 Len=82
399161 134.309134 244.3.79.224 -> 41.177.98.220 TCP 130 here-lm > dpserve [PSH, ACK] Seq=1662 Ack=4359 Win=64167 Len=72
399235 134.352941 244.3.79.224 -> 41.177.98.220 TCP 64 here-lm > dpserve [ACK] Seq=1734 Ack=5767 Win=65535 Len=0
399255 134.357707 244.3.79.224 -> 41.177.98.220 TCP 124 here-lm > dpserve [PSH, ACK] Seq=1734 Ack=5767 Win=65535 Len=66
400514 134.695064 244.3.79.224 -> 41.177.98.220 TCP 64 here-lm > dpserve [ACK] Seq=1800 Ack=6479 Win=64823 Len=0
408200 136.429503 244.3.79.224 -> 41.177.98.220 TCP 159 here-lm > dpserve [PSH, ACK] Seq=1800 Ack=6479 Win=64823 Len=101
409109 136.663844 244.3.79.224 -> 41.177.98.220 TCP 64 here-lm > dpserve [ACK] Seq=1901 Ack=6549 Win=64753 Len=0
432572 141.187030 244.3.79.224 -> 41.177.98.220 TCP 127 here-lm > dpserve [PSH, ACK] Seq=1901 Ack=6549 Win=64753 Len=69
432583 141.193340 244.3.79.224 -> 41.177.98.220 TCP 126 here-lm > dpserve [PSH, ACK] Seq=1970 Ack=6774 Win=64528 Len=68
433098 141.329271 244.3.79.224 -> 41.177.98.220 TCP 127 here-lm > dpserve [PSH, ACK] Seq=2038 Ack=6854 Win=64448 Len=69
433126 141.334515 244.3.79.224 -> 41.177.98.220 TCP 122 here-lm > dpserve [PSH, ACK] Seq=2107 Ack=6985 Win=64317 Len=64
433153 141.339208 244.3.79.224 -> 41.177.98.220 TCP 133 here-lm > dpserve [PSH, ACK] Seq=2171 Ack=7050 Win=64252 Len=75
434106 141.585815 244.3.79.224 -> 41.177.98.220 TCP 64 here-lm > dpserve [ACK] Seq=2246 Ack=7721 Win=65535 Len=0
454609 148.391716 244.3.79.224 -> 41.177.98.220 TCP 136 here-lm > dpserve [PSH, ACK] Seq=2246 Ack=7721 Win=65535 Len=78
454750 148.431639 244.3.79.224 -> 41.177.98.220 TCP 127 here-lm > dpserve [PSH, ACK] Seq=2324 Ack=7793 Win=65463 Len=69
455241 148.585946 244.3.79.224 -> 41.177.98.220 TCP 64 here-lm > dpserve [ACK] Seq=2393 Ack=7875 Win=65381 Len=0
465330 152.965509 244.3.79.224 -> 41.177.98.220 TCP 131 here-lm > dpserve [PSH, ACK] Seq=2393 Ack=7875 Win=65381 Len=73
465851 153.289162 244.3.79.224 -> 41.177.98.220 TCP 64 here-lm > dpserve [ACK] Seq=2466 Ack=7945 Win=65311 Len=0
512464 164.709547 244.3.79.224 -> 41.177.98.220 TCP 173 here-lm > dpserve [PSH, ACK] Seq=2466 Ack=7945 Win=65311 Len=115
512476 164.725208 244.3.79.224 -> 41.177.98.220 TCP 126 here-lm > dpserve [PSH, ACK] Seq=2581 Ack=8015 Win=65241 Len=68
512965 164.860775 244.3.79.224 -> 41.177.98.220 TCP 127 here-lm > dpserve [PSH, ACK] Seq=2649 Ack=8095 Win=65161 Len=69
512980 164.867186 244.3.79.224 -> 41.177.98.220 TCP 122 here-lm > dpserve [PSH, ACK] Seq=2718 Ack=8227 Win=65029 Len=64
513943 165.101890 244.3.79.224 -> 41.177.98.220 TCP 64 here-lm > dpserve [ACK] Seq=2782 Ack=8292 Win=64964 Len=0
517893 167.529723 244.3.79.224 -> 41.177.98.220 TCP 132 hiq > ups-onlinet [PSH, ACK] Seq=1 Ack=1 Win=65535 Len=74
518566 167.726940 244.3.79.224 -> 41.177.98.220 TCP 64 hiq > ups-onlinet [ACK] Seq=75 Ack=730 Win=64806 Len=0
525668 170.757523 244.3.79.224 -> 41.177.98.220 TCP 136 hiq > ups-onlinet [PSH, ACK] Seq=75 Ack=730 Win=64806 Len=78
525670 170.760227 244.3.79.224 -> 41.177.98.220 TCP 133 hiq > ups-onlinet [PSH, ACK] Seq=153 Ack=851 Win=64685 Len=75
526073 170.955911 244.3.79.224 -> 41.177.98.220 TCP 130 hiq > ups-onlinet [PSH, ACK] Seq=228 Ack=1410 Win=65535 Len=72
526395 171.117629 244.3.79.224 -> 41.177.98.220 TCP 64 hiq > ups-onlinet [ACK] Seq=300 Ack=1599 Win=65346 Len=0
540115 175.302054 244.3.79.224 -> 41.177.98.220 TCP 138 hiq > ups-onlinet [PSH, ACK] Seq=300 Ack=1599 Win=65346 Len=80
540136 175.311791 244.3.79.224 -> 41.177.98.220 TCP 159 hiq > ups-onlinet [PSH, ACK] Seq=380 Ack=1884 Win=65061 Len=101
540154 175.313653 244.3.79.224 -> 41.177.98.220 TCP 400 hiq > ups-onlinet [PSH, ACK] Seq=481 Ack=1984 Win=64961 Len=342
540177 175.322734 244.3.79.224 -> 41.177.98.220 TCP 467 hiq > ups-onlinet [PSH, ACK] Seq=823 Ack=2343 Win=64602 Len=409
540948 175.602083 244.3.79.224 -> 41.177.98.220 TCP 64 hiq > ups-onlinet [ACK] Seq=1232 Ack=2740 Win=64205 Len=0
697915 221.165848 244.3.79.224 -> 41.177.98.220 TCP 151 here-lm > dpserve [PSH, ACK] Seq=2782 Ack=8292 Win=64964 Len=93
698206 221.329039 244.3.79.224 -> 41.177.98.220 TCP 127 here-lm > dpserve [PSH, ACK] Seq=2875 Ack=8565 Win=64691 Len=69
698216 221.332350 244.3.79.224 -> 41.177.98.220 TCP 129 here-lm > dpserve [PSH, ACK] Seq=2944 Ack=8804 Win=64452 Len=71
698221 221.335924 244.3.79.224 -> 41.177.98.220 TCP 126 here-lm > dpserve [PSH, ACK] Seq=3015 Ack=8972 Win=64284 Len=68
698815 221.604065 244.3.79.224 -> 41.177.98.220 TCP 128 here-lm > dpserve [PSH, ACK] Seq=3083 Ack=9190 Win=65535 Len=70
698827 221.609330 244.3.79.224 -> 41.177.98.220 TCP 127 here-lm > dpserve [PSH, ACK] Seq=3153 Ack=9347 Win=65378 Len=69
698835 221.613174 244.3.79.224 -> 41.177.98.220 TCP 127 here-lm > dpserve [PSH, ACK] Seq=3222 Ack=9586 Win=65139 Len=69
699218 221.765281 244.3.79.224 -> 41.177.98.220 TCP 64 here-lm > dpserve [ACK] Seq=3291 Ack=11267 Win=65535 Len=0
751811 241.064740 244.3.79.224 -> 41.177.98.220 TCP 131 hiq > ups-onlinet [PSH, ACK] Seq=1232 Ack=2740 Win=64205 Len=73
751867 241.115608 244.3.79.224 -> 41.177.98.220 TCP 64 hiq > ups-onlinet [ACK] Seq=1305 Ack=4555 Win=65535 Len=0
781632 252.638482 244.3.79.224 -> 41.177.98.220 TCP 151 here-lm > dpserve [PSH, ACK] Seq=3291 Ack=11267 Win=65535 Len=93
781708 252.673518 244.3.79.224 -> 41.177.98.220 TCP 127 here-lm > dpserve [PSH, ACK] Seq=3384 Ack=11540 Win=65262 Len=69
781717 252.677136 244.3.79.224 -> 41.177.98.220 TCP 129 here-lm > dpserve [PSH, ACK] Seq=3453 Ack=11779 Win=65023 Len=71
781726 252.680695 244.3.79.224 -> 41.177.98.220 TCP 126 here-lm > dpserve [PSH, ACK] Seq=3524 Ack=11947 Win=64855 Len=68
781729 252.694127 244.3.79.224 -> 41.177.98.220 TCP 128 here-lm > dpserve [PSH, ACK] Seq=3592 Ack=12165 Win=64637 Len=70
781733 252.698806 244.3.79.224 -> 41.177.98.220 TCP 127 here-lm > dpserve [PSH, ACK] Seq=3662 Ack=12322 Win=64480 Len=69
781757 252.702616 244.3.79.224 -> 41.177.98.220 TCP 127 here-lm > dpserve [PSH, ACK] Seq=3731 Ack=12561 Win=64241 Len=69
781771 252.713976 244.3.79.224 -> 41.177.98.220 TCP 64 here-lm > dpserve [ACK] Seq=3800 Ack=14242 Win=65535 Len=0
840568 275.646956 244.3.79.224 -> 41.177.98.220 TCP 126 here-lm > dpserve [PSH, ACK] Seq=3800 Ack=14242 Win=65535 Len=68
840590 275.688618 244.3.79.224 -> 41.177.98.220 TCP 126 here-lm > dpserve [PSH, ACK] Seq=3868 Ack=14460 Win=65317 Len=68
840596 275.701940 244.3.79.224 -> 41.177.98.220 TCP 142 here-lm > dpserve [PSH, ACK] Seq=3936 Ack=14678 Win=65099 Len=84
840692 275.757869 244.3.79.224 -> 41.177.98.220 TCP 140 here-lm > dpserve [PSH, ACK] Seq=4020 Ack=15190 Win=64587 Len=82
840768 275.764979 244.3.79.224 -> 41.177.98.220 TCP 140 here-lm > dpserve [PSH, ACK] Seq=4102 Ack=15261 Win=64516 Len=82
840771 275.771349 244.3.79.224 -> 41.177.98.220 TCP 130 here-lm > dpserve [PSH, ACK] Seq=4184 Ack=15332 Win=64445 Len=72
841383 276.093162 244.3.79.224 -> 41.177.98.220 TCP 64 here-lm > dpserve [ACK] Seq=4256 Ack=16868 Win=65535 Len=0
841386 276.099209 244.3.79.224 -> 41.177.98.220 TCP 124 here-lm > dpserve [PSH, ACK] Seq=4256 Ack=16868 Win=65535 Len=66
841999 276.557131 244.3.79.224 -> 41.177.98.220 TCP 64 here-lm > dpserve [ACK] Seq=4322 Ack=17765 Win=64638 Len=0
964236 320.863257 244.3.79.224 -> 41.177.98.220 TCP 126 here-lm > dpserve [PSH, ACK] Seq=4322 Ack=17765 Win=64638 Len=68
964263 320.879860 244.3.79.224 -> 41.177.98.220 TCP 154 here-lm > dpserve [PSH, ACK] Seq=4390 Ack=17983 Win=64420 Len=96
964425 320.987029 244.3.79.224 -> 41.177.98.220 TCP 195 here-lm > dpserve [PSH, ACK] Seq=4486 Ack=18114 Win=64289 Len=137
964728 321.133056 244.3.79.224 -> 41.177.98.220 TCP 128 here-lm > dpserve [PSH, ACK] Seq=4623 Ack=18224 Win=64179 Len=70
964820 321.170948 244.3.79.224 -> 41.177.98.220 TCP 130 here-lm > dpserve [PSH, ACK] Seq=4693 Ack=18654 Win=65535 Len=72
965265 321.370670 244.3.79.224 -> 41.177.98.220 TCP 131 here-lm > dpserve [PSH, ACK] Seq=4765 Ack=18905 Win=65284 Len=73
966029 321.620492 244.3.79.224 -> 41.177.98.220 TCP 64 here-lm > dpserve [ACK] Seq=4838 Ack=18989 Win=65200 Len=0
967097 322.110828 244.3.79.224 -> 41.177.98.220 TCP 130 here-lm > dpserve [PSH, ACK] Seq=4838 Ack=18989 Win=65200 Len=72
967120 322.119052 244.3.79.224 -> 41.177.98.220 TCP 123 here-lm > dpserve [PSH, ACK] Seq=4910 Ack=19111 Win=65078 Len=65
968238 322.386166 244.3.79.224 -> 41.177.98.220 TCP 64 here-lm > dpserve [ACK] Seq=4975 Ack=19753 Win=64436 Len=0
980601 327.222867 244.3.79.224 -> 41.177.98.220 TCP 129 here-lm > dpserve [PSH, ACK] Seq=4975 Ack=19753 Win=64436 Len=71
980630 327.230365 244.3.79.224 -> 41.177.98.220 TCP 123 here-lm > dpserve [PSH, ACK] Seq=5046 Ack=19824 Win=64365 Len=65
980700 327.254976 244.3.79.224 -> 41.177.98.220 TCP 64 here-lm > dpserve [ACK] Seq=5111 Ack=22584 Win=65535 Len=0
981025 327.526864 244.3.79.224 -> 41.177.98.220 TCP 64 here-lm > dpserve [ACK] Seq=5111 Ack=23345 Win=64774 Len=0
998408 333.747288 244.3.79.224 -> 41.177.98.220 TCP 131 here-lm > dpserve [PSH, ACK] Seq=5111 Ack=23345 Win=64774 Len=73
998899 333.980096 244.3.79.224 -> 41.177.98.220 TCP 64 here-lm > dpserve [ACK] Seq=5184 Ack=23418 Win=64701 Len=0
1003597 336.537758 244.3.79.224 -> 41.177.98.220 TCP 146 here-lm > dpserve [PSH, ACK] Seq=5184 Ack=23418 Win=64701 Len=88
1005983 336.823905 244.3.79.224 -> 41.177.98.220 TCP 64 here-lm > dpserve [ACK] Seq=5272 Ack=23513 Win=64606 Len=0
