1016458 342.208385 244.3.197.47 -> 253.37.253.43 TCP 87 53945 > oob-ws-http [PSH, ACK] Seq=1 Ack=1 Win=16542 Len=29
1016459 342.208390 244.3.197.47 -> 253.37.253.43 TCP 87 [TCP Retransmission] 53945 > oob-ws-http [PSH, ACK] Seq=1 Ack=1 Win=16542 Len=29
1016709 342.405363 244.3.197.47 -> 253.37.253.43 TCP 64 53945 > oob-ws-http [ACK] Seq=30 Ack=70 Win=16525 Len=0
1016710 342.405368 244.3.197.47 -> 253.37.253.43 TCP 64 [TCP Dup ACK 1016709#1] 53945 > oob-ws-http [ACK] Seq=30 Ack=70 Win=16525 Len=0
