28122  11.293990 244.3.153.248 -> 41.177.24.241 TCP 64 49376 > imaps [ACK] Seq=33 Ack=41 Win=253 Len=0
394528 132.255262 244.3.153.248 -> 41.177.24.241 TCP 64 49376 > imaps [ACK] Seq=65 Ack=81 Win=253 Len=0
676117 211.493696 244.3.153.248 -> 244.3.160.80 TCP 70 49383 > https [SYN] Seq=0 Win=8192 Len=0 MSS=1150 WS=256 SACK_PERM=1
676145 211.496454 244.3.153.248 -> 244.3.160.80 TCP 64 49383 > https [ACK] Seq=1 Ack=1 Win=65536 Len=0
676295 211.538468 244.3.153.248 -> 244.3.160.80 TCP 64 49383 > https [ACK] Seq=657 Ack=2335 Win=65536 Len=0
676342 211.565495 244.3.153.248 -> 244.3.160.80 TCP 64 49383 > https [ACK] Seq=1046 Ack=3705 Win=65536 Len=0
710707 226.566429 244.3.153.248 -> 244.3.160.80 TCP 64 49383 > https [FIN, ACK] Seq=1083 Ack=3742 Win=65280 Len=0
710711 226.566564 244.3.153.248 -> 244.3.160.80 TCP 64 49383 > https [ACK] Seq=1084 Ack=3743 Win=65280 Len=0
722881 231.163452 244.3.153.248 -> 41.177.153.71 TCP 70 49384 > hp-pdl-datastr [SYN] Seq=0 Win=8192 Len=0 MSS=1150 WS=256 SACK_PERM=1
722891 231.166593 244.3.153.248 -> 41.177.153.71 TCP 64 49384 > hp-pdl-datastr [ACK] Seq=1 Ack=1 Win=65536 Len=0
722899 231.169258 244.3.153.248 -> 41.177.153.71 TCP 81 [TCP Window Full] 49384 > hp-pdl-datastr [ACK] Seq=1 Ack=1 Win=65536 Len=23
722901 231.169713 244.3.153.248 -> 41.177.153.71 UDP 124 Source port: 49841  Destination port: snmp
722927 231.184939 244.3.153.248 -> 41.177.153.71 TCP 1208 49384 > hp-pdl-datastr [ACK] Seq=24 Ack=1 Win=65536 Len=1150
722929 231.185355 244.3.153.248 -> 41.177.153.71 TCP 1208 49384 > hp-pdl-datastr [ACK] Seq=1174 Ack=1 Win=65536 Len=1150
722951 231.188112 244.3.153.248 -> 41.177.153.71 TCP 1208 49384 > hp-pdl-datastr [ACK] Seq=2324 Ack=1 Win=65536 Len=1150
722955 231.188452 244.3.153.248 -> 41.177.153.71 TCP 1208 49384 > hp-pdl-datastr [ACK] Seq=3474 Ack=1 Win=65536 Len=1150
722957 231.188872 244.3.153.248 -> 41.177.153.71 TCP 1208 49384 > hp-pdl-datastr [ACK] Seq=4624 Ack=1 Win=65536 Len=1150
722960 231.189190 244.3.153.248 -> 41.177.153.71 TCP 1208 49384 > hp-pdl-datastr [ACK] Seq=5774 Ack=1 Win=65536 Len=1150
722968 231.191193 244.3.153.248 -> 41.177.153.71 TCP 1208 49384 > hp-pdl-datastr [ACK] Seq=6924 Ack=1 Win=65536 Len=1150
722970 231.191695 244.3.153.248 -> 41.177.153.71 TCP 1208 49384 > hp-pdl-datastr [ACK] Seq=8074 Ack=1 Win=65536 Len=1150
722978 231.192013 244.3.153.248 -> 41.177.153.71 TCP 1208 49384 > hp-pdl-datastr [ACK] Seq=9224 Ack=1 Win=65536 Len=1150
722982 231.192373 244.3.153.248 -> 41.177.153.71 TCP 1208 49384 > hp-pdl-datastr [ACK] Seq=10374 Ack=1 Win=65536 Len=1150
722986 231.192790 244.3.153.248 -> 41.177.153.71 TCP 1208 49384 > hp-pdl-datastr [ACK] Seq=11524 Ack=1 Win=65536 Len=1150
722990 231.193263 244.3.153.248 -> 41.177.153.71 TCP 1208 49384 > hp-pdl-datastr [ACK] Seq=12674 Ack=1 Win=65536 Len=1150
722997 231.193779 244.3.153.248 -> 41.177.153.71 TCP 1208 49384 > hp-pdl-datastr [ACK] Seq=13824 Ack=1 Win=65536 Len=1150
722999 231.194161 244.3.153.248 -> 41.177.153.71 TCP 1208 49384 > hp-pdl-datastr [ACK] Seq=14974 Ack=1 Win=65536 Len=1150
723004 231.194657 244.3.153.248 -> 41.177.153.71 TCP 1208 49384 > hp-pdl-datastr [ACK] Seq=16124 Ack=1 Win=65536 Len=1150
723008 231.195062 244.3.153.248 -> 41.177.153.71 TCP 1208 49384 > hp-pdl-datastr [ACK] Seq=17274 Ack=1 Win=65536 Len=1150
723013 231.195562 244.3.153.248 -> 41.177.153.71 TCP 1208 49384 > hp-pdl-datastr [ACK] Seq=18424 Ack=1 Win=65536 Len=1150
723014 231.195819 244.3.153.248 -> 41.177.153.71 TCP 1208 49384 > hp-pdl-datastr [ACK] Seq=19574 Ack=1 Win=65536 Len=1150
723018 231.196518 244.3.153.248 -> 41.177.153.71 TCP 1208 49384 > hp-pdl-datastr [ACK] Seq=20724 Ack=1 Win=65536 Len=1150
723020 231.197019 244.3.153.248 -> 41.177.153.71 TCP 1208 49384 > hp-pdl-datastr [ACK] Seq=21874 Ack=1 Win=65536 Len=1150
723024 231.197432 244.3.153.248 -> 41.177.153.71 TCP 1208 49384 > hp-pdl-datastr [ACK] Seq=23024 Ack=1 Win=65536 Len=1150
723029 231.198306 244.3.153.248 -> 41.177.153.71 TCP 1208 49384 > hp-pdl-datastr [ACK] Seq=24174 Ack=1 Win=65536 Len=1150
723030 231.198593 244.3.153.248 -> 41.177.153.71 TCP 1208 49384 > hp-pdl-datastr [ACK] Seq=25324 Ack=1 Win=65536 Len=1150
723036 231.199726 244.3.153.248 -> 41.177.153.71 TCP 1208 49384 > hp-pdl-datastr [ACK] Seq=26474 Ack=1 Win=65536 Len=1150
723038 231.200030 244.3.153.248 -> 41.177.153.71 TCP 1208 49384 > hp-pdl-datastr [ACK] Seq=27624 Ack=1 Win=65536 Len=1150
723043 231.200386 244.3.153.248 -> 41.177.153.71 TCP 1208 49384 > hp-pdl-datastr [ACK] Seq=28774 Ack=1 Win=65536 Len=1150
723051 231.200868 244.3.153.248 -> 41.177.153.71 TCP 1208 49384 > hp-pdl-datastr [ACK] Seq=29924 Ack=1 Win=65536 Len=1150
723060 231.201306 244.3.153.248 -> 41.177.153.71 TCP 1208 49384 > hp-pdl-datastr [ACK] Seq=31074 Ack=1 Win=65536 Len=1150
723062 231.201737 244.3.153.248 -> 41.177.153.71 TCP 1208 49384 > hp-pdl-datastr [ACK] Seq=32224 Ack=1 Win=65536 Len=1150
723068 231.202335 244.3.153.248 -> 41.177.153.71 TCP 1208 49384 > hp-pdl-datastr [ACK] Seq=33374 Ack=1 Win=65536 Len=1150
723069 231.202561 244.3.153.248 -> 41.177.153.71 TCP 773 49384 > hp-pdl-datastr [FIN, PSH, ACK] Seq=34524 Ack=1 Win=65536 Len=715
723083 231.206324 244.3.153.248 -> 41.177.153.71 TCP 64 49384 > hp-pdl-datastr [ACK] Seq=35240 Ack=2 Win=65536 Len=0
782264 253.060761 244.3.153.248 -> 41.177.24.241 TCP 64 49376 > imaps [ACK] Seq=97 Ack=121 Win=253 Len=0
793565 258.457763 244.3.153.248 -> 41.177.3.18  TCP 70 49389 > unieng [SYN] Seq=0 Win=30732 Len=0 MSS=1150 WS=1 SACK_PERM=1
793575 258.460376 244.3.153.248 -> 41.177.3.18  TCP 64 49389 > unieng [ACK] Seq=1 Ack=1 Win=30732 Len=0
793578 258.460710 244.3.153.248 -> 41.177.3.18  TCP 64 49389 > unieng [PSH, ACK] Seq=1 Ack=1 Win=30732 Len=4
793591 258.463582 244.3.153.248 -> 41.177.3.18  TCP 78 49389 > unieng [PSH, ACK] Seq=5 Ack=5 Win=30728 Len=20
793633 258.500531 244.3.153.248 -> 41.177.3.18  TCP 74 49389 > unieng [PSH, ACK] Seq=25 Ack=31 Win=30702 Len=16
793653 258.506903 244.3.153.248 -> 41.177.3.18  TCP 64 49389 > unieng [ACK] Seq=41 Ack=2331 Win=30732 Len=0
793655 258.507265 244.3.153.248 -> 41.177.3.18  TCP 64 49389 > unieng [ACK] Seq=41 Ack=4631 Win=30732 Len=0
793670 258.509919 244.3.153.248 -> 41.177.3.18  TCP 64 49389 > unieng [ACK] Seq=41 Ack=6931 Win=30732 Len=0
793672 258.510719 244.3.153.248 -> 41.177.3.18  TCP 64 49389 > unieng [ACK] Seq=41 Ack=8389 Win=30732 Len=0
793674 258.511295 244.3.153.248 -> 41.177.3.18  TCP 97 49389 > unieng [PSH, ACK] Seq=41 Ack=8389 Win=30732 Len=39
793686 258.513978 244.3.153.248 -> 41.177.3.18  TCP 75 49389 > unieng [PSH, ACK] Seq=80 Ack=8405 Win=30716 Len=17
793727 258.522042 244.3.153.248 -> 41.177.3.18  TCP 70 49389 > unieng [PSH, ACK] Seq=97 Ack=8417 Win=30704 Len=12
793951 258.627228 244.3.153.248 -> 41.177.3.18  TCP 104 49389 > unieng [PSH, ACK] Seq=109 Ack=8445 Win=30676 Len=46
793959 258.630525 244.3.153.248 -> 41.177.3.18  TCP 97 49389 > unieng [PSH, ACK] Seq=155 Ack=8484 Win=30637 Len=39
793963 258.632504 244.3.153.248 -> 41.177.3.18  TCP 86 49389 > unieng [PSH, ACK] Seq=194 Ack=8512 Win=30609 Len=28
793967 258.634501 244.3.153.248 -> 41.177.3.18  TCP 86 49389 > unieng [PSH, ACK] Seq=222 Ack=8540 Win=30581 Len=28
793971 258.636339 244.3.153.248 -> 41.177.3.18  TCP 86 49389 > unieng [PSH, ACK] Seq=250 Ack=8599 Win=30522 Len=28
793977 258.638210 244.3.153.248 -> 41.177.3.18  TCP 117 49389 > unieng [PSH, ACK] Seq=278 Ack=8627 Win=30494 Len=59
794036 258.671209 244.3.153.248 -> 41.177.3.18  TCP 99 49389 > unieng [PSH, ACK] Seq=337 Ack=8655 Win=30466 Len=41
794044 258.674399 244.3.153.248 -> 41.177.3.18  TCP 97 49389 > unieng [PSH, ACK] Seq=378 Ack=8694 Win=30427 Len=39
794054 258.676194 244.3.153.248 -> 41.177.3.18  TCP 86 49389 > unieng [PSH, ACK] Seq=417 Ack=8722 Win=30399 Len=28
794075 258.679152 244.3.153.248 -> 41.177.3.18  TCP 104 49389 > unieng [PSH, ACK] Seq=445 Ack=8750 Win=30371 Len=46
794097 258.681268 244.3.153.248 -> 41.177.3.18  TCP 97 49389 > unieng [PSH, ACK] Seq=491 Ack=8789 Win=30332 Len=39
794108 258.683127 244.3.153.248 -> 41.177.3.18  TCP 86 49389 > unieng [PSH, ACK] Seq=530 Ack=8817 Win=30304 Len=28
794116 258.685076 244.3.153.248 -> 41.177.3.18  TCP 86 49389 > unieng [PSH, ACK] Seq=558 Ack=8845 Win=30276 Len=28
794128 258.687155 244.3.153.248 -> 41.177.3.18  TCP 86 49389 > unieng [PSH, ACK] Seq=586 Ack=8904 Win=30217 Len=28
794138 258.689205 244.3.153.248 -> 41.177.3.18  TCP 117 49389 > unieng [PSH, ACK] Seq=614 Ack=8932 Win=30189 Len=59
794158 258.691336 244.3.153.248 -> 41.177.3.18  TCP 104 49389 > unieng [PSH, ACK] Seq=673 Ack=8960 Win=30161 Len=46
794164 258.694017 244.3.153.248 -> 41.177.3.18  TCP 97 49389 > unieng [PSH, ACK] Seq=719 Ack=8999 Win=30122 Len=39
794172 258.695992 244.3.153.248 -> 41.177.3.18  TCP 86 49389 > unieng [PSH, ACK] Seq=758 Ack=9027 Win=30094 Len=28
794179 258.697775 244.3.153.248 -> 41.177.3.18  TCP 83 49389 > unieng [PSH, ACK] Seq=786 Ack=9052 Win=30069 Len=25
794187 258.699712 244.3.153.248 -> 41.177.3.18  TCP 102 49389 > unieng [PSH, ACK] Seq=811 Ack=9080 Win=30041 Len=44
794193 258.701828 244.3.153.248 -> 41.177.3.18  TCP 97 49389 > unieng [PSH, ACK] Seq=855 Ack=9119 Win=30002 Len=39
794197 258.703724 244.3.153.248 -> 41.177.3.18  TCP 86 49389 > unieng [PSH, ACK] Seq=894 Ack=9147 Win=29974 Len=28
794203 258.706296 244.3.153.248 -> 41.177.3.18  TCP 704 49389 > unieng [PSH, ACK] Seq=922 Ack=9175 Win=29946 Len=646
794214 258.710320 244.3.153.248 -> 41.177.3.18  TCP 101 49389 > unieng [PSH, ACK] Seq=1568 Ack=9208 Win=29913 Len=43
794220 258.712761 244.3.153.248 -> 41.177.3.18  TCP 88 49389 > unieng [PSH, ACK] Seq=1611 Ack=9238 Win=29883 Len=30
794252 258.741210 244.3.153.248 -> 41.177.3.18  TCP 127 49389 > unieng [PSH, ACK] Seq=1641 Ack=9268 Win=29853 Len=69
794271 258.749840 244.3.153.248 -> 41.177.3.18  TCP 132 49389 > unieng [PSH, ACK] Seq=1710 Ack=9814 Win=30732 Len=74
794275 258.752788 244.3.153.248 -> 41.177.3.18  TCP 135 49389 > unieng [PSH, ACK] Seq=1784 Ack=9846 Win=30700 Len=77
794279 258.755851 244.3.153.248 -> 41.177.3.18  TCP 129 49389 > unieng [PSH, ACK] Seq=1861 Ack=9878 Win=30668 Len=71
794302 258.761909 244.3.153.248 -> 41.177.3.18  TCP 88 49389 > unieng [PSH, ACK] Seq=1932 Ack=9977 Win=30569 Len=30
794315 258.764728 244.3.153.248 -> 41.177.3.18  TCP 88 49389 > unieng [PSH, ACK] Seq=1962 Ack=10384 Win=30162 Len=30
794329 258.767345 244.3.153.248 -> 41.177.3.18  TCP 155 49389 > unieng [PSH, ACK] Seq=1992 Ack=10591 Win=29955 Len=97
794349 258.770031 244.3.153.248 -> 41.177.3.18  TCP 86 49389 > unieng [PSH, ACK] Seq=2089 Ack=10623 Win=29923 Len=28
794357 258.773073 244.3.153.248 -> 41.177.3.18  TCP 145 49389 > unieng [PSH, ACK] Seq=2117 Ack=10743 Win=29803 Len=87
794372 258.775576 244.3.153.248 -> 41.177.3.18  TCP 157 49389 > unieng [PSH, ACK] Seq=2204 Ack=10775 Win=29771 Len=99
794377 258.779233 244.3.153.248 -> 41.177.3.18  TCP 102 49389 > unieng [PSH, ACK] Seq=2303 Ack=10807 Win=29739 Len=44
794401 258.782680 244.3.153.248 -> 41.177.3.18  TCP 143 49389 > unieng [PSH, ACK] Seq=2347 Ack=10839 Win=29707 Len=85
794410 258.786581 244.3.153.248 -> 41.177.3.18  TCP 98 49389 > unieng [PSH, ACK] Seq=2432 Ack=10876 Win=29670 Len=40
794438 258.789441 244.3.153.248 -> 41.177.3.18  TCP 90 49389 > unieng [PSH, ACK] Seq=2472 Ack=11005 Win=30732 Len=32
794449 258.791863 244.3.153.248 -> 41.177.3.18  TCP 144 49389 > unieng [PSH, ACK] Seq=2504 Ack=11033 Win=30704 Len=86
794465 258.794610 244.3.153.248 -> 41.177.3.18  TCP 90 49389 > unieng [PSH, ACK] Seq=2590 Ack=11070 Win=30667 Len=32
794476 258.797125 244.3.153.248 -> 41.177.3.18  TCP 144 49389 > unieng [PSH, ACK] Seq=2622 Ack=11098 Win=30639 Len=86
794527 258.812391 244.3.153.248 -> 41.177.3.18  TCP 90 49389 > unieng [PSH, ACK] Seq=2708 Ack=11135 Win=30602 Len=32
794536 258.817289 244.3.153.248 -> 41.177.3.18  TCP 86 49389 > unieng [PSH, ACK] Seq=2740 Ack=11163 Win=30574 Len=28
794540 258.820306 244.3.153.248 -> 41.177.3.18  TCP 107 49389 > unieng [PSH, ACK] Seq=2768 Ack=11290 Win=30447 Len=49
794544 258.822921 244.3.153.248 -> 41.177.3.18  TCP 106 49389 > unieng [PSH, ACK] Seq=2817 Ack=11338 Win=30399 Len=48
794550 258.825275 244.3.153.248 -> 41.177.3.18  TCP 314 49389 > unieng [PSH, ACK] Seq=2865 Ack=11366 Win=30371 Len=256
794559 258.828551 244.3.153.248 -> 41.177.3.18  TCP 114 49389 > unieng [PSH, ACK] Seq=3121 Ack=11394 Win=30343 Len=56
794591 258.831608 244.3.153.248 -> 41.177.3.18  TCP 86 49389 > unieng [PSH, ACK] Seq=3177 Ack=11426 Win=30311 Len=28
794596 258.835453 244.3.153.248 -> 41.177.3.18  TCP 86 49389 > unieng [PSH, ACK] Seq=3205 Ack=11564 Win=30173 Len=28
795020 259.050991 244.3.153.248 -> 41.177.3.18  TCP 64 49389 > unieng [ACK] Seq=3233 Ack=11702 Win=30035 Len=0
795022 259.053312 244.3.153.248 -> 41.177.3.18  TCP 152 49389 > unieng [PSH, ACK] Seq=3233 Ack=11702 Win=30035 Len=94
795028 259.056015 244.3.153.248 -> 41.177.3.18  TCP 138 49389 > unieng [PSH, ACK] Seq=3327 Ack=11733 Win=30004 Len=80
795082 259.067527 244.3.153.248 -> 41.177.3.18  TCP 90 49389 > unieng [PSH, ACK] Seq=3407 Ack=11764 Win=29973 Len=32
795098 259.069646 244.3.153.248 -> 41.177.3.18  TCP 90 49389 > unieng [PSH, ACK] Seq=3439 Ack=11802 Win=29935 Len=32
795108 259.071728 244.3.153.248 -> 41.177.3.18  TCP 96 49389 > unieng [PSH, ACK] Seq=3471 Ack=11850 Win=29887 Len=38
795127 259.081024 244.3.153.248 -> 41.177.3.18  TCP 94 49389 > unieng [PSH, ACK] Seq=3509 Ack=12037 Win=29700 Len=36
795131 259.083066 244.3.153.248 -> 41.177.3.18  TCP 227 49389 > unieng [PSH, ACK] Seq=3545 Ack=12074 Win=29663 Len=169
795137 259.086287 244.3.153.248 -> 41.177.3.18  TCP 180 49389 > unieng [PSH, ACK] Seq=3714 Ack=12257 Win=30732 Len=122
795144 259.091189 244.3.153.248 -> 41.177.3.18  TCP 133 49389 > unieng [PSH, ACK] Seq=3836 Ack=12645 Win=30344 Len=75
795152 259.093568 244.3.153.248 -> 41.177.3.18  TCP 133 49389 > unieng [PSH, ACK] Seq=3911 Ack=12692 Win=30297 Len=75
795173 259.100413 244.3.153.248 -> 41.177.3.18  TCP 94 49389 > unieng [PSH, ACK] Seq=3986 Ack=12739 Win=30250 Len=36
795177 259.102700 244.3.153.248 -> 41.177.3.18  TCP 98 49389 > unieng [PSH, ACK] Seq=4022 Ack=12775 Win=30214 Len=40
795193 259.105329 244.3.153.248 -> 41.177.3.18  TCP 90 49389 > unieng [PSH, ACK] Seq=4062 Ack=12970 Win=30019 Len=32
795228 259.119929 244.3.153.248 -> 41.177.3.18  TCP 86 49389 > unieng [PSH, ACK] Seq=4094 Ack=12998 Win=29991 Len=28
795237 259.122630 244.3.153.248 -> 41.177.3.18  TCP 86 49389 > unieng [PSH, ACK] Seq=4122 Ack=13136 Win=29853 Len=28
795367 259.172053 244.3.153.248 -> 41.177.3.18  TCP 116 49389 > unieng [PSH, ACK] Seq=4150 Ack=13168 Win=29821 Len=58
795371 259.174759 244.3.153.248 -> 41.177.3.18  TCP 98 49389 > unieng [PSH, ACK] Seq=4208 Ack=13211 Win=29778 Len=40
795377 259.176882 244.3.153.248 -> 41.177.3.18  TCP 90 49389 > unieng [PSH, ACK] Seq=4248 Ack=13244 Win=29745 Len=32
795384 259.178768 244.3.153.248 -> 41.177.3.18  TCP 182 49389 > unieng [PSH, ACK] Seq=4280 Ack=13272 Win=29717 Len=124
795393 259.181692 244.3.153.248 -> 41.177.3.18  TCP 98 49389 > unieng [PSH, ACK] Seq=4404 Ack=13309 Win=29680 Len=40
795416 259.183829 244.3.153.248 -> 41.177.3.18  TCP 90 49389 > unieng [PSH, ACK] Seq=4444 Ack=13342 Win=29647 Len=32
795423 259.185862 244.3.153.248 -> 41.177.3.18  TCP 114 49389 > unieng [PSH, ACK] Seq=4476 Ack=13370 Win=29619 Len=56
795456 259.197225 244.3.153.248 -> 41.177.3.18  TCP 101 49389 > unieng [PSH, ACK] Seq=4532 Ack=13406 Win=29583 Len=43
795494 259.213353 244.3.153.248 -> 41.177.3.18  TCP 90 49389 > unieng [PSH, ACK] Seq=4575 Ack=14260 Win=30732 Len=32
795500 259.215356 244.3.153.248 -> 41.177.3.18  TCP 122 49389 > unieng [PSH, ACK] Seq=4607 Ack=14288 Win=30704 Len=64
795561 259.256019 244.3.153.248 -> 41.177.3.18  TCP 101 49389 > unieng [PSH, ACK] Seq=4671 Ack=14324 Win=30668 Len=43
795567 259.258696 244.3.153.248 -> 41.177.3.18  TCP 90 49389 > unieng [PSH, ACK] Seq=4714 Ack=14369 Win=30623 Len=32
795645 259.290653 244.3.153.248 -> 41.177.3.18  TCP 323 49389 > unieng [PSH, ACK] Seq=4746 Ack=14397 Win=30595 Len=265
795717 259.336106 244.3.153.248 -> 41.177.3.18  TCP 114 49389 > unieng [PSH, ACK] Seq=5011 Ack=15092 Win=29900 Len=56
795744 259.351262 244.3.153.248 -> 41.177.3.18  TCP 101 49389 > unieng [PSH, ACK] Seq=5067 Ack=15128 Win=29864 Len=43
795755 259.358983 244.3.153.248 -> 41.177.3.18  TCP 70 49389 > unieng [ACK] Seq=5110 Ack=16278 Win=30732 Len=0 SLE=17428 SRE=17608
795759 259.359184 244.3.153.248 -> 41.177.3.18  TCP 64 49389 > unieng [ACK] Seq=5110 Ack=17608 Win=30732 Len=0
795768 259.360610 244.3.153.248 -> 41.177.3.18  TCP 323 49389 > unieng [PSH, ACK] Seq=5110 Ack=17608 Win=30732 Len=265
795776 259.373685 244.3.153.248 -> 41.177.3.18  TCP 86 49389 > unieng [PSH, ACK] Seq=5375 Ack=18303 Win=30037 Len=28
795782 259.376672 244.3.153.248 -> 41.177.3.18  TCP 86 49389 > unieng [PSH, ACK] Seq=5403 Ack=18560 Win=29780 Len=28
795792 259.382014 244.3.153.248 -> 41.177.3.18  TCP 86 49389 > unieng [PSH, ACK] Seq=5431 Ack=18707 Win=29633 Len=28
795805 259.389240 244.3.153.248 -> 41.177.3.18  TCP 86 49389 > unieng [PSH, ACK] Seq=5459 Ack=18998 Win=30732 Len=28
795820 259.395173 244.3.153.248 -> 41.177.3.18  TCP 90 49389 > unieng [PSH, ACK] Seq=5487 Ack=19273 Win=30457 Len=32
795826 259.397431 244.3.153.248 -> 41.177.3.18  TCP 86 49389 > unieng [PSH, ACK] Seq=5519 Ack=19301 Win=30429 Len=28
795840 259.400132 244.3.153.248 -> 41.177.3.18  TCP 86 49389 > unieng [PSH, ACK] Seq=5547 Ack=19575 Win=30155 Len=28
795849 259.404596 244.3.153.248 -> 41.177.3.18  TCP 86 49389 > unieng [PSH, ACK] Seq=5575 Ack=19706 Win=30024 Len=28
796169 259.612695 244.3.153.248 -> 41.177.3.18  TCP 64 49389 > unieng [ACK] Seq=5603 Ack=19969 Win=29761 Len=0
796186 259.638953 244.3.153.248 -> 41.177.3.18  TCP 114 49389 > unieng [PSH, ACK] Seq=5603 Ack=19969 Win=29761 Len=56
796230 259.650682 244.3.153.248 -> 41.177.3.18  TCP 114 49389 > unieng [PSH, ACK] Seq=5659 Ack=20005 Win=29725 Len=56
796253 259.656446 244.3.153.248 -> 41.177.3.18  TCP 122 49389 > unieng [PSH, ACK] Seq=5715 Ack=20041 Win=29689 Len=64
796271 259.661010 244.3.153.248 -> 41.177.3.18  TCP 101 49389 > unieng [PSH, ACK] Seq=5779 Ack=20077 Win=29653 Len=43
796284 259.664381 244.3.153.248 -> 41.177.3.18  TCP 90 49389 > unieng [PSH, ACK] Seq=5822 Ack=20617 Win=30732 Len=32
796290 259.666323 244.3.153.248 -> 41.177.3.18  TCP 182 49389 > unieng [PSH, ACK] Seq=5854 Ack=20645 Win=30704 Len=124
796301 259.668696 244.3.153.248 -> 41.177.3.18  TCP 98 49389 > unieng [PSH, ACK] Seq=5978 Ack=20682 Win=30667 Len=40
796318 259.670767 244.3.153.248 -> 41.177.3.18  TCP 90 49389 > unieng [PSH, ACK] Seq=6018 Ack=20715 Win=30634 Len=32
796339 259.679210 244.3.153.248 -> 41.177.3.18  TCP 94 49389 > unieng [PSH, ACK] Seq=6050 Ack=20743 Win=30606 Len=36
796717 259.893514 244.3.153.248 -> 41.177.3.18  TCP 64 49389 > unieng [ACK] Seq=6086 Ack=20775 Win=30574 Len=0
814996 265.709076 244.3.153.248 -> 41.177.3.18  TCP 97 49389 > unieng [PSH, ACK] Seq=6086 Ack=20775 Win=30574 Len=39
815005 265.712511 244.3.153.248 -> 41.177.3.18  TCP 143 49389 > unieng [PSH, ACK] Seq=6125 Ack=20860 Win=30489 Len=85
815152 265.748802 244.3.153.248 -> 41.177.3.18  TCP 97 49389 > unieng [PSH, ACK] Seq=6210 Ack=20888 Win=30461 Len=39
815187 265.752702 244.3.153.248 -> 41.177.3.18  TCP 94 49389 > unieng [PSH, ACK] Seq=6249 Ack=21495 Win=29854 Len=36
815766 265.961897 244.3.153.248 -> 41.177.3.18  TCP 64 49389 > unieng [ACK] Seq=6285 Ack=21587 Win=29762 Len=0
819991 267.530577 244.3.153.248 -> 41.177.3.18  TCP 97 49389 > unieng [PSH, ACK] Seq=6285 Ack=21587 Win=29762 Len=39
820004 267.534373 244.3.153.248 -> 41.177.3.18  TCP 143 49389 > unieng [PSH, ACK] Seq=6324 Ack=21672 Win=29677 Len=85
820085 267.555607 244.3.153.248 -> 41.177.3.18  TCP 97 49389 > unieng [PSH, ACK] Seq=6409 Ack=21700 Win=29649 Len=39
820111 267.578077 244.3.153.248 -> 41.177.3.18  TCP 114 49389 > unieng [PSH, ACK] Seq=6448 Ack=22307 Win=30732 Len=56
820634 267.787106 244.3.153.248 -> 41.177.3.18  TCP 64 49389 > unieng [ACK] Seq=6504 Ack=22343 Win=30696 Len=0
828012 270.228568 244.3.153.248 -> 41.177.3.18  TCP 86 49389 > unieng [PSH, ACK] Seq=6504 Ack=22343 Win=30696 Len=28
828104 270.289293 244.3.153.248 -> 41.177.3.18  TCP 116 49389 > unieng [PSH, ACK] Seq=6532 Ack=22481 Win=30558 Len=58
828109 270.292199 244.3.153.248 -> 41.177.3.18  TCP 98 49389 > unieng [PSH, ACK] Seq=6590 Ack=22524 Win=30515 Len=40
828113 270.294714 244.3.153.248 -> 41.177.3.18  TCP 90 49389 > unieng [PSH, ACK] Seq=6630 Ack=22557 Win=30482 Len=32
828120 270.297126 244.3.153.248 -> 41.177.3.18  TCP 182 49389 > unieng [PSH, ACK] Seq=6662 Ack=22585 Win=30454 Len=124
828126 270.299835 244.3.153.248 -> 41.177.3.18  TCP 98 49389 > unieng [PSH, ACK] Seq=6786 Ack=22622 Win=30417 Len=40
828134 270.302130 244.3.153.248 -> 41.177.3.18  TCP 90 49389 > unieng [PSH, ACK] Seq=6826 Ack=22655 Win=30384 Len=32
828142 270.304595 244.3.153.248 -> 41.177.3.18  TCP 114 49389 > unieng [PSH, ACK] Seq=6858 Ack=22683 Win=30356 Len=56
828157 270.308733 244.3.153.248 -> 41.177.3.18  TCP 101 49389 > unieng [PSH, ACK] Seq=6914 Ack=22719 Win=30320 Len=43
828186 270.313278 244.3.153.248 -> 41.177.3.18  TCP 90 49389 > unieng [PSH, ACK] Seq=6957 Ack=23566 Win=30732 Len=32
828193 270.315801 244.3.153.248 -> 41.177.3.18  TCP 122 49389 > unieng [PSH, ACK] Seq=6989 Ack=23594 Win=30704 Len=64
828226 270.320166 244.3.153.248 -> 41.177.3.18  TCP 101 49389 > unieng [PSH, ACK] Seq=7053 Ack=23630 Win=30668 Len=43
828265 270.322660 244.3.153.248 -> 41.177.3.18  TCP 90 49389 > unieng [PSH, ACK] Seq=7096 Ack=23675 Win=30623 Len=32
828362 270.350208 244.3.153.248 -> 41.177.3.18  TCP 323 49389 > unieng [PSH, ACK] Seq=7128 Ack=23703 Win=30595 Len=265
828414 270.368062 244.3.153.248 -> 41.177.3.18  TCP 114 49389 > unieng [PSH, ACK] Seq=7393 Ack=24398 Win=29900 Len=56
829014 270.580420 244.3.153.248 -> 41.177.3.18  TCP 64 49389 > unieng [ACK] Seq=7449 Ack=24434 Win=29864 Len=0
864000 285.434397 244.3.153.248 -> 41.177.3.18  TCP 86 49389 > unieng [PSH, ACK] Seq=7449 Ack=24434 Win=29864 Len=28
864102 285.476992 244.3.153.248 -> 41.177.3.18  TCP 116 49389 > unieng [PSH, ACK] Seq=7477 Ack=24572 Win=29726 Len=58
864126 285.479923 244.3.153.248 -> 41.177.3.18  TCP 98 49389 > unieng [PSH, ACK] Seq=7535 Ack=24615 Win=29683 Len=40
864130 285.482146 244.3.153.248 -> 41.177.3.18  TCP 90 49389 > unieng [PSH, ACK] Seq=7575 Ack=24648 Win=29650 Len=32
864134 285.484160 244.3.153.248 -> 41.177.3.18  TCP 182 49389 > unieng [PSH, ACK] Seq=7607 Ack=24676 Win=29622 Len=124
864140 285.486677 244.3.153.248 -> 41.177.3.18  TCP 98 49389 > unieng [PSH, ACK] Seq=7731 Ack=24713 Win=29585 Len=40
864146 285.488966 244.3.153.248 -> 41.177.3.18  TCP 90 49389 > unieng [PSH, ACK] Seq=7771 Ack=24746 Win=30732 Len=32
864154 285.491253 244.3.153.248 -> 41.177.3.18  TCP 114 49389 > unieng [PSH, ACK] Seq=7803 Ack=24774 Win=30704 Len=56
864158 285.494702 244.3.153.248 -> 41.177.3.18  TCP 101 49389 > unieng [PSH, ACK] Seq=7859 Ack=24810 Win=30668 Len=43
864165 285.498705 244.3.153.248 -> 41.177.3.18  TCP 90 49389 > unieng [PSH, ACK] Seq=7902 Ack=25657 Win=29821 Len=32
864172 285.500868 244.3.153.248 -> 41.177.3.18  TCP 122 49389 > unieng [PSH, ACK] Seq=7934 Ack=25685 Win=29793 Len=64
864180 285.504955 244.3.153.248 -> 41.177.3.18  TCP 101 49389 > unieng [PSH, ACK] Seq=7998 Ack=25721 Win=29757 Len=43
864185 285.507246 244.3.153.248 -> 41.177.3.18  TCP 90 49389 > unieng [PSH, ACK] Seq=8041 Ack=25766 Win=29712 Len=32
864216 285.523956 244.3.153.248 -> 41.177.3.18  TCP 323 49389 > unieng [PSH, ACK] Seq=8073 Ack=25794 Win=29684 Len=265
864265 285.535540 244.3.153.248 -> 41.177.3.18  TCP 114 49389 > unieng [PSH, ACK] Seq=8338 Ack=26489 Win=30732 Len=56
864643 285.742863 244.3.153.248 -> 41.177.3.18  TCP 64 49389 > unieng [ACK] Seq=8394 Ack=26525 Win=30696 Len=0
