50358  20.499165  244.3.31.41 -> 41.177.98.98 TCP 222 em7-secom > 41014 [PSH, ACK] Seq=1 Ack=360 Win=49640 Len=164
241271  83.988233  244.3.31.41 -> 41.177.98.98 TCP 222 em7-secom > 41014 [PSH, ACK] Seq=165 Ack=747 Win=49640 Len=164
729347 234.143685  244.3.31.41 -> 41.177.98.98 TCP 70 em7-secom > 41302 [SYN, ACK] Seq=0 Ack=1 Win=49640 Len=0 MSS=1460 WS=1 SACK_PERM=1
729350 234.144169  244.3.31.41 -> 41.177.98.98 TCP 64 em7-secom > 41302 [ACK] Seq=1 Ack=139 Win=49502 Len=0
734478 234.616016  244.3.31.41 -> 41.177.98.98 TCP 161 em7-secom > 41302 [PSH, ACK] Seq=1 Ack=139 Win=49640 Len=103
734516 234.617349  244.3.31.41 -> 41.177.98.98 TCP 64 em7-secom > 41302 [ACK] Seq=104 Ack=332 Win=49640 Len=0
735176 234.695241  244.3.31.41 -> 41.177.98.98 TCP 126 em7-secom > 41302 [PSH, ACK] Seq=104 Ack=332 Win=49640 Len=68
735972 234.976846  244.3.31.41 -> 41.177.98.98 TCP 126 em7-secom > 41302 [PSH, ACK] Seq=172 Ack=525 Win=49640 Len=68
746839 238.900599  244.3.31.41 -> 41.177.98.98 TCP 129 em7-secom > 41302 [PSH, ACK] Seq=240 Ack=721 Win=49640 Len=71
747009 238.993764  244.3.31.41 -> 41.177.98.98 TCP 129 em7-secom > 41302 [PSH, ACK] Seq=311 Ack=917 Win=49640 Len=71
747214 239.060766  244.3.31.41 -> 41.177.98.98 TCP 128 em7-secom > 41302 [PSH, ACK] Seq=382 Ack=1112 Win=49640 Len=70
