28034  11.243835 244.3.185.119 -> 41.177.98.220 TCP 148 netobjects2 > ups-onlinet [PSH, ACK] Seq=1 Ack=1 Win=65535 Len=90
28124  11.294473 244.3.185.119 -> 41.177.98.220 TCP 64 netobjects2 > ups-onlinet [ACK] Seq=91 Ack=1659 Win=65535 Len=0
38535  15.944282 244.3.185.119 -> 41.177.98.220 TCP 132 netobjects2 > ups-onlinet [PSH, ACK] Seq=91 Ack=1659 Win=65535 Len=74
39169  16.206280 244.3.185.119 -> 41.177.98.220 TCP 64 netobjects2 > ups-onlinet [ACK] Seq=165 Ack=2933 Win=64261 Len=0
60772  24.659743 244.3.185.119 -> 41.177.98.220 TCP 136 netobjects2 > ups-onlinet [PSH, ACK] Seq=165 Ack=2933 Win=64261 Len=78
60774  24.664375 244.3.185.119 -> 41.177.98.220 TCP 133 netobjects2 > ups-onlinet [PSH, ACK] Seq=243 Ack=3065 Win=65535 Len=75
60895  24.763328 244.3.185.119 -> 41.177.98.220 TCP 130 netobjects2 > ups-onlinet [PSH, ACK] Seq=318 Ack=3560 Win=65040 Len=72
61144  24.956434 244.3.185.119 -> 41.177.98.220 TCP 64 netobjects2 > ups-onlinet [ACK] Seq=390 Ack=3856 Win=64744 Len=0
63934  26.395780 244.3.185.119 -> 41.177.98.220 TCP 133 netobjects2 > ups-onlinet [PSH, ACK] Seq=390 Ack=3856 Win=64744 Len=75
64343  26.561669 244.3.185.119 -> 41.177.98.220 TCP 128 netobjects2 > ups-onlinet [PSH, ACK] Seq=465 Ack=4290 Win=64310 Len=70
64429  26.609833 244.3.185.119 -> 41.177.98.220 TCP 130 netobjects2 > ups-onlinet [PSH, ACK] Seq=535 Ack=4724 Win=65535 Len=72
64998  26.815281 244.3.185.119 -> 41.177.98.220 TCP 131 netobjects2 > ups-onlinet [PSH, ACK] Seq=607 Ack=5020 Win=65239 Len=73
65562  27.034600 244.3.185.119 -> 41.177.98.220 TCP 64 netobjects2 > ups-onlinet [ACK] Seq=680 Ack=5103 Win=65156 Len=0
68175  28.059780 244.3.185.119 -> 41.177.98.220 TCP 130 netobjects2 > ups-onlinet [PSH, ACK] Seq=680 Ack=5103 Win=65156 Len=72
68199  28.068768 244.3.185.119 -> 41.177.98.220 TCP 123 netobjects2 > ups-onlinet [PSH, ACK] Seq=752 Ack=5224 Win=65035 Len=65
68481  28.237744 244.3.185.119 -> 41.177.98.220 TCP 64 netobjects2 > ups-onlinet [ACK] Seq=817 Ack=5865 Win=64394 Len=0
228255  78.336900 244.3.185.119 -> 41.177.98.220 TCP 132 netobjects2 > ups-onlinet [PSH, ACK] Seq=817 Ack=5865 Win=64394 Len=74
228454  78.409375 244.3.185.119 -> 41.177.98.220 TCP 64 netobjects2 > ups-onlinet [ACK] Seq=891 Ack=7687 Win=65535 Len=0
381885 127.137424 244.3.185.119 -> 41.177.98.220 TCP 132 netobjects2 > ups-onlinet [PSH, ACK] Seq=891 Ack=7687 Win=65535 Len=74
381970 127.198597 244.3.185.119 -> 41.177.98.220 TCP 64 netobjects2 > ups-onlinet [ACK] Seq=965 Ack=9236 Win=65535 Len=0
453818 148.013006 244.3.185.119 -> 41.177.98.220 TCP 136 netobjects2 > ups-onlinet [PSH, ACK] Seq=965 Ack=9236 Win=65535 Len=78
453839 148.032544 244.3.185.119 -> 41.177.98.220 TCP 133 netobjects2 > ups-onlinet [PSH, ACK] Seq=1043 Ack=9367 Win=65404 Len=75
454057 148.130992 244.3.185.119 -> 41.177.98.220 TCP 130 netobjects2 > ups-onlinet [PSH, ACK] Seq=1118 Ack=9881 Win=64890 Len=72
454456 148.333679 244.3.185.119 -> 41.177.98.220 TCP 64 netobjects2 > ups-onlinet [ACK] Seq=1190 Ack=10170 Win=64601 Len=0
480290 158.341117 244.3.185.119 -> 41.177.98.220 TCP 133 netobjects2 > ups-onlinet [PSH, ACK] Seq=1190 Ack=10170 Win=64601 Len=75
480396 158.382976 244.3.185.119 -> 41.177.98.220 TCP 128 netobjects2 > ups-onlinet [PSH, ACK] Seq=1265 Ack=10629 Win=65535 Len=70
480430 158.422279 244.3.185.119 -> 41.177.98.220 TCP 130 netobjects2 > ups-onlinet [PSH, ACK] Seq=1335 Ack=11088 Win=65076 Len=72
481153 158.615104 244.3.185.119 -> 41.177.98.220 TCP 64 netobjects2 > ups-onlinet [ACK] Seq=1407 Ack=11377 Win=64787 Len=0
481187 158.626325 244.3.185.119 -> 41.177.98.220 TCP 131 netobjects2 > ups-onlinet [PSH, ACK] Seq=1407 Ack=11377 Win=64787 Len=73
481848 158.833868 244.3.185.119 -> 41.177.98.220 TCP 64 netobjects2 > ups-onlinet [ACK] Seq=1480 Ack=11460 Win=64704 Len=0
484255 159.725091 244.3.185.119 -> 41.177.98.220 TCP 130 netobjects2 > ups-onlinet [PSH, ACK] Seq=1480 Ack=11460 Win=64704 Len=72
484309 159.733355 244.3.185.119 -> 41.177.98.220 TCP 123 netobjects2 > ups-onlinet [PSH, ACK] Seq=1552 Ack=11577 Win=64587 Len=65
485435 159.927638 244.3.185.119 -> 41.177.98.220 TCP 64 netobjects2 > ups-onlinet [ACK] Seq=1617 Ack=12218 Win=65535 Len=0
603324 191.413755 244.3.185.119 -> 41.177.98.220 TCP 148 netobjects2 > ups-onlinet [PSH, ACK] Seq=1617 Ack=12218 Win=65535 Len=90
603795 191.616730 244.3.185.119 -> 41.177.98.220 TCP 64 netobjects2 > ups-onlinet [ACK] Seq=1707 Ack=12398 Win=65355 Len=0
684864 214.933968 244.3.185.119 -> 41.177.98.220 TCP 148 netobjects2 > ups-onlinet [PSH, ACK] Seq=1707 Ack=12398 Win=65355 Len=90
684977 214.999027 244.3.185.119 -> 41.177.98.220 TCP 132 netobjects2 > ups-onlinet [PSH, ACK] Seq=1797 Ack=12688 Win=65065 Len=74
685063 215.075692 244.3.185.119 -> 41.177.98.220 TCP 64 netobjects2 > ups-onlinet [ACK] Seq=1871 Ack=14636 Win=65535 Len=0
699572 221.877771 244.3.185.119 -> 41.177.98.220 TCP 136 netobjects2 > ups-onlinet [PSH, ACK] Seq=1871 Ack=14636 Win=65535 Len=78
699649 221.889245 244.3.185.119 -> 41.177.98.220 TCP 133 netobjects2 > ups-onlinet [PSH, ACK] Seq=1949 Ack=14768 Win=65403 Len=75
700004 222.011756 244.3.185.119 -> 41.177.98.220 TCP 130 netobjects2 > ups-onlinet [PSH, ACK] Seq=2024 Ack=15274 Win=64897 Len=72
700311 222.178762 244.3.185.119 -> 41.177.98.220 TCP 64 netobjects2 > ups-onlinet [ACK] Seq=2096 Ack=15540 Win=64631 Len=0
701824 223.053773 244.3.185.119 -> 41.177.98.220 TCP 133 netobjects2 > ups-onlinet [PSH, ACK] Seq=2096 Ack=15540 Win=64631 Len=75
702139 223.175002 244.3.185.119 -> 41.177.98.220 TCP 128 netobjects2 > ups-onlinet [PSH, ACK] Seq=2171 Ack=16005 Win=64166 Len=70
702281 223.223182 244.3.185.119 -> 41.177.98.220 TCP 130 netobjects2 > ups-onlinet [PSH, ACK] Seq=2241 Ack=16470 Win=65535 Len=72
702586 223.381908 244.3.185.119 -> 41.177.98.220 TCP 64 netobjects2 > ups-onlinet [ACK] Seq=2313 Ack=16736 Win=65269 Len=0
702717 223.429106 244.3.185.119 -> 41.177.98.220 TCP 131 netobjects2 > ups-onlinet [PSH, ACK] Seq=2313 Ack=16736 Win=65269 Len=73
703101 223.600679 244.3.185.119 -> 41.177.98.220 TCP 64 netobjects2 > ups-onlinet [ACK] Seq=2386 Ack=16819 Win=65186 Len=0
704583 224.229776 244.3.185.119 -> 41.177.98.220 TCP 130 netobjects2 > ups-onlinet [PSH, ACK] Seq=2386 Ack=16819 Win=65186 Len=72
704599 224.237801 244.3.185.119 -> 41.177.98.220 TCP 123 netobjects2 > ups-onlinet [PSH, ACK] Seq=2458 Ack=16940 Win=65065 Len=65
705020 224.366303 244.3.185.119 -> 41.177.98.220 TCP 64 netobjects2 > ups-onlinet [ACK] Seq=2523 Ack=17581 Win=64424 Len=0
758856 244.340951 244.3.185.119 -> 41.177.98.220 TCP 148 netobjects2 > ups-onlinet [PSH, ACK] Seq=2523 Ack=17581 Win=64424 Len=90
759017 244.469213 244.3.185.119 -> 41.177.98.220 TCP 64 netobjects2 > ups-onlinet [ACK] Seq=2613 Ack=17761 Win=64244 Len=0
979501 326.559102 244.3.185.119 -> 41.177.98.220 TCP 148 netobjects2 > ups-onlinet [PSH, ACK] Seq=2613 Ack=17761 Win=64244 Len=90
979742 326.728524 244.3.185.119 -> 41.177.98.220 TCP 64 netobjects2 > ups-onlinet [ACK] Seq=2703 Ack=17941 Win=65535 Len=0
