89077  34.393780 244.3.185.100 -> 41.177.98.220 TCP 131 sesi-lm > op-probe [PSH, ACK] Seq=1 Ack=1 Win=65087 Len=73
89112  34.398437 244.3.185.100 -> 41.177.98.220 TCP 168 sesi-lm > op-probe [PSH, ACK] Seq=74 Ack=109 Win=64979 Len=110
89130  34.405435 244.3.185.100 -> 41.177.98.220 TCP 178 sesi-lm > op-probe [PSH, ACK] Seq=184 Ack=231 Win=64857 Len=120
89208  34.448121 244.3.185.100 -> 41.177.98.220 TCP 178 sesi-lm > op-probe [PSH, ACK] Seq=304 Ack=528 Win=64560 Len=120
89298  34.486812 244.3.185.100 -> 41.177.98.220 TCP 129 sesi-lm > op-probe [PSH, ACK] Seq=424 Ack=825 Win=64263 Len=71
89353  34.499931 244.3.185.100 -> 41.177.98.220 TCP 163 sesi-lm > op-probe [PSH, ACK] Seq=495 Ack=908 Win=64180 Len=105
89723  34.618640 244.3.185.100 -> 41.177.98.220 TCP 64 sesi-lm > op-probe [ACK] Seq=600 Ack=1388 Win=65535 Len=0
183096  61.530140 244.3.185.100 -> 41.177.98.220 TCP 131 sesi-lm > op-probe [PSH, ACK] Seq=600 Ack=1388 Win=65535 Len=73
183180  61.556953 244.3.185.100 -> 41.177.98.220 TCP 248 sesi-lm > op-probe [PSH, ACK] Seq=673 Ack=1496 Win=65427 Len=190
183949  61.822264 244.3.185.100 -> 41.177.98.220 TCP 64 sesi-lm > op-probe [ACK] Seq=863 Ack=1829 Win=65094 Len=0
