334518 116.947065  244.3.31.46 -> 41.177.230.224 TCP 78 34105 > smtp [SYN] Seq=0 Win=5840 Len=0 MSS=1460 SACK_PERM=1 TSval=1061536202 TSecr=0 WS=4
334521 116.947599  244.3.31.46 -> 41.177.230.224 TCP 70 34105 > smtp [ACK] Seq=1 Ack=1 Win=5840 Len=0 TSval=1061536203 TSecr=3195985835
357422 121.979352  244.3.31.46 -> 41.177.230.224 TCP 70 34105 > smtp [ACK] Seq=1 Ack=101 Win=5840 Len=0 TSval=1061541234 TSecr=3195986338
357932 122.194553  244.3.31.46 -> 41.177.230.224 TCP 70 34105 > smtp [FIN, ACK] Seq=27283 Ack=535 Win=7984 Len=0 TSval=1061541450 TSecr=3195986359
357939 122.198342  244.3.31.46 -> 41.177.230.224 TCP 64 34105 > smtp [RST] Seq=27284 Win=0 Len=0
