6641   2.172524 244.3.77.218 -> 244.3.210.254 TCP 70 kazaa > 19813 [PSH, ACK] Seq=1 Ack=1 Win=64752 Len=12
117858  42.279343 244.3.77.218 -> 244.3.210.254 TCP 64 kazaa > 19813 [ACK] Seq=13 Ack=13 Win=64740 Len=0
237022  82.375776 244.3.77.218 -> 244.3.210.254 TCP 70 kazaa > 19813 [PSH, ACK] Seq=13 Ack=13 Win=64740 Len=12
359312 122.647808 244.3.77.218 -> 244.3.210.254 TCP 64 kazaa > 19813 [ACK] Seq=25 Ack=25 Win=64728 Len=0
491823 162.440535 244.3.77.218 -> 244.3.210.254 TCP 70 kazaa > 19813 [PSH, ACK] Seq=25 Ack=25 Win=64728 Len=12
644237 202.715539 244.3.77.218 -> 244.3.210.254 TCP 64 kazaa > 19813 [ACK] Seq=37 Ack=37 Win=64716 Len=0
754870 242.587270 244.3.77.218 -> 244.3.210.254 TCP 70 kazaa > 19813 [PSH, ACK] Seq=37 Ack=37 Win=64716 Len=12
855522 282.789033 244.3.77.218 -> 244.3.210.254 TCP 64 kazaa > 19813 [ACK] Seq=49 Ack=49 Win=64704 Len=0
969025 322.724352 244.3.77.218 -> 244.3.210.254 TCP 70 kazaa > 19813 [PSH, ACK] Seq=49 Ack=49 Win=64704 Len=12
