947719 314.504603 252.110.41.194 -> 41.177.26.91 TCP 66 ms-sql-s > http [SYN] Seq=0 Win=16384 Len=0 MSS=1460 SACK_PERM=1
948786 314.688689 252.110.41.194 -> 41.177.26.91 TCP 64 ms-sql-s > http [ACK] Seq=1 Ack=1 Win=17520 Len=0
949982 315.022255 252.110.41.194 -> 41.177.26.91 TCP 64 ms-sql-s > http [ACK] Seq=803 Ack=2921 Win=17520 Len=0
950388 315.188178 252.110.41.194 -> 41.177.26.91 TCP 64 ms-sql-s > http [ACK] Seq=803 Ack=4381 Win=17520 Len=0
950543 315.255171 252.110.41.194 -> 41.177.26.91 TCP 64 ms-sql-s > http [ACK] Seq=803 Ack=7301 Win=17520 Len=0
950982 315.409019 252.110.41.194 -> 41.177.26.91 TCP 64 ms-sql-s > http [ACK] Seq=803 Ack=8761 Win=17520 Len=0
951104 315.455477 252.110.41.194 -> 41.177.26.91 TCP 64 ms-sql-s > http [ACK] Seq=803 Ack=11681 Win=17520 Len=0
951203 315.488113 252.110.41.194 -> 41.177.26.91 TCP 64 ms-sql-s > http [ACK] Seq=803 Ack=14601 Win=17520 Len=0
951760 315.648766 252.110.41.194 -> 41.177.26.91 TCP 64 ms-sql-s > http [ACK] Seq=803 Ack=16061 Win=17520 Len=0
951852 315.687888 252.110.41.194 -> 41.177.26.91 TCP 64 ms-sql-s > http [ACK] Seq=803 Ack=18981 Win=17520 Len=0
952058 315.755141 252.110.41.194 -> 41.177.26.91 TCP 64 ms-sql-s > http [ACK] Seq=803 Ack=21901 Win=14600 Len=0
952141 315.788631 252.110.41.194 -> 41.177.26.91 TCP 70 ms-sql-s > http [ACK] Seq=803 Ack=23361 Win=13140 Len=0 SLE=24821 SRE=24873
952239 315.801274 252.110.41.194 -> 41.177.26.91 TCP 64 ms-sql-s > http [ACK] Seq=803 Ack=24873 Win=11628 Len=0
952807 315.955186 252.110.41.194 -> 41.177.26.91 TCP 64 ms-sql-s > http [ACK] Seq=803 Ack=26333 Win=10168 Len=0
953037 316.028142 252.110.41.194 -> 41.177.26.91 TCP 64 ms-sql-s > http [ACK] Seq=803 Ack=29253 Win=7248 Len=0
953140 316.074966 252.110.41.194 -> 41.177.26.91 TCP 64 ms-sql-s > http [ACK] Seq=803 Ack=32173 Win=4328 Len=0
953388 316.151890 252.110.41.194 -> 41.177.26.91 TCP 64 ms-sql-s > http [ACK] Seq=803 Ack=35093 Win=1408 Len=0
958211 318.143086 252.110.41.194 -> 41.177.26.91 TCP 64 [TCP ZeroWindow] ms-sql-s > http [ACK] Seq=803 Ack=36501 Win=0 Len=0
961234 319.368079 252.110.41.194 -> 41.177.26.91 TCP 64 [TCP ZeroWindowProbeAck] [TCP ZeroWindow] ms-sql-s > http [ACK] Seq=803 Ack=36501 Win=0 Len=0
964066 320.763384 252.110.41.194 -> 41.177.26.91 TCP 64 [TCP ZeroWindowProbeAck] [TCP ZeroWindow] ms-sql-s > http [ACK] Seq=803 Ack=36501 Win=0 Len=0
970438 323.548882 252.110.41.194 -> 41.177.26.91 TCP 64 [TCP ZeroWindowProbeAck] [TCP ZeroWindow] ms-sql-s > http [ACK] Seq=803 Ack=36501 Win=0 Len=0
