807950 263.760232 253.213.108.139 -> 253.37.253.43 TCP 64 printer > cisco-sccp [SYN, ACK] Seq=0 Ack=1 Win=3072 Len=0 MSS=1380
807951 263.760236 253.213.108.139 -> 253.37.253.43 TCP 64 [TCP Out-Of-Order] printer > cisco-sccp [SYN, ACK] Seq=0 Ack=1 Win=3072 Len=0 MSS=1380
808187 263.780204 253.213.108.139 -> 253.37.253.43 TCP 64 printer > cisco-sccp [ACK] Seq=1 Ack=7 Win=3072 Len=0
808188 263.780209 253.213.108.139 -> 253.37.253.43 TCP 64 [TCP Dup ACK 808187#1] printer > cisco-sccp [ACK] Seq=1 Ack=7 Win=3072 Len=0
808191 263.780719 253.213.108.139 -> 253.37.253.43 TCP 64 [TCP Keep-Alive] printer > cisco-sccp [PSH, ACK] Seq=1 Ack=7 Win=3072 Len=1
808201 263.782876 253.213.108.139 -> 253.37.253.43 TCP 64 printer > cisco-sccp [ACK] Seq=2 Ack=30 Win=3072 Len=0
808202 263.782881 253.213.108.139 -> 253.37.253.43 TCP 64 [TCP Dup ACK 808201#1] printer > cisco-sccp [ACK] Seq=2 Ack=30 Win=3072 Len=0
808205 263.783418 253.213.108.139 -> 253.37.253.43 TCP 64 [TCP Keep-Alive] printer > cisco-sccp [PSH, ACK] Seq=2 Ack=30 Win=3072 Len=1
808223 263.785911 253.213.108.139 -> 253.37.253.43 TCP 64 printer > cisco-sccp [ACK] Seq=3 Ack=110 Win=3072 Len=0
808224 263.785915 253.213.108.139 -> 253.37.253.43 TCP 64 [TCP Dup ACK 808223#1] printer > cisco-sccp [ACK] Seq=3 Ack=110 Win=3072 Len=0
808247 263.788181 253.213.108.139 -> 253.37.253.43 TCP 64 printer > cisco-sccp [ACK] Seq=3 Ack=111 Win=3072 Len=0
808248 263.788186 253.213.108.139 -> 253.37.253.43 TCP 64 [TCP Dup ACK 808247#1] printer > cisco-sccp [ACK] Seq=3 Ack=111 Win=3072 Len=0
808252 263.788529 253.213.108.139 -> 253.37.253.43 TCP 64 [TCP Keep-Alive] printer > cisco-sccp [PSH, ACK] Seq=3 Ack=111 Win=3072 Len=1
808259 263.790770 253.213.108.139 -> 253.37.253.43 TCP 64 printer > cisco-sccp [ACK] Seq=4 Ack=134 Win=3072 Len=0
808260 263.790774 253.213.108.139 -> 253.37.253.43 TCP 64 [TCP Dup ACK 808259#1] printer > cisco-sccp [ACK] Seq=4 Ack=134 Win=3072 Len=0
808263 263.791181 253.213.108.139 -> 253.37.253.43 TCP 64 [TCP Keep-Alive] printer > cisco-sccp [PSH, ACK] Seq=4 Ack=134 Win=3072 Len=1
808330 263.800228 253.213.108.139 -> 253.37.253.43 TCP 64 printer > cisco-sccp [ACK] Seq=5 Ack=1653 Win=23057 Len=0
808331 263.800232 253.213.108.139 -> 253.37.253.43 TCP 64 [TCP Dup ACK 808330#1] printer > cisco-sccp [ACK] Seq=5 Ack=1653 Win=23057 Len=0
808454 263.806674 253.213.108.139 -> 253.37.253.43 TCP 64 printer > cisco-sccp [ACK] Seq=5 Ack=1817 Win=24576 Len=0
808455 263.806678 253.213.108.139 -> 253.37.253.43 TCP 64 [TCP Dup ACK 808454#1] printer > cisco-sccp [ACK] Seq=5 Ack=1817 Win=24576 Len=0
808463 263.807064 253.213.108.139 -> 253.37.253.43 TCP 64 [TCP Keep-Alive] printer > cisco-sccp [PSH, ACK] Seq=5 Ack=1817 Win=24576 Len=1
808488 263.809324 253.213.108.139 -> 253.37.253.43 TCP 64 printer > cisco-sccp [ACK] Seq=6 Ack=1818 Win=24576 Len=0
808489 263.809329 253.213.108.139 -> 253.37.253.43 TCP 64 [TCP Dup ACK 808488#1] printer > cisco-sccp [ACK] Seq=6 Ack=1818 Win=24576 Len=0
808502 263.810303 253.213.108.139 -> 253.37.253.43 TCP 64 printer > cisco-sccp [FIN, ACK] Seq=6 Ack=1818 Win=24576 Len=0
808503 263.810308 253.213.108.139 -> 253.37.253.43 TCP 64 [TCP Out-Of-Order] printer > cisco-sccp [FIN, ACK] Seq=6 Ack=1818 Win=24576 Len=0
