878351 291.556566 253.180.253.142 -> 253.37.253.43 TCP 64 imtc-map > telnet [ACK] Seq=17 Ack=9 Win=64539 Len=0
878352 291.556570 253.180.253.142 -> 253.37.253.43 TCP 64 [TCP Dup ACK 878351#1] imtc-map > telnet [ACK] Seq=17 Ack=9 Win=64539 Len=0
878518 291.757732 253.180.253.142 -> 253.37.253.43 TCP 64 imtc-map > telnet [ACK] Seq=17 Ack=481 Win=64067 Len=0
878519 291.757737 253.180.253.142 -> 253.37.253.43 TCP 64 [TCP Dup ACK 878518#1] imtc-map > telnet [ACK] Seq=17 Ack=481 Win=64067 Len=0
890514 294.775481 253.180.253.142 -> 253.37.253.43 TCP 64 imtc-map > telnet [ACK] Seq=54 Ack=1658 Win=64860 Len=0
890515 294.775486 253.180.253.142 -> 253.37.253.43 TCP 64 [TCP Dup ACK 890514#1] imtc-map > telnet [ACK] Seq=54 Ack=1658 Win=64860 Len=0
894659 296.083192 253.180.253.142 -> 253.37.253.43 TCP 64 imtc-map > telnet [ACK] Seq=82 Ack=2343 Win=64175 Len=0
894660 296.083197 253.180.253.142 -> 253.37.253.43 TCP 64 [TCP Dup ACK 894659#1] imtc-map > telnet [ACK] Seq=82 Ack=2343 Win=64175 Len=0
896239 296.485543 253.180.253.142 -> 253.37.253.43 TCP 64 imtc-map > telnet [ACK] Seq=97 Ack=3171 Win=64860 Len=0
896240 296.485548 253.180.253.142 -> 253.37.253.43 TCP 64 [TCP Dup ACK 896239#1] imtc-map > telnet [ACK] Seq=97 Ack=3171 Win=64860 Len=0
912493 302.018108 253.180.253.142 -> 253.37.253.43 TCP 64 imtc-map > telnet [ACK] Seq=131 Ack=3968 Win=64063 Len=0
912494 302.018112 253.180.253.142 -> 253.37.253.43 TCP 64 [TCP Dup ACK 912493#1] imtc-map > telnet [ACK] Seq=131 Ack=3968 Win=64063 Len=0
915752 303.828713 253.180.253.142 -> 253.37.253.43 TCP 64 imtc-map > telnet [ACK] Seq=141 Ack=4775 Win=64860 Len=0
915753 303.828718 253.180.253.142 -> 253.37.253.43 TCP 64 [TCP Dup ACK 915752#1] imtc-map > telnet [ACK] Seq=141 Ack=4775 Win=64860 Len=0
920958 305.438221 253.180.253.142 -> 253.37.253.43 TCP 64 imtc-map > telnet [ACK] Seq=156 Ack=5381 Win=64254 Len=0
920959 305.438225 253.180.253.142 -> 253.37.253.43 TCP 64 [TCP Dup ACK 920958#1] imtc-map > telnet [ACK] Seq=156 Ack=5381 Win=64254 Len=0
975921 324.952996 253.180.253.142 -> 253.37.253.43 TCP 64 imtc-map > telnet [ACK] Seq=201 Ack=6282 Win=64860 Len=0
975922 324.953005 253.180.253.142 -> 253.37.253.43 TCP 64 [TCP Dup ACK 975921#1] imtc-map > telnet [ACK] Seq=201 Ack=6282 Win=64860 Len=0
995479 332.195583 253.180.253.142 -> 253.37.253.43 TCP 64 imtc-map > telnet [ACK] Seq=211 Ack=6972 Win=64170 Len=0
995480 332.195587 253.180.253.142 -> 253.37.253.43 TCP 64 [TCP Dup ACK 995479#1] imtc-map > telnet [ACK] Seq=211 Ack=6972 Win=64170 Len=0
996284 332.698540 253.180.253.142 -> 253.37.253.43 TCP 64 imtc-map > telnet [ACK] Seq=221 Ack=7671 Win=64860 Len=0
996285 332.698545 253.180.253.142 -> 253.37.253.43 TCP 64 [TCP Dup ACK 996284#1] imtc-map > telnet [ACK] Seq=221 Ack=7671 Win=64860 Len=0
997425 333.302103 253.180.253.142 -> 253.37.253.43 TCP 64 imtc-map > telnet [ACK] Seq=231 Ack=8270 Win=64261 Len=0
997426 333.302108 253.180.253.142 -> 253.37.253.43 TCP 64 [TCP Dup ACK 997425#1] imtc-map > telnet [ACK] Seq=231 Ack=8270 Win=64261 Len=0
999062 334.106820 253.180.253.142 -> 253.37.253.43 TCP 64 imtc-map > telnet [ACK] Seq=241 Ack=8861 Win=63670 Len=0
999063 334.106825 253.180.253.142 -> 253.37.253.43 TCP 64 [TCP Dup ACK 999062#1] imtc-map > telnet [ACK] Seq=241 Ack=8861 Win=63670 Len=0
999851 334.408621 253.180.253.142 -> 253.37.253.43 TCP 64 imtc-map > telnet [ACK] Seq=251 Ack=9456 Win=64860 Len=0
999852 334.408625 253.180.253.142 -> 253.37.253.43 TCP 64 [TCP Dup ACK 999851#1] imtc-map > telnet [ACK] Seq=251 Ack=9456 Win=64860 Len=0
1000600 334.810961 253.180.253.142 -> 253.37.253.43 TCP 64 imtc-map > telnet [ACK] Seq=261 Ack=10101 Win=64215 Len=0
1000601 334.810965 253.180.253.142 -> 253.37.253.43 TCP 64 [TCP Dup ACK 1000600#1] imtc-map > telnet [ACK] Seq=261 Ack=10101 Win=64215 Len=0
1001627 335.615679 253.180.253.142 -> 253.37.253.43 TCP 64 imtc-map > telnet [ACK] Seq=271 Ack=10774 Win=63542 Len=0
1001628 335.615685 253.180.253.142 -> 253.37.253.43 TCP 64 [TCP Dup ACK 1001627#1] imtc-map > telnet [ACK] Seq=271 Ack=10774 Win=63542 Len=0
1002267 335.917498 253.180.253.142 -> 253.37.253.43 TCP 64 imtc-map > telnet [ACK] Seq=281 Ack=11463 Win=64860 Len=0
1002268 335.917502 253.180.253.142 -> 253.37.253.43 TCP 64 [TCP Dup ACK 1002267#1] imtc-map > telnet [ACK] Seq=281 Ack=11463 Win=64860 Len=0
1003032 336.319907 253.180.253.142 -> 253.37.253.43 TCP 64 imtc-map > telnet [ACK] Seq=291 Ack=12142 Win=64181 Len=0
1003033 336.319911 253.180.253.142 -> 253.37.253.43 TCP 64 [TCP Dup ACK 1003032#1] imtc-map > telnet [ACK] Seq=291 Ack=12142 Win=64181 Len=0
1006638 337.124614 253.180.253.142 -> 253.37.253.43 TCP 64 imtc-map > telnet [ACK] Seq=301 Ack=12847 Win=64860 Len=0
1006639 337.124619 253.180.253.142 -> 253.37.253.43 TCP 64 [TCP Dup ACK 1006638#1] imtc-map > telnet [ACK] Seq=301 Ack=12847 Win=64860 Len=0
1008992 338.130498 253.180.253.142 -> 253.37.253.43 TCP 64 imtc-map > telnet [ACK] Seq=311 Ack=13526 Win=64181 Len=0
1008993 338.130503 253.180.253.142 -> 253.37.253.43 TCP 64 [TCP Dup ACK 1008992#1] imtc-map > telnet [ACK] Seq=311 Ack=13526 Win=64181 Len=0
1015802 341.852382 253.180.253.142 -> 253.37.253.43 TCP 64 imtc-map > telnet [ACK] Seq=321 Ack=14231 Win=64860 Len=0
1015803 341.852386 253.180.253.142 -> 253.37.253.43 TCP 64 [TCP Dup ACK 1015802#1] imtc-map > telnet [ACK] Seq=321 Ack=14231 Win=64860 Len=0
1016543 342.254737 253.180.253.142 -> 253.37.253.43 TCP 64 imtc-map > telnet [ACK] Seq=331 Ack=14952 Win=64139 Len=0
1016544 342.254741 253.180.253.142 -> 253.37.253.43 TCP 64 [TCP Dup ACK 1016543#1] imtc-map > telnet [ACK] Seq=331 Ack=14952 Win=64139 Len=0
1017001 342.556549 253.180.253.142 -> 253.37.253.43 TCP 64 imtc-map > telnet [ACK] Seq=341 Ack=15671 Win=64860 Len=0
1017002 342.556554 253.180.253.142 -> 253.37.253.43 TCP 64 [TCP Dup ACK 1017001#1] imtc-map > telnet [ACK] Seq=341 Ack=15671 Win=64860 Len=0
1017903 343.160086 253.180.253.142 -> 253.37.253.43 TCP 64 imtc-map > telnet [ACK] Seq=351 Ack=16448 Win=64083 Len=0
1017904 343.160091 253.180.253.142 -> 253.37.253.43 TCP 64 [TCP Dup ACK 1017903#1] imtc-map > telnet [ACK] Seq=351 Ack=16448 Win=64083 Len=0
1018835 343.562457 253.180.253.142 -> 253.37.253.43 TCP 64 imtc-map > telnet [ACK] Seq=361 Ack=17241 Win=64860 Len=0
1018836 343.562462 253.180.253.142 -> 253.37.253.43 TCP 64 [TCP Dup ACK 1018835#1] imtc-map > telnet [ACK] Seq=361 Ack=17241 Win=64860 Len=0
1019517 343.864202 253.180.253.142 -> 253.37.253.43 TCP 64 imtc-map > telnet [ACK] Seq=371 Ack=17992 Win=64109 Len=0
1019518 343.864206 253.180.253.142 -> 253.37.253.43 TCP 64 [TCP Dup ACK 1019517#1] imtc-map > telnet [ACK] Seq=371 Ack=17992 Win=64109 Len=0
1020154 344.165994 253.180.253.142 -> 253.37.253.43 TCP 64 imtc-map > telnet [ACK] Seq=381 Ack=18691 Win=64860 Len=0
1020155 344.165998 253.180.253.142 -> 253.37.253.43 TCP 64 [TCP Dup ACK 1020154#1] imtc-map > telnet [ACK] Seq=381 Ack=18691 Win=64860 Len=0
1021692 344.970676 253.180.253.142 -> 253.37.253.43 TCP 64 imtc-map > telnet [ACK] Seq=391 Ack=19442 Win=64109 Len=0
1021693 344.970681 253.180.253.142 -> 253.37.253.43 TCP 64 [TCP Dup ACK 1021692#1] imtc-map > telnet [ACK] Seq=391 Ack=19442 Win=64109 Len=0
