908748 299.929534 253.37.253.121 -> 253.160.108.127 TCP 64 sns-admin > http [RST, ACK] Seq=1 Ack=1 Win=0 Len=0
923700 306.937302 253.37.253.121 -> 253.160.108.127 TCP 66 simslink > http [SYN] Seq=0 Win=65535 Len=0 MSS=1460 SACK_PERM=1
923715 306.938894 253.37.253.121 -> 253.160.108.127 TCP 64 simslink > http [ACK] Seq=1 Ack=1 Win=65535 Len=0
923729 306.941369 253.37.253.121 -> 253.160.108.127 TCP 64 simslink > http [ACK] Seq=842 Ack=1810 Win=65535 Len=0
923759 306.960690 253.37.253.121 -> 253.160.108.127 TCP 64 simslink > http [RST, ACK] Seq=842 Ack=1810 Win=0 Len=0
927349 309.070468 253.37.253.121 -> 253.160.108.127 TCP 66 gadgetgate1way > http [SYN] Seq=0 Win=65535 Len=0 MSS=1460 SACK_PERM=1
927389 309.072067 253.37.253.121 -> 253.160.108.127 TCP 64 gadgetgate1way > http [ACK] Seq=1 Ack=1 Win=65535 Len=0
