32656  13.839038 253.37.253.251 -> 253.37.253.254 TCP 64 pvuniwien > 1024 [ACK] Seq=1 Ack=3 Win=65062 Len=0
82960  32.277512 253.37.253.251 -> 253.160.108.127 TCP 64 corel-vncadmin > http [RST, ACK] Seq=1 Ack=1 Win=0 Len=0
109455  39.283265 253.37.253.251 -> 253.160.108.127 TCP 66 firstcall42 > http [SYN] Seq=0 Win=65535 Len=0 MSS=1460 SACK_PERM=1
109475  39.284847 253.37.253.251 -> 253.160.108.127 TCP 64 firstcall42 > http [ACK] Seq=1 Ack=1 Win=65535 Len=0
109488  39.287270 253.37.253.251 -> 253.160.108.127 TCP 70 firstcall42 > http [ACK] Seq=842 Ack=1381 Win=65535 Len=0 SLE=1809 SRE=1810
109489  39.287301 253.37.253.251 -> 253.160.108.127 TCP 64 firstcall42 > http [ACK] Seq=842 Ack=1810 Win=65107 Len=0
109574  39.308623 253.37.253.251 -> 253.160.108.127 TCP 64 firstcall42 > http [FIN, ACK] Seq=842 Ack=1810 Win=65107 Len=0
115912  41.355781 253.37.253.251 -> 253.160.108.127 TCP 66 ewnn > http [SYN] Seq=0 Win=65535 Len=0 MSS=1460 SACK_PERM=1
115926  41.357390 253.37.253.251 -> 253.160.108.127 TCP 64 ewnn > http [ACK] Seq=1 Ack=1 Win=65535 Len=0
215277  73.887305 253.37.253.251 -> 253.37.253.254 TCP 64 pvuniwien > 1024 [ACK] Seq=1 Ack=5 Win=65060 Len=0
296040  99.919157 253.37.253.251 -> 253.37.253.254 TCP 64 pvuniwien > 1024 [ACK] Seq=1 Ack=1457 Win=65535 Len=0
296058  99.924789 253.37.253.251 -> 253.37.253.254 TCP 66 pvuniwien > 1024 [PSH, ACK] Seq=1 Ack=1814 Win=65178 Len=8
296127  99.946221 253.37.253.251 -> 253.37.253.254 TCP 66 pvuniwien > 1024 [PSH, ACK] Seq=9 Ack=1924 Win=65068 Len=8
537427 173.967752 253.37.253.251 -> 253.37.253.254 TCP 64 pvuniwien > 1024 [ACK] Seq=17 Ack=1926 Win=65066 Len=0
728967 234.016013 253.37.253.251 -> 253.37.253.254 TCP 64 pvuniwien > 1024 [ACK] Seq=17 Ack=1928 Win=65064 Len=0
885514 294.083430 253.37.253.251 -> 253.37.253.254 TCP 64 pvuniwien > 1024 [ACK] Seq=17 Ack=1930 Win=65062 Len=0
