778294 250.936942 253.98.108.244 -> 253.37.253.43 TCP 64 fjsv-gssagt > telnet [ACK] Seq=33 Ack=1479 Win=64860 Len=0
778295 250.936947 253.98.108.244 -> 253.37.253.43 TCP 64 [TCP Dup ACK 778294#1] fjsv-gssagt > telnet [ACK] Seq=33 Ack=1479 Win=64860 Len=0
779791 251.787450 253.98.108.244 -> 253.37.253.43 TCP 64 fjsv-gssagt > telnet [ACK] Seq=48 Ack=1976 Win=64363 Len=0
779792 251.787455 253.98.108.244 -> 253.37.253.43 TCP 64 [TCP Dup ACK 779791#1] fjsv-gssagt > telnet [ACK] Seq=48 Ack=1976 Win=64363 Len=0
781560 252.592183 253.98.108.244 -> 253.37.253.43 TCP 64 fjsv-gssagt > telnet [ACK] Seq=63 Ack=2669 Win=63670 Len=0
781561 252.592187 253.98.108.244 -> 253.37.253.43 TCP 64 [TCP Dup ACK 781560#1] fjsv-gssagt > telnet [ACK] Seq=63 Ack=2669 Win=63670 Len=0
782761 253.396928 253.98.108.244 -> 253.37.253.43 TCP 64 fjsv-gssagt > telnet [ACK] Seq=78 Ack=3308 Win=64860 Len=0
782762 253.396933 253.98.108.244 -> 253.37.253.43 TCP 64 [TCP Dup ACK 782761#1] fjsv-gssagt > telnet [ACK] Seq=78 Ack=3308 Win=64860 Len=0
798550 260.540464 253.98.108.244 -> 253.37.253.43 TCP 64 fjsv-gssagt > telnet [ACK] Seq=103 Ack=4768 Win=64860 Len=0
798551 260.540468 253.98.108.244 -> 253.37.253.43 TCP 64 [TCP Dup ACK 798550#1] fjsv-gssagt > telnet [ACK] Seq=103 Ack=4768 Win=64860 Len=0
