984635 328.764209 253.180.108.144 -> 253.37.253.43 TCP 64 syncserver > telnet [ACK] Seq=1 Ack=10 Win=64846 Len=0
984636 328.764213 253.180.108.144 -> 253.37.253.43 TCP 64 [TCP Dup ACK 984635#1] syncserver > telnet [ACK] Seq=1 Ack=10 Win=64846 Len=0
984656 328.765096 253.180.108.144 -> 253.37.253.43 TCP 64 syncserver > telnet [FIN, ACK] Seq=1 Ack=10 Win=64846 Len=0
984657 328.765101 253.180.108.144 -> 253.37.253.43 TCP 64 [TCP Out-Of-Order] syncserver > telnet [FIN, ACK] Seq=1 Ack=10 Win=64846 Len=0
985139 328.871139 253.180.108.144 -> 253.37.253.43 TCP 66 remoteware-un > telnet [SYN] Seq=0 Win=64512 Len=0 MSS=1380 SACK_PERM=1
985140 328.871144 253.180.108.144 -> 253.37.253.43 TCP 66 [TCP Out-Of-Order] remoteware-un > telnet [SYN] Seq=0 Win=64512 Len=0 MSS=1380 SACK_PERM=1
985155 328.872598 253.180.108.144 -> 253.37.253.43 TCP 64 remoteware-un > telnet [ACK] Seq=1 Ack=1 Win=64860 Len=0
985156 328.872603 253.180.108.144 -> 253.37.253.43 TCP 64 [TCP Dup ACK 985155#1] remoteware-un > telnet [ACK] Seq=1 Ack=1 Win=64860 Len=0
985640 329.088951 253.180.108.144 -> 253.37.253.43 TCP 64 remoteware-un > telnet [ACK] Seq=33 Ack=49 Win=64812 Len=0
985641 329.088955 253.180.108.144 -> 253.37.253.43 TCP 64 [TCP Dup ACK 985640#1] remoteware-un > telnet [ACK] Seq=33 Ack=49 Win=64812 Len=0
986546 329.290986 253.180.108.144 -> 253.37.253.43 TCP 64 remoteware-un > telnet [ACK] Seq=33 Ack=308 Win=64553 Len=0
986547 329.290991 253.180.108.144 -> 253.37.253.43 TCP 64 [TCP Dup ACK 986546#1] remoteware-un > telnet [ACK] Seq=33 Ack=308 Win=64553 Len=0
