412240 137.336482 253.213.108.79 -> 253.37.253.43 TCP 64 infoman > telnet [ACK] Seq=32 Ack=1050 Win=63808 Len=0
412241 137.336487 253.213.108.79 -> 253.37.253.43 TCP 64 [TCP Dup ACK 412240#1] infoman > telnet [ACK] Seq=32 Ack=1050 Win=63808 Len=0
425841 139.750576 253.213.108.79 -> 253.37.253.43 TCP 64 infoman > telnet [ACK] Seq=42 Ack=2340 Win=64860 Len=0
425842 139.750581 253.213.108.79 -> 253.37.253.43 TCP 64 [TCP Dup ACK 425841#1] infoman > telnet [ACK] Seq=42 Ack=2340 Win=64860 Len=0
429517 140.454698 253.213.108.79 -> 253.37.253.43 TCP 64 infoman > telnet [ACK] Seq=52 Ack=3459 Win=63741 Len=0
429518 140.454703 253.213.108.79 -> 253.37.253.43 TCP 64 [TCP Dup ACK 429517#1] infoman > telnet [ACK] Seq=52 Ack=3459 Win=63741 Len=0
454380 148.300482 253.213.108.79 -> 253.37.253.43 TCP 64 infoman > telnet [ACK] Seq=62 Ack=4430 Win=64860 Len=0
454381 148.300487 253.213.108.79 -> 253.37.253.43 TCP 64 [TCP Dup ACK 454380#1] infoman > telnet [ACK] Seq=62 Ack=4430 Win=64860 Len=0
456970 149.205770 253.213.108.79 -> 253.37.253.43 TCP 64 infoman > telnet [ACK] Seq=72 Ack=5509 Win=63781 Len=0
456971 149.205775 253.213.108.79 -> 253.37.253.43 TCP 64 [TCP Dup ACK 456970#1] infoman > telnet [ACK] Seq=72 Ack=5509 Win=63781 Len=0
538112 174.251959 253.213.108.79 -> 253.37.253.43 TCP 64 infoman > telnet [ACK] Seq=82 Ack=6799 Win=64860 Len=0
538113 174.251963 253.213.108.79 -> 253.37.253.43 TCP 64 [TCP Dup ACK 538112#1] infoman > telnet [ACK] Seq=82 Ack=6799 Win=64860 Len=0
539522 174.956106 253.213.108.79 -> 253.37.253.43 TCP 64 infoman > telnet [ACK] Seq=92 Ack=7952 Win=63707 Len=0
539523 174.956111 253.213.108.79 -> 253.37.253.43 TCP 64 [TCP Dup ACK 539522#1] infoman > telnet [ACK] Seq=92 Ack=7952 Win=63707 Len=0
554139 178.376061 253.213.108.79 -> 253.37.253.43 TCP 64 infoman > telnet [ACK] Seq=122 Ack=9122 Win=64860 Len=0
554140 178.376066 253.213.108.79 -> 253.37.253.43 TCP 64 [TCP Dup ACK 554139#1] infoman > telnet [ACK] Seq=122 Ack=9122 Win=64860 Len=0
691248 218.007425 253.213.108.79 -> 253.37.253.43 TCP 64 infoman > telnet [ACK] Seq=132 Ack=10171 Win=63811 Len=0
691249 218.007429 253.213.108.79 -> 253.37.253.43 TCP 64 [TCP Dup ACK 691248#1] infoman > telnet [ACK] Seq=132 Ack=10171 Win=63811 Len=0
691907 218.409766 253.213.108.79 -> 253.37.253.43 TCP 64 infoman > telnet [ACK] Seq=142 Ack=11034 Win=64860 Len=0
691908 218.409770 253.213.108.79 -> 253.37.253.43 TCP 64 [TCP Dup ACK 691907#1] infoman > telnet [ACK] Seq=142 Ack=11034 Win=64860 Len=0
700376 222.232066 253.213.108.79 -> 253.37.253.43 TCP 64 infoman > telnet [ACK] Seq=173 Ack=12017 Win=63877 Len=0
700377 222.232071 253.213.108.79 -> 253.37.253.43 TCP 64 [TCP Dup ACK 700376#1] infoman > telnet [ACK] Seq=173 Ack=12017 Win=63877 Len=0
705578 224.545616 253.213.108.79 -> 253.37.253.43 TCP 64 infoman > telnet [ACK] Seq=183 Ack=13303 Win=64860 Len=0
705579 224.545621 253.213.108.79 -> 253.37.253.43 TCP 64 [TCP Dup ACK 705578#1] infoman > telnet [ACK] Seq=183 Ack=13303 Win=64860 Len=0
706830 225.048540 253.213.108.79 -> 253.37.253.43 TCP 64 infoman > telnet [ACK] Seq=193 Ack=13991 Win=64172 Len=0
706831 225.048545 253.213.108.79 -> 253.37.253.43 TCP 64 [TCP Dup ACK 706830#1] infoman > telnet [ACK] Seq=193 Ack=13991 Win=64172 Len=0
709848 226.155009 253.213.108.79 -> 253.37.253.43 TCP 64 infoman > telnet [ACK] Seq=203 Ack=14994 Win=64860 Len=0
709849 226.155013 253.213.108.79 -> 253.37.253.43 TCP 64 [TCP Dup ACK 709848#1] infoman > telnet [ACK] Seq=203 Ack=14994 Win=64860 Len=0
715605 228.367919 253.213.108.79 -> 253.37.253.43 TCP 64 infoman > telnet [ACK] Seq=213 Ack=15914 Win=63940 Len=0
715606 228.367924 253.213.108.79 -> 253.37.253.43 TCP 64 [TCP Dup ACK 715605#1] infoman > telnet [ACK] Seq=213 Ack=15914 Win=63940 Len=0
736381 235.409034 253.213.108.79 -> 253.37.253.43 TCP 64 infoman > telnet [ACK] Seq=223 Ack=16903 Win=64860 Len=0
736382 235.409039 253.213.108.79 -> 253.37.253.43 TCP 64 [TCP Dup ACK 736381#1] infoman > telnet [ACK] Seq=223 Ack=16903 Win=64860 Len=0
740257 236.314313 253.213.108.79 -> 253.37.253.43 TCP 64 infoman > telnet [ACK] Seq=233 Ack=17919 Win=63844 Len=0
740258 236.314318 253.213.108.79 -> 253.37.253.43 TCP 64 [TCP Dup ACK 740257#1] infoman > telnet [ACK] Seq=233 Ack=17919 Win=63844 Len=0
762358 245.970675 253.213.108.79 -> 253.37.253.43 TCP 64 infoman > telnet [ACK] Seq=243 Ack=19185 Win=64860 Len=0
762359 245.970680 253.213.108.79 -> 253.37.253.43 TCP 64 [TCP Dup ACK 762358#1] infoman > telnet [ACK] Seq=243 Ack=19185 Win=64860 Len=0
765815 247.479484 253.213.108.79 -> 253.37.253.43 TCP 64 infoman > telnet [ACK] Seq=253 Ack=20518 Win=63527 Len=0
765816 247.479488 253.213.108.79 -> 253.37.253.43 TCP 64 [TCP Dup ACK 765815#1] infoman > telnet [ACK] Seq=253 Ack=20518 Win=63527 Len=0
769644 249.088996 253.213.108.79 -> 253.37.253.43 TCP 64 infoman > telnet [ACK] Seq=271 Ack=21748 Win=64860 Len=0
769645 249.089001 253.213.108.79 -> 253.37.253.43 TCP 64 [TCP Dup ACK 769644#1] infoman > telnet [ACK] Seq=271 Ack=21748 Win=64860 Len=0
840345 275.543330 253.213.108.79 -> 253.37.253.43 TCP 64 infoman > telnet [ACK] Seq=281 Ack=23014 Win=63594 Len=0
840346 275.543335 253.213.108.79 -> 253.37.253.43 TCP 64 [TCP Dup ACK 840345#1] infoman > telnet [ACK] Seq=281 Ack=23014 Win=63594 Len=0
1021248 344.647754 253.213.108.79 -> 253.37.253.43 TCP 64 infoman > telnet [ACK] Seq=291 Ack=24347 Win=64860 Len=0
1021249 344.647758 253.213.108.79 -> 253.37.253.43 TCP 64 [TCP Dup ACK 1021248#1] infoman > telnet [ACK] Seq=291 Ack=24347 Win=64860 Len=0
