537438 173.976300 253.142.253.210 -> 253.37.253.43 TCP 64 ldap-admin > telnet [ACK] Seq=21 Ack=10 Win=65526 Len=0
537439 173.976304 253.142.253.210 -> 253.37.253.43 TCP 64 [TCP Dup ACK 537438#1] ldap-admin > telnet [ACK] Seq=21 Ack=10 Win=65526 Len=0
537936 174.176912 253.142.253.210 -> 253.37.253.43 TCP 64 ldap-admin > telnet [ACK] Seq=21 Ack=1103 Win=64433 Len=0
537937 174.176917 253.142.253.210 -> 253.37.253.43 TCP 64 [TCP Dup ACK 537936#1] ldap-admin > telnet [ACK] Seq=21 Ack=1103 Win=64433 Len=0
539369 174.879170 253.142.253.210 -> 253.37.253.43 TCP 64 ldap-admin > telnet [ACK] Seq=36 Ack=1953 Win=65535 Len=0
539370 174.879175 253.142.253.210 -> 253.37.253.43 TCP 64 [TCP Dup ACK 539369#1] ldap-admin > telnet [ACK] Seq=36 Ack=1953 Win=65535 Len=0
540300 175.380740 253.142.253.210 -> 253.37.253.43 TCP 64 ldap-admin > telnet [ACK] Seq=51 Ack=2816 Win=64672 Len=0
540301 175.380745 253.142.253.210 -> 253.37.253.43 TCP 64 [TCP Dup ACK 540300#1] ldap-admin > telnet [ACK] Seq=51 Ack=2816 Win=64672 Len=0
581729 185.111670 253.142.253.210 -> 253.37.253.43 TCP 64 ldap-admin > telnet [ACK] Seq=78 Ack=3057 Win=64431 Len=0
581730 185.111675 253.142.253.210 -> 253.37.253.43 TCP 64 [TCP Dup ACK 581729#1] ldap-admin > telnet [ACK] Seq=78 Ack=3057 Win=64431 Len=0
582656 185.512941 253.142.253.210 -> 253.37.253.43 TCP 64 ldap-admin > telnet [ACK] Seq=88 Ack=3921 Win=65535 Len=0
582657 185.512946 253.142.253.210 -> 253.37.253.43 TCP 64 [TCP Dup ACK 582656#1] ldap-admin > telnet [ACK] Seq=88 Ack=3921 Win=65535 Len=0
584724 186.315490 253.142.253.210 -> 253.37.253.43 TCP 64 ldap-admin > telnet [ACK] Seq=96 Ack=3981 Win=65475 Len=0
584725 186.315494 253.142.253.210 -> 253.37.253.43 TCP 64 [TCP Dup ACK 584724#1] ldap-admin > telnet [ACK] Seq=96 Ack=3981 Win=65475 Len=0
588206 187.318661 253.142.253.210 -> 253.37.253.43 TCP 64 ldap-admin > telnet [ACK] Seq=96 Ack=5314 Win=65535 Len=0
588207 187.318666 253.142.253.210 -> 253.37.253.43 TCP 64 [TCP Dup ACK 588206#1] ldap-admin > telnet [ACK] Seq=96 Ack=5314 Win=65535 Len=0
