57201  23.423792 253.160.239.39 -> 253.37.253.167 TCP 64 ncube-lm > 55376 [ACK] Seq=1 Ack=406 Win=65535 Len=0
57458  23.493090 253.160.239.39 -> 253.37.253.167 TCP 407 ncube-lm > 55376 [PSH, ACK] Seq=1 Ack=406 Win=65535 Len=349
57485  23.494826 253.160.239.39 -> 253.37.253.167 TCP 160 ncube-lm > 55376 [PSH, ACK] Seq=350 Ack=427 Win=65535 Len=102
603319 191.404859 253.160.239.39 -> 253.37.253.167 TCP 68 ncube-lm > 47385 [PSH, ACK] Seq=1 Ack=1 Win=65535 Len=10
654627 204.930716 253.160.239.39 -> 253.37.253.167 TCP 68 ncube-lm > 43948 [PSH, ACK] Seq=1 Ack=1 Win=65535 Len=10
