32112  13.624869 253.37.253.254 -> 253.37.253.31 TCP 64 1024 > kvm-via-ip [PSH, ACK] Seq=1 Ack=1 Win=33396 Len=2
32113  13.624905 253.37.253.254 -> 253.37.253.251 TCP 64 1024 > pvuniwien [PSH, ACK] Seq=1 Ack=1 Win=33396 Len=2
214704  73.684544 253.37.253.254 -> 253.37.253.31 TCP 64 1024 > kvm-via-ip [PSH, ACK] Seq=3 Ack=1 Win=33396 Len=2
214705  73.684579 253.37.253.254 -> 253.37.253.251 TCP 64 1024 > pvuniwien [PSH, ACK] Seq=3 Ack=1 Win=33396 Len=2
295599  99.709244 253.37.253.254 -> 253.37.253.251 TCP 1510 1024 > pvuniwien [ACK] Seq=5 Ack=1 Win=33396 Len=1452
296057  99.924445 253.37.253.254 -> 253.37.253.251 TCP 415 1024 > pvuniwien [PSH, ACK] Seq=1457 Ack=1 Win=33396 Len=357
296120  99.944755 253.37.253.254 -> 253.37.253.251 TCP 168 1024 > pvuniwien [PSH, ACK] Seq=1814 Ack=9 Win=33396 Len=110
296183  99.974396 253.37.253.254 -> 253.37.253.251 TCP 64 1024 > pvuniwien [ACK] Seq=1924 Ack=17 Win=33396 Len=0
397639 133.744219 253.37.253.254 -> 253.37.253.31 TCP 64 1024 > kvm-via-ip [PSH, ACK] Seq=5 Ack=1 Win=33396 Len=2
536829 173.784006 253.37.253.254 -> 253.37.253.251 TCP 64 1024 > pvuniwien [PSH, ACK] Seq=1924 Ack=17 Win=33396 Len=2
610525 193.803900 253.37.253.254 -> 253.37.253.31 TCP 64 1024 > kvm-via-ip [PSH, ACK] Seq=7 Ack=1 Win=33396 Len=2
728555 233.843684 253.37.253.254 -> 253.37.253.251 TCP 64 1024 > pvuniwien [PSH, ACK] Seq=1926 Ack=17 Win=33396 Len=2
783842 253.863577 253.37.253.254 -> 253.37.253.31 TCP 64 1024 > kvm-via-ip [PSH, ACK] Seq=9 Ack=1 Win=33396 Len=2
885134 293.903363 253.37.253.254 -> 253.37.253.251 TCP 64 1024 > pvuniwien [PSH, ACK] Seq=1928 Ack=17 Win=33396 Len=2
945673 313.923262 253.37.253.254 -> 253.37.253.31 TCP 64 1024 > kvm-via-ip [PSH, ACK] Seq=11 Ack=1 Win=33396 Len=2
