396080 132.760625 253.160.251.85 -> 253.37.253.43 TCP 70 38778 > ddm-rdb [SYN] Seq=0 Win=65535 Len=0 MSS=1380 WS=2 SACK_PERM=1
396081 132.760630 253.160.251.85 -> 253.37.253.43 TCP 70 [TCP Out-Of-Order] 38778 > ddm-rdb [SYN] Seq=0 Win=65535 Len=0 MSS=1380 WS=2 SACK_PERM=1
396096 132.762185 253.160.251.85 -> 253.37.253.43 TCP 64 38778 > ddm-rdb [ACK] Seq=1 Ack=1 Win=65536 Len=0
396097 132.762189 253.160.251.85 -> 253.37.253.43 TCP 64 [TCP Dup ACK 396096#1] 38778 > ddm-rdb [ACK] Seq=1 Ack=1 Win=65536 Len=0
396098 132.762342 253.160.251.85 -> 253.37.253.43 TCP 533 38778 > ddm-rdb [PSH, ACK] Seq=1 Ack=1 Win=65536 Len=475
396099 132.762346 253.160.251.85 -> 253.37.253.43 TCP 533 [TCP Retransmission] 38778 > ddm-rdb [PSH, ACK] Seq=1 Ack=1 Win=65536 Len=475
396124 132.792718 253.160.251.85 -> 253.37.253.43 TCP 209 38778 > ddm-rdb [PSH, ACK] Seq=476 Ack=285 Win=65252 Len=151
396125 132.792723 253.160.251.85 -> 253.37.253.43 TCP 209 [TCP Retransmission] 38778 > ddm-rdb [PSH, ACK] Seq=476 Ack=285 Win=65252 Len=151
396137 132.798545 253.160.251.85 -> 253.37.253.43 TCP 68 38778 > ddm-rdb [PSH, ACK] Seq=627 Ack=766 Win=64770 Len=10
396138 132.798550 253.160.251.85 -> 253.37.253.43 TCP 68 [TCP Retransmission] 38778 > ddm-rdb [PSH, ACK] Seq=627 Ack=766 Win=64770 Len=10
396143 132.800549 253.160.251.85 -> 253.37.253.43 TCP 64 38778 > ddm-rdb [FIN, ACK] Seq=637 Ack=820 Win=64716 Len=0
396144 132.800554 253.160.251.85 -> 253.37.253.43 TCP 64 [TCP Out-Of-Order] 38778 > ddm-rdb [FIN, ACK] Seq=637 Ack=820 Win=64716 Len=0
396151 132.803003 253.160.251.85 -> 253.37.253.43 TCP 64 38778 > ddm-rdb [ACK] Seq=638 Ack=821 Win=64716 Len=0
396152 132.803007 253.160.251.85 -> 253.37.253.43 TCP 64 [TCP Dup ACK 396151#1] 38778 > ddm-rdb [ACK] Seq=638 Ack=821 Win=64716 Len=0
410674 137.010784 253.160.251.85 -> 253.37.253.43 TCP 70 38795 > ddm-rdb [SYN] Seq=0 Win=65535 Len=0 MSS=1380 WS=2 SACK_PERM=1
410675 137.010789 253.160.251.85 -> 253.37.253.43 TCP 70 [TCP Out-Of-Order] 38795 > ddm-rdb [SYN] Seq=0 Win=65535 Len=0 MSS=1380 WS=2 SACK_PERM=1
410685 137.014103 253.160.251.85 -> 253.37.253.43 TCP 64 38795 > ddm-rdb [ACK] Seq=1 Ack=1 Win=65536 Len=0
410686 137.014108 253.160.251.85 -> 253.37.253.43 TCP 64 [TCP Dup ACK 410685#1] 38795 > ddm-rdb [ACK] Seq=1 Ack=1 Win=65536 Len=0
410687 137.014267 253.160.251.85 -> 253.37.253.43 TCP 533 38795 > ddm-rdb [PSH, ACK] Seq=1 Ack=1 Win=65536 Len=475
410688 137.014272 253.160.251.85 -> 253.37.253.43 TCP 533 [TCP Retransmission] 38795 > ddm-rdb [PSH, ACK] Seq=1 Ack=1 Win=65536 Len=475
410807 137.051864 253.160.251.85 -> 253.37.253.43 TCP 209 38795 > ddm-rdb [PSH, ACK] Seq=476 Ack=285 Win=65252 Len=151
410808 137.051869 253.160.251.85 -> 253.37.253.43 TCP 209 [TCP Retransmission] 38795 > ddm-rdb [PSH, ACK] Seq=476 Ack=285 Win=65252 Len=151
410884 137.058460 253.160.251.85 -> 253.37.253.43 TCP 1438 38795 > ddm-rdb [ACK] Seq=627 Ack=766 Win=64770 Len=1380
410885 137.058464 253.160.251.85 -> 253.37.253.43 TCP 1438 [TCP Retransmission] 38795 > ddm-rdb [ACK] Seq=627 Ack=766 Win=64770 Len=1380
410886 137.058468 253.160.251.85 -> 253.37.253.43 TCP 505 38795 > ddm-rdb [PSH, ACK] Seq=2007 Ack=766 Win=64770 Len=447
410887 137.058472 253.160.251.85 -> 253.37.253.43 TCP 505 [TCP Retransmission] 38795 > ddm-rdb [PSH, ACK] Seq=2007 Ack=766 Win=64770 Len=447
411165 137.112353 253.160.251.85 -> 253.37.253.43 TCP 68 38795 > ddm-rdb [PSH, ACK] Seq=2454 Ack=1684 Win=65536 Len=10
411166 137.112358 253.160.251.85 -> 253.37.253.43 TCP 68 [TCP Retransmission] 38795 > ddm-rdb [PSH, ACK] Seq=2454 Ack=1684 Win=65536 Len=10
411174 137.115233 253.160.251.85 -> 253.37.253.43 TCP 64 38795 > ddm-rdb [FIN, ACK] Seq=2464 Ack=1738 Win=65482 Len=0
411175 137.115238 253.160.251.85 -> 253.37.253.43 TCP 64 [TCP Out-Of-Order] 38795 > ddm-rdb [FIN, ACK] Seq=2464 Ack=1738 Win=65482 Len=0
411186 137.117293 253.160.251.85 -> 253.37.253.43 TCP 64 38795 > ddm-rdb [ACK] Seq=2465 Ack=1739 Win=65482 Len=0
411187 137.117297 253.160.251.85 -> 253.37.253.43 TCP 64 [TCP Dup ACK 411186#1] 38795 > ddm-rdb [ACK] Seq=2465 Ack=1739 Win=65482 Len=0
415610 138.633421 253.160.251.85 -> 253.37.253.43 TCP 70 38810 > ddm-rdb [SYN] Seq=0 Win=65535 Len=0 MSS=1380 WS=2 SACK_PERM=1
415611 138.633427 253.160.251.85 -> 253.37.253.43 TCP 70 [TCP Out-Of-Order] 38810 > ddm-rdb [SYN] Seq=0 Win=65535 Len=0 MSS=1380 WS=2 SACK_PERM=1
415625 138.634955 253.160.251.85 -> 253.37.253.43 TCP 64 38810 > ddm-rdb [ACK] Seq=1 Ack=1 Win=65536 Len=0
415626 138.634960 253.160.251.85 -> 253.37.253.43 TCP 64 [TCP Dup ACK 415625#1] 38810 > ddm-rdb [ACK] Seq=1 Ack=1 Win=65536 Len=0
415628 138.635133 253.160.251.85 -> 253.37.253.43 TCP 533 38810 > ddm-rdb [PSH, ACK] Seq=1 Ack=1 Win=65536 Len=475
415629 138.635137 253.160.251.85 -> 253.37.253.43 TCP 533 [TCP Retransmission] 38810 > ddm-rdb [PSH, ACK] Seq=1 Ack=1 Win=65536 Len=475
415682 138.650084 253.160.251.85 -> 253.37.253.43 TCP 218 38810 > ddm-rdb [PSH, ACK] Seq=476 Ack=285 Win=65252 Len=160
415683 138.650088 253.160.251.85 -> 253.37.253.43 TCP 218 [TCP Retransmission] 38810 > ddm-rdb [PSH, ACK] Seq=476 Ack=285 Win=65252 Len=160
415705 138.654054 253.160.251.85 -> 253.37.253.43 TCP 181 38810 > ddm-rdb [PSH, ACK] Seq=636 Ack=337 Win=65200 Len=123
415706 138.654060 253.160.251.85 -> 253.37.253.43 TCP 181 [TCP Retransmission] 38810 > ddm-rdb [PSH, ACK] Seq=636 Ack=337 Win=65200 Len=123
415769 138.674454 253.160.251.85 -> 253.37.253.43 TCP 209 38810 > ddm-rdb [PSH, ACK] Seq=759 Ack=454 Win=65082 Len=151
415770 138.674459 253.160.251.85 -> 253.37.253.43 TCP 209 [TCP Retransmission] 38810 > ddm-rdb [PSH, ACK] Seq=759 Ack=454 Win=65082 Len=151
415909 138.690107 253.160.251.85 -> 253.37.253.43 TCP 64 38810 > ddm-rdb [ACK] Seq=910 Ack=3214 Win=65536 Len=0
415910 138.690113 253.160.251.85 -> 253.37.253.43 TCP 64 [TCP Dup ACK 415909#1] 38810 > ddm-rdb [ACK] Seq=910 Ack=3214 Win=65536 Len=0
415912 138.690342 253.160.251.85 -> 253.37.253.43 TCP 64 38810 > ddm-rdb [ACK] Seq=910 Ack=5974 Win=65536 Len=0
415913 138.690347 253.160.251.85 -> 253.37.253.43 TCP 64 [TCP Dup ACK 415912#1] 38810 > ddm-rdb [ACK] Seq=910 Ack=5974 Win=65536 Len=0
415920 138.690618 253.160.251.85 -> 253.37.253.43 TCP 64 38810 > ddm-rdb [ACK] Seq=910 Ack=8734 Win=65536 Len=0
415921 138.690622 253.160.251.85 -> 253.37.253.43 TCP 64 [TCP Dup ACK 415920#1] 38810 > ddm-rdb [ACK] Seq=910 Ack=8734 Win=65536 Len=0
415955 138.691937 253.160.251.85 -> 253.37.253.43 TCP 64 38810 > ddm-rdb [ACK] Seq=910 Ack=11494 Win=65536 Len=0
415956 138.691942 253.160.251.85 -> 253.37.253.43 TCP 64 [TCP Dup ACK 415955#1] 38810 > ddm-rdb [ACK] Seq=910 Ack=11494 Win=65536 Len=0
415958 138.692154 253.160.251.85 -> 253.37.253.43 TCP 64 38810 > ddm-rdb [ACK] Seq=910 Ack=14254 Win=65536 Len=0
415959 138.692160 253.160.251.85 -> 253.37.253.43 TCP 64 [TCP Dup ACK 415958#1] 38810 > ddm-rdb [ACK] Seq=910 Ack=14254 Win=65536 Len=0
415964 138.692376 253.160.251.85 -> 253.37.253.43 TCP 64 38810 > ddm-rdb [ACK] Seq=910 Ack=17014 Win=65536 Len=0
415965 138.692381 253.160.251.85 -> 253.37.253.43 TCP 64 [TCP Dup ACK 415964#1] 38810 > ddm-rdb [ACK] Seq=910 Ack=17014 Win=65536 Len=0
415974 138.692671 253.160.251.85 -> 253.37.253.43 TCP 64 38810 > ddm-rdb [ACK] Seq=910 Ack=19774 Win=65536 Len=0
415975 138.692675 253.160.251.85 -> 253.37.253.43 TCP 64 [TCP Dup ACK 415974#1] 38810 > ddm-rdb [ACK] Seq=910 Ack=19774 Win=65536 Len=0
415981 138.692900 253.160.251.85 -> 253.37.253.43 TCP 64 38810 > ddm-rdb [ACK] Seq=910 Ack=22534 Win=65536 Len=0
415983 138.692909 253.160.251.85 -> 253.37.253.43 TCP 64 [TCP Dup ACK 415981#1] 38810 > ddm-rdb [ACK] Seq=910 Ack=22534 Win=65536 Len=0
415996 138.693854 253.160.251.85 -> 253.37.253.43 TCP 64 38810 > ddm-rdb [ACK] Seq=910 Ack=25294 Win=65536 Len=0
415997 138.693859 253.160.251.85 -> 253.37.253.43 TCP 64 [TCP Dup ACK 415996#1] 38810 > ddm-rdb [ACK] Seq=910 Ack=25294 Win=65536 Len=0
415999 138.694094 253.160.251.85 -> 253.37.253.43 TCP 64 38810 > ddm-rdb [ACK] Seq=910 Ack=28054 Win=65536 Len=0
416000 138.694099 253.160.251.85 -> 253.37.253.43 TCP 64 [TCP Dup ACK 415999#1] 38810 > ddm-rdb [ACK] Seq=910 Ack=28054 Win=65536 Len=0
416004 138.694350 253.160.251.85 -> 253.37.253.43 TCP 64 38810 > ddm-rdb [ACK] Seq=910 Ack=30814 Win=65536 Len=0
416005 138.694354 253.160.251.85 -> 253.37.253.43 TCP 64 [TCP Dup ACK 416004#1] 38810 > ddm-rdb [ACK] Seq=910 Ack=30814 Win=65536 Len=0
416008 138.696453 253.160.251.85 -> 253.37.253.43 TCP 64 38810 > ddm-rdb [ACK] Seq=910 Ack=32230 Win=65536 Len=0
416009 138.696458 253.160.251.85 -> 253.37.253.43 TCP 64 [TCP Dup ACK 416008#1] 38810 > ddm-rdb [ACK] Seq=910 Ack=32230 Win=65536 Len=0
416176 138.728364 253.160.251.85 -> 253.37.253.43 TCP 1438 38810 > ddm-rdb [ACK] Seq=910 Ack=32230 Win=65536 Len=1380
416177 138.728368 253.160.251.85 -> 253.37.253.43 TCP 1438 [TCP Retransmission] 38810 > ddm-rdb [ACK] Seq=910 Ack=32230 Win=65536 Len=1380
416178 138.728372 253.160.251.85 -> 253.37.253.43 TCP 505 38810 > ddm-rdb [PSH, ACK] Seq=2290 Ack=32230 Win=65536 Len=447
416180 138.728380 253.160.251.85 -> 253.37.253.43 TCP 505 [TCP Retransmission] 38810 > ddm-rdb [PSH, ACK] Seq=2290 Ack=32230 Win=65536 Len=447
416593 138.790661 253.160.251.85 -> 253.37.253.43 TCP 64 38810 > ddm-rdb [ACK] Seq=2737 Ack=34990 Win=65536 Len=0
416594 138.790665 253.160.251.85 -> 253.37.253.43 TCP 64 [TCP Dup ACK 416593#1] 38810 > ddm-rdb [ACK] Seq=2737 Ack=34990 Win=65536 Len=0
416598 138.790904 253.160.251.85 -> 253.37.253.43 TCP 64 38810 > ddm-rdb [ACK] Seq=2737 Ack=37750 Win=65536 Len=0
416599 138.790908 253.160.251.85 -> 253.37.253.43 TCP 64 [TCP Dup ACK 416598#1] 38810 > ddm-rdb [ACK] Seq=2737 Ack=37750 Win=65536 Len=0
416605 138.791085 253.160.251.85 -> 253.37.253.43 TCP 64 38810 > ddm-rdb [ACK] Seq=2737 Ack=40510 Win=65536 Len=0
416606 138.791090 253.160.251.85 -> 253.37.253.43 TCP 64 [TCP Dup ACK 416605#1] 38810 > ddm-rdb [ACK] Seq=2737 Ack=40510 Win=65536 Len=0
416614 138.791330 253.160.251.85 -> 253.37.253.43 TCP 64 38810 > ddm-rdb [ACK] Seq=2737 Ack=43270 Win=65536 Len=0
416615 138.791334 253.160.251.85 -> 253.37.253.43 TCP 64 [TCP Dup ACK 416614#1] 38810 > ddm-rdb [ACK] Seq=2737 Ack=43270 Win=65536 Len=0
416628 138.791576 253.160.251.85 -> 253.37.253.43 TCP 64 38810 > ddm-rdb [ACK] Seq=2737 Ack=46030 Win=65536 Len=0
416629 138.791580 253.160.251.85 -> 253.37.253.43 TCP 64 [TCP Dup ACK 416628#1] 38810 > ddm-rdb [ACK] Seq=2737 Ack=46030 Win=65536 Len=0
416639 138.791815 253.160.251.85 -> 253.37.253.43 TCP 64 38810 > ddm-rdb [ACK] Seq=2737 Ack=48790 Win=65536 Len=0
416640 138.791820 253.160.251.85 -> 253.37.253.43 TCP 64 [TCP Dup ACK 416639#1] 38810 > ddm-rdb [ACK] Seq=2737 Ack=48790 Win=65536 Len=0
416646 138.792045 253.160.251.85 -> 253.37.253.43 TCP 64 38810 > ddm-rdb [ACK] Seq=2737 Ack=51550 Win=65536 Len=0
416647 138.792050 253.160.251.85 -> 253.37.253.43 TCP 64 [TCP Dup ACK 416646#1] 38810 > ddm-rdb [ACK] Seq=2737 Ack=51550 Win=65536 Len=0
416652 138.792342 253.160.251.85 -> 253.37.253.43 TCP 64 38810 > ddm-rdb [ACK] Seq=2737 Ack=54310 Win=65536 Len=0
416653 138.792347 253.160.251.85 -> 253.37.253.43 TCP 64 [TCP Dup ACK 416652#1] 38810 > ddm-rdb [ACK] Seq=2737 Ack=54310 Win=65536 Len=0
416656 138.792559 253.160.251.85 -> 253.37.253.43 TCP 64 38810 > ddm-rdb [ACK] Seq=2737 Ack=57070 Win=65536 Len=0
416657 138.792563 253.160.251.85 -> 253.37.253.43 TCP 64 [TCP Dup ACK 416656#1] 38810 > ddm-rdb [ACK] Seq=2737 Ack=57070 Win=65536 Len=0
416662 138.792748 253.160.251.85 -> 253.37.253.43 TCP 64 38810 > ddm-rdb [ACK] Seq=2737 Ack=59830 Win=65536 Len=0
416663 138.792752 253.160.251.85 -> 253.37.253.43 TCP 64 [TCP Dup ACK 416662#1] 38810 > ddm-rdb [ACK] Seq=2737 Ack=59830 Win=65536 Len=0
416668 138.793048 253.160.251.85 -> 253.37.253.43 TCP 64 38810 > ddm-rdb [ACK] Seq=2737 Ack=62590 Win=65536 Len=0
416669 138.793052 253.160.251.85 -> 253.37.253.43 TCP 64 [TCP Dup ACK 416668#1] 38810 > ddm-rdb [ACK] Seq=2737 Ack=62590 Win=65536 Len=0
416675 138.793633 253.160.251.85 -> 253.37.253.43 TCP 64 38810 > ddm-rdb [ACK] Seq=2737 Ack=65316 Win=65216 Len=0
416676 138.793638 253.160.251.85 -> 253.37.253.43 TCP 64 [TCP Dup ACK 416675#1] 38810 > ddm-rdb [ACK] Seq=2737 Ack=65316 Win=65216 Len=0
416677 138.793642 253.160.251.85 -> 253.37.253.43 TCP 64 [TCP Dup ACK 416675#2] 38810 > ddm-rdb [ACK] Seq=2737 Ack=65316 Win=65216 Len=0
416678 138.793646 253.160.251.85 -> 253.37.253.43 TCP 64 [TCP Dup ACK 416675#3] 38810 > ddm-rdb [ACK] Seq=2737 Ack=65316 Win=65216 Len=0
416688 138.794802 253.160.251.85 -> 253.37.253.43 TCP 156 38810 > ddm-rdb [PSH, ACK] Seq=2737 Ack=65316 Win=65216 Len=98
416689 138.794807 253.160.251.85 -> 253.37.253.43 TCP 156 [TCP Retransmission] 38810 > ddm-rdb [PSH, ACK] Seq=2737 Ack=65316 Win=65216 Len=98
416758 138.800028 253.160.251.85 -> 253.37.253.43 TCP 64 38810 > ddm-rdb [ACK] Seq=2835 Ack=73596 Win=65536 Len=0
416759 138.800033 253.160.251.85 -> 253.37.253.43 TCP 64 [TCP Dup ACK 416758#1] 38810 > ddm-rdb [ACK] Seq=2835 Ack=73596 Win=65536 Len=0
416768 138.801323 253.160.251.85 -> 253.37.253.43 TCP 64 38810 > ddm-rdb [ACK] Seq=2835 Ack=78734 Win=65536 Len=0
416769 138.801327 253.160.251.85 -> 253.37.253.43 TCP 64 [TCP Dup ACK 416768#1] 38810 > ddm-rdb [ACK] Seq=2835 Ack=78734 Win=65536 Len=0
416791 138.804355 253.160.251.85 -> 253.37.253.43 TCP 1438 38810 > ddm-rdb [ACK] Seq=2835 Ack=78734 Win=65536 Len=1380
416792 138.804358 253.160.251.85 -> 253.37.253.43 TCP 1438 [TCP Retransmission] 38810 > ddm-rdb [ACK] Seq=2835 Ack=78734 Win=65536 Len=1380
416793 138.804362 253.160.251.85 -> 253.37.253.43 TCP 496 38810 > ddm-rdb [PSH, ACK] Seq=4215 Ack=78734 Win=65536 Len=438
416794 138.804366 253.160.251.85 -> 253.37.253.43 TCP 496 [TCP Retransmission] 38810 > ddm-rdb [PSH, ACK] Seq=4215 Ack=78734 Win=65536 Len=438
417705 138.969075 253.160.251.85 -> 253.37.253.43 TCP 64 38810 > ddm-rdb [ACK] Seq=4653 Ack=81494 Win=65536 Len=0
417706 138.969080 253.160.251.85 -> 253.37.253.43 TCP 64 [TCP Dup ACK 417705#1] 38810 > ddm-rdb [ACK] Seq=4653 Ack=81494 Win=65536 Len=0
417709 138.969239 253.160.251.85 -> 253.37.253.43 TCP 64 38810 > ddm-rdb [ACK] Seq=4653 Ack=84254 Win=65536 Len=0
417710 138.969244 253.160.251.85 -> 253.37.253.43 TCP 64 [TCP Dup ACK 417709#1] 38810 > ddm-rdb [ACK] Seq=4653 Ack=84254 Win=65536 Len=0
417714 138.969478 253.160.251.85 -> 253.37.253.43 TCP 64 38810 > ddm-rdb [ACK] Seq=4653 Ack=87014 Win=65536 Len=0
417715 138.969483 253.160.251.85 -> 253.37.253.43 TCP 64 [TCP Dup ACK 417714#1] 38810 > ddm-rdb [ACK] Seq=4653 Ack=87014 Win=65536 Len=0
417719 138.969727 253.160.251.85 -> 253.37.253.43 TCP 64 38810 > ddm-rdb [ACK] Seq=4653 Ack=89774 Win=65536 Len=0
417720 138.969732 253.160.251.85 -> 253.37.253.43 TCP 64 [TCP Dup ACK 417719#1] 38810 > ddm-rdb [ACK] Seq=4653 Ack=89774 Win=65536 Len=0
417724 138.969974 253.160.251.85 -> 253.37.253.43 TCP 64 38810 > ddm-rdb [ACK] Seq=4653 Ack=92534 Win=65536 Len=0
417725 138.969979 253.160.251.85 -> 253.37.253.43 TCP 64 [TCP Dup ACK 417724#1] 38810 > ddm-rdb [ACK] Seq=4653 Ack=92534 Win=65536 Len=0
417730 138.970279 253.160.251.85 -> 253.37.253.43 TCP 64 38810 > ddm-rdb [ACK] Seq=4653 Ack=95294 Win=65536 Len=0
417731 138.970284 253.160.251.85 -> 253.37.253.43 TCP 64 [TCP Dup ACK 417730#1] 38810 > ddm-rdb [ACK] Seq=4653 Ack=95294 Win=65536 Len=0
417737 138.970521 253.160.251.85 -> 253.37.253.43 TCP 64 38810 > ddm-rdb [ACK] Seq=4653 Ack=98054 Win=65536 Len=0
417738 138.970526 253.160.251.85 -> 253.37.253.43 TCP 64 [TCP Dup ACK 417737#1] 38810 > ddm-rdb [ACK] Seq=4653 Ack=98054 Win=65536 Len=0
417745 138.970717 253.160.251.85 -> 253.37.253.43 TCP 64 38810 > ddm-rdb [ACK] Seq=4653 Ack=100814 Win=65536 Len=0
417746 138.970722 253.160.251.85 -> 253.37.253.43 TCP 64 [TCP Dup ACK 417745#1] 38810 > ddm-rdb [ACK] Seq=4653 Ack=100814 Win=65536 Len=0
417748 138.971043 253.160.251.85 -> 253.37.253.43 TCP 64 38810 > ddm-rdb [ACK] Seq=4653 Ack=103574 Win=65536 Len=0
417749 138.971048 253.160.251.85 -> 253.37.253.43 TCP 64 [TCP Dup ACK 417748#1] 38810 > ddm-rdb [ACK] Seq=4653 Ack=103574 Win=65536 Len=0
417751 138.971277 253.160.251.85 -> 253.37.253.43 TCP 64 38810 > ddm-rdb [ACK] Seq=4653 Ack=106334 Win=65536 Len=0
417752 138.971282 253.160.251.85 -> 253.37.253.43 TCP 64 [TCP Dup ACK 417751#1] 38810 > ddm-rdb [ACK] Seq=4653 Ack=106334 Win=65536 Len=0
417755 138.971505 253.160.251.85 -> 253.37.253.43 TCP 64 38810 > ddm-rdb [ACK] Seq=4653 Ack=109094 Win=65536 Len=0
417756 138.971509 253.160.251.85 -> 253.37.253.43 TCP 64 [TCP Dup ACK 417755#1] 38810 > ddm-rdb [ACK] Seq=4653 Ack=109094 Win=65536 Len=0
417776 138.972641 253.160.251.85 -> 253.37.253.43 TCP 64 38810 > ddm-rdb [ACK] Seq=4653 Ack=111687 Win=65350 Len=0
417777 138.972646 253.160.251.85 -> 253.37.253.43 TCP 64 [TCP Dup ACK 417776#1] 38810 > ddm-rdb [ACK] Seq=4653 Ack=111687 Win=65350 Len=0
417778 138.972678 253.160.251.85 -> 253.37.253.43 TCP 64 [TCP Dup ACK 417776#2] 38810 > ddm-rdb [ACK] Seq=4653 Ack=111687 Win=65350 Len=0
417779 138.972683 253.160.251.85 -> 253.37.253.43 TCP 64 [TCP Dup ACK 417776#3] 38810 > ddm-rdb [ACK] Seq=4653 Ack=111687 Win=65350 Len=0
417781 138.973667 253.160.251.85 -> 253.37.253.43 TCP 156 38810 > ddm-rdb [PSH, ACK] Seq=4653 Ack=111687 Win=65350 Len=98
417782 138.973672 253.160.251.85 -> 253.37.253.43 TCP 156 [TCP Retransmission] 38810 > ddm-rdb [PSH, ACK] Seq=4653 Ack=111687 Win=65350 Len=98
417871 138.987068 253.160.251.85 -> 253.37.253.43 TCP 64 38810 > ddm-rdb [ACK] Seq=4751 Ack=114447 Win=65536 Len=0
417872 138.987073 253.160.251.85 -> 253.37.253.43 TCP 64 [TCP Dup ACK 417871#1] 38810 > ddm-rdb [ACK] Seq=4751 Ack=114447 Win=65536 Len=0
417878 138.987285 253.160.251.85 -> 253.37.253.43 TCP 64 38810 > ddm-rdb [ACK] Seq=4751 Ack=117207 Win=65536 Len=0
417879 138.987289 253.160.251.85 -> 253.37.253.43 TCP 64 [TCP Dup ACK 417878#1] 38810 > ddm-rdb [ACK] Seq=4751 Ack=117207 Win=65536 Len=0
417884 138.987591 253.160.251.85 -> 253.37.253.43 TCP 64 38810 > ddm-rdb [ACK] Seq=4751 Ack=121347 Win=65536 Len=0
417885 138.987594 253.160.251.85 -> 253.37.253.43 TCP 64 [TCP Dup ACK 417884#1] 38810 > ddm-rdb [ACK] Seq=4751 Ack=121347 Win=65536 Len=0
417888 138.987767 253.160.251.85 -> 253.37.253.43 TCP 64 38810 > ddm-rdb [ACK] Seq=4751 Ack=124107 Win=65536 Len=0
417889 138.987772 253.160.251.85 -> 253.37.253.43 TCP 64 [TCP Dup ACK 417888#1] 38810 > ddm-rdb [ACK] Seq=4751 Ack=124107 Win=65536 Len=0
417896 138.988077 253.160.251.85 -> 253.37.253.43 TCP 64 38810 > ddm-rdb [ACK] Seq=4751 Ack=126867 Win=65536 Len=0
417897 138.988080 253.160.251.85 -> 253.37.253.43 TCP 64 [TCP Dup ACK 417896#1] 38810 > ddm-rdb [ACK] Seq=4751 Ack=126867 Win=65536 Len=0
417902 138.988320 253.160.251.85 -> 253.37.253.43 TCP 64 38810 > ddm-rdb [ACK] Seq=4751 Ack=129627 Win=65536 Len=0
417903 138.988324 253.160.251.85 -> 253.37.253.43 TCP 64 [TCP Dup ACK 417902#1] 38810 > ddm-rdb [ACK] Seq=4751 Ack=129627 Win=65536 Len=0
417906 138.988486 253.160.251.85 -> 253.37.253.43 TCP 64 38810 > ddm-rdb [ACK] Seq=4751 Ack=132387 Win=65536 Len=0
417907 138.988491 253.160.251.85 -> 253.37.253.43 TCP 64 [TCP Dup ACK 417906#1] 38810 > ddm-rdb [ACK] Seq=4751 Ack=132387 Win=65536 Len=0
417912 138.988855 253.160.251.85 -> 253.37.253.43 TCP 64 38810 > ddm-rdb [ACK] Seq=4751 Ack=135147 Win=65536 Len=0
417913 138.988860 253.160.251.85 -> 253.37.253.43 TCP 64 [TCP Dup ACK 417912#1] 38810 > ddm-rdb [ACK] Seq=4751 Ack=135147 Win=65536 Len=0
417915 138.988970 253.160.251.85 -> 253.37.253.43 TCP 64 38810 > ddm-rdb [ACK] Seq=4751 Ack=137907 Win=65536 Len=0
417916 138.988975 253.160.251.85 -> 253.37.253.43 TCP 64 [TCP Dup ACK 417915#1] 38810 > ddm-rdb [ACK] Seq=4751 Ack=137907 Win=65536 Len=0
417919 138.989378 253.160.251.85 -> 253.37.253.43 TCP 64 38810 > ddm-rdb [ACK] Seq=4751 Ack=140667 Win=65536 Len=0
417921 138.989386 253.160.251.85 -> 253.37.253.43 TCP 64 [TCP Dup ACK 417919#1] 38810 > ddm-rdb [ACK] Seq=4751 Ack=140667 Win=65536 Len=0
417922 138.989447 253.160.251.85 -> 253.37.253.43 TCP 64 38810 > ddm-rdb [ACK] Seq=4751 Ack=143427 Win=65536 Len=0
417923 138.989452 253.160.251.85 -> 253.37.253.43 TCP 64 [TCP Dup ACK 417922#1] 38810 > ddm-rdb [ACK] Seq=4751 Ack=143427 Win=65536 Len=0
417934 138.990217 253.160.251.85 -> 253.37.253.43 TCP 64 38810 > ddm-rdb [ACK] Seq=4751 Ack=144513 Win=64450 Len=0
417935 138.990221 253.160.251.85 -> 253.37.253.43 TCP 64 [TCP Dup ACK 417934#1] 38810 > ddm-rdb [ACK] Seq=4751 Ack=144513 Win=64450 Len=0
417936 138.990247 253.160.251.85 -> 253.37.253.43 TCP 156 38810 > ddm-rdb [PSH, ACK] Seq=4751 Ack=144513 Win=64450 Len=98
417937 138.990251 253.160.251.85 -> 253.37.253.43 TCP 156 [TCP Retransmission] 38810 > ddm-rdb [PSH, ACK] Seq=4751 Ack=144513 Win=64450 Len=98
417990 138.999103 253.160.251.85 -> 253.37.253.43 TCP 64 38810 > ddm-rdb [ACK] Seq=4849 Ack=150033 Win=65536 Len=0
417991 138.999107 253.160.251.85 -> 253.37.253.43 TCP 64 [TCP Dup ACK 417990#1] 38810 > ddm-rdb [ACK] Seq=4849 Ack=150033 Win=65536 Len=0
417994 138.999216 253.160.251.85 -> 253.37.253.43 TCP 64 38810 > ddm-rdb [ACK] Seq=4849 Ack=152793 Win=65536 Len=0
417995 138.999220 253.160.251.85 -> 253.37.253.43 TCP 64 [TCP Dup ACK 417994#1] 38810 > ddm-rdb [ACK] Seq=4849 Ack=152793 Win=65536 Len=0
417998 138.999388 253.160.251.85 -> 253.37.253.43 TCP 64 38810 > ddm-rdb [ACK] Seq=4849 Ack=155553 Win=65536 Len=0
417999 138.999392 253.160.251.85 -> 253.37.253.43 TCP 64 [TCP Dup ACK 417998#1] 38810 > ddm-rdb [ACK] Seq=4849 Ack=155553 Win=65536 Len=0
418003 138.999623 253.160.251.85 -> 253.37.253.43 TCP 64 38810 > ddm-rdb [ACK] Seq=4849 Ack=158313 Win=65536 Len=0
418004 138.999627 253.160.251.85 -> 253.37.253.43 TCP 64 [TCP Dup ACK 418003#1] 38810 > ddm-rdb [ACK] Seq=4849 Ack=158313 Win=65536 Len=0
418009 138.999936 253.160.251.85 -> 253.37.253.43 TCP 64 38810 > ddm-rdb [ACK] Seq=4849 Ack=161073 Win=65536 Len=0
418010 138.999940 253.160.251.85 -> 253.37.253.43 TCP 64 [TCP Dup ACK 418009#1] 38810 > ddm-rdb [ACK] Seq=4849 Ack=161073 Win=65536 Len=0
418014 139.000135 253.160.251.85 -> 253.37.253.43 TCP 64 38810 > ddm-rdb [ACK] Seq=4849 Ack=163833 Win=65536 Len=0
418015 139.000139 253.160.251.85 -> 253.37.253.43 TCP 64 [TCP Dup ACK 418014#1] 38810 > ddm-rdb [ACK] Seq=4849 Ack=163833 Win=65536 Len=0
418024 139.000347 253.160.251.85 -> 253.37.253.43 TCP 64 38810 > ddm-rdb [ACK] Seq=4849 Ack=166593 Win=65536 Len=0
418025 139.000352 253.160.251.85 -> 253.37.253.43 TCP 64 [TCP Dup ACK 418024#1] 38810 > ddm-rdb [ACK] Seq=4849 Ack=166593 Win=65536 Len=0
418029 139.000598 253.160.251.85 -> 253.37.253.43 TCP 64 38810 > ddm-rdb [ACK] Seq=4849 Ack=169353 Win=65536 Len=0
418030 139.000603 253.160.251.85 -> 253.37.253.43 TCP 64 [TCP Dup ACK 418029#1] 38810 > ddm-rdb [ACK] Seq=4849 Ack=169353 Win=65536 Len=0
418032 139.000841 253.160.251.85 -> 253.37.253.43 TCP 64 38810 > ddm-rdb [ACK] Seq=4849 Ack=172113 Win=65536 Len=0
418033 139.000846 253.160.251.85 -> 253.37.253.43 TCP 64 [TCP Dup ACK 418032#1] 38810 > ddm-rdb [ACK] Seq=4849 Ack=172113 Win=65536 Len=0
418035 139.001073 253.160.251.85 -> 253.37.253.43 TCP 64 38810 > ddm-rdb [ACK] Seq=4849 Ack=174873 Win=65536 Len=0
418036 139.001078 253.160.251.85 -> 253.37.253.43 TCP 64 [TCP Dup ACK 418035#1] 38810 > ddm-rdb [ACK] Seq=4849 Ack=174873 Win=65536 Len=0
418041 139.001512 253.160.251.85 -> 253.37.253.43 TCP 64 38810 > ddm-rdb [ACK] Seq=4849 Ack=177339 Win=65476 Len=0
418042 139.001517 253.160.251.85 -> 253.37.253.43 TCP 64 [TCP Dup ACK 418041#1] 38810 > ddm-rdb [ACK] Seq=4849 Ack=177339 Win=65476 Len=0
418043 139.001521 253.160.251.85 -> 253.37.253.43 TCP 64 [TCP Dup ACK 418041#2] 38810 > ddm-rdb [ACK] Seq=4849 Ack=177339 Win=65476 Len=0
418044 139.001525 253.160.251.85 -> 253.37.253.43 TCP 64 [TCP Dup ACK 418041#3] 38810 > ddm-rdb [ACK] Seq=4849 Ack=177339 Win=65476 Len=0
418050 139.001987 253.160.251.85 -> 253.37.253.43 TCP 156 38810 > ddm-rdb [PSH, ACK] Seq=4849 Ack=177339 Win=65476 Len=98
418051 139.001991 253.160.251.85 -> 253.37.253.43 TCP 156 [TCP Retransmission] 38810 > ddm-rdb [PSH, ACK] Seq=4849 Ack=177339 Win=65476 Len=98
418143 139.014765 253.160.251.85 -> 253.37.253.43 TCP 64 38810 > ddm-rdb [ACK] Seq=4947 Ack=180099 Win=65536 Len=0
418144 139.014769 253.160.251.85 -> 253.37.253.43 TCP 64 [TCP Dup ACK 418143#1] 38810 > ddm-rdb [ACK] Seq=4947 Ack=180099 Win=65536 Len=0
418147 139.014951 253.160.251.85 -> 253.37.253.43 TCP 64 38810 > ddm-rdb [ACK] Seq=4947 Ack=182859 Win=65536 Len=0
418148 139.014956 253.160.251.85 -> 253.37.253.43 TCP 64 [TCP Dup ACK 418147#1] 38810 > ddm-rdb [ACK] Seq=4947 Ack=182859 Win=65536 Len=0
418153 139.015253 253.160.251.85 -> 253.37.253.43 TCP 64 38810 > ddm-rdb [ACK] Seq=4947 Ack=185619 Win=65536 Len=0
418154 139.015257 253.160.251.85 -> 253.37.253.43 TCP 64 [TCP Dup ACK 418153#1] 38810 > ddm-rdb [ACK] Seq=4947 Ack=185619 Win=65536 Len=0
418157 139.015437 253.160.251.85 -> 253.37.253.43 TCP 64 38810 > ddm-rdb [ACK] Seq=4947 Ack=188379 Win=65536 Len=0
418158 139.015442 253.160.251.85 -> 253.37.253.43 TCP 64 [TCP Dup ACK 418157#1] 38810 > ddm-rdb [ACK] Seq=4947 Ack=188379 Win=65536 Len=0
418170 139.015681 253.160.251.85 -> 253.37.253.43 TCP 64 38810 > ddm-rdb [ACK] Seq=4947 Ack=191139 Win=65536 Len=0
418171 139.015685 253.160.251.85 -> 253.37.253.43 TCP 64 [TCP Dup ACK 418170#1] 38810 > ddm-rdb [ACK] Seq=4947 Ack=191139 Win=65536 Len=0
418176 139.015980 253.160.251.85 -> 253.37.253.43 TCP 64 38810 > ddm-rdb [ACK] Seq=4947 Ack=193899 Win=65536 Len=0
418177 139.015984 253.160.251.85 -> 253.37.253.43 TCP 64 [TCP Dup ACK 418176#1] 38810 > ddm-rdb [ACK] Seq=4947 Ack=193899 Win=65536 Len=0
418181 139.016222 253.160.251.85 -> 253.37.253.43 TCP 64 38810 > ddm-rdb [ACK] Seq=4947 Ack=196659 Win=65536 Len=0
418182 139.016226 253.160.251.85 -> 253.37.253.43 TCP 64 [TCP Dup ACK 418181#1] 38810 > ddm-rdb [ACK] Seq=4947 Ack=196659 Win=65536 Len=0
418185 139.016429 253.160.251.85 -> 253.37.253.43 TCP 64 38810 > ddm-rdb [ACK] Seq=4947 Ack=199419 Win=65536 Len=0
418186 139.016434 253.160.251.85 -> 253.37.253.43 TCP 64 [TCP Dup ACK 418185#1] 38810 > ddm-rdb [ACK] Seq=4947 Ack=199419 Win=65536 Len=0
418189 139.016658 253.160.251.85 -> 253.37.253.43 TCP 64 38810 > ddm-rdb [ACK] Seq=4947 Ack=202179 Win=65536 Len=0
418190 139.016663 253.160.251.85 -> 253.37.253.43 TCP 64 [TCP Dup ACK 418189#1] 38810 > ddm-rdb [ACK] Seq=4947 Ack=202179 Win=65536 Len=0
418192 139.016880 253.160.251.85 -> 253.37.253.43 TCP 64 38810 > ddm-rdb [ACK] Seq=4947 Ack=204939 Win=65536 Len=0
418193 139.016885 253.160.251.85 -> 253.37.253.43 TCP 64 [TCP Dup ACK 418192#1] 38810 > ddm-rdb [ACK] Seq=4947 Ack=204939 Win=65536 Len=0
418195 139.017107 253.160.251.85 -> 253.37.253.43 TCP 64 38810 > ddm-rdb [ACK] Seq=4947 Ack=207699 Win=65536 Len=0
418196 139.017112 253.160.251.85 -> 253.37.253.43 TCP 64 [TCP Dup ACK 418195#1] 38810 > ddm-rdb [ACK] Seq=4947 Ack=207699 Win=65536 Len=0
418203 139.018024 253.160.251.85 -> 253.37.253.43 TCP 64 38810 > ddm-rdb [ACK] Seq=4947 Ack=210165 Win=65476 Len=0
418204 139.018029 253.160.251.85 -> 253.37.253.43 TCP 64 [TCP Dup ACK 418203#1] 38810 > ddm-rdb [ACK] Seq=4947 Ack=210165 Win=65476 Len=0
418205 139.018033 253.160.251.85 -> 253.37.253.43 TCP 64 [TCP Dup ACK 418203#2] 38810 > ddm-rdb [ACK] Seq=4947 Ack=210165 Win=65476 Len=0
418206 139.018037 253.160.251.85 -> 253.37.253.43 TCP 64 [TCP Dup ACK 418203#3] 38810 > ddm-rdb [ACK] Seq=4947 Ack=210165 Win=65476 Len=0
418207 139.018056 253.160.251.85 -> 253.37.253.43 TCP 156 38810 > ddm-rdb [PSH, ACK] Seq=4947 Ack=210165 Win=65476 Len=98
418208 139.018060 253.160.251.85 -> 253.37.253.43 TCP 156 [TCP Retransmission] 38810 > ddm-rdb [PSH, ACK] Seq=4947 Ack=210165 Win=65476 Len=98
418264 139.022443 253.160.251.85 -> 253.37.253.43 TCP 64 38810 > ddm-rdb [ACK] Seq=5045 Ack=212925 Win=65536 Len=0
418265 139.022448 253.160.251.85 -> 253.37.253.43 TCP 64 [TCP Dup ACK 418264#1] 38810 > ddm-rdb [ACK] Seq=5045 Ack=212925 Win=65536 Len=0
418272 139.022927 253.160.251.85 -> 253.37.253.43 TCP 64 38810 > ddm-rdb [ACK] Seq=5045 Ack=215685 Win=65536 Len=0
418273 139.022932 253.160.251.85 -> 253.37.253.43 TCP 64 [TCP Dup ACK 418272#1] 38810 > ddm-rdb [ACK] Seq=5045 Ack=215685 Win=65536 Len=0
418276 139.023038 253.160.251.85 -> 253.37.253.43 TCP 64 38810 > ddm-rdb [ACK] Seq=5045 Ack=218445 Win=65536 Len=0
418277 139.023044 253.160.251.85 -> 253.37.253.43 TCP 64 [TCP Dup ACK 418276#1] 38810 > ddm-rdb [ACK] Seq=5045 Ack=218445 Win=65536 Len=0
418333 139.035883 253.160.251.85 -> 253.37.253.43 TCP 64 38810 > ddm-rdb [ACK] Seq=5045 Ack=242991 Win=65476 Len=0
418334 139.035888 253.160.251.85 -> 253.37.253.43 TCP 64 [TCP Dup ACK 418333#1] 38810 > ddm-rdb [ACK] Seq=5045 Ack=242991 Win=65476 Len=0
418335 139.035892 253.160.251.85 -> 253.37.253.43 TCP 64 [TCP Dup ACK 418333#2] 38810 > ddm-rdb [ACK] Seq=5045 Ack=242991 Win=65476 Len=0
418336 139.035897 253.160.251.85 -> 253.37.253.43 TCP 64 [TCP Dup ACK 418333#3] 38810 > ddm-rdb [ACK] Seq=5045 Ack=242991 Win=65476 Len=0
418346 139.037900 253.160.251.85 -> 253.37.253.43 TCP 156 38810 > ddm-rdb [PSH, ACK] Seq=5045 Ack=242991 Win=65476 Len=98
418347 139.037905 253.160.251.85 -> 253.37.253.43 TCP 156 [TCP Retransmission] 38810 > ddm-rdb [PSH, ACK] Seq=5045 Ack=242991 Win=65476 Len=98
418416 139.043259 253.160.251.85 -> 253.37.253.43 TCP 64 38810 > ddm-rdb [ACK] Seq=5143 Ack=249891 Win=65536 Len=0
418417 139.043264 253.160.251.85 -> 253.37.253.43 TCP 64 [TCP Dup ACK 418416#1] 38810 > ddm-rdb [ACK] Seq=5143 Ack=249891 Win=65536 Len=0
418422 139.043514 253.160.251.85 -> 253.37.253.43 TCP 64 38810 > ddm-rdb [ACK] Seq=5143 Ack=252651 Win=65536 Len=0
418423 139.043519 253.160.251.85 -> 253.37.253.43 TCP 64 [TCP Dup ACK 418422#1] 38810 > ddm-rdb [ACK] Seq=5143 Ack=252651 Win=65536 Len=0
418449 139.050995 253.160.251.85 -> 253.37.253.43 TCP 64 38810 > ddm-rdb [ACK] Seq=5143 Ack=275817 Win=65476 Len=0
418450 139.051002 253.160.251.85 -> 253.37.253.43 TCP 64 [TCP Dup ACK 418449#1] 38810 > ddm-rdb [ACK] Seq=5143 Ack=275817 Win=65476 Len=0
418451 139.051006 253.160.251.85 -> 253.37.253.43 TCP 64 [TCP Dup ACK 418449#2] 38810 > ddm-rdb [ACK] Seq=5143 Ack=275817 Win=65476 Len=0
418452 139.051011 253.160.251.85 -> 253.37.253.43 TCP 64 [TCP Dup ACK 418449#3] 38810 > ddm-rdb [ACK] Seq=5143 Ack=275817 Win=65476 Len=0
418457 139.052815 253.160.251.85 -> 253.37.253.43 TCP 156 38810 > ddm-rdb [PSH, ACK] Seq=5143 Ack=275817 Win=65476 Len=98
418458 139.052820 253.160.251.85 -> 253.37.253.43 TCP 156 [TCP Retransmission] 38810 > ddm-rdb [PSH, ACK] Seq=5143 Ack=275817 Win=65476 Len=98
418513 139.057330 253.160.251.85 -> 253.37.253.43 TCP 64 38810 > ddm-rdb [ACK] Seq=5241 Ack=279957 Win=65536 Len=0
418514 139.057335 253.160.251.85 -> 253.37.253.43 TCP 64 [TCP Dup ACK 418513#1] 38810 > ddm-rdb [ACK] Seq=5241 Ack=279957 Win=65536 Len=0
418534 139.057879 253.160.251.85 -> 253.37.253.43 TCP 64 38810 > ddm-rdb [ACK] Seq=5241 Ack=285477 Win=65536 Len=0
418535 139.057883 253.160.251.85 -> 253.37.253.43 TCP 64 [TCP Dup ACK 418534#1] 38810 > ddm-rdb [ACK] Seq=5241 Ack=285477 Win=65536 Len=0
418553 139.058364 253.160.251.85 -> 253.37.253.43 TCP 64 38810 > ddm-rdb [ACK] Seq=5241 Ack=290997 Win=65536 Len=0
418554 139.058369 253.160.251.85 -> 253.37.253.43 TCP 64 [TCP Dup ACK 418553#1] 38810 > ddm-rdb [ACK] Seq=5241 Ack=290997 Win=65536 Len=0
418559 139.058894 253.160.251.85 -> 253.37.253.43 TCP 64 38810 > ddm-rdb [ACK] Seq=5241 Ack=297897 Win=65536 Len=0
418560 139.058898 253.160.251.85 -> 253.37.253.43 TCP 64 [TCP Dup ACK 418559#1] 38810 > ddm-rdb [ACK] Seq=5241 Ack=297897 Win=65536 Len=0
418569 139.059364 253.160.251.85 -> 253.37.253.43 TCP 64 38810 > ddm-rdb [ACK] Seq=5241 Ack=303417 Win=65536 Len=0
418570 139.059368 253.160.251.85 -> 253.37.253.43 TCP 64 [TCP Dup ACK 418569#1] 38810 > ddm-rdb [ACK] Seq=5241 Ack=303417 Win=65536 Len=0
418585 139.060384 253.160.251.85 -> 253.37.253.43 TCP 64 38810 > ddm-rdb [ACK] Seq=5241 Ack=308643 Win=65476 Len=0
418586 139.060388 253.160.251.85 -> 253.37.253.43 TCP 64 [TCP Dup ACK 418585#1] 38810 > ddm-rdb [ACK] Seq=5241 Ack=308643 Win=65476 Len=0
418587 139.060393 253.160.251.85 -> 253.37.253.43 TCP 64 [TCP Dup ACK 418585#2] 38810 > ddm-rdb [ACK] Seq=5241 Ack=308643 Win=65476 Len=0
418588 139.060397 253.160.251.85 -> 253.37.253.43 TCP 64 [TCP Dup ACK 418585#3] 38810 > ddm-rdb [ACK] Seq=5241 Ack=308643 Win=65476 Len=0
418589 139.060434 253.160.251.85 -> 253.37.253.43 TCP 156 38810 > ddm-rdb [PSH, ACK] Seq=5241 Ack=308643 Win=65476 Len=98
418590 139.060438 253.160.251.85 -> 253.37.253.43 TCP 156 [TCP Retransmission] 38810 > ddm-rdb [PSH, ACK] Seq=5241 Ack=308643 Win=65476 Len=98
418641 139.064896 253.160.251.85 -> 253.37.253.43 TCP 64 38810 > ddm-rdb [ACK] Seq=5339 Ack=314163 Win=65536 Len=0
418642 139.064901 253.160.251.85 -> 253.37.253.43 TCP 64 [TCP Dup ACK 418641#1] 38810 > ddm-rdb [ACK] Seq=5339 Ack=314163 Win=65536 Len=0
418648 139.065385 253.160.251.85 -> 253.37.253.43 TCP 64 38810 > ddm-rdb [ACK] Seq=5339 Ack=319683 Win=65536 Len=0
418650 139.065394 253.160.251.85 -> 253.37.253.43 TCP 64 [TCP Dup ACK 418648#1] 38810 > ddm-rdb [ACK] Seq=5339 Ack=319683 Win=65536 Len=0
418664 139.065878 253.160.251.85 -> 253.37.253.43 TCP 64 38810 > ddm-rdb [ACK] Seq=5339 Ack=325203 Win=65536 Len=0
418665 139.065883 253.160.251.85 -> 253.37.253.43 TCP 64 [TCP Dup ACK 418664#1] 38810 > ddm-rdb [ACK] Seq=5339 Ack=325203 Win=65536 Len=0
418672 139.066338 253.160.251.85 -> 253.37.253.43 TCP 64 38810 > ddm-rdb [ACK] Seq=5339 Ack=330723 Win=65536 Len=0
418673 139.066342 253.160.251.85 -> 253.37.253.43 TCP 64 [TCP Dup ACK 418672#1] 38810 > ddm-rdb [ACK] Seq=5339 Ack=330723 Win=65536 Len=0
418677 139.066821 253.160.251.85 -> 253.37.253.43 TCP 64 38810 > ddm-rdb [ACK] Seq=5339 Ack=336243 Win=65536 Len=0
418678 139.066825 253.160.251.85 -> 253.37.253.43 TCP 64 [TCP Dup ACK 418677#1] 38810 > ddm-rdb [ACK] Seq=5339 Ack=336243 Win=65536 Len=0
418688 139.068387 253.160.251.85 -> 253.37.253.43 TCP 64 38810 > ddm-rdb [ACK] Seq=5339 Ack=341469 Win=65476 Len=0
418689 139.068392 253.160.251.85 -> 253.37.253.43 TCP 64 [TCP Dup ACK 418688#1] 38810 > ddm-rdb [ACK] Seq=5339 Ack=341469 Win=65476 Len=0
418690 139.068396 253.160.251.85 -> 253.37.253.43 TCP 64 [TCP Dup ACK 418688#2] 38810 > ddm-rdb [ACK] Seq=5339 Ack=341469 Win=65476 Len=0
418691 139.068400 253.160.251.85 -> 253.37.253.43 TCP 64 [TCP Dup ACK 418688#3] 38810 > ddm-rdb [ACK] Seq=5339 Ack=341469 Win=65476 Len=0
418692 139.068416 253.160.251.85 -> 253.37.253.43 TCP 156 38810 > ddm-rdb [PSH, ACK] Seq=5339 Ack=341469 Win=65476 Len=98
418693 139.068419 253.160.251.85 -> 253.37.253.43 TCP 156 [TCP Retransmission] 38810 > ddm-rdb [PSH, ACK] Seq=5339 Ack=341469 Win=65476 Len=98
418752 139.072561 253.160.251.85 -> 253.37.253.43 TCP 64 38810 > ddm-rdb [ACK] Seq=5437 Ack=345609 Win=65536 Len=0
418753 139.072566 253.160.251.85 -> 253.37.253.43 TCP 64 [TCP Dup ACK 418752#1] 38810 > ddm-rdb [ACK] Seq=5437 Ack=345609 Win=65536 Len=0
418757 139.072749 253.160.251.85 -> 253.37.253.43 TCP 64 38810 > ddm-rdb [ACK] Seq=5437 Ack=348369 Win=65536 Len=0
418758 139.072753 253.160.251.85 -> 253.37.253.43 TCP 64 [TCP Dup ACK 418757#1] 38810 > ddm-rdb [ACK] Seq=5437 Ack=348369 Win=65536 Len=0
418762 139.072934 253.160.251.85 -> 253.37.253.43 TCP 64 38810 > ddm-rdb [ACK] Seq=5437 Ack=351129 Win=65536 Len=0
418763 139.072939 253.160.251.85 -> 253.37.253.43 TCP 64 [TCP Dup ACK 418762#1] 38810 > ddm-rdb [ACK] Seq=5437 Ack=351129 Win=65536 Len=0
418770 139.073235 253.160.251.85 -> 253.37.253.43 TCP 64 38810 > ddm-rdb [ACK] Seq=5437 Ack=353889 Win=65536 Len=0
418771 139.073239 253.160.251.85 -> 253.37.253.43 TCP 64 [TCP Dup ACK 418770#1] 38810 > ddm-rdb [ACK] Seq=5437 Ack=353889 Win=65536 Len=0
418776 139.073498 253.160.251.85 -> 253.37.253.43 TCP 64 38810 > ddm-rdb [ACK] Seq=5437 Ack=356649 Win=65536 Len=0
418777 139.073502 253.160.251.85 -> 253.37.253.43 TCP 64 [TCP Dup ACK 418776#1] 38810 > ddm-rdb [ACK] Seq=5437 Ack=356649 Win=65536 Len=0
418789 139.073667 253.160.251.85 -> 253.37.253.43 TCP 64 38810 > ddm-rdb [ACK] Seq=5437 Ack=359409 Win=65536 Len=0
418790 139.073672 253.160.251.85 -> 253.37.253.43 TCP 64 [TCP Dup ACK 418789#1] 38810 > ddm-rdb [ACK] Seq=5437 Ack=359409 Win=65536 Len=0
418801 139.073889 253.160.251.85 -> 253.37.253.43 TCP 64 38810 > ddm-rdb [ACK] Seq=5437 Ack=362169 Win=65536 Len=0
418802 139.073894 253.160.251.85 -> 253.37.253.43 TCP 64 [TCP Dup ACK 418801#1] 38810 > ddm-rdb [ACK] Seq=5437 Ack=362169 Win=65536 Len=0
418805 139.074218 253.160.251.85 -> 253.37.253.43 TCP 64 38810 > ddm-rdb [ACK] Seq=5437 Ack=364929 Win=65536 Len=0
418806 139.074223 253.160.251.85 -> 253.37.253.43 TCP 64 [TCP Dup ACK 418805#1] 38810 > ddm-rdb [ACK] Seq=5437 Ack=364929 Win=65536 Len=0
418808 139.074405 253.160.251.85 -> 253.37.253.43 TCP 64 38810 > ddm-rdb [ACK] Seq=5437 Ack=367689 Win=65536 Len=0
418809 139.074410 253.160.251.85 -> 253.37.253.43 TCP 64 [TCP Dup ACK 418808#1] 38810 > ddm-rdb [ACK] Seq=5437 Ack=367689 Win=65536 Len=0
418811 139.074713 253.160.251.85 -> 253.37.253.43 TCP 64 38810 > ddm-rdb [ACK] Seq=5437 Ack=370449 Win=65536 Len=0
418812 139.074718 253.160.251.85 -> 253.37.253.43 TCP 64 [TCP Dup ACK 418811#1] 38810 > ddm-rdb [ACK] Seq=5437 Ack=370449 Win=65536 Len=0
418814 139.074894 253.160.251.85 -> 253.37.253.43 TCP 64 38810 > ddm-rdb [ACK] Seq=5437 Ack=373209 Win=65536 Len=0
418815 139.074898 253.160.251.85 -> 253.37.253.43 TCP 64 [TCP Dup ACK 418814#1] 38810 > ddm-rdb [ACK] Seq=5437 Ack=373209 Win=65536 Len=0
418818 139.075595 253.160.251.85 -> 253.37.253.43 TCP 64 38810 > ddm-rdb [ACK] Seq=5437 Ack=374295 Win=64450 Len=0
418819 139.075600 253.160.251.85 -> 253.37.253.43 TCP 64 [TCP Dup ACK 418818#1] 38810 > ddm-rdb [ACK] Seq=5437 Ack=374295 Win=64450 Len=0
418820 139.075643 253.160.251.85 -> 253.37.253.43 TCP 156 38810 > ddm-rdb [PSH, ACK] Seq=5437 Ack=374295 Win=64450 Len=98
418821 139.075648 253.160.251.85 -> 253.37.253.43 TCP 156 [TCP Retransmission] 38810 > ddm-rdb [PSH, ACK] Seq=5437 Ack=374295 Win=64450 Len=98
418897 139.080095 253.160.251.85 -> 253.37.253.43 TCP 64 38810 > ddm-rdb [ACK] Seq=5535 Ack=377055 Win=65536 Len=0
418898 139.080099 253.160.251.85 -> 253.37.253.43 TCP 64 [TCP Dup ACK 418897#1] 38810 > ddm-rdb [ACK] Seq=5535 Ack=377055 Win=65536 Len=0
418903 139.080248 253.160.251.85 -> 253.37.253.43 TCP 64 38810 > ddm-rdb [ACK] Seq=5535 Ack=379815 Win=65536 Len=0
418904 139.080252 253.160.251.85 -> 253.37.253.43 TCP 64 [TCP Dup ACK 418903#1] 38810 > ddm-rdb [ACK] Seq=5535 Ack=379815 Win=65536 Len=0
418912 139.080578 253.160.251.85 -> 253.37.253.43 TCP 64 38810 > ddm-rdb [ACK] Seq=5535 Ack=382575 Win=65536 Len=0
418913 139.080582 253.160.251.85 -> 253.37.253.43 TCP 64 [TCP Dup ACK 418912#1] 38810 > ddm-rdb [ACK] Seq=5535 Ack=382575 Win=65536 Len=0
418919 139.080802 253.160.251.85 -> 253.37.253.43 TCP 64 38810 > ddm-rdb [ACK] Seq=5535 Ack=385335 Win=65536 Len=0
418920 139.080806 253.160.251.85 -> 253.37.253.43 TCP 64 [TCP Dup ACK 418919#1] 38810 > ddm-rdb [ACK] Seq=5535 Ack=385335 Win=65536 Len=0
418926 139.081043 253.160.251.85 -> 253.37.253.43 TCP 64 38810 > ddm-rdb [ACK] Seq=5535 Ack=388095 Win=65536 Len=0
418927 139.081047 253.160.251.85 -> 253.37.253.43 TCP 64 [TCP Dup ACK 418926#1] 38810 > ddm-rdb [ACK] Seq=5535 Ack=388095 Win=65536 Len=0
418932 139.081281 253.160.251.85 -> 253.37.253.43 TCP 64 38810 > ddm-rdb [ACK] Seq=5535 Ack=390855 Win=65536 Len=0
418933 139.081284 253.160.251.85 -> 253.37.253.43 TCP 64 [TCP Dup ACK 418932#1] 38810 > ddm-rdb [ACK] Seq=5535 Ack=390855 Win=65536 Len=0
418938 139.081523 253.160.251.85 -> 253.37.253.43 TCP 64 38810 > ddm-rdb [ACK] Seq=5535 Ack=393615 Win=65536 Len=0
418939 139.081527 253.160.251.85 -> 253.37.253.43 TCP 64 [TCP Dup ACK 418938#1] 38810 > ddm-rdb [ACK] Seq=5535 Ack=393615 Win=65536 Len=0
418942 139.081733 253.160.251.85 -> 253.37.253.43 TCP 64 38810 > ddm-rdb [ACK] Seq=5535 Ack=396375 Win=65536 Len=0
418943 139.081738 253.160.251.85 -> 253.37.253.43 TCP 64 [TCP Dup ACK 418942#1] 38810 > ddm-rdb [ACK] Seq=5535 Ack=396375 Win=65536 Len=0
418945 139.081949 253.160.251.85 -> 253.37.253.43 TCP 64 38810 > ddm-rdb [ACK] Seq=5535 Ack=399135 Win=65536 Len=0
418946 139.081954 253.160.251.85 -> 253.37.253.43 TCP 64 [TCP Dup ACK 418945#1] 38810 > ddm-rdb [ACK] Seq=5535 Ack=399135 Win=65536 Len=0
