449272 146.005405 253.213.108.48 -> 253.37.253.43 TCP 64 1491 > telnet [ACK] Seq=31 Ack=4076 Win=65535 Len=0
449273 146.005410 253.213.108.48 -> 253.37.253.43 TCP 64 [TCP Dup ACK 449272#1] 1491 > telnet [ACK] Seq=31 Ack=4076 Win=65535 Len=0
461987 151.432788 253.213.108.48 -> 253.37.253.43 TCP 64 1491 > telnet [ACK] Seq=76 Ack=4819 Win=64792 Len=0
461988 151.432792 253.213.108.48 -> 253.37.253.43 TCP 64 [TCP Dup ACK 461987#1] 1491 > telnet [ACK] Seq=76 Ack=4819 Win=64792 Len=0
462411 151.632554 253.213.108.48 -> 253.37.253.43 TCP 64 1491 > telnet [ACK] Seq=86 Ack=5541 Win=65535 Len=0
462412 151.632559 253.213.108.48 -> 253.37.253.43 TCP 64 [TCP Dup ACK 462411#1] 1491 > telnet [ACK] Seq=86 Ack=5541 Win=65535 Len=0
463894 152.437302 253.213.108.48 -> 253.37.253.43 TCP 64 1491 > telnet [ACK] Seq=96 Ack=6850 Win=64226 Len=0
463895 152.437307 253.213.108.48 -> 253.37.253.43 TCP 64 [TCP Dup ACK 463894#1] 1491 > telnet [ACK] Seq=96 Ack=6850 Win=64226 Len=0
520309 168.339322 253.213.108.48 -> 253.37.253.43 TCP 64 1491 > telnet [ACK] Seq=217 Ack=8741 Win=64630 Len=0
520310 168.339327 253.213.108.48 -> 253.37.253.43 TCP 64 [TCP Dup ACK 520309#1] 1491 > telnet [ACK] Seq=217 Ack=8741 Win=64630 Len=0
532704 172.762364 253.213.108.48 -> 253.37.253.43 TCP 64 1491 > telnet [ACK] Seq=227 Ack=9547 Win=65535 Len=0
532705 172.762369 253.213.108.48 -> 253.37.253.43 TCP 64 [TCP Dup ACK 532704#1] 1491 > telnet [ACK] Seq=227 Ack=9547 Win=65535 Len=0
