897880 296.974799 253.241.23.203 -> 253.37.253.43 TCP 66 srdp > oob-ws-http [SYN] Seq=0 Win=64512 Len=0 MSS=1380 SACK_PERM=1
897881 296.974803 253.241.23.203 -> 253.37.253.43 TCP 66 [TCP Out-Of-Order] srdp > oob-ws-http [SYN] Seq=0 Win=64512 Len=0 MSS=1380 SACK_PERM=1
897905 296.976165 253.241.23.203 -> 253.37.253.43 TCP 64 srdp > oob-ws-http [ACK] Seq=1 Ack=1 Win=64860 Len=0
897906 296.976170 253.241.23.203 -> 253.37.253.43 TCP 64 [TCP Dup ACK 897905#1] srdp > oob-ws-http [ACK] Seq=1 Ack=1 Win=64860 Len=0
899158 297.099768 253.241.23.203 -> 253.37.253.43 TCP 122 srdp > oob-ws-http [PSH, ACK] Seq=1 Ack=1 Win=64860 Len=64
899159 297.099772 253.241.23.203 -> 253.37.253.43 TCP 122 [TCP Retransmission] srdp > oob-ws-http [PSH, ACK] Seq=1 Ack=1 Win=64860 Len=64
899169 297.103518 253.241.23.203 -> 253.37.253.43 TCP 270 srdp > oob-ws-http [PSH, ACK] Seq=65 Ack=779 Win=64082 Len=212
899170 297.103523 253.241.23.203 -> 253.37.253.43 TCP 270 [TCP Retransmission] srdp > oob-ws-http [PSH, ACK] Seq=65 Ack=779 Win=64082 Len=212
899439 297.136596 253.241.23.203 -> 253.37.253.43 TCP 64 srdp > oob-ws-http [ACK] Seq=277 Ack=854 Win=64007 Len=0
899440 297.136600 253.241.23.203 -> 253.37.253.43 TCP 64 [TCP Dup ACK 899439#1] srdp > oob-ws-http [ACK] Seq=277 Ack=854 Win=64007 Len=0
899679 297.157557 253.241.23.203 -> 253.37.253.43 TCP 87 srdp > oob-ws-http [PSH, ACK] Seq=277 Ack=883 Win=63978 Len=29
899680 297.157562 253.241.23.203 -> 253.37.253.43 TCP 87 [TCP Retransmission] srdp > oob-ws-http [PSH, ACK] Seq=277 Ack=883 Win=63978 Len=29
899691 297.159384 253.241.23.203 -> 253.37.253.43 TCP 103 srdp > oob-ws-http [PSH, ACK] Seq=306 Ack=920 Win=63941 Len=45
899692 297.159388 253.241.23.203 -> 253.37.253.43 TCP 103 [TCP Retransmission] srdp > oob-ws-http [PSH, ACK] Seq=306 Ack=920 Win=63941 Len=45
899721 297.161075 253.241.23.203 -> 253.37.253.43 TCP 95 srdp > oob-ws-http [PSH, ACK] Seq=351 Ack=981 Win=63880 Len=37
899722 297.161080 253.241.23.203 -> 253.37.253.43 TCP 95 [TCP Retransmission] srdp > oob-ws-http [PSH, ACK] Seq=351 Ack=981 Win=63880 Len=37
900846 297.309167 253.241.23.203 -> 253.37.253.43 TCP 64 srdp > oob-ws-http [ACK] Seq=388 Ack=1018 Win=63843 Len=0
900847 297.309172 253.241.23.203 -> 253.37.253.43 TCP 64 [TCP Dup ACK 900846#1] srdp > oob-ws-http [ACK] Seq=388 Ack=1018 Win=63843 Len=0
901645 297.510354 253.241.23.203 -> 253.37.253.43 TCP 64 srdp > oob-ws-http [ACK] Seq=388 Ack=1332 Win=63529 Len=0
901646 297.510360 253.241.23.203 -> 253.37.253.43 TCP 64 [TCP Dup ACK 901645#1] srdp > oob-ws-http [ACK] Seq=388 Ack=1332 Win=63529 Len=0
908698 299.911968 253.241.23.203 -> 253.37.253.43 TCP 103 srdp > oob-ws-http [PSH, ACK] Seq=388 Ack=1332 Win=63529 Len=45
908699 299.911973 253.241.23.203 -> 253.37.253.43 TCP 103 [TCP Retransmission] srdp > oob-ws-http [PSH, ACK] Seq=388 Ack=1332 Win=63529 Len=45
908927 300.025040 253.241.23.203 -> 253.37.253.43 TCP 64 srdp > oob-ws-http [ACK] Seq=433 Ack=1369 Win=63492 Len=0
908928 300.025045 253.241.23.203 -> 253.37.253.43 TCP 64 [TCP Dup ACK 908927#1] srdp > oob-ws-http [ACK] Seq=433 Ack=1369 Win=63492 Len=0
909229 300.226208 253.241.23.203 -> 253.37.253.43 TCP 64 srdp > oob-ws-http [ACK] Seq=433 Ack=1928 Win=64860 Len=0
909230 300.226213 253.241.23.203 -> 253.37.253.43 TCP 64 [TCP Dup ACK 909229#1] srdp > oob-ws-http [ACK] Seq=433 Ack=1928 Win=64860 Len=0
919671 304.807716 253.241.23.203 -> 253.37.253.43 TCP 127 srdp > oob-ws-http [PSH, ACK] Seq=433 Ack=1928 Win=64860 Len=69
919672 304.807720 253.241.23.203 -> 253.37.253.43 TCP 127 [TCP Retransmission] srdp > oob-ws-http [PSH, ACK] Seq=433 Ack=1928 Win=64860 Len=69
920036 304.953875 253.241.23.203 -> 253.37.253.43 TCP 64 srdp > oob-ws-http [ACK] Seq=502 Ack=2893 Win=63895 Len=0
920037 304.953880 253.241.23.203 -> 253.37.253.43 TCP 64 [TCP Dup ACK 920036#1] srdp > oob-ws-http [ACK] Seq=502 Ack=2893 Win=63895 Len=0
933910 311.175777 253.241.23.203 -> 253.37.253.43 TCP 111 srdp > oob-ws-http [PSH, ACK] Seq=502 Ack=2893 Win=63895 Len=53
933911 311.175782 253.241.23.203 -> 253.37.253.43 TCP 111 [TCP Retransmission] srdp > oob-ws-http [PSH, ACK] Seq=502 Ack=2893 Win=63895 Len=53
934704 311.391512 253.241.23.203 -> 253.37.253.43 TCP 64 srdp > oob-ws-http [ACK] Seq=555 Ack=2930 Win=63858 Len=0
934705 311.391517 253.241.23.203 -> 253.37.253.43 TCP 64 [TCP Dup ACK 934704#1] srdp > oob-ws-http [ACK] Seq=555 Ack=2930 Win=63858 Len=0
935210 311.592700 253.241.23.203 -> 253.37.253.43 TCP 64 srdp > oob-ws-http [ACK] Seq=555 Ack=4276 Win=64860 Len=0
935211 311.592704 253.241.23.203 -> 253.37.253.43 TCP 64 [TCP Dup ACK 935210#1] srdp > oob-ws-http [ACK] Seq=555 Ack=4276 Win=64860 Len=0
939731 312.823890 253.241.23.203 -> 253.37.253.43 TCP 103 srdp > oob-ws-http [PSH, ACK] Seq=555 Ack=4276 Win=64860 Len=45
939732 312.823894 253.241.23.203 -> 253.37.253.43 TCP 103 [TCP Retransmission] srdp > oob-ws-http [PSH, ACK] Seq=555 Ack=4276 Win=64860 Len=45
940616 313.000887 253.241.23.203 -> 253.37.253.43 TCP 64 srdp > oob-ws-http [ACK] Seq=600 Ack=5193 Win=63943 Len=0
940617 313.000893 253.241.23.203 -> 253.37.253.43 TCP 64 [TCP Dup ACK 940616#1] srdp > oob-ws-http [ACK] Seq=600 Ack=5193 Win=63943 Len=0
963780 320.664254 253.241.23.203 -> 253.37.253.43 TCP 103 srdp > oob-ws-http [PSH, ACK] Seq=600 Ack=5193 Win=63943 Len=45
963781 320.664258 253.241.23.203 -> 253.37.253.43 TCP 103 [TCP Retransmission] srdp > oob-ws-http [PSH, ACK] Seq=600 Ack=5193 Win=63943 Len=45
964201 320.846775 253.241.23.203 -> 253.37.253.43 TCP 64 srdp > oob-ws-http [ACK] Seq=645 Ack=5230 Win=63906 Len=0
964202 320.846780 253.241.23.203 -> 253.37.253.43 TCP 64 [TCP Dup ACK 964201#1] srdp > oob-ws-http [ACK] Seq=645 Ack=5230 Win=63906 Len=0
964587 321.047927 253.241.23.203 -> 253.37.253.43 TCP 64 srdp > oob-ws-http [ACK] Seq=645 Ack=6368 Win=64860 Len=0
964588 321.047932 253.241.23.203 -> 253.37.253.43 TCP 64 [TCP Dup ACK 964587#1] srdp > oob-ws-http [ACK] Seq=645 Ack=6368 Win=64860 Len=0
973865 324.312039 253.241.23.203 -> 253.37.253.43 TCP 103 srdp > oob-ws-http [PSH, ACK] Seq=645 Ack=6368 Win=64860 Len=45
973866 324.312044 253.241.23.203 -> 253.37.253.43 TCP 103 [TCP Retransmission] srdp > oob-ws-http [PSH, ACK] Seq=645 Ack=6368 Win=64860 Len=45
974721 324.467948 253.241.23.203 -> 253.37.253.43 TCP 64 srdp > oob-ws-http [ACK] Seq=690 Ack=6493 Win=64735 Len=0
974722 324.467953 253.241.23.203 -> 253.37.253.43 TCP 64 [TCP Dup ACK 974721#1] srdp > oob-ws-http [ACK] Seq=690 Ack=6493 Win=64735 Len=0
976466 325.271989 253.241.23.203 -> 253.37.253.43 TCP 103 srdp > oob-ws-http [PSH, ACK] Seq=690 Ack=6493 Win=64735 Len=45
976467 325.271994 253.241.23.203 -> 253.37.253.43 TCP 103 [TCP Retransmission] srdp > oob-ws-http [PSH, ACK] Seq=690 Ack=6493 Win=64735 Len=45
976842 325.473826 253.241.23.203 -> 253.37.253.43 TCP 64 srdp > oob-ws-http [ACK] Seq=735 Ack=6618 Win=64610 Len=0
976843 325.473831 253.241.23.203 -> 253.37.253.43 TCP 64 [TCP Dup ACK 976842#1] srdp > oob-ws-http [ACK] Seq=735 Ack=6618 Win=64610 Len=0
981480 327.894203 253.241.23.203 -> 253.37.253.43 TCP 95 srdp > oob-ws-http [PSH, ACK] Seq=735 Ack=6618 Win=64610 Len=37
981481 327.894207 253.241.23.203 -> 253.37.253.43 TCP 95 [TCP Retransmission] srdp > oob-ws-http [PSH, ACK] Seq=735 Ack=6618 Win=64610 Len=37
981895 328.089100 253.241.23.203 -> 253.37.253.43 TCP 64 srdp > oob-ws-http [ACK] Seq=772 Ack=6711 Win=64517 Len=0
981896 328.089105 253.241.23.203 -> 253.37.253.43 TCP 64 [TCP Dup ACK 981895#1] srdp > oob-ws-http [ACK] Seq=772 Ack=6711 Win=64517 Len=0
985367 328.994429 253.241.23.203 -> 253.37.253.43 TCP 64 srdp > oob-ws-http [ACK] Seq=772 Ack=7636 Win=63592 Len=0
985368 328.994433 253.241.23.203 -> 253.37.253.43 TCP 64 [TCP Dup ACK 985367#1] srdp > oob-ws-http [ACK] Seq=772 Ack=7636 Win=63592 Len=0
1001641 335.624189 253.241.23.203 -> 253.37.253.43 TCP 111 srdp > oob-ws-http [PSH, ACK] Seq=772 Ack=7636 Win=63592 Len=53
1001642 335.624193 253.241.23.203 -> 253.37.253.43 TCP 111 [TCP Retransmission] srdp > oob-ws-http [PSH, ACK] Seq=772 Ack=7636 Win=63592 Len=53
1002011 335.834389 253.241.23.203 -> 253.37.253.43 TCP 64 srdp > oob-ws-http [ACK] Seq=825 Ack=7673 Win=63555 Len=0
1002012 335.834394 253.241.23.203 -> 253.37.253.43 TCP 64 [TCP Dup ACK 1002011#1] srdp > oob-ws-http [ACK] Seq=825 Ack=7673 Win=63555 Len=0
1002580 336.035563 253.241.23.203 -> 253.37.253.43 TCP 64 srdp > oob-ws-http [ACK] Seq=825 Ack=9019 Win=64860 Len=0
1002581 336.035568 253.241.23.203 -> 253.37.253.43 TCP 64 [TCP Dup ACK 1002580#1] srdp > oob-ws-http [ACK] Seq=825 Ack=9019 Win=64860 Len=0
1011249 339.240258 253.241.23.203 -> 253.37.253.43 TCP 103 srdp > oob-ws-http [PSH, ACK] Seq=825 Ack=9019 Win=64860 Len=45
1011250 339.240263 253.241.23.203 -> 253.37.253.43 TCP 103 [TCP Retransmission] srdp > oob-ws-http [PSH, ACK] Seq=825 Ack=9019 Win=64860 Len=45
1011509 339.354981 253.241.23.203 -> 253.37.253.43 TCP 64 srdp > oob-ws-http [ACK] Seq=870 Ack=9936 Win=63943 Len=0
1011510 339.354987 253.241.23.203 -> 253.37.253.43 TCP 64 [TCP Dup ACK 1011509#1] srdp > oob-ws-http [ACK] Seq=870 Ack=9936 Win=63943 Len=0
1014540 341.224223 253.241.23.203 -> 253.37.253.43 TCP 103 srdp > oob-ws-http [PSH, ACK] Seq=870 Ack=9936 Win=63943 Len=45
1014541 341.224228 253.241.23.203 -> 253.37.253.43 TCP 103 [TCP Retransmission] srdp > oob-ws-http [PSH, ACK] Seq=870 Ack=9936 Win=63943 Len=45
1014691 341.366713 253.241.23.203 -> 253.37.253.43 TCP 64 srdp > oob-ws-http [ACK] Seq=915 Ack=9973 Win=63906 Len=0
1014692 341.366717 253.241.23.203 -> 253.37.253.43 TCP 64 [TCP Dup ACK 1014691#1] srdp > oob-ws-http [ACK] Seq=915 Ack=9973 Win=63906 Len=0
1014961 341.567911 253.241.23.203 -> 253.37.253.43 TCP 64 srdp > oob-ws-http [ACK] Seq=915 Ack=11111 Win=64860 Len=0
1014962 341.567916 253.241.23.203 -> 253.37.253.43 TCP 64 [TCP Dup ACK 1014961#1] srdp > oob-ws-http [ACK] Seq=915 Ack=11111 Win=64860 Len=0
