578386 183.703311 253.116.108.56 -> 253.37.253.43 TCP 66 nowcontact > telnet [SYN] Seq=0 Win=65535 Len=0 MSS=1380 SACK_PERM=1
578387 183.703316 253.116.108.56 -> 253.37.253.43 TCP 66 [TCP Out-Of-Order] nowcontact > telnet [SYN] Seq=0 Win=65535 Len=0 MSS=1380 SACK_PERM=1
578396 183.704557 253.116.108.56 -> 253.37.253.43 TCP 64 nowcontact > telnet [ACK] Seq=1 Ack=1 Win=65535 Len=0
578397 183.704562 253.116.108.56 -> 253.37.253.43 TCP 64 [TCP Dup ACK 578396#1] nowcontact > telnet [ACK] Seq=1 Ack=1 Win=65535 Len=0
578479 183.717822 253.116.108.56 -> 253.37.253.43 TCP 66 poweronnud > telnet [SYN] Seq=0 Win=65535 Len=0 MSS=1380 SACK_PERM=1
578480 183.717827 253.116.108.56 -> 253.37.253.43 TCP 66 [TCP Out-Of-Order] poweronnud > telnet [SYN] Seq=0 Win=65535 Len=0 MSS=1380 SACK_PERM=1
578498 183.719020 253.116.108.56 -> 253.37.253.43 TCP 64 poweronnud > telnet [ACK] Seq=1 Ack=1 Win=65535 Len=0
578499 183.719025 253.116.108.56 -> 253.37.253.43 TCP 64 [TCP Dup ACK 578498#1] poweronnud > telnet [ACK] Seq=1 Ack=1 Win=65535 Len=0
578811 183.822649 253.116.108.56 -> 253.37.253.43 TCP 64 nowcontact > telnet [ACK] Seq=33 Ack=49 Win=65487 Len=0
578812 183.822654 253.116.108.56 -> 253.37.253.43 TCP 64 [TCP Dup ACK 578811#1] nowcontact > telnet [ACK] Seq=33 Ack=49 Win=65487 Len=0
578985 183.923236 253.116.108.56 -> 253.37.253.43 TCP 64 poweronnud > telnet [ACK] Seq=33 Ack=49 Win=65487 Len=0
578986 183.923241 253.116.108.56 -> 253.37.253.43 TCP 64 [TCP Dup ACK 578985#1] poweronnud > telnet [ACK] Seq=33 Ack=49 Win=65487 Len=0
579187 184.023832 253.116.108.56 -> 253.37.253.43 TCP 64 nowcontact > telnet [ACK] Seq=33 Ack=308 Win=65228 Len=0
579188 184.023836 253.116.108.56 -> 253.37.253.43 TCP 64 [TCP Dup ACK 579187#1] nowcontact > telnet [ACK] Seq=33 Ack=308 Win=65228 Len=0
579349 184.124396 253.116.108.56 -> 253.37.253.43 TCP 64 poweronnud > telnet [ACK] Seq=33 Ack=308 Win=65228 Len=0
579350 184.124401 253.116.108.56 -> 253.37.253.43 TCP 64 [TCP Dup ACK 579349#1] poweronnud > telnet [ACK] Seq=33 Ack=308 Win=65228 Len=0
584615 186.297788 253.116.108.56 -> 253.37.253.43 TCP 64 poweronnud > telnet [FIN, ACK] Seq=33 Ack=308 Win=65228 Len=0
584616 186.297793 253.116.108.56 -> 253.37.253.43 TCP 64 [TCP Out-Of-Order] poweronnud > telnet [FIN, ACK] Seq=33 Ack=308 Win=65228 Len=0
584623 186.299342 253.116.108.56 -> 253.37.253.43 TCP 64 poweronnud > telnet [ACK] Seq=34 Ack=309 Win=65228 Len=0
584624 186.299347 253.116.108.56 -> 253.37.253.43 TCP 64 [TCP Dup ACK 584623#1] poweronnud > telnet [ACK] Seq=34 Ack=309 Win=65228 Len=0
589101 187.721729 253.116.108.56 -> 253.37.253.43 TCP 64 nowcontact > telnet [FIN, ACK] Seq=33 Ack=308 Win=65228 Len=0
589102 187.721733 253.116.108.56 -> 253.37.253.43 TCP 64 [TCP Out-Of-Order] nowcontact > telnet [FIN, ACK] Seq=33 Ack=308 Win=65228 Len=0
589110 187.723172 253.116.108.56 -> 253.37.253.43 TCP 64 nowcontact > telnet [ACK] Seq=34 Ack=309 Win=65228 Len=0
589111 187.723176 253.116.108.56 -> 253.37.253.43 TCP 64 [TCP Dup ACK 589110#1] nowcontact > telnet [ACK] Seq=34 Ack=309 Win=65228 Len=0
