32641  13.831104 253.37.253.31 -> 253.37.253.254 TCP 64 kvm-via-ip > 1024 [ACK] Seq=1 Ack=3 Win=64126 Len=0
215254  73.878953 253.37.253.31 -> 253.37.253.254 TCP 64 kvm-via-ip > 1024 [ACK] Seq=1 Ack=5 Win=64124 Len=0
398042 133.926796 253.37.253.31 -> 253.37.253.254 TCP 64 kvm-via-ip > 1024 [ACK] Seq=1 Ack=7 Win=64122 Len=0
580123 184.490636 253.37.253.31 -> 253.160.108.127 TCP 64 ctp > http [RST, ACK] Seq=1 Ack=1 Win=0 Len=0
603477 191.496669 253.37.253.31 -> 253.160.108.127 TCP 66 quickbooksrds > http [SYN] Seq=0 Win=65535 Len=0 MSS=1460 SACK_PERM=1
603489 191.498226 253.37.253.31 -> 253.160.108.127 TCP 64 quickbooksrds > http [ACK] Seq=1 Ack=1 Win=65535 Len=0
603517 191.500575 253.37.253.31 -> 253.160.108.127 TCP 64 quickbooksrds > http [ACK] Seq=842 Ack=1810 Win=65535 Len=0
603590 191.521743 253.37.253.31 -> 253.160.108.127 TCP 64 quickbooksrds > http [FIN, ACK] Seq=842 Ack=1810 Win=65535 Len=0
609635 193.584442 253.37.253.31 -> 253.160.108.127 TCP 66 tvnetworkvideo > http [SYN] Seq=0 Win=65535 Len=0 MSS=1460 SACK_PERM=1
609645 193.586042 253.37.253.31 -> 253.160.108.127 TCP 64 tvnetworkvideo > http [ACK] Seq=1 Ack=1 Win=65535 Len=0
611171 193.974640 253.37.253.31 -> 253.37.253.254 TCP 64 kvm-via-ip > 1024 [ACK] Seq=1 Ack=9 Win=64120 Len=0
784199 254.022499 253.37.253.31 -> 253.37.253.254 TCP 64 kvm-via-ip > 1024 [ACK] Seq=1 Ack=11 Win=64118 Len=0
946243 314.070349 253.37.253.31 -> 253.37.253.254 TCP 64 kvm-via-ip > 1024 [ACK] Seq=1 Ack=13 Win=64116 Len=0
