836451 273.921897 253.197.40.108 -> 253.37.253.43 TCP 66 empire-empuma > telnet [SYN] Seq=0 Win=64512 Len=0 MSS=1380 SACK_PERM=1
836452 273.921901 253.197.40.108 -> 253.37.253.43 TCP 66 [TCP Out-Of-Order] empire-empuma > telnet [SYN] Seq=0 Win=64512 Len=0 MSS=1380 SACK_PERM=1
836461 273.923200 253.197.40.108 -> 253.37.253.43 TCP 64 empire-empuma > telnet [ACK] Seq=1 Ack=1 Win=64860 Len=0
836462 273.923205 253.197.40.108 -> 253.37.253.43 TCP 64 [TCP Dup ACK 836461#1] empire-empuma > telnet [ACK] Seq=1 Ack=1 Win=64860 Len=0
836858 274.079009 253.197.40.108 -> 253.37.253.43 TCP 64 empire-empuma > telnet [ACK] Seq=33 Ack=49 Win=64812 Len=0
836859 274.079013 253.197.40.108 -> 253.37.253.43 TCP 64 [TCP Dup ACK 836858#1] empire-empuma > telnet [ACK] Seq=33 Ack=49 Win=64812 Len=0
837239 274.280170 253.197.40.108 -> 253.37.253.43 TCP 64 empire-empuma > telnet [ACK] Seq=33 Ack=308 Win=64553 Len=0
837240 274.280175 253.197.40.108 -> 253.37.253.43 TCP 64 [TCP Dup ACK 837239#1] empire-empuma > telnet [ACK] Seq=33 Ack=308 Win=64553 Len=0
842047 276.593724 253.197.40.108 -> 253.37.253.43 TCP 64 empire-empuma > telnet [ACK] Seq=49 Ack=316 Win=64545 Len=0
842048 276.593729 253.197.40.108 -> 253.37.253.43 TCP 64 [TCP Dup ACK 842047#1] empire-empuma > telnet [ACK] Seq=49 Ack=316 Win=64545 Len=0
842273 276.794932 253.197.40.108 -> 253.37.253.43 TCP 64 empire-empuma > telnet [ACK] Seq=49 Ack=788 Win=64073 Len=0
842274 276.794937 253.197.40.108 -> 253.37.253.43 TCP 64 [TCP Dup ACK 842273#1] empire-empuma > telnet [ACK] Seq=49 Ack=788 Win=64073 Len=0
852217 281.623218 253.197.40.108 -> 253.37.253.43 TCP 64 empire-empuma > telnet [ACK] Seq=86 Ack=1966 Win=64860 Len=0
852218 281.623223 253.197.40.108 -> 253.37.253.43 TCP 64 [TCP Dup ACK 852217#1] empire-empuma > telnet [ACK] Seq=86 Ack=1966 Win=64860 Len=0
874653 289.569749 253.197.40.108 -> 253.37.253.43 TCP 64 empire-empuma > telnet [ACK] Seq=106 Ack=2027 Win=64799 Len=0
874654 289.569754 253.197.40.108 -> 253.37.253.43 TCP 64 [TCP Dup ACK 874653#1] empire-empuma > telnet [ACK] Seq=106 Ack=2027 Win=64799 Len=0
910134 300.735134 253.197.40.108 -> 253.37.253.43 TCP 64 empire-empuma > telnet [ACK] Seq=126 Ack=2068 Win=64758 Len=0
910135 300.735141 253.197.40.108 -> 253.37.253.43 TCP 64 [TCP Dup ACK 910134#1] empire-empuma > telnet [ACK] Seq=126 Ack=2068 Win=64758 Len=0
928319 309.285186 253.197.40.108 -> 253.37.253.43 TCP 64 empire-empuma > telnet [ACK] Seq=151 Ack=2077 Win=64749 Len=0
928320 309.285191 253.197.40.108 -> 253.37.253.43 TCP 64 [TCP Dup ACK 928319#1] empire-empuma > telnet [ACK] Seq=151 Ack=2077 Win=64749 Len=0
928817 309.486370 253.197.40.108 -> 253.37.253.43 TCP 64 empire-empuma > telnet [ACK] Seq=151 Ack=2086 Win=64740 Len=0
928818 309.486375 253.197.40.108 -> 253.37.253.43 TCP 64 [TCP Dup ACK 928817#1] empire-empuma > telnet [ACK] Seq=151 Ack=2086 Win=64740 Len=0
929414 309.687640 253.197.40.108 -> 253.37.253.43 TCP 64 empire-empuma > telnet [ACK] Seq=151 Ack=3250 Win=63576 Len=0
929415 309.687645 253.197.40.108 -> 253.37.253.43 TCP 64 [TCP Dup ACK 929414#1] empire-empuma > telnet [ACK] Seq=151 Ack=3250 Win=63576 Len=0
955258 316.829419 253.197.40.108 -> 253.37.253.43 TCP 64 empire-empuma > telnet [ACK] Seq=166 Ack=4232 Win=64860 Len=0
955259 316.829424 253.197.40.108 -> 253.37.253.43 TCP 64 [TCP Dup ACK 955258#1] empire-empuma > telnet [ACK] Seq=166 Ack=4232 Win=64860 Len=0
960444 319.042380 253.197.40.108 -> 253.37.253.43 TCP 64 empire-empuma > telnet [ACK] Seq=181 Ack=4241 Win=64851 Len=0
960445 319.042385 253.197.40.108 -> 253.37.253.43 TCP 64 [TCP Dup ACK 960444#1] empire-empuma > telnet [ACK] Seq=181 Ack=4241 Win=64851 Len=0
960868 319.243502 253.197.40.108 -> 253.37.253.43 TCP 64 empire-empuma > telnet [ACK] Seq=181 Ack=5319 Win=63773 Len=0
960869 319.243506 253.197.40.108 -> 253.37.253.43 TCP 64 [TCP Dup ACK 960868#1] empire-empuma > telnet [ACK] Seq=181 Ack=5319 Win=63773 Len=0
971343 323.971207 253.197.40.108 -> 253.37.253.43 TCP 64 empire-empuma > telnet [ACK] Seq=196 Ack=5948 Win=64860 Len=0
971344 323.971212 253.197.40.108 -> 253.37.253.43 TCP 64 [TCP Dup ACK 971343#1] empire-empuma > telnet [ACK] Seq=196 Ack=5948 Win=64860 Len=0
997602 333.426585 253.197.40.108 -> 253.37.253.43 TCP 64 empire-empuma > telnet [ACK] Seq=206 Ack=6969 Win=63839 Len=0
997603 333.426589 253.197.40.108 -> 253.37.253.43 TCP 64 [TCP Dup ACK 997602#1] empire-empuma > telnet [ACK] Seq=206 Ack=6969 Win=63839 Len=0
998777 333.929524 253.197.40.108 -> 253.37.253.43 TCP 64 empire-empuma > telnet [ACK] Seq=216 Ack=8096 Win=64860 Len=0
998778 333.929529 253.197.40.108 -> 253.37.253.43 TCP 64 [TCP Dup ACK 998777#1] empire-empuma > telnet [ACK] Seq=216 Ack=8096 Win=64860 Len=0
1001079 335.136603 253.197.40.108 -> 253.37.253.43 TCP 64 empire-empuma > telnet [ACK] Seq=226 Ack=9235 Win=63721 Len=0
1001080 335.136608 253.197.40.108 -> 253.37.253.43 TCP 64 [TCP Dup ACK 1001079#1] empire-empuma > telnet [ACK] Seq=226 Ack=9235 Win=63721 Len=0
