413048 137.899359 253.75.165.224 -> 253.37.253.43 TCP 64 sdserver > telnet [ACK] Seq=1031 Ack=100115 Win=64591 Len=0
413049 137.899365 253.75.165.224 -> 253.37.253.43 TCP 64 [TCP Dup ACK 413048#1] sdserver > telnet [ACK] Seq=1031 Ack=100115 Win=64591 Len=0
414889 138.502867 253.75.165.224 -> 253.37.253.43 TCP 64 sdserver > telnet [ACK] Seq=1041 Ack=101150 Win=65535 Len=0
414890 138.502873 253.75.165.224 -> 253.37.253.43 TCP 64 [TCP Dup ACK 414889#1] sdserver > telnet [ACK] Seq=1041 Ack=101150 Win=65535 Len=0
417390 138.906188 253.75.165.224 -> 253.37.253.43 TCP 64 sdserver > telnet [ACK] Seq=1051 Ack=102114 Win=64571 Len=0
417391 138.906193 253.75.165.224 -> 253.37.253.43 TCP 64 [TCP Dup ACK 417390#1] sdserver > telnet [ACK] Seq=1051 Ack=102114 Win=64571 Len=0
422371 139.312456 253.75.165.224 -> 253.37.253.43 TCP 64 sdserver > telnet [ACK] Seq=1061 Ack=103182 Win=65535 Len=0
422372 139.312460 253.75.165.224 -> 253.37.253.43 TCP 64 [TCP Dup ACK 422371#1] sdserver > telnet [ACK] Seq=1061 Ack=103182 Win=65535 Len=0
425627 139.711971 253.75.165.224 -> 253.37.253.43 TCP 64 sdserver > telnet [ACK] Seq=1071 Ack=104379 Win=64338 Len=0
425628 139.711976 253.75.165.224 -> 253.37.253.43 TCP 64 [TCP Dup ACK 425627#1] sdserver > telnet [ACK] Seq=1071 Ack=104379 Win=64338 Len=0
431100 140.819245 253.75.165.224 -> 253.37.253.43 TCP 64 sdserver > telnet [ACK] Seq=1081 Ack=105587 Win=65535 Len=0
431101 140.819250 253.75.165.224 -> 253.37.253.43 TCP 64 [TCP Dup ACK 431100#1] sdserver > telnet [ACK] Seq=1081 Ack=105587 Win=65535 Len=0
440860 143.532110 253.75.165.224 -> 253.37.253.43 TCP 64 sdserver > telnet [ACK] Seq=1097 Ack=106780 Win=64342 Len=0
440861 143.532114 253.75.165.224 -> 253.37.253.43 TCP 64 [TCP Dup ACK 440860#1] sdserver > telnet [ACK] Seq=1097 Ack=106780 Win=64342 Len=0
442359 144.035047 253.75.165.224 -> 253.37.253.43 TCP 64 sdserver > telnet [ACK] Seq=1107 Ack=107534 Win=65535 Len=0
442360 144.035052 253.75.165.224 -> 253.37.253.43 TCP 64 [TCP Dup ACK 442359#1] sdserver > telnet [ACK] Seq=1107 Ack=107534 Win=65535 Len=0
443095 144.236216 253.75.165.224 -> 253.37.253.43 TCP 64 sdserver > telnet [ACK] Seq=1117 Ack=108461 Win=64608 Len=0
443096 144.236220 253.75.165.224 -> 253.37.253.43 TCP 64 [TCP Dup ACK 443095#1] sdserver > telnet [ACK] Seq=1117 Ack=108461 Win=64608 Len=0
444262 144.640528 253.75.165.224 -> 253.37.253.43 TCP 64 sdserver > telnet [ACK] Seq=1127 Ack=109099 Win=65535 Len=0
444263 144.640535 253.75.165.224 -> 253.37.253.43 TCP 64 [TCP Dup ACK 444262#1] sdserver > telnet [ACK] Seq=1127 Ack=109099 Win=65535 Len=0
447165 145.248910 253.75.165.224 -> 253.37.253.43 TCP 64 sdserver > telnet [ACK] Seq=1137 Ack=110026 Win=64608 Len=0
447166 145.248915 253.75.165.224 -> 253.37.253.43 TCP 64 [TCP Dup ACK 447165#1] sdserver > telnet [ACK] Seq=1137 Ack=110026 Win=64608 Len=0
447954 145.546765 253.75.165.224 -> 253.37.253.43 TCP 64 sdserver > telnet [ACK] Seq=1147 Ack=110664 Win=65535 Len=0
447955 145.546769 253.75.165.224 -> 253.37.253.43 TCP 64 [TCP Dup ACK 447954#1] sdserver > telnet [ACK] Seq=1147 Ack=110664 Win=65535 Len=0
450505 146.549665 253.75.165.224 -> 253.37.253.43 TCP 64 sdserver > telnet [ACK] Seq=1157 Ack=111591 Win=64608 Len=0
450506 146.549670 253.75.165.224 -> 253.37.253.43 TCP 64 [TCP Dup ACK 450505#1] sdserver > telnet [ACK] Seq=1157 Ack=111591 Win=64608 Len=0
451490 147.052603 253.75.165.224 -> 253.37.253.43 TCP 64 sdserver > telnet [ACK] Seq=1167 Ack=112229 Win=65535 Len=0
451491 147.052607 253.75.165.224 -> 253.37.253.43 TCP 64 [TCP Dup ACK 451490#1] sdserver > telnet [ACK] Seq=1167 Ack=112229 Win=65535 Len=0
453117 147.756715 253.75.165.224 -> 253.37.253.43 TCP 64 sdserver > telnet [ACK] Seq=1177 Ack=113156 Win=64608 Len=0
453118 147.756720 253.75.165.224 -> 253.37.253.43 TCP 64 [TCP Dup ACK 453117#1] sdserver > telnet [ACK] Seq=1177 Ack=113156 Win=64608 Len=0
456324 148.963720 253.75.165.224 -> 253.37.253.43 TCP 64 sdserver > telnet [ACK] Seq=1187 Ack=114364 Win=65535 Len=0
456325 148.963724 253.75.165.224 -> 253.37.253.43 TCP 64 [TCP Dup ACK 456324#1] sdserver > telnet [ACK] Seq=1187 Ack=114364 Win=65535 Len=0
463351 152.187299 253.75.165.224 -> 253.37.253.43 TCP 64 sdserver > telnet [ACK] Seq=1197 Ack=115373 Win=64526 Len=0
463352 152.187303 253.75.165.224 -> 253.37.253.43 TCP 64 [TCP Dup ACK 463351#1] sdserver > telnet [ACK] Seq=1197 Ack=115373 Win=64526 Len=0
851385 281.338592 253.75.165.224 -> 253.37.253.43 TCP 64 sdserver > telnet [ACK] Seq=1207 Ack=116369 Win=65535 Len=0
851386 281.338597 253.75.165.224 -> 253.37.253.43 TCP 64 [TCP Dup ACK 851385#1] sdserver > telnet [ACK] Seq=1207 Ack=116369 Win=65535 Len=0
857777 283.452835 253.75.165.224 -> 253.37.253.43 TCP 64 sdserver > telnet [ACK] Seq=1217 Ack=117353 Win=64551 Len=0
857778 283.452840 253.75.165.224 -> 253.37.253.43 TCP 64 [TCP Dup ACK 857777#1] sdserver > telnet [ACK] Seq=1217 Ack=117353 Win=64551 Len=0
865934 286.265290 253.75.165.224 -> 253.37.253.43 TCP 64 sdserver > telnet [ACK] Seq=1233 Ack=118564 Win=65535 Len=0
865935 286.265295 253.75.165.224 -> 253.37.253.43 TCP 64 [TCP Dup ACK 865934#1] sdserver > telnet [ACK] Seq=1233 Ack=118564 Win=65535 Len=0
867365 286.766274 253.75.165.224 -> 253.37.253.43 TCP 64 sdserver > telnet [ACK] Seq=1243 Ack=119492 Win=64607 Len=0
867366 286.766279 253.75.165.224 -> 253.37.253.43 TCP 64 [TCP Dup ACK 867365#1] sdserver > telnet [ACK] Seq=1243 Ack=119492 Win=64607 Len=0
868187 286.967462 253.75.165.224 -> 253.37.253.43 TCP 64 sdserver > telnet [ACK] Seq=1253 Ack=120436 Win=65535 Len=0
868188 286.967466 253.75.165.224 -> 253.37.253.43 TCP 64 [TCP Dup ACK 868187#1] sdserver > telnet [ACK] Seq=1253 Ack=120436 Win=65535 Len=0
869294 287.372707 253.75.165.224 -> 253.37.253.43 TCP 64 sdserver > telnet [ACK] Seq=1263 Ack=121380 Win=64591 Len=0
869295 287.372711 253.75.165.224 -> 253.37.253.43 TCP 64 [TCP Dup ACK 869294#1] sdserver > telnet [ACK] Seq=1263 Ack=121380 Win=64591 Len=0
869791 287.572909 253.75.165.224 -> 253.37.253.43 TCP 64 sdserver > telnet [ACK] Seq=1273 Ack=122448 Win=65535 Len=0
869792 287.572913 253.75.165.224 -> 253.37.253.43 TCP 64 [TCP Dup ACK 869791#1] sdserver > telnet [ACK] Seq=1273 Ack=122448 Win=65535 Len=0
870221 287.777975 253.75.165.224 -> 253.37.253.43 TCP 64 sdserver > telnet [ACK] Seq=1283 Ack=123645 Win=64338 Len=0
870222 287.777980 253.75.165.224 -> 253.37.253.43 TCP 64 [TCP Dup ACK 870221#1] sdserver > telnet [ACK] Seq=1283 Ack=123645 Win=64338 Len=0
877353 290.896122 253.75.165.224 -> 253.37.253.43 TCP 64 sdserver > telnet [ACK] Seq=1293 Ack=124629 Win=65535 Len=0
877354 290.896127 253.75.165.224 -> 253.37.253.43 TCP 64 [TCP Dup ACK 877353#1] sdserver > telnet [ACK] Seq=1293 Ack=124629 Win=65535 Len=0
878239 291.493817 253.75.165.224 -> 253.37.253.43 TCP 64 sdserver > telnet [ACK] Seq=1303 Ack=125826 Win=64338 Len=0
878240 291.493821 253.75.165.224 -> 253.37.253.43 TCP 64 [TCP Dup ACK 878239#1] sdserver > telnet [ACK] Seq=1303 Ack=125826 Win=64338 Len=0
895455 296.227159 253.75.165.224 -> 253.37.253.43 TCP 64 sdserver > telnet [ACK] Seq=1313 Ack=127034 Win=65535 Len=0
895456 296.227164 253.75.165.224 -> 253.37.253.43 TCP 64 [TCP Dup ACK 895455#1] sdserver > telnet [ACK] Seq=1313 Ack=127034 Win=65535 Len=0
911025 301.357012 253.75.165.224 -> 253.37.253.43 TCP 64 sdserver > telnet [ACK] Seq=1329 Ack=128227 Win=64342 Len=0
911026 301.357017 253.75.165.224 -> 253.37.253.43 TCP 64 [TCP Dup ACK 911025#1] sdserver > telnet [ACK] Seq=1329 Ack=128227 Win=64342 Len=0
913300 302.463404 253.75.165.224 -> 253.37.253.43 TCP 64 sdserver > telnet [ACK] Seq=1339 Ack=128981 Win=65535 Len=0
913301 302.463408 253.75.165.224 -> 253.37.253.43 TCP 64 [TCP Dup ACK 913300#1] sdserver > telnet [ACK] Seq=1339 Ack=128981 Win=65535 Len=0
914052 302.760266 253.75.165.224 -> 253.37.253.43 TCP 64 sdserver > telnet [ACK] Seq=1349 Ack=129908 Win=64608 Len=0
914053 302.760271 253.75.165.224 -> 253.37.253.43 TCP 64 [TCP Dup ACK 914052#1] sdserver > telnet [ACK] Seq=1349 Ack=129908 Win=64608 Len=0
914728 303.061065 253.75.165.224 -> 253.37.253.43 TCP 64 sdserver > telnet [ACK] Seq=1359 Ack=130546 Win=65535 Len=0
914729 303.061069 253.75.165.224 -> 253.37.253.43 TCP 64 [TCP Dup ACK 914728#1] sdserver > telnet [ACK] Seq=1359 Ack=130546 Win=65535 Len=0
915120 303.368666 253.75.165.224 -> 253.37.253.43 TCP 64 sdserver > telnet [ACK] Seq=1369 Ack=131275 Win=64806 Len=0
915121 303.368670 253.75.165.224 -> 253.37.253.43 TCP 64 [TCP Dup ACK 915120#1] sdserver > telnet [ACK] Seq=1369 Ack=131275 Win=64806 Len=0
916262 304.168474 253.75.165.224 -> 253.37.253.43 TCP 64 sdserver > telnet [ACK] Seq=1379 Ack=132222 Win=65535 Len=0
916263 304.168479 253.75.165.224 -> 253.37.253.43 TCP 64 [TCP Dup ACK 916262#1] sdserver > telnet [ACK] Seq=1379 Ack=132222 Win=65535 Len=0
919841 304.871596 253.75.165.224 -> 253.37.253.43 TCP 64 sdserver > telnet [ACK] Seq=1389 Ack=133430 Win=64327 Len=0
919842 304.871601 253.75.165.224 -> 253.37.253.43 TCP 64 [TCP Dup ACK 919841#1] sdserver > telnet [ACK] Seq=1389 Ack=133430 Win=64327 Len=0
929839 309.803219 253.75.165.224 -> 253.37.253.43 TCP 64 sdserver > telnet [ACK] Seq=1399 Ack=134439 Win=65535 Len=0
929840 309.803224 253.75.165.224 -> 253.37.253.43 TCP 64 [TCP Dup ACK 929839#1] sdserver > telnet [ACK] Seq=1399 Ack=134439 Win=65535 Len=0
943456 313.421345 253.75.165.224 -> 253.37.253.43 TCP 64 sdserver > telnet [ACK] Seq=1415 Ack=135646 Win=64328 Len=0
943457 313.421349 253.75.165.224 -> 253.37.253.43 TCP 64 [TCP Dup ACK 943456#1] sdserver > telnet [ACK] Seq=1415 Ack=135646 Win=64328 Len=0
945684 313.925933 253.75.165.224 -> 253.37.253.43 TCP 64 sdserver > telnet [ACK] Seq=1425 Ack=136499 Win=65535 Len=0
945685 313.925937 253.75.165.224 -> 253.37.253.43 TCP 64 [TCP Dup ACK 945684#1] sdserver > telnet [ACK] Seq=1425 Ack=136499 Win=65535 Len=0
946338 314.125438 253.75.165.224 -> 253.37.253.43 TCP 64 sdserver > telnet [ACK] Seq=1435 Ack=137652 Win=64382 Len=0
946339 314.125443 253.75.165.224 -> 253.37.253.43 TCP 64 [TCP Dup ACK 946338#1] sdserver > telnet [ACK] Seq=1435 Ack=137652 Win=64382 Len=0
952673 315.936926 253.75.165.224 -> 253.37.253.43 TCP 64 sdserver > telnet [ACK] Seq=1445 Ack=138627 Win=65535 Len=0
952674 315.936931 253.75.165.224 -> 253.37.253.43 TCP 64 [TCP Dup ACK 952673#1] sdserver > telnet [ACK] Seq=1445 Ack=138627 Win=65535 Len=0
955269 316.841215 253.75.165.224 -> 253.37.253.43 TCP 64 sdserver > telnet [ACK] Seq=1455 Ack=139671 Win=64491 Len=0
955270 316.841220 253.75.165.224 -> 253.37.253.43 TCP 64 [TCP Dup ACK 955269#1] sdserver > telnet [ACK] Seq=1455 Ack=139671 Win=64491 Len=0
956477 317.444746 253.75.165.224 -> 253.37.253.43 TCP 64 sdserver > telnet [ACK] Seq=1465 Ack=140401 Win=65535 Len=0
956478 317.444751 253.75.165.224 -> 253.37.253.43 TCP 64 [TCP Dup ACK 956477#1] sdserver > telnet [ACK] Seq=1465 Ack=140401 Win=65535 Len=0
957393 317.847082 253.75.165.224 -> 253.37.253.43 TCP 64 sdserver > telnet [ACK] Seq=1475 Ack=141554 Win=64382 Len=0
957394 317.847087 253.75.165.224 -> 253.37.253.43 TCP 64 [TCP Dup ACK 957393#1] sdserver > telnet [ACK] Seq=1475 Ack=141554 Win=64382 Len=0
