670197 208.753117 253.180.108.204 -> 253.37.253.43 TCP 64 tsp > telnet [ACK] Seq=1 Ack=10 Win=64846 Len=0
670198 208.753122 253.180.108.204 -> 253.37.253.43 TCP 64 [TCP Dup ACK 670197#1] tsp > telnet [ACK] Seq=1 Ack=10 Win=64846 Len=0
670200 208.755410 253.180.108.204 -> 253.37.253.43 TCP 64 tsp > telnet [FIN, ACK] Seq=1 Ack=10 Win=64846 Len=0
670201 208.755415 253.180.108.204 -> 253.37.253.43 TCP 64 [TCP Out-Of-Order] tsp > telnet [FIN, ACK] Seq=1 Ack=10 Win=64846 Len=0
670218 208.766889 253.180.108.204 -> 253.37.253.43 TCP 66 talarian-mcast5 > telnet [SYN] Seq=0 Win=64512 Len=0 MSS=1380 SACK_PERM=1
670219 208.766894 253.180.108.204 -> 253.37.253.43 TCP 66 [TCP Out-Of-Order] talarian-mcast5 > telnet [SYN] Seq=0 Win=64512 Len=0 MSS=1380 SACK_PERM=1
670232 208.768430 253.180.108.204 -> 253.37.253.43 TCP 64 talarian-mcast5 > telnet [ACK] Seq=1 Ack=1 Win=64860 Len=0
670233 208.768435 253.180.108.204 -> 253.37.253.43 TCP 64 [TCP Dup ACK 670232#1] talarian-mcast5 > telnet [ACK] Seq=1 Ack=1 Win=64860 Len=0
670869 208.967712 253.180.108.204 -> 253.37.253.43 TCP 64 talarian-mcast5 > telnet [ACK] Seq=33 Ack=49 Win=64812 Len=0
670870 208.967716 253.180.108.204 -> 253.37.253.43 TCP 64 [TCP Dup ACK 670869#1] talarian-mcast5 > telnet [ACK] Seq=33 Ack=49 Win=64812 Len=0
671519 209.167700 253.180.108.204 -> 253.37.253.43 TCP 64 talarian-mcast5 > telnet [ACK] Seq=33 Ack=308 Win=64553 Len=0
671520 209.167704 253.180.108.204 -> 253.37.253.43 TCP 64 [TCP Dup ACK 671519#1] talarian-mcast5 > telnet [ACK] Seq=33 Ack=308 Win=64553 Len=0
691181 217.969597 253.180.108.204 -> 253.37.253.43 TCP 64 splitlock-gw > telnet [ACK] Seq=11 Ack=2524 Win=64860 Len=0
691182 217.969602 253.180.108.204 -> 253.37.253.43 TCP 64 [TCP Dup ACK 691181#1] splitlock-gw > telnet [ACK] Seq=11 Ack=2524 Win=64860 Len=0
694666 219.865538 253.180.108.204 -> 253.37.253.43 TCP 64 splitlock-gw > telnet [ACK] Seq=29 Ack=4523 Win=64860 Len=0
694667 219.865542 253.180.108.204 -> 253.37.253.43 TCP 64 [TCP Dup ACK 694666#1] splitlock-gw > telnet [ACK] Seq=29 Ack=4523 Win=64860 Len=0
