525444 170.619351 253.213.108.75 -> 253.37.253.43 TCP 64 nbx-cc > telnet [ACK] Seq=34 Ack=998 Win=65535 Len=0
525445 170.619355 253.213.108.75 -> 253.37.253.43 TCP 64 [TCP Dup ACK 525444#1] nbx-cc > telnet [ACK] Seq=34 Ack=998 Win=65535 Len=0
527996 171.524593 253.213.108.75 -> 253.37.253.43 TCP 64 nbx-cc > telnet [ACK] Seq=44 Ack=2318 Win=64215 Len=0
527997 171.524598 253.213.108.75 -> 253.37.253.43 TCP 64 [TCP Dup ACK 527996#1] nbx-cc > telnet [ACK] Seq=44 Ack=2318 Win=64215 Len=0
528522 171.725794 253.213.108.75 -> 253.37.253.43 TCP 64 nbx-cc > telnet [ACK] Seq=54 Ack=3454 Win=65535 Len=0
528523 171.725799 253.213.108.75 -> 253.37.253.43 TCP 64 [TCP Dup ACK 528522#1] nbx-cc > telnet [ACK] Seq=54 Ack=3454 Win=65535 Len=0
536226 173.636893 253.213.108.75 -> 253.37.253.43 TCP 64 nbx-cc > telnet [ACK] Seq=72 Ack=4214 Win=64775 Len=0
536227 173.636898 253.213.108.75 -> 253.37.253.43 TCP 64 [TCP Dup ACK 536226#1] nbx-cc > telnet [ACK] Seq=72 Ack=4214 Win=64775 Len=0
630404 199.789067 253.213.108.75 -> 253.37.253.43 TCP 64 nbx-cc > telnet [ACK] Seq=82 Ack=5154 Win=65535 Len=0
630405 199.789072 253.213.108.75 -> 253.37.253.43 TCP 64 [TCP Dup ACK 630404#1] nbx-cc > telnet [ACK] Seq=82 Ack=5154 Win=65535 Len=0
656927 205.924931 253.213.108.75 -> 253.37.253.43 TCP 64 nbx-cc > telnet [ACK] Seq=127 Ack=5909 Win=64780 Len=0
656928 205.924935 253.213.108.75 -> 253.37.253.43 TCP 64 [TCP Dup ACK 656927#1] nbx-cc > telnet [ACK] Seq=127 Ack=5909 Win=64780 Len=0
659491 206.226512 253.213.108.75 -> 253.37.253.43 TCP 64 nbx-cc > telnet [ACK] Seq=137 Ack=6653 Win=65535 Len=0
659492 206.226516 253.213.108.75 -> 253.37.253.43 TCP 64 [TCP Dup ACK 659491#1] nbx-cc > telnet [ACK] Seq=137 Ack=6653 Win=65535 Len=0
697999 221.213780 253.213.108.75 -> 253.37.253.43 TCP 64 nbx-cc > telnet [ACK] Seq=182 Ack=7412 Win=64776 Len=0
698000 221.213784 253.213.108.75 -> 253.37.253.43 TCP 64 [TCP Dup ACK 697999#1] nbx-cc > telnet [ACK] Seq=182 Ack=7412 Win=64776 Len=0
698543 221.515502 253.213.108.75 -> 253.37.253.43 TCP 64 nbx-cc > telnet [ACK] Seq=192 Ack=8151 Win=65535 Len=0
698544 221.515507 253.213.108.75 -> 253.37.253.43 TCP 64 [TCP Dup ACK 698543#1] nbx-cc > telnet [ACK] Seq=192 Ack=8151 Win=65535 Len=0
700237 222.119016 253.213.108.75 -> 253.37.253.43 TCP 64 nbx-cc > telnet [ACK] Seq=202 Ack=9143 Win=64543 Len=0
700238 222.119021 253.213.108.75 -> 253.37.253.43 TCP 64 [TCP Dup ACK 700237#1] nbx-cc > telnet [ACK] Seq=202 Ack=9143 Win=64543 Len=0
703184 223.627828 253.213.108.75 -> 253.37.253.43 TCP 64 nbx-cc > telnet [ACK] Seq=212 Ack=9989 Win=65535 Len=0
703185 223.627833 253.213.108.75 -> 253.37.253.43 TCP 64 [TCP Dup ACK 703184#1] nbx-cc > telnet [ACK] Seq=212 Ack=9989 Win=65535 Len=0
739962 236.100386 253.213.108.75 -> 253.37.253.43 TCP 64 nbx-cc > telnet [ACK] Seq=245 Ack=11017 Win=64507 Len=0
739963 236.100391 253.213.108.75 -> 253.37.253.43 TCP 64 [TCP Dup ACK 739962#1] nbx-cc > telnet [ACK] Seq=245 Ack=11017 Win=64507 Len=0
742258 237.407976 253.213.108.75 -> 253.37.253.43 TCP 64 nbx-cc > telnet [ACK] Seq=255 Ack=12337 Win=65535 Len=0
742259 237.407981 253.213.108.75 -> 253.37.253.43 TCP 64 [TCP Dup ACK 742258#1] nbx-cc > telnet [ACK] Seq=255 Ack=12337 Win=65535 Len=0
760663 245.354232 253.213.108.75 -> 253.37.253.43 TCP 64 nbx-cc > telnet [ACK] Seq=265 Ack=13473 Win=64399 Len=0
760664 245.354236 253.213.108.75 -> 253.37.253.43 TCP 64 [TCP Dup ACK 760663#1] nbx-cc > telnet [ACK] Seq=265 Ack=13473 Win=64399 Len=0
765990 247.567114 253.213.108.75 -> 253.37.253.43 TCP 64 nbx-cc > telnet [ACK] Seq=283 Ack=14282 Win=65535 Len=0
765991 247.567118 253.213.108.75 -> 253.37.253.43 TCP 64 [TCP Dup ACK 765990#1] nbx-cc > telnet [ACK] Seq=283 Ack=14282 Win=65535 Len=0
797831 260.240919 253.213.108.75 -> 253.37.253.43 TCP 64 nbx-cc > telnet [ACK] Seq=293 Ack=15218 Win=64599 Len=0
797832 260.240924 253.213.108.75 -> 253.37.253.43 TCP 64 [TCP Dup ACK 797831#1] nbx-cc > telnet [ACK] Seq=293 Ack=15218 Win=64599 Len=0
838194 274.624572 253.213.108.75 -> 253.37.253.43 TCP 64 nbx-cc > telnet [ACK] Seq=338 Ack=15969 Win=65535 Len=0
838195 274.624576 253.213.108.75 -> 253.37.253.43 TCP 64 [TCP Dup ACK 838194#1] nbx-cc > telnet [ACK] Seq=338 Ack=15969 Win=65535 Len=0
839853 275.328669 253.213.108.75 -> 253.37.253.43 TCP 64 nbx-cc > telnet [ACK] Seq=348 Ack=16704 Win=64800 Len=0
839854 275.328673 253.213.108.75 -> 253.37.253.43 TCP 64 [TCP Dup ACK 839853#1] nbx-cc > telnet [ACK] Seq=348 Ack=16704 Win=64800 Len=0
841279 276.032766 253.213.108.75 -> 253.37.253.43 TCP 64 nbx-cc > telnet [ACK] Seq=358 Ack=17727 Win=65535 Len=0
841280 276.032772 253.213.108.75 -> 253.37.253.43 TCP 64 [TCP Dup ACK 841279#1] nbx-cc > telnet [ACK] Seq=358 Ack=17727 Win=65535 Len=0
842171 276.736858 253.213.108.75 -> 253.37.253.43 TCP 64 nbx-cc > telnet [ACK] Seq=368 Ack=18573 Win=64689 Len=0
842172 276.736865 253.213.108.75 -> 253.37.253.43 TCP 64 [TCP Dup ACK 842171#1] nbx-cc > telnet [ACK] Seq=368 Ack=18573 Win=64689 Len=0
877273 290.818894 253.213.108.75 -> 253.37.253.43 TCP 64 nbx-cc > telnet [ACK] Seq=401 Ack=19570 Win=65535 Len=0
877274 290.818899 253.213.108.75 -> 253.37.253.43 TCP 64 [TCP Dup ACK 877273#1] nbx-cc > telnet [ACK] Seq=401 Ack=19570 Win=65535 Len=0
878567 291.824661 253.213.108.75 -> 253.37.253.43 TCP 64 nbx-cc > telnet [ACK] Seq=411 Ack=20890 Win=64215 Len=0
878568 291.824665 253.213.108.75 -> 253.37.253.43 TCP 64 [TCP Dup ACK 878567#1] nbx-cc > telnet [ACK] Seq=411 Ack=20890 Win=64215 Len=0
888130 294.439896 253.213.108.75 -> 253.37.253.43 TCP 64 nbx-cc > telnet [ACK] Seq=421 Ack=22026 Win=65535 Len=0
888131 294.439900 253.213.108.75 -> 253.37.253.43 TCP 64 [TCP Dup ACK 888130#1] nbx-cc > telnet [ACK] Seq=421 Ack=22026 Win=65535 Len=0
895918 296.350971 253.213.108.75 -> 253.37.253.43 TCP 64 nbx-cc > telnet [ACK] Seq=439 Ack=22783 Win=64778 Len=0
895919 296.350976 253.213.108.75 -> 253.37.253.43 TCP 64 [TCP Dup ACK 895918#1] nbx-cc > telnet [ACK] Seq=439 Ack=22783 Win=64778 Len=0
960561 319.083354 253.213.108.75 -> 253.37.253.43 TCP 64 nbx-cc > telnet [ACK] Seq=449 Ack=23723 Win=65535 Len=0
960562 319.083359 253.213.108.75 -> 253.37.253.43 TCP 64 [TCP Dup ACK 960561#1] nbx-cc > telnet [ACK] Seq=449 Ack=23723 Win=65535 Len=0
978589 326.023698 253.213.108.75 -> 253.37.253.43 TCP 64 nbx-cc > telnet [ACK] Seq=494 Ack=24478 Win=64780 Len=0
978590 326.023703 253.213.108.75 -> 253.37.253.43 TCP 64 [TCP Dup ACK 978589#1] nbx-cc > telnet [ACK] Seq=494 Ack=24478 Win=64780 Len=0
978878 326.224838 253.213.108.75 -> 253.37.253.43 TCP 64 nbx-cc > telnet [ACK] Seq=504 Ack=25217 Win=65535 Len=0
978879 326.224845 253.213.108.75 -> 253.37.253.43 TCP 64 [TCP Dup ACK 978878#1] nbx-cc > telnet [ACK] Seq=504 Ack=25217 Win=65535 Len=0
979933 326.828371 253.213.108.75 -> 253.37.253.43 TCP 64 nbx-cc > telnet [ACK] Seq=514 Ack=26209 Win=64543 Len=0
979934 326.828376 253.213.108.75 -> 253.37.253.43 TCP 64 [TCP Dup ACK 979933#1] nbx-cc > telnet [ACK] Seq=514 Ack=26209 Win=64543 Len=0
980904 327.431845 253.213.108.75 -> 253.37.253.43 TCP 64 nbx-cc > telnet [ACK] Seq=524 Ack=27055 Win=65535 Len=0
980905 327.431850 253.213.108.75 -> 253.37.253.43 TCP 64 [TCP Dup ACK 980904#1] nbx-cc > telnet [ACK] Seq=524 Ack=27055 Win=65535 Len=0
1020345 344.229606 253.213.108.75 -> 253.37.253.43 TCP 64 nbx-cc > telnet [ACK] Seq=557 Ack=28088 Win=64502 Len=0
1020346 344.229611 253.213.108.75 -> 253.37.253.43 TCP 64 [TCP Dup ACK 1020345#1] nbx-cc > telnet [ACK] Seq=557 Ack=28088 Win=64502 Len=0
