389836 130.277360 254.40.82.123 -> 244.3.210.197 TCP 70 11347 > http [SYN] Seq=0 Win=8192 Len=0 MSS=1380 WS=4 SACK_PERM=1
389848 130.278453 254.40.82.123 -> 244.3.210.197 TCP 70 64070 > http [SYN] Seq=0 Win=8192 Len=0 MSS=1380 WS=4 SACK_PERM=1
389860 130.281986 254.40.82.123 -> 244.3.210.197 TCP 64 11347 > http [ACK] Seq=1 Ack=1 Win=16560 Len=0
389873 130.284598 254.40.82.123 -> 244.3.210.197 TCP 64 64070 > http [ACK] Seq=1 Ack=1 Win=16560 Len=0
390982 130.667734 254.40.82.123 -> 244.3.210.197 TCP 64 11347 > http [ACK] Seq=6567 Ack=3576 Win=15952 Len=0
394464 132.238941 254.40.82.123 -> 244.3.210.197 TCP 64 64070 > http [RST, ACK] Seq=1255 Ack=637 Win=0 Len=0
606463 192.318626 254.40.82.123 -> 244.3.210.197 TCP 64 11347 > http [RST, ACK] Seq=6567 Ack=3576 Win=0 Len=0
