624839 198.385111 254.194.155.203 -> 41.177.26.46 TCP 78 40521 > http [SYN] Seq=0 Win=5840 Len=0 MSS=1460 SACK_PERM=1 TSval=1848010864 TSecr=0 WS=128
625055 198.469295 254.194.155.203 -> 41.177.26.46 TCP 70 40521 > http [ACK] Seq=1 Ack=1 Win=5888 Len=0 TSval=1848010885 TSecr=1509565296
625525 198.582488 254.194.155.203 -> 41.177.26.46 TCP 70 40521 > http [ACK] Seq=232 Ack=243 Win=6912 Len=0 TSval=1848010913 TSecr=1509565308
625530 198.582810 254.194.155.203 -> 41.177.26.46 TCP 70 40521 > http [ACK] Seq=232 Ack=1691 Win=9856 Len=0 TSval=1848010913 TSecr=1509565308
625531 198.582814 254.194.155.203 -> 41.177.26.46 TCP 70 40521 > http [ACK] Seq=232 Ack=3139 Win=12800 Len=0 TSval=1848010913 TSecr=1509565308
625794 198.667792 254.194.155.203 -> 41.177.26.46 TCP 70 40521 > http [ACK] Seq=232 Ack=4587 Win=15616 Len=0 TSval=1848010935 TSecr=1509565316
625795 198.667797 254.194.155.203 -> 41.177.26.46 TCP 70 40521 > http [ACK] Seq=232 Ack=6035 Win=18560 Len=0 TSval=1848010935 TSecr=1509565316
625798 198.667943 254.194.155.203 -> 41.177.26.46 TCP 70 40521 > http [ACK] Seq=232 Ack=7483 Win=21504 Len=0 TSval=1848010935 TSecr=1509565316
625799 198.667947 254.194.155.203 -> 41.177.26.46 TCP 70 40521 > http [ACK] Seq=232 Ack=8435 Win=24320 Len=0 TSval=1848010935 TSecr=1509565316
625801 198.668157 254.194.155.203 -> 41.177.26.46 TCP 70 40521 > http [ACK] Seq=232 Ack=9883 Win=27264 Len=0 TSval=1848010935 TSecr=1509565316
625805 198.668235 254.194.155.203 -> 41.177.26.46 TCP 70 40521 > http [ACK] Seq=232 Ack=11331 Win=30080 Len=0 TSval=1848010935 TSecr=1509565316
626090 198.751896 254.194.155.203 -> 41.177.26.46 TCP 70 40521 > http [ACK] Seq=232 Ack=12779 Win=33024 Len=0 TSval=1848010956 TSecr=1509565325
626091 198.751959 254.194.155.203 -> 41.177.26.46 TCP 70 40521 > http [ACK] Seq=232 Ack=14227 Win=35968 Len=0 TSval=1848010956 TSecr=1509565325
626092 198.751964 254.194.155.203 -> 41.177.26.46 TCP 70 40521 > http [ACK] Seq=232 Ack=15675 Win=38784 Len=0 TSval=1848010956 TSecr=1509565325
626093 198.751968 254.194.155.203 -> 41.177.26.46 TCP 70 40521 > http [ACK] Seq=232 Ack=16627 Win=41728 Len=0 TSval=1848010956 TSecr=1509565325
626094 198.751972 254.194.155.203 -> 41.177.26.46 TCP 70 40521 > http [ACK] Seq=232 Ack=18075 Win=42496 Len=0 TSval=1848010956 TSecr=1509565325
626095 198.751976 254.194.155.203 -> 41.177.26.46 TCP 70 40521 > http [ACK] Seq=232 Ack=19523 Win=41088 Len=0 TSval=1848010956 TSecr=1509565325
626096 198.752006 254.194.155.203 -> 41.177.26.46 TCP 70 40521 > http [ACK] Seq=232 Ack=20971 Win=39808 Len=0 TSval=1848010956 TSecr=1509565325
626101 198.752195 254.194.155.203 -> 41.177.26.46 TCP 70 40521 > http [ACK] Seq=232 Ack=22419 Win=38400 Len=0 TSval=1848010956 TSecr=1509565325
626102 198.752199 254.194.155.203 -> 41.177.26.46 TCP 70 40521 > http [ACK] Seq=232 Ack=23867 Win=37120 Len=0 TSval=1848010956 TSecr=1509565325
626164 198.767431 254.194.155.203 -> 41.177.26.46 TCP 70 40521 > http [ACK] Seq=232 Ack=27715 Win=44672 Len=0 TSval=1848010960 TSecr=1509565325
626342 198.837505 254.194.155.203 -> 41.177.26.46 TCP 70 40521 > http [ACK] Seq=232 Ack=29163 Win=47488 Len=0 TSval=1848010977 TSecr=1509565333
626347 198.843535 254.194.155.203 -> 41.177.26.46 TCP 70 40521 > http [ACK] Seq=232 Ack=53739 Win=47488 Len=0 TSval=1848010979 TSecr=1509565333
626393 198.853176 254.194.155.203 -> 41.177.26.46 TCP 70 40521 > http [ACK] Seq=232 Ack=55187 Win=47744 Len=0 TSval=1848010981 TSecr=1509565335
626403 198.866214 254.194.155.203 -> 41.177.26.46 TCP 70 40521 > http [ACK] Seq=232 Ack=59035 Win=47744 Len=0 TSval=1848010984 TSecr=1509565335
626578 198.922993 254.194.155.203 -> 41.177.26.46 TCP 70 40521 > http [ACK] Seq=232 Ack=61931 Win=47744 Len=0 TSval=1848010999 TSecr=1509565342
626627 198.931274 254.194.155.203 -> 41.177.26.46 TCP 70 40521 > http [ACK] Seq=232 Ack=66113 Win=47744 Len=0 TSval=1848011001 TSecr=1509565342
626670 198.947642 254.194.155.203 -> 41.177.26.46 TCP 70 40521 > http [FIN, ACK] Seq=232 Ack=66113 Win=47744 Len=0 TSval=1848011005 TSecr=1509565342
