805920 263.372706 33.57.213.186 -> 41.177.26.91 TCP 70 25461 > http [SYN] Seq=0 Win=8192 Len=0 MSS=1452 WS=4 SACK_PERM=1
806973 263.632670 33.57.213.186 -> 41.177.26.91 TCP 64 25461 > http [ACK] Seq=1 Ack=1 Win=66792 Len=0
809435 264.017862 33.57.213.186 -> 41.177.26.91 TCP 64 25461 > http [ACK] Seq=880 Ack=2905 Win=66792 Len=0
810414 264.223931 33.57.213.186 -> 41.177.26.91 TCP 64 25461 > http [ACK] Seq=880 Ack=4357 Win=66792 Len=0
810540 264.281061 33.57.213.186 -> 41.177.26.91 TCP 64 25461 > http [ACK] Seq=880 Ack=7261 Win=66792 Len=0
811075 264.484593 33.57.213.186 -> 41.177.26.91 TCP 64 25461 > http [ACK] Seq=880 Ack=8713 Win=66792 Len=0
811080 264.485730 33.57.213.186 -> 41.177.26.91 TCP 64 25461 > http [ACK] Seq=880 Ack=11617 Win=66792 Len=0
811280 264.542072 33.57.213.186 -> 41.177.26.91 TCP 64 25461 > http [ACK] Seq=880 Ack=14521 Win=66792 Len=0
812012 264.744177 33.57.213.186 -> 41.177.26.91 TCP 64 25461 > http [ACK] Seq=880 Ack=15973 Win=66792 Len=0
812015 264.746101 33.57.213.186 -> 41.177.26.91 TCP 64 25461 > http [ACK] Seq=880 Ack=18877 Win=66792 Len=0
812023 264.749610 33.57.213.186 -> 41.177.26.91 TCP 64 25461 > http [ACK] Seq=880 Ack=21781 Win=66792 Len=0
812202 264.804496 33.57.213.186 -> 41.177.26.91 TCP 64 25461 > http [ACK] Seq=880 Ack=24815 Win=66792 Len=0
812660 265.003615 33.57.213.186 -> 41.177.26.91 TCP 64 25461 > http [ACK] Seq=880 Ack=26267 Win=66792 Len=0
812685 265.009656 33.57.213.186 -> 41.177.26.91 TCP 64 25461 > http [ACK] Seq=880 Ack=29171 Win=66792 Len=0
812690 265.013650 33.57.213.186 -> 41.177.26.91 TCP 64 25461 > http [ACK] Seq=880 Ack=32075 Win=66792 Len=0
812697 265.017247 33.57.213.186 -> 41.177.26.91 TCP 64 25461 > http [ACK] Seq=880 Ack=34979 Win=66792 Len=0
812704 265.020762 33.57.213.186 -> 41.177.26.91 TCP 64 25461 > http [ACK] Seq=880 Ack=37883 Win=66792 Len=0
812784 265.069706 33.57.213.186 -> 41.177.26.91 TCP 64 25461 > http [ACK] Seq=880 Ack=40787 Win=66792 Len=0
812791 265.073243 33.57.213.186 -> 41.177.26.91 TCP 64 25461 > http [ACK] Seq=880 Ack=43691 Win=66792 Len=0
813218 265.268825 33.57.213.186 -> 41.177.26.91 TCP 64 25461 > http [ACK] Seq=880 Ack=46595 Win=66792 Len=0
813224 265.274572 33.57.213.186 -> 41.177.26.91 TCP 64 25461 > http [ACK] Seq=880 Ack=49391 Win=66792 Len=0
813231 265.277373 33.57.213.186 -> 41.177.26.91 TCP 64 25461 > http [ACK] Seq=880 Ack=52295 Win=66792 Len=0
813239 265.281766 33.57.213.186 -> 41.177.26.91 TCP 64 25461 > http [ACK] Seq=880 Ack=55199 Win=66792 Len=0
813257 265.285399 33.57.213.186 -> 41.177.26.91 TCP 64 25461 > http [ACK] Seq=880 Ack=58103 Win=66792 Len=0
813260 265.288711 33.57.213.186 -> 41.177.26.91 TCP 64 25461 > http [ACK] Seq=880 Ack=61007 Win=66792 Len=0
813293 265.292019 33.57.213.186 -> 41.177.26.91 TCP 64 25461 > http [ACK] Seq=880 Ack=63911 Win=66792 Len=0
813499 265.342408 33.57.213.186 -> 41.177.26.91 TCP 64 25461 > http [ACK] Seq=880 Ack=65991 Win=66792 Len=0
