208593  71.671965 40.193.255.164 -> 244.3.210.197 TCP 66 33677 > http [SYN] Seq=0 Win=65535 Len=0 MSS=1250 SACK_PERM=1
208605  71.679884 40.193.255.164 -> 244.3.210.197 TCP 64 33677 > http [ACK] Seq=1 Ack=1 Win=65535 Len=0
208621  71.692790 40.193.255.164 -> 244.3.210.197 TCP 64 33677 > http [RST, ACK] Seq=547 Ack=1251 Win=0 Len=0
911629 301.593608 40.193.255.164 -> 244.3.210.197 TCP 66 21702 > http [SYN] Seq=0 Win=65535 Len=0 MSS=1250 SACK_PERM=1
911668 301.601468 40.193.255.164 -> 244.3.210.197 TCP 64 21702 > http [ACK] Seq=1 Ack=1 Win=65535 Len=0
911733 301.614234 40.193.255.164 -> 244.3.210.197 TCP 64 21702 > http [RST, ACK] Seq=547 Ack=1251 Win=0 Len=0
