572472 182.619819 40.248.75.155 -> 244.3.160.239 TCP 66 http > 34741 [SYN, ACK] Seq=0 Ack=1 Win=49680 Len=0 MSS=1380 SACK_PERM=1
572850 182.685563 40.248.75.155 -> 244.3.160.239 TCP 64 http > 34741 [ACK] Seq=1 Ack=908 Win=48773 Len=0
575499 182.872690 40.248.75.155 -> 244.3.160.239 TCP 64 [TCP segment of a reassembled PDU]
575502 182.872992 40.248.75.155 -> 244.3.160.239 TCP 64 http > 34741 [FIN, ACK] Seq=2307 Ack=908 Win=49680 Len=0
575813 182.939806 40.248.75.155 -> 244.3.160.239 TCP 64 http > 34741 [ACK] Seq=2308 Ack=909 Win=49680 Len=0
576381 183.100102 40.248.75.155 -> 244.3.160.239 TCP 66 http > 34742 [SYN, ACK] Seq=0 Ack=1 Win=49680 Len=0 MSS=1380 SACK_PERM=1
576686 183.165463 40.248.75.155 -> 244.3.160.239 TCP 64 http > 34742 [ACK] Seq=1 Ack=661 Win=49020 Len=0
576696 183.172816 40.248.75.155 -> 244.3.160.239 TCP 64 http > 34742 [FIN, ACK] Seq=389 Ack=661 Win=49680 Len=0
576958 183.238339 40.248.75.155 -> 244.3.160.239 TCP 64 http > 34742 [ACK] Seq=390 Ack=662 Win=49680 Len=0
720285 229.879435 40.248.75.155 -> 244.3.160.239 TCP 66 http > 35069 [SYN, ACK] Seq=0 Ack=1 Win=49680 Len=0 MSS=1380 SACK_PERM=1
720480 229.946060 40.248.75.155 -> 244.3.160.239 TCP 64 http > 35069 [ACK] Seq=1 Ack=964 Win=48717 Len=0
720890 230.084297 40.248.75.155 -> 244.3.160.239 TCP 64 [TCP segment of a reassembled PDU]
720891 230.084516 40.248.75.155 -> 244.3.160.239 TCP 64 http > 35069 [FIN, ACK] Seq=1162 Ack=964 Win=49680 Len=0
721036 230.151440 40.248.75.155 -> 244.3.160.239 TCP 64 http > 35069 [ACK] Seq=1163 Ack=965 Win=49680 Len=0
