97382  36.527373 40.202.90.203 -> 244.3.160.239 TCP 66 http > 33556 [SYN, ACK] Seq=0 Ack=1 Win=4380 Len=0 MSS=1460 SACK_PERM=1
98018  36.607118 40.202.90.203 -> 244.3.160.239 TCP 64 http > 33556 [ACK] Seq=1 Ack=796 Win=5175 Len=0
98360  36.701420 40.202.90.203 -> 244.3.160.239 TCP 64 http > 33556 [ACK] Seq=344 Ack=797 Win=5175 Len=0
98361  36.701512 40.202.90.203 -> 244.3.160.239 TCP 64 http > 33556 [FIN, ACK] Seq=344 Ack=797 Win=5175 Len=0
98894  36.847663 40.202.90.203 -> 244.3.160.239 TCP 66 http > 33557 [SYN, ACK] Seq=0 Ack=1 Win=4380 Len=0 MSS=1460 SACK_PERM=1
99347  36.917744 40.202.90.203 -> 244.3.160.239 TCP 64 http > 33557 [ACK] Seq=1 Ack=800 Win=5179 Len=0
100306  37.058734 40.202.90.203 -> 244.3.160.239 TCP 64 [TCP segment of a reassembled PDU]
102514  37.462406 40.202.90.203 -> 244.3.160.239 TCP 66 http > 33558 [SYN, ACK] Seq=0 Ack=1 Win=4380 Len=0 MSS=1460 SACK_PERM=1
102777  37.508083 40.202.90.203 -> 244.3.160.239 TCP 66 http > 33559 [SYN, ACK] Seq=0 Ack=1 Win=4380 Len=0 MSS=1460 SACK_PERM=1
102929  37.535296 40.202.90.203 -> 244.3.160.239 TCP 64 http > 33558 [ACK] Seq=1 Ack=884 Win=5263 Len=0
103090  37.558416 40.202.90.203 -> 244.3.160.239 TCP 64 http > 33557 [ACK] Seq=39015 Ack=801 Win=5179 Len=0
103091  37.558420 40.202.90.203 -> 244.3.160.239 TCP 64 http > 33557 [FIN, ACK] Seq=39015 Ack=801 Win=5179 Len=0
103130  37.564689 40.202.90.203 -> 244.3.160.239 TCP 66 http > 33560 [SYN, ACK] Seq=0 Ack=1 Win=4380 Len=0 MSS=1460 SACK_PERM=1
103163  37.574428 40.202.90.203 -> 244.3.160.239 TCP 64 http > 33559 [ACK] Seq=1 Ack=882 Win=5261 Len=0
103258  37.589221 40.202.90.203 -> 244.3.160.239 TCP 66 http > 33561 [SYN, ACK] Seq=0 Ack=1 Win=4380 Len=0 MSS=1460 SACK_PERM=1
103408  37.610562 40.202.90.203 -> 244.3.160.239 TCP 64 http > 33558 [ACK] Seq=227 Ack=885 Win=5263 Len=0
103412  37.610885 40.202.90.203 -> 244.3.160.239 TCP 64 http > 33558 [FIN, ACK] Seq=227 Ack=885 Win=5263 Len=0
103493  37.619319 40.202.90.203 -> 244.3.160.239 TCP 66 http > 33562 [SYN, ACK] Seq=0 Ack=1 Win=4380 Len=0 MSS=1460 SACK_PERM=1
103595  37.634006 40.202.90.203 -> 244.3.160.239 TCP 64 http > 33560 [ACK] Seq=1 Ack=881 Win=5260 Len=0
103624  37.637196 40.202.90.203 -> 244.3.160.239 TCP 66 http > 33563 [SYN, ACK] Seq=0 Ack=1 Win=4380 Len=0 MSS=1460 SACK_PERM=1
103642  37.641273 40.202.90.203 -> 244.3.160.239 TCP 64 http > 33559 [ACK] Seq=96 Ack=883 Win=5261 Len=0
103643  37.641278 40.202.90.203 -> 244.3.160.239 TCP 64 http > 33559 [FIN, ACK] Seq=96 Ack=883 Win=5261 Len=0
103800  37.663821 40.202.90.203 -> 244.3.160.239 TCP 64 http > 33561 [ACK] Seq=1 Ack=880 Win=5259 Len=0
103847  37.677694 40.202.90.203 -> 244.3.160.239 TCP 66 http > 33564 [SYN, ACK] Seq=0 Ack=1 Win=4380 Len=0 MSS=1460 SACK_PERM=1
103870  37.687090 40.202.90.203 -> 244.3.160.239 TCP 64 http > 33562 [ACK] Seq=1 Ack=879 Win=5258 Len=0
103900  37.702779 40.202.90.203 -> 244.3.160.239 TCP 64 http > 33560 [ACK] Seq=229 Ack=882 Win=5260 Len=0
103901  37.702783 40.202.90.203 -> 244.3.160.239 TCP 64 http > 33560 [FIN, ACK] Seq=229 Ack=882 Win=5260 Len=0
103904  37.703876 40.202.90.203 -> 244.3.160.239 TCP 64 http > 33563 [ACK] Seq=1 Ack=883 Win=5262 Len=0
104307  37.737389 40.202.90.203 -> 244.3.160.239 TCP 66 http > 33565 [SYN, ACK] Seq=0 Ack=1 Win=4380 Len=0 MSS=1460 SACK_PERM=1
104332  37.744378 40.202.90.203 -> 244.3.160.239 TCP 64 http > 33564 [ACK] Seq=1 Ack=884 Win=5263 Len=0
104351  37.756073 40.202.90.203 -> 244.3.160.239 TCP 64 http > 33562 [ACK] Seq=229 Ack=880 Win=5258 Len=0
104352  37.756158 40.202.90.203 -> 244.3.160.239 TCP 64 http > 33562 [FIN, ACK] Seq=229 Ack=880 Win=5258 Len=0
104386  37.776214 40.202.90.203 -> 244.3.160.239 TCP 64 http > 33563 [ACK] Seq=229 Ack=884 Win=5262 Len=0
104387  37.776219 40.202.90.203 -> 244.3.160.239 TCP 64 http > 33563 [FIN, ACK] Seq=229 Ack=884 Win=5262 Len=0
104414  37.794533 40.202.90.203 -> 244.3.160.239 TCP 66 http > 33566 [SYN, ACK] Seq=0 Ack=1 Win=4380 Len=0 MSS=1460 SACK_PERM=1
104427  37.801169 40.202.90.203 -> 244.3.160.239 TCP 64 http > 33561 [ACK] Seq=229 Ack=881 Win=5259 Len=0
104428  37.801380 40.202.90.203 -> 244.3.160.239 TCP 64 http > 33561 [FIN, ACK] Seq=229 Ack=881 Win=5259 Len=0
104435  37.804380 40.202.90.203 -> 244.3.160.239 TCP 64 http > 33565 [ACK] Seq=1 Ack=883 Win=5262 Len=0
104458  37.811340 40.202.90.203 -> 244.3.160.239 TCP 64 http > 33564 [ACK] Seq=95 Ack=885 Win=5263 Len=0
104459  37.811344 40.202.90.203 -> 244.3.160.239 TCP 64 http > 33564 [FIN, ACK] Seq=95 Ack=885 Win=5263 Len=0
104480  37.821704 40.202.90.203 -> 244.3.160.239 TCP 66 http > 33567 [SYN, ACK] Seq=0 Ack=1 Win=4380 Len=0 MSS=1460 SACK_PERM=1
104505  37.826141 40.202.90.203 -> 244.3.160.239 TCP 66 http > 33568 [SYN, ACK] Seq=0 Ack=1 Win=4380 Len=0 MSS=1460 SACK_PERM=1
104550  37.843813 40.202.90.203 -> 244.3.160.239 TCP 66 http > 33569 [SYN, ACK] Seq=0 Ack=1 Win=4380 Len=0 MSS=1460 SACK_PERM=1
104650  37.869804 40.202.90.203 -> 244.3.160.239 TCP 64 http > 33566 [ACK] Seq=1 Ack=880 Win=5259 Len=0
104674  37.874235 40.202.90.203 -> 244.3.160.239 TCP 64 http > 33565 [ACK] Seq=96 Ack=884 Win=5262 Len=0
104675  37.874240 40.202.90.203 -> 244.3.160.239 TCP 64 http > 33565 [FIN, ACK] Seq=96 Ack=884 Win=5262 Len=0
104726  37.894752 40.202.90.203 -> 244.3.160.239 TCP 64 http > 33568 [ACK] Seq=1 Ack=885 Win=5264 Len=0
104735  37.897407 40.202.90.203 -> 244.3.160.239 TCP 64 http > 33567 [ACK] Seq=1 Ack=879 Win=5258 Len=0
104797  37.911441 40.202.90.203 -> 244.3.160.239 TCP 64 http > 33569 [ACK] Seq=1 Ack=884 Win=5263 Len=0
104866  37.925684 40.202.90.203 -> 244.3.160.239 TCP 66 http > 33570 [SYN, ACK] Seq=0 Ack=1 Win=4380 Len=0 MSS=1460 SACK_PERM=1
104975  37.946141 40.202.90.203 -> 244.3.160.239 TCP 64 http > 33566 [ACK] Seq=96 Ack=881 Win=5259 Len=0
104976  37.946207 40.202.90.203 -> 244.3.160.239 TCP 64 http > 33566 [FIN, ACK] Seq=96 Ack=881 Win=5259 Len=0
105074  37.966447 40.202.90.203 -> 244.3.160.239 TCP 64 http > 33568 [ACK] Seq=96 Ack=886 Win=5264 Len=0
105075  37.966660 40.202.90.203 -> 244.3.160.239 TCP 64 http > 33568 [FIN, ACK] Seq=96 Ack=886 Win=5264 Len=0
105111  37.973830 40.202.90.203 -> 244.3.160.239 TCP 66 http > 33571 [SYN, ACK] Seq=0 Ack=1 Win=4380 Len=0 MSS=1460 SACK_PERM=1
105122  37.974979 40.202.90.203 -> 244.3.160.239 TCP 64 http > 33567 [ACK] Seq=229 Ack=880 Win=5258 Len=0
105123  37.974984 40.202.90.203 -> 244.3.160.239 TCP 64 http > 33567 [FIN, ACK] Seq=229 Ack=880 Win=5258 Len=0
105166  37.981532 40.202.90.203 -> 244.3.160.239 TCP 64 http > 33569 [ACK] Seq=96 Ack=885 Win=5263 Len=0
105167  37.981755 40.202.90.203 -> 244.3.160.239 TCP 64 http > 33569 [FIN, ACK] Seq=96 Ack=885 Win=5263 Len=0
105279  38.004203 40.202.90.203 -> 244.3.160.239 TCP 64 http > 33570 [ACK] Seq=1 Ack=878 Win=5257 Len=0
105345  38.016132 40.202.90.203 -> 244.3.160.239 TCP 66 http > 33572 [SYN, ACK] Seq=0 Ack=1 Win=4380 Len=0 MSS=1460 SACK_PERM=1
105357  38.016868 40.202.90.203 -> 244.3.160.239 TCP 66 http > 33573 [SYN, ACK] Seq=0 Ack=1 Win=4380 Len=0 MSS=1460 SACK_PERM=1
105381  38.023235 40.202.90.203 -> 244.3.160.239 TCP 66 http > 33574 [SYN, ACK] Seq=0 Ack=1 Win=4380 Len=0 MSS=1460 SACK_PERM=1
105396  38.043925 40.202.90.203 -> 244.3.160.239 TCP 64 http > 33571 [ACK] Seq=1 Ack=877 Win=5256 Len=0
105518  38.083576 40.202.90.203 -> 244.3.160.239 TCP 64 http > 33570 [ACK] Seq=229 Ack=879 Win=5257 Len=0
105519  38.083580 40.202.90.203 -> 244.3.160.239 TCP 64 http > 33570 [FIN, ACK] Seq=229 Ack=879 Win=5257 Len=0
105536  38.088181 40.202.90.203 -> 244.3.160.239 TCP 64 http > 33573 [ACK] Seq=1 Ack=877 Win=5256 Len=0
105569  38.093159 40.202.90.203 -> 244.3.160.239 TCP 64 http > 33572 [ACK] Seq=1 Ack=878 Win=5257 Len=0
105581  38.095667 40.202.90.203 -> 244.3.160.239 TCP 64 http > 33574 [ACK] Seq=1 Ack=883 Win=5262 Len=0
105662  38.110779 40.202.90.203 -> 244.3.160.239 TCP 66 http > 33575 [SYN, ACK] Seq=0 Ack=1 Win=4380 Len=0 MSS=1460 SACK_PERM=1
105684  38.114846 40.202.90.203 -> 244.3.160.239 TCP 64 http > 33571 [ACK] Seq=95 Ack=878 Win=5256 Len=0
105685  38.114850 40.202.90.203 -> 244.3.160.239 TCP 64 http > 33571 [FIN, ACK] Seq=95 Ack=878 Win=5256 Len=0
105750  38.153443 40.202.90.203 -> 244.3.160.239 TCP 66 http > 33576 [SYN, ACK] Seq=0 Ack=1 Win=4380 Len=0 MSS=1460 SACK_PERM=1
105753  38.160038 40.202.90.203 -> 244.3.160.239 TCP 64 http > 33573 [ACK] Seq=229 Ack=878 Win=5256 Len=0
105754  38.160043 40.202.90.203 -> 244.3.160.239 TCP 64 http > 33573 [FIN, ACK] Seq=229 Ack=878 Win=5256 Len=0
105757  38.170688 40.202.90.203 -> 244.3.160.239 TCP 64 http > 33574 [ACK] Seq=229 Ack=884 Win=5262 Len=0
105758  38.170693 40.202.90.203 -> 244.3.160.239 TCP 64 http > 33574 [FIN, ACK] Seq=229 Ack=884 Win=5262 Len=0
105761  38.171797 40.202.90.203 -> 244.3.160.239 TCP 64 http > 33572 [ACK] Seq=229 Ack=879 Win=5257 Len=0
105762  38.171802 40.202.90.203 -> 244.3.160.239 TCP 64 http > 33572 [FIN, ACK] Seq=229 Ack=879 Win=5257 Len=0
105771  38.177470 40.202.90.203 -> 244.3.160.239 TCP 64 http > 33575 [ACK] Seq=1 Ack=882 Win=5261 Len=0
105805  38.189894 40.202.90.203 -> 244.3.160.239 TCP 66 http > 33577 [SYN, ACK] Seq=0 Ack=1 Win=4380 Len=0 MSS=1460 SACK_PERM=1
105889  38.200469 40.202.90.203 -> 244.3.160.239 TCP 66 http > 33579 [SYN, ACK] Seq=0 Ack=1 Win=4380 Len=0 MSS=1460 SACK_PERM=1
105907  38.202509 40.202.90.203 -> 244.3.160.239 TCP 66 http > 33578 [SYN, ACK] Seq=0 Ack=1 Win=4380 Len=0 MSS=1460 SACK_PERM=1
105968  38.227760 40.202.90.203 -> 244.3.160.239 TCP 64 http > 33576 [ACK] Seq=1 Ack=879 Win=5258 Len=0
106020  38.245850 40.202.90.203 -> 244.3.160.239 TCP 64 http > 33575 [ACK] Seq=229 Ack=883 Win=5261 Len=0
106021  38.245855 40.202.90.203 -> 244.3.160.239 TCP 64 http > 33575 [FIN, ACK] Seq=229 Ack=883 Win=5261 Len=0
106035  38.256676 40.202.90.203 -> 244.3.160.239 TCP 64 http > 33577 [ACK] Seq=1 Ack=878 Win=5257 Len=0
106047  38.268879 40.202.90.203 -> 244.3.160.239 TCP 64 http > 33579 [ACK] Seq=1 Ack=877 Win=5256 Len=0
106072  38.274906 40.202.90.203 -> 244.3.160.239 TCP 64 http > 33578 [ACK] Seq=1 Ack=878 Win=5257 Len=0
106078  38.279015 40.202.90.203 -> 244.3.160.239 TCP 66 http > 33580 [SYN, ACK] Seq=0 Ack=1 Win=4380 Len=0 MSS=1460 SACK_PERM=1
106129  38.308461 40.202.90.203 -> 244.3.160.239 TCP 64 http > 33576 [ACK] Seq=229 Ack=880 Win=5258 Len=0
106130  38.308466 40.202.90.203 -> 244.3.160.239 TCP 64 http > 33576 [FIN, ACK] Seq=229 Ack=880 Win=5258 Len=0
106178  38.325514 40.202.90.203 -> 244.3.160.239 TCP 64 http > 33577 [ACK] Seq=228 Ack=879 Win=5257 Len=0
106179  38.325519 40.202.90.203 -> 244.3.160.239 TCP 64 http > 33577 [FIN, ACK] Seq=228 Ack=879 Win=5257 Len=0
106216  38.337720 40.202.90.203 -> 244.3.160.239 TCP 66 http > 33581 [SYN, ACK] Seq=0 Ack=1 Win=4380 Len=0 MSS=1460 SACK_PERM=1
106219  38.338749 40.202.90.203 -> 244.3.160.239 TCP 64 http > 33579 [ACK] Seq=229 Ack=878 Win=5256 Len=0
106220  38.338753 40.202.90.203 -> 244.3.160.239 TCP 64 http > 33579 [FIN, ACK] Seq=229 Ack=878 Win=5256 Len=0
106225  38.346953 40.202.90.203 -> 244.3.160.239 TCP 64 http > 33580 [ACK] Seq=1 Ack=880 Win=5259 Len=0
106227  38.348877 40.202.90.203 -> 244.3.160.239 TCP 64 http > 33578 [ACK] Seq=96 Ack=879 Win=5257 Len=0
106228  38.348882 40.202.90.203 -> 244.3.160.239 TCP 64 http > 33578 [FIN, ACK] Seq=96 Ack=879 Win=5257 Len=0
106318  38.380287 40.202.90.203 -> 244.3.160.239 TCP 66 http > 33582 [SYN, ACK] Seq=0 Ack=1 Win=4380 Len=0 MSS=1460 SACK_PERM=1
106328  38.381512 40.202.90.203 -> 244.3.160.239 TCP 66 http > 33584 [SYN, ACK] Seq=0 Ack=1 Win=4380 Len=0 MSS=1460 SACK_PERM=1
106335  38.384583 40.202.90.203 -> 244.3.160.239 TCP 66 http > 33583 [SYN, ACK] Seq=0 Ack=1 Win=4380 Len=0 MSS=1460 SACK_PERM=1
106420  38.405406 40.202.90.203 -> 244.3.160.239 TCP 64 http > 33581 [ACK] Seq=1 Ack=879 Win=5258 Len=0
106433  38.416724 40.202.90.203 -> 244.3.160.239 TCP 64 http > 33580 [ACK] Seq=96 Ack=881 Win=5259 Len=0
106434  38.416729 40.202.90.203 -> 244.3.160.239 TCP 64 http > 33580 [FIN, ACK] Seq=96 Ack=881 Win=5259 Len=0
106579  38.448662 40.202.90.203 -> 244.3.160.239 TCP 64 http > 33584 [ACK] Seq=1 Ack=881 Win=5260 Len=0
106605  38.455188 40.202.90.203 -> 244.3.160.239 TCP 64 http > 33582 [ACK] Seq=1 Ack=883 Win=5262 Len=0
106614  38.460009 40.202.90.203 -> 244.3.160.239 TCP 64 http > 33583 [ACK] Seq=1 Ack=882 Win=5261 Len=0
106637  38.464256 40.202.90.203 -> 244.3.160.239 TCP 66 http > 33586 [SYN, ACK] Seq=0 Ack=1 Win=4380 Len=0 MSS=1460 SACK_PERM=1
106683  38.473777 40.202.90.203 -> 244.3.160.239 TCP 64 http > 33581 [ACK] Seq=95 Ack=880 Win=5258 Len=0
106684  38.473782 40.202.90.203 -> 244.3.160.239 TCP 64 http > 33581 [FIN, ACK] Seq=95 Ack=880 Win=5258 Len=0
106885  38.506773 40.202.90.203 -> 244.3.160.239 TCP 66 http > 33587 [SYN, ACK] Seq=0 Ack=1 Win=4380 Len=0 MSS=1460 SACK_PERM=1
106907  38.517616 40.202.90.203 -> 244.3.160.239 TCP 64 http > 33584 [ACK] Seq=229 Ack=882 Win=5260 Len=0
106908  38.517619 40.202.90.203 -> 244.3.160.239 TCP 64 http > 33584 [FIN, ACK] Seq=229 Ack=882 Win=5260 Len=0
106969  38.533208 40.202.90.203 -> 244.3.160.239 TCP 64 http > 33582 [ACK] Seq=228 Ack=884 Win=5262 Len=0
106970  38.533494 40.202.90.203 -> 244.3.160.239 TCP 64 http > 33582 [FIN, ACK] Seq=228 Ack=884 Win=5262 Len=0
106975  38.536449 40.202.90.203 -> 244.3.160.239 TCP 64 http > 33586 [ACK] Seq=1 Ack=880 Win=5259 Len=0
106976  38.536858 40.202.90.203 -> 244.3.160.239 TCP 64 http > 33583 [ACK] Seq=228 Ack=883 Win=5261 Len=0
106977  38.536863 40.202.90.203 -> 244.3.160.239 TCP 64 http > 33583 [FIN, ACK] Seq=228 Ack=883 Win=5261 Len=0
107049  38.556219 40.202.90.203 -> 244.3.160.239 TCP 66 http > 33589 [SYN, ACK] Seq=0 Ack=1 Win=4380 Len=0 MSS=1460 SACK_PERM=1
107059  38.565906 40.202.90.203 -> 244.3.160.239 TCP 66 http > 33590 [SYN, ACK] Seq=0 Ack=1 Win=4380 Len=0 MSS=1460 SACK_PERM=1
107077  38.572034 40.202.90.203 -> 244.3.160.239 TCP 66 http > 33591 [SYN, ACK] Seq=0 Ack=1 Win=4380 Len=0 MSS=1460 SACK_PERM=1
107089  38.574545 40.202.90.203 -> 244.3.160.239 TCP 64 http > 33587 [ACK] Seq=1 Ack=885 Win=5264 Len=0
107203  38.610392 40.202.90.203 -> 244.3.160.239 TCP 64 http > 33586 [ACK] Seq=96 Ack=881 Win=5259 Len=0
107204  38.610397 40.202.90.203 -> 244.3.160.239 TCP 64 http > 33586 [FIN, ACK] Seq=96 Ack=881 Win=5259 Len=0
107225  38.623734 40.202.90.203 -> 244.3.160.239 TCP 64 http > 33589 [ACK] Seq=1 Ack=884 Win=5263 Len=0
107262  38.633784 40.202.90.203 -> 244.3.160.239 TCP 64 http > 33590 [ACK] Seq=1 Ack=886 Win=5265 Len=0
107293  38.640485 40.202.90.203 -> 244.3.160.239 TCP 64 http > 33591 [ACK] Seq=1 Ack=885 Win=5264 Len=0
107308  38.643261 40.202.90.203 -> 244.3.160.239 TCP 64 http > 33587 [ACK] Seq=229 Ack=886 Win=5264 Len=0
107310  38.643494 40.202.90.203 -> 244.3.160.239 TCP 64 http > 33587 [FIN, ACK] Seq=229 Ack=886 Win=5264 Len=0
107318  38.646240 40.202.90.203 -> 244.3.160.239 TCP 66 http > 33592 [SYN, ACK] Seq=0 Ack=1 Win=4380 Len=0 MSS=1460 SACK_PERM=1
107526  38.675829 40.202.90.203 -> 244.3.160.239 TCP 66 http > 33593 [SYN, ACK] Seq=0 Ack=1 Win=4380 Len=0 MSS=1460 SACK_PERM=1
107579  38.694145 40.202.90.203 -> 244.3.160.239 TCP 64 http > 33589 [ACK] Seq=229 Ack=885 Win=5263 Len=0
107580  38.694150 40.202.90.203 -> 244.3.160.239 TCP 64 http > 33589 [FIN, ACK] Seq=229 Ack=885 Win=5263 Len=0
107593  38.702432 40.202.90.203 -> 244.3.160.239 TCP 64 http > 33590 [ACK] Seq=229 Ack=887 Win=5265 Len=0
107594  38.702437 40.202.90.203 -> 244.3.160.239 TCP 64 http > 33590 [FIN, ACK] Seq=229 Ack=887 Win=5265 Len=0
107661  38.715441 40.202.90.203 -> 244.3.160.239 TCP 64 http > 33591 [ACK] Seq=229 Ack=886 Win=5264 Len=0
107662  38.715447 40.202.90.203 -> 244.3.160.239 TCP 64 http > 33591 [FIN, ACK] Seq=229 Ack=886 Win=5264 Len=0
107679  38.719763 40.202.90.203 -> 244.3.160.239 TCP 64 http > 33592 [ACK] Seq=1 Ack=875 Win=5254 Len=0
107761  38.737263 40.202.90.203 -> 244.3.160.239 TCP 66 http > 33594 [SYN, ACK] Seq=0 Ack=1 Win=4380 Len=0 MSS=1460 SACK_PERM=1
107768  38.742664 40.202.90.203 -> 244.3.160.239 TCP 64 http > 33593 [ACK] Seq=1 Ack=875 Win=5254 Len=0
107770  38.745437 40.202.90.203 -> 244.3.160.239 TCP 66 http > 33595 [SYN, ACK] Seq=0 Ack=1 Win=4380 Len=0 MSS=1460 SACK_PERM=1
107807  38.761501 40.202.90.203 -> 244.3.160.239 TCP 66 http > 33596 [SYN, ACK] Seq=0 Ack=1 Win=4380 Len=0 MSS=1460 SACK_PERM=1
107950  38.795322 40.202.90.203 -> 244.3.160.239 TCP 64 http > 33592 [ACK] Seq=191 Ack=876 Win=5254 Len=0
107952  38.795560 40.202.90.203 -> 244.3.160.239 TCP 64 http > 33592 [FIN, ACK] Seq=191 Ack=876 Win=5254 Len=0
107987  38.813774 40.202.90.203 -> 244.3.160.239 TCP 64 http > 33593 [ACK] Seq=96 Ack=876 Win=5254 Len=0
107988  38.813779 40.202.90.203 -> 244.3.160.239 TCP 64 http > 33593 [FIN, ACK] Seq=96 Ack=876 Win=5254 Len=0
107992  38.814977 40.202.90.203 -> 244.3.160.239 TCP 64 http > 33594 [ACK] Seq=1 Ack=885 Win=5264 Len=0
108011  38.822638 40.202.90.203 -> 244.3.160.239 TCP 64 http > 33595 [ACK] Seq=1 Ack=884 Win=5263 Len=0
108013  38.822759 40.202.90.203 -> 244.3.160.239 TCP 66 http > 33598 [SYN, ACK] Seq=0 Ack=1 Win=4380 Len=0 MSS=1460 SACK_PERM=1
108035  38.839013 40.202.90.203 -> 244.3.160.239 TCP 64 http > 33596 [ACK] Seq=1 Ack=875 Win=5254 Len=0
108051  38.843623 40.202.90.203 -> 244.3.160.239 TCP 66 http > 33599 [SYN, ACK] Seq=0 Ack=1 Win=4380 Len=0 MSS=1460 SACK_PERM=1
108130  38.889853 40.202.90.203 -> 244.3.160.239 TCP 64 http > 33598 [ACK] Seq=1 Ack=875 Win=5254 Len=0
108153  38.898405 40.202.90.203 -> 244.3.160.239 TCP 64 http > 33594 [ACK] Seq=229 Ack=886 Win=5264 Len=0
108154  38.898525 40.202.90.203 -> 244.3.160.239 TCP 64 http > 33594 [FIN, ACK] Seq=229 Ack=886 Win=5264 Len=0
108160  38.901972 40.202.90.203 -> 244.3.160.239 TCP 64 http > 33595 [ACK] Seq=94 Ack=885 Win=5263 Len=0
108161  38.902156 40.202.90.203 -> 244.3.160.239 TCP 64 http > 33595 [FIN, ACK] Seq=94 Ack=885 Win=5263 Len=0
108182  38.911072 40.202.90.203 -> 244.3.160.239 TCP 64 http > 33599 [ACK] Seq=1 Ack=875 Win=5254 Len=0
108198  38.920294 40.202.90.203 -> 244.3.160.239 TCP 64 http > 33596 [ACK] Seq=96 Ack=876 Win=5254 Len=0
108199  38.920299 40.202.90.203 -> 244.3.160.239 TCP 64 http > 33596 [FIN, ACK] Seq=96 Ack=876 Win=5254 Len=0
108205  38.924974 40.202.90.203 -> 244.3.160.239 TCP 66 http > 33601 [SYN, ACK] Seq=0 Ack=1 Win=4380 Len=0 MSS=1460 SACK_PERM=1
108227  38.933710 40.202.90.203 -> 244.3.160.239 TCP 66 http > 33602 [SYN, ACK] Seq=0 Ack=1 Win=4380 Len=0 MSS=1460 SACK_PERM=1
108268  38.949273 40.202.90.203 -> 244.3.160.239 TCP 66 http > 33603 [SYN, ACK] Seq=0 Ack=1 Win=4380 Len=0 MSS=1460 SACK_PERM=1
108297  38.962640 40.202.90.203 -> 244.3.160.239 TCP 64 http > 33598 [ACK] Seq=191 Ack=876 Win=5254 Len=0
108298  38.962796 40.202.90.203 -> 244.3.160.239 TCP 64 http > 33598 [FIN, ACK] Seq=191 Ack=876 Win=5254 Len=0
108334  38.980332 40.202.90.203 -> 244.3.160.239 TCP 64 http > 33599 [ACK] Seq=191 Ack=876 Win=5254 Len=0
108335  38.980337 40.202.90.203 -> 244.3.160.239 TCP 64 http > 33599 [FIN, ACK] Seq=191 Ack=876 Win=5254 Len=0
108373  38.993145 40.202.90.203 -> 244.3.160.239 TCP 64 http > 33601 [ACK] Seq=1 Ack=875 Win=5254 Len=0
108399  39.000957 40.202.90.203 -> 244.3.160.239 TCP 64 http > 33602 [ACK] Seq=1 Ack=871 Win=5250 Len=0
108413  39.003426 40.202.90.203 -> 244.3.160.239 TCP 66 http > 33604 [SYN, ACK] Seq=0 Ack=1 Win=4380 Len=0 MSS=1460 SACK_PERM=1
108434  39.013837 40.202.90.203 -> 244.3.160.239 TCP 66 http > 33605 [SYN, ACK] Seq=0 Ack=1 Win=4380 Len=0 MSS=1460 SACK_PERM=1
108464  39.018084 40.202.90.203 -> 244.3.160.239 TCP 64 http > 33603 [ACK] Seq=1 Ack=877 Win=5256 Len=0
108686  39.068429 40.202.90.203 -> 244.3.160.239 TCP 64 http > 33601 [ACK] Seq=96 Ack=876 Win=5254 Len=0
108687  39.068434 40.202.90.203 -> 244.3.160.239 TCP 64 http > 33601 [FIN, ACK] Seq=96 Ack=876 Win=5254 Len=0
108702  39.072303 40.202.90.203 -> 244.3.160.239 TCP 64 http > 33602 [ACK] Seq=228 Ack=872 Win=5250 Len=0
108703  39.072308 40.202.90.203 -> 244.3.160.239 TCP 64 http > 33602 [FIN, ACK] Seq=228 Ack=872 Win=5250 Len=0
108745  39.078433 40.202.90.203 -> 244.3.160.239 TCP 64 http > 33604 [ACK] Seq=1 Ack=875 Win=5254 Len=0
108756  39.080844 40.202.90.203 -> 244.3.160.239 TCP 64 http > 33605 [ACK] Seq=1 Ack=875 Win=5254 Len=0
108780  39.086461 40.202.90.203 -> 244.3.160.239 TCP 64 http > 33603 [ACK] Seq=95 Ack=878 Win=5256 Len=0
108781  39.086465 40.202.90.203 -> 244.3.160.239 TCP 64 http > 33603 [FIN, ACK] Seq=95 Ack=878 Win=5256 Len=0
108794  39.092927 40.202.90.203 -> 244.3.160.239 TCP 66 http > 33607 [SYN, ACK] Seq=0 Ack=1 Win=4380 Len=0 MSS=1460 SACK_PERM=1
108937  39.151928 40.202.90.203 -> 244.3.160.239 TCP 64 http > 33605 [ACK] Seq=96 Ack=876 Win=5254 Len=0
108938  39.151933 40.202.90.203 -> 244.3.160.239 TCP 64 http > 33605 [FIN, ACK] Seq=96 Ack=876 Win=5254 Len=0
108943  39.153438 40.202.90.203 -> 244.3.160.239 TCP 64 http > 33604 [ACK] Seq=95 Ack=876 Win=5254 Len=0
108944  39.153442 40.202.90.203 -> 244.3.160.239 TCP 64 http > 33604 [FIN, ACK] Seq=95 Ack=876 Win=5254 Len=0
108974  39.160925 40.202.90.203 -> 244.3.160.239 TCP 64 http > 33607 [ACK] Seq=1 Ack=882 Win=5261 Len=0
109291  39.228633 40.202.90.203 -> 244.3.160.239 TCP 64 http > 33607 [ACK] Seq=96 Ack=883 Win=5261 Len=0
109292  39.228638 40.202.90.203 -> 244.3.160.239 TCP 64 http > 33607 [FIN, ACK] Seq=96 Ack=883 Win=5261 Len=0
157155  53.552828 40.202.90.203 -> 244.3.160.239 TCP 66 http > 33661 [SYN, ACK] Seq=0 Ack=1 Win=4380 Len=0 MSS=1460 SACK_PERM=1
157420  53.625499 40.202.90.203 -> 244.3.160.239 TCP 64 http > 33661 [ACK] Seq=1 Ack=1241 Win=5620 Len=0
174735  58.063425 40.202.90.203 -> 244.3.160.239 TCP 64 http > 33661 [ACK] Seq=1718 Ack=1242 Win=5620 Len=0
174736  58.063430 40.202.90.203 -> 244.3.160.239 TCP 64 http > 33661 [FIN, ACK] Seq=1718 Ack=1242 Win=5620 Len=0
174854  58.123112 40.202.90.203 -> 244.3.160.239 TCP 66 http > 33762 [SYN, ACK] Seq=0 Ack=1 Win=4380 Len=0 MSS=1460 SACK_PERM=1
175046  58.193660 40.202.90.203 -> 244.3.160.239 TCP 64 http > 33762 [ACK] Seq=1 Ack=1523 Win=5902 Len=0
180467  60.781045 40.202.90.203 -> 244.3.160.239 TCP 64 http > 33762 [ACK] Seq=56198 Ack=1524 Win=5902 Len=0
180468  60.781050 40.202.90.203 -> 244.3.160.239 TCP 64 http > 33762 [FIN, ACK] Seq=56198 Ack=1524 Win=5902 Len=0
181995  61.181305 40.202.90.203 -> 244.3.160.239 TCP 66 http > 33776 [SYN, ACK] Seq=0 Ack=1 Win=4380 Len=0 MSS=1460 SACK_PERM=1
182044  61.194391 40.202.90.203 -> 244.3.160.239 TCP 66 http > 33777 [SYN, ACK] Seq=0 Ack=1 Win=4380 Len=0 MSS=1460 SACK_PERM=1
182216  61.250421 40.202.90.203 -> 244.3.160.239 TCP 64 http > 33776 [ACK] Seq=1 Ack=1430 Win=5809 Len=0
182289  61.262189 40.202.90.203 -> 244.3.160.239 TCP 64 http > 33777 [ACK] Seq=1 Ack=1373 Win=5752 Len=0
182476  61.323336 40.202.90.203 -> 244.3.160.239 TCP 64 http > 33776 [ACK] Seq=191 Ack=1431 Win=5809 Len=0
182477  61.323340 40.202.90.203 -> 244.3.160.239 TCP 64 http > 33776 [FIN, ACK] Seq=191 Ack=1431 Win=5809 Len=0
183408  61.631977 40.202.90.203 -> 244.3.160.239 TCP 64 http > 33777 [FIN, ACK] Seq=1064 Ack=1373 Win=5752 Len=0
183668  61.706911 40.202.90.203 -> 244.3.160.239 TCP 64 http > 33777 [ACK] Seq=1065 Ack=1374 Win=5752 Len=0
199219  68.499663 40.202.90.203 -> 244.3.160.239 TCP 66 http > 33883 [SYN, ACK] Seq=0 Ack=1 Win=4380 Len=0 MSS=1460 SACK_PERM=1
199350  68.567119 40.202.90.203 -> 244.3.160.239 TCP 64 http > 33883 [ACK] Seq=1 Ack=1389 Win=5768 Len=0
208052  71.372948 40.202.90.203 -> 244.3.160.239 TCP 64 http > 33883 [FIN, ACK] Seq=51043 Ack=1389 Win=5768 Len=0
208190  71.442032 40.202.90.203 -> 244.3.160.239 TCP 64 http > 33883 [ACK] Seq=51044 Ack=1390 Win=5768 Len=0
235215  81.912072 40.202.90.203 -> 244.3.160.239 TCP 66 http > 33970 [SYN, ACK] Seq=0 Ack=1 Win=4380 Len=0 MSS=1460 SACK_PERM=1
235277  81.986056 40.202.90.203 -> 244.3.160.239 TCP 64 http > 33970 [ACK] Seq=1 Ack=1708 Win=6087 Len=0
299208 100.877421 40.202.90.203 -> 244.3.160.239 TCP 66 http > 34122 [SYN, ACK] Seq=0 Ack=1 Win=4380 Len=0 MSS=1460 SACK_PERM=1
299396 100.951184 40.202.90.203 -> 244.3.160.239 TCP 64 http > 34122 [ACK] Seq=1 Ack=1335 Win=5714 Len=0
299695 101.033798 40.202.90.203 -> 244.3.160.239 TCP 64 http > 34122 [ACK] Seq=767 Ack=1336 Win=5714 Len=0
299696 101.033802 40.202.90.203 -> 244.3.160.239 TCP 64 http > 34122 [FIN, ACK] Seq=767 Ack=1336 Win=5714 Len=0
333687 116.664295 40.202.90.203 -> 244.3.160.239 TCP 66 http > 34162 [SYN, ACK] Seq=0 Ack=1 Win=4380 Len=0 MSS=1460 SACK_PERM=1
333930 116.731471 40.202.90.203 -> 244.3.160.239 TCP 64 http > 34162 [ACK] Seq=1 Ack=1730 Win=6109 Len=0
462548 151.715453 40.202.90.203 -> 244.3.160.239 TCP 66 http > 34319 [SYN, ACK] Seq=0 Ack=1 Win=4380 Len=0 MSS=1460 SACK_PERM=1
462657 151.785259 40.202.90.203 -> 244.3.160.239 TCP 64 http > 34319 [ACK] Seq=1 Ack=1730 Win=6109 Len=0
474774 156.591378 40.202.90.203 -> 244.3.160.239 TCP 66 http > 34363 [SYN, ACK] Seq=0 Ack=1 Win=4380 Len=0 MSS=1460 SACK_PERM=1
474896 156.628963 40.202.90.203 -> 244.3.160.239 TCP 66 http > 34364 [SYN, ACK] Seq=0 Ack=1 Win=4380 Len=0 MSS=1460 SACK_PERM=1
474973 156.658846 40.202.90.203 -> 244.3.160.239 TCP 64 http > 34363 [ACK] Seq=1 Ack=1282 Win=5661 Len=0
475142 156.703115 40.202.90.203 -> 244.3.160.239 TCP 64 http > 34364 [ACK] Seq=1 Ack=1280 Win=5659 Len=0
475160 156.711233 40.202.90.203 -> 244.3.160.239 TCP 66 http > 34367 [SYN, ACK] Seq=0 Ack=1 Win=4380 Len=0 MSS=1460 SACK_PERM=1
475223 156.729482 40.202.90.203 -> 244.3.160.239 TCP 64 http > 34363 [ACK] Seq=191 Ack=1283 Win=5661 Len=0
475224 156.729488 40.202.90.203 -> 244.3.160.239 TCP 64 http > 34363 [FIN, ACK] Seq=191 Ack=1283 Win=5661 Len=0
475297 156.778361 40.202.90.203 -> 244.3.160.239 TCP 64 http > 34364 [ACK] Seq=191 Ack=1281 Win=5659 Len=0
475298 156.778512 40.202.90.203 -> 244.3.160.239 TCP 64 http > 34364 [FIN, ACK] Seq=191 Ack=1281 Win=5659 Len=0
475349 156.788410 40.202.90.203 -> 244.3.160.239 TCP 64 http > 34319 [FIN, ACK] Seq=72596 Ack=1730 Win=6109 Len=0
475365 156.793378 40.202.90.203 -> 244.3.160.239 TCP 64 http > 34367 [ACK] Seq=1 Ack=1230 Win=5609 Len=0
475545 156.862432 40.202.90.203 -> 244.3.160.239 TCP 64 http > 34319 [ACK] Seq=72597 Ack=1731 Win=6109 Len=0
475977 157.078259 40.202.90.203 -> 244.3.160.239 TCP 64 http > 34367 [ACK] Seq=1773 Ack=1231 Win=5609 Len=0
475978 157.078264 40.202.90.203 -> 244.3.160.239 TCP 64 http > 34367 [FIN, ACK] Seq=1773 Ack=1231 Win=5609 Len=0
551489 177.419107 40.202.90.203 -> 244.3.160.239 TCP 64 http > 33970 [ACK] Seq=10221 Ack=1709 Win=6087 Len=0
557653 179.422939 40.202.90.203 -> 244.3.160.239 TCP 64 http > 34162 [ACK] Seq=10221 Ack=1731 Win=6109 Len=0
600608 190.365425 40.202.90.203 -> 244.3.160.239 TCP 66 http > 34786 [SYN, ACK] Seq=0 Ack=1 Win=4380 Len=0 MSS=1460 SACK_PERM=1
600851 190.442873 40.202.90.203 -> 244.3.160.239 TCP 64 http > 34786 [ACK] Seq=1 Ack=1722 Win=6101 Len=0
603304 191.384419 40.202.90.203 -> 244.3.160.239 TCP 64 http > 34786 [ACK] Seq=1673 Ack=1723 Win=6101 Len=0
603305 191.384423 40.202.90.203 -> 244.3.160.239 TCP 64 http > 34786 [FIN, ACK] Seq=1673 Ack=1723 Win=6101 Len=0
603376 191.435500 40.202.90.203 -> 244.3.160.239 TCP 66 http > 34794 [SYN, ACK] Seq=0 Ack=1 Win=4380 Len=0 MSS=1460 SACK_PERM=1
603522 191.503536 40.202.90.203 -> 244.3.160.239 TCP 64 http > 34794 [ACK] Seq=1 Ack=1908 Win=6287 Len=0
610940 193.923284 40.202.90.203 -> 244.3.160.239 TCP 66 http > 34799 [SYN, ACK] Seq=0 Ack=1 Win=4380 Len=0 MSS=1460 SACK_PERM=1
611286 193.991900 40.202.90.203 -> 244.3.160.239 TCP 64 http > 34799 [ACK] Seq=1 Ack=1443 Win=5822 Len=0
611355 194.010794 40.202.90.203 -> 244.3.160.239 TCP 80 [TCP segment of a reassembled PDU]
611685 194.079551 40.202.90.203 -> 244.3.160.239 TCP 64 http > 34794 [ACK] Seq=54043 Ack=1909 Win=6287 Len=0
611686 194.079557 40.202.90.203 -> 244.3.160.239 TCP 64 http > 34794 [FIN, ACK] Seq=54043 Ack=1909 Win=6287 Len=0
611986 194.197178 40.202.90.203 -> 244.3.160.239 TCP 64 http > 34799 [FIN, ACK] Seq=1064 Ack=1443 Win=5822 Len=0
612179 194.268045 40.202.90.203 -> 244.3.160.239 TCP 64 http > 34799 [ACK] Seq=1065 Ack=1444 Win=5822 Len=0
638502 201.517541 40.202.90.203 -> 244.3.160.239 TCP 66 http > 34946 [SYN, ACK] Seq=0 Ack=1 Win=4380 Len=0 MSS=1460 SACK_PERM=1
638712 201.586242 40.202.90.203 -> 244.3.160.239 TCP 64 http > 34946 [ACK] Seq=1 Ack=1534 Win=5913 Len=0
639084 201.683837 40.202.90.203 -> 244.3.160.239 TCP 64 http > 34946 [ACK] Seq=927 Ack=1535 Win=5913 Len=0
639086 201.684089 40.202.90.203 -> 244.3.160.239 TCP 64 http > 34946 [FIN, ACK] Seq=927 Ack=1535 Win=5913 Len=0
685412 215.275543 40.202.90.203 -> 244.3.160.239 TCP 66 http > 35046 [SYN, ACK] Seq=0 Ack=1 Win=4380 Len=0 MSS=1460 SACK_PERM=1
685533 215.342638 40.202.90.203 -> 244.3.160.239 TCP 64 http > 35046 [ACK] Seq=1 Ack=1973 Win=6352 Len=0
689054 216.801832 40.202.90.203 -> 244.3.160.239 TCP 64 http > 35046 [FIN, ACK] Seq=50899 Ack=1973 Win=6352 Len=0
689165 216.871089 40.202.90.203 -> 244.3.160.239 TCP 64 http > 35046 [ACK] Seq=50900 Ack=1974 Win=6352 Len=0
693943 219.423809 40.202.90.203 -> 244.3.160.239 TCP 66 http > 35053 [SYN, ACK] Seq=0 Ack=1 Win=4380 Len=0 MSS=1460 SACK_PERM=1
694104 219.491964 40.202.90.203 -> 244.3.160.239 TCP 64 http > 35053 [ACK] Seq=1 Ack=1454 Win=5833 Len=0
694295 219.587616 40.202.90.203 -> 244.3.160.239 TCP 64 http > 35053 [ACK] Seq=860 Ack=1455 Win=5833 Len=0
694296 219.587620 40.202.90.203 -> 244.3.160.239 TCP 64 http > 35053 [FIN, ACK] Seq=860 Ack=1455 Win=5833 Len=0
715634 228.376180 40.202.90.203 -> 244.3.160.239 TCP 66 http > 35066 [SYN, ACK] Seq=0 Ack=1 Win=4380 Len=0 MSS=1460 SACK_PERM=1
715811 228.446778 40.202.90.203 -> 244.3.160.239 TCP 64 http > 35066 [ACK] Seq=1 Ack=1856 Win=6235 Len=0
721463 230.330056 40.202.90.203 -> 244.3.160.239 TCP 64 http > 35066 [ACK] Seq=1568 Ack=1857 Win=6235 Len=0
721464 230.330061 40.202.90.203 -> 244.3.160.239 TCP 64 http > 35066 [FIN, ACK] Seq=1568 Ack=1857 Win=6235 Len=0
721605 230.382464 40.202.90.203 -> 244.3.160.239 TCP 66 http > 35070 [SYN, ACK] Seq=0 Ack=1 Win=4380 Len=0 MSS=1460 SACK_PERM=1
721759 230.455836 40.202.90.203 -> 244.3.160.239 TCP 64 http > 35070 [ACK] Seq=1 Ack=1986 Win=6365 Len=0
724876 232.020278 40.202.90.203 -> 244.3.160.239 TCP 66 http > 35093 [SYN, ACK] Seq=0 Ack=1 Win=4380 Len=0 MSS=1460 SACK_PERM=1
725068 232.088133 40.202.90.203 -> 244.3.160.239 TCP 64 http > 35093 [ACK] Seq=1 Ack=1471 Win=5850 Len=0
725257 232.204495 40.202.90.203 -> 244.3.160.239 TCP 64 http > 35070 [ACK] Seq=55151 Ack=1987 Win=6365 Len=0
725258 232.204500 40.202.90.203 -> 244.3.160.239 TCP 64 http > 35070 [FIN, ACK] Seq=55151 Ack=1987 Win=6365 Len=0
725602 232.352866 40.202.90.203 -> 244.3.160.239 TCP 64 http > 35093 [FIN, ACK] Seq=7867 Ack=1471 Win=5850 Len=0
725881 232.465564 40.202.90.203 -> 244.3.160.239 TCP 64 http > 35093 [ACK] Seq=7868 Ack=1472 Win=5850 Len=0
752870 241.606236 40.202.90.203 -> 244.3.160.239 TCP 66 http > 35143 [SYN, ACK] Seq=0 Ack=1 Win=4380 Len=0 MSS=1460 SACK_PERM=1
753090 241.678329 40.202.90.203 -> 244.3.160.239 TCP 64 http > 35143 [ACK] Seq=1 Ack=1559 Win=5938 Len=0
753807 241.891225 40.202.90.203 -> 244.3.160.239 TCP 64 http > 35143 [ACK] Seq=856 Ack=1560 Win=5938 Len=0
753809 241.891368 40.202.90.203 -> 244.3.160.239 TCP 64 http > 35143 [FIN, ACK] Seq=856 Ack=1560 Win=5938 Len=0
780244 252.001135 40.202.90.203 -> 244.3.160.239 TCP 66 http > 35238 [SYN, ACK] Seq=0 Ack=1 Win=4380 Len=0 MSS=1460 SACK_PERM=1
780343 252.068535 40.202.90.203 -> 244.3.160.239 TCP 64 http > 35238 [ACK] Seq=1 Ack=1965 Win=6344 Len=0
783631 253.771347 40.202.90.203 -> 244.3.160.239 TCP 64 http > 35238 [FIN, ACK] Seq=50734 Ack=1965 Win=6344 Len=0
783804 253.838916 40.202.90.203 -> 244.3.160.239 TCP 64 http > 35238 [ACK] Seq=50735 Ack=1966 Win=6344 Len=0
828707 270.475188 40.202.90.203 -> 244.3.160.239 TCP 66 http > 35268 [SYN, ACK] Seq=0 Ack=1 Win=4380 Len=0 MSS=1460 SACK_PERM=1
828960 270.550300 40.202.90.203 -> 244.3.160.239 TCP 64 http > 35268 [ACK] Seq=1 Ack=1821 Win=6200 Len=0
834323 273.050702 40.202.90.203 -> 244.3.160.239 TCP 64 http > 35268 [ACK] Seq=1643 Ack=1822 Win=6200 Len=0
834324 273.050808 40.202.90.203 -> 244.3.160.239 TCP 64 http > 35268 [FIN, ACK] Seq=1643 Ack=1822 Win=6200 Len=0
834380 273.102194 40.202.90.203 -> 244.3.160.239 TCP 66 http > 35274 [SYN, ACK] Seq=0 Ack=1 Win=4380 Len=0 MSS=1460 SACK_PERM=1
834490 273.176515 40.202.90.203 -> 244.3.160.239 TCP 64 http > 35274 [ACK] Seq=1 Ack=2001 Win=6380 Len=0
839792 275.304163 40.202.90.203 -> 244.3.160.239 TCP 66 http > 35288 [SYN, ACK] Seq=0 Ack=1 Win=4380 Len=0 MSS=1460 SACK_PERM=1
840005 275.367581 40.202.90.203 -> 244.3.160.239 TCP 64 http > 35274 [ACK] Seq=52429 Ack=2002 Win=6380 Len=0
840006 275.367585 40.202.90.203 -> 244.3.160.239 TCP 64 http > 35274 [FIN, ACK] Seq=52429 Ack=2002 Win=6380 Len=0
840016 275.370601 40.202.90.203 -> 244.3.160.239 TCP 64 http > 35288 [ACK] Seq=1 Ack=1522 Win=5901 Len=0
840581 275.672118 40.202.90.203 -> 244.3.160.239 TCP 64 http > 35288 [ACK] Seq=371 Ack=1523 Win=5901 Len=0
840582 275.672482 40.202.90.203 -> 244.3.160.239 TCP 64 http > 35288 [FIN, ACK] Seq=371 Ack=1523 Win=5901 Len=0
862495 284.571366 40.202.90.203 -> 244.3.160.239 TCP 66 http > 35346 [SYN, ACK] Seq=0 Ack=1 Win=4380 Len=0 MSS=1460 SACK_PERM=1
862612 284.648830 40.202.90.203 -> 244.3.160.239 TCP 64 http > 35346 [ACK] Seq=1 Ack=2228 Win=6607 Len=0
862613 284.648834 40.202.90.203 -> 244.3.160.239 TCP 64 http > 35346 [ACK] Seq=1 Ack=2269 Win=6648 Len=0
862615 284.649116 40.202.90.203 -> 244.3.160.239 TCP 64 http > 35346 [ACK] Seq=1 Ack=2429 Win=6808 Len=0
864908 285.859363 40.202.90.203 -> 244.3.160.239 TCP 66 http > altova-lm [SYN, ACK] Seq=0 Ack=1 Win=4380 Len=0 MSS=1460 SACK_PERM=1
864975 285.884060 40.202.90.203 -> 244.3.160.239 TCP 66 http > guttersnex [SYN, ACK] Seq=0 Ack=1 Win=4380 Len=0 MSS=1460 SACK_PERM=1
865039 285.911740 40.202.90.203 -> 244.3.160.239 TCP 64 http > 35346 [ACK] Seq=42702 Ack=2430 Win=6808 Len=0
865040 285.911745 40.202.90.203 -> 244.3.160.239 TCP 64 http > 35346 [FIN, ACK] Seq=42702 Ack=2430 Win=6808 Len=0
865056 285.928989 40.202.90.203 -> 244.3.160.239 TCP 64 http > altova-lm [ACK] Seq=1 Ack=1528 Win=5907 Len=0
865109 285.953969 40.202.90.203 -> 244.3.160.239 TCP 64 http > guttersnex [ACK] Seq=1 Ack=1583 Win=5962 Len=0
865353 286.025669 40.202.90.203 -> 244.3.160.239 TCP 64 http > guttersnex [ACK] Seq=191 Ack=1584 Win=5962 Len=0
865354 286.025814 40.202.90.203 -> 244.3.160.239 TCP 64 http > guttersnex [FIN, ACK] Seq=191 Ack=1584 Win=5962 Len=0
866185 286.383812 40.202.90.203 -> 244.3.160.239 TCP 64 http > altova-lm [ACK] Seq=371 Ack=1529 Win=5907 Len=0
866191 286.384175 40.202.90.203 -> 244.3.160.239 TCP 64 http > altova-lm [FIN, ACK] Seq=371 Ack=1529 Win=5907 Len=0
