1082   0.282724 41.177.26.55 -> 244.3.160.248 TCP 64 http > 43325 [ACK] Seq=1 Ack=2 Win=64240 Len=0
1083   0.282728 41.177.26.55 -> 244.3.160.248 TCP 64 http > 43316 [ACK] Seq=1 Ack=2 Win=64240 Len=0
1085   0.282946 41.177.26.55 -> 244.3.160.248 TCP 64 http > 43322 [ACK] Seq=1 Ack=2 Win=64240 Len=0
1965   0.596887 41.177.26.55 -> 244.3.160.248 TCP 64 http > 43297 [ACK] Seq=1 Ack=2 Win=64240 Len=0
4834   1.464643 41.177.26.55 -> 244.3.160.248 TCP 64 http > 43451 [FIN, ACK] Seq=1 Ack=1 Win=64240 Len=0
5570   1.774531 41.177.26.55 -> 244.3.160.248 TCP 64 http > 43452 [FIN, ACK] Seq=1 Ack=1 Win=64240 Len=0
5907   1.851338 41.177.26.55 -> 244.3.160.248 TCP 66 http > 43521 [SYN, ACK] Seq=0 Ack=1 Win=64240 Len=0 MSS=1460 SACK_PERM=1
5914   1.851954 41.177.26.55 -> 244.3.160.248 TCP 64 http > 43521 [ACK] Seq=1 Ack=352 Win=63889 Len=0
6446   2.076478 41.177.26.55 -> 244.3.160.248 TCP 64 http > 43371 [ACK] Seq=1 Ack=2 Win=64240 Len=0
13451   3.957614 41.177.26.55 -> 244.3.160.248 TCP 66 http > 43522 [SYN, ACK] Seq=0 Ack=1 Win=64240 Len=0 MSS=1460 SACK_PERM=1
13477   3.958348 41.177.26.55 -> 244.3.160.248 TCP 64 http > 43522 [ACK] Seq=1 Ack=352 Win=63889 Len=0
16415   4.486195 41.177.26.55 -> 244.3.160.248 TCP 66 http > 43524 [SYN, ACK] Seq=0 Ack=1 Win=64240 Len=0 MSS=1460 SACK_PERM=1
16418   4.486791 41.177.26.55 -> 244.3.160.248 TCP 64 http > 43524 [ACK] Seq=1 Ack=354 Win=63887 Len=0
16490   4.512306 41.177.26.55 -> 244.3.160.248 TCP 64 http > 43524 [FIN, ACK] Seq=461 Ack=354 Win=64240 Len=0
16493   4.512571 41.177.26.55 -> 244.3.160.248 TCP 64 http > 43524 [ACK] Seq=462 Ack=355 Win=64240 Len=0
20770   6.874483 41.177.26.55 -> 244.3.160.248 TCP 64 http > 43521 [FIN, ACK] Seq=10399 Ack=352 Win=64240 Len=0
20923   6.939228 41.177.26.55 -> 244.3.160.248 TCP 66 http > 43541 [SYN, ACK] Seq=0 Ack=1 Win=64240 Len=0 MSS=1460 SACK_PERM=1
20926   6.940075 41.177.26.55 -> 244.3.160.248 TCP 64 http > 43541 [ACK] Seq=1 Ack=968 Win=63273 Len=0
22076   7.752548 41.177.26.55 -> 244.3.160.248 TCP 64 http > 43522 [ACK] Seq=10402 Ack=353 Win=64240 Len=0
22077   7.752664 41.177.26.55 -> 244.3.160.248 TCP 64 http > 43522 [FIN, ACK] Seq=10402 Ack=353 Win=64240 Len=0
22080   7.752768 41.177.26.55 -> 244.3.160.248 TCP 64 http > 43451 [ACK] Seq=2 Ack=2 Win=64240 Len=0
23696   8.650327 41.177.26.55 -> 244.3.160.248 TCP 66 http > 43584 [SYN, ACK] Seq=0 Ack=1 Win=64240 Len=0 MSS=1460 SACK_PERM=1
23699   8.651054 41.177.26.55 -> 244.3.160.248 TCP 64 http > 43584 [ACK] Seq=1 Ack=377 Win=63864 Len=0
27841  11.113126 41.177.26.55 -> 244.3.160.248 TCP 66 http > 43638 [SYN, ACK] Seq=0 Ack=1 Win=64240 Len=0 MSS=1460 SACK_PERM=1
27845  11.113861 41.177.26.55 -> 244.3.160.248 TCP 64 http > 43638 [ACK] Seq=1 Ack=347 Win=63894 Len=0
29322  11.964649 41.177.26.55 -> 244.3.160.248 TCP 64 http > 43541 [FIN, ACK] Seq=615 Ack=968 Win=64240 Len=0
32435  13.776694 41.177.26.55 -> 244.3.160.248 TCP 64 http > 43452 [ACK] Seq=2 Ack=2 Win=64240 Len=0
32436  13.776767 41.177.26.55 -> 244.3.160.248 TCP 64 http > 43321 [ACK] Seq=1 Ack=2 Win=64240 Len=0
32532  13.804731 41.177.26.55 -> 244.3.160.248 TCP 64 http > 43584 [FIN, ACK] Seq=14195 Ack=377 Win=64240 Len=0
37203  15.520234 41.177.26.55 -> 244.3.160.248 TCP 66 http > 43674 [SYN, ACK] Seq=0 Ack=1 Win=64240 Len=0 MSS=1460 SACK_PERM=1
37206  15.520759 41.177.26.55 -> 244.3.160.248 TCP 64 http > 43674 [ACK] Seq=1 Ack=343 Win=63898 Len=0
37321  15.546991 41.177.26.55 -> 244.3.160.248 TCP 64 http > 43584 [ACK] Seq=14196 Ack=378 Win=64240 Len=0
38714  15.997452 41.177.26.55 -> 244.3.160.248 TCP 64 http > 43638 [ACK] Seq=10396 Ack=348 Win=64240 Len=0
38717  15.997622 41.177.26.55 -> 244.3.160.248 TCP 64 http > 43638 [FIN, ACK] Seq=10396 Ack=348 Win=64240 Len=0
45169  18.886900 41.177.26.55 -> 244.3.160.248 TCP 64 http > 43521 [ACK] Seq=10400 Ack=353 Win=64240 Len=0
50455  20.544747 41.177.26.55 -> 244.3.160.248 TCP 64 http > 43674 [FIN, ACK] Seq=10400 Ack=343 Win=64240 Len=0
52726  21.968788 41.177.26.55 -> 244.3.160.248 TCP 66 http > 43746 [SYN, ACK] Seq=0 Ack=1 Win=64240 Len=0 MSS=1460 SACK_PERM=1
52729  21.969601 41.177.26.55 -> 244.3.160.248 TCP 64 http > 43746 [ACK] Seq=1 Ack=820 Win=63421 Len=0
56186  23.073813 41.177.26.55 -> 244.3.160.248 TCP 66 http > 43747 [SYN, ACK] Seq=0 Ack=1 Win=64240 Len=0 MSS=1460 SACK_PERM=1
56193  23.074395 41.177.26.55 -> 244.3.160.248 TCP 64 http > 43747 [ACK] Seq=1 Ack=354 Win=63887 Len=0
56255  23.094084 41.177.26.55 -> 244.3.160.248 TCP 64 http > 43747 [FIN, ACK] Seq=461 Ack=354 Win=64240 Len=0
56258  23.094419 41.177.26.55 -> 244.3.160.248 TCP 64 http > 43747 [ACK] Seq=462 Ack=355 Win=64240 Len=0
62025  25.445178 41.177.26.55 -> 244.3.160.248 TCP 66 http > 43776 [SYN, ACK] Seq=0 Ack=1 Win=64240 Len=0 MSS=1460 SACK_PERM=1
62028  25.445892 41.177.26.55 -> 244.3.160.248 TCP 64 http > 43776 [ACK] Seq=1 Ack=814 Win=63427 Len=0
65423  26.994737 41.177.26.55 -> 244.3.160.248 TCP 64 http > 43746 [FIN, ACK] Seq=587 Ack=820 Win=64240 Len=0
66671  27.485948 41.177.26.55 -> 244.3.160.248 TCP 66 http > 43781 [SYN, ACK] Seq=0 Ack=1 Win=64240 Len=0 MSS=1460 SACK_PERM=1
66679  27.486780 41.177.26.55 -> 244.3.160.248 TCP 64 http > 43781 [ACK] Seq=1 Ack=1171 Win=63070 Len=0
68611  28.347318 41.177.26.55 -> 244.3.160.248 TCP 66 http > 43787 [SYN, ACK] Seq=0 Ack=1 Win=64240 Len=0 MSS=1460 SACK_PERM=1
68614  28.347862 41.177.26.55 -> 244.3.160.248 TCP 64 http > 43787 [ACK] Seq=1 Ack=344 Win=63897 Len=0
73160  29.861847 41.177.26.55 -> 244.3.160.248 TCP 64 http > 43674 [ACK] Seq=10401 Ack=344 Win=64240 Len=0
75384  30.474902 41.177.26.55 -> 244.3.160.248 TCP 64 http > 43776 [FIN, ACK] Seq=595 Ack=814 Win=64240 Len=0
77592  30.961881 41.177.26.55 -> 244.3.160.248 TCP 66 http > 43812 [SYN, ACK] Seq=0 Ack=1 Win=64240 Len=0 MSS=1460 SACK_PERM=1
77596  30.962651 41.177.26.55 -> 244.3.160.248 TCP 64 http > 43812 [ACK] Seq=1 Ack=805 Win=63436 Len=0
77870  31.039091 41.177.26.55 -> 244.3.160.248 TCP 64 http > 43812 [ACK] Seq=11308 Ack=1551 Win=64240 Len=0
77899  31.044570 41.177.26.55 -> 244.3.160.248 TCP 66 http > 43813 [SYN, ACK] Seq=0 Ack=1 Win=64240 Len=0 MSS=1460 SACK_PERM=1
77902  31.044985 41.177.26.55 -> 244.3.160.248 TCP 66 http > 43814 [SYN, ACK] Seq=0 Ack=1 Win=64240 Len=0 MSS=1460 SACK_PERM=1
77905  31.045382 41.177.26.55 -> 244.3.160.248 TCP 64 http > 43813 [ACK] Seq=1 Ack=747 Win=63494 Len=0
77907  31.045802 41.177.26.55 -> 244.3.160.248 TCP 64 http > 43814 [ACK] Seq=1 Ack=741 Win=63500 Len=0
77912  31.046793 41.177.26.55 -> 244.3.160.248 TCP 66 http > 43815 [SYN, ACK] Seq=0 Ack=1 Win=64240 Len=0 MSS=1460 SACK_PERM=1
77917  31.047512 41.177.26.55 -> 244.3.160.248 TCP 64 http > 43815 [ACK] Seq=1 Ack=742 Win=63499 Len=0
78193  31.112603 41.177.26.55 -> 244.3.160.248 TCP 64 http > 43813 [ACK] Seq=2553 Ack=1498 Win=64240 Len=0
78390  31.152829 41.177.26.55 -> 244.3.160.248 TCP 64 http > 43815 [ACK] Seq=1126 Ack=1482 Win=64240 Len=0
78408  31.157183 41.177.26.55 -> 244.3.160.248 TCP 64 http > 43814 [ACK] Seq=1498 Ack=1481 Win=64240 Len=0
79019  31.335452 41.177.26.55 -> 244.3.160.248 TCP 64 http > 43814 [ACK] Seq=47047 Ack=2954 Win=64240 Len=0
83630  32.514804 41.177.26.55 -> 244.3.160.248 TCP 64 http > 43781 [FIN, ACK] Seq=669 Ack=1171 Win=64240 Len=0
85657  33.277059 41.177.26.55 -> 244.3.160.248 TCP 64 http > 43541 [ACK] Seq=616 Ack=969 Win=64240 Len=0
85883  33.375021 41.177.26.55 -> 244.3.160.248 TCP 64 http > 43787 [FIN, ACK] Seq=10401 Ack=344 Win=64240 Len=0
90374  34.810167 41.177.26.55 -> 244.3.160.248 TCP 66 http > 43877 [SYN, ACK] Seq=0 Ack=1 Win=64240 Len=0 MSS=1460 SACK_PERM=1
90377  34.810816 41.177.26.55 -> 244.3.160.248 TCP 64 http > 43877 [ACK] Seq=1 Ack=354 Win=63887 Len=0
95473  36.044859 41.177.26.55 -> 244.3.160.248 TCP 64 http > 43812 [FIN, ACK] Seq=13053 Ack=1551 Win=64240 Len=0
95786  36.114984 41.177.26.55 -> 244.3.160.248 TCP 64 http > 43813 [FIN, ACK] Seq=6290 Ack=1498 Win=64240 Len=0
96742  36.344905 41.177.26.55 -> 244.3.160.248 TCP 64 http > 43815 [FIN, ACK] Seq=125201 Ack=3708 Win=64240 Len=0
102258  37.424861 41.177.26.55 -> 244.3.160.248 TCP 64 http > 43814 [FIN, ACK] Seq=54621 Ack=3766 Win=64240 Len=0
104871  37.928236 41.177.26.55 -> 244.3.160.248 TCP 66 http > 43995 [SYN, ACK] Seq=0 Ack=1 Win=64240 Len=0 MSS=1460 SACK_PERM=1
104874  37.928991 41.177.26.55 -> 244.3.160.248 TCP 64 http > 43995 [ACK] Seq=1 Ack=814 Win=63427 Len=0
105229  37.996631 41.177.26.55 -> 244.3.160.248 TCP 66 http > 44005 [SYN, ACK] Seq=0 Ack=1 Win=64240 Len=0 MSS=1460 SACK_PERM=1
105234  37.997277 41.177.26.55 -> 244.3.160.248 TCP 64 http > 44005 [ACK] Seq=1 Ack=352 Win=63889 Len=0
108215  38.929166 41.177.26.55 -> 244.3.160.248 TCP 66 http > 44033 [SYN, ACK] Seq=0 Ack=1 Win=64240 Len=0 MSS=1460 SACK_PERM=1
108218  38.929824 41.177.26.55 -> 244.3.160.248 TCP 64 http > 44033 [ACK] Seq=1 Ack=347 Win=63894 Len=0
110862  39.660360 41.177.26.55 -> 244.3.160.248 TCP 64 http > 43995 [ACK] Seq=8101 Ack=1578 Win=64240 Len=0
111464  39.834887 41.177.26.55 -> 244.3.160.248 TCP 64 http > 43877 [FIN, ACK] Seq=10851 Ack=354 Win=64240 Len=0
116145  41.437148 41.177.26.55 -> 244.3.160.248 TCP 64 http > 43746 [ACK] Seq=588 Ack=821 Win=64240 Len=0
117399  42.083768 41.177.26.55 -> 244.3.160.248 TCP 64 http > 43776 [ACK] Seq=596 Ack=815 Win=64240 Len=0
120606  43.024940 41.177.26.55 -> 244.3.160.248 TCP 64 http > 44005 [FIN, ACK] Seq=10399 Ack=352 Win=64240 Len=0
123588  43.965039 41.177.26.55 -> 244.3.160.248 TCP 64 http > 44033 [FIN, ACK] Seq=10332 Ack=347 Win=64240 Len=0
124733  44.517251 41.177.26.55 -> 244.3.160.248 TCP 64 http > 43781 [ACK] Seq=670 Ack=1172 Win=64240 Len=0
125047  44.665070 41.177.26.55 -> 244.3.160.248 TCP 64 http > 43995 [FIN, ACK] Seq=8527 Ack=1578 Win=64240 Len=0
129834  45.387948 41.177.26.55 -> 244.3.160.248 TCP 64 http > 43787 [ACK] Seq=10402 Ack=345 Win=64240 Len=0
129878  45.400333 41.177.26.55 -> 244.3.160.248 TCP 66 http > 44063 [SYN, ACK] Seq=0 Ack=1 Win=64240 Len=0 MSS=1460 SACK_PERM=1
129883  45.401156 41.177.26.55 -> 244.3.160.248 TCP 64 http > 44063 [ACK] Seq=1 Ack=821 Win=63420 Len=0
133822  46.559925 41.177.26.55 -> 244.3.160.248 TCP 66 http > 44069 [SYN, ACK] Seq=0 Ack=1 Win=64240 Len=0 MSS=1460 SACK_PERM=1
133829  46.560490 41.177.26.55 -> 244.3.160.248 TCP 64 http > 44069 [ACK] Seq=1 Ack=354 Win=63887 Len=0
134010  46.583664 41.177.26.55 -> 244.3.160.248 TCP 64 http > 44069 [FIN, ACK] Seq=461 Ack=354 Win=64240 Len=0
134012  46.583721 41.177.26.55 -> 244.3.160.248 TCP 64 http > 44069 [ACK] Seq=462 Ack=355 Win=64240 Len=0
143788  49.396991 41.177.26.55 -> 244.3.160.248 TCP 64 http > 44033 [ACK] Seq=10333 Ack=348 Win=64240 Len=0
143790  49.397885 41.177.26.55 -> 244.3.160.248 TCP 64 http > 44005 [ACK] Seq=10400 Ack=353 Win=64240 Len=0
144057  49.461048 41.177.26.55 -> 244.3.160.248 TCP 66 http > 44071 [SYN, ACK] Seq=0 Ack=1 Win=64240 Len=0 MSS=1460 SACK_PERM=1
144088  49.461880 41.177.26.55 -> 244.3.160.248 TCP 64 http > 44071 [ACK] Seq=1 Ack=851 Win=63390 Len=0
145381  49.834490 41.177.26.55 -> 244.3.160.248 TCP 66 http > 44072 [SYN, ACK] Seq=0 Ack=1 Win=64240 Len=0 MSS=1460 SACK_PERM=1
145385  49.835195 41.177.26.55 -> 244.3.160.248 TCP 64 http > 44072 [ACK] Seq=1 Ack=842 Win=64240 Len=0
145496  49.856678 41.177.26.55 -> 244.3.160.248 TCP 64 http > 44072 [ACK] Seq=653 Ack=843 Win=64240 Len=0
145497  49.856749 41.177.26.55 -> 244.3.160.248 TCP 64 http > 44072 [FIN, ACK] Seq=653 Ack=843 Win=64240 Len=0
147579  50.655049 41.177.26.55 -> 244.3.160.248 TCP 64 http > 44063 [FIN, ACK] Seq=14732 Ack=821 Win=64240 Len=0
151121  51.847354 41.177.26.55 -> 244.3.160.248 TCP 64 http > 43877 [ACK] Seq=10852 Ack=355 Win=64240 Len=0
160008  54.485165 41.177.26.55 -> 244.3.160.248 TCP 64 http > 44071 [FIN, ACK] Seq=457 Ack=851 Win=64240 Len=0
170391  56.677589 41.177.26.55 -> 244.3.160.248 TCP 64 http > 43814 [ACK] Seq=54622 Ack=3767 Win=64240 Len=0
170392  56.677593 41.177.26.55 -> 244.3.160.248 TCP 64 http > 43995 [ACK] Seq=8528 Ack=1579 Win=64240 Len=0
170554  56.707532 41.177.26.55 -> 244.3.160.248 TCP 64 http > 43815 [ACK] Seq=125202 Ack=3709 Win=64240 Len=0
170631  56.727407 41.177.26.55 -> 244.3.160.248 TCP 64 http > 43813 [ACK] Seq=6291 Ack=1499 Win=64240 Len=0
186574  62.667576 41.177.26.55 -> 244.3.160.248 TCP 64 http > 44063 [ACK] Seq=14733 Ack=822 Win=64240 Len=0
186575  62.667653 41.177.26.55 -> 244.3.160.248 TCP 64 http > 43812 [ACK] Seq=13054 Ack=1552 Win=64240 Len=0
189216  64.586955 41.177.26.55 -> 244.3.160.248 TCP 66 http > 44126 [SYN, ACK] Seq=0 Ack=1 Win=64240 Len=0 MSS=1460 SACK_PERM=1
189222  64.587723 41.177.26.55 -> 244.3.160.248 TCP 64 http > 44126 [ACK] Seq=1 Ack=378 Win=63863 Len=0
190708  65.570323 41.177.26.55 -> 244.3.160.248 TCP 66 http > 44129 [SYN, ACK] Seq=0 Ack=1 Win=64240 Len=0 MSS=1460 SACK_PERM=1
190711  65.570996 41.177.26.55 -> 244.3.160.248 TCP 64 http > 44129 [ACK] Seq=1 Ack=354 Win=63887 Len=0
190757  65.594963 41.177.26.55 -> 244.3.160.248 TCP 64 http > 44129 [FIN, ACK] Seq=461 Ack=354 Win=64240 Len=0
190761  65.595187 41.177.26.55 -> 244.3.160.248 TCP 64 http > 44129 [ACK] Seq=462 Ack=355 Win=64240 Len=0
193243  66.487665 41.177.26.55 -> 244.3.160.248 TCP 64 http > 44071 [ACK] Seq=458 Ack=852 Win=64240 Len=0
199288  68.532884 41.177.26.55 -> 244.3.160.248 TCP 66 http > 44195 [SYN, ACK] Seq=0 Ack=1 Win=64240 Len=0 MSS=1460 SACK_PERM=1
199291  68.533500 41.177.26.55 -> 244.3.160.248 TCP 64 http > 44195 [ACK] Seq=1 Ack=347 Win=63894 Len=0
201368  69.468547 41.177.26.55 -> 244.3.160.248 TCP 64 http > 44195 [ACK] Seq=10404 Ack=348 Win=64240 Len=0
201369  69.468659 41.177.26.55 -> 244.3.160.248 TCP 64 http > 44195 [FIN, ACK] Seq=10404 Ack=348 Win=64240 Len=0
201857  69.675360 41.177.26.55 -> 244.3.160.248 TCP 64 http > 44126 [FIN, ACK] Seq=14010 Ack=378 Win=64240 Len=0
205117  70.539746 41.177.26.55 -> 244.3.160.248 TCP 64 http > 44126 [ACK] Seq=14011 Ack=379 Win=64240 Len=0
209062  71.975723 41.177.26.55 -> 244.3.160.248 TCP 66 http > 44226 [SYN, ACK] Seq=0 Ack=1 Win=64240 Len=0 MSS=1460 SACK_PERM=1
209065  71.976359 41.177.26.55 -> 244.3.160.248 TCP 64 http > 44226 [ACK] Seq=1 Ack=346 Win=63895 Len=0
218362  74.522760 41.177.26.55 -> 244.3.160.248 TCP 66 http > 44254 [SYN, ACK] Seq=0 Ack=1 Win=64240 Len=0 MSS=1460 SACK_PERM=1
218369  74.523614 41.177.26.55 -> 244.3.160.248 TCP 64 http > 44254 [ACK] Seq=1 Ack=720 Win=63521 Len=0
219325  74.948740 41.177.26.55 -> 244.3.160.248 TCP 66 http > 44256 [SYN, ACK] Seq=0 Ack=1 Win=64240 Len=0 MSS=1460 SACK_PERM=1
219329  74.949425 41.177.26.55 -> 244.3.160.248 TCP 64 http > 44256 [ACK] Seq=1 Ack=568 Win=63673 Len=0
219605  75.097971 41.177.26.55 -> 244.3.160.248 TCP 64 http > 44256 [ACK] Seq=8221 Ack=569 Win=64240 Len=0
219606  75.098033 41.177.26.55 -> 244.3.160.248 TCP 64 http > 44256 [FIN, ACK] Seq=8221 Ack=569 Win=64240 Len=0
224389  76.691727 41.177.26.55 -> 244.3.160.248 TCP 66 http > 44284 [SYN, ACK] Seq=0 Ack=1 Win=64240 Len=0 MSS=1460 SACK_PERM=1
224392  76.692543 41.177.26.55 -> 244.3.160.248 TCP 64 http > 44284 [ACK] Seq=1 Ack=336 Win=63905 Len=0
225199  77.005375 41.177.26.55 -> 244.3.160.248 TCP 64 http > 44226 [FIN, ACK] Seq=10403 Ack=346 Win=64240 Len=0
229340  78.836843 41.177.26.55 -> 244.3.160.248 TCP 66 http > 44303 [SYN, ACK] Seq=0 Ack=1 Win=64240 Len=0 MSS=1460 SACK_PERM=1
229343  78.837656 41.177.26.55 -> 244.3.160.248 TCP 64 http > 44303 [ACK] Seq=1 Ack=629 Win=63612 Len=0
229392  78.849716 41.177.26.55 -> 244.3.160.248 TCP 64 http > 44303 [ACK] Seq=112 Ack=630 Win=64240 Len=0
229393  78.849773 41.177.26.55 -> 244.3.160.248 TCP 64 http > 44303 [FIN, ACK] Seq=112 Ack=630 Win=64240 Len=0
230955  79.772681 41.177.26.55 -> 244.3.160.248 TCP 66 http > 44310 [SYN, ACK] Seq=0 Ack=1 Win=64240 Len=0 MSS=1460 SACK_PERM=1
230958  79.773394 41.177.26.55 -> 244.3.160.248 TCP 64 http > 44310 [ACK] Seq=1 Ack=625 Win=63616 Len=0
230989  79.779214 41.177.26.55 -> 244.3.160.248 TCP 64 http > 44310 [ACK] Seq=110 Ack=626 Win=64240 Len=0
230990  79.779283 41.177.26.55 -> 244.3.160.248 TCP 64 http > 44310 [FIN, ACK] Seq=110 Ack=626 Win=64240 Len=0
232575  80.425571 41.177.26.55 -> 244.3.160.248 TCP 64 http > 44254 [FIN, ACK] Seq=177 Ack=720 Win=64240 Len=0
234929  81.705503 41.177.26.55 -> 244.3.160.248 TCP 64 http > 44284 [FIN, ACK] Seq=10733 Ack=336 Win=64240 Len=0
240974  83.783289 41.177.26.55 -> 244.3.160.248 TCP 66 http > 44349 [SYN, ACK] Seq=0 Ack=1 Win=64240 Len=0 MSS=1460 SACK_PERM=1
240978  83.783909 41.177.26.55 -> 244.3.160.248 TCP 64 http > 44349 [ACK] Seq=1 Ack=341 Win=63900 Len=0
241364  84.055617 41.177.26.55 -> 244.3.160.248 TCP 64 http > 44349 [ACK] Seq=10398 Ack=342 Win=64240 Len=0
241365  84.055702 41.177.26.55 -> 244.3.160.248 TCP 64 http > 44349 [FIN, ACK] Seq=10398 Ack=342 Win=64240 Len=0
241626  84.187095 41.177.26.55 -> 244.3.160.248 TCP 66 http > 44350 [SYN, ACK] Seq=0 Ack=1 Win=64240 Len=0 MSS=1460 SACK_PERM=1
241629  84.187788 41.177.26.55 -> 244.3.160.248 TCP 64 http > 44350 [ACK] Seq=1 Ack=354 Win=63887 Len=0
241682  84.213702 41.177.26.55 -> 244.3.160.248 TCP 64 http > 44350 [FIN, ACK] Seq=461 Ack=354 Win=64240 Len=0
241685  84.214012 41.177.26.55 -> 244.3.160.248 TCP 64 http > 44350 [ACK] Seq=462 Ack=355 Win=64240 Len=0
244827  85.404665 41.177.26.55 -> 244.3.160.248 TCP 66 http > 44357 [SYN, ACK] Seq=0 Ack=1 Win=64240 Len=0 MSS=1460 SACK_PERM=1
244830  85.405522 41.177.26.55 -> 244.3.160.248 TCP 64 http > 44357 [ACK] Seq=1 Ack=805 Win=64240 Len=0
248059  87.302249 41.177.26.55 -> 244.3.160.248 TCP 66 http > 44380 [SYN, ACK] Seq=0 Ack=1 Win=64240 Len=0 MSS=1460 SACK_PERM=1
248062  87.302975 41.177.26.55 -> 244.3.160.248 TCP 64 http > 44380 [ACK] Seq=1 Ack=343 Win=63898 Len=0
248479  87.493844 41.177.26.55 -> 244.3.160.248 TCP 66 http > 44382 [SYN, ACK] Seq=0 Ack=1 Win=64240 Len=0 MSS=1460 SACK_PERM=1
248482  87.494412 41.177.26.55 -> 244.3.160.248 TCP 64 http > 44382 [ACK] Seq=1 Ack=334 Win=63907 Len=0
251708  89.018421 41.177.26.55 -> 244.3.160.248 TCP 64 http > 44226 [ACK] Seq=10404 Ack=347 Win=64240 Len=0
254625  90.425625 41.177.26.55 -> 244.3.160.248 TCP 64 http > 44357 [FIN, ACK] Seq=577 Ack=805 Win=64240 Len=0
272732  92.238574 41.177.26.55 -> 244.3.160.248 TCP 64 http > 44254 [ACK] Seq=178 Ack=721 Win=64240 Len=0
274064  92.325615 41.177.26.55 -> 244.3.160.248 TCP 64 http > 44380 [FIN, ACK] Seq=10400 Ack=343 Win=64240 Len=0
274372  92.511519 41.177.26.55 -> 244.3.160.248 TCP 66 http > 44482 [SYN, ACK] Seq=0 Ack=1 Win=64240 Len=0 MSS=1460 SACK_PERM=1
274375  92.512267 41.177.26.55 -> 244.3.160.248 TCP 64 http > 44482 [ACK] Seq=1 Ack=1048 Win=63193 Len=0
274388  92.515605 41.177.26.55 -> 244.3.160.248 TCP 64 http > 44382 [FIN, ACK] Seq=10397 Ack=334 Win=64240 Len=0
274899  92.678832 41.177.26.55 -> 244.3.160.248 TCP 66 http > 44488 [SYN, ACK] Seq=0 Ack=1 Win=64240 Len=0 MSS=1460 SACK_PERM=1
274902  92.679632 41.177.26.55 -> 244.3.160.248 TCP 64 http > 44488 [ACK] Seq=1 Ack=851 Win=63390 Len=0
275311  92.776178 41.177.26.55 -> 244.3.160.248 TCP 66 http > 44489 [SYN, ACK] Seq=0 Ack=1 Win=64240 Len=0 MSS=1460 SACK_PERM=1
275314  92.776991 41.177.26.55 -> 244.3.160.248 TCP 64 http > 44489 [ACK] Seq=1 Ack=848 Win=63393 Len=0
275316  92.777603 41.177.26.55 -> 244.3.160.248 TCP 66 http > 44490 [SYN, ACK] Seq=0 Ack=1 Win=64240 Len=0 MSS=1460 SACK_PERM=1
275319  92.778501 41.177.26.55 -> 244.3.160.248 TCP 64 http > 44490 [ACK] Seq=1 Ack=825 Win=63416 Len=0
275498  92.808797 41.177.26.55 -> 244.3.160.248 TCP 66 http > 44494 [SYN, ACK] Seq=0 Ack=1 Win=64240 Len=0 MSS=1460 SACK_PERM=1
275508  92.811033 41.177.26.55 -> 244.3.160.248 TCP 64 http > 44494 [ACK] Seq=1 Ack=831 Win=63410 Len=0
275537  92.817575 41.177.26.55 -> 244.3.160.248 TCP 66 http > 44497 [SYN, ACK] Seq=0 Ack=1 Win=64240 Len=0 MSS=1460 SACK_PERM=1
275554  92.818477 41.177.26.55 -> 244.3.160.248 TCP 64 http > 44497 [ACK] Seq=1 Ack=828 Win=63413 Len=0
275563  92.821343 41.177.26.55 -> 244.3.160.248 TCP 64 http > 44488 [ACK] Seq=11041 Ack=1676 Win=64240 Len=0
275781  92.916998 41.177.26.55 -> 244.3.160.248 TCP 66 http > 44500 [SYN, ACK] Seq=0 Ack=1 Win=64240 Len=0 MSS=1460 SACK_PERM=1
275784  92.917745 41.177.26.55 -> 244.3.160.248 TCP 64 http > 44500 [ACK] Seq=1 Ack=821 Win=63420 Len=0
277636  93.718251 41.177.26.55 -> 244.3.160.248 TCP 64 http > 44284 [ACK] Seq=10734 Ack=337 Win=64240 Len=0
278648  94.083362 41.177.26.55 -> 244.3.160.248 TCP 66 http > 44516 [SYN, ACK] Seq=0 Ack=1 Win=64240 Len=0 MSS=1460 SACK_PERM=1
278651  94.084086 41.177.26.55 -> 244.3.160.248 TCP 64 http > 44516 [ACK] Seq=1 Ack=815 Win=63426 Len=0
279038  94.169938 41.177.26.55 -> 244.3.160.248 TCP 66 http > 44521 [SYN, ACK] Seq=0 Ack=1 Win=64240 Len=0 MSS=1460 SACK_PERM=1
279041  94.170685 41.177.26.55 -> 244.3.160.248 TCP 64 http > 44521 [ACK] Seq=1 Ack=954 Win=63287 Len=0
280735  94.526897 41.177.26.55 -> 244.3.160.248 TCP 64 http > 44482 [ACK] Seq=685 Ack=1049 Win=64240 Len=0
280737  94.527042 41.177.26.55 -> 244.3.160.248 TCP 64 http > 44482 [FIN, ACK] Seq=685 Ack=1049 Win=64240 Len=0
282365  94.822872 41.177.26.55 -> 244.3.160.248 TCP 64 http > 44494 [ACK] Seq=4049 Ack=832 Win=64240 Len=0
282367  94.823007 41.177.26.55 -> 244.3.160.248 TCP 64 http > 44494 [FIN, ACK] Seq=4049 Ack=832 Win=64240 Len=0
286180  95.671881 41.177.26.55 -> 244.3.160.248 TCP 64 http > 44489 [ACK] Seq=10530 Ack=1749 Win=64240 Len=0
287402  96.009936 41.177.26.55 -> 244.3.160.248 TCP 64 http > 44497 [ACK] Seq=428 Ack=1720 Win=64240 Len=0
287425  96.012910 41.177.26.55 -> 244.3.160.248 TCP 64 http > 44500 [ACK] Seq=2767 Ack=1712 Win=64240 Len=0
287558  96.042679 41.177.26.55 -> 244.3.160.248 TCP 64 http > 44490 [ACK] Seq=140475 Ack=1710 Win=64240 Len=0
292214  97.893896 41.177.26.55 -> 244.3.160.248 TCP 64 http > 44380 [ACK] Seq=10401 Ack=344 Win=64240 Len=0
292891  98.334213 41.177.26.55 -> 244.3.160.248 TCP 66 http > 44585 [SYN, ACK] Seq=0 Ack=1 Win=64240 Len=0 MSS=1460 SACK_PERM=1
292894  98.334782 41.177.26.55 -> 244.3.160.248 TCP 64 http > 44585 [ACK] Seq=1 Ack=346 Win=63895 Len=0
294245  99.105675 41.177.26.55 -> 244.3.160.248 TCP 64 http > 44516 [FIN, ACK] Seq=457 Ack=815 Win=64240 Len=0
294428  99.195928 41.177.26.55 -> 244.3.160.248 TCP 64 http > 44521 [FIN, ACK] Seq=595 Ack=954 Win=64240 Len=0
297707 100.415634 41.177.26.55 -> 244.3.160.248 TCP 64 http > 44488 [ACK] Seq=13949 Ack=3444 Win=64240 Len=0
298579 100.645549 41.177.26.55 -> 244.3.160.248 TCP 66 http > 44589 [SYN, ACK] Seq=0 Ack=1 Win=64240 Len=0 MSS=1460 SACK_PERM=1
298584 100.646112 41.177.26.55 -> 244.3.160.248 TCP 64 http > 44589 [ACK] Seq=1 Ack=345 Win=63896 Len=0
298775 100.715652 41.177.26.55 -> 244.3.160.248 TCP 64 http > 44489 [ACK] Seq=11134 Ack=3570 Win=64240 Len=0
299565 101.015787 41.177.26.55 -> 244.3.160.248 TCP 64 http > 44497 [FIN, ACK] Seq=36280 Ack=1720 Win=64240 Len=0
299566 101.015792 41.177.26.55 -> 244.3.160.248 TCP 64 http > 44500 [FIN, ACK] Seq=31388 Ack=1712 Win=64240 Len=0
301687 101.743484 41.177.26.55 -> 244.3.160.248 TCP 66 http > 44596 [SYN, ACK] Seq=0 Ack=1 Win=64240 Len=0 MSS=1460 SACK_PERM=1
301690 101.744038 41.177.26.55 -> 244.3.160.248 TCP 64 http > 44596 [ACK] Seq=1 Ack=347 Win=63894 Len=0
302971 102.428278 41.177.26.55 -> 244.3.160.248 TCP 64 http > 44357 [ACK] Seq=578 Ack=806 Win=64240 Len=0
304787 103.180247 41.177.26.55 -> 244.3.160.248 TCP 66 http > 44612 [SYN, ACK] Seq=0 Ack=1 Win=64240 Len=0 MSS=1460 SACK_PERM=1
304790 103.180828 41.177.26.55 -> 244.3.160.248 TCP 64 http > 44612 [ACK] Seq=1 Ack=354 Win=63887 Len=0
304889 103.203546 41.177.26.55 -> 244.3.160.248 TCP 64 http > 44612 [FIN, ACK] Seq=461 Ack=354 Win=64240 Len=0
304892 103.203807 41.177.26.55 -> 244.3.160.248 TCP 64 http > 44612 [ACK] Seq=462 Ack=355 Win=64240 Len=0
305289 103.365860 41.177.26.55 -> 244.3.160.248 TCP 64 http > 44585 [FIN, ACK] Seq=10403 Ack=346 Win=64240 Len=0
306092 103.820654 41.177.26.55 -> 244.3.160.248 TCP 66 http > 44617 [SYN, ACK] Seq=0 Ack=1 Win=64240 Len=0 MSS=1460 SACK_PERM=1
306095 103.821295 41.177.26.55 -> 244.3.160.248 TCP 64 http > 44617 [ACK] Seq=1 Ack=354 Win=63887 Len=0
307450 104.528340 41.177.26.55 -> 244.3.160.248 TCP 64 http > 44382 [ACK] Seq=10398 Ack=335 Win=64240 Len=0
309493 105.545737 41.177.26.55 -> 244.3.160.248 TCP 64 http > 44488 [FIN, ACK] Seq=18198 Ack=3444 Win=64240 Len=0
309617 105.585782 41.177.26.55 -> 244.3.160.248 TCP 64 http > 44490 [FIN, ACK] Seq=146267 Ack=2561 Win=64240 Len=0
309738 105.685861 41.177.26.55 -> 244.3.160.248 TCP 64 http > 44589 [FIN, ACK] Seq=10402 Ack=345 Win=64240 Len=0
310091 105.845839 41.177.26.55 -> 244.3.160.248 TCP 64 http > 44489 [FIN, ACK] Seq=11310 Ack=3570 Win=64240 Len=0
312812 106.775820 41.177.26.55 -> 244.3.160.248 TCP 64 http > 44596 [FIN, ACK] Seq=10402 Ack=347 Win=64240 Len=0
314327 107.243204 41.177.26.55 -> 244.3.160.248 TCP 64 http > 44617 [ACK] Seq=10401 Ack=355 Win=64240 Len=0
314332 107.243344 41.177.26.55 -> 244.3.160.248 TCP 64 http > 44617 [FIN, ACK] Seq=10401 Ack=355 Win=64240 Len=0
315257 107.658419 41.177.26.55 -> 244.3.160.248 TCP 66 http > 44638 [SYN, ACK] Seq=0 Ack=1 Win=64240 Len=0 MSS=1460 SACK_PERM=1
315260 107.659116 41.177.26.55 -> 244.3.160.248 TCP 64 http > 44638 [ACK] Seq=1 Ack=814 Win=63427 Len=0
315379 107.706172 41.177.26.55 -> 244.3.160.248 TCP 64 http > 44638 [ACK] Seq=400 Ack=815 Win=64240 Len=0
315381 107.706258 41.177.26.55 -> 244.3.160.248 TCP 64 http > 44638 [FIN, ACK] Seq=400 Ack=815 Win=64240 Len=0
319905 109.112967 41.177.26.55 -> 244.3.160.248 TCP 64 http > 44516 [ACK] Seq=458 Ack=816 Win=64240 Len=0
324042 111.208566 41.177.26.55 -> 244.3.160.248 TCP 64 http > 44521 [ACK] Seq=596 Ack=955 Win=64240 Len=0
324875 111.612128 41.177.26.55 -> 244.3.160.248 TCP 66 http > 44724 [SYN, ACK] Seq=0 Ack=1 Win=64240 Len=0 MSS=1460 SACK_PERM=1
324878 111.612725 41.177.26.55 -> 244.3.160.248 TCP 64 http > 44724 [ACK] Seq=1 Ack=425 Win=63816 Len=0
327273 113.088431 41.177.26.55 -> 244.3.160.248 TCP 64 http > 44500 [ACK] Seq=31389 Ack=1713 Win=64240 Len=0
327325 113.128450 41.177.26.55 -> 244.3.160.248 TCP 64 http > 44497 [ACK] Seq=36281 Ack=1721 Win=64240 Len=0
330949 115.268758 41.177.26.55 -> 244.3.160.248 TCP 66 http > 44836 [SYN, ACK] Seq=0 Ack=1 Win=64240 Len=0 MSS=1460 SACK_PERM=1
330952 115.269422 41.177.26.55 -> 244.3.160.248 TCP 64 http > 44836 [ACK] Seq=1 Ack=380 Win=63861 Len=0
331161 115.378534 41.177.26.55 -> 244.3.160.248 TCP 64 http > 44585 [ACK] Seq=10404 Ack=347 Win=64240 Len=0
333583 116.645995 41.177.26.55 -> 244.3.160.248 TCP 64 http > 44724 [FIN, ACK] Seq=5683 Ack=425 Win=64240 Len=0
334050 116.759830 41.177.26.55 -> 244.3.160.248 TCP 64 http > 44488 [ACK] Seq=18199 Ack=3445 Win=64240 Len=0
334052 116.760846 41.177.26.55 -> 244.3.160.248 TCP 64 http > 44490 [ACK] Seq=146268 Ack=2562 Win=64240 Len=0
334056 116.762630 41.177.26.55 -> 244.3.160.248 TCP 64 http > 44489 [ACK] Seq=11311 Ack=3571 Win=64240 Len=0
336838 117.576160 41.177.26.55 -> 244.3.160.248 TCP 64 http > 44724 [ACK] Seq=5684 Ack=426 Win=64240 Len=0
338177 117.689066 41.177.26.55 -> 244.3.160.248 TCP 64 http > 44589 [ACK] Seq=10403 Ack=346 Win=64240 Len=0
351399 118.788608 41.177.26.55 -> 244.3.160.248 TCP 64 http > 44596 [ACK] Seq=10403 Ack=348 Win=64240 Len=0
353730 120.355967 41.177.26.55 -> 244.3.160.248 TCP 64 http > 44836 [FIN, ACK] Seq=14231 Ack=380 Win=64240 Len=0
356366 121.597756 41.177.26.55 -> 244.3.160.248 TCP 64 http > 44836 [ACK] Seq=14232 Ack=381 Win=64240 Len=0
356578 121.712513 41.177.26.55 -> 244.3.160.248 TCP 66 http > 44913 [SYN, ACK] Seq=0 Ack=1 Win=64240 Len=0 MSS=1460 SACK_PERM=1
356582 121.713113 41.177.26.55 -> 244.3.160.248 TCP 64 http > 44913 [ACK] Seq=1 Ack=343 Win=63898 Len=0
358470 122.386166 41.177.26.55 -> 244.3.160.248 TCP 66 http > 44923 [SYN, ACK] Seq=0 Ack=1 Win=64240 Len=0 MSS=1460 SACK_PERM=1
358475 122.386824 41.177.26.55 -> 244.3.160.248 TCP 64 http > 44923 [ACK] Seq=1 Ack=354 Win=63887 Len=0
358540 122.407182 41.177.26.55 -> 244.3.160.248 TCP 64 http > 44923 [FIN, ACK] Seq=461 Ack=354 Win=64240 Len=0
358542 122.407405 41.177.26.55 -> 244.3.160.248 TCP 64 http > 44923 [ACK] Seq=462 Ack=355 Win=64240 Len=0
365142 124.453560 41.177.26.55 -> 244.3.160.248 TCP 64 http > 44913 [ACK] Seq=10400 Ack=344 Win=64240 Len=0
365143 124.453684 41.177.26.55 -> 244.3.160.248 TCP 64 http > 44913 [FIN, ACK] Seq=10400 Ack=344 Win=64240 Len=0
390606 130.521902 41.177.26.55 -> 244.3.160.248 TCP 66 http > 44983 [SYN, ACK] Seq=0 Ack=1 Win=64240 Len=0 MSS=1460 SACK_PERM=1
390613 130.522536 41.177.26.55 -> 244.3.160.248 TCP 64 http > 44983 [ACK] Seq=1 Ack=352 Win=63889 Len=0
404167 135.432474 41.177.26.55 -> 244.3.160.248 TCP 66 http > 45014 [SYN, ACK] Seq=0 Ack=1 Win=64240 Len=0 MSS=1460 SACK_PERM=1
404170 135.433212 41.177.26.55 -> 244.3.160.248 TCP 64 http > 45014 [ACK] Seq=1 Ack=348 Win=63893 Len=0
404505 135.546104 41.177.26.55 -> 244.3.160.248 TCP 64 http > 44983 [FIN, ACK] Seq=10399 Ack=352 Win=64240 Len=0
429497 140.446232 41.177.26.55 -> 244.3.160.248 TCP 64 http > 45014 [FIN, ACK] Seq=10405 Ack=348 Win=64240 Len=0
432267 141.106912 41.177.26.55 -> 244.3.160.248 TCP 66 http > invision-ag [SYN, ACK] Seq=0 Ack=1 Win=64240 Len=0 MSS=1460 SACK_PERM=1
432270 141.107623 41.177.26.55 -> 244.3.160.248 TCP 64 http > invision-ag [ACK] Seq=1 Ack=354 Win=63887 Len=0
432362 141.133575 41.177.26.55 -> 244.3.160.248 TCP 64 http > invision-ag [FIN, ACK] Seq=461 Ack=354 Win=64240 Len=0
432373 141.133824 41.177.26.55 -> 244.3.160.248 TCP 64 http > invision-ag [ACK] Seq=462 Ack=355 Win=64240 Len=0
438109 142.898206 41.177.26.55 -> 244.3.160.248 TCP 64 http > 44983 [ACK] Seq=10400 Ack=353 Win=64240 Len=0
439433 143.139920 41.177.26.55 -> 244.3.160.248 TCP 66 http > 45062 [SYN, ACK] Seq=0 Ack=1 Win=64240 Len=0 MSS=1460 SACK_PERM=1
439436 143.140707 41.177.26.55 -> 244.3.160.248 TCP 64 http > 45062 [ACK] Seq=1 Ack=426 Win=63815 Len=0
451194 146.902190 41.177.26.55 -> 244.3.160.248 TCP 66 http > 45132 [SYN, ACK] Seq=0 Ack=1 Win=64240 Len=0 MSS=1460 SACK_PERM=1
451201 146.902911 41.177.26.55 -> 244.3.160.248 TCP 64 http > 45132 [ACK] Seq=1 Ack=914 Win=63327 Len=0
451905 147.222101 41.177.26.55 -> 244.3.160.248 TCP 66 http > 45134 [SYN, ACK] Seq=0 Ack=1 Win=64240 Len=0 MSS=1460 SACK_PERM=1
451914 147.222912 41.177.26.55 -> 244.3.160.248 TCP 64 http > 45134 [ACK] Seq=1 Ack=864 Win=63377 Len=0
451928 147.225422 41.177.26.55 -> 244.3.160.248 TCP 66 http > 45135 [SYN, ACK] Seq=0 Ack=1 Win=64240 Len=0 MSS=1460 SACK_PERM=1
451933 147.226356 41.177.26.55 -> 244.3.160.248 TCP 64 http > 45135 [ACK] Seq=1 Ack=861 Win=64240 Len=0
451969 147.229750 41.177.26.55 -> 244.3.160.248 TCP 66 http > 45136 [SYN, ACK] Seq=0 Ack=1 Win=64240 Len=0 MSS=1460 SACK_PERM=1
451980 147.230805 41.177.26.55 -> 244.3.160.248 TCP 64 http > 45136 [ACK] Seq=1 Ack=884 Win=63357 Len=0
452124 147.245998 41.177.26.55 -> 244.3.160.248 TCP 64 http > 45132 [ACK] Seq=11041 Ack=1780 Win=64240 Len=0
452219 147.264084 41.177.26.55 -> 244.3.160.248 TCP 64 http > 45134 [ACK] Seq=428 Ack=1725 Win=64240 Len=0
452571 147.405557 41.177.26.55 -> 244.3.160.248 TCP 64 http > 45136 [ACK] Seq=10530 Ack=1740 Win=64240 Len=0
453316 147.836199 41.177.26.55 -> 244.3.160.248 TCP 64 http > 45135 [ACK] Seq=140475 Ack=1725 Win=64240 Len=0
453663 147.970529 41.177.26.55 -> 244.3.160.248 TCP 66 http > 45137 [SYN, ACK] Seq=0 Ack=1 Win=64240 Len=0 MSS=1460 SACK_PERM=1
453668 147.971353 41.177.26.55 -> 244.3.160.248 TCP 64 http > 45137 [ACK] Seq=1 Ack=930 Win=63311 Len=0
453812 148.009287 41.177.26.55 -> 244.3.160.248 TCP 64 http > 45137 [ACK] Seq=601 Ack=931 Win=64240 Len=0
453813 148.009356 41.177.26.55 -> 244.3.160.248 TCP 64 http > 45137 [FIN, ACK] Seq=601 Ack=931 Win=64240 Len=0
454250 148.226331 41.177.26.55 -> 244.3.160.248 TCP 64 http > 45062 [FIN, ACK] Seq=9899 Ack=426 Win=64240 Len=0
455226 148.577503 41.177.26.55 -> 244.3.160.248 TCP 66 http > 45139 [SYN, ACK] Seq=0 Ack=1 Win=64240 Len=0 MSS=1460 SACK_PERM=1
455229 148.578086 41.177.26.55 -> 244.3.160.248 TCP 64 http > 45139 [ACK] Seq=1 Ack=344 Win=63897 Len=0
461388 151.156309 41.177.26.55 -> 244.3.160.248 TCP 64 http > 45132 [ACK] Seq=15517 Ack=3501 Win=64240 Len=0
463932 152.459476 41.177.26.55 -> 244.3.160.248 TCP 64 http > 45014 [ACK] Seq=10406 Ack=349 Win=64240 Len=0
464981 152.836402 41.177.26.55 -> 244.3.160.248 TCP 64 http > 45134 [FIN, ACK] Seq=37780 Ack=2590 Win=64240 Len=0
465009 152.846389 41.177.26.55 -> 244.3.160.248 TCP 64 http > 45136 [FIN, ACK] Seq=14317 Ack=2598 Win=64240 Len=0
465010 152.846532 41.177.26.55 -> 244.3.160.248 TCP 64 http > 45135 [FIN, ACK] Seq=169096 Ack=1725 Win=64240 Len=0
466459 153.572018 41.177.26.55 -> 244.3.160.248 TCP 66 http > 45151 [SYN, ACK] Seq=0 Ack=1 Win=64240 Len=0 MSS=1460 SACK_PERM=1
466463 153.572617 41.177.26.55 -> 244.3.160.248 TCP 64 http > 45151 [ACK] Seq=1 Ack=349 Win=63892 Len=0
466573 153.616457 41.177.26.55 -> 244.3.160.248 TCP 64 http > 45139 [FIN, ACK] Seq=10401 Ack=344 Win=64240 Len=0
471773 155.801862 41.177.26.55 -> 244.3.160.248 TCP 64 http > 45062 [ACK] Seq=9900 Ack=427 Win=64240 Len=0
473955 156.326581 41.177.26.55 -> 244.3.160.248 TCP 64 http > 45132 [FIN, ACK] Seq=22708 Ack=4362 Win=64240 Len=0
481188 158.626435 41.177.26.55 -> 244.3.160.248 TCP 64 http > 45151 [FIN, ACK] Seq=10677 Ack=349 Win=64240 Len=0
488121 160.404469 41.177.26.55 -> 244.3.160.248 TCP 66 http > 45178 [SYN, ACK] Seq=0 Ack=1 Win=64240 Len=0 MSS=1460 SACK_PERM=1
488130 160.405445 41.177.26.55 -> 244.3.160.248 TCP 64 http > 45178 [ACK] Seq=1 Ack=354 Win=63887 Len=0
488211 160.425327 41.177.26.55 -> 244.3.160.248 TCP 64 http > 45178 [FIN, ACK] Seq=461 Ack=354 Win=64240 Len=0
488219 160.425734 41.177.26.55 -> 244.3.160.248 TCP 64 http > 45178 [ACK] Seq=462 Ack=355 Win=64240 Len=0
512939 164.849606 41.177.26.55 -> 244.3.160.248 TCP 64 http > 45136 [ACK] Seq=14318 Ack=2599 Win=64240 Len=0
512961 164.859483 41.177.26.55 -> 244.3.160.248 TCP 64 http > 45135 [ACK] Seq=169097 Ack=1726 Win=64240 Len=0
514015 165.139435 41.177.26.55 -> 244.3.160.248 TCP 64 http > 45134 [ACK] Seq=37781 Ack=2591 Win=64240 Len=0
514681 165.629395 41.177.26.55 -> 244.3.160.248 TCP 64 http > 45139 [ACK] Seq=10402 Ack=345 Win=64240 Len=0
520312 168.339581 41.177.26.55 -> 244.3.160.248 TCP 64 http > 45132 [ACK] Seq=22709 Ack=4363 Win=64240 Len=0
525486 170.639852 41.177.26.55 -> 244.3.160.248 TCP 64 http > 45151 [ACK] Seq=10678 Ack=350 Win=64240 Len=0
525870 170.872475 41.177.26.55 -> 244.3.160.248 TCP 66 http > 45339 [SYN, ACK] Seq=0 Ack=1 Win=64240 Len=0 MSS=1460 SACK_PERM=1
525874 170.873140 41.177.26.55 -> 244.3.160.248 TCP 64 http > 45339 [ACK] Seq=1 Ack=382 Win=63859 Len=0
528519 171.725644 41.177.26.55 -> 244.3.160.248 TCP 66 http > 45354 [SYN, ACK] Seq=0 Ack=1 Win=64240 Len=0 MSS=1460 SACK_PERM=1
528527 171.726423 41.177.26.55 -> 244.3.160.248 TCP 64 http > 45354 [ACK] Seq=1 Ack=1004 Win=63237 Len=0
543126 176.036716 41.177.26.55 -> 244.3.160.248 TCP 64 http > 45339 [FIN, ACK] Seq=13944 Ack=382 Win=64240 Len=0
546740 176.756791 41.177.26.55 -> 244.3.160.248 TCP 64 http > 45354 [FIN, ACK] Seq=457 Ack=1004 Win=64240 Len=0
549861 177.104371 41.177.26.55 -> 244.3.160.248 TCP 64 http > 45339 [ACK] Seq=13945 Ack=383 Win=64240 Len=0
556586 179.224242 41.177.26.55 -> 244.3.160.248 TCP 66 http > 45530 [SYN, ACK] Seq=0 Ack=1 Win=64240 Len=0 MSS=1460 SACK_PERM=1
556589 179.224897 41.177.26.55 -> 244.3.160.248 TCP 64 http > 45530 [ACK] Seq=1 Ack=351 Win=63890 Len=0
556612 179.244740 41.177.26.55 -> 244.3.160.248 TCP 64 http > 45530 [FIN, ACK] Seq=461 Ack=351 Win=64240 Len=0
556616 179.245032 41.177.26.55 -> 244.3.160.248 TCP 64 http > 45530 [ACK] Seq=462 Ack=352 Win=64240 Len=0
566972 181.240936 41.177.26.55 -> 244.3.160.248 TCP 66 http > 45537 [SYN, ACK] Seq=0 Ack=1 Win=64240 Len=0 MSS=1460 SACK_PERM=1
566975 181.241827 41.177.26.55 -> 244.3.160.248 TCP 64 http > 45537 [ACK] Seq=1 Ack=955 Win=63286 Len=0
584500 186.266905 41.177.26.55 -> 244.3.160.248 TCP 64 http > 45537 [FIN, ACK] Seq=585 Ack=955 Win=64240 Len=0
586844 186.942058 41.177.26.55 -> 244.3.160.248 TCP 66 http > 45579 [SYN, ACK] Seq=0 Ack=1 Win=64240 Len=0 MSS=1460 SACK_PERM=1
586850 186.942634 41.177.26.55 -> 244.3.160.248 TCP 64 http > 45579 [ACK] Seq=1 Ack=344 Win=63897 Len=0
595455 188.759846 41.177.26.55 -> 244.3.160.248 TCP 64 http > 45354 [ACK] Seq=458 Ack=1005 Win=64240 Len=0
603684 191.573023 41.177.26.55 -> 244.3.160.248 TCP 66 http > 45609 [SYN, ACK] Seq=0 Ack=1 Win=64240 Len=0 MSS=1460 SACK_PERM=1
603687 191.573799 41.177.26.55 -> 244.3.160.248 TCP 64 http > 45609 [ACK] Seq=1 Ack=346 Win=63895 Len=0
605169 191.966941 41.177.26.55 -> 244.3.160.248 TCP 64 http > 45579 [FIN, ACK] Seq=10401 Ack=344 Win=64240 Len=0
608284 193.153933 41.177.26.55 -> 244.3.160.248 TCP 66 http > 45610 [SYN, ACK] Seq=0 Ack=1 Win=64240 Len=0 MSS=1460 SACK_PERM=1
608287 193.155074 41.177.26.55 -> 244.3.160.248 TCP 64 http > 45610 [ACK] Seq=1 Ack=1134 Win=63107 Len=0
618177 196.597134 41.177.26.55 -> 244.3.160.248 TCP 64 http > 45609 [FIN, ACK] Seq=10403 Ack=346 Win=64240 Len=0
624171 198.110337 41.177.26.55 -> 244.3.160.248 TCP 66 http > 45620 [SYN, ACK] Seq=0 Ack=1 Win=64240 Len=0 MSS=1460 SACK_PERM=1
624174 198.111092 41.177.26.55 -> 244.3.160.248 TCP 64 http > 45620 [ACK] Seq=1 Ack=351 Win=63890 Len=0
624211 198.135028 41.177.26.55 -> 244.3.160.248 TCP 64 http > 45620 [FIN, ACK] Seq=461 Ack=351 Win=64240 Len=0
624214 198.135366 41.177.26.55 -> 244.3.160.248 TCP 64 http > 45620 [ACK] Seq=462 Ack=352 Win=64240 Len=0
624297 198.177133 41.177.26.55 -> 244.3.160.248 TCP 64 http > 45610 [FIN, ACK] Seq=669 Ack=1134 Win=64240 Len=0
626049 198.741386 41.177.26.55 -> 244.3.160.248 TCP 66 http > 45624 [SYN, ACK] Seq=0 Ack=1 Win=64240 Len=0 MSS=1460 SACK_PERM=1
626067 198.742446 41.177.26.55 -> 244.3.160.248 TCP 64 http > 45624 [ACK] Seq=1 Ack=775 Win=63466 Len=0
635457 200.830105 41.177.26.55 -> 244.3.160.248 TCP 64 http > 45537 [ACK] Seq=586 Ack=956 Win=64240 Len=0
648522 203.787130 41.177.26.55 -> 244.3.160.248 TCP 64 http > 45624 [FIN, ACK] Seq=5361 Ack=775 Win=64240 Len=0
649334 203.980103 41.177.26.55 -> 244.3.160.248 TCP 64 http > 45579 [ACK] Seq=10402 Ack=345 Win=64240 Len=0
669590 208.610701 41.177.26.55 -> 244.3.160.248 TCP 64 http > 45609 [ACK] Seq=10404 Ack=347 Win=64240 Len=0
676240 211.523615 41.177.26.55 -> 244.3.160.248 TCP 64 http > 45610 [ACK] Seq=670 Ack=1135 Win=64240 Len=0
682935 214.198903 41.177.26.55 -> 244.3.160.248 TCP 66 http > 45702 [SYN, ACK] Seq=0 Ack=1 Win=64240 Len=0 MSS=1460 SACK_PERM=1
682939 214.199664 41.177.26.55 -> 244.3.160.248 TCP 64 http > 45702 [ACK] Seq=1 Ack=346 Win=63895 Len=0
686734 215.802945 41.177.26.55 -> 244.3.160.248 TCP 64 http > 45624 [ACK] Seq=5362 Ack=776 Win=64240 Len=0
689386 216.981797 41.177.26.55 -> 244.3.160.248 TCP 66 http > 45709 [SYN, ACK] Seq=0 Ack=1 Win=64240 Len=0 MSS=1460 SACK_PERM=1
689389 216.982523 41.177.26.55 -> 244.3.160.248 TCP 64 http > 45709 [ACK] Seq=1 Ack=344 Win=63897 Len=0
689580 217.108765 41.177.26.55 -> 244.3.160.248 TCP 66 http > 45710 [SYN, ACK] Seq=0 Ack=1 Win=64240 Len=0 MSS=1460 SACK_PERM=1
689583 217.109502 41.177.26.55 -> 244.3.160.248 TCP 64 http > 45710 [ACK] Seq=1 Ack=351 Win=63890 Len=0
689656 217.135906 41.177.26.55 -> 244.3.160.248 TCP 64 http > 45710 [FIN, ACK] Seq=461 Ack=351 Win=64240 Len=0
689660 217.136186 41.177.26.55 -> 244.3.160.248 TCP 64 http > 45710 [ACK] Seq=462 Ack=352 Win=64240 Len=0
692308 218.616993 41.177.26.55 -> 244.3.160.248 TCP 66 http > 45725 [SYN, ACK] Seq=0 Ack=1 Win=64240 Len=0 MSS=1460 SACK_PERM=1
692311 218.617705 41.177.26.55 -> 244.3.160.248 TCP 64 http > 45725 [ACK] Seq=1 Ack=946 Win=63295 Len=0
693700 219.247287 41.177.26.55 -> 244.3.160.248 TCP 64 http > 45702 [FIN, ACK] Seq=10402 Ack=346 Win=64240 Len=0
697669 221.022505 41.177.26.55 -> 244.3.160.248 TCP 66 http > 45736 [SYN, ACK] Seq=0 Ack=1 Win=64240 Len=0 MSS=1460 SACK_PERM=1
697672 221.023206 41.177.26.55 -> 244.3.160.248 TCP 64 http > 45736 [ACK] Seq=1 Ack=342 Win=63899 Len=0
699994 222.008722 41.177.26.55 -> 244.3.160.248 TCP 66 http > 45739 [SYN, ACK] Seq=0 Ack=1 Win=64240 Len=0 MSS=1460 SACK_PERM=1
699997 222.009344 41.177.26.55 -> 244.3.160.248 TCP 64 http > 45739 [ACK] Seq=1 Ack=388 Win=63853 Len=0
700019 222.017321 41.177.26.55 -> 244.3.160.248 TCP 64 http > 45709 [FIN, ACK] Seq=10401 Ack=344 Win=64240 Len=0
709547 226.047364 41.177.26.55 -> 244.3.160.248 TCP 64 http > 45736 [FIN, ACK] Seq=10398 Ack=342 Win=64240 Len=0
712997 227.472715 41.177.26.55 -> 244.3.160.248 TCP 66 http > 45745 [SYN, ACK] Seq=0 Ack=1 Win=64240 Len=0 MSS=1460 SACK_PERM=1
713001 227.473449 41.177.26.55 -> 244.3.160.248 TCP 64 http > 45745 [ACK] Seq=1 Ack=333 Win=63908 Len=0
714756 228.079563 41.177.26.55 -> 244.3.160.248 TCP 66 http > 45749 [SYN, ACK] Seq=0 Ack=1 Win=64240 Len=0 MSS=1460 SACK_PERM=1
714761 228.080072 41.177.26.55 -> 244.3.160.248 TCP 64 http > 45749 [ACK] Seq=1 Ack=225 Win=64016 Len=0
714860 228.110143 41.177.26.55 -> 244.3.160.248 TCP 64 http > 45749 [ACK] Seq=5252 Ack=449 Win=64240 Len=0
715495 228.327404 41.177.26.55 -> 244.3.160.248 TCP 64 http > 45739 [FIN, ACK] Seq=6162 Ack=388 Win=64240 Len=0
716229 228.590058 41.177.26.55 -> 244.3.160.248 TCP 64 http > 45749 [ACK] Seq=16292 Ack=450 Win=64240 Len=0
716230 228.590151 41.177.26.55 -> 244.3.160.248 TCP 64 http > 45749 [FIN, ACK] Seq=16292 Ack=450 Win=64240 Len=0
716634 228.697338 41.177.26.55 -> 244.3.160.248 TCP 64 http > 45725 [FIN, ACK] Seq=355 Ack=946 Win=64240 Len=0
716699 228.718529 41.177.26.55 -> 244.3.160.248 TCP 66 http > 45751 [SYN, ACK] Seq=0 Ack=1 Win=64240 Len=0 MSS=1460 SACK_PERM=1
716704 228.719160 41.177.26.55 -> 244.3.160.248 TCP 64 http > 45751 [ACK] Seq=1 Ack=344 Win=63897 Len=0
718544 229.398183 41.177.26.55 -> 244.3.160.248 TCP 64 http > 45739 [ACK] Seq=6163 Ack=389 Win=64240 Len=0
723177 231.260623 41.177.26.55 -> 244.3.160.248 TCP 64 http > 45702 [ACK] Seq=10403 Ack=347 Win=64240 Len=0
726101 232.527608 41.177.26.55 -> 244.3.160.248 TCP 64 http > 45745 [FIN, ACK] Seq=11101 Ack=333 Win=64240 Len=0
727406 233.263991 41.177.26.55 -> 244.3.160.248 TCP 66 http > 45759 [SYN, ACK] Seq=0 Ack=1 Win=64240 Len=0 MSS=1460 SACK_PERM=1
727409 233.264738 41.177.26.55 -> 244.3.160.248 TCP 64 http > 45759 [ACK] Seq=1 Ack=772 Win=63469 Len=0
728146 233.653964 41.177.26.55 -> 244.3.160.248 TCP 64 http > 45709 [ACK] Seq=10402 Ack=345 Win=64240 Len=0
728400 233.767492 41.177.26.55 -> 244.3.160.248 TCP 64 http > 45751 [FIN, ACK] Seq=10676 Ack=344 Win=64240 Len=0
729369 234.151821 41.177.26.55 -> 244.3.160.248 TCP 66 http > 45760 [SYN, ACK] Seq=0 Ack=1 Win=64240 Len=0 MSS=1460 SACK_PERM=1
729372 234.152630 41.177.26.55 -> 244.3.160.248 TCP 64 http > 45760 [ACK] Seq=1 Ack=425 Win=63816 Len=0
740384 236.392113 41.177.26.55 -> 244.3.160.248 TCP 66 http > 45761 [SYN, ACK] Seq=0 Ack=1 Win=64240 Len=0 MSS=1460 SACK_PERM=1
740387 236.392922 41.177.26.55 -> 244.3.160.248 TCP 64 http > 45761 [ACK] Seq=1 Ack=351 Win=63890 Len=0
740858 236.593631 41.177.26.55 -> 244.3.160.248 TCP 64 http > 45761 [FIN, ACK] Seq=461 Ack=351 Win=64240 Len=0
740861 236.594091 41.177.26.55 -> 244.3.160.248 TCP 64 http > 45761 [ACK] Seq=462 Ack=352 Win=64240 Len=0
744624 238.060944 41.177.26.55 -> 244.3.160.248 TCP 64 http > 45736 [ACK] Seq=10399 Ack=343 Win=64240 Len=0
745596 238.337566 41.177.26.55 -> 244.3.160.248 TCP 64 http > 45759 [FIN, ACK] Seq=12754 Ack=772 Win=64240 Len=0
746320 238.634824 41.177.26.55 -> 244.3.160.248 TCP 66 http > 45775 [SYN, ACK] Seq=0 Ack=1 Win=64240 Len=0 MSS=1460 SACK_PERM=1
746323 238.635480 41.177.26.55 -> 244.3.160.248 TCP 64 http > 45775 [ACK] Seq=1 Ack=343 Win=63898 Len=0
747608 239.177595 41.177.26.55 -> 244.3.160.248 TCP 64 http > 45760 [FIN, ACK] Seq=1136 Ack=425 Win=64240 Len=0
748707 239.820204 41.177.26.55 -> 244.3.160.248 TCP 66 http > 45790 [SYN, ACK] Seq=0 Ack=1 Win=64240 Len=0 MSS=1460 SACK_PERM=1
748710 239.821417 41.177.26.55 -> 244.3.160.248 TCP 64 http > 45790 [ACK] Seq=1 Ack=1162 Win=63079 Len=0
750880 240.701353 41.177.26.55 -> 244.3.160.248 TCP 64 http > 45725 [ACK] Seq=356 Ack=947 Win=64240 Len=0
753178 241.709739 41.177.26.55 -> 244.3.160.248 TCP 66 http > 45819 [SYN, ACK] Seq=0 Ack=1 Win=64240 Len=0 MSS=1460 SACK_PERM=1
753183 241.710537 41.177.26.55 -> 244.3.160.248 TCP 64 http > 45819 [ACK] Seq=1 Ack=337 Win=63904 Len=0
755208 242.734982 41.177.26.55 -> 244.3.160.248 TCP 64 http > 45775 [ACK] Seq=10400 Ack=344 Win=64240 Len=0
755209 242.735079 41.177.26.55 -> 244.3.160.248 TCP 64 http > 45775 [FIN, ACK] Seq=10400 Ack=344 Win=64240 Len=0
759123 244.540888 41.177.26.55 -> 244.3.160.248 TCP 64 http > 45745 [ACK] Seq=11102 Ack=334 Win=64240 Len=0
759547 244.847607 41.177.26.55 -> 244.3.160.248 TCP 64 http > 45790 [FIN, ACK] Seq=579 Ack=1162 Win=64240 Len=0
761781 245.780933 41.177.26.55 -> 244.3.160.248 TCP 64 http > 45751 [ACK] Seq=10677 Ack=345 Win=64240 Len=0
764416 246.727717 41.177.26.55 -> 244.3.160.248 TCP 64 http > 45819 [FIN, ACK] Seq=10719 Ack=337 Win=64240 Len=0
776838 250.297725 41.177.26.55 -> 244.3.160.248 TCP 64 http > 45760 [ACK] Seq=1137 Ack=426 Win=64240 Len=0
776959 250.350961 41.177.26.55 -> 244.3.160.248 TCP 64 http > 45759 [ACK] Seq=12755 Ack=773 Win=64240 Len=0
789870 256.564928 41.177.26.55 -> 244.3.160.248 TCP 66 http > 45947 [SYN, ACK] Seq=0 Ack=1 Win=64240 Len=0 MSS=1460 SACK_PERM=1
789874 256.565658 41.177.26.55 -> 244.3.160.248 TCP 64 http > 45947 [ACK] Seq=1 Ack=778 Win=63463 Len=0
792028 257.453367 41.177.26.55 -> 244.3.160.248 TCP 66 http > 45949 [SYN, ACK] Seq=0 Ack=1 Win=64240 Len=0 MSS=1460 SACK_PERM=1
792031 257.453939 41.177.26.55 -> 244.3.160.248 TCP 64 http > 45949 [ACK] Seq=1 Ack=351 Win=63890 Len=0
792076 257.476513 41.177.26.55 -> 244.3.160.248 TCP 64 http > 45949 [FIN, ACK] Seq=461 Ack=351 Win=64240 Len=0
792078 257.476609 41.177.26.55 -> 244.3.160.248 TCP 64 http > 45949 [ACK] Seq=462 Ack=352 Win=64240 Len=0
793477 258.427894 41.177.26.55 -> 244.3.160.248 TCP 64 http > 45819 [ACK] Seq=10720 Ack=338 Win=64240 Len=0
798807 260.630234 41.177.26.55 -> 244.3.160.248 TCP 66 http > 45955 [SYN, ACK] Seq=0 Ack=1 Win=64240 Len=0 MSS=1460 SACK_PERM=1
798812 260.630909 41.177.26.55 -> 244.3.160.248 TCP 64 http > 45955 [ACK] Seq=1 Ack=414 Win=63827 Len=0
799076 260.708872 41.177.26.55 -> 244.3.160.248 TCP 66 http > 45956 [SYN, ACK] Seq=0 Ack=1 Win=64240 Len=0 MSS=1460 SACK_PERM=1
799079 260.709447 41.177.26.55 -> 244.3.160.248 TCP 64 http > 45956 [ACK] Seq=1 Ack=347 Win=63894 Len=0
800694 261.607923 41.177.26.55 -> 244.3.160.248 TCP 64 http > 45947 [FIN, ACK] Seq=4631 Ack=778 Win=64240 Len=0
800804 261.677179 41.177.26.55 -> 244.3.160.248 TCP 64 http > 45790 [ACK] Seq=580 Ack=1163 Win=64240 Len=0
805733 263.316275 41.177.26.55 -> 244.3.160.248 TCP 66 http > 46019 [SYN, ACK] Seq=0 Ack=1 Win=64240 Len=0 MSS=1460 SACK_PERM=1
805737 263.316965 41.177.26.55 -> 244.3.160.248 TCP 64 http > 46019 [ACK] Seq=1 Ack=345 Win=63896 Len=0
814756 265.657901 41.177.26.55 -> 244.3.160.248 TCP 64 http > 45955 [FIN, ACK] Seq=1136 Ack=414 Win=64240 Len=0
815147 265.747882 41.177.26.55 -> 244.3.160.248 TCP 64 http > 45956 [FIN, ACK] Seq=10404 Ack=347 Win=64240 Len=0
816407 266.293344 41.177.26.55 -> 244.3.160.248 TCP 66 http > 46050 [SYN, ACK] Seq=0 Ack=1 Win=64240 Len=0 MSS=1460 SACK_PERM=1
816412 266.294239 41.177.26.55 -> 244.3.160.248 TCP 64 http > 46050 [ACK] Seq=1 Ack=351 Win=63890 Len=0
818215 266.963048 41.177.26.55 -> 244.3.160.248 TCP 64 http > 45955 [ACK] Seq=1137 Ack=415 Win=64240 Len=0
821934 268.337931 41.177.26.55 -> 244.3.160.248 TCP 64 http > 46019 [FIN, ACK] Seq=10402 Ack=345 Win=64240 Len=0
829638 270.961438 41.177.26.55 -> 244.3.160.248 TCP 66 http > 46185 [SYN, ACK] Seq=0 Ack=1 Win=64240 Len=0 MSS=1460 SACK_PERM=1
829641 270.962547 41.177.26.55 -> 244.3.160.248 TCP 64 http > 46185 [ACK] Seq=1 Ack=1291 Win=62950 Len=0
830328 271.317923 41.177.26.55 -> 244.3.160.248 TCP 64 http > 46050 [FIN, ACK] Seq=10401 Ack=351 Win=64240 Len=0
832253 272.127446 41.177.26.55 -> 244.3.160.248 TCP 66 http > 46188 [SYN, ACK] Seq=0 Ack=1 Win=64240 Len=0 MSS=1460 SACK_PERM=1
832279 272.131841 41.177.26.55 -> 244.3.160.248 TCP 64 http > 46188 [ACK] Seq=1 Ack=337 Win=64240 Len=0
835106 273.375626 41.177.26.55 -> 244.3.160.248 TCP 64 http > 46185 [ACK] Seq=177 Ack=2295 Win=64240 Len=0
835814 273.611459 41.177.26.55 -> 244.3.160.248 TCP 64 http > 45947 [ACK] Seq=4632 Ack=779 Win=64240 Len=0
841332 276.065513 41.177.26.55 -> 244.3.160.248 TCP 66 http > 46196 [SYN, ACK] Seq=0 Ack=1 Win=64240 Len=0 MSS=1460 SACK_PERM=1
841335 276.066274 41.177.26.55 -> 244.3.160.248 TCP 64 http > 46196 [ACK] Seq=1 Ack=351 Win=63890 Len=0
841366 276.086229 41.177.26.55 -> 244.3.160.248 TCP 64 http > 46196 [FIN, ACK] Seq=461 Ack=351 Win=64240 Len=0
841370 276.086476 41.177.26.55 -> 244.3.160.248 TCP 64 http > 46196 [ACK] Seq=462 Ack=352 Win=64240 Len=0
843225 277.138015 41.177.26.55 -> 244.3.160.248 TCP 64 http > 46188 [FIN, ACK] Seq=10719 Ack=337 Win=64240 Len=0
844253 277.751457 41.177.26.55 -> 244.3.160.248 TCP 64 http > 45956 [ACK] Seq=10405 Ack=348 Win=64240 Len=0
844575 277.953703 41.177.26.55 -> 244.3.160.248 TCP 66 http > 46206 [SYN, ACK] Seq=0 Ack=1 Win=64240 Len=0 MSS=1460 SACK_PERM=1
844581 277.954256 41.177.26.55 -> 244.3.160.248 TCP 64 http > 46206 [ACK] Seq=1 Ack=390 Win=63851 Len=0
845890 278.688021 41.177.26.55 -> 244.3.160.248 TCP 64 http > 46185 [FIN, ACK] Seq=9130 Ack=3294 Win=64240 Len=0
846602 279.140225 41.177.26.55 -> 244.3.160.248 TCP 64 http > 46188 [ACK] Seq=10720 Ack=338 Win=64240 Len=0
848441 280.351636 41.177.26.55 -> 244.3.160.248 TCP 64 http > 46019 [ACK] Seq=10403 Ack=346 Win=64240 Len=0
854337 282.425826 41.177.26.55 -> 244.3.160.248 TCP 66 http > 46285 [SYN, ACK] Seq=0 Ack=1 Win=64240 Len=0 MSS=1460 SACK_PERM=1
854340 282.426550 41.177.26.55 -> 244.3.160.248 TCP 64 http > 46285 [ACK] Seq=1 Ack=343 Win=63898 Len=0
856731 283.128173 41.177.26.55 -> 244.3.160.248 TCP 64 http > 46206 [FIN, ACK] Seq=8139 Ack=390 Win=64240 Len=0
857374 283.331663 41.177.26.55 -> 244.3.160.248 TCP 64 http > 46050 [ACK] Seq=10402 Ack=352 Win=64240 Len=0
862891 284.806131 41.177.26.55 -> 244.3.160.248 TCP 64 http > 46206 [ACK] Seq=8140 Ack=391 Win=64240 Len=0
863801 285.348311 41.177.26.55 -> 244.3.160.248 TCP 66 http > 46315 [SYN, ACK] Seq=0 Ack=1 Win=64240 Len=0 MSS=1460 SACK_PERM=1
863804 285.348967 41.177.26.55 -> 244.3.160.248 TCP 64 http > 46315 [ACK] Seq=1 Ack=434 Win=63807 Len=0
869418 287.438319 41.177.26.55 -> 244.3.160.248 TCP 64 http > 46285 [FIN, ACK] Seq=10799 Ack=343 Win=64240 Len=0
869422 287.444875 41.177.26.55 -> 244.3.160.248 TCP 66 http > 46342 [SYN, ACK] Seq=0 Ack=1 Win=64240 Len=0 MSS=1460 SACK_PERM=1
869425 287.445628 41.177.26.55 -> 244.3.160.248 TCP 64 http > 46342 [ACK] Seq=1 Ack=345 Win=63896 Len=0
876578 290.378195 41.177.26.55 -> 244.3.160.248 TCP 64 http > 46315 [FIN, ACK] Seq=5685 Ack=434 Win=64240 Len=0
877119 290.701742 41.177.26.55 -> 244.3.160.248 TCP 64 http > 46185 [ACK] Seq=9131 Ack=3295 Win=64240 Len=0
879449 292.468478 41.177.26.55 -> 244.3.160.248 TCP 64 http > 46342 [FIN, ACK] Seq=10399 Ack=345 Win=64240 Len=0
885300 293.971245 41.177.26.55 -> 244.3.160.248 TCP 64 http > 46315 [ACK] Seq=5686 Ack=435 Win=64240 Len=0
885381 294.009853 41.177.26.55 -> 244.3.160.248 TCP 66 http > 46427 [SYN, ACK] Seq=0 Ack=1 Win=64240 Len=0 MSS=1460 SACK_PERM=1
885386 294.010585 41.177.26.55 -> 244.3.160.248 TCP 64 http > 46427 [ACK] Seq=1 Ack=348 Win=63893 Len=0
892599 295.428437 41.177.26.55 -> 244.3.160.248 TCP 66 http > 46453 [SYN, ACK] Seq=0 Ack=1 Win=64240 Len=0 MSS=1460 SACK_PERM=1
892604 295.429223 41.177.26.55 -> 244.3.160.248 TCP 64 http > 46453 [ACK] Seq=1 Ack=351 Win=63890 Len=0
892673 295.457056 41.177.26.55 -> 244.3.160.248 TCP 64 http > 46453 [FIN, ACK] Seq=461 Ack=351 Win=64240 Len=0
892677 295.457338 41.177.26.55 -> 244.3.160.248 TCP 64 http > 46453 [ACK] Seq=462 Ack=352 Win=64240 Len=0
902587 297.749237 41.177.26.55 -> 244.3.160.248 TCP 64 http > 46285 [ACK] Seq=10800 Ack=344 Win=64240 Len=0
904079 298.156996 41.177.26.55 -> 244.3.160.248 TCP 66 http > 46471 [SYN, ACK] Seq=0 Ack=1 Win=64240 Len=0 MSS=1460 SACK_PERM=1
904083 298.157602 41.177.26.55 -> 244.3.160.248 TCP 64 http > 46471 [ACK] Seq=1 Ack=340 Win=63901 Len=0
907347 299.048361 41.177.26.55 -> 244.3.160.248 TCP 64 http > 46427 [FIN, ACK] Seq=10398 Ack=348 Win=64240 Len=0
909668 300.474677 41.177.26.55 -> 244.3.160.248 TCP 64 http > 46427 [ACK] Seq=10399 Ack=349 Win=64240 Len=0
909716 300.502493 41.177.26.55 -> 244.3.160.248 TCP 64 http > 46342 [ACK] Seq=10400 Ack=346 Win=64240 Len=0
914853 303.168456 41.177.26.55 -> 244.3.160.248 TCP 64 http > 46471 [FIN, ACK] Seq=10397 Ack=340 Win=64240 Len=0
920097 304.975653 41.177.26.55 -> 244.3.160.248 TCP 66 http > 46498 [SYN, ACK] Seq=0 Ack=1 Win=64240 Len=0 MSS=1460 SACK_PERM=1
920103 304.976361 41.177.26.55 -> 244.3.160.248 TCP 64 http > 46498 [ACK] Seq=1 Ack=784 Win=63457 Len=0
928545 309.360441 41.177.26.55 -> 244.3.160.248 TCP 66 http > 46587 [SYN, ACK] Seq=0 Ack=1 Win=64240 Len=0 MSS=1460 SACK_PERM=1
928556 309.361318 41.177.26.55 -> 244.3.160.248 TCP 64 http > 46587 [ACK] Seq=1 Ack=824 Win=63417 Len=0
930937 310.188496 41.177.26.55 -> 244.3.160.248 TCP 64 http > 46498 [FIN, ACK] Seq=4815 Ack=784 Win=64240 Len=0
931383 310.332313 41.177.26.55 -> 244.3.160.248 TCP 64 http > 46587 [ACK] Seq=567 Ack=825 Win=64240 Len=0
931384 310.332393 41.177.26.55 -> 244.3.160.248 TCP 64 http > 46587 [FIN, ACK] Seq=567 Ack=825 Win=64240 Len=0
931783 310.434901 41.177.26.55 -> 244.3.160.248 TCP 66 http > 46588 [SYN, ACK] Seq=0 Ack=1 Win=64240 Len=0 MSS=1460 SACK_PERM=1
931793 310.435523 41.177.26.55 -> 244.3.160.248 TCP 64 http > 46588 [ACK] Seq=1 Ack=354 Win=63887 Len=0
933456 311.015526 41.177.26.55 -> 244.3.160.248 TCP 66 http > 46589 [SYN, ACK] Seq=0 Ack=1 Win=64240 Len=0 MSS=1460 SACK_PERM=1
933461 311.016119 41.177.26.55 -> 244.3.160.248 TCP 64 http > 46589 [ACK] Seq=1 Ack=338 Win=63903 Len=0
934503 311.305366 41.177.26.55 -> 244.3.160.248 TCP 66 http > 46591 [SYN, ACK] Seq=0 Ack=1 Win=64240 Len=0 MSS=1460 SACK_PERM=1
934512 311.306141 41.177.26.55 -> 244.3.160.248 TCP 64 http > 46591 [ACK] Seq=1 Ack=826 Win=63415 Len=0
935088 311.561985 41.177.26.55 -> 244.3.160.248 TCP 66 http > 46595 [SYN, ACK] Seq=0 Ack=1 Win=64240 Len=0 MSS=1460 SACK_PERM=1
935091 311.562576 41.177.26.55 -> 244.3.160.248 TCP 64 http > 46595 [ACK] Seq=1 Ack=350 Win=63891 Len=0
937386 312.151072 41.177.26.55 -> 244.3.160.248 TCP 64 http > 46471 [ACK] Seq=10398 Ack=341 Win=64240 Len=0
940945 313.038361 41.177.26.55 -> 244.3.160.248 TCP 64 http > 46591 [ACK] Seq=177 Ack=1588 Win=64240 Len=0
946114 314.036099 41.177.26.55 -> 244.3.160.248 TCP 66 http > 46599 [SYN, ACK] Seq=0 Ack=1 Win=64240 Len=0 MSS=1460 SACK_PERM=1
946117 314.036703 41.177.26.55 -> 244.3.160.248 TCP 64 http > 46599 [ACK] Seq=1 Ack=351 Win=63890 Len=0
946211 314.056367 41.177.26.55 -> 244.3.160.248 TCP 64 http > 46599 [FIN, ACK] Seq=461 Ack=351 Win=64240 Len=0
946215 314.056997 41.177.26.55 -> 244.3.160.248 TCP 64 http > 46599 [ACK] Seq=462 Ack=352 Win=64240 Len=0
949419 314.849687 41.177.26.55 -> 244.3.160.248 TCP 66 http > 46601 [SYN, ACK] Seq=0 Ack=1 Win=64240 Len=0 MSS=1460 SACK_PERM=1
949422 314.850413 41.177.26.55 -> 244.3.160.248 TCP 64 http > 46601 [ACK] Seq=1 Ack=344 Win=63897 Len=0
951122 315.458593 41.177.26.55 -> 244.3.160.248 TCP 64 http > 46588 [FIN, ACK] Seq=10644 Ack=354 Win=64240 Len=0
952709 315.945078 41.177.26.55 -> 244.3.160.248 TCP 66 http > 46610 [SYN, ACK] Seq=0 Ack=1 Win=64240 Len=0 MSS=1460 SACK_PERM=1
952713 315.946046 41.177.26.55 -> 244.3.160.248 TCP 64 http > 46610 [ACK] Seq=1 Ack=1024 Win=63217 Len=0
953077 316.048554 41.177.26.55 -> 244.3.160.248 TCP 64 http > 46589 [FIN, ACK] Seq=10337 Ack=338 Win=64240 Len=0
954721 316.588582 41.177.26.55 -> 244.3.160.248 TCP 64 http > 46595 [FIN, ACK] Seq=10335 Ack=350 Win=64240 Len=0
957193 317.826737 41.177.26.55 -> 244.3.160.248 TCP 66 http > 46614 [SYN, ACK] Seq=0 Ack=1 Win=64240 Len=0 MSS=1460 SACK_PERM=1
957197 317.827649 41.177.26.55 -> 244.3.160.248 TCP 64 http > 46614 [ACK] Seq=1 Ack=792 Win=63449 Len=0
957424 317.869520 41.177.26.55 -> 244.3.160.248 TCP 64 http > 46610 [ACK] Seq=631 Ack=1025 Win=64240 Len=0
957426 317.869617 41.177.26.55 -> 244.3.160.248 TCP 64 http > 46610 [FIN, ACK] Seq=631 Ack=1025 Win=64240 Len=0
962342 319.878630 41.177.26.55 -> 244.3.160.248 TCP 64 http > 46601 [FIN, ACK] Seq=10400 Ack=344 Win=64240 Len=0
962835 320.118633 41.177.26.55 -> 244.3.160.248 TCP 64 http > 46591 [FIN, ACK] Seq=18747 Ack=2364 Win=64240 Len=0
964855 321.192706 41.177.26.55 -> 244.3.160.248 TCP 64 http > 46588 [ACK] Seq=10645 Ack=355 Win=64240 Len=0
965708 321.520443 41.177.26.55 -> 244.3.160.248 TCP 66 http > 46618 [SYN, ACK] Seq=0 Ack=1 Win=64240 Len=0 MSS=1460 SACK_PERM=1
965716 321.521384 41.177.26.55 -> 244.3.160.248 TCP 64 http > 46618 [ACK] Seq=1 Ack=337 Win=63904 Len=0
969325 322.838631 41.177.26.55 -> 244.3.160.248 TCP 64 http > 46614 [FIN, ACK] Seq=585 Ack=792 Win=64240 Len=0
970686 323.739668 41.177.26.55 -> 244.3.160.248 TCP 66 http > 46669 [SYN, ACK] Seq=0 Ack=1 Win=64240 Len=0 MSS=1460 SACK_PERM=1
970689 323.740696 41.177.26.55 -> 244.3.160.248 TCP 64 http > 46669 [ACK] Seq=1 Ack=1081 Win=63160 Len=0
975898 324.947503 41.177.26.55 -> 244.3.160.248 TCP 66 http > 46670 [SYN, ACK] Seq=0 Ack=1 Win=64240 Len=0 MSS=1460 SACK_PERM=1
975903 324.948078 41.177.26.55 -> 244.3.160.248 TCP 64 http > 46670 [ACK] Seq=1 Ack=350 Win=63891 Len=0
978514 325.975424 41.177.26.55 -> 244.3.160.248 TCP 64 http > 46669 [ACK] Seq=585 Ack=2171 Win=64240 Len=0
979495 326.558766 41.177.26.55 -> 244.3.160.248 TCP 64 http > 46618 [FIN, ACK] Seq=10588 Ack=337 Win=64240 Len=0
981850 328.062474 41.177.26.55 -> 244.3.160.248 TCP 64 http > 46589 [ACK] Seq=10338 Ack=339 Win=64240 Len=0
984052 328.605157 41.177.26.55 -> 244.3.160.248 TCP 64 http > 46595 [ACK] Seq=10336 Ack=351 Win=64240 Len=0
989695 329.968772 41.177.26.55 -> 244.3.160.248 TCP 64 http > 46670 [FIN, ACK] Seq=10400 Ack=350 Win=64240 Len=0
992111 330.988742 41.177.26.55 -> 244.3.160.248 TCP 64 http > 46669 [FIN, ACK] Seq=1169 Ack=2171 Win=64240 Len=0
994537 331.882453 41.177.26.55 -> 244.3.160.248 TCP 64 http > 46601 [ACK] Seq=10401 Ack=345 Win=64240 Len=0
995416 332.132488 41.177.26.55 -> 244.3.160.248 TCP 64 http > 46591 [ACK] Seq=18748 Ack=2365 Win=64240 Len=0
995417 332.132535 41.177.26.55 -> 244.3.160.248 TCP 64 http > 46498 [ACK] Seq=4816 Ack=785 Win=64240 Len=0
997293 333.231141 41.177.26.55 -> 244.3.160.248 TCP 66 http > 46761 [SYN, ACK] Seq=0 Ack=1 Win=64240 Len=0 MSS=1460 SACK_PERM=1
997296 333.232142 41.177.26.55 -> 244.3.160.248 TCP 64 http > 46761 [ACK] Seq=1 Ack=351 Win=63890 Len=0
997353 333.265952 41.177.26.55 -> 244.3.160.248 TCP 64 http > 46761 [FIN, ACK] Seq=461 Ack=351 Win=64240 Len=0
997356 333.266311 41.177.26.55 -> 244.3.160.248 TCP 64 http > 46761 [ACK] Seq=462 Ack=352 Win=64240 Len=0
1000640 334.852510 41.177.26.55 -> 244.3.160.248 TCP 64 http > 46614 [ACK] Seq=586 Ack=793 Win=64240 Len=0
1007697 337.464990 41.177.26.55 -> 244.3.160.248 TCP 66 http > 46851 [SYN, ACK] Seq=0 Ack=1 Win=64240 Len=0 MSS=1460 SACK_PERM=1
1007700 337.465877 41.177.26.55 -> 244.3.160.248 TCP 64 http > 46851 [ACK] Seq=1 Ack=1435 Win=62806 Len=0
1009749 338.572615 41.177.26.55 -> 244.3.160.248 TCP 64 http > 46618 [ACK] Seq=10589 Ack=338 Win=64240 Len=0
1016089 341.982678 41.177.26.55 -> 244.3.160.248 TCP 64 http > 46670 [ACK] Seq=10401 Ack=351 Win=64240 Len=0
1016786 342.478887 41.177.26.55 -> 244.3.160.248 TCP 64 http > 46851 [FIN, ACK] Seq=597 Ack=1435 Win=64240 Len=0
1021131 344.554824 41.177.26.55 -> 244.3.160.248 TCP 64 http > 46669 [ACK] Seq=1170 Ack=2172 Win=64240 Len=0
