14142   3.997308 41.177.84.66 -> 244.3.31.168 TCP 82 59032 > https [SYN] Seq=0 Win=65535 Len=0 MSS=1380 WS=8 TSval=739593833 TSecr=0 SACK_PERM=1
14144   3.997709 41.177.84.66 -> 244.3.31.168 TCP 70 59032 > https [ACK] Seq=1 Ack=1 Win=524280 Len=0 TSval=739593833 TSecr=1061423253
14148   3.998612 41.177.84.66 -> 244.3.31.168 TCP 70 59032 > https [ACK] Seq=204 Ack=139 Win=524280 Len=0 TSval=739593833 TSecr=1061423254
14171   4.006840 41.177.84.66 -> 244.3.31.168 TCP 70 59032 > https [ACK] Seq=1164 Ack=4243 Win=521560 Len=0 TSval=739593833 TSecr=1061423261
14178   4.007395 41.177.84.66 -> 244.3.31.168 TCP 70 59032 > https [ACK] Seq=1164 Ack=5800 Win=523752 Len=0 TSval=739593833 TSecr=1061423262
14192   4.008236 41.177.84.66 -> 244.3.31.168 TCP 70 59032 > https [FIN, ACK] Seq=1201 Ack=5800 Win=524280 Len=0 TSval=739593833 TSecr=1061423262
14224   4.011833 41.177.84.66 -> 244.3.31.168 TCP 82 59033 > https [SYN] Seq=0 Win=65535 Len=0 MSS=1380 WS=8 TSval=739593833 TSecr=0 SACK_PERM=1
14226   4.012042 41.177.84.66 -> 244.3.31.168 TCP 82 59034 > https [SYN] Seq=0 Win=65535 Len=0 MSS=1380 WS=8 TSval=739593833 TSecr=0 SACK_PERM=1
14228   4.012391 41.177.84.66 -> 244.3.31.168 TCP 70 59033 > https [ACK] Seq=1 Ack=1 Win=524280 Len=0 TSval=739593833 TSecr=1061423267
14229   4.012395 41.177.84.66 -> 244.3.31.168 TCP 70 59034 > https [ACK] Seq=1 Ack=1 Win=524280 Len=0 TSval=739593833 TSecr=1061423267
14236   4.013242 41.177.84.66 -> 244.3.31.168 TCP 70 59033 > https [ACK] Seq=204 Ack=139 Win=524280 Len=0 TSval=739593833 TSecr=1061423268
14237   4.013449 41.177.84.66 -> 244.3.31.168 TCP 70 59034 > https [ACK] Seq=204 Ack=139 Win=524280 Len=0 TSval=739593833 TSecr=1061423268
14256   4.023182 41.177.84.66 -> 244.3.31.168 TCP 70 59033 > https [ACK] Seq=1276 Ack=448 Win=524280 Len=0 TSval=739593833 TSecr=1061423278
14258   4.023279 41.177.84.66 -> 244.3.31.168 TCP 70 59033 > https [ACK] Seq=1276 Ack=485 Win=524280 Len=0 TSval=739593833 TSecr=1061423278
14259   4.023282 41.177.84.66 -> 244.3.31.168 TCP 70 59033 > https [ACK] Seq=1276 Ack=486 Win=524280 Len=0 TSval=739593833 TSecr=1061423278
14262   4.023427 41.177.84.66 -> 244.3.31.168 TCP 70 59033 > https [FIN, ACK] Seq=1313 Ack=486 Win=524280 Len=0 TSval=739593833 TSecr=1061423278
14280   4.024260 41.177.84.66 -> 244.3.31.168 TCP 70 59034 > https [ACK] Seq=1276 Ack=448 Win=524280 Len=0 TSval=739593833 TSecr=1061423279
14281   4.024265 41.177.84.66 -> 244.3.31.168 TCP 70 59034 > https [ACK] Seq=1276 Ack=485 Win=524280 Len=0 TSval=739593833 TSecr=1061423279
14282   4.024293 41.177.84.66 -> 244.3.31.168 TCP 70 59034 > https [ACK] Seq=1276 Ack=486 Win=524280 Len=0 TSval=739593833 TSecr=1061423279
14284   4.024444 41.177.84.66 -> 244.3.31.168 TCP 70 59034 > https [FIN, ACK] Seq=1313 Ack=486 Win=524280 Len=0 TSval=739593833 TSecr=1061423279
364328 124.069878 41.177.84.66 -> 244.3.31.168 TCP 82 59049 > https [SYN] Seq=0 Win=65535 Len=0 MSS=1380 WS=8 TSval=739595033 TSecr=0 SACK_PERM=1
364330 124.070243 41.177.84.66 -> 244.3.31.168 TCP 70 59049 > https [ACK] Seq=1 Ack=1 Win=524280 Len=0 TSval=739595033 TSecr=1061543325
364334 124.071090 41.177.84.66 -> 244.3.31.168 TCP 70 59049 > https [ACK] Seq=204 Ack=139 Win=524280 Len=0 TSval=739595033 TSecr=1061543326
364357 124.082806 41.177.84.66 -> 244.3.31.168 TCP 70 59049 > https [ACK] Seq=1164 Ack=4243 Win=523944 Len=0 TSval=739595033 TSecr=1061543337
364358 124.082896 41.177.84.66 -> 244.3.31.168 TCP 70 59049 > https [ACK] Seq=1164 Ack=5384 Win=524032 Len=0 TSval=739595033 TSecr=1061543337
364362 124.083589 41.177.84.66 -> 244.3.31.168 TCP 70 59049 > https [FIN, ACK] Seq=1201 Ack=5384 Win=524280 Len=0 TSval=739595033 TSecr=1061543337
364379 124.087236 41.177.84.66 -> 244.3.31.168 TCP 82 59050 > https [SYN] Seq=0 Win=65535 Len=0 MSS=1380 WS=8 TSval=739595033 TSecr=0 SACK_PERM=1
364383 124.087410 41.177.84.66 -> 244.3.31.168 TCP 82 59051 > https [SYN] Seq=0 Win=65535 Len=0 MSS=1380 WS=8 TSval=739595033 TSecr=0 SACK_PERM=1
364389 124.087603 41.177.84.66 -> 244.3.31.168 TCP 70 59050 > https [ACK] Seq=1 Ack=1 Win=524280 Len=0 TSval=739595033 TSecr=1061543342
364390 124.087782 41.177.84.66 -> 244.3.31.168 TCP 70 59051 > https [ACK] Seq=1 Ack=1 Win=524280 Len=0 TSval=739595033 TSecr=1061543343
364397 124.088555 41.177.84.66 -> 244.3.31.168 TCP 70 59050 > https [ACK] Seq=204 Ack=139 Win=524280 Len=0 TSval=739595033 TSecr=1061543343
364398 124.088707 41.177.84.66 -> 244.3.31.168 TCP 70 59051 > https [ACK] Seq=204 Ack=139 Win=524280 Len=0 TSval=739595033 TSecr=1061543344
364426 124.097333 41.177.84.66 -> 244.3.31.168 TCP 70 59050 > https [ACK] Seq=1276 Ack=448 Win=524280 Len=0 TSval=739595033 TSecr=1061543352
364427 124.097405 41.177.84.66 -> 244.3.31.168 TCP 70 59050 > https [ACK] Seq=1276 Ack=485 Win=524280 Len=0 TSval=739595033 TSecr=1061543352
364429 124.097413 41.177.84.66 -> 244.3.31.168 TCP 70 59050 > https [ACK] Seq=1276 Ack=486 Win=524280 Len=0 TSval=739595033 TSecr=1061543352
364432 124.097586 41.177.84.66 -> 244.3.31.168 TCP 70 59050 > https [FIN, ACK] Seq=1313 Ack=486 Win=524280 Len=0 TSval=739595033 TSecr=1061543352
364443 124.098924 41.177.84.66 -> 244.3.31.168 TCP 70 59051 > https [ACK] Seq=1276 Ack=448 Win=524280 Len=0 TSval=739595033 TSecr=1061543354
364444 124.098952 41.177.84.66 -> 244.3.31.168 TCP 70 59051 > https [ACK] Seq=1276 Ack=485 Win=524280 Len=0 TSval=739595033 TSecr=1061543354
364445 124.098975 41.177.84.66 -> 244.3.31.168 TCP 70 59051 > https [ACK] Seq=1276 Ack=486 Win=524280 Len=0 TSval=739595033 TSecr=1061543354
364447 124.099122 41.177.84.66 -> 244.3.31.168 TCP 70 59051 > https [FIN, ACK] Seq=1313 Ack=486 Win=524280 Len=0 TSval=739595033 TSecr=1061543354
758265 244.154392 41.177.84.66 -> 244.3.31.168 TCP 82 59061 > https [SYN] Seq=0 Win=65535 Len=0 MSS=1380 WS=8 TSval=739596233 TSecr=0 SACK_PERM=1
758269 244.154783 41.177.84.66 -> 244.3.31.168 TCP 70 59061 > https [ACK] Seq=1 Ack=1 Win=524280 Len=0 TSval=739596233 TSecr=1061663409
758388 244.173151 41.177.84.66 -> 244.3.31.168 TCP 70 59061 > https [ACK] Seq=204 Ack=1549 Win=523760 Len=0 TSval=739596234 TSecr=1061663427
758423 244.193863 41.177.84.66 -> 244.3.31.168 TCP 70 59061 > https [ACK] Seq=402 Ack=1608 Win=524280 Len=0 TSval=739596234 TSecr=1061663448
758442 244.198213 41.177.84.66 -> 244.3.31.168 TCP 70 59061 > https [ACK] Seq=1303 Ack=5712 Win=521600 Len=0 TSval=739596234 TSecr=1061663452
758443 244.198312 41.177.84.66 -> 244.3.31.168 TCP 70 59061 > https [ACK] Seq=1303 Ack=6853 Win=524032 Len=0 TSval=739596234 TSecr=1061663453
758445 244.198987 41.177.84.66 -> 244.3.31.168 TCP 70 59061 > https [FIN, ACK] Seq=1340 Ack=6853 Win=524280 Len=0 TSval=739596234 TSecr=1061663453
758448 244.202582 41.177.84.66 -> 244.3.31.168 TCP 82 59062 > https [SYN] Seq=0 Win=65535 Len=0 MSS=1380 WS=8 TSval=739596234 TSecr=0 SACK_PERM=1
758450 244.202760 41.177.84.66 -> 244.3.31.168 TCP 82 59063 > https [SYN] Seq=0 Win=65535 Len=0 MSS=1380 WS=8 TSval=739596234 TSecr=0 SACK_PERM=1
758452 244.202997 41.177.84.66 -> 244.3.31.168 TCP 70 59062 > https [ACK] Seq=1 Ack=1 Win=524280 Len=0 TSval=739596234 TSecr=1061663458
758453 244.203162 41.177.84.66 -> 244.3.31.168 TCP 70 59063 > https [ACK] Seq=1 Ack=1 Win=524280 Len=0 TSval=739596234 TSecr=1061663458
758462 244.204012 41.177.84.66 -> 244.3.31.168 TCP 70 59062 > https [ACK] Seq=204 Ack=139 Win=524280 Len=0 TSval=739596234 TSecr=1061663458
758465 244.204335 41.177.84.66 -> 244.3.31.168 TCP 70 59063 > https [ACK] Seq=204 Ack=139 Win=524280 Len=0 TSval=739596234 TSecr=1061663459
758488 244.212335 41.177.84.66 -> 244.3.31.168 TCP 70 59062 > https [ACK] Seq=1276 Ack=448 Win=524280 Len=0 TSval=739596234 TSecr=1061663467
758489 244.212391 41.177.84.66 -> 244.3.31.168 TCP 70 59062 > https [ACK] Seq=1276 Ack=485 Win=524280 Len=0 TSval=739596234 TSecr=1061663467
758490 244.212397 41.177.84.66 -> 244.3.31.168 TCP 70 59062 > https [ACK] Seq=1276 Ack=486 Win=524280 Len=0 TSval=739596234 TSecr=1061663467
758493 244.213090 41.177.84.66 -> 244.3.31.168 TCP 70 59062 > https [FIN, ACK] Seq=1313 Ack=486 Win=524280 Len=0 TSval=739596234 TSecr=1061663467
758510 244.215195 41.177.84.66 -> 244.3.31.168 TCP 70 59063 > https [ACK] Seq=1276 Ack=448 Win=524280 Len=0 TSval=739596234 TSecr=1061663470
758511 244.215200 41.177.84.66 -> 244.3.31.168 TCP 70 59063 > https [ACK] Seq=1276 Ack=485 Win=524280 Len=0 TSval=739596234 TSecr=1061663470
758513 244.215263 41.177.84.66 -> 244.3.31.168 TCP 70 59063 > https [ACK] Seq=1276 Ack=486 Win=524280 Len=0 TSval=739596234 TSecr=1061663470
758515 244.215408 41.177.84.66 -> 244.3.31.168 TCP 70 59063 > https [FIN, ACK] Seq=1313 Ack=486 Win=524280 Len=0 TSval=739596234 TSecr=1061663470
