606   0.154114 41.177.244.142 -> 244.3.210.90 TCP 70 49225 > afpovertcp [ACK] Seq=1 Ack=19 Win=49243 Len=0 TSval=967320715 TSecr=376777166
26053  10.154699 41.177.244.142 -> 244.3.210.90 TCP 70 49225 > afpovertcp [ACK] Seq=17 Ack=37 Win=49243 Len=0 TSval=967320735 TSecr=376777266
49641  20.155145 41.177.244.142 -> 244.3.210.90 TCP 70 49225 > afpovertcp [ACK] Seq=49 Ack=55 Win=49243 Len=0 TSval=967320755 TSecr=376777366
50430  20.516794 41.177.244.142 -> 244.3.210.254 TCP 64 4944 > 19813 [ACK] Seq=1 Ack=13 Win=64495 Len=0
54663  22.644721 41.177.244.142 -> 244.3.210.254 TCP 70 afpovertcp > 52502 [ACK] Seq=17 Ack=17 Win=32768 Len=0 TSval=3472903958 TSecr=2134604059
74205  30.155749 41.177.244.142 -> 244.3.210.90 TCP 70 49225 > afpovertcp [ACK] Seq=65 Ack=73 Win=49243 Len=0 TSval=967320775 TSecr=376777465
112708  40.156351 41.177.244.142 -> 244.3.210.90 TCP 70 49225 > afpovertcp [ACK] Seq=81 Ack=91 Win=49243 Len=0 TSval=967320795 TSecr=376777565
146244  50.156909 41.177.244.142 -> 244.3.210.90 TCP 70 49225 > afpovertcp [ACK] Seq=113 Ack=109 Win=49243 Len=0 TSval=967320815 TSecr=376777665
156187  53.247736 41.177.244.142 -> 244.3.210.254 TCP 70 afpovertcp > 52502 [ACK] Seq=33 Ack=33 Win=32768 Len=0 TSval=3472904019 TSecr=2134604120
179000  60.157394 41.177.244.142 -> 244.3.210.90 TCP 70 49225 > afpovertcp [ACK] Seq=129 Ack=127 Win=49243 Len=0 TSval=967320835 TSecr=376777765
179618  60.480273 41.177.244.142 -> 244.3.210.254 TCP 70 4944 > 19813 [PSH, ACK] Seq=1 Ack=13 Win=64495 Len=12
231931  80.158549 41.177.244.142 -> 244.3.210.90 TCP 70 49225 > afpovertcp [ACK] Seq=161 Ack=145 Win=49243 Len=0 TSval=967320875 TSecr=376777965
240773  83.650217 41.177.244.142 -> 244.3.210.254 TCP 70 afpovertcp > 52502 [ACK] Seq=33 Ack=49 Win=32768 Len=0 TSval=3472904080 TSecr=2134604181
254005  90.159125 41.177.244.142 -> 244.3.210.90 TCP 70 49225 > afpovertcp [ACK] Seq=177 Ack=163 Win=49243 Len=0 TSval=967320895 TSecr=376778065
296528 100.159623 41.177.244.142 -> 244.3.210.90 TCP 70 49225 > afpovertcp [ACK] Seq=193 Ack=181 Win=49243 Len=0 TSval=967320915 TSecr=376778165
298461 100.585681 41.177.244.142 -> 244.3.210.254 TCP 64 4944 > 19813 [ACK] Seq=13 Ack=25 Win=64483 Len=0
321969 110.160155 41.177.244.142 -> 244.3.210.90 TCP 70 49225 > afpovertcp [ACK] Seq=225 Ack=199 Win=49243 Len=0 TSval=967320935 TSecr=376778265
328764 114.252631 41.177.244.142 -> 244.3.210.254 TCP 70 afpovertcp > 52502 [ACK] Seq=49 Ack=65 Win=32768 Len=0 TSval=3472904141 TSecr=2134604242
353420 120.160764 41.177.244.142 -> 244.3.210.90 TCP 70 49225 > afpovertcp [ACK] Seq=241 Ack=217 Win=49243 Len=0 TSval=967320955 TSecr=376778365
389604 130.161346 41.177.244.142 -> 244.3.210.90 TCP 70 49225 > afpovertcp [ACK] Seq=257 Ack=235 Win=49243 Len=0 TSval=967320975 TSecr=376778465
430310 140.622418 41.177.244.142 -> 244.3.210.254 TCP 70 4944 > 19813 [PSH, ACK] Seq=13 Ack=25 Win=64483 Len=12
444362 144.655039 41.177.244.142 -> 244.3.210.254 TCP 70 afpovertcp > 52502 [ACK] Seq=65 Ack=81 Win=32768 Len=0 TSval=3472904202 TSecr=2134604303
459199 150.162518 41.177.244.142 -> 244.3.210.90 TCP 70 49225 > afpovertcp [ACK] Seq=289 Ack=253 Win=49243 Len=0 TSval=967321015 TSecr=376778665
486854 160.163019 41.177.244.142 -> 244.3.210.90 TCP 70 49225 > afpovertcp [ACK] Seq=305 Ack=271 Win=49243 Len=0 TSval=967321035 TSecr=376778765
523836 170.163589 41.177.244.142 -> 244.3.210.90 TCP 70 49225 > afpovertcp [ACK] Seq=337 Ack=289 Win=49243 Len=0 TSval=967321055 TSecr=376778865
539758 175.057421 41.177.244.142 -> 244.3.210.254 TCP 70 afpovertcp > 52502 [ACK] Seq=81 Ack=97 Win=32768 Len=0 TSval=3472904263 TSecr=2134604364
560892 180.164156 41.177.244.142 -> 244.3.210.90 TCP 70 49225 > afpovertcp [ACK] Seq=353 Ack=307 Win=49243 Len=0 TSval=967321075 TSecr=376778965
565040 180.758083 41.177.244.142 -> 244.3.210.254 TCP 64 4944 > 19813 [ACK] Seq=25 Ack=37 Win=64471 Len=0
599632 190.164741 41.177.244.142 -> 244.3.210.90 TCP 70 49225 > afpovertcp [ACK] Seq=369 Ack=325 Win=49243 Len=0 TSval=967321095 TSecr=376779065
656342 205.660134 41.177.244.142 -> 244.3.210.254 TCP 70 afpovertcp > 52502 [ACK] Seq=97 Ack=113 Win=32768 Len=0 TSval=3472904324 TSecr=2134604425
695542 220.166426 41.177.244.142 -> 244.3.210.90 TCP 70 49225 > afpovertcp [ACK] Seq=401 Ack=343 Win=49243 Len=0 TSval=967321155 TSecr=376779365
697019 220.824084 41.177.244.142 -> 244.3.210.254 TCP 70 4944 > 19813 [PSH, ACK] Seq=25 Ack=37 Win=64471 Len=12
721061 230.166841 41.177.244.142 -> 244.3.210.90 TCP 70 49225 > afpovertcp [ACK] Seq=433 Ack=361 Win=49243 Len=0 TSval=967321175 TSecr=376779464
739862 236.062541 41.177.244.142 -> 244.3.210.254 TCP 70 afpovertcp > 52502 [ACK] Seq=113 Ack=129 Win=32768 Len=0 TSval=3472904385 TSecr=2134604486
749156 240.167450 41.177.244.142 -> 244.3.210.90 TCP 70 49225 > afpovertcp [ACK] Seq=449 Ack=379 Win=49243 Len=0 TSval=967321195 TSecr=376779564
776618 250.168029 41.177.244.142 -> 244.3.210.90 TCP 70 49225 > afpovertcp [ACK] Seq=465 Ack=397 Win=49243 Len=0 TSval=967321215 TSecr=376779664
799487 260.927542 41.177.244.142 -> 244.3.210.254 TCP 64 4944 > 19813 [ACK] Seq=37 Ack=49 Win=64459 Len=0
817327 266.665159 41.177.244.142 -> 244.3.210.254 TCP 70 afpovertcp > 52502 [ACK] Seq=129 Ack=145 Win=32768 Len=0 TSval=3472904446 TSecr=2134604547
827878 270.169073 41.177.244.142 -> 244.3.210.90 TCP 70 49225 > afpovertcp [ACK] Seq=497 Ack=415 Win=49243 Len=0 TSval=967321255 TSecr=376779864
848040 280.169667 41.177.244.142 -> 244.3.210.90 TCP 70 49225 > afpovertcp [ACK] Seq=513 Ack=433 Win=49243 Len=0 TSval=967321275 TSecr=376779964
876215 290.170253 41.177.244.142 -> 244.3.210.90 TCP 70 49225 > afpovertcp [ACK] Seq=545 Ack=451 Win=49243 Len=0 TSval=967321295 TSecr=376780064
898901 297.067787 41.177.244.142 -> 244.3.210.254 TCP 70 afpovertcp > 52502 [ACK] Seq=145 Ack=161 Win=32768 Len=0 TSval=3472904507 TSecr=2134604608
909180 300.170829 41.177.244.142 -> 244.3.210.90 TCP 70 49225 > afpovertcp [ACK] Seq=561 Ack=469 Win=49243 Len=0 TSval=967321315 TSecr=376780164
910340 300.903781 41.177.244.142 -> 244.3.210.254 TCP 70 4944 > 19813 [PSH, ACK] Seq=37 Ack=49 Win=64459 Len=12
916181 304.068510 41.177.244.142 -> 244.3.210.254 TCP 70 afpovertcp > 52502 [ACK] Seq=163 Ack=177 Win=32768 Len=0 TSval=3472904521 TSecr=2134604622
981187 327.670744 41.177.244.142 -> 244.3.210.254 TCP 70 afpovertcp > 52502 [ACK] Seq=163 Ack=193 Win=32768 Len=0 TSval=3472904568 TSecr=2134604669
1009100 338.172894 41.177.244.142 -> 244.3.210.90 TCP 70 49225 > afpovertcp [ACK] Seq=593 Ack=485 Win=49244 Len=0 TSval=967321391 TSecr=376780544
1012534 340.173050 41.177.244.142 -> 244.3.210.90 TCP 70 49225 > afpovertcp [ACK] Seq=593 Ack=503 Win=49243 Len=0 TSval=967321395 TSecr=376780564
1014408 341.097010 41.177.244.142 -> 244.3.210.254 TCP 64 4944 > 19813 [ACK] Seq=49 Ack=61 Win=64447 Len=0
