1956   0.595981 41.177.98.43 -> 41.177.26.155 TCP 70 36592 > 8010 [FIN, ACK] Seq=1 Ack=1 Win=33304 Len=0 TSval=1540618 TSecr=1509543891
1957   0.595985 41.177.98.43 -> 41.177.26.155 TCP 70 [TCP Out-Of-Order] 36592 > 8010 [FIN, ACK] Seq=1 Ack=1 Win=33304 Len=0 TSval=1540618 TSecr=1509543891
1962   0.596563 41.177.98.43 -> 41.177.26.155 TCP 70 36592 > 8010 [ACK] Seq=2 Ack=2 Win=33304 Len=0 TSval=1540618 TSecr=1509545518
1963   0.596568 41.177.98.43 -> 41.177.26.155 TCP 70 [TCP Dup ACK 1962#1] 36592 > 8010 [ACK] Seq=2 Ack=2 Win=33304 Len=0 TSval=1540618 TSecr=1509545518
4118   1.219508 41.177.98.43 -> 41.177.26.155 TCP 82 36601 > 8010 [SYN] Seq=0 Win=32850 Len=0 MSS=1460 TSval=1540680 TSecr=0 WS=2 SACK_PERM=1
4119   1.219513 41.177.98.43 -> 41.177.26.155 TCP 82 [TCP Out-Of-Order] 36601 > 8010 [SYN] Seq=0 Win=32850 Len=0 MSS=1460 TSval=1540680 TSecr=0 WS=2 SACK_PERM=1
4122   1.219798 41.177.98.43 -> 41.177.26.155 TCP 70 36601 > 8010 [ACK] Seq=1 Ack=1 Win=66608 Len=0 TSval=1540680 TSecr=1509545580
4123   1.219803 41.177.98.43 -> 41.177.26.155 TCP 70 [TCP Dup ACK 4122#1] 36601 > 8010 [ACK] Seq=1 Ack=1 Win=66608 Len=0 TSval=1540680 TSecr=1509545580
4124   1.220149 41.177.98.43 -> 41.177.26.155 TCP 1143 36601 > 8010 [PSH, ACK] Seq=1 Ack=1 Win=66608 Len=1073 TSval=1540680 TSecr=1509545580
4125   1.220154 41.177.98.43 -> 41.177.26.155 TCP 1143 [TCP Retransmission] 36601 > 8010 [PSH, ACK] Seq=1 Ack=1 Win=66608 Len=1073 TSval=1540680 TSecr=1509545580
4307   1.291748 41.177.98.43 -> 41.177.26.155 TCP 70 36601 > 8010 [ACK] Seq=1074 Ack=749 Win=66608 Len=0 TSval=1540688 TSecr=1509545587
4308   1.291753 41.177.98.43 -> 41.177.26.155 TCP 70 [TCP Dup ACK 4307#1] 36601 > 8010 [ACK] Seq=1074 Ack=749 Win=66608 Len=0 TSval=1540688 TSecr=1509545587
7920   2.768741 41.177.98.43 -> 41.177.26.155 TCP 82 36603 > 8010 [SYN] Seq=0 Win=32850 Len=0 MSS=1460 TSval=1540835 TSecr=0 WS=2 SACK_PERM=1
7921   2.768746 41.177.98.43 -> 41.177.26.155 TCP 82 [TCP Out-Of-Order] 36603 > 8010 [SYN] Seq=0 Win=32850 Len=0 MSS=1460 TSval=1540835 TSecr=0 WS=2 SACK_PERM=1
7924   2.769038 41.177.98.43 -> 41.177.26.155 TCP 70 36603 > 8010 [ACK] Seq=1 Ack=1 Win=66608 Len=0 TSval=1540835 TSecr=1509545735
7925   2.769042 41.177.98.43 -> 41.177.26.155 TCP 70 [TCP Dup ACK 7924#1] 36603 > 8010 [ACK] Seq=1 Ack=1 Win=66608 Len=0 TSval=1540835 TSecr=1509545735
7926   2.769445 41.177.98.43 -> 41.177.26.155 TCP 1012 36603 > 8010 [PSH, ACK] Seq=1 Ack=1 Win=66608 Len=942 TSval=1540835 TSecr=1509545735
7927   2.769450 41.177.98.43 -> 41.177.26.155 TCP 1012 [TCP Retransmission] 36603 > 8010 [PSH, ACK] Seq=1 Ack=1 Win=66608 Len=942 TSval=1540835 TSecr=1509545735
8109   2.849673 41.177.98.43 -> 41.177.26.155 TCP 70 36603 > 8010 [ACK] Seq=943 Ack=1372 Win=66608 Len=0 TSval=1540843 TSecr=1509545743
8111   2.849682 41.177.98.43 -> 41.177.26.155 TCP 70 [TCP Dup ACK 8109#1] 36603 > 8010 [ACK] Seq=943 Ack=1372 Win=66608 Len=0 TSval=1540843 TSecr=1509545743
17126   4.850255 41.177.98.43 -> 41.177.26.155 TCP 70 36595 > 8010 [FIN, ACK] Seq=1 Ack=1 Win=33304 Len=0 TSval=1541044 TSecr=1509544242
17127   4.850259 41.177.98.43 -> 41.177.26.155 TCP 70 [TCP Out-Of-Order] 36595 > 8010 [FIN, ACK] Seq=1 Ack=1 Win=33304 Len=0 TSval=1541044 TSecr=1509544242
17133   4.850809 41.177.98.43 -> 41.177.26.155 TCP 70 36595 > 8010 [ACK] Seq=2 Ack=2 Win=33304 Len=0 TSval=1541044 TSecr=1509545943
17134   4.850814 41.177.98.43 -> 41.177.26.155 TCP 70 [TCP Dup ACK 17133#1] 36595 > 8010 [ACK] Seq=2 Ack=2 Win=33304 Len=0 TSval=1541044 TSecr=1509545943
18043   5.549216 41.177.98.43 -> 41.177.26.155 TCP 82 36605 > 8010 [SYN] Seq=0 Win=32850 Len=0 MSS=1460 TSval=1541113 TSecr=0 WS=2 SACK_PERM=1
18044   5.549221 41.177.98.43 -> 41.177.26.155 TCP 82 [TCP Out-Of-Order] 36605 > 8010 [SYN] Seq=0 Win=32850 Len=0 MSS=1460 TSval=1541113 TSecr=0 WS=2 SACK_PERM=1
18047   5.549526 41.177.98.43 -> 41.177.26.155 TCP 70 36605 > 8010 [ACK] Seq=1 Ack=1 Win=66608 Len=0 TSval=1541113 TSecr=1509546013
18048   5.549530 41.177.98.43 -> 41.177.26.155 TCP 70 [TCP Dup ACK 18047#1] 36605 > 8010 [ACK] Seq=1 Ack=1 Win=66608 Len=0 TSval=1541113 TSecr=1509546013
18049   5.549898 41.177.98.43 -> 41.177.26.155 TCP 956 36605 > 8010 [PSH, ACK] Seq=1 Ack=1 Win=66608 Len=886 TSval=1541113 TSecr=1509546013
18050   5.549903 41.177.98.43 -> 41.177.26.155 TCP 956 [TCP Retransmission] 36605 > 8010 [PSH, ACK] Seq=1 Ack=1 Win=66608 Len=886 TSval=1541113 TSecr=1509546013
18065   5.570144 41.177.98.43 -> 41.177.26.155 TCP 70 36605 > 8010 [ACK] Seq=887 Ack=562 Win=66608 Len=0 TSval=1541116 TSecr=1509546015
18066   5.570149 41.177.98.43 -> 41.177.26.155 TCP 70 [TCP Dup ACK 18065#1] 36605 > 8010 [ACK] Seq=887 Ack=562 Win=66608 Len=0 TSval=1541116 TSecr=1509546015
25752   9.960006 41.177.98.43 -> 41.177.26.155 TCP 70 36594 > 8010 [FIN, ACK] Seq=1 Ack=1 Win=33304 Len=0 TSval=1541555 TSecr=1509544753
25753   9.960011 41.177.98.43 -> 41.177.26.155 TCP 70 [TCP Out-Of-Order] 36594 > 8010 [FIN, ACK] Seq=1 Ack=1 Win=33304 Len=0 TSval=1541555 TSecr=1509544753
25761   9.960623 41.177.98.43 -> 41.177.26.155 TCP 70 36594 > 8010 [ACK] Seq=2 Ack=2 Win=33304 Len=0 TSval=1541555 TSecr=1509546454
25762   9.960628 41.177.98.43 -> 41.177.26.155 TCP 70 [TCP Dup ACK 25761#1] 36594 > 8010 [ACK] Seq=2 Ack=2 Win=33304 Len=0 TSval=1541555 TSecr=1509546454
34967  14.675105 41.177.98.43 -> 41.177.26.155 TCP 82 36612 > 8010 [SYN] Seq=0 Win=32850 Len=0 MSS=1460 TSval=1542026 TSecr=0 WS=2 SACK_PERM=1
34968  14.675110 41.177.98.43 -> 41.177.26.155 TCP 82 [TCP Out-Of-Order] 36612 > 8010 [SYN] Seq=0 Win=32850 Len=0 MSS=1460 TSval=1542026 TSecr=0 WS=2 SACK_PERM=1
34973  14.675355 41.177.98.43 -> 41.177.26.155 TCP 70 36612 > 8010 [ACK] Seq=1 Ack=1 Win=66608 Len=0 TSval=1542026 TSecr=1509546926
34974  14.675360 41.177.98.43 -> 41.177.26.155 TCP 70 [TCP Dup ACK 34973#1] 36612 > 8010 [ACK] Seq=1 Ack=1 Win=66608 Len=0 TSval=1542026 TSecr=1509546926
34977  14.675745 41.177.98.43 -> 41.177.26.155 TCP 1021 36612 > 8010 [PSH, ACK] Seq=1 Ack=1 Win=66608 Len=951 TSval=1542026 TSecr=1509546926
34978  14.675750 41.177.98.43 -> 41.177.26.155 TCP 1021 [TCP Retransmission] 36612 > 8010 [PSH, ACK] Seq=1 Ack=1 Win=66608 Len=951 TSval=1542026 TSecr=1509546926
35267  14.766798 41.177.98.43 -> 41.177.26.155 TCP 70 36612 > 8010 [ACK] Seq=952 Ack=784 Win=66608 Len=0 TSval=1542035 TSecr=1509546935
35268  14.766805 41.177.98.43 -> 41.177.26.155 TCP 70 [TCP Dup ACK 35267#1] 36612 > 8010 [ACK] Seq=952 Ack=784 Win=66608 Len=0 TSval=1542035 TSecr=1509546935
37571  15.639828 41.177.98.43 -> 41.177.26.155 TCP 70 36600 > 8010 [FIN, ACK] Seq=1 Ack=1 Win=33304 Len=0 TSval=1542123 TSecr=1509545320
37572  15.639832 41.177.98.43 -> 41.177.26.155 TCP 70 [TCP Out-Of-Order] 36600 > 8010 [FIN, ACK] Seq=1 Ack=1 Win=33304 Len=0 TSval=1542123 TSecr=1509545320
37582  15.640397 41.177.98.43 -> 41.177.26.155 TCP 70 36600 > 8010 [ACK] Seq=2 Ack=2 Win=33304 Len=0 TSval=1542123 TSecr=1509547022
37583  15.640401 41.177.98.43 -> 41.177.26.155 TCP 70 [TCP Dup ACK 37582#1] 36600 > 8010 [ACK] Seq=2 Ack=2 Win=33304 Len=0 TSval=1542123 TSecr=1509547022
43106  18.309804 41.177.98.43 -> 41.177.26.155 TCP 70 36601 > 8010 [FIN, ACK] Seq=1074 Ack=749 Win=66608 Len=0 TSval=1542390 TSecr=1509545587
43107  18.309810 41.177.98.43 -> 41.177.26.155 TCP 70 [TCP Out-Of-Order] 36601 > 8010 [FIN, ACK] Seq=1074 Ack=749 Win=66608 Len=0 TSval=1542390 TSecr=1509545587
43113  18.310376 41.177.98.43 -> 41.177.26.155 TCP 70 36601 > 8010 [ACK] Seq=1075 Ack=750 Win=66608 Len=0 TSval=1542390 TSecr=1509547289
43114  18.310382 41.177.98.43 -> 41.177.26.155 TCP 70 [TCP Dup ACK 43113#1] 36601 > 8010 [ACK] Seq=1075 Ack=750 Win=66608 Len=0 TSval=1542390 TSecr=1509547289
48624  19.869653 41.177.98.43 -> 41.177.26.155 TCP 70 36603 > 8010 [FIN, ACK] Seq=943 Ack=1372 Win=66608 Len=0 TSval=1542546 TSecr=1509545743
48625  19.869658 41.177.98.43 -> 41.177.26.155 TCP 70 [TCP Out-Of-Order] 36603 > 8010 [FIN, ACK] Seq=943 Ack=1372 Win=66608 Len=0 TSval=1542546 TSecr=1509545743
48635  19.870218 41.177.98.43 -> 41.177.26.155 TCP 70 36603 > 8010 [ACK] Seq=944 Ack=1373 Win=66608 Len=0 TSval=1542546 TSecr=1509547445
48636  19.870222 41.177.98.43 -> 41.177.26.155 TCP 70 [TCP Dup ACK 48635#1] 36603 > 8010 [ACK] Seq=944 Ack=1373 Win=66608 Len=0 TSval=1542546 TSecr=1509547445
49949  20.282074 41.177.98.43 -> 41.177.26.155 TCP 82 36615 > 8010 [SYN] Seq=0 Win=32850 Len=0 MSS=1460 TSval=1542587 TSecr=0 WS=2 SACK_PERM=1
49950  20.282079 41.177.98.43 -> 41.177.26.155 TCP 82 [TCP Out-Of-Order] 36615 > 8010 [SYN] Seq=0 Win=32850 Len=0 MSS=1460 TSval=1542587 TSecr=0 WS=2 SACK_PERM=1
49953  20.282404 41.177.98.43 -> 41.177.26.155 TCP 70 36615 > 8010 [ACK] Seq=1 Ack=1 Win=66608 Len=0 TSval=1542587 TSecr=1509547486
49954  20.282409 41.177.98.43 -> 41.177.26.155 TCP 70 [TCP Dup ACK 49953#1] 36615 > 8010 [ACK] Seq=1 Ack=1 Win=66608 Len=0 TSval=1542587 TSecr=1509547486
49955  20.282731 41.177.98.43 -> 41.177.26.155 TCP 992 36615 > 8010 [PSH, ACK] Seq=1 Ack=1 Win=66608 Len=922 TSval=1542587 TSecr=1509547486
49956  20.282736 41.177.98.43 -> 41.177.26.155 TCP 992 [TCP Retransmission] 36615 > 8010 [PSH, ACK] Seq=1 Ack=1 Win=66608 Len=922 TSval=1542587 TSecr=1509547486
50012  20.321514 41.177.98.43 -> 41.177.26.155 TCP 70 36615 > 8010 [ACK] Seq=923 Ack=768 Win=66608 Len=0 TSval=1542591 TSecr=1509547490
50013  20.321519 41.177.98.43 -> 41.177.26.155 TCP 70 [TCP Dup ACK 50012#1] 36615 > 8010 [ACK] Seq=923 Ack=768 Win=66608 Len=0 TSval=1542591 TSecr=1509547490
50176  20.420478 41.177.98.43 -> 41.177.26.155 TCP 82 36617 > 8010 [SYN] Seq=0 Win=32850 Len=0 MSS=1460 TSval=1542601 TSecr=0 WS=2 SACK_PERM=1
50177  20.420483 41.177.98.43 -> 41.177.26.155 TCP 82 [TCP Out-Of-Order] 36617 > 8010 [SYN] Seq=0 Win=32850 Len=0 MSS=1460 TSval=1542601 TSecr=0 WS=2 SACK_PERM=1
50180  20.420794 41.177.98.43 -> 41.177.26.155 TCP 70 36617 > 8010 [ACK] Seq=1 Ack=1 Win=66608 Len=0 TSval=1542601 TSecr=1509547500
50181  20.420798 41.177.98.43 -> 41.177.26.155 TCP 70 [TCP Dup ACK 50180#1] 36617 > 8010 [ACK] Seq=1 Ack=1 Win=66608 Len=0 TSval=1542601 TSecr=1509547500
50182  20.421101 41.177.98.43 -> 41.177.26.155 TCP 872 36617 > 8010 [PSH, ACK] Seq=1 Ack=1 Win=66608 Len=802 TSval=1542601 TSecr=1509547500
50183  20.421105 41.177.98.43 -> 41.177.26.155 TCP 872 [TCP Retransmission] 36617 > 8010 [PSH, ACK] Seq=1 Ack=1 Win=66608 Len=802 TSval=1542601 TSecr=1509547500
50307  20.487082 41.177.98.43 -> 41.177.26.155 TCP 70 36617 > 8010 [ACK] Seq=803 Ack=695 Win=66608 Len=0 TSval=1542607 TSecr=1509547507
50308  20.487086 41.177.98.43 -> 41.177.26.155 TCP 70 [TCP Dup ACK 50307#1] 36617 > 8010 [ACK] Seq=803 Ack=695 Win=66608 Len=0 TSval=1542607 TSecr=1509547507
59097  23.834116 41.177.98.43 -> 41.177.26.155 TCP 82 36621 > 8010 [SYN] Seq=0 Win=32850 Len=0 MSS=1460 TSval=1542942 TSecr=0 WS=2 SACK_PERM=1
59098  23.834121 41.177.98.43 -> 41.177.26.155 TCP 82 [TCP Out-Of-Order] 36621 > 8010 [SYN] Seq=0 Win=32850 Len=0 MSS=1460 TSval=1542942 TSecr=0 WS=2 SACK_PERM=1
59101  23.834417 41.177.98.43 -> 41.177.26.155 TCP 70 36621 > 8010 [ACK] Seq=1 Ack=1 Win=66608 Len=0 TSval=1542942 TSecr=1509547841
59102  23.834422 41.177.98.43 -> 41.177.26.155 TCP 70 [TCP Dup ACK 59101#1] 36621 > 8010 [ACK] Seq=1 Ack=1 Win=66608 Len=0 TSval=1542942 TSecr=1509547841
59103  23.834769 41.177.98.43 -> 41.177.26.155 TCP 909 36621 > 8010 [PSH, ACK] Seq=1 Ack=1 Win=66608 Len=839 TSval=1542942 TSecr=1509547841
59104  23.834774 41.177.98.43 -> 41.177.26.155 TCP 909 [TCP Retransmission] 36621 > 8010 [PSH, ACK] Seq=1 Ack=1 Win=66608 Len=839 TSval=1542942 TSecr=1509547841
59560  23.987014 41.177.98.43 -> 41.177.26.155 TCP 70 36621 > 8010 [ACK] Seq=840 Ack=1449 Win=65160 Len=0 TSval=1542957 TSecr=1509547857
59561  23.987019 41.177.98.43 -> 41.177.26.155 TCP 70 [TCP Dup ACK 59560#1] 36621 > 8010 [ACK] Seq=840 Ack=1449 Win=65160 Len=0 TSval=1542957 TSecr=1509547857
59562  23.987050 41.177.98.43 -> 41.177.26.155 TCP 70 36621 > 8010 [ACK] Seq=840 Ack=1461 Win=66608 Len=0 TSval=1542957 TSecr=1509547857
59563  23.987055 41.177.98.43 -> 41.177.26.155 TCP 70 [TCP Dup ACK 59562#1] 36621 > 8010 [ACK] Seq=840 Ack=1461 Win=66608 Len=0 TSval=1542957 TSecr=1509547857
59628  24.002955 41.177.98.43 -> 41.177.26.155 TCP 70 36621 > 8010 [FIN, ACK] Seq=840 Ack=1461 Win=66608 Len=0 TSval=1542959 TSecr=1509547857
59629  24.002959 41.177.98.43 -> 41.177.26.155 TCP 70 [TCP Out-Of-Order] 36621 > 8010 [FIN, ACK] Seq=840 Ack=1461 Win=66608 Len=0 TSval=1542959 TSecr=1509547857
59634  24.003510 41.177.98.43 -> 41.177.26.155 TCP 70 36621 > 8010 [ACK] Seq=841 Ack=1462 Win=66608 Len=0 TSval=1542959 TSecr=1509547858
59635  24.003514 41.177.98.43 -> 41.177.26.155 TCP 70 [TCP Dup ACK 59634#1] 36621 > 8010 [ACK] Seq=841 Ack=1462 Win=66608 Len=0 TSval=1542959 TSecr=1509547858
81151  31.779236 41.177.98.43 -> 41.177.26.155 TCP 70 36612 > 8010 [FIN, ACK] Seq=952 Ack=784 Win=66608 Len=0 TSval=1543737 TSecr=1509546935
81152  31.779241 41.177.98.43 -> 41.177.26.155 TCP 70 [TCP Out-Of-Order] 36612 > 8010 [FIN, ACK] Seq=952 Ack=784 Win=66608 Len=0 TSval=1543737 TSecr=1509546935
81166  31.779795 41.177.98.43 -> 41.177.26.155 TCP 70 36612 > 8010 [ACK] Seq=953 Ack=785 Win=66608 Len=0 TSval=1543737 TSecr=1509548636
81167  31.779800 41.177.98.43 -> 41.177.26.155 TCP 70 [TCP Dup ACK 81166#1] 36612 > 8010 [ACK] Seq=953 Ack=785 Win=66608 Len=0 TSval=1543737 TSecr=1509548636
81738  31.905936 41.177.98.43 -> 41.177.26.155 TCP 82 36624 > 8010 [SYN] Seq=0 Win=32850 Len=0 MSS=1460 TSval=1543749 TSecr=0 WS=2 SACK_PERM=1
81739  31.905940 41.177.98.43 -> 41.177.26.155 TCP 82 [TCP Out-Of-Order] 36624 > 8010 [SYN] Seq=0 Win=32850 Len=0 MSS=1460 TSval=1543749 TSecr=0 WS=2 SACK_PERM=1
81742  31.906226 41.177.98.43 -> 41.177.26.155 TCP 70 36624 > 8010 [ACK] Seq=1 Ack=1 Win=66608 Len=0 TSval=1543749 TSecr=1509548649
81743  31.906231 41.177.98.43 -> 41.177.26.155 TCP 70 [TCP Dup ACK 81742#1] 36624 > 8010 [ACK] Seq=1 Ack=1 Win=66608 Len=0 TSval=1543749 TSecr=1509548649
81744  31.906628 41.177.98.43 -> 41.177.26.155 TCP 1151 36624 > 8010 [PSH, ACK] Seq=1 Ack=1 Win=66608 Len=1081 TSval=1543749 TSecr=1509548649
81745  31.906632 41.177.98.43 -> 41.177.26.155 TCP 1151 [TCP Retransmission] 36624 > 8010 [PSH, ACK] Seq=1 Ack=1 Win=66608 Len=1081 TSval=1543749 TSecr=1509548649
82942  32.272701 41.177.98.43 -> 41.177.26.155 TCP 70 36624 > 8010 [ACK] Seq=1082 Ack=1449 Win=65160 Len=0 TSval=1543786 TSecr=1509548685
82943  32.272705 41.177.98.43 -> 41.177.26.155 TCP 70 [TCP Dup ACK 82942#1] 36624 > 8010 [ACK] Seq=1082 Ack=1449 Win=65160 Len=0 TSval=1543786 TSecr=1509548685
82944  32.273057 41.177.98.43 -> 41.177.26.155 TCP 70 36624 > 8010 [ACK] Seq=1082 Ack=2091 Win=66608 Len=0 TSval=1543786 TSecr=1509548685
82945  32.273062 41.177.98.43 -> 41.177.26.155 TCP 70 [TCP Dup ACK 82944#1] 36624 > 8010 [ACK] Seq=1082 Ack=2091 Win=66608 Len=0 TSval=1543786 TSecr=1509548685
88550  34.223305 41.177.98.43 -> 41.177.26.155 TCP 82 36626 > 8010 [SYN] Seq=0 Win=32850 Len=0 MSS=1460 TSval=1543981 TSecr=0 WS=2 SACK_PERM=1
88551  34.223310 41.177.98.43 -> 41.177.26.155 TCP 82 [TCP Out-Of-Order] 36626 > 8010 [SYN] Seq=0 Win=32850 Len=0 MSS=1460 TSval=1543981 TSecr=0 WS=2 SACK_PERM=1
88554  34.223641 41.177.98.43 -> 41.177.26.155 TCP 70 36626 > 8010 [ACK] Seq=1 Ack=1 Win=66608 Len=0 TSval=1543981 TSecr=1509548880
88555  34.223645 41.177.98.43 -> 41.177.26.155 TCP 70 [TCP Dup ACK 88554#1] 36626 > 8010 [ACK] Seq=1 Ack=1 Win=66608 Len=0 TSval=1543981 TSecr=1509548880
88556  34.223998 41.177.98.43 -> 41.177.26.155 TCP 1174 36626 > 8010 [PSH, ACK] Seq=1 Ack=1 Win=66608 Len=1104 TSval=1543981 TSecr=1509548880
88557  34.224002 41.177.98.43 -> 41.177.26.155 TCP 1174 [TCP Retransmission] 36626 > 8010 [PSH, ACK] Seq=1 Ack=1 Win=66608 Len=1104 TSval=1543981 TSecr=1509548880
89479  34.548931 41.177.98.43 -> 41.177.26.155 TCP 70 36626 > 8010 [ACK] Seq=1105 Ack=1449 Win=65160 Len=0 TSval=1544013 TSecr=1509548913
89480  34.548937 41.177.98.43 -> 41.177.26.155 TCP 70 [TCP Dup ACK 89479#1] 36626 > 8010 [ACK] Seq=1105 Ack=1449 Win=65160 Len=0 TSval=1544013 TSecr=1509548913
89481  34.549003 41.177.98.43 -> 41.177.26.155 TCP 70 36626 > 8010 [ACK] Seq=1105 Ack=2030 Win=66608 Len=0 TSval=1544014 TSecr=1509548913
89482  34.549008 41.177.98.43 -> 41.177.26.155 TCP 70 [TCP Dup ACK 89481#1] 36626 > 8010 [ACK] Seq=1105 Ack=2030 Win=66608 Len=0 TSval=1544014 TSecr=1509548913
92417  35.390147 41.177.98.43 -> 41.177.26.155 TCP 82 36627 > 8010 [SYN] Seq=0 Win=32850 Len=0 MSS=1460 TSval=1544098 TSecr=0 WS=2 SACK_PERM=1
92418  35.390152 41.177.98.43 -> 41.177.26.155 TCP 82 [TCP Out-Of-Order] 36627 > 8010 [SYN] Seq=0 Win=32850 Len=0 MSS=1460 TSval=1544098 TSecr=0 WS=2 SACK_PERM=1
92421  35.390466 41.177.98.43 -> 41.177.26.155 TCP 70 36627 > 8010 [ACK] Seq=1 Ack=1 Win=66608 Len=0 TSval=1544098 TSecr=1509548997
92422  35.390471 41.177.98.43 -> 41.177.26.155 TCP 70 [TCP Dup ACK 92421#1] 36627 > 8010 [ACK] Seq=1 Ack=1 Win=66608 Len=0 TSval=1544098 TSecr=1509548997
92427  35.390861 41.177.98.43 -> 41.177.26.155 TCP 964 36627 > 8010 [PSH, ACK] Seq=1 Ack=1 Win=66608 Len=894 TSval=1544098 TSecr=1509548997
92428  35.390866 41.177.98.43 -> 41.177.26.155 TCP 964 [TCP Retransmission] 36627 > 8010 [PSH, ACK] Seq=1 Ack=1 Win=66608 Len=894 TSval=1544098 TSecr=1509548997
92769  35.495740 41.177.98.43 -> 41.177.26.155 TCP 70 36627 > 8010 [ACK] Seq=895 Ack=743 Win=66608 Len=0 TSval=1544108 TSecr=1509549008
92770  35.495745 41.177.98.43 -> 41.177.26.155 TCP 70 [TCP Dup ACK 92769#1] 36627 > 8010 [ACK] Seq=895 Ack=743 Win=66608 Len=0 TSval=1544108 TSecr=1509549008
92834  35.519148 41.177.98.43 -> 41.177.26.155 TCP 70 36617 > 8010 [FIN, ACK] Seq=803 Ack=695 Win=66608 Len=0 TSval=1544111 TSecr=1509547507
92835  35.519152 41.177.98.43 -> 41.177.26.155 TCP 70 [TCP Out-Of-Order] 36617 > 8010 [FIN, ACK] Seq=803 Ack=695 Win=66608 Len=0 TSval=1544111 TSecr=1509547507
92842  35.519712 41.177.98.43 -> 41.177.26.155 TCP 70 36617 > 8010 [ACK] Seq=804 Ack=696 Win=66608 Len=0 TSval=1544111 TSecr=1509549010
92843  35.519716 41.177.98.43 -> 41.177.26.155 TCP 70 [TCP Dup ACK 92842#1] 36617 > 8010 [ACK] Seq=804 Ack=696 Win=66608 Len=0 TSval=1544111 TSecr=1509549010
92955  35.554761 41.177.98.43 -> 41.177.26.155 TCP 70 36605 > 8010 [ACK] Seq=887 Ack=563 Win=66608 Len=0 TSval=1544114 TSecr=1509549013
92956  35.554766 41.177.98.43 -> 41.177.26.155 TCP 70 [TCP Dup ACK 92955#1] 36605 > 8010 [ACK] Seq=887 Ack=563 Win=66608 Len=0 TSval=1544114 TSecr=1509549013
101742  37.339052 41.177.98.43 -> 41.177.26.155 TCP 70 36615 > 8010 [FIN, ACK] Seq=923 Ack=768 Win=66608 Len=0 TSval=1544293 TSecr=1509547490
101743  37.339056 41.177.98.43 -> 41.177.26.155 TCP 70 [TCP Out-Of-Order] 36615 > 8010 [FIN, ACK] Seq=923 Ack=768 Win=66608 Len=0 TSval=1544293 TSecr=1509547490
101750  37.339602 41.177.98.43 -> 41.177.26.155 TCP 70 36615 > 8010 [ACK] Seq=924 Ack=769 Win=66608 Len=0 TSval=1544293 TSecr=1509549192
101751  37.339606 41.177.98.43 -> 41.177.26.155 TCP 70 [TCP Dup ACK 101750#1] 36615 > 8010 [ACK] Seq=924 Ack=769 Win=66608 Len=0 TSval=1544293 TSecr=1509549192
117576  42.180018 41.177.98.43 -> 41.177.26.155 TCP 82 36630 > 8010 [SYN] Seq=0 Win=32850 Len=0 MSS=1460 TSval=1544777 TSecr=0 WS=2 SACK_PERM=1
117577  42.180022 41.177.98.43 -> 41.177.26.155 TCP 82 [TCP Out-Of-Order] 36630 > 8010 [SYN] Seq=0 Win=32850 Len=0 MSS=1460 TSval=1544777 TSecr=0 WS=2 SACK_PERM=1
117580  42.180304 41.177.98.43 -> 41.177.26.155 TCP 70 36630 > 8010 [ACK] Seq=1 Ack=1 Win=66608 Len=0 TSval=1544777 TSecr=1509549676
117581  42.180309 41.177.98.43 -> 41.177.26.155 TCP 70 [TCP Dup ACK 117580#1] 36630 > 8010 [ACK] Seq=1 Ack=1 Win=66608 Len=0 TSval=1544777 TSecr=1509549676
117582  42.180700 41.177.98.43 -> 41.177.26.155 TCP 1140 36630 > 8010 [PSH, ACK] Seq=1 Ack=1 Win=66608 Len=1070 TSval=1544777 TSecr=1509549676
117583  42.180705 41.177.98.43 -> 41.177.26.155 TCP 1140 [TCP Retransmission] 36630 > 8010 [PSH, ACK] Seq=1 Ack=1 Win=66608 Len=1070 TSval=1544777 TSecr=1509549676
117817  42.256224 41.177.98.43 -> 41.177.26.155 TCP 70 36630 > 8010 [ACK] Seq=1071 Ack=1449 Win=65160 Len=0 TSval=1544784 TSecr=1509549684
117818  42.256229 41.177.98.43 -> 41.177.26.155 TCP 70 [TCP Dup ACK 117817#1] 36630 > 8010 [ACK] Seq=1071 Ack=1449 Win=65160 Len=0 TSval=1544784 TSecr=1509549684
117819  42.256266 41.177.98.43 -> 41.177.26.155 TCP 70 36630 > 8010 [ACK] Seq=1071 Ack=1471 Win=66608 Len=0 TSval=1544784 TSecr=1509549684
117820  42.256270 41.177.98.43 -> 41.177.26.155 TCP 70 [TCP Dup ACK 117819#1] 36630 > 8010 [ACK] Seq=1071 Ack=1471 Win=66608 Len=0 TSval=1544784 TSecr=1509549684
118994  42.702254 41.177.98.43 -> 41.177.26.155 TCP 82 36633 > 8010 [SYN] Seq=0 Win=32850 Len=0 MSS=1460 TSval=1544829 TSecr=0 WS=2 SACK_PERM=1
118995  42.702258 41.177.98.43 -> 41.177.26.155 TCP 82 [TCP Out-Of-Order] 36633 > 8010 [SYN] Seq=0 Win=32850 Len=0 MSS=1460 TSval=1544829 TSecr=0 WS=2 SACK_PERM=1
118999  42.702590 41.177.98.43 -> 41.177.26.155 TCP 70 36633 > 8010 [ACK] Seq=1 Ack=1 Win=66608 Len=0 TSval=1544829 TSecr=1509549728
119000  42.702594 41.177.98.43 -> 41.177.26.155 TCP 70 [TCP Dup ACK 118999#1] 36633 > 8010 [ACK] Seq=1 Ack=1 Win=66608 Len=0 TSval=1544829 TSecr=1509549728
119002  42.702960 41.177.98.43 -> 41.177.26.155 TCP 1010 36633 > 8010 [PSH, ACK] Seq=1 Ack=1 Win=66608 Len=940 TSval=1544829 TSecr=1509549728
119003  42.702965 41.177.98.43 -> 41.177.26.155 TCP 1010 [TCP Retransmission] 36633 > 8010 [PSH, ACK] Seq=1 Ack=1 Win=66608 Len=940 TSval=1544829 TSecr=1509549728
119325  42.780743 41.177.98.43 -> 41.177.26.155 TCP 70 36633 > 8010 [ACK] Seq=941 Ack=845 Win=66608 Len=0 TSval=1544837 TSecr=1509549736
119326  42.780750 41.177.98.43 -> 41.177.26.155 TCP 70 [TCP Dup ACK 119325#1] 36633 > 8010 [ACK] Seq=941 Ack=845 Win=66608 Len=0 TSval=1544837 TSecr=1509549736
142756  49.035749 41.177.98.43 -> 41.177.26.155 TCP 82 36636 > 8010 [SYN] Seq=0 Win=32850 Len=0 MSS=1460 TSval=1545462 TSecr=0 WS=2 SACK_PERM=1
142757  49.035754 41.177.98.43 -> 41.177.26.155 TCP 82 [TCP Out-Of-Order] 36636 > 8010 [SYN] Seq=0 Win=32850 Len=0 MSS=1460 TSval=1545462 TSecr=0 WS=2 SACK_PERM=1
142761  49.036128 41.177.98.43 -> 41.177.26.155 TCP 70 36636 > 8010 [ACK] Seq=1 Ack=1 Win=66608 Len=0 TSval=1545462 TSecr=1509550362
142762  49.036133 41.177.98.43 -> 41.177.26.155 TCP 70 [TCP Dup ACK 142761#1] 36636 > 8010 [ACK] Seq=1 Ack=1 Win=66608 Len=0 TSval=1545462 TSecr=1509550362
142766  49.036528 41.177.98.43 -> 41.177.26.155 TCP 1295 36636 > 8010 [PSH, ACK] Seq=1 Ack=1 Win=66608 Len=1225 TSval=1545462 TSecr=1509550362
142767  49.036533 41.177.98.43 -> 41.177.26.155 TCP 1295 [TCP Retransmission] 36636 > 8010 [PSH, ACK] Seq=1 Ack=1 Win=66608 Len=1225 TSval=1545462 TSecr=1509550362
142980  49.111675 41.177.98.43 -> 41.177.26.155 TCP 70 36636 > 8010 [ACK] Seq=1226 Ack=1449 Win=65160 Len=0 TSval=1545470 TSecr=1509550369
142981  49.111680 41.177.98.43 -> 41.177.26.155 TCP 70 [TCP Dup ACK 142980#1] 36636 > 8010 [ACK] Seq=1226 Ack=1449 Win=65160 Len=0 TSval=1545470 TSecr=1509550369
142982  49.111714 41.177.98.43 -> 41.177.26.155 TCP 70 36636 > 8010 [ACK] Seq=1226 Ack=1519 Win=66608 Len=0 TSval=1545470 TSecr=1509550369
142983  49.111719 41.177.98.43 -> 41.177.26.155 TCP 70 [TCP Dup ACK 142982#1] 36636 > 8010 [ACK] Seq=1226 Ack=1519 Win=66608 Len=0 TSval=1545470 TSecr=1509550369
153292  52.459832 41.177.98.43 -> 41.177.26.155 TCP 82 36639 > 8010 [SYN] Seq=0 Win=32850 Len=0 MSS=1460 TSval=1545805 TSecr=0 WS=2 SACK_PERM=1
153293  52.459836 41.177.98.43 -> 41.177.26.155 TCP 82 [TCP Out-Of-Order] 36639 > 8010 [SYN] Seq=0 Win=32850 Len=0 MSS=1460 TSval=1545805 TSecr=0 WS=2 SACK_PERM=1
153296  52.460175 41.177.98.43 -> 41.177.26.155 TCP 70 36639 > 8010 [ACK] Seq=1 Ack=1 Win=66608 Len=0 TSval=1545805 TSecr=1509550704
153297  52.460180 41.177.98.43 -> 41.177.26.155 TCP 70 [TCP Dup ACK 153296#1] 36639 > 8010 [ACK] Seq=1 Ack=1 Win=66608 Len=0 TSval=1545805 TSecr=1509550704
153298  52.460578 41.177.98.43 -> 41.177.26.155 TCP 1123 36639 > 8010 [PSH, ACK] Seq=1 Ack=1 Win=66608 Len=1053 TSval=1545805 TSecr=1509550704
153299  52.460583 41.177.98.43 -> 41.177.26.155 TCP 1123 [TCP Retransmission] 36639 > 8010 [PSH, ACK] Seq=1 Ack=1 Win=66608 Len=1053 TSval=1545805 TSecr=1509550704
153519  52.508510 41.177.98.43 -> 41.177.26.155 TCP 70 36627 > 8010 [FIN, ACK] Seq=895 Ack=743 Win=66608 Len=0 TSval=1545810 TSecr=1509549008
153520  52.508515 41.177.98.43 -> 41.177.26.155 TCP 70 [TCP Out-Of-Order] 36627 > 8010 [FIN, ACK] Seq=895 Ack=743 Win=66608 Len=0 TSval=1545810 TSecr=1509549008
153534  52.509481 41.177.98.43 -> 41.177.26.155 TCP 70 36627 > 8010 [ACK] Seq=896 Ack=744 Win=66608 Len=0 TSval=1545810 TSecr=1509550709
153535  52.509486 41.177.98.43 -> 41.177.26.155 TCP 70 [TCP Dup ACK 153534#1] 36627 > 8010 [ACK] Seq=896 Ack=744 Win=66608 Len=0 TSval=1545810 TSecr=1509550709
153649  52.546070 41.177.98.43 -> 41.177.26.155 TCP 70 36639 > 8010 [ACK] Seq=1054 Ack=851 Win=66608 Len=0 TSval=1545813 TSecr=1509550713
153650  52.546075 41.177.98.43 -> 41.177.26.155 TCP 70 [TCP Dup ACK 153649#1] 36639 > 8010 [ACK] Seq=1054 Ack=851 Win=66608 Len=0 TSval=1545813 TSecr=1509550713
155914  53.167040 41.177.98.43 -> 41.177.26.155 TCP 82 36641 > 8010 [SYN] Seq=0 Win=32850 Len=0 MSS=1460 TSval=1545875 TSecr=0 WS=2 SACK_PERM=1
155915  53.167044 41.177.98.43 -> 41.177.26.155 TCP 82 [TCP Out-Of-Order] 36641 > 8010 [SYN] Seq=0 Win=32850 Len=0 MSS=1460 TSval=1545875 TSecr=0 WS=2 SACK_PERM=1
155918  53.167446 41.177.98.43 -> 41.177.26.155 TCP 70 36641 > 8010 [ACK] Seq=1 Ack=1 Win=66608 Len=0 TSval=1545875 TSecr=1509550775
155919  53.167450 41.177.98.43 -> 41.177.26.155 TCP 70 [TCP Dup ACK 155918#1] 36641 > 8010 [ACK] Seq=1 Ack=1 Win=66608 Len=0 TSval=1545875 TSecr=1509550775
155920  53.167730 41.177.98.43 -> 41.177.26.155 TCP 868 36641 > 8010 [PSH, ACK] Seq=1 Ack=1 Win=66608 Len=798 TSval=1545875 TSecr=1509550775
155921  53.167735 41.177.98.43 -> 41.177.26.155 TCP 868 [TCP Retransmission] 36641 > 8010 [PSH, ACK] Seq=1 Ack=1 Win=66608 Len=798 TSval=1545875 TSecr=1509550775
156280  53.259981 41.177.98.43 -> 41.177.26.155 TCP 70 36641 > 8010 [ACK] Seq=799 Ack=881 Win=66608 Len=0 TSval=1545885 TSecr=1509550784
156281  53.259986 41.177.98.43 -> 41.177.26.155 TCP 70 [TCP Dup ACK 156280#1] 36641 > 8010 [ACK] Seq=799 Ack=881 Win=66608 Len=0 TSval=1545885 TSecr=1509550784
156418  53.284467 41.177.98.43 -> 41.177.26.155 TCP 70 36641 > 8010 [FIN, ACK] Seq=799 Ack=881 Win=66608 Len=0 TSval=1545887 TSecr=1509550784
156419  53.284472 41.177.98.43 -> 41.177.26.155 TCP 70 [TCP Out-Of-Order] 36641 > 8010 [FIN, ACK] Seq=799 Ack=881 Win=66608 Len=0 TSval=1545887 TSecr=1509550784
156428  53.285009 41.177.98.43 -> 41.177.26.155 TCP 70 36641 > 8010 [ACK] Seq=800 Ack=882 Win=66608 Len=0 TSval=1545887 TSecr=1509550786
156429  53.285014 41.177.98.43 -> 41.177.26.155 TCP 70 [TCP Dup ACK 156428#1] 36641 > 8010 [ACK] Seq=800 Ack=882 Win=66608 Len=0 TSval=1545887 TSecr=1509550786
157260  53.592157 41.177.98.43 -> 41.177.26.155 TCP 70 36605 > 8010 [FIN, ACK] Seq=887 Ack=563 Win=66608 Len=0 TSval=1545918 TSecr=1509549013
157261  53.592162 41.177.98.43 -> 41.177.26.155 TCP 70 [TCP Out-Of-Order] 36605 > 8010 [FIN, ACK] Seq=887 Ack=563 Win=66608 Len=0 TSval=1545918 TSecr=1509549013
160002  54.484284 41.177.98.43 -> 41.177.26.155 TCP 1295 36636 > 8010 [PSH, ACK] Seq=1226 Ack=1519 Win=66608 Len=1225 TSval=1546007 TSecr=1509550369
160003  54.484289 41.177.98.43 -> 41.177.26.155 TCP 1295 [TCP Retransmission] 36636 > 8010 [PSH, ACK] Seq=1226 Ack=1519 Win=66608 Len=1225 TSval=1546007 TSecr=1509550369
160510  54.659399 41.177.98.43 -> 41.177.26.155 TCP 70 36636 > 8010 [ACK] Seq=2451 Ack=2966 Win=66608 Len=0 TSval=1546025 TSecr=1509550913
160511  54.659404 41.177.98.43 -> 41.177.26.155 TCP 70 [TCP Dup ACK 160510#1] 36636 > 8010 [ACK] Seq=2451 Ack=2966 Win=66608 Len=0 TSval=1546025 TSecr=1509550913
175180  58.244313 41.177.98.43 -> 41.177.26.155 TCP 70 36624 > 8010 [FIN, ACK] Seq=1082 Ack=2091 Win=66608 Len=0 TSval=1546383 TSecr=1509548685
175181  58.244318 41.177.98.43 -> 41.177.26.155 TCP 70 [TCP Out-Of-Order] 36624 > 8010 [FIN, ACK] Seq=1082 Ack=2091 Win=66608 Len=0 TSval=1546383 TSecr=1509548685
175188  58.244756 41.177.98.43 -> 41.177.26.155 TCP 70 36624 > 8010 [ACK] Seq=1083 Ack=2092 Win=66608 Len=0 TSval=1546383 TSecr=1509551282
175189  58.244760 41.177.98.43 -> 41.177.26.155 TCP 70 [TCP Dup ACK 175188#1] 36624 > 8010 [ACK] Seq=1083 Ack=2092 Win=66608 Len=0 TSval=1546383 TSecr=1509551282
176557  58.959042 41.177.98.43 -> 41.177.26.155 TCP 70 36626 > 8010 [FIN, ACK] Seq=1105 Ack=2030 Win=66608 Len=0 TSval=1546455 TSecr=1509548913
176558  58.959047 41.177.98.43 -> 41.177.26.155 TCP 70 [TCP Out-Of-Order] 36626 > 8010 [FIN, ACK] Seq=1105 Ack=2030 Win=66608 Len=0 TSval=1546455 TSecr=1509548913
176563  58.959696 41.177.98.43 -> 41.177.26.155 TCP 70 36626 > 8010 [ACK] Seq=1106 Ack=2031 Win=66608 Len=0 TSval=1546455 TSecr=1509551354
176564  58.959700 41.177.98.43 -> 41.177.26.155 TCP 70 [TCP Dup ACK 176563#1] 36626 > 8010 [ACK] Seq=1106 Ack=2031 Win=66608 Len=0 TSval=1546455 TSecr=1509551354
178141  59.798203 41.177.98.43 -> 41.177.26.155 TCP 70 36633 > 8010 [FIN, ACK] Seq=941 Ack=845 Win=66608 Len=0 TSval=1546539 TSecr=1509549736
178142  59.798207 41.177.98.43 -> 41.177.26.155 TCP 70 [TCP Out-Of-Order] 36633 > 8010 [FIN, ACK] Seq=941 Ack=845 Win=66608 Len=0 TSval=1546539 TSecr=1509549736
178147  59.798775 41.177.98.43 -> 41.177.26.155 TCP 70 36633 > 8010 [ACK] Seq=942 Ack=846 Win=66608 Len=0 TSval=1546539 TSecr=1509551438
178148  59.798780 41.177.98.43 -> 41.177.26.155 TCP 70 [TCP Dup ACK 178147#1] 36633 > 8010 [ACK] Seq=942 Ack=846 Win=66608 Len=0 TSval=1546539 TSecr=1509551438
184529  62.028936 41.177.98.43 -> 41.177.26.155 TCP 1161 36630 > 8010 [PSH, ACK] Seq=1071 Ack=1471 Win=66608 Len=1091 TSval=1546762 TSecr=1509549684
184530  62.028941 41.177.98.43 -> 41.177.26.155 TCP 1161 [TCP Retransmission] 36630 > 8010 [PSH, ACK] Seq=1071 Ack=1471 Win=66608 Len=1091 TSval=1546762 TSecr=1509549684
185892  62.268017 41.177.98.43 -> 41.177.26.155 TCP 70 36630 > 8010 [ACK] Seq=2162 Ack=2865 Win=66608 Len=0 TSval=1546786 TSecr=1509551674
185893  62.268022 41.177.98.43 -> 41.177.26.155 TCP 70 [TCP Dup ACK 185892#1] 36630 > 8010 [ACK] Seq=2162 Ack=2865 Win=66608 Len=0 TSval=1546786 TSecr=1509551674
187581  63.467501 41.177.98.43 -> 41.177.26.155 TCP 82 36649 > 8010 [SYN] Seq=0 Win=32850 Len=0 MSS=1460 TSval=1546905 TSecr=0 WS=2 SACK_PERM=1
187582  63.467506 41.177.98.43 -> 41.177.26.155 TCP 82 [TCP Out-Of-Order] 36649 > 8010 [SYN] Seq=0 Win=32850 Len=0 MSS=1460 TSval=1546905 TSecr=0 WS=2 SACK_PERM=1
187586  63.467831 41.177.98.43 -> 41.177.26.155 TCP 70 36649 > 8010 [ACK] Seq=1 Ack=1 Win=66608 Len=0 TSval=1546905 TSecr=1509551805
187587  63.467836 41.177.98.43 -> 41.177.26.155 TCP 70 [TCP Dup ACK 187586#1] 36649 > 8010 [ACK] Seq=1 Ack=1 Win=66608 Len=0 TSval=1546905 TSecr=1509551805
187589  63.468284 41.177.98.43 -> 41.177.26.155 TCP 1061 36649 > 8010 [PSH, ACK] Seq=1 Ack=1 Win=66608 Len=991 TSval=1546906 TSecr=1509551805
187590  63.468289 41.177.98.43 -> 41.177.26.155 TCP 1061 [TCP Retransmission] 36649 > 8010 [PSH, ACK] Seq=1 Ack=1 Win=66608 Len=991 TSval=1546906 TSecr=1509551805
187618  63.481829 41.177.98.43 -> 41.177.26.155 TCP 70 36649 > 8010 [ACK] Seq=992 Ack=562 Win=66608 Len=0 TSval=1546907 TSecr=1509551806
187619  63.481833 41.177.98.43 -> 41.177.26.155 TCP 70 [TCP Dup ACK 187618#1] 36649 > 8010 [ACK] Seq=992 Ack=562 Win=66608 Len=0 TSval=1546907 TSecr=1509551806
201594  69.557943 41.177.98.43 -> 41.177.26.155 TCP 70 36639 > 8010 [FIN, ACK] Seq=1054 Ack=851 Win=66608 Len=0 TSval=1547515 TSecr=1509550713
201595  69.557948 41.177.98.43 -> 41.177.26.155 TCP 70 [TCP Out-Of-Order] 36639 > 8010 [FIN, ACK] Seq=1054 Ack=851 Win=66608 Len=0 TSval=1547515 TSecr=1509550713
201600  69.558514 41.177.98.43 -> 41.177.26.155 TCP 70 36639 > 8010 [ACK] Seq=1055 Ack=852 Win=66608 Len=0 TSval=1547515 TSecr=1509552414
201601  69.558519 41.177.98.43 -> 41.177.26.155 TCP 70 [TCP Dup ACK 201600#1] 36639 > 8010 [ACK] Seq=1055 Ack=852 Win=66608 Len=0 TSval=1547515 TSecr=1509552414
208429  71.567773 41.177.98.43 -> 41.177.26.155 TCP 70 36636 > 8010 [FIN, ACK] Seq=2451 Ack=2966 Win=66608 Len=0 TSval=1547716 TSecr=1509550913
208430  71.567779 41.177.98.43 -> 41.177.26.155 TCP 70 [TCP Out-Of-Order] 36636 > 8010 [FIN, ACK] Seq=2451 Ack=2966 Win=66608 Len=0 TSval=1547716 TSecr=1509550913
208436  71.568347 41.177.98.43 -> 41.177.26.155 TCP 70 36636 > 8010 [ACK] Seq=2452 Ack=2967 Win=66608 Len=0 TSval=1547716 TSecr=1509552615
208437  71.568352 41.177.98.43 -> 41.177.26.155 TCP 70 [TCP Dup ACK 208436#1] 36636 > 8010 [ACK] Seq=2452 Ack=2967 Win=66608 Len=0 TSval=1547716 TSecr=1509552615
223606  76.543978 41.177.98.43 -> 41.177.26.155 TCP 82 36654 > 8010 [SYN] Seq=0 Win=32850 Len=0 MSS=1460 TSval=1548213 TSecr=0 WS=2 SACK_PERM=1
223607  76.543982 41.177.98.43 -> 41.177.26.155 TCP 82 [TCP Out-Of-Order] 36654 > 8010 [SYN] Seq=0 Win=32850 Len=0 MSS=1460 TSval=1548213 TSecr=0 WS=2 SACK_PERM=1
223610  76.544311 41.177.98.43 -> 41.177.26.155 TCP 70 36654 > 8010 [ACK] Seq=1 Ack=1 Win=66608 Len=0 TSval=1548213 TSecr=1509553112
223611  76.544316 41.177.98.43 -> 41.177.26.155 TCP 70 [TCP Dup ACK 223610#1] 36654 > 8010 [ACK] Seq=1 Ack=1 Win=66608 Len=0 TSval=1548213 TSecr=1509553112
223614  76.544636 41.177.98.43 -> 41.177.26.155 TCP 981 36654 > 8010 [PSH, ACK] Seq=1 Ack=1 Win=66608 Len=911 TSval=1548213 TSecr=1509553112
223615  76.544641 41.177.98.43 -> 41.177.26.155 TCP 981 [TCP Retransmission] 36654 > 8010 [PSH, ACK] Seq=1 Ack=1 Win=66608 Len=911 TSval=1548213 TSecr=1509553112
223936  76.618848 41.177.98.43 -> 41.177.26.155 TCP 70 36654 > 8010 [ACK] Seq=912 Ack=864 Win=66608 Len=0 TSval=1548221 TSecr=1509553120
223937  76.618852 41.177.98.43 -> 41.177.26.155 TCP 70 [TCP Dup ACK 223936#1] 36654 > 8010 [ACK] Seq=912 Ack=864 Win=66608 Len=0 TSval=1548221 TSecr=1509553120
229877  79.177473 41.177.98.43 -> 41.177.26.155 TCP 70 36630 > 8010 [FIN, ACK] Seq=2162 Ack=2865 Win=66608 Len=0 TSval=1548477 TSecr=1509551674
229878  79.177478 41.177.98.43 -> 41.177.26.155 TCP 70 [TCP Out-Of-Order] 36630 > 8010 [FIN, ACK] Seq=2162 Ack=2865 Win=66608 Len=0 TSval=1548477 TSecr=1509551674
229884  79.178037 41.177.98.43 -> 41.177.26.155 TCP 70 36630 > 8010 [ACK] Seq=2163 Ack=2866 Win=66608 Len=0 TSval=1548477 TSecr=1509553376
229885  79.178042 41.177.98.43 -> 41.177.26.155 TCP 70 [TCP Dup ACK 229884#1] 36630 > 8010 [ACK] Seq=2163 Ack=2866 Win=66608 Len=0 TSval=1548477 TSecr=1509553376
232764  80.497413 41.177.98.43 -> 41.177.26.155 TCP 70 36649 > 8010 [FIN, ACK] Seq=992 Ack=562 Win=66608 Len=0 TSval=1548609 TSecr=1509551806
232765  80.497417 41.177.98.43 -> 41.177.26.155 TCP 70 [TCP Out-Of-Order] 36649 > 8010 [FIN, ACK] Seq=992 Ack=562 Win=66608 Len=0 TSval=1548609 TSecr=1509551806
232770  80.498007 41.177.98.43 -> 41.177.26.155 TCP 70 36649 > 8010 [ACK] Seq=993 Ack=563 Win=66608 Len=0 TSval=1548609 TSecr=1509553508
232771  80.498012 41.177.98.43 -> 41.177.26.155 TCP 70 [TCP Dup ACK 232770#1] 36649 > 8010 [ACK] Seq=993 Ack=563 Win=66608 Len=0 TSval=1548609 TSecr=1509553508
240850  83.700580 41.177.98.43 -> 41.177.26.155 TCP 82 36656 > 8010 [SYN] Seq=0 Win=32850 Len=0 MSS=1460 TSval=1548929 TSecr=0 WS=2 SACK_PERM=1
240851  83.700585 41.177.98.43 -> 41.177.26.155 TCP 82 [TCP Out-Of-Order] 36656 > 8010 [SYN] Seq=0 Win=32850 Len=0 MSS=1460 TSval=1548929 TSecr=0 WS=2 SACK_PERM=1
240854  83.700979 41.177.98.43 -> 41.177.26.155 TCP 70 36656 > 8010 [ACK] Seq=1 Ack=1 Win=66608 Len=0 TSval=1548929 TSecr=1509553828
240855  83.700984 41.177.98.43 -> 41.177.26.155 TCP 70 [TCP Dup ACK 240854#1] 36656 > 8010 [ACK] Seq=1 Ack=1 Win=66608 Len=0 TSval=1548929 TSecr=1509553828
240856  83.701397 41.177.98.43 -> 41.177.26.155 TCP 1295 36656 > 8010 [PSH, ACK] Seq=1 Ack=1 Win=66608 Len=1225 TSval=1548929 TSecr=1509553828
240857  83.701402 41.177.98.43 -> 41.177.26.155 TCP 1295 [TCP Retransmission] 36656 > 8010 [PSH, ACK] Seq=1 Ack=1 Win=66608 Len=1225 TSval=1548929 TSecr=1509553828
240929  83.767336 41.177.98.43 -> 41.177.26.155 TCP 70 36656 > 8010 [ACK] Seq=1226 Ack=1448 Win=66608 Len=0 TSval=1548936 TSecr=1509553835
240930  83.767341 41.177.98.43 -> 41.177.26.155 TCP 70 [TCP Dup ACK 240929#1] 36656 > 8010 [ACK] Seq=1226 Ack=1448 Win=66608 Len=0 TSval=1548936 TSecr=1509553835
249583  88.044095 41.177.98.43 -> 41.177.26.155 TCP 82 36659 > 8010 [SYN] Seq=0 Win=32850 Len=0 MSS=1460 TSval=1549363 TSecr=0 WS=2 SACK_PERM=1
249584  88.044099 41.177.98.43 -> 41.177.26.155 TCP 82 [TCP Out-Of-Order] 36659 > 8010 [SYN] Seq=0 Win=32850 Len=0 MSS=1460 TSval=1549363 TSecr=0 WS=2 SACK_PERM=1
249588  88.044347 41.177.98.43 -> 41.177.26.155 TCP 70 36659 > 8010 [ACK] Seq=1 Ack=1 Win=66608 Len=0 TSval=1549363 TSecr=1509554262
249589  88.044352 41.177.98.43 -> 41.177.26.155 TCP 70 [TCP Dup ACK 249588#1] 36659 > 8010 [ACK] Seq=1 Ack=1 Win=66608 Len=0 TSval=1549363 TSecr=1509554262
249593  88.044743 41.177.98.43 -> 41.177.26.155 TCP 1011 36659 > 8010 [PSH, ACK] Seq=1 Ack=1 Win=66608 Len=941 TSval=1549363 TSecr=1509554262
249594  88.044747 41.177.98.43 -> 41.177.26.155 TCP 1011 [TCP Retransmission] 36659 > 8010 [PSH, ACK] Seq=1 Ack=1 Win=66608 Len=941 TSval=1549363 TSecr=1509554262
250375  88.310135 41.177.98.43 -> 41.177.26.155 TCP 70 36659 > 8010 [ACK] Seq=942 Ack=1449 Win=65160 Len=0 TSval=1549390 TSecr=1509554289
250376  88.310139 41.177.98.43 -> 41.177.26.155 TCP 70 [TCP Dup ACK 250375#1] 36659 > 8010 [ACK] Seq=942 Ack=1449 Win=65160 Len=0 TSval=1549390 TSecr=1509554289
250377  88.310186 41.177.98.43 -> 41.177.26.155 TCP 70 36659 > 8010 [ACK] Seq=942 Ack=2067 Win=66608 Len=0 TSval=1549390 TSecr=1509554289
250378  88.310191 41.177.98.43 -> 41.177.26.155 TCP 70 [TCP Dup ACK 250377#1] 36659 > 8010 [ACK] Seq=942 Ack=2067 Win=66608 Len=0 TSval=1549390 TSecr=1509554289
250785  88.540214 41.177.98.43 -> 41.177.26.155 TCP 82 36660 > 8010 [SYN] Seq=0 Win=32850 Len=0 MSS=1460 TSval=1549413 TSecr=0 WS=2 SACK_PERM=1
250786  88.540219 41.177.98.43 -> 41.177.26.155 TCP 82 [TCP Out-Of-Order] 36660 > 8010 [SYN] Seq=0 Win=32850 Len=0 MSS=1460 TSval=1549413 TSecr=0 WS=2 SACK_PERM=1
250789  88.540500 41.177.98.43 -> 41.177.26.155 TCP 70 36660 > 8010 [ACK] Seq=1 Ack=1 Win=66608 Len=0 TSval=1549413 TSecr=1509554312
250790  88.540505 41.177.98.43 -> 41.177.26.155 TCP 70 [TCP Dup ACK 250789#1] 36660 > 8010 [ACK] Seq=1 Ack=1 Win=66608 Len=0 TSval=1549413 TSecr=1509554312
250791  88.540821 41.177.98.43 -> 41.177.26.155 TCP 924 36660 > 8010 [PSH, ACK] Seq=1 Ack=1 Win=66608 Len=854 TSval=1549413 TSecr=1509554312
250792  88.540825 41.177.98.43 -> 41.177.26.155 TCP 924 [TCP Retransmission] 36660 > 8010 [PSH, ACK] Seq=1 Ack=1 Win=66608 Len=854 TSval=1549413 TSecr=1509554312
250799  88.548125 41.177.98.43 -> 41.177.26.155 TCP 70 36660 > 8010 [ACK] Seq=855 Ack=562 Win=66608 Len=0 TSval=1549414 TSecr=1509554313
250800  88.548130 41.177.98.43 -> 41.177.26.155 TCP 70 [TCP Dup ACK 250799#1] 36660 > 8010 [ACK] Seq=855 Ack=562 Win=66608 Len=0 TSval=1549414 TSecr=1509554313
276076  93.073385 41.177.98.43 -> 41.177.26.155 TCP 82 36662 > 8010 [SYN] Seq=0 Win=32850 Len=0 MSS=1460 TSval=1549866 TSecr=0 WS=2 SACK_PERM=1
276077  93.073389 41.177.98.43 -> 41.177.26.155 TCP 82 [TCP Out-Of-Order] 36662 > 8010 [SYN] Seq=0 Win=32850 Len=0 MSS=1460 TSval=1549866 TSecr=0 WS=2 SACK_PERM=1
276080  93.073797 41.177.98.43 -> 41.177.26.155 TCP 70 36662 > 8010 [ACK] Seq=1 Ack=1 Win=66608 Len=0 TSval=1549866 TSecr=1509554765
276081  93.073802 41.177.98.43 -> 41.177.26.155 TCP 70 [TCP Dup ACK 276080#1] 36662 > 8010 [ACK] Seq=1 Ack=1 Win=66608 Len=0 TSval=1549866 TSecr=1509554765
276082  93.074112 41.177.98.43 -> 41.177.26.155 TCP 943 36662 > 8010 [PSH, ACK] Seq=1 Ack=1 Win=66608 Len=873 TSval=1549866 TSecr=1509554765
276084  93.074121 41.177.98.43 -> 41.177.26.155 TCP 943 [TCP Retransmission] 36662 > 8010 [PSH, ACK] Seq=1 Ack=1 Win=66608 Len=873 TSval=1549866 TSecr=1509554765
276093  93.084161 41.177.98.43 -> 41.177.26.155 TCP 70 36662 > 8010 [ACK] Seq=874 Ack=562 Win=66608 Len=0 TSval=1549867 TSecr=1509554766
