  4   0.000379 41.177.3.224 -> 41.177.117.184 TCP 668 51332 > skytelnet [PSH, ACK] Seq=1 Ack=339 Win=65535 Len=610
  6   0.001201 41.177.3.224 -> 41.177.117.184 TCP 719 51332 > skytelnet [PSH, ACK] Seq=611 Ack=821 Win=65535 Len=661
 11   0.001957 41.177.3.224 -> 41.177.117.184 TCP 515 51332 > skytelnet [PSH, ACK] Seq=1272 Ack=1364 Win=65535 Len=457
 31   0.003768 41.177.3.224 -> 41.177.117.184 TCP 379 51332 > skytelnet [PSH, ACK] Seq=1729 Ack=1699 Win=65535 Len=321
 33   0.004381 41.177.3.224 -> 41.177.117.184 TCP 131 51332 > skytelnet [PSH, ACK] Seq=2050 Ack=1880 Win=65535 Len=73
 39   0.005016 41.177.3.224 -> 244.3.176.149 TCP 281 9809 > transact [PSH, ACK] Seq=1 Ack=1 Win=65535 Len=223
 57   0.005800 41.177.3.224 -> 244.3.176.149 TCP 134 9809 > transact [PSH, ACK] Seq=224 Ack=69 Win=65535 Len=76
 59   0.006418 41.177.3.224 -> 244.3.176.149 TCP 64 9809 > transact [ACK] Seq=300 Ack=70 Win=65535 Len=0
 61   0.006576 41.177.3.224 -> 244.3.176.149 TCP 64 9809 > transact [FIN, ACK] Seq=300 Ack=70 Win=65535 Len=0
129   0.022589 41.177.3.224 -> 244.3.176.149 TCP 64 52479 > 8752 [ACK] Seq=1 Ack=2180 Win=65535 Len=0
137   0.025369 41.177.3.224 -> 244.3.176.149 TCP 81 52479 > 8752 [PSH, ACK] Seq=1 Ack=2180 Win=65535 Len=23
138   0.025408 41.177.3.224 -> 244.3.176.149 TCP 64 52479 > 8752 [FIN, ACK] Seq=24 Ack=2180 Win=65535 Len=0
142   0.026387 41.177.3.224 -> 41.177.117.184 TCP 504 39924 > skytelnet [PSH, ACK] Seq=1 Ack=1 Win=65535 Len=446
151   0.026977 41.177.3.224 -> 41.177.117.184 TCP 267 39924 > skytelnet [PSH, ACK] Seq=447 Ack=309 Win=65535 Len=209
153   0.027642 41.177.3.224 -> 41.177.117.184 TCP 612 39924 > skytelnet [PSH, ACK] Seq=656 Ack=516 Win=65535 Len=554
155   0.029240 41.177.3.224 -> 41.177.117.184 TCP 448 39924 > skytelnet [PSH, ACK] Seq=1210 Ack=908 Win=65535 Len=390
157   0.029929 41.177.3.224 -> 41.177.117.184 TCP 429 39924 > skytelnet [PSH, ACK] Seq=1600 Ack=1105 Win=65535 Len=371
159   0.030450 41.177.3.224 -> 41.177.117.184 TCP 131 39924 > skytelnet [PSH, ACK] Seq=1971 Ack=1499 Win=65535 Len=73
163   0.032837 41.177.3.224 -> 41.177.117.184 TCP 1438 39924 > skytelnet [ACK] Seq=2044 Ack=1521 Win=65535 Len=1380
164   0.032841 41.177.3.224 -> 41.177.117.184 TCP 575 39924 > skytelnet [PSH, ACK] Seq=3424 Ack=1521 Win=65535 Len=517
248   0.050152 41.177.3.224 -> 41.177.117.184 TCP 1438 39924 > skytelnet [ACK] Seq=3941 Ack=1718 Win=65535 Len=1380
249   0.050157 41.177.3.224 -> 41.177.117.184 TCP 352 39924 > skytelnet [PSH, ACK] Seq=5321 Ack=1718 Win=65535 Len=294
298   0.065709 41.177.3.224 -> 41.177.117.184 TCP 1358 39924 > skytelnet [PSH, ACK] Seq=5615 Ack=1915 Win=65535 Len=1300
302   0.066484 41.177.3.224 -> 41.177.117.184 TCP 693 39924 > skytelnet [PSH, ACK] Seq=6915 Ack=2112 Win=65535 Len=635
304   0.067304 41.177.3.224 -> 41.177.117.184 TCP 397 39924 > skytelnet [PSH, ACK] Seq=7550 Ack=2850 Win=65535 Len=339
307   0.067863 41.177.3.224 -> 41.177.117.184 TCP 131 39924 > skytelnet [PSH, ACK] Seq=7889 Ack=3047 Win=65535 Len=73
346   0.089268 41.177.3.224 -> 41.177.117.184 TCP 521 39924 > skytelnet [PSH, ACK] Seq=7962 Ack=3069 Win=65535 Len=463
348   0.090072 41.177.3.224 -> 41.177.117.184 TCP 429 39924 > skytelnet [PSH, ACK] Seq=8425 Ack=3474 Win=65535 Len=371
361   0.090808 41.177.3.224 -> 41.177.117.184 TCP 785 39924 > skytelnet [PSH, ACK] Seq=8796 Ack=3871 Win=65535 Len=727
363   0.091433 41.177.3.224 -> 41.177.117.184 TCP 588 39924 > skytelnet [PSH, ACK] Seq=9523 Ack=4068 Win=65535 Len=530
375   0.092057 41.177.3.224 -> 41.177.117.184 TCP 452 39924 > skytelnet [PSH, ACK] Seq=10053 Ack=4265 Win=65535 Len=394
377   0.092502 41.177.3.224 -> 41.177.117.184 TCP 131 39924 > skytelnet [PSH, ACK] Seq=10447 Ack=4462 Win=65535 Len=73
378   0.092685 41.177.3.224 -> 41.177.117.184 TCP 64 50371 > slp [ACK] Seq=1 Ack=1 Win=65535 Len=0
379   0.092689 41.177.3.224 -> 41.177.117.184 TCP 64 51332 > skytelnet [ACK] Seq=2123 Ack=1902 Win=65535 Len=0
380   0.092694 41.177.3.224 -> 41.177.117.184 TCP 64 51330 > skytelnet [ACK] Seq=1 Ack=1 Win=65535 Len=0
418   0.096700 41.177.3.224 -> 41.177.117.184 TCP 490 39924 > skytelnet [PSH, ACK] Seq=10520 Ack=4484 Win=65535 Len=432
420   0.097299 41.177.3.224 -> 41.177.117.184 TCP 131 39924 > skytelnet [PSH, ACK] Seq=10952 Ack=4681 Win=65535 Len=73
429   0.098629 41.177.3.224 -> 41.177.117.184 TCP 521 39924 > skytelnet [PSH, ACK] Seq=11025 Ack=4703 Win=65535 Len=463
432   0.099330 41.177.3.224 -> 41.177.117.184 TCP 429 39924 > skytelnet [PSH, ACK] Seq=11488 Ack=5108 Win=65535 Len=371
434   0.099985 41.177.3.224 -> 41.177.117.184 TCP 784 39924 > skytelnet [PSH, ACK] Seq=11859 Ack=5505 Win=65535 Len=726
436   0.100492 41.177.3.224 -> 41.177.117.184 TCP 131 39924 > skytelnet [PSH, ACK] Seq=12585 Ack=5702 Win=65535 Len=73
438   0.101619 41.177.3.224 -> 41.177.117.184 TCP 420 39924 > skytelnet [PSH, ACK] Seq=12658 Ack=5724 Win=65535 Len=362
440   0.102269 41.177.3.224 -> 41.177.117.184 TCP 419 39924 > skytelnet [PSH, ACK] Seq=13020 Ack=5921 Win=65535 Len=361
442   0.102782 41.177.3.224 -> 41.177.117.184 TCP 131 39924 > skytelnet [PSH, ACK] Seq=13381 Ack=6118 Win=65535 Len=73
444   0.107540 41.177.3.224 -> 41.177.117.184 TCP 370 39924 > skytelnet [PSH, ACK] Seq=13454 Ack=6140 Win=65535 Len=312
446   0.108195 41.177.3.224 -> 41.177.117.184 TCP 131 39924 > skytelnet [PSH, ACK] Seq=13766 Ack=6337 Win=65535 Len=73
448   0.109257 41.177.3.224 -> 41.177.117.184 TCP 372 39924 > skytelnet [PSH, ACK] Seq=13839 Ack=6359 Win=65535 Len=314
450   0.109770 41.177.3.224 -> 41.177.117.184 TCP 131 39924 > skytelnet [PSH, ACK] Seq=14153 Ack=6556 Win=65535 Len=73
933   0.242709 41.177.3.224 -> 41.177.117.184 TCP 367 49020 > slm-api [PSH, ACK] Seq=1 Ack=1 Win=65535 Len=309
1160   0.302690 41.177.3.224 -> 41.177.117.184 TCP 64 49020 > slm-api [ACK] Seq=310 Ack=390 Win=65535 Len=0
1161   0.302695 41.177.3.224 -> 41.177.117.184 TCP 64 39924 > skytelnet [ACK] Seq=14226 Ack=6578 Win=65535 Len=0
1525   0.438370 41.177.3.224 -> 41.177.117.184 TCP 367 50327 > skytelnet [PSH, ACK] Seq=1 Ack=1 Win=65535 Len=309
1762   0.512678 41.177.3.224 -> 41.177.117.184 TCP 64 50327 > skytelnet [ACK] Seq=310 Ack=391 Win=65535 Len=0
4385   1.316952 41.177.3.224 -> 41.177.117.184 TCP 1062 40016 > stt [PSH, ACK] Seq=1 Ack=1 Win=65535 Len=1004
4399   1.318920 41.177.3.224 -> 41.177.117.184 TCP 1305 40016 > stt [PSH, ACK] Seq=1005 Ack=956 Win=65535 Len=1247
4401   1.319952 41.177.3.224 -> 41.177.117.184 TCP 683 40016 > stt [PSH, ACK] Seq=2252 Ack=1919 Win=65535 Len=625
4403   1.320785 41.177.3.224 -> 41.177.117.184 TCP 131 40016 > stt [PSH, ACK] Seq=2877 Ack=2116 Win=65535 Len=73
4405   1.321566 41.177.3.224 -> 41.177.117.184 TCP 708 40016 > stt [PSH, ACK] Seq=2950 Ack=2138 Win=65535 Len=650
4407   1.322546 41.177.3.224 -> 41.177.117.184 TCP 1057 40016 > stt [PSH, ACK] Seq=3600 Ack=2629 Win=65535 Len=999
4411   1.323469 41.177.3.224 -> 41.177.117.184 TCP 551 40016 > stt [PSH, ACK] Seq=4599 Ack=3120 Win=65535 Len=493
4415   1.325015 41.177.3.224 -> 41.177.117.184 TCP 1438 40016 > stt [ACK] Seq=5092 Ack=3459 Win=65535 Len=1380
4416   1.325020 41.177.3.224 -> 41.177.117.184 TCP 689 40016 > stt [PSH, ACK] Seq=6472 Ack=3459 Win=65535 Len=631
4417   1.325023 41.177.3.224 -> 41.177.117.184 TCP 702 40016 > stt [PSH, ACK] Seq=7103 Ack=3459 Win=65535 Len=644
4421   1.325847 41.177.3.224 -> 41.177.117.184 TCP 64 40016 > stt [ACK] Seq=7747 Ack=4839 Win=64860 Len=0
4422   1.325851 41.177.3.224 -> 41.177.117.184 TCP 64 40016 > stt [ACK] Seq=7747 Ack=5512 Win=64187 Len=0
5090   1.587043 41.177.3.224 -> 41.177.3.203 TCP 446 ea1 > 58381 [PSH, ACK] Seq=1 Ack=326 Win=65535 Len=388
6309   1.980645 41.177.3.224 -> 41.177.117.184 TCP 367 48741 > stt [PSH, ACK] Seq=1 Ack=1 Win=65535 Len=309
6315   1.982655 41.177.3.224 -> 41.177.117.184 TCP 64 48741 > stt [ACK] Seq=310 Ack=390 Win=65535 Len=0
6321   1.984685 41.177.3.224 -> 41.177.117.184 TCP 367 50412 > netbill-keyrep [PSH, ACK] Seq=1 Ack=1 Win=65535 Len=309
6447   2.082436 41.177.3.224 -> 41.177.117.184 TCP 367 51255 > slp [PSH, ACK] Seq=1 Ack=1 Win=65535 Len=309
6470   2.105295 41.177.3.224 -> 41.177.117.184 TCP 367 51281 > slp [PSH, ACK] Seq=1 Ack=1 Win=65535 Len=309
6707   2.192673 41.177.3.224 -> 41.177.117.184 TCP 64 50412 > netbill-keyrep [ACK] Seq=310 Ack=390 Win=65535 Len=0
6708   2.192678 41.177.3.224 -> 41.177.117.184 TCP 64 51255 > slp [ACK] Seq=310 Ack=391 Win=65535 Len=0
6709   2.192681 41.177.3.224 -> 41.177.117.184 TCP 64 51281 > slp [ACK] Seq=310 Ack=391 Win=65535 Len=0
6771   2.216821 41.177.3.224 -> 41.177.3.203 TCP 446 ea1 > 58386 [PSH, ACK] Seq=1 Ack=326 Win=65535 Len=388
6850   2.249378 41.177.3.224 -> 41.177.117.184 TCP 367 51349 > skytelnet [PSH, ACK] Seq=1 Ack=1 Win=65535 Len=309
6920   2.288559 41.177.3.224 -> 41.177.117.184 TCP 367 51334 > skytelnet [PSH, ACK] Seq=1 Ack=1 Win=65535 Len=309
7225   2.402666 41.177.3.224 -> 41.177.117.184 TCP 64 51334 > skytelnet [ACK] Seq=310 Ack=391 Win=65535 Len=0
7226   2.402671 41.177.3.224 -> 41.177.117.184 TCP 64 51349 > skytelnet [ACK] Seq=310 Ack=391 Win=65535 Len=0
8895   3.185994 41.177.3.224 -> 41.177.117.184 TCP 939 47468 > taurus-wh [PSH, ACK] Seq=1 Ack=1 Win=65535 Len=881
8907   3.187534 41.177.3.224 -> 41.177.117.184 TCP 1438 47468 > taurus-wh [ACK] Seq=882 Ack=881 Win=65535 Len=1380
8908   3.187538 41.177.3.224 -> 41.177.117.184 TCP 176 47468 > taurus-wh [PSH, ACK] Seq=2262 Ack=881 Win=65535 Len=118
8916   3.188487 41.177.3.224 -> 41.177.117.184 TCP 388 47468 > taurus-wh [PSH, ACK] Seq=2380 Ack=2663 Win=65535 Len=330
8919   3.189314 41.177.3.224 -> 41.177.117.184 TCP 736 47468 > taurus-wh [PSH, ACK] Seq=2710 Ack=2860 Win=65535 Len=678
8921   3.190146 41.177.3.224 -> 41.177.117.184 TCP 381 47468 > taurus-wh [PSH, ACK] Seq=3388 Ack=3806 Win=65535 Len=323
8923   3.190797 41.177.3.224 -> 41.177.117.184 TCP 482 47468 > taurus-wh [PSH, ACK] Seq=3711 Ack=4260 Win=65535 Len=424
8927   3.191471 41.177.3.224 -> 41.177.117.184 TCP 131 47468 > taurus-wh [PSH, ACK] Seq=4135 Ack=4457 Win=65535 Len=73
8934   3.192541 41.177.3.224 -> 41.177.117.184 TCP 367 47468 > taurus-wh [PSH, ACK] Seq=4208 Ack=4479 Win=65535 Len=309
9011   3.242645 41.177.3.224 -> 41.177.117.184 TCP 64 47468 > taurus-wh [ACK] Seq=4517 Ack=4868 Win=65535 Len=0
9199   3.330575 41.177.3.224 -> 41.177.3.203 TCP 446 ea1 > 36735 [PSH, ACK] Seq=1 Ack=349 Win=65535 Len=388
9209   3.332362 41.177.3.224 -> 41.177.3.203 TCP 522 ea1 > 36735 [PSH, ACK] Seq=389 Ack=815 Win=65535 Len=464
9212   3.333514 41.177.3.224 -> 41.177.3.203 TCP 447 ea1 > 36735 [PSH, ACK] Seq=853 Ack=1280 Win=65535 Len=389
9215   3.334374 41.177.3.224 -> 41.177.3.203 TCP 388 ea1 > 36735 [PSH, ACK] Seq=1242 Ack=1755 Win=65535 Len=330
9309   3.378453 41.177.3.224 -> 41.177.3.203 TCP 255 ea1 > 36735 [PSH, ACK] Seq=1572 Ack=2296 Win=65535 Len=197
9316   3.379815 41.177.3.224 -> 41.177.3.203 TCP 80 ea1 > 36735 [PSH, ACK] Seq=1769 Ack=2381 Win=65535 Len=22
9328   3.380948 41.177.3.224 -> 41.177.3.203 TCP 255 ea1 > 36735 [PSH, ACK] Seq=1791 Ack=2942 Win=65535 Len=197
9341   3.382033 41.177.3.224 -> 41.177.3.203 TCP 80 ea1 > 36735 [PSH, ACK] Seq=1988 Ack=3027 Win=65535 Len=22
9362   3.383566 41.177.3.224 -> 41.177.3.203 TCP 1013 ea1 > 36735 [PSH, ACK] Seq=2010 Ack=4047 Win=65535 Len=955
9381   3.385017 41.177.3.224 -> 41.177.3.203 TCP 1021 ea1 > 36735 [PSH, ACK] Seq=2965 Ack=5310 Win=65535 Len=963
9399   3.386375 41.177.3.224 -> 41.177.3.203 TCP 255 ea1 > 36735 [PSH, ACK] Seq=3928 Ack=5951 Win=65535 Len=197
9403   3.386830 41.177.3.224 -> 41.177.3.203 TCP 80 ea1 > 36735 [PSH, ACK] Seq=4125 Ack=6036 Win=65535 Len=22
9415   3.387936 41.177.3.224 -> 41.177.3.203 TCP 549 ea1 > 36735 [PSH, ACK] Seq=4147 Ack=6702 Win=65535 Len=491
9421   3.389031 41.177.3.224 -> 41.177.3.203 TCP 549 ea1 > 36735 [PSH, ACK] Seq=4638 Ack=7717 Win=65535 Len=491
9438   3.389825 41.177.3.224 -> 41.177.3.203 TCP 397 ea1 > 36735 [PSH, ACK] Seq=5129 Ack=8226 Win=65535 Len=339
9493   3.391712 41.177.3.224 -> 41.177.3.203 TCP 1518 ea1 > 36735 [ACK] Seq=5468 Ack=10897 Win=65535 Len=1460
9494   3.391717 41.177.3.224 -> 41.177.3.203 TCP 609 ea1 > 36735 [PSH, ACK] Seq=6928 Ack=10897 Win=65535 Len=551
9495   3.391721 41.177.3.224 -> 41.177.3.203 TCP 100 ea1 > 36735 [PSH, ACK] Seq=7479 Ack=10897 Win=65535 Len=42
9509   3.392077 41.177.3.224 -> 41.177.117.184 TCP 367 50396 > taurus-wh [PSH, ACK] Seq=1 Ack=1 Win=65535 Len=309
9806   3.449872 41.177.3.224 -> 41.177.117.184 TCP 367 51186 > slm-api [PSH, ACK] Seq=1 Ack=1 Win=65535 Len=309
9816   3.452657 41.177.3.224 -> 41.177.117.184 TCP 64 50396 > taurus-wh [ACK] Seq=310 Ack=390 Win=65535 Len=0
9817   3.452662 41.177.3.224 -> 41.177.117.184 TCP 64 51186 > slm-api [ACK] Seq=310 Ack=390 Win=65535 Len=0
10362   3.594216 41.177.3.224 -> 41.177.117.184 TCP 1062 40080 > taurus-wh [PSH, ACK] Seq=1 Ack=1 Win=65535 Len=1004
10364   3.595931 41.177.3.224 -> 41.177.117.184 TCP 1305 40080 > taurus-wh [PSH, ACK] Seq=1005 Ack=956 Win=65535 Len=1247
10366   3.596955 41.177.3.224 -> 41.177.117.184 TCP 683 40080 > taurus-wh [PSH, ACK] Seq=2252 Ack=1919 Win=65535 Len=625
10368   3.597701 41.177.3.224 -> 41.177.117.184 TCP 131 40080 > taurus-wh [PSH, ACK] Seq=2877 Ack=2116 Win=65535 Len=73
10372   3.598386 41.177.3.224 -> 41.177.117.184 TCP 708 40080 > taurus-wh [PSH, ACK] Seq=2950 Ack=2138 Win=65535 Len=650
10379   3.599259 41.177.3.224 -> 41.177.117.184 TCP 1057 40080 > taurus-wh [PSH, ACK] Seq=3600 Ack=2629 Win=65535 Len=999
10387   3.600153 41.177.3.224 -> 41.177.117.184 TCP 551 40080 > taurus-wh [PSH, ACK] Seq=4599 Ack=3120 Win=65535 Len=493
10397   3.601583 41.177.3.224 -> 41.177.117.184 TCP 1438 40080 > taurus-wh [ACK] Seq=5092 Ack=3459 Win=65535 Len=1380
10398   3.601588 41.177.3.224 -> 41.177.117.184 TCP 689 40080 > taurus-wh [PSH, ACK] Seq=6472 Ack=3459 Win=65535 Len=631
10399   3.601592 41.177.3.224 -> 41.177.117.184 TCP 702 40080 > taurus-wh [PSH, ACK] Seq=7103 Ack=3459 Win=65535 Len=644
10841   3.662638 41.177.3.224 -> 41.177.117.184 TCP 64 40080 > taurus-wh [ACK] Seq=7747 Ack=5512 Win=65535 Len=0
11309   3.684357 41.177.3.224 -> 41.177.117.184 TCP 367 51236 > netbill-keyrep [PSH, ACK] Seq=1 Ack=1 Win=65535 Len=309
13202   3.872639 41.177.3.224 -> 41.177.117.184 TCP 64 51236 > netbill-keyrep [ACK] Seq=310 Ack=390 Win=65535 Len=0
13258   3.908415 41.177.3.224 -> 41.177.117.184 TCP 367 51146 > slm-api [PSH, ACK] Seq=1 Ack=1 Win=65535 Len=309
13681   3.966436 41.177.3.224 -> 41.177.117.184 TCP 367 51211 > stt [PSH, ACK] Seq=1 Ack=1 Win=65535 Len=309
14160   4.005183 41.177.3.224 -> 41.177.117.184 TCP 367 38680 > stt [PSH, ACK] Seq=1 Ack=1 Win=65535 Len=309
14167   4.006475 41.177.3.224 -> 41.177.117.184 TCP 477 38680 > stt [PSH, ACK] Seq=310 Ack=390 Win=65535 Len=419
14177   4.007083 41.177.3.224 -> 41.177.117.184 TCP 454 38680 > stt [PSH, ACK] Seq=729 Ack=655 Win=65535 Len=396
14185   4.007822 41.177.3.224 -> 41.177.117.184 TCP 131 38680 > stt [PSH, ACK] Seq=1125 Ack=852 Win=65535 Len=73
14205   4.008998 41.177.3.224 -> 41.177.117.184 TCP 336 38680 > stt [PSH, ACK] Seq=1198 Ack=874 Win=65535 Len=278
14213   4.009875 41.177.3.224 -> 41.177.117.184 TCP 87 38680 > stt [PSH, ACK] Seq=1476 Ack=1168 Win=65535 Len=29
14335   4.082652 41.177.3.224 -> 41.177.117.184 TCP 64 51146 > slm-api [ACK] Seq=310 Ack=390 Win=65535 Len=0
14336   4.082657 41.177.3.224 -> 41.177.117.184 TCP 64 51211 > stt [ACK] Seq=310 Ack=390 Win=65535 Len=0
14337   4.082662 41.177.3.224 -> 41.177.117.184 TCP 64 38680 > stt [ACK] Seq=1505 Ack=1340 Win=65535 Len=0
16168   4.452764 41.177.3.224 -> 41.177.117.184 TCP 367 50382 > stt [PSH, ACK] Seq=1 Ack=1 Win=65535 Len=309
16412   4.484528 41.177.3.224 -> 41.177.117.184 TCP 367 50391 > taurus-wh [PSH, ACK] Seq=1 Ack=1 Win=65535 Len=309
16440   4.492636 41.177.3.224 -> 41.177.117.184 TCP 64 50391 > taurus-wh [ACK] Seq=310 Ack=390 Win=65535 Len=0
16441   4.492641 41.177.3.224 -> 41.177.117.184 TCP 64 50382 > stt [ACK] Seq=310 Ack=390 Win=65535 Len=0
17225   4.912626 41.177.3.224 -> 244.3.34.165 TCP 64 ssh > proofd [ACK] Seq=1 Ack=73 Win=65535 Len=0
17230   4.922712 41.177.3.224 -> 41.177.117.184 TCP 367 50371 > slp [PSH, ACK] Seq=1 Ack=1 Win=65535 Len=309
17467   5.122619 41.177.3.224 -> 41.177.117.184 TCP 64 50371 > slp [ACK] Seq=310 Ack=391 Win=65535 Len=0
17591   5.244298 41.177.3.224 -> 41.177.117.184 TCP 367 49020 > slm-api [PSH, ACK] Seq=310 Ack=390 Win=65535 Len=309
17694   5.332622 41.177.3.224 -> 41.177.117.184 TCP 64 49020 > slm-api [ACK] Seq=619 Ack=779 Win=65535 Len=0
17852   5.439823 41.177.3.224 -> 41.177.117.184 TCP 367 50327 > skytelnet [PSH, ACK] Seq=310 Ack=391 Win=65535 Len=309
18030   5.542621 41.177.3.224 -> 41.177.117.184 TCP 64 50327 > skytelnet [ACK] Seq=619 Ack=781 Win=65535 Len=0
20019   6.588536 41.177.3.224 -> 41.177.3.203 TCP 446 ea1 > 58381 [PSH, ACK] Seq=389 Ack=651 Win=65535 Len=388
20998   6.982213 41.177.3.224 -> 41.177.117.184 TCP 367 48741 > stt [PSH, ACK] Seq=310 Ack=390 Win=65535 Len=309
21006   6.986019 41.177.3.224 -> 41.177.117.184 TCP 367 50412 > netbill-keyrep [PSH, ACK] Seq=310 Ack=390 Win=65535 Len=309
21025   7.012606 41.177.3.224 -> 41.177.117.184 TCP 64 48741 > stt [ACK] Seq=619 Ack=779 Win=65535 Len=0
21026   7.012611 41.177.3.224 -> 41.177.117.184 TCP 64 50412 > netbill-keyrep [ACK] Seq=619 Ack=779 Win=65535 Len=0
21113   7.083815 41.177.3.224 -> 41.177.117.184 TCP 367 51255 > slp [PSH, ACK] Seq=310 Ack=391 Win=65535 Len=309
21133   7.106496 41.177.3.224 -> 41.177.117.184 TCP 367 51281 > slp [PSH, ACK] Seq=310 Ack=391 Win=65535 Len=309
21210   7.197668 41.177.3.224 -> 41.177.117.184 TCP 367 65162 > slm-api [PSH, ACK] Seq=1 Ack=1 Win=65535 Len=309
21212   7.198867 41.177.3.224 -> 41.177.117.184 TCP 473 65162 > slm-api [PSH, ACK] Seq=310 Ack=390 Win=65535 Len=415
21215   7.199499 41.177.3.224 -> 41.177.117.184 TCP 450 65162 > slm-api [PSH, ACK] Seq=725 Ack=655 Win=65535 Len=392
21217   7.200221 41.177.3.224 -> 41.177.117.184 TCP 131 65162 > slm-api [PSH, ACK] Seq=1117 Ack=852 Win=65535 Len=73
21219   7.203467 41.177.3.224 -> 41.177.117.184 TCP 336 65162 > slm-api [PSH, ACK] Seq=1190 Ack=874 Win=65535 Len=278
21223   7.206390 41.177.3.224 -> 41.177.117.184 TCP 87 65162 > slm-api [PSH, ACK] Seq=1468 Ack=1182 Win=65535 Len=29
21237   7.218913 41.177.3.224 -> 41.177.3.203 TCP 1518 ea1 > 58386 [ACK] Seq=389 Ack=1838 Win=65535 Len=1460
21238   7.218918 41.177.3.224 -> 41.177.3.203 TCP 609 ea1 > 58386 [PSH, ACK] Seq=1849 Ack=1838 Win=65535 Len=551
21239   7.218922 41.177.3.224 -> 41.177.3.203 TCP 69 ea1 > 58386 [PSH, ACK] Seq=2400 Ack=1838 Win=65535 Len=11
21240   7.222608 41.177.3.224 -> 41.177.117.184 TCP 64 51255 > slp [ACK] Seq=619 Ack=781 Win=65535 Len=0
21241   7.222612 41.177.3.224 -> 41.177.117.184 TCP 64 51281 > slp [ACK] Seq=619 Ack=781 Win=65535 Len=0
21242   7.222618 41.177.3.224 -> 41.177.117.184 TCP 64 65162 > slm-api [ACK] Seq=1497 Ack=1354 Win=65535 Len=0
21246   7.223399 41.177.3.224 -> 41.177.3.203 TCP 446 ea1 > 58386 [PSH, ACK] Seq=2411 Ack=2163 Win=65535 Len=388
21284   7.250690 41.177.3.224 -> 41.177.117.184 TCP 367 51349 > skytelnet [PSH, ACK] Seq=310 Ack=391 Win=65535 Len=309
21309   7.289716 41.177.3.224 -> 41.177.117.184 TCP 367 51334 > skytelnet [PSH, ACK] Seq=310 Ack=391 Win=65535 Len=309
21501   7.432602 41.177.3.224 -> 41.177.117.184 TCP 64 51334 > skytelnet [ACK] Seq=619 Ack=781 Win=65535 Len=0
21502   7.432607 41.177.3.224 -> 41.177.117.184 TCP 64 51349 > skytelnet [ACK] Seq=619 Ack=781 Win=65535 Len=0
21672   7.510941 41.177.3.224 -> 41.177.117.184 TCP 367 65161 > slm-api [PSH, ACK] Seq=1 Ack=1 Win=65535 Len=309
21676   7.512075 41.177.3.224 -> 41.177.117.184 TCP 475 65161 > slm-api [PSH, ACK] Seq=310 Ack=390 Win=65535 Len=417
21678   7.512666 41.177.3.224 -> 41.177.117.184 TCP 452 65161 > slm-api [PSH, ACK] Seq=727 Ack=655 Win=65535 Len=394
21684   7.513308 41.177.3.224 -> 41.177.117.184 TCP 131 65161 > slm-api [PSH, ACK] Seq=1121 Ack=852 Win=65535 Len=73
21691   7.516279 41.177.3.224 -> 41.177.117.184 TCP 367 40064 > taurus-wh [PSH, ACK] Seq=1 Ack=1 Win=65535 Len=309
21693   7.517300 41.177.3.224 -> 41.177.117.184 TCP 476 40064 > taurus-wh [PSH, ACK] Seq=310 Ack=390 Win=65535 Len=418
21695   7.517856 41.177.3.224 -> 41.177.117.184 TCP 453 40064 > taurus-wh [PSH, ACK] Seq=728 Ack=655 Win=65535 Len=395
21697   7.518379 41.177.3.224 -> 41.177.117.184 TCP 131 40064 > taurus-wh [PSH, ACK] Seq=1123 Ack=852 Win=65535 Len=73
21704   7.525500 41.177.3.224 -> 41.177.117.184 TCP 367 65167 > slm-api [PSH, ACK] Seq=1 Ack=1 Win=65535 Len=309
21705   7.525557 41.177.3.224 -> 41.177.117.184 TCP 367 65164 > slm-api [PSH, ACK] Seq=1 Ack=1 Win=65535 Len=309
21709   7.526629 41.177.3.224 -> 41.177.117.184 TCP 336 40064 > taurus-wh [PSH, ACK] Seq=1196 Ack=874 Win=65535 Len=278
21710   7.526708 41.177.3.224 -> 41.177.117.184 TCP 475 65167 > slm-api [PSH, ACK] Seq=310 Ack=390 Win=65535 Len=417
21711   7.526712 41.177.3.224 -> 41.177.117.184 TCP 473 65164 > slm-api [PSH, ACK] Seq=310 Ack=390 Win=65535 Len=415
21714   7.527287 41.177.3.224 -> 41.177.117.184 TCP 450 65164 > slm-api [PSH, ACK] Seq=725 Ack=655 Win=65535 Len=392
21716   7.527295 41.177.3.224 -> 41.177.117.184 TCP 452 65167 > slm-api [PSH, ACK] Seq=727 Ack=655 Win=65535 Len=394
21717   7.527359 41.177.3.224 -> 41.177.117.184 TCP 367 65168 > slm-api [PSH, ACK] Seq=1 Ack=1 Win=65535 Len=309
21718   7.527565 41.177.3.224 -> 41.177.117.184 TCP 87 40064 > taurus-wh [PSH, ACK] Seq=1474 Ack=1168 Win=65535 Len=29
21721   7.527885 41.177.3.224 -> 41.177.117.184 TCP 131 65164 > slm-api [PSH, ACK] Seq=1117 Ack=852 Win=65535 Len=73
21722   7.527890 41.177.3.224 -> 41.177.117.184 TCP 131 65167 > slm-api [PSH, ACK] Seq=1121 Ack=852 Win=65535 Len=73
21725   7.528496 41.177.3.224 -> 41.177.117.184 TCP 473 65168 > slm-api [PSH, ACK] Seq=310 Ack=390 Win=65535 Len=415
21727   7.529026 41.177.3.224 -> 41.177.117.184 TCP 450 65168 > slm-api [PSH, ACK] Seq=725 Ack=655 Win=65535 Len=392
21729   7.529460 41.177.3.224 -> 41.177.117.184 TCP 131 65168 > slm-api [PSH, ACK] Seq=1117 Ack=852 Win=65535 Len=73
21731   7.534787 41.177.3.224 -> 41.177.117.184 TCP 336 65161 > slm-api [PSH, ACK] Seq=1194 Ack=874 Win=65535 Len=278
21733   7.535533 41.177.3.224 -> 41.177.117.184 TCP 87 65161 > slm-api [PSH, ACK] Seq=1472 Ack=1175 Win=65535 Len=29
21739   7.538637 41.177.3.224 -> 41.177.117.184 TCP 336 65167 > slm-api [PSH, ACK] Seq=1194 Ack=874 Win=65535 Len=278
21740   7.538642 41.177.3.224 -> 41.177.117.184 TCP 336 65168 > slm-api [PSH, ACK] Seq=1190 Ack=874 Win=65535 Len=278
21741   7.538728 41.177.3.224 -> 41.177.117.184 TCP 336 65164 > slm-api [PSH, ACK] Seq=1190 Ack=874 Win=65535 Len=278
21745   7.539420 41.177.3.224 -> 41.177.117.184 TCP 87 65167 > slm-api [PSH, ACK] Seq=1472 Ack=1180 Win=65535 Len=29
21746   7.539424 41.177.3.224 -> 41.177.117.184 TCP 87 65168 > slm-api [PSH, ACK] Seq=1468 Ack=1175 Win=65535 Len=29
21747   7.539595 41.177.3.224 -> 41.177.117.184 TCP 87 65164 > slm-api [PSH, ACK] Seq=1468 Ack=1180 Win=65535 Len=29
21751   7.540142 41.177.3.224 -> 41.177.117.184 TCP 590 65168 > slm-api [PSH, ACK] Seq=1497 Ack=1347 Win=65535 Len=532
21754   7.546822 41.177.3.224 -> 41.177.117.184 TCP 367 40058 > taurus-wh [PSH, ACK] Seq=1 Ack=1 Win=65535 Len=309
21756   7.547782 41.177.3.224 -> 41.177.117.184 TCP 476 40058 > taurus-wh [PSH, ACK] Seq=310 Ack=390 Win=65535 Len=418
21758   7.548396 41.177.3.224 -> 41.177.117.184 TCP 453 40058 > taurus-wh [PSH, ACK] Seq=728 Ack=655 Win=65535 Len=395
21760   7.548934 41.177.3.224 -> 41.177.117.184 TCP 131 40058 > taurus-wh [PSH, ACK] Seq=1123 Ack=852 Win=65535 Len=73
21772   7.556232 41.177.3.224 -> 41.177.117.184 TCP 336 40058 > taurus-wh [PSH, ACK] Seq=1196 Ack=874 Win=65535 Len=278
21774   7.556991 41.177.3.224 -> 41.177.117.184 TCP 87 40058 > taurus-wh [PSH, ACK] Seq=1474 Ack=1179 Win=65535 Len=29
21778   7.557693 41.177.3.224 -> 41.177.117.184 TCP 590 40058 > taurus-wh [PSH, ACK] Seq=1503 Ack=1351 Win=65535 Len=532
21822   7.596003 41.177.3.224 -> 41.177.117.184 TCP 367 51305 > slp [PSH, ACK] Seq=1 Ack=1 Win=65535 Len=309
21824   7.597003 41.177.3.224 -> 41.177.117.184 TCP 475 51305 > slp [PSH, ACK] Seq=310 Ack=391 Win=65535 Len=417
21826   7.597512 41.177.3.224 -> 41.177.117.184 TCP 452 51305 > slp [PSH, ACK] Seq=727 Ack=656 Win=65535 Len=394
21828   7.598149 41.177.3.224 -> 41.177.117.184 TCP 131 51305 > slp [PSH, ACK] Seq=1121 Ack=853 Win=65535 Len=73
21838   7.607335 41.177.3.224 -> 41.177.117.184 TCP 336 51305 > slp [PSH, ACK] Seq=1194 Ack=875 Win=65535 Len=278
21840   7.607999 41.177.3.224 -> 41.177.117.184 TCP 87 51305 > slp [PSH, ACK] Seq=1472 Ack=1183 Win=65535 Len=29
21868   7.638110 41.177.3.224 -> 41.177.117.184 TCP 367 51374 > skytelnet [PSH, ACK] Seq=1 Ack=1 Win=65535 Len=309
21870   7.639207 41.177.3.224 -> 41.177.117.184 TCP 476 51374 > skytelnet [PSH, ACK] Seq=310 Ack=391 Win=65535 Len=418
21872   7.639749 41.177.3.224 -> 41.177.117.184 TCP 453 51374 > skytelnet [PSH, ACK] Seq=728 Ack=656 Win=65535 Len=395
21874   7.640379 41.177.3.224 -> 41.177.117.184 TCP 131 51374 > skytelnet [PSH, ACK] Seq=1123 Ack=853 Win=65535 Len=73
21876   7.641834 41.177.3.224 -> 41.177.117.184 TCP 336 51374 > skytelnet [PSH, ACK] Seq=1196 Ack=875 Win=65535 Len=278
21878   7.642589 41.177.3.224 -> 41.177.117.184 TCP 64 51305 > slp [ACK] Seq=1501 Ack=1355 Win=65535 Len=0
21879   7.642593 41.177.3.224 -> 41.177.117.184 TCP 64 51374 > skytelnet [ACK] Seq=1474 Ack=1172 Win=65535 Len=0
21880   7.642597 41.177.3.224 -> 41.177.117.184 TCP 64 40064 > taurus-wh [ACK] Seq=1503 Ack=1340 Win=65535 Len=0
21881   7.642601 41.177.3.224 -> 41.177.117.184 TCP 64 40058 > taurus-wh [ACK] Seq=2035 Ack=1971 Win=65535 Len=0
21882   7.642605 41.177.3.224 -> 41.177.117.184 TCP 64 65168 > slm-api [ACK] Seq=2029 Ack=1967 Win=65535 Len=0
21883   7.642632 41.177.3.224 -> 41.177.117.184 TCP 64 65167 > slm-api [ACK] Seq=1501 Ack=1352 Win=65535 Len=0
21884   7.642636 41.177.3.224 -> 41.177.117.184 TCP 87 51374 > skytelnet [PSH, ACK] Seq=1474 Ack=1172 Win=65535 Len=29
21885   7.642640 41.177.3.224 -> 41.177.117.184 TCP 64 65164 > slm-api [ACK] Seq=1497 Ack=1352 Win=65535 Len=0
21886   7.642645 41.177.3.224 -> 41.177.117.184 TCP 64 65161 > slm-api [ACK] Seq=1501 Ack=1347 Win=65535 Len=0
22126   7.777728 41.177.3.224 -> 41.177.117.184 TCP 367 65163 > slm-api [PSH, ACK] Seq=1 Ack=1 Win=65535 Len=309
22129   7.778809 41.177.3.224 -> 41.177.117.184 TCP 475 65163 > slm-api [PSH, ACK] Seq=310 Ack=390 Win=65535 Len=417
22131   7.779410 41.177.3.224 -> 41.177.117.184 TCP 452 65163 > slm-api [PSH, ACK] Seq=727 Ack=655 Win=65535 Len=394
22134   7.780246 41.177.3.224 -> 41.177.117.184 TCP 131 65163 > slm-api [PSH, ACK] Seq=1121 Ack=852 Win=65535 Len=73
22145   7.786927 41.177.3.224 -> 41.177.117.184 TCP 336 65163 > slm-api [PSH, ACK] Seq=1194 Ack=874 Win=65535 Len=278
22148   7.789193 41.177.3.224 -> 41.177.117.184 TCP 87 65163 > slm-api [PSH, ACK] Seq=1472 Ack=1182 Win=65535 Len=29
22239   7.852596 41.177.3.224 -> 41.177.117.184 TCP 64 51374 > skytelnet [ACK] Seq=1503 Ack=1344 Win=65535 Len=0
22240   7.852601 41.177.3.224 -> 41.177.117.184 TCP 64 65163 > slm-api [ACK] Seq=1501 Ack=1354 Win=65535 Len=0
22621   8.072550 41.177.3.224 -> 41.177.117.184 TCP 367 38682 > stt [PSH, ACK] Seq=1 Ack=1 Win=65535 Len=309
22623   8.073640 41.177.3.224 -> 41.177.117.184 TCP 477 38682 > stt [PSH, ACK] Seq=310 Ack=390 Win=65535 Len=419
22625   8.074226 41.177.3.224 -> 41.177.117.184 TCP 454 38682 > stt [PSH, ACK] Seq=729 Ack=655 Win=65535 Len=396
22635   8.074866 41.177.3.224 -> 41.177.117.184 TCP 131 38682 > stt [PSH, ACK] Seq=1125 Ack=852 Win=65535 Len=73
22637   8.076928 41.177.3.224 -> 41.177.117.184 TCP 336 38682 > stt [PSH, ACK] Seq=1198 Ack=874 Win=65535 Len=278
22643   8.077615 41.177.3.224 -> 41.177.117.184 TCP 87 38682 > stt [PSH, ACK] Seq=1476 Ack=1179 Win=65535 Len=29
22645   8.078326 41.177.3.224 -> 41.177.117.184 TCP 590 38682 > stt [PSH, ACK] Seq=1505 Ack=1351 Win=65535 Len=532
22812   8.193582 41.177.3.224 -> 41.177.117.184 TCP 367 47468 > taurus-wh [PSH, ACK] Seq=4517 Ack=4868 Win=65535 Len=309
22906   8.272591 41.177.3.224 -> 41.177.117.184 TCP 64 47468 > taurus-wh [ACK] Seq=4826 Ack=5257 Win=65535 Len=0
22907   8.272596 41.177.3.224 -> 41.177.117.184 TCP 64 38682 > stt [ACK] Seq=2037 Ack=1971 Win=65535 Len=0
23148   8.393506 41.177.3.224 -> 41.177.117.184 TCP 367 50396 > taurus-wh [PSH, ACK] Seq=310 Ack=390 Win=65535 Len=309
23253   8.451287 41.177.3.224 -> 41.177.117.184 TCP 367 51186 > slm-api [PSH, ACK] Seq=310 Ack=390 Win=65535 Len=309
23307   8.482589 41.177.3.224 -> 41.177.117.184 TCP 64 50396 > taurus-wh [ACK] Seq=619 Ack=779 Win=65535 Len=0
23308   8.482593 41.177.3.224 -> 41.177.117.184 TCP 64 51186 > slm-api [ACK] Seq=619 Ack=779 Win=65535 Len=0
23561   8.559730 41.177.3.224 -> 41.177.117.184 TCP 367 38681 > stt [PSH, ACK] Seq=1 Ack=1 Win=65535 Len=309
23563   8.560712 41.177.3.224 -> 41.177.117.184 TCP 477 38681 > stt [PSH, ACK] Seq=310 Ack=390 Win=65535 Len=419
23565   8.561249 41.177.3.224 -> 41.177.117.184 TCP 454 38681 > stt [PSH, ACK] Seq=729 Ack=655 Win=65535 Len=396
23567   8.561951 41.177.3.224 -> 41.177.117.184 TCP 131 38681 > stt [PSH, ACK] Seq=1125 Ack=852 Win=65535 Len=73
23574   8.563260 41.177.3.224 -> 41.177.117.184 TCP 336 38681 > stt [PSH, ACK] Seq=1198 Ack=874 Win=65535 Len=278
23578   8.564123 41.177.3.224 -> 41.177.117.184 TCP 87 38681 > stt [PSH, ACK] Seq=1476 Ack=1168 Win=65535 Len=29
23734   8.685594 41.177.3.224 -> 41.177.117.184 TCP 367 51236 > netbill-keyrep [PSH, ACK] Seq=310 Ack=390 Win=65535 Len=309
23752   8.692577 41.177.3.224 -> 41.177.117.184 TCP 64 51236 > netbill-keyrep [ACK] Seq=619 Ack=779 Win=65535 Len=0
23753   8.692582 41.177.3.224 -> 41.177.117.184 TCP 64 38681 > stt [ACK] Seq=1505 Ack=1340 Win=65535 Len=0
24052   8.822113 41.177.3.224 -> 41.177.117.184 TCP 390 39054 > slm-api [PSH, ACK] Seq=1 Ack=1 Win=65535 Len=332
24057   8.824106 41.177.3.224 -> 41.177.117.184 TCP 508 39054 > slm-api [PSH, ACK] Seq=333 Ack=390 Win=65535 Len=450
24059   8.824931 41.177.3.224 -> 41.177.117.184 TCP 507 39054 > slm-api [PSH, ACK] Seq=783 Ack=854 Win=65535 Len=449
24061   8.825999 41.177.3.224 -> 41.177.117.184 TCP 517 39054 > slm-api [PSH, ACK] Seq=1232 Ack=1243 Win=65535 Len=459
24091   8.882835 41.177.3.224 -> 41.177.117.184 TCP 585 39054 > slm-api [PSH, ACK] Seq=1691 Ack=1573 Win=65535 Len=527
24093   8.883690 41.177.3.224 -> 41.177.117.184 TCP 131 39054 > slm-api [PSH, ACK] Seq=2218 Ack=1770 Win=65535 Len=73
24095   8.886644 41.177.3.224 -> 41.177.117.184 TCP 631 39054 > slm-api [PSH, ACK] Seq=2291 Ack=1792 Win=65535 Len=573
24097   8.887861 41.177.3.224 -> 41.177.117.184 TCP 605 39054 > slm-api [PSH, ACK] Seq=2864 Ack=2527 Win=65535 Len=547
24099   8.888432 41.177.3.224 -> 41.177.117.184 TCP 131 39054 > slm-api [PSH, ACK] Seq=3411 Ack=2724 Win=65535 Len=73
24104   8.890167 41.177.3.224 -> 41.177.117.184 TCP 1062 39054 > slm-api [PSH, ACK] Seq=3484 Ack=2746 Win=65535 Len=1004
24116   8.907582 41.177.3.224 -> 41.177.117.184 TCP 1305 39054 > slm-api [PSH, ACK] Seq=4488 Ack=3701 Win=65535 Len=1247
24121   8.910042 41.177.3.224 -> 41.177.117.184 TCP 367 51146 > slm-api [PSH, ACK] Seq=310 Ack=390 Win=65535 Len=309
24124   8.912230 41.177.3.224 -> 41.177.117.184 TCP 683 39054 > slm-api [PSH, ACK] Seq=5735 Ack=4664 Win=65535 Len=625
24126   8.913002 41.177.3.224 -> 41.177.117.184 TCP 131 39054 > slm-api [PSH, ACK] Seq=6360 Ack=4861 Win=65535 Len=73
24128   8.913964 41.177.3.224 -> 41.177.117.184 TCP 708 39054 > slm-api [PSH, ACK] Seq=6433 Ack=4883 Win=65535 Len=650
24130   8.914908 41.177.3.224 -> 41.177.117.184 TCP 1057 39054 > slm-api [PSH, ACK] Seq=7083 Ack=5374 Win=65535 Len=999
24134   8.915740 41.177.3.224 -> 41.177.117.184 TCP 551 39054 > slm-api [PSH, ACK] Seq=8082 Ack=5865 Win=65535 Len=493
24136   8.917334 41.177.3.224 -> 41.177.117.184 TCP 1438 39054 > slm-api [ACK] Seq=8575 Ack=6204 Win=65535 Len=1380
24137   8.917338 41.177.3.224 -> 41.177.117.184 TCP 689 39054 > slm-api [PSH, ACK] Seq=9955 Ack=6204 Win=65535 Len=631
24138   8.917342 41.177.3.224 -> 41.177.117.184 TCP 702 39054 > slm-api [PSH, ACK] Seq=10586 Ack=6204 Win=65535 Len=644
24170   8.967924 41.177.3.224 -> 41.177.117.184 TCP 367 51211 > stt [PSH, ACK] Seq=310 Ack=390 Win=65535 Len=309
24284   9.112592 41.177.3.224 -> 41.177.117.184 TCP 64 51146 > slm-api [ACK] Seq=619 Ack=779 Win=65535 Len=0
24285   9.112597 41.177.3.224 -> 41.177.117.184 TCP 64 51211 > stt [ACK] Seq=619 Ack=779 Win=65535 Len=0
24286   9.112601 41.177.3.224 -> 41.177.117.184 TCP 64 39054 > slm-api [ACK] Seq=11230 Ack=8257 Win=65535 Len=0
24827   9.454186 41.177.3.224 -> 41.177.117.184 TCP 367 50382 > stt [PSH, ACK] Seq=310 Ack=390 Win=65535 Len=309
24876   9.486112 41.177.3.224 -> 41.177.117.184 TCP 367 50391 > taurus-wh [PSH, ACK] Seq=310 Ack=390 Win=65535 Len=309
24993   9.532578 41.177.3.224 -> 41.177.117.184 TCP 64 50391 > taurus-wh [ACK] Seq=619 Ack=779 Win=65535 Len=0
24994   9.532583 41.177.3.224 -> 41.177.117.184 TCP 64 50382 > stt [ACK] Seq=619 Ack=779 Win=65535 Len=0
25642   9.924233 41.177.3.224 -> 41.177.117.184 TCP 367 50371 > slp [PSH, ACK] Seq=310 Ack=391 Win=65535 Len=309
25748   9.952560 41.177.3.224 -> 41.177.117.184 TCP 64 50371 > slp [ACK] Seq=619 Ack=781 Win=65535 Len=0
25843  10.031465 41.177.3.224 -> 41.177.117.184 TCP 367 51312 > slp [PSH, ACK] Seq=1 Ack=1 Win=65535 Len=309
25845  10.032560 41.177.3.224 -> 41.177.117.184 TCP 477 51312 > slp [PSH, ACK] Seq=310 Ack=391 Win=65535 Len=419
25847  10.033084 41.177.3.224 -> 41.177.117.184 TCP 454 51312 > slp [PSH, ACK] Seq=729 Ack=656 Win=65535 Len=396
25849  10.033723 41.177.3.224 -> 41.177.117.184 TCP 131 51312 > slp [PSH, ACK] Seq=1125 Ack=853 Win=65535 Len=73
25852  10.034872 41.177.3.224 -> 41.177.117.184 TCP 336 51312 > slp [PSH, ACK] Seq=1198 Ack=875 Win=65535 Len=278
25856  10.035657 41.177.3.224 -> 41.177.117.184 TCP 87 51312 > slp [PSH, ACK] Seq=1476 Ack=1181 Win=65535 Len=29
26064  10.162558 41.177.3.224 -> 41.177.117.184 TCP 64 51312 > slp [ACK] Seq=1505 Ack=1353 Win=65535 Len=0
26126  10.210480 41.177.3.224 -> 41.177.117.184 TCP 367 65238 > netbill-keyrep [PSH, ACK] Seq=1 Ack=1 Win=65535 Len=309
26128  10.211672 41.177.3.224 -> 41.177.117.184 TCP 471 65238 > netbill-keyrep [PSH, ACK] Seq=310 Ack=390 Win=65535 Len=413
26130  10.212283 41.177.3.224 -> 41.177.117.184 TCP 318 65238 > netbill-keyrep [PSH, ACK] Seq=723 Ack=656 Win=65535 Len=260
26132  10.213009 41.177.3.224 -> 41.177.117.184 TCP 367 65238 > netbill-keyrep [PSH, ACK] Seq=983 Ack=863 Win=65535 Len=309
26136  10.213972 41.177.3.224 -> 41.177.117.184 TCP 471 65238 > netbill-keyrep [PSH, ACK] Seq=1292 Ack=1252 Win=65535 Len=413
26138  10.214462 41.177.3.224 -> 41.177.117.184 TCP 318 65238 > netbill-keyrep [PSH, ACK] Seq=1705 Ack=1518 Win=65535 Len=260
26140  10.215132 41.177.3.224 -> 41.177.117.184 TCP 367 65238 > netbill-keyrep [PSH, ACK] Seq=1965 Ack=1725 Win=65535 Len=309
26143  10.215775 41.177.3.224 -> 41.177.117.184 TCP 471 65238 > netbill-keyrep [PSH, ACK] Seq=2274 Ack=2114 Win=65535 Len=413
26145  10.216248 41.177.3.224 -> 41.177.117.184 TCP 318 65238 > netbill-keyrep [PSH, ACK] Seq=2687 Ack=2380 Win=65535 Len=260
26147  10.216971 41.177.3.224 -> 41.177.117.184 TCP 590 65238 > netbill-keyrep [PSH, ACK] Seq=2947 Ack=2587 Win=65535 Len=532
26213  10.245586 41.177.3.224 -> 41.177.117.184 TCP 367 49020 > slm-api [PSH, ACK] Seq=619 Ack=779 Win=65535 Len=309
26419  10.372567 41.177.3.224 -> 41.177.117.184 TCP 64 49020 > slm-api [ACK] Seq=928 Ack=1168 Win=65535 Len=0
26420  10.372572 41.177.3.224 -> 41.177.117.184 TCP 64 65238 > netbill-keyrep [ACK] Seq=3479 Ack=3207 Win=65535 Len=0
26598  10.441295 41.177.3.224 -> 41.177.117.184 TCP 367 50327 > skytelnet [PSH, ACK] Seq=619 Ack=781 Win=65535 Len=309
26600  10.442445 41.177.3.224 -> 41.177.117.184 TCP 367 51306 > slp [PSH, ACK] Seq=1 Ack=1 Win=65535 Len=309
26601  10.442506 41.177.3.224 -> 41.177.117.184 TCP 367 51307 > slp [PSH, ACK] Seq=1 Ack=1 Win=65535 Len=309
26605  10.443462 41.177.3.224 -> 41.177.117.184 TCP 477 51306 > slp [PSH, ACK] Seq=310 Ack=391 Win=65535 Len=419
26606  10.443627 41.177.3.224 -> 41.177.117.184 TCP 477 51307 > slp [PSH, ACK] Seq=310 Ack=391 Win=65535 Len=419
26608  10.444081 41.177.3.224 -> 41.177.117.184 TCP 454 51306 > slp [PSH, ACK] Seq=729 Ack=656 Win=65535 Len=396
26611  10.444831 41.177.3.224 -> 41.177.117.184 TCP 131 51306 > slp [PSH, ACK] Seq=1125 Ack=853 Win=65535 Len=73
26612  10.444991 41.177.3.224 -> 41.177.117.184 TCP 454 51307 > slp [PSH, ACK] Seq=729 Ack=656 Win=65535 Len=396
26614  10.445619 41.177.3.224 -> 41.177.117.184 TCP 131 51307 > slp [PSH, ACK] Seq=1125 Ack=853 Win=65535 Len=73
26616  10.446680 41.177.3.224 -> 41.177.117.184 TCP 336 51306 > slp [PSH, ACK] Seq=1198 Ack=875 Win=65535 Len=278
26618  10.447484 41.177.3.224 -> 41.177.117.184 TCP 87 51306 > slp [PSH, ACK] Seq=1476 Ack=1176 Win=65535 Len=29
26620  10.447973 41.177.3.224 -> 41.177.117.184 TCP 336 51307 > slp [PSH, ACK] Seq=1198 Ack=875 Win=65535 Len=278
26628  10.448661 41.177.3.224 -> 41.177.117.184 TCP 87 51307 > slp [PSH, ACK] Seq=1476 Ack=1183 Win=65535 Len=29
26830  10.582565 41.177.3.224 -> 41.177.117.184 TCP 64 50327 > skytelnet [ACK] Seq=928 Ack=1171 Win=65535 Len=0
26831  10.582570 41.177.3.224 -> 41.177.117.184 TCP 64 51307 > slp [ACK] Seq=1505 Ack=1355 Win=65535 Len=0
26832  10.582574 41.177.3.224 -> 41.177.117.184 TCP 64 51306 > slp [ACK] Seq=1505 Ack=1435 Win=65535 Len=0
28345  11.429340 41.177.3.224 -> 41.177.117.184 TCP 1062 40118 > netbill-keyrep [PSH, ACK] Seq=1 Ack=1 Win=65535 Len=1004
28349  11.431284 41.177.3.224 -> 41.177.117.184 TCP 1305 40118 > netbill-keyrep [PSH, ACK] Seq=1005 Ack=956 Win=65535 Len=1247
28358  11.433895 41.177.3.224 -> 41.177.117.184 TCP 683 40118 > netbill-keyrep [PSH, ACK] Seq=2252 Ack=1919 Win=65535 Len=625
28376  11.434585 41.177.3.224 -> 41.177.117.184 TCP 131 40118 > netbill-keyrep [PSH, ACK] Seq=2877 Ack=2116 Win=65535 Len=73
28378  11.435291 41.177.3.224 -> 41.177.117.184 TCP 708 40118 > netbill-keyrep [PSH, ACK] Seq=2950 Ack=2138 Win=65535 Len=650
28380  11.436279 41.177.3.224 -> 41.177.117.184 TCP 1057 40118 > netbill-keyrep [PSH, ACK] Seq=3600 Ack=2629 Win=65535 Len=999
28384  11.437148 41.177.3.224 -> 41.177.117.184 TCP 551 40118 > netbill-keyrep [PSH, ACK] Seq=4599 Ack=3120 Win=65535 Len=493
28386  11.438656 41.177.3.224 -> 41.177.117.184 TCP 1438 40118 > netbill-keyrep [ACK] Seq=5092 Ack=3459 Win=65535 Len=1380
28387  11.438660 41.177.3.224 -> 41.177.117.184 TCP 689 40118 > netbill-keyrep [PSH, ACK] Seq=6472 Ack=3459 Win=65535 Len=631
28388  11.438664 41.177.3.224 -> 41.177.117.184 TCP 702 40118 > netbill-keyrep [PSH, ACK] Seq=7103 Ack=3459 Win=65535 Len=644
28396  11.440266 41.177.3.224 -> 41.177.117.184 TCP 64 40118 > netbill-keyrep [ACK] Seq=7747 Ack=4839 Win=64860 Len=0
28397  11.440270 41.177.3.224 -> 41.177.117.184 TCP 64 40118 > netbill-keyrep [ACK] Seq=7747 Ack=5512 Win=64187 Len=0
28635  11.570440 41.177.3.224 -> 41.177.117.184 TCP 367 51373 > skytelnet [PSH, ACK] Seq=1 Ack=1 Win=65535 Len=309
28637  11.571612 41.177.3.224 -> 41.177.117.184 TCP 476 51373 > skytelnet [PSH, ACK] Seq=310 Ack=391 Win=65535 Len=418
28639  11.572224 41.177.3.224 -> 41.177.117.184 TCP 453 51373 > skytelnet [PSH, ACK] Seq=728 Ack=656 Win=65535 Len=395
28641  11.572875 41.177.3.224 -> 41.177.117.184 TCP 131 51373 > skytelnet [PSH, ACK] Seq=1123 Ack=853 Win=65535 Len=73
28643  11.574234 41.177.3.224 -> 41.177.117.184 TCP 336 51373 > skytelnet [PSH, ACK] Seq=1196 Ack=875 Win=65535 Len=278
28645  11.575173 41.177.3.224 -> 41.177.117.184 TCP 87 51373 > skytelnet [PSH, ACK] Seq=1474 Ack=1167 Win=65535 Len=29
28650  11.575932 41.177.3.224 -> 41.177.117.184 TCP 590 51373 > skytelnet [PSH, ACK] Seq=1503 Ack=1339 Win=65535 Len=532
28663  11.590477 41.177.3.224 -> 41.177.3.203 TCP 938 ea1 > 58381 [PSH, ACK] Seq=777 Ack=1545 Win=65535 Len=880
28673  11.591805 41.177.3.224 -> 41.177.3.203 TCP 1518 ea1 > 58381 [ACK] Seq=1657 Ack=3057 Win=65535 Len=1460
28674  11.591810 41.177.3.224 -> 41.177.3.203 TCP 609 ea1 > 58381 [PSH, ACK] Seq=3117 Ack=3057 Win=65535 Len=551
