143990  49.449244 41.177.230.67 -> 244.3.160.239 TCP 66 http > 33632 [SYN, ACK] Seq=0 Ack=1 Win=33120 Len=0 SACK_PERM=1 MSS=1380
143996  49.450445 41.177.230.67 -> 244.3.160.239 TCP 64 http > 33632 [ACK] Seq=1 Ack=929 Win=33120 Len=0
146710  50.350602 41.177.230.67 -> 244.3.160.239 TCP 64 http > 33632 [ACK] Seq=4457 Ack=930 Win=33120 Len=0
146711  50.350698 41.177.230.67 -> 244.3.160.239 TCP 64 http > 33632 [FIN, ACK] Seq=4457 Ack=930 Win=33120 Len=0
171349  56.885700 41.177.230.67 -> 244.3.160.239 TCP 66 http > 33747 [SYN, ACK] Seq=0 Ack=1 Win=33120 Len=0 SACK_PERM=1 MSS=1380
171360  56.887007 41.177.230.67 -> 244.3.160.239 TCP 64 http > 33747 [ACK] Seq=1 Ack=955 Win=33120 Len=0
171361  56.887011 41.177.230.67 -> 244.3.160.239 TCP 64 http > 33747 [ACK] Seq=1 Ack=1254 Win=33120 Len=0
172107  57.327719 41.177.230.67 -> 244.3.160.239 TCP 64 http > 33747 [ACK] Seq=15473 Ack=1255 Win=33120 Len=0
172108  57.327724 41.177.230.67 -> 244.3.160.239 TCP 64 http > 33747 [FIN, ACK] Seq=15473 Ack=1255 Win=33120 Len=0
184764  62.085930 41.177.230.67 -> 244.3.160.239 TCP 66 http > 33779 [SYN, ACK] Seq=0 Ack=1 Win=33120 Len=0 SACK_PERM=1 MSS=1380
184767  62.087109 41.177.230.67 -> 244.3.160.239 TCP 64 http > 33779 [ACK] Seq=1 Ack=928 Win=33120 Len=0
186182  62.443016 41.177.230.67 -> 244.3.160.239 TCP 64 http > 33779 [ACK] Seq=4490 Ack=929 Win=33120 Len=0
186183  62.443333 41.177.230.67 -> 244.3.160.239 TCP 64 http > 33779 [FIN, ACK] Seq=4490 Ack=929 Win=33120 Len=0
201303  69.453446 41.177.230.67 -> 244.3.160.239 TCP 66 http > 33893 [SYN, ACK] Seq=0 Ack=1 Win=33120 Len=0 SACK_PERM=1 MSS=1380
201318  69.454869 41.177.230.67 -> 244.3.160.239 TCP 64 http > 33893 [ACK] Seq=1 Ack=955 Win=33120 Len=0
201319  69.455892 41.177.230.67 -> 244.3.160.239 TCP 64 http > 33893 [ACK] Seq=1 Ack=1254 Win=33120 Len=0
202572  69.904809 41.177.230.67 -> 244.3.160.239 TCP 75 [TCP segment of a reassembled PDU]
202594  69.913879 41.177.230.67 -> 244.3.160.239 TCP 64 http > 33893 [ACK] Seq=13151 Ack=1255 Win=33120 Len=0
202595  69.913884 41.177.230.67 -> 244.3.160.239 TCP 64 http > 33893 [FIN, ACK] Seq=13151 Ack=1255 Win=33120 Len=0
214767  73.703591 41.177.230.67 -> 244.3.160.239 TCP 66 http > 33923 [SYN, ACK] Seq=0 Ack=1 Win=33120 Len=0 SACK_PERM=1 MSS=1380
214772  73.704730 41.177.230.67 -> 244.3.160.239 TCP 64 http > 33923 [ACK] Seq=1 Ack=929 Win=33120 Len=0
215761  74.063114 41.177.230.67 -> 244.3.160.239 TCP 64 http > 33923 [ACK] Seq=4517 Ack=930 Win=33120 Len=0
215762  74.063119 41.177.230.67 -> 244.3.160.239 TCP 64 http > 33923 [FIN, ACK] Seq=4517 Ack=930 Win=33120 Len=0
235288  81.993663 41.177.230.67 -> 244.3.160.239 TCP 66 http > 33972 [SYN, ACK] Seq=0 Ack=1 Win=33120 Len=0 SACK_PERM=1 MSS=1380
235295  81.994846 41.177.230.67 -> 244.3.160.239 TCP 64 http > 33972 [ACK] Seq=1 Ack=940 Win=33120 Len=0
235296  81.994850 41.177.230.67 -> 244.3.160.239 TCP 64 http > 33972 [ACK] Seq=1 Ack=1264 Win=33120 Len=0
236600  82.341324 41.177.230.67 -> 244.3.160.239 TCP 64 http > 33972 [ACK] Seq=7398 Ack=1265 Win=33120 Len=0
236601  82.341347 41.177.230.67 -> 244.3.160.239 TCP 64 http > 33972 [FIN, ACK] Seq=7398 Ack=1265 Win=33120 Len=0
241010  83.790108 41.177.230.67 -> 244.3.160.239 TCP 66 http > 33977 [SYN, ACK] Seq=0 Ack=1 Win=33120 Len=0 SACK_PERM=1 MSS=1380
241019  83.791489 41.177.230.67 -> 244.3.160.239 TCP 64 http > 33977 [ACK] Seq=1 Ack=945 Win=33120 Len=0
241020  83.791494 41.177.230.67 -> 244.3.160.239 TCP 64 http > 33977 [ACK] Seq=1 Ack=1269 Win=33120 Len=0
241732  84.235603 41.177.230.67 -> 244.3.160.239 TCP 75 [TCP segment of a reassembled PDU]
241801  84.245141 41.177.230.67 -> 244.3.160.239 TCP 64 http > 33977 [ACK] Seq=12904 Ack=1270 Win=33120 Len=0
241802  84.245184 41.177.230.67 -> 244.3.160.239 TCP 64 http > 33977 [FIN, ACK] Seq=12904 Ack=1270 Win=33120 Len=0
249698  88.087279 41.177.230.67 -> 244.3.160.239 TCP 66 http > 34015 [SYN, ACK] Seq=0 Ack=1 Win=33120 Len=0 SACK_PERM=1 MSS=1380
249725  88.088528 41.177.230.67 -> 244.3.160.239 TCP 64 http > 34015 [ACK] Seq=1 Ack=927 Win=33120 Len=0
250579  88.436773 41.177.230.67 -> 244.3.160.239 TCP 64 http > 34015 [ACK] Seq=4452 Ack=928 Win=33120 Len=0
250580  88.436880 41.177.230.67 -> 244.3.160.239 TCP 64 http > 34015 [FIN, ACK] Seq=4452 Ack=928 Win=33120 Len=0
266404  92.023856 41.177.230.67 -> 244.3.160.239 TCP 66 http > 34030 [SYN, ACK] Seq=0 Ack=1 Win=33120 Len=0 SACK_PERM=1 MSS=1380
266453  92.024929 41.177.230.67 -> 244.3.160.239 TCP 64 http > 34030 [ACK] Seq=1 Ack=953 Win=33120 Len=0
266460  92.025071 41.177.230.67 -> 244.3.160.239 TCP 64 http > 34030 [ACK] Seq=1 Ack=1226 Win=33120 Len=0
274305  92.493903 41.177.230.67 -> 244.3.160.239 TCP 64 http > 34030 [ACK] Seq=15170 Ack=1227 Win=33120 Len=0
274306  92.494011 41.177.230.67 -> 244.3.160.239 TCP 64 http > 34030 [FIN, ACK] Seq=15170 Ack=1227 Win=33120 Len=0
285544  95.491389 41.177.230.67 -> 244.3.160.239 TCP 66 http > 34068 [SYN, ACK] Seq=0 Ack=1 Win=33120 Len=0 SACK_PERM=1 MSS=1380
285551  95.492559 41.177.230.67 -> 244.3.160.239 TCP 64 http > 34068 [ACK] Seq=1 Ack=929 Win=33120 Len=0
286825  95.835887 41.177.230.67 -> 244.3.160.239 TCP 64 http > 34068 [ACK] Seq=4431 Ack=930 Win=33120 Len=0
286826  95.835936 41.177.230.67 -> 244.3.160.239 TCP 64 http > 34068 [FIN, ACK] Seq=4431 Ack=930 Win=33120 Len=0
296001  99.899824 41.177.230.67 -> 244.3.160.239 TCP 66 http > 34104 [SYN, ACK] Seq=0 Ack=1 Win=33120 Len=0 SACK_PERM=1 MSS=1380
296005  99.901072 41.177.230.67 -> 244.3.160.239 TCP 64 http > 34104 [ACK] Seq=1 Ack=955 Win=33120 Len=0
296006  99.901077 41.177.230.67 -> 244.3.160.239 TCP 64 http > 34104 [ACK] Seq=1 Ack=1228 Win=33120 Len=0
297446 100.342836 41.177.230.67 -> 244.3.160.239 TCP 64 http > 34104 [ACK] Seq=15172 Ack=1229 Win=33120 Len=0
297447 100.342905 41.177.230.67 -> 244.3.160.239 TCP 64 http > 34104 [FIN, ACK] Seq=15172 Ack=1229 Win=33120 Len=0
303247 102.519262 41.177.230.67 -> 244.3.160.239 TCP 66 http > 34131 [SYN, ACK] Seq=0 Ack=1 Win=33120 Len=0 SACK_PERM=1 MSS=1380
303252 102.520464 41.177.230.67 -> 244.3.160.239 TCP 64 http > 34131 [ACK] Seq=1 Ack=929 Win=33120 Len=0
303997 102.864800 41.177.230.67 -> 244.3.160.239 TCP 64 http > 34131 [ACK] Seq=4433 Ack=930 Win=33120 Len=0
303999 102.864847 41.177.230.67 -> 244.3.160.239 TCP 64 http > 34131 [FIN, ACK] Seq=4433 Ack=930 Win=33120 Len=0
310636 105.999897 41.177.230.67 -> 244.3.160.239 TCP 66 http > 34135 [SYN, ACK] Seq=0 Ack=1 Win=33120 Len=0 SACK_PERM=1 MSS=1380
310640 106.001067 41.177.230.67 -> 244.3.160.239 TCP 64 http > 34135 [ACK] Seq=1 Ack=955 Win=33120 Len=0
310641 106.001072 41.177.230.67 -> 244.3.160.239 TCP 64 http > 34135 [ACK] Seq=1 Ack=1228 Win=33120 Len=0
311621 106.432037 41.177.230.67 -> 244.3.160.239 TCP 75 [TCP segment of a reassembled PDU]
311662 106.442483 41.177.230.67 -> 244.3.160.239 TCP 64 http > 34135 [ACK] Seq=15201 Ack=1229 Win=33120 Len=0
311663 106.442580 41.177.230.67 -> 244.3.160.239 TCP 64 http > 34135 [FIN, ACK] Seq=15201 Ack=1229 Win=33120 Len=0
323865 111.057635 41.177.230.67 -> 244.3.160.239 TCP 66 http > 34156 [SYN, ACK] Seq=0 Ack=1 Win=33120 Len=0 SACK_PERM=1 MSS=1380
323868 111.058779 41.177.230.67 -> 244.3.160.239 TCP 64 http > 34156 [ACK] Seq=1 Ack=929 Win=33120 Len=0
323919 111.098848 41.177.230.67 -> 244.3.160.239 TCP 64 http > 34156 [ACK] Seq=4459 Ack=930 Win=33120 Len=0
323920 111.099024 41.177.230.67 -> 244.3.160.239 TCP 64 http > 34156 [FIN, ACK] Seq=4459 Ack=930 Win=33120 Len=0
338775 117.704701 41.177.230.67 -> 244.3.160.239 TCP 66 http > 34164 [SYN, ACK] Seq=0 Ack=1 Win=33120 Len=0 SACK_PERM=1 MSS=1380
338826 117.705798 41.177.230.67 -> 244.3.160.239 TCP 64 http > 34164 [ACK] Seq=1 Ack=955 Win=32166 Len=0
338828 117.705822 41.177.230.67 -> 244.3.160.239 TCP 64 http > 34164 [ACK] Seq=1 Ack=1228 Win=31893 Len=0
349619 118.168086 41.177.230.67 -> 244.3.160.239 TCP 75 [TCP segment of a reassembled PDU]
349643 118.178491 41.177.230.67 -> 244.3.160.239 TCP 64 http > 34164 [ACK] Seq=15218 Ack=1229 Win=33120 Len=0
349644 118.178591 41.177.230.67 -> 244.3.160.239 TCP 64 http > 34164 [FIN, ACK] Seq=15218 Ack=1229 Win=33120 Len=0
354953 120.962459 41.177.230.67 -> 244.3.160.239 TCP 66 http > 34174 [SYN, ACK] Seq=0 Ack=1 Win=33120 Len=0 SACK_PERM=1 MSS=1380
354957 120.963512 41.177.230.67 -> 244.3.160.239 TCP 64 http > 34174 [ACK] Seq=1 Ack=929 Win=33120 Len=0
355802 121.311686 41.177.230.67 -> 244.3.160.239 TCP 64 http > 34174 [ACK] Seq=4476 Ack=930 Win=33120 Len=0
355803 121.311810 41.177.230.67 -> 244.3.160.239 TCP 64 http > 34174 [FIN, ACK] Seq=4476 Ack=930 Win=33120 Len=0
793815 258.573513 41.177.230.67 -> 244.3.160.239 TCP 66 http > 35246 [SYN, ACK] Seq=0 Ack=1 Win=33120 Len=0 SACK_PERM=1 MSS=1380
793821 258.574779 41.177.230.67 -> 244.3.160.239 TCP 64 http > 35246 [ACK] Seq=1 Ack=929 Win=33120 Len=0
794785 258.919388 41.177.230.67 -> 244.3.160.239 TCP 64 http > 35246 [ACK] Seq=4476 Ack=930 Win=33120 Len=0
794786 258.919460 41.177.230.67 -> 244.3.160.239 TCP 64 http > 35246 [FIN, ACK] Seq=4476 Ack=930 Win=33120 Len=0
809012 263.925696 41.177.230.67 -> 244.3.160.239 TCP 66 http > 35251 [SYN, ACK] Seq=0 Ack=1 Win=33120 Len=0 SACK_PERM=1 MSS=1380
809020 263.926896 41.177.230.67 -> 244.3.160.239 TCP 64 http > 35251 [ACK] Seq=1 Ack=955 Win=33120 Len=0
809021 263.926901 41.177.230.67 -> 244.3.160.239 TCP 64 http > 35251 [ACK] Seq=1 Ack=1228 Win=33120 Len=0
810716 264.362884 41.177.230.67 -> 244.3.160.239 TCP 75 [TCP segment of a reassembled PDU]
810745 264.373714 41.177.230.67 -> 244.3.160.239 TCP 64 http > 35251 [ACK] Seq=15178 Ack=1229 Win=33120 Len=0
810746 264.373719 41.177.230.67 -> 244.3.160.239 TCP 64 http > 35251 [FIN, ACK] Seq=15178 Ack=1229 Win=33120 Len=0
817123 266.567076 41.177.230.67 -> 244.3.160.239 TCP 66 http > 35261 [SYN, ACK] Seq=0 Ack=1 Win=33120 Len=0 SACK_PERM=1 MSS=1380
817128 266.568443 41.177.230.67 -> 244.3.160.239 TCP 64 http > 35261 [ACK] Seq=1 Ack=928 Win=33120 Len=0
818136 266.943631 41.177.230.67 -> 244.3.160.239 TCP 64 http > 35261 [ACK] Seq=4413 Ack=929 Win=33120 Len=0
818137 266.943636 41.177.230.67 -> 244.3.160.239 TCP 64 http > 35261 [FIN, ACK] Seq=4413 Ack=929 Win=33120 Len=0
830237 271.234442 41.177.230.67 -> 244.3.160.239 TCP 66 http > 35270 [SYN, ACK] Seq=0 Ack=1 Win=33120 Len=0 SACK_PERM=1 MSS=1380
830241 271.236167 41.177.230.67 -> 244.3.160.239 TCP 64 http > 35270 [ACK] Seq=1 Ack=955 Win=33120 Len=0
830243 271.236412 41.177.230.67 -> 244.3.160.239 TCP 64 http > 35270 [ACK] Seq=1 Ack=1228 Win=33120 Len=0
830834 271.673973 41.177.230.67 -> 244.3.160.239 TCP 75 [TCP segment of a reassembled PDU]
830863 271.684454 41.177.230.67 -> 244.3.160.239 TCP 64 http > 35270 [ACK] Seq=15213 Ack=1229 Win=33120 Len=0
830864 271.684458 41.177.230.67 -> 244.3.160.239 TCP 64 http > 35270 [FIN, ACK] Seq=15213 Ack=1229 Win=33120 Len=0
840070 275.401296 41.177.230.67 -> 244.3.160.239 TCP 66 http > 35289 [SYN, ACK] Seq=0 Ack=1 Win=33120 Len=0 SACK_PERM=1 MSS=1380
840091 275.402509 41.177.230.67 -> 244.3.160.239 TCP 64 http > 35289 [ACK] Seq=1 Ack=929 Win=33120 Len=0
840742 275.762659 41.177.230.67 -> 244.3.160.239 TCP 64 http > 35289 [ACK] Seq=4470 Ack=930 Win=33120 Len=0
840748 275.762916 41.177.230.67 -> 244.3.160.239 TCP 64 http > 35289 [FIN, ACK] Seq=4470 Ack=930 Win=33120 Len=0
