709008 225.934981 41.177.218.254 -> 244.3.210.197 TCP 66 bmc-onekey > http [SYN] Seq=0 Win=64512 Len=0 MSS=1380 SACK_PERM=1
709009 225.935047 41.177.218.254 -> 244.3.210.197 TCP 66 iniserve-port > http [SYN] Seq=0 Win=64512 Len=0 MSS=1380 SACK_PERM=1
709022 225.935469 41.177.218.254 -> 244.3.210.197 TCP 64 bmc-onekey > http [ACK] Seq=1 Ack=1 Win=64512 Len=0
709029 225.935968 41.177.218.254 -> 244.3.210.197 TCP 64 iniserve-port > http [ACK] Seq=1 Ack=1 Win=64512 Len=0
709065 225.940173 41.177.218.254 -> 244.3.210.197 TCP 64 bmc-onekey > http [ACK] Seq=123 Ack=2761 Win=64512 Len=0
709075 225.943212 41.177.218.254 -> 244.3.210.197 TCP 64 bmc-onekey > http [ACK] Seq=123 Ack=4141 Win=64512 Len=0
709076 225.943217 41.177.218.254 -> 244.3.210.197 TCP 64 bmc-onekey > http [ACK] Seq=123 Ack=6901 Win=64512 Len=0
709092 225.944096 41.177.218.254 -> 244.3.210.197 TCP 64 bmc-onekey > http [ACK] Seq=123 Ack=8281 Win=64512 Len=0
709100 225.944700 41.177.218.254 -> 244.3.210.197 TCP 64 bmc-onekey > http [ACK] Seq=123 Ack=11041 Win=64512 Len=0
709101 225.944705 41.177.218.254 -> 244.3.210.197 TCP 64 bmc-onekey > http [ACK] Seq=123 Ack=12421 Win=63132 Len=0
709119 225.944995 41.177.218.254 -> 244.3.210.197 TCP 64 bmc-onekey > http [ACK] Seq=123 Ack=15181 Win=60372 Len=0
709131 225.946464 41.177.218.254 -> 244.3.210.197 TCP 64 bmc-onekey > http [ACK] Seq=123 Ack=17941 Win=57612 Len=0
709132 225.946469 41.177.218.254 -> 244.3.210.197 TCP 64 bmc-onekey > http [ACK] Seq=123 Ack=20701 Win=54852 Len=0
709133 225.946473 41.177.218.254 -> 244.3.210.197 TCP 64 bmc-onekey > http [ACK] Seq=123 Ack=26221 Win=49332 Len=0
709134 225.946477 41.177.218.254 -> 244.3.210.197 TCP 64 bmc-onekey > http [ACK] Seq=123 Ack=23461 Win=52092 Len=0
709167 225.947335 41.177.218.254 -> 244.3.210.197 TCP 64 bmc-onekey > http [ACK] Seq=123 Ack=28981 Win=46572 Len=0
709171 225.947490 41.177.218.254 -> 244.3.210.197 TCP 64 bmc-onekey > http [ACK] Seq=123 Ack=31741 Win=43812 Len=0
709185 225.947797 41.177.218.254 -> 244.3.210.197 TCP 64 bmc-onekey > http [ACK] Seq=123 Ack=34501 Win=41052 Len=0
709189 225.947880 41.177.218.254 -> 244.3.210.197 TCP 64 bmc-onekey > http [ACK] Seq=123 Ack=37261 Win=38292 Len=0
709200 225.948307 41.177.218.254 -> 244.3.210.197 TCP 64 bmc-onekey > http [ACK] Seq=123 Ack=40021 Win=35532 Len=0
709201 225.948379 41.177.218.254 -> 244.3.210.197 TCP 64 bmc-onekey > http [ACK] Seq=123 Ack=42781 Win=32772 Len=0
709212 225.948961 41.177.218.254 -> 244.3.210.197 TCP 64 bmc-onekey > http [ACK] Seq=123 Ack=45541 Win=30012 Len=0
709213 225.948965 41.177.218.254 -> 244.3.210.197 TCP 64 bmc-onekey > http [ACK] Seq=123 Ack=48301 Win=27252 Len=0
709214 225.948970 41.177.218.254 -> 244.3.210.197 TCP 70 [TCP Dup ACK 709213#1] bmc-onekey > http [ACK] Seq=123 Ack=48301 Win=27252 Len=0 SLE=49681 SRE=49686
709222 225.949275 41.177.218.254 -> 244.3.210.197 TCP 64 bmc-onekey > http [ACK] Seq=123 Ack=49686 Win=25867 Len=0
709237 225.951199 41.177.218.254 -> 244.3.210.197 TCP 64 [TCP Window Update] bmc-onekey > http [ACK] Seq=123 Ack=49686 Win=64512 Len=0
709669 226.090872 41.177.218.254 -> 244.3.210.197 TCP 64 iniserve-port > http [ACK] Seq=189 Ack=583 Win=63930 Len=0
723770 231.591791 41.177.218.254 -> 244.3.210.197 TCP 64 iniserve-port > http [ACK] Seq=410 Ack=3343 Win=64512 Len=0
723771 231.591796 41.177.218.254 -> 244.3.210.197 TCP 64 iniserve-port > http [ACK] Seq=410 Ack=4723 Win=64512 Len=0
723790 231.593879 41.177.218.254 -> 244.3.210.197 TCP 64 iniserve-port > http [ACK] Seq=410 Ack=7483 Win=64512 Len=0
723804 231.594368 41.177.218.254 -> 244.3.210.197 TCP 64 iniserve-port > http [ACK] Seq=410 Ack=8863 Win=64512 Len=0
723805 231.594372 41.177.218.254 -> 244.3.210.197 TCP 64 iniserve-port > http [ACK] Seq=410 Ack=11623 Win=64512 Len=0
723806 231.594440 41.177.218.254 -> 244.3.210.197 TCP 64 iniserve-port > http [ACK] Seq=410 Ack=13003 Win=63132 Len=0
723824 231.594769 41.177.218.254 -> 244.3.210.197 TCP 64 iniserve-port > http [ACK] Seq=410 Ack=15763 Win=60372 Len=0
723831 231.595966 41.177.218.254 -> 244.3.210.197 TCP 64 [TCP Window Update] iniserve-port > http [ACK] Seq=410 Ack=15763 Win=64512 Len=0
724420 231.825239 41.177.218.254 -> 244.3.210.197 TCP 64 iniserve-port > http [ACK] Seq=410 Ack=16002 Win=64273 Len=0
