1150   0.301289 41.177.98.220 -> 244.3.185.121 TCP 1314 ups-onlinet > caspssl [PSH, ACK] Seq=1 Ack=1240 Win=49680 Len=1256
1423   0.408268 41.177.98.220 -> 244.3.185.121 TCP 138 ups-onlinet > caspssl [PSH, ACK] Seq=1257 Ack=2497 Win=49680 Len=80
1582   0.458176 41.177.98.220 -> 244.3.185.121 TCP 64 ups-onlinet > caspssl [ACK] Seq=1337 Ack=3742 Win=49680 Len=0
1897   0.568847 41.177.98.220 -> 244.3.185.121 TCP 1438 ups-onlinet > caspssl [ACK] Seq=1337 Ack=3742 Win=49680 Len=1380
1898   0.568852 41.177.98.220 -> 244.3.185.121 TCP 499 ups-onlinet > caspssl [PSH, ACK] Seq=2717 Ack=3742 Win=49680 Len=441
3456   1.128167 41.177.98.220 -> 244.3.142.22 TCP 64 ups-onlinet > hpvmmagent [ACK] Seq=1 Ack=75 Win=49640 Len=0
3989   1.181041 41.177.98.220 -> 244.3.142.22 TCP 417 ups-onlinet > hpvmmagent [PSH, ACK] Seq=1 Ack=75 Win=49640 Len=359
6087   1.911860 41.177.98.220 -> 244.3.142.57 TCP 1253 ups-onlinet > idmaps [PSH, ACK] Seq=1 Ack=1179 Win=49640 Len=1195
6476   2.118760 41.177.98.220 -> 244.3.142.57 TCP 138 ups-onlinet > idmaps [PSH, ACK] Seq=1196 Ack=2375 Win=49640 Len=80
6638   2.168236 41.177.98.220 -> 244.3.142.57 TCP 64 ups-onlinet > idmaps [ACK] Seq=1276 Ack=3612 Win=49640 Len=0
6894   2.269110 41.177.98.220 -> 244.3.199.164 TCP 158 ups-onlinet > bbn-mmc [PSH, ACK] Seq=1 Ack=102 Win=49680 Len=100
6901   2.271102 41.177.98.220 -> 244.3.199.164 TCP 324 ups-onlinet > bbn-mmc [PSH, ACK] Seq=101 Ack=351 Win=49680 Len=266
6921   2.288709 41.177.98.220 -> 244.3.199.164 TCP 147 ups-onlinet > bbn-mmc [PSH, ACK] Seq=367 Ack=422 Win=49680 Len=89
7046   2.328210 41.177.98.220 -> 244.3.199.164 TCP 64 ups-onlinet > bbn-mmc [ACK] Seq=456 Ack=715 Win=49680 Len=0
7048   2.328951 41.177.98.220 -> 244.3.199.164 TCP 411 ups-onlinet > bbn-mmc [PSH, ACK] Seq=456 Ack=715 Win=49680 Len=353
7500   2.535088 41.177.98.220 -> 244.3.185.121 TCP 146 ups-onlinet > caspssl [PSH, ACK] Seq=3158 Ack=3814 Win=49680 Len=88
7640   2.588231 41.177.98.220 -> 244.3.185.121 TCP 64 ups-onlinet > caspssl [ACK] Seq=3246 Ack=5101 Win=49680 Len=0
7810   2.683593 41.177.98.220 -> 41.177.92.145 TCP 166 op-probe > metaagent [PSH, ACK] Seq=1 Ack=74 Win=49640 Len=108
7827   2.707653 41.177.98.220 -> 41.177.92.145 TCP 180 op-probe > metaagent [PSH, ACK] Seq=109 Ack=184 Win=49640 Len=122
7830   2.715018 41.177.98.220 -> 244.3.142.57 TCP 1499 ups-onlinet > idmaps [PSH, ACK] Seq=1276 Ack=3612 Win=49640 Len=1441
7845   2.728253 41.177.98.220 -> 41.177.92.145 TCP 64 op-probe > metaagent [ACK] Seq=231 Ack=304 Win=49640 Len=0
7953   2.778274 41.177.98.220 -> 244.3.142.22 TCP 64 ups-onlinet > hpvmmagent [ACK] Seq=360 Ack=149 Win=49640 Len=0
7966   2.780439 41.177.98.220 -> 244.3.142.22 TCP 1049 ups-onlinet > hpvmmagent [PSH, ACK] Seq=360 Ack=149 Win=49640 Len=991
8036   2.810608 41.177.98.220 -> 41.177.92.145 TCP 358 op-probe > metaagent [PSH, ACK] Seq=231 Ack=304 Win=49640 Len=300
8123   2.852538 41.177.98.220 -> 41.177.92.145 TCP 358 op-probe > metaagent [PSH, ACK] Seq=531 Ack=424 Win=49640 Len=300
8126   2.854372 41.177.98.220 -> 41.177.92.145 TCP 141 op-probe > metaagent [PSH, ACK] Seq=831 Ack=495 Win=49640 Len=83
8209   2.894045 41.177.98.220 -> 41.177.92.145 TCP 628 op-probe > metaagent [PSH, ACK] Seq=914 Ack=600 Win=49640 Len=570
8258   2.918229 41.177.98.220 -> 244.3.142.22 TCP 64 ups-onlinet > hpvmmagent [ACK] Seq=1351 Ack=223 Win=49640 Len=0
8261   2.919721 41.177.98.220 -> 244.3.142.22 TCP 1019 ups-onlinet > hpvmmagent [PSH, ACK] Seq=1351 Ack=223 Win=49640 Len=961
8798   3.120408 41.177.98.220 -> 244.3.199.164 TCP 325 ups-onlinet > bbn-mmc [PSH, ACK] Seq=809 Ack=787 Win=49680 Len=267
8808   3.136809 41.177.98.220 -> 244.3.185.121 TCP 1438 ups-onlinet > caspssl [ACK] Seq=3246 Ack=5101 Win=49680 Len=1380
8809   3.136814 41.177.98.220 -> 244.3.185.121 TCP 106 ups-onlinet > caspssl [PSH, ACK] Seq=4626 Ack=5101 Win=49680 Len=48
9272   3.368298 41.177.98.220 -> 41.177.75.71 TCP 64 dpserve > 63038 [ACK] Seq=1 Ack=88 Win=49680 Len=0
9876   3.500358 41.177.98.220 -> 41.177.75.71 TCP 178 dpserve > 63038 [PSH, ACK] Seq=1 Ack=88 Win=49680 Len=120
9927   3.508528 41.177.98.220 -> 41.177.75.71 TCP 187 dpserve > 63038 [PSH, ACK] Seq=121 Ack=157 Win=49680 Len=129
10211   3.533813 41.177.98.220 -> 41.177.75.71 TCP 264 dpserve > 63038 [PSH, ACK] Seq=250 Ack=227 Win=49680 Len=206
10226   3.536349 41.177.98.220 -> 41.177.75.71 TCP 139 dpserve > 63038 [PSH, ACK] Seq=456 Ack=298 Win=49680 Len=81
10370   3.598078 41.177.98.220 -> 41.177.75.71 TCP 1438 dpserve > 63038 [ACK] Seq=537 Ack=349 Win=49680 Len=1380
10371   3.598083 41.177.98.220 -> 41.177.75.71 TCP 1104 dpserve > 63038 [PSH, ACK] Seq=1917 Ack=349 Win=49680 Len=1046
10389   3.600334 41.177.98.220 -> 41.177.75.71 TCP 290 dpserve > 63038 [PSH, ACK] Seq=2963 Ack=413 Win=49680 Len=232
10403   3.602196 41.177.98.220 -> 41.177.75.71 TCP 292 dpserve > 63038 [PSH, ACK] Seq=3195 Ack=477 Win=49680 Len=234
10405   3.604142 41.177.98.220 -> 41.177.75.71 TCP 287 dpserve > 63038 [PSH, ACK] Seq=3429 Ack=541 Win=49680 Len=229
10463   3.606047 41.177.98.220 -> 41.177.75.71 TCP 288 dpserve > 63038 [PSH, ACK] Seq=3658 Ack=605 Win=49680 Len=230
10484   3.607822 41.177.98.220 -> 41.177.75.71 TCP 283 dpserve > 63038 [PSH, ACK] Seq=3888 Ack=669 Win=49680 Len=225
10488   3.609678 41.177.98.220 -> 41.177.75.71 TCP 286 dpserve > 63038 [PSH, ACK] Seq=4113 Ack=733 Win=49680 Len=228
10492   3.612732 41.177.98.220 -> 41.177.75.71 TCP 273 dpserve > 63038 [PSH, ACK] Seq=4341 Ack=797 Win=49680 Len=215
10497   3.614641 41.177.98.220 -> 41.177.75.71 TCP 285 dpserve > 63038 [PSH, ACK] Seq=4556 Ack=861 Win=49680 Len=227
10511   3.616648 41.177.98.220 -> 41.177.75.71 TCP 283 dpserve > 63038 [PSH, ACK] Seq=4783 Ack=925 Win=49680 Len=225
10513   3.619360 41.177.98.220 -> 41.177.75.71 TCP 64 dpserve > 63038 [ACK] Seq=5008 Ack=990 Win=49680 Len=0
10514   3.619442 41.177.98.220 -> 41.177.75.71 TCP 291 dpserve > 63038 [PSH, ACK] Seq=5008 Ack=990 Win=49680 Len=233
10517   3.621660 41.177.98.220 -> 41.177.75.71 TCP 291 dpserve > 63038 [PSH, ACK] Seq=5241 Ack=1055 Win=49680 Len=233
10527   3.623524 41.177.98.220 -> 41.177.75.71 TCP 283 dpserve > 63038 [PSH, ACK] Seq=5474 Ack=1120 Win=49680 Len=225
10532   3.625388 41.177.98.220 -> 41.177.75.71 TCP 289 dpserve > 63038 [PSH, ACK] Seq=5699 Ack=1185 Win=49680 Len=231
10535   3.627248 41.177.98.220 -> 41.177.75.71 TCP 288 dpserve > 63038 [PSH, ACK] Seq=5930 Ack=1250 Win=49680 Len=230
10537   3.629196 41.177.98.220 -> 41.177.75.71 TCP 295 dpserve > 63038 [PSH, ACK] Seq=6160 Ack=1315 Win=49680 Len=237
10546   3.631077 41.177.98.220 -> 41.177.75.71 TCP 286 dpserve > 63038 [PSH, ACK] Seq=6397 Ack=1380 Win=49680 Len=228
10556   3.632912 41.177.98.220 -> 41.177.75.71 TCP 291 dpserve > 63038 [PSH, ACK] Seq=6625 Ack=1445 Win=49680 Len=233
10560   3.634769 41.177.98.220 -> 41.177.75.71 TCP 284 dpserve > 63038 [PSH, ACK] Seq=6858 Ack=1510 Win=49680 Len=226
10562   3.636621 41.177.98.220 -> 41.177.75.71 TCP 297 dpserve > 63038 [PSH, ACK] Seq=7084 Ack=1575 Win=49680 Len=239
10564   3.638463 41.177.98.220 -> 41.177.75.71 TCP 287 dpserve > 63038 [PSH, ACK] Seq=7323 Ack=1640 Win=49680 Len=229
10566   3.640466 41.177.98.220 -> 41.177.75.71 TCP 289 dpserve > 63038 [PSH, ACK] Seq=7552 Ack=1705 Win=49680 Len=231
10576   3.642327 41.177.98.220 -> 41.177.75.71 TCP 284 dpserve > 63038 [PSH, ACK] Seq=7783 Ack=1770 Win=49680 Len=226
10596   3.644229 41.177.98.220 -> 41.177.75.71 TCP 286 dpserve > 63038 [PSH, ACK] Seq=8009 Ack=1835 Win=49680 Len=228
10615   3.646100 41.177.98.220 -> 41.177.75.71 TCP 285 dpserve > 63038 [PSH, ACK] Seq=8237 Ack=1900 Win=49680 Len=227
10628   3.647959 41.177.98.220 -> 41.177.75.71 TCP 284 dpserve > 63038 [PSH, ACK] Seq=8464 Ack=1965 Win=49680 Len=226
10650   3.649832 41.177.98.220 -> 41.177.75.71 TCP 284 dpserve > 63038 [PSH, ACK] Seq=8690 Ack=2030 Win=49680 Len=226
10658   3.651691 41.177.98.220 -> 41.177.75.71 TCP 282 dpserve > 63038 [PSH, ACK] Seq=8916 Ack=2095 Win=49680 Len=224
10681   3.654289 41.177.98.220 -> 41.177.75.71 TCP 284 dpserve > 63038 [PSH, ACK] Seq=9140 Ack=2160 Win=49680 Len=226
10710   3.656544 41.177.98.220 -> 41.177.75.71 TCP 290 dpserve > 63038 [PSH, ACK] Seq=9366 Ack=2225 Win=49680 Len=232
10746   3.658433 41.177.98.220 -> 41.177.75.71 TCP 290 dpserve > 63038 [PSH, ACK] Seq=9598 Ack=2290 Win=49680 Len=232
10787   3.660302 41.177.98.220 -> 41.177.75.71 TCP 291 dpserve > 63038 [PSH, ACK] Seq=9830 Ack=2355 Win=49680 Len=233
10830   3.662164 41.177.98.220 -> 41.177.75.71 TCP 293 dpserve > 63038 [PSH, ACK] Seq=10063 Ack=2420 Win=49680 Len=235
11169   3.678205 41.177.98.220 -> 41.177.75.71 TCP 64 dpserve > 63038 [ACK] Seq=10298 Ack=2495 Win=49680 Len=0
11783   3.698335 41.177.98.220 -> 41.177.75.71 TCP 156 dpserve > 63038 [PSH, ACK] Seq=10298 Ack=2495 Win=49680 Len=98
17505   5.171500 41.177.98.220 -> 244.3.185.121 TCP 135 ups-onlinet > caspssl [PSH, ACK] Seq=4674 Ack=5179 Win=49680 Len=77
17509   5.173363 41.177.98.220 -> 244.3.185.121 TCP 219 ups-onlinet > caspssl [PSH, ACK] Seq=4751 Ack=5335 Win=49680 Len=161
18071   5.575499 41.177.98.220 -> 244.3.199.164 TCP 197 ups-onlinet > bbn-mmc [PSH, ACK] Seq=1076 Ack=865 Win=49680 Len=139
18183   5.730825 41.177.98.220 -> 244.3.185.135 TCP 64 ups-onlinet > health-trap [ACK] Seq=1 Ack=1073 Win=48608 Len=0
18186   5.732887 41.177.98.220 -> 244.3.185.135 TCP 1438 ups-onlinet > health-trap [ACK] Seq=1 Ack=1444 Win=49680 Len=1380
18187   5.732892 41.177.98.220 -> 244.3.185.135 TCP 137 ups-onlinet > health-trap [PSH, ACK] Seq=1381 Ack=1444 Win=49680 Len=79
18814   6.048139 41.177.98.220 -> 244.3.185.135 TCP 64 ups-onlinet > health-trap [ACK] Seq=1460 Ack=2516 Win=48608 Len=0
18824   6.055226 41.177.98.220 -> 244.3.185.135 TCP 137 ups-onlinet > health-trap [PSH, ACK] Seq=1460 Ack=2905 Win=49680 Len=79
18834   6.058246 41.177.98.220 -> 244.3.185.135 TCP 64 ups-onlinet > health-trap [ACK] Seq=1539 Ack=3977 Win=48608 Len=0
18878   6.118160 41.177.98.220 -> 244.3.185.135 TCP 64 ups-onlinet > health-trap [ACK] Seq=1539 Ack=4354 Win=49680 Len=0
18916   6.147853 41.177.98.220 -> 244.3.185.135 TCP 937 ups-onlinet > health-trap [PSH, ACK] Seq=1539 Ack=4354 Win=49680 Len=879
20916   6.935649 41.177.98.220 -> 244.3.185.135 TCP 145 ups-onlinet > health-trap [PSH, ACK] Seq=2418 Ack=4422 Win=49680 Len=87
20920   6.936652 41.177.98.220 -> 244.3.185.135 TCP 64 ups-onlinet > health-trap [ACK] Seq=2505 Ack=5494 Win=48608 Len=0
21008   6.988211 41.177.98.220 -> 244.3.185.135 TCP 64 ups-onlinet > health-trap [ACK] Seq=2505 Ack=5909 Win=49680 Len=0
23136   8.378254 41.177.98.220 -> 41.177.75.71 TCP 64 dpserve > 63038 [ACK] Seq=10396 Ack=2586 Win=49680 Len=0
23145   8.384804 41.177.98.220 -> 41.177.75.71 TCP 128 dpserve > 63038 [PSH, ACK] Seq=10396 Ack=2586 Win=49680 Len=70
23150   8.394734 41.177.98.220 -> 41.177.75.71 TCP 128 dpserve > 63038 [PSH, ACK] Seq=10466 Ack=2666 Win=49680 Len=70
23234   8.438248 41.177.98.220 -> 41.177.75.71 TCP 64 dpserve > 63038 [ACK] Seq=10536 Ack=2749 Win=49680 Len=0
23480   8.507170 41.177.98.220 -> 41.177.75.71 TCP 1296 dpserve > 63038 [PSH, ACK] Seq=10536 Ack=2749 Win=49680 Len=1238
23508   8.531071 41.177.98.220 -> 41.177.75.71 TCP 129 dpserve > 63038 [PSH, ACK] Seq=11774 Ack=2848 Win=49680 Len=71
23546   8.550264 41.177.98.220 -> 41.177.75.71 TCP 129 dpserve > 63038 [PSH, ACK] Seq=11845 Ack=2947 Win=49680 Len=71
23553   8.553049 41.177.98.220 -> 41.177.75.71 TCP 129 dpserve > 63038 [PSH, ACK] Seq=11916 Ack=3046 Win=49680 Len=71
23568   8.561984 41.177.98.220 -> 41.177.75.71 TCP 64 dpserve > 63038 [ACK] Seq=11987 Ack=3145 Win=49680 Len=0
23583   8.572085 41.177.98.220 -> 41.177.75.71 TCP 129 dpserve > 63038 [PSH, ACK] Seq=11987 Ack=3145 Win=49680 Len=71
23618   8.587413 41.177.98.220 -> 41.177.75.71 TCP 423 dpserve > 63038 [PSH, ACK] Seq=12058 Ack=3213 Win=49680 Len=365
23642   8.609169 41.177.98.220 -> 41.177.75.71 TCP 264 dpserve > 63038 [PSH, ACK] Seq=12423 Ack=3282 Win=49680 Len=206
23647   8.610781 41.177.98.220 -> 244.3.185.135 TCP 1438 ups-onlinet > health-trap [ACK] Seq=2505 Ack=5909 Win=49680 Len=1380
23648   8.610786 41.177.98.220 -> 244.3.185.135 TCP 360 ups-onlinet > health-trap [PSH, ACK] Seq=3885 Ack=5909 Win=49680 Len=302
23688   8.638214 41.177.98.220 -> 41.177.75.71 TCP 64 dpserve > 63038 [ACK] Seq=12629 Ack=3355 Win=49680 Len=0
23722   8.667702 41.177.98.220 -> 41.177.75.71 TCP 169 dpserve > 63038 [PSH, ACK] Seq=12629 Ack=3355 Win=49680 Len=111
23790   8.704524 41.177.98.220 -> 41.177.75.71 TCP 1438 dpserve > 63038 [ACK] Seq=12740 Ack=3406 Win=49680 Len=1380
23795   8.704612 41.177.98.220 -> 41.177.75.71 TCP 1104 dpserve > 63038 [PSH, ACK] Seq=14120 Ack=3406 Win=49680 Len=1046
23807   8.706578 41.177.98.220 -> 41.177.75.71 TCP 290 dpserve > 63038 [PSH, ACK] Seq=15166 Ack=3470 Win=49680 Len=232
23809   8.708422 41.177.98.220 -> 41.177.75.71 TCP 292 dpserve > 63038 [PSH, ACK] Seq=15398 Ack=3534 Win=49680 Len=234
23811   8.710247 41.177.98.220 -> 41.177.75.71 TCP 287 dpserve > 63038 [PSH, ACK] Seq=15632 Ack=3598 Win=49680 Len=229
23813   8.712049 41.177.98.220 -> 41.177.75.71 TCP 288 dpserve > 63038 [PSH, ACK] Seq=15861 Ack=3662 Win=49680 Len=230
23819   8.713850 41.177.98.220 -> 41.177.75.71 TCP 283 dpserve > 63038 [PSH, ACK] Seq=16091 Ack=3726 Win=49680 Len=225
23823   8.715657 41.177.98.220 -> 41.177.75.71 TCP 286 dpserve > 63038 [PSH, ACK] Seq=16316 Ack=3790 Win=49680 Len=228
23825   8.717489 41.177.98.220 -> 41.177.75.71 TCP 273 dpserve > 63038 [PSH, ACK] Seq=16544 Ack=3854 Win=49680 Len=215
23830   8.719370 41.177.98.220 -> 41.177.75.71 TCP 285 dpserve > 63038 [PSH, ACK] Seq=16759 Ack=3918 Win=49680 Len=227
23832   8.721250 41.177.98.220 -> 41.177.75.71 TCP 283 dpserve > 63038 [PSH, ACK] Seq=16986 Ack=3982 Win=49680 Len=225
23834   8.723042 41.177.98.220 -> 41.177.75.71 TCP 291 dpserve > 63038 [PSH, ACK] Seq=17211 Ack=4047 Win=49680 Len=233
23836   8.724829 41.177.98.220 -> 41.177.75.71 TCP 291 dpserve > 63038 [PSH, ACK] Seq=17444 Ack=4112 Win=49680 Len=233
23838   8.726615 41.177.98.220 -> 41.177.75.71 TCP 283 dpserve > 63038 [PSH, ACK] Seq=17677 Ack=4177 Win=49680 Len=225
23841   8.728404 41.177.98.220 -> 41.177.75.71 TCP 289 dpserve > 63038 [PSH, ACK] Seq=17902 Ack=4242 Win=49680 Len=231
23844   8.730205 41.177.98.220 -> 41.177.75.71 TCP 288 dpserve > 63038 [PSH, ACK] Seq=18133 Ack=4307 Win=49680 Len=230
23848   8.731998 41.177.98.220 -> 41.177.75.71 TCP 295 dpserve > 63038 [PSH, ACK] Seq=18363 Ack=4372 Win=49680 Len=237
23850   8.733781 41.177.98.220 -> 41.177.75.71 TCP 286 dpserve > 63038 [PSH, ACK] Seq=18600 Ack=4437 Win=49680 Len=228
23852   8.735571 41.177.98.220 -> 41.177.75.71 TCP 291 dpserve > 63038 [PSH, ACK] Seq=18828 Ack=4502 Win=49680 Len=233
23854   8.737356 41.177.98.220 -> 41.177.75.71 TCP 284 dpserve > 63038 [PSH, ACK] Seq=19061 Ack=4567 Win=49680 Len=226
23856   8.739166 41.177.98.220 -> 41.177.75.71 TCP 297 dpserve > 63038 [PSH, ACK] Seq=19287 Ack=4632 Win=49680 Len=239
23858   8.740955 41.177.98.220 -> 41.177.75.71 TCP 287 dpserve > 63038 [PSH, ACK] Seq=19526 Ack=4697 Win=49680 Len=229
23879   8.742746 41.177.98.220 -> 41.177.75.71 TCP 289 dpserve > 63038 [PSH, ACK] Seq=19755 Ack=4762 Win=49680 Len=231
23881   8.744541 41.177.98.220 -> 41.177.75.71 TCP 284 dpserve > 63038 [PSH, ACK] Seq=19986 Ack=4827 Win=49680 Len=226
23886   8.746331 41.177.98.220 -> 41.177.75.71 TCP 286 dpserve > 63038 [PSH, ACK] Seq=20212 Ack=4892 Win=49680 Len=228
23888   8.748132 41.177.98.220 -> 41.177.75.71 TCP 285 dpserve > 63038 [PSH, ACK] Seq=20440 Ack=4957 Win=49680 Len=227
23893   8.749919 41.177.98.220 -> 41.177.75.71 TCP 284 dpserve > 63038 [PSH, ACK] Seq=20667 Ack=5022 Win=49680 Len=226
23897   8.751710 41.177.98.220 -> 41.177.75.71 TCP 284 dpserve > 63038 [PSH, ACK] Seq=20893 Ack=5087 Win=49680 Len=226
23903   8.753510 41.177.98.220 -> 41.177.75.71 TCP 282 dpserve > 63038 [PSH, ACK] Seq=21119 Ack=5152 Win=49680 Len=224
23941   8.755305 41.177.98.220 -> 41.177.75.71 TCP 284 dpserve > 63038 [PSH, ACK] Seq=21343 Ack=5217 Win=49680 Len=226
23946   8.757115 41.177.98.220 -> 41.177.75.71 TCP 290 dpserve > 63038 [PSH, ACK] Seq=21569 Ack=5282 Win=49680 Len=232
23951   8.758989 41.177.98.220 -> 41.177.75.71 TCP 290 dpserve > 63038 [PSH, ACK] Seq=21801 Ack=5347 Win=49680 Len=232
23955   8.760794 41.177.98.220 -> 41.177.75.71 TCP 291 dpserve > 63038 [PSH, ACK] Seq=22033 Ack=5412 Win=49680 Len=233
23957   8.763076 41.177.98.220 -> 41.177.75.71 TCP 293 dpserve > 63038 [PSH, ACK] Seq=22266 Ack=5477 Win=49680 Len=235
23965   8.769455 41.177.98.220 -> 41.177.75.71 TCP 64 dpserve > 63038 [ACK] Seq=22501 Ack=5544 Win=49680 Len=0
23966   8.769512 41.177.98.220 -> 41.177.75.71 TCP 464 dpserve > 63038 [PSH, ACK] Seq=22501 Ack=5544 Win=49680 Len=406
23969   8.773788 41.177.98.220 -> 41.177.75.71 TCP 148 dpserve > 63038 [PSH, ACK] Seq=22907 Ack=5636 Win=49680 Len=90
24516   9.289745 41.177.98.220 -> 244.3.185.176 TCP 64 ups-onlinet > digital-notary [ACK] Seq=1 Ack=1525 Win=49680 Len=0
24527   9.291720 41.177.98.220 -> 244.3.185.176 TCP 1438 ups-onlinet > digital-notary [ACK] Seq=1 Ack=1525 Win=49680 Len=1380
24528   9.291725 41.177.98.220 -> 244.3.185.176 TCP 219 ups-onlinet > digital-notary [PSH, ACK] Seq=1381 Ack=1525 Win=49680 Len=161
24731   9.419789 41.177.98.220 -> 244.3.185.176 TCP 64 ups-onlinet > digital-notary [ACK] Seq=1542 Ack=3067 Win=49680 Len=0
24755   9.426573 41.177.98.220 -> 244.3.185.176 TCP 138 ups-onlinet > digital-notary [PSH, ACK] Seq=1542 Ack=3067 Win=49680 Len=80
24765   9.429538 41.177.98.220 -> 244.3.185.176 TCP 64 ups-onlinet > digital-notary [ACK] Seq=1622 Ack=4597 Win=49680 Len=0
25171   9.659379 41.177.98.220 -> 244.3.185.176 TCP 1239 ups-onlinet > digital-notary [PSH, ACK] Seq=1622 Ack=4597 Win=49680 Len=1181
28117  11.293263 41.177.98.220 -> 244.3.185.119 TCP 64 ups-onlinet > netobjects2 [ACK] Seq=1 Ack=91 Win=49680 Len=0
28118  11.293435 41.177.98.220 -> 244.3.185.119 TCP 1438 ups-onlinet > netobjects2 [ACK] Seq=1 Ack=91 Win=49680 Len=1380
28119  11.293440 41.177.98.220 -> 244.3.185.119 TCP 336 ups-onlinet > netobjects2 [PSH, ACK] Seq=1381 Ack=91 Win=49680 Len=278
29408  12.022302 41.177.98.220 -> 244.3.185.176 TCP 146 ups-onlinet > digital-notary [PSH, ACK] Seq=2803 Ack=4670 Win=49680 Len=88
29415  12.023974 41.177.98.220 -> 244.3.185.176 TCP 64 ups-onlinet > digital-notary [ACK] Seq=2891 Ack=6243 Win=49680 Len=0
30471  12.702792 41.177.98.220 -> 244.3.185.176 TCP 1438 ups-onlinet > digital-notary [ACK] Seq=2891 Ack=6243 Win=49680 Len=1380
30472  12.702797 41.177.98.220 -> 244.3.185.176 TCP 433 ups-onlinet > digital-notary [PSH, ACK] Seq=4271 Ack=6243 Win=49680 Len=375
30803  12.838458 41.177.98.220 -> 244.3.84.197 TCP 64 dpserve > valisys-lm [ACK] Seq=1 Ack=92 Win=49680 Len=0
30819  12.861612 41.177.98.220 -> 244.3.84.197 TCP 221 dpserve > valisys-lm [PSH, ACK] Seq=1 Ack=92 Win=49680 Len=163
30826  12.867362 41.177.98.220 -> 244.3.79.163 TCP 70 ups-onlinet > mc-client [ACK] Seq=1 Ack=4294966761 Win=49680 Len=0 SLE=1 SRE=380
30829  12.867413 41.177.98.220 -> 244.3.79.163 TCP 64 ups-onlinet > mc-client [ACK] Seq=1 Ack=380 Win=49680 Len=0
30834  12.868989 41.177.98.220 -> 244.3.79.163 TCP 990 ups-onlinet > mc-client [PSH, ACK] Seq=1 Ack=380 Win=49680 Len=932
31014  12.996835 41.177.98.220 -> 244.3.79.163 TCP 64 ups-onlinet > mc-client [ACK] Seq=933 Ack=1313 Win=48747 Len=0
31024  13.004072 41.177.98.220 -> 244.3.79.163 TCP 138 ups-onlinet > mc-client [PSH, ACK] Seq=933 Ack=1313 Win=48747 Len=80
31033  13.007380 41.177.98.220 -> 244.3.79.163 TCP 64 ups-onlinet > mc-client [ACK] Seq=1013 Ack=2233 Win=49680 Len=0
31151  13.103458 41.177.98.220 -> 244.3.79.163 TCP 1261 ups-onlinet > mc-client [PSH, ACK] Seq=1013 Ack=2233 Win=49680 Len=1203
33274  14.084152 41.177.98.220 -> 244.3.79.163 TCP 64 ups-onlinet > mc-client [ACK] Seq=2216 Ack=3211 Win=48702 Len=0
33605  14.263710 41.177.98.220 -> 41.177.75.71 TCP 276 dpserve > 63038 [PSH, ACK] Seq=22997 Ack=5752 Win=49680 Len=218
34245  14.513960 41.177.98.220 -> 244.3.79.163 TCP 1220 ups-onlinet > mc-client [PSH, ACK] Seq=2216 Ack=3211 Win=48702 Len=1162
36990  15.426738 41.177.98.220 -> 244.3.185.135 TCP 64 ups-onlinet > health-trap [ACK] Seq=4187 Ack=6981 Win=48608 Len=0
37001  15.428849 41.177.98.220 -> 244.3.185.135 TCP 1438 ups-onlinet > health-trap [ACK] Seq=4187 Ack=7372 Win=49680 Len=1380
37002  15.428854 41.177.98.220 -> 244.3.185.135 TCP 157 ups-onlinet > health-trap [PSH, ACK] Seq=5567 Ack=7372 Win=49680 Len=99
37920  15.749767 41.177.98.220 -> 244.3.185.135 TCP 64 ups-onlinet > health-trap [ACK] Seq=5666 Ack=8444 Win=48608 Len=0
37987  15.757234 41.177.98.220 -> 244.3.185.135 TCP 137 ups-onlinet > health-trap [PSH, ACK] Seq=5666 Ack=8853 Win=49680 Len=79
37992  15.760392 41.177.98.220 -> 244.3.185.135 TCP 64 ups-onlinet > health-trap [ACK] Seq=5745 Ack=9925 Win=48608 Len=0
38040  15.777548 41.177.98.220 -> 244.3.185.135 TCP 939 ups-onlinet > health-trap [PSH, ACK] Seq=5745 Ack=10322 Win=49680 Len=881
38229  15.829918 41.177.98.220 -> 41.177.75.71 TCP 1438 dpserve > 63038 [ACK] Seq=23215 Ack=5803 Win=49680 Len=1380
38231  15.829927 41.177.98.220 -> 41.177.75.71 TCP 1104 dpserve > 63038 [PSH, ACK] Seq=24595 Ack=5803 Win=49680 Len=1046
38241  15.832384 41.177.98.220 -> 41.177.75.71 TCP 290 dpserve > 63038 [PSH, ACK] Seq=25641 Ack=5867 Win=49680 Len=232
38246  15.834311 41.177.98.220 -> 41.177.75.71 TCP 292 dpserve > 63038 [PSH, ACK] Seq=25873 Ack=5931 Win=49680 Len=234
38250  15.836210 41.177.98.220 -> 41.177.75.71 TCP 287 dpserve > 63038 [PSH, ACK] Seq=26107 Ack=5995 Win=49680 Len=229
38258  15.838110 41.177.98.220 -> 41.177.75.71 TCP 288 dpserve > 63038 [PSH, ACK] Seq=26336 Ack=6059 Win=49680 Len=230
38266  15.841113 41.177.98.220 -> 41.177.75.71 TCP 283 dpserve > 63038 [PSH, ACK] Seq=26566 Ack=6123 Win=49680 Len=225
38273  15.843022 41.177.98.220 -> 41.177.75.71 TCP 286 dpserve > 63038 [PSH, ACK] Seq=26791 Ack=6187 Win=49680 Len=228
38275  15.844966 41.177.98.220 -> 41.177.75.71 TCP 273 dpserve > 63038 [PSH, ACK] Seq=27019 Ack=6251 Win=49680 Len=215
38277  15.846896 41.177.98.220 -> 41.177.75.71 TCP 285 dpserve > 63038 [PSH, ACK] Seq=27234 Ack=6315 Win=49680 Len=227
38285  15.848814 41.177.98.220 -> 41.177.75.71 TCP 64 dpserve > 63038 [ACK] Seq=27461 Ack=6379 Win=49680 Len=0
38287  15.848858 41.177.98.220 -> 41.177.75.71 TCP 283 dpserve > 63038 [PSH, ACK] Seq=27461 Ack=6379 Win=49680 Len=225
38292  15.850746 41.177.98.220 -> 41.177.75.71 TCP 291 dpserve > 63038 [PSH, ACK] Seq=27686 Ack=6444 Win=49680 Len=233
38297  15.852662 41.177.98.220 -> 41.177.75.71 TCP 291 dpserve > 63038 [PSH, ACK] Seq=27919 Ack=6509 Win=49680 Len=233
38315  15.854575 41.177.98.220 -> 41.177.75.71 TCP 283 dpserve > 63038 [PSH, ACK] Seq=28152 Ack=6574 Win=49680 Len=225
38319  15.856479 41.177.98.220 -> 41.177.75.71 TCP 289 dpserve > 63038 [PSH, ACK] Seq=28377 Ack=6639 Win=49680 Len=231
38345  15.858402 41.177.98.220 -> 41.177.75.71 TCP 288 dpserve > 63038 [PSH, ACK] Seq=28608 Ack=6704 Win=49680 Len=230
38356  15.860299 41.177.98.220 -> 41.177.75.71 TCP 295 dpserve > 63038 [PSH, ACK] Seq=28838 Ack=6769 Win=49680 Len=237
38363  15.862204 41.177.98.220 -> 41.177.75.71 TCP 286 dpserve > 63038 [PSH, ACK] Seq=29075 Ack=6834 Win=49680 Len=228
38378  15.864884 41.177.98.220 -> 41.177.75.71 TCP 291 dpserve > 63038 [PSH, ACK] Seq=29303 Ack=6899 Win=49680 Len=233
38380  15.866813 41.177.98.220 -> 41.177.75.71 TCP 284 dpserve > 63038 [PSH, ACK] Seq=29536 Ack=6964 Win=49680 Len=226
38382  15.868712 41.177.98.220 -> 41.177.75.71 TCP 297 dpserve > 63038 [PSH, ACK] Seq=29762 Ack=7029 Win=49680 Len=239
38386  15.870624 41.177.98.220 -> 41.177.75.71 TCP 287 dpserve > 63038 [PSH, ACK] Seq=30001 Ack=7094 Win=49680 Len=229
38388  15.872537 41.177.98.220 -> 41.177.75.71 TCP 289 dpserve > 63038 [PSH, ACK] Seq=30230 Ack=7159 Win=49680 Len=231
38392  15.874431 41.177.98.220 -> 41.177.75.71 TCP 284 dpserve > 63038 [PSH, ACK] Seq=30461 Ack=7224 Win=49680 Len=226
38412  15.876317 41.177.98.220 -> 41.177.75.71 TCP 286 dpserve > 63038 [PSH, ACK] Seq=30687 Ack=7289 Win=49680 Len=228
38425  15.878208 41.177.98.220 -> 41.177.75.71 TCP 285 dpserve > 63038 [PSH, ACK] Seq=30915 Ack=7354 Win=49680 Len=227
38430  15.880098 41.177.98.220 -> 41.177.75.71 TCP 284 dpserve > 63038 [PSH, ACK] Seq=31142 Ack=7419 Win=49680 Len=226
38432  15.881988 41.177.98.220 -> 41.177.75.71 TCP 284 dpserve > 63038 [PSH, ACK] Seq=31368 Ack=7484 Win=49680 Len=226
38435  15.883997 41.177.98.220 -> 41.177.75.71 TCP 282 dpserve > 63038 [PSH, ACK] Seq=31594 Ack=7549 Win=49680 Len=224
38437  15.885893 41.177.98.220 -> 41.177.75.71 TCP 284 dpserve > 63038 [PSH, ACK] Seq=31818 Ack=7614 Win=49680 Len=226
38439  15.887793 41.177.98.220 -> 41.177.75.71 TCP 290 dpserve > 63038 [PSH, ACK] Seq=32044 Ack=7679 Win=49680 Len=232
38441  15.889690 41.177.98.220 -> 41.177.75.71 TCP 290 dpserve > 63038 [PSH, ACK] Seq=32276 Ack=7744 Win=49680 Len=232
38443  15.891573 41.177.98.220 -> 41.177.75.71 TCP 291 dpserve > 63038 [PSH, ACK] Seq=32508 Ack=7809 Win=49680 Len=233
38447  15.893461 41.177.98.220 -> 41.177.75.71 TCP 293 dpserve > 63038 [PSH, ACK] Seq=32741 Ack=7874 Win=49680 Len=235
38459  15.899290 41.177.98.220 -> 41.177.75.71 TCP 64 dpserve > 63038 [ACK] Seq=32976 Ack=7941 Win=49680 Len=0
38460  15.899322 41.177.98.220 -> 41.177.75.71 TCP 464 dpserve > 63038 [PSH, ACK] Seq=32976 Ack=7941 Win=49680 Len=406
38499  15.922232 41.177.98.220 -> 41.177.75.71 TCP 414 dpserve > 63038 [PSH, ACK] Seq=33382 Ack=8033 Win=49680 Len=356
38530  15.940998 41.177.98.220 -> 41.177.75.71 TCP 264 dpserve > 63038 [PSH, ACK] Seq=33738 Ack=8102 Win=49680 Len=206
38547  15.949971 41.177.98.220 -> 41.177.75.71 TCP 64 dpserve > 63038 [ACK] Seq=33944 Ack=8186 Win=49680 Len=0
38548  15.950012 41.177.98.220 -> 41.177.75.71 TCP 267 dpserve > 63038 [PSH, ACK] Seq=33944 Ack=8186 Win=49680 Len=209
38689  15.992678 41.177.98.220 -> 244.3.185.119 TCP 64 ups-onlinet > netobjects2 [ACK] Seq=1659 Ack=165 Win=49680 Len=0
38690  15.992785 41.177.98.220 -> 244.3.185.119 TCP 1332 ups-onlinet > netobjects2 [PSH, ACK] Seq=1659 Ack=165 Win=49680 Len=1274
39520  16.391767 41.177.98.220 -> 244.3.79.163 TCP 1438 ups-onlinet > mc-client [ACK] Seq=3378 Ack=3304 Win=48702 Len=1380
39521  16.391772 41.177.98.220 -> 244.3.79.163 TCP 1438 ups-onlinet > mc-client [ACK] Seq=4758 Ack=3304 Win=48702 Len=1380
39522  16.391797 41.177.98.220 -> 244.3.79.163 TCP 1438 ups-onlinet > mc-client [ACK] Seq=6138 Ack=3304 Win=48702 Len=1380
39523  16.391801 41.177.98.220 -> 244.3.79.163 TCP 1208 ups-onlinet > mc-client [PSH, ACK] Seq=7518 Ack=3304 Win=48702 Len=1150
39604  16.474503 41.177.98.220 -> 244.3.185.135 TCP 64 ups-onlinet > health-trap [ACK] Seq=6626 Ack=11394 Win=48608 Len=0
39611  16.488119 41.177.98.220 -> 244.3.79.163 TCP 1438 ups-onlinet > mc-client [ACK] Seq=8668 Ack=3375 Win=48702 Len=1380
39612  16.488123 41.177.98.220 -> 244.3.79.163 TCP 1438 ups-onlinet > mc-client [ACK] Seq=10048 Ack=3375 Win=48702 Len=1380
39613  16.488143 41.177.98.220 -> 244.3.79.163 TCP 1438 ups-onlinet > mc-client [ACK] Seq=11428 Ack=3375 Win=48702 Len=1380
39614  16.488147 41.177.98.220 -> 244.3.79.163 TCP 800 ups-onlinet > mc-client [PSH, ACK] Seq=12808 Ack=3375 Win=48702 Len=742
39671  16.506102 41.177.98.220 -> 244.3.79.163 TCP 1438 ups-onlinet > mc-client [ACK] Seq=13550 Ack=3447 Win=48702 Len=1380
39672  16.506107 41.177.98.220 -> 244.3.79.163 TCP 1438 ups-onlinet > mc-client [ACK] Seq=14930 Ack=3447 Win=48702 Len=1380
39673  16.506129 41.177.98.220 -> 244.3.79.163 TCP 1438 ups-onlinet > mc-client [ACK] Seq=16310 Ack=3447 Win=48702 Len=1380
39674  16.506133 41.177.98.220 -> 244.3.79.163 TCP 1043 ups-onlinet > mc-client [PSH, ACK] Seq=17690 Ack=3447 Win=48702 Len=985
39683  16.512413 41.177.98.220 -> 244.3.79.163 TCP 1438 ups-onlinet > mc-client [ACK] Seq=18675 Ack=3519 Win=48702 Len=1380
39684  16.512418 41.177.98.220 -> 244.3.79.163 TCP 1438 ups-onlinet > mc-client [ACK] Seq=20055 Ack=3519 Win=48702 Len=1380
39685  16.512437 41.177.98.220 -> 244.3.79.163 TCP 1438 ups-onlinet > mc-client [ACK] Seq=21435 Ack=3519 Win=48702 Len=1380
39686  16.512441 41.177.98.220 -> 244.3.79.163 TCP 795 ups-onlinet > mc-client [PSH, ACK] Seq=22815 Ack=3519 Win=48702 Len=737
39697  16.518975 41.177.98.220 -> 244.3.79.163 TCP 1438 ups-onlinet > mc-client [ACK] Seq=23552 Ack=3591 Win=48702 Len=1380
39698  16.519000 41.177.98.220 -> 244.3.79.163 TCP 1438 ups-onlinet > mc-client [ACK] Seq=24932 Ack=3591 Win=48702 Len=1380
39699  16.519028 41.177.98.220 -> 244.3.79.163 TCP 1438 ups-onlinet > mc-client [ACK] Seq=26312 Ack=3591 Win=48702 Len=1380
39700  16.519032 41.177.98.220 -> 244.3.79.163 TCP 1082 ups-onlinet > mc-client [PSH, ACK] Seq=27692 Ack=3591 Win=48702 Len=1024
39716  16.525973 41.177.98.220 -> 244.3.79.163 TCP 1438 ups-onlinet > mc-client [ACK] Seq=28716 Ack=3663 Win=48702 Len=1380
39717  16.525978 41.177.98.220 -> 244.3.79.163 TCP 1438 ups-onlinet > mc-client [ACK] Seq=30096 Ack=3663 Win=48702 Len=1380
39719  16.525985 41.177.98.220 -> 244.3.79.163 TCP 1438 ups-onlinet > mc-client [ACK] Seq=31476 Ack=3663 Win=48702 Len=1380
39720  16.525989 41.177.98.220 -> 244.3.79.163 TCP 1088 ups-onlinet > mc-client [PSH, ACK] Seq=32856 Ack=3663 Win=48702 Len=1030
39729  16.528151 41.177.98.220 -> 244.3.185.135 TCP 64 ups-onlinet > health-trap [ACK] Seq=6626 Ack=11844 Win=49680 Len=0
39774  16.532461 41.177.98.220 -> 244.3.79.163 TCP 1438 ups-onlinet > mc-client [ACK] Seq=33886 Ack=3735 Win=48702 Len=1380
39775  16.532483 41.177.98.220 -> 244.3.79.163 TCP 1438 ups-onlinet > mc-client [ACK] Seq=35266 Ack=3735 Win=48702 Len=1380
39776  16.532512 41.177.98.220 -> 244.3.79.163 TCP 1438 ups-onlinet > mc-client [ACK] Seq=36646 Ack=3735 Win=48702 Len=1380
39777  16.532516 41.177.98.220 -> 244.3.79.163 TCP 1189 ups-onlinet > mc-client [PSH, ACK] Seq=38026 Ack=3735 Win=48702 Len=1131
39786  16.538866 41.177.98.220 -> 244.3.79.163 TCP 1438 ups-onlinet > mc-client [ACK] Seq=39157 Ack=3807 Win=48702 Len=1380
39787  16.538891 41.177.98.220 -> 244.3.79.163 TCP 1438 ups-onlinet > mc-client [ACK] Seq=40537 Ack=3807 Win=48702 Len=1380
39788  16.538923 41.177.98.220 -> 244.3.79.163 TCP 1438 ups-onlinet > mc-client [ACK] Seq=41917 Ack=3807 Win=48702 Len=1380
39789  16.538927 41.177.98.220 -> 244.3.79.163 TCP 1231 ups-onlinet > mc-client [PSH, ACK] Seq=43297 Ack=3807 Win=48702 Len=1173
39802  16.545635 41.177.98.220 -> 244.3.79.163 TCP 1438 ups-onlinet > mc-client [ACK] Seq=44470 Ack=3879 Win=48702 Len=1380
39803  16.545639 41.177.98.220 -> 244.3.79.163 TCP 1438 ups-onlinet > mc-client [ACK] Seq=45850 Ack=3879 Win=48702 Len=1380
39804  16.545665 41.177.98.220 -> 244.3.79.163 TCP 1438 ups-onlinet > mc-client [ACK] Seq=47230 Ack=3879 Win=48702 Len=1380
39805  16.545669 41.177.98.220 -> 244.3.79.163 TCP 1261 ups-onlinet > mc-client [PSH, ACK] Seq=48610 Ack=3879 Win=48702 Len=1203
39835  16.551969 41.177.98.220 -> 244.3.79.163 TCP 1438 ups-onlinet > mc-client [ACK] Seq=49813 Ack=3951 Win=48702 Len=1380
39836  16.551995 41.177.98.220 -> 244.3.79.163 TCP 1438 ups-onlinet > mc-client [ACK] Seq=51193 Ack=3951 Win=48702 Len=1380
39837  16.552022 41.177.98.220 -> 244.3.79.163 TCP 1438 ups-onlinet > mc-client [ACK] Seq=52573 Ack=3951 Win=48702 Len=1380
39838  16.552027 41.177.98.220 -> 244.3.79.163 TCP 1011 ups-onlinet > mc-client [PSH, ACK] Seq=53953 Ack=3951 Win=48702 Len=953
39855  16.558180 41.177.98.220 -> 244.3.79.163 TCP 378 ups-onlinet > mc-client [PSH, ACK] Seq=54906 Ack=4023 Win=48702 Len=320
39989  16.624285 41.177.98.220 -> 244.3.185.135 TCP 1438 ups-onlinet > health-trap [ACK] Seq=6626 Ack=11844 Win=49680 Len=1380
39990  16.624295 41.177.98.220 -> 244.3.185.135 TCP 271 ups-onlinet > health-trap [PSH, ACK] Seq=8006 Ack=11844 Win=49680 Len=213
40814  17.048263 41.177.98.220 -> 244.3.93.177 TCP 527 ups-onlinet > ardus-trns [PSH, ACK] Seq=1 Ack=71 Win=49680 Len=469
41639  17.361826 41.177.98.220 -> 244.3.93.177 TCP 305 ups-onlinet > ardus-trns [PSH, ACK] Seq=470 Ack=143 Win=49680 Len=247
42131  17.519965 41.177.98.220 -> 244.3.93.177 TCP 179 ups-onlinet > ardus-trns [PSH, ACK] Seq=717 Ack=215 Win=49680 Len=121
42139  17.522928 41.177.98.220 -> 244.3.93.177 TCP 128 ups-onlinet > ardus-trns [PSH, ACK] Seq=838 Ack=286 Win=49680 Len=70
42143  17.525283 41.177.98.220 -> 244.3.93.177 TCP 141 ups-onlinet > ardus-trns [PSH, ACK] Seq=908 Ack=359 Win=49680 Len=83
43655  18.494154 41.177.98.220 -> 41.177.92.145 TCP 166 op-probe > metaagent [PSH, ACK] Seq=1484 Ack=673 Win=49640 Len=108
43732  18.528146 41.177.98.220 -> 41.177.92.145 TCP 64 op-probe > metaagent [ACK] Seq=1592 Ack=863 Win=49640 Len=0
44059  18.617586 41.177.98.220 -> 41.177.92.145 TCP 276 op-probe > metaagent [PSH, ACK] Seq=1592 Ack=863 Win=49640 Len=218
44977  18.828591 41.177.98.220 -> 244.3.185.235 TCP 647 ups-onlinet > icon-discover [PSH, ACK] Seq=1 Ack=573 Win=49680 Len=589
45223  18.913295 41.177.98.220 -> 244.3.185.235 TCP 138 ups-onlinet > icon-discover [PSH, ACK] Seq=590 Ack=1163 Win=49680 Len=80
45283  18.958218 41.177.98.220 -> 244.3.185.235 TCP 64 ups-onlinet > icon-discover [ACK] Seq=670 Ack=1740 Win=49680 Len=0
45398  19.011526 41.177.98.220 -> 244.3.185.235 TCP 698 ups-onlinet > icon-discover [PSH, ACK] Seq=670 Ack=1740 Win=49680 Len=640
46401  19.377078 41.177.98.220 -> 41.177.75.71 TCP 1438 ups-onlinet > 58087 [ACK] Seq=1 Ack=75 Win=49680 Len=1380
46402  19.377083 41.177.98.220 -> 41.177.75.71 TCP 309 ups-onlinet > 58087 [PSH, ACK] Seq=1381 Ack=75 Win=49680 Len=251
47977  19.719528 41.177.98.220 -> 244.3.79.176 TCP 64 ups-onlinet > rap-listen [ACK] Seq=1 Ack=53 Win=49680 Len=0
48407  19.818239 41.177.98.220 -> 244.3.185.176 TCP 135 ups-onlinet > digital-notary [PSH, ACK] Seq=4646 Ack=6321 Win=49680 Len=77
48420  19.820226 41.177.98.220 -> 244.3.185.176 TCP 219 ups-onlinet > digital-notary [PSH, ACK] Seq=4723 Ack=6477 Win=49680 Len=161
49148  20.002744 41.177.98.220 -> 244.3.185.235 TCP 64 ups-onlinet > icon-discover [ACK] Seq=1310 Ack=2377 Win=49680 Len=0
49634  20.150453 41.177.98.220 -> 244.3.185.235 TCP 747 ups-onlinet > icon-discover [PSH, ACK] Seq=1310 Ack=2377 Win=49680 Len=689
54198  22.452743 41.177.98.220 -> 244.3.142.57 TCP 1309 ups-onlinet > idmaps [PSH, ACK] Seq=2717 Ack=4846 Win=49640 Len=1251
54671  22.647685 41.177.98.220 -> 244.3.142.57 TCP 138 ups-onlinet > idmaps [PSH, ACK] Seq=3968 Ack=6098 Win=49640 Len=80
54880  22.698168 41.177.98.220 -> 244.3.142.57 TCP 64 ups-onlinet > idmaps [ACK] Seq=4048 Ack=7389 Win=49640 Len=0
55283  22.833440 41.177.98.220 -> 244.3.79.176 TCP 1438 ups-onlinet > rap-listen [ACK] Seq=1 Ack=53 Win=49680 Len=1380
55284  22.833445 41.177.98.220 -> 244.3.79.176 TCP 1438 ups-onlinet > rap-listen [ACK] Seq=1381 Ack=53 Win=49680 Len=1380
55285  22.833460 41.177.98.220 -> 244.3.79.176 TCP 1438 ups-onlinet > rap-listen [ACK] Seq=2761 Ack=53 Win=49680 Len=1380
55286  22.833484 41.177.98.220 -> 244.3.79.176 TCP 1438 ups-onlinet > rap-listen [ACK] Seq=4141 Ack=53 Win=49680 Len=1380
55287  22.833507 41.177.98.220 -> 244.3.79.176 TCP 1438 ups-onlinet > rap-listen [ACK] Seq=5521 Ack=53 Win=49680 Len=1380
55288  22.833532 41.177.98.220 -> 244.3.79.176 TCP 1438 ups-onlinet > rap-listen [ACK] Seq=6901 Ack=53 Win=49680 Len=1380
55289  22.833580 41.177.98.220 -> 244.3.79.176 TCP 1438 ups-onlinet > rap-listen [ACK] Seq=8281 Ack=53 Win=49680 Len=1380
55290  22.833584 41.177.98.220 -> 244.3.79.176 TCP 1438 ups-onlinet > rap-listen [ACK] Seq=9661 Ack=53 Win=49680 Len=1380
55291  22.833595 41.177.98.220 -> 244.3.79.176 TCP 1438 ups-onlinet > rap-listen [ACK] Seq=11041 Ack=53 Win=49680 Len=1380
55292  22.833617 41.177.98.220 -> 244.3.79.176 TCP 1438 ups-onlinet > rap-listen [ACK] Seq=12421 Ack=53 Win=49680 Len=1380
55293  22.833641 41.177.98.220 -> 244.3.79.176 TCP 1438 ups-onlinet > rap-listen [ACK] Seq=13801 Ack=53 Win=49680 Len=1380
55294  22.833664 41.177.98.220 -> 244.3.79.176 TCP 1438 ups-onlinet > rap-listen [ACK] Seq=15181 Ack=53 Win=49680 Len=1380
55295  22.833688 41.177.98.220 -> 244.3.79.176 TCP 1438 ups-onlinet > rap-listen [ACK] Seq=16561 Ack=53 Win=49680 Len=1380
55296  22.833709 41.177.98.220 -> 244.3.79.176 TCP 1438 ups-onlinet > rap-listen [ACK] Seq=17941 Ack=53 Win=49680 Len=1380
55297  22.833713 41.177.98.220 -> 244.3.79.176 TCP 724 ups-onlinet > rap-listen [PSH, ACK] Seq=19321 Ack=53 Win=49680 Len=666
55746  22.943853 41.177.98.220 -> 244.3.142.57 TCP 1511 ups-onlinet > idmaps [PSH, ACK] Seq=4048 Ack=7389 Win=49640 Len=1453
57193  23.419228 41.177.98.220 -> 244.3.185.121 TCP 156 ups-onlinet > caspssl [PSH, ACK] Seq=4912 Ack=5434 Win=49680 Len=98
57197  23.421271 41.177.98.220 -> 244.3.185.121 TCP 278 ups-onlinet > caspssl [PSH, ACK] Seq=5010 Ack=5637 Win=49680 Len=220
57253  23.441942 41.177.98.220 -> 244.3.185.121 TCP 147 ups-onlinet > caspssl [PSH, ACK] Seq=5230 Ack=5710 Win=49680 Len=89
57390  23.474862 41.177.98.220 -> 244.3.185.121 TCP 64 ups-onlinet > caspssl [ACK] Seq=5319 Ack=5959 Win=49680 Len=0
57391  23.474912 41.177.98.220 -> 244.3.185.121 TCP 365 ups-onlinet > caspssl [PSH, ACK] Seq=5319 Ack=5959 Win=49680 Len=307
59729  24.068837 41.177.98.220 -> 244.3.199.164 TCP 158 ups-onlinet > bbn-mmc [PSH, ACK] Seq=1215 Ack=966 Win=49680 Len=100
59752  24.071171 41.177.98.220 -> 244.3.199.164 TCP 342 ups-onlinet > bbn-mmc [PSH, ACK] Seq=1315 Ack=1233 Win=49680 Len=284
59858  24.105473 41.177.98.220 -> 244.3.199.164 TCP 147 ups-onlinet > bbn-mmc [PSH, ACK] Seq=1599 Ack=1304 Win=49680 Len=89
59895  24.128165 41.177.98.220 -> 244.3.199.164 TCP 64 ups-onlinet > bbn-mmc [ACK] Seq=1688 Ack=1615 Win=49680 Len=0
59917  24.136289 41.177.98.220 -> 244.3.199.164 TCP 429 ups-onlinet > bbn-mmc [PSH, ACK] Seq=1688 Ack=1615 Win=49680 Len=371
60643  24.564336 41.177.98.220 -> 244.3.185.121 TCP 345 ups-onlinet > caspssl [PSH, ACK] Seq=5626 Ack=6031 Win=49680 Len=287
60773  24.663686 41.177.98.220 -> 244.3.185.119 TCP 190 ups-onlinet > netobjects2 [PSH, ACK] Seq=2933 Ack=243 Win=49680 Len=132
60855  24.718181 41.177.98.220 -> 244.3.185.119 TCP 64 ups-onlinet > netobjects2 [ACK] Seq=3065 Ack=318 Win=49680 Len=0
60860  24.722590 41.177.98.220 -> 244.3.185.119 TCP 553 ups-onlinet > netobjects2 [PSH, ACK] Seq=3065 Ack=318 Win=49680 Len=495
60898  24.768424 41.177.98.220 -> 244.3.185.119 TCP 354 ups-onlinet > netobjects2 [PSH, ACK] Seq=3560 Ack=390 Win=49680 Len=296
61912  25.374947 41.177.98.220 -> 244.3.3.249  TCP 407 ups-onlinet > rdrmshc [PSH, ACK] Seq=1 Ack=97 Win=49680 Len=349
62031  25.448429 41.177.98.220 -> 244.3.3.249  TCP 64 ups-onlinet > rdrmshc [ACK] Seq=350 Ack=170 Win=49680 Len=0
62032  25.448518 41.177.98.220 -> 244.3.3.249  TCP 1124 ups-onlinet > rdrmshc [PSH, ACK] Seq=350 Ack=170 Win=49680 Len=1066
62468  25.661104 41.177.98.220 -> 244.3.185.121 TCP 128 ups-onlinet > caspssl [PSH, ACK] Seq=5913 Ack=6102 Win=49680 Len=70
62483  25.685772 41.177.98.220 -> 244.3.185.121 TCP 345 ups-onlinet > caspssl [PSH, ACK] Seq=5983 Ack=6174 Win=49680 Len=287
62786  25.838308 41.177.98.220 -> 244.3.199.164 TCP 332 ups-onlinet > bbn-mmc [PSH, ACK] Seq=2059 Ack=1687 Win=49680 Len=274
64109  26.448214 41.177.98.220 -> 244.3.185.119 TCP 64 ups-onlinet > netobjects2 [ACK] Seq=3856 Ack=465 Win=49680 Len=0
64340  26.560784 41.177.98.220 -> 244.3.185.119 TCP 492 ups-onlinet > netobjects2 [PSH, ACK] Seq=3856 Ack=465 Win=49680 Len=434
64389  26.587583 41.177.98.220 -> 244.3.185.119 TCP 492 ups-onlinet > netobjects2 [PSH, ACK] Seq=4290 Ack=535 Win=49680 Len=434
64436  26.614903 41.177.98.220 -> 244.3.185.119 TCP 354 ups-onlinet > netobjects2 [PSH, ACK] Seq=4724 Ack=607 Win=49680 Len=296
65000  26.816237 41.177.98.220 -> 244.3.185.119 TCP 141 ups-onlinet > netobjects2 [PSH, ACK] Seq=5020 Ack=680 Win=49680 Len=83
67738  27.885094 41.177.98.220 -> 244.3.199.51 TCP 174 ups-onlinet > resacommunity [PSH, ACK] Seq=1 Ack=161 Win=49680 Len=116
68012  27.975234 41.177.98.220 -> 244.3.199.164 TCP 259 ups-onlinet > bbn-mmc [PSH, ACK] Seq=2333 Ack=1765 Win=49680 Len=201
68185  28.063164 41.177.98.220 -> 244.3.185.119 TCP 179 ups-onlinet > netobjects2 [PSH, ACK] Seq=5103 Ack=752 Win=49680 Len=121
68212  28.073145 41.177.98.220 -> 244.3.185.119 TCP 699 ups-onlinet > netobjects2 [PSH, ACK] Seq=5224 Ack=817 Win=49680 Len=641
