51975  21.413040 41.177.186.56 -> 244.3.160.239 TCP 82 7461 > http [SYN] Seq=0 Win=65535 Len=0 MSS=1460 WS=8 TSval=591597811 TSecr=0 SACK_PERM=1
51978  21.414102 41.177.186.56 -> 244.3.160.239 TCP 70 7461 > http [ACK] Seq=1 Ack=1 Win=524280 Len=0 TSval=591597811 TSecr=1511936642
51994  21.421776 41.177.186.56 -> 244.3.160.239 TCP 70 7461 > http [ACK] Seq=1329 Ack=688 Win=524280 Len=0 TSval=591597811 TSecr=1511936642
51995  21.421780 41.177.186.56 -> 244.3.160.239 TCP 70 7461 > http [ACK] Seq=1329 Ack=689 Win=524280 Len=0 TSval=591597811 TSecr=1511936642
51999  21.422814 41.177.186.56 -> 244.3.160.239 TCP 70 7461 > http [FIN, ACK] Seq=1329 Ack=689 Win=524280 Len=0 TSval=591597811 TSecr=1511936642
52007  21.424635 41.177.186.56 -> 244.3.160.239 TCP 82 jmact6 > http [SYN] Seq=0 Win=65535 Len=0 MSS=1460 WS=8 TSval=591597811 TSecr=0 SACK_PERM=1
52013  21.425645 41.177.186.56 -> 244.3.160.239 TCP 70 jmact6 > http [ACK] Seq=1 Ack=1 Win=524280 Len=0 TSval=591597811 TSecr=1511936643
52034  21.433285 41.177.186.56 -> 244.3.160.239 TCP 70 jmact6 > http [ACK] Seq=1381 Ack=607 Win=524280 Len=0 TSval=591597812 TSecr=1511936643
52035  21.433308 41.177.186.56 -> 244.3.160.239 TCP 70 jmact6 > http [ACK] Seq=1381 Ack=608 Win=524280 Len=0 TSval=591597812 TSecr=1511936643
52036  21.433854 41.177.186.56 -> 244.3.160.239 TCP 70 jmact6 > http [FIN, ACK] Seq=1381 Ack=608 Win=524280 Len=0 TSval=591597812 TSecr=1511936643
52047  21.439841 41.177.186.56 -> 244.3.160.239 TCP 82 8062 > http [SYN] Seq=0 Win=65535 Len=0 MSS=1460 WS=8 TSval=591597812 TSecr=0 SACK_PERM=1
52051  21.440948 41.177.186.56 -> 244.3.160.239 TCP 70 8062 > http [ACK] Seq=1 Ack=1 Win=524280 Len=0 TSval=591597812 TSecr=1511936644
52063  21.443039 41.177.186.56 -> 244.3.160.239 TCP 77 [TCP segment of a reassembled PDU]
52862  22.069738 41.177.186.56 -> 244.3.160.239 TCP 70 8062 > http [ACK] Seq=1456 Ack=2150 Win=523472 Len=0 TSval=591597818 TSecr=1511936707
52866  22.070825 41.177.186.56 -> 244.3.160.239 TCP 70 8062 > http [ACK] Seq=1456 Ack=4199 Win=523568 Len=0 TSval=591597818 TSecr=1511936707
52873  22.072619 41.177.186.56 -> 244.3.160.239 TCP 70 8062 > http [ACK] Seq=1456 Ack=6248 Win=523568 Len=0 TSval=591597818 TSecr=1511936707
52882  22.074191 41.177.186.56 -> 244.3.160.239 TCP 70 8062 > http [ACK] Seq=1456 Ack=8307 Win=523560 Len=0 TSval=591597818 TSecr=1511936707
52890  22.076210 41.177.186.56 -> 244.3.160.239 TCP 70 8062 > http [ACK] Seq=1456 Ack=10356 Win=523568 Len=0 TSval=591597818 TSecr=1511936708
52901  22.078013 41.177.186.56 -> 244.3.160.239 TCP 70 8062 > http [ACK] Seq=1456 Ack=12425 Win=524280 Len=0 TSval=591597818 TSecr=1511936708
52906  22.079127 41.177.186.56 -> 244.3.160.239 TCP 70 8062 > http [ACK] Seq=1456 Ack=14475 Win=523568 Len=0 TSval=591597818 TSecr=1511936708
52914  22.080734 41.177.186.56 -> 244.3.160.239 TCP 70 8062 > http [ACK] Seq=1456 Ack=16561 Win=523536 Len=0 TSval=591597818 TSecr=1511936708
52919  22.082016 41.177.186.56 -> 244.3.160.239 TCP 70 8062 > http [ACK] Seq=1456 Ack=18610 Win=523568 Len=0 TSval=591597818 TSecr=1511936708
52930  22.084072 41.177.186.56 -> 244.3.160.239 TCP 70 8062 > http [ACK] Seq=1456 Ack=20659 Win=523568 Len=0 TSval=591597818 TSecr=1511936708
52931  22.084639 41.177.186.56 -> 244.3.160.239 TCP 70 8062 > http [ACK] Seq=1456 Ack=22708 Win=524280 Len=0 TSval=591597818 TSecr=1511936709
52937  22.086325 41.177.186.56 -> 244.3.160.239 TCP 70 8062 > http [ACK] Seq=1456 Ack=24757 Win=523568 Len=0 TSval=591597818 TSecr=1511936709
52944  22.087929 41.177.186.56 -> 244.3.160.239 TCP 70 8062 > http [ACK] Seq=1456 Ack=26810 Win=523568 Len=0 TSval=591597818 TSecr=1511936709
52947  22.089136 41.177.186.56 -> 244.3.160.239 TCP 70 8062 > http [ACK] Seq=1456 Ack=28859 Win=523568 Len=0 TSval=591597818 TSecr=1511936709
52952  22.090723 41.177.186.56 -> 244.3.160.239 TCP 70 8062 > http [ACK] Seq=1456 Ack=30919 Win=523560 Len=0 TSval=591597818 TSecr=1511936709
52954  22.091862 41.177.186.56 -> 244.3.160.239 TCP 70 8062 > http [ACK] Seq=1456 Ack=32968 Win=523568 Len=0 TSval=591597818 TSecr=1511936709
52961  22.093518 41.177.186.56 -> 244.3.160.239 TCP 70 8062 > http [ACK] Seq=1456 Ack=35017 Win=523568 Len=0 TSval=591597818 TSecr=1511936709
52963  22.094697 41.177.186.56 -> 244.3.160.239 TCP 70 8062 > http [ACK] Seq=1456 Ack=37066 Win=524280 Len=0 TSval=591597818 TSecr=1511936710
52973  22.096342 41.177.186.56 -> 244.3.160.239 TCP 70 8062 > http [ACK] Seq=1456 Ack=39115 Win=523568 Len=0 TSval=591597818 TSecr=1511936710
52977  22.097447 41.177.186.56 -> 244.3.160.239 TCP 70 8062 > http [ACK] Seq=1456 Ack=41046 Win=523688 Len=0 TSval=591597818 TSecr=1511936710
52982  22.102047 41.177.186.56 -> 244.3.160.239 TCP 82 jdl-dbkitchen > http [SYN] Seq=0 Win=65535 Len=0 MSS=1460 WS=8 TSval=591597818 TSecr=0 SACK_PERM=1
52984  22.103181 41.177.186.56 -> 244.3.160.239 TCP 70 jdl-dbkitchen > http [ACK] Seq=1 Ack=1 Win=524280 Len=0 TSval=591597818 TSecr=1511936710
52985  22.103439 41.177.186.56 -> 244.3.160.239 TCP 82 6952 > http [SYN] Seq=0 Win=65535 Len=0 MSS=1460 WS=8 TSval=591597818 TSecr=0 SACK_PERM=1
52988  22.104218 41.177.186.56 -> 244.3.160.239 TCP 82 xprint-server > http [SYN] Seq=0 Win=65535 Len=0 MSS=1460 WS=8 TSval=591597818 TSecr=0 SACK_PERM=1
52991  22.104752 41.177.186.56 -> 244.3.160.239 TCP 82 8063 > http [SYN] Seq=0 Win=65535 Len=0 MSS=1460 WS=8 TSval=591597818 TSecr=0 SACK_PERM=1
52992  22.104857 41.177.186.56 -> 244.3.160.239 TCP 70 6952 > http [ACK] Seq=1 Ack=1 Win=524280 Len=0 TSval=591597818 TSecr=1511936711
52994  22.105436 41.177.186.56 -> 244.3.160.239 TCP 70 xprint-server > http [ACK] Seq=1 Ack=1 Win=524280 Len=0 TSval=591597818 TSecr=1511936711
53005  22.106316 41.177.186.56 -> 244.3.160.239 TCP 70 8063 > http [ACK] Seq=1 Ack=1 Win=524280 Len=0 TSval=591597818 TSecr=1511936711
53033  22.109149 41.177.186.56 -> 244.3.160.239 TCP 70 8062 > http [ACK] Seq=1456 Ack=43095 Win=523568 Len=0 TSval=591597818 TSecr=1511936711
53048  22.110800 41.177.186.56 -> 244.3.160.239 TCP 70 8062 > http [ACK] Seq=1456 Ack=45144 Win=523568 Len=0 TSval=591597818 TSecr=1511936711
53052  22.111920 41.177.186.56 -> 244.3.160.239 TCP 70 8062 > http [ACK] Seq=1456 Ack=47193 Win=523568 Len=0 TSval=591597818 TSecr=1511936711
53068  22.113699 41.177.186.56 -> 244.3.160.239 TCP 70 8062 > http [ACK] Seq=1456 Ack=49242 Win=523568 Len=0 TSval=591597818 TSecr=1511936711
53081  22.115000 41.177.186.56 -> 244.3.160.239 TCP 70 8062 > http [ACK] Seq=1456 Ack=51291 Win=523568 Len=0 TSval=591597818 TSecr=1511936712
53085  22.115548 41.177.186.56 -> 244.3.160.239 TCP 70 6952 > http [ACK] Seq=1047 Ack=295 Win=524280 Len=0 TSval=591597818 TSecr=1511936712
53086  22.115552 41.177.186.56 -> 244.3.160.239 TCP 70 6952 > http [ACK] Seq=1047 Ack=296 Win=524280 Len=0 TSval=591597818 TSecr=1511936712
53087  22.115623 41.177.186.56 -> 244.3.160.239 TCP 70 6952 > http [FIN, ACK] Seq=1047 Ack=296 Win=524280 Len=0 TSval=591597818 TSecr=1511936712
53094  22.116862 41.177.186.56 -> 244.3.160.239 TCP 70 8062 > http [ACK] Seq=1456 Ack=53386 Win=523528 Len=0 TSval=591597818 TSecr=1511936712
53095  22.116866 41.177.186.56 -> 244.3.160.239 TCP 70 jdl-dbkitchen > http [ACK] Seq=1031 Ack=333 Win=524280 Len=0 TSval=591597818 TSecr=1511936712
53096  22.116870 41.177.186.56 -> 244.3.160.239 TCP 70 jdl-dbkitchen > http [ACK] Seq=1031 Ack=334 Win=524280 Len=0 TSval=591597818 TSecr=1511936712
53103  22.117527 41.177.186.56 -> 244.3.160.239 TCP 70 jdl-dbkitchen > http [FIN, ACK] Seq=1031 Ack=334 Win=524280 Len=0 TSval=591597818 TSecr=1511936712
53110  22.118191 41.177.186.56 -> 244.3.160.239 TCP 70 8062 > http [ACK] Seq=1456 Ack=55435 Win=523568 Len=0 TSval=591597818 TSecr=1511936712
53125  22.120321 41.177.186.56 -> 244.3.160.239 TCP 70 8062 > http [ACK] Seq=1456 Ack=57486 Win=523568 Len=0 TSval=591597818 TSecr=1511936712
53132  22.121582 41.177.186.56 -> 244.3.160.239 TCP 70 8062 > http [ACK] Seq=1456 Ack=59535 Win=524280 Len=0 TSval=591597818 TSecr=1511936712
53133  22.121615 41.177.186.56 -> 244.3.160.239 TCP 70 xprint-server > http [ACK] Seq=1047 Ack=2050 Win=524280 Len=0 TSval=591597818 TSecr=1511936712
53140  22.122421 41.177.186.56 -> 244.3.160.239 TCP 70 xprint-server > http [ACK] Seq=1047 Ack=4099 Win=524280 Len=0 TSval=591597818 TSecr=1511936712
53147  22.123170 41.177.186.56 -> 244.3.160.239 TCP 70 8062 > http [ACK] Seq=1456 Ack=61584 Win=524280 Len=0 TSval=591597818 TSecr=1511936712
53148  22.123580 41.177.186.56 -> 244.3.160.239 TCP 70 xprint-server > http [ACK] Seq=1047 Ack=6148 Win=523568 Len=0 TSval=591597818 TSecr=1511936712
53157  22.124348 41.177.186.56 -> 244.3.160.239 TCP 70 8062 > http [ACK] Seq=1456 Ack=63647 Win=523560 Len=0 TSval=591597818 TSecr=1511936712
53159  22.124869 41.177.186.56 -> 244.3.160.239 TCP 70 xprint-server > http [ACK] Seq=1047 Ack=8197 Win=523568 Len=0 TSval=591597818 TSecr=1511936713
53161  22.124986 41.177.186.56 -> 244.3.160.239 TCP 70 xprint-server > http [ACK] Seq=1047 Ack=8301 Win=523464 Len=0 TSval=591597818 TSecr=1511936713
53162  22.124991 41.177.186.56 -> 244.3.160.239 TCP 70 xprint-server > http [ACK] Seq=1047 Ack=8302 Win=523464 Len=0 TSval=591597818 TSecr=1511936713
53163  22.125178 41.177.186.56 -> 244.3.160.239 TCP 70 xprint-server > http [FIN, ACK] Seq=1047 Ack=8302 Win=524280 Len=0 TSval=591597818 TSecr=1511936713
53165  22.125618 41.177.186.56 -> 244.3.160.239 TCP 70 8062 > http [ACK] Seq=1456 Ack=65707 Win=523560 Len=0 TSval=591597818 TSecr=1511936713
53176  22.127456 41.177.186.56 -> 244.3.160.239 TCP 70 8062 > http [ACK] Seq=1456 Ack=67756 Win=523568 Len=0 TSval=591597818 TSecr=1511936713
53179  22.128580 41.177.186.56 -> 244.3.160.239 TCP 70 8063 > http [ACK] Seq=1028 Ack=2050 Win=523568 Len=0 TSval=591597818 TSecr=1511936713
53180  22.128616 41.177.186.56 -> 244.3.160.239 TCP 70 8063 > http [ACK] Seq=1028 Ack=3163 Win=522456 Len=0 TSval=591597818 TSecr=1511936713
53181  22.128621 41.177.186.56 -> 244.3.160.239 TCP 70 8063 > http [ACK] Seq=1028 Ack=3164 Win=522456 Len=0 TSval=591597818 TSecr=1511936713
53182  22.128791 41.177.186.56 -> 244.3.160.239 TCP 70 8062 > http [ACK] Seq=1456 Ack=69805 Win=521520 Len=0 TSval=591597818 TSecr=1511936713
53187  22.129236 41.177.186.56 -> 244.3.160.239 TCP 70 8063 > http [FIN, ACK] Seq=1028 Ack=3164 Win=524280 Len=0 TSval=591597818 TSecr=1511936713
53190  22.130397 41.177.186.56 -> 244.3.160.239 TCP 70 8062 > http [ACK] Seq=1456 Ack=71854 Win=523568 Len=0 TSval=591597819 TSecr=1511936713
53196  22.132149 41.177.186.56 -> 244.3.160.239 TCP 70 8062 > http [ACK] Seq=1456 Ack=73903 Win=523568 Len=0 TSval=591597819 TSecr=1511936713
53197  22.133178 41.177.186.56 -> 244.3.160.239 TCP 70 8062 > http [ACK] Seq=1456 Ack=75952 Win=523568 Len=0 TSval=591597819 TSecr=1511936713
53201  22.134933 41.177.186.56 -> 244.3.160.239 TCP 70 8062 > http [ACK] Seq=1456 Ack=78001 Win=523568 Len=0 TSval=591597819 TSecr=1511936714
53206  22.136620 41.177.186.56 -> 244.3.160.239 TCP 70 8062 > http [ACK] Seq=1456 Ack=80050 Win=523568 Len=0 TSval=591597819 TSecr=1511936714
53211  22.138268 41.177.186.56 -> 244.3.160.239 TCP 70 8062 > http [ACK] Seq=1456 Ack=82099 Win=523568 Len=0 TSval=591597819 TSecr=1511936714
53214  22.138771 41.177.186.56 -> 244.3.160.239 TCP 82 8667 > http [SYN] Seq=0 Win=65535 Len=0 MSS=1460 WS=8 TSval=591597819 TSecr=0 SACK_PERM=1
53220  22.139533 41.177.186.56 -> 244.3.160.239 TCP 70 8062 > http [ACK] Seq=1456 Ack=84148 Win=523568 Len=0 TSval=591597819 TSecr=1511936714
53221  22.139538 41.177.186.56 -> 244.3.160.239 TCP 70 8062 > http [ACK] Seq=1456 Ack=84401 Win=523320 Len=0 TSval=591597819 TSecr=1511936714
53222  22.139542 41.177.186.56 -> 244.3.160.239 TCP 70 8062 > http [ACK] Seq=1456 Ack=84402 Win=523320 Len=0 TSval=591597819 TSecr=1511936714
53232  22.140197 41.177.186.56 -> 244.3.160.239 TCP 70 8667 > http [ACK] Seq=1 Ack=1 Win=524280 Len=0 TSval=591597819 TSecr=1511936714
53238  22.140866 41.177.186.56 -> 244.3.160.239 TCP 70 8062 > http [FIN, ACK] Seq=1456 Ack=84402 Win=524280 Len=0 TSval=591597819 TSecr=1511936714
53246  22.141478 41.177.186.56 -> 244.3.160.239 TCP 82 14934 > http [SYN] Seq=0 Win=65535 Len=0 MSS=1460 WS=8 TSval=591597819 TSecr=0 SACK_PERM=1
53248  22.142116 41.177.186.56 -> 244.3.160.239 TCP 82 14640 > http [SYN] Seq=0 Win=65535 Len=0 MSS=1460 WS=8 TSval=591597819 TSecr=0 SACK_PERM=1
53252  22.142702 41.177.186.56 -> 244.3.160.239 TCP 70 14934 > http [ACK] Seq=1 Ack=1 Win=524280 Len=0 TSval=591597819 TSecr=1511936714
53257  22.143528 41.177.186.56 -> 244.3.160.239 TCP 70 14640 > http [ACK] Seq=1 Ack=1 Win=524280 Len=0 TSval=591597819 TSecr=1511936714
53276  22.151014 41.177.186.56 -> 244.3.160.239 TCP 82 msgsrvr > http [SYN] Seq=0 Win=65535 Len=0 MSS=1460 WS=8 TSval=591597819 TSecr=0 SACK_PERM=1
53280  22.152093 41.177.186.56 -> 244.3.160.239 TCP 70 msgsrvr > http [ACK] Seq=1 Ack=1 Win=524280 Len=0 TSval=591597819 TSecr=1511936715
53308  22.163163 41.177.186.56 -> 244.3.160.239 TCP 70 14934 > http [ACK] Seq=1040 Ack=448 Win=524280 Len=0 TSval=591597819 TSecr=1511936716
53309  22.163168 41.177.186.56 -> 244.3.160.239 TCP 70 14934 > http [ACK] Seq=1040 Ack=449 Win=524280 Len=0 TSval=591597819 TSecr=1511936716
53310  22.163836 41.177.186.56 -> 244.3.160.239 TCP 70 14934 > http [FIN, ACK] Seq=1040 Ack=449 Win=524280 Len=0 TSval=591597819 TSecr=1511936716
53312  22.164439 41.177.186.56 -> 244.3.160.239 TCP 70 14640 > http [ACK] Seq=1046 Ack=1715 Win=524280 Len=0 TSval=591597819 TSecr=1511936716
53313  22.164482 41.177.186.56 -> 244.3.160.239 TCP 70 14640 > http [ACK] Seq=1046 Ack=1716 Win=524280 Len=0 TSval=591597819 TSecr=1511936717
53314  22.164990 41.177.186.56 -> 244.3.160.239 TCP 70 14640 > http [FIN, ACK] Seq=1046 Ack=1716 Win=524280 Len=0 TSval=591597819 TSecr=1511936717
53330  22.173236 41.177.186.56 -> 244.3.160.239 TCP 82 ccmail > http [SYN] Seq=0 Win=65535 Len=0 MSS=1460 WS=8 TSval=591597819 TSecr=0 SACK_PERM=1
53340  22.175061 41.177.186.56 -> 244.3.160.239 TCP 70 msgsrvr > http [ACK] Seq=1026 Ack=2050 Win=523568 Len=0 TSval=591597819 TSecr=1511936718
53341  22.175066 41.177.186.56 -> 244.3.160.239 TCP 70 ccmail > http [ACK] Seq=1 Ack=1 Win=524280 Len=0 TSval=591597819 TSecr=1511936718
53351  22.176383 41.177.186.56 -> 244.3.160.239 TCP 70 msgsrvr > http [ACK] Seq=1026 Ack=4099 Win=524280 Len=0 TSval=591597819 TSecr=1511936718
53357  22.177525 41.177.186.56 -> 244.3.160.239 TCP 70 msgsrvr > http [ACK] Seq=1026 Ack=6148 Win=523568 Len=0 TSval=591597819 TSecr=1511936718
53370  22.179239 41.177.186.56 -> 244.3.160.239 TCP 70 msgsrvr > http [ACK] Seq=1026 Ack=8197 Win=523568 Len=0 TSval=591597819 TSecr=1511936718
53375  22.180744 41.177.186.56 -> 244.3.160.239 TCP 70 msgsrvr > http [ACK] Seq=1026 Ack=10246 Win=523568 Len=0 TSval=591597819 TSecr=1511936718
53381  22.182081 41.177.186.56 -> 244.3.160.239 TCP 70 msgsrvr > http [ACK] Seq=1026 Ack=12295 Win=523568 Len=0 TSval=591597819 TSecr=1511936718
53410  22.183127 41.177.186.56 -> 244.3.160.239 TCP 70 msgsrvr > http [ACK] Seq=1026 Ack=14344 Win=521520 Len=0 TSval=591597819 TSecr=1511936718
53413  22.183964 41.177.186.56 -> 244.3.160.239 TCP 82 6137 > http [SYN] Seq=0 Win=65535 Len=0 MSS=1460 WS=8 TSval=591597819 TSecr=0 SACK_PERM=1
53419  22.184868 41.177.186.56 -> 244.3.160.239 TCP 70 msgsrvr > http [ACK] Seq=1026 Ack=16393 Win=523568 Len=0 TSval=591597819 TSecr=1511936718
53426  22.185588 41.177.186.56 -> 244.3.160.239 TCP 70 6137 > http [ACK] Seq=1 Ack=1 Win=524280 Len=0 TSval=591597819 TSecr=1511936719
53430  22.186188 41.177.186.56 -> 244.3.160.239 TCP 70 msgsrvr > http [ACK] Seq=1026 Ack=18442 Win=523568 Len=0 TSval=591597819 TSecr=1511936719
53438  22.187194 41.177.186.56 -> 244.3.160.239 TCP 70 msgsrvr > http [ACK] Seq=1026 Ack=20491 Win=523568 Len=0 TSval=591597819 TSecr=1511936719
53445  22.188412 41.177.186.56 -> 244.3.160.239 TCP 70 msgsrvr > http [ACK] Seq=1026 Ack=22540 Win=523568 Len=0 TSval=591597819 TSecr=1511936719
53457  22.190093 41.177.186.56 -> 244.3.160.239 TCP 70 msgsrvr > http [ACK] Seq=1026 Ack=24589 Win=523568 Len=0 TSval=591597819 TSecr=1511936719
53466  22.191335 41.177.186.56 -> 244.3.160.239 TCP 70 msgsrvr > http [ACK] Seq=1026 Ack=26638 Win=523568 Len=0 TSval=591597819 TSecr=1511936719
53472  22.192535 41.177.186.56 -> 244.3.160.239 TCP 70 msgsrvr > http [ACK] Seq=1026 Ack=28687 Win=523568 Len=0 TSval=591597819 TSecr=1511936719
53478  22.193674 41.177.186.56 -> 244.3.160.239 TCP 70 msgsrvr > http [ACK] Seq=1026 Ack=30736 Win=523568 Len=0 TSval=591597819 TSecr=1511936719
53492  22.195795 41.177.186.56 -> 244.3.160.239 TCP 70 msgsrvr > http [ACK] Seq=1026 Ack=32785 Win=523568 Len=0 TSval=591597819 TSecr=1511936720
53503  22.197024 41.177.186.56 -> 244.3.160.239 TCP 70 msgsrvr > http [ACK] Seq=1026 Ack=34834 Win=523568 Len=0 TSval=591597819 TSecr=1511936720
53507  22.198070 41.177.186.56 -> 244.3.160.239 TCP 70 msgsrvr > http [ACK] Seq=1026 Ack=36883 Win=523568 Len=0 TSval=591597819 TSecr=1511936720
53514  22.199231 41.177.186.56 -> 244.3.160.239 TCP 70 msgsrvr > http [ACK] Seq=1026 Ack=38932 Win=523568 Len=0 TSval=591597819 TSecr=1511936720
53521  22.200517 41.177.186.56 -> 244.3.160.239 TCP 70 msgsrvr > http [ACK] Seq=1026 Ack=40981 Win=523568 Len=0 TSval=591597819 TSecr=1511936720
53527  22.201517 41.177.186.56 -> 244.3.160.239 TCP 70 msgsrvr > http [ACK] Seq=1026 Ack=43030 Win=523568 Len=0 TSval=591597819 TSecr=1511936720
53535  22.202676 41.177.186.56 -> 244.3.160.239 TCP 70 msgsrvr > http [ACK] Seq=1026 Ack=45079 Win=523568 Len=0 TSval=591597819 TSecr=1511936720
53542  22.203913 41.177.186.56 -> 244.3.160.239 TCP 70 msgsrvr > http [ACK] Seq=1026 Ack=47128 Win=523568 Len=0 TSval=591597819 TSecr=1511936720
53552  22.205671 41.177.186.56 -> 244.3.160.239 TCP 70 msgsrvr > http [ACK] Seq=1026 Ack=49177 Win=523568 Len=0 TSval=591597819 TSecr=1511936721
53556  22.206933 41.177.186.56 -> 244.3.160.239 TCP 70 msgsrvr > http [ACK] Seq=1026 Ack=51226 Win=523568 Len=0 TSval=591597819 TSecr=1511936721
53561  22.208428 41.177.186.56 -> 244.3.160.239 TCP 70 msgsrvr > http [ACK] Seq=1026 Ack=53275 Win=523568 Len=0 TSval=591597819 TSecr=1511936721
53569  22.209607 41.177.186.56 -> 244.3.160.239 TCP 70 msgsrvr > http [ACK] Seq=1026 Ack=55324 Win=524280 Len=0 TSval=591597819 TSecr=1511936721
53576  22.210936 41.177.186.56 -> 244.3.160.239 TCP 70 msgsrvr > http [ACK] Seq=1026 Ack=57373 Win=523568 Len=0 TSval=591597819 TSecr=1511936721
53583  22.211939 41.177.186.56 -> 244.3.160.239 TCP 70 msgsrvr > http [ACK] Seq=1026 Ack=59422 Win=524280 Len=0 TSval=591597819 TSecr=1511936721
53585  22.213159 41.177.186.56 -> 244.3.160.239 TCP 70 msgsrvr > http [ACK] Seq=1026 Ack=61471 Win=523568 Len=0 TSval=591597819 TSecr=1511936721
53597  22.214684 41.177.186.56 -> 244.3.160.239 TCP 70 msgsrvr > http [ACK] Seq=1026 Ack=63520 Win=523568 Len=0 TSval=591597819 TSecr=1511936721
53603  22.215840 41.177.186.56 -> 244.3.160.239 TCP 70 msgsrvr > http [ACK] Seq=1026 Ack=65569 Win=523568 Len=0 TSval=591597819 TSecr=1511936722
53616  22.217586 41.177.186.56 -> 244.3.160.239 TCP 70 msgsrvr > http [ACK] Seq=1026 Ack=67618 Win=523568 Len=0 TSval=591597819 TSecr=1511936722
53618  22.218048 41.177.186.56 -> 244.3.160.239 TCP 70 ccmail > http [ACK] Seq=1042 Ack=1263 Win=524280 Len=0 TSval=591597819 TSecr=1511936722
53628  22.218821 41.177.186.56 -> 244.3.160.239 TCP 70 msgsrvr > http [ACK] Seq=1026 Ack=69667 Win=523568 Len=0 TSval=591597819 TSecr=1511936722
53629  22.218826 41.177.186.56 -> 244.3.160.239 TCP 70 ccmail > http [ACK] Seq=1042 Ack=1264 Win=524280 Len=0 TSval=591597819 TSecr=1511936722
53630  22.219382 41.177.186.56 -> 244.3.160.239 TCP 70 ccmail > http [FIN, ACK] Seq=1042 Ack=1264 Win=524280 Len=0 TSval=591597819 TSecr=1511936722
53635  22.219969 41.177.186.56 -> 244.3.160.239 TCP 70 msgsrvr > http [ACK] Seq=1026 Ack=71716 Win=523568 Len=0 TSval=591597819 TSecr=1511936722
53645  22.221602 41.177.186.56 -> 244.3.160.239 TCP 70 msgsrvr > http [ACK] Seq=1026 Ack=73765 Win=523568 Len=0 TSval=591597819 TSecr=1511936722
53656  22.222747 41.177.186.56 -> 244.3.160.239 TCP 70 msgsrvr > http [ACK] Seq=1026 Ack=75815 Win=523568 Len=0 TSval=591597819 TSecr=1511936722
53660  22.223983 41.177.186.56 -> 244.3.160.239 TCP 70 msgsrvr > http [ACK] Seq=1026 Ack=77864 Win=523568 Len=0 TSval=591597819 TSecr=1511936722
53668  22.225300 41.177.186.56 -> 244.3.160.239 TCP 70 msgsrvr > http [ACK] Seq=1026 Ack=79913 Win=523568 Len=0 TSval=591597819 TSecr=1511936723
53675  22.226832 41.177.186.56 -> 244.3.160.239 TCP 70 msgsrvr > http [ACK] Seq=1026 Ack=81962 Win=523568 Len=0 TSval=591597819 TSecr=1511936723
53678  22.227510 41.177.186.56 -> 244.3.160.239 TCP 70 msgsrvr > http [ACK] Seq=1026 Ack=84011 Win=523568 Len=0 TSval=591597819 TSecr=1511936723
53687  22.229262 41.177.186.56 -> 244.3.160.239 TCP 70 msgsrvr > http [ACK] Seq=1026 Ack=86060 Win=523568 Len=0 TSval=591597819 TSecr=1511936723
53696  22.230723 41.177.186.56 -> 244.3.160.239 TCP 70 msgsrvr > http [ACK] Seq=1026 Ack=88109 Win=523568 Len=0 TSval=591597820 TSecr=1511936723
53702  22.231747 41.177.186.56 -> 244.3.160.239 TCP 70 msgsrvr > http [ACK] Seq=1026 Ack=90158 Win=523568 Len=0 TSval=591597820 TSecr=1511936723
53710  22.233236 41.177.186.56 -> 244.3.160.239 TCP 70 msgsrvr > http [ACK] Seq=1026 Ack=92207 Win=523568 Len=0 TSval=591597820 TSecr=1511936723
53719  22.234826 41.177.186.56 -> 244.3.160.239 TCP 70 msgsrvr > http [ACK] Seq=1026 Ack=94256 Win=523568 Len=0 TSval=591597820 TSecr=1511936723
53726  22.235572 41.177.186.56 -> 244.3.160.239 TCP 70 msgsrvr > http [ACK] Seq=1026 Ack=96305 Win=523568 Len=0 TSval=591597820 TSecr=1511936724
53735  22.237278 41.177.186.56 -> 244.3.160.239 TCP 70 msgsrvr > http [ACK] Seq=1026 Ack=98354 Win=523568 Len=0 TSval=591597820 TSecr=1511936724
53737  22.237875 41.177.186.56 -> 244.3.160.239 TCP 70 msgsrvr > http [ACK] Seq=1026 Ack=100403 Win=523568 Len=0 TSval=591597820 TSecr=1511936724
53745  22.239952 41.177.186.56 -> 244.3.160.239 TCP 70 msgsrvr > http [ACK] Seq=1026 Ack=102452 Win=523568 Len=0 TSval=591597820 TSecr=1511936724
53750  22.240759 41.177.186.56 -> 244.3.160.239 TCP 70 msgsrvr > http [ACK] Seq=1026 Ack=104501 Win=523568 Len=0 TSval=591597820 TSecr=1511936724
53754  22.241836 41.177.186.56 -> 244.3.160.239 TCP 70 msgsrvr > http [ACK] Seq=1026 Ack=106550 Win=523568 Len=0 TSval=591597820 TSecr=1511936724
53765  22.243441 41.177.186.56 -> 244.3.160.239 TCP 70 msgsrvr > http [ACK] Seq=1026 Ack=108599 Win=523568 Len=0 TSval=591597820 TSecr=1511936724
53771  22.245208 41.177.186.56 -> 244.3.160.239 TCP 70 msgsrvr > http [ACK] Seq=1026 Ack=110648 Win=523568 Len=0 TSval=591597820 TSecr=1511936724
53772  22.245230 41.177.186.56 -> 244.3.160.239 TCP 82 9241 > http [SYN] Seq=0 Win=65535 Len=0 MSS=1460 WS=8 TSval=591597820 TSecr=0 SACK_PERM=1
53777  22.245798 41.177.186.56 -> 244.3.160.239 TCP 70 msgsrvr > http [ACK] Seq=1026 Ack=112697 Win=523568 Len=0 TSval=591597820 TSecr=1511936725
53778  22.246368 41.177.186.56 -> 244.3.160.239 TCP 70 9241 > http [ACK] Seq=1 Ack=1 Win=524280 Len=0 TSval=591597820 TSecr=1511936725
53784  22.247330 41.177.186.56 -> 244.3.160.239 TCP 70 msgsrvr > http [ACK] Seq=1026 Ack=114746 Win=523568 Len=0 TSval=591597820 TSecr=1511936725
53788  22.248270 41.177.186.56 -> 244.3.160.239 TCP 70 msgsrvr > http [ACK] Seq=1026 Ack=116795 Win=523568 Len=0 TSval=591597820 TSecr=1511936725
53800  22.249892 41.177.186.56 -> 244.3.160.239 TCP 70 msgsrvr > http [ACK] Seq=1026 Ack=118844 Win=523568 Len=0 TSval=591597820 TSecr=1511936725
53804  22.251055 41.177.186.56 -> 244.3.160.239 TCP 70 msgsrvr > http [ACK] Seq=1026 Ack=120893 Win=523568 Len=0 TSval=591597820 TSecr=1511936725
53808  22.252685 41.177.186.56 -> 244.3.160.239 TCP 70 msgsrvr > http [ACK] Seq=1026 Ack=122942 Win=523568 Len=0 TSval=591597820 TSecr=1511936725
53813  22.253935 41.177.186.56 -> 244.3.160.239 TCP 70 msgsrvr > http [ACK] Seq=1026 Ack=124991 Win=524280 Len=0 TSval=591597820 TSecr=1511936725
53819  22.255059 41.177.186.56 -> 244.3.160.239 TCP 70 msgsrvr > http [ACK] Seq=1026 Ack=127040 Win=523568 Len=0 TSval=591597820 TSecr=1511936726
53822  22.256201 41.177.186.56 -> 244.3.160.239 TCP 70 msgsrvr > http [ACK] Seq=1026 Ack=129089 Win=523568 Len=0 TSval=591597820 TSecr=1511936726
53828  22.257696 41.177.186.56 -> 244.3.160.239 TCP 70 msgsrvr > http [ACK] Seq=1026 Ack=131138 Win=523568 Len=0 TSval=591597820 TSecr=1511936726
53837  22.259001 41.177.186.56 -> 244.3.160.239 TCP 70 msgsrvr > http [ACK] Seq=1026 Ack=133187 Win=523568 Len=0 TSval=591597820 TSecr=1511936726
53842  22.260201 41.177.186.56 -> 244.3.160.239 TCP 70 msgsrvr > http [ACK] Seq=1026 Ack=135236 Win=523568 Len=0 TSval=591597820 TSecr=1511936726
53846  22.261348 41.177.186.56 -> 244.3.160.239 TCP 70 msgsrvr > http [ACK] Seq=1026 Ack=137285 Win=524280 Len=0 TSval=591597820 TSecr=1511936726
53850  22.262429 41.177.186.56 -> 244.3.160.239 TCP 70 msgsrvr > http [ACK] Seq=1026 Ack=139334 Win=523568 Len=0 TSval=591597820 TSecr=1511936726
53860  22.263771 41.177.186.56 -> 244.3.160.239 TCP 70 msgsrvr > http [ACK] Seq=1026 Ack=141383 Win=523568 Len=0 TSval=591597820 TSecr=1511936726
53861  22.264165 41.177.186.56 -> 244.3.160.239 TCP 70 msgsrvr > http [ACK] Seq=1026 Ack=142312 Win=524280 Len=0 TSval=591597820 TSecr=1511936726
53862  22.264199 41.177.186.56 -> 244.3.160.239 TCP 70 msgsrvr > http [ACK] Seq=1026 Ack=142313 Win=524280 Len=0 TSval=591597820 TSecr=1511936727
53863  22.264322 41.177.186.56 -> 244.3.160.239 TCP 70 msgsrvr > http [FIN, ACK] Seq=1026 Ack=142313 Win=524280 Len=0 TSval=591597820 TSecr=1511936727
53880  22.267107 41.177.186.56 -> 244.3.160.239 TCP 70 6137 > http [ACK] Seq=1027 Ack=2050 Win=523568 Len=0 TSval=591597820 TSecr=1511936727
53881  22.267586 41.177.186.56 -> 244.3.160.239 TCP 70 6137 > http [ACK] Seq=1027 Ack=3276 Win=524280 Len=0 TSval=591597820 TSecr=1511936727
53882  22.267590 41.177.186.56 -> 244.3.160.239 TCP 70 6137 > http [ACK] Seq=1027 Ack=3277 Win=524280 Len=0 TSval=591597820 TSecr=1511936727
53883  22.268112 41.177.186.56 -> 244.3.160.239 TCP 70 6137 > http [FIN, ACK] Seq=1027 Ack=3277 Win=524280 Len=0 TSval=591597820 TSecr=1511936727
53920  22.287787 41.177.186.56 -> 244.3.160.239 TCP 70 9241 > http [ACK] Seq=1052 Ack=2052 Win=524280 Len=0 TSval=591597820 TSecr=1511936729
53921  22.287791 41.177.186.56 -> 244.3.160.239 TCP 70 9241 > http [ACK] Seq=1052 Ack=2706 Win=524280 Len=0 TSval=591597820 TSecr=1511936729
53922  22.287796 41.177.186.56 -> 244.3.160.239 TCP 70 9241 > http [ACK] Seq=1052 Ack=2707 Win=524280 Len=0 TSval=591597820 TSecr=1511936729
53923  22.288393 41.177.186.56 -> 244.3.160.239 TCP 70 9241 > http [FIN, ACK] Seq=1052 Ack=2707 Win=524280 Len=0 TSval=591597820 TSecr=1511936729
53963  22.309518 41.177.186.56 -> 244.3.160.239 TCP 70 8667 > http [ACK] Seq=1026 Ack=2050 Win=523568 Len=0 TSval=591597820 TSecr=1511936731
53965  22.310161 41.177.186.56 -> 244.3.160.239 TCP 70 8667 > http [ACK] Seq=1026 Ack=4099 Win=524280 Len=0 TSval=591597820 TSecr=1511936731
53975  22.311646 41.177.186.56 -> 244.3.160.239 TCP 70 8667 > http [ACK] Seq=1026 Ack=6148 Win=523568 Len=0 TSval=591597820 TSecr=1511936731
53979  22.312829 41.177.186.56 -> 244.3.160.239 TCP 70 8667 > http [ACK] Seq=1026 Ack=8198 Win=523568 Len=0 TSval=591597820 TSecr=1511936731
53985  22.313969 41.177.186.56 -> 244.3.160.239 TCP 70 8667 > http [ACK] Seq=1026 Ack=10247 Win=523568 Len=0 TSval=591597820 TSecr=1511936731
53997  22.315669 41.177.186.56 -> 244.3.160.239 TCP 70 8667 > http [ACK] Seq=1026 Ack=12296 Win=523568 Len=0 TSval=591597820 TSecr=1511936732
54004  22.317043 41.177.186.56 -> 244.3.160.239 TCP 70 8667 > http [ACK] Seq=1026 Ack=14345 Win=523568 Len=0 TSval=591597820 TSecr=1511936732
54008  22.318000 41.177.186.56 -> 244.3.160.239 TCP 70 8667 > http [ACK] Seq=1026 Ack=16394 Win=523568 Len=0 TSval=591597820 TSecr=1511936732
54019  22.320070 41.177.186.56 -> 244.3.160.239 TCP 70 8667 > http [ACK] Seq=1026 Ack=18443 Win=523568 Len=0 TSval=591597820 TSecr=1511936732
54026  22.321225 41.177.186.56 -> 244.3.160.239 TCP 70 8667 > http [ACK] Seq=1026 Ack=20492 Win=523568 Len=0 TSval=591597820 TSecr=1511936732
54034  22.322420 41.177.186.56 -> 244.3.160.239 TCP 70 8667 > http [ACK] Seq=1026 Ack=22541 Win=523568 Len=0 TSval=591597820 TSecr=1511936732
54040  22.323568 41.177.186.56 -> 244.3.160.239 TCP 70 8667 > http [ACK] Seq=1026 Ack=24590 Win=523568 Len=0 TSval=591597820 TSecr=1511936732
54049  22.324694 41.177.186.56 -> 244.3.160.239 TCP 70 8667 > http [ACK] Seq=1026 Ack=26639 Win=523568 Len=0 TSval=591597820 TSecr=1511936733
54056  22.326445 41.177.186.56 -> 244.3.160.239 TCP 70 8667 > http [ACK] Seq=1026 Ack=28688 Win=523568 Len=0 TSval=591597820 TSecr=1511936733
54059  22.327526 41.177.186.56 -> 244.3.160.239 TCP 70 8667 > http [ACK] Seq=1026 Ack=30737 Win=523568 Len=0 TSval=591597820 TSecr=1511936733
54063  22.328802 41.177.186.56 -> 244.3.160.239 TCP 70 8667 > http [ACK] Seq=1026 Ack=32786 Win=523568 Len=0 TSval=591597820 TSecr=1511936733
54067  22.330245 41.177.186.56 -> 244.3.160.239 TCP 70 8667 > http [ACK] Seq=1026 Ack=34835 Win=524280 Len=0 TSval=591597821 TSecr=1511936733
54072  22.331923 41.177.186.56 -> 244.3.160.239 TCP 70 8667 > http [ACK] Seq=1026 Ack=36884 Win=523568 Len=0 TSval=591597821 TSecr=1511936733
54078  22.332700 41.177.186.56 -> 244.3.160.239 TCP 70 8667 > http [ACK] Seq=1026 Ack=38933 Win=523568 Len=0 TSval=591597821 TSecr=1511936733
54082  22.333791 41.177.186.56 -> 244.3.160.239 TCP 70 8667 > http [ACK] Seq=1026 Ack=40982 Win=523568 Len=0 TSval=591597821 TSecr=1511936733
54084  22.334853 41.177.186.56 -> 244.3.160.239 TCP 70 8667 > http [ACK] Seq=1026 Ack=43031 Win=523568 Len=0 TSval=591597821 TSecr=1511936734
54091  22.336507 41.177.186.56 -> 244.3.160.239 TCP 70 8667 > http [ACK] Seq=1026 Ack=45080 Win=523568 Len=0 TSval=591597821 TSecr=1511936734
54094  22.337806 41.177.186.56 -> 244.3.160.239 TCP 70 8667 > http [ACK] Seq=1026 Ack=47129 Win=524280 Len=0 TSval=591597821 TSecr=1511936734
54095  22.337811 41.177.186.56 -> 244.3.160.239 TCP 70 8667 > http [ACK] Seq=1026 Ack=47609 Win=524280 Len=0 TSval=591597821 TSecr=1511936734
54096  22.337815 41.177.186.56 -> 244.3.160.239 TCP 70 8667 > http [ACK] Seq=1026 Ack=47610 Win=524280 Len=0 TSval=591597821 TSecr=1511936734
54098  22.338341 41.177.186.56 -> 244.3.160.239 TCP 70 8667 > http [FIN, ACK] Seq=1026 Ack=47610 Win=524280 Len=0 TSval=591597821 TSecr=1511936734
54499  22.577071 41.177.186.56 -> 244.3.160.239 TCP 82 9863 > http [SYN] Seq=0 Win=65535 Len=0 MSS=1460 WS=8 TSval=591597823 TSecr=0 SACK_PERM=1
54501  22.577636 41.177.186.56 -> 244.3.160.239 TCP 82 prp > http [SYN] Seq=0 Win=65535 Len=0 MSS=1460 WS=8 TSval=591597823 TSecr=0 SACK_PERM=1
54503  22.578301 41.177.186.56 -> 244.3.160.239 TCP 70 9863 > http [ACK] Seq=1 Ack=1 Win=524280 Len=0 TSval=591597823 TSecr=1511936758
54504  22.578829 41.177.186.56 -> 244.3.160.239 TCP 70 prp > http [ACK] Seq=1 Ack=1 Win=524280 Len=0 TSval=591597823 TSecr=1511936758
54515  22.582099 41.177.186.56 -> 244.3.160.239 TCP 82 ksysguard > http [SYN] Seq=0 Win=65535 Len=0 MSS=1460 WS=8 TSval=591597823 TSecr=0 SACK_PERM=1
54518  22.582672 41.177.186.56 -> 244.3.160.239 TCP 82 6272 > http [SYN] Seq=0 Win=65535 Len=0 MSS=1460 WS=8 TSval=591597823 TSecr=0 SACK_PERM=1
54524  22.583199 41.177.186.56 -> 244.3.160.239 TCP 70 ksysguard > http [ACK] Seq=1 Ack=1 Win=524280 Len=0 TSval=591597823 TSecr=1511936758
54527  22.583942 41.177.186.56 -> 244.3.160.239 TCP 70 6272 > http [ACK] Seq=1 Ack=1 Win=524280 Len=0 TSval=591597823 TSecr=1511936758
54623  22.621759 41.177.186.56 -> 244.3.160.239 TCP 70 9863 > http [ACK] Seq=1038 Ack=2050 Win=523568 Len=0 TSval=591597823 TSecr=1511936762
54624  22.621763 41.177.186.56 -> 244.3.160.239 TCP 70 9863 > http [ACK] Seq=1038 Ack=2795 Win=522824 Len=0 TSval=591597823 TSecr=1511936762
54626  22.622317 41.177.186.56 -> 244.3.160.239 TCP 70 9863 > http [ACK] Seq=1038 Ack=2796 Win=524280 Len=0 TSval=591597823 TSecr=1511936762
54627  22.622322 41.177.186.56 -> 244.3.160.239 TCP 70 9863 > http [FIN, ACK] Seq=1038 Ack=2796 Win=524280 Len=0 TSval=591597823 TSecr=1511936762
54707  22.664079 41.177.186.56 -> 244.3.160.239 TCP 70 prp > http [ACK] Seq=1023 Ack=333 Win=524280 Len=0 TSval=591597824 TSecr=1511936766
54708  22.664084 41.177.186.56 -> 244.3.160.239 TCP 70 prp > http [ACK] Seq=1023 Ack=334 Win=524280 Len=0 TSval=591597824 TSecr=1511936767
54709  22.664292 41.177.186.56 -> 244.3.160.239 TCP 70 prp > http [FIN, ACK] Seq=1023 Ack=334 Win=524280 Len=0 TSval=591597824 TSecr=1511936767
54741  22.672797 41.177.186.56 -> 244.3.160.239 TCP 70 6272 > http [ACK] Seq=1063 Ack=2050 Win=523568 Len=0 TSval=591597824 TSecr=1511936767
54745  22.673840 41.177.186.56 -> 244.3.160.239 TCP 70 6272 > http [ACK] Seq=1063 Ack=4100 Win=524280 Len=0 TSval=591597824 TSecr=1511936767
54754  22.675540 41.177.186.56 -> 244.3.160.239 TCP 70 6272 > http [ACK] Seq=1063 Ack=6149 Win=523568 Len=0 TSval=591597824 TSecr=1511936768
54758  22.676913 41.177.186.56 -> 244.3.160.239 TCP 70 6272 > http [ACK] Seq=1063 Ack=8198 Win=523568 Len=0 TSval=591597824 TSecr=1511936768
54762  22.677908 41.177.186.56 -> 244.3.160.239 TCP 70 6272 > http [ACK] Seq=1063 Ack=10247 Win=523568 Len=0 TSval=591597824 TSecr=1511936768
54776  22.679506 41.177.186.56 -> 244.3.160.239 TCP 70 6272 > http [ACK] Seq=1063 Ack=12296 Win=523568 Len=0 TSval=591597824 TSecr=1511936768
54781  22.680815 41.177.186.56 -> 244.3.160.239 TCP 70 6272 > http [ACK] Seq=1063 Ack=14345 Win=523568 Len=0 TSval=591597824 TSecr=1511936768
54787  22.682410 41.177.186.56 -> 244.3.160.239 TCP 70 6272 > http [ACK] Seq=1063 Ack=16394 Win=523568 Len=0 TSval=591597824 TSecr=1511936768
54797  22.683676 41.177.186.56 -> 244.3.160.239 TCP 70 6272 > http [ACK] Seq=1063 Ack=18443 Win=523568 Len=0 TSval=591597824 TSecr=1511936768
54805  22.685380 41.177.186.56 -> 244.3.160.239 TCP 70 6272 > http [ACK] Seq=1063 Ack=20492 Win=523568 Len=0 TSval=591597824 TSecr=1511936769
54810  22.686475 41.177.186.56 -> 244.3.160.239 TCP 70 6272 > http [ACK] Seq=1063 Ack=22541 Win=523568 Len=0 TSval=591597824 TSecr=1511936769
54818  22.688093 41.177.186.56 -> 244.3.160.239 TCP 70 6272 > http [ACK] Seq=1063 Ack=24590 Win=523568 Len=0 TSval=591597824 TSecr=1511936769
54826  22.689201 41.177.186.56 -> 244.3.160.239 TCP 70 6272 > http [ACK] Seq=1063 Ack=26639 Win=523568 Len=0 TSval=591597824 TSecr=1511936769
54835  22.690268 41.177.186.56 -> 244.3.160.239 TCP 70 6272 > http [ACK] Seq=1063 Ack=28688 Win=523568 Len=0 TSval=591597824 TSecr=1511936769
54846  22.691887 41.177.186.56 -> 244.3.160.239 TCP 70 6272 > http [ACK] Seq=1063 Ack=30737 Win=523568 Len=0 TSval=591597824 TSecr=1511936769
54854  22.693024 41.177.186.56 -> 244.3.160.239 TCP 70 6272 > http [ACK] Seq=1063 Ack=32786 Win=523568 Len=0 TSval=591597824 TSecr=1511936769
54867  22.695200 41.177.186.56 -> 244.3.160.239 TCP 70 6272 > http [ACK] Seq=1063 Ack=34835 Win=523568 Len=0 TSval=591597824 TSecr=1511936770
54871  22.695850 41.177.186.56 -> 244.3.160.239 TCP 70 6272 > http [ACK] Seq=1063 Ack=36884 Win=523568 Len=0 TSval=591597824 TSecr=1511936770
54876  22.697003 41.177.186.56 -> 244.3.160.239 TCP 70 6272 > http [ACK] Seq=1063 Ack=38933 Win=523568 Len=0 TSval=591597824 TSecr=1511936770
54885  22.698725 41.177.186.56 -> 244.3.160.239 TCP 70 6272 > http [ACK] Seq=1063 Ack=40982 Win=523568 Len=0 TSval=591597824 TSecr=1511936770
54889  22.699855 41.177.186.56 -> 244.3.160.239 TCP 70 6272 > http [ACK] Seq=1063 Ack=43031 Win=523568 Len=0 TSval=591597824 TSecr=1511936770
54896  22.701481 41.177.186.56 -> 244.3.160.239 TCP 70 6272 > http [ACK] Seq=1063 Ack=45080 Win=524280 Len=0 TSval=591597824 TSecr=1511936770
54917  22.702712 41.177.186.56 -> 244.3.160.239 TCP 70 6272 > http [ACK] Seq=1063 Ack=47129 Win=523568 Len=0 TSval=591597824 TSecr=1511936770
54921  22.703794 41.177.186.56 -> 244.3.160.239 TCP 70 6272 > http [ACK] Seq=1063 Ack=49178 Win=523568 Len=0 TSval=591597824 TSecr=1511936770
54928  22.704868 41.177.186.56 -> 244.3.160.239 TCP 70 ksysguard > http [ACK] Seq=1080 Ack=2050 Win=523568 Len=0 TSval=591597824 TSecr=1511936771
54932  22.705798 41.177.186.56 -> 244.3.160.239 TCP 70 6272 > http [ACK] Seq=1063 Ack=51227 Win=523568 Len=0 TSval=591597824 TSecr=1511936771
54933  22.705803 41.177.186.56 -> 244.3.160.239 TCP 70 ksysguard > http [ACK] Seq=1080 Ack=3503 Win=524168 Len=0 TSval=591597824 TSecr=1511936771
54934  22.705807 41.177.186.56 -> 244.3.160.239 TCP 70 ksysguard > http [ACK] Seq=1080 Ack=3504 Win=524168 Len=0 TSval=591597824 TSecr=1511936771
54939  22.707290 41.177.186.56 -> 244.3.160.239 TCP 70 6272 > http [ACK] Seq=1063 Ack=53276 Win=523568 Len=0 TSval=591597824 TSecr=1511936771
54941  22.707977 41.177.186.56 -> 244.3.160.239 TCP 70 6272 > http [ACK] Seq=1063 Ack=55325 Win=521520 Len=0 TSval=591597824 TSecr=1511936771
54952  22.709647 41.177.186.56 -> 244.3.160.239 TCP 70 6272 > http [ACK] Seq=1063 Ack=57374 Win=519472 Len=0 TSval=591597824 TSecr=1511936771
54953  22.709652 41.177.186.56 -> 244.3.160.239 TCP 70 6272 > http [ACK] Seq=1063 Ack=57529 Win=519320 Len=0 TSval=591597824 TSecr=1511936771
54954  22.709715 41.177.186.56 -> 244.3.160.239 TCP 70 6272 > http [ACK] Seq=1063 Ack=57530 Win=519320 Len=0 TSval=591597824 TSecr=1511936771
54981  22.735426 41.177.186.56 -> 244.3.160.239 TCP 82 10479 > http [SYN] Seq=0 Win=65535 Len=0 MSS=1460 WS=8 TSval=591597825 TSecr=0 SACK_PERM=1
54983  22.736025 41.177.186.56 -> 244.3.160.239 TCP 82 7198 > http [SYN] Seq=0 Win=65535 Len=0 MSS=1460 WS=8 TSval=591597825 TSecr=0 SACK_PERM=1
54984  22.736029 41.177.186.56 -> 244.3.160.239 TCP 70 6272 > http [FIN, ACK] Seq=1063 Ack=57530 Win=524280 Len=0 TSval=591597825 TSecr=1511936771
54985  22.736119 41.177.186.56 -> 244.3.160.239 TCP 70 ksysguard > http [FIN, ACK] Seq=1080 Ack=3504 Win=524280 Len=0 TSval=591597825 TSecr=1511936771
54989  22.736644 41.177.186.56 -> 244.3.160.239 TCP 70 10479 > http [ACK] Seq=1 Ack=1 Win=524280 Len=0 TSval=591597825 TSecr=1511936774
54991  22.736968 41.177.186.56 -> 244.3.160.239 TCP 70 7198 > http [ACK] Seq=1 Ack=1 Win=524280 Len=0 TSval=591597825 TSecr=1511936774
55035  22.757269 41.177.186.56 -> 244.3.160.239 TCP 70 7198 > http [ACK] Seq=1034 Ack=277 Win=524280 Len=0 TSval=591597825 TSecr=1511936776
55042  22.761811 41.177.186.56 -> 244.3.160.239 TCP 82 10275 > http [SYN] Seq=0 Win=65535 Len=0 MSS=1460 WS=8 TSval=591597825 TSecr=0 SACK_PERM=1
55044  22.762519 41.177.186.56 -> 244.3.160.239 TCP 82 15749 > http [SYN] Seq=0 Win=65535 Len=0 MSS=1460 WS=8 TSval=591597825 TSecr=0 SACK_PERM=1
55046  22.762997 41.177.186.56 -> 244.3.160.239 TCP 70 10275 > http [ACK] Seq=1 Ack=1 Win=524280 Len=0 TSval=591597825 TSecr=1511936776
55048  22.763825 41.177.186.56 -> 244.3.160.239 TCP 70 15749 > http [ACK] Seq=1 Ack=1 Win=524280 Len=0 TSval=591597825 TSecr=1511936776
55091  22.775868 41.177.186.56 -> 244.3.160.239 TCP 70 10479 > http [ACK] Seq=1026 Ack=2050 Win=523568 Len=0 TSval=591597825 TSecr=1511936778
55098  22.776958 41.177.186.56 -> 244.3.160.239 TCP 70 10479 > http [ACK] Seq=1026 Ack=4099 Win=523568 Len=0 TSval=591597825 TSecr=1511936778
55099  22.777113 41.177.186.56 -> 244.3.160.239 TCP 70 10275 > http [ACK] Seq=1013 Ack=275 Win=524280 Len=0 TSval=591597825 TSecr=1511936778
55102  22.777605 41.177.186.56 -> 244.3.160.239 TCP 70 15749 > http [ACK] Seq=1048 Ack=277 Win=524280 Len=0 TSval=591597825 TSecr=1511936778
55114  22.778327 41.177.186.56 -> 244.3.160.239 TCP 70 10479 > http [ACK] Seq=1026 Ack=6148 Win=523568 Len=0 TSval=591597825 TSecr=1511936778
55121  22.779958 41.177.186.56 -> 244.3.160.239 TCP 70 10479 > http [ACK] Seq=1026 Ack=8197 Win=523568 Len=0 TSval=591597825 TSecr=1511936778
55132  22.781483 41.177.186.56 -> 244.3.160.239 TCP 70 10479 > http [ACK] Seq=1026 Ack=10246 Win=523568 Len=0 TSval=591597825 TSecr=1511936778
55137  22.782613 41.177.186.56 -> 244.3.160.239 TCP 70 10479 > http [ACK] Seq=1026 Ack=12295 Win=523568 Len=0 TSval=591597825 TSecr=1511936778
55141  22.784264 41.177.186.56 -> 244.3.160.239 TCP 70 10479 > http [ACK] Seq=1026 Ack=14344 Win=523568 Len=0 TSval=591597825 TSecr=1511936778
