358733 122.498592 41.177.211.31 -> 41.177.98.220 TCP 66 vrtstrapserver > op-probe [SYN] Seq=0 Win=65535 Len=0 MSS=1380 SACK_PERM=1
358737 122.499361 41.177.211.31 -> 41.177.98.220 TCP 64 vrtstrapserver > op-probe [ACK] Seq=1 Ack=1 Win=65535 Len=0
358738 122.499590 41.177.211.31 -> 41.177.98.220 TCP 144 vrtstrapserver > op-probe [PSH, ACK] Seq=1 Ack=1 Win=65535 Len=86
363699 123.834832 41.177.211.31 -> 41.177.98.220 TCP 64 vrtstrapserver > op-probe [ACK] Seq=87 Ack=103 Win=65433 Len=0
387492 129.226700 41.177.211.31 -> 41.177.98.220 TCP 141 vrtstrapserver > op-probe [PSH, ACK] Seq=87 Ack=103 Win=65433 Len=83
387510 129.236357 41.177.211.31 -> 41.177.98.220 TCP 113 vrtstrapserver > op-probe [PSH, ACK] Seq=170 Ack=191 Win=65345 Len=55
387578 129.297994 41.177.211.31 -> 41.177.98.220 TCP 126 vrtstrapserver > op-probe [PSH, ACK] Seq=225 Ack=536 Win=65000 Len=68
387597 129.317716 41.177.211.31 -> 41.177.98.220 TCP 114 vrtstrapserver > op-probe [PSH, ACK] Seq=293 Ack=803 Win=64733 Len=56
387669 129.362571 41.177.211.31 -> 41.177.98.220 TCP 64 vrtstrapserver > op-probe [ACK] Seq=349 Ack=2303 Win=65535 Len=0
387675 129.363287 41.177.211.31 -> 41.177.98.220 TCP 114 vrtstrapserver > op-probe [PSH, ACK] Seq=349 Ack=2303 Win=65535 Len=56
387705 129.378714 41.177.211.31 -> 41.177.98.220 TCP 64 vrtstrapserver > op-probe [ACK] Seq=405 Ack=3807 Win=65535 Len=0
387706 129.379627 41.177.211.31 -> 41.177.98.220 TCP 112 vrtstrapserver > op-probe [PSH, ACK] Seq=405 Ack=3807 Win=65535 Len=54
388033 129.575413 41.177.211.31 -> 41.177.98.220 TCP 64 vrtstrapserver > op-probe [ACK] Seq=459 Ack=5489 Win=65535 Len=0
388034 129.576391 41.177.211.31 -> 41.177.98.220 TCP 112 vrtstrapserver > op-probe [PSH, ACK] Seq=459 Ack=5489 Win=65535 Len=54
388071 129.588940 41.177.211.31 -> 41.177.98.220 TCP 64 vrtstrapserver > op-probe [ACK] Seq=513 Ack=7201 Win=65535 Len=0
388072 129.589929 41.177.211.31 -> 41.177.98.220 TCP 112 vrtstrapserver > op-probe [PSH, ACK] Seq=513 Ack=7201 Win=65535 Len=54
388087 129.602740 41.177.211.31 -> 41.177.98.220 TCP 64 vrtstrapserver > op-probe [ACK] Seq=567 Ack=8867 Win=65535 Len=0
388088 129.603691 41.177.211.31 -> 41.177.98.220 TCP 112 vrtstrapserver > op-probe [PSH, ACK] Seq=567 Ack=8867 Win=65535 Len=54
388102 129.616780 41.177.211.31 -> 41.177.98.220 TCP 64 vrtstrapserver > op-probe [ACK] Seq=621 Ack=10534 Win=65535 Len=0
388119 129.617709 41.177.211.31 -> 41.177.98.220 TCP 112 vrtstrapserver > op-probe [PSH, ACK] Seq=621 Ack=10534 Win=65535 Len=54
388245 129.630510 41.177.211.31 -> 41.177.98.220 TCP 64 vrtstrapserver > op-probe [ACK] Seq=675 Ack=12247 Win=65535 Len=0
388246 129.631421 41.177.211.31 -> 41.177.98.220 TCP 112 vrtstrapserver > op-probe [PSH, ACK] Seq=675 Ack=12247 Win=65535 Len=54
388380 129.644149 41.177.211.31 -> 41.177.98.220 TCP 64 vrtstrapserver > op-probe [ACK] Seq=729 Ack=13984 Win=65535 Len=0
388383 129.645073 41.177.211.31 -> 41.177.98.220 TCP 112 vrtstrapserver > op-probe [PSH, ACK] Seq=729 Ack=13984 Win=65535 Len=54
388491 129.657502 41.177.211.31 -> 41.177.98.220 TCP 64 vrtstrapserver > op-probe [ACK] Seq=783 Ack=15692 Win=65535 Len=0
388503 129.658415 41.177.211.31 -> 41.177.98.220 TCP 112 vrtstrapserver > op-probe [PSH, ACK] Seq=783 Ack=15692 Win=65535 Len=54
388628 129.671733 41.177.211.31 -> 41.177.98.220 TCP 64 vrtstrapserver > op-probe [ACK] Seq=837 Ack=17371 Win=65535 Len=0
388638 129.672706 41.177.211.31 -> 41.177.98.220 TCP 112 vrtstrapserver > op-probe [PSH, ACK] Seq=837 Ack=17371 Win=65535 Len=54
388757 129.685441 41.177.211.31 -> 41.177.98.220 TCP 64 vrtstrapserver > op-probe [ACK] Seq=891 Ack=19064 Win=65535 Len=0
388770 129.686323 41.177.211.31 -> 41.177.98.220 TCP 112 vrtstrapserver > op-probe [PSH, ACK] Seq=891 Ack=19064 Win=65535 Len=54
388793 129.699252 41.177.211.31 -> 41.177.98.220 TCP 64 vrtstrapserver > op-probe [ACK] Seq=945 Ack=20797 Win=65535 Len=0
388794 129.700159 41.177.211.31 -> 41.177.98.220 TCP 112 vrtstrapserver > op-probe [PSH, ACK] Seq=945 Ack=20797 Win=65535 Len=54
388815 129.713032 41.177.211.31 -> 41.177.98.220 TCP 64 vrtstrapserver > op-probe [ACK] Seq=999 Ack=22547 Win=65535 Len=0
388816 129.714006 41.177.211.31 -> 41.177.98.220 TCP 112 vrtstrapserver > op-probe [PSH, ACK] Seq=999 Ack=22547 Win=65535 Len=54
388843 129.726640 41.177.211.31 -> 41.177.98.220 TCP 64 vrtstrapserver > op-probe [ACK] Seq=1053 Ack=24264 Win=65535 Len=0
388844 129.727523 41.177.211.31 -> 41.177.98.220 TCP 112 vrtstrapserver > op-probe [PSH, ACK] Seq=1053 Ack=24264 Win=65535 Len=54
388864 129.741492 41.177.211.31 -> 41.177.98.220 TCP 64 vrtstrapserver > op-probe [ACK] Seq=1107 Ack=25934 Win=65535 Len=0
388865 129.742445 41.177.211.31 -> 41.177.98.220 TCP 112 vrtstrapserver > op-probe [PSH, ACK] Seq=1107 Ack=25934 Win=65535 Len=54
388875 129.755440 41.177.211.31 -> 41.177.98.220 TCP 64 vrtstrapserver > op-probe [ACK] Seq=1161 Ack=27594 Win=65535 Len=0
388876 129.756382 41.177.211.31 -> 41.177.98.220 TCP 112 vrtstrapserver > op-probe [PSH, ACK] Seq=1161 Ack=27594 Win=65535 Len=54
388910 129.769296 41.177.211.31 -> 41.177.98.220 TCP 64 vrtstrapserver > op-probe [ACK] Seq=1215 Ack=29312 Win=65535 Len=0
388911 129.770222 41.177.211.31 -> 41.177.98.220 TCP 112 vrtstrapserver > op-probe [PSH, ACK] Seq=1215 Ack=29312 Win=65535 Len=54
388950 129.783081 41.177.211.31 -> 41.177.98.220 TCP 64 vrtstrapserver > op-probe [ACK] Seq=1269 Ack=30995 Win=65535 Len=0
388951 129.784027 41.177.211.31 -> 41.177.98.220 TCP 112 vrtstrapserver > op-probe [PSH, ACK] Seq=1269 Ack=30995 Win=65535 Len=54
388972 129.796888 41.177.211.31 -> 41.177.98.220 TCP 64 vrtstrapserver > op-probe [ACK] Seq=1323 Ack=32648 Win=65535 Len=0
388976 129.797795 41.177.211.31 -> 41.177.98.220 TCP 112 vrtstrapserver > op-probe [PSH, ACK] Seq=1323 Ack=32648 Win=65535 Len=54
389002 129.810428 41.177.211.31 -> 41.177.98.220 TCP 64 vrtstrapserver > op-probe [ACK] Seq=1377 Ack=34339 Win=65535 Len=0
389007 129.811398 41.177.211.31 -> 41.177.98.220 TCP 112 vrtstrapserver > op-probe [PSH, ACK] Seq=1377 Ack=34339 Win=65535 Len=54
389051 129.824056 41.177.211.31 -> 41.177.98.220 TCP 64 vrtstrapserver > op-probe [ACK] Seq=1431 Ack=36065 Win=65535 Len=0
389053 129.824975 41.177.211.31 -> 41.177.98.220 TCP 112 vrtstrapserver > op-probe [PSH, ACK] Seq=1431 Ack=36065 Win=65535 Len=54
389076 129.837813 41.177.211.31 -> 41.177.98.220 TCP 64 vrtstrapserver > op-probe [ACK] Seq=1485 Ack=37796 Win=65535 Len=0
389077 129.838744 41.177.211.31 -> 41.177.98.220 TCP 112 vrtstrapserver > op-probe [PSH, ACK] Seq=1485 Ack=37796 Win=65535 Len=54
389105 129.851278 41.177.211.31 -> 41.177.98.220 TCP 64 vrtstrapserver > op-probe [ACK] Seq=1539 Ack=39498 Win=65535 Len=0
389107 129.852250 41.177.211.31 -> 41.177.98.220 TCP 112 vrtstrapserver > op-probe [PSH, ACK] Seq=1539 Ack=39498 Win=65535 Len=54
389118 129.864941 41.177.211.31 -> 41.177.98.220 TCP 64 vrtstrapserver > op-probe [ACK] Seq=1593 Ack=41235 Win=65535 Len=0
389119 129.865921 41.177.211.31 -> 41.177.98.220 TCP 112 vrtstrapserver > op-probe [PSH, ACK] Seq=1593 Ack=41235 Win=65535 Len=54
389140 129.878890 41.177.211.31 -> 41.177.98.220 TCP 64 vrtstrapserver > op-probe [ACK] Seq=1647 Ack=42967 Win=65535 Len=0
389141 129.879820 41.177.211.31 -> 41.177.98.220 TCP 112 vrtstrapserver > op-probe [PSH, ACK] Seq=1647 Ack=42967 Win=65535 Len=54
389159 129.892742 41.177.211.31 -> 41.177.98.220 TCP 64 vrtstrapserver > op-probe [ACK] Seq=1701 Ack=44685 Win=65535 Len=0
389166 129.893686 41.177.211.31 -> 41.177.98.220 TCP 112 vrtstrapserver > op-probe [PSH, ACK] Seq=1701 Ack=44685 Win=65535 Len=54
389184 129.906335 41.177.211.31 -> 41.177.98.220 TCP 64 vrtstrapserver > op-probe [ACK] Seq=1755 Ack=46418 Win=65535 Len=0
389186 129.907264 41.177.211.31 -> 41.177.98.220 TCP 112 vrtstrapserver > op-probe [PSH, ACK] Seq=1755 Ack=46418 Win=65535 Len=54
389193 129.920026 41.177.211.31 -> 41.177.98.220 TCP 64 vrtstrapserver > op-probe [ACK] Seq=1809 Ack=48087 Win=65535 Len=0
389194 129.920961 41.177.211.31 -> 41.177.98.220 TCP 112 vrtstrapserver > op-probe [PSH, ACK] Seq=1809 Ack=48087 Win=65535 Len=54
389226 129.933766 41.177.211.31 -> 41.177.98.220 TCP 64 vrtstrapserver > op-probe [ACK] Seq=1863 Ack=49756 Win=65535 Len=0
389231 129.934698 41.177.211.31 -> 41.177.98.220 TCP 112 vrtstrapserver > op-probe [PSH, ACK] Seq=1863 Ack=49756 Win=65535 Len=54
389250 129.947419 41.177.211.31 -> 41.177.98.220 TCP 64 vrtstrapserver > op-probe [ACK] Seq=1917 Ack=51392 Win=65535 Len=0
389251 129.948344 41.177.211.31 -> 41.177.98.220 TCP 112 vrtstrapserver > op-probe [PSH, ACK] Seq=1917 Ack=51392 Win=65535 Len=54
389265 129.961094 41.177.211.31 -> 41.177.98.220 TCP 64 vrtstrapserver > op-probe [ACK] Seq=1971 Ack=53070 Win=65535 Len=0
389267 129.962053 41.177.211.31 -> 41.177.98.220 TCP 112 vrtstrapserver > op-probe [PSH, ACK] Seq=1971 Ack=53070 Win=65535 Len=54
389272 129.974825 41.177.211.31 -> 41.177.98.220 TCP 64 vrtstrapserver > op-probe [ACK] Seq=2025 Ack=54725 Win=65535 Len=0
389273 129.975748 41.177.211.31 -> 41.177.98.220 TCP 112 vrtstrapserver > op-probe [PSH, ACK] Seq=2025 Ack=54725 Win=65535 Len=54
389285 129.988634 41.177.211.31 -> 41.177.98.220 TCP 64 vrtstrapserver > op-probe [ACK] Seq=2079 Ack=56483 Win=65535 Len=0
389286 129.989589 41.177.211.31 -> 41.177.98.220 TCP 112 vrtstrapserver > op-probe [PSH, ACK] Seq=2079 Ack=56483 Win=65535 Len=54
389297 130.002302 41.177.211.31 -> 41.177.98.220 TCP 64 vrtstrapserver > op-probe [ACK] Seq=2133 Ack=58164 Win=65535 Len=0
389298 130.003242 41.177.211.31 -> 41.177.98.220 TCP 112 vrtstrapserver > op-probe [PSH, ACK] Seq=2133 Ack=58164 Win=65535 Len=54
389327 130.015518 41.177.211.31 -> 41.177.98.220 TCP 64 vrtstrapserver > op-probe [ACK] Seq=2187 Ack=59905 Win=65535 Len=0
389331 130.016448 41.177.211.31 -> 41.177.98.220 TCP 112 vrtstrapserver > op-probe [PSH, ACK] Seq=2187 Ack=59905 Win=65535 Len=54
389349 130.029245 41.177.211.31 -> 41.177.98.220 TCP 64 vrtstrapserver > op-probe [ACK] Seq=2241 Ack=61591 Win=65535 Len=0
389350 130.030143 41.177.211.31 -> 41.177.98.220 TCP 112 vrtstrapserver > op-probe [PSH, ACK] Seq=2241 Ack=61591 Win=65535 Len=54
389368 130.042892 41.177.211.31 -> 41.177.98.220 TCP 64 vrtstrapserver > op-probe [ACK] Seq=2295 Ack=63342 Win=65535 Len=0
389369 130.043838 41.177.211.31 -> 41.177.98.220 TCP 112 vrtstrapserver > op-probe [PSH, ACK] Seq=2295 Ack=63342 Win=65535 Len=54
389379 130.056626 41.177.211.31 -> 41.177.98.220 TCP 64 vrtstrapserver > op-probe [ACK] Seq=2349 Ack=65077 Win=65535 Len=0
389382 130.057618 41.177.211.31 -> 41.177.98.220 TCP 112 vrtstrapserver > op-probe [PSH, ACK] Seq=2349 Ack=65077 Win=65535 Len=54
389399 130.070457 41.177.211.31 -> 41.177.98.220 TCP 64 vrtstrapserver > op-probe [ACK] Seq=2403 Ack=66771 Win=65535 Len=0
389400 130.071393 41.177.211.31 -> 41.177.98.220 TCP 112 vrtstrapserver > op-probe [PSH, ACK] Seq=2403 Ack=66771 Win=65535 Len=54
389465 130.084307 41.177.211.31 -> 41.177.98.220 TCP 64 vrtstrapserver > op-probe [ACK] Seq=2457 Ack=68501 Win=65535 Len=0
389468 130.085235 41.177.211.31 -> 41.177.98.220 TCP 112 vrtstrapserver > op-probe [PSH, ACK] Seq=2457 Ack=68501 Win=65535 Len=54
389503 130.099412 41.177.211.31 -> 41.177.98.220 TCP 64 vrtstrapserver > op-probe [ACK] Seq=2511 Ack=70240 Win=65535 Len=0
389510 130.100364 41.177.211.31 -> 41.177.98.220 TCP 112 vrtstrapserver > op-probe [PSH, ACK] Seq=2511 Ack=70240 Win=65535 Len=54
389531 130.113294 41.177.211.31 -> 41.177.98.220 TCP 64 vrtstrapserver > op-probe [ACK] Seq=2565 Ack=71948 Win=65535 Len=0
389534 130.114227 41.177.211.31 -> 41.177.98.220 TCP 112 vrtstrapserver > op-probe [PSH, ACK] Seq=2565 Ack=71948 Win=65535 Len=54
389552 130.127077 41.177.211.31 -> 41.177.98.220 TCP 64 vrtstrapserver > op-probe [ACK] Seq=2619 Ack=73665 Win=65535 Len=0
389553 130.128005 41.177.211.31 -> 41.177.98.220 TCP 112 vrtstrapserver > op-probe [PSH, ACK] Seq=2619 Ack=73665 Win=65535 Len=54
389568 130.140804 41.177.211.31 -> 41.177.98.220 TCP 64 vrtstrapserver > op-probe [ACK] Seq=2673 Ack=75361 Win=65535 Len=0
389569 130.141878 41.177.211.31 -> 41.177.98.220 TCP 112 vrtstrapserver > op-probe [PSH, ACK] Seq=2673 Ack=75361 Win=65535 Len=54
389591 130.154747 41.177.211.31 -> 41.177.98.220 TCP 64 vrtstrapserver > op-probe [ACK] Seq=2727 Ack=77022 Win=65535 Len=0
389592 130.155711 41.177.211.31 -> 41.177.98.220 TCP 112 vrtstrapserver > op-probe [PSH, ACK] Seq=2727 Ack=77022 Win=65535 Len=54
389623 130.168497 41.177.211.31 -> 41.177.98.220 TCP 64 vrtstrapserver > op-probe [ACK] Seq=2781 Ack=78705 Win=65535 Len=0
389633 130.169451 41.177.211.31 -> 41.177.98.220 TCP 112 vrtstrapserver > op-probe [PSH, ACK] Seq=2781 Ack=78705 Win=65535 Len=54
389645 130.181999 41.177.211.31 -> 41.177.98.220 TCP 64 vrtstrapserver > op-probe [ACK] Seq=2835 Ack=80362 Win=65535 Len=0
389646 130.182964 41.177.211.31 -> 41.177.98.220 TCP 112 vrtstrapserver > op-probe [PSH, ACK] Seq=2835 Ack=80362 Win=65535 Len=54
389696 130.195789 41.177.211.31 -> 41.177.98.220 TCP 64 vrtstrapserver > op-probe [ACK] Seq=2889 Ack=82064 Win=65535 Len=0
389700 130.196716 41.177.211.31 -> 41.177.98.220 TCP 112 vrtstrapserver > op-probe [PSH, ACK] Seq=2889 Ack=82064 Win=65535 Len=54
389724 130.210411 41.177.211.31 -> 41.177.98.220 TCP 64 vrtstrapserver > op-probe [ACK] Seq=2943 Ack=83757 Win=65535 Len=0
389728 130.211344 41.177.211.31 -> 41.177.98.220 TCP 112 vrtstrapserver > op-probe [PSH, ACK] Seq=2943 Ack=83757 Win=65535 Len=54
389737 130.224026 41.177.211.31 -> 41.177.98.220 TCP 64 vrtstrapserver > op-probe [ACK] Seq=2997 Ack=85432 Win=65535 Len=0
389738 130.224979 41.177.211.31 -> 41.177.98.220 TCP 112 vrtstrapserver > op-probe [PSH, ACK] Seq=2997 Ack=85432 Win=65535 Len=54
389764 130.237448 41.177.211.31 -> 41.177.98.220 TCP 64 vrtstrapserver > op-probe [ACK] Seq=3051 Ack=87062 Win=65535 Len=0
389765 130.238390 41.177.211.31 -> 41.177.98.220 TCP 112 vrtstrapserver > op-probe [PSH, ACK] Seq=3051 Ack=87062 Win=65535 Len=54
389794 130.251095 41.177.211.31 -> 41.177.98.220 TCP 64 vrtstrapserver > op-probe [ACK] Seq=3105 Ack=88770 Win=65535 Len=0
389795 130.252029 41.177.211.31 -> 41.177.98.220 TCP 112 vrtstrapserver > op-probe [PSH, ACK] Seq=3105 Ack=88770 Win=65535 Len=54
389801 130.264780 41.177.211.31 -> 41.177.98.220 TCP 64 vrtstrapserver > op-probe [ACK] Seq=3159 Ack=90418 Win=65535 Len=0
389802 130.265722 41.177.211.31 -> 41.177.98.220 TCP 112 vrtstrapserver > op-probe [PSH, ACK] Seq=3159 Ack=90418 Win=65535 Len=54
389855 130.278691 41.177.211.31 -> 41.177.98.220 TCP 64 vrtstrapserver > op-probe [ACK] Seq=3213 Ack=92091 Win=65535 Len=0
389859 130.279651 41.177.211.31 -> 41.177.98.220 TCP 112 vrtstrapserver > op-probe [PSH, ACK] Seq=3213 Ack=92091 Win=65535 Len=54
389917 130.292487 41.177.211.31 -> 41.177.98.220 TCP 64 vrtstrapserver > op-probe [ACK] Seq=3267 Ack=93944 Win=65535 Len=0
389925 130.293455 41.177.211.31 -> 41.177.98.220 TCP 112 vrtstrapserver > op-probe [PSH, ACK] Seq=3267 Ack=93944 Win=65535 Len=54
389969 130.306409 41.177.211.31 -> 41.177.98.220 TCP 64 vrtstrapserver > op-probe [ACK] Seq=3321 Ack=95785 Win=65535 Len=0
389970 130.307288 41.177.211.31 -> 41.177.98.220 TCP 112 vrtstrapserver > op-probe [PSH, ACK] Seq=3321 Ack=95785 Win=65535 Len=54
390014 130.319963 41.177.211.31 -> 41.177.98.220 TCP 64 vrtstrapserver > op-probe [ACK] Seq=3375 Ack=97557 Win=65535 Len=0
390029 130.320902 41.177.211.31 -> 41.177.98.220 TCP 112 vrtstrapserver > op-probe [PSH, ACK] Seq=3375 Ack=97557 Win=65535 Len=54
390053 130.333643 41.177.211.31 -> 41.177.98.220 TCP 64 vrtstrapserver > op-probe [ACK] Seq=3429 Ack=99304 Win=65535 Len=0
390055 130.334549 41.177.211.31 -> 41.177.98.220 TCP 112 vrtstrapserver > op-probe [PSH, ACK] Seq=3429 Ack=99304 Win=65535 Len=54
390090 130.347423 41.177.211.31 -> 41.177.98.220 TCP 64 vrtstrapserver > op-probe [ACK] Seq=3483 Ack=101085 Win=65535 Len=0
390094 130.348374 41.177.211.31 -> 41.177.98.220 TCP 112 vrtstrapserver > op-probe [PSH, ACK] Seq=3483 Ack=101085 Win=65535 Len=54
390137 130.360930 41.177.211.31 -> 41.177.98.220 TCP 64 vrtstrapserver > op-probe [ACK] Seq=3537 Ack=102859 Win=65535 Len=0
390138 130.361904 41.177.211.31 -> 41.177.98.220 TCP 112 vrtstrapserver > op-probe [PSH, ACK] Seq=3537 Ack=102859 Win=65535 Len=54
390169 130.374294 41.177.211.31 -> 41.177.98.220 TCP 64 vrtstrapserver > op-probe [ACK] Seq=3591 Ack=104612 Win=65535 Len=0
390173 130.375237 41.177.211.31 -> 41.177.98.220 TCP 112 vrtstrapserver > op-probe [PSH, ACK] Seq=3591 Ack=104612 Win=65535 Len=54
390210 130.387794 41.177.211.31 -> 41.177.98.220 TCP 64 vrtstrapserver > op-probe [ACK] Seq=3645 Ack=106329 Win=65535 Len=0
390218 130.388762 41.177.211.31 -> 41.177.98.220 TCP 112 vrtstrapserver > op-probe [PSH, ACK] Seq=3645 Ack=106329 Win=65535 Len=54
390256 130.401165 41.177.211.31 -> 41.177.98.220 TCP 64 vrtstrapserver > op-probe [ACK] Seq=3699 Ack=108072 Win=65535 Len=0
390260 130.402098 41.177.211.31 -> 41.177.98.220 TCP 112 vrtstrapserver > op-probe [PSH, ACK] Seq=3699 Ack=108072 Win=65535 Len=54
390300 130.414611 41.177.211.31 -> 41.177.98.220 TCP 64 vrtstrapserver > op-probe [ACK] Seq=3753 Ack=109807 Win=65535 Len=0
390306 130.415642 41.177.211.31 -> 41.177.98.220 TCP 112 vrtstrapserver > op-probe [PSH, ACK] Seq=3753 Ack=109807 Win=65535 Len=54
390329 130.428333 41.177.211.31 -> 41.177.98.220 TCP 64 vrtstrapserver > op-probe [ACK] Seq=3807 Ack=111543 Win=65535 Len=0
390332 130.429264 41.177.211.31 -> 41.177.98.220 TCP 112 vrtstrapserver > op-probe [PSH, ACK] Seq=3807 Ack=111543 Win=65535 Len=54
390348 130.441918 41.177.211.31 -> 41.177.98.220 TCP 64 vrtstrapserver > op-probe [ACK] Seq=3861 Ack=113244 Win=65535 Len=0
390351 130.442857 41.177.211.31 -> 41.177.98.220 TCP 112 vrtstrapserver > op-probe [PSH, ACK] Seq=3861 Ack=113244 Win=65535 Len=54
390375 130.455553 41.177.211.31 -> 41.177.98.220 TCP 64 vrtstrapserver > op-probe [ACK] Seq=3915 Ack=114981 Win=65535 Len=0
390376 130.456492 41.177.211.31 -> 41.177.98.220 TCP 112 vrtstrapserver > op-probe [PSH, ACK] Seq=3915 Ack=114981 Win=65535 Len=54
390392 130.469739 41.177.211.31 -> 41.177.98.220 TCP 64 vrtstrapserver > op-probe [ACK] Seq=3969 Ack=116702 Win=65535 Len=0
390393 130.470675 41.177.211.31 -> 41.177.98.220 TCP 112 vrtstrapserver > op-probe [PSH, ACK] Seq=3969 Ack=116702 Win=65535 Len=54
390455 130.483532 41.177.211.31 -> 41.177.98.220 TCP 64 vrtstrapserver > op-probe [ACK] Seq=4023 Ack=118388 Win=65535 Len=0
390457 130.484449 41.177.211.31 -> 41.177.98.220 TCP 112 vrtstrapserver > op-probe [PSH, ACK] Seq=4023 Ack=118388 Win=65535 Len=54
390492 130.497267 41.177.211.31 -> 41.177.98.220 TCP 64 vrtstrapserver > op-probe [ACK] Seq=4077 Ack=120092 Win=65535 Len=0
390493 130.498201 41.177.211.31 -> 41.177.98.220 TCP 112 vrtstrapserver > op-probe [PSH, ACK] Seq=4077 Ack=120092 Win=65535 Len=54
390559 130.511071 41.177.211.31 -> 41.177.98.220 TCP 64 vrtstrapserver > op-probe [ACK] Seq=4131 Ack=121768 Win=65535 Len=0
390564 130.511983 41.177.211.31 -> 41.177.98.220 TCP 112 vrtstrapserver > op-probe [PSH, ACK] Seq=4131 Ack=121768 Win=65535 Len=54
390632 130.524823 41.177.211.31 -> 41.177.98.220 TCP 64 vrtstrapserver > op-probe [ACK] Seq=4185 Ack=123433 Win=65535 Len=0
390633 130.525727 41.177.211.31 -> 41.177.98.220 TCP 112 vrtstrapserver > op-probe [PSH, ACK] Seq=4185 Ack=123433 Win=65535 Len=54
390679 130.538534 41.177.211.31 -> 41.177.98.220 TCP 64 vrtstrapserver > op-probe [ACK] Seq=4239 Ack=125118 Win=65535 Len=0
390684 130.539495 41.177.211.31 -> 41.177.98.220 TCP 112 vrtstrapserver > op-probe [PSH, ACK] Seq=4239 Ack=125118 Win=65535 Len=54
390710 130.552265 41.177.211.31 -> 41.177.98.220 TCP 64 vrtstrapserver > op-probe [ACK] Seq=4293 Ack=126833 Win=65535 Len=0
390713 130.553237 41.177.211.31 -> 41.177.98.220 TCP 112 vrtstrapserver > op-probe [PSH, ACK] Seq=4293 Ack=126833 Win=65535 Len=54
390725 130.566029 41.177.211.31 -> 41.177.98.220 TCP 64 vrtstrapserver > op-probe [ACK] Seq=4347 Ack=128615 Win=65535 Len=0
390726 130.567039 41.177.211.31 -> 41.177.98.220 TCP 112 vrtstrapserver > op-probe [PSH, ACK] Seq=4347 Ack=128615 Win=65535 Len=54
390742 130.579778 41.177.211.31 -> 41.177.98.220 TCP 64 vrtstrapserver > op-probe [ACK] Seq=4401 Ack=130347 Win=65535 Len=0
390743 130.580746 41.177.211.31 -> 41.177.98.220 TCP 112 vrtstrapserver > op-probe [PSH, ACK] Seq=4401 Ack=130347 Win=65535 Len=54
390791 130.593344 41.177.211.31 -> 41.177.98.220 TCP 64 vrtstrapserver > op-probe [ACK] Seq=4455 Ack=131972 Win=65535 Len=0
390792 130.594276 41.177.211.31 -> 41.177.98.220 TCP 112 vrtstrapserver > op-probe [PSH, ACK] Seq=4455 Ack=131972 Win=65535 Len=54
390799 130.598042 41.177.211.31 -> 41.177.98.220 TCP 110 vrtstrapserver > op-probe [PSH, ACK] Seq=4509 Ack=132338 Win=65169 Len=52
390845 130.631542 41.177.211.31 -> 41.177.98.220 TCP 112 vrtstrapserver > op-probe [PSH, ACK] Seq=4561 Ack=133406 Win=65535 Len=54
390853 130.635212 41.177.211.31 -> 41.177.98.220 TCP 142 vrtstrapserver > op-probe [PSH, ACK] Seq=4615 Ack=133797 Win=65144 Len=84
390860 130.637170 41.177.211.31 -> 41.177.98.220 TCP 112 vrtstrapserver > op-probe [PSH, ACK] Seq=4699 Ack=133907 Win=65034 Len=54
390871 130.642949 41.177.211.31 -> 41.177.98.220 TCP 64 vrtstrapserver > op-probe [ACK] Seq=4753 Ack=139380 Win=65535 Len=0
390876 130.645664 41.177.211.31 -> 41.177.98.220 TCP 115 vrtstrapserver > op-probe [PSH, ACK] Seq=4753 Ack=139380 Win=65535 Len=57
390937 130.665451 41.177.211.31 -> 41.177.98.220 TCP 64 vrtstrapserver > op-probe [ACK] Seq=4810 Ack=147660 Win=65535 Len=0
390943 130.665557 41.177.211.31 -> 41.177.98.220 TCP 64 vrtstrapserver > op-probe [ACK] Seq=4810 Ack=150420 Win=65535 Len=0
390946 130.665622 41.177.211.31 -> 41.177.98.220 TCP 64 vrtstrapserver > op-probe [ACK] Seq=4810 Ack=157320 Win=64155 Len=0
390948 130.665630 41.177.211.31 -> 41.177.98.220 TCP 64 [TCP Window Update] vrtstrapserver > op-probe [ACK] Seq=4810 Ack=157320 Win=65535 Len=0
390952 130.665688 41.177.211.31 -> 41.177.98.220 TCP 64 vrtstrapserver > op-probe [ACK] Seq=4810 Ack=161460 Win=65535 Len=0
390956 130.665750 41.177.211.31 -> 41.177.98.220 TCP 64 vrtstrapserver > op-probe [ACK] Seq=4810 Ack=165600 Win=64155 Len=0
390960 130.665812 41.177.211.31 -> 41.177.98.220 TCP 64 vrtstrapserver > op-probe [ACK] Seq=4810 Ack=171120 Win=58635 Len=0
390963 130.665864 41.177.211.31 -> 41.177.98.220 TCP 64 [TCP Window Update] vrtstrapserver > op-probe [ACK] Seq=4810 Ack=171120 Win=65535 Len=0
390967 130.665946 41.177.211.31 -> 41.177.98.220 TCP 64 vrtstrapserver > op-probe [ACK] Seq=4810 Ack=176640 Win=61395 Len=0
390972 130.665974 41.177.211.31 -> 41.177.98.220 TCP 64 vrtstrapserver > op-probe [ACK] Seq=4810 Ack=180780 Win=57255 Len=0
390973 130.666009 41.177.211.31 -> 41.177.98.220 TCP 64 vrtstrapserver > op-probe [ACK] Seq=4810 Ack=184920 Win=53115 Len=0
390974 130.666051 41.177.211.31 -> 41.177.98.220 TCP 64 vrtstrapserver > op-probe [ACK] Seq=4810 Ack=187680 Win=50355 Len=0
390975 130.666099 41.177.211.31 -> 41.177.98.220 TCP 64 [TCP Window Update] vrtstrapserver > op-probe [ACK] Seq=4810 Ack=187680 Win=65535 Len=0
390976 130.666134 41.177.211.31 -> 41.177.98.220 TCP 64 vrtstrapserver > op-probe [ACK] Seq=4810 Ack=194580 Win=58635 Len=0
390977 130.666193 41.177.211.31 -> 41.177.98.220 TCP 64 vrtstrapserver > op-probe [ACK] Seq=4810 Ack=198720 Win=54495 Len=0
390978 130.666250 41.177.211.31 -> 41.177.98.220 TCP 64 vrtstrapserver > op-probe [ACK] Seq=4810 Ack=201480 Win=51735 Len=0
390979 130.666292 41.177.211.31 -> 41.177.98.220 TCP 64 vrtstrapserver > op-probe [ACK] Seq=4810 Ack=204982 Win=48233 Len=0
390980 130.666342 41.177.211.31 -> 41.177.98.220 TCP 64 [TCP Window Update] vrtstrapserver > op-probe [ACK] Seq=4810 Ack=204982 Win=51993 Len=0
390981 130.666617 41.177.211.31 -> 41.177.98.220 TCP 64 [TCP Window Update] vrtstrapserver > op-probe [ACK] Seq=4810 Ack=204982 Win=65535 Len=0
391075 130.697264 41.177.211.31 -> 41.177.98.220 TCP 118 vrtstrapserver > op-probe [PSH, ACK] Seq=4810 Ack=204982 Win=65535 Len=60
391104 130.706981 41.177.211.31 -> 41.177.98.220 TCP 64 vrtstrapserver > op-probe [ACK] Seq=4870 Ack=209122 Win=65535 Len=0
391118 130.709608 41.177.211.31 -> 41.177.98.220 TCP 115 vrtstrapserver > op-probe [PSH, ACK] Seq=4870 Ack=209898 Win=64759 Len=57
391195 130.728343 41.177.211.31 -> 41.177.98.220 TCP 64 vrtstrapserver > op-probe [ACK] Seq=4927 Ack=215418 Win=65535 Len=0
391199 130.728408 41.177.211.31 -> 41.177.98.220 TCP 64 vrtstrapserver > op-probe [ACK] Seq=4927 Ack=219558 Win=65535 Len=0
391205 130.728514 41.177.211.31 -> 41.177.98.220 TCP 64 vrtstrapserver > op-probe [ACK] Seq=4927 Ack=226458 Win=65535 Len=0
391208 130.728546 41.177.211.31 -> 41.177.98.220 TCP 64 vrtstrapserver > op-probe [ACK] Seq=4927 Ack=229218 Win=65535 Len=0
391215 130.728694 41.177.211.31 -> 41.177.98.220 TCP 64 vrtstrapserver > op-probe [ACK] Seq=4927 Ack=236118 Win=64155 Len=0
391219 130.728740 41.177.211.31 -> 41.177.98.220 TCP 64 vrtstrapserver > op-probe [ACK] Seq=4927 Ack=240258 Win=60015 Len=0
391226 130.728869 41.177.211.31 -> 41.177.98.220 TCP 64 vrtstrapserver > op-probe [ACK] Seq=4927 Ack=245778 Win=64155 Len=0
391228 130.728891 41.177.211.31 -> 41.177.98.220 TCP 64 vrtstrapserver > op-probe [ACK] Seq=4927 Ack=249918 Win=60015 Len=0
391231 130.728921 41.177.211.31 -> 41.177.98.220 TCP 64 vrtstrapserver > op-probe [ACK] Seq=4927 Ack=245778 Win=64155 Len=0
391232 130.728956 41.177.211.31 -> 41.177.98.220 TCP 64 vrtstrapserver > op-probe [ACK] Seq=4927 Ack=256818 Win=53115 Len=0
391233 130.729059 41.177.211.31 -> 41.177.98.220 TCP 64 vrtstrapserver > op-probe [ACK] Seq=4927 Ack=260958 Win=48975 Len=0
391234 130.729064 41.177.211.31 -> 41.177.98.220 TCP 64 vrtstrapserver > op-probe [ACK] Seq=4927 Ack=263718 Win=46215 Len=0
391235 130.729107 41.177.211.31 -> 41.177.98.220 TCP 64 vrtstrapserver > op-probe [ACK] Seq=4927 Ack=266478 Win=43455 Len=0
391236 130.729242 41.177.211.31 -> 41.177.98.220 TCP 64 [TCP Window Update] vrtstrapserver > op-probe [ACK] Seq=4927 Ack=266478 Win=65535 Len=0
391237 130.729246 41.177.211.31 -> 41.177.98.220 TCP 64 vrtstrapserver > op-probe [ACK] Seq=4927 Ack=275500 Win=56513 Len=0
391238 130.729730 41.177.211.31 -> 41.177.98.220 TCP 64 [TCP Window Update] vrtstrapserver > op-probe [ACK] Seq=4927 Ack=275500 Win=60273 Len=0
391239 130.730005 41.177.211.31 -> 41.177.98.220 TCP 64 [TCP Window Update] vrtstrapserver > op-probe [ACK] Seq=4927 Ack=275500 Win=65535 Len=0
391254 130.748924 41.177.211.31 -> 41.177.98.220 TCP 124 vrtstrapserver > op-probe [PSH, ACK] Seq=4927 Ack=275500 Win=65535 Len=66
391282 130.756423 41.177.211.31 -> 41.177.98.220 TCP 124 vrtstrapserver > op-probe [PSH, ACK] Seq=4993 Ack=276254 Win=64781 Len=66
391286 130.758136 41.177.211.31 -> 41.177.98.220 TCP 124 vrtstrapserver > op-probe [PSH, ACK] Seq=5059 Ack=276352 Win=64683 Len=66
391376 130.780905 41.177.211.31 -> 41.177.98.220 TCP 64 vrtstrapserver > op-probe [ACK] Seq=5125 Ack=279872 Win=65535 Len=0
391378 130.783192 41.177.211.31 -> 41.177.98.220 TCP 124 vrtstrapserver > op-probe [PSH, ACK] Seq=5125 Ack=279872 Win=65535 Len=66
391817 130.972602 41.177.211.31 -> 41.177.98.220 TCP 64 vrtstrapserver > op-probe [ACK] Seq=5191 Ack=280513 Win=64894 Len=0
