216950  74.194326 41.177.211.120 -> 41.177.98.220 TCP 131 unizensus > op-probe [PSH, ACK] Seq=1 Ack=1 Win=65535 Len=73
217144  74.212641 41.177.211.120 -> 41.177.98.220 TCP 186 unizensus > op-probe [PSH, ACK] Seq=74 Ack=109 Win=65427 Len=128
218083  74.450394 41.177.211.120 -> 41.177.98.220 TCP 64 unizensus > op-probe [ACK] Seq=202 Ack=382 Win=65154 Len=0
226501  77.456673 41.177.211.120 -> 41.177.98.220 TCP 155 unizensus > op-probe [PSH, ACK] Seq=202 Ack=382 Win=65154 Len=97
227220  77.755720 41.177.211.120 -> 41.177.98.220 TCP 64 unizensus > op-probe [ACK] Seq=299 Ack=887 Win=65535 Len=0
