42557  17.935388 41.177.26.72 -> 244.3.160.248 TCP 66 http > 43724 [SYN, ACK] Seq=0 Ack=1 Win=64240 Len=0 MSS=1460 SACK_PERM=1
42560  17.936191 41.177.26.72 -> 244.3.160.248 TCP 64 http > 43724 [ACK] Seq=1 Ack=863 Win=63378 Len=0
56268  23.104713 41.177.26.72 -> 244.3.160.248 TCP 64 http > 43724 [FIN, ACK] Seq=1657 Ack=863 Win=64240 Len=0
60053  24.235542 41.177.26.72 -> 244.3.160.248 TCP 66 http > 43762 [SYN, ACK] Seq=0 Ack=1 Win=64240 Len=0 MSS=1460 SACK_PERM=1
60058  24.236307 41.177.26.72 -> 244.3.160.248 TCP 64 http > 43762 [ACK] Seq=1 Ack=826 Win=63415 Len=0
71287  29.404752 41.177.26.72 -> 244.3.160.248 TCP 64 http > 43762 [FIN, ACK] Seq=1656 Ack=826 Win=64240 Len=0
85284  33.118998 41.177.26.72 -> 244.3.160.248 TCP 64 http > 43724 [ACK] Seq=1658 Ack=864 Win=64240 Len=0
87234  33.773117 41.177.26.72 -> 244.3.160.248 TCP 66 http > 43841 [SYN, ACK] Seq=0 Ack=1 Win=64240 Len=0 MSS=1460 SACK_PERM=1
87237  33.774012 41.177.26.72 -> 244.3.160.248 TCP 64 http > 43841 [ACK] Seq=1 Ack=593 Win=63648 Len=0
87299  33.794931 41.177.26.72 -> 244.3.160.248 TCP 64 http > 43841 [FIN, ACK] Seq=1219 Ack=593 Win=64240 Len=0
87303  33.795853 41.177.26.72 -> 244.3.160.248 TCP 64 http > 43841 [ACK] Seq=1220 Ack=594 Win=64240 Len=0
87330  33.800216 41.177.26.72 -> 244.3.160.248 TCP 66 http > 43842 [SYN, ACK] Seq=0 Ack=1 Win=64240 Len=0 MSS=1460 SACK_PERM=1
87339  33.801094 41.177.26.72 -> 244.3.160.248 TCP 64 http > 43842 [ACK] Seq=1 Ack=658 Win=63583 Len=0
87384  33.809930 41.177.26.72 -> 244.3.160.248 TCP 64 http > 43842 [FIN, ACK] Seq=2337 Ack=658 Win=64240 Len=0
87389  33.810691 41.177.26.72 -> 244.3.160.248 TCP 64 http > 43842 [ACK] Seq=2338 Ack=659 Win=64240 Len=0
87437  33.825969 41.177.26.72 -> 244.3.160.248 TCP 66 http > 43844 [SYN, ACK] Seq=0 Ack=1 Win=64240 Len=0 MSS=1460 SACK_PERM=1
87443  33.826620 41.177.26.72 -> 244.3.160.248 TCP 64 http > 43844 [ACK] Seq=1 Ack=722 Win=63519 Len=0
87491  33.837626 41.177.26.72 -> 244.3.160.248 TCP 64 http > 43844 [FIN, ACK] Seq=670 Ack=722 Win=64240 Len=0
87495  33.838200 41.177.26.72 -> 244.3.160.248 TCP 64 http > 43844 [ACK] Seq=671 Ack=723 Win=64240 Len=0
116087  41.417265 41.177.26.72 -> 244.3.160.248 TCP 64 http > 43762 [ACK] Seq=1657 Ack=827 Win=64240 Len=0
158605  54.032582 41.177.26.72 -> 244.3.160.248 TCP 66 http > 44096 [SYN, ACK] Seq=0 Ack=1 Win=64240 Len=0 MSS=1460 SACK_PERM=1
158609  54.033409 41.177.26.72 -> 244.3.160.248 TCP 64 http > 44096 [ACK] Seq=1 Ack=597 Win=63644 Len=0
158768  54.056968 41.177.26.72 -> 244.3.160.248 TCP 64 http > 44096 [FIN, ACK] Seq=1137 Ack=597 Win=64240 Len=0
158772  54.057634 41.177.26.72 -> 244.3.160.248 TCP 64 http > 44096 [ACK] Seq=1138 Ack=598 Win=64240 Len=0
158774  54.059422 41.177.26.72 -> 244.3.160.248 TCP 66 http > 44097 [SYN, ACK] Seq=0 Ack=1 Win=64240 Len=0 MSS=1460 SACK_PERM=1
158777  54.060230 41.177.26.72 -> 244.3.160.248 TCP 64 http > 44097 [ACK] Seq=1 Ack=668 Win=63573 Len=0
158829  54.071527 41.177.26.72 -> 244.3.160.248 TCP 64 http > 44097 [FIN, ACK] Seq=2337 Ack=668 Win=64240 Len=0
158834  54.072633 41.177.26.72 -> 244.3.160.248 TCP 64 http > 44097 [ACK] Seq=2338 Ack=669 Win=64240 Len=0
250619  88.477948 41.177.26.72 -> 244.3.160.248 TCP 66 http > 44401 [SYN, ACK] Seq=0 Ack=1 Win=64240 Len=0 MSS=1460 SACK_PERM=1
250622  88.478852 41.177.26.72 -> 244.3.160.248 TCP 64 http > 44401 [ACK] Seq=1 Ack=1171 Win=63070 Len=0
277496  93.645649 41.177.26.72 -> 244.3.160.248 TCP 64 http > 44401 [FIN, ACK] Seq=1657 Ack=1171 Win=64240 Len=0
280738  94.527147 41.177.26.72 -> 244.3.160.248 TCP 66 http > 44527 [SYN, ACK] Seq=0 Ack=1 Win=64240 Len=0 MSS=1460 SACK_PERM=1
280742  94.527889 41.177.26.72 -> 244.3.160.248 TCP 64 http > 44527 [ACK] Seq=1 Ack=1041 Win=63200 Len=0
295566  99.685671 41.177.26.72 -> 244.3.160.248 TCP 64 http > 44527 [FIN, ACK] Seq=1657 Ack=1041 Win=64240 Len=0
309716 105.658300 41.177.26.72 -> 244.3.160.248 TCP 64 http > 44401 [ACK] Seq=1658 Ack=1172 Win=64240 Len=0
324962 111.688880 41.177.26.72 -> 244.3.160.248 TCP 64 http > 44527 [ACK] Seq=1658 Ack=1042 Win=64240 Len=0
397710 133.786573 41.177.26.72 -> 244.3.160.248 TCP 66 http > 45005 [SYN, ACK] Seq=0 Ack=1 Win=64240 Len=0 MSS=1460 SACK_PERM=1
397721 133.787390 41.177.26.72 -> 244.3.160.248 TCP 64 http > 45005 [ACK] Seq=1 Ack=842 Win=63399 Len=0
417615 138.956228 41.177.26.72 -> 244.3.160.248 TCP 64 http > 45005 [FIN, ACK] Seq=1657 Ack=842 Win=64240 Len=0
461061 150.959222 41.177.26.72 -> 244.3.160.248 TCP 64 http > 45005 [ACK] Seq=1658 Ack=843 Win=64240 Len=0
521727 169.031824 41.177.26.72 -> 244.3.160.248 TCP 66 http > 45324 [SYN, ACK] Seq=0 Ack=1 Win=64240 Len=0 MSS=1460 SACK_PERM=1
521730 169.032626 41.177.26.72 -> 244.3.160.248 TCP 64 http > 45324 [ACK] Seq=1 Ack=882 Win=63359 Len=0
532113 172.575010 41.177.26.72 -> 244.3.160.248 TCP 66 http > 45370 [SYN, ACK] Seq=0 Ack=1 Win=64240 Len=0 MSS=1460 SACK_PERM=1
532116 172.575822 41.177.26.72 -> 244.3.160.248 TCP 64 http > 45370 [ACK] Seq=1 Ack=857 Win=63384 Len=0
537955 174.196735 41.177.26.72 -> 244.3.160.248 TCP 64 http > 45324 [FIN, ACK] Seq=1657 Ack=882 Win=64240 Len=0
552463 177.736701 41.177.26.72 -> 244.3.160.248 TCP 64 http > 45370 [FIN, ACK] Seq=1657 Ack=857 Win=64240 Len=0
584242 186.189866 41.177.26.72 -> 244.3.160.248 TCP 64 http > 45324 [ACK] Seq=1658 Ack=883 Win=64240 Len=0
598636 189.729924 41.177.26.72 -> 244.3.160.248 TCP 64 http > 45370 [ACK] Seq=1658 Ack=858 Win=64240 Len=0
684931 214.965985 41.177.26.72 -> 244.3.160.248 TCP 66 http > 45704 [SYN, ACK] Seq=0 Ack=1 Win=64240 Len=0 MSS=1460 SACK_PERM=1
684934 214.966829 41.177.26.72 -> 244.3.160.248 TCP 64 http > 45704 [ACK] Seq=1 Ack=985 Win=63256 Len=0
692605 218.744859 41.177.26.72 -> 244.3.160.248 TCP 66 http > 45726 [SYN, ACK] Seq=0 Ack=1 Win=64240 Len=0 MSS=1460 SACK_PERM=1
692614 218.745663 41.177.26.72 -> 244.3.160.248 TCP 64 http > 45726 [ACK] Seq=1 Ack=884 Win=63357 Len=0
695475 220.127468 41.177.26.72 -> 244.3.160.248 TCP 64 http > 45704 [FIN, ACK] Seq=1657 Ack=985 Win=64240 Len=0
703427 223.767331 41.177.26.72 -> 244.3.160.248 TCP 64 http > 45726 [FIN, ACK] Seq=4870 Ack=884 Win=64240 Len=0
709243 225.951428 41.177.26.72 -> 244.3.160.248 TCP 66 http > 45741 [SYN, ACK] Seq=0 Ack=1 Win=64240 Len=0 MSS=1460 SACK_PERM=1
709246 225.952068 41.177.26.72 -> 244.3.160.248 TCP 64 http > 45741 [ACK] Seq=1 Ack=538 Win=63703 Len=0
722795 231.117415 41.177.26.72 -> 244.3.160.248 TCP 64 http > 45741 [FIN, ACK] Seq=1657 Ack=538 Win=64240 Len=0
725137 232.130714 41.177.26.72 -> 244.3.160.248 TCP 64 http > 45704 [ACK] Seq=1658 Ack=986 Win=64240 Len=0
738543 235.770865 41.177.26.72 -> 244.3.160.248 TCP 64 http > 45726 [ACK] Seq=4871 Ack=885 Win=64240 Len=0
756037 243.330846 41.177.26.72 -> 244.3.160.248 TCP 64 http > 45741 [ACK] Seq=1658 Ack=539 Win=64240 Len=0
839324 275.112881 41.177.26.72 -> 244.3.160.248 TCP 66 http > 46192 [SYN, ACK] Seq=0 Ack=1 Win=64240 Len=0 MSS=1460 SACK_PERM=1
839327 275.113721 41.177.26.72 -> 244.3.160.248 TCP 64 http > 46192 [ACK] Seq=1 Ack=906 Win=63335 Len=0
846186 278.806218 41.177.26.72 -> 244.3.160.248 TCP 66 http > 46236 [SYN, ACK] Seq=0 Ack=1 Win=64240 Len=0 MSS=1460 SACK_PERM=1
846191 278.807019 41.177.26.72 -> 244.3.160.248 TCP 64 http > 46236 [ACK] Seq=1 Ack=678 Win=63563 Len=0
848229 280.278072 41.177.26.72 -> 244.3.160.248 TCP 64 http > 46192 [FIN, ACK] Seq=1657 Ack=906 Win=64240 Len=0
860963 283.968184 41.177.26.72 -> 244.3.160.248 TCP 64 http > 46236 [FIN, ACK] Seq=1657 Ack=678 Win=64240 Len=0
877977 291.358043 41.177.26.72 -> 244.3.160.248 TCP 64 http > 46192 [ACK] Seq=1658 Ack=907 Win=64240 Len=0
890510 294.775163 41.177.26.72 -> 244.3.160.248 TCP 64 http > 46236 [ACK] Seq=1658 Ack=679 Win=64240 Len=0
957428 317.869752 41.177.26.72 -> 244.3.160.248 TCP 66 http > 46615 [SYN, ACK] Seq=0 Ack=1 Win=64240 Len=0 MSS=1460 SACK_PERM=1
957434 317.870538 41.177.26.72 -> 244.3.160.248 TCP 64 http > 46615 [ACK] Seq=1 Ack=1019 Win=63222 Len=0
969709 323.038796 41.177.26.72 -> 244.3.160.248 TCP 64 http > 46615 [FIN, ACK] Seq=1657 Ack=1019 Win=64240 Len=0
1001001 335.052523 41.177.26.72 -> 244.3.160.248 TCP 64 http > 46615 [ACK] Seq=1658 Ack=1020 Win=64240 Len=0
