670240 208.769281 41.177.46.138 -> 244.3.153.48 TCP 66 https > msmq [SYN, ACK] Seq=0 Ack=1 Win=5840 Len=0 MSS=1380 SACK_PERM=1
670246 208.772604 41.177.46.138 -> 244.3.153.48 TCP 64 https > msmq [ACK] Seq=1 Ack=202 Win=6432 Len=0
670414 208.809358 41.177.46.138 -> 244.3.153.48 TCP 64 https > msmq [ACK] Seq=1366 Ack=2005 Win=11500 Len=0
671263 209.114322 41.177.46.138 -> 244.3.153.48 TCP 64 https > msmq [ACK] Seq=44010 Ack=3770 Win=16100 Len=0
682865 214.156773 41.177.46.138 -> 244.3.153.48 TCP 64 https > msmq [FIN, ACK] Seq=90947 Ack=3770 Win=16100 Len=0
932173 310.556072 41.177.46.138 -> 244.3.153.48 TCP 66 https > tdp-suite [SYN, ACK] Seq=0 Ack=1 Win=5840 Len=0 MSS=1380 SACK_PERM=1
932186 310.559249 41.177.46.138 -> 244.3.153.48 TCP 64 https > tdp-suite [ACK] Seq=1 Ack=202 Win=6432 Len=0
932269 310.580170 41.177.46.138 -> 244.3.153.48 TCP 64 https > tdp-suite [ACK] Seq=139 Ack=1866 Win=11500 Len=0
934083 311.234426 41.177.46.138 -> 244.3.153.48 TCP 64 https > tdp-suite [ACK] Seq=42783 Ack=3631 Win=16100 Len=0
953819 316.273240 41.177.46.138 -> 244.3.153.48 TCP 64 https > tdp-suite [FIN, ACK] Seq=89720 Ack=3631 Win=16100 Len=0
963596 320.603435 41.177.46.138 -> 244.3.153.48 TCP 64 https > tdp-suite [RST] Seq=89721 Win=0 Len=0
