914154 302.779228 41.122.241.239 -> 41.177.26.176 TCP 66 spandataport > http [SYN] Seq=0 Win=8576 Len=0 MSS=536 SACK_PERM=1
914457 302.942726 41.122.241.239 -> 41.177.26.176 TCP 64 spandataport > http [ACK] Seq=1 Ack=1 Win=8576 Len=0
915372 303.587851 41.122.241.239 -> 41.177.26.176 TCP 64 spandataport > http [ACK] Seq=433 Ack=270 Win=8307 Len=0
915375 303.589083 41.122.241.239 -> 41.177.26.176 TCP 64 spandataport > http [ACK] Seq=433 Ack=596 Win=8576 Len=0
915379 303.590620 41.122.241.239 -> 41.177.26.176 TCP 64 spandataport > http [ACK] Seq=433 Ack=1138 Win=8576 Len=0
915482 303.670629 41.122.241.239 -> 41.177.26.176 TCP 66 ncu-2 > http [SYN] Seq=0 Win=8576 Len=0 MSS=536 SACK_PERM=1
915492 303.674412 41.122.241.239 -> 41.177.26.176 TCP 66 embrace-dp-s > http [SYN] Seq=0 Win=8576 Len=0 MSS=536 SACK_PERM=1
915533 303.709054 41.122.241.239 -> 41.177.26.176 TCP 64 spandataport > http [ACK] Seq=433 Ack=1674 Win=8576 Len=0
915562 303.752715 41.122.241.239 -> 41.177.26.176 TCP 64 spandataport > http [ACK] Seq=433 Ack=2746 Win=8576 Len=0
915566 303.753714 41.122.241.239 -> 41.177.26.176 TCP 64 spandataport > http [ACK] Seq=433 Ack=3818 Win=8576 Len=0
915570 303.755672 41.122.241.239 -> 41.177.26.176 TCP 64 spandataport > http [ACK] Seq=433 Ack=4890 Win=8576 Len=0
915597 303.777967 41.122.241.239 -> 41.177.26.176 TCP 66 dmod-workspace > http [SYN] Seq=0 Win=8576 Len=0 MSS=536 SACK_PERM=1
915758 303.832167 41.122.241.239 -> 41.177.26.176 TCP 64 ncu-2 > http [ACK] Seq=1 Ack=1 Win=8576 Len=0
915766 303.836171 41.122.241.239 -> 41.177.26.176 TCP 64 embrace-dp-s > http [ACK] Seq=1 Ack=1 Win=8576 Len=0
915828 303.871872 41.122.241.239 -> 41.177.26.176 TCP 64 spandataport > http [ACK] Seq=433 Ack=5668 Win=8576 Len=0
915901 303.915010 41.122.241.239 -> 41.177.26.176 TCP 64 spandataport > http [ACK] Seq=433 Ack=6740 Win=8576 Len=0
915909 303.918405 41.122.241.239 -> 41.177.26.176 TCP 64 spandataport > http [ACK] Seq=433 Ack=7812 Win=8576 Len=0
915910 303.920172 41.122.241.239 -> 41.177.26.176 TCP 64 spandataport > http [ACK] Seq=433 Ack=8884 Win=8576 Len=0
915911 303.921248 41.122.241.239 -> 41.177.26.176 TCP 64 spandataport > http [ACK] Seq=433 Ack=9617 Win=8576 Len=0
915914 303.922425 41.122.241.239 -> 41.177.26.176 TCP 64 spandataport > http [ACK] Seq=433 Ack=10269 Win=8576 Len=0
915935 303.939669 41.122.241.239 -> 41.177.26.176 TCP 64 dmod-workspace > http [ACK] Seq=1 Ack=1 Win=8576 Len=0
916030 304.003461 41.122.241.239 -> 41.177.26.176 TCP 64 ncu-2 > http [ACK] Seq=407 Ack=277 Win=8300 Len=0
916033 304.007641 41.122.241.239 -> 41.177.26.176 TCP 64 ncu-2 > http [ACK] Seq=407 Ack=917 Win=8576 Len=0
916039 304.009063 41.122.241.239 -> 41.177.26.176 TCP 64 ncu-2 > http [ACK] Seq=407 Ack=924 Win=8569 Len=0
916041 304.010151 41.122.241.239 -> 41.177.26.176 TCP 64 ncu-2 > http [ACK] Seq=407 Ack=1996 Win=8576 Len=0
916047 304.014612 41.122.241.239 -> 41.177.26.176 TCP 64 embrace-dp-s > http [ACK] Seq=454 Ack=824 Win=8576 Len=0
916048 304.014663 41.122.241.239 -> 41.177.26.176 TCP 64 embrace-dp-s > http [ACK] Seq=454 Ack=1896 Win=8576 Len=0
916130 304.036102 41.122.241.239 -> 41.177.26.176 TCP 64 spandataport > http [ACK] Seq=433 Ack=11218 Win=8576 Len=0
916150 304.045593 41.122.241.239 -> 41.177.26.176 TCP 66 cpq-tasksmart > http [SYN] Seq=0 Win=8576 Len=0 MSS=536 SACK_PERM=1
916204 304.109127 41.122.241.239 -> 41.177.26.176 TCP 64 dmod-workspace > http [ACK] Seq=463 Ack=821 Win=8576 Len=0
916267 304.169959 41.122.241.239 -> 41.177.26.176 TCP 64 ncu-2 > http [ACK] Seq=407 Ack=3068 Win=8576 Len=0
916273 304.171365 41.122.241.239 -> 41.177.26.176 TCP 64 ncu-2 > http [ACK] Seq=407 Ack=3666 Win=8576 Len=0
916276 304.172320 41.122.241.239 -> 41.177.26.176 TCP 64 ncu-2 > http [ACK] Seq=407 Ack=4738 Win=8576 Len=0
916277 304.173051 41.122.241.239 -> 41.177.26.176 TCP 64 ncu-2 > http [ACK] Seq=407 Ack=5758 Win=8576 Len=0
916287 304.177708 41.122.241.239 -> 41.177.26.176 TCP 64 embrace-dp-s > http [ACK] Seq=454 Ack=2968 Win=8576 Len=0
916293 304.179745 41.122.241.239 -> 41.177.26.176 TCP 64 embrace-dp-s > http [ACK] Seq=454 Ack=4040 Win=8576 Len=0
916297 304.180212 41.122.241.239 -> 41.177.26.176 TCP 64 embrace-dp-s > http [ACK] Seq=454 Ack=5112 Win=8576 Len=0
916320 304.206580 41.122.241.239 -> 41.177.26.176 TCP 64 cpq-tasksmart > http [ACK] Seq=1 Ack=1 Win=8576 Len=0
916334 304.216796 41.122.241.239 -> 41.177.26.176 TCP 64 spandataport > http [ACK] Seq=873 Ack=12214 Win=8576 Len=0
916349 304.219900 41.122.241.239 -> 41.177.26.176 TCP 64 spandataport > http [ACK] Seq=873 Ack=13286 Win=8576 Len=0
916350 304.220534 41.122.241.239 -> 41.177.26.176 TCP 64 spandataport > http [ACK] Seq=873 Ack=13993 Win=8576 Len=0
916434 304.283129 41.122.241.239 -> 41.177.26.176 TCP 64 dmod-workspace > http [ACK] Seq=918 Ack=1875 Win=8576 Len=0
916438 304.283873 41.122.241.239 -> 41.177.26.176 TCP 64 dmod-workspace > http [ACK] Seq=918 Ack=2947 Win=8576 Len=0
916443 304.285649 41.122.241.239 -> 41.177.26.176 TCP 64 dmod-workspace > http [ACK] Seq=918 Ack=4019 Win=8576 Len=0
916497 304.332132 41.122.241.239 -> 41.177.26.176 TCP 64 ncu-2 > http [ACK] Seq=407 Ack=6517 Win=8576 Len=0
916499 304.332898 41.122.241.239 -> 41.177.26.176 TCP 64 ncu-2 > http [ACK] Seq=407 Ack=7169 Win=8576 Len=0
916502 304.334749 41.122.241.239 -> 41.177.26.176 TCP 64 ncu-2 > http [ACK] Seq=407 Ack=8118 Win=8576 Len=0
916515 304.340406 41.122.241.239 -> 41.177.26.176 TCP 64 embrace-dp-s > http [ACK] Seq=454 Ack=6184 Win=8576 Len=0
916524 304.342438 41.122.241.239 -> 41.177.26.176 TCP 64 embrace-dp-s > http [ACK] Seq=454 Ack=7256 Win=8576 Len=0
916529 304.343512 41.122.241.239 -> 41.177.26.176 TCP 64 embrace-dp-s > http [ACK] Seq=454 Ack=8328 Win=8576 Len=0
916535 304.345189 41.122.241.239 -> 41.177.26.176 TCP 64 embrace-dp-s > http [ACK] Seq=454 Ack=9016 Win=8576 Len=0
916567 304.350939 41.122.241.239 -> 41.177.26.176 TCP 64 ncu-2 > http [FIN, ACK] Seq=407 Ack=8330 Win=8364 Len=0
916628 304.383172 41.122.241.239 -> 41.177.26.176 TCP 64 cpq-tasksmart > http [ACK] Seq=445 Ack=823 Win=8576 Len=0
916629 304.383176 41.122.241.239 -> 41.177.26.176 TCP 64 cpq-tasksmart > http [ACK] Seq=445 Ack=1895 Win=8576 Len=0
916663 304.404027 41.122.241.239 -> 41.177.26.176 TCP 64 spandataport > http [ACK] Seq=1323 Ack=14814 Win=8576 Len=0
916664 304.404691 41.122.241.239 -> 41.177.26.176 TCP 64 spandataport > http [ACK] Seq=1323 Ack=15886 Win=8576 Len=0
916727 304.446890 41.122.241.239 -> 41.177.26.176 TCP 64 dmod-workspace > http [ACK] Seq=918 Ack=5091 Win=8576 Len=0
916731 304.447791 41.122.241.239 -> 41.177.26.176 TCP 64 dmod-workspace > http [ACK] Seq=918 Ack=6163 Win=8576 Len=0
916736 304.449784 41.122.241.239 -> 41.177.26.176 TCP 64 dmod-workspace > http [ACK] Seq=918 Ack=7235 Win=8576 Len=0
916737 304.450962 41.122.241.239 -> 41.177.26.176 TCP 64 dmod-workspace > http [ACK] Seq=918 Ack=8307 Win=8576 Len=0
916818 304.502881 41.122.241.239 -> 41.177.26.176 TCP 64 embrace-dp-s > http [ACK] Seq=454 Ack=10088 Win=8576 Len=0
916825 304.504085 41.122.241.239 -> 41.177.26.176 TCP 64 embrace-dp-s > http [ACK] Seq=454 Ack=11160 Win=8576 Len=0
916833 304.505211 41.122.241.239 -> 41.177.26.176 TCP 64 embrace-dp-s > http [ACK] Seq=454 Ack=12232 Win=8576 Len=0
916847 304.507159 41.122.241.239 -> 41.177.26.176 TCP 64 embrace-dp-s > http [ACK] Seq=454 Ack=13304 Win=8576 Len=0
916860 304.508731 41.122.241.239 -> 41.177.26.176 TCP 64 embrace-dp-s > http [ACK] Seq=454 Ack=14376 Win=8576 Len=0
916867 304.510178 41.122.241.239 -> 41.177.26.176 TCP 64 embrace-dp-s > http [ACK] Seq=454 Ack=15448 Win=8576 Len=0
916872 304.511810 41.122.241.239 -> 41.177.26.176 TCP 64 spandataport > http [ACK] Seq=1323 Ack=16063 Win=8399 Len=0
916875 304.512700 41.122.241.239 -> 41.177.26.176 TCP 64 ncu-2 > http [ACK] Seq=408 Ack=8331 Win=8364 Len=0
916933 304.545637 41.122.241.239 -> 41.177.26.176 TCP 64 cpq-tasksmart > http [ACK] Seq=445 Ack=2967 Win=8576 Len=0
916946 304.546676 41.122.241.239 -> 41.177.26.176 TCP 64 cpq-tasksmart > http [ACK] Seq=445 Ack=4039 Win=8576 Len=0
916949 304.548262 41.122.241.239 -> 41.177.26.176 TCP 64 cpq-tasksmart > http [ACK] Seq=445 Ack=5111 Win=8576 Len=0
917281 304.610983 41.122.241.239 -> 41.177.26.176 TCP 64 dmod-workspace > http [ACK] Seq=918 Ack=9379 Win=8576 Len=0
917315 304.612654 41.122.241.239 -> 41.177.26.176 TCP 64 dmod-workspace > http [ACK] Seq=918 Ack=10067 Win=8576 Len=0
917322 304.613196 41.122.241.239 -> 41.177.26.176 TCP 64 embrace-dp-s > http [ACK] Seq=454 Ack=15984 Win=8576 Len=0
917346 304.614309 41.122.241.239 -> 41.177.26.176 TCP 64 dmod-workspace > http [ACK] Seq=918 Ack=11139 Win=8576 Len=0
917796 304.666648 41.122.241.239 -> 41.177.26.176 TCP 64 embrace-dp-s > http [ACK] Seq=454 Ack=16672 Win=8576 Len=0
917811 304.667849 41.122.241.239 -> 41.177.26.176 TCP 64 embrace-dp-s > http [ACK] Seq=454 Ack=17744 Win=8576 Len=0
917817 304.669111 41.122.241.239 -> 41.177.26.176 TCP 64 embrace-dp-s > http [ACK] Seq=454 Ack=18816 Win=8576 Len=0
917821 304.670852 41.122.241.239 -> 41.177.26.176 TCP 64 embrace-dp-s > http [ACK] Seq=454 Ack=19888 Win=8576 Len=0
917849 304.675174 41.122.241.239 -> 41.177.26.176 TCP 64 embrace-dp-s > http [ACK] Seq=454 Ack=20960 Win=8576 Len=0
917852 304.675187 41.122.241.239 -> 41.177.26.176 TCP 64 embrace-dp-s > http [ACK] Seq=454 Ack=22032 Win=8576 Len=0
917889 304.676758 41.122.241.239 -> 41.177.26.176 TCP 64 embrace-dp-s > http [ACK] Seq=454 Ack=23104 Win=8576 Len=0
918334 304.708972 41.122.241.239 -> 41.177.26.176 TCP 64 cpq-tasksmart > http [ACK] Seq=445 Ack=6183 Win=8576 Len=0
919235 304.776796 41.122.241.239 -> 41.177.26.176 TCP 64 embrace-dp-s > http [ACK] Seq=454 Ack=24176 Win=8576 Len=0
919706 304.813030 41.122.241.239 -> 41.177.26.176 TCP 64 cpq-tasksmart > http [ACK] Seq=445 Ack=6216 Win=8543 Len=0
919707 304.813479 41.122.241.239 -> 41.177.26.176 TCP 64 dmod-workspace > http [ACK] Seq=918 Ack=11429 Win=8286 Len=0
919742 304.831033 41.122.241.239 -> 41.177.26.176 TCP 64 embrace-dp-s > http [ACK] Seq=454 Ack=24864 Win=8576 Len=0
919743 304.831139 41.122.241.239 -> 41.177.26.176 TCP 64 embrace-dp-s > http [ACK] Seq=454 Ack=25936 Win=8576 Len=0
919772 304.835966 41.122.241.239 -> 41.177.26.176 TCP 64 embrace-dp-s > http [ACK] Seq=454 Ack=27008 Win=8576 Len=0
919775 304.837257 41.122.241.239 -> 41.177.26.176 TCP 64 embrace-dp-s > http [ACK] Seq=454 Ack=28080 Win=8576 Len=0
919780 304.838211 41.122.241.239 -> 41.177.26.176 TCP 64 embrace-dp-s > http [ACK] Seq=454 Ack=29152 Win=8576 Len=0
919785 304.839694 41.122.241.239 -> 41.177.26.176 TCP 64 embrace-dp-s > http [ACK] Seq=454 Ack=30224 Win=8576 Len=0
919788 304.841237 41.122.241.239 -> 41.177.26.176 TCP 64 embrace-dp-s > http [ACK] Seq=454 Ack=31296 Win=8576 Len=0
919986 304.939241 41.122.241.239 -> 41.177.26.176 TCP 64 embrace-dp-s > http [ACK] Seq=454 Ack=32368 Win=8576 Len=0
920263 304.993448 41.122.241.239 -> 41.177.26.176 TCP 64 embrace-dp-s > http [ACK] Seq=454 Ack=33056 Win=8576 Len=0
920269 304.996208 41.122.241.239 -> 41.177.26.176 TCP 64 embrace-dp-s > http [ACK] Seq=454 Ack=34128 Win=8576 Len=0
920272 304.998149 41.122.241.239 -> 41.177.26.176 TCP 64 embrace-dp-s > http [ACK] Seq=454 Ack=35200 Win=8576 Len=0
920276 305.000481 41.122.241.239 -> 41.177.26.176 TCP 64 embrace-dp-s > http [ACK] Seq=454 Ack=36272 Win=8576 Len=0
920314 305.017590 41.122.241.239 -> 41.177.26.176 TCP 64 embrace-dp-s > http [ACK] Seq=454 Ack=38416 Win=8576 Len=0
920330 305.018798 41.122.241.239 -> 41.177.26.176 TCP 64 embrace-dp-s > http [ACK] Seq=454 Ack=39488 Win=8576 Len=0
920476 305.102159 41.122.241.239 -> 41.177.26.176 TCP 64 embrace-dp-s > http [ACK] Seq=454 Ack=40560 Win=8576 Len=0
920545 305.158368 41.122.241.239 -> 41.177.26.176 TCP 64 embrace-dp-s > http [ACK] Seq=454 Ack=41248 Win=8576 Len=0
920553 305.161008 41.122.241.239 -> 41.177.26.176 TCP 64 embrace-dp-s > http [ACK] Seq=454 Ack=42320 Win=8576 Len=0
920556 305.161710 41.122.241.239 -> 41.177.26.176 TCP 64 embrace-dp-s > http [ACK] Seq=454 Ack=43392 Win=8576 Len=0
920579 305.169844 41.122.241.239 -> 41.177.26.176 TCP 64 embrace-dp-s > http [ACK] Seq=454 Ack=44464 Win=8576 Len=0
920593 305.180153 41.122.241.239 -> 41.177.26.176 TCP 64 embrace-dp-s > http [ACK] Seq=454 Ack=45536 Win=8576 Len=0
920629 305.191824 41.122.241.239 -> 41.177.26.176 TCP 64 embrace-dp-s > http [ACK] Seq=454 Ack=46608 Win=8576 Len=0
920630 305.192430 41.122.241.239 -> 41.177.26.176 TCP 64 embrace-dp-s > http [ACK] Seq=454 Ack=47680 Win=8576 Len=0
920720 305.264457 41.122.241.239 -> 41.177.26.176 TCP 64 embrace-dp-s > http [ACK] Seq=454 Ack=48752 Win=8576 Len=0
920820 305.325038 41.122.241.239 -> 41.177.26.176 TCP 64 embrace-dp-s > http [ACK] Seq=454 Ack=49440 Win=8576 Len=0
920821 305.325413 41.122.241.239 -> 41.177.26.176 TCP 64 embrace-dp-s > http [ACK] Seq=454 Ack=50512 Win=8576 Len=0
920822 305.327245 41.122.241.239 -> 41.177.26.176 TCP 64 embrace-dp-s > http [ACK] Seq=454 Ack=51345 Win=8576 Len=0
921250 305.605946 41.122.241.239 -> 41.177.26.176 TCP 64 dmod-workspace > http [ACK] Seq=1363 Ack=12001 Win=8576 Len=0
921278 305.619532 41.122.241.239 -> 41.177.26.176 TCP 64 embrace-dp-s > http [ACK] Seq=901 Ack=52165 Win=8576 Len=0
921281 305.620802 41.122.241.239 -> 41.177.26.176 TCP 64 embrace-dp-s > http [ACK] Seq=901 Ack=53237 Win=8576 Len=0
921284 305.621806 41.122.241.239 -> 41.177.26.176 TCP 64 embrace-dp-s > http [ACK] Seq=901 Ack=54309 Win=8576 Len=0
921291 305.623466 41.122.241.239 -> 41.177.26.176 TCP 64 embrace-dp-s > http [ACK] Seq=901 Ack=55381 Win=8576 Len=0
921294 305.625772 41.122.241.239 -> 41.177.26.176 TCP 64 spandataport > http [ACK] Seq=1767 Ack=16638 Win=8576 Len=0
921297 305.628450 41.122.241.239 -> 41.177.26.176 TCP 64 cpq-tasksmart > http [ACK] Seq=889 Ack=6789 Win=8576 Len=0
921598 305.775802 41.122.241.239 -> 41.177.26.176 TCP 64 dmod-workspace > http [ACK] Seq=1809 Ack=12574 Win=8576 Len=0
921617 305.796374 41.122.241.239 -> 41.177.26.176 TCP 64 embrace-dp-s > http [ACK] Seq=1388 Ack=56214 Win=8576 Len=0
921618 305.798356 41.122.241.239 -> 41.177.26.176 TCP 64 embrace-dp-s > http [ACK] Seq=1388 Ack=57286 Win=8576 Len=0
921619 305.804112 41.122.241.239 -> 41.177.26.176 TCP 64 cpq-tasksmart > http [ACK] Seq=1381 Ack=7611 Win=8576 Len=0
921623 305.805614 41.122.241.239 -> 41.177.26.176 TCP 64 cpq-tasksmart > http [ACK] Seq=1381 Ack=8683 Win=8576 Len=0
921624 305.807275 41.122.241.239 -> 41.177.26.176 TCP 64 spandataport > http [ACK] Seq=2256 Ack=17460 Win=8576 Len=0
921625 305.807834 41.122.241.239 -> 41.177.26.176 TCP 64 spandataport > http [ACK] Seq=2256 Ack=18251 Win=8576 Len=0
922268 306.116983 41.122.241.239 -> 41.177.26.176 TCP 64 cpq-tasksmart > http [ACK] Seq=1863 Ack=9037 Win=8222 Len=0
922269 306.116987 41.122.241.239 -> 41.177.26.176 TCP 64 spandataport > http [ACK] Seq=2739 Ack=18584 Win=8243 Len=0
922277 306.118213 41.122.241.239 -> 41.177.26.176 TCP 64 dmod-workspace > http [ACK] Seq=2689 Ack=13897 Win=8576 Len=0
922278 306.118869 41.122.241.239 -> 41.177.26.176 TCP 64 dmod-workspace > http [ACK] Seq=2689 Ack=14468 Win=8576 Len=0
922546 306.317810 41.122.241.239 -> 41.177.26.176 TCP 64 embrace-dp-s > http [ACK] Seq=2311 Ack=58578 Win=8246 Len=0
923763 306.961492 41.122.241.239 -> 41.177.26.176 TCP 64 spandataport > http [ACK] Seq=3175 Ack=18860 Win=8576 Len=0
923769 306.964007 41.122.241.239 -> 41.177.26.176 TCP 64 spandataport > http [ACK] Seq=3175 Ack=19500 Win=8576 Len=0
923770 306.964568 41.122.241.239 -> 41.177.26.176 TCP 64 spandataport > http [ACK] Seq=3175 Ack=19507 Win=8569 Len=0
923773 306.966160 41.122.241.239 -> 41.177.26.176 TCP 64 spandataport > http [ACK] Seq=3175 Ack=20579 Win=8576 Len=0
923778 306.967337 41.122.241.239 -> 41.177.26.176 TCP 64 spandataport > http [ACK] Seq=3175 Ack=21651 Win=8576 Len=0
923779 306.968230 41.122.241.239 -> 41.177.26.176 TCP 64 spandataport > http [ACK] Seq=3175 Ack=21713 Win=8514 Len=0
923780 306.969552 41.122.241.239 -> 41.177.26.176 TCP 64 spandataport > http [ACK] Seq=3175 Ack=22785 Win=8576 Len=0
923781 306.970578 41.122.241.239 -> 41.177.26.176 TCP 70 spandataport > http [ACK] Seq=3175 Ack=23321 Win=8576 Len=0 SLE=25696 SRE=25700
923782 306.970821 41.122.241.239 -> 41.177.26.176 TCP 70 [TCP Dup ACK 923781#1] spandataport > http [ACK] Seq=3175 Ack=23321 Win=8576 Len=0 SLE=25696 SRE=25745
923783 306.971622 41.122.241.239 -> 41.177.26.176 TCP 70 [TCP Dup ACK 923781#2] spandataport > http [ACK] Seq=3175 Ack=23321 Win=8576 Len=0 SLE=25696 SRE=25747
923784 306.973181 41.122.241.239 -> 41.177.26.176 TCP 70 [TCP Dup ACK 923781#3] spandataport > http [ACK] Seq=3175 Ack=23321 Win=8576 Len=0 SLE=25696 SRE=25752
923804 306.977440 41.122.241.239 -> 41.177.26.176 TCP 70 [TCP Dup ACK 923781#4] spandataport > http [ACK] Seq=3175 Ack=23321 Win=8576 Len=0 SLE=25696 SRE=26288
923805 306.977465 41.122.241.239 -> 41.177.26.176 TCP 70 [TCP Dup ACK 923781#5] spandataport > http [ACK] Seq=3175 Ack=23321 Win=8576 Len=0 SLE=25696 SRE=26699
923806 306.977841 41.122.241.239 -> 41.177.26.176 TCP 70 [TCP Dup ACK 923781#6] spandataport > http [ACK] Seq=3175 Ack=23321 Win=8576 Len=0 SLE=25696 SRE=26701
924008 307.122812 41.122.241.239 -> 41.177.26.176 TCP 70 [TCP Dup ACK 923781#7] spandataport > http [ACK] Seq=3175 Ack=23321 Win=8576 Len=0 SLE=25696 SRE=26913
924043 307.138337 41.122.241.239 -> 41.177.26.176 TCP 70 spandataport > http [ACK] Seq=3175 Ack=24393 Win=8576 Len=0 SLE=25696 SRE=26913
924044 307.138846 41.122.241.239 -> 41.177.26.176 TCP 70 spandataport > http [ACK] Seq=3175 Ack=25465 Win=8576 Len=0 SLE=25696 SRE=26913
924048 307.140130 41.122.241.239 -> 41.177.26.176 TCP 64 spandataport > http [ACK] Seq=3175 Ack=26913 Win=8576 Len=0
931086 310.240146 41.122.241.239 -> 41.177.26.176 TCP 64 cpq-tasksmart > http [ACK] Seq=2440 Ack=10109 Win=8576 Len=0
931087 310.241793 41.122.241.239 -> 41.177.26.176 TCP 64 cpq-tasksmart > http [ACK] Seq=2440 Ack=10992 Win=8576 Len=0
931088 310.243085 41.122.241.239 -> 41.177.26.176 TCP 64 cpq-tasksmart > http [ACK] Seq=2440 Ack=12064 Win=8576 Len=0
931089 310.243089 41.122.241.239 -> 41.177.26.176 TCP 64 cpq-tasksmart > http [ACK] Seq=2440 Ack=12934 Win=8576 Len=0
931090 310.244630 41.122.241.239 -> 41.177.26.176 TCP 64 cpq-tasksmart > http [ACK] Seq=2440 Ack=13981 Win=8576 Len=0
931099 310.246278 41.122.241.239 -> 41.177.26.176 TCP 64 cpq-tasksmart > http [ACK] Seq=2440 Ack=15053 Win=8576 Len=0
931105 310.255187 41.122.241.239 -> 41.177.26.176 TCP 64 cpq-tasksmart > http [ACK] Seq=2440 Ack=15489 Win=8140 Len=0
931424 310.341425 41.122.241.239 -> 41.177.26.176 TCP 81 [TCP segment of a reassembled PDU]
932465 310.630884 41.122.241.239 -> 41.177.26.176 TCP 64 dmod-workspace > http [ACK] Seq=3248 Ack=14924 Win=8120 Len=0
932778 310.732184 41.122.241.239 -> 41.177.26.176 TCP 64 embrace-dp-s > http [ACK] Seq=2697 Ack=58854 Win=8576 Len=0
932784 310.734120 41.122.241.239 -> 41.177.26.176 TCP 64 embrace-dp-s > http [ACK] Seq=2697 Ack=59494 Win=8576 Len=0
932785 310.734651 41.122.241.239 -> 41.177.26.176 TCP 64 embrace-dp-s > http [ACK] Seq=2697 Ack=59501 Win=8569 Len=0
932788 310.735344 41.122.241.239 -> 41.177.26.176 TCP 64 embrace-dp-s > http [ACK] Seq=2697 Ack=60573 Win=8576 Len=0
932790 310.736704 41.122.241.239 -> 41.177.26.176 TCP 64 embrace-dp-s > http [ACK] Seq=2697 Ack=61645 Win=8576 Len=0
932791 310.738358 41.122.241.239 -> 41.177.26.176 TCP 64 embrace-dp-s > http [ACK] Seq=2697 Ack=61707 Win=8514 Len=0
932795 310.739347 41.122.241.239 -> 41.177.26.176 TCP 64 embrace-dp-s > http [ACK] Seq=2697 Ack=62779 Win=8576 Len=0
932815 310.740643 41.122.241.239 -> 41.177.26.176 TCP 64 embrace-dp-s > http [ACK] Seq=2697 Ack=63851 Win=8576 Len=0
932819 310.742270 41.122.241.239 -> 41.177.26.176 TCP 64 embrace-dp-s > http [ACK] Seq=2697 Ack=64296 Win=8131 Len=0
932823 310.743743 41.122.241.239 -> 41.177.26.176 TCP 64 embrace-dp-s > http [ACK] Seq=2697 Ack=64303 Win=8124 Len=0
932831 310.744837 41.122.241.239 -> 41.177.26.176 TCP 64 embrace-dp-s > http [ACK] Seq=2697 Ack=64851 Win=8576 Len=0
932832 310.745554 41.122.241.239 -> 41.177.26.176 TCP 64 embrace-dp-s > http [ACK] Seq=2697 Ack=65069 Win=8358 Len=0
932865 310.749715 41.122.241.239 -> 41.177.26.176 TCP 64 embrace-dp-s > http [ACK] Seq=2697 Ack=65610 Win=8576 Len=0
932866 310.749826 41.122.241.239 -> 41.177.26.176 TCP 70 embrace-dp-s > http [ACK] Seq=2697 Ack=65668 Win=8518 Len=0 SLE=65726 SRE=66262
932867 310.750107 41.122.241.239 -> 41.177.26.176 TCP 70 [TCP Dup ACK 932866#1] embrace-dp-s > http [ACK] Seq=2697 Ack=65668 Win=8518 Len=0 SLE=65726 SRE=66673
932870 310.751069 41.122.241.239 -> 41.177.26.176 TCP 70 [TCP Dup ACK 932866#2] embrace-dp-s > http [ACK] Seq=2697 Ack=65668 Win=8518 Len=0 SLE=65726 SRE=66675
933056 310.799968 41.122.241.239 -> 41.177.26.176 TCP 64 embrace-dp-s > http [FIN, ACK] Seq=2697 Ack=65668 Win=8518 Len=0
933225 310.894484 41.122.241.239 -> 41.177.26.176 TCP 70 [TCP Dup ACK 933056#1] embrace-dp-s > http [ACK] Seq=2698 Ack=65668 Win=8518 Len=0 SLE=65726 SRE=66887
933324 310.961801 41.122.241.239 -> 41.177.26.176 TCP 64 embrace-dp-s > http [RST, ACK] Seq=2698 Ack=65726 Win=0 Len=0
944400 313.704182 41.122.241.239 -> 41.177.26.176 TCP 64 spandataport > http [ACK] Seq=3591 Ack=27189 Win=8300 Len=0
944403 313.705028 41.122.241.239 -> 41.177.26.176 TCP 64 spandataport > http [ACK] Seq=3591 Ack=27829 Win=8576 Len=0
944409 313.706067 41.122.241.239 -> 41.177.26.176 TCP 64 spandataport > http [ACK] Seq=3591 Ack=27836 Win=8569 Len=0
944436 313.707432 41.122.241.239 -> 41.177.26.176 TCP 64 spandataport > http [ACK] Seq=3591 Ack=28908 Win=8576 Len=0
944454 313.712306 41.122.241.239 -> 41.177.26.176 TCP 64 spandataport > http [ACK] Seq=3591 Ack=29980 Win=8576 Len=0
944458 313.712611 41.122.241.239 -> 41.177.26.176 TCP 64 spandataport > http [ACK] Seq=3591 Ack=30042 Win=8514 Len=0
944460 313.713541 41.122.241.239 -> 41.177.26.176 TCP 64 spandataport > http [ACK] Seq=3591 Ack=31114 Win=8576 Len=0
945083 313.841542 41.122.241.239 -> 41.177.26.176 TCP 64 spandataport > http [ACK] Seq=3591 Ack=31650 Win=8576 Len=0
945318 313.868720 41.122.241.239 -> 41.177.26.176 TCP 64 spandataport > http [ACK] Seq=3591 Ack=32650 Win=8576 Len=0
945328 313.870149 41.122.241.239 -> 41.177.26.176 TCP 64 spandataport > http [ACK] Seq=3591 Ack=33409 Win=8576 Len=0
945333 313.874410 41.122.241.239 -> 41.177.26.176 TCP 64 spandataport > http [ACK] Seq=3591 Ack=34061 Win=8576 Len=0
945344 313.875828 41.122.241.239 -> 41.177.26.176 TCP 64 spandataport > http [ACK] Seq=3591 Ack=35010 Win=8576 Len=0
946155 314.042153 41.122.241.239 -> 41.177.26.176 TCP 64 spandataport > http [ACK] Seq=3591 Ack=35222 Win=8364 Len=0
976561 325.317722 41.122.241.239 -> 41.177.26.176 TCP 64 cpq-tasksmart > http [ACK] Seq=2440 Ack=15490 Win=8140 Len=0
976938 325.508084 41.122.241.239 -> 41.177.26.176 TCP 64 dmod-workspace > http [ACK] Seq=3248 Ack=14925 Win=8120 Len=0
984437 328.709696 41.122.241.239 -> 41.177.26.176 TCP 64 spandataport > http [ACK] Seq=3591 Ack=35223 Win=8364 Len=0
990416 330.354536 41.122.241.239 -> 41.177.26.176 TCP 64 spandataport > http [FIN, ACK] Seq=3591 Ack=35223 Win=8364 Len=0
990418 330.356152 41.122.241.239 -> 41.177.26.176 TCP 64 dmod-workspace > http [FIN, ACK] Seq=3248 Ack=14925 Win=8120 Len=0
990436 330.359111 41.122.241.239 -> 41.177.26.176 TCP 64 cpq-tasksmart > http [FIN, ACK] Seq=2440 Ack=15490 Win=8140 Len=0
