27385  10.819806 41.177.202.249 -> 244.3.153.67 TCP 64 microsoft-ds > ftsrv [ACK] Seq=19197 Ack=18855 Win=25300 Len=0
40659  17.029847 41.177.202.249 -> 244.3.153.67 TCP 64 microsoft-ds > ftsrv [ACK] Seq=37640 Ack=23064 Win=25300 Len=0
99663  36.960326 41.177.202.249 -> 244.3.153.67 TCP 64 microsoft-ds > ftsrv [ACK] Seq=66546 Ack=70045 Win=25300 Len=0
108271  38.950165 41.177.202.249 -> 244.3.153.67 TCP 64 microsoft-ds > ftsrv [ACK] Seq=74160 Ack=74004 Win=25300 Len=0
153238  52.440473 41.177.202.249 -> 244.3.153.67 TCP 64 microsoft-ds > ftsrv [ACK] Seq=102124 Ack=113661 Win=25300 Len=0
993363 331.474057 41.177.202.249 -> 244.3.153.67 TCP 64 microsoft-ds > ftsrv [ACK] Seq=110224 Ack=118030 Win=25300 Len=0
