219891  75.230741 41.177.117.153 -> 244.3.41.84  TCP 169 35246 > ricardo-lm [PSH, ACK] Seq=1 Ack=1 Win=65535 Len=111
219999  75.278326 41.177.117.153 -> 244.3.41.84  TCP 168 35246 > ricardo-lm [PSH, ACK] Seq=112 Ack=39 Win=65535 Len=110
220047  75.296264 41.177.117.153 -> 244.3.41.84  TCP 64 35246 > ricardo-lm [FIN, ACK] Seq=222 Ack=69 Win=65535 Len=0
740362 236.367402 41.177.117.153 -> 41.177.3.224 TCP 64 virtual-places > 52506 [SYN, ACK] Seq=0 Ack=1 Win=65535 Len=0 MSS=1380
740580 236.483191 41.177.117.153 -> 41.177.3.224 TCP 64 virtual-places > 52506 [ACK] Seq=3529 Ack=3569 Win=65535 Len=0
740581 236.483246 41.177.117.153 -> 41.177.3.224 TCP 64 virtual-places > 52506 [FIN, ACK] Seq=3529 Ack=3569 Win=65535 Len=0
897085 296.821615 41.177.117.153 -> 41.177.3.224 TCP 64 virtual-places > 52512 [SYN, ACK] Seq=0 Ack=1 Win=65535 Len=0 MSS=1380
897143 296.845132 41.177.117.153 -> 41.177.3.224 TCP 64 virtual-places > 52512 [ACK] Seq=1 Ack=238 Win=65535 Len=0
897253 296.899323 41.177.117.153 -> 41.177.3.224 TCP 64 virtual-places > 52512 [ACK] Seq=2373 Ack=1696 Win=65535 Len=0
897254 296.899388 41.177.117.153 -> 41.177.3.224 TCP 64 virtual-places > 52512 [FIN, ACK] Seq=2373 Ack=1696 Win=65535 Len=0
