281   0.056056 41.177.31.98 -> 244.3.153.142 TCP 64 ssh > 49633 [ACK] Seq=1 Ack=1 Win=64455 Len=0
25975  10.118561 41.177.31.98 -> 244.3.153.142 TCP 64 ssh > 49633 [ACK] Seq=1 Ack=73 Win=65535 Len=0
49391  20.071655 41.177.31.98 -> 244.3.153.142 TCP 64 ssh > 49633 [ACK] Seq=1 Ack=145 Win=65463 Len=0
74153  30.134145 41.177.31.98 -> 244.3.153.142 TCP 64 ssh > 49633 [ACK] Seq=1 Ack=217 Win=65391 Len=0
112478  40.087255 41.177.31.98 -> 244.3.153.142 TCP 64 ssh > 49633 [ACK] Seq=1 Ack=289 Win=65319 Len=0
146217  50.149729 41.177.31.98 -> 244.3.153.142 TCP 64 ssh > 49633 [ACK] Seq=1 Ack=361 Win=65247 Len=0
178869  60.102870 41.177.31.98 -> 244.3.153.142 TCP 64 ssh > 49633 [ACK] Seq=1 Ack=433 Win=65175 Len=0
203217  70.055961 41.177.31.98 -> 244.3.153.142 TCP 64 ssh > 49633 [ACK] Seq=1 Ack=505 Win=65103 Len=0
231795  80.118442 41.177.31.98 -> 244.3.153.142 TCP 64 ssh > 49633 [ACK] Seq=1 Ack=577 Win=65031 Len=0
253846  90.071561 41.177.31.98 -> 244.3.153.142 TCP 64 ssh > 49633 [ACK] Seq=1 Ack=649 Win=64959 Len=0
296459 100.134055 41.177.31.98 -> 244.3.153.142 TCP 64 ssh > 49633 [ACK] Seq=1 Ack=721 Win=64887 Len=0
321810 110.087169 41.177.31.98 -> 244.3.153.142 TCP 64 ssh > 49633 [ACK] Seq=1 Ack=793 Win=64815 Len=0
353410 120.149644 41.177.31.98 -> 244.3.153.142 TCP 64 ssh > 49633 [ACK] Seq=1 Ack=865 Win=64743 Len=0
389525 130.102764 41.177.31.98 -> 244.3.153.142 TCP 64 ssh > 49633 [ACK] Seq=1 Ack=937 Win=64671 Len=0
427671 140.055877 41.177.31.98 -> 244.3.153.142 TCP 64 ssh > 49633 [ACK] Seq=1 Ack=1009 Win=64599 Len=0
459081 150.118356 41.177.31.98 -> 244.3.153.142 TCP 64 ssh > 49633 [ACK] Seq=1 Ack=1081 Win=64527 Len=0
486302 160.071479 41.177.31.98 -> 244.3.153.142 TCP 64 ssh > 49633 [ACK] Seq=1 Ack=1153 Win=64455 Len=0
523777 170.133980 41.177.31.98 -> 244.3.153.142 TCP 64 ssh > 49633 [ACK] Seq=1 Ack=1225 Win=65535 Len=0
560713 180.087103 41.177.31.98 -> 244.3.153.142 TCP 64 ssh > 49633 [ACK] Seq=1 Ack=1297 Win=65463 Len=0
599615 190.149559 41.177.31.98 -> 244.3.153.142 TCP 64 ssh > 49633 [ACK] Seq=1 Ack=1369 Win=65391 Len=0
631563 200.102668 41.177.31.98 -> 244.3.153.142 TCP 64 ssh > 49633 [ACK] Seq=1 Ack=1441 Win=65319 Len=0
673386 210.055823 41.177.31.98 -> 244.3.153.142 TCP 64 ssh > 49633 [ACK] Seq=1 Ack=1513 Win=65247 Len=0
695423 220.118256 41.177.31.98 -> 244.3.153.142 TCP 64 ssh > 49633 [ACK] Seq=1 Ack=1585 Win=65175 Len=0
720849 230.071371 41.177.31.98 -> 244.3.153.142 TCP 64 ssh > 49633 [ACK] Seq=1 Ack=1657 Win=65103 Len=0
749098 240.133877 41.177.31.98 -> 244.3.153.142 TCP 64 ssh > 49633 [ACK] Seq=1 Ack=1729 Win=65031 Len=0
776444 250.086968 41.177.31.98 -> 244.3.153.142 TCP 64 ssh > 49633 [ACK] Seq=1 Ack=1801 Win=64959 Len=0
797406 260.149455 41.177.31.98 -> 244.3.153.142 TCP 64 ssh > 49633 [ACK] Seq=1 Ack=1873 Win=64887 Len=0
827744 270.102562 41.177.31.98 -> 244.3.153.142 TCP 64 ssh > 49633 [ACK] Seq=1 Ack=1945 Win=64815 Len=0
873106 288.805711 41.177.31.98 -> 244.3.153.142 TCP 64 ssh > 49633 [ACK] Seq=273 Ack=2393 Win=65535 Len=0
907147 298.977563 41.177.31.98 -> 244.3.153.142 TCP 64 ssh > 49633 [ACK] Seq=273 Ack=2465 Win=65463 Len=0
924037 307.130463 41.177.31.98 -> 244.3.153.142 TCP 64 ssh > 49633 [ACK] Seq=825 Ack=5485 Win=65535 Len=0
924047 307.140100 41.177.31.98 -> 244.3.153.142 TCP 64 ssh > 49633 [ACK] Seq=825 Ack=7481 Win=65535 Len=0
957074 317.790023 41.177.31.98 -> 244.3.153.142 TCP 64 ssh > 49633 [ACK] Seq=1241 Ack=7985 Win=65031 Len=0
981286 327.743118 41.177.31.98 -> 244.3.153.142 TCP 64 ssh > 49633 [ACK] Seq=1241 Ack=8057 Win=64959 Len=0
1008442 337.805611 41.177.31.98 -> 244.3.153.142 TCP 64 ssh > 49633 [ACK] Seq=1241 Ack=8129 Win=64887 Len=0
