567626 181.404616 41.177.244.254 -> 244.3.210.255 TCP 66 smtp > gwha [SYN, ACK] Seq=0 Ack=1 Win=5840 Len=0 MSS=1380 SACK_PERM=1
567735 181.419456 41.177.244.254 -> 244.3.210.255 TCP 95 [TCP segment of a reassembled PDU]
567737 181.419972 41.177.244.254 -> 244.3.210.255 TCP 64 smtp > gwha [ACK] Seq=38 Ack=25 Win=5840 Len=0
567745 181.420951 41.177.244.254 -> 244.3.210.255 TCP 72 [TCP segment of a reassembled PDU]
567895 181.455500 41.177.244.254 -> 244.3.210.255 TCP 95 [TCP segment of a reassembled PDU]
567901 181.456391 41.177.244.254 -> 244.3.210.255 TCP 64 smtp > gwha [ACK] Seq=383 Ack=3181 Win=12420 Len=0
567943 181.467460 41.177.244.254 -> 244.3.210.255 TCP 96 [TCP segment of a reassembled PDU]
567948 181.468198 41.177.244.254 -> 244.3.210.255 TCP 73 [TCP segment of a reassembled PDU]
567949 181.468202 41.177.244.254 -> 244.3.210.255 TCP 64 smtp > gwha [FIN, ACK] Seq=436 Ack=3424 Win=15180 Len=0
567954 181.468594 41.177.244.254 -> 244.3.210.255 TCP 64 smtp > gwha [ACK] Seq=437 Ack=3425 Win=15180 Len=0
