12345   3.787408 41.177.98.143 -> 244.138.41.17 TCP 140 vcom-tunnel > ws-discovery [PSH, ACK] Seq=1 Ack=37 Win=64860 Len=82
20946   6.947352 41.177.98.143 -> 194.47.193.89 TCP 140 vcom-tunnel > ovwdb [PSH, ACK] Seq=1 Ack=37 Win=64860 Len=82
28229  11.374574 41.177.98.143 -> 83.94.193.12 TCP 1411 vcom-tunnel > o2server-port [FIN, PSH, ACK] Seq=1 Ack=1 Win=32857 Len=1341 TSval=1509546596 TSecr=65702
46744  19.436083 41.177.98.143 -> 244.160.201.18 TCP 85 vcom-tunnel > 51265 [PSH, ACK] Seq=1 Ack=14 Win=32775 Len=27
51473  21.132666 41.177.98.143 -> 244.160.201.18 TCP 130 vcom-tunnel > 51265 [PSH, ACK] Seq=28 Ack=32 Win=32775 Len=72
51588  21.204041 41.177.98.143 -> 244.160.201.18 TCP 132 vcom-tunnel > 51265 [PSH, ACK] Seq=100 Ack=58 Win=32775 Len=74
51717  21.281045 41.177.98.143 -> 244.160.201.18 TCP 79 vcom-tunnel > 51265 [PSH, ACK] Seq=174 Ack=80 Win=32775 Len=21
51967  21.404570 41.177.98.143 -> 244.160.201.18 TCP 64 vcom-tunnel > 51265 [ACK] Seq=195 Ack=103 Win=32775 Len=0
52186  21.488568 41.177.98.143 -> 244.160.201.18 TCP 249 vcom-tunnel > 51265 [PSH, ACK] Seq=195 Ack=432 Win=32775 Len=191
52508  21.735894 41.177.98.143 -> 244.160.201.18 TCP 286 vcom-tunnel > 51265 [PSH, ACK] Seq=386 Ack=432 Win=32775 Len=228
52749  21.982079 41.177.98.143 -> 244.160.201.18 TCP 218 vcom-tunnel > 51265 [PSH, ACK] Seq=614 Ack=432 Win=32775 Len=160
54144  22.408658 41.177.98.143 -> 244.160.201.18 TCP 137 vcom-tunnel > 51265 [PSH, ACK] Seq=774 Ack=432 Win=32775 Len=79
54686  22.655132 41.177.98.143 -> 244.160.201.18 TCP 279 vcom-tunnel > 51265 [PSH, ACK] Seq=853 Ack=432 Win=32775 Len=221
55013  22.745041 41.177.98.143 -> 244.160.201.18 TCP 115 vcom-tunnel > 51265 [PSH, ACK] Seq=1074 Ack=453 Win=32775 Len=57
59180  23.855721 41.177.98.143 -> 244.160.201.18 TCP 115 vcom-tunnel > 51265 [PSH, ACK] Seq=1131 Ack=474 Win=32775 Len=57
62602  25.765056 41.177.98.143 -> 244.56.202.204 TCP 69 vcom-tunnel > netbill-keyrep [PSH, ACK] Seq=1 Ack=86 Win=64240 Len=11
62747  25.817790 41.177.98.143 -> 244.56.202.204 TCP 64 vcom-tunnel > netbill-keyrep [ACK] Seq=12 Ack=95 Win=64240 Len=0
62748  25.818016 41.177.98.143 -> 244.56.202.204 TCP 1518 vcom-tunnel > netbill-keyrep [ACK] Seq=12 Ack=95 Win=64240 Len=1460
62749  25.818020 41.177.98.143 -> 244.56.202.204 TCP 302 vcom-tunnel > netbill-keyrep [PSH, ACK] Seq=1472 Ack=95 Win=64240 Len=244
68702  28.390302 41.177.98.143 -> 244.160.201.18 TCP 132 vcom-tunnel > 51265 [PSH, ACK] Seq=1188 Ack=500 Win=32775 Len=74
68773  28.442181 41.177.98.143 -> 244.160.201.18 TCP 655 vcom-tunnel > 51265 [PSH, ACK] Seq=1262 Ack=511 Win=32775 Len=597
68867  28.490441 41.177.98.143 -> 244.160.201.18 TCP 409 vcom-tunnel > 51265 [PSH, ACK] Seq=1859 Ack=526 Win=32775 Len=351
69392  28.784378 41.177.98.143 -> 244.160.201.18 TCP 69 vcom-tunnel > 51265 [PSH, ACK] Seq=2210 Ack=611 Win=32775 Len=11
69656  28.876086 41.177.98.143 -> 244.160.201.18 TCP 64 vcom-tunnel > 51265 [ACK] Seq=2221 Ack=618 Win=32775 Len=0
69659  28.876150 41.177.98.143 -> 244.160.201.18 TCP 1000 vcom-tunnel > 51265 [PSH, ACK] Seq=2221 Ack=618 Win=32775 Len=942
70081  29.054674 41.177.98.143 -> 244.160.201.18 TCP 64 vcom-tunnel > 51265 [ACK] Seq=3163 Ack=700 Win=32775 Len=0
70115  29.066826 41.177.98.143 -> 244.160.201.18 TCP 1438 vcom-tunnel > 51265 [ACK] Seq=3163 Ack=700 Win=32775 Len=1380
70116  29.066847 41.177.98.143 -> 244.160.201.18 TCP 1438 vcom-tunnel > 51265 [ACK] Seq=4543 Ack=700 Win=32775 Len=1380
70117  29.066851 41.177.98.143 -> 244.160.201.18 TCP 64 vcom-tunnel > 51265 [PSH, ACK] Seq=5923 Ack=700 Win=32775 Len=3
70495  29.185828 41.177.98.143 -> 244.160.201.18 TCP 903 vcom-tunnel > 51265 [PSH, ACK] Seq=5926 Ack=774 Win=32775 Len=845
70730  29.252466 41.177.98.143 -> 244.160.201.18 TCP 1279 vcom-tunnel > 51265 [PSH, ACK] Seq=6771 Ack=848 Win=32775 Len=1221
70953  29.309393 41.177.98.143 -> 153.103.26.253 TCP 140 vcom-tunnel > pslicser [PSH, ACK] Seq=1 Ack=37 Win=64240 Len=82
71014  29.354798 41.177.98.143 -> 244.160.201.18 TCP 890 vcom-tunnel > 51265 [PSH, ACK] Seq=7992 Ack=922 Win=32775 Len=832
71517  29.481093 41.177.98.143 -> 244.160.201.18 TCP 132 vcom-tunnel > 51265 [PSH, ACK] Seq=8824 Ack=948 Win=32775 Len=74
88751  34.282341 41.177.98.143 -> 186.45.149.155 TCP 132 vcom-tunnel > jwserver [PSH, ACK] Seq=1 Ack=27 Win=64240 Len=74
105997  38.232492 41.177.98.143 -> 244.160.201.18 TCP 64 vcom-tunnel > 51265 [ACK] Seq=8898 Ack=1022 Win=32775 Len=0
105998  38.232559 41.177.98.143 -> 244.160.201.18 TCP 987 vcom-tunnel > 51265 [PSH, ACK] Seq=8898 Ack=1022 Win=32775 Len=929
106117  38.294672 41.177.98.143 -> 244.160.201.18 TCP 659 vcom-tunnel > 51265 [PSH, ACK] Seq=9827 Ack=1096 Win=32775 Len=601
115817  41.314851 41.177.98.143 -> 244.160.201.18 TCP 64 vcom-tunnel > 51265 [ACK] Seq=10428 Ack=1170 Win=32775 Len=0
115843  41.325953 41.177.98.143 -> 244.160.201.18 TCP 864 vcom-tunnel > 51265 [PSH, ACK] Seq=10428 Ack=1170 Win=32775 Len=806
116120  41.431076 41.177.98.143 -> 244.160.201.18 TCP 64 vcom-tunnel > 51265 [ACK] Seq=11234 Ack=1244 Win=32775 Len=0
116121  41.431134 41.177.98.143 -> 244.160.201.18 TCP 888 vcom-tunnel > 51265 [PSH, ACK] Seq=11234 Ack=1244 Win=32775 Len=830
122937  43.748201 41.177.98.143 -> 194.31.194.116 TCP 140 vcom-tunnel > tgcconnect [PSH, ACK] Seq=1 Ack=37 Win=65520 Len=82
124947  44.608492 41.177.98.143 -> 244.160.201.18 TCP 893 vcom-tunnel > 51265 [PSH, ACK] Seq=12064 Ack=1318 Win=32775 Len=835
125126  44.714887 41.177.98.143 -> 244.160.201.18 TCP 64 vcom-tunnel > 51265 [ACK] Seq=12899 Ack=1393 Win=32775 Len=0
125135  44.719935 41.177.98.143 -> 244.160.201.18 TCP 941 vcom-tunnel > 51265 [PSH, ACK] Seq=12899 Ack=1393 Win=32775 Len=883
134999  46.927577 41.177.98.143 -> 244.56.67.116 TCP 349 vcom-tunnel > isomair [PSH, ACK] Seq=1 Ack=81 Win=32850 Len=291
135108  46.975088 41.177.98.143 -> 244.56.67.116 TCP 356 vcom-tunnel > isomair [PSH, ACK] Seq=292 Ack=157 Win=32850 Len=298
136286  47.448352 41.177.98.143 -> 244.56.67.116 TCP 69 vcom-tunnel > isomair [PSH, ACK] Seq=590 Ack=242 Win=32850 Len=11
136646  47.564958 41.177.98.143 -> 244.56.67.116 TCP 64 vcom-tunnel > isomair [ACK] Seq=601 Ack=253 Win=32850 Len=0
136776  47.599968 41.177.98.143 -> 244.56.67.116 TCP 182 vcom-tunnel > isomair [PSH, ACK] Seq=601 Ack=253 Win=32850 Len=124
137037  47.646611 41.177.98.143 -> 244.56.67.116 TCP 69 vcom-tunnel > isomair [PSH, ACK] Seq=725 Ack=338 Win=32850 Len=11
137262  47.705097 41.177.98.143 -> 244.56.67.116 TCP 64 vcom-tunnel > isomair [ACK] Seq=736 Ack=365 Win=32850 Len=0
137289  47.713279 41.177.98.143 -> 244.56.67.116 TCP 1518 vcom-tunnel > isomair [ACK] Seq=736 Ack=365 Win=32850 Len=1460
137290  47.713301 41.177.98.143 -> 244.56.67.116 TCP 1518 vcom-tunnel > isomair [ACK] Seq=2196 Ack=365 Win=32850 Len=1460
137291  47.713305 41.177.98.143 -> 244.56.67.116 TCP 780 vcom-tunnel > isomair [PSH, ACK] Seq=3656 Ack=365 Win=32850 Len=722
138184  47.949627 41.177.98.143 -> 244.56.67.116 TCP 69 vcom-tunnel > isomair [PSH, ACK] Seq=4378 Ack=450 Win=32850 Len=11
138391  47.998245 41.177.98.143 -> 244.56.67.116 TCP 64 vcom-tunnel > isomair [ACK] Seq=4389 Ack=477 Win=32850 Len=0
138392  47.998339 41.177.98.143 -> 244.56.67.116 TCP 1518 vcom-tunnel > isomair [ACK] Seq=4389 Ack=477 Win=32850 Len=1460
138393  47.998362 41.177.98.143 -> 244.56.67.116 TCP 1518 vcom-tunnel > isomair [ACK] Seq=5849 Ack=477 Win=32850 Len=1460
138394  47.998366 41.177.98.143 -> 244.56.67.116 TCP 780 vcom-tunnel > isomair [PSH, ACK] Seq=7309 Ack=477 Win=32850 Len=722
143394  49.275357 41.177.98.143 -> 244.160.201.18 TCP 945 vcom-tunnel > 51265 [PSH, ACK] Seq=13782 Ack=1468 Win=32775 Len=887
143672  49.355914 41.177.98.143 -> 244.160.201.18 TCP 949 vcom-tunnel > 51265 [PSH, ACK] Seq=14669 Ack=1543 Win=32775 Len=891
147875  50.773045 41.177.98.143 -> 244.239.193.90 TCP 85 vcom-tunnel > dls-monitor [PSH, ACK] Seq=1 Ack=14 Win=64860 Len=27
148981  51.166580 41.177.98.143 -> 244.239.193.90 TCP 130 vcom-tunnel > dls-monitor [PSH, ACK] Seq=28 Ack=32 Win=64860 Len=72
149085  51.223269 41.177.98.143 -> 244.239.193.90 TCP 79 vcom-tunnel > dls-monitor [PSH, ACK] Seq=100 Ack=54 Win=64860 Len=21
149518  51.325102 41.177.98.143 -> 244.239.193.90 TCP 64 vcom-tunnel > dls-monitor [ACK] Seq=121 Ack=77 Win=64860 Len=0
149711  51.383534 41.177.98.143 -> 244.239.193.90 TCP 187 vcom-tunnel > dls-monitor [PSH, ACK] Seq=121 Ack=393 Win=64860 Len=129
150137  51.557577 41.177.98.143 -> 244.239.193.90 TCP 557 vcom-tunnel > dls-monitor [PSH, ACK] Seq=250 Ack=393 Win=64860 Len=499
150336  51.604022 41.177.98.143 -> 244.239.193.90 TCP 114 vcom-tunnel > dls-monitor [PSH, ACK] Seq=749 Ack=414 Win=64860 Len=56
152385  52.197955 41.177.98.143 -> 244.56.67.116 TCP 201 vcom-tunnel > isomair [PSH, ACK] Seq=8031 Ack=552 Win=32850 Len=143
154274  52.705774 41.177.98.143 -> 244.239.193.90 TCP 114 vcom-tunnel > dls-monitor [PSH, ACK] Seq=805 Ack=435 Win=64860 Len=56
154787  52.845017 41.177.98.143 -> 244.239.193.90 TCP 64 vcom-tunnel > dls-monitor [ACK] Seq=861 Ack=458 Win=64860 Len=0
154864  52.900879 41.177.98.143 -> 244.239.193.90 TCP 186 vcom-tunnel > dls-monitor [PSH, ACK] Seq=861 Ack=776 Win=64860 Len=128
155231  52.980321 41.177.98.143 -> 244.160.201.18 TCP 945 vcom-tunnel > 51265 [PSH, ACK] Seq=15560 Ack=1618 Win=32775 Len=887
155627  53.046028 41.177.98.143 -> 244.160.201.18 TCP 937 vcom-tunnel > 51265 [PSH, ACK] Seq=16447 Ack=1693 Win=32775 Len=879
155657  53.067196 41.177.98.143 -> 244.239.193.90 TCP 557 vcom-tunnel > dls-monitor [PSH, ACK] Seq=989 Ack=776 Win=64860 Len=499
155807  53.109035 41.177.98.143 -> 244.239.193.90 TCP 159 vcom-tunnel > dls-monitor [PSH, ACK] Seq=1488 Ack=797 Win=64860 Len=101
159124  54.176287 41.177.98.143 -> 244.239.193.90 TCP 159 vcom-tunnel > dls-monitor [PSH, ACK] Seq=1589 Ack=818 Win=64860 Len=101
159544  54.295175 41.177.98.143 -> 244.239.193.90 TCP 64 vcom-tunnel > dls-monitor [ACK] Seq=1690 Ack=841 Win=64860 Len=0
159650  54.352807 41.177.98.143 -> 244.239.193.90 TCP 186 vcom-tunnel > dls-monitor [PSH, ACK] Seq=1690 Ack=1151 Win=64860 Len=128
160305  54.576876 41.177.98.143 -> 244.239.193.90 TCP 210 vcom-tunnel > dls-monitor [PSH, ACK] Seq=1818 Ack=1151 Win=64860 Len=152
160932  54.777001 41.177.98.143 -> 244.239.193.90 TCP 96 vcom-tunnel > dls-monitor [PSH, ACK] Seq=1970 Ack=1151 Win=64860 Len=38
161052  54.818484 41.177.98.143 -> 244.160.201.18 TCP 1083 vcom-tunnel > 51265 [PSH, ACK] Seq=17326 Ack=1768 Win=32775 Len=1025
161257  54.888309 41.177.98.143 -> 244.160.201.18 TCP 997 vcom-tunnel > 51265 [PSH, ACK] Seq=18351 Ack=1843 Win=32775 Len=939
162107  55.149975 41.177.98.143 -> 244.239.193.90 TCP 96 vcom-tunnel > dls-monitor [PSH, ACK] Seq=2008 Ack=1151 Win=64860 Len=38
163408  55.423690 41.177.98.143 -> 244.239.193.90 TCP 142 vcom-tunnel > dls-monitor [PSH, ACK] Seq=2046 Ack=1151 Win=64860 Len=84
164751  55.758060 41.177.98.143 -> 244.239.193.90 TCP 107 vcom-tunnel > dls-monitor [PSH, ACK] Seq=2130 Ack=1151 Win=64860 Len=49
165765  55.912821 41.177.98.143 -> 244.160.201.18 TCP 64 vcom-tunnel > 51265 [ACK] Seq=19290 Ack=1918 Win=32775 Len=0
165766  55.912903 41.177.98.143 -> 244.160.201.18 TCP 1255 vcom-tunnel > 51265 [PSH, ACK] Seq=19290 Ack=1918 Win=32775 Len=1197
166232  55.984022 41.177.98.143 -> 244.239.193.90 TCP 285 vcom-tunnel > dls-monitor [PSH, ACK] Seq=2179 Ack=1151 Win=64860 Len=227
166552  56.021729 41.177.98.143 -> 244.160.201.18 TCP 64 vcom-tunnel > 51265 [ACK] Seq=20487 Ack=1993 Win=32775 Len=0
166554  56.021829 41.177.98.143 -> 244.160.201.18 TCP 1428 vcom-tunnel > 51265 [PSH, ACK] Seq=20487 Ack=1993 Win=32775 Len=1370
166590  56.027664 41.177.98.143 -> 244.239.193.90 TCP 207 vcom-tunnel > dls-monitor [PSH, ACK] Seq=2406 Ack=1172 Win=64860 Len=149
171673  57.110133 41.177.98.143 -> 244.239.193.90 TCP 207 vcom-tunnel > dls-monitor [PSH, ACK] Seq=2555 Ack=1193 Win=64860 Len=149
177366  59.530903 41.177.98.143 -> 244.239.193.90 TCP 655 vcom-tunnel > dls-monitor [PSH, ACK] Seq=2704 Ack=1204 Win=64860 Len=597
177466  59.556867 41.177.98.143 -> 244.239.193.90 TCP 396 vcom-tunnel > dls-monitor [PSH, ACK] Seq=3301 Ack=1219 Win=64860 Len=338
177476  59.572436 41.177.98.143 -> 244.56.202.204 TCP 85 vcom-tunnel > netbill-keyrep [PSH, ACK] Seq=1716 Ack=108 Win=64240 Len=27
177866  59.725359 41.177.98.143 -> 244.56.202.204 TCP 132 vcom-tunnel > netbill-keyrep [PSH, ACK] Seq=1743 Ack=134 Win=64240 Len=74
178299  59.855141 41.177.98.143 -> 244.56.202.204 TCP 64 vcom-tunnel > netbill-keyrep [ACK] Seq=1817 Ack=157 Win=64240 Len=0
178492  59.929223 41.177.98.143 -> 244.56.202.204 TCP 250 vcom-tunnel > netbill-keyrep [PSH, ACK] Seq=1817 Ack=723 Win=64240 Len=192
178899  60.122621 41.177.98.143 -> 244.56.202.204 TCP 595 vcom-tunnel > netbill-keyrep [PSH, ACK] Seq=2009 Ack=723 Win=64240 Len=537
179266  60.276343 41.177.98.143 -> 244.239.193.90 TCP 69 vcom-tunnel > dls-monitor [PSH, ACK] Seq=3639 Ack=1304 Win=64860 Len=11
179341  60.335138 41.177.98.143 -> 244.239.193.90 TCP 64 vcom-tunnel > dls-monitor [ACK] Seq=3650 Ack=1311 Win=64860 Len=0
179407  60.368389 41.177.98.143 -> 244.239.193.90 TCP 1023 vcom-tunnel > dls-monitor [PSH, ACK] Seq=3650 Ack=1311 Win=64860 Len=965
179582  60.459196 41.177.98.143 -> 244.239.193.90 TCP 64 vcom-tunnel > dls-monitor [ACK] Seq=4615 Ack=1390 Win=64860 Len=0
179583  60.459229 41.177.98.143 -> 244.239.193.90 TCP 373 vcom-tunnel > dls-monitor [PSH, ACK] Seq=4615 Ack=1390 Win=64860 Len=315
179731  60.516817 41.177.98.143 -> 244.239.193.90 TCP 360 vcom-tunnel > dls-monitor [PSH, ACK] Seq=4930 Ack=1469 Win=64860 Len=302
179863  60.568145 41.177.98.143 -> 244.239.193.90 TCP 393 vcom-tunnel > dls-monitor [PSH, ACK] Seq=5232 Ack=1548 Win=64860 Len=335
182133  61.225111 41.177.98.143 -> 244.56.202.204 TCP 64 vcom-tunnel > netbill-keyrep [ACK] Seq=2546 Ack=746 Win=64240 Len=0
182401  61.298840 41.177.98.143 -> 244.56.202.204 TCP 248 vcom-tunnel > netbill-keyrep [PSH, ACK] Seq=2546 Ack=1315 Win=64240 Len=190
183100  61.530946 41.177.98.143 -> 244.56.202.204 TCP 294 vcom-tunnel > netbill-keyrep [PSH, ACK] Seq=2736 Ack=1315 Win=64240 Len=236
183729  61.732127 41.177.98.143 -> 244.56.202.204 TCP 322 vcom-tunnel > netbill-keyrep [PSH, ACK] Seq=2972 Ack=1315 Win=64240 Len=264
184672  62.074357 41.177.98.143 -> 244.239.193.90 TCP 69 vcom-tunnel > dls-monitor [PSH, ACK] Seq=5567 Ack=1633 Win=64860 Len=11
184926  62.105468 41.177.98.143 -> 244.239.193.90 TCP 1023 vcom-tunnel > dls-monitor [PSH, ACK] Seq=5578 Ack=1640 Win=64860 Len=965
186724  62.855158 41.177.98.143 -> 244.56.202.204 TCP 64 vcom-tunnel > netbill-keyrep [ACK] Seq=3236 Ack=1338 Win=64240 Len=0
186800  62.934948 41.177.98.143 -> 244.56.202.204 TCP 185 vcom-tunnel > netbill-keyrep [PSH, ACK] Seq=3236 Ack=1911 Win=64240 Len=127
187063  63.140191 41.177.98.143 -> 244.56.202.204 TCP 210 vcom-tunnel > netbill-keyrep [PSH, ACK] Seq=3363 Ack=1911 Win=64240 Len=152
187436  63.341475 41.177.98.143 -> 244.56.202.204 TCP 96 vcom-tunnel > netbill-keyrep [PSH, ACK] Seq=3515 Ack=1911 Win=64240 Len=38
187746  63.542795 41.177.98.143 -> 244.56.202.204 TCP 134 vcom-tunnel > netbill-keyrep [PSH, ACK] Seq=3553 Ack=1911 Win=64240 Len=76
187957  63.743846 41.177.98.143 -> 244.56.202.204 TCP 142 vcom-tunnel > netbill-keyrep [PSH, ACK] Seq=3629 Ack=1911 Win=64240 Len=84
188215  63.945020 41.177.98.143 -> 244.56.202.204 TCP 326 vcom-tunnel > netbill-keyrep [PSH, ACK] Seq=3713 Ack=1911 Win=64240 Len=268
188321  64.005650 41.177.98.143 -> 244.56.202.204 TCP 702 vcom-tunnel > netbill-keyrep [PSH, ACK] Seq=3981 Ack=1932 Win=64240 Len=644
189296  64.642597 41.177.98.143 -> 244.160.201.18 TCP 1271 vcom-tunnel > 51265 [PSH, ACK] Seq=21857 Ack=2068 Win=32775 Len=1213
189391  64.733832 41.177.98.143 -> 244.160.201.18 TCP 859 vcom-tunnel > 51265 [PSH, ACK] Seq=23070 Ack=2143 Win=32775 Len=801
189817  65.066823 41.177.98.143 -> 244.56.202.204 TCP 702 vcom-tunnel > netbill-keyrep [PSH, ACK] Seq=4625 Ack=1953 Win=64240 Len=644
193001  66.395178 41.177.98.143 -> 244.239.193.90 TCP 64 vcom-tunnel > dls-monitor [ACK] Seq=6543 Ack=1722 Win=64860 Len=0
193083  66.421446 41.177.98.143 -> 244.239.193.90 TCP 1367 vcom-tunnel > dls-monitor [PSH, ACK] Seq=6543 Ack=1722 Win=64860 Len=1309
193332  66.505212 41.177.98.143 -> 244.239.193.90 TCP 64 vcom-tunnel > dls-monitor [ACK] Seq=7852 Ack=1805 Win=64860 Len=0
193472  66.544488 41.177.98.143 -> 244.239.193.90 TCP 1429 vcom-tunnel > dls-monitor [PSH, ACK] Seq=7852 Ack=1805 Win=64860 Len=1371
193727  66.619888 41.177.98.143 -> 244.239.193.90 TCP 1438 vcom-tunnel > dls-monitor [ACK] Seq=9223 Ack=1889 Win=64860 Len=1380
193728  66.619892 41.177.98.143 -> 244.239.193.90 TCP 138 vcom-tunnel > dls-monitor [PSH, ACK] Seq=10603 Ack=1889 Win=64860 Len=80
193998  66.705285 41.177.98.143 -> 244.239.193.90 TCP 64 vcom-tunnel > dls-monitor [ACK] Seq=10683 Ack=1973 Win=64860 Len=0
194082  66.727903 41.177.98.143 -> 244.239.193.90 TCP 1438 vcom-tunnel > dls-monitor [ACK] Seq=10683 Ack=1973 Win=64860 Len=1380
194083  66.727908 41.177.98.143 -> 244.239.193.90 TCP 594 vcom-tunnel > dls-monitor [PSH, ACK] Seq=12063 Ack=1973 Win=64860 Len=536
196675  67.491215 41.177.98.143 -> 244.56.202.204 TCP 659 vcom-tunnel > netbill-keyrep [PSH, ACK] Seq=5269 Ack=1968 Win=64240 Len=601
197412  67.691770 41.177.98.143 -> 244.56.202.204 TCP 69 vcom-tunnel > netbill-keyrep [PSH, ACK] Seq=5870 Ack=2053 Win=64240 Len=11
197577  67.745229 41.177.98.143 -> 244.56.202.204 TCP 64 vcom-tunnel > netbill-keyrep [ACK] Seq=5881 Ack=2060 Win=64240 Len=0
197632  67.765911 41.177.98.143 -> 244.56.202.204 TCP 1304 vcom-tunnel > netbill-keyrep [PSH, ACK] Seq=5881 Ack=2060 Win=64240 Len=1246
197891  67.875259 41.177.98.143 -> 244.56.202.204 TCP 64 vcom-tunnel > netbill-keyrep [ACK] Seq=7127 Ack=2139 Win=64240 Len=0
197922  67.883269 41.177.98.143 -> 244.56.202.204 TCP 814 vcom-tunnel > netbill-keyrep [PSH, ACK] Seq=7127 Ack=2139 Win=64240 Len=756
198089  67.953127 41.177.98.143 -> 244.56.202.204 TCP 834 vcom-tunnel > netbill-keyrep [PSH, ACK] Seq=7883 Ack=2218 Win=64240 Len=776
198162  68.018392 41.177.98.143 -> 244.56.202.204 TCP 648 vcom-tunnel > netbill-keyrep [PSH, ACK] Seq=8659 Ack=2297 Win=64240 Len=590
199786  68.768693 41.177.98.143 -> 244.56.67.116 TCP 242 vcom-tunnel > isomair [PSH, ACK] Seq=8174 Ack=627 Win=32850 Len=184
199916  68.853806 41.177.98.143 -> 128.231.127.18 TCP 64 vcom-tunnel > tcoflashagent [SYN, ACK] Seq=0 Ack=1 Win=64860 Len=0 MSS=1460
199998  68.888128 41.177.98.143 -> 128.231.127.18 TCP 64 vcom-tunnel > tcoflashagent [ACK] Seq=1 Ack=424 Win=64437 Len=0
200335  69.059605 41.177.98.143 -> 128.231.127.18 TCP 64 vcom-tunnel > tcoflashagent [PSH, ACK] Seq=1 Ack=424 Win=64860 Len=1
200911  69.269423 41.177.98.143 -> 128.231.127.18 TCP 713 vcom-tunnel > tcoflashagent [PSH, ACK] Seq=2 Ack=424 Win=64860 Len=655
200955  69.304147 41.177.98.143 -> 128.231.127.18 TCP 64 vcom-tunnel > tcoflashagent [ACK] Seq=657 Ack=447 Win=64860 Len=0
200956  69.305141 41.177.98.143 -> 128.231.127.18 TCP 113 vcom-tunnel > tcoflashagent [PSH, ACK] Seq=657 Ack=447 Win=64860 Len=55
201025  69.339493 41.177.98.143 -> 128.231.127.18 TCP 249 vcom-tunnel > tcoflashagent [PSH, ACK] Seq=712 Ack=457 Win=64860 Len=191
201106  69.373849 41.177.98.143 -> 128.231.127.18 TCP 85 vcom-tunnel > tcoflashagent [PSH, ACK] Seq=903 Ack=482 Win=64860 Len=27
201255  69.439508 41.177.98.143 -> 128.231.127.18 TCP 101 vcom-tunnel > tcoflashagent [PSH, ACK] Seq=930 Ack=503 Win=64860 Len=43
201627  69.597367 41.177.98.143 -> 128.231.127.18 TCP 202 vcom-tunnel > tcoflashagent [PSH, ACK] Seq=973 Ack=503 Win=64860 Len=144
201725  69.634421 41.177.98.143 -> 128.231.127.18 TCP 249 vcom-tunnel > tcoflashagent [PSH, ACK] Seq=1117 Ack=514 Win=64860 Len=191
202587  69.907425 41.177.98.143 -> 128.231.127.18 TCP 219 vcom-tunnel > tcoflashagent [PSH, ACK] Seq=1308 Ack=544 Win=64860 Len=161
202726  69.957685 41.177.98.143 -> 128.231.127.18 TCP 69 vcom-tunnel > tcoflashagent [PSH, ACK] Seq=1469 Ack=565 Win=64860 Len=11
203103  70.023597 41.177.98.143 -> 128.231.127.18 TCP 132 vcom-tunnel > tcoflashagent [PSH, ACK] Seq=1480 Ack=591 Win=64860 Len=74
203354  70.098654 41.177.98.143 -> 128.231.127.18 TCP 138 vcom-tunnel > tcoflashagent [PSH, ACK] Seq=1554 Ack=625 Win=64860 Len=80
203443  70.131814 41.177.98.143 -> 244.56.67.116 TCP 244 vcom-tunnel > isomair [PSH, ACK] Seq=8358 Ack=702 Win=32850 Len=186
203530  70.152473 41.177.98.143 -> 128.231.127.18 TCP 69 vcom-tunnel > tcoflashagent [PSH, ACK] Seq=1634 Ack=646 Win=64860 Len=11
203968  70.202352 41.177.98.143 -> 128.231.127.18 TCP 69 vcom-tunnel > tcoflashagent [PSH, ACK] Seq=1645 Ack=658 Win=64860 Len=11
206340  70.755617 41.177.98.143 -> 244.56.67.116 TCP 69 vcom-tunnel > isomair [PSH, ACK] Seq=8544 Ack=787 Win=32850 Len=11
206746  70.815293 41.177.98.143 -> 244.56.67.116 TCP 64 vcom-tunnel > isomair [ACK] Seq=8555 Ack=794 Win=32850 Len=0
207147  70.901031 41.177.98.143 -> 244.56.67.116 TCP 1518 vcom-tunnel > isomair [ACK] Seq=8555 Ack=794 Win=32850 Len=1460
207148  70.901036 41.177.98.143 -> 244.56.67.116 TCP 1299 vcom-tunnel > isomair [PSH, ACK] Seq=10015 Ack=794 Win=32850 Len=1241
207603  70.957790 41.177.98.143 -> 244.56.67.116 TCP 322 vcom-tunnel > isomair [PSH, ACK] Seq=11256 Ack=869 Win=32850 Len=264
208070  71.385436 41.177.98.143 -> 83.94.193.12 TCP 1411 [TCP Retransmission] vcom-tunnel > o2server-port [FIN, PSH, ACK] Seq=1 Ack=1 Win=32857 Len=1341 TSval=1509552597 TSecr=65702
208455  71.588667 41.177.98.143 -> 128.231.127.18 TCP 85 vcom-tunnel > tcoflashagent [PSH, ACK] Seq=1656 Ack=671 Win=64860 Len=27
214719  73.688942 41.177.98.143 -> 244.56.67.116 TCP 275 vcom-tunnel > isomair [PSH, ACK] Seq=11520 Ack=946 Win=32850 Len=217
214857  73.740273 41.177.98.143 -> 244.56.67.116 TCP 239 vcom-tunnel > isomair [PSH, ACK] Seq=11737 Ack=1023 Win=32850 Len=181
217988  74.407209 41.177.98.143 -> 244.56.202.204 TCP 673 vcom-tunnel > netbill-keyrep [PSH, ACK] Seq=9249 Ack=2376 Win=64240 Len=615
218146  74.459745 41.177.98.143 -> 244.56.202.204 TCP 670 vcom-tunnel > netbill-keyrep [PSH, ACK] Seq=9864 Ack=2455 Win=64240 Len=612
221437  75.903513 41.177.98.143 -> 244.56.202.204 TCP 664 vcom-tunnel > netbill-keyrep [PSH, ACK] Seq=10476 Ack=2534 Win=64240 Len=606
221484  75.916529 41.177.98.143 -> 244.56.67.116 TCP 268 vcom-tunnel > isomair [PSH, ACK] Seq=11918 Ack=1100 Win=32850 Len=210
221488  75.917215 41.177.98.143 -> 186.45.149.155 TCP 140 vcom-tunnel > jwserver [PSH, ACK] Seq=75 Ack=63 Win=64240 Len=82
221759  75.974855 41.177.98.143 -> 244.56.202.204 TCP 677 vcom-tunnel > netbill-keyrep [PSH, ACK] Seq=11082 Ack=2613 Win=64240 Len=619
222027  76.067422 41.177.98.143 -> 244.56.202.204 TCP 682 vcom-tunnel > netbill-keyrep [PSH, ACK] Seq=11701 Ack=2692 Win=64240 Len=624
222232  76.148394 41.177.98.143 -> 244.56.202.204 TCP 677 vcom-tunnel > netbill-keyrep [PSH, ACK] Seq=12325 Ack=2772 Win=64240 Len=619
223891  76.615358 41.177.98.143 -> 244.160.201.18 TCP 64 vcom-tunnel > 51265 [ACK] Seq=23871 Ack=2218 Win=32775 Len=0
223893  76.616311 41.177.98.143 -> 244.160.201.18 TCP 1370 vcom-tunnel > 51265 [PSH, ACK] Seq=23871 Ack=2218 Win=32775 Len=1312
223981  76.621343 41.177.98.143 -> 244.56.67.116 TCP 313 vcom-tunnel > isomair [PSH, ACK] Seq=12128 Ack=1177 Win=32850 Len=255
224524  76.745290 41.177.98.143 -> 244.160.201.18 TCP 64 vcom-tunnel > 51265 [ACK] Seq=25183 Ack=2293 Win=32775 Len=0
224533  76.753554 41.177.98.143 -> 244.160.201.18 TCP 972 vcom-tunnel > 51265 [PSH, ACK] Seq=25183 Ack=2293 Win=32775 Len=914
227269  77.787738 41.177.98.143 -> 244.56.202.204 TCP 677 vcom-tunnel > netbill-keyrep [PSH, ACK] Seq=12944 Ack=2852 Win=64240 Len=619
227346  77.862269 41.177.98.143 -> 244.56.202.204 TCP 689 vcom-tunnel > netbill-keyrep [PSH, ACK] Seq=13563 Ack=2932 Win=64240 Len=631
228676  78.509168 41.177.98.143 -> 244.56.202.204 TCP 710 vcom-tunnel > netbill-keyrep [PSH, ACK] Seq=14194 Ack=3012 Win=64240 Len=652
228844  78.600651 41.177.98.143 -> 244.56.202.204 TCP 663 vcom-tunnel > netbill-keyrep [PSH, ACK] Seq=14846 Ack=3092 Win=64240 Len=605
229854  79.144128 41.177.98.143 -> 244.56.202.204 TCP 653 vcom-tunnel > netbill-keyrep [PSH, ACK] Seq=15451 Ack=3172 Win=64240 Len=595
229939  79.245431 41.177.98.143 -> 244.56.202.204 TCP 64 vcom-tunnel > netbill-keyrep [ACK] Seq=16046 Ack=3252 Win=64240 Len=0
229940  79.247531 41.177.98.143 -> 244.56.202.204 TCP 678 vcom-tunnel > netbill-keyrep [PSH, ACK] Seq=16046 Ack=3252 Win=64240 Len=620
230789  79.696974 41.177.98.143 -> 244.239.193.90 TCP 69 vcom-tunnel > dls-monitor [PSH, ACK] Seq=12599 Ack=2058 Win=64860 Len=11
230915  79.755466 41.177.98.143 -> 244.239.193.90 TCP 64 vcom-tunnel > dls-monitor [ACK] Seq=12610 Ack=2083 Win=64860 Len=0
231118  79.831482 41.177.98.143 -> 244.239.193.90 TCP 1438 vcom-tunnel > dls-monitor [ACK] Seq=12610 Ack=2083 Win=64860 Len=1380
231119  79.831487 41.177.98.143 -> 244.239.193.90 TCP 1271 vcom-tunnel > dls-monitor [PSH, ACK] Seq=13990 Ack=2083 Win=64860 Len=1213
231340  79.927745 41.177.98.143 -> 244.56.202.204 TCP 681 vcom-tunnel > netbill-keyrep [PSH, ACK] Seq=16666 Ack=3332 Win=64240 Len=623
231507  80.012489 41.177.98.143 -> 244.56.202.204 TCP 709 vcom-tunnel > netbill-keyrep [PSH, ACK] Seq=17289 Ack=3412 Win=64240 Len=651
231800  80.119065 41.177.98.143 -> 244.56.202.204 TCP 749 vcom-tunnel > netbill-keyrep [PSH, ACK] Seq=17940 Ack=3492 Win=64240 Len=691
232013  80.199494 41.177.98.143 -> 244.56.202.204 TCP 671 vcom-tunnel > netbill-keyrep [PSH, ACK] Seq=18631 Ack=3572 Win=64240 Len=613
234583  81.469986 41.177.98.143 -> 244.56.202.204 TCP 742 vcom-tunnel > netbill-keyrep [PSH, ACK] Seq=19244 Ack=3652 Win=64240 Len=684
234768  81.556000 41.177.98.143 -> 244.56.202.204 TCP 981 vcom-tunnel > netbill-keyrep [PSH, ACK] Seq=19928 Ack=3732 Win=64240 Len=923
238542  82.761962 41.177.98.143 -> 244.56.202.204 TCP 1047 vcom-tunnel > netbill-keyrep [PSH, ACK] Seq=20851 Ack=3812 Win=64240 Len=989
238767  82.865429 41.177.98.143 -> 244.56.202.204 TCP 64 vcom-tunnel > netbill-keyrep [ACK] Seq=21840 Ack=3892 Win=64240 Len=0
238891  82.906236 41.177.98.143 -> 244.56.202.204 TCP 714 vcom-tunnel > netbill-keyrep [PSH, ACK] Seq=21840 Ack=3892 Win=64240 Len=656
239087  83.006288 41.177.98.143 -> 244.56.202.204 TCP 727 vcom-tunnel > netbill-keyrep [PSH, ACK] Seq=22496 Ack=3972 Win=64240 Len=669
239124  83.034174 41.177.98.143 -> 194.46.94.159 TCP 140 vcom-tunnel > santak-ups [PSH, ACK] Seq=1 Ack=37 Win=64240 Len=82
252179  89.230919 41.177.98.143 -> 244.56.67.116 TCP 69 vcom-tunnel > isomair [PSH, ACK] Seq=12383 Ack=1262 Win=32850 Len=11
252346  89.285486 41.177.98.143 -> 244.56.67.116 TCP 64 vcom-tunnel > isomair [ACK] Seq=12394 Ack=1270 Win=32850 Len=0
252546  89.365849 41.177.98.143 -> 244.56.67.116 TCP 1518 vcom-tunnel > isomair [ACK] Seq=12394 Ack=1270 Win=32850 Len=1460
252547  89.365870 41.177.98.143 -> 244.56.67.116 TCP 1518 vcom-tunnel > isomair [ACK] Seq=13854 Ack=1270 Win=32850 Len=1460
252548  89.365875 41.177.98.143 -> 244.56.67.116 TCP 455 vcom-tunnel > isomair [PSH, ACK] Seq=15314 Ack=1270 Win=32850 Len=397
252719  89.421040 41.177.98.143 -> 244.56.67.116 TCP 303 vcom-tunnel > isomair [PSH, ACK] Seq=15711 Ack=1347 Win=32850 Len=245
253152  89.630989 41.177.98.143 -> 41.194.123.57 TCP 140 vcom-tunnel > 50342 [PSH, ACK] Seq=1 Ack=37 Win=32850 Len=82
294232  99.092617 41.177.98.143 -> 244.56.67.116 TCP 210 vcom-tunnel > isomair [PSH, ACK] Seq=15956 Ack=1424 Win=32850 Len=152
299709 101.046523 41.177.98.143 -> 244.56.67.116 TCP 450 vcom-tunnel > isomair [PSH, ACK] Seq=16108 Ack=1501 Win=32850 Len=392
304349 102.995117 41.177.98.143 -> 244.56.67.116 TCP 245 vcom-tunnel > isomair [PSH, ACK] Seq=16500 Ack=1578 Win=32850 Len=187
308373 104.922666 41.177.98.143 -> 244.56.67.116 TCP 218 vcom-tunnel > isomair [PSH, ACK] Seq=16687 Ack=1655 Win=32850 Len=160
313068 106.857120 41.177.98.143 -> 244.56.67.116 TCP 69 vcom-tunnel > isomair [PSH, ACK] Seq=16847 Ack=1740 Win=32850 Len=11
313192 106.915729 41.177.98.143 -> 244.56.67.116 TCP 64 vcom-tunnel > isomair [ACK] Seq=16858 Ack=1749 Win=32850 Len=0
313988 107.127486 41.177.98.143 -> 244.56.67.116 TCP 1518 vcom-tunnel > isomair [ACK] Seq=16858 Ack=1749 Win=32850 Len=1460
313989 107.127506 41.177.98.143 -> 244.56.67.116 TCP 1437 vcom-tunnel > isomair [PSH, ACK] Seq=18318 Ack=1749 Win=32850 Len=1379
314177 107.188500 41.177.98.143 -> 244.56.67.116 TCP 303 vcom-tunnel > isomair [PSH, ACK] Seq=19697 Ack=1826 Win=32850 Len=245
319320 108.822980 41.177.98.143 -> 244.56.67.116 TCP 207 vcom-tunnel > isomair [PSH, ACK] Seq=19942 Ack=1903 Win=32850 Len=149
322471 110.344547 41.177.98.143 -> 203.67.168.48 TCP 140 vcom-tunnel > 54249 [PSH, ACK] Seq=1 Ack=37 Win=32850 Len=82
322854 110.524754 41.177.98.143 -> 244.160.201.18 TCP 69 vcom-tunnel > 51265 [PSH, ACK] Seq=26097 Ack=2378 Win=32775 Len=11
323015 110.615827 41.177.98.143 -> 244.160.201.18 TCP 1438 vcom-tunnel > 51265 [ACK] Seq=26108 Ack=2387 Win=32775 Len=1380
323016 110.615848 41.177.98.143 -> 244.160.201.18 TCP 180 vcom-tunnel > 51265 [PSH, ACK] Seq=27488 Ack=2387 Win=32775 Len=122
323125 110.682307 41.177.98.143 -> 244.160.201.18 TCP 598 vcom-tunnel > 51265 [PSH, ACK] Seq=27610 Ack=2471 Win=32775 Len=540
323242 110.746214 41.177.98.143 -> 244.160.201.18 TCP 326 vcom-tunnel > 51265 [PSH, ACK] Seq=28150 Ack=2549 Win=32775 Len=268
329910 114.886074 41.177.98.143 -> 47.41.55.77  TCP 140 vcom-tunnel > DB2_db2inst1_END [PSH, ACK] Seq=1 Ack=37 Win=32850 Len=82
330844 115.186412 41.177.98.143 -> 203.25.39.39 TCP 152 vcom-tunnel > 51489 [PSH, ACK] Seq=1 Ack=37 Win=64296 Len=82 TSval=1509556977 TSecr=6823606
350041 118.342583 41.177.98.143 -> 244.56.202.204 TCP 132 vcom-tunnel > netbill-keyrep [PSH, ACK] Seq=23165 Ack=3998 Win=64240 Len=74
350531 118.466098 41.177.98.143 -> 244.56.202.204 TCP 64 vcom-tunnel > netbill-keyrep [ACK] Seq=23239 Ack=4021 Win=64240 Len=0
350850 118.543424 41.177.98.143 -> 244.56.202.204 TCP 250 vcom-tunnel > netbill-keyrep [PSH, ACK] Seq=23239 Ack=4498 Win=64240 Len=192
351305 118.767482 41.177.98.143 -> 244.56.202.204 TCP 134 vcom-tunnel > netbill-keyrep [PSH, ACK] Seq=23431 Ack=4498 Win=64240 Len=76
351907 119.102086 41.177.98.143 -> 244.56.202.204 TCP 96 vcom-tunnel > netbill-keyrep [PSH, ACK] Seq=23507 Ack=4498 Win=64240 Len=38
352097 119.270381 41.177.98.143 -> 244.56.202.204 TCP 96 vcom-tunnel > netbill-keyrep [PSH, ACK] Seq=23545 Ack=4498 Win=64240 Len=38
352169 119.315134 41.177.98.143 -> 194.120.155.106 TCP 140 vcom-tunnel > 4435 [PSH, ACK] Seq=1 Ack=37 Win=64860 Len=82
352405 119.471529 41.177.98.143 -> 244.56.202.204 TCP 180 vcom-tunnel > netbill-keyrep [PSH, ACK] Seq=23583 Ack=4498 Win=64240 Len=122
352701 119.673647 41.177.98.143 -> 244.56.202.204 TCP 104 vcom-tunnel > netbill-keyrep [PSH, ACK] Seq=23705 Ack=4498 Win=64240 Len=46
353051 119.873825 41.177.98.143 -> 244.56.202.204 TCP 276 vcom-tunnel > netbill-keyrep [PSH, ACK] Seq=23751 Ack=4498 Win=64240 Len=218
354989 120.985918 41.177.98.143 -> 244.56.202.204 TCP 64 vcom-tunnel > netbill-keyrep [ACK] Seq=23969 Ack=4521 Win=64240 Len=0
355185 121.064519 41.177.98.143 -> 244.56.202.204 TCP 250 vcom-tunnel > netbill-keyrep [PSH, ACK] Seq=23969 Ack=5001 Win=64240 Len=192
355743 121.282084 41.177.98.143 -> 244.56.202.204 TCP 134 vcom-tunnel > netbill-keyrep [PSH, ACK] Seq=24161 Ack=5001 Win=64240 Len=76
357060 121.827005 41.177.98.143 -> 244.56.202.204 TCP 96 vcom-tunnel > netbill-keyrep [PSH, ACK] Seq=24237 Ack=5001 Win=64240 Len=38
357439 121.986363 41.177.98.143 -> 244.56.202.204 TCP 96 vcom-tunnel > netbill-keyrep [PSH, ACK] Seq=24275 Ack=5001 Win=64240 Len=38
357920 122.187463 41.177.98.143 -> 244.56.202.204 TCP 180 vcom-tunnel > netbill-keyrep [PSH, ACK] Seq=24313 Ack=5001 Win=64240 Len=122
358488 122.388576 41.177.98.143 -> 244.56.202.204 TCP 322 vcom-tunnel > netbill-keyrep [PSH, ACK] Seq=24435 Ack=5001 Win=64240 Len=264
361803 123.495974 41.177.98.143 -> 244.56.202.204 TCP 64 vcom-tunnel > netbill-keyrep [ACK] Seq=24699 Ack=5024 Win=64240 Len=0
362174 123.573057 41.177.98.143 -> 244.56.202.204 TCP 185 vcom-tunnel > netbill-keyrep [PSH, ACK] Seq=24699 Ack=5511 Win=64240 Len=127
363398 123.796811 41.177.98.143 -> 244.56.202.204 TCP 134 vcom-tunnel > netbill-keyrep [PSH, ACK] Seq=24826 Ack=5511 Win=64240 Len=76
364213 123.997948 41.177.98.143 -> 244.56.202.204 TCP 96 vcom-tunnel > netbill-keyrep [PSH, ACK] Seq=24902 Ack=5511 Win=64240 Len=38
364677 124.199295 41.177.98.143 -> 244.56.202.204 TCP 96 vcom-tunnel > netbill-keyrep [PSH, ACK] Seq=24940 Ack=5511 Win=64240 Len=38
365163 124.488884 41.177.98.143 -> 244.56.202.204 TCP 96 vcom-tunnel > netbill-keyrep [PSH, ACK] Seq=24978 Ack=5511 Win=64240 Len=38
365228 124.516440 41.177.98.143 -> 244.160.201.18 TCP 69 vcom-tunnel > 51265 [PSH, ACK] Seq=28418 Ack=2634 Win=32775 Len=11
365340 124.627913 41.177.98.143 -> 244.160.201.18 TCP 1438 vcom-tunnel > 51265 [ACK] Seq=28429 Ack=2643 Win=32775 Len=1380
365341 124.627918 41.177.98.143 -> 244.160.201.18 TCP 466 vcom-tunnel > 51265 [PSH, ACK] Seq=29809 Ack=2643 Win=32775 Len=408
366362 125.314822 41.177.98.143 -> 244.56.202.204 TCP 96 vcom-tunnel > netbill-keyrep [PSH, ACK] Seq=25016 Ack=5511 Win=64240 Len=38
367630 125.805564 41.177.98.143 -> 244.56.202.204 TCP 96 vcom-tunnel > netbill-keyrep [PSH, ACK] Seq=25054 Ack=5511 Win=64240 Len=38
368332 126.187467 41.177.98.143 -> 244.56.202.204 TCP 96 vcom-tunnel > netbill-keyrep [PSH, ACK] Seq=25092 Ack=5511 Win=64240 Len=38
374693 126.472807 41.177.98.143 -> 244.56.202.204 TCP 142 vcom-tunnel > netbill-keyrep [PSH, ACK] Seq=25130 Ack=5511 Win=64240 Len=84
381549 127.009141 41.177.98.143 -> 244.56.202.204 TCP 138 vcom-tunnel > netbill-keyrep [PSH, ACK] Seq=25214 Ack=5511 Win=64240 Len=80
382113 127.216937 41.177.98.143 -> 244.56.202.204 TCP 282 vcom-tunnel > netbill-keyrep [PSH, ACK] Seq=25294 Ack=5511 Win=64240 Len=224
382738 127.278001 41.177.98.143 -> 244.56.202.204 TCP 839 vcom-tunnel > netbill-keyrep [PSH, ACK] Seq=25518 Ack=5532 Win=64240 Len=781
385927 128.135230 41.177.98.143 -> 244.160.201.18 TCP 499 vcom-tunnel > 51265 [PSH, ACK] Seq=30217 Ack=2727 Win=32775 Len=441
386183 128.354049 41.177.98.143 -> 244.56.202.204 TCP 839 vcom-tunnel > netbill-keyrep [PSH, ACK] Seq=26299 Ack=5553 Win=64240 Len=781
389281 129.986322 41.177.98.143 -> 244.56.202.204 TCP 132 vcom-tunnel > netbill-keyrep [PSH, ACK] Seq=27080 Ack=5579 Win=64240 Len=74
389352 130.030932 41.177.98.143 -> 244.56.202.204 TCP 571 vcom-tunnel > netbill-keyrep [PSH, ACK] Seq=27154 Ack=5594 Win=64240 Len=513
389761 130.236973 41.177.98.143 -> 244.56.202.204 TCP 69 vcom-tunnel > netbill-keyrep [PSH, ACK] Seq=27667 Ack=5679 Win=64240 Len=11
389933 130.296026 41.177.98.143 -> 244.56.202.204 TCP 64 vcom-tunnel > netbill-keyrep [ACK] Seq=27678 Ack=5686 Win=64240 Len=0
390170 130.374431 41.177.98.143 -> 244.56.202.204 TCP 1518 vcom-tunnel > netbill-keyrep [ACK] Seq=27678 Ack=5686 Win=64240 Len=1460
390171 130.374487 41.177.98.143 -> 244.56.202.204 TCP 602 vcom-tunnel > netbill-keyrep [PSH, ACK] Seq=29138 Ack=5686 Win=64240 Len=544
390468 130.486224 41.177.98.143 -> 244.56.202.204 TCP 64 vcom-tunnel > netbill-keyrep [ACK] Seq=29682 Ack=5760 Win=64240 Len=0
390479 130.490761 41.177.98.143 -> 244.56.202.204 TCP 1246 vcom-tunnel > netbill-keyrep [PSH, ACK] Seq=29682 Ack=5760 Win=64240 Len=1188
390793 130.596144 41.177.98.143 -> 244.56.202.204 TCP 64 vcom-tunnel > netbill-keyrep [ACK] Seq=30870 Ack=5834 Win=64240 Len=0
390797 130.597700 41.177.98.143 -> 244.56.202.204 TCP 1518 vcom-tunnel > netbill-keyrep [ACK] Seq=30870 Ack=5834 Win=64240 Len=1460
390798 130.597705 41.177.98.143 -> 244.56.202.204 TCP 461 vcom-tunnel > netbill-keyrep [PSH, ACK] Seq=32330 Ack=5834 Win=64240 Len=403
391095 130.706073 41.177.98.143 -> 244.56.202.204 TCP 64 vcom-tunnel > netbill-keyrep [ACK] Seq=32733 Ack=5908 Win=64240 Len=0
391106 130.708159 41.177.98.143 -> 244.56.202.204 TCP 1518 vcom-tunnel > netbill-keyrep [ACK] Seq=32733 Ack=5908 Win=64240 Len=1460
391107 130.708164 41.177.98.143 -> 244.56.202.204 TCP 416 vcom-tunnel > netbill-keyrep [PSH, ACK] Seq=34193 Ack=5908 Win=64240 Len=358
391515 130.858821 41.177.98.143 -> 244.56.202.204 TCP 132 vcom-tunnel > netbill-keyrep [PSH, ACK] Seq=34551 Ack=5934 Win=64240 Len=74
392894 131.396187 41.177.98.143 -> 83.94.193.12 TCP 1411 [TCP Retransmission] vcom-tunnel > o2server-port [FIN, PSH, ACK] Seq=1 Ack=1 Win=32857 Len=1341 TSval=1509558598 TSecr=65702
394276 132.136200 41.177.98.143 -> 128.231.127.18 TCP 85 vcom-tunnel > discovery-port [PSH, ACK] Seq=1 Ack=14 Win=64860 Len=27
395612 132.560845 41.177.98.143 -> 128.231.127.18 TCP 130 vcom-tunnel > discovery-port [PSH, ACK] Seq=28 Ack=32 Win=64860 Len=72
395990 132.695674 41.177.98.143 -> 128.231.127.18 TCP 79 vcom-tunnel > discovery-port [PSH, ACK] Seq=100 Ack=54 Win=64860 Len=21
396164 132.806075 41.177.98.143 -> 128.231.127.18 TCP 64 vcom-tunnel > discovery-port [ACK] Seq=121 Ack=77 Win=64860 Len=0
396275 132.857447 41.177.98.143 -> 128.231.127.18 TCP 109 vcom-tunnel > discovery-port [PSH, ACK] Seq=121 Ack=381 Win=64860 Len=51
398202 133.986208 41.177.98.143 -> 128.231.127.18 TCP 64 vcom-tunnel > discovery-port [ACK] Seq=172 Ack=404 Win=64860 Len=0
398384 134.036934 41.177.98.143 -> 128.231.127.18 TCP 109 vcom-tunnel > discovery-port [PSH, ACK] Seq=172 Ack=710 Win=64860 Len=51
399455 134.436248 41.177.98.143 -> 244.56.202.204 TCP 64 vcom-tunnel > netbill-keyrep [ACK] Seq=34625 Ack=6008 Win=64240 Len=0
399488 134.448976 41.177.98.143 -> 244.56.202.204 TCP 1518 vcom-tunnel > netbill-keyrep [ACK] Seq=34625 Ack=6008 Win=64240 Len=1460
399489 134.448981 41.177.98.143 -> 244.56.202.204 TCP 991 vcom-tunnel > netbill-keyrep [PSH, ACK] Seq=36085 Ack=6008 Win=64240 Len=933
399830 134.558009 41.177.98.143 -> 244.56.202.204 TCP 64 vcom-tunnel > netbill-keyrep [ACK] Seq=37018 Ack=6082 Win=64240 Len=0
399831 134.558202 41.177.98.143 -> 244.56.202.204 TCP 1518 vcom-tunnel > netbill-keyrep [ACK] Seq=37018 Ack=6082 Win=64240 Len=1460
399832 134.558207 41.177.98.143 -> 244.56.202.204 TCP 136 vcom-tunnel > netbill-keyrep [PSH, ACK] Seq=38478 Ack=6082 Win=64240 Len=78
402920 135.166077 41.177.98.143 -> 128.231.127.18 TCP 64 vcom-tunnel > discovery-port [ACK] Seq=223 Ack=733 Win=64860 Len=0
403178 135.219277 41.177.98.143 -> 128.231.127.18 TCP 109 vcom-tunnel > discovery-port [PSH, ACK] Seq=223 Ack=1042 Win=64860 Len=51
406464 135.976069 41.177.98.143 -> 244.160.160.144 TCP 140 vcom-tunnel > 53261 [PSH, ACK] Seq=1 Ack=37 Win=32825 Len=82
413408 138.091776 41.177.98.143 -> 244.56.202.204 TCP 1518 vcom-tunnel > netbill-keyrep [ACK] Seq=38556 Ack=6156 Win=64240 Len=1460
413409 138.091780 41.177.98.143 -> 244.56.202.204 TCP 355 vcom-tunnel > netbill-keyrep [PSH, ACK] Seq=40016 Ack=6156 Win=64240 Len=297
413565 138.165161 41.177.98.143 -> 244.56.202.204 TCP 1518 vcom-tunnel > netbill-keyrep [ACK] Seq=40313 Ack=6230 Win=64240 Len=1460
413566 138.165167 41.177.98.143 -> 244.56.202.204 TCP 137 vcom-tunnel > netbill-keyrep [PSH, ACK] Seq=41773 Ack=6230 Win=64240 Len=79
413951 138.279217 41.177.98.143 -> 244.56.202.204 TCP 1518 vcom-tunnel > netbill-keyrep [ACK] Seq=41852 Ack=6304 Win=64240 Len=1460
413952 138.279222 41.177.98.143 -> 244.56.202.204 TCP 195 vcom-tunnel > netbill-keyrep [PSH, ACK] Seq=43312 Ack=6304 Win=64240 Len=137
414277 138.353256 41.177.98.143 -> 244.56.202.204 TCP 1518 vcom-tunnel > netbill-keyrep [ACK] Seq=43449 Ack=6379 Win=64240 Len=1460
414278 138.353261 41.177.98.143 -> 244.56.202.204 TCP 201 vcom-tunnel > netbill-keyrep [PSH, ACK] Seq=44909 Ack=6379 Win=64240 Len=143
425150 139.611863 41.177.98.143 -> 244.56.202.204 TCP 1496 vcom-tunnel > netbill-keyrep [PSH, ACK] Seq=45052 Ack=6454 Win=64240 Len=1438
425582 139.701406 41.177.98.143 -> 244.56.202.204 TCP 1518 vcom-tunnel > netbill-keyrep [ACK] Seq=46490 Ack=6529 Win=64240 Len=1460
425583 139.701411 41.177.98.143 -> 244.56.202.204 TCP 242 vcom-tunnel > netbill-keyrep [PSH, ACK] Seq=47950 Ack=6529 Win=64240 Len=184
426047 139.789510 41.177.98.143 -> 244.160.201.18 TCP 69 vcom-tunnel > 51265 [PSH, ACK] Seq=30658 Ack=2812 Win=32775 Len=11
426565 139.872337 41.177.98.143 -> 244.160.201.18 TCP 1438 vcom-tunnel > 51265 [ACK] Seq=30669 Ack=2821 Win=32775 Len=1380
