61292  25.049202 41.177.244.220 -> 244.3.210.254 TCP 64 dialpad-voice1 > 19813 [ACK] Seq=1 Ack=13 Win=65269 Len=0
189761  65.026136 41.177.244.220 -> 244.3.210.254 TCP 70 dialpad-voice1 > 19813 [PSH, ACK] Seq=1 Ack=13 Win=65269 Len=12
308822 105.215686 41.177.244.220 -> 244.3.210.254 TCP 64 dialpad-voice1 > 19813 [ACK] Seq=13 Ack=25 Win=65257 Len=0
447154 145.232612 41.177.244.220 -> 244.3.210.254 TCP 70 dialpad-voice1 > 19813 [PSH, ACK] Seq=13 Ack=25 Win=65257 Len=12
582365 185.382183 41.177.244.220 -> 244.3.210.254 TCP 64 dialpad-voice1 > 19813 [ACK] Seq=25 Ack=37 Win=65245 Len=0
707940 225.432352 41.177.244.220 -> 244.3.210.254 TCP 70 dialpad-voice1 > 19813 [PSH, ACK] Seq=25 Ack=37 Win=65245 Len=12
814235 265.548684 41.177.244.220 -> 244.3.210.254 TCP 64 dialpad-voice1 > 19813 [ACK] Seq=37 Ack=49 Win=65233 Len=0
921211 305.589043 41.177.244.220 -> 244.3.210.254 TCP 70 dialpad-voice1 > 19813 [PSH, ACK] Seq=37 Ack=49 Win=65233 Len=12
