6711   2.196526 41.177.40.92 -> 244.3.160.239 TCP 70 16359 > http [SYN] Seq=0 Win=8192 Len=0 MSS=1460 WS=4 SACK_PERM=1
6713   2.197075 41.177.40.92 -> 244.3.160.239 TCP 64 16359 > http [ACK] Seq=1 Ack=1 Win=65700 Len=0
6814   2.240370 41.177.40.92 -> 244.3.160.239 TCP 64 16359 > http [ACK] Seq=891 Ack=2050 Win=65700 Len=0
6822   2.242090 41.177.40.92 -> 244.3.160.239 TCP 64 16359 > http [ACK] Seq=891 Ack=4099 Win=65700 Len=0
6823   2.242212 41.177.40.92 -> 244.3.160.239 TCP 64 16359 > http [ACK] Seq=891 Ack=4361 Win=65436 Len=0
6825   2.242220 41.177.40.92 -> 244.3.160.239 TCP 64 16359 > http [FIN, ACK] Seq=891 Ack=4361 Win=65436 Len=0
6833   2.244319 41.177.40.92 -> 244.3.160.239 TCP 70 11093 > http [SYN] Seq=0 Win=8192 Len=0 MSS=1460 WS=4 SACK_PERM=1
6835   2.244760 41.177.40.92 -> 244.3.160.239 TCP 64 11093 > http [ACK] Seq=1 Ack=1 Win=65700 Len=0
6871   2.256178 41.177.40.92 -> 244.3.160.239 TCP 64 11093 > http [ACK] Seq=1014 Ack=244 Win=65456 Len=0
6873   2.256314 41.177.40.92 -> 244.3.160.239 TCP 64 11093 > http [FIN, ACK] Seq=1014 Ack=244 Win=65456 Len=0
6876   2.262276 41.177.40.92 -> 244.3.160.239 TCP 70 giop-ssl > http [SYN] Seq=0 Win=8192 Len=0 MSS=1460 WS=4 SACK_PERM=1
6883   2.262661 41.177.40.92 -> 244.3.160.239 TCP 64 giop-ssl > http [ACK] Seq=1 Ack=1 Win=65700 Len=0
7551   2.546991 41.177.40.92 -> 244.3.160.239 TCP 64 giop-ssl > http [ACK] Seq=1027 Ack=2298 Win=65700 Len=0
7552   2.547199 41.177.40.92 -> 244.3.160.239 TCP 64 giop-ssl > http [FIN, ACK] Seq=1027 Ack=2298 Win=65700 Len=0
7571   2.558147 41.177.40.92 -> 244.3.160.239 TCP 70 9922 > http [SYN] Seq=0 Win=8192 Len=0 MSS=1460 WS=4 SACK_PERM=1
7573   2.558592 41.177.40.92 -> 244.3.160.239 TCP 64 9922 > http [ACK] Seq=1 Ack=1 Win=65700 Len=0
8050   2.825140 41.177.40.92 -> 244.3.160.239 TCP 64 9922 > http [ACK] Seq=1136 Ack=1461 Win=64240 Len=0
8052   2.825367 41.177.40.92 -> 244.3.160.239 TCP 64 9922 > http [FIN, ACK] Seq=1136 Ack=1461 Win=64240 Len=0
8059   2.832747 41.177.40.92 -> 244.3.160.239 TCP 70 14205 > http [SYN] Seq=0 Win=8192 Len=0 MSS=1460 WS=4 SACK_PERM=1
8061   2.833208 41.177.40.92 -> 244.3.160.239 TCP 64 14205 > http [ACK] Seq=1 Ack=1 Win=65700 Len=0
8098   2.848548 41.177.40.92 -> 244.3.160.239 TCP 64 14205 > http [ACK] Seq=1212 Ack=838 Win=64864 Len=0
8101   2.848677 41.177.40.92 -> 244.3.160.239 TCP 64 14205 > http [FIN, ACK] Seq=1212 Ack=838 Win=64864 Len=0
8104   2.848917 41.177.40.92 -> 244.3.160.239 TCP 70 telelpathstart > http [SYN] Seq=0 Win=8192 Len=0 MSS=1460 WS=4 SACK_PERM=1
8108   2.849462 41.177.40.92 -> 244.3.160.239 TCP 64 telelpathstart > http [ACK] Seq=1 Ack=1 Win=65700 Len=0
8487   3.032085 41.177.40.92 -> 244.3.160.239 TCP 64 telelpathstart > http [ACK] Seq=1153 Ack=2050 Win=65700 Len=0
8493   3.033830 41.177.40.92 -> 244.3.160.239 TCP 64 telelpathstart > http [ACK] Seq=1153 Ack=4099 Win=65700 Len=0
8506   3.035818 41.177.40.92 -> 244.3.160.239 TCP 64 telelpathstart > http [ACK] Seq=1153 Ack=6148 Win=65700 Len=0
8513   3.037825 41.177.40.92 -> 244.3.160.239 TCP 64 telelpathstart > http [ACK] Seq=1153 Ack=8239 Win=65700 Len=0
8519   3.039948 41.177.40.92 -> 244.3.160.239 TCP 64 telelpathstart > http [ACK] Seq=1153 Ack=10345 Win=65700 Len=0
8521   3.040025 41.177.40.92 -> 244.3.160.239 TCP 70 12967 > http [SYN] Seq=0 Win=8192 Len=0 MSS=1460 WS=4 SACK_PERM=1
8526   3.040429 41.177.40.92 -> 244.3.160.239 TCP 70 15043 > http [SYN] Seq=0 Win=8192 Len=0 MSS=1460 WS=4 SACK_PERM=1
8527   3.040573 41.177.40.92 -> 244.3.160.239 TCP 64 12967 > http [ACK] Seq=1 Ack=1 Win=65700 Len=0
8530   3.040829 41.177.40.92 -> 244.3.160.239 TCP 70 citrixuppg > http [SYN] Seq=0 Win=8192 Len=0 MSS=1460 WS=4 SACK_PERM=1
8531   3.040947 41.177.40.92 -> 244.3.160.239 TCP 64 15043 > http [ACK] Seq=1 Ack=1 Win=65700 Len=0
8534   3.041156 41.177.40.92 -> 244.3.160.239 TCP 70 l3-ranger > http [SYN] Seq=0 Win=8192 Len=0 MSS=1460 WS=4 SACK_PERM=1
8537   3.041415 41.177.40.92 -> 244.3.160.239 TCP 64 citrixuppg > http [ACK] Seq=1 Ack=1 Win=65700 Len=0
8540   3.041647 41.177.40.92 -> 244.3.160.239 TCP 64 l3-ranger > http [ACK] Seq=1 Ack=1 Win=65700 Len=0
8546   3.042320 41.177.40.92 -> 244.3.160.239 TCP 64 telelpathstart > http [ACK] Seq=1153 Ack=12394 Win=65700 Len=0
8566   3.044662 41.177.40.92 -> 244.3.160.239 TCP 64 telelpathstart > http [ACK] Seq=1153 Ack=14453 Win=65700 Len=0
8582   3.046868 41.177.40.92 -> 244.3.160.239 TCP 64 telelpathstart > http [ACK] Seq=1153 Ack=16509 Win=65700 Len=0
8593   3.047827 41.177.40.92 -> 244.3.160.239 TCP 64 12967 > http [ACK] Seq=983 Ack=242 Win=65460 Len=0
8595   3.047913 41.177.40.92 -> 244.3.160.239 TCP 64 12967 > http [FIN, ACK] Seq=983 Ack=242 Win=65460 Len=0
8608   3.049130 41.177.40.92 -> 244.3.160.239 TCP 64 telelpathstart > http [ACK] Seq=1153 Ack=18558 Win=65700 Len=0
8616   3.049691 41.177.40.92 -> 244.3.160.239 TCP 64 15043 > http [ACK] Seq=996 Ack=242 Win=65460 Len=0
8617   3.049696 41.177.40.92 -> 244.3.160.239 TCP 64 15043 > http [FIN, ACK] Seq=996 Ack=242 Win=65460 Len=0
8636   3.051681 41.177.40.92 -> 244.3.160.239 TCP 64 telelpathstart > http [ACK] Seq=1153 Ack=20839 Win=65700 Len=0
8643   3.052297 41.177.40.92 -> 244.3.160.239 TCP 64 citrixuppg > http [ACK] Seq=985 Ack=242 Win=65460 Len=0
8646   3.052616 41.177.40.92 -> 244.3.160.239 TCP 64 citrixuppg > http [FIN, ACK] Seq=985 Ack=242 Win=65460 Len=0
8655   3.053808 41.177.40.92 -> 244.3.160.239 TCP 64 telelpathstart > http [ACK] Seq=1153 Ack=22888 Win=65700 Len=0
8673   3.056060 41.177.40.92 -> 244.3.160.239 TCP 64 telelpathstart > http [ACK] Seq=1153 Ack=24984 Win=65700 Len=0
8687   3.057753 41.177.40.92 -> 244.3.160.239 TCP 64 l3-ranger > http [ACK] Seq=933 Ack=1617 Win=65700 Len=0
8691   3.058133 41.177.40.92 -> 244.3.160.239 TCP 64 l3-ranger > http [ACK] Seq=933 Ack=1618 Win=65700 Len=0
8692   3.058138 41.177.40.92 -> 244.3.160.239 TCP 64 telelpathstart > http [ACK] Seq=1153 Ack=27033 Win=65700 Len=0
8693   3.058194 41.177.40.92 -> 244.3.160.239 TCP 64 l3-ranger > http [FIN, ACK] Seq=933 Ack=1618 Win=65700 Len=0
8700   3.060318 41.177.40.92 -> 244.3.160.239 TCP 64 telelpathstart > http [ACK] Seq=1153 Ack=29083 Win=65700 Len=0
8708   3.062617 41.177.40.92 -> 244.3.160.239 TCP 64 telelpathstart > http [ACK] Seq=1153 Ack=31343 Win=65700 Len=0
8724   3.064825 41.177.40.92 -> 244.3.160.239 TCP 64 telelpathstart > http [ACK] Seq=1153 Ack=33548 Win=65700 Len=0
8730   3.065600 41.177.40.92 -> 244.3.160.239 TCP 64 telelpathstart > http [ACK] Seq=1153 Ack=34277 Win=64972 Len=0
8731   3.065604 41.177.40.92 -> 244.3.160.239 TCP 64 telelpathstart > http [FIN, ACK] Seq=1153 Ack=34277 Win=64972 Len=0
17600   5.259117 41.177.40.92 -> 244.3.160.239 TCP 70 octopus > http [SYN] Seq=0 Win=8192 Len=0 MSS=1460 WS=4 SACK_PERM=1
17602   5.259626 41.177.40.92 -> 244.3.160.239 TCP 64 octopus > http [ACK] Seq=1 Ack=1 Win=65700 Len=0
17628   5.266394 41.177.40.92 -> 244.3.160.239 TCP 64 octopus > http [ACK] Seq=884 Ack=174 Win=65528 Len=0
17630   5.266591 41.177.40.92 -> 244.3.160.239 TCP 64 octopus > http [FIN, ACK] Seq=884 Ack=174 Win=65528 Len=0
