36592  15.288612 41.177.3.215 -> 41.177.3.224 TCP 66 58976 > 30383 [SYN] Seq=0 Win=24820 Len=0 SACK_PERM=1 MSS=1460
36597  15.289036 41.177.3.215 -> 41.177.3.224 TCP 64 58976 > 30383 [ACK] Seq=1 Ack=1 Win=24820 Len=0
37407  15.571795 41.177.3.215 -> 41.177.3.224 TCP 673 58976 > 30383 [PSH, ACK] Seq=1 Ack=1 Win=24820 Len=615
37442  15.576724 41.177.3.215 -> 41.177.3.224 TCP 64 58976 > 30383 [ACK] Seq=616 Ack=45 Win=24820 Len=0
37444  15.578089 41.177.3.215 -> 41.177.3.224 TCP 326 58976 > 30383 [PSH, ACK] Seq=616 Ack=45 Win=24820 Len=268
39267  16.253049 41.177.3.215 -> 41.177.3.224 TCP 64 58976 > 30383 [ACK] Seq=884 Ack=686 Win=24820 Len=0
39305  16.273039 41.177.3.215 -> 41.177.3.224 TCP 64 58976 > 30383 [FIN, ACK] Seq=884 Ack=686 Win=24820 Len=0
39316  16.273561 41.177.3.215 -> 41.177.3.224 TCP 64 58976 > 30383 [ACK] Seq=885 Ack=687 Win=24820 Len=0
57511  23.495670 41.177.3.215 -> 244.3.210.95 TCP 66 59077 > hp-alarm-mgr [SYN] Seq=0 Win=24820 Len=0 SACK_PERM=1 MSS=1380
57633  23.505985 41.177.3.215 -> 244.3.210.95 TCP 64 59077 > hp-alarm-mgr [ACK] Seq=1 Ack=1 Win=24840 Len=0
59179  23.855555 41.177.3.215 -> 244.3.210.95 TCP 659 59077 > hp-alarm-mgr [PSH, ACK] Seq=1 Ack=1 Win=24840 Len=601
59182  23.857272 41.177.3.215 -> 244.3.210.95 TCP 64 59077 > hp-alarm-mgr [ACK] Seq=602 Ack=45 Win=24840 Len=0
59192  23.858220 41.177.3.215 -> 244.3.210.95 TCP 327 59077 > hp-alarm-mgr [PSH, ACK] Seq=602 Ack=45 Win=24840 Len=269
59252  23.871245 41.177.3.215 -> 244.3.210.95 TCP 64 59077 > hp-alarm-mgr [ACK] Seq=871 Ack=686 Win=24840 Len=0
59287  23.884221 41.177.3.215 -> 244.3.210.95 TCP 64 59077 > hp-alarm-mgr [FIN, ACK] Seq=871 Ack=686 Win=24840 Len=0
59290  23.884805 41.177.3.215 -> 244.3.210.95 TCP 64 59077 > hp-alarm-mgr [ACK] Seq=872 Ack=687 Win=24840 Len=0
245469  85.710300 41.177.3.215 -> 41.177.3.203 TCP 66 59187 > 30383 [SYN] Seq=0 Win=24820 Len=0 SACK_PERM=1 MSS=1460
245471  85.710665 41.177.3.215 -> 41.177.3.203 TCP 64 59187 > 30383 [ACK] Seq=1 Ack=1 Win=24820 Len=0
245588  85.745892 41.177.3.215 -> 41.177.3.203 TCP 667 59187 > 30383 [PSH, ACK] Seq=1 Ack=1 Win=24820 Len=609
245597  85.750713 41.177.3.215 -> 41.177.3.203 TCP 64 59187 > 30383 [ACK] Seq=610 Ack=45 Win=24820 Len=0
245599  85.751842 41.177.3.215 -> 41.177.3.203 TCP 324 59187 > 30383 [PSH, ACK] Seq=610 Ack=45 Win=24820 Len=266
246578  86.468678 41.177.3.215 -> 41.177.3.203 TCP 64 59187 > 30383 [ACK] Seq=876 Ack=686 Win=24820 Len=0
246580  86.471935 41.177.3.215 -> 41.177.3.203 TCP 64 59187 > 30383 [FIN, ACK] Seq=876 Ack=686 Win=24820 Len=0
246583  86.472481 41.177.3.215 -> 41.177.3.203 TCP 64 59187 > 30383 [ACK] Seq=877 Ack=687 Win=24820 Len=0
404479 135.530966 41.177.3.215 -> 41.177.3.224 TCP 66 59280 > 30383 [SYN] Seq=0 Win=24820 Len=0 SACK_PERM=1 MSS=1460
404481 135.531362 41.177.3.215 -> 41.177.3.224 TCP 64 59280 > 30383 [ACK] Seq=1 Ack=1 Win=24820 Len=0
405206 135.707150 41.177.3.215 -> 41.177.3.224 TCP 673 59280 > 30383 [PSH, ACK] Seq=1 Ack=1 Win=24820 Len=615
405222 135.712147 41.177.3.215 -> 41.177.3.224 TCP 64 59280 > 30383 [ACK] Seq=616 Ack=45 Win=24820 Len=0
405247 135.713645 41.177.3.215 -> 41.177.3.224 TCP 326 59280 > 30383 [PSH, ACK] Seq=616 Ack=45 Win=24820 Len=268
408380 136.491514 41.177.3.215 -> 41.177.3.224 TCP 64 59280 > 30383 [ACK] Seq=884 Ack=686 Win=24820 Len=0
408488 136.512116 41.177.3.215 -> 41.177.3.224 TCP 64 59280 > 30383 [FIN, ACK] Seq=884 Ack=686 Win=24820 Len=0
408491 136.512676 41.177.3.215 -> 41.177.3.224 TCP 64 59280 > 30383 [ACK] Seq=885 Ack=687 Win=24820 Len=0
441883 143.860726 41.177.3.215 -> 244.3.210.95 TCP 66 59400 > hp-alarm-mgr [SYN] Seq=0 Win=24820 Len=0 SACK_PERM=1 MSS=1380
441885 143.861254 41.177.3.215 -> 244.3.210.95 TCP 64 59400 > hp-alarm-mgr [ACK] Seq=1 Ack=1 Win=24840 Len=0
443364 144.329702 41.177.3.215 -> 244.3.210.95 TCP 659 59400 > hp-alarm-mgr [PSH, ACK] Seq=1 Ack=1 Win=24840 Len=601
443370 144.331387 41.177.3.215 -> 244.3.210.95 TCP 64 59400 > hp-alarm-mgr [ACK] Seq=602 Ack=45 Win=24840 Len=0
443373 144.332314 41.177.3.215 -> 244.3.210.95 TCP 327 59400 > hp-alarm-mgr [PSH, ACK] Seq=602 Ack=45 Win=24840 Len=269
443405 144.345494 41.177.3.215 -> 244.3.210.95 TCP 64 59400 > hp-alarm-mgr [ACK] Seq=871 Ack=686 Win=24840 Len=0
443440 144.357904 41.177.3.215 -> 244.3.210.95 TCP 64 59400 > hp-alarm-mgr [FIN, ACK] Seq=871 Ack=686 Win=24840 Len=0
443443 144.358478 41.177.3.215 -> 244.3.210.95 TCP 64 59400 > hp-alarm-mgr [ACK] Seq=872 Ack=687 Win=24840 Len=0
655006 205.055824 41.177.3.215 -> 41.177.3.203 TCP 66 59499 > 30383 [SYN] Seq=0 Win=24820 Len=0 SACK_PERM=1 MSS=1460
655011 205.056241 41.177.3.215 -> 41.177.3.203 TCP 64 59499 > 30383 [ACK] Seq=1 Ack=1 Win=24820 Len=0
655147 205.121081 41.177.3.215 -> 41.177.3.203 TCP 667 59499 > 30383 [PSH, ACK] Seq=1 Ack=1 Win=24820 Len=609
655149 205.126161 41.177.3.215 -> 41.177.3.203 TCP 64 59499 > 30383 [ACK] Seq=610 Ack=45 Win=24820 Len=0
655152 205.127116 41.177.3.215 -> 41.177.3.203 TCP 324 59499 > 30383 [PSH, ACK] Seq=610 Ack=45 Win=24820 Len=266
656843 205.881064 41.177.3.215 -> 41.177.3.203 TCP 64 59499 > 30383 [ACK] Seq=876 Ack=686 Win=24820 Len=0
656850 205.884066 41.177.3.215 -> 41.177.3.203 TCP 64 59499 > 30383 [FIN, ACK] Seq=876 Ack=686 Win=24820 Len=0
656854 205.884584 41.177.3.215 -> 41.177.3.203 TCP 64 59499 > 30383 [ACK] Seq=877 Ack=687 Win=24820 Len=0
700458 222.314232 41.177.3.215 -> 145.95.81.118 UDP 108 Source port: 57172  Destination port: snmp
707950 225.433635 41.177.3.215 -> 145.95.81.118 UDP 108 Source port: 57172  Destination port: snmp
711674 227.044211 41.177.3.215 -> 145.95.81.118 UDP 108 Source port: 57172  Destination port: snmp
790621 256.835490 41.177.3.215 -> 41.177.3.224 TCP 66 59608 > 30383 [SYN] Seq=0 Win=24820 Len=0 SACK_PERM=1 MSS=1460
790623 256.836050 41.177.3.215 -> 41.177.3.224 TCP 64 59608 > 30383 [ACK] Seq=1 Ack=1 Win=24820 Len=0
790982 256.993787 41.177.3.215 -> 41.177.3.224 TCP 673 59608 > 30383 [PSH, ACK] Seq=1 Ack=1 Win=24820 Len=615
790987 256.998693 41.177.3.215 -> 41.177.3.224 TCP 64 59608 > 30383 [ACK] Seq=616 Ack=45 Win=24820 Len=0
790988 256.999800 41.177.3.215 -> 41.177.3.224 TCP 326 59608 > 30383 [PSH, ACK] Seq=616 Ack=45 Win=24820 Len=268
792545 257.790032 41.177.3.215 -> 41.177.3.224 TCP 64 59608 > 30383 [ACK] Seq=884 Ack=686 Win=24820 Len=0
792588 257.809530 41.177.3.215 -> 41.177.3.224 TCP 64 59608 > 30383 [FIN, ACK] Seq=884 Ack=686 Win=24820 Len=0
792591 257.810075 41.177.3.215 -> 41.177.3.224 TCP 64 59608 > 30383 [ACK] Seq=885 Ack=687 Win=24820 Len=0
812044 264.772159 41.177.3.215 -> 244.3.210.95 TCP 66 59722 > hp-alarm-mgr [SYN] Seq=0 Win=24820 Len=0 SACK_PERM=1 MSS=1380
812050 264.773447 41.177.3.215 -> 244.3.210.95 TCP 64 59722 > hp-alarm-mgr [ACK] Seq=1 Ack=1 Win=24840 Len=0
812696 265.016341 41.177.3.215 -> 244.3.210.95 TCP 659 59722 > hp-alarm-mgr [PSH, ACK] Seq=1 Ack=1 Win=24840 Len=601
812702 265.017993 41.177.3.215 -> 244.3.210.95 TCP 64 59722 > hp-alarm-mgr [ACK] Seq=602 Ack=45 Win=24840 Len=0
812703 265.019325 41.177.3.215 -> 244.3.210.95 TCP 327 59722 > hp-alarm-mgr [PSH, ACK] Seq=602 Ack=45 Win=24840 Len=269
812709 265.032420 41.177.3.215 -> 244.3.210.95 TCP 64 59722 > hp-alarm-mgr [ACK] Seq=871 Ack=686 Win=24840 Len=0
812728 265.044011 41.177.3.215 -> 244.3.210.95 TCP 64 59722 > hp-alarm-mgr [FIN, ACK] Seq=871 Ack=686 Win=24840 Len=0
812731 265.044555 41.177.3.215 -> 244.3.210.95 TCP 64 59722 > hp-alarm-mgr [ACK] Seq=872 Ack=687 Win=24840 Len=0
976894 325.493792 41.177.3.215 -> 41.177.3.203 TCP 66 59833 > 30383 [SYN] Seq=0 Win=24820 Len=0 SACK_PERM=1 MSS=1460
976900 325.494173 41.177.3.215 -> 41.177.3.203 TCP 64 59833 > 30383 [ACK] Seq=1 Ack=1 Win=24820 Len=0
977009 325.540443 41.177.3.215 -> 41.177.3.203 TCP 667 59833 > 30383 [PSH, ACK] Seq=1 Ack=1 Win=24820 Len=609
977033 325.545106 41.177.3.215 -> 41.177.3.203 TCP 64 59833 > 30383 [ACK] Seq=610 Ack=45 Win=24820 Len=0
977042 325.545986 41.177.3.215 -> 41.177.3.203 TCP 324 59833 > 30383 [PSH, ACK] Seq=610 Ack=45 Win=24820 Len=266
979059 326.329569 41.177.3.215 -> 41.177.3.203 TCP 64 59833 > 30383 [ACK] Seq=876 Ack=686 Win=24820 Len=0
979066 326.332648 41.177.3.215 -> 41.177.3.203 TCP 64 59833 > 30383 [FIN, ACK] Seq=876 Ack=686 Win=24820 Len=0
979079 326.333162 41.177.3.215 -> 41.177.3.203 TCP 64 59833 > 30383 [ACK] Seq=877 Ack=687 Win=24820 Len=0
