1408   0.397774 41.177.26.176 -> 68.188.213.144 TCP 64 http > hpss-ndapi [ACK] Seq=1 Ack=2 Win=32964 Len=0
1496   0.430011 41.177.26.176 -> 15.186.110.142 TCP 70 http > 60031 [ACK] Seq=10507 Ack=2 Win=33304 Len=0 TSval=140341639 TSecr=708513305
1568   0.452365 41.177.26.176 -> 77.197.128.18 TCP 66 http > 39982 [SYN, ACK] Seq=0 Ack=1 Win=64240 Len=0 SACK_PERM=1 MSS=1460
1632   0.487337 41.177.26.176 -> 77.197.128.108 TCP 66 http > 26837 [SYN, ACK] Seq=0 Ack=1 Win=64240 Len=0 SACK_PERM=1 MSS=1460
1836   0.534150 41.177.26.176 -> 77.197.128.18 TCP 64 http > 39982 [ACK] Seq=1 Ack=353 Win=64240 Len=0
1883   0.561271 41.177.26.176 -> 77.197.128.225 TCP 66 http > 28395 [SYN, ACK] Seq=0 Ack=1 Win=64240 Len=0 SACK_PERM=1 MSS=1460
1901   0.569007 41.177.26.176 -> 77.197.128.108 TCP 64 http > 26837 [ACK] Seq=1 Ack=316 Win=63925 Len=0
2120   0.642993 41.177.26.176 -> 77.197.128.225 TCP 64 http > 28395 [ACK] Seq=1 Ack=308 Win=63933 Len=0
3073   1.022434 41.177.26.176 -> 77.197.128.64 TCP 66 http > 53146 [SYN, ACK] Seq=0 Ack=1 Win=64240 Len=0 SACK_PERM=1 MSS=1460
3166   1.061724 41.177.26.176 -> 77.197.128.18 TCP 66 http > 40135 [SYN, ACK] Seq=0 Ack=1 Win=64240 Len=0 SACK_PERM=1 MSS=1460
3340   1.101295 41.177.26.176 -> 77.197.128.64 TCP 64 http > 53146 [ACK] Seq=1 Ack=309 Win=63932 Len=0
3521   1.143392 41.177.26.176 -> 77.197.128.18 TCP 64 http > 40135 [ACK] Seq=1 Ack=309 Win=63932 Len=0
4293   1.284711 41.177.26.176 -> 77.197.128.108 TCP 66 http > 27056 [SYN, ACK] Seq=0 Ack=1 Win=64240 Len=0 SACK_PERM=1 MSS=1460
4470   1.358976 41.177.26.176 -> 77.197.128.225 TCP 66 http > 28517 [SYN, ACK] Seq=0 Ack=1 Win=64240 Len=0 SACK_PERM=1 MSS=1460
4484   1.366529 41.177.26.176 -> 77.197.128.108 TCP 64 http > 27056 [ACK] Seq=1 Ack=301 Win=63940 Len=0
4613   1.406918 41.177.26.176 -> 77.197.128.64 TCP 71 [TCP segment of a reassembled PDU]
4653   1.416743 41.177.26.176 -> 77.197.128.118 TCP 66 http > 54580 [SYN, ACK] Seq=0 Ack=1 Win=64240 Len=0 SACK_PERM=1 MSS=1460
4767   1.440793 41.177.26.176 -> 77.197.128.225 TCP 64 http > 28517 [ACK] Seq=1 Ack=323 Win=63918 Len=0
4901   1.498551 41.177.26.176 -> 77.197.128.118 TCP 64 http > 54580 [ACK] Seq=1 Ack=309 Win=63932 Len=0
5001   1.537156 41.177.26.176 -> 15.186.110.142 TCP 82 http > 60188 [SYN, ACK] Seq=0 Ack=1 Win=33304 Len=0 TSval=140341750 TSecr=708514410 WS=2 SACK_PERM=1 MSS=1460
5156   1.608323 41.177.26.176 -> 15.186.110.142 TCP 70 http > 60188 [ACK] Seq=1 Ack=452 Win=66156 Len=0 TSval=140341757 TSecr=708514481
5323   1.689627 41.177.26.176 -> 77.197.128.223 TCP 66 http > 42376 [SYN, ACK] Seq=0 Ack=1 Win=64240 Len=0 SACK_PERM=1 MSS=1460
5357   1.721945 41.177.26.176 -> 77.197.128.108 TCP 75 [TCP segment of a reassembled PDU]
5484   1.766264 41.177.26.176 -> 40.202.145.94 TCP 64 http > 53683 [FIN, ACK] Seq=1 Ack=1 Win=33120 Len=0
5527   1.771350 41.177.26.176 -> 77.197.128.223 TCP 64 http > 42376 [ACK] Seq=1 Ack=304 Win=63937 Len=0
5846   1.822975 41.177.26.176 -> 77.197.128.64 TCP 66 http > 53340 [SYN, ACK] Seq=0 Ack=1 Win=64240 Len=0 SACK_PERM=1 MSS=1460
6036   1.887341 41.177.26.176 -> 40.202.145.94 TCP 64 http > 53683 [ACK] Seq=2 Ack=2 Win=33120 Len=0
6038   1.890283 41.177.26.176 -> 77.197.128.18 TCP 66 http > 40372 [SYN, ACK] Seq=0 Ack=1 Win=64240 Len=0 SACK_PERM=1 MSS=1460
6051   1.902063 41.177.26.176 -> 77.197.128.64 TCP 64 http > 53340 [ACK] Seq=1 Ack=309 Win=63932 Len=0
6280   1.971908 41.177.26.176 -> 77.197.128.18 TCP 64 http > 40372 [ACK] Seq=1 Ack=305 Win=63936 Len=0
6457   2.097372 41.177.26.176 -> 77.197.128.108 TCP 66 http > 27230 [SYN, ACK] Seq=0 Ack=1 Win=64240 Len=0 SACK_PERM=1 MSS=1460
6467   2.104084 41.177.26.176 -> 15.186.110.142 TCP 82 http > 60252 [SYN, ACK] Seq=0 Ack=1 Win=33304 Len=0 TSval=140341806 TSecr=708514977 WS=2 SACK_PERM=1 MSS=1460
6657   2.175534 41.177.26.176 -> 15.186.110.142 TCP 70 http > 60252 [ACK] Seq=1 Ack=465 Win=66144 Len=0 TSval=140341813 TSecr=708515048
6686   2.178995 41.177.26.176 -> 77.197.128.108 TCP 64 http > 27230 [ACK] Seq=1 Ack=289 Win=63952 Len=0
6933   2.296783 41.177.26.176 -> 77.197.128.106 TCP 66 http > 35540 [SYN, ACK] Seq=0 Ack=1 Win=64240 Len=0 SACK_PERM=1 MSS=1460
7126   2.375955 41.177.26.176 -> 77.197.128.106 TCP 64 http > 35540 [ACK] Seq=1 Ack=419 Win=63822 Len=0
7612   2.577888 41.177.26.176 -> 77.197.128.225 TCP 66 http > 28676 [SYN, ACK] Seq=0 Ack=1 Win=64240 Len=0 SACK_PERM=1 MSS=1460
7769   2.659673 41.177.26.176 -> 77.197.128.225 TCP 64 http > 28676 [ACK] Seq=1 Ack=318 Win=63923 Len=0
7917   2.768173 41.177.26.176 -> 15.186.110.142 TCP 70 http > 60252 [ACK] Seq=24924 Ack=466 Win=66608 Len=0 TSval=140341873 TSecr=708515641
8935   3.192659 41.177.26.176 -> 15.186.110.142 TCP 70 http > 60188 [ACK] Seq=9215 Ack=453 Win=66608 Len=0 TSval=140341915 TSecr=708516065
9543   3.394979 41.177.26.176 -> 77.197.128.108 TCP 66 http > 27334 [SYN, ACK] Seq=0 Ack=1 Win=64240 Len=0 SACK_PERM=1 MSS=1460
9742   3.442029 41.177.26.176 -> 122.39.210.202 TCP 64 http > 57482 [ACK] Seq=1 Ack=2 Win=64860 Len=0
9744   3.442262 41.177.26.176 -> 122.39.210.202 TCP 64 http > 57482 [FIN, ACK] Seq=1 Ack=2 Win=64860 Len=0
9835   3.467509 41.177.26.176 -> 77.197.128.18 TCP 66 http > 40580 [SYN, ACK] Seq=0 Ack=1 Win=64240 Len=0 SACK_PERM=1 MSS=1460
9848   3.476641 41.177.26.176 -> 77.197.128.108 TCP 64 http > 27334 [ACK] Seq=1 Ack=308 Win=63933 Len=0
10297   3.549234 41.177.26.176 -> 77.197.128.18 TCP 64 http > 40580 [ACK] Seq=1 Ack=317 Win=63924 Len=0
10491   3.611360 41.177.26.176 -> 77.197.128.41 TCP 66 http > ctx-bridge [SYN, ACK] Seq=0 Ack=1 Win=64240 Len=0 SACK_PERM=1 MSS=1460
11561   3.690333 41.177.26.176 -> 77.197.128.41 TCP 64 http > ctx-bridge [ACK] Seq=1 Ack=309 Win=63932 Len=0
12337   3.781813 41.177.26.176 -> 77.197.128.155 TCP 66 http > 59689 [SYN, ACK] Seq=0 Ack=1 Win=64240 Len=0 SACK_PERM=1 MSS=1460
13146   3.863445 41.177.26.176 -> 77.197.128.155 TCP 64 http > 59689 [ACK] Seq=1 Ack=305 Win=63936 Len=0
14307   4.046072 41.177.26.176 -> 77.197.128.106 TCP 66 http > 35903 [SYN, ACK] Seq=0 Ack=1 Win=64240 Len=0 SACK_PERM=1 MSS=1460
15185   4.125086 41.177.26.176 -> 77.197.128.106 TCP 64 http > 35903 [ACK] Seq=1 Ack=318 Win=64240 Len=0
15199   4.142601 41.177.26.176 -> 77.197.128.251 TCP 66 http > 17800 [SYN, ACK] Seq=0 Ack=1 Win=64240 Len=0 SACK_PERM=1 MSS=1460
15399   4.221629 41.177.26.176 -> 77.197.128.251 TCP 64 http > 17800 [ACK] Seq=1 Ack=303 Win=63938 Len=0
15911   4.320911 41.177.26.176 -> 77.197.128.224 TCP 66 http > 33387 [SYN, ACK] Seq=0 Ack=1 Win=64240 Len=0 SACK_PERM=1 MSS=1460
16102   4.402729 41.177.26.176 -> 77.197.128.224 TCP 64 http > 33387 [ACK] Seq=1 Ack=355 Win=63886 Len=0
16105   4.405467 41.177.26.176 -> 77.197.128.155 TCP 66 http > 59921 [SYN, ACK] Seq=0 Ack=1 Win=64240 Len=0 SACK_PERM=1 MSS=1460
16422   4.487146 41.177.26.176 -> 77.197.128.155 TCP 64 http > 59921 [ACK] Seq=1 Ack=319 Win=63922 Len=0
16467   4.495198 41.177.26.176 -> 77.197.128.106 TCP 64 [TCP segment of a reassembled PDU]
16738   4.588155 41.177.26.176 -> 68.188.213.144 TCP 70 http > aeroflight-ads [SYN, ACK] Seq=0 Ack=1 Win=32964 Len=0 WS=2 SACK_PERM=1 MSS=1460
17078   4.825367 41.177.26.176 -> 77.197.128.155 TCP 64 [TCP segment of a reassembled PDU]
17107   4.840027 41.177.26.176 -> 68.188.213.144 TCP 64 http > aeroflight-ads [ACK] Seq=1 Ack=537 Win=65928 Len=0
17137   4.854751 41.177.26.176 -> 68.188.213.144 TCP 64 http > aeroflight-ads [ACK] Seq=1 Ack=807 Win=65928 Len=0
17274   4.942005 41.177.26.176 -> 77.197.128.64 TCP 66 http > 54179 [SYN, ACK] Seq=0 Ack=1 Win=64240 Len=0 SACK_PERM=1 MSS=1460
17393   5.021183 41.177.26.176 -> 77.197.128.64 TCP 64 http > 54179 [ACK] Seq=1 Ack=336 Win=63905 Len=0
17429   5.073948 41.177.26.176 -> 77.197.128.155 TCP 66 http > 60164 [SYN, ACK] Seq=0 Ack=1 Win=64240 Len=0 SACK_PERM=1 MSS=1460
17494   5.156221 41.177.26.176 -> 77.197.128.155 TCP 64 http > 60164 [ACK] Seq=1 Ack=328 Win=63913 Len=0
17558   5.210814 41.177.26.176 -> 77.197.128.142 TCP 66 http > 20372 [SYN, ACK] Seq=0 Ack=1 Win=64240 Len=0 SACK_PERM=1 MSS=1460
17666   5.292541 41.177.26.176 -> 77.197.128.142 TCP 64 http > 20372 [ACK] Seq=1 Ack=319 Win=63922 Len=0
18341   5.804215 41.177.26.176 -> 77.197.128.251 TCP 66 http > 18194 [SYN, ACK] Seq=0 Ack=1 Win=64240 Len=0 SACK_PERM=1 MSS=1460
18528   5.883117 41.177.26.176 -> 77.197.128.251 TCP 64 http > 18194 [ACK] Seq=1 Ack=355 Win=63886 Len=0
18849   6.072726 41.177.26.176 -> 77.197.128.118 TCP 66 http > 55727 [SYN, ACK] Seq=0 Ack=1 Win=64240 Len=0 SACK_PERM=1 MSS=1460
18925   6.154789 41.177.26.176 -> 77.197.128.118 TCP 64 http > 55727 [ACK] Seq=1 Ack=318 Win=63923 Len=0
18991   6.180107 41.177.26.176 -> 77.197.128.155 TCP 66 http > 60585 [SYN, ACK] Seq=0 Ack=1 Win=64240 Len=0 SACK_PERM=1 MSS=1460
19125   6.261887 41.177.26.176 -> 77.197.128.155 TCP 64 http > 60585 [ACK] Seq=1 Ack=318 Win=63923 Len=0
19715   6.484463 41.177.26.176 -> 77.197.128.251 TCP 66 http > 18391 [SYN, ACK] Seq=0 Ack=1 Win=64240 Len=0 SACK_PERM=1 MSS=1460
19881   6.545540 41.177.26.176 -> 77.197.128.118 TCP 64 [TCP segment of a reassembled PDU]
19906   6.553783 41.177.26.176 -> 77.197.128.64 TCP 66 http > 54797 [SYN, ACK] Seq=0 Ack=1 Win=64240 Len=0 SACK_PERM=1 MSS=1460
19942   6.563495 41.177.26.176 -> 77.197.128.251 TCP 64 http > 18391 [ACK] Seq=1 Ack=318 Win=63923 Len=0
20157   6.633179 41.177.26.176 -> 77.197.128.64 TCP 64 http > 54797 [ACK] Seq=1 Ack=355 Win=64240 Len=0
20749   6.866531 41.177.26.176 -> 124.39.24.160 TCP 64 http > 14555 [ACK] Seq=1 Ack=2 Win=32850 Len=0
20835   6.888779 41.177.26.176 -> 77.197.128.155 TCP 66 http > 60737 [SYN, ACK] Seq=0 Ack=1 Win=64240 Len=0 SACK_PERM=1 MSS=1460
20935   6.944654 41.177.26.176 -> 77.197.128.251 TCP 64 [TCP segment of a reassembled PDU]
20962   6.970454 41.177.26.176 -> 77.197.128.155 TCP 64 http > 60737 [ACK] Seq=1 Ack=310 Win=63931 Len=0
21209   7.194894 41.177.26.176 -> 77.197.128.251 TCP 66 http > 18609 [SYN, ACK] Seq=0 Ack=1 Win=64240 Len=0 SACK_PERM=1 MSS=1460
21293   7.273973 41.177.26.176 -> 77.197.128.251 TCP 64 http > 18609 [ACK] Seq=1 Ack=309 Win=63932 Len=0
21802   7.588545 41.177.26.176 -> 15.186.110.142 TCP 82 http > 60701 [SYN, ACK] Seq=0 Ack=1 Win=33304 Len=0 TSval=140342355 TSecr=708520463 WS=2 SACK_PERM=1 MSS=1460
21836   7.602973 41.177.26.176 -> 77.197.128.155 TCP 66 http > 60860 [SYN, ACK] Seq=0 Ack=1 Win=64240 Len=0 SACK_PERM=1 MSS=1460
21920   7.659086 41.177.26.176 -> 15.186.110.142 TCP 70 http > 60701 [ACK] Seq=1 Ack=445 Win=66608 Len=0 TSval=140342362 TSecr=708520533
21972   7.684803 41.177.26.176 -> 77.197.128.155 TCP 64 http > 60860 [ACK] Seq=1 Ack=355 Win=64240 Len=0
22152   7.792394 41.177.26.176 -> 77.197.128.64 TCP 66 http > 55210 [SYN, ACK] Seq=0 Ack=1 Win=64240 Len=0 SACK_PERM=1 MSS=1460
22252   7.871430 41.177.26.176 -> 77.197.128.64 TCP 64 http > 55210 [ACK] Seq=1 Ack=309 Win=63932 Len=0
22266   7.875658 41.177.26.176 -> 77.197.128.251 TCP 66 http > 18813 [SYN, ACK] Seq=0 Ack=1 Win=64240 Len=0 SACK_PERM=1 MSS=1460
22396   7.954854 41.177.26.176 -> 77.197.128.251 TCP 64 http > 18813 [ACK] Seq=1 Ack=318 Win=63923 Len=0
22931   8.293194 41.177.26.176 -> 77.197.128.225 TCP 66 http > 32820 [SYN, ACK] Seq=0 Ack=1 Win=64240 Len=0 SACK_PERM=1 MSS=1460
23058   8.362318 41.177.26.176 -> 77.197.128.155 TCP 66 http > 61068 [SYN, ACK] Seq=0 Ack=1 Win=64240 Len=0 SACK_PERM=1 MSS=1460
23117   8.374862 41.177.26.176 -> 77.197.128.225 TCP 64 http > 32820 [ACK] Seq=1 Ack=322 Win=63919 Len=0
23242   8.444158 41.177.26.176 -> 77.197.128.155 TCP 64 http > 61068 [ACK] Seq=1 Ack=376 Win=63865 Len=0
23439   8.502589 41.177.26.176 -> 77.197.128.251 TCP 66 http > 18999 [SYN, ACK] Seq=0 Ack=1 Win=64240 Len=0 SACK_PERM=1 MSS=1460
23599   8.581646 41.177.26.176 -> 77.197.128.251 TCP 64 http > 18999 [ACK] Seq=1 Ack=318 Win=63923 Len=0
24018   8.788590 41.177.26.176 -> 77.197.128.64 TCP 66 http > 55633 [SYN, ACK] Seq=0 Ack=1 Win=64240 Len=0 SACK_PERM=1 MSS=1460
24078   8.867570 41.177.26.176 -> 77.197.128.64 TCP 64 http > 55633 [ACK] Seq=1 Ack=318 Win=63923 Len=0
24267   9.094899 41.177.26.176 -> 77.197.128.251 TCP 66 http > 19173 [SYN, ACK] Seq=0 Ack=1 Win=64240 Len=0 SACK_PERM=1 MSS=1460
24345   9.173814 41.177.26.176 -> 77.197.128.251 TCP 64 http > 19173 [ACK] Seq=1 Ack=309 Win=63932 Len=0
24371   9.194583 41.177.26.176 -> 77.197.128.64 TCP 64 [TCP segment of a reassembled PDU]
24407   9.209926 41.177.26.176 -> 77.197.128.108 TCP 66 http > 32824 [SYN, ACK] Seq=0 Ack=1 Win=64240 Len=0 SACK_PERM=1 MSS=1460
24529   9.291746 41.177.26.176 -> 77.197.128.108 TCP 64 http > 32824 [ACK] Seq=1 Ack=355 Win=63886 Len=0
24857   9.477669 41.177.26.176 -> 77.197.128.155 TCP 66 http > 61328 [SYN, ACK] Seq=0 Ack=1 Win=64240 Len=0 SACK_PERM=1 MSS=1460
25028   9.559334 41.177.26.176 -> 77.197.128.155 TCP 64 http > 61328 [ACK] Seq=1 Ack=314 Win=63927 Len=0
25164   9.648149 41.177.26.176 -> 77.197.128.64 TCP 66 http > 55885 [SYN, ACK] Seq=0 Ack=1 Win=64240 Len=0 SACK_PERM=1 MSS=1460
25240   9.728588 41.177.26.176 -> 77.197.128.64 TCP 64 http > 55885 [ACK] Seq=1 Ack=305 Win=63936 Len=0
25289   9.741132 41.177.26.176 -> 77.197.128.251 TCP 66 http > 19361 [SYN, ACK] Seq=0 Ack=1 Win=64240 Len=0 SACK_PERM=1 MSS=1460
25427   9.787597 41.177.26.176 -> 68.188.213.144 TCP 64 http > aeroflight-ads [ACK] Seq=5281 Ack=1609 Win=65928 Len=0
25489   9.820247 41.177.26.176 -> 77.197.128.251 TCP 64 http > 19361 [ACK] Seq=1 Ack=309 Win=63932 Len=0
25799  10.015306 41.177.26.176 -> 77.197.128.225 TCP 66 http > 33953 [SYN, ACK] Seq=0 Ack=1 Win=64240 Len=0 SACK_PERM=1 MSS=1460
25938  10.097147 41.177.26.176 -> 77.197.128.225 TCP 64 http > 33953 [ACK] Seq=1 Ack=330 Win=63911 Len=0
26014  10.136295 41.177.26.176 -> 122.39.210.202 TCP 64 http > 48463 [FIN, ACK] Seq=1 Ack=1 Win=64860 Len=0
26106  10.195480 41.177.26.176 -> 77.197.128.251 TCP 75 [TCP segment of a reassembled PDU]
26374  10.341628 41.177.26.176 -> 77.197.128.155 TCP 95 [TCP segment of a reassembled PDU]
26591  10.435004 41.177.26.176 -> 77.197.128.251 TCP 66 http > 19536 [SYN, ACK] Seq=0 Ack=1 Win=64240 Len=0 SACK_PERM=1 MSS=1460
26738  10.513951 41.177.26.176 -> 77.197.128.251 TCP 64 http > 19536 [ACK] Seq=1 Ack=353 Win=63888 Len=0
26754  10.519479 41.177.26.176 -> 77.197.128.155 TCP 66 http > 61589 [SYN, ACK] Seq=0 Ack=1 Win=64240 Len=0 SACK_PERM=1 MSS=1460
26922  10.601284 41.177.26.176 -> 77.197.128.155 TCP 64 http > 61589 [ACK] Seq=1 Ack=309 Win=63932 Len=0
27227  10.737526 41.177.26.176 -> 77.197.128.64 TCP 66 http > 56098 [SYN, ACK] Seq=0 Ack=1 Win=64240 Len=0 SACK_PERM=1 MSS=1460
27370  10.816664 41.177.26.176 -> 77.197.128.64 TCP 64 http > 56098 [ACK] Seq=1 Ack=319 Win=63922 Len=0
27774  11.044582 41.177.26.176 -> 77.197.128.251 TCP 66 http > 19696 [SYN, ACK] Seq=0 Ack=1 Win=64240 Len=0 SACK_PERM=1 MSS=1460
27885  11.123693 41.177.26.176 -> 77.197.128.251 TCP 64 http > 19696 [ACK] Seq=1 Ack=305 Win=63936 Len=0
27930  11.158835 41.177.26.176 -> 77.197.128.155 TCP 66 http > 61672 [SYN, ACK] Seq=0 Ack=1 Win=64240 Len=0 SACK_PERM=1 MSS=1460
27955  11.178097 41.177.26.176 -> 77.197.128.225 TCP 84 [TCP segment of a reassembled PDU]
28000  11.202442 41.177.26.176 -> 77.197.128.64 TCP 64 [TCP segment of a reassembled PDU]
28025  11.240648 41.177.26.176 -> 77.197.128.155 TCP 64 http > 61672 [ACK] Seq=1 Ack=320 Win=63921 Len=0
28187  11.349384 41.177.26.176 -> 15.186.110.142 TCP 87 [TCP segment of a reassembled PDU]
28245  11.392302 41.177.26.176 -> 77.197.128.225 TCP 66 http > 34770 [SYN, ACK] Seq=0 Ack=1 Win=64240 Len=0 SACK_PERM=1 MSS=1460
28443  11.474343 41.177.26.176 -> 77.197.128.225 TCP 64 http > 34770 [ACK] Seq=1 Ack=297 Win=64240 Len=0
28493  11.489024 41.177.26.176 -> 15.186.110.142 TCP 70 http > 60701 [ACK] Seq=11249 Ack=446 Win=66608 Len=0 TSval=140342745 TSecr=708524363
28759  11.674043 41.177.26.176 -> 77.197.128.251 TCP 66 http > 19859 [SYN, ACK] Seq=0 Ack=1 Win=64240 Len=0 SACK_PERM=1 MSS=1460
28901  11.748998 41.177.26.176 -> 77.197.128.64 TCP 66 http > 56355 [SYN, ACK] Seq=0 Ack=1 Win=64240 Len=0 SACK_PERM=1 MSS=1460
28918  11.753015 41.177.26.176 -> 77.197.128.251 TCP 64 http > 19859 [ACK] Seq=1 Ack=308 Win=63933 Len=0
29060  11.808585 41.177.26.176 -> 77.197.128.108 TCP 66 http > 34589 [SYN, ACK] Seq=0 Ack=1 Win=64240 Len=0 SACK_PERM=1 MSS=1460
29082  11.818213 41.177.26.176 -> 77.197.128.118 TCP 66 http > 57573 [SYN, ACK] Seq=0 Ack=1 Win=64240 Len=0 SACK_PERM=1 MSS=1460
29110  11.828443 41.177.26.176 -> 77.197.128.64 TCP 64 http > 56355 [ACK] Seq=1 Ack=302 Win=64240 Len=0
29171  11.890725 41.177.26.176 -> 77.197.128.108 TCP 64 http > 34589 [ACK] Seq=1 Ack=309 Win=63932 Len=0
29201  11.901028 41.177.26.176 -> 77.197.128.118 TCP 64 http > 57573 [ACK] Seq=1 Ack=306 Win=63935 Len=0
29430  12.050155 41.177.26.176 -> 122.39.210.202 TCP 64 http > 48463 [ACK] Seq=2 Ack=2 Win=64860 Len=0
29756  12.266663 41.177.26.176 -> 77.197.128.108 TCP 75 [TCP segment of a reassembled PDU]
29799  12.305257 41.177.26.176 -> 77.197.128.251 TCP 66 http > 20035 [SYN, ACK] Seq=0 Ack=1 Win=64240 Len=0 SACK_PERM=1 MSS=1460
29804  12.310411 41.177.26.176 -> 77.197.128.155 TCP 66 http > 61830 [SYN, ACK] Seq=0 Ack=1 Win=64240 Len=0 SACK_PERM=1 MSS=1460
29846  12.368699 41.177.26.176 -> 124.17.22.71 TCP 66 http > dec-mbadmin-h [SYN, ACK] Seq=0 Ack=1 Win=65340 Len=0 SACK_PERM=1 MSS=1460
29898  12.384254 41.177.26.176 -> 77.197.128.251 TCP 64 http > 20035 [ACK] Seq=1 Ack=308 Win=63933 Len=0
29916  12.392085 41.177.26.176 -> 77.197.128.155 TCP 64 http > 61830 [ACK] Seq=1 Ack=323 Win=63918 Len=0
30129  12.546693 41.177.26.176 -> 124.17.22.71 TCP 64 http > dec-mbadmin-h [ACK] Seq=1 Ack=745 Win=65340 Len=0
30526  12.729173 41.177.26.176 -> 124.17.22.71 TCP 64 http > dec-mbadmin-h [ACK] Seq=734 Ack=1488 Win=65340 Len=0
30557  12.734750 41.177.26.176 -> 124.17.22.71 TCP 64 [TCP segment of a reassembled PDU]
30563  12.734930 41.177.26.176 -> 124.17.22.71 TCP 64 [TCP segment of a reassembled PDU]
30564  12.734934 41.177.26.176 -> 124.17.22.71 TCP 64 [TCP segment of a reassembled PDU]
30913  12.919414 41.177.26.176 -> 77.197.128.251 TCP 66 http > 20198 [SYN, ACK] Seq=0 Ack=1 Win=64240 Len=0 SACK_PERM=1 MSS=1460
31017  12.998478 41.177.26.176 -> 77.197.128.251 TCP 64 http > 20198 [ACK] Seq=1 Ack=316 Win=64240 Len=0
31105  13.059998 41.177.26.176 -> 77.197.128.225 TCP 83 [TCP segment of a reassembled PDU]
31443  13.312213 41.177.26.176 -> 77.197.128.225 TCP 66 http > 35531 [SYN, ACK] Seq=0 Ack=1 Win=64240 Len=0 SACK_PERM=1 MSS=1460
31755  13.389061 41.177.26.176 -> 77.197.128.64 TCP 70 [TCP segment of a reassembled PDU]
31765  13.394066 41.177.26.176 -> 77.197.128.225 TCP 64 http > 35531 [ACK] Seq=1 Ack=336 Win=63905 Len=0
31882  13.455407 41.177.26.176 -> 124.17.22.71 TCP 66 http > fujitsu-mmpdc [SYN, ACK] Seq=0 Ack=1 Win=65340 Len=0 SACK_PERM=1 MSS=1460
31886  13.457234 41.177.26.176 -> 124.17.22.71 TCP 66 http > sixnetudr [SYN, ACK] Seq=0 Ack=1 Win=65340 Len=0 SACK_PERM=1 MSS=1460
31912  13.458622 41.177.26.176 -> 124.17.22.71 TCP 66 http > sg-lm [SYN, ACK] Seq=0 Ack=1 Win=65340 Len=0 SACK_PERM=1 MSS=1460
32122  13.627697 41.177.26.176 -> 124.17.22.71 TCP 64 http > fujitsu-mmpdc [ACK] Seq=1 Ack=696 Win=65340 Len=0
32139  13.643617 41.177.26.176 -> 124.17.22.71 TCP 64 http > sixnetudr [ACK] Seq=1 Ack=695 Win=65340 Len=0
32199  13.657417 41.177.26.176 -> 124.17.22.71 TCP 64 http > sg-lm [ACK] Seq=1 Ack=616 Win=65340 Len=0
32601  13.822280 41.177.26.176 -> 124.17.22.71 TCP 64 http > fujitsu-mmpdc [ACK] Seq=182 Ack=1391 Win=65340 Len=0
32765  13.890182 41.177.26.176 -> 77.197.128.155 TCP 66 http > 62159 [SYN, ACK] Seq=0 Ack=1 Win=64240 Len=0 SACK_PERM=1 MSS=1460
32909  13.971919 41.177.26.176 -> 77.197.128.155 TCP 64 http > 62159 [ACK] Seq=1 Ack=308 Win=63933 Len=0
32973  13.982729 41.177.26.176 -> 77.197.128.64 TCP 66 http > 56907 [SYN, ACK] Seq=0 Ack=1 Win=64240 Len=0 SACK_PERM=1 MSS=1460
33059  13.997850 41.177.26.176 -> 124.17.22.71 TCP 64 http > sixnetudr [ACK] Seq=183 Ack=1388 Win=65340 Len=0
33198  14.061695 41.177.26.176 -> 77.197.128.64 TCP 64 http > 56907 [ACK] Seq=1 Ack=308 Win=63933 Len=0
33465  14.175141 41.177.26.176 -> 124.17.22.71 TCP 64 http > sg-lm [ACK] Seq=3179 Ack=1310 Win=65340 Len=0
33518  14.209694 41.177.26.176 -> 77.197.128.251 TCP 66 http > 20460 [SYN, ACK] Seq=0 Ack=1 Win=64240 Len=0 SACK_PERM=1 MSS=1460
33640  14.288708 41.177.26.176 -> 77.197.128.251 TCP 64 http > 20460 [ACK] Seq=1 Ack=318 Win=63923 Len=0
34107  14.483979 41.177.26.176 -> 77.197.128.225 TCP 66 http > 35891 [SYN, ACK] Seq=0 Ack=1 Win=64240 Len=0 SACK_PERM=1 MSS=1460
34212  14.502806 41.177.26.176 -> 77.197.128.155 TCP 66 http > 62319 [SYN, ACK] Seq=0 Ack=1 Win=64240 Len=0 SACK_PERM=1 MSS=1460
34486  14.565601 41.177.26.176 -> 77.197.128.225 TCP 64 http > 35891 [ACK] Seq=1 Ack=305 Win=63936 Len=0
34589  14.584480 41.177.26.176 -> 77.197.128.155 TCP 64 http > 62319 [ACK] Seq=1 Ack=316 Win=63925 Len=0
35722  14.891727 41.177.26.176 -> 77.197.128.251 TCP 66 http > 20584 [SYN, ACK] Seq=0 Ack=1 Win=64240 Len=0 SACK_PERM=1 MSS=1460
35731  14.898866 41.177.26.176 -> 77.197.128.155 TCP 64 [TCP segment of a reassembled PDU]
35833  14.970764 41.177.26.176 -> 77.197.128.251 TCP 64 http > 20584 [ACK] Seq=1 Ack=329 Win=63912 Len=0
36175  15.085275 41.177.26.176 -> 77.197.128.64 TCP 66 http > 57089 [SYN, ACK] Seq=0 Ack=1 Win=64240 Len=0 SACK_PERM=1 MSS=1460
36443  15.151074 41.177.26.176 -> 77.197.128.155 TCP 66 http > 62535 [SYN, ACK] Seq=0 Ack=1 Win=64240 Len=0 SACK_PERM=1 MSS=1460
36450  15.164232 41.177.26.176 -> 77.197.128.64 TCP 64 http > 57089 [ACK] Seq=1 Ack=309 Win=63932 Len=0
36533  15.232884 41.177.26.176 -> 77.197.128.155 TCP 64 http > 62535 [ACK] Seq=1 Ack=324 Win=63917 Len=0
36568  15.264767 41.177.26.176 -> 77.197.128.225 TCP 66 http > 36188 [SYN, ACK] Seq=0 Ack=1 Win=64240 Len=0 SACK_PERM=1 MSS=1460
36716  15.346462 41.177.26.176 -> 77.197.128.225 TCP 64 http > 36188 [ACK] Seq=1 Ack=318 Win=63923 Len=0
36803  15.373568 41.177.26.176 -> 225.106.194.46 TCP 66 http > 33381 [SYN, ACK] Seq=0 Ack=1 Win=64240 Len=0 SACK_PERM=1 MSS=1460
37040  15.443489 41.177.26.176 -> 225.106.194.46 TCP 64 http > 33381 [ACK] Seq=1 Ack=1186 Win=64240 Len=0
37196  15.513177 41.177.26.176 -> 77.197.128.41 TCP 66 http > 12129 [SYN, ACK] Seq=0 Ack=1 Win=64240 Len=0 SACK_PERM=1 MSS=1460
37446  15.578981 41.177.26.176 -> 225.106.194.46 TCP 66 http > 33309 [SYN, ACK] Seq=0 Ack=1 Win=64240 Len=0 SACK_PERM=1 MSS=1460
37454  15.592217 41.177.26.176 -> 77.197.128.41 TCP 64 http > 12129 [ACK] Seq=1 Ack=355 Win=63886 Len=0
37594  15.643691 41.177.26.176 -> 225.106.194.46 TCP 64 http > 33309 [ACK] Seq=1 Ack=698 Win=64240 Len=0
37656  15.651630 41.177.26.176 -> 225.106.194.46 TCP 64 http > 33381 [ACK] Seq=9678 Ack=1891 Win=64240 Len=0
37660  15.654226 41.177.26.176 -> 77.197.128.225 TCP 64 [TCP segment of a reassembled PDU]
37848  15.746002 41.177.26.176 -> 225.106.194.46 TCP 64 http > 33309 [ACK] Seq=767 Ack=1396 Win=64240 Len=0
38031  15.775014 41.177.26.176 -> 77.197.128.118 TCP 66 http > 58884 [SYN, ACK] Seq=0 Ack=1 Win=64240 Len=0 SACK_PERM=1 MSS=1460
38323  15.856870 41.177.26.176 -> 77.197.128.118 TCP 64 http > 58884 [ACK] Seq=1 Ack=318 Win=63923 Len=0
38413  15.876407 41.177.26.176 -> 77.197.128.225 TCP 66 http > 36411 [SYN, ACK] Seq=0 Ack=1 Win=64240 Len=0 SACK_PERM=1 MSS=1460
38553  15.958109 41.177.26.176 -> 77.197.128.225 TCP 64 http > 36411 [ACK] Seq=1 Ack=301 Win=63940 Len=0
38896  16.086690 41.177.26.176 -> 77.197.128.64 TCP 66 http > 57279 [SYN, ACK] Seq=0 Ack=1 Win=64240 Len=0 SACK_PERM=1 MSS=1460
39068  16.165600 41.177.26.176 -> 77.197.128.64 TCP 64 http > 57279 [ACK] Seq=1 Ack=308 Win=63933 Len=0
39207  16.219218 41.177.26.176 -> 77.197.128.118 TCP 64 [TCP segment of a reassembled PDU]
39381  16.279501 41.177.26.176 -> 77.197.128.225 TCP 75 [TCP segment of a reassembled PDU]
39505  16.375197 41.177.26.176 -> 124.17.22.71 TCP 66 http > netview-aix-1 [SYN, ACK] Seq=0 Ack=1 Win=65340 Len=0 SACK_PERM=1 MSS=1460
39507  16.377235 41.177.26.176 -> 124.17.22.71 TCP 66 http > netview-aix-2 [SYN, ACK] Seq=0 Ack=1 Win=65340 Len=0 SACK_PERM=1 MSS=1460
39589  16.461646 41.177.26.176 -> 77.197.128.64 TCP 72 [TCP segment of a reassembled PDU]
39597  16.469111 41.177.26.176 -> 77.197.128.225 TCP 66 http > 36659 [SYN, ACK] Seq=0 Ack=1 Win=64240 Len=0 SACK_PERM=1 MSS=1460
39825  16.550764 41.177.26.176 -> 77.197.128.225 TCP 64 http > 36659 [ACK] Seq=1 Ack=308 Win=63933 Len=0
39894  16.581786 41.177.26.176 -> 124.17.22.71 TCP 64 http > netview-aix-1 [ACK] Seq=1 Ack=709 Win=65340 Len=0
39942  16.595450 41.177.26.176 -> 124.17.22.71 TCP 64 http > netview-aix-2 [ACK] Seq=1 Ack=710 Win=65340 Len=0
40079  16.688454 41.177.26.176 -> 77.197.128.251 TCP 66 http > 20981 [SYN, ACK] Seq=0 Ack=1 Win=64240 Len=0 SACK_PERM=1 MSS=1460
40168  16.767347 41.177.26.176 -> 77.197.128.251 TCP 64 http > 20981 [ACK] Seq=1 Ack=356 Win=63885 Len=0
40211  16.814170 41.177.26.176 -> 124.17.22.71 TCP 64 http > netview-aix-1 [ACK] Seq=183 Ack=1416 Win=65340 Len=0
40238  16.828342 41.177.26.176 -> 124.17.22.71 TCP 64 http > netview-aix-2 [ACK] Seq=183 Ack=1333 Win=65340 Len=0
40384  16.910731 41.177.26.176 -> 77.197.128.64 TCP 66 http > 57474 [SYN, ACK] Seq=0 Ack=1 Win=64240 Len=0 SACK_PERM=1 MSS=1460
40405  16.926923 41.177.26.176 -> 77.197.128.155 TCP 66 http > 63078 [SYN, ACK] Seq=0 Ack=1 Win=64240 Len=0 SACK_PERM=1 MSS=1460
40500  16.989867 41.177.26.176 -> 77.197.128.64 TCP 64 http > 57474 [ACK] Seq=1 Ack=309 Win=63932 Len=0
40531  17.008495 41.177.26.176 -> 77.197.128.155 TCP 64 http > 63078 [ACK] Seq=1 Ack=318 Win=63923 Len=0
40937  17.105038 41.177.26.176 -> 41.177.43.100 TCP 66 http > opcua-tls [SYN, ACK] Seq=0 Ack=1 Win=65520 Len=0 SACK_PERM=1 MSS=1460
40943  17.106325 41.177.26.176 -> 41.177.43.100 TCP 64 http > opcua-tls [ACK] Seq=1 Ack=537 Win=65520 Len=0
40944  17.106412 41.177.26.176 -> 41.177.43.100 TCP 64 http > opcua-tls [ACK] Seq=1 Ack=778 Win=65520 Len=0
40965  17.111484 41.177.26.176 -> 41.177.43.100 TCP 64 http > opcua-tls [ACK] Seq=672 Ack=1556 Win=65520 Len=0
41353  17.265455 41.177.26.176 -> 77.197.128.225 TCP 66 http > 37069 [SYN, ACK] Seq=0 Ack=1 Win=64240 Len=0 SACK_PERM=1 MSS=1460
41599  17.347230 41.177.26.176 -> 77.197.128.225 TCP 64 http > 37069 [ACK] Seq=1 Ack=316 Win=63925 Len=0
41665  17.370254 41.177.26.176 -> 77.197.128.251 TCP 66 http > 21104 [SYN, ACK] Seq=0 Ack=1 Win=64240 Len=0 SACK_PERM=1 MSS=1460
41940  17.449154 41.177.26.176 -> 77.197.128.251 TCP 64 http > 21104 [ACK] Seq=1 Ack=355 Win=63886 Len=0
42083  17.496133 41.177.26.176 -> 77.197.128.155 TCP 66 http > 63292 [SYN, ACK] Seq=0 Ack=1 Win=64240 Len=0 SACK_PERM=1 MSS=1460
42192  17.561608 41.177.26.176 -> 151.77.127.218 TCP 82 http > 51731 [SYN, ACK] Seq=0 Ack=1 Win=33304 Len=0 TSval=140343352 TSecr=842414578 WS=2 SACK_PERM=1 MSS=1460
42195  17.569973 41.177.26.176 -> 151.77.127.218 TCP 70 http > 51731 [ACK] Seq=1 Ack=806 Win=66608 Len=0 TSval=140343353 TSecr=842414578
42201  17.577817 41.177.26.176 -> 77.197.128.155 TCP 64 http > 63292 [ACK] Seq=1 Ack=305 Win=63936 Len=0
42545  17.917297 41.177.26.176 -> 77.197.128.64 TCP 66 http > 57718 [SYN, ACK] Seq=0 Ack=1 Win=64240 Len=0 SACK_PERM=1 MSS=1460
42688  17.996140 41.177.26.176 -> 77.197.128.64 TCP 64 http > 57718 [ACK] Seq=1 Ack=318 Win=63923 Len=0
42820  18.093316 41.177.26.176 -> 77.197.128.225 TCP 66 http > 37456 [SYN, ACK] Seq=0 Ack=1 Win=64240 Len=0 SACK_PERM=1 MSS=1460
42875  18.117002 41.177.26.176 -> 77.197.128.251 TCP 66 http > 21233 [SYN, ACK] Seq=0 Ack=1 Win=64240 Len=0 SACK_PERM=1 MSS=1460
42899  18.142809 41.177.26.176 -> 77.197.128.155 TCP 66 http > 63547 [SYN, ACK] Seq=0 Ack=1 Win=64240 Len=0 SACK_PERM=1 MSS=1460
42936  18.175087 41.177.26.176 -> 77.197.128.225 TCP 64 http > 37456 [ACK] Seq=1 Ack=317 Win=63924 Len=0
42967  18.196099 41.177.26.176 -> 77.197.128.251 TCP 64 http > 21233 [ACK] Seq=1 Ack=309 Win=63932 Len=0
42998  18.224651 41.177.26.176 -> 77.197.128.155 TCP 64 http > 63547 [ACK] Seq=1 Ack=353 Win=63888 Len=0
43293  18.388897 41.177.26.176 -> 151.77.127.218 TCP 70 http > 51731 [ACK] Seq=20225 Ack=1584 Win=66608 Len=0 TSval=140343435 TSecr=842414586
43711  18.510104 41.177.26.176 -> 77.197.128.118 TCP 66 http > 59735 [SYN, ACK] Seq=0 Ack=1 Win=64240 Len=0 SACK_PERM=1 MSS=1460
43957  18.592164 41.177.26.176 -> 77.197.128.118 TCP 64 http > 59735 [ACK] Seq=1 Ack=319 Win=64240 Len=0
44174  18.651616 41.177.26.176 -> 41.177.43.100 TCP 77 [TCP segment of a reassembled PDU]
44196  18.662374 41.177.26.176 -> 41.177.43.100 TCP 66 http > gw-log [SYN, ACK] Seq=0 Ack=1 Win=65520 Len=0 SACK_PERM=1 MSS=1460
44207  18.673478 41.177.26.176 -> 41.177.43.100 TCP 64 [TCP segment of a reassembled PDU]
44243  18.693398 41.177.26.176 -> 41.177.43.100 TCP 64 http > gw-log [ACK] Seq=1 Ack=537 Win=65520 Len=0
44244  18.693470 41.177.26.176 -> 41.177.43.100 TCP 64 http > gw-log [ACK] Seq=1 Ack=858 Win=65520 Len=0
44247  18.694686 41.177.26.176 -> 41.177.43.100 TCP 64 http > opcua-tls [ACK] Seq=8256 Ack=2493 Win=65520 Len=0
44252  18.695492 41.177.26.176 -> 41.177.43.100 TCP 66 http > wcr-remlib [SYN, ACK] Seq=0 Ack=1 Win=65520 Len=0 SACK_PERM=1 MSS=1460
44255  18.695817 41.177.26.176 -> 41.177.43.100 TCP 66 http > contamac-icm [SYN, ACK] Seq=0 Ack=1 Win=65520 Len=0 SACK_PERM=1 MSS=1460
44263  18.696895 41.177.26.176 -> 41.177.43.100 TCP 66 http > wfc [SYN, ACK] Seq=0 Ack=1 Win=65520 Len=0 SACK_PERM=1 MSS=1460
44274  18.698422 41.177.26.176 -> 41.177.43.100 TCP 78 [TCP segment of a reassembled PDU]
44276  18.698741 41.177.26.176 -> 41.177.43.100 TCP 66 http > appserv-http [SYN, ACK] Seq=0 Ack=1 Win=65520 Len=0 SACK_PERM=1 MSS=1460
44281  18.699901 41.177.26.176 -> 41.177.43.100 TCP 64 http > wcr-remlib [ACK] Seq=1 Ack=537 Win=65520 Len=0
44282  18.699967 41.177.26.176 -> 41.177.43.100 TCP 64 http > wcr-remlib [ACK] Seq=1 Ack=840 Win=65520 Len=0
44285  18.700563 41.177.26.176 -> 41.177.43.100 TCP 64 http > contamac-icm [ACK] Seq=1 Ack=537 Win=65520 Len=0
44286  18.700625 41.177.26.176 -> 41.177.43.100 TCP 64 http > contamac-icm [ACK] Seq=1 Ack=835 Win=65520 Len=0
44289  18.701328 41.177.26.176 -> 41.177.43.100 TCP 64 http > wfc [ACK] Seq=1 Ack=537 Win=65520 Len=0
44290  18.701389 41.177.26.176 -> 41.177.43.100 TCP 64 http > wfc [ACK] Seq=1 Ack=833 Win=65520 Len=0
44294  18.702076 41.177.26.176 -> 41.177.43.100 TCP 64 http > gw-log [ACK] Seq=7866 Ack=1711 Win=65520 Len=0
44298  18.702633 41.177.26.176 -> 41.177.43.100 TCP 64 http > appserv-http [ACK] Seq=1 Ack=537 Win=65520 Len=0
44299  18.702706 41.177.26.176 -> 41.177.43.100 TCP 64 http > appserv-http [ACK] Seq=1 Ack=805 Win=65520 Len=0
44325  18.705867 41.177.26.176 -> 41.177.43.100 TCP 64 http > gw-log [ACK] Seq=8192 Ack=2577 Win=65520 Len=0
44339  18.707811 41.177.26.176 -> 41.177.43.100 TCP 64 http > contamac-icm [ACK] Seq=2026 Ack=1695 Win=65520 Len=0
44345  18.708430 41.177.26.176 -> 41.177.43.100 TCP 64 http > wcr-remlib [ACK] Seq=10378 Ack=1701 Win=65520 Len=0
44366  18.709460 41.177.26.176 -> 41.177.43.100 TCP 64 http > gw-log [ACK] Seq=9855 Ack=3439 Win=65520 Len=0
44465  18.715997 41.177.26.176 -> 41.177.43.100 TCP 64 http > wcr-remlib [ACK] Seq=27293 Ack=2556 Win=65520 Len=0
44486  18.716902 41.177.26.176 -> 41.177.43.100 TCP 64 http > gw-log [ACK] Seq=26668 Ack=4307 Win=65520 Len=0
44569  18.738950 41.177.26.176 -> 41.177.43.100 TCP 64 http > contamac-icm [ACK] Seq=18178 Ack=2571 Win=65520 Len=0
44812  18.790171 41.177.26.176 -> 77.197.128.251 TCP 66 http > 21392 [SYN, ACK] Seq=0 Ack=1 Win=64240 Len=0 SACK_PERM=1 MSS=1460
44853  18.799464 41.177.26.176 -> 77.197.128.155 TCP 66 http > 63741 [SYN, ACK] Seq=0 Ack=1 Win=64240 Len=0 SACK_PERM=1 MSS=1460
44870  18.803018 41.177.26.176 -> 151.77.127.218 TCP 82 http > 51732 [SYN, ACK] Seq=0 Ack=1 Win=33304 Len=0 TSval=140343476 TSecr=842414591 WS=2 SACK_PERM=1 MSS=1460
44886  18.809381 41.177.26.176 -> 41.177.43.100 TCP 64 http > wfc [ACK] Seq=6216 Ack=1744 Win=65520 Len=0
44887  18.809543 41.177.26.176 -> 151.77.127.218 TCP 70 http > 51732 [ACK] Seq=1 Ack=790 Win=66608 Len=0 TSval=140343477 TSecr=842414591
44895  18.810628 41.177.26.176 -> 41.177.43.100 TCP 64 http > appserv-http [ACK] Seq=502 Ack=1714 Win=65520 Len=0
44969  18.824372 41.177.26.176 -> 41.177.43.100 TCP 64 http > wcr-remlib [ACK] Seq=36265 Ack=3422 Win=65520 Len=0
44986  18.829776 41.177.26.176 -> 41.177.43.100 TCP 64 http > gw-log [ACK] Seq=49370 Ack=5172 Win=65520 Len=0
45081  18.869184 41.177.26.176 -> 77.197.128.251 TCP 64 http > 21392 [ACK] Seq=1 Ack=318 Win=63923 Len=0
45156  18.881175 41.177.26.176 -> 77.197.128.155 TCP 64 http > 63741 [ACK] Seq=1 Ack=301 Win=63940 Len=0
45193  18.901506 41.177.26.176 -> 77.197.128.225 TCP 66 http > 37931 [SYN, ACK] Seq=0 Ack=1 Win=64240 Len=0 SACK_PERM=1 MSS=1460
45274  18.934946 41.177.26.176 -> 77.197.128.64 TCP 66 http > 57917 [SYN, ACK] Seq=0 Ack=1 Win=64240 Len=0 SACK_PERM=1 MSS=1460
45280  18.950714 41.177.26.176 -> 77.197.128.118 TCP 64 [TCP segment of a reassembled PDU]
45334  18.983344 41.177.26.176 -> 77.197.128.225 TCP 64 http > 37931 [ACK] Seq=1 Ack=356 Win=63885 Len=0
45413  19.013886 41.177.26.176 -> 77.197.128.64 TCP 64 http > 57917 [ACK] Seq=1 Ack=318 Win=63923 Len=0
45730  19.180008 41.177.26.176 -> 151.77.127.218 TCP 70 http > 51732 [ACK] Seq=721 Ack=1574 Win=66608 Len=0 TSval=140343514 TSecr=842414594
45740  19.184471 41.177.26.176 -> 77.197.128.155 TCP 75 [TCP segment of a reassembled PDU]
45836  19.207083 41.177.26.176 -> 151.77.127.218 TCP 82 http > 51733 [SYN, ACK] Seq=0 Ack=1 Win=33304 Len=0 TSval=140343517 TSecr=842414595 WS=2 SACK_PERM=1 MSS=1460
45941  19.224365 41.177.26.176 -> 151.77.127.218 TCP 82 http > 51734 [SYN, ACK] Seq=0 Ack=1 Win=33304 Len=0 TSval=140343518 TSecr=842414595 WS=2 SACK_PERM=1 MSS=1460
45982  19.238776 41.177.26.176 -> 151.77.127.218 TCP 70 http > 51733 [ACK] Seq=1 Ack=793 Win=66608 Len=0 TSval=140343520 TSecr=842414595
45989  19.245529 41.177.26.176 -> 151.77.127.218 TCP 70 http > 51734 [ACK] Seq=1 Ack=788 Win=65820 Len=0 TSval=140343520 TSecr=842414595
45998  19.257624 41.177.26.176 -> 151.77.127.218 TCP 70 http > 51733 [ACK] Seq=415 Ack=1588 Win=66608 Len=0 TSval=140343522 TSecr=842414595
46372  19.365849 41.177.26.176 -> 151.77.127.218 TCP 70 http > 51734 [ACK] Seq=621 Ack=1572 Win=66608 Len=0 TSval=140343532 TSecr=842414596
46449  19.390564 41.177.26.176 -> 77.197.128.64 TCP 64 [TCP segment of a reassembled PDU]
46774  19.448628 41.177.26.176 -> 77.197.128.155 TCP 66 http > 63899 [SYN, ACK] Seq=0 Ack=1 Win=64240 Len=0 SACK_PERM=1 MSS=1460
46967  19.493959 41.177.26.176 -> 77.197.128.251 TCP 66 http > 21540 [SYN, ACK] Seq=0 Ack=1 Win=64240 Len=0 SACK_PERM=1 MSS=1460
47241  19.530248 41.177.26.176 -> 77.197.128.155 TCP 64 http > 63899 [ACK] Seq=1 Ack=318 Win=63923 Len=0
47324  19.573030 41.177.26.176 -> 77.197.128.251 TCP 64 http > 21540 [ACK] Seq=1 Ack=311 Win=63930 Len=0
47498  19.604901 41.177.26.176 -> 79.108.231.127 TCP 70 http > 55814 [SYN, ACK] Seq=0 Ack=1 Win=32850 Len=0 WS=2 SACK_PERM=1 MSS=1460
47810  19.687942 41.177.26.176 -> 77.197.128.225 TCP 66 http > 38390 [SYN, ACK] Seq=0 Ack=1 Win=64240 Len=0 SACK_PERM=1 MSS=1460
48131  19.769802 41.177.26.176 -> 77.197.128.225 TCP 64 http > 38390 [ACK] Seq=1 Ack=309 Win=63932 Len=0
49042  19.944042 41.177.26.176 -> 77.197.128.64 TCP 66 http > 58066 [SYN, ACK] Seq=0 Ack=1 Win=64240 Len=0 SACK_PERM=1 MSS=1460
49255  20.023123 41.177.26.176 -> 77.197.128.64 TCP 64 http > 58066 [ACK] Seq=1 Ack=356 Win=63885 Len=0
49396  20.079960 41.177.26.176 -> 79.108.231.127 TCP 64 http > 55814 [ACK] Seq=1 Ack=2 Win=65700 Len=0
49397  20.081384 41.177.26.176 -> 79.108.231.127 TCP 64 http > 55814 [FIN, ACK] Seq=1 Ack=2 Win=65700 Len=0
49581  20.134211 41.177.26.176 -> 77.197.128.155 TCP 66 http > 64151 [SYN, ACK] Seq=0 Ack=1 Win=64240 Len=0 SACK_PERM=1 MSS=1460
49789  20.216007 41.177.26.176 -> 77.197.128.155 TCP 64 http > 64151 [ACK] Seq=1 Ack=368 Win=63873 Len=0
49811  20.221328 41.177.26.176 -> 15.186.110.142 TCP 82 http > 33390 [SYN, ACK] Seq=0 Ack=1 Win=33304 Len=0 TSval=140343618 TSecr=708533096 WS=2 SACK_PERM=1 MSS=1460
49971  20.290088 41.177.26.176 -> 15.186.110.142 TCP 70 http > 33390 [ACK] Seq=1 Ack=504 Win=66104 Len=0 TSval=140343625 TSecr=708533165
50446  20.530286 41.177.26.176 -> 77.197.128.225 TCP 66 http > 38905 [SYN, ACK] Seq=0 Ack=1 Win=64240 Len=0 SACK_PERM=1 MSS=1460
50573  20.613021 41.177.26.176 -> 77.197.128.225 TCP 64 http > 38905 [ACK] Seq=1 Ack=308 Win=64240 Len=0
50926  20.894075 41.177.26.176 -> 77.197.128.225 TCP 72 [TCP segment of a reassembled PDU]
50931  20.902562 41.177.26.176 -> 77.197.128.118 TCP 66 http > 60626 [SYN, ACK] Seq=0 Ack=1 Win=64240 Len=0 SACK_PERM=1 MSS=1460
51111  20.984397 41.177.26.176 -> 77.197.128.118 TCP 64 http > 60626 [ACK] Seq=1 Ack=318 Win=63923 Len=0
51513  21.158981 41.177.26.176 -> 77.197.128.64 TCP 66 http > 58244 [SYN, ACK] Seq=0 Ack=1 Win=64240 Len=0 SACK_PERM=1 MSS=1460
51600  21.208234 41.177.26.176 -> 15.186.110.142 TCP 70 http > 33390 [ACK] Seq=10191 Ack=505 Win=66608 Len=0 TSval=140343717 TSecr=708534083
51664  21.238059 41.177.26.176 -> 77.197.128.64 TCP 64 http > 58244 [ACK] Seq=1 Ack=310 Win=64240 Len=0
51719  21.281401 41.177.26.176 -> 77.197.128.251 TCP 66 http > 21902 [SYN, ACK] Seq=0 Ack=1 Win=64240 Len=0 SACK_PERM=1 MSS=1460
51739  21.298315 41.177.26.176 -> 77.197.128.225 TCP 66 http > 39325 [SYN, ACK] Seq=0 Ack=1 Win=64240 Len=0 SACK_PERM=1 MSS=1460
51871  21.360738 41.177.26.176 -> 77.197.128.251 TCP 64 http > 21902 [ACK] Seq=1 Ack=309 Win=63932 Len=0
51910  21.380055 41.177.26.176 -> 77.197.128.225 TCP 64 http > 39325 [ACK] Seq=1 Ack=341 Win=63900 Len=0
52643  21.896968 41.177.26.176 -> 77.197.128.251 TCP 66 http > 22057 [SYN, ACK] Seq=0 Ack=1 Win=64240 Len=0 SACK_PERM=1 MSS=1460
52734  21.976129 41.177.26.176 -> 77.197.128.251 TCP 64 http > 22057 [ACK] Seq=1 Ack=318 Win=63923 Len=0
53321  22.170967 41.177.26.176 -> 77.197.127.128 TCP 66 http > 61598 [SYN, ACK] Seq=0 Ack=1 Win=64240 Len=0 SACK_PERM=1 MSS=1460
53707  22.232748 41.177.26.176 -> 77.197.127.128 TCP 64 http > 61598 [ACK] Seq=1 Ack=309 Win=63932 Len=0
54123  22.385634 41.177.26.176 -> 77.197.128.64 TCP 66 http > 58445 [SYN, ACK] Seq=0 Ack=1 Win=64240 Len=0 SACK_PERM=1 MSS=1460
54224  22.464568 41.177.26.176 -> 77.197.128.64 TCP 64 http > 58445 [ACK] Seq=1 Ack=308 Win=63933 Len=0
54261  22.492129 41.177.26.176 -> 151.77.127.218 TCP 70 http > 51731 [ACK] Seq=74371 Ack=9524 Win=66608 Len=0 TSval=140343845 TSecr=842414627
54262  22.492488 41.177.26.176 -> 151.77.127.218 TCP 70 http > 51731 [FIN, ACK] Seq=74371 Ack=9524 Win=66608 Len=0 TSval=140343845 TSecr=842414627
54296  22.496833 41.177.26.176 -> 151.77.127.218 TCP 70 http > 51732 [ACK] Seq=5916 Ack=4734 Win=66608 Len=0 TSval=140343846 TSecr=842414627
54297  22.497257 41.177.26.176 -> 151.77.127.218 TCP 70 http > 51732 [FIN, ACK] Seq=5916 Ack=4734 Win=66608 Len=0 TSval=140343846 TSecr=842414627
54303  22.501176 41.177.26.176 -> 151.77.127.218 TCP 70 http > 51734 [ACK] Seq=2738 Ack=3949 Win=66608 Len=0 TSval=140343846 TSecr=842414628
54304  22.501522 41.177.26.176 -> 151.77.127.218 TCP 70 http > 51734 [FIN, ACK] Seq=2738 Ack=3949 Win=66608 Len=0 TSval=140343846 TSecr=842414628
54308  22.504776 41.177.26.176 -> 151.77.127.218 TCP 70 http > 51733 [ACK] Seq=4894 Ack=3961 Win=66608 Len=0 TSval=140343846 TSecr=842414628
54309  22.505003 41.177.26.176 -> 151.77.127.218 TCP 70 http > 51733 [FIN, ACK] Seq=4894 Ack=3961 Win=66608 Len=0 TSval=140343846 TSecr=842414628
54344  22.527108 41.177.26.176 -> 77.197.128.225 TCP 66 http > 39942 [SYN, ACK] Seq=0 Ack=1 Win=64240 Len=0 SACK_PERM=1 MSS=1460
54378  22.537173 41.177.26.176 -> 77.197.128.251 TCP 66 http > 22203 [SYN, ACK] Seq=0 Ack=1 Win=64240 Len=0 SACK_PERM=1 MSS=1460
54494  22.572289 41.177.26.176 -> 77.197.127.128 TCP 75 [TCP segment of a reassembled PDU]
54597  22.612032 41.177.26.176 -> 77.197.128.225 TCP 64 http > 39942 [ACK] Seq=1 Ack=318 Win=64240 Len=0
54611  22.616096 41.177.26.176 -> 77.197.128.251 TCP 64 http > 22203 [ACK] Seq=1 Ack=345 Win=63896 Len=0
55008  22.740035 41.177.26.176 -> 77.197.128.64 TCP 72 [TCP segment of a reassembled PDU]
