1020905 344.359423 41.177.157.141 -> 41.177.157.214 TCP 84 gw > 29246 [PSH, ACK] Seq=1 Ack=1 Win=5840 Len=26
1020906 344.359428 41.177.157.141 -> 41.177.157.214 TCP 84 [TCP Retransmission] gw > 29246 [PSH, ACK] Seq=1 Ack=1 Win=5840 Len=26
1020948 344.399595 41.177.157.141 -> 41.177.157.214 TCP 65 gw > 29246 [PSH, ACK] Seq=27 Ack=1 Win=5840 Len=7
1021311 344.679332 41.177.157.141 -> 41.177.157.214 TCP 80 gw > 29246 [PSH, ACK] Seq=34 Ack=1 Win=5840 Len=22
1021347 344.719341 41.177.157.141 -> 41.177.157.214 TCP 69 gw > 29246 [PSH, ACK] Seq=56 Ack=1 Win=5840 Len=11
