754544 242.371571 41.177.75.120 -> 41.177.98.220 TCP 178 qotps > ups-onlinet [PSH, ACK] Seq=1 Ack=1 Win=65535 Len=120
755341 242.829748 41.177.75.120 -> 41.177.98.220 TCP 64 qotps > ups-onlinet [ACK] Seq=121 Ack=843 Win=65535 Len=0
794789 258.920946 41.177.75.120 -> 41.177.98.220 TCP 132 qotps > ups-onlinet [PSH, ACK] Seq=121 Ack=843 Win=65535 Len=74
795164 259.098004 41.177.75.120 -> 41.177.98.220 TCP 132 qotps > ups-onlinet [PSH, ACK] Seq=195 Ack=1957 Win=65535 Len=74
795483 259.209871 41.177.75.120 -> 41.177.98.220 TCP 131 qotps > ups-onlinet [PSH, ACK] Seq=269 Ack=3038 Win=65535 Len=73
795745 259.354390 41.177.75.120 -> 41.177.98.220 TCP 131 qotps > ups-onlinet [PSH, ACK] Seq=342 Ack=3966 Win=65535 Len=73
796073 259.564097 41.177.75.120 -> 41.177.98.220 TCP 64 qotps > ups-onlinet [ACK] Seq=415 Ack=4991 Win=65535 Len=0
810268 264.163534 41.177.75.120 -> 41.177.98.220 TCP 135 qotps > ups-onlinet [PSH, ACK] Seq=415 Ack=4991 Win=65535 Len=77
810758 264.376543 41.177.75.120 -> 41.177.98.220 TCP 64 qotps > ups-onlinet [ACK] Seq=492 Ack=5325 Win=65201 Len=0
894877 296.108207 41.177.75.120 -> 41.177.98.220 TCP 135 qotps > ups-onlinet [PSH, ACK] Seq=492 Ack=5325 Win=65201 Len=77
895089 296.130854 41.177.75.120 -> 41.177.98.220 TCP 132 qotps > ups-onlinet [PSH, ACK] Seq=569 Ack=5459 Win=65067 Len=74
895447 296.223579 41.177.75.120 -> 41.177.98.220 TCP 129 qotps > ups-onlinet [PSH, ACK] Seq=643 Ack=5953 Win=65535 Len=71
896113 296.423154 41.177.75.120 -> 41.177.98.220 TCP 64 qotps > ups-onlinet [ACK] Seq=714 Ack=6215 Win=65273 Len=0
915242 303.484253 41.177.75.120 -> 41.177.98.220 TCP 136 qotps > ups-onlinet [PSH, ACK] Seq=714 Ack=6215 Win=65273 Len=78
915257 303.500885 41.177.75.120 -> 41.177.98.220 TCP 133 qotps > ups-onlinet [PSH, ACK] Seq=792 Ack=6354 Win=65134 Len=75
915383 303.590927 41.177.75.120 -> 41.177.98.220 TCP 130 qotps > ups-onlinet [PSH, ACK] Seq=867 Ack=6862 Win=65535 Len=72
915559 303.751184 41.177.75.120 -> 41.177.98.220 TCP 64 qotps > ups-onlinet [ACK] Seq=939 Ack=7127 Win=65270 Len=0
930935 310.188379 41.177.75.120 -> 41.177.98.220 TCP 136 qotps > ups-onlinet [PSH, ACK] Seq=939 Ack=7127 Win=65270 Len=78
930981 310.203520 41.177.75.120 -> 41.177.98.220 TCP 133 qotps > ups-onlinet [PSH, ACK] Seq=1017 Ack=7254 Win=65143 Len=75
931329 310.323592 41.177.75.120 -> 41.177.98.220 TCP 130 qotps > ups-onlinet [PSH, ACK] Seq=1092 Ack=7827 Win=65535 Len=72
932123 310.532381 41.177.75.120 -> 41.177.98.220 TCP 64 qotps > ups-onlinet [ACK] Seq=1164 Ack=8080 Win=65282 Len=0
986413 329.246347 41.177.75.120 -> 41.177.98.176 TCP 66 lotusmtap > http [SYN] Seq=0 Win=65535 Len=0 MSS=1380 SACK_PERM=1
986422 329.246920 41.177.75.120 -> 41.177.98.176 TCP 64 lotusmtap > http [ACK] Seq=1 Ack=1 Win=65535 Len=0
992197 331.075624 41.177.75.120 -> 41.177.98.176 TCP 64 lotusmtap > http [ACK] Seq=796 Ack=2761 Win=65535 Len=0
992198 331.075629 41.177.75.120 -> 41.177.98.176 TCP 64 lotusmtap > http [ACK] Seq=796 Ack=4141 Win=65535 Len=0
992204 331.077812 41.177.75.120 -> 41.177.98.176 TCP 64 lotusmtap > http [ACK] Seq=796 Ack=6715 Win=65535 Len=0
992205 331.077884 41.177.75.120 -> 41.177.98.176 TCP 64 lotusmtap > http [ACK] Seq=796 Ack=9475 Win=65535 Len=0
992214 331.080745 41.177.75.120 -> 41.177.98.176 TCP 64 lotusmtap > http [ACK] Seq=796 Ack=11843 Win=65535 Len=0
992215 331.080889 41.177.75.120 -> 41.177.98.176 TCP 64 lotusmtap > http [ACK] Seq=796 Ack=14603 Win=65535 Len=0
992227 331.083682 41.177.75.120 -> 41.177.98.176 TCP 64 lotusmtap > http [ACK] Seq=796 Ack=16971 Win=65535 Len=0
992228 331.083800 41.177.75.120 -> 41.177.98.176 TCP 64 lotusmtap > http [ACK] Seq=796 Ack=19731 Win=65535 Len=0
992231 331.085623 41.177.75.120 -> 41.177.98.176 TCP 64 lotusmtap > http [ACK] Seq=796 Ack=21158 Win=65535 Len=0
992237 331.088643 41.177.75.120 -> 41.177.98.176 TCP 66 midnight-tech > http [SYN] Seq=0 Win=65535 Len=0 MSS=1380 SACK_PERM=1
992239 331.088829 41.177.75.120 -> 41.177.98.176 TCP 66 pxc-ntfy > http [SYN] Seq=0 Win=65535 Len=0 MSS=1380 SACK_PERM=1
992241 331.089152 41.177.75.120 -> 41.177.98.176 TCP 64 midnight-tech > http [ACK] Seq=1 Ack=1 Win=65535 Len=0
992254 331.089850 41.177.75.120 -> 41.177.98.176 TCP 64 pxc-ntfy > http [ACK] Seq=1 Ack=1 Win=65535 Len=0
992266 331.094645 41.177.75.120 -> 41.177.98.176 TCP 64 midnight-tech > http [ACK] Seq=766 Ack=2761 Win=65535 Len=0
992267 331.094815 41.177.75.120 -> 41.177.98.176 TCP 64 midnight-tech > http [ACK] Seq=766 Ack=4141 Win=65535 Len=0
992337 331.154283 41.177.75.120 -> 41.177.98.176 TCP 64 pxc-ntfy > http [ACK] Seq=1513 Ack=2409 Win=65535 Len=0
992338 331.154288 41.177.75.120 -> 41.177.98.176 TCP 64 pxc-ntfy > http [ACK] Seq=1513 Ack=5169 Win=65535 Len=0
992345 331.155627 41.177.75.120 -> 41.177.98.176 TCP 64 pxc-ntfy > http [ACK] Seq=1513 Ack=7929 Win=65535 Len=0
992352 331.156269 41.177.75.120 -> 41.177.98.176 TCP 64 pxc-ntfy > http [ACK] Seq=1513 Ack=9309 Win=65535 Len=0
992355 331.156282 41.177.75.120 -> 41.177.98.176 TCP 64 pxc-ntfy > http [ACK] Seq=1513 Ack=12069 Win=65535 Len=0
992356 331.156286 41.177.75.120 -> 41.177.98.176 TCP 64 pxc-ntfy > http [ACK] Seq=1513 Ack=13449 Win=65535 Len=0
992367 331.157150 41.177.75.120 -> 41.177.98.176 TCP 64 pxc-ntfy > http [ACK] Seq=1513 Ack=16209 Win=65535 Len=0
992372 331.157760 41.177.75.120 -> 41.177.98.176 TCP 64 pxc-ntfy > http [ACK] Seq=1513 Ack=17589 Win=65535 Len=0
992376 331.159217 41.177.75.120 -> 41.177.98.176 TCP 64 pxc-ntfy > http [ACK] Seq=1513 Ack=20349 Win=65535 Len=0
992377 331.159431 41.177.75.120 -> 41.177.98.176 TCP 64 pxc-ntfy > http [ACK] Seq=1513 Ack=23109 Win=65535 Len=0
992378 331.159436 41.177.75.120 -> 41.177.98.176 TCP 64 pxc-ntfy > http [ACK] Seq=1513 Ack=24489 Win=65535 Len=0
992379 331.159440 41.177.75.120 -> 41.177.98.176 TCP 64 pxc-ntfy > http [ACK] Seq=1513 Ack=27249 Win=65535 Len=0
992380 331.159444 41.177.75.120 -> 41.177.98.176 TCP 64 pxc-ntfy > http [ACK] Seq=1513 Ack=30009 Win=62775 Len=0
992382 331.159468 41.177.75.120 -> 41.177.98.176 TCP 64 pxc-ntfy > http [ACK] Seq=1513 Ack=32769 Win=60015 Len=0
992386 331.159917 41.177.75.120 -> 41.177.98.176 TCP 64 pxc-ntfy > http [ACK] Seq=1513 Ack=34149 Win=62395 Len=0
992392 331.160504 41.177.75.120 -> 41.177.98.176 TCP 64 pxc-ntfy > http [ACK] Seq=1513 Ack=35529 Win=64775 Len=0
992393 331.160509 41.177.75.120 -> 41.177.98.176 TCP 64 pxc-ntfy > http [ACK] Seq=1513 Ack=38289 Win=62015 Len=0
992394 331.160513 41.177.75.120 -> 41.177.98.176 TCP 64 pxc-ntfy > http [ACK] Seq=1513 Ack=41049 Win=59255 Len=0
992402 331.161320 41.177.75.120 -> 41.177.98.176 TCP 64 pxc-ntfy > http [ACK] Seq=1513 Ack=42429 Win=61635 Len=0
992403 331.161325 41.177.75.120 -> 41.177.98.176 TCP 64 pxc-ntfy > http [ACK] Seq=1513 Ack=45189 Win=58875 Len=0
992404 331.161329 41.177.75.120 -> 41.177.98.176 TCP 64 pxc-ntfy > http [ACK] Seq=1513 Ack=47949 Win=56115 Len=0
992406 331.161354 41.177.75.120 -> 41.177.98.176 TCP 64 pxc-ntfy > http [ACK] Seq=1513 Ack=50709 Win=53355 Len=0
992410 331.162214 41.177.75.120 -> 41.177.98.176 TCP 64 [TCP Window Update] pxc-ntfy > http [ACK] Seq=1513 Ack=50709 Win=57255 Len=0
992411 331.162269 41.177.75.120 -> 41.177.98.176 TCP 64 pxc-ntfy > http [ACK] Seq=1513 Ack=58989 Win=48975 Len=0
992412 331.162274 41.177.75.120 -> 41.177.98.176 TCP 64 pxc-ntfy > http [ACK] Seq=1513 Ack=56229 Win=51735 Len=0
992413 331.162279 41.177.75.120 -> 41.177.98.176 TCP 64 pxc-ntfy > http [ACK] Seq=1513 Ack=60387 Win=47577 Len=0
992414 331.162283 41.177.75.120 -> 41.177.98.176 TCP 64 pxc-ntfy > http [ACK] Seq=1513 Ack=53469 Win=54495 Len=0
992415 331.165450 41.177.75.120 -> 41.177.98.176 TCP 64 pxc-ntfy > http [ACK] Seq=1513 Ack=60387 Win=55857 Len=0
992416 331.165454 41.177.75.120 -> 41.177.98.176 TCP 64 [TCP Window Update] pxc-ntfy > http [ACK] Seq=1513 Ack=60387 Win=65535 Len=0
992442 331.182800 41.177.75.120 -> 41.177.98.176 TCP 64 lotusmtap > http [ACK] Seq=2317 Ack=23968 Win=65535 Len=0
992444 331.183566 41.177.75.120 -> 41.177.98.176 TCP 64 lotusmtap > http [ACK] Seq=2317 Ack=26728 Win=65535 Len=0
992445 331.183571 41.177.75.120 -> 41.177.98.176 TCP 64 lotusmtap > http [ACK] Seq=2317 Ack=29488 Win=65535 Len=0
992454 331.187742 41.177.75.120 -> 41.177.98.176 TCP 64 pxc-ntfy > http [ACK] Seq=2267 Ack=62076 Win=65535 Len=0
992455 331.187951 41.177.75.120 -> 41.177.98.176 TCP 64 pxc-ntfy > http [ACK] Seq=2267 Ack=64836 Win=65535 Len=0
992466 331.192087 41.177.75.120 -> 41.177.98.176 TCP 64 midnight-tech > http [ACK] Seq=2284 Ack=8000 Win=65535 Len=0
992472 331.192630 41.177.75.120 -> 41.177.98.176 TCP 64 midnight-tech > http [ACK] Seq=2284 Ack=10760 Win=65535 Len=0
992473 331.192635 41.177.75.120 -> 41.177.98.176 TCP 64 midnight-tech > http [ACK] Seq=2284 Ack=13520 Win=65535 Len=0
992474 331.192639 41.177.75.120 -> 41.177.98.176 TCP 64 midnight-tech > http [ACK] Seq=2284 Ack=14812 Win=65535 Len=0
992479 331.193099 41.177.75.120 -> 41.177.98.176 TCP 64 midnight-tech > http [ACK] Seq=2284 Ack=17020 Win=65535 Len=0
992497 331.198626 41.177.75.120 -> 41.177.98.176 TCP 64 lotusmtap > http [ACK] Seq=3075 Ack=32773 Win=65535 Len=0
992498 331.198631 41.177.75.120 -> 41.177.98.176 TCP 64 lotusmtap > http [ACK] Seq=3075 Ack=34153 Win=65535 Len=0
992535 331.202115 41.177.75.120 -> 41.177.98.176 TCP 64 pxc-ntfy > http [ACK] Seq=3036 Ack=67768 Win=65535 Len=0
992536 331.202966 41.177.75.120 -> 41.177.98.176 TCP 64 pxc-ntfy > http [ACK] Seq=3036 Ack=70528 Win=65535 Len=0
992537 331.203115 41.177.75.120 -> 41.177.98.176 TCP 64 pxc-ntfy > http [ACK] Seq=3036 Ack=73288 Win=65535 Len=0
992538 331.203120 41.177.75.120 -> 41.177.98.176 TCP 64 pxc-ntfy > http [ACK] Seq=3036 Ack=74580 Win=65535 Len=0
992552 331.207633 41.177.75.120 -> 41.177.98.176 TCP 64 midnight-tech > http [ACK] Seq=3054 Ack=19118 Win=65535 Len=0
992576 331.212288 41.177.75.120 -> 41.177.98.176 TCP 64 lotusmtap > http [ACK] Seq=3828 Ack=36938 Win=65535 Len=0
992577 331.212293 41.177.75.120 -> 41.177.98.176 TCP 64 lotusmtap > http [ACK] Seq=3828 Ack=39698 Win=65535 Len=0
992592 331.215889 41.177.75.120 -> 41.177.98.176 TCP 64 pxc-ntfy > http [ACK] Seq=3788 Ack=77355 Win=65535 Len=0
992594 331.217090 41.177.75.120 -> 41.177.98.176 TCP 64 pxc-ntfy > http [ACK] Seq=3788 Ack=80115 Win=65535 Len=0
992595 331.217727 41.177.75.120 -> 41.177.98.176 TCP 64 pxc-ntfy > http [ACK] Seq=3788 Ack=82875 Win=65535 Len=0
992597 331.218376 41.177.75.120 -> 41.177.98.176 TCP 64 pxc-ntfy > http [ACK] Seq=3788 Ack=84167 Win=65535 Len=0
992598 331.218381 41.177.75.120 -> 41.177.98.176 TCP 64 pxc-ntfy > http [ACK] Seq=3788 Ack=86927 Win=65535 Len=0
992599 331.218385 41.177.75.120 -> 41.177.98.176 TCP 64 pxc-ntfy > http [ACK] Seq=3788 Ack=88307 Win=65535 Len=0
992600 331.218389 41.177.75.120 -> 41.177.98.176 TCP 64 pxc-ntfy > http [ACK] Seq=3788 Ack=90870 Win=65535 Len=0
992615 331.223942 41.177.75.120 -> 41.177.98.176 TCP 64 midnight-tech > http [ACK] Seq=3804 Ack=20807 Win=65535 Len=0
992616 331.224735 41.177.75.120 -> 41.177.98.176 TCP 64 midnight-tech > http [ACK] Seq=3804 Ack=23567 Win=65535 Len=0
992617 331.224740 41.177.75.120 -> 41.177.98.176 TCP 64 midnight-tech > http [ACK] Seq=3804 Ack=26327 Win=65535 Len=0
992618 331.224744 41.177.75.120 -> 41.177.98.176 TCP 64 midnight-tech > http [ACK] Seq=3804 Ack=27619 Win=65535 Len=0
992619 331.224790 41.177.75.120 -> 41.177.98.176 TCP 64 midnight-tech > http [ACK] Seq=3804 Ack=28440 Win=65535 Len=0
992648 331.237564 41.177.75.120 -> 41.177.98.176 TCP 64 pxc-ntfy > http [ACK] Seq=4571 Ack=92431 Win=65535 Len=0
992698 331.262128 41.177.75.120 -> 41.177.98.176 TCP 64 midnight-tech > http [ACK] Seq=4594 Ack=30117 Win=65535 Len=0
992702 331.262981 41.177.75.120 -> 41.177.98.176 TCP 64 midnight-tech > http [ACK] Seq=4594 Ack=32877 Win=65535 Len=0
992703 331.263176 41.177.75.120 -> 41.177.98.176 TCP 64 midnight-tech > http [ACK] Seq=4594 Ack=35637 Win=65535 Len=0
992705 331.263405 41.177.75.120 -> 41.177.98.176 TCP 64 midnight-tech > http [ACK] Seq=4594 Ack=36929 Win=65243 Len=0
992706 331.263409 41.177.75.120 -> 41.177.98.176 TCP 64 midnight-tech > http [ACK] Seq=4594 Ack=39689 Win=62483 Len=0
992707 331.263414 41.177.75.120 -> 41.177.98.176 TCP 64 midnight-tech > http [ACK] Seq=4594 Ack=45121 Win=57051 Len=0
992708 331.263418 41.177.75.120 -> 41.177.98.176 TCP 64 midnight-tech > http [ACK] Seq=4594 Ack=47881 Win=54291 Len=0
992709 331.263421 41.177.75.120 -> 41.177.98.176 TCP 64 midnight-tech > http [ACK] Seq=4594 Ack=42449 Win=59723 Len=0
992710 331.263464 41.177.75.120 -> 41.177.98.176 TCP 64 midnight-tech > http [ACK] Seq=4594 Ack=56161 Win=46011 Len=0
992711 331.263467 41.177.75.120 -> 41.177.98.176 TCP 64 midnight-tech > http [ACK] Seq=4594 Ack=50641 Win=51531 Len=0
992712 331.263471 41.177.75.120 -> 41.177.98.176 TCP 64 midnight-tech > http [ACK] Seq=4594 Ack=53401 Win=48771 Len=0
992732 331.269596 41.177.75.120 -> 41.177.98.176 TCP 64 midnight-tech > http [ACK] Seq=4594 Ack=56161 Win=65535 Len=0
992733 331.269701 41.177.75.120 -> 41.177.98.176 TCP 64 midnight-tech > http [ACK] Seq=4594 Ack=57352 Win=65535 Len=0
993211 331.422947 41.177.75.120 -> 41.177.98.176 TCP 64 lotusmtap > http [ACK] Seq=5357 Ack=41519 Win=65535 Len=0
993527 331.532274 41.177.75.120 -> 41.177.98.176 TCP 64 pxc-ntfy > http [ACK] Seq=5262 Ack=92724 Win=65242 Len=0
1010880 339.105204 41.177.75.120 -> 41.177.98.176 TCP 64 midnight-tech > http [ACK] Seq=5521 Ack=60112 Win=65535 Len=0
1010881 339.105209 41.177.75.120 -> 41.177.98.176 TCP 64 midnight-tech > http [ACK] Seq=5521 Ack=61492 Win=65535 Len=0
1010901 339.107166 41.177.75.120 -> 41.177.98.176 TCP 64 midnight-tech > http [ACK] Seq=5521 Ack=64065 Win=65535 Len=0
1010902 339.107249 41.177.75.120 -> 41.177.98.176 TCP 64 midnight-tech > http [ACK] Seq=5521 Ack=66825 Win=65535 Len=0
1010920 339.109739 41.177.75.120 -> 41.177.98.176 TCP 64 midnight-tech > http [ACK] Seq=5521 Ack=69193 Win=65535 Len=0
1010921 339.110176 41.177.75.120 -> 41.177.98.176 TCP 64 midnight-tech > http [ACK] Seq=5521 Ack=71953 Win=65535 Len=0
1010938 339.114102 41.177.75.120 -> 41.177.98.176 TCP 64 midnight-tech > http [ACK] Seq=5521 Ack=74321 Win=65535 Len=0
1010939 339.114106 41.177.75.120 -> 41.177.98.176 TCP 64 midnight-tech > http [ACK] Seq=5521 Ack=76201 Win=65535 Len=0
1010975 339.159547 41.177.75.120 -> 41.177.98.176 TCP 66 gilatskysurfer > http [SYN] Seq=0 Win=65535 Len=0 MSS=1380 SACK_PERM=1
1010978 339.159990 41.177.75.120 -> 41.177.98.176 TCP 66 broker-service > http [SYN] Seq=0 Win=65535 Len=0 MSS=1380 SACK_PERM=1
1010982 339.160882 41.177.75.120 -> 41.177.98.176 TCP 64 gilatskysurfer > http [ACK] Seq=1 Ack=1 Win=65535 Len=0
1010983 339.160886 41.177.75.120 -> 41.177.98.176 TCP 64 broker-service > http [ACK] Seq=1 Ack=1 Win=65535 Len=0
1010992 339.162455 41.177.75.120 -> 41.177.98.176 TCP 64 lotusmtap > http [ACK] Seq=7096 Ack=44834 Win=65535 Len=0
1010994 339.162464 41.177.75.120 -> 41.177.98.176 TCP 64 lotusmtap > http [ACK] Seq=7096 Ack=46214 Win=65535 Len=0
1011007 339.164195 41.177.75.120 -> 41.177.98.176 TCP 64 broker-service > http [ACK] Seq=870 Ack=1679 Win=65535 Len=0
1011008 339.164272 41.177.75.120 -> 41.177.98.176 TCP 64 gilatskysurfer > http [ACK] Seq=870 Ack=2203 Win=65535 Len=0
1011012 339.164954 41.177.75.120 -> 41.177.98.176 TCP 64 broker-service > http [ACK] Seq=870 Ack=4439 Win=65535 Len=0
1011013 339.165159 41.177.75.120 -> 41.177.98.176 TCP 64 broker-service > http [ACK] Seq=870 Ack=7199 Win=65535 Len=0
1011018 339.165776 41.177.75.120 -> 41.177.98.176 TCP 64 broker-service > http [ACK] Seq=870 Ack=9959 Win=65535 Len=0
1011019 339.165916 41.177.75.120 -> 41.177.98.176 TCP 64 broker-service > http [ACK] Seq=870 Ack=11339 Win=65535 Len=0
1011036 339.169894 41.177.75.120 -> 41.177.98.176 TCP 64 midnight-tech > http [ACK] Seq=6391 Ack=77739 Win=65535 Len=0
1011413 339.297864 41.177.75.120 -> 41.177.98.176 TCP 64 broker-service > http [ACK] Seq=870 Ack=11794 Win=65080 Len=0
1011414 339.297869 41.177.75.120 -> 41.177.98.176 TCP 64 lotusmtap > http [ACK] Seq=7096 Ack=47503 Win=65535 Len=0
1011415 339.297873 41.177.75.120 -> 41.177.98.176 TCP 64 pxc-ntfy > http [ACK] Seq=6132 Ack=93256 Win=65535 Len=0
1011998 339.735284 41.177.75.120 -> 41.177.98.176 TCP 64 pxc-ntfy > http [ACK] Seq=7037 Ack=94179 Win=65535 Len=0
