252060  89.178118 41.113.177.123 -> 41.177.26.176 TCP 82 56136 > http [SYN] Seq=0 Win=65535 Len=0 MSS=1460 WS=8 TSval=159862051 TSecr=0 SACK_PERM=1
252497  89.320268 41.113.177.123 -> 41.177.26.176 TCP 70 56136 > http [ACK] Seq=1 Ack=1 Win=524280 Len=0 TSval=159862053 TSecr=140350514
254096  90.214781 41.113.177.123 -> 41.177.26.176 TCP 82 [TCP Dup ACK 252498#1] 56136 > http [ACK] Seq=774 Ack=1 Win=524280 Len=0 TSval=159862062 TSecr=140350528 SLE=2897 SRE=3098
254097  90.214865 41.113.177.123 -> 41.177.26.176 TCP 82 56136 > http [ACK] Seq=774 Ack=1449 Win=524176 Len=0 TSval=159862062 TSecr=140350603 SLE=2897 SRE=3098
254102  90.215530 41.113.177.123 -> 41.177.26.176 TCP 70 56136 > http [ACK] Seq=774 Ack=3098 Win=523968 Len=0 TSval=159862062 TSecr=140350603
254471  90.357862 41.113.177.123 -> 41.177.26.176 TCP 70 56136 > http [ACK] Seq=774 Ack=5631 Win=524280 Len=0 TSval=159862063 TSecr=140350617
308011 104.784047 41.113.177.123 -> 41.177.26.176 TCP 70 56136 > http [FIN, ACK] Seq=774 Ack=5631 Win=524280 Len=0 TSval=159862207 TSecr=140350617
308374 104.930307 41.113.177.123 -> 41.177.26.176 TCP 70 [TCP Dup ACK 308011#1] 56136 > http [ACK] Seq=775 Ack=5631 Win=524280 Len=0 TSval=159862209 TSecr=140352074
308375 104.930472 41.113.177.123 -> 41.177.26.176 TCP 70 56136 > http [ACK] Seq=775 Ack=5632 Win=524280 Len=0 TSval=159862209 TSecr=140352074
577105 183.273931 41.113.177.123 -> 41.177.26.176 TCP 82 56140 > http [SYN] Seq=0 Win=65535 Len=0 MSS=1460 WS=8 TSval=159862991 TSecr=0 SACK_PERM=1
577549 183.415171 41.113.177.123 -> 41.177.26.176 TCP 70 56140 > http [ACK] Seq=1 Ack=1 Win=524280 Len=0 TSval=159862993 TSecr=140359923
581195 184.879964 41.113.177.123 -> 41.177.26.176 TCP 82 [TCP Dup ACK 577550#1] 56140 > http [ACK] Seq=775 Ack=1 Win=524280 Len=0 TSval=159863007 TSecr=140359938 SLE=2897 SRE=3206
581196 184.880271 41.113.177.123 -> 41.177.26.176 TCP 82 56140 > http [ACK] Seq=775 Ack=1449 Win=524176 Len=0 TSval=159863007 TSecr=140360070 SLE=2897 SRE=3206
581197 184.880316 41.113.177.123 -> 41.177.26.176 TCP 70 56140 > http [ACK] Seq=775 Ack=3206 Win=523864 Len=0 TSval=159863007 TSecr=140360070
581539 185.022659 41.113.177.123 -> 41.177.26.176 TCP 70 56140 > http [ACK] Seq=775 Ack=6102 Win=524176 Len=0 TSval=159863009 TSecr=140360084
581548 185.024081 41.113.177.123 -> 41.177.26.176 TCP 70 56140 > http [ACK] Seq=775 Ack=8890 Win=524240 Len=0 TSval=159863009 TSecr=140360084
581710 185.102316 41.113.177.123 -> 41.177.26.176 TCP 70 56140 > http [ACK] Seq=775 Ack=10281 Win=524280 Len=0 TSval=159863009 TSecr=140360084
581970 185.193645 41.113.177.123 -> 41.177.26.176 TCP 82 56140 > http [ACK] Seq=775 Ack=11683 Win=524280 Len=0 TSval=159863010 TSecr=140360098 SLE=13062 SRE=14364
581975 185.194469 41.113.177.123 -> 41.177.26.176 TCP 70 56140 > http [ACK] Seq=775 Ack=14364 Win=522936 Len=0 TSval=159863010 TSecr=140360098
581976 185.194721 41.113.177.123 -> 41.177.26.176 TCP 82 56140 > http [ACK] Seq=775 Ack=15358 Win=524280 Len=0 TSval=159863010 TSecr=140360098 SLE=16806 SRE=17855
581978 185.195078 41.113.177.123 -> 41.177.26.176 TCP 70 56140 > http [ACK] Seq=775 Ack=17855 Win=523120 Len=0 TSval=159863010 TSecr=140360098
615793 195.599479 41.113.177.123 -> 41.177.26.176 TCP 82 [TCP Dup ACK 614520#1] 56140 > http [ACK] Seq=1550 Ack=17855 Win=524280 Len=0 TSval=159863114 TSecr=140361097 SLE=20751 SRE=20952
615794 195.599709 41.113.177.123 -> 41.177.26.176 TCP 82 [TCP Dup ACK 614520#2] 56140 > http [ACK] Seq=1550 Ack=17855 Win=524280 Len=0 TSval=159863114 TSecr=140361097 SLE=20751 SRE=21753
615795 195.600423 41.113.177.123 -> 41.177.26.176 TCP 82 56140 > http [ACK] Seq=1550 Ack=19303 Win=524176 Len=0 TSval=159863114 TSecr=140361142 SLE=20751 SRE=21753
615796 195.600747 41.113.177.123 -> 41.177.26.176 TCP 70 56140 > http [ACK] Seq=1550 Ack=21753 Win=523168 Len=0 TSval=159863114 TSecr=140361142
615797 195.601178 41.113.177.123 -> 41.177.26.176 TCP 70 56140 > http [ACK] Seq=1550 Ack=22055 Win=524280 Len=0 TSval=159863114 TSecr=140361142
615798 195.601660 41.113.177.123 -> 41.177.26.176 TCP 82 [TCP Dup ACK 615797#1] 56140 > http [ACK] Seq=1550 Ack=22055 Win=524280 Len=0 TSval=159863114 TSecr=140361142 SLE=23503 SRE=24094
615799 195.602517 41.113.177.123 -> 41.177.26.176 TCP 70 56140 > http [ACK] Seq=1550 Ack=24094 Win=523584 Len=0 TSval=159863114 TSecr=140361142
615811 195.612598 41.113.177.123 -> 41.177.26.176 TCP 70 56140 > http [ACK] Seq=1550 Ack=24099 Win=524280 Len=0 TSval=159863114 TSecr=140361143
623523 197.889605 41.113.177.123 -> 41.177.26.176 TCP 70 56140 > http [ACK] Seq=2325 Ack=24773 Win=524280 Len=0 TSval=159863137 TSecr=140361371
623526 197.892219 41.113.177.123 -> 41.177.26.176 TCP 82 56140 > http [ACK] Seq=2325 Ack=26221 Win=524280 Len=0 TSval=159863137 TSecr=140361371 SLE=27669 SRE=27997
623554 197.894034 41.113.177.123 -> 41.177.26.176 TCP 70 56140 > http [ACK] Seq=2325 Ack=27997 Win=523848 Len=0 TSval=159863137 TSecr=140361371
623564 197.897142 41.113.177.123 -> 41.177.26.176 TCP 82 [TCP Window Update] 56140 > http [ACK] Seq=2325 Ack=27997 Win=524280 Len=0 TSval=159863137 TSecr=140361371 SLE=29445 SRE=29774
623566 197.897337 41.113.177.123 -> 41.177.26.176 TCP 70 56140 > http [ACK] Seq=2325 Ack=29774 Win=523840 Len=0 TSval=159863137 TSecr=140361371
623567 197.897630 41.113.177.123 -> 41.177.26.176 TCP 70 56140 > http [ACK] Seq=2325 Ack=31813 Win=524280 Len=0 TSval=159863137 TSecr=140361371
623582 197.906678 41.113.177.123 -> 41.177.26.176 TCP 70 56140 > http [ACK] Seq=2325 Ack=31818 Win=524280 Len=0 TSval=159863137 TSecr=140361372
679600 212.581237 41.113.177.123 -> 41.177.26.176 TCP 70 56140 > http [ACK] Seq=3099 Ack=33236 Win=524200 Len=0 TSval=159863284 TSecr=140362840
679603 212.582216 41.113.177.123 -> 41.177.26.176 TCP 82 [TCP Window Update] 56140 > http [ACK] Seq=3099 Ack=33236 Win=524280 Len=0 TSval=159863284 TSecr=140362840 SLE=34684 SRE=35714
679604 212.582331 41.113.177.123 -> 41.177.26.176 TCP 70 56140 > http [ACK] Seq=3099 Ack=35714 Win=523144 Len=0 TSval=159863284 TSecr=140362840
679605 212.582578 41.113.177.123 -> 41.177.26.176 TCP 70 56140 > http [ACK] Seq=3099 Ack=36351 Win=524280 Len=0 TSval=159863284 TSecr=140362840
679606 212.582684 41.113.177.123 -> 41.177.26.176 TCP 82 [TCP Dup ACK 679605#1] 56140 > http [ACK] Seq=3099 Ack=36351 Win=524280 Len=0 TSval=159863284 TSecr=140362840 SLE=37799 SRE=38390
679607 212.582977 41.113.177.123 -> 41.177.26.176 TCP 70 56140 > http [ACK] Seq=3099 Ack=38390 Win=523584 Len=0 TSval=159863284 TSecr=140362840
679666 212.596430 41.113.177.123 -> 41.177.26.176 TCP 70 56140 > http [ACK] Seq=3099 Ack=38395 Win=524280 Len=0 TSval=159863284 TSecr=140362841
713525 227.649973 41.113.177.123 -> 41.177.26.176 TCP 70 56140 > http [ACK] Seq=3099 Ack=38396 Win=524280 Len=0 TSval=159863434 TSecr=140364347
748645 239.772167 41.113.177.123 -> 41.177.26.176 TCP 70 56140 > http [FIN, ACK] Seq=3099 Ack=38396 Win=524280 Len=0 TSval=159863556 TSecr=140364347
759671 244.934821 41.113.177.123 -> 41.177.26.176 TCP 82 56145 > http [SYN] Seq=0 Win=65535 Len=0 MSS=1460 WS=8 TSval=159863607 TSecr=0 SACK_PERM=1
759967 245.076615 41.113.177.123 -> 41.177.26.176 TCP 70 56145 > http [ACK] Seq=1 Ack=1 Win=524280 Len=0 TSval=159863609 TSecr=140366089
762320 245.947176 41.113.177.123 -> 41.177.26.176 TCP 82 [TCP Dup ACK 759968#1] 56145 > http [ACK] Seq=775 Ack=1 Win=524280 Len=0 TSval=159863617 TSecr=140366104 SLE=2897 SRE=3117
762323 245.947790 41.113.177.123 -> 41.177.26.176 TCP 82 [TCP Dup ACK 759968#2] 56145 > http [ACK] Seq=775 Ack=1 Win=524280 Len=0 TSval=159863617 TSecr=140366104 SLE=2897 SRE=3898
762324 245.947931 41.113.177.123 -> 41.177.26.176 TCP 82 56145 > http [ACK] Seq=775 Ack=1449 Win=524176 Len=0 TSval=159863617 TSecr=140366176 SLE=2897 SRE=3898
762325 245.948054 41.113.177.123 -> 41.177.26.176 TCP 70 56145 > http [ACK] Seq=775 Ack=3898 Win=523168 Len=0 TSval=159863617 TSecr=140366176
762679 246.090157 41.113.177.123 -> 41.177.26.176 TCP 82 56145 > http [ACK] Seq=775 Ack=4763 Win=524280 Len=0 TSval=159863619 TSecr=140366191 SLE=6211 SRE=6807
762680 246.090734 41.113.177.123 -> 41.177.26.176 TCP 70 56145 > http [ACK] Seq=775 Ack=6807 Win=523576 Len=0 TSval=159863619 TSecr=140366191
799414 260.880311 41.113.177.123 -> 41.177.26.176 TCP 70 56145 > http [ACK] Seq=1578 Ack=9703 Win=524176 Len=0 TSval=159863766 TSecr=140367670
799415 260.881199 41.113.177.123 -> 41.177.26.176 TCP 70 56145 > http [ACK] Seq=1578 Ack=9904 Win=524280 Len=0 TSval=159863766 TSecr=140367670
799417 260.882403 41.113.177.123 -> 41.177.26.176 TCP 70 56145 > http [ACK] Seq=1578 Ack=12602 Win=524280 Len=0 TSval=159863766 TSecr=140367670
799429 260.896801 41.113.177.123 -> 41.177.26.176 TCP 70 56145 > http [ACK] Seq=1578 Ack=12607 Win=524280 Len=0 TSval=159863767 TSecr=140367671
804925 263.089917 41.113.177.123 -> 41.177.26.176 TCP 82 56145 > http [ACK] Seq=2349 Ack=14055 Win=524280 Len=0 TSval=159863788 TSecr=140367891 SLE=15503 SRE=16494
804926 263.090505 41.113.177.123 -> 41.177.26.176 TCP 70 56145 > http [ACK] Seq=2349 Ack=16494 Win=523184 Len=0 TSval=159863788 TSecr=140367891
804928 263.091329 41.113.177.123 -> 41.177.26.176 TCP 82 [TCP Window Update] 56145 > http [ACK] Seq=2349 Ack=16494 Win=524280 Len=0 TSval=159863788 TSecr=140367891 SLE=17942 SRE=18220
804931 263.091999 41.113.177.123 -> 41.177.26.176 TCP 70 56145 > http [ACK] Seq=2349 Ack=18220 Win=523896 Len=0 TSval=159863788 TSecr=140367891
804934 263.092468 41.113.177.123 -> 41.177.26.176 TCP 82 [TCP Window Update] 56145 > http [ACK] Seq=2349 Ack=18220 Win=524280 Len=0 TSval=159863788 TSecr=140367891 SLE=19668 SRE=20259
804939 263.099245 41.113.177.123 -> 41.177.26.176 TCP 70 56145 > http [ACK] Seq=2349 Ack=20259 Win=523584 Len=0 TSval=159863788 TSecr=140367891
804940 263.104448 41.113.177.123 -> 41.177.26.176 TCP 70 56145 > http [ACK] Seq=2349 Ack=20264 Win=524280 Len=0 TSval=159863789 TSecr=140367892
844989 278.167548 41.113.177.123 -> 41.177.26.176 TCP 70 56145 > http [ACK] Seq=2349 Ack=20265 Win=524280 Len=0 TSval=159863939 TSecr=140369399
862844 284.772882 41.113.177.123 -> 41.177.26.176 TCP 70 56145 > http [FIN, ACK] Seq=2349 Ack=20265 Win=524280 Len=0 TSval=159864005 TSecr=140369399
