63564  26.256212 41.177.244.77 -> 244.3.210.90 TCP 66 vt-ssl > microsoft-ds [SYN] Seq=0 Win=65535 Len=0 MSS=1380 SACK_PERM=1
73448  29.948709 41.177.244.77 -> 244.3.210.254 TCP 70 m2ua > 19813 [PSH, ACK] Seq=1 Ack=1 Win=65295 Len=12
84243  32.706060 41.177.244.77 -> 244.3.210.90 TCP 66 [TCP Port numbers reused] vt-ssl > microsoft-ds [SYN] Seq=0 Win=65535 Len=0 MSS=1380 SACK_PERM=1
204857  70.453045 41.177.244.77 -> 244.3.210.254 TCP 64 m2ua > 19813 [ACK] Seq=13 Ack=13 Win=65283 Len=0
321958 110.151778 41.177.244.77 -> 244.3.210.254 TCP 70 m2ua > 19813 [PSH, ACK] Seq=13 Ack=13 Win=65283 Len=12
449873 146.271660 41.177.244.77 -> 244.3.210.90 TCP 66 webmail-2 > microsoft-ds [SYN] Seq=0 Win=65535 Len=0 MSS=1380 SACK_PERM=1
459496 150.303988 41.177.244.77 -> 244.3.210.254 TCP 64 m2ua > 19813 [ACK] Seq=25 Ack=25 Win=65271 Len=0
464973 152.830348 41.177.244.77 -> 244.3.210.90 TCP 66 [TCP Port numbers reused] webmail-2 > microsoft-ds [SYN] Seq=0 Win=65535 Len=0 MSS=1380 SACK_PERM=1
600469 190.308046 41.177.244.77 -> 244.3.210.254 TCP 70 m2ua > 19813 [PSH, ACK] Seq=25 Ack=25 Win=65271 Len=12
721778 230.470911 41.177.244.77 -> 244.3.210.254 TCP 64 m2ua > 19813 [ACK] Seq=37 Ack=37 Win=65259 Len=0
816398 266.287074 41.177.244.77 -> 244.3.210.90 TCP 66 arcpd > microsoft-ds [SYN] Seq=0 Win=65535 Len=0 MSS=1380 SACK_PERM=1
817615 266.770237 41.177.244.77 -> 244.3.210.90 TCP 66 [TCP Port numbers reused] arcpd > microsoft-ds [SYN] Seq=0 Win=65535 Len=0 MSS=1380 SACK_PERM=1
828643 270.451531 41.177.244.77 -> 244.3.210.254 TCP 70 m2ua > 19813 [PSH, ACK] Seq=37 Ack=37 Win=65259 Len=12
932481 310.637821 41.177.244.77 -> 244.3.210.254 TCP 64 m2ua > 19813 [ACK] Seq=49 Ack=49 Win=65247 Len=0
