836408 273.897546 41.177.247.242 -> 244.3.160.239 TCP 66 14362 > http [SYN] Seq=0 Win=64512 Len=0 MSS=1260 SACK_PERM=1
836412 273.898368 41.177.247.242 -> 244.3.160.239 TCP 64 14362 > http [ACK] Seq=1 Ack=1 Win=64512 Len=0
836929 274.101653 41.177.247.242 -> 244.3.160.239 TCP 64 14362 > http [ACK] Seq=8616 Ack=626 Win=63888 Len=0
836930 274.101657 41.177.247.242 -> 244.3.160.239 TCP 64 14362 > http [FIN, ACK] Seq=8616 Ack=626 Win=63888 Len=0
836932 274.102243 41.177.247.242 -> 244.3.160.239 TCP 66 4386 > http [SYN] Seq=0 Win=64512 Len=0 MSS=1260 SACK_PERM=1
836935 274.102887 41.177.247.242 -> 244.3.160.239 TCP 64 4386 > http [ACK] Seq=1 Ack=1 Win=64512 Len=0
837132 274.236217 41.177.247.242 -> 244.3.160.239 TCP 64 4386 > http [ACK] Seq=952 Ack=2050 Win=64512 Len=0
837218 274.277913 41.177.247.242 -> 244.3.160.239 TCP 64 4386 > http [ACK] Seq=952 Ack=4514 Win=64512 Len=0
837236 274.279658 41.177.247.242 -> 244.3.160.239 TCP 64 4386 > http [ACK] Seq=952 Ack=6563 Win=64512 Len=0
837245 274.281299 41.177.247.242 -> 244.3.160.239 TCP 64 4386 > http [ACK] Seq=952 Ack=8530 Win=64512 Len=0
837328 274.313602 41.177.247.242 -> 244.3.160.239 TCP 64 4386 > http [ACK] Seq=952 Ack=11331 Win=64512 Len=0
837342 274.319208 41.177.247.242 -> 244.3.160.239 TCP 64 4386 > http [ACK] Seq=952 Ack=13380 Win=64512 Len=0
837345 274.320871 41.177.247.242 -> 244.3.160.239 TCP 64 4386 > http [ACK] Seq=952 Ack=15477 Win=64512 Len=0
837348 274.322331 41.177.247.242 -> 244.3.160.239 TCP 64 4386 > http [ACK] Seq=952 Ack=16924 Win=64512 Len=0
837379 274.344099 41.177.247.242 -> 244.3.160.239 TCP 66 6423 > http [SYN] Seq=0 Win=64512 Len=0 MSS=1260 SACK_PERM=1
837383 274.344586 41.177.247.242 -> 244.3.160.239 TCP 66 11239 > http [SYN] Seq=0 Win=64512 Len=0 MSS=1260 SACK_PERM=1
837386 274.344886 41.177.247.242 -> 244.3.160.239 TCP 64 6423 > http [ACK] Seq=1 Ack=1 Win=64512 Len=0
837389 274.345407 41.177.247.242 -> 244.3.160.239 TCP 64 11239 > http [ACK] Seq=1 Ack=1 Win=64512 Len=0
837405 274.352090 41.177.247.242 -> 244.3.160.239 TCP 64 4386 > http [ACK] Seq=952 Ack=19030 Win=64512 Len=0
837408 274.353157 41.177.247.242 -> 244.3.160.239 TCP 64 4386 > http [ACK] Seq=952 Ack=20308 Win=64512 Len=0
837409 274.353162 41.177.247.242 -> 244.3.160.239 TCP 64 4386 > http [FIN, ACK] Seq=952 Ack=20308 Win=64512 Len=0
837552 274.428986 41.177.247.242 -> 244.3.160.239 TCP 64 11239 > http [ACK] Seq=654 Ack=2050 Win=64512 Len=0
837553 274.428991 41.177.247.242 -> 244.3.160.239 TCP 64 6423 > http [ACK] Seq=654 Ack=2050 Win=64512 Len=0
837665 274.465856 41.177.247.242 -> 244.3.160.239 TCP 64 11239 > http [ACK] Seq=654 Ack=3733 Win=64512 Len=0
837668 274.466174 41.177.247.242 -> 244.3.160.239 TCP 64 11239 > http [FIN, ACK] Seq=654 Ack=3733 Win=64512 Len=0
837678 274.467264 41.177.247.242 -> 244.3.160.239 TCP 64 6423 > http [ACK] Seq=654 Ack=4734 Win=64512 Len=0
837680 274.467902 41.177.247.242 -> 244.3.160.239 TCP 64 6423 > http [ACK] Seq=654 Ack=5750 Win=63497 Len=0
837681 274.468041 41.177.247.242 -> 244.3.160.239 TCP 64 6423 > http [FIN, ACK] Seq=654 Ack=5750 Win=63497 Len=0
837695 274.474581 41.177.247.242 -> 244.3.160.239 TCP 66 8645 > http [SYN] Seq=0 Win=64512 Len=0 MSS=1260 SACK_PERM=1
837700 274.475027 41.177.247.242 -> 244.3.160.239 TCP 66 14705 > http [SYN] Seq=0 Win=64512 Len=0 MSS=1260 SACK_PERM=1
837702 274.475378 41.177.247.242 -> 244.3.160.239 TCP 64 8645 > http [ACK] Seq=1 Ack=1 Win=64512 Len=0
837705 274.475927 41.177.247.242 -> 244.3.160.239 TCP 64 14705 > http [ACK] Seq=1 Ack=1 Win=64512 Len=0
838255 274.651104 41.177.247.242 -> 244.3.160.239 TCP 64 8645 > http [ACK] Seq=665 Ack=1087 Win=63426 Len=0
838256 274.651108 41.177.247.242 -> 244.3.160.239 TCP 64 14705 > http [ACK] Seq=673 Ack=355 Win=64158 Len=0
838259 274.651191 41.177.247.242 -> 244.3.160.239 TCP 64 8645 > http [FIN, ACK] Seq=665 Ack=1087 Win=63426 Len=0
838266 274.651235 41.177.247.242 -> 244.3.160.239 TCP 64 14705 > http [FIN, ACK] Seq=673 Ack=355 Win=64158 Len=0
838457 274.760648 41.177.247.242 -> 244.3.160.239 TCP 64 8645 > http [ACK] Seq=666 Ack=1088 Win=63426 Len=0
838458 274.760998 41.177.247.242 -> 244.3.160.239 TCP 64 14705 > http [ACK] Seq=674 Ack=356 Win=64158 Len=0
862078 284.416983 41.177.247.242 -> 244.3.160.239 TCP 66 4835 > http [SYN] Seq=0 Win=64512 Len=0 MSS=1260 SACK_PERM=1
862080 284.417727 41.177.247.242 -> 244.3.160.239 TCP 64 4835 > http [ACK] Seq=1 Ack=1 Win=64512 Len=0
862470 284.546452 41.177.247.242 -> 244.3.160.239 TCP 64 4835 > http [ACK] Seq=3619 Ack=626 Win=63888 Len=0
862471 284.546646 41.177.247.242 -> 244.3.160.239 TCP 64 4835 > http [FIN, ACK] Seq=3619 Ack=626 Win=63888 Len=0
862473 284.547118 41.177.247.242 -> 244.3.160.239 TCP 66 ndtp > http [SYN] Seq=0 Win=64512 Len=0 MSS=1260 SACK_PERM=1
862475 284.547848 41.177.247.242 -> 244.3.160.239 TCP 64 ndtp > http [ACK] Seq=1 Ack=1 Win=64512 Len=0
862662 284.676363 41.177.247.242 -> 244.3.160.239 TCP 64 ndtp > http [ACK] Seq=899 Ack=687 Win=63827 Len=0
862663 284.676367 41.177.247.242 -> 244.3.160.239 TCP 64 ndtp > http [FIN, ACK] Seq=899 Ack=687 Win=63827 Len=0
862902 284.823580 41.177.247.242 -> 244.3.160.239 TCP 66 10698 > http [SYN] Seq=0 Win=64512 Len=0 MSS=1260 SACK_PERM=1
862905 284.824544 41.177.247.242 -> 244.3.160.239 TCP 64 10698 > http [ACK] Seq=1 Ack=1 Win=64512 Len=0
863348 285.039582 41.177.247.242 -> 244.3.160.239 TCP 64 10698 > http [ACK] Seq=981 Ack=555 Win=63959 Len=0
863349 285.039587 41.177.247.242 -> 244.3.160.239 TCP 64 10698 > http [FIN, ACK] Seq=981 Ack=555 Win=63959 Len=0
863353 285.040127 41.177.247.242 -> 244.3.160.239 TCP 66 cp-spxsvr > http [SYN] Seq=0 Win=64512 Len=0 MSS=1260 SACK_PERM=1
863355 285.040807 41.177.247.242 -> 244.3.160.239 TCP 64 cp-spxsvr > http [ACK] Seq=1 Ack=1 Win=64512 Len=0
863640 285.230308 41.177.247.242 -> 244.3.160.239 TCP 64 cp-spxsvr > http [ACK] Seq=846 Ack=957 Win=63557 Len=0
863641 285.230313 41.177.247.242 -> 244.3.160.239 TCP 64 cp-spxsvr > http [FIN, ACK] Seq=846 Ack=957 Win=63557 Len=0
863643 285.230519 41.177.247.242 -> 244.3.160.239 TCP 66 ace-proxy > http [SYN] Seq=0 Win=64512 Len=0 MSS=1260 SACK_PERM=1
863648 285.231310 41.177.247.242 -> 244.3.160.239 TCP 64 ace-proxy > http [ACK] Seq=1 Ack=1 Win=64512 Len=0
863933 285.407757 41.177.247.242 -> 244.3.160.239 TCP 64 ace-proxy > http [ACK] Seq=1074 Ack=1017 Win=63497 Len=0
863934 285.407763 41.177.247.242 -> 244.3.160.239 TCP 64 ace-proxy > http [FIN, ACK] Seq=1074 Ack=1017 Win=63497 Len=0
863954 285.410158 41.177.247.242 -> 244.3.160.239 TCP 66 13440 > https [SYN] Seq=0 Win=64512 Len=0 MSS=1260 SACK_PERM=1
863956 285.410751 41.177.247.242 -> 244.3.160.239 TCP 64 13440 > https [ACK] Seq=1 Ack=1 Win=64512 Len=0
864312 285.547245 41.177.247.242 -> 244.3.160.239 TCP 64 13440 > https [ACK] Seq=193 Ack=3112 Win=64512 Len=0
865726 286.191213 41.177.247.242 -> 244.3.160.239 TCP 64 13440 > https [ACK] Seq=1500 Ack=5383 Win=64512 Len=0
865729 286.192987 41.177.247.242 -> 244.3.160.239 TCP 64 13440 > https [ACK] Seq=1500 Ack=7505 Win=64512 Len=0
865740 286.194997 41.177.247.242 -> 244.3.160.239 TCP 64 13440 > https [ACK] Seq=1500 Ack=9627 Win=64512 Len=0
865747 286.197067 41.177.247.242 -> 244.3.160.239 TCP 64 13440 > https [ACK] Seq=1500 Ack=11749 Win=64512 Len=0
865749 286.198025 41.177.247.242 -> 244.3.160.239 TCP 64 13440 > https [ACK] Seq=1500 Ack=13167 Win=64512 Len=0
865761 286.208541 41.177.247.242 -> 244.3.160.239 TCP 66 5954 > https [SYN] Seq=0 Win=64512 Len=0 MSS=1260 SACK_PERM=1
865763 286.209153 41.177.247.242 -> 244.3.160.239 TCP 64 5954 > https [ACK] Seq=1 Ack=1 Win=64512 Len=0
865987 286.290660 41.177.247.242 -> 244.3.160.239 TCP 64 13440 > https [ACK] Seq=1500 Ack=13205 Win=64475 Len=0
865989 286.290973 41.177.247.242 -> 244.3.160.239 TCP 64 13440 > https [FIN, ACK] Seq=1500 Ack=13205 Win=64475 Len=0
867034 286.627860 41.177.247.242 -> 244.3.160.239 TCP 64 5954 > https [ACK] Seq=945 Ack=2261 Win=64512 Len=0
867036 286.629132 41.177.247.242 -> 244.3.160.239 TCP 64 5954 > https [ACK] Seq=945 Ack=4015 Win=64512 Len=0
867243 286.720962 41.177.247.242 -> 244.3.160.239 TCP 64 5954 > https [ACK] Seq=945 Ack=4053 Win=64475 Len=0
867244 286.721062 41.177.247.242 -> 244.3.160.239 TCP 64 5954 > https [FIN, ACK] Seq=945 Ack=4053 Win=64475 Len=0
867247 286.723268 41.177.247.242 -> 244.3.160.239 TCP 66 4582 > https [SYN] Seq=0 Win=64512 Len=0 MSS=1260 SACK_PERM=1
867249 286.724263 41.177.247.242 -> 244.3.160.239 TCP 66 stss > https [SYN] Seq=0 Win=64512 Len=0 MSS=1260 SACK_PERM=1
867250 286.724268 41.177.247.242 -> 244.3.160.239 TCP 64 4582 > https [ACK] Seq=1 Ack=1 Win=64512 Len=0
867254 286.724719 41.177.247.242 -> 244.3.160.239 TCP 66 7221 > https [SYN] Seq=0 Win=64512 Len=0 MSS=1260 SACK_PERM=1
867256 286.725065 41.177.247.242 -> 244.3.160.239 TCP 64 stss > https [ACK] Seq=1 Ack=1 Win=64512 Len=0
867259 286.725397 41.177.247.242 -> 244.3.160.239 TCP 64 7221 > https [ACK] Seq=1 Ack=1 Win=64512 Len=0
867260 286.725402 41.177.247.242 -> 244.3.160.239 TCP 66 4469 > https [SYN] Seq=0 Win=64512 Len=0 MSS=1260 SACK_PERM=1
867266 286.726021 41.177.247.242 -> 244.3.160.239 TCP 64 4469 > https [ACK] Seq=1 Ack=1 Win=64512 Len=0
869040 287.281326 41.177.247.242 -> 244.3.160.239 TCP 64 4582 > https [ACK] Seq=977 Ack=2319 Win=64512 Len=0
869041 287.281330 41.177.247.242 -> 244.3.160.239 TCP 64 stss > https [ACK] Seq=977 Ack=1745 Win=64512 Len=0
869042 287.281388 41.177.247.242 -> 244.3.160.239 TCP 64 7221 > https [ACK] Seq=961 Ack=575 Win=63938 Len=0
869044 287.281615 41.177.247.242 -> 244.3.160.239 TCP 64 4469 > https [ACK] Seq=977 Ack=655 Win=63858 Len=0
869048 287.281817 41.177.247.242 -> 244.3.160.239 TCP 64 7221 > https [FIN, ACK] Seq=998 Ack=575 Win=63938 Len=0
869051 287.282134 41.177.247.242 -> 244.3.160.239 TCP 64 4469 > https [FIN, ACK] Seq=1014 Ack=655 Win=63858 Len=0
869053 287.282256 41.177.247.242 -> 244.3.160.239 TCP 64 4582 > https [ACK] Seq=977 Ack=4839 Win=64512 Len=0
869054 287.282261 41.177.247.242 -> 244.3.160.239 TCP 64 stss > https [ACK] Seq=977 Ack=3337 Win=64512 Len=0
869058 287.282585 41.177.247.242 -> 244.3.160.239 TCP 64 stss > https [FIN, ACK] Seq=1014 Ack=3337 Win=64512 Len=0
869061 287.282876 41.177.247.242 -> 244.3.160.239 TCP 64 4582 > https [ACK] Seq=977 Ack=7359 Win=64512 Len=0
869062 287.283411 41.177.247.242 -> 244.3.160.239 TCP 64 4582 > https [ACK] Seq=977 Ack=9433 Win=64512 Len=0
869064 287.283817 41.177.247.242 -> 244.3.160.239 TCP 64 4582 > https [FIN, ACK] Seq=1014 Ack=9433 Win=64512 Len=0
869191 287.340954 41.177.247.242 -> 244.3.160.239 TCP 66 sasggprs > https [SYN] Seq=0 Win=64512 Len=0 MSS=1260 SACK_PERM=1
869194 287.341798 41.177.247.242 -> 244.3.160.239 TCP 64 sasggprs > https [ACK] Seq=1 Ack=1 Win=64512 Len=0
869291 287.370788 41.177.247.242 -> 244.3.160.239 TCP 64 4469 > https [RST, ACK] Seq=1015 Ack=692 Win=0 Len=0
869292 287.370793 41.177.247.242 -> 244.3.160.239 TCP 64 7221 > https [RST, ACK] Seq=999 Ack=612 Win=0 Len=0
869492 287.480699 41.177.247.242 -> 244.3.160.239 TCP 64 stss > https [RST, ACK] Seq=1015 Ack=3374 Win=0 Len=0
869493 287.480703 41.177.247.242 -> 244.3.160.239 TCP 64 4582 > https [RST, ACK] Seq=1015 Ack=9470 Win=0 Len=0
870304 287.831138 41.177.247.242 -> 244.3.160.239 TCP 64 sasggprs > https [ACK] Seq=945 Ack=1423 Win=64512 Len=0
870306 287.831313 41.177.247.242 -> 244.3.160.239 TCP 64 sasggprs > https [FIN, ACK] Seq=982 Ack=1423 Win=64512 Len=0
870887 288.020455 41.177.247.242 -> 244.3.160.239 TCP 64 sasggprs > https [RST, ACK] Seq=983 Ack=1460 Win=0 Len=0
893631 295.746091 41.177.247.242 -> 244.3.160.239 TCP 66 9661 > https [SYN] Seq=0 Win=64512 Len=0 MSS=1260 SACK_PERM=1
893645 295.746804 41.177.247.242 -> 244.3.160.239 TCP 64 9661 > https [ACK] Seq=1 Ack=1 Win=64512 Len=0
896416 296.541120 41.177.247.242 -> 244.3.160.239 TCP 64 9661 > https [ACK] Seq=1697 Ack=2351 Win=64512 Len=0
896421 296.542951 41.177.247.242 -> 244.3.160.239 TCP 64 9661 > https [ACK] Seq=1697 Ack=4473 Win=64512 Len=0
896428 296.545044 41.177.247.242 -> 244.3.160.239 TCP 64 9661 > https [ACK] Seq=1697 Ack=6595 Win=64512 Len=0
896433 296.546788 41.177.247.242 -> 244.3.160.239 TCP 64 9661 > https [ACK] Seq=1697 Ack=8717 Win=64512 Len=0
896438 296.548393 41.177.247.242 -> 244.3.160.239 TCP 64 9661 > https [ACK] Seq=1697 Ack=10567 Win=64512 Len=0
896700 296.650609 41.177.247.242 -> 244.3.160.239 TCP 64 9661 > https [ACK] Seq=1697 Ack=10605 Win=64475 Len=0
896701 296.651028 41.177.247.242 -> 244.3.160.239 TCP 64 9661 > https [FIN, ACK] Seq=1697 Ack=10605 Win=64475 Len=0
930953 310.193073 41.177.247.242 -> 244.3.160.239 TCP 66 8594 > https [SYN] Seq=0 Win=64512 Len=0 MSS=1260 SACK_PERM=1
930955 310.193901 41.177.247.242 -> 244.3.160.239 TCP 64 8594 > https [ACK] Seq=1 Ack=1 Win=64512 Len=0
933087 310.830543 41.177.247.242 -> 244.3.160.239 TCP 64 8594 > https [ACK] Seq=1697 Ack=2351 Win=64512 Len=0
933097 310.832569 41.177.247.242 -> 244.3.160.239 TCP 64 8594 > https [ACK] Seq=1697 Ack=4473 Win=64512 Len=0
933101 310.834434 41.177.247.242 -> 244.3.160.239 TCP 64 8594 > https [ACK] Seq=1697 Ack=6595 Win=64512 Len=0
933105 310.836476 41.177.247.242 -> 244.3.160.239 TCP 64 8594 > https [ACK] Seq=1697 Ack=8717 Win=64512 Len=0
933130 310.837921 41.177.247.242 -> 244.3.160.239 TCP 64 8594 > https [ACK] Seq=1697 Ack=10567 Win=64512 Len=0
933178 310.870519 41.177.247.242 -> 244.3.160.239 TCP 64 8594 > https [ACK] Seq=1697 Ack=10605 Win=64475 Len=0
933180 310.870867 41.177.247.242 -> 244.3.160.239 TCP 64 8594 > https [FIN, ACK] Seq=1697 Ack=10605 Win=64475 Len=0
998479 333.787025 41.177.247.242 -> 244.3.160.239 TCP 66 15327 > https [SYN] Seq=0 Win=64512 Len=0 MSS=1260 SACK_PERM=1
998481 333.787790 41.177.247.242 -> 244.3.160.239 TCP 64 15327 > https [ACK] Seq=1 Ack=1 Win=64512 Len=0
999836 334.400865 41.177.247.242 -> 244.3.160.239 TCP 64 15327 > https [ACK] Seq=1697 Ack=2351 Win=64512 Len=0
999839 334.402777 41.177.247.242 -> 244.3.160.239 TCP 64 15327 > https [ACK] Seq=1697 Ack=4473 Win=64512 Len=0
999843 334.404574 41.177.247.242 -> 244.3.160.239 TCP 64 15327 > https [ACK] Seq=1697 Ack=6595 Win=64512 Len=0
999846 334.406495 41.177.247.242 -> 244.3.160.239 TCP 64 15327 > https [ACK] Seq=1697 Ack=8717 Win=64512 Len=0
999849 334.407816 41.177.247.242 -> 244.3.160.239 TCP 64 15327 > https [ACK] Seq=1697 Ack=10567 Win=64512 Len=0
999962 334.480298 41.177.247.242 -> 244.3.160.239 TCP 64 15327 > https [ACK] Seq=1697 Ack=10605 Win=64475 Len=0
999963 334.480303 41.177.247.242 -> 244.3.160.239 TCP 64 15327 > https [FIN, ACK] Seq=1697 Ack=10605 Win=64475 Len=0
1018284 343.314306 41.177.247.242 -> 244.3.160.239 TCP 66 4255 > https [SYN] Seq=0 Win=64512 Len=0 MSS=1260 SACK_PERM=1
1018289 343.315003 41.177.247.242 -> 244.3.160.239 TCP 64 4255 > https [ACK] Seq=1 Ack=1 Win=64512 Len=0
1019718 343.974664 41.177.247.242 -> 244.3.160.239 TCP 64 4255 > https [ACK] Seq=1697 Ack=2351 Win=64512 Len=0
1019726 343.976419 41.177.247.242 -> 244.3.160.239 TCP 64 4255 > https [ACK] Seq=1697 Ack=4473 Win=64512 Len=0
1019729 343.978254 41.177.247.242 -> 244.3.160.239 TCP 64 4255 > https [ACK] Seq=1697 Ack=6595 Win=64512 Len=0
1019732 343.980028 41.177.247.242 -> 244.3.160.239 TCP 64 4255 > https [ACK] Seq=1697 Ack=8717 Win=64512 Len=0
1019735 343.981627 41.177.247.242 -> 244.3.160.239 TCP 64 4255 > https [ACK] Seq=1697 Ack=10567 Win=64512 Len=0
1019753 343.990003 41.177.247.242 -> 244.3.160.239 TCP 64 4255 > https [ACK] Seq=1697 Ack=10605 Win=64475 Len=0
1019754 343.990067 41.177.247.242 -> 244.3.160.239 TCP 64 4255 > https [FIN, ACK] Seq=1697 Ack=10605 Win=64475 Len=0
