631028 199.943714 41.177.34.163 -> 244.3.210.197 TCP 70 36813 > http [SYN] Seq=0 Win=5840 Len=0 MSS=1380 SACK_PERM=1 WS=4
631039 199.944289 41.177.34.163 -> 244.3.210.197 TCP 64 36813 > http [ACK] Seq=1 Ack=1 Win=5840 Len=0
631063 199.949107 41.177.34.163 -> 244.3.210.197 TCP 64 36813 > http [ACK] Seq=770 Ack=351 Win=6912 Len=0
631144 199.964298 41.177.34.163 -> 244.3.210.197 TCP 70 36815 > http [SYN] Seq=0 Win=5840 Len=0 MSS=1380 SACK_PERM=1 WS=4
631157 199.964805 41.177.34.163 -> 244.3.210.197 TCP 64 36815 > http [ACK] Seq=1 Ack=1 Win=5840 Len=0
632267 200.339283 41.177.34.163 -> 244.3.210.197 TCP 64 36815 > http [ACK] Seq=949 Ack=1381 Win=8760 Len=0
632276 200.339482 41.177.34.163 -> 244.3.210.197 TCP 64 36815 > http [ACK] Seq=949 Ack=2761 Win=11680 Len=0
632286 200.340025 41.177.34.163 -> 244.3.210.197 TCP 64 36815 > http [ACK] Seq=949 Ack=4141 Win=14600 Len=0
632294 200.340267 41.177.34.163 -> 244.3.210.197 TCP 64 36815 > http [ACK] Seq=949 Ack=5521 Win=17520 Len=0
632295 200.340385 41.177.34.163 -> 244.3.210.197 TCP 64 36815 > http [ACK] Seq=949 Ack=6901 Win=20440 Len=0
632300 200.340467 41.177.34.163 -> 244.3.210.197 TCP 64 36815 > http [ACK] Seq=949 Ack=8281 Win=23360 Len=0
632316 200.340916 41.177.34.163 -> 244.3.210.197 TCP 64 36815 > http [ACK] Seq=949 Ack=9661 Win=26280 Len=0
632317 200.341015 41.177.34.163 -> 244.3.210.197 TCP 64 36815 > http [ACK] Seq=949 Ack=11041 Win=29200 Len=0
632318 200.341170 41.177.34.163 -> 244.3.210.197 TCP 64 36815 > http [ACK] Seq=949 Ack=12421 Win=32120 Len=0
632319 200.341269 41.177.34.163 -> 244.3.210.197 TCP 64 36815 > http [ACK] Seq=949 Ack=13801 Win=35040 Len=0
632341 200.342057 41.177.34.163 -> 244.3.210.197 TCP 64 36815 > http [ACK] Seq=949 Ack=15181 Win=37960 Len=0
632342 200.342062 41.177.34.163 -> 244.3.210.197 TCP 64 36815 > http [ACK] Seq=949 Ack=15420 Win=37960 Len=0
632421 200.359642 41.177.34.163 -> 244.3.210.197 TCP 64 36815 > http [ACK] Seq=1761 Ack=18180 Win=43800 Len=0
632427 200.359849 41.177.34.163 -> 244.3.210.197 TCP 64 36815 > http [ACK] Seq=1761 Ack=20940 Win=49640 Len=0
632430 200.360061 41.177.34.163 -> 244.3.210.197 TCP 64 36815 > http [ACK] Seq=1761 Ack=23700 Win=55480 Len=0
632434 200.360134 41.177.34.163 -> 244.3.210.197 TCP 64 36815 > http [ACK] Seq=1761 Ack=25801 Win=55876 Len=0
632497 200.369439 41.177.34.163 -> 244.3.210.197 TCP 64 36815 > http [ACK] Seq=2572 Ack=28561 Win=64076 Len=0
632516 200.370413 41.177.34.163 -> 244.3.210.197 TCP 64 36815 > http [ACK] Seq=2572 Ack=39601 Win=64076 Len=0
632532 200.370651 41.177.34.163 -> 244.3.210.197 TCP 64 36815 > http [ACK] Seq=2572 Ack=42361 Win=64076 Len=0
632543 200.370940 41.177.34.163 -> 244.3.210.197 TCP 64 36815 > http [ACK] Seq=2572 Ack=45121 Win=64076 Len=0
632549 200.371105 41.177.34.163 -> 244.3.210.197 TCP 64 36815 > http [ACK] Seq=2572 Ack=47881 Win=64076 Len=0
632564 200.371355 41.177.34.163 -> 244.3.210.197 TCP 64 36815 > http [ACK] Seq=2572 Ack=50641 Win=64076 Len=0
632585 200.372923 41.177.34.163 -> 244.3.210.197 TCP 64 36815 > http [ACK] Seq=2572 Ack=53401 Win=64076 Len=0
632597 200.373365 41.177.34.163 -> 244.3.210.197 TCP 64 36815 > http [ACK] Seq=2572 Ack=56161 Win=64076 Len=0
632600 200.373485 41.177.34.163 -> 244.3.210.197 TCP 64 36815 > http [ACK] Seq=2572 Ack=58921 Win=64076 Len=0
632615 200.373718 41.177.34.163 -> 244.3.210.197 TCP 64 36815 > http [ACK] Seq=2572 Ack=61681 Win=64076 Len=0
632621 200.373943 41.177.34.163 -> 244.3.210.197 TCP 64 36815 > http [ACK] Seq=2572 Ack=64441 Win=64076 Len=0
632632 200.374140 41.177.34.163 -> 244.3.210.197 TCP 64 36815 > http [ACK] Seq=2572 Ack=67201 Win=64076 Len=0
632644 200.374381 41.177.34.163 -> 244.3.210.197 TCP 64 36815 > http [ACK] Seq=2572 Ack=69961 Win=64076 Len=0
632652 200.374660 41.177.34.163 -> 244.3.210.197 TCP 64 36815 > http [ACK] Seq=2572 Ack=72721 Win=64076 Len=0
632660 200.374840 41.177.34.163 -> 244.3.210.197 TCP 64 36815 > http [ACK] Seq=2572 Ack=75481 Win=64076 Len=0
632670 200.375076 41.177.34.163 -> 244.3.210.197 TCP 64 36815 > http [ACK] Seq=2572 Ack=78241 Win=64076 Len=0
632678 200.375291 41.177.34.163 -> 244.3.210.197 TCP 64 36815 > http [ACK] Seq=2572 Ack=81001 Win=64076 Len=0
632694 200.375624 41.177.34.163 -> 244.3.210.197 TCP 64 36815 > http [ACK] Seq=2572 Ack=83761 Win=64076 Len=0
632706 200.376159 41.177.34.163 -> 244.3.210.197 TCP 64 36815 > http [ACK] Seq=2572 Ack=86521 Win=64076 Len=0
632716 200.376432 41.177.34.163 -> 244.3.210.197 TCP 64 36815 > http [ACK] Seq=2572 Ack=89281 Win=64076 Len=0
632726 200.376698 41.177.34.163 -> 244.3.210.197 TCP 64 36815 > http [ACK] Seq=2572 Ack=92041 Win=64076 Len=0
632734 200.377027 41.177.34.163 -> 244.3.210.197 TCP 70 36838 > http [SYN] Seq=0 Win=5840 Len=0 MSS=1380 SACK_PERM=1 WS=4
632735 200.377030 41.177.34.163 -> 244.3.210.197 TCP 64 36815 > http [ACK] Seq=2572 Ack=94801 Win=64076 Len=0
632752 200.377488 41.177.34.163 -> 244.3.210.197 TCP 64 36815 > http [ACK] Seq=2572 Ack=97561 Win=64076 Len=0
632756 200.377690 41.177.34.163 -> 244.3.210.197 TCP 64 36838 > http [ACK] Seq=1 Ack=1 Win=5840 Len=0
632760 200.377921 41.177.34.163 -> 244.3.210.197 TCP 64 36815 > http [ACK] Seq=2572 Ack=100321 Win=64076 Len=0
632775 200.378294 41.177.34.163 -> 244.3.210.197 TCP 64 36815 > http [ACK] Seq=2572 Ack=103081 Win=64076 Len=0
632784 200.379122 41.177.34.163 -> 244.3.210.197 TCP 64 36815 > http [ACK] Seq=2572 Ack=105841 Win=64076 Len=0
632793 200.379510 41.177.34.163 -> 244.3.210.197 TCP 64 36815 > http [ACK] Seq=2572 Ack=108601 Win=64076 Len=0
632816 200.381788 41.177.34.163 -> 244.3.210.197 TCP 64 36815 > http [ACK] Seq=2572 Ack=111361 Win=64076 Len=0
632817 200.381792 41.177.34.163 -> 244.3.210.197 TCP 64 36815 > http [ACK] Seq=2572 Ack=114121 Win=64076 Len=0
632818 200.381797 41.177.34.163 -> 244.3.210.197 TCP 64 36815 > http [ACK] Seq=2572 Ack=116881 Win=64076 Len=0
632819 200.381801 41.177.34.163 -> 244.3.210.197 TCP 64 36815 > http [ACK] Seq=2572 Ack=119641 Win=64076 Len=0
632820 200.381805 41.177.34.163 -> 244.3.210.197 TCP 64 36815 > http [ACK] Seq=2572 Ack=122401 Win=64076 Len=0
632821 200.381814 41.177.34.163 -> 244.3.210.197 TCP 64 36815 > http [ACK] Seq=2572 Ack=125161 Win=64076 Len=0
632822 200.381818 41.177.34.163 -> 244.3.210.197 TCP 64 36815 > http [ACK] Seq=2572 Ack=127921 Win=62776 Len=0
632823 200.381871 41.177.34.163 -> 244.3.210.197 TCP 64 36815 > http [ACK] Seq=2572 Ack=130681 Win=64076 Len=0
632836 200.382062 41.177.34.163 -> 244.3.210.197 TCP 64 36815 > http [ACK] Seq=2572 Ack=133441 Win=64076 Len=0
632858 200.382360 41.177.34.163 -> 244.3.210.197 TCP 64 36815 > http [ACK] Seq=2572 Ack=136201 Win=64076 Len=0
632871 200.382709 41.177.34.163 -> 244.3.210.197 TCP 64 36815 > http [ACK] Seq=2572 Ack=138961 Win=64076 Len=0
632877 200.382971 41.177.34.163 -> 244.3.210.197 TCP 64 36815 > http [ACK] Seq=2572 Ack=141721 Win=64076 Len=0
632878 200.383206 41.177.34.163 -> 244.3.210.197 TCP 64 36815 > http [ACK] Seq=2572 Ack=144481 Win=64076 Len=0
632894 200.384113 41.177.34.163 -> 244.3.210.197 TCP 64 36815 > http [ACK] Seq=2572 Ack=147241 Win=64076 Len=0
632896 200.384426 41.177.34.163 -> 244.3.210.197 TCP 64 36815 > http [ACK] Seq=2572 Ack=150001 Win=64076 Len=0
632902 200.384757 41.177.34.163 -> 244.3.210.197 TCP 64 36815 > http [ACK] Seq=2572 Ack=152761 Win=64076 Len=0
632913 200.385109 41.177.34.163 -> 244.3.210.197 TCP 64 36815 > http [ACK] Seq=2572 Ack=155521 Win=64076 Len=0
632916 200.385366 41.177.34.163 -> 244.3.210.197 TCP 64 36815 > http [ACK] Seq=2572 Ack=158281 Win=64076 Len=0
632920 200.385514 41.177.34.163 -> 244.3.210.197 TCP 64 36815 > http [ACK] Seq=2572 Ack=160126 Win=64076 Len=0
632963 200.388217 41.177.34.163 -> 244.3.210.197 TCP 64 36838 > http [ACK] Seq=803 Ack=1381 Win=8760 Len=0
632964 200.388301 41.177.34.163 -> 244.3.210.197 TCP 64 36838 > http [ACK] Seq=803 Ack=2761 Win=11680 Len=0
632984 200.388949 41.177.34.163 -> 244.3.210.197 TCP 64 36838 > http [ACK] Seq=803 Ack=4141 Win=14600 Len=0
632995 200.389202 41.177.34.163 -> 244.3.210.197 TCP 64 36838 > http [ACK] Seq=803 Ack=5521 Win=17520 Len=0
632996 200.389206 41.177.34.163 -> 244.3.210.197 TCP 64 36838 > http [ACK] Seq=803 Ack=6901 Win=20440 Len=0
632999 200.389361 41.177.34.163 -> 244.3.210.197 TCP 64 36838 > http [ACK] Seq=803 Ack=8281 Win=23360 Len=0
633024 200.390161 41.177.34.163 -> 244.3.210.197 TCP 64 36838 > http [ACK] Seq=803 Ack=9661 Win=26280 Len=0
633026 200.390263 41.177.34.163 -> 244.3.210.197 TCP 64 36838 > http [ACK] Seq=803 Ack=11041 Win=29200 Len=0
633041 200.390782 41.177.34.163 -> 244.3.210.197 TCP 64 36838 > http [ACK] Seq=803 Ack=12421 Win=32120 Len=0
633060 200.392477 41.177.34.163 -> 244.3.210.197 TCP 64 36838 > http [ACK] Seq=803 Ack=13801 Win=35040 Len=0
633061 200.392481 41.177.34.163 -> 244.3.210.197 TCP 64 36838 > http [ACK] Seq=803 Ack=15181 Win=37960 Len=0
633062 200.392485 41.177.34.163 -> 244.3.210.197 TCP 64 36838 > http [ACK] Seq=803 Ack=16561 Win=40880 Len=0
633063 200.392489 41.177.34.163 -> 244.3.210.197 TCP 64 36838 > http [ACK] Seq=803 Ack=17941 Win=43800 Len=0
633064 200.392493 41.177.34.163 -> 244.3.210.197 TCP 64 36838 > http [ACK] Seq=803 Ack=19321 Win=46720 Len=0
633065 200.392497 41.177.34.163 -> 244.3.210.197 TCP 64 36838 > http [ACK] Seq=803 Ack=20701 Win=49640 Len=0
633066 200.392546 41.177.34.163 -> 244.3.210.197 TCP 64 36838 > http [ACK] Seq=803 Ack=22081 Win=52560 Len=0
633067 200.392550 41.177.34.163 -> 244.3.210.197 TCP 64 36838 > http [ACK] Seq=803 Ack=23461 Win=55480 Len=0
633068 200.392555 41.177.34.163 -> 244.3.210.197 TCP 64 36838 > http [ACK] Seq=803 Ack=24841 Win=58400 Len=0
633113 200.393071 41.177.34.163 -> 244.3.210.197 TCP 64 36838 > http [ACK] Seq=803 Ack=26221 Win=61320 Len=0
633123 200.393179 41.177.34.163 -> 244.3.210.197 TCP 64 36838 > http [ACK] Seq=803 Ack=27601 Win=64076 Len=0
633141 200.395082 41.177.34.163 -> 244.3.210.197 TCP 64 36838 > http [ACK] Seq=803 Ack=28981 Win=64076 Len=0
633142 200.395087 41.177.34.163 -> 244.3.210.197 TCP 64 36838 > http [ACK] Seq=803 Ack=30361 Win=64076 Len=0
633146 200.395313 41.177.34.163 -> 244.3.210.197 TCP 64 36838 > http [ACK] Seq=803 Ack=33121 Win=64076 Len=0
633147 200.395318 41.177.34.163 -> 244.3.210.197 TCP 64 36838 > http [ACK] Seq=803 Ack=34243 Win=64076 Len=0
633244 200.429058 41.177.34.163 -> 244.3.210.197 TCP 64 36815 > http [ACK] Seq=3383 Ack=162886 Win=64076 Len=0
633249 200.429241 41.177.34.163 -> 244.3.210.197 TCP 64 36838 > http [ACK] Seq=1611 Ack=37003 Win=64076 Len=0
633294 200.469200 41.177.34.163 -> 244.3.210.197 TCP 64 36815 > http [ACK] Seq=3383 Ack=163427 Win=64076 Len=0
633295 200.469242 41.177.34.163 -> 244.3.210.197 TCP 64 36838 > http [ACK] Seq=1611 Ack=37608 Win=64076 Len=0
633663 200.573015 41.177.34.163 -> 244.3.210.197 TCP 64 36815 > http [ACK] Seq=4198 Ack=166096 Win=64076 Len=0
633746 200.584155 41.177.34.163 -> 244.3.210.197 TCP 64 36838 > http [ACK] Seq=2420 Ack=40368 Win=64076 Len=0
633788 200.585225 41.177.34.163 -> 244.3.210.197 TCP 64 36838 > http [ACK] Seq=2420 Ack=42512 Win=64076 Len=0
633796 200.585849 41.177.34.163 -> 244.3.210.197 TCP 64 36815 > http [ACK] Seq=5007 Ack=168856 Win=64076 Len=0
633813 200.586920 41.177.34.163 -> 244.3.210.197 TCP 64 36815 > http [ACK] Seq=5007 Ack=179896 Win=64076 Len=0
633815 200.587249 41.177.34.163 -> 244.3.210.197 TCP 64 36815 > http [ACK] Seq=5007 Ack=182656 Win=64076 Len=0
633832 200.587895 41.177.34.163 -> 244.3.210.197 TCP 64 36815 > http [ACK] Seq=5007 Ack=185416 Win=64076 Len=0
633833 200.587899 41.177.34.163 -> 244.3.210.197 TCP 64 36815 > http [ACK] Seq=5007 Ack=188176 Win=64076 Len=0
633845 200.588157 41.177.34.163 -> 244.3.210.197 TCP 64 36815 > http [ACK] Seq=5007 Ack=190936 Win=64076 Len=0
633850 200.588360 41.177.34.163 -> 244.3.210.197 TCP 64 36815 > http [ACK] Seq=5007 Ack=193696 Win=64076 Len=0
633861 200.588671 41.177.34.163 -> 244.3.210.197 TCP 64 36815 > http [ACK] Seq=5007 Ack=196456 Win=64076 Len=0
633867 200.588994 41.177.34.163 -> 244.3.210.197 TCP 64 36815 > http [ACK] Seq=5007 Ack=199216 Win=64076 Len=0
633879 200.589362 41.177.34.163 -> 244.3.210.197 TCP 64 36815 > http [ACK] Seq=5007 Ack=201976 Win=64076 Len=0
633888 200.589648 41.177.34.163 -> 244.3.210.197 TCP 64 36815 > http [ACK] Seq=5007 Ack=204239 Win=64076 Len=0
633934 200.596294 41.177.34.163 -> 244.3.210.197 TCP 64 36838 > http [ACK] Seq=3230 Ack=45272 Win=64076 Len=0
633936 200.596392 41.177.34.163 -> 244.3.210.197 TCP 64 36838 > http [ACK] Seq=3230 Ack=48032 Win=64076 Len=0
633948 200.597675 41.177.34.163 -> 244.3.210.197 TCP 64 36838 > http [ACK] Seq=3230 Ack=63212 Win=64076 Len=0
633951 200.597806 41.177.34.163 -> 244.3.210.197 TCP 64 36838 > http [ACK] Seq=3230 Ack=65972 Win=64076 Len=0
633960 200.597994 41.177.34.163 -> 244.3.210.197 TCP 64 36838 > http [ACK] Seq=3230 Ack=68732 Win=64076 Len=0
633978 200.601102 41.177.34.163 -> 244.3.210.197 TCP 64 36838 > http [ACK] Seq=3230 Ack=71492 Win=64076 Len=0
633979 200.601107 41.177.34.163 -> 244.3.210.197 TCP 64 36838 > http [ACK] Seq=3230 Ack=73424 Win=64076 Len=0
634070 200.605605 41.177.34.163 -> 244.3.210.197 TCP 64 36815 > http [ACK] Seq=5817 Ack=206999 Win=64076 Len=0
634080 200.606621 41.177.34.163 -> 244.3.210.197 TCP 64 36815 > http [ACK] Seq=5817 Ack=213899 Win=64076 Len=0
634087 200.606805 41.177.34.163 -> 244.3.210.197 TCP 64 36815 > http [ACK] Seq=5817 Ack=216659 Win=64076 Len=0
634095 200.607151 41.177.34.163 -> 244.3.210.197 TCP 64 36815 > http [ACK] Seq=5817 Ack=219419 Win=64076 Len=0
634101 200.607513 41.177.34.163 -> 244.3.210.197 TCP 64 36815 > http [ACK] Seq=5817 Ack=222179 Win=64076 Len=0
634109 200.607831 41.177.34.163 -> 244.3.210.197 TCP 64 36815 > http [ACK] Seq=5817 Ack=224939 Win=64076 Len=0
634124 200.608126 41.177.34.163 -> 244.3.210.197 TCP 64 36815 > http [ACK] Seq=5817 Ack=227699 Win=64076 Len=0
634132 200.608351 41.177.34.163 -> 244.3.210.197 TCP 64 36815 > http [ACK] Seq=5817 Ack=230459 Win=64076 Len=0
634151 200.609955 41.177.34.163 -> 244.3.210.197 TCP 64 36815 > http [ACK] Seq=5817 Ack=233219 Win=64076 Len=0
634186 200.614879 41.177.34.163 -> 244.3.210.197 TCP 64 36838 > http [ACK] Seq=4038 Ack=76184 Win=64076 Len=0
634196 200.616178 41.177.34.163 -> 244.3.210.197 TCP 64 36838 > http [ACK] Seq=4038 Ack=84093 Win=64076 Len=0
634308 200.642885 41.177.34.163 -> 244.3.210.197 TCP 64 36815 > http [ACK] Seq=6640 Ack=236246 Win=64076 Len=0
634315 200.643325 41.177.34.163 -> 244.3.210.197 TCP 64 36815 > http [ACK] Seq=6640 Ack=238239 Win=64076 Len=0
634441 200.658562 41.177.34.163 -> 244.3.210.197 TCP 64 36838 > http [ACK] Seq=4849 Ack=86791 Win=64076 Len=0
634461 200.661920 41.177.34.163 -> 244.3.210.197 TCP 64 36815 > http [ACK] Seq=7441 Ack=240549 Win=64076 Len=0
634506 200.667848 41.177.34.163 -> 244.3.210.197 TCP 64 36838 > http [ACK] Seq=5662 Ack=89551 Win=64076 Len=0
634518 200.669257 41.177.34.163 -> 244.3.210.197 TCP 64 36838 > http [ACK] Seq=5662 Ack=97866 Win=64076 Len=0
634593 200.683574 41.177.34.163 -> 244.3.210.197 TCP 64 36815 > http [ACK] Seq=8252 Ack=243309 Win=64076 Len=0
634599 200.684679 41.177.34.163 -> 244.3.210.197 TCP 64 36815 > http [ACK] Seq=8252 Ack=250302 Win=64076 Len=0
634655 200.697570 41.177.34.163 -> 244.3.210.197 TCP 64 36838 > http [ACK] Seq=6469 Ack=100626 Win=64076 Len=0
634683 200.698767 41.177.34.163 -> 244.3.210.197 TCP 64 36838 > http [ACK] Seq=6469 Ack=107052 Win=64076 Len=0
634713 200.712033 41.177.34.163 -> 244.3.210.197 TCP 64 36815 > http [ACK] Seq=9060 Ack=253062 Win=64076 Len=0
634791 200.723563 41.177.34.163 -> 244.3.210.197 TCP 64 36838 > http [ACK] Seq=7281 Ack=109812 Win=64076 Len=0
634797 200.724663 41.177.34.163 -> 244.3.210.197 TCP 64 36838 > http [ACK] Seq=7281 Ack=111402 Win=64076 Len=0
634851 200.737296 41.177.34.163 -> 244.3.210.197 TCP 64 36815 > http [ACK] Seq=9866 Ack=256620 Win=64076 Len=0
634869 200.739342 41.177.34.163 -> 244.3.210.197 TCP 64 36815 > http [ACK] Seq=9866 Ack=259380 Win=64076 Len=0
634891 200.740454 41.177.34.163 -> 244.3.210.197 TCP 64 36815 > http [ACK] Seq=9866 Ack=262140 Win=64076 Len=0
634902 200.740756 41.177.34.163 -> 244.3.210.197 TCP 64 36815 > http [ACK] Seq=9866 Ack=264639 Win=64076 Len=0
635051 200.760737 41.177.34.163 -> 244.3.210.197 TCP 64 36838 > http [ACK] Seq=8089 Ack=114162 Win=64076 Len=0
635052 200.760741 41.177.34.163 -> 244.3.210.197 TCP 64 36838 > http [ACK] Seq=8089 Ack=116922 Win=64076 Len=0
635053 200.760811 41.177.34.163 -> 244.3.210.197 TCP 64 36838 > http [ACK] Seq=8089 Ack=119682 Win=64076 Len=0
635073 200.762929 41.177.34.163 -> 244.3.210.197 TCP 64 36838 > http [ACK] Seq=8089 Ack=145902 Win=53116 Len=0
635076 200.763071 41.177.34.163 -> 244.3.210.197 TCP 64 36838 > http [ACK] Seq=8089 Ack=148662 Win=64076 Len=0
635085 200.763240 41.177.34.163 -> 244.3.210.197 TCP 64 36838 > http [ACK] Seq=8089 Ack=151422 Win=64076 Len=0
635086 200.763467 41.177.34.163 -> 244.3.210.197 TCP 64 36838 > http [ACK] Seq=8089 Ack=154182 Win=64076 Len=0
635097 200.763809 41.177.34.163 -> 244.3.210.197 TCP 64 36838 > http [ACK] Seq=8089 Ack=156942 Win=64076 Len=0
635099 200.764056 41.177.34.163 -> 244.3.210.197 TCP 64 36838 > http [ACK] Seq=8089 Ack=159702 Win=64076 Len=0
635104 200.764193 41.177.34.163 -> 244.3.210.197 TCP 64 36838 > http [ACK] Seq=8089 Ack=162462 Win=64076 Len=0
635112 200.764410 41.177.34.163 -> 244.3.210.197 TCP 64 36838 > http [ACK] Seq=8089 Ack=165222 Win=64076 Len=0
635116 200.764660 41.177.34.163 -> 244.3.210.197 TCP 64 36838 > http [ACK] Seq=8089 Ack=167982 Win=64076 Len=0
635122 200.764899 41.177.34.163 -> 244.3.210.197 TCP 64 36838 > http [ACK] Seq=8089 Ack=170742 Win=64076 Len=0
635128 200.765133 41.177.34.163 -> 244.3.210.197 TCP 64 36838 > http [ACK] Seq=8089 Ack=173502 Win=64076 Len=0
635134 200.765349 41.177.34.163 -> 244.3.210.197 TCP 64 36838 > http [ACK] Seq=8089 Ack=175992 Win=64076 Len=0
635214 200.796813 41.177.34.163 -> 244.3.210.197 TCP 64 36815 > http [ACK] Seq=10682 Ack=267399 Win=64076 Len=0
635253 200.797989 41.177.34.163 -> 244.3.210.197 TCP 64 36815 > http [ACK] Seq=10682 Ack=270502 Win=64076 Len=0
635344 200.810367 41.177.34.163 -> 244.3.210.197 TCP 64 36838 > http [ACK] Seq=8901 Ack=178752 Win=69916 Len=0
635421 200.824250 41.177.34.163 -> 244.3.210.197 TCP 64 36815 > http [ACK] Seq=11487 Ack=273262 Win=64076 Len=0
635433 200.825224 41.177.34.163 -> 244.3.210.197 TCP 64 36815 > http [ACK] Seq=11487 Ack=280162 Win=64076 Len=0
635438 200.825403 41.177.34.163 -> 244.3.210.197 TCP 64 36815 > http [ACK] Seq=11487 Ack=281835 Win=64076 Len=0
635514 200.840000 41.177.34.163 -> 244.3.210.197 TCP 64 36838 > http [ACK] Seq=9734 Ack=182209 Win=75756 Len=0
635520 200.840225 41.177.34.163 -> 244.3.210.197 TCP 64 36838 > http [ACK] Seq=9734 Ack=184969 Win=81596 Len=0
635528 200.840482 41.177.34.163 -> 244.3.210.197 TCP 64 36838 > http [ACK] Seq=9734 Ack=187729 Win=87436 Len=0
635531 200.840685 41.177.34.163 -> 244.3.210.197 TCP 64 36838 > http [ACK] Seq=9734 Ack=190489 Win=93276 Len=0
635547 200.840929 41.177.34.163 -> 244.3.210.197 TCP 64 36838 > http [ACK] Seq=9734 Ack=193249 Win=99116 Len=0
635553 200.841204 41.177.34.163 -> 244.3.210.197 TCP 64 36838 > http [ACK] Seq=9734 Ack=196009 Win=104956 Len=0
635557 200.841455 41.177.34.163 -> 244.3.210.197 TCP 64 36838 > http [ACK] Seq=9734 Ack=198769 Win=110796 Len=0
635563 200.841553 41.177.34.163 -> 244.3.210.197 TCP 64 36838 > http [ACK] Seq=9734 Ack=201529 Win=116636 Len=0
635571 200.841822 41.177.34.163 -> 244.3.210.197 TCP 64 36838 > http [ACK] Seq=9734 Ack=204289 Win=122476 Len=0
635577 200.842109 41.177.34.163 -> 244.3.210.197 TCP 64 36838 > http [ACK] Seq=9734 Ack=207049 Win=128316 Len=0
635581 200.842359 41.177.34.163 -> 244.3.210.197 TCP 64 36838 > http [ACK] Seq=9734 Ack=209809 Win=129180 Len=0
635584 200.842578 41.177.34.163 -> 244.3.210.197 TCP 64 36838 > http [ACK] Seq=9734 Ack=212569 Win=129180 Len=0
635588 200.842792 41.177.34.163 -> 244.3.210.197 TCP 64 36838 > http [ACK] Seq=9734 Ack=215329 Win=129180 Len=0
635597 200.842985 41.177.34.163 -> 244.3.210.197 TCP 64 36838 > http [ACK] Seq=9734 Ack=218060 Win=129180 Len=0
635613 200.843501 41.177.34.163 -> 244.3.210.197 TCP 64 36815 > http [ACK] Seq=12317 Ack=284595 Win=64076 Len=0
635620 200.844223 41.177.34.163 -> 244.3.210.197 TCP 64 36815 > http [ACK] Seq=12317 Ack=288735 Win=64076 Len=0
635629 200.844357 41.177.34.163 -> 244.3.210.197 TCP 64 36815 > http [ACK] Seq=12317 Ack=291495 Win=64076 Len=0
635647 200.844704 41.177.34.163 -> 244.3.210.197 TCP 64 36815 > http [ACK] Seq=12317 Ack=294255 Win=64076 Len=0
635695 200.856327 41.177.34.163 -> 244.3.210.197 TCP 64 36838 > http [ACK] Seq=10566 Ack=220820 Win=129180 Len=0
635708 200.857381 41.177.34.163 -> 244.3.210.197 TCP 64 36838 > http [ACK] Seq=10566 Ack=231100 Win=129180 Len=0
635752 200.874535 41.177.34.163 -> 244.3.210.197 TCP 64 36838 > http [ACK] Seq=12197 Ack=233219 Win=129180 Len=0
635767 200.877946 41.177.34.163 -> 244.3.210.197 TCP 64 36815 > http [ACK] Seq=14743 Ack=298168 Win=64076 Len=0
635794 200.882135 41.177.34.163 -> 244.3.210.197 TCP 64 36838 > http [ACK] Seq=13007 Ack=235879 Win=129180 Len=0
635849 200.887872 41.177.34.163 -> 244.3.210.197 TCP 64 36815 > http [ACK] Seq=15552 Ack=300928 Win=64076 Len=0
635874 200.889663 41.177.34.163 -> 244.3.210.197 TCP 64 36838 > http [ACK] Seq=13815 Ack=238639 Win=129180 Len=0
635888 200.890596 41.177.34.163 -> 244.3.210.197 TCP 64 36838 > http [ACK] Seq=13815 Ack=240867 Win=129180 Len=0
635939 200.895408 41.177.34.163 -> 244.3.210.197 TCP 64 36815 > http [ACK] Seq=16361 Ack=303742 Win=64076 Len=0
635954 200.896525 41.177.34.163 -> 244.3.210.197 TCP 64 36815 > http [ACK] Seq=16361 Ack=305714 Win=64076 Len=0
636011 200.901498 41.177.34.163 -> 244.3.210.197 TCP 64 36838 > http [ACK] Seq=14635 Ack=243450 Win=129180 Len=0
636054 200.905852 41.177.34.163 -> 244.3.210.197 TCP 64 36815 > http [ACK] Seq=17180 Ack=308474 Win=64076 Len=0
636055 200.905855 41.177.34.163 -> 244.3.210.197 TCP 64 36815 > http [ACK] Seq=17180 Ack=310769 Win=64076 Len=0
636108 200.910167 41.177.34.163 -> 244.3.210.197 TCP 64 36838 > http [ACK] Seq=15454 Ack=246210 Win=129180 Len=0
636120 200.911316 41.177.34.163 -> 244.3.210.197 TCP 64 36838 > http [ACK] Seq=15454 Ack=253357 Win=129180 Len=0
636223 200.924622 41.177.34.163 -> 244.3.210.197 TCP 64 36815 > http [ACK] Seq=17995 Ack=313511 Win=64076 Len=0
636394 200.948255 41.177.34.163 -> 244.3.210.197 TCP 64 36815 > http [ACK] Seq=19641 Ack=316668 Win=64076 Len=0
636715 201.001583 41.177.34.163 -> 244.3.210.197 TCP 64 36838 > http [ACK] Seq=19583 Ack=255627 Win=129180 Len=0
636729 201.005654 41.177.34.163 -> 244.3.210.197 TCP 64 36815 > http [ACK] Seq=21268 Ack=318023 Win=64076 Len=0
644139 202.710682 41.177.34.163 -> 244.3.210.197 TCP 64 36838 > http [ACK] Seq=20687 Ack=257007 Win=129180 Len=0
644143 202.710853 41.177.34.163 -> 244.3.210.197 TCP 64 36838 > http [ACK] Seq=20687 Ack=258387 Win=129180 Len=0
644150 202.710913 41.177.34.163 -> 244.3.210.197 TCP 64 36838 > http [ACK] Seq=20687 Ack=259767 Win=128312 Len=0
644157 202.711119 41.177.34.163 -> 244.3.210.197 TCP 64 36838 > http [ACK] Seq=20687 Ack=261147 Win=126932 Len=0
644165 202.711384 41.177.34.163 -> 244.3.210.197 TCP 64 36838 > http [ACK] Seq=20687 Ack=262527 Win=125552 Len=0
644170 202.711568 41.177.34.163 -> 244.3.210.197 TCP 64 36838 > http [ACK] Seq=20687 Ack=263907 Win=124172 Len=0
644176 202.711823 41.177.34.163 -> 244.3.210.197 TCP 64 36838 > http [ACK] Seq=20687 Ack=265287 Win=122792 Len=0
644181 202.711985 41.177.34.163 -> 244.3.210.197 TCP 64 36838 > http [ACK] Seq=20687 Ack=266667 Win=121412 Len=0
644188 202.712165 41.177.34.163 -> 244.3.210.197 TCP 64 36838 > http [ACK] Seq=20687 Ack=268047 Win=120032 Len=0
644194 202.712370 41.177.34.163 -> 244.3.210.197 TCP 64 36838 > http [ACK] Seq=20687 Ack=269427 Win=118652 Len=0
644197 202.712570 41.177.34.163 -> 244.3.210.197 TCP 64 36838 > http [ACK] Seq=20687 Ack=270807 Win=117272 Len=0
644201 202.712716 41.177.34.163 -> 244.3.210.197 TCP 64 36838 > http [ACK] Seq=20687 Ack=272187 Win=115892 Len=0
644206 202.712922 41.177.34.163 -> 244.3.210.197 TCP 64 36838 > http [ACK] Seq=20687 Ack=273567 Win=114512 Len=0
644214 202.713161 41.177.34.163 -> 244.3.210.197 TCP 64 36838 > http [ACK] Seq=20687 Ack=274947 Win=128312 Len=0
644217 202.713225 41.177.34.163 -> 244.3.210.197 TCP 64 36838 > http [ACK] Seq=20687 Ack=275056 Win=129180 Len=0
645042 202.922936 41.177.34.163 -> 244.3.210.197 TCP 64 36815 > http [ACK] Seq=22166 Ack=319403 Win=64076 Len=0
645049 202.923151 41.177.34.163 -> 244.3.210.197 TCP 64 36815 > http [ACK] Seq=22166 Ack=320783 Win=64076 Len=0
645050 202.923309 41.177.34.163 -> 244.3.210.197 TCP 64 36815 > http [ACK] Seq=22166 Ack=322163 Win=62776 Len=0
645058 202.923499 41.177.34.163 -> 244.3.210.197 TCP 64 36815 > http [ACK] Seq=22166 Ack=323543 Win=61396 Len=0
645063 202.923748 41.177.34.163 -> 244.3.210.197 TCP 64 36815 > http [ACK] Seq=22166 Ack=324923 Win=60016 Len=0
645070 202.923900 41.177.34.163 -> 244.3.210.197 TCP 64 36815 > http [ACK] Seq=22166 Ack=326303 Win=58636 Len=0
645076 202.924098 41.177.34.163 -> 244.3.210.197 TCP 64 36815 > http [ACK] Seq=22166 Ack=327683 Win=57256 Len=0
645082 202.924261 41.177.34.163 -> 244.3.210.197 TCP 64 36815 > http [ACK] Seq=22166 Ack=329063 Win=64076 Len=0
645091 202.924404 41.177.34.163 -> 244.3.210.197 TCP 64 36815 > http [ACK] Seq=22166 Ack=330443 Win=64076 Len=0
645093 202.924553 41.177.34.163 -> 244.3.210.197 TCP 64 36815 > http [ACK] Seq=22166 Ack=331823 Win=64076 Len=0
645100 202.924802 41.177.34.163 -> 244.3.210.197 TCP 64 36815 > http [ACK] Seq=22166 Ack=333203 Win=64076 Len=0
645111 202.925002 41.177.34.163 -> 244.3.210.197 TCP 64 36815 > http [ACK] Seq=22166 Ack=334583 Win=64076 Len=0
645113 202.925142 41.177.34.163 -> 244.3.210.197 TCP 64 36815 > http [ACK] Seq=22166 Ack=335963 Win=64076 Len=0
645119 202.925306 41.177.34.163 -> 244.3.210.197 TCP 64 36815 > http [ACK] Seq=22166 Ack=337343 Win=64076 Len=0
645121 202.925453 41.177.34.163 -> 244.3.210.197 TCP 64 36815 > http [ACK] Seq=22166 Ack=338723 Win=64076 Len=0
645125 202.925616 41.177.34.163 -> 244.3.210.197 TCP 64 36815 > http [ACK] Seq=22166 Ack=340103 Win=64076 Len=0
645157 202.926259 41.177.34.163 -> 244.3.210.197 TCP 64 36815 > http [ACK] Seq=22166 Ack=342863 Win=64076 Len=0
645159 202.926348 41.177.34.163 -> 244.3.210.197 TCP 64 36838 > http [ACK] Seq=21573 Ack=277816 Win=129180 Len=0
645162 202.926651 41.177.34.163 -> 244.3.210.197 TCP 64 36815 > http [ACK] Seq=22166 Ack=344145 Win=64076 Len=0
645173 202.927121 41.177.34.163 -> 244.3.210.197 TCP 64 36838 > http [ACK] Seq=21573 Ack=283336 Win=129180 Len=0
645174 202.927327 41.177.34.163 -> 244.3.210.197 TCP 64 36838 > http [ACK] Seq=21573 Ack=286096 Win=129180 Len=0
645180 202.927560 41.177.34.163 -> 244.3.210.197 TCP 64 36838 > http [ACK] Seq=21573 Ack=288856 Win=129180 Len=0
645181 202.927564 41.177.34.163 -> 244.3.210.197 TCP 64 36838 > http [ACK] Seq=21573 Ack=289191 Win=129180 Len=0
645303 202.950861 41.177.34.163 -> 244.3.210.197 TCP 64 36815 > http [ACK] Seq=23073 Ack=346905 Win=64076 Len=0
645309 202.951595 41.177.34.163 -> 244.3.210.197 TCP 64 36815 > http [ACK] Seq=23073 Ack=348945 Win=64076 Len=0
645384 202.963996 41.177.34.163 -> 244.3.210.197 TCP 64 36838 > http [ACK] Seq=22478 Ack=291531 Win=129180 Len=0
645428 202.975521 41.177.34.163 -> 244.3.210.197 TCP 64 36815 > http [ACK] Seq=23978 Ack=351038 Win=64076 Len=0
645515 202.996368 41.177.34.163 -> 244.3.210.197 TCP 64 36815 > http [ACK] Seq=24883 Ack=353126 Win=64076 Len=0
645550 203.000517 41.177.34.163 -> 244.3.210.197 TCP 64 36838 > http [ACK] Seq=24259 Ack=294076 Win=129180 Len=0
645607 203.012936 41.177.34.163 -> 244.3.210.197 TCP 64 36815 > http [ACK] Seq=25788 Ack=355098 Win=64076 Len=0
645627 203.015881 41.177.34.163 -> 244.3.210.197 TCP 64 36838 > http [ACK] Seq=25139 Ack=296836 Win=129180 Len=0
645639 203.016699 41.177.34.163 -> 244.3.210.197 TCP 64 36838 > http [ACK] Seq=25139 Ack=298644 Win=129180 Len=0
645682 203.040763 41.177.34.163 -> 244.3.210.197 TCP 64 36815 > http [ACK] Seq=26693 Ack=357176 Win=64076 Len=0
645907 203.123057 41.177.34.163 -> 244.3.210.197 TCP 64 36838 > http [ACK] Seq=26023 Ack=301404 Win=129180 Len=0
645914 203.124176 41.177.34.163 -> 244.3.210.197 TCP 64 36838 > http [ACK] Seq=26023 Ack=312444 Win=129180 Len=0
645915 203.124354 41.177.34.163 -> 244.3.210.197 TCP 64 36838 > http [ACK] Seq=26023 Ack=315204 Win=129180 Len=0
645921 203.124588 41.177.34.163 -> 244.3.210.197 TCP 64 36838 > http [ACK] Seq=26023 Ack=317964 Win=129180 Len=0
645927 203.124759 41.177.34.163 -> 244.3.210.197 TCP 64 36838 > http [ACK] Seq=26023 Ack=319516 Win=129180 Len=0
691565 218.197470 41.177.34.163 -> 244.3.210.197 TCP 64 36813 > http [FIN, ACK] Seq=770 Ack=351 Win=6912 Len=0
691566 218.197475 41.177.34.163 -> 244.3.210.197 TCP 64 36813 > http [RST, ACK] Seq=771 Ack=351 Win=6912 Len=0
691576 218.197740 41.177.34.163 -> 244.3.210.197 TCP 64 36815 > http [FIN, ACK] Seq=26693 Ack=357176 Win=64076 Len=0
691577 218.197744 41.177.34.163 -> 244.3.210.197 TCP 64 36815 > http [RST, ACK] Seq=26694 Ack=357176 Win=64076 Len=0
691581 218.197873 41.177.34.163 -> 244.3.210.197 TCP 64 36838 > http [FIN, ACK] Seq=26023 Ack=319516 Win=129180 Len=0
691582 218.197877 41.177.34.163 -> 244.3.210.197 TCP 64 36838 > http [RST, ACK] Seq=26024 Ack=319516 Win=129180 Len=0
698001 221.214083 41.177.34.163 -> 41.177.98.176 TCP 70 46388 > http [SYN] Seq=0 Win=5840 Len=0 MSS=1380 SACK_PERM=1 WS=4
698003 221.215549 41.177.34.163 -> 41.177.98.176 TCP 64 46388 > http [ACK] Seq=1 Ack=1 Win=5840 Len=0
701866 223.069511 41.177.34.163 -> 41.177.98.176 TCP 64 46388 > http [ACK] Seq=696 Ack=1381 Win=8760 Len=0
701867 223.069516 41.177.34.163 -> 41.177.98.176 TCP 64 46388 > http [ACK] Seq=696 Ack=2761 Win=11680 Len=0
701868 223.069520 41.177.34.163 -> 41.177.98.176 TCP 64 46388 > http [ACK] Seq=696 Ack=4141 Win=14600 Len=0
701876 223.070535 41.177.34.163 -> 41.177.98.176 TCP 64 46388 > http [ACK] Seq=696 Ack=5335 Win=17360 Len=0
701893 223.073885 41.177.34.163 -> 41.177.98.176 TCP 64 46388 > http [ACK] Seq=696 Ack=6715 Win=20280 Len=0
701895 223.073996 41.177.34.163 -> 41.177.98.176 TCP 64 46388 > http [ACK] Seq=696 Ack=8095 Win=23200 Len=0
701896 223.074148 41.177.34.163 -> 41.177.98.176 TCP 64 46388 > http [ACK] Seq=696 Ack=9475 Win=26120 Len=0
701897 223.074153 41.177.34.163 -> 41.177.98.176 TCP 64 46388 > http [ACK] Seq=696 Ack=9625 Win=28880 Len=0
701898 223.074158 41.177.34.163 -> 41.177.98.176 TCP 64 46388 > http [ACK] Seq=696 Ack=9630 Win=28880 Len=0
702028 223.101762 41.177.34.163 -> 41.177.98.176 TCP 70 46490 > http [SYN] Seq=0 Win=5840 Len=0 MSS=1380 SACK_PERM=1 WS=4
702030 223.102290 41.177.34.163 -> 41.177.98.176 TCP 64 46490 > http [ACK] Seq=1 Ack=1 Win=5840 Len=0
702040 223.106702 41.177.34.163 -> 41.177.98.176 TCP 64 46490 > http [ACK] Seq=483 Ack=719 Win=7276 Len=0
702053 223.124255 41.177.34.163 -> 41.177.98.176 TCP 64 46388 > http [ACK] Seq=1179 Ack=12390 Win=34720 Len=0
702054 223.124727 41.177.34.163 -> 41.177.98.176 TCP 64 46388 > http [ACK] Seq=1179 Ack=15108 Win=40400 Len=0
702072 223.155612 41.177.34.163 -> 41.177.98.176 TCP 64 46490 > http [ACK] Seq=975 Ack=1835 Win=9508 Len=0
702133 223.174111 41.177.34.163 -> 41.177.98.176 TCP 64 46490 > http [ACK] Seq=1456 Ack=2145 Win=11740 Len=0
702137 223.174676 41.177.34.163 -> 41.177.98.176 TCP 64 46490 > http [ACK] Seq=1456 Ack=3525 Win=14660 Len=0
702140 223.175024 41.177.34.163 -> 41.177.98.176 TCP 64 46490 > http [ACK] Seq=1456 Ack=4905 Win=17580 Len=0
702142 223.175079 41.177.34.163 -> 41.177.98.176 TCP 70 [TCP Dup ACK 702140#1] 46490 > http [ACK] Seq=1456 Ack=4905 Win=17580 Len=0 SLE=9045 SRE=10425
702146 223.175560 41.177.34.163 -> 41.177.98.176 TCP 70 46490 > http [ACK] Seq=1456 Ack=6285 Win=20500 Len=0 SLE=9045 SRE=10425
702147 223.175999 41.177.34.163 -> 41.177.98.176 TCP 70 46490 > http [ACK] Seq=1456 Ack=7665 Win=23420 Len=0 SLE=9045 SRE=10425
702155 223.180773 41.177.34.163 -> 41.177.98.176 TCP 64 46490 > http [ACK] Seq=1456 Ack=10425 Win=26340 Len=0
702156 223.180821 41.177.34.163 -> 41.177.98.176 TCP 64 46490 > http [ACK] Seq=1456 Ack=11805 Win=29260 Len=0
702158 223.181074 41.177.34.163 -> 41.177.98.176 TCP 64 46490 > http [ACK] Seq=1456 Ack=13185 Win=32180 Len=0
702165 223.182114 41.177.34.163 -> 41.177.98.176 TCP 64 46490 > http [ACK] Seq=1456 Ack=14565 Win=35100 Len=0
702169 223.182415 41.177.34.163 -> 41.177.98.176 TCP 64 46490 > http [ACK] Seq=1456 Ack=15945 Win=38020 Len=0
702176 223.183468 41.177.34.163 -> 41.177.98.176 TCP 70 [TCP Dup ACK 702169#1] 46490 > http [ACK] Seq=1456 Ack=15945 Win=38020 Len=0 SLE=31125 SRE=32505
702177 223.183472 41.177.34.163 -> 41.177.98.176 TCP 70 46490 > http [ACK] Seq=1456 Ack=17325 Win=40940 Len=0 SLE=31125 SRE=32505
702180 223.183847 41.177.34.163 -> 41.177.98.176 TCP 70 46490 > http [ACK] Seq=1456 Ack=18705 Win=43860 Len=0 SLE=31125 SRE=32505
702182 223.184101 41.177.34.163 -> 41.177.98.176 TCP 70 46490 > http [ACK] Seq=1456 Ack=20085 Win=46780 Len=0 SLE=31125 SRE=32505
702183 223.184105 41.177.34.163 -> 41.177.98.176 TCP 70 46490 > http [ACK] Seq=1456 Ack=21465 Win=49700 Len=0 SLE=31125 SRE=32505
702191 223.186897 41.177.34.163 -> 41.177.98.176 TCP 70 46490 > http [ACK] Seq=1456 Ack=22845 Win=52620 Len=0 SLE=31125 SRE=32505
702192 223.186902 41.177.34.163 -> 41.177.98.176 TCP 70 46490 > http [ACK] Seq=1456 Ack=24225 Win=55540 Len=0 SLE=31125 SRE=32505
702193 223.186985 41.177.34.163 -> 41.177.98.176 TCP 70 46490 > http [ACK] Seq=1456 Ack=25605 Win=58460 Len=0 SLE=31125 SRE=32505
702195 223.187118 41.177.34.163 -> 41.177.98.176 TCP 70 46490 > http [ACK] Seq=1456 Ack=26985 Win=61380 Len=0 SLE=31125 SRE=32505
702198 223.187290 41.177.34.163 -> 41.177.98.176 TCP 70 46490 > http [ACK] Seq=1456 Ack=28365 Win=64076 Len=0 SLE=31125 SRE=32505
702199 223.187295 41.177.34.163 -> 41.177.98.176 TCP 70 46490 > http [ACK] Seq=1456 Ack=29745 Win=62776 Len=0 SLE=31125 SRE=32505
702203 223.187642 41.177.34.163 -> 41.177.98.176 TCP 64 46490 > http [ACK] Seq=1456 Ack=32505 Win=64076 Len=0
702205 223.187811 41.177.34.163 -> 41.177.98.176 TCP 64 46490 > http [ACK] Seq=1456 Ack=33885 Win=64076 Len=0
702211 223.188378 41.177.34.163 -> 41.177.98.176 TCP 64 46490 > http [ACK] Seq=1456 Ack=35265 Win=64076 Len=0
702212 223.188503 41.177.34.163 -> 41.177.98.176 TCP 64 46490 > http [ACK] Seq=1456 Ack=36645 Win=64076 Len=0
702214 223.189304 41.177.34.163 -> 41.177.98.176 TCP 64 46490 > http [ACK] Seq=1456 Ack=38025 Win=64076 Len=0
702215 223.189308 41.177.34.163 -> 41.177.98.176 TCP 64 46490 > http [ACK] Seq=1456 Ack=39405 Win=64076 Len=0
702216 223.189312 41.177.34.163 -> 41.177.98.176 TCP 64 46490 > http [ACK] Seq=1456 Ack=40785 Win=64076 Len=0
702217 223.189316 41.177.34.163 -> 41.177.98.176 TCP 64 46490 > http [ACK] Seq=1456 Ack=42165 Win=64076 Len=0
702218 223.189407 41.177.34.163 -> 41.177.98.176 TCP 64 46490 > http [ACK] Seq=1456 Ack=43545 Win=64076 Len=0
702219 223.189506 41.177.34.163 -> 41.177.98.176 TCP 64 46490 > http [ACK] Seq=1456 Ack=44925 Win=64076 Len=0
702220 223.189600 41.177.34.163 -> 41.177.98.176 TCP 64 46490 > http [ACK] Seq=1456 Ack=46305 Win=64076 Len=0
702227 223.191299 41.177.34.163 -> 41.177.98.176 TCP 64 46490 > http [ACK] Seq=1456 Ack=47685 Win=66996 Len=0
702231 223.192990 41.177.34.163 -> 41.177.98.176 TCP 64 46490 > http [ACK] Seq=1456 Ack=49065 Win=69916 Len=0
702232 223.193434 41.177.34.163 -> 41.177.98.176 TCP 64 46490 > http [ACK] Seq=1456 Ack=50445 Win=72836 Len=0
702233 223.193439 41.177.34.163 -> 41.177.98.176 TCP 64 46490 > http [ACK] Seq=1456 Ack=51825 Win=75756 Len=0
702234 223.193639 41.177.34.163 -> 41.177.98.176 TCP 64 46490 > http [ACK] Seq=1456 Ack=53205 Win=77280 Len=0
702235 223.194335 41.177.34.163 -> 41.177.98.176 TCP 64 46490 > http [ACK] Seq=1456 Ack=55965 Win=77280 Len=0
702236 223.194340 41.177.34.163 -> 41.177.98.176 TCP 64 46490 > http [ACK] Seq=1456 Ack=58725 Win=77280 Len=0
702237 223.194407 41.177.34.163 -> 41.177.98.176 TCP 64 46490 > http [ACK] Seq=1456 Ack=61503 Win=77280 Len=0
702362 223.271594 41.177.34.163 -> 41.177.98.176 TCP 64 46490 > http [ACK] Seq=1936 Ack=61812 Win=77280 Len=0
702365 223.271926 41.177.34.163 -> 41.177.98.176 TCP 64 46490 > http [ACK] Seq=1936 Ack=64572 Win=77280 Len=0
702369 223.272678 41.177.34.163 -> 41.177.98.176 TCP 64 46490 > http [ACK] Seq=1936 Ack=69237 Win=77280 Len=0
702372 223.278268 41.177.34.163 -> 41.177.98.176 TCP 64 46388 > http [ACK] Seq=1670 Ack=15938 Win=43160 Len=0
702386 223.286353 41.177.34.163 -> 41.177.98.176 TCP 64 46388 > http [ACK] Seq=2157 Ack=16247 Win=43160 Len=0
702387 223.286594 41.177.34.163 -> 41.177.98.176 TCP 64 46388 > http [ACK] Seq=2157 Ack=17627 Win=46080 Len=0
702388 223.286830 41.177.34.163 -> 41.177.98.176 TCP 64 46388 > http [ACK] Seq=2157 Ack=19007 Win=49000 Len=0
702389 223.287077 41.177.34.163 -> 41.177.98.176 TCP 64 46388 > http [ACK] Seq=2157 Ack=20387 Win=51920 Len=0
702390 223.287082 41.177.34.163 -> 41.177.98.176 TCP 64 46388 > http [ACK] Seq=2157 Ack=21630 Win=54680 Len=0
702407 223.302632 41.177.34.163 -> 41.177.98.176 TCP 64 46490 > http [ACK] Seq=2429 Ack=70927 Win=77280 Len=0
702412 223.304178 41.177.34.163 -> 41.177.98.176 TCP 64 46490 > http [ACK] Seq=2429 Ack=73687 Win=77280 Len=0
702414 223.304968 41.177.34.163 -> 41.177.98.176 TCP 64 46490 > http [ACK] Seq=2429 Ack=76447 Win=77280 Len=0
702415 223.305113 41.177.34.163 -> 41.177.98.176 TCP 64 46490 > http [ACK] Seq=2429 Ack=79119 Win=77280 Len=0
702489 223.324453 41.177.34.163 -> 41.177.98.176 TCP 64 46388 > http [ACK] Seq=2648 Ack=24390 Win=60520 Len=0
702490 223.324542 41.177.34.163 -> 41.177.98.176 TCP 64 46388 > http [ACK] Seq=2648 Ack=26866 Win=61396 Len=0
702519 223.340094 41.177.34.163 -> 41.177.98.176 TCP 64 46490 > http [ACK] Seq=2931 Ack=81636 Win=77280 Len=0
702520 223.340776 41.177.34.163 -> 41.177.98.176 TCP 64 46490 > http [ACK] Seq=2931 Ack=84396 Win=77280 Len=0
702521 223.340993 41.177.34.163 -> 41.177.98.176 TCP 64 46490 > http [ACK] Seq=2931 Ack=87156 Win=77280 Len=0
702522 223.341379 41.177.34.163 -> 41.177.98.176 TCP 64 46490 > http [ACK] Seq=2931 Ack=89533 Win=77280 Len=0
702556 223.362253 41.177.34.163 -> 41.177.98.176 TCP 64 46388 > http [ACK] Seq=3151 Ack=28964 Win=64076 Len=0
702580 223.374313 41.177.34.163 -> 41.177.98.176 TCP 64 46490 > http [ACK] Seq=3417 Ack=91222 Win=77280 Len=0
702581 223.374318 41.177.34.163 -> 41.177.98.176 TCP 64 46490 > http [ACK] Seq=3417 Ack=93982 Win=77280 Len=0
702609 223.391547 41.177.34.163 -> 41.177.98.176 TCP 64 46388 > http [ACK] Seq=3636 Ack=30654 Win=64076 Len=0
702626 223.392704 41.177.34.163 -> 41.177.98.176 TCP 64 46388 > http [ACK] Seq=3636 Ack=37466 Win=64076 Len=0
702629 223.393771 41.177.34.163 -> 41.177.98.176 TCP 64 46388 > http [ACK] Seq=3636 Ack=40226 Win=64076 Len=0
702630 223.393776 41.177.34.163 -> 41.177.98.176 TCP 64 46388 > http [ACK] Seq=3636 Ack=42986 Win=64076 Len=0
702663 223.407426 41.177.34.163 -> 41.177.98.176 TCP 64 46490 > http [ACK] Seq=3900 Ack=96830 Win=77280 Len=0
702725 223.434350 41.177.34.163 -> 41.177.98.176 TCP 64 46388 > http [ACK] Seq=3636 Ack=44169 Win=64076 Len=0
702757 223.447203 41.177.34.163 -> 41.177.98.176 TCP 64 46490 > http [ACK] Seq=3900 Ack=104463 Win=69644 Len=0
703247 223.648319 41.177.34.163 -> 41.177.98.176 TCP 64 46388 > http [ACK] Seq=4117 Ack=44496 Win=64076 Len=0
703264 223.661655 41.177.34.163 -> 41.177.98.176 TCP 64 46490 > http [ACK] Seq=4383 Ack=105564 Win=77280 Len=0
703347 223.705846 41.177.34.163 -> 41.177.98.176 TCP 64 46388 > http [ACK] Seq=4601 Ack=44831 Win=64076 Len=0
703353 223.707422 41.177.34.163 -> 41.177.98.176 TCP 64 46490 > http [ACK] Seq=4754 Ack=105857 Win=77280 Len=0
703354 223.708394 41.177.34.163 -> 41.177.98.176 TCP 64 46490 > http [FIN, ACK] Seq=4754 Ack=105857 Win=77280 Len=0
703357 223.709066 41.177.34.163 -> 41.177.98.176 TCP 64 46490 > http [ACK] Seq=4755 Ack=105858 Win=77280 Len=0
741054 236.711440 41.177.34.163 -> 41.177.98.176 TCP 64 46388 > http [ACK] Seq=5536 Ack=46211 Win=64076 Len=0
741055 236.711775 41.177.34.163 -> 41.177.98.176 TCP 64 46388 > http [ACK] Seq=5536 Ack=47591 Win=64076 Len=0
741056 236.711879 41.177.34.163 -> 41.177.98.176 TCP 64 46388 > http [ACK] Seq=5536 Ack=48971 Win=62776 Len=0
741057 236.712027 41.177.34.163 -> 41.177.98.176 TCP 64 46388 > http [ACK] Seq=5536 Ack=50164 Win=61580 Len=0
741062 236.714026 41.177.34.163 -> 41.177.98.176 TCP 64 46388 > http [ACK] Seq=5536 Ack=51544 Win=64076 Len=0
741063 236.714075 41.177.34.163 -> 41.177.98.176 TCP 64 46388 > http [ACK] Seq=5536 Ack=52924 Win=64076 Len=0
741064 236.714170 41.177.34.163 -> 41.177.98.176 TCP 64 46388 > http [ACK] Seq=5536 Ack=54304 Win=62776 Len=0
741065 236.714222 41.177.34.163 -> 41.177.98.176 TCP 64 46388 > http [ACK] Seq=5536 Ack=55292 Win=61788 Len=0
741068 236.716542 41.177.34.163 -> 41.177.98.176 TCP 64 46388 > http [ACK] Seq=5536 Ack=56325 Win=64076 Len=0
741069 236.716547 41.177.34.163 -> 41.177.98.176 TCP 64 46388 > http [ACK] Seq=5536 Ack=56330 Win=64076 Len=0
779876 251.822212 41.177.34.163 -> 41.177.98.176 TCP 64 46388 > http [ACK] Seq=5536 Ack=56331 Win=64076 Len=0
782496 253.220778 41.177.34.163 -> 41.177.98.176 TCP 64 46388 > http [FIN, ACK] Seq=5536 Ack=56331 Win=64076 Len=0
950763 315.334380 41.177.34.163 -> 41.177.98.176 TCP 70 51670 > http [SYN] Seq=0 Win=5840 Len=0 MSS=1380 SACK_PERM=1 WS=4
950765 315.335122 41.177.34.163 -> 41.177.98.176 TCP 64 51670 > http [ACK] Seq=1 Ack=1 Win=5840 Len=0
950771 315.336861 41.177.34.163 -> 41.177.98.176 TCP 64 51670 > http [ACK] Seq=730 Ack=297 Win=6912 Len=0
950773 315.337158 41.177.34.163 -> 41.177.98.176 TCP 64 51670 > http [ACK] Seq=730 Ack=1677 Win=9832 Len=0
950775 315.337450 41.177.34.163 -> 41.177.98.176 TCP 64 51670 > http [ACK] Seq=730 Ack=3057 Win=12752 Len=0
950779 315.337918 41.177.34.163 -> 41.177.98.176 TCP 64 51670 > http [ACK] Seq=730 Ack=4437 Win=15672 Len=0
950780 315.338066 41.177.34.163 -> 41.177.98.176 TCP 70 [TCP Dup ACK 950779#1] 51670 > http [ACK] Seq=730 Ack=4437 Win=15672 Len=0 SLE=5817 SRE=7197
950781 315.338070 41.177.34.163 -> 41.177.98.176 TCP 64 51670 > http [ACK] Seq=730 Ack=7197 Win=18592 Len=0
950782 315.338100 41.177.34.163 -> 41.177.98.176 TCP 64 51670 > http [ACK] Seq=730 Ack=7776 Win=21352 Len=0
984811 328.794083 41.177.34.163 -> 244.3.210.197 TCP 70 43996 > http [SYN] Seq=0 Win=5840 Len=0 MSS=1380 SACK_PERM=1 WS=4
984819 328.794558 41.177.34.163 -> 244.3.210.197 TCP 64 43996 > http [ACK] Seq=1 Ack=1 Win=5840 Len=0
985970 329.176663 41.177.34.163 -> 244.3.210.197 TCP 64 43996 > http [ACK] Seq=947 Ack=1381 Win=8760 Len=0
985986 329.180509 41.177.34.163 -> 244.3.210.197 TCP 64 43996 > http [ACK] Seq=947 Ack=2761 Win=11680 Len=0
985987 329.180515 41.177.34.163 -> 244.3.210.197 TCP 64 43996 > http [ACK] Seq=947 Ack=4141 Win=14600 Len=0
985988 329.180519 41.177.34.163 -> 244.3.210.197 TCP 64 43996 > http [ACK] Seq=947 Ack=5521 Win=17520 Len=0
986011 329.181401 41.177.34.163 -> 244.3.210.197 TCP 64 43996 > http [ACK] Seq=947 Ack=6901 Win=20440 Len=0
986013 329.181507 41.177.34.163 -> 244.3.210.197 TCP 64 43996 > http [ACK] Seq=947 Ack=8281 Win=23360 Len=0
986020 329.181636 41.177.34.163 -> 244.3.210.197 TCP 64 43996 > http [ACK] Seq=947 Ack=9661 Win=26280 Len=0
986023 329.181658 41.177.34.163 -> 244.3.210.197 TCP 64 43996 > http [ACK] Seq=947 Ack=11041 Win=29200 Len=0
986027 329.181756 41.177.34.163 -> 244.3.210.197 TCP 64 43996 > http [ACK] Seq=947 Ack=12421 Win=32120 Len=0
986030 329.181867 41.177.34.163 -> 244.3.210.197 TCP 64 43996 > http [ACK] Seq=947 Ack=13801 Win=35040 Len=0
986054 329.183162 41.177.34.163 -> 244.3.210.197 TCP 64 43996 > http [ACK] Seq=947 Ack=15181 Win=37960 Len=0
986055 329.183192 41.177.34.163 -> 244.3.210.197 TCP 64 43996 > http [ACK] Seq=947 Ack=15420 Win=37960 Len=0
986180 329.212698 41.177.34.163 -> 244.3.210.197 TCP 64 43996 > http [ACK] Seq=1757 Ack=18180 Win=43800 Len=0
986188 329.212956 41.177.34.163 -> 244.3.210.197 TCP 64 43996 > http [ACK] Seq=1757 Ack=20940 Win=49640 Len=0
986191 329.213133 41.177.34.163 -> 244.3.210.197 TCP 64 43996 > http [ACK] Seq=1757 Ack=23700 Win=55480 Len=0
986195 329.213194 41.177.34.163 -> 244.3.210.197 TCP 64 43996 > http [ACK] Seq=1757 Ack=25801 Win=55876 Len=0
986273 329.234818 41.177.34.163 -> 244.3.210.197 TCP 64 43996 > http [ACK] Seq=2557 Ack=38221 Win=64076 Len=0
986277 329.234967 41.177.34.163 -> 244.3.210.197 TCP 64 43996 > http [ACK] Seq=2557 Ack=40981 Win=64076 Len=0
986294 329.235237 41.177.34.163 -> 244.3.210.197 TCP 64 43996 > http [ACK] Seq=2557 Ack=43741 Win=64076 Len=0
986295 329.235413 41.177.34.163 -> 244.3.210.197 TCP 70 44013 > http [SYN] Seq=0 Win=5840 Len=0 MSS=1380 SACK_PERM=1 WS=4
986297 329.235473 41.177.34.163 -> 244.3.210.197 TCP 64 43996 > http [ACK] Seq=2557 Ack=46501 Win=64076 Len=0
986303 329.235602 41.177.34.163 -> 244.3.210.197 TCP 64 43996 > http [ACK] Seq=2557 Ack=49261 Win=64076 Len=0
986320 329.235887 41.177.34.163 -> 244.3.210.197 TCP 64 44013 > http [ACK] Seq=1 Ack=1 Win=5840 Len=0
986321 329.236003 41.177.34.163 -> 244.3.210.197 TCP 64 43996 > http [ACK] Seq=2557 Ack=28561 Win=64076 Len=0
986350 329.237252 41.177.34.163 -> 244.3.210.197 TCP 64 43996 > http [ACK] Seq=2557 Ack=52021 Win=64076 Len=0
986352 329.237388 41.177.34.163 -> 244.3.210.197 TCP 64 43996 > http [ACK] Seq=2557 Ack=54781 Win=64076 Len=0
986358 329.237544 41.177.34.163 -> 244.3.210.197 TCP 64 43996 > http [ACK] Seq=2557 Ack=57541 Win=64076 Len=0
986369 329.237738 41.177.34.163 -> 244.3.210.197 TCP 64 43996 > http [ACK] Seq=2557 Ack=60043 Win=64076 Len=0
986384 329.240483 41.177.34.163 -> 244.3.210.197 TCP 64 44013 > http [ACK] Seq=807 Ack=1381 Win=8760 Len=0
986385 329.240587 41.177.34.163 -> 244.3.210.197 TCP 64 44013 > http [ACK] Seq=807 Ack=2761 Win=11680 Len=0
986398 329.241074 41.177.34.163 -> 244.3.210.197 TCP 64 44013 > http [ACK] Seq=807 Ack=3366 Win=14440 Len=0
986553 329.294588 41.177.34.163 -> 244.3.210.197 TCP 64 43996 > http [ACK] Seq=3366 Ack=62803 Win=64076 Len=0
986559 329.296738 41.177.34.163 -> 244.3.210.197 TCP 64 44013 > http [ACK] Seq=1616 Ack=4746 Win=17360 Len=0
986560 329.296787 41.177.34.163 -> 244.3.210.197 TCP 64 44013 > http [ACK] Seq=1616 Ack=6126 Win=20280 Len=0
986563 329.296900 41.177.34.163 -> 244.3.210.197 TCP 64 44013 > http [ACK] Seq=1616 Ack=7506 Win=23200 Len=0
986566 329.296973 41.177.34.163 -> 244.3.210.197 TCP 64 44013 > http [ACK] Seq=1616 Ack=8886 Win=26120 Len=0
986569 329.297039 41.177.34.163 -> 244.3.210.197 TCP 64 44013 > http [ACK] Seq=1616 Ack=10266 Win=29040 Len=0
986601 329.298452 41.177.34.163 -> 244.3.210.197 TCP 64 44013 > http [ACK] Seq=1616 Ack=11646 Win=31960 Len=0
986602 329.298489 41.177.34.163 -> 244.3.210.197 TCP 64 44013 > http [ACK] Seq=1616 Ack=13026 Win=34880 Len=0
986606 329.298611 41.177.34.163 -> 244.3.210.197 TCP 64 44013 > http [ACK] Seq=1616 Ack=14406 Win=37800 Len=0
986612 329.298737 41.177.34.163 -> 244.3.210.197 TCP 64 44013 > http [ACK] Seq=1616 Ack=15786 Win=40720 Len=0
986614 329.298745 41.177.34.163 -> 244.3.210.197 TCP 64 44013 > http [ACK] Seq=1616 Ack=17166 Win=43640 Len=0
986617 329.298851 41.177.34.163 -> 244.3.210.197 TCP 64 44013 > http [ACK] Seq=1616 Ack=18546 Win=46560 Len=0
986626 329.298950 41.177.34.163 -> 244.3.210.197 TCP 64 44013 > http [ACK] Seq=1616 Ack=19926 Win=49480 Len=0
986637 329.299063 41.177.34.163 -> 244.3.210.197 TCP 64 44013 > http [ACK] Seq=1616 Ack=21306 Win=52400 Len=0
986641 329.299125 41.177.34.163 -> 244.3.210.197 TCP 64 44013 > http [ACK] Seq=1616 Ack=22686 Win=55320 Len=0
986643 329.299210 41.177.34.163 -> 244.3.210.197 TCP 64 44013 > http [ACK] Seq=1616 Ack=24066 Win=58240 Len=0
986649 329.299347 41.177.34.163 -> 244.3.210.197 TCP 64 44013 > http [ACK] Seq=1616 Ack=25446 Win=61160 Len=0
986658 329.299482 41.177.34.163 -> 244.3.210.197 TCP 64 44013 > http [ACK] Seq=1616 Ack=26826 Win=64076 Len=0
986674 329.299621 41.177.34.163 -> 244.3.210.197 TCP 64 44013 > http [ACK] Seq=1616 Ack=29586 Win=64076 Len=0
986686 329.299752 41.177.34.163 -> 244.3.210.197 TCP 64 44013 > http [ACK] Seq=1616 Ack=32346 Win=64076 Len=0
986697 329.299942 41.177.34.163 -> 244.3.210.197 TCP 64 44013 > http [ACK] Seq=1616 Ack=35106 Win=64076 Len=0
986701 329.300169 41.177.34.163 -> 244.3.210.197 TCP 64 44013 > http [ACK] Seq=1616 Ack=37866 Win=64076 Len=0
986721 329.300375 41.177.34.163 -> 244.3.210.197 TCP 64 44013 > http [ACK] Seq=1616 Ack=40626 Win=64076 Len=0
986734 329.300562 41.177.34.163 -> 244.3.210.197 TCP 64 44013 > http [ACK] Seq=1616 Ack=43386 Win=64076 Len=0
986737 329.300721 41.177.34.163 -> 244.3.210.197 TCP 64 44013 > http [ACK] Seq=1616 Ack=46146 Win=64076 Len=0
986739 329.300730 41.177.34.163 -> 244.3.210.197 TCP 70 [TCP Dup ACK 986737#1] 44013 > http [ACK] Seq=1616 Ack=46146 Win=64076 Len=0 SLE=65466 SRE=66846
986740 329.300793 41.177.34.163 -> 244.3.210.197 TCP 70 44013 > http [ACK] Seq=1616 Ack=47526 Win=64076 Len=0 SLE=65466 SRE=66846
986744 329.300901 41.177.34.163 -> 244.3.210.197 TCP 70 44013 > http [ACK] Seq=1616 Ack=48906 Win=64076 Len=0 SLE=65466 SRE=66846
986769 329.301433 41.177.34.163 -> 244.3.210.197 TCP 70 44013 > http [ACK] Seq=1616 Ack=50286 Win=64076 Len=0 SLE=65466 SRE=66846
986772 329.301601 41.177.34.163 -> 244.3.210.197 TCP 70 44013 > http [ACK] Seq=1616 Ack=51666 Win=64076 Len=0 SLE=65466 SRE=66846
986784 329.302321 41.177.34.163 -> 244.3.210.197 TCP 70 44013 > http [ACK] Seq=1616 Ack=53046 Win=64076 Len=0 SLE=65466 SRE=66846
986791 329.302454 41.177.34.163 -> 244.3.210.197 TCP 70 44013 > http [ACK] Seq=1616 Ack=54426 Win=64076 Len=0 SLE=65466 SRE=66846
986802 329.302554 41.177.34.163 -> 244.3.210.197 TCP 70 44013 > http [ACK] Seq=1616 Ack=55806 Win=64076 Len=0 SLE=65466 SRE=66846
986807 329.302628 41.177.34.163 -> 244.3.210.197 TCP 70 44013 > http [ACK] Seq=1616 Ack=57186 Win=64076 Len=0 SLE=65466 SRE=66846
986810 329.302740 41.177.34.163 -> 244.3.210.197 TCP 70 44013 > http [ACK] Seq=1616 Ack=58566 Win=64076 Len=0 SLE=65466 SRE=66846
986815 329.302964 41.177.34.163 -> 244.3.210.197 TCP 70 44013 > http [ACK] Seq=1616 Ack=59946 Win=64076 Len=0 SLE=65466 SRE=66846
986818 329.303075 41.177.34.163 -> 244.3.210.197 TCP 70 44013 > http [ACK] Seq=1616 Ack=61326 Win=62776 Len=0 SLE=65466 SRE=66846
986834 329.303229 41.177.34.163 -> 244.3.210.197 TCP 70 44013 > http [ACK] Seq=1616 Ack=62706 Win=61396 Len=0 SLE=65466 SRE=66846
986844 329.303403 41.177.34.163 -> 244.3.210.197 TCP 70 44013 > http [ACK] Seq=1616 Ack=64086 Win=60016 Len=0 SLE=65466 SRE=66846
986845 329.303475 41.177.34.163 -> 244.3.210.197 TCP 64 44013 > http [ACK] Seq=1616 Ack=66846 Win=58636 Len=0
986849 329.303626 41.177.34.163 -> 244.3.210.197 TCP 64 44013 > http [ACK] Seq=1616 Ack=68226 Win=57256 Len=0
986853 329.304124 41.177.34.163 -> 244.3.210.197 TCP 64 44013 > http [ACK] Seq=1616 Ack=73746 Win=64076 Len=0
986862 329.304856 41.177.34.163 -> 244.3.210.197 TCP 64 44013 > http [ACK] Seq=1616 Ack=76506 Win=64076 Len=0
986875 329.305111 41.177.34.163 -> 244.3.210.197 TCP 64 44013 > http [ACK] Seq=1616 Ack=79266 Win=64076 Len=0
986893 329.305318 41.177.34.163 -> 244.3.210.197 TCP 64 44013 > http [ACK] Seq=1616 Ack=82026 Win=64076 Len=0
986908 329.305513 41.177.34.163 -> 244.3.210.197 TCP 64 44013 > http [ACK] Seq=1616 Ack=84786 Win=64076 Len=0
986919 329.305741 41.177.34.163 -> 244.3.210.197 TCP 64 44013 > http [ACK] Seq=1616 Ack=87546 Win=64076 Len=0
986920 329.306120 41.177.34.163 -> 244.3.210.197 TCP 64 44013 > http [ACK] Seq=1616 Ack=90306 Win=64076 Len=0
986922 329.306379 41.177.34.163 -> 244.3.210.197 TCP 64 44013 > http [ACK] Seq=1616 Ack=93066 Win=64076 Len=0
986936 329.306567 41.177.34.163 -> 244.3.210.197 TCP 64 44013 > http [ACK] Seq=1616 Ack=95826 Win=64076 Len=0
986943 329.306816 41.177.34.163 -> 244.3.210.197 TCP 64 44013 > http [ACK] Seq=1616 Ack=98586 Win=64076 Len=0
986944 329.307035 41.177.34.163 -> 244.3.210.197 TCP 64 44013 > http [ACK] Seq=1616 Ack=101346 Win=64076 Len=0
986945 329.307225 41.177.34.163 -> 244.3.210.197 TCP 64 44013 > http [ACK] Seq=1616 Ack=104106 Win=64076 Len=0
986946 329.307417 41.177.34.163 -> 244.3.210.197 TCP 64 44013 > http [ACK] Seq=1616 Ack=106866 Win=64076 Len=0
986996 329.309020 41.177.34.163 -> 244.3.210.197 TCP 64 44013 > http [ACK] Seq=1616 Ack=109626 Win=64076 Len=0
986997 329.309051 41.177.34.163 -> 244.3.210.197 TCP 64 44013 > http [ACK] Seq=1616 Ack=112386 Win=64076 Len=0
986998 329.309057 41.177.34.163 -> 244.3.210.197 TCP 64 44013 > http [ACK] Seq=1616 Ack=115146 Win=64076 Len=0
986999 329.309061 41.177.34.163 -> 244.3.210.197 TCP 64 44013 > http [ACK] Seq=1616 Ack=117906 Win=64076 Len=0
987001 329.309268 41.177.34.163 -> 244.3.210.197 TCP 64 44013 > http [ACK] Seq=1616 Ack=120666 Win=64076 Len=0
987004 329.309474 41.177.34.163 -> 244.3.210.197 TCP 64 44013 > http [ACK] Seq=1616 Ack=123426 Win=64076 Len=0
987006 329.309731 41.177.34.163 -> 244.3.210.197 TCP 64 44013 > http [ACK] Seq=1616 Ack=126186 Win=64076 Len=0
987008 329.309913 41.177.34.163 -> 244.3.210.197 TCP 64 44013 > http [ACK] Seq=1616 Ack=128946 Win=64076 Len=0
987017 329.310154 41.177.34.163 -> 244.3.210.197 TCP 64 44013 > http [ACK] Seq=1616 Ack=131706 Win=64076 Len=0
987033 329.310325 41.177.34.163 -> 244.3.210.197 TCP 64 44013 > http [ACK] Seq=1616 Ack=134466 Win=64076 Len=0
987063 329.311060 41.177.34.163 -> 244.3.210.197 TCP 64 44013 > http [ACK] Seq=1616 Ack=137226 Win=64076 Len=0
987064 329.311109 41.177.34.163 -> 244.3.210.197 TCP 64 44013 > http [ACK] Seq=1616 Ack=137691 Win=64076 Len=0
987148 329.335078 41.177.34.163 -> 244.3.210.197 TCP 64 43996 > http [ACK] Seq=3366 Ack=63344 Win=64076 Len=0
987275 329.417919 41.177.34.163 -> 244.3.210.197 TCP 64 43996 > http [ACK] Seq=4179 Ack=66013 Win=64076 Len=0
987360 329.430258 41.177.34.163 -> 244.3.210.197 TCP 64 44013 > http [ACK] Seq=2423 Ack=139071 Win=66996 Len=0
987380 329.430443 41.177.34.163 -> 244.3.210.197 TCP 64 44013 > http [ACK] Seq=2423 Ack=140451 Win=69916 Len=0
987398 329.430609 41.177.34.163 -> 244.3.210.197 TCP 64 44013 > http [ACK] Seq=2423 Ack=141831 Win=72836 Len=0
987415 329.431439 41.177.34.163 -> 244.3.210.197 TCP 64 44013 > http [ACK] Seq=2423 Ack=142595 Win=72836 Len=0
987421 329.431599 41.177.34.163 -> 244.3.210.197 TCP 64 43996 > http [ACK] Seq=4986 Ack=68773 Win=64076 Len=0
987438 329.432729 41.177.34.163 -> 244.3.210.197 TCP 64 43996 > http [ACK] Seq=4986 Ack=79813 Win=64076 Len=0
987448 329.433193 41.177.34.163 -> 244.3.210.197 TCP 64 43996 > http [ACK] Seq=4986 Ack=82573 Win=64076 Len=0
987455 329.433441 41.177.34.163 -> 244.3.210.197 TCP 64 43996 > http [ACK] Seq=4986 Ack=85333 Win=64076 Len=0
987459 329.433620 41.177.34.163 -> 244.3.210.197 TCP 64 43996 > http [ACK] Seq=4986 Ack=88093 Win=64076 Len=0
987469 329.433846 41.177.34.163 -> 244.3.210.197 TCP 64 43996 > http [ACK] Seq=4986 Ack=90853 Win=64076 Len=0
987470 329.434013 41.177.34.163 -> 244.3.210.197 TCP 64 43996 > http [ACK] Seq=4986 Ack=93613 Win=64076 Len=0
987478 329.434192 41.177.34.163 -> 244.3.210.197 TCP 64 43996 > http [ACK] Seq=4986 Ack=96373 Win=64076 Len=0
987489 329.434485 41.177.34.163 -> 244.3.210.197 TCP 64 43996 > http [ACK] Seq=4986 Ack=99133 Win=64076 Len=0
987491 329.434850 41.177.34.163 -> 244.3.210.197 TCP 64 43996 > http [ACK] Seq=4986 Ack=101893 Win=66240 Len=0
987500 329.435125 41.177.34.163 -> 244.3.210.197 TCP 64 43996 > http [ACK] Seq=4986 Ack=104156 Win=66240 Len=0
987575 329.439629 41.177.34.163 -> 244.3.210.197 TCP 64 44013 > http [ACK] Seq=3231 Ack=145355 Win=78676 Len=0
987579 329.439797 41.177.34.163 -> 244.3.210.197 TCP 64 44013 > http [ACK] Seq=3231 Ack=148115 Win=84516 Len=0
987587 329.440078 41.177.34.163 -> 244.3.210.197 TCP 64 44013 > http [ACK] Seq=3231 Ack=150875 Win=90356 Len=0
987588 329.440296 41.177.34.163 -> 244.3.210.197 TCP 64 44013 > http [ACK] Seq=3231 Ack=153635 Win=96196 Len=0
987599 329.440665 41.177.34.163 -> 244.3.210.197 TCP 64 44013 > http [ACK] Seq=3231 Ack=157775 Win=99116 Len=0
987600 329.440852 41.177.34.163 -> 244.3.210.197 TCP 64 44013 > http [ACK] Seq=3231 Ack=160535 Win=104956 Len=0
987608 329.441093 41.177.34.163 -> 244.3.210.197 TCP 64 44013 > http [ACK] Seq=3231 Ack=163295 Win=105812 Len=0
987612 329.441279 41.177.34.163 -> 244.3.210.197 TCP 64 44013 > http [ACK] Seq=3231 Ack=166055 Win=105812 Len=0
987620 329.441582 41.177.34.163 -> 244.3.210.197 TCP 64 44013 > http [ACK] Seq=3231 Ack=168815 Win=105812 Len=0
987624 329.441732 41.177.34.163 -> 244.3.210.197 TCP 64 44013 > http [ACK] Seq=3231 Ack=171575 Win=105812 Len=0
987631 329.441966 41.177.34.163 -> 244.3.210.197 TCP 64 44013 > http [ACK] Seq=3231 Ack=173507 Win=105812 Len=0
987682 329.449968 41.177.34.163 -> 244.3.210.197 TCP 64 43996 > http [ACK] Seq=5794 Ack=127616 Win=60196 Len=0
987685 329.450082 41.177.34.163 -> 244.3.210.197 TCP 64 43996 > http [ACK] Seq=5794 Ack=130376 Win=66240 Len=0
987705 329.451570 41.177.34.163 -> 244.3.210.197 TCP 64 43996 > http [ACK] Seq=5794 Ack=133136 Win=66240 Len=0
987743 329.458658 41.177.34.163 -> 244.3.210.197 TCP 64 44013 > http [ACK] Seq=4037 Ack=176267 Win=105812 Len=0
987754 329.459856 41.177.34.163 -> 244.3.210.197 TCP 64 44013 > http [ACK] Seq=4037 Ack=184176 Win=105812 Len=0
987833 329.492472 41.177.34.163 -> 244.3.210.197 TCP 64 43996 > http [ACK] Seq=6615 Ack=138156 Win=66240 Len=0
987868 329.504806 41.177.34.163 -> 244.3.210.197 TCP 64 44013 > http [ACK] Seq=4846 Ack=186874 Win=105812 Len=0
987874 329.506262 41.177.34.163 -> 244.3.210.197 TCP 64 43996 > http [ACK] Seq=7414 Ack=140466 Win=66240 Len=0
987905 329.512612 41.177.34.163 -> 244.3.210.197 TCP 64 44013 > http [ACK] Seq=5657 Ack=189634 Win=105812 Len=0
987914 329.513889 41.177.34.163 -> 244.3.210.197 TCP 64 44013 > http [ACK] Seq=5657 Ack=197949 Win=105812 Len=0
987986 329.536565 41.177.34.163 -> 244.3.210.197 TCP 64 43996 > http [ACK] Seq=8223 Ack=150219 Win=66240 Len=0
988029 329.550883 41.177.34.163 -> 244.3.210.197 TCP 64 44013 > http [ACK] Seq=6462 Ack=200709 Win=105812 Len=0
988035 329.552042 41.177.34.163 -> 244.3.210.197 TCP 64 44013 > http [ACK] Seq=6462 Ack=207135 Win=105812 Len=0
988084 329.572955 41.177.34.163 -> 244.3.210.197 TCP 64 43996 > http [ACK] Seq=9029 Ack=153777 Win=66240 Len=0
988104 329.584003 41.177.34.163 -> 244.3.210.197 TCP 64 44013 > http [ACK] Seq=7272 Ack=209895 Win=105812 Len=0
988110 329.584991 41.177.34.163 -> 244.3.210.197 TCP 64 44013 > http [ACK] Seq=7272 Ack=211485 Win=105812 Len=0
988155 329.598429 41.177.34.163 -> 244.3.210.197 TCP 64 43996 > http [ACK] Seq=9833 Ack=156537 Win=66240 Len=0
988162 329.600304 41.177.34.163 -> 244.3.210.197 TCP 64 43996 > http [ACK] Seq=9833 Ack=159297 Win=66240 Len=0
988168 329.601356 41.177.34.163 -> 244.3.210.197 TCP 64 43996 > http [ACK] Seq=9833 Ack=162057 Win=66240 Len=0
988175 329.601673 41.177.34.163 -> 244.3.210.197 TCP 64 43996 > http [ACK] Seq=9833 Ack=164556 Win=66240 Len=0
988261 329.624575 41.177.34.163 -> 244.3.210.197 TCP 64 44013 > http [ACK] Seq=8078 Ack=214245 Win=105812 Len=0
988272 329.626031 41.177.34.163 -> 244.3.210.197 TCP 64 44013 > http [ACK] Seq=8078 Ack=230805 Win=104592 Len=0
988278 329.626216 41.177.34.163 -> 244.3.210.197 TCP 64 44013 > http [ACK] Seq=8078 Ack=233565 Win=105812 Len=0
988286 329.626490 41.177.34.163 -> 244.3.210.197 TCP 64 44013 > http [ACK] Seq=8078 Ack=236325 Win=105812 Len=0
988292 329.626691 41.177.34.163 -> 244.3.210.197 TCP 64 44013 > http [ACK] Seq=8078 Ack=239085 Win=105812 Len=0
988302 329.626926 41.177.34.163 -> 244.3.210.197 TCP 64 44013 > http [ACK] Seq=8078 Ack=241845 Win=105812 Len=0
988305 329.627119 41.177.34.163 -> 244.3.210.197 TCP 64 44013 > http [ACK] Seq=8078 Ack=244605 Win=105812 Len=0
988311 329.627361 41.177.34.163 -> 244.3.210.197 TCP 64 44013 > http [ACK] Seq=8078 Ack=247365 Win=105812 Len=0
988318 329.627650 41.177.34.163 -> 244.3.210.197 TCP 64 44013 > http [ACK] Seq=8078 Ack=250125 Win=105812 Len=0
988328 329.627870 41.177.34.163 -> 244.3.210.197 TCP 64 44013 > http [ACK] Seq=8078 Ack=252885 Win=105812 Len=0
988332 329.628062 41.177.34.163 -> 244.3.210.197 TCP 64 44013 > http [ACK] Seq=8078 Ack=255645 Win=105812 Len=0
988338 329.628320 41.177.34.163 -> 244.3.210.197 TCP 64 44013 > http [ACK] Seq=8078 Ack=258405 Win=105812 Len=0
988344 329.628558 41.177.34.163 -> 244.3.210.197 TCP 64 44013 > http [ACK] Seq=8078 Ack=261165 Win=105812 Len=0
988350 329.628809 41.177.34.163 -> 244.3.210.197 TCP 64 44013 > http [ACK] Seq=8078 Ack=263925 Win=105812 Len=0
988351 329.629020 41.177.34.163 -> 244.3.210.197 TCP 64 44013 > http [ACK] Seq=8078 Ack=266685 Win=105812 Len=0
988357 329.629259 41.177.34.163 -> 244.3.210.197 TCP 64 44013 > http [ACK] Seq=8078 Ack=269445 Win=105812 Len=0
988368 329.629515 41.177.34.163 -> 244.3.210.197 TCP 64 44013 > http [ACK] Seq=8078 Ack=272205 Win=105812 Len=0
988374 329.629814 41.177.34.163 -> 244.3.210.197 TCP 64 44013 > http [ACK] Seq=8078 Ack=274965 Win=105812 Len=0
988432 329.663976 41.177.34.163 -> 244.3.210.197 TCP 64 43996 > http [ACK] Seq=10647 Ack=170419 Win=66240 Len=0
988438 329.669565 41.177.34.163 -> 244.3.210.197 TCP 64 44013 > http [ACK] Seq=8078 Ack=276075 Win=105812 Len=0
988460 329.678483 41.177.34.163 -> 244.3.210.197 TCP 64 44013 > http [ACK] Seq=8888 Ack=277455 Win=108732 Len=0
988461 329.678488 41.177.34.163 -> 244.3.210.197 TCP 64 44013 > http [ACK] Seq=8888 Ack=278835 Win=111652 Len=0
988472 329.679582 41.177.34.163 -> 244.3.210.197 TCP 64 44013 > http [ACK] Seq=8888 Ack=279532 Win=111652 Len=0
988501 329.695022 41.177.34.163 -> 244.3.210.197 TCP 64 43996 > http [ACK] Seq=11450 Ack=181752 Win=66240 Len=0
988566 329.714198 41.177.34.163 -> 244.3.210.197 TCP 64 44013 > http [ACK] Seq=9716 Ack=282292 Win=117492 Len=0
988572 329.715280 41.177.34.163 -> 244.3.210.197 TCP 64 43996 > http [ACK] Seq=12281 Ack=190032 Win=66240 Len=0
988580 329.715674 41.177.34.163 -> 244.3.210.197 TCP 64 44013 > http [ACK] Seq=9716 Ack=285052 Win=123332 Len=0
988581 329.715679 41.177.34.163 -> 244.3.210.197 TCP 64 44013 > http [ACK] Seq=9716 Ack=287812 Win=129172 Len=0
988584 329.715778 41.177.34.163 -> 244.3.210.197 TCP 64 43996 > http [ACK] Seq=12281 Ack=192792 Win=66240 Len=0
988599 329.716199 41.177.34.163 -> 244.3.210.197 TCP 64 43996 > http [ACK] Seq=12281 Ack=195552 Win=66240 Len=0
988601 329.716300 41.177.34.163 -> 244.3.210.197 TCP 64 44013 > http [ACK] Seq=9716 Ack=290572 Win=129180 Len=0
988612 329.716804 41.177.34.163 -> 244.3.210.197 TCP 64 43996 > http [ACK] Seq=12281 Ack=198312 Win=66240 Len=0
988613 329.716836 41.177.34.163 -> 244.3.210.197 TCP 64 44013 > http [ACK] Seq=9716 Ack=292963 Win=129180 Len=0
988619 329.717180 41.177.34.163 -> 244.3.210.197 TCP 64 43996 > http [ACK] Seq=12281 Ack=201072 Win=66240 Len=0
988630 329.717468 41.177.34.163 -> 244.3.210.197 TCP 64 43996 > http [ACK] Seq=12281 Ack=203832 Win=66240 Len=0
988635 329.717758 41.177.34.163 -> 244.3.210.197 TCP 64 43996 > http [ACK] Seq=12281 Ack=206592 Win=66240 Len=0
988637 329.717998 41.177.34.163 -> 244.3.210.197 TCP 64 43996 > http [ACK] Seq=12281 Ack=209352 Win=66240 Len=0
988647 329.718318 41.177.34.163 -> 244.3.210.197 TCP 64 43996 > http [ACK] Seq=12281 Ack=212112 Win=66240 Len=0
988656 329.718912 41.177.34.163 -> 244.3.210.197 TCP 64 43996 > http [ACK] Seq=12281 Ack=214872 Win=66240 Len=0
988663 329.719192 41.177.34.163 -> 244.3.210.197 TCP 64 43996 > http [ACK] Seq=12281 Ack=217632 Win=66240 Len=0
988669 329.719455 41.177.34.163 -> 244.3.210.197 TCP 64 43996 > http [ACK] Seq=12281 Ack=220363 Win=66240 Len=0
988709 329.728667 41.177.34.163 -> 244.3.210.197 TCP 64 44013 > http [ACK] Seq=10546 Ack=295723 Win=129180 Len=0
988715 329.729307 41.177.34.163 -> 244.3.210.197 TCP 64 44013 > http [ACK] Seq=10546 Ack=304003 Win=129180 Len=0
988721 329.729523 41.177.34.163 -> 244.3.210.197 TCP 64 44013 > http [ACK] Seq=10546 Ack=306003 Win=129180 Len=0
988784 329.752063 41.177.34.163 -> 244.3.210.197 TCP 64 44013 > http [ACK] Seq=12171 Ack=308192 Win=129180 Len=0
988808 329.757156 41.177.34.163 -> 244.3.210.197 TCP 64 43996 > http [ACK] Seq=14703 Ack=223195 Win=66240 Len=0
988839 329.762910 41.177.34.163 -> 244.3.210.197 TCP 64 44013 > http [ACK] Seq=12979 Ack=310852 Win=129180 Len=0
988849 329.765715 41.177.34.163 -> 244.3.210.197 TCP 64 43996 > http [ACK] Seq=15510 Ack=226009 Win=66240 Len=0
988877 329.771757 41.177.34.163 -> 244.3.210.197 TCP 64 44013 > http [ACK] Seq=13785 Ack=313612 Win=129180 Len=0
988886 329.772747 41.177.34.163 -> 244.3.210.197 TCP 64 44013 > http [ACK] Seq=13785 Ack=315840 Win=129180 Len=0
988903 329.776957 41.177.34.163 -> 244.3.210.197 TCP 64 43996 > http [ACK] Seq=16317 Ack=228769 Win=66240 Len=0
988915 329.777994 41.177.34.163 -> 244.3.210.197 TCP 64 43996 > http [ACK] Seq=16317 Ack=230741 Win=66240 Len=0
988926 329.780621 41.177.34.163 -> 244.3.210.197 TCP 64 44013 > http [ACK] Seq=14603 Ack=318423 Win=129180 Len=0
988946 329.787128 41.177.34.163 -> 244.3.210.197 TCP 64 43996 > http [ACK] Seq=17134 Ack=235796 Win=66240 Len=0
989104 329.814085 41.177.34.163 -> 244.3.210.197 TCP 64 44013 > http [ACK] Seq=15420 Ack=321183 Win=129180 Len=0
989111 329.814917 41.177.34.163 -> 244.3.210.197 TCP 64 44013 > http [ACK] Seq=15420 Ack=328330 Win=129180 Len=0
989152 329.827529 41.177.34.163 -> 244.3.210.197 TCP 64 43996 > http [ACK] Seq=17947 Ack=238538 Win=66240 Len=0
989319 329.864298 41.177.34.163 -> 244.3.210.197 TCP 64 44013 > http [ACK] Seq=17884 Ack=332048 Win=129180 Len=0
989597 329.922483 41.177.34.163 -> 244.3.210.197 TCP 64 43996 > http [ACK] Seq=21244 Ack=240247 Win=66240 Len=0
989609 329.925499 41.177.34.163 -> 244.3.210.197 TCP 64 44013 > http [ACK] Seq=19507 Ack=333403 Win=129180 Len=0
990513 330.378702 41.177.34.163 -> 41.177.98.176 TCP 64 51670 > http [ACK] Seq=730 Ack=7777 Win=21352 Len=0
997386 333.278601 41.177.34.163 -> 41.177.98.176 TCP 64 51670 > http [FIN, ACK] Seq=730 Ack=7777 Win=21352 Len=0
1002783 336.201210 41.177.34.163 -> 244.3.210.197 TCP 64 43996 > http [ACK] Seq=22346 Ack=241627 Win=66240 Len=0
1002789 336.201408 41.177.34.163 -> 244.3.210.197 TCP 64 43996 > http [ACK] Seq=22346 Ack=243007 Win=65716 Len=0
1002790 336.201643 41.177.34.163 -> 244.3.210.197 TCP 64 43996 > http [ACK] Seq=22346 Ack=244387 Win=64336 Len=0
1002798 336.201844 41.177.34.163 -> 244.3.210.197 TCP 64 43996 > http [ACK] Seq=22346 Ack=245767 Win=62956 Len=0
1002807 336.202146 41.177.34.163 -> 244.3.210.197 TCP 64 43996 > http [ACK] Seq=22346 Ack=247147 Win=61576 Len=0
1002808 336.202392 41.177.34.163 -> 244.3.210.197 TCP 64 43996 > http [ACK] Seq=22346 Ack=248527 Win=60196 Len=0
1002816 336.202684 41.177.34.163 -> 244.3.210.197 TCP 64 43996 > http [ACK] Seq=22346 Ack=249907 Win=65716 Len=0
1002821 336.202846 41.177.34.163 -> 244.3.210.197 TCP 64 43996 > http [ACK] Seq=22346 Ack=251287 Win=64336 Len=0
1002826 336.203092 41.177.34.163 -> 244.3.210.197 TCP 64 43996 > http [ACK] Seq=22346 Ack=252667 Win=65716 Len=0
1002832 336.203285 41.177.34.163 -> 244.3.210.197 TCP 64 43996 > http [ACK] Seq=22346 Ack=254047 Win=64336 Len=0
1002838 336.203532 41.177.34.163 -> 244.3.210.197 TCP 64 43996 > http [ACK] Seq=22346 Ack=255427 Win=62956 Len=0
1002846 336.203778 41.177.34.163 -> 244.3.210.197 TCP 64 43996 > http [ACK] Seq=22346 Ack=256807 Win=65716 Len=0
1002850 336.203986 41.177.34.163 -> 244.3.210.197 TCP 64 43996 > http [ACK] Seq=22346 Ack=258187 Win=64336 Len=0
1002861 336.204972 41.177.34.163 -> 244.3.210.197 TCP 64 43996 > http [ACK] Seq=22346 Ack=259567 Win=66240 Len=0
1002862 336.204977 41.177.34.163 -> 244.3.210.197 TCP 64 43996 > http [ACK] Seq=22346 Ack=259681 Win=66240 Len=0
1003353 336.507215 41.177.34.163 -> 244.3.210.197 TCP 64 44013 > http [ACK] Seq=20403 Ack=334783 Win=129180 Len=0
1003370 336.507448 41.177.34.163 -> 244.3.210.197 TCP 64 44013 > http [ACK] Seq=20403 Ack=336163 Win=129180 Len=0
1003371 336.507452 41.177.34.163 -> 244.3.210.197 TCP 64 44013 > http [ACK] Seq=20403 Ack=337543 Win=128312 Len=0
1003379 336.507725 41.177.34.163 -> 244.3.210.197 TCP 64 44013 > http [ACK] Seq=20403 Ack=338923 Win=126932 Len=0
1003383 336.507949 41.177.34.163 -> 244.3.210.197 TCP 64 44013 > http [ACK] Seq=20403 Ack=340303 Win=125552 Len=0
1003385 336.507958 41.177.34.163 -> 244.3.210.197 TCP 64 44013 > http [ACK] Seq=20403 Ack=341683 Win=124172 Len=0
1003390 336.508060 41.177.34.163 -> 244.3.210.197 TCP 64 44013 > http [ACK] Seq=20403 Ack=343063 Win=122792 Len=0
1003391 336.508120 41.177.34.163 -> 244.3.210.197 TCP 64 44013 > http [ACK] Seq=20403 Ack=344443 Win=121412 Len=0
1003396 336.508236 41.177.34.163 -> 244.3.210.197 TCP 64 44013 > http [ACK] Seq=20403 Ack=345823 Win=120032 Len=0
1003404 336.508441 41.177.34.163 -> 244.3.210.197 TCP 64 44013 > http [ACK] Seq=20403 Ack=347203 Win=129180 Len=0
1003411 336.508551 41.177.34.163 -> 244.3.210.197 TCP 64 44013 > http [ACK] Seq=20403 Ack=348583 Win=129180 Len=0
1003420 336.508684 41.177.34.163 -> 244.3.210.197 TCP 64 44013 > http [ACK] Seq=20403 Ack=349963 Win=129180 Len=0
1003421 336.508823 41.177.34.163 -> 244.3.210.197 TCP 64 44013 > http [ACK] Seq=20403 Ack=351343 Win=129180 Len=0
1003430 336.509088 41.177.34.163 -> 244.3.210.197 TCP 64 44013 > http [ACK] Seq=20403 Ack=352723 Win=129180 Len=0
1003433 336.509099 41.177.34.163 -> 244.3.210.197 TCP 64 44013 > http [ACK] Seq=20403 Ack=354103 Win=129180 Len=0
1003434 336.509262 41.177.34.163 -> 244.3.210.197 TCP 64 44013 > http [ACK] Seq=20403 Ack=355483 Win=129180 Len=0
1003435 336.509366 41.177.34.163 -> 244.3.210.197 TCP 64 44013 > http [ACK] Seq=20403 Ack=358243 Win=129180 Len=0
1003436 336.509418 41.177.34.163 -> 244.3.210.197 TCP 64 44013 > http [ACK] Seq=20403 Ack=359525 Win=129180 Len=0
1003447 336.509714 41.177.34.163 -> 244.3.210.197 TCP 64 43996 > http [ACK] Seq=23230 Ack=261061 Win=66240 Len=0
1003450 336.509917 41.177.34.163 -> 244.3.210.197 TCP 64 43996 > http [ACK] Seq=23230 Ack=262441 Win=65716 Len=0
1003465 336.510101 41.177.34.163 -> 244.3.210.197 TCP 64 43996 > http [ACK] Seq=23230 Ack=263821 Win=64336 Len=0
1003475 336.510260 41.177.34.163 -> 244.3.210.197 TCP 64 43996 > http [ACK] Seq=23230 Ack=265201 Win=62956 Len=0
1003476 336.510405 41.177.34.163 -> 244.3.210.197 TCP 64 43996 > http [ACK] Seq=23230 Ack=266581 Win=61576 Len=0
1003477 336.510562 41.177.34.163 -> 244.3.210.197 TCP 64 43996 > http [ACK] Seq=23230 Ack=267961 Win=60196 Len=0
1003478 336.510736 41.177.34.163 -> 244.3.210.197 TCP 64 43996 > http [ACK] Seq=23230 Ack=269341 Win=58816 Len=0
1003494 336.511174 41.177.34.163 -> 244.3.210.197 TCP 64 43996 > http [ACK] Seq=23230 Ack=270721 Win=66240 Len=0
1003495 336.511179 41.177.34.163 -> 244.3.210.197 TCP 64 43996 > http [ACK] Seq=23230 Ack=272101 Win=66240 Len=0
1003496 336.511182 41.177.34.163 -> 244.3.210.197 TCP 64 43996 > http [ACK] Seq=23230 Ack=273481 Win=65716 Len=0
1003497 336.511245 41.177.34.163 -> 244.3.210.197 TCP 64 43996 > http [ACK] Seq=23230 Ack=273816 Win=65716 Len=0
1003640 336.555217 41.177.34.163 -> 244.3.210.197 TCP 64 44013 > http [ACK] Seq=21308 Ack=362285 Win=129180 Len=0
1003641 336.555222 41.177.34.163 -> 244.3.210.197 TCP 64 44013 > http [ACK] Seq=21308 Ack=364325 Win=129180 Len=0
1003699 336.571664 41.177.34.163 -> 244.3.210.197 TCP 64 43996 > http [ACK] Seq=24133 Ack=275196 Win=66240 Len=0
1003700 336.571669 41.177.34.163 -> 244.3.210.197 TCP 64 43996 > http [ACK] Seq=24133 Ack=276022 Win=66240 Len=0
1003722 336.576070 41.177.34.163 -> 244.3.210.197 TCP 64 44013 > http [ACK] Seq=22211 Ack=366418 Win=129180 Len=0
1003747 336.583400 41.177.34.163 -> 244.3.210.197 TCP 64 43996 > http [ACK] Seq=25036 Ack=277994 Win=66240 Len=0
1003765 336.596378 41.177.34.163 -> 244.3.210.197 TCP 64 44013 > http [ACK] Seq=23114 Ack=368758 Win=129180 Len=0
1003783 336.601638 41.177.34.163 -> 244.3.210.197 TCP 64 43996 > http [ACK] Seq=25939 Ack=280082 Win=66240 Len=0
1003801 336.611299 41.177.34.163 -> 244.3.210.197 TCP 64 44013 > http [ACK] Seq=24017 Ack=370836 Win=129180 Len=0
1003829 336.619915 41.177.34.163 -> 244.3.210.197 TCP 64 43996 > http [ACK] Seq=26817 Ack=284650 Win=66240 Len=0
1003875 336.663768 41.177.34.163 -> 244.3.210.197 TCP 64 44013 > http [ACK] Seq=24891 Ack=371175 Win=129180 Len=0
1004020 336.698076 41.177.34.163 -> 244.3.210.197 TCP 64 43996 > http [ACK] Seq=27704 Ack=287410 Win=66240 Len=0
1004021 336.698081 41.177.34.163 -> 244.3.210.197 TCP 64 43996 > http [ACK] Seq=27704 Ack=290170 Win=66240 Len=0
1004029 336.699299 41.177.34.163 -> 244.3.210.197 TCP 64 43996 > http [ACK] Seq=27704 Ack=301210 Win=66240 Len=0
1004045 336.699516 41.177.34.163 -> 244.3.210.197 TCP 64 43996 > http [ACK] Seq=27704 Ack=303970 Win=66240 Len=0
1004059 336.700380 41.177.34.163 -> 244.3.210.197 TCP 64 43996 > http [ACK] Seq=27704 Ack=306730 Win=66240 Len=0
1004060 336.700385 41.177.34.163 -> 244.3.210.197 TCP 64 43996 > http [ACK] Seq=27704 Ack=309490 Win=66240 Len=0
1004061 336.700404 41.177.34.163 -> 244.3.210.197 TCP 64 43996 > http [ACK] Seq=27704 Ack=312250 Win=66240 Len=0
1004069 336.700648 41.177.34.163 -> 244.3.210.197 TCP 64 43996 > http [ACK] Seq=27704 Ack=315010 Win=66240 Len=0
1004073 336.701016 41.177.34.163 -> 244.3.210.197 TCP 64 43996 > http [ACK] Seq=27704 Ack=317770 Win=66240 Len=0
1004078 336.701271 41.177.34.163 -> 244.3.210.197 TCP 64 43996 > http [ACK] Seq=27704 Ack=320530 Win=66240 Len=0
1004099 336.701533 41.177.34.163 -> 244.3.210.197 TCP 64 43996 > http [ACK] Seq=27704 Ack=323290 Win=69160 Len=0
1004103 336.701872 41.177.34.163 -> 244.3.210.197 TCP 64 43996 > http [ACK] Seq=27704 Ack=326050 Win=74520 Len=0
1004109 336.702278 41.177.34.163 -> 244.3.210.197 TCP 64 43996 > http [ACK] Seq=27704 Ack=328810 Win=74520 Len=0
1004131 336.702527 41.177.34.163 -> 244.3.210.197 TCP 64 43996 > http [ACK] Seq=27704 Ack=331570 Win=74520 Len=0
1004135 336.702826 41.177.34.163 -> 244.3.210.197 TCP 64 43996 > http [ACK] Seq=27704 Ack=334330 Win=74520 Len=0
1004146 336.703145 41.177.34.163 -> 244.3.210.197 TCP 64 43996 > http [ACK] Seq=27704 Ack=337090 Win=74520 Len=0
1004151 336.703374 41.177.34.163 -> 244.3.210.197 TCP 64 43996 > http [ACK] Seq=27704 Ack=339850 Win=74520 Len=0
1004165 336.703720 41.177.34.163 -> 244.3.210.197 TCP 64 43996 > http [ACK] Seq=27704 Ack=342610 Win=74520 Len=0
1004180 336.704018 41.177.34.163 -> 244.3.210.197 TCP 64 43996 > http [ACK] Seq=27704 Ack=345370 Win=74520 Len=0
1004183 336.704310 41.177.34.163 -> 244.3.210.197 TCP 64 43996 > http [ACK] Seq=27704 Ack=348130 Win=74520 Len=0
1004191 336.704632 41.177.34.163 -> 244.3.210.197 TCP 64 43996 > http [ACK] Seq=27704 Ack=350890 Win=74520 Len=0
1004209 336.706961 41.177.34.163 -> 244.3.210.197 TCP 64 43996 > http [ACK] Seq=27704 Ack=353650 Win=74520 Len=0
1004217 336.707578 41.177.34.163 -> 244.3.210.197 TCP 64 43996 > http [ACK] Seq=27704 Ack=356410 Win=74520 Len=0
1004226 336.709117 41.177.34.163 -> 244.3.210.197 TCP 64 43996 > http [ACK] Seq=27704 Ack=359170 Win=74520 Len=0
1004227 336.709122 41.177.34.163 -> 244.3.210.197 TCP 64 43996 > http [ACK] Seq=27704 Ack=361930 Win=74520 Len=0
1004228 336.709125 41.177.34.163 -> 244.3.210.197 TCP 64 43996 > http [ACK] Seq=27704 Ack=364690 Win=74520 Len=0
1004229 336.709129 41.177.34.163 -> 244.3.210.197 TCP 64 43996 > http [ACK] Seq=27704 Ack=367450 Win=74520 Len=0
1004258 336.709584 41.177.34.163 -> 244.3.210.197 TCP 64 43996 > http [ACK] Seq=27704 Ack=370210 Win=74520 Len=0
1004271 336.710140 41.177.34.163 -> 244.3.210.197 TCP 64 43996 > http [ACK] Seq=27704 Ack=372970 Win=74520 Len=0
1004288 336.710470 41.177.34.163 -> 244.3.210.197 TCP 64 43996 > http [ACK] Seq=27704 Ack=375730 Win=74520 Len=0
1004299 336.710980 41.177.34.163 -> 244.3.210.197 TCP 64 43996 > http [ACK] Seq=27704 Ack=378490 Win=74520 Len=0
1004307 336.711290 41.177.34.163 -> 244.3.210.197 TCP 64 43996 > http [ACK] Seq=27704 Ack=381250 Win=74520 Len=0
1004315 336.711837 41.177.34.163 -> 244.3.210.197 TCP 64 43996 > http [ACK] Seq=27704 Ack=384010 Win=74520 Len=0
1004323 336.712326 41.177.34.163 -> 244.3.210.197 TCP 64 43996 > http [ACK] Seq=27704 Ack=386770 Win=74520 Len=0
1004332 336.712985 41.177.34.163 -> 244.3.210.197 TCP 64 43996 > http [ACK] Seq=27704 Ack=389530 Win=74520 Len=0
1004340 336.713293 41.177.34.163 -> 244.3.210.197 TCP 64 43996 > http [ACK] Seq=27704 Ack=392290 Win=74520 Len=0
1004348 336.713582 41.177.34.163 -> 244.3.210.197 TCP 64 43996 > http [ACK] Seq=27704 Ack=395050 Win=74520 Len=0
1004356 336.713896 41.177.34.163 -> 244.3.210.197 TCP 64 43996 > http [ACK] Seq=27704 Ack=397810 Win=74520 Len=0
1004364 336.714391 41.177.34.163 -> 244.3.210.197 TCP 64 43996 > http [ACK] Seq=27704 Ack=400570 Win=74520 Len=0
1004372 336.715987 41.177.34.163 -> 244.3.210.197 TCP 64 43996 > http [ACK] Seq=27704 Ack=403330 Win=74520 Len=0
1004373 336.715992 41.177.34.163 -> 244.3.210.197 TCP 64 43996 > http [ACK] Seq=27704 Ack=406090 Win=74520 Len=0
1004374 336.715996 41.177.34.163 -> 244.3.210.197 TCP 64 43996 > http [ACK] Seq=27704 Ack=408850 Win=74520 Len=0
1004377 336.716089 41.177.34.163 -> 244.3.210.197 TCP 64 43996 > http [ACK] Seq=27704 Ack=411610 Win=74520 Len=0
1004404 336.716438 41.177.34.163 -> 244.3.210.197 TCP 64 43996 > http [ACK] Seq=27704 Ack=414370 Win=74520 Len=0
1004407 336.716689 41.177.34.163 -> 244.3.210.197 TCP 64 43996 > http [ACK] Seq=27704 Ack=417130 Win=74520 Len=0
1004415 336.716860 41.177.34.163 -> 244.3.210.197 TCP 64 43996 > http [ACK] Seq=27704 Ack=419890 Win=74520 Len=0
1004423 336.717283 41.177.34.163 -> 244.3.210.197 TCP 64 43996 > http [ACK] Seq=27704 Ack=422650 Win=74520 Len=0
1004433 336.717464 41.177.34.163 -> 244.3.210.197 TCP 64 43996 > http [ACK] Seq=27704 Ack=425410 Win=74520 Len=0
1004456 336.718161 41.177.34.163 -> 244.3.210.197 TCP 64 43996 > http [ACK] Seq=27704 Ack=428170 Win=80360 Len=0
1004459 336.718721 41.177.34.163 -> 244.3.210.197 TCP 64 43996 > http [ACK] Seq=27704 Ack=430930 Win=86200 Len=0
1004473 336.719966 41.177.34.163 -> 244.3.210.197 TCP 64 43996 > http [ACK] Seq=27704 Ack=433690 Win=92040 Len=0
1004482 336.720189 41.177.34.163 -> 244.3.210.197 TCP 64 43996 > http [ACK] Seq=27704 Ack=436450 Win=97880 Len=0
1004488 336.720417 41.177.34.163 -> 244.3.210.197 TCP 64 43996 > http [ACK] Seq=27704 Ack=439210 Win=103720 Len=0
1004500 336.720793 41.177.34.163 -> 244.3.210.197 TCP 64 43996 > http [ACK] Seq=27704 Ack=441970 Win=109560 Len=0
1004509 336.721081 41.177.34.163 -> 244.3.210.197 TCP 64 43996 > http [ACK] Seq=27704 Ack=444730 Win=115400 Len=0
1004518 336.721361 41.177.34.163 -> 244.3.210.197 TCP 64 43996 > http [ACK] Seq=27704 Ack=447490 Win=121240 Len=0
1004527 336.721766 41.177.34.163 -> 244.3.210.197 TCP 64 43996 > http [ACK] Seq=27704 Ack=450250 Win=127080 Len=0
1004536 336.722117 41.177.34.163 -> 244.3.210.197 TCP 64 43996 > http [ACK] Seq=27704 Ack=453010 Win=131072 Len=0
1004545 336.722410 41.177.34.163 -> 244.3.210.197 TCP 64 43996 > http [ACK] Seq=27704 Ack=455770 Win=131072 Len=0
1004554 336.722769 41.177.34.163 -> 244.3.210.197 TCP 64 43996 > http [ACK] Seq=27704 Ack=458530 Win=131072 Len=0
1004562 336.723038 41.177.34.163 -> 244.3.210.197 TCP 64 43996 > http [ACK] Seq=27704 Ack=461290 Win=131072 Len=0
1004572 336.723316 41.177.34.163 -> 244.3.210.197 TCP 64 43996 > http [ACK] Seq=27704 Ack=464050 Win=131072 Len=0
1004580 336.723633 41.177.34.163 -> 244.3.210.197 TCP 64 43996 > http [ACK] Seq=27704 Ack=466810 Win=131072 Len=0
1004590 336.724056 41.177.34.163 -> 244.3.210.197 TCP 64 43996 > http [ACK] Seq=27704 Ack=469570 Win=131072 Len=0
1004594 336.724254 41.177.34.163 -> 244.3.210.197 TCP 64 43996 > http [ACK] Seq=27704 Ack=472330 Win=131072 Len=0
1004608 336.724588 41.177.34.163 -> 244.3.210.197 TCP 64 43996 > http [ACK] Seq=27704 Ack=475090 Win=131072 Len=0
1004617 336.725469 41.177.34.163 -> 244.3.210.197 TCP 64 43996 > http [ACK] Seq=27704 Ack=477850 Win=131072 Len=0
1004626 336.725754 41.177.34.163 -> 244.3.210.197 TCP 64 43996 > http [ACK] Seq=27704 Ack=480610 Win=131072 Len=0
1004635 336.726116 41.177.34.163 -> 244.3.210.197 TCP 64 43996 > http [ACK] Seq=27704 Ack=483370 Win=131072 Len=0
1004644 336.726402 41.177.34.163 -> 244.3.210.197 TCP 64 43996 > http [ACK] Seq=27704 Ack=486130 Win=131072 Len=0
1004653 336.726712 41.177.34.163 -> 244.3.210.197 TCP 64 43996 > http [ACK] Seq=27704 Ack=488890 Win=131072 Len=0
1004662 336.727015 41.177.34.163 -> 244.3.210.197 TCP 64 43996 > http [ACK] Seq=27704 Ack=491650 Win=131072 Len=0
1004673 336.727306 41.177.34.163 -> 244.3.210.197 TCP 64 43996 > http [ACK] Seq=27704 Ack=494410 Win=131072 Len=0
1004683 336.727833 41.177.34.163 -> 244.3.210.197 TCP 64 43996 > http [ACK] Seq=27704 Ack=497170 Win=131072 Len=0
1004692 336.728099 41.177.34.163 -> 244.3.210.197 TCP 64 43996 > http [ACK] Seq=27704 Ack=499930 Win=131072 Len=0
1004701 336.728464 41.177.34.163 -> 244.3.210.197 TCP 64 43996 > http [ACK] Seq=27704 Ack=502690 Win=131072 Len=0
1004710 336.728795 41.177.34.163 -> 244.3.210.197 TCP 64 43996 > http [ACK] Seq=27704 Ack=505450 Win=131072 Len=0
1004719 336.729145 41.177.34.163 -> 244.3.210.197 TCP 64 43996 > http [ACK] Seq=27704 Ack=508210 Win=131072 Len=0
1004723 336.729445 41.177.34.163 -> 244.3.210.197 TCP 64 43996 > http [ACK] Seq=27704 Ack=510970 Win=131072 Len=0
1004737 336.729897 41.177.34.163 -> 244.3.210.197 TCP 64 43996 > http [ACK] Seq=27704 Ack=513730 Win=131072 Len=0
1004748 336.730363 41.177.34.163 -> 244.3.210.197 TCP 64 43996 > http [ACK] Seq=27704 Ack=516490 Win=131072 Len=0
1004756 336.730557 41.177.34.163 -> 244.3.210.197 TCP 64 43996 > http [ACK] Seq=27704 Ack=519250 Win=131072 Len=0
1004772 336.731955 41.177.34.163 -> 244.3.210.197 TCP 64 43996 > http [ACK] Seq=27704 Ack=522010 Win=131072 Len=0
1004773 336.731960 41.177.34.163 -> 244.3.210.197 TCP 64 43996 > http [ACK] Seq=27704 Ack=524770 Win=131072 Len=0
1004795 336.732447 41.177.34.163 -> 244.3.210.197 TCP 64 43996 > http [ACK] Seq=27704 Ack=527530 Win=131072 Len=0
1004799 336.732634 41.177.34.163 -> 244.3.210.197 TCP 64 43996 > http [ACK] Seq=27704 Ack=530290 Win=131072 Len=0
1004813 336.732963 41.177.34.163 -> 244.3.210.197 TCP 64 43996 > http [ACK] Seq=27704 Ack=533050 Win=131072 Len=0
1004823 336.733292 41.177.34.163 -> 244.3.210.197 TCP 64 43996 > http [ACK] Seq=27704 Ack=535810 Win=131072 Len=0
1004829 336.733548 41.177.34.163 -> 244.3.210.197 TCP 64 43996 > http [ACK] Seq=27704 Ack=538570 Win=131072 Len=0
1004843 336.733902 41.177.34.163 -> 244.3.210.197 TCP 64 43996 > http [ACK] Seq=27704 Ack=541330 Win=131072 Len=0
1004852 336.734197 41.177.34.163 -> 244.3.210.197 TCP 64 43996 > http [ACK] Seq=27704 Ack=544090 Win=131072 Len=0
1004860 336.734496 41.177.34.163 -> 244.3.210.197 TCP 64 43996 > http [ACK] Seq=27704 Ack=546850 Win=131072 Len=0
1004870 336.734822 41.177.34.163 -> 244.3.210.197 TCP 64 43996 > http [ACK] Seq=27704 Ack=549610 Win=131072 Len=0
1004880 336.735095 41.177.34.163 -> 244.3.210.197 TCP 64 43996 > http [ACK] Seq=27704 Ack=552370 Win=131072 Len=0
1004888 336.735389 41.177.34.163 -> 244.3.210.197 TCP 64 43996 > http [ACK] Seq=27704 Ack=555130 Win=131072 Len=0
1004896 336.735738 41.177.34.163 -> 244.3.210.197 TCP 64 43996 > http [ACK] Seq=27704 Ack=557890 Win=131072 Len=0
1004904 336.736088 41.177.34.163 -> 244.3.210.197 TCP 64 43996 > http [ACK] Seq=27704 Ack=560650 Win=131072 Len=0
1004912 336.736565 41.177.34.163 -> 244.3.210.197 TCP 64 43996 > http [ACK] Seq=27704 Ack=563410 Win=131072 Len=0
1004917 336.736810 41.177.34.163 -> 244.3.210.197 TCP 64 43996 > http [ACK] Seq=27704 Ack=566170 Win=131072 Len=0
1004928 336.737008 41.177.34.163 -> 244.3.210.197 TCP 64 43996 > http [ACK] Seq=27704 Ack=568930 Win=131072 Len=0
1004936 336.737448 41.177.34.163 -> 244.3.210.197 TCP 64 43996 > http [ACK] Seq=27704 Ack=571690 Win=131072 Len=0
1004944 336.738056 41.177.34.163 -> 244.3.210.197 TCP 64 43996 > http [ACK] Seq=27704 Ack=574450 Win=131072 Len=0
1004952 336.738269 41.177.34.163 -> 244.3.210.197 TCP 64 43996 > http [ACK] Seq=27704 Ack=577210 Win=131072 Len=0
1004965 336.738949 41.177.34.163 -> 244.3.210.197 TCP 64 43996 > http [ACK] Seq=27704 Ack=579970 Win=131072 Len=0
1004969 336.739074 41.177.34.163 -> 244.3.210.197 TCP 64 43996 > http [ACK] Seq=27704 Ack=582730 Win=131072 Len=0
1004984 336.739384 41.177.34.163 -> 244.3.210.197 TCP 64 43996 > http [ACK] Seq=27704 Ack=585490 Win=131072 Len=0
1004994 336.740025 41.177.34.163 -> 244.3.210.197 TCP 64 43996 > http [ACK] Seq=27704 Ack=588250 Win=131072 Len=0
1005005 336.740468 41.177.34.163 -> 244.3.210.197 TCP 64 43996 > http [ACK] Seq=27704 Ack=591010 Win=131072 Len=0
1005016 336.741099 41.177.34.163 -> 244.3.210.197 TCP 64 43996 > http [ACK] Seq=27704 Ack=593770 Win=131072 Len=0
1005026 336.741366 41.177.34.163 -> 244.3.210.197 TCP 64 43996 > http [ACK] Seq=27704 Ack=596530 Win=131072 Len=0
1005034 336.741778 41.177.34.163 -> 244.3.210.197 TCP 64 43996 > http [ACK] Seq=27704 Ack=599290 Win=131072 Len=0
1005044 336.742063 41.177.34.163 -> 244.3.210.197 TCP 64 43996 > http [ACK] Seq=27704 Ack=602050 Win=131072 Len=0
1005048 336.742309 41.177.34.163 -> 244.3.210.197 TCP 64 43996 > http [ACK] Seq=27704 Ack=604810 Win=131072 Len=0
1005061 336.742958 41.177.34.163 -> 244.3.210.197 TCP 64 43996 > http [ACK] Seq=27704 Ack=607570 Win=131072 Len=0
1005064 336.743384 41.177.34.163 -> 244.3.210.197 TCP 64 43996 > http [ACK] Seq=27704 Ack=610330 Win=131072 Len=0
1005066 336.743470 41.177.34.163 -> 244.3.210.197 TCP 64 43996 > http [ACK] Seq=27704 Ack=613090 Win=131072 Len=0
1005088 336.744234 41.177.34.163 -> 244.3.210.197 TCP 64 43996 > http [ACK] Seq=27704 Ack=615850 Win=131072 Len=0
1005089 336.744239 41.177.34.163 -> 244.3.210.197 TCP 64 43996 > http [ACK] Seq=27704 Ack=618610 Win=131072 Len=0
1005099 336.744680 41.177.34.163 -> 244.3.210.197 TCP 64 43996 > http [ACK] Seq=27704 Ack=621370 Win=131072 Len=0
1005100 336.744684 41.177.34.163 -> 244.3.210.197 TCP 64 43996 > http [ACK] Seq=27704 Ack=624130 Win=131072 Len=0
1005120 336.745029 41.177.34.163 -> 244.3.210.197 TCP 64 43996 > http [ACK] Seq=27704 Ack=626890 Win=131072 Len=0
1005128 336.745887 41.177.34.163 -> 244.3.210.197 TCP 64 43996 > http [ACK] Seq=27704 Ack=629650 Win=131072 Len=0
1005129 336.745892 41.177.34.163 -> 244.3.210.197 TCP 64 43996 > http [ACK] Seq=27704 Ack=632410 Win=131072 Len=0
1005130 336.745896 41.177.34.163 -> 244.3.210.197 TCP 64 43996 > http [ACK] Seq=27704 Ack=635170 Win=131072 Len=0
1005152 336.746516 41.177.34.163 -> 244.3.210.197 TCP 64 43996 > http [ACK] Seq=27704 Ack=637930 Win=131072 Len=0
1005163 336.747160 41.177.34.163 -> 244.3.210.197 TCP 64 43996 > http [ACK] Seq=27704 Ack=640690 Win=131072 Len=0
1005164 336.747164 41.177.34.163 -> 244.3.210.197 TCP 64 43996 > http [ACK] Seq=27704 Ack=643450 Win=131072 Len=0
1005170 336.747334 41.177.34.163 -> 244.3.210.197 TCP 64 43996 > http [ACK] Seq=27704 Ack=646210 Win=131072 Len=0
1005187 336.747626 41.177.34.163 -> 244.3.210.197 TCP 64 43996 > http [ACK] Seq=27704 Ack=648970 Win=131072 Len=0
1005190 336.747906 41.177.34.163 -> 244.3.210.197 TCP 64 43996 > http [ACK] Seq=27704 Ack=651730 Win=131072 Len=0
1005203 336.748383 41.177.34.163 -> 244.3.210.197 TCP 64 43996 > http [ACK] Seq=27704 Ack=654490 Win=131072 Len=0
1005210 336.748691 41.177.34.163 -> 244.3.210.197 TCP 64 43996 > http [ACK] Seq=27704 Ack=657250 Win=131072 Len=0
1005219 336.748917 41.177.34.163 -> 244.3.210.197 TCP 64 43996 > http [ACK] Seq=27704 Ack=660010 Win=131072 Len=0
1005228 336.749089 41.177.34.163 -> 244.3.210.197 TCP 64 43996 > http [ACK] Seq=27704 Ack=662770 Win=131072 Len=0
1005236 336.749450 41.177.34.163 -> 244.3.210.197 TCP 64 43996 > http [ACK] Seq=27704 Ack=665530 Win=131072 Len=0
1005245 336.749749 41.177.34.163 -> 244.3.210.197 TCP 64 43996 > http [ACK] Seq=27704 Ack=668290 Win=131072 Len=0
1005255 336.750048 41.177.34.163 -> 244.3.210.197 TCP 64 43996 > http [ACK] Seq=27704 Ack=671050 Win=131072 Len=0
1005263 336.750357 41.177.34.163 -> 244.3.210.197 TCP 64 43996 > http [ACK] Seq=27704 Ack=673810 Win=131072 Len=0
1005277 336.750903 41.177.34.163 -> 244.3.210.197 TCP 64 43996 > http [ACK] Seq=27704 Ack=676570 Win=131072 Len=0
1005289 336.751181 41.177.34.163 -> 244.3.210.197 TCP 64 43996 > http [ACK] Seq=27704 Ack=679330 Win=131072 Len=0
1005297 336.751499 41.177.34.163 -> 244.3.210.197 TCP 64 43996 > http [ACK] Seq=27704 Ack=682090 Win=131072 Len=0
1005307 336.752023 41.177.34.163 -> 244.3.210.197 TCP 64 43996 > http [ACK] Seq=27704 Ack=684850 Win=131072 Len=0
1005310 336.752266 41.177.34.163 -> 244.3.210.197 TCP 64 43996 > http [ACK] Seq=27704 Ack=687610 Win=131072 Len=0
1005313 336.752746 41.177.34.163 -> 244.3.210.197 TCP 64 43996 > http [ACK] Seq=27704 Ack=690370 Win=131072 Len=0
1005316 336.753133 41.177.34.163 -> 244.3.210.197 TCP 64 43996 > http [ACK] Seq=27704 Ack=693130 Win=131072 Len=0
1005319 336.753468 41.177.34.163 -> 244.3.210.197 TCP 64 43996 > http [ACK] Seq=27704 Ack=695890 Win=131072 Len=0
1005347 336.754650 41.177.34.163 -> 244.3.210.197 TCP 64 43996 > http [ACK] Seq=27704 Ack=698650 Win=131072 Len=0
1005348 336.754655 41.177.34.163 -> 244.3.210.197 TCP 64 43996 > http [ACK] Seq=27704 Ack=701410 Win=131072 Len=0
1005353 336.755146 41.177.34.163 -> 244.3.210.197 TCP 64 43996 > http [ACK] Seq=27704 Ack=704170 Win=131072 Len=0
1005355 336.755155 41.177.34.163 -> 244.3.210.197 TCP 64 43996 > http [ACK] Seq=27704 Ack=706930 Win=131072 Len=0
1005369 336.755365 41.177.34.163 -> 244.3.210.197 TCP 64 43996 > http [ACK] Seq=27704 Ack=709690 Win=131072 Len=0
1005384 336.755740 41.177.34.163 -> 244.3.210.197 TCP 64 43996 > http [ACK] Seq=27704 Ack=712450 Win=131072 Len=0
1005392 336.756012 41.177.34.163 -> 244.3.210.197 TCP 64 43996 > http [ACK] Seq=27704 Ack=715210 Win=131072 Len=0
1005396 336.756355 41.177.34.163 -> 244.3.210.197 TCP 64 43996 > http [ACK] Seq=27704 Ack=717970 Win=131072 Len=0
1005416 336.757087 41.177.34.163 -> 244.3.210.197 TCP 64 43996 > http [ACK] Seq=27704 Ack=720730 Win=131072 Len=0
1005424 336.757604 41.177.34.163 -> 244.3.210.197 TCP 64 43996 > http [ACK] Seq=27704 Ack=723490 Win=131072 Len=0
1005427 336.757888 41.177.34.163 -> 244.3.210.197 TCP 64 43996 > http [ACK] Seq=27704 Ack=726250 Win=131072 Len=0
1005439 336.758342 41.177.34.163 -> 244.3.210.197 TCP 64 43996 > http [ACK] Seq=27704 Ack=729010 Win=131072 Len=0
1005442 336.758450 41.177.34.163 -> 244.3.210.197 TCP 64 43996 > http [ACK] Seq=27704 Ack=731770 Win=131072 Len=0
1005455 336.758798 41.177.34.163 -> 244.3.210.197 TCP 64 43996 > http [ACK] Seq=27704 Ack=734530 Win=131072 Len=0
1005470 336.759928 41.177.34.163 -> 244.3.210.197 TCP 64 43996 > http [ACK] Seq=27704 Ack=737290 Win=131072 Len=0
1005480 336.760723 41.177.34.163 -> 244.3.210.197 TCP 64 43996 > http [ACK] Seq=27704 Ack=740050 Win=131072 Len=0
1005481 336.760727 41.177.34.163 -> 244.3.210.197 TCP 64 43996 > http [ACK] Seq=27704 Ack=742810 Win=131072 Len=0
1005496 336.761051 41.177.34.163 -> 244.3.210.197 TCP 64 43996 > http [ACK] Seq=27704 Ack=745570 Win=131072 Len=0
1005504 336.761380 41.177.34.163 -> 244.3.210.197 TCP 64 43996 > http [ACK] Seq=27704 Ack=748330 Win=131072 Len=0
1005512 336.761871 41.177.34.163 -> 244.3.210.197 TCP 64 43996 > http [ACK] Seq=27704 Ack=751090 Win=131072 Len=0
1005516 336.762042 41.177.34.163 -> 244.3.210.197 TCP 64 43996 > http [ACK] Seq=27704 Ack=753850 Win=131072 Len=0
1005520 336.762333 41.177.34.163 -> 244.3.210.197 TCP 64 43996 > http [ACK] Seq=27704 Ack=756610 Win=131072 Len=0
1005530 336.762699 41.177.34.163 -> 244.3.210.197 TCP 64 43996 > http [ACK] Seq=27704 Ack=759370 Win=131072 Len=0
1005546 336.763142 41.177.34.163 -> 244.3.210.197 TCP 64 43996 > http [ACK] Seq=27704 Ack=762130 Win=131072 Len=0
1005549 336.763442 41.177.34.163 -> 244.3.210.197 TCP 64 43996 > http [ACK] Seq=27704 Ack=764890 Win=131072 Len=0
1005562 336.764109 41.177.34.163 -> 244.3.210.197 TCP 64 43996 > http [ACK] Seq=27704 Ack=767650 Win=131072 Len=0
1005572 336.764687 41.177.34.163 -> 244.3.210.197 TCP 64 43996 > http [ACK] Seq=27704 Ack=770410 Win=131072 Len=0
1005575 336.764964 41.177.34.163 -> 244.3.210.197 TCP 64 43996 > http [ACK] Seq=27704 Ack=773170 Win=131072 Len=0
1005578 336.765270 41.177.34.163 -> 244.3.210.197 TCP 64 43996 > http [ACK] Seq=27704 Ack=775930 Win=131072 Len=0
1005581 336.765640 41.177.34.163 -> 244.3.210.197 TCP 64 43996 > http [ACK] Seq=27704 Ack=778690 Win=131072 Len=0
1005594 336.765868 41.177.34.163 -> 244.3.210.197 TCP 64 43996 > http [ACK] Seq=27704 Ack=781450 Win=131072 Len=0
1005607 336.766170 41.177.34.163 -> 244.3.210.197 TCP 64 43996 > http [ACK] Seq=27704 Ack=784210 Win=131072 Len=0
1005615 336.766612 41.177.34.163 -> 244.3.210.197 TCP 64 43996 > http [ACK] Seq=27704 Ack=786970 Win=131072 Len=0
1005621 336.767169 41.177.34.163 -> 244.3.210.197 TCP 64 43996 > http [ACK] Seq=27704 Ack=789730 Win=131072 Len=0
1005622 336.767463 41.177.34.163 -> 244.3.210.197 TCP 64 43996 > http [ACK] Seq=27704 Ack=792490 Win=131072 Len=0
1005623 336.767759 41.177.34.163 -> 244.3.210.197 TCP 64 43996 > http [ACK] Seq=27704 Ack=795250 Win=131072 Len=0
1005646 336.769351 41.177.34.163 -> 244.3.210.197 TCP 64 43996 > http [ACK] Seq=27704 Ack=798010 Win=131072 Len=0
1005647 336.769867 41.177.34.163 -> 244.3.210.197 TCP 64 43996 > http [ACK] Seq=27704 Ack=800770 Win=131072 Len=0
1005648 336.770659 41.177.34.163 -> 244.3.210.197 TCP 64 43996 > http [ACK] Seq=27704 Ack=803530 Win=131072 Len=0
1005667 336.772026 41.177.34.163 -> 244.3.210.197 TCP 64 43996 > http [ACK] Seq=27704 Ack=806290 Win=131072 Len=0
1005674 336.772425 41.177.34.163 -> 244.3.210.197 TCP 64 43996 > http [ACK] Seq=27704 Ack=809050 Win=131072 Len=0
1005677 336.772714 41.177.34.163 -> 244.3.210.197 TCP 64 43996 > http [ACK] Seq=27704 Ack=811810 Win=131072 Len=0
1005688 336.773018 41.177.34.163 -> 244.3.210.197 TCP 64 43996 > http [ACK] Seq=27704 Ack=814570 Win=131072 Len=0
1005689 336.773358 41.177.34.163 -> 244.3.210.197 TCP 64 43996 > http [ACK] Seq=27704 Ack=817330 Win=131072 Len=0
1005700 336.773658 41.177.34.163 -> 244.3.210.197 TCP 64 43996 > http [ACK] Seq=27704 Ack=820090 Win=131072 Len=0
1005706 336.774053 41.177.34.163 -> 244.3.210.197 TCP 64 43996 > http [ACK] Seq=27704 Ack=822850 Win=131072 Len=0
1005712 336.774505 41.177.34.163 -> 244.3.210.197 TCP 64 43996 > http [ACK] Seq=27704 Ack=825610 Win=131072 Len=0
1005718 336.775467 41.177.34.163 -> 244.3.210.197 TCP 64 43996 > http [ACK] Seq=27704 Ack=828370 Win=131072 Len=0
1005719 336.775471 41.177.34.163 -> 244.3.210.197 TCP 64 43996 > http [ACK] Seq=27704 Ack=831130 Win=131072 Len=0
1005730 336.775908 41.177.34.163 -> 244.3.210.197 TCP 64 43996 > http [ACK] Seq=27704 Ack=833890 Win=131072 Len=0
1005734 336.776255 41.177.34.163 -> 244.3.210.197 TCP 64 43996 > http [ACK] Seq=27704 Ack=836650 Win=131072 Len=0
1005746 336.776511 41.177.34.163 -> 244.3.210.197 TCP 64 43996 > http [ACK] Seq=27704 Ack=839410 Win=131072 Len=0
1005751 336.776810 41.177.34.163 -> 244.3.210.197 TCP 64 43996 > http [ACK] Seq=27704 Ack=842170 Win=131072 Len=0
1005760 336.777162 41.177.34.163 -> 244.3.210.197 TCP 64 43996 > http [ACK] Seq=27704 Ack=844930 Win=131072 Len=0
1005763 336.777463 41.177.34.163 -> 244.3.210.197 TCP 64 43996 > http [ACK] Seq=27704 Ack=847690 Win=131072 Len=0
1005772 336.778152 41.177.34.163 -> 244.3.210.197 TCP 64 43996 > http [ACK] Seq=27704 Ack=850450 Win=131072 Len=0
1005778 336.778546 41.177.34.163 -> 244.3.210.197 TCP 64 43996 > http [ACK] Seq=27704 Ack=853210 Win=131072 Len=0
1005784 336.778845 41.177.34.163 -> 244.3.210.197 TCP 64 43996 > http [ACK] Seq=27704 Ack=855970 Win=131072 Len=0
1005792 336.779141 41.177.34.163 -> 244.3.210.197 TCP 64 43996 > http [ACK] Seq=27704 Ack=858730 Win=131072 Len=0
1005795 336.779547 41.177.34.163 -> 244.3.210.197 TCP 64 43996 > http [ACK] Seq=27704 Ack=861490 Win=131072 Len=0
1005804 336.779993 41.177.34.163 -> 244.3.210.197 TCP 64 43996 > http [ACK] Seq=27704 Ack=864250 Win=131072 Len=0
1005811 336.781652 41.177.34.163 -> 244.3.210.197 TCP 64 43996 > http [ACK] Seq=27704 Ack=867010 Win=131072 Len=0
1005822 336.783760 41.177.34.163 -> 244.3.210.197 TCP 64 43996 > http [ACK] Seq=27704 Ack=869770 Win=131072 Len=0
1005830 336.784258 41.177.34.163 -> 244.3.210.197 TCP 64 43996 > http [ACK] Seq=27704 Ack=872530 Win=131072 Len=0
1005833 336.784376 41.177.34.163 -> 244.3.210.197 TCP 64 43996 > http [ACK] Seq=27704 Ack=875290 Win=131072 Len=0
1005842 336.784950 41.177.34.163 -> 244.3.210.197 TCP 64 43996 > http [ACK] Seq=27704 Ack=878050 Win=131072 Len=0
1005848 336.785376 41.177.34.163 -> 244.3.210.197 TCP 64 43996 > http [ACK] Seq=27704 Ack=880810 Win=131072 Len=0
1005854 336.785682 41.177.34.163 -> 244.3.210.197 TCP 64 43996 > http [ACK] Seq=27704 Ack=883570 Win=131072 Len=0
1005860 336.785983 41.177.34.163 -> 244.3.210.197 TCP 64 43996 > http [ACK] Seq=27704 Ack=886330 Win=131072 Len=0
1005866 336.786294 41.177.34.163 -> 244.3.210.197 TCP 64 43996 > http [ACK] Seq=27704 Ack=889090 Win=131072 Len=0
1005871 336.786579 41.177.34.163 -> 244.3.210.197 TCP 64 43996 > http [ACK] Seq=27704 Ack=891850 Win=131072 Len=0
1005873 336.787171 41.177.34.163 -> 244.3.210.197 TCP 64 43996 > http [ACK] Seq=27704 Ack=894610 Win=131072 Len=0
1005874 336.787432 41.177.34.163 -> 244.3.210.197 TCP 64 43996 > http [ACK] Seq=27704 Ack=897370 Win=131072 Len=0
1005890 336.788084 41.177.34.163 -> 244.3.210.197 TCP 64 43996 > http [ACK] Seq=27704 Ack=900130 Win=131072 Len=0
1005891 336.788378 41.177.34.163 -> 244.3.210.197 TCP 64 43996 > http [ACK] Seq=27704 Ack=902890 Win=131072 Len=0
1005896 336.788693 41.177.34.163 -> 244.3.210.197 TCP 64 43996 > http [ACK] Seq=27704 Ack=905650 Win=131072 Len=0
1005908 336.789102 41.177.34.163 -> 244.3.210.197 TCP 64 43996 > http [ACK] Seq=27704 Ack=908410 Win=131072 Len=0
1005911 336.789574 41.177.34.163 -> 244.3.210.197 TCP 64 43996 > http [ACK] Seq=27704 Ack=911170 Win=131072 Len=0
1005921 336.789828 41.177.34.163 -> 244.3.210.197 TCP 64 43996 > http [ACK] Seq=27704 Ack=913503 Win=131072 Len=0
