448058 145.585224 41.177.251.145 -> 41.177.98.176 TCP 66 descent3 > http [SYN] Seq=0 Win=65535 Len=0 MSS=1260 SACK_PERM=1
448061 145.585687 41.177.251.145 -> 41.177.98.176 TCP 64 descent3 > http [ACK] Seq=1 Ack=1 Win=65535 Len=0
448192 145.616002 41.177.251.145 -> 41.177.98.176 TCP 64 descent3 > http [ACK] Seq=761 Ack=2521 Win=65535 Len=0
448195 145.616688 41.177.251.145 -> 41.177.98.176 TCP 64 descent3 > http [ACK] Seq=761 Ack=5041 Win=65535 Len=0
448201 145.621797 41.177.251.145 -> 41.177.98.176 TCP 64 descent3 > http [ACK] Seq=761 Ack=6570 Win=65535 Len=0
448202 145.622005 41.177.251.145 -> 41.177.98.176 TCP 64 descent3 > http [ACK] Seq=761 Ack=9090 Win=65535 Len=0
448203 145.622122 41.177.251.145 -> 41.177.98.176 TCP 64 descent3 > http [ACK] Seq=761 Ack=10438 Win=65447 Len=0
448269 145.630363 41.177.251.145 -> 41.177.98.176 TCP 64 descent3 > http [ACK] Seq=761 Ack=12958 Win=62927 Len=0
448270 145.630574 41.177.251.145 -> 41.177.98.176 TCP 64 descent3 > http [ACK] Seq=761 Ack=15478 Win=60407 Len=0
448277 145.633913 41.177.251.145 -> 41.177.98.176 TCP 64 descent3 > http [ACK] Seq=761 Ack=16826 Win=59059 Len=0
448278 145.634125 41.177.251.145 -> 41.177.98.176 TCP 64 descent3 > http [ACK] Seq=761 Ack=19346 Win=56539 Len=0
448279 145.634245 41.177.251.145 -> 41.177.98.176 TCP 64 descent3 > http [ACK] Seq=761 Ack=20694 Win=55191 Len=0
448291 145.646414 41.177.251.145 -> 41.177.98.176 TCP 64 descent3 > http [ACK] Seq=761 Ack=23214 Win=52671 Len=0
448295 145.646623 41.177.251.145 -> 41.177.98.176 TCP 64 descent3 > http [ACK] Seq=761 Ack=25734 Win=50151 Len=0
448298 145.646856 41.177.251.145 -> 41.177.98.176 TCP 64 descent3 > http [ACK] Seq=761 Ack=28254 Win=47631 Len=0
448299 145.647055 41.177.251.145 -> 41.177.98.176 TCP 64 descent3 > http [ACK] Seq=761 Ack=30774 Win=45111 Len=0
448311 145.651278 41.177.251.145 -> 41.177.98.176 TCP 64 descent3 > http [ACK] Seq=761 Ack=32202 Win=43683 Len=0
448312 145.651501 41.177.251.145 -> 41.177.98.176 TCP 64 descent3 > http [ACK] Seq=761 Ack=34722 Win=41163 Len=0
448313 145.651617 41.177.251.145 -> 41.177.98.176 TCP 64 descent3 > http [ACK] Seq=761 Ack=36070 Win=39815 Len=0
448322 145.656118 41.177.251.145 -> 41.177.98.176 TCP 64 descent3 > http [ACK] Seq=761 Ack=38590 Win=37295 Len=0
448323 145.656326 41.177.251.145 -> 41.177.98.176 TCP 64 descent3 > http [ACK] Seq=761 Ack=41110 Win=34775 Len=0
448331 145.661386 41.177.251.145 -> 41.177.98.176 TCP 64 descent3 > http [ACK] Seq=761 Ack=42458 Win=33427 Len=0
448332 145.661603 41.177.251.145 -> 41.177.98.176 TCP 64 descent3 > http [ACK] Seq=761 Ack=44978 Win=30907 Len=0
448333 145.661717 41.177.251.145 -> 41.177.98.176 TCP 64 descent3 > http [ACK] Seq=761 Ack=46326 Win=29559 Len=0
448365 145.670206 41.177.251.145 -> 41.177.98.176 TCP 64 descent3 > http [ACK] Seq=761 Ack=48846 Win=27039 Len=0
448379 145.670442 41.177.251.145 -> 41.177.98.176 TCP 64 descent3 > http [ACK] Seq=761 Ack=51366 Win=24519 Len=0
448390 145.678208 41.177.251.145 -> 41.177.98.176 TCP 64 descent3 > http [ACK] Seq=761 Ack=52714 Win=23171 Len=0
448391 145.678430 41.177.251.145 -> 41.177.98.176 TCP 64 descent3 > http [ACK] Seq=761 Ack=55234 Win=20651 Len=0
448392 145.678545 41.177.251.145 -> 41.177.98.176 TCP 64 descent3 > http [ACK] Seq=761 Ack=56582 Win=19303 Len=0
448397 145.682846 41.177.251.145 -> 41.177.98.176 TCP 64 descent3 > http [ACK] Seq=761 Ack=59102 Win=16783 Len=0
448398 145.682993 41.177.251.145 -> 41.177.98.176 TCP 64 descent3 > http [ACK] Seq=761 Ack=60881 Win=15004 Len=0
448480 145.701871 41.177.251.145 -> 41.177.98.176 TCP 64 [TCP Window Update] descent3 > http [ACK] Seq=761 Ack=60881 Win=65535 Len=0
451441 147.030952 41.177.251.145 -> 41.177.98.176 TCP 64 descent3 > http [RST, ACK] Seq=761 Ack=60881 Win=0 Len=0
