183822  61.768187 41.177.98.79 -> 15.186.51.17 TCP 78 http > 39248 [SYN, ACK] Seq=0 Ack=1 Win=5792 Len=0 MSS=1460 SACK_PERM=1 TSval=1381311607 TSecr=1213826174 WS=4
184018  61.836711 41.177.98.79 -> 15.186.51.17 TCP 70 http > 39248 [ACK] Seq=1 Ack=432 Win=6864 Len=0 TSval=1381311676 TSecr=1213826243
184293  61.943078 41.177.98.79 -> 15.186.51.17 TCP 70 http > 39248 [ACK] Seq=5456 Ack=433 Win=6864 Len=0 TSval=1381311782 TSecr=1213826349
187821  63.630700 41.177.98.79 -> 90.80.188.164 TCP 66 http > spocp [SYN, ACK] Seq=0 Ack=1 Win=5840 Len=0 MSS=1460 SACK_PERM=1
187947  63.725428 41.177.98.79 -> 90.80.188.164 TCP 64 http > spocp [ACK] Seq=1 Ack=696 Win=6950 Len=0
188093  63.868752 41.177.98.79 -> 90.80.188.164 TCP 66 http > snap [SYN, ACK] Seq=0 Ack=1 Win=5840 Len=0 MSS=1460 SACK_PERM=1
188107  63.872742 41.177.98.79 -> 90.80.188.164 TCP 66 http > simon [SYN, ACK] Seq=0 Ack=1 Win=5840 Len=0 MSS=1460 SACK_PERM=1
188118  63.876950 41.177.98.79 -> 90.80.188.164 TCP 66 http > 4755 [SYN, ACK] Seq=0 Ack=1 Win=5840 Len=0 MSS=1460 SACK_PERM=1
188119  63.876954 41.177.98.79 -> 90.80.188.164 TCP 66 http > 4754 [SYN, ACK] Seq=0 Ack=1 Win=5840 Len=0 MSS=1460 SACK_PERM=1
188238  63.961052 41.177.98.79 -> 90.80.188.164 TCP 64 http > snap [ACK] Seq=1 Ack=512 Win=6432 Len=0
188268  63.971384 41.177.98.79 -> 90.80.188.164 TCP 64 http > simon [ACK] Seq=1 Ack=512 Win=6432 Len=0
188273  63.983164 41.177.98.79 -> 90.80.188.164 TCP 64 http > 4755 [ACK] Seq=1 Ack=538 Win=6444 Len=0
188328  64.021055 41.177.98.79 -> 90.80.188.164 TCP 64 http > 4754 [ACK] Seq=1 Ack=510 Win=6432 Len=0
188792  64.267999 41.177.98.79 -> 90.80.188.164 TCP 64 http > spocp [ACK] Seq=3364 Ack=1148 Win=8340 Len=0
229930  79.239907 41.177.98.79 -> 90.80.188.164 TCP 64 http > snap [FIN, ACK] Seq=2423 Ack=1041 Win=7504 Len=0
230265  79.492881 41.177.98.79 -> 90.80.188.164 TCP 64 http > spocp [FIN, ACK] Seq=4013 Ack=1148 Win=8340 Len=0
232592  80.434850 41.177.98.79 -> 90.80.188.164 TCP 64 http > 4755 [FIN, ACK] Seq=108198 Ack=538 Win=6444 Len=0
233835  81.035824 41.177.98.79 -> 90.80.188.164 TCP 64 http > 4754 [FIN, ACK] Seq=1633 Ack=893 Win=7504 Len=0
235152  81.872800 41.177.98.79 -> 90.80.188.164 TCP 64 http > simon [FIN, ACK] Seq=7443 Ack=925 Win=7504 Len=0
244252  85.176127 41.177.98.79 -> 90.80.188.164 TCP 64 http > snap [ACK] Seq=2424 Ack=1042 Win=7504 Len=0
244289  85.182802 41.177.98.79 -> 90.80.188.164 TCP 64 http > spocp [ACK] Seq=4014 Ack=1149 Win=8340 Len=0
244298  85.186793 41.177.98.79 -> 90.80.188.164 TCP 64 http > 4755 [ACK] Seq=108199 Ack=539 Win=6444 Len=0
244630  85.288680 41.177.98.79 -> 90.80.188.164 TCP 64 http > 4754 [ACK] Seq=1634 Ack=894 Win=7504 Len=0
245491  85.720743 41.177.98.79 -> 90.80.188.164 TCP 64 http > simon [ACK] Seq=7444 Ack=926 Win=7504 Len=0
274468  92.537518 41.177.98.79 -> 68.157.168.46 TCP 78 http > 62761 [SYN, ACK] Seq=0 Ack=1 Win=5792 Len=0 MSS=1460 SACK_PERM=1 TSval=1381342377 TSecr=155773718 WS=4
274560  92.580443 41.177.98.79 -> 68.157.168.46 TCP 70 http > 62761 [ACK] Seq=1 Ack=274 Win=6864 Len=0 TSval=1381342419 TSecr=155773761
292823  98.312661 41.177.98.79 -> 68.157.168.46 TCP 70 http > 62761 [FIN, ACK] Seq=5054 Ack=275 Win=6864 Len=0 TSval=1381348152 TSecr=155779493
758565 244.225545 41.177.98.79 -> 68.157.168.46 TCP 78 http > 38907 [SYN, ACK] Seq=0 Ack=1 Win=5792 Len=0 MSS=1460 SACK_PERM=1 TSval=1381494065 TSecr=155925401 WS=4
758715 244.268550 41.177.98.79 -> 68.157.168.46 TCP 70 http > 38907 [ACK] Seq=1 Ack=274 Win=6864 Len=0 TSval=1381494108 TSecr=155925444
776236 249.948983 41.177.98.79 -> 68.157.168.46 TCP 70 http > 38907 [FIN, ACK] Seq=4117 Ack=275 Win=6864 Len=0 TSval=1381499789 TSecr=155931124
