12351   3.806240 41.177.26.13 -> 66.224.155.77 TCP 70 http > dic-aida [FIN, ACK] Seq=1 Ack=1 Win=33120 Len=0 TSval=140341977 TSecr=70391
717247 228.886982 41.177.26.13 -> 41.177.230.224 TCP 70 http > 62436 [SYN, ACK] Seq=0 Ack=1 Win=32850 Len=0 WS=2 SACK_PERM=1 MSS=1460
717250 228.887546 41.177.26.13 -> 41.177.230.224 TCP 64 http > 62436 [ACK] Seq=1 Ack=85 Win=65616 Len=0
757272 243.896166 41.177.26.13 -> 41.177.230.224 TCP 64 http > 62436 [FIN, ACK] Seq=14435 Ack=85 Win=65700 Len=0
778087 250.803795 41.177.26.13 -> 254.194.155.167 TCP 82 http > 46747 [SYN, ACK] Seq=0 Ack=1 Win=33304 Len=0 TSval=140366676 TSecr=1846994877 WS=2 SACK_PERM=1 MSS=1460
778267 250.919909 41.177.26.13 -> 254.194.155.167 TCP 70 http > 46747 [ACK] Seq=1 Ack=200 Win=66608 Len=0 TSval=140366688 TSecr=1846994906
778891 251.246205 41.177.26.13 -> 254.194.155.167 TCP 70 http > 46747 [ACK] Seq=14404 Ack=201 Win=66608 Len=0 TSval=140366721 TSecr=1846994987
782199 252.964162 41.177.26.13 -> 41.177.230.224 TCP 64 http > 62436 [ACK] Seq=14436 Ack=86 Win=65700 Len=0
