2972   0.971627 41.177.26.22 -> 198.177.110.202 TCP 66 http > 52860 [SYN, ACK] Seq=0 Ack=1 Win=64240 Len=0 SACK_PERM=1 MSS=1460
3093   1.037655 41.177.26.22 -> 198.177.110.202 TCP 64 http > 52860 [ACK] Seq=1 Ack=199 Win=64042 Len=0
38855  16.046261 41.177.26.22 -> 198.177.110.202 TCP 64 http > 52860 [FIN, ACK] Seq=774 Ack=199 Win=64240 Len=0
300333 101.247127 41.177.26.22 -> 198.177.110.202 TCP 64 http > 52860 [RST] Seq=775 Win=0 Len=0
327814 113.390037 41.177.26.22 -> 198.177.110.202 TCP 66 http > 53891 [SYN, ACK] Seq=0 Ack=1 Win=64240 Len=0 SACK_PERM=1 MSS=1460
327869 113.455941 41.177.26.22 -> 198.177.110.202 TCP 64 http > 53891 [ACK] Seq=1 Ack=199 Win=64042 Len=0
386334 128.466311 41.177.26.22 -> 198.177.110.202 TCP 64 http > 53891 [FIN, ACK] Seq=774 Ack=199 Win=64240 Len=0
681610 213.657606 41.177.26.22 -> 198.177.110.202 TCP 64 http > 53891 [RST] Seq=775 Win=0 Len=0
717296 228.891991 41.177.26.22 -> 41.177.230.224 TCP 70 http > 62437 [SYN, ACK] Seq=0 Ack=1 Win=32850 Len=0 WS=2 SACK_PERM=1 MSS=1460
717309 228.892474 41.177.26.22 -> 41.177.230.224 TCP 64 http > 62437 [ACK] Seq=1 Ack=80 Win=65620 Len=0
717344 228.898375 41.177.26.22 -> 41.177.230.224 TCP 64 http > 62437 [ACK] Seq=619 Ack=190 Win=65700 Len=0
744859 238.107439 41.177.26.22 -> 198.177.110.202 TCP 66 http > 55026 [SYN, ACK] Seq=0 Ack=1 Win=64240 Len=0 SACK_PERM=1 MSS=1460
745058 238.173326 41.177.26.22 -> 198.177.110.202 TCP 64 http > 55026 [ACK] Seq=1 Ack=199 Win=64240 Len=0
757321 243.906213 41.177.26.22 -> 41.177.230.224 TCP 64 http > 62437 [FIN, ACK] Seq=3324 Ack=190 Win=65700 Len=0
782445 253.186180 41.177.26.22 -> 198.177.110.202 TCP 64 http > 55026 [FIN, ACK] Seq=774 Ack=199 Win=64240 Len=0
785979 254.900003 41.177.26.22 -> 41.177.230.224 TCP 64 http > 62437 [ACK] Seq=3325 Ack=191 Win=65700 Len=0
1009387 338.359776 41.177.26.22 -> 198.177.110.202 TCP 64 http > 55026 [RST] Seq=775 Win=0 Len=0
