1007731 337.486177 41.177.26.210 -> 41.177.98.176 TCP 66 jwalkserver > http [SYN] Seq=0 Win=65535 Len=0 MSS=1460 SACK_PERM=1
1007733 337.486607 41.177.26.210 -> 41.177.98.176 TCP 64 jwalkserver > http [ACK] Seq=1 Ack=1 Win=65535 Len=0
1012270 339.967849 41.177.26.210 -> 41.177.98.176 TCP 64 jwalkserver > http [ACK] Seq=1240 Ack=2921 Win=65535 Len=0
1012276 339.968331 41.177.26.210 -> 41.177.98.176 TCP 64 jwalkserver > http [ACK] Seq=1240 Ack=5335 Win=65535 Len=0
1012287 339.970372 41.177.26.210 -> 41.177.98.176 TCP 64 jwalkserver > http [ACK] Seq=1240 Ack=8255 Win=65535 Len=0
1012288 339.970547 41.177.26.210 -> 41.177.98.176 TCP 64 jwalkserver > http [ACK] Seq=1240 Ack=10463 Win=65535 Len=0
1012293 339.973202 41.177.26.210 -> 41.177.98.176 TCP 64 jwalkserver > http [ACK] Seq=1240 Ack=13383 Win=65535 Len=0
1012294 339.973384 41.177.26.210 -> 41.177.98.176 TCP 64 jwalkserver > http [ACK] Seq=1240 Ack=15591 Win=64787 Len=0
1012295 339.974833 41.177.26.210 -> 41.177.98.176 TCP 64 [TCP Window Update] jwalkserver > http [ACK] Seq=1240 Ack=15591 Win=65535 Len=0
1012301 339.978101 41.177.26.210 -> 41.177.98.176 TCP 64 jwalkserver > http [ACK] Seq=1240 Ack=18511 Win=65535 Len=0
1012302 339.978226 41.177.26.210 -> 41.177.98.176 TCP 64 jwalkserver > http [ACK] Seq=1240 Ack=19997 Win=65535 Len=0
1012320 339.999310 41.177.26.210 -> 41.177.98.176 TCP 66 winjaserver > http [SYN] Seq=0 Win=65535 Len=0 MSS=1460 SACK_PERM=1
1012322 339.999596 41.177.26.210 -> 41.177.98.176 TCP 64 winjaserver > http [ACK] Seq=1 Ack=1 Win=65535 Len=0
1012330 340.001788 41.177.26.210 -> 41.177.98.176 TCP 64 winjaserver > http [ACK] Seq=989 Ack=2921 Win=65535 Len=0
1012335 340.002704 41.177.26.210 -> 41.177.98.176 TCP 64 winjaserver > http [ACK] Seq=989 Ack=5480 Win=65535 Len=0
1012499 340.151827 41.177.26.210 -> 41.177.98.176 TCP 64 winjaserver > http [ACK] Seq=1976 Ack=6197 Win=65535 Len=0
1012903 340.476055 41.177.26.210 -> 41.177.98.176 TCP 64 winjaserver > http [ACK] Seq=2962 Ack=7967 Win=65535 Len=0
1012906 340.476324 41.177.26.210 -> 41.177.98.176 TCP 64 winjaserver > http [ACK] Seq=2962 Ack=10887 Win=65535 Len=0
1012911 340.476550 41.177.26.210 -> 41.177.98.176 TCP 64 winjaserver > http [ACK] Seq=2962 Ack=13807 Win=65535 Len=0
1012914 340.476755 41.177.26.210 -> 41.177.98.176 TCP 64 winjaserver > http [ACK] Seq=2962 Ack=16159 Win=65535 Len=0
1012917 340.476997 41.177.26.210 -> 41.177.98.176 TCP 64 winjaserver > http [ACK] Seq=2962 Ack=19079 Win=65535 Len=0
1012920 340.477249 41.177.26.210 -> 41.177.98.176 TCP 64 winjaserver > http [ACK] Seq=2962 Ack=21999 Win=65535 Len=0
1012923 340.477493 41.177.26.210 -> 41.177.98.176 TCP 64 winjaserver > http [ACK] Seq=2962 Ack=24919 Win=65535 Len=0
1012926 340.477743 41.177.26.210 -> 41.177.98.176 TCP 64 winjaserver > http [ACK] Seq=2962 Ack=27839 Win=65535 Len=0
1012931 340.477990 41.177.26.210 -> 41.177.98.176 TCP 64 winjaserver > http [ACK] Seq=2962 Ack=30759 Win=65535 Len=0
1012934 340.478234 41.177.26.210 -> 41.177.98.176 TCP 64 winjaserver > http [ACK] Seq=2962 Ack=33679 Win=65535 Len=0
1012937 340.478489 41.177.26.210 -> 41.177.98.176 TCP 64 winjaserver > http [ACK] Seq=2962 Ack=36599 Win=65535 Len=0
1012942 340.478718 41.177.26.210 -> 41.177.98.176 TCP 64 winjaserver > http [ACK] Seq=2962 Ack=39519 Win=65535 Len=0
1012945 340.478963 41.177.26.210 -> 41.177.98.176 TCP 64 winjaserver > http [ACK] Seq=2962 Ack=42439 Win=65535 Len=0
1012948 340.479213 41.177.26.210 -> 41.177.98.176 TCP 64 winjaserver > http [ACK] Seq=2962 Ack=45359 Win=65535 Len=0
1012951 340.479458 41.177.26.210 -> 41.177.98.176 TCP 64 winjaserver > http [ACK] Seq=2962 Ack=48279 Win=65535 Len=0
1012954 340.479706 41.177.26.210 -> 41.177.98.176 TCP 64 winjaserver > http [ACK] Seq=2962 Ack=51199 Win=65535 Len=0
1012957 340.479951 41.177.26.210 -> 41.177.98.176 TCP 64 winjaserver > http [ACK] Seq=2962 Ack=54119 Win=65535 Len=0
1012960 340.480200 41.177.26.210 -> 41.177.98.176 TCP 64 winjaserver > http [ACK] Seq=2962 Ack=57039 Win=65535 Len=0
1012963 340.480447 41.177.26.210 -> 41.177.98.176 TCP 64 winjaserver > http [ACK] Seq=2962 Ack=59959 Win=65535 Len=0
1012967 340.480695 41.177.26.210 -> 41.177.98.176 TCP 64 winjaserver > http [ACK] Seq=2962 Ack=62879 Win=65535 Len=0
1012968 340.480943 41.177.26.210 -> 41.177.98.176 TCP 64 winjaserver > http [ACK] Seq=2962 Ack=65865 Win=65535 Len=0
1013003 340.508912 41.177.26.210 -> 41.177.98.176 TCP 64 winjaserver > http [ACK] Seq=3947 Ack=67634 Win=65535 Len=0
1013007 340.509151 41.177.26.210 -> 41.177.98.176 TCP 64 winjaserver > http [ACK] Seq=3947 Ack=70554 Win=65535 Len=0
1013008 340.509403 41.177.26.210 -> 41.177.98.176 TCP 64 winjaserver > http [ACK] Seq=3947 Ack=73599 Win=65535 Len=0
1013024 340.517681 41.177.26.210 -> 41.177.98.176 TCP 64 jwalkserver > http [ACK] Seq=3228 Ack=23747 Win=65535 Len=0
1013025 340.517932 41.177.26.210 -> 41.177.98.176 TCP 64 jwalkserver > http [ACK] Seq=3228 Ack=26519 Win=65535 Len=0
1013063 340.527664 41.177.26.210 -> 41.177.98.176 TCP 64 winjaserver > http [ACK] Seq=4945 Ack=75369 Win=65535 Len=0
1013068 340.527911 41.177.26.210 -> 41.177.98.176 TCP 64 winjaserver > http [ACK] Seq=4945 Ack=78289 Win=65535 Len=0
1013077 340.528157 41.177.26.210 -> 41.177.98.176 TCP 64 winjaserver > http [ACK] Seq=4945 Ack=81209 Win=65535 Len=0
1013082 340.528362 41.177.26.210 -> 41.177.98.176 TCP 64 winjaserver > http [ACK] Seq=4945 Ack=83561 Win=65535 Len=0
1013085 340.528691 41.177.26.210 -> 41.177.98.176 TCP 64 winjaserver > http [ACK] Seq=4945 Ack=84309 Win=65535 Len=0
1013107 340.536228 41.177.26.210 -> 41.177.98.176 TCP 64 jwalkserver > http [ACK] Seq=4224 Ack=29439 Win=65535 Len=0
1013109 340.536417 41.177.26.210 -> 41.177.98.176 TCP 64 jwalkserver > http [ACK] Seq=4224 Ack=31755 Win=65535 Len=0
1013130 340.543362 41.177.26.210 -> 41.177.98.176 TCP 64 winjaserver > http [ACK] Seq=5952 Ack=86078 Win=65535 Len=0
1013134 340.543617 41.177.26.210 -> 41.177.98.176 TCP 64 winjaserver > http [ACK] Seq=5952 Ack=88998 Win=65535 Len=0
1013137 340.543851 41.177.26.210 -> 41.177.98.176 TCP 64 winjaserver > http [ACK] Seq=5952 Ack=91918 Win=65535 Len=0
1013138 340.544028 41.177.26.210 -> 41.177.98.176 TCP 64 winjaserver > http [ACK] Seq=5952 Ack=93895 Win=65535 Len=0
1013155 340.551153 41.177.26.210 -> 41.177.98.176 TCP 64 jwalkserver > http [ACK] Seq=5232 Ack=33853 Win=65535 Len=0
1013183 340.559125 41.177.26.210 -> 41.177.98.176 TCP 64 winjaserver > http [ACK] Seq=6943 Ack=96815 Win=65535 Len=0
1013185 340.559338 41.177.26.210 -> 41.177.98.176 TCP 64 winjaserver > http [ACK] Seq=6943 Ack=99503 Win=65535 Len=0
1013231 340.566709 41.177.26.210 -> 41.177.98.176 TCP 64 jwalkserver > http [ACK] Seq=6222 Ack=35623 Win=65535 Len=0
1013238 340.566946 41.177.26.210 -> 41.177.98.176 TCP 64 jwalkserver > http [ACK] Seq=6222 Ack=38543 Win=65535 Len=0
1013244 340.567190 41.177.26.210 -> 41.177.98.176 TCP 64 jwalkserver > http [ACK] Seq=6222 Ack=41463 Win=65535 Len=0
1013252 340.567404 41.177.26.210 -> 41.177.98.176 TCP 64 jwalkserver > http [ACK] Seq=6222 Ack=43815 Win=65535 Len=0
1013256 340.567639 41.177.26.210 -> 41.177.98.176 TCP 64 jwalkserver > http [ACK] Seq=6222 Ack=46735 Win=62615 Len=0
1013258 340.567851 41.177.26.210 -> 41.177.98.176 TCP 64 jwalkserver > http [ACK] Seq=6222 Ack=49058 Win=60292 Len=0
1013259 340.567876 41.177.26.210 -> 41.177.98.176 TCP 64 [TCP Window Update] jwalkserver > http [ACK] Seq=6222 Ack=49058 Win=64052 Len=0
1013261 340.568014 41.177.26.210 -> 41.177.98.176 TCP 64 [TCP Window Update] jwalkserver > http [ACK] Seq=6222 Ack=49058 Win=65535 Len=0
1013361 340.601316 41.177.26.210 -> 41.177.98.176 TCP 64 winjaserver > http [ACK] Seq=7931 Ack=101272 Win=65535 Len=0
1013373 340.601634 41.177.26.210 -> 41.177.98.176 TCP 64 winjaserver > http [ACK] Seq=7931 Ack=104192 Win=65535 Len=0
1013375 340.601792 41.177.26.210 -> 41.177.98.176 TCP 64 winjaserver > http [ACK] Seq=7931 Ack=107112 Win=65535 Len=0
1013376 340.601942 41.177.26.210 -> 41.177.98.176 TCP 64 winjaserver > http [ACK] Seq=7931 Ack=108825 Win=65535 Len=0
1013485 340.640260 41.177.26.210 -> 41.177.98.176 TCP 64 winjaserver > http [ACK] Seq=9913 Ack=110913 Win=65535 Len=0
1013496 340.643352 41.177.26.210 -> 41.177.98.176 TCP 64 jwalkserver > http [ACK] Seq=9189 Ack=52118 Win=65535 Len=0
1013512 340.648029 41.177.26.210 -> 41.177.98.176 TCP 64 winjaserver > http [ACK] Seq=10903 Ack=112670 Win=65535 Len=0
1013518 340.648301 41.177.26.210 -> 41.177.98.176 TCP 64 winjaserver > http [ACK] Seq=10903 Ack=115590 Win=65535 Len=0
1013520 340.648530 41.177.26.210 -> 41.177.98.176 TCP 64 winjaserver > http [ACK] Seq=10903 Ack=118510 Win=65535 Len=0
1013524 340.648734 41.177.26.210 -> 41.177.98.176 TCP 64 winjaserver > http [ACK] Seq=10903 Ack=120862 Win=65535 Len=0
1013525 340.648884 41.177.26.210 -> 41.177.98.176 TCP 64 winjaserver > http [ACK] Seq=10903 Ack=122705 Win=63692 Len=0
1013578 340.668515 41.177.26.210 -> 41.177.98.176 TCP 64 [TCP Window Update] winjaserver > http [ACK] Seq=10903 Ack=122705 Win=65535 Len=0
1013592 340.672800 41.177.26.210 -> 41.177.98.176 TCP 64 winjaserver > http [ACK] Seq=11893 Ack=125625 Win=65535 Len=0
1013593 340.673021 41.177.26.210 -> 41.177.98.176 TCP 64 winjaserver > http [ACK] Seq=11893 Ack=128134 Win=65535 Len=0
1013955 340.852846 41.177.26.210 -> 41.177.98.176 TCP 64 winjaserver > http [ACK] Seq=12890 Ack=129250 Win=65535 Len=0
1013956 340.852851 41.177.26.210 -> 41.177.98.176 TCP 64 jwalkserver > http [ACK] Seq=10180 Ack=53507 Win=65535 Len=0
1014561 341.253422 41.177.26.210 -> 41.177.98.176 TCP 64 jwalkserver > http [ACK] Seq=11169 Ack=53842 Win=65200 Len=0
1014680 341.353539 41.177.26.210 -> 41.177.98.176 TCP 64 winjaserver > http [ACK] Seq=13886 Ack=129944 Win=65535 Len=0
