31816  13.410441 41.177.2.124 -> 41.177.98.176 TCP 64 xap-ha > http [ACK] Seq=1 Ack=2 Win=65206 Len=0
32129  13.630382 41.177.2.124 -> 41.177.98.176 TCP 64 servistaitsm > http [ACK] Seq=1 Ack=2 Win=65535 Len=0
42735  18.031005 41.177.2.124 -> 41.177.98.176 TCP 64 xap-ha > http [RST, ACK] Seq=1 Ack=2 Win=0 Len=0
42736  18.031037 41.177.2.124 -> 41.177.98.176 TCP 64 servistaitsm > http [RST, ACK] Seq=1 Ack=2 Win=0 Len=0
748741 239.840075 41.177.2.124 -> 41.177.98.176 TCP 66 launchbird-lm > http [SYN] Seq=0 Win=65535 Len=0 MSS=1460 SACK_PERM=1
748743 239.840853 41.177.2.124 -> 41.177.98.176 TCP 64 launchbird-lm > http [ACK] Seq=1 Ack=1 Win=65535 Len=0
753923 241.973499 41.177.2.124 -> 41.177.98.176 TCP 64 launchbird-lm > http [ACK] Seq=1059 Ack=4381 Win=65535 Len=0
753933 241.976145 41.177.2.124 -> 41.177.98.176 TCP 64 launchbird-lm > http [ACK] Seq=1059 Ack=8255 Win=65535 Len=0
753935 241.976919 41.177.2.124 -> 41.177.98.176 TCP 64 launchbird-lm > http [ACK] Seq=1059 Ack=10463 Win=65535 Len=0
753942 241.978992 41.177.2.124 -> 41.177.98.176 TCP 64 launchbird-lm > http [ACK] Seq=1059 Ack=13383 Win=65535 Len=0
753943 241.979324 41.177.2.124 -> 41.177.98.176 TCP 64 launchbird-lm > http [ACK] Seq=1059 Ack=15591 Win=65535 Len=0
753944 241.979839 41.177.2.124 -> 41.177.98.176 TCP 66 heartbeat > http [SYN] Seq=0 Win=65535 Len=0 MSS=1460 SACK_PERM=1
753946 241.980517 41.177.2.124 -> 41.177.98.176 TCP 64 heartbeat > http [ACK] Seq=1 Ack=1 Win=65535 Len=0
753961 241.985506 41.177.2.124 -> 41.177.98.176 TCP 64 launchbird-lm > http [ACK] Seq=1059 Ack=18367 Win=65535 Len=0
754375 242.234373 41.177.2.124 -> 41.177.98.176 TCP 64 heartbeat > http [ACK] Seq=9219 Ack=1844 Win=65200 Len=0
754376 242.234378 41.177.2.124 -> 41.177.98.176 TCP 64 launchbird-lm > http [ACK] Seq=7774 Ack=19700 Win=64202 Len=0
757227 243.888091 41.177.2.124 -> 41.177.98.176 TCP 64 launchbird-lm > http [ACK] Seq=8983 Ack=22620 Win=65535 Len=0
757229 243.888390 41.177.2.124 -> 41.177.98.176 TCP 64 launchbird-lm > http [ACK] Seq=8983 Ack=25033 Win=65535 Len=0
757242 243.890739 41.177.2.124 -> 41.177.98.176 TCP 64 launchbird-lm > http [ACK] Seq=8983 Ack=27953 Win=65535 Len=0
757245 243.891073 41.177.2.124 -> 41.177.98.176 TCP 64 launchbird-lm > http [ACK] Seq=8983 Ack=30161 Win=65535 Len=0
757256 243.893595 41.177.2.124 -> 41.177.98.176 TCP 64 launchbird-lm > http [ACK] Seq=8983 Ack=33081 Win=65535 Len=0
757258 243.893911 41.177.2.124 -> 41.177.98.176 TCP 64 launchbird-lm > http [ACK] Seq=8983 Ack=35289 Win=65535 Len=0
757288 243.897615 41.177.2.124 -> 41.177.98.176 TCP 64 launchbird-lm > http [ACK] Seq=8983 Ack=39017 Win=65535 Len=0
757998 244.078083 41.177.2.124 -> 41.177.98.176 TCP 64 launchbird-lm > http [ACK] Seq=9879 Ack=39184 Win=65368 Len=0
758773 244.296850 41.177.2.124 -> 41.177.98.176 TCP 64 heartbeat > http [ACK] Seq=13620 Ack=3826 Win=65535 Len=0
777185 250.407185 41.177.2.124 -> 41.177.98.176 TCP 64 launchbird-lm > http [ACK] Seq=11170 Ack=44517 Win=65535 Len=0
777195 250.409819 41.177.2.124 -> 41.177.98.176 TCP 64 launchbird-lm > http [ACK] Seq=11170 Ack=47437 Win=65535 Len=0
777197 250.410097 41.177.2.124 -> 41.177.98.176 TCP 64 launchbird-lm > http [ACK] Seq=11170 Ack=49645 Win=65535 Len=0
777208 250.413585 41.177.2.124 -> 41.177.98.176 TCP 64 launchbird-lm > http [ACK] Seq=11170 Ack=52565 Win=65535 Len=0
777211 250.413887 41.177.2.124 -> 41.177.98.176 TCP 64 launchbird-lm > http [ACK] Seq=11170 Ack=54773 Win=65535 Len=0
777738 250.593676 41.177.2.124 -> 41.177.98.176 TCP 64 launchbird-lm > http [ACK] Seq=11170 Ack=56175 Win=64133 Len=0
795210 259.111562 41.177.2.124 -> 41.177.98.176 TCP 64 heartbeat > http [ACK] Seq=13620 Ack=3827 Win=65535 Len=0
795718 259.338502 41.177.2.124 -> 41.177.98.176 TCP 64 heartbeat > http [FIN, ACK] Seq=13620 Ack=3827 Win=65535 Len=0
800781 261.671658 41.177.2.124 -> 41.177.98.176 TCP 64 launchbird-lm > http [ACK] Seq=11806 Ack=59095 Win=65535 Len=0
800782 261.671959 41.177.2.124 -> 41.177.98.176 TCP 64 launchbird-lm > http [ACK] Seq=11806 Ack=61508 Win=65535 Len=0
800791 261.674505 41.177.2.124 -> 41.177.98.176 TCP 64 launchbird-lm > http [ACK] Seq=11806 Ack=64428 Win=65535 Len=0
800792 261.674825 41.177.2.124 -> 41.177.98.176 TCP 64 launchbird-lm > http [ACK] Seq=11806 Ack=66636 Win=65535 Len=0
800799 261.676962 41.177.2.124 -> 41.177.98.176 TCP 66 linktest > http [SYN] Seq=0 Win=65535 Len=0 MSS=1460 SACK_PERM=1
800811 261.677662 41.177.2.124 -> 41.177.98.176 TCP 64 launchbird-lm > http [ACK] Seq=11806 Ack=71764 Win=65535 Len=0
800813 261.677983 41.177.2.124 -> 41.177.98.176 TCP 64 linktest > http [ACK] Seq=1 Ack=1 Win=65535 Len=0
801268 261.937376 41.177.2.124 -> 41.177.98.176 TCP 64 linktest > http [ACK] Seq=9385 Ack=2007 Win=65032 Len=0
801395 262.046735 41.177.2.124 -> 41.177.98.176 TCP 64 launchbird-lm > http [ACK] Seq=20333 Ack=74156 Win=64664 Len=0
842536 276.830938 41.177.2.124 -> 41.177.98.176 TCP 64 linktest > http [ACK] Seq=9385 Ack=2008 Win=65032 Len=0
842692 276.910826 41.177.2.124 -> 41.177.98.176 TCP 64 launchbird-lm > http [ACK] Seq=20333 Ack=74157 Win=64664 Len=0
853892 282.261337 41.177.2.124 -> 41.177.98.176 TCP 64 linktest > http [RST, ACK] Seq=9385 Ack=2008 Win=0 Len=0
853893 282.261371 41.177.2.124 -> 41.177.98.176 TCP 64 launchbird-lm > http [RST, ACK] Seq=20333 Ack=74157 Win=0 Len=0
874467 289.401368 41.177.2.124 -> 41.177.98.176 TCP 66 canon-capt > http [SYN] Seq=0 Win=65535 Len=0 MSS=1460 SACK_PERM=1
874473 289.402081 41.177.2.124 -> 41.177.98.176 TCP 64 canon-capt > http [ACK] Seq=1 Ack=1 Win=65535 Len=0
877978 291.358048 41.177.2.124 -> 41.177.98.176 TCP 64 canon-capt > http [ACK] Seq=1318 Ack=4381 Win=65535 Len=0
877983 291.360805 41.177.2.124 -> 41.177.98.176 TCP 64 canon-capt > http [ACK] Seq=1318 Ack=8255 Win=65535 Len=0
877985 291.361574 41.177.2.124 -> 41.177.98.176 TCP 64 canon-capt > http [ACK] Seq=1318 Ack=10463 Win=65535 Len=0
877990 291.363680 41.177.2.124 -> 41.177.98.176 TCP 64 canon-capt > http [ACK] Seq=1318 Ack=13383 Win=65535 Len=0
877991 291.363994 41.177.2.124 -> 41.177.98.176 TCP 64 canon-capt > http [ACK] Seq=1318 Ack=15591 Win=65535 Len=0
877992 291.364538 41.177.2.124 -> 41.177.98.176 TCP 66 grf-port > http [SYN] Seq=0 Win=65535 Len=0 MSS=1460 SACK_PERM=1
877994 291.365210 41.177.2.124 -> 41.177.98.176 TCP 64 grf-port > http [ACK] Seq=1 Ack=1 Win=65535 Len=0
878383 291.593459 41.177.2.124 -> 41.177.98.176 TCP 64 grf-port > http [ACK] Seq=9175 Ack=1844 Win=65200 Len=0
878384 291.593463 41.177.2.124 -> 41.177.98.176 TCP 64 canon-capt > http [ACK] Seq=7167 Ack=18134 Win=64536 Len=0
911066 301.375466 41.177.2.124 -> 41.177.98.176 TCP 64 canon-capt > http [ACK] Seq=8378 Ack=23467 Win=65535 Len=0
911074 301.378101 41.177.2.124 -> 41.177.98.176 TCP 64 canon-capt > http [ACK] Seq=8378 Ack=26387 Win=65535 Len=0
911075 301.378429 41.177.2.124 -> 41.177.98.176 TCP 64 canon-capt > http [ACK] Seq=8378 Ack=28595 Win=65535 Len=0
911083 301.381186 41.177.2.124 -> 41.177.98.176 TCP 64 canon-capt > http [ACK] Seq=8378 Ack=31515 Win=65535 Len=0
911084 301.381516 41.177.2.124 -> 41.177.98.176 TCP 64 canon-capt > http [ACK] Seq=8378 Ack=33723 Win=65535 Len=0
911089 301.383999 41.177.2.124 -> 41.177.98.176 TCP 64 canon-capt > http [ACK] Seq=8378 Ack=36643 Win=65535 Len=0
911091 301.384312 41.177.2.124 -> 41.177.98.176 TCP 64 canon-capt > http [ACK] Seq=8378 Ack=38851 Win=65535 Len=0
911096 301.385649 41.177.2.124 -> 41.177.98.176 TCP 64 canon-capt > http [ACK] Seq=8378 Ack=39359 Win=65027 Len=0
911838 301.624661 41.177.2.124 -> 41.177.98.176 TCP 64 grf-port > http [ACK] Seq=11883 Ack=2348 Win=64696 Len=0
912091 301.734018 41.177.2.124 -> 41.177.98.176 TCP 64 canon-capt > http [ACK] Seq=11002 Ack=40411 Win=65535 Len=0
954237 316.459038 41.177.2.124 -> 41.177.98.176 TCP 64 grf-port > http [ACK] Seq=11883 Ack=2349 Win=64696 Len=0
954790 316.619288 41.177.2.124 -> 41.177.98.176 TCP 64 canon-capt > http [ACK] Seq=11002 Ack=40412 Win=65535 Len=0
956849 317.682848 41.177.2.124 -> 41.177.98.176 TCP 64 grf-port > http [RST, ACK] Seq=11883 Ack=2349 Win=0 Len=0
956850 317.682880 41.177.2.124 -> 41.177.98.176 TCP 64 canon-capt > http [RST, ACK] Seq=11002 Ack=40412 Win=0 Len=0
