9737   3.440772 41.177.159.194 -> 244.3.160.239 TCP 66 14779 > http [SYN] Seq=0 Win=16384 Len=0 MSS=1380 SACK_PERM=1
9740   3.441597 41.177.159.194 -> 244.3.160.239 TCP 64 14779 > http [ACK] Seq=1 Ack=1 Win=16560 Len=0
10483   3.607762 41.177.159.194 -> 244.3.160.239 TCP 64 14779 > http [ACK] Seq=813 Ack=1633 Win=16560 Len=0
10487   3.608793 41.177.159.194 -> 244.3.160.239 TCP 64 14779 > http [ACK] Seq=813 Ack=4332 Win=16560 Len=0
10553   3.632072 41.177.159.194 -> 244.3.160.239 TCP 64 14779 > http [ACK] Seq=813 Ack=7187 Win=16560 Len=0
10554   3.632077 41.177.159.194 -> 244.3.160.239 TCP 64 14779 > http [ACK] Seq=813 Ack=8821 Win=16560 Len=0
11976   3.707139 41.177.159.194 -> 244.3.160.239 TCP 64 14779 > http [ACK] Seq=813 Ack=8822 Win=16560 Len=0
12236   3.727582 41.177.159.194 -> 244.3.160.239 TCP 64 14779 > http [FIN, ACK] Seq=813 Ack=8822 Win=16560 Len=0
21346   7.332179 41.177.159.194 -> 244.3.160.239 TCP 66 14812 > http [SYN] Seq=0 Win=16384 Len=0 MSS=1380 SACK_PERM=1
21348   7.333109 41.177.159.194 -> 244.3.160.239 TCP 64 14812 > http [ACK] Seq=1 Ack=1 Win=16560 Len=0
21764   7.554553 41.177.159.194 -> 244.3.160.239 TCP 64 14812 > http [ACK] Seq=813 Ack=3013 Win=16560 Len=0
21769   7.555708 41.177.159.194 -> 244.3.160.239 TCP 64 14812 > http [ACK] Seq=813 Ack=5712 Win=16560 Len=0
21770   7.555870 41.177.159.194 -> 244.3.160.239 TCP 64 14812 > http [ACK] Seq=813 Ack=7092 Win=16560 Len=0
21948   7.663974 41.177.159.194 -> 244.3.160.239 TCP 64 14812 > http [ACK] Seq=813 Ack=8821 Win=16560 Len=0
22119   7.773921 41.177.159.194 -> 244.3.160.239 TCP 64 14812 > http [ACK] Seq=813 Ack=8822 Win=16560 Len=0
22123   7.776780 41.177.159.194 -> 244.3.160.239 TCP 64 14812 > http [FIN, ACK] Seq=813 Ack=8822 Win=16560 Len=0
25966  10.110586 41.177.159.194 -> 244.3.160.239 TCP 66 taskman-port > http [SYN] Seq=0 Win=16384 Len=0 MSS=1380 SACK_PERM=1
25968  10.111483 41.177.159.194 -> 244.3.160.239 TCP 64 taskman-port > http [ACK] Seq=1 Ack=1 Win=16560 Len=0
26346  10.324486 41.177.159.194 -> 244.3.160.239 TCP 64 taskman-port > http [ACK] Seq=813 Ack=1633 Win=16560 Len=0
26350  10.325594 41.177.159.194 -> 244.3.160.239 TCP 64 taskman-port > http [ACK] Seq=813 Ack=4332 Win=16560 Len=0
26351  10.325809 41.177.159.194 -> 244.3.160.239 TCP 64 taskman-port > http [ACK] Seq=813 Ack=7092 Win=16560 Len=0
26589  10.434257 41.177.159.194 -> 244.3.160.239 TCP 64 taskman-port > http [ACK] Seq=813 Ack=8821 Win=16560 Len=0
26775  10.543739 41.177.159.194 -> 244.3.160.239 TCP 64 taskman-port > http [ACK] Seq=813 Ack=8822 Win=16560 Len=0
27240  10.744574 41.177.159.194 -> 244.3.160.239 TCP 64 taskman-port > http [FIN, ACK] Seq=813 Ack=8822 Win=16560 Len=0
33708  14.317131 41.177.159.194 -> 244.3.160.239 TCP 66 13939 > http [SYN] Seq=0 Win=16384 Len=0 MSS=1380 SACK_PERM=1
33710  14.318017 41.177.159.194 -> 244.3.160.239 TCP 64 13939 > http [ACK] Seq=1 Ack=1 Win=16560 Len=0
34040  14.454551 41.177.159.194 -> 244.3.160.239 TCP 64 13939 > http [ACK] Seq=813 Ack=3013 Win=16560 Len=0
34087  14.475906 41.177.159.194 -> 244.3.160.239 TCP 64 13939 > http [ACK] Seq=813 Ack=5712 Win=16560 Len=0
34088  14.476019 41.177.159.194 -> 244.3.160.239 TCP 64 13939 > http [ACK] Seq=813 Ack=7187 Win=16560 Len=0
34094  14.476998 41.177.159.194 -> 244.3.160.239 TCP 64 13939 > http [ACK] Seq=813 Ack=8821 Win=16560 Len=0
34629  14.591096 41.177.159.194 -> 244.3.160.239 TCP 64 13939 > http [ACK] Seq=813 Ack=8822 Win=16560 Len=0
34648  14.594182 41.177.159.194 -> 244.3.160.239 TCP 64 13939 > http [FIN, ACK] Seq=813 Ack=8822 Win=16560 Len=0
43478  18.441285 41.177.159.194 -> 244.3.160.239 TCP 66 12954 > http [SYN] Seq=0 Win=16384 Len=0 MSS=1380 SACK_PERM=1
43482  18.442146 41.177.159.194 -> 244.3.160.239 TCP 64 12954 > http [ACK] Seq=1 Ack=1 Win=16560 Len=0
43965  18.594724 41.177.159.194 -> 244.3.160.239 TCP 64 12954 > http [ACK] Seq=813 Ack=1633 Win=16560 Len=0
43969  18.595958 41.177.159.194 -> 244.3.160.239 TCP 64 12954 > http [ACK] Seq=813 Ack=4332 Win=16560 Len=0
44010  18.606028 41.177.159.194 -> 244.3.160.239 TCP 64 12954 > http [ACK] Seq=813 Ack=7187 Win=16560 Len=0
44012  18.606050 41.177.159.194 -> 244.3.160.239 TCP 64 12954 > http [ACK] Seq=813 Ack=8821 Win=16560 Len=0
44446  18.713732 41.177.159.194 -> 244.3.160.239 TCP 64 12954 > http [ACK] Seq=813 Ack=8822 Win=16560 Len=0
44594  18.741044 41.177.159.194 -> 244.3.160.239 TCP 64 12954 > http [FIN, ACK] Seq=813 Ack=8822 Win=16560 Len=0
242873  84.462272 41.177.159.194 -> 244.3.160.239 TCP 66 11488 > http [SYN] Seq=0 Win=16384 Len=0 MSS=1380 SACK_PERM=1
242878  84.463032 41.177.159.194 -> 244.3.160.239 TCP 64 11488 > http [ACK] Seq=1 Ack=1 Win=16560 Len=0
243302  84.713542 41.177.159.194 -> 244.3.160.239 TCP 64 11488 > http [ACK] Seq=813 Ack=1633 Win=16560 Len=0
243306  84.714667 41.177.159.194 -> 244.3.160.239 TCP 64 11488 > http [ACK] Seq=813 Ack=4332 Win=16560 Len=0
243307  84.714891 41.177.159.194 -> 244.3.160.239 TCP 64 11488 > http [ACK] Seq=813 Ack=7092 Win=16560 Len=0
243470  84.823067 41.177.159.194 -> 244.3.160.239 TCP 64 11488 > http [ACK] Seq=813 Ack=8821 Win=16560 Len=0
243682  84.932910 41.177.159.194 -> 244.3.160.239 TCP 64 11488 > http [ACK] Seq=813 Ack=8822 Win=16560 Len=0
243873  85.018744 41.177.159.194 -> 244.3.160.239 TCP 64 11488 > http [FIN, ACK] Seq=813 Ack=8822 Win=16560 Len=0
