1492   0.429110 41.177.31.94 -> 244.3.47.39  TCP 118 49240 > iscsi-target [PSH, ACK] Seq=1 Ack=1 Win=65535 Len=48 TSval=724356394 TSecr=1086946519
1497   0.430041 41.177.31.94 -> 244.3.47.39  TCP 70 49240 > iscsi-target [ACK] Seq=49 Ack=49 Win=65535 Len=0 TSval=724356394 TSecr=1086946819
4771   1.442890 41.177.31.94 -> 145.95.122.12 TCP 66 57546 > 3283 [SYN] Seq=0 Win=65535 Len=0 MSS=1460 SACK_PERM=1
4772   1.442894 41.177.31.94 -> 145.95.122.12 TCP 66 57545 > 3283 [SYN] Seq=0 Win=65535 Len=0 MSS=1460 SACK_PERM=1
4773   1.442898 41.177.31.94 -> 145.95.181.55 TCP 66 57544 > 3283 [SYN] Seq=0 Win=65535 Len=0 MSS=1460 SACK_PERM=1
4774   1.442903 41.177.31.94 -> 145.95.181.55 TCP 66 57543 > 3283 [SYN] Seq=0 Win=65535 Len=0 MSS=1460 SACK_PERM=1
4775   1.442906 41.177.31.94 -> 145.95.122.12 TCP 66 57542 > 3283 [SYN] Seq=0 Win=65535 Len=0 MSS=1460 SACK_PERM=1
4776   1.442910 41.177.31.94 -> 145.95.181.55 TCP 66 57541 > 3283 [SYN] Seq=0 Win=65535 Len=0 MSS=1460 SACK_PERM=1
4777   1.442914 41.177.31.94 -> 145.95.181.55 TCP 66 57540 > 3283 [SYN] Seq=0 Win=65535 Len=0 MSS=1460 SACK_PERM=1
4778   1.442919 41.177.31.94 -> 145.95.122.12 TCP 66 57539 > 3283 [SYN] Seq=0 Win=65535 Len=0 MSS=1460 SACK_PERM=1
4779   1.442922 41.177.31.94 -> 145.95.122.12 TCP 66 57538 > 3283 [SYN] Seq=0 Win=65535 Len=0 MSS=1460 SACK_PERM=1
4780   1.442926 41.177.31.94 -> 145.95.122.12 TCP 66 57537 > 3283 [SYN] Seq=0 Win=65535 Len=0 MSS=1460 SACK_PERM=1
9034   3.269043 41.177.31.94 -> 244.3.47.39  TCP 1438 49240 > iscsi-target [ACK] Seq=49 Ack=49 Win=65535 Len=1368 TSval=724356423 TSecr=1086946819
9289   3.369228 41.177.31.94 -> 244.3.47.39  TCP 1438 49240 > iscsi-target [ACK] Seq=1417 Ack=49 Win=65535 Len=1368 TSval=724356424 TSecr=1086947113
9290   3.369233 41.177.31.94 -> 244.3.47.39  TCP 1438 49240 > iscsi-target [ACK] Seq=2785 Ack=49 Win=65535 Len=1368 TSval=724356424 TSecr=1086947113
9292   3.370040 41.177.31.94 -> 244.3.47.39  TCP 110 49240 > iscsi-target [PSH, ACK] Seq=4153 Ack=49 Win=65535 Len=40 TSval=724356424 TSecr=1086947113
9295   3.376607 41.177.31.94 -> 244.3.47.39  TCP 70 49240 > iscsi-target [ACK] Seq=4193 Ack=97 Win=65535 Len=0 TSval=724356424 TSecr=1086947114
9296   3.376869 41.177.31.94 -> 244.3.47.39  TCP 118 49240 > iscsi-target [PSH, ACK] Seq=4193 Ack=97 Win=65535 Len=48 TSval=724356424 TSecr=1086947114
9298   3.377592 41.177.31.94 -> 244.3.47.39  TCP 70 49240 > iscsi-target [ACK] Seq=4241 Ack=145 Win=65535 Len=0 TSval=724356424 TSecr=1086947114
9302   3.377931 41.177.31.94 -> 244.3.47.39  TCP 1438 49240 > iscsi-target [ACK] Seq=4241 Ack=145 Win=65535 Len=1368 TSval=724356424 TSecr=1086947114
9303   3.377935 41.177.31.94 -> 244.3.47.39  TCP 1438 49240 > iscsi-target [ACK] Seq=5609 Ack=145 Win=65535 Len=1368 TSval=724356424 TSecr=1086947114
9304   3.377939 41.177.31.94 -> 244.3.47.39  TCP 1438 49240 > iscsi-target [ACK] Seq=6977 Ack=145 Win=65535 Len=1368 TSval=724356424 TSecr=1086947114
9305   3.377943 41.177.31.94 -> 244.3.47.39  TCP 110 49240 > iscsi-target [PSH, ACK] Seq=8345 Ack=145 Win=65535 Len=40 TSval=724356424 TSecr=1086947114
9312   3.378832 41.177.31.94 -> 244.3.47.39  TCP 70 49240 > iscsi-target [ACK] Seq=8385 Ack=193 Win=65535 Len=0 TSval=724356424 TSecr=1086947114
9313   3.378900 41.177.31.94 -> 244.3.47.39  TCP 118 49240 > iscsi-target [PSH, ACK] Seq=8385 Ack=193 Win=65535 Len=48 TSval=724356424 TSecr=1086947114
9315   3.379682 41.177.31.94 -> 244.3.47.39  TCP 70 49240 > iscsi-target [ACK] Seq=8433 Ack=241 Win=65535 Len=0 TSval=724356424 TSecr=1086947114
9317   3.380261 41.177.31.94 -> 244.3.47.39  TCP 1438 49240 > iscsi-target [ACK] Seq=8433 Ack=241 Win=65535 Len=1368 TSval=724356424 TSecr=1086947114
9318   3.380265 41.177.31.94 -> 244.3.47.39  TCP 1438 49240 > iscsi-target [ACK] Seq=9801 Ack=241 Win=65535 Len=1368 TSval=724356424 TSecr=1086947114
9319   3.380269 41.177.31.94 -> 244.3.47.39  TCP 1438 49240 > iscsi-target [ACK] Seq=11169 Ack=241 Win=65535 Len=1368 TSval=724356424 TSecr=1086947114
9320   3.380273 41.177.31.94 -> 244.3.47.39  TCP 1438 49240 > iscsi-target [ACK] Seq=12537 Ack=241 Win=65535 Len=1368 TSval=724356424 TSecr=1086947114
9321   3.380277 41.177.31.94 -> 244.3.47.39  TCP 1438 49240 > iscsi-target [ACK] Seq=13905 Ack=241 Win=65535 Len=1368 TSval=724356424 TSecr=1086947114
9322   3.380293 41.177.31.94 -> 244.3.47.39  TCP 1438 49240 > iscsi-target [ACK] Seq=15273 Ack=241 Win=65535 Len=1368 TSval=724356424 TSecr=1086947114
9323   3.380297 41.177.31.94 -> 244.3.47.39  TCP 102 49240 > iscsi-target [PSH, ACK] Seq=16641 Ack=241 Win=65535 Len=32 TSval=724356424 TSecr=1086947114
9331   3.381226 41.177.31.94 -> 244.3.47.39  TCP 1438 49240 > iscsi-target [ACK] Seq=16673 Ack=241 Win=65535 Len=1368 TSval=724356424 TSecr=1086947114
9332   3.381230 41.177.31.94 -> 244.3.47.39  TCP 1438 49240 > iscsi-target [ACK] Seq=18041 Ack=241 Win=65535 Len=1368 TSval=724356424 TSecr=1086947114
9333   3.381234 41.177.31.94 -> 244.3.47.39  TCP 1438 49240 > iscsi-target [ACK] Seq=19409 Ack=241 Win=65535 Len=1368 TSval=724356424 TSecr=1086947114
9334   3.381238 41.177.31.94 -> 244.3.47.39  TCP 1438 49240 > iscsi-target [ACK] Seq=20777 Ack=241 Win=65535 Len=1368 TSval=724356424 TSecr=1086947114
9335   3.381242 41.177.31.94 -> 244.3.47.39  TCP 1438 49240 > iscsi-target [ACK] Seq=22145 Ack=241 Win=65535 Len=1368 TSval=724356424 TSecr=1086947114
9336   3.381268 41.177.31.94 -> 244.3.47.39  TCP 1438 49240 > iscsi-target [ACK] Seq=23513 Ack=241 Win=65535 Len=1368 TSval=724356424 TSecr=1086947114
9337   3.381272 41.177.31.94 -> 244.3.47.39  TCP 1438 49240 > iscsi-target [ACK] Seq=24881 Ack=241 Win=65535 Len=1368 TSval=724356424 TSecr=1086947114
9342   3.382084 41.177.31.94 -> 244.3.47.39  TCP 1438 49240 > iscsi-target [ACK] Seq=26249 Ack=241 Win=65535 Len=1368 TSval=724356424 TSecr=1086947114
9343   3.382088 41.177.31.94 -> 244.3.47.39  TCP 1438 49240 > iscsi-target [ACK] Seq=27617 Ack=241 Win=65535 Len=1368 TSval=724356424 TSecr=1086947114
9344   3.382092 41.177.31.94 -> 244.3.47.39  TCP 1438 49240 > iscsi-target [ACK] Seq=28985 Ack=241 Win=65535 Len=1368 TSval=724356424 TSecr=1086947114
9345   3.382096 41.177.31.94 -> 244.3.47.39  TCP 1438 49240 > iscsi-target [ACK] Seq=30353 Ack=241 Win=65535 Len=1368 TSval=724356424 TSecr=1086947114
9346   3.382100 41.177.31.94 -> 244.3.47.39  TCP 1438 49240 > iscsi-target [ACK] Seq=31721 Ack=241 Win=65535 Len=1368 TSval=724356424 TSecr=1086947114
9347   3.382115 41.177.31.94 -> 244.3.47.39  TCP 1438 49240 > iscsi-target [ACK] Seq=33089 Ack=241 Win=65535 Len=1368 TSval=724356424 TSecr=1086947114
9352   3.383075 41.177.31.94 -> 244.3.47.39  TCP 1438 49240 > iscsi-target [ACK] Seq=34457 Ack=241 Win=65535 Len=1368 TSval=724356424 TSecr=1086947115
9353   3.383080 41.177.31.94 -> 244.3.47.39  TCP 1438 49240 > iscsi-target [ACK] Seq=35825 Ack=241 Win=65535 Len=1368 TSval=724356424 TSecr=1086947115
9354   3.383084 41.177.31.94 -> 244.3.47.39  TCP 1438 49240 > iscsi-target [ACK] Seq=37193 Ack=241 Win=65535 Len=1368 TSval=724356424 TSecr=1086947115
9355   3.383088 41.177.31.94 -> 244.3.47.39  TCP 1438 49240 > iscsi-target [ACK] Seq=38561 Ack=241 Win=65535 Len=1368 TSval=724356424 TSecr=1086947115
9357   3.383129 41.177.31.94 -> 244.3.47.39  TCP 1438 49240 > iscsi-target [ACK] Seq=39929 Ack=241 Win=65535 Len=1368 TSval=724356424 TSecr=1086947115
9358   3.383133 41.177.31.94 -> 244.3.47.39  TCP 1438 49240 > iscsi-target [ACK] Seq=41297 Ack=241 Win=65535 Len=1368 TSval=724356424 TSecr=1086947115
9359   3.383137 41.177.31.94 -> 244.3.47.39  TCP 1438 49240 > iscsi-target [ACK] Seq=42665 Ack=241 Win=65535 Len=1368 TSval=724356424 TSecr=1086947115
9366   3.384085 41.177.31.94 -> 244.3.47.39  TCP 1438 49240 > iscsi-target [ACK] Seq=44033 Ack=241 Win=65535 Len=1368 TSval=724356424 TSecr=1086947115
9367   3.384089 41.177.31.94 -> 244.3.47.39  TCP 1438 49240 > iscsi-target [ACK] Seq=45401 Ack=241 Win=65535 Len=1368 TSval=724356424 TSecr=1086947115
9368   3.384093 41.177.31.94 -> 244.3.47.39  TCP 1438 49240 > iscsi-target [ACK] Seq=46769 Ack=241 Win=65535 Len=1368 TSval=724356424 TSecr=1086947115
9369   3.384097 41.177.31.94 -> 244.3.47.39  TCP 1438 49240 > iscsi-target [ACK] Seq=48137 Ack=241 Win=65535 Len=1368 TSval=724356424 TSecr=1086947115
9370   3.384101 41.177.31.94 -> 244.3.47.39  TCP 1438 49240 > iscsi-target [ACK] Seq=49505 Ack=241 Win=65535 Len=1368 TSval=724356424 TSecr=1086947115
9371   3.384150 41.177.31.94 -> 244.3.47.39  TCP 1438 49240 > iscsi-target [ACK] Seq=50873 Ack=241 Win=65535 Len=1368 TSval=724356424 TSecr=1086947115
9372   3.384154 41.177.31.94 -> 244.3.47.39  TCP 1438 49240 > iscsi-target [ACK] Seq=52241 Ack=241 Win=65535 Len=1368 TSval=724356424 TSecr=1086947115
9373   3.384158 41.177.31.94 -> 244.3.47.39  TCP 1438 49240 > iscsi-target [ACK] Seq=53609 Ack=241 Win=65535 Len=1368 TSval=724356424 TSecr=1086947115
9374   3.384162 41.177.31.94 -> 244.3.47.39  TCP 1438 49240 > iscsi-target [ACK] Seq=54977 Ack=241 Win=65535 Len=1368 TSval=724356424 TSecr=1086947115
9382   3.385083 41.177.31.94 -> 244.3.47.39  TCP 1438 49240 > iscsi-target [ACK] Seq=56345 Ack=241 Win=65535 Len=1368 TSval=724356424 TSecr=1086947115
9383   3.385088 41.177.31.94 -> 244.3.47.39  TCP 1438 49240 > iscsi-target [ACK] Seq=57713 Ack=241 Win=65535 Len=1368 TSval=724356424 TSecr=1086947115
9384   3.385092 41.177.31.94 -> 244.3.47.39  TCP 1438 49240 > iscsi-target [ACK] Seq=59081 Ack=241 Win=65535 Len=1368 TSval=724356424 TSecr=1086947115
9385   3.385096 41.177.31.94 -> 244.3.47.39  TCP 1438 49240 > iscsi-target [ACK] Seq=60449 Ack=241 Win=65535 Len=1368 TSval=724356424 TSecr=1086947115
9386   3.385100 41.177.31.94 -> 244.3.47.39  TCP 1438 49240 > iscsi-target [ACK] Seq=61817 Ack=241 Win=65535 Len=1368 TSval=724356424 TSecr=1086947115
9387   3.385128 41.177.31.94 -> 244.3.47.39  TCP 1438 49240 > iscsi-target [ACK] Seq=63185 Ack=241 Win=65535 Len=1368 TSval=724356424 TSecr=1086947115
9388   3.385132 41.177.31.94 -> 244.3.47.39  TCP 1438 49240 > iscsi-target [ACK] Seq=64553 Ack=241 Win=65535 Len=1368 TSval=724356424 TSecr=1086947115
9389   3.385136 41.177.31.94 -> 244.3.47.39  TCP 262 49240 > iscsi-target [PSH, ACK] Seq=65921 Ack=241 Win=65535 Len=192 TSval=724356424 TSecr=1086947115
9397   3.386206 41.177.31.94 -> 244.3.47.39  TCP 70 49240 > iscsi-target [ACK] Seq=66113 Ack=289 Win=65535 Len=0 TSval=724356424 TSecr=1086947115
9400   3.386442 41.177.31.94 -> 244.3.47.39  TCP 118 49240 > iscsi-target [PSH, ACK] Seq=66113 Ack=289 Win=65535 Len=48 TSval=724356424 TSecr=1086947115
9405   3.387116 41.177.31.94 -> 244.3.47.39  TCP 70 49240 > iscsi-target [ACK] Seq=66161 Ack=337 Win=65535 Len=0 TSval=724356424 TSecr=1086947115
9408   3.387453 41.177.31.94 -> 244.3.47.39  TCP 1438 49240 > iscsi-target [ACK] Seq=66161 Ack=337 Win=65535 Len=1368 TSval=724356424 TSecr=1086947115
9409   3.387457 41.177.31.94 -> 244.3.47.39  TCP 1438 49240 > iscsi-target [ACK] Seq=67529 Ack=337 Win=65535 Len=1368 TSval=724356424 TSecr=1086947115
9410   3.387461 41.177.31.94 -> 244.3.47.39  TCP 1438 49240 > iscsi-target [ACK] Seq=68897 Ack=337 Win=65535 Len=1368 TSval=724356424 TSecr=1086947115
9411   3.387465 41.177.31.94 -> 244.3.47.39  TCP 110 49240 > iscsi-target [PSH, ACK] Seq=70265 Ack=337 Win=65535 Len=40 TSval=724356424 TSecr=1086947115
9416   3.388129 41.177.31.94 -> 244.3.47.39  TCP 70 49240 > iscsi-target [ACK] Seq=70305 Ack=385 Win=65535 Len=0 TSval=724356424 TSecr=1086947115
9417   3.388189 41.177.31.94 -> 244.3.47.39  TCP 118 49240 > iscsi-target [PSH, ACK] Seq=70305 Ack=385 Win=65535 Len=48 TSval=724356424 TSecr=1086947115
9422   3.389070 41.177.31.94 -> 244.3.47.39  TCP 70 49240 > iscsi-target [ACK] Seq=70353 Ack=433 Win=65535 Len=0 TSval=724356424 TSecr=1086947115
9423   3.389414 41.177.31.94 -> 244.3.47.39  TCP 1438 49240 > iscsi-target [ACK] Seq=70353 Ack=433 Win=65535 Len=1368 TSval=724356424 TSecr=1086947115
9424   3.389419 41.177.31.94 -> 244.3.47.39  TCP 1438 49240 > iscsi-target [ACK] Seq=71721 Ack=433 Win=65535 Len=1368 TSval=724356424 TSecr=1086947115
9425   3.389422 41.177.31.94 -> 244.3.47.39  TCP 1438 49240 > iscsi-target [ACK] Seq=73089 Ack=433 Win=65535 Len=1368 TSval=724356424 TSecr=1086947115
9426   3.389426 41.177.31.94 -> 244.3.47.39  TCP 110 49240 > iscsi-target [PSH, ACK] Seq=74457 Ack=433 Win=65535 Len=40 TSval=724356424 TSecr=1086947115
9427   3.389430 41.177.31.94 -> 244.3.47.39  TCP 1438 49240 > iscsi-target [ACK] Seq=74497 Ack=433 Win=65535 Len=1368 TSval=724356424 TSecr=1086947115
9428   3.389465 41.177.31.94 -> 244.3.47.39  TCP 1438 49240 > iscsi-target [ACK] Seq=75865 Ack=433 Win=65535 Len=1368 TSval=724356424 TSecr=1086947115
9429   3.389469 41.177.31.94 -> 244.3.47.39  TCP 1438 49240 > iscsi-target [ACK] Seq=77233 Ack=433 Win=65535 Len=1368 TSval=724356424 TSecr=1086947115
9431   3.389477 41.177.31.94 -> 244.3.47.39  TCP 1438 49240 > iscsi-target [ACK] Seq=78601 Ack=433 Win=65535 Len=1368 TSval=724356424 TSecr=1086947115
9432   3.389481 41.177.31.94 -> 244.3.47.39  TCP 1438 49240 > iscsi-target [ACK] Seq=79969 Ack=433 Win=65535 Len=1368 TSval=724356424 TSecr=1086947115
9433   3.389513 41.177.31.94 -> 244.3.47.39  TCP 1438 49240 > iscsi-target [ACK] Seq=81337 Ack=433 Win=65535 Len=1368 TSval=724356424 TSecr=1086947115
9434   3.389518 41.177.31.94 -> 244.3.47.39  TCP 102 49240 > iscsi-target [PSH, ACK] Seq=82705 Ack=433 Win=65535 Len=32 TSval=724356424 TSecr=1086947115
9435   3.389522 41.177.31.94 -> 244.3.47.39  TCP 1438 49240 > iscsi-target [ACK] Seq=82737 Ack=433 Win=65535 Len=1368 TSval=724356424 TSecr=1086947115
9436   3.389526 41.177.31.94 -> 244.3.47.39  TCP 1438 49240 > iscsi-target [ACK] Seq=84105 Ack=433 Win=65535 Len=1368 TSval=724356424 TSecr=1086947115
9447   3.390398 41.177.31.94 -> 244.3.47.39  TCP 1438 49240 > iscsi-target [ACK] Seq=85473 Ack=433 Win=65535 Len=1368 TSval=724356424 TSecr=1086947115
9448   3.390402 41.177.31.94 -> 244.3.47.39  TCP 1438 49240 > iscsi-target [ACK] Seq=86841 Ack=433 Win=65535 Len=1368 TSval=724356424 TSecr=1086947115
9449   3.390406 41.177.31.94 -> 244.3.47.39  TCP 1438 49240 > iscsi-target [ACK] Seq=88209 Ack=433 Win=65535 Len=1368 TSval=724356424 TSecr=1086947115
9450   3.390410 41.177.31.94 -> 244.3.47.39  TCP 1438 49240 > iscsi-target [ACK] Seq=89577 Ack=433 Win=65535 Len=1368 TSval=724356424 TSecr=1086947115
9451   3.390415 41.177.31.94 -> 244.3.47.39  TCP 1438 49240 > iscsi-target [ACK] Seq=90945 Ack=433 Win=65535 Len=1368 TSval=724356424 TSecr=1086947115
9452   3.390456 41.177.31.94 -> 244.3.47.39  TCP 1438 49240 > iscsi-target [ACK] Seq=92313 Ack=433 Win=65535 Len=1368 TSval=724356424 TSecr=1086947115
9453   3.390460 41.177.31.94 -> 244.3.47.39  TCP 1438 49240 > iscsi-target [ACK] Seq=93681 Ack=433 Win=65535 Len=1368 TSval=724356424 TSecr=1086947115
9454   3.390463 41.177.31.94 -> 244.3.47.39  TCP 1438 49240 > iscsi-target [ACK] Seq=95049 Ack=433 Win=65535 Len=1368 TSval=724356424 TSecr=1086947115
9455   3.390467 41.177.31.94 -> 244.3.47.39  TCP 1438 49240 > iscsi-target [ACK] Seq=96417 Ack=433 Win=65535 Len=1368 TSval=724356424 TSecr=1086947115
9456   3.390471 41.177.31.94 -> 244.3.47.39  TCP 1438 49240 > iscsi-target [ACK] Seq=97785 Ack=433 Win=65535 Len=1368 TSval=724356424 TSecr=1086947115
9457   3.390499 41.177.31.94 -> 244.3.47.39  TCP 1438 49240 > iscsi-target [ACK] Seq=99153 Ack=433 Win=65535 Len=1368 TSval=724356424 TSecr=1086947115
9458   3.390503 41.177.31.94 -> 244.3.47.39  TCP 1438 49240 > iscsi-target [ACK] Seq=100521 Ack=481 Win=65535 Len=1368 TSval=724356424 TSecr=1086947115
9459   3.390507 41.177.31.94 -> 244.3.47.39  TCP 158 49240 > iscsi-target [ACK] Seq=101889 Ack=529 Win=65535 Len=88 TSval=724356424 TSecr=1086947115
9471   3.391065 41.177.31.94 -> 244.3.47.39  TCP 1438 49240 > iscsi-target [ACK] Seq=101977 Ack=529 Win=65535 Len=1368 TSval=724356424 TSecr=1086947115
9473   3.391074 41.177.31.94 -> 244.3.47.39  TCP 1438 49240 > iscsi-target [ACK] Seq=103345 Ack=529 Win=65535 Len=1368 TSval=724356424 TSecr=1086947115
9477   3.391305 41.177.31.94 -> 244.3.47.39  TCP 1438 49240 > iscsi-target [ACK] Seq=104713 Ack=529 Win=65535 Len=1368 TSval=724356424 TSecr=1086947115
9478   3.391310 41.177.31.94 -> 244.3.47.39  TCP 1438 49240 > iscsi-target [ACK] Seq=106081 Ack=529 Win=65535 Len=1368 TSval=724356424 TSecr=1086947115
9479   3.391314 41.177.31.94 -> 244.3.47.39  TCP 1438 49240 > iscsi-target [ACK] Seq=107449 Ack=529 Win=65535 Len=1368 TSval=724356424 TSecr=1086947115
9480   3.391318 41.177.31.94 -> 244.3.47.39  TCP 1438 49240 > iscsi-target [ACK] Seq=108817 Ack=529 Win=65535 Len=1368 TSval=724356424 TSecr=1086947115
9481   3.391322 41.177.31.94 -> 244.3.47.39  TCP 1438 49240 > iscsi-target [ACK] Seq=110185 Ack=529 Win=65535 Len=1368 TSval=724356424 TSecr=1086947115
9482   3.391366 41.177.31.94 -> 244.3.47.39  TCP 1438 49240 > iscsi-target [ACK] Seq=111553 Ack=529 Win=65535 Len=1368 TSval=724356424 TSecr=1086947115
9483   3.391370 41.177.31.94 -> 244.3.47.39  TCP 1438 49240 > iscsi-target [ACK] Seq=112921 Ack=529 Win=65535 Len=1368 TSval=724356424 TSecr=1086947115
9484   3.391374 41.177.31.94 -> 244.3.47.39  TCP 1438 49240 > iscsi-target [ACK] Seq=114289 Ack=529 Win=65535 Len=1368 TSval=724356424 TSecr=1086947115
9485   3.391378 41.177.31.94 -> 244.3.47.39  TCP 1438 49240 > iscsi-target [ACK] Seq=115657 Ack=529 Win=65535 Len=1368 TSval=724356424 TSecr=1086947115
9486   3.391382 41.177.31.94 -> 244.3.47.39  TCP 1438 49240 > iscsi-target [ACK] Seq=117025 Ack=529 Win=65535 Len=1368 TSval=724356424 TSecr=1086947115
9487   3.391397 41.177.31.94 -> 244.3.47.39  TCP 1438 49240 > iscsi-target [ACK] Seq=118393 Ack=529 Win=65535 Len=1368 TSval=724356424 TSecr=1086947115
9488   3.391402 41.177.31.94 -> 244.3.47.39  TCP 158 49240 > iscsi-target [ACK] Seq=119761 Ack=577 Win=65535 Len=88 TSval=724356424 TSecr=1086947115
9489   3.391495 41.177.31.94 -> 244.3.47.39  TCP 70 49240 > iscsi-target [ACK] Seq=119849 Ack=625 Win=65535 Len=0 TSval=724356424 TSecr=1086947115
9504   3.391983 41.177.31.94 -> 244.3.47.39  TCP 1438 49240 > iscsi-target [ACK] Seq=119849 Ack=625 Win=65535 Len=1368 TSval=724356424 TSecr=1086947115
9505   3.391987 41.177.31.94 -> 244.3.47.39  TCP 1438 49240 > iscsi-target [ACK] Seq=121217 Ack=625 Win=65535 Len=1368 TSval=724356424 TSecr=1086947115
9506   3.391991 41.177.31.94 -> 244.3.47.39  TCP 1422 49240 > iscsi-target [PSH, ACK] Seq=122585 Ack=625 Win=65535 Len=1352 TSval=724356424 TSecr=1086947115
9510   3.392152 41.177.31.94 -> 244.3.47.39  TCP 70 49240 > iscsi-target [ACK] Seq=123937 Ack=673 Win=65535 Len=0 TSval=724356424 TSecr=1086947116
9511   3.392156 41.177.31.94 -> 244.3.47.39  TCP 70 49240 > iscsi-target [ACK] Seq=123937 Ack=721 Win=65535 Len=0 TSval=724356424 TSecr=1086947116
9513   3.392362 41.177.31.94 -> 244.3.47.39  TCP 1438 49240 > iscsi-target [ACK] Seq=123937 Ack=721 Win=65535 Len=1368 TSval=724356424 TSecr=1086947116
9514   3.392367 41.177.31.94 -> 244.3.47.39  TCP 1438 49240 > iscsi-target [ACK] Seq=125305 Ack=721 Win=65535 Len=1368 TSval=724356424 TSecr=1086947116
9515   3.392371 41.177.31.94 -> 244.3.47.39  TCP 1438 49240 > iscsi-target [ACK] Seq=126673 Ack=721 Win=65535 Len=1368 TSval=724356424 TSecr=1086947116
9516   3.392375 41.177.31.94 -> 244.3.47.39  TCP 110 49240 > iscsi-target [PSH, ACK] Seq=128041 Ack=721 Win=65535 Len=40 TSval=724356424 TSecr=1086947116
9523   3.392890 41.177.31.94 -> 244.3.47.39  TCP 70 49240 > iscsi-target [ACK] Seq=128081 Ack=769 Win=65535 Len=0 TSval=724356424 TSecr=1086947116
9528   3.393129 41.177.31.94 -> 244.3.47.39  TCP 70 49240 > iscsi-target [ACK] Seq=128081 Ack=817 Win=65535 Len=0 TSval=724356424 TSecr=1086947116
9546   3.396789 41.177.31.94 -> 244.3.47.39  TCP 1438 49240 > iscsi-target [ACK] Seq=128081 Ack=817 Win=65535 Len=1368 TSval=724356424 TSecr=1086947116
9547   3.396793 41.177.31.94 -> 244.3.47.39  TCP 1438 49240 > iscsi-target [ACK] Seq=129449 Ack=817 Win=65535 Len=1368 TSval=724356424 TSecr=1086947116
9548   3.396797 41.177.31.94 -> 244.3.47.39  TCP 1438 49240 > iscsi-target [ACK] Seq=130817 Ack=817 Win=65535 Len=1368 TSval=724356424 TSecr=1086947116
9549   3.396801 41.177.31.94 -> 244.3.47.39  TCP 110 49240 > iscsi-target [PSH, ACK] Seq=132185 Ack=817 Win=65535 Len=40 TSval=724356424 TSecr=1086947116
9554   3.397604 41.177.31.94 -> 244.3.47.39  TCP 70 49240 > iscsi-target [ACK] Seq=132225 Ack=865 Win=65535 Len=0 TSval=724356424 TSecr=1086947116
9555   3.397867 41.177.31.94 -> 244.3.47.39  TCP 118 49240 > iscsi-target [PSH, ACK] Seq=132225 Ack=865 Win=65535 Len=48 TSval=724356424 TSecr=1086947116
9563   3.398577 41.177.31.94 -> 244.3.47.39  TCP 70 49240 > iscsi-target [ACK] Seq=132273 Ack=913 Win=65535 Len=0 TSval=724356424 TSecr=1086947116
9565   3.398928 41.177.31.94 -> 244.3.47.39  TCP 1438 49240 > iscsi-target [ACK] Seq=132273 Ack=913 Win=65535 Len=1368 TSval=724356424 TSecr=1086947116
9566   3.398932 41.177.31.94 -> 244.3.47.39  TCP 1438 49240 > iscsi-target [ACK] Seq=133641 Ack=913 Win=65535 Len=1368 TSval=724356424 TSecr=1086947116
9567   3.398937 41.177.31.94 -> 244.3.47.39  TCP 1438 49240 > iscsi-target [ACK] Seq=135009 Ack=913 Win=65535 Len=1368 TSval=724356424 TSecr=1086947116
9568   3.398941 41.177.31.94 -> 244.3.47.39  TCP 110 49240 > iscsi-target [PSH, ACK] Seq=136377 Ack=913 Win=65535 Len=40 TSval=724356424 TSecr=1086947116
9572   3.399737 41.177.31.94 -> 244.3.47.39  TCP 70 49240 > iscsi-target [ACK] Seq=136417 Ack=961 Win=65535 Len=0 TSval=724356424 TSecr=1086947116
9573   3.399800 41.177.31.94 -> 244.3.47.39  TCP 118 49240 > iscsi-target [PSH, ACK] Seq=136417 Ack=961 Win=65535 Len=48 TSval=724356424 TSecr=1086947116
9577   3.400558 41.177.31.94 -> 244.3.47.39  TCP 70 49240 > iscsi-target [ACK] Seq=136465 Ack=1009 Win=65535 Len=0 TSval=724356424 TSecr=1086947116
9578   3.400957 41.177.31.94 -> 244.3.47.39  TCP 1438 49240 > iscsi-target [ACK] Seq=136465 Ack=1009 Win=65535 Len=1368 TSval=724356424 TSecr=1086947116
9579   3.400961 41.177.31.94 -> 244.3.47.39  TCP 1438 49240 > iscsi-target [ACK] Seq=137833 Ack=1009 Win=65535 Len=1368 TSval=724356424 TSecr=1086947116
9580   3.400965 41.177.31.94 -> 244.3.47.39  TCP 1438 49240 > iscsi-target [ACK] Seq=139201 Ack=1009 Win=65535 Len=1368 TSval=724356424 TSecr=1086947116
9581   3.400969 41.177.31.94 -> 244.3.47.39  TCP 1438 49240 > iscsi-target [ACK] Seq=140569 Ack=1009 Win=65535 Len=1368 TSval=724356424 TSecr=1086947116
9582   3.400973 41.177.31.94 -> 244.3.47.39  TCP 1438 49240 > iscsi-target [ACK] Seq=141937 Ack=1009 Win=65535 Len=1368 TSval=724356424 TSecr=1086947116
9583   3.401005 41.177.31.94 -> 244.3.47.39  TCP 1438 49240 > iscsi-target [ACK] Seq=143305 Ack=1009 Win=65535 Len=1368 TSval=724356424 TSecr=1086947116
9584   3.401010 41.177.31.94 -> 244.3.47.39  TCP 102 49240 > iscsi-target [PSH, ACK] Seq=144673 Ack=1009 Win=65535 Len=32 TSval=724356424 TSecr=1086947116
9585   3.401013 41.177.31.94 -> 244.3.47.39  TCP 1438 49240 > iscsi-target [ACK] Seq=144705 Ack=1009 Win=65535 Len=1368 TSval=724356424 TSecr=1086947116
9586   3.401017 41.177.31.94 -> 244.3.47.39  TCP 1438 49240 > iscsi-target [ACK] Seq=146073 Ack=1009 Win=65535 Len=1368 TSval=724356424 TSecr=1086947116
9587   3.401021 41.177.31.94 -> 244.3.47.39  TCP 1438 49240 > iscsi-target [ACK] Seq=147441 Ack=1009 Win=65535 Len=1368 TSval=724356424 TSecr=1086947116
9588   3.401042 41.177.31.94 -> 244.3.47.39  TCP 1438 49240 > iscsi-target [ACK] Seq=148809 Ack=1009 Win=65535 Len=1368 TSval=724356424 TSecr=1086947116
9590   3.401051 41.177.31.94 -> 244.3.47.39  TCP 1438 49240 > iscsi-target [ACK] Seq=150177 Ack=1009 Win=65535 Len=1368 TSval=724356424 TSecr=1086947116
9591   3.401055 41.177.31.94 -> 244.3.47.39  TCP 1438 49240 > iscsi-target [ACK] Seq=151545 Ack=1009 Win=65535 Len=1368 TSval=724356424 TSecr=1086947116
9592   3.401059 41.177.31.94 -> 244.3.47.39  TCP 102 49240 > iscsi-target [PSH, ACK] Seq=152913 Ack=1009 Win=65535 Len=32 TSval=724356424 TSecr=1086947116
9593   3.401096 41.177.31.94 -> 244.3.47.39  TCP 1438 49240 > iscsi-target [ACK] Seq=152945 Ack=1009 Win=65535 Len=1368 TSval=724356424 TSecr=1086947116
9594   3.401100 41.177.31.94 -> 244.3.47.39  TCP 1438 49240 > iscsi-target [ACK] Seq=154313 Ack=1009 Win=65535 Len=1368 TSval=724356424 TSecr=1086947116
9595   3.401104 41.177.31.94 -> 244.3.47.39  TCP 1438 49240 > iscsi-target [ACK] Seq=155681 Ack=1009 Win=65535 Len=1368 TSval=724356424 TSecr=1086947116
9609   3.401915 41.177.31.94 -> 244.3.47.39  TCP 1438 49240 > iscsi-target [ACK] Seq=157049 Ack=1009 Win=65535 Len=1368 TSval=724356424 TSecr=1086947116
9610   3.401920 41.177.31.94 -> 244.3.47.39  TCP 1438 49240 > iscsi-target [ACK] Seq=158417 Ack=1009 Win=65535 Len=1368 TSval=724356424 TSecr=1086947116
9611   3.401924 41.177.31.94 -> 244.3.47.39  TCP 1438 49240 > iscsi-target [ACK] Seq=159785 Ack=1009 Win=65535 Len=1368 TSval=724356424 TSecr=1086947116
9613   3.401932 41.177.31.94 -> 244.3.47.39  TCP 1438 49240 > iscsi-target [ACK] Seq=161153 Ack=1009 Win=65535 Len=1368 TSval=724356424 TSecr=1086947116
9615   3.401964 41.177.31.94 -> 244.3.47.39  TCP 1438 49240 > iscsi-target [ACK] Seq=162521 Ack=1009 Win=65535 Len=1368 TSval=724356424 TSecr=1086947116
9616   3.401967 41.177.31.94 -> 244.3.47.39  TCP 1438 49240 > iscsi-target [ACK] Seq=163889 Ack=1009 Win=65535 Len=1368 TSval=724356424 TSecr=1086947116
9617   3.401971 41.177.31.94 -> 244.3.47.39  TCP 142 49240 > iscsi-target [PSH, ACK] Seq=165257 Ack=1009 Win=65535 Len=72 TSval=724356424 TSecr=1086947116
9618   3.402107 41.177.31.94 -> 244.3.47.39  TCP 70 [TCP Dup ACK 9617#1] 49240 > iscsi-target [ACK] Seq=165329 Ack=1009 Win=65535 Len=0 TSval=724356424 TSecr=1086947116
9623   3.402732 41.177.31.94 -> 244.3.47.39  TCP 70 [TCP Dup ACK 9617#2] 49240 > iscsi-target [ACK] Seq=165329 Ack=1009 Win=65535 Len=0 TSval=724356424 TSecr=1086947117
9624   3.402736 41.177.31.94 -> 244.3.47.39  TCP 70 [TCP Dup ACK 9617#3] 49240 > iscsi-target [ACK] Seq=165329 Ack=1009 Win=65535 Len=0 TSval=724356424 TSecr=1086947117
9625   3.402740 41.177.31.94 -> 244.3.47.39  TCP 70 [TCP Dup ACK 9617#4] 49240 > iscsi-target [ACK] Seq=165329 Ack=1009 Win=65535 Len=0 TSval=724356424 TSecr=1086947117
9628   3.403268 41.177.31.94 -> 244.3.47.39  TCP 70 49240 > iscsi-target [ACK] Seq=165329 Ack=1057 Win=65535 Len=0 TSval=724356424 TSecr=1086947117
9630   3.403449 41.177.31.94 -> 244.3.47.39  TCP 70 [TCP Dup ACK 9628#1] 49240 > iscsi-target [ACK] Seq=165329 Ack=1057 Win=65535 Len=0 TSval=724356424 TSecr=1086947117
9631   3.403549 41.177.31.94 -> 244.3.47.39  TCP 118 49240 > iscsi-target [PSH, ACK] Seq=165329 Ack=1057 Win=65535 Len=48 TSval=724356424 TSecr=1086947117
9634   3.404211 41.177.31.94 -> 244.3.47.39  TCP 70 49240 > iscsi-target [ACK] Seq=165377 Ack=1105 Win=65535 Len=0 TSval=724356424 TSecr=1086947117
9636   3.404404 41.177.31.94 -> 244.3.47.39  TCP 1438 49240 > iscsi-target [ACK] Seq=165377 Ack=1105 Win=65535 Len=1368 TSval=724356424 TSecr=1086947117
9889   3.505144 41.177.31.94 -> 244.3.47.39  TCP 1438 49240 > iscsi-target [ACK] Seq=166745 Ack=1105 Win=65535 Len=1368 TSval=724356425 TSecr=1086947127
9890   3.505148 41.177.31.94 -> 244.3.47.39  TCP 1438 49240 > iscsi-target [ACK] Seq=168113 Ack=1105 Win=65535 Len=1368 TSval=724356425 TSecr=1086947127
9891   3.505153 41.177.31.94 -> 244.3.47.39  TCP 110 49240 > iscsi-target [PSH, ACK] Seq=169481 Ack=1105 Win=65535 Len=40 TSval=724356425 TSecr=1086947127
9896   3.506066 41.177.31.94 -> 244.3.47.39  TCP 70 49240 > iscsi-target [ACK] Seq=169521 Ack=1153 Win=65535 Len=0 TSval=724356425 TSecr=1086947127
9897   3.506331 41.177.31.94 -> 244.3.47.39  TCP 118 49240 > iscsi-target [PSH, ACK] Seq=169521 Ack=1153 Win=65535 Len=48 TSval=724356425 TSecr=1086947127
9901   3.507024 41.177.31.94 -> 244.3.47.39  TCP 70 49240 > iscsi-target [ACK] Seq=169569 Ack=1201 Win=65535 Len=0 TSval=724356425 TSecr=1086947127
9902   3.507182 41.177.31.94 -> 244.3.47.39  TCP 1438 49240 > iscsi-target [ACK] Seq=169569 Ack=1201 Win=65535 Len=1368 TSval=724356425 TSecr=1086947127
9903   3.507187 41.177.31.94 -> 244.3.47.39  TCP 1438 49240 > iscsi-target [ACK] Seq=170937 Ack=1201 Win=65535 Len=1368 TSval=724356425 TSecr=1086947127
9904   3.507191 41.177.31.94 -> 244.3.47.39  TCP 1438 49240 > iscsi-target [ACK] Seq=172305 Ack=1201 Win=65535 Len=1368 TSval=724356425 TSecr=1086947127
9905   3.507195 41.177.31.94 -> 244.3.47.39  TCP 110 49240 > iscsi-target [PSH, ACK] Seq=173673 Ack=1201 Win=65535 Len=40 TSval=724356425 TSecr=1086947127
9906   3.507199 41.177.31.94 -> 244.3.47.39  TCP 1438 49240 > iscsi-target [ACK] Seq=173713 Ack=1201 Win=65535 Len=1368 TSval=724356425 TSecr=1086947127
9915   3.508080 41.177.31.94 -> 244.3.47.39  TCP 1438 49240 > iscsi-target [ACK] Seq=175081 Ack=1201 Win=65535 Len=1368 TSval=724356425 TSecr=1086947127
9916   3.508085 41.177.31.94 -> 244.3.47.39  TCP 1438 49240 > iscsi-target [ACK] Seq=176449 Ack=1201 Win=65535 Len=1368 TSval=724356425 TSecr=1086947127
9917   3.508088 41.177.31.94 -> 244.3.47.39  TCP 1438 49240 > iscsi-target [ACK] Seq=177817 Ack=1201 Win=65535 Len=1368 TSval=724356425 TSecr=1086947127
9918   3.508092 41.177.31.94 -> 244.3.47.39  TCP 1438 49240 > iscsi-target [ACK] Seq=179185 Ack=1201 Win=65535 Len=1368 TSval=724356425 TSecr=1086947127
9919   3.508096 41.177.31.94 -> 244.3.47.39  TCP 1438 49240 > iscsi-target [ACK] Seq=180553 Ack=1201 Win=65535 Len=1368 TSval=724356425 TSecr=1086947127
9920   3.508136 41.177.31.94 -> 244.3.47.39  TCP 1438 49240 > iscsi-target [ACK] Seq=181921 Ack=1201 Win=65535 Len=1368 TSval=724356425 TSecr=1086947127
9921   3.508140 41.177.31.94 -> 244.3.47.39  TCP 1438 49240 > iscsi-target [ACK] Seq=183289 Ack=1201 Win=65535 Len=1368 TSval=724356425 TSecr=1086947127
9922   3.508144 41.177.31.94 -> 244.3.47.39  TCP 1438 49240 > iscsi-target [ACK] Seq=184657 Ack=1201 Win=65535 Len=1368 TSval=724356425 TSecr=1086947127
9923   3.508148 41.177.31.94 -> 244.3.47.39  TCP 318 49240 > iscsi-target [ACK] Seq=186025 Ack=1249 Win=65535 Len=248 TSval=724356425 TSecr=1086947127
9932   3.508943 41.177.31.94 -> 244.3.47.39  TCP 1438 49240 > iscsi-target [ACK] Seq=186273 Ack=1249 Win=65535 Len=1368 TSval=724356425 TSecr=1086947127
9933   3.508948 41.177.31.94 -> 244.3.47.39  TCP 1438 49240 > iscsi-target [ACK] Seq=187641 Ack=1249 Win=65535 Len=1368 TSval=724356425 TSecr=1086947127
9934   3.508952 41.177.31.94 -> 244.3.47.39  TCP 1438 49240 > iscsi-target [ACK] Seq=189009 Ack=1249 Win=65535 Len=1368 TSval=724356425 TSecr=1086947127
9935   3.508956 41.177.31.94 -> 244.3.47.39  TCP 1438 49240 > iscsi-target [ACK] Seq=190377 Ack=1249 Win=65535 Len=1368 TSval=724356425 TSecr=1086947127
9937   3.509002 41.177.31.94 -> 244.3.47.39  TCP 1438 49240 > iscsi-target [ACK] Seq=191745 Ack=1249 Win=65535 Len=1368 TSval=724356425 TSecr=1086947127
9938   3.509006 41.177.31.94 -> 244.3.47.39  TCP 1438 49240 > iscsi-target [ACK] Seq=193113 Ack=1249 Win=65535 Len=1368 TSval=724356425 TSecr=1086947127
9939   3.509010 41.177.31.94 -> 244.3.47.39  TCP 1438 49240 > iscsi-target [ACK] Seq=194481 Ack=1249 Win=65535 Len=1368 TSval=724356425 TSecr=1086947127
9940   3.509014 41.177.31.94 -> 244.3.47.39  TCP 1438 49240 > iscsi-target [ACK] Seq=195849 Ack=1249 Win=65535 Len=1368 TSval=724356425 TSecr=1086947127
9941   3.509018 41.177.31.94 -> 244.3.47.39  TCP 1438 49240 > iscsi-target [ACK] Seq=197217 Ack=1297 Win=65535 Len=1368 TSval=724356425 TSecr=1086947127
9942   3.509028 41.177.31.94 -> 244.3.47.39  TCP 318 49240 > iscsi-target [ACK] Seq=198585 Ack=1345 Win=65535 Len=248 TSval=724356425 TSecr=1086947127
9952   3.509852 41.177.31.94 -> 244.3.47.39  TCP 1438 49240 > iscsi-target [ACK] Seq=198833 Ack=1345 Win=65535 Len=1368 TSval=724356425 TSecr=1086947127
9953   3.509856 41.177.31.94 -> 244.3.47.39  TCP 1438 49240 > iscsi-target [ACK] Seq=200201 Ack=1345 Win=65535 Len=1368 TSval=724356425 TSecr=1086947127
9954   3.509860 41.177.31.94 -> 244.3.47.39  TCP 1438 49240 > iscsi-target [ACK] Seq=201569 Ack=1345 Win=65535 Len=1368 TSval=724356425 TSecr=1086947127
9955   3.509864 41.177.31.94 -> 244.3.47.39  TCP 1438 49240 > iscsi-target [ACK] Seq=202937 Ack=1345 Win=65535 Len=1368 TSval=724356425 TSecr=1086947127
9956   3.509868 41.177.31.94 -> 244.3.47.39  TCP 1438 49240 > iscsi-target [ACK] Seq=204305 Ack=1345 Win=65535 Len=1368 TSval=724356425 TSecr=1086947127
9957   3.509895 41.177.31.94 -> 244.3.47.39  TCP 1438 49240 > iscsi-target [ACK] Seq=205673 Ack=1345 Win=65535 Len=1368 TSval=724356425 TSecr=1086947127
9958   3.509899 41.177.31.94 -> 244.3.47.39  TCP 1438 49240 > iscsi-target [ACK] Seq=207041 Ack=1345 Win=65535 Len=1368 TSval=724356425 TSecr=1086947127
9959   3.509903 41.177.31.94 -> 244.3.47.39  TCP 1438 49240 > iscsi-target [ACK] Seq=208409 Ack=1345 Win=65535 Len=1368 TSval=724356425 TSecr=1086947127
9960   3.509907 41.177.31.94 -> 244.3.47.39  TCP 1110 49240 > iscsi-target [PSH, ACK] Seq=209777 Ack=1345 Win=65535 Len=1040 TSval=724356425 TSecr=1086947127
9961   3.509911 41.177.31.94 -> 244.3.47.39  TCP 70 49240 > iscsi-target [ACK] Seq=210817 Ack=1393 Win=65535 Len=0 TSval=724356425 TSecr=1086947127
9967   3.510770 41.177.31.94 -> 244.3.47.39  TCP 70 49240 > iscsi-target [ACK] Seq=210817 Ack=1441 Win=65535 Len=0 TSval=724356425 TSecr=1086947127
9968   3.511698 41.177.31.94 -> 244.3.47.39  TCP 118 49240 > iscsi-target [PSH, ACK] Seq=210817 Ack=1441 Win=65535 Len=48 TSval=724356425 TSecr=1086947127
9970   3.512184 41.177.31.94 -> 244.3.47.39  TCP 70 49240 > iscsi-target [ACK] Seq=210865 Ack=1489 Win=65535 Len=0 TSval=724356425 TSecr=1086947128
9971   3.512445 41.177.31.94 -> 244.3.47.39  TCP 1438 49240 > iscsi-target [ACK] Seq=210865 Ack=1489 Win=65535 Len=1368 TSval=724356425 TSecr=1086947128
9972   3.512450 41.177.31.94 -> 244.3.47.39  TCP 1438 49240 > iscsi-target [ACK] Seq=212233 Ack=1489 Win=65535 Len=1368 TSval=724356425 TSecr=1086947128
9973   3.512454 41.177.31.94 -> 244.3.47.39  TCP 1438 49240 > iscsi-target [ACK] Seq=213601 Ack=1489 Win=65535 Len=1368 TSval=724356425 TSecr=1086947128
9974   3.512458 41.177.31.94 -> 244.3.47.39  TCP 110 49240 > iscsi-target [PSH, ACK] Seq=214969 Ack=1489 Win=65535 Len=40 TSval=724356425 TSecr=1086947128
9978   3.513273 41.177.31.94 -> 244.3.47.39  TCP 70 49240 > iscsi-target [ACK] Seq=215009 Ack=1537 Win=65535 Len=0 TSval=724356425 TSecr=1086947128
9979   3.513512 41.177.31.94 -> 244.3.47.39  TCP 118 49240 > iscsi-target [PSH, ACK] Seq=215009 Ack=1537 Win=65535 Len=48 TSval=724356425 TSecr=1086947128
9981   3.514379 41.177.31.94 -> 244.3.47.39  TCP 70 49240 > iscsi-target [ACK] Seq=215057 Ack=1585 Win=65535 Len=0 TSval=724356425 TSecr=1086947128
9982   3.514859 41.177.31.94 -> 244.3.47.39  TCP 1438 49240 > iscsi-target [ACK] Seq=215057 Ack=1585 Win=65535 Len=1368 TSval=724356425 TSecr=1086947128
9983   3.514863 41.177.31.94 -> 244.3.47.39  TCP 1438 49240 > iscsi-target [ACK] Seq=216425 Ack=1585 Win=65535 Len=1368 TSval=724356425 TSecr=1086947128
9984   3.514867 41.177.31.94 -> 244.3.47.39  TCP 1438 49240 > iscsi-target [ACK] Seq=217793 Ack=1585 Win=65535 Len=1368 TSval=724356425 TSecr=1086947128
9985   3.514871 41.177.31.94 -> 244.3.47.39  TCP 1438 49240 > iscsi-target [ACK] Seq=219161 Ack=1585 Win=65535 Len=1368 TSval=724356425 TSecr=1086947128
9986   3.514875 41.177.31.94 -> 244.3.47.39  TCP 1438 49240 > iscsi-target [ACK] Seq=220529 Ack=1585 Win=65535 Len=1368 TSval=724356425 TSecr=1086947128
9987   3.514907 41.177.31.94 -> 244.3.47.39  TCP 1438 49240 > iscsi-target [ACK] Seq=221897 Ack=1585 Win=65535 Len=1368 TSval=724356425 TSecr=1086947128
9988   3.514911 41.177.31.94 -> 244.3.47.39  TCP 102 49240 > iscsi-target [PSH, ACK] Seq=223265 Ack=1585 Win=65535 Len=32 TSval=724356425 TSecr=1086947128
9989   3.514915 41.177.31.94 -> 244.3.47.39  TCP 1438 49240 > iscsi-target [ACK] Seq=223297 Ack=1585 Win=65535 Len=1368 TSval=724356425 TSecr=1086947128
9990   3.514919 41.177.31.94 -> 244.3.47.39  TCP 1438 49240 > iscsi-target [ACK] Seq=224665 Ack=1585 Win=65535 Len=1368 TSval=724356425 TSecr=1086947128
9991   3.514923 41.177.31.94 -> 244.3.47.39  TCP 1438 49240 > iscsi-target [ACK] Seq=226033 Ack=1585 Win=65535 Len=1368 TSval=724356425 TSecr=1086947128
9992   3.514949 41.177.31.94 -> 244.3.47.39  TCP 1438 49240 > iscsi-target [ACK] Seq=227401 Ack=1585 Win=65535 Len=1368 TSval=724356425 TSecr=1086947128
9993   3.514953 41.177.31.94 -> 244.3.47.39  TCP 1438 49240 > iscsi-target [ACK] Seq=228769 Ack=1585 Win=65535 Len=1368 TSval=724356425 TSecr=1086947128
10002   3.515678 41.177.31.94 -> 244.3.47.39  TCP 1438 49240 > iscsi-target [ACK] Seq=230137 Ack=1585 Win=65535 Len=1368 TSval=724356425 TSecr=1086947128
10003   3.515682 41.177.31.94 -> 244.3.47.39  TCP 1438 49240 > iscsi-target [ACK] Seq=231505 Ack=1585 Win=65535 Len=1368 TSval=724356425 TSecr=1086947128
10004   3.515686 41.177.31.94 -> 244.3.47.39  TCP 1438 49240 > iscsi-target [ACK] Seq=232873 Ack=1585 Win=65535 Len=1368 TSval=724356425 TSecr=1086947128
10005   3.515690 41.177.31.94 -> 244.3.47.39  TCP 1438 49240 > iscsi-target [ACK] Seq=234241 Ack=1585 Win=65535 Len=1368 TSval=724356425 TSecr=1086947128
10006   3.515695 41.177.31.94 -> 244.3.47.39  TCP 142 49240 > iscsi-target [PSH, ACK] Seq=235609 Ack=1585 Win=65535 Len=72 TSval=724356425 TSecr=1086947128
10007   3.515699 41.177.31.94 -> 244.3.47.39  TCP 70 [TCP Dup ACK 10006#1] 49240 > iscsi-target [ACK] Seq=235681 Ack=1585 Win=65535 Len=0 TSval=724356425 TSecr=1086947128
10011   3.516350 41.177.31.94 -> 244.3.47.39  TCP 70 [TCP Dup ACK 10006#2] 49240 > iscsi-target [ACK] Seq=235681 Ack=1585 Win=65535 Len=0 TSval=724356425 TSecr=1086947128
10012   3.516354 41.177.31.94 -> 244.3.47.39  TCP 70 [TCP Dup ACK 10006#3] 49240 > iscsi-target [ACK] Seq=235681 Ack=1585 Win=65535 Len=0 TSval=724356425 TSecr=1086947128
10013   3.516557 41.177.31.94 -> 244.3.47.39  TCP 70 49240 > iscsi-target [ACK] Seq=235681 Ack=1633 Win=65535 Len=0 TSval=724356425 TSecr=1086947128
10014   3.516735 41.177.31.94 -> 244.3.47.39  TCP 118 49240 > iscsi-target [PSH, ACK] Seq=235681 Ack=1633 Win=65535 Len=48 TSval=724356425 TSecr=1086947128
10017   3.517215 41.177.31.94 -> 244.3.47.39  TCP 70 49240 > iscsi-target [ACK] Seq=235729 Ack=1681 Win=65535 Len=0 TSval=724356425 TSecr=1086947128
10018   3.517459 41.177.31.94 -> 244.3.47.39  TCP 1438 49240 > iscsi-target [ACK] Seq=235729 Ack=1681 Win=65535 Len=1368 TSval=724356425 TSecr=1086947128
10019   3.517463 41.177.31.94 -> 244.3.47.39  TCP 1438 49240 > iscsi-target [ACK] Seq=237097 Ack=1681 Win=65535 Len=1368 TSval=724356425 TSecr=1086947128
10021   3.518133 41.177.31.94 -> 244.3.47.39  TCP 1438 49240 > iscsi-target [ACK] Seq=238465 Ack=1681 Win=65535 Len=1368 TSval=724356425 TSecr=1086947128
10022   3.518138 41.177.31.94 -> 244.3.47.39  TCP 110 49240 > iscsi-target [PSH, ACK] Seq=239833 Ack=1681 Win=65535 Len=40 TSval=724356425 TSecr=1086947128
10028   3.519033 41.177.31.94 -> 244.3.47.39  TCP 70 49240 > iscsi-target [ACK] Seq=239873 Ack=1729 Win=65535 Len=0 TSval=724356425 TSecr=1086947128
10029   3.519313 41.177.31.94 -> 244.3.47.39  TCP 118 49240 > iscsi-target [PSH, ACK] Seq=239873 Ack=1729 Win=65535 Len=48 TSval=724356425 TSecr=1086947128
10031   3.519840 41.177.31.94 -> 244.3.47.39  TCP 70 49240 > iscsi-target [ACK] Seq=239921 Ack=1777 Win=65535 Len=0 TSval=724356425 TSecr=1086947128
10032   3.520195 41.177.31.94 -> 244.3.47.39  TCP 1438 49240 > iscsi-target [ACK] Seq=239921 Ack=1777 Win=65535 Len=1368 TSval=724356425 TSecr=1086947128
10033   3.520200 41.177.31.94 -> 244.3.47.39  TCP 1438 49240 > iscsi-target [ACK] Seq=241289 Ack=1777 Win=65535 Len=1368 TSval=724356425 TSecr=1086947128
10034   3.520204 41.177.31.94 -> 244.3.47.39  TCP 1438 49240 > iscsi-target [ACK] Seq=242657 Ack=1777 Win=65535 Len=1368 TSval=724356425 TSecr=1086947128
10035   3.520208 41.177.31.94 -> 244.3.47.39  TCP 1438 49240 > iscsi-target [ACK] Seq=244025 Ack=1777 Win=65535 Len=1368 TSval=724356425 TSecr=1086947128
10036   3.520212 41.177.31.94 -> 244.3.47.39  TCP 1438 49240 > iscsi-target [ACK] Seq=245393 Ack=1777 Win=65535 Len=1368 TSval=724356425 TSecr=1086947128
10039   3.520933 41.177.31.94 -> 244.3.47.39  TCP 1438 49240 > iscsi-target [ACK] Seq=246761 Ack=1777 Win=65535 Len=1368 TSval=724356425 TSecr=1086947128
