25763   9.966126 41.177.180.176 -> 244.3.31.84  TCP 82 31111 > 61562 [PSH, ACK] Seq=1 Ack=1 Win=65535 Len=12 TSval=7319836 TSecr=1276466323
38481  15.914610 41.177.180.176 -> 41.177.3.215 TCP 66 hp-alarm-mgr > 58993 [SYN, ACK] Seq=0 Ack=1 Win=16384 Len=0 MSS=1460 SACK_PERM=1
38770  16.019132 41.177.180.176 -> 244.3.41.152 TCP 66 gds-adppiw-db > https [SYN] Seq=0 Win=65535 Len=0 MSS=1460 SACK_PERM=1
38798  16.020356 41.177.180.176 -> 244.3.41.152 TCP 64 gds-adppiw-db > https [ACK] Seq=1 Ack=1 Win=65535 Len=0
38861  16.064064 41.177.180.176 -> 244.3.41.152 TCP 64 gds-adppiw-db > https [ACK] Seq=952 Ack=548 Win=64988 Len=0
38863  16.064311 41.177.180.176 -> 244.3.41.152 TCP 64 gds-adppiw-db > https [FIN, ACK] Seq=989 Ack=548 Win=64988 Len=0
38865  16.064865 41.177.180.176 -> 244.3.41.152 TCP 64 gds-adppiw-db > https [RST, ACK] Seq=990 Ack=585 Win=0 Len=0
38866  16.064972 41.177.180.176 -> 244.3.41.152 TCP 64 gds-adppiw-db > https [RST] Seq=990 Win=0 Len=0
38867  16.064997 41.177.180.176 -> 244.3.41.152 TCP 64 gds-adppiw-db > https [RST] Seq=990 Win=0 Len=0
39032  16.150559 41.177.180.176 -> 41.177.3.215 TCP 102 hp-alarm-mgr > 58993 [PSH, ACK] Seq=1 Ack=599 Win=64937 Len=44
39148  16.186300 41.177.180.176 -> 41.177.3.215 TCP 699 hp-alarm-mgr > 58993 [PSH, ACK] Seq=45 Ack=867 Win=64669 Len=641
39208  16.220961 41.177.180.176 -> 41.177.3.215 TCP 64 hp-alarm-mgr > 58993 [ACK] Seq=686 Ack=868 Win=64669 Len=0
39209  16.221219 41.177.180.176 -> 41.177.3.215 TCP 64 hp-alarm-mgr > 58993 [FIN, ACK] Seq=686 Ack=868 Win=64669 Len=0
161534  54.986962 41.177.180.176 -> 244.3.31.84  TCP 118 dbcontrol-agent > 31111 [PSH, ACK] Seq=1 Ack=1 Win=65151 Len=60
162195  55.190035 41.177.180.176 -> 244.3.31.84  TCP 64 dbcontrol-agent > 31111 [ACK] Seq=61 Ack=13 Win=65139 Len=0
203253  70.067289 41.177.180.176 -> 244.3.31.84  TCP 82 31111 > 61562 [PSH, ACK] Seq=13 Ack=61 Win=65475 Len=12 TSval=7320437 TSecr=1276466443
330602 115.081090 41.177.180.176 -> 244.3.31.84  TCP 118 dbcontrol-agent > 31111 [PSH, ACK] Seq=61 Ack=13 Win=65139 Len=60
330913 115.237218 41.177.180.176 -> 244.3.31.84  TCP 64 dbcontrol-agent > 31111 [ACK] Seq=121 Ack=25 Win=65127 Len=0
389642 130.180760 41.177.180.176 -> 244.3.31.84  TCP 82 31111 > 61562 [PSH, ACK] Seq=25 Ack=121 Win=65415 Len=12 TSval=7321038 TSecr=1276466563
407336 136.196032 41.177.180.176 -> 41.177.3.215 TCP 66 hp-alarm-mgr > 59302 [SYN, ACK] Seq=0 Ack=1 Win=16384 Len=0 MSS=1460 SACK_PERM=1
407677 136.301535 41.177.180.176 -> 244.3.41.152 TCP 66 rsip > https [SYN] Seq=0 Win=65535 Len=0 MSS=1460 SACK_PERM=1
407678 136.302665 41.177.180.176 -> 244.3.41.152 TCP 64 rsip > https [ACK] Seq=1 Ack=1 Win=65535 Len=0
407767 136.329177 41.177.180.176 -> 244.3.41.152 TCP 64 rsip > https [ACK] Seq=936 Ack=548 Win=64988 Len=0
407769 136.329419 41.177.180.176 -> 244.3.41.152 TCP 64 rsip > https [FIN, ACK] Seq=973 Ack=548 Win=64988 Len=0
407770 136.329923 41.177.180.176 -> 244.3.41.152 TCP 64 rsip > https [RST, ACK] Seq=974 Ack=585 Win=0 Len=0
407771 136.330118 41.177.180.176 -> 244.3.41.152 TCP 64 rsip > https [RST] Seq=973 Win=0 Len=0
407772 136.330166 41.177.180.176 -> 244.3.41.152 TCP 64 rsip > https [RST] Seq=974 Win=0 Len=0
408344 136.483292 41.177.180.176 -> 41.177.3.215 TCP 102 hp-alarm-mgr > 59302 [PSH, ACK] Seq=1 Ack=599 Win=64937 Len=44
408513 136.518603 41.177.180.176 -> 41.177.3.215 TCP 699 hp-alarm-mgr > 59302 [PSH, ACK] Seq=45 Ack=867 Win=64669 Len=641
408576 136.535098 41.177.180.176 -> 41.177.3.215 TCP 64 hp-alarm-mgr > 59302 [ACK] Seq=686 Ack=868 Win=64669 Len=0
408579 136.535353 41.177.180.176 -> 41.177.3.215 TCP 64 hp-alarm-mgr > 59302 [FIN, ACK] Seq=686 Ack=868 Win=64669 Len=0
537739 174.081375 41.177.180.176 -> 41.177.3.215 TCP 64 ff-sm > hp-alarm-mgr [ACK] Seq=1 Ack=1 Win=64107 Len=1
539981 175.190911 41.177.180.176 -> 244.3.31.84  TCP 118 dbcontrol-agent > 31111 [PSH, ACK] Seq=121 Ack=25 Win=65127 Len=60
540344 175.394104 41.177.180.176 -> 244.3.31.84  TCP 64 dbcontrol-agent > 31111 [ACK] Seq=181 Ack=37 Win=65115 Len=0
600463 190.300195 41.177.180.176 -> 244.3.31.84  TCP 82 31111 > 61562 [PSH, ACK] Seq=37 Ack=181 Win=65355 Len=12 TSval=7321639 TSecr=1276466683
736268 235.316362 41.177.180.176 -> 244.3.31.84  TCP 118 dbcontrol-agent > 31111 [PSH, ACK] Seq=181 Ack=37 Win=65115 Len=60
736593 235.550581 41.177.180.176 -> 244.3.31.84  TCP 64 dbcontrol-agent > 31111 [ACK] Seq=241 Ack=49 Win=65103 Len=0
769204 248.900914 41.177.180.176 -> 244.3.31.84  TCP 82 31111 > 61562 [PSH, ACK] Seq=49 Ack=389 Win=65147 Len=12 TSval=7322226 TSecr=1276466799
775022 249.589454 41.177.180.176 -> 244.3.31.84  TCP 82 31111 > 61562 [PSH, ACK] Seq=61 Ack=597 Win=64939 Len=12 TSval=7322232 TSecr=1276466800
792194 257.536442 41.177.180.176 -> 41.177.3.215 TCP 66 hp-alarm-mgr > 59633 [SYN, ACK] Seq=0 Ack=1 Win=16384 Len=0 MSS=1460 SACK_PERM=1
792345 257.646189 41.177.180.176 -> 244.3.41.152 TCP 66 hylafax > https [SYN] Seq=0 Win=65535 Len=0 MSS=1460 SACK_PERM=1
792351 257.647472 41.177.180.176 -> 244.3.41.152 TCP 64 hylafax > https [ACK] Seq=1 Ack=1 Win=65535 Len=0
792396 257.671408 41.177.180.176 -> 244.3.41.152 TCP 64 hylafax > https [ACK] Seq=936 Ack=548 Win=64988 Len=0
792402 257.671696 41.177.180.176 -> 244.3.41.152 TCP 64 hylafax > https [FIN, ACK] Seq=973 Ack=548 Win=64988 Len=0
792404 257.672228 41.177.180.176 -> 244.3.41.152 TCP 64 hylafax > https [RST, ACK] Seq=974 Ack=585 Win=0 Len=0
792405 257.672272 41.177.180.176 -> 244.3.41.152 TCP 64 hylafax > https [RST] Seq=973 Win=0 Len=0
792406 257.672306 41.177.180.176 -> 244.3.41.152 TCP 64 hylafax > https [RST] Seq=974 Win=0 Len=0
792641 257.842580 41.177.180.176 -> 41.177.3.215 TCP 102 hp-alarm-mgr > 59633 [PSH, ACK] Seq=1 Ack=599 Win=64937 Len=44
792680 257.878483 41.177.180.176 -> 41.177.3.215 TCP 699 hp-alarm-mgr > 59633 [PSH, ACK] Seq=45 Ack=867 Win=64669 Len=641
792696 257.893633 41.177.180.176 -> 41.177.3.215 TCP 64 hp-alarm-mgr > 59633 [ACK] Seq=686 Ack=868 Win=64669 Len=0
792697 257.893892 41.177.180.176 -> 41.177.3.215 TCP 64 hp-alarm-mgr > 59633 [FIN, ACK] Seq=686 Ack=868 Win=64669 Len=0
