364907 124.308653 41.177.176.188 -> 41.177.98.176 TCP 66 hks-lm > http [SYN] Seq=0 Win=65535 Len=0 MSS=1460 SACK_PERM=1
364911 124.309084 41.177.176.188 -> 41.177.98.176 TCP 64 hks-lm > http [ACK] Seq=1 Ack=1 Win=65535 Len=0
368175 126.139919 41.177.176.188 -> 41.177.98.176 TCP 64 hks-lm > http [ACK] Seq=960 Ack=2921 Win=65535 Len=0
368177 126.140419 41.177.176.188 -> 41.177.98.176 TCP 64 hks-lm > http [ACK] Seq=960 Ack=5335 Win=65535 Len=0
368182 126.142551 41.177.176.188 -> 41.177.98.176 TCP 64 hks-lm > http [ACK] Seq=960 Ack=8255 Win=65535 Len=0
368183 126.142726 41.177.176.188 -> 41.177.98.176 TCP 64 hks-lm > http [ACK] Seq=960 Ack=10463 Win=65535 Len=0
368190 126.145356 41.177.176.188 -> 41.177.98.176 TCP 64 hks-lm > http [ACK] Seq=960 Ack=13383 Win=65535 Len=0
368192 126.145538 41.177.176.188 -> 41.177.98.176 TCP 64 hks-lm > http [ACK] Seq=960 Ack=15591 Win=65535 Len=0
368198 126.148226 41.177.176.188 -> 41.177.98.176 TCP 64 hks-lm > http [ACK] Seq=960 Ack=18511 Win=65535 Len=0
368200 126.148424 41.177.176.188 -> 41.177.98.176 TCP 64 hks-lm > http [ACK] Seq=960 Ack=20719 Win=64787 Len=0
368213 126.150516 41.177.176.188 -> 41.177.98.176 TCP 64 hks-lm > http [ACK] Seq=960 Ack=21177 Win=64329 Len=0
368508 126.237805 41.177.176.188 -> 41.177.98.176 TCP 64 [TCP Window Update] hks-lm > http [ACK] Seq=960 Ack=21177 Win=65535 Len=0
373996 126.437674 41.177.176.188 -> 41.177.98.176 TCP 64 hks-lm > http [ACK] Seq=2375 Ack=25213 Win=65535 Len=0
374005 126.437875 41.177.176.188 -> 41.177.98.176 TCP 64 hks-lm > http [ACK] Seq=2375 Ack=27771 Win=65535 Len=0
378614 126.592569 41.177.176.188 -> 41.177.98.176 TCP 64 hks-lm > http [ACK] Seq=3077 Ack=28488 Win=65535 Len=0
381178 126.766547 41.177.176.188 -> 41.177.98.176 TCP 64 hks-lm > http [ACK] Seq=3778 Ack=30258 Win=65535 Len=0
381184 126.766832 41.177.176.188 -> 41.177.98.176 TCP 64 hks-lm > http [ACK] Seq=3778 Ack=33178 Win=65535 Len=0
381188 126.767033 41.177.176.188 -> 41.177.98.176 TCP 64 hks-lm > http [ACK] Seq=3778 Ack=36098 Win=65535 Len=0
381193 126.767238 41.177.176.188 -> 41.177.98.176 TCP 64 hks-lm > http [ACK] Seq=3778 Ack=38450 Win=65535 Len=0
381197 126.767503 41.177.176.188 -> 41.177.98.176 TCP 64 hks-lm > http [ACK] Seq=3778 Ack=41370 Win=62615 Len=0
381200 126.767732 41.177.176.188 -> 41.177.98.176 TCP 64 hks-lm > http [ACK] Seq=3778 Ack=44290 Win=59695 Len=0
381203 126.767946 41.177.176.188 -> 41.177.98.176 TCP 64 hks-lm > http [ACK] Seq=3778 Ack=46642 Win=57343 Len=0
381207 126.768220 41.177.176.188 -> 41.177.98.176 TCP 64 hks-lm > http [ACK] Seq=3778 Ack=49562 Win=54423 Len=0
381208 126.768224 41.177.176.188 -> 41.177.98.176 TCP 64 [TCP Window Update] hks-lm > http [ACK] Seq=3778 Ack=49562 Win=58183 Len=0
381210 126.768439 41.177.176.188 -> 41.177.98.176 TCP 64 hks-lm > http [ACK] Seq=3778 Ack=52482 Win=55263 Len=0
381213 126.768647 41.177.176.188 -> 41.177.98.176 TCP 64 hks-lm > http [ACK] Seq=3778 Ack=54834 Win=52911 Len=0
381219 126.768908 41.177.176.188 -> 41.177.98.176 TCP 64 hks-lm > http [ACK] Seq=3778 Ack=57754 Win=49991 Len=0
381222 126.769138 41.177.176.188 -> 41.177.98.176 TCP 64 hks-lm > http [ACK] Seq=3778 Ack=60674 Win=47071 Len=0
381226 126.769343 41.177.176.188 -> 41.177.98.176 TCP 64 hks-lm > http [ACK] Seq=3778 Ack=63026 Win=44719 Len=0
381231 126.769599 41.177.176.188 -> 41.177.98.176 TCP 64 hks-lm > http [ACK] Seq=3778 Ack=65946 Win=41799 Len=0
381234 126.769841 41.177.176.188 -> 41.177.98.176 TCP 64 hks-lm > http [ACK] Seq=3778 Ack=68866 Win=38879 Len=0
381237 126.770038 41.177.176.188 -> 41.177.98.176 TCP 64 hks-lm > http [ACK] Seq=3778 Ack=71218 Win=36527 Len=0
381241 126.770301 41.177.176.188 -> 41.177.98.176 TCP 64 hks-lm > http [ACK] Seq=3778 Ack=74138 Win=33607 Len=0
381243 126.770529 41.177.176.188 -> 41.177.98.176 TCP 64 hks-lm > http [ACK] Seq=3778 Ack=77058 Win=30687 Len=0
381246 126.770733 41.177.176.188 -> 41.177.98.176 TCP 64 hks-lm > http [ACK] Seq=3778 Ack=79410 Win=28335 Len=0
381252 126.771000 41.177.176.188 -> 41.177.98.176 TCP 64 hks-lm > http [ACK] Seq=3778 Ack=82330 Win=25415 Len=0
381255 126.771234 41.177.176.188 -> 41.177.98.176 TCP 64 hks-lm > http [ACK] Seq=3778 Ack=85250 Win=22495 Len=0
381258 126.771460 41.177.176.188 -> 41.177.98.176 TCP 64 hks-lm > http [ACK] Seq=3778 Ack=87602 Win=20143 Len=0
381428 126.858456 41.177.176.188 -> 41.177.98.176 TCP 64 hks-lm > http [ACK] Seq=3778 Ack=88156 Win=26941 Len=0
381429 126.858743 41.177.176.188 -> 41.177.98.176 TCP 64 [TCP Window Update] hks-lm > http [ACK] Seq=3778 Ack=88156 Win=65535 Len=0
381673 127.062963 41.177.176.188 -> 41.177.98.176 TCP 64 hks-lm > http [ACK] Seq=5189 Ack=90755 Win=65535 Len=0
381678 127.063211 41.177.176.188 -> 41.177.98.176 TCP 64 hks-lm > http [ACK] Seq=5189 Ack=93675 Win=65535 Len=0
381680 127.063450 41.177.176.188 -> 41.177.98.176 TCP 64 hks-lm > http [ACK] Seq=5189 Ack=96720 Win=65535 Len=0
382506 127.254694 41.177.176.188 -> 41.177.98.176 TCP 64 hks-lm > http [ACK] Seq=5896 Ack=99640 Win=65535 Len=0
382510 127.254919 41.177.176.188 -> 41.177.98.176 TCP 64 hks-lm > http [ACK] Seq=5896 Ack=102412 Win=65535 Len=0
384516 127.443518 41.177.176.188 -> 41.177.98.176 TCP 64 hks-lm > http [ACK] Seq=6609 Ack=104182 Win=65535 Len=0
384520 127.443776 41.177.176.188 -> 41.177.98.176 TCP 64 hks-lm > http [ACK] Seq=6609 Ack=107102 Win=65535 Len=0
384523 127.444017 41.177.176.188 -> 41.177.98.176 TCP 64 hks-lm > http [ACK] Seq=6609 Ack=110022 Win=65535 Len=0
384527 127.444234 41.177.176.188 -> 41.177.98.176 TCP 64 hks-lm > http [ACK] Seq=6609 Ack=112374 Win=65535 Len=0
384569 127.445827 41.177.176.188 -> 41.177.98.176 TCP 64 hks-lm > http [ACK] Seq=6609 Ack=113122 Win=65535 Len=0
385198 127.629109 41.177.176.188 -> 41.177.98.176 TCP 64 hks-lm > http [ACK] Seq=7320 Ack=116042 Win=65535 Len=0
385199 127.629299 41.177.176.188 -> 41.177.98.176 TCP 64 hks-lm > http [ACK] Seq=7320 Ack=118358 Win=65535 Len=0
385511 127.822352 41.177.176.188 -> 41.177.98.176 TCP 64 hks-lm > http [ACK] Seq=8042 Ack=120127 Win=65535 Len=0
385516 127.822608 41.177.176.188 -> 41.177.98.176 TCP 64 hks-lm > http [ACK] Seq=8042 Ack=123047 Win=65535 Len=0
385521 127.822845 41.177.176.188 -> 41.177.98.176 TCP 64 hks-lm > http [ACK] Seq=8042 Ack=125967 Win=65535 Len=0
385523 127.823008 41.177.176.188 -> 41.177.98.176 TCP 64 hks-lm > http [ACK] Seq=8042 Ack=127944 Win=65535 Len=0
385753 128.005880 41.177.176.188 -> 41.177.98.176 TCP 64 hks-lm > http [ACK] Seq=8765 Ack=130042 Win=65535 Len=0
385897 128.101579 41.177.176.188 -> 41.177.98.176 TCP 64 hks-lm > http [ACK] Seq=9471 Ack=132962 Win=65535 Len=0
385898 128.101804 41.177.176.188 -> 41.177.98.176 TCP 64 hks-lm > http [ACK] Seq=9471 Ack=135650 Win=65535 Len=0
386109 128.305283 41.177.176.188 -> 41.177.98.176 TCP 64 hks-lm > http [ACK] Seq=10176 Ack=137420 Win=65535 Len=0
386113 128.305534 41.177.176.188 -> 41.177.98.176 TCP 64 hks-lm > http [ACK] Seq=10176 Ack=140340 Win=65535 Len=0
386115 128.305773 41.177.176.188 -> 41.177.98.176 TCP 64 hks-lm > http [ACK] Seq=10176 Ack=143260 Win=65535 Len=0
386118 128.305976 41.177.176.188 -> 41.177.98.176 TCP 64 hks-lm > http [ACK] Seq=10176 Ack=145612 Win=65535 Len=0
386121 128.306217 41.177.176.188 -> 41.177.98.176 TCP 64 hks-lm > http [ACK] Seq=10176 Ack=148532 Win=62615 Len=0
386122 128.306419 41.177.176.188 -> 41.177.98.176 TCP 64 hks-lm > http [ACK] Seq=10176 Ack=150855 Win=60292 Len=0
386131 128.311925 41.177.176.188 -> 41.177.98.176 TCP 64 [TCP Window Update] hks-lm > http [ACK] Seq=10176 Ack=150855 Win=64052 Len=0
386237 128.401322 41.177.176.188 -> 41.177.98.176 TCP 64 [TCP Window Update] hks-lm > http [ACK] Seq=10176 Ack=150855 Win=65535 Len=0
386383 128.498362 41.177.176.188 -> 41.177.98.176 TCP 64 hks-lm > http [ACK] Seq=10879 Ack=152624 Win=65535 Len=0
386388 128.498610 41.177.176.188 -> 41.177.98.176 TCP 64 hks-lm > http [ACK] Seq=10879 Ack=155544 Win=65535 Len=0
386390 128.498843 41.177.176.188 -> 41.177.98.176 TCP 64 hks-lm > http [ACK] Seq=10879 Ack=158464 Win=65535 Len=0
386391 128.498996 41.177.176.188 -> 41.177.98.176 TCP 64 hks-lm > http [ACK] Seq=10879 Ack=160177 Win=65535 Len=0
386819 128.795707 41.177.176.188 -> 41.177.98.176 TCP 64 hks-lm > http [ACK] Seq=11580 Ack=160504 Win=65208 Len=0
386831 128.804478 41.177.176.188 -> 41.177.98.176 TCP 64 hks-lm > http [ACK] Seq=12286 Ack=162065 Win=65535 Len=0
386886 128.831437 41.177.176.188 -> 41.177.98.176 TCP 64 hks-lm > http [ACK] Seq=12999 Ack=163822 Win=65535 Len=0
386890 128.831690 41.177.176.188 -> 41.177.98.176 TCP 64 hks-lm > http [ACK] Seq=12999 Ack=166742 Win=65535 Len=0
386892 128.831921 41.177.176.188 -> 41.177.98.176 TCP 64 hks-lm > http [ACK] Seq=12999 Ack=169662 Win=65535 Len=0
386896 128.832135 41.177.176.188 -> 41.177.98.176 TCP 64 hks-lm > http [ACK] Seq=12999 Ack=172014 Win=64075 Len=0
386900 128.832387 41.177.176.188 -> 41.177.98.176 TCP 64 hks-lm > http [ACK] Seq=12999 Ack=174934 Win=61155 Len=0
386902 128.832540 41.177.176.188 -> 41.177.98.176 TCP 64 hks-lm > http [ACK] Seq=12999 Ack=176394 Win=63455 Len=0
386904 128.832696 41.177.176.188 -> 41.177.98.176 TCP 64 hks-lm > http [ACK] Seq=12999 Ack=178746 Win=61103 Len=0
386907 128.832957 41.177.176.188 -> 41.177.98.176 TCP 64 hks-lm > http [ACK] Seq=12999 Ack=181666 Win=58183 Len=0
386910 128.833200 41.177.176.188 -> 41.177.98.176 TCP 64 hks-lm > http [ACK] Seq=12999 Ack=184586 Win=55263 Len=0
386913 128.833399 41.177.176.188 -> 41.177.98.176 TCP 64 hks-lm > http [ACK] Seq=12999 Ack=186938 Win=52911 Len=0
386915 128.833651 41.177.176.188 -> 41.177.98.176 TCP 64 hks-lm > http [ACK] Seq=12999 Ack=189858 Win=49991 Len=0
386916 128.837668 41.177.176.188 -> 41.177.98.176 TCP 64 hks-lm > http [ACK] Seq=12999 Ack=190977 Win=65535 Len=0
386922 128.841739 41.177.176.188 -> 41.177.98.176 TCP 66 iden-ralp > http [SYN] Seq=0 Win=65535 Len=0 MSS=1460 SACK_PERM=1
386927 128.842022 41.177.176.188 -> 41.177.98.176 TCP 64 iden-ralp > http [ACK] Seq=1 Ack=1 Win=65535 Len=0
387183 128.995989 41.177.176.188 -> 41.177.98.176 TCP 64 iden-ralp > http [ACK] Seq=705 Ack=337 Win=65199 Len=0
391859 130.999623 41.177.176.188 -> 41.177.98.176 TCP 64 hks-lm > http [ACK] Seq=14044 Ack=193897 Win=65535 Len=0
391860 130.999815 41.177.176.188 -> 41.177.98.176 TCP 64 hks-lm > http [ACK] Seq=14044 Ack=196310 Win=65535 Len=0
391865 131.002369 41.177.176.188 -> 41.177.98.176 TCP 64 hks-lm > http [ACK] Seq=14044 Ack=199230 Win=65535 Len=0
391866 131.002541 41.177.176.188 -> 41.177.98.176 TCP 64 hks-lm > http [ACK] Seq=14044 Ack=201438 Win=65535 Len=0
391875 131.005207 41.177.176.188 -> 41.177.98.176 TCP 64 hks-lm > http [ACK] Seq=14044 Ack=204358 Win=65535 Len=0
391878 131.005385 41.177.176.188 -> 41.177.98.176 TCP 64 hks-lm > http [ACK] Seq=14044 Ack=206566 Win=65535 Len=0
391891 131.008102 41.177.176.188 -> 41.177.98.176 TCP 64 hks-lm > http [ACK] Seq=14044 Ack=209486 Win=65535 Len=0
391892 131.008291 41.177.176.188 -> 41.177.98.176 TCP 64 hks-lm > http [ACK] Seq=14044 Ack=211694 Win=64787 Len=0
391896 131.009727 41.177.176.188 -> 41.177.98.176 TCP 64 hks-lm > http [ACK] Seq=14044 Ack=211959 Win=64522 Len=0
392034 131.096001 41.177.176.188 -> 41.177.98.176 TCP 64 [TCP Window Update] hks-lm > http [ACK] Seq=14044 Ack=211959 Win=65535 Len=0
442393 144.045183 41.177.176.188 -> 41.177.98.176 TCP 64 iden-ralp > http [ACK] Seq=2043 Ack=3257 Win=65535 Len=0
442395 144.045379 41.177.176.188 -> 41.177.98.176 TCP 64 iden-ralp > http [ACK] Seq=2043 Ack=5670 Win=65535 Len=0
442400 144.048088 41.177.176.188 -> 41.177.98.176 TCP 64 iden-ralp > http [ACK] Seq=2043 Ack=8590 Win=65535 Len=0
442401 144.048270 41.177.176.188 -> 41.177.98.176 TCP 64 iden-ralp > http [ACK] Seq=2043 Ack=10798 Win=65535 Len=0
442408 144.050921 41.177.176.188 -> 41.177.98.176 TCP 64 iden-ralp > http [ACK] Seq=2043 Ack=13718 Win=65535 Len=0
442409 144.051096 41.177.176.188 -> 41.177.98.176 TCP 64 iden-ralp > http [ACK] Seq=2043 Ack=15926 Win=64787 Len=0
442411 144.052472 41.177.176.188 -> 41.177.98.176 TCP 64 [TCP Window Update] iden-ralp > http [ACK] Seq=2043 Ack=15926 Win=65535 Len=0
442418 144.053823 41.177.176.188 -> 41.177.98.176 TCP 64 iden-ralp > http [ACK] Seq=2043 Ack=18846 Win=65535 Len=0
442420 144.054005 41.177.176.188 -> 41.177.98.176 TCP 64 iden-ralp > http [ACK] Seq=2043 Ack=21054 Win=65535 Len=0
442430 144.056907 41.177.176.188 -> 41.177.98.176 TCP 64 iden-ralp > http [ACK] Seq=2043 Ack=23623 Win=64426 Len=0
442739 144.141008 41.177.176.188 -> 41.177.98.176 TCP 64 [TCP Window Update] iden-ralp > http [ACK] Seq=2043 Ack=23623 Win=65535 Len=0
443979 144.518239 41.177.176.188 -> 41.177.98.176 TCP 64 iden-ralp > http [ACK] Seq=3042 Ack=24155 Win=65003 Len=0
443980 144.518244 41.177.176.188 -> 41.177.98.176 TCP 64 hks-lm > http [ACK] Seq=15043 Ack=212514 Win=65535 Len=0
461807 151.349698 41.177.176.188 -> 41.177.98.176 TCP 88 [TCP segment of a reassembled PDU]
463360 152.196587 41.177.176.188 -> 41.177.98.176 TCP 64 hks-lm > http [ACK] Seq=16681 Ack=215434 Win=65535 Len=0
463361 152.196784 41.177.176.188 -> 41.177.98.176 TCP 64 hks-lm > http [ACK] Seq=16681 Ack=217847 Win=65535 Len=0
463374 152.199226 41.177.176.188 -> 41.177.98.176 TCP 64 hks-lm > http [ACK] Seq=16681 Ack=220767 Win=65535 Len=0
463375 152.199428 41.177.176.188 -> 41.177.98.176 TCP 64 hks-lm > http [ACK] Seq=16681 Ack=222975 Win=64787 Len=0
463380 152.202067 41.177.176.188 -> 41.177.98.176 TCP 64 hks-lm > http [ACK] Seq=16681 Ack=225895 Win=61867 Len=0
463381 152.202250 41.177.176.188 -> 41.177.98.176 TCP 64 hks-lm > http [ACK] Seq=16681 Ack=228103 Win=59659 Len=0
463391 152.205883 41.177.176.188 -> 41.177.98.176 TCP 64 [TCP Window Update] hks-lm > http [ACK] Seq=16681 Ack=228103 Win=65535 Len=0
463397 152.206999 41.177.176.188 -> 41.177.98.176 TCP 64 hks-lm > http [ACK] Seq=16681 Ack=231023 Win=65535 Len=0
463398 152.207165 41.177.176.188 -> 41.177.98.176 TCP 64 hks-lm > http [ACK] Seq=16681 Ack=233097 Win=63461 Len=0
463641 152.300381 41.177.176.188 -> 41.177.98.176 TCP 64 [TCP Window Update] hks-lm > http [ACK] Seq=16681 Ack=233097 Win=65535 Len=0
464300 152.566754 41.177.176.188 -> 41.177.98.176 TCP 64 hks-lm > http [ACK] Seq=18780 Ack=235851 Win=65535 Len=0
464302 152.566891 41.177.176.188 -> 41.177.98.176 TCP 64 iden-ralp > http [ACK] Seq=5142 Ack=26309 Win=65535 Len=0
464328 152.580333 41.177.176.188 -> 41.177.98.176 TCP 64 hks-lm > http [ACK] Seq=19829 Ack=237608 Win=65535 Len=0
464332 152.580587 41.177.176.188 -> 41.177.98.176 TCP 64 hks-lm > http [ACK] Seq=19829 Ack=240528 Win=65535 Len=0
464335 152.580834 41.177.176.188 -> 41.177.98.176 TCP 64 hks-lm > http [ACK] Seq=19829 Ack=243448 Win=65535 Len=0
464338 152.581043 41.177.176.188 -> 41.177.98.176 TCP 64 hks-lm > http [ACK] Seq=19829 Ack=245800 Win=65535 Len=0
464339 152.581185 41.177.176.188 -> 41.177.98.176 TCP 64 hks-lm > http [ACK] Seq=19829 Ack=247643 Win=63692 Len=0
464360 152.587245 41.177.176.188 -> 41.177.98.176 TCP 64 [TCP Window Update] hks-lm > http [ACK] Seq=19829 Ack=247643 Win=65535 Len=0
464374 152.592886 41.177.176.188 -> 41.177.98.176 TCP 64 iden-ralp > http [ACK] Seq=6191 Ack=29229 Win=65535 Len=0
464375 152.593080 41.177.176.188 -> 41.177.98.176 TCP 64 iden-ralp > http [ACK] Seq=6191 Ack=31738 Win=65535 Len=0
465553 153.130546 41.177.176.188 -> 41.177.98.176 TCP 64 hks-lm > http [ACK] Seq=20884 Ack=248370 Win=65535 Len=0
518027 167.594436 41.177.176.188 -> 41.177.98.176 TCP 64 iden-ralp > http [ACK] Seq=6191 Ack=31739 Win=65535 Len=0
519727 167.954456 41.177.176.188 -> 41.177.98.176 TCP 64 hks-lm > http [ACK] Seq=20884 Ack=248371 Win=65535 Len=0
519798 168.011792 41.177.176.188 -> 41.177.98.176 TCP 64 iden-ralp > http [RST, ACK] Seq=6191 Ack=31739 Win=0 Len=0
519799 168.011860 41.177.176.188 -> 41.177.98.176 TCP 64 hks-lm > http [RST, ACK] Seq=20884 Ack=248371 Win=0 Len=0
