62644  25.771939 41.180.194.108 -> 41.177.26.46 TCP 70 49709 > http [FIN, ACK] Seq=1 Ack=1 Win=1032 Len=0 TSval=1178673410 TSecr=1509544660
62645  25.771973 41.180.194.108 -> 41.177.26.46 TCP 78 54710 > http [SYN] Seq=0 Win=65535 Len=0 MSS=1460 WS=64 SACK_PERM=1 TSval=1178673410 TSecr=0
62761  25.827743 41.180.194.108 -> 41.177.26.46 TCP 70 54710 > http [ACK] Seq=1 Ack=1 Win=66048 Len=0 TSval=1178673470 TSecr=1509548035
63226  26.112257 41.180.194.108 -> 41.177.26.46 TCP 70 54710 > http [ACK] Seq=787 Ack=2897 Win=64576 Len=0 TSval=1178673750 TSecr=1509548063
63230  26.112507 41.180.194.108 -> 41.177.26.46 TCP 70 54710 > http [ACK] Seq=787 Ack=4345 Win=66048 Len=0 TSval=1178673750 TSecr=1509548063
63235  26.113629 41.180.194.108 -> 41.177.26.46 TCP 78 52629 > http [SYN] Seq=0 Win=65535 Len=0 MSS=1460 WS=64 SACK_PERM=1 TSval=1178673760 TSecr=0
63241  26.114576 41.180.194.108 -> 41.177.26.46 TCP 78 65227 > http [SYN] Seq=0 Win=65535 Len=0 MSS=1460 WS=64 SACK_PERM=1 TSval=1178673760 TSecr=0
63243  26.115273 41.180.194.108 -> 41.177.26.46 TCP 78 59766 > http [SYN] Seq=0 Win=65535 Len=0 MSS=1460 WS=64 SACK_PERM=1 TSval=1178673760 TSecr=0
63245  26.115487 41.180.194.108 -> 41.177.26.46 TCP 78 65381 > http [SYN] Seq=0 Win=65535 Len=0 MSS=1460 WS=64 SACK_PERM=1 TSval=1178673760 TSecr=0
63246  26.115643 41.180.194.108 -> 41.177.26.46 TCP 78 53070 > http [SYN] Seq=0 Win=65535 Len=0 MSS=1460 WS=64 SACK_PERM=1 TSval=1178673760 TSecr=0
63248  26.115736 41.180.194.108 -> 41.177.26.46 TCP 78 56423 > http [SYN] Seq=0 Win=65535 Len=0 MSS=1460 WS=64 SACK_PERM=1 TSval=1178673760 TSecr=0
63314  26.168513 41.180.194.108 -> 41.177.26.46 TCP 70 54710 > http [ACK] Seq=787 Ack=7241 Win=64576 Len=0 TSval=1178673810 TSecr=1509548069
63315  26.169272 41.180.194.108 -> 41.177.26.46 TCP 70 52629 > http [ACK] Seq=1 Ack=1 Win=66048 Len=0 TSval=1178673810 TSecr=1509548069
63318  26.171181 41.180.194.108 -> 41.177.26.46 TCP 70 65227 > http [ACK] Seq=1 Ack=1 Win=66048 Len=0 TSval=1178673810 TSecr=1509548070
63321  26.171939 41.180.194.108 -> 41.177.26.46 TCP 70 65381 > http [ACK] Seq=1 Ack=1 Win=66048 Len=0 TSval=1178673810 TSecr=1509548070
63322  26.171968 41.180.194.108 -> 41.177.26.46 TCP 70 59766 > http [ACK] Seq=1 Ack=1 Win=66048 Len=0 TSval=1178673810 TSecr=1509548070
63323  26.172101 41.180.194.108 -> 41.177.26.46 TCP 70 56423 > http [ACK] Seq=1 Ack=1 Win=66048 Len=0 TSval=1178673810 TSecr=1509548070
63325  26.172450 41.180.194.108 -> 41.177.26.46 TCP 70 53070 > http [ACK] Seq=1 Ack=1 Win=66048 Len=0 TSval=1178673810 TSecr=1509548070
63476  26.234757 41.180.194.108 -> 41.177.26.46 TCP 70 52629 > http [ACK] Seq=773 Ack=1721 Win=64576 Len=0 TSval=1178673880 TSecr=1509548076
63477  26.234766 41.180.194.108 -> 41.177.26.46 TCP 70 52629 > http [ACK] Seq=773 Ack=3169 Win=66048 Len=0 TSval=1178673880 TSecr=1509548076
63481  26.235726 41.180.194.108 -> 41.177.26.46 TCP 70 65381 > http [ACK] Seq=772 Ack=1738 Win=64576 Len=0 TSval=1178673880 TSecr=1509548076
63485  26.236125 41.180.194.108 -> 41.177.26.46 TCP 70 59766 > http [ACK] Seq=769 Ack=2444 Win=65024 Len=0 TSval=1178673880 TSecr=1509548076
63486  26.236305 41.180.194.108 -> 41.177.26.46 TCP 70 56423 > http [ACK] Seq=790 Ack=1738 Win=64576 Len=0 TSval=1178673880 TSecr=1509548076
63490  26.236688 41.180.194.108 -> 41.177.26.46 TCP 70 56423 > http [ACK] Seq=790 Ack=3186 Win=66048 Len=0 TSval=1178673880 TSecr=1509548076
63491  26.236694 41.180.194.108 -> 41.177.26.46 TCP 70 65381 > http [ACK] Seq=772 Ack=3186 Win=66048 Len=0 TSval=1178673880 TSecr=1509548076
63492  26.236726 41.180.194.108 -> 41.177.26.46 TCP 70 65227 > http [ACK] Seq=782 Ack=1722 Win=64576 Len=0 TSval=1178673880 TSecr=1509548076
63500  26.237079 41.180.194.108 -> 41.177.26.46 TCP 70 65227 > http [ACK] Seq=782 Ack=3170 Win=66048 Len=0 TSval=1178673880 TSecr=1509548076
63512  26.244193 41.180.194.108 -> 41.177.26.46 TCP 70 54710 > http [ACK] Seq=787 Ack=8002 Win=66048 Len=0 TSval=1178673890 TSecr=1509548069
63656  26.293122 41.180.194.108 -> 41.177.26.46 TCP 70 52629 > http [ACK] Seq=773 Ack=6065 Win=64576 Len=0 TSval=1178673930 TSecr=1509548082
63660  26.294239 41.180.194.108 -> 41.177.26.46 TCP 70 65381 > http [ACK] Seq=772 Ack=6082 Win=63104 Len=0 TSval=1178673940 TSecr=1509548082
63661  26.294245 41.180.194.108 -> 41.177.26.46 TCP 70 56423 > http [ACK] Seq=790 Ack=6082 Win=63104 Len=0 TSval=1178673940 TSecr=1509548082
63662  26.294343 41.180.194.108 -> 41.177.26.46 TCP 70 53070 > http [ACK] Seq=781 Ack=1311 Win=66048 Len=0 TSval=1178673940 TSecr=1509548076
63671  26.294676 41.180.194.108 -> 41.177.26.46 TCP 70 56423 > http [ACK] Seq=790 Ack=7530 Win=65408 Len=0 TSval=1178673940 TSecr=1509548082
63672  26.294682 41.180.194.108 -> 41.177.26.46 TCP 70 56423 > http [ACK] Seq=790 Ack=10426 Win=62528 Len=0 TSval=1178673940 TSecr=1509548082
63673  26.294754 41.180.194.108 -> 41.177.26.46 TCP 70 65381 > http [ACK] Seq=772 Ack=7530 Win=65408 Len=0 TSval=1178673940 TSecr=1509548082
63674  26.294760 41.180.194.108 -> 41.177.26.46 TCP 70 65381 > http [ACK] Seq=772 Ack=10426 Win=62528 Len=0 TSval=1178673940 TSecr=1509548082
63675  26.294765 41.180.194.108 -> 41.177.26.46 TCP 70 [TCP Window Update] 65381 > http [ACK] Seq=772 Ack=10426 Win=66048 Len=0 TSval=1178673940 TSecr=1509548082
63676  26.294770 41.180.194.108 -> 41.177.26.46 TCP 70 [TCP Window Update] 56423 > http [ACK] Seq=790 Ack=10426 Win=66048 Len=0 TSval=1178673940 TSecr=1509548082
63688  26.295449 41.180.194.108 -> 41.177.26.46 TCP 70 65227 > http [ACK] Seq=782 Ack=6066 Win=64576 Len=0 TSval=1178673940 TSecr=1509548082
63689  26.295457 41.180.194.108 -> 41.177.26.46 TCP 70 65227 > http [ACK] Seq=782 Ack=8962 Win=64000 Len=0 TSval=1178673940 TSecr=1509548082
63692  26.295679 41.180.194.108 -> 41.177.26.46 TCP 70 65227 > http [ACK] Seq=782 Ack=10410 Win=66048 Len=0 TSval=1178673940 TSecr=1509548082
63756  26.344714 41.180.194.108 -> 41.177.26.46 TCP 70 52629 > http [ACK] Seq=773 Ack=6948 Win=66048 Len=0 TSval=1178673990 TSecr=1509548082
63770  26.350608 41.180.194.108 -> 41.177.26.46 TCP 70 65381 > http [ACK] Seq=772 Ack=13322 Win=64576 Len=0 TSval=1178673990 TSecr=1509548087
63771  26.350619 41.180.194.108 -> 41.177.26.46 TCP 70 56423 > http [ACK] Seq=790 Ack=13322 Win=64576 Len=0 TSval=1178673990 TSecr=1509548087
63772  26.350766 41.180.194.108 -> 41.177.26.46 TCP 70 65381 > http [ACK] Seq=772 Ack=14770 Win=66048 Len=0 TSval=1178673990 TSecr=1509548087
63781  26.351195 41.180.194.108 -> 41.177.26.46 TCP 70 56423 > http [ACK] Seq=790 Ack=14770 Win=66048 Len=0 TSval=1178673990 TSecr=1509548087
63782  26.351205 41.180.194.108 -> 41.177.26.46 TCP 70 56423 > http [ACK] Seq=790 Ack=17666 Win=64576 Len=0 TSval=1178673990 TSecr=1509548088
63789  26.351553 41.180.194.108 -> 41.177.26.46 TCP 70 65381 > http [ACK] Seq=772 Ack=17666 Win=64576 Len=0 TSval=1178673990 TSecr=1509548088
63790  26.351558 41.180.194.108 -> 41.177.26.46 TCP 70 65381 > http [ACK] Seq=772 Ack=19114 Win=66048 Len=0 TSval=1178673990 TSecr=1509548088
63793  26.351763 41.180.194.108 -> 41.177.26.46 TCP 70 56423 > http [ACK] Seq=790 Ack=19114 Win=66048 Len=0 TSval=1178673990 TSecr=1509548088
63799  26.352809 41.180.194.108 -> 41.177.26.46 TCP 70 65381 > http [ACK] Seq=772 Ack=22010 Win=64576 Len=0 TSval=1178673990 TSecr=1509548088
63800  26.352819 41.180.194.108 -> 41.177.26.46 TCP 70 56423 > http [ACK] Seq=790 Ack=22010 Win=64576 Len=0 TSval=1178673990 TSecr=1509548088
63807  26.353708 41.180.194.108 -> 41.177.26.46 TCP 70 65227 > http [ACK] Seq=782 Ack=13306 Win=64576 Len=0 TSval=1178674000 TSecr=1509548088
63808  26.353718 41.180.194.108 -> 41.177.26.46 TCP 70 65227 > http [ACK] Seq=782 Ack=14754 Win=66048 Len=0 TSval=1178674000 TSecr=1509548088
63809  26.353908 41.180.194.108 -> 41.177.26.46 TCP 70 65227 > http [ACK] Seq=782 Ack=17650 Win=63488 Len=0 TSval=1178674000 TSecr=1509548088
63810  26.354093 41.180.194.108 -> 41.177.26.46 TCP 70 65227 > http [ACK] Seq=782 Ack=19098 Win=66048 Len=0 TSval=1178674000 TSecr=1509548088
63811  26.354507 41.180.194.108 -> 41.177.26.46 TCP 70 65227 > http [ACK] Seq=782 Ack=21548 Win=65024 Len=0 TSval=1178674000 TSecr=1509548088
63939  26.407486 41.180.194.108 -> 41.177.26.46 TCP 70 65381 > http [ACK] Seq=772 Ack=23458 Win=65856 Len=0 TSval=1178674050 TSecr=1509548093
63942  26.407742 41.180.194.108 -> 41.177.26.46 TCP 70 56423 > http [ACK] Seq=790 Ack=23458 Win=65856 Len=0 TSval=1178674050 TSecr=1509548093
63943  26.407890 41.180.194.108 -> 41.177.26.46 TCP 70 65381 > http [ACK] Seq=772 Ack=26354 Win=64576 Len=0 TSval=1178674050 TSecr=1509548093
63944  26.407896 41.180.194.108 -> 41.177.26.46 TCP 70 65381 > http [ACK] Seq=772 Ack=27802 Win=66048 Len=0 TSval=1178674050 TSecr=1509548093
63952  26.408194 41.180.194.108 -> 41.177.26.46 TCP 70 56423 > http [ACK] Seq=790 Ack=26354 Win=64576 Len=0 TSval=1178674050 TSecr=1509548093
63956  26.408807 41.180.194.108 -> 41.177.26.46 TCP 70 56423 > http [ACK] Seq=790 Ack=27802 Win=66048 Len=0 TSval=1178674050 TSecr=1509548093
63959  26.409080 41.180.194.108 -> 41.177.26.46 TCP 70 56423 > http [ACK] Seq=790 Ack=30698 Win=64576 Len=0 TSval=1178674050 TSecr=1509548093
63964  26.409320 41.180.194.108 -> 41.177.26.46 TCP 70 56423 > http [ACK] Seq=790 Ack=32146 Win=66048 Len=0 TSval=1178674050 TSecr=1509548093
63965  26.409326 41.180.194.108 -> 41.177.26.46 TCP 70 65381 > http [ACK] Seq=772 Ack=30698 Win=64576 Len=0 TSval=1178674050 TSecr=1509548093
63972  26.409637 41.180.194.108 -> 41.177.26.46 TCP 70 65381 > http [ACK] Seq=772 Ack=32146 Win=66048 Len=0 TSval=1178674050 TSecr=1509548093
63977  26.409834 41.180.194.108 -> 41.177.26.46 TCP 70 65381 > http [ACK] Seq=772 Ack=35042 Win=64576 Len=0 TSval=1178674050 TSecr=1509548093
63979  26.410114 41.180.194.108 -> 41.177.26.46 TCP 70 65381 > http [ACK] Seq=772 Ack=36490 Win=66048 Len=0 TSval=1178674050 TSecr=1509548093
63983  26.410721 41.180.194.108 -> 41.177.26.46 TCP 70 56423 > http [ACK] Seq=790 Ack=35042 Win=64576 Len=0 TSval=1178674050 TSecr=1509548093
63984  26.410727 41.180.194.108 -> 41.177.26.46 TCP 70 56423 > http [ACK] Seq=790 Ack=36490 Win=66048 Len=0 TSval=1178674050 TSecr=1509548093
63990  26.411453 41.180.194.108 -> 41.177.26.46 TCP 70 56423 > http [ACK] Seq=790 Ack=39386 Win=64576 Len=0 TSval=1178674050 TSecr=1509548093
63994  26.411760 41.180.194.108 -> 41.177.26.46 TCP 70 65381 > http [ACK] Seq=772 Ack=39386 Win=64576 Len=0 TSval=1178674050 TSecr=1509548093
63995  26.412060 41.180.194.108 -> 41.177.26.46 TCP 70 65381 > http [ACK] Seq=772 Ack=40834 Win=66048 Len=0 TSval=1178674050 TSecr=1509548093
63996  26.412222 41.180.194.108 -> 41.177.26.46 TCP 70 56423 > http [ACK] Seq=790 Ack=40834 Win=66048 Len=0 TSval=1178674050 TSecr=1509548093
64132  26.463934 41.180.194.108 -> 41.177.26.46 TCP 70 65381 > http [ACK] Seq=772 Ack=43730 Win=64576 Len=0 TSval=1178674110 TSecr=1509548099
64133  26.464071 41.180.194.108 -> 41.177.26.46 TCP 70 56423 > http [ACK] Seq=790 Ack=43730 Win=64576 Len=0 TSval=1178674110 TSecr=1509548099
64134  26.464174 41.180.194.108 -> 41.177.26.46 TCP 70 65381 > http [ACK] Seq=772 Ack=45178 Win=66048 Len=0 TSval=1178674110 TSecr=1509548099
64135  26.464366 41.180.194.108 -> 41.177.26.46 TCP 70 65381 > http [ACK] Seq=772 Ack=48074 Win=64576 Len=0 TSval=1178674110 TSecr=1509548099
64136  26.464692 41.180.194.108 -> 41.177.26.46 TCP 70 65381 > http [ACK] Seq=772 Ack=49522 Win=66048 Len=0 TSval=1178674110 TSecr=1509548099
64137  26.464698 41.180.194.108 -> 41.177.26.46 TCP 70 56423 > http [ACK] Seq=790 Ack=45178 Win=66048 Len=0 TSval=1178674110 TSecr=1509548099
64138  26.465195 41.180.194.108 -> 41.177.26.46 TCP 70 56423 > http [ACK] Seq=790 Ack=48074 Win=64576 Len=0 TSval=1178674110 TSecr=1509548099
64139  26.465771 41.180.194.108 -> 41.177.26.46 TCP 70 56423 > http [ACK] Seq=790 Ack=49522 Win=66048 Len=0 TSval=1178674110 TSecr=1509548099
64140  26.466925 41.180.194.108 -> 41.177.26.46 TCP 70 56423 > http [ACK] Seq=790 Ack=52418 Win=64576 Len=0 TSval=1178674110 TSecr=1509548099
64141  26.466937 41.180.194.108 -> 41.177.26.46 TCP 70 56423 > http [ACK] Seq=790 Ack=55314 Win=63104 Len=0 TSval=1178674110 TSecr=1509548099
64143  26.467091 41.180.194.108 -> 41.177.26.46 TCP 70 [TCP Window Update] 56423 > http [ACK] Seq=790 Ack=55314 Win=66048 Len=0 TSval=1178674110 TSecr=1509548099
64145  26.467503 41.180.194.108 -> 41.177.26.46 TCP 70 65381 > http [ACK] Seq=772 Ack=52418 Win=64576 Len=0 TSval=1178674110 TSecr=1509548099
64146  26.467511 41.180.194.108 -> 41.177.26.46 TCP 70 56423 > http [ACK] Seq=790 Ack=58210 Win=63104 Len=0 TSval=1178674110 TSecr=1509548099
64147  26.467677 41.180.194.108 -> 41.177.26.46 TCP 70 [TCP Window Update] 56423 > http [ACK] Seq=790 Ack=58210 Win=66048 Len=0 TSval=1178674110 TSecr=1509548099
64148  26.467908 41.180.194.108 -> 41.177.26.46 TCP 70 65381 > http [ACK] Seq=772 Ack=53866 Win=66048 Len=0 TSval=1178674110 TSecr=1509548099
64149  26.467915 41.180.194.108 -> 41.177.26.46 TCP 70 65381 > http [ACK] Seq=772 Ack=56762 Win=64576 Len=0 TSval=1178674110 TSecr=1509548099
64154  26.470361 41.180.194.108 -> 41.177.26.46 TCP 70 56423 > http [ACK] Seq=790 Ack=61106 Win=64576 Len=0 TSval=1178674110 TSecr=1509548099
64162  26.470878 41.180.194.108 -> 41.177.26.46 TCP 70 56423 > http [ACK] Seq=790 Ack=62554 Win=66048 Len=0 TSval=1178674110 TSecr=1509548099
64163  26.470883 41.180.194.108 -> 41.177.26.46 TCP 70 56423 > http [ACK] Seq=790 Ack=65450 Win=64576 Len=0 TSval=1178674110 TSecr=1509548099
64164  26.471019 41.180.194.108 -> 41.177.26.46 TCP 70 56423 > http [ACK] Seq=790 Ack=68346 Win=63104 Len=0 TSval=1178674110 TSecr=1509548099
64165  26.471302 41.180.194.108 -> 41.177.26.46 TCP 70 56423 > http [ACK] Seq=790 Ack=69794 Win=66048 Len=0 TSval=1178674110 TSecr=1509548099
64166  26.471869 41.180.194.108 -> 41.177.26.46 TCP 70 56423 > http [ACK] Seq=790 Ack=71820 Win=64000 Len=0 TSval=1178674110 TSecr=1509548099
64336  26.544371 41.180.194.108 -> 41.177.26.46 TCP 70 65381 > http [ACK] Seq=772 Ack=57544 Win=66048 Len=0 TSval=1178674190 TSecr=1509548099
67510  27.785560 41.180.194.108 -> 41.177.26.46 TCP 78 61893 > http [SYN] Seq=0 Win=65535 Len=0 MSS=1460 WS=64 SACK_PERM=1 TSval=1178675430 TSecr=0
67674  27.844441 41.180.194.108 -> 41.177.26.46 TCP 70 61893 > http [ACK] Seq=1 Ack=1 Win=66048 Len=0 TSval=1178675490 TSecr=1509548237
67783  27.894099 41.180.194.108 -> 41.177.26.46 TCP 70 54710 > http [ACK] Seq=1280 Ack=8598 Win=66048 Len=0 TSval=1178675540 TSecr=1509548237
67809  27.904885 41.180.194.108 -> 41.177.26.46 TCP 70 61893 > http [ACK] Seq=509 Ack=2322 Win=65152 Len=0 TSval=1178675550 TSecr=1509548243
68129  28.043983 41.180.194.108 -> 41.177.26.46 TCP 70 54710 > http [ACK] Seq=1778 Ack=9540 Win=66048 Len=0 TSval=1178675690 TSecr=1509548248
115616  41.242114 41.180.194.108 -> 41.177.26.46 TCP 70 52629 > http [ACK] Seq=773 Ack=6949 Win=66048 Len=0 TSval=1178688880 TSecr=1509549577
115617  41.242612 41.180.194.108 -> 41.177.26.46 TCP 70 53070 > http [ACK] Seq=781 Ack=1312 Win=66048 Len=0 TSval=1178688880 TSecr=1509549577
115618  41.242617 41.180.194.108 -> 41.177.26.46 TCP 70 65227 > http [ACK] Seq=782 Ack=21549 Win=66048 Len=0 TSval=1178688880 TSecr=1509549577
115619  41.243109 41.180.194.108 -> 41.177.26.46 TCP 70 65381 > http [ACK] Seq=772 Ack=57545 Win=66048 Len=0 TSval=1178688880 TSecr=1509549577
115620  41.243113 41.180.194.108 -> 41.177.26.46 TCP 70 56423 > http [ACK] Seq=790 Ack=71821 Win=66048 Len=0 TSval=1178688880 TSecr=1509549577
115630  41.250524 41.180.194.108 -> 41.177.26.46 TCP 70 59766 > http [ACK] Seq=769 Ack=2445 Win=66048 Len=0 TSval=1178688890 TSecr=1509549578
119864  42.912048 41.180.194.108 -> 41.177.26.46 TCP 70 61893 > http [ACK] Seq=509 Ack=2323 Win=66048 Len=0 TSval=1178690550 TSecr=1509549744
120228  42.963469 41.180.194.108 -> 41.177.26.46 TCP 70 54710 > http [ACK] Seq=1778 Ack=9541 Win=66048 Len=0 TSval=1178690610 TSecr=1509549749
153389  52.477799 41.180.194.108 -> 41.177.26.46 TCP 70 65161 > http [FIN, ACK] Seq=1 Ack=1 Win=1032 Len=0 TSval=1178700120 TSecr=1509540358
153391  52.478060 41.180.194.108 -> 41.177.26.46 TCP 70 59932 > http [FIN, ACK] Seq=1 Ack=1 Win=1032 Len=0 TSval=1178700120 TSecr=1509540358
153393  52.478123 41.180.194.108 -> 41.177.26.46 TCP 70 63449 > http [FIN, ACK] Seq=1 Ack=1 Win=1032 Len=0 TSval=1178700120 TSecr=1509540358
153394  52.478128 41.180.194.108 -> 41.177.26.46 TCP 70 50524 > http [FIN, ACK] Seq=1 Ack=1 Win=1032 Len=0 TSval=1178700120 TSecr=1509540358
209994  72.374057 41.180.194.108 -> 41.177.26.46 TCP 70 54710 > http [FIN, ACK] Seq=1778 Ack=9541 Win=66048 Len=0 TSval=1178720020 TSecr=1509549749
209996  72.374464 41.180.194.108 -> 41.177.26.46 TCP 78 63682 > http [SYN] Seq=0 Win=65535 Len=0 MSS=1460 WS=64 SACK_PERM=1 TSval=1178720020 TSecr=0
209997  72.374498 41.180.194.108 -> 41.177.26.46 TCP 70 61893 > http [FIN, ACK] Seq=509 Ack=2323 Win=66048 Len=0 TSval=1178720020 TSecr=1509549744
210181  72.430351 41.180.194.108 -> 41.177.26.46 TCP 70 63682 > http [ACK] Seq=1 Ack=1 Win=66048 Len=0 TSval=1178720070 TSecr=1509552695
210322  72.493413 41.180.194.108 -> 41.177.26.46 TCP 70 63682 > http [ACK] Seq=951 Ack=2897 Win=64576 Len=0 TSval=1178720130 TSecr=1509552702
210324  72.494687 41.180.194.108 -> 41.177.26.46 TCP 70 63682 > http [ACK] Seq=951 Ack=4345 Win=66048 Len=0 TSval=1178720140 TSecr=1509552702
210327  72.495570 41.180.194.108 -> 41.177.26.46 TCP 78 61831 > http [SYN] Seq=0 Win=65535 Len=0 MSS=1460 WS=64 SACK_PERM=1 TSval=1178720140 TSecr=0
210328  72.495814 41.180.194.108 -> 41.177.26.46 TCP 78 55350 > http [SYN] Seq=0 Win=65535 Len=0 MSS=1460 WS=64 SACK_PERM=1 TSval=1178720140 TSecr=0
210333  72.496319 41.180.194.108 -> 41.177.26.46 TCP 78 50061 > http [SYN] Seq=0 Win=65535 Len=0 MSS=1460 WS=64 SACK_PERM=1 TSval=1178720140 TSecr=0
210334  72.496345 41.180.194.108 -> 41.177.26.46 TCP 78 53588 > http [SYN] Seq=0 Win=65535 Len=0 MSS=1460 WS=64 SACK_PERM=1 TSval=1178720140 TSecr=0
210335  72.496350 41.180.194.108 -> 41.177.26.46 TCP 78 60278 > http [SYN] Seq=0 Win=65535 Len=0 MSS=1460 WS=64 SACK_PERM=1 TSval=1178720140 TSecr=0
210336  72.496354 41.180.194.108 -> 41.177.26.46 TCP 78 64709 > http [SYN] Seq=0 Win=65535 Len=0 MSS=1460 WS=64 SACK_PERM=1 TSval=1178720140 TSecr=0
210339  72.496530 41.180.194.108 -> 41.177.26.46 TCP 78 54764 > http [SYN] Seq=0 Win=65535 Len=0 MSS=1460 WS=64 SACK_PERM=1 TSval=1178720140 TSecr=0
210344  72.496683 41.180.194.108 -> 41.177.26.46 TCP 78 62822 > http [SYN] Seq=0 Win=65535 Len=0 MSS=1460 WS=64 SACK_PERM=1 TSval=1178720140 TSecr=0
210347  72.496821 41.180.194.108 -> 41.177.26.46 TCP 78 60885 > http [SYN] Seq=0 Win=65535 Len=0 MSS=1460 WS=64 SACK_PERM=1 TSval=1178720140 TSecr=0
210355  72.497239 41.180.194.108 -> 41.177.26.46 TCP 78 62342 > http [SYN] Seq=0 Win=65535 Len=0 MSS=1460 WS=64 SACK_PERM=1 TSval=1178720140 TSecr=0
210357  72.497484 41.180.194.108 -> 41.177.26.46 TCP 78 54626 > http [SYN] Seq=0 Win=65535 Len=0 MSS=1460 WS=64 SACK_PERM=1 TSval=1178720140 TSecr=0
210361  72.497865 41.180.194.108 -> 41.177.26.46 TCP 78 54709 > http [SYN] Seq=0 Win=65535 Len=0 MSS=1460 WS=64 SACK_PERM=1 TSval=1178720140 TSecr=0
210387  72.500487 41.180.194.108 -> 41.177.26.46 TCP 78 63988 > http [SYN] Seq=0 Win=65535 Len=0 MSS=1460 WS=64 SACK_PERM=1 TSval=1178720140 TSecr=0
210388  72.500491 41.180.194.108 -> 41.177.26.46 TCP 78 52007 > http [SYN] Seq=0 Win=65535 Len=0 MSS=1460 WS=64 SACK_PERM=1 TSval=1178720140 TSecr=0
210390  72.500614 41.180.194.108 -> 41.177.26.46 TCP 78 58323 > http [SYN] Seq=0 Win=65535 Len=0 MSS=1460 WS=64 SACK_PERM=1 TSval=1178720140 TSecr=0
210393  72.500635 41.180.194.108 -> 41.177.26.46 TCP 78 50223 > http [SYN] Seq=0 Win=65535 Len=0 MSS=1460 WS=64 SACK_PERM=1 TSval=1178720140 TSecr=0
210664  72.566778 41.180.194.108 -> 41.177.26.46 TCP 70 61831 > http [ACK] Seq=1 Ack=1 Win=66048 Len=0 TSval=1178720210 TSecr=1509552708
210669  72.567204 41.180.194.108 -> 41.177.26.46 TCP 70 53588 > http [ACK] Seq=1 Ack=1 Win=66048 Len=0 TSval=1178720210 TSecr=1509552708
210673  72.567316 41.180.194.108 -> 41.177.26.46 TCP 70 54709 > http [ACK] Seq=1 Ack=1 Win=66048 Len=0 TSval=1178720210 TSecr=1509552708
210679  72.568649 41.180.194.108 -> 41.177.26.46 TCP 70 63988 > http [ACK] Seq=1 Ack=1 Win=66048 Len=0 TSval=1178720210 TSecr=1509552708
210680  72.568919 41.180.194.108 -> 41.177.26.46 TCP 70 52007 > http [ACK] Seq=1 Ack=1 Win=66048 Len=0 TSval=1178720210 TSecr=1509552708
210683  72.569336 41.180.194.108 -> 41.177.26.46 TCP 70 50223 > http [ACK] Seq=1 Ack=1 Win=66048 Len=0 TSval=1178720210 TSecr=1509552708
210685  72.569472 41.180.194.108 -> 41.177.26.46 TCP 70 58323 > http [ACK] Seq=1 Ack=1 Win=66048 Len=0 TSval=1178720210 TSecr=1509552708
210877  72.632538 41.180.194.108 -> 41.177.26.46 TCP 70 53588 > http [ACK] Seq=884 Ack=2897 Win=64576 Len=0 TSval=1178720270 TSecr=1509552716
210892  72.644338 41.180.194.108 -> 41.177.26.46 TCP 70 63682 > http [ACK] Seq=951 Ack=4937 Win=66048 Len=0 TSval=1178720290 TSecr=1509552707
210895  72.646804 41.180.194.108 -> 41.177.26.46 TCP 70 63988 > http [ACK] Seq=883 Ack=1485 Win=64512 Len=0 TSval=1178720290 TSecr=1509552717
211014  72.693908 41.180.194.108 -> 41.177.26.46 TCP 70 52007 > http [ACK] Seq=879 Ack=1007 Win=66048 Len=0 TSval=1178720340 TSecr=1509552717
211016  72.694090 41.180.194.108 -> 41.177.26.46 TCP 70 58323 > http [ACK] Seq=883 Ack=1085 Win=66048 Len=0 TSval=1178720340 TSecr=1509552716
211017  72.694095 41.180.194.108 -> 41.177.26.46 TCP 70 61831 > http [ACK] Seq=880 Ack=924 Win=66048 Len=0 TSval=1178720340 TSecr=1509552716
211018  72.694123 41.180.194.108 -> 41.177.26.46 TCP 70 50223 > http [ACK] Seq=887 Ack=1340 Win=66048 Len=0 TSval=1178720340 TSecr=1509552717
211019  72.694281 41.180.194.108 -> 41.177.26.46 TCP 70 54709 > http [ACK] Seq=883 Ack=895 Win=66048 Len=0 TSval=1178720340 TSecr=1509552716
211023  72.694381 41.180.194.108 -> 41.177.26.46 TCP 70 53588 > http [ACK] Seq=884 Ack=3874 Win=66048 Len=0 TSval=1178720340 TSecr=1509552716
220508  75.495243 41.180.194.108 -> 41.177.26.46 TCP 78 [TCP Retransmission] 62342 > http [SYN] Seq=0 Win=65535 Len=0 MSS=1460 WS=64 SACK_PERM=1 TSval=1178723140 TSecr=0
220510  75.495400 41.180.194.108 -> 41.177.26.46 TCP 78 [TCP Retransmission] 54764 > http [SYN] Seq=0 Win=65535 Len=0 MSS=1460 WS=64 SACK_PERM=1 TSval=1178723140 TSecr=0
220511  75.495421 41.180.194.108 -> 41.177.26.46 TCP 78 [TCP Retransmission] 55350 > http [SYN] Seq=0 Win=65535 Len=0 MSS=1460 WS=64 SACK_PERM=1 TSval=1178723140 TSecr=0
220512  75.495492 41.180.194.108 -> 41.177.26.46 TCP 78 [TCP Retransmission] 60278 > http [SYN] Seq=0 Win=65535 Len=0 MSS=1460 WS=64 SACK_PERM=1 TSval=1178723140 TSecr=0
220516  75.495579 41.180.194.108 -> 41.177.26.46 TCP 78 [TCP Retransmission] 62822 > http [SYN] Seq=0 Win=65535 Len=0 MSS=1460 WS=64 SACK_PERM=1 TSval=1178723140 TSecr=0
220517  75.495618 41.180.194.108 -> 41.177.26.46 TCP 78 [TCP Retransmission] 60885 > http [SYN] Seq=0 Win=65535 Len=0 MSS=1460 WS=64 SACK_PERM=1 TSval=1178723140 TSecr=0
220518  75.495623 41.180.194.108 -> 41.177.26.46 TCP 78 [TCP Retransmission] 54626 > http [SYN] Seq=0 Win=65535 Len=0 MSS=1460 WS=64 SACK_PERM=1 TSval=1178723140 TSecr=0
220519  75.495626 41.180.194.108 -> 41.177.26.46 TCP 78 [TCP Retransmission] 64709 > http [SYN] Seq=0 Win=65535 Len=0 MSS=1460 WS=64 SACK_PERM=1 TSval=1178723140 TSecr=0
220520  75.495701 41.180.194.108 -> 41.177.26.46 TCP 78 [TCP Retransmission] 50061 > http [SYN] Seq=0 Win=65535 Len=0 MSS=1460 WS=64 SACK_PERM=1 TSval=1178723140 TSecr=0
220672  75.551655 41.180.194.108 -> 41.177.26.46 TCP 64 62342 > http [RST] Seq=1 Win=0 Len=0
220674  75.552150 41.180.194.108 -> 41.177.26.46 TCP 64 62822 > http [RST] Seq=1 Win=0 Len=0
220675  75.552155 41.180.194.108 -> 41.177.26.46 TCP 64 55350 > http [RST] Seq=1 Win=0 Len=0
220677  75.552303 41.180.194.108 -> 41.177.26.46 TCP 64 50061 > http [RST] Seq=1 Win=0 Len=0
220678  75.552332 41.180.194.108 -> 41.177.26.46 TCP 64 60885 > http [RST] Seq=1 Win=0 Len=0
220679  75.552402 41.180.194.108 -> 41.177.26.46 TCP 64 54764 > http [RST] Seq=1 Win=0 Len=0
220680  75.552474 41.180.194.108 -> 41.177.26.46 TCP 64 54626 > http [RST] Seq=1 Win=0 Len=0
220681  75.552519 41.180.194.108 -> 41.177.26.46 TCP 64 64709 > http [RST] Seq=1 Win=0 Len=0
220682  75.552524 41.180.194.108 -> 41.177.26.46 TCP 64 60278 > http [RST] Seq=1 Win=0 Len=0
228986  78.693474 41.180.194.108 -> 41.177.26.46 TCP 78 [TCP Retransmission] 60278 > http [SYN] Seq=0 Win=65535 Len=0 MSS=1460 WS=64 SACK_PERM=1 TSval=1178726340 TSecr=0
228987  78.693479 41.180.194.108 -> 41.177.26.46 TCP 78 [TCP Retransmission] 64709 > http [SYN] Seq=0 Win=65535 Len=0 MSS=1460 WS=64 SACK_PERM=1 TSval=1178726340 TSecr=0
228988  78.693622 41.180.194.108 -> 41.177.26.46 TCP 78 [TCP Retransmission] 50061 > http [SYN] Seq=0 Win=65535 Len=0 MSS=1460 WS=64 SACK_PERM=1 TSval=1178726340 TSecr=0
228989  78.693626 41.180.194.108 -> 41.177.26.46 TCP 78 [TCP Retransmission] 62822 > http [SYN] Seq=0 Win=65535 Len=0 MSS=1460 WS=64 SACK_PERM=1 TSval=1178726340 TSecr=0
228994  78.693918 41.180.194.108 -> 41.177.26.46 TCP 78 [TCP Retransmission] 54764 > http [SYN] Seq=0 Win=65535 Len=0 MSS=1460 WS=64 SACK_PERM=1 TSval=1178726340 TSecr=0
228995  78.693923 41.180.194.108 -> 41.177.26.46 TCP 78 [TCP Retransmission] 55350 > http [SYN] Seq=0 Win=65535 Len=0 MSS=1460 WS=64 SACK_PERM=1 TSval=1178726340 TSecr=0
229004  78.694196 41.180.194.108 -> 41.177.26.46 TCP 78 [TCP Retransmission] 60885 > http [SYN] Seq=0 Win=65535 Len=0 MSS=1460 WS=64 SACK_PERM=1 TSval=1178726340 TSecr=0
229007  78.694770 41.180.194.108 -> 41.177.26.46 TCP 78 [TCP Retransmission] 62342 > http [SYN] Seq=0 Win=65535 Len=0 MSS=1460 WS=64 SACK_PERM=1 TSval=1178726340 TSecr=0
229009  78.695020 41.180.194.108 -> 41.177.26.46 TCP 78 [TCP Retransmission] 54626 > http [SYN] Seq=0 Win=65535 Len=0 MSS=1460 WS=64 SACK_PERM=1 TSval=1178726340 TSecr=0
229106  78.749605 41.180.194.108 -> 41.177.26.46 TCP 70 [TCP ACKed unseen segment] 62822 > http [ACK] Seq=1 Ack=4322339 Win=66048 Len=0 TSval=1178726390 TSecr=1509553327
229107  78.749774 41.180.194.108 -> 41.177.26.46 TCP 70 [TCP ACKed unseen segment] 55350 > http [ACK] Seq=1 Ack=5325063 Win=66048 Len=0 TSval=1178726390 TSecr=1509553327
229108  78.749916 41.180.194.108 -> 41.177.26.46 TCP 70 [TCP ACKed unseen segment] 54764 > http [ACK] Seq=1 Ack=4604482 Win=66048 Len=0 TSval=1178726390 TSecr=1509553327
229109  78.749985 41.180.194.108 -> 41.177.26.46 TCP 70 [TCP ACKed unseen segment] 64709 > http [ACK] Seq=1 Ack=4348253 Win=66048 Len=0 TSval=1178726390 TSecr=1509553327
229110  78.750131 41.180.194.108 -> 41.177.26.46 TCP 70 [TCP ACKed unseen segment] 50061 > http [ACK] Seq=1 Ack=4658339 Win=66048 Len=0 TSval=1178726390 TSecr=1509553327
229112  78.750208 41.180.194.108 -> 41.177.26.46 TCP 70 [TCP ACKed unseen segment] 60278 > http [ACK] Seq=1 Ack=4136106 Win=66048 Len=0 TSval=1178726390 TSecr=1509553327
229122  78.750673 41.180.194.108 -> 41.177.26.46 TCP 70 [TCP ACKed unseen segment] 60885 > http [ACK] Seq=1 Ack=4522214 Win=66048 Len=0 TSval=1178726390 TSecr=1509553327
229127  78.751095 41.180.194.108 -> 41.177.26.46 TCP 70 [TCP ACKed unseen segment] 54626 > http [ACK] Seq=1 Ack=4577509 Win=66048 Len=0 TSval=1178726390 TSecr=1509553327
229129  78.751231 41.180.194.108 -> 41.177.26.46 TCP 70 [TCP ACKed unseen segment] 62342 > http [ACK] Seq=1 Ack=4590987 Win=66048 Len=0 TSval=1178726390 TSecr=1509553327
229291  78.811483 41.180.194.108 -> 41.177.26.46 TCP 70 55350 > http [ACK] Seq=886 Ack=5326782 Win=64576 Len=0 TSval=1178726450 TSecr=1509553333
229292  78.811488 41.180.194.108 -> 41.177.26.46 TCP 70 55350 > http [ACK] Seq=886 Ack=5328230 Win=66048 Len=0 TSval=1178726450 TSecr=1509553334
229416  78.874444 41.180.194.108 -> 41.177.26.46 TCP 70 55350 > http [ACK] Seq=886 Ack=5331126 Win=64576 Len=0 TSval=1178726520 TSecr=1509553339
229435  78.894137 41.180.194.108 -> 41.177.26.46 TCP 70 54764 > http [ACK] Seq=879 Ack=4605125 Win=66048 Len=0 TSval=1178726540 TSecr=1509553333
229436  78.894142 41.180.194.108 -> 41.177.26.46 TCP 70 62822 > http [ACK] Seq=884 Ack=4323593 Win=66048 Len=0 TSval=1178726540 TSecr=1509553333
229437  78.894233 41.180.194.108 -> 41.177.26.46 TCP 70 64709 > http [ACK] Seq=881 Ack=4348953 Win=66048 Len=0 TSval=1178726540 TSecr=1509553333
229438  78.894314 41.180.194.108 -> 41.177.26.46 TCP 70 50061 > http [ACK] Seq=887 Ack=4659395 Win=66048 Len=0 TSval=1178726540 TSecr=1509553333
229526  78.944445 41.180.194.108 -> 41.177.26.46 TCP 70 55350 > http [ACK] Seq=886 Ack=5331219 Win=66048 Len=0 TSval=1178726590 TSecr=1509553339
230007  79.300265 41.180.194.108 -> 41.177.26.46 TCP 70 60278 > http [ACK] Seq=869 Ack=4139002 Win=64576 Len=0 TSval=1178726940 TSecr=1509553382
230083  79.394044 41.180.194.108 -> 41.177.26.46 TCP 70 60885 > http [ACK] Seq=878 Ack=4522856 Win=66048 Len=0 TSval=1178727040 TSecr=1509553382
230084  79.394234 41.180.194.108 -> 41.177.26.46 TCP 70 60278 > http [ACK] Seq=869 Ack=4140018 Win=66048 Len=0 TSval=1178727040 TSecr=1509553382
232298  80.311522 41.180.194.108 -> 41.177.26.46 TCP 70 54626 > http [ACK] Seq=884 Ack=4579216 Win=64320 Len=0 TSval=1178727950 TSecr=1509553483
232473  80.394173 41.180.194.108 -> 41.177.26.46 TCP 70 62342 > http [ACK] Seq=884 Ack=4592375 Win=66048 Len=0 TSval=1178728040 TSecr=1509553483
233348  80.715963 41.180.194.108 -> 41.177.26.46 TCP 70 63682 > http [ACK] Seq=1538 Ack=6656 Win=64576 Len=0 TSval=1178728360 TSecr=1509553524
233349  80.715968 41.180.194.108 -> 41.177.26.46 TCP 70 63682 > http [ACK] Seq=1538 Ack=8104 Win=66048 Len=0 TSval=1178728360 TSecr=1509553524
233350  80.716329 41.180.194.108 -> 41.177.26.46 TCP 70 63682 > http [ACK] Seq=1538 Ack=10768 Win=64832 Len=0 TSval=1178728360 TSecr=1509553524
248681  87.641125 41.180.194.108 -> 41.177.26.46 TCP 70 61831 > http [ACK] Seq=880 Ack=925 Win=66048 Len=0 TSval=1178735280 TSecr=1509554217
248682  87.641156 41.180.194.108 -> 41.177.26.46 TCP 70 50223 > http [ACK] Seq=887 Ack=1341 Win=66048 Len=0 TSval=1178735280 TSecr=1509554217
248683  87.641161 41.180.194.108 -> 41.177.26.46 TCP 70 52007 > http [ACK] Seq=879 Ack=1008 Win=66048 Len=0 TSval=1178735280 TSecr=1509554217
248684  87.641387 41.180.194.108 -> 41.177.26.46 TCP 70 54709 > http [ACK] Seq=883 Ack=896 Win=66048 Len=0 TSval=1178735280 TSecr=1509554217
248685  87.641392 41.180.194.108 -> 41.177.26.46 TCP 70 58323 > http [ACK] Seq=883 Ack=1086 Win=66048 Len=0 TSval=1178735280 TSecr=1509554217
248695  87.651161 41.180.194.108 -> 41.177.26.46 TCP 70 63988 > http [ACK] Seq=883 Ack=1486 Win=66048 Len=0 TSval=1178735290 TSecr=1509554218
248696  87.651322 41.180.194.108 -> 41.177.26.46 TCP 70 53588 > http [ACK] Seq=884 Ack=3875 Win=66048 Len=0 TSval=1178735290 TSecr=1509554218
249371  87.984616 41.180.194.108 -> 41.177.26.46 TCP 70 63682 > http [ACK] Seq=2490 Ack=12513 Win=64576 Len=0 TSval=1178735630 TSecr=1509554251
249373  87.984765 41.180.194.108 -> 41.177.26.46 TCP 70 63682 > http [ACK] Seq=2490 Ack=13961 Win=66048 Len=0 TSval=1178735630 TSecr=1509554251
249375  87.984817 41.180.194.108 -> 41.177.26.46 TCP 70 63682 > http [ACK] Seq=2490 Ack=16857 Win=64576 Len=0 TSval=1178735630 TSecr=1509554251
249380  87.985007 41.180.194.108 -> 41.177.26.46 TCP 70 63682 > http [ACK] Seq=2490 Ack=18305 Win=66048 Len=0 TSval=1178735630 TSecr=1509554251
249388  87.985784 41.180.194.108 -> 41.177.26.46 TCP 70 63682 > http [ACK] Seq=2490 Ack=20705 Win=64576 Len=0 TSval=1178735630 TSecr=1509554251
249394  87.986166 41.180.194.108 -> 41.177.26.46 TCP 70 63682 > http [ACK] Seq=2490 Ack=22153 Win=66048 Len=0 TSval=1178735630 TSecr=1509554251
249590  88.044467 41.180.194.108 -> 41.177.26.46 TCP 70 63682 > http [ACK] Seq=2490 Ack=23601 Win=66048 Len=0 TSval=1178735690 TSecr=1509554251
249597  88.046106 41.180.194.108 -> 41.177.26.46 TCP 70 63682 > http [ACK] Seq=2490 Ack=26497 Win=64576 Len=0 TSval=1178735690 TSecr=1509554256
249601  88.046428 41.180.194.108 -> 41.177.26.46 TCP 70 63682 > http [ACK] Seq=2490 Ack=27945 Win=66048 Len=0 TSval=1178735690 TSecr=1509554256
249603  88.046612 41.180.194.108 -> 41.177.26.46 TCP 70 63682 > http [ACK] Seq=2490 Ack=30841 Win=64576 Len=0 TSval=1178735690 TSecr=1509554256
249605  88.046642 41.180.194.108 -> 41.177.26.46 TCP 70 63682 > http [ACK] Seq=2490 Ack=33737 Win=63104 Len=0 TSval=1178735690 TSecr=1509554256
249606  88.046751 41.180.194.108 -> 41.177.26.46 TCP 70 [TCP Window Update] 63682 > http [ACK] Seq=2490 Ack=33737 Win=66048 Len=0 TSval=1178735690 TSecr=1509554256
249614  88.046937 41.180.194.108 -> 41.177.26.46 TCP 70 63682 > http [ACK] Seq=2490 Ack=36633 Win=64576 Len=0 TSval=1178735690 TSecr=1509554256
249618  88.047648 41.180.194.108 -> 41.177.26.46 TCP 70 63682 > http [ACK] Seq=2490 Ack=38081 Win=66048 Len=0 TSval=1178735690 TSecr=1509554257
249621  88.048160 41.180.194.108 -> 41.177.26.46 TCP 70 63682 > http [ACK] Seq=2490 Ack=40977 Win=64576 Len=0 TSval=1178735690 TSecr=1509554257
249622  88.048165 41.180.194.108 -> 41.177.26.46 TCP 70 63682 > http [ACK] Seq=2490 Ack=42425 Win=66048 Len=0 TSval=1178735690 TSecr=1509554257
249746  88.103954 41.180.194.108 -> 41.177.26.46 TCP 70 63682 > http [ACK] Seq=2490 Ack=45321 Win=64576 Len=0 TSval=1178735750 TSecr=1509554257
249747  88.103959 41.180.194.108 -> 41.177.26.46 TCP 70 63682 > http [ACK] Seq=2490 Ack=46769 Win=66048 Len=0 TSval=1178735750 TSecr=1509554262
249756  88.106584 41.180.194.108 -> 41.177.26.46 TCP 70 63682 > http [ACK] Seq=2490 Ack=49665 Win=64576 Len=0 TSval=1178735750 TSecr=1509554263
249757  88.106613 41.180.194.108 -> 41.177.26.46 TCP 70 63682 > http [ACK] Seq=2490 Ack=51113 Win=66048 Len=0 TSval=1178735750 TSecr=1509554263
249763  88.107041 41.180.194.108 -> 41.177.26.46 TCP 70 63682 > http [ACK] Seq=2490 Ack=54009 Win=64576 Len=0 TSval=1178735750 TSecr=1509554263
249766  88.107303 41.180.194.108 -> 41.177.26.46 TCP 70 63682 > http [ACK] Seq=2490 Ack=55457 Win=66048 Len=0 TSval=1178735750 TSecr=1509554263
249768  88.107333 41.180.194.108 -> 41.177.26.46 TCP 70 63682 > http [ACK] Seq=2490 Ack=58353 Win=64576 Len=0 TSval=1178735750 TSecr=1509554263
249774  88.107584 41.180.194.108 -> 41.177.26.46 TCP 70 63682 > http [ACK] Seq=2490 Ack=59801 Win=66048 Len=0 TSval=1178735750 TSecr=1509554263
249775  88.107588 41.180.194.108 -> 41.177.26.46 TCP 70 63682 > http [ACK] Seq=2490 Ack=62697 Win=64576 Len=0 TSval=1178735750 TSecr=1509554263
249806  88.109581 41.180.194.108 -> 41.177.26.46 TCP 70 63682 > http [ACK] Seq=2490 Ack=64145 Win=66048 Len=0 TSval=1178735750 TSecr=1509554263
249809  88.109946 41.180.194.108 -> 41.177.26.46 TCP 70 63682 > http [ACK] Seq=2490 Ack=67041 Win=64576 Len=0 TSval=1178735750 TSecr=1509554263
249813  88.111999 41.180.194.108 -> 41.177.26.46 TCP 70 63682 > http [ACK] Seq=2490 Ack=68489 Win=66048 Len=0 TSval=1178735750 TSecr=1509554263
249819  88.113782 41.180.194.108 -> 41.177.26.46 TCP 70 63682 > http [ACK] Seq=2490 Ack=71385 Win=64576 Len=0 TSval=1178735760 TSecr=1509554263
249823  88.114874 41.180.194.108 -> 41.177.26.46 TCP 70 63682 > http [ACK] Seq=2490 Ack=72833 Win=66048 Len=0 TSval=1178735760 TSecr=1509554263
249824  88.114991 41.180.194.108 -> 41.177.26.46 TCP 70 63682 > http [ACK] Seq=2490 Ack=75729 Win=64576 Len=0 TSval=1178735760 TSecr=1509554263
249825  88.114995 41.180.194.108 -> 41.177.26.46 TCP 70 63682 > http [ACK] Seq=2490 Ack=77177 Win=66048 Len=0 TSval=1178735760 TSecr=1509554263
249969  88.163875 41.180.194.108 -> 41.177.26.46 TCP 70 63682 > http [ACK] Seq=2490 Ack=80073 Win=64576 Len=0 TSval=1178735800 TSecr=1509554268
249970  88.163995 41.180.194.108 -> 41.177.26.46 TCP 70 63682 > http [ACK] Seq=2490 Ack=81521 Win=66048 Len=0 TSval=1178735810 TSecr=1509554268
249971  88.164000 41.180.194.108 -> 41.177.26.46 TCP 70 63682 > http [ACK] Seq=2490 Ack=84417 Win=64576 Len=0 TSval=1178735810 TSecr=1509554268
250002  88.167147 41.180.194.108 -> 41.177.26.46 TCP 70 63682 > http [ACK] Seq=2490 Ack=85865 Win=66048 Len=0 TSval=1178735810 TSecr=1509554269
250005  88.167507 41.180.194.108 -> 41.177.26.46 TCP 70 63682 > http [ACK] Seq=2490 Ack=88761 Win=64576 Len=0 TSval=1178735810 TSecr=1509554269
250009  88.167864 41.180.194.108 -> 41.177.26.46 TCP 70 63682 > http [ACK] Seq=2490 Ack=90209 Win=66048 Len=0 TSval=1178735810 TSecr=1509554269
250010  88.167869 41.180.194.108 -> 41.177.26.46 TCP 70 63682 > http [ACK] Seq=2490 Ack=93105 Win=63104 Len=0 TSval=1178735810 TSecr=1509554269
250011  88.167873 41.180.194.108 -> 41.177.26.46 TCP 70 63682 > http [ACK] Seq=2490 Ack=96001 Win=60224 Len=0 TSval=1178735810 TSecr=1509554269
250015  88.168502 41.180.194.108 -> 41.177.26.46 TCP 70 63682 > http [ACK] Seq=2490 Ack=98897 Win=57344 Len=0 TSval=1178735810 TSecr=1509554269
250017  88.169138 41.180.194.108 -> 41.177.26.46 TCP 70 63682 > http [ACK] Seq=2490 Ack=101793 Win=54464 Len=0 TSval=1178735810 TSecr=1509554269
250018  88.169304 41.180.194.108 -> 41.177.26.46 TCP 70 63682 > http [ACK] Seq=2490 Ack=104689 Win=51520 Len=0 TSval=1178735810 TSecr=1509554269
250019  88.169821 41.180.194.108 -> 41.177.26.46 TCP 70 63682 > http [ACK] Seq=2490 Ack=107585 Win=48640 Len=0 TSval=1178735810 TSecr=1509554269
250021  88.170346 41.180.194.108 -> 41.177.26.46 TCP 70 63682 > http [ACK] Seq=2490 Ack=110481 Win=45760 Len=0 TSval=1178735810 TSecr=1509554269
250023  88.171102 41.180.194.108 -> 41.177.26.46 TCP 70 63682 > http [ACK] Seq=2490 Ack=113377 Win=42880 Len=0 TSval=1178735810 TSecr=1509554269
250025  88.171630 41.180.194.108 -> 41.177.26.46 TCP 70 63682 > http [ACK] Seq=2490 Ack=116273 Win=39936 Len=0 TSval=1178735810 TSecr=1509554269
250026  88.171635 41.180.194.108 -> 41.177.26.46 TCP 70 [TCP Window Update] 63682 > http [ACK] Seq=2490 Ack=116273 Win=48128 Len=0 TSval=1178735810 TSecr=1509554269
250035  88.173286 41.180.194.108 -> 41.177.26.46 TCP 70 63682 > http [ACK] Seq=2490 Ack=119169 Win=45248 Len=0 TSval=1178735810 TSecr=1509554269
250040  88.175858 41.180.194.108 -> 41.177.26.46 TCP 70 63682 > http [ACK] Seq=2490 Ack=122065 Win=42368 Len=0 TSval=1178735820 TSecr=1509554269
250041  88.176020 41.180.194.108 -> 41.177.26.46 TCP 70 63682 > http [ACK] Seq=2490 Ack=124961 Win=39488 Len=0 TSval=1178735820 TSecr=1509554269
250049  88.176529 41.180.194.108 -> 41.177.26.46 TCP 70 63682 > http [ACK] Seq=2490 Ack=127857 Win=36544 Len=0 TSval=1178735820 TSecr=1509554269
250050  88.176759 41.180.194.108 -> 41.177.26.46 TCP 70 63682 > http [ACK] Seq=2490 Ack=130753 Win=33664 Len=0 TSval=1178735820 TSecr=1509554269
250051  88.176923 41.180.194.108 -> 41.177.26.46 TCP 70 63682 > http [ACK] Seq=2490 Ack=133649 Win=30784 Len=0 TSval=1178735820 TSecr=1509554269
250053  88.177668 41.180.194.108 -> 41.177.26.46 TCP 70 63682 > http [ACK] Seq=2490 Ack=135097 Win=37504 Len=0 TSval=1178735820 TSecr=1509554269
250175  88.220340 41.180.194.108 -> 41.177.26.46 TCP 70 63682 > http [ACK] Seq=2490 Ack=137993 Win=34624 Len=0 TSval=1178735860 TSecr=1509554274
250176  88.221267 41.180.194.108 -> 41.177.26.46 TCP 70 63682 > http [ACK] Seq=2490 Ack=140889 Win=31744 Len=0 TSval=1178735860 TSecr=1509554274
250177  88.221612 41.180.194.108 -> 41.177.26.46 TCP 70 63682 > http [ACK] Seq=2490 Ack=143785 Win=28800 Len=0 TSval=1178735860 TSecr=1509554274
250178  88.221987 41.180.194.108 -> 41.177.26.46 TCP 70 63682 > http [ACK] Seq=2490 Ack=146681 Win=25920 Len=0 TSval=1178735860 TSecr=1509554274
250180  88.224039 41.180.194.108 -> 41.177.26.46 TCP 70 63682 > http [ACK] Seq=2490 Ack=149577 Win=23040 Len=0 TSval=1178735870 TSecr=1509554275
250184  88.225373 41.180.194.108 -> 41.177.26.46 TCP 70 63682 > http [ACK] Seq=2490 Ack=152473 Win=20160 Len=0 TSval=1178735870 TSecr=1509554275
250187  88.226047 41.180.194.108 -> 41.177.26.46 TCP 70 63682 > http [ACK] Seq=2490 Ack=155369 Win=17216 Len=0 TSval=1178735870 TSecr=1509554275
250192  88.229840 41.180.194.108 -> 41.177.26.46 TCP 70 63682 > http [ACK] Seq=2490 Ack=158265 Win=14336 Len=0 TSval=1178735870 TSecr=1509554275
250193  88.230016 41.180.194.108 -> 41.177.26.46 TCP 70 63682 > http [ACK] Seq=2490 Ack=161161 Win=11456 Len=0 TSval=1178735870 TSecr=1509554275
