604   0.154083 41.177.244.177 -> 244.3.210.90 TCP 70 49192 > afpovertcp [ACK] Seq=1 Ack=19 Win=65535 Len=0 TSval=763084401 TSecr=376777166
875   0.212919 41.177.244.177 -> 244.3.210.254 TCP 70 56182 > rfb [ACK] Seq=1 Ack=123 Win=59777 Len=0 TSval=763084402 TSecr=2134604014
4067   1.213008 41.177.244.177 -> 244.3.210.254 TCP 70 56182 > rfb [ACK] Seq=1 Ack=257 Win=59710 Len=0 TSval=763084412 TSecr=2134604016
4142   1.223398 41.177.244.177 -> 244.3.210.254 TCP 70 56182 > rfb [ACK] Seq=1 Ack=345 Win=59666 Len=0 TSval=763084412 TSecr=2134604016
6763   2.213396 41.177.244.177 -> 244.3.210.254 TCP 70 56182 > rfb [ACK] Seq=1 Ack=467 Win=59605 Len=0 TSval=763084422 TSecr=2134604018
8972   3.213133 41.177.244.177 -> 244.3.210.254 TCP 70 56182 > rfb [ACK] Seq=1 Ack=590 Win=59544 Len=0 TSval=763084432 TSecr=2134604020
9036   3.272089 41.177.244.177 -> 244.3.210.254 TCP 70 56182 > rfb [ACK] Seq=1 Ack=822 Win=59428 Len=0 TSval=763084433 TSecr=2134604020
9053   3.282080 41.177.244.177 -> 244.3.210.254 TCP 70 56182 > rfb [ACK] Seq=1 Ack=897 Win=59390 Len=0 TSval=763084433 TSecr=2134604020
9184   3.327499 41.177.244.177 -> 244.3.210.254 TCP 70 56182 > rfb [ACK] Seq=1 Ack=997 Win=59340 Len=0 TSval=763084433 TSecr=2134604020
9201   3.330916 41.177.244.177 -> 244.3.210.254 TCP 70 56182 > rfb [ACK] Seq=1 Ack=1273 Win=59202 Len=0 TSval=763084433 TSecr=2134604020
9723   3.436465 41.177.244.177 -> 244.3.210.254 TCP 70 56182 > rfb [ACK] Seq=1 Ack=4009 Win=57834 Len=0 TSval=763084434 TSecr=2134604020
9724   3.436470 41.177.244.177 -> 244.3.210.254 TCP 70 56182 > rfb [ACK] Seq=1 Ack=4613 Win=57532 Len=0 TSval=763084434 TSecr=2134604020
10307   3.555440 41.177.244.177 -> 244.3.210.254 TCP 70 56182 > rfb [ACK] Seq=1 Ack=4931 Win=57373 Len=0 TSval=763084435 TSecr=2134604021
10311   3.557393 41.177.244.177 -> 244.3.210.254 TCP 70 56182 > rfb [ACK] Seq=1 Ack=5123 Win=57277 Len=0 TSval=763084435 TSecr=2134604021
10315   3.558115 41.177.244.177 -> 244.3.210.254 TCP 70 56182 > rfb [ACK] Seq=1 Ack=5579 Win=57049 Len=0 TSval=763084435 TSecr=2134604021
10317   3.559109 41.177.244.177 -> 244.3.210.254 TCP 70 56182 > rfb [ACK] Seq=1 Ack=5654 Win=57012 Len=0 TSval=763084435 TSecr=2134604021
10319   3.559780 41.177.244.177 -> 244.3.210.254 TCP 70 56182 > rfb [ACK] Seq=1 Ack=5819 Win=56929 Len=0 TSval=763084435 TSecr=2134604021
10321   3.560478 41.177.244.177 -> 244.3.210.254 TCP 70 56182 > rfb [ACK] Seq=1 Ack=6069 Win=56804 Len=0 TSval=763084435 TSecr=2134604021
10324   3.561216 41.177.244.177 -> 244.3.210.254 TCP 70 56182 > rfb [ACK] Seq=1 Ack=6412 Win=56633 Len=0 TSval=763084435 TSecr=2134604021
10326   3.561849 41.177.244.177 -> 244.3.210.254 TCP 70 56182 > rfb [ACK] Seq=1 Ack=6500 Win=56589 Len=0 TSval=763084435 TSecr=2134604021
15317   4.213223 41.177.244.177 -> 244.3.210.254 TCP 70 56182 > rfb [ACK] Seq=1 Ack=6622 Win=56528 Len=0 TSval=763084442 TSecr=2134604022
17562   5.213313 41.177.244.177 -> 244.3.210.254 TCP 70 56182 > rfb [ACK] Seq=1 Ack=6744 Win=56467 Len=0 TSval=763084452 TSecr=2134604024
19042   6.213348 41.177.244.177 -> 244.3.210.254 TCP 70 56182 > rfb [ACK] Seq=1 Ack=6875 Win=56401 Len=0 TSval=763084462 TSecr=2134604026
19050   6.223787 41.177.244.177 -> 244.3.210.254 TCP 70 56182 > rfb [ACK] Seq=1 Ack=6956 Win=56361 Len=0 TSval=763084462 TSecr=2134604026
21227   7.213389 41.177.244.177 -> 244.3.210.254 TCP 70 56182 > rfb [ACK] Seq=1 Ack=7078 Win=56300 Len=0 TSval=763084472 TSecr=2134604028
22833   8.213446 41.177.244.177 -> 244.3.210.254 TCP 70 56182 > rfb [ACK] Seq=1 Ack=7201 Win=56238 Len=0 TSval=763084482 TSecr=2134604030
23114   8.371826 41.177.244.177 -> 244.3.210.254 TCP 70 56182 > rfb [ACK] Seq=1 Ack=7440 Win=56119 Len=0 TSval=763084483 TSecr=2134604030
23143   8.381668 41.177.244.177 -> 244.3.210.254 TCP 70 56182 > rfb [ACK] Seq=1 Ack=7591 Win=56043 Len=0 TSval=763084484 TSecr=2134604030
23373   8.493155 41.177.244.177 -> 244.3.210.254 TCP 70 56182 > rfb [ACK] Seq=1 Ack=7908 Win=55885 Len=0 TSval=763084485 TSecr=2134604030
23446   8.503626 41.177.244.177 -> 244.3.210.254 TCP 70 56182 > rfb [ACK] Seq=1 Ack=8561 Win=55558 Len=0 TSval=763084485 TSecr=2134604030
24411   9.213522 41.177.244.177 -> 244.3.210.254 TCP 70 56182 > rfb [ACK] Seq=1 Ack=8683 Win=55497 Len=0 TSval=763084492 TSecr=2134604032
24665   9.379236 41.177.244.177 -> 244.3.210.254 TCP 82 54781 > 19813 [PSH, ACK] Seq=1 Ack=1 Win=65535 Len=12 TSval=763084494 TSecr=2134603952
26051  10.154646 41.177.244.177 -> 244.3.210.90 TCP 70 49192 > afpovertcp [ACK] Seq=33 Ack=37 Win=65535 Len=0 TSval=763084501 TSecr=376777266
26135  10.213557 41.177.244.177 -> 244.3.210.254 TCP 70 56182 > rfb [ACK] Seq=1 Ack=8805 Win=55436 Len=0 TSval=763084502 TSecr=2134604034
28010  11.213641 41.177.244.177 -> 244.3.210.254 TCP 70 56182 > rfb [ACK] Seq=1 Ack=8927 Win=55375 Len=0 TSval=763084512 TSecr=2134604036
29678  12.213686 41.177.244.177 -> 244.3.210.254 TCP 70 56182 > rfb [ACK] Seq=1 Ack=9049 Win=55314 Len=0 TSval=763084522 TSecr=2134604038
31265  13.213884 41.177.244.177 -> 244.3.210.254 TCP 70 56182 > rfb [ACK] Seq=1 Ack=9172 Win=55253 Len=0 TSval=763084532 TSecr=2134604040
31856  13.443448 41.177.244.177 -> 244.3.210.254 TCP 70 56182 > rfb [ACK] Seq=1 Ack=9272 Win=55203 Len=0 TSval=763084534 TSecr=2134604040
31865  13.446885 41.177.244.177 -> 244.3.210.254 TCP 70 56182 > rfb [ACK] Seq=1 Ack=9550 Win=55064 Len=0 TSval=763084534 TSecr=2134604040
32037  13.556270 41.177.244.177 -> 244.3.210.254 TCP 70 56182 > rfb [ACK] Seq=1 Ack=12286 Win=53696 Len=0 TSval=763084535 TSecr=2134604041
32038  13.556324 41.177.244.177 -> 244.3.210.254 TCP 70 56182 > rfb [ACK] Seq=1 Ack=12870 Win=53404 Len=0 TSval=763084535 TSecr=2134604041
32175  13.652158 41.177.244.177 -> 244.3.210.254 TCP 70 56182 > rfb [ACK] Seq=1 Ack=13443 Win=53117 Len=0 TSval=763084536 TSecr=2134604041
32187  13.654985 41.177.244.177 -> 244.3.210.254 TCP 70 56182 > rfb [ACK] Seq=1 Ack=13520 Win=53079 Len=0 TSval=763084536 TSecr=2134604041
32189  13.655757 41.177.244.177 -> 244.3.210.254 TCP 70 56182 > rfb [ACK] Seq=1 Ack=14250 Win=52714 Len=0 TSval=763084536 TSecr=2134604041
32193  13.656561 41.177.244.177 -> 244.3.210.254 TCP 70 56182 > rfb [ACK] Seq=1 Ack=15015 Win=52331 Len=0 TSval=763084536 TSecr=2134604041
32195  13.657210 41.177.244.177 -> 244.3.210.254 TCP 70 56182 > rfb [ACK] Seq=1 Ack=15170 Win=52254 Len=0 TSval=763084536 TSecr=2134604041
32203  13.657916 41.177.244.177 -> 244.3.210.254 TCP 70 56182 > rfb [ACK] Seq=1 Ack=15419 Win=52129 Len=0 TSval=763084536 TSecr=2134604041
32215  13.658797 41.177.244.177 -> 244.3.210.254 TCP 70 56182 > rfb [ACK] Seq=1 Ack=15737 Win=51970 Len=0 TSval=763084536 TSecr=2134604041
32219  13.659444 41.177.244.177 -> 244.3.210.254 TCP 70 56182 > rfb [ACK] Seq=1 Ack=15821 Win=51928 Len=0 TSval=763084536 TSecr=2134604041
32226  13.660089 41.177.244.177 -> 244.3.210.254 TCP 70 56182 > rfb [ACK] Seq=1 Ack=15970 Win=51854 Len=0 TSval=763084536 TSecr=2134604041
33526  14.213854 41.177.244.177 -> 244.3.210.254 TCP 70 56182 > rfb [ACK] Seq=1 Ack=16102 Win=51788 Len=0 TSval=763084542 TSecr=2134604042
33532  14.215128 41.177.244.177 -> 244.3.210.254 TCP 70 56182 > rfb [ACK] Seq=1 Ack=16183 Win=51747 Len=0 TSval=763084542 TSecr=2134604042
36480  15.213931 41.177.244.177 -> 244.3.210.254 TCP 70 56182 > rfb [ACK] Seq=1 Ack=16306 Win=51686 Len=0 TSval=763084552 TSecr=2134604044
39192  16.214025 41.177.244.177 -> 244.3.210.254 TCP 70 56182 > rfb [ACK] Seq=1 Ack=16429 Win=51624 Len=0 TSval=763084562 TSecr=2134604046
41202  17.214048 41.177.244.177 -> 244.3.210.254 TCP 70 56182 > rfb [ACK] Seq=1 Ack=16552 Win=51563 Len=0 TSval=763084572 TSecr=2134604048
42983  18.214127 41.177.244.177 -> 244.3.210.254 TCP 70 56182 > rfb [ACK] Seq=1 Ack=16675 Win=51501 Len=0 TSval=763084582 TSecr=2134604050
43632  18.492493 41.177.244.177 -> 244.3.210.254 TCP 70 56182 > rfb [ACK] Seq=1 Ack=16991 Win=51343 Len=0 TSval=763084585 TSecr=2134604050
43657  18.494227 41.177.244.177 -> 244.3.210.254 TCP 70 56182 > rfb [ACK] Seq=1 Ack=17182 Win=51248 Len=0 TSval=763084585 TSecr=2134604050
43668  18.494950 41.177.244.177 -> 244.3.210.254 TCP 70 56182 > rfb [ACK] Seq=1 Ack=17586 Win=51046 Len=0 TSval=763084585 TSecr=2134604050
43851  18.570760 41.177.244.177 -> 244.3.210.254 TCP 70 56182 > rfb [ACK] Seq=1 Ack=17825 Win=50926 Len=0 TSval=763084585 TSecr=2134604051
43860  18.572423 41.177.244.177 -> 244.3.210.254 TCP 70 56182 > rfb [ACK] Seq=1 Ack=17898 Win=50890 Len=0 TSval=763084585 TSecr=2134604051
43862  18.573074 41.177.244.177 -> 244.3.210.254 TCP 70 56182 > rfb [ACK] Seq=1 Ack=17974 Win=50852 Len=0 TSval=763084585 TSecr=2134604051
45895  19.214284 41.177.244.177 -> 244.3.210.254 TCP 70 56182 > rfb [ACK] Seq=1 Ack=18097 Win=50790 Len=0 TSval=763084592 TSecr=2134604052
49643  20.155251 41.177.244.177 -> 244.3.210.90 TCP 70 49192 > afpovertcp [ACK] Seq=49 Ack=55 Win=65535 Len=0 TSval=763084601 TSecr=376777366
49783  20.214222 41.177.244.177 -> 244.3.210.254 TCP 70 56182 > rfb [ACK] Seq=1 Ack=18220 Win=50729 Len=0 TSval=763084602 TSecr=2134604054
51607  21.214309 41.177.244.177 -> 244.3.210.254 TCP 70 56182 > rfb [ACK] Seq=1 Ack=18343 Win=50667 Len=0 TSval=763084612 TSecr=2134604056
53594  22.214341 41.177.244.177 -> 244.3.210.254 TCP 70 56182 > rfb [ACK] Seq=1 Ack=18466 Win=50606 Len=0 TSval=763084622 TSecr=2134604058
56566  23.215649 41.177.244.177 -> 244.3.210.254 TCP 70 56182 > rfb [ACK] Seq=1 Ack=18589 Win=50544 Len=0 TSval=763084632 TSecr=2134604060
57470  23.493903 41.177.244.177 -> 244.3.210.254 TCP 70 56182 > rfb [ACK] Seq=1 Ack=18689 Win=50494 Len=0 TSval=763084635 TSecr=2134604060
57526  23.496525 41.177.244.177 -> 244.3.210.254 TCP 70 56182 > rfb [ACK] Seq=1 Ack=18996 Win=50341 Len=0 TSval=763084635 TSecr=2134604060
57580  23.500537 41.177.244.177 -> 244.3.210.254 TCP 70 56182 > rfb [ACK] Seq=1 Ack=19272 Win=50203 Len=0 TSval=763084635 TSecr=2134604060
58062  23.606850 41.177.244.177 -> 244.3.210.254 TCP 70 56182 > rfb [ACK] Seq=1 Ack=22008 Win=48835 Len=0 TSval=763084636 TSecr=2134604061
58064  23.606919 41.177.244.177 -> 244.3.210.254 TCP 70 56182 > rfb [ACK] Seq=1 Ack=22635 Win=48521 Len=0 TSval=763084636 TSecr=2134604061
58635  23.710459 41.177.244.177 -> 244.3.210.254 TCP 70 56182 > rfb [ACK] Seq=1 Ack=24271 Win=47703 Len=0 TSval=763084637 TSecr=2134604061
58642  23.712015 41.177.244.177 -> 244.3.210.254 TCP 70 56182 > rfb [ACK] Seq=1 Ack=24510 Win=47584 Len=0 TSval=763084637 TSecr=2134604061
58685  23.722359 41.177.244.177 -> 244.3.210.254 TCP 70 56182 > rfb [ACK] Seq=1 Ack=24661 Win=47508 Len=0 TSval=763084637 TSecr=2134604061
60027  24.214491 41.177.244.177 -> 244.3.210.254 TCP 70 56182 > rfb [ACK] Seq=1 Ack=24784 Win=47447 Len=0 TSval=763084642 TSecr=2134604062
61637  25.214517 41.177.244.177 -> 244.3.210.254 TCP 70 56182 > rfb [ACK] Seq=1 Ack=24907 Win=47385 Len=0 TSval=763084652 TSecr=2134604064
63439  26.214521 41.177.244.177 -> 244.3.210.254 TCP 70 56182 > rfb [ACK] Seq=1 Ack=25029 Win=47324 Len=0 TSval=763084662 TSecr=2134604066
66019  27.214625 41.177.244.177 -> 244.3.210.254 TCP 70 56182 > rfb [ACK] Seq=1 Ack=25151 Win=47263 Len=0 TSval=763084672 TSecr=2134604068
68444  28.214689 41.177.244.177 -> 244.3.210.254 TCP 70 56182 > rfb [ACK] Seq=1 Ack=25274 Win=47202 Len=0 TSval=763084682 TSecr=2134604070
68869  28.491854 41.177.244.177 -> 244.3.210.254 TCP 70 56182 > rfb [ACK] Seq=1 Ack=25587 Win=47045 Len=0 TSval=763084685 TSecr=2134604070
68914  28.502091 41.177.244.177 -> 244.3.210.254 TCP 70 56182 > rfb [ACK] Seq=1 Ack=26270 Win=46704 Len=0 TSval=763084685 TSecr=2134604070
69320  28.770323 41.177.244.177 -> 244.3.210.254 TCP 70 56182 > rfb [ACK] Seq=1 Ack=26509 Win=46584 Len=0 TSval=763084687 TSecr=2134604071
69377  28.780225 41.177.244.177 -> 244.3.210.254 TCP 70 56182 > rfb [ACK] Seq=1 Ack=26661 Win=46508 Len=0 TSval=763084687 TSecr=2134604071
70573  29.214737 41.177.244.177 -> 244.3.210.254 TCP 70 56182 > rfb [ACK] Seq=1 Ack=26784 Win=46447 Len=0 TSval=763084692 TSecr=2134604072
74207  30.155819 41.177.244.177 -> 244.3.210.90 TCP 70 49192 > afpovertcp [ACK] Seq=65 Ack=73 Win=65535 Len=0 TSval=763084701 TSecr=376777465
74366  30.214834 41.177.244.177 -> 244.3.210.254 TCP 70 56182 > rfb [ACK] Seq=1 Ack=26907 Win=46385 Len=0 TSval=763084702 TSecr=2134604074
78641  31.214887 41.177.244.177 -> 244.3.210.254 TCP 70 56182 > rfb [ACK] Seq=1 Ack=27030 Win=46324 Len=0 TSval=763084712 TSecr=2134604076
82715  32.214883 41.177.244.177 -> 244.3.210.254 TCP 70 56182 > rfb [ACK] Seq=1 Ack=27153 Win=46262 Len=0 TSval=763084722 TSecr=2134604078
85454  33.215071 41.177.244.177 -> 244.3.210.254 TCP 70 56182 > rfb [ACK] Seq=1 Ack=27276 Win=46201 Len=0 TSval=763084732 TSecr=2134604080
86279  33.524731 41.177.244.177 -> 244.3.210.254 TCP 70 56182 > rfb [ACK] Seq=1 Ack=27589 Win=46044 Len=0 TSval=763084735 TSecr=2134604080
86311  33.535191 41.177.244.177 -> 244.3.210.254 TCP 70 56182 > rfb [ACK] Seq=1 Ack=28250 Win=45714 Len=0 TSval=763084735 TSecr=2134604080
86422  33.570337 41.177.244.177 -> 244.3.210.254 TCP 70 56182 > rfb [ACK] Seq=1 Ack=28350 Win=45664 Len=0 TSval=763084735 TSecr=2134604081
86426  33.573762 41.177.244.177 -> 244.3.210.254 TCP 70 56182 > rfb [ACK] Seq=1 Ack=28628 Win=45525 Len=0 TSval=763084735 TSecr=2134604081
87026  33.690067 41.177.244.177 -> 244.3.210.254 TCP 70 56182 > rfb [ACK] Seq=1 Ack=31364 Win=44157 Len=0 TSval=763084737 TSecr=2134604081
87027  33.690116 41.177.244.177 -> 244.3.210.254 TCP 70 56182 > rfb [ACK] Seq=1 Ack=31964 Win=43857 Len=0 TSval=763084737 TSecr=2134604081
87340  33.801429 41.177.244.177 -> 244.3.210.254 TCP 70 56182 > rfb [ACK] Seq=1 Ack=32035 Win=43821 Len=0 TSval=763084738 TSecr=2134604081
87342  33.802099 41.177.244.177 -> 244.3.210.254 TCP 70 56182 > rfb [ACK] Seq=1 Ack=32279 Win=43699 Len=0 TSval=763084738 TSecr=2134604081
87345  33.802758 41.177.244.177 -> 244.3.210.254 TCP 70 56182 > rfb [ACK] Seq=1 Ack=32524 Win=43577 Len=0 TSval=763084738 TSecr=2134604081
87351  33.803437 41.177.244.177 -> 244.3.210.254 TCP 70 56182 > rfb [ACK] Seq=1 Ack=32770 Win=43454 Len=0 TSval=763084738 TSecr=2134604081
87353  33.804094 41.177.244.177 -> 244.3.210.254 TCP 70 56182 > rfb [ACK] Seq=1 Ack=32852 Win=43413 Len=0 TSval=763084738 TSecr=2134604081
87355  33.804752 41.177.244.177 -> 244.3.210.254 TCP 70 56182 > rfb [ACK] Seq=1 Ack=32920 Win=43379 Len=0 TSval=763084738 TSecr=2134604081
87531  33.869879 41.177.244.177 -> 244.3.210.254 TCP 70 56182 > rfb [ACK] Seq=1 Ack=33159 Win=43259 Len=0 TSval=763084738 TSecr=2134604081
87542  33.871583 41.177.244.177 -> 244.3.210.254 TCP 70 56182 > rfb [ACK] Seq=1 Ack=33233 Win=43222 Len=0 TSval=763084738 TSecr=2134604081
87547  33.872218 41.177.244.177 -> 244.3.210.254 TCP 70 56182 > rfb [ACK] Seq=1 Ack=33311 Win=43183 Len=0 TSval=763084738 TSecr=2134604081
88509  34.214940 41.177.244.177 -> 244.3.210.254 TCP 70 56182 > rfb [ACK] Seq=1 Ack=33434 Win=43122 Len=0 TSval=763084742 TSecr=2134604082
91852  35.215180 41.177.244.177 -> 244.3.210.254 TCP 70 56182 > rfb [ACK] Seq=1 Ack=33556 Win=43061 Len=0 TSval=763084752 TSecr=2134604084
96381  36.215200 41.177.244.177 -> 244.3.210.254 TCP 70 56182 > rfb [ACK] Seq=1 Ack=33679 Win=42999 Len=0 TSval=763084762 TSecr=2134604086
101030  37.215443 41.177.244.177 -> 244.3.210.254 TCP 70 56182 > rfb [ACK] Seq=1 Ack=33802 Win=42938 Len=0 TSval=763084772 TSecr=2134604088
105960  38.215309 41.177.244.177 -> 244.3.210.254 TCP 70 56182 > rfb [ACK] Seq=1 Ack=33925 Win=42876 Len=0 TSval=763084782 TSecr=2134604090
106836  38.491394 41.177.244.177 -> 244.3.210.254 TCP 70 56182 > rfb [ACK] Seq=1 Ack=34226 Win=42726 Len=0 TSval=763084785 TSecr=2134604090
106878  38.501784 41.177.244.177 -> 244.3.210.254 TCP 70 56182 > rfb [ACK] Seq=1 Ack=34780 Win=42449 Len=0 TSval=763084785 TSecr=2134604090
108315  38.969714 41.177.244.177 -> 244.3.210.254 TCP 70 56182 > rfb [ACK] Seq=1 Ack=35008 Win=42335 Len=0 TSval=763084789 TSecr=2134604091
109225  39.215427 41.177.244.177 -> 244.3.210.254 TCP 70 56182 > rfb [ACK] Seq=1 Ack=35131 Win=42273 Len=0 TSval=763084792 TSecr=2134604092
110998  39.689214 41.177.244.177 -> 244.3.210.254 TCP 70 63123 > 19813 [ACK] Seq=1 Ack=13 Win=65535 Len=0 TSval=763084796 TSecr=2134604093
112706  40.156265 41.177.244.177 -> 244.3.210.90 TCP 70 49192 > afpovertcp [ACK] Seq=97 Ack=91 Win=65535 Len=0 TSval=763084801 TSecr=376777565
112999  40.215534 41.177.244.177 -> 244.3.210.254 TCP 70 56182 > rfb [ACK] Seq=1 Ack=35254 Win=42212 Len=0 TSval=763084802 TSecr=2134604094
115544  41.215717 41.177.244.177 -> 244.3.210.254 TCP 70 56182 > rfb [ACK] Seq=1 Ack=35377 Win=42150 Len=0 TSval=763084812 TSecr=2134604096
117719  42.215504 41.177.244.177 -> 244.3.210.254 TCP 70 56182 > rfb [ACK] Seq=1 Ack=35514 Win=42082 Len=0 TSval=763084822 TSecr=2134604098
117744  42.225994 41.177.244.177 -> 244.3.210.254 TCP 70 56182 > rfb [ACK] Seq=1 Ack=35597 Win=42040 Len=0 TSval=763084822 TSecr=2134604098
121199  43.215704 41.177.244.177 -> 244.3.210.254 TCP 70 56182 > rfb [ACK] Seq=1 Ack=35720 Win=41979 Len=0 TSval=763084832 TSecr=2134604100
122227  43.517519 41.177.244.177 -> 244.3.210.254 TCP 70 56182 > rfb [ACK] Seq=1 Ack=36027 Win=41825 Len=0 TSval=763084835 TSecr=2134604100
122266  43.527749 41.177.244.177 -> 244.3.210.254 TCP 70 56182 > rfb [ACK] Seq=1 Ack=36601 Win=41538 Len=0 TSval=763084835 TSecr=2134604100
122868  43.724673 41.177.244.177 -> 244.3.210.254 TCP 70 56182 > rfb [ACK] Seq=1 Ack=36701 Win=41488 Len=0 TSval=763084837 TSecr=2134604101
122882  43.728049 41.177.244.177 -> 244.3.210.254 TCP 70 56182 > rfb [ACK] Seq=1 Ack=36977 Win=41350 Len=0 TSval=763084837 TSecr=2134604101
123262  43.834290 41.177.244.177 -> 244.3.210.254 TCP 70 56182 > rfb [ACK] Seq=1 Ack=39713 Win=39982 Len=0 TSval=763084838 TSecr=2134604101
123263  43.834364 41.177.244.177 -> 244.3.210.254 TCP 70 56182 > rfb [ACK] Seq=1 Ack=40324 Win=39677 Len=0 TSval=763084838 TSecr=2134604101
123510  43.929543 41.177.244.177 -> 244.3.210.254 TCP 70 56182 > rfb [ACK] Seq=1 Ack=40399 Win=39639 Len=0 TSval=763084839 TSecr=2134604101
123512  43.930212 41.177.244.177 -> 244.3.210.254 TCP 70 56182 > rfb [ACK] Seq=1 Ack=40564 Win=39557 Len=0 TSval=763084839 TSecr=2134604101
123515  43.930873 41.177.244.177 -> 244.3.210.254 TCP 70 56182 > rfb [ACK] Seq=1 Ack=40814 Win=39432 Len=0 TSval=763084839 TSecr=2134604101
123517  43.931537 41.177.244.177 -> 244.3.210.254 TCP 70 56182 > rfb [ACK] Seq=1 Ack=41058 Win=39310 Len=0 TSval=763084839 TSecr=2134604101
123521  43.932163 41.177.244.177 -> 244.3.210.254 TCP 70 56182 > rfb [ACK] Seq=1 Ack=41166 Win=39256 Len=0 TSval=763084839 TSecr=2134604101
123693  44.069011 41.177.244.177 -> 244.3.210.254 TCP 70 56182 > rfb [ACK] Seq=1 Ack=41408 Win=39135 Len=0 TSval=763084840 TSecr=2134604102
123699  44.070906 41.177.244.177 -> 244.3.210.254 TCP 70 56182 > rfb [ACK] Seq=1 Ack=41486 Win=39096 Len=0 TSval=763084840 TSecr=2134604102
123701  44.071546 41.177.244.177 -> 244.3.210.254 TCP 70 56182 > rfb [ACK] Seq=1 Ack=41574 Win=39052 Len=0 TSval=763084840 TSecr=2134604102
123989  44.215600 41.177.244.177 -> 244.3.210.254 TCP 70 56182 > rfb [ACK] Seq=1 Ack=41697 Win=38990 Len=0 TSval=763084842 TSecr=2134604102
129010  45.215749 41.177.244.177 -> 244.3.210.254 TCP 70 56182 > rfb [ACK] Seq=1 Ack=41820 Win=38929 Len=0 TSval=763084852 TSecr=2134604104
132639  46.215928 41.177.244.177 -> 244.3.210.254 TCP 70 56182 > rfb [ACK] Seq=1 Ack=41962 Win=65535 Len=0 TSval=763084862 TSecr=2134604106
132640  46.215955 41.177.244.177 -> 244.3.210.254 TCP 70 [TCP Dup ACK 132639#1] 56182 > rfb [ACK] Seq=1 Ack=41962 Win=65535 Len=0 TSval=763084862 TSecr=2134604106
132670  46.226210 41.177.244.177 -> 244.3.210.254 TCP 70 56182 > rfb [ACK] Seq=1 Ack=42059 Win=65535 Len=0 TSval=763084862 TSecr=2134604106
135711  47.215859 41.177.244.177 -> 244.3.210.254 TCP 70 56182 > rfb [ACK] Seq=1 Ack=42182 Win=65535 Len=0 TSval=763084872 TSecr=2134604108
139387  48.216021 41.177.244.177 -> 244.3.210.254 TCP 70 56182 > rfb [ACK] Seq=1 Ack=42305 Win=65535 Len=0 TSval=763084882 TSecr=2134604110
140603  48.490476 41.177.244.177 -> 244.3.210.254 TCP 70 56182 > rfb [ACK] Seq=1 Ack=42614 Win=65535 Len=0 TSval=763084884 TSecr=2134604110
140665  48.500777 41.177.244.177 -> 244.3.210.254 TCP 70 56182 > rfb [ACK] Seq=1 Ack=43188 Win=65535 Len=0 TSval=763084885 TSecr=2134604110
143116  49.168864 41.177.244.177 -> 244.3.210.254 TCP 70 56182 > rfb [ACK] Seq=1 Ack=43423 Win=65535 Len=0 TSval=763084891 TSecr=2134604112
143122  49.178787 41.177.244.177 -> 244.3.210.254 TCP 70 56182 > rfb [ACK] Seq=1 Ack=43501 Win=65535 Len=0 TSval=763084891 TSecr=2134604112
143205  49.215971 41.177.244.177 -> 244.3.210.254 TCP 70 56182 > rfb [ACK] Seq=1 Ack=43624 Win=65535 Len=0 TSval=763084892 TSecr=2134604112
143748  49.388394 41.177.244.177 -> 244.3.210.254 TCP 70 54781 > 19813 [ACK] Seq=13 Ack=13 Win=65535 Len=0 TSval=763084893 TSecr=2134604112
146242  50.156828 41.177.244.177 -> 244.3.210.90 TCP 70 49192 > afpovertcp [ACK] Seq=113 Ack=109 Win=65535 Len=0 TSval=763084901 TSecr=376777665
146444  50.216095 41.177.244.177 -> 244.3.210.254 TCP 70 56182 > rfb [ACK] Seq=1 Ack=43747 Win=65535 Len=0 TSval=763084902 TSecr=2134604114
149074  51.216378 41.177.244.177 -> 244.3.210.254 TCP 70 56182 > rfb [ACK] Seq=1 Ack=43870 Win=65535 Len=0 TSval=763084912 TSecr=2134604116
152464  52.216212 41.177.244.177 -> 244.3.210.254 TCP 70 56182 > rfb [ACK] Seq=1 Ack=43993 Win=65535 Len=0 TSval=763084922 TSecr=2134604118
156057  53.216287 41.177.244.177 -> 244.3.210.254 TCP 70 56182 > rfb [ACK] Seq=1 Ack=44116 Win=65535 Len=0 TSval=763084932 TSecr=2134604120
157013  53.490134 41.177.244.177 -> 244.3.210.254 TCP 70 56182 > rfb [ACK] Seq=1 Ack=44439 Win=65535 Len=0 TSval=763084934 TSecr=2134604120
157048  53.500709 41.177.244.177 -> 244.3.210.254 TCP 70 56182 > rfb [ACK] Seq=1 Ack=45007 Win=65535 Len=0 TSval=763084935 TSecr=2134604120
157844  53.774035 41.177.244.177 -> 244.3.210.254 TCP 70 56182 > rfb [ACK] Seq=1 Ack=45107 Win=65535 Len=0 TSval=763084937 TSecr=2134604121
157853  53.777435 41.177.244.177 -> 244.3.210.254 TCP 70 56182 > rfb [ACK] Seq=1 Ack=45385 Win=65535 Len=0 TSval=763084937 TSecr=2134604121
158166  53.883125 41.177.244.177 -> 244.3.210.254 TCP 70 56182 > rfb [ACK] Seq=1 Ack=48121 Win=65535 Len=0 TSval=763084938 TSecr=2134604121
158167  53.883172 41.177.244.177 -> 244.3.210.254 TCP 70 56182 > rfb [ACK] Seq=1 Ack=48727 Win=65535 Len=0 TSval=763084938 TSecr=2134604121
158567  54.024012 41.177.244.177 -> 244.3.210.254 TCP 70 56182 > rfb [ACK] Seq=1 Ack=48798 Win=65535 Len=0 TSval=763084940 TSecr=2134604121
158569  54.024675 41.177.244.177 -> 244.3.210.254 TCP 70 56182 > rfb [ACK] Seq=1 Ack=49042 Win=65535 Len=0 TSval=763084940 TSecr=2134604121
158571  54.025351 41.177.244.177 -> 244.3.210.254 TCP 70 56182 > rfb [ACK] Seq=1 Ack=49306 Win=65535 Len=0 TSval=763084940 TSecr=2134604121
158574  54.026016 41.177.244.177 -> 244.3.210.254 TCP 70 56182 > rfb [ACK] Seq=1 Ack=49552 Win=65535 Len=0 TSval=763084940 TSecr=2134604121
158577  54.026642 41.177.244.177 -> 244.3.210.254 TCP 70 56182 > rfb [ACK] Seq=1 Ack=49634 Win=65535 Len=0 TSval=763084940 TSecr=2134604121
158583  54.027291 41.177.244.177 -> 244.3.210.254 TCP 70 56182 > rfb [ACK] Seq=1 Ack=49778 Win=65535 Len=0 TSval=763084940 TSecr=2134604121
159258  54.216556 41.177.244.177 -> 244.3.210.254 TCP 70 56182 > rfb [ACK] Seq=1 Ack=49901 Win=65535 Len=0 TSval=763084942 TSecr=2134604122
159434  54.268540 41.177.244.177 -> 244.3.210.254 TCP 70 56182 > rfb [ACK] Seq=1 Ack=50140 Win=65535 Len=0 TSval=763084942 TSecr=2134604122
159437  54.270273 41.177.244.177 -> 244.3.210.254 TCP 70 56182 > rfb [ACK] Seq=1 Ack=50213 Win=65535 Len=0 TSval=763084942 TSecr=2134604122
159443  54.270929 41.177.244.177 -> 244.3.210.254 TCP 70 56182 > rfb [ACK] Seq=1 Ack=50291 Win=65535 Len=0 TSval=763084942 TSecr=2134604122
162302  55.216543 41.177.244.177 -> 244.3.210.254 TCP 70 56182 > rfb [ACK] Seq=1 Ack=50414 Win=65535 Len=0 TSval=763084952 TSecr=2134604124
167873  56.216758 41.177.244.177 -> 244.3.210.254 TCP 70 56182 > rfb [ACK] Seq=1 Ack=50557 Win=65535 Len=0 TSval=763084962 TSecr=2134604126
167987  56.227239 41.177.244.177 -> 244.3.210.254 TCP 70 56182 > rfb [ACK] Seq=1 Ack=50717 Win=65535 Len=0 TSval=763084962 TSecr=2134604126
171867  57.216750 41.177.244.177 -> 244.3.210.254 TCP 70 56182 > rfb [ACK] Seq=1 Ack=50839 Win=65535 Len=0 TSval=763084972 TSecr=2134604128
175091  58.216661 41.177.244.177 -> 244.3.210.254 TCP 70 56182 > rfb [ACK] Seq=1 Ack=50961 Win=65535 Len=0 TSval=763084982 TSecr=2134604130
175848  58.489793 41.177.244.177 -> 244.3.210.254 TCP 70 56182 > rfb [ACK] Seq=1 Ack=51274 Win=65535 Len=0 TSval=763084984 TSecr=2134604130
175896  58.500160 41.177.244.177 -> 244.3.210.254 TCP 70 56182 > rfb [ACK] Seq=1 Ack=51900 Win=65535 Len=0 TSval=763084985 TSecr=2134604130
176853  59.216815 41.177.244.177 -> 244.3.210.254 TCP 70 56182 > rfb [ACK] Seq=1 Ack=52023 Win=65535 Len=0 TSval=763084992 TSecr=2134604132
177139  59.375131 41.177.244.177 -> 244.3.210.254 TCP 70 56182 > rfb [ACK] Seq=1 Ack=52255 Win=65535 Len=0 TSval=763084993 TSecr=2134604132
177147  59.381316 41.177.244.177 -> 244.3.210.254 TCP 70 56182 > rfb [ACK] Seq=1 Ack=52328 Win=65535 Len=0 TSval=763084993 TSecr=2134604132
178999  60.157389 41.177.244.177 -> 244.3.210.90 TCP 70 49192 > afpovertcp [ACK] Seq=129 Ack=127 Win=65535 Len=0 TSval=763085001 TSecr=376777765
179116  60.216899 41.177.244.177 -> 244.3.210.254 TCP 70 56182 > rfb [ACK] Seq=1 Ack=52450 Win=65535 Len=0 TSval=763085002 TSecr=2134604134
182100  61.216921 41.177.244.177 -> 244.3.210.254 TCP 70 56182 > rfb [ACK] Seq=1 Ack=52584 Win=65535 Len=0 TSval=763085012 TSecr=2134604136
182139  61.227203 41.177.244.177 -> 244.3.210.254 TCP 70 56182 > rfb [ACK] Seq=1 Ack=52672 Win=65535 Len=0 TSval=763085012 TSecr=2134604136
185739  62.216841 41.177.244.177 -> 244.3.210.254 TCP 70 56182 > rfb [ACK] Seq=1 Ack=52794 Win=65535 Len=0 TSval=763085022 TSecr=2134604138
187216  63.217192 41.177.244.177 -> 244.3.210.254 TCP 70 56182 > rfb [ACK] Seq=1 Ack=52917 Win=65535 Len=0 TSval=763085032 TSecr=2134604140
187655  63.489371 41.177.244.177 -> 244.3.210.254 TCP 70 56182 > rfb [ACK] Seq=1 Ack=53233 Win=65535 Len=0 TSval=763085034 TSecr=2134604140
187698  63.499841 41.177.244.177 -> 244.3.210.254 TCP 70 56182 > rfb [ACK] Seq=1 Ack=53864 Win=65535 Len=0 TSval=763085034 TSecr=2134604140
188145  63.889989 41.177.244.177 -> 244.3.210.254 TCP 70 56182 > rfb [ACK] Seq=1 Ack=53964 Win=65535 Len=0 TSval=763085038 TSecr=2134604141
188154  63.893391 41.177.244.177 -> 244.3.210.254 TCP 70 56182 > rfb [ACK] Seq=1 Ack=54240 Win=65535 Len=0 TSval=763085038 TSecr=2134604141
188333  64.022137 41.177.244.177 -> 244.3.210.254 TCP 70 56182 > rfb [ACK] Seq=1 Ack=56976 Win=65535 Len=0 TSval=763085040 TSecr=2134604141
188334  64.022186 41.177.244.177 -> 244.3.210.254 TCP 70 56182 > rfb [ACK] Seq=1 Ack=57607 Win=65535 Len=0 TSval=763085040 TSecr=2134604141
188579  64.123200 41.177.244.177 -> 244.3.210.254 TCP 70 56182 > rfb [ACK] Seq=1 Ack=57682 Win=65535 Len=0 TSval=763085041 TSecr=2134604142
188581  64.123891 41.177.244.177 -> 244.3.210.254 TCP 70 56182 > rfb [ACK] Seq=1 Ack=57847 Win=65535 Len=0 TSval=763085041 TSecr=2134604142
188583  64.124577 41.177.244.177 -> 244.3.210.254 TCP 70 56182 > rfb [ACK] Seq=1 Ack=58092 Win=65535 Len=0 TSval=763085041 TSecr=2134604142
188585  64.125269 41.177.244.177 -> 244.3.210.254 TCP 70 56182 > rfb [ACK] Seq=1 Ack=58505 Win=65535 Len=0 TSval=763085041 TSecr=2134604142
188589  64.125922 41.177.244.177 -> 244.3.210.254 TCP 70 56182 > rfb [ACK] Seq=1 Ack=58593 Win=65535 Len=0 TSval=763085041 TSecr=2134604142
188705  64.217085 41.177.244.177 -> 244.3.210.254 TCP 70 56182 > rfb [ACK] Seq=1 Ack=58728 Win=65535 Len=0 TSval=763085042 TSecr=2134604142
188710  64.218321 41.177.244.177 -> 244.3.210.254 TCP 70 56182 > rfb [ACK] Seq=1 Ack=58808 Win=65535 Len=0 TSval=763085042 TSecr=2134604142
189050  64.467853 41.177.244.177 -> 244.3.210.254 TCP 70 56182 > rfb [ACK] Seq=1 Ack=59040 Win=65535 Len=0 TSval=763085044 TSecr=2134604142
189053  64.469521 41.177.244.177 -> 244.3.210.254 TCP 70 56182 > rfb [ACK] Seq=1 Ack=59114 Win=65535 Len=0 TSval=763085044 TSecr=2134604142
190004  65.217108 41.177.244.177 -> 244.3.210.254 TCP 70 56182 > rfb [ACK] Seq=1 Ack=59236 Win=65535 Len=0 TSval=763085052 TSecr=2134604144
192183  66.217400 41.177.244.177 -> 244.3.210.254 TCP 70 56182 > rfb [ACK] Seq=1 Ack=59358 Win=65535 Len=0 TSval=763085062 TSecr=2134604146
195539  67.217160 41.177.244.177 -> 244.3.210.254 TCP 70 56182 > rfb [ACK] Seq=1 Ack=59480 Win=65535 Len=0 TSval=763085072 TSecr=2134604148
198538  68.217222 41.177.244.177 -> 244.3.210.254 TCP 70 56182 > rfb [ACK] Seq=1 Ack=59603 Win=65535 Len=0 TSval=763085082 TSecr=2134604150
199161  68.488994 41.177.244.177 -> 244.3.210.254 TCP 70 56182 > rfb [ACK] Seq=1 Ack=59916 Win=65535 Len=0 TSval=763085084 TSecr=2134604150
199216  68.499556 41.177.244.177 -> 244.3.210.254 TCP 70 56182 > rfb [ACK] Seq=1 Ack=60560 Win=65535 Len=0 TSval=763085084 TSecr=2134604150
200787  69.217595 41.177.244.177 -> 244.3.210.254 TCP 70 56182 > rfb [ACK] Seq=1 Ack=60682 Win=65535 Len=0 TSval=763085092 TSecr=2134604152
201687  69.620542 41.177.244.177 -> 244.3.210.254 TCP 70 56182 > rfb [ACK] Seq=1 Ack=60921 Win=65535 Len=0 TSval=763085096 TSecr=2134604153
201712  69.630258 41.177.244.177 -> 244.3.210.254 TCP 70 56182 > rfb [ACK] Seq=1 Ack=61073 Win=65535 Len=0 TSval=763085096 TSecr=2134604153
204195  70.217355 41.177.244.177 -> 244.3.210.254 TCP 70 56182 > rfb [ACK] Seq=1 Ack=61195 Win=65535 Len=0 TSval=763085102 TSecr=2134604154
207882  71.217429 41.177.244.177 -> 244.3.210.254 TCP 70 56182 > rfb [ACK] Seq=1 Ack=61317 Win=65535 Len=0 TSval=763085112 TSecr=2134604156
209556  72.217805 41.177.244.177 -> 244.3.210.254 TCP 70 56182 > rfb [ACK] Seq=1 Ack=61439 Win=65535 Len=0 TSval=763085122 TSecr=2134604158
213405  73.218011 41.177.244.177 -> 244.3.210.254 TCP 70 56182 > rfb [ACK] Seq=1 Ack=61562 Win=65535 Len=0 TSval=763085132 TSecr=2134604160
214153  73.488672 41.177.244.177 -> 244.3.210.254 TCP 70 56182 > rfb [ACK] Seq=1 Ack=61867 Win=65535 Len=0 TSval=763085134 TSecr=2134604160
214185  73.498998 41.177.244.177 -> 244.3.210.254 TCP 70 56182 > rfb [ACK] Seq=1 Ack=62432 Win=65535 Len=0 TSval=763085134 TSecr=2134604160
215471  73.972597 41.177.244.177 -> 244.3.210.254 TCP 70 56182 > rfb [ACK] Seq=1 Ack=62532 Win=65535 Len=0 TSval=763085139 TSecr=2134604161
215482  73.976145 41.177.244.177 -> 244.3.210.254 TCP 70 56182 > rfb [ACK] Seq=1 Ack=62810 Win=65535 Len=0 TSval=763085139 TSecr=2134604161
216073  74.116351 41.177.244.177 -> 244.3.210.254 TCP 70 56182 > rfb [ACK] Seq=1 Ack=65546 Win=65535 Len=0 TSval=763085141 TSecr=2134604162
216075  74.116392 41.177.244.177 -> 244.3.210.254 TCP 70 56182 > rfb [ACK] Seq=1 Ack=66150 Win=65535 Len=0 TSval=763085141 TSecr=2134604162
217496  74.237488 41.177.244.177 -> 244.3.210.254 TCP 70 56182 > rfb [ACK] Seq=1 Ack=66250 Win=65535 Len=0 TSval=763085142 TSecr=2134604162
217510  74.241134 41.177.244.177 -> 244.3.210.254 TCP 70 56182 > rfb [ACK] Seq=1 Ack=66567 Win=65535 Len=0 TSval=763085142 TSecr=2134604162
217870  74.353083 41.177.244.177 -> 244.3.210.254 TCP 70 56182 > rfb [ACK] Seq=1 Ack=69303 Win=65535 Len=0 TSval=763085143 TSecr=2134604162
217871  74.353126 41.177.244.177 -> 244.3.210.254 TCP 70 56182 > rfb [ACK] Seq=1 Ack=69953 Win=65535 Len=0 TSval=763085143 TSecr=2134604162
218099  74.453617 41.177.244.177 -> 244.3.210.254 TCP 70 56182 > rfb [ACK] Seq=1 Ack=70076 Win=65535 Len=0 TSval=763085144 TSecr=2134604162
218127  74.457344 41.177.244.177 -> 244.3.210.254 TCP 70 56182 > rfb [ACK] Seq=1 Ack=70147 Win=65535 Len=0 TSval=763085144 TSecr=2134604162
218135  74.458053 41.177.244.177 -> 244.3.210.254 TCP 70 56182 > rfb [ACK] Seq=1 Ack=70513 Win=65535 Len=0 TSval=763085144 TSecr=2134604162
218141  74.458736 41.177.244.177 -> 244.3.210.254 TCP 70 56182 > rfb [ACK] Seq=1 Ack=70834 Win=65535 Len=0 TSval=763085144 TSecr=2134604162
218144  74.459426 41.177.244.177 -> 244.3.210.254 TCP 70 56182 > rfb [ACK] Seq=1 Ack=71079 Win=65535 Len=0 TSval=763085144 TSecr=2134604162
218149  74.460100 41.177.244.177 -> 244.3.210.254 TCP 70 56182 > rfb [ACK] Seq=1 Ack=71163 Win=65535 Len=0 TSval=763085144 TSecr=2134604162
218152  74.460743 41.177.244.177 -> 244.3.210.254 TCP 70 56182 > rfb [ACK] Seq=1 Ack=71231 Win=65535 Len=0 TSval=763085144 TSecr=2134604162
218813  74.667874 41.177.244.177 -> 244.3.210.254 TCP 70 56182 > rfb [ACK] Seq=1 Ack=71470 Win=65535 Len=0 TSval=763085146 TSecr=2134604163
218817  74.668866 41.177.244.177 -> 244.3.210.254 TCP 70 56182 > rfb [ACK] Seq=1 Ack=71545 Win=65535 Len=0 TSval=763085146 TSecr=2134604163
218820  74.669544 41.177.244.177 -> 244.3.210.254 TCP 70 56182 > rfb [ACK] Seq=1 Ack=71623 Win=65535 Len=0 TSval=763085146 TSecr=2134604163
219858  75.217874 41.177.244.177 -> 244.3.210.254 TCP 70 56182 > rfb [ACK] Seq=1 Ack=71759 Win=65535 Len=0 TSval=763085152 TSecr=2134604164
219879  75.228278 41.177.244.177 -> 244.3.210.254 TCP 70 56182 > rfb [ACK] Seq=1 Ack=71839 Win=65535 Len=0 TSval=763085152 TSecr=2134604164
222413  76.217934 41.177.244.177 -> 244.3.210.254 TCP 70 56182 > rfb [ACK] Seq=1 Ack=71962 Win=65535 Len=0 TSval=763085162 TSecr=2134604166
225641  77.218102 41.177.244.177 -> 244.3.210.254 TCP 70 56182 > rfb [ACK] Seq=1 Ack=72085 Win=65535 Len=0 TSval=763085172 TSecr=2134604168
227991  78.218973 41.177.244.177 -> 244.3.210.254 TCP 70 56182 > rfb [ACK] Seq=1 Ack=72208 Win=65535 Len=0 TSval=763085182 TSecr=2134604170
228550  78.488512 41.177.244.177 -> 244.3.210.254 TCP 70 56182 > rfb [ACK] Seq=1 Ack=72521 Win=65535 Len=0 TSval=763085184 TSecr=2134604170
228622  78.499145 41.177.244.177 -> 244.3.210.254 TCP 70 56182 > rfb [ACK] Seq=1 Ack=73176 Win=65535 Len=0 TSval=763085184 TSecr=2134604170
229911  79.218158 41.177.244.177 -> 244.3.210.254 TCP 70 56182 > rfb [ACK] Seq=1 Ack=73299 Win=65535 Len=0 TSval=763085192 TSecr=2134604172
229924  79.228454 41.177.244.177 -> 244.3.210.254 TCP 70 56182 > rfb [ACK] Seq=1 Ack=73373 Win=65535 Len=0 TSval=763085192 TSecr=2134604172
230939  79.767102 41.177.244.177 -> 244.3.210.254 TCP 70 56182 > rfb [ACK] Seq=1 Ack=73608 Win=65535 Len=0 TSval=763085197 TSecr=2134604173
230976  79.776932 41.177.244.177 -> 244.3.210.254 TCP 70 56182 > rfb [ACK] Seq=1 Ack=73686 Win=65535 Len=0 TSval=763085197 TSecr=2134604173
231115  79.831039 41.177.244.177 -> 244.3.210.254 TCP 82 63123 > 19813 [PSH, ACK] Seq=1 Ack=13 Win=65535 Len=12 TSval=763085198 TSecr=2134604093
231928  80.158535 41.177.244.177 -> 244.3.210.90 TCP 70 49192 > afpovertcp [ACK] Seq=161 Ack=145 Win=65535 Len=0 TSval=763085201 TSecr=376777965
232079  80.218193 41.177.244.177 -> 244.3.210.254 TCP 70 56182 > rfb [ACK] Seq=1 Ack=73809 Win=65535 Len=0 TSval=763085202 TSecr=2134604174
234123  81.218305 41.177.244.177 -> 244.3.210.254 TCP 70 56182 > rfb [ACK] Seq=1 Ack=73932 Win=65535 Len=0 TSval=763085212 TSecr=2134604176
235738  82.218421 41.177.244.177 -> 244.3.210.254 TCP 70 56182 > rfb [ACK] Seq=1 Ack=74055 Win=65535 Len=0 TSval=763085222 TSecr=2134604178
237895  82.621891 41.177.244.177 -> 244.3.210.254 TCP 70 56182 > rfb [ACK] Seq=1 Ack=74155 Win=65535 Len=0 TSval=763085226 TSecr=2134604179
237913  82.625612 41.177.244.177 -> 244.3.210.254 TCP 70 56182 > rfb [ACK] Seq=1 Ack=74431 Win=65535 Len=0 TSval=763085226 TSecr=2134604179
238419  82.740531 41.177.244.177 -> 244.3.210.254 TCP 70 56182 > rfb [ACK] Seq=1 Ack=77167 Win=65535 Len=0 TSval=763085227 TSecr=2134604179
238420  82.740536 41.177.244.177 -> 244.3.210.254 TCP 70 56182 > rfb [ACK] Seq=1 Ack=77796 Win=65535 Len=0 TSval=763085227 TSecr=2134604179
238734  82.842276 41.177.244.177 -> 244.3.210.254 TCP 70 56182 > rfb [ACK] Seq=1 Ack=77887 Win=65535 Len=0 TSval=763085228 TSecr=2134604179
238736  82.842943 41.177.244.177 -> 244.3.210.254 TCP 70 56182 > rfb [ACK] Seq=1 Ack=78052 Win=65535 Len=0 TSval=763085228 TSecr=2134604179
238738  82.843664 41.177.244.177 -> 244.3.210.254 TCP 70 56182 > rfb [ACK] Seq=1 Ack=78385 Win=65535 Len=0 TSval=763085228 TSecr=2134604179
238740  82.844358 41.177.244.177 -> 244.3.210.254 TCP 70 56182 > rfb [ACK] Seq=1 Ack=78629 Win=65535 Len=0 TSval=763085228 TSecr=2134604179
238742  82.845100 41.177.244.177 -> 244.3.210.254 TCP 70 56182 > rfb [ACK] Seq=1 Ack=78717 Win=65535 Len=0 TSval=763085228 TSecr=2134604179
239692  83.218594 41.177.244.177 -> 244.3.210.254 TCP 70 56182 > rfb [ACK] Seq=1 Ack=78853 Win=65535 Len=0 TSval=763085232 TSecr=2134604180
239702  83.219845 41.177.244.177 -> 244.3.210.254 TCP 70 56182 > rfb [ACK] Seq=1 Ack=78933 Win=65535 Len=0 TSval=763085232 TSecr=2134604180
240525  83.488179 41.177.244.177 -> 244.3.210.254 TCP 70 56182 > rfb [ACK] Seq=1 Ack=79256 Win=65535 Len=0 TSval=763085234 TSecr=2134604180
240529  83.489741 41.177.244.177 -> 244.3.210.254 TCP 70 56182 > rfb [ACK] Seq=1 Ack=79455 Win=65535 Len=0 TSval=763085234 TSecr=2134604180
240531  83.490684 41.177.244.177 -> 244.3.210.254 TCP 70 56182 > rfb [ACK] Seq=1 Ack=79894 Win=65535 Len=0 TSval=763085234 TSecr=2134604180
241692  84.218448 41.177.244.177 -> 244.3.210.254 TCP 70 56182 > rfb [ACK] Seq=1 Ack=80017 Win=65535 Len=0 TSval=763085242 TSecr=2134604182
243572  84.866424 41.177.244.177 -> 244.3.210.254 TCP 70 56182 > rfb [ACK] Seq=1 Ack=80249 Win=65535 Len=0 TSval=763085248 TSecr=2134604183
243586  84.876307 41.177.244.177 -> 244.3.210.254 TCP 70 56182 > rfb [ACK] Seq=1 Ack=80323 Win=65535 Len=0 TSval=763085248 TSecr=2134604183
244391  85.218513 41.177.244.177 -> 244.3.210.254 TCP 70 56182 > rfb [ACK] Seq=1 Ack=80446 Win=65535 Len=0 TSval=763085252 TSecr=2134604184
246298  86.218592 41.177.244.177 -> 244.3.210.254 TCP 70 56182 > rfb [ACK] Seq=1 Ack=80568 Win=65535 Len=0 TSval=763085262 TSecr=2134604186
247963  87.218770 41.177.244.177 -> 244.3.210.254 TCP 70 56182 > rfb [ACK] Seq=1 Ack=80690 Win=65535 Len=0 TSval=763085272 TSecr=2134604188
250169  88.219001 41.177.244.177 -> 244.3.210.254 TCP 70 56182 > rfb [ACK] Seq=1 Ack=80813 Win=65535 Len=0 TSval=763085282 TSecr=2134604190
250646  88.487730 41.177.244.177 -> 244.3.210.254 TCP 70 56182 > rfb [ACK] Seq=1 Ack=81130 Win=65535 Len=0 TSval=763085284 TSecr=2134604190
250684  88.497938 41.177.244.177 -> 244.3.210.254 TCP 70 56182 > rfb [ACK] Seq=1 Ack=81735 Win=65535 Len=0 TSval=763085284 TSecr=2134604190
252133  89.218806 41.177.244.177 -> 244.3.210.254 TCP 70 56182 > rfb [ACK] Seq=1 Ack=81858 Win=65535 Len=0 TSval=763085292 TSecr=2134604192
252703  89.413319 41.177.244.177 -> 244.3.210.254 TCP 82 54781 > 19813 [PSH, ACK] Seq=13 Ack=13 Win=65535 Len=12 TSval=763085293 TSecr=2134604112
253719  89.965975 41.177.244.177 -> 244.3.210.254 TCP 70 56182 > rfb [ACK] Seq=1 Ack=82090 Win=65535 Len=0 TSval=763085299 TSecr=2134604193
253728  89.975972 41.177.244.177 -> 244.3.210.254 TCP 70 56182 > rfb [ACK] Seq=1 Ack=82160 Win=65535 Len=0 TSval=763085299 TSecr=2134604193
254003  90.159050 41.177.244.177 -> 244.3.210.90 TCP 70 49192 > afpovertcp [ACK] Seq=177 Ack=163 Win=65535 Len=0 TSval=763085301 TSecr=376778065
254117  90.218840 41.177.244.177 -> 244.3.210.254 TCP 70 56182 > rfb [ACK] Seq=1 Ack=82283 Win=65535 Len=0 TSval=763085302 TSecr=2134604194
256431  91.218907 41.177.244.177 -> 244.3.210.254 TCP 70 56182 > rfb [ACK] Seq=1 Ack=82406 Win=65535 Len=0 TSval=763085312 TSecr=2134604196
271997  92.218950 41.177.244.177 -> 244.3.210.254 TCP 70 56182 > rfb [ACK] Seq=1 Ack=82529 Win=65535 Len=0 TSval=763085322 TSecr=2134604198
275016  92.705829 41.177.244.177 -> 244.3.210.254 TCP 70 56182 > rfb [ACK] Seq=1 Ack=82629 Win=65535 Len=0 TSval=763085326 TSecr=2134604199
275036  92.709195 41.177.244.177 -> 244.3.210.254 TCP 70 56182 > rfb [ACK] Seq=1 Ack=82907 Win=65535 Len=0 TSval=763085326 TSecr=2134604199
275512  92.815075 41.177.244.177 -> 244.3.210.254 TCP 70 56182 > rfb [ACK] Seq=1 Ack=85643 Win=65535 Len=0 TSval=763085327 TSecr=2134604199
275513  92.815117 41.177.244.177 -> 244.3.210.254 TCP 70 56182 > rfb [ACK] Seq=1 Ack=86288 Win=65535 Len=0 TSval=763085327 TSecr=2134604199
275898  92.961986 41.177.244.177 -> 244.3.210.254 TCP 70 56182 > rfb [ACK] Seq=1 Ack=86359 Win=65535 Len=0 TSval=763085329 TSecr=2134604199
