981312 327.772561 41.177.98.197 -> 244.3.185.120 TCP 66 ncube-lm > scol [SYN, ACK] Seq=0 Ack=1 Win=49680 Len=0 MSS=1460 SACK_PERM=1
981325 327.778374 41.177.98.197 -> 244.3.185.120 TCP 64 ncube-lm > scol [ACK] Seq=1 Ack=59 Win=49622 Len=0
981327 327.778681 41.177.98.197 -> 244.3.185.120 TCP 64 ncube-lm > scol [ACK] Seq=1 Ack=305 Win=49376 Len=0
981450 327.886649 41.177.98.197 -> 244.3.185.120 TCP 66 ncube-lm > scol [PSH, ACK] Seq=1 Ack=305 Win=49680 Len=8
981453 327.887578 41.177.98.197 -> 244.3.185.120 TCP 64 ncube-lm > scol [ACK] Seq=9 Ack=609 Win=49680 Len=0
981454 327.887726 41.177.98.197 -> 244.3.185.120 TCP 90 ncube-lm > scol [PSH, ACK] Seq=9 Ack=609 Win=49680 Len=32
981457 327.888701 41.177.98.197 -> 244.3.185.120 TCP 185 ncube-lm > scol [PSH, ACK] Seq=41 Ack=764 Win=49680 Len=127
981474 327.891026 41.177.98.197 -> 244.3.185.120 TCP 238 ncube-lm > scol [PSH, ACK] Seq=168 Ack=801 Win=49680 Len=180
981477 327.892617 41.177.98.197 -> 244.3.185.120 TCP 64 ncube-lm > scol [ACK] Seq=348 Ack=1834 Win=48647 Len=0
981478 327.894031 41.177.98.197 -> 244.3.185.120 TCP 1015 ncube-lm > scol [PSH, ACK] Seq=348 Ack=1834 Win=48647 Len=957
981489 327.899485 41.177.98.197 -> 244.3.185.120 TCP 132 ncube-lm > scol [PSH, ACK] Seq=1305 Ack=1940 Win=48647 Len=74
981497 327.905145 41.177.98.197 -> 244.3.185.120 TCP 97 ncube-lm > scol [PSH, ACK] Seq=1379 Ack=2078 Win=48647 Len=39
981502 327.906066 41.177.98.197 -> 244.3.185.120 TCP 80 ncube-lm > scol [PSH, ACK] Seq=1418 Ack=2096 Win=48647 Len=22
981504 327.906879 41.177.98.197 -> 244.3.185.120 TCP 74 ncube-lm > scol [PSH, ACK] Seq=1440 Ack=2111 Win=48647 Len=16
981506 327.908029 41.177.98.197 -> 244.3.185.120 TCP 98 ncube-lm > scol [PSH, ACK] Seq=1456 Ack=2375 Win=48647 Len=40
981508 327.908869 41.177.98.197 -> 244.3.185.120 TCP 71 ncube-lm > scol [PSH, ACK] Seq=1496 Ack=2390 Win=48647 Len=13
981510 327.910120 41.177.98.197 -> 244.3.185.120 TCP 71 ncube-lm > scol [PSH, ACK] Seq=1509 Ack=2403 Win=48647 Len=13
981514 327.910939 41.177.98.197 -> 244.3.185.120 TCP 74 ncube-lm > scol [PSH, ACK] Seq=1522 Ack=2418 Win=48647 Len=16
981519 327.911955 41.177.98.197 -> 244.3.185.120 TCP 98 ncube-lm > scol [PSH, ACK] Seq=1538 Ack=2598 Win=48647 Len=40
981521 327.913350 41.177.98.197 -> 244.3.185.120 TCP 205 ncube-lm > scol [PSH, ACK] Seq=1578 Ack=2681 Win=48647 Len=147
981528 327.914284 41.177.98.197 -> 244.3.185.120 TCP 71 ncube-lm > scol [PSH, ACK] Seq=1725 Ack=2696 Win=48647 Len=13
981530 327.915203 41.177.98.197 -> 244.3.185.120 TCP 74 ncube-lm > scol [PSH, ACK] Seq=1738 Ack=2711 Win=48647 Len=16
981532 327.916466 41.177.98.197 -> 244.3.185.120 TCP 100 ncube-lm > scol [PSH, ACK] Seq=1754 Ack=3062 Win=48647 Len=42
981540 327.917481 41.177.98.197 -> 244.3.185.120 TCP 180 ncube-lm > scol [PSH, ACK] Seq=1796 Ack=3089 Win=48647 Len=122
981550 327.918985 41.177.98.197 -> 244.3.185.120 TCP 109 ncube-lm > scol [PSH, ACK] Seq=1918 Ack=3322 Win=48647 Len=51
981555 327.920159 41.177.98.197 -> 244.3.185.120 TCP 163 ncube-lm > scol [PSH, ACK] Seq=1969 Ack=3406 Win=48647 Len=105
981557 327.921128 41.177.98.197 -> 244.3.185.120 TCP 74 ncube-lm > scol [PSH, ACK] Seq=2074 Ack=3421 Win=48647 Len=16
981563 327.922462 41.177.98.197 -> 244.3.185.120 TCP 100 ncube-lm > scol [PSH, ACK] Seq=2090 Ack=3828 Win=48647 Len=42
981565 327.923472 41.177.98.197 -> 244.3.185.120 TCP 394 ncube-lm > scol [PSH, ACK] Seq=2132 Ack=3855 Win=48647 Len=336
981569 327.925102 41.177.98.197 -> 244.3.185.120 TCP 109 ncube-lm > scol [PSH, ACK] Seq=2468 Ack=4108 Win=48647 Len=51
981573 327.926442 41.177.98.197 -> 244.3.185.120 TCP 348 ncube-lm > scol [PSH, ACK] Seq=2519 Ack=4283 Win=48647 Len=290
981579 327.927750 41.177.98.197 -> 244.3.185.120 TCP 74 ncube-lm > scol [PSH, ACK] Seq=2809 Ack=4298 Win=48647 Len=16
981583 327.928915 41.177.98.197 -> 244.3.185.120 TCP 100 ncube-lm > scol [PSH, ACK] Seq=2825 Ack=4604 Win=48647 Len=42
981585 327.929842 41.177.98.197 -> 244.3.185.120 TCP 163 ncube-lm > scol [PSH, ACK] Seq=2867 Ack=4631 Win=48647 Len=105
981587 327.931271 41.177.98.197 -> 244.3.185.120 TCP 109 ncube-lm > scol [PSH, ACK] Seq=2972 Ack=4894 Win=48647 Len=51
981589 327.932832 41.177.98.197 -> 244.3.185.120 TCP 856 ncube-lm > scol [PSH, ACK] Seq=3023 Ack=4977 Win=48647 Len=798
981595 327.934274 41.177.98.197 -> 244.3.185.120 TCP 74 ncube-lm > scol [PSH, ACK] Seq=3821 Ack=4992 Win=48647 Len=16
981607 327.935531 41.177.98.197 -> 244.3.185.120 TCP 100 ncube-lm > scol [PSH, ACK] Seq=3837 Ack=5378 Win=48647 Len=42
981609 327.936475 41.177.98.197 -> 244.3.185.120 TCP 203 ncube-lm > scol [PSH, ACK] Seq=3879 Ack=5405 Win=48647 Len=145
981613 327.937981 41.177.98.197 -> 244.3.185.120 TCP 109 ncube-lm > scol [PSH, ACK] Seq=4024 Ack=5658 Win=48647 Len=51
981615 327.939405 41.177.98.197 -> 244.3.185.120 TCP 369 ncube-lm > scol [PSH, ACK] Seq=4075 Ack=5753 Win=48647 Len=311
981617 327.940580 41.177.98.197 -> 244.3.185.120 TCP 74 ncube-lm > scol [PSH, ACK] Seq=4386 Ack=5768 Win=48647 Len=16
981619 327.942214 41.177.98.197 -> 244.3.185.120 TCP 100 ncube-lm > scol [PSH, ACK] Seq=4402 Ack=6171 Win=48647 Len=42
981625 327.943188 41.177.98.197 -> 244.3.185.120 TCP 312 ncube-lm > scol [PSH, ACK] Seq=4444 Ack=6198 Win=48647 Len=254
981627 327.944732 41.177.98.197 -> 244.3.185.120 TCP 109 ncube-lm > scol [PSH, ACK] Seq=4698 Ack=6451 Win=48647 Len=51
981629 327.946265 41.177.98.197 -> 244.3.185.120 TCP 558 ncube-lm > scol [PSH, ACK] Seq=4749 Ack=6585 Win=48647 Len=500
981632 327.947770 41.177.98.197 -> 244.3.185.120 TCP 74 ncube-lm > scol [PSH, ACK] Seq=5249 Ack=6600 Win=48647 Len=16
981637 327.948999 41.177.98.197 -> 244.3.185.120 TCP 64 ncube-lm > scol [ACK] Seq=5265 Ack=7156 Win=49680 Len=0
981638 327.949151 41.177.98.197 -> 244.3.185.120 TCP 100 ncube-lm > scol [PSH, ACK] Seq=5265 Ack=7156 Win=49680 Len=42
981640 327.950118 41.177.98.197 -> 244.3.185.120 TCP 168 ncube-lm > scol [PSH, ACK] Seq=5307 Ack=7183 Win=49680 Len=110
981642 327.951957 41.177.98.197 -> 244.3.185.120 TCP 109 ncube-lm > scol [PSH, ACK] Seq=5417 Ack=7596 Win=49680 Len=51
981644 327.953059 41.177.98.197 -> 244.3.185.120 TCP 160 ncube-lm > scol [PSH, ACK] Seq=5468 Ack=7679 Win=49680 Len=102
981648 327.954036 41.177.98.197 -> 244.3.185.120 TCP 74 ncube-lm > scol [PSH, ACK] Seq=5570 Ack=7694 Win=49680 Len=16
981651 327.955342 41.177.98.197 -> 244.3.185.120 TCP 64 ncube-lm > scol [ACK] Seq=5586 Ack=8348 Win=49026 Len=0
981652 327.955415 41.177.98.197 -> 244.3.185.120 TCP 100 ncube-lm > scol [PSH, ACK] Seq=5586 Ack=8348 Win=49026 Len=42
981654 327.956476 41.177.98.197 -> 244.3.185.120 TCP 263 ncube-lm > scol [PSH, ACK] Seq=5628 Ack=8375 Win=49026 Len=205
981656 327.958344 41.177.98.197 -> 244.3.185.120 TCP 109 ncube-lm > scol [PSH, ACK] Seq=5833 Ack=8788 Win=49026 Len=51
981661 327.959866 41.177.98.197 -> 244.3.185.120 TCP 438 ncube-lm > scol [PSH, ACK] Seq=5884 Ack=8909 Win=49026 Len=380
981663 327.962090 41.177.98.197 -> 244.3.185.120 TCP 99 ncube-lm > scol [PSH, ACK] Seq=6264 Ack=8978 Win=49026 Len=41
981665 327.963076 41.177.98.197 -> 244.3.185.120 TCP 163 ncube-lm > scol [PSH, ACK] Seq=6305 Ack=8996 Win=49026 Len=105
981667 327.964359 41.177.98.197 -> 244.3.185.120 TCP 99 ncube-lm > scol [PSH, ACK] Seq=6410 Ack=9085 Win=49026 Len=41
981670 327.965366 41.177.98.197 -> 244.3.185.120 TCP 208 ncube-lm > scol [PSH, ACK] Seq=6451 Ack=9102 Win=49026 Len=150
981685 327.966679 41.177.98.197 -> 244.3.185.120 TCP 99 ncube-lm > scol [PSH, ACK] Seq=6601 Ack=9201 Win=49026 Len=41
981693 327.968048 41.177.98.197 -> 244.3.185.120 TCP 1168 ncube-lm > scol [PSH, ACK] Seq=6642 Ack=9218 Win=49026 Len=1110
981696 327.969957 41.177.98.197 -> 244.3.185.120 TCP 99 ncube-lm > scol [PSH, ACK] Seq=7752 Ack=9307 Win=49026 Len=41
981698 327.971234 41.177.98.197 -> 244.3.185.120 TCP 369 ncube-lm > scol [PSH, ACK] Seq=7793 Ack=9325 Win=49026 Len=311
981701 327.972680 41.177.98.197 -> 244.3.185.120 TCP 99 ncube-lm > scol [PSH, ACK] Seq=8104 Ack=9414 Win=49026 Len=41
981703 327.973995 41.177.98.197 -> 244.3.185.120 TCP 549 ncube-lm > scol [PSH, ACK] Seq=8145 Ack=9432 Win=49026 Len=491
981706 327.975852 41.177.98.197 -> 244.3.185.120 TCP 99 ncube-lm > scol [PSH, ACK] Seq=8636 Ack=9541 Win=49026 Len=41
981708 327.976795 41.177.98.197 -> 244.3.185.120 TCP 160 ncube-lm > scol [PSH, ACK] Seq=8677 Ack=9559 Win=49026 Len=102
981710 327.978496 41.177.98.197 -> 244.3.185.120 TCP 99 ncube-lm > scol [PSH, ACK] Seq=8779 Ack=9668 Win=49026 Len=41
981712 327.979846 41.177.98.197 -> 244.3.185.120 TCP 438 ncube-lm > scol [PSH, ACK] Seq=8820 Ack=9686 Win=49026 Len=380
981717 327.981926 41.177.98.197 -> 244.3.185.120 TCP 99 ncube-lm > scol [PSH, ACK] Seq=9200 Ack=9755 Win=49026 Len=41
981719 327.982876 41.177.98.197 -> 244.3.185.120 TCP 163 ncube-lm > scol [PSH, ACK] Seq=9241 Ack=9773 Win=49026 Len=105
981727 327.984312 41.177.98.197 -> 244.3.185.120 TCP 99 ncube-lm > scol [PSH, ACK] Seq=9346 Ack=9862 Win=49026 Len=41
981729 327.985307 41.177.98.197 -> 244.3.185.120 TCP 208 ncube-lm > scol [PSH, ACK] Seq=9387 Ack=9879 Win=49026 Len=150
981738 327.986639 41.177.98.197 -> 244.3.185.120 TCP 99 ncube-lm > scol [PSH, ACK] Seq=9537 Ack=9978 Win=49026 Len=41
981740 327.988042 41.177.98.197 -> 244.3.185.120 TCP 1110 ncube-lm > scol [PSH, ACK] Seq=9578 Ack=9995 Win=49026 Len=1052
981744 327.990122 41.177.98.197 -> 244.3.185.120 TCP 99 ncube-lm > scol [PSH, ACK] Seq=10630 Ack=10084 Win=49026 Len=41
981747 327.991573 41.177.98.197 -> 244.3.185.120 TCP 369 ncube-lm > scol [PSH, ACK] Seq=10671 Ack=10102 Win=49026 Len=311
981749 327.993029 41.177.98.197 -> 244.3.185.120 TCP 99 ncube-lm > scol [PSH, ACK] Seq=10982 Ack=10191 Win=49026 Len=41
981751 327.994389 41.177.98.197 -> 244.3.185.120 TCP 549 ncube-lm > scol [PSH, ACK] Seq=11023 Ack=10209 Win=49026 Len=491
981753 327.996215 41.177.98.197 -> 244.3.185.120 TCP 99 ncube-lm > scol [PSH, ACK] Seq=11514 Ack=10318 Win=49026 Len=41
981755 327.997236 41.177.98.197 -> 244.3.185.120 TCP 160 ncube-lm > scol [PSH, ACK] Seq=11555 Ack=10336 Win=49026 Len=102
981760 327.998886 41.177.98.197 -> 244.3.185.120 TCP 99 ncube-lm > scol [PSH, ACK] Seq=11657 Ack=10445 Win=49026 Len=41
981765 328.000269 41.177.98.197 -> 244.3.185.120 TCP 439 ncube-lm > scol [PSH, ACK] Seq=11698 Ack=10463 Win=49026 Len=381
981783 328.002306 41.177.98.197 -> 244.3.185.120 TCP 99 ncube-lm > scol [PSH, ACK] Seq=12079 Ack=10533 Win=49026 Len=41
981785 328.003325 41.177.98.197 -> 244.3.185.120 TCP 192 ncube-lm > scol [PSH, ACK] Seq=12120 Ack=10551 Win=49026 Len=134
981790 328.005624 41.177.98.197 -> 244.3.185.120 TCP 99 ncube-lm > scol [PSH, ACK] Seq=12254 Ack=10640 Win=49026 Len=41
981794 328.006884 41.177.98.197 -> 244.3.185.120 TCP 419 ncube-lm > scol [PSH, ACK] Seq=12295 Ack=10657 Win=49026 Len=361
981796 328.008865 41.177.98.197 -> 244.3.185.120 TCP 99 ncube-lm > scol [PSH, ACK] Seq=12656 Ack=10756 Win=49026 Len=41
981800 328.010339 41.177.98.197 -> 244.3.185.120 TCP 1112 ncube-lm > scol [PSH, ACK] Seq=12697 Ack=10773 Win=49026 Len=1054
981802 328.012533 41.177.98.197 -> 244.3.185.120 TCP 99 ncube-lm > scol [PSH, ACK] Seq=13751 Ack=10862 Win=49026 Len=41
981804 328.013882 41.177.98.197 -> 244.3.185.120 TCP 369 ncube-lm > scol [PSH, ACK] Seq=13792 Ack=10880 Win=49026 Len=311
981809 328.015359 41.177.98.197 -> 244.3.185.120 TCP 99 ncube-lm > scol [PSH, ACK] Seq=14103 Ack=10969 Win=49026 Len=41
981811 328.016736 41.177.98.197 -> 244.3.185.120 TCP 552 ncube-lm > scol [PSH, ACK] Seq=14144 Ack=10987 Win=49026 Len=494
981813 328.018557 41.177.98.197 -> 244.3.185.120 TCP 99 ncube-lm > scol [PSH, ACK] Seq=14638 Ack=11096 Win=49026 Len=41
981816 328.019535 41.177.98.197 -> 244.3.185.120 TCP 160 ncube-lm > scol [PSH, ACK] Seq=14679 Ack=11114 Win=49026 Len=102
981820 328.020930 41.177.98.197 -> 244.3.185.120 TCP 99 ncube-lm > scol [PSH, ACK] Seq=14781 Ack=11223 Win=49026 Len=41
981824 328.022675 41.177.98.197 -> 244.3.185.120 TCP 437 ncube-lm > scol [PSH, ACK] Seq=14822 Ack=11241 Win=49026 Len=379
