52761  21.989467 41.177.176.38 -> 41.177.98.176 TCP 66 4331 > http [SYN] Seq=0 Win=65535 Len=0 MSS=1460 SACK_PERM=1
52763  21.990014 41.177.176.38 -> 41.177.98.176 TCP 64 4331 > http [ACK] Seq=1 Ack=1 Win=65535 Len=0
59892  24.126958 41.177.176.38 -> 41.177.98.176 TCP 64 4331 > http [ACK] Seq=756 Ack=2921 Win=65535 Len=0
59894  24.127501 41.177.176.38 -> 41.177.98.176 TCP 64 4331 > http [ACK] Seq=756 Ack=5335 Win=65535 Len=0
59900  24.129694 41.177.176.38 -> 41.177.98.176 TCP 64 4331 > http [ACK] Seq=756 Ack=8255 Win=65535 Len=0
59901  24.129810 41.177.176.38 -> 41.177.98.176 TCP 64 4331 > http [ACK] Seq=756 Ack=10463 Win=65535 Len=0
59908  24.132484 41.177.176.38 -> 41.177.98.176 TCP 64 4331 > http [ACK] Seq=756 Ack=13383 Win=65535 Len=0
59909  24.132607 41.177.176.38 -> 41.177.98.176 TCP 64 4331 > http [ACK] Seq=756 Ack=15591 Win=65535 Len=0
59914  24.135314 41.177.176.38 -> 41.177.98.176 TCP 64 4331 > http [ACK] Seq=756 Ack=18511 Win=65535 Len=0
59915  24.135439 41.177.176.38 -> 41.177.98.176 TCP 64 4331 > http [ACK] Seq=756 Ack=20719 Win=65535 Len=0
59920  24.138206 41.177.176.38 -> 41.177.98.176 TCP 64 4331 > http [ACK] Seq=756 Ack=22017 Win=64237 Len=0
109144  39.199249 41.177.176.38 -> 41.177.98.176 TCP 64 4331 > http [ACK] Seq=756 Ack=22018 Win=64237 Len=0
123689  44.062388 41.177.176.38 -> 41.177.98.176 TCP 64 4331 > http [FIN, ACK] Seq=756 Ack=22018 Win=64237 Len=0
