108636  39.060453 41.177.251.105 -> 41.177.98.220 TCP 66 ac-tech > empowerid [SYN] Seq=0 Win=65535 Len=0 MSS=1460 SACK_PERM=1
108639  39.060906 41.177.251.105 -> 41.177.98.220 TCP 64 ac-tech > empowerid [ACK] Seq=1 Ack=1 Win=65535 Len=0
108642  39.061227 41.177.251.105 -> 41.177.98.220 TCP 151 ac-tech > empowerid [PSH, ACK] Seq=1 Ack=1 Win=65535 Len=93
113385  40.339612 41.177.251.105 -> 41.177.98.220 TCP 64 ac-tech > empowerid [ACK] Seq=94 Ack=106 Win=65430 Len=0
123015  43.759409 41.177.251.105 -> 41.177.98.220 TCP 143 ac-tech > empowerid [PSH, ACK] Seq=94 Ack=106 Win=65430 Len=85
123033  43.764439 41.177.251.105 -> 41.177.98.220 TCP 113 ac-tech > empowerid [PSH, ACK] Seq=179 Ack=203 Win=65333 Len=55
123113  43.779932 41.177.251.105 -> 41.177.98.220 TCP 131 ac-tech > empowerid [PSH, ACK] Seq=234 Ack=1636 Win=65535 Len=73
123132  43.787653 41.177.251.105 -> 41.177.98.220 TCP 115 ac-tech > empowerid [PSH, ACK] Seq=307 Ack=1745 Win=65426 Len=57
123134  43.790914 41.177.251.105 -> 41.177.98.220 TCP 112 ac-tech > empowerid [PSH, ACK] Seq=364 Ack=1834 Win=65337 Len=54
123153  43.799786 41.177.251.105 -> 41.177.98.220 TCP 124 ac-tech > empowerid [PSH, ACK] Seq=418 Ack=2424 Win=64747 Len=66
123584  43.960762 41.177.251.105 -> 41.177.98.220 TCP 64 ac-tech > empowerid [ACK] Seq=484 Ack=2493 Win=64678 Len=0
130060  45.445160 41.177.251.105 -> 41.177.98.220 TCP 64 ac-tech > empowerid [FIN, ACK] Seq=484 Ack=2493 Win=64678 Len=0
130629  45.619749 41.177.251.105 -> 41.177.98.220 TCP 64 ac-tech > empowerid [ACK] Seq=485 Ack=2494 Win=64678 Len=0
171632  57.091275 41.177.251.105 -> 41.177.98.220 TCP 66 esp-encap > 7040 [SYN] Seq=0 Win=65535 Len=0 MSS=1460 SACK_PERM=1
171636  57.091743 41.177.251.105 -> 41.177.98.220 TCP 64 esp-encap > 7040 [ACK] Seq=1 Ack=1 Win=65535 Len=0
171637  57.091922 41.177.251.105 -> 41.177.98.220 TCP 141 esp-encap > 7040 [PSH, ACK] Seq=1 Ack=1 Win=65535 Len=83
173352  57.643595 41.177.251.105 -> 41.177.98.220 TCP 64 esp-encap > 7040 [ACK] Seq=84 Ack=101 Win=65435 Len=0
190933  65.679705 41.177.251.105 -> 41.177.98.220 TCP 138 esp-encap > 7040 [PSH, ACK] Seq=84 Ack=101 Win=65435 Len=80
191142  65.788254 41.177.251.105 -> 41.177.98.220 TCP 64 esp-encap > 7040 [ACK] Seq=164 Ack=193 Win=65343 Len=0
193100  66.432251 41.177.251.105 -> 41.177.98.220 TCP 108 esp-encap > 7040 [PSH, ACK] Seq=164 Ack=193 Win=65343 Len=50
193688  66.606616 41.177.251.105 -> 41.177.98.220 TCP 64 esp-encap > 7040 [ACK] Seq=214 Ack=1251 Win=64285 Len=0
212582  73.068072 41.177.251.105 -> 41.177.98.220 TCP 145 esp-encap > 7040 [PSH, ACK] Seq=214 Ack=1251 Win=64285 Len=87
212832  73.111859 41.177.251.105 -> 41.177.98.220 TCP 64 esp-encap > 7040 [ACK] Seq=301 Ack=4171 Win=65535 Len=0
212838  73.115837 41.177.251.105 -> 41.177.98.220 TCP 145 esp-encap > 7040 [PSH, ACK] Seq=301 Ack=4922 Win=64784 Len=87
213182  73.168628 41.177.251.105 -> 41.177.98.220 TCP 64 esp-encap > 7040 [ACK] Seq=388 Ack=6659 Win=65535 Len=0
213193  73.171213 41.177.251.105 -> 41.177.98.220 TCP 120 esp-encap > 7040 [PSH, ACK] Seq=388 Ack=6659 Win=65535 Len=62
213203  73.174182 41.177.251.105 -> 41.177.98.220 TCP 120 esp-encap > 7040 [PSH, ACK] Seq=450 Ack=7377 Win=64817 Len=62
213211  73.176863 41.177.251.105 -> 41.177.98.220 TCP 120 esp-encap > 7040 [PSH, ACK] Seq=512 Ack=8095 Win=64099 Len=62
213215  73.179540 41.177.251.105 -> 41.177.98.220 TCP 120 esp-encap > 7040 [PSH, ACK] Seq=574 Ack=8817 Win=65535 Len=62
213218  73.182226 41.177.251.105 -> 41.177.98.220 TCP 120 esp-encap > 7040 [PSH, ACK] Seq=636 Ack=9535 Win=64817 Len=62
213246  73.184940 41.177.251.105 -> 41.177.98.220 TCP 120 esp-encap > 7040 [PSH, ACK] Seq=698 Ack=10263 Win=64089 Len=62
213269  73.187630 41.177.251.105 -> 41.177.98.220 TCP 120 esp-encap > 7040 [PSH, ACK] Seq=760 Ack=10974 Win=65535 Len=62
213837  73.332311 41.177.251.105 -> 41.177.98.220 TCP 64 esp-encap > 7040 [ACK] Seq=822 Ack=11831 Win=64678 Len=0
834158 272.958177 41.177.251.105 -> 41.177.98.220 TCP 64 esp-encap > 7040 [FIN, ACK] Seq=822 Ack=11831 Win=64678 Len=0
834177 272.970706 41.177.251.105 -> 41.177.98.220 TCP 64 esp-encap > 7040 [ACK] Seq=823 Ack=11832 Win=64678 Len=0
958583 318.301413 41.177.251.105 -> 41.177.98.167 TCP 66 wta-wsp-s > ncube-lm [SYN] Seq=0 Win=65535 Len=0 MSS=1460 SACK_PERM=1
958585 318.301895 41.177.251.105 -> 41.177.98.167 TCP 64 wta-wsp-s > ncube-lm [ACK] Seq=1 Ack=1 Win=65535 Len=0
958761 318.372049 41.177.251.105 -> 41.177.98.167 TCP 321 wta-wsp-s > ncube-lm [PSH, ACK] Seq=1 Ack=1 Win=65535 Len=263
959019 318.487419 41.177.251.105 -> 41.177.98.167 TCP 321 wta-wsp-s > ncube-lm [PSH, ACK] Seq=264 Ack=9 Win=65527 Len=263
959022 318.488099 41.177.251.105 -> 41.177.98.167 TCP 213 wta-wsp-s > ncube-lm [PSH, ACK] Seq=527 Ack=41 Win=65495 Len=155
959086 318.511617 41.177.251.105 -> 41.177.98.167 TCP 95 wta-wsp-s > ncube-lm [PSH, ACK] Seq=682 Ack=168 Win=65368 Len=37
959526 318.649504 41.177.251.105 -> 41.177.98.167 TCP 1091 wta-wsp-s > ncube-lm [PSH, ACK] Seq=719 Ack=348 Win=65188 Len=1033
959528 318.651873 41.177.251.105 -> 41.177.98.167 TCP 164 wta-wsp-s > ncube-lm [PSH, ACK] Seq=1752 Ack=1305 Win=64231 Len=106
959585 318.678708 41.177.251.105 -> 41.177.98.167 TCP 196 wta-wsp-s > ncube-lm [PSH, ACK] Seq=1858 Ack=1379 Win=64157 Len=138
959633 318.704322 41.177.251.105 -> 41.177.98.167 TCP 76 wta-wsp-s > ncube-lm [PSH, ACK] Seq=1996 Ack=1418 Win=64118 Len=18
959635 318.704748 41.177.251.105 -> 41.177.98.167 TCP 73 wta-wsp-s > ncube-lm [PSH, ACK] Seq=2014 Ack=1440 Win=64096 Len=15
959641 318.707303 41.177.251.105 -> 41.177.98.167 TCP 322 wta-wsp-s > ncube-lm [PSH, ACK] Seq=2029 Ack=1456 Win=64080 Len=264
959644 318.707912 41.177.251.105 -> 41.177.98.167 TCP 73 wta-wsp-s > ncube-lm [PSH, ACK] Seq=2293 Ack=1496 Win=65535 Len=15
959662 318.716369 41.177.251.105 -> 41.177.98.167 TCP 71 wta-wsp-s > ncube-lm [PSH, ACK] Seq=2308 Ack=1509 Win=65522 Len=13
959664 318.716745 41.177.251.105 -> 41.177.98.167 TCP 73 wta-wsp-s > ncube-lm [PSH, ACK] Seq=2321 Ack=1522 Win=65509 Len=15
959668 318.717147 41.177.251.105 -> 41.177.98.167 TCP 238 wta-wsp-s > ncube-lm [PSH, ACK] Seq=2336 Ack=1538 Win=65493 Len=180
959774 318.750353 41.177.251.105 -> 41.177.98.167 TCP 141 wta-wsp-s > ncube-lm [PSH, ACK] Seq=2516 Ack=1579 Win=65452 Len=83
959776 318.751315 41.177.251.105 -> 41.177.98.167 TCP 73 wta-wsp-s > ncube-lm [PSH, ACK] Seq=2599 Ack=1725 Win=65306 Len=15
959778 318.751888 41.177.251.105 -> 41.177.98.167 TCP 73 wta-wsp-s > ncube-lm [PSH, ACK] Seq=2614 Ack=1738 Win=65293 Len=15
959780 318.752353 41.177.251.105 -> 41.177.98.167 TCP 127 wta-wsp-s > ncube-lm [PSH, ACK] Seq=2629 Ack=1754 Win=65277 Len=69
959782 318.754658 41.177.251.105 -> 41.177.98.167 TCP 73 wta-wsp-s > ncube-lm [PSH, ACK] Seq=2698 Ack=1840 Win=65191 Len=15
959784 318.755245 41.177.251.105 -> 41.177.98.167 TCP 73 wta-wsp-s > ncube-lm [PSH, ACK] Seq=2713 Ack=1853 Win=65178 Len=15
959797 318.762579 41.177.251.105 -> 41.177.98.167 TCP 1518 wta-wsp-s > ncube-lm [ACK] Seq=2728 Ack=1869 Win=65162 Len=1460
959798 318.762584 41.177.251.105 -> 41.177.98.167 TCP 523 wta-wsp-s > ncube-lm [PSH, ACK] Seq=4188 Ack=1869 Win=65162 Len=465
959818 318.767360 41.177.251.105 -> 41.177.98.167 TCP 85 wta-wsp-s > ncube-lm [PSH, ACK] Seq=4653 Ack=1913 Win=65118 Len=27
960677 319.155599 41.177.251.105 -> 41.177.98.167 TCP 169 wta-wsp-s > ncube-lm [PSH, ACK] Seq=4680 Ack=2351 Win=64680 Len=111
961854 319.681248 41.177.251.105 -> 41.177.98.167 TCP 268 wta-wsp-s > ncube-lm [PSH, ACK] Seq=4791 Ack=2403 Win=64628 Len=210
964614 321.065134 41.177.251.105 -> 41.177.98.167 TCP 73 wta-wsp-s > ncube-lm [PSH, ACK] Seq=5001 Ack=3085 Win=65535 Len=15
964838 321.181834 41.177.251.105 -> 41.177.98.167 TCP 64 wta-wsp-s > ncube-lm [ACK] Seq=5016 Ack=3098 Win=65522 Len=0
