286660  95.811534 41.177.98.57 -> 41.177.24.224 TCP 82 62734 > smtp [SYN] Seq=0 Win=32850 Len=0 WS=2 TSval=140351177 TSecr=0 SACK_PERM=1 MSS=1460
286681  95.812883 41.177.98.57 -> 41.177.24.224 TCP 70 62734 > smtp [ACK] Seq=1 Ack=1 Win=67032 Len=0 TSval=140351177 TSecr=605222093
286767  95.825760 41.177.98.57 -> 41.177.24.224 TCP 70 62734 > smtp [ACK] Seq=1 Ack=80 Win=67032 Len=0 TSval=140351178 TSecr=605222095
286771  95.827451 41.177.98.57 -> 41.177.24.224 TCP 70 62734 > smtp [ACK] Seq=32 Ack=303 Win=67032 Len=0 TSval=140351179 TSecr=605222095
287592  96.056190 41.177.98.57 -> 41.177.24.224 TCP 70 62734 > smtp [ACK] Seq=129 Ack=338 Win=67032 Len=0 TSval=140351202 TSecr=605222108
287599  96.056570 41.177.98.57 -> 41.177.24.224 TCP 70 62734 > smtp [ACK] Seq=129 Ack=420 Win=67032 Len=0 TSval=140351202 TSecr=605222118
287678  96.082293 41.177.98.57 -> 41.177.24.224 TCP 70 62734 > smtp [ACK] Seq=1037 Ack=522 Win=67032 Len=0 TSval=140351204 TSecr=605222120
287684  96.082582 41.177.98.57 -> 41.177.24.224 TCP 70 62734 > smtp [ACK] Seq=1037 Ack=523 Win=67032 Len=0 TSval=140351204 TSecr=605222120
287688  96.082816 41.177.98.57 -> 41.177.24.224 TCP 70 62734 > smtp [FIN, ACK] Seq=1037 Ack=523 Win=67032 Len=0 TSval=140351204 TSecr=605222120
