31321  13.227991 41.177.98.121 -> 244.3.47.239 TCP 66 clariion-evr01 > ssslic-mgr [SYN, ACK] Seq=0 Ack=1 Win=49680 Len=0 MSS=1460 SACK_PERM=1
31327  13.234453 41.177.98.121 -> 244.3.47.239 TCP 64 clariion-evr01 > ssslic-mgr [ACK] Seq=1 Ack=344 Win=49337 Len=0
31336  13.239429 41.177.98.121 -> 244.3.47.239 TCP 246 clariion-evr01 > ssslic-mgr [PSH, ACK] Seq=1 Ack=344 Win=49680 Len=188
31337  13.240408 41.177.98.121 -> 244.3.47.239 TCP 1247 clariion-evr01 > ssslic-mgr [FIN, PSH, ACK] Seq=189 Ack=344 Win=49680 Len=1189
31387  13.261783 41.177.98.121 -> 244.3.47.239 TCP 64 clariion-evr01 > ssslic-mgr [ACK] Seq=1379 Ack=345 Win=49680 Len=0
72003  29.572849 41.177.98.121 -> 244.3.47.145 TCP 66 clariion-evr01 > mvx-lm [SYN, ACK] Seq=0 Ack=1 Win=49680 Len=0 MSS=1460 SACK_PERM=1
72006  29.573479 41.177.98.121 -> 244.3.47.145 TCP 64 clariion-evr01 > mvx-lm [ACK] Seq=1 Ack=284 Win=49397 Len=0
72060  29.579711 41.177.98.121 -> 244.3.47.145 TCP 150 clariion-evr01 > mvx-lm [PSH, ACK] Seq=1 Ack=284 Win=49680 Len=92
72061  29.579834 41.177.98.121 -> 244.3.47.145 TCP 64 clariion-evr01 > mvx-lm [FIN, ACK] Seq=93 Ack=284 Win=49680 Len=0
72068  29.580467 41.177.98.121 -> 244.3.47.145 TCP 64 clariion-evr01 > mvx-lm [ACK] Seq=94 Ack=285 Win=49680 Len=0
324095 111.222894 41.177.98.121 -> 244.3.47.239 TCP 66 clariion-evr01 > dellwebadmin-1 [SYN, ACK] Seq=0 Ack=1 Win=49680 Len=0 MSS=1460 SACK_PERM=1
324099 111.223482 41.177.98.121 -> 244.3.47.239 TCP 64 clariion-evr01 > dellwebadmin-1 [ACK] Seq=1 Ack=344 Win=49337 Len=0
324118 111.230682 41.177.98.121 -> 244.3.47.239 TCP 240 clariion-evr01 > dellwebadmin-1 [PSH, ACK] Seq=1 Ack=344 Win=49680 Len=182
324122 111.231559 41.177.98.121 -> 244.3.47.239 TCP 1074 clariion-evr01 > dellwebadmin-1 [FIN, PSH, ACK] Seq=183 Ack=344 Win=49680 Len=1016
324125 111.232713 41.177.98.121 -> 244.3.47.239 TCP 64 clariion-evr01 > dellwebadmin-1 [ACK] Seq=1200 Ack=345 Win=49680 Len=0
333510 116.608855 41.177.98.121 -> 41.177.230.224 TCP 70 65176 > smtp [SYN] Seq=0 Win=49640 Len=0 MSS=1460 WS=1 SACK_PERM=1
333515 116.609719 41.177.98.121 -> 41.177.230.224 TCP 64 65176 > smtp [ACK] Seq=1 Ack=1 Win=49640 Len=0
333538 116.630983 41.177.98.121 -> 41.177.230.224 TCP 64 ident > 62200 [RST, ACK] Seq=1 Ack=1 Win=0 Len=0
333550 116.639854 41.177.98.121 -> 41.177.230.224 TCP 64 65176 > smtp [ACK] Seq=1 Ack=101 Win=49640 Len=0
333553 116.640377 41.177.98.121 -> 41.177.230.224 TCP 89 [TCP segment of a reassembled PDU]
333558 116.640918 41.177.98.121 -> 41.177.230.224 TCP 64 65176 > smtp [ACK] Seq=32 Ack=325 Win=49640 Len=0
334669 117.013644 41.177.98.121 -> 41.177.230.224 TCP 64 [TCP segment of a reassembled PDU]
334672 117.014438 41.177.98.121 -> 41.177.230.224 TCP 64 65176 > smtp [ACK] Seq=56352 Ack=596 Win=49640 Len=0
334673 117.014521 41.177.98.121 -> 41.177.230.224 TCP 64 65176 > smtp [FIN, ACK] Seq=56352 Ack=596 Win=49640 Len=0
388025 129.572418 41.177.98.121 -> 244.3.47.145 TCP 66 clariion-evr01 > slp [SYN, ACK] Seq=0 Ack=1 Win=49680 Len=0 MSS=1460 SACK_PERM=1
388030 129.573123 41.177.98.121 -> 244.3.47.145 TCP 64 clariion-evr01 > slp [ACK] Seq=1 Ack=284 Win=49397 Len=0
388045 129.580534 41.177.98.121 -> 244.3.47.145 TCP 150 clariion-evr01 > slp [PSH, ACK] Seq=1 Ack=284 Win=49680 Len=92
388046 129.580649 41.177.98.121 -> 244.3.47.145 TCP 64 clariion-evr01 > slp [FIN, ACK] Seq=93 Ack=284 Win=49680 Len=0
388051 129.581351 41.177.98.121 -> 244.3.47.145 TCP 64 clariion-evr01 > slp [ACK] Seq=94 Ack=285 Win=49680 Len=0
606018 192.227748 41.177.98.121 -> 244.3.47.239 TCP 66 clariion-evr01 > ndm-server [SYN, ACK] Seq=0 Ack=1 Win=49680 Len=0 MSS=1460 SACK_PERM=1
606021 192.228415 41.177.98.121 -> 244.3.47.239 TCP 64 clariion-evr01 > ndm-server [ACK] Seq=1 Ack=344 Win=49337 Len=0
606027 192.231259 41.177.98.121 -> 244.3.47.239 TCP 246 clariion-evr01 > ndm-server [PSH, ACK] Seq=1 Ack=344 Win=49680 Len=188
606028 192.232238 41.177.98.121 -> 244.3.47.239 TCP 1247 clariion-evr01 > ndm-server [FIN, PSH, ACK] Seq=189 Ack=344 Win=49680 Len=1189
606031 192.233273 41.177.98.121 -> 244.3.47.239 TCP 64 clariion-evr01 > ndm-server [ACK] Seq=1379 Ack=345 Win=49680 Len=0
694378 219.650658 41.177.98.121 -> 18.141.176.39 TCP 64 56908 > 60014 [RST] Seq=1 Win=0 Len=0
719197 229.571447 41.177.98.121 -> 244.3.47.145 TCP 66 clariion-evr01 > rsvp-encap-1 [SYN, ACK] Seq=0 Ack=1 Win=49680 Len=0 MSS=1460 SACK_PERM=1
719201 229.572146 41.177.98.121 -> 244.3.47.145 TCP 64 clariion-evr01 > rsvp-encap-1 [ACK] Seq=1 Ack=284 Win=49397 Len=0
719241 229.581180 41.177.98.121 -> 244.3.47.145 TCP 150 clariion-evr01 > rsvp-encap-1 [PSH, ACK] Seq=1 Ack=284 Win=49680 Len=92
719242 229.581299 41.177.98.121 -> 244.3.47.145 TCP 64 clariion-evr01 > rsvp-encap-1 [FIN, ACK] Seq=93 Ack=284 Win=49680 Len=0
719247 229.582003 41.177.98.121 -> 244.3.47.145 TCP 64 clariion-evr01 > rsvp-encap-1 [ACK] Seq=94 Ack=285 Win=49680 Len=0
871358 288.219063 41.177.98.121 -> 244.3.47.239 TCP 66 clariion-evr01 > dwf [SYN, ACK] Seq=0 Ack=1 Win=49680 Len=0 MSS=1460 SACK_PERM=1
871364 288.219833 41.177.98.121 -> 244.3.47.239 TCP 64 clariion-evr01 > dwf [ACK] Seq=1 Ack=344 Win=49337 Len=0
871448 288.232012 41.177.98.121 -> 244.3.47.239 TCP 246 clariion-evr01 > dwf [PSH, ACK] Seq=1 Ack=344 Win=49680 Len=188
871452 288.232995 41.177.98.121 -> 244.3.47.239 TCP 1247 clariion-evr01 > dwf [FIN, PSH, ACK] Seq=189 Ack=344 Win=49680 Len=1189
871460 288.234089 41.177.98.121 -> 244.3.47.239 TCP 64 clariion-evr01 > dwf [ACK] Seq=1379 Ack=345 Win=49680 Len=0
997985 333.571091 41.177.98.121 -> 244.3.47.145 TCP 66 clariion-evr01 > psmond [SYN, ACK] Seq=0 Ack=1 Win=49680 Len=0 MSS=1460 SACK_PERM=1
997992 333.571653 41.177.98.121 -> 244.3.47.145 TCP 64 clariion-evr01 > psmond [ACK] Seq=1 Ack=284 Win=49397 Len=0
998058 333.582263 41.177.98.121 -> 244.3.47.145 TCP 150 clariion-evr01 > psmond [PSH, ACK] Seq=1 Ack=284 Win=49680 Len=92
998060 333.582382 41.177.98.121 -> 244.3.47.145 TCP 64 clariion-evr01 > psmond [FIN, ACK] Seq=93 Ack=284 Win=49680 Len=0
998069 333.583130 41.177.98.121 -> 244.3.47.145 TCP 64 clariion-evr01 > psmond [ACK] Seq=94 Ack=285 Win=49680 Len=0
