145689  49.929442 41.177.150.80 -> 244.3.41.84  TCP 70 56584 > telnet [SYN] Seq=0 Win=8192 Len=0 MSS=1380 WS=4 SACK_PERM=1
145694  49.931126 41.177.150.80 -> 244.3.41.84  TCP 64 56584 > telnet [ACK] Seq=1 Ack=1 Win=16560 Len=0
146190  50.137143 41.177.150.80 -> 244.3.41.84  TCP 64 56584 > telnet [ACK] Seq=33 Ack=49 Win=16512 Len=0
146677  50.341747 41.177.150.80 -> 244.3.41.84  TCP 64 56584 > telnet [ACK] Seq=41 Ack=121 Win=16440 Len=0
147257  50.542623 41.177.150.80 -> 244.3.41.84  TCP 64 56584 > telnet [ACK] Seq=169 Ack=144 Win=16416 Len=0
147860  50.761070 41.177.150.80 -> 244.3.41.84  TCP 64 56584 > telnet [ACK] Seq=297 Ack=177 Win=16384 Len=0
148387  50.963834 41.177.150.80 -> 244.3.41.84  TCP 64 56584 > telnet [ACK] Seq=297 Ack=1134 Win=15424 Len=0
157916  53.792684 41.177.150.80 -> 244.3.41.84  TCP 64 56584 > telnet [ACK] Seq=307 Ack=2523 Win=16560 Len=0
171619  57.089155 41.177.150.80 -> 244.3.41.84  TCP 64 56584 > telnet [ACK] Seq=325 Ack=5356 Win=16560 Len=0
451008 146.794567 41.177.150.80 -> 244.3.41.84  TCP 64 56584 > telnet [ACK] Seq=910 Ack=40132 Win=16560 Len=0
