36672  15.323130 41.177.26.254 -> 156.224.224.186 TCP 82 38044 > hdl-srv [SYN] Seq=0 Win=32850 Len=0 MSS=1460 TSval=1509546990 TSecr=0 WS=8 SACK_PERM=1
36747  15.358251 41.177.26.254 -> 156.224.224.186 TCP 70 38044 > hdl-srv [ACK] Seq=1 Ack=1 Win=263536 Len=0 TSval=1509546994 TSecr=2349161478
36976  15.424679 41.177.26.254 -> 156.224.224.186 TCP 90 38044 > hdl-srv [PSH, ACK] Seq=1 Ack=1 Win=263536 Len=20 TSval=1509547001 TSecr=2349161478
37084  15.459909 41.177.26.254 -> 156.224.224.186 TCP 123 38044 > hdl-srv [PSH, ACK] Seq=21 Ack=1 Win=263536 Len=53 TSval=1509547004 TSecr=2349161503
37160  15.498962 41.177.26.254 -> 156.224.224.186 TCP 70 38044 > hdl-srv [ACK] Seq=74 Ack=21 Win=263536 Len=0 TSval=1509547008 TSecr=2349161513
37162  15.499152 41.177.26.254 -> 156.224.224.186 TCP 70 38044 > hdl-srv [ACK] Seq=74 Ack=630 Win=263536 Len=0 TSval=1509547008 TSecr=2349161513
37169  15.505861 41.177.26.254 -> 156.224.224.186 TCP 70 38044 > hdl-srv [FIN, ACK] Seq=74 Ack=630 Win=263536 Len=0 TSval=1509547009 TSecr=2349161513
609507 193.562716 41.177.26.254 -> 41.177.98.176 TCP 82 38137 > http [SYN] Seq=0 Win=32850 Len=0 MSS=1460 TSval=1509564814 TSecr=0 WS=8 SACK_PERM=1
609508 193.562721 41.177.26.254 -> 41.177.98.176 TCP 82 [TCP Out-Of-Order] 38137 > http [SYN] Seq=0 Win=32850 Len=0 MSS=1460 TSval=1509564814 TSecr=0 WS=8 SACK_PERM=1
609514 193.563218 41.177.26.254 -> 41.177.98.176 TCP 70 38137 > http [ACK] Seq=1 Ack=1 Win=263536 Len=0 TSval=1509564814 TSecr=1559915
609515 193.563223 41.177.26.254 -> 41.177.98.176 TCP 70 [TCP Dup ACK 609514#1] 38137 > http [ACK] Seq=1 Ack=1 Win=263536 Len=0 TSval=1509564814 TSecr=1559915
609543 193.564955 41.177.26.254 -> 41.177.98.176 TCP 70 38137 > http [ACK] Seq=177 Ack=310 Win=263536 Len=0 TSval=1509564814 TSecr=1559916
609544 193.564960 41.177.26.254 -> 41.177.98.176 TCP 70 [TCP Dup ACK 609543#1] 38137 > http [ACK] Seq=177 Ack=310 Win=263536 Len=0 TSval=1509564814 TSecr=1559916
609550 193.565238 41.177.26.254 -> 41.177.98.176 TCP 70 38137 > http [ACK] Seq=177 Ack=1758 Win=262088 Len=0 TSval=1509564814 TSecr=1559916
609551 193.565242 41.177.26.254 -> 41.177.98.176 TCP 70 [TCP Dup ACK 609550#1] 38137 > http [ACK] Seq=177 Ack=1758 Win=262088 Len=0 TSval=1509564814 TSecr=1559916
609556 193.565486 41.177.26.254 -> 41.177.98.176 TCP 70 38137 > http [ACK] Seq=177 Ack=4654 Win=259192 Len=0 TSval=1509564814 TSecr=1559916
609557 193.565490 41.177.26.254 -> 41.177.98.176 TCP 70 [TCP Dup ACK 609556#1] 38137 > http [ACK] Seq=177 Ack=4654 Win=259192 Len=0 TSval=1509564814 TSecr=1559916
609563 193.565767 41.177.26.254 -> 41.177.98.176 TCP 70 38137 > http [ACK] Seq=177 Ack=8502 Win=263536 Len=0 TSval=1509564814 TSecr=1559916
609564 193.565772 41.177.26.254 -> 41.177.98.176 TCP 70 [TCP Dup ACK 609563#1] 38137 > http [ACK] Seq=177 Ack=8502 Win=263536 Len=0 TSval=1509564814 TSecr=1559916
609795 193.616917 41.177.26.254 -> 41.177.98.176 TCP 70 38137 > http [ACK] Seq=177 Ack=11089 Win=263536 Len=0 TSval=1509564820 TSecr=1559916
609796 193.616921 41.177.26.254 -> 41.177.98.176 TCP 70 [TCP Dup ACK 609795#1] 38137 > http [ACK] Seq=177 Ack=11089 Win=263536 Len=0 TSval=1509564820 TSecr=1559916
669399 208.572840 41.177.26.254 -> 41.177.98.176 TCP 70 38137 > http [ACK] Seq=177 Ack=11090 Win=263536 Len=0 TSval=1509566315 TSecr=1561417
669400 208.572843 41.177.26.254 -> 41.177.98.176 TCP 70 [TCP Dup ACK 669399#1] 38137 > http [ACK] Seq=177 Ack=11090 Win=263536 Len=0 TSval=1509566315 TSecr=1561417
669547 208.597150 41.177.26.254 -> 41.177.98.176 TCP 70 38137 > http [FIN, ACK] Seq=177 Ack=11090 Win=263536 Len=0 TSval=1509566318 TSecr=1561417
669548 208.597154 41.177.26.254 -> 41.177.98.176 TCP 70 [TCP Out-Of-Order] 38137 > http [FIN, ACK] Seq=177 Ack=11090 Win=263536 Len=0 TSval=1509566318 TSecr=1561417
720801 230.066425 41.177.26.254 -> 41.177.98.176 TCP 82 38148 > http [SYN] Seq=0 Win=32850 Len=0 MSS=1460 TSval=1509568464 TSecr=0 WS=8 SACK_PERM=1
720802 230.066430 41.177.26.254 -> 41.177.98.176 TCP 82 [TCP Out-Of-Order] 38148 > http [SYN] Seq=0 Win=32850 Len=0 MSS=1460 TSval=1509568464 TSecr=0 WS=8 SACK_PERM=1
720812 230.066920 41.177.26.254 -> 41.177.98.176 TCP 70 38148 > http [ACK] Seq=1 Ack=1 Win=263536 Len=0 TSval=1509568464 TSecr=1563566
720813 230.066924 41.177.26.254 -> 41.177.98.176 TCP 70 [TCP Dup ACK 720812#1] 38148 > http [ACK] Seq=1 Ack=1 Win=263536 Len=0 TSval=1509568464 TSecr=1563566
720821 230.068551 41.177.26.254 -> 41.177.98.176 TCP 70 38148 > http [ACK] Seq=177 Ack=310 Win=263536 Len=0 TSval=1509568465 TSecr=1563566
720822 230.068556 41.177.26.254 -> 41.177.98.176 TCP 70 [TCP Dup ACK 720821#1] 38148 > http [ACK] Seq=177 Ack=310 Win=263536 Len=0 TSval=1509568465 TSecr=1563566
720826 230.068804 41.177.26.254 -> 41.177.98.176 TCP 70 38148 > http [ACK] Seq=177 Ack=1758 Win=262088 Len=0 TSval=1509568465 TSecr=1563566
720828 230.068811 41.177.26.254 -> 41.177.98.176 TCP 70 [TCP Dup ACK 720826#1] 38148 > http [ACK] Seq=177 Ack=1758 Win=262088 Len=0 TSval=1509568465 TSecr=1563566
720832 230.069048 41.177.26.254 -> 41.177.98.176 TCP 70 38148 > http [ACK] Seq=177 Ack=4654 Win=259192 Len=0 TSval=1509568465 TSecr=1563566
720834 230.069056 41.177.26.254 -> 41.177.98.176 TCP 70 [TCP Dup ACK 720832#1] 38148 > http [ACK] Seq=177 Ack=4654 Win=259192 Len=0 TSval=1509568465 TSecr=1563566
720839 230.069300 41.177.26.254 -> 41.177.98.176 TCP 70 38148 > http [ACK] Seq=177 Ack=7550 Win=262088 Len=0 TSval=1509568465 TSecr=1563566
720841 230.069309 41.177.26.254 -> 41.177.98.176 TCP 70 [TCP Dup ACK 720839#1] 38148 > http [ACK] Seq=177 Ack=7550 Win=262088 Len=0 TSval=1509568465 TSecr=1563566
720846 230.069670 41.177.26.254 -> 41.177.98.176 TCP 70 38148 > http [ACK] Seq=177 Ack=9950 Win=262088 Len=0 TSval=1509568465 TSecr=1563566
720847 230.069674 41.177.26.254 -> 41.177.98.176 TCP 70 [TCP Dup ACK 720846#1] 38148 > http [ACK] Seq=177 Ack=9950 Win=262088 Len=0 TSval=1509568465 TSecr=1563566
721102 230.177342 41.177.26.254 -> 41.177.98.176 TCP 70 38148 > http [ACK] Seq=177 Ack=11089 Win=263536 Len=0 TSval=1509568476 TSecr=1563566
721103 230.177347 41.177.26.254 -> 41.177.98.176 TCP 70 [TCP Dup ACK 721102#1] 38148 > http [ACK] Seq=177 Ack=11089 Win=263536 Len=0 TSval=1509568476 TSecr=1563566
759948 245.071597 41.177.26.254 -> 41.177.98.176 TCP 70 38148 > http [ACK] Seq=177 Ack=11090 Win=263536 Len=0 TSval=1509569965 TSecr=1565067
759949 245.071602 41.177.26.254 -> 41.177.98.176 TCP 70 [TCP Dup ACK 759948#1] 38148 > http [ACK] Seq=177 Ack=11090 Win=263536 Len=0 TSval=1509569965 TSecr=1565067
760010 245.097748 41.177.26.254 -> 41.177.98.176 TCP 70 38148 > http [FIN, ACK] Seq=177 Ack=11090 Win=263536 Len=0 TSval=1509569968 TSecr=1565067
760011 245.097753 41.177.26.254 -> 41.177.98.176 TCP 70 [TCP Out-Of-Order] 38148 > http [FIN, ACK] Seq=177 Ack=11090 Win=263536 Len=0 TSval=1509569968 TSecr=1565067
779615 251.708600 41.177.26.254 -> 41.177.98.176 TCP 82 38154 > http [SYN] Seq=0 Win=32850 Len=0 MSS=1460 TSval=1509570629 TSecr=0 WS=8 SACK_PERM=1
779616 251.708606 41.177.26.254 -> 41.177.98.176 TCP 82 [TCP Out-Of-Order] 38154 > http [SYN] Seq=0 Win=32850 Len=0 MSS=1460 TSval=1509570629 TSecr=0 WS=8 SACK_PERM=1
779619 251.708901 41.177.26.254 -> 41.177.98.176 TCP 70 38154 > http [ACK] Seq=1 Ack=1 Win=263536 Len=0 TSval=1509570629 TSecr=1565730
779620 251.708905 41.177.26.254 -> 41.177.98.176 TCP 70 [TCP Dup ACK 779619#1] 38154 > http [ACK] Seq=1 Ack=1 Win=263536 Len=0 TSval=1509570629 TSecr=1565730
779636 251.710497 41.177.26.254 -> 41.177.98.176 TCP 70 38154 > http [ACK] Seq=177 Ack=310 Win=263536 Len=0 TSval=1509570629 TSecr=1565730
779637 251.710502 41.177.26.254 -> 41.177.98.176 TCP 70 [TCP Dup ACK 779636#1] 38154 > http [ACK] Seq=177 Ack=310 Win=263536 Len=0 TSval=1509570629 TSecr=1565730
779642 251.710782 41.177.26.254 -> 41.177.98.176 TCP 70 38154 > http [ACK] Seq=177 Ack=1758 Win=262088 Len=0 TSval=1509570629 TSecr=1565730
779643 251.710786 41.177.26.254 -> 41.177.98.176 TCP 70 [TCP Dup ACK 779642#1] 38154 > http [ACK] Seq=177 Ack=1758 Win=262088 Len=0 TSval=1509570629 TSecr=1565730
779647 251.711023 41.177.26.254 -> 41.177.98.176 TCP 70 38154 > http [ACK] Seq=177 Ack=4654 Win=259192 Len=0 TSval=1509570629 TSecr=1565730
779649 251.711030 41.177.26.254 -> 41.177.98.176 TCP 70 [TCP Dup ACK 779647#1] 38154 > http [ACK] Seq=177 Ack=4654 Win=259192 Len=0 TSval=1509570629 TSecr=1565730
779654 251.711291 41.177.26.254 -> 41.177.98.176 TCP 70 38154 > http [ACK] Seq=177 Ack=7550 Win=262088 Len=0 TSval=1509570629 TSecr=1565730
779655 251.711295 41.177.26.254 -> 41.177.98.176 TCP 70 [TCP Dup ACK 779654#1] 38154 > http [ACK] Seq=177 Ack=7550 Win=262088 Len=0 TSval=1509570629 TSecr=1565730
779661 251.711618 41.177.26.254 -> 41.177.98.176 TCP 70 38154 > http [ACK] Seq=177 Ack=10446 Win=262088 Len=0 TSval=1509570629 TSecr=1565730
779662 251.711623 41.177.26.254 -> 41.177.98.176 TCP 70 [TCP Dup ACK 779661#1] 38154 > http [ACK] Seq=177 Ack=10446 Win=262088 Len=0 TSval=1509570629 TSecr=1565730
779872 251.817633 41.177.26.254 -> 41.177.98.176 TCP 70 38154 > http [ACK] Seq=177 Ack=11089 Win=263536 Len=0 TSval=1509570640 TSecr=1565731
779873 251.817637 41.177.26.254 -> 41.177.98.176 TCP 70 [TCP Dup ACK 779872#1] 38154 > http [ACK] Seq=177 Ack=11089 Win=263536 Len=0 TSval=1509570640 TSecr=1565731
800954 261.760138 41.177.26.254 -> 41.177.98.176 TCP 70 38154 > http [ACK] Seq=353 Ack=12845 Win=262088 Len=0 TSval=1509571634 TSecr=1566735
800955 261.760142 41.177.26.254 -> 41.177.98.176 TCP 70 [TCP Dup ACK 800954#1] 38154 > http [ACK] Seq=353 Ack=12845 Win=262088 Len=0 TSval=1509571634 TSecr=1566735
800960 261.760371 41.177.26.254 -> 41.177.98.176 TCP 70 38154 > http [ACK] Seq=353 Ack=15741 Win=259192 Len=0 TSval=1509571634 TSecr=1566735
800961 261.760375 41.177.26.254 -> 41.177.98.176 TCP 70 [TCP Dup ACK 800960#1] 38154 > http [ACK] Seq=353 Ack=15741 Win=259192 Len=0 TSval=1509571634 TSecr=1566735
800966 261.760580 41.177.26.254 -> 41.177.98.176 TCP 70 38154 > http [ACK] Seq=353 Ack=18637 Win=256296 Len=0 TSval=1509571634 TSecr=1566735
800967 261.760585 41.177.26.254 -> 41.177.98.176 TCP 70 [TCP Dup ACK 800966#1] 38154 > http [ACK] Seq=353 Ack=18637 Win=256296 Len=0 TSval=1509571634 TSecr=1566735
800972 261.760803 41.177.26.254 -> 41.177.98.176 TCP 70 38154 > http [ACK] Seq=353 Ack=21037 Win=262088 Len=0 TSval=1509571634 TSecr=1566735
800973 261.760807 41.177.26.254 -> 41.177.98.176 TCP 70 [TCP Dup ACK 800972#1] 38154 > http [ACK] Seq=353 Ack=21037 Win=262088 Len=0 TSval=1509571634 TSecr=1566735
801118 261.859768 41.177.26.254 -> 41.177.98.176 TCP 70 38154 > http [ACK] Seq=353 Ack=22176 Win=263536 Len=0 TSval=1509571644 TSecr=1566735
801119 261.859773 41.177.26.254 -> 41.177.98.176 TCP 70 [TCP Dup ACK 801118#1] 38154 > http [ACK] Seq=353 Ack=22176 Win=263536 Len=0 TSval=1509571644 TSecr=1566735
842229 276.760331 41.177.26.254 -> 41.177.98.176 TCP 70 38154 > http [ACK] Seq=353 Ack=22177 Win=263536 Len=0 TSval=1509573134 TSecr=1568236
842230 276.760337 41.177.26.254 -> 41.177.98.176 TCP 70 [TCP Dup ACK 842229#1] 38154 > http [ACK] Seq=353 Ack=22177 Win=263536 Len=0 TSval=1509573134 TSecr=1568236
852599 281.778198 41.177.26.254 -> 41.177.98.176 TCP 70 38154 > http [FIN, ACK] Seq=353 Ack=22177 Win=263536 Len=0 TSval=1509573636 TSecr=1568236
852600 281.778203 41.177.26.254 -> 41.177.98.176 TCP 70 [TCP Out-Of-Order] 38154 > http [FIN, ACK] Seq=353 Ack=22177 Win=263536 Len=0 TSval=1509573636 TSecr=1568236
