8383   2.987543 41.177.98.142 -> 142.106.89.160 TCP 70 http > 50035 [SYN, ACK] Seq=0 Ack=1 Win=32850 Len=0 MSS=1460 WS=2 SACK_PERM=1
8814   3.141643 41.177.98.142 -> 142.106.89.160 TCP 64 http > 50035 [ACK] Seq=1 Ack=258 Win=65700 Len=0
20898   6.922046 41.177.98.142 -> 142.225.177.22 TCP 82 http > 11749 [SYN, ACK] Seq=0 Ack=1 Win=33304 Len=0 TSval=1541251 TSecr=896864506 MSS=1460 WS=2 SACK_PERM=1
21186   7.161963 41.177.98.142 -> 142.225.177.22 TCP 70 http > 11749 [ACK] Seq=1 Ack=265 Win=66344 Len=0 TSval=1541275 TSecr=896864742
47162  19.519715 41.177.98.142 -> 142.106.89.160 TCP 64 http > 50035 [FIN, ACK] Seq=7588 Ack=258 Win=65700 Len=0
57937  23.579538 41.177.98.142 -> 142.225.177.22 TCP 70 http > 11749 [FIN, ACK] Seq=7595 Ack=265 Win=66608 Len=0 TSval=1542917 TSecr=896866642
59011  23.819153 41.177.98.142 -> 142.225.177.22 TCP 70 http > 11749 [ACK] Seq=7596 Ack=266 Win=66608 Len=0 TSval=1542940 TSecr=896881070
158483  53.968913 41.177.98.142 -> 16.57.156.160 TCP 70 http > 51550 [SYN, ACK] Seq=0 Ack=1 Win=33396 Len=0 MSS=1460 WS=2 SACK_PERM=1
159075  54.161738 41.177.98.142 -> 16.57.156.160 TCP 64 http > 51550 [ACK] Seq=1 Ack=259 Win=66792 Len=0
205253  70.557752 41.177.98.142 -> 16.57.156.160 TCP 64 http > 51550 [FIN, ACK] Seq=7526 Ack=259 Win=66792 Len=0
205889  70.730178 41.177.98.142 -> 16.57.156.160 TCP 64 http > 51550 [ACK] Seq=7527 Ack=260 Win=66792 Len=0
336487 117.544826 41.177.98.142 -> 41.177.230.224 TCP 78 58642 > smtp [SYN] Seq=0 Win=5840 Len=0 MSS=1460 SACK_PERM=1 TSval=1381367384 TSecr=0 WS=4
336489 117.545549 41.177.98.142 -> 41.177.230.224 TCP 70 58642 > smtp [ACK] Seq=1 Ack=1 Win=5840 Len=0 TSval=1381367385 TSecr=3195985894
354805 120.868240 41.177.98.142 -> 75.116.185.145 TCP 66 http > seispoc [SYN, ACK] Seq=0 Ack=1 Win=64240 Len=0 MSS=1460 SACK_PERM=1
355468 121.219649 41.177.98.142 -> 75.116.185.145 TCP 64 http > seispoc [ACK] Seq=1 Ack=262 Win=64240 Len=0
358941 122.569878 41.177.98.142 -> 41.177.230.224 TCP 70 58642 > smtp [ACK] Seq=1 Ack=101 Win=5840 Len=0 TSval=1381372409 TSecr=3195986397
359812 122.851998 41.177.98.142 -> 41.177.230.224 TCP 70 58642 > smtp [FIN, ACK] Seq=67731 Ack=545 Win=7984 Len=0 TSval=1381372691 TSecr=3195986425
359822 122.855598 41.177.98.142 -> 41.177.230.224 TCP 64 58642 > smtp [RST] Seq=67732 Win=0 Len=0
412633 137.615303 41.177.98.142 -> 75.116.185.145 TCP 64 http > seispoc [FIN, ACK] Seq=7529 Ack=262 Win=64240 Len=0
667909 208.155389 41.177.98.142 -> 90.224.98.55 TCP 70 http > 63604 [SYN, ACK] Seq=0 Ack=1 Win=33390 Len=0 MSS=1460 WS=2 SACK_PERM=1
669671 208.632616 41.177.98.142 -> 90.224.98.55 TCP 64 http > 63604 [ACK] Seq=1 Ack=275 Win=66780 Len=0
673988 210.380721 41.177.98.142 -> 90.224.98.55 TCP 64 http > 63604 [ACK] Seq=7579 Ack=276 Win=66780 Len=0
722349 230.792123 41.177.98.142 -> 41.177.230.224 TCP 70 http > 62441 [SYN, ACK] Seq=0 Ack=1 Win=32850 Len=0 MSS=1460 WS=2 SACK_PERM=1
722352 230.792909 41.177.98.142 -> 41.177.230.224 TCP 64 http > 62441 [ACK] Seq=1 Ack=80 Win=65620 Len=0
727537 233.343065 41.177.98.142 -> 16.57.156.160 TCP 70 http > 53178 [SYN, ACK] Seq=0 Ack=1 Win=33396 Len=0 MSS=1460 WS=2 SACK_PERM=1
728101 233.635690 41.177.98.142 -> 16.57.156.160 TCP 64 http > 53178 [ACK] Seq=1 Ack=259 Win=66792 Len=0
761866 245.811353 41.177.98.142 -> 41.177.230.224 TCP 64 http > 62441 [FIN, ACK] Seq=3944 Ack=80 Win=65700 Len=0
763033 246.263923 41.177.98.142 -> 41.177.43.100 TCP 66 http > cc-tracking [SYN, ACK] Seq=0 Ack=1 Win=65520 Len=0 MSS=1460 SACK_PERM=1
763050 246.265203 41.177.98.142 -> 41.177.43.100 TCP 64 http > cc-tracking [ACK] Seq=1 Ack=537 Win=64984 Len=0
763051 246.265224 41.177.98.142 -> 41.177.43.100 TCP 64 http > cc-tracking [ACK] Seq=1 Ack=807 Win=64714 Len=0
763114 246.285946 41.177.98.142 -> 41.177.43.100 TCP 64 http > cc-tracking [ACK] Seq=4003 Ack=1622 Win=64705 Len=0
763127 246.288270 41.177.98.142 -> 41.177.43.100 TCP 66 http > wired [SYN, ACK] Seq=0 Ack=1 Win=65520 Len=0 MSS=1460 SACK_PERM=1
763148 246.296024 41.177.98.142 -> 41.177.43.100 TCP 64 http > wired [ACK] Seq=1 Ack=537 Win=64984 Len=0
763186 246.306543 41.177.98.142 -> 41.177.43.100 TCP 64 http > wired [ACK] Seq=1 Ack=843 Win=64678 Len=0
763194 246.307512 41.177.98.142 -> 41.177.43.100 TCP 64 http > cc-tracking [ACK] Seq=9197 Ack=2465 Win=65520 Len=0
763212 246.309459 41.177.98.142 -> 41.177.43.100 TCP 66 http > 4872 [SYN, ACK] Seq=0 Ack=1 Win=65520 Len=0 MSS=1460 SACK_PERM=1
763222 246.311646 41.177.98.142 -> 41.177.43.100 TCP 64 http > 4872 [ACK] Seq=1 Ack=537 Win=64984 Len=0
763223 246.311681 41.177.98.142 -> 41.177.43.100 TCP 64 http > 4872 [ACK] Seq=1 Ack=842 Win=64679 Len=0
763465 246.367098 41.177.98.142 -> 41.177.43.100 TCP 64 http > wired [ACK] Seq=3772 Ack=1630 Win=65520 Len=0
776374 250.011204 41.177.98.142 -> 16.57.156.160 TCP 64 http > 53178 [FIN, ACK] Seq=7526 Ack=259 Win=66792 Len=0
777012 250.363402 41.177.98.142 -> 16.57.156.160 TCP 64 http > 53178 [ACK] Seq=7527 Ack=260 Win=66792 Len=0
791607 257.303843 41.177.98.142 -> 41.177.43.100 TCP 64 http > cc-tracking [ACK] Seq=16353 Ack=3356 Win=64629 Len=0
794013 258.656075 41.177.98.142 -> 41.177.43.100 TCP 64 [TCP segment of a reassembled PDU]
794021 258.664060 41.177.98.142 -> 41.177.43.100 TCP 64 http > 4872 [ACK] Seq=795 Ack=1711 Win=65520 Len=0
794026 258.666552 41.177.98.142 -> 41.177.43.100 TCP 64 http > wired [ACK] Seq=4065 Ack=2505 Win=64645 Len=0
794049 258.674926 41.177.98.142 -> 41.177.43.100 TCP 64 http > cc-tracking [ACK] Seq=28846 Ack=4236 Win=65520 Len=0
794052 258.676014 41.177.98.142 -> 41.177.43.100 TCP 64 http > 4872 [ACK] Seq=1911 Ack=2594 Win=64637 Len=0
794057 258.676647 41.177.98.142 -> 41.177.43.100 TCP 66 http > 4874 [SYN, ACK] Seq=0 Ack=1 Win=65520 Len=0 MSS=1460 SACK_PERM=1
794059 258.677076 41.177.98.142 -> 41.177.43.100 TCP 66 http > 4875 [SYN, ACK] Seq=0 Ack=1 Win=65520 Len=0 MSS=1460 SACK_PERM=1
794068 258.678398 41.177.98.142 -> 41.177.43.100 TCP 66 http > tritium-can [SYN, ACK] Seq=0 Ack=1 Win=65520 Len=0 MSS=1460 SACK_PERM=1
794080 258.679513 41.177.98.142 -> 41.177.43.100 TCP 64 http > 4875 [ACK] Seq=1 Ack=537 Win=64984 Len=0
794081 258.679542 41.177.98.142 -> 41.177.43.100 TCP 64 http > 4875 [ACK] Seq=1 Ack=877 Win=64644 Len=0
794087 258.680201 41.177.98.142 -> 41.177.43.100 TCP 64 http > 4874 [ACK] Seq=1 Ack=537 Win=64984 Len=0
794090 258.680533 41.177.98.142 -> 41.177.43.100 TCP 64 http > 4874 [ACK] Seq=1 Ack=877 Win=64644 Len=0
794096 258.681229 41.177.98.142 -> 41.177.43.100 TCP 64 http > tritium-can [ACK] Seq=1 Ack=537 Win=64984 Len=0
794098 258.681273 41.177.98.142 -> 41.177.43.100 TCP 64 http > tritium-can [ACK] Seq=1 Ack=879 Win=64642 Len=0
794211 258.709206 41.177.98.142 -> 41.177.43.100 TCP 64 http > wired [ACK] Seq=5166 Ack=3396 Win=65520 Len=0
804819 263.023919 41.177.98.142 -> 41.177.230.224 TCP 64 http > 62441 [ACK] Seq=3945 Ack=81 Win=65700 Len=0
835955 273.680349 41.177.98.142 -> 41.177.43.100 TCP 64 http > 4872 [FIN, ACK] Seq=2817 Ack=2594 Win=64637 Len=0
835956 273.680441 41.177.98.142 -> 41.177.43.100 TCP 64 http > 4875 [FIN, ACK] Seq=710 Ack=877 Win=64644 Len=0
835971 273.690359 41.177.98.142 -> 41.177.43.100 TCP 64 http > tritium-can [FIN, ACK] Seq=1563 Ack=879 Win=64642 Len=0
835972 273.690364 41.177.98.142 -> 41.177.43.100 TCP 64 http > 4874 [FIN, ACK] Seq=721 Ack=877 Win=64644 Len=0
836065 273.710340 41.177.98.142 -> 41.177.43.100 TCP 64 http > wired [FIN, ACK] Seq=6288 Ack=3396 Win=65520 Len=0
836076 273.720311 41.177.98.142 -> 41.177.43.100 TCP 64 http > cc-tracking [FIN, ACK] Seq=29965 Ack=4236 Win=65520 Len=0
842217 276.758915 41.177.98.142 -> 41.177.43.100 TCP 64 http > cc-tracking [ACK] Seq=29966 Ack=4237 Win=65520 Len=0
842220 276.759232 41.177.98.142 -> 41.177.43.100 TCP 64 http > wired [ACK] Seq=6289 Ack=3397 Win=65520 Len=0
842221 276.759258 41.177.98.142 -> 41.177.43.100 TCP 64 http > 4874 [ACK] Seq=722 Ack=878 Win=64644 Len=0
842222 276.759296 41.177.98.142 -> 41.177.43.100 TCP 64 http > 4875 [ACK] Seq=711 Ack=878 Win=64644 Len=0
842225 276.759594 41.177.98.142 -> 41.177.43.100 TCP 64 http > 4872 [ACK] Seq=2818 Ack=2595 Win=64637 Len=0
842226 276.759621 41.177.98.142 -> 41.177.43.100 TCP 64 http > tritium-can [ACK] Seq=1564 Ack=880 Win=64642 Len=0
842232 276.760820 41.177.98.142 -> 41.177.43.100 TCP 66 http > 4878 [SYN, ACK] Seq=0 Ack=1 Win=65520 Len=0 MSS=1460 SACK_PERM=1
842300 276.811175 41.177.98.142 -> 41.177.43.100 TCP 64 http > 4878 [ACK] Seq=1 Ack=537 Win=64984 Len=0
842302 276.811526 41.177.98.142 -> 41.177.43.100 TCP 64 http > 4878 [ACK] Seq=1 Ack=1073 Win=64448 Len=0
842690 276.910348 41.177.98.142 -> 41.177.43.100 TCP 64 http > 4878 [ACK] Seq=1 Ack=1209 Win=64312 Len=0
842984 277.022129 41.177.98.142 -> 41.177.43.100 TCP 64 [TCP segment of a reassembled PDU]
843026 277.036645 41.177.98.142 -> 41.177.43.100 TCP 64 http > 4878 [ACK] Seq=13167 Ack=2281 Win=63240 Len=0
855071 282.636245 41.177.98.142 -> 41.177.43.100 TCP 64 http > 4878 [ACK] Seq=14134 Ack=3439 Win=64448 Len=0
855332 282.733258 41.177.98.142 -> 41.177.43.100 TCP 64 http > 4878 [ACK] Seq=14134 Ack=3847 Win=65520 Len=0
855644 282.822284 41.177.98.142 -> 41.177.43.100 TCP 64 [TCP segment of a reassembled PDU]
903073 297.879481 41.177.98.142 -> 41.177.43.100 TCP 64 http > 4878 [FIN, ACK] Seq=27299 Ack=3847 Win=65520 Len=0
910703 301.166392 41.177.98.142 -> 41.177.43.100 TCP 64 http > 4878 [ACK] Seq=27300 Ack=3848 Win=65520 Len=0
910705 301.167102 41.177.98.142 -> 41.177.43.100 TCP 66 http > wsdl-event [SYN, ACK] Seq=0 Ack=1 Win=65520 Len=0 MSS=1460 SACK_PERM=1
910739 301.195952 41.177.98.142 -> 41.177.43.100 TCP 64 http > wsdl-event [ACK] Seq=1 Ack=537 Win=64984 Len=0
910740 301.195975 41.177.98.142 -> 41.177.43.100 TCP 64 http > wsdl-event [ACK] Seq=1 Ack=1073 Win=64448 Len=0
910923 301.299311 41.177.98.142 -> 41.177.43.100 TCP 64 http > wsdl-event [ACK] Seq=1 Ack=1483 Win=65520 Len=0
911344 301.470554 41.177.98.142 -> 244.3.93.100 TCP 66 http > visionpyramid [SYN, ACK] Seq=0 Ack=1 Win=64860 Len=0 MSS=1460 SACK_PERM=1
911347 301.471633 41.177.98.142 -> 244.3.93.100 TCP 64 http > visionpyramid [ACK] Seq=1 Ack=1083 Win=63778 Len=0
911370 301.484338 41.177.98.142 -> 244.3.93.100 TCP 64 http > visionpyramid [ACK] Seq=170 Ack=1956 Win=64860 Len=0
911372 301.484724 41.177.98.142 -> 244.3.93.100 TCP 66 http > hermes [SYN, ACK] Seq=0 Ack=1 Win=64860 Len=0 MSS=1460 SACK_PERM=1
911375 301.485236 41.177.98.142 -> 244.3.93.100 TCP 66 http > mesavistaco [SYN, ACK] Seq=0 Ack=1 Win=64860 Len=0 MSS=1460 SACK_PERM=1
911383 301.485980 41.177.98.142 -> 244.3.93.100 TCP 64 http > hermes [ACK] Seq=1 Ack=884 Win=63977 Len=0
911384 301.486021 41.177.98.142 -> 244.3.93.100 TCP 64 http > mesavistaco [ACK] Seq=1 Ack=887 Win=63974 Len=0
911712 301.606312 41.177.98.142 -> 41.177.43.100 TCP 64 [TCP segment of a reassembled PDU]
911742 301.616167 41.177.98.142 -> 41.177.43.100 TCP 64 http > wsdl-event [ACK] Seq=19038 Ack=2555 Win=64448 Len=0
911750 301.616965 41.177.98.142 -> 41.177.43.100 TCP 66 http > 4881 [SYN, ACK] Seq=0 Ack=1 Win=65520 Len=0 MSS=1460 SACK_PERM=1
911776 301.622618 41.177.98.142 -> 41.177.43.100 TCP 64 http > 4881 [ACK] Seq=1 Ack=537 Win=64984 Len=0
911779 301.622966 41.177.98.142 -> 41.177.43.100 TCP 64 http > 4881 [ACK] Seq=1 Ack=1073 Win=64448 Len=0
911792 301.623784 41.177.98.142 -> 41.177.43.100 TCP 66 http > 4882 [SYN, ACK] Seq=0 Ack=1 Win=65520 Len=0 MSS=1460 SACK_PERM=1
911806 301.624184 41.177.98.142 -> 41.177.43.100 TCP 66 http > wmlserver [SYN, ACK] Seq=0 Ack=1 Win=65520 Len=0 MSS=1460 SACK_PERM=1
911852 301.630471 41.177.98.142 -> 41.177.43.100 TCP 66 http > hivestor [SYN, ACK] Seq=0 Ack=1 Win=65520 Len=0 MSS=1460 SACK_PERM=1
911891 301.662933 41.177.98.142 -> 41.177.43.100 TCP 66 http > abbs [SYN, ACK] Seq=0 Ack=1 Win=65520 Len=0 MSS=1460 SACK_PERM=1
911897 301.664371 41.177.98.142 -> 41.177.43.100 TCP 64 http > 4882 [ACK] Seq=1 Ack=537 Win=64984 Len=0
911898 301.664730 41.177.98.142 -> 41.177.43.100 TCP 64 http > 4882 [ACK] Seq=1 Ack=1073 Win=64448 Len=0
911902 301.665475 41.177.98.142 -> 41.177.43.100 TCP 64 http > wmlserver [ACK] Seq=1 Ack=537 Win=64984 Len=0
911903 301.665507 41.177.98.142 -> 41.177.43.100 TCP 64 http > wmlserver [ACK] Seq=1 Ack=1073 Win=64448 Len=0
911908 301.666289 41.177.98.142 -> 41.177.43.100 TCP 64 http > hivestor [ACK] Seq=1 Ack=537 Win=64984 Len=0
911909 301.666311 41.177.98.142 -> 41.177.43.100 TCP 64 http > hivestor [ACK] Seq=1 Ack=1073 Win=64448 Len=0
911918 301.667413 41.177.98.142 -> 41.177.43.100 TCP 64 http > 4881 [ACK] Seq=921 Ack=2234 Win=63287 Len=0
911929 301.668566 41.177.98.142 -> 41.177.43.100 TCP 64 http > abbs [ACK] Seq=1 Ack=537 Win=64984 Len=0
911931 301.668911 41.177.98.142 -> 41.177.43.100 TCP 64 http > abbs [ACK] Seq=1 Ack=1073 Win=64448 Len=0
911932 301.668932 41.177.98.142 -> 41.177.43.100 TCP 64 http > abbs [ACK] Seq=1 Ack=1153 Win=64368 Len=0
916326 304.209244 41.177.98.142 -> 244.3.93.100 TCP 64 http > visionpyramid [ACK] Seq=507 Ack=3920 Win=64860 Len=0
921154 305.573211 41.177.98.142 -> 244.3.93.100 TCP 64 http > mesavistaco [ACK] Seq=171 Ack=1813 Win=64860 Len=0
921156 305.573541 41.177.98.142 -> 244.3.93.100 TCP 64 http > hermes [ACK] Seq=170 Ack=1817 Win=64860 Len=0
921167 305.574427 41.177.98.142 -> 244.3.93.100 TCP 66 http > swldy-sias [SYN, ACK] Seq=0 Ack=1 Win=64860 Len=0 MSS=1460 SACK_PERM=1
921176 305.575418 41.177.98.142 -> 244.3.93.100 TCP 66 http > servergraph [SYN, ACK] Seq=0 Ack=1 Win=64860 Len=0 MSS=1460 SACK_PERM=1
921177 305.575464 41.177.98.142 -> 244.3.93.100 TCP 64 http > swldy-sias [ACK] Seq=1 Ack=918 Win=63943 Len=0
921185 305.575696 41.177.98.142 -> 244.3.93.100 TCP 66 http > bspne-pcc [SYN, ACK] Seq=0 Ack=1 Win=64860 Len=0 MSS=1460 SACK_PERM=1
921191 305.576501 41.177.98.142 -> 244.3.93.100 TCP 64 http > bspne-pcc [ACK] Seq=1 Ack=919 Win=63942 Len=0
921193 305.576557 41.177.98.142 -> 244.3.93.100 TCP 64 http > servergraph [ACK] Seq=1 Ack=926 Win=63935 Len=0
921300 305.629137 41.177.98.142 -> 244.3.93.100 TCP 64 http > visionpyramid [ACK] Seq=13005 Ack=4838 Win=64860 Len=0
954894 316.668909 41.177.98.142 -> 41.177.43.100 TCP 64 http > 4882 [FIN, ACK] Seq=557 Ack=1154 Win=64367 Len=0
954900 316.668996 41.177.98.142 -> 41.177.43.100 TCP 64 http > wsdl-event [FIN, ACK] Seq=19936 Ack=2639 Win=64364 Len=0
954902 316.669142 41.177.98.142 -> 41.177.43.100 TCP 64 http > 4881 [FIN, ACK] Seq=1501 Ack=2314 Win=65520 Len=0
954904 316.669151 41.177.98.142 -> 41.177.43.100 TCP 64 http > hivestor [FIN, ACK] Seq=477 Ack=1154 Win=64367 Len=0
954906 316.669159 41.177.98.142 -> 41.177.43.100 TCP 64 http > wmlserver [FIN, ACK] Seq=534 Ack=1154 Win=64367 Len=0
954943 316.678806 41.177.98.142 -> 41.177.43.100 TCP 64 http > abbs [FIN, ACK] Seq=547 Ack=1153 Win=65520 Len=0
963553 320.578639 41.177.98.142 -> 244.3.93.100 TCP 64 http > swldy-sias [FIN, ACK] Seq=170 Ack=918 Win=64860 Len=0
963554 320.578682 41.177.98.142 -> 244.3.93.100 TCP 64 http > mesavistaco [FIN, ACK] Seq=507 Ack=2735 Win=64860 Len=0
963566 320.588714 41.177.98.142 -> 244.3.93.100 TCP 64 http > hermes [FIN, ACK] Seq=506 Ack=2737 Win=64860 Len=0
963567 320.588898 41.177.98.142 -> 244.3.93.100 TCP 64 http > bspne-pcc [FIN, ACK] Seq=170 Ack=919 Win=64860 Len=0
963568 320.588902 41.177.98.142 -> 244.3.93.100 TCP 64 http > servergraph [FIN, ACK] Seq=170 Ack=926 Win=64860 Len=0
963722 320.638691 41.177.98.142 -> 244.3.93.100 TCP 64 http > visionpyramid [FIN, ACK] Seq=13173 Ack=4838 Win=64860 Len=0
980650 327.244690 41.177.98.142 -> 41.177.43.100 TCP 64 http > abbs [ACK] Seq=548 Ack=1154 Win=65520 Len=0
980652 327.244723 41.177.98.142 -> 41.177.43.100 TCP 64 http > hivestor [ACK] Seq=478 Ack=1155 Win=64367 Len=0
980655 327.244990 41.177.98.142 -> 41.177.43.100 TCP 64 http > 4881 [ACK] Seq=1502 Ack=2315 Win=65520 Len=0
980656 327.245014 41.177.98.142 -> 41.177.43.100 TCP 64 http > wmlserver [ACK] Seq=535 Ack=1155 Win=64367 Len=0
980657 327.245052 41.177.98.142 -> 41.177.43.100 TCP 64 http > 4882 [ACK] Seq=558 Ack=1155 Win=64367 Len=0
980659 327.245357 41.177.98.142 -> 41.177.43.100 TCP 64 http > wsdl-event [ACK] Seq=19937 Ack=2640 Win=64364 Len=0
997139 333.153816 41.177.98.142 -> 244.3.93.100 TCP 66 http > de-noc [SYN, ACK] Seq=0 Ack=1 Win=64860 Len=0 MSS=1460 SACK_PERM=1
997149 333.155042 41.177.98.142 -> 244.3.93.100 TCP 64 http > de-noc [ACK] Seq=1 Ack=1381 Win=63480 Len=0
997150 333.155064 41.177.98.142 -> 244.3.93.100 TCP 64 http > de-noc [ACK] Seq=1 Ack=1416 Win=63445 Len=0
997175 333.158184 41.177.98.142 -> 244.3.93.100 TCP 64 [TCP Window Update] http > de-noc [ACK] Seq=1 Ack=1416 Win=64860 Len=0
997902 333.556699 41.177.98.142 -> 244.3.93.100 TCP 66 http > de-cache-query [SYN, ACK] Seq=0 Ack=1 Win=64860 Len=0 MSS=1460 SACK_PERM=1
997903 333.556758 41.177.98.142 -> 244.3.93.100 TCP 66 http > de-server [SYN, ACK] Seq=0 Ack=1 Win=64860 Len=0 MSS=1460 SACK_PERM=1
997907 333.557402 41.177.98.142 -> 244.3.93.100 TCP 66 http > shockwave2 [SYN, ACK] Seq=0 Ack=1 Win=64860 Len=0 MSS=1460 SACK_PERM=1
997912 333.557801 41.177.98.142 -> 244.3.93.100 TCP 66 http > opennl [SYN, ACK] Seq=0 Ack=1 Win=64860 Len=0 MSS=1460 SACK_PERM=1
997917 333.558153 41.177.98.142 -> 244.3.93.100 TCP 64 http > de-cache-query [ACK] Seq=1 Ack=1215 Win=64860 Len=0
997919 333.558188 41.177.98.142 -> 244.3.93.100 TCP 64 http > de-server [ACK] Seq=1 Ack=1219 Win=64860 Len=0
997923 333.558513 41.177.98.142 -> 244.3.93.100 TCP 64 http > shockwave2 [ACK] Seq=1 Ack=1126 Win=63735 Len=0
997927 333.558949 41.177.98.142 -> 244.3.93.100 TCP 64 http > opennl [ACK] Seq=1 Ack=1126 Win=63735 Len=0
998093 333.587339 41.177.98.142 -> 244.3.93.100 TCP 64 [TCP segment of a reassembled PDU]
1017182 342.652293 41.177.98.142 -> 41.177.43.100 TCP 66 http > 4887 [SYN, ACK] Seq=0 Ack=1 Win=65520 Len=0 MSS=1460 SACK_PERM=1
1017186 342.654033 41.177.98.142 -> 41.177.43.100 TCP 64 http > 4887 [ACK] Seq=1 Ack=537 Win=64984 Len=0
1017188 342.654405 41.177.98.142 -> 41.177.43.100 TCP 64 http > 4887 [ACK] Seq=1 Ack=1073 Win=64448 Len=0
1017190 342.654769 41.177.98.142 -> 41.177.43.100 TCP 64 http > 4887 [ACK] Seq=1 Ack=1482 Win=64039 Len=0
1017196 342.657813 41.177.98.142 -> 41.177.43.100 TCP 64 [TCP Window Update] http > 4887 [ACK] Seq=1 Ack=1482 Win=65520 Len=0
1017531 342.903458 41.177.98.142 -> 41.177.43.100 TCP 64 [TCP segment of a reassembled PDU]
