470024 155.131938 41.177.98.38 -> 244.3.93.193 TCP 273 7110 > isoipsigport-1 [PSH, ACK] Seq=1 Ack=77 Win=49680 Len=215
470027 155.134029 41.177.98.38 -> 244.3.93.193 TCP 156 7110 > isoipsigport-1 [PSH, ACK] Seq=216 Ack=176 Win=49680 Len=98
470033 155.139661 41.177.98.38 -> 244.3.93.193 TCP 511 7110 > isoipsigport-1 [PSH, ACK] Seq=314 Ack=612 Win=49680 Len=453
470126 155.177921 41.177.98.38 -> 244.3.93.193 TCP 64 7110 > isoipsigport-1 [ACK] Seq=767 Ack=1105 Win=49680 Len=0
470479 155.330968 41.177.98.38 -> 244.3.93.193 TCP 543 7110 > isoipsigport-1 [PSH, ACK] Seq=767 Ack=1105 Win=49680 Len=485
492407 162.605574 41.177.98.38 -> 244.3.93.193 TCP 920 7110 > isoipsigport-1 [PSH, ACK] Seq=1252 Ack=1178 Win=49680 Len=862
497801 163.577261 41.177.98.38 -> 244.3.93.193 TCP 1417 7110 > isoipsigport-1 [PSH, ACK] Seq=2114 Ack=1250 Win=49680 Len=1359
499648 163.685011 41.177.98.38 -> 244.3.93.193 TCP 236 7110 > isoipsigport-1 [PSH, ACK] Seq=3473 Ack=1319 Win=49680 Len=178
832397 272.161851 41.177.98.38 -> 244.3.93.193 TCP 64 7110 > isoipsigport-1 [ACK] Seq=3651 Ack=4079 Win=46920 Len=0
832412 272.165365 41.177.98.38 -> 244.3.93.193 TCP 64 7110 > isoipsigport-1 [ACK] Seq=3651 Ack=8219 Win=49680 Len=0
832476 272.217653 41.177.98.38 -> 244.3.93.193 TCP 64 7110 > isoipsigport-1 [ACK] Seq=3651 Ack=9511 Win=49680 Len=0
832492 272.222370 41.177.98.38 -> 244.3.93.193 TCP 64 7110 > isoipsigport-1 [ACK] Seq=3651 Ack=14044 Win=49680 Len=0
832549 272.233616 41.177.98.38 -> 244.3.93.193 TCP 1438 7110 > isoipsigport-1 [ACK] Seq=3651 Ack=14044 Win=49680 Len=1380
832550 272.233621 41.177.98.38 -> 244.3.93.193 TCP 1438 7110 > isoipsigport-1 [ACK] Seq=5031 Ack=14044 Win=49680 Len=1380
832551 272.233637 41.177.98.38 -> 244.3.93.193 TCP 1438 7110 > isoipsigport-1 [ACK] Seq=6411 Ack=14044 Win=49680 Len=1380
832552 272.233660 41.177.98.38 -> 244.3.93.193 TCP 1438 7110 > isoipsigport-1 [ACK] Seq=7791 Ack=14044 Win=49680 Len=1380
832553 272.233682 41.177.98.38 -> 244.3.93.193 TCP 1438 7110 > isoipsigport-1 [ACK] Seq=9171 Ack=14044 Win=49680 Len=1380
832554 272.233707 41.177.98.38 -> 244.3.93.193 TCP 1438 7110 > isoipsigport-1 [ACK] Seq=10551 Ack=14044 Win=49680 Len=1380
832555 272.233727 41.177.98.38 -> 244.3.93.193 TCP 1438 7110 > isoipsigport-1 [ACK] Seq=11931 Ack=14044 Win=49680 Len=1380
832556 272.233751 41.177.98.38 -> 244.3.93.193 TCP 1438 7110 > isoipsigport-1 [ACK] Seq=13311 Ack=14044 Win=49680 Len=1380
832557 272.233772 41.177.98.38 -> 244.3.93.193 TCP 1438 7110 > isoipsigport-1 [ACK] Seq=14691 Ack=14044 Win=49680 Len=1380
832558 272.233776 41.177.98.38 -> 244.3.93.193 TCP 380 7110 > isoipsigport-1 [PSH, ACK] Seq=16071 Ack=14044 Win=49680 Len=322
832734 272.376612 41.177.98.38 -> 244.3.93.193 TCP 64 7110 > isoipsigport-1 [ACK] Seq=16393 Ack=19564 Win=44160 Len=0
832916 272.433295 41.177.98.38 -> 244.3.93.193 TCP 64 7110 > isoipsigport-1 [ACK] Seq=16393 Ack=22236 Win=49680 Len=0
832943 272.436800 41.177.98.38 -> 244.3.93.193 TCP 64 7110 > isoipsigport-1 [ACK] Seq=16393 Ack=24996 Win=46920 Len=0
833080 272.464680 41.177.98.38 -> 244.3.93.193 TCP 137 7110 > isoipsigport-1 [PSH, ACK] Seq=16393 Ack=26787 Win=49680 Len=79
833130 272.485642 41.177.98.38 -> 244.3.93.193 TCP 64 7110 > isoipsigport-1 [ACK] Seq=16472 Ack=30927 Win=45540 Len=0
833147 272.489273 41.177.98.38 -> 244.3.93.193 TCP 64 7110 > isoipsigport-1 [ACK] Seq=16472 Ack=34979 Win=49680 Len=0
833159 272.493924 41.177.98.38 -> 244.3.93.193 TCP 64 7110 > isoipsigport-1 [ACK] Seq=16472 Ack=39119 Win=45540 Len=0
833259 272.547646 41.177.98.38 -> 244.3.93.193 TCP 64 7110 > isoipsigport-1 [ACK] Seq=16472 Ack=39566 Win=49680 Len=0
837015 274.159919 41.177.98.38 -> 244.3.93.193 TCP 1438 7110 > isoipsigport-1 [ACK] Seq=16472 Ack=39566 Win=49680 Len=1380
837016 274.159943 41.177.98.38 -> 244.3.93.193 TCP 1438 7110 > isoipsigport-1 [ACK] Seq=17852 Ack=39566 Win=49680 Len=1380
837017 274.159965 41.177.98.38 -> 244.3.93.193 TCP 1438 7110 > isoipsigport-1 [ACK] Seq=19232 Ack=39566 Win=49680 Len=1380
837018 274.159988 41.177.98.38 -> 244.3.93.193 TCP 1438 7110 > isoipsigport-1 [ACK] Seq=20612 Ack=39566 Win=49680 Len=1380
837019 274.160010 41.177.98.38 -> 244.3.93.193 TCP 1438 7110 > isoipsigport-1 [ACK] Seq=21992 Ack=39566 Win=49680 Len=1380
837020 274.160032 41.177.98.38 -> 244.3.93.193 TCP 1438 7110 > isoipsigport-1 [ACK] Seq=23372 Ack=39566 Win=49680 Len=1380
837021 274.160055 41.177.98.38 -> 244.3.93.193 TCP 1438 7110 > isoipsigport-1 [ACK] Seq=24752 Ack=39566 Win=49680 Len=1380
837022 274.160078 41.177.98.38 -> 244.3.93.193 TCP 1438 7110 > isoipsigport-1 [ACK] Seq=26132 Ack=39566 Win=49680 Len=1380
837023 274.160098 41.177.98.38 -> 244.3.93.193 TCP 1438 7110 > isoipsigport-1 [ACK] Seq=27512 Ack=39566 Win=49680 Len=1380
837024 274.160102 41.177.98.38 -> 244.3.93.193 TCP 444 7110 > isoipsigport-1 [PSH, ACK] Seq=28892 Ack=39566 Win=49680 Len=386
838447 274.756646 41.177.98.38 -> 244.3.93.193 TCP 920 7110 > isoipsigport-1 [PSH, ACK] Seq=29278 Ack=39639 Win=49680 Len=862
840823 275.789592 41.177.98.38 -> 244.3.93.193 TCP 703 7110 > isoipsigport-1 [PSH, ACK] Seq=30140 Ack=39710 Win=49680 Len=645
841129 275.903399 41.177.98.38 -> 244.3.93.193 TCP 231 7110 > isoipsigport-1 [PSH, ACK] Seq=30785 Ack=39778 Win=49680 Len=173
866672 286.520086 41.177.98.38 -> 244.3.93.193 TCP 334 7110 > isoipsigport-1 [PSH, ACK] Seq=30958 Ack=39854 Win=49680 Len=276
866694 286.522091 41.177.98.38 -> 244.3.93.193 TCP 156 7110 > isoipsigport-1 [PSH, ACK] Seq=31234 Ack=39953 Win=49680 Len=98
866710 286.525735 41.177.98.38 -> 244.3.93.193 TCP 514 7110 > isoipsigport-1 [PSH, ACK] Seq=31332 Ack=40392 Win=49680 Len=456
866850 286.567565 41.177.98.38 -> 244.3.93.193 TCP 64 7110 > isoipsigport-1 [ACK] Seq=31788 Ack=40888 Win=49680 Len=0
866949 286.604132 41.177.98.38 -> 244.3.93.193 TCP 546 7110 > isoipsigport-1 [PSH, ACK] Seq=31788 Ack=40888 Win=49680 Len=488
