19495   6.405369 41.177.98.127 -> 213.197.255.209 TCP 82 z39-50 > 56495 [SYN, ACK] Seq=0 Ack=1 Win=49232 Len=0 TSval=1565674 TSecr=1774155004 MSS=1460 WS=1 SACK_PERM=1
19580   6.432504 41.177.98.127 -> 213.197.255.209 TCP 70 z39-50 > 56495 [ACK] Seq=1 Ack=53 Win=49232 Len=0 TSval=1565677 TSecr=1774155031
20220   6.664759 41.177.98.127 -> 209.254.255.22 TCP 66 z39-50 > 18254 [SYN, ACK] Seq=0 Ack=1 Win=49640 Len=0 MSS=1460 SACK_PERM=1
20336   6.723669 41.177.98.127 -> 209.254.255.22 TCP 64 z39-50 > 18254 [ACK] Seq=1 Ack=92 Win=49549 Len=0
21078   7.034654 41.177.98.127 -> 198.222.241.108 TCP 66 z39-50 > dpi-proxy [SYN, ACK] Seq=0 Ack=1 Win=49680 Len=0 MSS=1460 SACK_PERM=1
21099   7.055962 41.177.98.127 -> 198.222.241.108 TCP 64 z39-50 > dpi-proxy [ACK] Seq=1 Ack=92 Win=49680 Len=0
22044   7.739169 41.177.98.127 -> 213.197.255.209 TCP 146 z39-50 > 56495 [PSH, ACK] Seq=1 Ack=53 Win=49232 Len=76 TSval=1565808 TSecr=1774155031
22109   7.766748 41.177.98.127 -> 213.197.255.209 TCP 70 z39-50 > 56495 [ACK] Seq=77 Ack=238 Win=49232 Len=0 TSval=1565810 TSecr=1774156366
22372   7.938281 41.177.98.127 -> 213.197.255.209 TCP 93 z39-50 > 56495 [PSH, ACK] Seq=77 Ack=238 Win=49232 Len=23 TSval=1565828 TSecr=1774156366
22415   7.967906 41.177.98.127 -> 213.197.255.209 TCP 70 z39-50 > 56495 [ACK] Seq=100 Ack=239 Win=49232 Len=0 TSval=1565830 TSecr=1774156567
22416   7.968256 41.177.98.127 -> 213.197.255.209 TCP 70 z39-50 > 56495 [FIN, ACK] Seq=100 Ack=239 Win=49232 Len=0 TSval=1565831 TSecr=1774156567
22542   8.047917 41.177.98.127 -> 209.254.255.22 TCP 128 z39-50 > 18254 [PSH, ACK] Seq=1 Ack=92 Win=49640 Len=70
22701   8.108545 41.177.98.127 -> 209.254.255.22 TCP 64 z39-50 > 18254 [ACK] Seq=71 Ack=191 Win=49640 Len=0
22729   8.137469 41.177.98.127 -> 209.254.255.22 TCP 80 z39-50 > 18254 [PSH, ACK] Seq=71 Ack=191 Win=49640 Len=22
22886   8.253876 41.177.98.127 -> 209.254.255.22 TCP 64 z39-50 > 18254 [ACK] Seq=93 Ack=224 Win=49640 Len=0
22887   8.253983 41.177.98.127 -> 209.254.255.22 TCP 1384 z39-50 > 18254 [PSH, ACK] Seq=93 Ack=224 Win=49640 Len=1326
22979   8.319739 41.177.98.127 -> 209.254.255.22 TCP 64 z39-50 > 18254 [FIN, ACK] Seq=1419 Ack=232 Win=49640 Len=0
23132   8.377448 41.177.98.127 -> 209.254.255.22 TCP 64 z39-50 > 18254 [ACK] Seq=1420 Ack=233 Win=49640 Len=0
23147   8.393002 41.177.98.127 -> 198.222.241.108 TCP 128 z39-50 > dpi-proxy [PSH, ACK] Seq=1 Ack=92 Win=49680 Len=70
23168   8.418757 41.177.98.127 -> 198.222.241.108 TCP 64 z39-50 > dpi-proxy [ACK] Seq=71 Ack=206 Win=49680 Len=0
23643   8.610175 41.177.98.127 -> 198.222.241.108 TCP 81 z39-50 > dpi-proxy [PSH, ACK] Seq=71 Ack=206 Win=49680 Len=23
23737   8.688192 41.177.98.127 -> 198.222.241.108 TCP 64 z39-50 > dpi-proxy [ACK] Seq=94 Ack=239 Win=49680 Len=0
23743   8.688819 41.177.98.127 -> 198.222.241.108 TCP 1438 z39-50 > dpi-proxy [ACK] Seq=94 Ack=239 Win=49680 Len=1380
23744   8.688844 41.177.98.127 -> 198.222.241.108 TCP 1438 z39-50 > dpi-proxy [ACK] Seq=1474 Ack=239 Win=49680 Len=1380
23745   8.688866 41.177.98.127 -> 198.222.241.108 TCP 1438 z39-50 > dpi-proxy [ACK] Seq=2854 Ack=239 Win=49680 Len=1380
23746   8.688889 41.177.98.127 -> 198.222.241.108 TCP 1438 z39-50 > dpi-proxy [ACK] Seq=4234 Ack=239 Win=49680 Len=1380
23747   8.688910 41.177.98.127 -> 198.222.241.108 TCP 1438 z39-50 > dpi-proxy [ACK] Seq=5614 Ack=239 Win=49680 Len=1380
23828   8.718894 41.177.98.127 -> 198.222.241.108 TCP 547 z39-50 > dpi-proxy [PSH, ACK] Seq=6994 Ack=239 Win=49680 Len=489
23944   8.755596 41.177.98.127 -> 198.222.241.108 TCP 64 z39-50 > dpi-proxy [FIN, ACK] Seq=7483 Ack=247 Win=49680 Len=0
23980   8.779195 41.177.98.127 -> 198.222.241.108 TCP 64 z39-50 > dpi-proxy [ACK] Seq=7484 Ack=248 Win=49680 Len=0
29109  11.828242 41.177.98.127 -> 122.244.155.71 TCP 70 z39-50 > 46199 [ACK] Seq=1 Ack=193 Win=49232 Len=0 TSval=1566217 TSecr=986429537
30162  12.557256 41.177.98.127 -> 122.244.155.71 TCP 87 z39-50 > 46199 [PSH, ACK] Seq=1 Ack=193 Win=49232 Len=17 TSval=1566289 TSecr=986429537
30524  12.726937 41.177.98.127 -> 122.244.155.71 TCP 1180 z39-50 > 46199 [PSH, ACK] Seq=18 Ack=221 Win=49232 Len=1110 TSval=1566306 TSecr=986430465
31843  13.433805 41.177.98.127 -> 151.41.242.13 TCP 66 z39-50 > 42586 [SYN, ACK] Seq=0 Ack=1 Win=49640 Len=0 MSS=1460 SACK_PERM=1
31999  13.519928 41.177.98.127 -> 151.41.242.13 TCP 64 z39-50 > 42586 [ACK] Seq=1 Ack=53 Win=49588 Len=0
35550  14.841207 41.177.98.127 -> 151.41.242.13 TCP 134 z39-50 > 42586 [PSH, ACK] Seq=1 Ack=53 Win=49640 Len=76
35735  14.900450 41.177.98.127 -> 151.41.242.13 TCP 64 z39-50 > 42586 [ACK] Seq=77 Ack=131 Win=49640 Len=0
35829  14.965067 41.177.98.127 -> 151.41.242.13 TCP 81 z39-50 > 42586 [PSH, ACK] Seq=77 Ack=131 Win=49640 Len=23
35959  15.024056 41.177.98.127 -> 151.41.242.13 TCP 64 z39-50 > 42586 [ACK] Seq=100 Ack=132 Win=49640 Len=0
35979  15.024400 41.177.98.127 -> 151.41.242.13 TCP 64 z39-50 > 42586 [FIN, ACK] Seq=100 Ack=132 Win=49640 Len=0
43612  18.484890 41.177.98.127 -> 90.18.177.176 TCP 66 z39-50 > 60055 [SYN, ACK] Seq=0 Ack=1 Win=49640 Len=0 MSS=1460 SACK_PERM=1
43744  18.533150 41.177.98.127 -> 90.18.177.176 TCP 64 z39-50 > 60055 [ACK] Seq=1 Ack=92 Win=49549 Len=0
48127  19.763942 41.177.98.127 -> 94.130.157.255 TCP 64 z39-50 > 58174 [SYN, ACK] Seq=0 Ack=1 Win=49232 Len=0 MSS=1460
48245  19.789023 41.177.98.127 -> 94.130.157.255 TCP 64 z39-50 > 58174 [ACK] Seq=1 Ack=49 Win=49184 Len=0
48592  19.847935 41.177.98.127 -> 90.18.177.176 TCP 128 z39-50 > 60055 [PSH, ACK] Seq=1 Ack=92 Win=49640 Len=70
48794  19.897606 41.177.98.127 -> 90.18.177.176 TCP 64 z39-50 > 60055 [ACK] Seq=71 Ack=188 Win=49640 Len=0
49149  20.002956 41.177.98.127 -> 90.18.177.176 TCP 80 z39-50 > 60055 [PSH, ACK] Seq=71 Ack=188 Win=49640 Len=22
49483  20.108184 41.177.98.127 -> 90.18.177.176 TCP 64 z39-50 > 60055 [ACK] Seq=93 Ack=221 Win=49640 Len=0
49846  20.245276 41.177.98.127 -> 90.18.177.176 TCP 1518 z39-50 > 60055 [ACK] Seq=93 Ack=221 Win=49640 Len=1460
49847  20.245298 41.177.98.127 -> 90.18.177.176 TCP 1518 z39-50 > 60055 [ACK] Seq=1553 Ack=221 Win=49640 Len=1460
49848  20.245321 41.177.98.127 -> 90.18.177.176 TCP 1518 z39-50 > 60055 [ACK] Seq=3013 Ack=221 Win=49640 Len=1460
49849  20.245344 41.177.98.127 -> 90.18.177.176 TCP 1518 z39-50 > 60055 [ACK] Seq=4473 Ack=221 Win=49640 Len=1460
49850  20.245348 41.177.98.127 -> 90.18.177.176 TCP 675 z39-50 > 60055 [PSH, ACK] Seq=5933 Ack=221 Win=49640 Len=617
50007  20.303032 41.177.98.127 -> 90.18.177.176 TCP 64 z39-50 > 60055 [FIN, ACK] Seq=6550 Ack=229 Win=49640 Len=0
50056  20.353243 41.177.98.127 -> 90.18.177.176 TCP 64 z39-50 > 60055 [ACK] Seq=6551 Ack=230 Win=49640 Len=0
51476  21.137187 41.177.98.127 -> 94.130.157.255 TCP 128 z39-50 > 58174 [PSH, ACK] Seq=1 Ack=49 Win=49232 Len=70
53415  22.184228 41.177.98.127 -> 254.210.244.164 TCP 66 z39-50 > 36917 [SYN, ACK] Seq=0 Ack=1 Win=49680 Len=0 MSS=1460 SACK_PERM=1
53759  22.242256 41.177.98.127 -> 254.210.244.164 TCP 64 z39-50 > 36917 [ACK] Seq=1 Ack=92 Win=49589 Len=0
57848  23.563521 41.177.98.127 -> 254.210.244.164 TCP 128 z39-50 > 36917 [PSH, ACK] Seq=1 Ack=92 Win=49680 Len=70
58169  23.621955 41.177.98.127 -> 254.210.244.164 TCP 64 z39-50 > 36917 [ACK] Seq=71 Ack=180 Win=49680 Len=0
58174  23.622801 41.177.98.127 -> 254.210.244.164 TCP 97 z39-50 > 36917 [PSH, ACK] Seq=71 Ack=180 Win=49680 Len=39
58538  23.687194 41.177.98.127 -> 254.210.244.164 TCP 64 z39-50 > 36917 [FIN, ACK] Seq=110 Ack=188 Win=49680 Len=0
58778  23.745366 41.177.98.127 -> 254.210.244.164 TCP 64 z39-50 > 36917 [ACK] Seq=111 Ack=189 Win=49680 Len=0
58780  23.746505 41.177.98.127 -> 254.210.244.164 TCP 66 z39-50 > 6575 [SYN, ACK] Seq=0 Ack=1 Win=49680 Len=0 MSS=1460 SACK_PERM=1
58933  23.804990 41.177.98.127 -> 254.210.244.164 TCP 64 z39-50 > 6575 [ACK] Seq=1 Ack=92 Win=49589 Len=0
61412  25.119131 41.177.98.127 -> 254.210.244.164 TCP 128 z39-50 > 6575 [PSH, ACK] Seq=1 Ack=92 Win=49680 Len=70
61520  25.177663 41.177.98.127 -> 254.210.244.164 TCP 64 z39-50 > 6575 [ACK] Seq=71 Ack=180 Win=49680 Len=0
61521  25.178153 41.177.98.127 -> 254.210.244.164 TCP 97 z39-50 > 6575 [PSH, ACK] Seq=71 Ack=180 Win=49680 Len=39
61721  25.242116 41.177.98.127 -> 254.210.244.164 TCP 64 z39-50 > 6575 [FIN, ACK] Seq=110 Ack=188 Win=49680 Len=0
61803  25.300706 41.177.98.127 -> 254.210.244.164 TCP 64 z39-50 > 6575 [ACK] Seq=111 Ack=189 Win=49680 Len=0
65032  26.821315 41.177.98.127 -> 203.95.211.244 TCP 66 z39-50 > 49087 [SYN, ACK] Seq=0 Ack=1 Win=49640 Len=0 MSS=1460 SACK_PERM=1
65171  26.901812 41.177.98.127 -> 203.95.211.244 TCP 64 z39-50 > 49087 [ACK] Seq=1 Ack=53 Win=49588 Len=0
68531  28.285753 41.177.98.127 -> 203.95.211.244 TCP 134 z39-50 > 49087 [PSH, ACK] Seq=1 Ack=53 Win=49640 Len=76
68645  28.364990 41.177.98.127 -> 203.95.211.244 TCP 64 z39-50 > 49087 [ACK] Seq=77 Ack=189 Win=49640 Len=0
68740  28.430479 41.177.98.127 -> 203.95.211.244 TCP 81 z39-50 > 49087 [PSH, ACK] Seq=77 Ack=189 Win=49640 Len=23
69009  28.558122 41.177.98.127 -> 203.95.211.244 TCP 64 z39-50 > 49087 [ACK] Seq=100 Ack=228 Win=49640 Len=0
69151  28.654190 41.177.98.127 -> 203.95.211.244 TCP 1518 z39-50 > 49087 [ACK] Seq=100 Ack=228 Win=49640 Len=1460
69152  28.654216 41.177.98.127 -> 203.95.211.244 TCP 1518 z39-50 > 49087 [ACK] Seq=1560 Ack=228 Win=49640 Len=1460
69153  28.654221 41.177.98.127 -> 203.95.211.244 TCP 1065 z39-50 > 49087 [PSH, ACK] Seq=3020 Ack=228 Win=49640 Len=1007
69261  28.741193 41.177.98.127 -> 203.95.211.244 TCP 64 z39-50 > 49087 [ACK] Seq=4027 Ack=229 Win=49640 Len=0
69262  28.741397 41.177.98.127 -> 203.95.211.244 TCP 64 z39-50 > 49087 [FIN, ACK] Seq=4027 Ack=229 Win=49640 Len=0
69523  28.838926 41.177.98.127 -> 90.18.177.176 TCP 66 z39-50 > 35712 [SYN, ACK] Seq=0 Ack=1 Win=49640 Len=0 MSS=1460 SACK_PERM=1
69698  28.911584 41.177.98.127 -> 90.18.177.176 TCP 64 z39-50 > 35712 [ACK] Seq=1 Ack=92 Win=49549 Len=0
70366  29.148612 41.177.98.127 -> 254.214.213.72 TCP 66 z39-50 > j-ac [SYN, ACK] Seq=0 Ack=1 Win=49640 Len=0 MSS=1460 SACK_PERM=1
70491  29.180057 41.177.98.127 -> 254.214.213.72 TCP 64 z39-50 > j-ac [ACK] Seq=1 Ack=92 Win=49549 Len=0
71051  29.358489 41.177.98.127 -> 122.244.155.71 TCP 87 z39-50 > 46199 [PSH, ACK] Seq=1128 Ack=300 Win=49232 Len=17 TSval=1567970 TSecr=986447154
71782  29.530049 41.177.98.127 -> 122.244.155.71 TCP 70 z39-50 > 46199 [ACK] Seq=1145 Ack=455 Win=49232 Len=0 TSval=1567987 TSecr=986447258
71794  29.532363 41.177.98.127 -> 122.244.155.71 TCP 87 z39-50 > 46199 [PSH, ACK] Seq=1145 Ack=455 Win=49232 Len=17 TSval=1567987 TSecr=986447258
72254  29.622849 41.177.98.127 -> 122.244.155.71 TCP 131 z39-50 > 46199 [PSH, ACK] Seq=1162 Ack=572 Win=49232 Len=61 TSval=1567996 TSecr=986447437
74407  30.237639 41.177.98.127 -> 90.18.177.176 TCP 128 z39-50 > 35712 [PSH, ACK] Seq=1 Ack=92 Win=49640 Len=70
74620  30.286271 41.177.98.127 -> 90.18.177.176 TCP 64 z39-50 > 35712 [ACK] Seq=71 Ack=188 Win=49640 Len=0
74668  30.306724 41.177.98.127 -> 90.18.177.176 TCP 80 z39-50 > 35712 [PSH, ACK] Seq=71 Ack=188 Win=49640 Len=22
74887  30.359804 41.177.98.127 -> 90.18.177.176 TCP 64 z39-50 > 35712 [FIN, ACK] Seq=93 Ack=196 Win=49640 Len=0
75097  30.406187 41.177.98.127 -> 90.18.177.176 TCP 64 z39-50 > 35712 [ACK] Seq=94 Ack=197 Win=49640 Len=0
75400  30.476928 41.177.98.127 -> 254.214.213.72 TCP 128 z39-50 > j-ac [PSH, ACK] Seq=1 Ack=92 Win=49640 Len=70
75539  30.512534 41.177.98.127 -> 254.214.213.72 TCP 64 z39-50 > j-ac [ACK] Seq=71 Ack=193 Win=49640 Len=0
75646  30.534335 41.177.98.127 -> 254.214.213.72 TCP 82 z39-50 > j-ac [PSH, ACK] Seq=71 Ack=193 Win=49640 Len=24
75794  30.578646 41.177.98.127 -> 254.214.213.72 TCP 64 z39-50 > j-ac [FIN, ACK] Seq=95 Ack=201 Win=49640 Len=0
76050  30.620561 41.177.98.127 -> 254.214.213.72 TCP 64 z39-50 > j-ac [ACK] Seq=96 Ack=202 Win=49640 Len=0
77700  30.985849 41.177.98.127 -> 197.45.108.197 TCP 70 z39-50 > 64178 [SYN, ACK] Seq=0 Ack=1 Win=49640 Len=0 MSS=1460 WS=1 SACK_PERM=1
81457  31.836759 41.177.98.127 -> 197.45.108.197 TCP 64 z39-50 > 64178 [ACK] Seq=1 Ack=53 Win=49640 Len=0
85286  33.129870 41.177.98.127 -> 197.45.108.197 TCP 134 z39-50 > 64178 [PSH, ACK] Seq=1 Ack=53 Win=49640 Len=76
88823  34.310109 41.177.98.127 -> 197.45.108.197 TCP 64 z39-50 > 64178 [ACK] Seq=77 Ack=189 Win=49640 Len=0
88921  34.334540 41.177.98.127 -> 197.45.108.197 TCP 81 z39-50 > 64178 [PSH, ACK] Seq=77 Ack=189 Win=49640 Len=23
96272  36.198121 41.177.98.127 -> 197.45.108.197 TCP 64 z39-50 > 64178 [ACK] Seq=100 Ack=228 Win=49640 Len=0
96373  36.212057 41.177.98.127 -> 197.45.108.197 TCP 1518 z39-50 > 64178 [ACK] Seq=100 Ack=228 Win=49640 Len=1460
96374  36.212085 41.177.98.127 -> 197.45.108.197 TCP 1518 z39-50 > 64178 [ACK] Seq=1560 Ack=228 Win=49640 Len=1460
96375  36.212089 41.177.98.127 -> 197.45.108.197 TCP 1113 z39-50 > 64178 [PSH, ACK] Seq=3020 Ack=228 Win=49640 Len=1055
98803  36.820507 41.177.98.127 -> 151.41.242.13 TCP 66 z39-50 > 42608 [SYN, ACK] Seq=0 Ack=1 Win=49640 Len=0 MSS=1460 SACK_PERM=1
100178  37.036643 41.177.98.127 -> 151.41.242.13 TCP 64 z39-50 > 42608 [ACK] Seq=1 Ack=53 Win=49640 Len=0
100319  37.061919 41.177.98.127 -> 197.45.108.197 TCP 64 z39-50 > 64178 [ACK] Seq=4075 Ack=229 Win=49640 Len=0
100328  37.062220 41.177.98.127 -> 197.45.108.197 TCP 64 z39-50 > 64178 [FIN, ACK] Seq=4075 Ack=229 Win=49640 Len=0
106215  38.333402 41.177.98.127 -> 151.41.242.13 TCP 134 z39-50 > 42608 [PSH, ACK] Seq=1 Ack=53 Win=49640 Len=76
107022  38.549400 41.177.98.127 -> 151.41.242.13 TCP 64 z39-50 > 42608 [ACK] Seq=77 Ack=128 Win=49640 Len=0
107146  38.591073 41.177.98.127 -> 151.41.242.13 TCP 81 z39-50 > 42608 [PSH, ACK] Seq=77 Ack=128 Win=49640 Len=23
107804  38.758601 41.177.98.127 -> 151.41.242.13 TCP 64 z39-50 > 42608 [ACK] Seq=100 Ack=129 Win=49640 Len=0
107805  38.758787 41.177.98.127 -> 151.41.242.13 TCP 64 z39-50 > 42608 [FIN, ACK] Seq=100 Ack=129 Win=49640 Len=0
115842  41.324360 41.177.98.127 -> 122.241.95.77 TCP 66 z39-50 > 4506 [SYN, ACK] Seq=0 Ack=1 Win=49680 Len=0 MSS=1460 SACK_PERM=1
116014  41.388201 41.177.98.127 -> 122.241.95.77 TCP 64 z39-50 > 4506 [ACK] Seq=1 Ack=92 Win=49589 Len=0
118933  42.692823 41.177.98.127 -> 122.241.95.77 TCP 128 z39-50 > 4506 [PSH, ACK] Seq=1 Ack=92 Win=49680 Len=70
119215  42.755460 41.177.98.127 -> 122.241.95.77 TCP 64 z39-50 > 4506 [ACK] Seq=71 Ack=192 Win=49680 Len=0
119353  42.789372 41.177.98.127 -> 122.241.95.77 TCP 81 z39-50 > 4506 [PSH, ACK] Seq=71 Ack=192 Win=49680 Len=23
119625  42.857183 41.177.98.127 -> 122.241.95.77 TCP 64 z39-50 > 4506 [FIN, ACK] Seq=94 Ack=200 Win=49680 Len=0
119906  42.920387 41.177.98.127 -> 122.241.95.77 TCP 64 z39-50 > 4506 [ACK] Seq=95 Ack=201 Win=49680 Len=0
122806  43.707460 41.177.98.127 -> 254.214.213.72 TCP 66 z39-50 > nuauth [SYN, ACK] Seq=0 Ack=1 Win=49640 Len=0 MSS=1460 SACK_PERM=1
122977  43.753804 41.177.98.127 -> 254.214.213.72 TCP 64 z39-50 > nuauth [ACK] Seq=1 Ack=92 Win=49549 Len=0
123227  43.827200 41.177.98.127 -> 94.130.157.255 TCP 64 z39-50 > 58174 [ACK] Seq=71 Ack=194 Win=49232 Len=0
123691  44.063294 41.177.98.127 -> 94.130.157.255 TCP 75 z39-50 > 58174 [PSH, ACK] Seq=71 Ack=194 Win=49232 Len=17
123844  44.148152 41.177.98.127 -> 94.130.157.255 TCP 64 z39-50 > 58174 [ACK] Seq=88 Ack=227 Win=49232 Len=0
126381  44.919546 41.177.98.127 -> 122.244.155.71 TCP 87 z39-50 > 46199 [PSH, ACK] Seq=1223 Ack=651 Win=49232 Len=17 TSval=1569526 TSecr=986462718
128019  45.091645 41.177.98.127 -> 254.214.213.72 TCP 128 z39-50 > nuauth [PSH, ACK] Seq=1 Ack=92 Win=49640 Len=70
128076  45.096829 41.177.98.127 -> 94.130.157.255 TCP 1506 z39-50 > 58174 [ACK] Seq=88 Ack=227 Win=49232 Len=1448
128078  45.096849 41.177.98.127 -> 94.130.157.255 TCP 1506 z39-50 > 58174 [ACK] Seq=1536 Ack=227 Win=49232 Len=1448
128080  45.096903 41.177.98.127 -> 94.130.157.255 TCP 1506 z39-50 > 58174 [ACK] Seq=2984 Ack=227 Win=49232 Len=1448
128081  45.096906 41.177.98.127 -> 94.130.157.255 TCP 1506 z39-50 > 58174 [ACK] Seq=4432 Ack=227 Win=49232 Len=1448
128082  45.096918 41.177.98.127 -> 94.130.157.255 TCP 1506 z39-50 > 58174 [ACK] Seq=5880 Ack=227 Win=49232 Len=1448
128283  45.122880 41.177.98.127 -> 94.130.157.255 TCP 1506 z39-50 > 58174 [ACK] Seq=7328 Ack=227 Win=49232 Len=1448
128284  45.122903 41.177.98.127 -> 94.130.157.255 TCP 1506 z39-50 > 58174 [ACK] Seq=8776 Ack=227 Win=49232 Len=1448
128285  45.122924 41.177.98.127 -> 94.130.157.255 TCP 1506 z39-50 > 58174 [ACK] Seq=10224 Ack=227 Win=49232 Len=1448
128286  45.122986 41.177.98.127 -> 94.130.157.255 TCP 1506 z39-50 > 58174 [ACK] Seq=11672 Ack=227 Win=49232 Len=1448
128288  45.122994 41.177.98.127 -> 94.130.157.255 TCP 1506 z39-50 > 58174 [ACK] Seq=13120 Ack=227 Win=49232 Len=1448
128289  45.122998 41.177.98.127 -> 94.130.157.255 TCP 1506 z39-50 > 58174 [ACK] Seq=14568 Ack=227 Win=49232 Len=1448
128306  45.124198 41.177.98.127 -> 254.214.213.72 TCP 64 z39-50 > nuauth [ACK] Seq=71 Ack=214 Win=49640 Len=0
128475  45.148561 41.177.98.127 -> 94.130.157.255 TCP 1506 z39-50 > 58174 [ACK] Seq=16016 Ack=227 Win=49232 Len=1448
128476  45.148583 41.177.98.127 -> 94.130.157.255 TCP 1506 z39-50 > 58174 [ACK] Seq=17464 Ack=227 Win=49232 Len=1448
128477  45.148632 41.177.98.127 -> 94.130.157.255 TCP 1506 z39-50 > 58174 [ACK] Seq=18912 Ack=227 Win=49232 Len=1448
128479  45.148641 41.177.98.127 -> 94.130.157.255 TCP 1506 z39-50 > 58174 [ACK] Seq=20360 Ack=227 Win=49232 Len=1448
128480  45.148653 41.177.98.127 -> 94.130.157.255 TCP 1506 z39-50 > 58174 [ACK] Seq=21808 Ack=227 Win=49232 Len=1448
128481  45.148676 41.177.98.127 -> 94.130.157.255 TCP 1506 z39-50 > 58174 [ACK] Seq=23256 Ack=227 Win=49232 Len=1448
128482  45.148698 41.177.98.127 -> 94.130.157.255 TCP 1506 z39-50 > 58174 [ACK] Seq=24704 Ack=227 Win=49232 Len=1448
128483  45.148731 41.177.98.127 -> 94.130.157.255 TCP 1506 z39-50 > 58174 [ACK] Seq=26152 Ack=227 Win=49232 Len=1448
128489  45.153177 41.177.98.127 -> 254.214.213.72 TCP 82 z39-50 > nuauth [PSH, ACK] Seq=71 Ack=214 Win=49640 Len=24
128673  45.173886 41.177.98.127 -> 94.130.157.255 TCP 1506 z39-50 > 58174 [ACK] Seq=27600 Ack=227 Win=49232 Len=1448
128674  45.173890 41.177.98.127 -> 94.130.157.255 TCP 1506 z39-50 > 58174 [ACK] Seq=29048 Ack=227 Win=49232 Len=1448
128675  45.173894 41.177.98.127 -> 94.130.157.255 TCP 1506 z39-50 > 58174 [ACK] Seq=30496 Ack=227 Win=49232 Len=1448
128676  45.173950 41.177.98.127 -> 94.130.157.255 TCP 1506 z39-50 > 58174 [ACK] Seq=31944 Ack=227 Win=49232 Len=1448
128677  45.173995 41.177.98.127 -> 94.130.157.255 TCP 1506 z39-50 > 58174 [ACK] Seq=33392 Ack=227 Win=49232 Len=1448
128679  45.174004 41.177.98.127 -> 94.130.157.255 TCP 1506 z39-50 > 58174 [ACK] Seq=34840 Ack=227 Win=49232 Len=1448
128680  45.174017 41.177.98.127 -> 94.130.157.255 TCP 1506 z39-50 > 58174 [ACK] Seq=36288 Ack=227 Win=49232 Len=1448
128681  45.174042 41.177.98.127 -> 94.130.157.255 TCP 1506 z39-50 > 58174 [ACK] Seq=37736 Ack=227 Win=49232 Len=1448
128682  45.174089 41.177.98.127 -> 94.130.157.255 TCP 1506 z39-50 > 58174 [ACK] Seq=39184 Ack=227 Win=49232 Len=1448
128685  45.174102 41.177.98.127 -> 94.130.157.255 TCP 1506 z39-50 > 58174 [ACK] Seq=40632 Ack=227 Win=49232 Len=1448
128686  45.174106 41.177.98.127 -> 94.130.157.255 TCP 1506 z39-50 > 58174 [ACK] Seq=42080 Ack=227 Win=49232 Len=1448
128908  45.199348 41.177.98.127 -> 94.130.157.255 TCP 1506 z39-50 > 58174 [ACK] Seq=43528 Ack=227 Win=49232 Len=1448
128909  45.199384 41.177.98.127 -> 94.130.157.255 TCP 1506 z39-50 > 58174 [ACK] Seq=44976 Ack=227 Win=49232 Len=1448
128911  45.199393 41.177.98.127 -> 94.130.157.255 TCP 1377 z39-50 > 58174 [PSH, ACK] Seq=46424 Ack=227 Win=49232 Len=1319
128914  45.200677 41.177.98.127 -> 254.214.213.72 TCP 64 z39-50 > nuauth [FIN, ACK] Seq=95 Ack=222 Win=49640 Len=0
129274  45.243939 41.177.98.127 -> 254.214.213.72 TCP 64 z39-50 > nuauth [ACK] Seq=96 Ack=223 Win=49640 Len=0
140537  48.455849 41.177.98.127 -> 197.176.159.116 TCP 66 z39-50 > vqp [SYN, ACK] Seq=0 Ack=1 Win=49680 Len=0 MSS=1460 SACK_PERM=1
140743  48.531072 41.177.98.127 -> 213.197.255.209 TCP 82 z39-50 > 56541 [SYN, ACK] Seq=0 Ack=1 Win=49232 Len=0 TSval=1569887 TSecr=1774197129 MSS=1460 WS=1 SACK_PERM=1
140793  48.546456 41.177.98.127 -> 197.176.159.116 TCP 64 z39-50 > vqp [ACK] Seq=1 Ack=92 Win=49680 Len=0
140859  48.557672 41.177.98.127 -> 213.197.255.209 TCP 70 z39-50 > 56541 [ACK] Seq=1 Ack=53 Win=49232 Len=0 TSval=1569889 TSecr=1774197156
141224  48.632069 41.177.98.127 -> 142.197.48.208 TCP 66 z39-50 > plbserve-port [SYN, ACK] Seq=0 Ack=1 Win=49640 Len=0 MSS=1460 SACK_PERM=1
141493  48.683781 41.177.98.127 -> 142.197.48.208 TCP 64 z39-50 > plbserve-port [ACK] Seq=1 Ack=92 Win=49549 Len=0
145507  49.862457 41.177.98.127 -> 197.176.159.116 TCP 128 z39-50 > vqp [PSH, ACK] Seq=1 Ack=92 Win=49680 Len=70
145569  49.886718 41.177.98.127 -> 213.197.255.209 TCP 146 z39-50 > 56541 [PSH, ACK] Seq=1 Ack=53 Win=49232 Len=76 TSval=1570022 TSecr=1774197156
145657  49.914936 41.177.98.127 -> 213.197.255.209 TCP 70 z39-50 > 56541 [ACK] Seq=77 Ack=201 Win=49232 Len=0 TSval=1570025 TSecr=1774198514
145811  49.959438 41.177.98.127 -> 197.176.159.116 TCP 64 z39-50 > vqp [ACK] Seq=71 Ack=190 Win=49680 Len=0
145873  49.985529 41.177.98.127 -> 197.176.159.116 TCP 82 z39-50 > vqp [PSH, ACK] Seq=71 Ack=190 Win=49680 Len=24
145894  49.993253 41.177.98.127 -> 142.197.48.208 TCP 128 z39-50 > plbserve-port [PSH, ACK] Seq=1 Ack=92 Win=49640 Len=70
146013  50.044991 41.177.98.127 -> 142.197.48.208 TCP 64 z39-50 > plbserve-port [ACK] Seq=71 Ack=183 Win=49640 Len=0
146014  50.045487 41.177.98.127 -> 142.197.48.208 TCP 98 z39-50 > plbserve-port [PSH, ACK] Seq=71 Ack=183 Win=49640 Len=40
146099  50.102058 41.177.98.127 -> 142.197.48.208 TCP 64 z39-50 > plbserve-port [FIN, ACK] Seq=111 Ack=191 Win=49640 Len=0
146232  50.153252 41.177.98.127 -> 197.176.159.116 TCP 1438 z39-50 > vqp [ACK] Seq=95 Ack=223 Win=49680 Len=1380
146233  50.153256 41.177.98.127 -> 197.176.159.116 TCP 543 z39-50 > vqp [PSH, ACK] Seq=1475 Ack=223 Win=49680 Len=485
146238  50.154273 41.177.98.127 -> 142.197.48.208 TCP 64 z39-50 > plbserve-port [ACK] Seq=112 Ack=192 Win=49640 Len=0
146239  50.154403 41.177.98.127 -> 142.197.48.208 TCP 66 z39-50 > sunfm-port [SYN, ACK] Seq=0 Ack=1 Win=49640 Len=0 MSS=1460 SACK_PERM=1
146428  50.206214 41.177.98.127 -> 142.197.48.208 TCP 64 z39-50 > sunfm-port [ACK] Seq=1 Ack=92 Win=49549 Len=0
146532  50.246459 41.177.98.127 -> 197.176.159.116 TCP 64 z39-50 > vqp [FIN, ACK] Seq=1960 Ack=231 Win=49680 Len=0
146759  50.376201 41.177.98.127 -> 197.176.159.116 TCP 64 z39-50 > vqp [ACK] Seq=1961 Ack=232 Win=49680 Len=0
146787  50.389185 41.177.98.127 -> 213.197.255.209 TCP 93 z39-50 > 56541 [PSH, ACK] Seq=77 Ack=201 Win=49232 Len=23 TSval=1570073 TSecr=1774198514
147036  50.478167 41.177.98.127 -> 213.197.255.209 TCP 70 z39-50 > 56541 [ACK] Seq=100 Ack=240 Win=49232 Len=0 TSval=1570082 TSecr=1774199018
148056  50.822758 41.177.98.127 -> 213.197.255.209 TCP 1518 z39-50 > 56541 [ACK] Seq=100 Ack=240 Win=49232 Len=1448 TSval=1570116 TSecr=1774199018
148057  50.822779 41.177.98.127 -> 213.197.255.209 TCP 1518 z39-50 > 56541 [ACK] Seq=1548 Ack=240 Win=49232 Len=1448 TSval=1570116 TSecr=1774199018
148058  50.822801 41.177.98.127 -> 213.197.255.209 TCP 1518 z39-50 > 56541 [ACK] Seq=2996 Ack=240 Win=49232 Len=1448 TSval=1570116 TSecr=1774199018
148059  50.822821 41.177.98.127 -> 213.197.255.209 TCP 1518 z39-50 > 56541 [PSH, ACK] Seq=4444 Ack=240 Win=49232 Len=1448 TSval=1570116 TSecr=1774199018
148113  50.848926 41.177.98.127 -> 213.197.255.209 TCP 151 z39-50 > 56541 [PSH, ACK] Seq=5892 Ack=240 Win=49232 Len=81 TSval=1570119 TSecr=1774199448
148329  50.938212 41.177.98.127 -> 213.197.255.209 TCP 70 z39-50 > 56541 [ACK] Seq=5973 Ack=279 Win=49232 Len=0 TSval=1570128 TSecr=1774199480
149139  51.235727 41.177.98.127 -> 213.197.255.209 TCP 1518 z39-50 > 56541 [ACK] Seq=5973 Ack=279 Win=49232 Len=1448 TSval=1570157 TSecr=1774199480
149140  51.235752 41.177.98.127 -> 213.197.255.209 TCP 1518 z39-50 > 56541 [ACK] Seq=7421 Ack=279 Win=49232 Len=1448 TSval=1570157 TSecr=1774199480
149141  51.235773 41.177.98.127 -> 213.197.255.209 TCP 1518 z39-50 > 56541 [ACK] Seq=8869 Ack=279 Win=49232 Len=1448 TSval=1570157 TSecr=1774199480
149142  51.235798 41.177.98.127 -> 213.197.255.209 TCP 1518 z39-50 > 56541 [ACK] Seq=10317 Ack=279 Win=49232 Len=1448 TSval=1570157 TSecr=1774199480
149143  51.235819 41.177.98.127 -> 213.197.255.209 TCP 1518 z39-50 > 56541 [ACK] Seq=11765 Ack=279 Win=49232 Len=1448 TSval=1570157 TSecr=1774199480
149144  51.235824 41.177.98.127 -> 213.197.255.209 TCP 408 z39-50 > 56541 [PSH, ACK] Seq=13213 Ack=279 Win=49232 Len=338 TSval=1570157 TSecr=1774199480
149526  51.328102 41.177.98.127 -> 213.197.255.209 TCP 70 z39-50 > 56541 [ACK] Seq=13551 Ack=318 Win=49232 Len=0 TSval=1570167 TSecr=1774199869
150063  51.517699 41.177.98.127 -> 142.197.48.208 TCP 128 z39-50 > sunfm-port [PSH, ACK] Seq=1 Ack=92 Win=49640 Len=70
150174  51.569147 41.177.98.127 -> 142.197.48.208 TCP 64 z39-50 > sunfm-port [ACK] Seq=71 Ack=183 Win=49640 Len=0
150175  51.569856 41.177.98.127 -> 142.197.48.208 TCP 98 z39-50 > sunfm-port [PSH, ACK] Seq=71 Ack=183 Win=49640 Len=40
150409  51.627591 41.177.98.127 -> 142.197.48.208 TCP 64 z39-50 > sunfm-port [FIN, ACK] Seq=111 Ack=191 Win=49640 Len=0
150535  51.659420 41.177.98.127 -> 213.197.255.209 TCP 1518 z39-50 > 56541 [ACK] Seq=13551 Ack=318 Win=49232 Len=1448 TSval=1570200 TSecr=1774199869
150536  51.659445 41.177.98.127 -> 213.197.255.209 TCP 1518 z39-50 > 56541 [ACK] Seq=14999 Ack=318 Win=49232 Len=1448 TSval=1570200 TSecr=1774199869
150537  51.659466 41.177.98.127 -> 213.197.255.209 TCP 1518 z39-50 > 56541 [ACK] Seq=16447 Ack=318 Win=49232 Len=1448 TSval=1570200 TSecr=1774199869
150538  51.659490 41.177.98.127 -> 213.197.255.209 TCP 1518 z39-50 > 56541 [ACK] Seq=17895 Ack=318 Win=49232 Len=1448 TSval=1570200 TSecr=1774199869
150539  51.659514 41.177.98.127 -> 213.197.255.209 TCP 1518 z39-50 > 56541 [ACK] Seq=19343 Ack=318 Win=49232 Len=1448 TSval=1570200 TSecr=1774199869
150540  51.659519 41.177.98.127 -> 213.197.255.209 TCP 750 z39-50 > 56541 [PSH, ACK] Seq=20791 Ack=318 Win=49232 Len=680 TSval=1570200 TSecr=1774199869
150600  51.679579 41.177.98.127 -> 142.197.48.208 TCP 64 z39-50 > sunfm-port [ACK] Seq=112 Ack=192 Win=49640 Len=0
150800  51.748183 41.177.98.127 -> 213.197.255.209 TCP 70 z39-50 > 56541 [ACK] Seq=21471 Ack=357 Win=49232 Len=0 TSval=1570209 TSecr=1774200292
152268  52.173652 41.177.98.127 -> 213.197.255.209 TCP 1518 z39-50 > 56541 [ACK] Seq=21471 Ack=357 Win=49232 Len=1448 TSval=1570251 TSecr=1774200292
152269  52.173678 41.177.98.127 -> 213.197.255.209 TCP 1518 z39-50 > 56541 [ACK] Seq=22919 Ack=357 Win=49232 Len=1448 TSval=1570251 TSecr=1774200292
152270  52.173699 41.177.98.127 -> 213.197.255.209 TCP 1518 z39-50 > 56541 [ACK] Seq=24367 Ack=357 Win=49232 Len=1448 TSval=1570251 TSecr=1774200292
152271  52.173722 41.177.98.127 -> 213.197.255.209 TCP 1518 z39-50 > 56541 [ACK] Seq=25815 Ack=357 Win=49232 Len=1448 TSval=1570251 TSecr=1774200292
152272  52.173743 41.177.98.127 -> 213.197.255.209 TCP 1518 z39-50 > 56541 [ACK] Seq=27263 Ack=357 Win=49232 Len=1448 TSval=1570251 TSecr=1774200292
152273  52.173772 41.177.98.127 -> 213.197.255.209 TCP 1518 z39-50 > 56541 [ACK] Seq=28711 Ack=357 Win=49232 Len=1448 TSval=1570251 TSecr=1774200292
152274  52.173788 41.177.98.127 -> 213.197.255.209 TCP 1512 z39-50 > 56541 [PSH, ACK] Seq=30159 Ack=357 Win=49232 Len=1442 TSval=1570251 TSecr=1774200292
152654  52.268118 41.177.98.127 -> 213.197.255.209 TCP 70 z39-50 > 56541 [ACK] Seq=31601 Ack=396 Win=49232 Len=0 TSval=1570261 TSecr=1774200808
153540  52.511158 41.177.98.127 -> 213.197.255.209 TCP 1518 z39-50 > 56541 [ACK] Seq=31601 Ack=396 Win=49232 Len=1448 TSval=1570285 TSecr=1774200808
153541  52.511183 41.177.98.127 -> 213.197.255.209 TCP 1518 z39-50 > 56541 [ACK] Seq=33049 Ack=396 Win=49232 Len=1448 TSval=1570285 TSecr=1774200808
153542  52.511205 41.177.98.127 -> 213.197.255.209 TCP 1518 z39-50 > 56541 [ACK] Seq=34497 Ack=396 Win=49232 Len=1448 TSval=1570285 TSecr=1774200808
153543  52.511228 41.177.98.127 -> 213.197.255.209 TCP 1518 z39-50 > 56541 [ACK] Seq=35945 Ack=396 Win=49232 Len=1448 TSval=1570285 TSecr=1774200808
153544  52.511253 41.177.98.127 -> 213.197.255.209 TCP 1518 z39-50 > 56541 [ACK] Seq=37393 Ack=396 Win=49232 Len=1448 TSval=1570285 TSecr=1774200808
153545  52.511276 41.177.98.127 -> 213.197.255.209 TCP 1518 z39-50 > 56541 [ACK] Seq=38841 Ack=396 Win=49232 Len=1448 TSval=1570285 TSecr=1774200808
153546  52.511283 41.177.98.127 -> 213.197.255.209 TCP 547 z39-50 > 56541 [PSH, ACK] Seq=40289 Ack=396 Win=49232 Len=477 TSval=1570285 TSecr=1774200808
153916  52.598095 41.177.98.127 -> 213.197.255.209 TCP 70 z39-50 > 56541 [ACK] Seq=40766 Ack=435 Win=49232 Len=0 TSval=1570294 TSecr=1774201143
154680  52.823012 41.177.98.127 -> 213.197.255.209 TCP 1518 z39-50 > 56541 [ACK] Seq=40766 Ack=435 Win=49232 Len=1448 TSval=1570316 TSecr=1774201143
154681  52.823039 41.177.98.127 -> 213.197.255.209 TCP 1518 z39-50 > 56541 [ACK] Seq=42214 Ack=435 Win=49232 Len=1448 TSval=1570316 TSecr=1774201143
154682  52.823060 41.177.98.127 -> 213.197.255.209 TCP 1518 z39-50 > 56541 [ACK] Seq=43662 Ack=435 Win=49232 Len=1448 TSval=1570316 TSecr=1774201143
154683  52.823085 41.177.98.127 -> 213.197.255.209 TCP 1518 z39-50 > 56541 [ACK] Seq=45110 Ack=435 Win=49232 Len=1448 TSval=1570316 TSecr=1774201143
154684  52.823106 41.177.98.127 -> 213.197.255.209 TCP 1518 z39-50 > 56541 [ACK] Seq=46558 Ack=435 Win=49232 Len=1448 TSval=1570316 TSecr=1774201143
154685  52.823131 41.177.98.127 -> 213.197.255.209 TCP 1518 z39-50 > 56541 [ACK] Seq=48006 Ack=435 Win=49232 Len=1448 TSval=1570316 TSecr=1774201143
154686  52.823136 41.177.98.127 -> 213.197.255.209 TCP 865 z39-50 > 56541 [PSH, ACK] Seq=49454 Ack=435 Win=49232 Len=795 TSval=1570316 TSecr=1774201143
154971  52.918072 41.177.98.127 -> 213.197.255.209 TCP 70 z39-50 > 56541 [ACK] Seq=50249 Ack=474 Win=49232 Len=0 TSval=1570326 TSecr=1774201458
155952  53.177044 41.177.98.127 -> 213.197.255.209 TCP 1518 z39-50 > 56541 [ACK] Seq=50249 Ack=474 Win=49232 Len=1448 TSval=1570351 TSecr=1774201458
155953  53.177070 41.177.98.127 -> 213.197.255.209 TCP 1518 z39-50 > 56541 [ACK] Seq=51697 Ack=474 Win=49232 Len=1448 TSval=1570351 TSecr=1774201458
155954  53.177093 41.177.98.127 -> 213.197.255.209 TCP 1518 z39-50 > 56541 [ACK] Seq=53145 Ack=474 Win=49232 Len=1448 TSval=1570351 TSecr=1774201458
155955  53.177115 41.177.98.127 -> 213.197.255.209 TCP 1518 z39-50 > 56541 [ACK] Seq=54593 Ack=474 Win=49232 Len=1448 TSval=1570351 TSecr=1774201458
155956  53.177147 41.177.98.127 -> 213.197.255.209 TCP 1518 z39-50 > 56541 [ACK] Seq=56041 Ack=474 Win=49232 Len=1448 TSval=1570351 TSecr=1774201458
155957  53.177151 41.177.98.127 -> 213.197.255.209 TCP 1328 z39-50 > 56541 [PSH, ACK] Seq=57489 Ack=474 Win=49232 Len=1258 TSval=1570351 TSecr=1774201458
156355  53.268136 41.177.98.127 -> 213.197.255.209 TCP 70 z39-50 > 56541 [ACK] Seq=58747 Ack=513 Win=49232 Len=0 TSval=1570361 TSecr=1774201810
157317  53.610450 41.177.98.127 -> 213.197.255.209 TCP 1518 z39-50 > 56541 [ACK] Seq=58747 Ack=513 Win=49232 Len=1448 TSval=1570395 TSecr=1774201810
157318  53.610473 41.177.98.127 -> 213.197.255.209 TCP 1518 z39-50 > 56541 [ACK] Seq=60195 Ack=513 Win=49232 Len=1448 TSval=1570395 TSecr=1774201810
157319  53.610495 41.177.98.127 -> 213.197.255.209 TCP 1518 z39-50 > 56541 [ACK] Seq=61643 Ack=513 Win=49232 Len=1448 TSval=1570395 TSecr=1774201810
157320  53.610519 41.177.98.127 -> 213.197.255.209 TCP 1518 z39-50 > 56541 [ACK] Seq=63091 Ack=513 Win=49232 Len=1448 TSval=1570395 TSecr=1774201810
157321  53.610544 41.177.98.127 -> 213.197.255.209 TCP 1518 z39-50 > 56541 [ACK] Seq=64539 Ack=513 Win=49232 Len=1448 TSval=1570395 TSecr=1774201810
157322  53.610548 41.177.98.127 -> 213.197.255.209 TCP 758 z39-50 > 56541 [PSH, ACK] Seq=65987 Ack=513 Win=49232 Len=688 TSval=1570395 TSecr=1774201810
157653  53.698116 41.177.98.127 -> 213.197.255.209 TCP 70 z39-50 > 56541 [ACK] Seq=66675 Ack=552 Win=49232 Len=0 TSval=1570404 TSecr=1774202243
158067  53.857685 41.177.98.127 -> 213.197.255.209 TCP 1518 z39-50 > 56541 [ACK] Seq=66675 Ack=552 Win=49232 Len=1448 TSval=1570419 TSecr=1774202243
158068  53.857709 41.177.98.127 -> 213.197.255.209 TCP 1518 z39-50 > 56541 [ACK] Seq=68123 Ack=552 Win=49232 Len=1448 TSval=1570419 TSecr=1774202243
158069  53.857730 41.177.98.127 -> 213.197.255.209 TCP 1518 z39-50 > 56541 [ACK] Seq=69571 Ack=552 Win=49232 Len=1448 TSval=1570419 TSecr=1774202243
158070  53.857755 41.177.98.127 -> 213.197.255.209 TCP 1518 z39-50 > 56541 [ACK] Seq=71019 Ack=552 Win=49232 Len=1448 TSval=1570419 TSecr=1774202243
158071  53.857779 41.177.98.127 -> 213.197.255.209 TCP 1518 z39-50 > 56541 [ACK] Seq=72467 Ack=552 Win=49232 Len=1448 TSval=1570419 TSecr=1774202243
158072  53.857784 41.177.98.127 -> 213.197.255.209 TCP 868 z39-50 > 56541 [PSH, ACK] Seq=73915 Ack=552 Win=49232 Len=798 TSval=1570419 TSecr=1774202243
158424  53.948096 41.177.98.127 -> 213.197.255.209 TCP 70 z39-50 > 56541 [ACK] Seq=74713 Ack=591 Win=49232 Len=0 TSval=1570429 TSecr=1774202490
159576  54.314779 41.177.98.127 -> 41.177.251.254 TCP 66 z39-50 > pvsw-inet [SYN, ACK] Seq=0 Ack=1 Win=49640 Len=0 MSS=1460 SACK_PERM=1
159613  54.334688 41.177.98.127 -> 213.197.255.209 TCP 1518 z39-50 > 56541 [ACK] Seq=74713 Ack=591 Win=49232 Len=1448 TSval=1570467 TSecr=1774202490
159614  54.334714 41.177.98.127 -> 213.197.255.209 TCP 1518 z39-50 > 56541 [ACK] Seq=76161 Ack=591 Win=49232 Len=1448 TSval=1570467 TSecr=1774202490
159615  54.334736 41.177.98.127 -> 213.197.255.209 TCP 1518 z39-50 > 56541 [ACK] Seq=77609 Ack=591 Win=49232 Len=1448 TSval=1570467 TSecr=1774202490
159616  54.334760 41.177.98.127 -> 213.197.255.209 TCP 1518 z39-50 > 56541 [ACK] Seq=79057 Ack=591 Win=49232 Len=1448 TSval=1570467 TSecr=1774202490
159617  54.334784 41.177.98.127 -> 213.197.255.209 TCP 1518 z39-50 > 56541 [ACK] Seq=80505 Ack=591 Win=49232 Len=1448 TSval=1570467 TSecr=1774202490
159618  54.334804 41.177.98.127 -> 213.197.255.209 TCP 1518 z39-50 > 56541 [ACK] Seq=81953 Ack=591 Win=49232 Len=1448 TSval=1570467 TSecr=1774202490
159619  54.334808 41.177.98.127 -> 213.197.255.209 TCP 368 z39-50 > 56541 [PSH, ACK] Seq=83401 Ack=591 Win=49232 Len=298 TSval=1570467 TSecr=1774202490
159806  54.428071 41.177.98.127 -> 213.197.255.209 TCP 70 z39-50 > 56541 [ACK] Seq=83699 Ack=630 Win=49232 Len=0 TSval=1570477 TSecr=1774202968
159827  54.440537 41.177.98.127 -> 41.177.251.254 TCP 64 z39-50 > pvsw-inet [ACK] Seq=1 Ack=62 Win=49579 Len=0
160603  54.689963 41.177.98.127 -> 213.197.255.209 TCP 1518 z39-50 > 56541 [ACK] Seq=83699 Ack=630 Win=49232 Len=1448 TSval=1570503 TSecr=1774202968
160604  54.689987 41.177.98.127 -> 213.197.255.209 TCP 1518 z39-50 > 56541 [ACK] Seq=85147 Ack=630 Win=49232 Len=1448 TSval=1570503 TSecr=1774202968
160605  54.690009 41.177.98.127 -> 213.197.255.209 TCP 1518 z39-50 > 56541 [ACK] Seq=86595 Ack=630 Win=49232 Len=1448 TSval=1570503 TSecr=1774202968
160606  54.690035 41.177.98.127 -> 213.197.255.209 TCP 1518 z39-50 > 56541 [ACK] Seq=88043 Ack=630 Win=49232 Len=1448 TSval=1570503 TSecr=1774202968
160607  54.690039 41.177.98.127 -> 213.197.255.209 TCP 1007 z39-50 > 56541 [PSH, ACK] Seq=89491 Ack=630 Win=49232 Len=937 TSval=1570503 TSecr=1774202968
160699  54.716251 41.177.98.127 -> 213.197.255.209 TCP 1518 [TCP Fast Retransmission] z39-50 > 56541 [PSH, ACK] Seq=83699 Ack=630 Win=49232 Len=1448 TSval=1570505 TSecr=1774203315
161003  54.798087 41.177.98.127 -> 213.197.255.209 TCP 70 z39-50 > 56541 [ACK] Seq=90428 Ack=669 Win=49232 Len=0 TSval=1570514 TSecr=1774203346
162124  55.165804 41.177.98.127 -> 213.197.255.209 TCP 1518 z39-50 > 56541 [ACK] Seq=90428 Ack=669 Win=49232 Len=1448 TSval=1570550 TSecr=1774203346
162125  55.165829 41.177.98.127 -> 213.197.255.209 TCP 1518 z39-50 > 56541 [ACK] Seq=91876 Ack=669 Win=49232 Len=1448 TSval=1570550 TSecr=1774203346
162126  55.165849 41.177.98.127 -> 213.197.255.209 TCP 1518 z39-50 > 56541 [ACK] Seq=93324 Ack=669 Win=49232 Len=1448 TSval=1570550 TSecr=1774203346
162204  55.191695 41.177.98.127 -> 213.197.255.209 TCP 1518 z39-50 > 56541 [ACK] Seq=94772 Ack=669 Win=49232 Len=1448 TSval=1570553 TSecr=1774203790
162206  55.191712 41.177.98.127 -> 213.197.255.209 TCP 1518 z39-50 > 56541 [PSH, ACK] Seq=96220 Ack=669 Win=49232 Len=1448 TSval=1570553 TSecr=1774203790
162305  55.218179 41.177.98.127 -> 213.197.255.209 TCP 765 z39-50 > 56541 [PSH, ACK] Seq=97668 Ack=669 Win=49232 Len=695 TSval=1570556 TSecr=1774203817
162812  55.308103 41.177.98.127 -> 213.197.255.209 TCP 70 z39-50 > 56541 [ACK] Seq=98363 Ack=708 Win=49232 Len=0 TSval=1570565 TSecr=1774203848
165416  55.864206 41.177.98.127 -> 41.177.251.254 TCP 128 z39-50 > pvsw-inet [PSH, ACK] Seq=1 Ack=62 Win=49640 Len=70
166394  56.003944 41.177.98.127 -> 241.3.142.157 TCP 66 z39-50 > 10250 [SYN, ACK] Seq=0 Ack=1 Win=49680 Len=0 MSS=1460 SACK_PERM=1
166803  56.056046 41.177.98.127 -> 241.3.142.157 TCP 64 z39-50 > 10250 [ACK] Seq=1 Ack=92 Win=49589 Len=0
167696  56.186648 41.177.98.127 -> 254.214.213.72 TCP 66 z39-50 > agslb [SYN, ACK] Seq=0 Ack=1 Win=49640 Len=0 MSS=1460 SACK_PERM=1
167956  56.224266 41.177.98.127 -> 254.214.213.72 TCP 64 z39-50 > agslb [ACK] Seq=1 Ack=92 Win=49549 Len=0
171429  56.924309 41.177.98.127 -> 41.177.251.254 TCP 64 z39-50 > pvsw-inet [ACK] Seq=71 Ack=173 Win=49640 Len=0
171495  56.985612 41.177.98.127 -> 142.197.48.208 TCP 66 z39-50 > treehopper [SYN, ACK] Seq=0 Ack=1 Win=49640 Len=0 MSS=1460 SACK_PERM=1
171574  57.037583 41.177.98.127 -> 142.197.48.208 TCP 64 z39-50 > treehopper [ACK] Seq=1 Ack=116 Win=49640 Len=0
171596  57.064442 41.177.98.127 -> 41.177.251.254 TCP 75 z39-50 > pvsw-inet [PSH, ACK] Seq=71 Ack=173 Win=49640 Len=17
171893  57.244992 41.177.98.127 -> 213.197.255.209 TCP 1518 z39-50 > 56541 [ACK] Seq=98363 Ack=708 Win=49232 Len=1448 TSval=1570758 TSecr=1774203848
171894  57.245018 41.177.98.127 -> 213.197.255.209 TCP 1518 z39-50 > 56541 [ACK] Seq=99811 Ack=708 Win=49232 Len=1448 TSval=1570758 TSecr=1774203848
171895  57.245038 41.177.98.127 -> 213.197.255.209 TCP 1518 z39-50 > 56541 [ACK] Seq=101259 Ack=708 Win=49232 Len=1448 TSval=1570758 TSecr=1774203848
171964  57.270984 41.177.98.127 -> 213.197.255.209 TCP 1518 z39-50 > 56541 [ACK] Seq=102707 Ack=708 Win=49232 Len=1448 TSval=1570761 TSecr=1774205870
171965  57.271007 41.177.98.127 -> 213.197.255.209 TCP 1518 z39-50 > 56541 [ACK] Seq=104155 Ack=708 Win=49232 Len=1448 TSval=1570761 TSecr=1774205870
171966  57.271028 41.177.98.127 -> 213.197.255.209 TCP 1518 z39-50 > 56541 [ACK] Seq=105603 Ack=708 Win=49232 Len=1448 TSval=1570761 TSecr=1774205870
172051  57.297925 41.177.98.127 -> 213.197.255.209 TCP 1518 z39-50 > 56541 [ACK] Seq=107051 Ack=708 Win=49232 Len=1448 TSval=1570763 TSecr=1774205897
172052  57.297945 41.177.98.127 -> 213.197.255.209 TCP 1518 z39-50 > 56541 [PSH, ACK] Seq=108499 Ack=708 Win=49232 Len=1448 TSval=1570763 TSecr=1774205897
172057  57.299354 41.177.98.127 -> 213.197.255.209 TCP 1518 z39-50 > 56541 [ACK] Seq=109947 Ack=708 Win=49232 Len=1448 TSval=1570764 TSecr=1774205898
172058  57.299375 41.177.98.127 -> 213.197.255.209 TCP 1518 z39-50 > 56541 [PSH, ACK] Seq=111395 Ack=708 Win=49232 Len=1448 TSval=1570764 TSecr=1774205898
172096  57.323660 41.177.98.127 -> 213.197.255.209 TCP 1518 z39-50 > 56541 [ACK] Seq=112843 Ack=708 Win=49232 Len=1448 TSval=1570766 TSecr=1774205923
172097  57.323688 41.177.98.127 -> 213.197.255.209 TCP 1518 z39-50 > 56541 [PSH, ACK] Seq=114291 Ack=708 Win=49232 Len=1448 TSval=1570766 TSecr=1774205923
172103  57.325492 41.177.98.127 -> 213.197.255.209 TCP 1518 z39-50 > 56541 [ACK] Seq=115739 Ack=708 Win=49232 Len=1448 TSval=1570766 TSecr=1774205924
172104  57.325513 41.177.98.127 -> 213.197.255.209 TCP 1518 z39-50 > 56541 [PSH, ACK] Seq=117187 Ack=708 Win=49232 Len=1448 TSval=1570766 TSecr=1774205924
172130  57.349530 41.177.98.127 -> 213.197.255.209 TCP 1518 z39-50 > 56541 [ACK] Seq=118635 Ack=708 Win=49232 Len=1448 TSval=1570769 TSecr=1774205948
