31103  13.053314 41.177.37.176 -> 244.3.41.84  TCP 64 tripwire > telnet [ACK] Seq=40 Ack=820 Win=64716 Len=0
33692  14.312083 41.177.37.176 -> 244.3.41.84  TCP 64 tripwire > telnet [ACK] Seq=50 Ack=2396 Win=65535 Len=0
47983  19.725158 41.177.37.176 -> 244.3.41.84  TCP 64 tripwire > telnet [ACK] Seq=60 Ack=3548 Win=64383 Len=0
61590  25.193899 41.177.37.176 -> 244.3.41.84  TCP 64 tripwire > telnet [ACK] Seq=78 Ack=4084 Win=65535 Len=0
96747  36.350137 41.177.37.176 -> 244.3.41.84  TCP 64 tripwire > telnet [ACK] Seq=95 Ack=4302 Win=65317 Len=0
97868  36.568930 41.177.37.176 -> 244.3.41.84  TCP 64 tripwire > telnet [ACK] Seq=95 Ack=4311 Win=65308 Len=0
160729  54.725112 41.177.37.176 -> 244.3.41.84  TCP 64 tripwire > telnet [ACK] Seq=121 Ack=5449 Win=65535 Len=0
177371  59.537571 41.177.37.176 -> 244.3.41.84  TCP 64 tripwire > telnet [ACK] Seq=131 Ack=6083 Win=64901 Len=0
178556  59.975131 41.177.37.176 -> 244.3.41.84  TCP 64 tripwire > telnet [ACK] Seq=141 Ack=6778 Win=65535 Len=0
180377  60.740752 41.177.37.176 -> 244.3.41.84  TCP 64 tripwire > telnet [ACK] Seq=151 Ack=7380 Win=64933 Len=0
183356  61.615720 41.177.37.176 -> 244.3.41.84  TCP 64 tripwire > telnet [ACK] Seq=161 Ack=7940 Win=64373 Len=0
186627  62.709468 41.177.37.176 -> 244.3.41.84  TCP 64 tripwire > telnet [ACK] Seq=171 Ack=8371 Win=65535 Len=0
189198  64.568859 41.177.37.176 -> 244.3.41.84  TCP 64 tripwire > telnet [ACK] Seq=181 Ack=8914 Win=64992 Len=0
190470  65.443852 41.177.37.176 -> 244.3.41.84  TCP 64 tripwire > telnet [ACK] Seq=191 Ack=9443 Win=64463 Len=0
191740  65.990710 41.177.37.176 -> 244.3.41.84  TCP 64 tripwire > telnet [ACK] Seq=201 Ack=9874 Win=65535 Len=0
195966  67.303323 41.177.37.176 -> 244.3.41.84  TCP 64 tripwire > telnet [ACK] Seq=211 Ack=10407 Win=65002 Len=0
198482  68.178218 41.177.37.176 -> 244.3.41.84  TCP 64 tripwire > telnet [ACK] Seq=221 Ack=11146 Win=65535 Len=0
199448  68.615745 41.177.37.176 -> 244.3.41.84  TCP 64 tripwire > telnet [ACK] Seq=231 Ack=11797 Win=64884 Len=0
200324  69.053293 41.177.37.176 -> 244.3.41.84  TCP 64 tripwire > telnet [ACK] Seq=241 Ack=12195 Win=64486 Len=0
227801  78.063686 41.177.37.176 -> 244.3.41.84  TCP 64 tripwire > telnet [ACK] Seq=251 Ack=13887 Win=65535 Len=0
620890 197.422345 41.177.37.176 -> 244.3.41.84  TCP 64 tripwire > telnet [ACK] Seq=261 Ack=15643 Win=65535 Len=0
645676 203.037413 41.177.37.176 -> 244.3.41.84  TCP 64 tripwire > telnet [ACK] Seq=271 Ack=16462 Win=64716 Len=0
649648 204.019121 41.177.37.176 -> 244.3.41.84  TCP 64 tripwire > telnet [ACK] Seq=281 Ack=18038 Win=65535 Len=0
671939 209.381117 41.177.37.176 -> 244.3.41.84  TCP 64 tripwire > telnet [ACK] Seq=300 Ack=18857 Win=64716 Len=0
673983 210.376863 41.177.37.176 -> 244.3.41.84  TCP 64 tripwire > telnet [ACK] Seq=310 Ack=20433 Win=65535 Len=0
686696 215.780797 41.177.37.176 -> 244.3.41.84  TCP 64 tripwire > telnet [ACK] Seq=330 Ack=22787 Win=65535 Len=0
817667 266.799420 41.177.37.176 -> 244.3.41.84  TCP 64 tripwire > telnet [ACK] Seq=340 Ack=24567 Win=65535 Len=0
820935 267.898849 41.177.37.176 -> 244.3.41.84  TCP 64 tripwire > telnet [ACK] Seq=350 Ack=26275 Win=65535 Len=0
821540 268.131092 41.177.37.176 -> 244.3.41.84  TCP 64 tripwire > telnet [ACK] Seq=350 Ack=26284 Win=65526 Len=0
877048 290.649249 41.177.37.176 -> 244.3.41.84  TCP 64 tripwire > telnet [ACK] Seq=369 Ack=26643 Win=65167 Len=0
892414 295.365455 41.177.37.176 -> 244.3.41.84  TCP 64 tripwire > telnet [ACK] Seq=383 Ack=27885 Win=65535 Len=0
910208 300.776577 41.177.37.176 -> 244.3.41.84  TCP 64 tripwire > telnet [ACK] Seq=393 Ack=29549 Win=65535 Len=0
926727 308.802856 41.177.37.176 -> 244.3.41.84  TCP 64 tripwire > telnet [ACK] Seq=407 Ack=29571 Win=65513 Len=0
927220 309.037213 41.177.37.176 -> 244.3.41.84  TCP 64 tripwire > telnet [ACK] Seq=407 Ack=29589 Win=65495 Len=0
928114 309.240345 41.177.37.176 -> 244.3.41.84  TCP 64 tripwire > telnet [ACK] Seq=407 Ack=29674 Win=65410 Len=0
929809 309.794224 41.177.37.176 -> 244.3.41.84  TCP 64 tripwire > telnet [ACK] Seq=417 Ack=31146 Win=65535 Len=0
933080 310.822054 41.177.37.176 -> 244.3.41.84  TCP 64 tripwire > telnet [ACK] Seq=427 Ack=32537 Win=65535 Len=0
