112692  40.154093 41.67.197.204 -> 244.3.210.197 TCP 66 vaprtm > http [SYN] Seq=0 Win=65535 Len=0 MSS=1460 SACK_PERM=1
112991  40.214088 41.67.197.204 -> 244.3.210.197 TCP 64 vaprtm > http [ACK] Seq=1 Ack=1 Win=65535 Len=0
114178  40.716849 41.67.197.204 -> 244.3.210.197 TCP 64 vaprtm > http [ACK] Seq=886 Ack=2921 Win=65535 Len=0
114255  40.777798 41.67.197.204 -> 244.3.210.197 TCP 64 vaprtm > http [ACK] Seq=886 Ack=4381 Win=65535 Len=0
114263  40.779402 41.67.197.204 -> 244.3.210.197 TCP 64 vaprtm > http [RST, ACK] Seq=886 Ack=5841 Win=0 Len=0
116838  41.769102 41.67.197.204 -> 244.3.210.197 TCP 66 abatemgr > http [SYN] Seq=0 Win=65535 Len=0 MSS=1460 SACK_PERM=1
116975  41.830563 41.67.197.204 -> 244.3.210.197 TCP 64 abatemgr > http [ACK] Seq=1 Ack=1 Win=65535 Len=0
117965  42.324602 41.67.197.204 -> 244.3.210.197 TCP 64 abatemgr > http [ACK] Seq=954 Ack=2921 Win=65535 Len=0
118092  42.385612 41.67.197.204 -> 244.3.210.197 TCP 64 abatemgr > http [ACK] Seq=954 Ack=4381 Win=65535 Len=0
118108  42.387343 41.67.197.204 -> 244.3.210.197 TCP 64 abatemgr > http [ACK] Seq=954 Ack=7301 Win=65535 Len=0
118208  42.423924 41.67.197.204 -> 244.3.210.197 TCP 66 abatjss > http [SYN] Seq=0 Win=65535 Len=0 MSS=1460 SACK_PERM=1
118215  42.424815 41.67.197.204 -> 244.3.210.197 TCP 66 immedianet-bcn > http [SYN] Seq=0 Win=65535 Len=0 MSS=1460 SACK_PERM=1
118216  42.424866 41.67.197.204 -> 244.3.210.197 TCP 66 ps-ams > http [SYN] Seq=0 Win=65535 Len=0 MSS=1460 SACK_PERM=1
118230  42.425119 41.67.197.204 -> 244.3.210.197 TCP 66 apple-sasl > http [SYN] Seq=0 Win=65535 Len=0 MSS=1460 SACK_PERM=1
118255  42.445584 41.67.197.204 -> 244.3.210.197 TCP 66 can-nds-ssl > http [SYN] Seq=0 Win=65535 Len=0 MSS=1460 SACK_PERM=1
118262  42.446835 41.67.197.204 -> 244.3.210.197 TCP 64 abatemgr > http [ACK] Seq=954 Ack=8761 Win=65535 Len=0
118270  42.449165 41.67.197.204 -> 244.3.210.197 TCP 64 abatemgr > http [ACK] Seq=954 Ack=11681 Win=65535 Len=0
118278  42.449595 41.67.197.204 -> 244.3.210.197 TCP 64 abatemgr > http [ACK] Seq=954 Ack=13141 Win=65535 Len=0
118300  42.484133 41.67.197.204 -> 244.3.210.197 TCP 64 abatjss > http [ACK] Seq=1 Ack=1 Win=65535 Len=0
118316  42.489094 41.67.197.204 -> 244.3.210.197 TCP 64 immedianet-bcn > http [ACK] Seq=1 Ack=1 Win=65535 Len=0
118317  42.489099 41.67.197.204 -> 244.3.210.197 TCP 64 ps-ams > http [ACK] Seq=1 Ack=1 Win=65535 Len=0
118326  42.489412 41.67.197.204 -> 244.3.210.197 TCP 64 apple-sasl > http [ACK] Seq=1 Ack=1 Win=65535 Len=0
118411  42.505872 41.67.197.204 -> 244.3.210.197 TCP 64 can-nds-ssl > http [ACK] Seq=1 Ack=1 Win=65535 Len=0
118430  42.510395 41.67.197.204 -> 244.3.210.197 TCP 64 abatemgr > http [ACK] Seq=954 Ack=16061 Win=65535 Len=0
118431  42.510459 41.67.197.204 -> 244.3.210.197 TCP 64 abatemgr > http [ACK] Seq=954 Ack=17521 Win=65535 Len=0
118448  42.511446 41.67.197.204 -> 244.3.210.197 TCP 64 abatemgr > http [ACK] Seq=954 Ack=19435 Win=65535 Len=0
118497  42.552909 41.67.197.204 -> 244.3.210.197 TCP 64 abatjss > http [ACK] Seq=832 Ack=2921 Win=65535 Len=0
118508  42.556933 41.67.197.204 -> 244.3.210.197 TCP 64 immedianet-bcn > http [ACK] Seq=822 Ack=2921 Win=65535 Len=0
118522  42.561326 41.67.197.204 -> 244.3.210.197 TCP 64 ps-ams > http [ACK] Seq=828 Ack=2921 Win=65535 Len=0
118545  42.564138 41.67.197.204 -> 244.3.210.197 TCP 64 apple-sasl > http [ACK] Seq=831 Ack=2921 Win=65535 Len=0
118556  42.573342 41.67.197.204 -> 244.3.210.197 TCP 64 can-nds-ssl > http [ACK] Seq=816 Ack=2921 Win=65535 Len=0
118569  42.578123 41.67.197.204 -> 244.3.210.197 TCP 64 abatemgr > http [ACK] Seq=1773 Ack=22104 Win=65535 Len=0
118644  42.614625 41.67.197.204 -> 244.3.210.197 TCP 64 abatjss > http [ACK] Seq=832 Ack=4381 Win=65535 Len=0
118656  42.615848 41.67.197.204 -> 244.3.210.197 TCP 64 abatjss > http [ACK] Seq=832 Ack=7301 Win=65535 Len=0
118664  42.617901 41.67.197.204 -> 244.3.210.197 TCP 64 immedianet-bcn > http [ACK] Seq=822 Ack=4381 Win=65535 Len=0
118677  42.619611 41.67.197.204 -> 244.3.210.197 TCP 64 immedianet-bcn > http [ACK] Seq=822 Ack=7301 Win=65535 Len=0
118714  42.634651 41.67.197.204 -> 244.3.210.197 TCP 64 can-nds-ssl > http [ACK] Seq=816 Ack=4381 Win=65535 Len=0
118722  42.635609 41.67.197.204 -> 244.3.210.197 TCP 64 can-nds-ssl > http [ACK] Seq=816 Ack=7301 Win=65535 Len=0
118768  42.646606 41.67.197.204 -> 244.3.210.197 TCP 64 abatemgr > http [ACK] Seq=2600 Ack=25024 Win=65535 Len=0
118776  42.647578 41.67.197.204 -> 244.3.210.197 TCP 64 abatemgr > http [ACK] Seq=2600 Ack=26484 Win=65535 Len=0
118839  42.676149 41.67.197.204 -> 244.3.210.197 TCP 64 abatjss > http [ACK] Seq=832 Ack=8761 Win=65535 Len=0
118846  42.676929 41.67.197.204 -> 244.3.210.197 TCP 64 abatjss > http [ACK] Seq=832 Ack=10382 Win=65535 Len=0
118859  42.681070 41.67.197.204 -> 244.3.210.197 TCP 64 immedianet-bcn > http [ACK] Seq=822 Ack=8761 Win=65535 Len=0
118872  42.681380 41.67.197.204 -> 244.3.210.197 TCP 64 immedianet-bcn > http [ACK] Seq=822 Ack=11681 Win=65535 Len=0
118882  42.681833 41.67.197.204 -> 244.3.210.197 TCP 64 immedianet-bcn > http [ACK] Seq=822 Ack=13141 Win=65535 Len=0
118917  42.689864 41.67.197.204 -> 244.3.210.197 TCP 64 ps-ams > http [ACK] Seq=1645 Ack=6286 Win=65535 Len=0
118926  42.690129 41.67.197.204 -> 244.3.210.197 TCP 64 ps-ams > http [ACK] Seq=1645 Ack=7746 Win=65535 Len=0
118934  42.692899 41.67.197.204 -> 244.3.210.197 TCP 64 apple-sasl > http [ACK] Seq=1646 Ack=6222 Win=65535 Len=0
118944  42.693892 41.67.197.204 -> 244.3.210.197 TCP 64 apple-sasl > http [ACK] Seq=1646 Ack=7682 Win=65535 Len=0
118950  42.695826 41.67.197.204 -> 244.3.210.197 TCP 64 can-nds-ssl > http [ACK] Seq=816 Ack=8761 Win=65535 Len=0
118958  42.697346 41.67.197.204 -> 244.3.210.197 TCP 64 can-nds-ssl > http [ACK] Seq=816 Ack=11681 Win=65535 Len=0
118967  42.698593 41.67.197.204 -> 244.3.210.197 TCP 64 can-nds-ssl > http [ACK] Seq=816 Ack=13141 Win=65535 Len=0
119023  42.715342 41.67.197.204 -> 244.3.210.197 TCP 64 abatemgr > http [ACK] Seq=3411 Ack=29777 Win=65535 Len=0
119029  42.716140 41.67.197.204 -> 244.3.210.197 TCP 64 abatemgr > http [ACK] Seq=3411 Ack=31237 Win=65535 Len=0
119035  42.717346 41.67.197.204 -> 244.3.210.197 TCP 64 abatemgr > http [ACK] Seq=3411 Ack=34157 Win=65535 Len=0
119041  42.718125 41.67.197.204 -> 244.3.210.197 TCP 64 abatemgr > http [ACK] Seq=3411 Ack=35617 Win=65535 Len=0
119124  42.742359 41.67.197.204 -> 244.3.210.197 TCP 64 immedianet-bcn > http [ACK] Seq=822 Ack=16061 Win=65535 Len=0
119135  42.742869 41.67.197.204 -> 244.3.210.197 TCP 64 immedianet-bcn > http [ACK] Seq=822 Ack=17521 Win=65535 Len=0
119145  42.744373 41.67.197.204 -> 244.3.210.197 TCP 64 immedianet-bcn > http [ACK] Seq=822 Ack=20441 Win=65535 Len=0
119153  42.744871 41.67.197.204 -> 244.3.210.197 TCP 64 immedianet-bcn > http [ACK] Seq=822 Ack=21901 Win=65535 Len=0
119161  42.746384 41.67.197.204 -> 244.3.210.197 TCP 64 immedianet-bcn > http [ACK] Seq=822 Ack=24821 Win=65535 Len=0
119167  42.747105 41.67.197.204 -> 244.3.210.197 TCP 64 abatjss > http [ACK] Seq=1644 Ack=13302 Win=65535 Len=0
119178  42.751843 41.67.197.204 -> 244.3.210.197 TCP 64 ps-ams > http [ACK] Seq=1645 Ack=10666 Win=65535 Len=0
119190  42.752102 41.67.197.204 -> 244.3.210.197 TCP 64 ps-ams > http [ACK] Seq=1645 Ack=12126 Win=65535 Len=0
119197  42.753123 41.67.197.204 -> 244.3.210.197 TCP 64 ps-ams > http [ACK] Seq=1645 Ack=14441 Win=65535 Len=0
119218  42.757287 41.67.197.204 -> 244.3.210.197 TCP 64 apple-sasl > http [ACK] Seq=1646 Ack=10602 Win=65535 Len=0
119230  42.757544 41.67.197.204 -> 244.3.210.197 TCP 64 apple-sasl > http [ACK] Seq=1646 Ack=12062 Win=65535 Len=0
119253  42.761627 41.67.197.204 -> 244.3.210.197 TCP 64 can-nds-ssl > http [ACK] Seq=816 Ack=16061 Win=65535 Len=0
119254  42.761659 41.67.197.204 -> 244.3.210.197 TCP 64 can-nds-ssl > http [ACK] Seq=816 Ack=17521 Win=65535 Len=0
119270  42.762130 41.67.197.204 -> 244.3.210.197 TCP 64 can-nds-ssl > http [ACK] Seq=816 Ack=20441 Win=65535 Len=0
119279  42.762383 41.67.197.204 -> 244.3.210.197 TCP 64 can-nds-ssl > http [ACK] Seq=816 Ack=21901 Win=65535 Len=0
119296  42.764349 41.67.197.204 -> 244.3.210.197 TCP 64 can-nds-ssl > http [ACK] Seq=816 Ack=24821 Win=65535 Len=0
119336  42.786646 41.67.197.204 -> 244.3.210.197 TCP 64 abatemgr > http [ACK] Seq=4227 Ack=38963 Win=65535 Len=0
119347  42.787128 41.67.197.204 -> 244.3.210.197 TCP 64 abatemgr > http [ACK] Seq=4227 Ack=40393 Win=64105 Len=0
119376  42.803914 41.67.197.204 -> 244.3.210.197 TCP 64 immedianet-bcn > http [ACK] Seq=822 Ack=26281 Win=65535 Len=0
119382  42.805343 41.67.197.204 -> 244.3.210.197 TCP 64 immedianet-bcn > http [ACK] Seq=822 Ack=29201 Win=65535 Len=0
119389  42.805891 41.67.197.204 -> 244.3.210.197 TCP 64 immedianet-bcn > http [ACK] Seq=822 Ack=30661 Win=65535 Len=0
119396  42.806621 41.67.197.204 -> 244.3.210.197 TCP 64 immedianet-bcn > http [ACK] Seq=822 Ack=33581 Win=65535 Len=0
119428  42.815099 41.67.197.204 -> 244.3.210.197 TCP 64 abatjss > http [ACK] Seq=2454 Ack=16860 Win=65535 Len=0
119436  42.816621 41.67.197.204 -> 244.3.210.197 TCP 64 abatjss > http [ACK] Seq=2454 Ack=18320 Win=65535 Len=0
119445  42.817818 41.67.197.204 -> 244.3.210.197 TCP 64 abatjss > http [ACK] Seq=2454 Ack=21240 Win=65535 Len=0
119451  42.819406 41.67.197.204 -> 244.3.210.197 TCP 64 abatjss > http [ACK] Seq=2454 Ack=22700 Win=65535 Len=0
119458  42.820627 41.67.197.204 -> 244.3.210.197 TCP 64 abatjss > http [ACK] Seq=2454 Ack=24719 Win=65535 Len=0
119469  42.824616 41.67.197.204 -> 244.3.210.197 TCP 64 ps-ams > http [ACK] Seq=2458 Ack=17361 Win=65535 Len=0
119470  42.824621 41.67.197.204 -> 244.3.210.197 TCP 64 ps-ams > http [ACK] Seq=2458 Ack=18821 Win=65535 Len=0
119489  42.825061 41.67.197.204 -> 244.3.210.197 TCP 64 ps-ams > http [ACK] Seq=2458 Ack=21741 Win=65535 Len=0
119493  42.825349 41.67.197.204 -> 244.3.210.197 TCP 64 ps-ams > http [ACK] Seq=2458 Ack=23201 Win=65535 Len=0
119494  42.825405 41.67.197.204 -> 244.3.210.197 TCP 64 ps-ams > http [ACK] Seq=2458 Ack=26121 Win=65535 Len=0
119515  42.826382 41.67.197.204 -> 244.3.210.197 TCP 64 ps-ams > http [ACK] Seq=2458 Ack=27581 Win=65535 Len=0
119532  42.828340 41.67.197.204 -> 244.3.210.197 TCP 64 can-nds-ssl > http [ACK] Seq=816 Ack=26281 Win=65535 Len=0
119542  42.832624 41.67.197.204 -> 244.3.210.197 TCP 64 can-nds-ssl > http [ACK] Seq=816 Ack=29201 Win=65535 Len=0
119551  42.834583 41.67.197.204 -> 244.3.210.197 TCP 64 can-nds-ssl > http [ACK] Seq=816 Ack=30661 Win=65535 Len=0
119559  42.838362 41.67.197.204 -> 244.3.210.197 TCP 64 can-nds-ssl > http [ACK] Seq=816 Ack=33581 Win=65535 Len=0
119568  42.840360 41.67.197.204 -> 244.3.210.197 TCP 64 can-nds-ssl > http [ACK] Seq=816 Ack=35041 Win=65535 Len=0
119578  42.844356 41.67.197.204 -> 244.3.210.197 TCP 64 can-nds-ssl > http [ACK] Seq=816 Ack=37961 Win=65535 Len=0
119587  42.846602 41.67.197.204 -> 244.3.210.197 TCP 64 can-nds-ssl > http [ACK] Seq=816 Ack=39421 Win=65535 Len=0
119595  42.850876 41.67.197.204 -> 244.3.210.197 TCP 64 apple-sasl > http [ACK] Seq=2458 Ack=15975 Win=65535 Len=0
119605  42.852875 41.67.197.204 -> 244.3.210.197 TCP 64 apple-sasl > http [ACK] Seq=2458 Ack=17435 Win=65535 Len=0
119627  42.857338 41.67.197.204 -> 244.3.210.197 TCP 64 apple-sasl > http [ACK] Seq=2458 Ack=20355 Win=65535 Len=0
119637  42.859381 41.67.197.204 -> 244.3.210.197 TCP 64 apple-sasl > http [ACK] Seq=2458 Ack=21815 Win=65535 Len=0
119649  42.862896 41.67.197.204 -> 244.3.210.197 TCP 64 apple-sasl > http [ACK] Seq=2458 Ack=24735 Win=65535 Len=0
119660  42.864868 41.67.197.204 -> 244.3.210.197 TCP 64 apple-sasl > http [ACK] Seq=2458 Ack=26195 Win=65535 Len=0
119670  42.868526 41.67.197.204 -> 244.3.210.197 TCP 64 can-nds-ssl > http [ACK] Seq=816 Ack=42341 Win=65535 Len=0
119698  42.870608 41.67.197.204 -> 244.3.210.197 TCP 64 can-nds-ssl > http [ACK] Seq=816 Ack=43801 Win=65535 Len=0
119708  42.874821 41.67.197.204 -> 244.3.210.197 TCP 64 abatemgr > http [ACK] Seq=5047 Ack=43313 Win=65535 Len=0
119719  42.876886 41.67.197.204 -> 244.3.210.197 TCP 64 abatemgr > http [ACK] Seq=5047 Ack=44773 Win=65535 Len=0
119731  42.878903 41.67.197.204 -> 244.3.210.197 TCP 64 abatemgr > http [ACK] Seq=5047 Ack=46256 Win=65535 Len=0
119744  42.882897 41.67.197.204 -> 244.3.210.197 TCP 64 immedianet-bcn > http [ACK] Seq=1638 Ack=37163 Win=65535 Len=0
119762  42.888156 41.67.197.204 -> 244.3.210.197 TCP 64 ps-ams > http [ACK] Seq=2458 Ack=30501 Win=65535 Len=0
119780  42.890122 41.67.197.204 -> 244.3.210.197 TCP 64 ps-ams > http [ACK] Seq=2458 Ack=31961 Win=65535 Len=0
119791  42.894093 41.67.197.204 -> 244.3.210.197 TCP 64 ps-ams > http [ACK] Seq=2458 Ack=34881 Win=65535 Len=0
119799  42.895651 41.67.197.204 -> 244.3.210.197 TCP 64 ps-ams > http [ACK] Seq=2458 Ack=36341 Win=65535 Len=0
119813  42.900613 41.67.197.204 -> 244.3.210.197 TCP 64 ps-ams > http [ACK] Seq=2458 Ack=39261 Win=65535 Len=0
119823  42.902109 41.67.197.204 -> 244.3.210.197 TCP 64 ps-ams > http [ACK] Seq=2458 Ack=40721 Win=65535 Len=0
119840  42.906186 41.67.197.204 -> 244.3.210.197 TCP 64 ps-ams > http [ACK] Seq=2458 Ack=43641 Win=65535 Len=0
119848  42.908139 41.67.197.204 -> 244.3.210.197 TCP 64 ps-ams > http [ACK] Seq=2458 Ack=45101 Win=65535 Len=0
119878  42.914833 41.67.197.204 -> 244.3.210.197 TCP 64 abatjss > http [ACK] Seq=3263 Ack=27639 Win=65535 Len=0
119892  42.916865 41.67.197.204 -> 244.3.210.197 TCP 64 abatjss > http [ACK] Seq=3263 Ack=29099 Win=65535 Len=0
119908  42.921139 41.67.197.204 -> 244.3.210.197 TCP 64 abatjss > http [ACK] Seq=3263 Ack=32019 Win=65535 Len=0
119915  42.922365 41.67.197.204 -> 244.3.210.197 TCP 64 abatjss > http [ACK] Seq=3263 Ack=33479 Win=65535 Len=0
119931  42.925131 41.67.197.204 -> 244.3.210.197 TCP 64 ps-ams > http [ACK] Seq=2458 Ack=48021 Win=65535 Len=0
119944  42.927890 41.67.197.204 -> 244.3.210.197 TCP 64 abatjss > http [ACK] Seq=3263 Ack=36052 Win=65535 Len=0
119957  42.930395 41.67.197.204 -> 244.3.210.197 TCP 64 ps-ams > http [ACK] Seq=2458 Ack=49481 Win=65535 Len=0
120002  42.934388 41.67.197.204 -> 244.3.210.197 TCP 64 can-nds-ssl > http [ACK] Seq=816 Ack=46721 Win=65535 Len=0
120019  42.936353 41.67.197.204 -> 244.3.210.197 TCP 64 can-nds-ssl > http [ACK] Seq=816 Ack=48181 Win=65535 Len=0
120058  42.939854 41.67.197.204 -> 244.3.210.197 TCP 64 can-nds-ssl > http [ACK] Seq=816 Ack=51101 Win=65535 Len=0
120078  42.941866 41.67.197.204 -> 244.3.210.197 TCP 64 can-nds-ssl > http [ACK] Seq=816 Ack=52561 Win=65535 Len=0
120093  42.946425 41.67.197.204 -> 244.3.210.197 TCP 64 can-nds-ssl > http [ACK] Seq=816 Ack=55481 Win=65535 Len=0
120112  42.948385 41.67.197.204 -> 244.3.210.197 TCP 64 can-nds-ssl > http [ACK] Seq=816 Ack=56941 Win=65535 Len=0
120146  42.952420 41.67.197.204 -> 244.3.210.197 TCP 64 can-nds-ssl > http [ACK] Seq=816 Ack=59861 Win=65535 Len=0
120169  42.954819 41.67.197.204 -> 244.3.210.197 TCP 64 can-nds-ssl > http [ACK] Seq=816 Ack=61321 Win=65535 Len=0
120190  42.958815 41.67.197.204 -> 244.3.210.197 TCP 64 can-nds-ssl > http [ACK] Seq=816 Ack=64241 Win=65535 Len=0
120206  42.960808 41.67.197.204 -> 244.3.210.197 TCP 64 can-nds-ssl > http [ACK] Seq=816 Ack=65701 Win=65535 Len=0
120231  42.964400 41.67.197.204 -> 244.3.210.197 TCP 64 can-nds-ssl > http [ACK] Seq=816 Ack=68621 Win=65535 Len=0
120260  42.969128 41.67.197.204 -> 244.3.210.197 TCP 64 apple-sasl > http [ACK] Seq=2458 Ack=29115 Win=65535 Len=0
120276  42.970826 41.67.197.204 -> 244.3.210.197 TCP 64 apple-sasl > http [ACK] Seq=2458 Ack=30575 Win=65535 Len=0
120308  42.974877 41.67.197.204 -> 244.3.210.197 TCP 64 apple-sasl > http [ACK] Seq=2458 Ack=33495 Win=65535 Len=0
120327  42.976852 41.67.197.204 -> 244.3.210.197 TCP 64 apple-sasl > http [ACK] Seq=2458 Ack=34955 Win=65535 Len=0
120357  42.981362 41.67.197.204 -> 244.3.210.197 TCP 64 apple-sasl > http [ACK] Seq=2458 Ack=37875 Win=65535 Len=0
120373  42.983399 41.67.197.204 -> 244.3.210.197 TCP 64 apple-sasl > http [ACK] Seq=2458 Ack=39335 Win=65535 Len=0
120388  42.986127 41.67.197.204 -> 244.3.210.197 TCP 64 immedianet-bcn > http [ACK] Seq=1638 Ack=37700 Win=64998 Len=0
120394  42.987084 41.67.197.204 -> 244.3.210.197 TCP 64 apple-sasl > http [ACK] Seq=2458 Ack=42255 Win=65535 Len=0
120408  42.989121 41.67.197.204 -> 244.3.210.197 TCP 64 apple-sasl > http [ACK] Seq=2458 Ack=43715 Win=65535 Len=0
120430  42.992603 41.67.197.204 -> 244.3.210.197 TCP 64 apple-sasl > http [ACK] Seq=2458 Ack=46635 Win=65535 Len=0
120443  42.994595 41.67.197.204 -> 244.3.210.197 TCP 64 apple-sasl > http [ACK] Seq=2458 Ack=48095 Win=65535 Len=0
120453  42.996632 41.67.197.204 -> 244.3.210.197 TCP 64 can-nds-ssl > http [ACK] Seq=816 Ack=70081 Win=65535 Len=0
120474  43.001120 41.67.197.204 -> 244.3.210.197 TCP 64 can-nds-ssl > http [ACK] Seq=816 Ack=73001 Win=65535 Len=0
120490  43.003103 41.67.197.204 -> 244.3.210.197 TCP 64 can-nds-ssl > http [ACK] Seq=816 Ack=74461 Win=65535 Len=0
120539  43.009356 41.67.197.204 -> 244.3.210.197 TCP 64 ps-ams > http [ACK] Seq=2458 Ack=52401 Win=65535 Len=0
120547  43.011369 41.67.197.204 -> 244.3.210.197 TCP 64 can-nds-ssl > http [ACK] Seq=816 Ack=77381 Win=65535 Len=0
120556  43.013377 41.67.197.204 -> 244.3.210.197 TCP 64 can-nds-ssl > http [ACK] Seq=816 Ack=78841 Win=65535 Len=0
120573  43.017862 41.67.197.204 -> 244.3.210.197 TCP 64 can-nds-ssl > http [ACK] Seq=816 Ack=81761 Win=65535 Len=0
120585  43.019858 41.67.197.204 -> 244.3.210.197 TCP 64 can-nds-ssl > http [ACK] Seq=816 Ack=83221 Win=65535 Len=0
120600  43.023364 41.67.197.204 -> 244.3.210.197 TCP 64 can-nds-ssl > http [ACK] Seq=816 Ack=86141 Win=65535 Len=0
120608  43.025383 41.67.197.204 -> 244.3.210.197 TCP 64 can-nds-ssl > http [ACK] Seq=816 Ack=87601 Win=65535 Len=0
120619  43.030132 41.67.197.204 -> 244.3.210.197 TCP 64 can-nds-ssl > http [ACK] Seq=816 Ack=90521 Win=65535 Len=0
120626  43.031838 41.67.197.204 -> 244.3.210.197 TCP 64 can-nds-ssl > http [ACK] Seq=816 Ack=91981 Win=65535 Len=0
120662  43.035858 41.67.197.204 -> 244.3.210.197 TCP 64 can-nds-ssl > http [ACK] Seq=816 Ack=94901 Win=65535 Len=0
120671  43.037834 41.67.197.204 -> 244.3.210.197 TCP 64 can-nds-ssl > http [ACK] Seq=816 Ack=96361 Win=65535 Len=0
120697  43.042400 41.67.197.204 -> 244.3.210.197 TCP 64 can-nds-ssl > http [ACK] Seq=816 Ack=99281 Win=65535 Len=0
120708  43.044402 41.67.197.204 -> 244.3.210.197 TCP 64 can-nds-ssl > http [ACK] Seq=816 Ack=100741 Win=65535 Len=0
120724  43.048798 41.67.197.204 -> 244.3.210.197 TCP 64 can-nds-ssl > http [ACK] Seq=816 Ack=103661 Win=65535 Len=0
120730  43.050862 41.67.197.204 -> 244.3.210.197 TCP 64 can-nds-ssl > http [ACK] Seq=816 Ack=105121 Win=65535 Len=0
120741  43.054409 41.67.197.204 -> 244.3.210.197 TCP 64 can-nds-ssl > http [ACK] Seq=816 Ack=108041 Win=65535 Len=0
120747  43.056349 41.67.197.204 -> 244.3.210.197 TCP 64 can-nds-ssl > http [ACK] Seq=816 Ack=109501 Win=65535 Len=0
120754  43.060383 41.67.197.204 -> 244.3.210.197 TCP 64 can-nds-ssl > http [ACK] Seq=816 Ack=112421 Win=65535 Len=0
120767  43.062097 41.67.197.204 -> 244.3.210.197 TCP 64 can-nds-ssl > http [ACK] Seq=816 Ack=113881 Win=65535 Len=0
120775  43.066097 41.67.197.204 -> 244.3.210.197 TCP 64 can-nds-ssl > http [ACK] Seq=816 Ack=116801 Win=65535 Len=0
120788  43.070433 41.67.197.204 -> 244.3.210.197 TCP 64 apple-sasl > http [ACK] Seq=2458 Ack=51015 Win=65535 Len=0
120796  43.072382 41.67.197.204 -> 244.3.210.197 TCP 64 apple-sasl > http [ACK] Seq=2458 Ack=52475 Win=65535 Len=0
120806  43.076111 41.67.197.204 -> 244.3.210.197 TCP 64 apple-sasl > http [ACK] Seq=2458 Ack=55395 Win=65535 Len=0
120812  43.078162 41.67.197.204 -> 244.3.210.197 TCP 64 apple-sasl > http [ACK] Seq=2458 Ack=56855 Win=65535 Len=0
120824  43.082877 41.67.197.204 -> 244.3.210.197 TCP 64 apple-sasl > http [ACK] Seq=2458 Ack=59775 Win=65535 Len=0
120830  43.084401 41.67.197.204 -> 244.3.210.197 TCP 64 apple-sasl > http [ACK] Seq=2458 Ack=61235 Win=65535 Len=0
120838  43.088439 41.67.197.204 -> 244.3.210.197 TCP 64 apple-sasl > http [ACK] Seq=2458 Ack=64155 Win=65535 Len=0
120849  43.091334 41.67.197.204 -> 244.3.210.197 TCP 64 apple-sasl > http [ACK] Seq=2458 Ack=65615 Win=65535 Len=0
120867  43.094899 41.67.197.204 -> 244.3.210.197 TCP 64 apple-sasl > http [ACK] Seq=2458 Ack=68535 Win=65535 Len=0
120881  43.096847 41.67.197.204 -> 244.3.210.197 TCP 64 apple-sasl > http [ACK] Seq=2458 Ack=69995 Win=65535 Len=0
120898  43.101366 41.67.197.204 -> 244.3.210.197 TCP 64 apple-sasl > http [ACK] Seq=2458 Ack=72915 Win=65535 Len=0
120907  43.103337 41.67.197.204 -> 244.3.210.197 TCP 64 apple-sasl > http [ACK] Seq=2458 Ack=74375 Win=65535 Len=0
120921  43.107605 41.67.197.204 -> 244.3.210.197 TCP 64 apple-sasl > http [ACK] Seq=2458 Ack=77295 Win=65535 Len=0
120931  43.110362 41.67.197.204 -> 244.3.210.197 TCP 64 can-nds-ssl > http [ACK] Seq=816 Ack=118261 Win=65535 Len=0
120943  43.114593 41.67.197.204 -> 244.3.210.197 TCP 64 can-nds-ssl > http [ACK] Seq=816 Ack=121181 Win=65535 Len=0
120977  43.115884 41.67.197.204 -> 244.3.210.197 TCP 64 can-nds-ssl > http [ACK] Seq=816 Ack=122641 Win=65535 Len=0
120983  43.119598 41.67.197.204 -> 244.3.210.197 TCP 64 can-nds-ssl > http [ACK] Seq=816 Ack=125561 Win=65535 Len=0
120994  43.121599 41.67.197.204 -> 244.3.210.197 TCP 64 can-nds-ssl > http [ACK] Seq=816 Ack=127021 Win=65535 Len=0
121004  43.125867 41.67.197.204 -> 244.3.210.197 TCP 64 can-nds-ssl > http [ACK] Seq=816 Ack=129941 Win=65535 Len=0
121017  43.127907 41.67.197.204 -> 244.3.210.197 TCP 64 can-nds-ssl > http [ACK] Seq=816 Ack=131401 Win=65535 Len=0
121031  43.131594 41.67.197.204 -> 244.3.210.197 TCP 64 can-nds-ssl > http [ACK] Seq=816 Ack=134321 Win=65535 Len=0
121090  43.186115 41.67.197.204 -> 244.3.210.197 TCP 64 ps-ams > http [ACK] Seq=2458 Ack=52584 Win=65352 Len=0
121470  43.286412 41.67.197.204 -> 244.3.210.197 TCP 64 can-nds-ssl > http [ACK] Seq=816 Ack=134326 Win=65530 Len=0
121471  43.286433 41.67.197.204 -> 244.3.210.197 TCP 64 apple-sasl > http [ACK] Seq=2458 Ack=77645 Win=65185 Len=0
121496  43.293145 41.67.197.204 -> 244.3.210.197 TCP 64 abatemgr > http [ACK] Seq=5860 Ack=49176 Win=65535 Len=0
121505  43.294122 41.67.197.204 -> 244.3.210.197 TCP 64 abatemgr > http [ACK] Seq=5860 Ack=50636 Win=65535 Len=0
121733  43.385362 41.67.197.204 -> 244.3.210.197 TCP 64 immedianet-bcn > http [ACK] Seq=2452 Ack=40620 Win=65535 Len=0
121742  43.386623 41.67.197.204 -> 244.3.210.197 TCP 64 immedianet-bcn > http [ACK] Seq=2452 Ack=42080 Win=65535 Len=0
121748  43.388122 41.67.197.204 -> 244.3.210.197 TCP 64 immedianet-bcn > http [ACK] Seq=2452 Ack=45000 Win=65535 Len=0
121757  43.388876 41.67.197.204 -> 244.3.210.197 TCP 64 immedianet-bcn > http [ACK] Seq=2452 Ack=46460 Win=65535 Len=0
121763  43.390141 41.67.197.204 -> 244.3.210.197 TCP 64 immedianet-bcn > http [ACK] Seq=2452 Ack=49380 Win=62615 Len=0
121771  43.390635 41.67.197.204 -> 244.3.210.197 TCP 64 [TCP Window Update] immedianet-bcn > http [ACK] Seq=2452 Ack=49380 Win=65535 Len=0
121779  43.391631 41.67.197.204 -> 244.3.210.197 TCP 64 immedianet-bcn > http [ACK] Seq=2452 Ack=52300 Win=65535 Len=0
121785  43.392123 41.67.197.204 -> 244.3.210.197 TCP 64 immedianet-bcn > http [ACK] Seq=2452 Ack=53760 Win=65535 Len=0
121793  43.392841 41.67.197.204 -> 244.3.210.197 TCP 64 immedianet-bcn > http [ACK] Seq=2452 Ack=56680 Win=65535 Len=0
121801  43.393653 41.67.197.204 -> 244.3.210.197 TCP 64 immedianet-bcn > http [ACK] Seq=2452 Ack=58140 Win=65535 Len=0
121807  43.394844 41.67.197.204 -> 244.3.210.197 TCP 64 immedianet-bcn > http [ACK] Seq=2452 Ack=61060 Win=65535 Len=0
121814  43.395647 41.67.197.204 -> 244.3.210.197 TCP 64 immedianet-bcn > http [ACK] Seq=2452 Ack=62520 Win=65535 Len=0
121839  43.400123 41.67.197.204 -> 244.3.210.197 TCP 64 immedianet-bcn > http [ACK] Seq=2452 Ack=65440 Win=65535 Len=0
121845  43.402101 41.67.197.204 -> 244.3.210.197 TCP 64 immedianet-bcn > http [ACK] Seq=2452 Ack=66900 Win=65535 Len=0
121863  43.407632 41.67.197.204 -> 244.3.210.197 TCP 64 abatjss > http [ACK] Seq=4077 Ack=38972 Win=65535 Len=0
121873  43.408858 41.67.197.204 -> 244.3.210.197 TCP 64 abatjss > http [ACK] Seq=4077 Ack=40432 Win=65535 Len=0
121887  43.412553 41.67.197.204 -> 244.3.210.197 TCP 64 abatjss > http [ACK] Seq=4077 Ack=43352 Win=65535 Len=0
121895  43.414577 41.67.197.204 -> 244.3.210.197 TCP 64 abatjss > http [ACK] Seq=4077 Ack=44812 Win=65535 Len=0
121904  43.418151 41.67.197.204 -> 244.3.210.197 TCP 64 abatjss > http [ACK] Seq=4077 Ack=47732 Win=65535 Len=0
121913  43.420096 41.67.197.204 -> 244.3.210.197 TCP 64 abatjss > http [ACK] Seq=4077 Ack=49192 Win=65535 Len=0
121922  43.424593 41.67.197.204 -> 244.3.210.197 TCP 64 abatjss > http [ACK] Seq=4077 Ack=52112 Win=65535 Len=0
121928  43.426609 41.67.197.204 -> 244.3.210.197 TCP 64 abatjss > http [ACK] Seq=4077 Ack=53572 Win=65535 Len=0
121942  43.430837 41.67.197.204 -> 244.3.210.197 TCP 64 abatjss > http [ACK] Seq=4077 Ack=56492 Win=65535 Len=0
121952  43.433130 41.67.197.204 -> 244.3.210.197 TCP 64 abatjss > http [ACK] Seq=4077 Ack=57952 Win=65535 Len=0
121964  43.436417 41.67.197.204 -> 244.3.210.197 TCP 64 abatjss > http [ACK] Seq=4077 Ack=60872 Win=65535 Len=0
121982  43.439101 41.67.197.204 -> 244.3.210.197 TCP 64 abatjss > http [ACK] Seq=4077 Ack=62332 Win=65535 Len=0
122003  43.444868 41.67.197.204 -> 244.3.210.197 TCP 64 ps-ams > http [ACK] Seq=3270 Ack=55504 Win=65535 Len=0
122012  43.446820 41.67.197.204 -> 244.3.210.197 TCP 64 ps-ams > http [ACK] Seq=3270 Ack=56964 Win=65535 Len=0
122023  43.450389 41.67.197.204 -> 244.3.210.197 TCP 64 ps-ams > http [ACK] Seq=3270 Ack=59884 Win=65535 Len=0
122032  43.452387 41.67.197.204 -> 244.3.210.197 TCP 64 ps-ams > http [ACK] Seq=3270 Ack=61344 Win=65535 Len=0
122046  43.455906 41.67.197.204 -> 244.3.210.197 TCP 64 ps-ams > http [ACK] Seq=3270 Ack=63253 Win=65535 Len=0
122071  43.458839 41.67.197.204 -> 244.3.210.197 TCP 64 immedianet-bcn > http [ACK] Seq=2452 Ack=68612 Win=65535 Len=0
122090  43.469102 41.67.197.204 -> 244.3.210.197 TCP 64 abatjss > http [ACK] Seq=4077 Ack=65252 Win=65535 Len=0
122156  43.486838 41.67.197.204 -> 244.3.210.197 TCP 64 abatemgr > http [ACK] Seq=5860 Ack=51160 Win=65011 Len=0
122404  43.586384 41.67.197.204 -> 244.3.210.197 TCP 64 abatjss > http [ACK] Seq=4077 Ack=65299 Win=65488 Len=0
122740  43.690871 41.67.197.204 -> 244.3.210.197 TCP 64 can-nds-ssl > http [ACK] Seq=1639 Ack=134944 Win=64912 Len=0
122750  43.691417 41.67.197.204 -> 244.3.210.197 TCP 64 apple-sasl > http [ACK] Seq=3291 Ack=78859 Win=65535 Len=0
122929  43.746917 41.67.197.204 -> 244.3.210.197 TCP 64 abatemgr > http [ACK] Seq=6729 Ack=54080 Win=65535 Len=0
122936  43.747844 41.67.197.204 -> 244.3.210.197 TCP 64 abatemgr > http [ACK] Seq=6729 Ack=55540 Win=65535 Len=0
122943  43.750117 41.67.197.204 -> 244.3.210.197 TCP 64 abatemgr > http [ACK] Seq=6729 Ack=58460 Win=65535 Len=0
122949  43.750843 41.67.197.204 -> 244.3.210.197 TCP 64 abatemgr > http [ACK] Seq=6729 Ack=59920 Win=65535 Len=0
122955  43.751135 41.67.197.204 -> 244.3.210.197 TCP 64 abatemgr > http [ACK] Seq=6729 Ack=62840 Win=65535 Len=0
122962  43.752078 41.67.197.204 -> 244.3.210.197 TCP 64 abatemgr > http [ACK] Seq=6729 Ack=64300 Win=65535 Len=0
122970  43.753590 41.67.197.204 -> 244.3.210.197 TCP 64 abatemgr > http [ACK] Seq=6729 Ack=67220 Win=65535 Len=0
122981  43.754126 41.67.197.204 -> 244.3.210.197 TCP 64 abatemgr > http [ACK] Seq=6729 Ack=68680 Win=65535 Len=0
122991  43.754868 41.67.197.204 -> 244.3.210.197 TCP 64 abatemgr > http [ACK] Seq=6729 Ack=71600 Win=65535 Len=0
122997  43.756371 41.67.197.204 -> 244.3.210.197 TCP 64 abatemgr > http [ACK] Seq=6729 Ack=73060 Win=65535 Len=0
123003  43.757615 41.67.197.204 -> 244.3.210.197 TCP 64 abatemgr > http [ACK] Seq=6729 Ack=75980 Win=65535 Len=0
123009  43.759181 41.67.197.204 -> 244.3.210.197 TCP 64 abatemgr > http [ACK] Seq=6729 Ack=77282 Win=64233 Len=0
123022  43.762392 41.67.197.204 -> 244.3.210.197 TCP 64 ps-ams > http [ACK] Seq=4127 Ack=66173 Win=65535 Len=0
123038  43.765109 41.67.197.204 -> 244.3.210.197 TCP 64 ps-ams > http [ACK] Seq=4127 Ack=67633 Win=65535 Len=0
123054  43.768880 41.67.197.204 -> 244.3.210.197 TCP 64 ps-ams > http [ACK] Seq=4127 Ack=70553 Win=65535 Len=0
123066  43.770887 41.67.197.204 -> 244.3.210.197 TCP 64 ps-ams > http [ACK] Seq=4127 Ack=72013 Win=65535 Len=0
123086  43.775191 41.67.197.204 -> 244.3.210.197 TCP 64 ps-ams > http [ACK] Seq=4127 Ack=74933 Win=65535 Len=0
123099  43.776386 41.67.197.204 -> 244.3.210.197 TCP 64 ps-ams > http [ACK] Seq=4127 Ack=76393 Win=65535 Len=0
123339  43.887381 41.67.197.204 -> 244.3.210.197 TCP 64 immedianet-bcn > http [ACK] Seq=3309 Ack=69193 Win=64954 Len=0
123340  43.887386 41.67.197.204 -> 244.3.210.197 TCP 64 ps-ams > http [ACK] Seq=4127 Ack=77388 Win=64540 Len=0
130235  45.496839 41.67.197.204 -> 244.3.210.197 TCP 64 abatjss > http [ACK] Seq=4833 Ack=66959 Win=65535 Len=0
