20850   6.898063 46.90.205.219 -> 244.3.210.197 TCP 66 dzoglserver > http [SYN] Seq=0 Win=16384 Len=0 MSS=1460 SACK_PERM=1
20985   6.980513 46.90.205.219 -> 244.3.210.197 TCP 64 dzoglserver > http [ACK] Seq=1 Ack=1 Win=17520 Len=0
21638   7.481971 46.90.205.219 -> 244.3.210.197 TCP 64 dzoglserver > http [ACK] Seq=609 Ack=2921 Win=17520 Len=0
21785   7.563861 46.90.205.219 -> 244.3.210.197 TCP 64 dzoglserver > http [ACK] Seq=609 Ack=5841 Win=17520 Len=0
21852   7.628123 46.90.205.219 -> 244.3.210.197 TCP 66 ovsam-mgmt > http [SYN] Seq=0 Win=16384 Len=0 MSS=1460 SACK_PERM=1
21889   7.647907 46.90.205.219 -> 244.3.210.197 TCP 64 dzoglserver > http [ACK] Seq=609 Ack=8761 Win=17520 Len=0
21901   7.651876 46.90.205.219 -> 244.3.210.197 TCP 64 dzoglserver > http [ACK] Seq=609 Ack=11681 Win=17520 Len=0
21987   7.710769 46.90.205.219 -> 244.3.210.197 TCP 64 ovsam-mgmt > http [ACK] Seq=1 Ack=1 Win=17520 Len=0
22023   7.729956 46.90.205.219 -> 244.3.210.197 TCP 64 dzoglserver > http [ACK] Seq=609 Ack=14601 Win=17520 Len=0
22038   7.737877 46.90.205.219 -> 244.3.210.197 TCP 64 dzoglserver > http [ACK] Seq=609 Ack=17521 Win=17520 Len=0
22051   7.742077 46.90.205.219 -> 244.3.210.197 TCP 64 dzoglserver > http [ACK] Seq=609 Ack=20441 Win=17520 Len=0
22159   7.798098 46.90.205.219 -> 244.3.210.197 TCP 64 ovsam-mgmt > http [ACK] Seq=829 Ack=2921 Win=17520 Len=0
22168   7.802109 46.90.205.219 -> 244.3.210.197 TCP 64 ovsam-mgmt > http [FIN, ACK] Seq=829 Ack=2921 Win=17520 Len=0
22177   7.806068 46.90.205.219 -> 244.3.210.197 TCP 66 avocent-adsap > http [SYN] Seq=0 Win=16384 Len=0 MSS=1460 SACK_PERM=1
22191   7.819904 46.90.205.219 -> 244.3.210.197 TCP 64 dzoglserver > http [ACK] Seq=609 Ack=23361 Win=17520 Len=0
22271   7.882109 46.90.205.219 -> 244.3.210.197 TCP 64 ovsam-mgmt > http [RST, ACK] Seq=830 Ack=4381 Win=0 Len=0
22281   7.886139 46.90.205.219 -> 244.3.210.197 TCP 64 ovsam-mgmt > http [RST] Seq=829 Win=0 Len=0
22288   7.890134 46.90.205.219 -> 244.3.210.197 TCP 64 ovsam-mgmt > http [RST] Seq=829 Win=0 Len=0
22289   7.890176 46.90.205.219 -> 244.3.210.197 TCP 64 ovsam-mgmt > http [RST] Seq=830 Win=0 Len=0
22305   7.895723 46.90.205.219 -> 244.3.210.197 TCP 64 avocent-adsap > http [ACK] Seq=1 Ack=1 Win=17520 Len=0
22336   7.916349 46.90.205.219 -> 244.3.210.197 TCP 64 dzoglserver > http [ACK] Seq=1434 Ack=27667 Win=17520 Len=0
22344   7.919949 46.90.205.219 -> 244.3.210.197 TCP 64 dzoglserver > http [FIN, ACK] Seq=1434 Ack=28111 Win=17076 Len=0
22345   7.919991 46.90.205.219 -> 244.3.210.197 TCP 66 fagordnc > http [SYN] Seq=0 Win=16384 Len=0 MSS=1460 SACK_PERM=1
22453   8.003998 46.90.205.219 -> 244.3.210.197 TCP 64 dzoglserver > http [ACK] Seq=1435 Ack=28112 Win=17076 Len=0
22467   8.008748 46.90.205.219 -> 244.3.210.197 TCP 64 fagordnc > http [ACK] Seq=1 Ack=1 Win=17520 Len=0
22592   8.070261 46.90.205.219 -> 244.3.210.197 TCP 64 avocent-adsap > http [ACK] Seq=1647 Ack=3134 Win=17520 Len=0
22626   8.074524 46.90.205.219 -> 244.3.210.197 TCP 64 avocent-adsap > http [FIN, ACK] Seq=1647 Ack=4594 Win=17520 Len=0
22673   8.096159 46.90.205.219 -> 244.3.210.197 TCP 64 fagordnc > http [ACK] Seq=829 Ack=2921 Win=17520 Len=0
22674   8.096164 46.90.205.219 -> 244.3.210.197 TCP 64 fagordnc > http [FIN, ACK] Seq=829 Ack=2921 Win=17520 Len=0
22739   8.156244 46.90.205.219 -> 244.3.210.197 TCP 64 avocent-adsap > http [RST, ACK] Seq=1648 Ack=6054 Win=0 Len=0
22758   8.160207 46.90.205.219 -> 244.3.210.197 TCP 64 avocent-adsap > http [RST] Seq=1647 Win=0 Len=0
22759   8.160212 46.90.205.219 -> 244.3.210.197 TCP 64 avocent-adsap > http [RST] Seq=1647 Win=0 Len=0
22760   8.160232 46.90.205.219 -> 244.3.210.197 TCP 64 avocent-adsap > http [RST] Seq=1648 Win=0 Len=0
22761   8.160236 46.90.205.219 -> 244.3.210.197 TCP 64 avocent-adsap > http [RST] Seq=1648 Win=0 Len=0
22791   8.180001 46.90.205.219 -> 244.3.210.197 TCP 64 fagordnc > http [RST, ACK] Seq=830 Ack=3301 Win=0 Len=0
22792   8.180021 46.90.205.219 -> 244.3.210.197 TCP 64 fagordnc > http [RST] Seq=830 Win=0 Len=0
22793   8.180026 46.90.205.219 -> 244.3.210.197 TCP 64 fagordnc > http [RST] Seq=830 Win=0 Len=0
24226   9.031860 46.90.205.219 -> 244.3.210.197 TCP 66 pnbscada > http [SYN] Seq=0 Win=16384 Len=0 MSS=1460 SACK_PERM=1
24288   9.117083 46.90.205.219 -> 244.3.210.197 TCP 64 pnbscada > http [ACK] Seq=1 Ack=1 Win=17520 Len=0
24384   9.203808 46.90.205.219 -> 244.3.210.197 TCP 64 pnbscada > http [ACK] Seq=832 Ack=2669 Win=17520 Len=0
24395   9.207853 46.90.205.219 -> 244.3.210.197 TCP 64 pnbscada > http [FIN, ACK] Seq=832 Ack=2669 Win=17520 Len=0
24432   9.246041 46.90.205.219 -> 244.3.210.197 TCP 66 xmpcr-interface > http [SYN] Seq=0 Win=16384 Len=0 MSS=1460 SACK_PERM=1
24517   9.289860 46.90.205.219 -> 244.3.210.197 TCP 64 pnbscada > http [ACK] Seq=833 Ack=2670 Win=17520 Len=0
24575   9.332716 46.90.205.219 -> 244.3.210.197 TCP 64 xmpcr-interface > http [ACK] Seq=1 Ack=1 Win=17520 Len=0
24627   9.354293 46.90.205.219 -> 244.3.210.197 TCP 66 appss-lm > http [SYN] Seq=0 Win=16384 Len=0 MSS=1460 SACK_PERM=1
24732   9.420005 46.90.205.219 -> 244.3.210.197 TCP 64 xmpcr-interface > http [ACK] Seq=827 Ack=2921 Win=17520 Len=0
24744   9.424069 46.90.205.219 -> 244.3.210.197 TCP 64 xmpcr-interface > http [FIN, ACK] Seq=827 Ack=2921 Win=17520 Len=0
24783   9.437941 46.90.205.219 -> 244.3.210.197 TCP 64 appss-lm > http [ACK] Seq=1 Ack=1 Win=17520 Len=0
24914   9.504073 46.90.205.219 -> 244.3.210.197 TCP 64 xmpcr-interface > http [RST, ACK] Seq=828 Ack=4381 Win=0 Len=0
24930   9.508102 46.90.205.219 -> 244.3.210.197 TCP 64 xmpcr-interface > http [RST] Seq=827 Win=0 Len=0
24931   9.508107 46.90.205.219 -> 244.3.210.197 TCP 64 xmpcr-interface > http [RST] Seq=828 Win=0 Len=0
24947   9.512273 46.90.205.219 -> 244.3.210.197 TCP 64 xmpcr-interface > http [RST] Seq=828 Win=0 Len=0
24983   9.529993 46.90.205.219 -> 244.3.210.197 TCP 64 appss-lm > http [ACK] Seq=827 Ack=2921 Win=17520 Len=0
24996   9.534372 46.90.205.219 -> 244.3.210.197 TCP 64 appss-lm > http [RST, ACK] Seq=827 Ack=2921 Win=0 Len=0
25008   9.552062 46.90.205.219 -> 244.3.210.197 TCP 66 idac > http [SYN] Seq=0 Win=16384 Len=0 MSS=1460 SACK_PERM=1
25114   9.617817 46.90.205.219 -> 244.3.210.197 TCP 64 appss-lm > http [RST] Seq=827 Win=0 Len=0
25115   9.617822 46.90.205.219 -> 244.3.210.197 TCP 64 appss-lm > http [RST] Seq=827 Win=0 Len=0
25135   9.623382 46.90.205.219 -> 244.3.210.197 TCP 64 appss-lm > http [RST] Seq=827 Win=0 Len=0
25148   9.636907 46.90.205.219 -> 244.3.210.197 TCP 64 idac > http [ACK] Seq=1 Ack=1 Win=17520 Len=0
25178   9.674688 46.90.205.219 -> 244.3.210.197 TCP 66 vrpn > http [SYN] Seq=0 Win=16384 Len=0 MSS=1460 SACK_PERM=1
25222   9.721931 46.90.205.219 -> 244.3.210.197 TCP 64 idac > http [ACK] Seq=828 Ack=2921 Win=17520 Len=0
25231   9.727842 46.90.205.219 -> 244.3.210.197 TCP 64 idac > http [FIN, ACK] Seq=828 Ack=2921 Win=17520 Len=0
25316   9.752054 46.90.205.219 -> 244.3.210.197 TCP 66 topflow-ssl > http [SYN] Seq=0 Win=16384 Len=0 MSS=1460 SACK_PERM=1
25345   9.760781 46.90.205.219 -> 244.3.210.197 TCP 64 vrpn > http [ACK] Seq=1 Ack=1 Win=17520 Len=0
25440   9.806027 46.90.205.219 -> 244.3.210.197 TCP 64 idac > http [RST, ACK] Seq=829 Ack=4381 Win=0 Len=0
25441   9.806031 46.90.205.219 -> 244.3.210.197 TCP 64 idac > http [RST] Seq=828 Win=0 Len=0
25442   9.806036 46.90.205.219 -> 244.3.210.197 TCP 64 idac > http [RST] Seq=828 Win=0 Len=0
25467   9.809877 46.90.205.219 -> 244.3.210.197 TCP 64 idac > http [RST] Seq=829 Win=0 Len=0
25524   9.837129 46.90.205.219 -> 244.3.210.197 TCP 64 topflow-ssl > http [ACK] Seq=1 Ack=1 Win=17520 Len=0
25552   9.848003 46.90.205.219 -> 244.3.210.197 TCP 64 vrpn > http [ACK] Seq=828 Ack=2921 Win=17520 Len=0
25563   9.851836 46.90.205.219 -> 244.3.210.197 TCP 64 vrpn > http [FIN, ACK] Seq=828 Ack=2921 Win=17520 Len=0
25668   9.932064 46.90.205.219 -> 244.3.210.197 TCP 64 topflow-ssl > http [ACK] Seq=825 Ack=2921 Win=17520 Len=0
25687   9.936155 46.90.205.219 -> 244.3.210.197 TCP 64 vrpn > http [RST, ACK] Seq=829 Ack=4381 Win=0 Len=0
25693   9.936356 46.90.205.219 -> 244.3.210.197 TCP 64 topflow-ssl > http [FIN, ACK] Seq=825 Ack=2921 Win=17520 Len=0
25704   9.940026 46.90.205.219 -> 244.3.210.197 TCP 64 vrpn > http [RST] Seq=828 Win=0 Len=0
25705   9.940031 46.90.205.219 -> 244.3.210.197 TCP 64 vrpn > http [RST] Seq=828 Win=0 Len=0
25706   9.940035 46.90.205.219 -> 244.3.210.197 TCP 64 vrpn > http [RST] Seq=829 Win=0 Len=0
25802  10.016653 46.90.205.219 -> 244.3.210.197 TCP 64 topflow-ssl > http [RST, ACK] Seq=826 Ack=4381 Win=0 Len=0
25803  10.016658 46.90.205.219 -> 244.3.210.197 TCP 64 topflow-ssl > http [RST] Seq=825 Win=0 Len=0
25814  10.020062 46.90.205.219 -> 244.3.210.197 TCP 64 topflow-ssl > http [RST] Seq=825 Win=0 Len=0
25815  10.020119 46.90.205.219 -> 244.3.210.197 TCP 64 topflow-ssl > http [RST] Seq=826 Win=0 Len=0
25879  10.060120 46.90.205.219 -> 244.3.210.197 TCP 66 gbmt-stars > http [SYN] Seq=0 Win=16384 Len=0 MSS=1460 SACK_PERM=1
26022  10.144141 46.90.205.219 -> 244.3.210.197 TCP 64 gbmt-stars > http [ACK] Seq=1 Ack=1 Win=17520 Len=0
26191  10.236357 46.90.205.219 -> 244.3.210.197 TCP 64 gbmt-stars > http [ACK] Seq=841 Ack=2921 Win=17520 Len=0
26203  10.240027 46.90.205.219 -> 244.3.210.197 TCP 64 gbmt-stars > http [FIN, ACK] Seq=841 Ack=2921 Win=17520 Len=0
26269  10.278147 46.90.205.219 -> 244.3.210.197 TCP 66 listcrt-port-2 > http [SYN] Seq=0 Win=16384 Len=0 MSS=1460 SACK_PERM=1
26499  10.424070 46.90.205.219 -> 244.3.210.197 TCP 66 wysdmc > http [SYN] Seq=0 Win=16384 Len=0 MSS=1460 SACK_PERM=1
26500  10.424101 46.90.205.219 -> 244.3.210.197 TCP 64 gbmt-stars > http [RST, ACK] Seq=842 Ack=4381 Win=0 Len=0
26522  10.428966 46.90.205.219 -> 244.3.210.197 TCP 64 gbmt-stars > http [RST] Seq=841 Win=0 Len=0
26523  10.428972 46.90.205.219 -> 244.3.210.197 TCP 64 gbmt-stars > http [RST] Seq=842 Win=0 Len=0
26524  10.428976 46.90.205.219 -> 244.3.210.197 TCP 64 gbmt-stars > http [RST] Seq=842 Win=0 Len=0
26525  10.428980 46.90.205.219 -> 244.3.210.197 TCP 64 listcrt-port-2 > http [ACK] Seq=1 Ack=1 Win=17520 Len=0
26852  10.587992 46.90.205.219 -> 244.3.210.197 TCP 64 wysdmc > http [ACK] Seq=1 Ack=1 Win=17520 Len=0
26865  10.592731 46.90.205.219 -> 244.3.210.197 TCP 64 listcrt-port-2 > http [ACK] Seq=829 Ack=2698 Win=17520 Len=0
26866  10.592736 46.90.205.219 -> 244.3.210.197 TCP 64 listcrt-port-2 > http [FIN, ACK] Seq=829 Ack=2698 Win=17520 Len=0
26893  10.596152 46.90.205.219 -> 244.3.210.197 TCP 66 pktcablemmcops > http [SYN] Seq=0 Win=16384 Len=0 MSS=1460 SACK_PERM=1
27059  10.676390 46.90.205.219 -> 244.3.210.197 TCP 64 listcrt-port-2 > http [ACK] Seq=830 Ack=2699 Win=17520 Len=0
27079  10.679917 46.90.205.219 -> 244.3.210.197 TCP 64 pktcablemmcops > http [ACK] Seq=1 Ack=1 Win=17520 Len=0
27085  10.680085 46.90.205.219 -> 244.3.210.197 TCP 64 wysdmc > http [ACK] Seq=819 Ack=2023 Win=17520 Len=0
27107  10.684687 46.90.205.219 -> 244.3.210.197 TCP 66 exasoftport1 > http [SYN] Seq=0 Win=16384 Len=0 MSS=1460 SACK_PERM=1
27114  10.684891 46.90.205.219 -> 244.3.210.197 TCP 64 wysdmc > http [FIN, ACK] Seq=819 Ack=2023 Win=17520 Len=0
27265  10.770694 46.90.205.219 -> 244.3.210.197 TCP 64 exasoftport1 > http [ACK] Seq=1 Ack=1 Win=17520 Len=0
27270  10.770885 46.90.205.219 -> 244.3.210.197 TCP 64 wysdmc > http [ACK] Seq=820 Ack=2024 Win=17520 Len=0
27293  10.774403 46.90.205.219 -> 244.3.210.197 TCP 64 pktcablemmcops > http [ACK] Seq=826 Ack=1807 Win=17520 Len=0
27294  10.774426 46.90.205.219 -> 244.3.210.197 TCP 64 pktcablemmcops > http [FIN, ACK] Seq=826 Ack=1807 Win=17520 Len=0
27454  10.860090 46.90.205.219 -> 244.3.210.197 TCP 64 exasoftport1 > http [ACK] Seq=830 Ack=2921 Win=17520 Len=0
27455  10.860094 46.90.205.219 -> 244.3.210.197 TCP 64 pktcablemmcops > http [ACK] Seq=827 Ack=1808 Win=17520 Len=0
27456  10.860215 46.90.205.219 -> 244.3.210.197 TCP 64 exasoftport1 > http [FIN, ACK] Seq=830 Ack=2921 Win=17520 Len=0
27624  10.938785 46.90.205.219 -> 244.3.210.197 TCP 66 sor-update > http [SYN] Seq=0 Win=16384 Len=0 MSS=1460 SACK_PERM=1
27636  10.947126 46.90.205.219 -> 244.3.210.197 TCP 64 exasoftport1 > http [RST, ACK] Seq=831 Ack=4381 Win=0 Len=0
27637  10.947131 46.90.205.219 -> 244.3.210.197 TCP 64 exasoftport1 > http [RST] Seq=830 Win=0 Len=0
27638  10.947135 46.90.205.219 -> 244.3.210.197 TCP 64 exasoftport1 > http [RST] Seq=830 Win=0 Len=0
27639  10.947138 46.90.205.219 -> 244.3.210.197 TCP 64 exasoftport1 > http [RST] Seq=831 Win=0 Len=0
27745  11.020146 46.90.205.219 -> 244.3.210.197 TCP 64 sor-update > http [ACK] Seq=1 Ack=1 Win=17520 Len=0
27819  11.110067 46.90.205.219 -> 244.3.210.197 TCP 64 sor-update > http [ACK] Seq=829 Ack=2921 Win=17520 Len=0
27872  11.119264 46.90.205.219 -> 244.3.210.197 TCP 64 sor-update > http [FIN, ACK] Seq=829 Ack=2921 Win=17520 Len=0
27931  11.165831 46.90.205.219 -> 244.3.210.197 TCP 66 mpl-gprs-port > http [SYN] Seq=0 Win=16384 Len=0 MSS=1460 SACK_PERM=1
27972  11.194589 46.90.205.219 -> 244.3.210.197 TCP 64 sor-update > http [RST, ACK] Seq=830 Ack=4381 Win=0 Len=0
27973  11.194594 46.90.205.219 -> 244.3.210.197 TCP 64 sor-update > http [RST] Seq=829 Win=0 Len=0
27984  11.198048 46.90.205.219 -> 244.3.210.197 TCP 64 sor-update > http [RST] Seq=829 Win=0 Len=0
27991  11.202052 46.90.205.219 -> 244.3.210.197 TCP 64 sor-update > http [RST] Seq=830 Win=0 Len=0
28038  11.248606 46.90.205.219 -> 244.3.210.197 TCP 64 mpl-gprs-port > http [ACK] Seq=1 Ack=1 Win=17520 Len=0
28157  11.331975 46.90.205.219 -> 244.3.210.197 TCP 64 mpl-gprs-port > http [ACK] Seq=825 Ack=2921 Win=17520 Len=0
28169  11.337930 46.90.205.219 -> 244.3.210.197 TCP 64 mpl-gprs-port > http [FIN, ACK] Seq=825 Ack=2921 Win=17520 Len=0
28304  11.419071 46.90.205.219 -> 244.3.210.197 TCP 64 mpl-gprs-port > http [RST, ACK] Seq=826 Ack=4381 Win=0 Len=0
28314  11.421986 46.90.205.219 -> 244.3.210.197 TCP 64 mpl-gprs-port > http [RST] Seq=825 Win=0 Len=0
28315  11.422021 46.90.205.219 -> 244.3.210.197 TCP 64 mpl-gprs-port > http [RST] Seq=825 Win=0 Len=0
28316  11.422026 46.90.205.219 -> 244.3.210.197 TCP 64 mpl-gprs-port > http [RST] Seq=826 Win=0 Len=0
28431  11.462095 46.90.205.219 -> 244.3.210.197 TCP 66 winport > http [SYN] Seq=0 Win=16384 Len=0 MSS=1460 SACK_PERM=1
28603  11.544245 46.90.205.219 -> 244.3.210.197 TCP 64 winport > http [ACK] Seq=1 Ack=1 Win=17520 Len=0
28710  11.638057 46.90.205.219 -> 244.3.210.197 TCP 64 winport > http [ACK] Seq=826 Ack=2921 Win=17520 Len=0
28724  11.642196 46.90.205.219 -> 244.3.210.197 TCP 64 winport > http [FIN, ACK] Seq=826 Ack=2921 Win=17520 Len=0
28842  11.722102 46.90.205.219 -> 244.3.210.197 TCP 64 winport > http [RST, ACK] Seq=827 Ack=3558 Win=0 Len=0
28849  11.726084 46.90.205.219 -> 244.3.210.197 TCP 64 winport > http [RST] Seq=827 Win=0 Len=0
28850  11.726131 46.90.205.219 -> 244.3.210.197 TCP 64 winport > http [RST] Seq=827 Win=0 Len=0
28875  11.738203 46.90.205.219 -> 244.3.210.197 TCP 66 netboot-pxe > http [SYN] Seq=0 Win=16384 Len=0 MSS=1460 SACK_PERM=1
29090  11.822920 46.90.205.219 -> 244.3.210.197 TCP 64 netboot-pxe > http [ACK] Seq=1 Ack=1 Win=17520 Len=0
29240  11.908028 46.90.205.219 -> 244.3.210.197 TCP 64 netboot-pxe > http [ACK] Seq=830 Ack=2921 Win=17520 Len=0
29258  11.916499 46.90.205.219 -> 244.3.210.197 TCP 64 netboot-pxe > http [FIN, ACK] Seq=830 Ack=2921 Win=17520 Len=0
29360  11.992145 46.90.205.219 -> 244.3.210.197 TCP 64 netboot-pxe > http [RST, ACK] Seq=831 Ack=4350 Win=0 Len=0
29378  12.000168 46.90.205.219 -> 244.3.210.197 TCP 64 netboot-pxe > http [RST] Seq=831 Win=0 Len=0
29379  12.000173 46.90.205.219 -> 244.3.210.197 TCP 64 netboot-pxe > http [RST] Seq=831 Win=0 Len=0
29506  12.119860 46.90.205.219 -> 244.3.210.197 TCP 66 syam-webserver > http [SYN] Seq=0 Win=16384 Len=0 MSS=1460 SACK_PERM=1
29652  12.202079 46.90.205.219 -> 244.3.210.197 TCP 64 syam-webserver > http [ACK] Seq=1 Ack=1 Win=17520 Len=0
29945  12.420461 46.90.205.219 -> 244.3.210.197 TCP 64 syam-webserver > http [ACK] Seq=823 Ack=214 Win=17307 Len=0
30360  12.662025 46.90.205.219 -> 244.3.210.197 TCP 64 syam-webserver > http [ACK] Seq=1648 Ack=3134 Win=17520 Len=0
30389  12.665957 46.90.205.219 -> 244.3.210.197 TCP 64 syam-webserver > http [FIN, ACK] Seq=1648 Ack=3134 Win=17520 Len=0
30393  12.666088 46.90.205.219 -> 244.3.210.197 TCP 64 syam-webserver > http [RST, ACK] Seq=1649 Ack=4594 Win=0 Len=0
30575  12.740021 46.90.205.219 -> 244.3.210.197 TCP 66 dyn-site > http [SYN] Seq=0 Win=16384 Len=0 MSS=1460 SACK_PERM=1
30607  12.747940 46.90.205.219 -> 244.3.210.197 TCP 64 syam-webserver > http [RST] Seq=1648 Win=0 Len=0
30608  12.747944 46.90.205.219 -> 244.3.210.197 TCP 64 syam-webserver > http [RST] Seq=1648 Win=0 Len=0
30623  12.751997 46.90.205.219 -> 244.3.210.197 TCP 64 syam-webserver > http [RST] Seq=1648 Win=0 Len=0
30624  12.752002 46.90.205.219 -> 244.3.210.197 TCP 64 syam-webserver > http [RST] Seq=1649 Win=0 Len=0
30783  12.823863 46.90.205.219 -> 244.3.210.197 TCP 64 dyn-site > http [ACK] Seq=1 Ack=1 Win=17520 Len=0
30914  12.921895 46.90.205.219 -> 244.3.210.197 TCP 64 dyn-site > http [ACK] Seq=834 Ack=2921 Win=17520 Len=0
30936  12.925898 46.90.205.219 -> 244.3.210.197 TCP 64 dyn-site > http [FIN, ACK] Seq=834 Ack=2921 Win=17520 Len=0
30965  12.962036 46.90.205.219 -> 244.3.210.197 TCP 66 sunfm-port > http [SYN] Seq=0 Win=16384 Len=0 MSS=1460 SACK_PERM=1
31025  13.005807 46.90.205.219 -> 244.3.210.197 TCP 64 dyn-site > http [RST, ACK] Seq=835 Ack=4381 Win=0 Len=0
31034  13.010122 46.90.205.219 -> 244.3.210.197 TCP 64 dyn-site > http [RST] Seq=834 Win=0 Len=0
31035  13.010127 46.90.205.219 -> 244.3.210.197 TCP 64 dyn-site > http [RST] Seq=834 Win=0 Len=0
31036  13.010149 46.90.205.219 -> 244.3.210.197 TCP 64 dyn-site > http [RST] Seq=835 Win=0 Len=0
31037  13.010153 46.90.205.219 -> 244.3.210.197 TCP 64 dyn-site > http [RST] Seq=835 Win=0 Len=0
31079  13.044928 46.90.205.219 -> 244.3.210.197 TCP 64 sunfm-port > http [ACK] Seq=1 Ack=1 Win=17520 Len=0
31172  13.132066 46.90.205.219 -> 244.3.210.197 TCP 64 sunfm-port > http [ACK] Seq=830 Ack=2921 Win=17520 Len=0
31181  13.138036 46.90.205.219 -> 244.3.210.197 TCP 64 sunfm-port > http [FIN, ACK] Seq=830 Ack=2921 Win=17520 Len=0
31255  13.209843 46.90.205.219 -> 244.3.210.197 TCP 66 proaxess > http [SYN] Seq=0 Win=16384 Len=0 MSS=1460 SACK_PERM=1
31273  13.216465 46.90.205.219 -> 244.3.210.197 TCP 64 sunfm-port > http [RST, ACK] Seq=831 Ack=3457 Win=0 Len=0
31297  13.219989 46.90.205.219 -> 244.3.210.197 TCP 64 sunfm-port > http [RST] Seq=831 Win=0 Len=0
31313  13.224031 46.90.205.219 -> 244.3.210.197 TCP 64 sunfm-port > http [RST] Seq=831 Win=0 Len=0
31415  13.295433 46.90.205.219 -> 244.3.210.197 TCP 64 proaxess > http [ACK] Seq=1 Ack=1 Win=17520 Len=0
31725  13.383978 46.90.205.219 -> 244.3.210.197 TCP 64 proaxess > http [ACK] Seq=823 Ack=2921 Win=17520 Len=0
31746  13.387956 46.90.205.219 -> 244.3.210.197 TCP 64 proaxess > http [FIN, ACK] Seq=823 Ack=2921 Win=17520 Len=0
31927  13.470037 46.90.205.219 -> 244.3.210.197 TCP 64 proaxess > http [RST, ACK] Seq=824 Ack=4381 Win=0 Len=0
31928  13.470042 46.90.205.219 -> 244.3.210.197 TCP 64 proaxess > http [RST] Seq=823 Win=0 Len=0
31929  13.470046 46.90.205.219 -> 244.3.210.197 TCP 64 proaxess > http [RST] Seq=823 Win=0 Len=0
31947  13.474388 46.90.205.219 -> 244.3.210.197 TCP 64 proaxess > http [RST] Seq=824 Win=0 Len=0
32114  13.626138 46.90.205.219 -> 244.3.210.197 TCP 66 thrp > http [SYN] Seq=0 Win=16384 Len=0 MSS=1460 SACK_PERM=1
32302  13.710742 46.90.205.219 -> 244.3.210.197 TCP 64 thrp > http [ACK] Seq=1 Ack=1 Win=17520 Len=0
32326  13.721866 46.90.205.219 -> 244.3.210.197 TCP 66 ati-ip-to-ncpe > http [SYN] Seq=0 Win=16384 Len=0 MSS=1460 SACK_PERM=1
32501  13.798058 46.90.205.219 -> 244.3.210.197 TCP 64 thrp > http [ACK] Seq=836 Ack=2921 Win=17520 Len=0
32521  13.802005 46.90.205.219 -> 244.3.210.197 TCP 64 thrp > http [FIN, ACK] Seq=836 Ack=2921 Win=17520 Len=0
32545  13.806710 46.90.205.219 -> 244.3.210.197 TCP 64 ati-ip-to-ncpe > http [ACK] Seq=1 Ack=1 Win=17520 Len=0
32546  13.806715 46.90.205.219 -> 244.3.210.197 TCP 66 ppsms > http [SYN] Seq=0 Win=16384 Len=0 MSS=1460 SACK_PERM=1
32729  13.882116 46.90.205.219 -> 244.3.210.197 TCP 64 thrp > http [RST, ACK] Seq=837 Ack=4381 Win=0 Len=0
32730  13.882121 46.90.205.219 -> 244.3.210.197 TCP 64 thrp > http [RST] Seq=836 Win=0 Len=0
32743  13.886135 46.90.205.219 -> 244.3.210.197 TCP 64 thrp > http [RST] Seq=836 Win=0 Len=0
32744  13.886139 46.90.205.219 -> 244.3.210.197 TCP 64 thrp > http [RST] Seq=837 Win=0 Len=0
32758  13.889901 46.90.205.219 -> 244.3.210.197 TCP 64 ppsms > http [ACK] Seq=1 Ack=1 Win=17520 Len=0
32794  13.898017 46.90.205.219 -> 244.3.210.197 TCP 64 ati-ip-to-ncpe > http [ACK] Seq=829 Ack=2921 Win=17520 Len=0
32795  13.898021 46.90.205.219 -> 244.3.210.197 TCP 64 ati-ip-to-ncpe > http [FIN, ACK] Seq=829 Ack=2921 Win=17520 Len=0
32796  13.898025 46.90.205.219 -> 244.3.210.197 TCP 66 landmarks > http [SYN] Seq=0 Win=16384 Len=0 MSS=1460 SACK_PERM=1
32959  13.982025 46.90.205.219 -> 244.3.210.197 TCP 64 ati-ip-to-ncpe > http [RST, ACK] Seq=830 Ack=4381 Win=0 Len=0
32960  13.982030 46.90.205.219 -> 244.3.210.197 TCP 64 ati-ip-to-ncpe > http [RST] Seq=829 Win=0 Len=0
33023  13.990477 46.90.205.219 -> 244.3.210.197 TCP 64 ati-ip-to-ncpe > http [RST] Seq=829 Win=0 Len=0
33033  13.994516 46.90.205.219 -> 244.3.210.197 TCP 64 ati-ip-to-ncpe > http [RST] Seq=830 Win=0 Len=0
33034  13.994558 46.90.205.219 -> 244.3.210.197 TCP 64 landmarks > http [ACK] Seq=1 Ack=1 Win=17520 Len=0
33238  14.074312 46.90.205.219 -> 244.3.210.197 TCP 64 ppsms > http [ACK] Seq=1687 Ack=3501 Win=17520 Len=0
33252  14.077977 46.90.205.219 -> 244.3.210.197 TCP 64 ppsms > http [FIN, ACK] Seq=1687 Ack=4961 Win=17520 Len=0
33253  14.077981 46.90.205.219 -> 244.3.210.197 TCP 66 lanrevserver > http [SYN] Seq=0 Win=16384 Len=0 MSS=1460 SACK_PERM=1
33346  14.157880 46.90.205.219 -> 244.3.210.197 TCP 64 ppsms > http [RST, ACK] Seq=1688 Ack=6421 Win=0 Len=0
33347  14.157935 46.90.205.219 -> 244.3.210.197 TCP 64 ppsms > http [RST] Seq=1687 Win=0 Len=0
33379  14.162778 46.90.205.219 -> 244.3.210.197 TCP 64 ppsms > http [RST] Seq=1688 Win=0 Len=0
33380  14.162783 46.90.205.219 -> 244.3.210.197 TCP 64 ppsms > http [RST] Seq=1688 Win=0 Len=0
33385  14.162915 46.90.205.219 -> 244.3.210.197 TCP 64 lanrevserver > http [ACK] Seq=1 Ack=1 Win=17520 Len=0
33584  14.249952 46.90.205.219 -> 244.3.210.197 TCP 64 lanrevserver > http [ACK] Seq=848 Ack=2130 Win=17520 Len=0
33627  14.278086 46.90.205.219 -> 244.3.210.197 TCP 64 lanrevserver > http [FIN, ACK] Seq=848 Ack=2130 Win=17520 Len=0
33676  14.307962 46.90.205.219 -> 244.3.210.197 TCP 64 landmarks > http [ACK] Seq=1677 Ack=2332 Win=17520 Len=0
33693  14.312114 46.90.205.219 -> 244.3.210.197 TCP 64 landmarks > http [FIN, ACK] Seq=1677 Ack=2332 Win=17520 Len=0
33860  14.361912 46.90.205.219 -> 244.3.210.197 TCP 64 lanrevserver > http [ACK] Seq=849 Ack=2131 Win=17520 Len=0
33923  14.396268 46.90.205.219 -> 244.3.210.197 TCP 64 landmarks > http [ACK] Seq=1678 Ack=2333 Win=17520 Len=0
41046  17.143936 46.90.205.219 -> 244.3.210.197 TCP 66 opswmanager > http [SYN] Seq=0 Win=16384 Len=0 MSS=1460 SACK_PERM=1
41240  17.228754 46.90.205.219 -> 244.3.210.197 TCP 64 opswmanager > http [ACK] Seq=1 Ack=1 Win=17520 Len=0
41501  17.316247 46.90.205.219 -> 244.3.210.197 TCP 64 opswmanager > http [ACK] Seq=839 Ack=2921 Win=17520 Len=0
41520  17.319872 46.90.205.219 -> 244.3.210.197 TCP 64 opswmanager > http [FIN, ACK] Seq=839 Ack=2921 Win=17520 Len=0
41772  17.399903 46.90.205.219 -> 244.3.210.197 TCP 64 opswmanager > http [RST, ACK] Seq=840 Ack=3030 Win=0 Len=0
41787  17.403908 46.90.205.219 -> 244.3.210.197 TCP 64 opswmanager > http [RST] Seq=840 Win=0 Len=0
41788  17.403912 46.90.205.219 -> 244.3.210.197 TCP 64 opswmanager > http [RST] Seq=840 Win=0 Len=0
