672806 209.781675 51.244.4.136 -> 41.177.26.91 TCP 70 15256 > http [SYN] Seq=0 Win=8192 Len=0 MSS=1452 WS=4 SACK_PERM=1
673721 210.225632 51.244.4.136 -> 41.177.26.91 TCP 64 15256 > http [ACK] Seq=1 Ack=1 Win=66792 Len=0
674995 210.851414 51.244.4.136 -> 41.177.26.91 TCP 64 15256 > http [ACK] Seq=592 Ack=2905 Win=66792 Len=0
675806 211.296427 51.244.4.136 -> 41.177.26.91 TCP 70 [TCP Dup ACK 674995#1] 15256 > http [ACK] Seq=592 Ack=2905 Win=66792 Len=0 SLE=4357 SRE=5809
675824 211.306029 51.244.4.136 -> 41.177.26.91 TCP 70 [TCP Dup ACK 674995#2] 15256 > http [ACK] Seq=592 Ack=2905 Win=66792 Len=0 SLE=4357 SRE=7261
675837 211.314655 51.244.4.136 -> 41.177.26.91 TCP 70 [TCP Dup ACK 674995#3] 15256 > http [ACK] Seq=592 Ack=2905 Win=66792 Len=0 SLE=4357 SRE=8713
676792 211.745819 51.244.4.136 -> 41.177.26.91 TCP 70 [TCP Dup ACK 674995#4] 15256 > http [ACK] Seq=592 Ack=2905 Win=66792 Len=0 SLE=4357 SRE=9520
677251 211.962842 51.244.4.136 -> 41.177.26.91 TCP 64 15256 > http [ACK] Seq=592 Ack=9520 Win=66792 Len=0
687950 216.225184 51.244.4.136 -> 41.177.26.91 TCP 70 15270 > http [SYN] Seq=0 Win=8192 Len=0 MSS=1452 WS=4 SACK_PERM=1
688878 216.701356 51.244.4.136 -> 41.177.26.91 TCP 64 15270 > http [ACK] Seq=1 Ack=1 Win=66792 Len=0
689791 217.208913 51.244.4.136 -> 41.177.26.91 TCP 64 15270 > http [ACK] Seq=469 Ack=2905 Win=66792 Len=0
690749 217.706114 51.244.4.136 -> 41.177.26.91 TCP 70 [TCP Dup ACK 689791#1] 15270 > http [ACK] Seq=469 Ack=2905 Win=66792 Len=0 SLE=4357 SRE=5809
690761 217.715005 51.244.4.136 -> 41.177.26.91 TCP 70 [TCP Dup ACK 689791#2] 15270 > http [ACK] Seq=469 Ack=2905 Win=66792 Len=0 SLE=4357 SRE=7261
690791 217.724341 51.244.4.136 -> 41.177.26.91 TCP 70 [TCP Dup ACK 689791#3] 15270 > http [ACK] Seq=469 Ack=2905 Win=66792 Len=0 SLE=4357 SRE=8713
691619 218.213468 51.244.4.136 -> 41.177.26.91 TCP 70 [TCP Dup ACK 689791#4] 15270 > http [ACK] Seq=469 Ack=2905 Win=66792 Len=0 SLE=4357 SRE=10165
691640 218.223588 51.244.4.136 -> 41.177.26.91 TCP 70 [TCP Dup ACK 689791#5] 15270 > http [ACK] Seq=469 Ack=2905 Win=66792 Len=0 SLE=4357 SRE=11617
691953 218.426528 51.244.4.136 -> 41.177.26.91 TCP 64 15270 > http [ACK] Seq=469 Ack=11617 Win=66792 Len=0
692516 218.722028 51.244.4.136 -> 41.177.26.91 TCP 70 [TCP Dup ACK 691953#1] 15270 > http [ACK] Seq=469 Ack=11617 Win=66792 Len=0 SLE=13069 SRE=14521
693030 218.927439 51.244.4.136 -> 41.177.26.91 TCP 70 [TCP Dup ACK 691953#2] 15270 > http [ACK] Seq=469 Ack=11617 Win=66792 Len=0 SLE=13069 SRE=15973
693042 218.935161 51.244.4.136 -> 41.177.26.91 TCP 70 [TCP Dup ACK 691953#3] 15270 > http [ACK] Seq=469 Ack=11617 Win=66792 Len=0 SLE=13069 SRE=17425
693622 219.207365 51.244.4.136 -> 41.177.26.91 TCP 70 [TCP Dup ACK 691953#4] 15270 > http [ACK] Seq=469 Ack=11617 Win=66792 Len=0 SLE=13069 SRE=18877
693906 219.420277 51.244.4.136 -> 41.177.26.91 TCP 70 [TCP Dup ACK 691953#5] 15270 > http [ACK] Seq=469 Ack=11617 Win=66792 Len=0 SLE=13069 SRE=20329
694347 219.624727 51.244.4.136 -> 41.177.26.91 TCP 64 15270 > http [ACK] Seq=469 Ack=20329 Win=66792 Len=0
694693 219.884105 51.244.4.136 -> 41.177.26.91 TCP 64 15270 > http [ACK] Seq=469 Ack=21781 Win=66792 Len=0
695337 220.104852 51.244.4.136 -> 41.177.26.91 TCP 64 15270 > http [ACK] Seq=469 Ack=23233 Win=66792 Len=0
695482 220.129043 51.244.4.136 -> 41.177.26.91 TCP 70 [TCP Dup ACK 695337#1] 15270 > http [ACK] Seq=469 Ack=23233 Win=66792 Len=0 SLE=24685 SRE=26137
695846 220.374385 51.244.4.136 -> 41.177.26.91 TCP 70 [TCP Dup ACK 695337#2] 15270 > http [ACK] Seq=469 Ack=23233 Win=66792 Len=0 SLE=24685 SRE=27589
696244 220.590322 51.244.4.136 -> 41.177.26.91 TCP 70 [TCP Dup ACK 695337#3] 15270 > http [ACK] Seq=469 Ack=23233 Win=66792 Len=0 SLE=24685 SRE=29041
696291 220.613714 51.244.4.136 -> 41.177.26.91 TCP 70 [TCP Dup ACK 695337#4] 15270 > http [ACK] Seq=469 Ack=23233 Win=66792 Len=0 SLE=24685 SRE=30493
697176 220.863539 51.244.4.136 -> 41.177.26.91 TCP 70 [TCP Dup ACK 695337#5] 15270 > http [ACK] Seq=469 Ack=23233 Win=66792 Len=0 SLE=24685 SRE=31945
697803 221.105804 51.244.4.136 -> 41.177.26.91 TCP 64 15270 > http [ACK] Seq=469 Ack=33397 Win=66792 Len=0
698669 221.554300 51.244.4.136 -> 41.177.26.91 TCP 64 15270 > http [ACK] Seq=469 Ack=34849 Win=66792 Len=0
698816 221.606596 51.244.4.136 -> 41.177.26.91 TCP 64 15270 > http [ACK] Seq=469 Ack=37753 Win=66792 Len=0
699366 221.814264 51.244.4.136 -> 41.177.26.91 TCP 64 15270 > http [ACK] Seq=469 Ack=39205 Win=66792 Len=0
699650 221.893959 51.244.4.136 -> 41.177.26.91 TCP 64 15256 > irdmi [RST] Seq=1 Win=0 Len=0
700165 222.086047 51.244.4.136 -> 41.177.26.91 TCP 64 15270 > http [ACK] Seq=469 Ack=42109 Win=66792 Len=0
700973 222.572853 51.244.4.136 -> 41.177.26.91 TCP 70 15270 > http [ACK] Seq=469 Ack=45013 Win=66792 Len=0 SLE=46465 SRE=47917
701804 223.040019 51.244.4.136 -> 41.177.26.91 TCP 70 [TCP Dup ACK 700973#1] 15270 > http [ACK] Seq=469 Ack=45013 Win=66792 Len=0 SLE=46465 SRE=49369
701819 223.048430 51.244.4.136 -> 41.177.26.91 TCP 70 [TCP Dup ACK 700973#2] 15270 > http [ACK] Seq=469 Ack=45013 Win=66792 Len=0 SLE=46465 SRE=50821
701827 223.057283 51.244.4.136 -> 41.177.26.91 TCP 70 [TCP Dup ACK 700973#3] 15270 > http [ACK] Seq=469 Ack=45013 Win=66792 Len=0 SLE=46465 SRE=52273
702874 223.510359 51.244.4.136 -> 41.177.26.91 TCP 70 [TCP Dup ACK 700973#4] 15270 > http [ACK] Seq=469 Ack=45013 Win=66792 Len=0 SLE=46465 SRE=53725
702887 223.520429 51.244.4.136 -> 41.177.26.91 TCP 70 [TCP Dup ACK 700973#5] 15270 > http [ACK] Seq=469 Ack=45013 Win=66792 Len=0 SLE=46465 SRE=55177
703377 223.724228 51.244.4.136 -> 41.177.26.91 TCP 64 15270 > http [ACK] Seq=469 Ack=55177 Win=66792 Len=0
704440 224.187926 51.244.4.136 -> 41.177.26.91 TCP 70 15270 > http [ACK] Seq=469 Ack=56629 Win=66792 Len=0 SLE=58081 SRE=59533
704468 224.196895 51.244.4.136 -> 41.177.26.91 TCP 70 [TCP Dup ACK 704440#1] 15270 > http [ACK] Seq=469 Ack=56629 Win=66792 Len=0 SLE=58081 SRE=60985
705889 224.637368 51.244.4.136 -> 41.177.26.91 TCP 70 [TCP Dup ACK 704440#2] 15270 > http [ACK] Seq=469 Ack=56629 Win=66792 Len=0 SLE=58081 SRE=62437
705921 224.648426 51.244.4.136 -> 41.177.26.91 TCP 70 [TCP Dup ACK 704440#3] 15270 > http [ACK] Seq=469 Ack=56629 Win=66792 Len=0 SLE=58081 SRE=63889
706932 225.092903 51.244.4.136 -> 41.177.26.91 TCP 70 [TCP Dup ACK 704440#4] 15270 > http [ACK] Seq=469 Ack=56629 Win=66792 Len=0 SLE=58081 SRE=65341
707012 225.111113 51.244.4.136 -> 41.177.26.91 TCP 64 15270 > http [ACK] Seq=469 Ack=66793 Win=66792 Len=0
708255 225.559358 51.244.4.136 -> 41.177.26.91 TCP 64 15270 > http [ACK] Seq=469 Ack=69697 Win=66792 Len=0
708325 225.576811 51.244.4.136 -> 41.177.26.91 TCP 64 15270 > http [ACK] Seq=469 Ack=72601 Win=66792 Len=0
709409 226.000597 51.244.4.136 -> 41.177.26.91 TCP 64 15270 > http [ACK] Seq=469 Ack=75505 Win=66792 Len=0
709426 226.017035 51.244.4.136 -> 41.177.26.91 TCP 64 15270 > http [ACK] Seq=469 Ack=78409 Win=66792 Len=0
710520 226.475824 51.244.4.136 -> 41.177.26.91 TCP 70 [TCP Dup ACK 709426#1] 15270 > http [ACK] Seq=469 Ack=78409 Win=66792 Len=0 SLE=79861 SRE=81313
710550 226.485146 51.244.4.136 -> 41.177.26.91 TCP 70 [TCP Dup ACK 709426#2] 15270 > http [ACK] Seq=469 Ack=78409 Win=66792 Len=0 SLE=79861 SRE=82765
710570 226.493289 51.244.4.136 -> 41.177.26.91 TCP 70 [TCP Dup ACK 709426#3] 15270 > http [ACK] Seq=469 Ack=78409 Win=66792 Len=0 SLE=79861 SRE=84217
711437 226.906710 51.244.4.136 -> 41.177.26.91 TCP 70 [TCP Dup ACK 709426#4] 15270 > http [ACK] Seq=469 Ack=78409 Win=66792 Len=0 SLE=79861 SRE=84496
711829 227.124560 51.244.4.136 -> 41.177.26.91 TCP 64 15270 > http [ACK] Seq=469 Ack=84496 Win=66792 Len=0
768495 248.537738 51.244.4.136 -> 41.177.26.91 TCP 64 15270 > irdmi [RST] Seq=1 Win=0 Len=0
