107184  38.600258 68.157.168.24 -> 41.177.26.176 TCP 78 42623 > http [SYN] Seq=0 Win=5840 Len=0 MSS=1460 SACK_PERM=1 TSval=3390043746 TSecr=0 WS=64
107307  38.643116 68.157.168.24 -> 41.177.26.176 TCP 70 42623 > http [ACK] Seq=1 Ack=1 Win=5888 Len=0 TSval=3390043788 TSecr=140345456
112940  40.199983 68.157.168.24 -> 41.177.26.176 TCP 70 42623 > http [ACK] Seq=355 Ack=736 Win=7360 Len=0 TSval=3390045345 TSecr=140345612
112941  40.199987 68.157.168.24 -> 41.177.26.176 TCP 70 42623 > http [ACK] Seq=355 Ack=1487 Win=8832 Len=0 TSval=3390045345 TSecr=140345612
112962  40.207380 68.157.168.24 -> 41.177.26.176 TCP 70 42623 > http [ACK] Seq=355 Ack=2122 Win=10368 Len=0 TSval=3390045353 TSecr=140345612
112963  40.207384 68.157.168.24 -> 41.177.26.176 TCP 70 42623 > http [ACK] Seq=355 Ack=2313 Win=11840 Len=0 TSval=3390045353 TSecr=140345612
112964  40.207442 68.157.168.24 -> 41.177.26.176 TCP 70 42623 > http [ACK] Seq=355 Ack=2404 Win=11840 Len=0 TSval=3390045353 TSecr=140345612
112965  40.207446 68.157.168.24 -> 41.177.26.176 TCP 70 42623 > http [ACK] Seq=355 Ack=2595 Win=13376 Len=0 TSval=3390045353 TSecr=140345612
112968  40.207592 68.157.168.24 -> 41.177.26.176 TCP 70 42623 > http [ACK] Seq=355 Ack=2789 Win=14848 Len=0 TSval=3390045353 TSecr=140345612
112969  40.207677 68.157.168.24 -> 41.177.26.176 TCP 70 42623 > http [ACK] Seq=355 Ack=3644 Win=16576 Len=0 TSval=3390045353 TSecr=140345612
113103  40.242738 68.157.168.24 -> 41.177.26.176 TCP 70 42623 > http [ACK] Seq=355 Ack=5092 Win=19456 Len=0 TSval=3390045388 TSecr=140345616
113104  40.242743 68.157.168.24 -> 41.177.26.176 TCP 70 42623 > http [ACK] Seq=355 Ack=6193 Win=22336 Len=0 TSval=3390045388 TSecr=140345616
113105  40.242746 68.157.168.24 -> 41.177.26.176 TCP 70 42623 > http [ACK] Seq=355 Ack=7641 Win=25280 Len=0 TSval=3390045388 TSecr=140345616
113139  40.250037 68.157.168.24 -> 41.177.26.176 TCP 70 42623 > http [ACK] Seq=355 Ack=9089 Win=28160 Len=0 TSval=3390045395 TSecr=140345617
113140  40.250041 68.157.168.24 -> 41.177.26.176 TCP 70 42623 > http [ACK] Seq=355 Ack=10103 Win=31040 Len=0 TSval=3390045395 TSecr=140345617
115081  41.088269 68.157.168.24 -> 41.177.26.176 TCP 70 42623 > http [ACK] Seq=672 Ack=11598 Win=33920 Len=0 TSval=3390046234 TSecr=140345700
115146  41.099192 68.157.168.24 -> 41.177.26.176 TCP 70 42623 > http [ACK] Seq=672 Ack=14102 Win=42624 Len=0 TSval=3390046244 TSecr=140345701
115148  41.099443 68.157.168.24 -> 41.177.26.176 TCP 70 42623 > http [ACK] Seq=672 Ack=15602 Win=45504 Len=0 TSval=3390046245 TSecr=140345702
115173  41.108413 68.157.168.24 -> 41.177.26.176 TCP 70 42623 > http [ACK] Seq=672 Ack=17347 Win=51328 Len=0 TSval=3390046254 TSecr=140345702
115175  41.108920 68.157.168.24 -> 41.177.26.176 TCP 70 42623 > http [ACK] Seq=672 Ack=19889 Win=57088 Len=0 TSval=3390046254 TSecr=140345702
115362  41.164653 68.157.168.24 -> 41.177.26.176 TCP 70 42623 > http [ACK] Seq=672 Ack=19894 Win=57088 Len=0 TSval=3390046310 TSecr=140345704
133172  46.410953 68.157.168.24 -> 41.177.26.176 TCP 70 42623 > http [FIN, ACK] Seq=672 Ack=19894 Win=57088 Len=0 TSval=3390051556 TSecr=140345704
133348  46.454029 68.157.168.24 -> 41.177.26.176 TCP 70 42623 > http [ACK] Seq=673 Ack=19895 Win=57088 Len=0 TSval=3390051599 TSecr=140346237
522563 169.438378 68.157.168.24 -> 41.177.26.176 TCP 78 52789 > http [SYN] Seq=0 Win=5840 Len=0 MSS=1460 SACK_PERM=1 TSval=3390174580 TSecr=0 WS=64
522661 169.481175 68.157.168.24 -> 41.177.26.176 TCP 70 52789 > http [ACK] Seq=1 Ack=1 Win=5888 Len=0 TSval=3390174622 TSecr=140358540
526381 171.109044 68.157.168.24 -> 41.177.26.176 TCP 70 52789 > http [ACK] Seq=378 Ack=1449 Win=8768 Len=0 TSval=3390176250 TSecr=140358702
526382 171.109049 68.157.168.24 -> 41.177.26.176 TCP 70 52789 > http [ACK] Seq=378 Ack=1478 Win=8768 Len=0 TSval=3390176250 TSecr=140358702
526396 171.121611 68.157.168.24 -> 41.177.26.176 TCP 70 52789 > http [ACK] Seq=378 Ack=2143 Win=11648 Len=0 TSval=3390176263 TSecr=140358704
526397 171.121837 68.157.168.24 -> 41.177.26.176 TCP 70 52789 > http [ACK] Seq=378 Ack=2354 Win=14528 Len=0 TSval=3390176263 TSecr=140358704
526398 171.121842 68.157.168.24 -> 41.177.26.176 TCP 70 52789 > http [ACK] Seq=378 Ack=2565 Win=17472 Len=0 TSval=3390176263 TSecr=140358704
526399 171.121846 68.157.168.24 -> 41.177.26.176 TCP 70 52789 > http [ACK] Seq=378 Ack=2776 Win=20352 Len=0 TSval=3390176263 TSecr=140358704
526400 171.121850 68.157.168.24 -> 41.177.26.176 TCP 70 52789 > http [ACK] Seq=378 Ack=2990 Win=23232 Len=0 TSval=3390176263 TSecr=140358704
526405 171.123014 68.157.168.24 -> 41.177.26.176 TCP 70 52789 > http [ACK] Seq=378 Ack=3333 Win=26112 Len=0 TSval=3390176264 TSecr=140358704
526506 171.151487 68.157.168.24 -> 41.177.26.176 TCP 70 52789 > http [ACK] Seq=378 Ack=4781 Win=29056 Len=0 TSval=3390176293 TSecr=140358707
526507 171.151490 68.157.168.24 -> 41.177.26.176 TCP 70 52789 > http [ACK] Seq=378 Ack=5665 Win=31936 Len=0 TSval=3390176293 TSecr=140358707
526512 171.151613 68.157.168.24 -> 41.177.26.176 TCP 70 52789 > http [ACK] Seq=378 Ack=7113 Win=34816 Len=0 TSval=3390176293 TSecr=140358707
526513 171.151618 68.157.168.24 -> 41.177.26.176 TCP 70 52789 > http [ACK] Seq=378 Ack=8561 Win=37696 Len=0 TSval=3390176293 TSecr=140358707
526621 171.163840 68.157.168.24 -> 41.177.26.176 TCP 70 52789 > http [ACK] Seq=378 Ack=8927 Win=40640 Len=0 TSval=3390176305 TSecr=140358708
526624 171.164380 68.157.168.24 -> 41.177.26.176 TCP 70 52789 > http [ACK] Seq=378 Ack=10375 Win=43520 Len=0 TSval=3390176305 TSecr=140358708
526625 171.164385 68.157.168.24 -> 41.177.26.176 TCP 70 52789 > http [ACK] Seq=378 Ack=11823 Win=46400 Len=0 TSval=3390176306 TSecr=140358708
526626 171.164522 68.157.168.24 -> 41.177.26.176 TCP 70 52789 > http [ACK] Seq=378 Ack=12962 Win=49280 Len=0 TSval=3390176306 TSecr=140358708
531953 172.500902 68.157.168.24 -> 41.177.26.176 TCP 70 52789 > http [ACK] Seq=701 Ack=14410 Win=52224 Len=0 TSval=3390177642 TSecr=140358842
531954 172.500906 68.157.168.24 -> 41.177.26.176 TCP 70 52789 > http [ACK] Seq=701 Ack=14455 Win=52224 Len=0 TSval=3390177642 TSecr=140358842
532000 172.509459 68.157.168.24 -> 41.177.26.176 TCP 70 52789 > http [ACK] Seq=701 Ack=15120 Win=55104 Len=0 TSval=3390177651 TSecr=140358843
532001 172.509464 68.157.168.24 -> 41.177.26.176 TCP 70 52789 > http [ACK] Seq=701 Ack=15330 Win=57984 Len=0 TSval=3390177651 TSecr=140358843
532007 172.509821 68.157.168.24 -> 41.177.26.176 TCP 70 52789 > http [ACK] Seq=701 Ack=15540 Win=60864 Len=0 TSval=3390177651 TSecr=140358843
532008 172.509825 68.157.168.24 -> 41.177.26.176 TCP 70 52789 > http [ACK] Seq=701 Ack=15631 Win=60864 Len=0 TSval=3390177651 TSecr=140358843
532011 172.510086 68.157.168.24 -> 41.177.26.176 TCP 70 52789 > http [ACK] Seq=701 Ack=15844 Win=63808 Len=0 TSval=3390177651 TSecr=140358843
532013 172.510796 68.157.168.24 -> 41.177.26.176 TCP 70 52789 > http [ACK] Seq=701 Ack=16324 Win=64128 Len=0 TSval=3390177652 TSecr=140358843
532014 172.510913 68.157.168.24 -> 41.177.26.176 TCP 70 52789 > http [ACK] Seq=701 Ack=17772 Win=64128 Len=0 TSval=3390177652 TSecr=140358843
532015 172.510917 68.157.168.24 -> 41.177.26.176 TCP 70 52789 > http [ACK] Seq=701 Ack=18227 Win=63616 Len=0 TSval=3390177652 TSecr=140358843
532016 172.510979 68.157.168.24 -> 41.177.26.176 TCP 70 52789 > http [ACK] Seq=701 Ack=18402 Win=63488 Len=0 TSval=3390177652 TSecr=140358843
532017 172.510984 68.157.168.24 -> 41.177.26.176 TCP 70 52789 > http [ACK] Seq=701 Ack=18418 Win=63424 Len=0 TSval=3390177652 TSecr=140358843
532018 172.511260 68.157.168.24 -> 41.177.26.176 TCP 70 52789 > http [ACK] Seq=701 Ack=18523 Win=63360 Len=0 TSval=3390177652 TSecr=140358843
532034 172.520809 68.157.168.24 -> 41.177.26.176 TCP 70 52789 > http [ACK] Seq=701 Ack=18612 Win=64128 Len=0 TSval=3390177662 TSecr=140358844
532035 172.520815 68.157.168.24 -> 41.177.26.176 TCP 70 52789 > http [ACK] Seq=701 Ack=18814 Win=63872 Len=0 TSval=3390177662 TSecr=140358844
532036 172.520819 68.157.168.24 -> 41.177.26.176 TCP 70 52789 > http [ACK] Seq=701 Ack=20262 Win=62464 Len=0 TSval=3390177662 TSecr=140358844
532037 172.520822 68.157.168.24 -> 41.177.26.176 TCP 70 52789 > http [ACK] Seq=701 Ack=21710 Win=60992 Len=0 TSval=3390177662 TSecr=140358844
532038 172.520995 68.157.168.24 -> 41.177.26.176 TCP 70 52789 > http [ACK] Seq=701 Ack=22825 Win=64128 Len=0 TSval=3390177662 TSecr=140358844
532072 172.536697 68.157.168.24 -> 41.177.26.176 TCP 70 52789 > http [ACK] Seq=701 Ack=22830 Win=64128 Len=0 TSval=3390177678 TSecr=140358845
553789 178.221202 68.157.168.24 -> 41.177.26.176 TCP 70 52789 > http [FIN, ACK] Seq=701 Ack=22830 Win=64128 Len=0 TSval=3390183362 TSecr=140358845
553872 178.263733 68.157.168.24 -> 41.177.26.176 TCP 70 52789 > http [ACK] Seq=702 Ack=22831 Win=64128 Len=0 TSval=3390183405 TSecr=140359418
