189392  64.735018 68.157.168.202 -> 41.177.26.176 TCP 78 34808 > http [SYN] Seq=0 Win=5840 Len=0 MSS=1460 SACK_PERM=1 TSval=3551208488 TSecr=0 WS=64
189429  64.777841 68.157.168.202 -> 41.177.26.176 TCP 70 34808 > http [ACK] Seq=1 Ack=1 Win=5888 Len=0 TSval=3551208531 TSecr=140348069
190412  65.409940 68.157.168.202 -> 41.177.26.176 TCP 70 34808 > http [ACK] Seq=370 Ack=1449 Win=8768 Len=0 TSval=3551209163 TSecr=140348133
190413  65.409973 68.157.168.202 -> 41.177.26.176 TCP 70 34808 > http [ACK] Seq=370 Ack=2897 Win=11648 Len=0 TSval=3551209163 TSecr=140348133
190414  65.409978 68.157.168.202 -> 41.177.26.176 TCP 70 34808 > http [ACK] Seq=370 Ack=4345 Win=14528 Len=0 TSval=3551209163 TSecr=140348133
190477  65.452612 68.157.168.202 -> 41.177.26.176 TCP 70 34808 > http [ACK] Seq=370 Ack=5539 Win=17472 Len=0 TSval=3551209206 TSecr=140348137
190478  65.452700 68.157.168.202 -> 41.177.26.176 TCP 70 34808 > http [ACK] Seq=370 Ack=6987 Win=20352 Len=0 TSval=3551209206 TSecr=140348137
190479  65.452767 68.157.168.202 -> 41.177.26.176 TCP 70 34808 > http [ACK] Seq=370 Ack=8435 Win=23232 Len=0 TSval=3551209206 TSecr=140348137
190480  65.452772 68.157.168.202 -> 41.177.26.176 TCP 70 34808 > http [ACK] Seq=370 Ack=8712 Win=26112 Len=0 TSval=3551209206 TSecr=140348137
207729  71.065653 68.157.168.202 -> 41.177.26.176 TCP 70 34808 > http [FIN, ACK] Seq=370 Ack=8712 Win=26112 Len=0 TSval=3551214819 TSecr=140348137
207772  71.109577 68.157.168.202 -> 41.177.26.176 TCP 70 34808 > http [ACK] Seq=371 Ack=8713 Win=26112 Len=0 TSval=3551214862 TSecr=140348703
