130350  45.542201 68.157.168.209 -> 41.177.26.176 TCP 78 62713 > http [SYN] Seq=0 Win=5840 Len=0 MSS=1460 SACK_PERM=1 TSval=1963564236 TSecr=0 WS=64
130497  45.584761 68.157.168.209 -> 41.177.26.176 TCP 70 62713 > http [ACK] Seq=1 Ack=1 Win=5888 Len=0 TSval=1963564279 TSecr=140346150
132092  46.008541 68.157.168.209 -> 41.177.26.176 TCP 70 62713 > http [ACK] Seq=320 Ack=765 Win=7424 Len=0 TSval=1963564703 TSecr=140346192
132093  46.008545 68.157.168.209 -> 41.177.26.176 TCP 70 62713 > http [ACK] Seq=320 Ack=2213 Win=10304 Len=0 TSval=1963564703 TSecr=140346192
132094  46.008568 68.157.168.209 -> 41.177.26.176 TCP 70 62713 > http [ACK] Seq=320 Ack=3661 Win=13184 Len=0 TSval=1963564703 TSecr=140346192
132095  46.008572 68.157.168.209 -> 41.177.26.176 TCP 70 62713 > http [ACK] Seq=320 Ack=3896 Win=16064 Len=0 TSval=1963564703 TSecr=140346192
132220  46.051171 68.157.168.209 -> 41.177.26.176 TCP 70 62713 > http [ACK] Seq=320 Ack=5344 Win=19008 Len=0 TSval=1963564745 TSecr=140346197
132221  46.051298 68.157.168.209 -> 41.177.26.176 TCP 70 62713 > http [ACK] Seq=320 Ack=6070 Win=21888 Len=0 TSval=1963564746 TSecr=140346197
132222  46.051304 68.157.168.209 -> 41.177.26.176 TCP 70 62713 > http [ACK] Seq=320 Ack=7518 Win=24768 Len=0 TSval=1963564746 TSecr=140346197
132224  46.051446 68.157.168.209 -> 41.177.26.176 TCP 70 62713 > http [ACK] Seq=320 Ack=8966 Win=27648 Len=0 TSval=1963564746 TSecr=140346197
132226  46.051598 68.157.168.209 -> 41.177.26.176 TCP 70 62713 > http [ACK] Seq=320 Ack=10414 Win=30592 Len=0 TSval=1963564746 TSecr=140346197
132227  46.051602 68.157.168.209 -> 41.177.26.176 TCP 70 62713 > http [ACK] Seq=320 Ack=11182 Win=33472 Len=0 TSval=1963564746 TSecr=140346197
132254  46.062793 68.157.168.209 -> 41.177.26.176 TCP 70 62713 > http [ACK] Seq=320 Ack=11187 Win=33472 Len=0 TSval=1963564757 TSecr=140346198
150608  51.681644 68.157.168.209 -> 41.177.26.176 TCP 70 62713 > http [ACK] Seq=648 Ack=11948 Win=36352 Len=0 TSval=1963570376 TSecr=140346760
150610  51.681977 68.157.168.209 -> 41.177.26.176 TCP 70 62713 > http [ACK] Seq=648 Ack=12699 Win=39232 Len=0 TSval=1963570376 TSecr=140346760
150634  51.688702 68.157.168.209 -> 41.177.26.176 TCP 70 62713 > http [ACK] Seq=648 Ack=13334 Win=42176 Len=0 TSval=1963570382 TSecr=140346760
150635  51.688706 68.157.168.209 -> 41.177.26.176 TCP 70 62713 > http [ACK] Seq=648 Ack=13767 Win=45056 Len=0 TSval=1963570382 TSecr=140346760
150636  51.688710 68.157.168.209 -> 41.177.26.176 TCP 70 62713 > http [ACK] Seq=648 Ack=14909 Win=47936 Len=0 TSval=1963570383 TSecr=140346761
150637  51.688714 68.157.168.209 -> 41.177.26.176 TCP 70 62713 > http [ACK] Seq=648 Ack=14959 Win=47936 Len=0 TSval=1963570383 TSecr=140346761
150640  51.688841 68.157.168.209 -> 41.177.26.176 TCP 70 62713 > http [ACK] Seq=648 Ack=16407 Win=50816 Len=0 TSval=1963570383 TSecr=140346761
150641  51.688845 68.157.168.209 -> 41.177.26.176 TCP 70 62713 > http [ACK] Seq=648 Ack=16844 Win=53760 Len=0 TSval=1963570383 TSecr=140346761
150642  51.688850 68.157.168.209 -> 41.177.26.176 TCP 70 62713 > http [ACK] Seq=648 Ack=17091 Win=56640 Len=0 TSval=1963570383 TSecr=140346761
150647  51.689049 68.157.168.209 -> 41.177.26.176 TCP 70 62713 > http [ACK] Seq=648 Ack=17107 Win=56640 Len=0 TSval=1963570383 TSecr=140346761
150648  51.689053 68.157.168.209 -> 41.177.26.176 TCP 70 62713 > http [ACK] Seq=648 Ack=17143 Win=56640 Len=0 TSval=1963570383 TSecr=140346761
150649  51.689057 68.157.168.209 -> 41.177.26.176 TCP 70 62713 > http [ACK] Seq=648 Ack=17207 Win=56640 Len=0 TSval=1963570383 TSecr=140346761
150708  51.694364 68.157.168.209 -> 41.177.26.176 TCP 70 62713 > http [ACK] Seq=648 Ack=17432 Win=59520 Len=0 TSval=1963570388 TSecr=140346761
150709  51.694368 68.157.168.209 -> 41.177.26.176 TCP 70 62713 > http [ACK] Seq=648 Ack=17532 Win=59520 Len=0 TSval=1963570388 TSecr=140346761
150710  51.695260 68.157.168.209 -> 41.177.26.176 TCP 70 62713 > http [ACK] Seq=648 Ack=17680 Win=62400 Len=0 TSval=1963570389 TSecr=140346761
150711  51.695265 68.157.168.209 -> 41.177.26.176 TCP 70 62713 > http [ACK] Seq=648 Ack=19128 Win=63744 Len=0 TSval=1963570389 TSecr=140346761
150712  51.695269 68.157.168.209 -> 41.177.26.176 TCP 70 62713 > http [ACK] Seq=648 Ack=20576 Win=62272 Len=0 TSval=1963570389 TSecr=140346761
150716  51.695568 68.157.168.209 -> 41.177.26.176 TCP 70 62713 > http [ACK] Seq=648 Ack=21699 Win=64128 Len=0 TSval=1963570389 TSecr=140346761
150736  51.715038 68.157.168.209 -> 41.177.26.176 TCP 70 62713 > http [ACK] Seq=648 Ack=21704 Win=64128 Len=0 TSval=1963570409 TSecr=140346763
174149  57.874463 68.157.168.209 -> 41.177.26.176 TCP 70 62713 > http [FIN, ACK] Seq=648 Ack=21704 Win=64128 Len=0 TSval=1963576568 TSecr=140346763
174281  57.917746 68.157.168.209 -> 41.177.26.176 TCP 70 62713 > http [ACK] Seq=649 Ack=21705 Win=64128 Len=0 TSval=1963576611 TSecr=140347383
190445  65.425395 68.157.168.209 -> 41.177.26.176 TCP 78 36035 > http [SYN] Seq=0 Win=5840 Len=0 MSS=1460 SACK_PERM=1 TSval=1963584118 TSecr=0 WS=64
190514  65.468230 68.157.168.209 -> 41.177.26.176 TCP 70 36035 > http [ACK] Seq=1 Ack=1 Win=5888 Len=0 TSval=1963584161 TSecr=140348138
194893  66.997071 68.157.168.209 -> 41.177.26.176 TCP 70 36035 > http [ACK] Seq=357 Ack=1449 Win=8768 Len=0 TSval=1963585690 TSecr=140348291
194894  66.997076 68.157.168.209 -> 41.177.26.176 TCP 70 36035 > http [ACK] Seq=357 Ack=1471 Win=8768 Len=0 TSval=1963585690 TSecr=140348291
194931  67.004233 68.157.168.209 -> 41.177.26.176 TCP 70 36035 > http [ACK] Seq=357 Ack=2106 Win=11648 Len=0 TSval=1963585697 TSecr=140348292
194934  67.005096 68.157.168.209 -> 41.177.26.176 TCP 70 36035 > http [ACK] Seq=357 Ack=2299 Win=14528 Len=0 TSval=1963585698 TSecr=140348292
194936  67.005222 68.157.168.209 -> 41.177.26.176 TCP 70 36035 > http [ACK] Seq=357 Ack=2768 Win=17472 Len=0 TSval=1963585698 TSecr=140348292
194937  67.005227 68.157.168.209 -> 41.177.26.176 TCP 70 36035 > http [ACK] Seq=357 Ack=3642 Win=20352 Len=0 TSval=1963585698 TSecr=140348292
194938  67.005232 68.157.168.209 -> 41.177.26.176 TCP 70 36035 > http [ACK] Seq=357 Ack=5090 Win=23232 Len=0 TSval=1963585698 TSecr=140348292
194941  67.005397 68.157.168.209 -> 41.177.26.176 TCP 70 36035 > http [ACK] Seq=357 Ack=5429 Win=26112 Len=0 TSval=1963585698 TSecr=140348292
194942  67.005402 68.157.168.209 -> 41.177.26.176 TCP 70 36035 > http [ACK] Seq=357 Ack=5640 Win=29056 Len=0 TSval=1963585698 TSecr=140348292
194943  67.005406 68.157.168.209 -> 41.177.26.176 TCP 70 36035 > http [ACK] Seq=357 Ack=5743 Win=29056 Len=0 TSval=1963585698 TSecr=140348292
195053  67.040447 68.157.168.209 -> 41.177.26.176 TCP 70 36035 > http [ACK] Seq=357 Ack=6226 Win=31936 Len=0 TSval=1963585733 TSecr=140348296
195054  67.040657 68.157.168.209 -> 41.177.26.176 TCP 70 36035 > http [ACK] Seq=357 Ack=7674 Win=34816 Len=0 TSval=1963585733 TSecr=140348296
195055  67.040662 68.157.168.209 -> 41.177.26.176 TCP 70 36035 > http [ACK] Seq=357 Ack=9122 Win=37696 Len=0 TSval=1963585733 TSecr=140348296
195056  67.040666 68.157.168.209 -> 41.177.26.176 TCP 70 36035 > http [ACK] Seq=357 Ack=10152 Win=40640 Len=0 TSval=1963585733 TSecr=140348296
196596  67.455587 68.157.168.209 -> 41.177.26.176 TCP 70 36035 > http [ACK] Seq=676 Ack=12582 Win=46400 Len=0 TSval=1963586148 TSecr=140348337
196597  67.455592 68.157.168.209 -> 41.177.26.176 TCP 70 36035 > http [ACK] Seq=676 Ack=14047 Win=49280 Len=0 TSval=1963586148 TSecr=140348337
196598  67.455596 68.157.168.209 -> 41.177.26.176 TCP 70 36035 > http [ACK] Seq=676 Ack=16221 Win=55104 Len=0 TSval=1963586148 TSecr=140348337
196716  67.504825 68.157.168.209 -> 41.177.26.176 TCP 70 36035 > http [ACK] Seq=676 Ack=17947 Win=60864 Len=0 TSval=1963586198 TSecr=140348342
196717  67.505134 68.157.168.209 -> 41.177.26.176 TCP 70 36035 > http [ACK] Seq=676 Ack=20843 Win=64128 Len=0 TSval=1963586198 TSecr=140348342
197026  67.545597 68.157.168.209 -> 41.177.26.176 TCP 70 36035 > http [ACK] Seq=676 Ack=21223 Win=64128 Len=0 TSval=1963586238 TSecr=140348342
207004  70.851455 68.157.168.209 -> 41.177.26.176 TCP 70 36035 > http [ACK] Seq=984 Ack=22671 Win=64128 Len=0 TSval=1963589544 TSecr=140348677
207005  70.851460 68.157.168.209 -> 41.177.26.176 TCP 70 36035 > http [ACK] Seq=984 Ack=22704 Win=64064 Len=0 TSval=1963589544 TSecr=140348677
207033  70.861582 68.157.168.209 -> 41.177.26.176 TCP 70 36035 > http [ACK] Seq=984 Ack=23464 Win=64128 Len=0 TSval=1963589554 TSecr=140348678
207034  70.862243 68.157.168.209 -> 41.177.26.176 TCP 70 36035 > http [ACK] Seq=984 Ack=23663 Win=64128 Len=0 TSval=1963589555 TSecr=140348678
207035  70.862248 68.157.168.209 -> 41.177.26.176 TCP 70 36035 > http [ACK] Seq=984 Ack=23754 Win=64000 Len=0 TSval=1963589555 TSecr=140348678
207036  70.862251 68.157.168.209 -> 41.177.26.176 TCP 70 36035 > http [ACK] Seq=984 Ack=23953 Win=63808 Len=0 TSval=1963589555 TSecr=140348678
207037  70.862255 68.157.168.209 -> 41.177.26.176 TCP 70 36035 > http [ACK] Seq=984 Ack=24155 Win=63616 Len=0 TSval=1963589555 TSecr=140348678
207038  70.862260 68.157.168.209 -> 41.177.26.176 TCP 70 36035 > http [ACK] Seq=984 Ack=24802 Win=62976 Len=0 TSval=1963589555 TSecr=140348678
207039  70.862593 68.157.168.209 -> 41.177.26.176 TCP 70 36035 > http [ACK] Seq=984 Ack=26250 Win=64128 Len=0 TSval=1963589555 TSecr=140348678
207040  70.862597 68.157.168.209 -> 41.177.26.176 TCP 70 36035 > http [ACK] Seq=984 Ack=26490 Win=63872 Len=0 TSval=1963589555 TSecr=140348678
207041  70.862601 68.157.168.209 -> 41.177.26.176 TCP 70 36035 > http [ACK] Seq=984 Ack=26697 Win=63680 Len=0 TSval=1963589555 TSecr=140348678
207042  70.862605 68.157.168.209 -> 41.177.26.176 TCP 70 36035 > http [ACK] Seq=984 Ack=26798 Win=63552 Len=0 TSval=1963589555 TSecr=140348678
207054  70.870499 68.157.168.209 -> 41.177.26.176 TCP 70 36035 > http [ACK] Seq=984 Ack=26887 Win=64128 Len=0 TSval=1963589563 TSecr=140348679
207122  70.894361 68.157.168.209 -> 41.177.26.176 TCP 70 36035 > http [ACK] Seq=984 Ack=27081 Win=64128 Len=0 TSval=1963589587 TSecr=140348681
207124  70.894506 68.157.168.209 -> 41.177.26.176 TCP 70 36035 > http [ACK] Seq=984 Ack=28529 Win=62656 Len=0 TSval=1963589587 TSecr=140348681
207125  70.894510 68.157.168.209 -> 41.177.26.176 TCP 70 36035 > http [ACK] Seq=984 Ack=29977 Win=61248 Len=0 TSval=1963589587 TSecr=140348681
207126  70.894514 68.157.168.209 -> 41.177.26.176 TCP 70 36035 > http [ACK] Seq=984 Ack=30901 Win=64128 Len=0 TSval=1963589587 TSecr=140348681
224732  76.864581 68.157.168.209 -> 41.177.26.176 TCP 70 36035 > http [FIN, ACK] Seq=984 Ack=30901 Win=64128 Len=0 TSval=1963595557 TSecr=140348681
224988  76.907278 68.157.168.209 -> 41.177.26.176 TCP 70 36035 > http [ACK] Seq=985 Ack=30902 Win=64128 Len=0 TSval=1963595599 TSecr=140349282
290286  96.842564 68.157.168.209 -> 41.177.26.176 TCP 78 52491 > http [SYN] Seq=0 Win=5840 Len=0 MSS=1460 SACK_PERM=1 TSval=1963615534 TSecr=0 WS=64
290359  96.886054 68.157.168.209 -> 41.177.26.176 TCP 70 52491 > http [ACK] Seq=1 Ack=1 Win=5888 Len=0 TSval=1963615577 TSecr=140351280
291254  97.307002 68.157.168.209 -> 41.177.26.176 TCP 70 52491 > http [ACK] Seq=320 Ack=1449 Win=8768 Len=0 TSval=1963615998 TSecr=140351322
291255  97.307007 68.157.168.209 -> 41.177.26.176 TCP 70 52491 > http [ACK] Seq=320 Ack=2431 Win=11648 Len=0 TSval=1963615998 TSecr=140351322
291256  97.307161 68.157.168.209 -> 41.177.26.176 TCP 70 52491 > http [ACK] Seq=320 Ack=3879 Win=14528 Len=0 TSval=1963615998 TSecr=140351322
291257  97.307165 68.157.168.209 -> 41.177.26.176 TCP 70 52491 > http [ACK] Seq=320 Ack=3896 Win=14528 Len=0 TSval=1963615998 TSecr=140351322
291342  97.350028 68.157.168.209 -> 41.177.26.176 TCP 70 52491 > http [ACK] Seq=320 Ack=5344 Win=17472 Len=0 TSval=1963616041 TSecr=140351327
291343  97.350320 68.157.168.209 -> 41.177.26.176 TCP 70 52491 > http [ACK] Seq=320 Ack=6070 Win=20352 Len=0 TSval=1963616041 TSecr=140351327
291349  97.357327 68.157.168.209 -> 41.177.26.176 TCP 70 52491 > http [ACK] Seq=320 Ack=7518 Win=23232 Len=0 TSval=1963616048 TSecr=140351327
291350  97.357332 68.157.168.209 -> 41.177.26.176 TCP 70 52491 > http [ACK] Seq=320 Ack=7792 Win=26112 Len=0 TSval=1963616048 TSecr=140351327
291351  97.357395 68.157.168.209 -> 41.177.26.176 TCP 70 52491 > http [ACK] Seq=320 Ack=9240 Win=29056 Len=0 TSval=1963616048 TSecr=140351327
291352  97.357400 68.157.168.209 -> 41.177.26.176 TCP 70 52491 > http [ACK] Seq=320 Ack=10393 Win=31936 Len=0 TSval=1963616048 TSecr=140351327
291353  97.357403 68.157.168.209 -> 41.177.26.176 TCP 70 52491 > http [ACK] Seq=320 Ack=11070 Win=34816 Len=0 TSval=1963616048 TSecr=140351327
291371  97.371488 68.157.168.209 -> 41.177.26.176 TCP 70 52491 > http [ACK] Seq=320 Ack=11075 Win=34816 Len=0 TSval=1963616063 TSecr=140351329
294738  99.337851 68.157.168.209 -> 41.177.26.176 TCP 70 52491 > http [ACK] Seq=639 Ack=12523 Win=37696 Len=0 TSval=1963618029 TSecr=140351525
294739  99.337856 68.157.168.209 -> 41.177.26.176 TCP 70 52491 > http [ACK] Seq=639 Ack=13505 Win=40640 Len=0 TSval=1963618029 TSecr=140351525
294740  99.338208 68.157.168.209 -> 41.177.26.176 TCP 70 52491 > http [ACK] Seq=639 Ack=14953 Win=43520 Len=0 TSval=1963618029 TSecr=140351525
294741  99.338300 68.157.168.209 -> 41.177.26.176 TCP 70 52491 > http [ACK] Seq=639 Ack=16401 Win=46400 Len=0 TSval=1963618029 TSecr=140351525
294742  99.338327 68.157.168.209 -> 41.177.26.176 TCP 70 52491 > http [ACK] Seq=639 Ack=17137 Win=49280 Len=0 TSval=1963618029 TSecr=140351525
294841  99.391966 68.157.168.209 -> 41.177.26.176 TCP 70 52491 > http [ACK] Seq=639 Ack=18585 Win=52224 Len=0 TSval=1963618083 TSecr=140351531
294842  99.391971 68.157.168.209 -> 41.177.26.176 TCP 70 52491 > http [ACK] Seq=639 Ack=20033 Win=55104 Len=0 TSval=1963618083 TSecr=140351531
294843  99.392057 68.157.168.209 -> 41.177.26.176 TCP 70 52491 > http [ACK] Seq=639 Ack=21446 Win=57984 Len=0 TSval=1963618083 TSecr=140351531
294844  99.392061 68.157.168.209 -> 41.177.26.176 TCP 70 52491 > http [ACK] Seq=639 Ack=22123 Win=60864 Len=0 TSval=1963618083 TSecr=140351531
294863  99.407137 68.157.168.209 -> 41.177.26.176 TCP 70 52491 > http [ACK] Seq=639 Ack=22128 Win=60864 Len=0 TSval=1963618098 TSecr=140351532
296723 100.214259 68.157.168.209 -> 41.177.26.176 TCP 70 52491 > http [ACK] Seq=976 Ack=23601 Win=63808 Len=0 TSval=1963618905 TSecr=140351613
296755 100.224687 68.157.168.209 -> 41.177.26.176 TCP 70 52491 > http [ACK] Seq=976 Ack=25564 Win=64128 Len=0 TSval=1963618916 TSecr=140351614
296758 100.224963 68.157.168.209 -> 41.177.26.176 TCP 70 52491 > http [ACK] Seq=976 Ack=27670 Win=62208 Len=0 TSval=1963618916 TSecr=140351614
297081 100.257246 68.157.168.209 -> 41.177.26.176 TCP 70 52491 > http [ACK] Seq=976 Ack=28116 Win=64128 Len=0 TSval=1963618948 TSecr=140351614
297189 100.267912 68.157.168.209 -> 41.177.26.176 TCP 70 52491 > http [ACK] Seq=976 Ack=31012 Win=64128 Len=0 TSval=1963618959 TSecr=140351617
297373 100.307748 68.157.168.209 -> 41.177.26.176 TCP 70 52491 > http [ACK] Seq=976 Ack=32189 Win=64128 Len=0 TSval=1963618999 TSecr=140351618
312405 106.595976 68.157.168.209 -> 41.177.26.176 TCP 70 52491 > http [FIN, ACK] Seq=976 Ack=32189 Win=64128 Len=0 TSval=1963625287 TSecr=140351618
312513 106.639146 68.157.168.209 -> 41.177.26.176 TCP 70 52491 > http [ACK] Seq=977 Ack=32190 Win=64128 Len=0 TSval=1963625330 TSecr=140352256
696306 220.616640 68.157.168.209 -> 41.177.26.176 TCP 78 40378 > http [SYN] Seq=0 Win=5840 Len=0 MSS=1460 SACK_PERM=1 TSval=1963739301 TSecr=0 WS=64
696410 220.660064 68.157.168.209 -> 41.177.26.176 TCP 70 40378 > http [ACK] Seq=1 Ack=1 Win=5888 Len=0 TSval=1963739345 TSecr=140363658
698475 221.482521 68.157.168.209 -> 41.177.26.176 TCP 70 40378 > http [ACK] Seq=340 Ack=1449 Win=8768 Len=0 TSval=1963740167 TSecr=140363740
698476 221.482526 68.157.168.209 -> 41.177.26.176 TCP 70 40378 > http [ACK] Seq=340 Ack=1493 Win=8768 Len=0 TSval=1963740167 TSecr=140363740
698512 221.495541 68.157.168.209 -> 41.177.26.176 TCP 70 40378 > http [ACK] Seq=340 Ack=2164 Win=11648 Len=0 TSval=1963740180 TSecr=140363741
698513 221.495737 68.157.168.209 -> 41.177.26.176 TCP 70 40378 > http [ACK] Seq=340 Ack=2394 Win=14528 Len=0 TSval=1963740180 TSecr=140363741
698514 221.495775 68.157.168.209 -> 41.177.26.176 TCP 70 40378 > http [ACK] Seq=340 Ack=2715 Win=17472 Len=0 TSval=1963740180 TSecr=140363741
698515 221.495848 68.157.168.209 -> 41.177.26.176 TCP 70 40378 > http [ACK] Seq=340 Ack=2948 Win=20352 Len=0 TSval=1963740180 TSecr=140363741
698516 221.496096 68.157.168.209 -> 41.177.26.176 TCP 70 40378 > http [ACK] Seq=340 Ack=3464 Win=23232 Len=0 TSval=1963740181 TSecr=140363741
698517 221.496182 68.157.168.209 -> 41.177.26.176 TCP 70 40378 > http [ACK] Seq=340 Ack=4912 Win=26112 Len=0 TSval=1963740181 TSecr=140363741
698518 221.496187 68.157.168.209 -> 41.177.26.176 TCP 70 40378 > http [ACK] Seq=340 Ack=5400 Win=29056 Len=0 TSval=1963740181 TSecr=140363741
698519 221.496191 68.157.168.209 -> 41.177.26.176 TCP 70 40378 > http [ACK] Seq=340 Ack=5567 Win=31936 Len=0 TSval=1963740181 TSecr=140363741
698520 221.496194 68.157.168.209 -> 41.177.26.176 TCP 70 40378 > http [ACK] Seq=340 Ack=5728 Win=31936 Len=0 TSval=1963740181 TSecr=140363741
698567 221.525631 68.157.168.209 -> 41.177.26.176 TCP 70 40378 > http [ACK] Seq=340 Ack=6040 Win=34816 Len=0 TSval=1963740210 TSecr=140363744
698569 221.526124 68.157.168.209 -> 41.177.26.176 TCP 70 40378 > http [ACK] Seq=340 Ack=7488 Win=37696 Len=0 TSval=1963740211 TSecr=140363744
698570 221.526129 68.157.168.209 -> 41.177.26.176 TCP 70 40378 > http [ACK] Seq=340 Ack=8936 Win=40640 Len=0 TSval=1963740211 TSecr=140363744
698571 221.526242 68.157.168.209 -> 41.177.26.176 TCP 70 40378 > http [ACK] Seq=340 Ack=10116 Win=43520 Len=0 TSval=1963740211 TSecr=140363744
714105 227.803468 68.157.168.209 -> 41.177.26.176 TCP 70 40378 > http [FIN, ACK] Seq=340 Ack=10116 Win=43520 Len=0 TSval=1963746488 TSecr=140363744
714183 227.846587 68.157.168.209 -> 41.177.26.176 TCP 70 40378 > http [ACK] Seq=341 Ack=10117 Win=43520 Len=0 TSval=1963746531 TSecr=140364376
790600 256.825248 68.157.168.209 -> 41.177.26.176 TCP 78 58959 > http [SYN] Seq=0 Win=5840 Len=0 MSS=1460 SACK_PERM=1 TSval=1963775508 TSecr=0 WS=64
790706 256.868694 68.157.168.209 -> 41.177.26.176 TCP 70 58959 > http [ACK] Seq=1 Ack=1 Win=5888 Len=0 TSval=1963775551 TSecr=140367278
793418 258.405225 68.157.168.209 -> 41.177.26.176 TCP 70 58959 > http [ACK] Seq=319 Ack=1449 Win=8768 Len=0 TSval=1963777088 TSecr=140367432
793419 258.405230 68.157.168.209 -> 41.177.26.176 TCP 70 58959 > http [ACK] Seq=319 Ack=1486 Win=8768 Len=0 TSval=1963777088 TSecr=140367432
793440 258.416438 68.157.168.209 -> 41.177.26.176 TCP 70 58959 > http [ACK] Seq=319 Ack=2246 Win=11648 Len=0 TSval=1963777099 TSecr=140367433
793441 258.416645 68.157.168.209 -> 41.177.26.176 TCP 70 58959 > http [ACK] Seq=319 Ack=2455 Win=14528 Len=0 TSval=1963777099 TSecr=140367433
793442 258.416755 68.157.168.209 -> 41.177.26.176 TCP 70 58959 > http [ACK] Seq=319 Ack=2755 Win=17472 Len=0 TSval=1963777099 TSecr=140367433
793446 258.416984 68.157.168.209 -> 41.177.26.176 TCP 70 58959 > http [ACK] Seq=319 Ack=2967 Win=20352 Len=0 TSval=1963777099 TSecr=140367433
793447 258.416988 68.157.168.209 -> 41.177.26.176 TCP 70 58959 > http [ACK] Seq=319 Ack=3657 Win=23232 Len=0 TSval=1963777099 TSecr=140367433
793549 258.448214 68.157.168.209 -> 41.177.26.176 TCP 70 58959 > http [ACK] Seq=319 Ack=5105 Win=26112 Len=0 TSval=1963777131 TSecr=140367436
793550 258.448357 68.157.168.209 -> 41.177.26.176 TCP 70 58959 > http [ACK] Seq=319 Ack=5974 Win=29056 Len=0 TSval=1963777131 TSecr=140367436
793551 258.448519 68.157.168.209 -> 41.177.26.176 TCP 70 58959 > http [ACK] Seq=319 Ack=7422 Win=31936 Len=0 TSval=1963777131 TSecr=140367436
793570 258.459077 68.157.168.209 -> 41.177.26.176 TCP 70 58959 > http [ACK] Seq=319 Ack=8870 Win=34816 Len=0 TSval=1963777142 TSecr=140367438
793572 258.459096 68.157.168.209 -> 41.177.26.176 TCP 70 58959 > http [ACK] Seq=319 Ack=9904 Win=37696 Len=0 TSval=1963777142 TSecr=140367438
812910 265.102684 68.157.168.209 -> 41.177.26.176 TCP 70 58959 > http [FIN, ACK] Seq=319 Ack=9904 Win=37696 Len=0 TSval=1963783785 TSecr=140367438
812975 265.145878 68.157.168.209 -> 41.177.26.176 TCP 70 58959 > http [ACK] Seq=320 Ack=9905 Win=37696 Len=0 TSval=1963783828 TSecr=140368106
996822 332.920368 68.157.168.209 -> 41.177.26.176 TCP 78 50945 > http [SYN] Seq=0 Win=5840 Len=0 MSS=1460 SACK_PERM=1 TSval=1963851599 TSecr=0 WS=64
996861 332.963605 68.157.168.209 -> 41.177.26.176 TCP 70 50945 > http [ACK] Seq=1 Ack=1 Win=5888 Len=0 TSval=1963851642 TSecr=140374888
1000153 334.610966 68.157.168.209 -> 41.177.26.176 TCP 70 50945 > http [ACK] Seq=355 Ack=1449 Win=8768 Len=0 TSval=1963853290 TSecr=140375053
1000155 334.611254 68.157.168.209 -> 41.177.26.176 TCP 70 50945 > http [ACK] Seq=355 Ack=1483 Win=8768 Len=0 TSval=1963853290 TSecr=140375053
1000162 334.617775 68.157.168.209 -> 41.177.26.176 TCP 70 50945 > http [ACK] Seq=355 Ack=2118 Win=11648 Len=0 TSval=1963853296 TSecr=140375053
1000164 334.617966 68.157.168.209 -> 41.177.26.176 TCP 70 50945 > http [ACK] Seq=355 Ack=2395 Win=14528 Len=0 TSval=1963853297 TSecr=140375053
1000165 334.617970 68.157.168.209 -> 41.177.26.176 TCP 70 50945 > http [ACK] Seq=355 Ack=2586 Win=17472 Len=0 TSval=1963853297 TSecr=140375053
1000166 334.617974 68.157.168.209 -> 41.177.26.176 TCP 70 50945 > http [ACK] Seq=355 Ack=2780 Win=20352 Len=0 TSval=1963853297 TSecr=140375053
1000167 334.617978 68.157.168.209 -> 41.177.26.176 TCP 70 50945 > http [ACK] Seq=355 Ack=3636 Win=23232 Len=0 TSval=1963853297 TSecr=140375053
1000248 334.653857 68.157.168.209 -> 41.177.26.176 TCP 70 50945 > http [ACK] Seq=355 Ack=5084 Win=26112 Len=0 TSval=1963853332 TSecr=140375057
1000249 334.653864 68.157.168.209 -> 41.177.26.176 TCP 70 50945 > http [ACK] Seq=355 Ack=6199 Win=29056 Len=0 TSval=1963853332 TSecr=140375057
1000250 334.654221 68.157.168.209 -> 41.177.26.176 TCP 70 50945 > http [ACK] Seq=355 Ack=7647 Win=31936 Len=0 TSval=1963853333 TSecr=140375057
1000256 334.660623 68.157.168.209 -> 41.177.26.176 TCP 70 50945 > http [ACK] Seq=355 Ack=9095 Win=34816 Len=0 TSval=1963853339 TSecr=140375058
1000257 334.660628 68.157.168.209 -> 41.177.26.176 TCP 70 50945 > http [ACK] Seq=355 Ack=10109 Win=37696 Len=0 TSval=1963853339 TSecr=140375058
1013983 340.866746 68.157.168.209 -> 41.177.26.176 TCP 70 50945 > http [FIN, ACK] Seq=355 Ack=10109 Win=37696 Len=0 TSval=1963859545 TSecr=140375058
1014056 340.909592 68.157.168.209 -> 41.177.26.176 TCP 70 50945 > http [ACK] Seq=356 Ack=10110 Win=37696 Len=0 TSval=1963859588 TSecr=140375683
