34015  14.446708 68.159.161.47 -> 244.3.210.197 TCP 70 47517 > http [SYN] Seq=0 Win=5840 Len=0 MSS=1460 SACK_PERM=1 WS=128
34131  14.492340 68.159.161.47 -> 244.3.210.197 TCP 64 47517 > http [ACK] Seq=1 Ack=1 Win=5888 Len=0
35795  14.932035 68.159.161.47 -> 244.3.210.197 TCP 64 47517 > http [ACK] Seq=320 Ack=1461 Win=8832 Len=0
35796  14.932041 68.159.161.47 -> 244.3.210.197 TCP 64 47517 > http [ACK] Seq=320 Ack=2921 Win=11776 Len=0
35843  14.978107 68.159.161.47 -> 244.3.210.197 TCP 64 47517 > http [ACK] Seq=320 Ack=4381 Win=14720 Len=0
35844  14.978113 68.159.161.47 -> 244.3.210.197 TCP 64 47517 > http [ACK] Seq=320 Ack=5841 Win=17536 Len=0
35845  14.978118 68.159.161.47 -> 244.3.210.197 TCP 64 47517 > http [ACK] Seq=320 Ack=7301 Win=20480 Len=0
35846  14.978123 68.159.161.47 -> 244.3.210.197 TCP 64 47517 > http [ACK] Seq=320 Ack=8761 Win=23424 Len=0
35960  15.024111 68.159.161.47 -> 244.3.210.197 TCP 64 47517 > http [ACK] Seq=320 Ack=10221 Win=26368 Len=0
35961  15.024116 68.159.161.47 -> 244.3.210.197 TCP 64 47517 > http [ACK] Seq=320 Ack=11681 Win=29312 Len=0
35962  15.024120 68.159.161.47 -> 244.3.210.197 TCP 64 47517 > http [ACK] Seq=320 Ack=13141 Win=32128 Len=0
35963  15.024124 68.159.161.47 -> 244.3.210.197 TCP 64 47517 > http [ACK] Seq=320 Ack=14601 Win=35072 Len=0
35964  15.024129 68.159.161.47 -> 244.3.210.197 TCP 64 47517 > http [ACK] Seq=320 Ack=16061 Win=38016 Len=0
35980  15.024404 68.159.161.47 -> 244.3.210.197 TCP 64 47517 > http [ACK] Seq=320 Ack=17521 Win=40960 Len=0
35986  15.024432 68.159.161.47 -> 244.3.210.197 TCP 64 47517 > http [ACK] Seq=320 Ack=18981 Win=43904 Len=0
35998  15.024677 68.159.161.47 -> 244.3.210.197 TCP 64 47517 > http [ACK] Seq=320 Ack=20441 Win=46720 Len=0
36132  15.076982 68.159.161.47 -> 244.3.210.197 TCP 64 47517 > http [FIN, ACK] Seq=320 Ack=21849 Win=49664 Len=0
