84024  32.647443 68.157.168.253 -> 41.177.26.176 TCP 78 55336 > http [SYN] Seq=0 Win=5840 Len=0 MSS=1460 SACK_PERM=1 TSval=33958435 TSecr=0 WS=64
84194  32.690385 68.157.168.253 -> 41.177.26.176 TCP 70 55336 > http [ACK] Seq=1 Ack=1 Win=5888 Len=0 TSval=33958478 TSecr=140344861
88476  34.198078 68.157.168.253 -> 41.177.26.176 TCP 70 55336 > http [ACK] Seq=369 Ack=1439 Win=8768 Len=0 TSval=33959986 TSecr=140345011
88497  34.210834 68.157.168.253 -> 41.177.26.176 TCP 70 55336 > http [ACK] Seq=369 Ack=2199 Win=11648 Len=0 TSval=33959999 TSecr=140345013
88498  34.210985 68.157.168.253 -> 41.177.26.176 TCP 70 55336 > http [ACK] Seq=369 Ack=2408 Win=14528 Len=0 TSval=33959999 TSecr=140345013
88501  34.211250 68.157.168.253 -> 41.177.26.176 TCP 70 55336 > http [ACK] Seq=369 Ack=2499 Win=14528 Len=0 TSval=33959999 TSecr=140345013
88502  34.211255 68.157.168.253 -> 41.177.26.176 TCP 70 55336 > http [ACK] Seq=369 Ack=2708 Win=17344 Len=0 TSval=33959999 TSecr=140345013
88503  34.211259 68.157.168.253 -> 41.177.26.176 TCP 70 55336 > http [ACK] Seq=369 Ack=2920 Win=20224 Len=0 TSval=33959999 TSecr=140345013
88504  34.211263 68.157.168.253 -> 41.177.26.176 TCP 70 55336 > http [ACK] Seq=369 Ack=3612 Win=23104 Len=0 TSval=33959999 TSecr=140345013
88597  34.241091 68.157.168.253 -> 41.177.26.176 TCP 70 55336 > http [ACK] Seq=369 Ack=5060 Win=26048 Len=0 TSval=33960029 TSecr=140345016
88598  34.241096 68.157.168.253 -> 41.177.26.176 TCP 70 55336 > http [ACK] Seq=369 Ack=5639 Win=28928 Len=0 TSval=33960029 TSecr=140345016
88599  34.241255 68.157.168.253 -> 41.177.26.176 TCP 70 55336 > http [ACK] Seq=369 Ack=7087 Win=31808 Len=0 TSval=33960029 TSecr=140345016
88665  34.253445 68.157.168.253 -> 41.177.26.176 TCP 70 55336 > http [ACK] Seq=369 Ack=8535 Win=34688 Len=0 TSval=33960041 TSecr=140345017
88666  34.253451 68.157.168.253 -> 41.177.26.176 TCP 70 55336 > http [ACK] Seq=369 Ack=9340 Win=37632 Len=0 TSval=33960041 TSecr=140345017
109571  39.308220 68.157.168.253 -> 41.177.26.176 TCP 70 55336 > http [FIN, ACK] Seq=369 Ack=9340 Win=37632 Len=0 TSval=33965096 TSecr=140345017
109797  39.351507 68.157.168.253 -> 41.177.26.176 TCP 70 55336 > http [ACK] Seq=370 Ack=9341 Win=37632 Len=0 TSval=33965139 TSecr=140345527
124250  44.321228 68.157.168.253 -> 41.177.26.176 TCP 78 38369 > http [SYN] Seq=0 Win=5840 Len=0 MSS=1460 SACK_PERM=1 TSval=33970108 TSecr=0 WS=64
124389  44.364051 68.157.168.253 -> 41.177.26.176 TCP 70 38369 > http [ACK] Seq=1 Ack=1 Win=5888 Len=0 TSval=33970151 TSecr=140346028
130218  45.487835 68.157.168.253 -> 41.177.26.176 TCP 70 38369 > http [ACK] Seq=395 Ack=813 Win=7488 Len=0 TSval=33971275 TSecr=140346140
130219  45.487934 68.157.168.253 -> 41.177.26.176 TCP 70 38369 > http [ACK] Seq=395 Ack=1566 Win=9088 Len=0 TSval=33971275 TSecr=140346140
130241  45.497737 68.157.168.253 -> 41.177.26.176 TCP 70 38369 > http [ACK] Seq=395 Ack=2231 Win=10752 Len=0 TSval=33971285 TSecr=140346141
130244  45.498027 68.157.168.253 -> 41.177.26.176 TCP 70 38369 > http [ACK] Seq=395 Ack=2466 Win=12352 Len=0 TSval=33971285 TSecr=140346141
130245  45.498032 68.157.168.253 -> 41.177.26.176 TCP 70 38369 > http [ACK] Seq=395 Ack=2557 Win=12352 Len=0 TSval=33971285 TSecr=140346141
130246  45.498038 68.157.168.253 -> 41.177.26.176 TCP 70 38369 > http [ACK] Seq=395 Ack=2792 Win=14016 Len=0 TSval=33971285 TSecr=140346141
130247  45.498042 68.157.168.253 -> 41.177.26.176 TCP 70 38369 > http [ACK] Seq=395 Ack=3030 Win=15616 Len=0 TSval=33971285 TSecr=140346141
130248  45.498296 68.157.168.253 -> 41.177.26.176 TCP 70 38369 > http [ACK] Seq=395 Ack=3763 Win=17216 Len=0 TSval=33971286 TSecr=140346141
130314  45.530859 68.157.168.253 -> 41.177.26.176 TCP 70 38369 > http [ACK] Seq=395 Ack=5211 Win=20160 Len=0 TSval=33971318 TSecr=140346145
130317  45.531187 68.157.168.253 -> 41.177.26.176 TCP 70 38369 > http [ACK] Seq=395 Ack=6609 Win=23040 Len=0 TSval=33971318 TSecr=140346145
130318  45.531193 68.157.168.253 -> 41.177.26.176 TCP 70 38369 > http [ACK] Seq=395 Ack=8057 Win=25920 Len=0 TSval=33971319 TSecr=140346145
130345  45.540663 68.157.168.253 -> 41.177.26.176 TCP 70 38369 > http [ACK] Seq=395 Ack=9505 Win=28800 Len=0 TSval=33971328 TSecr=140346146
130346  45.540668 68.157.168.253 -> 41.177.26.176 TCP 70 38369 > http [ACK] Seq=395 Ack=10726 Win=31744 Len=0 TSval=33971328 TSecr=140346146
148528  50.998324 68.157.168.253 -> 41.177.26.176 TCP 70 38369 > http [FIN, ACK] Seq=395 Ack=10726 Win=31744 Len=0 TSval=33976786 TSecr=140346146
148722  51.041159 68.157.168.253 -> 41.177.26.176 TCP 70 38369 > http [ACK] Seq=396 Ack=10727 Win=31744 Len=0 TSval=33976828 TSecr=140346696
197475  67.708796 68.157.168.253 -> 41.177.26.176 TCP 78 55867 > http [SYN] Seq=0 Win=5840 Len=0 MSS=1460 SACK_PERM=1 TSval=33993496 TSecr=0 WS=64
197601  67.751450 68.157.168.253 -> 41.177.26.176 TCP 70 55867 > http [ACK] Seq=1 Ack=1 Win=5888 Len=0 TSval=33993539 TSecr=140348367
199770  68.757864 68.157.168.253 -> 41.177.26.176 TCP 70 55867 > http [ACK] Seq=351 Ack=1449 Win=8768 Len=0 TSval=33994545 TSecr=140348467
199771  68.757869 68.157.168.253 -> 41.177.26.176 TCP 70 55867 > http [ACK] Seq=351 Ack=1485 Win=8768 Len=0 TSval=33994545 TSecr=140348467
199781  68.768232 68.157.168.253 -> 41.177.26.176 TCP 70 55867 > http [ACK] Seq=351 Ack=2162 Win=11648 Len=0 TSval=33994555 TSecr=140348469
199782  68.768373 68.157.168.253 -> 41.177.26.176 TCP 70 55867 > http [ACK] Seq=351 Ack=2403 Win=14528 Len=0 TSval=33994555 TSecr=140348469
199785  68.768493 68.157.168.253 -> 41.177.26.176 TCP 70 55867 > http [ACK] Seq=351 Ack=2494 Win=14528 Len=0 TSval=33994556 TSecr=140348469
199787  68.768798 68.157.168.253 -> 41.177.26.176 TCP 70 55867 > http [ACK] Seq=351 Ack=2735 Win=17472 Len=0 TSval=33994556 TSecr=140348469
199788  68.768802 68.157.168.253 -> 41.177.26.176 TCP 70 55867 > http [ACK] Seq=351 Ack=2979 Win=20352 Len=0 TSval=33994556 TSecr=140348469
199789  68.769118 68.157.168.253 -> 41.177.26.176 TCP 70 55867 > http [ACK] Seq=351 Ack=3744 Win=23232 Len=0 TSval=33994556 TSecr=140348469
199816  68.800311 68.157.168.253 -> 41.177.26.176 TCP 70 55867 > http [ACK] Seq=351 Ack=5192 Win=26112 Len=0 TSval=33994587 TSecr=140348472
199817  68.800316 68.157.168.253 -> 41.177.26.176 TCP 70 55867 > http [ACK] Seq=351 Ack=6367 Win=29056 Len=0 TSval=33994587 TSecr=140348472
199818  68.800406 68.157.168.253 -> 41.177.26.176 TCP 70 55867 > http [ACK] Seq=351 Ack=7815 Win=31936 Len=0 TSval=33994587 TSecr=140348472
199843  68.810528 68.157.168.253 -> 41.177.26.176 TCP 70 55867 > http [ACK] Seq=351 Ack=9263 Win=34816 Len=0 TSval=33994598 TSecr=140348473
199844  68.810533 68.157.168.253 -> 41.177.26.176 TCP 70 55867 > http [ACK] Seq=351 Ack=10504 Win=37696 Len=0 TSval=33994598 TSecr=140348473
209498  72.195448 68.157.168.253 -> 41.177.26.176 TCP 70 55867 > http [ACK] Seq=673 Ack=11952 Win=40640 Len=0 TSval=33997982 TSecr=140348811
209499  72.195661 68.157.168.253 -> 41.177.26.176 TCP 70 55867 > http [ACK] Seq=673 Ack=12075 Win=40640 Len=0 TSval=33997983 TSecr=140348811
209520  72.204870 68.157.168.253 -> 41.177.26.176 TCP 70 55867 > http [ACK] Seq=673 Ack=12835 Win=43520 Len=0 TSval=33997992 TSecr=140348812
209521  72.204875 68.157.168.253 -> 41.177.26.176 TCP 70 55867 > http [ACK] Seq=673 Ack=12926 Win=43520 Len=0 TSval=33997992 TSecr=140348812
209522  72.205028 68.157.168.253 -> 41.177.26.176 TCP 70 55867 > http [ACK] Seq=673 Ack=13139 Win=46400 Len=0 TSval=33997992 TSecr=140348812
209523  72.205032 68.157.168.253 -> 41.177.26.176 TCP 70 55867 > http [ACK] Seq=673 Ack=13352 Win=49280 Len=0 TSval=33997992 TSecr=140348812
209524  72.205242 68.157.168.253 -> 41.177.26.176 TCP 70 55867 > http [ACK] Seq=673 Ack=13568 Win=52224 Len=0 TSval=33997992 TSecr=140348812
209525  72.205247 68.157.168.253 -> 41.177.26.176 TCP 70 55867 > http [ACK] Seq=673 Ack=14480 Win=55104 Len=0 TSval=33997992 TSecr=140348812
209528  72.205516 68.157.168.253 -> 41.177.26.176 TCP 70 55867 > http [ACK] Seq=673 Ack=15928 Win=57984 Len=0 TSval=33997993 TSecr=140348812
209529  72.205521 68.157.168.253 -> 41.177.26.176 TCP 70 55867 > http [ACK] Seq=673 Ack=16219 Win=60864 Len=0 TSval=33997993 TSecr=140348812
209530  72.205526 68.157.168.253 -> 41.177.26.176 TCP 70 55867 > http [ACK] Seq=673 Ack=16389 Win=62272 Len=0 TSval=33997993 TSecr=140348812
209532  72.205547 68.157.168.253 -> 41.177.26.176 TCP 70 55867 > http [ACK] Seq=673 Ack=16405 Win=62208 Len=0 TSval=33997993 TSecr=140348812
209533  72.205551 68.157.168.253 -> 41.177.26.176 TCP 70 55867 > http [ACK] Seq=673 Ack=16441 Win=62208 Len=0 TSval=33997993 TSecr=140348812
209534  72.205696 68.157.168.253 -> 41.177.26.176 TCP 70 55867 > http [ACK] Seq=673 Ack=16629 Win=64128 Len=0 TSval=33997993 TSecr=140348812
209549  72.213611 68.157.168.253 -> 41.177.26.176 TCP 70 55867 > http [ACK] Seq=673 Ack=16873 Win=64128 Len=0 TSval=33998001 TSecr=140348813
209550  72.214155 68.157.168.253 -> 41.177.26.176 TCP 70 55867 > http [ACK] Seq=673 Ack=17140 Win=64128 Len=0 TSval=33998001 TSecr=140348813
209551  72.214160 68.157.168.253 -> 41.177.26.176 TCP 70 55867 > http [ACK] Seq=673 Ack=18588 Win=62656 Len=0 TSval=33998001 TSecr=140348813
209552  72.214291 68.157.168.253 -> 41.177.26.176 TCP 70 55867 > http [ACK] Seq=673 Ack=20036 Win=64128 Len=0 TSval=33998001 TSecr=140348813
209553  72.214295 68.157.168.253 -> 41.177.26.176 TCP 70 55867 > http [ACK] Seq=673 Ack=21015 Win=63104 Len=0 TSval=33998001 TSecr=140348813
209612  72.235237 68.157.168.253 -> 41.177.26.176 TCP 70 55867 > http [ACK] Seq=673 Ack=21020 Win=64128 Len=0 TSval=33998022 TSecr=140348815
222908  76.372660 68.157.168.253 -> 41.177.26.176 TCP 70 55867 > http [ACK] Seq=1027 Ack=22468 Win=64128 Len=0 TSval=34002159 TSecr=140349229
222909  76.372664 68.157.168.253 -> 41.177.26.176 TCP 70 55867 > http [ACK] Seq=1027 Ack=22511 Win=64064 Len=0 TSval=34002160 TSecr=140349229
222957  76.379707 68.157.168.253 -> 41.177.26.176 TCP 70 55867 > http [ACK] Seq=1027 Ack=23146 Win=64128 Len=0 TSval=34002166 TSecr=140349230
222958  76.379835 68.157.168.253 -> 41.177.26.176 TCP 70 55867 > http [ACK] Seq=1027 Ack=23337 Win=64128 Len=0 TSval=34002167 TSecr=140349230
222959  76.379840 68.157.168.253 -> 41.177.26.176 TCP 70 55867 > http [ACK] Seq=1027 Ack=23428 Win=64000 Len=0 TSval=34002167 TSecr=140349230
222960  76.379844 68.157.168.253 -> 41.177.26.176 TCP 70 55867 > http [ACK] Seq=1027 Ack=23619 Win=63808 Len=0 TSval=34002167 TSecr=140349230
222961  76.379848 68.157.168.253 -> 41.177.26.176 TCP 70 55867 > http [ACK] Seq=1027 Ack=23813 Win=63616 Len=0 TSval=34002167 TSecr=140349230
222965  76.380035 68.157.168.253 -> 41.177.26.176 TCP 70 55867 > http [ACK] Seq=1027 Ack=24668 Win=64128 Len=0 TSval=34002167 TSecr=140349230
222966  76.380402 68.157.168.253 -> 41.177.26.176 TCP 70 55867 > http [ACK] Seq=1027 Ack=26116 Win=64128 Len=0 TSval=34002167 TSecr=140349230
222967  76.380407 68.157.168.253 -> 41.177.26.176 TCP 70 55867 > http [ACK] Seq=1027 Ack=26439 Win=63744 Len=0 TSval=34002167 TSecr=140349230
222968  76.380411 68.157.168.253 -> 41.177.26.176 TCP 70 55867 > http [ACK] Seq=1027 Ack=26673 Win=63552 Len=0 TSval=34002167 TSecr=140349230
222969  76.380530 68.157.168.253 -> 41.177.26.176 TCP 70 55867 > http [ACK] Seq=1027 Ack=26689 Win=64128 Len=0 TSval=34002167 TSecr=140349230
222970  76.380900 68.157.168.253 -> 41.177.26.176 TCP 70 55867 > http [ACK] Seq=1027 Ack=26764 Win=64128 Len=0 TSval=34002168 TSecr=140349230
223079  76.415108 68.157.168.253 -> 41.177.26.176 TCP 70 55867 > http [ACK] Seq=1027 Ack=27237 Win=64128 Len=0 TSval=34002202 TSecr=140349233
223080  76.415114 68.157.168.253 -> 41.177.26.176 TCP 70 55867 > http [ACK] Seq=1027 Ack=28685 Win=62656 Len=0 TSval=34002202 TSecr=140349233
223081  76.415243 68.157.168.253 -> 41.177.26.176 TCP 70 55867 > http [ACK] Seq=1027 Ack=30133 Win=64128 Len=0 TSval=34002202 TSecr=140349233
223082  76.415381 68.157.168.253 -> 41.177.26.176 TCP 70 55867 > http [ACK] Seq=1027 Ack=31147 Win=64128 Len=0 TSval=34002202 TSecr=140349233
238050  82.644393 68.157.168.253 -> 41.177.26.176 TCP 70 55867 > http [ACK] Seq=1377 Ack=32595 Win=64128 Len=0 TSval=34008431 TSecr=140349856
238051  82.644397 68.157.168.253 -> 41.177.26.176 TCP 70 55867 > http [ACK] Seq=1377 Ack=32633 Win=64064 Len=0 TSval=34008431 TSecr=140349856
238172  82.665713 68.157.168.253 -> 41.177.26.176 TCP 70 55867 > http [ACK] Seq=1377 Ack=33286 Win=64128 Len=0 TSval=34008452 TSecr=140349858
238173  82.665718 68.157.168.253 -> 41.177.26.176 TCP 70 55867 > http [ACK] Seq=1377 Ack=33527 Win=63872 Len=0 TSval=34008452 TSecr=140349858
238174  82.665722 68.157.168.253 -> 41.177.26.176 TCP 70 55867 > http [ACK] Seq=1377 Ack=33618 Win=64128 Len=0 TSval=34008452 TSecr=140349858
238175  82.665726 68.157.168.253 -> 41.177.26.176 TCP 70 55867 > http [ACK] Seq=1377 Ack=33859 Win=63872 Len=0 TSval=34008452 TSecr=140349858
238176  82.665730 68.157.168.253 -> 41.177.26.176 TCP 70 55867 > http [ACK] Seq=1377 Ack=34103 Win=63616 Len=0 TSval=34008452 TSecr=140349858
238178  82.665830 68.157.168.253 -> 41.177.26.176 TCP 70 55867 > http [ACK] Seq=1377 Ack=34628 Win=64128 Len=0 TSval=34008452 TSecr=140349858
238181  82.666015 68.157.168.253 -> 41.177.26.176 TCP 70 55867 > http [ACK] Seq=1377 Ack=36076 Win=64128 Len=0 TSval=34008453 TSecr=140349858
238186  82.666264 68.157.168.253 -> 41.177.26.176 TCP 70 55867 > http [ACK] Seq=1377 Ack=36660 Win=64128 Len=0 TSval=34008453 TSecr=140349858
238187  82.666268 68.157.168.253 -> 41.177.26.176 TCP 70 55867 > http [ACK] Seq=1377 Ack=36685 Win=64064 Len=0 TSval=34008453 TSecr=140349858
238188  82.666272 68.157.168.253 -> 41.177.26.176 TCP 70 55867 > http [ACK] Seq=1377 Ack=36714 Win=64128 Len=0 TSval=34008453 TSecr=140349858
238192  82.666344 68.157.168.253 -> 41.177.26.176 TCP 70 55867 > http [ACK] Seq=1377 Ack=36750 Win=64128 Len=0 TSval=34008453 TSecr=140349858
238193  82.666528 68.157.168.253 -> 41.177.26.176 TCP 70 55867 > http [ACK] Seq=1377 Ack=36819 Win=64128 Len=0 TSval=34008453 TSecr=140349858
238239  82.676321 68.157.168.253 -> 41.177.26.176 TCP 70 55867 > http [ACK] Seq=1377 Ack=36890 Win=64128 Len=0 TSval=34008463 TSecr=140349859
238273  82.686791 68.157.168.253 -> 41.177.26.176 TCP 70 55867 > http [ACK] Seq=1377 Ack=37263 Win=64128 Len=0 TSval=34008473 TSecr=140349860
238274  82.686811 68.157.168.253 -> 41.177.26.176 TCP 70 55867 > http [ACK] Seq=1377 Ack=41261 Win=61248 Len=0 TSval=34008473 TSecr=140349860
238334  82.702179 68.157.168.253 -> 41.177.26.176 TCP 70 55867 > http [ACK] Seq=1377 Ack=41266 Win=64128 Len=0 TSval=34008489 TSecr=140349862
243526  84.851565 68.157.168.253 -> 41.177.26.176 TCP 70 55867 > http [ACK] Seq=1745 Ack=42714 Win=64128 Len=0 TSval=34010638 TSecr=140350077
243527  84.851648 68.157.168.253 -> 41.177.26.176 TCP 70 55867 > http [ACK] Seq=1745 Ack=42875 Win=63936 Len=0 TSval=34010638 TSecr=140350077
243550  84.861910 68.157.168.253 -> 41.177.26.176 TCP 70 55867 > http [ACK] Seq=1745 Ack=43540 Win=64128 Len=0 TSval=34010649 TSecr=140350078
243551  84.861995 68.157.168.253 -> 41.177.26.176 TCP 70 55867 > http [ACK] Seq=1745 Ack=43745 Win=63872 Len=0 TSval=34010649 TSecr=140350078
243552  84.862000 68.157.168.253 -> 41.177.26.176 TCP 70 55867 > http [ACK] Seq=1745 Ack=43836 Win=63808 Len=0 TSval=34010649 TSecr=140350078
243556  84.862257 68.157.168.253 -> 41.177.26.176 TCP 70 55867 > http [ACK] Seq=1745 Ack=44041 Win=63616 Len=0 TSval=34010649 TSecr=140350078
243557  84.862261 68.157.168.253 -> 41.177.26.176 TCP 70 55867 > http [ACK] Seq=1745 Ack=44249 Win=63360 Len=0 TSval=34010649 TSecr=140350078
243560  84.862372 68.157.168.253 -> 41.177.26.176 TCP 70 55867 > http [ACK] Seq=1745 Ack=44943 Win=62720 Len=0 TSval=34010649 TSecr=140350078
243561  84.862581 68.157.168.253 -> 41.177.26.176 TCP 70 55867 > http [ACK] Seq=1745 Ack=46391 Win=64128 Len=0 TSval=34010649 TSecr=140350078
243562  84.862586 68.157.168.253 -> 41.177.26.176 TCP 70 55867 > http [ACK] Seq=1745 Ack=46806 Win=63680 Len=0 TSval=34010649 TSecr=140350078
243563  84.862589 68.157.168.253 -> 41.177.26.176 TCP 70 55867 > http [ACK] Seq=1745 Ack=47039 Win=63424 Len=0 TSval=34010649 TSecr=140350078
243564  84.862711 68.157.168.253 -> 41.177.26.176 TCP 70 55867 > http [ACK] Seq=1745 Ack=47055 Win=64128 Len=0 TSval=34010649 TSecr=140350078
243603  84.894020 68.157.168.253 -> 41.177.26.176 TCP 70 55867 > http [ACK] Seq=1745 Ack=47759 Win=64128 Len=0 TSval=34010681 TSecr=140350081
243604  84.894025 68.157.168.253 -> 41.177.26.176 TCP 70 55867 > http [ACK] Seq=1745 Ack=49207 Win=62656 Len=0 TSval=34010681 TSecr=140350081
243605  84.894181 68.157.168.253 -> 41.177.26.176 TCP 70 55867 > http [ACK] Seq=1745 Ack=50655 Win=64128 Len=0 TSval=34010681 TSecr=140350081
243621  84.904246 68.157.168.253 -> 41.177.26.176 TCP 70 55867 > http [ACK] Seq=1745 Ack=51753 Win=64128 Len=0 TSval=34010691 TSecr=140350082
253572  89.857267 68.157.168.253 -> 41.177.26.176 TCP 70 55867 > http [ACK] Seq=2069 Ack=52798 Win=64128 Len=0 TSval=34015644 TSecr=140350577
253573  89.857396 68.157.168.253 -> 41.177.26.176 TCP 70 55867 > http [ACK] Seq=2069 Ack=53544 Win=64128 Len=0 TSval=34015644 TSecr=140350577
253593  89.868962 68.157.168.253 -> 41.177.26.176 TCP 70 55867 > http [ACK] Seq=2069 Ack=54304 Win=64128 Len=0 TSval=34015655 TSecr=140350579
253594  89.868967 68.157.168.253 -> 41.177.26.176 TCP 70 55867 > http [ACK] Seq=2069 Ack=54395 Win=64000 Len=0 TSval=34015655 TSecr=140350579
253595  89.869112 68.157.168.253 -> 41.177.26.176 TCP 70 55867 > http [ACK] Seq=2069 Ack=54762 Win=64128 Len=0 TSval=34015656 TSecr=140350579
253600  89.869354 68.157.168.253 -> 41.177.26.176 TCP 70 55867 > http [ACK] Seq=2069 Ack=55129 Win=64128 Len=0 TSval=34015656 TSecr=140350579
253601  89.869358 68.157.168.253 -> 41.177.26.176 TCP 70 55867 > http [ACK] Seq=2069 Ack=55499 Win=63744 Len=0 TSval=34015656 TSecr=140350579
253620  89.899704 68.157.168.253 -> 41.177.26.176 TCP 70 55867 > http [ACK] Seq=2069 Ack=56721 Win=64128 Len=0 TSval=34015686 TSecr=140350582
253621  89.899709 68.157.168.253 -> 41.177.26.176 TCP 70 55867 > http [ACK] Seq=2069 Ack=58169 Win=62656 Len=0 TSval=34015686 TSecr=140350582
253623  89.899930 68.157.168.253 -> 41.177.26.176 TCP 70 55867 > http [ACK] Seq=2069 Ack=59231 Win=64128 Len=0 TSval=34015686 TSecr=140350582
253624  89.900185 68.157.168.253 -> 41.177.26.176 TCP 70 55867 > http [ACK] Seq=2069 Ack=60679 Win=64128 Len=0 TSval=34015687 TSecr=140350582
253638  89.911386 68.157.168.253 -> 41.177.26.176 TCP 70 55867 > http [ACK] Seq=2069 Ack=62127 Win=64128 Len=0 TSval=34015698 TSecr=140350583
253639  89.911471 68.157.168.253 -> 41.177.26.176 TCP 70 55867 > http [ACK] Seq=2069 Ack=62945 Win=63296 Len=0 TSval=34015698 TSecr=140350583
285399  95.451625 68.157.168.253 -> 41.177.26.176 TCP 70 55867 > http [FIN, ACK] Seq=2069 Ack=62945 Win=64128 Len=0 TSval=34021238 TSecr=140350583
285556  95.494101 68.157.168.253 -> 41.177.26.176 TCP 70 55867 > http [ACK] Seq=2070 Ack=62946 Win=64128 Len=0 TSval=34021280 TSecr=140351141
327728 113.336462 68.157.168.253 -> 41.177.26.176 TCP 78 36782 > http [SYN] Seq=0 Win=5840 Len=0 MSS=1460 SACK_PERM=1 TSval=34039122 TSecr=0 WS=64
327790 113.379754 68.157.168.253 -> 41.177.26.176 TCP 70 36782 > http [ACK] Seq=1 Ack=1 Win=5888 Len=0 TSval=34039165 TSecr=140352930
329516 114.752339 68.157.168.253 -> 41.177.26.176 TCP 70 36782 > http [ACK] Seq=294 Ack=1442 Win=8768 Len=0 TSval=34040537 TSecr=140353067
329531 114.763242 68.157.168.253 -> 41.177.26.176 TCP 70 36782 > http [ACK] Seq=294 Ack=2202 Win=11648 Len=0 TSval=34040548 TSecr=140353068
329532 114.763416 68.157.168.253 -> 41.177.26.176 TCP 70 36782 > http [ACK] Seq=294 Ack=2382 Win=14528 Len=0 TSval=34040549 TSecr=140353068
329533 114.763421 68.157.168.253 -> 41.177.26.176 TCP 70 36782 > http [ACK] Seq=294 Ack=2562 Win=17408 Len=0 TSval=34040549 TSecr=140353068
329534 114.763457 68.157.168.253 -> 41.177.26.176 TCP 70 36782 > http [ACK] Seq=294 Ack=2653 Win=17408 Len=0 TSval=34040549 TSecr=140353068
329535 114.763462 68.157.168.253 -> 41.177.26.176 TCP 70 36782 > http [ACK] Seq=294 Ack=2836 Win=20288 Len=0 TSval=34040549 TSecr=140353068
329539 114.763781 68.157.168.253 -> 41.177.26.176 TCP 70 36782 > http [ACK] Seq=294 Ack=3464 Win=23168 Len=0 TSval=34040549 TSecr=140353068
329569 114.795486 68.157.168.253 -> 41.177.26.176 TCP 70 36782 > http [ACK] Seq=294 Ack=4912 Win=26048 Len=0 TSval=34040581 TSecr=140353071
329570 114.795491 68.157.168.253 -> 41.177.26.176 TCP 70 36782 > http [ACK] Seq=294 Ack=5711 Win=28992 Len=0 TSval=34040581 TSecr=140353071
329574 114.795737 68.157.168.253 -> 41.177.26.176 TCP 70 36782 > http [ACK] Seq=294 Ack=7159 Win=31872 Len=0 TSval=34040581 TSecr=140353071
329635 114.806213 68.157.168.253 -> 41.177.26.176 TCP 70 36782 > http [ACK] Seq=294 Ack=8607 Win=34752 Len=0 TSval=34040591 TSecr=140353072
329636 114.806229 68.157.168.253 -> 41.177.26.176 TCP 70 36782 > http [ACK] Seq=294 Ack=9526 Win=37632 Len=0 TSval=34040591 TSecr=140353072
351609 118.923300 68.157.168.253 -> 41.177.26.176 TCP 70 36782 > http [ACK] Seq=591 Ack=10974 Win=40576 Len=0 TSval=34044708 TSecr=140353484
351610 118.923305 68.157.168.253 -> 41.177.26.176 TCP 70 36782 > http [ACK] Seq=591 Ack=11018 Win=40576 Len=0 TSval=34044708 TSecr=140353484
351625 118.934906 68.157.168.253 -> 41.177.26.176 TCP 70 36782 > http [ACK] Seq=591 Ack=11778 Win=43456 Len=0 TSval=34044720 TSecr=140353485
351626 118.934911 68.157.168.253 -> 41.177.26.176 TCP 70 36782 > http [ACK] Seq=591 Ack=11959 Win=46336 Len=0 TSval=34044720 TSecr=140353485
351628 118.935084 68.157.168.253 -> 41.177.26.176 TCP 70 36782 > http [ACK] Seq=591 Ack=12140 Win=49216 Len=0 TSval=34044720 TSecr=140353485
351629 118.935089 68.157.168.253 -> 41.177.26.176 TCP 70 36782 > http [ACK] Seq=591 Ack=12321 Win=52160 Len=0 TSval=34044720 TSecr=140353485
351633 118.935310 68.157.168.253 -> 41.177.26.176 TCP 70 36782 > http [ACK] Seq=591 Ack=12505 Win=55040 Len=0 TSval=34044720 TSecr=140353485
351634 118.935542 68.157.168.253 -> 41.177.26.176 TCP 70 36782 > http [ACK] Seq=591 Ack=13006 Win=57920 Len=0 TSval=34044720 TSecr=140353485
351635 118.935843 68.157.168.253 -> 41.177.26.176 TCP 70 36782 > http [ACK] Seq=591 Ack=14454 Win=60800 Len=0 TSval=34044721 TSecr=140353485
351636 118.935847 68.157.168.253 -> 41.177.26.176 TCP 70 36782 > http [ACK] Seq=591 Ack=14860 Win=62656 Len=0 TSval=34044721 TSecr=140353485
351637 118.935851 68.157.168.253 -> 41.177.26.176 TCP 70 36782 > http [ACK] Seq=591 Ack=14890 Win=62592 Len=0 TSval=34044721 TSecr=140353485
351638 118.935946 68.157.168.253 -> 41.177.26.176 TCP 70 36782 > http [ACK] Seq=591 Ack=14914 Win=62592 Len=0 TSval=34044721 TSecr=140353485
351639 118.935951 68.157.168.253 -> 41.177.26.176 TCP 70 36782 > http [ACK] Seq=591 Ack=14950 Win=62528 Len=0 TSval=34044721 TSecr=140353485
351640 118.935955 68.157.168.253 -> 41.177.26.176 TCP 70 36782 > http [ACK] Seq=591 Ack=15058 Win=62400 Len=0 TSval=34044721 TSecr=140353485
351643 118.944324 68.157.168.253 -> 41.177.26.176 TCP 70 36782 > http [ACK] Seq=591 Ack=15147 Win=63744 Len=0 TSval=34044729 TSecr=140353486
351644 118.944352 68.157.168.253 -> 41.177.26.176 TCP 70 36782 > http [ACK] Seq=591 Ack=15199 Win=63744 Len=0 TSval=34044729 TSecr=140353486
351665 118.966566 68.157.168.253 -> 41.177.26.176 TCP 70 36782 > http [ACK] Seq=591 Ack=16647 Win=64128 Len=0 TSval=34044751 TSecr=140353488
351666 118.966571 68.157.168.253 -> 41.177.26.176 TCP 70 36782 > http [ACK] Seq=591 Ack=18095 Win=64128 Len=0 TSval=34044751 TSecr=140353488
351667 118.966575 68.157.168.253 -> 41.177.26.176 TCP 70 36782 > http [ACK] Seq=591 Ack=19543 Win=62656 Len=0 TSval=34044751 TSecr=140353488
351688 118.977838 68.157.168.253 -> 41.177.26.176 TCP 70 36782 > http [ACK] Seq=591 Ack=19654 Win=64128 Len=0 TSval=34044763 TSecr=140353489
351692 118.978017 68.157.168.253 -> 41.177.26.176 TCP 70 36782 > http [ACK] Seq=591 Ack=21102 Win=64128 Len=0 TSval=34044763 TSecr=140353489
351693 118.978143 68.157.168.253 -> 41.177.26.176 TCP 70 36782 > http [ACK] Seq=591 Ack=23490 Win=62656 Len=0 TSval=34044763 TSecr=140353489
352290 119.398329 68.157.168.253 -> 41.177.26.176 TCP 70 36782 > http [ACK] Seq=910 Ack=25920 Win=64128 Len=0 TSval=34045183 TSecr=140353531
352291 119.398441 68.157.168.253 -> 41.177.26.176 TCP 70 36782 > http [ACK] Seq=910 Ack=27385 Win=63808 Len=0 TSval=34045183 TSecr=140353531
352292 119.398816 68.157.168.253 -> 41.177.26.176 TCP 70 36782 > http [ACK] Seq=910 Ack=29559 Win=64128 Len=0 TSval=34045184 TSecr=140353531
352374 119.453507 68.157.168.253 -> 41.177.26.176 TCP 70 36782 > http [ACK] Seq=910 Ack=31270 Win=62656 Len=0 TSval=34045239 TSecr=140353537
352376 119.453755 68.157.168.253 -> 41.177.26.176 TCP 70 36782 > http [ACK] Seq=910 Ack=33871 Win=64128 Len=0 TSval=34045239 TSecr=140353537
352446 119.493629 68.157.168.253 -> 41.177.26.176 TCP 70 36782 > http [ACK] Seq=910 Ack=34553 Win=64128 Len=0 TSval=34045279 TSecr=140353537
368094 126.112970 68.157.168.253 -> 41.177.26.176 TCP 70 36782 > http [ACK] Seq=1256 Ack=35365 Win=64128 Len=0 TSval=34051898 TSecr=140354203
368095 126.113150 68.157.168.253 -> 41.177.26.176 TCP 70 36782 > http [ACK] Seq=1256 Ack=36116 Win=64128 Len=0 TSval=34051898 TSecr=140354203
368138 126.123951 68.157.168.253 -> 41.177.26.176 TCP 70 36782 > http [ACK] Seq=1256 Ack=36873 Win=64128 Len=0 TSval=34051909 TSecr=140354204
368139 126.123956 68.157.168.253 -> 41.177.26.176 TCP 70 36782 > http [ACK] Seq=1256 Ack=37056 Win=63936 Len=0 TSval=34051909 TSecr=140354204
368140 126.123960 68.157.168.253 -> 41.177.26.176 TCP 70 36782 > http [ACK] Seq=1256 Ack=37147 Win=63808 Len=0 TSval=34051909 TSecr=140354204
368144 126.124372 68.157.168.253 -> 41.177.26.176 TCP 70 36782 > http [ACK] Seq=1256 Ack=37330 Win=64128 Len=0 TSval=34051909 TSecr=140354204
368145 126.124376 68.157.168.253 -> 41.177.26.176 TCP 70 36782 > http [ACK] Seq=1256 Ack=37516 Win=64128 Len=0 TSval=34051909 TSecr=140354204
368146 126.124380 68.157.168.253 -> 41.177.26.176 TCP 70 36782 > http [ACK] Seq=1256 Ack=38173 Win=63424 Len=0 TSval=34051909 TSecr=140354204
368227 126.156334 68.157.168.253 -> 41.177.26.176 TCP 70 36782 > http [ACK] Seq=1256 Ack=39621 Win=64128 Len=0 TSval=34051941 TSecr=140354207
368228 126.156338 68.157.168.253 -> 41.177.26.176 TCP 70 36782 > http [ACK] Seq=1256 Ack=40580 Win=63168 Len=0 TSval=34051941 TSecr=140354207
368229 126.156342 68.157.168.253 -> 41.177.26.176 TCP 70 36782 > http [ACK] Seq=1256 Ack=42028 Win=61696 Len=0 TSval=34051941 TSecr=140354207
368295 126.167290 68.157.168.253 -> 41.177.26.176 TCP 70 36782 > http [ACK] Seq=1256 Ack=43476 Win=64128 Len=0 TSval=34051952 TSecr=140354208
368296 126.167294 68.157.168.253 -> 41.177.26.176 TCP 70 36782 > http [ACK] Seq=1256 Ack=44432 Win=63168 Len=0 TSval=34051952 TSecr=140354208
385563 127.850706 68.157.168.253 -> 41.177.26.176 TCP 70 36782 > http [ACK] Seq=1565 Ack=45880 Win=64128 Len=0 TSval=34053635 TSecr=140354377
385564 127.850711 68.157.168.253 -> 41.177.26.176 TCP 70 36782 > http [ACK] Seq=1565 Ack=45902 Win=64064 Len=0 TSval=34053635 TSecr=140354377
385584 127.861608 68.157.168.253 -> 41.177.26.176 TCP 70 36782 > http [ACK] Seq=1565 Ack=46662 Win=64128 Len=0 TSval=34053646 TSecr=140354378
385585 127.861612 68.157.168.253 -> 41.177.26.176 TCP 70 36782 > http [ACK] Seq=1565 Ack=46855 Win=64128 Len=0 TSval=34053646 TSecr=140354378
385586 127.861616 68.157.168.253 -> 41.177.26.176 TCP 70 36782 > http [ACK] Seq=1565 Ack=47048 Win=63872 Len=0 TSval=34053646 TSecr=140354378
385587 127.861620 68.157.168.253 -> 41.177.26.176 TCP 70 36782 > http [ACK] Seq=1565 Ack=47241 Win=63680 Len=0 TSval=34053646 TSecr=140354378
385588 127.861716 68.157.168.253 -> 41.177.26.176 TCP 70 36782 > http [ACK] Seq=1565 Ack=47437 Win=64128 Len=0 TSval=34053646 TSecr=140354378
385591 127.861851 68.157.168.253 -> 41.177.26.176 TCP 70 36782 > http [ACK] Seq=1565 Ack=47992 Win=64128 Len=0 TSval=34053647 TSecr=140354378
385596 127.862334 68.157.168.253 -> 41.177.26.176 TCP 70 36782 > http [ACK] Seq=1565 Ack=49440 Win=64128 Len=0 TSval=34053647 TSecr=140354378
385597 127.862338 68.157.168.253 -> 41.177.26.176 TCP 70 36782 > http [ACK] Seq=1565 Ack=49985 Win=63552 Len=0 TSval=34053647 TSecr=140354378
385598 127.862342 68.157.168.253 -> 41.177.26.176 TCP 70 36782 > http [ACK] Seq=1565 Ack=50001 Win=63552 Len=0 TSval=34053647 TSecr=140354378
385600 127.862503 68.157.168.253 -> 41.177.26.176 TCP 70 36782 > http [ACK] Seq=1565 Ack=50037 Win=64128 Len=0 TSval=34053647 TSecr=140354378
385601 127.862507 68.157.168.253 -> 41.177.26.176 TCP 70 36782 > http [ACK] Seq=1565 Ack=50073 Win=64128 Len=0 TSval=34053647 TSecr=140354378
385611 127.872968 68.157.168.253 -> 41.177.26.176 TCP 70 36782 > http [ACK] Seq=1565 Ack=50162 Win=64128 Len=0 TSval=34053658 TSecr=140354379
385612 127.872973 68.157.168.253 -> 41.177.26.176 TCP 70 36782 > http [ACK] Seq=1565 Ack=50214 Win=64128 Len=0 TSval=34053658 TSecr=140354379
385620 127.893990 68.157.168.253 -> 41.177.26.176 TCP 70 36782 > http [ACK] Seq=1565 Ack=51662 Win=64128 Len=0 TSval=34053679 TSecr=140354381
385621 127.893995 68.157.168.253 -> 41.177.26.176 TCP 70 36782 > http [ACK] Seq=1565 Ack=53997 Win=61760 Len=0 TSval=34053679 TSecr=140354381
385627 127.904618 68.157.168.253 -> 41.177.26.176 TCP 70 36782 > http [ACK] Seq=1565 Ack=56503 Win=62656 Len=0 TSval=34053689 TSecr=140354382
391255 130.748951 68.157.168.253 -> 41.177.26.176 TCP 70 36782 > http [ACK] Seq=1937 Ack=57951 Win=64128 Len=0 TSval=34056534 TSecr=140354666
391256 130.748955 68.157.168.253 -> 41.177.26.176 TCP 70 36782 > http [ACK] Seq=1937 Ack=57985 Win=64064 Len=0 TSval=34056534 TSecr=140354666
391290 130.759517 68.157.168.253 -> 41.177.26.176 TCP 70 36782 > http [ACK] Seq=1937 Ack=58745 Win=64128 Len=0 TSval=34056544 TSecr=140354668
391291 130.760030 68.157.168.253 -> 41.177.26.176 TCP 70 36782 > http [ACK] Seq=1937 Ack=58958 Win=64128 Len=0 TSval=34056544 TSecr=140354668
391292 130.760035 68.157.168.253 -> 41.177.26.176 TCP 70 36782 > http [ACK] Seq=1937 Ack=59049 Win=64128 Len=0 TSval=34056544 TSecr=140354668
391293 130.760039 68.157.168.253 -> 41.177.26.176 TCP 70 36782 > http [ACK] Seq=1937 Ack=59262 Win=63872 Len=0 TSval=34056544 TSecr=140354668
391294 130.760389 68.157.168.253 -> 41.177.26.176 TCP 70 36782 > http [ACK] Seq=1937 Ack=59478 Win=63680 Len=0 TSval=34056545 TSecr=140354668
391295 130.760394 68.157.168.253 -> 41.177.26.176 TCP 70 36782 > http [ACK] Seq=1937 Ack=60172 Win=62976 Len=0 TSval=34056545 TSecr=140354668
391296 130.760398 68.157.168.253 -> 41.177.26.176 TCP 70 36782 > http [ACK] Seq=1937 Ack=61620 Win=64128 Len=0 TSval=34056545 TSecr=140354668
391297 130.760401 68.157.168.253 -> 41.177.26.176 TCP 70 36782 > http [ACK] Seq=1937 Ack=62019 Win=63680 Len=0 TSval=34056545 TSecr=140354668
391408 130.792176 68.157.168.253 -> 41.177.26.176 TCP 70 36782 > http [ACK] Seq=1937 Ack=62603 Win=64128 Len=0 TSval=34056577 TSecr=140354671
391409 130.792181 68.157.168.253 -> 41.177.26.176 TCP 70 36782 > http [ACK] Seq=1937 Ack=64051 Win=62656 Len=0 TSval=34056577 TSecr=140354671
391410 130.792286 68.157.168.253 -> 41.177.26.176 TCP 70 36782 > http [ACK] Seq=1937 Ack=65499 Win=64128 Len=0 TSval=34056577 TSecr=140354671
391411 130.792375 68.157.168.253 -> 41.177.26.176 TCP 70 36782 > http [ACK] Seq=1937 Ack=66633 Win=64128 Len=0 TSval=34056577 TSecr=140354671
393685 131.723219 68.157.168.253 -> 41.177.26.176 TCP 70 36782 > http [ACK] Seq=2286 Ack=68170 Win=64128 Len=0 TSval=34057508 TSecr=140354764
393704 131.733713 68.157.168.253 -> 41.177.26.176 TCP 70 36782 > http [ACK] Seq=2286 Ack=70400 Win=64128 Len=0 TSval=34057518 TSecr=140354765
393730 131.766756 68.157.168.253 -> 41.177.26.176 TCP 70 36782 > http [ACK] Seq=2286 Ack=72923 Win=64128 Len=0 TSval=34057551 TSecr=140354768
393735 131.777045 68.157.168.253 -> 41.177.26.176 TCP 70 36782 > http [ACK] Seq=2286 Ack=76900 Win=61248 Len=0 TSval=34057562 TSecr=140354769
412672 137.646300 68.157.168.253 -> 41.177.26.176 TCP 70 36782 > http [FIN, ACK] Seq=2286 Ack=76900 Win=64128 Len=0 TSval=34063430 TSecr=140354769
412718 137.689592 68.157.168.253 -> 41.177.26.176 TCP 70 36782 > http [ACK] Seq=2287 Ack=76901 Win=64128 Len=0 TSval=34063474 TSecr=140355361
443656 144.404799 68.157.168.253 -> 41.177.26.176 TCP 78 62553 > http [SYN] Seq=0 Win=5840 Len=0 MSS=1460 SACK_PERM=1 TSval=34070189 TSecr=0 WS=64
443813 144.447331 68.157.168.253 -> 41.177.26.176 TCP 70 62553 > http [ACK] Seq=1 Ack=1 Win=5888 Len=0 TSval=34070231 TSecr=140356036
445791 144.854787 68.157.168.253 -> 41.177.26.176 TCP 70 62553 > http [ACK] Seq=320 Ack=785 Win=7424 Len=0 TSval=34070639 TSecr=140356077
445792 144.854858 68.157.168.253 -> 41.177.26.176 TCP 70 62553 > http [ACK] Seq=320 Ack=2233 Win=10304 Len=0 TSval=34070639 TSecr=140356077
445795 144.855027 68.157.168.253 -> 41.177.26.176 TCP 70 62553 > http [ACK] Seq=320 Ack=2916 Win=13248 Len=0 TSval=34070639 TSecr=140356077
445798 144.855039 68.157.168.253 -> 41.177.26.176 TCP 70 62553 > http [ACK] Seq=320 Ack=3903 Win=16128 Len=0 TSval=34070639 TSecr=140356077
446407 144.898027 68.157.168.253 -> 41.177.26.176 TCP 70 62553 > http [ACK] Seq=320 Ack=5351 Win=19008 Len=0 TSval=34070682 TSecr=140356081
446410 144.898237 68.157.168.253 -> 41.177.26.176 TCP 70 62553 > http [ACK] Seq=320 Ack=6077 Win=21888 Len=0 TSval=34070682 TSecr=140356081
446465 144.904556 68.157.168.253 -> 41.177.26.176 TCP 70 62553 > http [ACK] Seq=320 Ack=7525 Win=24832 Len=0 TSval=34070689 TSecr=140356082
446466 144.904561 68.157.168.253 -> 41.177.26.176 TCP 70 62553 > http [ACK] Seq=320 Ack=7688 Win=27712 Len=0 TSval=34070689 TSecr=140356082
446467 144.905269 68.157.168.253 -> 41.177.26.176 TCP 70 62553 > http [ACK] Seq=320 Ack=9136 Win=30592 Len=0 TSval=34070689 TSecr=140356082
446468 144.905273 68.157.168.253 -> 41.177.26.176 TCP 70 62553 > http [ACK] Seq=320 Ack=10584 Win=33472 Len=0 TSval=34070689 TSecr=140356082
446470 144.905282 68.157.168.253 -> 41.177.26.176 TCP 70 62553 > http [ACK] Seq=320 Ack=11134 Win=36416 Len=0 TSval=34070689 TSecr=140356082
446485 144.920190 68.157.168.253 -> 41.177.26.176 TCP 70 62553 > http [ACK] Seq=320 Ack=11139 Win=36416 Len=0 TSval=34070704 TSecr=140356084
450839 146.700133 68.157.168.253 -> 41.177.26.176 TCP 70 62553 > http [ACK] Seq=697 Ack=12631 Win=39296 Len=0 TSval=34072484 TSecr=140356262
450865 146.712197 68.157.168.253 -> 41.177.26.176 TCP 70 62553 > http [ACK] Seq=697 Ack=14143 Win=53760 Len=0 TSval=34072496 TSecr=140356263
450866 146.712413 68.157.168.253 -> 41.177.26.176 TCP 70 62553 > http [ACK] Seq=697 Ack=15934 Win=59584 Len=0 TSval=34072496 TSecr=140356263
450907 146.743034 68.157.168.253 -> 41.177.26.176 TCP 70 62553 > http [ACK] Seq=697 Ack=18260 Win=64128 Len=0 TSval=34072527 TSecr=140356263
450945 146.755193 68.157.168.253 -> 41.177.26.176 TCP 70 62553 > http [ACK] Seq=697 Ack=21156 Win=64128 Len=0 TSval=34072539 TSecr=140356266
450946 146.755320 68.157.168.253 -> 41.177.26.176 TCP 70 62553 > http [ACK] Seq=697 Ack=23194 Win=62656 Len=0 TSval=34072539 TSecr=140356267
461870 151.377794 68.157.168.253 -> 41.177.26.176 TCP 70 62553 > http [ACK] Seq=1022 Ack=25388 Win=64128 Len=0 TSval=34077162 TSecr=140356728
461881 151.379818 68.157.168.253 -> 41.177.26.176 TCP 70 62553 > http [ACK] Seq=1022 Ack=27011 Win=63808 Len=0 TSval=34077164 TSecr=140356729
461958 151.420747 68.157.168.253 -> 41.177.26.176 TCP 70 62553 > http [ACK] Seq=1022 Ack=30964 Win=61248 Len=0 TSval=34077205 TSecr=140356734
461962 151.422292 68.157.168.253 -> 41.177.26.176 TCP 70 62553 > http [ACK] Seq=1022 Ack=32437 Win=63808 Len=0 TSval=34077206 TSecr=140356734
462057 151.461974 68.157.168.253 -> 41.177.26.176 TCP 70 62553 > http [ACK] Seq=1022 Ack=33885 Win=64128 Len=0 TSval=34077246 TSecr=140356734
462058 151.463227 68.157.168.253 -> 41.177.26.176 TCP 70 62553 > http [ACK] Seq=1022 Ack=35333 Win=64128 Len=0 TSval=34077247 TSecr=140356738
462059 151.463374 68.157.168.253 -> 41.177.26.176 TCP 70 62553 > http [ACK] Seq=1022 Ack=36431 Win=64128 Len=0 TSval=34077247 TSecr=140356738
479241 157.843232 68.157.168.253 -> 41.177.26.176 TCP 70 62553 > http [FIN, ACK] Seq=1022 Ack=36431 Win=64128 Len=0 TSval=34083627 TSecr=140356738
479335 157.886246 68.157.168.253 -> 41.177.26.176 TCP 70 62553 > http [ACK] Seq=1023 Ack=36432 Win=64128 Len=0 TSval=34083670 TSecr=140357380
674739 210.699905 68.157.168.253 -> 41.177.26.176 TCP 78 38335 > http [SYN] Seq=0 Win=5840 Len=0 MSS=1460 SACK_PERM=1 TSval=34136482 TSecr=0 WS=64
674793 210.742662 68.157.168.253 -> 41.177.26.176 TCP 70 38335 > http [ACK] Seq=1 Ack=1 Win=5888 Len=0 TSval=34136525 TSecr=140362666
679227 212.474346 68.157.168.253 -> 41.177.26.176 TCP 70 38335 > http [ACK] Seq=352 Ack=1449 Win=8768 Len=0 TSval=34138256 TSecr=140362839
679228 212.474351 68.157.168.253 -> 41.177.26.176 TCP 70 38335 > http [ACK] Seq=352 Ack=1534 Win=8768 Len=0 TSval=34138256 TSecr=140362839
679268 212.487059 68.157.168.253 -> 41.177.26.176 TCP 70 38335 > http [ACK] Seq=352 Ack=2199 Win=11648 Len=0 TSval=34138269 TSecr=140362840
679269 212.487064 68.157.168.253 -> 41.177.26.176 TCP 70 38335 > http [ACK] Seq=352 Ack=2438 Win=14528 Len=0 TSval=34138269 TSecr=140362840
679270 212.487069 68.157.168.253 -> 41.177.26.176 TCP 70 38335 > http [ACK] Seq=352 Ack=2677 Win=17472 Len=0 TSval=34138269 TSecr=140362840
679271 212.487197 68.157.168.253 -> 41.177.26.176 TCP 70 38335 > http [ACK] Seq=352 Ack=2916 Win=20352 Len=0 TSval=34138269 TSecr=140362840
679272 212.487202 68.157.168.253 -> 41.177.26.176 TCP 70 38335 > http [ACK] Seq=352 Ack=3158 Win=23232 Len=0 TSval=34138269 TSecr=140362840
679273 212.487206 68.157.168.253 -> 41.177.26.176 TCP 70 38335 > http [ACK] Seq=352 Ack=3529 Win=26112 Len=0 TSval=34138269 TSecr=140362840
679399 212.517301 68.157.168.253 -> 41.177.26.176 TCP 70 38335 > http [ACK] Seq=352 Ack=4977 Win=29056 Len=0 TSval=34138299 TSecr=140362843
679400 212.517341 68.157.168.253 -> 41.177.26.176 TCP 70 38335 > http [ACK] Seq=352 Ack=6095 Win=31936 Len=0 TSval=34138299 TSecr=140362843
679404 212.517540 68.157.168.253 -> 41.177.26.176 TCP 70 38335 > http [ACK] Seq=352 Ack=7543 Win=34816 Len=0 TSval=34138299 TSecr=140362843
679441 212.529800 68.157.168.253 -> 41.177.26.176 TCP 70 38335 > http [ACK] Seq=352 Ack=8991 Win=37696 Len=0 TSval=34138312 TSecr=140362845
679442 212.529877 68.157.168.253 -> 41.177.26.176 TCP 70 38335 > http [ACK] Seq=352 Ack=10268 Win=40640 Len=0 TSval=34138312 TSecr=140362845
692335 218.637622 68.157.168.253 -> 41.177.26.176 TCP 70 38335 > http [FIN, ACK] Seq=352 Ack=10268 Win=40640 Len=0 TSval=34144419 TSecr=140362845
692412 218.680107 68.157.168.253 -> 41.177.26.176 TCP 70 38335 > http [ACK] Seq=353 Ack=10269 Win=40640 Len=0 TSval=34144462 TSecr=140363460
