279864  94.367644 68.157.168.254 -> 244.3.210.197 TCP 78 41793 > https [SYN] Seq=0 Win=5840 Len=0 MSS=1460 SACK_PERM=1 TSval=1963615769 TSecr=0 WS=64
280033  94.410210 68.157.168.254 -> 244.3.210.197 TCP 70 41793 > https [ACK] Seq=1 Ack=1 Win=5888 Len=0 TSval=1963615811 TSecr=0
280299  94.453560 68.157.168.254 -> 244.3.210.197 TCP 70 41793 > https [ACK] Seq=40 Ack=924 Win=7744 Len=0 TSval=1963615855 TSecr=150404956
282617  94.880802 68.157.168.254 -> 244.3.210.197 TCP 70 41793 > https [ACK] Seq=546 Ack=3863 Win=13504 Len=0 TSval=1963616282 TSecr=150404960
282618  94.880807 68.157.168.254 -> 244.3.210.197 TCP 70 41793 > https [ACK] Seq=546 Ack=6759 Win=19328 Len=0 TSval=1963616282 TSecr=150404960
282767  94.923940 68.157.168.254 -> 244.3.210.197 TCP 70 41793 > https [ACK] Seq=546 Ack=9655 Win=25088 Len=0 TSval=1963616325 TSecr=150404961
282768  94.923945 68.157.168.254 -> 244.3.210.197 TCP 70 41793 > https [ACK] Seq=546 Ack=12551 Win=30912 Len=0 TSval=1963616325 TSecr=150404961
282770  94.924050 68.157.168.254 -> 244.3.210.197 TCP 70 41793 > https [ACK] Seq=546 Ack=15447 Win=36672 Len=0 TSval=1963616325 TSecr=150404961
282984  94.967089 68.157.168.254 -> 244.3.210.197 TCP 70 41793 > https [ACK] Seq=546 Ack=18343 Win=42496 Len=0 TSval=1963616368 TSecr=150404961
282985  94.967123 68.157.168.254 -> 244.3.210.197 TCP 70 41793 > https [ACK] Seq=546 Ack=21239 Win=48256 Len=0 TSval=1963616368 TSecr=150404961
282986  94.967128 68.157.168.254 -> 244.3.210.197 TCP 70 41793 > https [ACK] Seq=546 Ack=23733 Win=54080 Len=0 TSval=1963616368 TSecr=150404961
298008 100.476049 68.157.168.254 -> 244.3.210.197 TCP 70 41793 > https [FIN, ACK] Seq=546 Ack=23733 Win=54080 Len=0 TSval=1963621877 TSecr=150404961
298253 100.518755 68.157.168.254 -> 244.3.210.197 TCP 70 41793 > https [ACK] Seq=547 Ack=23734 Win=54080 Len=0 TSval=1963621919 TSecr=150405017
485226 159.884533 68.157.168.254 -> 244.3.210.197 TCP 78 41366 > https [SYN] Seq=0 Win=5840 Len=0 MSS=1460 SACK_PERM=1 TSval=1963681282 TSecr=0 WS=64
485429 159.927444 68.157.168.254 -> 244.3.210.197 TCP 70 41366 > https [ACK] Seq=1 Ack=1 Win=5888 Len=0 TSval=1963681325 TSecr=0
485672 159.971233 68.157.168.254 -> 244.3.210.197 TCP 70 41366 > https [ACK] Seq=40 Ack=924 Win=7744 Len=0 TSval=1963681369 TSecr=150405611
488956 160.650372 68.157.168.254 -> 244.3.210.197 TCP 70 41366 > https [ACK] Seq=550 Ack=3863 Win=13504 Len=0 TSval=1963682048 TSecr=150405619
488957 160.650377 68.157.168.254 -> 244.3.210.197 TCP 70 41366 > https [ACK] Seq=550 Ack=6759 Win=19328 Len=0 TSval=1963682048 TSecr=150405619
489052 160.694137 68.157.168.254 -> 244.3.210.197 TCP 70 41366 > https [ACK] Seq=550 Ack=9655 Win=25088 Len=0 TSval=1963682092 TSecr=150405619
489053 160.694142 68.157.168.254 -> 244.3.210.197 TCP 70 41366 > https [ACK] Seq=550 Ack=12551 Win=30912 Len=0 TSval=1963682092 TSecr=150405619
489054 160.694196 68.157.168.254 -> 244.3.210.197 TCP 70 41366 > https [ACK] Seq=550 Ack=15447 Win=36672 Len=0 TSval=1963682092 TSecr=150405619
489128 160.737203 68.157.168.254 -> 244.3.210.197 TCP 70 41366 > https [ACK] Seq=550 Ack=18122 Win=42496 Len=0 TSval=1963682135 TSecr=150405619
517291 167.226827 68.157.168.254 -> 244.3.210.197 TCP 70 41366 > https [FIN, ACK] Seq=550 Ack=18122 Win=42496 Len=0 TSval=1963688624 TSecr=150405619
517391 167.270365 68.157.168.254 -> 244.3.210.197 TCP 70 41366 > https [ACK] Seq=551 Ack=18123 Win=42496 Len=0 TSval=1963688667 TSecr=150405684
607297 192.660853 68.157.168.254 -> 244.3.210.197 TCP 78 60405 > https [SYN] Seq=0 Win=5840 Len=0 MSS=1460 SACK_PERM=1 TSval=1963714056 TSecr=0 WS=64
607400 192.703089 68.157.168.254 -> 244.3.210.197 TCP 70 60405 > https [ACK] Seq=1 Ack=1 Win=5888 Len=0 TSval=1963714099 TSecr=0
607441 192.745853 68.157.168.254 -> 244.3.210.197 TCP 70 60405 > https [ACK] Seq=40 Ack=924 Win=7744 Len=0 TSval=1963714141 TSecr=150405939
608639 193.306285 68.157.168.254 -> 244.3.210.197 TCP 70 60405 > https [ACK] Seq=555 Ack=3863 Win=13504 Len=0 TSval=1963714702 TSecr=150405945
608648 193.306473 68.157.168.254 -> 244.3.210.197 TCP 70 60405 > https [ACK] Seq=555 Ack=6759 Win=19328 Len=0 TSval=1963714702 TSecr=150405945
608763 193.348934 68.157.168.254 -> 244.3.210.197 TCP 70 60405 > https [ACK] Seq=555 Ack=9655 Win=25088 Len=0 TSval=1963714744 TSecr=150405945
608772 193.349172 68.157.168.254 -> 244.3.210.197 TCP 70 60405 > https [ACK] Seq=555 Ack=12551 Win=30912 Len=0 TSval=1963714745 TSecr=150405945
608776 193.349352 68.157.168.254 -> 244.3.210.197 TCP 70 60405 > https [ACK] Seq=555 Ack=15447 Win=36672 Len=0 TSval=1963714745 TSecr=150405945
608942 193.391610 68.157.168.254 -> 244.3.210.197 TCP 70 60405 > https [ACK] Seq=555 Ack=18343 Win=42496 Len=0 TSval=1963714787 TSecr=150405946
608943 193.391634 68.157.168.254 -> 244.3.210.197 TCP 70 60405 > https [ACK] Seq=555 Ack=21239 Win=48256 Len=0 TSval=1963714787 TSecr=150405946
608950 193.391774 68.157.168.254 -> 244.3.210.197 TCP 70 60405 > https [ACK] Seq=555 Ack=23831 Win=54080 Len=0 TSval=1963714787 TSecr=150405946
627493 199.181509 68.157.168.254 -> 244.3.210.197 TCP 70 60405 > https [FIN, ACK] Seq=555 Ack=23831 Win=54080 Len=0 TSval=1963720576 TSecr=150405946
627610 199.223947 68.157.168.254 -> 244.3.210.197 TCP 70 60405 > https [ACK] Seq=556 Ack=23832 Win=54080 Len=0 TSval=1963720619 TSecr=150406004
707905 225.426776 68.157.168.254 -> 244.3.210.197 TCP 78 33947 > https [SYN] Seq=0 Win=5840 Len=0 MSS=1460 SACK_PERM=1 TSval=1963746821 TSecr=0 WS=64
707999 225.469066 68.157.168.254 -> 244.3.210.197 TCP 70 33947 > https [ACK] Seq=1 Ack=1 Win=5888 Len=0 TSval=1963746863 TSecr=0
708111 225.511979 68.157.168.254 -> 244.3.210.197 TCP 70 33947 > https [ACK] Seq=40 Ack=924 Win=7744 Len=0 TSval=1963746906 TSecr=150406267
709387 225.997631 68.157.168.254 -> 244.3.210.197 TCP 70 33947 > https [ACK] Seq=543 Ack=3863 Win=13504 Len=0 TSval=1963747392 TSecr=150406272
709391 225.997785 68.157.168.254 -> 244.3.210.197 TCP 70 33947 > https [ACK] Seq=543 Ack=6759 Win=19328 Len=0 TSval=1963747392 TSecr=150406272
709509 226.039887 68.157.168.254 -> 244.3.210.197 TCP 70 33947 > https [ACK] Seq=543 Ack=9655 Win=25088 Len=0 TSval=1963747434 TSecr=150406272
709518 226.040221 68.157.168.254 -> 244.3.210.197 TCP 70 33947 > https [ACK] Seq=543 Ack=12551 Win=30912 Len=0 TSval=1963747434 TSecr=150406272
709519 226.040225 68.157.168.254 -> 244.3.210.197 TCP 70 33947 > https [ACK] Seq=543 Ack=15447 Win=36672 Len=0 TSval=1963747434 TSecr=150406272
709638 226.082541 68.157.168.254 -> 244.3.210.197 TCP 70 33947 > https [ACK] Seq=543 Ack=18343 Win=42496 Len=0 TSval=1963747477 TSecr=150406273
709640 226.082624 68.157.168.254 -> 244.3.210.197 TCP 70 33947 > https [ACK] Seq=543 Ack=20756 Win=48256 Len=0 TSval=1963747477 TSecr=150406273
725828 232.454282 68.157.168.254 -> 244.3.210.197 TCP 70 33947 > https [FIN, ACK] Seq=543 Ack=20756 Win=48256 Len=0 TSval=1963753848 TSecr=150406273
725977 232.496922 68.157.168.254 -> 244.3.210.197 TCP 70 33947 > https [ACK] Seq=544 Ack=20757 Win=48256 Len=0 TSval=1963753891 TSecr=150406336
793209 258.286656 68.157.168.254 -> 244.3.210.197 TCP 78 62111 > https [SYN] Seq=0 Win=5840 Len=0 MSS=1460 SACK_PERM=1 TSval=1963779679 TSecr=0 WS=64
793270 258.329261 68.157.168.254 -> 244.3.210.197 TCP 70 62111 > https [ACK] Seq=1 Ack=1 Win=5888 Len=0 TSval=1963779722 TSecr=0
793332 258.371918 68.157.168.254 -> 244.3.210.197 TCP 70 62111 > https [ACK] Seq=40 Ack=924 Win=7744 Len=0 TSval=1963779764 TSecr=150406595
794419 258.788112 68.157.168.254 -> 244.3.210.197 TCP 70 62111 > https [ACK] Seq=556 Ack=3863 Win=13504 Len=0 TSval=1963780181 TSecr=150406600
794428 258.788289 68.157.168.254 -> 244.3.210.197 TCP 70 62111 > https [ACK] Seq=556 Ack=6759 Win=19328 Len=0 TSval=1963780181 TSecr=150406600
794563 258.830515 68.157.168.254 -> 244.3.210.197 TCP 70 62111 > https [ACK] Seq=556 Ack=9655 Win=25088 Len=0 TSval=1963780223 TSecr=150406600
794572 258.830751 68.157.168.254 -> 244.3.210.197 TCP 70 62111 > https [ACK] Seq=556 Ack=12551 Win=30912 Len=0 TSval=1963780223 TSecr=150406600
794575 258.830926 68.157.168.254 -> 244.3.210.197 TCP 70 62111 > https [ACK] Seq=556 Ack=15447 Win=36672 Len=0 TSval=1963780223 TSecr=150406600
794649 258.872885 68.157.168.254 -> 244.3.210.197 TCP 70 62111 > https [ACK] Seq=556 Ack=18343 Win=42496 Len=0 TSval=1963780265 TSecr=150406601
794656 258.873488 68.157.168.254 -> 244.3.210.197 TCP 70 62111 > https [ACK] Seq=556 Ack=21239 Win=48256 Len=0 TSval=1963780266 TSecr=150406601
794657 258.873493 68.157.168.254 -> 244.3.210.197 TCP 70 62111 > https [ACK] Seq=556 Ack=24135 Win=54080 Len=0 TSval=1963780266 TSecr=150406601
794668 258.873822 68.157.168.254 -> 244.3.210.197 TCP 70 62111 > https [ACK] Seq=556 Ack=27031 Win=58368 Len=0 TSval=1963780266 TSecr=150406601
794754 258.913318 68.157.168.254 -> 244.3.210.197 TCP 70 62111 > https [ACK] Seq=556 Ack=28479 Win=59840 Len=0 TSval=1963780306 TSecr=150406601
794767 258.915249 68.157.168.254 -> 244.3.210.197 TCP 70 62111 > https [ACK] Seq=556 Ack=29330 Win=62720 Len=0 TSval=1963780308 TSecr=150406601
813505 265.348511 68.157.168.254 -> 244.3.210.197 TCP 70 62111 > https [FIN, ACK] Seq=556 Ack=29330 Win=62720 Len=0 TSval=1963786741 TSecr=150406601
813662 265.390846 68.157.168.254 -> 244.3.210.197 TCP 70 62111 > https [ACK] Seq=557 Ack=29331 Win=62720 Len=0 TSval=1963786783 TSecr=150406665
877661 291.091656 68.157.168.254 -> 244.3.210.197 TCP 78 46549 > https [SYN] Seq=0 Win=5840 Len=0 MSS=1460 SACK_PERM=1 TSval=1963812482 TSecr=0 WS=64
877725 291.135104 68.157.168.254 -> 244.3.210.197 TCP 70 46549 > https [ACK] Seq=1 Ack=1 Win=5888 Len=0 TSval=1963812525 TSecr=0
877795 291.178871 68.157.168.254 -> 244.3.210.197 TCP 70 46549 > https [ACK] Seq=40 Ack=924 Win=7744 Len=0 TSval=1963812569 TSecr=150406924
878578 291.843921 68.157.168.254 -> 244.3.210.197 TCP 70 46549 > https [ACK] Seq=555 Ack=3863 Win=13504 Len=0 TSval=1963813234 TSecr=150406930
878582 291.844398 68.157.168.254 -> 244.3.210.197 TCP 70 46549 > https [ACK] Seq=555 Ack=6759 Win=19328 Len=0 TSval=1963813235 TSecr=150406930
878658 291.887030 68.157.168.254 -> 244.3.210.197 TCP 70 46549 > https [ACK] Seq=555 Ack=9655 Win=25088 Len=0 TSval=1963813277 TSecr=150406930
878667 291.887546 68.157.168.254 -> 244.3.210.197 TCP 70 46549 > https [ACK] Seq=555 Ack=12551 Win=30912 Len=0 TSval=1963813278 TSecr=150406930
878675 291.887709 68.157.168.254 -> 244.3.210.197 TCP 70 46549 > https [ACK] Seq=555 Ack=15447 Win=36672 Len=0 TSval=1963813278 TSecr=150406930
878704 291.930372 68.157.168.254 -> 244.3.210.197 TCP 70 46549 > https [ACK] Seq=555 Ack=18343 Win=42496 Len=0 TSval=1963813321 TSecr=150406931
878709 291.930567 68.157.168.254 -> 244.3.210.197 TCP 70 46549 > https [ACK] Seq=555 Ack=21239 Win=48256 Len=0 TSval=1963813321 TSecr=150406931
878755 291.970976 68.157.168.254 -> 244.3.210.197 TCP 70 46549 > https [ACK] Seq=555 Ack=21251 Win=48256 Len=0 TSval=1963813361 TSecr=150406931
904408 298.200021 68.157.168.254 -> 244.3.210.197 TCP 70 46549 > https [FIN, ACK] Seq=555 Ack=21251 Win=48256 Len=0 TSval=1963819590 TSecr=150406931
904518 298.242806 68.157.168.254 -> 244.3.210.197 TCP 70 46549 > https [ACK] Seq=556 Ack=21252 Win=48256 Len=0 TSval=1963819633 TSecr=150406994
971035 323.925344 68.157.168.254 -> 244.3.210.197 TCP 78 58211 > https [SYN] Seq=0 Win=5840 Len=0 MSS=1460 SACK_PERM=1 TSval=1963845314 TSecr=0 WS=64
971297 323.968280 68.157.168.254 -> 244.3.210.197 TCP 70 58211 > https [ACK] Seq=1 Ack=1 Win=5888 Len=0 TSval=1963845357 TSecr=0
971755 324.011647 68.157.168.254 -> 244.3.210.197 TCP 70 58211 > https [ACK] Seq=40 Ack=924 Win=7744 Len=0 TSval=1963845400 TSecr=150407252
975762 324.893505 68.157.168.254 -> 244.3.210.197 TCP 70 58211 > https [ACK] Seq=573 Ack=3863 Win=13504 Len=0 TSval=1963846282 TSecr=150407260
975763 324.893510 68.157.168.254 -> 244.3.210.197 TCP 70 58211 > https [ACK] Seq=573 Ack=6759 Win=19328 Len=0 TSval=1963846282 TSecr=150407260
975867 324.936260 68.157.168.254 -> 244.3.210.197 TCP 70 58211 > https [ACK] Seq=573 Ack=9655 Win=25088 Len=0 TSval=1963846325 TSecr=150407262
975876 324.936606 68.157.168.254 -> 244.3.210.197 TCP 70 58211 > https [ACK] Seq=573 Ack=12551 Win=30912 Len=0 TSval=1963846325 TSecr=150407262
975884 324.936775 68.157.168.254 -> 244.3.210.197 TCP 70 58211 > https [ACK] Seq=573 Ack=15447 Win=36672 Len=0 TSval=1963846325 TSecr=150407262
975975 324.979316 68.157.168.254 -> 244.3.210.197 TCP 70 58211 > https [ACK] Seq=573 Ack=18343 Win=42496 Len=0 TSval=1963846368 TSecr=150407262
975981 324.979512 68.157.168.254 -> 244.3.210.197 TCP 70 58211 > https [ACK] Seq=573 Ack=21239 Win=48256 Len=0 TSval=1963846368 TSecr=150407262
975985 324.979713 68.157.168.254 -> 244.3.210.197 TCP 70 58211 > https [ACK] Seq=573 Ack=24135 Win=54080 Len=0 TSval=1963846368 TSecr=150407262
975989 324.979812 68.157.168.254 -> 244.3.210.197 TCP 70 58211 > https [ACK] Seq=573 Ack=26315 Win=59840 Len=0 TSval=1963846368 TSecr=150407262
992661 331.244877 68.157.168.254 -> 244.3.210.197 TCP 70 58211 > https [FIN, ACK] Seq=573 Ack=26315 Win=59840 Len=0 TSval=1963852633 TSecr=150407262
992750 331.287702 68.157.168.254 -> 244.3.210.197 TCP 70 58211 > https [ACK] Seq=574 Ack=26316 Win=59840 Len=0 TSval=1963852676 TSecr=150407325
