754657 242.482934 68.157.145.13 -> 244.3.210.255 TCP 78 44608 > https [SYN] Seq=0 Win=5840 Len=0 MSS=1460 SACK_PERM=1 TSval=3068366869 TSecr=0 WS=64
754864 242.581305 68.157.145.13 -> 244.3.210.255 TCP 70 44608 > https [ACK] Seq=1 Ack=1 Win=5888 Len=0 TSval=3068366967 TSecr=0
755100 242.680233 68.157.145.13 -> 244.3.210.255 TCP 70 44608 > https [ACK] Seq=40 Ack=924 Win=7744 Len=0 TSval=3068367066 TSecr=150406840
756161 243.435194 68.157.145.13 -> 244.3.210.255 TCP 70 44608 > https [ACK] Seq=541 Ack=3863 Win=13504 Len=0 TSval=3068367821 TSecr=150406847
756162 243.435199 68.157.145.13 -> 244.3.210.255 TCP 70 44608 > https [ACK] Seq=541 Ack=6759 Win=19328 Len=0 TSval=3068367821 TSecr=150406847
756343 243.533918 68.157.145.13 -> 244.3.210.255 TCP 70 44608 > https [ACK] Seq=541 Ack=9655 Win=25088 Len=0 TSval=3068367919 TSecr=150406848
756344 243.533944 68.157.145.13 -> 244.3.210.255 TCP 70 44608 > https [ACK] Seq=541 Ack=12227 Win=30912 Len=0 TSval=3068367919 TSecr=150406848
773623 249.500516 68.157.145.13 -> 244.3.210.255 TCP 70 44608 > https [FIN, ACK] Seq=541 Ack=12227 Win=30912 Len=0 TSval=3068373886 TSecr=150406848
775043 249.599198 68.157.145.13 -> 244.3.210.255 TCP 70 44608 > https [ACK] Seq=542 Ack=12228 Win=30912 Len=0 TSval=3068373985 TSecr=150406909
