225550  77.176101 68.157.15.43 -> 41.177.26.46 TCP 78 41244 > http [SYN] Seq=0 Win=5840 Len=0 MSS=1460 SACK_PERM=1 TSval=2677525096 TSecr=0 WS=64
225769  77.274569 68.157.15.43 -> 41.177.26.46 TCP 70 41244 > http [ACK] Seq=1 Ack=1 Win=5888 Len=0 TSval=2677525194 TSecr=1509553176
227084  77.632936 68.157.15.43 -> 41.177.26.46 TCP 70 41244 > http [ACK] Seq=329 Ack=1449 Win=8768 Len=0 TSval=2677525553 TSecr=1509553211
227085  77.632941 68.157.15.43 -> 41.177.26.46 TCP 70 41244 > http [ACK] Seq=329 Ack=2897 Win=11648 Len=0 TSval=2677525553 TSecr=1509553211
227086  77.632945 68.157.15.43 -> 41.177.26.46 TCP 70 41244 > http [ACK] Seq=329 Ack=4345 Win=14528 Len=0 TSval=2677525553 TSecr=1509553211
227196  77.732283 68.157.15.43 -> 41.177.26.46 TCP 70 41244 > http [ACK] Seq=329 Ack=5793 Win=17472 Len=0 TSval=2677525652 TSecr=1509553221
227197  77.732288 68.157.15.43 -> 41.177.26.46 TCP 70 41244 > http [ACK] Seq=329 Ack=7234 Win=20352 Len=0 TSval=2677525652 TSecr=1509553221
228158  78.296777 68.157.15.43 -> 41.177.26.46 TCP 70 41244 > http [ACK] Seq=611 Ack=8682 Win=23232 Len=0 TSval=2677526216 TSecr=1509553278
228159  78.296843 68.157.15.43 -> 41.177.26.46 TCP 70 41244 > http [ACK] Seq=611 Ack=10130 Win=26112 Len=0 TSval=2677526216 TSecr=1509553278
228160  78.296848 68.157.15.43 -> 41.177.26.46 TCP 70 41244 > http [ACK] Seq=611 Ack=11578 Win=29056 Len=0 TSval=2677526216 TSecr=1509553278
228163  78.296973 68.157.15.43 -> 41.177.26.46 TCP 70 41244 > http [ACK] Seq=611 Ack=13026 Win=31936 Len=0 TSval=2677526217 TSecr=1509553278
228164  78.296977 68.157.15.43 -> 41.177.26.46 TCP 70 41244 > http [ACK] Seq=611 Ack=14474 Win=34816 Len=0 TSval=2677526217 TSecr=1509553278
228165  78.296981 68.157.15.43 -> 41.177.26.46 TCP 70 41244 > http [ACK] Seq=611 Ack=15797 Win=37696 Len=0 TSval=2677526217 TSecr=1509553278
228181  78.300527 68.157.15.43 -> 41.177.26.46 TCP 70 41244 > http [ACK] Seq=611 Ack=17245 Win=40640 Len=0 TSval=2677526220 TSecr=1509553278
228182  78.300610 68.157.15.43 -> 41.177.26.46 TCP 70 41244 > http [ACK] Seq=611 Ack=18693 Win=43520 Len=0 TSval=2677526220 TSecr=1509553278
228354  78.395885 68.157.15.43 -> 41.177.26.46 TCP 70 41244 > http [ACK] Seq=611 Ack=20141 Win=46400 Len=0 TSval=2677526316 TSecr=1509553288
228355  78.396023 68.157.15.43 -> 41.177.26.46 TCP 70 41244 > http [ACK] Seq=611 Ack=21589 Win=49280 Len=0 TSval=2677526316 TSecr=1509553288
228356  78.396028 68.157.15.43 -> 41.177.26.46 TCP 70 41244 > http [ACK] Seq=611 Ack=23037 Win=52224 Len=0 TSval=2677526316 TSecr=1509553288
228358  78.396073 68.157.15.43 -> 41.177.26.46 TCP 70 41244 > http [ACK] Seq=611 Ack=23989 Win=55104 Len=0 TSval=2677526316 TSecr=1509553288
228360  78.396091 68.157.15.43 -> 41.177.26.46 TCP 70 41244 > http [ACK] Seq=611 Ack=25437 Win=57984 Len=0 TSval=2677526316 TSecr=1509553288
228368  78.396337 68.157.15.43 -> 41.177.26.46 TCP 70 41244 > http [ACK] Seq=611 Ack=26885 Win=60864 Len=0 TSval=2677526316 TSecr=1509553288
228369  78.396341 68.157.15.43 -> 41.177.26.46 TCP 70 41244 > http [ACK] Seq=611 Ack=28333 Win=62656 Len=0 TSval=2677526316 TSecr=1509553288
228371  78.396349 68.157.15.43 -> 41.177.26.46 TCP 70 41244 > http [ACK] Seq=611 Ack=29781 Win=61248 Len=0 TSval=2677526316 TSecr=1509553288
228372  78.396360 68.157.15.43 -> 41.177.26.46 TCP 70 41244 > http [ACK] Seq=611 Ack=31229 Win=59776 Len=0 TSval=2677526316 TSecr=1509553288
228373  78.396364 68.157.15.43 -> 41.177.26.46 TCP 70 41244 > http [ACK] Seq=611 Ack=32181 Win=58816 Len=0 TSval=2677526316 TSecr=1509553288
228374  78.396369 68.157.15.43 -> 41.177.26.46 TCP 70 41244 > http [ACK] Seq=611 Ack=33629 Win=57344 Len=0 TSval=2677526316 TSecr=1509553288
228375  78.396397 68.157.15.43 -> 41.177.26.46 TCP 70 41244 > http [ACK] Seq=611 Ack=35077 Win=55936 Len=0 TSval=2677526316 TSecr=1509553288
228397  78.399290 68.157.15.43 -> 41.177.26.46 TCP 70 41244 > http [ACK] Seq=611 Ack=36525 Win=64128 Len=0 TSval=2677526319 TSecr=1509553288
228401  78.400454 68.157.15.43 -> 41.177.26.46 TCP 70 41244 > http [ACK] Seq=611 Ack=39421 Win=64128 Len=0 TSval=2677526320 TSecr=1509553288
228402  78.400579 68.157.15.43 -> 41.177.26.46 TCP 70 41244 > http [ACK] Seq=611 Ack=40373 Win=64128 Len=0 TSval=2677526320 TSecr=1509553288
228493  78.440494 68.157.15.43 -> 41.177.26.46 TCP 70 41244 > http [ACK] Seq=611 Ack=41821 Win=64128 Len=0 TSval=2677526360 TSecr=1509553288
228562  78.494371 68.157.15.43 -> 41.177.26.46 TCP 70 41244 > http [ACK] Seq=611 Ack=44717 Win=62656 Len=0 TSval=2677526414 TSecr=1509553298
228568  78.494702 68.157.15.43 -> 41.177.26.46 TCP 70 41244 > http [ACK] Seq=611 Ack=47613 Win=64128 Len=0 TSval=2677526414 TSecr=1509553298
228571  78.494892 68.157.15.43 -> 41.177.26.46 TCP 70 41244 > http [ACK] Seq=611 Ack=59653 Win=54016 Len=0 TSval=2677526415 TSecr=1509553298
228573  78.494953 68.157.15.43 -> 41.177.26.46 TCP 70 41244 > http [ACK] Seq=611 Ack=62549 Win=62656 Len=0 TSval=2677526415 TSecr=1509553298
228578  78.495114 68.157.15.43 -> 41.177.26.46 TCP 70 41244 > http [ACK] Seq=611 Ack=69293 Win=55872 Len=0 TSval=2677526415 TSecr=1509553298
228579  78.495118 68.157.15.43 -> 41.177.26.46 TCP 70 41244 > http [ACK] Seq=611 Ack=72189 Win=58368 Len=0 TSval=2677526415 TSecr=1509553298
228580  78.495122 68.157.15.43 -> 41.177.26.46 TCP 70 41244 > http [ACK] Seq=611 Ack=73141 Win=64128 Len=0 TSval=2677526415 TSecr=1509553298
228612  78.498590 68.157.15.43 -> 41.177.26.46 TCP 70 41244 > http [ACK] Seq=611 Ack=76037 Win=64128 Len=0 TSval=2677526418 TSecr=1509553298
228623  78.499210 68.157.15.43 -> 41.177.26.46 TCP 70 41244 > http [ACK] Seq=611 Ack=78933 Win=64128 Len=0 TSval=2677526419 TSecr=1509553298
228627  78.499373 68.157.15.43 -> 41.177.26.46 TCP 70 41244 > http [ACK] Seq=611 Ack=81333 Win=64128 Len=0 TSval=2677526419 TSecr=1509553298
228629  78.499394 68.157.15.43 -> 41.177.26.46 TCP 70 41244 > http [ACK] Seq=611 Ack=84229 Win=62656 Len=0 TSval=2677526419 TSecr=1509553298
228696  78.539231 68.157.15.43 -> 41.177.26.46 TCP 70 41244 > http [ACK] Seq=611 Ack=87125 Win=64128 Len=0 TSval=2677526459 TSecr=1509553302
228776  78.593457 68.157.15.43 -> 41.177.26.46 TCP 70 41244 > http [ACK] Seq=611 Ack=89525 Win=64128 Len=0 TSval=2677526513 TSecr=1509553307
228778  78.593597 68.157.15.43 -> 41.177.26.46 TCP 70 41244 > http [ACK] Seq=611 Ack=90973 Win=67008 Len=0 TSval=2677526513 TSecr=1509553307
228779  78.593602 68.157.15.43 -> 41.177.26.46 TCP 70 41244 > http [ACK] Seq=611 Ack=92421 Win=69888 Len=0 TSval=2677526513 TSecr=1509553307
228781  78.593632 68.157.15.43 -> 41.177.26.46 TCP 70 41244 > http [ACK] Seq=611 Ack=93869 Win=72832 Len=0 TSval=2677526513 TSecr=1509553307
228782  78.593636 68.157.15.43 -> 41.177.26.46 TCP 70 41244 > http [ACK] Seq=611 Ack=95317 Win=75584 Len=0 TSval=2677526513 TSecr=1509553307
228785  78.593691 68.157.15.43 -> 41.177.26.46 TCP 70 41244 > http [ACK] Seq=611 Ack=97717 Win=78592 Len=0 TSval=2677526513 TSecr=1509553307
228786  78.593695 68.157.15.43 -> 41.177.26.46 TCP 70 41244 > http [ACK] Seq=611 Ack=100613 Win=78464 Len=0 TSval=2677526513 TSecr=1509553307
228804  78.594162 68.157.15.43 -> 41.177.26.46 TCP 70 41244 > http [ACK] Seq=611 Ack=102061 Win=79168 Len=0 TSval=2677526514 TSecr=1509553307
228805  78.594236 68.157.15.43 -> 41.177.26.46 TCP 70 41244 > http [ACK] Seq=611 Ack=113149 Win=68416 Len=0 TSval=2677526514 TSecr=1509553307
228807  78.594329 68.157.15.43 -> 41.177.26.46 TCP 70 41244 > http [ACK] Seq=611 Ack=115549 Win=78464 Len=0 TSval=2677526514 TSecr=1509553307
228809  78.594350 68.157.15.43 -> 41.177.26.46 TCP 70 41244 > http [ACK] Seq=611 Ack=128085 Win=66944 Len=0 TSval=2677526514 TSecr=1509553307
228826  78.597657 68.157.15.43 -> 41.177.26.46 TCP 70 41244 > http [ACK] Seq=611 Ack=130485 Win=79168 Len=0 TSval=2677526517 TSecr=1509553308
228837  78.597967 68.157.15.43 -> 41.177.26.46 TCP 70 41244 > http [ACK] Seq=611 Ack=133381 Win=79168 Len=0 TSval=2677526518 TSecr=1509553308
228838  78.598376 68.157.15.43 -> 41.177.26.46 TCP 70 41244 > http [ACK] Seq=611 Ack=136277 Win=78464 Len=0 TSval=2677526518 TSecr=1509553308
228839  78.598456 68.157.15.43 -> 41.177.26.46 TCP 70 41244 > http [ACK] Seq=611 Ack=143021 Win=74176 Len=0 TSval=2677526518 TSecr=1509553308
228840  78.598541 68.157.15.43 -> 41.177.26.46 TCP 70 41244 > http [ACK] Seq=611 Ack=145917 Win=78464 Len=0 TSval=2677526518 TSecr=1509553308
228887  78.637650 68.157.15.43 -> 41.177.26.46 TCP 70 41244 > http [ACK] Seq=611 Ack=146869 Win=79168 Len=0 TSval=2677526557 TSecr=1509553312
228891  78.638134 68.157.15.43 -> 41.177.26.46 TCP 70 41244 > http [ACK] Seq=611 Ack=149765 Win=79168 Len=0 TSval=2677526558 TSecr=1509553312
228970  78.692407 68.157.15.43 -> 41.177.26.46 TCP 70 41244 > http [ACK] Seq=611 Ack=152661 Win=78464 Len=0 TSval=2677526612 TSecr=1509553317
228971  78.692497 68.157.15.43 -> 41.177.26.46 TCP 70 41244 > http [ACK] Seq=611 Ack=155061 Win=78464 Len=0 TSval=2677526612 TSecr=1509553317
228972  78.692501 68.157.15.43 -> 41.177.26.46 TCP 70 41244 > http [ACK] Seq=611 Ack=164701 Win=79168 Len=0 TSval=2677526612 TSecr=1509553317
228973  78.692621 68.157.15.43 -> 41.177.26.46 TCP 70 41244 > http [ACK] Seq=611 Ack=166149 Win=82112 Len=0 TSval=2677526612 TSecr=1509553317
228974  78.692626 68.157.15.43 -> 41.177.26.46 TCP 70 41244 > http [ACK] Seq=611 Ack=167597 Win=84992 Len=0 TSval=2677526612 TSecr=1509553317
228975  78.692630 68.157.15.43 -> 41.177.26.46 TCP 70 41244 > http [ACK] Seq=611 Ack=169045 Win=87872 Len=0 TSval=2677526612 TSecr=1509553317
228976  78.692634 68.157.15.43 -> 41.177.26.46 TCP 70 41244 > http [ACK] Seq=611 Ack=170493 Win=90752 Len=0 TSval=2677526612 TSecr=1509553317
228977  78.692690 68.157.15.43 -> 41.177.26.46 TCP 70 41244 > http [ACK] Seq=611 Ack=171445 Win=93696 Len=0 TSval=2677526612 TSecr=1509553317
228978  78.692695 68.157.15.43 -> 41.177.26.46 TCP 70 41244 > http [ACK] Seq=611 Ack=172893 Win=96576 Len=0 TSval=2677526612 TSecr=1509553317
228979  78.692699 68.157.15.43 -> 41.177.26.46 TCP 70 41244 > http [ACK] Seq=611 Ack=174341 Win=99456 Len=0 TSval=2677526612 TSecr=1509553317
228981  78.693251 68.157.15.43 -> 41.177.26.46 TCP 70 41244 > http [ACK] Seq=611 Ack=175789 Win=102336 Len=0 TSval=2677526613 TSecr=1509553317
228982  78.693256 68.157.15.43 -> 41.177.26.46 TCP 70 41244 > http [ACK] Seq=611 Ack=177237 Win=105280 Len=0 TSval=2677526613 TSecr=1509553317
228983  78.693260 68.157.15.43 -> 41.177.26.46 TCP 70 41244 > http [ACK] Seq=611 Ack=178685 Win=108160 Len=0 TSval=2677526613 TSecr=1509553317
228984  78.693355 68.157.15.43 -> 41.177.26.46 TCP 70 41244 > http [ACK] Seq=611 Ack=179637 Win=111040 Len=0 TSval=2677526613 TSecr=1509553317
228985  78.693360 68.157.15.43 -> 41.177.26.46 TCP 70 41244 > http [ACK] Seq=611 Ack=181085 Win=113920 Len=0 TSval=2677526613 TSecr=1509553317
228998  78.694121 68.157.15.43 -> 41.177.26.46 TCP 70 41244 > http [ACK] Seq=611 Ack=182533 Win=116864 Len=0 TSval=2677526614 TSecr=1509553317
228999  78.694125 68.157.15.43 -> 41.177.26.46 TCP 70 41244 > http [ACK] Seq=611 Ack=183981 Win=119744 Len=0 TSval=2677526614 TSecr=1509553317
229000  78.694165 68.157.15.43 -> 41.177.26.46 TCP 70 41244 > http [ACK] Seq=611 Ack=185429 Win=122624 Len=0 TSval=2677526614 TSecr=1509553317
229001  78.694170 68.157.15.43 -> 41.177.26.46 TCP 70 41244 > http [ACK] Seq=611 Ack=186877 Win=125504 Len=0 TSval=2677526614 TSecr=1509553317
229002  78.694174 68.157.15.43 -> 41.177.26.46 TCP 70 41244 > http [ACK] Seq=611 Ack=187829 Win=128384 Len=0 TSval=2677526614 TSecr=1509553317
229003  78.694178 68.157.15.43 -> 41.177.26.46 TCP 70 41244 > http [ACK] Seq=611 Ack=192173 Win=126912 Len=0 TSval=2677526614 TSecr=1509553317
229006  78.694460 68.157.15.43 -> 41.177.26.46 TCP 70 41244 > http [ACK] Seq=611 Ack=193621 Win=131072 Len=0 TSval=2677526614 TSecr=1509553317
229011  78.696392 68.157.15.43 -> 41.177.26.46 TCP 70 41244 > http [ACK] Seq=611 Ack=196021 Win=131072 Len=0 TSval=2677526616 TSecr=1509553318
229012  78.696472 68.157.15.43 -> 41.177.26.46 TCP 70 41244 > http [ACK] Seq=611 Ack=198917 Win=129792 Len=0 TSval=2677526616 TSecr=1509553318
229013  78.696796 68.157.15.43 -> 41.177.26.46 TCP 70 41244 > http [ACK] Seq=611 Ack=201813 Win=131072 Len=0 TSval=2677526616 TSecr=1509553318
229014  78.696801 68.157.15.43 -> 41.177.26.46 TCP 70 41244 > http [ACK] Seq=611 Ack=203213 Win=131072 Len=0 TSval=2677526616 TSecr=1509553318
241367  84.056822 68.157.15.43 -> 41.177.26.46 TCP 70 41244 > http [FIN, ACK] Seq=611 Ack=203213 Win=131072 Len=0 TSval=2677531976 TSecr=1509553318
241575  84.156551 68.157.15.43 -> 41.177.26.46 TCP 70 41244 > http [ACK] Seq=612 Ack=203214 Win=131072 Len=0 TSval=2677532076 TSecr=1509553864
996950 333.021146 68.157.15.43 -> 41.177.26.46 TCP 78 57659 > http [SYN] Seq=0 Win=5840 Len=0 MSS=1460 SACK_PERM=1 TSval=2677780929 TSecr=0 WS=64
997067 333.120643 68.157.15.43 -> 41.177.26.46 TCP 70 57659 > http [ACK] Seq=1 Ack=1 Win=5888 Len=0 TSval=2677781028 TSecr=1509578760
997812 333.530054 68.157.15.43 -> 41.177.26.46 TCP 70 57659 > http [ACK] Seq=329 Ack=1449 Win=8768 Len=0 TSval=2677781437 TSecr=1509578801
997813 333.530059 68.157.15.43 -> 41.177.26.46 TCP 70 57659 > http [ACK] Seq=329 Ack=2897 Win=11648 Len=0 TSval=2677781437 TSecr=1509578801
997814 333.530064 68.157.15.43 -> 41.177.26.46 TCP 70 57659 > http [ACK] Seq=329 Ack=4345 Win=14528 Len=0 TSval=2677781437 TSecr=1509578801
998157 333.629225 68.157.15.43 -> 41.177.26.46 TCP 70 57659 > http [ACK] Seq=329 Ack=5793 Win=17472 Len=0 TSval=2677781537 TSecr=1509578811
998158 333.629230 68.157.15.43 -> 41.177.26.46 TCP 70 57659 > http [ACK] Seq=329 Ack=7234 Win=20352 Len=0 TSval=2677781537 TSecr=1509578811
998976 334.038795 68.157.15.43 -> 41.177.26.46 TCP 70 57659 > http [ACK] Seq=611 Ack=8682 Win=23232 Len=0 TSval=2677781946 TSecr=1509578852
998977 334.038799 68.157.15.43 -> 41.177.26.46 TCP 70 57659 > http [ACK] Seq=611 Ack=10130 Win=26112 Len=0 TSval=2677781946 TSecr=1509578852
998978 334.038854 68.157.15.43 -> 41.177.26.46 TCP 70 57659 > http [ACK] Seq=611 Ack=11578 Win=29056 Len=0 TSval=2677781946 TSecr=1509578852
998979 334.038858 68.157.15.43 -> 41.177.26.46 TCP 70 57659 > http [ACK] Seq=611 Ack=13026 Win=31936 Len=0 TSval=2677781946 TSecr=1509578852
998980 334.038962 68.157.15.43 -> 41.177.26.46 TCP 70 57659 > http [ACK] Seq=611 Ack=14474 Win=34816 Len=0 TSval=2677781946 TSecr=1509578852
998981 334.038967 68.157.15.43 -> 41.177.26.46 TCP 70 57659 > http [ACK] Seq=611 Ack=15797 Win=37696 Len=0 TSval=2677781946 TSecr=1509578852
998994 334.041240 68.157.15.43 -> 41.177.26.46 TCP 70 57659 > http [ACK] Seq=611 Ack=17245 Win=40640 Len=0 TSval=2677781949 TSecr=1509578852
998995 334.041334 68.157.15.43 -> 41.177.26.46 TCP 70 57659 > http [ACK] Seq=611 Ack=18693 Win=43520 Len=0 TSval=2677781949 TSecr=1509578852
999109 334.138059 68.157.15.43 -> 41.177.26.46 TCP 70 57659 > http [ACK] Seq=611 Ack=20141 Win=46400 Len=0 TSval=2677782045 TSecr=1509578862
999110 334.138136 68.157.15.43 -> 41.177.26.46 TCP 70 57659 > http [ACK] Seq=611 Ack=21589 Win=49280 Len=0 TSval=2677782045 TSecr=1509578862
999111 334.138140 68.157.15.43 -> 41.177.26.46 TCP 70 57659 > http [ACK] Seq=611 Ack=23037 Win=52224 Len=0 TSval=2677782046 TSecr=1509578862
999112 334.138145 68.157.15.43 -> 41.177.26.46 TCP 70 57659 > http [ACK] Seq=611 Ack=23989 Win=55104 Len=0 TSval=2677782046 TSecr=1509578862
999113 334.138149 68.157.15.43 -> 41.177.26.46 TCP 70 57659 > http [ACK] Seq=611 Ack=25437 Win=57984 Len=0 TSval=2677782046 TSecr=1509578862
999114 334.138153 68.157.15.43 -> 41.177.26.46 TCP 70 57659 > http [ACK] Seq=611 Ack=26885 Win=58368 Len=0 TSval=2677782046 TSecr=1509578862
999117 334.138305 68.157.15.43 -> 41.177.26.46 TCP 70 57659 > http [ACK] Seq=611 Ack=28333 Win=63808 Len=0 TSval=2677782046 TSecr=1509578862
999119 334.138338 68.157.15.43 -> 41.177.26.46 TCP 70 57659 > http [ACK] Seq=611 Ack=29781 Win=62656 Len=0 TSval=2677782046 TSecr=1509578862
999120 334.138342 68.157.15.43 -> 41.177.26.46 TCP 70 57659 > http [ACK] Seq=611 Ack=31229 Win=61248 Len=0 TSval=2677782046 TSecr=1509578862
999121 334.138346 68.157.15.43 -> 41.177.26.46 TCP 70 57659 > http [ACK] Seq=611 Ack=32181 Win=60288 Len=0 TSval=2677782046 TSecr=1509578862
999122 334.138350 68.157.15.43 -> 41.177.26.46 TCP 70 57659 > http [ACK] Seq=611 Ack=33629 Win=58816 Len=0 TSval=2677782046 TSecr=1509578862
999123 334.138359 68.157.15.43 -> 41.177.26.46 TCP 70 57659 > http [ACK] Seq=611 Ack=35077 Win=57344 Len=0 TSval=2677782046 TSecr=1509578862
999147 334.140290 68.157.15.43 -> 41.177.26.46 TCP 70 57659 > http [ACK] Seq=611 Ack=36525 Win=64128 Len=0 TSval=2677782048 TSecr=1509578862
999148 334.140389 68.157.15.43 -> 41.177.26.46 TCP 70 57659 > http [ACK] Seq=611 Ack=39421 Win=62656 Len=0 TSval=2677782048 TSecr=1509578862
999151 334.140517 68.157.15.43 -> 41.177.26.46 TCP 70 57659 > http [ACK] Seq=611 Ack=40373 Win=64128 Len=0 TSval=2677782048 TSecr=1509578862
999244 334.180849 68.157.15.43 -> 41.177.26.46 TCP 70 57659 > http [ACK] Seq=611 Ack=41821 Win=64128 Len=0 TSval=2677782088 TSecr=1509578862
999348 334.237379 68.157.15.43 -> 41.177.26.46 TCP 70 57659 > http [ACK] Seq=611 Ack=44717 Win=64128 Len=0 TSval=2677782145 TSecr=1509578871
999349 334.237383 68.157.15.43 -> 41.177.26.46 TCP 70 57659 > http [ACK] Seq=611 Ack=59653 Win=49152 Len=0 TSval=2677782145 TSecr=1509578871
999350 334.237461 68.157.15.43 -> 41.177.26.46 TCP 70 57659 > http [ACK] Seq=611 Ack=62549 Win=62656 Len=0 TSval=2677782145 TSecr=1509578871
999354 334.237601 68.157.15.43 -> 41.177.26.46 TCP 70 57659 > http [ACK] Seq=611 Ack=64949 Win=62656 Len=0 TSval=2677782145 TSecr=1509578871
999356 334.237624 68.157.15.43 -> 41.177.26.46 TCP 70 57659 > http [ACK] Seq=611 Ack=72189 Win=55488 Len=0 TSval=2677782145 TSecr=1509578871
999369 334.237885 68.157.15.43 -> 41.177.26.46 TCP 70 57659 > http [ACK] Seq=611 Ack=73141 Win=64128 Len=0 TSval=2677782145 TSecr=1509578872
999384 334.239356 68.157.15.43 -> 41.177.26.46 TCP 70 57659 > http [ACK] Seq=611 Ack=76037 Win=64128 Len=0 TSval=2677782147 TSecr=1509578872
999388 334.239877 68.157.15.43 -> 41.177.26.46 TCP 70 57659 > http [ACK] Seq=611 Ack=81333 Win=59776 Len=0 TSval=2677782147 TSecr=1509578872
999389 334.239956 68.157.15.43 -> 41.177.26.46 TCP 70 57659 > http [ACK] Seq=611 Ack=84229 Win=64128 Len=0 TSval=2677782147 TSecr=1509578872
999458 334.280111 68.157.15.43 -> 41.177.26.46 TCP 70 57659 > http [ACK] Seq=611 Ack=87125 Win=64128 Len=0 TSval=2677782187 TSecr=1509578876
999574 334.336597 68.157.15.43 -> 41.177.26.46 TCP 70 57659 > http [ACK] Seq=611 Ack=89525 Win=64128 Len=0 TSval=2677782244 TSecr=1509578881
999575 334.336681 68.157.15.43 -> 41.177.26.46 TCP 70 57659 > http [ACK] Seq=611 Ack=90973 Win=67008 Len=0 TSval=2677782244 TSecr=1509578881
999576 334.336685 68.157.15.43 -> 41.177.26.46 TCP 70 57659 > http [ACK] Seq=611 Ack=92421 Win=69888 Len=0 TSval=2677782244 TSecr=1509578881
999577 334.336689 68.157.15.43 -> 41.177.26.46 TCP 70 57659 > http [ACK] Seq=611 Ack=93869 Win=72832 Len=0 TSval=2677782244 TSecr=1509578881
999578 334.336694 68.157.15.43 -> 41.177.26.46 TCP 70 57659 > http [ACK] Seq=611 Ack=95317 Win=75712 Len=0 TSval=2677782244 TSecr=1509578881
999579 334.336697 68.157.15.43 -> 41.177.26.46 TCP 70 57659 > http [ACK] Seq=611 Ack=96765 Win=78592 Len=0 TSval=2677782244 TSecr=1509578881
999582 334.336798 68.157.15.43 -> 41.177.26.46 TCP 70 57659 > http [ACK] Seq=611 Ack=97717 Win=81472 Len=0 TSval=2677782244 TSecr=1509578881
999583 334.336802 68.157.15.43 -> 41.177.26.46 TCP 70 57659 > http [ACK] Seq=611 Ack=99165 Win=84416 Len=0 TSval=2677782244 TSecr=1509578881
999584 334.336806 68.157.15.43 -> 41.177.26.46 TCP 70 57659 > http [ACK] Seq=611 Ack=100613 Win=86080 Len=0 TSval=2677782244 TSecr=1509578881
999586 334.336841 68.157.15.43 -> 41.177.26.46 TCP 70 57659 > http [ACK] Seq=611 Ack=108805 Win=78848 Len=0 TSval=2677782244 TSecr=1509578881
999593 334.336937 68.157.15.43 -> 41.177.26.46 TCP 70 57659 > http [ACK] Seq=611 Ack=110253 Win=87744 Len=0 TSval=2677782244 TSecr=1509578881
999594 334.336941 68.157.15.43 -> 41.177.26.46 TCP 70 57659 > http [ACK] Seq=611 Ack=115549 Win=83200 Len=0 TSval=2677782244 TSecr=1509578881
999602 334.337077 68.157.15.43 -> 41.177.26.46 TCP 70 57659 > http [ACK] Seq=611 Ack=118445 Win=87488 Len=0 TSval=2677782244 TSecr=1509578881
999605 334.337126 68.157.15.43 -> 41.177.26.46 TCP 70 57659 > http [ACK] Seq=611 Ack=126637 Win=79296 Len=0 TSval=2677782244 TSecr=1509578881
999642 334.338563 68.157.15.43 -> 41.177.26.46 TCP 70 57659 > http [ACK] Seq=611 Ack=129533 Win=87744 Len=0 TSval=2677782246 TSecr=1509578881
999644 334.338767 68.157.15.43 -> 41.177.26.46 TCP 70 57659 > http [ACK] Seq=611 Ack=131933 Win=87744 Len=0 TSval=2677782246 TSecr=1509578882
999645 334.339079 68.157.15.43 -> 41.177.26.46 TCP 70 57659 > http [ACK] Seq=611 Ack=137725 Win=84608 Len=0 TSval=2677782246 TSecr=1509578882
999646 334.339148 68.157.15.43 -> 41.177.26.46 TCP 70 57659 > http [ACK] Seq=611 Ack=140125 Win=87488 Len=0 TSval=2677782247 TSecr=1509578882
999648 334.339518 68.157.15.43 -> 41.177.26.46 TCP 70 57659 > http [ACK] Seq=611 Ack=143021 Win=86080 Len=0 TSval=2677782247 TSecr=1509578882
999789 334.379836 68.157.15.43 -> 41.177.26.46 TCP 70 57659 > http [ACK] Seq=611 Ack=145917 Win=87488 Len=0 TSval=2677782287 TSecr=1509578886
999790 334.379841 68.157.15.43 -> 41.177.26.46 TCP 70 57659 > http [ACK] Seq=611 Ack=146869 Win=87744 Len=0 TSval=2677782287 TSecr=1509578886
999880 334.435531 68.157.15.43 -> 41.177.26.46 TCP 70 57659 > http [ACK] Seq=611 Ack=149765 Win=87488 Len=0 TSval=2677782343 TSecr=1509578891
999881 334.435682 68.157.15.43 -> 41.177.26.46 TCP 70 57659 > http [ACK] Seq=611 Ack=152661 Win=87488 Len=0 TSval=2677782343 TSecr=1509578891
999882 334.435808 68.157.15.43 -> 41.177.26.46 TCP 70 57659 > http [ACK] Seq=611 Ack=155061 Win=87488 Len=0 TSval=2677782343 TSecr=1509578891
999886 334.436134 68.157.15.43 -> 41.177.26.46 TCP 70 57659 > http [ACK] Seq=611 Ack=157957 Win=87488 Len=0 TSval=2677782343 TSecr=1509578891
999888 334.436141 68.157.15.43 -> 41.177.26.46 TCP 70 57659 > http [ACK] Seq=611 Ack=171445 Win=87744 Len=0 TSval=2677782343 TSecr=1509578891
999890 334.436274 68.157.15.43 -> 41.177.26.46 TCP 70 57659 > http [ACK] Seq=611 Ack=172893 Win=90624 Len=0 TSval=2677782344 TSecr=1509578891
999891 334.436279 68.157.15.43 -> 41.177.26.46 TCP 70 57659 > http [ACK] Seq=611 Ack=174341 Win=93504 Len=0 TSval=2677782344 TSecr=1509578891
999892 334.436309 68.157.15.43 -> 41.177.26.46 TCP 70 57659 > http [ACK] Seq=611 Ack=175789 Win=96448 Len=0 TSval=2677782344 TSecr=1509578891
999893 334.436338 68.157.15.43 -> 41.177.26.46 TCP 70 57659 > http [ACK] Seq=611 Ack=177237 Win=99328 Len=0 TSval=2677782344 TSecr=1509578891
999894 334.436342 68.157.15.43 -> 41.177.26.46 TCP 70 57659 > http [ACK] Seq=611 Ack=178685 Win=102208 Len=0 TSval=2677782344 TSecr=1509578891
999895 334.436347 68.157.15.43 -> 41.177.26.46 TCP 70 57659 > http [ACK] Seq=611 Ack=179637 Win=105088 Len=0 TSval=2677782344 TSecr=1509578891
999896 334.436350 68.157.15.43 -> 41.177.26.46 TCP 70 57659 > http [ACK] Seq=611 Ack=181085 Win=108032 Len=0 TSval=2677782344 TSecr=1509578891
999897 334.436354 68.157.15.43 -> 41.177.26.46 TCP 70 57659 > http [ACK] Seq=611 Ack=182533 Win=110912 Len=0 TSval=2677782344 TSecr=1509578891
999898 334.436359 68.157.15.43 -> 41.177.26.46 TCP 70 57659 > http [ACK] Seq=611 Ack=183981 Win=113792 Len=0 TSval=2677782344 TSecr=1509578891
999899 334.436383 68.157.15.43 -> 41.177.26.46 TCP 70 57659 > http [ACK] Seq=611 Ack=185429 Win=116672 Len=0 TSval=2677782344 TSecr=1509578891
999900 334.436387 68.157.15.43 -> 41.177.26.46 TCP 70 57659 > http [ACK] Seq=611 Ack=186877 Win=119616 Len=0 TSval=2677782344 TSecr=1509578891
999904 334.436490 68.157.15.43 -> 41.177.26.46 TCP 70 57659 > http [ACK] Seq=611 Ack=187829 Win=122496 Len=0 TSval=2677782344 TSecr=1509578891
999907 334.436562 68.157.15.43 -> 41.177.26.46 TCP 70 57659 > http [ACK] Seq=611 Ack=190725 Win=125376 Len=0 TSval=2677782344 TSecr=1509578891
999908 334.436566 68.157.15.43 -> 41.177.26.46 TCP 70 57659 > http [ACK] Seq=611 Ack=192173 Win=128256 Len=0 TSval=2677782344 TSecr=1509578891
999909 334.436570 68.157.15.43 -> 41.177.26.46 TCP 70 57659 > http [ACK] Seq=611 Ack=193621 Win=131200 Len=0 TSval=2677782344 TSecr=1509578891
999910 334.436643 68.157.15.43 -> 41.177.26.46 TCP 70 57659 > http [ACK] Seq=611 Ack=195069 Win=134080 Len=0 TSval=2677782344 TSecr=1509578891
999911 334.436648 68.157.15.43 -> 41.177.26.46 TCP 70 57659 > http [ACK] Seq=611 Ack=197469 Win=134080 Len=0 TSval=2677782344 TSecr=1509578891
999913 334.436767 68.157.15.43 -> 41.177.26.46 TCP 70 57659 > http [ACK] Seq=611 Ack=198505 Win=135872 Len=0 TSval=2677782344 TSecr=1509578891
1013294 340.577700 68.157.15.43 -> 41.177.26.46 TCP 70 57659 > http [FIN, ACK] Seq=611 Ack=198505 Win=135872 Len=0 TSval=2677788485 TSecr=1509578891
1013595 340.676785 68.157.15.43 -> 41.177.26.46 TCP 70 57659 > http [ACK] Seq=612 Ack=198506 Win=135872 Len=0 TSval=2677788584 TSecr=1509579515
