982698 328.389582 68.157.168.15 -> 41.177.26.176 TCP 78 60831 > http [SYN] Seq=0 Win=5840 Len=0 MSS=1460 SACK_PERM=1 TSval=58113881 TSecr=0 WS=64
982848 328.432544 68.157.168.15 -> 41.177.26.176 TCP 70 60831 > http [ACK] Seq=1 Ack=1 Win=5888 Len=0 TSval=58113923 TSecr=140374435
989841 330.049309 68.157.168.15 -> 41.177.26.176 TCP 70 60831 > http [ACK] Seq=314 Ack=1449 Win=8768 Len=0 TSval=58115540 TSecr=140374597
989842 330.049314 68.157.168.15 -> 41.177.26.176 TCP 70 60831 > http [ACK] Seq=314 Ack=2274 Win=11648 Len=0 TSval=58115540 TSecr=140374597
989843 330.049438 68.157.168.15 -> 41.177.26.176 TCP 70 60831 > http [ACK] Seq=314 Ack=3722 Win=14528 Len=0 TSval=58115540 TSecr=140374597
989900 330.091758 68.157.168.15 -> 41.177.26.176 TCP 70 60831 > http [ACK] Seq=314 Ack=5136 Win=17472 Len=0 TSval=58115583 TSecr=140374601
989903 330.092009 68.157.168.15 -> 41.177.26.176 TCP 70 60831 > http [ACK] Seq=314 Ack=6468 Win=20352 Len=0 TSval=58115583 TSecr=140374601
989904 330.092197 68.157.168.15 -> 41.177.26.176 TCP 70 60831 > http [ACK] Seq=314 Ack=7291 Win=23232 Len=0 TSval=58115583 TSecr=140374601
989905 330.092201 68.157.168.15 -> 41.177.26.176 TCP 70 60831 > http [ACK] Seq=314 Ack=8739 Win=26112 Len=0 TSval=58115583 TSecr=140374601
989906 330.092228 68.157.168.15 -> 41.177.26.176 TCP 82 [TCP Dup ACK 989905#1] 60831 > http [ACK] Seq=314 Ack=8739 Win=26112 Len=0 TSval=58115583 TSecr=140374601 SLE=10187 SRE=10299
