7078   2.342816 68.157.15.122 -> 41.177.26.46 TCP 78 45693 > http [SYN] Seq=0 Win=5840 Len=0 MSS=1460 SACK_PERM=1 TSval=3846055894 TSecr=0 WS=64
7311   2.441689 68.157.15.122 -> 41.177.26.46 TCP 70 45693 > http [ACK] Seq=1 Ack=1 Win=5888 Len=0 TSval=3846055993 TSecr=1509545692
7542   2.544045 68.157.15.122 -> 41.177.26.46 TCP 70 45693 > http [ACK] Seq=306 Ack=168 Win=6912 Len=0 TSval=3846056095 TSecr=1509545703
22421   7.982328 68.157.15.122 -> 41.177.26.46 TCP 70 45693 > http [FIN, ACK] Seq=306 Ack=168 Win=6912 Len=0 TSval=3846061533 TSecr=1509545703
22650   8.081444 68.157.15.122 -> 41.177.26.46 TCP 70 45693 > http [ACK] Seq=307 Ack=169 Win=6912 Len=0 TSval=3846061632 TSecr=1509546256
654529 204.905601 68.157.15.122 -> 41.177.26.46 TCP 78 37993 > http [SYN] Seq=0 Win=5840 Len=0 MSS=1460 SACK_PERM=1 TSval=3846258448 TSecr=0 WS=64
654872 205.006192 68.157.15.122 -> 41.177.26.46 TCP 70 37993 > http [ACK] Seq=1 Ack=1 Win=5888 Len=0 TSval=3846258549 TSecr=1509565948
655124 205.108295 68.157.15.122 -> 41.177.26.46 TCP 70 37993 > http [ACK] Seq=307 Ack=167 Win=6912 Len=0 TSval=3846258651 TSecr=1509565959
674692 210.678690 68.157.15.122 -> 41.177.26.46 TCP 70 37993 > http [FIN, ACK] Seq=307 Ack=167 Win=6912 Len=0 TSval=3846264221 TSecr=1509565959
674819 210.779324 68.157.15.122 -> 41.177.26.46 TCP 70 37993 > http [ACK] Seq=308 Ack=168 Win=6912 Len=0 TSval=3846264322 TSecr=1509566526
969737 323.064702 68.157.15.122 -> 41.177.26.46 TCP 78 55136 > http [SYN] Seq=0 Win=5840 Len=0 MSS=1460 SACK_PERM=1 TSval=3846376603 TSecr=0 WS=64
969940 323.163903 68.157.15.122 -> 41.177.26.46 TCP 70 55136 > http [ACK] Seq=1 Ack=1 Win=5888 Len=0 TSval=3846376702 TSecr=1509577764
970104 323.287766 68.157.15.122 -> 41.177.26.46 TCP 70 55136 > http [ACK] Seq=307 Ack=168 Win=6912 Len=0 TSval=3846376826 TSecr=1509577777
985268 328.929655 68.157.15.122 -> 41.177.26.46 TCP 70 55136 > http [FIN, ACK] Seq=307 Ack=168 Win=6912 Len=0 TSval=3846382468 TSecr=1509577777
985500 329.028718 68.157.15.122 -> 41.177.26.46 TCP 70 55136 > http [ACK] Seq=308 Ack=169 Win=6912 Len=0 TSval=3846382567 TSecr=1509578351
996166 332.616082 68.157.15.122 -> 41.177.26.46 TCP 78 40521 > http [SYN] Seq=0 Win=5840 Len=0 MSS=1460 SACK_PERM=1 TSval=3846386154 TSecr=0 WS=64
996312 332.716600 68.157.15.122 -> 41.177.26.46 TCP 70 40521 > http [ACK] Seq=1 Ack=1 Win=5888 Len=0 TSval=3846386254 TSecr=1509578719
996572 332.825919 68.157.15.122 -> 41.177.26.46 TCP 70 40521 > http [ACK] Seq=263 Ack=168 Win=6912 Len=0 TSval=3846386364 TSecr=1509578730
1009983 338.703461 68.157.15.122 -> 41.177.26.46 TCP 70 40521 > http [FIN, ACK] Seq=263 Ack=168 Win=6912 Len=0 TSval=3846392241 TSecr=1509578730
1010235 338.804086 68.157.15.122 -> 41.177.26.46 TCP 70 40521 > http [ACK] Seq=264 Ack=169 Win=6912 Len=0 TSval=3846392342 TSecr=1509579328
