16752   4.597619 68.157.168.82 -> 244.3.210.197 TCP 70 41764 > http [FIN, ACK] Seq=1 Ack=1 Win=816 Len=0 TSval=3043404904 TSecr=150403997
16796   4.640567 68.157.168.82 -> 244.3.210.197 TCP 70 41764 > http [ACK] Seq=2 Ack=2 Win=816 Len=0 TSval=3043404946 TSecr=150404058
27677  10.961450 68.157.168.82 -> 244.3.210.197 TCP 78 62221 > http [SYN] Seq=0 Win=5840 Len=0 MSS=1460 SACK_PERM=1 TSval=3043411267 TSecr=0 WS=64
27726  11.004205 68.157.168.82 -> 244.3.210.197 TCP 70 62221 > http [ACK] Seq=1 Ack=1 Win=5888 Len=0 TSval=3043411310 TSecr=0
28357  11.433782 68.157.168.82 -> 244.3.210.197 TCP 70 62221 > http [ACK] Seq=344 Ack=1449 Win=8768 Len=0 TSval=3043411739 TSecr=150404126
28361  11.433954 68.157.168.82 -> 244.3.210.197 TCP 70 62221 > http [ACK] Seq=344 Ack=2897 Win=11648 Len=0 TSval=3043411740 TSecr=150404126
28449  11.476693 68.157.168.82 -> 244.3.210.197 TCP 70 62221 > http [ACK] Seq=344 Ack=4345 Win=14528 Len=0 TSval=3043411782 TSecr=150404127
28452  11.476803 68.157.168.82 -> 244.3.210.197 TCP 70 62221 > http [ACK] Seq=344 Ack=5793 Win=17472 Len=0 TSval=3043411782 TSecr=150404127
28453  11.476807 68.157.168.82 -> 244.3.210.197 TCP 70 62221 > http [ACK] Seq=344 Ack=7241 Win=20352 Len=0 TSval=3043411782 TSecr=150404127
28462  11.476943 68.157.168.82 -> 244.3.210.197 TCP 70 62221 > http [ACK] Seq=344 Ack=8689 Win=23232 Len=0 TSval=3043411783 TSecr=150404127
28543  11.519378 68.157.168.82 -> 244.3.210.197 TCP 70 62221 > http [ACK] Seq=344 Ack=10137 Win=26112 Len=0 TSval=3043411825 TSecr=150404127
28544  11.519383 68.157.168.82 -> 244.3.210.197 TCP 70 62221 > http [ACK] Seq=344 Ack=11585 Win=29056 Len=0 TSval=3043411825 TSecr=150404127
28545  11.519387 68.157.168.82 -> 244.3.210.197 TCP 70 62221 > http [ACK] Seq=344 Ack=13033 Win=31936 Len=0 TSval=3043411825 TSecr=150404127
28553  11.519589 68.157.168.82 -> 244.3.210.197 TCP 70 62221 > http [ACK] Seq=344 Ack=14481 Win=34816 Len=0 TSval=3043411825 TSecr=150404127
28554  11.519594 68.157.168.82 -> 244.3.210.197 TCP 70 62221 > http [ACK] Seq=344 Ack=14816 Win=37696 Len=0 TSval=3043411825 TSecr=150404127
41656  17.369856 68.157.168.82 -> 244.3.210.197 TCP 70 62221 > http [FIN, ACK] Seq=344 Ack=14816 Win=37696 Len=0 TSval=3043417675 TSecr=150404127
41830  17.412713 68.157.168.82 -> 244.3.210.197 TCP 70 62221 > http [ACK] Seq=345 Ack=14817 Win=37696 Len=0 TSval=3043417718 TSecr=150404186
69667  28.892092 68.157.168.82 -> 244.3.210.197 TCP 78 35806 > http [SYN] Seq=0 Win=5840 Len=0 MSS=1460 SACK_PERM=1 TSval=3043429197 TSecr=0 WS=64
69837  28.935038 68.157.168.82 -> 244.3.210.197 TCP 70 35806 > http [ACK] Seq=1 Ack=1 Win=5888 Len=0 TSval=3043429240 TSecr=0
70958  29.312547 68.157.168.82 -> 244.3.210.197 TCP 70 35806 > http [ACK] Seq=299 Ack=1449 Win=8768 Len=0 TSval=3043429617 TSecr=150404305
70959  29.312552 68.157.168.82 -> 244.3.210.197 TCP 70 35806 > http [ACK] Seq=299 Ack=2897 Win=11648 Len=0 TSval=3043429617 TSecr=150404305
71015  29.355532 68.157.168.82 -> 244.3.210.197 TCP 70 35806 > http [ACK] Seq=299 Ack=4345 Win=14528 Len=0 TSval=3043429660 TSecr=150404305
71016  29.355536 68.157.168.82 -> 244.3.210.197 TCP 70 35806 > http [ACK] Seq=299 Ack=5793 Win=17472 Len=0 TSval=3043429660 TSecr=150404305
71017  29.355618 68.157.168.82 -> 244.3.210.197 TCP 70 35806 > http [ACK] Seq=299 Ack=7241 Win=20352 Len=0 TSval=3043429661 TSecr=150404305
71018  29.355623 68.157.168.82 -> 244.3.210.197 TCP 70 35806 > http [ACK] Seq=299 Ack=8689 Win=23232 Len=0 TSval=3043429661 TSecr=150404305
71242  29.398307 68.157.168.82 -> 244.3.210.197 TCP 70 35806 > http [ACK] Seq=299 Ack=10137 Win=26112 Len=0 TSval=3043429703 TSecr=150404305
71243  29.398311 68.157.168.82 -> 244.3.210.197 TCP 70 35806 > http [ACK] Seq=299 Ack=11585 Win=29056 Len=0 TSval=3043429703 TSecr=150404305
71244  29.398315 68.157.168.82 -> 244.3.210.197 TCP 70 35806 > http [ACK] Seq=299 Ack=13033 Win=31936 Len=0 TSval=3043429703 TSecr=150404305
71245  29.398319 68.157.168.82 -> 244.3.210.197 TCP 70 35806 > http [ACK] Seq=299 Ack=14481 Win=34816 Len=0 TSval=3043429703 TSecr=150404305
71246  29.398324 68.157.168.82 -> 244.3.210.197 TCP 70 35806 > http [ACK] Seq=299 Ack=15929 Win=37696 Len=0 TSval=3043429703 TSecr=150404305
71247  29.398328 68.157.168.82 -> 244.3.210.197 TCP 70 35806 > http [ACK] Seq=299 Ack=16031 Win=37696 Len=0 TSval=3043429703 TSecr=150404305
91512  35.145703 68.157.168.82 -> 244.3.210.197 TCP 70 35806 > http [FIN, ACK] Seq=299 Ack=16031 Win=37696 Len=0 TSval=3043435450 TSecr=150404305
91687  35.188617 68.157.168.82 -> 244.3.210.197 TCP 70 35806 > http [ACK] Seq=300 Ack=16032 Win=37696 Len=0 TSval=3043435493 TSecr=150404363
183316  61.600447 68.157.168.82 -> 244.3.210.197 TCP 78 53646 > http [SYN] Seq=0 Win=5840 Len=0 MSS=1460 SACK_PERM=1 TSval=3043461904 TSecr=0 WS=64
183435  61.643167 68.157.168.82 -> 244.3.210.197 TCP 70 53646 > http [ACK] Seq=1 Ack=1 Win=5888 Len=0 TSval=3043461947 TSecr=0
184488  62.018363 68.157.168.82 -> 244.3.210.197 TCP 70 53646 > http [ACK] Seq=304 Ack=1449 Win=8768 Len=0 TSval=3043462322 TSecr=150404632
184489  62.018472 68.157.168.82 -> 244.3.210.197 TCP 70 53646 > http [ACK] Seq=304 Ack=2897 Win=11648 Len=0 TSval=3043462322 TSecr=150404632
184587  62.060933 68.157.168.82 -> 244.3.210.197 TCP 70 53646 > http [ACK] Seq=304 Ack=4345 Win=14528 Len=0 TSval=3043462365 TSecr=150404632
184588  62.060937 68.157.168.82 -> 244.3.210.197 TCP 70 53646 > http [ACK] Seq=304 Ack=5793 Win=17472 Len=0 TSval=3043462365 TSecr=150404632
184603  62.061407 68.157.168.82 -> 244.3.210.197 TCP 70 53646 > http [ACK] Seq=304 Ack=7241 Win=20352 Len=0 TSval=3043462365 TSecr=150404632
184605  62.061537 68.157.168.82 -> 244.3.210.197 TCP 70 53646 > http [ACK] Seq=304 Ack=8689 Win=23232 Len=0 TSval=3043462365 TSecr=150404632
184894  62.103736 68.157.168.82 -> 244.3.210.197 TCP 70 53646 > http [ACK] Seq=304 Ack=10137 Win=26112 Len=0 TSval=3043462407 TSecr=150404633
184900  62.103905 68.157.168.82 -> 244.3.210.197 TCP 70 53646 > http [ACK] Seq=304 Ack=11585 Win=29056 Len=0 TSval=3043462408 TSecr=150404633
184901  62.103909 68.157.168.82 -> 244.3.210.197 TCP 70 53646 > http [ACK] Seq=304 Ack=13033 Win=31936 Len=0 TSval=3043462408 TSecr=150404633
184913  62.104203 68.157.168.82 -> 244.3.210.197 TCP 70 53646 > http [ACK] Seq=304 Ack=14481 Win=34816 Len=0 TSval=3043462408 TSecr=150404633
184914  62.104253 68.157.168.82 -> 244.3.210.197 TCP 70 53646 > http [ACK] Seq=304 Ack=15420 Win=37696 Len=0 TSval=3043462408 TSecr=150404633
197775  67.841287 68.157.168.82 -> 244.3.210.197 TCP 70 53646 > http [FIN, ACK] Seq=304 Ack=15420 Win=37696 Len=0 TSval=3043468145 TSecr=150404633
197930  67.884424 68.157.168.82 -> 244.3.210.197 TCP 70 53646 > http [ACK] Seq=305 Ack=15421 Win=37696 Len=0 TSval=3043468188 TSecr=150404690
293954  98.887061 68.157.168.82 -> 244.3.210.197 TCP 78 34689 > http [SYN] Seq=0 Win=5840 Len=0 MSS=1460 SACK_PERM=1 TSval=3043499189 TSecr=0 WS=64
294007  98.930099 68.157.168.82 -> 244.3.210.197 TCP 70 34689 > http [ACK] Seq=1 Ack=1 Win=5888 Len=0 TSval=3043499232 TSecr=0
295039  99.479764 68.157.168.82 -> 244.3.210.197 TCP 70 34689 > http [ACK] Seq=358 Ack=1449 Win=8768 Len=0 TSval=3043499782 TSecr=150405006
295040  99.479769 68.157.168.82 -> 244.3.210.197 TCP 70 34689 > http [ACK] Seq=358 Ack=2897 Win=11648 Len=0 TSval=3043499782 TSecr=150405006
295149  99.522550 68.157.168.82 -> 244.3.210.197 TCP 70 34689 > http [ACK] Seq=358 Ack=4345 Win=14528 Len=0 TSval=3043499825 TSecr=150405007
295150  99.522555 68.157.168.82 -> 244.3.210.197 TCP 70 34689 > http [ACK] Seq=358 Ack=5793 Win=17472 Len=0 TSval=3043499825 TSecr=150405007
295156  99.522689 68.157.168.82 -> 244.3.210.197 TCP 70 34689 > http [ACK] Seq=358 Ack=7241 Win=20352 Len=0 TSval=3043499825 TSecr=150405007
295157  99.522693 68.157.168.82 -> 244.3.210.197 TCP 70 34689 > http [ACK] Seq=358 Ack=8689 Win=23232 Len=0 TSval=3043499825 TSecr=150405007
295294  99.565706 68.157.168.82 -> 244.3.210.197 TCP 70 34689 > http [ACK] Seq=358 Ack=10137 Win=26112 Len=0 TSval=3043499868 TSecr=150405007
295295  99.565886 68.157.168.82 -> 244.3.210.197 TCP 70 34689 > http [ACK] Seq=358 Ack=11585 Win=29056 Len=0 TSval=3043499868 TSecr=150405007
295296  99.565891 68.157.168.82 -> 244.3.210.197 TCP 70 34689 > http [ACK] Seq=358 Ack=13033 Win=31936 Len=0 TSval=3043499868 TSecr=150405007
295297  99.565895 68.157.168.82 -> 244.3.210.197 TCP 70 34689 > http [ACK] Seq=358 Ack=14481 Win=34816 Len=0 TSval=3043499868 TSecr=150405007
295298  99.565900 68.157.168.82 -> 244.3.210.197 TCP 70 34689 > http [ACK] Seq=358 Ack=15001 Win=37696 Len=0 TSval=3043499868 TSecr=150405007
299918 101.098925 68.157.168.82 -> 244.3.210.197 TCP 70 34689 > http [ACK] Seq=633 Ack=16449 Win=40640 Len=0 TSval=3043501401 TSecr=150405023
299924 101.099135 68.157.168.82 -> 244.3.210.197 TCP 70 34689 > http [ACK] Seq=633 Ack=17897 Win=43520 Len=0 TSval=3043501401 TSecr=150405023
299925 101.099139 68.157.168.82 -> 244.3.210.197 TCP 70 34689 > http [ACK] Seq=633 Ack=19345 Win=46400 Len=0 TSval=3043501401 TSecr=150405023
299926 101.099146 68.157.168.82 -> 244.3.210.197 TCP 70 34689 > http [ACK] Seq=633 Ack=20793 Win=49280 Len=0 TSval=3043501401 TSecr=150405023
299927 101.099150 68.157.168.82 -> 244.3.210.197 TCP 70 34689 > http [ACK] Seq=633 Ack=21535 Win=52224 Len=0 TSval=3043501401 TSecr=150405023
313859 107.070442 68.157.168.82 -> 244.3.210.197 TCP 70 34689 > http [FIN, ACK] Seq=633 Ack=21535 Win=52224 Len=0 TSval=3043507372 TSecr=150405023
313935 107.113035 68.157.168.82 -> 244.3.210.197 TCP 70 34689 > http [ACK] Seq=634 Ack=21536 Win=52224 Len=0 TSval=3043507415 TSecr=150405083
587058 186.991911 68.157.168.82 -> 244.3.210.197 TCP 78 49044 > http [SYN] Seq=0 Win=5840 Len=0 MSS=1460 SACK_PERM=1 TSval=3043587291 TSecr=0 WS=64
587244 187.034765 68.157.168.82 -> 244.3.210.197 TCP 70 49044 > http [ACK] Seq=1 Ack=1 Win=5888 Len=0 TSval=3043587334 TSecr=0
588564 187.511159 68.157.168.82 -> 244.3.210.197 TCP 70 49044 > http [ACK] Seq=360 Ack=1449 Win=8768 Len=0 TSval=3043587810 TSecr=150405887
588565 187.511213 68.157.168.82 -> 244.3.210.197 TCP 70 49044 > http [ACK] Seq=360 Ack=2897 Win=11648 Len=0 TSval=3043587810 TSecr=150405887
588701 187.554005 68.157.168.82 -> 244.3.210.197 TCP 70 49044 > http [ACK] Seq=360 Ack=4345 Win=14528 Len=0 TSval=3043587853 TSecr=150405887
588702 187.554011 68.157.168.82 -> 244.3.210.197 TCP 70 49044 > http [ACK] Seq=360 Ack=5793 Win=17472 Len=0 TSval=3043587853 TSecr=150405887
588703 187.554016 68.157.168.82 -> 244.3.210.197 TCP 70 49044 > http [ACK] Seq=360 Ack=7241 Win=20352 Len=0 TSval=3043587853 TSecr=150405887
588704 187.554019 68.157.168.82 -> 244.3.210.197 TCP 70 49044 > http [ACK] Seq=360 Ack=8689 Win=23232 Len=0 TSval=3043587853 TSecr=150405887
588787 187.596505 68.157.168.82 -> 244.3.210.197 TCP 70 49044 > http [ACK] Seq=360 Ack=10137 Win=26112 Len=0 TSval=3043587895 TSecr=150405888
588789 187.596603 68.157.168.82 -> 244.3.210.197 TCP 70 49044 > http [ACK] Seq=360 Ack=11585 Win=29056 Len=0 TSval=3043587896 TSecr=150405888
588791 187.596611 68.157.168.82 -> 244.3.210.197 TCP 70 49044 > http [ACK] Seq=360 Ack=13033 Win=31936 Len=0 TSval=3043587896 TSecr=150405888
588792 187.596615 68.157.168.82 -> 244.3.210.197 TCP 70 49044 > http [ACK] Seq=360 Ack=14481 Win=34816 Len=0 TSval=3043587896 TSecr=150405888
588808 187.596840 68.157.168.82 -> 244.3.210.197 TCP 70 49044 > http [ACK] Seq=360 Ack=15929 Win=37696 Len=0 TSval=3043587896 TSecr=150405888
588811 187.596871 68.157.168.82 -> 244.3.210.197 TCP 70 49044 > http [ACK] Seq=360 Ack=16246 Win=40640 Len=0 TSval=3043587896 TSecr=150405888
611037 193.959254 68.157.168.82 -> 244.3.210.197 TCP 70 49044 > http [FIN, ACK] Seq=360 Ack=16246 Win=40640 Len=0 TSval=3043594258 TSecr=150405888
611332 194.002273 68.157.168.82 -> 244.3.210.197 TCP 70 49044 > http [ACK] Seq=361 Ack=16247 Win=40640 Len=0 TSval=3043594301 TSecr=150405951
776220 249.944359 68.157.168.82 -> 244.3.210.197 TCP 78 48859 > http [SYN] Seq=0 Win=5840 Len=0 MSS=1460 SACK_PERM=1 TSval=3043650241 TSecr=0 WS=64
776299 249.986778 68.157.168.82 -> 244.3.210.197 TCP 70 48859 > http [ACK] Seq=1 Ack=1 Win=5888 Len=0 TSval=3043650283 TSecr=0
776885 250.335303 68.157.168.82 -> 244.3.210.197 TCP 70 48859 > http [ACK] Seq=308 Ack=1449 Win=8768 Len=0 TSval=3043650632 TSecr=150406514
776890 250.335520 68.157.168.82 -> 244.3.210.197 TCP 70 48859 > http [ACK] Seq=308 Ack=2897 Win=11648 Len=0 TSval=3043650632 TSecr=150406514
777089 250.378112 68.157.168.82 -> 244.3.210.197 TCP 70 48859 > http [ACK] Seq=308 Ack=4345 Win=14528 Len=0 TSval=3043650675 TSecr=150406516
777095 250.378295 68.157.168.82 -> 244.3.210.197 TCP 70 48859 > http [ACK] Seq=308 Ack=5793 Win=17472 Len=0 TSval=3043650675 TSecr=150406516
777096 250.378299 68.157.168.82 -> 244.3.210.197 TCP 70 48859 > http [ACK] Seq=308 Ack=7241 Win=20352 Len=0 TSval=3043650675 TSecr=150406516
777098 250.378320 68.157.168.82 -> 244.3.210.197 TCP 70 48859 > http [ACK] Seq=308 Ack=8689 Win=23232 Len=0 TSval=3043650675 TSecr=150406516
777237 250.420761 68.157.168.82 -> 244.3.210.197 TCP 70 48859 > http [ACK] Seq=308 Ack=10137 Win=26112 Len=0 TSval=3043650717 TSecr=150406516
777243 250.421216 68.157.168.82 -> 244.3.210.197 TCP 70 48859 > http [ACK] Seq=308 Ack=11585 Win=29056 Len=0 TSval=3043650718 TSecr=150406516
777249 250.421352 68.157.168.82 -> 244.3.210.197 TCP 70 48859 > http [ACK] Seq=308 Ack=11912 Win=31936 Len=0 TSval=3043650718 TSecr=150406516
778552 251.136336 68.157.168.82 -> 244.3.210.197 TCP 70 48859 > http [ACK] Seq=639 Ack=13360 Win=34816 Len=0 TSval=3043651433 TSecr=150406523
778560 251.136582 68.157.168.82 -> 244.3.210.197 TCP 70 48859 > http [ACK] Seq=639 Ack=14808 Win=37696 Len=0 TSval=3043651433 TSecr=150406523
778568 251.136954 68.157.168.82 -> 244.3.210.197 TCP 70 48859 > http [ACK] Seq=639 Ack=16256 Win=40640 Len=0 TSval=3043651433 TSecr=150406523
778569 251.136958 68.157.168.82 -> 244.3.210.197 TCP 70 48859 > http [ACK] Seq=639 Ack=17704 Win=43520 Len=0 TSval=3043651433 TSecr=150406523
778570 251.136963 68.157.168.82 -> 244.3.210.197 TCP 70 48859 > http [ACK] Seq=639 Ack=19152 Win=46400 Len=0 TSval=3043651433 TSecr=150406523
778571 251.136966 68.157.168.82 -> 244.3.210.197 TCP 70 48859 > http [ACK] Seq=639 Ack=20600 Win=49280 Len=0 TSval=3043651433 TSecr=150406523
778572 251.136971 68.157.168.82 -> 244.3.210.197 TCP 70 48859 > http [ACK] Seq=639 Ack=22048 Win=52224 Len=0 TSval=3043651433 TSecr=150406523
778573 251.136975 68.157.168.82 -> 244.3.210.197 TCP 70 48859 > http [ACK] Seq=639 Ack=23496 Win=55104 Len=0 TSval=3043651433 TSecr=150406523
778574 251.136980 68.157.168.82 -> 244.3.210.197 TCP 70 48859 > http [ACK] Seq=639 Ack=24944 Win=55488 Len=0 TSval=3043651433 TSecr=150406523
778575 251.136985 68.157.168.82 -> 244.3.210.197 TCP 70 48859 > http [ACK] Seq=639 Ack=26392 Win=54016 Len=0 TSval=3043651433 TSecr=150406523
778576 251.136989 68.157.168.82 -> 244.3.210.197 TCP 70 48859 > http [ACK] Seq=639 Ack=27840 Win=52608 Len=0 TSval=3043651433 TSecr=150406523
778720 251.179634 68.157.168.82 -> 244.3.210.197 TCP 70 48859 > http [ACK] Seq=639 Ack=29288 Win=60864 Len=0 TSval=3043651476 TSecr=150406523
778721 251.179639 68.157.168.82 -> 244.3.210.197 TCP 70 48859 > http [ACK] Seq=639 Ack=30736 Win=62656 Len=0 TSval=3043651476 TSecr=150406523
778732 251.180031 68.157.168.82 -> 244.3.210.197 TCP 70 48859 > http [ACK] Seq=639 Ack=32184 Win=61248 Len=0 TSval=3043651476 TSecr=150406523
778738 251.180467 68.157.168.82 -> 244.3.210.197 TCP 70 48859 > http [ACK] Seq=639 Ack=33632 Win=59776 Len=0 TSval=3043651477 TSecr=150406523
778739 251.180472 68.157.168.82 -> 244.3.210.197 TCP 70 48859 > http [ACK] Seq=639 Ack=35080 Win=58368 Len=0 TSval=3043651477 TSecr=150406523
778740 251.180476 68.157.168.82 -> 244.3.210.197 TCP 70 48859 > http [ACK] Seq=639 Ack=36528 Win=56896 Len=0 TSval=3043651477 TSecr=150406523
778743 251.180615 68.157.168.82 -> 244.3.210.197 TCP 70 48859 > http [ACK] Seq=639 Ack=37495 Win=55936 Len=0 TSval=3043651477 TSecr=150406523
789432 256.403320 68.157.168.82 -> 244.3.210.197 TCP 70 48859 > http [ACK] Seq=941 Ack=38943 Win=64128 Len=0 TSval=3043656700 TSecr=150406576
789435 256.403457 68.157.168.82 -> 244.3.210.197 TCP 70 48859 > http [ACK] Seq=941 Ack=40391 Win=64128 Len=0 TSval=3043656700 TSecr=150406576
789436 256.403461 68.157.168.82 -> 244.3.210.197 TCP 70 48859 > http [ACK] Seq=941 Ack=40593 Win=63872 Len=0 TSval=3043656700 TSecr=150406576
803832 262.640691 68.157.168.82 -> 244.3.210.197 TCP 70 48859 > http [FIN, ACK] Seq=941 Ack=40593 Win=64128 Len=0 TSval=3043662937 TSecr=150406576
803980 262.683750 68.157.168.82 -> 244.3.210.197 TCP 70 48859 > http [ACK] Seq=942 Ack=40594 Win=64128 Len=0 TSval=3043662980 TSecr=150406638
838511 274.795549 68.157.168.82 -> 244.3.210.197 TCP 78 48926 > http [SYN] Seq=0 Win=5840 Len=0 MSS=1460 SACK_PERM=1 TSval=3043675091 TSecr=0 WS=64
838596 274.838544 68.157.168.82 -> 244.3.210.197 TCP 70 48926 > http [ACK] Seq=1 Ack=1 Win=5888 Len=0 TSval=3043675134 TSecr=0
839692 275.269746 68.157.168.82 -> 244.3.210.197 TCP 70 48926 > http [ACK] Seq=309 Ack=1449 Win=8768 Len=0 TSval=3043675565 TSecr=150406764
839702 275.270018 68.157.168.82 -> 244.3.210.197 TCP 70 48926 > http [ACK] Seq=309 Ack=2897 Win=11648 Len=0 TSval=3043675566 TSecr=150406764
839814 275.312651 68.157.168.82 -> 244.3.210.197 TCP 70 48926 > http [ACK] Seq=309 Ack=4345 Win=14528 Len=0 TSval=3043675608 TSecr=150406765
839815 275.312763 68.157.168.82 -> 244.3.210.197 TCP 70 48926 > http [ACK] Seq=309 Ack=5793 Win=17472 Len=0 TSval=3043675608 TSecr=150406765
839822 275.312834 68.157.168.82 -> 244.3.210.197 TCP 70 48926 > http [ACK] Seq=309 Ack=7241 Win=20352 Len=0 TSval=3043675608 TSecr=150406765
839827 275.312915 68.157.168.82 -> 244.3.210.197 TCP 70 48926 > http [ACK] Seq=309 Ack=8689 Win=23232 Len=0 TSval=3043675608 TSecr=150406765
839933 275.355423 68.157.168.82 -> 244.3.210.197 TCP 70 48926 > http [ACK] Seq=309 Ack=10137 Win=26112 Len=0 TSval=3043675651 TSecr=150406765
839940 275.355659 68.157.168.82 -> 244.3.210.197 TCP 70 48926 > http [ACK] Seq=309 Ack=11585 Win=29056 Len=0 TSval=3043675651 TSecr=150406765
839942 275.355680 68.157.168.82 -> 244.3.210.197 TCP 70 48926 > http [ACK] Seq=309 Ack=12526 Win=31936 Len=0 TSval=3043675651 TSecr=150406765
852122 281.590222 68.157.168.82 -> 244.3.210.197 TCP 70 48926 > http [FIN, ACK] Seq=309 Ack=12526 Win=31936 Len=0 TSval=3043681885 TSecr=150406765
852232 281.633129 68.157.168.82 -> 244.3.210.197 TCP 70 48926 > http [ACK] Seq=310 Ack=12527 Win=31936 Len=0 TSval=3043681928 TSecr=150406828
875789 290.031618 68.157.168.82 -> 244.3.210.197 TCP 78 33570 > http [SYN] Seq=0 Win=5840 Len=0 MSS=1460 SACK_PERM=1 TSval=3043690327 TSecr=0 WS=64
875966 290.074397 68.157.168.82 -> 244.3.210.197 TCP 70 33570 > http [ACK] Seq=1 Ack=1 Win=5888 Len=0 TSval=3043690369 TSecr=0
876602 290.409219 68.157.168.82 -> 244.3.210.197 TCP 70 33570 > http [ACK] Seq=351 Ack=1449 Win=8768 Len=0 TSval=3043690704 TSecr=150406916
876603 290.409223 68.157.168.82 -> 244.3.210.197 TCP 70 33570 > http [ACK] Seq=351 Ack=2897 Win=11648 Len=0 TSval=3043690704 TSecr=150406916
876681 290.452393 68.157.168.82 -> 244.3.210.197 TCP 70 33570 > http [ACK] Seq=351 Ack=4345 Win=14528 Len=0 TSval=3043690747 TSecr=150406916
876682 290.452398 68.157.168.82 -> 244.3.210.197 TCP 70 33570 > http [ACK] Seq=351 Ack=5793 Win=17472 Len=0 TSval=3043690747 TSecr=150406916
876683 290.452402 68.157.168.82 -> 244.3.210.197 TCP 70 33570 > http [ACK] Seq=351 Ack=7241 Win=20352 Len=0 TSval=3043690747 TSecr=150406916
876686 290.452514 68.157.168.82 -> 244.3.210.197 TCP 70 33570 > http [ACK] Seq=351 Ack=8689 Win=23232 Len=0 TSval=3043690747 TSecr=150406916
876732 290.495376 68.157.168.82 -> 244.3.210.197 TCP 70 33570 > http [ACK] Seq=351 Ack=10137 Win=26112 Len=0 TSval=3043690790 TSecr=150406917
876733 290.495381 68.157.168.82 -> 244.3.210.197 TCP 70 33570 > http [ACK] Seq=351 Ack=11585 Win=29056 Len=0 TSval=3043690790 TSecr=150406917
876734 290.495424 68.157.168.82 -> 244.3.210.197 TCP 70 33570 > http [ACK] Seq=351 Ack=13033 Win=31936 Len=0 TSval=3043690790 TSecr=150406917
876738 290.495516 68.157.168.82 -> 244.3.210.197 TCP 70 33570 > http [ACK] Seq=351 Ack=14481 Win=34816 Len=0 TSval=3043690790 TSecr=150406917
876739 290.495520 68.157.168.82 -> 244.3.210.197 TCP 70 33570 > http [ACK] Seq=351 Ack=15929 Win=37696 Len=0 TSval=3043690791 TSecr=150406917
876740 290.495524 68.157.168.82 -> 244.3.210.197 TCP 70 33570 > http [ACK] Seq=351 Ack=16752 Win=40640 Len=0 TSval=3043690791 TSecr=150406917
898800 297.062827 68.157.168.82 -> 244.3.210.197 TCP 70 33570 > http [FIN, ACK] Seq=351 Ack=16752 Win=40640 Len=0 TSval=3043697357 TSecr=150406917
899171 297.105441 68.157.168.82 -> 244.3.210.197 TCP 70 33570 > http [ACK] Seq=352 Ack=16753 Win=40640 Len=0 TSval=3043697400 TSecr=150406983
