71399  29.444060 68.157.168.38 -> 41.177.26.91 TCP 78 46163 > http [SYN] Seq=0 Win=5840 Len=0 MSS=1460 SACK_PERM=1 TSval=895343649 TSecr=0 WS=64
71524  29.487304 68.157.168.38 -> 41.177.26.91 TCP 70 46163 > http [ACK] Seq=1 Ack=1 Win=5888 Len=0 TSval=895343692 TSecr=1509548402
72282  29.632397 68.157.168.38 -> 41.177.26.91 TCP 70 46163 > http [ACK] Seq=255 Ack=1449 Win=8768 Len=0 TSval=895343837 TSecr=1509548417
72286  29.632669 68.157.168.38 -> 41.177.26.91 TCP 70 46163 > http [ACK] Seq=255 Ack=2897 Win=11648 Len=0 TSval=895343838 TSecr=1509548417
72289  29.632706 68.157.168.38 -> 41.177.26.91 TCP 70 46163 > http [ACK] Seq=255 Ack=4345 Win=14528 Len=0 TSval=895343838 TSecr=1509548417
72505  29.675229 68.157.168.38 -> 41.177.26.91 TCP 70 46163 > http [ACK] Seq=255 Ack=5793 Win=17472 Len=0 TSval=895343880 TSecr=1509548421
72506  29.675234 68.157.168.38 -> 41.177.26.91 TCP 70 46163 > http [ACK] Seq=255 Ack=7241 Win=20352 Len=0 TSval=895343880 TSecr=1509548421
72507  29.675238 68.157.168.38 -> 41.177.26.91 TCP 70 46163 > http [ACK] Seq=255 Ack=8689 Win=23232 Len=0 TSval=895343880 TSecr=1509548421
72508  29.675242 68.157.168.38 -> 41.177.26.91 TCP 70 46163 > http [ACK] Seq=255 Ack=10137 Win=26112 Len=0 TSval=895343880 TSecr=1509548421
72510  29.675354 68.157.168.38 -> 41.177.26.91 TCP 70 46163 > http [ACK] Seq=255 Ack=10889 Win=29056 Len=0 TSval=895343880 TSecr=1509548421
92520  35.418307 68.157.168.38 -> 41.177.26.91 TCP 70 46163 > http [FIN, ACK] Seq=255 Ack=10889 Win=29056 Len=0 TSval=895349623 TSecr=1509548421
92612  35.460895 68.157.168.38 -> 41.177.26.91 TCP 70 46163 > http [ACK] Seq=256 Ack=10890 Win=29056 Len=0 TSval=895349666 TSecr=1509549000
105742  38.145611 68.157.168.38 -> 41.177.26.176 TCP 78 60622 > http [SYN] Seq=0 Win=5840 Len=0 MSS=1460 SACK_PERM=1 TSval=895352350 TSecr=0 WS=64
105798  38.188658 68.157.168.38 -> 41.177.26.176 TCP 70 60622 > http [ACK] Seq=1 Ack=1 Win=5888 Len=0 TSval=895352393 TSecr=140345410
106961  38.530728 68.157.168.38 -> 41.177.26.176 TCP 70 60622 > http [ACK] Seq=320 Ack=785 Win=7424 Len=0 TSval=895352735 TSecr=140345445
106964  38.531035 68.157.168.38 -> 41.177.26.176 TCP 70 60622 > http [ACK] Seq=320 Ack=2233 Win=10304 Len=0 TSval=895352736 TSecr=140345445
106965  38.531040 68.157.168.38 -> 41.177.26.176 TCP 70 60622 > http [ACK] Seq=320 Ack=3681 Win=13248 Len=0 TSval=895352736 TSecr=140345445
106966  38.531105 68.157.168.38 -> 41.177.26.176 TCP 70 60622 > http [ACK] Seq=320 Ack=3892 Win=16128 Len=0 TSval=895352736 TSecr=140345445
107085  38.573726 68.157.168.38 -> 41.177.26.176 TCP 70 60622 > http [ACK] Seq=320 Ack=5340 Win=19008 Len=0 TSval=895352778 TSecr=140345449
107087  38.574028 68.157.168.38 -> 41.177.26.176 TCP 70 60622 > http [ACK] Seq=320 Ack=6062 Win=21888 Len=0 TSval=895352779 TSecr=140345449
107117  38.581469 68.157.168.38 -> 41.177.26.176 TCP 70 60622 > http [ACK] Seq=320 Ack=7510 Win=24832 Len=0 TSval=895352786 TSecr=140345450
107118  38.581475 68.157.168.38 -> 41.177.26.176 TCP 70 60622 > http [ACK] Seq=320 Ack=8081 Win=27712 Len=0 TSval=895352786 TSecr=140345450
107119  38.581479 68.157.168.38 -> 41.177.26.176 TCP 70 60622 > http [ACK] Seq=320 Ack=9529 Win=30592 Len=0 TSval=895352786 TSecr=140345450
107120  38.581505 68.157.168.38 -> 41.177.26.176 TCP 70 60622 > http [ACK] Seq=320 Ack=10977 Win=33472 Len=0 TSval=895352786 TSecr=140345450
107121  38.581533 68.157.168.38 -> 41.177.26.176 TCP 70 60622 > http [ACK] Seq=320 Ack=11178 Win=36416 Len=0 TSval=895352786 TSecr=140345450
107183  38.595920 68.157.168.38 -> 41.177.26.176 TCP 70 60622 > http [ACK] Seq=320 Ack=11183 Win=36416 Len=0 TSval=895352800 TSecr=140345451
116409  41.545518 68.157.168.38 -> 41.177.26.176 TCP 70 60622 > http [ACK] Seq=667 Ack=12631 Win=39296 Len=0 TSval=895355750 TSecr=140345746
116410  41.545584 68.157.168.38 -> 41.177.26.176 TCP 70 60622 > http [ACK] Seq=667 Ack=12658 Win=39296 Len=0 TSval=895355750 TSecr=140345746
116446  41.553052 68.157.168.38 -> 41.177.26.176 TCP 70 60622 > http [ACK] Seq=667 Ack=13285 Win=42176 Len=0 TSval=895355758 TSecr=140345747
116447  41.553084 68.157.168.38 -> 41.177.26.176 TCP 70 60622 > http [ACK] Seq=667 Ack=13469 Win=45056 Len=0 TSval=895355758 TSecr=140345747
116448  41.553089 68.157.168.38 -> 41.177.26.176 TCP 70 60622 > http [ACK] Seq=667 Ack=13653 Win=48000 Len=0 TSval=895355758 TSecr=140345747
116449  41.553163 68.157.168.38 -> 41.177.26.176 TCP 70 60622 > http [ACK] Seq=667 Ack=13744 Win=48000 Len=0 TSval=895355758 TSecr=140345747
116453  41.553331 68.157.168.38 -> 41.177.26.176 TCP 70 60622 > http [ACK] Seq=667 Ack=13931 Win=50880 Len=0 TSval=895355758 TSecr=140345747
116454  41.553336 68.157.168.38 -> 41.177.26.176 TCP 70 60622 > http [ACK] Seq=667 Ack=14587 Win=53760 Len=0 TSval=895355758 TSecr=140345747
116456  41.553675 68.157.168.38 -> 41.177.26.176 TCP 70 60622 > http [ACK] Seq=667 Ack=16035 Win=56640 Len=0 TSval=895355758 TSecr=140345747
116457  41.553747 68.157.168.38 -> 41.177.26.176 TCP 70 60622 > http [ACK] Seq=667 Ack=16213 Win=59584 Len=0 TSval=895355758 TSecr=140345747
116458  41.553933 68.157.168.38 -> 41.177.26.176 TCP 70 60622 > http [ACK] Seq=667 Ack=16349 Win=62464 Len=0 TSval=895355758 TSecr=140345747
116459  41.553938 68.157.168.38 -> 41.177.26.176 TCP 70 60622 > http [ACK] Seq=667 Ack=16401 Win=62464 Len=0 TSval=895355758 TSecr=140345747
116460  41.553941 68.157.168.38 -> 41.177.26.176 TCP 70 60622 > http [ACK] Seq=667 Ack=16448 Win=62464 Len=0 TSval=895355758 TSecr=140345747
116466  41.560064 68.157.168.38 -> 41.177.26.176 TCP 70 60622 > http [ACK] Seq=667 Ack=16537 Win=62464 Len=0 TSval=895355765 TSecr=140345748
116467  41.560068 68.157.168.38 -> 41.177.26.176 TCP 70 60622 > http [ACK] Seq=667 Ack=16742 Win=63744 Len=0 TSval=895355765 TSecr=140345748
116468  41.560205 68.157.168.38 -> 41.177.26.176 TCP 70 60622 > http [ACK] Seq=667 Ack=18190 Win=64128 Len=0 TSval=895355765 TSecr=140345748
116469  41.560348 68.157.168.38 -> 41.177.26.176 TCP 70 60622 > http [ACK] Seq=667 Ack=19638 Win=64128 Len=0 TSval=895355765 TSecr=140345748
116470  41.560435 68.157.168.38 -> 41.177.26.176 TCP 70 60622 > http [ACK] Seq=667 Ack=20488 Win=64128 Len=0 TSval=895355765 TSecr=140345748
116489  41.576068 68.157.168.38 -> 41.177.26.176 TCP 70 60622 > http [ACK] Seq=667 Ack=20493 Win=64128 Len=0 TSval=895355781 TSecr=140345749
134647  46.774039 68.157.168.38 -> 41.177.26.176 TCP 70 60622 > http [FIN, ACK] Seq=667 Ack=20493 Win=64128 Len=0 TSval=895360978 TSecr=140345749
134719  46.817217 68.157.168.38 -> 41.177.26.176 TCP 70 60622 > http [ACK] Seq=668 Ack=20494 Win=64128 Len=0 TSval=895361022 TSecr=140346273
199838  68.809586 68.157.168.38 -> 41.177.26.91 TCP 78 41652 > http [SYN] Seq=0 Win=5840 Len=0 MSS=1460 SACK_PERM=1 TSval=895383013 TSecr=0 WS=64
199912  68.853141 68.157.168.38 -> 41.177.26.91 TCP 70 41652 > http [ACK] Seq=1 Ack=1 Win=5888 Len=0 TSval=895383057 TSecr=1509552339
200173  68.997216 68.157.168.38 -> 41.177.26.91 TCP 70 41652 > http [ACK] Seq=255 Ack=1449 Win=8768 Len=0 TSval=895383201 TSecr=1509552353
200174  68.997222 68.157.168.38 -> 41.177.26.91 TCP 70 41652 > http [ACK] Seq=255 Ack=2897 Win=11648 Len=0 TSval=895383201 TSecr=1509552353
200175  68.997422 68.157.168.38 -> 41.177.26.91 TCP 70 41652 > http [ACK] Seq=255 Ack=4345 Win=14528 Len=0 TSval=895383201 TSecr=1509552353
200251  69.040177 68.157.168.38 -> 41.177.26.91 TCP 70 41652 > http [ACK] Seq=255 Ack=5793 Win=17472 Len=0 TSval=895383244 TSecr=1509552358
200252  69.040181 68.157.168.38 -> 41.177.26.91 TCP 70 41652 > http [ACK] Seq=255 Ack=7241 Win=20352 Len=0 TSval=895383244 TSecr=1509552358
200253  69.040199 68.157.168.38 -> 41.177.26.91 TCP 70 41652 > http [ACK] Seq=255 Ack=8689 Win=23232 Len=0 TSval=895383244 TSecr=1509552358
200254  69.040334 68.157.168.38 -> 41.177.26.91 TCP 70 41652 > http [ACK] Seq=255 Ack=10137 Win=26112 Len=0 TSval=895383244 TSecr=1509552358
200255  69.040339 68.157.168.38 -> 41.177.26.91 TCP 70 41652 > http [ACK] Seq=255 Ack=10923 Win=29056 Len=0 TSval=895383244 TSecr=1509552358
219033  74.754825 68.157.168.38 -> 41.177.26.91 TCP 70 41652 > http [FIN, ACK] Seq=255 Ack=10923 Win=29056 Len=0 TSval=895388958 TSecr=1509552358
219094  74.798680 68.157.168.38 -> 41.177.26.91 TCP 70 41652 > http [ACK] Seq=256 Ack=10924 Win=29056 Len=0 TSval=895389002 TSecr=1509552933
525618 170.710117 68.157.168.38 -> 41.177.26.91 TCP 78 50213 > http [SYN] Seq=0 Win=5840 Len=0 MSS=1460 SACK_PERM=1 TSval=895484910 TSecr=0 WS=64
525665 170.754014 68.157.168.38 -> 41.177.26.91 TCP 70 50213 > http [ACK] Seq=1 Ack=1 Win=5888 Len=0 TSval=895484954 TSecr=1509562529
526000 170.907150 68.157.168.38 -> 41.177.26.91 TCP 70 50213 > http [ACK] Seq=255 Ack=1449 Win=8768 Len=0 TSval=895485107 TSecr=1509562544
526001 170.907154 68.157.168.38 -> 41.177.26.91 TCP 70 50213 > http [ACK] Seq=255 Ack=2897 Win=11648 Len=0 TSval=895485107 TSecr=1509562544
526002 170.907159 68.157.168.38 -> 41.177.26.91 TCP 70 50213 > http [ACK] Seq=255 Ack=4345 Win=14528 Len=0 TSval=895485107 TSecr=1509562544
526059 170.949604 68.157.168.38 -> 41.177.26.91 TCP 70 50213 > http [ACK] Seq=255 Ack=5793 Win=17472 Len=0 TSval=895485150 TSecr=1509562549
526061 170.949689 68.157.168.38 -> 41.177.26.91 TCP 70 50213 > http [ACK] Seq=255 Ack=7241 Win=20352 Len=0 TSval=895485150 TSecr=1509562549
526062 170.949695 68.157.168.38 -> 41.177.26.91 TCP 70 50213 > http [ACK] Seq=255 Ack=8689 Win=23232 Len=0 TSval=895485150 TSecr=1509562549
526063 170.949698 68.157.168.38 -> 41.177.26.91 TCP 70 50213 > http [ACK] Seq=255 Ack=10137 Win=26112 Len=0 TSval=895485150 TSecr=1509562549
526064 170.949703 68.157.168.38 -> 41.177.26.91 TCP 70 50213 > http [ACK] Seq=255 Ack=10816 Win=29056 Len=0 TSval=895485150 TSecr=1509562549
546640 176.744604 68.157.168.38 -> 41.177.26.91 TCP 70 50213 > http [FIN, ACK] Seq=255 Ack=10816 Win=29056 Len=0 TSval=895490945 TSecr=1509562549
546969 176.787330 68.157.168.38 -> 41.177.26.91 TCP 70 50213 > http [ACK] Seq=256 Ack=10817 Win=29056 Len=0 TSval=895490987 TSecr=1509563132
721408 230.293319 68.157.168.38 -> 41.177.26.176 TCP 78 38114 > http [SYN] Seq=0 Win=5840 Len=0 MSS=1460 SACK_PERM=1 TSval=895544492 TSecr=0 WS=64
721469 230.335766 68.157.168.38 -> 41.177.26.176 TCP 70 38114 > http [ACK] Seq=1 Ack=1 Win=5888 Len=0 TSval=895544535 TSecr=140364625
723930 231.627077 68.157.168.38 -> 41.177.26.176 TCP 70 38114 > http [ACK] Seq=336 Ack=1449 Win=8768 Len=0 TSval=895545826 TSecr=140364754
723931 231.627176 68.157.168.38 -> 41.177.26.176 TCP 70 38114 > http [ACK] Seq=336 Ack=1579 Win=11648 Len=0 TSval=895545826 TSecr=140364754
723959 231.636228 68.157.168.38 -> 41.177.26.176 TCP 70 38114 > http [ACK] Seq=336 Ack=2214 Win=14528 Len=0 TSval=895545835 TSecr=140364755
723960 231.636233 68.157.168.38 -> 41.177.26.176 TCP 70 38114 > http [ACK] Seq=336 Ack=2439 Win=17472 Len=0 TSval=895545835 TSecr=140364755
723961 231.636237 68.157.168.38 -> 41.177.26.176 TCP 70 38114 > http [ACK] Seq=336 Ack=2664 Win=20352 Len=0 TSval=895545835 TSecr=140364755
723964 231.636392 68.157.168.38 -> 41.177.26.176 TCP 70 38114 > http [ACK] Seq=336 Ack=2889 Win=23232 Len=0 TSval=895545835 TSecr=140364755
723967 231.636736 68.157.168.38 -> 41.177.26.176 TCP 70 38114 > http [ACK] Seq=336 Ack=2982 Win=23232 Len=0 TSval=895545836 TSecr=140364755
723968 231.636741 68.157.168.38 -> 41.177.26.176 TCP 70 38114 > http [ACK] Seq=336 Ack=3893 Win=26112 Len=0 TSval=895545836 TSecr=140364755
723988 231.669686 68.157.168.38 -> 41.177.26.176 TCP 70 38114 > http [ACK] Seq=336 Ack=5341 Win=29056 Len=0 TSval=895545869 TSecr=140364759
723989 231.669770 68.157.168.38 -> 41.177.26.176 TCP 70 38114 > http [ACK] Seq=336 Ack=6717 Win=31936 Len=0 TSval=895545869 TSecr=140364759
723990 231.669792 68.157.168.38 -> 41.177.26.176 TCP 70 38114 > http [ACK] Seq=336 Ack=8165 Win=34816 Len=0 TSval=895545869 TSecr=140364759
724006 231.678786 68.157.168.38 -> 41.177.26.176 TCP 70 38114 > http [ACK] Seq=336 Ack=9613 Win=37696 Len=0 TSval=895545878 TSecr=140364760
724007 231.679061 68.157.168.38 -> 41.177.26.176 TCP 70 38114 > http [ACK] Seq=336 Ack=10778 Win=40640 Len=0 TSval=895545878 TSecr=140364760
736729 235.587580 68.157.168.38 -> 41.177.26.176 TCP 70 38114 > http [ACK] Seq=682 Ack=12226 Win=43520 Len=0 TSval=895549786 TSecr=140365150
736730 235.587584 68.157.168.38 -> 41.177.26.176 TCP 70 38114 > http [ACK] Seq=682 Ack=12338 Win=43520 Len=0 TSval=895549786 TSecr=140365150
736753 235.597795 68.157.168.38 -> 41.177.26.176 TCP 70 38114 > http [ACK] Seq=682 Ack=13095 Win=46400 Len=0 TSval=895549797 TSecr=140365151
736754 235.597950 68.157.168.38 -> 41.177.26.176 TCP 70 38114 > http [ACK] Seq=682 Ack=13278 Win=49280 Len=0 TSval=895549797 TSecr=140365151
736755 235.597955 68.157.168.38 -> 41.177.26.176 TCP 70 38114 > http [ACK] Seq=682 Ack=13369 Win=49280 Len=0 TSval=895549797 TSecr=140365151
736756 235.597959 68.157.168.38 -> 41.177.26.176 TCP 70 38114 > http [ACK] Seq=682 Ack=13552 Win=52224 Len=0 TSval=895549797 TSecr=140365151
736757 235.598257 68.157.168.38 -> 41.177.26.176 TCP 70 38114 > http [ACK] Seq=682 Ack=13738 Win=55104 Len=0 TSval=895549797 TSecr=140365151
736758 235.598262 68.157.168.38 -> 41.177.26.176 TCP 70 38114 > http [ACK] Seq=682 Ack=14395 Win=57984 Len=0 TSval=895549797 TSecr=140365152
736764 235.598811 68.157.168.38 -> 41.177.26.176 TCP 70 38114 > http [ACK] Seq=682 Ack=15843 Win=60864 Len=0 TSval=895549798 TSecr=140365152
736765 235.598815 68.157.168.38 -> 41.177.26.176 TCP 70 38114 > http [ACK] Seq=682 Ack=16110 Win=62656 Len=0 TSval=895549798 TSecr=140365152
736766 235.598820 68.157.168.38 -> 41.177.26.176 TCP 70 38114 > http [ACK] Seq=682 Ack=16380 Win=62336 Len=0 TSval=895549798 TSecr=140365152
736767 235.598824 68.157.168.38 -> 41.177.26.176 TCP 70 38114 > http [ACK] Seq=682 Ack=16404 Win=62336 Len=0 TSval=895549798 TSecr=140365152
736768 235.598828 68.157.168.38 -> 41.177.26.176 TCP 70 38114 > http [ACK] Seq=682 Ack=16493 Win=62272 Len=0 TSval=895549798 TSecr=140365152
736964 235.610482 68.157.168.38 -> 41.177.26.176 TCP 70 38114 > http [ACK] Seq=682 Ack=16627 Win=64128 Len=0 TSval=895549809 TSecr=140365153
736966 235.610899 68.157.168.38 -> 41.177.26.176 TCP 70 38114 > http [ACK] Seq=682 Ack=16789 Win=64128 Len=0 TSval=895549810 TSecr=140365153
736968 235.611034 68.157.168.38 -> 41.177.26.176 TCP 70 38114 > http [ACK] Seq=682 Ack=18237 Win=64128 Len=0 TSval=895549810 TSecr=140365153
736969 235.611039 68.157.168.38 -> 41.177.26.176 TCP 70 38114 > http [ACK] Seq=682 Ack=19685 Win=62656 Len=0 TSval=895549810 TSecr=140365153
736970 235.611152 68.157.168.38 -> 41.177.26.176 TCP 70 38114 > http [ACK] Seq=682 Ack=20631 Win=64128 Len=0 TSval=895549810 TSecr=140365153
737060 235.630301 68.157.168.38 -> 41.177.26.176 TCP 70 38114 > http [ACK] Seq=682 Ack=20636 Win=64128 Len=0 TSval=895549829 TSecr=140365155
746517 238.712200 68.157.168.38 -> 41.177.26.176 TCP 70 38114 > http [ACK] Seq=1010 Ack=22084 Win=64128 Len=0 TSval=895552911 TSecr=140365463
746518 238.712205 68.157.168.38 -> 41.177.26.176 TCP 70 38114 > http [ACK] Seq=1010 Ack=22155 Win=64000 Len=0 TSval=895552911 TSecr=140365463
746547 238.736070 68.157.168.38 -> 41.177.26.176 TCP 70 38114 > http [ACK] Seq=1010 Ack=22915 Win=64128 Len=0 TSval=895552935 TSecr=140365465
746549 238.736182 68.157.168.38 -> 41.177.26.176 TCP 70 38114 > http [ACK] Seq=1010 Ack=23134 Win=64128 Len=0 TSval=895552935 TSecr=140365465
746550 238.736187 68.157.168.38 -> 41.177.26.176 TCP 70 38114 > http [ACK] Seq=1010 Ack=23353 Win=63872 Len=0 TSval=895552935 TSecr=140365465
746551 238.736212 68.157.168.38 -> 41.177.26.176 TCP 70 38114 > http [ACK] Seq=1010 Ack=23444 Win=63808 Len=0 TSval=895552935 TSecr=140365465
746552 238.736216 68.157.168.38 -> 41.177.26.176 TCP 70 38114 > http [ACK] Seq=1010 Ack=23666 Win=63552 Len=0 TSval=895552935 TSecr=140365465
746555 238.736616 68.157.168.38 -> 41.177.26.176 TCP 70 38114 > http [ACK] Seq=1010 Ack=24378 Win=64128 Len=0 TSval=895552935 TSecr=140365465
746556 238.736844 68.157.168.38 -> 41.177.26.176 TCP 70 38114 > http [ACK] Seq=1010 Ack=25826 Win=64128 Len=0 TSval=895552935 TSecr=140365465
746583 238.754715 68.157.168.38 -> 41.177.26.176 TCP 70 38114 > http [ACK] Seq=1010 Ack=26710 Win=64128 Len=0 TSval=895552953 TSecr=140365467
746584 238.755067 68.157.168.38 -> 41.177.26.176 TCP 70 38114 > http [ACK] Seq=1010 Ack=26845 Win=64128 Len=0 TSval=895552954 TSecr=140365467
746585 238.755098 68.157.168.38 -> 41.177.26.176 TCP 70 38114 > http [ACK] Seq=1010 Ack=28293 Win=63744 Len=0 TSval=895552954 TSecr=140365467
746586 238.755232 68.157.168.38 -> 41.177.26.176 TCP 70 38114 > http [ACK] Seq=1010 Ack=29741 Win=64128 Len=0 TSval=895552954 TSecr=140365467
746607 238.778411 68.157.168.38 -> 41.177.26.176 TCP 70 38114 > http [ACK] Seq=1010 Ack=31072 Win=64128 Len=0 TSval=895552977 TSecr=140365470
753003 241.643217 68.157.168.38 -> 41.177.26.176 TCP 70 38114 > http [ACK] Seq=1340 Ack=32520 Win=64128 Len=0 TSval=895555842 TSecr=140365756
753004 241.643222 68.157.168.38 -> 41.177.26.176 TCP 70 38114 > http [ACK] Seq=1340 Ack=32541 Win=64064 Len=0 TSval=895555842 TSecr=140365756
753029 241.654381 68.157.168.38 -> 41.177.26.176 TCP 70 38114 > http [ACK] Seq=1340 Ack=33212 Win=64128 Len=0 TSval=895555853 TSecr=140365757
753032 241.654525 68.157.168.38 -> 41.177.26.176 TCP 70 38114 > http [ACK] Seq=1340 Ack=33433 Win=64128 Len=0 TSval=895555853 TSecr=140365757
753033 241.654529 68.157.168.38 -> 41.177.26.176 TCP 70 38114 > http [ACK] Seq=1340 Ack=33654 Win=63872 Len=0 TSval=895555853 TSecr=140365757
753034 241.654533 68.157.168.38 -> 41.177.26.176 TCP 70 38114 > http [ACK] Seq=1340 Ack=33745 Win=63808 Len=0 TSval=895555853 TSecr=140365757
753035 241.654609 68.157.168.38 -> 41.177.26.176 TCP 70 38114 > http [ACK] Seq=1340 Ack=33969 Win=64128 Len=0 TSval=895555853 TSecr=140365757
753036 241.654650 68.157.168.38 -> 41.177.26.176 TCP 70 38114 > http [ACK] Seq=1340 Ack=34476 Win=63616 Len=0 TSval=895555853 TSecr=140365757
753039 241.655143 68.157.168.38 -> 41.177.26.176 TCP 70 38114 > http [ACK] Seq=1340 Ack=35924 Win=64128 Len=0 TSval=895555854 TSecr=140365757
753040 241.655148 68.157.168.38 -> 41.177.26.176 TCP 70 38114 > http [ACK] Seq=1340 Ack=36405 Win=63616 Len=0 TSval=895555854 TSecr=140365757
753041 241.655152 68.157.168.38 -> 41.177.26.176 TCP 70 38114 > http [ACK] Seq=1340 Ack=36583 Win=63424 Len=0 TSval=895555854 TSecr=140365757
753042 241.655156 68.157.168.38 -> 41.177.26.176 TCP 70 38114 > http [ACK] Seq=1340 Ack=36606 Win=63424 Len=0 TSval=895555854 TSecr=140365757
753043 241.655160 68.157.168.38 -> 41.177.26.176 TCP 70 38114 > http [ACK] Seq=1340 Ack=36642 Win=63360 Len=0 TSval=895555854 TSecr=140365757
753044 241.655226 68.157.168.38 -> 41.177.26.176 TCP 70 38114 > http [ACK] Seq=1340 Ack=36721 Win=64128 Len=0 TSval=895555854 TSecr=140365757
753062 241.663892 68.157.168.38 -> 41.177.26.176 TCP 70 38114 > http [ACK] Seq=1340 Ack=36810 Win=64128 Len=0 TSval=895555862 TSecr=140365758
753102 241.685748 68.157.168.38 -> 41.177.26.176 TCP 70 38114 > http [ACK] Seq=1340 Ack=37028 Win=64128 Len=0 TSval=895555884 TSecr=140365760
753103 241.686003 68.157.168.38 -> 41.177.26.176 TCP 70 38114 > http [ACK] Seq=1340 Ack=41097 Win=61248 Len=0 TSval=895555885 TSecr=140365760
766584 247.809767 68.157.168.38 -> 41.177.26.176 TCP 70 38114 > http [FIN, ACK] Seq=1340 Ack=41097 Win=64128 Len=0 TSval=895562008 TSecr=140365760
766709 247.852573 68.157.168.38 -> 41.177.26.176 TCP 70 38114 > http [ACK] Seq=1341 Ack=41098 Win=64128 Len=0 TSval=895562051 TSecr=140366377
