189633  64.920102 68.157.168.204 -> 41.177.26.176 TCP 78 44061 > http [SYN] Seq=0 Win=5840 Len=0 MSS=1460 SACK_PERM=1 TSval=53203013 TSecr=0 WS=64
189695  64.962607 68.157.168.204 -> 41.177.26.176 TCP 70 44061 > http [ACK] Seq=1 Ack=1 Win=5888 Len=0 TSval=53203056 TSecr=140348088
190320  65.359721 68.157.168.204 -> 41.177.26.176 TCP 70 44061 > http [ACK] Seq=320 Ack=785 Win=7424 Len=0 TSval=53203453 TSecr=140348128
190321  65.359782 68.157.168.204 -> 41.177.26.176 TCP 70 44061 > http [ACK] Seq=320 Ack=2233 Win=10304 Len=0 TSval=53203453 TSecr=140348128
190322  65.360059 68.157.168.204 -> 41.177.26.176 TCP 70 44061 > http [ACK] Seq=320 Ack=3118 Win=13248 Len=0 TSval=53203453 TSecr=140348128
190324  65.360223 68.157.168.204 -> 41.177.26.176 TCP 70 44061 > http [ACK] Seq=320 Ack=3903 Win=16128 Len=0 TSval=53203453 TSecr=140348128
190395  65.402390 68.157.168.204 -> 41.177.26.176 TCP 70 44061 > http [ACK] Seq=320 Ack=5351 Win=19008 Len=0 TSval=53203495 TSecr=140348132
190396  65.402395 68.157.168.204 -> 41.177.26.176 TCP 70 44061 > http [ACK] Seq=320 Ack=6077 Win=21888 Len=0 TSval=53203496 TSecr=140348132
190397  65.402454 68.157.168.204 -> 41.177.26.176 TCP 70 44061 > http [ACK] Seq=320 Ack=7525 Win=24832 Len=0 TSval=53203496 TSecr=140348132
190398  65.402459 68.157.168.204 -> 41.177.26.176 TCP 70 44061 > http [ACK] Seq=320 Ack=7892 Win=27712 Len=0 TSval=53203496 TSecr=140348132
190399  65.402463 68.157.168.204 -> 41.177.26.176 TCP 70 44061 > http [ACK] Seq=320 Ack=9340 Win=30592 Len=0 TSval=53203496 TSecr=140348132
190400  65.402466 68.157.168.204 -> 41.177.26.176 TCP 70 44061 > http [ACK] Seq=320 Ack=10515 Win=33472 Len=0 TSval=53203496 TSecr=140348132
190401  65.402471 68.157.168.204 -> 41.177.26.176 TCP 70 44061 > http [ACK] Seq=320 Ack=11192 Win=36416 Len=0 TSval=53203496 TSecr=140348132
190444  65.422696 68.157.168.204 -> 41.177.26.176 TCP 70 44061 > http [ACK] Seq=320 Ack=11197 Win=36416 Len=0 TSval=53203516 TSecr=140348134
199978  68.882433 68.157.168.204 -> 41.177.26.176 TCP 70 44061 > http [ACK] Seq=638 Ack=12645 Win=39296 Len=0 TSval=53206975 TSecr=140348480
199979  68.882438 68.157.168.204 -> 41.177.26.176 TCP 70 44061 > http [ACK] Seq=638 Ack=13627 Win=42176 Len=0 TSval=53206975 TSecr=140348480
199980  68.882442 68.157.168.204 -> 41.177.26.176 TCP 70 44061 > http [ACK] Seq=638 Ack=15075 Win=45056 Len=0 TSval=53206975 TSecr=140348480
199981  68.882474 68.157.168.204 -> 41.177.26.176 TCP 70 44061 > http [ACK] Seq=638 Ack=15089 Win=45056 Len=0 TSval=53206975 TSecr=140348480
199982  68.882649 68.157.168.204 -> 41.177.26.176 TCP 70 44061 > http [ACK] Seq=638 Ack=16537 Win=48000 Len=0 TSval=53206976 TSecr=140348480
199983  68.882822 68.157.168.204 -> 41.177.26.176 TCP 70 44061 > http [ACK] Seq=638 Ack=17253 Win=50880 Len=0 TSval=53206976 TSecr=140348480
200033  68.922348 68.157.168.204 -> 41.177.26.176 TCP 70 44061 > http [ACK] Seq=638 Ack=18701 Win=53760 Len=0 TSval=53207015 TSecr=140348484
200034  68.922353 68.157.168.204 -> 41.177.26.176 TCP 70 44061 > http [ACK] Seq=638 Ack=19091 Win=56640 Len=0 TSval=53207015 TSecr=140348484
200035  68.922374 68.157.168.204 -> 41.177.26.176 TCP 70 44061 > http [ACK] Seq=638 Ack=20539 Win=59584 Len=0 TSval=53207015 TSecr=140348484
200036  68.922469 68.157.168.204 -> 41.177.26.176 TCP 70 44061 > http [ACK] Seq=638 Ack=21680 Win=62464 Len=0 TSval=53207016 TSecr=140348484
200037  68.922552 68.157.168.204 -> 41.177.26.176 TCP 70 44061 > http [ACK] Seq=638 Ack=22357 Win=62656 Len=0 TSval=53207016 TSecr=140348484
200051  68.932378 68.157.168.204 -> 41.177.26.176 TCP 70 44061 > http [ACK] Seq=638 Ack=22362 Win=64128 Len=0 TSval=53207025 TSecr=140348485
217448  74.234593 68.157.168.204 -> 41.177.26.176 TCP 70 44061 > http [ACK] Seq=968 Ack=23810 Win=64128 Len=0 TSval=53212327 TSecr=140349015
217459  74.234795 68.157.168.204 -> 41.177.26.176 TCP 70 44061 > http [ACK] Seq=968 Ack=24067 Win=64128 Len=0 TSval=53212328 TSecr=140349015
217570  74.259996 68.157.168.204 -> 41.177.26.176 TCP 70 44061 > http [ACK] Seq=968 Ack=24827 Win=64128 Len=0 TSval=53212353 TSecr=140349018
217573  74.260309 68.157.168.204 -> 41.177.26.176 TCP 70 44061 > http [ACK] Seq=968 Ack=25048 Win=64128 Len=0 TSval=53212353 TSecr=140349018
217574  74.260314 68.157.168.204 -> 41.177.26.176 TCP 70 44061 > http [ACK] Seq=968 Ack=25269 Win=63872 Len=0 TSval=53212353 TSecr=140349018
217575  74.260318 68.157.168.204 -> 41.177.26.176 TCP 70 44061 > http [ACK] Seq=968 Ack=25360 Win=63808 Len=0 TSval=53212353 TSecr=140349018
217576  74.260322 68.157.168.204 -> 41.177.26.176 TCP 70 44061 > http [ACK] Seq=968 Ack=25584 Win=63552 Len=0 TSval=53212353 TSecr=140349018
217577  74.260597 68.157.168.204 -> 41.177.26.176 TCP 70 44061 > http [ACK] Seq=968 Ack=26313 Win=64128 Len=0 TSval=53212353 TSecr=140349018
217580  74.260856 68.157.168.204 -> 41.177.26.176 TCP 70 44061 > http [ACK] Seq=968 Ack=27761 Win=64128 Len=0 TSval=53212354 TSecr=140349018
217636  74.276954 68.157.168.204 -> 41.177.26.176 TCP 70 44061 > http [ACK] Seq=968 Ack=28816 Win=64128 Len=0 TSval=53212370 TSecr=140349019
217637  74.277174 68.157.168.204 -> 41.177.26.176 TCP 70 44061 > http [ACK] Seq=968 Ack=28887 Win=64128 Len=0 TSval=53212370 TSecr=140349019
217638  74.277241 68.157.168.204 -> 41.177.26.176 TCP 70 44061 > http [ACK] Seq=968 Ack=28925 Win=64128 Len=0 TSval=53212370 TSecr=140349019
217654  74.284760 68.157.168.204 -> 41.177.26.176 TCP 70 44061 > http [ACK] Seq=968 Ack=29014 Win=64128 Len=0 TSval=53212377 TSecr=140349020
217655  74.284764 68.157.168.204 -> 41.177.26.176 TCP 70 44061 > http [ACK] Seq=968 Ack=29236 Win=63872 Len=0 TSval=53212377 TSecr=140349020
217657  74.284954 68.157.168.204 -> 41.177.26.176 TCP 70 44061 > http [ACK] Seq=968 Ack=30684 Win=64128 Len=0 TSval=53212378 TSecr=140349020
217658  74.285069 68.157.168.204 -> 41.177.26.176 TCP 70 44061 > http [ACK] Seq=968 Ack=32132 Win=64128 Len=0 TSval=53212378 TSecr=140349020
217685  74.302277 68.157.168.204 -> 41.177.26.176 TCP 70 44061 > http [ACK] Seq=968 Ack=33259 Win=64128 Len=0 TSval=53212395 TSecr=140349022
217688  74.302986 68.157.168.204 -> 41.177.26.176 TCP 70 44061 > http [ACK] Seq=968 Ack=33264 Win=64128 Len=0 TSval=53212396 TSecr=140349022
227802  78.073212 68.157.168.204 -> 41.177.26.176 TCP 70 44061 > http [ACK] Seq=1301 Ack=34712 Win=64128 Len=0 TSval=53216166 TSecr=140349399
227803  78.073218 68.157.168.204 -> 41.177.26.176 TCP 70 44061 > http [ACK] Seq=1301 Ack=34859 Win=63936 Len=0 TSval=53216166 TSecr=140349399
227809  78.083678 68.157.168.204 -> 41.177.26.176 TCP 70 44061 > http [ACK] Seq=1301 Ack=35494 Win=64128 Len=0 TSval=53216176 TSecr=140349400
227810  78.083682 68.157.168.204 -> 41.177.26.176 TCP 70 44061 > http [ACK] Seq=1301 Ack=35717 Win=63872 Len=0 TSval=53216176 TSecr=140349400
227812  78.084184 68.157.168.204 -> 41.177.26.176 TCP 70 44061 > http [ACK] Seq=1301 Ack=35940 Win=64128 Len=0 TSval=53216177 TSecr=140349400
227813  78.084189 68.157.168.204 -> 41.177.26.176 TCP 70 44061 > http [ACK] Seq=1301 Ack=37146 Win=62912 Len=0 TSval=53216177 TSecr=140349400
227814  78.084407 68.157.168.204 -> 41.177.26.176 TCP 70 44061 > http [ACK] Seq=1301 Ack=38594 Win=64128 Len=0 TSval=53216177 TSecr=140349400
227875  78.115580 68.157.168.204 -> 41.177.26.176 TCP 70 44061 > http [ACK] Seq=1301 Ack=39974 Win=64128 Len=0 TSval=53216208 TSecr=140349403
227876  78.115678 68.157.168.204 -> 41.177.26.176 TCP 70 44061 > http [ACK] Seq=1301 Ack=41422 Win=64128 Len=0 TSval=53216208 TSecr=140349403
227877  78.115847 68.157.168.204 -> 41.177.26.176 TCP 70 44061 > http [ACK] Seq=1301 Ack=42870 Win=64128 Len=0 TSval=53216208 TSecr=140349403
227878  78.125785 68.157.168.204 -> 41.177.26.176 TCP 70 44061 > http [ACK] Seq=1301 Ack=44025 Win=64128 Len=0 TSval=53216218 TSecr=140349404
229535  78.951409 68.157.168.204 -> 41.177.26.176 TCP 70 44061 > http [ACK] Seq=1691 Ack=45571 Win=63744 Len=0 TSval=53217044 TSecr=140349487
229570  78.961647 68.157.168.204 -> 41.177.26.176 TCP 70 44061 > http [ACK] Seq=1691 Ack=47750 Win=64128 Len=0 TSval=53217054 TSecr=140349488
229573  78.962210 68.157.168.204 -> 41.177.26.176 TCP 70 44061 > http [ACK] Seq=1691 Ack=49761 Win=62080 Len=0 TSval=53217055 TSecr=140349488
229610  78.993960 68.157.168.204 -> 41.177.26.176 TCP 70 44061 > http [ACK] Seq=1691 Ack=50200 Win=64128 Len=0 TSval=53217087 TSecr=140349488
229646  79.003736 68.157.168.204 -> 41.177.26.176 TCP 70 44061 > http [ACK] Seq=1691 Ack=53096 Win=64128 Len=0 TSval=53217096 TSecr=140349491
229706  79.045341 68.157.168.204 -> 41.177.26.176 TCP 70 44061 > http [ACK] Seq=1691 Ack=54163 Win=64128 Len=0 TSval=53217138 TSecr=140349492
243230  84.664664 68.157.168.204 -> 41.177.26.176 TCP 70 44061 > http [FIN, ACK] Seq=1691 Ack=54163 Win=64128 Len=0 TSval=53222757 TSecr=140349492
243295  84.706919 68.157.168.204 -> 41.177.26.176 TCP 70 44061 > http [ACK] Seq=1692 Ack=54164 Win=64128 Len=0 TSval=53222799 TSecr=140350062
246368  86.265314 68.157.168.204 -> 41.177.26.176 TCP 78 33117 > http [SYN] Seq=0 Win=5840 Len=0 MSS=1460 SACK_PERM=1 TSval=53224358 TSecr=0 WS=64
246424  86.307938 68.157.168.204 -> 41.177.26.176 TCP 70 33117 > http [ACK] Seq=1 Ack=1 Win=5888 Len=0 TSval=53224400 TSecr=140350222
249628  88.049878 68.157.168.204 -> 41.177.26.176 TCP 70 33117 > http [ACK] Seq=395 Ack=1449 Win=8768 Len=0 TSval=53226142 TSecr=140350397
249629  88.049883 68.157.168.204 -> 41.177.26.176 TCP 70 33117 > http [ACK] Seq=395 Ack=1492 Win=8768 Len=0 TSval=53226142 TSecr=140350397
249640  88.061296 68.157.168.204 -> 41.177.26.176 TCP 70 33117 > http [ACK] Seq=395 Ack=2157 Win=11648 Len=0 TSval=53226154 TSecr=140350398
249641  88.061816 68.157.168.204 -> 41.177.26.176 TCP 70 33117 > http [ACK] Seq=395 Ack=2392 Win=14528 Len=0 TSval=53226154 TSecr=140350398
249642  88.061821 68.157.168.204 -> 41.177.26.176 TCP 70 33117 > http [ACK] Seq=395 Ack=2718 Win=17472 Len=0 TSval=53226154 TSecr=140350398
249643  88.061877 68.157.168.204 -> 41.177.26.176 TCP 70 33117 > http [ACK] Seq=395 Ack=2956 Win=20352 Len=0 TSval=53226154 TSecr=140350398
249644  88.062146 68.157.168.204 -> 41.177.26.176 TCP 70 33117 > http [ACK] Seq=395 Ack=4404 Win=23232 Len=0 TSval=53226154 TSecr=140350398
249645  88.062151 68.157.168.204 -> 41.177.26.176 TCP 70 33117 > http [ACK] Seq=395 Ack=5584 Win=26112 Len=0 TSval=53226154 TSecr=140350398
249646  88.062200 68.157.168.204 -> 41.177.26.176 TCP 70 33117 > http [ACK] Seq=395 Ack=5600 Win=26112 Len=0 TSval=53226154 TSecr=140350398
249647  88.062419 68.157.168.204 -> 41.177.26.176 TCP 70 33117 > http [ACK] Seq=395 Ack=5636 Win=26112 Len=0 TSval=53226155 TSecr=140350398
249648  88.062502 68.157.168.204 -> 41.177.26.176 TCP 70 33117 > http [ACK] Seq=395 Ack=5749 Win=26112 Len=0 TSval=53226155 TSecr=140350398
249729  88.092497 68.157.168.204 -> 41.177.26.176 TCP 70 33117 > http [ACK] Seq=395 Ack=6040 Win=29056 Len=0 TSval=53226185 TSecr=140350401
249730  88.092621 68.157.168.204 -> 41.177.26.176 TCP 70 33117 > http [ACK] Seq=395 Ack=7488 Win=31936 Len=0 TSval=53226185 TSecr=140350401
249731  88.092646 68.157.168.204 -> 41.177.26.176 TCP 70 33117 > http [ACK] Seq=395 Ack=8936 Win=34816 Len=0 TSval=53226185 TSecr=140350401
249732  88.092650 68.157.168.204 -> 41.177.26.176 TCP 70 33117 > http [ACK] Seq=395 Ack=10169 Win=37696 Len=0 TSval=53226185 TSecr=140350401
249736  88.094478 68.157.168.204 -> 41.177.26.176 TCP 70 33117 > http [ACK] Seq=395 Ack=10174 Win=37696 Len=0 TSval=53226187 TSecr=140350401
251653  89.001913 68.157.168.204 -> 41.177.26.176 TCP 70 33117 > http [ACK] Seq=738 Ack=12244 Win=43520 Len=0 TSval=53227094 TSecr=140350491
251654  89.002082 68.157.168.204 -> 41.177.26.176 TCP 70 33117 > http [ACK] Seq=738 Ack=13748 Win=57984 Len=0 TSval=53227094 TSecr=140350492
251771  89.044662 68.157.168.204 -> 41.177.26.176 TCP 70 33117 > http [ACK] Seq=738 Ack=16214 Win=63808 Len=0 TSval=53227137 TSecr=140350496
251772  89.044666 68.157.168.204 -> 41.177.26.176 TCP 70 33117 > http [ACK] Seq=738 Ack=20558 Win=61248 Len=0 TSval=53227137 TSecr=140350496
251882  89.087371 68.157.168.204 -> 41.177.26.176 TCP 70 33117 > http [ACK] Seq=738 Ack=22955 Win=64128 Len=0 TSval=53227180 TSecr=140350500
251883  89.087484 68.157.168.204 -> 41.177.26.176 TCP 70 33117 > http [ACK] Seq=738 Ack=25515 Win=64128 Len=0 TSval=53227180 TSecr=140350500
285243  95.404785 68.157.168.204 -> 41.177.26.176 TCP 70 33117 > http [ACK] Seq=1140 Ack=27130 Win=63744 Len=0 TSval=53233497 TSecr=140351132
285301  95.414444 68.157.168.204 -> 41.177.26.176 TCP 70 33117 > http [ACK] Seq=1140 Ack=28630 Win=64128 Len=0 TSval=53233506 TSecr=140351133
285307  95.414623 68.157.168.204 -> 41.177.26.176 TCP 70 33117 > http [ACK] Seq=1140 Ack=31037 Win=64128 Len=0 TSval=53233507 TSecr=140351133
285382  95.447611 68.157.168.204 -> 41.177.26.176 TCP 70 33117 > http [ACK] Seq=1140 Ack=33888 Win=62656 Len=0 TSval=53233540 TSecr=140351136
285415  95.456699 68.157.168.204 -> 41.177.26.176 TCP 70 33117 > http [ACK] Seq=1140 Ack=36467 Win=62656 Len=0 TSval=53233549 TSecr=140351137
312961 106.821868 68.157.168.204 -> 41.177.26.176 TCP 70 33117 > http [ACK] Seq=1488 Ack=37985 Win=64128 Len=0 TSval=53244913 TSecr=140352274
313004 106.833407 68.157.168.204 -> 41.177.26.176 TCP 70 33117 > http [ACK] Seq=1488 Ack=39964 Win=64128 Len=0 TSval=53244925 TSecr=140352275
313084 106.864348 68.157.168.204 -> 41.177.26.176 TCP 70 33117 > http [ACK] Seq=1488 Ack=42560 Win=62656 Len=0 TSval=53244956 TSecr=140352278
313104 106.875976 68.157.168.204 -> 41.177.26.176 TCP 70 33117 > http [ACK] Seq=1488 Ack=45456 Win=62656 Len=0 TSval=53244968 TSecr=140352279
313193 106.916034 68.157.168.204 -> 41.177.26.176 TCP 70 33117 > http [ACK] Seq=1488 Ack=46712 Win=64128 Len=0 TSval=53245008 TSecr=140352279
325482 112.108634 68.157.168.204 -> 41.177.26.176 TCP 70 33117 > http [ACK] Seq=1813 Ack=48151 Win=64128 Len=0 TSval=53250200 TSecr=140352802
325504 112.118901 68.157.168.204 -> 41.177.26.176 TCP 70 33117 > http [ACK] Seq=1813 Ack=48911 Win=64128 Len=0 TSval=53250210 TSecr=140352804
325505 112.118906 68.157.168.204 -> 41.177.26.176 TCP 70 33117 > http [ACK] Seq=1813 Ack=49124 Win=63872 Len=0 TSval=53250210 TSecr=140352804
325506 112.118910 68.157.168.204 -> 41.177.26.176 TCP 70 33117 > http [ACK] Seq=1813 Ack=49337 Win=63680 Len=0 TSval=53250210 TSecr=140352804
325507 112.118914 68.157.168.204 -> 41.177.26.176 TCP 70 33117 > http [ACK] Seq=1813 Ack=49550 Win=63488 Len=0 TSval=53250210 TSecr=140352804
325509 112.119109 68.157.168.204 -> 41.177.26.176 TCP 70 33117 > http [ACK] Seq=1813 Ack=49766 Win=64128 Len=0 TSval=53250211 TSecr=140352804
325514 112.119215 68.157.168.204 -> 41.177.26.176 TCP 70 33117 > http [ACK] Seq=1813 Ack=50528 Win=63360 Len=0 TSval=53250211 TSecr=140352804
325567 112.151315 68.157.168.204 -> 41.177.26.176 TCP 70 33117 > http [ACK] Seq=1813 Ack=51976 Win=64128 Len=0 TSval=53250243 TSecr=140352807
325568 112.151320 68.157.168.204 -> 41.177.26.176 TCP 70 33117 > http [ACK] Seq=1813 Ack=52976 Win=63104 Len=0 TSval=53250243 TSecr=140352807
325580 112.161315 68.157.168.204 -> 41.177.26.176 TCP 70 33117 > http [ACK] Seq=1813 Ack=54424 Win=64128 Len=0 TSval=53250253 TSecr=140352808
325581 112.161319 68.157.168.204 -> 41.177.26.176 TCP 70 33117 > http [ACK] Seq=1813 Ack=55872 Win=62656 Len=0 TSval=53250253 TSecr=140352808
325582 112.161323 68.157.168.204 -> 41.177.26.176 TCP 70 33117 > http [ACK] Seq=1813 Ack=57320 Win=61248 Len=0 TSval=53250253 TSecr=140352808
325583 112.161327 68.157.168.204 -> 41.177.26.176 TCP 70 33117 > http [ACK] Seq=1813 Ack=58555 Win=59968 Len=0 TSval=53250253 TSecr=140352808
325585 112.161364 68.157.168.204 -> 41.177.26.176 TCP 70 33117 > http [ACK] Seq=1813 Ack=60003 Win=58560 Len=0 TSval=53250253 TSecr=140352808
325586 112.161368 68.157.168.204 -> 41.177.26.176 TCP 70 33117 > http [ACK] Seq=1813 Ack=61451 Win=57088 Len=0 TSval=53250253 TSecr=140352808
325587 112.161372 68.157.168.204 -> 41.177.26.176 TCP 70 33117 > http [ACK] Seq=1813 Ack=62564 Win=56000 Len=0 TSval=53250253 TSecr=140352808
327633 113.281004 68.157.168.204 -> 41.177.26.176 TCP 70 33117 > http [ACK] Seq=2181 Ack=64182 Win=64128 Len=0 TSval=53251372 TSecr=140352920
327663 113.291401 68.157.168.204 -> 41.177.26.176 TCP 70 33117 > http [ACK] Seq=2181 Ack=66250 Win=64128 Len=0 TSval=53251383 TSecr=140352921
327722 113.323573 68.157.168.204 -> 41.177.26.176 TCP 70 33117 > http [ACK] Seq=2181 Ack=69084 Win=64128 Len=0 TSval=53251415 TSecr=140352924
327727 113.334256 68.157.168.204 -> 41.177.26.176 TCP 70 33117 > http [ACK] Seq=2181 Ack=73078 Win=61248 Len=0 TSval=53251426 TSecr=140352925
330910 115.235254 68.157.168.204 -> 41.177.26.176 TCP 70 33117 > http [ACK] Seq=2500 Ack=75508 Win=62656 Len=0 TSval=53253327 TSecr=140353115
330911 115.235361 68.157.168.204 -> 41.177.26.176 TCP 70 33117 > http [ACK] Seq=2500 Ack=76979 Win=63744 Len=0 TSval=53253327 TSecr=140353115
330912 115.235660 68.157.168.204 -> 41.177.26.176 TCP 70 33117 > http [ACK] Seq=2500 Ack=79153 Win=62656 Len=0 TSval=53253327 TSecr=140353115
331001 115.293247 68.157.168.204 -> 41.177.26.176 TCP 70 33117 > http [ACK] Seq=2500 Ack=80876 Win=62656 Len=0 TSval=53253385 TSecr=140353121
331003 115.293627 68.157.168.204 -> 41.177.26.176 TCP 70 33117 > http [ACK] Seq=2500 Ack=83772 Win=64128 Len=0 TSval=53253385 TSecr=140353121
331095 115.333216 68.157.168.204 -> 41.177.26.176 TCP 70 33117 > http [ACK] Seq=2500 Ack=84152 Win=64128 Len=0 TSval=53253425 TSecr=140353121
355329 121.163681 68.157.168.204 -> 41.177.26.176 TCP 70 33117 > http [FIN, ACK] Seq=2500 Ack=84152 Win=64128 Len=0 TSval=53259255 TSecr=140353121
355445 121.206429 68.157.168.204 -> 41.177.26.176 TCP 70 33117 > http [ACK] Seq=2501 Ack=84153 Win=64128 Len=0 TSval=53259298 TSecr=140353712
518152 167.639663 68.157.168.204 -> 41.177.26.176 TCP 78 34694 > http [SYN] Seq=0 Win=5840 Len=0 MSS=1460 SACK_PERM=1 TSval=53305729 TSecr=0 WS=64
518380 167.683081 68.157.168.204 -> 41.177.26.176 TCP 70 34694 > http [ACK] Seq=1 Ack=1 Win=5888 Len=0 TSval=53305772 TSecr=140358360
521612 168.947948 68.157.168.204 -> 41.177.26.176 TCP 70 34694 > http [ACK] Seq=315 Ack=1449 Win=8768 Len=0 TSval=53307037 TSecr=140358486
521613 168.947952 68.157.168.204 -> 41.177.26.176 TCP 70 34694 > http [ACK] Seq=315 Ack=1474 Win=8768 Len=0 TSval=53307037 TSecr=140358486
521621 168.959701 68.157.168.204 -> 41.177.26.176 TCP 70 34694 > http [ACK] Seq=315 Ack=2231 Win=11648 Len=0 TSval=53307049 TSecr=140358488
521622 168.959706 68.157.168.204 -> 41.177.26.176 TCP 70 34694 > http [ACK] Seq=315 Ack=2322 Win=11648 Len=0 TSval=53307049 TSecr=140358488
521623 168.959905 68.157.168.204 -> 41.177.26.176 TCP 70 34694 > http [ACK] Seq=315 Ack=2527 Win=14528 Len=0 TSval=53307049 TSecr=140358488
521624 168.959910 68.157.168.204 -> 41.177.26.176 TCP 70 34694 > http [ACK] Seq=315 Ack=2732 Win=17472 Len=0 TSval=53307049 TSecr=140358488
521625 168.959914 68.157.168.204 -> 41.177.26.176 TCP 70 34694 > http [ACK] Seq=315 Ack=2940 Win=20352 Len=0 TSval=53307049 TSecr=140358488
521626 168.960347 68.157.168.204 -> 41.177.26.176 TCP 70 34694 > http [ACK] Seq=315 Ack=3620 Win=23232 Len=0 TSval=53307049 TSecr=140358488
521627 168.960616 68.157.168.204 -> 41.177.26.176 TCP 70 34694 > http [ACK] Seq=315 Ack=5068 Win=26112 Len=0 TSval=53307050 TSecr=140358488
521628 168.960621 68.157.168.204 -> 41.177.26.176 TCP 70 34694 > http [ACK] Seq=315 Ack=5242 Win=29056 Len=0 TSval=53307050 TSecr=140358488
521629 168.960625 68.157.168.204 -> 41.177.26.176 TCP 70 34694 > http [ACK] Seq=315 Ack=5403 Win=31936 Len=0 TSval=53307050 TSecr=140358488
521630 168.960924 68.157.168.204 -> 41.177.26.176 TCP 70 34694 > http [ACK] Seq=315 Ack=5455 Win=31936 Len=0 TSval=53307050 TSecr=140358488
521631 168.961038 68.157.168.204 -> 41.177.26.176 TCP 70 34694 > http [ACK] Seq=315 Ack=5521 Win=31936 Len=0 TSval=53307050 TSecr=140358488
521647 168.973297 68.157.168.204 -> 41.177.26.176 TCP 70 34694 > http [ACK] Seq=315 Ack=5656 Win=34816 Len=0 TSval=53307062 TSecr=140358489
521662 168.991006 68.157.168.204 -> 41.177.26.176 TCP 70 34694 > http [ACK] Seq=315 Ack=7104 Win=37696 Len=0 TSval=53307080 TSecr=140358491
521663 168.991253 68.157.168.204 -> 41.177.26.176 TCP 70 34694 > http [ACK] Seq=315 Ack=8552 Win=40640 Len=0 TSval=53307080 TSecr=140358491
521664 168.991258 68.157.168.204 -> 41.177.26.176 TCP 70 34694 > http [ACK] Seq=315 Ack=9565 Win=43520 Len=0 TSval=53307080 TSecr=140358491
521665 168.992192 68.157.168.204 -> 41.177.26.176 TCP 70 34694 > http [ACK] Seq=315 Ack=9570 Win=43520 Len=0 TSval=53307081 TSecr=140358491
538853 174.645573 68.157.168.204 -> 41.177.26.176 TCP 70 34694 > http [FIN, ACK] Seq=315 Ack=9570 Win=43520 Len=0 TSval=53312734 TSecr=140358491
538991 174.688548 68.157.168.204 -> 41.177.26.176 TCP 70 34694 > http [ACK] Seq=316 Ack=9571 Win=43520 Len=0 TSval=53312777 TSecr=140359060
691244 218.004645 68.157.168.204 -> 41.177.26.176 TCP 78 45960 > http [SYN] Seq=0 Win=5840 Len=0 MSS=1460 SACK_PERM=1 TSval=53356092 TSecr=0 WS=64
691341 218.048342 68.157.168.204 -> 41.177.26.176 TCP 70 45960 > http [ACK] Seq=1 Ack=1 Win=5888 Len=0 TSval=53356136 TSecr=140363396
692731 218.802208 68.157.168.204 -> 41.177.26.176 TCP 70 45960 > http [ACK] Seq=400 Ack=1449 Win=8768 Len=0 TSval=53356890 TSecr=140363472
692732 218.802260 68.157.168.204 -> 41.177.26.176 TCP 70 45960 > http [ACK] Seq=400 Ack=1463 Win=8768 Len=0 TSval=53356890 TSecr=140363472
692753 218.814473 68.157.168.204 -> 41.177.26.176 TCP 70 45960 > http [ACK] Seq=400 Ack=2140 Win=11648 Len=0 TSval=53356902 TSecr=140363473
692756 218.815188 68.157.168.204 -> 41.177.26.176 TCP 70 45960 > http [ACK] Seq=400 Ack=2377 Win=14528 Len=0 TSval=53356903 TSecr=140363473
692757 218.815233 68.157.168.204 -> 41.177.26.176 TCP 70 45960 > http [ACK] Seq=400 Ack=2614 Win=17472 Len=0 TSval=53356903 TSecr=140363473
692759 218.815328 68.157.168.204 -> 41.177.26.176 TCP 70 45960 > http [ACK] Seq=400 Ack=2851 Win=20352 Len=0 TSval=53356903 TSecr=140363473
692760 218.815358 68.157.168.204 -> 41.177.26.176 TCP 70 45960 > http [ACK] Seq=400 Ack=3091 Win=23232 Len=0 TSval=53356903 TSecr=140363473
692761 218.815363 68.157.168.204 -> 41.177.26.176 TCP 70 45960 > http [ACK] Seq=400 Ack=3894 Win=26112 Len=0 TSval=53356903 TSecr=140363473
692762 218.815963 68.157.168.204 -> 41.177.26.176 TCP 70 45960 > http [ACK] Seq=400 Ack=5342 Win=29056 Len=0 TSval=53356903 TSecr=140363473
692763 218.815967 68.157.168.204 -> 41.177.26.176 TCP 70 45960 > http [ACK] Seq=400 Ack=5783 Win=31936 Len=0 TSval=53356904 TSecr=140363473
692871 218.845428 68.157.168.204 -> 41.177.26.176 TCP 70 45960 > http [ACK] Seq=400 Ack=6454 Win=34816 Len=0 TSval=53356933 TSecr=140363476
692872 218.845432 68.157.168.204 -> 41.177.26.176 TCP 70 45960 > http [ACK] Seq=400 Ack=7617 Win=37696 Len=0 TSval=53356933 TSecr=140363476
692873 218.845436 68.157.168.204 -> 41.177.26.176 TCP 70 45960 > http [ACK] Seq=400 Ack=9065 Win=40640 Len=0 TSval=53356933 TSecr=140363476
692906 218.857239 68.157.168.204 -> 41.177.26.176 TCP 70 45960 > http [ACK] Seq=400 Ack=10513 Win=43520 Len=0 TSval=53356945 TSecr=140363477
692907 218.857244 68.157.168.204 -> 41.177.26.176 TCP 70 45960 > http [ACK] Seq=400 Ack=11638 Win=46400 Len=0 TSval=53356945 TSecr=140363477
706260 224.801854 68.157.168.204 -> 41.177.26.176 TCP 70 45960 > http [FIN, ACK] Seq=400 Ack=11638 Win=46400 Len=0 TSval=53362889 TSecr=140363477
706351 224.844557 68.157.168.204 -> 41.177.26.176 TCP 70 45960 > http [ACK] Seq=401 Ack=11639 Win=46400 Len=0 TSval=53362932 TSecr=140364076
1007107 337.290113 68.157.168.204 -> 41.177.26.176 TCP 78 54815 > http [SYN] Seq=0 Win=5840 Len=0 MSS=1460 SACK_PERM=1 TSval=53475373 TSecr=0 WS=64
1007218 337.332546 68.157.168.204 -> 41.177.26.176 TCP 70 54815 > http [ACK] Seq=1 Ack=1 Win=5888 Len=0 TSval=53475416 TSecr=140375325
1009346 338.345925 68.157.168.204 -> 41.177.26.176 TCP 70 54815 > http [ACK] Seq=375 Ack=740 Win=7360 Len=0 TSval=53476429 TSecr=140375426
1009347 338.345951 68.157.168.204 -> 41.177.26.176 TCP 70 54815 > http [ACK] Seq=375 Ack=1499 Win=8896 Len=0 TSval=53476429 TSecr=140375426
1009372 338.357341 68.157.168.204 -> 41.177.26.176 TCP 70 54815 > http [ACK] Seq=375 Ack=2168 Win=10368 Len=0 TSval=53476441 TSecr=140375427
1009373 338.357345 68.157.168.204 -> 41.177.26.176 TCP 70 54815 > http [ACK] Seq=375 Ack=2379 Win=11904 Len=0 TSval=53476441 TSecr=140375427
1009374 338.357349 68.157.168.204 -> 41.177.26.176 TCP 70 54815 > http [ACK] Seq=375 Ack=2470 Win=11904 Len=0 TSval=53476441 TSecr=140375427
1009375 338.357389 68.157.168.204 -> 41.177.26.176 TCP 70 54815 > http [ACK] Seq=375 Ack=2681 Win=13440 Len=0 TSval=53476441 TSecr=140375427
1009376 338.357394 68.157.168.204 -> 41.177.26.176 TCP 70 54815 > http [ACK] Seq=375 Ack=2895 Win=14912 Len=0 TSval=53476441 TSecr=140375427
1009377 338.357655 68.157.168.204 -> 41.177.26.176 TCP 70 54815 > http [ACK] Seq=375 Ack=3636 Win=16448 Len=0 TSval=53476441 TSecr=140375427
1009415 338.388558 68.157.168.204 -> 41.177.26.176 TCP 70 54815 > http [ACK] Seq=375 Ack=5084 Win=19328 Len=0 TSval=53476472 TSecr=140375431
1009416 338.388563 68.157.168.204 -> 41.177.26.176 TCP 70 54815 > http [ACK] Seq=375 Ack=6104 Win=22272 Len=0 TSval=53476472 TSecr=140375431
1009417 338.388696 68.157.168.204 -> 41.177.26.176 TCP 70 54815 > http [ACK] Seq=375 Ack=7552 Win=25152 Len=0 TSval=53476472 TSecr=140375431
1009436 338.400006 68.157.168.204 -> 41.177.26.176 TCP 70 54815 > http [ACK] Seq=375 Ack=9000 Win=28032 Len=0 TSval=53476483 TSecr=140375432
1009437 338.400011 68.157.168.204 -> 41.177.26.176 TCP 70 54815 > http [ACK] Seq=375 Ack=10152 Win=30912 Len=0 TSval=53476483 TSecr=140375432
1018394 343.343936 68.157.168.204 -> 41.177.26.176 TCP 70 54815 > http [ACK] Seq=708 Ack=10869 Win=33856 Len=0 TSval=53481427 TSecr=140375926
1018395 343.343969 68.157.168.204 -> 41.177.26.176 TCP 70 54815 > http [ACK] Seq=708 Ack=11604 Win=36736 Len=0 TSval=53481427 TSecr=140375926
1018514 343.355617 68.157.168.204 -> 41.177.26.176 TCP 70 54815 > http [ACK] Seq=708 Ack=12257 Win=39616 Len=0 TSval=53481439 TSecr=140375927
1018517 343.355744 68.157.168.204 -> 41.177.26.176 TCP 70 54815 > http [ACK] Seq=708 Ack=12480 Win=42496 Len=0 TSval=53481439 TSecr=140375927
1018518 343.355799 68.157.168.204 -> 41.177.26.176 TCP 70 54815 > http [ACK] Seq=708 Ack=12703 Win=45440 Len=0 TSval=53481439 TSecr=140375927
1018519 343.355804 68.157.168.204 -> 41.177.26.176 TCP 70 54815 > http [ACK] Seq=708 Ack=12926 Win=48320 Len=0 TSval=53481439 TSecr=140375927
1018525 343.356029 68.157.168.204 -> 41.177.26.176 TCP 70 54815 > http [ACK] Seq=708 Ack=13019 Win=48320 Len=0 TSval=53481439 TSecr=140375927
1018526 343.356034 68.157.168.204 -> 41.177.26.176 TCP 70 54815 > http [ACK] Seq=708 Ack=13520 Win=51200 Len=0 TSval=53481439 TSecr=140375927
1018527 343.356393 68.157.168.204 -> 41.177.26.176 TCP 70 54815 > http [ACK] Seq=708 Ack=14968 Win=54080 Len=0 TSval=53481440 TSecr=140375927
1018528 343.356397 68.157.168.204 -> 41.177.26.176 TCP 70 54815 > http [ACK] Seq=708 Ack=15444 Win=57024 Len=0 TSval=53481440 TSecr=140375927
1018529 343.356401 68.157.168.204 -> 41.177.26.176 TCP 70 54815 > http [ACK] Seq=708 Ack=15595 Win=59904 Len=0 TSval=53481440 TSecr=140375927
1018530 343.356406 68.157.168.204 -> 41.177.26.176 TCP 70 54815 > http [ACK] Seq=708 Ack=15611 Win=59904 Len=0 TSval=53481440 TSecr=140375927
1018531 343.356410 68.157.168.204 -> 41.177.26.176 TCP 70 54815 > http [ACK] Seq=708 Ack=15647 Win=59904 Len=0 TSval=53481440 TSecr=140375927
1018537 343.356539 68.157.168.204 -> 41.177.26.176 TCP 70 54815 > http [ACK] Seq=708 Ack=15731 Win=59904 Len=0 TSval=53481440 TSecr=140375927
1018549 343.365815 68.157.168.204 -> 41.177.26.176 TCP 70 54815 > http [ACK] Seq=708 Ack=16022 Win=62784 Len=0 TSval=53481449 TSecr=140375928
1018550 343.366061 68.157.168.204 -> 41.177.26.176 TCP 70 54815 > http [ACK] Seq=708 Ack=17470 Win=64128 Len=0 TSval=53481449 TSecr=140375928
1018551 343.366243 68.157.168.204 -> 41.177.26.176 TCP 70 54815 > http [ACK] Seq=708 Ack=18918 Win=64128 Len=0 TSval=53481449 TSecr=140375928
1018552 343.366248 68.157.168.204 -> 41.177.26.176 TCP 70 54815 > http [ACK] Seq=708 Ack=20220 Win=62784 Len=0 TSval=53481449 TSecr=140375928
1018561 343.384602 68.157.168.204 -> 41.177.26.176 TCP 70 54815 > http [ACK] Seq=708 Ack=20225 Win=64128 Len=0 TSval=53481468 TSecr=140375930
