16897   4.740491 68.157.168.224 -> 41.177.26.15 TCP 70 47436 > http [FIN, ACK] Seq=1 Ack=1 Win=380 Len=0 TSval=2051464574 TSecr=140341494
16989   4.783920 68.157.168.224 -> 41.177.26.15 TCP 70 47436 > http [ACK] Seq=2 Ack=2 Win=380 Len=0 TSval=2051464617 TSecr=140342070
21902   7.651881 68.157.168.224 -> 41.177.26.15 TCP 78 62277 > http [SYN] Seq=0 Win=5840 Len=0 MSS=1460 SACK_PERM=1 TSval=2051467485 TSecr=0 WS=64
21981   7.695117 68.157.168.224 -> 41.177.26.15 TCP 70 62277 > http [ACK] Seq=1 Ack=1 Win=5888 Len=0 TSval=2051467528 TSecr=140342361
22422   7.982433 68.157.168.224 -> 41.177.26.15 TCP 70 62277 > http [ACK] Seq=323 Ack=1449 Win=8768 Len=0 TSval=2051467816 TSecr=140342390
22423   7.982438 68.157.168.224 -> 41.177.26.15 TCP 70 62277 > http [ACK] Seq=323 Ack=2897 Win=11648 Len=0 TSval=2051467816 TSecr=140342390
22425   7.982493 68.157.168.224 -> 41.177.26.15 TCP 70 62277 > http [ACK] Seq=323 Ack=4345 Win=14528 Len=0 TSval=2051467816 TSecr=140342390
22499   8.025778 68.157.168.224 -> 41.177.26.15 TCP 70 62277 > http [ACK] Seq=323 Ack=5793 Win=17472 Len=0 TSval=2051467859 TSecr=140342394
22502   8.026220 68.157.168.224 -> 41.177.26.15 TCP 70 62277 > http [ACK] Seq=323 Ack=7241 Win=20352 Len=0 TSval=2051467859 TSecr=140342394
22503   8.026225 68.157.168.224 -> 41.177.26.15 TCP 70 62277 > http [ACK] Seq=323 Ack=8465 Win=23232 Len=0 TSval=2051467859 TSecr=140342394
22504   8.026229 68.157.168.224 -> 41.177.26.15 TCP 70 62277 > http [ACK] Seq=323 Ack=9913 Win=26112 Len=0 TSval=2051467859 TSecr=140342394
22505   8.026233 68.157.168.224 -> 41.177.26.15 TCP 70 62277 > http [ACK] Seq=323 Ack=11361 Win=29056 Len=0 TSval=2051467859 TSecr=140342394
22506   8.026419 68.157.168.224 -> 41.177.26.15 TCP 70 62277 > http [ACK] Seq=323 Ack=12809 Win=31936 Len=0 TSval=2051467860 TSecr=140342394
22573   8.068985 68.157.168.224 -> 41.177.26.15 TCP 70 62277 > http [ACK] Seq=323 Ack=14257 Win=34816 Len=0 TSval=2051467902 TSecr=140342398
22574   8.068992 68.157.168.224 -> 41.177.26.15 TCP 70 62277 > http [ACK] Seq=323 Ack=15705 Win=37696 Len=0 TSval=2051467902 TSecr=140342398
22580   8.069864 68.157.168.224 -> 41.177.26.15 TCP 70 62277 > http [ACK] Seq=323 Ack=16665 Win=40640 Len=0 TSval=2051467903 TSecr=140342399
22581   8.069947 68.157.168.224 -> 41.177.26.15 TCP 70 62277 > http [ACK] Seq=323 Ack=18113 Win=43520 Len=0 TSval=2051467903 TSecr=140342399
22582   8.069952 68.157.168.224 -> 41.177.26.15 TCP 70 62277 > http [ACK] Seq=323 Ack=19561 Win=46400 Len=0 TSval=2051467903 TSecr=140342399
22583   8.069972 68.157.168.224 -> 41.177.26.15 TCP 70 62277 > http [ACK] Seq=323 Ack=21009 Win=49280 Len=0 TSval=2051467903 TSecr=140342399
22584   8.069977 68.157.168.224 -> 41.177.26.15 TCP 70 62277 > http [ACK] Seq=323 Ack=22457 Win=52224 Len=0 TSval=2051467903 TSecr=140342399
22587   8.070128 68.157.168.224 -> 41.177.26.15 TCP 70 62277 > http [ACK] Seq=323 Ack=23905 Win=55104 Len=0 TSval=2051467903 TSecr=140342399
22588   8.070132 68.157.168.224 -> 41.177.26.15 TCP 70 62277 > http [ACK] Seq=323 Ack=24865 Win=57984 Len=0 TSval=2051467903 TSecr=140342399
22596   8.070330 68.157.168.224 -> 41.177.26.15 TCP 70 62277 > http [ACK] Seq=323 Ack=26313 Win=60864 Len=0 TSval=2051467903 TSecr=140342399
22597   8.070334 68.157.168.224 -> 41.177.26.15 TCP 70 62277 > http [ACK] Seq=323 Ack=27761 Win=62656 Len=0 TSval=2051467903 TSecr=140342399
22601   8.070351 68.157.168.224 -> 41.177.26.15 TCP 70 62277 > http [ACK] Seq=323 Ack=29209 Win=61248 Len=0 TSval=2051467903 TSecr=140342399
22702   8.112232 68.157.168.224 -> 41.177.26.15 TCP 70 62277 > http [ACK] Seq=323 Ack=30657 Win=64128 Len=0 TSval=2051467945 TSecr=140342403
22703   8.112275 68.157.168.224 -> 41.177.26.15 TCP 70 62277 > http [ACK] Seq=323 Ack=33065 Win=61696 Len=0 TSval=2051467945 TSecr=140342403
22704   8.112461 68.157.168.224 -> 41.177.26.15 TCP 70 62277 > http [ACK] Seq=323 Ack=35961 Win=64128 Len=0 TSval=2051467946 TSecr=140342403
22709   8.113249 68.157.168.224 -> 41.177.26.15 TCP 70 62277 > http [ACK] Seq=323 Ack=41265 Win=59776 Len=0 TSval=2051467946 TSecr=140342403
22710   8.113254 68.157.168.224 -> 41.177.26.15 TCP 70 62277 > http [ACK] Seq=323 Ack=44161 Win=62656 Len=0 TSval=2051467946 TSecr=140342403
22711   8.113258 68.157.168.224 -> 41.177.26.15 TCP 70 62277 > http [ACK] Seq=323 Ack=48505 Win=58368 Len=0 TSval=2051467946 TSecr=140342403
22712   8.113441 68.157.168.224 -> 41.177.26.15 TCP 70 62277 > http [ACK] Seq=323 Ack=50913 Win=62656 Len=0 TSval=2051467947 TSecr=140342403
22713   8.113446 68.157.168.224 -> 41.177.26.15 TCP 70 62277 > http [ACK] Seq=323 Ack=53967 Win=60864 Len=0 TSval=2051467947 TSecr=140342403
32535  13.805575 68.157.168.224 -> 41.177.26.15 TCP 70 62277 > http [FIN, ACK] Seq=323 Ack=53967 Win=64128 Len=0 TSval=2051473638 TSecr=140342403
32667  13.848814 68.157.168.224 -> 41.177.26.15 TCP 70 62277 > http [ACK] Seq=324 Ack=53968 Win=64128 Len=0 TSval=2051473682 TSecr=140342976
39856  16.560319 68.157.168.224 -> 41.177.26.15 TCP 78 48571 > http [SYN] Seq=0 Win=5840 Len=0 MSS=1460 SACK_PERM=1 TSval=2051476393 TSecr=0 WS=64
39952  16.603521 68.157.168.224 -> 41.177.26.15 TCP 70 48571 > http [ACK] Seq=1 Ack=1 Win=5888 Len=0 TSval=2051476437 TSecr=140343252
40257  16.839334 68.157.168.224 -> 41.177.26.15 TCP 70 48571 > http [ACK] Seq=464 Ack=1449 Win=8768 Len=0 TSval=2051476672 TSecr=140343275
40258  16.839339 68.157.168.224 -> 41.177.26.15 TCP 70 48571 > http [ACK] Seq=464 Ack=2897 Win=11648 Len=0 TSval=2051476672 TSecr=140343275
40259  16.839343 68.157.168.224 -> 41.177.26.15 TCP 70 48571 > http [ACK] Seq=464 Ack=4345 Win=14528 Len=0 TSval=2051476672 TSecr=140343275
40364  16.882443 68.157.168.224 -> 41.177.26.15 TCP 70 48571 > http [ACK] Seq=464 Ack=5793 Win=17472 Len=0 TSval=2051476715 TSecr=140343280
40365  16.882448 68.157.168.224 -> 41.177.26.15 TCP 70 48571 > http [ACK] Seq=464 Ack=7241 Win=20352 Len=0 TSval=2051476716 TSecr=140343280
40366  16.882452 68.157.168.224 -> 41.177.26.15 TCP 70 48571 > http [ACK] Seq=464 Ack=8379 Win=23232 Len=0 TSval=2051476716 TSecr=140343280
54827  22.689402 68.157.168.224 -> 41.177.26.15 TCP 70 48571 > http [FIN, ACK] Seq=464 Ack=8379 Win=23232 Len=0 TSval=2051482522 TSecr=140343280
54979  22.732918 68.157.168.224 -> 41.177.26.15 TCP 70 48571 > http [ACK] Seq=465 Ack=8380 Win=23232 Len=0 TSval=2051482566 TSecr=140343865
61823  25.314767 68.157.168.224 -> 41.177.26.15 TCP 78 36022 > http [SYN] Seq=0 Win=5840 Len=0 MSS=1460 SACK_PERM=1 TSval=2051485148 TSecr=0 WS=64
61883  25.357517 68.157.168.224 -> 41.177.26.15 TCP 70 36022 > http [ACK] Seq=1 Ack=1 Win=5888 Len=0 TSval=2051485190 TSecr=140344127
61967  25.404972 68.157.168.224 -> 41.177.26.15 TCP 70 36022 > http [ACK] Seq=281 Ack=204 Win=6912 Len=0 TSval=2051485238 TSecr=140344132
68067  28.013966 68.157.168.224 -> 41.177.26.15 TCP 70 36022 > http [ACK] Seq=647 Ack=1652 Win=9856 Len=0 TSval=2051487847 TSecr=140344393
68068  28.013971 68.157.168.224 -> 41.177.26.15 TCP 70 36022 > http [ACK] Seq=647 Ack=3100 Win=12736 Len=0 TSval=2051487847 TSecr=140344393
68069  28.013975 68.157.168.224 -> 41.177.26.15 TCP 70 36022 > http [ACK] Seq=647 Ack=4548 Win=15616 Len=0 TSval=2051487847 TSecr=140344393
68070  28.013980 68.157.168.224 -> 41.177.26.15 TCP 70 36022 > http [ACK] Seq=647 Ack=5996 Win=18496 Len=0 TSval=2051487847 TSecr=140344393
68143  28.056638 68.157.168.224 -> 41.177.26.15 TCP 70 36022 > http [ACK] Seq=647 Ack=7444 Win=21440 Len=0 TSval=2051487890 TSecr=140344397
68144  28.056643 68.157.168.224 -> 41.177.26.15 TCP 70 36022 > http [ACK] Seq=647 Ack=8652 Win=24320 Len=0 TSval=2051487890 TSecr=140344397
68151  28.057055 68.157.168.224 -> 41.177.26.15 TCP 70 36022 > http [ACK] Seq=647 Ack=10100 Win=27200 Len=0 TSval=2051487890 TSecr=140344397
68152  28.057060 68.157.168.224 -> 41.177.26.15 TCP 70 36022 > http [ACK] Seq=647 Ack=11548 Win=30080 Len=0 TSval=2051487890 TSecr=140344397
68159  28.057285 68.157.168.224 -> 41.177.26.15 TCP 70 36022 > http [ACK] Seq=647 Ack=12996 Win=33024 Len=0 TSval=2051487890 TSecr=140344397
68160  28.057290 68.157.168.224 -> 41.177.26.15 TCP 70 36022 > http [ACK] Seq=647 Ack=14444 Win=35904 Len=0 TSval=2051487890 TSecr=140344397
68161  28.057294 68.157.168.224 -> 41.177.26.15 TCP 70 36022 > http [ACK] Seq=647 Ack=15892 Win=38784 Len=0 TSval=2051487890 TSecr=140344397
68163  28.057301 68.157.168.224 -> 41.177.26.15 TCP 70 36022 > http [ACK] Seq=647 Ack=16844 Win=41664 Len=0 TSval=2051487890 TSecr=140344397
68270  28.099640 68.157.168.224 -> 41.177.26.15 TCP 70 36022 > http [ACK] Seq=647 Ack=18292 Win=44608 Len=0 TSval=2051487932 TSecr=140344402
68271  28.099645 68.157.168.224 -> 41.177.26.15 TCP 70 36022 > http [ACK] Seq=647 Ack=19740 Win=47488 Len=0 TSval=2051487932 TSecr=140344402
68272  28.099668 68.157.168.224 -> 41.177.26.15 TCP 70 36022 > http [ACK] Seq=647 Ack=21188 Win=50368 Len=0 TSval=2051487933 TSecr=140344402
68273  28.099744 68.157.168.224 -> 41.177.26.15 TCP 70 36022 > http [ACK] Seq=647 Ack=22636 Win=53248 Len=0 TSval=2051487933 TSecr=140344402
68274  28.099802 68.157.168.224 -> 41.177.26.15 TCP 70 36022 > http [ACK] Seq=647 Ack=24084 Win=56192 Len=0 TSval=2051487933 TSecr=140344402
68275  28.099869 68.157.168.224 -> 41.177.26.15 TCP 70 36022 > http [ACK] Seq=647 Ack=25036 Win=56896 Len=0 TSval=2051487933 TSecr=140344402
68276  28.099952 68.157.168.224 -> 41.177.26.15 TCP 70 36022 > http [ACK] Seq=647 Ack=26484 Win=55488 Len=0 TSval=2051487933 TSecr=140344402
68277  28.100088 68.157.168.224 -> 41.177.26.15 TCP 70 36022 > http [ACK] Seq=647 Ack=27932 Win=54016 Len=0 TSval=2051487933 TSecr=140344402
68282  28.102654 68.157.168.224 -> 41.177.26.15 TCP 70 36022 > http [ACK] Seq=647 Ack=31283 Win=50688 Len=0 TSval=2051487935 TSecr=140344402
86522  33.596851 68.157.168.224 -> 41.177.26.15 TCP 70 36022 > http [FIN, ACK] Seq=647 Ack=31283 Win=59072 Len=0 TSval=2051493429 TSecr=140344402
86800  33.639720 68.157.168.224 -> 41.177.26.15 TCP 70 36022 > http [ACK] Seq=648 Ack=31284 Win=59072 Len=0 TSval=2051493473 TSecr=140344956
88701  34.260391 68.157.168.224 -> 41.177.26.15 TCP 78 48868 > http [SYN] Seq=0 Win=5840 Len=0 MSS=1460 SACK_PERM=1 TSval=2051494093 TSecr=0 WS=64
88805  34.303494 68.157.168.224 -> 41.177.26.15 TCP 70 48868 > http [ACK] Seq=1 Ack=1 Win=5888 Len=0 TSval=2051494136 TSecr=140345022
88964  34.351589 68.157.168.224 -> 41.177.26.15 TCP 70 48868 > http [ACK] Seq=353 Ack=205 Win=6912 Len=0 TSval=2051494184 TSecr=140345027
106135  38.310851 68.157.168.224 -> 41.177.26.15 TCP 70 48868 > http [ACK] Seq=719 Ack=1653 Win=9856 Len=0 TSval=2051498144 TSecr=140345423
106136  38.310955 68.157.168.224 -> 41.177.26.15 TCP 70 48868 > http [ACK] Seq=719 Ack=3101 Win=12736 Len=0 TSval=2051498144 TSecr=140345423
106137  38.310979 68.157.168.224 -> 41.177.26.15 TCP 70 48868 > http [ACK] Seq=719 Ack=4549 Win=15616 Len=0 TSval=2051498144 TSecr=140345423
106142  38.311161 68.157.168.224 -> 41.177.26.15 TCP 70 48868 > http [ACK] Seq=719 Ack=5997 Win=18496 Len=0 TSval=2051498144 TSecr=140345423
106249  38.353881 68.157.168.224 -> 41.177.26.15 TCP 70 48868 > http [ACK] Seq=719 Ack=7445 Win=21440 Len=0 TSval=2051498187 TSecr=140345427
106250  38.353886 68.157.168.224 -> 41.177.26.15 TCP 70 48868 > http [ACK] Seq=719 Ack=8653 Win=24320 Len=0 TSval=2051498187 TSecr=140345427
106251  38.353889 68.157.168.224 -> 41.177.26.15 TCP 70 48868 > http [ACK] Seq=719 Ack=10101 Win=27200 Len=0 TSval=2051498187 TSecr=140345427
106254  38.354006 68.157.168.224 -> 41.177.26.15 TCP 70 48868 > http [ACK] Seq=719 Ack=11549 Win=30080 Len=0 TSval=2051498187 TSecr=140345427
106255  38.354011 68.157.168.224 -> 41.177.26.15 TCP 70 48868 > http [ACK] Seq=719 Ack=12997 Win=33024 Len=0 TSval=2051498187 TSecr=140345427
106256  38.354015 68.157.168.224 -> 41.177.26.15 TCP 70 48868 > http [ACK] Seq=719 Ack=14445 Win=35904 Len=0 TSval=2051498187 TSecr=140345427
106257  38.354082 68.157.168.224 -> 41.177.26.15 TCP 70 48868 > http [ACK] Seq=719 Ack=15893 Win=38784 Len=0 TSval=2051498187 TSecr=140345427
106258  38.354087 68.157.168.224 -> 41.177.26.15 TCP 70 48868 > http [ACK] Seq=719 Ack=16845 Win=41664 Len=0 TSval=2051498187 TSecr=140345427
106368  38.396928 68.157.168.224 -> 41.177.26.15 TCP 70 48868 > http [ACK] Seq=719 Ack=18293 Win=44608 Len=0 TSval=2051498230 TSecr=140345431
106369  38.396932 68.157.168.224 -> 41.177.26.15 TCP 70 48868 > http [ACK] Seq=719 Ack=19741 Win=47488 Len=0 TSval=2051498230 TSecr=140345431
106370  38.396937 68.157.168.224 -> 41.177.26.15 TCP 70 48868 > http [ACK] Seq=719 Ack=21189 Win=50368 Len=0 TSval=2051498230 TSecr=140345431
106371  38.397012 68.157.168.224 -> 41.177.26.15 TCP 70 48868 > http [ACK] Seq=719 Ack=22637 Win=53248 Len=0 TSval=2051498230 TSecr=140345431
106372  38.397016 68.157.168.224 -> 41.177.26.15 TCP 70 48868 > http [ACK] Seq=719 Ack=24085 Win=56192 Len=0 TSval=2051498230 TSecr=140345431
106373  38.397020 68.157.168.224 -> 41.177.26.15 TCP 70 48868 > http [ACK] Seq=719 Ack=25037 Win=59072 Len=0 TSval=2051498230 TSecr=140345431
106374  38.397024 68.157.168.224 -> 41.177.26.15 TCP 70 48868 > http [ACK] Seq=719 Ack=26485 Win=59776 Len=0 TSval=2051498230 TSecr=140345431
106375  38.397042 68.157.168.224 -> 41.177.26.15 TCP 70 48868 > http [ACK] Seq=719 Ack=27933 Win=58368 Len=0 TSval=2051498230 TSecr=140345431
106376  38.397047 68.157.168.224 -> 41.177.26.15 TCP 70 48868 > http [ACK] Seq=719 Ack=29381 Win=56896 Len=0 TSval=2051498230 TSecr=140345431
106383  38.397245 68.157.168.224 -> 41.177.26.15 TCP 70 48868 > http [ACK] Seq=719 Ack=32277 Win=64128 Len=0 TSval=2051498230 TSecr=140345431
106392  38.397411 68.157.168.224 -> 41.177.26.15 TCP 70 48868 > http [ACK] Seq=719 Ack=33229 Win=64128 Len=0 TSval=2051498230 TSecr=140345431
106399  38.397556 68.157.168.224 -> 41.177.26.15 TCP 70 48868 > http [ACK] Seq=719 Ack=37573 Win=61248 Len=0 TSval=2051498230 TSecr=140345431
106517  38.437025 68.157.168.224 -> 41.177.26.15 TCP 70 48868 > http [ACK] Seq=719 Ack=39021 Win=64128 Len=0 TSval=2051498270 TSecr=140345431
106531  38.440025 68.157.168.224 -> 41.177.26.15 TCP 70 48868 > http [ACK] Seq=719 Ack=41421 Win=64128 Len=0 TSval=2051498273 TSecr=140345436
106532  38.440030 68.157.168.224 -> 41.177.26.15 TCP 70 48868 > http [ACK] Seq=719 Ack=44317 Win=62656 Len=0 TSval=2051498273 TSecr=140345436
106537  38.440252 68.157.168.224 -> 41.177.26.15 TCP 70 48868 > http [ACK] Seq=719 Ack=47213 Win=62656 Len=0 TSval=2051498273 TSecr=140345436
106538  38.440256 68.157.168.224 -> 41.177.26.15 TCP 70 48868 > http [ACK] Seq=719 Ack=49613 Win=60224 Len=0 TSval=2051498273 TSecr=140345436
106541  38.440327 68.157.168.224 -> 41.177.26.15 TCP 70 48868 > http [ACK] Seq=719 Ack=52509 Win=62656 Len=0 TSval=2051498273 TSecr=140345436
106542  38.440332 68.157.168.224 -> 41.177.26.15 TCP 70 48868 > http [ACK] Seq=719 Ack=63597 Win=51520 Len=0 TSval=2051498273 TSecr=140345436
106549  38.440512 68.157.168.224 -> 41.177.26.15 TCP 70 48868 > http [ACK] Seq=719 Ack=65997 Win=62656 Len=0 TSval=2051498273 TSecr=140345436
106558  38.440679 68.157.168.224 -> 41.177.26.15 TCP 70 48868 > http [ACK] Seq=719 Ack=74189 Win=54464 Len=0 TSval=2051498273 TSecr=140345436
106559  38.440683 68.157.168.224 -> 41.177.26.15 TCP 70 48868 > http [ACK] Seq=719 Ack=77085 Win=64128 Len=0 TSval=2051498273 TSecr=140345436
106710  38.480313 68.157.168.224 -> 41.177.26.15 TCP 70 48868 > http [ACK] Seq=719 Ack=79981 Win=62656 Len=0 TSval=2051498313 TSecr=140345440
106731  38.483365 68.157.168.224 -> 41.177.26.15 TCP 70 48868 > http [ACK] Seq=719 Ack=82381 Win=62656 Len=0 TSval=2051498316 TSecr=140345440
106732  38.483371 68.157.168.224 -> 41.177.26.15 TCP 70 48868 > http [ACK] Seq=719 Ack=85277 Win=64128 Len=0 TSval=2051498316 TSecr=140345440
106733  38.483419 68.157.168.224 -> 41.177.26.15 TCP 70 48868 > http [ACK] Seq=719 Ack=86725 Win=67008 Len=0 TSval=2051498316 TSecr=140345440
106739  38.483518 68.157.168.224 -> 41.177.26.15 TCP 70 48868 > http [ACK] Seq=719 Ack=88173 Win=69888 Len=0 TSval=2051498316 TSecr=140345440
106740  38.483523 68.157.168.224 -> 41.177.26.15 TCP 70 48868 > http [ACK] Seq=719 Ack=89621 Win=72832 Len=0 TSval=2051498316 TSecr=140345440
106742  38.483547 68.157.168.224 -> 41.177.26.15 TCP 70 48868 > http [ACK] Seq=719 Ack=90573 Win=75712 Len=0 TSval=2051498316 TSecr=140345440
106743  38.483551 68.157.168.224 -> 41.177.26.15 TCP 70 48868 > http [ACK] Seq=719 Ack=92021 Win=78592 Len=0 TSval=2051498316 TSecr=140345440
106744  38.483555 68.157.168.224 -> 41.177.26.15 TCP 70 48868 > http [ACK] Seq=719 Ack=103109 Win=67456 Len=0 TSval=2051498316 TSecr=140345440
106749  38.483666 68.157.168.224 -> 41.177.26.15 TCP 70 48868 > http [ACK] Seq=719 Ack=104557 Win=81472 Len=0 TSval=2051498316 TSecr=140345440
106750  38.483670 68.157.168.224 -> 41.177.26.15 TCP 70 48868 > http [ACK] Seq=719 Ack=116597 Win=69952 Len=0 TSval=2051498316 TSecr=140345440
106753  38.483944 68.157.168.224 -> 41.177.26.15 TCP 70 48868 > http [ACK] Seq=719 Ack=118045 Win=81920 Len=0 TSval=2051498317 TSecr=140345440
106756  38.484014 68.157.168.224 -> 41.177.26.15 TCP 70 48868 > http [ACK] Seq=719 Ack=126237 Win=74304 Len=0 TSval=2051498317 TSecr=140345440
106757  38.484144 68.157.168.224 -> 41.177.26.15 TCP 70 48868 > http [ACK] Seq=719 Ack=129133 Win=81472 Len=0 TSval=2051498317 TSecr=140345440
106758  38.484149 68.157.168.224 -> 41.177.26.15 TCP 70 48868 > http [ACK] Seq=719 Ack=131533 Win=81472 Len=0 TSval=2051498317 TSecr=140345440
106923  38.523327 68.157.168.224 -> 41.177.26.15 TCP 70 48868 > http [ACK] Seq=719 Ack=134429 Win=81472 Len=0 TSval=2051498356 TSecr=140345444
106930  38.526376 68.157.168.224 -> 41.177.26.15 TCP 70 48868 > http [ACK] Seq=719 Ack=137325 Win=81920 Len=0 TSval=2051498359 TSecr=140345444
106931  38.526381 68.157.168.224 -> 41.177.26.15 TCP 70 48868 > http [ACK] Seq=719 Ack=142621 Win=77184 Len=0 TSval=2051498359 TSecr=140345444
106933  38.526582 68.157.168.224 -> 41.177.26.15 TCP 70 48868 > http [ACK] Seq=719 Ack=145517 Win=81472 Len=0 TSval=2051498359 TSecr=140345444
106939  38.526713 68.157.168.224 -> 41.177.26.15 TCP 70 48868 > http [ACK] Seq=719 Ack=146965 Win=84864 Len=0 TSval=2051498359 TSecr=140345444
106940  38.526969 68.157.168.224 -> 41.177.26.15 TCP 70 48868 > http [ACK] Seq=719 Ack=147917 Win=87744 Len=0 TSval=2051498360 TSecr=140345444
106941  38.527056 68.157.168.224 -> 41.177.26.15 TCP 70 48868 > http [ACK] Seq=719 Ack=149365 Win=90624 Len=0 TSval=2051498360 TSecr=140345444
106942  38.527061 68.157.168.224 -> 41.177.26.15 TCP 70 48868 > http [ACK] Seq=719 Ack=150813 Win=93504 Len=0 TSval=2051498360 TSecr=140345444
106943  38.527064 68.157.168.224 -> 41.177.26.15 TCP 70 48868 > http [ACK] Seq=719 Ack=152261 Win=96448 Len=0 TSval=2051498360 TSecr=140345444
106944  38.527068 68.157.168.224 -> 41.177.26.15 TCP 70 48868 > http [ACK] Seq=719 Ack=153709 Win=99328 Len=0 TSval=2051498360 TSecr=140345444
106945  38.527072 68.157.168.224 -> 41.177.26.15 TCP 70 48868 > http [ACK] Seq=719 Ack=155157 Win=102208 Len=0 TSval=2051498360 TSecr=140345444
106946  38.527227 68.157.168.224 -> 41.177.26.15 TCP 70 48868 > http [ACK] Seq=719 Ack=156109 Win=105088 Len=0 TSval=2051498360 TSecr=140345444
106947  38.527302 68.157.168.224 -> 41.177.26.15 TCP 70 48868 > http [ACK] Seq=719 Ack=157557 Win=108032 Len=0 TSval=2051498360 TSecr=140345444
106948  38.527477 68.157.168.224 -> 41.177.26.15 TCP 70 48868 > http [ACK] Seq=719 Ack=159005 Win=110912 Len=0 TSval=2051498360 TSecr=140345444
106949  38.527482 68.157.168.224 -> 41.177.26.15 TCP 70 48868 > http [ACK] Seq=719 Ack=160453 Win=113792 Len=0 TSval=2051498360 TSecr=140345444
106950  38.527486 68.157.168.224 -> 41.177.26.15 TCP 70 48868 > http [ACK] Seq=719 Ack=161901 Win=116672 Len=0 TSval=2051498360 TSecr=140345444
106951  38.527490 68.157.168.224 -> 41.177.26.15 TCP 70 48868 > http [ACK] Seq=719 Ack=163349 Win=119616 Len=0 TSval=2051498360 TSecr=140345444
106952  38.527495 68.157.168.224 -> 41.177.26.15 TCP 70 48868 > http [ACK] Seq=719 Ack=164301 Win=122368 Len=0 TSval=2051498360 TSecr=140345444
106953  38.527704 68.157.168.224 -> 41.177.26.15 TCP 70 48868 > http [ACK] Seq=719 Ack=182133 Win=104512 Len=0 TSval=2051498360 TSecr=140345444
106954  38.527845 68.157.168.224 -> 41.177.26.15 TCP 70 48868 > http [ACK] Seq=719 Ack=183581 Win=125312 Len=0 TSval=2051498361 TSecr=140345444
106955  38.528070 68.157.168.224 -> 41.177.26.15 TCP 70 48868 > http [ACK] Seq=719 Ack=196117 Win=115136 Len=0 TSval=2051498361 TSecr=140345444
106956  38.528156 68.157.168.224 -> 41.177.26.15 TCP 70 48868 > http [ACK] Seq=719 Ack=198517 Win=125312 Len=0 TSval=2051498361 TSecr=140345444
106957  38.528306 68.157.168.224 -> 41.177.26.15 TCP 70 48868 > http [ACK] Seq=719 Ack=205261 Win=120896 Len=0 TSval=2051498361 TSecr=140345444
106958  38.528311 68.157.168.224 -> 41.177.26.15 TCP 70 48868 > http [ACK] Seq=719 Ack=208157 Win=125312 Len=0 TSval=2051498361 TSecr=140345444
107063  38.566489 68.157.168.224 -> 41.177.26.15 TCP 70 48868 > http [ACK] Seq=719 Ack=211053 Win=125312 Len=0 TSval=2051498399 TSecr=140345448
107068  38.569246 68.157.168.224 -> 41.177.26.15 TCP 70 48868 > http [ACK] Seq=719 Ack=213453 Win=125312 Len=0 TSval=2051498402 TSecr=140345448
107069  38.569459 68.157.168.224 -> 41.177.26.15 TCP 70 48868 > http [ACK] Seq=719 Ack=214901 Win=128192 Len=0 TSval=2051498402 TSecr=140345449
107070  38.569464 68.157.168.224 -> 41.177.26.15 TCP 70 48868 > http [ACK] Seq=719 Ack=216349 Win=131072 Len=0 TSval=2051498402 TSecr=140345449
107071  38.569761 68.157.168.224 -> 41.177.26.15 TCP 70 48868 > http [ACK] Seq=719 Ack=217797 Win=134016 Len=0 TSval=2051498402 TSecr=140345449
107072  38.569766 68.157.168.224 -> 41.177.26.15 TCP 70 48868 > http [ACK] Seq=719 Ack=219245 Win=136896 Len=0 TSval=2051498403 TSecr=140345449
107073  38.569769 68.157.168.224 -> 41.177.26.15 TCP 70 48868 > http [ACK] Seq=719 Ack=219903 Win=139648 Len=0 TSval=2051498403 TSecr=140345449
122910  43.745427 68.157.168.224 -> 41.177.26.15 TCP 70 48868 > http [ACK] Seq=1103 Ack=221351 Win=139648 Len=0 TSval=2051503578 TSecr=140345966
122911  43.745496 68.157.168.224 -> 41.177.26.15 TCP 70 48868 > http [ACK] Seq=1103 Ack=222799 Win=139648 Len=0 TSval=2051503578 TSecr=140345966
122912  43.745501 68.157.168.224 -> 41.177.26.15 TCP 70 48868 > http [ACK] Seq=1103 Ack=224247 Win=139648 Len=0 TSval=2051503578 TSecr=140345966
122913  43.745504 68.157.168.224 -> 41.177.26.15 TCP 70 48868 > http [ACK] Seq=1103 Ack=225695 Win=138816 Len=0 TSval=2051503578 TSecr=140345966
122914  43.745509 68.157.168.224 -> 41.177.26.15 TCP 70 48868 > http [ACK] Seq=1103 Ack=227143 Win=137408 Len=0 TSval=2051503578 TSecr=140345966
122915  43.745824 68.157.168.224 -> 41.177.26.15 TCP 70 48868 > http [ACK] Seq=1103 Ack=228351 Win=139648 Len=0 TSval=2051503578 TSecr=140345966
122916  43.745918 68.157.168.224 -> 41.177.26.15 TCP 70 48868 > http [ACK] Seq=1103 Ack=229799 Win=139648 Len=0 TSval=2051503579 TSecr=140345966
122917  43.745922 68.157.168.224 -> 41.177.26.15 TCP 70 48868 > http [ACK] Seq=1103 Ack=231247 Win=139648 Len=0 TSval=2051503579 TSecr=140345966
122918  43.746009 68.157.168.224 -> 41.177.26.15 TCP 70 48868 > http [ACK] Seq=1103 Ack=232695 Win=139648 Len=0 TSval=2051503579 TSecr=140345966
122919  43.746014 68.157.168.224 -> 41.177.26.15 TCP 70 48868 > http [ACK] Seq=1103 Ack=234143 Win=138816 Len=0 TSval=2051503579 TSecr=140345966
122920  43.746018 68.157.168.224 -> 41.177.26.15 TCP 70 48868 > http [ACK] Seq=1103 Ack=235591 Win=137408 Len=0 TSval=2051503579 TSecr=140345966
122921  43.746021 68.157.168.224 -> 41.177.26.15 TCP 70 48868 > http [ACK] Seq=1103 Ack=236543 Win=136448 Len=0 TSval=2051503579 TSecr=140345966
122922  43.746026 68.157.168.224 -> 41.177.26.15 TCP 70 48868 > http [ACK] Seq=1103 Ack=237991 Win=134976 Len=0 TSval=2051503579 TSecr=140345966
122923  43.746030 68.157.168.224 -> 41.177.26.15 TCP 70 48868 > http [ACK] Seq=1103 Ack=239439 Win=133504 Len=0 TSval=2051503579 TSecr=140345966
122924  43.746034 68.157.168.224 -> 41.177.26.15 TCP 70 48868 > http [ACK] Seq=1103 Ack=240887 Win=132096 Len=0 TSval=2051503579 TSecr=140345966
122925  43.746164 68.157.168.224 -> 41.177.26.15 TCP 70 48868 > http [ACK] Seq=1103 Ack=242335 Win=139648 Len=0 TSval=2051503579 TSecr=140345966
122926  43.746169 68.157.168.224 -> 41.177.26.15 TCP 70 48868 > http [ACK] Seq=1103 Ack=244735 Win=139648 Len=0 TSval=2051503579 TSecr=140345966
122927  43.746389 68.157.168.224 -> 41.177.26.15 TCP 70 48868 > http [ACK] Seq=1103 Ack=245635 Win=139648 Len=0 TSval=2051503579 TSecr=140345966
122928  43.746394 68.157.168.224 -> 41.177.26.15 TCP 70 48868 > http [ACK] Seq=1103 Ack=245640 Win=139648 Len=0 TSval=2051503579 TSecr=140345966
143460  49.303943 68.157.168.224 -> 41.177.26.15 TCP 70 48868 > http [FIN, ACK] Seq=1103 Ack=245640 Win=139648 Len=0 TSval=2051509136 TSecr=140345966
143602  49.347184 68.157.168.224 -> 41.177.26.15 TCP 70 48868 > http [ACK] Seq=1104 Ack=245641 Win=139648 Len=0 TSval=2051509180 TSecr=140346526
152465  52.216905 68.157.168.224 -> 41.177.26.15 TCP 78 60848 > http [SYN] Seq=0 Win=5840 Len=0 MSS=1460 SACK_PERM=1 TSval=2051512050 TSecr=0 WS=64
152625  52.259510 68.157.168.224 -> 41.177.26.15 TCP 70 60848 > http [ACK] Seq=1 Ack=1 Win=5888 Len=0 TSval=2051512092 TSecr=140346818
153854  52.584545 68.157.168.224 -> 41.177.26.15 TCP 70 60848 > http [ACK] Seq=323 Ack=1449 Win=8768 Len=0 TSval=2051512418 TSecr=140346850
153855  52.584550 68.157.168.224 -> 41.177.26.15 TCP 70 60848 > http [ACK] Seq=323 Ack=2897 Win=11648 Len=0 TSval=2051512418 TSecr=140346850
153856  52.584943 68.157.168.224 -> 41.177.26.15 TCP 70 60848 > http [ACK] Seq=323 Ack=4345 Win=14528 Len=0 TSval=2051512418 TSecr=140346850
153990  52.627243 68.157.168.224 -> 41.177.26.15 TCP 70 60848 > http [ACK] Seq=323 Ack=5793 Win=17472 Len=0 TSval=2051512460 TSecr=140346854
153991  52.627250 68.157.168.224 -> 41.177.26.15 TCP 70 60848 > http [ACK] Seq=323 Ack=7241 Win=20352 Len=0 TSval=2051512460 TSecr=140346854
153992  52.627360 68.157.168.224 -> 41.177.26.15 TCP 70 60848 > http [ACK] Seq=323 Ack=8465 Win=23232 Len=0 TSval=2051512460 TSecr=140346854
153993  52.627492 68.157.168.224 -> 41.177.26.15 TCP 70 60848 > http [ACK] Seq=323 Ack=9913 Win=26112 Len=0 TSval=2051512461 TSecr=140346854
153997  52.627609 68.157.168.224 -> 41.177.26.15 TCP 70 60848 > http [ACK] Seq=323 Ack=11361 Win=29056 Len=0 TSval=2051512461 TSecr=140346854
153998  52.627614 68.157.168.224 -> 41.177.26.15 TCP 70 60848 > http [ACK] Seq=323 Ack=12809 Win=31936 Len=0 TSval=2051512461 TSecr=140346854
154147  52.669797 68.157.168.224 -> 41.177.26.15 TCP 70 60848 > http [ACK] Seq=323 Ack=14257 Win=34816 Len=0 TSval=2051512503 TSecr=140346859
154148  52.669934 68.157.168.224 -> 41.177.26.15 TCP 70 60848 > http [ACK] Seq=323 Ack=15705 Win=37696 Len=0 TSval=2051512503 TSecr=140346859
154149  52.669938 68.157.168.224 -> 41.177.26.15 TCP 70 60848 > http [ACK] Seq=323 Ack=16665 Win=40640 Len=0 TSval=2051512503 TSecr=140346859
154150  52.669943 68.157.168.224 -> 41.177.26.15 TCP 70 60848 > http [ACK] Seq=323 Ack=18113 Win=43520 Len=0 TSval=2051512503 TSecr=140346859
154151  52.669947 68.157.168.224 -> 41.177.26.15 TCP 70 60848 > http [ACK] Seq=323 Ack=19561 Win=46400 Len=0 TSval=2051512503 TSecr=140346859
154152  52.669950 68.157.168.224 -> 41.177.26.15 TCP 70 60848 > http [ACK] Seq=323 Ack=21009 Win=49280 Len=0 TSval=2051512503 TSecr=140346859
154153  52.669955 68.157.168.224 -> 41.177.26.15 TCP 70 60848 > http [ACK] Seq=323 Ack=22457 Win=52224 Len=0 TSval=2051512503 TSecr=140346859
154156  52.670082 68.157.168.224 -> 41.177.26.15 TCP 70 60848 > http [ACK] Seq=323 Ack=23905 Win=55104 Len=0 TSval=2051512503 TSecr=140346859
154157  52.670086 68.157.168.224 -> 41.177.26.15 TCP 70 60848 > http [ACK] Seq=323 Ack=24865 Win=57984 Len=0 TSval=2051512503 TSecr=140346859
154163  52.670252 68.157.168.224 -> 41.177.26.15 TCP 70 60848 > http [ACK] Seq=323 Ack=26313 Win=60864 Len=0 TSval=2051512503 TSecr=140346859
154166  52.670279 68.157.168.224 -> 41.177.26.15 TCP 70 60848 > http [ACK] Seq=323 Ack=27761 Win=62656 Len=0 TSval=2051512503 TSecr=140346859
154167  52.670283 68.157.168.224 -> 41.177.26.15 TCP 70 60848 > http [ACK] Seq=323 Ack=29209 Win=61248 Len=0 TSval=2051512503 TSecr=140346859
154301  52.712268 68.157.168.224 -> 41.177.26.15 TCP 70 60848 > http [ACK] Seq=323 Ack=30657 Win=64128 Len=0 TSval=2051512545 TSecr=140346863
154303  52.712518 68.157.168.224 -> 41.177.26.15 TCP 70 60848 > http [ACK] Seq=323 Ack=33065 Win=64128 Len=0 TSval=2051512546 TSecr=140346863
154305  52.712618 68.157.168.224 -> 41.177.26.15 TCP 70 60848 > http [ACK] Seq=323 Ack=42713 Win=55488 Len=0 TSval=2051512546 TSecr=140346863
154311  52.712794 68.157.168.224 -> 41.177.26.15 TCP 70 60848 > http [ACK] Seq=323 Ack=45609 Win=64128 Len=0 TSval=2051512546 TSecr=140346863
154315  52.712985 68.157.168.224 -> 41.177.26.15 TCP 70 60848 > http [ACK] Seq=323 Ack=62009 Win=47680 Len=0 TSval=2051512546 TSecr=140346863
154445  52.752857 68.157.168.224 -> 41.177.26.15 TCP 70 60848 > http [ACK] Seq=323 Ack=63457 Win=64128 Len=0 TSval=2051512586 TSecr=140346863
154451  52.754868 68.157.168.224 -> 41.177.26.15 TCP 70 60848 > http [ACK] Seq=323 Ack=65865 Win=64128 Len=0 TSval=2051512588 TSecr=140346867
154455  52.755177 68.157.168.224 -> 41.177.26.15 TCP 70 60848 > http [ACK] Seq=323 Ack=67313 Win=67008 Len=0 TSval=2051512588 TSecr=140346867
154456  52.755182 68.157.168.224 -> 41.177.26.15 TCP 70 60848 > http [ACK] Seq=323 Ack=68761 Win=67904 Len=0 TSval=2051512588 TSecr=140346867
154457  52.755323 68.157.168.224 -> 41.177.26.15 TCP 70 60848 > http [ACK] Seq=323 Ack=71657 Win=68544 Len=0 TSval=2051512588 TSecr=140346867
154460  52.755491 68.157.168.224 -> 41.177.26.15 TCP 70 60848 > http [ACK] Seq=323 Ack=74065 Win=68544 Len=0 TSval=2051512588 TSecr=140346867
154472  52.755713 68.157.168.224 -> 41.177.26.15 TCP 70 60848 > http [ACK] Seq=323 Ack=81305 Win=63616 Len=0 TSval=2051512589 TSecr=140346867
154473  52.755717 68.157.168.224 -> 41.177.26.15 TCP 70 60848 > http [ACK] Seq=323 Ack=83713 Win=67904 Len=0 TSval=2051512589 TSecr=140346867
154476  52.755893 68.157.168.224 -> 41.177.26.15 TCP 70 60848 > http [ACK] Seq=323 Ack=86609 Win=68544 Len=0 TSval=2051512589 TSecr=140346867
154477  52.755897 68.157.168.224 -> 41.177.26.15 TCP 70 60848 > http [ACK] Seq=323 Ack=89505 Win=66496 Len=0 TSval=2051512589 TSecr=140346867
154481  52.755960 68.157.168.224 -> 41.177.26.15 TCP 70 60848 > http [ACK] Seq=323 Ack=91913 Win=67904 Len=0 TSval=2051512589 TSecr=140346867
154488  52.756098 68.157.168.224 -> 41.177.26.15 TCP 70 60848 > http [ACK] Seq=323 Ack=100113 Win=60736 Len=0 TSval=2051512589 TSecr=140346867
154496  52.756243 68.157.168.224 -> 41.177.26.15 TCP 70 60848 > http [ACK] Seq=323 Ack=103009 Win=62144 Len=0 TSval=2051512589 TSecr=140346867
154583  52.795438 68.157.168.224 -> 41.177.26.15 TCP 70 60848 > http [ACK] Seq=323 Ack=105905 Win=68544 Len=0 TSval=2051512628 TSecr=140346871
154587  52.797505 68.157.168.224 -> 41.177.26.15 TCP 70 60848 > http [ACK] Seq=323 Ack=109761 Win=67904 Len=0 TSval=2051512631 TSecr=140346871
154592  52.797925 68.157.168.224 -> 41.177.26.15 TCP 70 60848 > http [ACK] Seq=323 Ack=112657 Win=67904 Len=0 TSval=2051512631 TSecr=140346871
154593  52.797930 68.157.168.224 -> 41.177.26.15 TCP 70 60848 > http [ACK] Seq=323 Ack=115065 Win=67904 Len=0 TSval=2051512631 TSecr=140346871
154594  52.798040 68.157.168.224 -> 41.177.26.15 TCP 70 60848 > http [ACK] Seq=323 Ack=117961 Win=68544 Len=0 TSval=2051512631 TSecr=140346871
154595  52.798045 68.157.168.224 -> 41.177.26.15 TCP 70 60848 > http [ACK] Seq=323 Ack=127609 Win=59264 Len=0 TSval=2051512631 TSecr=140346871
154600  52.798169 68.157.168.224 -> 41.177.26.15 TCP 70 60848 > http [ACK] Seq=323 Ack=130505 Win=67904 Len=0 TSval=2051512631 TSecr=140346871
154606  52.798279 68.157.168.224 -> 41.177.26.15 TCP 70 60848 > http [ACK] Seq=323 Ack=135809 Win=68544 Len=0 TSval=2051512631 TSecr=140346871
154609  52.798337 68.157.168.224 -> 41.177.26.15 TCP 70 60848 > http [ACK] Seq=323 Ack=137257 Win=71424 Len=0 TSval=2051512631 TSecr=140346871
154610  52.798342 68.157.168.224 -> 41.177.26.15 TCP 70 60848 > http [ACK] Seq=323 Ack=138705 Win=74304 Len=0 TSval=2051512631 TSecr=140346871
154611  52.798346 68.157.168.224 -> 41.177.26.15 TCP 70 60848 > http [ACK] Seq=323 Ack=139665 Win=77184 Len=0 TSval=2051512631 TSecr=140346871
154613  52.798362 68.157.168.224 -> 41.177.26.15 TCP 70 60848 > http [ACK] Seq=323 Ack=141113 Win=80128 Len=0 TSval=2051512631 TSecr=140346871
154614  52.798367 68.157.168.224 -> 41.177.26.15 TCP 70 60848 > http [ACK] Seq=323 Ack=142561 Win=83008 Len=0 TSval=2051512631 TSecr=140346871
154615  52.798371 68.157.168.224 -> 41.177.26.15 TCP 70 60848 > http [ACK] Seq=323 Ack=144009 Win=85888 Len=0 TSval=2051512631 TSecr=140346871
154616  52.798643 68.157.168.224 -> 41.177.26.15 TCP 70 60848 > http [ACK] Seq=323 Ack=145457 Win=88768 Len=0 TSval=2051512632 TSecr=140346871
154617  52.798647 68.157.168.224 -> 41.177.26.15 TCP 70 60848 > http [ACK] Seq=323 Ack=146905 Win=91712 Len=0 TSval=2051512632 TSecr=140346872
154618  52.798651 68.157.168.224 -> 41.177.26.15 TCP 70 60848 > http [ACK] Seq=323 Ack=147865 Win=94592 Len=0 TSval=2051512632 TSecr=140346872
154619  52.798655 68.157.168.224 -> 41.177.26.15 TCP 70 60848 > http [ACK] Seq=323 Ack=149313 Win=97472 Len=0 TSval=2051512632 TSecr=140346872
154620  52.798712 68.157.168.224 -> 41.177.26.15 TCP 70 60848 > http [ACK] Seq=323 Ack=150761 Win=100352 Len=0 TSval=2051512632 TSecr=140346872
154621  52.798717 68.157.168.224 -> 41.177.26.15 TCP 70 60848 > http [ACK] Seq=323 Ack=152209 Win=103296 Len=0 TSval=2051512632 TSecr=140346872
154622  52.798722 68.157.168.224 -> 41.177.26.15 TCP 70 60848 > http [ACK] Seq=323 Ack=153657 Win=106176 Len=0 TSval=2051512632 TSecr=140346872
154623  52.798726 68.157.168.224 -> 41.177.26.15 TCP 70 60848 > http [ACK] Seq=323 Ack=155105 Win=109056 Len=0 TSval=2051512632 TSecr=140346872
154624  52.798729 68.157.168.224 -> 41.177.26.15 TCP 70 60848 > http [ACK] Seq=323 Ack=156065 Win=111936 Len=0 TSval=2051512632 TSecr=140346872
154625  52.798744 68.157.168.224 -> 41.177.26.15 TCP 70 60848 > http [ACK] Seq=323 Ack=157513 Win=114880 Len=0 TSval=2051512632 TSecr=140346872
154626  52.798748 68.157.168.224 -> 41.177.26.15 TCP 70 60848 > http [ACK] Seq=323 Ack=158961 Win=117760 Len=0 TSval=2051512632 TSecr=140346872
154627  52.798752 68.157.168.224 -> 41.177.26.15 TCP 70 60848 > http [ACK] Seq=323 Ack=160409 Win=120640 Len=0 TSval=2051512632 TSecr=140346872
154628  52.798756 68.157.168.224 -> 41.177.26.15 TCP 70 60848 > http [ACK] Seq=323 Ack=163305 Win=118144 Len=0 TSval=2051512632 TSecr=140346872
154769  52.838244 68.157.168.224 -> 41.177.26.15 TCP 70 60848 > http [ACK] Seq=323 Ack=164265 Win=123520 Len=0 TSval=2051512671 TSecr=140346875
154770  52.838249 68.157.168.224 -> 41.177.26.15 TCP 70 60848 > http [ACK] Seq=323 Ack=165713 Win=126464 Len=0 TSval=2051512671 TSecr=140346875
154771  52.838519 68.157.168.224 -> 41.177.26.15 TCP 70 60848 > http [ACK] Seq=323 Ack=167161 Win=128320 Len=0 TSval=2051512671 TSecr=140346875
154780  52.840034 68.157.168.224 -> 41.177.26.15 TCP 70 60848 > http [ACK] Seq=323 Ack=170057 Win=128320 Len=0 TSval=2051512673 TSecr=140346876
154782  52.840303 68.157.168.224 -> 41.177.26.15 TCP 70 60848 > http [ACK] Seq=323 Ack=172465 Win=128320 Len=0 TSval=2051512673 TSecr=140346876
154783  52.840482 68.157.168.224 -> 41.177.26.15 TCP 70 60848 > http [ACK] Seq=323 Ack=175361 Win=128320 Len=0 TSval=2051512674 TSecr=140346876
154784  52.840706 68.157.168.224 -> 41.177.26.15 TCP 70 60848 > http [ACK] Seq=323 Ack=178257 Win=128320 Len=0 TSval=2051512674 TSecr=140346876
154785  52.840734 68.157.168.224 -> 41.177.26.15 TCP 70 60848 > http [ACK] Seq=323 Ack=187758 Win=121024 Len=0 TSval=2051512674 TSecr=140346876
160590  54.684602 68.157.168.224 -> 41.177.26.15 TCP 70 60848 > http [ACK] Seq=599 Ack=187960 Win=128320 Len=0 TSval=2051514518 TSecr=140347060
179398  60.363780 68.157.168.224 -> 41.177.26.15 TCP 70 60848 > http [FIN, ACK] Seq=599 Ack=187960 Win=128320 Len=0 TSval=2051520197 TSecr=140347060
179464  60.406408 68.157.168.224 -> 41.177.26.15 TCP 70 60848 > http [ACK] Seq=600 Ack=187961 Win=128320 Len=0 TSval=2051520239 TSecr=140347632
181868  61.132249 68.157.168.224 -> 41.177.26.15 TCP 78 58128 > http [SYN] Seq=0 Win=5840 Len=0 MSS=1460 SACK_PERM=1 TSval=2051520965 TSecr=0 WS=64
181986  61.174879 68.157.168.224 -> 41.177.26.15 TCP 70 58128 > http [ACK] Seq=1 Ack=1 Win=5888 Len=0 TSval=2051521007 TSecr=140347709
182144  61.229642 68.157.168.224 -> 41.177.26.15 TCP 70 58128 > http [ACK] Seq=457 Ack=1449 Win=8768 Len=0 TSval=2051521062 TSecr=140347715
182148  61.230058 68.157.168.224 -> 41.177.26.15 TCP 70 58128 > http [ACK] Seq=457 Ack=2897 Win=11648 Len=0 TSval=2051521062 TSecr=140347715
182150  61.230173 68.157.168.224 -> 41.177.26.15 TCP 70 58128 > http [ACK] Seq=457 Ack=4345 Win=14528 Len=0 TSval=2051521063 TSecr=140347715
182325  61.272373 68.157.168.224 -> 41.177.26.15 TCP 70 58128 > http [ACK] Seq=457 Ack=5793 Win=17472 Len=0 TSval=2051521105 TSecr=140347719
182326  61.272415 68.157.168.224 -> 41.177.26.15 TCP 70 58128 > http [ACK] Seq=457 Ack=7241 Win=20352 Len=0 TSval=2051521105 TSecr=140347719
182329  61.272496 68.157.168.224 -> 41.177.26.15 TCP 70 58128 > http [ACK] Seq=457 Ack=8347 Win=23232 Len=0 TSval=2051521105 TSecr=140347719
193646  66.590004 68.157.168.224 -> 41.177.26.15 TCP 70 58128 > http [FIN, ACK] Seq=457 Ack=8347 Win=23232 Len=0 TSval=2051526422 TSecr=140347719
193751  66.633135 68.157.168.224 -> 41.177.26.15 TCP 70 58128 > http [ACK] Seq=458 Ack=8348 Win=23232 Len=0 TSval=2051526465 TSecr=140348255
203203  70.046969 68.157.168.224 -> 41.177.26.15 TCP 78 63686 > http [SYN] Seq=0 Win=5840 Len=0 MSS=1460 SACK_PERM=1 TSval=2051529879 TSecr=0 WS=64
203339  70.089473 68.157.168.224 -> 41.177.26.15 TCP 70 63686 > http [ACK] Seq=1 Ack=1 Win=5888 Len=0 TSval=2051529922 TSecr=140348601
209034  71.946716 68.157.168.224 -> 41.177.26.15 TCP 70 63686 > http [ACK] Seq=375 Ack=1449 Win=8768 Len=0 TSval=2051531779 TSecr=140348786
209035  71.946720 68.157.168.224 -> 41.177.26.15 TCP 70 63686 > http [ACK] Seq=375 Ack=2897 Win=11648 Len=0 TSval=2051531779 TSecr=140348786
209036  71.946724 68.157.168.224 -> 41.177.26.15 TCP 70 63686 > http [ACK] Seq=375 Ack=4345 Win=14528 Len=0 TSval=2051531779 TSecr=140348786
209037  71.946728 68.157.168.224 -> 41.177.26.15 TCP 70 63686 > http [ACK] Seq=375 Ack=5793 Win=17472 Len=0 TSval=2051531779 TSecr=140348786
209090  71.989303 68.157.168.224 -> 41.177.26.15 TCP 70 63686 > http [ACK] Seq=375 Ack=7241 Win=20352 Len=0 TSval=2051531822 TSecr=140348791
209091  71.989399 68.157.168.224 -> 41.177.26.15 TCP 70 63686 > http [ACK] Seq=375 Ack=8476 Win=23232 Len=0 TSval=2051531822 TSecr=140348791
209092  71.989403 68.157.168.224 -> 41.177.26.15 TCP 70 63686 > http [ACK] Seq=375 Ack=9924 Win=26112 Len=0 TSval=2051531822 TSecr=140348791
209093  71.989426 68.157.168.224 -> 41.177.26.15 TCP 70 63686 > http [ACK] Seq=375 Ack=11372 Win=29056 Len=0 TSval=2051531822 TSecr=140348791
209102  71.990121 68.157.168.224 -> 41.177.26.15 TCP 70 63686 > http [ACK] Seq=375 Ack=12820 Win=31936 Len=0 TSval=2051531822 TSecr=140348791
209103  71.990126 68.157.168.224 -> 41.177.26.15 TCP 70 63686 > http [ACK] Seq=375 Ack=14268 Win=34816 Len=0 TSval=2051531822 TSecr=140348791
209104  71.990130 68.157.168.224 -> 41.177.26.15 TCP 70 63686 > http [ACK] Seq=375 Ack=15716 Win=37696 Len=0 TSval=2051531822 TSecr=140348791
209105  71.990246 68.157.168.224 -> 41.177.26.15 TCP 70 63686 > http [ACK] Seq=375 Ack=16668 Win=40640 Len=0 TSval=2051531822 TSecr=140348791
209149  72.032452 68.157.168.224 -> 41.177.26.15 TCP 70 63686 > http [ACK] Seq=375 Ack=18116 Win=43520 Len=0 TSval=2051531865 TSecr=140348795
209150  72.032522 68.157.168.224 -> 41.177.26.15 TCP 70 63686 > http [ACK] Seq=375 Ack=19564 Win=46400 Len=0 TSval=2051531865 TSecr=140348795
209151  72.032527 68.157.168.224 -> 41.177.26.15 TCP 70 63686 > http [ACK] Seq=375 Ack=21012 Win=49280 Len=0 TSval=2051531865 TSecr=140348795
