570247 182.212212 68.157.168.210 -> 41.177.26.176 TCP 78 59040 > http [SYN] Seq=0 Win=5840 Len=0 MSS=1460 SACK_PERM=1 TSval=895496412 TSecr=0 WS=64
570428 182.255258 68.157.168.210 -> 41.177.26.176 TCP 70 59040 > http [ACK] Seq=1 Ack=1 Win=5888 Len=0 TSval=895496455 TSecr=140359817
579527 184.208324 68.157.168.210 -> 41.177.26.176 TCP 70 59040 > http [ACK] Seq=375 Ack=1449 Win=8768 Len=0 TSval=895498408 TSecr=140360012
579531 184.208510 68.157.168.210 -> 41.177.26.176 TCP 70 59040 > http [ACK] Seq=375 Ack=1471 Win=8768 Len=0 TSval=895498408 TSecr=140360012
579540 184.218595 68.157.168.210 -> 41.177.26.176 TCP 70 59040 > http [ACK] Seq=375 Ack=2136 Win=11648 Len=0 TSval=895498419 TSecr=140360013
579542 184.218759 68.157.168.210 -> 41.177.26.176 TCP 70 59040 > http [ACK] Seq=375 Ack=2547 Win=14528 Len=0 TSval=895498419 TSecr=140360014
579545 184.219222 68.157.168.210 -> 41.177.26.176 TCP 70 59040 > http [ACK] Seq=375 Ack=3274 Win=17472 Len=0 TSval=895498419 TSecr=140360014
579546 184.219252 68.157.168.210 -> 41.177.26.176 TCP 70 59040 > http [ACK] Seq=375 Ack=3300 Win=17472 Len=0 TSval=895498419 TSecr=140360014
579611 184.251223 68.157.168.210 -> 41.177.26.176 TCP 70 59040 > http [ACK] Seq=375 Ack=4748 Win=20352 Len=0 TSval=895498451 TSecr=140360017
579612 184.251227 68.157.168.210 -> 41.177.26.176 TCP 70 59040 > http [ACK] Seq=375 Ack=5612 Win=23232 Len=0 TSval=895498451 TSecr=140360017
579620 184.251604 68.157.168.210 -> 41.177.26.176 TCP 70 59040 > http [ACK] Seq=375 Ack=7060 Win=26112 Len=0 TSval=895498452 TSecr=140360017
579621 184.251608 68.157.168.210 -> 41.177.26.176 TCP 70 59040 > http [ACK] Seq=375 Ack=8508 Win=29056 Len=0 TSval=895498452 TSecr=140360017
579645 184.261461 68.157.168.210 -> 41.177.26.176 TCP 70 59040 > http [ACK] Seq=375 Ack=9028 Win=31936 Len=0 TSval=895498461 TSecr=140360018
579646 184.261609 68.157.168.210 -> 41.177.26.176 TCP 70 59040 > http [ACK] Seq=375 Ack=10476 Win=34816 Len=0 TSval=895498462 TSecr=140360018
579647 184.261825 68.157.168.210 -> 41.177.26.176 TCP 70 59040 > http [ACK] Seq=375 Ack=11924 Win=37696 Len=0 TSval=895498462 TSecr=140360018
579648 184.262085 68.157.168.210 -> 41.177.26.176 TCP 70 59040 > http [ACK] Seq=375 Ack=13069 Win=40640 Len=0 TSval=895498462 TSecr=140360018
600733 190.411755 68.157.168.210 -> 41.177.26.176 TCP 70 59040 > http [FIN, ACK] Seq=375 Ack=13069 Win=40640 Len=0 TSval=895504611 TSecr=140360018
600853 190.454879 68.157.168.210 -> 41.177.26.176 TCP 70 59040 > http [ACK] Seq=376 Ack=13070 Win=40640 Len=0 TSval=895504655 TSecr=140360637
767783 248.194319 68.157.168.210 -> 41.177.26.176 TCP 78 61767 > http [SYN] Seq=0 Win=5840 Len=0 MSS=1460 SACK_PERM=1 TSval=895562392 TSecr=0 WS=64
767867 248.237339 68.157.168.210 -> 41.177.26.176 TCP 70 61767 > http [ACK] Seq=1 Ack=1 Win=5888 Len=0 TSval=895562435 TSecr=140366415
771826 249.357136 68.157.168.210 -> 41.177.26.176 TCP 70 61767 > http [ACK] Seq=369 Ack=839 Win=7552 Len=0 TSval=895563555 TSecr=140366527
771831 249.357443 68.157.168.210 -> 41.177.26.176 TCP 70 61767 > http [ACK] Seq=369 Ack=1592 Win=9216 Len=0 TSval=895563555 TSecr=140366527
771981 249.369050 68.157.168.210 -> 41.177.26.176 TCP 70 61767 > http [ACK] Seq=369 Ack=2541 Win=11136 Len=0 TSval=895563567 TSecr=140366529
771984 249.369130 68.157.168.210 -> 41.177.26.176 TCP 70 61767 > http [ACK] Seq=369 Ack=2949 Win=12992 Len=0 TSval=895563567 TSecr=140366529
771992 249.369420 68.157.168.210 -> 41.177.26.176 TCP 70 61767 > http [ACK] Seq=369 Ack=3643 Win=14912 Len=0 TSval=895563567 TSecr=140366529
772417 249.400784 68.157.168.210 -> 41.177.26.176 TCP 70 61767 > http [ACK] Seq=369 Ack=5091 Win=17792 Len=0 TSval=895563598 TSecr=140366532
772418 249.400789 68.157.168.210 -> 41.177.26.176 TCP 70 61767 > http [ACK] Seq=369 Ack=6429 Win=20736 Len=0 TSval=895563598 TSecr=140366532
772419 249.400809 68.157.168.210 -> 41.177.26.176 TCP 70 61767 > http [ACK] Seq=369 Ack=7877 Win=23616 Len=0 TSval=895563598 TSecr=140366532
772576 249.411817 68.157.168.210 -> 41.177.26.176 TCP 70 61767 > http [ACK] Seq=369 Ack=9325 Win=26496 Len=0 TSval=895563610 TSecr=140366533
772578 249.411842 68.157.168.210 -> 41.177.26.176 TCP 70 61767 > http [ACK] Seq=369 Ack=10423 Win=29376 Len=0 TSval=895563610 TSecr=140366533
786177 255.067601 68.157.168.210 -> 41.177.26.176 TCP 70 61767 > http [FIN, ACK] Seq=369 Ack=10423 Win=29376 Len=0 TSval=895569265 TSecr=140366533
786253 255.110915 68.157.168.210 -> 41.177.26.176 TCP 70 61767 > http [ACK] Seq=370 Ack=10424 Win=29376 Len=0 TSval=895569309 TSecr=140367103
