190780  65.615814 68.157.168.0 -> 41.177.26.176 TCP 78 49580 > http [SYN] Seq=0 Win=5840 Len=0 MSS=1460 SACK_PERM=1 TSval=3125673275 TSecr=0 WS=64
190870  65.658595 68.157.168.0 -> 41.177.26.176 TCP 70 49580 > http [ACK] Seq=1 Ack=1 Win=5888 Len=0 TSval=3125673318 TSecr=140348157
194965  67.012987 68.157.168.0 -> 41.177.26.176 TCP 70 49580 > http [ACK] Seq=294 Ack=1446 Win=8768 Len=0 TSval=3125674672 TSecr=140348293
195001  67.022317 68.157.168.0 -> 41.177.26.176 TCP 70 49580 > http [ACK] Seq=294 Ack=2206 Win=11648 Len=0 TSval=3125674682 TSecr=140348294
195002  67.022414 68.157.168.0 -> 41.177.26.176 TCP 70 49580 > http [ACK] Seq=294 Ack=2386 Win=14528 Len=0 TSval=3125674682 TSecr=140348294
195006  67.022975 68.157.168.0 -> 41.177.26.176 TCP 70 49580 > http [ACK] Seq=294 Ack=2566 Win=17408 Len=0 TSval=3125674682 TSecr=140348294
195007  67.022980 68.157.168.0 -> 41.177.26.176 TCP 70 49580 > http [ACK] Seq=294 Ack=2657 Win=17408 Len=0 TSval=3125674682 TSecr=140348294
195008  67.022984 68.157.168.0 -> 41.177.26.176 TCP 70 49580 > http [ACK] Seq=294 Ack=2840 Win=20352 Len=0 TSval=3125674682 TSecr=140348294
195009  67.023003 68.157.168.0 -> 41.177.26.176 TCP 70 49580 > http [ACK] Seq=294 Ack=3672 Win=23232 Len=0 TSval=3125674683 TSecr=140348294
195122  67.055889 68.157.168.0 -> 41.177.26.176 TCP 70 49580 > http [ACK] Seq=294 Ack=5120 Win=26112 Len=0 TSval=3125674715 TSecr=140348297
195127  67.056388 68.157.168.0 -> 41.177.26.176 TCP 70 49580 > http [ACK] Seq=294 Ack=6065 Win=28992 Len=0 TSval=3125674716 TSecr=140348297
195165  67.065110 68.157.168.0 -> 41.177.26.176 TCP 70 49580 > http [ACK] Seq=294 Ack=7513 Win=31936 Len=0 TSval=3125674725 TSecr=140348298
195166  67.065115 68.157.168.0 -> 41.177.26.176 TCP 70 49580 > http [ACK] Seq=294 Ack=8961 Win=34816 Len=0 TSval=3125674725 TSecr=140348298
195169  67.065508 68.157.168.0 -> 41.177.26.176 TCP 70 49580 > http [ACK] Seq=294 Ack=9689 Win=37696 Len=0 TSval=3125674725 TSecr=140348298
211415  72.817499 68.157.168.0 -> 41.177.26.176 TCP 70 49580 > http [FIN, ACK] Seq=294 Ack=9689 Win=37696 Len=0 TSval=3125680477 TSecr=140348298
211615  72.860772 68.157.168.0 -> 41.177.26.176 TCP 70 49580 > http [ACK] Seq=295 Ack=9690 Win=37696 Len=0 TSval=3125680520 TSecr=140348878
