760962 245.456065 68.157.168.40 -> 41.177.26.176 TCP 78 57322 > http [SYN] Seq=0 Win=5840 Len=0 MSS=1460 SACK_PERM=1 TSval=3260387890 TSecr=0 WS=64
761088 245.499635 68.157.168.40 -> 41.177.26.176 TCP 70 57322 > http [ACK] Seq=1 Ack=1 Win=5888 Len=0 TSval=3260387933 TSecr=140366142
763660 246.464896 68.157.168.40 -> 41.177.26.176 TCP 70 57322 > http [ACK] Seq=356 Ack=1449 Win=8768 Len=0 TSval=3260388898 TSecr=140366238
763661 246.464901 68.157.168.40 -> 41.177.26.176 TCP 70 57322 > http [ACK] Seq=356 Ack=1501 Win=8768 Len=0 TSval=3260388898 TSecr=140366238
763706 246.477068 68.157.168.40 -> 41.177.26.176 TCP 70 57322 > http [ACK] Seq=356 Ack=2166 Win=11648 Len=0 TSval=3260388911 TSecr=140366239
763707 246.477073 68.157.168.40 -> 41.177.26.176 TCP 70 57322 > http [ACK] Seq=356 Ack=2411 Win=14528 Len=0 TSval=3260388911 TSecr=140366239
763708 246.477097 68.157.168.40 -> 41.177.26.176 TCP 70 57322 > http [ACK] Seq=356 Ack=2656 Win=17472 Len=0 TSval=3260388911 TSecr=140366239
763709 246.477191 68.157.168.40 -> 41.177.26.176 TCP 70 57322 > http [ACK] Seq=356 Ack=2901 Win=20352 Len=0 TSval=3260388911 TSecr=140366239
763712 246.477320 68.157.168.40 -> 41.177.26.176 TCP 70 57322 > http [ACK] Seq=356 Ack=2994 Win=20352 Len=0 TSval=3260388911 TSecr=140366239
763713 246.477324 68.157.168.40 -> 41.177.26.176 TCP 70 57322 > http [ACK] Seq=356 Ack=4001 Win=23232 Len=0 TSval=3260388911 TSecr=140366239
763841 246.508381 68.157.168.40 -> 41.177.26.176 TCP 70 57322 > http [ACK] Seq=356 Ack=5449 Win=26112 Len=0 TSval=3260388942 TSecr=140366242
763842 246.508385 68.157.168.40 -> 41.177.26.176 TCP 70 57322 > http [ACK] Seq=356 Ack=6768 Win=29056 Len=0 TSval=3260388942 TSecr=140366242
763843 246.508389 68.157.168.40 -> 41.177.26.176 TCP 70 57322 > http [ACK] Seq=356 Ack=8216 Win=31936 Len=0 TSval=3260388942 TSecr=140366242
763900 246.520059 68.157.168.40 -> 41.177.26.176 TCP 70 57322 > http [ACK] Seq=356 Ack=9664 Win=34816 Len=0 TSval=3260388954 TSecr=140366244
763903 246.520449 68.157.168.40 -> 41.177.26.176 TCP 70 57322 > http [ACK] Seq=356 Ack=10810 Win=37696 Len=0 TSval=3260388954 TSecr=140366244
782943 253.458126 68.157.168.40 -> 41.177.26.176 TCP 70 57322 > http [ACK] Seq=817 Ack=12258 Win=40640 Len=0 TSval=3260395891 TSecr=140366937
782944 253.458131 68.157.168.40 -> 41.177.26.176 TCP 70 57322 > http [ACK] Seq=817 Ack=12297 Win=40640 Len=0 TSval=3260395891 TSecr=140366937
782951 253.467641 68.157.168.40 -> 41.177.26.176 TCP 70 57322 > http [ACK] Seq=817 Ack=12974 Win=43520 Len=0 TSval=3260395901 TSecr=140366938
782952 253.467646 68.157.168.40 -> 41.177.26.176 TCP 70 57322 > http [ACK] Seq=817 Ack=13065 Win=43520 Len=0 TSval=3260395901 TSecr=140366938
782953 253.467937 68.157.168.40 -> 41.177.26.176 TCP 70 57322 > http [ACK] Seq=817 Ack=13370 Win=46400 Len=0 TSval=3260395901 TSecr=140366938
782954 253.467942 68.157.168.40 -> 41.177.26.176 TCP 70 57322 > http [ACK] Seq=817 Ack=13675 Win=49280 Len=0 TSval=3260395901 TSecr=140366938
782955 253.467946 68.157.168.40 -> 41.177.26.176 TCP 70 57322 > http [ACK] Seq=817 Ack=13983 Win=52224 Len=0 TSval=3260395901 TSecr=140366938
782956 253.467969 68.157.168.40 -> 41.177.26.176 TCP 70 57322 > http [ACK] Seq=817 Ack=15062 Win=55104 Len=0 TSval=3260395901 TSecr=140366938
782959 253.468762 68.157.168.40 -> 41.177.26.176 TCP 70 57322 > http [ACK] Seq=817 Ack=16510 Win=57984 Len=0 TSval=3260395902 TSecr=140366938
782960 253.468767 68.157.168.40 -> 41.177.26.176 TCP 70 57322 > http [ACK] Seq=817 Ack=17264 Win=60864 Len=0 TSval=3260395902 TSecr=140366938
782961 253.468771 68.157.168.40 -> 41.177.26.176 TCP 70 57322 > http [ACK] Seq=817 Ack=17555 Win=61248 Len=0 TSval=3260395902 TSecr=140366938
782962 253.468775 68.157.168.40 -> 41.177.26.176 TCP 70 57322 > http [ACK] Seq=817 Ack=17571 Win=63808 Len=0 TSval=3260395902 TSecr=140366938
782963 253.468779 68.157.168.40 -> 41.177.26.176 TCP 70 57322 > http [ACK] Seq=817 Ack=17616 Win=63808 Len=0 TSval=3260395902 TSecr=140366938
782996 253.477495 68.157.168.40 -> 41.177.26.176 TCP 70 57322 > http [ACK] Seq=817 Ack=18096 Win=64128 Len=0 TSval=3260395911 TSecr=140366939
782998 253.477625 68.157.168.40 -> 41.177.26.176 TCP 70 57322 > http [ACK] Seq=817 Ack=19544 Win=64128 Len=0 TSval=3260395911 TSecr=140366939
782999 253.477629 68.157.168.40 -> 41.177.26.176 TCP 70 57322 > http [ACK] Seq=817 Ack=20992 Win=62656 Len=0 TSval=3260395911 TSecr=140366939
783001 253.477933 68.157.168.40 -> 41.177.26.176 TCP 70 57322 > http [ACK] Seq=817 Ack=22426 Win=64128 Len=0 TSval=3260395911 TSecr=140366939
783020 253.493239 68.157.168.40 -> 41.177.26.176 TCP 70 57322 > http [ACK] Seq=817 Ack=22431 Win=64128 Len=0 TSval=3260395927 TSecr=140366941
795658 259.297388 68.157.168.40 -> 41.177.26.176 TCP 70 57322 > http [FIN, ACK] Seq=817 Ack=22431 Win=64128 Len=0 TSval=3260401731 TSecr=140366941
795731 259.340656 68.157.168.40 -> 41.177.26.176 TCP 70 57322 > http [ACK] Seq=818 Ack=22432 Win=64128 Len=0 TSval=3260401774 TSecr=140367526
