69268  28.744261 68.252.139.26 -> 41.177.26.176 TCP 66 29488 > http [SYN] Seq=0 Win=65535 Len=0 MSS=1460 SACK_PERM=1
69318  28.769656 68.252.139.26 -> 41.177.26.176 TCP 64 29488 > http [ACK] Seq=1 Ack=1 Win=65535 Len=0
69661  28.880135 68.252.139.26 -> 41.177.26.176 TCP 64 29488 > http [ACK] Seq=453 Ack=1749 Win=65535 Len=0
69692  28.910880 68.252.139.26 -> 41.177.26.176 TCP 64 29488 > http [ACK] Seq=453 Ack=4669 Win=65535 Len=0
69724  28.918147 68.252.139.26 -> 41.177.26.176 TCP 64 29488 > http [ACK] Seq=453 Ack=7589 Win=65535 Len=0
69858  28.943590 68.252.139.26 -> 41.177.26.176 TCP 64 29488 > http [ACK] Seq=453 Ack=9941 Win=65535 Len=0
69862  28.951073 68.252.139.26 -> 41.177.26.176 TCP 64 29488 > http [ACK] Seq=453 Ack=12861 Win=65535 Len=0
69886  28.959655 68.252.139.26 -> 41.177.26.176 TCP 64 29488 > http [ACK] Seq=453 Ack=15781 Win=65535 Len=0
69910  28.975808 68.252.139.26 -> 41.177.26.176 TCP 64 29488 > http [ACK] Seq=453 Ack=18133 Win=65535 Len=0
70050  29.021203 68.252.139.26 -> 41.177.26.176 TCP 64 29488 > http [ACK] Seq=910 Ack=21039 Win=65535 Len=0
70053  29.025831 68.252.139.26 -> 41.177.26.176 TCP 64 29488 > http [ACK] Seq=910 Ack=23264 Win=65535 Len=0
123631  44.021443 68.252.139.26 -> 41.177.26.176 TCP 64 29488 > http [ACK] Seq=910 Ack=23265 Win=65535 Len=0
160490  54.650476 68.252.139.26 -> 41.177.26.176 TCP 64 29488 > http [FIN, ACK] Seq=910 Ack=23265 Win=65535 Len=0
