40069  16.676740 68.33.217.43 -> 244.3.31.168 TCP 82 54337 > https [SYN] Seq=0 Win=65535 Len=0 MSS=1460 WS=8 TSval=761217137 TSecr=0 SACK_PERM=1
42784  18.084411 68.33.217.43 -> 244.3.31.168 TCP 70 54337 > https [ACK] Seq=118 Ack=1147 Win=524280 Len=0 TSval=761217146 TSecr=1061436607
50124  20.393881 68.33.217.43 -> 244.3.31.168 TCP 70 54337 > https [ACK] Seq=316 Ack=1206 Win=524280 Len=0 TSval=761217176 TSecr=1061439626
54162  22.431317 68.33.217.43 -> 244.3.31.168 TCP 70 54337 > https [ACK] Seq=881 Ack=2032 Win=524280 Len=0 TSval=761217196 TSecr=1061441611
54521  22.582900 68.33.217.43 -> 244.3.31.168 TCP 70 54337 > https [FIN, ACK] Seq=918 Ack=2032 Win=524280 Len=0 TSval=761217196 TSecr=1061441611
54765  22.678233 68.33.217.43 -> 244.3.31.168 TCP 82 54340 > https [SYN] Seq=0 Win=65535 Len=0 MSS=1460 WS=8 TSval=761217196 TSecr=0 SACK_PERM=1
55059  22.766288 68.33.217.43 -> 244.3.31.168 TCP 64 54337 > https [RST] Seq=881 Win=0 Len=0
56861  23.350292 68.33.217.43 -> 244.3.31.168 TCP 82 [TCP Retransmission] 54340 > https [SYN] Seq=0 Win=65535 Len=0 MSS=1460 WS=8 TSval=761217205 TSecr=0 SACK_PERM=1
57228  23.432677 68.33.217.43 -> 244.3.31.168 TCP 70 54340 > https [ACK] Seq=1 Ack=1 Win=524280 Len=0 TSval=761217206 TSecr=1061442606
59162  23.848912 68.33.217.43 -> 244.3.31.168 TCP 70 54340 > https [ACK] Seq=150 Ack=139 Win=524280 Len=0 TSval=761217211 TSecr=1061443066
60254  24.352876 68.33.217.43 -> 244.3.31.168 TCP 70 54340 > https [ACK] Seq=806 Ack=1587 Win=524280 Len=0 TSval=761217215 TSecr=1061443337
76957  30.756767 68.33.217.43 -> 244.3.31.168 TCP 70 54340 > https [ACK] Seq=806 Ack=3035 Win=524280 Len=0 TSval=761217279 TSecr=1061449878
78278  31.132903 68.33.217.43 -> 244.3.31.168 TCP 70 54340 > https [ACK] Seq=806 Ack=4483 Win=524280 Len=0 TSval=761217281 TSecr=1061450012
81297  31.806983 68.33.217.43 -> 244.3.31.168 TCP 70 54340 > https [ACK] Seq=806 Ack=5800 Win=524280 Len=0 TSval=761217290 TSecr=1061451003
82035  31.992903 68.33.217.43 -> 244.3.31.168 TCP 70 54340 > https [FIN, ACK] Seq=843 Ack=5800 Win=524280 Len=0 TSval=761217290 TSecr=1061451003
146947  50.456922 68.33.217.43 -> 244.3.31.168 TCP 82 54344 > https [SYN] Seq=0 Win=65535 Len=0 MSS=1460 WS=8 TSval=761217476 TSecr=0 SACK_PERM=1
150247  51.586899 68.33.217.43 -> 244.3.31.168 TCP 82 [TCP Retransmission] 54344 > https [SYN] Seq=0 Win=65535 Len=0 MSS=1460 WS=8 TSval=761217485 TSecr=0 SACK_PERM=1
150553  51.662911 68.33.217.43 -> 244.3.31.168 TCP 70 54344 > https [ACK] Seq=1 Ack=1 Win=524280 Len=0 TSval=761217488 TSecr=1061470842
150895  51.782679 68.33.217.43 -> 244.3.31.168 TCP 70 54344 > https [ACK] Seq=150 Ack=139 Win=524280 Len=0 TSval=761217490 TSecr=1061471003
155226  52.973413 68.33.217.43 -> 244.3.31.168 TCP 70 54344 > https [ACK] Seq=886 Ack=1587 Win=524280 Len=0 TSval=761217501 TSecr=1061471757
155636  53.051166 68.33.217.43 -> 244.3.31.168 TCP 70 54344 > https [ACK] Seq=886 Ack=4483 Win=524176 Len=0 TSval=761217502 TSecr=1061472229
155970  53.190868 68.33.217.43 -> 244.3.31.168 TCP 70 54344 > https [ACK] Seq=886 Ack=5931 Win=524280 Len=0 TSval=761217503 TSecr=1061472306
156385  53.278986 68.33.217.43 -> 244.3.31.168 TCP 70 54344 > https [ACK] Seq=886 Ack=7899 Win=524280 Len=0 TSval=761217504 TSecr=1061472306
156692  53.360874 68.33.217.43 -> 244.3.31.168 TCP 70 54344 > https [FIN, ACK] Seq=923 Ack=7899 Win=524280 Len=0 TSval=761217504 TSecr=1061472306
224483  76.725002 68.33.217.43 -> 244.3.31.168 TCP 82 54356 > https [SYN] Seq=0 Win=65535 Len=0 MSS=1460 WS=8 TSval=761217738 TSecr=0 SACK_PERM=1
225536  77.160756 68.33.217.43 -> 244.3.31.168 TCP 70 54356 > https [ACK] Seq=1 Ack=1 Win=524280 Len=0 TSval=761217740 TSecr=1061495980
226434  77.404778 68.33.217.43 -> 244.3.31.168 TCP 70 54356 > https [ACK] Seq=150 Ack=139 Win=524280 Len=0 TSval=761217744 TSecr=1061496421
227778  78.044804 68.33.217.43 -> 244.3.31.168 TCP 70 54356 > https [ACK] Seq=806 Ack=3035 Win=524280 Len=0 TSval=761217749 TSecr=1061496902
227779  78.044809 68.33.217.43 -> 244.3.31.168 TCP 70 54356 > https [ACK] Seq=806 Ack=5800 Win=524280 Len=0 TSval=761217750 TSecr=1061496902
227785  78.050638 68.33.217.43 -> 244.3.31.168 TCP 70 [TCP Previous segment not captured] 54356 > https [FIN, ACK] Seq=843 Ack=5800 Win=524280 Len=0 TSval=761217750 TSecr=1061496902
235696  82.192675 68.33.217.43 -> 244.3.31.168 TCP 82 54357 > https [SYN] Seq=0 Win=65535 Len=0 MSS=1460 WS=8 TSval=761217792 TSecr=0 SACK_PERM=1
235793  82.248880 68.33.217.43 -> 244.3.31.168 TCP 70 54357 > https [ACK] Seq=1 Ack=1 Win=524280 Len=0 TSval=761217794 TSecr=1061501448
235957  82.286871 68.33.217.43 -> 244.3.31.168 TCP 70 54357 > https [ACK] Seq=150 Ack=139 Win=524280 Len=0 TSval=761217794 TSecr=1061501517
237617  82.558260 68.33.217.43 -> 244.3.31.168 TCP 70 54357 > https [ACK] Seq=982 Ack=1039 Win=524280 Len=0 TSval=761217797 TSecr=1061501785
237822  82.604349 68.33.217.43 -> 244.3.31.168 TCP 70 54357 > https [ACK] Seq=982 Ack=1076 Win=524280 Len=0 TSval=761217797 TSecr=1061501787
237845  82.609748 68.33.217.43 -> 244.3.31.168 TCP 70 [TCP Previous segment not captured] 54357 > https [FIN, ACK] Seq=1019 Ack=1076 Win=524280 Len=0 TSval=761217797 TSecr=1061501787
237877  82.616833 68.33.217.43 -> 244.3.31.168 TCP 64 54357 > https [RST] Seq=982 Win=0 Len=0
237894  82.621620 68.33.217.43 -> 244.3.31.168 TCP 64 54357 > https [RST] Seq=982 Win=0 Len=0
237914  82.626416 68.33.217.43 -> 244.3.31.168 TCP 64 54357 > https [RST] Seq=982 Win=0 Len=0
237915  82.626421 68.33.217.43 -> 244.3.31.168 TCP 64 54357 > https [RST] Seq=1020 Win=0 Len=0
243115  84.604189 68.33.217.43 -> 244.3.31.168 TCP 82 54358 > http [SYN] Seq=0 Win=65535 Len=0 MSS=1460 WS=8 TSval=761217817 TSecr=0 SACK_PERM=1
243151  84.615860 68.33.217.43 -> 244.3.31.168 TCP 70 54358 > http [ACK] Seq=1 Ack=1 Win=524280 Len=0 TSval=761217818 TSecr=1061503859
243187  84.644225 68.33.217.43 -> 244.3.31.168 TCP 70 54358 > http [ACK] Seq=540 Ack=620 Win=524280 Len=0 TSval=761217818 TSecr=1061503879
243192  84.649164 68.33.217.43 -> 244.3.31.168 TCP 70 54358 > http [FIN, ACK] Seq=540 Ack=620 Win=524280 Len=0 TSval=761217818 TSecr=1061503879
243193  84.649169 68.33.217.43 -> 244.3.31.168 TCP 70 [TCP Out-Of-Order] 54358 > http [FIN, ACK] Seq=540 Ack=621 Win=524280 Len=0 TSval=761217818 TSecr=1061503879
243194  84.649173 68.33.217.43 -> 244.3.31.168 TCP 82 54359 > https [SYN] Seq=0 Win=65535 Len=0 MSS=1460 WS=8 TSval=761217818 TSecr=0 SACK_PERM=1
243195  84.649178 68.33.217.43 -> 244.3.31.168 TCP 70 [TCP Out-Of-Order] 54358 > http [FIN, ACK] Seq=540 Ack=621 Win=524280 Len=0 TSval=761217818 TSecr=1061503879
243237  84.665224 68.33.217.43 -> 244.3.31.168 TCP 70 [TCP Dup ACK 243195#1] 54358 > http [ACK] Seq=541 Ack=621 Win=524280 Len=0 TSval=761217818 TSecr=1061503904
243244  84.669225 68.33.217.43 -> 244.3.31.168 TCP 70 54359 > https [ACK] Seq=1 Ack=1 Win=524280 Len=0 TSval=761217818 TSecr=1061503904
243261  84.684485 68.33.217.43 -> 244.3.31.168 TCP 70 54359 > https [ACK] Seq=150 Ack=139 Win=524280 Len=0 TSval=761217818 TSecr=1061503925
243388  84.797409 68.33.217.43 -> 244.3.31.168 TCP 70 54359 > https [ACK] Seq=822 Ack=4483 Win=524176 Len=0 TSval=761217819 TSecr=1061503957
243487  84.831508 68.33.217.43 -> 244.3.31.168 TCP 70 54359 > https [ACK] Seq=822 Ack=5384 Win=524280 Len=0 TSval=761217819 TSecr=1061503957
243497  84.837597 68.33.217.43 -> 244.3.31.168 TCP 70 [TCP Previous segment not captured] 54359 > https [FIN, ACK] Seq=859 Ack=5384 Win=524280 Len=0 TSval=761217819 TSecr=1061503957
654448 204.888761 68.33.217.43 -> 244.3.31.168 TCP 82 54361 > https [SYN] Seq=0 Win=65535 Len=0 MSS=1460 WS=8 TSval=761219018 TSecr=0 SACK_PERM=1
654532 204.906303 68.33.217.43 -> 244.3.31.168 TCP 70 54361 > https [ACK] Seq=1 Ack=1 Win=524280 Len=0 TSval=761219019 TSecr=1061624144
654629 204.931354 68.33.217.43 -> 244.3.31.168 TCP 70 54361 > https [ACK] Seq=150 Ack=139 Win=524280 Len=0 TSval=761219020 TSecr=1061624170
654789 204.972828 68.33.217.43 -> 244.3.31.168 TCP 70 54361 > https [ACK] Seq=854 Ack=965 Win=524280 Len=0 TSval=761219020 TSecr=1061624208
654821 204.983181 68.33.217.43 -> 244.3.31.168 TCP 70 54361 > https [FIN, ACK] Seq=891 Ack=965 Win=524280 Len=0 TSval=761219020 TSecr=1061624208
654822 204.983186 68.33.217.43 -> 244.3.31.168 TCP 82 54362 > https [SYN] Seq=0 Win=65535 Len=0 MSS=1460 WS=8 TSval=761219020 TSecr=0 SACK_PERM=1
654839 204.986925 68.33.217.43 -> 244.3.31.168 TCP 64 54361 > https [RST] Seq=854 Win=0 Len=0
654840 204.986929 68.33.217.43 -> 244.3.31.168 TCP 64 54361 > https [RST] Seq=854 Win=0 Len=0
655049 205.078475 68.33.217.43 -> 244.3.31.168 TCP 64 54361 > https [RST] Seq=892 Win=0 Len=0
655058 205.083269 68.33.217.43 -> 244.3.31.168 TCP 70 54362 > https [ACK] Seq=1 Ack=1 Win=524280 Len=0 TSval=761219020 TSecr=1061624238
655125 205.109296 68.33.217.43 -> 244.3.31.168 TCP 70 54362 > https [ACK] Seq=150 Ack=139 Win=524280 Len=0 TSval=761219022 TSecr=1061624339
655413 205.257493 68.33.217.43 -> 244.3.31.168 TCP 70 54362 > https [ACK] Seq=886 Ack=4483 Win=524176 Len=0 TSval=761219023 TSecr=1061624386
655415 205.261295 68.33.217.43 -> 244.3.31.168 TCP 70 54362 > https [ACK] Seq=886 Ack=5384 Win=524280 Len=0 TSval=761219023 TSecr=1061624386
655419 205.264991 68.33.217.43 -> 244.3.31.168 TCP 70 54362 > https [FIN, ACK] Seq=923 Ack=5384 Win=524280 Len=0 TSval=761219023 TSecr=1061624386
976627 325.372653 68.33.217.43 -> 244.3.31.168 TCP 82 54369 > https [SYN] Seq=0 Win=65535 Len=0 MSS=1460 WS=8 TSval=761220222 TSecr=0 SACK_PERM=1
977110 325.556079 68.33.217.43 -> 244.3.31.168 TCP 70 54369 > https [ACK] Seq=1 Ack=1 Win=524280 Len=0 TSval=761220224 TSecr=1061744627
977597 325.694638 68.33.217.43 -> 244.3.31.168 TCP 70 54369 > https [ACK] Seq=150 Ack=1147 Win=524280 Len=0 TSval=761220225 TSecr=1061744816
978644 326.067343 68.33.217.43 -> 244.3.31.168 TCP 70 54369 > https [ACK] Seq=348 Ack=1206 Win=524280 Len=0 TSval=761220228 TSecr=1061745128
978800 326.165049 68.33.217.43 -> 244.3.31.168 TCP 70 54369 > https [ACK] Seq=993 Ack=2032 Win=524280 Len=0 TSval=761220230 TSecr=1061745335
978804 326.169033 68.33.217.43 -> 244.3.31.168 TCP 70 [TCP Previous segment not captured] 54369 > https [FIN, ACK] Seq=1030 Ack=2032 Win=524280 Len=0 TSval=761220230 TSecr=1061745335
978815 326.173218 68.33.217.43 -> 244.3.31.168 TCP 82 54370 > https [SYN] Seq=0 Win=65535 Len=0 MSS=1460 WS=8 TSval=761220230 TSecr=0 SACK_PERM=1
978816 326.173223 68.33.217.43 -> 244.3.31.168 TCP 64 54369 > https [RST] Seq=993 Win=0 Len=0
979078 326.333129 68.33.217.43 -> 244.3.31.168 TCP 64 54369 > https [RST] Seq=993 Win=0 Len=0
979135 326.348235 68.33.217.43 -> 244.3.31.168 TCP 64 54369 > https [RST] Seq=993 Win=0 Len=0
979141 326.358292 68.33.217.43 -> 244.3.31.168 TCP 64 54369 > https [RST] Seq=1031 Win=0 Len=0
979142 326.364364 68.33.217.43 -> 244.3.31.168 TCP 70 54370 > https [ACK] Seq=1 Ack=1 Win=524280 Len=0 TSval=761220233 TSecr=1061745428
979607 326.647017 68.33.217.43 -> 244.3.31.168 TCP 70 54370 > https [ACK] Seq=150 Ack=139 Win=524280 Len=0 TSval=761220235 TSecr=1061745619
980260 327.020995 68.33.217.43 -> 244.3.31.168 TCP 70 54370 > https [ACK] Seq=886 Ack=3035 Win=524280 Len=0 TSval=761220239 TSecr=1061746083
980953 327.474415 68.33.217.43 -> 244.3.31.168 TCP 70 54370 > https [ACK] Seq=886 Ack=6168 Win=524280 Len=0 TSval=761220242 TSecr=1061746276
980958 327.480360 68.33.217.43 -> 244.3.31.168 TCP 70 [TCP Dup ACK 980953#1] 54370 > https [ACK] Seq=886 Ack=6168 Win=524280 Len=0 TSval=761220242 TSecr=1061746276
981126 327.623033 68.33.217.43 -> 244.3.31.168 TCP 70 [TCP Previous segment not captured] 54370 > https [FIN, ACK] Seq=923 Ack=6168 Win=524280 Len=0 TSval=761220242 TSecr=1061746276
