2089   0.622342 68.33.110.51 -> 41.177.98.176 TCP 70 40662 > http [ACK] Seq=1 Ack=4345 Win=65160 Len=0 TSval=1083459066 TSecr=1540618
2103   0.626330 68.33.110.51 -> 41.177.98.176 TCP 70 [TCP Dup ACK 2089#1] 40662 > http [ACK] Seq=1 Ack=4345 Win=65160 Len=0 TSval=1083459066 TSecr=1540618
2158   0.660323 68.33.110.51 -> 41.177.98.176 TCP 70 40662 > http [ACK] Seq=1 Ack=9679 Win=65535 Len=0 TSval=1083459066 TSecr=1540621
2252   0.678563 68.33.110.51 -> 41.177.98.176 TCP 70 40662 > http [ACK] Seq=1 Ack=13359 Win=65535 Len=0 TSval=1083459066 TSecr=1540625
2300   0.692450 68.33.110.51 -> 41.177.98.176 TCP 70 40662 > http [ACK] Seq=1 Ack=17039 Win=65535 Len=0 TSval=1083459066 TSecr=1540625
2338   0.708394 68.33.110.51 -> 41.177.98.176 TCP 82 40663 > http [SYN] Seq=0 Win=65535 Len=0 MSS=1460 WS=1 TSval=1083459066 TSecr=0 SACK_PERM=1
2351   0.712460 68.33.110.51 -> 41.177.98.176 TCP 82 40664 > http [SYN] Seq=0 Win=65535 Len=0 MSS=1460 WS=1 TSval=1083459066 TSecr=0 SACK_PERM=1
2352   0.712464 68.33.110.51 -> 41.177.98.176 TCP 82 40665 > http [SYN] Seq=0 Win=65535 Len=0 MSS=1460 WS=1 TSval=1083459066 TSecr=0 SACK_PERM=1
2356   0.716428 68.33.110.51 -> 41.177.98.176 TCP 82 40666 > http [SYN] Seq=0 Win=65535 Len=0 MSS=1460 WS=1 TSval=1083459066 TSecr=0 SACK_PERM=1
2357   0.716433 68.33.110.51 -> 41.177.98.176 TCP 82 40667 > http [SYN] Seq=0 Win=65535 Len=0 MSS=1460 WS=1 TSval=1083459066 TSecr=0 SACK_PERM=1
2372   0.720474 68.33.110.51 -> 41.177.98.176 TCP 70 40663 > http [ACK] Seq=1 Ack=1 Win=65535 Len=0 TSval=1083459066 TSecr=1540629
2385   0.728338 68.33.110.51 -> 41.177.98.176 TCP 70 40664 > http [ACK] Seq=1 Ack=1 Win=65535 Len=0 TSval=1083459066 TSecr=1540630
2397   0.733378 68.33.110.51 -> 41.177.98.176 TCP 70 40665 > http [ACK] Seq=1 Ack=1 Win=65535 Len=0 TSval=1083459066 TSecr=1540630
2403   0.737352 68.33.110.51 -> 41.177.98.176 TCP 70 40666 > http [ACK] Seq=1 Ack=1 Win=65535 Len=0 TSval=1083459066 TSecr=1540630
2415   0.741373 68.33.110.51 -> 41.177.98.176 TCP 70 40667 > http [ACK] Seq=1 Ack=1 Win=65535 Len=0 TSval=1083459066 TSecr=1540630
2434   0.748385 68.33.110.51 -> 41.177.98.176 TCP 70 40663 > http [ACK] Seq=943 Ack=555 Win=65535 Len=0 TSval=1083459066 TSecr=1540631
2437   0.752422 68.33.110.51 -> 41.177.98.176 TCP 70 40664 > http [ACK] Seq=943 Ack=1535 Win=65535 Len=0 TSval=1083459066 TSecr=1540632
2438   0.752427 68.33.110.51 -> 41.177.98.176 TCP 70 40665 > http [ACK] Seq=942 Ack=2203 Win=65535 Len=0 TSval=1083459066 TSecr=1540632
2439   0.756365 68.33.110.51 -> 41.177.98.176 TCP 70 40666 > http [ACK] Seq=942 Ack=3195 Win=65160 Len=0 TSval=1083459066 TSecr=1540633
2446   0.760358 68.33.110.51 -> 41.177.98.176 TCP 70 [TCP Dup ACK 2439#1] 40666 > http [ACK] Seq=942 Ack=3195 Win=65160 Len=0 TSval=1083459066 TSecr=1540633
2489   0.764353 68.33.110.51 -> 41.177.98.176 TCP 70 40667 > http [ACK] Seq=942 Ack=4345 Win=63712 Len=0 TSval=1083459066 TSecr=1540633
2556   0.778425 68.33.110.51 -> 41.177.98.176 TCP 70 40666 > http [ACK] Seq=942 Ack=6091 Win=65535 Len=0 TSval=1083459066 TSecr=1540634
2585   0.800485 68.33.110.51 -> 41.177.98.176 TCP 70 40666 > http [ACK] Seq=942 Ack=8987 Win=65535 Len=0 TSval=1083459066 TSecr=1540634
2595   0.804369 68.33.110.51 -> 41.177.98.176 TCP 70 40667 > http [ACK] Seq=942 Ack=5431 Win=65522 Len=0 TSval=1083459066 TSecr=1540635
2777   0.908340 68.33.110.51 -> 41.177.98.176 TCP 70 40666 > http [ACK] Seq=942 Ack=11794 Win=65535 Len=0 TSval=1083459066 TSecr=1540636
2779   0.912352 68.33.110.51 -> 41.177.98.176 TCP 70 40662 > http [ACK] Seq=943 Ack=19862 Win=65535 Len=0 TSval=1083459066 TSecr=1540629
4344   1.301378 68.33.110.51 -> 41.177.98.176 TCP 70 40662 > http [ACK] Seq=1920 Ack=20611 Win=65535 Len=0 TSval=1083459067 TSecr=1540688
37834  15.738570 68.33.110.51 -> 41.177.98.176 TCP 70 40663 > http [ACK] Seq=943 Ack=556 Win=65535 Len=0 TSval=1083459096 TSecr=1542132
37908  15.748690 68.33.110.51 -> 41.177.98.176 TCP 70 40665 > http [ACK] Seq=942 Ack=2204 Win=65535 Len=0 TSval=1083459096 TSecr=1542133
37964  15.752331 68.33.110.51 -> 41.177.98.176 TCP 70 40664 > http [ACK] Seq=943 Ack=1536 Win=65535 Len=0 TSval=1083459096 TSecr=1542133
37984  15.756340 68.33.110.51 -> 41.177.98.176 TCP 70 40667 > http [ACK] Seq=942 Ack=5432 Win=65535 Len=0 TSval=1083459096 TSecr=1542134
37991  15.760331 68.33.110.51 -> 41.177.98.176 TCP 70 40666 > http [ACK] Seq=942 Ack=11795 Win=65535 Len=0 TSval=1083459096 TSecr=1542134
39419  16.306325 68.33.110.51 -> 41.177.98.176 TCP 70 40662 > http [ACK] Seq=1920 Ack=20612 Win=65535 Len=0 TSval=1083459097 TSecr=1542189
52549  21.818396 68.33.110.51 -> 41.177.98.176 TCP 70 40666 > http [FIN, ACK] Seq=942 Ack=11795 Win=65535 Len=0 TSval=1083459108 TSecr=1542134
52554  21.822428 68.33.110.51 -> 41.177.98.176 TCP 70 40667 > http [FIN, ACK] Seq=942 Ack=5432 Win=65535 Len=0 TSval=1083459108 TSecr=1542134
52557  21.826413 68.33.110.51 -> 41.177.98.176 TCP 70 40665 > http [FIN, ACK] Seq=942 Ack=2204 Win=65535 Len=0 TSval=1083459108 TSecr=1542133
52562  21.830478 68.33.110.51 -> 41.177.98.176 TCP 70 40664 > http [FIN, ACK] Seq=943 Ack=1536 Win=65535 Len=0 TSval=1083459108 TSecr=1542133
52563  21.830483 68.33.110.51 -> 41.177.98.176 TCP 70 40663 > http [FIN, ACK] Seq=943 Ack=556 Win=65535 Len=0 TSval=1083459108 TSecr=1542132
52564  21.830487 68.33.110.51 -> 41.177.98.176 TCP 70 40662 > http [FIN, ACK] Seq=1920 Ack=20612 Win=65535 Len=0 TSval=1083459108 TSecr=1542189
52565  21.830491 68.33.110.51 -> 41.177.98.176 TCP 82 40669 > http [SYN] Seq=0 Win=65535 Len=0 MSS=1460 WS=1 TSval=1083459108 TSecr=0 SACK_PERM=1
52589  21.840346 68.33.110.51 -> 41.177.98.176 TCP 70 40669 > http [ACK] Seq=1 Ack=1 Win=65535 Len=0 TSval=1083459108 TSecr=1542742
54249  22.484481 68.33.110.51 -> 41.177.98.176 TCP 70 40669 > http [ACK] Seq=1061 Ack=4345 Win=65160 Len=0 TSval=1083459109 TSecr=1542805
54259  22.488511 68.33.110.51 -> 41.177.98.176 TCP 70 [TCP Dup ACK 54249#1] 40669 > http [ACK] Seq=1061 Ack=4345 Win=65160 Len=0 TSval=1083459109 TSecr=1542805
54329  22.514662 68.33.110.51 -> 41.177.98.176 TCP 70 40669 > http [ACK] Seq=1061 Ack=10137 Win=65535 Len=0 TSval=1083459109 TSecr=1542807
54350  22.530316 68.33.110.51 -> 41.177.98.176 TCP 70 40669 > http [ACK] Seq=1061 Ack=17377 Win=65535 Len=0 TSval=1083459109 TSecr=1542810
54368  22.534834 68.33.110.51 -> 41.177.98.176 TCP 70 [TCP Dup ACK 54350#1] 40669 > http [ACK] Seq=1061 Ack=17377 Win=65535 Len=0 TSval=1083459109 TSecr=1542810
54452  22.548341 68.33.110.51 -> 41.177.98.176 TCP 70 40669 > http [ACK] Seq=1061 Ack=20273 Win=65535 Len=0 TSval=1083459109 TSecr=1542812
54462  22.552452 68.33.110.51 -> 41.177.98.176 TCP 70 40669 > http [ACK] Seq=1061 Ack=26065 Win=62736 Len=0 TSval=1083459109 TSecr=1542812
54496  22.574798 68.33.110.51 -> 41.177.98.176 TCP 70 40669 > http [ACK] Seq=1061 Ack=27513 Win=65400 Len=0 TSval=1083459109 TSecr=1542813
54507  22.580346 68.33.110.51 -> 41.177.98.176 TCP 70 40669 > http [ACK] Seq=1061 Ack=37649 Win=64912 Len=0 TSval=1083459109 TSecr=1542814
54534  22.584347 68.33.110.51 -> 41.177.98.176 TCP 70 40669 > http [ACK] Seq=1061 Ack=40545 Win=65535 Len=0 TSval=1083459109 TSecr=1542816
54552  22.588330 68.33.110.51 -> 41.177.98.176 TCP 70 [TCP Dup ACK 54534#1] 40669 > http [ACK] Seq=1061 Ack=40545 Win=65535 Len=0 TSval=1083459109 TSecr=1542816
54566  22.592307 68.33.110.51 -> 41.177.98.176 TCP 70 40669 > http [ACK] Seq=1061 Ack=43441 Win=65535 Len=0 TSval=1083459109 TSecr=1542817
54955  22.718337 68.33.110.51 -> 41.177.98.176 TCP 70 40669 > http [ACK] Seq=1061 Ack=45786 Win=65535 Len=0 TSval=1083459110 TSecr=1542817
103082  37.556392 68.33.110.51 -> 41.177.98.176 TCP 70 40669 > http [ACK] Seq=1061 Ack=45787 Win=65535 Len=0 TSval=1083459139 TSecr=1544314
124163  44.280303 68.33.110.51 -> 41.177.98.176 TCP 70 40669 > http [FIN, ACK] Seq=1061 Ack=45787 Win=65535 Len=0 TSval=1083459153 TSecr=1544314
156559  53.318409 68.33.110.51 -> 41.177.98.176 TCP 82 40670 > http [SYN] Seq=0 Win=65535 Len=0 MSS=1460 WS=1 TSval=1083459171 TSecr=0 SACK_PERM=1
156605  53.326340 68.33.110.51 -> 41.177.98.176 TCP 70 40670 > http [ACK] Seq=1 Ack=1 Win=65535 Len=0 TSval=1083459171 TSecr=1545891
158093  53.870314 68.33.110.51 -> 41.177.98.176 TCP 70 40670 > http [ACK] Seq=1007 Ack=4345 Win=65160 Len=0 TSval=1083459172 TSecr=1545944
158115  53.874834 68.33.110.51 -> 41.177.98.176 TCP 70 [TCP Dup ACK 158093#1] 40670 > http [ACK] Seq=1007 Ack=4345 Win=65160 Len=0 TSval=1083459172 TSecr=1545944
158172  53.888317 68.33.110.51 -> 41.177.98.176 TCP 70 40670 > http [ACK] Seq=1007 Ack=10137 Win=64884 Len=0 TSval=1083459172 TSecr=1545946
158246  53.904331 68.33.110.51 -> 41.177.98.176 TCP 70 40670 > http [ACK] Seq=1007 Ack=15929 Win=65535 Len=0 TSval=1083459172 TSecr=1545948
158272  53.908331 68.33.110.51 -> 41.177.98.176 TCP 70 [TCP Dup ACK 158246#1] 40670 > http [ACK] Seq=1007 Ack=15929 Win=65535 Len=0 TSval=1083459172 TSecr=1545948
158313  53.918643 68.33.110.51 -> 41.177.98.176 TCP 70 40670 > http [ACK] Seq=1007 Ack=21721 Win=65535 Len=0 TSval=1083459172 TSecr=1545949
158318  53.922754 68.33.110.51 -> 41.177.98.176 TCP 70 [TCP Dup ACK 158313#1] 40670 > http [ACK] Seq=1007 Ack=21721 Win=65535 Len=0 TSval=1083459172 TSecr=1545949
158362  53.936324 68.33.110.51 -> 41.177.98.176 TCP 70 40670 > http [ACK] Seq=1007 Ack=23523 Win=65535 Len=0 TSval=1083459172 TSecr=1545949
158904  54.121219 68.33.110.51 -> 41.177.98.176 TCP 82 40671 > http [SYN] Seq=0 Win=65535 Len=0 MSS=1460 WS=1 TSval=1083459172 TSecr=0 SACK_PERM=1
158927  54.128654 68.33.110.51 -> 41.177.98.176 TCP 70 40671 > http [ACK] Seq=1 Ack=1 Win=65535 Len=0 TSval=1083459173 TSecr=1545971
158945  54.136697 68.33.110.51 -> 41.177.98.176 TCP 70 40670 > http [ACK] Seq=1895 Ack=24078 Win=65535 Len=0 TSval=1083459173 TSecr=1545971
158974  54.142328 68.33.110.51 -> 41.177.98.176 TCP 70 40671 > http [ACK] Seq=889 Ack=534 Win=65535 Len=0 TSval=1083459173 TSecr=1545972
194990  67.020449 68.33.110.51 -> 41.177.98.176 TCP 70 40670 > http [ACK] Seq=2917 Ack=35987 Win=65535 Len=0 TSval=1083459198 TSecr=1547259
195015  67.025230 68.33.110.51 -> 41.177.98.176 TCP 70 [TCP Dup ACK 194990#1] 40670 > http [ACK] Seq=2917 Ack=35987 Win=65535 Len=0 TSval=1083459198 TSecr=1547259
195042  67.034637 68.33.110.51 -> 41.177.98.176 TCP 70 40670 > http [ACK] Seq=2917 Ack=38883 Win=65535 Len=0 TSval=1083459198 TSecr=1547261
195126  67.056313 68.33.110.51 -> 41.177.98.176 TCP 70 40670 > http [ACK] Seq=2917 Ack=53363 Win=64672 Len=0 TSval=1083459198 TSecr=1547261
195155  67.060301 68.33.110.51 -> 41.177.98.176 TCP 70 [TCP Dup ACK 195126#1] 40670 > http [ACK] Seq=2917 Ack=53363 Win=64672 Len=0 TSval=1083459198 TSecr=1547261
195186  67.070320 68.33.110.51 -> 41.177.98.176 TCP 70 40670 > http [ACK] Seq=2917 Ack=56259 Win=65535 Len=0 TSval=1083459198 TSecr=1547262
195219  67.078756 68.33.110.51 -> 41.177.98.176 TCP 70 40670 > http [ACK] Seq=2917 Ack=69291 Win=64672 Len=0 TSval=1083459198 TSecr=1547264
195229  67.082327 68.33.110.51 -> 41.177.98.176 TCP 70 [TCP Dup ACK 195219#1] 40670 > http [ACK] Seq=2917 Ack=69291 Win=64672 Len=0 TSval=1083459198 TSecr=1547264
195340  67.141213 68.33.110.51 -> 41.177.98.176 TCP 70 40670 > http [ACK] Seq=2917 Ack=69867 Win=65535 Len=0 TSval=1083459199 TSecr=1547264
200602  69.144579 68.33.110.51 -> 41.177.98.176 TCP 70 40671 > http [ACK] Seq=889 Ack=535 Win=65535 Len=0 TSval=1083459203 TSecr=1547473
217868  74.352632 68.33.110.51 -> 41.177.98.176 TCP 70 40671 > http [FIN, ACK] Seq=889 Ack=535 Win=65535 Len=0 TSval=1083459213 TSecr=1547473
235353  82.026328 68.33.110.51 -> 41.177.98.176 TCP 70 40670 > http [ACK] Seq=3947 Ack=74211 Win=65160 Len=0 TSval=1083459228 TSecr=1548760
235363  82.030641 68.33.110.51 -> 41.177.98.176 TCP 70 [TCP Dup ACK 235353#1] 40670 > http [ACK] Seq=3947 Ack=74211 Win=65160 Len=0 TSval=1083459228 TSecr=1548760
235378  82.044544 68.33.110.51 -> 41.177.98.176 TCP 70 40670 > http [ACK] Seq=3947 Ack=80003 Win=65535 Len=0 TSval=1083459228 TSecr=1548761
235384  82.048407 68.33.110.51 -> 41.177.98.176 TCP 70 [TCP Dup ACK 235378#1] 40670 > http [ACK] Seq=3947 Ack=80003 Win=65535 Len=0 TSval=1083459228 TSecr=1548761
235406  82.060505 68.33.110.51 -> 41.177.98.176 TCP 70 40670 > http [ACK] Seq=3947 Ack=87243 Win=65535 Len=0 TSval=1083459228 TSecr=1548763
235425  82.064380 68.33.110.51 -> 41.177.98.176 TCP 70 [TCP Dup ACK 235406#1] 40670 > http [ACK] Seq=3947 Ack=87243 Win=65535 Len=0 TSval=1083459228 TSecr=1548763
235460  82.084959 68.33.110.51 -> 41.177.98.176 TCP 70 40670 > http [ACK] Seq=3947 Ack=95931 Win=65535 Len=0 TSval=1083459228 TSecr=1548765
235474  82.088497 68.33.110.51 -> 41.177.98.176 TCP 70 [TCP Dup ACK 235460#1] 40670 > http [ACK] Seq=3947 Ack=95931 Win=65535 Len=0 TSval=1083459228 TSecr=1548765
235503  82.104421 68.33.110.51 -> 41.177.98.176 TCP 70 40670 > http [ACK] Seq=3947 Ack=104619 Win=65535 Len=0 TSval=1083459228 TSecr=1548767
235519  82.108362 68.33.110.51 -> 41.177.98.176 TCP 70 [TCP Dup ACK 235503#1] 40670 > http [ACK] Seq=3947 Ack=104619 Win=65535 Len=0 TSval=1083459228 TSecr=1548767
235566  82.126301 68.33.110.51 -> 41.177.98.176 TCP 70 40670 > http [ACK] Seq=3947 Ack=114755 Win=65535 Len=0 TSval=1083459229 TSecr=1548769
235584  82.130296 68.33.110.51 -> 41.177.98.176 TCP 70 [TCP Dup ACK 235566#1] 40670 > http [ACK] Seq=3947 Ack=114755 Win=65535 Len=0 TSval=1083459229 TSecr=1548769
235588  82.136446 68.33.110.51 -> 41.177.98.176 TCP 70 40670 > http [ACK] Seq=3947 Ack=120547 Win=65535 Len=0 TSval=1083459229 TSecr=1548771
235596  82.140327 68.33.110.51 -> 41.177.98.176 TCP 70 [TCP Dup ACK 235588#1] 40670 > http [ACK] Seq=3947 Ack=120547 Win=65535 Len=0 TSval=1083459229 TSecr=1548771
235633  82.150305 68.33.110.51 -> 41.177.98.176 TCP 70 40670 > http [ACK] Seq=3947 Ack=133579 Win=65535 Len=0 TSval=1083459229 TSecr=1548772
235653  82.154629 68.33.110.51 -> 41.177.98.176 TCP 70 [TCP Dup ACK 235633#1] 40670 > http [ACK] Seq=3947 Ack=133579 Win=65535 Len=0 TSval=1083459229 TSecr=1548772
235663  82.160318 68.33.110.51 -> 41.177.98.176 TCP 70 40670 > http [ACK] Seq=3947 Ack=136475 Win=65535 Len=0 TSval=1083459229 TSecr=1548772
235691  82.188291 68.33.110.51 -> 41.177.98.176 TCP 70 40670 > http [ACK] Seq=3947 Ack=142267 Win=65535 Len=0 TSval=1083459229 TSecr=1548774
235695  82.192669 68.33.110.51 -> 41.177.98.176 TCP 70 [TCP Dup ACK 235691#1] 40670 > http [ACK] Seq=3947 Ack=142267 Win=65535 Len=0 TSval=1083459229 TSecr=1548774
235708  82.198591 68.33.110.51 -> 41.177.98.176 TCP 70 40670 > http [ACK] Seq=3947 Ack=148059 Win=65535 Len=0 TSval=1083459229 TSecr=1548774
235712  82.202573 68.33.110.51 -> 41.177.98.176 TCP 70 [TCP Dup ACK 235708#1] 40670 > http [ACK] Seq=3947 Ack=148059 Win=65535 Len=0 TSval=1083459229 TSecr=1548774
235737  82.218416 68.33.110.51 -> 41.177.98.176 TCP 70 40670 > http [ACK] Seq=3947 Ack=157212 Win=65535 Len=0 TSval=1083459229 TSecr=1548774
235747  82.222397 68.33.110.51 -> 41.177.98.176 TCP 70 [TCP Dup ACK 235737#1] 40670 > http [ACK] Seq=3947 Ack=157212 Win=65535 Len=0 TSval=1083459229 TSecr=1548774
282846  94.936422 68.33.110.51 -> 41.177.98.176 TCP 70 40670 > http [ACK] Seq=4938 Ack=160108 Win=65160 Len=0 TSval=1083459254 TSecr=1550050
283037  94.978306 68.33.110.51 -> 41.177.98.176 TCP 70 40670 > http [ACK] Seq=4938 Ack=169121 Win=65535 Len=0 TSval=1083459254 TSecr=1550051
283048  94.982362 68.33.110.51 -> 41.177.98.176 TCP 70 40670 > http [ACK] Seq=4938 Ack=177145 Win=65535 Len=0 TSval=1083459254 TSecr=1550051
283418  95.044811 68.33.110.51 -> 41.177.98.176 TCP 82 40673 > http [SYN] Seq=0 Win=65535 Len=0 MSS=1460 WS=1 TSval=1083459254 TSecr=0 SACK_PERM=1
283459  95.056338 68.33.110.51 -> 41.177.98.176 TCP 70 40673 > http [ACK] Seq=1 Ack=1 Win=65535 Len=0 TSval=1083459254 TSecr=1550063
283627  95.080302 68.33.110.51 -> 41.177.98.176 TCP 70 40673 > http [ACK] Seq=873 Ack=3195 Win=63712 Len=0 TSval=1083459254 TSecr=1550065
283668  95.084309 68.33.110.51 -> 41.177.98.176 TCP 70 [TCP Dup ACK 283627#1] 40673 > http [ACK] Seq=873 Ack=3195 Win=63712 Len=0 TSval=1083459254 TSecr=1550065
283719  95.090492 68.33.110.51 -> 41.177.98.176 TCP 70 40673 > http [ACK] Seq=873 Ack=4643 Win=65535 Len=0 TSval=1083459254 TSecr=1550067
283801  95.106285 68.33.110.51 -> 41.177.98.176 TCP 70 40673 > http [ACK] Seq=873 Ack=10435 Win=65535 Len=0 TSval=1083459254 TSecr=1550067
283818  95.110305 68.33.110.51 -> 41.177.98.176 TCP 70 [TCP Dup ACK 283801#1] 40673 > http [ACK] Seq=873 Ack=10435 Win=65535 Len=0 TSval=1083459254 TSecr=1550067
283854  95.124305 68.33.110.51 -> 41.177.98.176 TCP 70 40673 > http [ACK] Seq=873 Ack=17675 Win=65535 Len=0 TSval=1083459254 TSecr=1550069
283879  95.128321 68.33.110.51 -> 41.177.98.176 TCP 70 [TCP Dup ACK 283854#1] 40673 > http [ACK] Seq=873 Ack=17675 Win=65535 Len=0 TSval=1083459254 TSecr=1550069
283921  95.135817 68.33.110.51 -> 41.177.98.176 TCP 70 40673 > http [ACK] Seq=873 Ack=20571 Win=65535 Len=0 TSval=1083459255 TSecr=1550069
283947  95.140325 68.33.110.51 -> 41.177.98.176 TCP 70 40673 > http [ACK] Seq=873 Ack=27811 Win=65535 Len=0 TSval=1083459255 TSecr=1550071
283977  95.144309 68.33.110.51 -> 41.177.98.176 TCP 70 [TCP Dup ACK 283947#1] 40673 > http [ACK] Seq=873 Ack=27811 Win=65535 Len=0 TSval=1083459255 TSecr=1550071
284131  95.180285 68.33.110.51 -> 41.177.98.176 TCP 70 40673 > http [ACK] Seq=873 Ack=28914 Win=65535 Len=0 TSval=1083459255 TSecr=1550072
284146  95.184340 68.33.110.51 -> 41.177.98.176 TCP 70 40670 > http [ACK] Seq=5803 Ack=180125 Win=65535 Len=0 TSval=1083459255 TSecr=1550063
317489 108.334715 68.33.110.51 -> 41.177.98.176 TCP 70 40670 > http [ACK] Seq=6831 Ack=184469 Win=63712 Len=0 TSval=1083459281 TSecr=1551391
317500 108.338403 68.33.110.51 -> 41.177.98.176 TCP 70 [TCP Dup ACK 317489#1] 40670 > http [ACK] Seq=6831 Ack=184469 Win=63712 Len=0 TSval=1083459281 TSecr=1551391
317699 108.404317 68.33.110.51 -> 41.177.98.176 TCP 70 40670 > http [ACK] Seq=6831 Ack=185917 Win=65535 Len=0 TSval=1083459281 TSecr=1551392
317835 108.436287 68.33.110.51 -> 41.177.98.176 TCP 70 40670 > http [ACK] Seq=6831 Ack=191709 Win=65535 Len=0 TSval=1083459281 TSecr=1551392
317863 108.440332 68.33.110.51 -> 41.177.98.176 TCP 70 [TCP Dup ACK 317835#1] 40670 > http [ACK] Seq=6831 Ack=191709 Win=65535 Len=0 TSval=1083459281 TSecr=1551392
317884 108.454605 68.33.110.51 -> 41.177.98.176 TCP 70 40670 > http [ACK] Seq=6831 Ack=200397 Win=65535 Len=0 TSval=1083459281 TSecr=1551403
317909 108.458320 68.33.110.51 -> 41.177.98.176 TCP 70 [TCP Dup ACK 317884#1] 40670 > http [ACK] Seq=6831 Ack=200397 Win=65535 Len=0 TSval=1083459281 TSecr=1551403
317951 108.472670 68.33.110.51 -> 41.177.98.176 TCP 70 40670 > http [ACK] Seq=6831 Ack=206189 Win=65535 Len=0 TSval=1083459281 TSecr=1551404
317975 108.476307 68.33.110.51 -> 41.177.98.176 TCP 70 40670 > http [ACK] Seq=6831 Ack=209085 Win=65535 Len=0 TSval=1083459281 TSecr=1551404
317996 108.480350 68.33.110.51 -> 41.177.98.176 TCP 70 40670 > http [ACK] Seq=6831 Ack=211981 Win=65535 Len=0 TSval=1083459281 TSecr=1551404
318008 108.484300 68.33.110.51 -> 41.177.98.176 TCP 70 40670 > http [ACK] Seq=6831 Ack=214877 Win=65535 Len=0 TSval=1083459281 TSecr=1551406
318024 108.488691 68.33.110.51 -> 41.177.98.176 TCP 70 40670 > http [ACK] Seq=6831 Ack=217773 Win=65535 Len=0 TSval=1083459281 TSecr=1551406
318037 108.492305 68.33.110.51 -> 41.177.98.176 TCP 70 40670 > http [ACK] Seq=6831 Ack=220669 Win=65535 Len=0 TSval=1083459281 TSecr=1551407
318073 108.496294 68.33.110.51 -> 41.177.98.176 TCP 70 40670 > http [ACK] Seq=6831 Ack=223565 Win=65535 Len=0 TSval=1083459281 TSecr=1551407
318088 108.500310 68.33.110.51 -> 41.177.98.176 TCP 70 [TCP Dup ACK 318073#1] 40670 > http [ACK] Seq=6831 Ack=223565 Win=65535 Len=0 TSval=1083459281 TSecr=1551407
318137 108.506305 68.33.110.51 -> 41.177.98.176 TCP 70 40670 > http [ACK] Seq=6831 Ack=226461 Win=65535 Len=0 TSval=1083459281 TSecr=1551407
318142 108.510302 68.33.110.51 -> 41.177.98.176 TCP 70 40670 > http [ACK] Seq=6831 Ack=229357 Win=65535 Len=0 TSval=1083459281 TSecr=1551407
318168 108.514634 68.33.110.51 -> 41.177.98.176 TCP 70 40670 > http [ACK] Seq=6831 Ack=235149 Win=65535 Len=0 TSval=1083459281 TSecr=1551408
318184 108.518320 68.33.110.51 -> 41.177.98.176 TCP 70 40670 > http [ACK] Seq=6831 Ack=238045 Win=65535 Len=0 TSval=1083459281 TSecr=1551408
318227 108.522323 68.33.110.51 -> 41.177.98.176 TCP 70 40670 > http [ACK] Seq=6831 Ack=240941 Win=65535 Len=0 TSval=1083459281 TSecr=1551408
318237 108.526500 68.33.110.51 -> 41.177.98.176 TCP 70 40670 > http [ACK] Seq=6831 Ack=243837 Win=65535 Len=0 TSval=1083459281 TSecr=1551409
318247 108.530363 68.33.110.51 -> 41.177.98.176 TCP 70 40670 > http [ACK] Seq=6831 Ack=249629 Win=65535 Len=0 TSval=1083459281 TSecr=1551410
318272 108.534924 68.33.110.51 -> 41.177.98.176 TCP 70 40670 > http [ACK] Seq=6831 Ack=252525 Win=65535 Len=0 TSval=1083459281 TSecr=1551410
318285 108.538322 68.33.110.51 -> 41.177.98.176 TCP 70 [TCP Dup ACK 318272#1] 40670 > http [ACK] Seq=6831 Ack=252525 Win=65535 Len=0 TSval=1083459281 TSecr=1551410
318325 108.544911 68.33.110.51 -> 41.177.98.176 TCP 70 40670 > http [ACK] Seq=6831 Ack=258698 Win=65535 Len=0 TSval=1083459281 TSecr=1551410
318331 108.548300 68.33.110.51 -> 41.177.98.176 TCP 70 [TCP Dup ACK 318325#1] 40670 > http [ACK] Seq=6831 Ack=258698 Win=65535 Len=0 TSval=1083459281 TSecr=1551410
318356 108.554663 68.33.110.51 -> 41.177.98.176 TCP 70 40670 > http [ACK] Seq=6831 Ack=264490 Win=65535 Len=0 TSval=1083459281 TSecr=1551411
318381 108.558305 68.33.110.51 -> 41.177.98.176 TCP 70 40670 > http [ACK] Seq=6831 Ack=267386 Win=65535 Len=0 TSval=1083459281 TSecr=1551411
318402 108.562330 68.33.110.51 -> 41.177.98.176 TCP 70 [TCP Dup ACK 318381#1] 40670 > http [ACK] Seq=6831 Ack=267386 Win=65535 Len=0 TSval=1083459281 TSecr=1551411
318434 108.566399 68.33.110.51 -> 41.177.98.176 TCP 70 40670 > http [ACK] Seq=6831 Ack=270282 Win=65535 Len=0 TSval=1083459281 TSecr=1551412
318481 108.572296 68.33.110.51 -> 41.177.98.176 TCP 70 40670 > http [ACK] Seq=6831 Ack=276074 Win=65535 Len=0 TSval=1083459281 TSecr=1551412
318509 108.576300 68.33.110.51 -> 41.177.98.176 TCP 70 40670 > http [ACK] Seq=6831 Ack=278970 Win=65535 Len=0 TSval=1083459281 TSecr=1551412
318518 108.580300 68.33.110.51 -> 41.177.98.176 TCP 70 40670 > http [ACK] Seq=6831 Ack=281866 Win=65535 Len=0 TSval=1083459281 TSecr=1551412
318531 108.584284 68.33.110.51 -> 41.177.98.176 TCP 70 [TCP Dup ACK 318518#1] 40670 > http [ACK] Seq=6831 Ack=281866 Win=65535 Len=0 TSval=1083459281 TSecr=1551412
318558 108.590280 68.33.110.51 -> 41.177.98.176 TCP 70 40670 > http [ACK] Seq=6831 Ack=284762 Win=65535 Len=0 TSval=1083459281 TSecr=1551412
319235 108.780333 68.33.110.51 -> 41.177.98.176 TCP 70 40670 > http [ACK] Seq=6831 Ack=285720 Win=65535 Len=0 TSval=1083459282 TSecr=1551413
321799 110.074627 68.33.110.51 -> 41.177.98.176 TCP 70 40673 > http [ACK] Seq=873 Ack=28915 Win=65535 Len=0 TSval=1083459284 TSecr=1551566
352173 119.326354 68.33.110.51 -> 41.177.98.176 TCP 70 40673 > http [FIN, ACK] Seq=873 Ack=28915 Win=65535 Len=0 TSval=1083459303 TSecr=1551566
362278 123.586375 68.33.110.51 -> 41.177.98.176 TCP 70 40670 > http [ACK] Seq=6831 Ack=285721 Win=65535 Len=0 TSval=1083459311 TSecr=1552917
399456 134.436294 68.33.110.51 -> 41.177.98.176 TCP 70 40670 > http [FIN, ACK] Seq=6831 Ack=285721 Win=65535 Len=0 TSval=1083459333 TSecr=1552917
460452 150.654843 68.33.110.51 -> 41.177.98.176 TCP 82 40675 > http [SYN] Seq=0 Win=65535 Len=0 MSS=1460 WS=1 TSval=1083459366 TSecr=0 SACK_PERM=1
460475 150.664336 68.33.110.51 -> 41.177.98.176 TCP 70 40675 > http [ACK] Seq=1 Ack=1 Win=65535 Len=0 TSval=1083459366 TSecr=1555625
462679 151.806308 68.33.110.51 -> 41.177.98.176 TCP 70 40675 > http [ACK] Seq=1114 Ack=4345 Win=65160 Len=0 TSval=1083459368 TSecr=1555737
462685 151.810302 68.33.110.51 -> 41.177.98.176 TCP 70 [TCP Dup ACK 462679#1] 40675 > http [ACK] Seq=1114 Ack=4345 Win=65160 Len=0 TSval=1083459368 TSecr=1555737
462798 151.836366 68.33.110.51 -> 41.177.98.176 TCP 70 40675 > http [ACK] Seq=1114 Ack=10137 Win=65535 Len=0 TSval=1083459368 TSecr=1555740
462830 151.858373 68.33.110.51 -> 41.177.98.176 TCP 70 40675 > http [ACK] Seq=1114 Ack=17377 Win=64912 Len=0 TSval=1083459368 TSecr=1555743
462838 151.862382 68.33.110.51 -> 41.177.98.176 TCP 70 [TCP Dup ACK 462830#1] 40675 > http [ACK] Seq=1114 Ack=17377 Win=64912 Len=0 TSval=1083459368 TSecr=1555743
463037 152.000289 68.33.110.51 -> 41.177.98.176 TCP 70 40675 > http [ACK] Seq=1114 Ack=18676 Win=65535 Len=0 TSval=1083459368 TSecr=1555745
463799 152.400394 68.33.110.51 -> 41.177.98.176 TCP 70 40675 > http [ACK] Seq=2099 Ack=19420 Win=65535 Len=0 TSval=1083459369 TSecr=1555781
517297 167.232296 68.33.110.51 -> 41.177.98.176 TCP 70 40675 > http [ACK] Seq=2099 Ack=19421 Win=65535 Len=0 TSval=1083459399 TSecr=1557282
556764 179.302287 68.33.110.51 -> 41.177.98.176 TCP 70 40675 > http [FIN, ACK] Seq=2099 Ack=19421 Win=65535 Len=0 TSval=1083459423 TSecr=1557282
601458 190.710299 68.33.110.51 -> 41.177.98.176 TCP 82 40676 > http [SYN] Seq=0 Win=65535 Len=0 MSS=1460 WS=1 TSval=1083459446 TSecr=0 SACK_PERM=1
601504 190.722263 68.33.110.51 -> 41.177.98.176 TCP 70 40676 > http [ACK] Seq=1 Ack=1 Win=65535 Len=0 TSval=1083459446 TSecr=1559630
603944 191.692310 68.33.110.51 -> 41.177.98.176 TCP 70 40676 > http [ACK] Seq=1114 Ack=4345 Win=65160 Len=0 TSval=1083459448 TSecr=1559725
603974 191.696294 68.33.110.51 -> 41.177.98.176 TCP 70 [TCP Dup ACK 603944#1] 40676 > http [ACK] Seq=1114 Ack=4345 Win=65160 Len=0 TSval=1083459448 TSecr=1559725
604178 191.741228 68.33.110.51 -> 41.177.98.176 TCP 70 40676 > http [ACK] Seq=1114 Ack=10137 Win=65535 Len=0 TSval=1083459448 TSecr=1559728
604188 191.745184 68.33.110.51 -> 41.177.98.176 TCP 70 [TCP Dup ACK 604178#1] 40676 > http [ACK] Seq=1114 Ack=10137 Win=65535 Len=0 TSval=1083459448 TSecr=1559728
604203 191.756314 68.33.110.51 -> 41.177.98.176 TCP 70 40676 > http [ACK] Seq=1114 Ack=13033 Win=65535 Len=0 TSval=1083459448 TSecr=1559733
604230 191.768260 68.33.110.51 -> 41.177.98.176 TCP 70 40676 > http [ACK] Seq=1114 Ack=15929 Win=65535 Len=0 TSval=1083459448 TSecr=1559733
604387 191.812262 68.33.110.51 -> 41.177.98.176 TCP 70 40676 > http [ACK] Seq=1114 Ack=18547 Win=65535 Len=0 TSval=1083459448 TSecr=1559733
605995 192.215769 68.33.110.51 -> 41.177.98.176 TCP 70 40676 > http [ACK] Seq=2099 Ack=19293 Win=65535 Len=0 TSval=1083459449 TSecr=1559764
665317 207.060620 68.33.110.51 -> 41.177.98.176 TCP 70 40676 > http [ACK] Seq=2099 Ack=19294 Win=65535 Len=0 TSval=1083459478 TSecr=1561265
671892 209.352294 68.33.110.51 -> 41.177.98.176 TCP 70 40676 > http [FIN, ACK] Seq=2099 Ack=19294 Win=65535 Len=0 TSval=1083459483 TSecr=1561265
691958 218.428355 68.33.110.51 -> 41.177.98.176 TCP 82 40677 > http [SYN] Seq=0 Win=65535 Len=0 MSS=1460 WS=1 TSval=1083459501 TSecr=0 SACK_PERM=1
691981 218.438444 68.33.110.51 -> 41.177.98.176 TCP 70 40677 > http [ACK] Seq=1 Ack=1 Win=65535 Len=0 TSval=1083459501 TSecr=1562402
694549 219.802518 68.33.110.51 -> 41.177.98.176 TCP 70 40677 > http [ACK] Seq=1114 Ack=4345 Win=63712 Len=0 TSval=1083459504 TSecr=1562538
694556 219.806366 68.33.110.51 -> 41.177.98.176 TCP 70 [TCP Dup ACK 694549#1] 40677 > http [ACK] Seq=1114 Ack=4345 Win=63712 Len=0 TSval=1083459504 TSecr=1562538
694604 219.840288 68.33.110.51 -> 41.177.98.176 TCP 70 40677 > http [ACK] Seq=1114 Ack=5793 Win=65535 Len=0 TSval=1083459504 TSecr=1562540
694612 219.844660 68.33.110.51 -> 41.177.98.176 TCP 70 40677 > http [ACK] Seq=1114 Ack=10137 Win=65535 Len=0 TSval=1083459504 TSecr=1562540
694649 219.856381 68.33.110.51 -> 41.177.98.176 TCP 70 40677 > http [ACK] Seq=1114 Ack=13033 Win=65535 Len=0 TSval=1083459504 TSecr=1562543
694664 219.864588 68.33.110.51 -> 41.177.98.176 TCP 70 40677 > http [ACK] Seq=1114 Ack=15929 Win=65535 Len=0 TSval=1083459504 TSecr=1562544
694686 219.876351 68.33.110.51 -> 41.177.98.176 TCP 70 40677 > http [ACK] Seq=1114 Ack=18825 Win=65535 Len=0 TSval=1083459504 TSecr=1562544
694928 220.028462 68.33.110.51 -> 41.177.98.176 TCP 70 40677 > http [ACK] Seq=1114 Ack=21264 Win=65535 Len=0 TSval=1083459504 TSecr=1562545
695638 220.230592 68.33.110.51 -> 41.177.98.176 TCP 70 40677 > http [ACK] Seq=2099 Ack=22028 Win=65535 Len=0 TSval=1083459505 TSecr=1562579
736174 235.212291 68.33.110.51 -> 41.177.98.176 TCP 70 40677 > http [ACK] Seq=2099 Ack=22029 Win=65535 Len=0 TSval=1083459535 TSecr=1564080
747991 239.348260 68.33.110.51 -> 41.177.98.176 TCP 70 40677 > http [FIN, ACK] Seq=2099 Ack=22029 Win=65535 Len=0 TSval=1083459543 TSecr=1564080
