31137  13.083687 68.83.160.23 -> 244.3.210.98 TCP 64 bb > conclave-cpp [RST, ACK] Seq=1 Ack=1 Win=0 Len=0
31983  13.502554 68.83.160.23 -> 244.3.210.98 TCP 64 bb > conclave-cpp [RST, ACK] Seq=1 Ack=1 Win=0 Len=0
33180  14.048237 68.83.160.23 -> 244.3.210.98 TCP 64 bb > conclave-cpp [RST, ACK] Seq=1 Ack=1 Win=0 Len=0
43686  18.501902 68.83.160.23 -> 244.3.210.255 TCP 64 bb > ftsrv [RST, ACK] Seq=1 Ack=1 Win=0 Len=0
45502  19.063776 68.83.160.23 -> 244.3.210.255 TCP 64 bb > ftsrv [RST, ACK] Seq=1 Ack=1 Win=0 Len=0
47550  19.610431 68.83.160.23 -> 244.3.210.255 TCP 64 bb > ftsrv [RST, ACK] Seq=1 Ack=1 Win=0 Len=0
52721  21.962619 68.83.160.23 -> 244.3.210.230 TCP 64 bb > slc-systemlog [RST, ACK] Seq=1 Ack=1 Win=0 Len=0
53951  22.306502 68.83.160.23 -> 244.3.210.230 TCP 64 bb > slc-systemlog [RST, ACK] Seq=1 Ack=1 Win=0 Len=0
55202  22.808572 68.83.160.23 -> 244.3.210.230 TCP 64 bb > slc-systemlog [RST, ACK] Seq=1 Ack=1 Win=0 Len=0
59823  24.094310 68.83.160.23 -> 244.3.210.98 TCP 64 bb > groove [RST, ACK] Seq=1 Ack=1 Win=0 Len=0
60767  24.657174 68.83.160.23 -> 244.3.210.98 TCP 64 bb > groove [RST, ACK] Seq=1 Ack=1 Win=0 Len=0
61398  25.109651 68.83.160.23 -> 244.3.210.98 TCP 64 bb > groove [RST, ACK] Seq=1 Ack=1 Win=0 Len=0
95528  36.051322 68.83.160.23 -> 244.3.210.98 TCP 64 bb > talarian-mqs [RST, ACK] Seq=1 Ack=1 Win=0 Len=0
97906  36.579913 68.83.160.23 -> 244.3.210.98 TCP 64 bb > talarian-mqs [RST, ACK] Seq=1 Ack=1 Win=0 Len=0
99980  37.016485 68.83.160.23 -> 244.3.210.98 TCP 64 bb > talarian-mqs [RST, ACK] Seq=1 Ack=1 Win=0 Len=0
112779  40.167626 68.83.160.23 -> 244.3.210.98 TCP 64 bb > bmc-ar [RST, ACK] Seq=1 Ack=1 Win=0 Len=0
113875  40.531624 68.83.160.23 -> 244.3.210.98 TCP 64 bb > bmc-ar [RST, ACK] Seq=1 Ack=1 Win=0 Len=0
115008  41.064417 68.83.160.23 -> 244.3.210.98 TCP 64 bb > bmc-ar [RST, ACK] Seq=1 Ack=1 Win=0 Len=0
133355  46.455377 68.83.160.23 -> 244.3.210.98 TCP 64 bb > fast-rem-serv [RST, ACK] Seq=1 Ack=1 Win=0 Len=0
135093  46.969552 68.83.160.23 -> 244.3.210.98 TCP 64 bb > fast-rem-serv [RST, ACK] Seq=1 Ack=1 Win=0 Len=0
136166  47.407995 68.83.160.23 -> 244.3.210.98 TCP 64 bb > fast-rem-serv [RST, ACK] Seq=1 Ack=1 Win=0 Len=0
198844  68.339176 68.83.160.23 -> 244.3.210.197 TCP 64 bb > odeumservlink [RST, ACK] Seq=1 Ack=1 Win=0 Len=0
237188  82.391899 68.83.160.23 -> 244.3.210.98 TCP 64 bb > rtsclient [RST, ACK] Seq=1 Ack=1 Win=0 Len=0
238743  82.845815 68.83.160.23 -> 244.3.210.98 TCP 64 bb > rtsclient [RST, ACK] Seq=1 Ack=1 Win=0 Len=0
240241  83.392113 68.83.160.23 -> 244.3.210.98 TCP 64 bb > rtsclient [RST, ACK] Seq=1 Ack=1 Win=0 Len=0
254540  90.384044 68.83.160.23 -> 244.3.210.98 TCP 64 bb > kentrox-prot [RST, ACK] Seq=1 Ack=1 Win=0 Len=0
255490  90.719602 68.83.160.23 -> 244.3.210.98 TCP 64 bb > kentrox-prot [RST, ACK] Seq=1 Ack=1 Win=0 Len=0
256484  91.265004 68.83.160.23 -> 244.3.210.98 TCP 64 bb > kentrox-prot [RST, ACK] Seq=1 Ack=1 Win=0 Len=0
316103 107.918484 68.83.160.23 -> 244.3.210.230 TCP 64 bb > l3-hawk [RST, ACK] Seq=1 Ack=1 Win=0 Len=0
317716 108.408147 68.83.160.23 -> 244.3.210.230 TCP 64 bb > l3-hawk [RST, ACK] Seq=1 Ack=1 Win=0 Len=0
319486 108.919700 68.83.160.23 -> 244.3.210.230 TCP 64 bb > l3-hawk [RST, ACK] Seq=1 Ack=1 Win=0 Len=0
333809 116.704213 68.83.160.23 -> 244.3.210.255 TCP 64 bb > fc-cli [RST, ACK] Seq=1 Ack=1 Win=0 Len=0
335096 117.172740 68.83.160.23 -> 244.3.210.255 TCP 64 bb > fc-cli [RST, ACK] Seq=1 Ack=1 Win=0 Len=0
337439 117.626179 68.83.160.23 -> 244.3.210.255 TCP 64 bb > fc-cli [RST, ACK] Seq=1 Ack=1 Win=0 Len=0
353156 119.923448 68.83.160.23 -> 244.3.210.230 TCP 64 bb > bpcp-poll [RST, ACK] Seq=1 Ack=1 Win=0 Len=0
354037 120.478273 68.83.160.23 -> 244.3.210.230 TCP 64 bb > bpcp-poll [RST, ACK] Seq=1 Ack=1 Win=0 Len=0
354986 120.982463 68.83.160.23 -> 244.3.210.230 TCP 64 bb > bpcp-poll [RST, ACK] Seq=1 Ack=1 Win=0 Len=0
361243 123.300701 68.83.160.23 -> 244.3.210.98 TCP 64 bb > spock [RST, ACK] Seq=1 Ack=1 Win=0 Len=0
363048 123.752022 68.83.160.23 -> 244.3.210.98 TCP 64 bb > spock [RST, ACK] Seq=1 Ack=1 Win=0 Len=0
364926 124.313131 68.83.160.23 -> 244.3.210.98 TCP 64 bb > spock [RST, ACK] Seq=1 Ack=1 Win=0 Len=0
433934 141.539364 68.83.160.23 -> 244.3.210.230 TCP 64 bb > amt-blc-port [RST, ACK] Seq=1 Ack=1 Win=0 Len=0
435735 142.112656 68.83.160.23 -> 244.3.210.230 TCP 64 bb > amt-blc-port [RST, ACK] Seq=1 Ack=1 Win=0 Len=0
437656 142.707403 68.83.160.23 -> 244.3.210.230 TCP 64 bb > amt-blc-port [RST, ACK] Seq=1 Ack=1 Win=0 Len=0
491552 162.307464 68.83.160.23 -> 244.3.210.230 TCP 64 bb > fxp [RST, ACK] Seq=1 Ack=1 Win=0 Len=0
493486 162.826251 68.83.160.23 -> 244.3.210.230 TCP 64 bb > fxp [RST, ACK] Seq=1 Ack=1 Win=0 Len=0
495022 163.343931 68.83.160.23 -> 244.3.210.230 TCP 64 bb > fxp [RST, ACK] Seq=1 Ack=1 Win=0 Len=0
535959 173.517375 68.83.160.23 -> 244.3.210.255 TCP 64 bb > cichlid [RST, ACK] Seq=1 Ack=1 Win=0 Len=0
537705 174.063126 68.83.160.23 -> 244.3.210.255 TCP 64 bb > cichlid [RST, ACK] Seq=1 Ack=1 Win=0 Len=0
538764 174.608371 68.83.160.23 -> 244.3.210.255 TCP 64 bb > cichlid [RST, ACK] Seq=1 Ack=1 Win=0 Len=0
582461 185.423914 68.83.160.23 -> 244.3.210.230 TCP 64 bb > webemshttp [RST, ACK] Seq=1 Ack=1 Win=0 Len=0
583427 185.859128 68.83.160.23 -> 244.3.210.230 TCP 64 bb > webemshttp [RST, ACK] Seq=1 Ack=1 Win=0 Len=0
584899 186.361952 68.83.160.23 -> 244.3.210.230 TCP 64 bb > webemshttp [RST, ACK] Seq=1 Ack=1 Win=0 Len=0
623579 197.905544 68.83.160.23 -> 244.3.210.255 TCP 64 bb > winddlb [RST, ACK] Seq=1 Ack=1 Win=0 Len=0
624725 198.327659 68.83.160.23 -> 244.3.210.255 TCP 64 bb > winddlb [RST, ACK] Seq=1 Ack=1 Win=0 Len=0
626419 198.874266 68.83.160.23 -> 244.3.210.255 TCP 64 bb > winddlb [RST, ACK] Seq=1 Ack=1 Win=0 Len=0
673098 209.948219 68.83.160.23 -> 244.3.210.255 TCP 64 bb > tsspmap [RST, ACK] Seq=1 Ack=1 Win=0 Len=0
674116 210.467745 68.83.160.23 -> 244.3.210.255 TCP 64 bb > tsspmap [RST, ACK] Seq=1 Ack=1 Win=0 Len=0
675278 211.015338 68.83.160.23 -> 244.3.210.255 TCP 64 bb > tsspmap [RST, ACK] Seq=1 Ack=1 Win=0 Len=0
684603 214.732395 68.83.160.23 -> 244.3.210.230 TCP 64 bb > cesdinv [RST, ACK] Seq=1 Ack=1 Win=0 Len=0
685310 215.231645 68.83.160.23 -> 244.3.210.230 TCP 64 bb > cesdinv [RST, ACK] Seq=1 Ack=1 Win=0 Len=0
686563 215.733509 68.83.160.23 -> 244.3.210.230 TCP 64 bb > cesdinv [RST, ACK] Seq=1 Ack=1 Win=0 Len=0
700877 222.548009 68.83.160.23 -> 244.3.210.98 TCP 64 bb > metastorm [RST, ACK] Seq=1 Ack=1 Win=0 Len=0
701855 223.064508 68.83.160.23 -> 244.3.210.98 TCP 64 bb > metastorm [RST, ACK] Seq=1 Ack=1 Win=0 Len=0
702860 223.500726 68.83.160.23 -> 244.3.210.98 TCP 64 bb > metastorm [RST, ACK] Seq=1 Ack=1 Win=0 Len=0
731036 234.387004 68.83.160.23 -> 244.3.210.255 TCP 64 bb > svs-omagent [RST, ACK] Seq=1 Ack=1 Win=0 Len=0
735874 234.859841 68.83.160.23 -> 244.3.210.255 TCP 64 bb > svs-omagent [RST, ACK] Seq=1 Ack=1 Win=0 Len=0
736045 235.062672 68.83.160.23 -> 244.3.210.255 TCP 64 bb > shockwave [RST, ACK] Seq=1 Ack=1 Win=0 Len=0
736369 235.404914 68.83.160.23 -> 244.3.210.255 TCP 64 bb > shockwave [RST, ACK] Seq=1 Ack=1 Win=0 Len=0
736378 235.407690 68.83.160.23 -> 244.3.210.255 TCP 64 bb > svs-omagent [RST, ACK] Seq=1 Ack=1 Win=0 Len=0
739692 235.953290 68.83.160.23 -> 244.3.210.255 TCP 64 bb > shockwave [RST, ACK] Seq=1 Ack=1 Win=0 Len=0
760961 245.454704 68.83.160.23 -> 244.3.210.255 TCP 64 bb > cert-responder [RST, ACK] Seq=1 Ack=1 Win=0 Len=0
762192 245.905255 68.83.160.23 -> 244.3.210.255 TCP 64 bb > cert-responder [RST, ACK] Seq=1 Ack=1 Win=0 Len=0
763643 246.452088 68.83.160.23 -> 244.3.210.255 TCP 64 bb > cert-responder [RST, ACK] Seq=1 Ack=1 Win=0 Len=0
764083 246.580564 68.83.160.23 -> 244.3.210.230 TCP 64 bb > astromed-main [RST, ACK] Seq=1 Ack=1 Win=0 Len=0
764981 247.016907 68.83.160.23 -> 244.3.210.230 TCP 64 bb > astromed-main [RST, ACK] Seq=1 Ack=1 Win=0 Len=0
766115 247.620818 68.83.160.23 -> 244.3.210.230 TCP 64 bb > astromed-main [RST, ACK] Seq=1 Ack=1 Win=0 Len=0
827184 269.935514 68.83.160.23 -> 244.3.210.230 TCP 64 bb > iwlistener [RST, ACK] Seq=1 Ack=1 Win=0 Len=0
828662 270.455688 68.83.160.23 -> 244.3.210.230 TCP 64 bb > iwlistener [RST, ACK] Seq=1 Ack=1 Win=0 Len=0
829647 270.967990 68.83.160.23 -> 244.3.210.230 TCP 64 bb > iwlistener [RST, ACK] Seq=1 Ack=1 Win=0 Len=0
864263 285.534595 68.83.160.23 -> 244.3.210.255 TCP 64 bb > isis-ambc [RST, ACK] Seq=1 Ack=1 Win=0 Len=0
865423 286.046555 68.83.160.23 -> 244.3.210.255 TCP 64 bb > isis-ambc [RST, ACK] Seq=1 Ack=1 Win=0 Len=0
866928 286.592020 68.83.160.23 -> 244.3.210.255 TCP 64 bb > isis-ambc [RST, ACK] Seq=1 Ack=1 Win=0 Len=0
946238 314.067519 68.83.160.23 -> 244.3.210.98 TCP 64 bb > citrixadmin [RST, ACK] Seq=1 Ack=1 Win=0 Len=0
948549 314.627215 68.83.160.23 -> 244.3.210.98 TCP 64 bb > citrixadmin [RST, ACK] Seq=1 Ack=1 Win=0 Len=0
950644 315.288538 68.83.160.23 -> 244.3.210.98 TCP 64 bb > citrixadmin [RST, ACK] Seq=1 Ack=1 Win=0 Len=0
961724 319.608127 68.83.160.23 -> 244.3.210.255 TCP 64 bb > kermit [RST, ACK] Seq=1 Ack=1 Win=0 Len=0
962886 320.170645 68.83.160.23 -> 244.3.210.255 TCP 64 bb > kermit [RST, ACK] Seq=1 Ack=1 Win=0 Len=0
963677 320.623490 68.83.160.23 -> 244.3.210.255 TCP 64 bb > kermit [RST, ACK] Seq=1 Ack=1 Win=0 Len=0
969257 322.814985 68.83.160.23 -> 244.3.210.230 TCP 64 bb > dxmessagebase1 [RST, ACK] Seq=1 Ack=1 Win=0 Len=0
970051 323.259966 68.83.160.23 -> 244.3.210.230 TCP 64 bb > dxmessagebase1 [RST, ACK] Seq=1 Ack=1 Win=0 Len=0
970704 323.763471 68.83.160.23 -> 244.3.210.230 TCP 64 bb > dxmessagebase1 [RST, ACK] Seq=1 Ack=1 Win=0 Len=0
976143 325.112320 68.83.160.23 -> 244.3.210.98 TCP 64 bb > facsys-router [RST, ACK] Seq=1 Ack=1 Win=0 Len=0
977565 325.671930 68.83.160.23 -> 244.3.210.98 TCP 64 bb > facsys-router [RST, ACK] Seq=1 Ack=1 Win=0 Len=0
978731 326.110840 68.83.160.23 -> 244.3.210.98 TCP 64 bb > facsys-router [RST, ACK] Seq=1 Ack=1 Win=0 Len=0
1006726 337.165750 68.83.160.23 -> 244.3.210.98 TCP 64 bb > call-sig-trans [RST, ACK] Seq=1 Ack=1 Win=0 Len=0
1008028 337.688884 68.83.160.23 -> 244.3.210.98 TCP 64 bb > call-sig-trans [RST, ACK] Seq=1 Ack=1 Win=0 Len=0
1008979 338.128024 68.83.160.23 -> 244.3.210.98 TCP 64 bb > call-sig-trans [RST, ACK] Seq=1 Ack=1 Win=0 Len=0
1014446 341.152880 68.83.160.23 -> 244.3.210.98 TCP 64 bb > willy [RST, ACK] Seq=1 Ack=1 Win=0 Len=0
1014866 341.517001 68.83.160.23 -> 244.3.210.98 TCP 64 bb > willy [RST, ACK] Seq=1 Ack=1 Win=0 Len=0
1016258 342.079086 68.83.160.23 -> 244.3.210.98 TCP 64 bb > willy [RST, ACK] Seq=1 Ack=1 Win=0 Len=0
