62372  25.603707 75.43.106.122 -> 41.177.26.46 TCP 66 origo-native > http [SYN] Seq=0 Win=65535 Len=0 MSS=1460 SACK_PERM=1
63047  25.963503 75.43.106.122 -> 41.177.26.46 TCP 64 origo-native > http [ACK] Seq=1 Ack=1 Win=65535 Len=0
63765  26.349488 75.43.106.122 -> 41.177.26.46 TCP 64 origo-native > http [ACK] Seq=535 Ack=1734 Win=65535 Len=0
64196  26.492176 75.43.106.122 -> 41.177.26.46 TCP 64 origo-native > http [ACK] Seq=535 Ack=3194 Win=65535 Len=0
64672  26.709227 75.43.106.122 -> 41.177.26.46 TCP 64 origo-native > http [ACK] Seq=535 Ack=4654 Win=65535 Len=0
64675  26.709992 75.43.106.122 -> 41.177.26.46 TCP 64 origo-native > http [ACK] Seq=535 Ack=7574 Win=65535 Len=0
64862  26.751812 75.43.106.122 -> 41.177.26.46 TCP 66 csoftragent > http [SYN] Seq=0 Win=65535 Len=0 MSS=1460 SACK_PERM=1
65079  26.853246 75.43.106.122 -> 41.177.26.46 TCP 64 origo-native > http [ACK] Seq=535 Ack=9926 Win=65535 Len=0
65711  27.087621 75.43.106.122 -> 41.177.26.46 TCP 64 csoftragent > http [ACK] Seq=1 Ack=1 Win=65535 Len=0
66009  27.203167 75.43.106.122 -> 41.177.26.46 TCP 64 origo-native > http [ACK] Seq=535 Ack=10655 Win=64806 Len=0
66608  27.467893 75.43.106.122 -> 41.177.26.46 TCP 70 [TCP Dup ACK 65712#1] csoftragent > http [ACK] Seq=542 Ack=1 Win=65535 Len=0 SLE=273 SRE=1733
66610  27.468110 75.43.106.122 -> 41.177.26.46 TCP 70 [TCP Dup ACK 65712#2] csoftragent > http [ACK] Seq=542 Ack=1 Win=65535 Len=0 SLE=273 SRE=3193
67642  27.836621 75.43.106.122 -> 41.177.26.46 TCP 70 [TCP Dup ACK 65712#3] csoftragent > http [ACK] Seq=542 Ack=1 Win=65535 Len=0 SLE=273 SRE=4653
67644  27.836992 75.43.106.122 -> 41.177.26.46 TCP 70 [TCP Dup ACK 65712#4] csoftragent > http [ACK] Seq=542 Ack=1 Win=65535 Len=0 SLE=273 SRE=6113
67645  27.836997 75.43.106.122 -> 41.177.26.46 TCP 70 [TCP Dup ACK 65712#5] csoftragent > http [ACK] Seq=542 Ack=1 Win=65535 Len=0 SLE=273 SRE=6301
68412  28.197611 75.43.106.122 -> 41.177.26.46 TCP 64 csoftragent > http [ACK] Seq=542 Ack=6301 Win=65535 Len=0
68780  28.442935 75.43.106.122 -> 41.177.26.46 TCP 66 midnight-tech > http [SYN] Seq=0 Win=65535 Len=0 MSS=1460 SACK_PERM=1
68781  28.443097 75.43.106.122 -> 41.177.26.46 TCP 66 pxc-ntfy > http [SYN] Seq=0 Win=65535 Len=0 MSS=1460 SACK_PERM=1
69300  28.765177 75.43.106.122 -> 41.177.26.46 TCP 64 origo-native > http [ACK] Seq=2881 Ack=13575 Win=65535 Len=0
69301  28.765201 75.43.106.122 -> 41.177.26.46 TCP 64 origo-native > http [ACK] Seq=2881 Ack=14527 Win=64583 Len=0
69309  28.765757 75.43.106.122 -> 41.177.26.46 TCP 64 csoftragent > http [ACK] Seq=2875 Ack=8007 Win=65535 Len=0
69379  28.781403 75.43.106.122 -> 41.177.26.46 TCP 64 midnight-tech > http [ACK] Seq=1 Ack=1 Win=65535 Len=0
69380  28.781866 75.43.106.122 -> 41.177.26.46 TCP 64 pxc-ntfy > http [ACK] Seq=1 Ack=1 Win=65535 Len=0
69410  28.790042 75.43.106.122 -> 41.177.26.46 TCP 64 origo-native > http [ACK] Seq=2881 Ack=17255 Win=65535 Len=0
69414  28.790983 75.43.106.122 -> 41.177.26.46 TCP 64 origo-native > http [ACK] Seq=2881 Ack=20175 Win=65535 Len=0
69418  28.791304 75.43.106.122 -> 41.177.26.46 TCP 64 origo-native > http [ACK] Seq=2881 Ack=21635 Win=65535 Len=0
69425  28.795451 75.43.106.122 -> 41.177.26.46 TCP 64 csoftragent > http [ACK] Seq=2875 Ack=9739 Win=65535 Len=0
69814  28.930049 75.43.106.122 -> 41.177.26.46 TCP 64 origo-native > http [ACK] Seq=2881 Ack=23095 Win=65535 Len=0
70293  29.128634 75.43.106.122 -> 41.177.26.46 TCP 64 origo-native > http [ACK] Seq=2881 Ack=25447 Win=65535 Len=0
70297  29.129726 75.43.106.122 -> 41.177.26.46 TCP 64 origo-native > http [ACK] Seq=2881 Ack=28367 Win=65535 Len=0
70300  29.130020 75.43.106.122 -> 41.177.26.46 TCP 64 origo-native > http [ACK] Seq=2881 Ack=29827 Win=65535 Len=0
70405  29.156431 75.43.106.122 -> 41.177.26.46 TCP 64 pxc-ntfy > http [ACK] Seq=1561 Ack=2838 Win=65535 Len=0
70420  29.162161 75.43.106.122 -> 41.177.26.46 TCP 64 origo-native > http [ACK] Seq=2881 Ack=32747 Win=65535 Len=0
70424  29.162251 75.43.106.122 -> 41.177.26.46 TCP 64 origo-native > http [ACK] Seq=2881 Ack=33639 Win=64643 Len=0
70428  29.163336 75.43.106.122 -> 41.177.26.46 TCP 64 origo-native > http [ACK] Seq=2881 Ack=36559 Win=65535 Len=0
70429  29.163685 75.43.106.122 -> 41.177.26.46 TCP 64 origo-native > http [ACK] Seq=2881 Ack=38019 Win=65535 Len=0
70453  29.167778 75.43.106.122 -> 41.177.26.46 TCP 64 origo-native > http [ACK] Seq=2881 Ack=40939 Win=62615 Len=0
70454  29.168227 75.43.106.122 -> 41.177.26.46 TCP 64 csoftragent > http [ACK] Seq=2875 Ack=12659 Win=65535 Len=0
70473  29.176734 75.43.106.122 -> 41.177.26.46 TCP 64 [TCP Window Update] origo-native > http [ACK] Seq=2881 Ack=40939 Win=65535 Len=0
70861  29.293866 75.43.106.122 -> 41.177.26.46 TCP 64 pxc-ntfy > http [FIN, ACK] Seq=1561 Ack=4298 Win=65535 Len=0
70908  29.302469 75.43.106.122 -> 41.177.26.46 TCP 64 origo-native > http [ACK] Seq=2881 Ack=43291 Win=65535 Len=0
70910  29.302731 75.43.106.122 -> 41.177.26.46 TCP 64 origo-native > http [ACK] Seq=2881 Ack=44751 Win=65535 Len=0
71543  29.491523 75.43.106.122 -> 41.177.26.46 TCP 64 origo-native > http [ACK] Seq=2881 Ack=47671 Win=65535 Len=0
71546  29.492469 75.43.106.122 -> 41.177.26.46 TCP 64 origo-native > http [ACK] Seq=2881 Ack=49131 Win=65535 Len=0
71754  29.528008 75.43.106.122 -> 41.177.26.46 TCP 64 pxc-ntfy > http [ACK] Seq=1562 Ack=5758 Win=65535 Len=0
71778  29.529846 75.43.106.122 -> 41.177.26.46 TCP 64 pxc-ntfy > http [ACK] Seq=1562 Ack=8678 Win=65535 Len=0
71929  29.546144 75.43.106.122 -> 41.177.26.46 TCP 70 [TCP Dup ACK 70454#1] csoftragent > http [ACK] Seq=2875 Ack=12659 Win=65535 Len=0 SLE=14119 SRE=15112
71995  29.572189 75.43.106.122 -> 41.177.26.46 TCP 70 midnight-tech > http [ACK] Seq=2327 Ack=1560 Win=65535 Len=0 SLE=4480 SRE=5940
72413  29.656819 75.43.106.122 -> 41.177.26.46 TCP 64 pxc-ntfy > http [RST, ACK] Seq=1562 Ack=10138 Win=0 Len=0
73438  29.946883 75.43.106.122 -> 41.177.26.46 TCP 70 [TCP Dup ACK 71995#1] midnight-tech > http [ACK] Seq=2327 Ack=1560 Win=65535 Len=0 SLE=4480 SRE=7400
73441  29.947206 75.43.106.122 -> 41.177.26.46 TCP 70 [TCP Dup ACK 71995#2] midnight-tech > http [ACK] Seq=2327 Ack=1560 Win=65535 Len=0 SLE=4480 SRE=8860
73847  30.046891 75.43.106.122 -> 41.177.26.46 TCP 64 origo-native > http [ACK] Seq=3656 Ack=51699 Win=65535 Len=0
74679  30.311054 75.43.106.122 -> 41.177.26.46 TCP 70 [TCP Dup ACK 71995#3] midnight-tech > http [ACK] Seq=2327 Ack=1560 Win=65535 Len=0 SLE=4480 SRE=10320
74681  30.311250 75.43.106.122 -> 41.177.26.46 TCP 70 [TCP Dup ACK 71995#4] midnight-tech > http [ACK] Seq=2327 Ack=1560 Win=65535 Len=0 SLE=4480 SRE=11780
76310  30.659616 75.43.106.122 -> 41.177.26.46 TCP 64 midnight-tech > http [ACK] Seq=2327 Ack=11780 Win=65535 Len=0
76321  30.660288 75.43.106.122 -> 41.177.26.46 TCP 64 midnight-tech > http [ACK] Seq=2327 Ack=13240 Win=65535 Len=0
77675  30.981333 75.43.106.122 -> 41.177.26.46 TCP 64 midnight-tech > http [ACK] Seq=2327 Ack=16160 Win=65535 Len=0
77678  30.981739 75.43.106.122 -> 41.177.26.46 TCP 64 midnight-tech > http [ACK] Seq=2327 Ack=17620 Win=65535 Len=0
78474  31.164352 75.43.106.122 -> 41.177.26.46 TCP 64 midnight-tech > http [ACK] Seq=2327 Ack=19080 Win=65535 Len=0
79001  31.331514 75.43.106.122 -> 41.177.26.46 TCP 64 midnight-tech > http [ACK] Seq=2327 Ack=22000 Win=65535 Len=0
79450  31.468931 75.43.106.122 -> 41.177.26.46 TCP 64 midnight-tech > http [ACK] Seq=2327 Ack=23460 Win=65535 Len=0
80791  31.672788 75.43.106.122 -> 41.177.26.46 TCP 64 midnight-tech > http [ACK] Seq=2327 Ack=24920 Win=65535 Len=0
80826  31.690655 75.43.106.122 -> 41.177.26.46 TCP 64 midnight-tech > http [ACK] Seq=2327 Ack=27840 Win=65535 Len=0
80827  31.691059 75.43.106.122 -> 41.177.26.46 TCP 64 midnight-tech > http [ACK] Seq=2327 Ack=29300 Win=65535 Len=0
81975  31.976634 75.43.106.122 -> 41.177.26.46 TCP 64 midnight-tech > http [ACK] Seq=2327 Ack=30760 Win=65535 Len=0
82628  32.179784 75.43.106.122 -> 41.177.26.46 TCP 64 midnight-tech > http [ACK] Seq=2327 Ack=31590 Win=64705 Len=0
87411  33.820712 75.43.106.122 -> 41.177.26.46 TCP 64 csoftragent > http [ACK] Seq=2875 Ack=15112 Win=65535 Len=0
87971  34.067002 75.43.106.122 -> 41.177.26.46 TCP 64 csoftragent > http [FIN, ACK] Seq=2875 Ack=15112 Win=65535 Len=0
89188  34.422715 75.43.106.122 -> 41.177.26.46 TCP 64 csoftragent > http [ACK] Seq=2876 Ack=15113 Win=65535 Len=0
89193  34.427952 75.43.106.122 -> 41.177.26.46 TCP 64 midnight-tech > http [ACK] Seq=2855 Ack=34510 Win=65535 Len=0
89194  34.428081 75.43.106.122 -> 41.177.26.46 TCP 64 midnight-tech > http [ACK] Seq=2855 Ack=35501 Win=64544 Len=0
115197  41.117696 75.43.106.122 -> 41.177.26.46 TCP 64 origo-native > http [ACK] Seq=4420 Ack=52226 Win=65008 Len=0
115866  41.339889 75.43.106.122 -> 41.177.26.46 TCP 64 midnight-tech > http [ACK] Seq=3620 Ack=37236 Win=65535 Len=0
115872  41.340758 75.43.106.122 -> 41.177.26.46 TCP 64 midnight-tech > http [ACK] Seq=3620 Ack=40156 Win=65535 Len=0
115879  41.341464 75.43.106.122 -> 41.177.26.46 TCP 64 midnight-tech > http [ACK] Seq=3620 Ack=43076 Win=65535 Len=0
116712  41.686612 75.43.106.122 -> 41.177.26.46 TCP 64 midnight-tech > http [ACK] Seq=3620 Ack=44536 Win=65535 Len=0
116714  41.687344 75.43.106.122 -> 41.177.26.46 TCP 64 midnight-tech > http [ACK] Seq=3620 Ack=47456 Win=65535 Len=0
116718  41.688288 75.43.106.122 -> 41.177.26.46 TCP 64 midnight-tech > http [ACK] Seq=3620 Ack=50376 Win=65535 Len=0
116739  41.715414 75.43.106.122 -> 41.177.26.46 TCP 64 origo-native > http [ACK] Seq=5209 Ack=53956 Win=65535 Len=0
116741  41.716095 75.43.106.122 -> 41.177.26.46 TCP 64 origo-native > http [ACK] Seq=5209 Ack=56876 Win=65535 Len=0
116743  41.716499 75.43.106.122 -> 41.177.26.46 TCP 64 origo-native > http [ACK] Seq=5209 Ack=58381 Win=65535 Len=0
116749  41.726512 75.43.106.122 -> 41.177.26.46 TCP 66 gilatskysurfer > http [SYN] Seq=0 Win=65535 Len=0 MSS=1460 SACK_PERM=1
116973  41.828451 75.43.106.122 -> 41.177.26.46 TCP 64 midnight-tech > http [ACK] Seq=3620 Ack=51836 Win=65535 Len=0
117187  41.939801 75.43.106.122 -> 41.177.26.46 TCP 66 notify-srvr > http [SYN] Seq=0 Win=65535 Len=0 MSS=1460 SACK_PERM=1
117189  41.939986 75.43.106.122 -> 41.177.26.46 TCP 66 event-listener > http [SYN] Seq=0 Win=65535 Len=0 MSS=1460 SACK_PERM=1
117363  42.060315 75.43.106.122 -> 41.177.26.46 TCP 70 midnight-tech > http [ACK] Seq=5978 Ack=53296 Win=65535 Len=0 SLE=57676 SRE=59136
117365  42.060519 75.43.106.122 -> 41.177.26.46 TCP 70 [TCP Dup ACK 117363#1] midnight-tech > http [ACK] Seq=5978 Ack=53296 Win=65535 Len=0 SLE=57676 SRE=60596
117416  42.093671 75.43.106.122 -> 41.177.26.46 TCP 64 gilatskysurfer > http [ACK] Seq=1 Ack=1 Win=65535 Len=0
117687  42.203733 75.43.106.122 -> 41.177.26.46 TCP 70 [TCP Dup ACK 117363#2] midnight-tech > http [ACK] Seq=5978 Ack=53296 Win=65535 Len=0 SLE=57676 SRE=62056
117922  42.307726 75.43.106.122 -> 41.177.26.46 TCP 64 origo-native > http [ACK] Seq=8362 Ack=60992 Win=65535 Len=0
117928  42.312265 75.43.106.122 -> 41.177.26.46 TCP 64 notify-srvr > http [ACK] Seq=1 Ack=1 Win=65535 Len=0
117929  42.312634 75.43.106.122 -> 41.177.26.46 TCP 64 event-listener > http [ACK] Seq=1 Ack=1 Win=65535 Len=0
118244  42.434884 75.43.106.122 -> 41.177.26.46 TCP 70 [TCP Dup ACK 117363#3] midnight-tech > http [ACK] Seq=5978 Ack=53296 Win=65535 Len=0 SLE=57676 SRE=63516
118245  42.434981 75.43.106.122 -> 41.177.26.46 TCP 70 [TCP Dup ACK 117363#4] midnight-tech > http [ACK] Seq=5978 Ack=53296 Win=65535 Len=0 SLE=57676 SRE=64976
118291  42.465083 75.43.106.122 -> 41.177.26.46 TCP 64 gilatskysurfer > http [ACK] Seq=480 Ack=2921 Win=65535 Len=0
118292  42.465943 75.43.106.122 -> 41.177.26.46 TCP 64 gilatskysurfer > http [ACK] Seq=480 Ack=3913 Win=64543 Len=0
118575  42.579323 75.43.106.122 -> 41.177.26.46 TCP 70 [TCP Dup ACK 117363#5] midnight-tech > http [ACK] Seq=5978 Ack=53296 Win=65535 Len=0 SLE=57676 SRE=66436
119082  42.728894 75.43.106.122 -> 41.177.26.46 TCP 64 notify-srvr > http [ACK] Seq=3147 Ack=2428 Win=65535 Len=0
119088  42.729477 75.43.106.122 -> 41.177.26.46 TCP 64 event-listener > http [ACK] Seq=3155 Ack=2244 Win=65535 Len=0
119388  42.805861 75.43.106.122 -> 41.177.26.46 TCP 70 midnight-tech > http [ACK] Seq=5978 Ack=56216 Win=65535 Len=0 SLE=57676 SRE=66436
119397  42.806687 75.43.106.122 -> 41.177.26.46 TCP 64 midnight-tech > http [ACK] Seq=5978 Ack=66436 Win=65535 Len=0
119576  42.844097 75.43.106.122 -> 41.177.26.46 TCP 64 notify-srvr > http [ACK] Seq=3147 Ack=2696 Win=65267 Len=0
120625  43.031646 75.43.106.122 -> 41.177.26.46 TCP 64 event-listener > http [ACK] Seq=3155 Ack=3677 Win=64102 Len=0
120718  43.047140 75.43.106.122 -> 41.177.26.46 TCP 64 midnight-tech > http [ACK] Seq=5978 Ack=67896 Win=65535 Len=0
120802  43.073074 75.43.106.122 -> 41.177.26.46 TCP 64 notify-srvr > http [ACK] Seq=3147 Ack=5003 Win=65535 Len=0
120805  43.073789 75.43.106.122 -> 41.177.26.46 TCP 64 notify-srvr > http [ACK] Seq=3147 Ack=7923 Win=65535 Len=0
121065  43.164191 75.43.106.122 -> 41.177.26.46 TCP 64 midnight-tech > http [ACK] Seq=5978 Ack=70816 Win=65535 Len=0
121068  43.165024 75.43.106.122 -> 41.177.26.46 TCP 64 midnight-tech > http [ACK] Seq=5978 Ack=73736 Win=65535 Len=0
121665  43.351846 75.43.106.122 -> 41.177.26.46 TCP 64 notify-srvr > http [ACK] Seq=3147 Ack=9103 Win=64355 Len=0
122222  43.515655 75.43.106.122 -> 41.177.26.46 TCP 64 midnight-tech > http [ACK] Seq=5978 Ack=76656 Win=65535 Len=0
122229  43.517668 75.43.106.122 -> 41.177.26.46 TCP 64 midnight-tech > http [ACK] Seq=5978 Ack=79576 Win=65535 Len=0
122334  43.555053 75.43.106.122 -> 41.177.26.46 TCP 64 event-listener > http [ACK] Seq=3937 Ack=4319 Win=65535 Len=0
122335  43.555058 75.43.106.122 -> 41.177.26.46 TCP 64 origo-native > http [ACK] Seq=9938 Ack=63589 Win=64661 Len=0
122633  43.656526 75.43.106.122 -> 41.177.26.46 TCP 64 midnight-tech > http [ACK] Seq=5978 Ack=81036 Win=65535 Len=0
123310  43.872006 75.43.106.122 -> 41.177.26.46 TCP 64 midnight-tech > http [FIN, ACK] Seq=5978 Ack=81036 Win=65535 Len=0
123312  43.875936 75.43.106.122 -> 41.177.26.46 TCP 64 midnight-tech > http [ACK] Seq=5979 Ack=83956 Win=65535 Len=0
123319  43.876876 75.43.106.122 -> 41.177.26.46 TCP 64 midnight-tech > http [ACK] Seq=5979 Ack=86876 Win=65535 Len=0
123652  44.028503 75.43.106.122 -> 41.177.26.46 TCP 64 midnight-tech > http [ACK] Seq=5979 Ack=89796 Win=65535 Len=0
124116  44.248610 75.43.106.122 -> 41.177.26.46 TCP 64 midnight-tech > http [RST, ACK] Seq=5979 Ack=91256 Win=0 Len=0
172626  57.477809 75.43.106.122 -> 41.177.26.46 TCP 64 gilatskysurfer > http [ACK] Seq=480 Ack=3914 Win=64543 Len=0
173422  57.668685 75.43.106.122 -> 41.177.26.46 TCP 64 origo-native > http [FIN, ACK] Seq=9938 Ack=63589 Win=64661 Len=0
173425  57.668869 75.43.106.122 -> 41.177.26.46 TCP 64 event-listener > http [FIN, ACK] Seq=3937 Ack=4319 Win=65535 Len=0
173430  57.669032 75.43.106.122 -> 41.177.26.46 TCP 64 notify-srvr > http [FIN, ACK] Seq=3147 Ack=9103 Win=64355 Len=0
173448  57.669671 75.43.106.122 -> 41.177.26.46 TCP 64 gilatskysurfer > http [FIN, ACK] Seq=480 Ack=3914 Win=64543 Len=0
174640  58.025000 75.43.106.122 -> 41.177.26.46 TCP 64 origo-native > http [ACK] Seq=9939 Ack=63590 Win=64661 Len=0
174641  58.025051 75.43.106.122 -> 41.177.26.46 TCP 64 event-listener > http [ACK] Seq=3938 Ack=4320 Win=65535 Len=0
174642  58.025057 75.43.106.122 -> 41.177.26.46 TCP 64 notify-srvr > http [ACK] Seq=3148 Ack=9104 Win=64355 Len=0
