184685  62.076237 77.197.176.180 -> 244.3.210.197 TCP 66 30173 > http [SYN] Seq=0 Win=65535 Len=0 MSS=1460 SACK_PERM=1
185269  62.157844 77.197.176.180 -> 244.3.210.197 TCP 64 30173 > http [ACK] Seq=1 Ack=1 Win=65535 Len=0
185874  62.250221 77.197.176.180 -> 244.3.210.197 TCP 64 30173 > http [ACK] Seq=173 Ack=2921 Win=65535 Len=0
185985  62.331979 77.197.176.180 -> 244.3.210.197 TCP 64 30173 > http [ACK] Seq=173 Ack=6555 Win=65535 Len=0
185991  62.333295 77.197.176.180 -> 244.3.210.197 TCP 64 30173 > http [RST, ACK] Seq=173 Ack=6555 Win=0 Len=0
185997  62.334047 77.197.176.180 -> 244.3.210.197 TCP 66 30185 > http [SYN] Seq=0 Win=65535 Len=0 MSS=1460 SACK_PERM=1
186121  62.415530 77.197.176.180 -> 244.3.210.197 TCP 64 30185 > http [ACK] Seq=1 Ack=1 Win=65535 Len=0
186314  62.501322 77.197.176.180 -> 244.3.210.197 TCP 64 30185 > http [ACK] Seq=409 Ack=2326 Win=65535 Len=0
186330  62.503049 77.197.176.180 -> 244.3.210.197 TCP 64 30185 > http [RST, ACK] Seq=409 Ack=2326 Win=0 Len=0
