1014995 341.592063 77.197.106.40 -> 244.3.210.197 TCP 66 55553 > http [SYN] Seq=0 Win=65535 Len=0 MSS=1460 SACK_PERM=1
1015195 341.673681 77.197.106.40 -> 244.3.210.197 TCP 64 55553 > http [ACK] Seq=1 Ack=1 Win=65535 Len=0
1016567 342.272904 77.197.106.40 -> 244.3.210.197 TCP 64 55553 > http [ACK] Seq=312 Ack=2921 Win=65535 Len=0
1016641 342.354755 77.197.106.40 -> 244.3.210.197 TCP 64 55553 > http [ACK] Seq=312 Ack=7301 Win=65535 Len=0
1016739 342.436677 77.197.106.40 -> 244.3.210.197 TCP 64 55553 > http [ACK] Seq=312 Ack=13141 Win=65535 Len=0
1016848 342.519822 77.197.106.40 -> 244.3.210.197 TCP 64 55553 > http [ACK] Seq=312 Ack=13498 Win=65179 Len=0
1016854 342.520076 77.197.106.40 -> 244.3.210.197 TCP 64 55553 > http [RST, ACK] Seq=312 Ack=13498 Win=0 Len=0
