294118  99.024307 77.197.210.123 -> 41.177.26.15 TCP 66 4956 > http [SYN] Seq=0 Win=65535 Len=0 MSS=1460 SACK_PERM=1
294249  99.106351 77.197.210.123 -> 41.177.26.15 TCP 64 4956 > http [ACK] Seq=1 Ack=1 Win=65535 Len=0
295575  99.691337 77.197.210.123 -> 41.177.26.15 TCP 64 4956 > http [ACK] Seq=309 Ack=2921 Win=65535 Len=0
295741  99.773106 77.197.210.123 -> 41.177.26.15 TCP 64 4956 > http [ACK] Seq=309 Ack=5841 Win=65535 Len=0
295745  99.773182 77.197.210.123 -> 41.177.26.15 TCP 64 4956 > http [ACK] Seq=309 Ack=8465 Win=65535 Len=0
295894  99.854997 77.197.210.123 -> 41.177.26.15 TCP 64 4956 > http [ACK] Seq=309 Ack=11385 Win=65535 Len=0
295895  99.855123 77.197.210.123 -> 41.177.26.15 TCP 64 4956 > http [ACK] Seq=309 Ack=14305 Win=65535 Len=0
295896  99.855128 77.197.210.123 -> 41.177.26.15 TCP 64 4956 > http [ACK] Seq=309 Ack=16665 Win=65527 Len=0
295897  99.855132 77.197.210.123 -> 41.177.26.15 TCP 64 [TCP Dup ACK 295896#1] 4956 > http [ACK] Seq=309 Ack=16665 Win=65527 Len=0
307029 104.378873 77.197.210.123 -> 41.177.26.15 TCP 64 4956 > http [ACK] Seq=309 Ack=18125 Win=65535 Len=0
307279 104.460581 77.197.210.123 -> 41.177.26.15 TCP 64 4956 > http [ACK] Seq=309 Ack=21045 Win=65535 Len=0
307480 104.549801 77.197.210.123 -> 41.177.26.15 TCP 64 4956 > http [ACK] Seq=309 Ack=25425 Win=64967 Len=0
307481 104.549806 77.197.210.123 -> 41.177.26.15 TCP 64 [TCP Dup ACK 307480#1] 4956 > http [ACK] Seq=309 Ack=25425 Win=64967 Len=0
307678 104.636809 77.197.210.123 -> 41.177.26.15 TCP 64 4956 > http [ACK] Seq=309 Ack=30705 Win=65535 Len=0
307895 104.718506 77.197.210.123 -> 41.177.26.15 TCP 64 4956 > http [ACK] Seq=309 Ack=33065 Win=65535 Len=0
307896 104.718682 77.197.210.123 -> 41.177.26.15 TCP 64 4956 > http [ACK] Seq=309 Ack=34525 Win=65535 Len=0
307897 104.718686 77.197.210.123 -> 41.177.26.15 TCP 64 4956 > http [ACK] Seq=309 Ack=37445 Win=65535 Len=0
308029 104.800360 77.197.210.123 -> 41.177.26.15 TCP 64 4956 > http [ACK] Seq=309 Ack=40365 Win=65535 Len=0
308030 104.800481 77.197.210.123 -> 41.177.26.15 TCP 64 4956 > http [ACK] Seq=309 Ack=42725 Win=65535 Len=0
308337 104.882028 77.197.210.123 -> 41.177.26.15 TCP 64 4956 > http [ACK] Seq=309 Ack=45645 Win=65535 Len=0
308338 104.882142 77.197.210.123 -> 41.177.26.15 TCP 64 4956 > http [ACK] Seq=309 Ack=49465 Win=65535 Len=0
308429 104.963696 77.197.210.123 -> 41.177.26.15 TCP 64 4956 > http [ACK] Seq=309 Ack=52385 Win=65535 Len=0
308430 104.963813 77.197.210.123 -> 41.177.26.15 TCP 64 4956 > http [ACK] Seq=309 Ack=55305 Win=65535 Len=0
308431 104.963818 77.197.210.123 -> 41.177.26.15 TCP 64 4956 > http [ACK] Seq=309 Ack=57665 Win=65527 Len=0
308433 104.963931 77.197.210.123 -> 41.177.26.15 TCP 64 [TCP Dup ACK 308431#1] 4956 > http [ACK] Seq=309 Ack=57665 Win=65527 Len=0
308494 105.045575 77.197.210.123 -> 41.177.26.15 TCP 64 4956 > http [ACK] Seq=309 Ack=63505 Win=65535 Len=0
308495 105.045579 77.197.210.123 -> 41.177.26.15 TCP 64 4956 > http [ACK] Seq=309 Ack=65865 Win=65527 Len=0
308496 105.045583 77.197.210.123 -> 41.177.26.15 TCP 64 [TCP Dup ACK 308495#1] 4956 > http [ACK] Seq=309 Ack=65865 Win=65527 Len=0
308712 105.127375 77.197.210.123 -> 41.177.26.15 TCP 64 4956 > http [ACK] Seq=309 Ack=68785 Win=65535 Len=0
308713 105.127530 77.197.210.123 -> 41.177.26.15 TCP 64 4956 > http [ACK] Seq=309 Ack=71705 Win=65535 Len=0
308714 105.127570 77.197.210.123 -> 41.177.26.15 TCP 64 4956 > http [ACK] Seq=309 Ack=74065 Win=65535 Len=0
308813 105.214590 77.197.210.123 -> 41.177.26.15 TCP 64 4956 > http [ACK] Seq=309 Ack=83725 Win=64067 Len=0
308814 105.214595 77.197.210.123 -> 41.177.26.15 TCP 64 [TCP Window Update] 4956 > http [ACK] Seq=309 Ack=83725 Win=65535 Len=0
308950 105.296451 77.197.210.123 -> 41.177.26.15 TCP 64 4956 > http [ACK] Seq=309 Ack=86645 Win=65535 Len=0
308951 105.296483 77.197.210.123 -> 41.177.26.15 TCP 64 4956 > http [ACK] Seq=309 Ack=89565 Win=65535 Len=0
308952 105.296576 77.197.210.123 -> 41.177.26.15 TCP 64 4956 > http [ACK] Seq=309 Ack=91925 Win=65527 Len=0
308953 105.296581 77.197.210.123 -> 41.177.26.15 TCP 64 [TCP Dup ACK 308952#1] 4956 > http [ACK] Seq=309 Ack=91925 Win=65527 Len=0
309108 105.378446 77.197.210.123 -> 41.177.26.15 TCP 64 4956 > http [ACK] Seq=309 Ack=94845 Win=65535 Len=0
309110 105.378496 77.197.210.123 -> 41.177.26.15 TCP 64 4956 > http [ACK] Seq=309 Ack=97765 Win=65535 Len=0
309113 105.378682 77.197.210.123 -> 41.177.26.15 TCP 64 4956 > http [ACK] Seq=309 Ack=100125 Win=65535 Len=0
309120 105.378773 77.197.210.123 -> 41.177.26.15 TCP 64 4956 > http [ACK] Seq=309 Ack=101585 Win=65535 Len=0
309316 105.460240 77.197.210.123 -> 41.177.26.15 TCP 64 4956 > http [ACK] Seq=309 Ack=104505 Win=65535 Len=0
309317 105.460245 77.197.210.123 -> 41.177.26.15 TCP 64 4956 > http [ACK] Seq=309 Ack=106865 Win=65535 Len=0
309321 105.460530 77.197.210.123 -> 41.177.26.15 TCP 64 4956 > http [ACK] Seq=309 Ack=109785 Win=65527 Len=0
309322 105.460534 77.197.210.123 -> 41.177.26.15 TCP 64 [TCP Dup ACK 309321#1] 4956 > http [ACK] Seq=309 Ack=109785 Win=65527 Len=0
309324 105.460640 77.197.210.123 -> 41.177.26.15 TCP 64 4956 > http [ACK] Seq=309 Ack=112705 Win=65535 Len=0
309483 105.542567 77.197.210.123 -> 41.177.26.15 TCP 64 4956 > http [ACK] Seq=309 Ack=123265 Win=63167 Len=0
309484 105.542572 77.197.210.123 -> 41.177.26.15 TCP 64 [TCP Window Update] 4956 > http [ACK] Seq=309 Ack=123265 Win=65535 Len=0
309670 105.624576 77.197.210.123 -> 41.177.26.15 TCP 64 4956 > http [ACK] Seq=309 Ack=134385 Win=62607 Len=0
309671 105.624581 77.197.210.123 -> 41.177.26.15 TCP 64 [TCP Window Update] 4956 > http [ACK] Seq=309 Ack=134385 Win=65535 Len=0
309754 105.706427 77.197.210.123 -> 41.177.26.15 TCP 64 4956 > http [ACK] Seq=309 Ack=137305 Win=65535 Len=0
309755 105.706431 77.197.210.123 -> 41.177.26.15 TCP 64 4956 > http [ACK] Seq=309 Ack=139665 Win=65535 Len=0
309756 105.706598 77.197.210.123 -> 41.177.26.15 TCP 64 4956 > http [ACK] Seq=309 Ack=142585 Win=65535 Len=0
309757 105.706602 77.197.210.123 -> 41.177.26.15 TCP 64 4956 > http [ACK] Seq=309 Ack=145505 Win=65535 Len=0
309960 105.788114 77.197.210.123 -> 41.177.26.15 TCP 64 4956 > http [ACK] Seq=309 Ack=147865 Win=65535 Len=0
309961 105.788255 77.197.210.123 -> 41.177.26.15 TCP 64 4956 > http [ACK] Seq=309 Ack=150785 Win=65535 Len=0
309962 105.788260 77.197.210.123 -> 41.177.26.15 TCP 64 4956 > http [ACK] Seq=309 Ack=153705 Win=65527 Len=0
309963 105.788263 77.197.210.123 -> 41.177.26.15 TCP 64 [TCP Dup ACK 309962#1] 4956 > http [ACK] Seq=309 Ack=153705 Win=65527 Len=0
309964 105.788267 77.197.210.123 -> 41.177.26.15 TCP 64 4956 > http [ACK] Seq=309 Ack=156065 Win=65535 Len=0
310152 105.869899 77.197.210.123 -> 41.177.26.15 TCP 64 4956 > http [ACK] Seq=309 Ack=158985 Win=65535 Len=0
310153 105.869904 77.197.210.123 -> 41.177.26.15 TCP 64 4956 > http [ACK] Seq=309 Ack=161905 Win=65535 Len=0
310155 105.870087 77.197.210.123 -> 41.177.26.15 TCP 64 4956 > http [ACK] Seq=309 Ack=164265 Win=65535 Len=0
310157 105.870139 77.197.210.123 -> 41.177.26.15 TCP 64 4956 > http [ACK] Seq=309 Ack=165725 Win=65535 Len=0
310158 105.870143 77.197.210.123 -> 41.177.26.15 TCP 64 4956 > http [ACK] Seq=309 Ack=168645 Win=65535 Len=0
310469 105.951667 77.197.210.123 -> 41.177.26.15 TCP 64 4956 > http [ACK] Seq=309 Ack=171565 Win=65535 Len=0
310470 105.951672 77.197.210.123 -> 41.177.26.15 TCP 64 4956 > http [ACK] Seq=309 Ack=173925 Win=65535 Len=0
310471 105.951784 77.197.210.123 -> 41.177.26.15 TCP 64 4956 > http [ACK] Seq=309 Ack=176845 Win=65527 Len=0
310472 105.951789 77.197.210.123 -> 41.177.26.15 TCP 64 [TCP Dup ACK 310471#1] 4956 > http [ACK] Seq=309 Ack=176845 Win=65527 Len=0
310473 105.951793 77.197.210.123 -> 41.177.26.15 TCP 64 4956 > http [ACK] Seq=309 Ack=180665 Win=65535 Len=0
310802 106.035939 77.197.210.123 -> 41.177.26.15 TCP 64 4956 > http [ACK] Seq=309 Ack=194705 Win=61147 Len=0
310803 106.035944 77.197.210.123 -> 41.177.26.15 TCP 64 [TCP Window Update] 4956 > http [ACK] Seq=309 Ack=194705 Win=65535 Len=0
311129 106.117941 77.197.210.123 -> 41.177.26.15 TCP 64 4956 > http [ACK] Seq=309 Ack=197065 Win=65535 Len=0
311130 106.117963 77.197.210.123 -> 41.177.26.15 TCP 64 4956 > http [ACK] Seq=309 Ack=199985 Win=65535 Len=0
311131 106.118129 77.197.210.123 -> 41.177.26.15 TCP 64 4956 > http [ACK] Seq=309 Ack=204365 Win=64067 Len=0
311132 106.118134 77.197.210.123 -> 41.177.26.15 TCP 64 [TCP Window Update] 4956 > http [ACK] Seq=309 Ack=204365 Win=65535 Len=0
311137 106.118249 77.197.210.123 -> 41.177.26.15 TCP 64 4956 > http [ACK] Seq=309 Ack=206725 Win=65535 Len=0
311245 106.199690 77.197.210.123 -> 41.177.26.15 TCP 64 4956 > http [ACK] Seq=309 Ack=209645 Win=65535 Len=0
311247 106.199815 77.197.210.123 -> 41.177.26.15 TCP 64 4956 > http [ACK] Seq=309 Ack=212565 Win=65535 Len=0
311248 106.199820 77.197.210.123 -> 41.177.26.15 TCP 64 4956 > http [ACK] Seq=309 Ack=214925 Win=65535 Len=0
311253 106.199945 77.197.210.123 -> 41.177.26.15 TCP 64 4956 > http [ACK] Seq=309 Ack=217845 Win=62615 Len=0
311254 106.199954 77.197.210.123 -> 41.177.26.15 TCP 64 [TCP Window Update] 4956 > http [ACK] Seq=309 Ack=217845 Win=65535 Len=0
311255 106.199958 77.197.210.123 -> 41.177.26.15 TCP 64 4956 > http [ACK] Seq=309 Ack=221665 Win=65535 Len=0
311384 106.282376 77.197.210.123 -> 41.177.26.15 TCP 64 4956 > http [ACK] Seq=309 Ack=237165 Win=58227 Len=0
311385 106.282380 77.197.210.123 -> 41.177.26.15 TCP 64 [TCP Window Update] 4956 > http [ACK] Seq=309 Ack=237165 Win=65535 Len=0
311545 106.395452 77.197.210.123 -> 41.177.26.15 TCP 64 4956 > http [RST, ACK] Seq=309 Ack=238608 Win=0 Len=0
318000 108.482389 77.197.210.123 -> 41.177.26.15 TCP 66 14224 > http [SYN] Seq=0 Win=65535 Len=0 MSS=1460 SACK_PERM=1
318415 108.564000 77.197.210.123 -> 41.177.26.15 TCP 64 14224 > http [ACK] Seq=1 Ack=1 Win=65535 Len=0
321181 109.717380 77.197.210.123 -> 41.177.26.15 TCP 64 14224 > http [ACK] Seq=308 Ack=2921 Win=65535 Len=0
321282 109.799122 77.197.210.123 -> 41.177.26.15 TCP 64 14224 > http [ACK] Seq=308 Ack=7301 Win=65535 Len=0
321474 109.880889 77.197.210.123 -> 41.177.26.15 TCP 64 14224 > http [ACK] Seq=308 Ack=9925 Win=65535 Len=0
321482 109.881177 77.197.210.123 -> 41.177.26.15 TCP 64 14224 > http [ACK] Seq=308 Ack=12845 Win=65535 Len=0
321588 109.962603 77.197.210.123 -> 41.177.26.15 TCP 64 14224 > http [ACK] Seq=308 Ack=15765 Win=65535 Len=0
321589 109.962608 77.197.210.123 -> 41.177.26.15 TCP 64 14224 > http [ACK] Seq=308 Ack=16665 Win=64635 Len=0
321594 109.962872 77.197.210.123 -> 41.177.26.15 TCP 64 14224 > http [ACK] Seq=308 Ack=19585 Win=65535 Len=0
321595 109.962876 77.197.210.123 -> 41.177.26.15 TCP 64 14224 > http [ACK] Seq=308 Ack=21045 Win=65535 Len=0
321743 110.044461 77.197.210.123 -> 41.177.26.15 TCP 64 14224 > http [ACK] Seq=308 Ack=24865 Win=65187 Len=0
321744 110.044509 77.197.210.123 -> 41.177.26.15 TCP 64 [TCP Dup ACK 321743#1] 14224 > http [ACK] Seq=308 Ack=24865 Win=65187 Len=0
321745 110.044539 77.197.210.123 -> 41.177.26.15 TCP 64 14224 > http [ACK] Seq=308 Ack=29245 Win=65535 Len=0
321746 110.044544 77.197.210.123 -> 41.177.26.15 TCP 64 14224 > http [ACK] Seq=308 Ack=32165 Win=65535 Len=0
321755 110.044792 77.197.210.123 -> 41.177.26.15 TCP 64 14224 > http [ACK] Seq=308 Ack=35985 Win=61715 Len=0
321798 110.073130 77.197.210.123 -> 41.177.26.15 TCP 64 [TCP Window Update] 14224 > http [ACK] Seq=308 Ack=35985 Win=65535 Len=0
321921 110.129000 77.197.210.123 -> 41.177.26.15 TCP 64 14224 > http [ACK] Seq=308 Ack=48565 Win=61147 Len=0
321922 110.129137 77.197.210.123 -> 41.177.26.15 TCP 64 [TCP Window Update] 14224 > http [ACK] Seq=308 Ack=48565 Win=65535 Len=0
321929 110.129313 77.197.210.123 -> 41.177.26.15 TCP 64 14224 > http [ACK] Seq=308 Ack=56765 Win=60807 Len=0
321930 110.129317 77.197.210.123 -> 41.177.26.15 TCP 64 [TCP Window Update] 14224 > http [ACK] Seq=308 Ack=56765 Win=65535 Len=0
322140 110.210733 77.197.210.123 -> 41.177.26.15 TCP 64 14224 > http [ACK] Seq=308 Ack=59125 Win=65535 Len=0
322141 110.210738 77.197.210.123 -> 41.177.26.15 TCP 64 14224 > http [ACK] Seq=308 Ack=62045 Win=65535 Len=0
322142 110.210929 77.197.210.123 -> 41.177.26.15 TCP 64 14224 > http [ACK] Seq=308 Ack=65865 Win=64627 Len=0
322143 110.210933 77.197.210.123 -> 41.177.26.15 TCP 64 [TCP Dup ACK 322142#1] 14224 > http [ACK] Seq=308 Ack=65865 Win=64627 Len=0
322144 110.210937 77.197.210.123 -> 41.177.26.15 TCP 64 14224 > http [ACK] Seq=308 Ack=68785 Win=65535 Len=0
322145 110.210941 77.197.210.123 -> 41.177.26.15 TCP 64 14224 > http [ACK] Seq=308 Ack=71705 Win=65535 Len=0
322149 110.211228 77.197.210.123 -> 41.177.26.15 TCP 64 14224 > http [ACK] Seq=308 Ack=74065 Win=64635 Len=0
322160 110.211555 77.197.210.123 -> 41.177.26.15 TCP 64 14224 > http [ACK] Seq=308 Ack=76985 Win=61715 Len=0
322161 110.211559 77.197.210.123 -> 41.177.26.15 TCP 64 14224 > http [ACK] Seq=308 Ack=79905 Win=58795 Len=0
322169 110.211725 77.197.210.123 -> 41.177.26.15 TCP 64 14224 > http [ACK] Seq=308 Ack=81365 Win=60807 Len=0
322175 110.211822 77.197.210.123 -> 41.177.26.15 TCP 64 [TCP Window Update] 14224 > http [ACK] Seq=308 Ack=81365 Win=65535 Len=0
322347 110.292778 77.197.210.123 -> 41.177.26.15 TCP 64 14224 > http [ACK] Seq=308 Ack=83725 Win=65535 Len=0
322348 110.292862 77.197.210.123 -> 41.177.26.15 TCP 64 14224 > http [ACK] Seq=308 Ack=86645 Win=65535 Len=0
322349 110.292866 77.197.210.123 -> 41.177.26.15 TCP 64 14224 > http [ACK] Seq=308 Ack=89565 Win=65527 Len=0
322350 110.292871 77.197.210.123 -> 41.177.26.15 TCP 64 [TCP Dup ACK 322349#1] 14224 > http [ACK] Seq=308 Ack=89565 Win=65527 Len=0
322351 110.292875 77.197.210.123 -> 41.177.26.15 TCP 64 14224 > http [ACK] Seq=308 Ack=93385 Win=65535 Len=0
322352 110.293024 77.197.210.123 -> 41.177.26.15 TCP 64 14224 > http [ACK] Seq=308 Ack=96305 Win=65535 Len=0
322357 110.293143 77.197.210.123 -> 41.177.26.15 TCP 64 14224 > http [ACK] Seq=308 Ack=98665 Win=64635 Len=0
322358 110.293147 77.197.210.123 -> 41.177.26.15 TCP 64 14224 > http [ACK] Seq=308 Ack=101585 Win=61715 Len=0
322359 110.293151 77.197.210.123 -> 41.177.26.15 TCP 64 14224 > http [ACK] Seq=308 Ack=104505 Win=58795 Len=0
322361 110.293189 77.197.210.123 -> 41.177.26.15 TCP 64 14224 > http [ACK] Seq=308 Ack=106865 Win=56435 Len=0
322367 110.293295 77.197.210.123 -> 41.177.26.15 TCP 64 14224 > http [ACK] Seq=308 Ack=109785 Win=53515 Len=0
322368 110.293299 77.197.210.123 -> 41.177.26.15 TCP 64 14224 > http [ACK] Seq=308 Ack=112705 Win=50595 Len=0
322372 110.293437 77.197.210.123 -> 41.177.26.15 TCP 64 14224 > http [ACK] Seq=308 Ack=115065 Win=48235 Len=0
322377 110.293525 77.197.210.123 -> 41.177.26.15 TCP 64 14224 > http [ACK] Seq=308 Ack=117985 Win=45315 Len=0
322411 110.311960 77.197.210.123 -> 41.177.26.15 TCP 64 [TCP Window Update] 14224 > http [ACK] Seq=308 Ack=117985 Win=48787 Len=0
322412 110.311964 77.197.210.123 -> 41.177.26.15 TCP 64 [TCP Window Update] 14224 > http [ACK] Seq=308 Ack=117985 Win=65535 Len=0
322515 110.376282 77.197.210.123 -> 41.177.26.15 TCP 64 14224 > http [ACK] Seq=308 Ack=147865 Win=43847 Len=0
322516 110.376447 77.197.210.123 -> 41.177.26.15 TCP 64 [TCP Window Update] 14224 > http [ACK] Seq=308 Ack=147865 Win=65535 Len=0
322517 110.376452 77.197.210.123 -> 41.177.26.15 TCP 64 14224 > http [ACK] Seq=308 Ack=156065 Win=57335 Len=0
322524 110.376669 77.197.210.123 -> 41.177.26.15 TCP 64 14224 > http [ACK] Seq=308 Ack=161905 Win=51495 Len=0
322548 110.383098 77.197.210.123 -> 41.177.26.15 TCP 64 [TCP Window Update] 14224 > http [ACK] Seq=308 Ack=161905 Win=54967 Len=0
322549 110.383103 77.197.210.123 -> 41.177.26.15 TCP 64 [TCP Dup ACK 322548#1] 14224 > http [ACK] Seq=308 Ack=161905 Win=54967 Len=0
322551 110.383241 77.197.210.123 -> 41.177.26.15 TCP 64 [TCP Window Update] 14224 > http [ACK] Seq=308 Ack=161905 Win=65535 Len=0
322586 110.394779 77.197.210.123 -> 41.177.26.15 TCP 64 14224 > http [ACK] Seq=308 Ack=173925 Win=61707 Len=0
322587 110.394890 77.197.210.123 -> 41.177.26.15 TCP 64 [TCP Window Update] 14224 > http [ACK] Seq=308 Ack=173925 Win=65535 Len=0
322689 110.458302 77.197.210.123 -> 41.177.26.15 TCP 64 14224 > http [ACK] Seq=308 Ack=191785 Win=55867 Len=0
322690 110.458411 77.197.210.123 -> 41.177.26.15 TCP 64 [TCP Window Update] 14224 > http [ACK] Seq=308 Ack=191785 Win=65535 Len=0
322691 110.458415 77.197.210.123 -> 41.177.26.15 TCP 64 14224 > http [ACK] Seq=308 Ack=198525 Win=58795 Len=0
322695 110.458562 77.197.210.123 -> 41.177.26.15 TCP 64 14224 > http [ACK] Seq=308 Ack=199985 Win=60807 Len=0
322696 110.458565 77.197.210.123 -> 41.177.26.15 TCP 64 [TCP Window Update] 14224 > http [ACK] Seq=308 Ack=199985 Win=65535 Len=0
322697 110.458570 77.197.210.123 -> 41.177.26.15 TCP 64 14224 > http [ACK] Seq=308 Ack=206725 Win=65535 Len=0
322698 110.458574 77.197.210.123 -> 41.177.26.15 TCP 64 14224 > http [ACK] Seq=308 Ack=209645 Win=62615 Len=0
322699 110.458597 77.197.210.123 -> 41.177.26.15 TCP 64 [TCP Window Update] 14224 > http [ACK] Seq=308 Ack=209645 Win=65535 Len=0
322705 110.458737 77.197.210.123 -> 41.177.26.15 TCP 64 14224 > http [ACK] Seq=308 Ack=212565 Win=65535 Len=0
322718 110.465283 77.197.210.123 -> 41.177.26.15 TCP 64 14224 > http [ACK] Seq=308 Ack=223125 Win=63167 Len=0
322719 110.465288 77.197.210.123 -> 41.177.26.15 TCP 64 [TCP Window Update] 14224 > http [ACK] Seq=308 Ack=223125 Win=65535 Len=0
322734 110.477099 77.197.210.123 -> 41.177.26.15 TCP 64 14224 > http [ACK] Seq=308 Ack=229865 Win=65535 Len=0
322735 110.478589 77.197.210.123 -> 41.177.26.15 TCP 64 14224 > http [ACK] Seq=308 Ack=235705 Win=65535 Len=0
322882 110.540245 77.197.210.123 -> 41.177.26.15 TCP 64 14224 > http [ACK] Seq=308 Ack=239525 Win=65535 Len=0
322883 110.540249 77.197.210.123 -> 41.177.26.15 TCP 64 14224 > http [ACK] Seq=308 Ack=243905 Win=65527 Len=0
322884 110.540253 77.197.210.123 -> 41.177.26.15 TCP 64 [TCP Dup ACK 322883#1] 14224 > http [ACK] Seq=308 Ack=243905 Win=65527 Len=0
322885 110.540265 77.197.210.123 -> 41.177.26.15 TCP 64 14224 > http [ACK] Seq=308 Ack=247725 Win=65535 Len=0
322886 110.542930 77.197.210.123 -> 41.177.26.15 TCP 64 14224 > http [ACK] Seq=308 Ack=251962 Win=65535 Len=0
322908 110.569854 77.197.210.123 -> 41.177.26.15 TCP 64 14224 > http [RST, ACK] Seq=308 Ack=251962 Win=0 Len=0
365695 124.898206 77.197.210.123 -> 41.177.26.91 TCP 66 19122 > http [SYN] Seq=0 Win=65535 Len=0 MSS=1460 SACK_PERM=1
365780 124.980705 77.197.210.123 -> 41.177.26.91 TCP 64 19122 > http [ACK] Seq=1 Ack=1 Win=65535 Len=0
366203 125.183503 77.197.210.123 -> 41.177.26.91 TCP 64 19122 > http [ACK] Seq=332 Ack=2921 Win=65535 Len=0
366306 125.266223 77.197.210.123 -> 41.177.26.91 TCP 64 19122 > http [ACK] Seq=332 Ack=5841 Win=65535 Len=0
366310 125.266462 77.197.210.123 -> 41.177.26.91 TCP 64 19122 > http [ACK] Seq=332 Ack=8761 Win=65535 Len=0
366413 125.349411 77.197.210.123 -> 41.177.26.91 TCP 64 19122 > http [ACK] Seq=332 Ack=11681 Win=65535 Len=0
366414 125.349682 77.197.210.123 -> 41.177.26.91 TCP 64 19122 > http [ACK] Seq=332 Ack=14700 Win=65535 Len=0
366463 125.365376 77.197.210.123 -> 41.177.26.91 TCP 64 19122 > http [RST, ACK] Seq=332 Ack=14700 Win=0 Len=0
916490 304.329695 77.197.210.123 -> 41.177.26.15 TCP 66 efr > http [SYN] Seq=0 Win=65535 Len=0 MSS=1460 SACK_PERM=1
916669 304.412700 77.197.210.123 -> 41.177.26.15 TCP 64 efr > http [ACK] Seq=1 Ack=1 Win=65535 Len=0
918073 304.687006 77.197.210.123 -> 41.177.26.15 TCP 64 efr > http [ACK] Seq=308 Ack=2921 Win=65535 Len=0
919135 304.769920 77.197.210.123 -> 41.177.26.15 TCP 64 efr > http [ACK] Seq=308 Ack=8465 Win=65535 Len=0
919799 304.852142 77.197.210.123 -> 41.177.26.15 TCP 64 efr > http [ACK] Seq=308 Ack=15765 Win=65535 Len=0
919955 304.935019 77.197.210.123 -> 41.177.26.15 TCP 64 efr > http [ACK] Seq=308 Ack=19585 Win=65535 Len=0
919956 304.935024 77.197.210.123 -> 41.177.26.15 TCP 64 efr > http [ACK] Seq=308 Ack=23965 Win=65527 Len=0
919957 304.935028 77.197.210.123 -> 41.177.26.15 TCP 64 [TCP Dup ACK 919956#1] efr > http [ACK] Seq=308 Ack=23965 Win=65527 Len=0
920315 305.017640 77.197.210.123 -> 41.177.26.15 TCP 64 efr > http [ACK] Seq=308 Ack=34525 Win=63167 Len=0
920316 305.017645 77.197.210.123 -> 41.177.26.15 TCP 64 [TCP Window Update] efr > http [ACK] Seq=308 Ack=34525 Win=65535 Len=0
920458 305.099583 77.197.210.123 -> 41.177.26.15 TCP 64 efr > http [ACK] Seq=308 Ack=37445 Win=65535 Len=0
920459 305.099588 77.197.210.123 -> 41.177.26.15 TCP 64 efr > http [ACK] Seq=308 Ack=40365 Win=65535 Len=0
920460 305.099592 77.197.210.123 -> 41.177.26.15 TCP 64 efr > http [ACK] Seq=308 Ack=42725 Win=65527 Len=0
920461 305.099596 77.197.210.123 -> 41.177.26.15 TCP 64 [TCP Dup ACK 920460#1] efr > http [ACK] Seq=308 Ack=42725 Win=65527 Len=0
920462 305.099696 77.197.210.123 -> 41.177.26.15 TCP 64 efr > http [ACK] Seq=308 Ack=45645 Win=65535 Len=0
920602 305.181460 77.197.210.123 -> 41.177.26.15 TCP 64 efr > http [ACK] Seq=308 Ack=49465 Win=65535 Len=0
920604 305.181688 77.197.210.123 -> 41.177.26.15 TCP 64 efr > http [ACK] Seq=308 Ack=52385 Win=65535 Len=0
920605 305.181693 77.197.210.123 -> 41.177.26.15 TCP 64 efr > http [ACK] Seq=308 Ack=55305 Win=65527 Len=0
920606 305.181697 77.197.210.123 -> 41.177.26.15 TCP 64 [TCP Dup ACK 920605#1] efr > http [ACK] Seq=308 Ack=55305 Win=65527 Len=0
920607 305.181761 77.197.210.123 -> 41.177.26.15 TCP 64 efr > http [ACK] Seq=308 Ack=57665 Win=65535 Len=0
920609 305.181934 77.197.210.123 -> 41.177.26.15 TCP 64 efr > http [ACK] Seq=308 Ack=60585 Win=65535 Len=0
920610 305.181939 77.197.210.123 -> 41.177.26.15 TCP 64 efr > http [ACK] Seq=308 Ack=64106 Win=64934 Len=0
920632 305.196579 77.197.210.123 -> 41.177.26.15 TCP 64 efr > http [RST, ACK] Seq=308 Ack=64106 Win=0 Len=0
