284066  95.167254 77.197.128.165 -> 41.177.26.176 TCP 66 32991 > http [SYN] Seq=0 Win=65535 Len=0 MSS=1460 SACK_PERM=1
284582  95.249114 77.197.128.165 -> 41.177.26.176 TCP 64 32991 > http [ACK] Seq=1 Ack=1 Win=65535 Len=0
288272  96.302515 77.197.128.165 -> 41.177.26.176 TCP 64 32991 > http [ACK] Seq=341 Ack=2115 Win=65535 Len=0
288273  96.302727 77.197.128.165 -> 41.177.26.176 TCP 64 32991 > http [ACK] Seq=341 Ack=2605 Win=65045 Len=0
288274  96.302732 77.197.128.165 -> 41.177.26.176 TCP 64 32991 > http [ACK] Seq=341 Ack=2943 Win=64707 Len=0
288506  96.384516 77.197.128.165 -> 41.177.26.176 TCP 64 32991 > http [ACK] Seq=341 Ack=5410 Win=65535 Len=0
288507  96.384520 77.197.128.165 -> 41.177.26.176 TCP 64 32991 > http [ACK] Seq=341 Ack=8248 Win=64709 Len=0
288508  96.384524 77.197.128.165 -> 41.177.26.176 TCP 64 [TCP Dup ACK 288507#1] 32991 > http [ACK] Seq=341 Ack=8248 Win=64709 Len=0
288509  96.384529 77.197.128.165 -> 41.177.26.176 TCP 64 32991 > http [ACK] Seq=341 Ack=10972 Win=64271 Len=0
289444  96.632066 77.197.128.165 -> 41.177.26.176 TCP 64 32991 > http [RST, ACK] Seq=341 Ack=10972 Win=0 Len=0
291198  97.260130 77.197.128.165 -> 41.177.26.176 TCP 66 33713 > http [SYN] Seq=0 Win=65535 Len=0 MSS=1460 SACK_PERM=1
291330  97.341861 77.197.128.165 -> 41.177.26.176 TCP 64 33713 > http [ACK] Seq=1 Ack=1 Win=65535 Len=0
291939  97.713488 77.197.128.165 -> 41.177.26.176 TCP 64 33713 > http [ACK] Seq=316 Ack=2431 Win=65535 Len=0
292051  97.795294 77.197.128.165 -> 41.177.26.176 TCP 64 33713 > http [ACK] Seq=316 Ack=5351 Win=65535 Len=0
292052  97.795369 77.197.128.165 -> 41.177.26.176 TCP 64 33713 > http [ACK] Seq=316 Ack=7510 Win=65388 Len=0
292053  97.795374 77.197.128.165 -> 41.177.26.176 TCP 64 [TCP Dup ACK 292052#1] 33713 > http [ACK] Seq=316 Ack=7510 Win=65388 Len=0
292185  97.877191 77.197.128.165 -> 41.177.26.176 TCP 64 33713 > http [ACK] Seq=316 Ack=11022 Win=64943 Len=0
292232  97.929227 77.197.128.165 -> 41.177.26.176 TCP 64 33713 > http [RST, ACK] Seq=316 Ack=11022 Win=0 Len=0
292658  98.230281 77.197.128.165 -> 41.177.26.176 TCP 66 34006 > http [SYN] Seq=0 Win=65535 Len=0 MSS=1460 SACK_PERM=1
292818  98.312110 77.197.128.165 -> 41.177.26.176 TCP 64 34006 > http [ACK] Seq=1 Ack=1 Win=65535 Len=0
293719  98.717731 77.197.128.165 -> 41.177.26.176 TCP 64 34006 > http [ACK] Seq=355 Ack=2431 Win=65535 Len=0
293790  98.799507 77.197.128.165 -> 41.177.26.176 TCP 64 34006 > http [ACK] Seq=355 Ack=6225 Win=65535 Len=0
293947  98.881168 77.197.128.165 -> 41.177.26.176 TCP 64 34006 > http [ACK] Seq=355 Ack=8119 Win=65535 Len=0
293948  98.881355 77.197.128.165 -> 41.177.26.176 TCP 64 34006 > http [ACK] Seq=355 Ack=11225 Win=63889 Len=0
294111  99.016804 77.197.128.165 -> 41.177.26.176 TCP 64 [TCP Window Update] 34006 > http [ACK] Seq=355 Ack=11225 Win=65535 Len=0
294113  99.017061 77.197.128.165 -> 41.177.26.176 TCP 64 34006 > http [RST, ACK] Seq=355 Ack=11225 Win=0 Len=0
294466  99.240361 77.197.128.165 -> 41.177.26.176 TCP 66 34299 > http [SYN] Seq=0 Win=65535 Len=0 MSS=1460 SACK_PERM=1
294607  99.322077 77.197.128.165 -> 41.177.26.176 TCP 64 34299 > http [ACK] Seq=1 Ack=1 Win=65535 Len=0
295581  99.706354 77.197.128.165 -> 41.177.26.176 TCP 64 34299 > http [ACK] Seq=353 Ack=3274 Win=65535 Len=0
295770  99.788596 77.197.128.165 -> 41.177.26.176 TCP 64 34299 > http [ACK] Seq=353 Ack=5519 Win=65535 Len=0
295775  99.788860 77.197.128.165 -> 41.177.26.176 TCP 64 34299 > http [ACK] Seq=353 Ack=7683 Win=65535 Len=0
295933  99.870542 77.197.128.165 -> 41.177.26.176 TCP 64 34299 > http [ACK] Seq=353 Ack=11469 Win=65535 Len=0
295934  99.870838 77.197.128.165 -> 41.177.26.176 TCP 64 34299 > http [RST, ACK] Seq=353 Ack=11469 Win=0 Len=0
296341 100.065426 77.197.128.165 -> 41.177.26.176 TCP 66 34563 > http [SYN] Seq=0 Win=65535 Len=0 MSS=1460 SACK_PERM=1
296503 100.147161 77.197.128.165 -> 41.177.26.176 TCP 64 34563 > http [ACK] Seq=1 Ack=1 Win=65535 Len=0
298297 100.523657 77.197.128.165 -> 41.177.26.176 TCP 64 34563 > http [ACK] Seq=309 Ack=3908 Win=65535 Len=0
298517 100.605790 77.197.128.165 -> 41.177.26.176 TCP 64 34563 > http [ACK] Seq=309 Ack=6082 Win=65535 Len=0
298518 100.605936 77.197.128.165 -> 41.177.26.176 TCP 64 34563 > http [ACK] Seq=309 Ack=7914 Win=65535 Len=0
298723 100.687544 77.197.128.165 -> 41.177.26.176 TCP 64 34563 > http [ACK] Seq=309 Ack=11190 Win=65535 Len=0
298724 100.687740 77.197.128.165 -> 41.177.26.176 TCP 64 34563 > http [RST, ACK] Seq=309 Ack=11190 Win=0 Len=0
298821 100.742556 77.197.128.165 -> 41.177.26.176 TCP 66 34789 > http [SYN] Seq=0 Win=65535 Len=0 MSS=1460 SACK_PERM=1
299061 100.824503 77.197.128.165 -> 41.177.26.176 TCP 64 34789 > http [ACK] Seq=1 Ack=1 Win=65535 Len=0
300383 101.250282 77.197.128.165 -> 41.177.26.176 TCP 64 34789 > http [ACK] Seq=309 Ack=2431 Win=65535 Len=0
300384 101.250437 77.197.128.165 -> 41.177.26.176 TCP 64 34789 > http [ACK] Seq=309 Ack=3908 Win=65535 Len=0
300568 101.332219 77.197.128.165 -> 41.177.26.176 TCP 64 34789 > http [ACK] Seq=309 Ack=6088 Win=65535 Len=0
300569 101.332223 77.197.128.165 -> 41.177.26.176 TCP 64 34789 > http [ACK] Seq=309 Ack=10321 Win=65535 Len=0
300813 101.413991 77.197.128.165 -> 41.177.26.176 TCP 64 34789 > http [ACK] Seq=309 Ack=11918 Win=65535 Len=0
300814 101.414169 77.197.128.165 -> 41.177.26.176 TCP 64 34789 > http [RST, ACK] Seq=309 Ack=11918 Win=0 Len=0
300948 101.470241 77.197.128.165 -> 41.177.26.176 TCP 66 35042 > http [SYN] Seq=0 Win=65535 Len=0 MSS=1460 SACK_PERM=1
301144 101.551997 77.197.128.165 -> 41.177.26.176 TCP 64 35042 > http [ACK] Seq=1 Ack=1 Win=65535 Len=0
302365 102.036526 77.197.128.165 -> 41.177.26.176 TCP 64 35042 > http [ACK] Seq=318 Ack=2431 Win=65535 Len=0
302366 102.036531 77.197.128.165 -> 41.177.26.176 TCP 64 35042 > http [ACK] Seq=318 Ack=3896 Win=65535 Len=0
302441 102.118364 77.197.128.165 -> 41.177.26.176 TCP 64 35042 > http [ACK] Seq=318 Ack=6070 Win=65535 Len=0
302442 102.118399 77.197.128.165 -> 41.177.26.176 TCP 64 35042 > http [ACK] Seq=318 Ack=8302 Win=65535 Len=0
302534 102.199999 77.197.128.165 -> 41.177.26.176 TCP 64 35042 > http [ACK] Seq=318 Ack=10670 Win=65535 Len=0
302535 102.200362 77.197.128.165 -> 41.177.26.176 TCP 64 35042 > http [RST, ACK] Seq=318 Ack=11352 Win=0 Len=0
302642 102.237429 77.197.128.165 -> 41.177.26.176 TCP 66 35287 > http [SYN] Seq=0 Win=65535 Len=0 MSS=1460 SACK_PERM=1
302805 102.319273 77.197.128.165 -> 41.177.26.176 TCP 64 35287 > http [ACK] Seq=1 Ack=1 Win=65535 Len=0
317567 108.375474 77.197.128.165 -> 41.177.26.176 TCP 64 35287 > http [ACK] Seq=334 Ack=2121 Win=65535 Len=0
317572 108.375813 77.197.128.165 -> 41.177.26.176 TCP 64 35287 > http [ACK] Seq=334 Ack=2451 Win=65205 Len=0
317575 108.375993 77.197.128.165 -> 41.177.26.176 TCP 64 35287 > http [ACK] Seq=334 Ack=2932 Win=64724 Len=0
317906 108.457836 77.197.128.165 -> 41.177.26.176 TCP 64 35287 > http [ACK] Seq=334 Ack=5374 Win=65535 Len=0
317907 108.458144 77.197.128.165 -> 41.177.26.176 TCP 64 35287 > http [ACK] Seq=334 Ack=8180 Win=64741 Len=0
317908 108.458150 77.197.128.165 -> 41.177.26.176 TCP 64 [TCP Dup ACK 317907#1] 35287 > http [ACK] Seq=334 Ack=8180 Win=64741 Len=0
317910 108.458521 77.197.128.165 -> 41.177.26.176 TCP 64 35287 > http [ACK] Seq=334 Ack=10867 Win=64308 Len=0
317930 108.463669 77.197.128.165 -> 41.177.26.176 TCP 64 35287 > http [RST, ACK] Seq=334 Ack=10867 Win=0 Len=0
318551 108.588219 77.197.128.165 -> 41.177.26.176 TCP 66 36993 > http [SYN] Seq=0 Win=65535 Len=0 MSS=1460 SACK_PERM=1
318914 108.669981 77.197.128.165 -> 41.177.26.176 TCP 64 36993 > http [ACK] Seq=1 Ack=1 Win=65535 Len=0
319891 109.098137 77.197.128.165 -> 41.177.26.176 TCP 64 36993 > http [ACK] Seq=309 Ack=2431 Win=65535 Len=0
320021 109.180082 77.197.128.165 -> 41.177.26.176 TCP 64 36993 > http [ACK] Seq=309 Ack=6075 Win=65535 Len=0
320219 109.262079 77.197.128.165 -> 41.177.26.176 TCP 64 36993 > http [ACK] Seq=309 Ack=8995 Win=65535 Len=0
320220 109.262084 77.197.128.165 -> 41.177.26.176 TCP 64 36993 > http [ACK] Seq=309 Ack=11266 Win=65535 Len=0
320222 109.262397 77.197.128.165 -> 41.177.26.176 TCP 64 36993 > http [RST, ACK] Seq=309 Ack=11266 Win=0 Len=0
320438 109.330343 77.197.128.165 -> 41.177.26.176 TCP 66 37133 > http [SYN] Seq=0 Win=65535 Len=0 MSS=1460 SACK_PERM=1
320574 109.411955 77.197.128.165 -> 41.177.26.176 TCP 64 37133 > http [ACK] Seq=1 Ack=1 Win=65535 Len=0
321909 110.118229 77.197.128.165 -> 41.177.26.176 TCP 64 37133 > http [ACK] Seq=363 Ack=2098 Win=65535 Len=0
321950 110.146265 77.197.128.165 -> 41.177.26.176 TCP 64 37133 > http [ACK] Seq=363 Ack=3215 Win=64418 Len=0
322057 110.200315 77.197.128.165 -> 41.177.26.176 TCP 64 37133 > http [ACK] Seq=363 Ack=6135 Win=65535 Len=0
322214 110.228076 77.197.128.165 -> 41.177.26.176 TCP 64 37133 > http [ACK] Seq=363 Ack=9055 Win=64627 Len=0
322215 110.228080 77.197.128.165 -> 41.177.26.176 TCP 64 [TCP Dup ACK 322214#1] 37133 > http [ACK] Seq=363 Ack=9055 Win=64627 Len=0
322335 110.282081 77.197.128.165 -> 41.177.26.176 TCP 64 37133 > http [ACK] Seq=363 Ack=11975 Win=64075 Len=0
322336 110.282086 77.197.128.165 -> 41.177.26.176 TCP 64 37133 > http [ACK] Seq=363 Ack=13463 Win=62587 Len=0
322407 110.310140 77.197.128.165 -> 41.177.26.176 TCP 64 37133 > http [ACK] Seq=363 Ack=16383 Win=59667 Len=0
322472 110.349781 77.197.128.165 -> 41.177.26.176 TCP 64 37133 > http [ACK] Seq=363 Ack=17843 Win=61679 Len=0
322473 110.349786 77.197.128.165 -> 41.177.26.176 TCP 64 [TCP Window Update] 37133 > http [ACK] Seq=363 Ack=17843 Win=65535 Len=0
322493 110.364796 77.197.128.165 -> 41.177.26.176 TCP 64 37133 > http [ACK] Seq=363 Ack=20763 Win=65535 Len=0
322496 110.364990 77.197.128.165 -> 41.177.26.176 TCP 64 37133 > http [ACK] Seq=363 Ack=26603 Win=64967 Len=0
322497 110.364994 77.197.128.165 -> 41.177.26.176 TCP 64 [TCP Dup ACK 322496#1] 37133 > http [ACK] Seq=363 Ack=26603 Win=64967 Len=0
322574 110.392011 77.197.128.165 -> 41.177.26.176 TCP 64 37133 > http [ACK] Seq=363 Ack=30983 Win=65535 Len=0
322659 110.431615 77.197.128.165 -> 41.177.26.176 TCP 64 37133 > http [ACK] Seq=363 Ack=32791 Win=65535 Len=0
322686 110.446614 77.197.128.165 -> 41.177.26.176 TCP 64 37133 > http [ACK] Seq=363 Ack=34818 Win=65535 Len=0
322687 110.447470 77.197.128.165 -> 41.177.26.176 TCP 64 37133 > http [RST, ACK] Seq=363 Ack=34818 Win=0 Len=0
323051 110.639432 77.197.128.165 -> 41.177.26.176 TCP 66 37354 > http [SYN] Seq=0 Win=65535 Len=0 MSS=1460 SACK_PERM=1
323185 110.721193 77.197.128.165 -> 41.177.26.176 TCP 64 37354 > http [ACK] Seq=1 Ack=1 Win=65535 Len=0
323956 111.134922 77.197.128.165 -> 41.177.26.176 TCP 64 37354 > http [ACK] Seq=309 Ack=2921 Win=65535 Len=0
324073 111.216616 77.197.128.165 -> 41.177.26.176 TCP 64 37354 > http [ACK] Seq=309 Ack=5800 Win=65535 Len=0
324076 111.217064 77.197.128.165 -> 41.177.26.176 TCP 64 37354 > http [ACK] Seq=309 Ack=8720 Win=65535 Len=0
324263 111.298264 77.197.128.165 -> 41.177.26.176 TCP 64 37354 > http [ACK] Seq=309 Ack=10559 Win=63696 Len=0
324264 111.298269 77.197.128.165 -> 41.177.26.176 TCP 64 [TCP Dup ACK 324263#1] 37354 > http [ACK] Seq=309 Ack=10559 Win=63696 Len=0
324317 111.339723 77.197.128.165 -> 41.177.26.176 TCP 64 [TCP Window Update] 37354 > http [ACK] Seq=309 Ack=10559 Win=65535 Len=0
324318 111.340168 77.197.128.165 -> 41.177.26.176 TCP 64 37354 > http [RST, ACK] Seq=309 Ack=10559 Win=0 Len=0
324578 111.451892 77.197.128.165 -> 41.177.26.176 TCP 66 37489 > http [SYN] Seq=0 Win=65535 Len=0 MSS=1460 SACK_PERM=1
324723 111.533615 77.197.128.165 -> 41.177.26.176 TCP 64 37489 > http [ACK] Seq=1 Ack=1 Win=65535 Len=0
325360 112.048354 77.197.128.165 -> 41.177.26.176 TCP 64 37489 > http [ACK] Seq=355 Ack=2431 Win=65535 Len=0
325361 112.048358 77.197.128.165 -> 41.177.26.176 TCP 64 37489 > http [ACK] Seq=355 Ack=4058 Win=65535 Len=0
325517 112.130126 77.197.128.165 -> 41.177.26.176 TCP 64 37489 > http [ACK] Seq=355 Ack=6232 Win=65535 Len=0
325518 112.130131 77.197.128.165 -> 41.177.26.176 TCP 64 37489 > http [ACK] Seq=355 Ack=7692 Win=65535 Len=0
325519 112.130289 77.197.128.165 -> 41.177.26.176 TCP 64 37489 > http [ACK] Seq=355 Ack=10000 Win=65535 Len=0
325646 112.211888 77.197.128.165 -> 41.177.26.176 TCP 64 37489 > http [ACK] Seq=355 Ack=11396 Win=64139 Len=0
325728 112.258494 77.197.128.165 -> 41.177.26.176 TCP 64 37489 > http [RST, ACK] Seq=355 Ack=11396 Win=0 Len=0
325921 112.402374 77.197.128.165 -> 41.177.26.176 TCP 66 37638 > http [SYN] Seq=0 Win=65535 Len=0 MSS=1460 SACK_PERM=1
326044 112.484211 77.197.128.165 -> 41.177.26.176 TCP 64 37638 > http [ACK] Seq=1 Ack=1 Win=65535 Len=0
327040 112.934519 77.197.128.165 -> 41.177.26.176 TCP 64 37638 > http [ACK] Seq=318 Ack=2643 Win=65535 Len=0
327041 112.934695 77.197.128.165 -> 41.177.26.176 TCP 64 37638 > http [ACK] Seq=318 Ack=3916 Win=64262 Len=0
327186 113.016549 77.197.128.165 -> 41.177.26.176 TCP 64 37638 > http [ACK] Seq=318 Ack=6090 Win=65535 Len=0
327188 113.016690 77.197.128.165 -> 41.177.26.176 TCP 64 37638 > http [ACK] Seq=318 Ack=10470 Win=65535 Len=0
327308 113.125355 77.197.128.165 -> 41.177.26.176 TCP 64 37638 > http [RST, ACK] Seq=318 Ack=11346 Win=0 Len=0
327495 113.220813 77.197.128.165 -> 41.177.26.176 TCP 66 37756 > http [SYN] Seq=0 Win=65535 Len=0 MSS=1460 SACK_PERM=1
327688 113.302493 77.197.128.165 -> 41.177.26.176 TCP 64 37756 > http [ACK] Seq=1 Ack=1 Win=65535 Len=0
329643 114.813668 77.197.128.165 -> 41.177.26.176 TCP 64 37756 > http [ACK] Seq=313 Ack=1499 Win=65535 Len=0
329655 114.823675 77.197.128.165 -> 41.177.26.176 TCP 64 37756 > http [ACK] Seq=313 Ack=2481 Win=64553 Len=0
329656 114.823774 77.197.128.165 -> 41.177.26.176 TCP 64 37756 > http [ACK] Seq=313 Ack=2794 Win=64240 Len=0
329660 114.824106 77.197.128.165 -> 41.177.26.176 TCP 64 37756 > http [ACK] Seq=313 Ack=3730 Win=65535 Len=0
329965 114.895454 77.197.128.165 -> 41.177.26.176 TCP 64 37756 > http [ACK] Seq=313 Ack=6251 Win=65535 Len=0
330000 114.905439 77.197.128.165 -> 41.177.26.176 TCP 64 37756 > http [ACK] Seq=313 Ack=9171 Win=65535 Len=0
330001 114.905633 77.197.128.165 -> 41.177.26.176 TCP 64 37756 > http [RST, ACK] Seq=313 Ack=10299 Win=0 Len=0
330021 114.910328 77.197.128.165 -> 41.177.26.176 TCP 66 38293 > http [SYN] Seq=0 Win=65535 Len=0 MSS=1460 SACK_PERM=1
330174 114.992057 77.197.128.165 -> 41.177.26.176 TCP 64 38293 > http [ACK] Seq=1 Ack=1 Win=65535 Len=0
331175 115.393622 77.197.128.165 -> 41.177.26.176 TCP 64 38293 > http [ACK] Seq=318 Ack=2916 Win=65535 Len=0
331308 115.475286 77.197.128.165 -> 41.177.26.176 TCP 64 38293 > http [ACK] Seq=318 Ack=5363 Win=65535 Len=0
331309 115.475463 77.197.128.165 -> 41.177.26.176 TCP 64 38293 > http [ACK] Seq=318 Ack=7537 Win=65535 Len=0
331492 115.557256 77.197.128.165 -> 41.177.26.176 TCP 64 38293 > http [ACK] Seq=318 Ack=11888 Win=65535 Len=0
331493 115.557578 77.197.128.165 -> 41.177.26.176 TCP 64 38293 > http [RST, ACK] Seq=318 Ack=11888 Win=0 Len=0
331505 115.563533 77.197.128.165 -> 41.177.26.176 TCP 66 38523 > http [SYN] Seq=0 Win=65535 Len=0 MSS=1460 SACK_PERM=1
331683 115.645329 77.197.128.165 -> 41.177.26.176 TCP 64 38523 > http [ACK] Seq=1 Ack=1 Win=65535 Len=0
332544 116.007224 77.197.128.165 -> 41.177.26.176 TCP 64 38523 > http [ACK] Seq=316 Ack=2431 Win=65535 Len=0
332545 116.007229 77.197.128.165 -> 41.177.26.176 TCP 64 38523 > http [ACK] Seq=316 Ack=3893 Win=65535 Len=0
332704 116.089143 77.197.128.165 -> 41.177.26.176 TCP 64 38523 > http [ACK] Seq=316 Ack=6057 Win=65535 Len=0
332706 116.089274 77.197.128.165 -> 41.177.26.176 TCP 64 38523 > http [ACK] Seq=316 Ack=10507 Win=65535 Len=0
332787 116.171104 77.197.128.165 -> 41.177.26.176 TCP 64 38523 > http [ACK] Seq=316 Ack=12149 Win=65471 Len=0
332788 116.171108 77.197.128.165 -> 41.177.26.176 TCP 64 [TCP Dup ACK 332787#1] 38523 > http [ACK] Seq=316 Ack=12149 Win=65471 Len=0
332789 116.171387 77.197.128.165 -> 41.177.26.176 TCP 64 38523 > http [RST, ACK] Seq=316 Ack=12149 Win=0 Len=0
332791 116.173226 77.197.128.165 -> 41.177.26.176 TCP 66 38654 > http [SYN] Seq=0 Win=65535 Len=0 MSS=1460 SACK_PERM=1
332918 116.255195 77.197.128.165 -> 41.177.26.176 TCP 64 38654 > http [ACK] Seq=1 Ack=1 Win=65535 Len=0
333002 116.338039 77.197.128.165 -> 41.177.26.176 TCP 64 38654 > http [RST, ACK] Seq=266 Ack=730 Win=0 Len=0
333114 116.375329 77.197.128.165 -> 41.177.26.176 TCP 66 38681 > http [SYN] Seq=0 Win=65535 Len=0 MSS=1460 SACK_PERM=1
333163 116.457110 77.197.128.165 -> 41.177.26.176 TCP 64 38681 > http [ACK] Seq=1 Ack=1 Win=65535 Len=0
334210 116.851235 77.197.128.165 -> 41.177.26.176 TCP 64 38681 > http [ACK] Seq=354 Ack=2431 Win=65535 Len=0
334437 116.932937 77.197.128.165 -> 41.177.26.176 TCP 64 38681 > http [ACK] Seq=354 Ack=5351 Win=65535 Len=0
334439 116.933123 77.197.128.165 -> 41.177.26.176 TCP 64 38681 > http [ACK] Seq=354 Ack=7674 Win=65535 Len=0
334674 117.014685 77.197.128.165 -> 41.177.26.176 TCP 64 38681 > http [ACK] Seq=354 Ack=9406 Win=65535 Len=0
334676 117.014800 77.197.128.165 -> 41.177.26.176 TCP 64 38681 > http [ACK] Seq=354 Ack=11218 Win=63723 Len=0
334677 117.014805 77.197.128.165 -> 41.177.26.176 TCP 64 [TCP Window Update] 38681 > http [ACK] Seq=354 Ack=11218 Win=65535 Len=0
334678 117.015071 77.197.128.165 -> 41.177.26.176 TCP 64 38681 > http [RST, ACK] Seq=354 Ack=11218 Win=0 Len=0
341760 117.825879 77.197.128.165 -> 41.177.26.176 TCP 66 38787 > http [SYN] Seq=0 Win=65535 Len=0 MSS=1460 SACK_PERM=1
344233 117.907660 77.197.128.165 -> 41.177.26.176 TCP 64 38787 > http [ACK] Seq=1 Ack=1 Win=65535 Len=0
349857 118.277333 77.197.128.165 -> 41.177.26.176 TCP 64 38787 > http [ACK] Seq=309 Ack=3908 Win=64229 Len=0
350172 118.359069 77.197.128.165 -> 41.177.26.176 TCP 64 38787 > http [ACK] Seq=309 Ack=6082 Win=65535 Len=0
350173 118.359193 77.197.128.165 -> 41.177.26.176 TCP 64 38787 > http [ACK] Seq=309 Ack=8317 Win=65535 Len=0
350471 118.440892 77.197.128.165 -> 41.177.26.176 TCP 64 38787 > http [ACK] Seq=309 Ack=11197 Win=65535 Len=0
350472 118.441080 77.197.128.165 -> 41.177.26.176 TCP 64 38787 > http [RST, ACK] Seq=309 Ack=11197 Win=0 Len=0
350475 118.445123 77.197.128.165 -> 41.177.26.176 TCP 66 38850 > http [SYN] Seq=0 Win=65535 Len=0 MSS=1460 SACK_PERM=1
350771 118.526781 77.197.128.165 -> 41.177.26.176 TCP 64 38850 > http [ACK] Seq=1 Ack=1 Win=65535 Len=0
351818 119.039754 77.197.128.165 -> 41.177.26.176 TCP 64 38850 > http [ACK] Seq=355 Ack=2431 Win=65535 Len=0
351819 119.039758 77.197.128.165 -> 41.177.26.176 TCP 64 38850 > http [ACK] Seq=355 Ack=4058 Win=65535 Len=0
351947 119.121815 77.197.128.165 -> 41.177.26.176 TCP 64 38850 > http [ACK] Seq=355 Ack=6232 Win=65535 Len=0
351948 119.121954 77.197.128.165 -> 41.177.26.176 TCP 64 38850 > http [ACK] Seq=355 Ack=10537 Win=65535 Len=0
352024 119.203554 77.197.128.165 -> 41.177.26.176 TCP 64 38850 > http [ACK] Seq=355 Ack=13820 Win=63965 Len=0
352025 119.203559 77.197.128.165 -> 41.177.26.176 TCP 64 [TCP Window Update] 38850 > http [ACK] Seq=355 Ack=13820 Win=65535 Len=0
352026 119.203773 77.197.128.165 -> 41.177.26.176 TCP 64 38850 > http [RST, ACK] Seq=355 Ack=13820 Win=0 Len=0
352032 119.207983 77.197.128.165 -> 41.177.26.176 TCP 66 38943 > http [SYN] Seq=0 Win=65535 Len=0 MSS=1460 SACK_PERM=1
352133 119.289717 77.197.128.165 -> 41.177.26.176 TCP 64 38943 > http [ACK] Seq=1 Ack=1 Win=65535 Len=0
352668 119.654616 77.197.128.165 -> 41.177.26.176 TCP 64 38943 > http [ACK] Seq=309 Ack=3911 Win=65535 Len=0
352786 119.736306 77.197.128.165 -> 41.177.26.176 TCP 64 38943 > http [ACK] Seq=309 Ack=6081 Win=65535 Len=0
352787 119.736392 77.197.128.165 -> 41.177.26.176 TCP 64 38943 > http [ACK] Seq=309 Ack=7913 Win=65535 Len=0
352962 119.818159 77.197.128.165 -> 41.177.26.176 TCP 64 38943 > http [ACK] Seq=309 Ack=10833 Win=65535 Len=0
352963 119.818783 77.197.128.165 -> 41.177.26.176 TCP 64 38943 > http [RST, ACK] Seq=309 Ack=11185 Win=0 Len=0
352996 119.828388 77.197.128.165 -> 41.177.26.176 TCP 66 39049 > http [SYN] Seq=0 Win=65535 Len=0 MSS=1460 SACK_PERM=1
353105 119.910141 77.197.128.165 -> 41.177.26.176 TCP 64 39049 > http [ACK] Seq=1 Ack=1 Win=65535 Len=0
353659 120.321192 77.197.128.165 -> 41.177.26.176 TCP 64 39049 > http [ACK] Seq=355 Ack=2431 Win=65535 Len=0
353871 120.402997 77.197.128.165 -> 41.177.26.176 TCP 64 39049 > http [ACK] Seq=355 Ack=6225 Win=65535 Len=0
354051 120.484879 77.197.128.165 -> 41.177.26.176 TCP 64 39049 > http [ACK] Seq=355 Ack=8054 Win=65535 Len=0
354052 120.485075 77.197.128.165 -> 41.177.26.176 TCP 64 39049 > http [ACK] Seq=355 Ack=10655 Win=65535 Len=0
354053 120.485350 77.197.128.165 -> 41.177.26.176 TCP 64 39049 > http [RST, ACK] Seq=355 Ack=11337 Win=0 Len=0
354148 120.507635 77.197.128.165 -> 41.177.26.176 TCP 66 39185 > http [SYN] Seq=0 Win=65535 Len=0 MSS=1460 SACK_PERM=1
354311 120.589260 77.197.128.165 -> 41.177.26.176 TCP 64 39185 > http [ACK] Seq=1 Ack=1 Win=65535 Len=0
355030 121.008564 77.197.128.165 -> 41.177.26.176 TCP 64 39185 > http [ACK] Seq=354 Ack=2431 Win=65535 Len=0
355031 121.008894 77.197.128.165 -> 41.177.26.176 TCP 64 39185 > http [ACK] Seq=354 Ack=4051 Win=65535 Len=0
355214 121.090623 77.197.128.165 -> 41.177.26.176 TCP 64 39185 > http [ACK] Seq=354 Ack=6221 Win=65535 Len=0
355215 121.090628 77.197.128.165 -> 41.177.26.176 TCP 64 39185 > http [ACK] Seq=354 Ack=8243 Win=65535 Len=0
355216 121.090888 77.197.128.165 -> 41.177.26.176 TCP 64 39185 > http [ACK] Seq=354 Ack=11326 Win=65535 Len=0
355217 121.091093 77.197.128.165 -> 41.177.26.176 TCP 64 39185 > http [RST, ACK] Seq=354 Ack=11326 Win=0 Len=0
355258 121.106636 77.197.128.165 -> 41.177.26.176 TCP 66 39368 > http [SYN] Seq=0 Win=65535 Len=0 MSS=1460 SACK_PERM=1
355382 121.188496 77.197.128.165 -> 41.177.26.176 TCP 64 39368 > http [ACK] Seq=1 Ack=1 Win=65535 Len=0
356462 121.654156 77.197.128.165 -> 41.177.26.176 TCP 64 39368 > http [ACK] Seq=318 Ack=2431 Win=65535 Len=0
356465 121.654432 77.197.128.165 -> 41.177.26.176 TCP 64 39368 > http [ACK] Seq=318 Ack=3896 Win=65535 Len=0
356648 121.736042 77.197.128.165 -> 41.177.26.176 TCP 64 39368 > http [ACK] Seq=318 Ack=7530 Win=65535 Len=0
356652 121.736340 77.197.128.165 -> 41.177.26.176 TCP 64 39368 > http [ACK] Seq=318 Ack=10025 Win=65535 Len=0
357025 121.818312 77.197.128.165 -> 41.177.26.176 TCP 64 39368 > http [ACK] Seq=318 Ack=11848 Win=65535 Len=0
357027 121.818480 77.197.128.165 -> 41.177.26.176 TCP 64 39368 > http [RST, ACK] Seq=318 Ack=11848 Win=0 Len=0
357166 121.876024 77.197.128.165 -> 41.177.26.176 TCP 66 39515 > http [SYN] Seq=0 Win=65535 Len=0 MSS=1460 SACK_PERM=1
357361 121.957783 77.197.128.165 -> 41.177.26.176 TCP 64 39515 > http [ACK] Seq=1 Ack=1 Win=65535 Len=0
358460 122.385372 77.197.128.165 -> 41.177.26.176 TCP 64 39515 > http [ACK] Seq=309 Ack=2431 Win=65535 Len=0
358461 122.385458 77.197.128.165 -> 41.177.26.176 TCP 64 39515 > http [ACK] Seq=309 Ack=3908 Win=65535 Len=0
358631 122.467090 77.197.128.165 -> 41.177.26.176 TCP 64 39515 > http [ACK] Seq=309 Ack=6082 Win=65535 Len=0
358632 122.467216 77.197.128.165 -> 41.177.26.176 TCP 64 39515 > http [ACK] Seq=309 Ack=8170 Win=65535 Len=0
358634 122.467493 77.197.128.165 -> 41.177.26.176 TCP 64 39515 > http [ACK] Seq=309 Ack=10538 Win=65535 Len=0
358895 122.548993 77.197.128.165 -> 41.177.26.176 TCP 64 39515 > http [RST, ACK] Seq=309 Ack=11220 Win=0 Len=0
359242 122.629075 77.197.128.165 -> 41.177.26.176 TCP 66 39635 > http [SYN] Seq=0 Win=65535 Len=0 MSS=1460 SACK_PERM=1
359514 122.710836 77.197.128.165 -> 41.177.26.176 TCP 64 39635 > http [ACK] Seq=1 Ack=1 Win=65535 Len=0
360611 123.113809 77.197.128.165 -> 41.177.26.176 TCP 64 39635 > http [ACK] Seq=309 Ack=3908 Win=65535 Len=0
360915 123.195580 77.197.128.165 -> 41.177.26.176 TCP 64 39635 > http [ACK] Seq=309 Ack=6082 Win=65535 Len=0
360917 123.195641 77.197.128.165 -> 41.177.26.176 TCP 64 39635 > http [ACK] Seq=309 Ack=8505 Win=65535 Len=0
361161 123.277394 77.197.128.165 -> 41.177.26.176 TCP 64 39635 > http [ACK] Seq=309 Ack=11354 Win=65535 Len=0
361162 123.277771 77.197.128.165 -> 41.177.26.176 TCP 64 39635 > http [RST, ACK] Seq=309 Ack=11354 Win=0 Len=0
408257 136.453204 77.197.128.165 -> 41.177.26.176 TCP 66 42006 > http [SYN] Seq=0 Win=65535 Len=0 MSS=1460 SACK_PERM=1
408577 136.535147 77.197.128.165 -> 41.177.26.176 TCP 64 42006 > http [ACK] Seq=1 Ack=1 Win=65535 Len=0
410078 136.912137 77.197.128.165 -> 41.177.26.176 TCP 64 42006 > http [ACK] Seq=308 Ack=2431 Win=65535 Len=0
410080 136.912322 77.197.128.165 -> 41.177.26.176 TCP 64 42006 > http [ACK] Seq=308 Ack=3905 Win=65535 Len=0
410607 136.994000 77.197.128.165 -> 41.177.26.176 TCP 64 42006 > http [ACK] Seq=308 Ack=6069 Win=65535 Len=0
410608 136.994004 77.197.128.165 -> 41.177.26.176 TCP 64 42006 > http [ACK] Seq=308 Ack=7529 Win=65535 Len=0
410609 136.994259 77.197.128.165 -> 41.177.26.176 TCP 64 42006 > http [ACK] Seq=308 Ack=10449 Win=65535 Len=0
411009 137.076022 77.197.128.165 -> 41.177.26.176 TCP 64 42006 > http [ACK] Seq=308 Ack=11409 Win=64575 Len=0
411010 137.076180 77.197.128.165 -> 41.177.26.176 TCP 64 42006 > http [RST, ACK] Seq=308 Ack=11409 Win=0 Len=0
412165 137.312189 77.197.128.165 -> 41.177.26.176 TCP 66 42219 > http [SYN] Seq=0 Win=65535 Len=0 MSS=1460 SACK_PERM=1
412320 137.394017 77.197.128.165 -> 41.177.26.176 TCP 64 42219 > http [ACK] Seq=1 Ack=1 Win=65535 Len=0
412828 137.773981 77.197.128.165 -> 41.177.26.176 TCP 64 42219 > http [ACK] Seq=353 Ack=2429 Win=65535 Len=0
412832 137.774258 77.197.128.165 -> 41.177.26.176 TCP 64 42219 > http [ACK] Seq=353 Ack=4050 Win=65535 Len=0
412957 137.855669 77.197.128.165 -> 41.177.26.176 TCP 64 42219 > http [ACK] Seq=353 Ack=6214 Win=65535 Len=0
412958 137.855779 77.197.128.165 -> 41.177.26.176 TCP 64 42219 > http [ACK] Seq=353 Ack=7674 Win=65535 Len=0
412960 137.856007 77.197.128.165 -> 41.177.26.176 TCP 64 42219 > http [ACK] Seq=353 Ack=11042 Win=65535 Len=0
413135 137.937314 77.197.128.165 -> 41.177.26.176 TCP 64 42219 > http [ACK] Seq=353 Ack=11386 Win=65191 Len=0
413342 138.020006 77.197.128.165 -> 41.177.26.176 TCP 64 42219 > http [RST, ACK] Seq=353 Ack=11386 Win=0 Len=0
413976 138.294356 77.197.128.165 -> 41.177.26.176 TCP 66 42376 > http [SYN] Seq=0 Win=65535 Len=0 MSS=1460 SACK_PERM=1
414420 138.376216 77.197.128.165 -> 41.177.26.176 TCP 64 42376 > http [ACK] Seq=1 Ack=1 Win=65535 Len=0
416807 138.807128 77.197.128.165 -> 41.177.26.176 TCP 64 42376 > http [ACK] Seq=319 Ack=2431 Win=65535 Len=0
416808 138.807223 77.197.128.165 -> 41.177.26.176 TCP 64 42376 > http [ACK] Seq=319 Ack=3895 Win=65535 Len=0
417335 138.888981 77.197.128.165 -> 41.177.26.176 TCP 64 42376 > http [ACK] Seq=319 Ack=7535 Win=65535 Len=0
417336 138.889184 77.197.128.165 -> 41.177.26.176 TCP 64 42376 > http [ACK] Seq=319 Ack=10079 Win=65535 Len=0
417754 138.971473 77.197.128.165 -> 41.177.26.176 TCP 64 42376 > http [RST, ACK] Seq=319 Ack=11481 Win=0 Len=0
422355 139.311910 77.197.128.165 -> 41.177.26.176 TCP 66 42524 > http [SYN] Seq=0 Win=65535 Len=0 MSS=1460 SACK_PERM=1
423614 139.393537 77.197.128.165 -> 41.177.26.176 TCP 64 42524 > http [ACK] Seq=1 Ack=1 Win=65535 Len=0
425848 139.753200 77.197.128.165 -> 41.177.26.176 TCP 64 42524 > http [ACK] Seq=314 Ack=2431 Win=65535 Len=0
426365 139.835244 77.197.128.165 -> 41.177.26.176 TCP 64 42524 > http [ACK] Seq=314 Ack=6043 Win=65395 Len=0
426366 139.835248 77.197.128.165 -> 41.177.26.176 TCP 64 [TCP Dup ACK 426365#1] 42524 > http [ACK] Seq=314 Ack=6043 Win=65395 Len=0
426750 139.916966 77.197.128.165 -> 41.177.26.176 TCP 64 42524 > http [ACK] Seq=314 Ack=8963 Win=65535 Len=0
426751 139.916971 77.197.128.165 -> 41.177.26.176 TCP 64 42524 > http [ACK] Seq=314 Ack=11097 Win=63401 Len=0
426752 139.916999 77.197.128.165 -> 41.177.26.176 TCP 64 [TCP Dup ACK 426751#1] 42524 > http [ACK] Seq=314 Ack=11097 Win=63401 Len=0
427275 140.007832 77.197.128.165 -> 41.177.26.176 TCP 64 [TCP Window Update] 42524 > http [ACK] Seq=314 Ack=11097 Win=65535 Len=0
427278 140.008066 77.197.128.165 -> 41.177.26.176 TCP 64 42524 > http [RST, ACK] Seq=314 Ack=11097 Win=0 Len=0
428926 140.345771 77.197.128.165 -> 41.177.26.176 TCP 66 42668 > http [SYN] Seq=0 Win=65535 Len=0 MSS=1460 SACK_PERM=1
429366 140.427652 77.197.128.165 -> 41.177.26.176 TCP 64 42668 > http [ACK] Seq=1 Ack=1 Win=65535 Len=0
431359 140.893802 77.197.128.165 -> 41.177.26.176 TCP 64 42668 > http [ACK] Seq=318 Ack=2431 Win=65535 Len=0
431360 140.894088 77.197.128.165 -> 41.177.26.176 TCP 64 42668 > http [ACK] Seq=318 Ack=3896 Win=65535 Len=0
431710 140.975780 77.197.128.165 -> 41.177.26.176 TCP 64 42668 > http [ACK] Seq=318 Ack=6070 Win=65535 Len=0
431712 140.976143 77.197.128.165 -> 41.177.26.176 TCP 64 42668 > http [ACK] Seq=318 Ack=11166 Win=65535 Len=0
432159 141.077860 77.197.128.165 -> 41.177.26.176 TCP 64 42668 > http [RST, ACK] Seq=318 Ack=11166 Win=0 Len=0
433249 141.365495 77.197.128.165 -> 41.177.26.176 TCP 66 42784 > http [SYN] Seq=0 Win=65535 Len=0 MSS=1460 SACK_PERM=1
433557 141.447387 77.197.128.165 -> 41.177.26.176 TCP 64 42784 > http [ACK] Seq=1 Ack=1 Win=65535 Len=0
435064 141.912306 77.197.128.165 -> 41.177.26.176 TCP 64 42784 > http [ACK] Seq=301 Ack=2431 Win=65535 Len=0
435065 141.912311 77.197.128.165 -> 41.177.26.176 TCP 64 42784 > http [ACK] Seq=301 Ack=3914 Win=65535 Len=0
435331 141.994180 77.197.128.165 -> 41.177.26.176 TCP 64 42784 > http [ACK] Seq=301 Ack=6088 Win=65535 Len=0
435332 141.994257 77.197.128.165 -> 41.177.26.176 TCP 64 42784 > http [ACK] Seq=301 Ack=10468 Win=64627 Len=0
435333 141.994261 77.197.128.165 -> 41.177.26.176 TCP 64 [TCP Dup ACK 435332#1] 42784 > http [ACK] Seq=301 Ack=10468 Win=64627 Len=0
435906 142.137675 77.197.128.165 -> 41.177.26.176 TCP 64 42784 > http [ACK] Seq=301 Ack=11304 Win=65535 Len=0
435909 142.137900 77.197.128.165 -> 41.177.26.176 TCP 64 42784 > http [RST, ACK] Seq=301 Ack=11304 Win=0 Len=0
436776 142.373831 77.197.128.165 -> 41.177.26.176 TCP 66 42929 > http [SYN] Seq=0 Win=65535 Len=0 MSS=1460 SACK_PERM=1
436989 142.455772 77.197.128.165 -> 41.177.26.176 TCP 64 42929 > http [ACK] Seq=1 Ack=1 Win=65535 Len=0
437924 142.829600 77.197.128.165 -> 41.177.26.176 TCP 64 42929 > http [ACK] Seq=308 Ack=2431 Win=65535 Len=0
438159 142.911497 77.197.128.165 -> 41.177.26.176 TCP 64 42929 > http [ACK] Seq=308 Ack=6062 Win=65535 Len=0
438978 142.993286 77.197.128.165 -> 41.177.26.176 TCP 64 42929 > http [ACK] Seq=308 Ack=7777 Win=65535 Len=0
438980 142.993381 77.197.128.165 -> 41.177.26.176 TCP 64 42929 > http [ACK] Seq=308 Ack=11041 Win=65488 Len=0
438981 142.993384 77.197.128.165 -> 41.177.26.176 TCP 64 [TCP Dup ACK 438980#1] 42929 > http [ACK] Seq=308 Ack=11041 Win=65488 Len=0
439225 143.039726 77.197.128.165 -> 41.177.26.176 TCP 64 42929 > http [RST, ACK] Seq=308 Ack=11041 Win=0 Len=0
439997 143.346995 77.197.128.165 -> 41.177.26.176 TCP 66 43036 > http [SYN] Seq=0 Win=65535 Len=0 MSS=1460 SACK_PERM=1
440418 143.428671 77.197.128.165 -> 41.177.26.176 TCP 64 43036 > http [ACK] Seq=1 Ack=1 Win=65535 Len=0
443175 144.289802 77.197.128.165 -> 41.177.26.176 TCP 64 43036 > http [ACK] Seq=316 Ack=2118 Win=65535 Len=0
443180 144.290384 77.197.128.165 -> 41.177.26.176 TCP 64 43036 > http [ACK] Seq=316 Ack=2426 Win=65227 Len=0
443181 144.290388 77.197.128.165 -> 41.177.26.176 TCP 64 43036 > http [ACK] Seq=316 Ack=3608 Win=65535 Len=0
443595 144.371580 77.197.128.165 -> 41.177.26.176 TCP 64 43036 > http [ACK] Seq=316 Ack=6113 Win=65535 Len=0
443596 144.372203 77.197.128.165 -> 41.177.26.176 TCP 64 43036 > http [ACK] Seq=316 Ack=10190 Win=65535 Len=0
443839 144.468792 77.197.128.165 -> 41.177.26.176 TCP 64 43036 > http [RST, ACK] Seq=316 Ack=10190 Win=0 Len=0
445258 144.812176 77.197.128.165 -> 41.177.26.176 TCP 66 43242 > http [SYN] Seq=0 Win=65535 Len=0 MSS=1460 SACK_PERM=1
446361 144.893988 77.197.128.165 -> 41.177.26.176 TCP 64 43242 > http [ACK] Seq=1 Ack=1 Win=65535 Len=0
447302 145.305890 77.197.128.165 -> 41.177.26.176 TCP 64 43242 > http [ACK] Seq=307 Ack=2840 Win=65535 Len=0
447558 145.387864 77.197.128.165 -> 41.177.26.176 TCP 64 43242 > http [ACK] Seq=307 Ack=6069 Win=65535 Len=0
447733 145.469621 77.197.128.165 -> 41.177.26.176 TCP 64 43242 > http [ACK] Seq=307 Ack=8989 Win=65535 Len=0
447734 145.469626 77.197.128.165 -> 41.177.26.176 TCP 64 43242 > http [ACK] Seq=307 Ack=11127 Win=65535 Len=0
447735 145.469933 77.197.128.165 -> 41.177.26.176 TCP 64 43242 > http [RST, ACK] Seq=307 Ack=11127 Win=0 Len=0
448468 145.688842 77.197.128.165 -> 41.177.26.176 TCP 66 43495 > http [SYN] Seq=0 Win=65535 Len=0 MSS=1460 SACK_PERM=1
448673 145.770792 77.197.128.165 -> 41.177.26.176 TCP 64 43495 > http [ACK] Seq=1 Ack=1 Win=65535 Len=0
449646 146.138676 77.197.128.165 -> 41.177.26.176 TCP 64 43495 > http [ACK] Seq=308 Ack=2431 Win=65535 Len=0
449769 146.220457 77.197.128.165 -> 41.177.26.176 TCP 64 43495 > http [ACK] Seq=308 Ack=6062 Win=65376 Len=0
449770 146.220462 77.197.128.165 -> 41.177.26.176 TCP 64 [TCP Dup ACK 449769#1] 43495 > http [ACK] Seq=308 Ack=6062 Win=65376 Len=0
449914 146.302180 77.197.128.165 -> 41.177.26.176 TCP 64 43495 > http [ACK] Seq=308 Ack=11025 Win=64044 Len=0
449915 146.302321 77.197.128.165 -> 41.177.26.176 TCP 64 [TCP Window Update] 43495 > http [ACK] Seq=308 Ack=11025 Win=65535 Len=0
449916 146.302596 77.197.128.165 -> 41.177.26.176 TCP 64 43495 > http [RST, ACK] Seq=308 Ack=11025 Win=0 Len=0
450454 146.532268 77.197.128.165 -> 41.177.26.176 TCP 66 43670 > http [SYN] Seq=0 Win=65535 Len=0 MSS=1460 SACK_PERM=1
450617 146.613952 77.197.128.165 -> 41.177.26.176 TCP 64 43670 > http [ACK] Seq=1 Ack=1 Win=65535 Len=0
451382 146.998238 77.197.128.165 -> 41.177.26.176 TCP 64 43670 > http [ACK] Seq=300 Ack=3127 Win=65535 Len=0
451635 147.079935 77.197.128.165 -> 41.177.26.176 TCP 64 43670 > http [ACK] Seq=300 Ack=5372 Win=65535 Len=0
451636 147.080088 77.197.128.165 -> 41.177.26.176 TCP 64 43670 > http [ACK] Seq=300 Ack=7536 Win=65535 Len=0
451757 147.161869 77.197.128.165 -> 41.177.26.176 TCP 64 43670 > http [ACK] Seq=300 Ack=11897 Win=65535 Len=0
451759 147.162429 77.197.128.165 -> 41.177.26.176 TCP 64 43670 > http [RST, ACK] Seq=300 Ack=11897 Win=0 Len=0
452132 147.247543 77.197.128.165 -> 41.177.26.176 TCP 66 43848 > http [SYN] Seq=0 Win=65535 Len=0 MSS=1460 SACK_PERM=1
452320 147.329360 77.197.128.165 -> 41.177.26.176 TCP 64 43848 > http [ACK] Seq=1 Ack=1 Win=65535 Len=0
454211 148.198791 77.197.128.165 -> 41.177.26.176 TCP 64 43848 > http [ACK] Seq=339 Ack=2103 Win=65535 Len=0
454215 148.199172 77.197.128.165 -> 41.177.26.176 TCP 64 43848 > http [ACK] Seq=339 Ack=3059 Win=64579 Len=0
454359 148.280685 77.197.128.165 -> 41.177.26.176 TCP 64 43848 > http [ACK] Seq=339 Ack=5355 Win=65535 Len=0
454361 148.280865 77.197.128.165 -> 41.177.26.176 TCP 64 43848 > http [ACK] Seq=339 Ack=8185 Win=65535 Len=0
454557 148.362450 77.197.128.165 -> 41.177.26.176 TCP 64 43848 > http [ACK] Seq=339 Ack=10903 Win=65535 Len=0
454558 148.362804 77.197.128.165 -> 41.177.26.176 TCP 64 43848 > http [RST, ACK] Seq=339 Ack=10903 Win=0 Len=0
454803 148.446994 77.197.128.165 -> 41.177.26.176 TCP 66 44145 > http [SYN] Seq=0 Win=65535 Len=0 MSS=1460 SACK_PERM=1
455057 148.528777 77.197.128.165 -> 41.177.26.176 TCP 64 44145 > http [ACK] Seq=1 Ack=1 Win=65535 Len=0
456163 148.895956 77.197.128.165 -> 41.177.26.176 TCP 64 44145 > http [ACK] Seq=316 Ack=2602 Win=65535 Len=0
456367 148.978235 77.197.128.165 -> 41.177.26.176 TCP 64 44145 > http [ACK] Seq=316 Ack=6057 Win=65535 Len=0
456639 149.068449 77.197.128.165 -> 41.177.26.176 TCP 64 44145 > http [ACK] Seq=316 Ack=11154 Win=65535 Len=0
456659 149.074269 77.197.128.165 -> 41.177.26.176 TCP 64 44145 > http [RST, ACK] Seq=316 Ack=11154 Win=0 Len=0
457134 149.258988 77.197.128.165 -> 41.177.26.176 TCP 66 44383 > http [SYN] Seq=0 Win=65535 Len=0 MSS=1460 SACK_PERM=1
457322 149.340855 77.197.128.165 -> 41.177.26.176 TCP 64 44383 > http [ACK] Seq=1 Ack=1 Win=65535 Len=0
458317 149.774696 77.197.128.165 -> 41.177.26.176 TCP 64 44383 > http [ACK] Seq=356 Ack=2431 Win=65535 Len=0
458495 149.856626 77.197.128.165 -> 41.177.26.176 TCP 64 44383 > http [ACK] Seq=356 Ack=6230 Win=65535 Len=0
458662 149.938272 77.197.128.165 -> 41.177.26.176 TCP 64 44383 > http [ACK] Seq=356 Ack=8253 Win=65535 Len=0
458663 149.938418 77.197.128.165 -> 41.177.26.176 TCP 64 44383 > http [ACK] Seq=356 Ack=11347 Win=65535 Len=0
458666 149.938653 77.197.128.165 -> 41.177.26.176 TCP 64 44383 > http [RST, ACK] Seq=356 Ack=11347 Win=0 Len=0
459457 150.286111 77.197.128.165 -> 41.177.26.176 TCP 66 44584 > http [SYN] Seq=0 Win=65535 Len=0 MSS=1460 SACK_PERM=1
459669 150.367709 77.197.128.165 -> 41.177.26.176 TCP 64 44584 > http [ACK] Seq=1 Ack=1 Win=65535 Len=0
460631 150.727956 77.197.128.165 -> 41.177.26.176 TCP 64 44584 > http [ACK] Seq=353 Ack=2933 Win=65535 Len=0
460632 150.727993 77.197.128.165 -> 41.177.26.176 TCP 64 44584 > http [ACK] Seq=353 Ack=4058 Win=64410 Len=0
460862 150.809726 77.197.128.165 -> 41.177.26.176 TCP 64 44584 > http [ACK] Seq=353 Ack=5939 Win=65535 Len=0
460863 150.809730 77.197.128.165 -> 41.177.26.176 TCP 64 44584 > http [ACK] Seq=353 Ack=10202 Win=65535 Len=0
460865 150.810103 77.197.128.165 -> 41.177.26.176 TCP 64 44584 > http [RST, ACK] Seq=353 Ack=10884 Win=0 Len=0
461317 151.135427 77.197.128.165 -> 41.177.26.176 TCP 66 44675 > http [SYN] Seq=0 Win=65535 Len=0 MSS=1460 SACK_PERM=1
461474 151.217357 77.197.128.165 -> 41.177.26.176 TCP 64 44675 > http [ACK] Seq=1 Ack=1 Win=65535 Len=0
462559 151.720018 77.197.128.165 -> 41.177.26.176 TCP 64 44675 > http [ACK] Seq=288 Ack=2101 Win=65535 Len=0
462560 151.720022 77.197.128.165 -> 41.177.26.176 TCP 64 44675 > http [ACK] Seq=288 Ack=3993 Win=65535 Len=0
462563 151.728491 77.197.128.165 -> 41.177.26.176 TCP 64 44675 > http [RST, ACK] Seq=288 Ack=3998 Win=0 Len=0
462939 151.941148 77.197.128.165 -> 41.177.26.176 TCP 66 44788 > http [SYN] Seq=0 Win=65535 Len=0 MSS=1460 SACK_PERM=1
463043 152.023101 77.197.128.165 -> 41.177.26.176 TCP 64 44788 > http [ACK] Seq=1 Ack=1 Win=65535 Len=0
463954 152.464784 77.197.128.165 -> 41.177.26.176 TCP 64 44788 > http [ACK] Seq=310 Ack=2431 Win=65535 Len=0
463960 152.465198 77.197.128.165 -> 41.177.26.176 TCP 64 44788 > http [ACK] Seq=310 Ack=3907 Win=65535 Len=0
464230 152.546810 77.197.128.165 -> 41.177.26.176 TCP 64 44788 > http [ACK] Seq=310 Ack=6087 Win=65535 Len=0
464233 152.547052 77.197.128.165 -> 41.177.26.176 TCP 64 44788 > http [ACK] Seq=310 Ack=8688 Win=65535 Len=0
464608 152.628439 77.197.128.165 -> 41.177.26.176 TCP 64 44788 > http [ACK] Seq=310 Ack=11789 Win=65535 Len=0
464609 152.628770 77.197.128.165 -> 41.177.26.176 TCP 64 44788 > http [RST, ACK] Seq=310 Ack=11789 Win=0 Len=0
464870 152.758163 77.197.128.165 -> 41.177.26.176 TCP 66 44880 > http [SYN] Seq=0 Win=65535 Len=0 MSS=1460 SACK_PERM=1
464998 152.840139 77.197.128.165 -> 41.177.26.176 TCP 64 44880 > http [ACK] Seq=1 Ack=1 Win=65535 Len=0
468580 154.549894 77.197.128.165 -> 41.177.26.176 TCP 64 44880 > http [ACK] Seq=282 Ack=2182 Win=65535 Len=0
468583 154.550187 77.197.128.165 -> 41.177.26.176 TCP 64 44880 > http [ACK] Seq=282 Ack=2639 Win=65078 Len=0
468586 154.550624 77.197.128.165 -> 41.177.26.176 TCP 64 44880 > http [ACK] Seq=282 Ack=3680 Win=65535 Len=0
468775 154.631589 77.197.128.165 -> 41.177.26.176 TCP 64 44880 > http [ACK] Seq=282 Ack=6156 Win=65535 Len=0
468776 154.631975 77.197.128.165 -> 41.177.26.176 TCP 64 44880 > http [ACK] Seq=282 Ack=9076 Win=65535 Len=0
468777 154.632588 77.197.128.165 -> 41.177.26.176 TCP 64 44880 > http [RST, ACK] Seq=282 Ack=10078 Win=0 Len=0
517012 167.102144 77.197.128.165 -> 41.177.26.176 TCP 66 47338 > http [SYN] Seq=0 Win=65535 Len=0 MSS=1460 SACK_PERM=1
517213 167.184077 77.197.128.165 -> 41.177.26.176 TCP 64 47338 > http [ACK] Seq=1 Ack=1 Win=65535 Len=0
517974 167.561975 77.197.128.165 -> 41.177.26.176 TCP 64 47338 > http [ACK] Seq=308 Ack=2922 Win=65535 Len=0
518184 167.644070 77.197.128.165 -> 41.177.26.176 TCP 64 47338 > http [ACK] Seq=308 Ack=7529 Win=65535 Len=0
518564 167.725822 77.197.128.165 -> 41.177.26.176 TCP 64 47338 > http [ACK] Seq=308 Ack=10364 Win=65535 Len=0
518565 167.726117 77.197.128.165 -> 41.177.26.176 TCP 64 47338 > http [RST, ACK] Seq=308 Ack=11046 Win=0 Len=0
519119 167.831334 77.197.128.165 -> 41.177.26.176 TCP 66 47584 > http [SYN] Seq=0 Win=65535 Len=0 MSS=1460 SACK_PERM=1
519488 167.913071 77.197.128.165 -> 41.177.26.176 TCP 64 47584 > http [ACK] Seq=1 Ack=1 Win=65535 Len=0
524781 170.460565 77.197.128.165 -> 41.177.26.176 TCP 64 47584 > http [ACK] Seq=359 Ack=3855 Win=65535 Len=0
525319 170.542319 77.197.128.165 -> 41.177.26.176 TCP 64 47584 > http [ACK] Seq=359 Ack=6510 Win=65535 Len=0
525320 170.542482 77.197.128.165 -> 41.177.26.176 TCP 64 47584 > http [ACK] Seq=359 Ack=8714 Win=65535 Len=0
525447 170.624530 77.197.128.165 -> 41.177.26.176 TCP 64 47584 > http [ACK] Seq=359 Ack=11920 Win=65535 Len=0
525449 170.624771 77.197.128.165 -> 41.177.26.176 TCP 64 47584 > http [RST, ACK] Seq=359 Ack=11920 Win=0 Len=0
525629 170.720964 77.197.128.165 -> 41.177.26.176 TCP 66 48179 > http [SYN] Seq=0 Win=65535 Len=0 MSS=1460 SACK_PERM=1
525762 170.802817 77.197.128.165 -> 41.177.26.176 TCP 64 48179 > http [ACK] Seq=1 Ack=1 Win=65535 Len=0
526667 171.172517 77.197.128.165 -> 41.177.26.176 TCP 64 48179 > http [ACK] Seq=305 Ack=2431 Win=65535 Len=0
526668 171.172521 77.197.128.165 -> 41.177.26.176 TCP 64 48179 > http [ACK] Seq=305 Ack=3892 Win=65535 Len=0
526974 171.254519 77.197.128.165 -> 41.177.26.176 TCP 64 48179 > http [ACK] Seq=305 Ack=6062 Win=65535 Len=0
526976 171.254527 77.197.128.165 -> 41.177.26.176 TCP 64 48179 > http [ACK] Seq=305 Ack=8510 Win=65535 Len=0
527294 171.336235 77.197.128.165 -> 41.177.26.176 TCP 64 48179 > http [ACK] Seq=305 Ack=11593 Win=65535 Len=0
527296 171.336642 77.197.128.165 -> 41.177.26.176 TCP 64 48179 > http [RST, ACK] Seq=305 Ack=11593 Win=0 Len=0
527969 171.516648 77.197.128.165 -> 41.177.26.176 TCP 66 48327 > http [SYN] Seq=0 Win=65535 Len=0 MSS=1460 SACK_PERM=1
528255 171.598839 77.197.128.165 -> 41.177.26.176 TCP 64 48327 > http [ACK] Seq=1 Ack=1 Win=65535 Len=0
529316 171.976281 77.197.128.165 -> 41.177.26.176 TCP 64 48327 > http [ACK] Seq=309 Ack=2431 Win=65535 Len=0
529565 172.058164 77.197.128.165 -> 41.177.26.176 TCP 64 48327 > http [ACK] Seq=309 Ack=6067 Win=65535 Len=0
529919 172.139963 77.197.128.165 -> 41.177.26.176 TCP 64 48327 > http [ACK] Seq=309 Ack=7903 Win=65535 Len=0
529920 172.140108 77.197.128.165 -> 41.177.26.176 TCP 64 48327 > http [ACK] Seq=309 Ack=9363 Win=65535 Len=0
529921 172.140113 77.197.128.165 -> 41.177.26.176 TCP 64 48327 > http [ACK] Seq=309 Ack=11175 Win=65535 Len=0
529922 172.140323 77.197.128.165 -> 41.177.26.176 TCP 64 48327 > http [RST, ACK] Seq=309 Ack=11175 Win=0 Len=0
531142 172.319274 77.197.128.165 -> 41.177.26.176 TCP 66 48461 > http [SYN] Seq=0 Win=65535 Len=0 MSS=1460 SACK_PERM=1
531471 172.401094 77.197.128.165 -> 41.177.26.176 TCP 64 48461 > http [ACK] Seq=1 Ack=1 Win=65535 Len=0
532833 172.814437 77.197.128.165 -> 41.177.26.176 TCP 64 48461 > http [ACK] Seq=310 Ack=2431 Win=65535 Len=0
532834 172.814480 77.197.128.165 -> 41.177.26.176 TCP 64 48461 > http [ACK] Seq=310 Ack=3907 Win=65535 Len=0
533135 172.896407 77.197.128.165 -> 41.177.26.176 TCP 64 48461 > http [ACK] Seq=310 Ack=6081 Win=65535 Len=0
533136 172.896448 77.197.128.165 -> 41.177.26.176 TCP 64 48461 > http [ACK] Seq=310 Ack=9001 Win=65535 Len=0
533137 172.896453 77.197.128.165 -> 41.177.26.176 TCP 64 48461 > http [ACK] Seq=310 Ack=11165 Win=65535 Len=0
533138 172.896691 77.197.128.165 -> 41.177.26.176 TCP 64 48461 > http [RST, ACK] Seq=310 Ack=11165 Win=0 Len=0
533415 172.959422 77.197.128.165 -> 41.177.26.176 TCP 66 48557 > http [SYN] Seq=0 Win=65535 Len=0 MSS=1460 SACK_PERM=1
533736 173.041360 77.197.128.165 -> 41.177.26.176 TCP 64 48557 > http [ACK] Seq=1 Ack=1 Win=65535 Len=0
535580 173.406383 77.197.128.165 -> 41.177.26.176 TCP 64 48557 > http [ACK] Seq=308 Ack=2431 Win=65535 Len=0
535581 173.406556 77.197.128.165 -> 41.177.26.176 TCP 64 48557 > http [ACK] Seq=308 Ack=3905 Win=65535 Len=0
535899 173.488216 77.197.128.165 -> 41.177.26.176 TCP 64 48557 > http [ACK] Seq=308 Ack=6069 Win=65535 Len=0
535900 173.488244 77.197.128.165 -> 41.177.26.176 TCP 64 48557 > http [ACK] Seq=308 Ack=8211 Win=65535 Len=0
535901 173.488393 77.197.128.165 -> 41.177.26.176 TCP 64 48557 > http [ACK] Seq=308 Ack=11131 Win=65535 Len=0
536063 173.570168 77.197.128.165 -> 41.177.26.176 TCP 64 48557 > http [RST, ACK] Seq=308 Ack=11243 Win=0 Len=0
536758 173.757533 77.197.128.165 -> 41.177.26.176 TCP 66 48709 > http [SYN] Seq=0 Win=65535 Len=0 MSS=1460 SACK_PERM=1
536963 173.839365 77.197.128.165 -> 41.177.26.176 TCP 64 48709 > http [ACK] Seq=1 Ack=1 Win=65535 Len=0
537968 174.202021 77.197.128.165 -> 41.177.26.176 TCP 64 48709 > http [ACK] Seq=353 Ack=2243 Win=65535 Len=0
538054 174.240407 77.197.128.165 -> 41.177.26.176 TCP 64 48709 > http [ACK] Seq=353 Ack=3703 Win=65535 Len=0
538180 174.283985 77.197.128.165 -> 41.177.26.176 TCP 64 48709 > http [ACK] Seq=353 Ack=6208 Win=65535 Len=0
538227 174.322328 77.197.128.165 -> 41.177.26.176 TCP 64 48709 > http [ACK] Seq=353 Ack=10106 Win=65535 Len=0
538266 174.365894 77.197.128.165 -> 41.177.26.176 TCP 64 48709 > http [RST, ACK] Seq=353 Ack=11485 Win=0 Len=0
538693 174.563637 77.197.128.165 -> 41.177.26.176 TCP 66 48831 > http [SYN] Seq=0 Win=65535 Len=0 MSS=1460 SACK_PERM=1
538850 174.645252 77.197.128.165 -> 41.177.26.176 TCP 64 48831 > http [ACK] Seq=1 Ack=1 Win=65535 Len=0
539936 175.185177 77.197.128.165 -> 41.177.26.176 TCP 64 48831 > http [ACK] Seq=355 Ack=2431 Win=65535 Len=0
540059 175.266886 77.197.128.165 -> 41.177.26.176 TCP 64 48831 > http [ACK] Seq=355 Ack=5351 Win=65535 Len=0
540060 175.266991 77.197.128.165 -> 41.177.26.176 TCP 64 48831 > http [ACK] Seq=355 Ack=7685 Win=65535 Len=0
540258 175.348840 77.197.128.165 -> 41.177.26.176 TCP 64 48831 > http [ACK] Seq=355 Ack=11349 Win=65535 Len=0
540259 175.349126 77.197.128.165 -> 41.177.26.176 TCP 64 48831 > http [RST, ACK] Seq=355 Ack=11349 Win=0 Len=0
540407 175.421860 77.197.128.165 -> 41.177.26.176 TCP 66 48994 > http [SYN] Seq=0 Win=65535 Len=0 MSS=1460 SACK_PERM=1
540642 175.504063 77.197.128.165 -> 41.177.26.176 TCP 64 48994 > http [ACK] Seq=1 Ack=1 Win=65535 Len=0
542099 175.862412 77.197.128.165 -> 41.177.26.176 TCP 64 48994 > http [ACK] Seq=308 Ack=2431 Win=65535 Len=0
542490 175.944066 77.197.128.165 -> 41.177.26.176 TCP 64 48994 > http [ACK] Seq=308 Ack=6062 Win=65535 Len=0
543063 176.025748 77.197.128.165 -> 41.177.26.176 TCP 64 48994 > http [ACK] Seq=308 Ack=8323 Win=65535 Len=0
543064 176.025820 77.197.128.165 -> 41.177.26.176 TCP 64 48994 > http [ACK] Seq=308 Ack=11169 Win=65535 Len=0
543068 176.026257 77.197.128.165 -> 41.177.26.176 TCP 64 48994 > http [RST, ACK] Seq=308 Ack=11169 Win=0 Len=0
543683 176.181870 77.197.128.165 -> 41.177.26.176 TCP 66 db2idb2tpcc > http [SYN] Seq=0 Win=65535 Len=0 MSS=1460 SACK_PERM=1
543989 176.263738 77.197.128.165 -> 41.177.26.176 TCP 64 db2idb2tpcc > http [ACK] Seq=1 Ack=1 Win=65535 Len=0
545781 176.644156 77.197.128.165 -> 41.177.26.176 TCP 64 db2idb2tpcc > http [ACK] Seq=310 Ack=3907 Win=65535 Len=0
546475 176.725910 77.197.128.165 -> 41.177.26.176 TCP 64 db2idb2tpcc > http [ACK] Seq=310 Ack=6087 Win=65535 Len=0
546485 176.726100 77.197.128.165 -> 41.177.26.176 TCP 64 db2idb2tpcc > http [ACK] Seq=310 Ack=8500 Win=65535 Len=0
547251 176.807880 77.197.128.165 -> 41.177.26.176 TCP 64 db2idb2tpcc > http [ACK] Seq=310 Ack=11355 Win=65535 Len=0
547448 176.825822 77.197.128.165 -> 41.177.26.176 TCP 64 db2idb2tpcc > http [RST, ACK] Seq=310 Ack=11355 Win=0 Len=0
549306 176.996876 77.197.128.165 -> 41.177.26.176 TCP 66 49419 > http [SYN] Seq=0 Win=65535 Len=0 MSS=1460 SACK_PERM=1
549768 177.078512 77.197.128.165 -> 41.177.26.176 TCP 64 49419 > http [ACK] Seq=1 Ack=1 Win=65535 Len=0
551725 177.460533 77.197.128.165 -> 41.177.26.176 TCP 64 49419 > http [ACK] Seq=308 Ack=2431 Win=65535 Len=0
551983 177.542370 77.197.128.165 -> 41.177.26.176 TCP 64 49419 > http [ACK] Seq=308 Ack=6062 Win=65535 Len=0
552243 177.624081 77.197.128.165 -> 41.177.26.176 TCP 64 49419 > http [ACK] Seq=308 Ack=8982 Win=65535 Len=0
552244 177.624173 77.197.128.165 -> 41.177.26.176 TCP 64 49419 > http [ACK] Seq=308 Ack=11025 Win=65535 Len=0
552245 177.624336 77.197.128.165 -> 41.177.26.176 TCP 64 49419 > http [RST, ACK] Seq=308 Ack=11025 Win=0 Len=0
552650 177.811084 77.197.128.165 -> 41.177.26.176 TCP 66 49680 > http [SYN] Seq=0 Win=65535 Len=0 MSS=1460 SACK_PERM=1
552884 177.892917 77.197.128.165 -> 41.177.26.176 TCP 64 49680 > http [ACK] Seq=1 Ack=1 Win=65535 Len=0
554089 178.345602 77.197.128.165 -> 41.177.26.176 TCP 64 49680 > http [ACK] Seq=319 Ack=2431 Win=65535 Len=0
554090 178.345632 77.197.128.165 -> 41.177.26.176 TCP 64 49680 > http [ACK] Seq=319 Ack=3895 Win=65535 Len=0
554317 178.427418 77.197.128.165 -> 41.177.26.176 TCP 64 49680 > http [ACK] Seq=319 Ack=6075 Win=65535 Len=0
554318 178.427445 77.197.128.165 -> 41.177.26.176 TCP 64 49680 > http [ACK] Seq=319 Ack=8050 Win=65535 Len=0
554319 178.427608 77.197.128.165 -> 41.177.26.176 TCP 64 49680 > http [ACK] Seq=319 Ack=11107 Win=65535 Len=0
554320 178.427818 77.197.128.165 -> 41.177.26.176 TCP 64 49680 > http [RST, ACK] Seq=319 Ack=11107 Win=0 Len=0
554341 178.436311 77.197.128.165 -> 41.177.26.176 TCP 66 49793 > http [SYN] Seq=0 Win=65535 Len=0 MSS=1460 SACK_PERM=1
554546 178.518167 77.197.128.165 -> 41.177.26.176 TCP 64 49793 > http [ACK] Seq=1 Ack=1 Win=65535 Len=0
555763 178.943060 77.197.128.165 -> 41.177.26.176 TCP 64 49793 > http [ACK] Seq=309 Ack=3908 Win=65535 Len=0
555963 179.024904 77.197.128.165 -> 41.177.26.176 TCP 64 49793 > http [ACK] Seq=309 Ack=8211 Win=65535 Len=0
556280 179.106591 77.197.128.165 -> 41.177.26.176 TCP 64 49793 > http [ACK] Seq=309 Ack=11091 Win=65535 Len=0
556281 179.106918 77.197.128.165 -> 41.177.26.176 TCP 64 49793 > http [RST, ACK] Seq=309 Ack=11091 Win=0 Len=0
556703 179.271871 77.197.128.165 -> 41.177.26.176 TCP 66 49895 > http [SYN] Seq=0 Win=65535 Len=0 MSS=1460 SACK_PERM=1
556979 179.353574 77.197.128.165 -> 41.177.26.176 TCP 64 49895 > http [ACK] Seq=1 Ack=1 Win=65535 Len=0
559694 179.752615 77.197.128.165 -> 41.177.26.176 TCP 64 49895 > http [ACK] Seq=318 Ack=2431 Win=65535 Len=0
559933 179.834412 77.197.128.165 -> 41.177.26.176 TCP 64 49895 > http [ACK] Seq=318 Ack=6057 Win=65535 Len=0
560114 179.916256 77.197.128.165 -> 41.177.26.176 TCP 64 49895 > http [ACK] Seq=318 Ack=9742 Win=65535 Len=0
560115 179.916261 77.197.128.165 -> 41.177.26.176 TCP 64 49895 > http [ACK] Seq=318 Ack=12592 Win=65026 Len=0
560116 179.916276 77.197.128.165 -> 41.177.26.176 TCP 64 [TCP Dup ACK 560115#1] 49895 > http [ACK] Seq=318 Ack=12592 Win=65026 Len=0
560117 179.916434 77.197.128.165 -> 41.177.26.176 TCP 64 49895 > http [RST, ACK] Seq=318 Ack=12592 Win=0 Len=0
560548 180.029837 77.197.128.165 -> 41.177.26.176 TCP 66 49973 > http [SYN] Seq=0 Win=65535 Len=0 MSS=1460 SACK_PERM=1
560798 180.111547 77.197.128.165 -> 41.177.26.176 TCP 64 49973 > http [ACK] Seq=1 Ack=1 Win=65535 Len=0
563943 180.484740 77.197.128.165 -> 41.177.26.176 TCP 64 49973 > http [ACK] Seq=312 Ack=3107 Win=65535 Len=0
564252 180.566416 77.197.128.165 -> 41.177.26.176 TCP 64 49973 > http [ACK] Seq=312 Ack=5766 Win=65535 Len=0
564253 180.566556 77.197.128.165 -> 41.177.26.176 TCP 64 49973 > http [ACK] Seq=312 Ack=8237 Win=65535 Len=0
564564 180.648243 77.197.128.165 -> 41.177.26.176 TCP 64 49973 > http [ACK] Seq=312 Ack=11220 Win=65535 Len=0
564565 180.648480 77.197.128.165 -> 41.177.26.176 TCP 64 49973 > http [RST, ACK] Seq=312 Ack=11220 Win=0 Len=0
565246 180.842693 77.197.128.165 -> 41.177.26.176 TCP 66 50045 > http [SYN] Seq=0 Win=65535 Len=0 MSS=1460 SACK_PERM=1
565596 180.924443 77.197.128.165 -> 41.177.26.176 TCP 64 50045 > http [ACK] Seq=1 Ack=1 Win=65535 Len=0
567167 181.280902 77.197.128.165 -> 41.177.26.176 TCP 64 50045 > http [ACK] Seq=309 Ack=2431 Win=65535 Len=0
567479 181.362746 77.197.128.165 -> 41.177.26.176 TCP 64 50045 > http [ACK] Seq=309 Ack=6067 Win=65535 Len=0
567844 181.444540 77.197.128.165 -> 41.177.26.176 TCP 64 50045 > http [ACK] Seq=309 Ack=8322 Win=65535 Len=0
567846 181.444849 77.197.128.165 -> 41.177.26.176 TCP 64 50045 > http [ACK] Seq=309 Ack=11174 Win=65535 Len=0
567849 181.445038 77.197.128.165 -> 41.177.26.176 TCP 64 50045 > http [RST, ACK] Seq=309 Ack=11174 Win=0 Len=0
568583 181.662817 77.197.128.165 -> 41.177.26.176 TCP 66 50806 > http [SYN] Seq=0 Win=65535 Len=0 MSS=1460 SACK_PERM=1
568823 181.744450 77.197.128.165 -> 41.177.26.176 TCP 64 50806 > http [ACK] Seq=1 Ack=1 Win=65535 Len=0
569958 182.131999 77.197.128.165 -> 41.177.26.176 TCP 64 50806 > http [ACK] Seq=308 Ack=2431 Win=65535 Len=0
569959 182.132140 77.197.128.165 -> 41.177.26.176 TCP 64 50806 > http [ACK] Seq=308 Ack=3905 Win=65535 Len=0
570252 182.213895 77.197.128.165 -> 41.177.26.176 TCP 64 50806 > http [ACK] Seq=308 Ack=6069 Win=65535 Len=0
570253 182.214013 77.197.128.165 -> 41.177.26.176 TCP 64 50806 > http [ACK] Seq=308 Ack=10171 Win=65535 Len=0
570678 182.295888 77.197.128.165 -> 41.177.26.176 TCP 64 50806 > http [RST, ACK] Seq=308 Ack=11557 Win=0 Len=0
571794 182.501416 77.197.128.165 -> 41.177.26.176 TCP 66 51388 > http [SYN] Seq=0 Win=65535 Len=0 MSS=1460 SACK_PERM=1
572329 182.583137 77.197.128.165 -> 41.177.26.176 TCP 64 51388 > http [ACK] Seq=1 Ack=1 Win=65535 Len=0
576089 183.013995 77.197.128.165 -> 41.177.26.176 TCP 64 51388 > http [ACK] Seq=353 Ack=2767 Win=65535 Len=0
576369 183.095743 77.197.128.165 -> 41.177.26.176 TCP 64 51388 > http [ACK] Seq=353 Ack=6225 Win=65535 Len=0
576713 183.177561 77.197.128.165 -> 41.177.26.176 TCP 64 51388 > http [ACK] Seq=353 Ack=8574 Win=65535 Len=0
576717 183.179312 77.197.128.165 -> 41.177.26.176 TCP 64 51388 > http [ACK] Seq=353 Ack=11673 Win=65535 Len=0
576718 183.179629 77.197.128.165 -> 41.177.26.176 TCP 64 51388 > http [RST, ACK] Seq=353 Ack=11673 Win=0 Len=0
618878 196.789646 77.197.128.165 -> 41.177.26.176 TCP 66 53938 > http [SYN] Seq=0 Win=65535 Len=0 MSS=1460 SACK_PERM=1
619111 196.871542 77.197.128.165 -> 41.177.26.176 TCP 64 53938 > http [ACK] Seq=1 Ack=1 Win=65535 Len=0
620255 197.229766 77.197.128.165 -> 41.177.26.176 TCP 64 53938 > http [ACK] Seq=317 Ack=2429 Win=65535 Len=0
620416 197.312110 77.197.128.165 -> 41.177.26.176 TCP 64 53938 > http [ACK] Seq=317 Ack=6053 Win=65535 Len=0
620724 197.394491 77.197.128.165 -> 41.177.26.176 TCP 64 53938 > http [ACK] Seq=317 Ack=8140 Win=65535 Len=0
620725 197.394495 77.197.128.165 -> 41.177.26.176 TCP 64 53938 > http [ACK] Seq=317 Ack=11186 Win=64970 Len=0
620726 197.394500 77.197.128.165 -> 41.177.26.176 TCP 64 [TCP Dup ACK 620725#1] 53938 > http [ACK] Seq=317 Ack=11186 Win=64970 Len=0
620728 197.394892 77.197.128.165 -> 41.177.26.176 TCP 64 53938 > http [RST, ACK] Seq=317 Ack=11186 Win=0 Len=0
624835 198.383356 77.197.128.165 -> 41.177.26.176 TCP 66 54252 > http [SYN] Seq=0 Win=65535 Len=0 MSS=1460 SACK_PERM=1
625027 198.465392 77.197.128.165 -> 41.177.26.176 TCP 64 54252 > http [ACK] Seq=1 Ack=1 Win=65535 Len=0
626481 198.900805 77.197.128.165 -> 41.177.26.176 TCP 64 54252 > http [ACK] Seq=305 Ack=2431 Win=65535 Len=0
626483 198.900851 77.197.128.165 -> 41.177.26.176 TCP 64 54252 > http [ACK] Seq=305 Ack=3896 Win=65535 Len=0
626732 198.983617 77.197.128.165 -> 41.177.26.176 TCP 64 54252 > http [ACK] Seq=305 Ack=6070 Win=65535 Len=0
626734 198.983689 77.197.128.165 -> 41.177.26.176 TCP 64 54252 > http [ACK] Seq=305 Ack=9796 Win=65535 Len=0
626739 198.983972 77.197.128.165 -> 41.177.26.176 TCP 64 54252 > http [RST, ACK] Seq=305 Ack=11192 Win=0 Len=0
628120 199.360950 77.197.128.165 -> 41.177.26.176 TCP 66 54530 > http [SYN] Seq=0 Win=65535 Len=0 MSS=1460 SACK_PERM=1
628532 199.443403 77.197.128.165 -> 41.177.26.176 TCP 64 54530 > http [ACK] Seq=1 Ack=1 Win=65535 Len=0
636557 200.968979 77.197.128.165 -> 41.177.26.176 TCP 64 54530 > http [ACK] Seq=456 Ack=1841 Win=65535 Len=0
636639 200.979591 77.197.128.165 -> 41.177.26.176 TCP 64 54530 > http [ACK] Seq=456 Ack=3058 Win=64318 Len=0
636641 200.979828 77.197.128.165 -> 41.177.26.176 TCP 64 54530 > http [ACK] Seq=456 Ack=3793 Win=65535 Len=0
636939 201.050937 77.197.128.165 -> 41.177.26.176 TCP 64 54530 > http [ACK] Seq=456 Ack=6472 Win=65535 Len=0
636991 201.062263 77.197.128.165 -> 41.177.26.176 TCP 64 54530 > http [ACK] Seq=456 Ack=9269 Win=65535 Len=0
636992 201.062342 77.197.128.165 -> 41.177.26.176 TCP 64 54530 > http [ACK] Seq=456 Ack=11733 Win=65535 Len=0
636995 201.062622 77.197.128.165 -> 41.177.26.176 TCP 64 54530 > http [RST, ACK] Seq=456 Ack=11733 Win=0 Len=0
637515 201.216807 77.197.128.165 -> 41.177.26.176 TCP 66 55076 > http [SYN] Seq=0 Win=65535 Len=0 MSS=1460 SACK_PERM=1
637770 201.298504 77.197.128.165 -> 41.177.26.176 TCP 64 55076 > http [ACK] Seq=1 Ack=1 Win=65535 Len=0
639006 201.661987 77.197.128.165 -> 41.177.26.176 TCP 64 55076 > http [ACK] Seq=308 Ack=2431 Win=65535 Len=0
639236 201.743877 77.197.128.165 -> 41.177.26.176 TCP 64 55076 > http [ACK] Seq=308 Ack=6062 Win=65535 Len=0
639474 201.825884 77.197.128.165 -> 41.177.26.176 TCP 64 55076 > http [ACK] Seq=308 Ack=7879 Win=65535 Len=0
639475 201.825976 77.197.128.165 -> 41.177.26.176 TCP 64 55076 > http [ACK] Seq=308 Ack=11150 Win=65535 Len=0
639479 201.826188 77.197.128.165 -> 41.177.26.176 TCP 64 55076 > http [RST, ACK] Seq=308 Ack=11150 Win=0 Len=0
639693 201.907225 77.197.128.165 -> 41.177.26.176 TCP 66 55232 > http [SYN] Seq=0 Win=65535 Len=0 MSS=1460 SACK_PERM=1
639911 201.989823 77.197.128.165 -> 41.177.26.176 TCP 64 55232 > http [ACK] Seq=1 Ack=1 Win=65535 Len=0
641552 202.394167 77.197.128.165 -> 41.177.26.176 TCP 64 55232 > http [ACK] Seq=305 Ack=2602 Win=65535 Len=0
641895 202.475979 77.197.128.165 -> 41.177.26.176 TCP 64 55232 > http [ACK] Seq=305 Ack=6070 Win=65535 Len=0
642558 202.558265 77.197.128.165 -> 41.177.26.176 TCP 64 55232 > http [ACK] Seq=305 Ack=8058 Win=65535 Len=0
642564 202.558423 77.197.128.165 -> 41.177.26.176 TCP 64 55232 > http [ACK] Seq=305 Ack=11169 Win=65535 Len=0
642575 202.558720 77.197.128.165 -> 41.177.26.176 TCP 64 55232 > http [RST, ACK] Seq=305 Ack=11169 Win=0 Len=0
643968 202.674360 77.197.128.165 -> 41.177.26.176 TCP 66 55438 > http [SYN] Seq=0 Win=65535 Len=0 MSS=1460 SACK_PERM=1
644387 202.756281 77.197.128.165 -> 41.177.26.176 TCP 64 55438 > http [ACK] Seq=1 Ack=1 Win=65535 Len=0
646100 203.200510 77.197.128.165 -> 41.177.26.176 TCP 64 55438 > http [ACK] Seq=305 Ack=2431 Win=65535 Len=0
646303 203.282453 77.197.128.165 -> 41.177.26.176 TCP 64 55438 > http [ACK] Seq=305 Ack=6063 Win=65535 Len=0
646633 203.365539 77.197.128.165 -> 41.177.26.176 TCP 64 55438 > http [ACK] Seq=305 Ack=8187 Win=65535 Len=0
646634 203.365544 77.197.128.165 -> 41.177.26.176 TCP 64 55438 > http [ACK] Seq=305 Ack=10788 Win=65535 Len=0
646636 203.365861 77.197.128.165 -> 41.177.26.176 TCP 64 55438 > http [RST, ACK] Seq=305 Ack=11470 Win=0 Len=0
647506 203.543714 77.197.128.165 -> 41.177.26.176 TCP 66 55617 > http [SYN] Seq=0 Win=65535 Len=0 MSS=1460 SACK_PERM=1
647850 203.625606 77.197.128.165 -> 41.177.26.176 TCP 64 55617 > http [ACK] Seq=1 Ack=1 Win=65535 Len=0
653138 204.642382 77.197.128.165 -> 41.177.26.176 TCP 64 55617 > http [ACK] Seq=341 Ack=1847 Win=65535 Len=0
653232 204.652309 77.197.128.165 -> 41.177.26.176 TCP 64 55617 > http [ACK] Seq=341 Ack=2755 Win=64627 Len=0
653251 204.652808 77.197.128.165 -> 41.177.26.176 TCP 64 55617 > http [ACK] Seq=341 Ack=3487 Win=65535 Len=0
653657 204.724616 77.197.128.165 -> 41.177.26.176 TCP 64 55617 > http [ACK] Seq=341 Ack=6960 Win=65535 Len=0
653702 204.734223 77.197.128.165 -> 41.177.26.176 TCP 64 55617 > http [ACK] Seq=341 Ack=9880 Win=65535 Len=0
653708 204.734963 77.197.128.165 -> 41.177.26.176 TCP 64 55617 > http [RST, ACK] Seq=341 Ack=11139 Win=0 Len=0
654302 204.856157 77.197.128.165 -> 41.177.26.176 TCP 66 56010 > http [SYN] Seq=0 Win=65535 Len=0 MSS=1460 SACK_PERM=1
654678 204.938381 77.197.128.165 -> 41.177.26.176 TCP 64 56010 > http [ACK] Seq=1 Ack=1 Win=65535 Len=0
655710 205.388847 77.197.128.165 -> 41.177.26.176 TCP 64 56010 > http [ACK] Seq=309 Ack=2431 Win=65535 Len=0
655880 205.470811 77.197.128.165 -> 41.177.26.176 TCP 64 56010 > http [ACK] Seq=309 Ack=6075 Win=65535 Len=0
656206 205.552501 77.197.128.165 -> 41.177.26.176 TCP 64 56010 > http [ACK] Seq=309 Ack=8995 Win=65535 Len=0
656207 205.552506 77.197.128.165 -> 41.177.26.176 TCP 64 56010 > http [ACK] Seq=309 Ack=11077 Win=65535 Len=0
656214 205.560247 77.197.128.165 -> 41.177.26.176 TCP 64 56010 > http [RST, ACK] Seq=309 Ack=11077 Win=0 Len=0
656495 205.764395 77.197.128.165 -> 41.177.26.176 TCP 66 56265 > http [SYN] Seq=0 Win=65535 Len=0 MSS=1460 SACK_PERM=1
656773 205.846367 77.197.128.165 -> 41.177.26.176 TCP 64 56265 > http [ACK] Seq=1 Ack=1 Win=65535 Len=0
660755 206.322142 77.197.128.165 -> 41.177.26.176 TCP 64 56265 > http [ACK] Seq=303 Ack=2639 Win=65535 Len=0
660758 206.322256 77.197.128.165 -> 41.177.26.176 TCP 64 56265 > http [ACK] Seq=303 Ack=3924 Win=64250 Len=0
661825 206.404020 77.197.128.165 -> 41.177.26.176 TCP 64 56265 > http [ACK] Seq=303 Ack=7558 Win=65535 Len=0
661828 206.404269 77.197.128.165 -> 41.177.26.176 TCP 64 56265 > http [ACK] Seq=303 Ack=10085 Win=65535 Len=0
662546 206.485903 77.197.128.165 -> 41.177.26.176 TCP 64 56265 > http [ACK] Seq=303 Ack=11719 Win=65535 Len=0
662547 206.486165 77.197.128.165 -> 41.177.26.176 TCP 64 56265 > http [RST, ACK] Seq=303 Ack=11719 Win=0 Len=0
662744 206.557965 77.197.128.165 -> 41.177.26.176 TCP 66 56464 > http [SYN] Seq=0 Win=65535 Len=0 MSS=1460 SACK_PERM=1
662935 206.639760 77.197.128.165 -> 41.177.26.176 TCP 64 56464 > http [ACK] Seq=1 Ack=1 Win=65535 Len=0
665408 207.069267 77.197.128.165 -> 41.177.26.176 TCP 64 56464 > http [ACK] Seq=354 Ack=2431 Win=65535 Len=0
665498 207.151065 77.197.128.165 -> 41.177.26.176 TCP 64 56464 > http [ACK] Seq=354 Ack=6218 Win=65535 Len=0
665681 207.232863 77.197.128.165 -> 41.177.26.176 TCP 64 56464 > http [ACK] Seq=354 Ack=11592 Win=65535 Len=0
665682 207.233130 77.197.128.165 -> 41.177.26.176 TCP 64 56464 > http [RST, ACK] Seq=354 Ack=11592 Win=0 Len=0
666005 207.364157 77.197.128.165 -> 41.177.26.176 TCP 66 56700 > http [SYN] Seq=0 Win=65535 Len=0 MSS=1460 SACK_PERM=1
666288 207.446013 77.197.128.165 -> 41.177.26.176 TCP 64 56700 > http [ACK] Seq=1 Ack=1 Win=65535 Len=0
667302 207.931913 77.197.128.165 -> 41.177.26.176 TCP 64 56700 > http [ACK] Seq=355 Ack=2431 Win=65535 Len=0
667303 207.931918 77.197.128.165 -> 41.177.26.176 TCP 64 56700 > http [ACK] Seq=355 Ack=4058 Win=65535 Len=0
667540 208.014077 77.197.128.165 -> 41.177.26.176 TCP 64 56700 > http [ACK] Seq=355 Ack=6232 Win=65535 Len=0
667541 208.014081 77.197.128.165 -> 41.177.26.176 TCP 64 56700 > http [ACK] Seq=355 Ack=8531 Win=65535 Len=0
667769 208.096028 77.197.128.165 -> 41.177.26.176 TCP 64 56700 > http [ACK] Seq=355 Ack=11618 Win=65535 Len=0
667770 208.096189 77.197.128.165 -> 41.177.26.176 TCP 64 56700 > http [RST, ACK] Seq=355 Ack=11618 Win=0 Len=0
668506 208.388500 77.197.128.165 -> 41.177.26.176 TCP 66 56878 > http [SYN] Seq=0 Win=65535 Len=0 MSS=1460 SACK_PERM=1
668870 208.470325 77.197.128.165 -> 41.177.26.176 TCP 64 56878 > http [ACK] Seq=1 Ack=1 Win=65535 Len=0
677607 212.080437 77.197.128.165 -> 41.177.26.176 TCP 64 56878 > http [ACK] Seq=330 Ack=2337 Win=65535 Len=0
677610 212.080714 77.197.128.165 -> 41.177.26.176 TCP 64 56878 > http [ACK] Seq=330 Ack=4003 Win=65535 Len=0
677614 212.080875 77.197.128.165 -> 41.177.26.176 TCP 64 56878 > http [ACK] Seq=330 Ack=5695 Win=65535 Len=0
677743 212.162177 77.197.128.165 -> 41.177.26.176 TCP 64 56878 > http [ACK] Seq=330 Ack=8563 Win=65535 Len=0
677744 212.162333 77.197.128.165 -> 41.177.26.176 TCP 64 56878 > http [ACK] Seq=330 Ack=10275 Win=65283 Len=0
678217 212.283717 77.197.128.165 -> 41.177.26.176 TCP 64 56878 > http [RST, ACK] Seq=330 Ack=10275 Win=0 Len=0
679725 212.607195 77.197.128.165 -> 41.177.26.176 TCP 66 57440 > http [SYN] Seq=0 Win=65535 Len=0 MSS=1460 SACK_PERM=1
679979 212.688985 77.197.128.165 -> 41.177.26.176 TCP 64 57440 > http [ACK] Seq=1 Ack=1 Win=65535 Len=0
680679 213.107153 77.197.128.165 -> 41.177.26.176 TCP 64 57440 > http [ACK] Seq=319 Ack=2431 Win=65535 Len=0
680771 213.189112 77.197.128.165 -> 41.177.26.176 TCP 64 57440 > http [ACK] Seq=319 Ack=6068 Win=65535 Len=0
680876 213.270889 77.197.128.165 -> 41.177.26.176 TCP 64 57440 > http [ACK] Seq=319 Ack=8988 Win=65535 Len=0
680877 213.270894 77.197.128.165 -> 41.177.26.176 TCP 64 57440 > http [ACK] Seq=319 Ack=11328 Win=63195 Len=0
680878 213.270912 77.197.128.165 -> 41.177.26.176 TCP 64 [TCP Dup ACK 680877#1] 57440 > http [ACK] Seq=319 Ack=11328 Win=63195 Len=0
680974 213.353715 77.197.128.165 -> 41.177.26.176 TCP 64 [TCP Window Update] 57440 > http [ACK] Seq=319 Ack=11328 Win=65535 Len=0
680975 213.353849 77.197.128.165 -> 41.177.26.176 TCP 64 57440 > http [RST, ACK] Seq=319 Ack=11328 Win=0 Len=0
710141 226.317817 77.197.128.165 -> 41.177.26.176 TCP 66 59925 > http [SYN] Seq=0 Win=65535 Len=0 MSS=1460 SACK_PERM=1
710389 226.399618 77.197.128.165 -> 41.177.26.176 TCP 64 59925 > http [ACK] Seq=1 Ack=1 Win=65535 Len=0
711457 226.923937 77.197.128.165 -> 41.177.26.176 TCP 64 59925 > http [ACK] Seq=355 Ack=2431 Win=65535 Len=0
711616 227.006253 77.197.128.165 -> 41.177.26.176 TCP 64 59925 > http [ACK] Seq=355 Ack=6225 Win=65535 Len=0
711740 227.088007 77.197.128.165 -> 41.177.26.176 TCP 64 59925 > http [ACK] Seq=355 Ack=10605 Win=65535 Len=0
711741 227.088281 77.197.128.165 -> 41.177.26.176 TCP 64 59925 > http [RST, ACK] Seq=355 Ack=11321 Win=0 Len=0
720411 229.933222 77.197.128.165 -> 41.177.26.176 TCP 66 60566 > http [SYN] Seq=0 Win=65535 Len=0 MSS=1460 SACK_PERM=1
720655 230.015114 77.197.128.165 -> 41.177.26.176 TCP 64 60566 > http [ACK] Seq=1 Ack=1 Win=65535 Len=0
721795 230.479271 77.197.128.165 -> 41.177.26.176 TCP 64 60566 > http [ACK] Seq=318 Ack=2429 Win=65535 Len=0
721969 230.561045 77.197.128.165 -> 41.177.26.176 TCP 64 60566 > http [ACK] Seq=318 Ack=6061 Win=65535 Len=0
722100 230.642992 77.197.128.165 -> 41.177.26.176 TCP 64 60566 > http [ACK] Seq=318 Ack=8981 Win=65535 Len=0
722102 230.643128 77.197.128.165 -> 41.177.26.176 TCP 64 60566 > http [ACK] Seq=318 Ack=11682 Win=64474 Len=0
722103 230.643133 77.197.128.165 -> 41.177.26.176 TCP 64 [TCP Dup ACK 722102#1] 60566 > http [ACK] Seq=318 Ack=11682 Win=64474 Len=0
722104 230.643295 77.197.128.165 -> 41.177.26.176 TCP 64 60566 > http [RST, ACK] Seq=318 Ack=11682 Win=0 Len=0
724654 231.903516 77.197.128.165 -> 41.177.26.176 TCP 66 60905 > http [SYN] Seq=0 Win=65535 Len=0 MSS=1460 SACK_PERM=1
724805 231.985192 77.197.128.165 -> 41.177.26.176 TCP 64 60905 > http [ACK] Seq=1 Ack=1 Win=65535 Len=0
725757 232.413994 77.197.128.165 -> 41.177.26.176 TCP 64 60905 > http [ACK] Seq=355 Ack=2245 Win=65535 Len=0
725758 232.414164 77.197.128.165 -> 41.177.26.176 TCP 64 60905 > http [ACK] Seq=355 Ack=4058 Win=65535 Len=0
725973 232.495895 77.197.128.165 -> 41.177.26.176 TCP 64 60905 > http [ACK] Seq=355 Ack=6232 Win=65535 Len=0
725974 232.495900 77.197.128.165 -> 41.177.26.176 TCP 64 60905 > http [ACK] Seq=355 Ack=8498 Win=65535 Len=0
725975 232.496042 77.197.128.165 -> 41.177.26.176 TCP 64 60905 > http [ACK] Seq=355 Ack=11354 Win=65535 Len=0
725976 232.496325 77.197.128.165 -> 41.177.26.176 TCP 64 60905 > http [RST, ACK] Seq=355 Ack=11354 Win=0 Len=0
729090 234.085141 77.197.128.165 -> 41.177.26.176 TCP 66 61204 > http [SYN] Seq=0 Win=65535 Len=0 MSS=1460 SACK_PERM=1
729414 234.167010 77.197.128.165 -> 41.177.26.176 TCP 64 61204 > http [ACK] Seq=1 Ack=1 Win=65535 Len=0
738574 235.778833 77.197.128.165 -> 41.177.26.176 TCP 64 61204 > http [ACK] Seq=306 Ack=1671 Win=65535 Len=0
738600 235.790426 77.197.128.165 -> 41.177.26.176 TCP 64 61204 > http [ACK] Seq=306 Ack=2639 Win=64567 Len=0
738606 235.790555 77.197.128.165 -> 41.177.26.176 TCP 64 61204 > http [ACK] Seq=306 Ack=3055 Win=64151 Len=0
738611 235.790840 77.197.128.165 -> 41.177.26.176 TCP 64 61204 > http [ACK] Seq=306 Ack=4001 Win=65535 Len=0
739141 235.860600 77.197.128.165 -> 41.177.26.176 TCP 64 61204 > http [ACK] Seq=306 Ack=6617 Win=65535 Len=0
739341 235.872159 77.197.128.165 -> 41.177.26.176 TCP 64 61204 > http [ACK] Seq=306 Ack=8482 Win=63670 Len=0
739342 235.872164 77.197.128.165 -> 41.177.26.176 TCP 64 [TCP Window Update] 61204 > http [ACK] Seq=306 Ack=8482 Win=65535 Len=0
739343 235.872387 77.197.128.165 -> 41.177.26.176 TCP 64 61204 > http [ACK] Seq=306 Ack=11402 Win=64075 Len=0
739408 235.887481 77.197.128.165 -> 41.177.26.176 TCP 64 61204 > http [ACK] Seq=306 Ack=12358 Win=65535 Len=0
739409 235.887581 77.197.128.165 -> 41.177.26.176 TCP 64 61204 > http [RST, ACK] Seq=306 Ack=12358 Win=0 Len=0
740078 236.170459 77.197.128.165 -> 41.177.26.176 TCP 66 61758 > http [SYN] Seq=0 Win=65535 Len=0 MSS=1460 SACK_PERM=1
740147 236.252347 77.197.128.165 -> 41.177.26.176 TCP 64 61758 > http [ACK] Seq=1 Ack=1 Win=65535 Len=0
741116 236.735966 77.197.128.165 -> 41.177.26.176 TCP 64 61758 > http [ACK] Seq=355 Ack=2602 Win=65535 Len=0
741223 236.817808 77.197.128.165 -> 41.177.26.176 TCP 64 61758 > http [ACK] Seq=355 Ack=6226 Win=65535 Len=0
741389 236.899720 77.197.128.165 -> 41.177.26.176 TCP 64 61758 > http [ACK] Seq=355 Ack=11223 Win=64010 Len=0
741390 236.899725 77.197.128.165 -> 41.177.26.176 TCP 64 [TCP Dup ACK 741389#1] 61758 > http [ACK] Seq=355 Ack=11223 Win=64010 Len=0
741406 236.918986 77.197.128.165 -> 41.177.26.176 TCP 64 [TCP Window Update] 61758 > http [ACK] Seq=355 Ack=11223 Win=65535 Len=0
741407 236.919224 77.197.128.165 -> 41.177.26.176 TCP 64 61758 > http [RST, ACK] Seq=355 Ack=11223 Win=0 Len=0
741878 237.196635 77.197.128.165 -> 41.177.26.176 TCP 66 61987 > http [SYN] Seq=0 Win=65535 Len=0 MSS=1460 SACK_PERM=1
742012 237.278366 77.197.128.165 -> 41.177.26.176 TCP 64 61987 > http [ACK] Seq=1 Ack=1 Win=65535 Len=0
743741 237.869658 77.197.128.165 -> 41.177.26.176 TCP 64 61987 > http [ACK] Seq=318 Ack=2427 Win=65535 Len=0
743743 237.869774 77.197.128.165 -> 41.177.26.176 TCP 64 61987 > http [ACK] Seq=318 Ack=3892 Win=65535 Len=0
744157 237.951555 77.197.128.165 -> 41.177.26.176 TCP 64 61987 > http [ACK] Seq=318 Ack=8275 Win=65535 Len=0
744158 237.951560 77.197.128.165 -> 41.177.26.176 TCP 64 61987 > http [ACK] Seq=318 Ack=11131 Win=64139 Len=0
744581 238.052065 77.197.128.165 -> 41.177.26.176 TCP 64 61987 > http [RST, ACK] Seq=318 Ack=11131 Win=0 Len=0
745707 238.383349 77.197.128.165 -> 41.177.26.176 TCP 66 62250 > http [SYN] Seq=0 Win=65535 Len=0 MSS=1460 SACK_PERM=1
745932 238.465171 77.197.128.165 -> 41.177.26.176 TCP 64 62250 > http [ACK] Seq=1 Ack=1 Win=65535 Len=0
746731 238.829731 77.197.128.165 -> 41.177.26.176 TCP 64 62250 > http [ACK] Seq=317 Ack=2431 Win=65535 Len=0
746732 238.829736 77.197.128.165 -> 41.177.26.176 TCP 64 62250 > http [ACK] Seq=317 Ack=3892 Win=65535 Len=0
746851 238.911542 77.197.128.165 -> 41.177.26.176 TCP 64 62250 > http [ACK] Seq=317 Ack=6062 Win=65535 Len=0
746852 238.911547 77.197.128.165 -> 41.177.26.176 TCP 64 62250 > http [ACK] Seq=317 Ack=7522 Win=65535 Len=0
746854 238.911769 77.197.128.165 -> 41.177.26.176 TCP 64 62250 > http [ACK] Seq=317 Ack=9434 Win=65535 Len=0
747005 238.993352 77.197.128.165 -> 41.177.26.176 TCP 64 62250 > http [ACK] Seq=317 Ack=11246 Win=65283 Len=0
747006 238.993357 77.197.128.165 -> 41.177.26.176 TCP 64 [TCP Dup ACK 747005#1] 62250 > http [ACK] Seq=317 Ack=11246 Win=65283 Len=0
747735 239.224867 77.197.128.165 -> 41.177.26.176 TCP 64 62250 > http [RST, ACK] Seq=317 Ack=11246 Win=0 Len=0
748309 239.598024 77.197.128.165 -> 41.177.26.176 TCP 66 62449 > http [SYN] Seq=0 Win=65535 Len=0 MSS=1460 SACK_PERM=1
748508 239.679592 77.197.128.165 -> 41.177.26.176 TCP 64 62449 > http [ACK] Seq=1 Ack=1 Win=65535 Len=0
748973 240.043174 77.197.128.165 -> 41.177.26.176 TCP 64 62449 > http [ACK] Seq=353 Ack=4052 Win=65535 Len=0
749062 240.125080 77.197.128.165 -> 41.177.26.176 TCP 64 62449 > http [ACK] Seq=353 Ack=6216 Win=65535 Len=0
749063 240.125085 77.197.128.165 -> 41.177.26.176 TCP 64 62449 > http [ACK] Seq=353 Ack=9136 Win=65535 Len=0
749234 240.206983 77.197.128.165 -> 41.177.26.176 TCP 64 62449 > http [ACK] Seq=353 Ack=11429 Win=63242 Len=0
749235 240.206987 77.197.128.165 -> 41.177.26.176 TCP 64 [TCP Dup ACK 749234#1] 62449 > http [ACK] Seq=353 Ack=11429 Win=63242 Len=0
749441 240.272573 77.197.128.165 -> 41.177.26.176 TCP 64 [TCP Window Update] 62449 > http [ACK] Seq=353 Ack=11429 Win=65535 Len=0
749444 240.272837 77.197.128.165 -> 41.177.26.176 TCP 64 62449 > http [RST, ACK] Seq=353 Ack=11429 Win=0 Len=0
750541 240.609476 77.197.128.165 -> 41.177.26.176 TCP 66 62608 > http [SYN] Seq=0 Win=65535 Len=0 MSS=1460 SACK_PERM=1
750839 240.691245 77.197.128.165 -> 41.177.26.176 TCP 64 62608 > http [ACK] Seq=1 Ack=1 Win=65535 Len=0
751897 241.144189 77.197.128.165 -> 41.177.26.176 TCP 64 62608 > http [ACK] Seq=319 Ack=2431 Win=65535 Len=0
751898 241.144194 77.197.128.165 -> 41.177.26.176 TCP 64 62608 > http [ACK] Seq=319 Ack=3895 Win=65535 Len=0
752016 241.226086 77.197.128.165 -> 41.177.26.176 TCP 64 62608 > http [ACK] Seq=319 Ack=6075 Win=65535 Len=0
752018 241.226229 77.197.128.165 -> 41.177.26.176 TCP 64 62608 > http [ACK] Seq=319 Ack=8459 Win=65535 Len=0
752121 241.307992 77.197.128.165 -> 41.177.26.176 TCP 64 62608 > http [ACK] Seq=319 Ack=11314 Win=64140 Len=0
752378 241.418567 77.197.128.165 -> 41.177.26.176 TCP 64 62608 > http [RST, ACK] Seq=319 Ack=11314 Win=0 Len=0
753705 241.857153 77.197.128.165 -> 41.177.26.176 TCP 66 62830 > http [SYN] Seq=0 Win=65535 Len=0 MSS=1460 SACK_PERM=1
753868 241.938895 77.197.128.165 -> 41.177.26.176 TCP 64 62830 > http [ACK] Seq=1 Ack=1 Win=65535 Len=0
754516 242.352463 77.197.128.165 -> 41.177.26.176 TCP 64 62830 > http [ACK] Seq=353 Ack=2431 Win=65535 Len=0
754517 242.352468 77.197.128.165 -> 41.177.26.176 TCP 64 62830 > http [ACK] Seq=353 Ack=4059 Win=65535 Len=0
754605 242.434258 77.197.128.165 -> 41.177.26.176 TCP 64 62830 > http [ACK] Seq=353 Ack=7683 Win=65535 Len=0
754606 242.434438 77.197.128.165 -> 41.177.26.176 TCP 64 62830 > http [ACK] Seq=353 Ack=11205 Win=64025 Len=0
754607 242.434443 77.197.128.165 -> 41.177.26.176 TCP 64 [TCP Dup ACK 754606#1] 62830 > http [ACK] Seq=353 Ack=11205 Win=64025 Len=0
754968 242.629707 77.197.128.165 -> 41.177.26.176 TCP 64 [TCP Window Update] 62830 > http [ACK] Seq=353 Ack=11205 Win=65535 Len=0
754970 242.630008 77.197.128.165 -> 41.177.26.176 TCP 64 62830 > http [RST, ACK] Seq=353 Ack=11205 Win=0 Len=0
755779 243.050748 77.197.128.165 -> 41.177.26.176 TCP 66 63035 > http [SYN] Seq=0 Win=65535 Len=0 MSS=1460 SACK_PERM=1
755869 243.132417 77.197.128.165 -> 41.177.26.176 TCP 64 63035 > http [ACK] Seq=1 Ack=1 Win=65535 Len=0
756240 243.485868 77.197.128.165 -> 41.177.26.176 TCP 64 63035 > http [ACK] Seq=353 Ack=2431 Win=65535 Len=0
756411 243.567853 77.197.128.165 -> 41.177.26.176 TCP 64 63035 > http [ACK] Seq=353 Ack=5351 Win=65535 Len=0
756412 243.567858 77.197.128.165 -> 41.177.26.176 TCP 64 63035 > http [ACK] Seq=353 Ack=7669 Win=65535 Len=0
756581 243.649580 77.197.128.165 -> 41.177.26.176 TCP 64 63035 > http [ACK] Seq=353 Ack=9918 Win=65535 Len=0
756583 243.649751 77.197.128.165 -> 41.177.26.176 TCP 64 63035 > http [ACK] Seq=353 Ack=11534 Win=63919 Len=0
756584 243.649755 77.197.128.165 -> 41.177.26.176 TCP 64 [TCP Dup ACK 756583#1] 63035 > http [ACK] Seq=353 Ack=11534 Win=63919 Len=0
756981 243.759360 77.197.128.165 -> 41.177.26.176 TCP 64 [TCP Window Update] 63035 > http [ACK] Seq=353 Ack=11534 Win=65535 Len=0
756985 243.759680 77.197.128.165 -> 41.177.26.176 TCP 64 63035 > http [RST, ACK] Seq=353 Ack=11534 Win=0 Len=0
