292588  98.172267 77.197.128.204 -> 41.177.26.91 TCP 66 7538 > http [SYN] Seq=0 Win=65535 Len=0 MSS=1460 SACK_PERM=1
292691  98.254037 77.197.128.204 -> 41.177.26.91 TCP 64 7538 > http [ACK] Seq=1 Ack=1 Win=65535 Len=0
293421  98.517749 77.197.128.204 -> 41.177.26.91 TCP 64 7538 > http [ACK] Seq=287 Ack=256 Win=65280 Len=0
293480  98.566546 77.197.128.204 -> 41.177.26.91 TCP 64 7538 > http [RST, ACK] Seq=287 Ack=256 Win=0 Len=0
309872 105.763282 77.197.128.204 -> 41.177.26.91 TCP 66 13399 > http [SYN] Seq=0 Win=65535 Len=0 MSS=1460 SACK_PERM=1
310079 105.844786 77.197.128.204 -> 41.177.26.91 TCP 64 13399 > http [ACK] Seq=1 Ack=1 Win=65535 Len=0
310489 105.953538 77.197.128.204 -> 41.177.26.91 TCP 64 13399 > http [ACK] Seq=224 Ack=4381 Win=64627 Len=0
310490 105.953543 77.197.128.204 -> 41.177.26.91 TCP 64 [TCP Dup ACK 310489#1] 13399 > http [ACK] Seq=224 Ack=4381 Win=64627 Len=0
310799 106.035302 77.197.128.204 -> 41.177.26.91 TCP 64 13399 > http [ACK] Seq=224 Ack=6893 Win=65535 Len=0
310801 106.035566 77.197.128.204 -> 41.177.26.91 TCP 64 13399 > http [RST, ACK] Seq=224 Ack=6893 Win=0 Len=0
318683 108.616817 77.197.128.204 -> 41.177.26.91 TCP 66 14470 > http [SYN] Seq=0 Win=65535 Len=0 MSS=1460 SACK_PERM=1
318983 108.698554 77.197.128.204 -> 41.177.26.91 TCP 64 14470 > http [ACK] Seq=1 Ack=1 Win=65535 Len=0
319472 108.911003 77.197.128.204 -> 41.177.26.91 TCP 64 14470 > http [ACK] Seq=335 Ack=4381 Win=64627 Len=0
319473 108.911008 77.197.128.204 -> 41.177.26.91 TCP 64 [TCP Dup ACK 319472#1] 14470 > http [ACK] Seq=335 Ack=4381 Win=64627 Len=0
319600 108.992716 77.197.128.204 -> 41.177.26.91 TCP 64 14470 > http [ACK] Seq=335 Ack=10221 Win=65535 Len=0
319779 109.074544 77.197.128.204 -> 41.177.26.91 TCP 64 14470 > http [ACK] Seq=335 Ack=14601 Win=65535 Len=0
319785 109.074728 77.197.128.204 -> 41.177.26.91 TCP 64 14470 > http [ACK] Seq=335 Ack=17189 Win=65535 Len=0
319789 109.075489 77.197.128.204 -> 41.177.26.91 TCP 64 14470 > http [RST, ACK] Seq=335 Ack=17189 Win=0 Len=0
320968 109.599530 77.197.128.204 -> 41.177.26.91 TCP 66 14842 > http [SYN] Seq=0 Win=65535 Len=0 MSS=1460 SACK_PERM=1
321114 109.681194 77.197.128.204 -> 41.177.26.91 TCP 64 14842 > http [ACK] Seq=1 Ack=1 Win=65535 Len=0
321481 109.881173 77.197.128.204 -> 41.177.26.91 TCP 64 14842 > http [ACK] Seq=328 Ack=2921 Win=65535 Len=0
321593 109.962867 77.197.128.204 -> 41.177.26.91 TCP 64 14842 > http [ACK] Seq=328 Ack=8761 Win=64627 Len=0
321596 109.962880 77.197.128.204 -> 41.177.26.91 TCP 64 [TCP Dup ACK 321593#1] 14842 > http [ACK] Seq=328 Ack=8761 Win=64627 Len=0
321747 110.044577 77.197.128.204 -> 41.177.26.91 TCP 64 14842 > http [ACK] Seq=328 Ack=11681 Win=64075 Len=0
321754 110.044771 77.197.128.204 -> 41.177.26.91 TCP 64 14842 > http [ACK] Seq=328 Ack=16061 Win=59695 Len=0
321796 110.073121 77.197.128.204 -> 41.177.26.91 TCP 64 [TCP Window Update] 14842 > http [ACK] Seq=328 Ack=16061 Win=63167 Len=0
321797 110.073126 77.197.128.204 -> 41.177.26.91 TCP 64 [TCP Window Update] 14842 > http [ACK] Seq=328 Ack=16061 Win=65535 Len=0
321913 110.126224 77.197.128.204 -> 41.177.26.91 TCP 64 14842 > http [ACK] Seq=328 Ack=18119 Win=65535 Len=0
321916 110.127212 77.197.128.204 -> 41.177.26.91 TCP 64 14842 > http [RST, ACK] Seq=328 Ack=18119 Win=0 Len=0
387824 129.471648 77.197.128.204 -> 41.177.26.15 TCP 66 20236 > http [SYN] Seq=0 Win=65535 Len=0 MSS=1460 SACK_PERM=1
387991 129.553337 77.197.128.204 -> 41.177.26.15 TCP 64 20236 > http [ACK] Seq=1 Ack=1 Win=65535 Len=0
389108 129.855404 77.197.128.204 -> 41.177.26.15 TCP 64 20236 > http [ACK] Seq=308 Ack=2921 Win=65535 Len=0
389234 129.937232 77.197.128.204 -> 41.177.26.15 TCP 64 20236 > http [ACK] Seq=308 Ack=8465 Win=64923 Len=0
389235 129.937237 77.197.128.204 -> 41.177.26.15 TCP 64 [TCP Dup ACK 389234#1] 20236 > http [ACK] Seq=308 Ack=8465 Win=64923 Len=0
389344 130.019047 77.197.128.204 -> 41.177.26.15 TCP 64 20236 > http [ACK] Seq=308 Ack=14633 Win=65535 Len=0
389345 130.019399 77.197.128.204 -> 41.177.26.15 TCP 64 20236 > http [RST, ACK] Seq=308 Ack=14633 Win=0 Len=0
439348 143.094950 77.197.128.204 -> 41.177.26.15 TCP 66 28452 > http [SYN] Seq=0 Win=65535 Len=0 MSS=1460 SACK_PERM=1
439562 143.176875 77.197.128.204 -> 41.177.26.15 TCP 64 28452 > http [ACK] Seq=1 Ack=1 Win=65535 Len=0
441328 143.665760 77.197.128.204 -> 41.177.26.15 TCP 64 28452 > http [ACK] Seq=308 Ack=2921 Win=65535 Len=0
441527 143.747657 77.197.128.204 -> 41.177.26.15 TCP 64 28452 > http [ACK] Seq=308 Ack=5841 Win=65535 Len=0
441528 143.747662 77.197.128.204 -> 41.177.26.15 TCP 64 28452 > http [ACK] Seq=308 Ack=8465 Win=64923 Len=0
441529 143.747666 77.197.128.204 -> 41.177.26.15 TCP 64 [TCP Dup ACK 441528#1] 28452 > http [ACK] Seq=308 Ack=8465 Win=64923 Len=0
441770 143.829522 77.197.128.204 -> 41.177.26.15 TCP 64 28452 > http [ACK] Seq=308 Ack=12845 Win=62615 Len=0
441771 143.829526 77.197.128.204 -> 41.177.26.15 TCP 64 28452 > http [ACK] Seq=308 Ack=16665 Win=58795 Len=0
441848 143.849177 77.197.128.204 -> 41.177.26.15 TCP 64 [TCP Window Update] 28452 > http [ACK] Seq=308 Ack=16665 Win=62267 Len=0
441849 143.849182 77.197.128.204 -> 41.177.26.15 TCP 64 [TCP Window Update] 28452 > http [ACK] Seq=308 Ack=16665 Win=65535 Len=0
442001 143.911626 77.197.128.204 -> 41.177.26.15 TCP 64 28452 > http [ACK] Seq=308 Ack=26325 Win=64067 Len=0
442002 143.911630 77.197.128.204 -> 41.177.26.15 TCP 64 [TCP Window Update] 28452 > http [ACK] Seq=308 Ack=26325 Win=65535 Len=0
442251 143.993382 77.197.128.204 -> 41.177.26.15 TCP 64 28452 > http [ACK] Seq=308 Ack=30705 Win=65535 Len=0
442252 143.993387 77.197.128.204 -> 41.177.26.15 TCP 64 28452 > http [ACK] Seq=308 Ack=33065 Win=65535 Len=0
442253 143.993390 77.197.128.204 -> 41.177.26.15 TCP 64 28452 > http [ACK] Seq=308 Ack=35985 Win=65527 Len=0
442254 143.993395 77.197.128.204 -> 41.177.26.15 TCP 64 [TCP Dup ACK 442253#1] 28452 > http [ACK] Seq=308 Ack=35985 Win=65527 Len=0
442256 143.993504 77.197.128.204 -> 41.177.26.15 TCP 64 28452 > http [ACK] Seq=308 Ack=38905 Win=65535 Len=0
442580 144.075346 77.197.128.204 -> 41.177.26.15 TCP 64 28452 > http [ACK] Seq=308 Ack=42725 Win=65535 Len=0
442581 144.075350 77.197.128.204 -> 41.177.26.15 TCP 64 28452 > http [ACK] Seq=308 Ack=44185 Win=65535 Len=0
442582 144.075437 77.197.128.204 -> 41.177.26.15 TCP 64 28452 > http [ACK] Seq=308 Ack=49465 Win=65535 Len=0
442583 144.075443 77.197.128.204 -> 41.177.26.15 TCP 64 28452 > http [ACK] Seq=308 Ack=52385 Win=65527 Len=0
442584 144.075446 77.197.128.204 -> 41.177.26.15 TCP 64 [TCP Dup ACK 442583#1] 28452 > http [ACK] Seq=308 Ack=52385 Win=65527 Len=0
442585 144.075560 77.197.128.204 -> 41.177.26.15 TCP 64 28452 > http [ACK] Seq=308 Ack=56765 Win=65535 Len=0
442856 144.157398 77.197.128.204 -> 41.177.26.15 TCP 64 28452 > http [ACK] Seq=308 Ack=59125 Win=65535 Len=0
442857 144.157579 77.197.128.204 -> 41.177.26.15 TCP 64 28452 > http [ACK] Seq=308 Ack=63505 Win=61155 Len=0
442858 144.157584 77.197.128.204 -> 41.177.26.15 TCP 64 [TCP Window Update] 28452 > http [ACK] Seq=308 Ack=63505 Win=65535 Len=0
442859 144.157605 77.197.128.204 -> 41.177.26.15 TCP 64 28452 > http [ACK] Seq=308 Ack=71705 Win=65527 Len=0
442864 144.157735 77.197.128.204 -> 41.177.26.15 TCP 64 [TCP Dup ACK 442859#1] 28452 > http [ACK] Seq=308 Ack=71705 Win=65527 Len=0
442865 144.157740 77.197.128.204 -> 41.177.26.15 TCP 64 28452 > http [ACK] Seq=308 Ack=74065 Win=65535 Len=0
442874 144.158066 77.197.128.204 -> 41.177.26.15 TCP 64 28452 > http [ACK] Seq=308 Ack=78445 Win=65535 Len=0
442877 144.158328 77.197.128.204 -> 41.177.26.15 TCP 64 28452 > http [ACK] Seq=308 Ack=82265 Win=65535 Len=0
443103 144.239196 77.197.128.204 -> 41.177.26.15 TCP 64 28452 > http [ACK] Seq=308 Ack=86645 Win=65535 Len=0
443104 144.239444 77.197.128.204 -> 41.177.26.15 TCP 64 28452 > http [ACK] Seq=308 Ack=90465 Win=65527 Len=0
443105 144.239448 77.197.128.204 -> 41.177.26.15 TCP 64 [TCP Dup ACK 443104#1] 28452 > http [ACK] Seq=308 Ack=90465 Win=65527 Len=0
443106 144.239453 77.197.128.204 -> 41.177.26.15 TCP 64 28452 > http [ACK] Seq=308 Ack=94845 Win=65535 Len=0
443107 144.239572 77.197.128.204 -> 41.177.26.15 TCP 64 28452 > http [ACK] Seq=308 Ack=98335 Win=65535 Len=0
443119 144.246740 77.197.128.204 -> 41.177.26.15 TCP 64 28452 > http [RST, ACK] Seq=308 Ack=98335 Win=0 Len=0
760808 245.389951 77.197.128.204 -> 41.177.26.176 TCP 66 53278 > http [SYN] Seq=0 Win=65535 Len=0 MSS=1460 SACK_PERM=1
761013 245.471688 77.197.128.204 -> 41.177.26.176 TCP 64 53278 > http [ACK] Seq=1 Ack=1 Win=65535 Len=0
762102 245.888476 77.197.128.204 -> 41.177.26.176 TCP 64 53278 > http [ACK] Seq=309 Ack=3914 Win=65535 Len=0
762353 245.970183 77.197.128.204 -> 41.177.26.176 TCP 64 53278 > http [ACK] Seq=309 Ack=6088 Win=65535 Len=0
762354 245.970340 77.197.128.204 -> 41.177.26.176 TCP 64 53278 > http [ACK] Seq=309 Ack=8641 Win=65535 Len=0
762601 246.052070 77.197.128.204 -> 41.177.26.176 TCP 64 53278 > http [ACK] Seq=309 Ack=11497 Win=65535 Len=0
762602 246.052440 77.197.128.204 -> 41.177.26.176 TCP 64 53278 > http [RST, ACK] Seq=309 Ack=11497 Win=0 Len=0
783584 253.742041 77.197.128.204 -> 41.177.26.176 TCP 66 57746 > http [SYN] Seq=0 Win=65535 Len=0 MSS=1460 SACK_PERM=1
783741 253.823864 77.197.128.204 -> 41.177.26.176 TCP 64 57746 > http [ACK] Seq=1 Ack=1 Win=65535 Len=0
784577 254.235095 77.197.128.204 -> 41.177.26.176 TCP 64 57746 > http [ACK] Seq=304 Ack=3891 Win=65535 Len=0
784748 254.317110 77.197.128.204 -> 41.177.26.176 TCP 64 57746 > http [ACK] Seq=304 Ack=8979 Win=65535 Len=0
784914 254.398943 77.197.128.204 -> 41.177.26.176 TCP 64 57746 > http [ACK] Seq=304 Ack=12081 Win=65535 Len=0
784916 254.399320 77.197.128.204 -> 41.177.26.176 TCP 64 57746 > http [RST, ACK] Seq=304 Ack=12081 Win=0 Len=0
790026 256.630244 77.197.128.204 -> 41.177.26.176 TCP 66 59408 > http [SYN] Seq=0 Win=65535 Len=0 MSS=1460 SACK_PERM=1
790247 256.712362 77.197.128.204 -> 41.177.26.176 TCP 64 59408 > http [ACK] Seq=1 Ack=1 Win=65535 Len=0
791261 257.160532 77.197.128.204 -> 41.177.26.176 TCP 64 59408 > http [ACK] Seq=309 Ack=3908 Win=65535 Len=0
791411 257.242268 77.197.128.204 -> 41.177.26.176 TCP 64 59408 > http [ACK] Seq=309 Ack=6082 Win=65535 Len=0
791412 257.242363 77.197.128.204 -> 41.177.26.176 TCP 64 59408 > http [ACK] Seq=309 Ack=9249 Win=65535 Len=0
791777 257.324569 77.197.128.204 -> 41.177.26.176 TCP 64 59408 > http [ACK] Seq=309 Ack=11072 Win=65535 Len=0
791778 257.324629 77.197.128.204 -> 41.177.26.176 TCP 64 59408 > http [RST, ACK] Seq=309 Ack=11072 Win=0 Len=0
792338 257.645073 77.197.128.204 -> 41.177.26.176 TCP 66 60115 > http [SYN] Seq=0 Win=65535 Len=0 MSS=1460 SACK_PERM=1
792480 257.727742 77.197.128.204 -> 41.177.26.176 TCP 64 60115 > http [ACK] Seq=1 Ack=1 Win=65535 Len=0
793087 258.159632 77.197.128.204 -> 41.177.26.176 TCP 64 60115 > http [ACK] Seq=305 Ack=3125 Win=65535 Len=0
793164 258.241358 77.197.128.204 -> 41.177.26.176 TCP 64 60115 > http [ACK] Seq=305 Ack=6084 Win=65535 Len=0
793245 258.316483 77.197.128.204 -> 41.177.26.176 TCP 64 60115 > http [ACK] Seq=305 Ack=7544 Win=65535 Len=0
793249 258.323712 77.197.128.204 -> 41.177.26.176 TCP 64 60115 > http [ACK] Seq=305 Ack=12115 Win=65522 Len=0
793250 258.323717 77.197.128.204 -> 41.177.26.176 TCP 64 [TCP Dup ACK 793249#1] 60115 > http [ACK] Seq=305 Ack=12115 Win=65522 Len=0
793251 258.323817 77.197.128.204 -> 41.177.26.176 TCP 64 60115 > http [RST, ACK] Seq=305 Ack=12115 Win=0 Len=0
794473 258.796778 77.197.128.204 -> 41.177.26.176 TCP 66 61148 > http [SYN] Seq=0 Win=65535 Len=0 MSS=1460 SACK_PERM=1
794677 258.878646 77.197.128.204 -> 41.177.26.176 TCP 64 61148 > http [ACK] Seq=1 Ack=1 Win=65535 Len=0
795619 259.277106 77.197.128.204 -> 41.177.26.176 TCP 64 61148 > http [ACK] Seq=309 Ack=2429 Win=65535 Len=0
795620 259.277197 77.197.128.204 -> 41.177.26.176 TCP 64 61148 > http [ACK] Seq=309 Ack=3906 Win=65535 Len=0
795757 259.359050 77.197.128.204 -> 41.177.26.176 TCP 64 61148 > http [ACK] Seq=309 Ack=7253 Win=65535 Len=0
795758 259.359160 77.197.128.204 -> 41.177.26.176 TCP 64 61148 > http [ACK] Seq=309 Ack=10567 Win=64426 Len=0
795790 259.381102 77.197.128.204 -> 41.177.26.176 TCP 64 61148 > http [RST, ACK] Seq=309 Ack=10567 Win=0 Len=0
796326 259.674336 77.197.128.204 -> 41.177.26.176 TCP 66 61742 > http [SYN] Seq=0 Win=65535 Len=0 MSS=1460 SACK_PERM=1
796434 259.756016 77.197.128.204 -> 41.177.26.176 TCP 64 61742 > http [ACK] Seq=1 Ack=1 Win=65535 Len=0
797519 260.158550 77.197.128.204 -> 41.177.26.176 TCP 64 61742 > http [ACK] Seq=301 Ack=2431 Win=65535 Len=0
797520 260.158642 77.197.128.204 -> 41.177.26.176 TCP 64 61742 > http [ACK] Seq=301 Ack=3908 Win=65535 Len=0
797827 260.240431 77.197.128.204 -> 41.177.26.176 TCP 64 61742 > http [ACK] Seq=301 Ack=6082 Win=65535 Len=0
797828 260.240565 77.197.128.204 -> 41.177.26.176 TCP 64 61742 > http [ACK] Seq=301 Ack=7796 Win=65535 Len=0
797829 260.240719 77.197.128.204 -> 41.177.26.176 TCP 64 61742 > http [ACK] Seq=301 Ack=11079 Win=65535 Len=0
797833 260.240927 77.197.128.204 -> 41.177.26.176 TCP 64 61742 > http [RST, ACK] Seq=301 Ack=11079 Win=0 Len=0
798814 260.633455 77.197.128.204 -> 41.177.26.176 TCP 66 62357 > http [SYN] Seq=0 Win=65535 Len=0 MSS=1460 SACK_PERM=1
799089 260.715417 77.197.128.204 -> 41.177.26.176 TCP 64 62357 > http [ACK] Seq=1 Ack=1 Win=65535 Len=0
799999 261.150530 77.197.128.204 -> 41.177.26.176 TCP 64 62357 > http [ACK] Seq=353 Ack=2431 Win=65535 Len=0
800179 261.232461 77.197.128.204 -> 41.177.26.176 TCP 64 62357 > http [ACK] Seq=353 Ack=7673 Win=63765 Len=0
800180 261.232465 77.197.128.204 -> 41.177.26.176 TCP 64 [TCP Window Update] 62357 > http [ACK] Seq=353 Ack=7673 Win=65535 Len=0
800330 261.314266 77.197.128.204 -> 41.177.26.176 TCP 64 62357 > http [ACK] Seq=353 Ack=11309 Win=65535 Len=0
800332 261.314476 77.197.128.204 -> 41.177.26.176 TCP 64 62357 > http [RST, ACK] Seq=353 Ack=11309 Win=0 Len=0
800508 261.487449 77.197.128.204 -> 41.177.26.176 TCP 66 62966 > http [SYN] Seq=0 Win=65535 Len=0 MSS=1460 SACK_PERM=1
800646 261.569324 77.197.128.204 -> 41.177.26.176 TCP 64 62966 > http [ACK] Seq=1 Ack=1 Win=65535 Len=0
801333 262.001273 77.197.128.204 -> 41.177.26.176 TCP 64 62966 > http [ACK] Seq=301 Ack=2431 Win=65535 Len=0
801339 262.001790 77.197.128.204 -> 41.177.26.176 TCP 64 62966 > http [ACK] Seq=301 Ack=3908 Win=65535 Len=0
801432 262.083094 77.197.128.204 -> 41.177.26.176 TCP 64 62966 > http [ACK] Seq=301 Ack=6082 Win=65535 Len=0
801434 262.083409 77.197.128.204 -> 41.177.26.176 TCP 64 62966 > http [ACK] Seq=301 Ack=9002 Win=65535 Len=0
801435 262.083574 77.197.128.204 -> 41.177.26.176 TCP 64 62966 > http [ACK] Seq=301 Ack=11190 Win=65535 Len=0
801436 262.083709 77.197.128.204 -> 41.177.26.176 TCP 64 62966 > http [RST, ACK] Seq=301 Ack=11190 Win=0 Len=0
802904 262.331271 77.197.128.204 -> 41.177.26.176 TCP 66 63338 > http [SYN] Seq=0 Win=65535 Len=0 MSS=1460 SACK_PERM=1
803185 262.413247 77.197.128.204 -> 41.177.26.176 TCP 64 63338 > http [ACK] Seq=1 Ack=1 Win=65535 Len=0
804435 262.807454 77.197.128.204 -> 41.177.26.176 TCP 64 63338 > http [ACK] Seq=309 Ack=2431 Win=65535 Len=0
804436 262.807458 77.197.128.204 -> 41.177.26.176 TCP 64 63338 > http [ACK] Seq=309 Ack=3908 Win=65535 Len=0
804581 262.889426 77.197.128.204 -> 41.177.26.176 TCP 64 63338 > http [ACK] Seq=309 Ack=7910 Win=65535 Len=0
804582 262.889567 77.197.128.204 -> 41.177.26.176 TCP 64 63338 > http [ACK] Seq=309 Ack=11186 Win=65535 Len=0
804583 262.889903 77.197.128.204 -> 41.177.26.176 TCP 64 63338 > http [RST, ACK] Seq=309 Ack=11186 Win=0 Len=0
804711 262.955784 77.197.128.204 -> 41.177.26.176 TCP 66 63636 > http [SYN] Seq=0 Win=65535 Len=0 MSS=1460 SACK_PERM=1
804830 263.037568 77.197.128.204 -> 41.177.26.176 TCP 64 63636 > http [ACK] Seq=1 Ack=1 Win=65535 Len=0
806427 263.503552 77.197.128.204 -> 41.177.26.176 TCP 64 63636 > http [ACK] Seq=319 Ack=2431 Win=65535 Len=0
806428 263.503602 77.197.128.204 -> 41.177.26.176 TCP 64 63636 > http [ACK] Seq=319 Ack=3895 Win=65535 Len=0
806750 263.585388 77.197.128.204 -> 41.177.26.176 TCP 64 63636 > http [ACK] Seq=319 Ack=6075 Win=65535 Len=0
806751 263.585426 77.197.128.204 -> 41.177.26.176 TCP 64 63636 > http [ACK] Seq=319 Ack=8995 Win=65535 Len=0
807162 263.667100 77.197.128.204 -> 41.177.26.176 TCP 64 63636 > http [ACK] Seq=319 Ack=11593 Win=65535 Len=0
807164 263.667343 77.197.128.204 -> 41.177.26.176 TCP 64 63636 > http [RST, ACK] Seq=319 Ack=11593 Win=0 Len=0
807754 263.724133 77.197.128.204 -> 41.177.26.176 TCP 66 63960 > http [SYN] Seq=0 Win=65535 Len=0 MSS=1460 SACK_PERM=1
808437 263.806019 77.197.128.204 -> 41.177.26.176 TCP 64 63960 > http [ACK] Seq=1 Ack=1 Win=65535 Len=0
810645 264.326277 77.197.128.204 -> 41.177.26.176 TCP 64 63960 > http [ACK] Seq=355 Ack=2431 Win=65535 Len=0
810646 264.326498 77.197.128.204 -> 41.177.26.176 TCP 64 63960 > http [ACK] Seq=355 Ack=4058 Win=65535 Len=0
810829 264.408016 77.197.128.204 -> 41.177.26.176 TCP 64 63960 > http [ACK] Seq=355 Ack=6232 Win=65535 Len=0
810831 264.408146 77.197.128.204 -> 41.177.26.176 TCP 64 63960 > http [ACK] Seq=355 Ack=8747 Win=65535 Len=0
811093 264.489972 77.197.128.204 -> 41.177.26.176 TCP 64 63960 > http [ACK] Seq=355 Ack=11115 Win=65535 Len=0
811094 264.490249 77.197.128.204 -> 41.177.26.176 TCP 64 63960 > http [RST, ACK] Seq=355 Ack=11797 Win=0 Len=0
811196 264.523191 77.197.128.204 -> 41.177.26.176 TCP 66 64306 > http [SYN] Seq=0 Win=65535 Len=0 MSS=1460 SACK_PERM=1
811536 264.605105 77.197.128.204 -> 41.177.26.176 TCP 64 64306 > http [ACK] Seq=1 Ack=1 Win=65535 Len=0
812642 264.994403 77.197.128.204 -> 41.177.26.176 TCP 64 64306 > http [ACK] Seq=309 Ack=2431 Win=65535 Len=0
812643 264.994533 77.197.128.204 -> 41.177.26.176 TCP 64 64306 > http [ACK] Seq=309 Ack=3908 Win=65535 Len=0
812808 265.076127 77.197.128.204 -> 41.177.26.176 TCP 64 64306 > http [ACK] Seq=309 Ack=6076 Win=65535 Len=0
812809 265.076354 77.197.128.204 -> 41.177.26.176 TCP 64 64306 > http [ACK] Seq=309 Ack=8340 Win=65535 Len=0
812810 265.076506 77.197.128.204 -> 41.177.26.176 TCP 64 64306 > http [ACK] Seq=309 Ack=11183 Win=65535 Len=0
812811 265.077081 77.197.128.204 -> 41.177.26.176 TCP 64 64306 > http [RST, ACK] Seq=309 Ack=11183 Win=0 Len=0
813002 265.162099 77.197.128.204 -> 41.177.26.176 TCP 66 64572 > http [SYN] Seq=0 Win=65535 Len=0 MSS=1460 SACK_PERM=1
813187 265.243701 77.197.128.204 -> 41.177.26.176 TCP 64 64572 > http [ACK] Seq=1 Ack=1 Win=65535 Len=0
814817 265.682885 77.197.128.204 -> 41.177.26.176 TCP 64 64572 > http [ACK] Seq=305 Ack=2431 Win=65535 Len=0
814818 265.682967 77.197.128.204 -> 41.177.26.176 TCP 64 64572 > http [ACK] Seq=305 Ack=3896 Win=65535 Len=0
815220 265.764554 77.197.128.204 -> 41.177.26.176 TCP 64 64572 > http [ACK] Seq=305 Ack=6070 Win=65535 Len=0
815221 265.764751 77.197.128.204 -> 41.177.26.176 TCP 64 64572 > http [ACK] Seq=305 Ack=8990 Win=65535 Len=0
815487 265.846272 77.197.128.204 -> 41.177.26.176 TCP 64 64572 > http [ACK] Seq=305 Ack=11733 Win=65535 Len=0
815488 265.846471 77.197.128.204 -> 41.177.26.176 TCP 64 64572 > http [RST, ACK] Seq=305 Ack=11733 Win=0 Len=0
815909 265.995467 77.197.128.204 -> 41.177.26.176 TCP 66 64877 > http [SYN] Seq=0 Win=65535 Len=0 MSS=1460 SACK_PERM=1
816057 266.077119 77.197.128.204 -> 41.177.26.176 TCP 64 64877 > http [ACK] Seq=1 Ack=1 Win=65535 Len=0
816971 266.502155 77.197.128.204 -> 41.177.26.176 TCP 64 64877 > http [ACK] Seq=306 Ack=2431 Win=65535 Len=0
816972 266.502382 77.197.128.204 -> 41.177.26.176 TCP 64 64877 > http [ACK] Seq=306 Ack=3895 Win=65535 Len=0
817149 266.583965 77.197.128.204 -> 41.177.26.176 TCP 64 64877 > http [ACK] Seq=306 Ack=6075 Win=65535 Len=0
817152 266.584091 77.197.128.204 -> 41.177.26.176 TCP 64 64877 > http [ACK] Seq=306 Ack=8247 Win=65535 Len=0
817153 266.584288 77.197.128.204 -> 41.177.26.176 TCP 64 64877 > http [ACK] Seq=306 Ack=11109 Win=64133 Len=0
817206 266.603907 77.197.128.204 -> 41.177.26.176 TCP 64 64877 > http [RST, ACK] Seq=306 Ack=11109 Win=0 Len=0
817679 266.806445 77.197.128.204 -> 41.177.26.176 TCP 66 65135 > http [SYN] Seq=0 Win=65535 Len=0 MSS=1460 SACK_PERM=1
817883 266.888223 77.197.128.204 -> 41.177.26.176 TCP 64 65135 > http [ACK] Seq=1 Ack=1 Win=65535 Len=0
819347 267.328921 77.197.128.204 -> 41.177.26.176 TCP 64 65135 > http [ACK] Seq=309 Ack=2431 Win=65535 Len=0
819348 267.328998 77.197.128.204 -> 41.177.26.176 TCP 64 65135 > http [ACK] Seq=309 Ack=3908 Win=65535 Len=0
819623 267.410931 77.197.128.204 -> 41.177.26.176 TCP 64 65135 > http [ACK] Seq=309 Ack=8303 Win=65535 Len=0
819909 267.492707 77.197.128.204 -> 41.177.26.176 TCP 64 65135 > http [ACK] Seq=309 Ack=11579 Win=65535 Len=0
819910 267.493021 77.197.128.204 -> 41.177.26.176 TCP 64 65135 > http [RST, ACK] Seq=309 Ack=11579 Win=0 Len=0
820105 267.567869 77.197.128.204 -> 41.177.26.176 TCP 66 65494 > http [SYN] Seq=0 Win=65535 Len=0 MSS=1460 SACK_PERM=1
820263 267.649985 77.197.128.204 -> 41.177.26.176 TCP 64 65494 > http [ACK] Seq=1 Ack=1 Win=65535 Len=0
821351 268.061564 77.197.128.204 -> 41.177.26.176 TCP 64 65494 > http [ACK] Seq=319 Ack=2431 Win=65535 Len=0
821352 268.061776 77.197.128.204 -> 41.177.26.176 TCP 64 65494 > http [ACK] Seq=319 Ack=3895 Win=65535 Len=0
821565 268.143389 77.197.128.204 -> 41.177.26.176 TCP 64 65494 > http [ACK] Seq=319 Ack=6075 Win=65535 Len=0
821571 268.143540 77.197.128.204 -> 41.177.26.176 TCP 64 65494 > http [ACK] Seq=319 Ack=8995 Win=65535 Len=0
821576 268.143698 77.197.128.204 -> 41.177.26.176 TCP 64 65494 > http [ACK] Seq=319 Ack=11183 Win=65535 Len=0
821578 268.143950 77.197.128.204 -> 41.177.26.176 TCP 64 65494 > http [RST, ACK] Seq=319 Ack=11183 Win=0 Len=0
821645 268.168791 77.197.128.204 -> 41.177.26.176 TCP 66 dnap > http [SYN] Seq=0 Win=65535 Len=0 MSS=1460 SACK_PERM=1
821767 268.250795 77.197.128.204 -> 41.177.26.176 TCP 64 dnap > http [ACK] Seq=1 Ack=1 Win=65535 Len=0
822969 268.685883 77.197.128.204 -> 41.177.26.176 TCP 64 dnap > http [ACK] Seq=305 Ack=3894 Win=65535 Len=0
823091 268.767947 77.197.128.204 -> 41.177.26.176 TCP 64 dnap > http [ACK] Seq=305 Ack=5781 Win=65535 Len=0
823092 268.767952 77.197.128.204 -> 41.177.26.176 TCP 64 dnap > http [ACK] Seq=305 Ack=7562 Win=65535 Len=0
823145 268.816129 77.197.128.204 -> 41.177.26.176 TCP 64 dnap > http [ACK] Seq=305 Ack=9022 Win=65535 Len=0
823188 268.849752 77.197.128.204 -> 41.177.26.176 TCP 64 dnap > http [ACK] Seq=305 Ack=10551 Win=65535 Len=0
823189 268.850023 77.197.128.204 -> 41.177.26.176 TCP 64 dnap > http [RST, ACK] Seq=305 Ack=10551 Win=0 Len=0
823479 268.960929 77.197.128.204 -> 41.177.26.176 TCP 66 gwha > http [SYN] Seq=0 Win=65535 Len=0 MSS=1460 SACK_PERM=1
823676 269.042802 77.197.128.204 -> 41.177.26.176 TCP 64 gwha > http [ACK] Seq=1 Ack=1 Win=65535 Len=0
829531 270.897699 77.197.128.204 -> 41.177.26.176 TCP 64 gwha > http [ACK] Seq=310 Ack=2921 Win=65535 Len=0
829686 270.979365 77.197.128.204 -> 41.177.26.176 TCP 64 gwha > http [ACK] Seq=310 Ack=5841 Win=65535 Len=0
829687 270.979610 77.197.128.204 -> 41.177.26.176 TCP 64 gwha > http [ACK] Seq=310 Ack=7838 Win=65535 Len=0
829688 270.979764 77.197.128.204 -> 41.177.26.176 TCP 64 gwha > http [RST, ACK] Seq=310 Ack=7838 Win=0 Len=0
829691 270.991828 77.197.128.204 -> 41.177.26.176 TCP 66 cisco-net-mgmt > http [SYN] Seq=0 Win=65535 Len=0 MSS=1460 SACK_PERM=1
829911 271.073538 77.197.128.204 -> 41.177.26.176 TCP 64 cisco-net-mgmt > http [ACK] Seq=1 Ack=1 Win=65535 Len=0
832724 272.372671 77.197.128.204 -> 41.177.26.176 TCP 64 cisco-net-mgmt > http [ACK] Seq=351 Ack=1537 Win=65535 Len=0
832761 272.386932 77.197.128.204 -> 41.177.26.176 TCP 64 cisco-net-mgmt > http [ACK] Seq=351 Ack=2468 Win=64604 Len=0
832762 272.387109 77.197.128.204 -> 41.177.26.176 TCP 64 cisco-net-mgmt > http [ACK] Seq=351 Ack=2819 Win=64253 Len=0
832766 272.387318 77.197.128.204 -> 41.177.26.176 TCP 64 cisco-net-mgmt > http [ACK] Seq=351 Ack=3632 Win=65535 Len=0
833020 272.454423 77.197.128.204 -> 41.177.26.176 TCP 64 cisco-net-mgmt > http [ACK] Seq=351 Ack=6274 Win=65535 Len=0
833090 272.468769 77.197.128.204 -> 41.177.26.176 TCP 64 cisco-net-mgmt > http [ACK] Seq=351 Ack=9194 Win=65535 Len=0
833093 272.469054 77.197.128.204 -> 41.177.26.176 TCP 64 cisco-net-mgmt > http [RST, ACK] Seq=351 Ack=10389 Win=0 Len=0
835963 273.683228 77.197.128.204 -> 41.177.26.176 TCP 66 ncacn-ip-tcp > http [SYN] Seq=0 Win=65535 Len=0 MSS=1460 SACK_PERM=1
836125 273.765239 77.197.128.204 -> 41.177.26.176 TCP 64 ncacn-ip-tcp > http [ACK] Seq=1 Ack=1 Win=65535 Len=0
837004 274.139475 77.197.128.204 -> 41.177.26.176 TCP 64 ncacn-ip-tcp > http [ACK] Seq=353 Ack=2511 Win=65535 Len=0
837104 274.221811 77.197.128.204 -> 41.177.26.176 TCP 64 ncacn-ip-tcp > http [ACK] Seq=353 Ack=6209 Win=65309 Len=0
837105 274.221816 77.197.128.204 -> 41.177.26.176 TCP 64 [TCP Dup ACK 837104#1] ncacn-ip-tcp > http [ACK] Seq=353 Ack=6209 Win=65309 Len=0
837305 274.303378 77.197.128.204 -> 41.177.26.176 TCP 64 ncacn-ip-tcp > http [ACK] Seq=353 Ack=8020 Win=65535 Len=0
837306 274.303841 77.197.128.204 -> 41.177.26.176 TCP 64 ncacn-ip-tcp > http [ACK] Seq=353 Ack=11291 Win=63925 Len=0
837307 274.303845 77.197.128.204 -> 41.177.26.176 TCP 64 [TCP Dup ACK 837306#1] ncacn-ip-tcp > http [ACK] Seq=353 Ack=11291 Win=63925 Len=0
837349 274.323576 77.197.128.204 -> 41.177.26.176 TCP 64 [TCP Window Update] ncacn-ip-tcp > http [ACK] Seq=353 Ack=11291 Win=65535 Len=0
837350 274.323803 77.197.128.204 -> 41.177.26.176 TCP 64 ncacn-ip-tcp > http [RST, ACK] Seq=353 Ack=11291 Win=0 Len=0
868373 287.058623 77.197.128.204 -> 41.177.26.176 TCP 66 12687 > http [SYN] Seq=0 Win=65535 Len=0 MSS=1460 SACK_PERM=1
868560 287.140256 77.197.128.204 -> 41.177.26.176 TCP 64 12687 > http [ACK] Seq=1 Ack=1 Win=65535 Len=0
869820 287.579575 77.197.128.204 -> 41.177.26.176 TCP 64 12687 > http [ACK] Seq=318 Ack=2431 Win=65535 Len=0
869821 287.579579 77.197.128.204 -> 41.177.26.176 TCP 64 12687 > http [ACK] Seq=318 Ack=3896 Win=65535 Len=0
869986 287.661395 77.197.128.204 -> 41.177.26.176 TCP 64 12687 > http [ACK] Seq=318 Ack=6070 Win=65535 Len=0
869987 287.661547 77.197.128.204 -> 41.177.26.176 TCP 64 12687 > http [ACK] Seq=318 Ack=10450 Win=65535 Len=0
870147 287.743306 77.197.128.204 -> 41.177.26.176 TCP 64 12687 > http [ACK] Seq=318 Ack=12294 Win=65329 Len=0
870148 287.743311 77.197.128.204 -> 41.177.26.176 TCP 64 [TCP Dup ACK 870147#1] 12687 > http [ACK] Seq=318 Ack=12294 Win=65329 Len=0
870149 287.743397 77.197.128.204 -> 41.177.26.176 TCP 64 12687 > http [RST, ACK] Seq=318 Ack=12294 Win=0 Len=0
877878 291.261325 77.197.128.204 -> 41.177.26.176 TCP 66 15134 > http [SYN] Seq=0 Win=65535 Len=0 MSS=1460 SACK_PERM=1
877933 291.342977 77.197.128.204 -> 41.177.26.176 TCP 64 15134 > http [ACK] Seq=1 Ack=1 Win=65535 Len=0
879141 292.222605 77.197.128.204 -> 41.177.26.176 TCP 64 15134 > http [ACK] Seq=308 Ack=1458 Win=64078 Len=0
879148 292.228001 77.197.128.204 -> 41.177.26.176 TCP 64 15134 > http [ACK] Seq=308 Ack=2332 Win=65535 Len=0
879149 292.228006 77.197.128.204 -> 41.177.26.176 TCP 64 15134 > http [ACK] Seq=308 Ack=2632 Win=65235 Len=0
879153 292.228329 77.197.128.204 -> 41.177.26.176 TCP 64 15134 > http [ACK] Seq=308 Ack=3819 Win=65535 Len=0
879224 292.304493 77.197.128.204 -> 41.177.26.176 TCP 64 15134 > http [ACK] Seq=308 Ack=6515 Win=65535 Len=0
879235 292.309696 77.197.128.204 -> 41.177.26.176 TCP 64 15134 > http [ACK] Seq=308 Ack=7975 Win=65535 Len=0
879236 292.309701 77.197.128.204 -> 41.177.26.176 TCP 64 15134 > http [ACK] Seq=308 Ack=10551 Win=64419 Len=0
879448 292.461659 77.197.128.204 -> 41.177.26.176 TCP 64 15134 > http [RST, ACK] Seq=308 Ack=10551 Win=0 Len=0
880195 292.810845 77.197.128.204 -> 41.177.26.176 TCP 66 15935 > http [SYN] Seq=0 Win=65535 Len=0 MSS=1460 SACK_PERM=1
880549 292.892705 77.197.128.204 -> 41.177.26.176 TCP 64 15935 > http [ACK] Seq=1 Ack=1 Win=65535 Len=0
881973 293.290205 77.197.128.204 -> 41.177.26.176 TCP 64 15935 > http [ACK] Seq=353 Ack=2429 Win=65535 Len=0
881974 293.290342 77.197.128.204 -> 41.177.26.176 TCP 64 15935 > http [ACK] Seq=353 Ack=4050 Win=65535 Len=0
882074 293.372130 77.197.128.204 -> 41.177.26.176 TCP 64 15935 > http [ACK] Seq=353 Ack=6206 Win=65535 Len=0
882075 293.372135 77.197.128.204 -> 41.177.26.176 TCP 64 15935 > http [ACK] Seq=353 Ack=9126 Win=65535 Len=0
882173 293.453819 77.197.128.204 -> 41.177.26.176 TCP 64 15935 > http [ACK] Seq=353 Ack=11410 Win=65263 Len=0
882174 293.453979 77.197.128.204 -> 41.177.26.176 TCP 64 [TCP Dup ACK 882173#1] 15935 > http [ACK] Seq=353 Ack=11410 Win=65263 Len=0
882175 293.454140 77.197.128.204 -> 41.177.26.176 TCP 64 15935 > http [RST, ACK] Seq=353 Ack=11410 Win=0 Len=0
882489 293.622919 77.197.128.204 -> 41.177.26.176 TCP 66 16269 > http [SYN] Seq=0 Win=65535 Len=0 MSS=1460 SACK_PERM=1
883070 293.705080 77.197.128.204 -> 41.177.26.176 TCP 64 16269 > http [ACK] Seq=1 Ack=1 Win=65535 Len=0
885721 294.173904 77.197.128.204 -> 41.177.26.176 TCP 64 16269 > http [ACK] Seq=305 Ack=2431 Win=65535 Len=0
885725 294.174132 77.197.128.204 -> 41.177.26.176 TCP 64 16269 > http [ACK] Seq=305 Ack=3896 Win=65535 Len=0
886237 294.255848 77.197.128.204 -> 41.177.26.176 TCP 64 16269 > http [ACK] Seq=305 Ack=7530 Win=65535 Len=0
886240 294.256118 77.197.128.204 -> 41.177.26.176 TCP 64 16269 > http [ACK] Seq=305 Ack=9866 Win=65535 Len=0
887111 294.338587 77.197.128.204 -> 41.177.26.176 TCP 64 16269 > http [ACK] Seq=305 Ack=11456 Win=65535 Len=0
887112 294.338875 77.197.128.204 -> 41.177.26.176 TCP 64 16269 > http [RST, ACK] Seq=305 Ack=11456 Win=0 Len=0
888184 294.444614 77.197.128.204 -> 41.177.26.176 TCP 66 16605 > http [SYN] Seq=0 Win=65535 Len=0 MSS=1460 SACK_PERM=1
888683 294.526415 77.197.128.204 -> 41.177.26.176 TCP 64 16605 > http [ACK] Seq=1 Ack=1 Win=65535 Len=0
891210 294.933487 77.197.128.204 -> 41.177.26.176 TCP 64 16605 > http [ACK] Seq=315 Ack=2429 Win=65535 Len=0
891431 295.015239 77.197.128.204 -> 41.177.26.176 TCP 64 16605 > http [ACK] Seq=315 Ack=5798 Win=65535 Len=0
891671 295.098156 77.197.128.204 -> 41.177.26.176 TCP 64 16605 > http [ACK] Seq=315 Ack=8522 Win=65535 Len=0
891672 295.098171 77.197.128.204 -> 41.177.26.176 TCP 64 16605 > http [ACK] Seq=315 Ack=11115 Win=65535 Len=0
891675 295.098385 77.197.128.204 -> 41.177.26.176 TCP 64 16605 > http [RST, ACK] Seq=315 Ack=11115 Win=0 Len=0
892045 295.234600 77.197.128.204 -> 41.177.26.176 TCP 66 16886 > http [SYN] Seq=0 Win=65535 Len=0 MSS=1460 SACK_PERM=1
892273 295.316396 77.197.128.204 -> 41.177.26.176 TCP 64 16886 > http [ACK] Seq=1 Ack=1 Win=65535 Len=0
893750 295.770378 77.197.128.204 -> 41.177.26.176 TCP 64 16886 > http [ACK] Seq=309 Ack=3126 Win=65535 Len=0
894019 295.852478 77.197.128.204 -> 41.177.26.176 TCP 64 16886 > http [ACK] Seq=309 Ack=6085 Win=65535 Len=0
894245 295.934430 77.197.128.204 -> 41.177.26.176 TCP 64 16886 > http [ACK] Seq=309 Ack=8158 Win=65535 Len=0
894246 295.934474 77.197.128.204 -> 41.177.26.176 TCP 64 16886 > http [ACK] Seq=309 Ack=11434 Win=65535 Len=0
894255 295.934631 77.197.128.204 -> 41.177.26.176 TCP 64 16886 > http [RST, ACK] Seq=309 Ack=11434 Win=0 Len=0
894634 296.065828 77.197.128.204 -> 41.177.26.176 TCP 66 17133 > http [SYN] Seq=0 Win=65535 Len=0 MSS=1460 SACK_PERM=1
895151 296.147502 77.197.128.204 -> 41.177.26.176 TCP 64 17133 > http [ACK] Seq=1 Ack=1 Win=65535 Len=0
896601 296.610010 77.197.128.204 -> 41.177.26.176 TCP 64 17133 > http [ACK] Seq=318 Ack=2431 Win=65535 Len=0
896602 296.610184 77.197.128.204 -> 41.177.26.176 TCP 64 17133 > http [ACK] Seq=318 Ack=3896 Win=65535 Len=0
896774 296.691779 77.197.128.204 -> 41.177.26.176 TCP 64 17133 > http [ACK] Seq=318 Ack=6070 Win=65535 Len=0
896775 296.691903 77.197.128.204 -> 41.177.26.176 TCP 64 17133 > http [ACK] Seq=318 Ack=8569 Win=65535 Len=0
896963 296.773475 77.197.128.204 -> 41.177.26.176 TCP 64 17133 > http [ACK] Seq=318 Ack=11845 Win=65535 Len=0
896964 296.773835 77.197.128.204 -> 41.177.26.176 TCP 64 17133 > http [RST, ACK] Seq=318 Ack=11845 Win=0 Len=0
897257 296.900364 77.197.128.204 -> 41.177.26.176 TCP 66 17347 > http [SYN] Seq=0 Win=65535 Len=0 MSS=1460 SACK_PERM=1
897998 296.982223 77.197.128.204 -> 41.177.26.176 TCP 64 17347 > http [ACK] Seq=1 Ack=1 Win=65535 Len=0
901307 297.431826 77.197.128.204 -> 41.177.26.176 TCP 64 17347 > http [ACK] Seq=318 Ack=2431 Win=65535 Len=0
901309 297.431950 77.197.128.204 -> 41.177.26.176 TCP 64 17347 > http [ACK] Seq=318 Ack=3896 Win=65535 Len=0
901663 297.513666 77.197.128.204 -> 41.177.26.176 TCP 64 17347 > http [ACK] Seq=318 Ack=6070 Win=65535 Len=0
901664 297.513670 77.197.128.204 -> 41.177.26.176 TCP 64 17347 > http [ACK] Seq=318 Ack=8475 Win=65535 Len=0
901971 297.595528 77.197.128.204 -> 41.177.26.176 TCP 64 17347 > http [ACK] Seq=318 Ack=11355 Win=65535 Len=0
901972 297.595650 77.197.128.204 -> 41.177.26.176 TCP 64 17347 > http [RST, ACK] Seq=318 Ack=11355 Win=0 Len=0
902549 297.736399 77.197.128.204 -> 41.177.26.176 TCP 66 17602 > http [SYN] Seq=0 Win=65535 Len=0 MSS=1460 SACK_PERM=1
902841 297.818179 77.197.128.204 -> 41.177.26.176 TCP 64 17602 > http [ACK] Seq=1 Ack=1 Win=65535 Len=0
904492 298.231523 77.197.128.204 -> 41.177.26.176 TCP 64 17602 > http [ACK] Seq=318 Ack=2428 Win=65535 Len=0
904495 298.231762 77.197.128.204 -> 41.177.26.176 TCP 64 17602 > http [ACK] Seq=318 Ack=3893 Win=65535 Len=0
904716 298.313319 77.197.128.204 -> 41.177.26.176 TCP 64 17602 > http [ACK] Seq=318 Ack=5782 Win=65535 Len=0
904717 298.313353 77.197.128.204 -> 41.177.26.176 TCP 64 17602 > http [ACK] Seq=318 Ack=8172 Win=65535 Len=0
904718 298.313578 77.197.128.204 -> 41.177.26.176 TCP 64 17602 > http [ACK] Seq=318 Ack=11000 Win=65535 Len=0
904720 298.313769 77.197.128.204 -> 41.177.26.176 TCP 64 17602 > http [RST, ACK] Seq=318 Ack=11000 Win=0 Len=0
905521 298.516471 77.197.128.204 -> 41.177.26.176 TCP 66 17842 > http [SYN] Seq=0 Win=65535 Len=0 MSS=1460 SACK_PERM=1
905794 298.598082 77.197.128.204 -> 41.177.26.176 TCP 64 17842 > http [ACK] Seq=1 Ack=1 Win=65535 Len=0
907207 298.986489 77.197.128.204 -> 41.177.26.176 TCP 64 17842 > http [ACK] Seq=316 Ack=3893 Win=65535 Len=0
907401 299.068145 77.197.128.204 -> 41.177.26.176 TCP 64 17842 > http [ACK] Seq=316 Ack=6057 Win=65535 Len=0
907402 299.068351 77.197.128.204 -> 41.177.26.176 TCP 64 17842 > http [ACK] Seq=316 Ack=9562 Win=65535 Len=0
907512 299.149990 77.197.128.204 -> 41.177.26.176 TCP 64 17842 > http [ACK] Seq=316 Ack=11141 Win=65535 Len=0
907513 299.150295 77.197.128.204 -> 41.177.26.176 TCP 64 17842 > http [RST, ACK] Seq=316 Ack=11141 Win=0 Len=0
907796 299.345265 77.197.128.204 -> 41.177.26.176 TCP 66 18080 > http [SYN] Seq=0 Win=65535 Len=0 MSS=1460 SACK_PERM=1
907992 299.426840 77.197.128.204 -> 41.177.26.176 TCP 64 18080 > http [ACK] Seq=1 Ack=1 Win=65535 Len=0
908536 299.804228 77.197.128.204 -> 41.177.26.176 TCP 64 18080 > http [ACK] Seq=353 Ack=2431 Win=65535 Len=0
908537 299.804374 77.197.128.204 -> 41.177.26.176 TCP 64 18080 > http [ACK] Seq=353 Ack=4052 Win=65535 Len=0
908667 299.886011 77.197.128.204 -> 41.177.26.176 TCP 64 18080 > http [ACK] Seq=353 Ack=6216 Win=65535 Len=0
908668 299.886070 77.197.128.204 -> 41.177.26.176 TCP 64 18080 > http [ACK] Seq=353 Ack=8048 Win=65535 Len=0
908669 299.886181 77.197.128.204 -> 41.177.26.176 TCP 64 18080 > http [ACK] Seq=353 Ack=11319 Win=65535 Len=0
908670 299.886410 77.197.128.204 -> 41.177.26.176 TCP 64 18080 > http [RST, ACK] Seq=353 Ack=11319 Win=0 Len=0
908750 299.931810 77.197.128.204 -> 41.177.26.176 TCP 66 18248 > http [SYN] Seq=0 Win=65535 Len=0 MSS=1460 SACK_PERM=1
908914 300.013457 77.197.128.204 -> 41.177.26.176 TCP 64 18248 > http [ACK] Seq=1 Ack=1 Win=65535 Len=0
909479 300.414948 77.197.128.204 -> 41.177.26.176 TCP 64 18248 > http [ACK] Seq=319 Ack=3895 Win=65535 Len=0
909706 300.496695 77.197.128.204 -> 41.177.26.176 TCP 64 18248 > http [ACK] Seq=319 Ack=6069 Win=65535 Len=0
909709 300.496976 77.197.128.204 -> 41.177.26.176 TCP 64 18248 > http [ACK] Seq=319 Ack=7776 Win=65535 Len=0
909899 300.578344 77.197.128.204 -> 41.177.26.176 TCP 64 18248 > http [ACK] Seq=319 Ack=11074 Win=65535 Len=0
909901 300.578578 77.197.128.204 -> 41.177.26.176 TCP 64 18248 > http [RST, ACK] Seq=319 Ack=11074 Win=0 Len=0
910150 300.749127 77.197.128.204 -> 41.177.26.176 TCP 66 18503 > http [SYN] Seq=0 Win=65535 Len=0 MSS=1460 SACK_PERM=1
910261 300.830882 77.197.128.204 -> 41.177.26.176 TCP 64 18503 > http [ACK] Seq=1 Ack=1 Win=65535 Len=0
910743 301.200586 77.197.128.204 -> 41.177.26.176 TCP 64 18503 > http [ACK] Seq=316 Ack=2914 Win=65535 Len=0
910871 301.282284 77.197.128.204 -> 41.177.26.176 TCP 64 18503 > http [ACK] Seq=316 Ack=6064 Win=65535 Len=0
911029 301.364213 77.197.128.204 -> 41.177.26.176 TCP 64 18503 > http [ACK] Seq=316 Ack=11407 Win=65535 Len=0
911030 301.364449 77.197.128.204 -> 41.177.26.176 TCP 64 18503 > http [RST, ACK] Seq=316 Ack=11407 Win=0 Len=0
911500 301.539121 77.197.128.204 -> 41.177.26.176 TCP 66 18759 > http [SYN] Seq=0 Win=65535 Len=0 MSS=1460 SACK_PERM=1
911764 301.620864 77.197.128.204 -> 41.177.26.176 TCP 64 18759 > http [ACK] Seq=1 Ack=1 Win=65535 Len=0
913884 302.669241 77.197.128.204 -> 41.177.26.176 TCP 64 18759 > http [ACK] Seq=278 Ack=1568 Win=65535 Len=0
913937 302.679406 77.197.128.204 -> 41.177.26.176 TCP 64 18759 > http [ACK] Seq=278 Ack=2595 Win=64508 Len=0
913938 302.679546 77.197.128.204 -> 41.177.26.176 TCP 64 18759 > http [ACK] Seq=278 Ack=2956 Win=64147 Len=0
913984 302.722682 77.197.128.204 -> 41.177.26.176 TCP 64 18759 > http [ACK] Seq=278 Ack=3592 Win=65535 Len=0
914047 302.751068 77.197.128.204 -> 41.177.26.176 TCP 64 18759 > http [ACK] Seq=278 Ack=5976 Win=65535 Len=0
914057 302.761258 77.197.128.204 -> 41.177.26.176 TCP 64 18759 > http [ACK] Seq=278 Ack=9791 Win=65192 Len=0
914058 302.761263 77.197.128.204 -> 41.177.26.176 TCP 64 [TCP Dup ACK 914057#1] 18759 > http [ACK] Seq=278 Ack=9791 Win=65192 Len=0
915442 303.635855 77.197.128.204 -> 41.177.26.176 TCP 64 18759 > http [RST, ACK] Seq=278 Ack=9791 Win=0 Len=0
915817 303.866449 77.197.128.204 -> 41.177.26.176 TCP 66 19302 > http [SYN] Seq=0 Win=65535 Len=0 MSS=1460 SACK_PERM=1
915954 303.948083 77.197.128.204 -> 41.177.26.176 TCP 64 19302 > http [ACK] Seq=1 Ack=1 Win=65535 Len=0
916557 304.350303 77.197.128.204 -> 41.177.26.176 TCP 64 19302 > http [ACK] Seq=308 Ack=2431 Win=65535 Len=0
916558 304.350467 77.197.128.204 -> 41.177.26.176 TCP 64 19302 > http [ACK] Seq=308 Ack=3905 Win=65535 Len=0
916682 304.432187 77.197.128.204 -> 41.177.26.176 TCP 64 19302 > http [ACK] Seq=308 Ack=6069 Win=65535 Len=0
916683 304.432192 77.197.128.204 -> 41.177.26.176 TCP 64 19302 > http [ACK] Seq=308 Ack=11153 Win=63219 Len=0
916684 304.432196 77.197.128.204 -> 41.177.26.176 TCP 64 [TCP Window Update] 19302 > http [ACK] Seq=308 Ack=11153 Win=65535 Len=0
916965 304.566620 77.197.128.204 -> 41.177.26.176 TCP 64 19302 > http [RST, ACK] Seq=308 Ack=11153 Win=0 Len=0
920456 305.096447 77.197.128.204 -> 41.177.26.176 TCP 66 19982 > http [SYN] Seq=0 Win=65535 Len=0 MSS=1460 SACK_PERM=1
920588 305.178214 77.197.128.204 -> 41.177.26.176 TCP 64 19982 > http [ACK] Seq=1 Ack=1 Win=65535 Len=0
921197 305.580202 77.197.128.204 -> 41.177.26.176 TCP 64 19982 > http [ACK] Seq=316 Ack=3893 Win=65535 Len=0
921367 305.662012 77.197.128.204 -> 41.177.26.176 TCP 64 19982 > http [ACK] Seq=316 Ack=6057 Win=65535 Len=0
921368 305.662017 77.197.128.204 -> 41.177.26.176 TCP 64 19982 > http [ACK] Seq=316 Ack=8221 Win=63371 Len=0
921369 305.662021 77.197.128.204 -> 41.177.26.176 TCP 64 [TCP Window Update] 19982 > http [ACK] Seq=316 Ack=8221 Win=65535 Len=0
921513 305.744380 77.197.128.204 -> 41.177.26.176 TCP 64 19982 > http [ACK] Seq=316 Ack=11067 Win=65535 Len=0
921514 305.744647 77.197.128.204 -> 41.177.26.176 TCP 64 19982 > http [RST, ACK] Seq=316 Ack=11067 Win=0 Len=0
922232 306.093934 77.197.128.204 -> 41.177.26.176 TCP 66 20491 > http [SYN] Seq=0 Win=65535 Len=0 MSS=1460 SACK_PERM=1
922381 306.175934 77.197.128.204 -> 41.177.26.176 TCP 64 20491 > http [ACK] Seq=1 Ack=1 Win=65535 Len=0
922960 306.567454 77.197.128.204 -> 41.177.26.176 TCP 64 20491 > http [ACK] Seq=304 Ack=3893 Win=65535 Len=0
923078 306.649189 77.197.128.204 -> 41.177.26.176 TCP 64 20491 > http [ACK] Seq=304 Ack=6057 Win=65535 Len=0
923079 306.649299 77.197.128.204 -> 41.177.26.176 TCP 64 20491 > http [ACK] Seq=304 Ack=8739 Win=65535 Len=0
923276 306.731026 77.197.128.204 -> 41.177.26.176 TCP 64 20491 > http [ACK] Seq=304 Ack=11328 Win=62946 Len=0
923277 306.731031 77.197.128.204 -> 41.177.26.176 TCP 64 [TCP Window Update] 20491 > http [ACK] Seq=304 Ack=11328 Win=65535 Len=0
923278 306.731403 77.197.128.204 -> 41.177.26.176 TCP 64 20491 > http [RST, ACK] Seq=304 Ack=12010 Win=0 Len=0
923913 307.015087 77.197.128.204 -> 41.177.26.176 TCP 66 20917 > http [SYN] Seq=0 Win=65535 Len=0 MSS=1460 SACK_PERM=1
923992 307.096926 77.197.128.204 -> 41.177.26.176 TCP 64 20917 > http [ACK] Seq=1 Ack=1 Win=65535 Len=0
924571 307.531122 77.197.128.204 -> 41.177.26.176 TCP 64 20917 > http [ACK] Seq=318 Ack=2431 Win=65535 Len=0
924572 307.531254 77.197.128.204 -> 41.177.26.176 TCP 64 20917 > http [ACK] Seq=318 Ack=3896 Win=65535 Len=0
924656 307.612824 77.197.128.204 -> 41.177.26.176 TCP 64 20917 > http [ACK] Seq=318 Ack=6070 Win=65535 Len=0
924657 307.612948 77.197.128.204 -> 41.177.26.176 TCP 64 20917 > http [ACK] Seq=318 Ack=8292 Win=65535 Len=0
924658 307.612954 77.197.128.204 -> 41.177.26.176 TCP 64 20917 > http [ACK] Seq=318 Ack=11165 Win=64122 Len=0
924666 307.621861 77.197.128.204 -> 41.177.26.176 TCP 64 20917 > http [RST, ACK] Seq=318 Ack=11165 Win=0 Len=0
925299 307.980110 77.197.128.204 -> 41.177.26.176 TCP 66 21321 > http [SYN] Seq=0 Win=65535 Len=0 MSS=1460 SACK_PERM=1
925372 308.061915 77.197.128.204 -> 41.177.26.176 TCP 64 21321 > http [ACK] Seq=1 Ack=1 Win=65535 Len=0
925856 308.404713 77.197.128.204 -> 41.177.26.176 TCP 64 21321 > http [ACK] Seq=315 Ack=2245 Win=65535 Len=0
925857 308.404717 77.197.128.204 -> 41.177.26.176 TCP 64 21321 > http [ACK] Seq=315 Ack=3889 Win=65535 Len=0
925982 308.486622 77.197.128.204 -> 41.177.26.176 TCP 64 21321 > http [ACK] Seq=315 Ack=6055 Win=65535 Len=0
925983 308.486781 77.197.128.204 -> 41.177.26.176 TCP 64 21321 > http [ACK] Seq=315 Ack=8380 Win=63210 Len=0
925984 308.486785 77.197.128.204 -> 41.177.26.176 TCP 64 [TCP Window Update] 21321 > http [ACK] Seq=315 Ack=8380 Win=65535 Len=0
926068 308.519705 77.197.128.204 -> 41.177.26.176 TCP 64 21321 > http [ACK] Seq=315 Ack=9840 Win=65535 Len=0
926148 308.568547 77.197.128.204 -> 41.177.26.176 TCP 64 21321 > http [RST, ACK] Seq=315 Ack=11221 Win=0 Len=0
926814 308.843549 77.197.128.204 -> 41.177.26.176 TCP 66 21660 > http [SYN] Seq=0 Win=65535 Len=0 MSS=1460 SACK_PERM=1
926891 308.925975 77.197.128.204 -> 41.177.26.176 TCP 64 21660 > http [ACK] Seq=1 Ack=1 Win=65535 Len=0
930477 310.009086 77.197.128.204 -> 41.177.26.176 TCP 64 21660 > http [ACK] Seq=303 Ack=1547 Win=65535 Len=0
930520 310.021601 77.197.128.204 -> 41.177.26.176 TCP 64 21660 > http [ACK] Seq=303 Ack=2416 Win=64666 Len=0
930523 310.021694 77.197.128.204 -> 41.177.26.176 TCP 64 21660 > http [ACK] Seq=303 Ack=2711 Win=64371 Len=0
930526 310.022114 77.197.128.204 -> 41.177.26.176 TCP 64 21660 > http [ACK] Seq=303 Ack=3400 Win=65535 Len=0
930723 310.091104 77.197.128.204 -> 41.177.26.176 TCP 64 21660 > http [ACK] Seq=303 Ack=7354 Win=65535 Len=0
930744 310.103480 77.197.128.204 -> 41.177.26.176 TCP 64 21660 > http [ACK] Seq=303 Ack=9881 Win=65535 Len=0
930745 310.103767 77.197.128.204 -> 41.177.26.176 TCP 64 21660 > http [RST, ACK] Seq=303 Ack=9881 Win=0 Len=0
931080 310.236932 77.197.128.204 -> 41.177.26.176 TCP 66 22192 > http [SYN] Seq=0 Win=65535 Len=0 MSS=1460 SACK_PERM=1
931315 310.319579 77.197.128.204 -> 41.177.26.176 TCP 64 22192 > http [ACK] Seq=1 Ack=1 Win=65535 Len=0
932764 310.730142 77.197.128.204 -> 41.177.26.176 TCP 64 22192 > http [ACK] Seq=309 Ack=3915 Win=65535 Len=0
933066 310.813258 77.197.128.204 -> 41.177.26.176 TCP 64 22192 > http [ACK] Seq=309 Ack=6083 Win=65535 Len=0
933067 310.813417 77.197.128.204 -> 41.177.26.176 TCP 64 22192 > http [ACK] Seq=309 Ack=8436 Win=65535 Len=0
933226 310.897178 77.197.128.204 -> 41.177.26.176 TCP 64 22192 > http [ACK] Seq=309 Ack=11279 Win=65535 Len=0
933227 310.897650 77.197.128.204 -> 41.177.26.176 TCP 64 22192 > http [RST, ACK] Seq=309 Ack=11279 Win=0 Len=0
933534 311.039796 77.197.128.204 -> 41.177.26.176 TCP 66 22620 > http [SYN] Seq=0 Win=65535 Len=0 MSS=1460 SACK_PERM=1
933766 311.122629 77.197.128.204 -> 41.177.26.176 TCP 64 22620 > http [ACK] Seq=1 Ack=1 Win=65535 Len=0
939486 312.766007 77.197.128.204 -> 41.177.26.176 TCP 64 22620 > http [ACK] Seq=309 Ack=2191 Win=65535 Len=0
939488 312.766293 77.197.128.204 -> 41.177.26.176 TCP 64 22620 > http [ACK] Seq=309 Ack=2710 Win=65016 Len=0
939490 312.766431 77.197.128.204 -> 41.177.26.176 TCP 64 22620 > http [ACK] Seq=309 Ack=3816 Win=65535 Len=0
939812 312.848923 77.197.128.204 -> 41.177.26.176 TCP 64 22620 > http [ACK] Seq=309 Ack=6347 Win=65535 Len=0
939813 312.849101 77.197.128.204 -> 41.177.26.176 TCP 64 22620 > http [ACK] Seq=309 Ack=9267 Win=65535 Len=0
939814 312.849331 77.197.128.204 -> 41.177.26.176 TCP 64 22620 > http [RST, ACK] Seq=309 Ack=10236 Win=0 Len=0
941253 313.089184 77.197.128.204 -> 41.177.26.176 TCP 66 24404 > http [SYN] Seq=0 Win=65535 Len=0 MSS=1460 SACK_PERM=1
941888 313.171836 77.197.128.204 -> 41.177.26.176 TCP 64 24404 > http [ACK] Seq=1 Ack=1 Win=65535 Len=0
948768 314.685081 77.197.128.204 -> 41.177.26.176 TCP 64 24404 > http [ACK] Seq=309 Ack=1530 Win=65535 Len=0
948865 314.696763 77.197.128.204 -> 41.177.26.176 TCP 64 24404 > http [ACK] Seq=309 Ack=2501 Win=64564 Len=0
948866 314.696879 77.197.128.204 -> 41.177.26.176 TCP 64 24404 > http [ACK] Seq=309 Ack=2923 Win=64142 Len=0
948867 314.697073 77.197.128.204 -> 41.177.26.176 TCP 64 24404 > http [ACK] Seq=309 Ack=3887 Win=65535 Len=0
949132 314.766933 77.197.128.204 -> 41.177.26.176 TCP 64 24404 > http [ACK] Seq=309 Ack=6372 Win=65535 Len=0
949178 314.779209 77.197.128.204 -> 41.177.26.176 TCP 64 24404 > http [ACK] Seq=309 Ack=8446 Win=65535 Len=0
949179 314.779213 77.197.128.204 -> 41.177.26.176 TCP 64 24404 > http [ACK] Seq=309 Ack=9906 Win=65535 Len=0
949181 314.779357 77.197.128.204 -> 41.177.26.176 TCP 64 24404 > http [ACK] Seq=309 Ack=12326 Win=63115 Len=0
949454 314.859186 77.197.128.204 -> 41.177.26.176 TCP 64 [TCP Window Update] 24404 > http [ACK] Seq=309 Ack=12326 Win=65535 Len=0
949455 314.859291 77.197.128.204 -> 41.177.26.176 TCP 64 24404 > http [RST, ACK] Seq=309 Ack=12326 Win=0 Len=0
950239 315.100948 77.197.128.204 -> 41.177.26.176 TCP 66 25153 > http [SYN] Seq=0 Win=65535 Len=0 MSS=1460 SACK_PERM=1
950373 315.182713 77.197.128.204 -> 41.177.26.176 TCP 64 25153 > http [ACK] Seq=1 Ack=1 Win=65535 Len=0
951373 315.527612 77.197.128.204 -> 41.177.26.176 TCP 64 25153 > http [ACK] Seq=308 Ack=2431 Win=65535 Len=0
951598 315.609398 77.197.128.204 -> 41.177.26.176 TCP 64 25153 > http [ACK] Seq=308 Ack=6062 Win=65376 Len=0
951599 315.609402 77.197.128.204 -> 41.177.26.176 TCP 64 [TCP Dup ACK 951598#1] 25153 > http [ACK] Seq=308 Ack=6062 Win=65376 Len=0
951860 315.691104 77.197.128.204 -> 41.177.26.176 TCP 64 25153 > http [ACK] Seq=308 Ack=8982 Win=65535 Len=0
951861 315.691226 77.197.128.204 -> 41.177.26.176 TCP 64 25153 > http [ACK] Seq=308 Ack=11689 Win=65535 Len=0
951862 315.691415 77.197.128.204 -> 41.177.26.176 TCP 64 25153 > http [RST, ACK] Seq=308 Ack=11689 Win=0 Len=0
952574 315.899035 77.197.128.204 -> 41.177.26.176 TCP 66 25466 > http [SYN] Seq=0 Win=65535 Len=0 MSS=1460 SACK_PERM=1
952919 315.988185 77.197.128.204 -> 41.177.26.176 TCP 64 25466 > http [ACK] Seq=1 Ack=1 Win=65535 Len=0
954327 316.482233 77.197.128.204 -> 41.177.26.176 TCP 64 25466 > http [ACK] Seq=303 Ack=2427 Win=65535 Len=0
954328 316.482403 77.197.128.204 -> 41.177.26.176 TCP 64 25466 > http [ACK] Seq=303 Ack=3910 Win=65535 Len=0
954641 316.564005 77.197.128.204 -> 41.177.26.176 TCP 64 25466 > http [ACK] Seq=303 Ack=6084 Win=65535 Len=0
954643 316.564293 77.197.128.204 -> 41.177.26.176 TCP 64 25466 > http [ACK] Seq=303 Ack=10104 Win=61515 Len=0
954644 316.564298 77.197.128.204 -> 41.177.26.176 TCP 64 [TCP Window Update] 25466 > http [ACK] Seq=303 Ack=10104 Win=65535 Len=0
954855 316.645992 77.197.128.204 -> 41.177.26.176 TCP 64 25466 > http [RST, ACK] Seq=303 Ack=11493 Win=0 Len=0
955596 316.981959 77.197.128.204 -> 41.177.26.176 TCP 66 25842 > http [SYN] Seq=0 Win=65535 Len=0 MSS=1460 SACK_PERM=1
955934 317.063860 77.197.128.204 -> 41.177.26.176 TCP 64 25842 > http [ACK] Seq=1 Ack=1 Win=65535 Len=0
956703 317.538276 77.197.128.204 -> 41.177.26.176 TCP 64 25842 > http [ACK] Seq=305 Ack=2431 Win=65535 Len=0
956704 317.538445 77.197.128.204 -> 41.177.26.176 TCP 64 25842 > http [ACK] Seq=305 Ack=3896 Win=65535 Len=0
956798 317.620053 77.197.128.204 -> 41.177.26.176 TCP 64 25842 > http [ACK] Seq=305 Ack=6070 Win=65535 Len=0
956799 317.620058 77.197.128.204 -> 41.177.26.176 TCP 64 25842 > http [ACK] Seq=305 Ack=8150 Win=65535 Len=0
956800 317.620191 77.197.128.204 -> 41.177.26.176 TCP 64 25842 > http [ACK] Seq=305 Ack=10518 Win=64627 Len=0
956898 317.702090 77.197.128.204 -> 41.177.26.176 TCP 64 25842 > http [RST, ACK] Seq=305 Ack=11200 Win=0 Len=0
958374 318.199833 77.197.128.204 -> 41.177.26.176 TCP 66 26339 > http [SYN] Seq=0 Win=65535 Len=0 MSS=1460 SACK_PERM=1
958545 318.281631 77.197.128.204 -> 41.177.26.176 TCP 64 26339 > http [ACK] Seq=1 Ack=1 Win=65535 Len=0
959581 318.676543 77.197.128.204 -> 41.177.26.176 TCP 64 26339 > http [ACK] Seq=318 Ack=2922 Win=65535 Len=0
959792 318.758351 77.197.128.204 -> 41.177.26.176 TCP 64 26339 > http [ACK] Seq=318 Ack=6083 Win=65535 Len=0
960055 318.840327 77.197.128.204 -> 41.177.26.176 TCP 64 26339 > http [ACK] Seq=318 Ack=7828 Win=65535 Len=0
960056 318.840332 77.197.128.204 -> 41.177.26.176 TCP 64 26339 > http [ACK] Seq=318 Ack=11104 Win=65535 Len=0
960057 318.840626 77.197.128.204 -> 41.177.26.176 TCP 64 26339 > http [RST, ACK] Seq=318 Ack=11104 Win=0 Len=0
960362 318.999882 77.197.128.204 -> 41.177.26.176 TCP 66 26693 > http [SYN] Seq=0 Win=65535 Len=0 MSS=1460 SACK_PERM=1
960551 319.081499 77.197.128.204 -> 41.177.26.176 TCP 64 26693 > http [ACK] Seq=1 Ack=1 Win=65535 Len=0
961473 319.476176 77.197.128.204 -> 41.177.26.176 TCP 64 26693 > http [ACK] Seq=309 Ack=2431 Win=65535 Len=0
961474 319.476322 77.197.128.204 -> 41.177.26.176 TCP 64 26693 > http [ACK] Seq=309 Ack=3904 Win=65535 Len=0
961654 319.558034 77.197.128.204 -> 41.177.26.176 TCP 64 26693 > http [ACK] Seq=309 Ack=6074 Win=65535 Len=0
961655 319.558231 77.197.128.204 -> 41.177.26.176 TCP 64 26693 > http [ACK] Seq=309 Ack=10454 Win=64627 Len=0
961656 319.558236 77.197.128.204 -> 41.177.26.176 TCP 64 [TCP Dup ACK 961655#1] 26693 > http [ACK] Seq=309 Ack=10454 Win=64627 Len=0
961793 319.640108 77.197.128.204 -> 41.177.26.176 TCP 64 26693 > http [RST, ACK] Seq=309 Ack=11826 Win=0 Len=0
962052 319.808536 77.197.128.204 -> 41.177.26.176 TCP 66 27050 > http [SYN] Seq=0 Win=65535 Len=0 MSS=1460 SACK_PERM=1
962426 319.890458 77.197.128.204 -> 41.177.26.176 TCP 64 27050 > http [ACK] Seq=1 Ack=1 Win=65535 Len=0
963108 320.352693 77.197.128.204 -> 41.177.26.176 TCP 64 27050 > http [ACK] Seq=306 Ack=2431 Win=65535 Len=0
963206 320.434529 77.197.128.204 -> 41.177.26.176 TCP 64 27050 > http [ACK] Seq=306 Ack=6068 Win=65535 Len=0
963356 320.518681 77.197.128.204 -> 41.177.26.176 TCP 64 27050 > http [ACK] Seq=306 Ack=11107 Win=65535 Len=0
963357 320.518966 77.197.128.204 -> 41.177.26.176 TCP 64 27050 > http [RST, ACK] Seq=306 Ack=11107 Win=0 Len=0
963606 320.607185 77.197.128.204 -> 41.177.26.176 TCP 66 27400 > http [SYN] Seq=0 Win=65535 Len=0 MSS=1460 SACK_PERM=1
963845 320.689067 77.197.128.204 -> 41.177.26.176 TCP 64 27400 > http [ACK] Seq=1 Ack=1 Win=65535 Len=0
968213 322.370579 77.197.128.204 -> 41.177.26.176 TCP 64 27400 > http [ACK] Seq=314 Ack=1502 Win=65535 Len=0
968227 322.377254 77.197.128.204 -> 41.177.26.176 TCP 64 27400 > http [ACK] Seq=314 Ack=2447 Win=64590 Len=0
968228 322.377453 77.197.128.204 -> 41.177.26.176 TCP 64 27400 > http [ACK] Seq=314 Ack=2888 Win=64149 Len=0
968301 322.452625 77.197.128.204 -> 41.177.26.176 TCP 64 27400 > http [ACK] Seq=314 Ack=6354 Win=65535 Len=0
968311 322.459220 77.197.128.204 -> 41.177.26.176 TCP 64 27400 > http [ACK] Seq=314 Ack=10264 Win=64545 Len=0
968357 322.488501 77.197.128.204 -> 41.177.26.176 TCP 64 27400 > http [RST, ACK] Seq=314 Ack=10264 Win=0 Len=0
968711 322.636855 77.197.128.204 -> 41.177.26.176 TCP 66 28266 > http [SYN] Seq=0 Win=65535 Len=0 MSS=1460 SACK_PERM=1
968993 322.718760 77.197.128.204 -> 41.177.26.176 TCP 64 28266 > http [ACK] Seq=1 Ack=1 Win=65535 Len=0
969759 323.081132 77.197.128.204 -> 41.177.26.176 TCP 64 28266 > http [ACK] Seq=305 Ack=2431 Win=65535 Len=0
969762 323.081388 77.197.128.204 -> 41.177.26.176 TCP 64 28266 > http [ACK] Seq=305 Ack=3892 Win=65535 Len=0
969937 323.162838 77.197.128.204 -> 41.177.26.176 TCP 64 28266 > http [ACK] Seq=305 Ack=7522 Win=65535 Len=0
969939 323.163188 77.197.128.204 -> 41.177.26.176 TCP 64 28266 > http [ACK] Seq=305 Ack=11133 Win=65535 Len=0
970043 323.244687 77.197.128.204 -> 41.177.26.176 TCP 64 28266 > http [RST, ACK] Seq=305 Ack=11315 Win=0 Len=0
970352 323.475563 77.197.128.204 -> 41.177.26.176 TCP 66 28722 > http [SYN] Seq=0 Win=65535 Len=0 MSS=1460 SACK_PERM=1
970442 323.557635 77.197.128.204 -> 41.177.26.176 TCP 64 28722 > http [ACK] Seq=1 Ack=1 Win=65535 Len=0
971627 323.996953 77.197.128.204 -> 41.177.26.176 TCP 64 28722 > http [ACK] Seq=305 Ack=2431 Win=65535 Len=0
971630 323.997211 77.197.128.204 -> 41.177.26.176 TCP 64 28722 > http [ACK] Seq=305 Ack=3896 Win=65535 Len=0
972377 324.078580 77.197.128.204 -> 41.177.26.176 TCP 64 28722 > http [ACK] Seq=305 Ack=6070 Win=65535 Len=0
972381 324.078930 77.197.128.204 -> 41.177.26.176 TCP 64 28722 > http [ACK] Seq=305 Ack=8382 Win=65535 Len=0
973068 324.160364 77.197.128.204 -> 41.177.26.176 TCP 64 28722 > http [ACK] Seq=305 Ack=11495 Win=65535 Len=0
973069 324.161014 77.197.128.204 -> 41.177.26.176 TCP 64 28722 > http [RST, ACK] Seq=305 Ack=11495 Win=0 Len=0
973366 324.232095 77.197.128.204 -> 41.177.26.176 TCP 66 29085 > http [SYN] Seq=0 Win=65535 Len=0 MSS=1460 SACK_PERM=1
973869 324.313933 77.197.128.204 -> 41.177.26.176 TCP 64 29085 > http [ACK] Seq=1 Ack=1 Win=65535 Len=0
975294 324.693302 77.197.128.204 -> 41.177.26.176 TCP 64 29085 > http [ACK] Seq=353 Ack=2431 Win=65535 Len=0
975545 324.774964 77.197.128.204 -> 41.177.26.176 TCP 64 29085 > http [ACK] Seq=353 Ack=6209 Win=65535 Len=0
975731 324.856615 77.197.128.204 -> 41.177.26.176 TCP 64 29085 > http [ACK] Seq=353 Ack=8132 Win=65535 Len=0
975732 324.856781 77.197.128.204 -> 41.177.26.176 TCP 64 29085 > http [ACK] Seq=353 Ack=11403 Win=65535 Len=0
975733 324.856939 77.197.128.204 -> 41.177.26.176 TCP 64 29085 > http [RST, ACK] Seq=353 Ack=11403 Win=0 Len=0
976112 325.077232 77.197.128.204 -> 41.177.26.176 TCP 66 29526 > http [SYN] Seq=0 Win=65535 Len=0 MSS=1460 SACK_PERM=1
976242 325.159043 77.197.128.204 -> 41.177.26.176 TCP 64 29526 > http [ACK] Seq=1 Ack=1 Win=65535 Len=0
977017 325.543870 77.197.128.204 -> 41.177.26.176 TCP 64 29526 > http [ACK] Seq=316 Ack=2431 Win=65535 Len=0
977479 325.625649 77.197.128.204 -> 41.177.26.176 TCP 64 29526 > http [ACK] Seq=316 Ack=6050 Win=65535 Len=0
977613 325.707412 77.197.128.204 -> 41.177.26.176 TCP 64 29526 > http [ACK] Seq=316 Ack=8970 Win=65535 Len=0
977614 325.707417 77.197.128.204 -> 41.177.26.176 TCP 64 29526 > http [ACK] Seq=316 Ack=11013 Win=65535 Len=0
977615 325.707675 77.197.128.204 -> 41.177.26.176 TCP 64 29526 > http [RST, ACK] Seq=316 Ack=11013 Win=0 Len=0
978323 325.881535 77.197.128.204 -> 41.177.26.176 TCP 66 29891 > http [SYN] Seq=0 Win=65535 Len=0 MSS=1460 SACK_PERM=1
978495 325.963264 77.197.128.204 -> 41.177.26.176 TCP 64 29891 > http [ACK] Seq=1 Ack=1 Win=65535 Len=0
979256 326.434471 77.197.128.204 -> 41.177.26.176 TCP 64 29891 > http [ACK] Seq=355 Ack=2431 Win=65535 Len=0
979407 326.516272 77.197.128.204 -> 41.177.26.176 TCP 64 29891 > http [ACK] Seq=355 Ack=6225 Win=65535 Len=0
979408 326.516347 77.197.128.204 -> 41.177.26.176 TCP 64 29891 > http [ACK] Seq=355 Ack=7685 Win=65535 Len=0
979549 326.598067 77.197.128.204 -> 41.177.26.176 TCP 64 29891 > http [ACK] Seq=355 Ack=9507 Win=65535 Len=0
979550 326.598072 77.197.128.204 -> 41.177.26.176 TCP 64 29891 > http [ACK] Seq=355 Ack=11323 Win=65535 Len=0
979551 326.598495 77.197.128.204 -> 41.177.26.176 TCP 64 29891 > http [RST, ACK] Seq=355 Ack=11323 Win=0 Len=0
980037 326.911496 77.197.128.204 -> 41.177.26.176 TCP 66 30339 > http [SYN] Seq=0 Win=65535 Len=0 MSS=1460 SACK_PERM=1
980141 326.993247 77.197.128.204 -> 41.177.26.176 TCP 64 30339 > http [ACK] Seq=1 Ack=1 Win=65535 Len=0
981014 327.524168 77.197.128.204 -> 41.177.26.176 TCP 64 30339 > http [ACK] Seq=286 Ack=2921 Win=65535 Len=0
981015 327.524337 77.197.128.204 -> 41.177.26.176 TCP 64 30339 > http [ACK] Seq=286 Ack=3897 Win=64559 Len=0
981114 327.606163 77.197.128.204 -> 41.177.26.176 TCP 64 30339 > http [ACK] Seq=286 Ack=6817 Win=65535 Len=0
981115 327.606285 77.197.128.204 -> 41.177.26.176 TCP 64 30339 > http [ACK] Seq=286 Ack=10485 Win=65535 Len=0
981197 327.688253 77.197.128.204 -> 41.177.26.176 TCP 64 30339 > http [ACK] Seq=286 Ack=13396 Win=64228 Len=0
981198 327.688258 77.197.128.204 -> 41.177.26.176 TCP 64 [TCP Dup ACK 981197#1] 30339 > http [ACK] Seq=286 Ack=13396 Win=64228 Len=0
981199 327.688508 77.197.128.204 -> 41.177.26.176 TCP 64 30339 > http [RST, ACK] Seq=286 Ack=13396 Win=0 Len=0
981610 327.937437 77.197.128.204 -> 41.177.26.176 TCP 66 30947 > http [SYN] Seq=0 Win=65535 Len=0 MSS=1460 SACK_PERM=1
981815 328.019482 77.197.128.204 -> 41.177.26.176 TCP 64 30947 > http [ACK] Seq=1 Ack=1 Win=65535 Len=0
982746 328.399679 77.197.128.204 -> 41.177.26.176 TCP 64 30947 > http [ACK] Seq=304 Ack=2424 Win=65535 Len=0
982748 328.399906 77.197.128.204 -> 41.177.26.176 TCP 64 30947 > http [ACK] Seq=304 Ack=3886 Win=65535 Len=0
982941 328.481742 77.197.128.204 -> 41.177.26.176 TCP 64 30947 > http [ACK] Seq=304 Ack=5767 Win=65535 Len=0
982943 328.482025 77.197.128.204 -> 41.177.26.176 TCP 64 30947 > http [ACK] Seq=304 Ack=10147 Win=65535 Len=0
983761 328.567884 77.197.128.204 -> 41.177.26.176 TCP 64 30947 > http [RST, ACK] Seq=304 Ack=11582 Win=0 Len=0
984526 328.734554 77.197.128.204 -> 41.177.26.176 TCP 66 31439 > http [SYN] Seq=0 Win=65535 Len=0 MSS=1460 SACK_PERM=1
985014 328.816432 77.197.128.204 -> 41.177.26.176 TCP 64 31439 > http [ACK] Seq=1 Ack=1 Win=65535 Len=0
986411 329.246193 77.197.128.204 -> 41.177.26.176 TCP 64 31439 > http [ACK] Seq=305 Ack=2429 Win=65535 Len=0
986412 329.246343 77.197.128.204 -> 41.177.26.176 TCP 64 31439 > http [ACK] Seq=305 Ack=3894 Win=65535 Len=0
987134 329.328021 77.197.128.204 -> 41.177.26.176 TCP 64 31439 > http [ACK] Seq=305 Ack=6068 Win=65535 Len=0
987135 329.328026 77.197.128.204 -> 41.177.26.176 TCP 64 31439 > http [ACK] Seq=305 Ack=7840 Win=65535 Len=0
987136 329.328105 77.197.128.204 -> 41.177.26.176 TCP 64 31439 > http [ACK] Seq=305 Ack=11123 Win=65535 Len=0
987137 329.328299 77.197.128.204 -> 41.177.26.176 TCP 64 31439 > http [RST, ACK] Seq=305 Ack=11123 Win=0 Len=0
988004 329.540108 77.197.128.204 -> 41.177.26.176 TCP 66 31935 > http [SYN] Seq=0 Win=65535 Len=0 MSS=1460 SACK_PERM=1
988207 329.621910 77.197.128.204 -> 41.177.26.176 TCP 64 31935 > http [ACK] Seq=1 Ack=1 Win=65535 Len=0
989728 329.984868 77.197.128.204 -> 41.177.26.176 TCP 64 31935 > http [ACK] Seq=308 Ack=2431 Win=65535 Len=0
989731 329.985153 77.197.128.204 -> 41.177.26.176 TCP 64 31935 > http [ACK] Seq=308 Ack=3905 Win=65535 Len=0
989869 330.066575 77.197.128.204 -> 41.177.26.176 TCP 64 31935 > http [ACK] Seq=308 Ack=6069 Win=65535 Len=0
989870 330.066848 77.197.128.204 -> 41.177.26.176 TCP 64 31935 > http [ACK] Seq=308 Ack=11106 Win=65535 Len=0
989992 330.148482 77.197.128.204 -> 41.177.26.176 TCP 64 31935 > http [RST, ACK] Seq=308 Ack=11281 Win=0 Len=0
990472 330.372357 77.197.128.204 -> 41.177.26.176 TCP 66 32500 > http [SYN] Seq=0 Win=65535 Len=0 MSS=1460 SACK_PERM=1
990756 330.454026 77.197.128.204 -> 41.177.26.176 TCP 64 32500 > http [ACK] Seq=1 Ack=1 Win=65535 Len=0
991914 330.871671 77.197.128.204 -> 41.177.26.176 TCP 64 32500 > http [ACK] Seq=305 Ack=2431 Win=65535 Len=0
991915 330.871697 77.197.128.204 -> 41.177.26.176 TCP 64 32500 > http [ACK] Seq=305 Ack=3896 Win=65535 Len=0
992021 330.953579 77.197.128.204 -> 41.177.26.176 TCP 64 32500 > http [ACK] Seq=305 Ack=7530 Win=65535 Len=0
992023 330.953840 77.197.128.204 -> 41.177.26.176 TCP 64 32500 > http [ACK] Seq=305 Ack=10057 Win=65535 Len=0
992132 331.035863 77.197.128.204 -> 41.177.26.176 TCP 64 32500 > http [RST, ACK] Seq=305 Ack=11453 Win=0 Len=0
992441 331.182741 77.197.128.204 -> 41.177.26.176 TCP 66 32800 > http [SYN] Seq=0 Win=65535 Len=0 MSS=1460 SACK_PERM=1
992713 331.264568 77.197.128.204 -> 41.177.26.176 TCP 64 32800 > http [ACK] Seq=1 Ack=1 Win=65535 Len=0
993853 331.655450 77.197.128.204 -> 41.177.26.176 TCP 64 32800 > http [ACK] Seq=308 Ack=2431 Win=65535 Len=0
994094 331.737295 77.197.128.204 -> 41.177.26.176 TCP 64 32800 > http [ACK] Seq=308 Ack=6062 Win=65535 Len=0
994306 331.818977 77.197.128.204 -> 41.177.26.176 TCP 64 32800 > http [ACK] Seq=308 Ack=8129 Win=65535 Len=0
994308 331.819151 77.197.128.204 -> 41.177.26.176 TCP 64 32800 > http [ACK] Seq=308 Ack=10486 Win=65535 Len=0
994309 331.819249 77.197.128.204 -> 41.177.26.176 TCP 64 32800 > http [RST, ACK] Seq=308 Ack=11168 Win=0 Len=0
994921 331.981544 77.197.128.204 -> 41.177.26.176 TCP 66 32986 > http [SYN] Seq=0 Win=65535 Len=0 MSS=1460 SACK_PERM=1
995224 332.063343 77.197.128.204 -> 41.177.26.176 TCP 64 32986 > http [ACK] Seq=1 Ack=1 Win=65535 Len=0
995823 332.443278 77.197.128.204 -> 41.177.26.176 TCP 64 32986 > http [ACK] Seq=308 Ack=2431 Win=65535 Len=0
995824 332.443388 77.197.128.204 -> 41.177.26.176 TCP 64 32986 > http [ACK] Seq=308 Ack=3905 Win=65535 Len=0
995980 332.524911 77.197.128.204 -> 41.177.26.176 TCP 64 32986 > http [ACK] Seq=308 Ack=6069 Win=65535 Len=0
995986 332.525131 77.197.128.204 -> 41.177.26.176 TCP 64 32986 > http [ACK] Seq=308 Ack=8196 Win=65535 Len=0
995987 332.525135 77.197.128.204 -> 41.177.26.176 TCP 64 32986 > http [ACK] Seq=308 Ack=11116 Win=65535 Len=0
996161 332.606759 77.197.128.204 -> 41.177.26.176 TCP 64 32986 > http [RST, ACK] Seq=308 Ack=11460 Win=0 Len=0
998549 333.806111 77.197.128.204 -> 41.177.26.176 TCP 66 33307 > http [SYN] Seq=0 Win=65535 Len=0 MSS=1460 SACK_PERM=1
998699 333.887830 77.197.128.204 -> 41.177.26.176 TCP 64 33307 > http [ACK] Seq=1 Ack=1 Win=65535 Len=0
999495 334.287785 77.197.128.204 -> 41.177.26.176 TCP 64 33307 > http [ACK] Seq=353 Ack=2431 Win=65535 Len=0
999496 334.287900 77.197.128.204 -> 41.177.26.176 TCP 64 33307 > http [ACK] Seq=353 Ack=4058 Win=65535 Len=0
999773 334.369590 77.197.128.204 -> 41.177.26.176 TCP 64 33307 > http [ACK] Seq=353 Ack=6222 Win=65535 Len=0
999774 334.369595 77.197.128.204 -> 41.177.26.176 TCP 64 33307 > http [ACK] Seq=353 Ack=9757 Win=65535 Len=0
999775 334.369763 77.197.128.204 -> 41.177.26.176 TCP 64 33307 > http [ACK] Seq=353 Ack=11336 Win=65535 Len=0
1000227 334.638226 77.197.128.204 -> 41.177.26.176 TCP 64 33307 > http [RST, ACK] Seq=353 Ack=11336 Win=0 Len=0
1012154 339.897272 77.197.128.204 -> 41.177.26.176 TCP 66 36237 > http [SYN] Seq=0 Win=65535 Len=0 MSS=1460 SACK_PERM=1
1012303 339.978899 77.197.128.204 -> 41.177.26.176 TCP 64 36237 > http [ACK] Seq=1 Ack=1 Win=65535 Len=0
1012718 340.359641 77.197.128.204 -> 41.177.26.176 TCP 64 36237 > http [ACK] Seq=305 Ack=2431 Win=65535 Len=0
1012834 340.441374 77.197.128.204 -> 41.177.26.176 TCP 64 36237 > http [ACK] Seq=305 Ack=6055 Win=65535 Len=0
1013029 340.523114 77.197.128.204 -> 41.177.26.176 TCP 64 36237 > http [ACK] Seq=305 Ack=8076 Win=65535 Len=0
1013030 340.523141 77.197.128.204 -> 41.177.26.176 TCP 64 36237 > http [ACK] Seq=305 Ack=11166 Win=65535 Len=0
1013031 340.523465 77.197.128.204 -> 41.177.26.176 TCP 64 36237 > http [RST, ACK] Seq=305 Ack=11166 Win=0 Len=0
1016619 342.314757 77.197.128.204 -> 41.177.26.176 TCP 66 37407 > http [SYN] Seq=0 Win=65535 Len=0 MSS=1460 SACK_PERM=1
1016695 342.396490 77.197.128.204 -> 41.177.26.176 TCP 64 37407 > http [ACK] Seq=1 Ack=1 Win=65535 Len=0
1017381 342.819150 77.197.128.204 -> 41.177.26.176 TCP 64 37407 > http [ACK] Seq=310 Ack=2431 Win=65535 Len=0
1017520 342.900936 77.197.128.204 -> 41.177.26.176 TCP 64 37407 > http [ACK] Seq=310 Ack=6080 Win=65535 Len=0
1017668 342.983971 77.197.128.204 -> 41.177.26.176 TCP 64 37407 > http [ACK] Seq=310 Ack=10460 Win=65535 Len=0
1017670 342.984930 77.197.128.204 -> 41.177.26.176 TCP 64 37407 > http [RST, ACK] Seq=310 Ack=11280 Win=0 Len=0
1018025 343.218206 77.197.128.204 -> 41.177.26.176 TCP 66 37744 > http [SYN] Seq=0 Win=65535 Len=0 MSS=1460 SACK_PERM=1
1018229 343.299920 77.197.128.204 -> 41.177.26.176 TCP 64 37744 > http [ACK] Seq=1 Ack=1 Win=65535 Len=0
1019105 343.697370 77.197.128.204 -> 41.177.26.176 TCP 64 37744 > http [ACK] Seq=355 Ack=2429 Win=65535 Len=0
1019236 343.779151 77.197.128.204 -> 41.177.26.176 TCP 64 37744 > http [ACK] Seq=355 Ack=5936 Win=65535 Len=0
1019497 343.860850 77.197.128.204 -> 41.177.26.176 TCP 64 37744 > http [ACK] Seq=355 Ack=8147 Win=65535 Len=0
1019498 343.860855 77.197.128.204 -> 41.177.26.176 TCP 64 37744 > http [ACK] Seq=355 Ack=10716 Win=65535 Len=0
1019499 343.861046 77.197.128.204 -> 41.177.26.176 TCP 64 37744 > http [RST, ACK] Seq=355 Ack=10716 Win=0 Len=0
1019848 344.055781 77.197.128.204 -> 41.177.26.176 TCP 66 38025 > http [SYN] Seq=0 Win=65535 Len=0 MSS=1460 SACK_PERM=1
1020025 344.137828 77.197.128.204 -> 41.177.26.176 TCP 64 38025 > http [ACK] Seq=1 Ack=1 Win=65535 Len=0
1021124 344.551657 77.197.128.204 -> 41.177.26.176 TCP 64 38025 > http [ACK] Seq=309 Ack=3130 Win=65535 Len=0
1021207 344.633417 77.197.128.204 -> 41.177.26.176 TCP 64 38025 > http [ACK] Seq=309 Ack=6089 Win=65535 Len=0
1021344 344.716191 77.197.128.204 -> 41.177.26.176 TCP 64 38025 > http [ACK] Seq=309 Ack=7798 Win=65535 Len=0
1021345 344.716325 77.197.128.204 -> 41.177.26.176 TCP 64 38025 > http [ACK] Seq=309 Ack=11074 Win=65535 Len=0
1021346 344.716518 77.197.128.204 -> 41.177.26.176 TCP 64 38025 > http [RST, ACK] Seq=309 Ack=11074 Win=0 Len=0
1021511 344.859039 77.197.128.204 -> 41.177.26.176 TCP 66 38333 > http [SYN] Seq=0 Win=65535 Len=0 MSS=1460 SACK_PERM=1
1021609 344.940627 77.197.128.204 -> 41.177.26.176 TCP 64 38333 > http [ACK] Seq=1 Ack=1 Win=65535 Len=0
