315026 107.549389 77.197.128.47 -> 41.177.26.91 TCP 66 59928 > http [SYN] Seq=0 Win=65535 Len=0 MSS=1460 SACK_PERM=1
315173 107.632393 77.197.128.47 -> 41.177.26.91 TCP 64 59928 > http [ACK] Seq=1 Ack=1 Win=65535 Len=0
315672 107.801700 77.197.128.47 -> 41.177.26.91 TCP 64 59928 > http [ACK] Seq=321 Ack=2921 Win=65535 Len=0
315929 107.883367 77.197.128.47 -> 41.177.26.91 TCP 64 59928 > http [ACK] Seq=321 Ack=5841 Win=65535 Len=0
315931 107.883521 77.197.128.47 -> 41.177.26.91 TCP 64 59928 > http [ACK] Seq=321 Ack=8761 Win=65535 Len=0
316333 107.965150 77.197.128.47 -> 41.177.26.91 TCP 64 59928 > http [ACK] Seq=321 Ack=11681 Win=65535 Len=0
316334 107.965277 77.197.128.47 -> 41.177.26.91 TCP 64 59928 > http [ACK] Seq=321 Ack=15847 Win=65535 Len=0
316337 107.965903 77.197.128.47 -> 41.177.26.91 TCP 64 59928 > http [RST, ACK] Seq=321 Ack=15847 Win=0 Len=0
838271 274.654569 77.197.128.47 -> 244.3.210.197 TCP 66 46582 > http [SYN] Seq=0 Win=65535 Len=0 MSS=1460 SACK_PERM=1
838407 274.733461 77.197.128.47 -> 244.3.210.197 TCP 64 46582 > http [ACK] Seq=1 Ack=1 Win=65535 Len=0
839439 275.193187 77.197.128.47 -> 244.3.210.197 TCP 64 46582 > http [ACK] Seq=340 Ack=2921 Win=65535 Len=0
839716 275.272540 77.197.128.47 -> 244.3.210.197 TCP 64 46582 > http [ACK] Seq=340 Ack=4381 Win=65535 Len=0
839721 275.272648 77.197.128.47 -> 244.3.210.197 TCP 64 46582 > http [ACK] Seq=340 Ack=7301 Win=65535 Len=0
839916 275.351667 77.197.128.47 -> 244.3.210.197 TCP 64 46582 > http [ACK] Seq=340 Ack=13141 Win=62615 Len=0
840170 275.430444 77.197.128.47 -> 244.3.210.197 TCP 64 46582 > http [ACK] Seq=340 Ack=14623 Win=61133 Len=0
840183 275.437770 77.197.128.47 -> 244.3.210.197 TCP 64 [TCP Window Update] 46582 > http [ACK] Seq=340 Ack=14623 Win=64605 Len=0
840184 275.437775 77.197.128.47 -> 244.3.210.197 TCP 64 [TCP Dup ACK 840183#1] 46582 > http [ACK] Seq=340 Ack=14623 Win=64605 Len=0
840192 275.437975 77.197.128.47 -> 244.3.210.197 TCP 64 46582 > http [RST, ACK] Seq=340 Ack=14623 Win=0 Len=0
1002514 336.012287 77.197.128.47 -> 41.177.26.15 TCP 66 itm-mccs > http [SYN] Seq=0 Win=65535 Len=0 MSS=1460 SACK_PERM=1
1002675 336.094157 77.197.128.47 -> 41.177.26.15 TCP 64 itm-mccs > http [ACK] Seq=1 Ack=1 Win=65535 Len=0
1003753 336.586532 77.197.128.47 -> 41.177.26.15 TCP 64 itm-mccs > http [ACK] Seq=309 Ack=2921 Win=65535 Len=0
1003884 336.668408 77.197.128.47 -> 41.177.26.15 TCP 64 itm-mccs > http [ACK] Seq=309 Ack=5841 Win=65535 Len=0
1003885 336.668413 77.197.128.47 -> 41.177.26.15 TCP 64 itm-mccs > http [ACK] Seq=309 Ack=8465 Win=65535 Len=0
1005266 336.750622 77.197.128.47 -> 41.177.26.15 TCP 64 itm-mccs > http [ACK] Seq=309 Ack=12845 Win=64627 Len=0
1005267 336.750627 77.197.128.47 -> 41.177.26.15 TCP 64 [TCP Dup ACK 1005266#1] itm-mccs > http [ACK] Seq=309 Ack=12845 Win=64627 Len=0
1005268 336.750631 77.197.128.47 -> 41.177.26.15 TCP 64 itm-mccs > http [ACK] Seq=309 Ack=15765 Win=61707 Len=0
1005432 336.758113 77.197.128.47 -> 41.177.26.15 TCP 64 itm-mccs > http [ACK] Seq=309 Ack=16665 Win=64279 Len=0
1005433 336.758117 77.197.128.47 -> 41.177.26.15 TCP 64 [TCP Dup ACK 1005432#1] itm-mccs > http [ACK] Seq=309 Ack=16665 Win=64279 Len=0
1005990 336.832340 77.197.128.47 -> 41.177.26.15 TCP 64 itm-mccs > http [ACK] Seq=309 Ack=21045 Win=65535 Len=0
1005991 336.832437 77.197.128.47 -> 41.177.26.15 TCP 64 itm-mccs > http [ACK] Seq=309 Ack=24865 Win=65527 Len=0
1005992 336.832442 77.197.128.47 -> 41.177.26.15 TCP 64 [TCP Dup ACK 1005991#1] itm-mccs > http [ACK] Seq=309 Ack=24865 Win=65527 Len=0
1006040 336.839710 77.197.128.47 -> 41.177.26.15 TCP 64 itm-mccs > http [ACK] Seq=309 Ack=27785 Win=65535 Len=0
1006201 336.914210 77.197.128.47 -> 41.177.26.15 TCP 64 itm-mccs > http [ACK] Seq=309 Ack=33065 Win=65527 Len=0
1006202 336.914215 77.197.128.47 -> 41.177.26.15 TCP 64 [TCP Dup ACK 1006201#1] itm-mccs > http [ACK] Seq=309 Ack=33065 Win=65527 Len=0
1006203 336.914375 77.197.128.47 -> 41.177.26.15 TCP 64 itm-mccs > http [ACK] Seq=309 Ack=40365 Win=65535 Len=0
1006233 336.921594 77.197.128.47 -> 41.177.26.15 TCP 64 itm-mccs > http [ACK] Seq=309 Ack=42725 Win=65527 Len=0
1006234 336.921600 77.197.128.47 -> 41.177.26.15 TCP 64 [TCP Dup ACK 1006233#1] itm-mccs > http [ACK] Seq=309 Ack=42725 Win=65527 Len=0
1006427 336.995911 77.197.128.47 -> 41.177.26.15 TCP 64 itm-mccs > http [ACK] Seq=309 Ack=49465 Win=65535 Len=0
1006428 336.995996 77.197.128.47 -> 41.177.26.15 TCP 64 itm-mccs > http [ACK] Seq=309 Ack=50925 Win=65535 Len=0
1006435 336.996253 77.197.128.47 -> 41.177.26.15 TCP 64 itm-mccs > http [ACK] Seq=309 Ack=57665 Win=65535 Len=0
1006436 336.996257 77.197.128.47 -> 41.177.26.15 TCP 64 itm-mccs > http [ACK] Seq=309 Ack=60585 Win=62615 Len=0
1006437 336.996261 77.197.128.47 -> 41.177.26.15 TCP 64 [TCP Window Update] itm-mccs > http [ACK] Seq=309 Ack=60585 Win=65535 Len=0
1006455 337.003439 77.197.128.47 -> 41.177.26.15 TCP 64 itm-mccs > http [ACK] Seq=309 Ack=63505 Win=65535 Len=0
1006558 337.077573 77.197.128.47 -> 41.177.26.15 TCP 64 itm-mccs > http [ACK] Seq=309 Ack=65865 Win=65535 Len=0
1006559 337.077735 77.197.128.47 -> 41.177.26.15 TCP 64 itm-mccs > http [ACK] Seq=309 Ack=71705 Win=62607 Len=0
1006560 337.077885 77.197.128.47 -> 41.177.26.15 TCP 64 [TCP Window Update] itm-mccs > http [ACK] Seq=309 Ack=71705 Win=65535 Len=0
1006561 337.077889 77.197.128.47 -> 41.177.26.15 TCP 64 itm-mccs > http [ACK] Seq=309 Ack=74065 Win=65535 Len=0
1006571 337.078170 77.197.128.47 -> 41.177.26.15 TCP 64 itm-mccs > http [ACK] Seq=309 Ack=78445 Win=65535 Len=0
1006575 337.078339 77.197.128.47 -> 41.177.26.15 TCP 64 itm-mccs > http [ACK] Seq=309 Ack=82265 Win=65535 Len=0
1006583 337.078647 77.197.128.47 -> 41.177.26.15 TCP 64 itm-mccs > http [ACK] Seq=309 Ack=85185 Win=65535 Len=0
1006587 337.079021 77.197.128.47 -> 41.177.26.15 TCP 64 itm-mccs > http [ACK] Seq=309 Ack=88105 Win=65535 Len=0
1006593 337.085105 77.197.128.47 -> 41.177.26.15 TCP 64 itm-mccs > http [ACK] Seq=309 Ack=90465 Win=65535 Len=0
1006668 337.159448 77.197.128.47 -> 41.177.26.15 TCP 64 itm-mccs > http [ACK] Seq=309 Ack=93385 Win=65535 Len=0
1006669 337.159468 77.197.128.47 -> 41.177.26.15 TCP 64 itm-mccs > http [ACK] Seq=309 Ack=98665 Win=63167 Len=0
1006670 337.159560 77.197.128.47 -> 41.177.26.15 TCP 64 [TCP Window Update] itm-mccs > http [ACK] Seq=309 Ack=98665 Win=65535 Len=0
1006671 337.159565 77.197.128.47 -> 41.177.26.15 TCP 64 itm-mccs > http [ACK] Seq=309 Ack=101585 Win=65535 Len=0
1006672 337.159568 77.197.128.47 -> 41.177.26.15 TCP 64 itm-mccs > http [ACK] Seq=309 Ack=106865 Win=62267 Len=0
1006680 337.159800 77.197.128.47 -> 41.177.26.15 TCP 64 [TCP Window Update] itm-mccs > http [ACK] Seq=309 Ack=106865 Win=65535 Len=0
1006681 337.159804 77.197.128.47 -> 41.177.26.15 TCP 64 itm-mccs > http [ACK] Seq=309 Ack=109785 Win=65535 Len=0
1006689 337.159958 77.197.128.47 -> 41.177.26.15 TCP 64 itm-mccs > http [ACK] Seq=309 Ack=112705 Win=65535 Len=0
1006693 337.160039 77.197.128.47 -> 41.177.26.15 TCP 64 itm-mccs > http [ACK] Seq=309 Ack=116525 Win=64067 Len=0
1006694 337.160044 77.197.128.47 -> 41.177.26.15 TCP 64 [TCP Window Update] itm-mccs > http [ACK] Seq=309 Ack=116525 Win=65535 Len=0
1006697 337.160265 77.197.128.47 -> 41.177.26.15 TCP 64 itm-mccs > http [ACK] Seq=309 Ack=120905 Win=64627 Len=0
1006698 337.160270 77.197.128.47 -> 41.177.26.15 TCP 64 [TCP Dup ACK 1006697#1] itm-mccs > http [ACK] Seq=309 Ack=120905 Win=64627 Len=0
1006707 337.160669 77.197.128.47 -> 41.177.26.15 TCP 64 itm-mccs > http [ACK] Seq=309 Ack=123265 Win=65535 Len=0
1006709 337.160692 77.197.128.47 -> 41.177.26.15 TCP 64 itm-mccs > http [ACK] Seq=309 Ack=126185 Win=65535 Len=0
1006733 337.166802 77.197.128.47 -> 41.177.26.15 TCP 64 itm-mccs > http [ACK] Seq=309 Ack=130565 Win=64067 Len=0
1006734 337.166807 77.197.128.47 -> 41.177.26.15 TCP 64 [TCP Window Update] itm-mccs > http [ACK] Seq=309 Ack=130565 Win=65535 Len=0
1006929 337.241146 77.197.128.47 -> 41.177.26.15 TCP 64 itm-mccs > http [ACK] Seq=309 Ack=132925 Win=65535 Len=0
1006930 337.241305 77.197.128.47 -> 41.177.26.15 TCP 64 itm-mccs > http [ACK] Seq=309 Ack=138765 Win=65527 Len=0
1006931 337.241309 77.197.128.47 -> 41.177.26.15 TCP 64 [TCP Dup ACK 1006930#1] itm-mccs > http [ACK] Seq=309 Ack=138765 Win=65527 Len=0
1006932 337.241313 77.197.128.47 -> 41.177.26.15 TCP 64 itm-mccs > http [ACK] Seq=309 Ack=142585 Win=65535 Len=0
1006934 337.241448 77.197.128.47 -> 41.177.26.15 TCP 64 itm-mccs > http [ACK] Seq=309 Ack=147865 Win=65187 Len=0
1006935 337.241452 77.197.128.47 -> 41.177.26.15 TCP 64 [TCP Dup ACK 1006934#1] itm-mccs > http [ACK] Seq=309 Ack=147865 Win=65187 Len=0
1006936 337.241456 77.197.128.47 -> 41.177.26.15 TCP 64 itm-mccs > http [ACK] Seq=309 Ack=150785 Win=62267 Len=0
1006944 337.241627 77.197.128.47 -> 41.177.26.15 TCP 64 itm-mccs > http [ACK] Seq=309 Ack=153705 Win=59347 Len=0
1006952 337.241789 77.197.128.47 -> 41.177.26.15 TCP 64 itm-mccs > http [ACK] Seq=309 Ack=156065 Win=56987 Len=0
1006958 337.241930 77.197.128.47 -> 41.177.26.15 TCP 64 itm-mccs > http [ACK] Seq=309 Ack=160445 Win=52607 Len=0
1006959 337.242188 77.197.128.47 -> 41.177.26.15 TCP 64 itm-mccs > http [ACK] Seq=309 Ack=167185 Win=45867 Len=0
1006960 337.242192 77.197.128.47 -> 41.177.26.15 TCP 64 itm-mccs > http [ACK] Seq=309 Ack=170105 Win=42947 Len=0
1006962 337.242387 77.197.128.47 -> 41.177.26.15 TCP 64 itm-mccs > http [ACK] Seq=309 Ack=172465 Win=40587 Len=0
1006963 337.242548 77.197.128.47 -> 41.177.26.15 TCP 64 itm-mccs > http [ACK] Seq=309 Ack=180665 Win=32387 Len=0
1006974 337.244455 77.197.128.47 -> 41.177.26.15 TCP 64 [TCP Window Update] itm-mccs > http [ACK] Seq=309 Ack=180665 Win=35859 Len=0
1006975 337.244533 77.197.128.47 -> 41.177.26.15 TCP 64 [TCP Window Update] itm-mccs > http [ACK] Seq=309 Ack=180665 Win=65535 Len=0
1007011 337.248571 77.197.128.47 -> 41.177.26.15 TCP 64 itm-mccs > http [ACK] Seq=309 Ack=185045 Win=65535 Len=0
1007172 337.322904 77.197.128.47 -> 41.177.26.15 TCP 64 itm-mccs > http [ACK] Seq=309 Ack=188865 Win=65527 Len=0
1007173 337.322909 77.197.128.47 -> 41.177.26.15 TCP 64 [TCP Dup ACK 1007172#1] itm-mccs > http [ACK] Seq=309 Ack=188865 Win=65527 Len=0
1007174 337.323023 77.197.128.47 -> 41.177.26.15 TCP 64 itm-mccs > http [ACK] Seq=309 Ack=194705 Win=65535 Len=0
1007176 337.323136 77.197.128.47 -> 41.177.26.15 TCP 64 itm-mccs > http [ACK] Seq=309 Ack=197065 Win=65527 Len=0
1007177 337.323140 77.197.128.47 -> 41.177.26.15 TCP 64 [TCP Dup ACK 1007176#1] itm-mccs > http [ACK] Seq=309 Ack=197065 Win=65527 Len=0
1007184 337.323299 77.197.128.47 -> 41.177.26.15 TCP 64 itm-mccs > http [ACK] Seq=309 Ack=202905 Win=65535 Len=0
1007185 337.323303 77.197.128.47 -> 41.177.26.15 TCP 64 itm-mccs > http [ACK] Seq=309 Ack=206725 Win=64075 Len=0
1007186 337.323308 77.197.128.47 -> 41.177.26.15 TCP 64 [TCP Window Update] itm-mccs > http [ACK] Seq=309 Ack=206725 Win=65535 Len=0
1007187 337.323312 77.197.128.47 -> 41.177.26.15 TCP 64 itm-mccs > http [ACK] Seq=309 Ack=211105 Win=65535 Len=0
1007191 337.326093 77.197.128.47 -> 41.177.26.15 TCP 64 itm-mccs > http [ACK] Seq=309 Ack=213465 Win=65535 Len=0
1007192 337.326272 77.197.128.47 -> 41.177.26.15 TCP 64 itm-mccs > http [ACK] Seq=309 Ack=221665 Win=60247 Len=0
1007193 337.326277 77.197.128.47 -> 41.177.26.15 TCP 64 [TCP Window Update] itm-mccs > http [ACK] Seq=309 Ack=221665 Win=65535 Len=0
1007194 337.326363 77.197.128.47 -> 41.177.26.15 TCP 64 itm-mccs > http [ACK] Seq=309 Ack=224585 Win=65535 Len=0
1007195 337.326368 77.197.128.47 -> 41.177.26.15 TCP 64 itm-mccs > http [ACK] Seq=309 Ack=227505 Win=65535 Len=0
1007196 337.326531 77.197.128.47 -> 41.177.26.15 TCP 64 itm-mccs > http [ACK] Seq=309 Ack=231325 Win=64067 Len=0
1007197 337.326535 77.197.128.47 -> 41.177.26.15 TCP 64 [TCP Window Update] itm-mccs > http [ACK] Seq=309 Ack=231325 Win=65535 Len=0
1007198 337.326539 77.197.128.47 -> 41.177.26.15 TCP 64 itm-mccs > http [ACK] Seq=309 Ack=235705 Win=65535 Len=0
1007199 337.326543 77.197.128.47 -> 41.177.26.15 TCP 64 itm-mccs > http [ACK] Seq=309 Ack=239525 Win=64075 Len=0
1007200 337.326687 77.197.128.47 -> 41.177.26.15 TCP 64 itm-mccs > http [ACK] Seq=309 Ack=245365 Win=58235 Len=0
1007201 337.326849 77.197.128.47 -> 41.177.26.15 TCP 64 [TCP Window Update] itm-mccs > http [ACK] Seq=309 Ack=245365 Win=61707 Len=0
1007202 337.326948 77.197.128.47 -> 41.177.26.15 TCP 64 [TCP Window Update] itm-mccs > http [ACK] Seq=309 Ack=245365 Win=65535 Len=0
1007211 337.330346 77.197.128.47 -> 41.177.26.15 TCP 64 itm-mccs > http [ACK] Seq=309 Ack=247725 Win=65535 Len=0
1007627 337.404557 77.197.128.47 -> 41.177.26.15 TCP 64 itm-mccs > http [ACK] Seq=309 Ack=250645 Win=65535 Len=0
1007629 337.404689 77.197.128.47 -> 41.177.26.15 TCP 64 itm-mccs > http [ACK] Seq=309 Ack=254465 Win=64627 Len=0
1007630 337.404715 77.197.128.47 -> 41.177.26.15 TCP 64 [TCP Dup ACK 1007629#1] itm-mccs > http [ACK] Seq=309 Ack=254465 Win=64627 Len=0
1007631 337.404719 77.197.128.47 -> 41.177.26.15 TCP 64 itm-mccs > http [ACK] Seq=309 Ack=258845 Win=65535 Len=0
1007632 337.404850 77.197.128.47 -> 41.177.26.15 TCP 64 itm-mccs > http [ACK] Seq=309 Ack=262442 Win=65535 Len=0
1007655 337.421557 77.197.128.47 -> 41.177.26.15 TCP 64 itm-mccs > http [RST, ACK] Seq=309 Ack=262442 Win=0 Len=0
1013365 340.601461 77.197.128.47 -> 41.177.26.15 TCP 66 5650 > http [SYN] Seq=0 Win=65535 Len=0 MSS=1460 SACK_PERM=1
1013597 340.683135 77.197.128.47 -> 41.177.26.15 TCP 64 5650 > http [ACK] Seq=1 Ack=1 Win=65535 Len=0
1014185 340.970730 77.197.128.47 -> 41.177.26.15 TCP 64 5650 > http [ACK] Seq=308 Ack=4381 Win=65535 Len=0
1014356 341.052620 77.197.128.47 -> 41.177.26.15 TCP 64 5650 > http [ACK] Seq=308 Ack=8465 Win=64923 Len=0
1014357 341.052624 77.197.128.47 -> 41.177.26.15 TCP 64 [TCP Dup ACK 1014356#1] 5650 > http [ACK] Seq=308 Ack=8465 Win=64923 Len=0
1014426 341.134627 77.197.128.47 -> 41.177.26.15 TCP 64 5650 > http [ACK] Seq=308 Ack=14331 Win=63141 Len=0
1014427 341.134650 77.197.128.47 -> 41.177.26.15 TCP 64 [TCP Dup ACK 1014426#1] 5650 > http [ACK] Seq=308 Ack=14331 Win=63141 Len=0
1014589 341.285038 77.197.128.47 -> 41.177.26.15 TCP 64 [TCP Window Update] 5650 > http [ACK] Seq=308 Ack=14331 Win=65535 Len=0
1014590 341.285360 77.197.128.47 -> 41.177.26.15 TCP 64 5650 > http [RST, ACK] Seq=308 Ack=14331 Win=0 Len=0
1016086 341.977201 77.197.128.47 -> 41.177.26.15 TCP 66 6385 > http [SYN] Seq=0 Win=65535 Len=0 MSS=1460 SACK_PERM=1
1016212 342.058751 77.197.128.47 -> 41.177.26.15 TCP 64 6385 > http [ACK] Seq=1 Ack=1 Win=65535 Len=0
1016594 342.296727 77.197.128.47 -> 41.177.26.15 TCP 64 6385 > http [ACK] Seq=308 Ack=4381 Win=65535 Len=0
1016669 342.378586 77.197.128.47 -> 41.177.26.15 TCP 64 6385 > http [ACK] Seq=308 Ack=7301 Win=65535 Len=0
1016670 342.378590 77.197.128.47 -> 41.177.26.15 TCP 64 6385 > http [ACK] Seq=308 Ack=9925 Win=65535 Len=0
1016763 342.460501 77.197.128.47 -> 41.177.26.15 TCP 64 6385 > http [ACK] Seq=308 Ack=12845 Win=62615 Len=0
1016764 342.460654 77.197.128.47 -> 41.177.26.15 TCP 64 6385 > http [ACK] Seq=308 Ack=18125 Win=57335 Len=0
1016776 342.470048 77.197.128.47 -> 41.177.26.15 TCP 64 [TCP Window Update] 6385 > http [ACK] Seq=308 Ack=18125 Win=60807 Len=0
1016777 342.470053 77.197.128.47 -> 41.177.26.15 TCP 64 [TCP Window Update] 6385 > http [ACK] Seq=308 Ack=18125 Win=65535 Len=0
1016935 342.542346 77.197.128.47 -> 41.177.26.15 TCP 64 6385 > http [ACK] Seq=308 Ack=22505 Win=65535 Len=0
1016936 342.542351 77.197.128.47 -> 41.177.26.15 TCP 64 6385 > http [ACK] Seq=308 Ack=24865 Win=65535 Len=0
1016937 342.542493 77.197.128.47 -> 41.177.26.15 TCP 64 6385 > http [ACK] Seq=308 Ack=26325 Win=65535 Len=0
1016938 342.542497 77.197.128.47 -> 41.177.26.15 TCP 64 6385 > http [ACK] Seq=308 Ack=29245 Win=65535 Len=0
1017119 342.624179 77.197.128.47 -> 41.177.26.15 TCP 64 6385 > http [ACK] Seq=308 Ack=35985 Win=65535 Len=0
1017120 342.624345 77.197.128.47 -> 41.177.26.15 TCP 64 6385 > http [ACK] Seq=308 Ack=41265 Win=60255 Len=0
1017121 342.624350 77.197.128.47 -> 41.177.26.15 TCP 64 [TCP Window Update] 6385 > http [ACK] Seq=308 Ack=41265 Win=65535 Len=0
1017122 342.624354 77.197.128.47 -> 41.177.26.15 TCP 64 6385 > http [ACK] Seq=308 Ack=44185 Win=65535 Len=0
1017237 342.705988 77.197.128.47 -> 41.177.26.15 TCP 64 6385 > http [ACK] Seq=308 Ack=47105 Win=65535 Len=0
1017238 342.705993 77.197.128.47 -> 41.177.26.15 TCP 64 6385 > http [ACK] Seq=308 Ack=50925 Win=65535 Len=0
1017239 342.706152 77.197.128.47 -> 41.177.26.15 TCP 64 6385 > http [ACK] Seq=308 Ack=53845 Win=62615 Len=0
1017240 342.706157 77.197.128.47 -> 41.177.26.15 TCP 64 [TCP Window Update] 6385 > http [ACK] Seq=308 Ack=53845 Win=65535 Len=0
1017241 342.706280 77.197.128.47 -> 41.177.26.15 TCP 64 6385 > http [ACK] Seq=308 Ack=57665 Win=65535 Len=0
1017242 342.706285 77.197.128.47 -> 41.177.26.15 TCP 64 6385 > http [ACK] Seq=308 Ack=60147 Win=65535 Len=0
1017247 342.710735 77.197.128.47 -> 41.177.26.15 TCP 64 6385 > http [RST, ACK] Seq=308 Ack=60147 Win=0 Len=0
1017640 342.974112 77.197.128.47 -> 41.177.26.15 TCP 66 ovsdb > http [SYN] Seq=0 Win=65535 Len=0 MSS=1460 SACK_PERM=1
1017826 343.055724 77.197.128.47 -> 41.177.26.15 TCP 64 ovsdb > http [ACK] Seq=1 Ack=1 Win=65535 Len=0
1018109 343.252757 77.197.128.47 -> 41.177.26.15 TCP 64 ovsdb > http [RST, ACK] Seq=373 Ack=203 Win=0 Len=0
