364152 123.944936 77.197.210.159 -> 41.177.26.91 TCP 66 23256 > http [SYN] Seq=0 Win=65535 Len=0 MSS=1460 SACK_PERM=1
364231 124.027363 77.197.210.159 -> 41.177.26.91 TCP 64 23256 > http [ACK] Seq=1 Ack=1 Win=65535 Len=0
364679 124.200156 77.197.210.159 -> 41.177.26.91 TCP 64 23256 > http [ACK] Seq=306 Ack=2921 Win=65535 Len=0
364875 124.283575 77.197.210.159 -> 41.177.26.91 TCP 64 23256 > http [ACK] Seq=306 Ack=5841 Win=65535 Len=0
364876 124.283579 77.197.210.159 -> 41.177.26.91 TCP 64 23256 > http [ACK] Seq=306 Ack=8761 Win=65535 Len=0
365002 124.365268 77.197.210.159 -> 41.177.26.91 TCP 64 23256 > http [ACK] Seq=306 Ack=11681 Win=65535 Len=0
365004 124.365425 77.197.210.159 -> 41.177.26.91 TCP 64 23256 > http [ACK] Seq=306 Ack=15727 Win=65535 Len=0
365010 124.367167 77.197.210.159 -> 41.177.26.91 TCP 64 23256 > http [RST, ACK] Seq=306 Ack=15727 Win=0 Len=0
925312 308.002965 77.197.210.159 -> 41.177.26.15 TCP 66 ndl-ahp-svc > http [SYN] Seq=0 Win=65535 Len=0 MSS=1460 SACK_PERM=1
925387 308.084563 77.197.210.159 -> 41.177.26.15 TCP 64 ndl-ahp-svc > http [ACK] Seq=1 Ack=1 Win=65535 Len=0
925701 308.321299 77.197.210.159 -> 41.177.26.15 TCP 64 ndl-ahp-svc > http [ACK] Seq=308 Ack=4381 Win=65535 Len=0
925847 308.403086 77.197.210.159 -> 41.177.26.15 TCP 64 ndl-ahp-svc > http [ACK] Seq=308 Ack=7301 Win=65535 Len=0
925848 308.403218 77.197.210.159 -> 41.177.26.15 TCP 64 ndl-ahp-svc > http [ACK] Seq=308 Ack=9925 Win=65535 Len=0
925973 308.484948 77.197.210.159 -> 41.177.26.15 TCP 64 ndl-ahp-svc > http [ACK] Seq=308 Ack=12845 Win=65263 Len=0
925974 308.484962 77.197.210.159 -> 41.177.26.15 TCP 64 [TCP Dup ACK 925973#1] ndl-ahp-svc > http [ACK] Seq=308 Ack=12845 Win=65263 Len=0
925975 308.484966 77.197.210.159 -> 41.177.26.15 TCP 64 ndl-ahp-svc > http [ACK] Seq=308 Ack=16665 Win=65535 Len=0
926145 308.566812 77.197.210.159 -> 41.177.26.15 TCP 64 ndl-ahp-svc > http [ACK] Seq=308 Ack=21217 Win=65535 Len=0
926330 308.648834 77.197.210.159 -> 41.177.26.15 TCP 64 ndl-ahp-svc > http [RST, ACK] Seq=308 Ack=21217 Win=0 Len=0
