2124   0.644709 77.197.128.64 -> 41.177.26.176 TCP 64 52663 > http [ACK] Seq=1 Ack=2219 Win=65535 Len=0
2125   0.644801 77.197.128.64 -> 41.177.26.176 TCP 64 52663 > http [ACK] Seq=1 Ack=2657 Win=65097 Len=0
2373   0.723675 77.197.128.64 -> 41.177.26.176 TCP 64 52663 > http [ACK] Seq=1 Ack=4553 Win=65535 Len=0
2377   0.723932 77.197.128.64 -> 41.177.26.176 TCP 64 52663 > http [ACK] Seq=1 Ack=7448 Win=65535 Len=0
2589   0.802626 77.197.128.64 -> 41.177.26.176 TCP 64 52663 > http [ACK] Seq=1 Ack=10707 Win=65535 Len=0
2590   0.802647 77.197.128.64 -> 41.177.26.176 TCP 64 52663 > http [ACK] Seq=1 Ack=12167 Win=65535 Len=0
2592   0.802926 77.197.128.64 -> 41.177.26.176 TCP 64 52663 > http [ACK] Seq=1 Ack=14798 Win=65535 Len=0
2594   0.803257 77.197.128.64 -> 41.177.26.176 TCP 64 52663 > http [RST, ACK] Seq=1 Ack=14798 Win=0 Len=0
3072   1.022194 77.197.128.64 -> 41.177.26.176 TCP 66 53146 > http [SYN] Seq=0 Win=65535 Len=0 MSS=1460 SACK_PERM=1
3338   1.101131 77.197.128.64 -> 41.177.26.176 TCP 64 53146 > http [ACK] Seq=1 Ack=1 Win=65535 Len=0
4874   1.485500 77.197.128.64 -> 41.177.26.176 TCP 64 53146 > http [ACK] Seq=309 Ack=2431 Win=65535 Len=0
4875   1.485631 77.197.128.64 -> 41.177.26.176 TCP 64 53146 > http [ACK] Seq=309 Ack=3904 Win=65535 Len=0
5041   1.564736 77.197.128.64 -> 41.177.26.176 TCP 64 53146 > http [ACK] Seq=309 Ack=6074 Win=65535 Len=0
5042   1.564861 77.197.128.64 -> 41.177.26.176 TCP 64 53146 > http [ACK] Seq=309 Ack=8342 Win=65535 Len=0
5043   1.564885 77.197.128.64 -> 41.177.26.176 TCP 64 53146 > http [ACK] Seq=309 Ack=11187 Win=65535 Len=0
5044   1.565154 77.197.128.64 -> 41.177.26.176 TCP 64 53146 > http [RST, ACK] Seq=309 Ack=11187 Win=0 Len=0
5845   1.822667 77.197.128.64 -> 41.177.26.176 TCP 66 53340 > http [SYN] Seq=0 Win=65535 Len=0 MSS=1460 SACK_PERM=1
6049   1.901756 77.197.128.64 -> 41.177.26.176 TCP 64 53340 > http [ACK] Seq=1 Ack=1 Win=65535 Len=0
7052   2.329588 77.197.128.64 -> 41.177.26.176 TCP 64 53340 > http [ACK] Seq=309 Ack=2602 Win=65535 Len=0
7235   2.408521 77.197.128.64 -> 41.177.26.176 TCP 64 53340 > http [ACK] Seq=309 Ack=6082 Win=65535 Len=0
7392   2.487550 77.197.128.64 -> 41.177.26.176 TCP 64 53340 > http [ACK] Seq=309 Ack=9002 Win=65535 Len=0
7393   2.487555 77.197.128.64 -> 41.177.26.176 TCP 64 53340 > http [ACK] Seq=309 Ack=11057 Win=65535 Len=0
7394   2.487915 77.197.128.64 -> 41.177.26.176 TCP 64 53340 > http [RST, ACK] Seq=309 Ack=11057 Win=0 Len=0
17273   4.941818 77.197.128.64 -> 41.177.26.176 TCP 66 54179 > http [SYN] Seq=0 Win=65535 Len=0 MSS=1460 SACK_PERM=1
17391   5.020855 77.197.128.64 -> 41.177.26.176 TCP 64 54179 > http [ACK] Seq=1 Ack=1 Win=65535 Len=0
18475   5.869566 77.197.128.64 -> 41.177.26.176 TCP 64 54179 > http [ACK] Seq=336 Ack=2101 Win=65535 Len=0
18477   5.869772 77.197.128.64 -> 41.177.26.176 TCP 64 54179 > http [ACK] Seq=336 Ack=2433 Win=65203 Len=0
18484   5.870133 77.197.128.64 -> 41.177.26.176 TCP 64 54179 > http [ACK] Seq=336 Ack=2918 Win=64718 Len=0
18663   5.948580 77.197.128.64 -> 41.177.26.176 TCP 64 54179 > http [ACK] Seq=336 Ack=5367 Win=65535 Len=0
18664   5.948826 77.197.128.64 -> 41.177.26.176 TCP 64 54179 > http [ACK] Seq=336 Ack=9635 Win=63279 Len=0
18665   5.948830 77.197.128.64 -> 41.177.26.176 TCP 64 [TCP Window Update] 54179 > http [ACK] Seq=336 Ack=9635 Win=65535 Len=0
18876   6.115510 77.197.128.64 -> 41.177.26.176 TCP 64 54179 > http [ACK] Seq=336 Ack=10872 Win=64298 Len=0
18879   6.123727 77.197.128.64 -> 41.177.26.176 TCP 64 54179 > http [RST, ACK] Seq=336 Ack=10872 Win=0 Len=0
19905   6.553395 77.197.128.64 -> 41.177.26.176 TCP 66 54797 > http [SYN] Seq=0 Win=65535 Len=0 MSS=1460 SACK_PERM=1
20155   6.632739 77.197.128.64 -> 41.177.26.176 TCP 64 54797 > http [ACK] Seq=1 Ack=1 Win=65535 Len=0
21118   7.092803 77.197.128.64 -> 41.177.26.176 TCP 64 54797 > http [ACK] Seq=355 Ack=4058 Win=65535 Len=0
21189   7.171842 77.197.128.64 -> 41.177.26.176 TCP 64 54797 > http [ACK] Seq=355 Ack=6232 Win=65535 Len=0
21190   7.171847 77.197.128.64 -> 41.177.26.176 TCP 64 54797 > http [ACK] Seq=355 Ack=8554 Win=65535 Len=0
21285   7.250858 77.197.128.64 -> 41.177.26.176 TCP 64 54797 > http [ACK] Seq=355 Ack=11604 Win=65535 Len=0
21330   7.310517 77.197.128.64 -> 41.177.26.176 TCP 64 54797 > http [RST, ACK] Seq=355 Ack=11604 Win=0 Len=0
22151   7.792049 77.197.128.64 -> 41.177.26.176 TCP 66 55210 > http [SYN] Seq=0 Win=65535 Len=0 MSS=1460 SACK_PERM=1
22250   7.871150 77.197.128.64 -> 41.177.26.176 TCP 64 55210 > http [ACK] Seq=1 Ack=1 Win=65535 Len=0
22878   8.250552 77.197.128.64 -> 41.177.26.176 TCP 64 55210 > http [ACK] Seq=309 Ack=2242 Win=65535 Len=0
22879   8.250557 77.197.128.64 -> 41.177.26.176 TCP 64 55210 > http [ACK] Seq=309 Ack=3908 Win=65535 Len=0
23005   8.329432 77.197.128.64 -> 41.177.26.176 TCP 64 55210 > http [ACK] Seq=309 Ack=5955 Win=65535 Len=0
23006   8.329684 77.197.128.64 -> 41.177.26.176 TCP 64 55210 > http [ACK] Seq=309 Ack=8321 Win=65535 Len=0
23007   8.329744 77.197.128.64 -> 41.177.26.176 TCP 64 55210 > http [ACK] Seq=309 Ack=11050 Win=64266 Len=0
23496   8.519839 77.197.128.64 -> 41.177.26.176 TCP 64 55210 > http [RST, ACK] Seq=309 Ack=11050 Win=0 Len=0
24017   8.788274 77.197.128.64 -> 41.177.26.176 TCP 66 55633 > http [SYN] Seq=0 Win=65535 Len=0 MSS=1460 SACK_PERM=1
24076   8.867344 77.197.128.64 -> 41.177.26.176 TCP 64 55633 > http [ACK] Seq=1 Ack=1 Win=65535 Len=0
24490   9.273757 77.197.128.64 -> 41.177.26.176 TCP 64 55633 > http [ACK] Seq=318 Ack=2431 Win=65535 Len=0
24491   9.273762 77.197.128.64 -> 41.177.26.176 TCP 64 55633 > http [ACK] Seq=318 Ack=3896 Win=65535 Len=0
24625   9.352867 77.197.128.64 -> 41.177.26.176 TCP 64 55633 > http [ACK] Seq=318 Ack=6064 Win=65535 Len=0
24626   9.353176 77.197.128.64 -> 41.177.26.176 TCP 64 55633 > http [ACK] Seq=318 Ack=11164 Win=64815 Len=0
24793   9.442053 77.197.128.64 -> 41.177.26.176 TCP 64 55633 > http [RST, ACK] Seq=318 Ack=11164 Win=0 Len=0
25163   9.647579 77.197.128.64 -> 41.177.26.176 TCP 66 55885 > http [SYN] Seq=0 Win=65535 Len=0 MSS=1460 SACK_PERM=1
25238   9.728316 77.197.128.64 -> 41.177.26.176 TCP 64 55885 > http [ACK] Seq=1 Ack=1 Win=65535 Len=0
26099  10.191821 77.197.128.64 -> 41.177.26.176 TCP 64 55885 > http [ACK] Seq=305 Ack=2602 Win=65535 Len=0
26243  10.270799 77.197.128.64 -> 41.177.26.176 TCP 64 55885 > http [ACK] Seq=305 Ack=5356 Win=65535 Len=0
26244  10.270943 77.197.128.64 -> 41.177.26.176 TCP 64 55885 > http [ACK] Seq=305 Ack=7530 Win=65535 Len=0
26386  10.350130 77.197.128.64 -> 41.177.26.176 TCP 64 55885 > http [ACK] Seq=305 Ack=11188 Win=65349 Len=0
26387  10.350258 77.197.128.64 -> 41.177.26.176 TCP 64 [TCP Dup ACK 26386#1] 55885 > http [ACK] Seq=305 Ack=11188 Win=65349 Len=0
26445  10.388753 77.197.128.64 -> 41.177.26.176 TCP 64 55885 > http [RST, ACK] Seq=305 Ack=11188 Win=0 Len=0
27226  10.737182 77.197.128.64 -> 41.177.26.176 TCP 66 56098 > http [SYN] Seq=0 Win=65535 Len=0 MSS=1460 SACK_PERM=1
27368  10.816269 77.197.128.64 -> 41.177.26.176 TCP 64 56098 > http [ACK] Seq=1 Ack=1 Win=65535 Len=0
28107  11.281086 77.197.128.64 -> 41.177.26.176 TCP 64 56098 > http [ACK] Seq=319 Ack=2431 Win=65535 Len=0
28108  11.281232 77.197.128.64 -> 41.177.26.176 TCP 64 56098 > http [ACK] Seq=319 Ack=3895 Win=65535 Len=0
28198  11.360098 77.197.128.64 -> 41.177.26.176 TCP 64 56098 > http [ACK] Seq=319 Ack=6075 Win=65535 Len=0
28199  11.360252 77.197.128.64 -> 41.177.26.176 TCP 64 56098 > http [ACK] Seq=319 Ack=8333 Win=65535 Len=0
28390  11.439349 77.197.128.64 -> 41.177.26.176 TCP 64 56098 > http [ACK] Seq=319 Ack=11219 Win=65535 Len=0
28391  11.439530 77.197.128.64 -> 41.177.26.176 TCP 64 56098 > http [RST, ACK] Seq=319 Ack=11219 Win=0 Len=0
28898  11.748657 77.197.128.64 -> 41.177.26.176 TCP 66 56355 > http [SYN] Seq=0 Win=65535 Len=0 MSS=1460 SACK_PERM=1
29107  11.827966 77.197.128.64 -> 41.177.26.176 TCP 64 56355 > http [ACK] Seq=1 Ack=1 Win=65535 Len=0
31924  13.467805 77.197.128.64 -> 41.177.26.176 TCP 64 56355 > http [ACK] Seq=302 Ack=1473 Win=65535 Len=0
31956  13.478323 77.197.128.64 -> 41.177.26.176 TCP 64 56355 > http [ACK] Seq=302 Ack=2440 Win=64568 Len=0
31957  13.478453 77.197.128.64 -> 41.177.26.176 TCP 64 56355 > http [ACK] Seq=302 Ack=2738 Win=64270 Len=0
31958  13.478458 77.197.128.64 -> 41.177.26.176 TCP 64 56355 > http [ACK] Seq=302 Ack=3632 Win=65535 Len=0
32014  13.546853 77.197.128.64 -> 41.177.26.176 TCP 64 56355 > http [ACK] Seq=302 Ack=5985 Win=65535 Len=0
32044  13.557706 77.197.128.64 -> 41.177.26.176 TCP 64 56355 > http [ACK] Seq=302 Ack=8905 Win=65535 Len=0
32134  13.639748 77.197.128.64 -> 41.177.26.176 TCP 64 56355 > http [RST, ACK] Seq=302 Ack=9832 Win=0 Len=0
32972  13.982553 77.197.128.64 -> 41.177.26.176 TCP 66 56907 > http [SYN] Seq=0 Win=65535 Len=0 MSS=1460 SACK_PERM=1
33196  14.061346 77.197.128.64 -> 41.177.26.176 TCP 64 56907 > http [ACK] Seq=1 Ack=1 Win=65535 Len=0
34041  14.454683 77.197.128.64 -> 41.177.26.176 TCP 64 56907 > http [ACK] Seq=308 Ack=2922 Win=65535 Len=0
34309  14.533620 77.197.128.64 -> 41.177.26.176 TCP 64 56907 > http [ACK] Seq=308 Ack=6076 Win=65535 Len=0
34740  14.612564 77.197.128.64 -> 41.177.26.176 TCP 64 56907 > http [ACK] Seq=308 Ack=8502 Win=65535 Len=0
34741  14.612568 77.197.128.64 -> 41.177.26.176 TCP 64 56907 > http [ACK] Seq=308 Ack=11541 Win=63956 Len=0
35190  14.737708 77.197.128.64 -> 41.177.26.176 TCP 64 [TCP Window Update] 56907 > http [ACK] Seq=308 Ack=11541 Win=65535 Len=0
35193  14.738054 77.197.128.64 -> 41.177.26.176 TCP 64 56907 > http [RST, ACK] Seq=308 Ack=11541 Win=0 Len=0
36173  15.085096 77.197.128.64 -> 41.177.26.176 TCP 66 57089 > http [SYN] Seq=0 Win=65535 Len=0 MSS=1460 SACK_PERM=1
36448  15.164038 77.197.128.64 -> 41.177.26.176 TCP 64 57089 > http [ACK] Seq=1 Ack=1 Win=65535 Len=0
37501  15.619263 77.197.128.64 -> 41.177.26.176 TCP 64 57089 > http [ACK] Seq=309 Ack=2431 Win=65535 Len=0
37749  15.698342 77.197.128.64 -> 41.177.26.176 TCP 64 57089 > http [ACK] Seq=309 Ack=6075 Win=65535 Len=0
38036  15.777258 77.197.128.64 -> 41.177.26.176 TCP 64 57089 > http [ACK] Seq=309 Ack=7907 Win=65535 Len=0
38038  15.777446 77.197.128.64 -> 41.177.26.176 TCP 64 57089 > http [ACK] Seq=309 Ack=11190 Win=65352 Len=0
38039  15.777451 77.197.128.64 -> 41.177.26.176 TCP 64 [TCP Dup ACK 38038#1] 57089 > http [ACK] Seq=309 Ack=11190 Win=65352 Len=0
38324  15.856960 77.197.128.64 -> 41.177.26.176 TCP 64 57089 > http [RST, ACK] Seq=309 Ack=11190 Win=0 Len=0
38895  16.086215 77.197.128.64 -> 41.177.26.176 TCP 66 57279 > http [SYN] Seq=0 Win=65535 Len=0 MSS=1460 SACK_PERM=1
39066  16.165347 77.197.128.64 -> 41.177.26.176 TCP 64 57279 > http [ACK] Seq=1 Ack=1 Win=65535 Len=0
39792  16.540366 77.197.128.64 -> 41.177.26.176 TCP 64 57279 > http [ACK] Seq=308 Ack=2431 Win=65535 Len=0
39795  16.540717 77.197.128.64 -> 41.177.26.176 TCP 64 57279 > http [ACK] Seq=308 Ack=3905 Win=65535 Len=0
39979  16.619382 77.197.128.64 -> 41.177.26.176 TCP 64 57279 > http [ACK] Seq=308 Ack=6069 Win=65535 Len=0
39980  16.619554 77.197.128.64 -> 41.177.26.176 TCP 64 57279 > http [ACK] Seq=308 Ack=8303 Win=65535 Len=0
39981  16.619816 77.197.128.64 -> 41.177.26.176 TCP 64 57279 > http [ACK] Seq=308 Ack=11173 Win=64125 Len=0
40101  16.719973 77.197.128.64 -> 41.177.26.176 TCP 64 57279 > http [RST, ACK] Seq=308 Ack=11173 Win=0 Len=0
40383  16.910377 77.197.128.64 -> 41.177.26.176 TCP 66 57474 > http [SYN] Seq=0 Win=65535 Len=0 MSS=1460 SACK_PERM=1
40498  16.989571 77.197.128.64 -> 41.177.26.176 TCP 64 57474 > http [ACK] Seq=1 Ack=1 Win=65535 Len=0
41708  17.382603 77.197.128.64 -> 41.177.26.176 TCP 64 57474 > http [ACK] Seq=309 Ack=2602 Win=65535 Len=0
41975  17.461765 77.197.128.64 -> 41.177.26.176 TCP 64 57474 > http [ACK] Seq=309 Ack=6068 Win=65535 Len=0
42172  17.540768 77.197.128.64 -> 41.177.26.176 TCP 64 57474 > http [ACK] Seq=309 Ack=8988 Win=65535 Len=0
42173  17.540773 77.197.128.64 -> 41.177.26.176 TCP 64 57474 > http [ACK] Seq=309 Ack=11061 Win=65474 Len=0
42174  17.540777 77.197.128.64 -> 41.177.26.176 TCP 64 [TCP Dup ACK 42173#1] 57474 > http [ACK] Seq=309 Ack=11061 Win=65474 Len=0
42206  17.579936 77.197.128.64 -> 41.177.26.176 TCP 64 57474 > http [RST, ACK] Seq=309 Ack=11061 Win=0 Len=0
42544  17.917065 77.197.128.64 -> 41.177.26.176 TCP 66 57718 > http [SYN] Seq=0 Win=65535 Len=0 MSS=1460 SACK_PERM=1
42686  17.995878 77.197.128.64 -> 41.177.26.176 TCP 64 57718 > http [ACK] Seq=1 Ack=1 Win=65535 Len=0
43491  18.445344 77.197.128.64 -> 41.177.26.176 TCP 64 57718 > http [ACK] Seq=318 Ack=2431 Win=65535 Len=0
43726  18.524403 77.197.128.64 -> 41.177.26.176 TCP 64 57718 > http [ACK] Seq=318 Ack=6063 Win=65535 Len=0
43727  18.524490 77.197.128.64 -> 41.177.26.176 TCP 64 57718 > http [ACK] Seq=318 Ack=7523 Win=65535 Len=0
43996  18.603419 77.197.128.64 -> 41.177.26.176 TCP 64 57718 > http [ACK] Seq=318 Ack=11163 Win=63908 Len=0
44233  18.690645 77.197.128.64 -> 41.177.26.176 TCP 64 [TCP Window Update] 57718 > http [ACK] Seq=318 Ack=11163 Win=65535 Len=0
44234  18.690789 77.197.128.64 -> 41.177.26.176 TCP 64 57718 > http [RST, ACK] Seq=318 Ack=11163 Win=0 Len=0
45273  18.934774 77.197.128.64 -> 41.177.26.176 TCP 66 57917 > http [SYN] Seq=0 Win=65535 Len=0 MSS=1460 SACK_PERM=1
45410  19.013591 77.197.128.64 -> 41.177.26.176 TCP 64 57917 > http [ACK] Seq=1 Ack=1 Win=65535 Len=0
46821  19.469129 77.197.128.64 -> 41.177.26.176 TCP 64 57917 > http [ACK] Seq=318 Ack=2431 Win=65535 Len=0
46822  19.469228 77.197.128.64 -> 41.177.26.176 TCP 64 57917 > http [ACK] Seq=318 Ack=3896 Win=65535 Len=0
47289  19.548203 77.197.128.64 -> 41.177.26.176 TCP 64 57917 > http [ACK] Seq=318 Ack=6070 Win=65535 Len=0
47290  19.548320 77.197.128.64 -> 41.177.26.176 TCP 64 57917 > http [ACK] Seq=318 Ack=8265 Win=65535 Len=0
47292  19.548573 77.197.128.64 -> 41.177.26.176 TCP 64 57917 > http [ACK] Seq=318 Ack=10633 Win=63167 Len=0
47293  19.548577 77.197.128.64 -> 41.177.26.176 TCP 64 [TCP Window Update] 57917 > http [ACK] Seq=318 Ack=10633 Win=65535 Len=0
47659  19.634764 77.197.128.64 -> 41.177.26.176 TCP 64 57917 > http [RST, ACK] Seq=318 Ack=11315 Win=0 Len=0
49041  19.943816 77.197.128.64 -> 41.177.26.176 TCP 66 58066 > http [SYN] Seq=0 Win=65535 Len=0 MSS=1460 SACK_PERM=1
49253  20.022827 77.197.128.64 -> 41.177.26.176 TCP 64 58066 > http [ACK] Seq=1 Ack=1 Win=65535 Len=0
50218  20.439465 77.197.128.64 -> 41.177.26.176 TCP 64 58066 > http [ACK] Seq=356 Ack=2431 Win=65535 Len=0
50432  20.518415 77.197.128.64 -> 41.177.26.176 TCP 64 58066 > http [ACK] Seq=356 Ack=6483 Win=65535 Len=0
50555  20.597388 77.197.128.64 -> 41.177.26.176 TCP 64 58066 > http [ACK] Seq=356 Ack=8770 Win=65535 Len=0
50556  20.597499 77.197.128.64 -> 41.177.26.176 TCP 64 58066 > http [ACK] Seq=356 Ack=10230 Win=64075 Len=0
50557  20.597603 77.197.128.64 -> 41.177.26.176 TCP 64 58066 > http [ACK] Seq=356 Ack=11878 Win=62427 Len=0
50626  20.637502 77.197.128.64 -> 41.177.26.176 TCP 64 [TCP Window Update] 58066 > http [ACK] Seq=356 Ack=11878 Win=65535 Len=0
50628  20.637684 77.197.128.64 -> 41.177.26.176 TCP 64 58066 > http [RST, ACK] Seq=356 Ack=11878 Win=0 Len=0
51512  21.158705 77.197.128.64 -> 41.177.26.176 TCP 66 58244 > http [SYN] Seq=0 Win=65535 Len=0 MSS=1460 SACK_PERM=1
51662  21.237676 77.197.128.64 -> 41.177.26.176 TCP 64 58244 > http [ACK] Seq=1 Ack=1 Win=65535 Len=0
52457  21.653321 77.197.128.64 -> 41.177.26.176 TCP 64 58244 > http [ACK] Seq=310 Ack=2431 Win=65535 Len=0
52501  21.732395 77.197.128.64 -> 41.177.26.176 TCP 64 58244 > http [ACK] Seq=310 Ack=6080 Win=65358 Len=0
52502  21.732400 77.197.128.64 -> 41.177.26.176 TCP 64 [TCP Dup ACK 52501#1] 58244 > http [ACK] Seq=310 Ack=6080 Win=65358 Len=0
52541  21.811491 77.197.128.64 -> 41.177.26.176 TCP 64 58244 > http [ACK] Seq=310 Ack=8001 Win=65535 Len=0
52542  21.811599 77.197.128.64 -> 41.177.26.176 TCP 64 58244 > http [ACK] Seq=310 Ack=10420 Win=64667 Len=0
52543  21.811604 77.197.128.64 -> 41.177.26.176 TCP 64 [TCP Dup ACK 52542#1] 58244 > http [ACK] Seq=310 Ack=10420 Win=64667 Len=0
52732  21.975834 77.197.128.64 -> 41.177.26.176 TCP 64 58244 > http [ACK] Seq=310 Ack=11102 Win=63985 Len=0
52818  22.060371 77.197.128.64 -> 41.177.26.176 TCP 64 [TCP Window Update] 58244 > http [ACK] Seq=310 Ack=11102 Win=65535 Len=0
52819  22.060587 77.197.128.64 -> 41.177.26.176 TCP 64 58244 > http [RST, ACK] Seq=310 Ack=11102 Win=0 Len=0
54122  22.385459 77.197.128.64 -> 41.177.26.176 TCP 66 58445 > http [SYN] Seq=0 Win=65535 Len=0 MSS=1460 SACK_PERM=1
54218  22.464287 77.197.128.64 -> 41.177.26.176 TCP 64 58445 > http [ACK] Seq=1 Ack=1 Win=65535 Len=0
55247  22.818657 77.197.128.64 -> 41.177.26.176 TCP 64 58445 > http [ACK] Seq=308 Ack=2431 Win=65535 Len=0
55250  22.818792 77.197.128.64 -> 41.177.26.176 TCP 64 58445 > http [ACK] Seq=308 Ack=3905 Win=65535 Len=0
55501  22.897662 77.197.128.64 -> 41.177.26.176 TCP 64 58445 > http [ACK] Seq=308 Ack=6069 Win=65535 Len=0
55504  22.897790 77.197.128.64 -> 41.177.26.176 TCP 64 58445 > http [ACK] Seq=308 Ack=8989 Win=62615 Len=0
55505  22.897794 77.197.128.64 -> 41.177.26.176 TCP 64 [TCP Window Update] 58445 > http [ACK] Seq=308 Ack=8989 Win=65535 Len=0
55916  22.977657 77.197.128.64 -> 41.177.26.176 TCP 64 58445 > http [ACK] Seq=308 Ack=12168 Win=63816 Len=0
56217  23.081869 77.197.128.64 -> 41.177.26.176 TCP 64 [TCP Window Update] 58445 > http [ACK] Seq=308 Ack=12168 Win=65535 Len=0
56219  23.082172 77.197.128.64 -> 41.177.26.176 TCP 64 58445 > http [RST, ACK] Seq=308 Ack=12168 Win=0 Len=0
57098  23.397596 77.197.128.64 -> 41.177.26.176 TCP 66 58635 > http [SYN] Seq=0 Win=65535 Len=0 MSS=1460 SACK_PERM=1
57395  23.476636 77.197.128.64 -> 41.177.26.176 TCP 64 58635 > http [ACK] Seq=1 Ack=1 Win=65535 Len=0
61072  24.891381 77.197.128.64 -> 41.177.26.176 TCP 64 58635 > http [ACK] Seq=280 Ack=2195 Win=65535 Len=0
61073  24.891566 77.197.128.64 -> 41.177.26.176 TCP 64 58635 > http [ACK] Seq=280 Ack=2555 Win=65175 Len=0
61079  24.891942 77.197.128.64 -> 41.177.26.176 TCP 64 58635 > http [ACK] Seq=280 Ack=2828 Win=64902 Len=0
61156  24.970384 77.197.128.64 -> 41.177.26.176 TCP 64 58635 > http [ACK] Seq=280 Ack=5935 Win=65535 Len=0
61157  24.970583 77.197.128.64 -> 41.177.26.176 TCP 64 58635 > http [ACK] Seq=280 Ack=7395 Win=65535 Len=0
61158  24.970588 77.197.128.64 -> 41.177.26.176 TCP 64 58635 > http [ACK] Seq=280 Ack=9809 Win=65535 Len=0
61828  25.319603 77.197.128.64 -> 41.177.26.176 TCP 64 58635 > http [RST, ACK] Seq=280 Ack=9809 Win=0 Len=0
62797  25.844310 77.197.128.64 -> 41.177.26.176 TCP 66 59022 > http [SYN] Seq=0 Win=65535 Len=0 MSS=1460 SACK_PERM=1
62978  25.923258 77.197.128.64 -> 41.177.26.176 TCP 64 59022 > http [ACK] Seq=1 Ack=1 Win=65535 Len=0
63723  26.330491 77.197.128.64 -> 41.177.26.176 TCP 64 59022 > http [ACK] Seq=316 Ack=2431 Win=65535 Len=0
63966  26.409465 77.197.128.64 -> 41.177.26.176 TCP 64 59022 > http [ACK] Seq=316 Ack=6050 Win=65535 Len=0
64193  26.488548 77.197.128.64 -> 41.177.26.176 TCP 64 59022 > http [ACK] Seq=316 Ack=8558 Win=65535 Len=0
64194  26.488703 77.197.128.64 -> 41.177.26.176 TCP 64 59022 > http [ACK] Seq=316 Ack=11428 Win=65089 Len=0
64195  26.488710 77.197.128.64 -> 41.177.26.176 TCP 64 [TCP Dup ACK 64194#1] 59022 > http [ACK] Seq=316 Ack=11428 Win=65089 Len=0
64622  26.696319 77.197.128.64 -> 41.177.26.176 TCP 64 59022 > http [RST, ACK] Seq=316 Ack=11428 Win=0 Len=0
65601  27.052208 77.197.128.64 -> 41.177.26.176 TCP 66 59212 > http [SYN] Seq=0 Win=65535 Len=0 MSS=1460 SACK_PERM=1
65837  27.131102 77.197.128.64 -> 41.177.26.176 TCP 64 59212 > http [ACK] Seq=1 Ack=1 Win=65535 Len=0
66716  27.499964 77.197.128.64 -> 41.177.26.176 TCP 64 59212 > http [ACK] Seq=316 Ack=2431 Win=65535 Len=0
66717  27.500136 77.197.128.64 -> 41.177.26.176 TCP 64 59212 > http [ACK] Seq=316 Ack=3893 Win=65535 Len=0
66939  27.579002 77.197.128.64 -> 41.177.26.176 TCP 64 59212 > http [ACK] Seq=316 Ack=6057 Win=65535 Len=0
66940  27.579103 77.197.128.64 -> 41.177.26.176 TCP 64 59212 > http [ACK] Seq=316 Ack=8610 Win=65535 Len=0
66941  27.579130 77.197.128.64 -> 41.177.26.176 TCP 64 59212 > http [ACK] Seq=316 Ack=10070 Win=65535 Len=0
67482  27.764398 77.197.128.64 -> 41.177.26.176 TCP 64 59212 > http [RST, ACK] Seq=316 Ack=11456 Win=0 Len=0
68182  28.062964 77.197.128.64 -> 41.177.26.176 TCP 66 59372 > http [SYN] Seq=0 Win=65535 Len=0 MSS=1460 SACK_PERM=1
68342  28.142154 77.197.128.64 -> 41.177.26.176 TCP 64 59372 > http [ACK] Seq=1 Ack=1 Win=65535 Len=0
68952  28.522357 77.197.128.64 -> 41.177.26.176 TCP 64 59372 > http [ACK] Seq=356 Ack=2431 Win=65535 Len=0
69053  28.601598 77.197.128.64 -> 41.177.26.176 TCP 64 59372 > http [ACK] Seq=356 Ack=6230 Win=65208 Len=0
69054  28.601604 77.197.128.64 -> 41.177.26.176 TCP 64 [TCP Dup ACK 69053#1] 59372 > http [ACK] Seq=356 Ack=6230 Win=65208 Len=0
69179  28.680587 77.197.128.64 -> 41.177.26.176 TCP 64 59372 > http [ACK] Seq=356 Ack=8427 Win=65535 Len=0
69180  28.680592 77.197.128.64 -> 41.177.26.176 TCP 64 59372 > http [ACK] Seq=356 Ack=11711 Win=63711 Len=0
69266  28.742284 77.197.128.64 -> 41.177.26.176 TCP 64 [TCP Window Update] 59372 > http [ACK] Seq=356 Ack=11711 Win=65535 Len=0
69267  28.742474 77.197.128.64 -> 41.177.26.176 TCP 64 59372 > http [RST, ACK] Seq=356 Ack=11711 Win=0 Len=0
70202  29.083040 77.197.128.64 -> 41.177.26.176 TCP 66 59531 > http [SYN] Seq=0 Win=65535 Len=0 MSS=1460 SACK_PERM=1
70421  29.162165 77.197.128.64 -> 41.177.26.176 TCP 64 59531 > http [ACK] Seq=1 Ack=1 Win=65535 Len=0
71946  29.555446 77.197.128.64 -> 41.177.26.176 TCP 64 59531 > http [ACK] Seq=305 Ack=3894 Win=65535 Len=0
72305  29.634426 77.197.128.64 -> 41.177.26.176 TCP 64 59531 > http [ACK] Seq=305 Ack=6062 Win=65535 Len=0
72306  29.634431 77.197.128.64 -> 41.177.26.176 TCP 64 59531 > http [ACK] Seq=305 Ack=8610 Win=65535 Len=0
72620  29.713637 77.197.128.64 -> 41.177.26.176 TCP 64 59531 > http [ACK] Seq=305 Ack=11477 Win=64128 Len=0
73028  29.814172 77.197.128.64 -> 41.177.26.176 TCP 64 59531 > http [RST, ACK] Seq=305 Ack=11477 Win=0 Len=0
75591  30.522797 77.197.128.64 -> 41.177.26.176 TCP 66 59681 > http [SYN] Seq=0 Win=65535 Len=0 MSS=1460 SACK_PERM=1
75924  30.601744 77.197.128.64 -> 41.177.26.176 TCP 64 59681 > http [ACK] Seq=1 Ack=1 Win=65535 Len=0
77770  31.006590 77.197.128.64 -> 41.177.26.176 TCP 64 59681 > http [ACK] Seq=355 Ack=2602 Win=65535 Len=0
78076  31.085766 77.197.128.64 -> 41.177.26.176 TCP 64 59681 > http [ACK] Seq=355 Ack=7692 Win=65373 Len=0
78077  31.085770 77.197.128.64 -> 41.177.26.176 TCP 64 [TCP Dup ACK 78076#1] 59681 > http [ACK] Seq=355 Ack=7692 Win=65373 Len=0
78488  31.164908 77.197.128.64 -> 41.177.26.176 TCP 64 59681 > http [ACK] Seq=355 Ack=10040 Win=65535 Len=0
78927  31.289179 77.197.128.64 -> 41.177.26.176 TCP 64 59681 > http [RST, ACK] Seq=355 Ack=11453 Win=0 Len=0
80973  31.733537 77.197.128.64 -> 41.177.26.176 TCP 66 59840 > http [SYN] Seq=0 Win=65535 Len=0 MSS=1460 SACK_PERM=1
81352  31.812533 77.197.128.64 -> 41.177.26.176 TCP 64 59840 > http [ACK] Seq=1 Ack=1 Win=65535 Len=0
82854  32.240662 77.197.128.64 -> 41.177.26.176 TCP 64 59840 > http [ACK] Seq=306 Ack=3902 Win=65535 Len=0
83136  32.319652 77.197.128.64 -> 41.177.26.176 TCP 64 59840 > http [ACK] Seq=306 Ack=6082 Win=65535 Len=0
83139  32.319942 77.197.128.64 -> 41.177.26.176 TCP 64 59840 > http [ACK] Seq=306 Ack=9002 Win=65535 Len=0
83330  32.398696 77.197.128.64 -> 41.177.26.176 TCP 64 59840 > http [ACK] Seq=306 Ack=11074 Win=64923 Len=0
84575  32.810151 77.197.128.64 -> 41.177.26.176 TCP 64 59840 > http [RST, ACK] Seq=306 Ack=11074 Win=0 Len=0
85363  33.167114 77.197.128.64 -> 41.177.26.176 TCP 66 60025 > http [SYN] Seq=0 Win=65535 Len=0 MSS=1460 SACK_PERM=1
85552  33.246189 77.197.128.64 -> 41.177.26.176 TCP 64 60025 > http [ACK] Seq=1 Ack=1 Win=65535 Len=0
86645  33.612521 77.197.128.64 -> 41.177.26.176 TCP 64 60025 > http [ACK] Seq=316 Ack=2431 Win=65535 Len=0
86646  33.612609 77.197.128.64 -> 41.177.26.176 TCP 64 60025 > http [ACK] Seq=316 Ack=3893 Win=65535 Len=0
87046  33.691565 77.197.128.64 -> 41.177.26.176 TCP 64 60025 > http [ACK] Seq=316 Ack=6057 Win=65535 Len=0
87047  33.691570 77.197.128.64 -> 41.177.26.176 TCP 64 60025 > http [ACK] Seq=316 Ack=7517 Win=65535 Len=0
87049  33.691830 77.197.128.64 -> 41.177.26.176 TCP 64 60025 > http [ACK] Seq=316 Ack=10437 Win=65535 Len=0
87232  33.770509 77.197.128.64 -> 41.177.26.176 TCP 64 60025 > http [ACK] Seq=316 Ack=11246 Win=64726 Len=0
89330  34.496802 77.197.128.64 -> 41.177.26.176 TCP 64 60025 > http [RST, ACK] Seq=316 Ack=11246 Win=0 Len=0
387994 129.559005 77.197.128.64 -> 41.177.26.176 TCP 66 32320 > http [SYN] Seq=0 Win=65535 Len=0 MSS=1460 SACK_PERM=1
388312 129.637925 77.197.128.64 -> 41.177.26.176 TCP 64 32320 > http [ACK] Seq=1 Ack=1 Win=65535 Len=0
389576 130.151379 77.197.128.64 -> 41.177.26.176 TCP 64 32320 > http [ACK] Seq=318 Ack=2602 Win=65535 Len=0
389740 130.230685 77.197.128.64 -> 41.177.26.176 TCP 64 32320 > http [ACK] Seq=318 Ack=6070 Win=65535 Len=0
389984 130.309688 77.197.128.64 -> 41.177.26.176 TCP 64 32320 > http [ACK] Seq=318 Ack=8328 Win=65535 Len=0
389986 130.309752 77.197.128.64 -> 41.177.26.176 TCP 64 32320 > http [ACK] Seq=318 Ack=11177 Win=65535 Len=0
389987 130.309992 77.197.128.64 -> 41.177.26.176 TCP 64 32320 > http [RST, ACK] Seq=318 Ack=11177 Win=0 Len=0
458200 149.721520 77.197.128.64 -> 41.177.26.176 TCP 66 37359 > http [SYN] Seq=0 Win=65535 Len=0 MSS=1460 SACK_PERM=1
458348 149.800358 77.197.128.64 -> 41.177.26.176 TCP 64 37359 > http [ACK] Seq=1 Ack=1 Win=65535 Len=0
461800 151.349037 77.197.128.64 -> 41.177.26.176 TCP 64 37359 > http [ACK] Seq=301 Ack=1575 Win=65535 Len=0
461826 151.358616 77.197.128.64 -> 41.177.26.176 TCP 64 37359 > http [ACK] Seq=301 Ack=2538 Win=64572 Len=0
461827 151.358763 77.197.128.64 -> 41.177.26.176 TCP 64 37359 > http [ACK] Seq=301 Ack=2944 Win=64166 Len=0
461831 151.359266 77.197.128.64 -> 41.177.26.176 TCP 64 37359 > http [ACK] Seq=301 Ack=3679 Win=65535 Len=0
461976 151.428275 77.197.128.64 -> 41.177.26.176 TCP 64 37359 > http [ACK] Seq=301 Ack=6029 Win=65535 Len=0
461995 151.437635 77.197.128.64 -> 41.177.26.176 TCP 64 37359 > http [ACK] Seq=301 Ack=8949 Win=65535 Len=0
461996 151.437839 77.197.128.64 -> 41.177.26.176 TCP 64 37359 > http [RST, ACK] Seq=301 Ack=9872 Win=0 Len=0
600542 190.324097 77.197.128.64 -> 41.177.26.91 TCP 66 53026 > http [SYN] Seq=0 Win=65535 Len=0 MSS=1460 SACK_PERM=1
600722 190.405830 77.197.128.64 -> 41.177.26.91 TCP 64 53026 > http [ACK] Seq=1 Ack=1 Win=65535 Len=0
601099 190.582663 77.197.128.64 -> 41.177.26.91 TCP 64 53026 > http [ACK] Seq=314 Ack=4381 Win=65535 Len=0
601333 190.664324 77.197.128.64 -> 41.177.26.91 TCP 64 53026 > http [ACK] Seq=314 Ack=7301 Win=65535 Len=0
601334 190.664329 77.197.128.64 -> 41.177.26.91 TCP 64 53026 > http [ACK] Seq=314 Ack=8761 Win=65535 Len=0
601541 190.746051 77.197.128.64 -> 41.177.26.91 TCP 64 53026 > http [ACK] Seq=314 Ack=11681 Win=64075 Len=0
601543 190.746200 77.197.128.64 -> 41.177.26.91 TCP 64 53026 > http [ACK] Seq=314 Ack=15609 Win=60147 Len=0
601742 190.833141 77.197.128.64 -> 41.177.26.91 TCP 64 [TCP Window Update] 53026 > http [ACK] Seq=314 Ack=15609 Win=63619 Len=0
601743 190.833162 77.197.128.64 -> 41.177.26.91 TCP 64 [TCP Window Update] 53026 > http [ACK] Seq=314 Ack=15609 Win=65535 Len=0
601746 190.833939 77.197.128.64 -> 41.177.26.91 TCP 64 53026 > http [RST, ACK] Seq=314 Ack=15609 Win=0 Len=0
653183 204.649777 77.197.128.64 -> 41.177.26.91 TCP 66 59123 > http [SYN] Seq=0 Win=65535 Len=0 MSS=1460 SACK_PERM=1
653691 204.731359 77.197.128.64 -> 41.177.26.91 TCP 64 59123 > http [ACK] Seq=1 Ack=1 Win=65535 Len=0
654522 204.904910 77.197.128.64 -> 41.177.26.91 TCP 64 59123 > http [ACK] Seq=319 Ack=4381 Win=65535 Len=0
654833 204.986662 77.197.128.64 -> 41.177.26.91 TCP 64 59123 > http [ACK] Seq=319 Ack=8761 Win=65535 Len=0
654834 204.986667 77.197.128.64 -> 41.177.26.91 TCP 64 59123 > http [ACK] Seq=319 Ack=10221 Win=64075 Len=0
655038 205.068347 77.197.128.64 -> 41.177.26.91 TCP 64 59123 > http [ACK] Seq=319 Ack=15835 Win=58461 Len=0
655084 205.090316 77.197.128.64 -> 41.177.26.91 TCP 64 [TCP Window Update] 59123 > http [ACK] Seq=319 Ack=15835 Win=62485 Len=0
655085 205.090321 77.197.128.64 -> 41.177.26.91 TCP 64 [TCP Window Update] 59123 > http [ACK] Seq=319 Ack=15835 Win=65535 Len=0
655086 205.090978 77.197.128.64 -> 41.177.26.91 TCP 64 59123 > http [RST, ACK] Seq=319 Ack=15835 Win=0 Len=0
674179 210.499491 77.197.128.64 -> 41.177.26.91 TCP 66 61660 > http [SYN] Seq=0 Win=65535 Len=0 MSS=1460 SACK_PERM=1
674438 210.581224 77.197.128.64 -> 41.177.26.91 TCP 64 61660 > http [ACK] Seq=1 Ack=1 Win=65535 Len=0
674846 210.798934 77.197.128.64 -> 41.177.26.91 TCP 64 61660 > http [ACK] Seq=276 Ack=4381 Win=64627 Len=0
674847 210.798938 77.197.128.64 -> 41.177.26.91 TCP 64 [TCP Dup ACK 674846#1] 61660 > http [ACK] Seq=276 Ack=4381 Win=64627 Len=0
675057 210.880674 77.197.128.64 -> 41.177.26.91 TCP 64 61660 > http [ACK] Seq=276 Ack=8761 Win=64627 Len=0
675058 210.880679 77.197.128.64 -> 41.177.26.91 TCP 64 [TCP Dup ACK 675057#1] 61660 > http [ACK] Seq=276 Ack=8761 Win=64627 Len=0
675140 210.962351 77.197.128.64 -> 41.177.26.91 TCP 64 61660 > http [ACK] Seq=276 Ack=11681 Win=64075 Len=0
675141 210.962355 77.197.128.64 -> 41.177.26.91 TCP 64 61660 > http [ACK] Seq=276 Ack=14220 Win=61536 Len=0
675306 211.032268 77.197.128.64 -> 41.177.26.91 TCP 64 [TCP Window Update] 61660 > http [ACK] Seq=276 Ack=14220 Win=65008 Len=0
675307 211.032273 77.197.128.64 -> 41.177.26.91 TCP 64 [TCP Dup ACK 675306#1] 61660 > http [ACK] Seq=276 Ack=14220 Win=65008 Len=0
675308 211.032480 77.197.128.64 -> 41.177.26.91 TCP 64 61660 > http [RST, ACK] Seq=276 Ack=14220 Win=0 Len=0
1011865 339.636478 77.197.128.64 -> 41.177.26.15 TCP 66 44991 > http [SYN] Seq=0 Win=65535 Len=0 MSS=1460 SACK_PERM=1
1011967 339.715727 77.197.128.64 -> 41.177.26.15 TCP 64 44991 > http [ACK] Seq=1 Ack=1 Win=65535 Len=0
1014194 340.974047 77.197.128.64 -> 41.177.26.15 TCP 64 44991 > http [ACK] Seq=309 Ack=4381 Win=65535 Len=0
1014364 341.053715 77.197.128.64 -> 41.177.26.15 TCP 64 44991 > http [ACK] Seq=309 Ack=8465 Win=65535 Len=0
1014418 341.133141 77.197.128.64 -> 41.177.26.15 TCP 64 44991 > http [ACK] Seq=309 Ack=15765 Win=62343 Len=0
1014419 341.133145 77.197.128.64 -> 41.177.26.15 TCP 64 [TCP Window Update] 44991 > http [ACK] Seq=309 Ack=15765 Win=65535 Len=0
1014518 341.212213 77.197.128.64 -> 41.177.26.15 TCP 64 44991 > http [ACK] Seq=309 Ack=18125 Win=65535 Len=0
1014519 341.212304 77.197.128.64 -> 41.177.26.15 TCP 64 44991 > http [ACK] Seq=309 Ack=22505 Win=65535 Len=0
1014523 341.212508 77.197.128.64 -> 41.177.26.15 TCP 64 44991 > http [ACK] Seq=309 Ack=23965 Win=65535 Len=0
1014597 341.291326 77.197.128.64 -> 41.177.26.15 TCP 64 44991 > http [ACK] Seq=309 Ack=29245 Win=65535 Len=0
1014598 341.291331 77.197.128.64 -> 41.177.26.15 TCP 64 44991 > http [ACK] Seq=309 Ack=32165 Win=65527 Len=0
1014599 341.291353 77.197.128.64 -> 41.177.26.15 TCP 64 [TCP Dup ACK 1014598#1] 44991 > http [ACK] Seq=309 Ack=32165 Win=65527 Len=0
1014601 341.291550 77.197.128.64 -> 41.177.26.15 TCP 64 44991 > http [ACK] Seq=309 Ack=34525 Win=65535 Len=0
1014695 341.370617 77.197.128.64 -> 41.177.26.15 TCP 64 44991 > http [ACK] Seq=309 Ack=37445 Win=65535 Len=0
1014698 341.370871 77.197.128.64 -> 41.177.26.15 TCP 64 44991 > http [ACK] Seq=309 Ack=40365 Win=65535 Len=0
1014699 341.370875 77.197.128.64 -> 41.177.26.15 TCP 64 44991 > http [ACK] Seq=309 Ack=44185 Win=65527 Len=0
1014700 341.370879 77.197.128.64 -> 41.177.26.15 TCP 64 [TCP Dup ACK 1014699#1] 44991 > http [ACK] Seq=309 Ack=44185 Win=65527 Len=0
1014702 341.370888 77.197.128.64 -> 41.177.26.15 TCP 64 44991 > http [ACK] Seq=309 Ack=47105 Win=65535 Len=0
1014708 341.371164 77.197.128.64 -> 41.177.26.15 TCP 64 44991 > http [ACK] Seq=309 Ack=49465 Win=65535 Len=0
1014780 341.449575 77.197.128.64 -> 41.177.26.15 TCP 64 44991 > http [ACK] Seq=309 Ack=52385 Win=65535 Len=0
1014781 341.449783 77.197.128.64 -> 41.177.26.15 TCP 64 44991 > http [ACK] Seq=309 Ack=55305 Win=65527 Len=0
1014782 341.449788 77.197.128.64 -> 41.177.26.15 TCP 64 [TCP Dup ACK 1014781#1] 44991 > http [ACK] Seq=309 Ack=55305 Win=65527 Len=0
1014783 341.449862 77.197.128.64 -> 41.177.26.15 TCP 64 44991 > http [ACK] Seq=309 Ack=57665 Win=65535 Len=0
1014786 341.450036 77.197.128.64 -> 41.177.26.15 TCP 64 44991 > http [ACK] Seq=309 Ack=63505 Win=65527 Len=0
1014788 341.450062 77.197.128.64 -> 41.177.26.15 TCP 64 [TCP Dup ACK 1014786#1] 44991 > http [ACK] Seq=309 Ack=63505 Win=65527 Len=0
1014789 341.450065 77.197.128.64 -> 41.177.26.15 TCP 64 44991 > http [ACK] Seq=309 Ack=65865 Win=65535 Len=0
1014795 341.450196 77.197.128.64 -> 41.177.26.15 TCP 64 44991 > http [ACK] Seq=309 Ack=71705 Win=65527 Len=0
1014797 341.450219 77.197.128.64 -> 41.177.26.15 TCP 64 [TCP Dup ACK 1014795#1] 44991 > http [ACK] Seq=309 Ack=71705 Win=65527 Len=0
1014804 341.450352 77.197.128.64 -> 41.177.26.15 TCP 64 44991 > http [ACK] Seq=309 Ack=74065 Win=65535 Len=0
1014879 341.529278 77.197.128.64 -> 41.177.26.15 TCP 64 44991 > http [ACK] Seq=309 Ack=82265 Win=65527 Len=0
1014880 341.529283 77.197.128.64 -> 41.177.26.15 TCP 64 [TCP Dup ACK 1014879#1] 44991 > http [ACK] Seq=309 Ack=82265 Win=65527 Len=0
1014882 341.529519 77.197.128.64 -> 41.177.26.15 TCP 64 44991 > http [ACK] Seq=309 Ack=88105 Win=65535 Len=0
1014891 341.529719 77.197.128.64 -> 41.177.26.15 TCP 64 44991 > http [ACK] Seq=309 Ack=94845 Win=61147 Len=0
1014892 341.529723 77.197.128.64 -> 41.177.26.15 TCP 64 [TCP Window Update] 44991 > http [ACK] Seq=309 Ack=94845 Win=65535 Len=0
1014893 341.529727 77.197.128.64 -> 41.177.26.15 TCP 64 44991 > http [ACK] Seq=309 Ack=100125 Win=65535 Len=0
1014899 341.529888 77.197.128.64 -> 41.177.26.15 TCP 64 44991 > http [ACK] Seq=309 Ack=104505 Win=64067 Len=0
1014900 341.529892 77.197.128.64 -> 41.177.26.15 TCP 64 [TCP Window Update] 44991 > http [ACK] Seq=309 Ack=104505 Win=65535 Len=0
1014901 341.529896 77.197.128.64 -> 41.177.26.15 TCP 64 44991 > http [ACK] Seq=309 Ack=106865 Win=65535 Len=0
1015039 341.608583 77.197.128.64 -> 41.177.26.15 TCP 64 44991 > http [ACK] Seq=309 Ack=109785 Win=65535 Len=0
1015040 341.608694 77.197.128.64 -> 41.177.26.15 TCP 64 44991 > http [ACK] Seq=309 Ack=115065 Win=65527 Len=0
1015041 341.608698 77.197.128.64 -> 41.177.26.15 TCP 64 [TCP Dup ACK 1015040#1] 44991 > http [ACK] Seq=309 Ack=115065 Win=65527 Len=0
1015042 341.608703 77.197.128.64 -> 41.177.26.15 TCP 64 44991 > http [ACK] Seq=309 Ack=117985 Win=65535 Len=0
1015043 341.608870 77.197.128.64 -> 41.177.26.15 TCP 64 44991 > http [ACK] Seq=309 Ack=124725 Win=65527 Len=0
1015044 341.608875 77.197.128.64 -> 41.177.26.15 TCP 64 [TCP Dup ACK 1015043#1] 44991 > http [ACK] Seq=309 Ack=124725 Win=65527 Len=0
1015046 341.608929 77.197.128.64 -> 41.177.26.15 TCP 64 44991 > http [ACK] Seq=309 Ack=127645 Win=65535 Len=0
1015052 341.609040 77.197.128.64 -> 41.177.26.15 TCP 64 44991 > http [ACK] Seq=309 Ack=131465 Win=65535 Len=0
1015053 341.609044 77.197.128.64 -> 41.177.26.15 TCP 64 44991 > http [ACK] Seq=309 Ack=132925 Win=65535 Len=0
1015064 341.609241 77.197.128.64 -> 41.177.26.15 TCP 64 44991 > http [ACK] Seq=309 Ack=138765 Win=65535 Len=0
1015074 341.609379 77.197.128.64 -> 41.177.26.15 TCP 64 44991 > http [ACK] Seq=309 Ack=141125 Win=65535 Len=0
1015075 341.609383 77.197.128.64 -> 41.177.26.15 TCP 64 44991 > http [ACK] Seq=309 Ack=144045 Win=65535 Len=0
1015091 341.609747 77.197.128.64 -> 41.177.26.15 TCP 64 44991 > http [ACK] Seq=309 Ack=147865 Win=65535 Len=0
1015229 341.687818 77.197.128.64 -> 41.177.26.15 TCP 64 44991 > http [ACK] Seq=309 Ack=150785 Win=65535 Len=0
1015230 341.687943 77.197.128.64 -> 41.177.26.15 TCP 64 44991 > http [ACK] Seq=309 Ack=156065 Win=65527 Len=0
1015231 341.687948 77.197.128.64 -> 41.177.26.15 TCP 64 [TCP Dup ACK 1015230#1] 44991 > http [ACK] Seq=309 Ack=156065 Win=65527 Len=0
1015232 341.687952 77.197.128.64 -> 41.177.26.15 TCP 64 44991 > http [ACK] Seq=309 Ack=160445 Win=65535 Len=0
1015238 341.688131 77.197.128.64 -> 41.177.26.15 TCP 64 44991 > http [ACK] Seq=309 Ack=164265 Win=65535 Len=0
1015239 341.688135 77.197.128.64 -> 41.177.26.15 TCP 64 44991 > http [ACK] Seq=309 Ack=167185 Win=65535 Len=0
1015240 341.688139 77.197.128.64 -> 41.177.26.15 TCP 64 44991 > http [ACK] Seq=309 Ack=172465 Win=60255 Len=0
1015246 341.688465 77.197.128.64 -> 41.177.26.15 TCP 64 [TCP Window Update] 44991 > http [ACK] Seq=309 Ack=172465 Win=65535 Len=0
1015247 341.688468 77.197.128.64 -> 41.177.26.15 TCP 64 44991 > http [ACK] Seq=309 Ack=175385 Win=65535 Len=0
1015248 341.688472 77.197.128.64 -> 41.177.26.15 TCP 64 44991 > http [ACK] Seq=309 Ack=178305 Win=65535 Len=0
1015249 341.688476 77.197.128.64 -> 41.177.26.15 TCP 64 44991 > http [ACK] Seq=309 Ack=180665 Win=65527 Len=0
1015250 341.688481 77.197.128.64 -> 41.177.26.15 TCP 64 [TCP Dup ACK 1015249#1] 44991 > http [ACK] Seq=309 Ack=180665 Win=65527 Len=0
1015253 341.688536 77.197.128.64 -> 41.177.26.15 TCP 64 44991 > http [ACK] Seq=309 Ack=187965 Win=65535 Len=0
1015255 341.688584 77.197.128.64 -> 41.177.26.15 TCP 64 44991 > http [ACK] Seq=309 Ack=188865 Win=64635 Len=0
1015256 341.688752 77.197.128.64 -> 41.177.26.15 TCP 64 44991 > http [ACK] Seq=309 Ack=191785 Win=65535 Len=0
1015257 341.688756 77.197.128.64 -> 41.177.26.15 TCP 64 44991 > http [ACK] Seq=309 Ack=197065 Win=65527 Len=0
1015258 341.688761 77.197.128.64 -> 41.177.26.15 TCP 64 [TCP Dup ACK 1015257#1] 44991 > http [ACK] Seq=309 Ack=197065 Win=65527 Len=0
1015266 341.688949 77.197.128.64 -> 41.177.26.15 TCP 64 44991 > http [ACK] Seq=309 Ack=201445 Win=65535 Len=0
1015269 341.689082 77.197.128.64 -> 41.177.26.15 TCP 64 44991 > http [ACK] Seq=309 Ack=204365 Win=65535 Len=0
1015273 341.689162 77.197.128.64 -> 41.177.26.15 TCP 64 44991 > http [ACK] Seq=309 Ack=205265 Win=64635 Len=0
1015480 341.766945 77.197.128.64 -> 41.177.26.15 TCP 64 44991 > http [ACK] Seq=309 Ack=208185 Win=65535 Len=0
1015481 341.767027 77.197.128.64 -> 41.177.26.15 TCP 64 44991 > http [ACK] Seq=309 Ack=213465 Win=65527 Len=0
1015482 341.767032 77.197.128.64 -> 41.177.26.15 TCP 64 [TCP Dup ACK 1015481#1] 44991 > http [ACK] Seq=309 Ack=213465 Win=65527 Len=0
1015486 341.767220 77.197.128.64 -> 41.177.26.15 TCP 64 44991 > http [ACK] Seq=309 Ack=216385 Win=65535 Len=0
1015494 341.767385 77.197.128.64 -> 41.177.26.15 TCP 64 44991 > http [ACK] Seq=309 Ack=221665 Win=65535 Len=0
1015499 341.767639 77.197.128.64 -> 41.177.26.15 TCP 64 44991 > http [ACK] Seq=309 Ack=224585 Win=65535 Len=0
1015500 341.767643 77.197.128.64 -> 41.177.26.15 TCP 64 44991 > http [ACK] Seq=309 Ack=227505 Win=65535 Len=0
1015505 341.767898 77.197.128.64 -> 41.177.26.15 TCP 64 44991 > http [ACK] Seq=309 Ack=229865 Win=65535 Len=0
1015507 341.768014 77.197.128.64 -> 41.177.26.15 TCP 64 44991 > http [ACK] Seq=309 Ack=234245 Win=65535 Len=0
1015508 341.768029 77.197.128.64 -> 41.177.26.15 TCP 64 44991 > http [ACK] Seq=309 Ack=237165 Win=65535 Len=0
1015516 341.768268 77.197.128.64 -> 41.177.26.15 TCP 64 44991 > http [ACK] Seq=309 Ack=239525 Win=65535 Len=0
1015518 341.768352 77.197.128.64 -> 41.177.26.15 TCP 64 44991 > http [ACK] Seq=309 Ack=242445 Win=65535 Len=0
1015519 341.768356 77.197.128.64 -> 41.177.26.15 TCP 64 44991 > http [ACK] Seq=309 Ack=245365 Win=65535 Len=0
1015525 341.768582 77.197.128.64 -> 41.177.26.15 TCP 64 44991 > http [ACK] Seq=309 Ack=249185 Win=65535 Len=0
1015527 341.768663 77.197.128.64 -> 41.177.26.15 TCP 64 44991 > http [ACK] Seq=309 Ack=254465 Win=65535 Len=0
1015537 341.768963 77.197.128.64 -> 41.177.26.15 TCP 64 44991 > http [ACK] Seq=309 Ack=260305 Win=65535 Len=0
1015538 341.768968 77.197.128.64 -> 41.177.26.15 TCP 64 44991 > http [ACK] Seq=309 Ack=262665 Win=65535 Len=0
1015549 341.769243 77.197.128.64 -> 41.177.26.15 TCP 64 44991 > http [ACK] Seq=309 Ack=268505 Win=65535 Len=0
1015743 341.845987 77.197.128.64 -> 41.177.26.15 TCP 64 44991 > http [ACK] Seq=309 Ack=270865 Win=65535 Len=0
1015746 341.846162 77.197.128.64 -> 41.177.26.15 TCP 64 44991 > http [ACK] Seq=309 Ack=275245 Win=65535 Len=0
1015749 341.846214 77.197.128.64 -> 41.177.26.15 TCP 64 44991 > http [ACK] Seq=309 Ack=279065 Win=61715 Len=0
1015750 341.846218 77.197.128.64 -> 41.177.26.15 TCP 64 [TCP Window Update] 44991 > http [ACK] Seq=309 Ack=279065 Win=65535 Len=0
1015759 341.846491 77.197.128.64 -> 41.177.26.15 TCP 64 44991 > http [ACK] Seq=309 Ack=283445 Win=65535 Len=0
1015760 341.846621 77.197.128.64 -> 41.177.26.15 TCP 64 44991 > http [ACK] Seq=309 Ack=286365 Win=65535 Len=0
1015769 341.846814 77.197.128.64 -> 41.177.26.15 TCP 64 44991 > http [ACK] Seq=309 Ack=287265 Win=64635 Len=0
1015770 341.846892 77.197.128.64 -> 41.177.26.15 TCP 64 44991 > http [ACK] Seq=309 Ack=290185 Win=65535 Len=0
1015775 341.847066 77.197.128.64 -> 41.177.26.15 TCP 64 44991 > http [ACK] Seq=309 Ack=293105 Win=65535 Len=0
1015779 341.847355 77.197.128.64 -> 41.177.26.15 TCP 64 44991 > http [ACK] Seq=309 Ack=295465 Win=65535 Len=0
1015780 341.847359 77.197.128.64 -> 41.177.26.15 TCP 64 44991 > http [ACK] Seq=309 Ack=301305 Win=59695 Len=0
1015781 341.847364 77.197.128.64 -> 41.177.26.15 TCP 64 [TCP Window Update] 44991 > http [ACK] Seq=309 Ack=301305 Win=65535 Len=0
1015782 341.847368 77.197.128.64 -> 41.177.26.15 TCP 64 44991 > http [ACK] Seq=309 Ack=303665 Win=65535 Len=0
1015783 341.847495 77.197.128.64 -> 41.177.26.15 TCP 64 44991 > http [ACK] Seq=309 Ack=309505 Win=65535 Len=0
1015785 341.847704 77.197.128.64 -> 41.177.26.15 TCP 64 44991 > http [ACK] Seq=309 Ack=313325 Win=64067 Len=0
1015786 341.847709 77.197.128.64 -> 41.177.26.15 TCP 64 [TCP Window Update] 44991 > http [ACK] Seq=309 Ack=313325 Win=65535 Len=0
1015787 341.847841 77.197.128.64 -> 41.177.26.15 TCP 64 44991 > http [ACK] Seq=309 Ack=317705 Win=65535 Len=0
1015788 341.847993 77.197.128.64 -> 41.177.26.15 TCP 64 44991 > http [ACK] Seq=309 Ack=320065 Win=65535 Len=0
1015790 341.848140 77.197.128.64 -> 41.177.26.15 TCP 64 44991 > http [ACK] Seq=309 Ack=321525 Win=65535 Len=0
1015791 341.848252 77.197.128.64 -> 41.177.26.15 TCP 64 44991 > http [ACK] Seq=309 Ack=324445 Win=65535 Len=0
1015792 341.848375 77.197.128.64 -> 41.177.26.15 TCP 64 44991 > http [ACK] Seq=309 Ack=327365 Win=65535 Len=0
1015793 341.848735 77.197.128.64 -> 41.177.26.15 TCP 64 44991 > http [ACK] Seq=309 Ack=331185 Win=64067 Len=0
1015794 341.848739 77.197.128.64 -> 41.177.26.15 TCP 64 [TCP Window Update] 44991 > http [ACK] Seq=309 Ack=331185 Win=65535 Len=0
1015966 341.925486 77.197.128.64 -> 41.177.26.15 TCP 64 44991 > http [ACK] Seq=309 Ack=334105 Win=65535 Len=0
1015967 341.925523 77.197.128.64 -> 41.177.26.15 TCP 64 44991 > http [ACK] Seq=309 Ack=336465 Win=65535 Len=0
1015968 341.925528 77.197.128.64 -> 41.177.26.15 TCP 64 44991 > http [ACK] Seq=309 Ack=339385 Win=65527 Len=0
1015969 341.925532 77.197.128.64 -> 41.177.26.15 TCP 64 [TCP Dup ACK 1015968#1] 44991 > http [ACK] Seq=309 Ack=339385 Win=65527 Len=0
1015970 341.925702 77.197.128.64 -> 41.177.26.15 TCP 64 44991 > http [ACK] Seq=309 Ack=342305 Win=65535 Len=0
1015971 341.925930 77.197.128.64 -> 41.177.26.15 TCP 64 44991 > http [ACK] Seq=309 Ack=344665 Win=65535 Len=0
1015972 341.926012 77.197.128.64 -> 41.177.26.15 TCP 64 44991 > http [ACK] Seq=309 Ack=347585 Win=65535 Len=0
1015974 341.926358 77.197.128.64 -> 41.177.26.15 TCP 64 44991 > http [ACK] Seq=309 Ack=350505 Win=65527 Len=0
1015975 341.926362 77.197.128.64 -> 41.177.26.15 TCP 64 [TCP Dup ACK 1015974#1] 44991 > http [ACK] Seq=309 Ack=350505 Win=65527 Len=0
1015976 341.926367 77.197.128.64 -> 41.177.26.15 TCP 64 44991 > http [ACK] Seq=309 Ack=352865 Win=65535 Len=0
1015977 341.926641 77.197.128.64 -> 41.177.26.15 TCP 64 44991 > http [ACK] Seq=309 Ack=356206 Win=65535 Len=0
1016028 341.950817 77.197.128.64 -> 41.177.26.15 TCP 64 44991 > http [RST, ACK] Seq=309 Ack=356206 Win=0 Len=0
