197211  67.613415 77.197.128.150 -> 41.177.26.91 TCP 66 32220 > http [SYN] Seq=0 Win=65535 Len=0 MSS=1460 SACK_PERM=1
197423  67.695530 77.197.128.150 -> 41.177.26.91 TCP 64 32220 > http [ACK] Seq=1 Ack=1 Win=65535 Len=0
197758  67.835341 77.197.128.150 -> 41.177.26.91 TCP 64 32220 > http [ACK] Seq=311 Ack=2921 Win=65535 Len=0
197976  67.917051 77.197.128.150 -> 41.177.26.91 TCP 64 32220 > http [ACK] Seq=311 Ack=8761 Win=65535 Len=0
198144  67.998746 77.197.128.150 -> 41.177.26.91 TCP 64 32220 > http [ACK] Seq=311 Ack=14672 Win=65535 Len=0
198146  67.999035 77.197.128.150 -> 41.177.26.91 TCP 64 32220 > http [RST, ACK] Seq=311 Ack=14672 Win=0 Len=0
227981  78.198637 77.197.128.150 -> 41.177.26.91 TCP 66 38520 > http [SYN] Seq=0 Win=65535 Len=0 MSS=1460 SACK_PERM=1
228124  78.280210 77.197.128.150 -> 41.177.26.91 TCP 64 38520 > http [ACK] Seq=1 Ack=1 Win=65535 Len=0
228551  78.488987 77.197.128.150 -> 41.177.26.91 TCP 64 38520 > http [ACK] Seq=330 Ack=2921 Win=65535 Len=0
228735  78.571217 77.197.128.150 -> 41.177.26.91 TCP 64 38520 > http [ACK] Seq=330 Ack=5841 Win=65535 Len=0
228738  78.571422 77.197.128.150 -> 41.177.26.91 TCP 64 38520 > http [ACK] Seq=330 Ack=8761 Win=65535 Len=0
228904  78.653105 77.197.128.150 -> 41.177.26.91 TCP 64 38520 > http [ACK] Seq=330 Ack=11681 Win=65535 Len=0
228905  78.653280 77.197.128.150 -> 41.177.26.91 TCP 64 38520 > http [ACK] Seq=330 Ack=14601 Win=65535 Len=0
228906  78.653285 77.197.128.150 -> 41.177.26.91 TCP 64 38520 > http [ACK] Seq=330 Ack=17114 Win=65535 Len=0
228907  78.654016 77.197.128.150 -> 41.177.26.91 TCP 64 38520 > http [RST, ACK] Seq=330 Ack=17114 Win=0 Len=0
235117  81.847127 77.197.128.150 -> 41.177.26.91 TCP 66 40400 > http [SYN] Seq=0 Win=65535 Len=0 MSS=1460 SACK_PERM=1
235229  81.928686 77.197.128.150 -> 41.177.26.91 TCP 64 40400 > http [ACK] Seq=1 Ack=1 Win=65535 Len=0
235622  82.144585 77.197.128.150 -> 41.177.26.91 TCP 64 40400 > http [ACK] Seq=313 Ack=4381 Win=65535 Len=0
235752  82.226276 77.197.128.150 -> 41.177.26.91 TCP 64 40400 > http [ACK] Seq=313 Ack=8761 Win=65535 Len=0
236223  82.308170 77.197.128.150 -> 41.177.26.91 TCP 64 40400 > http [ACK] Seq=313 Ack=11681 Win=65535 Len=0
236225  82.308265 77.197.128.150 -> 41.177.26.91 TCP 64 40400 > http [ACK] Seq=313 Ack=16061 Win=65535 Len=0
237184  82.390700 77.197.128.150 -> 41.177.26.91 TCP 64 40400 > http [ACK] Seq=313 Ack=19178 Win=65535 Len=0
237187  82.391444 77.197.128.150 -> 41.177.26.91 TCP 64 40400 > http [RST, ACK] Seq=313 Ack=19178 Win=0 Len=0
238756  82.849821 77.197.128.150 -> 41.177.26.91 TCP 66 40914 > http [SYN] Seq=0 Win=65535 Len=0 MSS=1460 SACK_PERM=1
238951  82.931331 77.197.128.150 -> 41.177.26.91 TCP 64 40914 > http [ACK] Seq=1 Ack=1 Win=65535 Len=0
239214  83.086106 77.197.128.150 -> 41.177.26.91 TCP 64 40914 > http [ACK] Seq=303 Ack=2921 Win=65535 Len=0
239567  83.167873 77.197.128.150 -> 41.177.26.91 TCP 64 40914 > http [ACK] Seq=303 Ack=5841 Win=65535 Len=0
239568  83.167877 77.197.128.150 -> 41.177.26.91 TCP 64 40914 > http [ACK] Seq=303 Ack=8761 Win=65535 Len=0
239744  83.249813 77.197.128.150 -> 41.177.26.91 TCP 64 40914 > http [ACK] Seq=303 Ack=13141 Win=65535 Len=0
239745  83.249818 77.197.128.150 -> 41.177.26.91 TCP 64 40914 > http [ACK] Seq=303 Ack=14856 Win=65535 Len=0
239746  83.250183 77.197.128.150 -> 41.177.26.91 TCP 64 40914 > http [RST, ACK] Seq=303 Ack=14856 Win=0 Len=0
240207  83.372577 77.197.128.150 -> 41.177.26.91 TCP 66 41273 > http [SYN] Seq=0 Win=65535 Len=0 MSS=1460 SACK_PERM=1
240435  83.454497 77.197.128.150 -> 41.177.26.91 TCP 64 41273 > http [ACK] Seq=1 Ack=1 Win=65535 Len=0
240814  83.696149 77.197.128.150 -> 41.177.26.91 TCP 64 41273 > http [ACK] Seq=302 Ack=2921 Win=65535 Len=0
240944  83.777993 77.197.128.150 -> 41.177.26.91 TCP 64 41273 > http [ACK] Seq=302 Ack=5841 Win=65535 Len=0
240945  83.777997 77.197.128.150 -> 41.177.26.91 TCP 64 41273 > http [ACK] Seq=302 Ack=8761 Win=65535 Len=0
241138  83.859924 77.197.128.150 -> 41.177.26.91 TCP 64 41273 > http [ACK] Seq=302 Ack=13141 Win=65535 Len=0
241139  83.859929 77.197.128.150 -> 41.177.26.91 TCP 64 41273 > http [ACK] Seq=302 Ack=17521 Win=65535 Len=0
241217  83.942289 77.197.128.150 -> 41.177.26.91 TCP 64 41273 > http [RST, ACK] Seq=302 Ack=18548 Win=0 Len=0
