295822  99.834587 77.197.239.40 -> 41.177.26.176 TCP 66 policyserver > http [SYN] Seq=0 Win=65535 Len=0 MSS=1460 SACK_PERM=1
296032  99.913726 77.197.239.40 -> 41.177.26.176 TCP 64 policyserver > http [ACK] Seq=1 Ack=1 Win=65535 Len=0
296446 100.123489 77.197.239.40 -> 41.177.26.176 TCP 64 policyserver > http [RST, ACK] Seq=455 Ack=254 Win=0 Len=0
296463 100.138233 77.197.239.40 -> 41.177.26.176 TCP 64 policyserver > http [RST] Seq=455 Win=0 Len=0
296464 100.138263 77.197.239.40 -> 41.177.26.176 TCP 64 policyserver > http [RST] Seq=455 Win=0 Len=0
354794 120.846511 77.197.239.40 -> 41.177.26.176 TCP 66 ldap-admin > http [SYN] Seq=0 Win=65535 Len=0 MSS=1460 SACK_PERM=1
354872 120.925523 77.197.239.40 -> 41.177.26.176 TCP 64 ldap-admin > http [ACK] Seq=1 Ack=1 Win=65535 Len=0
356201 121.531445 77.197.239.40 -> 41.177.26.176 TCP 64 ldap-admin > http [ACK] Seq=463 Ack=3023 Win=65535 Len=0
356381 121.610777 77.197.239.40 -> 41.177.26.176 TCP 64 ldap-admin > http [ACK] Seq=463 Ack=5079 Win=65535 Len=0
356556 121.689913 77.197.239.40 -> 41.177.26.176 TCP 64 ldap-admin > http [ACK] Seq=463 Ack=7393 Win=65535 Len=0
356557 121.690525 77.197.239.40 -> 41.177.26.176 TCP 64 ldap-admin > http [RST, ACK] Seq=463 Ack=7393 Win=0 Len=0
