7892   2.763371 77.197.128.41 -> 41.177.26.176 TCP 64 editbench > http [ACK] Seq=1 Ack=4381 Win=65535 Len=0
8073   2.842424 77.197.128.41 -> 41.177.26.176 TCP 64 editbench > http [ACK] Seq=1 Ack=7301 Win=65535 Len=0
8074   2.842616 77.197.128.41 -> 41.177.26.176 TCP 64 editbench > http [ACK] Seq=1 Ack=11681 Win=64075 Len=0
8268   2.921623 77.197.128.41 -> 41.177.26.176 TCP 64 editbench > http [ACK] Seq=1 Ack=16061 Win=59695 Len=0
8269   2.921627 77.197.128.41 -> 41.177.26.176 TCP 64 editbench > http [ACK] Seq=1 Ack=20441 Win=55315 Len=0
8397   3.000628 77.197.128.41 -> 41.177.26.176 TCP 64 editbench > http [ACK] Seq=1 Ack=23361 Win=52395 Len=0
8398   3.000633 77.197.128.41 -> 41.177.26.176 TCP 64 editbench > http [ACK] Seq=1 Ack=27741 Win=48015 Len=0
8399   3.000838 77.197.128.41 -> 41.177.26.176 TCP 64 editbench > http [ACK] Seq=1 Ack=30661 Win=45095 Len=0
8400   3.000843 77.197.128.41 -> 41.177.26.176 TCP 64 editbench > http [ACK] Seq=1 Ack=33581 Win=42175 Len=0
8752   3.079682 77.197.128.41 -> 41.177.26.176 TCP 64 editbench > http [ACK] Seq=1 Ack=37961 Win=37795 Len=0
8753   3.079686 77.197.128.41 -> 41.177.26.176 TCP 64 editbench > http [ACK] Seq=1 Ack=40881 Win=34875 Len=0
8754   3.079854 77.197.128.41 -> 41.177.26.176 TCP 64 editbench > http [ACK] Seq=1 Ack=45261 Win=30495 Len=0
8759   3.079973 77.197.128.41 -> 41.177.26.176 TCP 64 editbench > http [ACK] Seq=1 Ack=49641 Win=26115 Len=0
8767   3.080138 77.197.128.41 -> 41.177.26.176 TCP 64 editbench > http [ACK] Seq=1 Ack=52561 Win=23195 Len=0
8821   3.158647 77.197.128.41 -> 41.177.26.176 TCP 64 editbench > http [ACK] Seq=1 Ack=55481 Win=20275 Len=0
8822   3.158714 77.197.128.41 -> 41.177.26.176 TCP 64 editbench > http [ACK] Seq=1 Ack=59861 Win=15895 Len=0
8823   3.158856 77.197.128.41 -> 41.177.26.176 TCP 64 editbench > http [ACK] Seq=1 Ack=64241 Win=11515 Len=0
8824   3.158988 77.197.128.41 -> 41.177.26.176 TCP 64 editbench > http [ACK] Seq=1 Ack=73001 Win=2755 Len=0
9051   3.281661 77.197.128.41 -> 41.177.26.176 TCP 64 editbench > http [ACK] Seq=1 Ack=74461 Win=1295 Len=0
9072   3.288516 77.197.128.41 -> 41.177.26.176 TCP 64 [TCP Window Update] editbench > http [ACK] Seq=1 Ack=74461 Win=4767 Len=0
9076   3.288801 77.197.128.41 -> 41.177.26.176 TCP 64 [TCP Window Update] editbench > http [ACK] Seq=1 Ack=74461 Win=65535 Len=0
9248   3.367593 77.197.128.41 -> 41.177.26.176 TCP 64 editbench > http [ACK] Seq=1 Ack=78841 Win=65535 Len=0
9251   3.367846 77.197.128.41 -> 41.177.26.176 TCP 64 editbench > http [ACK] Seq=1 Ack=86141 Win=62047 Len=0
9252   3.367850 77.197.128.41 -> 41.177.26.176 TCP 64 [TCP Window Update] editbench > http [ACK] Seq=1 Ack=86141 Win=65535 Len=0
9256   3.368029 77.197.128.41 -> 41.177.26.176 TCP 64 editbench > http [ACK] Seq=1 Ack=91721 Win=65535 Len=0
9257   3.368033 77.197.128.41 -> 41.177.26.176 TCP 64 editbench > http [ACK] Seq=1 Ack=96101 Win=63767 Len=0
9258   3.368037 77.197.128.41 -> 41.177.26.176 TCP 64 [TCP Window Update] editbench > http [ACK] Seq=1 Ack=96101 Win=65535 Len=0
9260   3.368051 77.197.128.41 -> 41.177.26.176 TCP 64 editbench > http [ACK] Seq=1 Ack=101941 Win=65535 Len=0
9267   3.368251 77.197.128.41 -> 41.177.26.176 TCP 64 editbench > http [ACK] Seq=1 Ack=107781 Win=63507 Len=0
9268   3.368255 77.197.128.41 -> 41.177.26.176 TCP 64 [TCP Window Update] editbench > http [ACK] Seq=1 Ack=107781 Win=65535 Len=0
9751   3.446554 77.197.128.41 -> 41.177.26.176 TCP 64 editbench > http [ACK] Seq=1 Ack=110701 Win=65535 Len=0
9752   3.446672 77.197.128.41 -> 41.177.26.176 TCP 64 editbench > http [ACK] Seq=1 Ack=113621 Win=65535 Len=0
9756   3.446826 77.197.128.41 -> 41.177.26.176 TCP 64 editbench > http [ACK] Seq=1 Ack=116541 Win=64967 Len=0
9757   3.446829 77.197.128.41 -> 41.177.26.176 TCP 64 [TCP Dup ACK 9756#1] editbench > http [ACK] Seq=1 Ack=116541 Win=64967 Len=0
9758   3.446834 77.197.128.41 -> 41.177.26.176 TCP 64 editbench > http [ACK] Seq=1 Ack=120921 Win=65535 Len=0
9768   3.447115 77.197.128.41 -> 41.177.26.176 TCP 64 editbench > http [ACK] Seq=1 Ack=126761 Win=65535 Len=0
9769   3.447119 77.197.128.41 -> 41.177.26.176 TCP 64 editbench > http [ACK] Seq=1 Ack=129769 Win=64879 Len=0
9770   3.447124 77.197.128.41 -> 41.177.26.176 TCP 64 [TCP Dup ACK 9769#1] editbench > http [ACK] Seq=1 Ack=129769 Win=64879 Len=0
9772   3.447131 77.197.128.41 -> 41.177.26.176 TCP 64 editbench > http [ACK] Seq=1 Ack=135609 Win=65535 Len=0
9773   3.447234 77.197.128.41 -> 41.177.26.176 TCP 64 editbench > http [ACK] Seq=1 Ack=139989 Win=63507 Len=0
9774   3.447239 77.197.128.41 -> 41.177.26.176 TCP 64 [TCP Window Update] editbench > http [ACK] Seq=1 Ack=139989 Win=65535 Len=0
9779   3.447331 77.197.128.41 -> 41.177.26.176 TCP 64 editbench > http [ACK] Seq=1 Ack=142909 Win=65535 Len=0
9781   3.447365 77.197.128.41 -> 41.177.26.176 TCP 64 editbench > http [ACK] Seq=1 Ack=145829 Win=65535 Len=0
9788   3.447510 77.197.128.41 -> 41.177.26.176 TCP 64 editbench > http [ACK] Seq=1 Ack=148797 Win=65535 Len=0
10084   3.525624 77.197.128.41 -> 41.177.26.176 TCP 64 editbench > http [ACK] Seq=1 Ack=154637 Win=65535 Len=0
10088   3.525703 77.197.128.41 -> 41.177.26.176 TCP 64 editbench > http [ACK] Seq=1 Ack=159017 Win=63507 Len=0
10089   3.525707 77.197.128.41 -> 41.177.26.176 TCP 64 [TCP Window Update] editbench > http [ACK] Seq=1 Ack=159017 Win=65535 Len=0
10091   3.525826 77.197.128.41 -> 41.177.26.176 TCP 64 editbench > http [ACK] Seq=1 Ack=163397 Win=65535 Len=0
10100   3.525949 77.197.128.41 -> 41.177.26.176 TCP 64 editbench > http [ACK] Seq=1 Ack=167777 Win=65535 Len=0
10104   3.526061 77.197.128.41 -> 41.177.26.176 TCP 64 editbench > http [ACK] Seq=1 Ack=169285 Win=65535 Len=0
10112   3.526224 77.197.128.41 -> 41.177.26.176 TCP 64 editbench > http [ACK] Seq=1 Ack=173665 Win=63459 Len=0
10113   3.526228 77.197.128.41 -> 41.177.26.176 TCP 64 [TCP Window Update] editbench > http [ACK] Seq=1 Ack=173665 Win=65535 Len=0
10115   3.526246 77.197.128.41 -> 41.177.26.176 TCP 64 editbench > http [ACK] Seq=1 Ack=176585 Win=65535 Len=0
10116   3.526249 77.197.128.41 -> 41.177.26.176 TCP 64 editbench > http [ACK] Seq=1 Ack=179505 Win=65535 Len=0
10119   3.526343 77.197.128.41 -> 41.177.26.176 TCP 64 editbench > http [ACK] Seq=1 Ack=186805 Win=63507 Len=0
10120   3.526347 77.197.128.41 -> 41.177.26.176 TCP 64 [TCP Window Update] editbench > http [ACK] Seq=1 Ack=186805 Win=65535 Len=0
10121   3.526351 77.197.128.41 -> 41.177.26.176 TCP 64 editbench > http [ACK] Seq=1 Ack=189773 Win=65535 Len=0
10122   3.526356 77.197.128.41 -> 41.177.26.176 TCP 64 editbench > http [ACK] Seq=1 Ack=192693 Win=65535 Len=0
10125   3.526495 77.197.128.41 -> 41.177.26.176 TCP 64 editbench > http [ACK] Seq=1 Ack=198533 Win=64967 Len=0
10131   3.526630 77.197.128.41 -> 41.177.26.176 TCP 64 [TCP Dup ACK 10125#1] editbench > http [ACK] Seq=1 Ack=198533 Win=64967 Len=0
10134   3.526673 77.197.128.41 -> 41.177.26.176 TCP 64 editbench > http [ACK] Seq=1 Ack=202913 Win=65535 Len=0
10135   3.526677 77.197.128.41 -> 41.177.26.176 TCP 64 editbench > http [ACK] Seq=1 Ack=205833 Win=65535 Len=0
10407   3.604599 77.197.128.41 -> 41.177.26.176 TCP 64 editbench > http [ACK] Seq=1 Ack=210261 Win=65535 Len=0
10408   3.604679 77.197.128.41 -> 41.177.26.176 TCP 64 editbench > http [ACK] Seq=1 Ack=211721 Win=65535 Len=0
10409   3.604799 77.197.128.41 -> 41.177.26.176 TCP 64 editbench > http [ACK] Seq=1 Ack=214641 Win=65535 Len=0
10414   3.604891 77.197.128.41 -> 41.177.26.176 TCP 64 editbench > http [ACK] Seq=1 Ack=219021 Win=65535 Len=0
10415   3.604895 77.197.128.41 -> 41.177.26.176 TCP 64 editbench > http [ACK] Seq=1 Ack=221941 Win=65535 Len=0
10418   3.604944 77.197.128.41 -> 41.177.26.176 TCP 64 editbench > http [ACK] Seq=1 Ack=224861 Win=65535 Len=0
10421   3.605016 77.197.128.41 -> 41.177.26.176 TCP 64 editbench > http [ACK] Seq=1 Ack=229241 Win=65535 Len=0
10430   3.605204 77.197.128.41 -> 41.177.26.176 TCP 64 editbench > http [ACK] Seq=1 Ack=230749 Win=65535 Len=0
10435   3.605480 77.197.128.41 -> 41.177.26.176 TCP 64 editbench > http [ACK] Seq=1 Ack=233669 Win=65535 Len=0
10436   3.605484 77.197.128.41 -> 41.177.26.176 TCP 64 editbench > http [ACK] Seq=1 Ack=238049 Win=65535 Len=0
10437   3.605489 77.197.128.41 -> 41.177.26.176 TCP 64 editbench > http [ACK] Seq=1 Ack=242429 Win=65535 Len=0
10438   3.605493 77.197.128.41 -> 41.177.26.176 TCP 64 editbench > http [ACK] Seq=1 Ack=245349 Win=65535 Len=0
10439   3.605584 77.197.128.41 -> 41.177.26.176 TCP 64 editbench > http [ACK] Seq=1 Ack=249729 Win=65535 Len=0
10443   3.605723 77.197.128.41 -> 41.177.26.176 TCP 64 editbench > http [ACK] Seq=1 Ack=255569 Win=65535 Len=0
10446   3.605768 77.197.128.41 -> 41.177.26.176 TCP 64 editbench > http [ACK] Seq=1 Ack=258489 Win=65535 Len=0
10453   3.605907 77.197.128.41 -> 41.177.26.176 TCP 64 editbench > http [ACK] Seq=1 Ack=264329 Win=65535 Len=0
10458   3.605993 77.197.128.41 -> 41.177.26.176 TCP 64 editbench > http [ACK] Seq=1 Ack=267249 Win=65535 Len=0
10459   3.605997 77.197.128.41 -> 41.177.26.176 TCP 64 editbench > http [ACK] Seq=1 Ack=270169 Win=65535 Len=0
10490   3.611172 77.197.128.41 -> 41.177.26.176 TCP 66 ctx-bridge > http [SYN] Seq=0 Win=65535 Len=0 MSS=1460 SACK_PERM=1
11268   3.683583 77.197.128.41 -> 41.177.26.176 TCP 64 editbench > http [ACK] Seq=1 Ack=271717 Win=65535 Len=0
11277   3.683883 77.197.128.41 -> 41.177.26.176 TCP 64 editbench > http [ACK] Seq=1 Ack=274637 Win=65535 Len=0
11278   3.683888 77.197.128.41 -> 41.177.26.176 TCP 64 editbench > http [ACK] Seq=1 Ack=280477 Win=63419 Len=0
11279   3.683892 77.197.128.41 -> 41.177.26.176 TCP 64 [TCP Window Update] editbench > http [ACK] Seq=1 Ack=280477 Win=65535 Len=0
11280   3.683923 77.197.128.41 -> 41.177.26.176 TCP 64 editbench > http [ACK] Seq=1 Ack=284857 Win=65535 Len=0
11288   3.683982 77.197.128.41 -> 41.177.26.176 TCP 64 editbench > http [ACK] Seq=1 Ack=289237 Win=65535 Len=0
11291   3.684011 77.197.128.41 -> 41.177.26.176 TCP 64 editbench > http [ACK] Seq=1 Ack=292205 Win=62567 Len=0
11293   3.684019 77.197.128.41 -> 41.177.26.176 TCP 64 [TCP Window Update] editbench > http [ACK] Seq=1 Ack=292205 Win=65535 Len=0
11298   3.684149 77.197.128.41 -> 41.177.26.176 TCP 64 editbench > http [ACK] Seq=1 Ack=293665 Win=65535 Len=0
11321   3.684618 77.197.128.41 -> 41.177.26.176 TCP 64 editbench > http [ACK] Seq=1 Ack=296585 Win=65535 Len=0
11323   3.684637 77.197.128.41 -> 41.177.26.176 TCP 64 editbench > http [ACK] Seq=1 Ack=299505 Win=65535 Len=0
11324   3.684641 77.197.128.41 -> 41.177.26.176 TCP 64 editbench > http [ACK] Seq=1 Ack=302425 Win=64967 Len=0
11325   3.684644 77.197.128.41 -> 41.177.26.176 TCP 64 [TCP Dup ACK 11324#1] editbench > http [ACK] Seq=1 Ack=302425 Win=64967 Len=0
11336   3.684755 77.197.128.41 -> 41.177.26.176 TCP 64 editbench > http [ACK] Seq=1 Ack=306805 Win=65535 Len=0
11337   3.684759 77.197.128.41 -> 41.177.26.176 TCP 64 editbench > http [ACK] Seq=1 Ack=309725 Win=65535 Len=0
11347   3.684992 77.197.128.41 -> 41.177.26.176 TCP 64 editbench > http [ACK] Seq=1 Ack=311185 Win=65535 Len=0
11348   3.684997 77.197.128.41 -> 41.177.26.176 TCP 64 editbench > http [ACK] Seq=1 Ack=312693 Win=65535 Len=0
11349   3.685028 77.197.128.41 -> 41.177.26.176 TCP 64 editbench > http [ACK] Seq=1 Ack=318533 Win=65535 Len=0
11350   3.685033 77.197.128.41 -> 41.177.26.176 TCP 64 editbench > http [ACK] Seq=1 Ack=321453 Win=62615 Len=0
11351   3.685093 77.197.128.41 -> 41.177.26.176 TCP 64 [TCP Window Update] editbench > http [ACK] Seq=1 Ack=321453 Win=65535 Len=0
11352   3.685097 77.197.128.41 -> 41.177.26.176 TCP 64 editbench > http [ACK] Seq=1 Ack=325833 Win=65535 Len=0
11358   3.685346 77.197.128.41 -> 41.177.26.176 TCP 64 editbench > http [ACK] Seq=1 Ack=328753 Win=65535 Len=0
11360   3.685355 77.197.128.41 -> 41.177.26.176 TCP 64 editbench > http [ACK] Seq=1 Ack=333181 Win=65535 Len=0
11362   3.685487 77.197.128.41 -> 41.177.26.176 TCP 64 editbench > http [ACK] Seq=1 Ack=334641 Win=65535 Len=0
11549   3.690126 77.197.128.41 -> 41.177.26.176 TCP 64 ctx-bridge > http [ACK] Seq=1 Ack=1 Win=65535 Len=0
12304   3.762944 77.197.128.41 -> 41.177.26.176 TCP 64 editbench > http [ACK] Seq=1 Ack=341941 Win=65535 Len=0
12305   3.762948 77.197.128.41 -> 41.177.26.176 TCP 64 editbench > http [ACK] Seq=1 Ack=346321 Win=61155 Len=0
12306   3.763092 77.197.128.41 -> 41.177.26.176 TCP 64 [TCP Window Update] editbench > http [ACK] Seq=1 Ack=346321 Win=65535 Len=0
12307   3.763106 77.197.128.41 -> 41.177.26.176 TCP 64 editbench > http [ACK] Seq=1 Ack=350701 Win=65535 Len=0
12308   3.763110 77.197.128.41 -> 41.177.26.176 TCP 64 editbench > http [ACK] Seq=1 Ack=353669 Win=65535 Len=0
12310   3.763303 77.197.128.41 -> 41.177.26.176 TCP 64 editbench > http [ACK] Seq=1 Ack=356589 Win=62615 Len=0
12311   3.763308 77.197.128.41 -> 41.177.26.176 TCP 64 [TCP Window Update] editbench > http [ACK] Seq=1 Ack=356589 Win=65535 Len=0
12312   3.763591 77.197.128.41 -> 41.177.26.176 TCP 64 editbench > http [ACK] Seq=1 Ack=360969 Win=65535 Len=0
12313   3.763596 77.197.128.41 -> 41.177.26.176 TCP 64 editbench > http [ACK] Seq=1 Ack=362624 Win=65535 Len=0
12319   3.767327 77.197.128.41 -> 41.177.26.176 TCP 64 editbench > http [RST, ACK] Seq=1 Ack=362624 Win=0 Len=0
14895   4.110445 77.197.128.41 -> 41.177.26.176 TCP 64 ctx-bridge > http [ACK] Seq=309 Ack=3915 Win=65535 Len=0
15257   4.189450 77.197.128.41 -> 41.177.26.176 TCP 64 ctx-bridge > http [ACK] Seq=309 Ack=6089 Win=65535 Len=0
15258   4.189455 77.197.128.41 -> 41.177.26.176 TCP 64 ctx-bridge > http [ACK] Seq=309 Ack=9009 Win=65535 Len=0
15891   4.316492 77.197.128.41 -> 41.177.26.176 TCP 64 ctx-bridge > http [ACK] Seq=309 Ack=11070 Win=65535 Len=0
15892   4.316785 77.197.128.41 -> 41.177.26.176 TCP 64 ctx-bridge > http [RST, ACK] Seq=309 Ack=11070 Win=0 Len=0
37195  15.512828 77.197.128.41 -> 41.177.26.176 TCP 66 12129 > http [SYN] Seq=0 Win=65535 Len=0 MSS=1460 SACK_PERM=1
37452  15.591913 77.197.128.41 -> 41.177.26.176 TCP 64 12129 > http [ACK] Seq=1 Ack=1 Win=65535 Len=0
38677  15.986956 77.197.128.41 -> 41.177.26.176 TCP 64 12129 > http [ACK] Seq=355 Ack=2245 Win=65535 Len=0
38868  16.066009 77.197.128.41 -> 41.177.26.176 TCP 64 12129 > http [ACK] Seq=355 Ack=6226 Win=65535 Len=0
39009  16.145055 77.197.128.41 -> 41.177.26.176 TCP 64 12129 > http [ACK] Seq=355 Ack=8467 Win=65535 Len=0
39011  16.145183 77.197.128.41 -> 41.177.26.176 TCP 64 12129 > http [ACK] Seq=355 Ack=11323 Win=65535 Len=0
39015  16.145377 77.197.128.41 -> 41.177.26.176 TCP 64 12129 > http [RST, ACK] Seq=355 Ack=11323 Win=0 Len=0
55985  23.009743 77.197.128.41 -> 41.177.26.176 TCP 66 13937 > http [SYN] Seq=0 Win=65535 Len=0 MSS=1460 SACK_PERM=1
56239  23.089186 77.197.128.41 -> 41.177.26.176 TCP 64 13937 > http [ACK] Seq=1 Ack=1 Win=65535 Len=0
57407  23.479724 77.197.128.41 -> 41.177.26.176 TCP 64 13937 > http [ACK] Seq=316 Ack=2602 Win=65535 Len=0
57815  23.558669 77.197.128.41 -> 41.177.26.176 TCP 64 13937 > http [ACK] Seq=316 Ack=6057 Win=65535 Len=0
58246  23.637817 77.197.128.41 -> 41.177.26.176 TCP 64 13937 > http [ACK] Seq=316 Ack=8977 Win=65535 Len=0
58247  23.637822 77.197.128.41 -> 41.177.26.176 TCP 64 13937 > http [ACK] Seq=316 Ack=11995 Win=65535 Len=0
58251  23.638583 77.197.128.41 -> 41.177.26.176 TCP 64 13937 > http [RST, ACK] Seq=316 Ack=11995 Win=0 Len=0
62493  25.694990 77.197.128.41 -> 41.177.26.176 TCP 66 14717 > http [SYN] Seq=0 Win=65535 Len=0 MSS=1460 SACK_PERM=1
62657  25.773895 77.197.128.41 -> 41.177.26.176 TCP 64 14717 > http [ACK] Seq=1 Ack=1 Win=65535 Len=0
63395  26.192872 77.197.128.41 -> 41.177.26.176 TCP 64 14717 > http [ACK] Seq=309 Ack=2602 Win=65535 Len=0
63396  26.192877 77.197.128.41 -> 41.177.26.176 TCP 64 14717 > http [ACK] Seq=309 Ack=3915 Win=64222 Len=0
63604  26.272049 77.197.128.41 -> 41.177.26.176 TCP 64 14717 > http [ACK] Seq=309 Ack=7549 Win=65535 Len=0
63605  26.272062 77.197.128.41 -> 41.177.26.176 TCP 64 14717 > http [ACK] Seq=309 Ack=10077 Win=65535 Len=0
63783  26.351210 77.197.128.41 -> 41.177.26.176 TCP 64 14717 > http [RST, ACK] Seq=309 Ack=11466 Win=0 Len=0
65408  26.986466 77.197.128.41 -> 41.177.26.176 TCP 66 15218 > http [SYN] Seq=0 Win=65535 Len=0 MSS=1460 SACK_PERM=1
65629  27.065966 77.197.128.41 -> 41.177.26.176 TCP 64 15218 > http [ACK] Seq=1 Ack=1 Win=65535 Len=0
66562  27.437298 77.197.128.41 -> 41.177.26.176 TCP 64 15218 > http [ACK] Seq=304 Ack=2914 Win=65535 Len=0
66748  27.516502 77.197.128.41 -> 41.177.26.176 TCP 64 15218 > http [ACK] Seq=304 Ack=6064 Win=65535 Len=0
67009  27.595354 77.197.128.41 -> 41.177.26.176 TCP 64 15218 > http [ACK] Seq=304 Ack=7951 Win=65535 Len=0
67011  27.595632 77.197.128.41 -> 41.177.26.176 TCP 64 15218 > http [ACK] Seq=304 Ack=11215 Win=65535 Len=0
67012  27.595874 77.197.128.41 -> 41.177.26.176 TCP 64 15218 > http [RST, ACK] Seq=304 Ack=11215 Win=0 Len=0
67722  27.874220 77.197.128.41 -> 41.177.26.176 TCP 66 15691 > http [SYN] Seq=0 Win=65535 Len=0 MSS=1460 SACK_PERM=1
67948  27.953210 77.197.128.41 -> 41.177.26.176 TCP 64 15691 > http [ACK] Seq=1 Ack=1 Win=65535 Len=0
68698  28.382785 77.197.128.41 -> 41.177.26.176 TCP 64 15691 > http [ACK] Seq=305 Ack=2431 Win=65535 Len=0
68815  28.461776 77.197.128.41 -> 41.177.26.176 TCP 64 15691 > http [ACK] Seq=305 Ack=6063 Win=65535 Len=0
68993  28.540768 77.197.128.41 -> 41.177.26.176 TCP 64 15691 > http [ACK] Seq=305 Ack=8937 Win=65535 Len=0
68994  28.540773 77.197.128.41 -> 41.177.26.176 TCP 64 15691 > http [ACK] Seq=305 Ack=12031 Win=64127 Len=0
68995  28.540777 77.197.128.41 -> 41.177.26.176 TCP 64 [TCP Dup ACK 68994#1] 15691 > http [ACK] Seq=305 Ack=12031 Win=64127 Len=0
68996  28.541034 77.197.128.41 -> 41.177.26.176 TCP 64 15691 > http [RST, ACK] Seq=305 Ack=12031 Win=0 Len=0
69157  28.658006 77.197.128.41 -> 41.177.26.176 TCP 66 16041 > http [SYN] Seq=0 Win=65535 Len=0 MSS=1460 SACK_PERM=1
69250  28.737050 77.197.128.41 -> 41.177.26.176 TCP 64 16041 > http [ACK] Seq=1 Ack=1 Win=65535 Len=0
70311  29.133748 77.197.128.41 -> 41.177.26.176 TCP 64 16041 > http [ACK] Seq=309 Ack=3911 Win=65535 Len=0
70562  29.212802 77.197.128.41 -> 41.177.26.176 TCP 64 16041 > http [ACK] Seq=309 Ack=9001 Win=65535 Len=0
70850  29.291751 77.197.128.41 -> 41.177.26.176 TCP 64 16041 > http [ACK] Seq=309 Ack=11175 Win=65535 Len=0
70851  29.292036 77.197.128.41 -> 41.177.26.176 TCP 64 16041 > http [RST, ACK] Seq=309 Ack=11175 Win=0 Len=0
70852  29.292362 77.197.128.41 -> 41.177.26.176 TCP 66 16289 > http [SYN] Seq=0 Win=65535 Len=0 MSS=1460 SACK_PERM=1
71124  29.371317 77.197.128.41 -> 41.177.26.176 TCP 64 16289 > http [ACK] Seq=1 Ack=1 Win=65535 Len=0
72903  29.788487 77.197.128.41 -> 41.177.26.176 TCP 64 16289 > http [ACK] Seq=353 Ack=2431 Win=65535 Len=0
72904  29.788508 77.197.128.41 -> 41.177.26.176 TCP 64 16289 > http [ACK] Seq=353 Ack=4059 Win=65535 Len=0
73185  29.867594 77.197.128.41 -> 41.177.26.176 TCP 64 16289 > http [ACK] Seq=353 Ack=6223 Win=65535 Len=0
73186  29.867599 77.197.128.41 -> 41.177.26.176 TCP 64 16289 > http [ACK] Seq=353 Ack=8298 Win=65535 Len=0
73187  29.867773 77.197.128.41 -> 41.177.26.176 TCP 64 16289 > http [ACK] Seq=353 Ack=11337 Win=65535 Len=0
73188  29.867965 77.197.128.41 -> 41.177.26.176 TCP 64 16289 > http [RST, ACK] Seq=353 Ack=11337 Win=0 Len=0
73348  29.918229 77.197.128.41 -> 41.177.26.176 TCP 66 16490 > http [SYN] Seq=0 Win=65535 Len=0 MSS=1460 SACK_PERM=1
73648  29.997194 77.197.128.41 -> 41.177.26.176 TCP 64 16490 > http [ACK] Seq=1 Ack=1 Win=65535 Len=0
79790  31.553726 77.197.128.41 -> 41.177.26.176 TCP 64 16490 > http [ACK] Seq=294 Ack=1476 Win=65535 Len=0
79830  31.563289 77.197.128.41 -> 41.177.26.176 TCP 64 16490 > http [ACK] Seq=294 Ack=2435 Win=64576 Len=0
79831  31.563584 77.197.128.41 -> 41.177.26.176 TCP 64 16490 > http [ACK] Seq=294 Ack=2725 Win=64286 Len=0
79832  31.563589 77.197.128.41 -> 41.177.26.176 TCP 64 16490 > http [ACK] Seq=294 Ack=3610 Win=65535 Len=0
80444  31.632689 77.197.128.41 -> 41.177.26.176 TCP 64 16490 > http [ACK] Seq=294 Ack=5947 Win=65535 Len=0
80484  31.642754 77.197.128.41 -> 41.177.26.176 TCP 64 16490 > http [ACK] Seq=294 Ack=9943 Win=65535 Len=0
80485  31.642889 77.197.128.41 -> 41.177.26.176 TCP 64 16490 > http [RST, ACK] Seq=294 Ack=9943 Win=0 Len=0
80917  31.721016 77.197.128.41 -> 41.177.26.176 TCP 66 17001 > http [SYN] Seq=0 Win=65535 Len=0 MSS=1460 SACK_PERM=1
81244  31.800262 77.197.128.41 -> 41.177.26.176 TCP 64 17001 > http [ACK] Seq=1 Ack=1 Win=65535 Len=0
82555  32.158972 77.197.128.41 -> 41.177.26.176 TCP 64 17001 > http [ACK] Seq=316 Ack=2431 Win=65535 Len=0
82557  32.159188 77.197.128.41 -> 41.177.26.176 TCP 64 17001 > http [ACK] Seq=316 Ack=3893 Win=65535 Len=0
82847  32.238084 77.197.128.41 -> 41.177.26.176 TCP 64 17001 > http [ACK] Seq=316 Ack=6057 Win=65535 Len=0
82848  32.238089 77.197.128.41 -> 41.177.26.176 TCP 64 17001 > http [ACK] Seq=316 Ack=9756 Win=65535 Len=0
83131  32.317043 77.197.128.41 -> 41.177.26.176 TCP 64 17001 > http [ACK] Seq=316 Ack=11396 Win=65535 Len=0
83133  32.317353 77.197.128.41 -> 41.177.26.176 TCP 64 17001 > http [RST, ACK] Seq=316 Ack=11396 Win=0 Len=0
83140  32.326932 77.197.128.41 -> 41.177.26.176 TCP 66 17159 > http [SYN] Seq=0 Win=65535 Len=0 MSS=1460 SACK_PERM=1
83335  32.406014 77.197.128.41 -> 41.177.26.176 TCP 64 17159 > http [ACK] Seq=1 Ack=1 Win=65535 Len=0
87798  33.987015 77.197.128.41 -> 41.177.26.176 TCP 66 17840 > http [SYN] Seq=0 Win=65535 Len=0 MSS=1460 SACK_PERM=1
87966  34.066104 77.197.128.41 -> 41.177.26.176 TCP 64 17840 > http [ACK] Seq=1 Ack=1 Win=65535 Len=0
89219  34.453486 77.197.128.41 -> 41.177.26.176 TCP 64 17159 > http [ACK] Seq=313 Ack=4381 Win=65535 Len=0
89391  34.532529 77.197.128.41 -> 41.177.26.176 TCP 64 17159 > http [ACK] Seq=313 Ack=8761 Win=65535 Len=0
89708  34.611529 77.197.128.41 -> 41.177.26.176 TCP 64 17159 > http [ACK] Seq=313 Ack=12022 Win=65535 Len=0
89710  34.611703 77.197.128.41 -> 41.177.26.176 TCP 64 17159 > http [RST, ACK] Seq=313 Ack=12022 Win=0 Len=0
91586  35.163270 77.197.128.41 -> 41.177.26.176 TCP 64 17840 > http [ACK] Seq=330 Ack=1462 Win=65535 Len=0
91618  35.174193 77.197.128.41 -> 41.177.26.176 TCP 64 17840 > http [ACK] Seq=330 Ack=2597 Win=64400 Len=0
91619  35.174349 77.197.128.41 -> 41.177.26.176 TCP 64 17840 > http [ACK] Seq=330 Ack=2926 Win=65535 Len=0
91952  35.243031 77.197.128.41 -> 41.177.26.176 TCP 64 17840 > http [ACK] Seq=330 Ack=4899 Win=65535 Len=0
91953  35.243036 77.197.128.41 -> 41.177.26.176 TCP 64 17840 > http [ACK] Seq=330 Ack=7298 Win=65535 Len=0
91983  35.253326 77.197.128.41 -> 41.177.26.176 TCP 64 17840 > http [ACK] Seq=330 Ack=9825 Win=65535 Len=0
91984  35.253525 77.197.128.41 -> 41.177.26.176 TCP 64 17840 > http [RST, ACK] Seq=330 Ack=9825 Win=0 Len=0
92384  35.380263 77.197.128.41 -> 41.177.26.176 TCP 66 18474 > http [SYN] Seq=0 Win=65535 Len=0 MSS=1460 SACK_PERM=1
92607  35.459447 77.197.128.41 -> 41.177.26.176 TCP 64 18474 > http [ACK] Seq=1 Ack=1 Win=65535 Len=0
94622  35.864241 77.197.128.41 -> 41.177.26.176 TCP 64 18474 > http [ACK] Seq=354 Ack=2431 Win=65535 Len=0
94933  35.943293 77.197.128.41 -> 41.177.26.176 TCP 64 18474 > http [ACK] Seq=354 Ack=6214 Win=65535 Len=0
95310  36.022280 77.197.128.41 -> 41.177.26.176 TCP 64 18474 > http [ACK] Seq=354 Ack=8368 Win=65535 Len=0
95312  36.022409 77.197.128.41 -> 41.177.26.176 TCP 64 18474 > http [ACK] Seq=354 Ack=11220 Win=64938 Len=0
95313  36.022414 77.197.128.41 -> 41.177.26.176 TCP 64 [TCP Dup ACK 95312#1] 18474 > http [ACK] Seq=354 Ack=11220 Win=64938 Len=0
95314  36.022688 77.197.128.41 -> 41.177.26.176 TCP 64 18474 > http [RST, ACK] Seq=354 Ack=11220 Win=0 Len=0
95430  36.042836 77.197.128.41 -> 41.177.26.176 TCP 66 18719 > http [SYN] Seq=0 Win=65535 Len=0 MSS=1460 SACK_PERM=1
95857  36.122187 77.197.128.41 -> 41.177.26.176 TCP 64 18719 > http [ACK] Seq=1 Ack=1 Win=65535 Len=0
97166  36.482569 77.197.128.41 -> 41.177.26.176 TCP 64 18719 > http [ACK] Seq=308 Ack=2431 Win=65535 Len=0
97758  36.562029 77.197.128.41 -> 41.177.26.176 TCP 64 18719 > http [ACK] Seq=308 Ack=6062 Win=65535 Len=0
98153  36.641150 77.197.128.41 -> 41.177.26.176 TCP 64 18719 > http [ACK] Seq=308 Ack=11182 Win=64976 Len=0
98154  36.641156 77.197.128.41 -> 41.177.26.176 TCP 64 [TCP Dup ACK 98153#1] 18719 > http [ACK] Seq=308 Ack=11182 Win=64976 Len=0
98155  36.641326 77.197.128.41 -> 41.177.26.176 TCP 64 18719 > http [RST, ACK] Seq=308 Ack=11864 Win=0 Len=0
98281  36.675723 77.197.128.41 -> 41.177.26.176 TCP 66 18923 > http [SYN] Seq=0 Win=65535 Len=0 MSS=1460 SACK_PERM=1
98541  36.754771 77.197.128.41 -> 41.177.26.176 TCP 64 18923 > http [ACK] Seq=1 Ack=1 Win=65535 Len=0
100567  37.117004 77.197.128.41 -> 41.177.26.176 TCP 64 18923 > http [ACK] Seq=353 Ack=2431 Win=65535 Len=0
100568  37.117180 77.197.128.41 -> 41.177.26.176 TCP 64 18923 > http [ACK] Seq=353 Ack=4052 Win=65535 Len=0
100866  37.195966 77.197.128.41 -> 41.177.26.176 TCP 64 18923 > http [ACK] Seq=353 Ack=6216 Win=65535 Len=0
100867  37.196197 77.197.128.41 -> 41.177.26.176 TCP 64 18923 > http [ACK] Seq=353 Ack=9136 Win=65535 Len=0
100868  37.196205 77.197.128.41 -> 41.177.26.176 TCP 64 18923 > http [ACK] Seq=353 Ack=11290 Win=65535 Len=0
100869  37.196378 77.197.128.41 -> 41.177.26.176 TCP 64 18923 > http [RST, ACK] Seq=353 Ack=11290 Win=0 Len=0
101428  37.292615 77.197.128.41 -> 41.177.26.176 TCP 66 19140 > http [SYN] Seq=0 Win=65535 Len=0 MSS=1460 SACK_PERM=1
101939  37.371490 77.197.128.41 -> 41.177.26.176 TCP 64 19140 > http [ACK] Seq=1 Ack=1 Win=65535 Len=0
104298  37.734578 77.197.128.41 -> 41.177.26.176 TCP 64 19140 > http [ACK] Seq=354 Ack=2431 Win=65535 Len=0
104463  37.814515 77.197.128.41 -> 41.177.26.176 TCP 64 19140 > http [ACK] Seq=354 Ack=7674 Win=65535 Len=0
104723  37.894002 77.197.128.41 -> 41.177.26.176 TCP 64 19140 > http [ACK] Seq=354 Ack=11458 Win=64700 Len=0
104724  37.894025 77.197.128.41 -> 41.177.26.176 TCP 64 [TCP Dup ACK 104723#1] 19140 > http [ACK] Seq=354 Ack=11458 Win=64700 Len=0
104725  37.894029 77.197.128.41 -> 41.177.26.176 TCP 64 19140 > http [RST, ACK] Seq=354 Ack=11458 Win=0 Len=0
105576  38.095131 77.197.128.41 -> 41.177.26.176 TCP 66 19395 > http [SYN] Seq=0 Win=65535 Len=0 MSS=1460 SACK_PERM=1
105764  38.174553 77.197.128.41 -> 41.177.26.176 TCP 64 19395 > http [ACK] Seq=1 Ack=1 Win=65535 Len=0
110355  39.525264 77.197.128.41 -> 41.177.26.176 TCP 64 19395 > http [ACK] Seq=305 Ack=1502 Win=65535 Len=0
110380  39.535821 77.197.128.41 -> 41.177.26.176 TCP 64 19395 > http [ACK] Seq=305 Ack=2258 Win=64779 Len=0
110381  39.536075 77.197.128.41 -> 41.177.26.176 TCP 64 19395 > http [ACK] Seq=305 Ack=2670 Win=64367 Len=0
110384  39.536229 77.197.128.41 -> 41.177.26.176 TCP 64 19395 > http [ACK] Seq=305 Ack=3595 Win=65535 Len=0
110633  39.604376 77.197.128.41 -> 41.177.26.176 TCP 64 19395 > http [ACK] Seq=305 Ack=6061 Win=65535 Len=0
110713  39.614999 77.197.128.41 -> 41.177.26.176 TCP 64 19395 > http [ACK] Seq=305 Ack=8981 Win=65535 Len=0
110714  39.615440 77.197.128.41 -> 41.177.26.176 TCP 64 19395 > http [RST, ACK] Seq=305 Ack=10077 Win=0 Len=0
111117  39.717790 77.197.128.41 -> 41.177.26.176 TCP 66 19925 > http [SYN] Seq=0 Win=65535 Len=0 MSS=1460 SACK_PERM=1
111333  39.796715 77.197.128.41 -> 41.177.26.176 TCP 64 19925 > http [ACK] Seq=1 Ack=1 Win=65535 Len=0
114269  40.785672 77.197.128.41 -> 41.177.26.176 TCP 64 19925 > http [ACK] Seq=342 Ack=1506 Win=65535 Len=0
114313  40.796830 77.197.128.41 -> 41.177.26.176 TCP 64 19925 > http [ACK] Seq=342 Ack=2418 Win=64623 Len=0
114316  40.797200 77.197.128.41 -> 41.177.26.176 TCP 64 19925 > http [ACK] Seq=342 Ack=3006 Win=65535 Len=0
114414  40.865161 77.197.128.41 -> 41.177.26.176 TCP 64 19925 > http [ACK] Seq=342 Ack=5239 Win=65535 Len=0
114420  40.875826 77.197.128.41 -> 41.177.26.176 TCP 64 19925 > http [ACK] Seq=342 Ack=9340 Win=65535 Len=0
114421  40.877090 77.197.128.41 -> 41.177.26.176 TCP 64 19925 > http [RST, ACK] Seq=342 Ack=10611 Win=0 Len=0
114578  40.923769 77.197.128.41 -> 41.177.26.176 TCP 66 20281 > http [SYN] Seq=0 Win=65535 Len=0 MSS=1460 SACK_PERM=1
114737  41.002865 77.197.128.41 -> 41.177.26.176 TCP 64 20281 > http [ACK] Seq=1 Ack=1 Win=65535 Len=0
116006  41.387652 77.197.128.41 -> 41.177.26.176 TCP 64 20281 > http [ACK] Seq=314 Ack=2431 Win=65535 Len=0
116213  41.466832 77.197.128.41 -> 41.177.26.176 TCP 64 20281 > http [ACK] Seq=314 Ack=6049 Win=65535 Len=0
116411  41.545741 77.197.128.41 -> 41.177.26.176 TCP 64 20281 > http [ACK] Seq=314 Ack=8969 Win=65535 Len=0
116412  41.545848 77.197.128.41 -> 41.177.26.176 TCP 64 20281 > http [ACK] Seq=314 Ack=10983 Win=65175 Len=0
116413  41.545852 77.197.128.41 -> 41.177.26.176 TCP 64 [TCP Dup ACK 116412#1] 20281 > http [ACK] Seq=314 Ack=10983 Win=65175 Len=0
116414  41.546134 77.197.128.41 -> 41.177.26.176 TCP 64 20281 > http [RST, ACK] Seq=314 Ack=10983 Win=0 Len=0
116740  41.716090 77.197.128.41 -> 41.177.26.176 TCP 66 20498 > http [SYN] Seq=0 Win=65535 Len=0 MSS=1460 SACK_PERM=1
116915  41.795037 77.197.128.41 -> 41.177.26.176 TCP 64 20498 > http [ACK] Seq=1 Ack=1 Win=65535 Len=0
117680  42.202645 77.197.128.41 -> 41.177.26.176 TCP 64 20498 > http [ACK] Seq=308 Ack=2840 Win=65535 Len=0
117861  42.281729 77.197.128.41 -> 41.177.26.176 TCP 64 20498 > http [ACK] Seq=308 Ack=6074 Win=65535 Len=0
118032  42.361178 77.197.128.41 -> 41.177.26.176 TCP 64 20498 > http [ACK] Seq=308 Ack=8277 Win=65535 Len=0
118033  42.361462 77.197.128.41 -> 41.177.26.176 TCP 64 20498 > http [ACK] Seq=308 Ack=11319 Win=65535 Len=0
118035  42.361658 77.197.128.41 -> 41.177.26.176 TCP 64 20498 > http [RST, ACK] Seq=308 Ack=11319 Win=0 Len=0
118475  42.532292 77.197.128.41 -> 41.177.26.176 TCP 66 20692 > http [SYN] Seq=0 Win=65535 Len=0 MSS=1460 SACK_PERM=1
118637  42.611629 77.197.128.41 -> 41.177.26.176 TCP 64 20692 > http [ACK] Seq=1 Ack=1 Win=65535 Len=0
120760  43.061603 77.197.128.41 -> 41.177.26.176 TCP 64 20692 > http [ACK] Seq=318 Ack=2431 Win=65535 Len=0
120761  43.061709 77.197.128.41 -> 41.177.26.176 TCP 64 20692 > http [ACK] Seq=318 Ack=3896 Win=65535 Len=0
121040  43.140674 77.197.128.41 -> 41.177.26.176 TCP 64 20692 > http [ACK] Seq=318 Ack=6070 Win=65535 Len=0
121041  43.140678 77.197.128.41 -> 41.177.26.176 TCP 64 20692 > http [ACK] Seq=318 Ack=8304 Win=65535 Len=0
121207  43.219541 77.197.128.41 -> 41.177.26.176 TCP 64 20692 > http [ACK] Seq=318 Ack=10672 Win=65535 Len=0
121209  43.220296 77.197.128.41 -> 41.177.26.176 TCP 64 20692 > http [RST, ACK] Seq=318 Ack=11354 Win=0 Len=0
122144  43.482664 77.197.128.41 -> 41.177.26.176 TCP 66 20998 > http [SYN] Seq=0 Win=65535 Len=0 MSS=1460 SACK_PERM=1
122362  43.561626 77.197.128.41 -> 41.177.26.176 TCP 64 20998 > http [ACK] Seq=1 Ack=1 Win=65535 Len=0
123657  44.032292 77.197.128.41 -> 41.177.26.176 TCP 64 20998 > http [ACK] Seq=310 Ack=2431 Win=65535 Len=0
123756  44.111374 77.197.128.41 -> 41.177.26.176 TCP 64 20998 > http [ACK] Seq=310 Ack=6080 Win=65535 Len=0
123930  44.190435 77.197.128.41 -> 41.177.26.176 TCP 64 20998 > http [ACK] Seq=310 Ack=11191 Win=65535 Len=0
123932  44.190729 77.197.128.41 -> 41.177.26.176 TCP 64 20998 > http [RST, ACK] Seq=310 Ack=11191 Win=0 Len=0
124487  44.409117 77.197.128.41 -> 41.177.26.176 TCP 66 21384 > http [SYN] Seq=0 Win=65535 Len=0 MSS=1460 SACK_PERM=1
124630  44.488586 77.197.128.41 -> 41.177.26.176 TCP 64 21384 > http [ACK] Seq=1 Ack=1 Win=65535 Len=0
126051  44.885319 77.197.128.41 -> 41.177.26.176 TCP 64 21384 > http [ACK] Seq=308 Ack=2431 Win=65535 Len=0
126053  44.885412 77.197.128.41 -> 41.177.26.176 TCP 64 21384 > http [ACK] Seq=308 Ack=3905 Win=65535 Len=0
126850  44.964671 77.197.128.41 -> 41.177.26.176 TCP 64 21384 > http [ACK] Seq=308 Ack=6069 Win=65535 Len=0
126851  44.964793 77.197.128.41 -> 41.177.26.176 TCP 64 21384 > http [ACK] Seq=308 Ack=10056 Win=65535 Len=0
127632  45.044093 77.197.128.41 -> 41.177.26.176 TCP 64 21384 > http [RST, ACK] Seq=308 Ack=11466 Win=0 Len=0
128986  45.211964 77.197.128.41 -> 41.177.26.176 TCP 66 21636 > http [SYN] Seq=0 Win=65535 Len=0 MSS=1460 SACK_PERM=1
129622  45.290879 77.197.128.41 -> 41.177.26.176 TCP 64 21636 > http [ACK] Seq=1 Ack=1 Win=65535 Len=0
131140  45.736067 77.197.128.41 -> 41.177.26.176 TCP 64 21636 > http [ACK] Seq=318 Ack=2438 Win=65535 Len=0
131146  45.736379 77.197.128.41 -> 41.177.26.176 TCP 64 21636 > http [ACK] Seq=318 Ack=3903 Win=65535 Len=0
131670  45.815055 77.197.128.41 -> 41.177.26.176 TCP 64 21636 > http [ACK] Seq=318 Ack=6077 Win=65535 Len=0
131674  45.815328 77.197.128.41 -> 41.177.26.176 TCP 64 21636 > http [ACK] Seq=318 Ack=9672 Win=65535 Len=0
131676  45.815624 77.197.128.41 -> 41.177.26.176 TCP 64 21636 > http [RST, ACK] Seq=318 Ack=11068 Win=0 Len=0
132043  45.985746 77.197.128.41 -> 41.177.26.176 TCP 66 21892 > http [SYN] Seq=0 Win=65535 Len=0 MSS=1460 SACK_PERM=1
132261  46.065932 77.197.128.41 -> 41.177.26.176 TCP 64 21892 > http [ACK] Seq=1 Ack=1 Win=65535 Len=0
137035  47.646329 77.197.128.41 -> 41.177.26.176 TCP 64 21892 > http [ACK] Seq=306 Ack=1481 Win=65535 Len=0
137064  47.655923 77.197.128.41 -> 41.177.26.176 TCP 64 21892 > http [ACK] Seq=306 Ack=2666 Win=64350 Len=0
137321  47.725548 77.197.128.41 -> 41.177.26.176 TCP 64 21892 > http [ACK] Seq=306 Ack=4517 Win=65535 Len=0
137338  47.734929 77.197.128.41 -> 41.177.26.176 TCP 64 21892 > http [ACK] Seq=306 Ack=6966 Win=65535 Len=0
137339  47.735065 77.197.128.41 -> 41.177.26.176 TCP 64 21892 > http [ACK] Seq=306 Ack=9886 Win=65535 Len=0
137626  47.804897 77.197.128.41 -> 41.177.26.176 TCP 64 21892 > http [RST, ACK] Seq=306 Ack=10876 Win=0 Len=0
137627  47.805402 77.197.128.41 -> 41.177.26.176 TCP 66 22267 > http [SYN] Seq=0 Win=65535 Len=0 MSS=1460 SACK_PERM=1
137927  47.884385 77.197.128.41 -> 41.177.26.176 TCP 64 22267 > http [ACK] Seq=1 Ack=1 Win=65535 Len=0
139884  48.291427 77.197.128.41 -> 41.177.26.176 TCP 64 22267 > http [ACK] Seq=308 Ack=3702 Win=65535 Len=0
140133  48.370725 77.197.128.41 -> 41.177.26.176 TCP 64 22267 > http [ACK] Seq=308 Ack=7398 Win=65535 Len=0
140534  48.449686 77.197.128.41 -> 41.177.26.176 TCP 64 22267 > http [ACK] Seq=308 Ack=11408 Win=65535 Len=0
140535  48.450041 77.197.128.41 -> 41.177.26.176 TCP 64 22267 > http [RST, ACK] Seq=308 Ack=11408 Win=0 Len=0
141384  48.641951 77.197.128.41 -> 41.177.26.176 TCP 66 22418 > http [SYN] Seq=0 Win=65535 Len=0 MSS=1460 SACK_PERM=1
141617  48.720847 77.197.128.41 -> 41.177.26.176 TCP 64 22418 > http [ACK] Seq=1 Ack=1 Win=65535 Len=0
143103  49.161739 77.197.128.41 -> 41.177.26.176 TCP 64 22418 > http [ACK] Seq=309 Ack=2431 Win=65535 Len=0
143291  49.241035 77.197.128.41 -> 41.177.26.176 TCP 64 22418 > http [ACK] Seq=309 Ack=7535 Win=65535 Len=0
143523  49.320185 77.197.128.41 -> 41.177.26.176 TCP 64 22418 > http [ACK] Seq=309 Ack=9389 Win=65535 Len=0
143524  49.320189 77.197.128.41 -> 41.177.26.176 TCP 64 22418 > http [ACK] Seq=309 Ack=11205 Win=63719 Len=0
143525  49.320193 77.197.128.41 -> 41.177.26.176 TCP 64 [TCP Window Update] 22418 > http [ACK] Seq=309 Ack=11205 Win=65535 Len=0
143526  49.320478 77.197.128.41 -> 41.177.26.176 TCP 64 22418 > http [RST, ACK] Seq=309 Ack=11205 Win=0 Len=0
143953  49.441139 77.197.128.41 -> 41.177.26.176 TCP 66 22599 > http [SYN] Seq=0 Win=65535 Len=0 MSS=1460 SACK_PERM=1
144303  49.520365 77.197.128.41 -> 41.177.26.176 TCP 64 22599 > http [ACK] Seq=1 Ack=1 Win=65535 Len=0
145796  49.951998 77.197.128.41 -> 41.177.26.176 TCP 64 22599 > http [ACK] Seq=306 Ack=2429 Win=65535 Len=0
145973  50.031274 77.197.128.41 -> 41.177.26.176 TCP 64 22599 > http [ACK] Seq=306 Ack=5777 Win=65535 Len=0
146114  50.110273 77.197.128.41 -> 41.177.26.176 TCP 64 22599 > http [ACK] Seq=306 Ack=7711 Win=65535 Len=0
146115  50.110480 77.197.128.41 -> 41.177.26.176 TCP 64 22599 > http [ACK] Seq=306 Ack=10542 Win=65535 Len=0
146116  50.110721 77.197.128.41 -> 41.177.26.176 TCP 64 22599 > http [RST, ACK] Seq=306 Ack=10542 Win=0 Len=0
146488  50.220710 77.197.128.41 -> 41.177.26.176 TCP 66 22732 > http [SYN] Seq=0 Win=65535 Len=0 MSS=1460 SACK_PERM=1
146613  50.300187 77.197.128.41 -> 41.177.26.176 TCP 64 22732 > http [ACK] Seq=1 Ack=1 Win=65535 Len=0
147733  50.707051 77.197.128.41 -> 41.177.26.176 TCP 64 22732 > http [ACK] Seq=319 Ack=2431 Win=65535 Len=0
147734  50.707148 77.197.128.41 -> 41.177.26.176 TCP 64 22732 > http [ACK] Seq=319 Ack=3895 Win=65535 Len=0
147940  50.786299 77.197.128.41 -> 41.177.26.176 TCP 64 22732 > http [ACK] Seq=319 Ack=6069 Win=65535 Len=0
147941  50.786419 77.197.128.41 -> 41.177.26.176 TCP 64 22732 > http [ACK] Seq=319 Ack=10468 Win=65535 Len=0
148179  50.865213 77.197.128.41 -> 41.177.26.176 TCP 64 22732 > http [ACK] Seq=319 Ack=12121 Win=65501 Len=0
148180  50.865217 77.197.128.41 -> 41.177.26.176 TCP 64 [TCP Dup ACK 148179#1] 22732 > http [ACK] Seq=319 Ack=12121 Win=65501 Len=0
148181  50.865487 77.197.128.41 -> 41.177.26.176 TCP 64 22732 > http [RST, ACK] Seq=319 Ack=12121 Win=0 Len=0
148192  50.875868 77.197.128.41 -> 41.177.26.176 TCP 66 22862 > http [SYN] Seq=0 Win=65535 Len=0 MSS=1460 SACK_PERM=1
148369  50.954918 77.197.128.41 -> 41.177.26.176 TCP 64 22862 > http [ACK] Seq=1 Ack=1 Win=65535 Len=0
151125  51.850166 77.197.128.41 -> 41.177.26.176 TCP 64 22862 > http [ACK] Seq=327 Ack=2095 Win=65535 Len=0
151126  51.850321 77.197.128.41 -> 41.177.26.176 TCP 64 22862 > http [ACK] Seq=327 Ack=2557 Win=65073 Len=0
151131  51.850469 77.197.128.41 -> 41.177.26.176 TCP 64 22862 > http [ACK] Seq=327 Ack=2881 Win=64749 Len=0
151445  51.929171 77.197.128.41 -> 41.177.26.176 TCP 64 22862 > http [ACK] Seq=327 Ack=5059 Win=65535 Len=0
151446  51.929197 77.197.128.41 -> 41.177.26.176 TCP 64 22862 > http [ACK] Seq=327 Ack=7664 Win=65535 Len=0
151455  51.929604 77.197.128.41 -> 41.177.26.176 TCP 64 22862 > http [ACK] Seq=327 Ack=10180 Win=65535 Len=0
151457  51.929869 77.197.128.41 -> 41.177.26.176 TCP 64 22862 > http [RST, ACK] Seq=327 Ack=10180 Win=0 Len=0
151996  52.080320 77.197.128.41 -> 41.177.26.176 TCP 66 23084 > http [SYN] Seq=0 Win=65535 Len=0 MSS=1460 SACK_PERM=1
152229  52.159243 77.197.128.41 -> 41.177.26.176 TCP 64 23084 > http [ACK] Seq=1 Ack=1 Win=65535 Len=0
153642  52.545367 77.197.128.41 -> 41.177.26.176 TCP 64 23084 > http [ACK] Seq=318 Ack=2602 Win=65535 Len=0
153959  52.609683 77.197.128.41 -> 41.177.26.176 TCP 64 23084 > http [ACK] Seq=318 Ack=3896 Win=64241 Len=0
153988  52.624574 77.197.128.41 -> 41.177.26.176 TCP 64 23084 > http [ACK] Seq=318 Ack=7530 Win=65535 Len=0
154236  52.688677 77.197.128.41 -> 41.177.26.176 TCP 64 23084 > http [ACK] Seq=318 Ack=11173 Win=65535 Len=0
154237  52.688953 77.197.128.41 -> 41.177.26.176 TCP 64 23084 > http [RST, ACK] Seq=318 Ack=11173 Win=0 Len=0
154903  52.906954 77.197.128.41 -> 41.177.26.176 TCP 66 23212 > http [SYN] Seq=0 Win=65535 Len=0 MSS=1460 SACK_PERM=1
155266  52.986183 77.197.128.41 -> 41.177.26.176 TCP 64 23212 > http [ACK] Seq=1 Ack=1 Win=65535 Len=0
156844  53.411127 77.197.128.41 -> 41.177.26.176 TCP 64 23212 > http [ACK] Seq=306 Ack=3902 Win=65535 Len=0
157014  53.490246 77.197.128.41 -> 41.177.26.176 TCP 64 23212 > http [ACK] Seq=306 Ack=6082 Win=65535 Len=0
157015  53.490251 77.197.128.41 -> 41.177.26.176 TCP 64 23212 > http [ACK] Seq=306 Ack=8056 Win=65535 Len=0
157193  53.569390 77.197.128.41 -> 41.177.26.176 TCP 64 23212 > http [ACK] Seq=306 Ack=11362 Win=65535 Len=0
157196  53.569678 77.197.128.41 -> 41.177.26.176 TCP 64 23212 > http [RST, ACK] Seq=306 Ack=11362 Win=0 Len=0
157666  53.704091 77.197.128.41 -> 41.177.26.176 TCP 66 23404 > http [SYN] Seq=0 Win=65535 Len=0 MSS=1460 SACK_PERM=1
157867  53.783070 77.197.128.41 -> 41.177.26.176 TCP 64 23404 > http [ACK] Seq=1 Ack=1 Win=65535 Len=0
159257  54.216551 77.197.128.41 -> 41.177.26.176 TCP 64 23404 > http [ACK] Seq=305 Ack=2431 Win=65535 Len=0
159548  54.295765 77.197.128.41 -> 41.177.26.176 TCP 64 23404 > http [ACK] Seq=305 Ack=6063 Win=65535 Len=0
159705  54.375549 77.197.128.41 -> 41.177.26.176 TCP 64 23404 > http [ACK] Seq=305 Ack=11167 Win=64991 Len=0
159706  54.375581 77.197.128.41 -> 41.177.26.176 TCP 64 [TCP Dup ACK 159705#1] 23404 > http [ACK] Seq=305 Ack=11167 Win=64991 Len=0
159707  54.375989 77.197.128.41 -> 41.177.26.176 TCP 64 23404 > http [RST, ACK] Seq=305 Ack=11167 Win=0 Len=0
160306  54.579362 77.197.128.41 -> 41.177.26.176 TCP 66 23587 > http [SYN] Seq=0 Win=65535 Len=0 MSS=1460 SACK_PERM=1
160507  54.658656 77.197.128.41 -> 41.177.26.176 TCP 64 23587 > http [ACK] Seq=1 Ack=1 Win=65535 Len=0
161675  55.050087 77.197.128.41 -> 41.177.26.176 TCP 64 23587 > http [ACK] Seq=308 Ack=2431 Win=65535 Len=0
162037  55.129239 77.197.128.41 -> 41.177.26.176 TCP 64 23587 > http [ACK] Seq=308 Ack=6062 Win=65535 Len=0
162282  55.208489 77.197.128.41 -> 41.177.26.176 TCP 64 23587 > http [ACK] Seq=308 Ack=7908 Win=65535 Len=0
162285  55.208771 77.197.128.41 -> 41.177.26.176 TCP 64 23587 > http [ACK] Seq=308 Ack=11179 Win=64979 Len=0
162286  55.208775 77.197.128.41 -> 41.177.26.176 TCP 64 [TCP Dup ACK 162285#1] 23587 > http [ACK] Seq=308 Ack=11179 Win=64979 Len=0
162288  55.208972 77.197.128.41 -> 41.177.26.176 TCP 64 23587 > http [RST, ACK] Seq=308 Ack=11179 Win=0 Len=0
162964  55.329452 77.197.128.41 -> 41.177.26.176 TCP 66 23723 > http [SYN] Seq=0 Win=65535 Len=0 MSS=1460 SACK_PERM=1
163376  55.408822 77.197.128.41 -> 41.177.26.176 TCP 64 23723 > http [ACK] Seq=1 Ack=1 Win=65535 Len=0
164828  55.783080 77.197.128.41 -> 41.177.26.176 TCP 64 23723 > http [ACK] Seq=309 Ack=3911 Win=65535 Len=0
165406  55.862308 77.197.128.41 -> 41.177.26.176 TCP 64 23723 > http [ACK] Seq=309 Ack=7541 Win=65535 Len=0
165931  55.941348 77.197.128.41 -> 41.177.26.176 TCP 64 23723 > http [ACK] Seq=309 Ack=9777 Win=65535 Len=0
165935  55.941592 77.197.128.41 -> 41.177.26.176 TCP 64 23723 > http [RST, ACK] Seq=309 Ack=11193 Win=0 Len=0
167391  56.141762 77.197.128.41 -> 41.177.26.176 TCP 66 23828 > http [SYN] Seq=0 Win=65535 Len=0 MSS=1460 SACK_PERM=1
167916  56.220957 77.197.128.41 -> 41.177.26.176 TCP 64 23828 > http [ACK] Seq=1 Ack=1 Win=65535 Len=0
169851  56.560597 77.197.128.41 -> 41.177.26.176 TCP 64 23828 > http [ACK] Seq=314 Ack=3896 Win=65535 Len=0
170212  56.639736 77.197.128.41 -> 41.177.26.176 TCP 64 23828 > http [ACK] Seq=314 Ack=6056 Win=65535 Len=0
170213  56.639740 77.197.128.41 -> 41.177.26.176 TCP 64 23828 > http [ACK] Seq=314 Ack=9443 Win=65535 Len=0
170596  56.718755 77.197.128.41 -> 41.177.26.176 TCP 64 23828 > http [ACK] Seq=314 Ack=11243 Win=65535 Len=0
170597  56.719137 77.197.128.41 -> 41.177.26.176 TCP 64 23828 > http [RST, ACK] Seq=314 Ack=11243 Win=0 Len=0
170757  56.751298 77.197.128.41 -> 41.177.26.176 TCP 66 23896 > http [SYN] Seq=0 Win=65535 Len=0 MSS=1460 SACK_PERM=1
171143  56.830287 77.197.128.41 -> 41.177.26.176 TCP 64 23896 > http [ACK] Seq=1 Ack=1 Win=65535 Len=0
174206  57.894264 77.197.128.41 -> 41.177.26.176 TCP 64 23896 > http [ACK] Seq=342 Ack=1491 Win=65535 Len=0
174236  57.904364 77.197.128.41 -> 41.177.26.176 TCP 64 23896 > http [ACK] Seq=342 Ack=2493 Win=64533 Len=0
174239  57.904615 77.197.128.41 -> 41.177.26.176 TCP 64 23896 > http [ACK] Seq=342 Ack=2990 Win=65535 Len=0
174499  57.973970 77.197.128.41 -> 41.177.26.176 TCP 64 23896 > http [ACK] Seq=342 Ack=6232 Win=65535 Len=0
174520  57.983289 77.197.128.41 -> 41.177.26.176 TCP 64 23896 > http [ACK] Seq=342 Ack=9152 Win=65535 Len=0
174524  57.983719 77.197.128.41 -> 41.177.26.176 TCP 64 23896 > http [RST, ACK] Seq=342 Ack=10280 Win=0 Len=0
174962  58.174996 77.197.128.41 -> 41.177.26.176 TCP 66 24086 > http [SYN] Seq=0 Win=65535 Len=0 MSS=1460 SACK_PERM=1
175217  58.254224 77.197.128.41 -> 41.177.26.176 TCP 64 24086 > http [ACK] Seq=1 Ack=1 Win=65535 Len=0
176223  58.665517 77.197.128.41 -> 41.177.26.176 TCP 64 24086 > http [ACK] Seq=309 Ack=2431 Win=65535 Len=0
176305  58.744522 77.197.128.41 -> 41.177.26.176 TCP 64 24086 > http [ACK] Seq=309 Ack=6075 Win=65535 Len=0
176381  58.823735 77.197.128.41 -> 41.177.26.176 TCP 64 24086 > http [ACK] Seq=309 Ack=8183 Win=65535 Len=0
176382  58.823762 77.197.128.41 -> 41.177.26.176 TCP 64 24086 > http [ACK] Seq=309 Ack=11466 Win=64692 Len=0
176383  58.823766 77.197.128.41 -> 41.177.26.176 TCP 64 [TCP Dup ACK 176382#1] 24086 > http [ACK] Seq=309 Ack=11466 Win=64692 Len=0
176384  58.823965 77.197.128.41 -> 41.177.26.176 TCP 64 24086 > http [RST, ACK] Seq=309 Ack=11466 Win=0 Len=0
176578  58.971792 77.197.128.41 -> 41.177.26.176 TCP 66 24172 > http [SYN] Seq=0 Win=65535 Len=0 MSS=1460 SACK_PERM=1
176685  59.050947 77.197.128.41 -> 41.177.26.176 TCP 64 24172 > http [ACK] Seq=1 Ack=1 Win=65535 Len=0
179375  60.351109 77.197.128.41 -> 41.177.26.176 TCP 64 24172 > http [ACK] Seq=325 Ack=3158 Win=65535 Len=0
179525  60.430392 77.197.128.41 -> 41.177.26.176 TCP 64 24172 > http [ACK] Seq=325 Ack=5663 Win=65535 Len=0
179527  60.430557 77.197.128.41 -> 41.177.26.176 TCP 64 24172 > http [ACK] Seq=325 Ack=8275 Win=65535 Len=0
179711  60.509538 77.197.128.41 -> 41.177.26.176 TCP 64 24172 > http [ACK] Seq=325 Ack=12373 Win=65535 Len=0
179712  60.509682 77.197.128.41 -> 41.177.26.176 TCP 64 24172 > http [ACK] Seq=325 Ack=13742 Win=64166 Len=0
179713  60.509721 77.197.128.41 -> 41.177.26.176 TCP 64 24172 > http [ACK] Seq=325 Ack=16445 Win=65535 Len=0
179916  60.588922 77.197.128.41 -> 41.177.26.176 TCP 64 24172 > http [ACK] Seq=325 Ack=20454 Win=65535 Len=0
179917  60.588926 77.197.128.41 -> 41.177.26.176 TCP 64 24172 > http [ACK] Seq=325 Ack=22139 Win=65330 Len=0
179918  60.588931 77.197.128.41 -> 41.177.26.176 TCP 64 [TCP Dup ACK 179917#1] 24172 > http [ACK] Seq=325 Ack=22139 Win=65330 Len=0
179920  60.589532 77.197.128.41 -> 41.177.26.176 TCP 64 24172 > http [RST, ACK] Seq=325 Ack=22139 Win=0 Len=0
180544  60.807123 77.197.128.41 -> 41.177.26.176 TCP 66 24383 > http [SYN] Seq=0 Win=65535 Len=0 MSS=1460 SACK_PERM=1
180808  60.886051 77.197.128.41 -> 41.177.26.176 TCP 64 24383 > http [ACK] Seq=1 Ack=1 Win=65535 Len=0
182413  61.303291 77.197.128.41 -> 41.177.26.176 TCP 64 24383 > http [ACK] Seq=319 Ack=2431 Win=65535 Len=0
182414  61.303444 77.197.128.41 -> 41.177.26.176 TCP 64 24383 > http [ACK] Seq=319 Ack=3895 Win=65535 Len=0
182629  61.382493 77.197.128.41 -> 41.177.26.176 TCP 64 24383 > http [ACK] Seq=319 Ack=8078 Win=65535 Len=0
182630  61.382498 77.197.128.41 -> 41.177.26.176 TCP 64 24383 > http [ACK] Seq=319 Ack=10687 Win=65535 Len=0
182865  61.461600 77.197.128.41 -> 41.177.26.176 TCP 64 24383 > http [RST, ACK] Seq=319 Ack=11369 Win=0 Len=0
183311  61.598585 77.197.128.41 -> 41.177.26.176 TCP 66 24466 > http [SYN] Seq=0 Win=65535 Len=0 MSS=1460 SACK_PERM=1
183583  61.677926 77.197.128.41 -> 41.177.26.176 TCP 64 24466 > http [ACK] Seq=1 Ack=1 Win=65535 Len=0
184576  62.053902 77.197.128.41 -> 41.177.26.176 TCP 64 24466 > http [ACK] Seq=317 Ack=2834 Win=65535 Len=0
185117  62.133413 77.197.128.41 -> 41.177.26.176 TCP 64 24466 > http [ACK] Seq=317 Ack=6069 Win=65535 Len=0
185688  62.212324 77.197.128.41 -> 41.177.26.176 TCP 64 24466 > http [ACK] Seq=317 Ack=8295 Win=65535 Len=0
185689  62.212471 77.197.128.41 -> 41.177.26.176 TCP 64 24466 > http [ACK] Seq=317 Ack=11164 Win=65535 Len=0
185691  62.212676 77.197.128.41 -> 41.177.26.176 TCP 64 24466 > http [RST, ACK] Seq=317 Ack=11164 Win=0 Len=0
762339 245.965363 77.197.128.41 -> 41.177.26.15 TCP 66 50114 > http [SYN] Seq=0 Win=65535 Len=0 MSS=1460 SACK_PERM=1
762574 246.044424 77.197.128.41 -> 41.177.26.15 TCP 64 50114 > http [ACK] Seq=1 Ack=1 Win=65535 Len=0
763686 246.469653 77.197.128.41 -> 41.177.26.15 TCP 64 50114 > http [ACK] Seq=308 Ack=4381 Win=65535 Len=0
763965 246.548717 77.197.128.41 -> 41.177.26.15 TCP 64 50114 > http [ACK] Seq=308 Ack=7301 Win=65535 Len=0
763966 246.548876 77.197.128.41 -> 41.177.26.15 TCP 64 50114 > http [ACK] Seq=308 Ack=9925 Win=65535 Len=0
764207 246.627899 77.197.128.41 -> 41.177.26.15 TCP 64 50114 > http [ACK] Seq=308 Ack=14305 Win=63803 Len=0
764208 246.627904 77.197.128.41 -> 41.177.26.15 TCP 64 [TCP Window Update] 50114 > http [ACK] Seq=308 Ack=14305 Win=65535 Len=0
764209 246.627908 77.197.128.41 -> 41.177.26.15 TCP 64 50114 > http [ACK] Seq=308 Ack=16665 Win=65535 Len=0
764364 246.706995 77.197.128.41 -> 41.177.26.15 TCP 64 50114 > http [ACK] Seq=308 Ack=19585 Win=65535 Len=0
764365 246.706999 77.197.128.41 -> 41.177.26.15 TCP 64 50114 > http [ACK] Seq=308 Ack=22505 Win=65535 Len=0
764366 246.707090 77.197.128.41 -> 41.177.26.15 TCP 64 50114 > http [ACK] Seq=308 Ack=24865 Win=65527 Len=0
764367 246.707095 77.197.128.41 -> 41.177.26.15 TCP 64 [TCP Dup ACK 764366#1] 50114 > http [ACK] Seq=308 Ack=24865 Win=65527 Len=0
764368 246.707131 77.197.128.41 -> 41.177.26.15 TCP 64 50114 > http [ACK] Seq=308 Ack=27785 Win=65535 Len=0
764533 246.786120 77.197.128.41 -> 41.177.26.15 TCP 64 50114 > http [ACK] Seq=308 Ack=33065 Win=65535 Len=0
764539 246.786427 77.197.128.41 -> 41.177.26.15 TCP 64 50114 > http [ACK] Seq=308 Ack=37445 Win=64067 Len=0
764540 246.786431 77.197.128.41 -> 41.177.26.15 TCP 64 [TCP Window Update] 50114 > http [ACK] Seq=308 Ack=37445 Win=65535 Len=0
764542 246.786557 77.197.128.41 -> 41.177.26.15 TCP 64 50114 > http [ACK] Seq=308 Ack=41265 Win=65535 Len=0
764544 246.786604 77.197.128.41 -> 41.177.26.15 TCP 64 50114 > http [ACK] Seq=308 Ack=44185 Win=65535 Len=0
764661 246.865342 77.197.128.41 -> 41.177.26.15 TCP 64 50114 > http [ACK] Seq=308 Ack=49465 Win=63167 Len=0
764662 246.865347 77.197.128.41 -> 41.177.26.15 TCP 64 [TCP Window Update] 50114 > http [ACK] Seq=308 Ack=49465 Win=65535 Len=0
764663 246.865507 77.197.128.41 -> 41.177.26.15 TCP 64 50114 > http [ACK] Seq=308 Ack=53845 Win=65535 Len=0
764667 246.865727 77.197.128.41 -> 41.177.26.15 TCP 64 50114 > http [ACK] Seq=308 Ack=57665 Win=65535 Len=0
764668 246.865752 77.197.128.41 -> 41.177.26.15 TCP 64 50114 > http [ACK] Seq=308 Ack=60585 Win=62615 Len=0
764669 246.865756 77.197.128.41 -> 41.177.26.15 TCP 64 [TCP Window Update] 50114 > http [ACK] Seq=308 Ack=60585 Win=65535 Len=0
764672 246.865928 77.197.128.41 -> 41.177.26.15 TCP 64 50114 > http [ACK] Seq=308 Ack=67325 Win=65535 Len=0
764828 246.944387 77.197.128.41 -> 41.177.26.15 TCP 64 50114 > http [ACK] Seq=308 Ack=71705 Win=64067 Len=0
764829 246.944392 77.197.128.41 -> 41.177.26.15 TCP 64 [TCP Window Update] 50114 > http [ACK] Seq=308 Ack=71705 Win=65535 Len=0
764836 246.944749 77.197.128.41 -> 41.177.26.15 TCP 64 50114 > http [ACK] Seq=308 Ack=74065 Win=65535 Len=0
764840 246.945103 77.197.128.41 -> 41.177.26.15 TCP 64 50114 > http [ACK] Seq=308 Ack=79905 Win=65535 Len=0
764841 246.945108 77.197.128.41 -> 41.177.26.15 TCP 64 50114 > http [ACK] Seq=308 Ack=82265 Win=65535 Len=0
764845 246.945370 77.197.128.41 -> 41.177.26.15 TCP 64 50114 > http [ACK] Seq=308 Ack=89565 Win=65535 Len=0
764846 246.945375 77.197.128.41 -> 41.177.26.15 TCP 64 50114 > http [ACK] Seq=308 Ack=93385 Win=65535 Len=0
764855 246.945574 77.197.128.41 -> 41.177.26.15 TCP 64 50114 > http [ACK] Seq=308 Ack=96305 Win=65535 Len=0
764998 247.023321 77.197.128.41 -> 41.177.26.15 TCP 64 50114 > http [ACK] Seq=308 Ack=98665 Win=65535 Len=0
765000 247.023526 77.197.128.41 -> 41.177.26.15 TCP 64 50114 > http [ACK] Seq=308 Ack=101585 Win=65535 Len=0
765006 247.023820 77.197.128.41 -> 41.177.26.15 TCP 64 50114 > http [ACK] Seq=308 Ack=106865 Win=63167 Len=0
765007 247.023824 77.197.128.41 -> 41.177.26.15 TCP 64 [TCP Window Update] 50114 > http [ACK] Seq=308 Ack=106865 Win=65535 Len=0
765013 247.024119 77.197.128.41 -> 41.177.26.15 TCP 64 50114 > http [ACK] Seq=308 Ack=109785 Win=65535 Len=0
765014 247.024233 77.197.128.41 -> 41.177.26.15 TCP 64 50114 > http [ACK] Seq=308 Ack=115065 Win=65527 Len=0
765015 247.024237 77.197.128.41 -> 41.177.26.15 TCP 64 [TCP Dup ACK 765014#1] 50114 > http [ACK] Seq=308 Ack=115065 Win=65527 Len=0
765021 247.024362 77.197.128.41 -> 41.177.26.15 TCP 64 50114 > http [ACK] Seq=308 Ack=117985 Win=65535 Len=0
765022 247.024366 77.197.128.41 -> 41.177.26.15 TCP 64 50114 > http [ACK] Seq=308 Ack=120905 Win=65535 Len=0
765023 247.024370 77.197.128.41 -> 41.177.26.15 TCP 64 50114 > http [ACK] Seq=308 Ack=124725 Win=65527 Len=0
765024 247.024374 77.197.128.41 -> 41.177.26.15 TCP 64 [TCP Dup ACK 765023#1] 50114 > http [ACK] Seq=308 Ack=124725 Win=65527 Len=0
765029 247.024483 77.197.128.41 -> 41.177.26.15 TCP 64 50114 > http [ACK] Seq=308 Ack=127645 Win=65535 Len=0
765030 247.024528 77.197.128.41 -> 41.177.26.15 TCP 64 50114 > http [ACK] Seq=308 Ack=132925 Win=65527 Len=0
765031 247.024533 77.197.128.41 -> 41.177.26.15 TCP 64 [TCP Dup ACK 765030#1] 50114 > http [ACK] Seq=308 Ack=132925 Win=65527 Len=0
765036 247.024655 77.197.128.41 -> 41.177.26.15 TCP 64 50114 > http [ACK] Seq=308 Ack=135845 Win=65535 Len=0
765231 247.102303 77.197.128.41 -> 41.177.26.15 TCP 64 50114 > http [ACK] Seq=308 Ack=139665 Win=65535 Len=0
765232 247.102535 77.197.128.41 -> 41.177.26.15 TCP 64 50114 > http [ACK] Seq=308 Ack=142585 Win=65535 Len=0
765233 247.102540 77.197.128.41 -> 41.177.26.15 TCP 64 50114 > http [ACK] Seq=308 Ack=144045 Win=65535 Len=0
765234 247.102863 77.197.128.41 -> 41.177.26.15 TCP 64 50114 > http [ACK] Seq=308 Ack=147865 Win=65535 Len=0
765235 247.102867 77.197.128.41 -> 41.177.26.15 TCP 64 50114 > http [ACK] Seq=308 Ack=150785 Win=65535 Len=0
765236 247.103089 77.197.128.41 -> 41.177.26.15 TCP 64 50114 > http [ACK] Seq=308 Ack=152245 Win=65535 Len=0
765237 247.103094 77.197.128.41 -> 41.177.26.15 TCP 64 50114 > http [ACK] Seq=308 Ack=156065 Win=65535 Len=0
765238 247.103243 77.197.128.41 -> 41.177.26.15 TCP 64 50114 > http [ACK] Seq=308 Ack=158985 Win=65535 Len=0
765239 247.103248 77.197.128.41 -> 41.177.26.15 TCP 64 50114 > http [ACK] Seq=308 Ack=161905 Win=62615 Len=0
765240 247.103266 77.197.128.41 -> 41.177.26.15 TCP 64 [TCP Window Update] 50114 > http [ACK] Seq=308 Ack=161905 Win=65535 Len=0
765241 247.103335 77.197.128.41 -> 41.177.26.15 TCP 64 50114 > http [ACK] Seq=308 Ack=165725 Win=65535 Len=0
765243 247.103562 77.197.128.41 -> 41.177.26.15 TCP 64 50114 > http [ACK] Seq=308 Ack=170105 Win=65535 Len=0
765244 247.103567 77.197.128.41 -> 41.177.26.15 TCP 64 50114 > http [ACK] Seq=308 Ack=172465 Win=65535 Len=0
765246 247.103760 77.197.128.41 -> 41.177.26.15 TCP 64 50114 > http [ACK] Seq=308 Ack=175385 Win=65535 Len=0
765247 247.103957 77.197.128.41 -> 41.177.26.15 TCP 64 50114 > http [ACK] Seq=308 Ack=180099 Win=65535 Len=0
765301 247.116198 77.197.128.41 -> 41.177.26.15 TCP 64 50114 > http [RST, ACK] Seq=308 Ack=180099 Win=0 Len=0
786186 255.075931 77.197.128.41 -> 41.177.26.15 TCP 66 56286 > http [SYN] Seq=0 Win=65535 Len=0 MSS=1460 SACK_PERM=1
786302 255.154883 77.197.128.41 -> 41.177.26.15 TCP 64 56286 > http [ACK] Seq=1 Ack=1 Win=65535 Len=0
786929 255.424757 77.197.128.41 -> 41.177.26.15 TCP 64 56286 > http [ACK] Seq=308 Ack=4381 Win=65535 Len=0
787135 255.503908 77.197.128.41 -> 41.177.26.15 TCP 64 56286 > http [ACK] Seq=308 Ack=9925 Win=65535 Len=0
787336 255.583256 77.197.128.41 -> 41.177.26.15 TCP 64 56286 > http [ACK] Seq=308 Ack=16665 Win=61443 Len=0
787337 255.583260 77.197.128.41 -> 41.177.26.15 TCP 64 [TCP Window Update] 56286 > http [ACK] Seq=308 Ack=16665 Win=65535 Len=0
787606 255.662389 77.197.128.41 -> 41.177.26.15 TCP 64 56286 > http [ACK] Seq=308 Ack=19585 Win=65535 Len=0
787607 255.662568 77.197.128.41 -> 41.177.26.15 TCP 64 56286 > http [ACK] Seq=308 Ack=22505 Win=65535 Len=0
787609 255.662577 77.197.128.41 -> 41.177.26.15 TCP 64 56286 > http [ACK] Seq=308 Ack=24865 Win=65527 Len=0
787610 255.662581 77.197.128.41 -> 41.177.26.15 TCP 64 [TCP Dup ACK 787609#1] 56286 > http [ACK] Seq=308 Ack=24865 Win=65527 Len=0
787792 255.741498 77.197.128.41 -> 41.177.26.15 TCP 64 56286 > http [ACK] Seq=308 Ack=29245 Win=65535 Len=0
787793 255.741744 77.197.128.41 -> 41.177.26.15 TCP 64 56286 > http [ACK] Seq=308 Ack=34525 Win=64067 Len=0
787794 255.741749 77.197.128.41 -> 41.177.26.15 TCP 64 [TCP Window Update] 56286 > http [ACK] Seq=308 Ack=34525 Win=65535 Len=0
787795 255.741753 77.197.128.41 -> 41.177.26.15 TCP 64 56286 > http [ACK] Seq=308 Ack=37445 Win=65535 Len=0
787929 255.820723 77.197.128.41 -> 41.177.26.15 TCP 64 56286 > http [ACK] Seq=308 Ack=41265 Win=65535 Len=0
787930 255.820822 77.197.128.41 -> 41.177.26.15 TCP 64 56286 > http [ACK] Seq=308 Ack=45645 Win=61155 Len=0
787931 255.820827 77.197.128.41 -> 41.177.26.15 TCP 64 [TCP Window Update] 56286 > http [ACK] Seq=308 Ack=45645 Win=65535 Len=0
787932 255.820959 77.197.128.41 -> 41.177.26.15 TCP 64 56286 > http [ACK] Seq=308 Ack=49465 Win=65535 Len=0
787942 255.821282 77.197.128.41 -> 41.177.26.15 TCP 64 56286 > http [ACK] Seq=308 Ack=53845 Win=65527 Len=0
787943 255.821287 77.197.128.41 -> 41.177.26.15 TCP 64 [TCP Dup ACK 787942#1] 56286 > http [ACK] Seq=308 Ack=53845 Win=65527 Len=0
788050 255.900223 77.197.128.41 -> 41.177.26.15 TCP 64 56286 > http [ACK] Seq=308 Ack=59125 Win=65535 Len=0
788051 255.900436 77.197.128.41 -> 41.177.26.15 TCP 64 56286 > http [ACK] Seq=308 Ack=63505 Win=64067 Len=0
788052 255.900441 77.197.128.41 -> 41.177.26.15 TCP 64 [TCP Window Update] 56286 > http [ACK] Seq=308 Ack=63505 Win=65535 Len=0
788053 255.900453 77.197.128.41 -> 41.177.26.15 TCP 64 56286 > http [ACK] Seq=308 Ack=65865 Win=65535 Len=0
788055 255.900622 77.197.128.41 -> 41.177.26.15 TCP 64 56286 > http [ACK] Seq=308 Ack=68785 Win=65535 Len=0
788064 255.900753 77.197.128.41 -> 41.177.26.15 TCP 64 56286 > http [ACK] Seq=308 Ack=71705 Win=65535 Len=0
788067 255.900836 77.197.128.41 -> 41.177.26.15 TCP 64 56286 > http [ACK] Seq=308 Ack=74065 Win=65527 Len=0
788068 255.900841 77.197.128.41 -> 41.177.26.15 TCP 64 [TCP Dup ACK 788067#1] 56286 > http [ACK] Seq=308 Ack=74065 Win=65527 Len=0
788080 255.901149 77.197.128.41 -> 41.177.26.15 TCP 64 56286 > http [ACK] Seq=308 Ack=76985 Win=65535 Len=0
788194 255.979541 77.197.128.41 -> 41.177.26.15 TCP 64 56286 > http [ACK] Seq=308 Ack=82265 Win=65535 Len=0
788197 255.979700 77.197.128.41 -> 41.177.26.15 TCP 64 56286 > http [ACK] Seq=308 Ack=86645 Win=64067 Len=0
788198 255.979705 77.197.128.41 -> 41.177.26.15 TCP 64 [TCP Window Update] 56286 > http [ACK] Seq=308 Ack=86645 Win=65535 Len=0
788199 255.979709 77.197.128.41 -> 41.177.26.15 TCP 64 56286 > http [ACK] Seq=308 Ack=89565 Win=65535 Len=0
788201 255.979904 77.197.128.41 -> 41.177.26.15 TCP 64 56286 > http [ACK] Seq=308 Ack=94845 Win=65535 Len=0
788204 255.980087 77.197.128.41 -> 41.177.26.15 TCP 64 56286 > http [ACK] Seq=308 Ack=97765 Win=65527 Len=0
788205 255.980092 77.197.128.41 -> 41.177.26.15 TCP 64 [TCP Dup ACK 788204#1] 56286 > http [ACK] Seq=308 Ack=97765 Win=65527 Len=0
788206 255.980096 77.197.128.41 -> 41.177.26.15 TCP 64 56286 > http [ACK] Seq=308 Ack=100125 Win=65535 Len=0
788207 255.980100 77.197.128.41 -> 41.177.26.15 TCP 64 56286 > http [ACK] Seq=308 Ack=102435 Win=65535 Len=0
788234 255.987313 77.197.128.41 -> 41.177.26.15 TCP 64 56286 > http [RST, ACK] Seq=308 Ack=102435 Win=0 Len=0
793724 258.520424 77.197.128.41 -> 41.177.26.15 TCP 66 58522 > http [SYN] Seq=0 Win=65535 Len=0 MSS=1460 SACK_PERM=1
793866 258.599522 77.197.128.41 -> 41.177.26.15 TCP 64 58522 > http [ACK] Seq=1 Ack=1 Win=65535 Len=0
797769 260.217098 77.197.128.41 -> 41.177.26.15 TCP 64 58522 > http [ACK] Seq=366 Ack=4381 Win=65535 Len=0
797921 260.296120 77.197.128.41 -> 41.177.26.15 TCP 64 58522 > http [ACK] Seq=366 Ack=7301 Win=65535 Len=0
797934 260.296826 77.197.128.41 -> 41.177.26.15 TCP 64 58522 > http [RST, ACK] Seq=366 Ack=8135 Win=0 Len=0
798117 260.381729 77.197.128.41 -> 41.177.26.15 TCP 66 60079 > http [SYN] Seq=0 Win=65535 Len=0 MSS=1460 SACK_PERM=1
798362 260.460759 77.197.128.41 -> 41.177.26.15 TCP 64 60079 > http [ACK] Seq=1 Ack=1 Win=65535 Len=0
799101 260.718964 77.197.128.41 -> 41.177.26.15 TCP 64 60079 > http [ACK] Seq=308 Ack=2921 Win=65535 Len=0
799276 260.798804 77.197.128.41 -> 41.177.26.15 TCP 64 60079 > http [ACK] Seq=308 Ack=8465 Win=65535 Len=0
799411 260.878029 77.197.128.41 -> 41.177.26.15 TCP 64 60079 > http [ACK] Seq=308 Ack=11385 Win=65535 Len=0
799412 260.878297 77.197.128.41 -> 41.177.26.15 TCP 64 60079 > http [ACK] Seq=308 Ack=14686 Win=65535 Len=0
799413 260.878463 77.197.128.41 -> 41.177.26.15 TCP 64 60079 > http [RST, ACK] Seq=308 Ack=14686 Win=0 Len=0
799847 261.074122 77.197.128.41 -> 41.177.26.15 TCP 66 60787 > http [SYN] Seq=0 Win=65535 Len=0 MSS=1460 SACK_PERM=1
800010 261.153358 77.197.128.41 -> 41.177.26.15 TCP 64 60787 > http [ACK] Seq=1 Ack=1 Win=65535 Len=0
801594 262.211658 77.197.128.41 -> 41.177.26.15 TCP 64 60787 > http [ACK] Seq=308 Ack=2921 Win=65535 Len=0
802453 262.290904 77.197.128.41 -> 41.177.26.15 TCP 64 60787 > http [ACK] Seq=308 Ack=5841 Win=65535 Len=0
802476 262.291164 77.197.128.41 -> 41.177.26.15 TCP 64 60787 > http [ACK] Seq=308 Ack=8465 Win=65535 Len=0
803040 262.370070 77.197.128.41 -> 41.177.26.15 TCP 64 60787 > http [ACK] Seq=308 Ack=11385 Win=65535 Len=0
803041 262.370280 77.197.128.41 -> 41.177.26.15 TCP 64 60787 > http [ACK] Seq=308 Ack=16665 Win=65527 Len=0
803042 262.370285 77.197.128.41 -> 41.177.26.15 TCP 64 [TCP Dup ACK 803041#1] 60787 > http [ACK] Seq=308 Ack=16665 Win=65527 Len=0
803304 262.449341 77.197.128.41 -> 41.177.26.15 TCP 64 60787 > http [ACK] Seq=308 Ack=19585 Win=65535 Len=0
803305 262.449346 77.197.128.41 -> 41.177.26.15 TCP 64 60787 > http [ACK] Seq=308 Ack=24865 Win=65527 Len=0
803306 262.449366 77.197.128.41 -> 41.177.26.15 TCP 64 [TCP Dup ACK 803305#1] 60787 > http [ACK] Seq=308 Ack=24865 Win=65527 Len=0
803307 262.449479 77.197.128.41 -> 41.177.26.15 TCP 64 60787 > http [ACK] Seq=308 Ack=27785 Win=65535 Len=0
803563 262.528455 77.197.128.41 -> 41.177.26.15 TCP 64 60787 > http [ACK] Seq=308 Ack=33065 Win=62267 Len=0
803564 262.528460 77.197.128.41 -> 41.177.26.15 TCP 64 [TCP Window Update] 60787 > http [ACK] Seq=308 Ack=33065 Win=65535 Len=0
803565 262.528608 77.197.128.41 -> 41.177.26.15 TCP 64 60787 > http [ACK] Seq=308 Ack=37445 Win=65535 Len=0
803568 262.528880 77.197.128.41 -> 41.177.26.15 TCP 64 60787 > http [ACK] Seq=308 Ack=42725 Win=64067 Len=0
803569 262.528884 77.197.128.41 -> 41.177.26.15 TCP 64 [TCP Window Update] 60787 > http [ACK] Seq=308 Ack=42725 Win=65535 Len=0
803746 262.607726 77.197.128.41 -> 41.177.26.15 TCP 64 60787 > http [ACK] Seq=308 Ack=47105 Win=65535 Len=0
803750 262.608006 77.197.128.41 -> 41.177.26.15 TCP 64 60787 > http [ACK] Seq=308 Ack=49465 Win=65535 Len=0
803754 262.608186 77.197.128.41 -> 41.177.26.15 TCP 64 60787 > http [ACK] Seq=308 Ack=52385 Win=62615 Len=0
803755 262.608190 77.197.128.41 -> 41.177.26.15 TCP 64 [TCP Window Update] 60787 > http [ACK] Seq=308 Ack=52385 Win=65535 Len=0
803757 262.608285 77.197.128.41 -> 41.177.26.15 TCP 64 60787 > http [ACK] Seq=308 Ack=56765 Win=65535 Len=0
803760 262.608387 77.197.128.41 -> 41.177.26.15 TCP 64 60787 > http [ACK] Seq=308 Ack=59125 Win=65535 Len=0
803764 262.608525 77.197.128.41 -> 41.177.26.15 TCP 64 60787 > http [ACK] Seq=308 Ack=62045 Win=65527 Len=0
803765 262.608529 77.197.128.41 -> 41.177.26.15 TCP 64 [TCP Dup ACK 803764#1] 60787 > http [ACK] Seq=308 Ack=62045 Win=65527 Len=0
804008 262.686834 77.197.128.41 -> 41.177.26.15 TCP 64 60787 > http [ACK] Seq=308 Ack=65865 Win=65535 Len=0
804009 262.686838 77.197.128.41 -> 41.177.26.15 TCP 64 60787 > http [ACK] Seq=308 Ack=68785 Win=65535 Len=0
804010 262.686946 77.197.128.41 -> 41.177.26.15 TCP 64 60787 > http [ACK] Seq=308 Ack=70245 Win=65535 Len=0
804012 262.687180 77.197.128.41 -> 41.177.26.15 TCP 64 60787 > http [ACK] Seq=308 Ack=74065 Win=65535 Len=0
804018 262.687305 77.197.128.41 -> 41.177.26.15 TCP 64 60787 > http [ACK] Seq=308 Ack=76985 Win=65535 Len=0
804019 262.687309 77.197.128.41 -> 41.177.26.15 TCP 64 60787 > http [ACK] Seq=308 Ack=81365 Win=65535 Len=0
804034 262.687652 77.197.128.41 -> 41.177.26.15 TCP 64 60787 > http [ACK] Seq=308 Ack=85185 Win=65535 Len=0
804035 262.687656 77.197.128.41 -> 41.177.26.15 TCP 64 60787 > http [ACK] Seq=308 Ack=89565 Win=65535 Len=0
804264 262.765995 77.197.128.41 -> 41.177.26.15 TCP 64 60787 > http [ACK] Seq=308 Ack=91925 Win=65535 Len=0
804265 262.766235 77.197.128.41 -> 41.177.26.15 TCP 64 60787 > http [ACK] Seq=308 Ack=98665 Win=65527 Len=0
804266 262.766240 77.197.128.41 -> 41.177.26.15 TCP 64 [TCP Dup ACK 804265#1] 60787 > http [ACK] Seq=308 Ack=98665 Win=65527 Len=0
804267 262.766244 77.197.128.41 -> 41.177.26.15 TCP 64 60787 > http [ACK] Seq=308 Ack=101585 Win=65535 Len=0
804268 262.766247 77.197.128.41 -> 41.177.26.15 TCP 64 60787 > http [ACK] Seq=308 Ack=106865 Win=65527 Len=0
804269 262.766252 77.197.128.41 -> 41.177.26.15 TCP 64 [TCP Dup ACK 804268#1] 60787 > http [ACK] Seq=308 Ack=106865 Win=65527 Len=0
804273 262.766389 77.197.128.41 -> 41.177.26.15 TCP 64 60787 > http [ACK] Seq=308 Ack=111245 Win=65535 Len=0
804274 262.766394 77.197.128.41 -> 41.177.26.15 TCP 64 60787 > http [ACK] Seq=308 Ack=115065 Win=65527 Len=0
804275 262.766398 77.197.128.41 -> 41.177.26.15 TCP 64 [TCP Dup ACK 804274#1] 60787 > http [ACK] Seq=308 Ack=115065 Win=65527 Len=0
804281 262.766538 77.197.128.41 -> 41.177.26.15 TCP 64 60787 > http [ACK] Seq=308 Ack=117985 Win=65535 Len=0
804288 262.766677 77.197.128.41 -> 41.177.26.15 TCP 64 60787 > http [ACK] Seq=308 Ack=123265 Win=65527 Len=0
804289 262.766681 77.197.128.41 -> 41.177.26.15 TCP 64 [TCP Dup ACK 804288#1] 60787 > http [ACK] Seq=308 Ack=123265 Win=65527 Len=0
804296 262.766816 77.197.128.41 -> 41.177.26.15 TCP 64 60787 > http [ACK] Seq=308 Ack=129105 Win=65535 Len=0
804473 262.845131 77.197.128.41 -> 41.177.26.15 TCP 64 60787 > http [ACK] Seq=308 Ack=131465 Win=65527 Len=0
804474 262.845137 77.197.128.41 -> 41.177.26.15 TCP 64 [TCP Dup ACK 804473#1] 60787 > http [ACK] Seq=308 Ack=131465 Win=65527 Len=0
804476 262.845395 77.197.128.41 -> 41.177.26.15 TCP 64 60787 > http [ACK] Seq=308 Ack=137305 Win=65535 Len=0
804477 262.845400 77.197.128.41 -> 41.177.26.15 TCP 64 60787 > http [ACK] Seq=308 Ack=141125 Win=64067 Len=0
804478 262.845404 77.197.128.41 -> 41.177.26.15 TCP 64 [TCP Window Update] 60787 > http [ACK] Seq=308 Ack=141125 Win=65535 Len=0
804479 262.845408 77.197.128.41 -> 41.177.26.15 TCP 64 60787 > http [ACK] Seq=308 Ack=145505 Win=65535 Len=0
804480 262.845412 77.197.128.41 -> 41.177.26.15 TCP 64 60787 > http [ACK] Seq=308 Ack=147865 Win=65535 Len=0
804484 262.845550 77.197.128.41 -> 41.177.26.15 TCP 64 60787 > http [ACK] Seq=308 Ack=152245 Win=65535 Len=0
804490 262.845710 77.197.128.41 -> 41.177.26.15 TCP 64 60787 > http [ACK] Seq=308 Ack=156065 Win=65527 Len=0
804491 262.845714 77.197.128.41 -> 41.177.26.15 TCP 64 [TCP Dup ACK 804490#1] 60787 > http [ACK] Seq=308 Ack=156065 Win=65527 Len=0
804496 262.845838 77.197.128.41 -> 41.177.26.15 TCP 64 60787 > http [ACK] Seq=308 Ack=160445 Win=65535 Len=0
804502 262.846010 77.197.128.41 -> 41.177.26.15 TCP 64 60787 > http [ACK] Seq=308 Ack=163365 Win=65535 Len=0
804509 262.846143 77.197.128.41 -> 41.177.26.15 TCP 64 60787 > http [ACK] Seq=308 Ack=167185 Win=65535 Len=0
804522 262.846403 77.197.128.41 -> 41.177.26.15 TCP 64 60787 > http [ACK] Seq=308 Ack=172465 Win=65535 Len=0
804528 262.846729 77.197.128.41 -> 41.177.26.15 TCP 64 60787 > http [ACK] Seq=308 Ack=178305 Win=65535 Len=0
804529 262.846734 77.197.128.41 -> 41.177.26.15 TCP 64 60787 > http [ACK] Seq=308 Ack=180665 Win=65535 Len=0
804625 262.924296 77.197.128.41 -> 41.177.26.15 TCP 64 60787 > http [ACK] Seq=308 Ack=183585 Win=65535 Len=0
804626 262.924301 77.197.128.41 -> 41.177.26.15 TCP 64 60787 > http [ACK] Seq=308 Ack=186505 Win=65535 Len=0
804627 262.924305 77.197.128.41 -> 41.177.26.15 TCP 64 60787 > http [ACK] Seq=308 Ack=188865 Win=65527 Len=0
804628 262.924318 77.197.128.41 -> 41.177.26.15 TCP 64 [TCP Dup ACK 804627#1] 60787 > http [ACK] Seq=308 Ack=188865 Win=65527 Len=0
804629 262.924493 77.197.128.41 -> 41.177.26.15 TCP 64 60787 > http [ACK] Seq=308 Ack=194705 Win=65535 Len=0
804630 262.924498 77.197.128.41 -> 41.177.26.15 TCP 64 60787 > http [ACK] Seq=308 Ack=197065 Win=65535 Len=0
804632 262.924706 77.197.128.41 -> 41.177.26.15 TCP 64 60787 > http [ACK] Seq=308 Ack=198525 Win=65535 Len=0
804638 262.924861 77.197.128.41 -> 41.177.26.15 TCP 64 60787 > http [ACK] Seq=308 Ack=206725 Win=65535 Len=0
804639 262.924988 77.197.128.41 -> 41.177.26.15 TCP 64 60787 > http [ACK] Seq=308 Ack=213465 Win=58795 Len=0
804640 262.924992 77.197.128.41 -> 41.177.26.15 TCP 64 [TCP Window Update] 60787 > http [ACK] Seq=308 Ack=213465 Win=65535 Len=0
804641 262.925022 77.197.128.41 -> 41.177.26.15 TCP 64 60787 > http [ACK] Seq=308 Ack=221665 Win=65535 Len=0
804643 262.925061 77.197.128.41 -> 41.177.26.15 TCP 64 60787 > http [ACK] Seq=308 Ack=224585 Win=65535 Len=0
804644 262.925105 77.197.128.41 -> 41.177.26.15 TCP 64 60787 > http [ACK] Seq=308 Ack=227505 Win=65535 Len=0
804645 262.925236 77.197.128.41 -> 41.177.26.15 TCP 64 60787 > http [ACK] Seq=308 Ack=231325 Win=64067 Len=0
804646 262.925241 77.197.128.41 -> 41.177.26.15 TCP 64 [TCP Window Update] 60787 > http [ACK] Seq=308 Ack=231325 Win=65535 Len=0
804647 262.925460 77.197.128.41 -> 41.177.26.15 TCP 64 60787 > http [ACK] Seq=308 Ack=234245 Win=65535 Len=0
804648 262.925486 77.197.128.41 -> 41.177.26.15 TCP 64 60787 > http [ACK] Seq=308 Ack=237165 Win=65535 Len=0
804649 262.925961 77.197.128.41 -> 41.177.26.15 TCP 64 60787 > http [ACK] Seq=308 Ack=239525 Win=65527 Len=0
804650 262.925966 77.197.128.41 -> 41.177.26.15 TCP 64 [TCP Dup ACK 804649#1] 60787 > http [ACK] Seq=308 Ack=239525 Win=65527 Len=0
804651 262.926197 77.197.128.41 -> 41.177.26.15 TCP 64 60787 > http [ACK] Seq=308 Ack=242445 Win=65535 Len=0
804652 262.926324 77.197.128.41 -> 41.177.26.15 TCP 64 60787 > http [ACK] Seq=308 Ack=245365 Win=65535 Len=0
804785 263.003796 77.197.128.41 -> 41.177.26.15 TCP 64 60787 > http [ACK] Seq=308 Ack=247725 Win=65527 Len=0
804786 263.003834 77.197.128.41 -> 41.177.26.15 TCP 64 [TCP Dup ACK 804785#1] 60787 > http [ACK] Seq=308 Ack=247725 Win=65527 Len=0
804787 263.003976 77.197.128.41 -> 41.177.26.15 TCP 64 60787 > http [ACK] Seq=308 Ack=250645 Win=65535 Len=0
804789 263.004233 77.197.128.41 -> 41.177.26.15 TCP 64 60787 > http [ACK] Seq=308 Ack=253565 Win=65535 Len=0
804822 263.026626 77.197.128.41 -> 41.177.26.15 TCP 64 60787 > http [RST, ACK] Seq=308 Ack=254985 Win=0 Len=0
805046 263.140921 77.197.128.41 -> 41.177.26.15 TCP 66 62260 > http [SYN] Seq=0 Win=65535 Len=0 MSS=1460 SACK_PERM=1
805192 263.220198 77.197.128.41 -> 41.177.26.15 TCP 64 62260 > http [ACK] Seq=1 Ack=1 Win=65535 Len=0
807125 263.663545 77.197.128.41 -> 41.177.26.15 TCP 64 62260 > http [ACK] Seq=308 Ack=2921 Win=65535 Len=0
807819 263.742632 77.197.128.41 -> 41.177.26.15 TCP 64 62260 > http [ACK] Seq=308 Ack=5841 Win=65535 Len=0
807821 263.742641 77.197.128.41 -> 41.177.26.15 TCP 64 62260 > http [ACK] Seq=308 Ack=8465 Win=65535 Len=0
808565 263.821649 77.197.128.41 -> 41.177.26.15 TCP 64 62260 > http [ACK] Seq=308 Ack=11385 Win=65535 Len=0
808566 263.821807 77.197.128.41 -> 41.177.26.15 TCP 64 62260 > http [ACK] Seq=308 Ack=16665 Win=65527 Len=0
808567 263.821812 77.197.128.41 -> 41.177.26.15 TCP 64 [TCP Dup ACK 808566#1] 62260 > http [ACK] Seq=308 Ack=16665 Win=65527 Len=0
808892 263.900851 77.197.128.41 -> 41.177.26.15 TCP 64 62260 > http [ACK] Seq=308 Ack=21045 Win=65535 Len=0
808893 263.900854 77.197.128.41 -> 41.177.26.15 TCP 64 62260 > http [ACK] Seq=308 Ack=24865 Win=65527 Len=0
808894 263.900859 77.197.128.41 -> 41.177.26.15 TCP 64 [TCP Dup ACK 808893#1] 62260 > http [ACK] Seq=308 Ack=24865 Win=65527 Len=0
808899 263.901015 77.197.128.41 -> 41.177.26.15 TCP 64 62260 > http [ACK] Seq=308 Ack=27785 Win=65535 Len=0
809247 263.979907 77.197.128.41 -> 41.177.26.15 TCP 64 62260 > http [ACK] Seq=308 Ack=30705 Win=65535 Len=0
809248 263.979911 77.197.128.41 -> 41.177.26.15 TCP 64 62260 > http [ACK] Seq=308 Ack=33065 Win=65527 Len=0
809249 263.979915 77.197.128.41 -> 41.177.26.15 TCP 64 [TCP Dup ACK 809248#1] 62260 > http [ACK] Seq=308 Ack=33065 Win=65527 Len=0
809251 263.980000 77.197.128.41 -> 41.177.26.15 TCP 64 62260 > http [ACK] Seq=308 Ack=37445 Win=65535 Len=0
809257 263.980218 77.197.128.41 -> 41.177.26.15 TCP 64 62260 > http [ACK] Seq=308 Ack=42725 Win=64067 Len=0
809258 263.980223 77.197.128.41 -> 41.177.26.15 TCP 64 [TCP Window Update] 62260 > http [ACK] Seq=308 Ack=42725 Win=65535 Len=0
809672 264.059211 77.197.128.41 -> 41.177.26.15 TCP 64 62260 > http [ACK] Seq=308 Ack=47105 Win=65535 Len=0
809673 264.059390 77.197.128.41 -> 41.177.26.15 TCP 64 62260 > http [ACK] Seq=308 Ack=49465 Win=65535 Len=0
809674 264.059395 77.197.128.41 -> 41.177.26.15 TCP 64 62260 > http [ACK] Seq=308 Ack=50925 Win=65535 Len=0
809675 264.059399 77.197.128.41 -> 41.177.26.15 TCP 64 62260 > http [ACK] Seq=308 Ack=53845 Win=65535 Len=0
809679 264.059570 77.197.128.41 -> 41.177.26.15 TCP 64 62260 > http [ACK] Seq=308 Ack=57665 Win=65535 Len=0
809680 264.059574 77.197.128.41 -> 41.177.26.15 TCP 64 62260 > http [ACK] Seq=308 Ack=62045 Win=61155 Len=0
809681 264.059578 77.197.128.41 -> 41.177.26.15 TCP 64 [TCP Window Update] 62260 > http [ACK] Seq=308 Ack=62045 Win=65535 Len=0
810109 264.138224 77.197.128.41 -> 41.177.26.15 TCP 64 62260 > http [ACK] Seq=308 Ack=65865 Win=65535 Len=0
810110 264.138310 77.197.128.41 -> 41.177.26.15 TCP 64 62260 > http [ACK] Seq=308 Ack=68785 Win=65535 Len=0
810111 264.138459 77.197.128.41 -> 41.177.26.15 TCP 64 62260 > http [ACK] Seq=308 Ack=71705 Win=62615 Len=0
810112 264.138463 77.197.128.41 -> 41.177.26.15 TCP 64 [TCP Window Update] 62260 > http [ACK] Seq=308 Ack=71705 Win=65535 Len=0
810113 264.138467 77.197.128.41 -> 41.177.26.15 TCP 64 62260 > http [ACK] Seq=308 Ack=74065 Win=65535 Len=0
810132 264.138794 77.197.128.41 -> 41.177.26.15 TCP 64 62260 > http [ACK] Seq=308 Ack=76985 Win=65535 Len=0
810135 264.138853 77.197.128.41 -> 41.177.26.15 TCP 64 62260 > http [ACK] Seq=308 Ack=79905 Win=65535 Len=0
810136 264.138857 77.197.128.41 -> 41.177.26.15 TCP 64 62260 > http [ACK] Seq=308 Ack=82265 Win=65535 Len=0
810140 264.138960 77.197.128.41 -> 41.177.26.15 TCP 64 62260 > http [ACK] Seq=308 Ack=86645 Win=65535 Len=0
810146 264.139109 77.197.128.41 -> 41.177.26.15 TCP 64 62260 > http [ACK] Seq=308 Ack=90465 Win=65535 Len=0
810388 264.217349 77.197.128.41 -> 41.177.26.15 TCP 64 62260 > http [ACK] Seq=308 Ack=98665 Win=65527 Len=0
810389 264.217354 77.197.128.41 -> 41.177.26.15 TCP 64 [TCP Dup ACK 810388#1] 62260 > http [ACK] Seq=308 Ack=98665 Win=65527 Len=0
810391 264.217614 77.197.128.41 -> 41.177.26.15 TCP 64 62260 > http [ACK] Seq=308 Ack=103045 Win=65535 Len=0
810392 264.217618 77.197.128.41 -> 41.177.26.15 TCP 64 62260 > http [ACK] Seq=308 Ack=106865 Win=65527 Len=0
810393 264.217622 77.197.128.41 -> 41.177.26.15 TCP 64 [TCP Dup ACK 810392#1] 62260 > http [ACK] Seq=308 Ack=106865 Win=65527 Len=0
810394 264.217626 77.197.128.41 -> 41.177.26.15 TCP 64 62260 > http [ACK] Seq=308 Ack=111245 Win=65535 Len=0
810396 264.217777 77.197.128.41 -> 41.177.26.15 TCP 64 62260 > http [ACK] Seq=308 Ack=114165 Win=65535 Len=0
810397 264.217781 77.197.128.41 -> 41.177.26.15 TCP 64 62260 > http [ACK] Seq=308 Ack=117985 Win=61715 Len=0
810398 264.217786 77.197.128.41 -> 41.177.26.15 TCP 64 [TCP Window Update] 62260 > http [ACK] Seq=308 Ack=117985 Win=65535 Len=0
810399 264.217851 77.197.128.41 -> 41.177.26.15 TCP 64 62260 > http [ACK] Seq=308 Ack=120905 Win=65535 Len=0
810400 264.217855 77.197.128.41 -> 41.177.26.15 TCP 64 62260 > http [ACK] Seq=308 Ack=123265 Win=65535 Len=0
810401 264.217994 77.197.128.41 -> 41.177.26.15 TCP 64 62260 > http [ACK] Seq=308 Ack=127645 Win=65535 Len=0
810402 264.217999 77.197.128.41 -> 41.177.26.15 TCP 64 62260 > http [ACK] Seq=308 Ack=129105 Win=65535 Len=0
810403 264.218154 77.197.128.41 -> 41.177.26.15 TCP 64 62260 > http [ACK] Seq=308 Ack=132847 Win=65535 Len=0
810432 264.227952 77.197.128.41 -> 41.177.26.15 TCP 64 62260 > http [RST, ACK] Seq=308 Ack=132847 Win=0 Len=0
810574 264.297623 77.197.128.41 -> 41.177.26.15 TCP 66 62880 > http [SYN] Seq=0 Win=65535 Len=0 MSS=1460 SACK_PERM=1
810759 264.376725 77.197.128.41 -> 41.177.26.15 TCP 64 62880 > http [ACK] Seq=1 Ack=1 Win=65535 Len=0
812471 264.926337 77.197.128.41 -> 41.177.26.15 TCP 64 62880 > http [ACK] Seq=309 Ack=2921 Win=65535 Len=0
812663 265.005571 77.197.128.41 -> 41.177.26.15 TCP 64 62880 > http [ACK] Seq=309 Ack=5841 Win=65535 Len=0
812666 265.005818 77.197.128.41 -> 41.177.26.15 TCP 64 62880 > http [ACK] Seq=309 Ack=8465 Win=65535 Len=0
812851 265.084600 77.197.128.41 -> 41.177.26.15 TCP 64 62880 > http [ACK] Seq=309 Ack=12845 Win=65535 Len=0
812852 265.084799 77.197.128.41 -> 41.177.26.15 TCP 64 62880 > http [ACK] Seq=309 Ack=16665 Win=65527 Len=0
812853 265.084804 77.197.128.41 -> 41.177.26.15 TCP 64 [TCP Dup ACK 812852#1] 62880 > http [ACK] Seq=309 Ack=16665 Win=65527 Len=0
813006 265.163627 77.197.128.41 -> 41.177.26.15 TCP 64 62880 > http [ACK] Seq=309 Ack=22505 Win=65535 Len=0
813007 265.163805 77.197.128.41 -> 41.177.26.15 TCP 64 62880 > http [ACK] Seq=309 Ack=27785 Win=62607 Len=0
813008 265.163810 77.197.128.41 -> 41.177.26.15 TCP 64 [TCP Window Update] 62880 > http [ACK] Seq=309 Ack=27785 Win=65535 Len=0
813166 265.242740 77.197.128.41 -> 41.177.26.15 TCP 64 62880 > http [ACK] Seq=309 Ack=30705 Win=65535 Len=0
813167 265.242895 77.197.128.41 -> 41.177.26.15 TCP 64 62880 > http [ACK] Seq=309 Ack=33065 Win=65535 Len=0
813170 265.243075 77.197.128.41 -> 41.177.26.15 TCP 64 62880 > http [ACK] Seq=309 Ack=38905 Win=62607 Len=0
813171 265.243079 77.197.128.41 -> 41.177.26.15 TCP 64 [TCP Window Update] 62880 > http [ACK] Seq=309 Ack=38905 Win=65535 Len=0
813173 265.243099 77.197.128.41 -> 41.177.26.15 TCP 64 62880 > http [ACK] Seq=309 Ack=41265 Win=65535 Len=0
813442 265.321866 77.197.128.41 -> 41.177.26.15 TCP 64 62880 > http [ACK] Seq=309 Ack=44185 Win=65535 Len=0
813443 265.321889 77.197.128.41 -> 41.177.26.15 TCP 64 62880 > http [ACK] Seq=309 Ack=47105 Win=65535 Len=0
813444 265.322003 77.197.128.41 -> 41.177.26.15 TCP 64 62880 > http [ACK] Seq=309 Ack=49465 Win=65527 Len=0
813445 265.322008 77.197.128.41 -> 41.177.26.15 TCP 64 [TCP Dup ACK 813444#1] 62880 > http [ACK] Seq=309 Ack=49465 Win=65527 Len=0
813448 265.322205 77.197.128.41 -> 41.177.26.15 TCP 64 62880 > http [ACK] Seq=309 Ack=52385 Win=65535 Len=0
813449 265.322209 77.197.128.41 -> 41.177.26.15 TCP 64 62880 > http [ACK] Seq=309 Ack=57665 Win=65527 Len=0
813450 265.322213 77.197.128.41 -> 41.177.26.15 TCP 64 [TCP Dup ACK 813449#1] 62880 > http [ACK] Seq=309 Ack=57665 Win=65527 Len=0
813453 265.322293 77.197.128.41 -> 41.177.26.15 TCP 64 62880 > http [ACK] Seq=309 Ack=60585 Win=65535 Len=0
813698 265.400939 77.197.128.41 -> 41.177.26.15 TCP 64 62880 > http [ACK] Seq=309 Ack=64965 Win=65535 Len=0
813699 265.401098 77.197.128.41 -> 41.177.26.15 TCP 64 62880 > http [ACK] Seq=309 Ack=65865 Win=64635 Len=0
813706 265.401422 77.197.128.41 -> 41.177.26.15 TCP 64 62880 > http [ACK] Seq=309 Ack=70245 Win=65535 Len=0
813710 265.401645 77.197.128.41 -> 41.177.26.15 TCP 64 62880 > http [ACK] Seq=309 Ack=74065 Win=65535 Len=0
813716 265.402062 77.197.128.41 -> 41.177.26.15 TCP 64 62880 > http [ACK] Seq=309 Ack=76985 Win=65535 Len=0
813717 265.402157 77.197.128.41 -> 41.177.26.15 TCP 64 62880 > http [ACK] Seq=309 Ack=81365 Win=65535 Len=0
813718 265.402190 77.197.128.41 -> 41.177.26.15 TCP 64 62880 > http [ACK] Seq=309 Ack=85185 Win=65535 Len=0
813730 265.402498 77.197.128.41 -> 41.177.26.15 TCP 64 62880 > http [ACK] Seq=309 Ack=89565 Win=65535 Len=0
813944 265.480225 77.197.128.41 -> 41.177.26.15 TCP 64 62880 > http [ACK] Seq=309 Ack=91925 Win=65535 Len=0
813945 265.480230 77.197.128.41 -> 41.177.26.15 TCP 64 62880 > http [ACK] Seq=309 Ack=96305 Win=65535 Len=0
813946 265.480235 77.197.128.41 -> 41.177.26.15 TCP 64 62880 > http [ACK] Seq=309 Ack=97765 Win=65535 Len=0
813949 265.480581 77.197.128.41 -> 41.177.26.15 TCP 64 62880 > http [ACK] Seq=309 Ack=101585 Win=65535 Len=0
813950 265.480585 77.197.128.41 -> 41.177.26.15 TCP 64 62880 > http [ACK] Seq=309 Ack=106865 Win=64627 Len=0
813951 265.480589 77.197.128.41 -> 41.177.26.15 TCP 64 [TCP Dup ACK 813950#1] 62880 > http [ACK] Seq=309 Ack=106865 Win=64627 Len=0
813964 265.481031 77.197.128.41 -> 41.177.26.15 TCP 64 62880 > http [ACK] Seq=309 Ack=111245 Win=65535 Len=0
813972 265.481260 77.197.128.41 -> 41.177.26.15 TCP 64 62880 > http [ACK] Seq=309 Ack=115065 Win=65535 Len=0
813973 265.481264 77.197.128.41 -> 41.177.26.15 TCP 64 62880 > http [ACK] Seq=309 Ack=120905 Win=59695 Len=0
813974 265.481268 77.197.128.41 -> 41.177.26.15 TCP 64 [TCP Window Update] 62880 > http [ACK] Seq=309 Ack=120905 Win=65535 Len=0
813976 265.481276 77.197.128.41 -> 41.177.26.15 TCP 64 62880 > http [ACK] Seq=309 Ack=123265 Win=65535 Len=0
813981 265.481474 77.197.128.41 -> 41.177.26.15 TCP 64 62880 > http [ACK] Seq=309 Ack=126185 Win=65535 Len=0
813982 265.481478 77.197.128.41 -> 41.177.26.15 TCP 64 62880 > http [ACK] Seq=309 Ack=129105 Win=65535 Len=0
814287 265.559294 77.197.128.41 -> 41.177.26.15 TCP 64 62880 > http [ACK] Seq=309 Ack=131465 Win=65527 Len=0
814288 265.559299 77.197.128.41 -> 41.177.26.15 TCP 64 [TCP Dup ACK 814287#1] 62880 > http [ACK] Seq=309 Ack=131465 Win=65527 Len=0
814295 265.559779 77.197.128.41 -> 41.177.26.15 TCP 64 62880 > http [ACK] Seq=309 Ack=135845 Win=65535 Len=0
814296 265.559784 77.197.128.41 -> 41.177.26.15 TCP 64 62880 > http [ACK] Seq=309 Ack=141125 Win=64067 Len=0
814297 265.559788 77.197.128.41 -> 41.177.26.15 TCP 64 [TCP Window Update] 62880 > http [ACK] Seq=309 Ack=141125 Win=65535 Len=0
814298 265.559791 77.197.128.41 -> 41.177.26.15 TCP 64 62880 > http [ACK] Seq=309 Ack=147865 Win=65535 Len=0
814299 265.559909 77.197.128.41 -> 41.177.26.15 TCP 64 62880 > http [ACK] Seq=309 Ack=150785 Win=62615 Len=0
814300 265.559914 77.197.128.41 -> 41.177.26.15 TCP 64 [TCP Window Update] 62880 > http [ACK] Seq=309 Ack=150785 Win=65535 Len=0
814301 265.559918 77.197.128.41 -> 41.177.26.15 TCP 64 62880 > http [ACK] Seq=309 Ack=153705 Win=65535 Len=0
814310 265.560135 77.197.128.41 -> 41.177.26.15 TCP 64 62880 > http [ACK] Seq=309 Ack=156065 Win=65535 Len=0
814311 265.560139 77.197.128.41 -> 41.177.26.15 TCP 64 62880 > http [ACK] Seq=309 Ack=160445 Win=64067 Len=0
814312 265.560143 77.197.128.41 -> 41.177.26.15 TCP 64 [TCP Window Update] 62880 > http [ACK] Seq=309 Ack=160445 Win=65535 Len=0
814323 265.560345 77.197.128.41 -> 41.177.26.15 TCP 64 62880 > http [ACK] Seq=309 Ack=164265 Win=65535 Len=0
814326 265.560406 77.197.128.41 -> 41.177.26.15 TCP 64 62880 > http [ACK] Seq=309 Ack=170105 Win=64067 Len=0
814327 265.560410 77.197.128.41 -> 41.177.26.15 TCP 64 [TCP Window Update] 62880 > http [ACK] Seq=309 Ack=170105 Win=65535 Len=0
814336 265.560596 77.197.128.41 -> 41.177.26.15 TCP 64 62880 > http [ACK] Seq=309 Ack=173925 Win=65535 Len=0
814337 265.560600 77.197.128.41 -> 41.177.26.15 TCP 64 62880 > http [ACK] Seq=309 Ack=176845 Win=65535 Len=0
814345 265.560733 77.197.128.41 -> 41.177.26.15 TCP 64 62880 > http [ACK] Seq=309 Ack=180665 Win=65535 Len=0
814349 265.561012 77.197.128.41 -> 41.177.26.15 TCP 64 62880 > http [ACK] Seq=309 Ack=185045 Win=65535 Len=0
814645 265.638330 77.197.128.41 -> 41.177.26.15 TCP 64 62880 > http [ACK] Seq=309 Ack=188865 Win=65535 Len=0
814654 265.638799 77.197.128.41 -> 41.177.26.15 TCP 64 62880 > http [ACK] Seq=309 Ack=191785 Win=65535 Len=0
814655 265.638803 77.197.128.41 -> 41.177.26.15 TCP 64 62880 > http [ACK] Seq=309 Ack=194705 Win=62615 Len=0
814656 265.638807 77.197.128.41 -> 41.177.26.15 TCP 64 [TCP Window Update] 62880 > http [ACK] Seq=309 Ack=194705 Win=65535 Len=0
814657 265.638916 77.197.128.41 -> 41.177.26.15 TCP 64 62880 > http [ACK] Seq=309 Ack=197065 Win=65535 Len=0
814658 265.638949 77.197.128.41 -> 41.177.26.15 TCP 64 62880 > http [ACK] Seq=309 Ack=199985 Win=65535 Len=0
814659 265.639070 77.197.128.41 -> 41.177.26.15 TCP 64 62880 > http [ACK] Seq=309 Ack=209645 Win=61147 Len=0
814660 265.639074 77.197.128.41 -> 41.177.26.15 TCP 64 [TCP Window Update] 62880 > http [ACK] Seq=309 Ack=209645 Win=65535 Len=0
814661 265.639078 77.197.128.41 -> 41.177.26.15 TCP 64 62880 > http [ACK] Seq=309 Ack=212565 Win=65535 Len=0
814662 265.639213 77.197.128.41 -> 41.177.26.15 TCP 64 62880 > http [ACK] Seq=309 Ack=214925 Win=65535 Len=0
814663 265.639217 77.197.128.41 -> 41.177.26.15 TCP 64 62880 > http [ACK] Seq=309 Ack=221665 Win=64627 Len=0
814664 265.639221 77.197.128.41 -> 41.177.26.15 TCP 64 [TCP Dup ACK 814663#1] 62880 > http [ACK] Seq=309 Ack=221665 Win=64627 Len=0
814665 265.639378 77.197.128.41 -> 41.177.26.15 TCP 64 62880 > http [ACK] Seq=309 Ack=227505 Win=65535 Len=0
814666 265.639384 77.197.128.41 -> 41.177.26.15 TCP 64 62880 > http [ACK] Seq=309 Ack=231325 Win=65527 Len=0
814667 265.639387 77.197.128.41 -> 41.177.26.15 TCP 64 [TCP Dup ACK 814666#1] 62880 > http [ACK] Seq=309 Ack=231325 Win=65527 Len=0
814668 265.639457 77.197.128.41 -> 41.177.26.15 TCP 64 62880 > http [ACK] Seq=309 Ack=234245 Win=65535 Len=0
814672 265.639633 77.197.128.41 -> 41.177.26.15 TCP 64 62880 > http [ACK] Seq=309 Ack=237189 Win=65535 Len=0
814752 265.657279 77.197.128.41 -> 41.177.26.15 TCP 64 62880 > http [RST, ACK] Seq=309 Ack=237189 Win=0 Len=0
815178 265.752089 77.197.128.41 -> 41.177.26.15 TCP 66 63724 > http [SYN] Seq=0 Win=65535 Len=0 MSS=1460 SACK_PERM=1
815477 265.831297 77.197.128.41 -> 41.177.26.15 TCP 64 63724 > http [ACK] Seq=1 Ack=1 Win=65535 Len=0
816206 266.191319 77.197.128.41 -> 41.177.26.15 TCP 64 63724 > http [ACK] Seq=307 Ack=4381 Win=65535 Len=0
816373 266.270482 77.197.128.41 -> 41.177.26.15 TCP 64 63724 > http [ACK] Seq=307 Ack=7301 Win=65535 Len=0
816374 266.270536 77.197.128.41 -> 41.177.26.15 TCP 64 63724 > http [ACK] Seq=307 Ack=9925 Win=65535 Len=0
816535 266.349555 77.197.128.41 -> 41.177.26.15 TCP 64 63724 > http [ACK] Seq=307 Ack=16665 Win=61443 Len=0
816536 266.349649 77.197.128.41 -> 41.177.26.15 TCP 64 [TCP Window Update] 63724 > http [ACK] Seq=307 Ack=16665 Win=65535 Len=0
816754 266.429046 77.197.128.41 -> 41.177.26.15 TCP 64 63724 > http [ACK] Seq=307 Ack=19585 Win=65535 Len=0
816755 266.429051 77.197.128.41 -> 41.177.26.15 TCP 64 63724 > http [ACK] Seq=307 Ack=22505 Win=65535 Len=0
816756 266.429055 77.197.128.41 -> 41.177.26.15 TCP 64 63724 > http [ACK] Seq=307 Ack=24865 Win=65535 Len=0
816757 266.429169 77.197.128.41 -> 41.177.26.15 TCP 64 63724 > http [ACK] Seq=307 Ack=26325 Win=65535 Len=0
816988 266.508149 77.197.128.41 -> 41.177.26.15 TCP 64 63724 > http [ACK] Seq=307 Ack=30705 Win=65535 Len=0
816989 266.508154 77.197.128.41 -> 41.177.26.15 TCP 64 63724 > http [ACK] Seq=307 Ack=35985 Win=64067 Len=0
816990 266.508158 77.197.128.41 -> 41.177.26.15 TCP 64 [TCP Window Update] 63724 > http [ACK] Seq=307 Ack=35985 Win=65535 Len=0
816991 266.508250 77.197.128.41 -> 41.177.26.15 TCP 64 63724 > http [ACK] Seq=307 Ack=40365 Win=65535 Len=0
817155 266.587326 77.197.128.41 -> 41.177.26.15 TCP 64 63724 > http [ACK] Seq=307 Ack=45645 Win=64067 Len=0
817156 266.587331 77.197.128.41 -> 41.177.26.15 TCP 64 [TCP Window Update] 63724 > http [ACK] Seq=307 Ack=45645 Win=65535 Len=0
817157 266.587335 77.197.128.41 -> 41.177.26.15 TCP 64 63724 > http [ACK] Seq=307 Ack=49465 Win=65535 Len=0
817158 266.587456 77.197.128.41 -> 41.177.26.15 TCP 64 63724 > http [ACK] Seq=307 Ack=53845 Win=65535 Len=0
817159 266.587461 77.197.128.41 -> 41.177.26.15 TCP 64 63724 > http [ACK] Seq=307 Ack=57665 Win=65527 Len=0
817160 266.587465 77.197.128.41 -> 41.177.26.15 TCP 64 [TCP Dup ACK 817159#1] 63724 > http [ACK] Seq=307 Ack=57665 Win=65527 Len=0
817161 266.587469 77.197.128.41 -> 41.177.26.15 TCP 64 63724 > http [ACK] Seq=307 Ack=60585 Win=65535 Len=0
817328 266.666641 77.197.128.41 -> 41.177.26.15 TCP 64 63724 > http [ACK] Seq=307 Ack=64965 Win=65535 Len=0
817329 266.666647 77.197.128.41 -> 41.177.26.15 TCP 64 63724 > http [ACK] Seq=307 Ack=67325 Win=65535 Len=0
817330 266.666651 77.197.128.41 -> 41.177.26.15 TCP 64 63724 > http [ACK] Seq=307 Ack=71705 Win=61155 Len=0
817331 266.666655 77.197.128.41 -> 41.177.26.15 TCP 64 [TCP Window Update] 63724 > http [ACK] Seq=307 Ack=71705 Win=65535 Len=0
817334 266.666911 77.197.128.41 -> 41.177.26.15 TCP 64 63724 > http [ACK] Seq=307 Ack=74065 Win=65535 Len=0
817343 266.667103 77.197.128.41 -> 41.177.26.15 TCP 64 63724 > http [ACK] Seq=307 Ack=76985 Win=65535 Len=0
817345 266.667124 77.197.128.41 -> 41.177.26.15 TCP 64 63724 > http [ACK] Seq=307 Ack=82265 Win=65535 Len=0
817347 266.667196 77.197.128.41 -> 41.177.26.15 TCP 64 63724 > http [ACK] Seq=307 Ack=86645 Win=65535 Len=0
817511 266.745739 77.197.128.41 -> 41.177.26.15 TCP 64 63724 > http [ACK] Seq=307 Ack=90465 Win=65535 Len=0
817512 266.745876 77.197.128.41 -> 41.177.26.15 TCP 64 63724 > http [ACK] Seq=307 Ack=98665 Win=63167 Len=0
817513 266.745881 77.197.128.41 -> 41.177.26.15 TCP 64 [TCP Window Update] 63724 > http [ACK] Seq=307 Ack=98665 Win=65535 Len=0
817514 266.745885 77.197.128.41 -> 41.177.26.15 TCP 64 63724 > http [ACK] Seq=307 Ack=101585 Win=65535 Len=0
817515 266.745889 77.197.128.41 -> 41.177.26.15 TCP 64 63724 > http [ACK] Seq=307 Ack=104505 Win=65535 Len=0
817523 266.746129 77.197.128.41 -> 41.177.26.15 TCP 64 63724 > http [ACK] Seq=307 Ack=108325 Win=65535 Len=0
817524 266.746134 77.197.128.41 -> 41.177.26.15 TCP 64 63724 > http [ACK] Seq=307 Ack=109785 Win=65535 Len=0
817532 266.746379 77.197.128.41 -> 41.177.26.15 TCP 64 63724 > http [ACK] Seq=307 Ack=115065 Win=65535 Len=0
817533 266.746383 77.197.128.41 -> 41.177.26.15 TCP 64 63724 > http [ACK] Seq=307 Ack=119445 Win=64067 Len=0
817534 266.746388 77.197.128.41 -> 41.177.26.15 TCP 64 [TCP Window Update] 63724 > http [ACK] Seq=307 Ack=119445 Win=65535 Len=0
817535 266.746392 77.197.128.41 -> 41.177.26.15 TCP 64 63724 > http [ACK] Seq=307 Ack=123265 Win=65535 Len=0
817706 266.824841 77.197.128.41 -> 41.177.26.15 TCP 64 63724 > http [ACK] Seq=307 Ack=127645 Win=65527 Len=0
817707 266.824845 77.197.128.41 -> 41.177.26.15 TCP 64 [TCP Dup ACK 817706#1] 63724 > http [ACK] Seq=307 Ack=127645 Win=65527 Len=0
817708 266.824849 77.197.128.41 -> 41.177.26.15 TCP 64 63724 > http [ACK] Seq=307 Ack=130565 Win=65535 Len=0
817709 266.825025 77.197.128.41 -> 41.177.26.15 TCP 64 63724 > http [ACK] Seq=307 Ack=132925 Win=65535 Len=0
817710 266.825030 77.197.128.41 -> 41.177.26.15 TCP 64 63724 > http [ACK] Seq=307 Ack=137305 Win=65535 Len=0
817711 266.825111 77.197.128.41 -> 41.177.26.15 TCP 64 63724 > http [ACK] Seq=307 Ack=138864 Win=63976 Len=0
817712 266.825116 77.197.128.41 -> 41.177.26.15 TCP 64 [TCP Window Update] 63724 > http [ACK] Seq=307 Ack=138864 Win=65535 Len=0
817722 266.834434 77.197.128.41 -> 41.177.26.15 TCP 64 63724 > http [RST, ACK] Seq=307 Ack=138864 Win=0 Len=0
818050 266.926263 77.197.128.41 -> 41.177.26.15 TCP 66 64371 > http [SYN] Seq=0 Win=65535 Len=0 MSS=1460 SACK_PERM=1
818353 267.005188 77.197.128.41 -> 41.177.26.15 TCP 64 64371 > http [ACK] Seq=1 Ack=1 Win=65535 Len=0
819511 267.378356 77.197.128.41 -> 41.177.26.15 TCP 64 64371 > http [ACK] Seq=308 Ack=4381 Win=65535 Len=0
819773 267.457545 77.197.128.41 -> 41.177.26.15 TCP 64 64371 > http [ACK] Seq=308 Ack=9925 Win=65535 Len=0
820014 267.536510 77.197.128.41 -> 41.177.26.15 TCP 64 64371 > http [ACK] Seq=308 Ack=14305 Win=63803 Len=0
820015 267.536609 77.197.128.41 -> 41.177.26.15 TCP 64 [TCP Window Update] 64371 > http [ACK] Seq=308 Ack=14305 Win=65535 Len=0
820016 267.536614 77.197.128.41 -> 41.177.26.15 TCP 64 64371 > http [ACK] Seq=308 Ack=16665 Win=65535 Len=0
820172 267.615615 77.197.128.41 -> 41.177.26.15 TCP 64 64371 > http [ACK] Seq=308 Ack=19585 Win=65535 Len=0
820173 267.615620 77.197.128.41 -> 41.177.26.15 TCP 64 64371 > http [ACK] Seq=308 Ack=22505 Win=65535 Len=0
820174 267.615803 77.197.128.41 -> 41.177.26.15 TCP 64 64371 > http [ACK] Seq=308 Ack=26325 Win=64067 Len=0
820175 267.615808 77.197.128.41 -> 41.177.26.15 TCP 64 [TCP Window Update] 64371 > http [ACK] Seq=308 Ack=26325 Win=65535 Len=0
820328 267.694785 77.197.128.41 -> 41.177.26.15 TCP 64 64371 > http [ACK] Seq=308 Ack=29245 Win=65535 Len=0
820331 267.694927 77.197.128.41 -> 41.177.26.15 TCP 64 64371 > http [ACK] Seq=308 Ack=33065 Win=65535 Len=0
820333 267.694935 77.197.128.41 -> 41.177.26.15 TCP 64 64371 > http [ACK] Seq=308 Ack=35985 Win=62615 Len=0
820334 267.694939 77.197.128.41 -> 41.177.26.15 TCP 64 [TCP Window Update] 64371 > http [ACK] Seq=308 Ack=35985 Win=65535 Len=0
820337 267.695014 77.197.128.41 -> 41.177.26.15 TCP 64 64371 > http [ACK] Seq=308 Ack=40365 Win=65535 Len=0
820541 267.773797 77.197.128.41 -> 41.177.26.15 TCP 64 64371 > http [ACK] Seq=308 Ack=44185 Win=65527 Len=0
820542 267.773802 77.197.128.41 -> 41.177.26.15 TCP 64 [TCP Dup ACK 820541#1] 64371 > http [ACK] Seq=308 Ack=44185 Win=65527 Len=0
820543 267.773914 77.197.128.41 -> 41.177.26.15 TCP 64 64371 > http [ACK] Seq=308 Ack=47105 Win=65535 Len=0
820544 267.773918 77.197.128.41 -> 41.177.26.15 TCP 64 64371 > http [ACK] Seq=308 Ack=49465 Win=65535 Len=0
820547 267.774105 77.197.128.41 -> 41.177.26.15 TCP 64 64371 > http [ACK] Seq=308 Ack=55305 Win=65527 Len=0
820548 267.774110 77.197.128.41 -> 41.177.26.15 TCP 64 [TCP Dup ACK 820547#1] 64371 > http [ACK] Seq=308 Ack=55305 Win=65527 Len=0
820554 267.774232 77.197.128.41 -> 41.177.26.15 TCP 64 64371 > http [ACK] Seq=308 Ack=59125 Win=65535 Len=0
820759 267.852766 77.197.128.41 -> 41.177.26.15 TCP 64 64371 > http [ACK] Seq=308 Ack=62045 Win=65535 Len=0
820760 267.852940 77.197.128.41 -> 41.177.26.15 TCP 64 64371 > http [ACK] Seq=308 Ack=63505 Win=65535 Len=0
820761 267.852944 77.197.128.41 -> 41.177.26.15 TCP 64 64371 > http [ACK] Seq=308 Ack=68785 Win=65535 Len=0
820762 267.853092 77.197.128.41 -> 41.177.26.15 TCP 64 64371 > http [ACK] Seq=308 Ack=71705 Win=65527 Len=0
820763 267.853096 77.197.128.41 -> 41.177.26.15 TCP 64 [TCP Dup ACK 820762#1] 64371 > http [ACK] Seq=308 Ack=71705 Win=65527 Len=0
820768 267.853247 77.197.128.41 -> 41.177.26.15 TCP 64 64371 > http [ACK] Seq=308 Ack=74065 Win=65535 Len=0
820776 267.853505 77.197.128.41 -> 41.177.26.15 TCP 64 64371 > http [ACK] Seq=308 Ack=81365 Win=65535 Len=0
820782 267.853634 77.197.128.41 -> 41.177.26.15 TCP 64 64371 > http [ACK] Seq=308 Ack=85185 Win=65535 Len=0
820985 267.932045 77.197.128.41 -> 41.177.26.15 TCP 64 64371 > http [ACK] Seq=308 Ack=91925 Win=65535 Len=0
820986 267.932050 77.197.128.41 -> 41.177.26.15 TCP 64 64371 > http [ACK] Seq=308 Ack=94845 Win=62615 Len=0
820987 267.932054 77.197.128.41 -> 41.177.26.15 TCP 64 [TCP Window Update] 64371 > http [ACK] Seq=308 Ack=94845 Win=65535 Len=0
820988 267.932143 77.197.128.41 -> 41.177.26.15 TCP 64 64371 > http [ACK] Seq=308 Ack=98665 Win=65535 Len=0
820996 267.932437 77.197.128.41 -> 41.177.26.15 TCP 64 64371 > http [ACK] Seq=308 Ack=108325 Win=60247 Len=0
820997 267.932441 77.197.128.41 -> 41.177.26.15 TCP 64 [TCP Window Update] 64371 > http [ACK] Seq=308 Ack=108325 Win=65535 Len=0
820998 267.932445 77.197.128.41 -> 41.177.26.15 TCP 64 64371 > http [ACK] Seq=308 Ack=111245 Win=65535 Len=0
821001 267.932606 77.197.128.41 -> 41.177.26.15 TCP 64 64371 > http [ACK] Seq=308 Ack=114165 Win=65535 Len=0
821002 267.932611 77.197.128.41 -> 41.177.26.15 TCP 64 64371 > http [ACK] Seq=308 Ack=117985 Win=65535 Len=0
821003 267.932614 77.197.128.41 -> 41.177.26.15 TCP 64 64371 > http [ACK] Seq=308 Ack=119445 Win=65535 Len=0
821012 267.932772 77.197.128.41 -> 41.177.26.15 TCP 64 64371 > http [ACK] Seq=308 Ack=122365 Win=65535 Len=0
821160 268.011149 77.197.128.41 -> 41.177.26.15 TCP 64 64371 > http [ACK] Seq=308 Ack=127645 Win=65535 Len=0
821161 268.011153 77.197.128.41 -> 41.177.26.15 TCP 64 64371 > http [ACK] Seq=308 Ack=131465 Win=64627 Len=0
821162 268.011356 77.197.128.41 -> 41.177.26.15 TCP 64 [TCP Dup ACK 821161#1] 64371 > http [ACK] Seq=308 Ack=131465 Win=64627 Len=0
821163 268.011361 77.197.128.41 -> 41.177.26.15 TCP 64 64371 > http [ACK] Seq=308 Ack=135845 Win=65535 Len=0
821169 268.011493 77.197.128.41 -> 41.177.26.15 TCP 64 64371 > http [ACK] Seq=308 Ack=139665 Win=65527 Len=0
821171 268.011501 77.197.128.41 -> 41.177.26.15 TCP 64 [TCP Dup ACK 821169#1] 64371 > http [ACK] Seq=308 Ack=139665 Win=65527 Len=0
821180 268.011701 77.197.128.41 -> 41.177.26.15 TCP 64 64371 > http [ACK] Seq=308 Ack=147865 Win=65527 Len=0
821181 268.011705 77.197.128.41 -> 41.177.26.15 TCP 64 [TCP Dup ACK 821180#1] 64371 > http [ACK] Seq=308 Ack=147865 Win=65527 Len=0
821182 268.011709 77.197.128.41 -> 41.177.26.15 TCP 64 64371 > http [ACK] Seq=308 Ack=150785 Win=65535 Len=0
821185 268.011744 77.197.128.41 -> 41.177.26.15 TCP 64 64371 > http [ACK] Seq=308 Ack=153705 Win=65535 Len=0
821186 268.011749 77.197.128.41 -> 41.177.26.15 TCP 64 64371 > http [ACK] Seq=308 Ack=156065 Win=65535 Len=0
821199 268.012137 77.197.128.41 -> 41.177.26.15 TCP 64 64371 > http [ACK] Seq=308 Ack=158985 Win=65535 Len=0
821200 268.012141 77.197.128.41 -> 41.177.26.15 TCP 64 64371 > http [ACK] Seq=308 Ack=161905 Win=65535 Len=0
821201 268.012145 77.197.128.41 -> 41.177.26.15 TCP 64 64371 > http [ACK] Seq=308 Ack=164265 Win=65535 Len=0
821207 268.012275 77.197.128.41 -> 41.177.26.15 TCP 64 64371 > http [ACK] Seq=308 Ack=170105 Win=65535 Len=0
821208 268.012279 77.197.128.41 -> 41.177.26.15 TCP 64 64371 > http [ACK] Seq=308 Ack=172465 Win=65535 Len=0
821390 268.090121 77.197.128.41 -> 41.177.26.15 TCP 64 64371 > http [ACK] Seq=308 Ack=175385 Win=65535 Len=0
821391 268.090215 77.197.128.41 -> 41.177.26.15 TCP 64 64371 > http [ACK] Seq=308 Ack=179765 Win=65535 Len=0
821392 268.090391 77.197.128.41 -> 41.177.26.15 TCP 64 64371 > http [ACK] Seq=308 Ack=183585 Win=61715 Len=0
821393 268.090395 77.197.128.41 -> 41.177.26.15 TCP 64 [TCP Window Update] 64371 > http [ACK] Seq=308 Ack=183585 Win=65535 Len=0
821394 268.090399 77.197.128.41 -> 41.177.26.15 TCP 64 64371 > http [ACK] Seq=308 Ack=188865 Win=65535 Len=0
821395 268.090478 77.197.128.41 -> 41.177.26.15 TCP 64 64371 > http [ACK] Seq=308 Ack=193245 Win=64067 Len=0
821396 268.090483 77.197.128.41 -> 41.177.26.15 TCP 64 [TCP Window Update] 64371 > http [ACK] Seq=308 Ack=193245 Win=65535 Len=0
821397 268.090687 77.197.128.41 -> 41.177.26.15 TCP 64 64371 > http [ACK] Seq=308 Ack=196165 Win=65535 Len=0
821398 268.090691 77.197.128.41 -> 41.177.26.15 TCP 64 64371 > http [ACK] Seq=308 Ack=199985 Win=65535 Len=0
821399 268.090791 77.197.128.41 -> 41.177.26.15 TCP 64 64371 > http [ACK] Seq=308 Ack=201445 Win=65535 Len=0
821400 268.090795 77.197.128.41 -> 41.177.26.15 TCP 64 64371 > http [ACK] Seq=308 Ack=205265 Win=65535 Len=0
821401 268.090799 77.197.128.41 -> 41.177.26.15 TCP 64 64371 > http [ACK] Seq=308 Ack=208185 Win=65535 Len=0
821403 268.091008 77.197.128.41 -> 41.177.26.15 TCP 64 64371 > http [ACK] Seq=308 Ack=211105 Win=62615 Len=0
821404 268.091013 77.197.128.41 -> 41.177.26.15 TCP 64 [TCP Window Update] 64371 > http [ACK] Seq=308 Ack=211105 Win=65535 Len=0
821405 268.091016 77.197.128.41 -> 41.177.26.15 TCP 64 64371 > http [ACK] Seq=308 Ack=214925 Win=65535 Len=0
821406 268.091021 77.197.128.41 -> 41.177.26.15 TCP 64 64371 > http [ACK] Seq=308 Ack=217845 Win=65535 Len=0
821407 268.091203 77.197.128.41 -> 41.177.26.15 TCP 64 64371 > http [ACK] Seq=308 Ack=219305 Win=65535 Len=0
821408 268.091208 77.197.128.41 -> 41.177.26.15 TCP 64 64371 > http [ACK] Seq=308 Ack=221665 Win=65535 Len=0
821409 268.091212 77.197.128.41 -> 41.177.26.15 TCP 64 64371 > http [ACK] Seq=308 Ack=223914 Win=65535 Len=0
821433 268.105253 77.197.128.41 -> 41.177.26.15 TCP 64 64371 > http [RST, ACK] Seq=308 Ack=223914 Win=0 Len=0
1014553 341.240427 77.197.128.41 -> 244.3.160.239 TCP 66 hao > http [SYN] Seq=0 Win=65535 Len=0 MSS=1460 SACK_PERM=1
1014639 341.323133 77.197.128.41 -> 244.3.160.239 TCP 64 hao > http [ACK] Seq=1 Ack=1 Win=65535 Len=0
1014742 341.406230 77.197.128.41 -> 244.3.160.239 TCP 64 hao > http [ACK] Seq=377 Ack=767 Win=64770 Len=0
1014743 341.406234 77.197.128.41 -> 244.3.160.239 TCP 64 hao > http [RST, ACK] Seq=377 Ack=767 Win=0 Len=0
