15198   4.142031 77.197.128.251 -> 41.177.26.176 TCP 66 17800 > http [SYN] Seq=0 Win=65535 Len=0 MSS=1460 SACK_PERM=1
15393   4.221350 77.197.128.251 -> 41.177.26.176 TCP 64 17800 > http [ACK] Seq=1 Ack=1 Win=65535 Len=0
18158   5.712772 77.197.128.251 -> 41.177.26.176 TCP 64 17800 > http [ACK] Seq=303 Ack=1554 Win=65535 Len=0
18173   5.723087 77.197.128.251 -> 41.177.26.176 TCP 64 17800 > http [ACK] Seq=303 Ack=2519 Win=64570 Len=0
18174   5.723245 77.197.128.251 -> 41.177.26.176 TCP 64 17800 > http [ACK] Seq=303 Ack=2929 Win=64160 Len=0
18178   5.723475 77.197.128.251 -> 41.177.26.176 TCP 64 17800 > http [ACK] Seq=303 Ack=3868 Win=65535 Len=0
18308   5.791824 77.197.128.251 -> 41.177.26.176 TCP 64 17800 > http [ACK] Seq=303 Ack=6426 Win=65535 Len=0
18334   5.802192 77.197.128.251 -> 41.177.26.176 TCP 64 17800 > http [ACK] Seq=303 Ack=9346 Win=65535 Len=0
18335   5.802409 77.197.128.251 -> 41.177.26.176 TCP 64 17800 > http [RST, ACK] Seq=303 Ack=10375 Win=0 Len=0
18339   5.803928 77.197.128.251 -> 41.177.26.176 TCP 66 18194 > http [SYN] Seq=0 Win=65535 Len=0 MSS=1460 SACK_PERM=1
18526   5.882923 77.197.128.251 -> 41.177.26.176 TCP 64 18194 > http [ACK] Seq=1 Ack=1 Win=65535 Len=0
19263   6.322666 77.197.128.251 -> 41.177.26.176 TCP 64 18194 > http [ACK] Seq=355 Ack=2431 Win=65535 Len=0
19264   6.322670 77.197.128.251 -> 41.177.26.176 TCP 64 18194 > http [ACK] Seq=355 Ack=4058 Win=65535 Len=0
19484   6.401967 77.197.128.251 -> 41.177.26.176 TCP 64 18194 > http [ACK] Seq=355 Ack=6232 Win=65535 Len=0
19485   6.401971 77.197.128.251 -> 41.177.26.176 TCP 64 18194 > http [ACK] Seq=355 Ack=8589 Win=65535 Len=0
19709   6.480869 77.197.128.251 -> 41.177.26.176 TCP 64 18194 > http [ACK] Seq=355 Ack=11639 Win=65535 Len=0
19710   6.481110 77.197.128.251 -> 41.177.26.176 TCP 64 18194 > http [RST, ACK] Seq=355 Ack=11639 Win=0 Len=0
19714   6.484143 77.197.128.251 -> 41.177.26.176 TCP 66 18391 > http [SYN] Seq=0 Win=65535 Len=0 MSS=1460 SACK_PERM=1
19940   6.563240 77.197.128.251 -> 41.177.26.176 TCP 64 18391 > http [ACK] Seq=1 Ack=1 Win=65535 Len=0
21060   7.023478 77.197.128.251 -> 41.177.26.176 TCP 64 18391 > http [ACK] Seq=318 Ack=2431 Win=65535 Len=0
21063   7.023725 77.197.128.251 -> 41.177.26.176 TCP 64 18391 > http [ACK] Seq=318 Ack=3896 Win=65535 Len=0
21129   7.102526 77.197.128.251 -> 41.177.26.176 TCP 64 18391 > http [ACK] Seq=318 Ack=7530 Win=65535 Len=0
21130   7.102685 77.197.128.251 -> 41.177.26.176 TCP 64 18391 > http [ACK] Seq=318 Ack=9973 Win=65535 Len=0
21204   7.181740 77.197.128.251 -> 41.177.26.176 TCP 64 18391 > http [RST, ACK] Seq=318 Ack=11369 Win=0 Len=0
21208   7.194618 77.197.128.251 -> 41.177.26.176 TCP 66 18609 > http [SYN] Seq=0 Win=65535 Len=0 MSS=1460 SACK_PERM=1
21291   7.273629 77.197.128.251 -> 41.177.26.176 TCP 64 18609 > http [ACK] Seq=1 Ack=1 Win=65535 Len=0
22011   7.714442 77.197.128.251 -> 41.177.26.176 TCP 64 18609 > http [ACK] Seq=309 Ack=2924 Win=65535 Len=0
22153   7.793546 77.197.128.251 -> 41.177.26.176 TCP 64 18609 > http [ACK] Seq=309 Ack=7542 Win=65535 Len=0
22254   7.872605 77.197.128.251 -> 41.177.26.176 TCP 64 18609 > http [ACK] Seq=309 Ack=11192 Win=65459 Len=0
22255   7.872610 77.197.128.251 -> 41.177.26.176 TCP 64 [TCP Dup ACK 22254#1] 18609 > http [ACK] Seq=309 Ack=11192 Win=65459 Len=0
22256   7.873075 77.197.128.251 -> 41.177.26.176 TCP 64 18609 > http [RST, ACK] Seq=309 Ack=11192 Win=0 Len=0
22265   7.875468 77.197.128.251 -> 41.177.26.176 TCP 66 18813 > http [SYN] Seq=0 Win=65535 Len=0 MSS=1460 SACK_PERM=1
22394   7.954299 77.197.128.251 -> 41.177.26.176 TCP 64 18813 > http [ACK] Seq=1 Ack=1 Win=65535 Len=0
23028   8.340430 77.197.128.251 -> 41.177.26.176 TCP 64 18813 > http [ACK] Seq=318 Ack=3909 Win=65535 Len=0
23185   8.420550 77.197.128.251 -> 41.177.26.176 TCP 64 18813 > http [ACK] Seq=318 Ack=9687 Win=65535 Len=0
23431   8.499949 77.197.128.251 -> 41.177.26.176 TCP 64 18813 > http [RST, ACK] Seq=318 Ack=11083 Win=0 Len=0
23438   8.502155 77.197.128.251 -> 41.177.26.176 TCP 66 18999 > http [SYN] Seq=0 Win=65535 Len=0 MSS=1460 SACK_PERM=1
23597   8.581383 77.197.128.251 -> 41.177.26.176 TCP 64 18999 > http [ACK] Seq=1 Ack=1 Win=65535 Len=0
24203   9.011503 77.197.128.251 -> 41.177.26.176 TCP 64 18999 > http [ACK] Seq=318 Ack=2431 Win=65535 Len=0
24204   9.011631 77.197.128.251 -> 41.177.26.176 TCP 64 18999 > http [ACK] Seq=318 Ack=3903 Win=65535 Len=0
24263   9.090834 77.197.128.251 -> 41.177.26.176 TCP 64 18999 > http [ACK] Seq=318 Ack=7976 Win=65535 Len=0
24264   9.091106 77.197.128.251 -> 41.177.26.176 TCP 64 18999 > http [ACK] Seq=318 Ack=11070 Win=65535 Len=0
24265   9.091370 77.197.128.251 -> 41.177.26.176 TCP 64 18999 > http [RST, ACK] Seq=318 Ack=11070 Win=0 Len=0
24266   9.094565 77.197.128.251 -> 41.177.26.176 TCP 66 19173 > http [SYN] Seq=0 Win=65535 Len=0 MSS=1460 SACK_PERM=1
24343   9.173582 77.197.128.251 -> 41.177.26.176 TCP 64 19173 > http [ACK] Seq=1 Ack=1 Win=65535 Len=0
25086   9.579410 77.197.128.251 -> 41.177.26.176 TCP 64 19173 > http [ACK] Seq=309 Ack=3915 Win=65535 Len=0
25166   9.658527 77.197.128.251 -> 41.177.26.176 TCP 64 19173 > http [ACK] Seq=309 Ack=6089 Win=65535 Len=0
25167   9.658531 77.197.128.251 -> 41.177.26.176 TCP 64 19173 > http [ACK] Seq=309 Ack=8198 Win=65535 Len=0
25268   9.737515 77.197.128.251 -> 41.177.26.176 TCP 64 19173 > http [ACK] Seq=309 Ack=11481 Win=65535 Len=0
25269   9.737834 77.197.128.251 -> 41.177.26.176 TCP 64 19173 > http [RST, ACK] Seq=309 Ack=11481 Win=0 Len=0
25286   9.740571 77.197.128.251 -> 41.177.26.176 TCP 66 19361 > http [SYN] Seq=0 Win=65535 Len=0 MSS=1460 SACK_PERM=1
25487   9.819833 77.197.128.251 -> 41.177.26.176 TCP 64 19361 > http [ACK] Seq=1 Ack=1 Win=65535 Len=0
26249  10.274235 77.197.128.251 -> 41.177.26.176 TCP 64 19361 > http [ACK] Seq=309 Ack=2431 Win=65535 Len=0
26250  10.274240 77.197.128.251 -> 41.177.26.176 TCP 64 19361 > http [ACK] Seq=309 Ack=3908 Win=65535 Len=0
26394  10.353546 77.197.128.251 -> 41.177.26.176 TCP 64 19361 > http [ACK] Seq=309 Ack=6082 Win=65535 Len=0
26395  10.353551 77.197.128.251 -> 41.177.26.176 TCP 64 19361 > http [ACK] Seq=309 Ack=8116 Win=65535 Len=0
26396  10.353555 77.197.128.251 -> 41.177.26.176 TCP 64 19361 > http [ACK] Seq=309 Ack=10528 Win=65535 Len=0
26578  10.433287 77.197.128.251 -> 41.177.26.176 TCP 64 19361 > http [RST, ACK] Seq=309 Ack=11210 Win=0 Len=0
26590  10.434722 77.197.128.251 -> 41.177.26.176 TCP 66 19536 > http [SYN] Seq=0 Win=65535 Len=0 MSS=1460 SACK_PERM=1
26736  10.513725 77.197.128.251 -> 41.177.26.176 TCP 64 19536 > http [ACK] Seq=1 Ack=1 Win=65535 Len=0
27521  10.881750 77.197.128.251 -> 41.177.26.176 TCP 64 19536 > http [ACK] Seq=353 Ack=2431 Win=65535 Len=0
27522  10.881755 77.197.128.251 -> 41.177.26.176 TCP 64 19536 > http [ACK] Seq=353 Ack=4052 Win=65535 Len=0
27673  10.961100 77.197.128.251 -> 41.177.26.176 TCP 64 19536 > http [ACK] Seq=353 Ack=6216 Win=65535 Len=0
27674  10.961132 77.197.128.251 -> 41.177.26.176 TCP 64 19536 > http [ACK] Seq=353 Ack=10239 Win=65535 Len=0
27766  11.040151 77.197.128.251 -> 41.177.26.176 TCP 64 19536 > http [ACK] Seq=353 Ack=11881 Win=65535 Len=0
27767  11.040577 77.197.128.251 -> 41.177.26.176 TCP 64 19536 > http [RST, ACK] Seq=353 Ack=11881 Win=0 Len=0
27772  11.044030 77.197.128.251 -> 41.177.26.176 TCP 66 19696 > http [SYN] Seq=0 Win=65535 Len=0 MSS=1460 SACK_PERM=1
27883  11.123344 77.197.128.251 -> 41.177.26.176 TCP 64 19696 > http [ACK] Seq=1 Ack=1 Win=65535 Len=0
28523  11.505071 77.197.128.251 -> 41.177.26.176 TCP 64 19696 > http [ACK] Seq=305 Ack=2430 Win=65535 Len=0
28646  11.575501 77.197.128.251 -> 41.177.26.176 TCP 64 19696 > http [ACK] Seq=305 Ack=3890 Win=65535 Len=0
28656  11.584291 77.197.128.251 -> 41.177.26.176 TCP 64 19696 > http [ACK] Seq=305 Ack=6056 Win=65535 Len=0
28742  11.654451 77.197.128.251 -> 41.177.26.176 TCP 64 19696 > http [ACK] Seq=305 Ack=8455 Win=65535 Len=0
28746  11.663385 77.197.128.251 -> 41.177.26.176 TCP 64 19696 > http [ACK] Seq=305 Ack=11305 Win=65535 Len=0
28747  11.663573 77.197.128.251 -> 41.177.26.176 TCP 64 19696 > http [RST, ACK] Seq=305 Ack=11305 Win=0 Len=0
28755  11.673767 77.197.128.251 -> 41.177.26.176 TCP 66 19859 > http [SYN] Seq=0 Win=65535 Len=0 MSS=1460 SACK_PERM=1
28916  11.752671 77.197.128.251 -> 41.177.26.176 TCP 64 19859 > http [ACK] Seq=1 Ack=1 Win=65535 Len=0
29553  12.142352 77.197.128.251 -> 41.177.26.176 TCP 64 19859 > http [ACK] Seq=308 Ack=2602 Win=65535 Len=0
29693  12.221346 77.197.128.251 -> 41.177.26.176 TCP 64 19859 > http [ACK] Seq=308 Ack=5365 Win=65535 Len=0
29694  12.221504 77.197.128.251 -> 41.177.26.176 TCP 64 19859 > http [ACK] Seq=308 Ack=7529 Win=65535 Len=0
29789  12.300516 77.197.128.251 -> 41.177.26.176 TCP 64 19859 > http [ACK] Seq=308 Ack=11624 Win=65535 Len=0
29790  12.300710 77.197.128.251 -> 41.177.26.176 TCP 64 19859 > http [RST, ACK] Seq=308 Ack=11624 Win=0 Len=0
29798  12.304946 77.197.128.251 -> 41.177.26.176 TCP 66 20035 > http [SYN] Seq=0 Win=65535 Len=0 MSS=1460 SACK_PERM=1
29896  12.383993 77.197.128.251 -> 41.177.26.176 TCP 64 20035 > http [ACK] Seq=1 Ack=1 Win=65535 Len=0
30637  12.755130 77.197.128.251 -> 41.177.26.176 TCP 64 20035 > http [ACK] Seq=308 Ack=3705 Win=65535 Len=0
30790  12.834094 77.197.128.251 -> 41.177.26.176 TCP 64 20035 > http [ACK] Seq=308 Ack=6063 Win=65535 Len=0
30791  12.834324 77.197.128.251 -> 41.177.26.176 TCP 64 20035 > http [ACK] Seq=308 Ack=8912 Win=65535 Len=0
30888  12.913175 77.197.128.251 -> 41.177.26.176 TCP 64 20035 > http [ACK] Seq=308 Ack=12176 Win=65256 Len=0
30889  12.913204 77.197.128.251 -> 41.177.26.176 TCP 64 [TCP Dup ACK 30888#1] 20035 > http [ACK] Seq=308 Ack=12176 Win=65256 Len=0
30891  12.913567 77.197.128.251 -> 41.177.26.176 TCP 64 20035 > http [RST, ACK] Seq=308 Ack=12176 Win=0 Len=0
30912  12.918978 77.197.128.251 -> 41.177.26.176 TCP 66 20198 > http [SYN] Seq=0 Win=65535 Len=0 MSS=1460 SACK_PERM=1
31015  12.998030 77.197.128.251 -> 41.177.26.176 TCP 64 20198 > http [ACK] Seq=1 Ack=1 Win=65535 Len=0
33183  14.050574 77.197.128.251 -> 41.177.26.176 TCP 64 20198 > http [ACK] Seq=316 Ack=1505 Win=65535 Len=0
33191  14.060531 77.197.128.251 -> 41.177.26.176 TCP 64 20198 > http [ACK] Seq=316 Ack=2601 Win=64439 Len=0
33193  14.060704 77.197.128.251 -> 41.177.26.176 TCP 64 20198 > http [ACK] Seq=316 Ack=3040 Win=65535 Len=0
33318  14.129657 77.197.128.251 -> 41.177.26.176 TCP 64 20198 > http [ACK] Seq=316 Ack=4850 Win=65535 Len=0
33319  14.129662 77.197.128.251 -> 41.177.26.176 TCP 64 20198 > http [ACK] Seq=316 Ack=7242 Win=65535 Len=0
33325  14.139417 77.197.128.251 -> 41.177.26.176 TCP 64 20198 > http [ACK] Seq=316 Ack=9393 Win=65535 Len=0
33512  14.208691 77.197.128.251 -> 41.177.26.176 TCP 64 20198 > http [ACK] Seq=316 Ack=12005 Win=65112 Len=0
33513  14.208695 77.197.128.251 -> 41.177.26.176 TCP 64 [TCP Dup ACK 33512#1] 20198 > http [ACK] Seq=316 Ack=12005 Win=65112 Len=0
33514  14.208834 77.197.128.251 -> 41.177.26.176 TCP 64 20198 > http [RST, ACK] Seq=316 Ack=12005 Win=0 Len=0
33515  14.209347 77.197.128.251 -> 41.177.26.176 TCP 66 20460 > http [SYN] Seq=0 Win=65535 Len=0 MSS=1460 SACK_PERM=1
33638  14.288419 77.197.128.251 -> 41.177.26.176 TCP 64 20460 > http [ACK] Seq=1 Ack=1 Win=65535 Len=0
35157  14.731738 77.197.128.251 -> 41.177.26.176 TCP 64 20460 > http [ACK] Seq=318 Ack=3900 Win=65535 Len=0
35415  14.810763 77.197.128.251 -> 41.177.26.176 TCP 64 20460 > http [ACK] Seq=318 Ack=8007 Win=65535 Len=0
35719  14.889796 77.197.128.251 -> 41.177.26.176 TCP 64 20460 > http [ACK] Seq=318 Ack=11283 Win=65535 Len=0
35720  14.889933 77.197.128.251 -> 41.177.26.176 TCP 64 20460 > http [RST, ACK] Seq=318 Ack=11283 Win=0 Len=0
35721  14.891437 77.197.128.251 -> 41.177.26.176 TCP 66 20584 > http [SYN] Seq=0 Win=65535 Len=0 MSS=1460 SACK_PERM=1
35831  14.970560 77.197.128.251 -> 41.177.26.176 TCP 64 20584 > http [ACK] Seq=1 Ack=1 Win=65535 Len=0
39938  16.594830 77.197.128.251 -> 41.177.26.176 TCP 64 20584 > http [ACK] Seq=329 Ack=1474 Win=65535 Len=0
39955  16.604384 77.197.128.251 -> 41.177.26.176 TCP 64 20584 > http [ACK] Seq=329 Ack=2563 Win=64446 Len=0
39956  16.604617 77.197.128.251 -> 41.177.26.176 TCP 64 20584 > http [ACK] Seq=329 Ack=3042 Win=65535 Len=0
40068  16.673879 77.197.128.251 -> 41.177.26.176 TCP 64 20584 > http [ACK] Seq=329 Ack=6645 Win=65535 Len=0
40074  16.683530 77.197.128.251 -> 41.177.26.176 TCP 64 20584 > http [ACK] Seq=329 Ack=10633 Win=65535 Len=0
40075  16.683763 77.197.128.251 -> 41.177.26.176 TCP 64 20584 > http [RST, ACK] Seq=329 Ack=10633 Win=0 Len=0
40078  16.688200 77.197.128.251 -> 41.177.26.176 TCP 66 20981 > http [SYN] Seq=0 Win=65535 Len=0 MSS=1460 SACK_PERM=1
40166  16.767140 77.197.128.251 -> 41.177.26.176 TCP 64 20981 > http [ACK] Seq=1 Ack=1 Win=65535 Len=0
41178  17.207093 77.197.128.251 -> 41.177.26.176 TCP 64 20981 > http [ACK] Seq=356 Ack=2431 Win=65535 Len=0
41179  17.207097 77.197.128.251 -> 41.177.26.176 TCP 64 20981 > http [ACK] Seq=356 Ack=4057 Win=65535 Len=0
41392  17.286110 77.197.128.251 -> 41.177.26.176 TCP 64 20981 > http [ACK] Seq=356 Ack=6237 Win=65535 Len=0
41393  17.286345 77.197.128.251 -> 41.177.26.176 TCP 64 20981 > http [ACK] Seq=356 Ack=9229 Win=65535 Len=0
41648  17.365259 77.197.128.251 -> 41.177.26.176 TCP 64 20981 > http [ACK] Seq=356 Ack=12084 Win=65535 Len=0
41649  17.365395 77.197.128.251 -> 41.177.26.176 TCP 64 20981 > http [RST, ACK] Seq=356 Ack=12084 Win=0 Len=0
41663  17.370090 77.197.128.251 -> 41.177.26.176 TCP 66 21104 > http [SYN] Seq=0 Win=65535 Len=0 MSS=1460 SACK_PERM=1
41937  17.448982 77.197.128.251 -> 41.177.26.176 TCP 64 21104 > http [ACK] Seq=1 Ack=1 Win=65535 Len=0
42621  17.956908 77.197.128.251 -> 41.177.26.176 TCP 64 21104 > http [ACK] Seq=355 Ack=2431 Win=65535 Len=0
42622  17.956913 77.197.128.251 -> 41.177.26.176 TCP 64 21104 > http [ACK] Seq=355 Ack=4058 Win=65535 Len=0
42743  18.035855 77.197.128.251 -> 41.177.26.176 TCP 64 21104 > http [ACK] Seq=355 Ack=6232 Win=65535 Len=0
42744  18.036018 77.197.128.251 -> 41.177.26.176 TCP 64 21104 > http [ACK] Seq=355 Ack=8505 Win=65535 Len=0
42870  18.114880 77.197.128.251 -> 41.177.26.176 TCP 64 21104 > http [ACK] Seq=355 Ack=11781 Win=65535 Len=0
42871  18.115172 77.197.128.251 -> 41.177.26.176 TCP 64 21104 > http [RST, ACK] Seq=355 Ack=11781 Win=0 Len=0
42874  18.116716 77.197.128.251 -> 41.177.26.176 TCP 66 21233 > http [SYN] Seq=0 Win=65535 Len=0 MSS=1460 SACK_PERM=1
42962  18.195677 77.197.128.251 -> 41.177.26.176 TCP 64 21233 > http [ACK] Seq=1 Ack=1 Win=65535 Len=0
44069  18.628643 77.197.128.251 -> 41.177.26.176 TCP 64 21233 > http [ACK] Seq=309 Ack=3130 Win=65535 Len=0
44337  18.707611 77.197.128.251 -> 41.177.26.176 TCP 64 21233 > http [ACK] Seq=309 Ack=6089 Win=65535 Len=0
44805  18.786498 77.197.128.251 -> 41.177.26.176 TCP 64 21233 > http [ACK] Seq=309 Ack=7912 Win=65535 Len=0
44806  18.786754 77.197.128.251 -> 41.177.26.176 TCP 64 21233 > http [ACK] Seq=309 Ack=11188 Win=65535 Len=0
44807  18.786903 77.197.128.251 -> 41.177.26.176 TCP 64 21233 > http [RST, ACK] Seq=309 Ack=11188 Win=0 Len=0
44811  18.789988 77.197.128.251 -> 41.177.26.176 TCP 66 21392 > http [SYN] Seq=0 Win=65535 Len=0 MSS=1460 SACK_PERM=1
45079  18.868920 77.197.128.251 -> 41.177.26.176 TCP 64 21392 > http [ACK] Seq=1 Ack=1 Win=65535 Len=0
46330  19.333827 77.197.128.251 -> 41.177.26.176 TCP 64 21392 > http [ACK] Seq=318 Ack=2431 Win=65535 Len=0
46625  19.412797 77.197.128.251 -> 41.177.26.176 TCP 64 21392 > http [ACK] Seq=318 Ack=6063 Win=65535 Len=0
46957  19.491768 77.197.128.251 -> 41.177.26.176 TCP 64 21392 > http [ACK] Seq=318 Ack=11055 Win=65103 Len=0
46958  19.491818 77.197.128.251 -> 41.177.26.176 TCP 64 [TCP Dup ACK 46957#1] 21392 > http [ACK] Seq=318 Ack=11055 Win=65103 Len=0
46964  19.492142 77.197.128.251 -> 41.177.26.176 TCP 64 21392 > http [RST, ACK] Seq=318 Ack=11055 Win=0 Len=0
46966  19.493703 77.197.128.251 -> 41.177.26.176 TCP 66 21540 > http [SYN] Seq=0 Win=65535 Len=0 MSS=1460 SACK_PERM=1
47322  19.572596 77.197.128.251 -> 41.177.26.176 TCP 64 21540 > http [ACK] Seq=1 Ack=1 Win=65535 Len=0
51457  21.122243 77.197.128.251 -> 41.177.26.176 TCP 64 21540 > http [ACK] Seq=311 Ack=1729 Win=65535 Len=0
51469  21.132169 77.197.128.251 -> 41.177.26.176 TCP 64 21540 > http [ACK] Seq=311 Ack=2702 Win=64562 Len=0
51472  21.132567 77.197.128.251 -> 41.177.26.176 TCP 64 21540 > http [ACK] Seq=311 Ack=3128 Win=64136 Len=0
51582  21.201287 77.197.128.251 -> 41.177.26.176 TCP 64 21540 > http [ACK] Seq=311 Ack=6782 Win=65535 Len=0
51603  21.211116 77.197.128.251 -> 41.177.26.176 TCP 64 21540 > http [ACK] Seq=311 Ack=8694 Win=65535 Len=0
51604  21.211678 77.197.128.251 -> 41.177.26.176 TCP 64 21540 > http [ACK] Seq=311 Ack=11614 Win=65535 Len=0
51714  21.280106 77.197.128.251 -> 41.177.26.176 TCP 64 21540 > http [ACK] Seq=311 Ack=12462 Win=64687 Len=0
51715  21.280428 77.197.128.251 -> 41.177.26.176 TCP 64 21540 > http [RST, ACK] Seq=311 Ack=12462 Win=0 Len=0
51718  21.281215 77.197.128.251 -> 41.177.26.176 TCP 66 21902 > http [SYN] Seq=0 Win=65535 Len=0 MSS=1460 SACK_PERM=1
51869  21.360161 77.197.128.251 -> 41.177.26.176 TCP 64 21902 > http [ACK] Seq=1 Ack=1 Win=65535 Len=0
52495  21.729613 77.197.128.251 -> 41.177.26.176 TCP 64 21902 > http [ACK] Seq=309 Ack=2431 Win=65535 Len=0
52532  21.808776 77.197.128.251 -> 41.177.26.176 TCP 64 21902 > http [ACK] Seq=309 Ack=6067 Win=65535 Len=0
52620  21.887635 77.197.128.251 -> 41.177.26.176 TCP 64 21902 > http [ACK] Seq=309 Ack=8059 Win=65535 Len=0
52622  21.887815 77.197.128.251 -> 41.177.26.176 TCP 64 21902 > http [ACK] Seq=309 Ack=11331 Win=65535 Len=0
52625  21.889973 77.197.128.251 -> 41.177.26.176 TCP 64 21902 > http [RST, ACK] Seq=309 Ack=11331 Win=0 Len=0
52641  21.896718 77.197.128.251 -> 41.177.26.176 TCP 66 22057 > http [SYN] Seq=0 Win=65535 Len=0 MSS=1460 SACK_PERM=1
52730  21.975614 77.197.128.251 -> 41.177.26.176 TCP 64 22057 > http [ACK] Seq=1 Ack=1 Win=65535 Len=0
54116  22.377612 77.197.128.251 -> 41.177.26.176 TCP 64 22057 > http [ACK] Seq=318 Ack=2431 Win=65535 Len=0
54203  22.456886 77.197.128.251 -> 41.177.26.176 TCP 64 22057 > http [ACK] Seq=318 Ack=6063 Win=65535 Len=0
54370  22.535701 77.197.128.251 -> 41.177.26.176 TCP 64 22057 > http [ACK] Seq=318 Ack=7780 Win=65535 Len=0
54374  22.535949 77.197.128.251 -> 41.177.26.176 TCP 64 22057 > http [ACK] Seq=318 Ack=11063 Win=65535 Len=0
54376  22.536272 77.197.128.251 -> 41.177.26.176 TCP 64 22057 > http [RST, ACK] Seq=318 Ack=11063 Win=0 Len=0
54377  22.536925 77.197.128.251 -> 41.177.26.176 TCP 66 22203 > http [SYN] Seq=0 Win=65535 Len=0 MSS=1460 SACK_PERM=1
54609  22.615774 77.197.128.251 -> 41.177.26.176 TCP 64 22203 > http [ACK] Seq=1 Ack=1 Win=65535 Len=0
58931  23.804698 77.197.128.251 -> 41.177.26.176 TCP 64 22203 > http [ACK] Seq=345 Ack=1495 Win=65535 Len=0
58969  23.816394 77.197.128.251 -> 41.177.26.176 TCP 64 22203 > http [ACK] Seq=345 Ack=2511 Win=64519 Len=0
58970  23.816399 77.197.128.251 -> 41.177.26.176 TCP 64 22203 > http [ACK] Seq=345 Ack=3022 Win=65535 Len=0
59284  23.883833 77.197.128.251 -> 41.177.26.176 TCP 64 22203 > http [ACK] Seq=345 Ack=5016 Win=65535 Len=0
59314  23.895348 77.197.128.251 -> 41.177.26.176 TCP 64 22203 > http [ACK] Seq=345 Ack=10511 Win=65535 Len=0
59318  23.895633 77.197.128.251 -> 41.177.26.176 TCP 64 22203 > http [RST, ACK] Seq=345 Ack=10511 Win=0 Len=0
59322  23.898552 77.197.128.251 -> 41.177.26.176 TCP 66 22526 > http [SYN] Seq=0 Win=65535 Len=0 MSS=1460 SACK_PERM=1
59518  23.977738 77.197.128.251 -> 41.177.26.176 TCP 64 22526 > http [ACK] Seq=1 Ack=1 Win=65535 Len=0
60206  24.341037 77.197.128.251 -> 41.177.26.176 TCP 64 22526 > http [ACK] Seq=308 Ack=2428 Win=65535 Len=0
60289  24.372643 77.197.128.251 -> 41.177.26.176 TCP 64 22526 > http [ACK] Seq=308 Ack=3888 Win=65535 Len=0
60366  24.420588 77.197.128.251 -> 41.177.26.176 TCP 64 22526 > http [ACK] Seq=308 Ack=7238 Win=65535 Len=0
60438  24.451815 77.197.128.251 -> 41.177.26.176 TCP 64 22526 > http [ACK] Seq=308 Ack=8761 Win=65535 Len=0
60543  24.499744 77.197.128.251 -> 41.177.26.176 TCP 64 22526 > http [ACK] Seq=308 Ack=11512 Win=65535 Len=0
60544  24.499996 77.197.128.251 -> 41.177.26.176 TCP 64 22526 > http [RST, ACK] Seq=308 Ack=11512 Win=0 Len=0
60546  24.501437 77.197.128.251 -> 41.177.26.176 TCP 66 22675 > http [SYN] Seq=0 Win=65535 Len=0 MSS=1460 SACK_PERM=1
60663  24.580426 77.197.128.251 -> 41.177.26.176 TCP 64 22675 > http [ACK] Seq=1 Ack=1 Win=65535 Len=0
61298  25.053436 77.197.128.251 -> 41.177.26.176 TCP 64 22675 > http [ACK] Seq=318 Ack=2909 Win=65535 Len=0
61435  25.132446 77.197.128.251 -> 41.177.26.176 TCP 64 22675 > http [ACK] Seq=318 Ack=6063 Win=65535 Len=0
61631  25.211542 77.197.128.251 -> 41.177.26.176 TCP 64 22675 > http [ACK] Seq=318 Ack=8983 Win=65535 Len=0
61632  25.211566 77.197.128.251 -> 41.177.26.176 TCP 64 22675 > http [ACK] Seq=318 Ack=11171 Win=65535 Len=0
61633  25.211717 77.197.128.251 -> 41.177.26.176 TCP 64 22675 > http [RST, ACK] Seq=318 Ack=11171 Win=0 Len=0
61634  25.212150 77.197.128.251 -> 41.177.26.176 TCP 66 22863 > http [SYN] Seq=0 Win=65535 Len=0 MSS=1460 SACK_PERM=1
61788  25.291171 77.197.128.251 -> 41.177.26.176 TCP 64 22863 > http [ACK] Seq=1 Ack=1 Win=65535 Len=0
62488  25.694089 77.197.128.251 -> 41.177.26.176 TCP 64 22863 > http [ACK] Seq=309 Ack=2431 Win=65535 Len=0
62648  25.773135 77.197.128.251 -> 41.177.26.176 TCP 64 22863 > http [ACK] Seq=309 Ack=5351 Win=65535 Len=0
62649  25.773140 77.197.128.251 -> 41.177.26.176 TCP 64 22863 > http [ACK] Seq=309 Ack=7529 Win=65535 Len=0
62805  25.852252 77.197.128.251 -> 41.177.26.176 TCP 64 22863 > http [ACK] Seq=309 Ack=9354 Win=65535 Len=0
62806  25.852257 77.197.128.251 -> 41.177.26.176 TCP 64 22863 > http [ACK] Seq=309 Ack=11162 Win=65535 Len=0
62807  25.852508 77.197.128.251 -> 41.177.26.176 TCP 64 22863 > http [RST, ACK] Seq=309 Ack=11162 Win=0 Len=0
62808  25.853444 77.197.128.251 -> 41.177.26.176 TCP 66 inovaport2 > http [SYN] Seq=0 Win=65535 Len=0 MSS=1460 SACK_PERM=1
63008  25.932560 77.197.128.251 -> 41.177.26.176 TCP 64 inovaport2 > http [ACK] Seq=1 Ack=1 Win=65535 Len=0
65220  26.930553 77.197.128.251 -> 41.177.26.176 TCP 64 inovaport2 > http [ACK] Seq=338 Ack=1579 Win=65535 Len=0
65263  26.942970 77.197.128.251 -> 41.177.26.176 TCP 64 inovaport2 > http [ACK] Seq=338 Ack=2347 Win=64767 Len=0
65265  26.943207 77.197.128.251 -> 41.177.26.176 TCP 64 inovaport2 > http [ACK] Seq=338 Ack=3079 Win=65535 Len=0
65498  27.009657 77.197.128.251 -> 41.177.26.176 TCP 64 inovaport2 > http [ACK] Seq=338 Ack=5304 Win=65535 Len=0
65522  27.022222 77.197.128.251 -> 41.177.26.176 TCP 64 inovaport2 > http [ACK] Seq=338 Ack=9365 Win=65535 Len=0
65523  27.022656 77.197.128.251 -> 41.177.26.176 TCP 64 inovaport2 > http [RST, ACK] Seq=338 Ack=10482 Win=0 Len=0
65541  27.025407 77.197.128.251 -> 41.177.26.176 TCP 66 23240 > http [SYN] Seq=0 Win=65535 Len=0 MSS=1460 SACK_PERM=1
65761  27.104483 77.197.128.251 -> 41.177.26.176 TCP 64 23240 > http [ACK] Seq=1 Ack=1 Win=65535 Len=0
66667  27.485699 77.197.128.251 -> 41.177.26.176 TCP 64 23240 > http [ACK] Seq=308 Ack=3905 Win=65535 Len=0
66909  27.564863 77.197.128.251 -> 41.177.26.176 TCP 64 23240 > http [ACK] Seq=308 Ack=6069 Win=65535 Len=0
66910  27.565005 77.197.128.251 -> 41.177.26.176 TCP 64 23240 > http [ACK] Seq=308 Ack=8989 Win=65535 Len=0
67148  27.643853 77.197.128.251 -> 41.177.26.176 TCP 64 23240 > http [ACK] Seq=308 Ack=11508 Win=65535 Len=0
67149  27.644132 77.197.128.251 -> 41.177.26.176 TCP 64 23240 > http [RST, ACK] Seq=308 Ack=11508 Win=0 Len=0
67159  27.646100 77.197.128.251 -> 41.177.26.176 TCP 66 23338 > http [SYN] Seq=0 Win=65535 Len=0 MSS=1460 SACK_PERM=1
67385  27.725048 77.197.128.251 -> 41.177.26.176 TCP 64 23338 > http [ACK] Seq=1 Ack=1 Win=65535 Len=0
68265  28.096253 77.197.128.251 -> 41.177.26.176 TCP 64 23338 > http [ACK] Seq=305 Ack=2511 Win=65535 Len=0
68392  28.175258 77.197.128.251 -> 41.177.26.176 TCP 64 23338 > http [ACK] Seq=305 Ack=6063 Win=65535 Len=0
68494  28.254198 77.197.128.251 -> 41.177.26.176 TCP 64 23338 > http [ACK] Seq=305 Ack=8128 Win=65535 Len=0
68495  28.254314 77.197.128.251 -> 41.177.26.176 TCP 64 23338 > http [ACK] Seq=305 Ack=11178 Win=65060 Len=0
68496  28.254319 77.197.128.251 -> 41.177.26.176 TCP 64 [TCP Dup ACK 68495#1] 23338 > http [ACK] Seq=305 Ack=11178 Win=65060 Len=0
68497  28.254599 77.197.128.251 -> 41.177.26.176 TCP 64 23338 > http [RST, ACK] Seq=305 Ack=11178 Win=0 Len=0
68738  28.427891 77.197.128.251 -> 41.177.26.176 TCP 66 23454 > http [SYN] Seq=0 Win=65535 Len=0 MSS=1460 SACK_PERM=1
68931  28.506864 77.197.128.251 -> 41.177.26.176 TCP 64 23454 > http [ACK] Seq=1 Ack=1 Win=65535 Len=0
69655  28.875883 77.197.128.251 -> 41.177.26.176 TCP 64 23454 > http [ACK] Seq=316 Ack=2914 Win=65535 Len=0
69870  28.954891 77.197.128.251 -> 41.177.26.176 TCP 64 23454 > http [ACK] Seq=316 Ack=6064 Win=65535 Len=0
70059  29.033850 77.197.128.251 -> 41.177.26.176 TCP 64 23454 > http [ACK] Seq=316 Ack=8390 Win=65535 Len=0
70060  29.033910 77.197.128.251 -> 41.177.26.176 TCP 64 23454 > http [ACK] Seq=316 Ack=11429 Win=65535 Len=0
70061  29.034145 77.197.128.251 -> 41.177.26.176 TCP 64 23454 > http [RST, ACK] Seq=316 Ack=11429 Win=0 Len=0
865921 286.254286 77.197.128.251 -> 41.177.26.176 TCP 66 17689 > http [SYN] Seq=0 Win=65535 Len=0 MSS=1460 SACK_PERM=1
866078 286.333485 77.197.128.251 -> 41.177.26.176 TCP 64 17689 > http [ACK] Seq=1 Ack=1 Win=65535 Len=0
867393 286.781647 77.197.128.251 -> 41.177.26.176 TCP 64 17689 > http [ACK] Seq=310 Ack=2431 Win=65535 Len=0
867394 286.781652 77.197.128.251 -> 41.177.26.176 TCP 64 17689 > http [ACK] Seq=310 Ack=3907 Win=65535 Len=0
867606 286.860672 77.197.128.251 -> 41.177.26.176 TCP 64 17689 > http [ACK] Seq=310 Ack=6087 Win=65535 Len=0
867607 286.860815 77.197.128.251 -> 41.177.26.176 TCP 64 17689 > http [ACK] Seq=310 Ack=10713 Win=64386 Len=0
868124 286.939897 77.197.128.251 -> 41.177.26.176 TCP 64 17689 > http [RST, ACK] Seq=310 Ack=11395 Win=0 Len=0
907725 299.303761 77.197.128.251 -> 41.177.26.176 TCP 66 22335 > http [SYN] Seq=0 Win=65535 Len=0 MSS=1460 SACK_PERM=1
907829 299.382750 77.197.128.251 -> 41.177.26.176 TCP 64 22335 > http [ACK] Seq=1 Ack=1 Win=65535 Len=0
908580 299.834995 77.197.128.251 -> 41.177.26.176 TCP 64 22335 > http [ACK] Seq=318 Ack=2916 Win=65535 Len=0
908711 299.914041 77.197.128.251 -> 41.177.26.176 TCP 64 22335 > http [ACK] Seq=318 Ack=6077 Win=65535 Len=0
908849 299.993207 77.197.128.251 -> 41.177.26.176 TCP 64 22335 > http [ACK] Seq=318 Ack=8583 Win=65535 Len=0
908850 299.993306 77.197.128.251 -> 41.177.26.176 TCP 64 22335 > http [ACK] Seq=318 Ack=11859 Win=65535 Len=0
908851 299.993421 77.197.128.251 -> 41.177.26.176 TCP 64 22335 > http [RST, ACK] Seq=318 Ack=11859 Win=0 Len=0
915975 303.963345 77.197.128.251 -> 41.177.26.176 TCP 66 23831 > http [SYN] Seq=0 Win=65535 Len=0 MSS=1460 SACK_PERM=1
916135 304.042264 77.197.128.251 -> 41.177.26.176 TCP 64 23831 > http [ACK] Seq=1 Ack=1 Win=65535 Len=0
916689 304.433920 77.197.128.251 -> 41.177.26.176 TCP 64 23831 > http [ACK] Seq=353 Ack=4059 Win=65535 Len=0
916878 304.513233 77.197.128.251 -> 41.177.26.176 TCP 64 23831 > http [ACK] Seq=353 Ack=6223 Win=65535 Len=0
916879 304.513238 77.197.128.251 -> 41.177.26.176 TCP 64 23831 > http [ACK] Seq=353 Ack=8564 Win=65535 Len=0
917070 304.592321 77.197.128.251 -> 41.177.26.176 TCP 64 23831 > http [ACK] Seq=353 Ack=11403 Win=65535 Len=0
917083 304.592672 77.197.128.251 -> 41.177.26.176 TCP 64 23831 > http [RST, ACK] Seq=353 Ack=11403 Win=0 Len=0
925584 308.244819 77.197.128.251 -> 41.177.26.176 TCP 66 25180 > http [SYN] Seq=0 Win=65535 Len=0 MSS=1460 SACK_PERM=1
925714 308.323865 77.197.128.251 -> 41.177.26.176 TCP 64 25180 > http [ACK] Seq=1 Ack=1 Win=65535 Len=0
928350 309.288963 77.197.128.251 -> 41.177.26.176 TCP 64 25180 > http [ACK] Seq=401 Ack=3862 Win=65535 Len=0
928590 309.370389 77.197.128.251 -> 41.177.26.176 TCP 64 25180 > http [ACK] Seq=401 Ack=6492 Win=65535 Len=0
928592 309.370551 77.197.128.251 -> 41.177.26.176 TCP 64 25180 > http [ACK] Seq=401 Ack=9412 Win=65535 Len=0
928731 309.449938 77.197.128.251 -> 41.177.26.176 TCP 64 25180 > http [ACK] Seq=401 Ack=11271 Win=65535 Len=0
928732 309.450138 77.197.128.251 -> 41.177.26.176 TCP 64 25180 > http [ACK] Seq=401 Ack=12983 Win=63823 Len=0
928733 309.450143 77.197.128.251 -> 41.177.26.176 TCP 64 [TCP Window Update] 25180 > http [ACK] Seq=401 Ack=12983 Win=65535 Len=0
928734 309.450284 77.197.128.251 -> 41.177.26.176 TCP 64 25180 > http [RST, ACK] Seq=401 Ack=12983 Win=0 Len=0
928762 309.465643 77.197.128.251 -> 41.177.26.176 TCP 66 25661 > http [SYN] Seq=0 Win=65535 Len=0 MSS=1460 SACK_PERM=1
928990 309.547018 77.197.128.251 -> 41.177.26.176 TCP 64 25661 > http [ACK] Seq=1 Ack=1 Win=65535 Len=0
930411 309.952482 77.197.128.251 -> 41.177.26.176 TCP 64 25661 > http [ACK] Seq=308 Ack=2431 Win=65535 Len=0
930539 310.031584 77.197.128.251 -> 41.177.26.176 TCP 64 25661 > http [ACK] Seq=308 Ack=6062 Win=65535 Len=0
930778 310.110740 77.197.128.251 -> 41.177.26.176 TCP 64 25661 > http [ACK] Seq=308 Ack=8982 Win=65535 Len=0
930779 310.110745 77.197.128.251 -> 41.177.26.176 TCP 64 25661 > http [ACK] Seq=308 Ack=11152 Win=65535 Len=0
930780 310.110990 77.197.128.251 -> 41.177.26.176 TCP 64 25661 > http [RST, ACK] Seq=308 Ack=11152 Win=0 Len=0
930794 310.127660 77.197.128.251 -> 41.177.26.176 TCP 66 25946 > http [SYN] Seq=0 Win=65535 Len=0 MSS=1460 SACK_PERM=1
930991 310.207284 77.197.128.251 -> 41.177.26.176 TCP 64 25946 > http [ACK] Seq=1 Ack=1 Win=65535 Len=0
932212 310.568526 77.197.128.251 -> 41.177.26.176 TCP 64 25946 > http [ACK] Seq=308 Ack=2431 Win=65535 Len=0
932213 310.568531 77.197.128.251 -> 41.177.26.176 TCP 64 25946 > http [ACK] Seq=308 Ack=3905 Win=65535 Len=0
932517 310.647575 77.197.128.251 -> 41.177.26.176 TCP 64 25946 > http [ACK] Seq=308 Ack=6069 Win=65535 Len=0
932518 310.647675 77.197.128.251 -> 41.177.26.176 TCP 64 25946 > http [ACK] Seq=308 Ack=8475 Win=65535 Len=0
932758 310.726636 77.197.128.251 -> 41.177.26.176 TCP 64 25946 > http [ACK] Seq=308 Ack=11314 Win=65535 Len=0
932760 310.726791 77.197.128.251 -> 41.177.26.176 TCP 64 25946 > http [RST, ACK] Seq=308 Ack=11314 Win=0 Len=0
933062 310.806504 77.197.128.251 -> 41.177.26.176 TCP 66 26187 > http [SYN] Seq=0 Win=65535 Len=0 MSS=1460 SACK_PERM=1
933214 310.887689 77.197.128.251 -> 41.177.26.176 TCP 64 26187 > http [ACK] Seq=1 Ack=1 Win=65535 Len=0
934157 311.257298 77.197.128.251 -> 41.177.26.176 TCP 64 26187 > http [ACK] Seq=316 Ack=2431 Win=65535 Len=0
934555 311.336698 77.197.128.251 -> 41.177.26.176 TCP 64 26187 > http [ACK] Seq=316 Ack=6050 Win=65535 Len=0
934815 311.418038 77.197.128.251 -> 41.177.26.176 TCP 64 26187 > http [ACK] Seq=316 Ack=7867 Win=65535 Len=0
934816 311.418181 77.197.128.251 -> 41.177.26.176 TCP 64 26187 > http [ACK] Seq=316 Ack=11131 Win=65027 Len=0
934817 311.418186 77.197.128.251 -> 41.177.26.176 TCP 64 [TCP Dup ACK 934816#1] 26187 > http [ACK] Seq=316 Ack=11131 Win=65027 Len=0
934819 311.418498 77.197.128.251 -> 41.177.26.176 TCP 64 26187 > http [RST, ACK] Seq=316 Ack=11131 Win=0 Len=0
934828 311.424612 77.197.128.251 -> 41.177.26.176 TCP 66 26435 > http [SYN] Seq=0 Win=65535 Len=0 MSS=1460 SACK_PERM=1
934932 311.503790 77.197.128.251 -> 41.177.26.176 TCP 64 26435 > http [ACK] Seq=1 Ack=1 Win=65535 Len=0
936693 311.967470 77.197.128.251 -> 41.177.26.176 TCP 64 26435 > http [ACK] Seq=355 Ack=2602 Win=65535 Len=0
937126 312.046558 77.197.128.251 -> 41.177.26.176 TCP 64 26435 > http [ACK] Seq=355 Ack=6232 Win=65535 Len=0
937326 312.125813 77.197.128.251 -> 41.177.26.176 TCP 64 26435 > http [ACK] Seq=355 Ack=10612 Win=65535 Len=0
937327 312.126224 77.197.128.251 -> 41.177.26.176 TCP 64 26435 > http [RST, ACK] Seq=355 Ack=11608 Win=0 Len=0
937328 312.128749 77.197.128.251 -> 41.177.26.176 TCP 66 26690 > http [SYN] Seq=0 Win=65535 Len=0 MSS=1460 SACK_PERM=1
937529 312.207615 77.197.128.251 -> 41.177.26.176 TCP 64 26690 > http [ACK] Seq=1 Ack=1 Win=65535 Len=0
938850 312.615859 77.197.128.251 -> 41.177.26.176 TCP 64 26690 > http [ACK] Seq=356 Ack=2431 Win=65535 Len=0
938851 312.616016 77.197.128.251 -> 41.177.26.176 TCP 64 26690 > http [ACK] Seq=356 Ack=4057 Win=65535 Len=0
939130 312.695536 77.197.128.251 -> 41.177.26.176 TCP 64 26690 > http [ACK] Seq=356 Ack=6237 Win=65535 Len=0
939131 312.695623 77.197.128.251 -> 41.177.26.176 TCP 64 26690 > http [ACK] Seq=356 Ack=8219 Win=65535 Len=0
939134 312.695947 77.197.128.251 -> 41.177.26.176 TCP 64 26690 > http [ACK] Seq=356 Ack=11139 Win=65535 Len=0
939614 312.790188 77.197.128.251 -> 41.177.26.176 TCP 64 26690 > http [RST, ACK] Seq=356 Ack=11503 Win=0 Len=0
939649 312.803724 77.197.128.251 -> 41.177.26.176 TCP 66 26928 > http [SYN] Seq=0 Win=65535 Len=0 MSS=1460 SACK_PERM=1
939932 312.883088 77.197.128.251 -> 41.177.26.176 TCP 64 26928 > http [ACK] Seq=1 Ack=1 Win=65535 Len=0
942556 313.276404 77.197.128.251 -> 41.177.26.176 TCP 64 26928 > http [ACK] Seq=318 Ack=2431 Win=65535 Len=0
942558 313.276504 77.197.128.251 -> 41.177.26.176 TCP 64 26928 > http [ACK] Seq=318 Ack=3896 Win=65535 Len=0
943142 313.356286 77.197.128.251 -> 41.177.26.176 TCP 64 26928 > http [ACK] Seq=318 Ack=6070 Win=65535 Len=0
943143 313.356290 77.197.128.251 -> 41.177.26.176 TCP 64 26928 > http [ACK] Seq=318 Ack=8340 Win=65535 Len=0
943144 313.356589 77.197.128.251 -> 41.177.26.176 TCP 64 26928 > http [ACK] Seq=318 Ack=11189 Win=65535 Len=0
943146 313.356696 77.197.128.251 -> 41.177.26.176 TCP 64 26928 > http [RST, ACK] Seq=318 Ack=11189 Win=0 Len=0
943169 313.364759 77.197.128.251 -> 41.177.26.176 TCP 66 27117 > http [SYN] Seq=0 Win=65535 Len=0 MSS=1460 SACK_PERM=1
943568 313.443583 77.197.128.251 -> 41.177.26.176 TCP 64 27117 > http [ACK] Seq=1 Ack=1 Win=65535 Len=0
945379 313.883962 77.197.128.251 -> 41.177.26.176 TCP 64 27117 > http [ACK] Seq=318 Ack=2431 Win=65535 Len=0
945380 313.883967 77.197.128.251 -> 41.177.26.176 TCP 64 27117 > http [ACK] Seq=318 Ack=3896 Win=65535 Len=0
945855 313.963427 77.197.128.251 -> 41.177.26.176 TCP 64 27117 > http [ACK] Seq=318 Ack=6070 Win=65535 Len=0
945858 313.963649 77.197.128.251 -> 41.177.26.176 TCP 64 27117 > http [ACK] Seq=318 Ack=10471 Win=65535 Len=0
945859 313.963819 77.197.128.251 -> 41.177.26.176 TCP 64 27117 > http [RST, ACK] Seq=318 Ack=11153 Win=0 Len=0
945868 313.968784 77.197.128.251 -> 41.177.26.176 TCP 66 27312 > http [SYN] Seq=0 Win=65535 Len=0 MSS=1460 SACK_PERM=1
946164 314.047796 77.197.128.251 -> 41.177.26.176 TCP 64 27312 > http [ACK] Seq=1 Ack=1 Win=65535 Len=0
951407 315.545717 77.197.128.251 -> 41.177.26.176 TCP 64 27312 > http [ACK] Seq=321 Ack=1511 Win=65535 Len=0
951490 315.556195 77.197.128.251 -> 41.177.26.176 TCP 64 27312 > http [ACK] Seq=321 Ack=2644 Win=64402 Len=0
951492 315.556540 77.197.128.251 -> 41.177.26.176 TCP 64 27312 > http [ACK] Seq=321 Ack=3211 Win=65535 Len=0
951628 315.624794 77.197.128.251 -> 41.177.26.176 TCP 64 27312 > http [ACK] Seq=321 Ack=5839 Win=65535 Len=0
951671 315.635105 77.197.128.251 -> 41.177.26.176 TCP 64 27312 > http [ACK] Seq=321 Ack=8499 Win=65535 Len=0
951672 315.635542 77.197.128.251 -> 41.177.26.176 TCP 64 27312 > http [ACK] Seq=321 Ack=11046 Win=65535 Len=0
951673 315.635837 77.197.128.251 -> 41.177.26.176 TCP 64 27312 > http [RST, ACK] Seq=321 Ack=11046 Win=0 Len=0
951734 315.644204 77.197.128.251 -> 41.177.26.176 TCP 66 27767 > http [SYN] Seq=0 Win=65535 Len=0 MSS=1460 SACK_PERM=1
951951 315.723474 77.197.128.251 -> 41.177.26.176 TCP 64 27767 > http [ACK] Seq=1 Ack=1 Win=65535 Len=0
953739 316.254838 77.197.128.251 -> 41.177.26.176 TCP 64 27767 > http [ACK] Seq=355 Ack=2431 Win=65535 Len=0
953740 316.254972 77.197.128.251 -> 41.177.26.176 TCP 64 27767 > http [ACK] Seq=355 Ack=4058 Win=65535 Len=0
953982 316.333912 77.197.128.251 -> 41.177.26.176 TCP 64 27767 > http [ACK] Seq=355 Ack=6232 Win=65535 Len=0
953983 316.334127 77.197.128.251 -> 41.177.26.176 TCP 64 27767 > http [ACK] Seq=355 Ack=11334 Win=65535 Len=0
953984 316.334336 77.197.128.251 -> 41.177.26.176 TCP 64 27767 > http [RST, ACK] Seq=355 Ack=11334 Win=0 Len=0
953997 316.339944 77.197.128.251 -> 41.177.26.176 TCP 66 27958 > http [SYN] Seq=0 Win=65535 Len=0 MSS=1460 SACK_PERM=1
954155 316.419030 77.197.128.251 -> 41.177.26.176 TCP 64 27958 > http [ACK] Seq=1 Ack=1 Win=65535 Len=0
957794 317.986536 77.197.128.251 -> 41.177.26.176 TCP 64 27958 > http [ACK] Seq=305 Ack=1634 Win=65535 Len=0
957820 317.996409 77.197.128.251 -> 41.177.26.176 TCP 64 27958 > http [ACK] Seq=305 Ack=2604 Win=64565 Len=0
957822 317.996607 77.197.128.251 -> 41.177.26.176 TCP 64 27958 > http [ACK] Seq=305 Ack=2905 Win=64264 Len=0
957825 317.996768 77.197.128.251 -> 41.177.26.176 TCP 64 27958 > http [ACK] Seq=305 Ack=3993 Win=65535 Len=0
958046 318.065760 77.197.128.251 -> 41.177.26.176 TCP 64 27958 > http [ACK] Seq=305 Ack=6680 Win=65535 Len=0
958071 318.075345 77.197.128.251 -> 41.177.26.176 TCP 64 27958 > http [ACK] Seq=305 Ack=9600 Win=65535 Len=0
958072 318.075682 77.197.128.251 -> 41.177.26.176 TCP 64 27958 > http [RST, ACK] Seq=305 Ack=10531 Win=0 Len=0
958076 318.081805 77.197.128.251 -> 41.177.26.176 TCP 66 28522 > http [SYN] Seq=0 Win=65535 Len=0 MSS=1460 SACK_PERM=1
958264 318.160825 77.197.128.251 -> 41.177.26.176 TCP 64 28522 > http [ACK] Seq=1 Ack=1 Win=65535 Len=0
959237 318.554925 77.197.128.251 -> 41.177.26.176 TCP 64 28522 > http [ACK] Seq=317 Ack=2431 Win=65535 Len=0
959238 318.554959 77.197.128.251 -> 41.177.26.176 TCP 64 28522 > http [ACK] Seq=317 Ack=3892 Win=65535 Len=0
959479 318.634093 77.197.128.251 -> 41.177.26.176 TCP 64 28522 > http [ACK] Seq=317 Ack=6062 Win=65535 Len=0
959480 318.634174 77.197.128.251 -> 41.177.26.176 TCP 64 28522 > http [ACK] Seq=317 Ack=9703 Win=65535 Len=0
959656 318.713010 77.197.128.251 -> 41.177.26.176 TCP 64 28522 > http [ACK] Seq=317 Ack=11326 Win=65535 Len=0
959657 318.713364 77.197.128.251 -> 41.177.26.176 TCP 64 28522 > http [RST, ACK] Seq=317 Ack=11326 Win=0 Len=0
959667 318.717047 77.197.128.251 -> 41.177.26.176 TCP 66 28717 > http [SYN] Seq=0 Win=65535 Len=0 MSS=1460 SACK_PERM=1
959974 318.796065 77.197.128.251 -> 41.177.26.176 TCP 64 28717 > http [ACK] Seq=1 Ack=1 Win=65535 Len=0
962809 320.102491 77.197.128.251 -> 41.177.26.176 TCP 64 28717 > http [ACK] Seq=325 Ack=3199 Win=65535 Len=0
962894 320.181957 77.197.128.251 -> 41.177.26.176 TCP 64 28717 > http [ACK] Seq=325 Ack=7123 Win=65535 Len=0
962986 320.261248 77.197.128.251 -> 41.177.26.176 TCP 64 28717 > http [ACK] Seq=325 Ack=9754 Win=65535 Len=0
962987 320.261290 77.197.128.251 -> 41.177.26.176 TCP 64 28717 > http [ACK] Seq=325 Ack=12475 Win=65455 Len=0
962988 320.261295 77.197.128.251 -> 41.177.26.176 TCP 64 [TCP Dup ACK 962987#1] 28717 > http [ACK] Seq=325 Ack=12475 Win=65455 Len=0
963094 320.340578 77.197.128.251 -> 41.177.26.176 TCP 64 28717 > http [ACK] Seq=325 Ack=15243 Win=65535 Len=0
963095 320.341025 77.197.128.251 -> 41.177.26.176 TCP 64 28717 > http [ACK] Seq=325 Ack=17888 Win=65535 Len=0
963096 320.341030 77.197.128.251 -> 41.177.26.176 TCP 64 28717 > http [ACK] Seq=325 Ack=20274 Win=65535 Len=0
963097 320.341034 77.197.128.251 -> 41.177.26.176 TCP 64 28717 > http [ACK] Seq=325 Ack=21959 Win=65535 Len=0
963098 320.341768 77.197.128.251 -> 41.177.26.176 TCP 64 28717 > http [RST, ACK] Seq=325 Ack=21959 Win=0 Len=0
963112 320.354559 77.197.128.251 -> 41.177.26.176 TCP 66 29209 > http [SYN] Seq=0 Win=65535 Len=0 MSS=1460 SACK_PERM=1
963203 320.433618 77.197.128.251 -> 41.177.26.176 TCP 64 29209 > http [ACK] Seq=1 Ack=1 Win=65535 Len=0
965688 321.512562 77.197.128.251 -> 41.177.26.176 TCP 64 29209 > http [ACK] Seq=341 Ack=1475 Win=65535 Len=0
965725 321.522523 77.197.128.251 -> 41.177.26.176 TCP 64 29209 > http [ACK] Seq=341 Ack=2390 Win=64620 Len=0
965728 321.522791 77.197.128.251 -> 41.177.26.176 TCP 64 29209 > http [ACK] Seq=341 Ack=3722 Win=65535 Len=0
965957 321.591649 77.197.128.251 -> 41.177.26.176 TCP 64 29209 > http [ACK] Seq=341 Ack=6418 Win=65535 Len=0
966002 321.601513 77.197.128.251 -> 41.177.26.176 TCP 64 29209 > http [ACK] Seq=341 Ack=9338 Win=65535 Len=0
966004 321.602073 77.197.128.251 -> 41.177.26.176 TCP 64 29209 > http [RST, ACK] Seq=341 Ack=10479 Win=0 Len=0
966005 321.608682 77.197.128.251 -> 41.177.26.176 TCP 66 29500 > http [SYN] Seq=0 Win=65535 Len=0 MSS=1460 SACK_PERM=1
966259 321.688009 77.197.128.251 -> 41.177.26.176 TCP 64 29500 > http [ACK] Seq=1 Ack=1 Win=65535 Len=0
967037 322.055480 77.197.128.251 -> 41.177.26.176 TCP 64 29500 > http [ACK] Seq=353 Ack=4052 Win=65535 Len=0
967155 322.134902 77.197.128.251 -> 41.177.26.176 TCP 64 29500 > http [ACK] Seq=353 Ack=6216 Win=65535 Len=0
967156 322.135029 77.197.128.251 -> 41.177.26.176 TCP 64 29500 > http [ACK] Seq=353 Ack=9136 Win=65535 Len=0
967524 322.214010 77.197.128.251 -> 41.177.26.176 TCP 64 29500 > http [ACK] Seq=353 Ack=11909 Win=65535 Len=0
967525 322.214210 77.197.128.251 -> 41.177.26.176 TCP 64 29500 > http [RST, ACK] Seq=353 Ack=11909 Win=0 Len=0
967555 322.224068 77.197.128.251 -> 41.177.26.176 TCP 66 29674 > http [SYN] Seq=0 Win=65535 Len=0 MSS=1460 SACK_PERM=1
968038 322.303171 77.197.128.251 -> 41.177.26.176 TCP 64 29674 > http [ACK] Seq=1 Ack=1 Win=65535 Len=0
969039 322.730357 77.197.128.251 -> 41.177.26.176 TCP 64 29674 > http [ACK] Seq=318 Ack=2431 Win=65535 Len=0
969043 322.730690 77.197.128.251 -> 41.177.26.176 TCP 64 29674 > http [ACK] Seq=318 Ack=3896 Win=65535 Len=0
969245 322.809823 77.197.128.251 -> 41.177.26.176 TCP 64 29674 > http [ACK] Seq=318 Ack=6070 Win=65535 Len=0
969247 322.809933 77.197.128.251 -> 41.177.26.176 TCP 64 29674 > http [ACK] Seq=318 Ack=8607 Win=65535 Len=0
969402 322.889328 77.197.128.251 -> 41.177.26.176 TCP 64 29674 > http [ACK] Seq=318 Ack=11456 Win=65535 Len=0
969403 322.890202 77.197.128.251 -> 41.177.26.176 TCP 64 29674 > http [RST, ACK] Seq=318 Ack=11456 Win=0 Len=0
969409 322.900955 77.197.128.251 -> 41.177.26.176 TCP 66 29795 > http [SYN] Seq=0 Win=65535 Len=0 MSS=1460 SACK_PERM=1
969591 322.980291 77.197.128.251 -> 41.177.26.176 TCP 64 29795 > http [ACK] Seq=1 Ack=1 Win=65535 Len=0
970367 323.486868 77.197.128.251 -> 41.177.26.176 TCP 64 29795 > http [ACK] Seq=355 Ack=2431 Win=65535 Len=0
970368 323.486897 77.197.128.251 -> 41.177.26.176 TCP 64 29795 > http [ACK] Seq=355 Ack=4058 Win=65535 Len=0
970455 323.565890 77.197.128.251 -> 41.177.26.176 TCP 64 29795 > http [ACK] Seq=355 Ack=6232 Win=65535 Len=0
970456 323.566034 77.197.128.251 -> 41.177.26.176 TCP 64 29795 > http [ACK] Seq=355 Ack=9152 Win=65535 Len=0
970564 323.645476 77.197.128.251 -> 41.177.26.176 TCP 64 29795 > http [ACK] Seq=355 Ack=11503 Win=65535 Len=0
970565 323.645610 77.197.128.251 -> 41.177.26.176 TCP 64 29795 > http [RST, ACK] Seq=355 Ack=11503 Win=0 Len=0
970566 323.648074 77.197.128.251 -> 41.177.26.176 TCP 66 29959 > http [SYN] Seq=0 Win=65535 Len=0 MSS=1460 SACK_PERM=1
970674 323.727271 77.197.128.251 -> 41.177.26.176 TCP 64 29959 > http [ACK] Seq=1 Ack=1 Win=65535 Len=0
975634 324.804738 77.197.128.251 -> 41.177.26.176 TCP 64 29959 > http [ACK] Seq=330 Ack=1502 Win=65535 Len=0
975665 324.816750 77.197.128.251 -> 41.177.26.176 TCP 64 29959 > http [ACK] Seq=330 Ack=2258 Win=64779 Len=0
975670 324.817303 77.197.128.251 -> 41.177.26.176 TCP 64 29959 > http [ACK] Seq=330 Ack=3474 Win=65535 Len=0
975750 324.883760 77.197.128.251 -> 41.177.26.176 TCP 64 29959 > http [ACK] Seq=330 Ack=5912 Win=65535 Len=0
975785 324.895947 77.197.128.251 -> 41.177.26.176 TCP 64 29959 > http [ACK] Seq=330 Ack=8832 Win=65535 Len=0
975786 324.896427 77.197.128.251 -> 41.177.26.176 TCP 64 29959 > http [RST, ACK] Seq=330 Ack=9899 Win=0 Len=0
975787 324.897209 77.197.128.251 -> 41.177.26.176 TCP 66 30227 > http [SYN] Seq=0 Win=65535 Len=0 MSS=1460 SACK_PERM=1
975966 324.976283 77.197.128.251 -> 41.177.26.176 TCP 64 30227 > http [ACK] Seq=1 Ack=1 Win=65535 Len=0
976636 325.381926 77.197.128.251 -> 41.177.26.176 TCP 64 30227 > http [ACK] Seq=319 Ack=2431 Win=65535 Len=0
976637 325.382107 77.197.128.251 -> 41.177.26.176 TCP 64 30227 > http [ACK] Seq=319 Ack=3895 Win=65535 Len=0
976793 325.461432 77.197.128.251 -> 41.177.26.176 TCP 64 30227 > http [ACK] Seq=319 Ack=6075 Win=65535 Len=0
976794 325.461438 77.197.128.251 -> 41.177.26.176 TCP 64 30227 > http [ACK] Seq=319 Ack=9657 Win=65535 Len=0
976802 325.461718 77.197.128.251 -> 41.177.26.176 TCP 64 30227 > http [RST, ACK] Seq=319 Ack=11083 Win=0 Len=0
976874 325.488021 77.197.128.251 -> 41.177.26.176 TCP 66 30385 > http [SYN] Seq=0 Win=65535 Len=0 MSS=1460 SACK_PERM=1
977152 325.567280 77.197.128.251 -> 41.177.26.176 TCP 64 30385 > http [ACK] Seq=1 Ack=1 Win=65535 Len=0
978425 325.929198 77.197.128.251 -> 41.177.26.176 TCP 64 30385 > http [ACK] Seq=309 Ack=2431 Win=65535 Len=0
978426 325.929393 77.197.128.251 -> 41.177.26.176 TCP 64 30385 > http [ACK] Seq=309 Ack=3911 Win=65535 Len=0
978564 326.008240 77.197.128.251 -> 41.177.26.176 TCP 64 30385 > http [ACK] Seq=309 Ack=6081 Win=65535 Len=0
978565 326.008370 77.197.128.251 -> 41.177.26.176 TCP 64 30385 > http [ACK] Seq=309 Ack=8435 Win=65535 Len=0
978710 326.087321 77.197.128.251 -> 41.177.26.176 TCP 64 30385 > http [ACK] Seq=309 Ack=11481 Win=65535 Len=0
978711 326.087456 77.197.128.251 -> 41.177.26.176 TCP 64 30385 > http [RST, ACK] Seq=309 Ack=11481 Win=0 Len=0
978717 326.090156 77.197.128.251 -> 41.177.26.176 TCP 66 30550 > http [SYN] Seq=0 Win=65535 Len=0 MSS=1460 SACK_PERM=1
978808 326.169750 77.197.128.251 -> 41.177.26.176 TCP 64 30550 > http [ACK] Seq=1 Ack=1 Win=65535 Len=0
979593 326.637752 77.197.128.251 -> 41.177.26.176 TCP 64 30550 > http [ACK] Seq=355 Ack=2431 Win=65535 Len=0
979594 326.637901 77.197.128.251 -> 41.177.26.176 TCP 64 30550 > http [ACK] Seq=355 Ack=4058 Win=65535 Len=0
979724 326.716799 77.197.128.251 -> 41.177.26.176 TCP 64 30550 > http [ACK] Seq=355 Ack=6232 Win=65535 Len=0
979725 326.717014 77.197.128.251 -> 41.177.26.176 TCP 64 30550 > http [ACK] Seq=355 Ack=8060 Win=65535 Len=0
979726 326.717019 77.197.128.251 -> 41.177.26.176 TCP 64 30550 > http [ACK] Seq=355 Ack=11343 Win=65535 Len=0
979728 326.717288 77.197.128.251 -> 41.177.26.176 TCP 64 30550 > http [RST, ACK] Seq=355 Ack=11343 Win=0 Len=0
979749 326.731572 77.197.128.251 -> 41.177.26.176 TCP 66 30709 > http [SYN] Seq=0 Win=65535 Len=0 MSS=1460 SACK_PERM=1
979903 326.810550 77.197.128.251 -> 41.177.26.176 TCP 64 30709 > http [ACK] Seq=1 Ack=1 Win=65535 Len=0
980497 327.169092 77.197.128.251 -> 41.177.26.176 TCP 64 30709 > http [ACK] Seq=353 Ack=3020 Win=65535 Len=0
980662 327.248311 77.197.128.251 -> 41.177.26.176 TCP 64 30709 > http [ACK] Seq=353 Ack=6223 Win=65535 Len=0
980763 327.327368 77.197.128.251 -> 41.177.26.176 TCP 64 30709 > http [ACK] Seq=353 Ack=8619 Win=65535 Len=0
980764 327.327484 77.197.128.251 -> 41.177.26.176 TCP 64 30709 > http [ACK] Seq=353 Ack=11458 Win=65535 Len=0
980765 327.327789 77.197.128.251 -> 41.177.26.176 TCP 64 30709 > http [RST, ACK] Seq=353 Ack=11458 Win=0 Len=0
980766 327.328684 77.197.128.251 -> 41.177.26.176 TCP 66 30823 > http [SYN] Seq=0 Win=65535 Len=0 MSS=1460 SACK_PERM=1
980876 327.407925 77.197.128.251 -> 41.177.26.176 TCP 64 30823 > http [ACK] Seq=1 Ack=1 Win=65535 Len=0
985716 329.102097 77.197.128.251 -> 41.177.26.176 TCP 64 30823 > http [ACK] Seq=351 Ack=1505 Win=65535 Len=0
985766 329.114793 77.197.128.251 -> 41.177.26.176 TCP 64 30823 > http [ACK] Seq=351 Ack=2231 Win=64809 Len=0
985768 329.115217 77.197.128.251 -> 41.177.26.176 TCP 64 30823 > http [ACK] Seq=351 Ack=3830 Win=65535 Len=0
986010 329.181361 77.197.128.251 -> 41.177.26.176 TCP 64 30823 > http [ACK] Seq=351 Ack=6632 Win=65535 Len=0
986102 329.194292 77.197.128.251 -> 41.177.26.176 TCP 64 30823 > http [ACK] Seq=351 Ack=9552 Win=65535 Len=0
986104 329.194584 77.197.128.251 -> 41.177.26.176 TCP 64 30823 > http [RST, ACK] Seq=351 Ack=10941 Win=0 Len=0
986119 329.200989 77.197.128.251 -> 41.177.26.176 TCP 66 31196 > http [SYN] Seq=0 Win=65535 Len=0 MSS=1460 SACK_PERM=1
986484 329.280080 77.197.128.251 -> 41.177.26.176 TCP 64 31196 > http [ACK] Seq=1 Ack=1 Win=65535 Len=0
988790 329.752416 77.197.128.251 -> 41.177.26.176 TCP 64 31196 > http [ACK] Seq=309 Ack=2431 Win=65535 Len=0
988791 329.752420 77.197.128.251 -> 41.177.26.176 TCP 64 31196 > http [ACK] Seq=309 Ack=3908 Win=65535 Len=0
989174 329.831686 77.197.128.251 -> 41.177.26.176 TCP 64 31196 > http [ACK] Seq=309 Ack=9051 Win=65535 Len=0
989514 329.911019 77.197.128.251 -> 41.177.26.176 TCP 64 31196 > http [ACK] Seq=309 Ack=12138 Win=65497 Len=0
989515 329.911023 77.197.128.251 -> 41.177.26.176 TCP 64 [TCP Dup ACK 989514#1] 31196 > http [ACK] Seq=309 Ack=12138 Win=65497 Len=0
989522 329.911422 77.197.128.251 -> 41.177.26.176 TCP 64 31196 > http [RST, ACK] Seq=309 Ack=12138 Win=0 Len=0
989552 329.914773 77.197.128.251 -> 41.177.26.176 TCP 66 31336 > http [SYN] Seq=0 Win=65535 Len=0 MSS=1460 SACK_PERM=1
989752 329.993741 77.197.128.251 -> 41.177.26.176 TCP 64 31336 > http [ACK] Seq=1 Ack=1 Win=65535 Len=0
990853 330.502349 77.197.128.251 -> 41.177.26.176 TCP 64 31336 > http [ACK] Seq=355 Ack=2431 Win=65535 Len=0
990854 330.502514 77.197.128.251 -> 41.177.26.176 TCP 64 31336 > http [ACK] Seq=355 Ack=4065 Win=65535 Len=0
991188 330.581458 77.197.128.251 -> 41.177.26.176 TCP 64 31336 > http [ACK] Seq=355 Ack=6491 Win=65535 Len=0
991189 330.581463 77.197.128.251 -> 41.177.26.176 TCP 64 31336 > http [ACK] Seq=355 Ack=8703 Win=65535 Len=0
991403 330.660332 77.197.128.251 -> 41.177.26.176 TCP 64 31336 > http [ACK] Seq=355 Ack=11811 Win=65535 Len=0
991405 330.660647 77.197.128.251 -> 41.177.26.176 TCP 64 31336 > http [RST, ACK] Seq=355 Ack=11811 Win=0 Len=0
991415 330.671546 77.197.128.251 -> 41.177.26.176 TCP 66 31440 > http [SYN] Seq=0 Win=65535 Len=0 MSS=1460 SACK_PERM=1
991593 330.750459 77.197.128.251 -> 41.177.26.176 TCP 64 31440 > http [ACK] Seq=1 Ack=1 Win=65535 Len=0
994090 331.735849 77.197.128.251 -> 41.177.26.176 TCP 64 31440 > http [ACK] Seq=332 Ack=1531 Win=65535 Len=0
994121 331.746212 77.197.128.251 -> 41.177.26.176 TCP 64 31440 > http [ACK] Seq=332 Ack=2433 Win=64633 Len=0
994122 331.746341 77.197.128.251 -> 41.177.26.176 TCP 64 31440 > http [ACK] Seq=332 Ack=2761 Win=64305 Len=0
994126 331.746535 77.197.128.251 -> 41.177.26.176 TCP 64 31440 > http [ACK] Seq=332 Ack=3753 Win=65535 Len=0
994291 331.815131 77.197.128.251 -> 41.177.26.176 TCP 64 31440 > http [ACK] Seq=332 Ack=6241 Win=65535 Len=0
994343 331.825339 77.197.128.251 -> 41.177.26.176 TCP 64 31440 > http [ACK] Seq=332 Ack=9161 Win=65535 Len=0
994344 331.825643 77.197.128.251 -> 41.177.26.176 TCP 64 31440 > http [RST, ACK] Seq=332 Ack=10245 Win=0 Len=0
994360 331.831127 77.197.128.251 -> 41.177.26.176 TCP 66 31630 > http [SYN] Seq=0 Win=65535 Len=0 MSS=1460 SACK_PERM=1
994636 331.910171 77.197.128.251 -> 41.177.26.176 TCP 64 31630 > http [ACK] Seq=1 Ack=1 Win=65535 Len=0
995652 332.302338 77.197.128.251 -> 41.177.26.176 TCP 64 31630 > http [ACK] Seq=310 Ack=3907 Win=65535 Len=0
995742 332.381449 77.197.128.251 -> 41.177.26.176 TCP 64 31630 > http [ACK] Seq=310 Ack=6087 Win=65535 Len=0
995743 332.381529 77.197.128.251 -> 41.177.26.176 TCP 64 31630 > http [ACK] Seq=310 Ack=9007 Win=65535 Len=0
995846 332.460633 77.197.128.251 -> 41.177.26.176 TCP 64 31630 > http [ACK] Seq=310 Ack=11163 Win=65535 Len=0
995847 332.460914 77.197.128.251 -> 41.177.26.176 TCP 64 31630 > http [RST, ACK] Seq=310 Ack=11163 Win=0 Len=0
997016 333.079189 77.197.128.251 -> 41.177.26.176 TCP 66 31744 > http [SYN] Seq=0 Win=65535 Len=0 MSS=1460 SACK_PERM=1
997174 333.158179 77.197.128.251 -> 41.177.26.176 TCP 64 31744 > http [ACK] Seq=1 Ack=1 Win=65535 Len=0
997767 333.514833 77.197.128.251 -> 41.177.26.176 TCP 66 31952 > http [SYN] Seq=0 Win=65535 Len=0 MSS=1460 SACK_PERM=1
997774 333.517019 77.197.128.251 -> 41.177.26.176 TCP 64 31744 > http [ACK] Seq=353 Ack=3020 Win=65535 Len=0
998039 333.576866 77.197.128.251 -> 41.177.26.176 TCP 64 31744 > http [ACK] Seq=353 Ack=4059 Win=64496 Len=0
998104 333.593816 77.197.128.251 -> 41.177.26.176 TCP 64 31952 > http [ACK] Seq=1 Ack=1 Win=65535 Len=0
998107 333.596004 77.197.128.251 -> 41.177.26.176 TCP 64 31744 > http [ACK] Seq=353 Ack=6223 Win=65535 Len=0
998240 333.655824 77.197.128.251 -> 41.177.26.176 TCP 64 31744 > http [ACK] Seq=353 Ack=8281 Win=65535 Len=0
998241 333.655829 77.197.128.251 -> 41.177.26.176 TCP 64 31744 > http [ACK] Seq=353 Ack=10701 Win=65535 Len=0
998289 333.675167 77.197.128.251 -> 41.177.26.176 TCP 64 31744 > http [RST, ACK] Seq=353 Ack=11383 Win=0 Len=0
998904 333.982877 77.197.128.251 -> 41.177.26.176 TCP 64 31952 > http [ACK] Seq=353 Ack=2431 Win=65535 Len=0
998905 333.982881 77.197.128.251 -> 41.177.26.176 TCP 64 31952 > http [ACK] Seq=353 Ack=4052 Win=65535 Len=0
999015 334.062172 77.197.128.251 -> 41.177.26.176 TCP 64 31952 > http [ACK] Seq=353 Ack=6216 Win=65535 Len=0
999016 334.062177 77.197.128.251 -> 41.177.26.176 TCP 64 31952 > http [ACK] Seq=353 Ack=8752 Win=65535 Len=0
999157 334.141098 77.197.128.251 -> 41.177.26.176 TCP 64 31952 > http [ACK] Seq=353 Ack=11791 Win=65535 Len=0
999158 334.141357 77.197.128.251 -> 41.177.26.176 TCP 64 31952 > http [RST, ACK] Seq=353 Ack=11791 Win=0 Len=0
1001135 335.177404 77.197.128.251 -> 41.177.26.176 TCP 66 32684 > http [SYN] Seq=0 Win=65535 Len=0 MSS=1460 SACK_PERM=1
1001215 335.256384 77.197.128.251 -> 41.177.26.176 TCP 64 32684 > http [ACK] Seq=1 Ack=1 Win=65535 Len=0
1001710 335.678351 77.197.128.251 -> 41.177.26.176 TCP 64 32684 > http [ACK] Seq=318 Ack=2431 Win=65535 Len=0
1001711 335.678503 77.197.128.251 -> 41.177.26.176 TCP 64 32684 > http [ACK] Seq=318 Ack=3896 Win=65535 Len=0
1001842 335.757846 77.197.128.251 -> 41.177.26.176 TCP 64 32684 > http [ACK] Seq=318 Ack=6070 Win=65535 Len=0
1001843 335.757851 77.197.128.251 -> 41.177.26.176 TCP 64 32684 > http [ACK] Seq=318 Ack=8086 Win=65535 Len=0
1001844 335.757855 77.197.128.251 -> 41.177.26.176 TCP 64 32684 > http [ACK] Seq=318 Ack=10517 Win=65535 Len=0
1002029 335.837193 77.197.128.251 -> 41.177.26.176 TCP 64 32684 > http [RST, ACK] Seq=318 Ack=11199 Win=0 Len=0
1002116 335.872506 77.197.128.251 -> 41.177.26.176 TCP 66 32990 > http [SYN] Seq=0 Win=65535 Len=0 MSS=1460 SACK_PERM=1
1002358 335.951392 77.197.128.251 -> 41.177.26.176 TCP 64 32990 > http [ACK] Seq=1 Ack=1 Win=65535 Len=0
1002949 336.306344 77.197.128.251 -> 41.177.26.176 TCP 64 32990 > http [ACK] Seq=309 Ack=2842 Win=65535 Len=0
1003131 336.385671 77.197.128.251 -> 41.177.26.176 TCP 64 32990 > http [ACK] Seq=309 Ack=6081 Win=65535 Len=0
1003261 336.464714 77.197.128.251 -> 41.177.26.176 TCP 64 32990 > http [ACK] Seq=309 Ack=11409 Win=65535 Len=0
1003262 336.465012 77.197.128.251 -> 41.177.26.176 TCP 64 32990 > http [RST, ACK] Seq=309 Ack=11409 Win=0 Len=0
1005478 336.760134 77.197.128.251 -> 41.177.26.176 TCP 66 33421 > http [SYN] Seq=0 Win=65535 Len=0 MSS=1460 SACK_PERM=1
1006037 336.839014 77.197.128.251 -> 41.177.26.176 TCP 64 33421 > http [ACK] Seq=1 Ack=1 Win=65535 Len=0
1007353 337.378917 77.197.128.251 -> 41.177.26.176 TCP 64 33421 > http [ACK] Seq=355 Ack=2438 Win=65535 Len=0
1007356 337.379112 77.197.128.251 -> 41.177.26.176 TCP 64 33421 > http [ACK] Seq=355 Ack=4072 Win=65535 Len=0
1007686 337.457881 77.197.128.251 -> 41.177.26.176 TCP 64 33421 > http [ACK] Seq=355 Ack=6246 Win=65535 Len=0
1007687 337.457974 77.197.128.251 -> 41.177.26.176 TCP 64 33421 > http [ACK] Seq=355 Ack=8159 Win=65535 Len=0
1007688 337.458107 77.197.128.251 -> 41.177.26.176 TCP 64 33421 > http [ACK] Seq=355 Ack=11209 Win=65535 Len=0
1007689 337.458369 77.197.128.251 -> 41.177.26.176 TCP 64 33421 > http [RST, ACK] Seq=355 Ack=11209 Win=0 Len=0
1007811 337.546626 77.197.128.251 -> 41.177.26.176 TCP 66 33750 > http [SYN] Seq=0 Win=65535 Len=0 MSS=1460 SACK_PERM=1
1007901 337.626138 77.197.128.251 -> 41.177.26.176 TCP 64 33750 > http [ACK] Seq=1 Ack=1 Win=65535 Len=0
1012136 339.889521 77.197.128.251 -> 41.177.26.176 TCP 64 33750 > http [ACK] Seq=356 Ack=4381 Win=65535 Len=0
1012277 339.968625 77.197.128.251 -> 41.177.26.176 TCP 64 33750 > http [ACK] Seq=356 Ack=8761 Win=65535 Len=0
1012381 340.047655 77.197.128.251 -> 41.177.26.176 TCP 64 33750 > http [ACK] Seq=356 Ack=11681 Win=65535 Len=0
1012382 340.047660 77.197.128.251 -> 41.177.26.176 TCP 64 33750 > http [ACK] Seq=356 Ack=14601 Win=65535 Len=0
1012474 340.126973 77.197.128.251 -> 41.177.26.176 TCP 64 33750 > http [ACK] Seq=356 Ack=17521 Win=65535 Len=0
1012478 340.127541 77.197.128.251 -> 41.177.26.176 TCP 64 33750 > http [ACK] Seq=356 Ack=20441 Win=65535 Len=0
1012479 340.127643 77.197.128.251 -> 41.177.26.176 TCP 64 33750 > http [ACK] Seq=356 Ack=23361 Win=65535 Len=0
1012568 340.205999 77.197.128.251 -> 41.177.26.176 TCP 64 33750 > http [ACK] Seq=356 Ack=26281 Win=65535 Len=0
1012569 340.206004 77.197.128.251 -> 41.177.26.176 TCP 64 33750 > http [ACK] Seq=356 Ack=29201 Win=65535 Len=0
1012571 340.206395 77.197.128.251 -> 41.177.26.176 TCP 64 33750 > http [ACK] Seq=356 Ack=31020 Win=65535 Len=0
1012573 340.206597 77.197.128.251 -> 41.177.26.176 TCP 64 33750 > http [ACK] Seq=356 Ack=35405 Win=65535 Len=0
1012574 340.207403 77.197.128.251 -> 41.177.26.176 TCP 64 33750 > http [RST, ACK] Seq=356 Ack=35405 Win=0 Len=0
1013162 340.552523 77.197.128.251 -> 41.177.26.176 TCP 66 35986 > http [SYN] Seq=0 Win=65535 Len=0 MSS=1460 SACK_PERM=1
1013455 340.631739 77.197.128.251 -> 41.177.26.176 TCP 64 35986 > http [ACK] Seq=1 Ack=1 Win=65535 Len=0
1014251 341.006745 77.197.128.251 -> 41.177.26.176 TCP 64 35986 > http [ACK] Seq=308 Ack=2922 Win=65535 Len=0
1014398 341.086012 77.197.128.251 -> 41.177.26.176 TCP 64 35986 > http [ACK] Seq=308 Ack=6076 Win=65535 Len=0
1014460 341.164874 77.197.128.251 -> 41.177.26.176 TCP 64 35986 > http [ACK] Seq=308 Ack=8040 Win=65535 Len=0
1014461 341.164994 77.197.128.251 -> 41.177.26.176 TCP 64 35986 > http [ACK] Seq=308 Ack=10397 Win=65535 Len=0
1014462 341.165390 77.197.128.251 -> 41.177.26.176 TCP 64 35986 > http [RST, ACK] Seq=308 Ack=11079 Win=0 Len=0
1014667 341.346301 77.197.128.251 -> 41.177.26.176 TCP 66 36281 > http [SYN] Seq=0 Win=65535 Len=0 MSS=1460 SACK_PERM=1
1014751 341.425232 77.197.128.251 -> 41.177.26.176 TCP 64 36281 > http [ACK] Seq=1 Ack=1 Win=65535 Len=0
1015838 341.872194 77.197.128.251 -> 41.177.26.176 TCP 64 36281 > http [ACK] Seq=305 Ack=2431 Win=65535 Len=0
1016033 341.951141 77.197.128.251 -> 41.177.26.176 TCP 64 36281 > http [ACK] Seq=305 Ack=6057 Win=65535 Len=0
1016157 342.030700 77.197.128.251 -> 41.177.26.176 TCP 64 36281 > http [ACK] Seq=305 Ack=8162 Win=65535 Len=0
1016158 342.030828 77.197.128.251 -> 41.177.26.176 TCP 64 36281 > http [ACK] Seq=305 Ack=11430 Win=65535 Len=0
1016159 342.031112 77.197.128.251 -> 41.177.26.176 TCP 64 36281 > http [RST, ACK] Seq=305 Ack=11430 Win=0 Len=0
1016430 342.183566 77.197.128.251 -> 41.177.26.176 TCP 66 36616 > http [SYN] Seq=0 Win=65535 Len=0 MSS=1460 SACK_PERM=1
1016551 342.262731 77.197.128.251 -> 41.177.26.176 TCP 64 36616 > http [ACK] Seq=1 Ack=1 Win=65535 Len=0
1017260 342.728139 77.197.128.251 -> 41.177.26.176 TCP 64 36616 > http [ACK] Seq=305 Ack=2431 Win=65535 Len=0
1017261 342.728278 77.197.128.251 -> 41.177.26.176 TCP 64 36616 > http [ACK] Seq=305 Ack=3896 Win=65535 Len=0
1017362 342.807192 77.197.128.251 -> 41.177.26.176 TCP 64 36616 > http [ACK] Seq=305 Ack=6070 Win=65535 Len=0
1017363 342.807197 77.197.128.251 -> 41.177.26.176 TCP 64 36616 > http [ACK] Seq=305 Ack=8286 Win=65535 Len=0
1017484 342.873800 77.197.128.251 -> 41.177.26.176 TCP 64 36616 > http [ACK] Seq=305 Ack=9746 Win=65535 Len=0
1017493 342.886244 77.197.128.251 -> 41.177.26.176 TCP 64 36616 > http [ACK] Seq=305 Ack=11562 Win=65535 Len=0
1017495 342.886381 77.197.128.251 -> 41.177.26.176 TCP 64 36616 > http [RST, ACK] Seq=305 Ack=11562 Win=0 Len=0
1017559 342.931840 77.197.128.251 -> 41.177.26.176 TCP 66 36846 > http [SYN] Seq=0 Win=65535 Len=0 MSS=1460 SACK_PERM=1
1017733 343.010793 77.197.128.251 -> 41.177.26.176 TCP 64 36846 > http [ACK] Seq=1 Ack=1 Win=65535 Len=0
1018589 343.406489 77.197.128.251 -> 41.177.26.176 TCP 64 36846 > http [ACK] Seq=309 Ack=3891 Win=65535 Len=0
1018689 343.485857 77.197.128.251 -> 41.177.26.176 TCP 64 36846 > http [ACK] Seq=309 Ack=6069 Win=65535 Len=0
1018690 343.485862 77.197.128.251 -> 41.177.26.176 TCP 64 36846 > http [ACK] Seq=309 Ack=8363 Win=65535 Len=0
1018840 343.565004 77.197.128.251 -> 41.177.26.176 TCP 64 36846 > http [ACK] Seq=309 Ack=11631 Win=65535 Len=0
1018841 343.565523 77.197.128.251 -> 41.177.26.176 TCP 64 36846 > http [RST, ACK] Seq=309 Ack=11631 Win=0 Len=0
1019523 343.875870 77.197.128.251 -> 41.177.26.176 TCP 66 37099 > http [SYN] Seq=0 Win=65535 Len=0 MSS=1460 SACK_PERM=1
1019692 343.954826 77.197.128.251 -> 41.177.26.176 TCP 64 37099 > http [ACK] Seq=1 Ack=1 Win=65535 Len=0
1020827 344.326234 77.197.128.251 -> 41.177.26.176 TCP 64 37099 > http [ACK] Seq=353 Ack=2431 Win=65535 Len=0
1020828 344.326239 77.197.128.251 -> 41.177.26.176 TCP 64 37099 > http [ACK] Seq=353 Ack=4052 Win=65535 Len=0
1020967 344.406470 77.197.128.251 -> 41.177.26.176 TCP 64 37099 > http [ACK] Seq=353 Ack=10792 Win=65535 Len=0
1021044 344.485732 77.197.128.251 -> 41.177.26.176 TCP 64 37099 > http [RST, ACK] Seq=353 Ack=11474 Win=0 Len=0
1021288 344.672069 77.197.128.251 -> 41.177.26.176 TCP 66 37314 > http [SYN] Seq=0 Win=65535 Len=0 MSS=1460 SACK_PERM=1
1021384 344.750978 77.197.128.251 -> 41.177.26.176 TCP 64 37314 > http [ACK] Seq=1 Ack=1 Win=65535 Len=0
