582292 185.336264 77.197.210.81 -> 41.177.26.91 TCP 66 56978 > http [SYN] Seq=0 Win=65535 Len=0 MSS=1460 SACK_PERM=1
582459 185.418287 77.197.210.81 -> 41.177.26.91 TCP 64 56978 > http [ACK] Seq=1 Ack=1 Win=65535 Len=0
582832 185.602746 77.197.210.81 -> 41.177.26.91 TCP 64 56978 > http [ACK] Seq=304 Ack=2921 Win=65535 Len=0
583083 185.684672 77.197.210.81 -> 41.177.26.91 TCP 64 56978 > http [ACK] Seq=304 Ack=5841 Win=65535 Len=0
583084 185.684789 77.197.210.81 -> 41.177.26.91 TCP 64 56978 > http [ACK] Seq=304 Ack=8761 Win=65535 Len=0
583239 185.767061 77.197.210.81 -> 41.177.26.91 TCP 64 56978 > http [ACK] Seq=304 Ack=14469 Win=65535 Len=0
583311 185.800617 77.197.210.81 -> 41.177.26.91 TCP 64 56978 > http [RST, ACK] Seq=304 Ack=14469 Win=0 Len=0
999556 334.318476 77.197.210.81 -> 41.177.26.15 TCP 66 40187 > http [SYN] Seq=0 Win=65535 Len=0 MSS=1460 SACK_PERM=1
999823 334.397675 77.197.210.81 -> 41.177.26.15 TCP 64 40187 > http [ACK] Seq=1 Ack=1 Win=65535 Len=0
1000720 334.890618 77.197.210.81 -> 41.177.26.15 TCP 64 40187 > http [ACK] Seq=363 Ack=4381 Win=65535 Len=0
1000919 334.969870 77.197.210.81 -> 41.177.26.15 TCP 64 40187 > http [ACK] Seq=363 Ack=8118 Win=65535 Len=0
1000920 334.970645 77.197.210.81 -> 41.177.26.15 TCP 64 40187 > http [RST, ACK] Seq=363 Ack=8118 Win=0 Len=0
