190946  65.690728 77.197.128.194 -> 41.177.26.15 TCP 66 23911 > http [SYN] Seq=0 Win=65535 Len=0 MSS=1460 SACK_PERM=1
191082  65.772560 77.197.128.194 -> 41.177.26.15 TCP 64 23911 > http [ACK] Seq=1 Ack=1 Win=65535 Len=0
192392  66.288561 77.197.128.194 -> 41.177.26.15 TCP 64 23911 > http [ACK] Seq=308 Ack=4381 Win=65535 Len=0
192902  66.370586 77.197.128.194 -> 41.177.26.15 TCP 64 23911 > http [ACK] Seq=308 Ack=9925 Win=65535 Len=0
193147  66.452311 77.197.128.194 -> 41.177.26.15 TCP 64 23911 > http [ACK] Seq=308 Ack=12845 Win=65263 Len=0
193148  66.452315 77.197.128.194 -> 41.177.26.15 TCP 64 [TCP Dup ACK 193147#1] 23911 > http [ACK] Seq=308 Ack=12845 Win=65263 Len=0
193149  66.452319 77.197.128.194 -> 41.177.26.15 TCP 64 23911 > http [ACK] Seq=308 Ack=16665 Win=65535 Len=0
193439  66.533973 77.197.128.194 -> 41.177.26.15 TCP 64 23911 > http [ACK] Seq=308 Ack=19585 Win=65535 Len=0
193442  66.534155 77.197.128.194 -> 41.177.26.15 TCP 64 23911 > http [ACK] Seq=308 Ack=24865 Win=65527 Len=0
193443  66.534159 77.197.128.194 -> 41.177.26.15 TCP 64 [TCP Dup ACK 193442#1] 23911 > http [ACK] Seq=308 Ack=24865 Win=65527 Len=0
193560  66.580785 77.197.128.194 -> 41.177.26.15 TCP 64 23911 > http [ACK] Seq=308 Ack=26325 Win=65535 Len=0
193702  66.616128 77.197.128.194 -> 41.177.26.15 TCP 64 23911 > http [ACK] Seq=308 Ack=30705 Win=65535 Len=0
193703  66.616133 77.197.128.194 -> 41.177.26.15 TCP 64 23911 > http [ACK] Seq=308 Ack=34525 Win=65527 Len=0
193704  66.616147 77.197.128.194 -> 41.177.26.15 TCP 64 [TCP Dup ACK 193703#1] 23911 > http [ACK] Seq=308 Ack=34525 Win=65527 Len=0
193706  66.616322 77.197.128.194 -> 41.177.26.15 TCP 64 23911 > http [ACK] Seq=308 Ack=37445 Win=65535 Len=0
193834  66.662529 77.197.128.194 -> 41.177.26.15 TCP 64 23911 > http [ACK] Seq=308 Ack=40365 Win=65535 Len=0
193957  66.697832 77.197.128.194 -> 41.177.26.15 TCP 64 23911 > http [ACK] Seq=308 Ack=42725 Win=65535 Len=0
193958  66.697941 77.197.128.194 -> 41.177.26.15 TCP 64 23911 > http [ACK] Seq=308 Ack=45645 Win=65527 Len=0
193959  66.697946 77.197.128.194 -> 41.177.26.15 TCP 64 [TCP Dup ACK 193958#1] 23911 > http [ACK] Seq=308 Ack=45645 Win=65527 Len=0
193960  66.697949 77.197.128.194 -> 41.177.26.15 TCP 64 23911 > http [ACK] Seq=308 Ack=49465 Win=65535 Len=0
193967  66.698192 77.197.128.194 -> 41.177.26.15 TCP 64 23911 > http [ACK] Seq=308 Ack=53845 Win=65535 Len=0
194130  66.744199 77.197.128.194 -> 41.177.26.15 TCP 64 23911 > http [ACK] Seq=308 Ack=57665 Win=65527 Len=0
194131  66.744203 77.197.128.194 -> 41.177.26.15 TCP 64 [TCP Dup ACK 194130#1] 23911 > http [ACK] Seq=308 Ack=57665 Win=65527 Len=0
194132  66.744311 77.197.128.194 -> 41.177.26.15 TCP 64 23911 > http [ACK] Seq=308 Ack=60585 Win=65535 Len=0
194259  66.779612 77.197.128.194 -> 41.177.26.15 TCP 64 23911 > http [ACK] Seq=308 Ack=63505 Win=65535 Len=0
194260  66.779726 77.197.128.194 -> 41.177.26.15 TCP 64 23911 > http [ACK] Seq=308 Ack=65865 Win=65527 Len=0
194261  66.779784 77.197.128.194 -> 41.177.26.15 TCP 64 [TCP Dup ACK 194260#1] 23911 > http [ACK] Seq=308 Ack=65865 Win=65527 Len=0
194265  66.779870 77.197.128.194 -> 41.177.26.15 TCP 64 23911 > http [ACK] Seq=308 Ack=68785 Win=65535 Len=0
194272  66.780021 77.197.128.194 -> 41.177.26.15 TCP 64 23911 > http [ACK] Seq=308 Ack=71705 Win=65535 Len=0
194276  66.780099 77.197.128.194 -> 41.177.26.15 TCP 64 23911 > http [ACK] Seq=308 Ack=74065 Win=65527 Len=0
194277  66.780103 77.197.128.194 -> 41.177.26.15 TCP 64 [TCP Dup ACK 194276#1] 23911 > http [ACK] Seq=308 Ack=74065 Win=65527 Len=0
194284  66.780318 77.197.128.194 -> 41.177.26.15 TCP 64 23911 > http [ACK] Seq=308 Ack=76985 Win=65535 Len=0
194285  66.780322 77.197.128.194 -> 41.177.26.15 TCP 64 23911 > http [ACK] Seq=308 Ack=79905 Win=65535 Len=0
194372  66.826169 77.197.128.194 -> 41.177.26.15 TCP 64 23911 > http [ACK] Seq=308 Ack=82265 Win=65535 Len=0
194373  66.826254 77.197.128.194 -> 41.177.26.15 TCP 64 23911 > http [ACK] Seq=308 Ack=85185 Win=65535 Len=0
194377  66.826395 77.197.128.194 -> 41.177.26.15 TCP 64 23911 > http [ACK] Seq=308 Ack=89565 Win=64067 Len=0
194378  66.826399 77.197.128.194 -> 41.177.26.15 TCP 64 [TCP Window Update] 23911 > http [ACK] Seq=308 Ack=89565 Win=65535 Len=0
194444  66.861354 77.197.128.194 -> 41.177.26.15 TCP 64 23911 > http [ACK] Seq=308 Ack=93385 Win=65535 Len=0
194445  66.861358 77.197.128.194 -> 41.177.26.15 TCP 64 23911 > http [ACK] Seq=308 Ack=96305 Win=65535 Len=0
194446  66.861453 77.197.128.194 -> 41.177.26.15 TCP 64 23911 > http [ACK] Seq=308 Ack=98665 Win=63175 Len=0
194447  66.861457 77.197.128.194 -> 41.177.26.15 TCP 64 [TCP Window Update] 23911 > http [ACK] Seq=308 Ack=98665 Win=65535 Len=0
194448  66.861560 77.197.128.194 -> 41.177.26.15 TCP 64 23911 > http [ACK] Seq=308 Ack=101585 Win=65535 Len=0
194454  66.861734 77.197.128.194 -> 41.177.26.15 TCP 64 23911 > http [ACK] Seq=308 Ack=105965 Win=65535 Len=0
194455  66.861738 77.197.128.194 -> 41.177.26.15 TCP 64 23911 > http [ACK] Seq=308 Ack=108325 Win=65527 Len=0
194460  66.861846 77.197.128.194 -> 41.177.26.15 TCP 64 [TCP Dup ACK 194455#1] 23911 > http [ACK] Seq=308 Ack=108325 Win=65527 Len=0
194463  66.861968 77.197.128.194 -> 41.177.26.15 TCP 64 23911 > http [ACK] Seq=308 Ack=111245 Win=65535 Len=0
194464  66.861972 77.197.128.194 -> 41.177.26.15 TCP 64 23911 > http [ACK] Seq=308 Ack=115065 Win=65535 Len=0
194465  66.861976 77.197.128.194 -> 41.177.26.15 TCP 64 23911 > http [ACK] Seq=308 Ack=116525 Win=65535 Len=0
194603  66.908489 77.197.128.194 -> 41.177.26.15 TCP 64 23911 > http [ACK] Seq=308 Ack=119445 Win=65535 Len=0
194604  66.908494 77.197.128.194 -> 41.177.26.15 TCP 64 23911 > http [ACK] Seq=308 Ack=123265 Win=65535 Len=0
194605  66.908697 77.197.128.194 -> 41.177.26.15 TCP 64 23911 > http [ACK] Seq=308 Ack=126185 Win=62615 Len=0
194608  66.908760 77.197.128.194 -> 41.177.26.15 TCP 64 [TCP Window Update] 23911 > http [ACK] Seq=308 Ack=126185 Win=65535 Len=0
194617  66.908949 77.197.128.194 -> 41.177.26.15 TCP 64 23911 > http [ACK] Seq=308 Ack=129105 Win=65535 Len=0
194618  66.909095 77.197.128.194 -> 41.177.26.15 TCP 64 23911 > http [ACK] Seq=308 Ack=132925 Win=65535 Len=0
194696  66.943090 77.197.128.194 -> 41.177.26.15 TCP 64 23911 > http [ACK] Seq=308 Ack=135845 Win=65527 Len=0
194697  66.943094 77.197.128.194 -> 41.177.26.15 TCP 64 [TCP Dup ACK 194696#1] 23911 > http [ACK] Seq=308 Ack=135845 Win=65527 Len=0
194699  66.943221 77.197.128.194 -> 41.177.26.15 TCP 64 23911 > http [ACK] Seq=308 Ack=141125 Win=63727 Len=0
194700  66.943225 77.197.128.194 -> 41.177.26.15 TCP 64 [TCP Window Update] 23911 > http [ACK] Seq=308 Ack=141125 Win=65535 Len=0
194706  66.943368 77.197.128.194 -> 41.177.26.15 TCP 64 23911 > http [ACK] Seq=308 Ack=145505 Win=65535 Len=0
194717  66.943567 77.197.128.194 -> 41.177.26.15 TCP 64 23911 > http [ACK] Seq=308 Ack=147865 Win=65535 Len=0
194718  66.943572 77.197.128.194 -> 41.177.26.15 TCP 64 23911 > http [ACK] Seq=308 Ack=150785 Win=65535 Len=0
194722  66.943814 77.197.128.194 -> 41.177.26.15 TCP 64 23911 > http [ACK] Seq=308 Ack=156065 Win=65535 Len=0
194728  66.943970 77.197.128.194 -> 41.177.26.15 TCP 64 23911 > http [ACK] Seq=308 Ack=160445 Win=65535 Len=0
194732  66.944096 77.197.128.194 -> 41.177.26.15 TCP 64 23911 > http [ACK] Seq=308 Ack=163365 Win=65535 Len=0
194733  66.944301 77.197.128.194 -> 41.177.26.15 TCP 64 23911 > http [ACK] Seq=308 Ack=165725 Win=65535 Len=0
194734  66.944306 77.197.128.194 -> 41.177.26.15 TCP 64 23911 > http [ACK] Seq=308 Ack=172465 Win=65527 Len=0
194735  66.944310 77.197.128.194 -> 41.177.26.15 TCP 64 [TCP Dup ACK 194734#1] 23911 > http [ACK] Seq=308 Ack=172465 Win=65527 Len=0
194878  66.990637 77.197.128.194 -> 41.177.26.15 TCP 64 23911 > http [ACK] Seq=308 Ack=175385 Win=65535 Len=0
194879  66.990641 77.197.128.194 -> 41.177.26.15 TCP 64 23911 > http [ACK] Seq=308 Ack=178305 Win=65535 Len=0
194880  66.990732 77.197.128.194 -> 41.177.26.15 TCP 64 23911 > http [ACK] Seq=308 Ack=180665 Win=65527 Len=0
194881  66.990736 77.197.128.194 -> 41.177.26.15 TCP 64 [TCP Dup ACK 194880#1] 23911 > http [ACK] Seq=308 Ack=180665 Win=65527 Len=0
194882  66.990741 77.197.128.194 -> 41.177.26.15 TCP 64 23911 > http [ACK] Seq=308 Ack=183585 Win=65535 Len=0
194883  66.990866 77.197.128.194 -> 41.177.26.15 TCP 64 23911 > http [ACK] Seq=308 Ack=186505 Win=65535 Len=0
194884  66.990870 77.197.128.194 -> 41.177.26.15 TCP 64 23911 > http [ACK] Seq=308 Ack=188865 Win=65535 Len=0
194885  66.990874 77.197.128.194 -> 41.177.26.15 TCP 64 23911 > http [ACK] Seq=308 Ack=193245 Win=64067 Len=0
194886  66.990891 77.197.128.194 -> 41.177.26.15 TCP 64 [TCP Window Update] 23911 > http [ACK] Seq=308 Ack=193245 Win=65535 Len=0
194887  66.991005 77.197.128.194 -> 41.177.26.15 TCP 64 23911 > http [ACK] Seq=308 Ack=196165 Win=65535 Len=0
195010  67.024918 77.197.128.194 -> 41.177.26.15 TCP 64 23911 > http [ACK] Seq=308 Ack=198525 Win=65535 Len=0
195011  67.024923 77.197.128.194 -> 41.177.26.15 TCP 64 23911 > http [ACK] Seq=308 Ack=201445 Win=65527 Len=0
195012  67.024927 77.197.128.194 -> 41.177.26.15 TCP 64 [TCP Dup ACK 195011#1] 23911 > http [ACK] Seq=308 Ack=201445 Win=65527 Len=0
195013  67.025069 77.197.128.194 -> 41.177.26.15 TCP 64 23911 > http [ACK] Seq=308 Ack=205265 Win=65535 Len=0
195014  67.025074 77.197.128.194 -> 41.177.26.15 TCP 64 23911 > http [ACK] Seq=308 Ack=208185 Win=65535 Len=0
195016  67.025291 77.197.128.194 -> 41.177.26.15 TCP 64 23911 > http [ACK] Seq=308 Ack=211105 Win=65527 Len=0
195017  67.025296 77.197.128.194 -> 41.177.26.15 TCP 64 [TCP Dup ACK 195016#1] 23911 > http [ACK] Seq=308 Ack=211105 Win=65527 Len=0
195018  67.025377 77.197.128.194 -> 41.177.26.15 TCP 64 23911 > http [ACK] Seq=308 Ack=213465 Win=65535 Len=0
195019  67.025574 77.197.128.194 -> 41.177.26.15 TCP 64 23911 > http [ACK] Seq=308 Ack=216385 Win=65535 Len=0
195020  67.025579 77.197.128.194 -> 41.177.26.15 TCP 64 23911 > http [ACK] Seq=308 Ack=219372 Win=65460 Len=0
195021  67.025583 77.197.128.194 -> 41.177.26.15 TCP 64 [TCP Dup ACK 195020#1] 23911 > http [ACK] Seq=308 Ack=219372 Win=65460 Len=0
195052  67.040381 77.197.128.194 -> 41.177.26.15 TCP 64 23911 > http [RST, ACK] Seq=308 Ack=219372 Win=0 Len=0
208535  71.627841 77.197.128.194 -> 41.177.26.15 TCP 66 28354 > http [SYN] Seq=0 Win=65535 Len=0 MSS=1460 SACK_PERM=1
208637  71.709720 77.197.128.194 -> 41.177.26.15 TCP 64 28354 > http [ACK] Seq=1 Ack=1 Win=65535 Len=0
210261  72.466264 77.197.128.194 -> 41.177.26.15 TCP 64 28354 > http [ACK] Seq=309 Ack=4381 Win=65535 Len=0
210598  72.548223 77.197.128.194 -> 41.177.26.15 TCP 64 28354 > http [ACK] Seq=309 Ack=7301 Win=65535 Len=0
210605  72.548542 77.197.128.194 -> 41.177.26.15 TCP 64 28354 > http [ACK] Seq=309 Ack=9925 Win=65535 Len=0
210867  72.629999 77.197.128.194 -> 41.177.26.15 TCP 64 28354 > http [ACK] Seq=309 Ack=14305 Win=63803 Len=0
210868  72.630004 77.197.128.194 -> 41.177.26.15 TCP 64 [TCP Window Update] 28354 > http [ACK] Seq=309 Ack=14305 Win=65535 Len=0
210873  72.630292 77.197.128.194 -> 41.177.26.15 TCP 64 28354 > http [ACK] Seq=309 Ack=16665 Win=65535 Len=0
211094  72.711718 77.197.128.194 -> 41.177.26.15 TCP 64 28354 > http [ACK] Seq=309 Ack=19585 Win=65535 Len=0
211098  72.711983 77.197.128.194 -> 41.177.26.15 TCP 64 28354 > http [ACK] Seq=309 Ack=23965 Win=64067 Len=0
211099  72.711987 77.197.128.194 -> 41.177.26.15 TCP 64 [TCP Window Update] 28354 > http [ACK] Seq=309 Ack=23965 Win=65535 Len=0
211100  72.711990 77.197.128.194 -> 41.177.26.15 TCP 64 28354 > http [ACK] Seq=309 Ack=26325 Win=65535 Len=0
211336  72.793444 77.197.128.194 -> 41.177.26.15 TCP 64 28354 > http [ACK] Seq=309 Ack=29245 Win=65535 Len=0
211337  72.793449 77.197.128.194 -> 41.177.26.15 TCP 64 28354 > http [ACK] Seq=309 Ack=32165 Win=65535 Len=0
211340  72.793683 77.197.128.194 -> 41.177.26.15 TCP 64 28354 > http [ACK] Seq=309 Ack=33065 Win=64635 Len=0
211341  72.793688 77.197.128.194 -> 41.177.26.15 TCP 64 28354 > http [ACK] Seq=309 Ack=37445 Win=65535 Len=0
211347  72.793829 77.197.128.194 -> 41.177.26.15 TCP 64 28354 > http [ACK] Seq=309 Ack=41265 Win=65535 Len=0
211640  72.875130 77.197.128.194 -> 41.177.26.15 TCP 64 28354 > http [ACK] Seq=309 Ack=42725 Win=65535 Len=0
211641  72.875230 77.197.128.194 -> 41.177.26.15 TCP 64 28354 > http [ACK] Seq=309 Ack=45645 Win=65535 Len=0
211644  72.875372 77.197.128.194 -> 41.177.26.15 TCP 64 28354 > http [ACK] Seq=309 Ack=50925 Win=65527 Len=0
211645  72.875376 77.197.128.194 -> 41.177.26.15 TCP 64 [TCP Dup ACK 211644#1] 28354 > http [ACK] Seq=309 Ack=50925 Win=65527 Len=0
211646  72.875380 77.197.128.194 -> 41.177.26.15 TCP 64 28354 > http [ACK] Seq=309 Ack=57665 Win=65535 Len=0
211651  72.875497 77.197.128.194 -> 41.177.26.15 TCP 64 28354 > http [ACK] Seq=309 Ack=59125 Win=65535 Len=0
211652  72.875501 77.197.128.194 -> 41.177.26.15 TCP 64 28354 > http [ACK] Seq=309 Ack=63505 Win=65535 Len=0
212001  72.957038 77.197.128.194 -> 41.177.26.15 TCP 64 28354 > http [ACK] Seq=309 Ack=65865 Win=65535 Len=0
212002  72.957172 77.197.128.194 -> 41.177.26.15 TCP 64 28354 > http [ACK] Seq=309 Ack=71705 Win=59695 Len=0
212003  72.957176 77.197.128.194 -> 41.177.26.15 TCP 64 [TCP Window Update] 28354 > http [ACK] Seq=309 Ack=71705 Win=65535 Len=0
212009  72.957393 77.197.128.194 -> 41.177.26.15 TCP 64 28354 > http [ACK] Seq=309 Ack=74065 Win=65535 Len=0
212019  72.957943 77.197.128.194 -> 41.177.26.15 TCP 64 28354 > http [ACK] Seq=309 Ack=76985 Win=65535 Len=0
212020  72.957947 77.197.128.194 -> 41.177.26.15 TCP 64 28354 > http [ACK] Seq=309 Ack=79905 Win=65535 Len=0
212027  72.958367 77.197.128.194 -> 41.177.26.15 TCP 64 28354 > http [ACK] Seq=309 Ack=82265 Win=65535 Len=0
212028  72.958371 77.197.128.194 -> 41.177.26.15 TCP 64 28354 > http [ACK] Seq=309 Ack=85185 Win=65535 Len=0
212031  72.958569 77.197.128.194 -> 41.177.26.15 TCP 64 28354 > http [ACK] Seq=309 Ack=89565 Win=65535 Len=0
212034  72.958597 77.197.128.194 -> 41.177.26.15 TCP 64 28354 > http [ACK] Seq=309 Ack=94845 Win=65535 Len=0
212307  73.038763 77.197.128.194 -> 41.177.26.15 TCP 64 28354 > http [ACK] Seq=309 Ack=98665 Win=65535 Len=0
212308  73.038895 77.197.128.194 -> 41.177.26.15 TCP 64 28354 > http [ACK] Seq=309 Ack=101585 Win=65535 Len=0
212310  73.038920 77.197.128.194 -> 41.177.26.15 TCP 64 28354 > http [ACK] Seq=309 Ack=104505 Win=62615 Len=0
212316  73.039040 77.197.128.194 -> 41.177.26.15 TCP 64 [TCP Window Update] 28354 > http [ACK] Seq=309 Ack=104505 Win=65535 Len=0
212318  73.039064 77.197.128.194 -> 41.177.26.15 TCP 64 28354 > http [ACK] Seq=309 Ack=106865 Win=65535 Len=0
212325  73.039196 77.197.128.194 -> 41.177.26.15 TCP 64 28354 > http [ACK] Seq=309 Ack=109785 Win=65535 Len=0
212334  73.039725 77.197.128.194 -> 41.177.26.15 TCP 64 28354 > http [ACK] Seq=309 Ack=115065 Win=65527 Len=0
212335  73.039730 77.197.128.194 -> 41.177.26.15 TCP 64 [TCP Dup ACK 212334#1] 28354 > http [ACK] Seq=309 Ack=115065 Win=65527 Len=0
212336  73.039733 77.197.128.194 -> 41.177.26.15 TCP 64 28354 > http [ACK] Seq=309 Ack=117985 Win=65535 Len=0
212347  73.040091 77.197.128.194 -> 41.177.26.15 TCP 64 28354 > http [ACK] Seq=309 Ack=123265 Win=65535 Len=0
212348  73.040218 77.197.128.194 -> 41.177.26.15 TCP 64 28354 > http [ACK] Seq=309 Ack=127645 Win=64067 Len=0
212349  73.040223 77.197.128.194 -> 41.177.26.15 TCP 64 [TCP Window Update] 28354 > http [ACK] Seq=309 Ack=127645 Win=65535 Len=0
212350  73.040227 77.197.128.194 -> 41.177.26.15 TCP 64 28354 > http [ACK] Seq=309 Ack=130565 Win=65535 Len=0
212351  73.040314 77.197.128.194 -> 41.177.26.15 TCP 64 28354 > http [ACK] Seq=309 Ack=132925 Win=65535 Len=0
212357  73.040476 77.197.128.194 -> 41.177.26.15 TCP 64 28354 > http [ACK] Seq=309 Ack=137305 Win=64067 Len=0
212358  73.040481 77.197.128.194 -> 41.177.26.15 TCP 64 [TCP Window Update] 28354 > http [ACK] Seq=309 Ack=137305 Win=65535 Len=0
212856  73.120412 77.197.128.194 -> 41.177.26.15 TCP 64 28354 > http [ACK] Seq=309 Ack=139665 Win=65535 Len=0
212859  73.120494 77.197.128.194 -> 41.177.26.15 TCP 64 28354 > http [ACK] Seq=309 Ack=142585 Win=65535 Len=0
212860  73.120498 77.197.128.194 -> 41.177.26.15 TCP 64 28354 > http [ACK] Seq=309 Ack=145505 Win=65527 Len=0
212861  73.120502 77.197.128.194 -> 41.177.26.15 TCP 64 [TCP Dup ACK 212860#1] 28354 > http [ACK] Seq=309 Ack=145505 Win=65527 Len=0
212862  73.120614 77.197.128.194 -> 41.177.26.15 TCP 64 28354 > http [ACK] Seq=309 Ack=147865 Win=64635 Len=0
212863  73.120618 77.197.128.194 -> 41.177.26.15 TCP 64 28354 > http [ACK] Seq=309 Ack=152245 Win=65535 Len=0
212867  73.120769 77.197.128.194 -> 41.177.26.15 TCP 64 28354 > http [ACK] Seq=309 Ack=156065 Win=65535 Len=0
212882  73.121008 77.197.128.194 -> 41.177.26.15 TCP 64 28354 > http [ACK] Seq=309 Ack=160445 Win=65527 Len=0
212883  73.121012 77.197.128.194 -> 41.177.26.15 TCP 64 [TCP Dup ACK 212882#1] 28354 > http [ACK] Seq=309 Ack=160445 Win=65527 Len=0
212901  73.121341 77.197.128.194 -> 41.177.26.15 TCP 64 28354 > http [ACK] Seq=309 Ack=163365 Win=65535 Len=0
212906  73.121550 77.197.128.194 -> 41.177.26.15 TCP 64 28354 > http [ACK] Seq=309 Ack=168645 Win=65535 Len=0
212907  73.121553 77.197.128.194 -> 41.177.26.15 TCP 64 28354 > http [ACK] Seq=309 Ack=172465 Win=61715 Len=0
212908  73.121557 77.197.128.194 -> 41.177.26.15 TCP 64 [TCP Window Update] 28354 > http [ACK] Seq=309 Ack=172465 Win=65535 Len=0
212921  73.122041 77.197.128.194 -> 41.177.26.15 TCP 64 28354 > http [ACK] Seq=309 Ack=180665 Win=65527 Len=0
212922  73.122046 77.197.128.194 -> 41.177.26.15 TCP 64 [TCP Dup ACK 212921#1] 28354 > http [ACK] Seq=309 Ack=180665 Win=65527 Len=0
212923  73.122157 77.197.128.194 -> 41.177.26.15 TCP 64 28354 > http [ACK] Seq=309 Ack=186505 Win=65535 Len=0
212930  73.122325 77.197.128.194 -> 41.177.26.15 TCP 64 28354 > http [ACK] Seq=309 Ack=188865 Win=65527 Len=0
212931  73.122329 77.197.128.194 -> 41.177.26.15 TCP 64 [TCP Dup ACK 212930#1] 28354 > http [ACK] Seq=309 Ack=188865 Win=65527 Len=0
212934  73.122340 77.197.128.194 -> 41.177.26.15 TCP 64 28354 > http [ACK] Seq=309 Ack=191785 Win=65535 Len=0
212939  73.122487 77.197.128.194 -> 41.177.26.15 TCP 64 28354 > http [ACK] Seq=309 Ack=194705 Win=65535 Len=0
212942  73.122519 77.197.128.194 -> 41.177.26.15 TCP 64 28354 > http [ACK] Seq=309 Ack=197065 Win=65535 Len=0
212943  73.122523 77.197.128.194 -> 41.177.26.15 TCP 64 28354 > http [ACK] Seq=309 Ack=199985 Win=65535 Len=0
213298  73.202318 77.197.128.194 -> 41.177.26.15 TCP 64 28354 > http [ACK] Seq=309 Ack=204365 Win=65535 Len=0
213301  73.202484 77.197.128.194 -> 41.177.26.15 TCP 64 28354 > http [ACK] Seq=309 Ack=206725 Win=65535 Len=0
213302  73.202489 77.197.128.194 -> 41.177.26.15 TCP 64 28354 > http [ACK] Seq=309 Ack=209645 Win=62615 Len=0
213303  73.202493 77.197.128.194 -> 41.177.26.15 TCP 64 [TCP Window Update] 28354 > http [ACK] Seq=309 Ack=209645 Win=65535 Len=0
213311  73.202704 77.197.128.194 -> 41.177.26.15 TCP 64 28354 > http [ACK] Seq=309 Ack=211105 Win=65535 Len=0
213312  73.202708 77.197.128.194 -> 41.177.26.15 TCP 64 28354 > http [ACK] Seq=309 Ack=213465 Win=65535 Len=0
213316  73.202787 77.197.128.194 -> 41.177.26.15 TCP 64 28354 > http [ACK] Seq=309 Ack=216385 Win=65535 Len=0
213319  73.202913 77.197.128.194 -> 41.177.26.15 TCP 64 28354 > http [ACK] Seq=309 Ack=220765 Win=64067 Len=0
213320  73.202917 77.197.128.194 -> 41.177.26.15 TCP 64 [TCP Window Update] 28354 > http [ACK] Seq=309 Ack=220765 Win=65535 Len=0
213321  73.202920 77.197.128.194 -> 41.177.26.15 TCP 64 28354 > http [ACK] Seq=309 Ack=224585 Win=65535 Len=0
213335  73.203189 77.197.128.194 -> 41.177.26.15 TCP 64 28354 > http [ACK] Seq=309 Ack=227505 Win=65535 Len=0
213338  73.203428 77.197.128.194 -> 41.177.26.15 TCP 64 28354 > http [ACK] Seq=309 Ack=229865 Win=63175 Len=0
213339  73.203433 77.197.128.194 -> 41.177.26.15 TCP 64 [TCP Window Update] 28354 > http [ACK] Seq=309 Ack=229865 Win=65535 Len=0
213340  73.203623 77.197.128.194 -> 41.177.26.15 TCP 64 28354 > http [ACK] Seq=309 Ack=232785 Win=65535 Len=0
213342  73.203777 77.197.128.194 -> 41.177.26.15 TCP 64 28354 > http [ACK] Seq=309 Ack=237165 Win=65535 Len=0
213343  73.204073 77.197.128.194 -> 41.177.26.15 TCP 64 28354 > http [ACK] Seq=309 Ack=240985 Win=61715 Len=0
213344  73.204078 77.197.128.194 -> 41.177.26.15 TCP 64 [TCP Window Update] 28354 > http [ACK] Seq=309 Ack=240985 Win=65535 Len=0
213346  73.204349 77.197.128.194 -> 41.177.26.15 TCP 64 28354 > http [ACK] Seq=309 Ack=246265 Win=65535 Len=0
213347  73.204354 77.197.128.194 -> 41.177.26.15 TCP 64 28354 > http [ACK] Seq=309 Ack=249185 Win=65527 Len=0
213348  73.204358 77.197.128.194 -> 41.177.26.15 TCP 64 [TCP Dup ACK 213347#1] 28354 > http [ACK] Seq=309 Ack=249185 Win=65527 Len=0
213349  73.204362 77.197.128.194 -> 41.177.26.15 TCP 64 28354 > http [ACK] Seq=309 Ack=255925 Win=65535 Len=0
213350  73.204366 77.197.128.194 -> 41.177.26.15 TCP 64 28354 > http [ACK] Seq=309 Ack=261765 Win=59695 Len=0
213351  73.204489 77.197.128.194 -> 41.177.26.15 TCP 64 [TCP Window Update] 28354 > http [ACK] Seq=309 Ack=261765 Win=65535 Len=0
213352  73.204494 77.197.128.194 -> 41.177.26.15 TCP 64 28354 > http [ACK] Seq=309 Ack=264125 Win=65535 Len=0
213718  73.284037 77.197.128.194 -> 41.177.26.15 TCP 64 28354 > http [ACK] Seq=309 Ack=267045 Win=65535 Len=0
213719  73.284185 77.197.128.194 -> 41.177.26.15 TCP 64 28354 > http [ACK] Seq=309 Ack=269965 Win=65527 Len=0
213720  73.284189 77.197.128.194 -> 41.177.26.15 TCP 64 [TCP Dup ACK 213719#1] 28354 > http [ACK] Seq=309 Ack=269965 Win=65527 Len=0
213721  73.284193 77.197.128.194 -> 41.177.26.15 TCP 64 28354 > http [ACK] Seq=309 Ack=273785 Win=65535 Len=0
213722  73.284405 77.197.128.194 -> 41.177.26.15 TCP 64 28354 > http [ACK] Seq=309 Ack=279065 Win=64627 Len=0
213723  73.284466 77.197.128.194 -> 41.177.26.15 TCP 64 [TCP Dup ACK 213722#1] 28354 > http [ACK] Seq=309 Ack=279065 Win=64627 Len=0
213725  73.284743 77.197.128.194 -> 41.177.26.15 TCP 64 28354 > http [ACK] Seq=309 Ack=283445 Win=65535 Len=0
213726  73.284871 77.197.128.194 -> 41.177.26.15 TCP 64 28354 > http [ACK] Seq=309 Ack=287265 Win=65527 Len=0
213727  73.284875 77.197.128.194 -> 41.177.26.15 TCP 64 [TCP Dup ACK 213726#1] 28354 > http [ACK] Seq=309 Ack=287265 Win=65527 Len=0
213728  73.285006 77.197.128.194 -> 41.177.26.15 TCP 64 28354 > http [ACK] Seq=309 Ack=289455 Win=65535 Len=0
213768  73.303484 77.197.128.194 -> 41.177.26.15 TCP 64 28354 > http [RST, ACK] Seq=309 Ack=289455 Win=0 Len=0
999941 334.469237 77.197.128.194 -> 244.3.31.124 TCP 66 41021 > https [SYN] Seq=0 Win=65535 Len=0 MSS=1460 SACK_PERM=1
1000078 334.548168 77.197.128.194 -> 244.3.31.124 TCP 64 41021 > https [ACK] Seq=1 Ack=1 Win=65535 Len=0
1001347 335.373707 77.197.128.194 -> 244.3.31.124 TCP 64 41021 > https [ACK] Seq=567 Ack=4116 Win=64115 Len=0
1001348 335.373712 77.197.128.194 -> 244.3.31.124 TCP 64 [TCP Dup ACK 1001347#1] 41021 > https [ACK] Seq=567 Ack=4116 Win=64115 Len=0
1001349 335.373843 77.197.128.194 -> 244.3.31.124 TCP 64 41021 > https [ACK] Seq=567 Ack=4547 Win=65535 Len=0
1001350 335.373848 77.197.128.194 -> 244.3.31.124 TCP 64 41021 > https [RST, ACK] Seq=567 Ack=4547 Win=0 Len=0
