90494  34.848119 77.197.210.239 -> 41.177.26.15 TCP 66 23790 > http [SYN] Seq=0 Win=65535 Len=0 MSS=1460 SACK_PERM=1
90762  34.930654 77.197.210.239 -> 41.177.26.15 TCP 64 23790 > http [ACK] Seq=1 Ack=1 Win=65535 Len=0
92614  35.463049 77.197.210.239 -> 41.177.26.15 TCP 64 23790 > http [ACK] Seq=309 Ack=4381 Win=65535 Len=0
92906  35.545005 77.197.210.239 -> 41.177.26.15 TCP 64 23790 > http [ACK] Seq=309 Ack=7301 Win=65535 Len=0
92907  35.545009 77.197.210.239 -> 41.177.26.15 TCP 64 23790 > http [ACK] Seq=309 Ack=9925 Win=65535 Len=0
93224  35.626937 77.197.210.239 -> 41.177.26.15 TCP 64 23790 > http [ACK] Seq=309 Ack=12845 Win=65263 Len=0
93225  35.626942 77.197.210.239 -> 41.177.26.15 TCP 64 [TCP Dup ACK 93224#1] 23790 > http [ACK] Seq=309 Ack=12845 Win=65263 Len=0
93226  35.626946 77.197.210.239 -> 41.177.26.15 TCP 64 23790 > http [ACK] Seq=309 Ack=16665 Win=65535 Len=0
93526  35.708988 77.197.210.239 -> 41.177.26.15 TCP 64 23790 > http [ACK] Seq=309 Ack=19585 Win=65535 Len=0
93542  35.709237 77.197.210.239 -> 41.177.26.15 TCP 64 23790 > http [ACK] Seq=309 Ack=22505 Win=65535 Len=0
93543  35.709241 77.197.210.239 -> 41.177.26.15 TCP 64 23790 > http [ACK] Seq=309 Ack=24865 Win=65535 Len=0
93544  35.709245 77.197.210.239 -> 41.177.26.15 TCP 64 23790 > http [ACK] Seq=309 Ack=26325 Win=65535 Len=0
94110  35.793659 77.197.210.239 -> 41.177.26.15 TCP 64 23790 > http [ACK] Seq=309 Ack=29245 Win=65535 Len=0
94111  35.793862 77.197.210.239 -> 41.177.26.15 TCP 64 23790 > http [ACK] Seq=309 Ack=32165 Win=65535 Len=0
94117  35.794110 77.197.210.239 -> 41.177.26.15 TCP 64 23790 > http [ACK] Seq=309 Ack=34525 Win=65535 Len=0
94118  35.794114 77.197.210.239 -> 41.177.26.15 TCP 64 23790 > http [ACK] Seq=309 Ack=35985 Win=65535 Len=0
94119  35.794118 77.197.210.239 -> 41.177.26.15 TCP 64 23790 > http [ACK] Seq=309 Ack=38905 Win=65535 Len=0
94120  35.794122 77.197.210.239 -> 41.177.26.15 TCP 64 23790 > http [ACK] Seq=309 Ack=41265 Win=65535 Len=0
94704  35.878806 77.197.210.239 -> 41.177.26.15 TCP 64 23790 > http [ACK] Seq=309 Ack=65865 Win=50587 Len=0
94707  35.878861 77.197.210.239 -> 41.177.26.15 TCP 64 [TCP Window Update] 23790 > http [ACK] Seq=309 Ack=65865 Win=65535 Len=0
94752  35.884776 77.197.210.239 -> 41.177.26.15 TCP 64 23790 > http [ACK] Seq=309 Ack=67325 Win=65535 Len=0
95008  35.960955 77.197.210.239 -> 41.177.26.15 TCP 64 23790 > http [ACK] Seq=309 Ack=70245 Win=65535 Len=0
95009  35.961147 77.197.210.239 -> 41.177.26.15 TCP 64 23790 > http [ACK] Seq=309 Ack=74065 Win=65535 Len=0
95017  35.961431 77.197.210.239 -> 41.177.26.15 TCP 64 23790 > http [ACK] Seq=309 Ack=76985 Win=65535 Len=0
95019  35.961595 77.197.210.239 -> 41.177.26.15 TCP 64 23790 > http [ACK] Seq=309 Ack=79905 Win=65535 Len=0
95020  35.961599 77.197.210.239 -> 41.177.26.15 TCP 64 23790 > http [ACK] Seq=309 Ack=82265 Win=65535 Len=0
95023  35.961651 77.197.210.239 -> 41.177.26.15 TCP 64 23790 > http [ACK] Seq=309 Ack=86645 Win=65535 Len=0
95024  35.961726 77.197.210.239 -> 41.177.26.15 TCP 64 23790 > http [ACK] Seq=309 Ack=90465 Win=65535 Len=0
95026  35.961770 77.197.210.239 -> 41.177.26.15 TCP 64 23790 > http [ACK] Seq=309 Ack=93385 Win=65535 Len=0
95072  35.966736 77.197.210.239 -> 41.177.26.15 TCP 64 23790 > http [ACK] Seq=309 Ack=96305 Win=65535 Len=0
95431  36.042840 77.197.210.239 -> 41.177.26.15 TCP 64 23790 > http [ACK] Seq=309 Ack=98665 Win=65535 Len=0
95432  36.042844 77.197.210.239 -> 41.177.26.15 TCP 64 23790 > http [ACK] Seq=309 Ack=101585 Win=65527 Len=0
95433  36.042848 77.197.210.239 -> 41.177.26.15 TCP 64 [TCP Dup ACK 95432#1] 23790 > http [ACK] Seq=309 Ack=101585 Win=65527 Len=0
95434  36.042852 77.197.210.239 -> 41.177.26.15 TCP 64 23790 > http [ACK] Seq=309 Ack=104505 Win=65535 Len=0
95435  36.042988 77.197.210.239 -> 41.177.26.15 TCP 64 23790 > http [ACK] Seq=309 Ack=106865 Win=65535 Len=0
95444  36.043395 77.197.210.239 -> 41.177.26.15 TCP 64 23790 > http [ACK] Seq=309 Ack=109785 Win=65535 Len=0
95445  36.043399 77.197.210.239 -> 41.177.26.15 TCP 64 23790 > http [ACK] Seq=309 Ack=112705 Win=62615 Len=0
95446  36.043403 77.197.210.239 -> 41.177.26.15 TCP 64 23790 > http [ACK] Seq=309 Ack=115065 Win=60255 Len=0
95456  36.043640 77.197.210.239 -> 41.177.26.15 TCP 64 23790 > http [ACK] Seq=309 Ack=117985 Win=57335 Len=0
95458  36.043780 77.197.210.239 -> 41.177.26.15 TCP 64 23790 > http [ACK] Seq=309 Ack=120905 Win=54415 Len=0
95460  36.043800 77.197.210.239 -> 41.177.26.15 TCP 64 23790 > http [ACK] Seq=309 Ack=123265 Win=52055 Len=0
95463  36.043964 77.197.210.239 -> 41.177.26.15 TCP 64 23790 > http [ACK] Seq=309 Ack=126185 Win=49135 Len=0
95464  36.043970 77.197.210.239 -> 41.177.26.15 TCP 64 23790 > http [ACK] Seq=309 Ack=129105 Win=46215 Len=0
95468  36.044104 77.197.210.239 -> 41.177.26.15 TCP 64 23790 > http [ACK] Seq=309 Ack=131465 Win=43855 Len=0
95485  36.047013 77.197.210.239 -> 41.177.26.15 TCP 64 23790 > http [ACK] Seq=309 Ack=132925 Win=45867 Len=0
95486  36.047017 77.197.210.239 -> 41.177.26.15 TCP 64 [TCP Window Update] 23790 > http [ACK] Seq=309 Ack=132925 Win=65535 Len=0
95514  36.048814 77.197.210.239 -> 41.177.26.15 TCP 64 23790 > http [ACK] Seq=309 Ack=135845 Win=65535 Len=0
95791  36.119190 77.197.210.239 -> 41.177.26.15 TCP 64 23790 > http [ACK] Seq=309 Ack=137305 Win=65535 Len=0
95934  36.125261 77.197.210.239 -> 41.177.26.15 TCP 64 23790 > http [ACK] Seq=309 Ack=139665 Win=65535 Len=0
95935  36.125421 77.197.210.239 -> 41.177.26.15 TCP 64 23790 > http [ACK] Seq=309 Ack=141125 Win=65535 Len=0
95936  36.125426 77.197.210.239 -> 41.177.26.15 TCP 64 23790 > http [ACK] Seq=309 Ack=144045 Win=65535 Len=0
95940  36.125608 77.197.210.239 -> 41.177.26.15 TCP 64 23790 > http [ACK] Seq=309 Ack=147865 Win=65535 Len=0
95941  36.125612 77.197.210.239 -> 41.177.26.15 TCP 64 23790 > http [ACK] Seq=309 Ack=150785 Win=64075 Len=0
95942  36.125617 77.197.210.239 -> 41.177.26.15 TCP 64 23790 > http [ACK] Seq=309 Ack=153705 Win=61155 Len=0
95946  36.125721 77.197.210.239 -> 41.177.26.15 TCP 64 23790 > http [ACK] Seq=309 Ack=156065 Win=58795 Len=0
95960  36.125878 77.197.210.239 -> 41.177.26.15 TCP 64 23790 > http [ACK] Seq=309 Ack=158985 Win=55875 Len=0
95961  36.125882 77.197.210.239 -> 41.177.26.15 TCP 64 23790 > http [ACK] Seq=309 Ack=161905 Win=52955 Len=0
95962  36.125894 77.197.210.239 -> 41.177.26.15 TCP 64 23790 > http [ACK] Seq=309 Ack=164265 Win=50595 Len=0
95963  36.126103 77.197.210.239 -> 41.177.26.15 TCP 64 23790 > http [ACK] Seq=309 Ack=167185 Win=47675 Len=0
95964  36.126220 77.197.210.239 -> 41.177.26.15 TCP 64 23790 > http [ACK] Seq=309 Ack=170105 Win=44755 Len=0
95965  36.126224 77.197.210.239 -> 41.177.26.15 TCP 64 23790 > http [ACK] Seq=309 Ack=172465 Win=42395 Len=0
95987  36.131004 77.197.210.239 -> 41.177.26.15 TCP 64 23790 > http [ACK] Seq=309 Ack=175385 Win=39475 Len=0
95989  36.131316 77.197.210.239 -> 41.177.26.15 TCP 64 23790 > http [ACK] Seq=309 Ack=179765 Win=35095 Len=0
95990  36.131442 77.197.210.239 -> 41.177.26.15 TCP 64 23790 > http [ACK] Seq=309 Ack=182125 Win=32735 Len=0
95991  36.131540 77.197.210.239 -> 41.177.26.15 TCP 64 23790 > http [ACK] Seq=309 Ack=185045 Win=29815 Len=0
95992  36.131545 77.197.210.239 -> 41.177.26.15 TCP 64 23790 > http [ACK] Seq=309 Ack=187965 Win=26895 Len=0
95993  36.131549 77.197.210.239 -> 41.177.26.15 TCP 64 23790 > http [ACK] Seq=309 Ack=190325 Win=24535 Len=0
95994  36.131730 77.197.210.239 -> 41.177.26.15 TCP 64 23790 > http [ACK] Seq=309 Ack=193245 Win=21615 Len=0
95997  36.133301 77.197.210.239 -> 41.177.26.15 TCP 64 23790 > http [ACK] Seq=309 Ack=196165 Win=18695 Len=0
95998  36.133439 77.197.210.239 -> 41.177.26.15 TCP 64 23790 > http [ACK] Seq=309 Ack=198525 Win=16335 Len=0
96005  36.137700 77.197.210.239 -> 41.177.26.15 TCP 64 23790 > http [ACK] Seq=309 Ack=199985 Win=18347 Len=0
96006  36.137705 77.197.210.239 -> 41.177.26.15 TCP 64 [TCP Window Update] 23790 > http [ACK] Seq=309 Ack=199985 Win=65535 Len=0
96382  36.215638 77.197.210.239 -> 41.177.26.15 TCP 64 23790 > http [ACK] Seq=309 Ack=213465 Win=60247 Len=0
96383  36.215643 77.197.210.239 -> 41.177.26.15 TCP 64 [TCP Window Update] 23790 > http [ACK] Seq=309 Ack=213465 Win=65535 Len=0
96402  36.222979 77.197.210.239 -> 41.177.26.15 TCP 64 23790 > http [ACK] Seq=309 Ack=264125 Win=23067 Len=0
96403  36.223204 77.197.210.239 -> 41.177.26.15 TCP 64 [TCP Window Update] 23790 > http [ACK] Seq=309 Ack=264125 Win=65535 Len=0
96591  36.297993 77.197.210.239 -> 41.177.26.15 TCP 64 23790 > http [ACK] Seq=309 Ack=267420 Win=65535 Len=0
96688  36.328418 77.197.210.239 -> 41.177.26.15 TCP 64 23790 > http [RST, ACK] Seq=309 Ack=267420 Win=0 Len=0
161599  55.018701 77.197.210.239 -> 41.177.26.15 TCP 66 29180 > http [SYN] Seq=0 Win=65535 Len=0 MSS=1460 SACK_PERM=1
161902  55.100345 77.197.210.239 -> 41.177.26.15 TCP 64 29180 > http [ACK] Seq=1 Ack=1 Win=65535 Len=0
163770  55.514289 77.197.210.239 -> 41.177.26.15 TCP 64 29180 > http [ACK] Seq=308 Ack=2921 Win=65535 Len=0
164027  55.596174 77.197.210.239 -> 41.177.26.15 TCP 64 29180 > http [ACK] Seq=308 Ack=5841 Win=65535 Len=0
164028  55.596178 77.197.210.239 -> 41.177.26.15 TCP 64 29180 > http [ACK] Seq=308 Ack=8465 Win=65535 Len=0
164440  55.681400 77.197.210.239 -> 41.177.26.15 TCP 64 29180 > http [ACK] Seq=308 Ack=16665 Win=65527 Len=0
164441  55.681404 77.197.210.239 -> 41.177.26.15 TCP 64 [TCP Dup ACK 164440#1] 29180 > http [ACK] Seq=308 Ack=16665 Win=65527 Len=0
164756  55.763217 77.197.210.239 -> 41.177.26.15 TCP 64 29180 > http [ACK] Seq=308 Ack=19585 Win=65535 Len=0
164757  55.763221 77.197.210.239 -> 41.177.26.15 TCP 64 29180 > http [ACK] Seq=308 Ack=22505 Win=65535 Len=0
164758  55.763225 77.197.210.239 -> 41.177.26.15 TCP 64 29180 > http [ACK] Seq=308 Ack=25576 Win=64816 Len=0
164759  55.763318 77.197.210.239 -> 41.177.26.15 TCP 64 [TCP Dup ACK 164758#1] 29180 > http [ACK] Seq=308 Ack=25576 Win=64816 Len=0
164764  55.769025 77.197.210.239 -> 41.177.26.15 TCP 64 29180 > http [RST, ACK] Seq=308 Ack=25576 Win=0 Len=0
174493  57.971534 77.197.210.239 -> 41.177.26.15 TCP 66 30379 > http [SYN] Seq=0 Win=65535 Len=0 MSS=1460 SACK_PERM=1
174715  58.053265 77.197.210.239 -> 41.177.26.15 TCP 64 30379 > http [ACK] Seq=1 Ack=1 Win=65535 Len=0
175357  58.292633 77.197.210.239 -> 41.177.26.15 TCP 64 30379 > http [ACK] Seq=308 Ack=4381 Win=65535 Len=0
175657  58.374320 77.197.210.239 -> 41.177.26.15 TCP 64 30379 > http [ACK] Seq=308 Ack=7301 Win=65535 Len=0
175658  58.374354 77.197.210.239 -> 41.177.26.15 TCP 64 30379 > http [ACK] Seq=308 Ack=9925 Win=65535 Len=0
175787  58.456070 77.197.210.239 -> 41.177.26.15 TCP 64 30379 > http [ACK] Seq=308 Ack=12845 Win=65263 Len=0
175788  58.456074 77.197.210.239 -> 41.177.26.15 TCP 64 [TCP Dup ACK 175787#1] 30379 > http [ACK] Seq=308 Ack=12845 Win=65263 Len=0
175789  58.456078 77.197.210.239 -> 41.177.26.15 TCP 64 30379 > http [ACK] Seq=308 Ack=15765 Win=65535 Len=0
175790  58.456082 77.197.210.239 -> 41.177.26.15 TCP 64 30379 > http [ACK] Seq=308 Ack=18125 Win=65535 Len=0
175953  58.537826 77.197.210.239 -> 41.177.26.15 TCP 64 30379 > http [ACK] Seq=308 Ack=21045 Win=65535 Len=0
175954  58.537831 77.197.210.239 -> 41.177.26.15 TCP 64 30379 > http [ACK] Seq=308 Ack=24865 Win=65535 Len=0
175955  58.537969 77.197.210.239 -> 41.177.26.15 TCP 64 30379 > http [ACK] Seq=308 Ack=26325 Win=65535 Len=0
175956  58.537974 77.197.210.239 -> 41.177.26.15 TCP 64 30379 > http [ACK] Seq=308 Ack=29245 Win=65535 Len=0
176131  58.619547 77.197.210.239 -> 41.177.26.15 TCP 64 30379 > http [ACK] Seq=308 Ack=32165 Win=65535 Len=0
176132  58.619552 77.197.210.239 -> 41.177.26.15 TCP 64 30379 > http [ACK] Seq=308 Ack=34525 Win=65535 Len=0
176133  58.619556 77.197.210.239 -> 41.177.26.15 TCP 64 30379 > http [ACK] Seq=308 Ack=37445 Win=65535 Len=0
176134  58.619646 77.197.210.239 -> 41.177.26.15 TCP 64 30379 > http [ACK] Seq=308 Ack=38905 Win=65535 Len=0
176135  58.619651 77.197.210.239 -> 41.177.26.15 TCP 64 30379 > http [ACK] Seq=308 Ack=41265 Win=65535 Len=0
176136  58.619655 77.197.210.239 -> 41.177.26.15 TCP 64 30379 > http [ACK] Seq=308 Ack=44185 Win=65535 Len=0
176138  58.619736 77.197.210.239 -> 41.177.26.15 TCP 64 30379 > http [ACK] Seq=308 Ack=47105 Win=65535 Len=0
176254  58.701574 77.197.210.239 -> 41.177.26.15 TCP 64 30379 > http [ACK] Seq=308 Ack=49465 Win=65535 Len=0
176255  58.701579 77.197.210.239 -> 41.177.26.15 TCP 64 30379 > http [ACK] Seq=308 Ack=52385 Win=65535 Len=0
176256  58.701583 77.197.210.239 -> 41.177.26.15 TCP 64 30379 > http [ACK] Seq=308 Ack=55305 Win=65527 Len=0
176257  58.701587 77.197.210.239 -> 41.177.26.15 TCP 64 [TCP Dup ACK 176256#1] 30379 > http [ACK] Seq=308 Ack=55305 Win=65527 Len=0
176258  58.701604 77.197.210.239 -> 41.177.26.15 TCP 64 30379 > http [ACK] Seq=308 Ack=57665 Win=65535 Len=0
176259  58.701742 77.197.210.239 -> 41.177.26.15 TCP 64 30379 > http [ACK] Seq=308 Ack=60585 Win=65535 Len=0
176260  58.701746 77.197.210.239 -> 41.177.26.15 TCP 64 30379 > http [ACK] Seq=308 Ack=63505 Win=65535 Len=0
176261  58.701815 77.197.210.239 -> 41.177.26.15 TCP 64 30379 > http [ACK] Seq=308 Ack=65865 Win=63175 Len=0
176264  58.702048 77.197.210.239 -> 41.177.26.15 TCP 64 30379 > http [ACK] Seq=308 Ack=68785 Win=60255 Len=0
176265  58.702053 77.197.210.239 -> 41.177.26.15 TCP 64 30379 > http [ACK] Seq=308 Ack=70259 Win=58781 Len=0
176268  58.709963 77.197.210.239 -> 41.177.26.15 TCP 64 [TCP Window Update] 30379 > http [ACK] Seq=308 Ack=70259 Win=62253 Len=0
176269  58.709968 77.197.210.239 -> 41.177.26.15 TCP 64 [TCP Window Update] 30379 > http [ACK] Seq=308 Ack=70259 Win=65535 Len=0
176277  58.717153 77.197.210.239 -> 41.177.26.15 TCP 64 30379 > http [RST, ACK] Seq=308 Ack=70259 Win=0 Len=0
920385 305.062290 77.197.210.239 -> 41.177.26.15 TCP 66 39088 > http [SYN] Seq=0 Win=65535 Len=0 MSS=1460 SACK_PERM=1
920517 305.144260 77.197.210.239 -> 41.177.26.15 TCP 64 39088 > http [ACK] Seq=1 Ack=1 Win=65535 Len=0
921932 305.948356 77.197.210.239 -> 41.177.26.15 TCP 64 39088 > http [ACK] Seq=308 Ack=2921 Win=65535 Len=0
922129 306.030416 77.197.210.239 -> 41.177.26.15 TCP 64 39088 > http [ACK] Seq=308 Ack=7301 Win=65535 Len=0
922270 306.116991 77.197.210.239 -> 41.177.26.15 TCP 64 39088 > http [ACK] Seq=308 Ack=14305 Win=65535 Len=0
922403 306.198756 77.197.210.239 -> 41.177.26.15 TCP 64 39088 > http [ACK] Seq=308 Ack=16665 Win=65527 Len=0
922404 306.198761 77.197.210.239 -> 41.177.26.15 TCP 64 [TCP Dup ACK 922403#1] 39088 > http [ACK] Seq=308 Ack=16665 Win=65527 Len=0
922405 306.198854 77.197.210.239 -> 41.177.26.15 TCP 64 39088 > http [ACK] Seq=308 Ack=19585 Win=65535 Len=0
922406 306.198858 77.197.210.239 -> 41.177.26.15 TCP 64 39088 > http [ACK] Seq=308 Ack=21824 Win=65535 Len=0
922470 306.242254 77.197.210.239 -> 41.177.26.15 TCP 64 39088 > http [RST, ACK] Seq=308 Ack=21824 Win=0 Len=0
