17799   5.410491 77.197.210.122 -> 41.177.26.15 TCP 66 50034 > http [SYN] Seq=0 Win=65535 Len=0 MSS=1460 SACK_PERM=1
17962   5.492289 77.197.210.122 -> 41.177.26.15 TCP 64 50034 > http [ACK] Seq=1 Ack=1 Win=65535 Len=0
18318   5.795665 77.197.210.122 -> 41.177.26.15 TCP 64 50034 > http [ACK] Seq=308 Ack=2921 Win=65535 Len=0
18512   5.879997 77.197.210.122 -> 41.177.26.15 TCP 64 50034 > http [ACK] Seq=308 Ack=8465 Win=65535 Len=0
18688   5.961989 77.197.210.122 -> 41.177.26.15 TCP 64 50034 > http [ACK] Seq=308 Ack=11385 Win=65535 Len=0
18689   5.961993 77.197.210.122 -> 41.177.26.15 TCP 64 50034 > http [ACK] Seq=308 Ack=14305 Win=65535 Len=0
18790   6.043633 77.197.210.122 -> 41.177.26.15 TCP 64 50034 > http [ACK] Seq=308 Ack=16665 Win=65535 Len=0
18791   6.043787 77.197.210.122 -> 41.177.26.15 TCP 64 50034 > http [ACK] Seq=308 Ack=19585 Win=65535 Len=0
18797   6.043978 77.197.210.122 -> 41.177.26.15 TCP 64 50034 > http [ACK] Seq=308 Ack=22505 Win=65535 Len=0
18798   6.043982 77.197.210.122 -> 41.177.26.15 TCP 64 50034 > http [ACK] Seq=308 Ack=23965 Win=65535 Len=0
18880   6.125592 77.197.210.122 -> 41.177.26.15 TCP 64 50034 > http [ACK] Seq=308 Ack=26325 Win=65535 Len=0
18881   6.125597 77.197.210.122 -> 41.177.26.15 TCP 64 50034 > http [ACK] Seq=308 Ack=29245 Win=65535 Len=0
18882   6.125601 77.197.210.122 -> 41.177.26.15 TCP 64 50034 > http [ACK] Seq=308 Ack=32165 Win=65527 Len=0
18883   6.125605 77.197.210.122 -> 41.177.26.15 TCP 64 [TCP Dup ACK 18882#1] 50034 > http [ACK] Seq=308 Ack=32165 Win=65527 Len=0
18884   6.125765 77.197.210.122 -> 41.177.26.15 TCP 64 50034 > http [ACK] Seq=308 Ack=34525 Win=65535 Len=0
18885   6.125770 77.197.210.122 -> 41.177.26.15 TCP 64 50034 > http [ACK] Seq=308 Ack=37445 Win=65535 Len=0
19020   6.208596 77.197.210.122 -> 41.177.26.15 TCP 64 50034 > http [ACK] Seq=308 Ack=45645 Win=65535 Len=0
19021   6.208601 77.197.210.122 -> 41.177.26.15 TCP 64 50034 > http [ACK] Seq=308 Ack=52385 Win=58795 Len=0
19022   6.208605 77.197.210.122 -> 41.177.26.15 TCP 64 [TCP Window Update] 50034 > http [ACK] Seq=308 Ack=52385 Win=65535 Len=0
19023   6.208610 77.197.210.122 -> 41.177.26.15 TCP 64 50034 > http [ACK] Seq=308 Ack=57665 Win=63175 Len=0
19031   6.208966 77.197.210.122 -> 41.177.26.15 TCP 64 50034 > http [ACK] Seq=308 Ack=60585 Win=60255 Len=0
19039   6.211729 77.197.210.122 -> 41.177.26.15 TCP 64 [TCP Window Update] 50034 > http [ACK] Seq=308 Ack=60585 Win=63727 Len=0
19040   6.211760 77.197.210.122 -> 41.177.26.15 TCP 64 [TCP Window Update] 50034 > http [ACK] Seq=308 Ack=60585 Win=65535 Len=0
19205   6.290398 77.197.210.122 -> 41.177.26.15 TCP 64 50034 > http [ACK] Seq=308 Ack=63505 Win=65535 Len=0
19206   6.290403 77.197.210.122 -> 41.177.26.15 TCP 64 50034 > http [ACK] Seq=308 Ack=65865 Win=65535 Len=0
19207   6.290406 77.197.210.122 -> 41.177.26.15 TCP 64 50034 > http [ACK] Seq=308 Ack=68785 Win=65527 Len=0
19208   6.290410 77.197.210.122 -> 41.177.26.15 TCP 64 [TCP Dup ACK 19207#1] 50034 > http [ACK] Seq=308 Ack=68785 Win=65527 Len=0
19209   6.290607 77.197.210.122 -> 41.177.26.15 TCP 64 50034 > http [ACK] Seq=308 Ack=74065 Win=65535 Len=0
19210   6.291255 77.197.210.122 -> 41.177.26.15 TCP 64 50034 > http [ACK] Seq=308 Ack=77296 Win=65224 Len=0
19293   6.328560 77.197.210.122 -> 41.177.26.15 TCP 64 50034 > http [RST, ACK] Seq=308 Ack=77296 Win=0 Len=0
686909 215.865789 77.197.210.122 -> 41.177.26.91 TCP 66 48252 > http [SYN] Seq=0 Win=65535 Len=0 MSS=1460 SACK_PERM=1
687136 215.945834 77.197.210.122 -> 41.177.26.91 TCP 64 48252 > http [ACK] Seq=1 Ack=1 Win=65535 Len=0
687713 216.109458 77.197.210.122 -> 41.177.26.91 TCP 64 48252 > http [ACK] Seq=311 Ack=2921 Win=65535 Len=0
687870 216.189030 77.197.210.122 -> 41.177.26.91 TCP 64 48252 > http [ACK] Seq=311 Ack=5841 Win=65535 Len=0
687871 216.189074 77.197.210.122 -> 41.177.26.91 TCP 64 48252 > http [ACK] Seq=311 Ack=8761 Win=65535 Len=0
688029 216.270987 77.197.210.122 -> 41.177.26.91 TCP 64 48252 > http [ACK] Seq=311 Ack=11681 Win=65535 Len=0
688030 216.271083 77.197.210.122 -> 41.177.26.91 TCP 64 48252 > http [ACK] Seq=311 Ack=14601 Win=65535 Len=0
696778 220.768295 77.197.210.122 -> 41.177.26.91 TCP 64 48252 > irdmi [RST] Seq=1 Win=0 Len=0
764605 246.818986 77.197.210.122 -> 41.177.26.91 TCP 64 48252 > http [RST, ACK] Seq=311 Ack=14601 Win=0 Len=0
933145 310.839526 77.197.210.122 -> 41.177.26.91 TCP 66 18016 > http [SYN] Seq=0 Win=65535 Len=0 MSS=1460 SACK_PERM=1
933254 310.918405 77.197.210.122 -> 41.177.26.91 TCP 64 18016 > http [ACK] Seq=1 Ack=1 Win=65535 Len=0
933598 311.063634 77.197.210.122 -> 41.177.26.91 TCP 64 18016 > http [ACK] Seq=280 Ack=2921 Win=65535 Len=0
933838 311.143944 77.197.210.122 -> 41.177.26.91 TCP 64 18016 > http [ACK] Seq=280 Ack=8761 Win=65535 Len=0
934064 311.223007 77.197.210.122 -> 41.177.26.91 TCP 64 18016 > http [ACK] Seq=280 Ack=11681 Win=65535 Len=0
934065 311.223012 77.197.210.122 -> 41.177.26.91 TCP 64 18016 > http [ACK] Seq=280 Ack=14601 Win=65535 Len=0
934269 311.264926 77.197.210.122 -> 41.177.26.91 TCP 64 18016 > http [RST, ACK] Seq=280 Ack=15453 Win=0 Len=0
