638450 201.483410 77.197.127.117 -> 41.177.26.176 TCP 66 49777 > http [SYN] Seq=0 Win=65535 Len=0 MSS=1460 SACK_PERM=1
638564 201.544552 77.197.127.117 -> 41.177.26.176 TCP 64 49777 > http [ACK] Seq=1 Ack=1 Win=65535 Len=0
639921 201.992469 77.197.127.117 -> 41.177.26.176 TCP 64 49777 > http [ACK] Seq=301 Ack=2431 Win=65535 Len=0
639922 201.992632 77.197.127.117 -> 41.177.26.176 TCP 64 49777 > http [ACK] Seq=301 Ack=3908 Win=65535 Len=0
640274 202.053454 77.197.127.117 -> 41.177.26.176 TCP 64 49777 > http [ACK] Seq=301 Ack=6082 Win=65535 Len=0
640276 202.053556 77.197.127.117 -> 41.177.26.176 TCP 64 49777 > http [ACK] Seq=301 Ack=9002 Win=65535 Len=0
640418 202.114425 77.197.127.117 -> 41.177.26.176 TCP 64 49777 > http [ACK] Seq=301 Ack=11634 Win=65535 Len=0
640421 202.114641 77.197.127.117 -> 41.177.26.176 TCP 64 49777 > http [RST, ACK] Seq=301 Ack=11634 Win=0 Len=0
641054 202.310962 77.197.127.117 -> 41.177.26.176 TCP 66 50610 > http [SYN] Seq=0 Win=65535 Len=0 MSS=1460 SACK_PERM=1
641438 202.372039 77.197.127.117 -> 41.177.26.176 TCP 64 50610 > http [ACK] Seq=1 Ack=1 Win=65535 Len=0
646382 203.307754 77.197.127.117 -> 41.177.26.176 TCP 64 50610 > http [ACK] Seq=313 Ack=2335 Win=65535 Len=0
646642 203.369004 77.197.127.117 -> 41.177.26.176 TCP 64 50610 > http [ACK] Seq=313 Ack=5180 Win=65535 Len=0
646643 203.369091 77.197.127.117 -> 41.177.26.176 TCP 64 50610 > http [ACK] Seq=313 Ack=7856 Win=65535 Len=0
646917 203.430573 77.197.127.117 -> 41.177.26.176 TCP 64 50610 > http [ACK] Seq=313 Ack=10018 Win=65535 Len=0
646918 203.430712 77.197.127.117 -> 41.177.26.176 TCP 64 50610 > http [ACK] Seq=313 Ack=11619 Win=65535 Len=0
646920 203.430991 77.197.127.117 -> 41.177.26.176 TCP 64 50610 > http [RST, ACK] Seq=313 Ack=11619 Win=0 Len=0
