165049  55.817559 77.197.239.16 -> 41.177.26.176 TCP 66 13779 > http [SYN] Seq=0 Win=65535 Len=0 MSS=1460 SACK_PERM=1
165691  55.899955 77.197.239.16 -> 41.177.26.176 TCP 64 13779 > http [ACK] Seq=1 Ack=1 Win=65535 Len=0
167257  56.121983 77.197.239.16 -> 41.177.26.176 TCP 64 13779 > http [RST, ACK] Seq=448 Ack=252 Win=0 Len=0
167341  56.133093 77.197.239.16 -> 41.177.26.176 TCP 64 13779 > http [RST] Seq=448 Win=0 Len=0
167342  56.133098 77.197.239.16 -> 41.177.26.176 TCP 64 13779 > http [RST] Seq=448 Win=0 Len=0
173595  57.714242 77.197.239.16 -> 41.177.26.176 TCP 66 13797 > http [SYN] Seq=0 Win=65535 Len=0 MSS=1460 SACK_PERM=1
173825  57.800355 77.197.239.16 -> 41.177.26.176 TCP 64 13797 > http [ACK] Seq=1 Ack=1 Win=65535 Len=0
175722  58.412908 77.197.239.16 -> 41.177.26.176 TCP 64 13797 > http [ACK] Seq=463 Ack=2972 Win=65535 Len=0
175850  58.494904 77.197.239.16 -> 41.177.26.176 TCP 64 13797 > http [ACK] Seq=463 Ack=5024 Win=65535 Len=0
175853  58.495716 77.197.239.16 -> 41.177.26.176 TCP 64 13797 > http [ACK] Seq=463 Ack=7944 Win=65535 Len=0
176027  58.576553 77.197.239.16 -> 41.177.26.176 TCP 64 13797 > http [ACK] Seq=463 Ack=9894 Win=65535 Len=0
176028  58.577360 77.197.239.16 -> 41.177.26.176 TCP 64 13797 > http [ACK] Seq=463 Ack=12208 Win=65535 Len=0
176029  58.578074 77.197.239.16 -> 41.177.26.176 TCP 64 13797 > http [RST, ACK] Seq=463 Ack=12208 Win=0 Len=0
