283055  94.983942 77.197.128.164 -> 41.177.26.176 TCP 66 47685 > http [SYN] Seq=0 Win=65535 Len=0 MSS=1460 SACK_PERM=1
283507  95.065897 77.197.128.164 -> 41.177.26.176 TCP 64 47685 > http [ACK] Seq=1 Ack=1 Win=65535 Len=0
285719  95.535693 77.197.128.164 -> 41.177.26.176 TCP 64 47685 > http [ACK] Seq=356 Ack=4057 Win=65535 Len=0
285954  95.617497 77.197.128.164 -> 41.177.26.176 TCP 64 47685 > http [ACK] Seq=356 Ack=6237 Win=65535 Len=0
285955  95.617501 77.197.128.164 -> 41.177.26.176 TCP 64 47685 > http [ACK] Seq=356 Ack=8502 Win=65535 Len=0
286164  95.668552 77.197.128.164 -> 41.177.26.15 TCP 66 48219 > http [SYN] Seq=0 Win=65535 Len=0 MSS=1460 SACK_PERM=1
286247  95.699274 77.197.128.164 -> 41.177.26.176 TCP 64 47685 > http [ACK] Seq=356 Ack=11357 Win=65535 Len=0
286248  95.699547 77.197.128.164 -> 41.177.26.176 TCP 64 47685 > http [RST, ACK] Seq=356 Ack=11357 Win=0 Len=0
286395  95.750287 77.197.128.164 -> 41.177.26.15 TCP 64 48219 > http [ACK] Seq=1 Ack=1 Win=65535 Len=0
287387  96.000637 77.197.128.164 -> 41.177.26.15 TCP 64 48219 > http [ACK] Seq=307 Ack=2921 Win=65535 Len=0
287679  96.082298 77.197.128.164 -> 41.177.26.15 TCP 64 48219 > http [ACK] Seq=307 Ack=5841 Win=65535 Len=0
287681  96.082540 77.197.128.164 -> 41.177.26.15 TCP 64 48219 > http [ACK] Seq=307 Ack=8465 Win=65535 Len=0
287954  96.164074 77.197.128.164 -> 41.177.26.15 TCP 64 48219 > http [ACK] Seq=307 Ack=11385 Win=65535 Len=0
287955  96.164351 77.197.128.164 -> 41.177.26.15 TCP 64 48219 > http [ACK] Seq=307 Ack=16665 Win=65527 Len=0
287956  96.164355 77.197.128.164 -> 41.177.26.15 TCP 64 [TCP Dup ACK 287955#1] 48219 > http [ACK] Seq=307 Ack=16665 Win=65527 Len=0
288123  96.245967 77.197.128.164 -> 41.177.26.15 TCP 64 48219 > http [ACK] Seq=307 Ack=19585 Win=65535 Len=0
288124  96.246138 77.197.128.164 -> 41.177.26.15 TCP 64 48219 > http [ACK] Seq=307 Ack=22505 Win=65535 Len=0
288125  96.246143 77.197.128.164 -> 41.177.26.15 TCP 64 48219 > http [ACK] Seq=307 Ack=24865 Win=65527 Len=0
288126  96.246148 77.197.128.164 -> 41.177.26.15 TCP 64 [TCP Dup ACK 288125#1] 48219 > http [ACK] Seq=307 Ack=24865 Win=65527 Len=0
288127  96.246152 77.197.128.164 -> 41.177.26.15 TCP 64 48219 > http [ACK] Seq=307 Ack=26337 Win=65535 Len=0
288133  96.247807 77.197.128.164 -> 41.177.26.15 TCP 64 48219 > http [RST, ACK] Seq=307 Ack=26337 Win=0 Len=0
301710 101.749960 77.197.128.164 -> 41.177.26.176 TCP 66 51115 > http [SYN] Seq=0 Win=65535 Len=0 MSS=1460 SACK_PERM=1
301925 101.831689 77.197.128.164 -> 41.177.26.176 TCP 64 51115 > http [ACK] Seq=1 Ack=1 Win=65535 Len=0
302903 102.387641 77.197.128.164 -> 41.177.26.15 TCP 66 51463 > http [SYN] Seq=0 Win=65535 Len=0 MSS=1460 SACK_PERM=1
303022 102.469385 77.197.128.164 -> 41.177.26.15 TCP 64 51463 > http [ACK] Seq=1 Ack=1 Win=65535 Len=0
303837 102.803417 77.197.128.164 -> 41.177.26.15 TCP 64 51463 > http [ACK] Seq=307 Ack=2921 Win=65535 Len=0
304066 102.885344 77.197.128.164 -> 41.177.26.15 TCP 64 51463 > http [ACK] Seq=307 Ack=5841 Win=65535 Len=0
304067 102.885349 77.197.128.164 -> 41.177.26.15 TCP 64 51463 > http [ACK] Seq=307 Ack=8465 Win=65535 Len=0
304234 102.967259 77.197.128.164 -> 41.177.26.15 TCP 64 51463 > http [ACK] Seq=307 Ack=14305 Win=65535 Len=0
304235 102.967432 77.197.128.164 -> 41.177.26.15 TCP 64 51463 > http [ACK] Seq=307 Ack=16665 Win=65527 Len=0
304236 102.967437 77.197.128.164 -> 41.177.26.15 TCP 64 [TCP Dup ACK 304235#1] 51463 > http [ACK] Seq=307 Ack=16665 Win=65527 Len=0
304543 103.049149 77.197.128.164 -> 41.177.26.15 TCP 64 51463 > http [ACK] Seq=307 Ack=19585 Win=65535 Len=0
304544 103.049154 77.197.128.164 -> 41.177.26.15 TCP 64 51463 > http [ACK] Seq=307 Ack=22505 Win=65535 Len=0
304545 103.049157 77.197.128.164 -> 41.177.26.15 TCP 64 51463 > http [ACK] Seq=307 Ack=24865 Win=65527 Len=0
304546 103.049162 77.197.128.164 -> 41.177.26.15 TCP 64 [TCP Dup ACK 304545#1] 51463 > http [ACK] Seq=307 Ack=24865 Win=65527 Len=0
304547 103.049276 77.197.128.164 -> 41.177.26.15 TCP 64 51463 > http [ACK] Seq=307 Ack=27785 Win=65535 Len=0
304676 103.130882 77.197.128.164 -> 41.177.26.15 TCP 64 51463 > http [ACK] Seq=307 Ack=30705 Win=65535 Len=0
304677 103.130998 77.197.128.164 -> 41.177.26.15 TCP 64 51463 > http [ACK] Seq=307 Ack=35985 Win=62607 Len=0
304678 103.131003 77.197.128.164 -> 41.177.26.15 TCP 64 [TCP Window Update] 51463 > http [ACK] Seq=307 Ack=35985 Win=65535 Len=0
304679 103.131007 77.197.128.164 -> 41.177.26.15 TCP 64 51463 > http [ACK] Seq=307 Ack=38905 Win=65535 Len=0
304684 103.131153 77.197.128.164 -> 41.177.26.15 TCP 64 51463 > http [ACK] Seq=307 Ack=41265 Win=65535 Len=0
304685 103.131164 77.197.128.164 -> 41.177.26.15 TCP 64 51463 > http [ACK] Seq=307 Ack=44185 Win=65535 Len=0
304928 103.212810 77.197.128.164 -> 41.177.26.15 TCP 64 51463 > http [ACK] Seq=307 Ack=49465 Win=63167 Len=0
304929 103.212815 77.197.128.164 -> 41.177.26.15 TCP 64 [TCP Window Update] 51463 > http [ACK] Seq=307 Ack=49465 Win=65535 Len=0
304930 103.212819 77.197.128.164 -> 41.177.26.15 TCP 64 51463 > http [ACK] Seq=307 Ack=52385 Win=65535 Len=0
304931 103.212839 77.197.128.164 -> 41.177.26.15 TCP 64 51463 > http [ACK] Seq=307 Ack=57665 Win=65535 Len=0
304932 103.212843 77.197.128.164 -> 41.177.26.15 TCP 64 51463 > http [ACK] Seq=307 Ack=60585 Win=65535 Len=0
304933 103.212883 77.197.128.164 -> 41.177.26.15 TCP 64 51463 > http [ACK] Seq=307 Ack=63505 Win=65535 Len=0
304934 103.212888 77.197.128.164 -> 41.177.26.15 TCP 64 51463 > http [ACK] Seq=307 Ack=67325 Win=64067 Len=0
304935 103.212892 77.197.128.164 -> 41.177.26.15 TCP 64 [TCP Window Update] 51463 > http [ACK] Seq=307 Ack=67325 Win=65535 Len=0
305137 103.294638 77.197.128.164 -> 41.177.26.15 TCP 64 51463 > http [ACK] Seq=307 Ack=70245 Win=65535 Len=0
305138 103.294643 77.197.128.164 -> 41.177.26.15 TCP 64 51463 > http [ACK] Seq=307 Ack=75525 Win=65535 Len=0
305139 103.294647 77.197.128.164 -> 41.177.26.15 TCP 64 51463 > http [ACK] Seq=307 Ack=78445 Win=62615 Len=0
305140 103.294651 77.197.128.164 -> 41.177.26.15 TCP 64 [TCP Window Update] 51463 > http [ACK] Seq=307 Ack=78445 Win=65535 Len=0
305144 103.294918 77.197.128.164 -> 41.177.26.15 TCP 64 51463 > http [ACK] Seq=307 Ack=82265 Win=65535 Len=0
305147 103.294942 77.197.128.164 -> 41.177.26.15 TCP 64 51463 > http [ACK] Seq=307 Ack=85185 Win=65535 Len=0
305148 103.294946 77.197.128.164 -> 41.177.26.15 TCP 64 51463 > http [ACK] Seq=307 Ack=86645 Win=65535 Len=0
305149 103.294950 77.197.128.164 -> 41.177.26.15 TCP 64 51463 > http [ACK] Seq=307 Ack=91925 Win=65535 Len=0
305150 103.294955 77.197.128.164 -> 41.177.26.15 TCP 64 51463 > http [ACK] Seq=307 Ack=96305 Win=64067 Len=0
305151 103.294959 77.197.128.164 -> 41.177.26.15 TCP 64 [TCP Window Update] 51463 > http [ACK] Seq=307 Ack=96305 Win=65535 Len=0
305152 103.294963 77.197.128.164 -> 41.177.26.15 TCP 64 51463 > http [ACK] Seq=307 Ack=98665 Win=65535 Len=0
305322 103.376356 77.197.128.164 -> 41.177.26.15 TCP 64 51463 > http [ACK] Seq=307 Ack=101585 Win=65535 Len=0
305323 103.376404 77.197.128.164 -> 41.177.26.15 TCP 64 51463 > http [ACK] Seq=307 Ack=106865 Win=63167 Len=0
305325 103.376413 77.197.128.164 -> 41.177.26.15 TCP 64 [TCP Window Update] 51463 > http [ACK] Seq=307 Ack=106865 Win=65535 Len=0
305326 103.376430 77.197.128.164 -> 41.177.26.15 TCP 64 51463 > http [ACK] Seq=307 Ack=109785 Win=65535 Len=0
305330 103.376652 77.197.128.164 -> 41.177.26.15 TCP 64 51463 > http [ACK] Seq=307 Ack=112705 Win=65535 Len=0
305331 103.376656 77.197.128.164 -> 41.177.26.15 TCP 64 51463 > http [ACK] Seq=307 Ack=115065 Win=65535 Len=0
305332 103.376660 77.197.128.164 -> 41.177.26.15 TCP 64 51463 > http [ACK] Seq=307 Ack=119445 Win=65535 Len=0
305333 103.376664 77.197.128.164 -> 41.177.26.15 TCP 64 51463 > http [ACK] Seq=307 Ack=123265 Win=61715 Len=0
305334 103.376668 77.197.128.164 -> 41.177.26.15 TCP 64 [TCP Window Update] 51463 > http [ACK] Seq=307 Ack=123265 Win=65535 Len=0
305342 103.376789 77.197.128.164 -> 41.177.26.15 TCP 64 51463 > http [ACK] Seq=307 Ack=127645 Win=65535 Len=0
305352 103.376961 77.197.128.164 -> 41.177.26.15 TCP 64 51463 > http [ACK] Seq=307 Ack=132925 Win=64067 Len=0
305353 103.376965 77.197.128.164 -> 41.177.26.15 TCP 64 [TCP Window Update] 51463 > http [ACK] Seq=307 Ack=132925 Win=65535 Len=0
305354 103.376970 77.197.128.164 -> 41.177.26.15 TCP 64 51463 > http [ACK] Seq=307 Ack=135845 Win=65535 Len=0
305355 103.376984 77.197.128.164 -> 41.177.26.15 TCP 64 51463 > http [ACK] Seq=307 Ack=138765 Win=65535 Len=0
305357 103.377114 77.197.128.164 -> 41.177.26.15 TCP 64 51463 > http [ACK] Seq=307 Ack=141125 Win=65535 Len=0
305358 103.377291 77.197.128.164 -> 41.177.26.15 TCP 64 51463 > http [ACK] Seq=307 Ack=144045 Win=65535 Len=0
305482 103.458162 77.197.128.164 -> 41.177.26.15 TCP 64 51463 > http [ACK] Seq=307 Ack=147865 Win=65535 Len=0
305483 103.458282 77.197.128.164 -> 41.177.26.15 TCP 64 51463 > http [ACK] Seq=307 Ack=156065 Win=61707 Len=0
305484 103.458410 77.197.128.164 -> 41.177.26.15 TCP 64 [TCP Window Update] 51463 > http [ACK] Seq=307 Ack=156065 Win=65535 Len=0
305485 103.458415 77.197.128.164 -> 41.177.26.15 TCP 64 51463 > http [ACK] Seq=307 Ack=161905 Win=64075 Len=0
305486 103.458419 77.197.128.164 -> 41.177.26.15 TCP 64 [TCP Window Update] 51463 > http [ACK] Seq=307 Ack=161905 Win=65535 Len=0
305487 103.458423 77.197.128.164 -> 41.177.26.15 TCP 64 51463 > http [ACK] Seq=307 Ack=163621 Win=65535 Len=0
305503 103.469233 77.197.128.164 -> 41.177.26.15 TCP 64 51463 > http [RST, ACK] Seq=307 Ack=163621 Win=0 Len=0
313727 107.023047 77.197.128.164 -> 41.177.26.15 TCP 66 53426 > http [SYN] Seq=0 Win=65535 Len=0 MSS=1460 SACK_PERM=1
313913 107.104797 77.197.128.164 -> 41.177.26.15 TCP 64 53426 > http [ACK] Seq=1 Ack=1 Win=65535 Len=0
314389 107.289716 77.197.128.164 -> 41.177.26.176 TCP 64 51115 > http [ACK] Seq=318 Ack=2431 Win=65535 Len=0
314390 107.289758 77.197.128.164 -> 41.177.26.176 TCP 64 51115 > http [ACK] Seq=318 Ack=3896 Win=65535 Len=0
314610 107.371512 77.197.128.164 -> 41.177.26.176 TCP 64 51115 > http [ACK] Seq=318 Ack=6070 Win=65535 Len=0
314612 107.371593 77.197.128.164 -> 41.177.26.176 TCP 64 51115 > http [ACK] Seq=318 Ack=8315 Win=65535 Len=0
314613 107.371598 77.197.128.164 -> 41.177.26.176 TCP 64 51115 > http [ACK] Seq=318 Ack=10683 Win=65535 Len=0
314614 107.371898 77.197.128.164 -> 41.177.26.176 TCP 64 51115 > http [RST, ACK] Seq=318 Ack=11365 Win=0 Len=0
315248 107.650969 77.197.128.164 -> 41.177.26.15 TCP 64 53426 > http [ACK] Seq=309 Ack=2921 Win=65535 Len=0
315498 107.732713 77.197.128.164 -> 41.177.26.15 TCP 64 53426 > http [ACK] Seq=309 Ack=5841 Win=65535 Len=0
315499 107.732933 77.197.128.164 -> 41.177.26.15 TCP 64 53426 > http [ACK] Seq=309 Ack=8465 Win=65535 Len=0
315721 107.814527 77.197.128.164 -> 41.177.26.15 TCP 64 53426 > http [ACK] Seq=309 Ack=12845 Win=65535 Len=0
315722 107.814645 77.197.128.164 -> 41.177.26.15 TCP 64 53426 > http [ACK] Seq=309 Ack=16665 Win=65527 Len=0
315723 107.814650 77.197.128.164 -> 41.177.26.15 TCP 64 [TCP Dup ACK 315722#1] 53426 > http [ACK] Seq=309 Ack=16665 Win=65527 Len=0
316023 107.896380 77.197.128.164 -> 41.177.26.15 TCP 64 53426 > http [ACK] Seq=309 Ack=22505 Win=65535 Len=0
316024 107.896385 77.197.128.164 -> 41.177.26.15 TCP 64 53426 > http [ACK] Seq=309 Ack=24865 Win=65527 Len=0
316025 107.896389 77.197.128.164 -> 41.177.26.15 TCP 64 [TCP Dup ACK 316024#1] 53426 > http [ACK] Seq=309 Ack=24865 Win=65527 Len=0
316026 107.896545 77.197.128.164 -> 41.177.26.15 TCP 64 53426 > http [ACK] Seq=309 Ack=27785 Win=65535 Len=0
316379 107.978178 77.197.128.164 -> 41.177.26.15 TCP 64 53426 > http [ACK] Seq=309 Ack=33065 Win=65527 Len=0
316380 107.978183 77.197.128.164 -> 41.177.26.15 TCP 64 [TCP Dup ACK 316379#1] 53426 > http [ACK] Seq=309 Ack=33065 Win=65527 Len=0
316381 107.978395 77.197.128.164 -> 41.177.26.15 TCP 64 53426 > http [ACK] Seq=309 Ack=35985 Win=65535 Len=0
316382 107.978400 77.197.128.164 -> 41.177.26.15 TCP 64 53426 > http [ACK] Seq=309 Ack=40365 Win=65535 Len=0
316383 107.978404 77.197.128.164 -> 41.177.26.15 TCP 64 53426 > http [ACK] Seq=309 Ack=42725 Win=65535 Len=0
316730 108.059923 77.197.128.164 -> 41.177.26.15 TCP 64 53426 > http [ACK] Seq=309 Ack=44185 Win=65535 Len=0
316731 108.060153 77.197.128.164 -> 41.177.26.15 TCP 64 53426 > http [ACK] Seq=309 Ack=47105 Win=65535 Len=0
316732 108.060158 77.197.128.164 -> 41.177.26.15 TCP 64 53426 > http [ACK] Seq=309 Ack=50925 Win=65535 Len=0
316736 108.060262 77.197.128.164 -> 41.177.26.15 TCP 64 53426 > http [ACK] Seq=309 Ack=53845 Win=62615 Len=0
316737 108.060266 77.197.128.164 -> 41.177.26.15 TCP 64 [TCP Window Update] 53426 > http [ACK] Seq=309 Ack=53845 Win=65535 Len=0
316738 108.060271 77.197.128.164 -> 41.177.26.15 TCP 64 53426 > http [ACK] Seq=309 Ack=59125 Win=65535 Len=0
316742 108.060383 77.197.128.164 -> 41.177.26.15 TCP 64 53426 > http [ACK] Seq=309 Ack=63505 Win=64067 Len=0
316743 108.060387 77.197.128.164 -> 41.177.26.15 TCP 64 [TCP Window Update] 53426 > http [ACK] Seq=309 Ack=63505 Win=65535 Len=0
316961 108.141830 77.197.128.164 -> 41.177.26.15 TCP 64 53426 > http [ACK] Seq=309 Ack=67325 Win=65535 Len=0
316962 108.141881 77.197.128.164 -> 41.177.26.15 TCP 64 53426 > http [ACK] Seq=309 Ack=71705 Win=65527 Len=0
316963 108.141886 77.197.128.164 -> 41.177.26.15 TCP 64 [TCP Dup ACK 316962#1] 53426 > http [ACK] Seq=309 Ack=71705 Win=65527 Len=0
316970 108.142333 77.197.128.164 -> 41.177.26.15 TCP 64 53426 > http [ACK] Seq=309 Ack=74065 Win=65535 Len=0
316971 108.142337 77.197.128.164 -> 41.177.26.15 TCP 64 53426 > http [ACK] Seq=309 Ack=76985 Win=65535 Len=0
316980 108.142611 77.197.128.164 -> 41.177.26.15 TCP 64 53426 > http [ACK] Seq=309 Ack=81365 Win=65535 Len=0
316981 108.142615 77.197.128.164 -> 41.177.26.15 TCP 64 53426 > http [ACK] Seq=309 Ack=83725 Win=65535 Len=0
316982 108.142619 77.197.128.164 -> 41.177.26.15 TCP 64 53426 > http [ACK] Seq=309 Ack=86645 Win=65535 Len=0
316991 108.142930 77.197.128.164 -> 41.177.26.15 TCP 64 53426 > http [ACK] Seq=309 Ack=90465 Win=65535 Len=0
316992 108.142934 77.197.128.164 -> 41.177.26.15 TCP 64 53426 > http [ACK] Seq=309 Ack=93385 Win=65535 Len=0
317096 108.223704 77.197.128.164 -> 41.177.26.15 TCP 64 53426 > http [ACK] Seq=309 Ack=97765 Win=65535 Len=0
317097 108.223869 77.197.128.164 -> 41.177.26.15 TCP 64 53426 > http [ACK] Seq=309 Ack=100125 Win=65535 Len=0
317098 108.223874 77.197.128.164 -> 41.177.26.15 TCP 64 53426 > http [ACK] Seq=309 Ack=104505 Win=61155 Len=0
317099 108.223877 77.197.128.164 -> 41.177.26.15 TCP 64 [TCP Window Update] 53426 > http [ACK] Seq=309 Ack=104505 Win=65535 Len=0
317105 108.224027 77.197.128.164 -> 41.177.26.15 TCP 64 53426 > http [ACK] Seq=309 Ack=106865 Win=65535 Len=0
317107 108.224058 77.197.128.164 -> 41.177.26.15 TCP 64 53426 > http [ACK] Seq=309 Ack=111245 Win=65535 Len=0
317119 108.224324 77.197.128.164 -> 41.177.26.15 TCP 64 53426 > http [ACK] Seq=309 Ack=112705 Win=65535 Len=0
317120 108.224327 77.197.128.164 -> 41.177.26.15 TCP 64 53426 > http [ACK] Seq=309 Ack=117985 Win=65535 Len=0
317124 108.224483 77.197.128.164 -> 41.177.26.15 TCP 64 53426 > http [ACK] Seq=309 Ack=123265 Win=63167 Len=0
317125 108.224488 77.197.128.164 -> 41.177.26.15 TCP 64 [TCP Window Update] 53426 > http [ACK] Seq=309 Ack=123265 Win=65535 Len=0
317126 108.224493 77.197.128.164 -> 41.177.26.15 TCP 64 53426 > http [ACK] Seq=309 Ack=126185 Win=65535 Len=0
317136 108.224821 77.197.128.164 -> 41.177.26.15 TCP 64 53426 > http [ACK] Seq=309 Ack=129105 Win=65535 Len=0
317139 108.224973 77.197.128.164 -> 41.177.26.15 TCP 64 53426 > http [ACK] Seq=309 Ack=131465 Win=65535 Len=0
317141 108.224997 77.197.128.164 -> 41.177.26.15 TCP 64 53426 > http [ACK] Seq=309 Ack=134385 Win=62615 Len=0
317142 108.225001 77.197.128.164 -> 41.177.26.15 TCP 64 [TCP Window Update] 53426 > http [ACK] Seq=309 Ack=134385 Win=65535 Len=0
317397 108.305490 77.197.128.164 -> 41.177.26.15 TCP 64 53426 > http [ACK] Seq=309 Ack=139665 Win=65535 Len=0
317398 108.305656 77.197.128.164 -> 41.177.26.15 TCP 64 53426 > http [ACK] Seq=309 Ack=147865 Win=61707 Len=0
317399 108.305661 77.197.128.164 -> 41.177.26.15 TCP 64 [TCP Window Update] 53426 > http [ACK] Seq=309 Ack=147865 Win=65535 Len=0
317400 108.305665 77.197.128.164 -> 41.177.26.15 TCP 64 53426 > http [ACK] Seq=309 Ack=152245 Win=65535 Len=0
317411 108.305924 77.197.128.164 -> 41.177.26.15 TCP 64 53426 > http [ACK] Seq=309 Ack=155165 Win=65535 Len=0
317413 108.305947 77.197.128.164 -> 41.177.26.15 TCP 64 53426 > http [ACK] Seq=309 Ack=157525 Win=65535 Len=0
317420 108.306117 77.197.128.164 -> 41.177.26.15 TCP 64 53426 > http [ACK] Seq=309 Ack=161905 Win=64067 Len=0
317421 108.306121 77.197.128.164 -> 41.177.26.15 TCP 64 [TCP Window Update] 53426 > http [ACK] Seq=309 Ack=161905 Win=65535 Len=0
317422 108.306125 77.197.128.164 -> 41.177.26.15 TCP 64 53426 > http [ACK] Seq=309 Ack=164265 Win=65535 Len=0
317430 108.306327 77.197.128.164 -> 41.177.26.15 TCP 64 53426 > http [ACK] Seq=309 Ack=171565 Win=65535 Len=0
317436 108.306475 77.197.128.164 -> 41.177.26.15 TCP 64 53426 > http [ACK] Seq=309 Ack=176845 Win=65535 Len=0
317437 108.306479 77.197.128.164 -> 41.177.26.15 TCP 64 53426 > http [ACK] Seq=309 Ack=179765 Win=65535 Len=0
317448 108.306737 77.197.128.164 -> 41.177.26.15 TCP 64 53426 > http [ACK] Seq=309 Ack=182125 Win=65535 Len=0
317451 108.306892 77.197.128.164 -> 41.177.26.15 TCP 64 53426 > http [ACK] Seq=309 Ack=185045 Win=65535 Len=0
317452 108.306896 77.197.128.164 -> 41.177.26.15 TCP 64 53426 > http [ACK] Seq=309 Ack=188865 Win=65535 Len=0
317455 108.307059 77.197.128.164 -> 41.177.26.15 TCP 64 53426 > http [ACK] Seq=309 Ack=194705 Win=65535 Len=0
317621 108.387303 77.197.128.164 -> 41.177.26.15 TCP 64 53426 > http [ACK] Seq=309 Ack=198525 Win=65535 Len=0
317622 108.387430 77.197.128.164 -> 41.177.26.15 TCP 64 53426 > http [ACK] Seq=309 Ack=205265 Win=63167 Len=0
317623 108.387435 77.197.128.164 -> 41.177.26.15 TCP 64 [TCP Window Update] 53426 > http [ACK] Seq=309 Ack=205265 Win=65535 Len=0
317624 108.387551 77.197.128.164 -> 41.177.26.15 TCP 64 53426 > http [ACK] Seq=309 Ack=208185 Win=65535 Len=0
317625 108.387571 77.197.128.164 -> 41.177.26.15 TCP 64 53426 > http [ACK] Seq=309 Ack=216385 Win=62607 Len=0
317626 108.387658 77.197.128.164 -> 41.177.26.15 TCP 64 [TCP Window Update] 53426 > http [ACK] Seq=309 Ack=216385 Win=65535 Len=0
317627 108.387713 77.197.128.164 -> 41.177.26.15 TCP 64 53426 > http [ACK] Seq=309 Ack=219305 Win=65535 Len=0
317628 108.387804 77.197.128.164 -> 41.177.26.15 TCP 64 53426 > http [ACK] Seq=309 Ack=224585 Win=65527 Len=0
317629 108.387809 77.197.128.164 -> 41.177.26.15 TCP 64 [TCP Dup ACK 317628#1] 53426 > http [ACK] Seq=309 Ack=224585 Win=65527 Len=0
317630 108.387991 77.197.128.164 -> 41.177.26.15 TCP 64 53426 > http [ACK] Seq=309 Ack=228965 Win=65535 Len=0
317631 108.387996 77.197.128.164 -> 41.177.26.15 TCP 64 53426 > http [ACK] Seq=309 Ack=232785 Win=65527 Len=0
317632 108.388000 77.197.128.164 -> 41.177.26.15 TCP 64 [TCP Dup ACK 317631#1] 53426 > http [ACK] Seq=309 Ack=232785 Win=65527 Len=0
317633 108.388148 77.197.128.164 -> 41.177.26.15 TCP 64 53426 > http [ACK] Seq=309 Ack=235705 Win=65535 Len=0
317634 108.388153 77.197.128.164 -> 41.177.26.15 TCP 64 53426 > http [ACK] Seq=309 Ack=238065 Win=65535 Len=0
317635 108.388157 77.197.128.164 -> 41.177.26.15 TCP 64 53426 > http [ACK] Seq=309 Ack=242445 Win=64067 Len=0
317636 108.388161 77.197.128.164 -> 41.177.26.15 TCP 64 [TCP Window Update] 53426 > http [ACK] Seq=309 Ack=242445 Win=65535 Len=0
317637 108.388278 77.197.128.164 -> 41.177.26.15 TCP 64 53426 > http [ACK] Seq=309 Ack=245365 Win=65535 Len=0
317638 108.388595 77.197.128.164 -> 41.177.26.15 TCP 64 53426 > http [ACK] Seq=309 Ack=250645 Win=65535 Len=0
317639 108.388600 77.197.128.164 -> 41.177.26.15 TCP 64 53426 > http [ACK] Seq=309 Ack=253419 Win=62761 Len=0
317640 108.388604 77.197.128.164 -> 41.177.26.15 TCP 64 [TCP Window Update] 53426 > http [ACK] Seq=309 Ack=253419 Win=65535 Len=0
317713 108.405589 77.197.128.164 -> 41.177.26.15 TCP 64 53426 > http [RST, ACK] Seq=309 Ack=253419 Win=0 Len=0
320626 109.441200 77.197.128.164 -> 41.177.26.176 TCP 66 54624 > http [SYN] Seq=0 Win=65535 Len=0 MSS=1460 SACK_PERM=1
320802 109.523030 77.197.128.164 -> 41.177.26.176 TCP 64 54624 > http [ACK] Seq=1 Ack=1 Win=65535 Len=0
321161 109.704264 77.197.128.164 -> 41.177.26.15 TCP 66 54749 > http [SYN] Seq=0 Win=65535 Len=0 MSS=1460 SACK_PERM=1
321268 109.786046 77.197.128.164 -> 41.177.26.15 TCP 64 54749 > http [ACK] Seq=1 Ack=1 Win=65535 Len=0
321462 109.873736 77.197.128.164 -> 41.177.26.15 TCP 64 54749 > http [RST, ACK] Seq=380 Ack=204 Win=0 Len=0
321531 109.922852 77.197.128.164 -> 41.177.26.176 TCP 64 54624 > http [ACK] Seq=318 Ack=3896 Win=65535 Len=0
321640 110.004553 77.197.128.164 -> 41.177.26.176 TCP 64 54624 > http [ACK] Seq=318 Ack=6070 Win=65535 Len=0
321643 110.004776 77.197.128.164 -> 41.177.26.176 TCP 64 54624 > http [ACK] Seq=318 Ack=8137 Win=65535 Len=0
321808 110.086185 77.197.128.164 -> 41.177.26.176 TCP 64 54624 > http [ACK] Seq=318 Ack=10505 Win=65535 Len=0
321809 110.086518 77.197.128.164 -> 41.177.26.176 TCP 64 54624 > http [RST, ACK] Seq=318 Ack=11187 Win=0 Len=0
324595 111.463883 77.197.128.164 -> 41.177.26.176 TCP 66 55736 > http [SYN] Seq=0 Win=65535 Len=0 MSS=1460 SACK_PERM=1
324791 111.545656 77.197.128.164 -> 41.177.26.176 TCP 64 55736 > http [ACK] Seq=1 Ack=1 Win=65535 Len=0
324898 111.622883 77.197.128.164 -> 41.177.26.15 TCP 66 55838 > http [SYN] Seq=0 Win=65535 Len=0 MSS=1460 SACK_PERM=1
324968 111.704750 77.197.128.164 -> 41.177.26.15 TCP 64 55838 > http [ACK] Seq=1 Ack=1 Win=65535 Len=0
325166 111.901736 77.197.128.164 -> 41.177.26.176 TCP 64 55736 > http [ACK] Seq=316 Ack=2511 Win=65535 Len=0
325282 111.983616 77.197.128.164 -> 41.177.26.176 TCP 64 55736 > http [ACK] Seq=316 Ack=6050 Win=65535 Len=0
325396 112.065448 77.197.128.164 -> 41.177.26.176 TCP 64 55736 > http [ACK] Seq=316 Ack=8035 Win=65535 Len=0
325397 112.065453 77.197.128.164 -> 41.177.26.176 TCP 64 55736 > http [ACK] Seq=316 Ack=11130 Win=65108 Len=0
325398 112.065457 77.197.128.164 -> 41.177.26.176 TCP 64 [TCP Dup ACK 325397#1] 55736 > http [ACK] Seq=316 Ack=11130 Win=65108 Len=0
325399 112.065727 77.197.128.164 -> 41.177.26.176 TCP 64 55736 > http [RST, ACK] Seq=316 Ack=11130 Win=0 Len=0
325692 112.242559 77.197.128.164 -> 41.177.26.15 TCP 64 55838 > http [ACK] Seq=308 Ack=4381 Win=65535 Len=0
325816 112.324356 77.197.128.164 -> 41.177.26.15 TCP 64 55838 > http [ACK] Seq=308 Ack=7301 Win=65535 Len=0
325817 112.324574 77.197.128.164 -> 41.177.26.15 TCP 64 55838 > http [ACK] Seq=308 Ack=9925 Win=65535 Len=0
325950 112.406404 77.197.128.164 -> 41.177.26.15 TCP 64 55838 > http [ACK] Seq=308 Ack=12845 Win=65263 Len=0
325951 112.406409 77.197.128.164 -> 41.177.26.15 TCP 64 [TCP Dup ACK 325950#1] 55838 > http [ACK] Seq=308 Ack=12845 Win=65263 Len=0
325952 112.406412 77.197.128.164 -> 41.177.26.15 TCP 64 55838 > http [ACK] Seq=308 Ack=16665 Win=65535 Len=0
326081 112.488106 77.197.128.164 -> 41.177.26.15 TCP 64 55838 > http [ACK] Seq=308 Ack=21045 Win=65527 Len=0
326082 112.488111 77.197.128.164 -> 41.177.26.15 TCP 64 [TCP Dup ACK 326081#1] 55838 > http [ACK] Seq=308 Ack=21045 Win=65527 Len=0
326083 112.488208 77.197.128.164 -> 41.177.26.15 TCP 64 55838 > http [ACK] Seq=308 Ack=24865 Win=65535 Len=0
326084 112.488398 77.197.128.164 -> 41.177.26.15 TCP 64 55838 > http [ACK] Seq=308 Ack=27643 Win=65535 Len=0
326085 112.489943 77.197.128.164 -> 41.177.26.15 TCP 64 55838 > http [RST, ACK] Seq=308 Ack=27643 Win=0 Len=0
326748 112.838531 77.197.128.164 -> 41.177.26.176 TCP 66 56554 > http [SYN] Seq=0 Win=65535 Len=0 MSS=1460 SACK_PERM=1
326993 112.920257 77.197.128.164 -> 41.177.26.176 TCP 64 56554 > http [ACK] Seq=1 Ack=1 Win=65535 Len=0
327102 112.961093 77.197.128.164 -> 41.177.26.15 TCP 66 56707 > http [SYN] Seq=0 Win=65535 Len=0 MSS=1460 SACK_PERM=1
327220 113.042921 77.197.128.164 -> 41.177.26.15 TCP 64 56707 > http [ACK] Seq=1 Ack=1 Win=65535 Len=0
327702 113.311016 77.197.128.164 -> 41.177.26.176 TCP 64 56554 > http [ACK] Seq=355 Ack=2431 Win=65535 Len=0
327703 113.311159 77.197.128.164 -> 41.177.26.176 TCP 64 56554 > http [ACK] Seq=355 Ack=4058 Win=65535 Len=0
327793 113.381376 77.197.128.164 -> 41.177.26.15 TCP 64 56707 > http [ACK] Seq=309 Ack=2921 Win=65535 Len=0
327816 113.392763 77.197.128.164 -> 41.177.26.176 TCP 64 56554 > http [ACK] Seq=355 Ack=6232 Win=65535 Len=0
327817 113.392887 77.197.128.164 -> 41.177.26.176 TCP 64 56554 > http [ACK] Seq=355 Ack=8650 Win=65535 Len=0
327872 113.463150 77.197.128.164 -> 41.177.26.15 TCP 64 56707 > http [ACK] Seq=309 Ack=5841 Win=65535 Len=0
327873 113.463300 77.197.128.164 -> 41.177.26.15 TCP 64 56707 > http [ACK] Seq=309 Ack=8465 Win=65535 Len=0
327882 113.474579 77.197.128.164 -> 41.177.26.176 TCP 64 56554 > http [ACK] Seq=355 Ack=11499 Win=65535 Len=0
327883 113.474852 77.197.128.164 -> 41.177.26.176 TCP 64 56554 > http [RST, ACK] Seq=355 Ack=11499 Win=0 Len=0
327972 113.544987 77.197.128.164 -> 41.177.26.15 TCP 64 56707 > http [ACK] Seq=309 Ack=12845 Win=65535 Len=0
327975 113.545132 77.197.128.164 -> 41.177.26.15 TCP 64 56707 > http [ACK] Seq=309 Ack=16665 Win=65527 Len=0
327983 113.545370 77.197.128.164 -> 41.177.26.15 TCP 64 [TCP Dup ACK 327975#1] 56707 > http [ACK] Seq=309 Ack=16665 Win=65527 Len=0
328089 113.626814 77.197.128.164 -> 41.177.26.15 TCP 64 56707 > http [ACK] Seq=309 Ack=19585 Win=65535 Len=0
328090 113.626819 77.197.128.164 -> 41.177.26.15 TCP 64 56707 > http [ACK] Seq=309 Ack=22505 Win=65535 Len=0
328091 113.626823 77.197.128.164 -> 41.177.26.15 TCP 64 56707 > http [ACK] Seq=309 Ack=24865 Win=65527 Len=0
328092 113.626827 77.197.128.164 -> 41.177.26.15 TCP 64 [TCP Dup ACK 328091#1] 56707 > http [ACK] Seq=309 Ack=24865 Win=65527 Len=0
328093 113.626939 77.197.128.164 -> 41.177.26.15 TCP 64 56707 > http [ACK] Seq=309 Ack=27785 Win=65535 Len=0
328186 113.708721 77.197.128.164 -> 41.177.26.15 TCP 64 56707 > http [ACK] Seq=309 Ack=30705 Win=65535 Len=0
328187 113.708726 77.197.128.164 -> 41.177.26.15 TCP 64 56707 > http [ACK] Seq=309 Ack=33065 Win=65535 Len=0
328188 113.708741 77.197.128.164 -> 41.177.26.15 TCP 64 56707 > http [ACK] Seq=309 Ack=35985 Win=65527 Len=0
328189 113.708895 77.197.128.164 -> 41.177.26.15 TCP 64 [TCP Dup ACK 328188#1] 56707 > http [ACK] Seq=309 Ack=35985 Win=65527 Len=0
328190 113.708900 77.197.128.164 -> 41.177.26.15 TCP 64 56707 > http [ACK] Seq=309 Ack=40365 Win=65535 Len=0
328199 113.709106 77.197.128.164 -> 41.177.26.15 TCP 64 56707 > http [ACK] Seq=309 Ack=44185 Win=65535 Len=0
328288 113.790703 77.197.128.164 -> 41.177.26.15 TCP 64 56707 > http [ACK] Seq=309 Ack=50925 Win=63167 Len=0
328289 113.790707 77.197.128.164 -> 41.177.26.15 TCP 64 [TCP Window Update] 56707 > http [ACK] Seq=309 Ack=50925 Win=65535 Len=0
328290 113.790712 77.197.128.164 -> 41.177.26.15 TCP 64 56707 > http [ACK] Seq=309 Ack=55305 Win=65535 Len=0
328291 113.790715 77.197.128.164 -> 41.177.26.15 TCP 64 56707 > http [ACK] Seq=309 Ack=57665 Win=65535 Len=0
328292 113.790720 77.197.128.164 -> 41.177.26.15 TCP 64 56707 > http [ACK] Seq=309 Ack=62045 Win=65535 Len=0
328293 113.790827 77.197.128.164 -> 41.177.26.15 TCP 64 56707 > http [ACK] Seq=309 Ack=68785 Win=58795 Len=0
328294 113.790832 77.197.128.164 -> 41.177.26.15 TCP 64 [TCP Window Update] 56707 > http [ACK] Seq=309 Ack=68785 Win=65535 Len=0
328367 113.872659 77.197.128.164 -> 41.177.26.15 TCP 64 56707 > http [ACK] Seq=309 Ack=74065 Win=65535 Len=0
328368 113.872664 77.197.128.164 -> 41.177.26.15 TCP 64 56707 > http [ACK] Seq=309 Ack=79905 Win=62607 Len=0
328369 113.872668 77.197.128.164 -> 41.177.26.15 TCP 64 [TCP Window Update] 56707 > http [ACK] Seq=309 Ack=79905 Win=65535 Len=0
328370 113.872721 77.197.128.164 -> 41.177.26.15 TCP 64 56707 > http [ACK] Seq=309 Ack=86645 Win=65535 Len=0
328371 113.872828 77.197.128.164 -> 41.177.26.15 TCP 64 56707 > http [ACK] Seq=309 Ack=90465 Win=61715 Len=0
328372 113.872832 77.197.128.164 -> 41.177.26.15 TCP 64 [TCP Window Update] 56707 > http [ACK] Seq=309 Ack=90465 Win=65535 Len=0
328373 113.872836 77.197.128.164 -> 41.177.26.15 TCP 64 56707 > http [ACK] Seq=309 Ack=93385 Win=65535 Len=0
328374 113.873022 77.197.128.164 -> 41.177.26.15 TCP 64 56707 > http [ACK] Seq=309 Ack=98665 Win=65535 Len=0
328486 113.954580 77.197.128.164 -> 41.177.26.15 TCP 64 56707 > http [ACK] Seq=309 Ack=101585 Win=65527 Len=0
328487 113.954584 77.197.128.164 -> 41.177.26.15 TCP 64 [TCP Dup ACK 328486#1] 56707 > http [ACK] Seq=309 Ack=101585 Win=65527 Len=0
328489 113.954802 77.197.128.164 -> 41.177.26.15 TCP 64 56707 > http [ACK] Seq=309 Ack=104505 Win=65535 Len=0
328490 113.954806 77.197.128.164 -> 41.177.26.15 TCP 64 56707 > http [ACK] Seq=309 Ack=108325 Win=65535 Len=0
328491 113.954810 77.197.128.164 -> 41.177.26.15 TCP 64 56707 > http [ACK] Seq=309 Ack=109785 Win=65535 Len=0
328492 113.954814 77.197.128.164 -> 41.177.26.15 TCP 64 56707 > http [ACK] Seq=309 Ack=115065 Win=65535 Len=0
328493 113.954818 77.197.128.164 -> 41.177.26.15 TCP 64 56707 > http [ACK] Seq=309 Ack=117985 Win=65527 Len=0
328494 113.954823 77.197.128.164 -> 41.177.26.15 TCP 64 [TCP Dup ACK 328493#1] 56707 > http [ACK] Seq=309 Ack=117985 Win=65527 Len=0
328500 113.955015 77.197.128.164 -> 41.177.26.15 TCP 64 56707 > http [ACK] Seq=309 Ack=123265 Win=65535 Len=0
328501 113.955019 77.197.128.164 -> 41.177.26.15 TCP 64 56707 > http [ACK] Seq=309 Ack=127645 Win=64067 Len=0
328502 113.955106 77.197.128.164 -> 41.177.26.15 TCP 64 [TCP Window Update] 56707 > http [ACK] Seq=309 Ack=127645 Win=65535 Len=0
328503 113.955110 77.197.128.164 -> 41.177.26.15 TCP 64 56707 > http [ACK] Seq=309 Ack=131465 Win=65535 Len=0
328504 113.955216 77.197.128.164 -> 41.177.26.15 TCP 64 56707 > http [ACK] Seq=309 Ack=134385 Win=65535 Len=0
328505 113.955380 77.197.128.164 -> 41.177.26.15 TCP 64 56707 > http [ACK] Seq=309 Ack=138765 Win=65535 Len=0
328551 113.985689 77.197.128.164 -> 41.177.26.176 TCP 66 57399 > http [SYN] Seq=0 Win=65535 Len=0 MSS=1460 SACK_PERM=1
328592 114.036427 77.197.128.164 -> 41.177.26.15 TCP 64 56707 > http [ACK] Seq=309 Ack=141125 Win=65535 Len=0
328593 114.036432 77.197.128.164 -> 41.177.26.15 TCP 64 56707 > http [ACK] Seq=309 Ack=144045 Win=65535 Len=0
328594 114.036545 77.197.128.164 -> 41.177.26.15 TCP 64 56707 > http [ACK] Seq=309 Ack=146504 Win=65535 Len=0
328597 114.046786 77.197.128.164 -> 41.177.26.15 TCP 64 56707 > http [RST, ACK] Seq=309 Ack=146504 Win=0 Len=0
328628 114.067690 77.197.128.164 -> 41.177.26.176 TCP 64 57399 > http [ACK] Seq=1 Ack=1 Win=65535 Len=0
329031 114.499430 77.197.128.164 -> 41.177.26.176 TCP 64 57399 > http [ACK] Seq=319 Ack=2245 Win=65535 Len=0
329032 114.499435 77.197.128.164 -> 41.177.26.176 TCP 64 57399 > http [ACK] Seq=319 Ack=3902 Win=65535 Len=0
329176 114.581483 77.197.128.164 -> 41.177.26.176 TCP 64 57399 > http [ACK] Seq=319 Ack=6082 Win=65535 Len=0
329177 114.581488 77.197.128.164 -> 41.177.26.176 TCP 64 57399 > http [ACK] Seq=319 Ack=8222 Win=65535 Len=0
329178 114.581649 77.197.128.164 -> 41.177.26.176 TCP 64 57399 > http [ACK] Seq=319 Ack=11108 Win=65535 Len=0
329179 114.581768 77.197.128.164 -> 41.177.26.176 TCP 64 57399 > http [RST, ACK] Seq=319 Ack=11108 Win=0 Len=0
330121 114.946371 77.197.128.164 -> 41.177.26.176 TCP 66 58065 > http [SYN] Seq=0 Win=65535 Len=0 MSS=1460 SACK_PERM=1
330347 115.028187 77.197.128.164 -> 41.177.26.176 TCP 64 58065 > http [ACK] Seq=1 Ack=1 Win=65535 Len=0
331152 115.375847 77.197.128.164 -> 41.177.26.176 TCP 64 58065 > http [ACK] Seq=304 Ack=2431 Win=65535 Len=0
331153 115.375955 77.197.128.164 -> 41.177.26.176 TCP 64 58065 > http [ACK] Seq=304 Ack=3893 Win=65535 Len=0
331286 115.457715 77.197.128.164 -> 41.177.26.176 TCP 64 58065 > http [ACK] Seq=304 Ack=6057 Win=65535 Len=0
331288 115.457980 77.197.128.164 -> 41.177.26.176 TCP 64 58065 > http [ACK] Seq=304 Ack=10437 Win=65535 Len=0
331458 115.539635 77.197.128.164 -> 41.177.26.176 TCP 64 58065 > http [RST, ACK] Seq=304 Ack=11294 Win=0 Len=0
331928 115.698300 77.197.128.164 -> 41.177.26.176 TCP 66 58562 > http [SYN] Seq=0 Win=65535 Len=0 MSS=1460 SACK_PERM=1
332179 115.780058 77.197.128.164 -> 41.177.26.176 TCP 64 58562 > http [ACK] Seq=1 Ack=1 Win=65535 Len=0
333746 116.685594 77.197.128.164 -> 41.177.26.176 TCP 64 58562 > http [ACK] Seq=346 Ack=2126 Win=65535 Len=0
333748 116.685798 77.197.128.164 -> 41.177.26.176 TCP 64 58562 > http [ACK] Seq=346 Ack=2719 Win=64942 Len=0
333753 116.686099 77.197.128.164 -> 41.177.26.176 TCP 64 58562 > http [ACK] Seq=346 Ack=4002 Win=65535 Len=0
334070 116.767383 77.197.128.164 -> 41.177.26.176 TCP 64 58562 > http [ACK] Seq=346 Ack=6878 Win=65535 Len=0
334071 116.767535 77.197.128.164 -> 41.177.26.176 TCP 64 58562 > http [ACK] Seq=346 Ack=9798 Win=65535 Len=0
334072 116.768277 77.197.128.164 -> 41.177.26.176 TCP 64 58562 > http [RST, ACK] Seq=346 Ack=11085 Win=0 Len=0
334091 116.782566 77.197.128.164 -> 41.177.26.176 TCP 66 59476 > http [SYN] Seq=0 Win=65535 Len=0 MSS=1460 SACK_PERM=1
334245 116.864228 77.197.128.164 -> 41.177.26.176 TCP 64 59476 > http [ACK] Seq=1 Ack=1 Win=65535 Len=0
335257 117.276264 77.197.128.164 -> 41.177.26.176 TCP 64 59476 > http [ACK] Seq=309 Ack=2431 Win=65535 Len=0
335258 117.276415 77.197.128.164 -> 41.177.26.176 TCP 64 59476 > http [ACK] Seq=309 Ack=3908 Win=65535 Len=0
335448 117.358198 77.197.128.164 -> 41.177.26.176 TCP 64 59476 > http [ACK] Seq=309 Ack=6076 Win=65535 Len=0
335449 117.358473 77.197.128.164 -> 41.177.26.176 TCP 64 59476 > http [ACK] Seq=309 Ack=11065 Win=65535 Len=0
335451 117.358803 77.197.128.164 -> 41.177.26.176 TCP 64 59476 > http [RST, ACK] Seq=309 Ack=11065 Win=0 Len=0
336055 117.496352 77.197.128.164 -> 41.177.26.176 TCP 66 59994 > http [SYN] Seq=0 Win=65535 Len=0 MSS=1460 SACK_PERM=1
336857 117.578208 77.197.128.164 -> 41.177.26.176 TCP 64 59994 > http [ACK] Seq=1 Ack=1 Win=65535 Len=0
346966 117.995827 77.197.128.164 -> 41.177.26.176 TCP 64 59994 > http [ACK] Seq=301 Ack=2431 Win=65535 Len=0
349128 118.077704 77.197.128.164 -> 41.177.26.176 TCP 64 59994 > http [ACK] Seq=301 Ack=6075 Win=65535 Len=0
349606 118.159335 77.197.128.164 -> 41.177.26.176 TCP 64 59994 > http [ACK] Seq=301 Ack=8315 Win=65535 Len=0
349607 118.159416 77.197.128.164 -> 41.177.26.176 TCP 64 59994 > http [ACK] Seq=301 Ack=11195 Win=64963 Len=0
349608 118.159452 77.197.128.164 -> 41.177.26.176 TCP 64 [TCP Dup ACK 349607#1] 59994 > http [ACK] Seq=301 Ack=11195 Win=64963 Len=0
349609 118.159829 77.197.128.164 -> 41.177.26.176 TCP 64 59994 > http [RST, ACK] Seq=301 Ack=11195 Win=0 Len=0
350156 118.353535 77.197.128.164 -> 41.177.26.176 TCP 66 60633 > http [SYN] Seq=0 Win=65535 Len=0 MSS=1460 SACK_PERM=1
350450 118.435414 77.197.128.164 -> 41.177.26.176 TCP 64 60633 > http [ACK] Seq=1 Ack=1 Win=65535 Len=0
351504 118.880637 77.197.128.164 -> 41.177.26.176 TCP 64 60633 > http [ACK] Seq=309 Ack=3130 Win=65535 Len=0
351659 118.964263 77.197.128.164 -> 41.177.26.176 TCP 64 60633 > http [ACK] Seq=309 Ack=7549 Win=65535 Len=0
351843 119.046130 77.197.128.164 -> 41.177.26.176 TCP 64 60633 > http [ACK] Seq=309 Ack=11091 Win=65535 Len=0
351844 119.046474 77.197.128.164 -> 41.177.26.176 TCP 64 60633 > http [RST, ACK] Seq=309 Ack=11091 Win=0 Len=0
351866 119.069277 77.197.128.164 -> 41.177.26.176 TCP 66 61099 > http [SYN] Seq=0 Win=65535 Len=0 MSS=1460 SACK_PERM=1
351978 119.151321 77.197.128.164 -> 41.177.26.176 TCP 64 61099 > http [ACK] Seq=1 Ack=1 Win=65535 Len=0
352520 119.556185 77.197.128.164 -> 41.177.26.176 TCP 64 61099 > http [ACK] Seq=318 Ack=3705 Win=65535 Len=0
352627 119.637922 77.197.128.164 -> 41.177.26.176 TCP 64 61099 > http [ACK] Seq=318 Ack=8218 Win=65535 Len=0
352757 119.719808 77.197.128.164 -> 41.177.26.176 TCP 64 61099 > http [ACK] Seq=318 Ack=11067 Win=65535 Len=0
352760 119.720029 77.197.128.164 -> 41.177.26.176 TCP 64 61099 > http [RST, ACK] Seq=318 Ack=11067 Win=0 Len=0
353177 119.936212 77.197.128.164 -> 41.177.26.176 TCP 66 61680 > http [SYN] Seq=0 Win=65535 Len=0 MSS=1460 SACK_PERM=1
353250 120.018142 77.197.128.164 -> 41.177.26.176 TCP 64 61680 > http [ACK] Seq=1 Ack=1 Win=65535 Len=0
354140 120.506844 77.197.128.164 -> 41.177.26.176 TCP 64 61680 > http [ACK] Seq=355 Ack=4058 Win=65535 Len=0
354309 120.588843 77.197.128.164 -> 41.177.26.176 TCP 64 61680 > http [ACK] Seq=355 Ack=6232 Win=65535 Len=0
354310 120.588848 77.197.128.164 -> 41.177.26.176 TCP 64 61680 > http [ACK] Seq=355 Ack=8419 Win=65535 Len=0
354500 120.670828 77.197.128.164 -> 41.177.26.176 TCP 64 61680 > http [ACK] Seq=355 Ack=10831 Win=65535 Len=0
354502 120.671080 77.197.128.164 -> 41.177.26.176 TCP 64 61680 > http [RST, ACK] Seq=355 Ack=11513 Win=0 Len=0
354555 120.688037 77.197.128.164 -> 41.177.26.176 TCP 66 62214 > http [SYN] Seq=0 Win=65535 Len=0 MSS=1460 SACK_PERM=1
354701 120.769735 77.197.128.164 -> 41.177.26.176 TCP 64 62214 > http [ACK] Seq=1 Ack=1 Win=65535 Len=0
357635 122.048237 77.197.128.164 -> 41.177.26.176 TCP 64 62214 > http [ACK] Seq=351 Ack=1537 Win=65535 Len=0
357650 122.058927 77.197.128.164 -> 41.177.26.176 TCP 64 62214 > http [ACK] Seq=351 Ack=2468 Win=64604 Len=0
357651 122.058932 77.197.128.164 -> 41.177.26.176 TCP 64 62214 > http [ACK] Seq=351 Ack=2819 Win=64253 Len=0
357652 122.058936 77.197.128.164 -> 41.177.26.176 TCP 64 62214 > http [ACK] Seq=351 Ack=3632 Win=65535 Len=0
357817 122.130138 77.197.128.164 -> 41.177.26.176 TCP 64 62214 > http [ACK] Seq=351 Ack=6282 Win=65535 Len=0
357844 122.140837 77.197.128.164 -> 41.177.26.176 TCP 64 62214 > http [ACK] Seq=351 Ack=10397 Win=65535 Len=0
357845 122.141182 77.197.128.164 -> 41.177.26.176 TCP 64 62214 > http [RST, ACK] Seq=351 Ack=10397 Win=0 Len=0
361111 123.259889 77.197.128.164 -> 41.177.26.176 TCP 66 63399 > http [SYN] Seq=0 Win=65535 Len=0 MSS=1460 SACK_PERM=1
361377 123.342000 77.197.128.164 -> 41.177.26.176 TCP 64 63399 > http [ACK] Seq=1 Ack=1 Win=65535 Len=0
363543 123.826531 77.197.128.164 -> 41.177.26.176 TCP 64 63399 > http [ACK] Seq=355 Ack=2431 Win=65535 Len=0
363544 123.826803 77.197.128.164 -> 41.177.26.176 TCP 64 63399 > http [ACK] Seq=355 Ack=4058 Win=65535 Len=0
364131 123.908443 77.197.128.164 -> 41.177.26.176 TCP 64 63399 > http [ACK] Seq=355 Ack=6232 Win=65535 Len=0
364132 123.908586 77.197.128.164 -> 41.177.26.176 TCP 64 63399 > http [ACK] Seq=355 Ack=11221 Win=65535 Len=0
364133 123.908745 77.197.128.164 -> 41.177.26.176 TCP 64 63399 > http [RST, ACK] Seq=355 Ack=11221 Win=0 Len=0
466149 153.417847 77.197.128.164 -> 41.177.26.176 TCP 66 12720 > http [SYN] Seq=0 Win=65535 Len=0 MSS=1460 SACK_PERM=1
466279 153.499468 77.197.128.164 -> 41.177.26.176 TCP 64 12720 > http [ACK] Seq=1 Ack=1 Win=65535 Len=0
467419 154.022078 77.197.128.164 -> 41.177.26.176 TCP 64 12720 > http [ACK] Seq=318 Ack=2431 Win=65535 Len=0
467423 154.022356 77.197.128.164 -> 41.177.26.176 TCP 64 12720 > http [ACK] Seq=318 Ack=3896 Win=65535 Len=0
467604 154.103740 77.197.128.164 -> 41.177.26.176 TCP 64 12720 > http [ACK] Seq=318 Ack=6070 Win=65535 Len=0
467607 154.104064 77.197.128.164 -> 41.177.26.176 TCP 64 12720 > http [ACK] Seq=318 Ack=8343 Win=65535 Len=0
467750 154.185498 77.197.128.164 -> 41.177.26.176 TCP 64 12720 > http [ACK] Seq=318 Ack=11199 Win=65535 Len=0
467751 154.185747 77.197.128.164 -> 41.177.26.176 TCP 64 12720 > http [RST, ACK] Seq=318 Ack=11199 Win=0 Len=0
467784 154.216588 77.197.128.164 -> 41.177.26.176 TCP 66 13650 > http [SYN] Seq=0 Win=65535 Len=0 MSS=1460 SACK_PERM=1
467960 154.298280 77.197.128.164 -> 41.177.26.176 TCP 64 13650 > http [ACK] Seq=1 Ack=1 Win=65535 Len=0
468815 154.654583 77.197.128.164 -> 41.177.26.176 TCP 64 13650 > http [ACK] Seq=309 Ack=2431 Win=65535 Len=0
469016 154.736435 77.197.128.164 -> 41.177.26.176 TCP 64 13650 > http [ACK] Seq=309 Ack=5351 Win=65535 Len=0
469019 154.736566 77.197.128.164 -> 41.177.26.176 TCP 64 13650 > http [ACK] Seq=309 Ack=7527 Win=65535 Len=0
469216 154.818369 77.197.128.164 -> 41.177.26.176 TCP 64 13650 > http [ACK] Seq=309 Ack=11119 Win=65535 Len=0
469217 154.818548 77.197.128.164 -> 41.177.26.176 TCP 64 13650 > http [RST, ACK] Seq=309 Ack=11119 Win=0 Len=0
