977   0.260283 77.197.128.225 -> 41.177.26.176 TCP 64 28287 > http [ACK] Seq=1 Ack=2431 Win=65535 Len=0
979   0.260292 77.197.128.225 -> 41.177.26.176 TCP 64 28287 > http [ACK] Seq=1 Ack=4051 Win=65535 Len=0
1279   0.342032 77.197.128.225 -> 41.177.26.176 TCP 64 28287 > http [ACK] Seq=1 Ack=6221 Win=65535 Len=0
1280   0.342232 77.197.128.225 -> 41.177.26.176 TCP 64 28287 > http [ACK] Seq=1 Ack=10601 Win=65535 Len=0
1474   0.424008 77.197.128.225 -> 41.177.26.176 TCP 64 28287 > http [RST, ACK] Seq=1 Ack=11974 Win=0 Len=0
1882   0.560998 77.197.128.225 -> 41.177.26.176 TCP 66 28395 > http [SYN] Seq=0 Win=65535 Len=0 MSS=1460 SACK_PERM=1
2118   0.642702 77.197.128.225 -> 41.177.26.176 TCP 64 28395 > http [ACK] Seq=1 Ack=1 Win=65535 Len=0
3032   0.996057 77.197.128.225 -> 41.177.26.176 TCP 64 28395 > http [ACK] Seq=308 Ack=2842 Win=65295 Len=0
3035   0.996145 77.197.128.225 -> 41.177.26.176 TCP 64 28395 > http [ACK] Seq=308 Ack=3918 Win=64219 Len=0
3219   1.077841 77.197.128.225 -> 41.177.26.176 TCP 64 28395 > http [ACK] Seq=308 Ack=6082 Win=65535 Len=0
3220   1.077962 77.197.128.225 -> 41.177.26.176 TCP 64 28395 > http [ACK] Seq=308 Ack=10647 Win=65535 Len=0
3882   1.159669 77.197.128.225 -> 41.177.26.176 TCP 64 28395 > http [RST, ACK] Seq=308 Ack=11329 Win=0 Len=0
4469   1.358663 77.197.128.225 -> 41.177.26.176 TCP 66 28517 > http [SYN] Seq=0 Win=65535 Len=0 MSS=1460 SACK_PERM=1
4765   1.440554 77.197.128.225 -> 41.177.26.176 TCP 64 28517 > http [ACK] Seq=1 Ack=1 Win=65535 Len=0
7035   2.324995 77.197.128.225 -> 41.177.26.176 TCP 64 28517 > http [ACK] Seq=323 Ack=2085 Win=65535 Len=0
7037   2.325077 77.197.128.225 -> 41.177.26.176 TCP 64 28517 > http [ACK] Seq=323 Ack=2408 Win=65212 Len=0
7038   2.325230 77.197.128.225 -> 41.177.26.176 TCP 64 28517 > http [ACK] Seq=323 Ack=2875 Win=64745 Len=0
7231   2.406893 77.197.128.225 -> 41.177.26.176 TCP 64 28517 > http [ACK] Seq=323 Ack=5073 Win=65535 Len=0
7232   2.407056 77.197.128.225 -> 41.177.26.176 TCP 64 28517 > http [ACK] Seq=323 Ack=7467 Win=65535 Len=0
7233   2.407060 77.197.128.225 -> 41.177.26.176 TCP 64 28517 > http [ACK] Seq=323 Ack=9977 Win=65535 Len=0
7234   2.407321 77.197.128.225 -> 41.177.26.176 TCP 64 28517 > http [RST, ACK] Seq=323 Ack=9977 Win=0 Len=0
7611   2.577616 77.197.128.225 -> 41.177.26.176 TCP 66 28676 > http [SYN] Seq=0 Win=65535 Len=0 MSS=1460 SACK_PERM=1
7766   2.659398 77.197.128.225 -> 41.177.26.176 TCP 64 28676 > http [ACK] Seq=1 Ack=1 Win=65535 Len=0
8741   3.072689 77.197.128.225 -> 41.177.26.176 TCP 64 28676 > http [ACK] Seq=318 Ack=2916 Win=65535 Len=0
8817   3.154357 77.197.128.225 -> 41.177.26.176 TCP 64 28676 > http [ACK] Seq=318 Ack=6071 Win=65535 Len=0
9005   3.236031 77.197.128.225 -> 41.177.26.176 TCP 64 28676 > http [ACK] Seq=318 Ack=8612 Win=65535 Len=0
9007   3.236244 77.197.128.225 -> 41.177.26.176 TCP 64 28676 > http [ACK] Seq=318 Ack=11462 Win=65535 Len=0
9657   3.409095 77.197.128.225 -> 41.177.26.176 TCP 64 28676 > http [RST, ACK] Seq=318 Ack=11462 Win=0 Len=0
22930   8.292789 77.197.128.225 -> 41.177.26.176 TCP 66 32820 > http [SYN] Seq=0 Win=65535 Len=0 MSS=1460 SACK_PERM=1
23115   8.374670 77.197.128.225 -> 41.177.26.176 TCP 64 32820 > http [ACK] Seq=1 Ack=1 Win=65535 Len=0
25588   9.854445 77.197.128.225 -> 41.177.26.176 TCP 64 32820 > http [ACK] Seq=322 Ack=2178 Win=65535 Len=0
25592   9.854973 77.197.128.225 -> 41.177.26.176 TCP 64 32820 > http [ACK] Seq=322 Ack=2857 Win=64856 Len=0
25694   9.936401 77.197.128.225 -> 41.177.26.176 TCP 64 32820 > http [ACK] Seq=322 Ack=5329 Win=65535 Len=0
25696   9.936476 77.197.128.225 -> 41.177.26.176 TCP 64 32820 > http [ACK] Seq=322 Ack=7662 Win=65535 Len=0
25702   9.936788 77.197.128.225 -> 41.177.26.176 TCP 64 32820 > http [ACK] Seq=322 Ack=9933 Win=65535 Len=0
25703   9.937089 77.197.128.225 -> 41.177.26.176 TCP 64 32820 > http [RST, ACK] Seq=322 Ack=9933 Win=0 Len=0
25798  10.014992 77.197.128.225 -> 41.177.26.176 TCP 66 33953 > http [SYN] Seq=0 Win=65535 Len=0 MSS=1460 SACK_PERM=1
25935  10.096793 77.197.128.225 -> 41.177.26.176 TCP 64 33953 > http [ACK] Seq=1 Ack=1 Win=65535 Len=0
28053  11.249658 77.197.128.225 -> 41.177.26.176 TCP 64 33953 > http [ACK] Seq=330 Ack=1501 Win=65535 Len=0
28069  11.261255 77.197.128.225 -> 41.177.26.176 TCP 64 33953 > http [ACK] Seq=330 Ack=2401 Win=64635 Len=0
28070  11.261279 77.197.128.225 -> 41.177.26.176 TCP 64 33953 > http [ACK] Seq=330 Ack=3466 Win=65535 Len=0
28156  11.331499 77.197.128.225 -> 41.177.26.176 TCP 64 33953 > http [ACK] Seq=330 Ack=6035 Win=65535 Len=0
28176  11.342957 77.197.128.225 -> 41.177.26.176 TCP 64 33953 > http [ACK] Seq=330 Ack=10153 Win=65535 Len=0
28177  11.343286 77.197.128.225 -> 41.177.26.176 TCP 64 33953 > http [RST, ACK] Seq=330 Ack=10153 Win=0 Len=0
28243  11.391766 77.197.128.225 -> 41.177.26.176 TCP 66 34770 > http [SYN] Seq=0 Win=65535 Len=0 MSS=1460 SACK_PERM=1
28441  11.473720 77.197.128.225 -> 41.177.26.176 TCP 64 34770 > http [ACK] Seq=1 Ack=1 Win=65535 Len=0
31189  13.141507 77.197.128.225 -> 41.177.26.176 TCP 64 34770 > http [ACK] Seq=297 Ack=1486 Win=65535 Len=0
31203  13.153352 77.197.128.225 -> 41.177.26.176 TCP 64 34770 > http [ACK] Seq=297 Ack=2447 Win=64574 Len=0
31204  13.153507 77.197.128.225 -> 41.177.26.176 TCP 64 34770 > http [ACK] Seq=297 Ack=2849 Win=64172 Len=0
31207  13.153658 77.197.128.225 -> 41.177.26.176 TCP 64 34770 > http [ACK] Seq=297 Ack=3606 Win=65535 Len=0
31311  13.223342 77.197.128.225 -> 41.177.26.176 TCP 64 34770 > http [ACK] Seq=297 Ack=5832 Win=65535 Len=0
31328  13.235087 77.197.128.225 -> 41.177.26.176 TCP 64 34770 > http [ACK] Seq=297 Ack=9571 Win=65535 Len=0
31329  13.235356 77.197.128.225 -> 41.177.26.176 TCP 64 34770 > http [RST, ACK] Seq=297 Ack=9571 Win=0 Len=0
31442  13.311979 77.197.128.225 -> 41.177.26.176 TCP 66 35531 > http [SYN] Seq=0 Win=65535 Len=0 MSS=1460 SACK_PERM=1
31763  13.393628 77.197.128.225 -> 41.177.26.176 TCP 64 35531 > http [ACK] Seq=1 Ack=1 Win=65535 Len=0
33558  14.232627 77.197.128.225 -> 41.177.26.176 TCP 64 35531 > http [ACK] Seq=336 Ack=2109 Win=65535 Len=0
33563  14.233073 77.197.128.225 -> 41.177.26.176 TCP 64 35531 > http [ACK] Seq=336 Ack=2441 Win=65203 Len=0
33566  14.233396 77.197.128.225 -> 41.177.26.176 TCP 64 35531 > http [ACK] Seq=336 Ack=3911 Win=65535 Len=0
33702  14.314498 77.197.128.225 -> 41.177.26.176 TCP 64 35531 > http [ACK] Seq=336 Ack=6595 Win=65535 Len=0
33703  14.314835 77.197.128.225 -> 41.177.26.176 TCP 64 35531 > http [ACK] Seq=336 Ack=9515 Win=65535 Len=0
33704  14.315325 77.197.128.225 -> 41.177.26.176 TCP 64 35531 > http [RST, ACK] Seq=336 Ack=10615 Win=0 Len=0
34105  14.483607 77.197.128.225 -> 41.177.26.176 TCP 66 35891 > http [SYN] Seq=0 Win=65535 Len=0 MSS=1460 SACK_PERM=1
34483  14.565403 77.197.128.225 -> 41.177.26.176 TCP 64 35891 > http [ACK] Seq=1 Ack=1 Win=65535 Len=0
35771  14.916627 77.197.128.225 -> 41.177.26.176 TCP 64 35891 > http [ACK] Seq=305 Ack=2834 Win=65535 Len=0
35908  14.998618 77.197.128.225 -> 41.177.26.176 TCP 64 35891 > http [ACK] Seq=305 Ack=6069 Win=65535 Len=0
36155  15.080263 77.197.128.225 -> 41.177.26.176 TCP 64 35891 > http [ACK] Seq=305 Ack=8212 Win=65535 Len=0
36156  15.080377 77.197.128.225 -> 41.177.26.176 TCP 64 35891 > http [ACK] Seq=305 Ack=11295 Win=65535 Len=0
36157  15.080857 77.197.128.225 -> 41.177.26.176 TCP 64 35891 > http [RST, ACK] Seq=305 Ack=11295 Win=0 Len=0
36567  15.264434 77.197.128.225 -> 41.177.26.176 TCP 66 36188 > http [SYN] Seq=0 Win=65535 Len=0 MSS=1460 SACK_PERM=1
36714  15.346242 77.197.128.225 -> 41.177.26.176 TCP 64 36188 > http [ACK] Seq=1 Ack=1 Win=65535 Len=0
37814  15.735562 77.197.128.225 -> 41.177.26.176 TCP 64 36188 > http [ACK] Seq=318 Ack=2431 Win=65535 Len=0
37820  15.735965 77.197.128.225 -> 41.177.26.176 TCP 64 36188 > http [ACK] Seq=318 Ack=3896 Win=65535 Len=0
38187  15.817554 77.197.128.225 -> 41.177.26.176 TCP 64 36188 > http [ACK] Seq=318 Ack=6070 Win=65535 Len=0
38188  15.817560 77.197.128.225 -> 41.177.26.176 TCP 64 36188 > http [ACK] Seq=318 Ack=7761 Win=65535 Len=0
38189  15.817705 77.197.128.225 -> 41.177.26.176 TCP 64 36188 > http [ACK] Seq=318 Ack=11059 Win=65535 Len=0
38190  15.817894 77.197.128.225 -> 41.177.26.176 TCP 64 36188 > http [RST, ACK] Seq=318 Ack=11059 Win=0 Len=0
38410  15.876141 77.197.128.225 -> 41.177.26.176 TCP 66 36411 > http [SYN] Seq=0 Win=65535 Len=0 MSS=1460 SACK_PERM=1
38551  15.957793 77.197.128.225 -> 41.177.26.176 TCP 64 36411 > http [ACK] Seq=1 Ack=1 Win=65535 Len=0
39479  16.361160 77.197.128.225 -> 41.177.26.176 TCP 64 36411 > http [ACK] Seq=301 Ack=2431 Win=65535 Len=0
39480  16.361165 77.197.128.225 -> 41.177.26.176 TCP 64 36411 > http [ACK] Seq=301 Ack=3908 Win=65535 Len=0
39567  16.443089 77.197.128.225 -> 41.177.26.176 TCP 64 36411 > http [ACK] Seq=301 Ack=6076 Win=65535 Len=0
39568  16.443113 77.197.128.225 -> 41.177.26.176 TCP 64 36411 > http [ACK] Seq=301 Ack=8338 Win=65535 Len=0
39569  16.443201 77.197.128.225 -> 41.177.26.176 TCP 64 36411 > http [ACK] Seq=301 Ack=11181 Win=65535 Len=0
39570  16.443471 77.197.128.225 -> 41.177.26.176 TCP 64 36411 > http [RST, ACK] Seq=301 Ack=11181 Win=0 Len=0
39596  16.468927 77.197.128.225 -> 41.177.26.176 TCP 66 36659 > http [SYN] Seq=0 Win=65535 Len=0 MSS=1460 SACK_PERM=1
39822  16.550511 77.197.128.225 -> 41.177.26.176 TCP 64 36659 > http [ACK] Seq=1 Ack=1 Win=65535 Len=0
40446  16.937837 77.197.128.225 -> 41.177.26.176 TCP 64 36659 > http [ACK] Seq=308 Ack=2602 Win=65535 Len=0
40545  17.019715 77.197.128.225 -> 41.177.26.176 TCP 64 36659 > http [ACK] Seq=308 Ack=6069 Win=65535 Len=0
40926  17.101462 77.197.128.225 -> 41.177.26.176 TCP 64 36659 > http [ACK] Seq=308 Ack=8581 Win=65535 Len=0
40927  17.101467 77.197.128.225 -> 41.177.26.176 TCP 64 36659 > http [ACK] Seq=308 Ack=11620 Win=65535 Len=0
40928  17.101726 77.197.128.225 -> 41.177.26.176 TCP 64 36659 > http [RST, ACK] Seq=308 Ack=11620 Win=0 Len=0
41350  17.265041 77.197.128.225 -> 41.177.26.176 TCP 66 37069 > http [SYN] Seq=0 Win=65535 Len=0 MSS=1460 SACK_PERM=1
41596  17.346905 77.197.128.225 -> 41.177.26.176 TCP 64 37069 > http [ACK] Seq=1 Ack=1 Win=65535 Len=0
42339  17.706737 77.197.128.225 -> 41.177.26.176 TCP 64 37069 > http [ACK] Seq=316 Ack=3128 Win=65535 Len=0
42418  17.788497 77.197.128.225 -> 41.177.26.176 TCP 64 37069 > http [ACK] Seq=316 Ack=6077 Win=65535 Len=0
42463  17.870171 77.197.128.225 -> 41.177.26.176 TCP 64 37069 > http [ACK] Seq=316 Ack=8997 Win=65535 Len=0
42464  17.870299 77.197.128.225 -> 41.177.26.176 TCP 64 37069 > http [ACK] Seq=316 Ack=11697 Win=65535 Len=0
42465  17.870539 77.197.128.225 -> 41.177.26.176 TCP 64 37069 > http [RST, ACK] Seq=316 Ack=11697 Win=0 Len=0
42818  18.093065 77.197.128.225 -> 41.177.26.176 TCP 66 37456 > http [SYN] Seq=0 Win=65535 Len=0 MSS=1460 SACK_PERM=1
42933  18.174824 77.197.128.225 -> 41.177.26.176 TCP 64 37456 > http [ACK] Seq=1 Ack=1 Win=65535 Len=0
43809  18.552381 77.197.128.225 -> 41.177.26.176 TCP 64 37456 > http [ACK] Seq=317 Ack=2431 Win=65535 Len=0
44100  18.634486 77.197.128.225 -> 41.177.26.176 TCP 64 37456 > http [ACK] Seq=317 Ack=6055 Win=65535 Len=0
44466  18.716172 77.197.128.225 -> 41.177.26.176 TCP 64 37456 > http [ACK] Seq=317 Ack=11684 Win=64474 Len=0
44467  18.716301 77.197.128.225 -> 41.177.26.176 TCP 64 [TCP Dup ACK 44466#1] 37456 > http [ACK] Seq=317 Ack=11684 Win=64474 Len=0
44477  18.716653 77.197.128.225 -> 41.177.26.176 TCP 64 37456 > http [RST, ACK] Seq=317 Ack=11684 Win=0 Len=0
45192  18.901252 77.197.128.225 -> 41.177.26.176 TCP 66 37931 > http [SYN] Seq=0 Win=65535 Len=0 MSS=1460 SACK_PERM=1
45332  18.983105 77.197.128.225 -> 41.177.26.176 TCP 64 37931 > http [ACK] Seq=1 Ack=1 Win=65535 Len=0
46820  19.469124 77.197.128.225 -> 41.177.26.176 TCP 64 37931 > http [ACK] Seq=356 Ack=4057 Win=65535 Len=0
47294  19.550880 77.197.128.225 -> 41.177.26.176 TCP 64 37931 > http [ACK] Seq=356 Ack=6237 Win=65535 Len=0
47295  19.550885 77.197.128.225 -> 41.177.26.176 TCP 64 37931 > http [ACK] Seq=356 Ack=7974 Win=65535 Len=0
47656  19.632860 77.197.128.225 -> 41.177.26.176 TCP 64 37931 > http [ACK] Seq=356 Ack=11258 Win=65535 Len=0
47657  19.633086 77.197.128.225 -> 41.177.26.176 TCP 64 37931 > http [RST, ACK] Seq=356 Ack=11258 Win=0 Len=0
47809  19.687679 77.197.128.225 -> 41.177.26.176 TCP 66 38390 > http [SYN] Seq=0 Win=65535 Len=0 MSS=1460 SACK_PERM=1
48129  19.769576 77.197.128.225 -> 41.177.26.176 TCP 64 38390 > http [ACK] Seq=1 Ack=1 Win=65535 Len=0
49897  20.250581 77.197.128.225 -> 41.177.26.176 TCP 64 38390 > http [ACK] Seq=309 Ack=2431 Win=65535 Len=0
50035  20.332400 77.197.128.225 -> 41.177.26.176 TCP 64 38390 > http [ACK] Seq=309 Ack=6075 Win=65535 Len=0
50156  20.414042 77.197.128.225 -> 41.177.26.176 TCP 64 38390 > http [ACK] Seq=309 Ack=8095 Win=65535 Len=0
50157  20.414281 77.197.128.225 -> 41.177.26.176 TCP 64 38390 > http [ACK] Seq=309 Ack=11182 Win=65535 Len=0
50158  20.414434 77.197.128.225 -> 41.177.26.176 TCP 64 38390 > http [RST, ACK] Seq=309 Ack=11182 Win=0 Len=0
50445  20.530024 77.197.128.225 -> 41.177.26.176 TCP 66 38905 > http [SYN] Seq=0 Win=65535 Len=0 MSS=1460 SACK_PERM=1
50569  20.611713 77.197.128.225 -> 41.177.26.176 TCP 64 38905 > http [ACK] Seq=1 Ack=1 Win=65535 Len=0
51068  20.975472 77.197.128.225 -> 41.177.26.176 TCP 64 38905 > http [ACK] Seq=308 Ack=2429 Win=65535 Len=0
51069  20.975533 77.197.128.225 -> 41.177.26.176 TCP 64 38905 > http [ACK] Seq=308 Ack=3903 Win=65535 Len=0
51287  21.057347 77.197.128.225 -> 41.177.26.176 TCP 64 38905 > http [ACK] Seq=308 Ack=6067 Win=65535 Len=0
51288  21.057352 77.197.128.225 -> 41.177.26.176 TCP 64 38905 > http [ACK] Seq=308 Ack=8322 Win=65535 Len=0
51477  21.138710 77.197.128.225 -> 41.177.26.176 TCP 64 38905 > http [ACK] Seq=308 Ack=9782 Win=65535 Len=0
51483  21.139265 77.197.128.225 -> 41.177.26.176 TCP 64 38905 > http [ACK] Seq=308 Ack=11361 Win=65535 Len=0
51486  21.139530 77.197.128.225 -> 41.177.26.176 TCP 64 38905 > http [RST, ACK] Seq=308 Ack=11361 Win=0 Len=0
51738  21.298149 77.197.128.225 -> 41.177.26.176 TCP 66 39325 > http [SYN] Seq=0 Win=65535 Len=0 MSS=1460 SACK_PERM=1
51906  21.379737 77.197.128.225 -> 41.177.26.176 TCP 64 39325 > http [ACK] Seq=1 Ack=1 Win=65535 Len=0
53876  22.266733 77.197.128.225 -> 41.177.26.176 TCP 64 39325 > http [ACK] Seq=341 Ack=1778 Win=65535 Len=0
53897  22.277513 77.197.128.225 -> 41.177.26.176 TCP 64 39325 > http [ACK] Seq=341 Ack=2693 Win=64620 Len=0
53898  22.277598 77.197.128.225 -> 41.177.26.176 TCP 64 39325 > http [ACK] Seq=341 Ack=3034 Win=64279 Len=0
53900  22.277699 77.197.128.225 -> 41.177.26.176 TCP 64 39325 > http [ACK] Seq=341 Ack=4054 Win=65535 Len=0
54108  22.349013 77.197.128.225 -> 41.177.26.176 TCP 64 39325 > http [ACK] Seq=341 Ack=6846 Win=65535 Len=0
54114  22.359260 77.197.128.225 -> 41.177.26.176 TCP 64 39325 > http [ACK] Seq=341 Ack=9766 Win=65535 Len=0
54115  22.359714 77.197.128.225 -> 41.177.26.176 TCP 64 39325 > http [RST, ACK] Seq=341 Ack=10908 Win=0 Len=0
54342  22.526870 77.197.128.225 -> 41.177.26.176 TCP 66 39942 > http [SYN] Seq=0 Win=65535 Len=0 MSS=1460 SACK_PERM=1
54588  22.608501 77.197.128.225 -> 41.177.26.176 TCP 64 39942 > http [ACK] Seq=1 Ack=1 Win=65535 Len=0
55948  22.996508 77.197.128.225 -> 41.177.26.176 TCP 64 39942 > http [ACK] Seq=318 Ack=3896 Win=65535 Len=0
56205  23.078386 77.197.128.225 -> 41.177.26.176 TCP 64 39942 > http [ACK] Seq=318 Ack=6070 Win=65535 Len=0
56206  23.078391 77.197.128.225 -> 41.177.26.176 TCP 64 39942 > http [ACK] Seq=318 Ack=7967 Win=65535 Len=0
56380  23.160132 77.197.128.225 -> 41.177.26.176 TCP 64 39942 > http [ACK] Seq=318 Ack=10379 Win=65535 Len=0
56381  23.160502 77.197.128.225 -> 41.177.26.176 TCP 64 39942 > http [RST, ACK] Seq=318 Ack=11061 Win=0 Len=0
56791  23.312465 77.197.128.225 -> 41.177.26.176 TCP 66 40385 > http [SYN] Seq=0 Win=65535 Len=0 MSS=1460 SACK_PERM=1
57060  23.394224 77.197.128.225 -> 41.177.26.176 TCP 64 40385 > http [ACK] Seq=1 Ack=1 Win=65535 Len=0
59150  23.848092 77.197.128.225 -> 41.177.26.176 TCP 64 40385 > http [ACK] Seq=318 Ack=2431 Win=65535 Len=0
59151  23.848096 77.197.128.225 -> 41.177.26.176 TCP 64 40385 > http [ACK] Seq=318 Ack=3896 Win=65535 Len=0
59427  23.929723 77.197.128.225 -> 41.177.26.176 TCP 64 40385 > http [ACK] Seq=318 Ack=6070 Win=65535 Len=0
59428  23.929777 77.197.128.225 -> 41.177.26.176 TCP 64 40385 > http [ACK] Seq=318 Ack=7908 Win=65535 Len=0
59429  23.929889 77.197.128.225 -> 41.177.26.176 TCP 64 40385 > http [ACK] Seq=318 Ack=11184 Win=65535 Len=0
59431  23.930213 77.197.128.225 -> 41.177.26.176 TCP 64 40385 > http [RST, ACK] Seq=318 Ack=11184 Win=0 Len=0
59434  23.931646 77.197.128.225 -> 41.177.26.176 TCP 66 40721 > http [SYN] Seq=0 Win=65535 Len=0 MSS=1460 SACK_PERM=1
59655  24.013688 77.197.128.225 -> 41.177.26.176 TCP 64 40721 > http [ACK] Seq=1 Ack=1 Win=65535 Len=0
60336  24.392964 77.197.128.225 -> 41.177.26.176 TCP 64 40721 > http [ACK] Seq=293 Ack=2241 Win=65535 Len=0
60463  24.474681 77.197.128.225 -> 41.177.26.176 TCP 64 40721 > http [ACK] Seq=293 Ack=4672 Win=65535 Len=0
60467  24.475060 77.197.128.225 -> 41.177.26.176 TCP 64 40721 > http [ACK] Seq=293 Ack=7019 Win=65535 Len=0
60629  24.556522 77.197.128.225 -> 41.177.26.176 TCP 64 40721 > http [ACK] Seq=293 Ack=9912 Win=65535 Len=0
60633  24.557032 77.197.128.225 -> 41.177.26.176 TCP 64 40721 > http [ACK] Seq=293 Ack=12724 Win=64215 Len=0
60634  24.557037 77.197.128.225 -> 41.177.26.176 TCP 64 [TCP Dup ACK 60633#1] 40721 > http [ACK] Seq=293 Ack=12724 Win=64215 Len=0
60639  24.557491 77.197.128.225 -> 41.177.26.176 TCP 64 40721 > http [ACK] Seq=293 Ack=15545 Win=65535 Len=0
60738  24.638711 77.197.128.225 -> 41.177.26.176 TCP 64 40721 > http [ACK] Seq=293 Ack=19766 Win=65535 Len=0
60739  24.639638 77.197.128.225 -> 41.177.26.176 TCP 64 40721 > http [ACK] Seq=293 Ack=24313 Win=64959 Len=0
60740  24.639643 77.197.128.225 -> 41.177.26.176 TCP 64 [TCP Dup ACK 60739#1] 40721 > http [ACK] Seq=293 Ack=24313 Win=64959 Len=0
60741  24.641061 77.197.128.225 -> 41.177.26.176 TCP 64 40721 > http [RST, ACK] Seq=293 Ack=24313 Win=0 Len=0
60896  24.765824 77.197.128.225 -> 41.177.26.176 TCP 66 41148 > http [SYN] Seq=0 Win=65535 Len=0 MSS=1460 SACK_PERM=1
60998  24.848061 77.197.128.225 -> 41.177.26.176 TCP 64 41148 > http [ACK] Seq=1 Ack=1 Win=65535 Len=0
61681  25.223813 77.197.128.225 -> 41.177.26.176 TCP 64 41148 > http [ACK] Seq=309 Ack=2431 Win=65535 Len=0
61683  25.223934 77.197.128.225 -> 41.177.26.176 TCP 64 41148 > http [ACK] Seq=309 Ack=3904 Win=65535 Len=0
61809  25.305640 77.197.128.225 -> 41.177.26.176 TCP 64 41148 > http [ACK] Seq=309 Ack=6074 Win=65535 Len=0
61810  25.305945 77.197.128.225 -> 41.177.26.176 TCP 64 41148 > http [ACK] Seq=309 Ack=11182 Win=65535 Len=0
61811  25.306405 77.197.128.225 -> 41.177.26.176 TCP 64 41148 > http [RST, ACK] Seq=309 Ack=11182 Win=0 Len=0
61957  25.404047 77.197.128.225 -> 41.177.26.176 TCP 66 41516 > http [SYN] Seq=0 Win=65535 Len=0 MSS=1460 SACK_PERM=1
62126  25.485777 77.197.128.225 -> 41.177.26.176 TCP 64 41516 > http [ACK] Seq=1 Ack=1 Win=65535 Len=0
63037  25.952824 77.197.128.225 -> 41.177.26.176 TCP 64 41516 > http [ACK] Seq=310 Ack=3912 Win=65535 Len=0
63135  26.034624 77.197.128.225 -> 41.177.26.176 TCP 64 41516 > http [ACK] Seq=310 Ack=7263 Win=65535 Len=0
63251  26.116583 77.197.128.225 -> 41.177.26.176 TCP 64 41516 > http [ACK] Seq=310 Ack=10183 Win=65535 Len=0
63252  26.116834 77.197.128.225 -> 41.177.26.176 TCP 64 41516 > http [RST, ACK] Seq=310 Ack=11383 Win=0 Len=0
63529  26.251098 77.197.128.225 -> 41.177.26.176 TCP 66 42004 > http [SYN] Seq=0 Win=65535 Len=0 MSS=1460 SACK_PERM=1
63727  26.332913 77.197.128.225 -> 41.177.26.176 TCP 64 42004 > http [ACK] Seq=1 Ack=1 Win=65535 Len=0
64626  26.697668 77.197.128.225 -> 41.177.26.176 TCP 64 42004 > http [ACK] Seq=308 Ack=2431 Win=65535 Len=0
64627  26.697673 77.197.128.225 -> 41.177.26.176 TCP 64 42004 > http [ACK] Seq=308 Ack=3905 Win=65535 Len=0
64950  26.779653 77.197.128.225 -> 41.177.26.176 TCP 64 42004 > http [ACK] Seq=308 Ack=6069 Win=65535 Len=0
64951  26.779657 77.197.128.225 -> 41.177.26.176 TCP 64 42004 > http [ACK] Seq=308 Ack=11177 Win=65535 Len=0
64952  26.779801 77.197.128.225 -> 41.177.26.176 TCP 64 42004 > http [RST, ACK] Seq=308 Ack=11177 Win=0 Len=0
64977  26.798497 77.197.128.225 -> 41.177.26.176 TCP 66 42342 > http [SYN] Seq=0 Win=65535 Len=0 MSS=1460 SACK_PERM=1
65134  26.880492 77.197.128.225 -> 41.177.26.176 TCP 64 42342 > http [ACK] Seq=1 Ack=1 Win=65535 Len=0
66340  27.340735 77.197.128.225 -> 41.177.26.176 TCP 64 42342 > http [ACK] Seq=318 Ack=2431 Win=65535 Len=0
66341  27.340855 77.197.128.225 -> 41.177.26.176 TCP 64 42342 > http [ACK] Seq=318 Ack=3896 Win=65535 Len=0
66515  27.422899 77.197.128.225 -> 41.177.26.176 TCP 64 42342 > http [ACK] Seq=318 Ack=6070 Win=65535 Len=0
66516  27.422904 77.197.128.225 -> 41.177.26.176 TCP 64 42342 > http [ACK] Seq=318 Ack=8607 Win=65535 Len=0
66724  27.504570 77.197.128.225 -> 41.177.26.176 TCP 64 42342 > http [ACK] Seq=318 Ack=11463 Win=65535 Len=0
66726  27.504949 77.197.128.225 -> 41.177.26.176 TCP 64 42342 > http [RST, ACK] Seq=318 Ack=11463 Win=0 Len=0
67058  27.608874 77.197.128.225 -> 41.177.26.176 TCP 66 42826 > http [SYN] Seq=0 Win=65535 Len=0 MSS=1460 SACK_PERM=1
67326  27.690487 77.197.128.225 -> 41.177.26.176 TCP 64 42826 > http [ACK] Seq=1 Ack=1 Win=65535 Len=0
68383  28.159607 77.197.128.225 -> 41.177.26.176 TCP 64 42826 > http [ACK] Seq=356 Ack=2427 Win=65535 Len=0
68483  28.241360 77.197.128.225 -> 41.177.26.176 TCP 64 42826 > http [ACK] Seq=356 Ack=5347 Win=65535 Len=0
68484  28.241482 77.197.128.225 -> 41.177.26.176 TCP 64 42826 > http [ACK] Seq=356 Ack=7939 Win=65535 Len=0
68602  28.323163 77.197.128.225 -> 41.177.26.176 TCP 64 42826 > http [ACK] Seq=356 Ack=9539 Win=65535 Len=0
68603  28.323327 77.197.128.225 -> 41.177.26.176 TCP 64 42826 > http [ACK] Seq=356 Ack=11616 Win=63458 Len=0
68604  28.323332 77.197.128.225 -> 41.177.26.176 TCP 64 [TCP Window Update] 42826 > http [ACK] Seq=356 Ack=11616 Win=65535 Len=0
68605  28.323336 77.197.128.225 -> 41.177.26.176 TCP 64 42826 > http [RST, ACK] Seq=356 Ack=11616 Win=0 Len=0
68733  28.422667 77.197.128.225 -> 41.177.26.176 TCP 66 43012 > http [SYN] Seq=0 Win=65535 Len=0 MSS=1460 SACK_PERM=1
68922  28.504481 77.197.128.225 -> 41.177.26.176 TCP 64 43012 > http [ACK] Seq=1 Ack=1 Win=65535 Len=0
71083  29.366265 77.197.128.225 -> 41.177.26.176 TCP 64 43012 > http [ACK] Seq=326 Ack=2088 Win=65535 Len=0
71086  29.366592 77.197.128.225 -> 41.177.26.176 TCP 64 43012 > http [ACK] Seq=326 Ack=2550 Win=65073 Len=0
71091  29.366742 77.197.128.225 -> 41.177.26.176 TCP 64 43012 > http [ACK] Seq=326 Ack=2875 Win=64748 Len=0
71418  29.447989 77.197.128.225 -> 41.177.26.176 TCP 64 43012 > http [ACK] Seq=326 Ack=5052 Win=65535 Len=0
71419  29.448210 77.197.128.225 -> 41.177.26.176 TCP 64 43012 > http [ACK] Seq=326 Ack=7508 Win=65535 Len=0
71420  29.448448 77.197.128.225 -> 41.177.26.176 TCP 64 43012 > http [ACK] Seq=326 Ack=9909 Win=65535 Len=0
71421  29.448737 77.197.128.225 -> 41.177.26.176 TCP 64 43012 > http [RST, ACK] Seq=326 Ack=9909 Win=0 Len=0
71442  29.456911 77.197.128.225 -> 41.177.26.176 TCP 66 43175 > http [SYN] Seq=0 Win=65535 Len=0 MSS=1460 SACK_PERM=1
71857  29.538593 77.197.128.225 -> 41.177.26.176 TCP 64 43175 > http [ACK] Seq=1 Ack=1 Win=65535 Len=0
73596  29.983418 77.197.128.225 -> 41.177.26.176 TCP 64 43175 > http [ACK] Seq=319 Ack=2431 Win=65535 Len=0
73917  30.065110 77.197.128.225 -> 41.177.26.176 TCP 64 43175 > http [ACK] Seq=319 Ack=5351 Win=65535 Len=0
73923  30.065295 77.197.128.225 -> 41.177.26.176 TCP 64 43175 > http [ACK] Seq=319 Ack=7528 Win=65535 Len=0
74172  30.146849 77.197.128.225 -> 41.177.26.176 TCP 64 43175 > http [ACK] Seq=319 Ack=10520 Win=65535 Len=0
74175  30.147205 77.197.128.225 -> 41.177.26.176 TCP 64 43175 > http [RST, ACK] Seq=319 Ack=11202 Win=0 Len=0
74473  30.248736 77.197.128.225 -> 41.177.26.176 TCP 66 43263 > http [SYN] Seq=0 Win=65535 Len=0 MSS=1460 SACK_PERM=1
74798  30.330481 77.197.128.225 -> 41.177.26.176 TCP 64 43263 > http [ACK] Seq=1 Ack=1 Win=65535 Len=0
77137  30.808978 77.197.128.225 -> 41.177.26.176 TCP 64 43263 > http [ACK] Seq=318 Ack=2431 Win=65535 Len=0
77140  30.809097 77.197.128.225 -> 41.177.26.176 TCP 64 43263 > http [ACK] Seq=318 Ack=3896 Win=65535 Len=0
77404  30.890722 77.197.128.225 -> 41.177.26.176 TCP 64 43263 > http [ACK] Seq=318 Ack=6070 Win=65535 Len=0
77405  30.890889 77.197.128.225 -> 41.177.26.176 TCP 64 43263 > http [ACK] Seq=318 Ack=8990 Win=65535 Len=0
77406  30.890911 77.197.128.225 -> 41.177.26.176 TCP 64 43263 > http [ACK] Seq=318 Ack=11163 Win=65535 Len=0
77415  30.891287 77.197.128.225 -> 41.177.26.176 TCP 64 43263 > http [RST, ACK] Seq=318 Ack=11163 Win=0 Len=0
77975  31.064477 77.197.128.225 -> 41.177.26.176 TCP 66 43377 > http [SYN] Seq=0 Win=65535 Len=0 MSS=1460 SACK_PERM=1
78336  31.146171 77.197.128.225 -> 41.177.26.176 TCP 64 43377 > http [ACK] Seq=1 Ack=1 Win=65535 Len=0
79751  31.546811 77.197.128.225 -> 41.177.26.176 TCP 64 43377 > http [ACK] Seq=318 Ack=2245 Win=65535 Len=0
79752  31.546815 77.197.128.225 -> 41.177.26.176 TCP 64 43377 > http [ACK] Seq=318 Ack=3896 Win=65535 Len=0
80421  31.628464 77.197.128.225 -> 41.177.26.176 TCP 64 43377 > http [ACK] Seq=318 Ack=6064 Win=65535 Len=0
80423  31.628604 77.197.128.225 -> 41.177.26.176 TCP 64 43377 > http [ACK] Seq=318 Ack=8984 Win=65535 Len=0
80469  31.639322 77.197.128.225 -> 41.177.26.176 TCP 64 43377 > http [ACK] Seq=318 Ack=10444 Win=65535 Len=0
80871  31.710419 77.197.128.225 -> 41.177.26.176 TCP 64 43377 > http [RST, ACK] Seq=318 Ack=11434 Win=0 Len=0
81641  31.874610 77.197.128.225 -> 41.177.26.176 TCP 66 43488 > http [SYN] Seq=0 Win=65535 Len=0 MSS=1460 SACK_PERM=1
81948  31.956302 77.197.128.225 -> 41.177.26.176 TCP 64 43488 > http [ACK] Seq=1 Ack=1 Win=65535 Len=0
83214  32.355094 77.197.128.225 -> 41.177.26.176 TCP 64 43488 > http [ACK] Seq=285 Ack=3205 Win=65535 Len=0
83421  32.436866 77.197.128.225 -> 41.177.26.176 TCP 64 43488 > http [ACK] Seq=285 Ack=5914 Win=65535 Len=0
83424  32.437203 77.197.128.225 -> 41.177.26.176 TCP 64 43488 > http [ACK] Seq=285 Ack=8636 Win=65535 Len=0
83640  32.518773 77.197.128.225 -> 41.177.26.176 TCP 64 43488 > http [ACK] Seq=285 Ack=12625 Win=64307 Len=0
83641  32.518778 77.197.128.225 -> 41.177.26.176 TCP 64 [TCP Dup ACK 83640#1] 43488 > http [ACK] Seq=285 Ack=12625 Win=64307 Len=0
83642  32.519003 77.197.128.225 -> 41.177.26.176 TCP 64 43488 > http [ACK] Seq=285 Ack=16592 Win=65535 Len=0
83926  32.600625 77.197.128.225 -> 41.177.26.176 TCP 64 43488 > http [ACK] Seq=285 Ack=19394 Win=65535 Len=0
83929  32.600781 77.197.128.225 -> 41.177.26.176 TCP 64 43488 > http [ACK] Seq=285 Ack=22194 Win=62735 Len=0
83930  32.600786 77.197.128.225 -> 41.177.26.176 TCP 64 [TCP Window Update] 43488 > http [ACK] Seq=285 Ack=22194 Win=65535 Len=0
83932  32.601187 77.197.128.225 -> 41.177.26.176 TCP 64 43488 > http [ACK] Seq=285 Ack=25079 Win=65535 Len=0
83936  32.601835 77.197.128.225 -> 41.177.26.176 TCP 64 43488 > http [RST, ACK] Seq=285 Ack=25079 Win=0 Len=0
86177  33.480351 77.197.128.225 -> 41.177.26.176 TCP 66 43701 > http [SYN] Seq=0 Win=65535 Len=0 MSS=1460 SACK_PERM=1
86392  33.562459 77.197.128.225 -> 41.177.26.176 TCP 64 43701 > http [ACK] Seq=1 Ack=1 Win=65535 Len=0
87969  34.066815 77.197.128.225 -> 41.177.26.176 TCP 64 43701 > http [ACK] Seq=356 Ack=2431 Win=65535 Len=0
87970  34.066820 77.197.128.225 -> 41.177.26.176 TCP 64 43701 > http [ACK] Seq=356 Ack=4057 Win=65535 Len=0
88236  34.148858 77.197.128.225 -> 41.177.26.176 TCP 64 43701 > http [ACK] Seq=356 Ack=6237 Win=65535 Len=0
88237  34.148863 77.197.128.225 -> 41.177.26.176 TCP 64 43701 > http [ACK] Seq=356 Ack=8476 Win=65535 Len=0
88239  34.148979 77.197.128.225 -> 41.177.26.176 TCP 64 43701 > http [ACK] Seq=356 Ack=9936 Win=65535 Len=0
88577  34.230620 77.197.128.225 -> 41.177.26.176 TCP 64 43701 > http [ACK] Seq=356 Ack=11533 Win=65535 Len=0
88578  34.230732 77.197.128.225 -> 41.177.26.176 TCP 64 43701 > http [RST, ACK] Seq=356 Ack=11533 Win=0 Len=0
122019  43.448389 77.197.128.225 -> 41.177.26.176 TCP 66 49979 > http [SYN] Seq=0 Win=65535 Len=0 MSS=1460 SACK_PERM=1
122270  43.530276 77.197.128.225 -> 41.177.26.176 TCP 64 49979 > http [ACK] Seq=1 Ack=1 Win=65535 Len=0
123575  43.957541 77.197.128.225 -> 41.177.26.176 TCP 64 49979 > http [ACK] Seq=355 Ack=2431 Win=65535 Len=0
123576  43.957838 77.197.128.225 -> 41.177.26.176 TCP 64 49979 > http [ACK] Seq=355 Ack=4065 Win=65535 Len=0
123675  44.039375 77.197.128.225 -> 41.177.26.176 TCP 64 49979 > http [ACK] Seq=355 Ack=6239 Win=65535 Len=0
123676  44.039534 77.197.128.225 -> 41.177.26.176 TCP 64 49979 > http [ACK] Seq=355 Ack=7965 Win=65535 Len=0
123677  44.039684 77.197.128.225 -> 41.177.26.176 TCP 64 49979 > http [ACK] Seq=355 Ack=11248 Win=65535 Len=0
123678  44.039813 77.197.128.225 -> 41.177.26.176 TCP 64 49979 > http [RST, ACK] Seq=355 Ack=11248 Win=0 Len=0
143402  49.280212 77.197.128.225 -> 41.177.26.176 TCP 66 52576 > http [SYN] Seq=0 Win=65535 Len=0 MSS=1460 SACK_PERM=1
143686  49.362055 77.197.128.225 -> 41.177.26.176 TCP 64 52576 > http [ACK] Seq=1 Ack=1 Win=65535 Len=0
145110  49.750414 77.197.128.225 -> 41.177.26.176 TCP 64 52576 > http [ACK] Seq=308 Ack=2431 Win=65535 Len=0
145358  49.832096 77.197.128.225 -> 41.177.26.176 TCP 64 52576 > http [ACK] Seq=308 Ack=6062 Win=65535 Len=0
145642  49.913895 77.197.128.225 -> 41.177.26.176 TCP 64 52576 > http [ACK] Seq=308 Ack=8401 Win=65535 Len=0
145643  49.914034 77.197.128.225 -> 41.177.26.176 TCP 64 52576 > http [ACK] Seq=308 Ack=11271 Win=65535 Len=0
145647  49.914393 77.197.128.225 -> 41.177.26.176 TCP 64 52576 > http [RST, ACK] Seq=308 Ack=11271 Win=0 Len=0
148103  50.831683 77.197.128.225 -> 41.177.26.176 TCP 66 53592 > http [SYN] Seq=0 Win=65535 Len=0 MSS=1460 SACK_PERM=1
148246  50.913617 77.197.128.225 -> 41.177.26.176 TCP 64 53592 > http [ACK] Seq=1 Ack=1 Win=65535 Len=0
151333  51.897571 77.197.128.225 -> 41.177.26.176 TCP 64 53592 > http [ACK] Seq=339 Ack=2111 Win=65535 Len=0
151357  51.908563 77.197.128.225 -> 41.177.26.176 TCP 64 53592 > http [ACK] Seq=339 Ack=3017 Win=64629 Len=0
151360  51.908917 77.197.128.225 -> 41.177.26.176 TCP 64 53592 > http [ACK] Seq=339 Ack=3499 Win=64147 Len=0
151623  51.979385 77.197.128.225 -> 41.177.26.176 TCP 64 53592 > http [ACK] Seq=339 Ack=7267 Win=65535 Len=0
151674  51.990433 77.197.128.225 -> 41.177.26.176 TCP 64 53592 > http [ACK] Seq=339 Ack=9648 Win=65535 Len=0
151963  52.061114 77.197.128.225 -> 41.177.26.176 TCP 64 53592 > http [ACK] Seq=339 Ack=12357 Win=65535 Len=0
151964  52.061394 77.197.128.225 -> 41.177.26.176 TCP 64 53592 > http [RST, ACK] Seq=339 Ack=12357 Win=0 Len=0
152516  52.233929 77.197.128.225 -> 41.177.26.176 TCP 66 54528 > http [SYN] Seq=0 Win=65535 Len=0 MSS=1460 SACK_PERM=1
152782  52.315734 77.197.128.225 -> 41.177.26.176 TCP 64 54528 > http [ACK] Seq=1 Ack=1 Win=65535 Len=0
158028  53.841683 77.197.128.225 -> 41.177.26.176 TCP 64 54528 > http [ACK] Seq=315 Ack=2204 Win=65535 Len=0
158035  53.842052 77.197.128.225 -> 41.177.26.176 TCP 64 54528 > http [ACK] Seq=315 Ack=2778 Win=64961 Len=0
158037  53.842435 77.197.128.225 -> 41.177.26.176 TCP 64 54528 > http [ACK] Seq=315 Ack=4250 Win=65535 Len=0
158324  53.923646 77.197.128.225 -> 41.177.26.176 TCP 64 54528 > http [ACK] Seq=315 Ack=6407 Win=65535 Len=0
158326  53.923896 77.197.128.225 -> 41.177.26.176 TCP 64 54528 > http [ACK] Seq=315 Ack=9327 Win=65535 Len=0
158327  53.924044 77.197.128.225 -> 41.177.26.176 TCP 64 54528 > http [ACK] Seq=315 Ack=10808 Win=65535 Len=0
158526  54.005239 77.197.128.225 -> 41.177.26.176 TCP 64 54528 > http [ACK] Seq=315 Ack=13299 Win=64678 Len=0
158527  54.005260 77.197.128.225 -> 41.177.26.176 TCP 64 [TCP Dup ACK 158526#1] 54528 > http [ACK] Seq=315 Ack=13299 Win=64678 Len=0
158529  54.005522 77.197.128.225 -> 41.177.26.176 TCP 64 54528 > http [RST, ACK] Seq=315 Ack=13299 Win=0 Len=0
159114  54.174598 77.197.128.225 -> 41.177.26.176 TCP 66 55424 > http [SYN] Seq=0 Win=65535 Len=0 MSS=1460 SACK_PERM=1
159392  54.256409 77.197.128.225 -> 41.177.26.176 TCP 64 55424 > http [ACK] Seq=1 Ack=1 Win=65535 Len=0
160433  54.624762 77.197.128.225 -> 41.177.26.176 TCP 64 55424 > http [ACK] Seq=308 Ack=2720 Win=65535 Len=0
160658  54.706485 77.197.128.225 -> 41.177.26.176 TCP 64 55424 > http [ACK] Seq=308 Ack=6076 Win=65535 Len=0
160957  54.788249 77.197.128.225 -> 41.177.26.176 TCP 64 55424 > http [ACK] Seq=308 Ack=8324 Win=65535 Len=0
160958  54.788405 77.197.128.225 -> 41.177.26.176 TCP 64 55424 > http [ACK] Seq=308 Ack=11194 Win=65535 Len=0
160959  54.788613 77.197.128.225 -> 41.177.26.176 TCP 64 55424 > http [RST, ACK] Seq=308 Ack=11194 Win=0 Len=0
161293  54.896365 77.197.128.225 -> 41.177.26.176 TCP 66 55752 > http [SYN] Seq=0 Win=65535 Len=0 MSS=1460 SACK_PERM=1
161506  54.978309 77.197.128.225 -> 41.177.26.176 TCP 64 55752 > http [ACK] Seq=1 Ack=1 Win=65535 Len=0
163501  55.446941 77.197.128.225 -> 41.177.26.176 TCP 64 55752 > http [ACK] Seq=303 Ack=2924 Win=65535 Len=0
163801  55.528812 77.197.128.225 -> 41.177.26.176 TCP 64 55752 > http [ACK] Seq=303 Ack=6091 Win=65535 Len=0
164120  55.610419 77.197.128.225 -> 41.177.26.176 TCP 64 55752 > http [ACK] Seq=303 Ack=8560 Win=65535 Len=0
164121  55.610563 77.197.128.225 -> 41.177.26.176 TCP 64 55752 > http [ACK] Seq=303 Ack=11610 Win=65535 Len=0
164123  55.610746 77.197.128.225 -> 41.177.26.176 TCP 64 55752 > http [RST, ACK] Seq=303 Ack=11610 Win=0 Len=0
164475  55.695953 77.197.128.225 -> 41.177.26.176 TCP 66 56036 > http [SYN] Seq=0 Win=65535 Len=0 MSS=1460 SACK_PERM=1
164790  55.778504 77.197.128.225 -> 41.177.26.176 TCP 64 56036 > http [ACK] Seq=1 Ack=1 Win=65535 Len=0
173949  57.830160 77.197.128.225 -> 41.177.26.176 TCP 64 56036 > http [ACK] Seq=318 Ack=4381 Win=65535 Len=0
174265  57.911959 77.197.128.225 -> 41.177.26.176 TCP 64 56036 > http [ACK] Seq=318 Ack=8761 Win=65535 Len=0
174565  57.993631 77.197.128.225 -> 41.177.26.176 TCP 64 56036 > http [ACK] Seq=318 Ack=11681 Win=65535 Len=0
174566  57.993731 77.197.128.225 -> 41.177.26.176 TCP 64 56036 > http [ACK] Seq=318 Ack=16061 Win=65535 Len=0
174778  58.075382 77.197.128.225 -> 41.177.26.176 TCP 64 56036 > http [ACK] Seq=318 Ack=19119 Win=65535 Len=0
174779  58.076335 77.197.128.225 -> 41.177.26.176 TCP 64 56036 > http [RST, ACK] Seq=318 Ack=19119 Win=0 Len=0
174827  58.112271 77.197.128.225 -> 41.177.26.176 TCP 66 56689 > http [SYN] Seq=0 Win=65535 Len=0 MSS=1460 SACK_PERM=1
175047  58.193999 77.197.128.225 -> 41.177.26.176 TCP 64 56689 > http [ACK] Seq=1 Ack=1 Win=65535 Len=0
176097  58.599718 77.197.128.225 -> 41.177.26.176 TCP 64 56689 > http [ACK] Seq=309 Ack=2431 Win=65535 Len=0
176230  58.681464 77.197.128.225 -> 41.177.26.176 TCP 64 56689 > http [ACK] Seq=309 Ack=6069 Win=65535 Len=0
176317  58.763268 77.197.128.225 -> 41.177.26.176 TCP 64 56689 > http [ACK] Seq=309 Ack=7904 Win=65535 Len=0
176318  58.763793 77.197.128.225 -> 41.177.26.176 TCP 64 56689 > http [ACK] Seq=309 Ack=11172 Win=64986 Len=0
176319  58.763798 77.197.128.225 -> 41.177.26.176 TCP 64 [TCP Dup ACK 176318#1] 56689 > http [ACK] Seq=309 Ack=11172 Win=64986 Len=0
176320  58.764183 77.197.128.225 -> 41.177.26.176 TCP 64 56689 > http [RST, ACK] Seq=309 Ack=11172 Win=0 Len=0
176547  58.951672 77.197.128.225 -> 41.177.26.176 TCP 66 56867 > http [SYN] Seq=0 Win=65535 Len=0 MSS=1460 SACK_PERM=1
176639  59.033372 77.197.128.225 -> 41.177.26.176 TCP 64 56867 > http [ACK] Seq=1 Ack=1 Win=65535 Len=0
177223  59.430948 77.197.128.225 -> 41.177.26.176 TCP 64 56867 > http [ACK] Seq=305 Ack=3903 Win=65535 Len=0
177335  59.512932 77.197.128.225 -> 41.177.26.176 TCP 64 56867 > http [ACK] Seq=305 Ack=6077 Win=65535 Len=0
177336  59.512936 77.197.128.225 -> 41.177.26.176 TCP 64 56867 > http [ACK] Seq=305 Ack=7966 Win=65535 Len=0
177520  59.594643 77.197.128.225 -> 41.177.26.176 TCP 64 56867 > http [ACK] Seq=305 Ack=11072 Win=65535 Len=0
177521  59.595046 77.197.128.225 -> 41.177.26.176 TCP 64 56867 > http [RST, ACK] Seq=305 Ack=11072 Win=0 Len=0
178081  59.781332 77.197.128.225 -> 41.177.26.176 TCP 66 57017 > http [SYN] Seq=0 Win=65535 Len=0 MSS=1460 SACK_PERM=1
178321  59.863286 77.197.128.225 -> 41.177.26.176 TCP 64 57017 > http [ACK] Seq=1 Ack=1 Win=65535 Len=0
179216  60.257737 77.197.128.225 -> 41.177.26.176 TCP 64 57017 > http [ACK] Seq=306 Ack=2431 Win=65535 Len=0
179218  60.257869 77.197.128.225 -> 41.177.26.176 TCP 64 57017 > http [ACK] Seq=306 Ack=3899 Win=65535 Len=0
179351  60.339498 77.197.128.225 -> 41.177.26.176 TCP 64 57017 > http [ACK] Seq=306 Ack=6055 Win=65535 Len=0
179352  60.339657 77.197.128.225 -> 41.177.26.176 TCP 64 57017 > http [ACK] Seq=306 Ack=8213 Win=65535 Len=0
179354  60.339775 77.197.128.225 -> 41.177.26.176 TCP 64 57017 > http [ACK] Seq=306 Ack=11051 Win=65535 Len=0
179355  60.340093 77.197.128.225 -> 41.177.26.176 TCP 64 57017 > http [RST, ACK] Seq=306 Ack=11051 Win=0 Len=0
179459  60.405969 77.197.128.225 -> 41.177.26.176 TCP 66 57137 > http [SYN] Seq=0 Win=65535 Len=0 MSS=1460 SACK_PERM=1
179640  60.487756 77.197.128.225 -> 41.177.26.176 TCP 64 57137 > http [ACK] Seq=1 Ack=1 Win=65535 Len=0
180793  60.871727 77.197.128.225 -> 41.177.26.176 TCP 64 57137 > http [ACK] Seq=310 Ack=3907 Win=65535 Len=0
181190  60.953531 77.197.128.225 -> 41.177.26.176 TCP 64 57137 > http [ACK] Seq=310 Ack=6081 Win=65535 Len=0
181191  60.953639 77.197.128.225 -> 41.177.26.176 TCP 64 57137 > http [ACK] Seq=310 Ack=8617 Win=65535 Len=0
181549  61.035476 77.197.128.225 -> 41.177.26.176 TCP 64 57137 > http [ACK] Seq=310 Ack=11466 Win=65535 Len=0
181550  61.035720 77.197.128.225 -> 41.177.26.176 TCP 64 57137 > http [RST, ACK] Seq=310 Ack=11466 Win=0 Len=0
182062  61.197681 77.197.128.225 -> 41.177.26.176 TCP 66 57293 > http [SYN] Seq=0 Win=65535 Len=0 MSS=1460 SACK_PERM=1
182342  61.279407 77.197.128.225 -> 41.177.26.176 TCP 64 57293 > http [ACK] Seq=1 Ack=1 Win=65535 Len=0
183523  61.662416 77.197.128.225 -> 41.177.26.176 TCP 64 57293 > http [ACK] Seq=301 Ack=2431 Win=65535 Len=0
183526  61.662670 77.197.128.225 -> 41.177.26.176 TCP 64 57293 > http [ACK] Seq=301 Ack=3908 Win=65535 Len=0
183759  61.744293 77.197.128.225 -> 41.177.26.176 TCP 64 57293 > http [ACK] Seq=301 Ack=6082 Win=65535 Len=0
183760  61.744391 77.197.128.225 -> 41.177.26.176 TCP 64 57293 > http [ACK] Seq=301 Ack=8340 Win=65535 Len=0
183761  61.744551 77.197.128.225 -> 41.177.26.176 TCP 64 57293 > http [ACK] Seq=301 Ack=11189 Win=65535 Len=0
183762  61.744782 77.197.128.225 -> 41.177.26.176 TCP 64 57293 > http [RST, ACK] Seq=301 Ack=11189 Win=0 Len=0
183929  61.812743 77.197.128.225 -> 41.177.26.176 TCP 66 57427 > http [SYN] Seq=0 Win=65535 Len=0 MSS=1460 SACK_PERM=1
184219  61.894305 77.197.128.225 -> 41.177.26.176 TCP 64 57427 > http [ACK] Seq=1 Ack=1 Win=65535 Len=0
186030  62.354580 77.197.128.225 -> 41.177.26.176 TCP 64 57427 > http [ACK] Seq=309 Ack=2245 Win=65535 Len=0
186162  62.436572 77.197.128.225 -> 41.177.26.176 TCP 64 57427 > http [ACK] Seq=309 Ack=6076 Win=65535 Len=0
186361  62.518311 77.197.128.225 -> 41.177.26.176 TCP 64 57427 > http [ACK] Seq=309 Ack=8996 Win=65535 Len=0
186362  62.518433 77.197.128.225 -> 41.177.26.176 TCP 64 57427 > http [ACK] Seq=309 Ack=11276 Win=65535 Len=0
186365  62.518675 77.197.128.225 -> 41.177.26.176 TCP 64 57427 > http [RST, ACK] Seq=309 Ack=11276 Win=0 Len=0
187412  63.330753 77.197.128.225 -> 41.177.26.176 TCP 66 57539 > http [SYN] Seq=0 Win=65535 Len=0 MSS=1460 SACK_PERM=1
187509  63.412755 77.197.128.225 -> 41.177.26.176 TCP 64 57539 > http [ACK] Seq=1 Ack=1 Win=65535 Len=0
187984  63.803685 77.197.128.225 -> 41.177.26.176 TCP 64 57539 > http [ACK] Seq=309 Ack=2844 Win=65535 Len=0
188139  63.885450 77.197.128.225 -> 41.177.26.176 TCP 64 57539 > http [ACK] Seq=309 Ack=6089 Win=65535 Len=0
188257  63.967023 77.197.128.225 -> 41.177.26.176 TCP 64 57539 > http [ACK] Seq=309 Ack=8020 Win=65535 Len=0
188259  63.967239 77.197.128.225 -> 41.177.26.176 TCP 64 57539 > http [ACK] Seq=309 Ack=11296 Win=65535 Len=0
188261  63.967497 77.197.128.225 -> 41.177.26.176 TCP 64 57539 > http [RST, ACK] Seq=309 Ack=11296 Win=0 Len=0
923302 306.750036 77.197.128.225 -> 41.177.26.15 TCP 66 44142 > http [SYN] Seq=0 Win=65535 Len=0 MSS=1460 SACK_PERM=1
923505 306.831904 77.197.128.225 -> 41.177.26.15 TCP 64 44142 > http [ACK] Seq=1 Ack=1 Win=65535 Len=0
924086 307.166568 77.197.128.225 -> 41.177.26.15 TCP 64 44142 > http [ACK] Seq=308 Ack=4381 Win=65535 Len=0
924179 307.248264 77.197.128.225 -> 41.177.26.15 TCP 64 44142 > http [ACK] Seq=308 Ack=8465 Win=65535 Len=0
924278 307.330047 77.197.128.225 -> 41.177.26.15 TCP 64 44142 > http [ACK] Seq=308 Ack=11385 Win=65535 Len=0
924282 307.330341 77.197.128.225 -> 41.177.26.15 TCP 64 44142 > http [ACK] Seq=308 Ack=12845 Win=65535 Len=0
924283 307.330359 77.197.128.225 -> 41.177.26.15 TCP 64 44142 > http [ACK] Seq=308 Ack=15765 Win=65535 Len=0
924411 307.411831 77.197.128.225 -> 41.177.26.15 TCP 64 44142 > http [ACK] Seq=308 Ack=18125 Win=65535 Len=0
924412 307.411998 77.197.128.225 -> 41.177.26.15 TCP 64 44142 > http [ACK] Seq=308 Ack=22505 Win=65535 Len=0
924413 307.412003 77.197.128.225 -> 41.177.26.15 TCP 64 44142 > http [ACK] Seq=308 Ack=24865 Win=63175 Len=0
924414 307.412007 77.197.128.225 -> 41.177.26.15 TCP 64 [TCP Window Update] 44142 > http [ACK] Seq=308 Ack=24865 Win=65535 Len=0
924415 307.412143 77.197.128.225 -> 41.177.26.15 TCP 64 44142 > http [ACK] Seq=308 Ack=26391 Win=65535 Len=0
924416 307.413743 77.197.128.225 -> 41.177.26.15 TCP 64 44142 > http [RST, ACK] Seq=308 Ack=26391 Win=0 Len=0
