17557   5.210435 77.197.128.142 -> 41.177.26.176 TCP 66 20372 > http [SYN] Seq=0 Win=65535 Len=0 MSS=1460 SACK_PERM=1
17664   5.292322 77.197.128.142 -> 41.177.26.176 TCP 64 20372 > http [ACK] Seq=1 Ack=1 Win=65535 Len=0
18157   5.712538 77.197.128.142 -> 41.177.26.176 TCP 64 20372 > http [ACK] Seq=319 Ack=3042 Win=65535 Len=0
18312   5.794271 77.197.128.142 -> 41.177.26.176 TCP 64 20372 > http [ACK] Seq=319 Ack=6089 Win=65535 Len=0
18469   5.865746 77.197.128.142 -> 41.177.26.176 TCP 64 20372 > http [ACK] Seq=319 Ack=7549 Win=65535 Len=0
18500   5.876046 77.197.128.142 -> 41.177.26.176 TCP 64 20372 > http [ACK] Seq=319 Ack=10367 Win=65535 Len=0
18501   5.876459 77.197.128.142 -> 41.177.26.176 TCP 64 20372 > http [RST, ACK] Seq=319 Ack=11049 Win=0 Len=0
91074  35.022582 77.197.128.142 -> 41.177.26.176 TCP 66 25213 > http [SYN] Seq=0 Win=65535 Len=0 MSS=1460 SACK_PERM=1
91339  35.104170 77.197.128.142 -> 41.177.26.176 TCP 64 25213 > http [ACK] Seq=1 Ack=1 Win=65535 Len=0
92651  35.472190 77.197.128.142 -> 41.177.26.176 TCP 64 25213 > http [ACK] Seq=305 Ack=2431 Win=65535 Len=0
92652  35.472194 77.197.128.142 -> 41.177.26.176 TCP 64 25213 > http [ACK] Seq=305 Ack=3892 Win=65535 Len=0
92944  35.554015 77.197.128.142 -> 41.177.26.176 TCP 64 25213 > http [ACK] Seq=305 Ack=7522 Win=65535 Len=0
92945  35.554138 77.197.128.142 -> 41.177.26.176 TCP 64 25213 > http [ACK] Seq=305 Ack=10442 Win=65535 Len=0
92949  35.554508 77.197.128.142 -> 41.177.26.176 TCP 64 25213 > http [RST, ACK] Seq=305 Ack=11142 Win=0 Len=0
178083  59.782545 77.197.128.142 -> 41.177.26.176 TCP 66 28717 > http [SYN] Seq=0 Win=65535 Len=0 MSS=1460 SACK_PERM=1
178328  59.864146 77.197.128.142 -> 41.177.26.176 TCP 64 28717 > http [ACK] Seq=1 Ack=1 Win=65535 Len=0
179330  60.324231 77.197.128.142 -> 41.177.26.176 TCP 64 28717 > http [ACK] Seq=318 Ack=2637 Win=65535 Len=0
179458  60.405946 77.197.128.142 -> 41.177.26.176 TCP 64 28717 > http [ACK] Seq=318 Ack=6077 Win=65535 Len=0
179639  60.487751 77.197.128.142 -> 41.177.26.176 TCP 64 28717 > http [ACK] Seq=318 Ack=8231 Win=65535 Len=0
179641  60.487760 77.197.128.142 -> 41.177.26.176 TCP 64 28717 > http [ACK] Seq=318 Ack=11080 Win=65535 Len=0
179644  60.488095 77.197.128.142 -> 41.177.26.176 TCP 64 28717 > http [RST, ACK] Seq=318 Ack=11080 Win=0 Len=0
189047  64.465299 77.197.128.142 -> 41.177.26.176 TCP 66 29575 > http [SYN] Seq=0 Win=65535 Len=0 MSS=1460 SACK_PERM=1
189179  64.547053 77.197.128.142 -> 41.177.26.176 TCP 64 29575 > http [ACK] Seq=1 Ack=1 Win=65535 Len=0
189649  64.931873 77.197.128.142 -> 41.177.26.176 TCP 64 29575 > http [ACK] Seq=316 Ack=2431 Win=65535 Len=0
189746  65.013648 77.197.128.142 -> 41.177.26.176 TCP 64 29575 > http [ACK] Seq=316 Ack=6050 Win=65535 Len=0
189841  65.095242 77.197.128.142 -> 41.177.26.176 TCP 64 29575 > http [ACK] Seq=316 Ack=7769 Win=65535 Len=0
189842  65.095452 77.197.128.142 -> 41.177.26.176 TCP 64 29575 > http [ACK] Seq=316 Ack=11033 Win=65535 Len=0
189843  65.095734 77.197.128.142 -> 41.177.26.176 TCP 64 29575 > http [RST, ACK] Seq=316 Ack=11033 Win=0 Len=0
395826 132.633412 77.197.128.142 -> 41.177.26.176 TCP 66 41816 > http [SYN] Seq=0 Win=65535 Len=0 MSS=1460 SACK_PERM=1
396027 132.715113 77.197.128.142 -> 41.177.26.176 TCP 64 41816 > http [ACK] Seq=1 Ack=1 Win=65535 Len=0
396838 133.168011 77.197.128.142 -> 41.177.26.176 TCP 64 41816 > http [ACK] Seq=308 Ack=2431 Win=65535 Len=0
396956 133.249640 77.197.128.142 -> 41.177.26.176 TCP 64 41816 > http [ACK] Seq=308 Ack=6062 Win=65535 Len=0
397115 133.331287 77.197.128.142 -> 41.177.26.176 TCP 64 41816 > http [ACK] Seq=308 Ack=7879 Win=65535 Len=0
397116 133.331356 77.197.128.142 -> 41.177.26.176 TCP 64 41816 > http [ACK] Seq=308 Ack=10468 Win=65535 Len=0
397117 133.331729 77.197.128.142 -> 41.177.26.176 TCP 64 41816 > http [RST, ACK] Seq=308 Ack=11150 Win=0 Len=0
586344 186.775893 77.197.128.142 -> 41.177.26.176 TCP 66 53377 > http [SYN] Seq=0 Win=65535 Len=0 MSS=1460 SACK_PERM=1
586588 186.857708 77.197.128.142 -> 41.177.26.176 TCP 64 53377 > http [ACK] Seq=1 Ack=1 Win=65535 Len=0
588065 187.260788 77.197.128.142 -> 41.177.26.176 TCP 64 53377 > http [ACK] Seq=304 Ack=2602 Win=65535 Len=0
588066 187.260793 77.197.128.142 -> 41.177.26.176 TCP 64 53377 > http [ACK] Seq=304 Ack=3899 Win=64238 Len=0
588295 187.342804 77.197.128.142 -> 41.177.26.176 TCP 64 53377 > http [ACK] Seq=304 Ack=6063 Win=65535 Len=0
588296 187.343153 77.197.128.142 -> 41.177.26.176 TCP 64 53377 > http [ACK] Seq=304 Ack=11049 Win=65535 Len=0
588297 187.343281 77.197.128.142 -> 41.177.26.176 TCP 64 53377 > http [RST, ACK] Seq=304 Ack=11049 Win=0 Len=0
597507 189.246998 77.197.128.142 -> 41.177.26.91 TCP 66 53302 > http [SYN] Seq=0 Win=65535 Len=0 MSS=1460 SACK_PERM=1
597692 189.326068 77.197.128.142 -> 41.177.26.91 TCP 64 53302 > http [ACK] Seq=1 Ack=1 Win=65535 Len=0
598218 189.552165 77.197.128.142 -> 41.177.26.91 TCP 64 53302 > http [ACK] Seq=384 Ack=2921 Win=65535 Len=0
598414 189.631114 77.197.128.142 -> 41.177.26.91 TCP 64 53302 > http [ACK] Seq=384 Ack=5841 Win=65535 Len=0
598416 189.631296 77.197.128.142 -> 41.177.26.91 TCP 64 53302 > http [ACK] Seq=384 Ack=8761 Win=65535 Len=0
598562 189.710191 77.197.128.142 -> 41.177.26.91 TCP 64 53302 > http [ACK] Seq=384 Ack=13141 Win=65535 Len=0
598564 189.710289 77.197.128.142 -> 41.177.26.91 TCP 64 53302 > http [ACK] Seq=384 Ack=15090 Win=65535 Len=0
598565 189.710530 77.197.128.142 -> 41.177.26.91 TCP 64 53302 > http [RST, ACK] Seq=384 Ack=15090 Win=0 Len=0
665271 207.047024 77.197.128.142 -> 41.177.26.91 TCP 66 64595 > http [SYN] Seq=0 Win=65535 Len=0 MSS=1460 SACK_PERM=1
665463 207.126207 77.197.128.142 -> 41.177.26.91 TCP 64 64595 > http [ACK] Seq=1 Ack=1 Win=65535 Len=0
665886 207.289406 77.197.128.142 -> 41.177.26.91 TCP 64 64595 > http [ACK] Seq=317 Ack=2921 Win=65535 Len=0
666013 207.368320 77.197.128.142 -> 41.177.26.91 TCP 64 64595 > http [ACK] Seq=317 Ack=5841 Win=65535 Len=0
666014 207.368447 77.197.128.142 -> 41.177.26.91 TCP 64 64595 > http [ACK] Seq=317 Ack=8761 Win=65535 Len=0
666293 207.447350 77.197.128.142 -> 41.177.26.91 TCP 64 64595 > http [ACK] Seq=317 Ack=13141 Win=65535 Len=0
666294 207.447424 77.197.128.142 -> 41.177.26.91 TCP 64 64595 > http [ACK] Seq=317 Ack=15702 Win=65535 Len=0
666296 207.448421 77.197.128.142 -> 41.177.26.91 TCP 64 64595 > http [RST, ACK] Seq=317 Ack=15702 Win=0 Len=0
675911 211.372545 77.197.128.142 -> 41.177.26.91 TCP 66 5390 > http [SYN] Seq=0 Win=65535 Len=0 MSS=1460 SACK_PERM=1
676026 211.451668 77.197.128.142 -> 41.177.26.91 TCP 64 5390 > http [ACK] Seq=1 Ack=1 Win=65535 Len=0
676402 211.593636 77.197.128.142 -> 41.177.26.91 TCP 64 5390 > http [ACK] Seq=304 Ack=2921 Win=65535 Len=0
676592 211.672671 77.197.128.142 -> 41.177.26.91 TCP 64 5390 > http [ACK] Seq=304 Ack=7301 Win=65535 Len=0
676793 211.751580 77.197.128.142 -> 41.177.26.91 TCP 64 5390 > http [ACK] Seq=304 Ack=10221 Win=65535 Len=0
676794 211.751722 77.197.128.142 -> 41.177.26.91 TCP 64 5390 > http [ACK] Seq=304 Ack=14468 Win=65535 Len=0
676795 211.751979 77.197.128.142 -> 41.177.26.91 TCP 64 5390 > http [RST, ACK] Seq=304 Ack=14468 Win=0 Len=0
688156 216.355280 77.197.128.142 -> 41.177.26.176 TCP 66 58419 > http [SYN] Seq=0 Win=65535 Len=0 MSS=1460 SACK_PERM=1
688312 216.437644 77.197.128.142 -> 41.177.26.176 TCP 64 58419 > http [ACK] Seq=1 Ack=1 Win=65535 Len=0
689103 216.818891 77.197.128.142 -> 41.177.26.176 TCP 64 58419 > http [ACK] Seq=318 Ack=2431 Win=65535 Len=0
689106 216.819124 77.197.128.142 -> 41.177.26.176 TCP 64 58419 > http [ACK] Seq=318 Ack=3896 Win=65535 Len=0
689236 216.900615 77.197.128.142 -> 41.177.26.176 TCP 64 58419 > http [ACK] Seq=318 Ack=7530 Win=65535 Len=0
689237 216.900789 77.197.128.142 -> 41.177.26.176 TCP 64 58419 > http [ACK] Seq=318 Ack=11179 Win=65535 Len=0
689240 216.901137 77.197.128.142 -> 41.177.26.176 TCP 64 58419 > http [RST, ACK] Seq=318 Ack=11179 Win=0 Len=0
757024 243.775715 77.197.128.142 -> 41.177.26.176 TCP 66 20397 > http [SYN] Seq=0 Win=65535 Len=0 MSS=1460 SACK_PERM=1
757148 243.857452 77.197.128.142 -> 41.177.26.176 TCP 64 20397 > http [ACK] Seq=1 Ack=1 Win=65535 Len=0
758810 244.313130 77.197.128.142 -> 41.177.26.176 TCP 64 20397 > http [ACK] Seq=309 Ack=2431 Win=65535 Len=0
758813 244.313460 77.197.128.142 -> 41.177.26.176 TCP 64 20397 > http [ACK] Seq=309 Ack=3908 Win=65535 Len=0
758916 244.394905 77.197.128.142 -> 41.177.26.176 TCP 64 20397 > http [ACK] Seq=309 Ack=6082 Win=65535 Len=0
758919 244.395040 77.197.128.142 -> 41.177.26.176 TCP 64 20397 > http [ACK] Seq=309 Ack=10462 Win=65535 Len=0
759020 244.476581 77.197.128.142 -> 41.177.26.176 TCP 64 20397 > http [ACK] Seq=309 Ack=12188 Win=65447 Len=0
759021 244.476585 77.197.128.142 -> 41.177.26.176 TCP 64 [TCP Dup ACK 759020#1] 20397 > http [ACK] Seq=309 Ack=12188 Win=65447 Len=0
759022 244.476843 77.197.128.142 -> 41.177.26.176 TCP 64 20397 > http [RST, ACK] Seq=309 Ack=12188 Win=0 Len=0
759255 244.653842 77.197.128.142 -> 41.177.26.176 TCP 66 21089 > http [SYN] Seq=0 Win=65535 Len=0 MSS=1460 SACK_PERM=1
759403 244.735704 77.197.128.142 -> 41.177.26.176 TCP 64 21089 > http [ACK] Seq=1 Ack=1 Win=65535 Len=0
761403 245.629163 77.197.128.142 -> 41.177.26.176 TCP 64 21089 > http [ACK] Seq=314 Ack=2111 Win=65535 Len=0
761404 245.629378 77.197.128.142 -> 41.177.26.176 TCP 64 21089 > http [ACK] Seq=314 Ack=2417 Win=65229 Len=0
761407 245.629555 77.197.128.142 -> 41.177.26.176 TCP 64 21089 > http [ACK] Seq=314 Ack=2850 Win=64796 Len=0
761584 245.711027 77.197.128.142 -> 41.177.26.176 TCP 64 21089 > http [ACK] Seq=314 Ack=5059 Win=65535 Len=0
761585 245.711174 77.197.128.142 -> 41.177.26.176 TCP 64 21089 > http [ACK] Seq=314 Ack=10168 Win=65535 Len=0
761586 245.711427 77.197.128.142 -> 41.177.26.176 TCP 64 21089 > http [RST, ACK] Seq=314 Ack=10168 Win=0 Len=0
762259 245.921442 77.197.128.142 -> 41.177.26.176 TCP 66 21749 > http [SYN] Seq=0 Win=65535 Len=0 MSS=1460 SACK_PERM=1
762511 246.003202 77.197.128.142 -> 41.177.26.176 TCP 64 21749 > http [ACK] Seq=1 Ack=1 Win=65535 Len=0
763491 246.387056 77.197.128.142 -> 41.177.26.176 TCP 64 21749 > http [ACK] Seq=316 Ack=2431 Win=65535 Len=0
763492 246.387202 77.197.128.142 -> 41.177.26.176 TCP 64 21749 > http [ACK] Seq=316 Ack=3893 Win=65535 Len=0
763678 246.468839 77.197.128.142 -> 41.177.26.176 TCP 64 21749 > http [ACK] Seq=316 Ack=6057 Win=65535 Len=0
763681 246.468967 77.197.128.142 -> 41.177.26.176 TCP 64 21749 > http [ACK] Seq=316 Ack=8272 Win=65535 Len=0
763682 246.468971 77.197.128.142 -> 41.177.26.176 TCP 64 21749 > http [ACK] Seq=316 Ack=11118 Win=65535 Len=0
763684 246.469160 77.197.128.142 -> 41.177.26.176 TCP 64 21749 > http [RST, ACK] Seq=316 Ack=11118 Win=0 Len=0
763823 246.504647 77.197.128.142 -> 41.177.26.176 TCP 66 22094 > http [SYN] Seq=0 Win=65535 Len=0 MSS=1460 SACK_PERM=1
764120 246.586209 77.197.128.142 -> 41.177.26.176 TCP 64 22094 > http [ACK] Seq=1 Ack=1 Win=65535 Len=0
764809 246.935252 77.197.128.142 -> 41.177.26.176 TCP 64 22094 > http [ACK] Seq=316 Ack=2914 Win=65535 Len=0
764982 247.017010 77.197.128.142 -> 41.177.26.176 TCP 64 22094 > http [ACK] Seq=316 Ack=6064 Win=65535 Len=0
765219 247.098870 77.197.128.142 -> 41.177.26.176 TCP 64 22094 > http [ACK] Seq=316 Ack=10936 Win=65535 Len=0
765220 247.099234 77.197.128.142 -> 41.177.26.176 TCP 64 22094 > http [RST, ACK] Seq=316 Ack=10936 Win=0 Len=0
765337 247.135084 77.197.128.142 -> 41.177.26.176 TCP 66 22433 > http [SYN] Seq=0 Win=65535 Len=0 MSS=1460 SACK_PERM=1
765447 247.216852 77.197.128.142 -> 41.177.26.176 TCP 64 22433 > http [ACK] Seq=1 Ack=1 Win=65535 Len=0
766082 247.600492 77.197.128.142 -> 41.177.26.176 TCP 64 22433 > http [ACK] Seq=308 Ack=2922 Win=65535 Len=0
766308 247.682984 77.197.128.142 -> 41.177.26.176 TCP 64 22433 > http [ACK] Seq=308 Ack=7536 Win=65535 Len=0
766483 247.765027 77.197.128.142 -> 41.177.26.176 TCP 64 22433 > http [ACK] Seq=308 Ack=11051 Win=65535 Len=0
766485 247.765141 77.197.128.142 -> 41.177.26.176 TCP 64 22433 > http [RST, ACK] Seq=308 Ack=11051 Win=0 Len=0
766573 247.806349 77.197.128.142 -> 41.177.26.176 TCP 66 22781 > http [SYN] Seq=0 Win=65535 Len=0 MSS=1460 SACK_PERM=1
766784 247.887948 77.197.128.142 -> 41.177.26.176 TCP 64 22781 > http [ACK] Seq=1 Ack=1 Win=65535 Len=0
769071 248.814682 77.197.128.142 -> 41.177.26.176 TCP 64 22781 > http [ACK] Seq=328 Ack=1574 Win=65535 Len=0
769085 248.828015 77.197.128.142 -> 41.177.26.176 TCP 64 22781 > http [ACK] Seq=328 Ack=2472 Win=64637 Len=0
769086 248.828114 77.197.128.142 -> 41.177.26.176 TCP 64 22781 > http [ACK] Seq=328 Ack=2796 Win=64313 Len=0
769090 248.828430 77.197.128.142 -> 41.177.26.176 TCP 64 22781 > http [ACK] Seq=328 Ack=3774 Win=65535 Len=0
769198 248.896426 77.197.128.142 -> 41.177.26.176 TCP 64 22781 > http [ACK] Seq=328 Ack=6417 Win=65535 Len=0
769211 248.909912 77.197.128.142 -> 41.177.26.176 TCP 64 22781 > http [ACK] Seq=328 Ack=10538 Win=65535 Len=0
769212 248.910066 77.197.128.142 -> 41.177.26.176 TCP 64 22781 > http [RST, ACK] Seq=328 Ack=10538 Win=0 Len=0
769303 248.964627 77.197.128.142 -> 41.177.26.176 TCP 66 23329 > http [SYN] Seq=0 Win=65535 Len=0 MSS=1460 SACK_PERM=1
769479 249.046344 77.197.128.142 -> 41.177.26.176 TCP 64 23329 > http [ACK] Seq=1 Ack=1 Win=65535 Len=0
776382 250.041812 77.197.128.142 -> 41.177.26.176 TCP 64 23329 > http [ACK] Seq=322 Ack=2190 Win=65535 Len=0
776383 250.041998 77.197.128.142 -> 41.177.26.176 TCP 64 23329 > http [ACK] Seq=322 Ack=2874 Win=64851 Len=0
776503 250.123637 77.197.128.142 -> 41.177.26.176 TCP 64 23329 > http [ACK] Seq=322 Ack=6116 Win=65535 Len=0
776504 250.123806 77.197.128.142 -> 41.177.26.176 TCP 64 23329 > http [ACK] Seq=322 Ack=10149 Win=65535 Len=0
776507 250.124080 77.197.128.142 -> 41.177.26.176 TCP 64 23329 > http [RST, ACK] Seq=322 Ack=10149 Win=0 Len=0
776655 250.185361 77.197.128.142 -> 41.177.26.176 TCP 66 23891 > http [SYN] Seq=0 Win=65535 Len=0 MSS=1460 SACK_PERM=1
776749 250.267240 77.197.128.142 -> 41.177.26.176 TCP 64 23891 > http [ACK] Seq=1 Ack=1 Win=65535 Len=0
777989 250.723845 77.197.128.142 -> 41.177.26.176 TCP 64 23891 > http [ACK] Seq=318 Ack=2245 Win=65535 Len=0
778095 250.806618 77.197.128.142 -> 41.177.26.176 TCP 64 23891 > http [ACK] Seq=318 Ack=6064 Win=65535 Len=0
778235 250.888421 77.197.128.142 -> 41.177.26.176 TCP 64 23891 > http [ACK] Seq=318 Ack=8984 Win=65535 Len=0
778236 250.888426 77.197.128.142 -> 41.177.26.176 TCP 64 23891 > http [ACK] Seq=318 Ack=11171 Win=65535 Len=0
778237 250.888707 77.197.128.142 -> 41.177.26.176 TCP 64 23891 > http [RST, ACK] Seq=318 Ack=11171 Win=0 Len=0
778401 251.008840 77.197.128.142 -> 41.177.26.176 TCP 66 24295 > http [SYN] Seq=0 Win=65535 Len=0 MSS=1460 SACK_PERM=1
778476 251.090504 77.197.128.142 -> 41.177.26.176 TCP 64 24295 > http [ACK] Seq=1 Ack=1 Win=65535 Len=0
779205 251.503552 77.197.128.142 -> 41.177.26.176 TCP 64 24295 > http [ACK] Seq=319 Ack=2431 Win=65535 Len=0
779206 251.503660 77.197.128.142 -> 41.177.26.176 TCP 64 24295 > http [ACK] Seq=319 Ack=3895 Win=65535 Len=0
779340 251.585473 77.197.128.142 -> 41.177.26.176 TCP 64 24295 > http [ACK] Seq=319 Ack=6075 Win=65535 Len=0
779341 251.585619 77.197.128.142 -> 41.177.26.176 TCP 64 24295 > http [ACK] Seq=319 Ack=9867 Win=65535 Len=0
779527 251.667155 77.197.128.142 -> 41.177.26.176 TCP 64 24295 > http [ACK] Seq=319 Ack=11464 Win=65535 Len=0
779529 251.667607 77.197.128.142 -> 41.177.26.176 TCP 64 24295 > http [RST, ACK] Seq=319 Ack=11464 Win=0 Len=0
779879 251.824002 77.197.128.142 -> 41.177.26.176 TCP 66 24681 > http [SYN] Seq=0 Win=65535 Len=0 MSS=1460 SACK_PERM=1
780047 251.905731 77.197.128.142 -> 41.177.26.176 TCP 64 24681 > http [ACK] Seq=1 Ack=1 Win=65535 Len=0
780663 252.262488 77.197.128.142 -> 41.177.26.176 TCP 64 24681 > http [ACK] Seq=304 Ack=2431 Win=65535 Len=0
780664 252.262692 77.197.128.142 -> 41.177.26.176 TCP 64 24681 > http [ACK] Seq=304 Ack=3893 Win=65535 Len=0
780839 252.344289 77.197.128.142 -> 41.177.26.176 TCP 64 24681 > http [ACK] Seq=304 Ack=7517 Win=65535 Len=0
780840 252.344403 77.197.128.142 -> 41.177.26.176 TCP 64 24681 > http [ACK] Seq=304 Ack=10120 Win=65535 Len=0
781107 252.426211 77.197.128.142 -> 41.177.26.176 TCP 64 24681 > http [RST, ACK] Seq=304 Ack=11506 Win=0 Len=0
781567 252.594331 77.197.128.142 -> 41.177.26.176 TCP 66 25097 > http [SYN] Seq=0 Win=65535 Len=0 MSS=1460 SACK_PERM=1
781710 252.676108 77.197.128.142 -> 41.177.26.176 TCP 64 25097 > http [ACK] Seq=1 Ack=1 Win=65535 Len=0
782390 253.150446 77.197.128.142 -> 41.177.26.176 TCP 64 25097 > http [ACK] Seq=309 Ack=2431 Win=65535 Len=0
782521 253.232157 77.197.128.142 -> 41.177.26.176 TCP 64 25097 > http [ACK] Seq=309 Ack=7535 Win=65535 Len=0
782620 253.314445 77.197.128.142 -> 41.177.26.176 TCP 64 25097 > http [ACK] Seq=309 Ack=11256 Win=64902 Len=0
782621 253.314450 77.197.128.142 -> 41.177.26.176 TCP 64 [TCP Dup ACK 782620#1] 25097 > http [ACK] Seq=309 Ack=11256 Win=64902 Len=0
782622 253.314454 77.197.128.142 -> 41.177.26.176 TCP 64 25097 > http [RST, ACK] Seq=309 Ack=11256 Win=0 Len=0
782906 253.442008 77.197.128.142 -> 41.177.26.176 TCP 66 25542 > http [SYN] Seq=0 Win=65535 Len=0 MSS=1460 SACK_PERM=1
783085 253.523810 77.197.128.142 -> 41.177.26.176 TCP 64 25542 > http [ACK] Seq=1 Ack=1 Win=65535 Len=0
785848 254.812183 77.197.128.142 -> 41.177.26.176 TCP 64 25542 > http [ACK] Seq=325 Ack=2592 Win=65535 Len=0
785849 254.812333 77.197.128.142 -> 41.177.26.176 TCP 64 25542 > http [ACK] Seq=325 Ack=4203 Win=65535 Len=0
785967 254.894105 77.197.128.142 -> 41.177.26.176 TCP 64 25542 > http [ACK] Seq=325 Ack=8442 Win=65535 Len=0
785968 254.894223 77.197.128.142 -> 41.177.26.176 TCP 64 25542 > http [ACK] Seq=325 Ack=11167 Win=65535 Len=0
786089 254.975877 77.197.128.142 -> 41.177.26.176 TCP 64 25542 > http [ACK] Seq=325 Ack=12539 Win=64163 Len=0
786090 254.975953 77.197.128.142 -> 41.177.26.176 TCP 64 25542 > http [ACK] Seq=325 Ack=15343 Win=65535 Len=0
786091 254.975957 77.197.128.142 -> 41.177.26.176 TCP 64 25542 > http [ACK] Seq=325 Ack=18225 Win=65535 Len=0
786094 254.976646 77.197.128.142 -> 41.177.26.176 TCP 64 25542 > http [RST, ACK] Seq=325 Ack=18225 Win=0 Len=0
786251 255.105453 77.197.128.142 -> 41.177.26.176 TCP 66 26246 > http [SYN] Seq=0 Win=65535 Len=0 MSS=1460 SACK_PERM=1
786335 255.187317 77.197.128.142 -> 41.177.26.176 TCP 64 26246 > http [ACK] Seq=1 Ack=1 Win=65535 Len=0
787257 255.565341 77.197.128.142 -> 41.177.26.176 TCP 64 26246 > http [ACK] Seq=316 Ack=2431 Win=65535 Len=0
787258 255.565346 77.197.128.142 -> 41.177.26.176 TCP 64 26246 > http [ACK] Seq=316 Ack=3893 Win=65535 Len=0
787556 255.647376 77.197.128.142 -> 41.177.26.176 TCP 64 26246 > http [ACK] Seq=316 Ack=6057 Win=65535 Len=0
787557 255.647380 77.197.128.142 -> 41.177.26.176 TCP 64 26246 > http [ACK] Seq=316 Ack=9513 Win=65535 Len=0
787558 255.647384 77.197.128.142 -> 41.177.26.176 TCP 64 26246 > http [ACK] Seq=316 Ack=11129 Win=65535 Len=0
787559 255.647582 77.197.128.142 -> 41.177.26.176 TCP 64 26246 > http [RST, ACK] Seq=316 Ack=11129 Win=0 Len=0
787666 255.683930 77.197.128.142 -> 41.177.26.176 TCP 66 26503 > http [SYN] Seq=0 Win=65535 Len=0 MSS=1460 SACK_PERM=1
787854 255.766587 77.197.128.142 -> 41.177.26.176 TCP 64 26503 > http [ACK] Seq=1 Ack=1 Win=65535 Len=0
789217 256.225897 77.197.128.142 -> 41.177.26.176 TCP 64 26503 > http [ACK] Seq=310 Ack=2844 Win=65535 Len=0
789318 256.307829 77.197.128.142 -> 41.177.26.176 TCP 64 26503 > http [ACK] Seq=310 Ack=6087 Win=65535 Len=0
789421 256.389735 77.197.128.142 -> 41.177.26.176 TCP 64 26503 > http [ACK] Seq=310 Ack=7903 Win=65535 Len=0
789422 256.389854 77.197.128.142 -> 41.177.26.176 TCP 64 26503 > http [ACK] Seq=310 Ack=11216 Win=65355 Len=0
789423 256.389858 77.197.128.142 -> 41.177.26.176 TCP 64 [TCP Dup ACK 789422#1] 26503 > http [ACK] Seq=310 Ack=11216 Win=65355 Len=0
789425 256.390049 77.197.128.142 -> 41.177.26.176 TCP 64 26503 > http [RST, ACK] Seq=310 Ack=11216 Win=0 Len=0
789791 256.517212 77.197.128.142 -> 41.177.26.176 TCP 66 26862 > http [SYN] Seq=0 Win=65535 Len=0 MSS=1460 SACK_PERM=1
789941 256.598947 77.197.128.142 -> 41.177.26.176 TCP 64 26862 > http [ACK] Seq=1 Ack=1 Win=65535 Len=0
791028 257.012332 77.197.128.142 -> 41.177.26.176 TCP 64 26862 > http [ACK] Seq=318 Ack=2431 Win=65535 Len=0
791029 257.012608 77.197.128.142 -> 41.177.26.176 TCP 64 26862 > http [ACK] Seq=318 Ack=3896 Win=65535 Len=0
791127 257.094311 77.197.128.142 -> 41.177.26.176 TCP 64 26862 > http [ACK] Seq=318 Ack=6070 Win=65535 Len=0
791128 257.094421 77.197.128.142 -> 41.177.26.176 TCP 64 26862 > http [ACK] Seq=318 Ack=7964 Win=65535 Len=0
791130 257.094591 77.197.128.142 -> 41.177.26.176 TCP 64 26862 > http [ACK] Seq=318 Ack=11051 Win=65535 Len=0
791131 257.094850 77.197.128.142 -> 41.177.26.176 TCP 64 26862 > http [RST, ACK] Seq=318 Ack=11051 Win=0 Len=0
791252 257.152231 77.197.128.142 -> 41.177.26.176 TCP 66 27138 > http [SYN] Seq=0 Win=65535 Len=0 MSS=1460 SACK_PERM=1
791399 257.234022 77.197.128.142 -> 41.177.26.176 TCP 64 27138 > http [ACK] Seq=1 Ack=1 Win=65535 Len=0
792283 257.602807 77.197.128.142 -> 41.177.26.176 TCP 64 27138 > http [ACK] Seq=353 Ack=2431 Win=65535 Len=0
792423 257.684667 77.197.128.142 -> 41.177.26.176 TCP 64 27138 > http [ACK] Seq=353 Ack=5351 Win=65535 Len=0
792424 257.684721 77.197.128.142 -> 41.177.26.176 TCP 64 27138 > http [ACK] Seq=353 Ack=7669 Win=65535 Len=0
792520 257.766712 77.197.128.142 -> 41.177.26.176 TCP 64 27138 > http [ACK] Seq=353 Ack=12116 Win=64042 Len=0
792521 257.766717 77.197.128.142 -> 41.177.26.176 TCP 64 [TCP Window Update] 27138 > http [ACK] Seq=353 Ack=12116 Win=65535 Len=0
792522 257.766978 77.197.128.142 -> 41.177.26.176 TCP 64 27138 > http [RST, ACK] Seq=353 Ack=12116 Win=0 Len=0
792761 257.941889 77.197.128.142 -> 41.177.26.176 TCP 66 27478 > http [SYN] Seq=0 Win=65535 Len=0 MSS=1460 SACK_PERM=1
792890 258.023605 77.197.128.142 -> 41.177.26.176 TCP 64 27478 > http [ACK] Seq=1 Ack=1 Win=65535 Len=0
793662 258.509395 77.197.128.142 -> 41.177.26.176 TCP 64 27478 > http [ACK] Seq=318 Ack=2710 Win=65535 Len=0
793848 258.591193 77.197.128.142 -> 41.177.26.176 TCP 64 27478 > http [ACK] Seq=318 Ack=6063 Win=65535 Len=0
794037 258.672686 77.197.128.142 -> 41.177.26.176 TCP 64 27478 > http [ACK] Seq=318 Ack=7879 Win=65535 Len=0
794040 258.673067 77.197.128.142 -> 41.177.26.176 TCP 64 27478 > http [ACK] Seq=318 Ack=11162 Win=65275 Len=0
794041 258.673072 77.197.128.142 -> 41.177.26.176 TCP 64 [TCP Dup ACK 794040#1] 27478 > http [ACK] Seq=318 Ack=11162 Win=65275 Len=0
794042 258.673194 77.197.128.142 -> 41.177.26.176 TCP 64 27478 > http [RST, ACK] Seq=318 Ack=11162 Win=0 Len=0
794237 258.724549 77.197.128.142 -> 41.177.26.176 TCP 66 27823 > http [SYN] Seq=0 Win=65535 Len=0 MSS=1460 SACK_PERM=1
794502 258.806401 77.197.128.142 -> 41.177.26.176 TCP 64 27823 > http [ACK] Seq=1 Ack=1 Win=65535 Len=0
795667 259.303823 77.197.128.142 -> 41.177.26.176 TCP 64 27823 > http [ACK] Seq=356 Ack=2431 Win=65535 Len=0
795668 259.304092 77.197.128.142 -> 41.177.26.176 TCP 64 27823 > http [ACK] Seq=356 Ack=4057 Win=65535 Len=0
795800 259.385923 77.197.128.142 -> 41.177.26.176 TCP 64 27823 > http [ACK] Seq=356 Ack=6237 Win=65535 Len=0
795802 259.386335 77.197.128.142 -> 41.177.26.176 TCP 64 27823 > http [ACK] Seq=356 Ack=10617 Win=65535 Len=0
795923 259.467900 77.197.128.142 -> 41.177.26.176 TCP 64 27823 > http [RST, ACK] Seq=356 Ack=11630 Win=0 Len=0
796062 259.558534 77.197.128.142 -> 41.177.26.176 TCP 66 28178 > http [SYN] Seq=0 Win=65535 Len=0 MSS=1460 SACK_PERM=1
796189 259.640347 77.197.128.142 -> 41.177.26.176 TCP 64 28178 > http [ACK] Seq=1 Ack=1 Win=65535 Len=0
796909 260.002391 77.197.128.142 -> 41.177.26.176 TCP 64 28178 > http [ACK] Seq=316 Ack=3893 Win=65535 Len=0
797131 260.084088 77.197.128.142 -> 41.177.26.176 TCP 64 28178 > http [ACK] Seq=316 Ack=6057 Win=65535 Len=0
797132 260.084220 77.197.128.142 -> 41.177.26.176 TCP 64 28178 > http [ACK] Seq=316 Ack=8309 Win=65535 Len=0
797551 260.165823 77.197.128.142 -> 41.177.26.176 TCP 64 28178 > http [ACK] Seq=316 Ack=11573 Win=65535 Len=0
797552 260.166076 77.197.128.142 -> 41.177.26.176 TCP 64 28178 > http [RST, ACK] Seq=316 Ack=11573 Win=0 Len=0
798107 260.371128 77.197.128.142 -> 41.177.26.176 TCP 66 28551 > http [SYN] Seq=0 Win=65535 Len=0 MSS=1460 SACK_PERM=1
798338 260.452826 77.197.128.142 -> 41.177.26.176 TCP 64 28551 > http [ACK] Seq=1 Ack=1 Win=65535 Len=0
800716 261.624482 77.197.128.142 -> 41.177.26.176 TCP 64 28551 > http [ACK] Seq=333 Ack=1587 Win=65535 Len=0
800726 261.635665 77.197.128.142 -> 41.177.26.176 TCP 64 28551 > http [ACK] Seq=333 Ack=2489 Win=64633 Len=0
800729 261.635902 77.197.128.142 -> 41.177.26.176 TCP 64 28551 > http [ACK] Seq=333 Ack=2963 Win=64159 Len=0
800875 261.706260 77.197.128.142 -> 41.177.26.176 TCP 64 28551 > http [ACK] Seq=333 Ack=5264 Win=65535 Len=0
800902 261.717327 77.197.128.142 -> 41.177.26.176 TCP 64 28551 > http [ACK] Seq=333 Ack=9287 Win=65535 Len=0
800903 261.717872 77.197.128.142 -> 41.177.26.176 TCP 64 28551 > http [RST, ACK] Seq=333 Ack=10377 Win=0 Len=0
801000 261.774781 77.197.128.142 -> 41.177.26.176 TCP 66 29312 > http [SYN] Seq=0 Win=65535 Len=0 MSS=1460 SACK_PERM=1
801091 261.856510 77.197.128.142 -> 41.177.26.176 TCP 64 29312 > http [ACK] Seq=1 Ack=1 Win=65535 Len=0
802232 262.273369 77.197.128.142 -> 41.177.26.176 TCP 64 29312 > http [ACK] Seq=354 Ack=4051 Win=65535 Len=0
802982 262.355462 77.197.128.142 -> 41.177.26.176 TCP 64 29312 > http [ACK] Seq=354 Ack=6221 Win=65535 Len=0
802983 262.355605 77.197.128.142 -> 41.177.26.176 TCP 64 29312 > http [ACK] Seq=354 Ack=9495 Win=65535 Len=0
803267 262.437158 77.197.128.142 -> 41.177.26.176 TCP 64 29312 > http [ACK] Seq=354 Ack=11307 Win=65535 Len=0
803268 262.437424 77.197.128.142 -> 41.177.26.176 TCP 64 29312 > http [RST, ACK] Seq=354 Ack=11307 Win=0 Len=0
803694 262.577893 77.197.128.142 -> 41.177.26.176 TCP 66 29765 > http [SYN] Seq=0 Win=65535 Len=0 MSS=1460 SACK_PERM=1
803886 262.659590 77.197.128.142 -> 41.177.26.176 TCP 64 29765 > http [ACK] Seq=1 Ack=1 Win=65535 Len=0
810305 264.173354 77.197.128.142 -> 41.177.26.176 TCP 64 29765 > http [ACK] Seq=305 Ack=1463 Win=65535 Len=0
810319 264.183772 77.197.128.142 -> 41.177.26.176 TCP 64 29765 > http [ACK] Seq=305 Ack=2432 Win=64566 Len=0
810321 264.183945 77.197.128.142 -> 41.177.26.176 TCP 64 29765 > http [ACK] Seq=305 Ack=2850 Win=64148 Len=0
810324 264.184074 77.197.128.142 -> 41.177.26.176 TCP 64 29765 > http [ACK] Seq=305 Ack=3840 Win=65535 Len=0
810490 264.255019 77.197.128.142 -> 41.177.26.176 TCP 64 29765 > http [ACK] Seq=305 Ack=6365 Win=65535 Len=0
810509 264.265684 77.197.128.142 -> 41.177.26.176 TCP 64 29765 > http [ACK] Seq=305 Ack=9285 Win=65535 Len=0
810510 264.265874 77.197.128.142 -> 41.177.26.176 TCP 64 29765 > http [RST, ACK] Seq=305 Ack=10269 Win=0 Len=0
810919 264.433345 77.197.128.142 -> 41.177.26.176 TCP 66 30776 > http [SYN] Seq=0 Win=65535 Len=0 MSS=1460 SACK_PERM=1
811140 264.515154 77.197.128.142 -> 41.177.26.176 TCP 64 30776 > http [ACK] Seq=1 Ack=1 Win=65535 Len=0
812596 264.973421 77.197.128.142 -> 41.177.26.176 TCP 64 30776 > http [ACK] Seq=309 Ack=3915 Win=65535 Len=0
812742 265.055197 77.197.128.142 -> 41.177.26.176 TCP 64 30776 > http [ACK] Seq=309 Ack=6089 Win=65535 Len=0
812743 265.055202 77.197.128.142 -> 41.177.26.176 TCP 64 30776 > http [ACK] Seq=309 Ack=8217 Win=65535 Len=0
812957 265.136983 77.197.128.142 -> 41.177.26.176 TCP 64 30776 > http [ACK] Seq=309 Ack=11097 Win=65535 Len=0
812958 265.137196 77.197.128.142 -> 41.177.26.176 TCP 64 30776 > http [RST, ACK] Seq=309 Ack=11097 Win=0 Len=0
813229 265.276839 77.197.128.142 -> 41.177.26.176 TCP 66 31316 > http [SYN] Seq=0 Win=65535 Len=0 MSS=1460 SACK_PERM=1
813584 265.358440 77.197.128.142 -> 41.177.26.176 TCP 64 31316 > http [ACK] Seq=1 Ack=1 Win=65535 Len=0
815359 265.809893 77.197.128.142 -> 41.177.26.176 TCP 64 31316 > http [ACK] Seq=309 Ack=2431 Win=65535 Len=0
815360 265.809898 77.197.128.142 -> 41.177.26.176 TCP 64 31316 > http [ACK] Seq=309 Ack=3908 Win=65535 Len=0
815613 265.891663 77.197.128.142 -> 41.177.26.176 TCP 64 31316 > http [ACK] Seq=309 Ack=6082 Win=65535 Len=0
815614 265.891769 77.197.128.142 -> 41.177.26.176 TCP 64 31316 > http [ACK] Seq=309 Ack=10462 Win=65535 Len=0
815821 265.973603 77.197.128.142 -> 41.177.26.176 TCP 64 31316 > http [RST, ACK] Seq=309 Ack=11286 Win=0 Len=0
816055 266.074254 77.197.128.142 -> 41.177.26.176 TCP 66 31599 > http [SYN] Seq=0 Win=65535 Len=0 MSS=1460 SACK_PERM=1
816171 266.156175 77.197.128.142 -> 41.177.26.176 TCP 64 31599 > http [ACK] Seq=1 Ack=1 Win=65535 Len=0
817098 266.552730 77.197.128.142 -> 41.177.26.176 TCP 64 31599 > http [ACK] Seq=308 Ack=2431 Win=65535 Len=0
817099 266.552842 77.197.128.142 -> 41.177.26.176 TCP 64 31599 > http [ACK] Seq=308 Ack=3905 Win=65535 Len=0
817267 266.634774 77.197.128.142 -> 41.177.26.176 TCP 64 31599 > http [ACK] Seq=308 Ack=6069 Win=65535 Len=0
817268 266.634779 77.197.128.142 -> 41.177.26.176 TCP 64 31599 > http [ACK] Seq=308 Ack=11049 Win=65535 Len=0
817272 266.635016 77.197.128.142 -> 41.177.26.176 TCP 64 31599 > http [RST, ACK] Seq=308 Ack=11049 Win=0 Len=0
817450 266.699053 77.197.128.142 -> 41.177.26.176 TCP 66 31791 > http [SYN] Seq=0 Win=65535 Len=0 MSS=1460 SACK_PERM=1
817643 266.780804 77.197.128.142 -> 41.177.26.176 TCP 64 31791 > http [ACK] Seq=1 Ack=1 Win=65535 Len=0
821119 267.966769 77.197.128.142 -> 41.177.26.176 TCP 64 31791 > http [ACK] Seq=333 Ack=2257 Win=65535 Len=0
821120 267.966921 77.197.128.142 -> 41.177.26.176 TCP 64 31791 > http [ACK] Seq=333 Ack=4218 Win=65535 Len=0
821337 268.048580 77.197.128.142 -> 41.177.26.176 TCP 64 31791 > http [ACK] Seq=333 Ack=6581 Win=65535 Len=0
821338 268.048618 77.197.128.142 -> 41.177.26.176 TCP 64 31791 > http [ACK] Seq=333 Ack=8145 Win=65535 Len=0
821339 268.048858 77.197.128.142 -> 41.177.26.176 TCP 64 31791 > http [ACK] Seq=333 Ack=11258 Win=65535 Len=0
821340 268.049067 77.197.128.142 -> 41.177.26.176 TCP 64 31791 > http [RST, ACK] Seq=333 Ack=11258 Win=0 Len=0
821491 268.121205 77.197.128.142 -> 41.177.26.176 TCP 66 32274 > http [SYN] Seq=0 Win=65535 Len=0 MSS=1460 SACK_PERM=1
821712 268.203056 77.197.128.142 -> 41.177.26.176 TCP 64 32274 > http [ACK] Seq=1 Ack=1 Win=65535 Len=0
822891 268.661563 77.197.128.142 -> 41.177.26.176 TCP 64 32274 > http [ACK] Seq=309 Ack=2245 Win=65535 Len=0
822892 268.661568 77.197.128.142 -> 41.177.26.176 TCP 64 32274 > http [ACK] Seq=309 Ack=3908 Win=65535 Len=0
823071 268.743358 77.197.128.142 -> 41.177.26.176 TCP 64 32274 > http [ACK] Seq=309 Ack=6082 Win=65535 Len=0
823072 268.743589 77.197.128.142 -> 41.177.26.176 TCP 64 32274 > http [ACK] Seq=309 Ack=11194 Win=65535 Len=0
823073 268.743722 77.197.128.142 -> 41.177.26.176 TCP 64 32274 > http [RST, ACK] Seq=309 Ack=11194 Win=0 Len=0
823327 268.903121 77.197.128.142 -> 41.177.26.176 TCP 66 32418 > http [SYN] Seq=0 Win=65535 Len=0 MSS=1460 SACK_PERM=1
823532 268.984860 77.197.128.142 -> 41.177.26.176 TCP 64 32418 > http [ACK] Seq=1 Ack=1 Win=65535 Len=0
825475 269.421508 77.197.128.142 -> 41.177.26.176 TCP 64 32418 > http [ACK] Seq=355 Ack=3280 Win=65535 Len=0
825787 269.503202 77.197.128.142 -> 41.177.26.176 TCP 64 32418 > http [ACK] Seq=355 Ack=6239 Win=65535 Len=0
826081 269.584744 77.197.128.142 -> 41.177.26.176 TCP 64 32418 > http [ACK] Seq=355 Ack=7951 Win=65535 Len=0
826082 269.584877 77.197.128.142 -> 41.177.26.176 TCP 64 32418 > http [ACK] Seq=355 Ack=11227 Win=65535 Len=0
826083 269.585205 77.197.128.142 -> 41.177.26.176 TCP 64 32418 > http [RST, ACK] Seq=355 Ack=11227 Win=0 Len=0
826464 269.715744 77.197.128.142 -> 41.177.26.176 TCP 66 32548 > http [SYN] Seq=0 Win=65535 Len=0 MSS=1460 SACK_PERM=1
826801 269.797381 77.197.128.142 -> 41.177.26.176 TCP 64 32548 > http [ACK] Seq=1 Ack=1 Win=65535 Len=0
828053 270.263254 77.197.128.142 -> 41.177.26.176 TCP 64 32548 > http [ACK] Seq=309 Ack=2431 Win=65535 Len=0
828311 270.344955 77.197.128.142 -> 41.177.26.176 TCP 64 32548 > http [ACK] Seq=309 Ack=6075 Win=65535 Len=0
828528 270.426726 77.197.128.142 -> 41.177.26.176 TCP 64 32548 > http [ACK] Seq=309 Ack=8652 Win=65535 Len=0
828529 270.426731 77.197.128.142 -> 41.177.26.176 TCP 64 32548 > http [ACK] Seq=309 Ack=11765 Win=64393 Len=0
828530 270.426735 77.197.128.142 -> 41.177.26.176 TCP 64 [TCP Dup ACK 828529#1] 32548 > http [ACK] Seq=309 Ack=11765 Win=64393 Len=0
828532 270.426994 77.197.128.142 -> 41.177.26.176 TCP 64 32548 > http [RST, ACK] Seq=309 Ack=11765 Win=0 Len=0
828942 270.541215 77.197.128.142 -> 41.177.26.176 TCP 66 32657 > http [SYN] Seq=0 Win=65535 Len=0 MSS=1460 SACK_PERM=1
829190 270.622814 77.197.128.142 -> 41.177.26.176 TCP 64 32657 > http [ACK] Seq=1 Ack=1 Win=65535 Len=0
829777 271.034299 77.197.128.142 -> 41.177.26.176 TCP 64 32657 > http [ACK] Seq=309 Ack=2842 Win=65535 Len=0
830018 271.116048 77.197.128.142 -> 41.177.26.176 TCP 64 32657 > http [ACK] Seq=309 Ack=6081 Win=65535 Len=0
830186 271.197801 77.197.128.142 -> 41.177.26.176 TCP 64 32657 > http [ACK] Seq=309 Ack=7710 Win=65535 Len=0
830187 271.197807 77.197.128.142 -> 41.177.26.176 TCP 64 32657 > http [ACK] Seq=309 Ack=10307 Win=65535 Len=0
830191 271.198081 77.197.128.142 -> 41.177.26.176 TCP 64 32657 > http [RST, ACK] Seq=309 Ack=10989 Win=0 Len=0
