206533  70.767789 77.197.128.135 -> 41.177.26.176 TCP 66 61502 > http [SYN] Seq=0 Win=65535 Len=0 MSS=1460 SACK_PERM=1
206993  70.849629 77.197.128.135 -> 41.177.26.176 TCP 64 61502 > http [ACK] Seq=1 Ack=1 Win=65535 Len=0
207899  71.226394 77.197.128.135 -> 41.177.26.176 TCP 64 61502 > http [ACK] Seq=309 Ack=3908 Win=65535 Len=0
207992  71.308218 77.197.128.135 -> 41.177.26.176 TCP 64 61502 > http [ACK] Seq=309 Ack=6082 Win=65535 Len=0
207993  71.308400 77.197.128.135 -> 41.177.26.176 TCP 64 61502 > http [ACK] Seq=309 Ack=9002 Win=65535 Len=0
208081  71.389937 77.197.128.135 -> 41.177.26.176 TCP 64 61502 > http [ACK] Seq=309 Ack=11164 Win=65535 Len=0
208083  71.390334 77.197.128.135 -> 41.177.26.176 TCP 64 61502 > http [RST, ACK] Seq=309 Ack=11164 Win=0 Len=0
287571  96.054190 77.197.128.135 -> 41.177.26.176 TCP 66 intv > http [SYN] Seq=0 Win=65535 Len=0 MSS=1460 SACK_PERM=1
287811  96.135940 77.197.128.135 -> 41.177.26.176 TCP 64 intv > http [ACK] Seq=1 Ack=1 Win=65535 Len=0
289437  96.631384 77.197.128.135 -> 41.177.26.176 TCP 64 intv > http [ACK] Seq=356 Ack=2431 Win=65535 Len=0
289440  96.631618 77.197.128.135 -> 41.177.26.176 TCP 64 intv > http [ACK] Seq=356 Ack=4057 Win=65535 Len=0
289710  96.713007 77.197.128.135 -> 41.177.26.176 TCP 64 intv > http [ACK] Seq=356 Ack=6237 Win=65535 Len=0
289711  96.713156 77.197.128.135 -> 41.177.26.176 TCP 64 intv > http [ACK] Seq=356 Ack=9987 Win=65535 Len=0
289982  96.794837 77.197.128.135 -> 41.177.26.176 TCP 64 intv > http [RST, ACK] Seq=356 Ack=11382 Win=0 Len=0
491252 162.119252 77.197.128.135 -> 41.177.26.176 TCP 66 17346 > http [SYN] Seq=0 Win=65535 Len=0 MSS=1460 SACK_PERM=1
491346 162.201305 77.197.128.135 -> 41.177.26.176 TCP 64 17346 > http [ACK] Seq=1 Ack=1 Win=65535 Len=0
492326 162.589335 77.197.128.135 -> 41.177.26.176 TCP 64 17346 > http [ACK] Seq=302 Ack=2431 Win=65535 Len=0
492793 162.671040 77.197.128.135 -> 41.177.26.176 TCP 64 17346 > http [ACK] Seq=302 Ack=6043 Win=65535 Len=0
493119 162.752821 77.197.128.135 -> 41.177.26.176 TCP 64 17346 > http [ACK] Seq=302 Ack=7930 Win=65535 Len=0
493120 162.752918 77.197.128.135 -> 41.177.26.176 TCP 64 17346 > http [ACK] Seq=302 Ack=11186 Win=65535 Len=0
493121 162.753234 77.197.128.135 -> 41.177.26.176 TCP 64 17346 > http [RST, ACK] Seq=302 Ack=11186 Win=0 Len=0
842173 276.741662 77.197.128.135 -> 41.177.26.176 TCP 66 40737 > http [SYN] Seq=0 Win=65535 Len=0 MSS=1460 SACK_PERM=1
842444 276.823333 77.197.128.135 -> 41.177.26.176 TCP 64 40737 > http [ACK] Seq=1 Ack=1 Win=65535 Len=0
845768 278.601270 77.197.128.135 -> 41.177.26.176 TCP 64 40737 > http [ACK] Seq=285 Ack=1704 Win=65535 Len=0
845794 278.611639 77.197.128.135 -> 41.177.26.176 TCP 64 40737 > http [ACK] Seq=285 Ack=2741 Win=64498 Len=0
845796 278.611693 77.197.128.135 -> 41.177.26.176 TCP 64 40737 > http [ACK] Seq=285 Ack=3116 Win=64123 Len=0
845879 278.683031 77.197.128.135 -> 41.177.26.176 TCP 64 40737 > http [ACK] Seq=285 Ack=5460 Win=65535 Len=0
845906 278.693193 77.197.128.135 -> 41.177.26.176 TCP 64 40737 > http [ACK] Seq=285 Ack=8252 Win=65535 Len=0
845908 278.693427 77.197.128.135 -> 41.177.26.176 TCP 64 40737 > http [ACK] Seq=285 Ack=10672 Win=65535 Len=0
845909 278.693539 77.197.128.135 -> 41.177.26.176 TCP 64 40737 > http [RST, ACK] Seq=285 Ack=10672 Win=0 Len=0
922099 306.015415 77.197.128.135 -> 41.177.26.176 TCP 66 45713 > http [SYN] Seq=0 Win=65535 Len=0 MSS=1460 SACK_PERM=1
922239 306.097200 77.197.128.135 -> 41.177.26.176 TCP 64 45713 > http [ACK] Seq=1 Ack=1 Win=65535 Len=0
922792 306.486280 77.197.128.135 -> 41.177.26.176 TCP 64 45713 > http [ACK] Seq=305 Ack=2431 Win=65535 Len=0
922965 306.568048 77.197.128.135 -> 41.177.26.176 TCP 64 45713 > http [ACK] Seq=305 Ack=7523 Win=65535 Len=0
923083 306.649759 77.197.128.135 -> 41.177.26.176 TCP 64 45713 > http [ACK] Seq=305 Ack=11337 Win=64821 Len=0
923084 306.649764 77.197.128.135 -> 41.177.26.176 TCP 64 [TCP Dup ACK 923083#1] 45713 > http [ACK] Seq=305 Ack=11337 Win=64821 Len=0
923085 306.650220 77.197.128.135 -> 41.177.26.176 TCP 64 45713 > http [RST, ACK] Seq=305 Ack=11337 Win=0 Len=0
1001593 335.577220 77.197.128.135 -> 41.177.26.176 TCP 66 51050 > http [SYN] Seq=0 Win=65535 Len=0 MSS=1460 SACK_PERM=1
1001672 335.659188 77.197.128.135 -> 41.177.26.176 TCP 64 51050 > http [ACK] Seq=1 Ack=1 Win=65535 Len=0
1002682 336.106576 77.197.128.135 -> 41.177.26.176 TCP 64 51050 > http [ACK] Seq=306 Ack=2431 Win=65535 Len=0
1002683 336.106738 77.197.128.135 -> 41.177.26.176 TCP 64 51050 > http [ACK] Seq=306 Ack=3895 Win=65535 Len=0
1002756 336.188278 77.197.128.135 -> 41.177.26.176 TCP 64 51050 > http [ACK] Seq=306 Ack=6075 Win=65535 Len=0
1002757 336.188283 77.197.128.135 -> 41.177.26.176 TCP 64 51050 > http [ACK] Seq=306 Ack=8312 Win=65535 Len=0
1002758 336.188475 77.197.128.135 -> 41.177.26.176 TCP 64 51050 > http [ACK] Seq=306 Ack=11191 Win=65535 Len=0
1002759 336.188810 77.197.128.135 -> 41.177.26.176 TCP 64 51050 > http [RST, ACK] Seq=306 Ack=11191 Win=0 Len=0
