97090  36.459670 77.197.128.92 -> 41.177.26.15 TCP 66 5832 > http [SYN] Seq=0 Win=65535 Len=0 MSS=1460 SACK_PERM=1
97425  36.541621 77.197.128.92 -> 41.177.26.15 TCP 64 5832 > http [ACK] Seq=1 Ack=1 Win=65535 Len=0
103773  37.658692 77.197.128.92 -> 41.177.26.15 TCP 64 5832 > http [ACK] Seq=377 Ack=4381 Win=65535 Len=0
104319  37.740782 77.197.128.92 -> 41.177.26.15 TCP 64 5832 > http [ACK] Seq=377 Ack=7301 Win=65535 Len=0
104320  37.740787 77.197.128.92 -> 41.177.26.15 TCP 64 5832 > http [ACK] Seq=377 Ack=9936 Win=65535 Len=0
104487  37.822689 77.197.128.92 -> 41.177.26.15 TCP 64 5832 > http [ACK] Seq=377 Ack=12856 Win=65252 Len=0
104488  37.822693 77.197.128.92 -> 41.177.26.15 TCP 64 [TCP Dup ACK 104487#1] 5832 > http [ACK] Seq=377 Ack=12856 Win=65252 Len=0
104489  37.822697 77.197.128.92 -> 41.177.26.15 TCP 64 5832 > http [ACK] Seq=377 Ack=16668 Win=65535 Len=0
104772  37.904461 77.197.128.92 -> 41.177.26.15 TCP 64 5832 > http [ACK] Seq=377 Ack=19588 Win=65535 Len=0
104773  37.904465 77.197.128.92 -> 41.177.26.15 TCP 64 5832 > http [ACK] Seq=377 Ack=26320 Win=65535 Len=0
105182  37.986227 77.197.128.92 -> 41.177.26.15 TCP 64 5832 > http [ACK] Seq=377 Ack=30700 Win=65535 Len=0
105183  37.986232 77.197.128.92 -> 41.177.26.15 TCP 64 5832 > http [ACK] Seq=377 Ack=33052 Win=65535 Len=0
105184  37.986236 77.197.128.92 -> 41.177.26.15 TCP 64 5832 > http [ACK] Seq=377 Ack=35059 Win=64988 Len=0
105185  37.986240 77.197.128.92 -> 41.177.26.15 TCP 64 [TCP Dup ACK 105184#1] 5832 > http [ACK] Seq=377 Ack=35059 Win=64988 Len=0
105197  37.988581 77.197.128.92 -> 41.177.26.15 TCP 64 5832 > http [RST, ACK] Seq=377 Ack=35059 Win=0 Len=0
130066  45.449290 77.197.128.92 -> 41.177.26.15 TCP 66 15118 > http [SYN] Seq=0 Win=65535 Len=0 MSS=1460 SACK_PERM=1
130316  45.531120 77.197.128.92 -> 41.177.26.15 TCP 64 15118 > http [ACK] Seq=1 Ack=1 Win=65535 Len=0
132536  46.182840 77.197.128.92 -> 41.177.26.15 TCP 64 15118 > http [ACK] Seq=308 Ack=4381 Win=65535 Len=0
132741  46.264610 77.197.128.92 -> 41.177.26.15 TCP 64 15118 > http [ACK] Seq=308 Ack=7301 Win=65535 Len=0
132743  46.264853 77.197.128.92 -> 41.177.26.15 TCP 64 15118 > http [ACK] Seq=308 Ack=9925 Win=65535 Len=0
132952  46.346362 77.197.128.92 -> 41.177.26.15 TCP 64 15118 > http [ACK] Seq=308 Ack=14305 Win=63803 Len=0
132953  46.346367 77.197.128.92 -> 41.177.26.15 TCP 64 [TCP Window Update] 15118 > http [ACK] Seq=308 Ack=14305 Win=65535 Len=0
132955  46.346613 77.197.128.92 -> 41.177.26.15 TCP 64 15118 > http [ACK] Seq=308 Ack=18125 Win=65535 Len=0
133228  46.428255 77.197.128.92 -> 41.177.26.15 TCP 64 15118 > http [ACK] Seq=308 Ack=22505 Win=65527 Len=0
133229  46.428260 77.197.128.92 -> 41.177.26.15 TCP 64 [TCP Dup ACK 133228#1] 15118 > http [ACK] Seq=308 Ack=22505 Win=65527 Len=0
133230  46.428303 77.197.128.92 -> 41.177.26.15 TCP 64 15118 > http [ACK] Seq=308 Ack=26325 Win=65535 Len=0
133236  46.428606 77.197.128.92 -> 41.177.26.15 TCP 64 15118 > http [ACK] Seq=308 Ack=29245 Win=65535 Len=0
133521  46.510085 77.197.128.92 -> 41.177.26.15 TCP 64 15118 > http [ACK] Seq=308 Ack=35985 Win=61707 Len=0
133522  46.510110 77.197.128.92 -> 41.177.26.15 TCP 64 [TCP Window Update] 15118 > http [ACK] Seq=308 Ack=35985 Win=65535 Len=0
133523  46.510234 77.197.128.92 -> 41.177.26.15 TCP 64 15118 > http [ACK] Seq=308 Ack=38905 Win=65535 Len=0
133526  46.510518 77.197.128.92 -> 41.177.26.15 TCP 64 15118 > http [ACK] Seq=308 Ack=41265 Win=65535 Len=0
133527  46.510549 77.197.128.92 -> 41.177.26.15 TCP 64 15118 > http [ACK] Seq=308 Ack=44185 Win=65527 Len=0
133528  46.510554 77.197.128.92 -> 41.177.26.15 TCP 64 [TCP Dup ACK 133527#1] 15118 > http [ACK] Seq=308 Ack=44185 Win=65527 Len=0
134038  46.592251 77.197.128.92 -> 41.177.26.15 TCP 64 15118 > http [ACK] Seq=308 Ack=49465 Win=65535 Len=0
134039  46.592409 77.197.128.92 -> 41.177.26.15 TCP 64 15118 > http [ACK] Seq=308 Ack=52385 Win=65527 Len=0
134040  46.592413 77.197.128.92 -> 41.177.26.15 TCP 64 [TCP Dup ACK 134039#1] 15118 > http [ACK] Seq=308 Ack=52385 Win=65527 Len=0
134041  46.592615 77.197.128.92 -> 41.177.26.15 TCP 64 15118 > http [ACK] Seq=308 Ack=55305 Win=65535 Len=0
134042  46.592621 77.197.128.92 -> 41.177.26.15 TCP 64 15118 > http [ACK] Seq=308 Ack=60585 Win=65535 Len=0
134043  46.592625 77.197.128.92 -> 41.177.26.15 TCP 64 15118 > http [ACK] Seq=308 Ack=63505 Win=65527 Len=0
134044  46.592628 77.197.128.92 -> 41.177.26.15 TCP 64 [TCP Dup ACK 134043#1] 15118 > http [ACK] Seq=308 Ack=63505 Win=65527 Len=0
134290  46.674172 77.197.128.92 -> 41.177.26.15 TCP 64 15118 > http [ACK] Seq=308 Ack=65865 Win=65535 Len=0
134291  46.674276 77.197.128.92 -> 41.177.26.15 TCP 64 15118 > http [ACK] Seq=308 Ack=71705 Win=65535 Len=0
134292  46.674281 77.197.128.92 -> 41.177.26.15 TCP 64 15118 > http [ACK] Seq=308 Ack=74065 Win=65535 Len=0
134295  46.674578 77.197.128.92 -> 41.177.26.15 TCP 64 15118 > http [ACK] Seq=308 Ack=76985 Win=65535 Len=0
134296  46.674658 77.197.128.92 -> 41.177.26.15 TCP 64 15118 > http [ACK] Seq=308 Ack=79905 Win=65535 Len=0
134297  46.674663 77.197.128.92 -> 41.177.26.15 TCP 64 15118 > http [ACK] Seq=308 Ack=82265 Win=65535 Len=0
134306  46.674859 77.197.128.92 -> 41.177.26.15 TCP 64 15118 > http [ACK] Seq=308 Ack=88105 Win=65535 Len=0
134307  46.674863 77.197.128.92 -> 41.177.26.15 TCP 64 15118 > http [ACK] Seq=308 Ack=91925 Win=65535 Len=0
134591  46.756120 77.197.128.92 -> 41.177.26.15 TCP 64 15118 > http [ACK] Seq=308 Ack=94845 Win=65535 Len=0
134592  46.756300 77.197.128.92 -> 41.177.26.15 TCP 64 15118 > http [ACK] Seq=308 Ack=98665 Win=65535 Len=0
134593  46.756305 77.197.128.92 -> 41.177.26.15 TCP 64 15118 > http [ACK] Seq=308 Ack=101585 Win=62615 Len=0
134594  46.756343 77.197.128.92 -> 41.177.26.15 TCP 64 [TCP Window Update] 15118 > http [ACK] Seq=308 Ack=101585 Win=65535 Len=0
134595  46.756462 77.197.128.92 -> 41.177.26.15 TCP 64 15118 > http [ACK] Seq=308 Ack=104505 Win=65535 Len=0
134596  46.756466 77.197.128.92 -> 41.177.26.15 TCP 64 15118 > http [ACK] Seq=308 Ack=106865 Win=63175 Len=0
134597  46.756470 77.197.128.92 -> 41.177.26.15 TCP 64 [TCP Window Update] 15118 > http [ACK] Seq=308 Ack=106865 Win=65535 Len=0
134598  46.756558 77.197.128.92 -> 41.177.26.15 TCP 64 15118 > http [ACK] Seq=308 Ack=109785 Win=65535 Len=0
134599  46.756724 77.197.128.92 -> 41.177.26.15 TCP 64 15118 > http [ACK] Seq=308 Ack=115065 Win=65527 Len=0
134600  46.756729 77.197.128.92 -> 41.177.26.15 TCP 64 [TCP Dup ACK 134599#1] 15118 > http [ACK] Seq=308 Ack=115065 Win=65527 Len=0
134601  46.756732 77.197.128.92 -> 41.177.26.15 TCP 64 15118 > http [ACK] Seq=308 Ack=119445 Win=65535 Len=0
134602  46.756912 77.197.128.92 -> 41.177.26.15 TCP 64 15118 > http [ACK] Seq=308 Ack=125146 Win=63646 Len=0
134603  46.756916 77.197.128.92 -> 41.177.26.15 TCP 64 [TCP Window Update] 15118 > http [ACK] Seq=308 Ack=125146 Win=65535 Len=0
134627  46.766899 77.197.128.92 -> 41.177.26.15 TCP 64 15118 > http [RST, ACK] Seq=308 Ack=125146 Win=0 Len=0
155034  52.921854 77.197.128.92 -> 41.177.26.15 TCP 66 20979 > http [SYN] Seq=0 Win=65535 Len=0 MSS=1460 SACK_PERM=1
155312  53.003619 77.197.128.92 -> 41.177.26.15 TCP 64 20979 > http [ACK] Seq=1 Ack=1 Win=65535 Len=0
156760  53.381873 77.197.128.92 -> 41.177.26.15 TCP 64 20979 > http [ACK] Seq=308 Ack=4381 Win=65535 Len=0
156959  53.463670 77.197.128.92 -> 41.177.26.15 TCP 64 20979 > http [ACK] Seq=308 Ack=7301 Win=65535 Len=0
156960  53.463695 77.197.128.92 -> 41.177.26.15 TCP 64 20979 > http [ACK] Seq=308 Ack=9925 Win=65535 Len=0
157131  53.545403 77.197.128.92 -> 41.177.26.15 TCP 64 20979 > http [ACK] Seq=308 Ack=12845 Win=65263 Len=0
157132  53.545543 77.197.128.92 -> 41.177.26.15 TCP 64 [TCP Dup ACK 157131#1] 20979 > http [ACK] Seq=308 Ack=12845 Win=65263 Len=0
157133  53.545548 77.197.128.92 -> 41.177.26.15 TCP 64 20979 > http [ACK] Seq=308 Ack=16665 Win=65535 Len=0
157423  53.628112 77.197.128.92 -> 41.177.26.15 TCP 64 20979 > http [ACK] Seq=308 Ack=21045 Win=65535 Len=0
157424  53.628318 77.197.128.92 -> 41.177.26.15 TCP 64 20979 > http [ACK] Seq=308 Ack=27785 Win=62607 Len=0
157425  53.628323 77.197.128.92 -> 41.177.26.15 TCP 64 [TCP Window Update] 20979 > http [ACK] Seq=308 Ack=27785 Win=65535 Len=0
157677  53.711866 77.197.128.92 -> 41.177.26.15 TCP 64 20979 > http [ACK] Seq=308 Ack=30705 Win=65535 Len=0
157679  53.712118 77.197.128.92 -> 41.177.26.15 TCP 64 20979 > http [ACK] Seq=308 Ack=33065 Win=65535 Len=0
157680  53.712122 77.197.128.92 -> 41.177.26.15 TCP 64 20979 > http [ACK] Seq=308 Ack=35985 Win=65527 Len=0
157681  53.712127 77.197.128.92 -> 41.177.26.15 TCP 64 [TCP Dup ACK 157680#1] 20979 > http [ACK] Seq=308 Ack=35985 Win=65527 Len=0
157682  53.712131 77.197.128.92 -> 41.177.26.15 TCP 64 20979 > http [ACK] Seq=308 Ack=38905 Win=65535 Len=0
157683  53.712135 77.197.128.92 -> 41.177.26.15 TCP 64 20979 > http [ACK] Seq=308 Ack=41265 Win=65535 Len=0
157917  53.793602 77.197.128.92 -> 41.177.26.15 TCP 64 20979 > http [ACK] Seq=308 Ack=44185 Win=65535 Len=0
157922  53.793854 77.197.128.92 -> 41.177.26.15 TCP 64 20979 > http [ACK] Seq=308 Ack=49465 Win=63167 Len=0
157923  53.793858 77.197.128.92 -> 41.177.26.15 TCP 64 [TCP Window Update] 20979 > http [ACK] Seq=308 Ack=49465 Win=65535 Len=0
157924  53.793862 77.197.128.92 -> 41.177.26.15 TCP 64 20979 > http [ACK] Seq=308 Ack=52385 Win=65535 Len=0
157926  53.793975 77.197.128.92 -> 41.177.26.15 TCP 64 20979 > http [ACK] Seq=308 Ack=55305 Win=65535 Len=0
157931  53.794194 77.197.128.92 -> 41.177.26.15 TCP 64 20979 > http [ACK] Seq=308 Ack=60585 Win=65527 Len=0
157932  53.794198 77.197.128.92 -> 41.177.26.15 TCP 64 [TCP Dup ACK 157931#1] 20979 > http [ACK] Seq=308 Ack=60585 Win=65527 Len=0
158117  53.875233 77.197.128.92 -> 41.177.26.15 TCP 64 20979 > http [ACK] Seq=308 Ack=63505 Win=65535 Len=0
158118  53.875296 77.197.128.92 -> 41.177.26.15 TCP 64 20979 > http [ACK] Seq=308 Ack=65865 Win=65535 Len=0
158124  53.875572 77.197.128.92 -> 41.177.26.15 TCP 64 20979 > http [ACK] Seq=308 Ack=68785 Win=65535 Len=0
158125  53.875576 77.197.128.92 -> 41.177.26.15 TCP 64 20979 > http [ACK] Seq=308 Ack=70245 Win=65535 Len=0
158129  53.875773 77.197.128.92 -> 41.177.26.15 TCP 64 20979 > http [ACK] Seq=308 Ack=74065 Win=65535 Len=0
158137  53.876108 77.197.128.92 -> 41.177.26.15 TCP 64 20979 > http [ACK] Seq=308 Ack=76985 Win=65535 Len=0
158138  53.876114 77.197.128.92 -> 41.177.26.15 TCP 64 20979 > http [ACK] Seq=308 Ack=81365 Win=65535 Len=0
158139  53.876231 77.197.128.92 -> 41.177.26.15 TCP 64 20979 > http [ACK] Seq=308 Ack=83725 Win=65535 Len=0
158144  53.876347 77.197.128.92 -> 41.177.26.15 TCP 64 20979 > http [ACK] Seq=308 Ack=86645 Win=65535 Len=0
158145  53.876350 77.197.128.92 -> 41.177.26.15 TCP 64 20979 > http [ACK] Seq=308 Ack=89565 Win=65535 Len=0
158448  53.956947 77.197.128.92 -> 41.177.26.15 TCP 64 20979 > http [ACK] Seq=308 Ack=93385 Win=65535 Len=0
158449  53.956953 77.197.128.92 -> 41.177.26.15 TCP 64 20979 > http [ACK] Seq=308 Ack=96305 Win=65535 Len=0
158450  53.957103 77.197.128.92 -> 41.177.26.15 TCP 64 20979 > http [ACK] Seq=308 Ack=97765 Win=65535 Len=0
158451  53.957272 77.197.128.92 -> 41.177.26.15 TCP 64 20979 > http [ACK] Seq=308 Ack=100125 Win=65535 Len=0
158455  53.957391 77.197.128.92 -> 41.177.26.15 TCP 64 20979 > http [ACK] Seq=308 Ack=104505 Win=65535 Len=0
158459  53.957537 77.197.128.92 -> 41.177.26.15 TCP 64 20979 > http [ACK] Seq=308 Ack=106865 Win=63175 Len=0
158460  53.957541 77.197.128.92 -> 41.177.26.15 TCP 64 [TCP Window Update] 20979 > http [ACK] Seq=308 Ack=106865 Win=65535 Len=0
158461  53.957545 77.197.128.92 -> 41.177.26.15 TCP 64 20979 > http [ACK] Seq=308 Ack=109785 Win=65535 Len=0
158464  53.957723 77.197.128.92 -> 41.177.26.15 TCP 64 20979 > http [ACK] Seq=308 Ack=112705 Win=65535 Len=0
158465  53.957829 77.197.128.92 -> 41.177.26.15 TCP 64 20979 > http [ACK] Seq=308 Ack=116525 Win=64067 Len=0
158466  53.957851 77.197.128.92 -> 41.177.26.15 TCP 64 [TCP Window Update] 20979 > http [ACK] Seq=308 Ack=116525 Win=65535 Len=0
158467  53.957856 77.197.128.92 -> 41.177.26.15 TCP 64 20979 > http [ACK] Seq=308 Ack=120905 Win=65535 Len=0
158468  53.957945 77.197.128.92 -> 41.177.26.15 TCP 64 20979 > http [ACK] Seq=308 Ack=123265 Win=65535 Len=0
158469  53.958123 77.197.128.92 -> 41.177.26.15 TCP 64 20979 > http [ACK] Seq=308 Ack=127645 Win=64067 Len=0
158470  53.958128 77.197.128.92 -> 41.177.26.15 TCP 64 [TCP Window Update] 20979 > http [ACK] Seq=308 Ack=127645 Win=65535 Len=0
158471  53.958146 77.197.128.92 -> 41.177.26.15 TCP 64 20979 > http [ACK] Seq=308 Ack=132925 Win=65535 Len=0
158653  54.038785 77.197.128.92 -> 41.177.26.15 TCP 64 20979 > http [ACK] Seq=308 Ack=135845 Win=65527 Len=0
158654  54.038790 77.197.128.92 -> 41.177.26.15 TCP 64 [TCP Dup ACK 158653#1] 20979 > http [ACK] Seq=308 Ack=135845 Win=65527 Len=0
158657  54.038929 77.197.128.92 -> 41.177.26.15 TCP 64 20979 > http [ACK] Seq=308 Ack=139665 Win=65535 Len=0
158659  54.038974 77.197.128.92 -> 41.177.26.15 TCP 64 20979 > http [ACK] Seq=308 Ack=142585 Win=65535 Len=0
158731  54.049903 77.197.128.92 -> 41.177.26.15 TCP 64 20979 > http [RST, ACK] Seq=308 Ack=143997 Win=0 Len=0
