201230  69.411104 77.197.128.139 -> 41.177.26.46 TCP 66 35152 > http [SYN] Seq=0 Win=65535 Len=0 MSS=1460 SACK_PERM=1
201442  69.492782 77.197.128.139 -> 41.177.26.46 TCP 64 35152 > http [ACK] Seq=1 Ack=1 Win=65535 Len=0
202005  69.751726 77.197.128.139 -> 41.177.26.46 TCP 64 35152 > http [ACK] Seq=334 Ack=170 Win=65366 Len=0
202898  69.988430 77.197.128.139 -> 41.177.26.46 TCP 64 35152 > http [RST, ACK] Seq=334 Ack=170 Win=0 Len=0
762771 246.125866 77.197.128.139 -> 41.177.26.176 TCP 66 5935 > http [SYN] Seq=0 Win=65535 Len=0 MSS=1460 SACK_PERM=1
762947 246.208020 77.197.128.139 -> 41.177.26.176 TCP 64 5935 > http [ACK] Seq=1 Ack=1 Win=65535 Len=0
764325 246.681578 77.197.128.139 -> 41.177.26.176 TCP 64 5935 > http [ACK] Seq=305 Ack=2431 Win=65535 Len=0
764326 246.681675 77.197.128.139 -> 41.177.26.176 TCP 64 5935 > http [ACK] Seq=305 Ack=3896 Win=65535 Len=0
764508 246.763268 77.197.128.139 -> 41.177.26.176 TCP 64 5935 > http [ACK] Seq=305 Ack=6070 Win=65535 Len=0
764509 246.763455 77.197.128.139 -> 41.177.26.176 TCP 64 5935 > http [ACK] Seq=305 Ack=10450 Win=61155 Len=0
764510 246.763460 77.197.128.139 -> 41.177.26.176 TCP 64 [TCP Window Update] 5935 > http [ACK] Seq=305 Ack=10450 Win=65535 Len=0
764777 246.915670 77.197.128.139 -> 41.177.26.176 TCP 64 5935 > http [RST, ACK] Seq=305 Ack=11337 Win=0 Len=0
778990 251.321617 77.197.128.139 -> 41.177.26.176 TCP 66 11155 > http [SYN] Seq=0 Win=65535 Len=0 MSS=1460 SACK_PERM=1
779059 251.403495 77.197.128.139 -> 41.177.26.176 TCP 64 11155 > http [ACK] Seq=1 Ack=1 Win=65535 Len=0
779952 251.863383 77.197.128.139 -> 41.177.26.176 TCP 64 11155 > http [ACK] Seq=309 Ack=2431 Win=65535 Len=0
780148 251.945360 77.197.128.139 -> 41.177.26.176 TCP 64 11155 > http [ACK] Seq=309 Ack=6075 Win=65535 Len=0
780151 251.945630 77.197.128.139 -> 41.177.26.176 TCP 64 11155 > http [ACK] Seq=309 Ack=7535 Win=65535 Len=0
780277 252.027161 77.197.128.139 -> 41.177.26.176 TCP 64 11155 > http [ACK] Seq=309 Ack=11576 Win=65535 Len=0
780281 252.027735 77.197.128.139 -> 41.177.26.176 TCP 64 11155 > http [RST, ACK] Seq=309 Ack=11576 Win=0 Len=0
782680 253.340511 77.197.128.139 -> 41.177.26.176 TCP 66 12081 > http [SYN] Seq=0 Win=65535 Len=0 MSS=1460 SACK_PERM=1
782830 253.422484 77.197.128.139 -> 41.177.26.176 TCP 64 12081 > http [ACK] Seq=1 Ack=1 Win=65535 Len=0
783797 253.836099 77.197.128.139 -> 41.177.26.176 TCP 64 12081 > http [ACK] Seq=317 Ack=2431 Win=65535 Len=0
783921 253.918045 77.197.128.139 -> 41.177.26.176 TCP 64 12081 > http [ACK] Seq=317 Ack=6055 Win=65383 Len=0
783922 253.918050 77.197.128.139 -> 41.177.26.176 TCP 64 [TCP Dup ACK 783921#1] 12081 > http [ACK] Seq=317 Ack=6055 Win=65383 Len=0
784161 253.999761 77.197.128.139 -> 41.177.26.176 TCP 64 12081 > http [ACK] Seq=317 Ack=8197 Win=65535 Len=0
784162 253.999921 77.197.128.139 -> 41.177.26.176 TCP 64 12081 > http [ACK] Seq=317 Ack=9657 Win=64075 Len=0
784176 254.007618 77.197.128.139 -> 41.177.26.176 TCP 64 12081 > http [ACK] Seq=317 Ack=11049 Win=65535 Len=0
784177 254.007954 77.197.128.139 -> 41.177.26.176 TCP 64 12081 > http [RST, ACK] Seq=317 Ack=11049 Win=0 Len=0
784603 254.260009 77.197.128.139 -> 41.177.26.176 TCP 66 12525 > http [SYN] Seq=0 Win=65535 Len=0 MSS=1460 SACK_PERM=1
784790 254.341740 77.197.128.139 -> 41.177.26.176 TCP 64 12525 > http [ACK] Seq=1 Ack=1 Win=65535 Len=0
785752 254.729218 77.197.128.139 -> 41.177.26.176 TCP 64 12525 > http [ACK] Seq=305 Ack=2431 Win=65535 Len=0
785753 254.729223 77.197.128.139 -> 41.177.26.176 TCP 64 12525 > http [ACK] Seq=305 Ack=3896 Win=65535 Len=0
785845 254.811211 77.197.128.139 -> 41.177.26.176 TCP 64 12525 > http [ACK] Seq=305 Ack=6070 Win=65535 Len=0
785846 254.811216 77.197.128.139 -> 41.177.26.176 TCP 64 12525 > http [ACK] Seq=305 Ack=8336 Win=65535 Len=0
785847 254.811220 77.197.128.139 -> 41.177.26.176 TCP 64 12525 > http [ACK] Seq=305 Ack=9796 Win=65535 Len=0
786015 254.924124 77.197.128.139 -> 41.177.26.176 TCP 64 12525 > http [ACK] Seq=305 Ack=11192 Win=64139 Len=0
786032 254.949314 77.197.128.139 -> 41.177.26.176 TCP 64 12525 > http [RST, ACK] Seq=305 Ack=11192 Win=0 Len=0
786468 255.289076 77.197.128.139 -> 41.177.26.176 TCP 66 12867 > http [SYN] Seq=0 Win=65535 Len=0 MSS=1460 SACK_PERM=1
786789 255.370889 77.197.128.139 -> 41.177.26.176 TCP 64 12867 > http [ACK] Seq=1 Ack=1 Win=65535 Len=0
787827 255.756987 77.197.128.139 -> 41.177.26.176 TCP 64 12867 > http [ACK] Seq=285 Ack=3205 Win=65535 Len=0
787961 255.838939 77.197.128.139 -> 41.177.26.176 TCP 64 12867 > http [ACK] Seq=285 Ack=6073 Win=65535 Len=0
787962 255.838944 77.197.128.139 -> 41.177.26.176 TCP 64 12867 > http [ACK] Seq=285 Ack=8516 Win=65535 Len=0
788106 255.920816 77.197.128.139 -> 41.177.26.176 TCP 64 12867 > http [ACK] Seq=285 Ack=11226 Win=65535 Len=0
788107 255.920985 77.197.128.139 -> 41.177.26.176 TCP 64 12867 > http [ACK] Seq=285 Ack=12624 Win=64137 Len=0
788108 255.920990 77.197.128.139 -> 41.177.26.176 TCP 64 12867 > http [ACK] Seq=285 Ack=16829 Win=65535 Len=0
788296 256.002692 77.197.128.139 -> 41.177.26.176 TCP 64 12867 > http [ACK] Seq=285 Ack=19382 Win=65535 Len=0
788297 256.002863 77.197.128.139 -> 41.177.26.176 TCP 64 12867 > http [ACK] Seq=285 Ack=24665 Win=65535 Len=0
788298 256.003257 77.197.128.139 -> 41.177.26.176 TCP 64 12867 > http [RST, ACK] Seq=285 Ack=24665 Win=0 Len=0
790203 256.695604 77.197.128.139 -> 41.177.26.176 TCP 66 13335 > http [SYN] Seq=0 Win=65535 Len=0 MSS=1460 SACK_PERM=1
790417 256.777703 77.197.128.139 -> 41.177.26.176 TCP 64 13335 > http [ACK] Seq=1 Ack=1 Win=65535 Len=0
791601 257.301004 77.197.128.139 -> 41.177.26.176 TCP 64 13335 > http [ACK] Seq=356 Ack=2429 Win=65535 Len=0
791884 257.382802 77.197.128.139 -> 41.177.26.176 TCP 64 13335 > http [ACK] Seq=356 Ack=5349 Win=65535 Len=0
791885 257.382856 77.197.128.139 -> 41.177.26.176 TCP 64 13335 > http [ACK] Seq=356 Ack=7688 Win=65535 Len=0
792061 257.464622 77.197.128.139 -> 41.177.26.176 TCP 64 13335 > http [ACK] Seq=356 Ack=9728 Win=63495 Len=0
792062 257.464628 77.197.128.139 -> 41.177.26.176 TCP 64 [TCP Window Update] 13335 > http [ACK] Seq=356 Ack=9728 Win=65535 Len=0
792063 257.464631 77.197.128.139 -> 41.177.26.176 TCP 64 13335 > http [ACK] Seq=356 Ack=11362 Win=63901 Len=0
792236 257.561392 77.197.128.139 -> 41.177.26.176 TCP 64 [TCP Window Update] 13335 > http [ACK] Seq=356 Ack=11362 Win=65535 Len=0
792237 257.561518 77.197.128.139 -> 41.177.26.176 TCP 64 13335 > http [RST, ACK] Seq=356 Ack=11362 Win=0 Len=0
792755 257.936450 77.197.128.139 -> 41.177.26.176 TCP 66 bpdbm > http [SYN] Seq=0 Win=65535 Len=0 MSS=1460 SACK_PERM=1
792879 258.018241 77.197.128.139 -> 41.177.26.176 TCP 64 bpdbm > http [ACK] Seq=1 Ack=1 Win=65535 Len=0
793522 258.441535 77.197.128.139 -> 41.177.26.176 TCP 64 bpdbm > http [ACK] Seq=353 Ack=2431 Win=65535 Len=0
793523 258.441661 77.197.128.139 -> 41.177.26.176 TCP 64 bpdbm > http [ACK] Seq=353 Ack=4052 Win=65535 Len=0
793730 258.523710 77.197.128.139 -> 41.177.26.176 TCP 64 bpdbm > http [ACK] Seq=353 Ack=6220 Win=65535 Len=0
793731 258.523975 77.197.128.139 -> 41.177.26.176 TCP 64 bpdbm > http [ACK] Seq=353 Ack=11186 Win=64949 Len=0
794069 258.678489 77.197.128.139 -> 41.177.26.176 TCP 64 bpdbm > http [RST, ACK] Seq=353 Ack=11186 Win=0 Len=0
795254 259.134008 77.197.128.139 -> 41.177.26.176 TCP 66 14113 > http [SYN] Seq=0 Win=65535 Len=0 MSS=1460 SACK_PERM=1
795502 259.215996 77.197.128.139 -> 41.177.26.176 TCP 64 14113 > http [ACK] Seq=1 Ack=1 Win=65535 Len=0
796219 259.649231 77.197.128.139 -> 41.177.26.176 TCP 64 14113 > http [ACK] Seq=353 Ack=2431 Win=65535 Len=0
796220 259.649457 77.197.128.139 -> 41.177.26.176 TCP 64 14113 > http [ACK] Seq=353 Ack=4052 Win=65535 Len=0
796409 259.730965 77.197.128.139 -> 41.177.26.176 TCP 64 14113 > http [ACK] Seq=353 Ack=6216 Win=65535 Len=0
796410 259.731225 77.197.128.139 -> 41.177.26.176 TCP 64 14113 > http [ACK] Seq=353 Ack=9136 Win=65383 Len=0
796411 259.731230 77.197.128.139 -> 41.177.26.176 TCP 64 [TCP Dup ACK 796410#1] 14113 > http [ACK] Seq=353 Ack=9136 Win=65383 Len=0
796412 259.731234 77.197.128.139 -> 41.177.26.176 TCP 64 14113 > http [ACK] Seq=353 Ack=11199 Win=65535 Len=0
796657 259.870302 77.197.128.139 -> 41.177.26.176 TCP 64 14113 > http [RST, ACK] Seq=353 Ack=11199 Win=0 Len=0
797357 260.146121 77.197.128.139 -> 41.177.26.176 TCP 66 14419 > http [SYN] Seq=0 Win=65535 Len=0 MSS=1460 SACK_PERM=1
797783 260.227854 77.197.128.139 -> 41.177.26.176 TCP 64 14419 > http [ACK] Seq=1 Ack=1 Win=65535 Len=0
803550 262.522551 77.197.128.139 -> 41.177.26.176 TCP 64 14419 > http [ACK] Seq=288 Ack=1487 Win=65535 Len=0
803588 262.534509 77.197.128.139 -> 41.177.26.176 TCP 64 14419 > http [ACK] Seq=288 Ack=2433 Win=64589 Len=0
803589 262.534813 77.197.128.139 -> 41.177.26.176 TCP 64 14419 > http [ACK] Seq=288 Ack=2805 Win=64217 Len=0
803590 262.534818 77.197.128.139 -> 41.177.26.176 TCP 64 14419 > http [ACK] Seq=288 Ack=3730 Win=65535 Len=0
803725 262.604475 77.197.128.139 -> 41.177.26.176 TCP 64 14419 > http [ACK] Seq=288 Ack=6248 Win=65535 Len=0
803790 262.616580 77.197.128.139 -> 41.177.26.176 TCP 64 14419 > http [ACK] Seq=288 Ack=9168 Win=65535 Len=0
804326 262.771246 77.197.128.139 -> 41.177.26.176 TCP 64 14419 > http [RST, ACK] Seq=288 Ack=10146 Win=0 Len=0
805130 263.205924 77.197.128.139 -> 41.177.26.176 TCP 66 15296 > http [SYN] Seq=0 Win=65535 Len=0 MSS=1460 SACK_PERM=1
805512 263.287752 77.197.128.139 -> 41.177.26.176 TCP 64 15296 > http [ACK] Seq=1 Ack=1 Win=65535 Len=0
807776 263.733179 77.197.128.139 -> 41.177.26.176 TCP 64 15296 > http [ACK] Seq=319 Ack=2431 Win=65535 Len=0
807780 263.733605 77.197.128.139 -> 41.177.26.176 TCP 64 15296 > http [ACK] Seq=319 Ack=3895 Win=65535 Len=0
808527 263.814887 77.197.128.139 -> 41.177.26.176 TCP 64 15296 > http [ACK] Seq=319 Ack=6075 Win=65535 Len=0
808531 263.815397 77.197.128.139 -> 41.177.26.176 TCP 64 15296 > http [ACK] Seq=319 Ack=8321 Win=65535 Len=0
808532 263.815402 77.197.128.139 -> 41.177.26.176 TCP 64 15296 > http [ACK] Seq=319 Ack=9781 Win=64075 Len=0
808861 263.893277 77.197.128.139 -> 41.177.26.176 TCP 64 [TCP Window Update] 15296 > http [ACK] Seq=319 Ack=9781 Win=65535 Len=0
808873 263.896809 77.197.128.139 -> 41.177.26.176 TCP 64 15296 > http [RST, ACK] Seq=319 Ack=11200 Win=0 Len=0
810385 264.209331 77.197.128.139 -> 41.177.26.176 TCP 66 15622 > http [SYN] Seq=0 Win=65535 Len=0 MSS=1460 SACK_PERM=1
810562 264.290976 77.197.128.139 -> 41.177.26.176 TCP 64 15622 > http [ACK] Seq=1 Ack=1 Win=65535 Len=0
811853 264.682780 77.197.128.139 -> 41.177.26.176 TCP 64 15622 > http [ACK] Seq=306 Ack=3899 Win=65535 Len=0
812040 264.764608 77.197.128.139 -> 41.177.26.176 TCP 64 15622 > http [ACK] Seq=306 Ack=6055 Win=65535 Len=0
812041 264.764612 77.197.128.139 -> 41.177.26.176 TCP 64 15622 > http [ACK] Seq=306 Ack=8285 Win=65535 Len=0
812370 264.846512 77.197.128.139 -> 41.177.26.176 TCP 64 15622 > http [ACK] Seq=306 Ack=11123 Win=65535 Len=0
812371 264.846855 77.197.128.139 -> 41.177.26.176 TCP 64 15622 > http [RST, ACK] Seq=306 Ack=11123 Win=0 Len=0
813109 265.209537 77.197.128.139 -> 41.177.26.176 TCP 66 15951 > http [SYN] Seq=0 Win=65535 Len=0 MSS=1460 SACK_PERM=1
813278 265.291154 77.197.128.139 -> 41.177.26.176 TCP 64 15951 > http [ACK] Seq=1 Ack=1 Win=65535 Len=0
814781 265.672715 77.197.128.139 -> 41.177.26.176 TCP 64 15951 > http [ACK] Seq=353 Ack=4058 Win=65535 Len=0
815191 265.754667 77.197.128.139 -> 41.177.26.176 TCP 64 15951 > http [ACK] Seq=353 Ack=6222 Win=65535 Len=0
815192 265.754831 77.197.128.139 -> 41.177.26.176 TCP 64 15951 > http [ACK] Seq=353 Ack=9142 Win=65535 Len=0
815482 265.836488 77.197.128.139 -> 41.177.26.176 TCP 64 15951 > http [ACK] Seq=353 Ack=11741 Win=64396 Len=0
815573 265.876004 77.197.128.139 -> 41.177.26.176 TCP 64 15951 > http [RST, ACK] Seq=353 Ack=11741 Win=0 Len=0
816284 266.226272 77.197.128.139 -> 41.177.26.176 TCP 66 16306 > http [SYN] Seq=0 Win=65535 Len=0 MSS=1460 SACK_PERM=1
816442 266.308037 77.197.128.139 -> 41.177.26.176 TCP 64 16306 > http [ACK] Seq=1 Ack=1 Win=65535 Len=0
817414 266.686429 77.197.128.139 -> 41.177.26.176 TCP 64 16306 > http [ACK] Seq=304 Ack=2431 Win=65535 Len=0
817415 266.686573 77.197.128.139 -> 41.177.26.176 TCP 64 16306 > http [ACK] Seq=304 Ack=3899 Win=65535 Len=0
817610 266.768163 77.197.128.139 -> 41.177.26.176 TCP 64 16306 > http [ACK] Seq=304 Ack=6063 Win=65535 Len=0
817611 266.768167 77.197.128.139 -> 41.177.26.176 TCP 64 16306 > http [ACK] Seq=304 Ack=8328 Win=63270 Len=0
817612 266.768172 77.197.128.139 -> 41.177.26.176 TCP 64 [TCP Window Update] 16306 > http [ACK] Seq=304 Ack=8328 Win=65535 Len=0
817613 266.768355 77.197.128.139 -> 41.177.26.176 TCP 64 16306 > http [ACK] Seq=304 Ack=11174 Win=64149 Len=0
818226 266.967500 77.197.128.139 -> 41.177.26.176 TCP 64 16306 > http [RST, ACK] Seq=304 Ack=11174 Win=0 Len=0
819293 267.312104 77.197.128.139 -> 41.177.26.176 TCP 66 16606 > http [SYN] Seq=0 Win=65535 Len=0 MSS=1460 SACK_PERM=1
819563 267.394102 77.197.128.139 -> 41.177.26.176 TCP 64 16606 > http [ACK] Seq=1 Ack=1 Win=65535 Len=0
820735 267.838210 77.197.128.139 -> 41.177.26.176 TCP 64 16606 > http [ACK] Seq=309 Ack=2431 Win=65535 Len=0
820975 267.919963 77.197.128.139 -> 41.177.26.176 TCP 64 16606 > http [ACK] Seq=309 Ack=6075 Win=65535 Len=0
821155 268.002020 77.197.128.139 -> 41.177.26.176 TCP 64 16606 > http [ACK] Seq=309 Ack=10455 Win=65535 Len=0
821348 268.054919 77.197.128.139 -> 41.177.26.176 TCP 64 16606 > http [RST, ACK] Seq=309 Ack=11264 Win=0 Len=0
821821 268.300001 77.197.128.139 -> 41.177.26.176 TCP 66 16903 > http [SYN] Seq=0 Win=65535 Len=0 MSS=1460 SACK_PERM=1
821987 268.381852 77.197.128.139 -> 41.177.26.176 TCP 64 16903 > http [ACK] Seq=1 Ack=1 Win=65535 Len=0
823119 268.795267 77.197.128.139 -> 41.177.26.176 TCP 64 16903 > http [ACK] Seq=308 Ack=3212 Win=65535 Len=0
823192 268.877278 77.197.128.139 -> 41.177.26.176 TCP 64 16903 > http [ACK] Seq=308 Ack=6112 Win=65535 Len=0
823193 268.877283 77.197.128.139 -> 41.177.26.176 TCP 64 16903 > http [ACK] Seq=308 Ack=7031 Win=64616 Len=0
823467 268.959336 77.197.128.139 -> 41.177.26.176 TCP 64 16903 > http [ACK] Seq=308 Ack=9685 Win=65535 Len=0
823468 268.959503 77.197.128.139 -> 41.177.26.176 TCP 64 16903 > http [ACK] Seq=308 Ack=15170 Win=60050 Len=0
823549 268.992462 77.197.128.139 -> 41.177.26.176 TCP 64 [TCP Window Update] 16903 > http [ACK] Seq=308 Ack=15170 Win=63522 Len=0
823550 268.992467 77.197.128.139 -> 41.177.26.176 TCP 64 [TCP Window Update] 16903 > http [ACK] Seq=308 Ack=15170 Win=65535 Len=0
823661 269.041691 77.197.128.139 -> 41.177.26.176 TCP 64 16903 > http [ACK] Seq=308 Ack=19354 Win=65535 Len=0
823662 269.041712 77.197.128.139 -> 41.177.26.176 TCP 64 16903 > http [ACK] Seq=308 Ack=23449 Win=65448 Len=0
823664 269.041789 77.197.128.139 -> 41.177.26.176 TCP 64 [TCP Dup ACK 823662#1] 16903 > http [ACK] Seq=308 Ack=23449 Win=65448 Len=0
823666 269.041993 77.197.128.139 -> 41.177.26.176 TCP 64 16903 > http [ACK] Seq=308 Ack=26118 Win=65535 Len=0
824065 269.123606 77.197.128.139 -> 41.177.26.176 TCP 64 16903 > http [ACK] Seq=308 Ack=28907 Win=65535 Len=0
824069 269.124371 77.197.128.139 -> 41.177.26.176 TCP 64 16903 > http [RST, ACK] Seq=308 Ack=30327 Win=0 Len=0
825160 269.341362 77.197.128.139 -> 41.177.26.176 TCP 66 17207 > http [SYN] Seq=0 Win=65535 Len=0 MSS=1460 SACK_PERM=1
825483 269.423074 77.197.128.139 -> 41.177.26.176 TCP 64 17207 > http [ACK] Seq=1 Ack=1 Win=65535 Len=0
828418 270.377154 77.197.128.139 -> 41.177.26.176 TCP 64 17207 > http [ACK] Seq=316 Ack=1600 Win=65535 Len=0
828436 270.387162 77.197.128.139 -> 41.177.26.176 TCP 64 17207 > http [ACK] Seq=316 Ack=2344 Win=64791 Len=0
828439 270.387483 77.197.128.139 -> 41.177.26.176 TCP 64 17207 > http [ACK] Seq=316 Ack=2786 Win=64349 Len=0
828441 270.387664 77.197.128.139 -> 41.177.26.176 TCP 64 17207 > http [ACK] Seq=316 Ack=3702 Win=65535 Len=0
828678 270.459305 77.197.128.139 -> 41.177.26.176 TCP 64 17207 > http [ACK] Seq=316 Ack=6510 Win=65535 Len=0
828692 270.468897 77.197.128.139 -> 41.177.26.176 TCP 64 17207 > http [ACK] Seq=316 Ack=9430 Win=62615 Len=0
828693 270.468926 77.197.128.139 -> 41.177.26.176 TCP 64 [TCP Window Update] 17207 > http [ACK] Seq=316 Ack=9430 Win=65535 Len=0
829166 270.616421 77.197.128.139 -> 41.177.26.176 TCP 64 17207 > http [RST, ACK] Seq=316 Ack=10440 Win=0 Len=0
829631 270.954344 77.197.128.139 -> 41.177.26.176 TCP 66 17671 > http [SYN] Seq=0 Win=65535 Len=0 MSS=1460 SACK_PERM=1
829789 271.036055 77.197.128.139 -> 41.177.26.176 TCP 64 17671 > http [ACK] Seq=1 Ack=1 Win=65535 Len=0
830442 271.425735 77.197.128.139 -> 41.177.26.176 TCP 64 17671 > http [ACK] Seq=317 Ack=2431 Win=65535 Len=0
830443 271.425740 77.197.128.139 -> 41.177.26.176 TCP 64 17671 > http [ACK] Seq=317 Ack=3892 Win=65535 Len=0
830589 271.507722 77.197.128.139 -> 41.177.26.176 TCP 64 17671 > http [ACK] Seq=317 Ack=6062 Win=65535 Len=0
830590 271.507846 77.197.128.139 -> 41.177.26.176 TCP 64 17671 > http [ACK] Seq=317 Ack=8483 Win=65535 Len=0
830720 271.589606 77.197.128.139 -> 41.177.26.176 TCP 64 17671 > http [ACK] Seq=317 Ack=11359 Win=64119 Len=0
832778 272.394071 77.197.128.139 -> 41.177.26.176 TCP 64 17671 > http [RST, ACK] Seq=317 Ack=11359 Win=0 Len=0
833907 272.806644 77.197.128.139 -> 41.177.26.176 TCP 66 18210 > http [SYN] Seq=0 Win=65535 Len=0 MSS=1460 SACK_PERM=1
834044 272.888273 77.197.128.139 -> 41.177.26.176 TCP 64 18210 > http [ACK] Seq=1 Ack=1 Win=65535 Len=0
834754 273.291265 77.197.128.139 -> 41.177.26.176 TCP 64 18210 > http [ACK] Seq=353 Ack=2431 Win=65535 Len=0
834755 273.291379 77.197.128.139 -> 41.177.26.176 TCP 64 18210 > http [ACK] Seq=353 Ack=4052 Win=65535 Len=0
835101 273.373038 77.197.128.139 -> 41.177.26.176 TCP 64 18210 > http [ACK] Seq=353 Ack=6216 Win=65535 Len=0
835102 273.373043 77.197.128.139 -> 41.177.26.176 TCP 64 18210 > http [ACK] Seq=353 Ack=7676 Win=65535 Len=0
835103 273.373155 77.197.128.139 -> 41.177.26.176 TCP 64 18210 > http [ACK] Seq=353 Ack=11187 Win=65496 Len=0
835104 273.373159 77.197.128.139 -> 41.177.26.176 TCP 64 [TCP Dup ACK 835103#1] 18210 > http [ACK] Seq=353 Ack=11187 Win=65496 Len=0
837274 274.287425 77.197.128.139 -> 41.177.26.176 TCP 64 18210 > http [RST, ACK] Seq=353 Ack=11187 Win=0 Len=0
918839 304.748634 77.197.128.139 -> 41.177.26.176 TCP 66 35749 > http [SYN] Seq=0 Win=65535 Len=0 MSS=1460 SACK_PERM=1
919739 304.830521 77.197.128.139 -> 41.177.26.176 TCP 64 35749 > http [ACK] Seq=1 Ack=1 Win=65535 Len=0
921699 305.833318 77.197.128.139 -> 41.177.26.176 TCP 64 35749 > http [ACK] Seq=347 Ack=1534 Win=65535 Len=0
921722 305.842963 77.197.128.139 -> 41.177.26.176 TCP 64 35749 > http [ACK] Seq=347 Ack=2697 Win=64372 Len=0
921723 305.843089 77.197.128.139 -> 41.177.26.176 TCP 64 35749 > http [ACK] Seq=347 Ack=3198 Win=65535 Len=0
921867 305.915085 77.197.128.139 -> 41.177.26.176 TCP 64 35749 > http [ACK] Seq=347 Ack=5522 Win=65535 Len=0
921879 305.924838 77.197.128.139 -> 41.177.26.176 TCP 64 35749 > http [ACK] Seq=347 Ack=8929 Win=65535 Len=0
921880 305.924986 77.197.128.139 -> 41.177.26.176 TCP 64 35749 > http [ACK] Seq=347 Ack=11849 Win=65535 Len=0
922011 305.996979 77.197.128.139 -> 41.177.26.176 TCP 64 35749 > http [ACK] Seq=347 Ack=13138 Win=64246 Len=0
922014 305.997205 77.197.128.139 -> 41.177.26.176 TCP 64 35749 > http [RST, ACK] Seq=347 Ack=13138 Win=0 Len=0
928893 309.507539 77.197.128.139 -> 41.177.26.176 TCP 66 37457 > http [SYN] Seq=0 Win=65535 Len=0 MSS=1460 SACK_PERM=1
929103 309.589487 77.197.128.139 -> 41.177.26.176 TCP 64 37457 > http [ACK] Seq=1 Ack=1 Win=65535 Len=0
930398 309.951165 77.197.128.139 -> 41.177.26.176 TCP 64 37457 > http [ACK] Seq=308 Ack=3905 Win=65535 Len=0
930567 310.033338 77.197.128.139 -> 41.177.26.176 TCP 64 37457 > http [ACK] Seq=308 Ack=6069 Win=65535 Len=0
930568 310.033361 77.197.128.139 -> 41.177.26.176 TCP 64 37457 > http [ACK] Seq=308 Ack=8869 Win=65535 Len=0
930784 310.115490 77.197.128.139 -> 41.177.26.176 TCP 64 37457 > http [ACK] Seq=308 Ack=11708 Win=65535 Len=0
930785 310.115599 77.197.128.139 -> 41.177.26.176 TCP 64 37457 > http [RST, ACK] Seq=308 Ack=11708 Win=0 Len=0
947434 314.449599 77.197.128.139 -> 41.177.26.176 TCP 66 38356 > http [SYN] Seq=0 Win=65535 Len=0 MSS=1460 SACK_PERM=1
947889 314.531382 77.197.128.139 -> 41.177.26.176 TCP 64 38356 > http [ACK] Seq=1 Ack=1 Win=65535 Len=0
949876 314.983506 77.197.128.139 -> 41.177.26.176 TCP 64 38356 > http [ACK] Seq=318 Ack=2431 Win=65535 Len=0
949877 314.983676 77.197.128.139 -> 41.177.26.176 TCP 64 38356 > http [ACK] Seq=318 Ack=3896 Win=65535 Len=0
950103 315.065280 77.197.128.139 -> 41.177.26.176 TCP 64 38356 > http [ACK] Seq=318 Ack=6070 Win=65535 Len=0
950104 315.065471 77.197.128.139 -> 41.177.26.176 TCP 64 38356 > http [ACK] Seq=318 Ack=10232 Win=65535 Len=0
950333 315.147752 77.197.128.139 -> 41.177.26.176 TCP 64 38356 > http [RST, ACK] Seq=318 Ack=11628 Win=0 Len=0
954223 316.453629 77.197.128.139 -> 41.177.26.176 TCP 66 38879 > http [SYN] Seq=0 Win=65535 Len=0 MSS=1460 SACK_PERM=1
954551 316.535367 77.197.128.139 -> 41.177.26.176 TCP 64 38879 > http [ACK] Seq=1 Ack=1 Win=65535 Len=0
955396 316.892230 77.197.128.139 -> 41.177.26.176 TCP 64 38879 > http [ACK] Seq=308 Ack=2431 Win=65535 Len=0
955587 316.973974 77.197.128.139 -> 41.177.26.176 TCP 64 38879 > http [ACK] Seq=308 Ack=5351 Win=65535 Len=0
955588 316.974053 77.197.128.139 -> 41.177.26.176 TCP 64 38879 > http [ACK] Seq=308 Ack=7522 Win=65535 Len=0
955927 317.056085 77.197.128.139 -> 41.177.26.176 TCP 64 38879 > http [ACK] Seq=308 Ack=11106 Win=65052 Len=0
955928 317.056090 77.197.128.139 -> 41.177.26.176 TCP 64 [TCP Dup ACK 955927#1] 38879 > http [ACK] Seq=308 Ack=11106 Win=65052 Len=0
955929 317.056333 77.197.128.139 -> 41.177.26.176 TCP 64 38879 > http [RST, ACK] Seq=308 Ack=11106 Win=0 Len=0
958657 318.328882 77.197.128.139 -> 41.177.26.176 TCP 66 39325 > http [SYN] Seq=0 Win=65535 Len=0 MSS=1460 SACK_PERM=1
958823 318.410672 77.197.128.139 -> 41.177.26.176 TCP 64 39325 > http [ACK] Seq=1 Ack=1 Win=65535 Len=0
960012 318.807278 77.197.128.139 -> 41.177.26.176 TCP 64 39325 > http [ACK] Seq=316 Ack=2431 Win=65535 Len=0
960013 318.807282 77.197.128.139 -> 41.177.26.176 TCP 64 39325 > http [ACK] Seq=316 Ack=3893 Win=65535 Len=0
960095 318.889084 77.197.128.139 -> 41.177.26.176 TCP 64 39325 > http [ACK] Seq=316 Ack=6057 Win=65535 Len=0
960096 318.889088 77.197.128.139 -> 41.177.26.176 TCP 64 39325 > http [ACK] Seq=316 Ack=8326 Win=65535 Len=0
960097 318.889211 77.197.128.139 -> 41.177.26.176 TCP 64 39325 > http [ACK] Seq=316 Ack=11172 Win=65535 Len=0
960098 318.889405 77.197.128.139 -> 41.177.26.176 TCP 64 39325 > http [RST, ACK] Seq=316 Ack=11172 Win=0 Len=0
961768 319.636119 77.197.128.139 -> 41.177.26.176 TCP 66 39599 > http [SYN] Seq=0 Win=65535 Len=0 MSS=1460 SACK_PERM=1
961897 319.717821 77.197.128.139 -> 41.177.26.176 TCP 64 39599 > http [ACK] Seq=1 Ack=1 Win=65535 Len=0
964991 321.268827 77.197.128.139 -> 41.177.26.176 TCP 64 39599 > http [ACK] Seq=331 Ack=1549 Win=65535 Len=0
965032 321.279529 77.197.128.139 -> 41.177.26.176 TCP 64 39599 > http [ACK] Seq=331 Ack=2549 Win=64535 Len=0
965034 321.279689 77.197.128.139 -> 41.177.26.176 TCP 64 39599 > http [ACK] Seq=331 Ack=2880 Win=64204 Len=0
965039 321.279964 77.197.128.139 -> 41.177.26.176 TCP 64 39599 > http [ACK] Seq=331 Ack=3894 Win=65535 Len=0
965203 321.350600 77.197.128.139 -> 41.177.26.176 TCP 64 39599 > http [ACK] Seq=331 Ack=6416 Win=65535 Len=0
965241 321.361563 77.197.128.139 -> 41.177.26.176 TCP 64 39599 > http [ACK] Seq=331 Ack=10419 Win=65535 Len=0
965242 321.361887 77.197.128.139 -> 41.177.26.176 TCP 64 39599 > http [RST, ACK] Seq=331 Ack=10419 Win=0 Len=0
965400 321.427460 77.197.128.139 -> 41.177.26.176 TCP 66 40025 > http [SYN] Seq=0 Win=65535 Len=0 MSS=1460 SACK_PERM=1
965673 321.509422 77.197.128.139 -> 41.177.26.176 TCP 64 40025 > http [ACK] Seq=1 Ack=1 Win=65535 Len=0
966798 321.905598 77.197.128.139 -> 41.177.26.176 TCP 64 40025 > http [ACK] Seq=306 Ack=2431 Win=65535 Len=0
966799 321.905821 77.197.128.139 -> 41.177.26.176 TCP 64 40025 > http [ACK] Seq=306 Ack=3895 Win=65535 Len=0
966944 321.987406 77.197.128.139 -> 41.177.26.176 TCP 64 40025 > http [ACK] Seq=306 Ack=6075 Win=65535 Len=0
966945 321.987577 77.197.128.139 -> 41.177.26.176 TCP 64 40025 > http [ACK] Seq=306 Ack=8157 Win=65535 Len=0
966946 321.987582 77.197.128.139 -> 41.177.26.176 TCP 64 40025 > http [ACK] Seq=306 Ack=10532 Win=65535 Len=0
967059 322.069436 77.197.128.139 -> 41.177.26.176 TCP 64 40025 > http [RST, ACK] Seq=306 Ack=11214 Win=0 Len=0
968235 322.384343 77.197.128.139 -> 41.177.26.176 TCP 66 40319 > http [SYN] Seq=0 Win=65535 Len=0 MSS=1460 SACK_PERM=1
968322 322.466204 77.197.128.139 -> 41.177.26.176 TCP 64 40319 > http [ACK] Seq=1 Ack=1 Win=65535 Len=0
969497 322.937794 77.197.128.139 -> 41.177.26.176 TCP 64 40319 > http [ACK] Seq=318 Ack=3705 Win=65535 Len=0
969685 323.019894 77.197.128.139 -> 41.177.26.176 TCP 64 40319 > http [ACK] Seq=318 Ack=6070 Win=65535 Len=0
969686 323.019899 77.197.128.139 -> 41.177.26.176 TCP 64 40319 > http [ACK] Seq=318 Ack=8990 Win=65535 Len=0
969835 323.101932 77.197.128.139 -> 41.177.26.176 TCP 64 40319 > http [ACK] Seq=318 Ack=11179 Win=65535 Len=0
969837 323.102079 77.197.128.139 -> 41.177.26.176 TCP 64 40319 > http [RST, ACK] Seq=318 Ack=11179 Win=0 Len=0
970122 323.310446 77.197.128.139 -> 41.177.26.176 TCP 66 40579 > http [SYN] Seq=0 Win=65535 Len=0 MSS=1460 SACK_PERM=1
970253 323.392154 77.197.128.139 -> 41.177.26.176 TCP 64 40579 > http [ACK] Seq=1 Ack=1 Win=65535 Len=0
974990 324.548657 77.197.128.139 -> 41.177.26.176 TCP 64 40579 > http [ACK] Seq=333 Ack=1575 Win=65535 Len=0
975006 324.558865 77.197.128.139 -> 41.177.26.176 TCP 64 40579 > http [ACK] Seq=333 Ack=2477 Win=64633 Len=0
975007 324.559056 77.197.128.139 -> 41.177.26.176 TCP 64 40579 > http [ACK] Seq=333 Ack=2951 Win=64159 Len=0
975008 324.559061 77.197.128.139 -> 41.177.26.176 TCP 64 40579 > http [ACK] Seq=333 Ack=3798 Win=65535 Len=0
975175 324.630543 77.197.128.139 -> 41.177.26.176 TCP 64 40579 > http [ACK] Seq=333 Ack=6338 Win=65535 Len=0
975195 324.640737 77.197.128.139 -> 41.177.26.176 TCP 64 40579 > http [ACK] Seq=333 Ack=10348 Win=65535 Len=0
975197 324.641032 77.197.128.139 -> 41.177.26.176 TCP 64 40579 > http [RST, ACK] Seq=333 Ack=10348 Win=0 Len=0
975387 324.727285 77.197.128.139 -> 41.177.26.176 TCP 66 40943 > http [SYN] Seq=0 Win=65535 Len=0 MSS=1460 SACK_PERM=1
975643 324.808999 77.197.128.139 -> 41.177.26.176 TCP 64 40943 > http [ACK] Seq=1 Ack=1 Win=65535 Len=0
976443 325.264492 77.197.128.139 -> 41.177.26.176 TCP 64 40943 > http [ACK] Seq=319 Ack=2431 Win=65535 Len=0
976444 325.264724 77.197.128.139 -> 41.177.26.176 TCP 64 40943 > http [ACK] Seq=319 Ack=3901 Win=65535 Len=0
976606 325.346714 77.197.128.139 -> 41.177.26.176 TCP 64 40943 > http [ACK] Seq=319 Ack=6081 Win=65535 Len=0
976607 325.346843 77.197.128.139 -> 41.177.26.176 TCP 64 40943 > http [ACK] Seq=319 Ack=10461 Win=65535 Len=0
976724 325.428926 77.197.128.139 -> 41.177.26.176 TCP 64 40943 > http [RST, ACK] Seq=319 Ack=11289 Win=0 Len=0
977123 325.557867 77.197.128.139 -> 41.177.26.176 TCP 66 41133 > http [SYN] Seq=0 Win=65535 Len=0 MSS=1460 SACK_PERM=1
977497 325.640110 77.197.128.139 -> 41.177.26.176 TCP 64 41133 > http [ACK] Seq=1 Ack=1 Win=65535 Len=0
978835 326.180191 77.197.128.139 -> 41.177.26.176 TCP 64 41133 > http [ACK] Seq=355 Ack=2431 Win=65535 Len=0
978952 326.262173 77.197.128.139 -> 41.177.26.176 TCP 64 41133 > http [ACK] Seq=355 Ack=5351 Win=65535 Len=0
978953 326.262226 77.197.128.139 -> 41.177.26.176 TCP 64 41133 > http [ACK] Seq=355 Ack=7685 Win=65535 Len=0
979130 326.344104 77.197.128.139 -> 41.177.26.176 TCP 64 41133 > http [ACK] Seq=355 Ack=9908 Win=65535 Len=0
979131 326.344204 77.197.128.139 -> 41.177.26.176 TCP 64 41133 > http [ACK] Seq=355 Ack=11535 Win=63908 Len=0
979132 326.344211 77.197.128.139 -> 41.177.26.176 TCP 64 [TCP Window Update] 41133 > http [ACK] Seq=355 Ack=11535 Win=65535 Len=0
979133 326.344394 77.197.128.139 -> 41.177.26.176 TCP 64 41133 > http [RST, ACK] Seq=355 Ack=11535 Win=0 Len=0
979308 326.451994 77.197.128.139 -> 41.177.26.176 TCP 66 41344 > http [SYN] Seq=0 Win=65535 Len=0 MSS=1460 SACK_PERM=1
979466 326.533786 77.197.128.139 -> 41.177.26.176 TCP 64 41344 > http [ACK] Seq=1 Ack=1 Win=65535 Len=0
980049 326.916383 77.197.128.139 -> 41.177.26.176 TCP 64 41344 > http [ACK] Seq=316 Ack=2431 Win=65535 Len=0
980151 326.998055 77.197.128.139 -> 41.177.26.176 TCP 64 41344 > http [ACK] Seq=316 Ack=6050 Win=65535 Len=0
980384 327.079643 77.197.128.139 -> 41.177.26.176 TCP 64 41344 > http [ACK] Seq=316 Ack=7844 Win=65535 Len=0
980386 327.079813 77.197.128.139 -> 41.177.26.176 TCP 64 41344 > http [ACK] Seq=316 Ack=11130 Win=65028 Len=0
980387 327.079817 77.197.128.139 -> 41.177.26.176 TCP 64 [TCP Dup ACK 980386#1] 41344 > http [ACK] Seq=316 Ack=11130 Win=65028 Len=0
980388 327.080091 77.197.128.139 -> 41.177.26.176 TCP 64 41344 > http [RST, ACK] Seq=316 Ack=11130 Win=0 Len=0
980702 327.258352 77.197.128.139 -> 41.177.26.176 TCP 66 41541 > http [SYN] Seq=0 Win=65535 Len=0 MSS=1460 SACK_PERM=1
980784 327.340097 77.197.128.139 -> 41.177.26.176 TCP 64 41541 > http [ACK] Seq=1 Ack=1 Win=65535 Len=0
981265 327.738235 77.197.128.139 -> 41.177.26.176 TCP 64 41541 > http [ACK] Seq=301 Ack=2431 Win=65535 Len=0
981357 327.820049 77.197.128.139 -> 41.177.26.176 TCP 64 41541 > http [ACK] Seq=301 Ack=6075 Win=65535 Len=0
981493 327.901828 77.197.128.139 -> 41.177.26.176 TCP 64 41541 > http [ACK] Seq=301 Ack=8670 Win=65535 Len=0
981494 327.901929 77.197.128.139 -> 41.177.26.176 TCP 64 41541 > http [ACK] Seq=301 Ack=11519 Win=64639 Len=0
981495 327.901934 77.197.128.139 -> 41.177.26.176 TCP 64 [TCP Dup ACK 981494#1] 41541 > http [ACK] Seq=301 Ack=11519 Win=64639 Len=0
981496 327.902261 77.197.128.139 -> 41.177.26.176 TCP 64 41541 > http [RST, ACK] Seq=301 Ack=11519 Win=0 Len=0
981720 327.983158 77.197.128.139 -> 41.177.26.176 TCP 66 41713 > http [SYN] Seq=0 Win=65535 Len=0 MSS=1460 SACK_PERM=1
981851 328.064975 77.197.128.139 -> 41.177.26.176 TCP 64 41713 > http [ACK] Seq=1 Ack=1 Win=65535 Len=0
985808 329.129329 77.197.128.139 -> 41.177.26.176 TCP 64 41713 > http [ACK] Seq=360 Ack=2102 Win=65535 Len=0
985809 329.129595 77.197.128.139 -> 41.177.26.176 TCP 64 41713 > http [ACK] Seq=360 Ack=2636 Win=65001 Len=0
985810 329.129818 77.197.128.139 -> 41.177.26.176 TCP 64 41713 > http [ACK] Seq=360 Ack=3173 Win=64464 Len=0
986170 329.211480 77.197.128.139 -> 41.177.26.176 TCP 64 41713 > http [ACK] Seq=360 Ack=7418 Win=65535 Len=0
986171 329.211485 77.197.128.139 -> 41.177.26.176 TCP 64 41713 > http [ACK] Seq=360 Ack=10338 Win=65535 Len=0
986173 329.211666 77.197.128.139 -> 41.177.26.176 TCP 64 41713 > http [ACK] Seq=360 Ack=11798 Win=65535 Len=0
986549 329.293477 77.197.128.139 -> 41.177.26.176 TCP 64 41713 > http [ACK] Seq=360 Ack=14115 Win=65535 Len=0
986550 329.293596 77.197.128.139 -> 41.177.26.176 TCP 64 41713 > http [RST, ACK] Seq=360 Ack=14115 Win=0 Len=0
987414 329.431282 77.197.128.139 -> 41.177.26.176 TCP 66 42039 > http [SYN] Seq=0 Win=65535 Len=0 MSS=1460 SACK_PERM=1
987911 329.512862 77.197.128.139 -> 41.177.26.176 TCP 64 42039 > http [ACK] Seq=1 Ack=1 Win=65535 Len=0
990559 330.395148 77.197.128.139 -> 41.177.26.176 TCP 64 42039 > http [ACK] Seq=322 Ack=2082 Win=65535 Len=0
990566 330.395398 77.197.128.139 -> 41.177.26.176 TCP 64 42039 > http [ACK] Seq=322 Ack=2400 Win=65217 Len=0
990572 330.395669 77.197.128.139 -> 41.177.26.176 TCP 64 42039 > http [ACK] Seq=322 Ack=2857 Win=64760 Len=0
990795 330.476942 77.197.128.139 -> 41.177.26.176 TCP 64 42039 > http [ACK] Seq=322 Ack=6094 Win=65535 Len=0
990797 330.477293 77.197.128.139 -> 41.177.26.176 TCP 64 42039 > http [ACK] Seq=322 Ack=9014 Win=65535 Len=0
990798 330.477799 77.197.128.139 -> 41.177.26.176 TCP 64 42039 > http [RST, ACK] Seq=322 Ack=10041 Win=0 Len=0
991232 330.616591 77.197.128.139 -> 41.177.26.176 TCP 66 42356 > http [SYN] Seq=0 Win=65535 Len=0 MSS=1460 SACK_PERM=1
991471 330.698571 77.197.128.139 -> 41.177.26.176 TCP 64 42356 > http [ACK] Seq=1 Ack=1 Win=65535 Len=0
992242 331.089285 77.197.128.139 -> 41.177.26.176 TCP 64 42356 > http [ACK] Seq=309 Ack=3044 Win=65535 Len=0
992420 331.171177 77.197.128.139 -> 41.177.26.176 TCP 64 42356 > http [ACK] Seq=309 Ack=6081 Win=65535 Len=0
992669 331.253145 77.197.128.139 -> 41.177.26.176 TCP 64 42356 > http [ACK] Seq=309 Ack=9001 Win=65535 Len=0
992670 331.253248 77.197.128.139 -> 41.177.26.176 TCP 64 42356 > http [ACK] Seq=309 Ack=11184 Win=65535 Len=0
992671 331.253391 77.197.128.139 -> 41.177.26.176 TCP 64 42356 > http [RST, ACK] Seq=309 Ack=11184 Win=0 Len=0
993172 331.392604 77.197.128.139 -> 41.177.26.176 TCP 66 42578 > http [SYN] Seq=0 Win=65535 Len=0 MSS=1460 SACK_PERM=1
993365 331.474449 77.197.128.139 -> 41.177.26.176 TCP 64 42578 > http [ACK] Seq=1 Ack=1 Win=65535 Len=0
994743 331.935378 77.197.128.139 -> 41.177.26.176 TCP 64 42578 > http [ACK] Seq=356 Ack=2602 Win=65535 Len=0
995086 332.017071 77.197.128.139 -> 41.177.26.176 TCP 64 42578 > http [ACK] Seq=356 Ack=5517 Win=65535 Len=0
995089 332.017196 77.197.128.139 -> 41.177.26.176 TCP 64 42578 > http [ACK] Seq=356 Ack=7950 Win=65535 Len=0
995335 332.099199 77.197.128.139 -> 41.177.26.176 TCP 64 42578 > http [ACK] Seq=356 Ack=11761 Win=65535 Len=0
995336 332.099309 77.197.128.139 -> 41.177.26.176 TCP 64 42578 > http [RST, ACK] Seq=356 Ack=11761 Win=0 Len=0
995500 332.215125 77.197.128.139 -> 41.177.26.176 TCP 66 42710 > http [SYN] Seq=0 Win=65535 Len=0 MSS=1460 SACK_PERM=1
995629 332.296952 77.197.128.139 -> 41.177.26.176 TCP 64 42710 > http [ACK] Seq=1 Ack=1 Win=65535 Len=0
996267 332.679388 77.197.128.139 -> 41.177.26.176 TCP 64 42710 > http [ACK] Seq=353 Ack=3020 Win=65535 Len=0
996351 332.761490 77.197.128.139 -> 41.177.26.176 TCP 64 42710 > http [ACK] Seq=353 Ack=6216 Win=65535 Len=0
996352 332.761495 77.197.128.139 -> 41.177.26.176 TCP 64 42710 > http [ACK] Seq=353 Ack=7676 Win=65535 Len=0
996635 332.843190 77.197.128.139 -> 41.177.26.176 TCP 64 42710 > http [ACK] Seq=353 Ack=11199 Win=64853 Len=0
997410 333.290130 77.197.128.139 -> 41.177.26.176 TCP 64 42710 > http [RST, ACK] Seq=353 Ack=11199 Win=0 Len=0
997697 333.473609 77.197.128.139 -> 41.177.26.176 TCP 66 42922 > http [SYN] Seq=0 Win=65535 Len=0 MSS=1460 SACK_PERM=1
997888 333.555447 77.197.128.139 -> 41.177.26.176 TCP 64 42922 > http [ACK] Seq=1 Ack=1 Win=65535 Len=0
998839 333.955627 77.197.128.139 -> 41.177.26.176 TCP 64 42922 > http [ACK] Seq=318 Ack=2431 Win=65535 Len=0
998967 334.037587 77.197.128.139 -> 41.177.26.176 TCP 64 42922 > http [ACK] Seq=318 Ack=6063 Win=65535 Len=0
999065 334.111651 77.197.128.139 -> 41.177.26.176 TCP 64 42922 > http [ACK] Seq=318 Ack=7523 Win=65535 Len=0
999091 334.119300 77.197.128.139 -> 41.177.26.176 TCP 64 42922 > http [ACK] Seq=318 Ack=11165 Win=63905 Len=0
999092 334.119305 77.197.128.139 -> 41.177.26.176 TCP 64 [TCP Dup ACK 999091#1] 42922 > http [ACK] Seq=318 Ack=11165 Win=63905 Len=0
999166 334.151708 77.197.128.139 -> 41.177.26.176 TCP 64 [TCP Window Update] 42922 > http [ACK] Seq=318 Ack=11165 Win=65535 Len=0
999167 334.151992 77.197.128.139 -> 41.177.26.176 TCP 64 42922 > http [RST, ACK] Seq=318 Ack=11165 Win=0 Len=0
1001039 335.091800 77.197.128.139 -> 41.177.26.176 TCP 66 43599 > http [SYN] Seq=0 Win=65535 Len=0 MSS=1460 SACK_PERM=1
1001112 335.173573 77.197.128.139 -> 41.177.26.176 TCP 64 43599 > http [ACK] Seq=1 Ack=1 Win=65535 Len=0
1001523 335.525876 77.197.128.139 -> 41.177.26.176 TCP 64 43599 > http [ACK] Seq=307 Ack=2431 Win=65535 Len=0
1001621 335.607652 77.197.128.139 -> 41.177.26.176 TCP 64 43599 > http [ACK] Seq=307 Ack=6055 Win=65535 Len=0
1001722 335.689675 77.197.128.139 -> 41.177.26.176 TCP 64 43599 > http [ACK] Seq=307 Ack=8280 Win=65535 Len=0
1001723 335.689827 77.197.128.139 -> 41.177.26.176 TCP 64 43599 > http [ACK] Seq=307 Ack=11139 Win=65535 Len=0
1001724 335.689951 77.197.128.139 -> 41.177.26.176 TCP 64 43599 > http [RST, ACK] Seq=307 Ack=11139 Win=0 Len=0
1001929 335.796131 77.197.128.139 -> 41.177.26.176 TCP 66 43899 > http [SYN] Seq=0 Win=65535 Len=0 MSS=1460 SACK_PERM=1
1002161 335.877849 77.197.128.139 -> 41.177.26.176 TCP 64 43899 > http [ACK] Seq=1 Ack=1 Win=65535 Len=0
1002926 336.263843 77.197.128.139 -> 41.177.26.176 TCP 64 43899 > http [ACK] Seq=309 Ack=2602 Win=65535 Len=0
1003053 336.345582 77.197.128.139 -> 41.177.26.176 TCP 64 43899 > http [ACK] Seq=309 Ack=6082 Win=65535 Len=0
1003171 336.408624 77.197.128.139 -> 41.177.26.176 TCP 64 43899 > http [ACK] Seq=309 Ack=7542 Win=65535 Len=0
1003215 336.427323 77.197.128.139 -> 41.177.26.176 TCP 64 43899 > http [ACK] Seq=309 Ack=11191 Win=65535 Len=0
1003217 336.427648 77.197.128.139 -> 41.177.26.176 TCP 64 43899 > http [RST, ACK] Seq=309 Ack=11191 Win=0 Len=0
1004770 336.731851 77.197.128.139 -> 41.177.26.176 TCP 66 44237 > http [SYN] Seq=0 Win=65535 Len=0 MSS=1460 SACK_PERM=1
1005962 336.813855 77.197.128.139 -> 41.177.26.176 TCP 64 44237 > http [ACK] Seq=1 Ack=1 Win=65535 Len=0
1006920 337.239590 77.197.128.139 -> 41.177.26.176 TCP 64 44237 > http [ACK] Seq=318 Ack=2429 Win=65535 Len=0
1006921 337.239729 77.197.128.139 -> 41.177.26.176 TCP 64 44237 > http [ACK] Seq=318 Ack=3894 Win=65535 Len=0
1007163 337.321780 77.197.128.139 -> 41.177.26.176 TCP 64 44237 > http [ACK] Seq=318 Ack=6068 Win=65535 Len=0
1007164 337.321785 77.197.128.139 -> 41.177.26.176 TCP 64 44237 > http [ACK] Seq=318 Ack=7852 Win=63751 Len=0
1007165 337.321789 77.197.128.139 -> 41.177.26.176 TCP 64 [TCP Window Update] 44237 > http [ACK] Seq=318 Ack=7852 Win=65535 Len=0
1007168 337.321918 77.197.128.139 -> 41.177.26.176 TCP 64 44237 > http [ACK] Seq=318 Ack=11128 Win=63719 Len=0
1007224 337.334105 77.197.128.139 -> 41.177.26.176 TCP 64 [TCP Window Update] 44237 > http [ACK] Seq=318 Ack=11128 Win=65535 Len=0
1007225 337.334255 77.197.128.139 -> 41.177.26.176 TCP 64 44237 > http [RST, ACK] Seq=318 Ack=11128 Win=0 Len=0
1007807 337.542291 77.197.128.139 -> 41.177.26.176 TCP 66 44525 > http [SYN] Seq=0 Win=65535 Len=0 MSS=1460 SACK_PERM=1
1007895 337.623911 77.197.128.139 -> 41.177.26.176 TCP 64 44525 > http [ACK] Seq=1 Ack=1 Win=65535 Len=0
1008881 338.036936 77.197.128.139 -> 41.177.26.176 TCP 64 44525 > http [ACK] Seq=318 Ack=2431 Win=65535 Len=0
1008882 338.037009 77.197.128.139 -> 41.177.26.176 TCP 64 44525 > http [ACK] Seq=318 Ack=3896 Win=65535 Len=0
1008974 338.118866 77.197.128.139 -> 41.177.26.176 TCP 64 44525 > http [ACK] Seq=318 Ack=6070 Win=65535 Len=0
1008975 338.118871 77.197.128.139 -> 41.177.26.176 TCP 64 44525 > http [ACK] Seq=318 Ack=7773 Win=65535 Len=0
1008976 338.118980 77.197.128.139 -> 41.177.26.176 TCP 64 44525 > http [ACK] Seq=318 Ack=11056 Win=63712 Len=0
1009119 338.201364 77.197.128.139 -> 41.177.26.176 TCP 64 [TCP Window Update] 44525 > http [ACK] Seq=318 Ack=11056 Win=65535 Len=0
1009120 338.201635 77.197.128.139 -> 41.177.26.176 TCP 64 44525 > http [RST, ACK] Seq=318 Ack=11056 Win=0 Len=0
1009441 338.402335 77.197.128.139 -> 41.177.26.176 TCP 66 44879 > http [SYN] Seq=0 Win=65535 Len=0 MSS=1460 SACK_PERM=1
1009554 338.484035 77.197.128.139 -> 41.177.26.176 TCP 64 44879 > http [ACK] Seq=1 Ack=1 Win=65535 Len=0
1010436 338.892909 77.197.128.139 -> 41.177.26.176 TCP 64 44879 > http [ACK] Seq=306 Ack=2431 Win=65535 Len=0
1010437 338.893119 77.197.128.139 -> 41.177.26.176 TCP 64 44879 > http [ACK] Seq=306 Ack=3895 Win=65535 Len=0
1010665 338.974914 77.197.128.139 -> 41.177.26.176 TCP 64 44879 > http [ACK] Seq=306 Ack=6075 Win=65535 Len=0
1010666 338.974919 77.197.128.139 -> 41.177.26.176 TCP 64 44879 > http [ACK] Seq=306 Ack=8324 Win=65535 Len=0
1010667 338.975005 77.197.128.139 -> 41.177.26.176 TCP 64 44879 > http [ACK] Seq=306 Ack=11179 Win=62680 Len=0
1010668 338.975010 77.197.128.139 -> 41.177.26.176 TCP 64 [TCP Window Update] 44879 > http [ACK] Seq=306 Ack=11179 Win=65535 Len=0
1010700 338.992569 77.197.128.139 -> 41.177.26.176 TCP 64 44879 > http [RST, ACK] Seq=306 Ack=11179 Win=0 Len=0
1011136 339.206012 77.197.128.139 -> 41.177.26.176 TCP 66 45147 > http [SYN] Seq=0 Win=65535 Len=0 MSS=1460 SACK_PERM=1
1011355 339.287761 77.197.128.139 -> 41.177.26.176 TCP 64 45147 > http [ACK] Seq=1 Ack=1 Win=65535 Len=0
1011980 339.720886 77.197.128.139 -> 41.177.26.176 TCP 64 45147 > http [ACK] Seq=318 Ack=2431 Win=65535 Len=0
1011981 339.720890 77.197.128.139 -> 41.177.26.176 TCP 64 45147 > http [ACK] Seq=318 Ack=3896 Win=65535 Len=0
1012052 339.802643 77.197.128.139 -> 41.177.26.176 TCP 64 45147 > http [ACK] Seq=318 Ack=6070 Win=65535 Len=0
1012053 339.802721 77.197.128.139 -> 41.177.26.176 TCP 64 45147 > http [ACK] Seq=318 Ack=11054 Win=65535 Len=0
1012054 339.803031 77.197.128.139 -> 41.177.26.176 TCP 64 45147 > http [RST, ACK] Seq=318 Ack=11054 Win=0 Len=0
1012370 340.038201 77.197.128.139 -> 41.177.26.176 TCP 66 45468 > http [SYN] Seq=0 Win=65535 Len=0 MSS=1460 SACK_PERM=1
1012464 340.119931 77.197.128.139 -> 41.177.26.176 TCP 64 45468 > http [ACK] Seq=1 Ack=1 Win=65535 Len=0
1013098 340.535883 77.197.128.139 -> 41.177.26.176 TCP 64 45468 > http [ACK] Seq=318 Ack=3896 Win=65535 Len=0
1013417 340.617622 77.197.128.139 -> 41.177.26.176 TCP 64 45468 > http [ACK] Seq=318 Ack=6070 Win=65535 Len=0
1013418 340.617663 77.197.128.139 -> 41.177.26.176 TCP 64 45468 > http [ACK] Seq=318 Ack=8229 Win=65535 Len=0
1013617 340.699399 77.197.128.139 -> 41.177.26.176 TCP 64 45468 > http [ACK] Seq=318 Ack=11085 Win=65535 Len=0
1013620 340.699597 77.197.128.139 -> 41.177.26.176 TCP 64 45468 > http [RST, ACK] Seq=318 Ack=11085 Win=0 Len=0
1014378 341.056083 77.197.128.139 -> 41.177.26.176 TCP 66 45808 > http [SYN] Seq=0 Win=65535 Len=0 MSS=1460 SACK_PERM=1
1014430 341.137814 77.197.128.139 -> 41.177.26.176 TCP 64 45808 > http [ACK] Seq=1 Ack=1 Win=65535 Len=0
1015102 341.614671 77.197.128.139 -> 41.177.26.176 TCP 64 45808 > http [ACK] Seq=301 Ack=2431 Win=65535 Len=0
1015308 341.697091 77.197.128.139 -> 41.177.26.176 TCP 64 45808 > http [ACK] Seq=301 Ack=5351 Win=65535 Len=0
1015309 341.697353 77.197.128.139 -> 41.177.26.176 TCP 64 45808 > http [ACK] Seq=301 Ack=7535 Win=65535 Len=0
1015573 341.779015 77.197.128.139 -> 41.177.26.176 TCP 64 45808 > http [ACK] Seq=301 Ack=11198 Win=65535 Len=0
1015574 341.779280 77.197.128.139 -> 41.177.26.176 TCP 64 45808 > http [RST, ACK] Seq=301 Ack=11198 Win=0 Len=0
1016355 342.121252 77.197.128.139 -> 41.177.26.176 TCP 66 46151 > http [SYN] Seq=0 Win=65535 Len=0 MSS=1460 SACK_PERM=1
1016446 342.202935 77.197.128.139 -> 41.177.26.176 TCP 64 46151 > http [ACK] Seq=1 Ack=1 Win=65535 Len=0
1017147 342.630173 77.197.128.139 -> 41.177.26.176 TCP 64 46151 > http [ACK] Seq=355 Ack=2431 Win=65535 Len=0
1017148 342.630278 77.197.128.139 -> 41.177.26.176 TCP 64 46151 > http [ACK] Seq=355 Ack=4058 Win=65535 Len=0
1017251 342.711914 77.197.128.139 -> 41.177.26.176 TCP 64 46151 > http [ACK] Seq=355 Ack=7692 Win=65535 Len=0
1017252 342.712024 77.197.128.139 -> 41.177.26.176 TCP 64 46151 > http [ACK] Seq=355 Ack=10238 Win=65535 Len=0
1017349 342.793978 77.197.128.139 -> 41.177.26.176 TCP 64 46151 > http [RST, ACK] Seq=355 Ack=11627 Win=0 Len=0
1017552 342.917938 77.197.128.139 -> 41.177.26.176 TCP 66 46417 > http [SYN] Seq=0 Win=65535 Len=0 MSS=1460 SACK_PERM=1
1017701 342.999763 77.197.128.139 -> 41.177.26.176 TCP 64 46417 > http [ACK] Seq=1 Ack=1 Win=65535 Len=0
1018711 343.496696 77.197.128.139 -> 41.177.26.176 TCP 64 46417 > http [ACK] Seq=355 Ack=2431 Win=65535 Len=0
1018856 343.578469 77.197.128.139 -> 41.177.26.176 TCP 64 46417 > http [ACK] Seq=355 Ack=6225 Win=65535 Len=0
1019026 343.660403 77.197.128.139 -> 41.177.26.176 TCP 64 46417 > http [ACK] Seq=355 Ack=8594 Win=65535 Len=0
1019027 343.660407 77.197.128.139 -> 41.177.26.176 TCP 64 46417 > http [ACK] Seq=355 Ack=11474 Win=65535 Len=0
1019028 343.660697 77.197.128.139 -> 41.177.26.176 TCP 64 46417 > http [RST, ACK] Seq=355 Ack=11474 Win=0 Len=0
1019635 343.932435 77.197.128.139 -> 41.177.26.176 TCP 66 46759 > http [SYN] Seq=0 Win=65535 Len=0 MSS=1460 SACK_PERM=1
1019778 344.014050 77.197.128.139 -> 41.177.26.176 TCP 64 46759 > http [ACK] Seq=1 Ack=1 Win=65535 Len=0
1020963 344.405920 77.197.128.139 -> 41.177.26.176 TCP 64 46759 > http [ACK] Seq=310 Ack=2602 Win=65535 Len=0
1021051 344.487822 77.197.128.139 -> 41.177.26.176 TCP 64 46759 > http [ACK] Seq=310 Ack=6087 Win=65535 Len=0
1021147 344.569630 77.197.128.139 -> 41.177.26.176 TCP 64 46759 > http [ACK] Seq=310 Ack=11193 Win=65535 Len=0
1021148 344.569870 77.197.128.139 -> 41.177.26.176 TCP 64 46759 > http [RST, ACK] Seq=310 Ack=11193 Win=0 Len=0
1021378 344.742725 77.197.128.139 -> 41.177.26.176 TCP 66 mbus > http [SYN] Seq=0 Win=65535 Len=0 MSS=1460 SACK_PERM=1
1021464 344.824342 77.197.128.139 -> 41.177.26.176 TCP 64 mbus > http [ACK] Seq=1 Ack=1 Win=65535 Len=0
