193955  66.695505 77.197.128.176 -> 41.177.26.176 TCP 66 16944 > http [SYN] Seq=0 Win=65535 Len=0 MSS=1460 SACK_PERM=1
194240  66.774545 77.197.128.176 -> 41.177.26.176 TCP 64 16944 > http [ACK] Seq=1 Ack=1 Win=65535 Len=0
197227  67.619035 77.197.128.176 -> 41.177.26.176 TCP 64 16944 > http [ACK] Seq=348 Ack=2095 Win=65535 Len=0
197228  67.619203 77.197.128.176 -> 41.177.26.176 TCP 64 16944 > http [ACK] Seq=348 Ack=2439 Win=65191 Len=0
197233  67.619465 77.197.128.176 -> 41.177.26.176 TCP 64 16944 > http [ACK] Seq=348 Ack=2948 Win=64682 Len=0
197434  67.698117 77.197.128.176 -> 41.177.26.176 TCP 64 16944 > http [ACK] Seq=348 Ack=5195 Win=65535 Len=0
197435  67.698223 77.197.128.176 -> 41.177.26.176 TCP 64 16944 > http [ACK] Seq=348 Ack=9276 Win=65535 Len=0
197436  67.698617 77.197.128.176 -> 41.177.26.176 TCP 64 16944 > http [RST, ACK] Seq=348 Ack=10601 Win=0 Len=0
282854  94.939854 77.197.128.176 -> 41.177.26.176 TCP 66 20950 > http [SYN] Seq=0 Win=65535 Len=0 MSS=1460 SACK_PERM=1
283262  95.018895 77.197.128.176 -> 41.177.26.176 TCP 64 20950 > http [ACK] Seq=1 Ack=1 Win=65535 Len=0
285482  95.474291 77.197.128.176 -> 41.177.26.176 TCP 64 20950 > http [ACK] Seq=319 Ack=2431 Win=65535 Len=0
285483  95.474296 77.197.128.176 -> 41.177.26.176 TCP 64 20950 > http [ACK] Seq=319 Ack=3895 Win=65535 Len=0
285768  95.553353 77.197.128.176 -> 41.177.26.176 TCP 64 20950 > http [ACK] Seq=319 Ack=6075 Win=65535 Len=0
285769  95.553466 77.197.128.176 -> 41.177.26.176 TCP 64 20950 > http [ACK] Seq=319 Ack=8230 Win=65535 Len=0
285770  95.553638 77.197.128.176 -> 41.177.26.176 TCP 64 20950 > http [ACK] Seq=319 Ack=11092 Win=65535 Len=0
285771  95.553716 77.197.128.176 -> 41.177.26.176 TCP 64 20950 > http [RST, ACK] Seq=319 Ack=11092 Win=0 Len=0
357580 122.029636 77.197.128.176 -> 41.177.26.176 TCP 66 24820 > http [SYN] Seq=0 Win=65535 Len=0 MSS=1460 SACK_PERM=1
357762 122.108701 77.197.128.176 -> 41.177.26.176 TCP 64 24820 > http [ACK] Seq=1 Ack=1 Win=65535 Len=0
360559 123.094007 77.197.128.176 -> 41.177.26.176 TCP 64 24820 > http [ACK] Seq=306 Ack=2154 Win=65535 Len=0
360581 123.104241 77.197.128.176 -> 41.177.26.176 TCP 64 24820 > http [ACK] Seq=306 Ack=3026 Win=64663 Len=0
360582 123.104247 77.197.128.176 -> 41.177.26.176 TCP 64 24820 > http [ACK] Seq=306 Ack=3324 Win=64365 Len=0
360587 123.104569 77.197.128.176 -> 41.177.26.176 TCP 64 24820 > http [ACK] Seq=306 Ack=4255 Win=65535 Len=0
360794 123.173153 77.197.128.176 -> 41.177.26.176 TCP 64 24820 > http [ACK] Seq=306 Ack=7131 Win=65535 Len=0
360861 123.183270 77.197.128.176 -> 41.177.26.176 TCP 64 24820 > http [ACK] Seq=306 Ack=10261 Win=65535 Len=0
360862 123.183512 77.197.128.176 -> 41.177.26.176 TCP 64 24820 > http [RST, ACK] Seq=306 Ack=11352 Win=0 Len=0
488952 160.641764 77.197.128.176 -> 41.177.26.176 TCP 66 30238 > http [SYN] Seq=0 Win=65535 Len=0 MSS=1460 SACK_PERM=1
489105 160.720884 77.197.128.176 -> 41.177.26.176 TCP 64 30238 > http [ACK] Seq=1 Ack=1 Win=65535 Len=0
489618 161.118302 77.197.128.176 -> 41.177.26.176 TCP 64 30238 > http [ACK] Seq=353 Ack=2431 Win=65535 Len=0
489740 161.197316 77.197.128.176 -> 41.177.26.176 TCP 64 30238 > http [ACK] Seq=353 Ack=7669 Win=65535 Len=0
489851 161.276447 77.197.128.176 -> 41.177.26.176 TCP 64 30238 > http [ACK] Seq=353 Ack=10589 Win=65535 Len=0
489852 161.276538 77.197.128.176 -> 41.177.26.176 TCP 64 30238 > http [ACK] Seq=353 Ack=11738 Win=64386 Len=0
489853 161.276710 77.197.128.176 -> 41.177.26.176 TCP 64 30238 > http [RST, ACK] Seq=353 Ack=11738 Win=0 Len=0
769409 248.994163 77.197.128.176 -> 41.177.26.176 TCP 66 42582 > http [SYN] Seq=0 Win=65535 Len=0 MSS=1460 SACK_PERM=1
769517 249.073256 77.197.128.176 -> 41.177.26.176 TCP 64 42582 > http [ACK] Seq=1 Ack=1 Win=65535 Len=0
773239 249.463253 77.197.128.176 -> 41.177.26.176 TCP 64 42582 > http [ACK] Seq=318 Ack=3902 Win=65535 Len=0
774324 249.542360 77.197.128.176 -> 41.177.26.176 TCP 64 42582 > http [ACK] Seq=318 Ack=6076 Win=65535 Len=0
774325 249.542365 77.197.128.176 -> 41.177.26.176 TCP 64 42582 > http [ACK] Seq=318 Ack=8333 Win=65535 Len=0
775155 249.621911 77.197.128.176 -> 41.177.26.176 TCP 64 42582 > http [ACK] Seq=318 Ack=11189 Win=65535 Len=0
775162 249.622175 77.197.128.176 -> 41.177.26.176 TCP 64 42582 > http [RST, ACK] Seq=318 Ack=11189 Win=0 Len=0
833548 272.667899 77.197.128.176 -> 41.177.26.176 TCP 66 45943 > http [SYN] Seq=0 Win=65535 Len=0 MSS=1460 SACK_PERM=1
833759 272.746803 77.197.128.176 -> 41.177.26.176 TCP 64 45943 > http [ACK] Seq=1 Ack=1 Win=65535 Len=0
837671 274.466417 77.197.128.176 -> 41.177.26.176 TCP 64 45943 > http [ACK] Seq=312 Ack=1477 Win=65535 Len=0
837708 274.476129 77.197.128.176 -> 41.177.26.176 TCP 64 45943 > http [ACK] Seq=312 Ack=2545 Win=64467 Len=0
837713 274.476615 77.197.128.176 -> 41.177.26.176 TCP 64 45943 > http [ACK] Seq=312 Ack=3889 Win=65535 Len=0
837918 274.545580 77.197.128.176 -> 41.177.26.176 TCP 64 45943 > http [ACK] Seq=312 Ack=6581 Win=65535 Len=0
837964 274.555078 77.197.128.176 -> 41.177.26.176 TCP 64 45943 > http [ACK] Seq=312 Ack=9501 Win=65535 Len=0
837978 274.556136 77.197.128.176 -> 41.177.26.176 TCP 64 45943 > http [RST, ACK] Seq=312 Ack=10646 Win=0 Len=0
905032 298.406556 77.197.128.176 -> 41.177.26.176 TCP 66 49935 > http [SYN] Seq=0 Win=65535 Len=0 MSS=1460 SACK_PERM=1
905452 298.485533 77.197.128.176 -> 41.177.26.176 TCP 64 49935 > http [ACK] Seq=1 Ack=1 Win=65535 Len=0
906824 298.895164 77.197.128.176 -> 41.177.26.176 TCP 64 49935 > http [ACK] Seq=318 Ack=2225 Win=65535 Len=0
906825 298.895169 77.197.128.176 -> 41.177.26.176 TCP 64 49935 > http [ACK] Seq=318 Ack=3896 Win=65535 Len=0
907129 298.974112 77.197.128.176 -> 41.177.26.176 TCP 64 49935 > http [ACK] Seq=318 Ack=6070 Win=65535 Len=0
907132 298.974340 77.197.128.176 -> 41.177.26.176 TCP 64 49935 > http [ACK] Seq=318 Ack=11044 Win=65535 Len=0
907133 298.974573 77.197.128.176 -> 41.177.26.176 TCP 64 49935 > http [RST, ACK] Seq=318 Ack=11044 Win=0 Len=0
912877 302.236185 77.197.128.176 -> 41.177.26.176 TCP 66 50692 > http [SYN] Seq=0 Win=65535 Len=0 MSS=1460 SACK_PERM=1
913044 302.315116 77.197.128.176 -> 41.177.26.176 TCP 64 50692 > http [ACK] Seq=1 Ack=1 Win=65535 Len=0
913971 302.711981 77.197.128.176 -> 41.177.26.176 TCP 64 50692 > http [ACK] Seq=304 Ack=3900 Win=65535 Len=0
914191 302.791006 77.197.128.176 -> 41.177.26.176 TCP 64 50692 > http [ACK] Seq=304 Ack=6064 Win=65535 Len=0
914192 302.791142 77.197.128.176 -> 41.177.26.176 TCP 64 50692 > http [ACK] Seq=304 Ack=8984 Win=65535 Len=0
914308 302.870042 77.197.128.176 -> 41.177.26.176 TCP 64 50692 > http [ACK] Seq=304 Ack=11250 Win=65535 Len=0
914309 302.870275 77.197.128.176 -> 41.177.26.176 TCP 64 50692 > http [RST, ACK] Seq=304 Ack=11250 Win=0 Len=0
916196 304.095302 77.197.128.176 -> 41.177.26.176 TCP 66 51259 > http [SYN] Seq=0 Win=65535 Len=0 MSS=1460 SACK_PERM=1
916280 304.174458 77.197.128.176 -> 41.177.26.176 TCP 64 51259 > http [ACK] Seq=1 Ack=1 Win=65535 Len=0
917509 304.632939 77.197.128.176 -> 41.177.26.176 TCP 64 51259 > http [ACK] Seq=318 Ack=2431 Win=65535 Len=0
917510 304.633069 77.197.128.176 -> 41.177.26.176 TCP 64 51259 > http [ACK] Seq=318 Ack=3896 Win=65535 Len=0
918353 304.712166 77.197.128.176 -> 41.177.26.176 TCP 64 51259 > http [ACK] Seq=318 Ack=6070 Win=65535 Len=0
918354 304.712327 77.197.128.176 -> 41.177.26.176 TCP 64 51259 > http [ACK] Seq=318 Ack=10100 Win=65535 Len=0
919453 304.791395 77.197.128.176 -> 41.177.26.176 TCP 64 51259 > http [RST, ACK] Seq=318 Ack=11489 Win=0 Len=0
995607 332.281794 77.197.128.176 -> 41.177.26.176 TCP 66 55624 > http [SYN] Seq=0 Win=65535 Len=0 MSS=1460 SACK_PERM=1
995714 332.361011 77.197.128.176 -> 41.177.26.176 TCP 64 55624 > http [ACK] Seq=1 Ack=1 Win=65535 Len=0
997475 333.341026 77.197.128.176 -> 41.177.26.176 TCP 64 55624 > http [ACK] Seq=338 Ack=1573 Win=65535 Len=0
997489 333.352864 77.197.128.176 -> 41.177.26.176 TCP 64 55624 > http [ACK] Seq=338 Ack=2584 Win=64524 Len=0
997490 333.353039 77.197.128.176 -> 41.177.26.176 TCP 64 55624 > http [ACK] Seq=338 Ack=3073 Win=65535 Len=0
997582 333.420083 77.197.128.176 -> 41.177.26.176 TCP 64 55624 > http [ACK] Seq=338 Ack=5298 Win=65535 Len=0
997610 333.431835 77.197.128.176 -> 41.177.26.176 TCP 64 55624 > http [ACK] Seq=338 Ack=9494 Win=65535 Len=0
997611 333.432263 77.197.128.176 -> 41.177.26.176 TCP 64 55624 > http [RST, ACK] Seq=338 Ack=10750 Win=0 Len=0
