364526 124.140402 77.197.128.72 -> 244.3.210.197 TCP 66 43655 > http [SYN] Seq=0 Win=65535 Len=0 MSS=1460 SACK_PERM=1
364736 124.221985 77.197.128.72 -> 244.3.210.197 TCP 64 43655 > http [ACK] Seq=1 Ack=1 Win=65535 Len=0
365310 124.602279 77.197.128.72 -> 244.3.210.197 TCP 64 43655 > http [ACK] Seq=280 Ack=2921 Win=65535 Len=0
365426 124.683941 77.197.128.72 -> 244.3.210.197 TCP 64 43655 > http [ACK] Seq=280 Ack=7301 Win=65535 Len=0
365561 124.765611 77.197.128.72 -> 244.3.210.197 TCP 64 43655 > http [ACK] Seq=280 Ack=10221 Win=65535 Len=0
365562 124.765616 77.197.128.72 -> 244.3.210.197 TCP 64 43655 > http [ACK] Seq=280 Ack=13141 Win=62615 Len=0
365565 124.765762 77.197.128.72 -> 244.3.210.197 TCP 64 [TCP Window Update] 43655 > http [ACK] Seq=280 Ack=13141 Win=65535 Len=0
365654 124.847293 77.197.128.72 -> 244.3.210.197 TCP 64 43655 > http [ACK] Seq=280 Ack=16061 Win=65535 Len=0
365655 124.847297 77.197.128.72 -> 244.3.210.197 TCP 64 43655 > http [ACK] Seq=280 Ack=17733 Win=65535 Len=0
365666 124.847879 77.197.128.72 -> 244.3.210.197 TCP 64 43655 > http [RST, ACK] Seq=280 Ack=17733 Win=0 Len=0
840536 275.576772 77.197.128.72 -> 41.177.26.91 TCP 66 45710 > http [SYN] Seq=0 Win=65535 Len=0 MSS=1460 SACK_PERM=1
840572 275.658528 77.197.128.72 -> 41.177.26.91 TCP 64 45710 > http [ACK] Seq=1 Ack=1 Win=65535 Len=0
841083 275.873862 77.197.128.72 -> 41.177.26.91 TCP 64 45710 > http [ACK] Seq=310 Ack=4381 Win=65535 Len=0
841210 275.955605 77.197.128.72 -> 41.177.26.91 TCP 64 45710 > http [ACK] Seq=310 Ack=7301 Win=65535 Len=0
841211 275.955609 77.197.128.72 -> 41.177.26.91 TCP 64 45710 > http [ACK] Seq=310 Ack=10221 Win=65535 Len=0
841300 276.037952 77.197.128.72 -> 41.177.26.91 TCP 64 45710 > http [ACK] Seq=310 Ack=13141 Win=65535 Len=0
841301 276.037957 77.197.128.72 -> 41.177.26.91 TCP 64 45710 > http [ACK] Seq=310 Ack=17521 Win=65535 Len=0
841424 276.119708 77.197.128.72 -> 41.177.26.91 TCP 64 45710 > http [ACK] Seq=310 Ack=20207 Win=65535 Len=0
841425 276.120540 77.197.128.72 -> 41.177.26.91 TCP 64 45710 > http [RST, ACK] Seq=310 Ack=20207 Win=0 Len=0
847020 279.421956 77.197.128.72 -> 41.177.26.91 TCP 66 48362 > http [SYN] Seq=0 Win=65535 Len=0 MSS=1460 SACK_PERM=1
847080 279.503584 77.197.128.72 -> 41.177.26.91 TCP 64 48362 > http [ACK] Seq=1 Ack=1 Win=65535 Len=0
847470 279.730824 77.197.128.72 -> 41.177.26.91 TCP 64 48362 > http [ACK] Seq=324 Ack=2921 Win=65535 Len=0
847551 279.813049 77.197.128.72 -> 41.177.26.91 TCP 64 48362 > http [ACK] Seq=324 Ack=5841 Win=65535 Len=0
847552 279.813054 77.197.128.72 -> 41.177.26.91 TCP 64 48362 > http [ACK] Seq=324 Ack=8761 Win=65535 Len=0
847649 279.894829 77.197.128.72 -> 41.177.26.91 TCP 64 48362 > http [ACK] Seq=324 Ack=11681 Win=65535 Len=0
847650 279.894973 77.197.128.72 -> 41.177.26.91 TCP 64 48362 > http [ACK] Seq=324 Ack=17501 Win=65535 Len=0
847651 279.895653 77.197.128.72 -> 41.177.26.91 TCP 64 48362 > http [RST, ACK] Seq=324 Ack=17501 Win=0 Len=0
850870 281.153105 77.197.128.72 -> 41.177.26.91 TCP 66 49592 > http [SYN] Seq=0 Win=65535 Len=0 MSS=1460 SACK_PERM=1
851146 281.234676 77.197.128.72 -> 41.177.26.91 TCP 64 49592 > http [ACK] Seq=1 Ack=1 Win=65535 Len=0
851774 281.497587 77.197.128.72 -> 41.177.26.91 TCP 64 49592 > http [ACK] Seq=329 Ack=2921 Win=65535 Len=0
852040 281.579224 77.197.128.72 -> 41.177.26.91 TCP 64 49592 > http [ACK] Seq=329 Ack=7301 Win=65535 Len=0
852342 281.661045 77.197.128.72 -> 41.177.26.91 TCP 64 49592 > http [ACK] Seq=329 Ack=11681 Win=65535 Len=0
852343 281.661050 77.197.128.72 -> 41.177.26.91 TCP 64 49592 > http [ACK] Seq=329 Ack=14601 Win=65535 Len=0
852521 281.743033 77.197.128.72 -> 41.177.26.91 TCP 64 49592 > http [ACK] Seq=329 Ack=17521 Win=65535 Len=0
852522 281.743038 77.197.128.72 -> 41.177.26.91 TCP 64 49592 > http [ACK] Seq=329 Ack=19608 Win=65535 Len=0
852523 281.744055 77.197.128.72 -> 41.177.26.91 TCP 64 49592 > http [RST, ACK] Seq=329 Ack=19608 Win=0 Len=0
