468960 154.717524 77.197.210.71 -> 41.177.26.15 TCP 66 58473 > http [SYN] Seq=0 Win=65535 Len=0 MSS=1460 SACK_PERM=1
469151 154.799388 77.197.210.71 -> 41.177.26.15 TCP 64 58473 > http [ACK] Seq=1 Ack=1 Win=65535 Len=0
469842 155.071367 77.197.210.71 -> 41.177.26.15 TCP 64 58473 > http [ACK] Seq=308 Ack=4381 Win=65535 Len=0
470074 155.155444 77.197.210.71 -> 41.177.26.15 TCP 70 58473 > http [ACK] Seq=308 Ack=5841 Win=65535 Len=0 SLE=7301 SRE=8465
470075 155.155582 77.197.210.71 -> 41.177.26.15 TCP 70 [TCP Dup ACK 470074#1] 58473 > http [ACK] Seq=308 Ack=5841 Win=65535 Len=0 SLE=7301 SRE=9925
470255 155.237552 77.197.210.71 -> 41.177.26.15 TCP 70 [TCP Dup ACK 470074#2] 58473 > http [ACK] Seq=308 Ack=5841 Win=65535 Len=0 SLE=7301 SRE=11385
470256 155.237557 77.197.210.71 -> 41.177.26.15 TCP 70 [TCP Dup ACK 470074#3] 58473 > http [ACK] Seq=308 Ack=5841 Win=65535 Len=0 SLE=7301 SRE=12845
470461 155.319242 77.197.210.71 -> 41.177.26.15 TCP 64 58473 > http [ACK] Seq=308 Ack=12845 Win=65263 Len=0
470462 155.319247 77.197.210.71 -> 41.177.26.15 TCP 64 [TCP Dup ACK 470461#1] 58473 > http [ACK] Seq=308 Ack=12845 Win=65263 Len=0
470644 155.401449 77.197.210.71 -> 41.177.26.15 TCP 64 58473 > http [ACK] Seq=308 Ack=15765 Win=65535 Len=0
470854 155.485287 77.197.210.71 -> 41.177.26.15 TCP 64 58473 > http [ACK] Seq=308 Ack=18125 Win=65535 Len=0
471111 155.567934 77.197.210.71 -> 41.177.26.15 TCP 64 58473 > http [ACK] Seq=308 Ack=21045 Win=65535 Len=0
471310 155.650934 77.197.210.71 -> 41.177.26.15 TCP 64 58473 > http [ACK] Seq=308 Ack=23965 Win=65535 Len=0
471518 155.733878 77.197.210.71 -> 41.177.26.15 TCP 64 58473 > http [ACK] Seq=308 Ack=26325 Win=65535 Len=0
471519 155.733883 77.197.210.71 -> 41.177.26.15 TCP 64 58473 > http [ACK] Seq=308 Ack=29245 Win=65535 Len=0
471835 155.815991 77.197.210.71 -> 41.177.26.15 TCP 64 58473 > http [ACK] Seq=308 Ack=33065 Win=65527 Len=0
471836 155.815996 77.197.210.71 -> 41.177.26.15 TCP 64 [TCP Dup ACK 471835#1] 58473 > http [ACK] Seq=308 Ack=33065 Win=65527 Len=0
472238 155.897912 77.197.210.71 -> 41.177.26.15 TCP 64 58473 > http [ACK] Seq=308 Ack=37445 Win=65535 Len=0
472671 155.981595 77.197.210.71 -> 41.177.26.15 TCP 64 58473 > http [ACK] Seq=308 Ack=41265 Win=65535 Len=0
473127 156.065352 77.197.210.71 -> 41.177.26.15 TCP 64 58473 > http [ACK] Seq=308 Ack=44185 Win=65535 Len=0
473128 156.065357 77.197.210.71 -> 41.177.26.15 TCP 64 58473 > http [ACK] Seq=308 Ack=47105 Win=65527 Len=0
473129 156.065361 77.197.210.71 -> 41.177.26.15 TCP 64 [TCP Dup ACK 473128#1] 58473 > http [ACK] Seq=308 Ack=47105 Win=65527 Len=0
473513 156.157468 77.197.210.71 -> 41.177.26.15 TCP 64 58473 > http [ACK] Seq=308 Ack=49971 Win=65535 Len=0
473560 156.168878 77.197.210.71 -> 41.177.26.15 TCP 64 58473 > http [RST, ACK] Seq=308 Ack=49971 Win=0 Len=0
