792498 257.741803 77.197.67.116 -> 244.3.210.197 TCP 66 61809 > http [SYN] Seq=0 Win=65535 Len=0 MSS=1460 SACK_PERM=1
792606 257.822312 77.197.67.116 -> 244.3.210.197 TCP 64 61809 > http [ACK] Seq=1 Ack=1 Win=65535 Len=0
793536 258.445656 77.197.67.116 -> 244.3.210.197 TCP 64 61809 > http [ACK] Seq=356 Ack=2921 Win=65535 Len=0
793736 258.528403 77.197.67.116 -> 244.3.210.197 TCP 64 61809 > http [ACK] Seq=356 Ack=7301 Win=65535 Len=0
793902 258.609021 77.197.67.116 -> 244.3.210.197 TCP 64 61809 > http [ACK] Seq=356 Ack=13141 Win=65535 Len=0
794139 258.689290 77.197.67.116 -> 244.3.210.197 TCP 64 61809 > http [ACK] Seq=356 Ack=19640 Win=65535 Len=0
795971 259.487103 77.197.67.116 -> 244.3.210.197 TCP 64 61809 > http [ACK] Seq=810 Ack=28400 Win=65535 Len=0
796077 259.566746 77.197.67.116 -> 244.3.210.197 TCP 64 61809 > http [ACK] Seq=810 Ack=30021 Win=63914 Len=0
796232 259.650997 77.197.67.116 -> 244.3.210.197 TCP 66 61843 > http [SYN] Seq=0 Win=65535 Len=0 MSS=1460 SACK_PERM=1
796422 259.733784 77.197.67.116 -> 244.3.210.197 TCP 64 61843 > http [ACK] Seq=1 Ack=1 Win=65535 Len=0
797853 260.257632 77.197.67.116 -> 244.3.210.197 TCP 64 [TCP Window Update] 61809 > http [ACK] Seq=810 Ack=30021 Win=65535 Len=0
798177 260.409133 77.197.67.116 -> 244.3.210.197 TCP 64 61843 > http [ACK] Seq=445 Ack=2921 Win=65535 Len=0
798190 260.414564 77.197.67.116 -> 244.3.210.197 TCP 64 61809 > http [ACK] Seq=1260 Ack=33386 Win=65535 Len=0
798442 260.490719 77.197.67.116 -> 244.3.210.197 TCP 64 61843 > http [ACK] Seq=445 Ack=7301 Win=65535 Len=0
798608 260.563926 77.197.67.116 -> 244.3.210.197 TCP 64 61809 > http [ACK] Seq=1713 Ack=36687 Win=65535 Len=0
798632 260.577053 77.197.67.116 -> 244.3.210.197 TCP 64 61843 > http [ACK] Seq=445 Ack=13141 Win=65535 Len=0
798903 260.649854 77.197.67.116 -> 244.3.210.197 TCP 64 61809 > http [ACK] Seq=2166 Ack=51287 Win=59695 Len=0
798904 260.649859 77.197.67.116 -> 244.3.210.197 TCP 64 [TCP Window Update] 61809 > http [ACK] Seq=2166 Ack=51287 Win=63455 Len=0
798929 260.657025 77.197.67.116 -> 244.3.210.197 TCP 64 61843 > http [ACK] Seq=445 Ack=20441 Win=65535 Len=0
799176 260.740006 77.197.67.116 -> 244.3.210.197 TCP 64 61809 > http [ACK] Seq=2166 Ack=67347 Win=47395 Len=0
799194 260.740491 77.197.67.116 -> 244.3.210.197 TCP 64 61843 > http [ACK] Seq=445 Ack=29201 Win=61155 Len=0
799299 260.814377 77.197.67.116 -> 244.3.210.197 TCP 64 [TCP Window Update] 61809 > http [ACK] Seq=2166 Ack=67347 Win=51155 Len=0
799300 260.814381 77.197.67.116 -> 244.3.210.197 TCP 64 [TCP Window Update] 61809 > http [ACK] Seq=2166 Ack=67347 Win=65535 Len=0
799301 260.814385 77.197.67.116 -> 244.3.210.197 TCP 64 [TCP Window Update] 61843 > http [ACK] Seq=445 Ack=29201 Win=64915 Len=0
799322 260.821996 77.197.67.116 -> 244.3.210.197 TCP 64 61809 > http [ACK] Seq=2166 Ack=84867 Win=56775 Len=0
799323 260.822041 77.197.67.116 -> 244.3.210.197 TCP 64 61843 > http [ACK] Seq=445 Ack=34243 Win=65535 Len=0
799324 260.822046 77.197.67.116 -> 244.3.210.197 TCP 64 [TCP Window Update] 61809 > http [ACK] Seq=2166 Ack=84867 Win=60535 Len=0
799353 260.822668 77.197.67.116 -> 244.3.210.197 TCP 64 [TCP Window Update] 61809 > http [ACK] Seq=2166 Ack=84867 Win=65535 Len=0
799441 260.902816 77.197.67.116 -> 244.3.210.197 TCP 64 61809 > http [ACK] Seq=2166 Ack=102491 Win=56671 Len=0
799469 260.918062 77.197.67.116 -> 244.3.210.197 TCP 64 [TCP Window Update] 61809 > http [ACK] Seq=2166 Ack=102491 Win=60431 Len=0
799470 260.918067 77.197.67.116 -> 244.3.210.197 TCP 64 [TCP Window Update] 61809 > http [ACK] Seq=2166 Ack=102491 Win=65535 Len=0
799571 260.983588 77.197.67.116 -> 244.3.210.197 TCP 64 61809 > http [ACK] Seq=2166 Ack=122931 Win=56155 Len=0
799609 260.985511 77.197.67.116 -> 244.3.210.197 TCP 64 [TCP Window Update] 61809 > http [ACK] Seq=2166 Ack=122931 Win=65535 Len=0
799772 261.063983 77.197.67.116 -> 244.3.210.197 TCP 64 61809 > http [ACK] Seq=2166 Ack=144831 Win=52395 Len=0
799773 261.063987 77.197.67.116 -> 244.3.210.197 TCP 64 [TCP Window Update] 61809 > http [ACK] Seq=2166 Ack=144831 Win=56155 Len=0
799774 261.063991 77.197.67.116 -> 244.3.210.197 TCP 64 [TCP Window Update] 61809 > http [ACK] Seq=2166 Ack=144831 Win=65535 Len=0
799973 261.149177 77.197.67.116 -> 244.3.210.197 TCP 64 61809 > http [ACK] Seq=2166 Ack=168027 Win=51099 Len=0
799974 261.149182 77.197.67.116 -> 244.3.210.197 TCP 64 [TCP Window Update] 61809 > http [ACK] Seq=2166 Ack=168027 Win=54859 Len=0
799975 261.149214 77.197.67.116 -> 244.3.210.197 TCP 64 [TCP Window Update] 61809 > http [ACK] Seq=2166 Ack=168027 Win=65535 Len=0
800169 261.230839 77.197.67.116 -> 244.3.210.197 TCP 64 61809 > http [ACK] Seq=2166 Ack=171012 Win=65535 Len=0
800922 261.744095 77.197.67.116 -> 244.3.210.197 TCP 64 61843 > http [ACK] Seq=902 Ack=36912 Win=65535 Len=0
803092 262.377055 77.197.67.116 -> 244.3.210.197 TCP 64 61809 > http [ACK] Seq=2617 Ack=197292 Win=48015 Len=0
803093 262.377060 77.197.67.116 -> 244.3.210.197 TCP 64 61843 > http [ACK] Seq=1353 Ack=41816 Win=65535 Len=0
803094 262.377064 77.197.67.116 -> 244.3.210.197 TCP 64 [TCP Window Update] 61809 > http [ACK] Seq=2617 Ack=197292 Win=51775 Len=0
803295 262.448493 77.197.67.116 -> 244.3.210.197 TCP 64 [TCP Window Update] 61809 > http [ACK] Seq=2617 Ack=197292 Win=65535 Len=0
803384 262.461205 77.197.67.116 -> 244.3.210.197 TCP 64 61809 > http [ACK] Seq=2617 Ack=209155 Win=62432 Len=0
803390 262.461396 77.197.67.116 -> 244.3.210.197 TCP 64 [TCP Window Update] 61809 > http [ACK] Seq=2617 Ack=209155 Win=65535 Len=0
803648 262.571068 77.197.67.116 -> 244.3.210.197 TCP 64 61843 > http [ACK] Seq=1805 Ack=56416 Win=59695 Len=0
803654 262.571249 77.197.67.116 -> 244.3.210.197 TCP 64 61809 > http [ACK] Seq=3069 Ack=238355 Win=45095 Len=0
803672 262.572581 77.197.67.116 -> 244.3.210.197 TCP 64 [TCP Window Update] 61843 > http [ACK] Seq=1805 Ack=56416 Win=63455 Len=0
803864 262.650647 77.197.67.116 -> 244.3.210.197 TCP 64 61843 > http [ACK] Seq=1805 Ack=72476 Win=47395 Len=0
804048 262.690595 77.197.67.116 -> 244.3.210.197 TCP 64 [TCP Window Update] 61843 > http [ACK] Seq=1805 Ack=72476 Win=51155 Len=0
804049 262.690619 77.197.67.116 -> 244.3.210.197 TCP 64 [TCP Window Update] 61843 > http [ACK] Seq=1805 Ack=72476 Win=65535 Len=0
804057 262.690764 77.197.67.116 -> 244.3.210.197 TCP 64 61809 > http [ACK] Seq=3069 Ack=238402 Win=48808 Len=0
804058 262.690769 77.197.67.116 -> 244.3.210.197 TCP 64 [TCP Window Update] 61809 > http [ACK] Seq=3069 Ack=238402 Win=65535 Len=0
804602 262.902685 77.197.67.116 -> 244.3.210.197 TCP 64 61843 > http [ACK] Seq=1805 Ack=72728 Win=65283 Len=0
808599 263.831073 77.197.67.116 -> 244.3.210.197 TCP 64 61809 > http [ACK] Seq=3519 Ack=249071 Win=63626 Len=0
808600 263.831078 77.197.67.116 -> 244.3.210.197 TCP 64 [TCP Window Update] 61809 > http [ACK] Seq=3519 Ack=249071 Win=65535 Len=0
810980 264.447513 77.197.67.116 -> 244.3.210.197 TCP 64 61843 > http [ACK] Seq=2270 Ack=77481 Win=65535 Len=0
811728 264.643544 77.197.67.116 -> 244.3.210.197 TCP 64 61809 > http [ACK] Seq=3972 Ack=251769 Win=65535 Len=0
811908 264.697824 77.197.67.116 -> 244.3.210.197 TCP 64 61843 > http [ACK] Seq=2713 Ack=79791 Win=65535 Len=0
812051 264.774354 77.197.67.116 -> 244.3.210.197 TCP 64 61809 > http [ACK] Seq=4427 Ack=262844 Win=63220 Len=0
812052 264.774359 77.197.67.116 -> 244.3.210.197 TCP 64 [TCP Window Update] 61809 > http [ACK] Seq=4427 Ack=262844 Win=65535 Len=0
814009 265.487018 77.197.67.116 -> 244.3.210.197 TCP 64 61843 > http [ACK] Seq=3166 Ack=89544 Win=64542 Len=0
814491 265.582030 77.197.67.116 -> 244.3.210.197 TCP 64 61809 > http [ACK] Seq=4876 Ack=272030 Win=65109 Len=0
816475 266.322320 77.197.67.116 -> 244.3.210.197 TCP 64 61843 > http [ACK] Seq=3616 Ack=93102 Win=65535 Len=0
817183 266.589981 77.197.67.116 -> 244.3.210.197 TCP 64 61809 > http [ACK] Seq=5330 Ack=276380 Win=65535 Len=0
817723 266.839862 77.197.67.116 -> 244.3.210.197 TCP 64 61843 > http [ACK] Seq=4064 Ack=103881 Win=63516 Len=0
817724 266.839885 77.197.67.116 -> 244.3.210.197 TCP 64 [TCP Window Update] 61843 > http [ACK] Seq=4064 Ack=103881 Win=65535 Len=0
819903 267.491496 77.197.67.116 -> 244.3.210.197 TCP 64 61809 > http [ACK] Seq=5870 Ack=276594 Win=65321 Len=0
821062 267.948371 77.197.67.116 -> 244.3.210.197 TCP 64 61843 > http [ACK] Seq=4514 Ack=130161 Win=65535 Len=0
821291 268.028721 77.197.67.116 -> 244.3.210.197 TCP 64 61843 > http [ACK] Seq=4514 Ack=157901 Win=46555 Len=0
821305 268.032673 77.197.67.116 -> 244.3.210.197 TCP 64 [TCP Window Update] 61843 > http [ACK] Seq=4514 Ack=157901 Win=50315 Len=0
821317 268.035344 77.197.67.116 -> 244.3.210.197 TCP 64 [TCP Window Update] 61843 > http [ACK] Seq=4514 Ack=157901 Win=65535 Len=0
821441 268.109590 77.197.67.116 -> 244.3.210.197 TCP 64 61843 > http [ACK] Seq=4514 Ack=168471 Win=63725 Len=0
821442 268.109618 77.197.67.116 -> 244.3.210.197 TCP 64 [TCP Window Update] 61843 > http [ACK] Seq=4514 Ack=168471 Win=65535 Len=0
822907 268.668494 77.197.67.116 -> 244.3.210.197 TCP 64 61809 > http [ACK] Seq=6328 Ack=282457 Win=65535 Len=0
823079 268.760506 77.197.67.116 -> 244.3.210.197 TCP 64 61843 > http [ACK] Seq=4968 Ack=171928 Win=65535 Len=0
824055 269.122975 77.197.67.116 -> 244.3.210.197 TCP 64 61809 > http [ACK] Seq=6775 Ack=293790 Win=62962 Len=0
824121 269.138625 77.197.67.116 -> 244.3.210.197 TCP 64 [TCP Window Update] 61809 > http [ACK] Seq=6775 Ack=293790 Win=65535 Len=0
825470 269.420712 77.197.67.116 -> 244.3.210.197 TCP 64 61843 > http [ACK] Seq=5439 Ack=201425 Win=65535 Len=0
827022 269.874656 77.197.67.116 -> 244.3.210.197 TCP 64 61809 > http [ACK] Seq=7261 Ack=298590 Win=65535 Len=0
827031 269.876945 77.197.67.116 -> 244.3.210.197 TCP 64 61843 > http [ACK] Seq=5923 Ack=203518 Win=65535 Len=0
827455 270.019147 77.197.67.116 -> 244.3.210.197 TCP 64 61843 > http [ACK] Seq=6407 Ack=205724 Win=65535 Len=0
827462 270.020089 77.197.67.116 -> 244.3.210.197 TCP 64 61809 > http [ACK] Seq=7745 Ack=300678 Win=65535 Len=0
827861 270.167108 77.197.67.116 -> 244.3.210.197 TCP 64 61843 > http [ACK] Seq=6891 Ack=207696 Win=65535 Len=0
827867 270.168238 77.197.67.116 -> 244.3.210.197 TCP 64 61809 > http [ACK] Seq=8229 Ack=303018 Win=65535 Len=0
828024 270.252203 77.197.67.116 -> 244.3.210.197 TCP 64 61843 > http [ACK] Seq=7375 Ack=209774 Win=65535 Len=0
836874 274.086678 77.197.67.116 -> 244.3.210.197 TCP 64 61843 > http [ACK] Seq=7838 Ack=234199 Win=49870 Len=0
836880 274.087644 77.197.67.116 -> 244.3.210.197 TCP 64 [TCP Window Update] 61843 > http [ACK] Seq=7838 Ack=234199 Win=53630 Len=0
836920 274.099833 77.197.67.116 -> 244.3.210.197 TCP 64 [TCP Window Update] 61843 > http [ACK] Seq=7838 Ack=234199 Win=65535 Len=0
867531 286.843066 77.197.67.116 -> 244.3.210.197 TCP 64 61809 > http [RST, ACK] Seq=8229 Ack=303018 Win=0 Len=0
868034 286.923154 77.197.67.116 -> 244.3.210.197 TCP 64 61843 > http [RST, ACK] Seq=7838 Ack=234199 Win=0 Len=0
