88829  34.311837 77.197.128.168 -> 41.177.26.176 TCP 66 25118 > http [SYN] Seq=0 Win=65535 Len=0 MSS=1460 SACK_PERM=1
89075  34.393681 77.197.128.168 -> 41.177.26.176 TCP 64 25118 > http [ACK] Seq=1 Ack=1 Win=65535 Len=0
90251  34.789661 77.197.128.168 -> 41.177.26.176 TCP 64 25118 > http [ACK] Seq=305 Ack=2431 Win=65535 Len=0
90252  34.789665 77.197.128.168 -> 41.177.26.176 TCP 64 25118 > http [ACK] Seq=305 Ack=3896 Win=65535 Len=0
90565  34.871435 77.197.128.168 -> 41.177.26.176 TCP 64 25118 > http [ACK] Seq=305 Ack=7885 Win=65535 Len=0
90566  34.871675 77.197.128.168 -> 41.177.26.176 TCP 64 25118 > http [ACK] Seq=305 Ack=11161 Win=63719 Len=0
90811  34.935227 77.197.128.168 -> 41.177.26.176 TCP 64 [TCP Window Update] 25118 > http [ACK] Seq=305 Ack=11161 Win=65535 Len=0
90812  34.935529 77.197.128.168 -> 41.177.26.176 TCP 64 25118 > http [RST, ACK] Seq=305 Ack=11161 Win=0 Len=0
92337  35.367259 77.197.128.168 -> 41.177.26.176 TCP 66 25856 > http [SYN] Seq=0 Win=65535 Len=0 MSS=1460 SACK_PERM=1
92581  35.449002 77.197.128.168 -> 41.177.26.176 TCP 64 25856 > http [ACK] Seq=1 Ack=1 Win=65535 Len=0
94479  35.826590 77.197.128.168 -> 41.177.26.176 TCP 64 25856 > http [ACK] Seq=353 Ack=2431 Win=65535 Len=0
94480  35.826740 77.197.128.168 -> 41.177.26.176 TCP 64 25856 > http [ACK] Seq=353 Ack=4052 Win=65535 Len=0
94820  35.909278 77.197.128.168 -> 41.177.26.176 TCP 64 25856 > http [ACK] Seq=353 Ack=6216 Win=65535 Len=0
94822  35.909388 77.197.128.168 -> 41.177.26.176 TCP 64 25856 > http [ACK] Seq=353 Ack=8319 Win=65535 Len=0
94831  35.909530 77.197.128.168 -> 41.177.26.176 TCP 64 25856 > http [ACK] Seq=353 Ack=9779 Win=64075 Len=0
94878  35.923564 77.197.128.168 -> 41.177.26.176 TCP 64 25856 > http [ACK] Seq=353 Ack=11239 Win=65535 Len=0
95151  35.993168 77.197.128.168 -> 41.177.26.176 TCP 64 25856 > http [RST, ACK] Seq=353 Ack=11395 Win=0 Len=0
95748  36.105037 77.197.128.168 -> 41.177.26.176 TCP 66 26377 > http [SYN] Seq=0 Win=65535 Len=0 MSS=1460 SACK_PERM=1
96223  36.187405 77.197.128.168 -> 41.177.26.176 TCP 64 26377 > http [ACK] Seq=1 Ack=1 Win=65535 Len=0
98085  36.628708 77.197.128.168 -> 41.177.26.176 TCP 64 26377 > http [ACK] Seq=309 Ack=2431 Win=65535 Len=0
98089  36.628979 77.197.128.168 -> 41.177.26.176 TCP 64 26377 > http [ACK] Seq=309 Ack=3908 Win=65535 Len=0
98394  36.710823 77.197.128.168 -> 41.177.26.176 TCP 64 26377 > http [ACK] Seq=309 Ack=6082 Win=65535 Len=0
98395  36.710984 77.197.128.168 -> 41.177.26.176 TCP 64 26377 > http [ACK] Seq=309 Ack=7542 Win=65535 Len=0
98397  36.711453 77.197.128.168 -> 41.177.26.176 TCP 64 26377 > http [ACK] Seq=309 Ack=9942 Win=65535 Len=0
98740  36.796481 77.197.128.168 -> 41.177.26.176 TCP 64 26377 > http [ACK] Seq=309 Ack=11355 Win=64122 Len=0
98741  36.797146 77.197.128.168 -> 41.177.26.176 TCP 64 26377 > http [RST, ACK] Seq=309 Ack=11355 Win=0 Len=0
101918  37.362980 77.197.128.168 -> 41.177.26.176 TCP 66 27185 > http [SYN] Seq=0 Win=65535 Len=0 MSS=1460 SACK_PERM=1
102425  37.446996 77.197.128.168 -> 41.177.26.176 TCP 64 27185 > http [ACK] Seq=1 Ack=1 Win=65535 Len=0
104762  37.903348 77.197.128.168 -> 41.177.26.176 TCP 64 27185 > http [ACK] Seq=309 Ack=2431 Win=65535 Len=0
105186  37.986682 77.197.128.168 -> 41.177.26.176 TCP 64 27185 > http [ACK] Seq=309 Ack=6075 Win=65363 Len=0
105187  37.986687 77.197.128.168 -> 41.177.26.176 TCP 64 [TCP Dup ACK 105186#1] 27185 > http [ACK] Seq=309 Ack=6075 Win=65363 Len=0
105483  38.069473 77.197.128.168 -> 41.177.26.176 TCP 64 27185 > http [ACK] Seq=309 Ack=8659 Win=65535 Len=0
105484  38.069680 77.197.128.168 -> 41.177.26.176 TCP 64 27185 > http [ACK] Seq=309 Ack=11508 Win=64146 Len=0
105756  38.168852 77.197.128.168 -> 41.177.26.176 TCP 64 27185 > http [RST, ACK] Seq=309 Ack=11508 Win=0 Len=0
107080  38.572742 77.197.128.168 -> 41.177.26.176 TCP 66 28023 > http [SYN] Seq=0 Win=65535 Len=0 MSS=1460 SACK_PERM=1
107432  38.654499 77.197.128.168 -> 41.177.26.176 TCP 64 28023 > http [ACK] Seq=1 Ack=1 Win=65535 Len=0
108443  39.016106 77.197.128.168 -> 41.177.26.176 TCP 64 28023 > http [ACK] Seq=353 Ack=2431 Win=65535 Len=0
108444  39.016111 77.197.128.168 -> 41.177.26.176 TCP 64 28023 > http [ACK] Seq=353 Ack=4052 Win=65535 Len=0
108831  39.099793 77.197.128.168 -> 41.177.26.176 TCP 64 28023 > http [ACK] Seq=353 Ack=6216 Win=65535 Len=0
108832  39.099909 77.197.128.168 -> 41.177.26.176 TCP 64 28023 > http [ACK] Seq=353 Ack=8601 Win=65535 Len=0
109050  39.181665 77.197.128.168 -> 41.177.26.176 TCP 64 28023 > http [ACK] Seq=353 Ack=11440 Win=65535 Len=0
109052  39.181950 77.197.128.168 -> 41.177.26.176 TCP 64 28023 > http [RST, ACK] Seq=353 Ack=11440 Win=0 Len=0
110025  39.410903 77.197.128.168 -> 41.177.26.176 TCP 66 28577 > http [SYN] Seq=0 Win=65535 Len=0 MSS=1460 SACK_PERM=1
110262  39.492570 77.197.128.168 -> 41.177.26.176 TCP 64 28577 > http [ACK] Seq=1 Ack=1 Win=65535 Len=0
111724  39.896224 77.197.128.168 -> 41.177.26.176 TCP 64 28577 > http [ACK] Seq=355 Ack=3024 Win=65535 Len=0
112092  39.978113 77.197.128.168 -> 41.177.26.176 TCP 64 28577 > http [ACK] Seq=355 Ack=6239 Win=65535 Len=0
112401  40.060938 77.197.128.168 -> 41.177.26.176 TCP 64 28577 > http [ACK] Seq=355 Ack=8147 Win=65535 Len=0
112402  40.061063 77.197.128.168 -> 41.177.26.176 TCP 64 28577 > http [ACK] Seq=355 Ack=11241 Win=65535 Len=0
112403  40.061214 77.197.128.168 -> 41.177.26.176 TCP 64 28577 > http [RST, ACK] Seq=355 Ack=11241 Win=0 Len=0
113240  40.312053 77.197.128.168 -> 41.177.26.176 TCP 66 29154 > http [SYN] Seq=0 Win=65535 Len=0 MSS=1460 SACK_PERM=1
113615  40.393800 77.197.128.168 -> 41.177.26.176 TCP 64 29154 > http [ACK] Seq=1 Ack=1 Win=65535 Len=0
114366  40.837365 77.197.128.168 -> 41.177.26.176 TCP 64 29154 > http [ACK] Seq=318 Ack=2431 Win=65535 Len=0
114367  40.837529 77.197.128.168 -> 41.177.26.176 TCP 64 29154 > http [ACK] Seq=318 Ack=3896 Win=65535 Len=0
114564  40.919193 77.197.128.168 -> 41.177.26.176 TCP 64 29154 > http [ACK] Seq=318 Ack=7530 Win=65535 Len=0
114565  40.919576 77.197.128.168 -> 41.177.26.176 TCP 64 29154 > http [ACK] Seq=318 Ack=11182 Win=63895 Len=0
114566  40.919581 77.197.128.168 -> 41.177.26.176 TCP 64 [TCP Dup ACK 114565#1] 29154 > http [ACK] Seq=318 Ack=11182 Win=63895 Len=0
114635  40.976842 77.197.128.168 -> 41.177.26.176 TCP 64 [TCP Window Update] 29154 > http [ACK] Seq=318 Ack=11182 Win=65535 Len=0
114639  40.977056 77.197.128.168 -> 41.177.26.176 TCP 64 29154 > http [RST, ACK] Seq=318 Ack=11182 Win=0 Len=0
115707  41.269573 77.197.128.168 -> 41.177.26.176 TCP 66 29844 > http [SYN] Seq=0 Win=65535 Len=0 MSS=1460 SACK_PERM=1
115896  41.351321 77.197.128.168 -> 41.177.26.176 TCP 64 29844 > http [ACK] Seq=1 Ack=1 Win=65535 Len=0
118188  42.411915 77.197.128.168 -> 41.177.26.176 TCP 64 29844 > http [ACK] Seq=344 Ack=1498 Win=65535 Len=0
118202  42.423039 77.197.128.168 -> 41.177.26.176 TCP 64 29844 > http [ACK] Seq=344 Ack=2415 Win=64618 Len=0
118205  42.423270 77.197.128.168 -> 41.177.26.176 TCP 64 29844 > http [ACK] Seq=344 Ack=2919 Win=64114 Len=0
118206  42.423391 77.197.128.168 -> 41.177.26.176 TCP 64 29844 > http [ACK] Seq=344 Ack=3544 Win=65535 Len=0
118347  42.493757 77.197.128.168 -> 41.177.26.176 TCP 64 29844 > http [ACK] Seq=344 Ack=6115 Win=65535 Len=0
118409  42.504674 77.197.128.168 -> 41.177.26.176 TCP 64 29844 > http [ACK] Seq=344 Ack=7575 Win=65535 Len=0
118410  42.504982 77.197.128.168 -> 41.177.26.176 TCP 64 29844 > http [ACK] Seq=344 Ack=10191 Win=65535 Len=0
118713  42.634018 77.197.128.168 -> 41.177.26.176 TCP 64 29844 > http [RST, ACK] Seq=344 Ack=10191 Win=0 Len=0
119902  42.919837 77.197.128.168 -> 41.177.26.176 TCP 66 30940 > http [SYN] Seq=0 Win=65535 Len=0 MSS=1460 SACK_PERM=1
120487  43.002089 77.197.128.168 -> 41.177.26.176 TCP 64 30940 > http [ACK] Seq=1 Ack=1 Win=65535 Len=0
121669  43.355360 77.197.128.168 -> 41.177.26.176 TCP 64 30940 > http [ACK] Seq=316 Ack=3705 Win=65535 Len=0
121990  43.439657 77.197.128.168 -> 41.177.26.176 TCP 64 30940 > http [ACK] Seq=316 Ack=7869 Win=65031 Len=0
121991  43.439662 77.197.128.168 -> 41.177.26.176 TCP 64 [TCP Dup ACK 121990#1] 30940 > http [ACK] Seq=316 Ack=7869 Win=65031 Len=0
122244  43.521375 77.197.128.168 -> 41.177.26.176 TCP 64 30940 > http [ACK] Seq=316 Ack=10458 Win=65535 Len=0
122246  43.521852 77.197.128.168 -> 41.177.26.176 TCP 64 30940 > http [RST, ACK] Seq=316 Ack=11140 Win=0 Len=0
123454  43.921097 77.197.128.168 -> 41.177.26.176 TCP 66 31498 > http [SYN] Seq=0 Win=65535 Len=0 MSS=1460 SACK_PERM=1
123617  44.004127 77.197.128.168 -> 41.177.26.176 TCP 64 31498 > http [ACK] Seq=1 Ack=1 Win=65535 Len=0
135209  47.011711 77.197.128.168 -> 41.177.26.176 TCP 64 31498 > http [ACK] Seq=267 Ack=2388 Win=65535 Len=0
135366  47.093845 77.197.128.168 -> 41.177.26.176 TCP 64 31498 > http [ACK] Seq=267 Ack=5164 Win=65535 Len=0
135367  47.093850 77.197.128.168 -> 41.177.26.176 TCP 64 31498 > http [ACK] Seq=267 Ack=7240 Win=65535 Len=0
135584  47.177280 77.197.128.168 -> 41.177.26.176 TCP 64 31498 > http [ACK] Seq=267 Ack=10177 Win=65535 Len=0
135586  47.177522 77.197.128.168 -> 41.177.26.176 TCP 64 31498 > http [RST, ACK] Seq=267 Ack=10177 Win=0 Len=0
136491  47.514274 77.197.128.168 -> 41.177.26.176 TCP 66 33404 > http [SYN] Seq=0 Win=65535 Len=0 MSS=1460 SACK_PERM=1
136766  47.597233 77.197.128.168 -> 41.177.26.176 TCP 64 33404 > http [ACK] Seq=1 Ack=1 Win=65535 Len=0
138891  48.105701 77.197.128.168 -> 41.177.26.176 TCP 64 33404 > http [ACK] Seq=355 Ack=2245 Win=65535 Len=0
139236  48.188773 77.197.128.168 -> 41.177.26.176 TCP 64 33404 > http [ACK] Seq=355 Ack=5165 Win=65535 Len=0
139242  48.189066 77.197.128.168 -> 41.177.26.176 TCP 64 33404 > http [ACK] Seq=355 Ack=7686 Win=65026 Len=0
139243  48.189069 77.197.128.168 -> 41.177.26.176 TCP 64 [TCP Dup ACK 139242#1] 33404 > http [ACK] Seq=355 Ack=7686 Win=65026 Len=0
139755  48.271059 77.197.128.168 -> 41.177.26.176 TCP 64 33404 > http [ACK] Seq=355 Ack=11330 Win=65535 Len=0
139757  48.271330 77.197.128.168 -> 41.177.26.176 TCP 64 33404 > http [RST, ACK] Seq=355 Ack=11330 Win=0 Len=0
140657  48.499358 77.197.128.168 -> 41.177.26.176 TCP 66 33978 > http [SYN] Seq=0 Win=65535 Len=0 MSS=1460 SACK_PERM=1
140907  48.582247 77.197.128.168 -> 41.177.26.176 TCP 64 33978 > http [ACK] Seq=1 Ack=1 Win=65535 Len=0
142854  49.071083 77.197.128.168 -> 41.177.26.176 TCP 64 33978 > http [ACK] Seq=356 Ack=2431 Win=65535 Len=0
143077  49.152898 77.197.128.168 -> 41.177.26.176 TCP 64 33978 > http [ACK] Seq=356 Ack=5351 Win=65535 Len=0
143078  49.152903 77.197.128.168 -> 41.177.26.176 TCP 64 33978 > http [ACK] Seq=356 Ack=7690 Win=63196 Len=0
143079  49.152907 77.197.128.168 -> 41.177.26.176 TCP 64 [TCP Window Update] 33978 > http [ACK] Seq=356 Ack=7690 Win=65535 Len=0
143268  49.235161 77.197.128.168 -> 41.177.26.176 TCP 64 33978 > http [ACK] Seq=356 Ack=10610 Win=65535 Len=0
143269  49.235448 77.197.128.168 -> 41.177.26.176 TCP 64 33978 > http [RST, ACK] Seq=356 Ack=11325 Win=0 Len=0
144282  49.512833 77.197.128.168 -> 41.177.26.176 TCP 66 34475 > http [SYN] Seq=0 Win=65535 Len=0 MSS=1460 SACK_PERM=1
144521  49.595400 77.197.128.168 -> 41.177.26.176 TCP 64 34475 > http [ACK] Seq=1 Ack=1 Win=65535 Len=0
148911  51.127418 77.197.128.168 -> 41.177.26.176 TCP 64 34475 > http [ACK] Seq=306 Ack=1415 Win=64121 Len=0
148933  51.138115 77.197.128.168 -> 41.177.26.176 TCP 64 34475 > http [ACK] Seq=306 Ack=2386 Win=65535 Len=0
148934  51.138168 77.197.128.168 -> 41.177.26.176 TCP 64 34475 > http [ACK] Seq=306 Ack=2688 Win=65233 Len=0
148938  51.138410 77.197.128.168 -> 41.177.26.176 TCP 64 34475 > http [ACK] Seq=306 Ack=3596 Win=64325 Len=0
149064  51.209377 77.197.128.168 -> 41.177.26.176 TCP 64 34475 > http [ACK] Seq=306 Ack=5836 Win=65535 Len=0
149081  51.220278 77.197.128.168 -> 41.177.26.176 TCP 64 34475 > http [ACK] Seq=306 Ack=9763 Win=61608 Len=0
149082  51.220308 77.197.128.168 -> 41.177.26.176 TCP 64 [TCP Window Update] 34475 > http [ACK] Seq=306 Ack=9763 Win=65535 Len=0
149506  51.308953 77.197.128.168 -> 41.177.26.176 TCP 64 34475 > http [RST, ACK] Seq=306 Ack=9763 Win=0 Len=0
150730  51.712385 77.197.128.168 -> 41.177.26.176 TCP 66 35511 > http [SYN] Seq=0 Win=65535 Len=0 MSS=1460 SACK_PERM=1
150929  51.796247 77.197.128.168 -> 41.177.26.176 TCP 64 35511 > http [ACK] Seq=1 Ack=1 Win=65535 Len=0
152289  52.180580 77.197.128.168 -> 41.177.26.176 TCP 64 35511 > http [ACK] Seq=317 Ack=2834 Win=65535 Len=0
152640  52.263724 77.197.128.168 -> 41.177.26.176 TCP 64 35511 > http [ACK] Seq=317 Ack=6062 Win=65535 Len=0
152641  52.263841 77.197.128.168 -> 41.177.26.176 TCP 64 35511 > http [ACK] Seq=317 Ack=7522 Win=65535 Len=0
152868  52.345671 77.197.128.168 -> 41.177.26.176 TCP 64 35511 > http [ACK] Seq=317 Ack=9521 Win=65535 Len=0
152869  52.345753 77.197.128.168 -> 41.177.26.176 TCP 64 35511 > http [ACK] Seq=317 Ack=11163 Win=65535 Len=0
152871  52.345904 77.197.128.168 -> 41.177.26.176 TCP 64 35511 > http [RST, ACK] Seq=317 Ack=11163 Win=0 Len=0
153264  52.450329 77.197.128.168 -> 41.177.26.176 TCP 66 35889 > http [SYN] Seq=0 Win=65535 Len=0 MSS=1460 SACK_PERM=1
153589  52.533269 77.197.128.168 -> 41.177.26.176 TCP 64 35889 > http [ACK] Seq=1 Ack=1 Win=65535 Len=0
154943  52.915273 77.197.128.168 -> 41.177.26.176 TCP 64 35889 > http [ACK] Seq=304 Ack=2834 Win=65535 Len=0
155288  52.997287 77.197.128.168 -> 41.177.26.176 TCP 64 35889 > http [ACK] Seq=304 Ack=5360 Win=65535 Len=0
155289  52.997292 77.197.128.168 -> 41.177.26.176 TCP 64 35889 > http [ACK] Seq=304 Ack=7524 Win=65535 Len=0
155666  53.079305 77.197.128.168 -> 41.177.26.176 TCP 64 35889 > http [ACK] Seq=304 Ack=11151 Win=65535 Len=0
155667  53.079504 77.197.128.168 -> 41.177.26.176 TCP 64 35889 > http [RST, ACK] Seq=304 Ack=11151 Win=0 Len=0
156265  53.257088 77.197.128.168 -> 41.177.26.176 TCP 66 36364 > http [SYN] Seq=0 Win=65535 Len=0 MSS=1460 SACK_PERM=1
156641  53.338796 77.197.128.168 -> 41.177.26.176 TCP 64 36364 > http [ACK] Seq=1 Ack=1 Win=65535 Len=0
159596  54.323464 77.197.128.168 -> 41.177.26.176 TCP 64 36364 > http [ACK] Seq=327 Ack=2110 Win=65535 Len=0
159602  54.323837 77.197.128.168 -> 41.177.26.176 TCP 64 36364 > http [ACK] Seq=327 Ack=2797 Win=64848 Len=0
159603  54.323941 77.197.128.168 -> 41.177.26.176 TCP 64 36364 > http [ACK] Seq=327 Ack=3596 Win=65535 Len=0
159749  54.405553 77.197.128.168 -> 41.177.26.176 TCP 64 36364 > http [ACK] Seq=327 Ack=6098 Win=65535 Len=0
159750  54.405827 77.197.128.168 -> 41.177.26.176 TCP 64 36364 > http [ACK] Seq=327 Ack=11568 Win=65535 Len=0
160020  54.487329 77.197.128.168 -> 41.177.26.176 TCP 64 36364 > http [ACK] Seq=327 Ack=12618 Win=64485 Len=0
160022  54.487633 77.197.128.168 -> 41.177.26.176 TCP 64 36364 > http [RST, ACK] Seq=327 Ack=12618 Win=0 Len=0
160770  54.733690 77.197.128.168 -> 41.177.26.176 TCP 66 37079 > http [SYN] Seq=0 Win=65535 Len=0 MSS=1460 SACK_PERM=1
161048  54.816232 77.197.128.168 -> 41.177.26.176 TCP 64 37079 > http [ACK] Seq=1 Ack=1 Win=65535 Len=0
162668  55.278435 77.197.128.168 -> 41.177.26.176 TCP 64 37079 > http [ACK] Seq=309 Ack=2431 Win=65535 Len=0
162671  55.278685 77.197.128.168 -> 41.177.26.176 TCP 64 37079 > http [ACK] Seq=309 Ack=3908 Win=65535 Len=0
163169  55.360161 77.197.128.168 -> 41.177.26.176 TCP 64 37079 > http [ACK] Seq=309 Ack=7542 Win=65535 Len=0
163171  55.360275 77.197.128.168 -> 41.177.26.176 TCP 64 37079 > http [ACK] Seq=309 Ack=10601 Win=62476 Len=0
163173  55.360428 77.197.128.168 -> 41.177.26.176 TCP 64 [TCP Window Update] 37079 > http [ACK] Seq=309 Ack=10601 Win=65535 Len=0
163481  55.442038 77.197.128.168 -> 41.177.26.176 TCP 64 37079 > http [RST, ACK] Seq=309 Ack=11283 Win=0 Len=0
164019  55.591550 77.197.128.168 -> 41.177.26.176 TCP 66 gdrive-sync > http [SYN] Seq=0 Win=65535 Len=0 MSS=1460 SACK_PERM=1
164338  55.673613 77.197.128.168 -> 41.177.26.176 TCP 64 gdrive-sync > http [ACK] Seq=1 Ack=1 Win=65535 Len=0
167350  56.135264 77.197.128.168 -> 41.177.26.176 TCP 64 gdrive-sync > http [ACK] Seq=305 Ack=4062 Win=65535 Len=0
167878  56.217151 77.197.128.168 -> 41.177.26.176 TCP 64 gdrive-sync > http [ACK] Seq=305 Ack=6064 Win=65535 Len=0
167879  56.217156 77.197.128.168 -> 41.177.26.176 TCP 64 gdrive-sync > http [ACK] Seq=305 Ack=7861 Win=65535 Len=0
168387  56.298846 77.197.128.168 -> 41.177.26.176 TCP 64 gdrive-sync > http [ACK] Seq=305 Ack=11137 Win=63934 Len=0
168388  56.298851 77.197.128.168 -> 41.177.26.176 TCP 64 [TCP Dup ACK 168387#1] gdrive-sync > http [ACK] Seq=305 Ack=11137 Win=63934 Len=0
168664  56.335817 77.197.128.168 -> 41.177.26.176 TCP 64 [TCP Window Update] gdrive-sync > http [ACK] Seq=305 Ack=11137 Win=65535 Len=0
168666  56.336130 77.197.128.168 -> 41.177.26.176 TCP 64 gdrive-sync > http [RST, ACK] Seq=305 Ack=11137 Win=0 Len=0
170862  56.766202 77.197.128.168 -> 41.177.26.176 TCP 66 37974 > http [SYN] Seq=0 Win=65535 Len=0 MSS=1460 SACK_PERM=1
171189  56.847878 77.197.128.168 -> 41.177.26.176 TCP 64 37974 > http [ACK] Seq=1 Ack=1 Win=65535 Len=0
171991  57.287987 77.197.128.168 -> 41.177.26.176 TCP 64 37974 > http [ACK] Seq=318 Ack=2431 Win=65535 Len=0
171992  57.288008 77.197.128.168 -> 41.177.26.176 TCP 64 37974 > http [ACK] Seq=318 Ack=3896 Win=65535 Len=0
172157  57.369956 77.197.128.168 -> 41.177.26.176 TCP 64 37974 > http [ACK] Seq=318 Ack=8350 Win=65535 Len=0
172402  57.451882 77.197.128.168 -> 41.177.26.176 TCP 64 37974 > http [ACK] Seq=318 Ack=11199 Win=65338 Len=0
172403  57.451886 77.197.128.168 -> 41.177.26.176 TCP 64 [TCP Dup ACK 172402#1] 37974 > http [ACK] Seq=318 Ack=11199 Win=65338 Len=0
172407  57.452178 77.197.128.168 -> 41.177.26.176 TCP 64 37974 > http [RST, ACK] Seq=318 Ack=11199 Win=0 Len=0
173239  57.611217 77.197.128.168 -> 41.177.26.176 TCP 66 38398 > http [SYN] Seq=0 Win=65535 Len=0 MSS=1460 SACK_PERM=1
173555  57.692875 77.197.128.168 -> 41.177.26.176 TCP 64 38398 > http [ACK] Seq=1 Ack=1 Win=65535 Len=0
177097  59.349945 77.197.128.168 -> 41.177.26.176 TCP 64 38398 > http [ACK] Seq=296 Ack=2300 Win=65535 Len=0
177098  59.350148 77.197.128.168 -> 41.177.26.176 TCP 64 38398 > http [ACK] Seq=296 Ack=2702 Win=65133 Len=0
177101  59.350255 77.197.128.168 -> 41.177.26.176 TCP 64 38398 > http [ACK] Seq=296 Ack=3762 Win=65535 Len=0
177232  59.432199 77.197.128.168 -> 41.177.26.176 TCP 64 38398 > http [ACK] Seq=296 Ack=6350 Win=65535 Len=0
177233  59.432341 77.197.128.168 -> 41.177.26.176 TCP 64 38398 > http [ACK] Seq=296 Ack=9270 Win=65535 Len=0
177234  59.432592 77.197.128.168 -> 41.177.26.176 TCP 64 38398 > http [RST, ACK] Seq=296 Ack=10148 Win=0 Len=0
177797  59.710402 77.197.128.168 -> 41.177.26.176 TCP 66 39446 > http [SYN] Seq=0 Win=65535 Len=0 MSS=1460 SACK_PERM=1
178123  59.792118 77.197.128.168 -> 41.177.26.176 TCP 64 39446 > http [ACK] Seq=1 Ack=1 Win=65535 Len=0
179137  60.226635 77.197.128.168 -> 41.177.26.176 TCP 64 39446 > http [ACK] Seq=310 Ack=2431 Win=65535 Len=0
179312  60.308753 77.197.128.168 -> 41.177.26.176 TCP 64 39446 > http [ACK] Seq=310 Ack=7540 Win=63898 Len=0
179313  60.308758 77.197.128.168 -> 41.177.26.176 TCP 64 [TCP Window Update] 39446 > http [ACK] Seq=310 Ack=7540 Win=65535 Len=0
179429  60.390733 77.197.128.168 -> 41.177.26.176 TCP 64 39446 > http [ACK] Seq=310 Ack=9251 Win=65535 Len=0
179430  60.390738 77.197.128.168 -> 41.177.26.176 TCP 64 39446 > http [ACK] Seq=310 Ack=11082 Win=65535 Len=0
179431  60.390904 77.197.128.168 -> 41.177.26.176 TCP 64 39446 > http [RST, ACK] Seq=310 Ack=11082 Win=0 Len=0
179742  60.520602 77.197.128.168 -> 41.177.26.176 TCP 66 39795 > http [SYN] Seq=0 Win=65535 Len=0 MSS=1460 SACK_PERM=1
179990  60.602234 77.197.128.168 -> 41.177.26.176 TCP 64 39795 > http [ACK] Seq=1 Ack=1 Win=65535 Len=0
181804  61.112963 77.197.128.168 -> 41.177.26.176 TCP 64 39795 > http [ACK] Seq=355 Ack=2431 Win=65535 Len=0
181805  61.112967 77.197.128.168 -> 41.177.26.176 TCP 64 39795 > http [ACK] Seq=355 Ack=4058 Win=65535 Len=0
182050  61.194735 77.197.128.168 -> 41.177.26.176 TCP 64 39795 > http [ACK] Seq=355 Ack=6232 Win=65535 Len=0
182051  61.194739 77.197.128.168 -> 41.177.26.176 TCP 64 39795 > http [ACK] Seq=355 Ack=9131 Win=65535 Len=0
182332  61.276364 77.197.128.168 -> 41.177.26.176 TCP 64 39795 > http [ACK] Seq=355 Ack=12181 Win=65535 Len=0
182336  61.276900 77.197.128.168 -> 41.177.26.176 TCP 64 39795 > http [RST, ACK] Seq=355 Ack=12181 Win=0 Len=0
183795  61.756375 77.197.128.168 -> 41.177.26.176 TCP 66 40278 > http [SYN] Seq=0 Win=65535 Len=0 MSS=1460 SACK_PERM=1
184022  61.838355 77.197.128.168 -> 41.177.26.176 TCP 64 40278 > http [ACK] Seq=1 Ack=1 Win=65535 Len=0
185850  62.241073 77.197.128.168 -> 41.177.26.176 TCP 64 40278 > http [ACK] Seq=308 Ack=2922 Win=65535 Len=0
185980  62.322992 77.197.128.168 -> 41.177.26.176 TCP 64 40278 > http [ACK] Seq=308 Ack=6076 Win=65535 Len=0
186100  62.404668 77.197.128.168 -> 41.177.26.176 TCP 64 40278 > http [ACK] Seq=308 Ack=8641 Win=65535 Len=0
186101  62.404834 77.197.128.168 -> 41.177.26.176 TCP 64 40278 > http [ACK] Seq=308 Ack=11487 Win=65535 Len=0
186102  62.405094 77.197.128.168 -> 41.177.26.176 TCP 64 40278 > http [RST, ACK] Seq=308 Ack=11487 Win=0 Len=0
186423  62.579692 77.197.128.168 -> 41.177.26.176 TCP 66 40688 > http [SYN] Seq=0 Win=65535 Len=0 MSS=1460 SACK_PERM=1
186540  62.661590 77.197.128.168 -> 41.177.26.176 TCP 64 40688 > http [ACK] Seq=1 Ack=1 Win=65535 Len=0
186972  63.075527 77.197.128.168 -> 41.177.26.176 TCP 64 40688 > http [ACK] Seq=318 Ack=2431 Win=65535 Len=0
186973  63.075642 77.197.128.168 -> 41.177.26.176 TCP 64 40688 > http [ACK] Seq=318 Ack=3896 Win=65535 Len=0
187092  63.157304 77.197.128.168 -> 41.177.26.176 TCP 64 40688 > http [ACK] Seq=318 Ack=6070 Win=65535 Len=0
187093  63.157443 77.197.128.168 -> 41.177.26.176 TCP 64 40688 > http [ACK] Seq=318 Ack=10450 Win=61155 Len=0
187094  63.157448 77.197.128.168 -> 41.177.26.176 TCP 64 [TCP Window Update] 40688 > http [ACK] Seq=318 Ack=10450 Win=65535 Len=0
187456  63.371322 77.197.128.168 -> 41.177.26.176 TCP 64 40688 > http [ACK] Seq=318 Ack=11445 Win=64540 Len=0
188168  63.907371 77.197.128.168 -> 41.177.26.176 TCP 66 40891 > http [SYN] Seq=0 Win=65535 Len=0 MSS=1460 SACK_PERM=1
188231  63.959255 77.197.128.168 -> 41.177.26.176 TCP 64 40688 > http [RST, ACK] Seq=318 Ack=11445 Win=0 Len=0
188283  63.988954 77.197.128.168 -> 41.177.26.176 TCP 64 40891 > http [ACK] Seq=1 Ack=1 Win=65535 Len=0
188948  64.381256 77.197.128.168 -> 41.177.26.176 TCP 64 40891 > http [ACK] Seq=353 Ack=2431 Win=65535 Len=0
188949  64.381440 77.197.128.168 -> 41.177.26.176 TCP 64 40891 > http [ACK] Seq=353 Ack=4052 Win=65535 Len=0
189044  64.462992 77.197.128.168 -> 41.177.26.176 TCP 64 40891 > http [ACK] Seq=353 Ack=7676 Win=65535 Len=0
189045  64.463188 77.197.128.168 -> 41.177.26.176 TCP 64 40891 > http [ACK] Seq=353 Ack=9833 Win=65535 Len=0
189191  64.559557 77.197.128.168 -> 41.177.26.176 TCP 64 40891 > http [RST, ACK] Seq=353 Ack=11212 Win=0 Len=0
226396  77.364162 77.197.128.168 -> 41.177.26.176 TCP 66 49872 > http [SYN] Seq=0 Win=65535 Len=0 MSS=1460 SACK_PERM=1
226484  77.446014 77.197.128.168 -> 41.177.26.176 TCP 64 49872 > http [ACK] Seq=1 Ack=1 Win=65535 Len=0
227311  77.833422 77.197.128.168 -> 41.177.26.176 TCP 64 49872 > http [ACK] Seq=306 Ack=3899 Win=65535 Len=0
227458  77.916090 77.197.128.168 -> 41.177.26.176 TCP 64 49872 > http [ACK] Seq=306 Ack=8664 Win=65535 Len=0
227650  77.998720 77.197.128.168 -> 41.177.26.176 TCP 64 49872 > http [ACK] Seq=306 Ack=11502 Win=65535 Len=0
227653  77.998991 77.197.128.168 -> 41.177.26.176 TCP 64 49872 > http [RST, ACK] Seq=306 Ack=11502 Win=0 Len=0
237650  82.575332 77.197.128.168 -> 41.177.26.176 TCP 66 52580 > http [SYN] Seq=0 Win=65535 Len=0 MSS=1460 SACK_PERM=1
238128  82.657105 77.197.128.168 -> 41.177.26.176 TCP 64 52580 > http [ACK] Seq=1 Ack=1 Win=65535 Len=0
239474  83.152486 77.197.128.168 -> 41.177.26.176 TCP 64 52580 > http [ACK] Seq=305 Ack=3903 Win=65535 Len=0
239723  83.234206 77.197.128.168 -> 41.177.26.176 TCP 64 52580 > http [ACK] Seq=305 Ack=6077 Win=65535 Len=0
239724  83.234235 77.197.128.168 -> 41.177.26.176 TCP 64 52580 > http [ACK] Seq=305 Ack=8247 Win=65535 Len=0
239976  83.316210 77.197.128.168 -> 41.177.26.176 TCP 64 52580 > http [ACK] Seq=305 Ack=11334 Win=65535 Len=0
239977  83.316331 77.197.128.168 -> 41.177.26.176 TCP 64 52580 > http [RST, ACK] Seq=305 Ack=11334 Win=0 Len=0
241118  83.847465 77.197.128.168 -> 41.177.26.176 TCP 66 53381 > http [SYN] Seq=0 Win=65535 Len=0 MSS=1460 SACK_PERM=1
241188  83.929138 77.197.128.168 -> 41.177.26.176 TCP 64 53381 > http [ACK] Seq=1 Ack=1 Win=65535 Len=0
242195  84.318553 77.197.128.168 -> 41.177.26.176 TCP 64 53381 > http [ACK] Seq=308 Ack=2225 Win=65535 Len=0
242196  84.318572 77.197.128.168 -> 41.177.26.176 TCP 64 53381 > http [ACK] Seq=308 Ack=3911 Win=65535 Len=0
242607  84.400175 77.197.128.168 -> 41.177.26.176 TCP 64 53381 > http [ACK] Seq=308 Ack=6075 Win=65535 Len=0
242608  84.400441 77.197.128.168 -> 41.177.26.176 TCP 64 53381 > http [ACK] Seq=308 Ack=11152 Win=65535 Len=0
242609  84.400584 77.197.128.168 -> 41.177.26.176 TCP 64 53381 > http [RST, ACK] Seq=308 Ack=11152 Win=0 Len=0
243086  84.589932 77.197.128.168 -> 41.177.26.176 TCP 66 53887 > http [SYN] Seq=0 Win=65535 Len=0 MSS=1460 SACK_PERM=1
243250  84.671674 77.197.128.168 -> 41.177.26.176 TCP 64 53887 > http [ACK] Seq=1 Ack=1 Win=65535 Len=0
244123  85.136002 77.197.128.168 -> 41.177.26.176 TCP 64 53887 > http [ACK] Seq=318 Ack=2431 Win=65535 Len=0
244384  85.217898 77.197.128.168 -> 41.177.26.176 TCP 64 53887 > http [ACK] Seq=318 Ack=5351 Win=65535 Len=0
244386  85.217907 77.197.128.168 -> 41.177.26.176 TCP 64 53887 > http [ACK] Seq=318 Ack=7523 Win=65535 Len=0
244635  85.299645 77.197.128.168 -> 41.177.26.176 TCP 64 53887 > http [ACK] Seq=318 Ack=11061 Win=65535 Len=0
244637  85.299861 77.197.128.168 -> 41.177.26.176 TCP 64 53887 > http [RST, ACK] Seq=318 Ack=11061 Win=0 Len=0
244783  85.362598 77.197.128.168 -> 41.177.26.176 TCP 66 54208 > http [SYN] Seq=0 Win=65535 Len=0 MSS=1460 SACK_PERM=1
244915  85.444539 77.197.128.168 -> 41.177.26.176 TCP 64 54208 > http [ACK] Seq=1 Ack=1 Win=65535 Len=0
245769  85.864862 77.197.128.168 -> 41.177.26.176 TCP 64 54208 > http [ACK] Seq=319 Ack=2836 Win=65535 Len=0
245910  85.946710 77.197.128.168 -> 41.177.26.176 TCP 64 54208 > http [ACK] Seq=319 Ack=6082 Win=65535 Len=0
245973  86.028311 77.197.128.168 -> 41.177.26.176 TCP 64 54208 > http [ACK] Seq=319 Ack=8366 Win=65535 Len=0
245974  86.028458 77.197.128.168 -> 41.177.26.176 TCP 64 54208 > http [ACK] Seq=319 Ack=11479 Win=65535 Len=0
245975  86.028695 77.197.128.168 -> 41.177.26.176 TCP 64 54208 > http [RST, ACK] Seq=319 Ack=11479 Win=0 Len=0
246058  86.114823 77.197.128.168 -> 41.177.26.176 TCP 66 54460 > http [SYN] Seq=0 Win=65535 Len=0 MSS=1460 SACK_PERM=1
246243  86.196852 77.197.128.168 -> 41.177.26.176 TCP 64 54460 > http [ACK] Seq=1 Ack=1 Win=65535 Len=0
246864  86.607438 77.197.128.168 -> 41.177.26.176 TCP 64 54460 > http [ACK] Seq=318 Ack=2431 Win=65535 Len=0
246865  86.607625 77.197.128.168 -> 41.177.26.176 TCP 64 54460 > http [ACK] Seq=318 Ack=3896 Win=65535 Len=0
246968  86.689154 77.197.128.168 -> 41.177.26.176 TCP 64 54460 > http [ACK] Seq=318 Ack=6070 Win=65535 Len=0
246969  86.689439 77.197.128.168 -> 41.177.26.176 TCP 64 54460 > http [ACK] Seq=318 Ack=11082 Win=65535 Len=0
246970  86.689827 77.197.128.168 -> 41.177.26.176 TCP 64 54460 > http [RST, ACK] Seq=318 Ack=11082 Win=0 Len=0
247172  86.845853 77.197.128.168 -> 41.177.26.176 TCP 66 54638 > http [SYN] Seq=0 Win=65535 Len=0 MSS=1460 SACK_PERM=1
247269  86.927621 77.197.128.168 -> 41.177.26.176 TCP 64 54638 > http [ACK] Seq=1 Ack=1 Win=65535 Len=0
248080  87.308489 77.197.128.168 -> 41.177.26.176 TCP 64 54638 > http [ACK] Seq=308 Ack=2602 Win=65535 Len=0
248185  87.390286 77.197.128.168 -> 41.177.26.176 TCP 64 54638 > http [ACK] Seq=308 Ack=5365 Win=65535 Len=0
248188  87.390554 77.197.128.168 -> 41.177.26.176 TCP 64 54638 > http [ACK] Seq=308 Ack=7529 Win=65535 Len=0
248455  87.472078 77.197.128.168 -> 41.177.26.176 TCP 64 54638 > http [ACK] Seq=308 Ack=9690 Win=65535 Len=0
248456  87.472611 77.197.128.168 -> 41.177.26.176 TCP 64 54638 > http [RST, ACK] Seq=308 Ack=11076 Win=0 Len=0
248704  87.662262 77.197.128.168 -> 41.177.26.176 TCP 66 54943 > http [SYN] Seq=0 Win=65535 Len=0 MSS=1460 SACK_PERM=1
248809  87.744207 77.197.128.168 -> 41.177.26.176 TCP 64 54943 > http [ACK] Seq=1 Ack=1 Win=65535 Len=0
250152  88.215943 77.197.128.168 -> 41.177.26.176 TCP 64 54943 > http [ACK] Seq=355 Ack=2431 Win=65535 Len=0
250153  88.215948 77.197.128.168 -> 41.177.26.176 TCP 64 54943 > http [ACK] Seq=355 Ack=4058 Win=65535 Len=0
250338  88.297706 77.197.128.168 -> 41.177.26.176 TCP 64 54943 > http [ACK] Seq=355 Ack=7692 Win=65535 Len=0
250339  88.297798 77.197.128.168 -> 41.177.26.176 TCP 64 54943 > http [ACK] Seq=355 Ack=11237 Win=65535 Len=0
250340  88.298365 77.197.128.168 -> 41.177.26.176 TCP 64 54943 > http [RST, ACK] Seq=355 Ack=11237 Win=0 Len=0
250616  88.475946 77.197.128.168 -> 41.177.26.176 TCP 66 55262 > http [SYN] Seq=0 Win=65535 Len=0 MSS=1460 SACK_PERM=1
250815  88.557635 77.197.128.168 -> 41.177.26.176 TCP 64 55262 > http [ACK] Seq=1 Ack=1 Win=65535 Len=0
251540  88.936964 77.197.128.168 -> 41.177.26.176 TCP 64 55262 > http [ACK] Seq=354 Ack=2245 Win=65535 Len=0
251542  88.937126 77.197.128.168 -> 41.177.26.176 TCP 64 55262 > http [ACK] Seq=354 Ack=4051 Win=65535 Len=0
251709  89.018765 77.197.128.168 -> 41.177.26.176 TCP 64 55262 > http [ACK] Seq=354 Ack=9141 Win=65535 Len=0
251710  89.018907 77.197.128.168 -> 41.177.26.176 TCP 64 55262 > http [ACK] Seq=354 Ack=11273 Win=65535 Len=0
251711  89.019025 77.197.128.168 -> 41.177.26.176 TCP 64 55262 > http [RST, ACK] Seq=354 Ack=11273 Win=0 Len=0
251785  89.050854 77.197.128.168 -> 41.177.26.176 TCP 66 55468 > http [SYN] Seq=0 Win=65535 Len=0 MSS=1460 SACK_PERM=1
251947  89.132540 77.197.128.168 -> 41.177.26.176 TCP 64 55468 > http [ACK] Seq=1 Ack=1 Win=65535 Len=0
253044  89.592931 77.197.128.168 -> 41.177.26.176 TCP 64 55468 > http [ACK] Seq=318 Ack=2431 Win=65535 Len=0
253247  89.674855 77.197.128.168 -> 41.177.26.176 TCP 64 55468 > http [ACK] Seq=318 Ack=6063 Win=65535 Len=0
253440  89.756651 77.197.128.168 -> 41.177.26.176 TCP 64 55468 > http [ACK] Seq=318 Ack=9842 Win=65535 Len=0
253441  89.757002 77.197.128.168 -> 41.177.26.176 TCP 64 55468 > http [RST, ACK] Seq=318 Ack=11255 Win=0 Len=0
253467  89.774931 77.197.128.168 -> 41.177.26.176 TCP 66 55727 > http [SYN] Seq=0 Win=65535 Len=0 MSS=1460 SACK_PERM=1
253569  89.856674 77.197.128.168 -> 41.177.26.176 TCP 64 55727 > http [ACK] Seq=1 Ack=1 Win=65535 Len=0
254250  90.256898 77.197.128.168 -> 41.177.26.176 TCP 64 55727 > http [ACK] Seq=309 Ack=2431 Win=65535 Len=0
254251  90.256902 77.197.128.168 -> 41.177.26.176 TCP 64 55727 > http [ACK] Seq=309 Ack=3908 Win=65535 Len=0
254435  90.338858 77.197.128.168 -> 41.177.26.176 TCP 64 55727 > http [ACK] Seq=309 Ack=6076 Win=65535 Len=0
254436  90.339003 77.197.128.168 -> 41.177.26.176 TCP 64 55727 > http [ACK] Seq=309 Ack=9007 Win=65535 Len=0
254622  90.420678 77.197.128.168 -> 41.177.26.176 TCP 64 55727 > http [ACK] Seq=309 Ack=12297 Win=65338 Len=0
254623  90.420683 77.197.128.168 -> 41.177.26.176 TCP 64 [TCP Dup ACK 254622#1] 55727 > http [ACK] Seq=309 Ack=12297 Win=65338 Len=0
254624  90.420964 77.197.128.168 -> 41.177.26.176 TCP 64 55727 > http [RST, ACK] Seq=309 Ack=12297 Win=0 Len=0
254979  90.556113 77.197.128.168 -> 41.177.26.176 TCP 66 56037 > http [SYN] Seq=0 Win=65535 Len=0 MSS=1460 SACK_PERM=1
255195  90.638093 77.197.128.168 -> 41.177.26.176 TCP 64 56037 > http [ACK] Seq=1 Ack=1 Win=65535 Len=0
256070  91.012386 77.197.128.168 -> 41.177.26.176 TCP 64 56037 > http [ACK] Seq=308 Ack=3912 Win=65535 Len=0
256195  91.094250 77.197.128.168 -> 41.177.26.176 TCP 64 56037 > http [ACK] Seq=308 Ack=7536 Win=65535 Len=0
256322  91.153533 77.197.128.168 -> 41.177.26.176 TCP 64 56037 > http [ACK] Seq=308 Ack=8996 Win=65535 Len=0
256340  91.176117 77.197.128.168 -> 41.177.26.176 TCP 64 56037 > http [ACK] Seq=308 Ack=11618 Win=65535 Len=0
256341  91.176291 77.197.128.168 -> 41.177.26.176 TCP 64 56037 > http [RST, ACK] Seq=308 Ack=11618 Win=0 Len=0
256876  91.425054 77.197.128.168 -> 41.177.26.176 TCP 66 56367 > http [SYN] Seq=0 Win=65535 Len=0 MSS=1460 SACK_PERM=1
257282  91.506924 77.197.128.168 -> 41.177.26.176 TCP 64 56367 > http [ACK] Seq=1 Ack=1 Win=65535 Len=0
274223  92.413353 77.197.128.168 -> 41.177.26.176 TCP 64 56367 > http [ACK] Seq=316 Ack=2125 Win=65535 Len=0
274224  92.413549 77.197.128.168 -> 41.177.26.176 TCP 64 56367 > http [ACK] Seq=316 Ack=3604 Win=65535 Len=0
274310  92.495402 77.197.128.168 -> 41.177.26.176 TCP 64 56367 > http [ACK] Seq=316 Ack=6103 Win=65535 Len=0
274311  92.495407 77.197.128.168 -> 41.177.26.176 TCP 64 56367 > http [ACK] Seq=316 Ack=10180 Win=65535 Len=0
274312  92.495649 77.197.128.168 -> 41.177.26.176 TCP 64 56367 > http [RST, ACK] Seq=316 Ack=10180 Win=0 Len=0
277616  93.682301 77.197.128.168 -> 41.177.26.176 TCP 66 56908 > http [SYN] Seq=0 Win=65535 Len=0 MSS=1460 SACK_PERM=1
277788  93.764080 77.197.128.168 -> 41.177.26.176 TCP 64 56908 > http [ACK] Seq=1 Ack=1 Win=65535 Len=0
279013  94.155686 77.197.128.168 -> 41.177.26.176 TCP 64 56908 > http [ACK] Seq=355 Ack=4063 Win=65535 Len=0
279237  94.237388 77.197.128.168 -> 41.177.26.176 TCP 64 56908 > http [ACK] Seq=355 Ack=5950 Win=65535 Len=0
279238  94.237579 77.197.128.168 -> 41.177.26.176 TCP 64 56908 > http [ACK] Seq=355 Ack=8703 Win=65535 Len=0
279606  94.319097 77.197.128.168 -> 41.177.26.176 TCP 64 56908 > http [ACK] Seq=355 Ack=11714 Win=62524 Len=0
279607  94.319147 77.197.128.168 -> 41.177.26.176 TCP 64 [TCP Window Update] 56908 > http [ACK] Seq=355 Ack=11714 Win=65535 Len=0
279612  94.319411 77.197.128.168 -> 41.177.26.176 TCP 64 56908 > http [RST, ACK] Seq=355 Ack=11714 Win=0 Len=0
281291  94.621085 77.197.128.168 -> 41.177.26.176 TCP 66 57630 > http [SYN] Seq=0 Win=65535 Len=0 MSS=1460 SACK_PERM=1
281776  94.702820 77.197.128.168 -> 41.177.26.176 TCP 64 57630 > http [ACK] Seq=1 Ack=1 Win=65535 Len=0
283752  95.094630 77.197.128.168 -> 41.177.26.176 TCP 64 57630 > http [ACK] Seq=304 Ack=2431 Win=65535 Len=0
284108  95.176679 77.197.128.168 -> 41.177.26.176 TCP 64 57630 > http [ACK] Seq=304 Ack=6050 Win=65535 Len=0
284639  95.258699 77.197.128.168 -> 41.177.26.176 TCP 64 57630 > http [ACK] Seq=304 Ack=7873 Win=65535 Len=0
284640  95.258703 77.197.128.168 -> 41.177.26.176 TCP 64 57630 > http [ACK] Seq=304 Ack=10462 Win=65535 Len=0
284641  95.258973 77.197.128.168 -> 41.177.26.176 TCP 64 57630 > http [RST, ACK] Seq=304 Ack=11144 Win=0 Len=0
285562  95.497391 77.197.128.168 -> 41.177.26.176 TCP 66 58265 > http [SYN] Seq=0 Win=65535 Len=0 MSS=1460 SACK_PERM=1
285841  95.579165 77.197.128.168 -> 41.177.26.176 TCP 64 58265 > http [ACK] Seq=1 Ack=1 Win=65535 Len=0
287347  95.985428 77.197.128.168 -> 41.177.26.176 TCP 64 58265 > http [ACK] Seq=316 Ack=2431 Win=65535 Len=0
287618  96.067883 77.197.128.168 -> 41.177.26.176 TCP 64 58265 > http [ACK] Seq=316 Ack=7510 Win=65535 Len=0
287863  96.149864 77.197.128.168 -> 41.177.26.176 TCP 64 58265 > http [ACK] Seq=316 Ack=11431 Win=65535 Len=0
287864  96.150043 77.197.128.168 -> 41.177.26.176 TCP 64 58265 > http [RST, ACK] Seq=316 Ack=11431 Win=0 Len=0
288581  96.404377 77.197.128.168 -> 41.177.26.176 TCP 66 58766 > http [SYN] Seq=0 Win=65535 Len=0 MSS=1460 SACK_PERM=1
289034  96.488376 77.197.128.168 -> 41.177.26.176 TCP 64 58766 > http [ACK] Seq=1 Ack=1 Win=65535 Len=0
292452  98.074983 77.197.128.168 -> 41.177.26.176 TCP 64 58766 > http [ACK] Seq=317 Ack=2218 Win=65535 Len=0
292453  98.075084 77.197.128.168 -> 41.177.26.176 TCP 64 58766 > http [ACK] Seq=317 Ack=2660 Win=65093 Len=0
292460  98.075515 77.197.128.168 -> 41.177.26.176 TCP 64 58766 > http [ACK] Seq=317 Ack=3699 Win=65535 Len=0
292580  98.157006 77.197.128.168 -> 41.177.26.176 TCP 64 58766 > http [ACK] Seq=317 Ack=6051 Win=65535 Len=0
292581  98.157161 77.197.128.168 -> 41.177.26.176 TCP 64 58766 > http [ACK] Seq=317 Ack=8971 Win=65535 Len=0
292582  98.157930 77.197.128.168 -> 41.177.26.176 TCP 64 58766 > http [RST, ACK] Seq=317 Ack=9969 Win=0 Len=0
292983  98.368916 77.197.128.168 -> 41.177.26.176 TCP 66 60120 > http [SYN] Seq=0 Win=65535 Len=0 MSS=1460 SACK_PERM=1
293190  98.450839 77.197.128.168 -> 41.177.26.176 TCP 64 60120 > http [ACK] Seq=1 Ack=1 Win=65535 Len=0
296090  99.935439 77.197.128.168 -> 41.177.26.176 TCP 64 60120 > http [ACK] Seq=347 Ack=2059 Win=65535 Len=0
296092  99.935734 77.197.128.168 -> 41.177.26.176 TCP 64 60120 > http [ACK] Seq=347 Ack=2711 Win=64883 Len=0
296094  99.935839 77.197.128.168 -> 41.177.26.176 TCP 64 60120 > http [ACK] Seq=347 Ack=3366 Win=64228 Len=0
296245 100.017716 77.197.128.168 -> 41.177.26.176 TCP 64 60120 > http [ACK] Seq=347 Ack=6637 Win=65535 Len=0
296246 100.017787 77.197.128.168 -> 41.177.26.176 TCP 64 60120 > http [ACK] Seq=347 Ack=10708 Win=65535 Len=0
296247 100.018126 77.197.128.168 -> 41.177.26.176 TCP 64 60120 > http [RST, ACK] Seq=347 Ack=10708 Win=0 Len=0
296677 100.197441 77.197.128.168 -> 41.177.26.176 TCP 66 61316 > http [SYN] Seq=0 Win=65535 Len=0 MSS=1460 SACK_PERM=1
297301 100.279103 77.197.128.168 -> 41.177.26.176 TCP 64 61316 > http [ACK] Seq=1 Ack=1 Win=65535 Len=0
300288 101.242379 77.197.128.168 -> 41.177.26.176 TCP 64 61316 > http [ACK] Seq=334 Ack=1536 Win=65535 Len=0
300405 101.257325 77.197.128.168 -> 41.177.26.176 TCP 64 61316 > http [ACK] Seq=334 Ack=2440 Win=64631 Len=0
300408 101.257640 77.197.128.168 -> 41.177.26.176 TCP 64 61316 > http [ACK] Seq=334 Ack=3012 Win=65535 Len=0
300539 101.324251 77.197.128.168 -> 41.177.26.176 TCP 64 61316 > http [ACK] Seq=334 Ack=6407 Win=65535 Len=0
300584 101.339063 77.197.128.168 -> 41.177.26.176 TCP 64 61316 > http [ACK] Seq=334 Ack=9327 Win=65535 Len=0
300585 101.339491 77.197.128.168 -> 41.177.26.176 TCP 64 61316 > http [RST, ACK] Seq=334 Ack=10512 Win=0 Len=0
301014 101.497725 77.197.128.168 -> 41.177.26.176 TCP 66 62206 > http [SYN] Seq=0 Win=65535 Len=0 MSS=1460 SACK_PERM=1
301241 101.579337 77.197.128.168 -> 41.177.26.176 TCP 64 62206 > http [ACK] Seq=1 Ack=1 Win=65535 Len=0
317012 108.154698 77.197.128.168 -> 41.177.26.176 TCP 64 62206 > http [ACK] Seq=316 Ack=2177 Win=65535 Len=0
317013 108.154849 77.197.128.168 -> 41.177.26.176 TCP 64 62206 > http [ACK] Seq=316 Ack=2625 Win=65087 Len=0
317014 108.154944 77.197.128.168 -> 41.177.26.176 TCP 64 62206 > http [ACK] Seq=316 Ack=2942 Win=64770 Len=0
317165 108.236528 77.197.128.168 -> 41.177.26.176 TCP 64 62206 > http [ACK] Seq=316 Ack=5329 Win=65535 Len=0
317167 108.236589 77.197.128.168 -> 41.177.26.176 TCP 64 62206 > http [ACK] Seq=316 Ack=7751 Win=65535 Len=0
317168 108.236608 77.197.128.168 -> 41.177.26.176 TCP 64 62206 > http [ACK] Seq=316 Ack=10161 Win=65535 Len=0
317179 108.237104 77.197.128.168 -> 41.177.26.176 TCP 64 62206 > http [RST, ACK] Seq=316 Ack=10161 Win=0 Len=0
317705 108.404640 77.197.128.168 -> 41.177.26.176 TCP 66 raven-rmp > http [SYN] Seq=0 Win=65535 Len=0 MSS=1460 SACK_PERM=1
318019 108.486467 77.197.128.168 -> 41.177.26.176 TCP 64 raven-rmp > http [ACK] Seq=1 Ack=1 Win=65535 Len=0
319420 108.878657 77.197.128.168 -> 41.177.26.176 TCP 64 raven-rmp > http [ACK] Seq=319 Ack=3117 Win=65535 Len=0
319541 108.960556 77.197.128.168 -> 41.177.26.176 TCP 64 raven-rmp > http [ACK] Seq=319 Ack=6082 Win=65535 Len=0
319704 109.042611 77.197.128.168 -> 41.177.26.176 TCP 64 raven-rmp > http [ACK] Seq=319 Ack=9041 Win=65535 Len=0
319705 109.042721 77.197.128.168 -> 41.177.26.176 TCP 64 raven-rmp > http [ACK] Seq=319 Ack=11927 Win=65535 Len=0
319706 109.042987 77.197.128.168 -> 41.177.26.176 TCP 64 raven-rmp > http [RST, ACK] Seq=319 Ack=11927 Win=0 Len=0
320080 109.220127 77.197.128.168 -> 41.177.26.176 TCP 66 4204 > http [SYN] Seq=0 Win=65535 Len=0 MSS=1460 SACK_PERM=1
320411 109.302165 77.197.128.168 -> 41.177.26.176 TCP 64 4204 > http [ACK] Seq=1 Ack=1 Win=65535 Len=0
321151 109.699119 77.197.128.168 -> 41.177.26.176 TCP 64 4204 > http [ACK] Seq=308 Ack=2431 Win=65535 Len=0
