91888  35.221379 77.197.210.186 -> 41.177.26.15 TCP 66 42771 > http [SYN] Seq=0 Win=65535 Len=0 MSS=1460 SACK_PERM=1
92161  35.303559 77.197.210.186 -> 41.177.26.15 TCP 64 42771 > http [ACK] Seq=1 Ack=1 Win=65535 Len=0
93476  35.694561 77.197.210.186 -> 41.177.26.15 TCP 64 42771 > http [ACK] Seq=308 Ack=4381 Win=65535 Len=0
93969  35.776711 77.197.210.186 -> 41.177.26.15 TCP 64 42771 > http [ACK] Seq=308 Ack=7301 Win=65535 Len=0
93970  35.776716 77.197.210.186 -> 41.177.26.15 TCP 64 42771 > http [ACK] Seq=308 Ack=9925 Win=65535 Len=0
94609  35.860147 77.197.210.186 -> 41.177.26.15 TCP 64 42771 > http [ACK] Seq=308 Ack=18125 Win=59983 Len=0
94610  35.860152 77.197.210.186 -> 41.177.26.15 TCP 64 [TCP Window Update] 42771 > http [ACK] Seq=308 Ack=18125 Win=65535 Len=0
94929  35.942346 77.197.210.186 -> 41.177.26.15 TCP 64 42771 > http [ACK] Seq=308 Ack=21045 Win=65535 Len=0
94930  35.942351 77.197.210.186 -> 41.177.26.15 TCP 64 42771 > http [ACK] Seq=308 Ack=22899 Win=65535 Len=0
94940  35.945732 77.197.210.186 -> 41.177.26.15 TCP 64 42771 > http [RST, ACK] Seq=308 Ack=22899 Win=0 Len=0
107990  38.813982 77.197.210.186 -> 41.177.26.15 TCP 66 45513 > http [SYN] Seq=0 Win=65535 Len=0 MSS=1460 SACK_PERM=1
108144  38.895926 77.197.210.186 -> 41.177.26.15 TCP 64 45513 > http [ACK] Seq=1 Ack=1 Win=65535 Len=0
110364  39.530192 77.197.210.186 -> 41.177.26.15 TCP 64 45513 > http [ACK] Seq=309 Ack=2921 Win=65535 Len=0
110682  39.612999 77.197.210.186 -> 41.177.26.15 TCP 64 45513 > http [ACK] Seq=309 Ack=5841 Win=65535 Len=0
110683  39.613002 77.197.210.186 -> 41.177.26.15 TCP 64 45513 > http [ACK] Seq=309 Ack=8465 Win=64923 Len=0
110684  39.613006 77.197.210.186 -> 41.177.26.15 TCP 64 [TCP Dup ACK 110683#1] 45513 > http [ACK] Seq=309 Ack=8465 Win=64923 Len=0
111038  39.694995 77.197.210.186 -> 41.177.26.15 TCP 64 45513 > http [ACK] Seq=309 Ack=11385 Win=65535 Len=0
111045  39.695132 77.197.210.186 -> 41.177.26.15 TCP 64 45513 > http [ACK] Seq=309 Ack=15765 Win=65535 Len=0
111049  39.695213 77.197.210.186 -> 41.177.26.15 TCP 64 45513 > http [ACK] Seq=309 Ack=16665 Win=64635 Len=0
111280  39.777533 77.197.210.186 -> 41.177.26.15 TCP 64 45513 > http [ACK] Seq=309 Ack=19585 Win=65535 Len=0
111281  39.777538 77.197.210.186 -> 41.177.26.15 TCP 64 45513 > http [ACK] Seq=309 Ack=21045 Win=65535 Len=0
111282  39.777653 77.197.210.186 -> 41.177.26.15 TCP 64 45513 > http [ACK] Seq=309 Ack=26325 Win=63727 Len=0
111283  39.777657 77.197.210.186 -> 41.177.26.15 TCP 64 [TCP Window Update] 45513 > http [ACK] Seq=309 Ack=26325 Win=65535 Len=0
111287  39.777805 77.197.210.186 -> 41.177.26.15 TCP 64 45513 > http [ACK] Seq=309 Ack=29245 Win=62615 Len=0
111552  39.860577 77.197.210.186 -> 41.177.26.15 TCP 64 45513 > http [ACK] Seq=309 Ack=47105 Win=44755 Len=0
111785  39.921452 77.197.210.186 -> 41.177.26.15 TCP 64 [TCP Window Update] 45513 > http [ACK] Seq=309 Ack=47105 Win=48227 Len=0
111786  39.921540 77.197.210.186 -> 41.177.26.15 TCP 64 [TCP Window Update] 45513 > http [ACK] Seq=309 Ack=47105 Win=65535 Len=0
111897  39.942526 77.197.210.186 -> 41.177.26.15 TCP 64 45513 > http [ACK] Seq=309 Ack=49465 Win=65535 Len=0
111900  39.942647 77.197.210.186 -> 41.177.26.15 TCP 64 45513 > http [ACK] Seq=309 Ack=52385 Win=65535 Len=0
111901  39.942651 77.197.210.186 -> 41.177.26.15 TCP 64 45513 > http [ACK] Seq=309 Ack=55305 Win=65527 Len=0
111902  39.942655 77.197.210.186 -> 41.177.26.15 TCP 64 [TCP Dup ACK 111901#1] 45513 > http [ACK] Seq=309 Ack=55305 Win=65527 Len=0
111903  39.942659 77.197.210.186 -> 41.177.26.15 TCP 64 45513 > http [ACK] Seq=309 Ack=57665 Win=65535 Len=0
111908  39.942785 77.197.210.186 -> 41.177.26.15 TCP 64 45513 > http [ACK] Seq=309 Ack=60585 Win=65535 Len=0
111912  39.942879 77.197.210.186 -> 41.177.26.15 TCP 64 45513 > http [ACK] Seq=309 Ack=64965 Win=64075 Len=0
111916  39.943074 77.197.210.186 -> 41.177.26.15 TCP 64 45513 > http [ACK] Seq=309 Ack=67325 Win=61715 Len=0
112147  40.008380 77.197.210.186 -> 41.177.26.15 TCP 64 [TCP Window Update] 45513 > http [ACK] Seq=309 Ack=67325 Win=65187 Len=0
112148  40.008386 77.197.210.186 -> 41.177.26.15 TCP 64 [TCP Dup ACK 112147#1] 45513 > http [ACK] Seq=309 Ack=67325 Win=65187 Len=0
112194  40.024312 77.197.210.186 -> 41.177.26.15 TCP 64 45513 > http [ACK] Seq=309 Ack=70245 Win=65535 Len=0
112199  40.024573 77.197.210.186 -> 41.177.26.15 TCP 64 45513 > http [ACK] Seq=309 Ack=73165 Win=65535 Len=0
112205  40.024878 77.197.210.186 -> 41.177.26.15 TCP 64 45513 > http [ACK] Seq=309 Ack=75525 Win=65535 Len=0
112206  40.024883 77.197.210.186 -> 41.177.26.15 TCP 64 45513 > http [ACK] Seq=309 Ack=78445 Win=65535 Len=0
112207  40.024887 77.197.210.186 -> 41.177.26.15 TCP 64 45513 > http [ACK] Seq=309 Ack=81365 Win=65535 Len=0
112211  40.025098 77.197.210.186 -> 41.177.26.15 TCP 64 45513 > http [ACK] Seq=309 Ack=83725 Win=63175 Len=0
112212  40.025102 77.197.210.186 -> 41.177.26.15 TCP 64 45513 > http [ACK] Seq=309 Ack=86645 Win=60255 Len=0
112215  40.025147 77.197.210.186 -> 41.177.26.15 TCP 64 45513 > http [ACK] Seq=309 Ack=89565 Win=57335 Len=0
112227  40.025334 77.197.210.186 -> 41.177.26.15 TCP 64 45513 > http [ACK] Seq=309 Ack=91925 Win=54975 Len=0
112233  40.025529 77.197.210.186 -> 41.177.26.15 TCP 64 45513 > http [ACK] Seq=309 Ack=94845 Win=52055 Len=0
112234  40.025533 77.197.210.186 -> 41.177.26.15 TCP 64 45513 > http [ACK] Seq=309 Ack=97765 Win=49135 Len=0
112450  40.079810 77.197.210.186 -> 41.177.26.15 TCP 64 [TCP Window Update] 45513 > http [ACK] Seq=309 Ack=97765 Win=53507 Len=0
112451  40.079815 77.197.210.186 -> 41.177.26.15 TCP 64 [TCP Window Update] 45513 > http [ACK] Seq=309 Ack=97765 Win=65535 Len=0
112549  40.106180 77.197.210.186 -> 41.177.26.15 TCP 64 45513 > http [ACK] Seq=309 Ack=101585 Win=65535 Len=0
112550  40.106273 77.197.210.186 -> 41.177.26.15 TCP 64 45513 > http [ACK] Seq=309 Ack=104505 Win=65535 Len=0
112555  40.106481 77.197.210.186 -> 41.177.26.15 TCP 64 45513 > http [ACK] Seq=309 Ack=105965 Win=65535 Len=0
112560  40.106590 77.197.210.186 -> 41.177.26.15 TCP 64 45513 > http [ACK] Seq=309 Ack=108325 Win=65535 Len=0
112561  40.106594 77.197.210.186 -> 41.177.26.15 TCP 64 45513 > http [ACK] Seq=309 Ack=111245 Win=65535 Len=0
112568  40.106854 77.197.210.186 -> 41.177.26.15 TCP 64 45513 > http [ACK] Seq=309 Ack=115065 Win=64635 Len=0
112569  40.106859 77.197.210.186 -> 41.177.26.15 TCP 64 45513 > http [ACK] Seq=309 Ack=117985 Win=61715 Len=0
112573  40.106972 77.197.210.186 -> 41.177.26.15 TCP 64 45513 > http [ACK] Seq=309 Ack=122365 Win=57335 Len=0
112574  40.106976 77.197.210.186 -> 41.177.26.15 TCP 64 45513 > http [ACK] Seq=309 Ack=124725 Win=54975 Len=0
112575  40.106980 77.197.210.186 -> 41.177.26.15 TCP 64 45513 > http [ACK] Seq=309 Ack=127645 Win=52055 Len=0
112584  40.107247 77.197.210.186 -> 41.177.26.15 TCP 64 45513 > http [ACK] Seq=309 Ack=131465 Win=48235 Len=0
112585  40.107251 77.197.210.186 -> 41.177.26.15 TCP 64 45513 > http [ACK] Seq=309 Ack=134385 Win=45315 Len=0
112591  40.107552 77.197.210.186 -> 41.177.26.15 TCP 64 45513 > http [ACK] Seq=309 Ack=137305 Win=42395 Len=0
112592  40.107556 77.197.210.186 -> 41.177.26.15 TCP 64 45513 > http [ACK] Seq=309 Ack=139665 Win=40035 Len=0
112593  40.107657 77.197.210.186 -> 41.177.26.15 TCP 64 45513 > http [ACK] Seq=309 Ack=142585 Win=37115 Len=0
112736  40.163085 77.197.210.186 -> 41.177.26.15 TCP 64 45513 > http [ACK] Seq=309 Ack=144045 Win=39127 Len=0
112737  40.163091 77.197.210.186 -> 41.177.26.15 TCP 64 [TCP Window Update] 45513 > http [ACK] Seq=309 Ack=144045 Win=65535 Len=0
112884  40.187919 77.197.210.186 -> 41.177.26.15 TCP 64 45513 > http [ACK] Seq=309 Ack=146965 Win=65535 Len=0
112885  40.187996 77.197.210.186 -> 41.177.26.15 TCP 64 45513 > http [ACK] Seq=309 Ack=149325 Win=65535 Len=0
112886  40.188114 77.197.210.186 -> 41.177.26.15 TCP 64 45513 > http [ACK] Seq=309 Ack=152245 Win=65527 Len=0
112888  40.188150 77.197.210.186 -> 41.177.26.15 TCP 64 [TCP Dup ACK 112886#1] 45513 > http [ACK] Seq=309 Ack=152245 Win=65527 Len=0
112889  40.188154 77.197.210.186 -> 41.177.26.15 TCP 64 45513 > http [ACK] Seq=309 Ack=156065 Win=65535 Len=0
112893  40.188253 77.197.210.186 -> 41.177.26.15 TCP 64 45513 > http [ACK] Seq=309 Ack=158985 Win=65535 Len=0
112900  40.188440 77.197.210.186 -> 41.177.26.15 TCP 64 45513 > http [ACK] Seq=309 Ack=161905 Win=64075 Len=0
112901  40.188445 77.197.210.186 -> 41.177.26.15 TCP 64 45513 > http [ACK] Seq=309 Ack=164265 Win=61715 Len=0
112903  40.188571 77.197.210.186 -> 41.177.26.15 TCP 64 45513 > http [ACK] Seq=309 Ack=167185 Win=58795 Len=0
112906  40.188765 77.197.210.186 -> 41.177.26.15 TCP 64 45513 > http [ACK] Seq=309 Ack=170105 Win=55875 Len=0
112907  40.188769 77.197.210.186 -> 41.177.26.15 TCP 64 45513 > http [ACK] Seq=309 Ack=172465 Win=53515 Len=0
112909  40.188931 77.197.210.186 -> 41.177.26.15 TCP 64 45513 > http [ACK] Seq=309 Ack=175385 Win=50595 Len=0
112910  40.189057 77.197.210.186 -> 41.177.26.15 TCP 64 45513 > http [ACK] Seq=309 Ack=178305 Win=47675 Len=0
113084  40.240437 77.197.210.186 -> 41.177.26.15 TCP 64 [TCP Window Update] 45513 > http [ACK] Seq=309 Ack=178305 Win=51147 Len=0
113085  40.240442 77.197.210.186 -> 41.177.26.15 TCP 64 [TCP Window Update] 45513 > http [ACK] Seq=309 Ack=178305 Win=65535 Len=0
113109  40.246442 77.197.210.186 -> 41.177.26.15 TCP 64 45513 > http [ACK] Seq=309 Ack=208185 Win=43847 Len=0
113110  40.246447 77.197.210.186 -> 41.177.26.15 TCP 64 [TCP Window Update] 45513 > http [ACK] Seq=309 Ack=208185 Win=65535 Len=0
113180  40.271372 77.197.210.186 -> 41.177.26.15 TCP 64 45513 > http [ACK] Seq=309 Ack=224585 Win=49135 Len=0
113185  40.276860 77.197.210.186 -> 41.177.26.15 TCP 64 [TCP Window Update] 45513 > http [ACK] Seq=309 Ack=224585 Win=52607 Len=0
113186  40.276865 77.197.210.186 -> 41.177.26.15 TCP 64 [TCP Dup ACK 113185#1] 45513 > http [ACK] Seq=309 Ack=224585 Win=52607 Len=0
113188  40.277072 77.197.210.186 -> 41.177.26.15 TCP 64 [TCP Window Update] 45513 > http [ACK] Seq=309 Ack=224585 Win=65535 Len=0
113269  40.322159 77.197.210.186 -> 41.177.26.15 TCP 64 45513 > http [ACK] Seq=309 Ack=227505 Win=65535 Len=0
113270  40.322292 77.197.210.186 -> 41.177.26.15 TCP 64 45513 > http [ACK] Seq=309 Ack=229865 Win=65535 Len=0
113271  40.322298 77.197.210.186 -> 41.177.26.15 TCP 64 45513 > http [ACK] Seq=309 Ack=232785 Win=65527 Len=0
113272  40.322302 77.197.210.186 -> 41.177.26.15 TCP 64 [TCP Dup ACK 113271#1] 45513 > http [ACK] Seq=309 Ack=232785 Win=65527 Len=0
113273  40.322324 77.197.210.186 -> 41.177.26.15 TCP 64 45513 > http [ACK] Seq=309 Ack=235705 Win=65535 Len=0
113274  40.322329 77.197.210.186 -> 41.177.26.15 TCP 64 45513 > http [ACK] Seq=309 Ack=238065 Win=65535 Len=0
113275  40.322546 77.197.210.186 -> 41.177.26.15 TCP 64 45513 > http [ACK] Seq=309 Ack=240985 Win=65535 Len=0
113295  40.328386 77.197.210.186 -> 41.177.26.15 TCP 64 45513 > http [ACK] Seq=309 Ack=243905 Win=62615 Len=0
113296  40.328391 77.197.210.186 -> 41.177.26.15 TCP 64 45513 > http [ACK] Seq=309 Ack=246265 Win=60255 Len=0
113297  40.328408 77.197.210.186 -> 41.177.26.15 TCP 64 45513 > http [ACK] Seq=309 Ack=249185 Win=57335 Len=0
113298  40.328412 77.197.210.186 -> 41.177.26.15 TCP 64 45513 > http [ACK] Seq=309 Ack=252105 Win=54415 Len=0
113299  40.328416 77.197.210.186 -> 41.177.26.15 TCP 64 45513 > http [ACK] Seq=309 Ack=254465 Win=52055 Len=0
113302  40.328649 77.197.210.186 -> 41.177.26.15 TCP 64 45513 > http [ACK] Seq=309 Ack=257385 Win=49135 Len=0
113303  40.328654 77.197.210.186 -> 41.177.26.15 TCP 64 45513 > http [ACK] Seq=309 Ack=260305 Win=46215 Len=0
113304  40.328658 77.197.210.186 -> 41.177.26.15 TCP 64 45513 > http [ACK] Seq=309 Ack=262665 Win=43855 Len=0
113305  40.328662 77.197.210.186 -> 41.177.26.15 TCP 64 45513 > http [ACK] Seq=309 Ack=265585 Win=40935 Len=0
113306  40.328666 77.197.210.186 -> 41.177.26.15 TCP 64 45513 > http [ACK] Seq=309 Ack=268505 Win=38015 Len=0
113307  40.328671 77.197.210.186 -> 41.177.26.15 TCP 64 45513 > http [ACK] Seq=309 Ack=270865 Win=35655 Len=0
113464  40.358950 77.197.210.186 -> 41.177.26.15 TCP 64 45513 > http [ACK] Seq=309 Ack=274889 Win=31631 Len=0
113494  40.364059 77.197.210.186 -> 41.177.26.15 TCP 64 [TCP Window Update] 45513 > http [ACK] Seq=309 Ack=274889 Win=35103 Len=0
113495  40.364063 77.197.210.186 -> 41.177.26.15 TCP 64 [TCP Window Update] 45513 > http [ACK] Seq=309 Ack=274889 Win=65535 Len=0
113605  40.392259 77.197.210.186 -> 41.177.26.15 TCP 64 45513 > http [RST, ACK] Seq=309 Ack=274889 Win=0 Len=0
114211  40.736952 77.197.210.186 -> 41.177.26.15 TCP 66 46645 > http [SYN] Seq=0 Win=65535 Len=0 MSS=1460 SACK_PERM=1
114352  40.818692 77.197.210.186 -> 41.177.26.15 TCP 64 46645 > http [ACK] Seq=1 Ack=1 Win=65535 Len=0
118896  42.684138 77.197.210.186 -> 41.177.26.15 TCP 64 46645 > http [ACK] Seq=365 Ack=4381 Win=65535 Len=0
119312  42.772165 77.197.210.186 -> 41.177.26.15 TCP 64 46645 > http [ACK] Seq=365 Ack=9936 Win=65535 Len=0
119613  42.853981 77.197.210.186 -> 41.177.26.15 TCP 64 46645 > http [ACK] Seq=365 Ack=12856 Win=65252 Len=0
119614  42.853986 77.197.210.186 -> 41.177.26.15 TCP 64 [TCP Dup ACK 119613#1] 46645 > http [ACK] Seq=365 Ack=12856 Win=65252 Len=0
119615  42.853990 77.197.210.186 -> 41.177.26.15 TCP 64 46645 > http [ACK] Seq=365 Ack=16668 Win=65535 Len=0
120015  42.936176 77.197.210.186 -> 41.177.26.15 TCP 64 46645 > http [ACK] Seq=365 Ack=19588 Win=65535 Len=0
120016  42.936180 77.197.210.186 -> 41.177.26.15 TCP 64 46645 > http [ACK] Seq=365 Ack=22508 Win=65535 Len=0
120017  42.936183 77.197.210.186 -> 41.177.26.15 TCP 64 46645 > http [ACK] Seq=365 Ack=24860 Win=65535 Len=0
120580  43.018442 77.197.210.186 -> 41.177.26.15 TCP 64 46645 > http [ACK] Seq=365 Ack=27780 Win=65535 Len=0
120581  43.018583 77.197.210.186 -> 41.177.26.15 TCP 64 46645 > http [ACK] Seq=365 Ack=30700 Win=65535 Len=0
120582  43.018588 77.197.210.186 -> 41.177.26.15 TCP 64 46645 > http [ACK] Seq=365 Ack=33052 Win=65535 Len=0
120583  43.018694 77.197.210.186 -> 41.177.26.15 TCP 64 46645 > http [ACK] Seq=365 Ack=37432 Win=65535 Len=0
120584  43.018698 77.197.210.186 -> 41.177.26.15 TCP 64 46645 > http [ACK] Seq=365 Ack=39222 Win=65535 Len=0
120599  43.023317 77.197.210.186 -> 41.177.26.15 TCP 64 46645 > http [RST, ACK] Seq=365 Ack=39222 Win=0 Len=0
758043 244.092526 77.197.210.186 -> 41.177.26.15 TCP 66 39961 > http [SYN] Seq=0 Win=65535 Len=0 MSS=1460 SACK_PERM=1
758395 244.174447 77.197.210.186 -> 41.177.26.15 TCP 64 39961 > http [ACK] Seq=1 Ack=1 Win=65535 Len=0
759358 244.719696 77.197.210.186 -> 41.177.26.15 TCP 64 39961 > http [ACK] Seq=309 Ack=4381 Win=65535 Len=0
759447 244.803290 77.197.210.186 -> 41.177.26.15 TCP 64 39961 > http [ACK] Seq=309 Ack=9925 Win=65535 Len=0
759600 244.885034 77.197.210.186 -> 41.177.26.15 TCP 64 39961 > http [ACK] Seq=309 Ack=12845 Win=62615 Len=0
759601 244.885339 77.197.210.186 -> 41.177.26.15 TCP 64 39961 > http [ACK] Seq=309 Ack=15765 Win=59695 Len=0
759608 244.888306 77.197.210.186 -> 41.177.26.15 TCP 64 39961 > http [ACK] Seq=309 Ack=16665 Win=62267 Len=0
759609 244.888453 77.197.210.186 -> 41.177.26.15 TCP 64 [TCP Window Update] 39961 > http [ACK] Seq=309 Ack=16665 Win=65535 Len=0
759720 244.967447 77.197.210.186 -> 41.177.26.15 TCP 64 39961 > http [ACK] Seq=309 Ack=19585 Win=65535 Len=0
759721 244.967511 77.197.210.186 -> 41.177.26.15 TCP 64 39961 > http [ACK] Seq=309 Ack=22505 Win=65535 Len=0
759723 244.967688 77.197.210.186 -> 41.177.26.15 TCP 64 39961 > http [ACK] Seq=309 Ack=24865 Win=65527 Len=0
759724 244.967693 77.197.210.186 -> 41.177.26.15 TCP 64 [TCP Dup ACK 759723#1] 39961 > http [ACK] Seq=309 Ack=24865 Win=65527 Len=0
759735 244.969964 77.197.210.186 -> 41.177.26.15 TCP 64 39961 > http [ACK] Seq=309 Ack=27785 Win=65535 Len=0
759886 245.050516 77.197.210.186 -> 41.177.26.15 TCP 64 39961 > http [ACK] Seq=309 Ack=30705 Win=65535 Len=0
759887 245.050520 77.197.210.186 -> 41.177.26.15 TCP 64 39961 > http [ACK] Seq=309 Ack=33065 Win=65535 Len=0
759896 245.050691 77.197.210.186 -> 41.177.26.15 TCP 64 39961 > http [ACK] Seq=309 Ack=35985 Win=65527 Len=0
759897 245.050695 77.197.210.186 -> 41.177.26.15 TCP 64 [TCP Dup ACK 759896#1] 39961 > http [ACK] Seq=309 Ack=35985 Win=65527 Len=0
759898 245.050716 77.197.210.186 -> 41.177.26.15 TCP 64 39961 > http [ACK] Seq=309 Ack=38905 Win=65535 Len=0
759914 245.052173 77.197.210.186 -> 41.177.26.15 TCP 64 39961 > http [ACK] Seq=309 Ack=41265 Win=65535 Len=0
759915 245.052327 77.197.210.186 -> 41.177.26.15 TCP 64 39961 > http [ACK] Seq=309 Ack=44185 Win=65535 Len=0
760084 245.133619 77.197.210.186 -> 41.177.26.15 TCP 64 39961 > http [ACK] Seq=309 Ack=62045 Win=50587 Len=0
760085 245.133648 77.197.210.186 -> 41.177.26.15 TCP 64 [TCP Window Update] 39961 > http [ACK] Seq=309 Ack=62045 Win=65535 Len=0
760104 245.135008 77.197.210.186 -> 41.177.26.15 TCP 64 39961 > http [ACK] Seq=309 Ack=70245 Win=57335 Len=0
760125 245.137209 77.197.210.186 -> 41.177.26.15 TCP 64 [TCP Window Update] 39961 > http [ACK] Seq=309 Ack=70245 Win=60807 Len=0
760126 245.137214 77.197.210.186 -> 41.177.26.15 TCP 64 [TCP Dup ACK 760125#1] 39961 > http [ACK] Seq=309 Ack=70245 Win=60807 Len=0
760127 245.137218 77.197.210.186 -> 41.177.26.15 TCP 64 [TCP Window Update] 39961 > http [ACK] Seq=309 Ack=70245 Win=65535 Len=0
760315 245.216153 77.197.210.186 -> 41.177.26.15 TCP 64 39961 > http [ACK] Seq=309 Ack=74065 Win=65535 Len=0
760316 245.216293 77.197.210.186 -> 41.177.26.15 TCP 64 39961 > http [ACK] Seq=309 Ack=76985 Win=65535 Len=0
760317 245.216298 77.197.210.186 -> 41.177.26.15 TCP 64 39961 > http [ACK] Seq=309 Ack=78445 Win=65535 Len=0
760318 245.216468 77.197.210.186 -> 41.177.26.15 TCP 64 39961 > http [ACK] Seq=309 Ack=82265 Win=65535 Len=0
760319 245.216472 77.197.210.186 -> 41.177.26.15 TCP 64 39961 > http [ACK] Seq=309 Ack=86645 Win=65535 Len=0
760327 245.216748 77.197.210.186 -> 41.177.26.15 TCP 64 39961 > http [ACK] Seq=309 Ack=89565 Win=62615 Len=0
760341 245.217578 77.197.210.186 -> 41.177.26.15 TCP 64 39961 > http [ACK] Seq=309 Ack=91925 Win=60255 Len=0
760344 245.217765 77.197.210.186 -> 41.177.26.15 TCP 64 39961 > http [ACK] Seq=309 Ack=96305 Win=55875 Len=0
760346 245.217788 77.197.210.186 -> 41.177.26.15 TCP 64 39961 > http [ACK] Seq=309 Ack=98665 Win=53515 Len=0
760387 245.236827 77.197.210.186 -> 41.177.26.15 TCP 64 [TCP Window Update] 39961 > http [ACK] Seq=309 Ack=98665 Win=56987 Len=0
760388 245.236831 77.197.210.186 -> 41.177.26.15 TCP 64 [TCP Window Update] 39961 > http [ACK] Seq=309 Ack=98665 Win=65535 Len=0
760534 245.298045 77.197.210.186 -> 41.177.26.15 TCP 64 39961 > http [ACK] Seq=309 Ack=101585 Win=65535 Len=0
760535 245.298225 77.197.210.186 -> 41.177.26.15 TCP 64 39961 > http [ACK] Seq=309 Ack=104505 Win=65535 Len=0
760536 245.298230 77.197.210.186 -> 41.177.26.15 TCP 64 39961 > http [ACK] Seq=309 Ack=106865 Win=65527 Len=0
760537 245.298234 77.197.210.186 -> 41.177.26.15 TCP 64 [TCP Dup ACK 760536#1] 39961 > http [ACK] Seq=309 Ack=106865 Win=65527 Len=0
760538 245.298250 77.197.210.186 -> 41.177.26.15 TCP 64 39961 > http [ACK] Seq=309 Ack=109785 Win=65535 Len=0
760542 245.298375 77.197.210.186 -> 41.177.26.15 TCP 64 39961 > http [ACK] Seq=309 Ack=112705 Win=65535 Len=0
760548 245.298721 77.197.210.186 -> 41.177.26.15 TCP 64 39961 > http [ACK] Seq=309 Ack=115065 Win=65527 Len=0
760549 245.298725 77.197.210.186 -> 41.177.26.15 TCP 64 [TCP Dup ACK 760548#1] 39961 > http [ACK] Seq=309 Ack=115065 Win=65527 Len=0
760550 245.298730 77.197.210.186 -> 41.177.26.15 TCP 64 39961 > http [ACK] Seq=309 Ack=119445 Win=65535 Len=0
760551 245.298733 77.197.210.186 -> 41.177.26.15 TCP 64 39961 > http [ACK] Seq=309 Ack=123265 Win=65535 Len=0
760552 245.298738 77.197.210.186 -> 41.177.26.15 TCP 64 39961 > http [ACK] Seq=309 Ack=124725 Win=65535 Len=0
760586 245.300414 77.197.210.186 -> 41.177.26.15 TCP 64 39961 > http [ACK] Seq=309 Ack=139665 Win=58787 Len=0
760587 245.300418 77.197.210.186 -> 41.177.26.15 TCP 64 [TCP Window Update] 39961 > http [ACK] Seq=309 Ack=139665 Win=65535 Len=0
760744 245.380319 77.197.210.186 -> 41.177.26.15 TCP 64 39961 > http [ACK] Seq=309 Ack=149325 Win=64067 Len=0
760745 245.380324 77.197.210.186 -> 41.177.26.15 TCP 64 [TCP Window Update] 39961 > http [ACK] Seq=309 Ack=149325 Win=65535 Len=0
760754 245.380956 77.197.210.186 -> 41.177.26.15 TCP 64 39961 > http [ACK] Seq=309 Ack=164265 Win=57335 Len=0
760755 245.381069 77.197.210.186 -> 41.177.26.15 TCP 64 39961 > http [ACK] Seq=309 Ack=167185 Win=54415 Len=0
760759 245.381317 77.197.210.186 -> 41.177.26.15 TCP 64 39961 > http [ACK] Seq=309 Ack=172465 Win=49135 Len=0
760761 245.381530 77.197.210.186 -> 41.177.26.15 TCP 64 [TCP Window Update] 39961 > http [ACK] Seq=309 Ack=172465 Win=52607 Len=0
760762 245.381535 77.197.210.186 -> 41.177.26.15 TCP 64 [TCP Window Update] 39961 > http [ACK] Seq=309 Ack=172465 Win=65535 Len=0
760793 245.382129 77.197.210.186 -> 41.177.26.15 TCP 64 39961 > http [ACK] Seq=309 Ack=179765 Win=65535 Len=0
760795 245.383435 77.197.210.186 -> 41.177.26.15 TCP 64 39961 > http [ACK] Seq=309 Ack=196165 Win=49135 Len=0
760796 245.383541 77.197.210.186 -> 41.177.26.15 TCP 64 [TCP Window Update] 39961 > http [ACK] Seq=309 Ack=196165 Win=65535 Len=0
760976 245.462077 77.197.210.186 -> 41.177.26.15 TCP 64 39961 > http [ACK] Seq=309 Ack=198525 Win=65535 Len=0
760977 245.462126 77.197.210.186 -> 41.177.26.15 TCP 64 39961 > http [ACK] Seq=309 Ack=201445 Win=65535 Len=0
760978 245.462149 77.197.210.186 -> 41.177.26.15 TCP 64 39961 > http [ACK] Seq=309 Ack=205265 Win=64627 Len=0
760979 245.462216 77.197.210.186 -> 41.177.26.15 TCP 64 [TCP Dup ACK 760978#1] 39961 > http [ACK] Seq=309 Ack=205265 Win=64627 Len=0
760985 245.462657 77.197.210.186 -> 41.177.26.15 TCP 64 39961 > http [ACK] Seq=309 Ack=208185 Win=65535 Len=0
760986 245.462661 77.197.210.186 -> 41.177.26.15 TCP 64 39961 > http [ACK] Seq=309 Ack=210714 Win=65535 Len=0
761185 245.534826 77.197.210.186 -> 41.177.26.15 TCP 64 39961 > http [RST, ACK] Seq=309 Ack=210714 Win=0 Len=0
761931 245.819393 77.197.210.186 -> 41.177.26.15 TCP 66 21018 > http [SYN] Seq=0 Win=65535 Len=0 MSS=1460 SACK_PERM=1
762168 245.901174 77.197.210.186 -> 41.177.26.15 TCP 64 21018 > http [ACK] Seq=1 Ack=1 Win=65535 Len=0
762598 246.051074 77.197.210.186 -> 41.177.26.15 TCP 64 21018 > http [RST, ACK] Seq=374 Ack=206 Win=0 Len=0
783618 253.766514 77.197.210.186 -> 41.177.26.15 TCP 66 25875 > http [SYN] Seq=0 Win=65535 Len=0 MSS=1460 SACK_PERM=1
783812 253.851262 77.197.210.186 -> 41.177.26.15 TCP 64 25875 > http [ACK] Seq=1 Ack=1 Win=65535 Len=0
784345 254.123454 77.197.210.186 -> 41.177.26.15 TCP 64 25875 > http [ACK] Seq=308 Ack=2921 Win=65535 Len=0
784542 254.211994 77.197.210.186 -> 41.177.26.15 TCP 64 25875 > http [ACK] Seq=308 Ack=8465 Win=65535 Len=0
784677 254.294187 77.197.210.186 -> 41.177.26.15 TCP 64 25875 > http [ACK] Seq=308 Ack=11385 Win=65535 Len=0
784678 254.294192 77.197.210.186 -> 41.177.26.15 TCP 64 25875 > http [ACK] Seq=308 Ack=14305 Win=65535 Len=0
784851 254.376231 77.197.210.186 -> 41.177.26.15 TCP 64 25875 > http [ACK] Seq=308 Ack=16665 Win=65535 Len=0
784853 254.376437 77.197.210.186 -> 41.177.26.15 TCP 64 25875 > http [ACK] Seq=308 Ack=19585 Win=65535 Len=0
784855 254.376588 77.197.210.186 -> 41.177.26.15 TCP 64 25875 > http [ACK] Seq=308 Ack=22505 Win=65535 Len=0
784856 254.376593 77.197.210.186 -> 41.177.26.15 TCP 64 25875 > http [ACK] Seq=308 Ack=23965 Win=65535 Len=0
785252 254.461360 77.197.210.186 -> 41.177.26.15 TCP 64 25875 > http [RST, ACK] Seq=308 Ack=24774 Win=0 Len=0
836841 274.074167 77.197.210.186 -> 244.3.210.197 TCP 66 31534 > http [SYN] Seq=0 Win=65535 Len=0 MSS=1460 SACK_PERM=1
837029 274.164814 77.197.210.186 -> 244.3.210.197 TCP 64 31534 > http [ACK] Seq=1 Ack=1 Win=65535 Len=0
838297 274.662319 77.197.210.186 -> 244.3.210.197 TCP 64 31534 > http [ACK] Seq=339 Ack=2921 Win=65535 Len=0
838428 274.744132 77.197.210.186 -> 244.3.210.197 TCP 64 31534 > http [ACK] Seq=339 Ack=7301 Win=65535 Len=0
838561 274.826268 77.197.210.186 -> 244.3.210.197 TCP 64 31534 > http [ACK] Seq=339 Ack=10221 Win=65535 Len=0
838562 274.826278 77.197.210.186 -> 244.3.210.197 TCP 64 31534 > http [ACK] Seq=339 Ack=11681 Win=65535 Len=0
838768 274.913681 77.197.210.186 -> 244.3.210.197 TCP 64 31534 > http [ACK] Seq=339 Ack=14925 Win=65535 Len=0
838776 274.914138 77.197.210.186 -> 244.3.210.197 TCP 64 31534 > http [RST, ACK] Seq=339 Ack=14925 Win=0 Len=0
844292 277.794695 77.197.210.186 -> 41.177.26.91 TCP 66 34619 > http [SYN] Seq=0 Win=65535 Len=0 MSS=1460 SACK_PERM=1
844464 277.873802 77.197.210.186 -> 41.177.26.91 TCP 64 34619 > http [ACK] Seq=1 Ack=1 Win=65535 Len=0
844822 278.070739 77.197.210.186 -> 41.177.26.91 TCP 64 34619 > http [ACK] Seq=304 Ack=4381 Win=65535 Len=0
844947 278.152180 77.197.210.186 -> 41.177.26.91 TCP 64 34619 > http [ACK] Seq=304 Ack=8761 Win=65535 Len=0
845090 278.242974 77.197.210.186 -> 41.177.26.91 TCP 64 34619 > http [ACK] Seq=304 Ack=16061 Win=65535 Len=0
845245 278.322027 77.197.210.186 -> 41.177.26.91 TCP 64 34619 > http [ACK] Seq=304 Ack=19131 Win=65535 Len=0
845378 278.386442 77.197.210.186 -> 41.177.26.91 TCP 64 34619 > http [RST, ACK] Seq=304 Ack=19131 Win=0 Len=0
