300818 101.419377 77.197.128.12 -> 41.177.26.15 TCP 66 59372 > http [SYN] Seq=0 Win=65535 Len=0 MSS=1460 SACK_PERM=1
301019 101.498489 77.197.128.12 -> 41.177.26.15 TCP 64 59372 > http [ACK] Seq=1 Ack=1 Win=65535 Len=0
302699 102.268635 77.197.128.12 -> 41.177.26.15 TCP 64 59372 > http [ACK] Seq=309 Ack=2921 Win=65535 Len=0
302839 102.347862 77.197.128.12 -> 41.177.26.15 TCP 64 59372 > http [ACK] Seq=309 Ack=5841 Win=65535 Len=0
302840 102.347867 77.197.128.12 -> 41.177.26.15 TCP 64 59372 > http [ACK] Seq=309 Ack=8465 Win=65535 Len=0
302959 102.426979 77.197.128.12 -> 41.177.26.15 TCP 64 59372 > http [ACK] Seq=309 Ack=11385 Win=65535 Len=0
302960 102.427052 77.197.128.12 -> 41.177.26.15 TCP 64 59372 > http [ACK] Seq=309 Ack=16665 Win=65527 Len=0
302961 102.427057 77.197.128.12 -> 41.177.26.15 TCP 64 [TCP Dup ACK 302960#1] 59372 > http [ACK] Seq=309 Ack=16665 Win=65527 Len=0
303184 102.506132 77.197.128.12 -> 41.177.26.15 TCP 64 59372 > http [ACK] Seq=309 Ack=22505 Win=65535 Len=0
303185 102.506137 77.197.128.12 -> 41.177.26.15 TCP 64 59372 > http [ACK] Seq=309 Ack=27785 Win=62607 Len=0
303186 102.506141 77.197.128.12 -> 41.177.26.15 TCP 64 [TCP Window Update] 59372 > http [ACK] Seq=309 Ack=27785 Win=65535 Len=0
303429 102.585325 77.197.128.12 -> 41.177.26.15 TCP 64 59372 > http [ACK] Seq=309 Ack=33065 Win=65535 Len=0
303430 102.585330 77.197.128.12 -> 41.177.26.15 TCP 64 59372 > http [ACK] Seq=309 Ack=37445 Win=64067 Len=0
303431 102.585582 77.197.128.12 -> 41.177.26.15 TCP 64 [TCP Window Update] 59372 > http [ACK] Seq=309 Ack=37445 Win=65535 Len=0
303432 102.585587 77.197.128.12 -> 41.177.26.15 TCP 64 59372 > http [ACK] Seq=309 Ack=41265 Win=65535 Len=0
303586 102.664463 77.197.128.12 -> 41.177.26.15 TCP 64 59372 > http [ACK] Seq=309 Ack=44185 Win=65535 Len=0
303587 102.664468 77.197.128.12 -> 41.177.26.15 TCP 64 59372 > http [ACK] Seq=309 Ack=47105 Win=62615 Len=0
303588 102.664615 77.197.128.12 -> 41.177.26.15 TCP 64 [TCP Window Update] 59372 > http [ACK] Seq=309 Ack=47105 Win=65535 Len=0
303589 102.664620 77.197.128.12 -> 41.177.26.15 TCP 64 59372 > http [ACK] Seq=309 Ack=49465 Win=65535 Len=0
303590 102.664759 77.197.128.12 -> 41.177.26.15 TCP 64 59372 > http [ACK] Seq=309 Ack=53845 Win=65535 Len=0
303591 102.664764 77.197.128.12 -> 41.177.26.15 TCP 64 59372 > http [ACK] Seq=309 Ack=57665 Win=61715 Len=0
303592 102.664767 77.197.128.12 -> 41.177.26.15 TCP 64 [TCP Window Update] 59372 > http [ACK] Seq=309 Ack=57665 Win=65535 Len=0
303763 102.743560 77.197.128.12 -> 41.177.26.15 TCP 64 59372 > http [ACK] Seq=309 Ack=62045 Win=65535 Len=0
303764 102.743565 77.197.128.12 -> 41.177.26.15 TCP 64 59372 > http [ACK] Seq=309 Ack=64965 Win=65535 Len=0
303765 102.743720 77.197.128.12 -> 41.177.26.15 TCP 64 59372 > http [ACK] Seq=309 Ack=68785 Win=64067 Len=0
303766 102.743725 77.197.128.12 -> 41.177.26.15 TCP 64 [TCP Window Update] 59372 > http [ACK] Seq=309 Ack=68785 Win=65535 Len=0
303770 102.743980 77.197.128.12 -> 41.177.26.15 TCP 64 59372 > http [ACK] Seq=309 Ack=71705 Win=65535 Len=0
303771 102.743984 77.197.128.12 -> 41.177.26.15 TCP 64 59372 > http [ACK] Seq=309 Ack=74065 Win=65535 Len=0
303779 102.744145 77.197.128.12 -> 41.177.26.15 TCP 64 59372 > http [ACK] Seq=309 Ack=78445 Win=65535 Len=0
303783 102.744205 77.197.128.12 -> 41.177.26.15 TCP 64 59372 > http [ACK] Seq=309 Ack=82265 Win=65535 Len=0
303873 102.822777 77.197.128.12 -> 41.177.26.15 TCP 64 59372 > http [ACK] Seq=309 Ack=85185 Win=65535 Len=0
303875 102.822853 77.197.128.12 -> 41.177.26.15 TCP 64 59372 > http [ACK] Seq=309 Ack=93385 Win=62607 Len=0
303876 102.822858 77.197.128.12 -> 41.177.26.15 TCP 64 [TCP Window Update] 59372 > http [ACK] Seq=309 Ack=93385 Win=65535 Len=0
303883 102.823071 77.197.128.12 -> 41.177.26.15 TCP 64 59372 > http [ACK] Seq=309 Ack=97765 Win=65535 Len=0
303884 102.823075 77.197.128.12 -> 41.177.26.15 TCP 64 59372 > http [ACK] Seq=309 Ack=103045 Win=65535 Len=0
303885 102.823079 77.197.128.12 -> 41.177.26.15 TCP 64 59372 > http [ACK] Seq=309 Ack=106865 Win=64627 Len=0
303887 102.823087 77.197.128.12 -> 41.177.26.15 TCP 64 [TCP Dup ACK 303885#1] 59372 > http [ACK] Seq=309 Ack=106865 Win=64627 Len=0
303892 102.823169 77.197.128.12 -> 41.177.26.15 TCP 64 59372 > http [ACK] Seq=309 Ack=111245 Win=65535 Len=0
303893 102.823172 77.197.128.12 -> 41.177.26.15 TCP 64 59372 > http [ACK] Seq=309 Ack=116525 Win=65535 Len=0
304093 102.901716 77.197.128.12 -> 41.177.26.15 TCP 64 59372 > http [ACK] Seq=309 Ack=119445 Win=65527 Len=0
304094 102.901722 77.197.128.12 -> 41.177.26.15 TCP 64 [TCP Dup ACK 304093#1] 59372 > http [ACK] Seq=309 Ack=119445 Win=65527 Len=0
304095 102.901753 77.197.128.12 -> 41.177.26.15 TCP 64 59372 > http [ACK] Seq=309 Ack=124725 Win=65535 Len=0
304096 102.901807 77.197.128.12 -> 41.177.26.15 TCP 64 59372 > http [ACK] Seq=309 Ack=129105 Win=64067 Len=0
304097 102.901841 77.197.128.12 -> 41.177.26.15 TCP 64 [TCP Window Update] 59372 > http [ACK] Seq=309 Ack=129105 Win=65535 Len=0
304102 102.902029 77.197.128.12 -> 41.177.26.15 TCP 64 59372 > http [ACK] Seq=309 Ack=131465 Win=65535 Len=0
304103 102.902033 77.197.128.12 -> 41.177.26.15 TCP 64 59372 > http [ACK] Seq=309 Ack=134385 Win=65535 Len=0
304104 102.902037 77.197.128.12 -> 41.177.26.15 TCP 64 59372 > http [ACK] Seq=309 Ack=137305 Win=64075 Len=0
304115 102.902281 77.197.128.12 -> 41.177.26.15 TCP 64 59372 > http [ACK] Seq=309 Ack=139665 Win=61715 Len=0
304116 102.902285 77.197.128.12 -> 41.177.26.15 TCP 64 59372 > http [ACK] Seq=309 Ack=144045 Win=60807 Len=0
304117 102.902289 77.197.128.12 -> 41.177.26.15 TCP 64 [TCP Window Update] 59372 > http [ACK] Seq=309 Ack=144045 Win=65535 Len=0
304118 102.902294 77.197.128.12 -> 41.177.26.15 TCP 64 59372 > http [ACK] Seq=309 Ack=147865 Win=65535 Len=0
304119 102.902298 77.197.128.12 -> 41.177.26.15 TCP 64 59372 > http [ACK] Seq=309 Ack=150785 Win=65535 Len=0
304124 102.902404 77.197.128.12 -> 41.177.26.15 TCP 64 59372 > http [ACK] Seq=309 Ack=156065 Win=65527 Len=0
304127 102.902430 77.197.128.12 -> 41.177.26.15 TCP 64 [TCP Dup ACK 304124#1] 59372 > http [ACK] Seq=309 Ack=156065 Win=65527 Len=0
304136 102.902621 77.197.128.12 -> 41.177.26.15 TCP 64 59372 > http [ACK] Seq=309 Ack=161905 Win=65535 Len=0
304272 102.980655 77.197.128.12 -> 41.177.26.15 TCP 64 59372 > http [ACK] Seq=309 Ack=164265 Win=65535 Len=0
304273 102.980824 77.197.128.12 -> 41.177.26.15 TCP 64 59372 > http [ACK] Seq=309 Ack=168645 Win=65535 Len=0
304274 102.980829 77.197.128.12 -> 41.177.26.15 TCP 64 59372 > http [ACK] Seq=309 Ack=172465 Win=61715 Len=0
304275 102.980870 77.197.128.12 -> 41.177.26.15 TCP 64 [TCP Window Update] 59372 > http [ACK] Seq=309 Ack=172465 Win=65535 Len=0
304278 102.981108 77.197.128.12 -> 41.177.26.15 TCP 64 59372 > http [ACK] Seq=309 Ack=176845 Win=65535 Len=0
304279 102.981112 77.197.128.12 -> 41.177.26.15 TCP 64 59372 > http [ACK] Seq=309 Ack=180665 Win=65535 Len=0
304280 102.981117 77.197.128.12 -> 41.177.26.15 TCP 64 59372 > http [ACK] Seq=309 Ack=183585 Win=62615 Len=0
304282 102.981124 77.197.128.12 -> 41.177.26.15 TCP 64 [TCP Window Update] 59372 > http [ACK] Seq=309 Ack=183585 Win=65535 Len=0
304286 102.981238 77.197.128.12 -> 41.177.26.15 TCP 64 59372 > http [ACK] Seq=309 Ack=190325 Win=65535 Len=0
304287 102.981242 77.197.128.12 -> 41.177.26.15 TCP 64 59372 > http [ACK] Seq=309 Ack=193245 Win=62615 Len=0
304288 102.981246 77.197.128.12 -> 41.177.26.15 TCP 64 [TCP Window Update] 59372 > http [ACK] Seq=309 Ack=193245 Win=65535 Len=0
304295 102.981374 77.197.128.12 -> 41.177.26.15 TCP 64 59372 > http [ACK] Seq=309 Ack=197065 Win=65535 Len=0
304297 102.981397 77.197.128.12 -> 41.177.26.15 TCP 64 59372 > http [ACK] Seq=309 Ack=202905 Win=64067 Len=0
304298 102.981401 77.197.128.12 -> 41.177.26.15 TCP 64 [TCP Window Update] 59372 > http [ACK] Seq=309 Ack=202905 Win=65535 Len=0
304305 102.981607 77.197.128.12 -> 41.177.26.15 TCP 64 59372 > http [ACK] Seq=309 Ack=205265 Win=65535 Len=0
304306 102.981611 77.197.128.12 -> 41.177.26.15 TCP 64 59372 > http [ACK] Seq=309 Ack=213465 Win=65527 Len=0
304307 102.981615 77.197.128.12 -> 41.177.26.15 TCP 64 [TCP Dup ACK 304306#1] 59372 > http [ACK] Seq=309 Ack=213465 Win=65527 Len=0
304308 102.981619 77.197.128.12 -> 41.177.26.15 TCP 64 59372 > http [ACK] Seq=309 Ack=217845 Win=65535 Len=0
304318 102.981817 77.197.128.12 -> 41.177.26.15 TCP 64 59372 > http [ACK] Seq=309 Ack=221665 Win=65535 Len=0
304319 102.981821 77.197.128.12 -> 41.177.26.15 TCP 64 59372 > http [ACK] Seq=309 Ack=224585 Win=65535 Len=0
304327 102.981972 77.197.128.12 -> 41.177.26.15 TCP 64 59372 > http [ACK] Seq=309 Ack=226045 Win=65535 Len=0
304581 103.059905 77.197.128.12 -> 41.177.26.15 TCP 64 59372 > http [ACK] Seq=309 Ack=229865 Win=65535 Len=0
304582 103.060012 77.197.128.12 -> 41.177.26.15 TCP 64 59372 > http [ACK] Seq=309 Ack=238065 Win=61707 Len=0
304583 103.060016 77.197.128.12 -> 41.177.26.15 TCP 64 [TCP Window Update] 59372 > http [ACK] Seq=309 Ack=238065 Win=65535 Len=0
304584 103.060020 77.197.128.12 -> 41.177.26.15 TCP 64 59372 > http [ACK] Seq=309 Ack=240985 Win=65535 Len=0
304585 103.060144 77.197.128.12 -> 41.177.26.15 TCP 64 59372 > http [ACK] Seq=309 Ack=243905 Win=65535 Len=0
304586 103.060241 77.197.128.12 -> 41.177.26.15 TCP 64 59372 > http [ACK] Seq=309 Ack=246265 Win=65535 Len=0
304587 103.060426 77.197.128.12 -> 41.177.26.15 TCP 64 59372 > http [ACK] Seq=309 Ack=250645 Win=64067 Len=0
304588 103.060430 77.197.128.12 -> 41.177.26.15 TCP 64 [TCP Window Update] 59372 > http [ACK] Seq=309 Ack=250645 Win=65535 Len=0
304589 103.060434 77.197.128.12 -> 41.177.26.15 TCP 64 59372 > http [ACK] Seq=309 Ack=255925 Win=65535 Len=0
304590 103.060438 77.197.128.12 -> 41.177.26.15 TCP 64 59372 > http [ACK] Seq=309 Ack=261765 Win=65535 Len=0
304591 103.060538 77.197.128.12 -> 41.177.26.15 TCP 64 59372 > http [ACK] Seq=309 Ack=264125 Win=65527 Len=0
304592 103.060543 77.197.128.12 -> 41.177.26.15 TCP 64 [TCP Dup ACK 304591#1] 59372 > http [ACK] Seq=309 Ack=264125 Win=65527 Len=0
304593 103.060617 77.197.128.12 -> 41.177.26.15 TCP 64 59372 > http [ACK] Seq=309 Ack=270865 Win=65535 Len=0
304594 103.060642 77.197.128.12 -> 41.177.26.15 TCP 64 59372 > http [ACK] Seq=309 Ack=272325 Win=65535 Len=0
304595 103.060770 77.197.128.12 -> 41.177.26.15 TCP 64 59372 > http [ACK] Seq=309 Ack=279065 Win=65535 Len=0
304596 103.060775 77.197.128.12 -> 41.177.26.15 TCP 64 59372 > http [ACK] Seq=309 Ack=280525 Win=65535 Len=0
304597 103.060909 77.197.128.12 -> 41.177.26.15 TCP 64 59372 > http [ACK] Seq=309 Ack=287265 Win=65535 Len=0
304600 103.061092 77.197.128.12 -> 41.177.26.15 TCP 64 59372 > http [ACK] Seq=309 Ack=290147 Win=62653 Len=0
304601 103.061096 77.197.128.12 -> 41.177.26.15 TCP 64 [TCP Window Update] 59372 > http [ACK] Seq=309 Ack=290147 Win=65535 Len=0
304634 103.080038 77.197.128.12 -> 41.177.26.15 TCP 64 59372 > http [RST, ACK] Seq=309 Ack=290147 Win=0 Len=0
328359 113.858606 77.197.128.12 -> 41.177.26.15 TCP 66 nmmp > http [SYN] Seq=0 Win=65535 Len=0 MSS=1460 SACK_PERM=1
328462 113.937614 77.197.128.12 -> 41.177.26.15 TCP 64 nmmp > http [ACK] Seq=1 Ack=1 Win=65535 Len=0
328580 114.022736 77.197.128.12 -> 41.177.26.15 TCP 64 nmmp > http [RST, ACK] Seq=381 Ack=205 Win=0 Len=0
335122 117.177111 77.197.128.12 -> 41.177.26.15 TCP 66 icmpd > http [SYN] Seq=0 Win=65535 Len=0 MSS=1460 SACK_PERM=1
335242 117.256119 77.197.128.12 -> 41.177.26.15 TCP 64 icmpd > http [ACK] Seq=1 Ack=1 Win=65535 Len=0
336814 117.572960 77.197.128.12 -> 41.177.26.15 TCP 64 icmpd > http [ACK] Seq=308 Ack=4381 Win=65535 Len=0
337504 117.652058 77.197.128.12 -> 41.177.26.15 TCP 64 icmpd > http [ACK] Seq=308 Ack=9925 Win=65535 Len=0
339171 117.731147 77.197.128.12 -> 41.177.26.15 TCP 64 icmpd > http [ACK] Seq=308 Ack=12845 Win=65263 Len=0
339172 117.731152 77.197.128.12 -> 41.177.26.15 TCP 64 [TCP Dup ACK 339171#1] icmpd > http [ACK] Seq=308 Ack=12845 Win=65263 Len=0
339173 117.731156 77.197.128.12 -> 41.177.26.15 TCP 64 icmpd > http [ACK] Seq=308 Ack=16665 Win=65535 Len=0
341590 117.810245 77.197.128.12 -> 41.177.26.15 TCP 64 icmpd > http [ACK] Seq=308 Ack=19585 Win=65535 Len=0
341591 117.810380 77.197.128.12 -> 41.177.26.15 TCP 64 icmpd > http [ACK] Seq=308 Ack=22505 Win=65535 Len=0
341593 117.810503 77.197.128.12 -> 41.177.26.15 TCP 64 icmpd > http [ACK] Seq=308 Ack=24865 Win=65527 Len=0
341594 117.810508 77.197.128.12 -> 41.177.26.15 TCP 64 [TCP Dup ACK 341593#1] icmpd > http [ACK] Seq=308 Ack=24865 Win=65527 Len=0
343712 117.889315 77.197.128.12 -> 41.177.26.15 TCP 64 icmpd > http [ACK] Seq=308 Ack=27785 Win=65535 Len=0
343713 117.889319 77.197.128.12 -> 41.177.26.15 TCP 64 icmpd > http [ACK] Seq=308 Ack=30705 Win=65535 Len=0
343720 117.889455 77.197.128.12 -> 41.177.26.15 TCP 64 icmpd > http [ACK] Seq=308 Ack=33065 Win=65527 Len=0
343721 117.889459 77.197.128.12 -> 41.177.26.15 TCP 64 [TCP Dup ACK 343720#1] icmpd > http [ACK] Seq=308 Ack=33065 Win=65527 Len=0
343739 117.889671 77.197.128.12 -> 41.177.26.15 TCP 64 icmpd > http [ACK] Seq=308 Ack=38905 Win=65535 Len=0
345874 117.968267 77.197.128.12 -> 41.177.26.15 TCP 64 icmpd > http [ACK] Seq=308 Ack=41265 Win=65535 Len=0
345875 117.968272 77.197.128.12 -> 41.177.26.15 TCP 64 icmpd > http [ACK] Seq=308 Ack=42725 Win=65535 Len=0
345886 117.968394 77.197.128.12 -> 41.177.26.15 TCP 64 icmpd > http [ACK] Seq=308 Ack=45645 Win=65535 Len=0
345887 117.968398 77.197.128.12 -> 41.177.26.15 TCP 64 icmpd > http [ACK] Seq=308 Ack=50925 Win=65527 Len=0
345888 117.968402 77.197.128.12 -> 41.177.26.15 TCP 64 [TCP Dup ACK 345887#1] icmpd > http [ACK] Seq=308 Ack=50925 Win=65527 Len=0
345905 117.968640 77.197.128.12 -> 41.177.26.15 TCP 64 icmpd > http [ACK] Seq=308 Ack=53845 Win=65535 Len=0
345906 117.968644 77.197.128.12 -> 41.177.26.15 TCP 64 icmpd > http [ACK] Seq=308 Ack=57665 Win=65535 Len=0
345921 117.968893 77.197.128.12 -> 41.177.26.15 TCP 64 icmpd > http [ACK] Seq=308 Ack=59125 Win=65535 Len=0
348418 118.047376 77.197.128.12 -> 41.177.26.15 TCP 64 icmpd > http [ACK] Seq=308 Ack=62045 Win=65535 Len=0
348426 118.047549 77.197.128.12 -> 41.177.26.15 TCP 64 icmpd > http [ACK] Seq=308 Ack=65865 Win=65535 Len=0
348428 118.047617 77.197.128.12 -> 41.177.26.15 TCP 64 icmpd > http [ACK] Seq=308 Ack=67325 Win=65535 Len=0
348430 118.047652 77.197.128.12 -> 41.177.26.15 TCP 64 icmpd > http [ACK] Seq=308 Ack=71705 Win=65535 Len=0
348442 118.047962 77.197.128.12 -> 41.177.26.15 TCP 64 icmpd > http [ACK] Seq=308 Ack=74065 Win=65535 Len=0
348456 118.048225 77.197.128.12 -> 41.177.26.15 TCP 64 icmpd > http [ACK] Seq=308 Ack=78445 Win=65535 Len=0
348457 118.048229 77.197.128.12 -> 41.177.26.15 TCP 64 icmpd > http [ACK] Seq=308 Ack=82265 Win=65535 Len=0
348468 118.048378 77.197.128.12 -> 41.177.26.15 TCP 64 icmpd > http [ACK] Seq=308 Ack=89565 Win=65535 Len=0
349531 118.126443 77.197.128.12 -> 41.177.26.15 TCP 64 icmpd > http [ACK] Seq=308 Ack=91925 Win=65535 Len=0
349532 118.126448 77.197.128.12 -> 41.177.26.15 TCP 64 icmpd > http [ACK] Seq=308 Ack=96305 Win=65535 Len=0
349534 118.126558 77.197.128.12 -> 41.177.26.15 TCP 64 icmpd > http [ACK] Seq=308 Ack=101585 Win=60255 Len=0
349535 118.126583 77.197.128.12 -> 41.177.26.15 TCP 64 [TCP Window Update] icmpd > http [ACK] Seq=308 Ack=101585 Win=65535 Len=0
349538 118.126734 77.197.128.12 -> 41.177.26.15 TCP 64 icmpd > http [ACK] Seq=308 Ack=105965 Win=65535 Len=0
349545 118.127077 77.197.128.12 -> 41.177.26.15 TCP 64 icmpd > http [ACK] Seq=308 Ack=108325 Win=65535 Len=0
349546 118.127122 77.197.128.12 -> 41.177.26.15 TCP 64 icmpd > http [ACK] Seq=308 Ack=111245 Win=65535 Len=0
349547 118.127206 77.197.128.12 -> 41.177.26.15 TCP 64 icmpd > http [ACK] Seq=308 Ack=115065 Win=64627 Len=0
349548 118.127245 77.197.128.12 -> 41.177.26.15 TCP 64 [TCP Dup ACK 349547#1] icmpd > http [ACK] Seq=308 Ack=115065 Win=64627 Len=0
349549 118.127305 77.197.128.12 -> 41.177.26.15 TCP 64 icmpd > http [ACK] Seq=308 Ack=117985 Win=65535 Len=0
349550 118.127311 77.197.128.12 -> 41.177.26.15 TCP 64 icmpd > http [ACK] Seq=308 Ack=123265 Win=65527 Len=0
349551 118.127490 77.197.128.12 -> 41.177.26.15 TCP 64 [TCP Dup ACK 349550#1] icmpd > http [ACK] Seq=308 Ack=123265 Win=65527 Len=0
349552 118.127495 77.197.128.12 -> 41.177.26.15 TCP 64 icmpd > http [ACK] Seq=308 Ack=126185 Win=65535 Len=0
349553 118.127602 77.197.128.12 -> 41.177.26.15 TCP 64 icmpd > http [ACK] Seq=308 Ack=130565 Win=65535 Len=0
349669 118.205516 77.197.128.12 -> 41.177.26.15 TCP 64 icmpd > http [ACK] Seq=308 Ack=131465 Win=64635 Len=0
349670 118.205521 77.197.128.12 -> 41.177.26.15 TCP 64 icmpd > http [ACK] Seq=308 Ack=134385 Win=65535 Len=0
349671 118.205625 77.197.128.12 -> 41.177.26.15 TCP 64 icmpd > http [ACK] Seq=308 Ack=139665 Win=65535 Len=0
349678 118.210758 77.197.128.12 -> 41.177.26.15 TCP 64 icmpd > http [ACK] Seq=308 Ack=140433 Win=64767 Len=0
349689 118.214705 77.197.128.12 -> 41.177.26.15 TCP 64 icmpd > http [RST, ACK] Seq=308 Ack=140433 Win=0 Len=0
691840 218.356552 77.197.128.12 -> 41.177.26.91 TCP 66 45949 > http [SYN] Seq=0 Win=65535 Len=0 MSS=1460 SACK_PERM=1
691980 218.438214 77.197.128.12 -> 41.177.26.91 TCP 64 45949 > http [ACK] Seq=1 Ack=1 Win=65535 Len=0
692365 218.656015 77.197.128.12 -> 41.177.26.91 TCP 64 45949 > http [ACK] Seq=288 Ack=4381 Win=65535 Len=0
692571 218.739852 77.197.128.12 -> 41.177.26.91 TCP 64 45949 > http [ACK] Seq=288 Ack=8761 Win=65535 Len=0
692786 218.821636 77.197.128.12 -> 41.177.26.91 TCP 64 45949 > http [ACK] Seq=288 Ack=16061 Win=65535 Len=0
692971 218.903831 77.197.128.12 -> 41.177.26.91 TCP 64 45949 > http [RST, ACK] Seq=288 Ack=17100 Win=0 Len=0
