10290   3.548138 77.197.210.51 -> 244.3.210.197 TCP 66 22598 > http [SYN] Seq=0 Win=65535 Len=0 MSS=1460 SACK_PERM=1
10538   3.629645 77.197.210.51 -> 244.3.210.197 TCP 64 22598 > http [ACK] Seq=1 Ack=1 Win=65535 Len=0
14215   4.010931 77.197.210.51 -> 244.3.210.197 TCP 64 22598 > http [ACK] Seq=338 Ack=2921 Win=65535 Len=0
14485   4.092629 77.197.210.51 -> 244.3.210.197 TCP 64 22598 > http [ACK] Seq=338 Ack=5841 Win=65535 Len=0
15097   4.116463 77.197.210.51 -> 244.3.210.197 TCP 64 22598 > http [ACK] Seq=338 Ack=7301 Win=65535 Len=0
15239   4.175913 77.197.210.51 -> 244.3.210.197 TCP 64 22598 > http [ACK] Seq=338 Ack=11681 Win=64967 Len=0
15240   4.175917 77.197.210.51 -> 244.3.210.197 TCP 64 [TCP Dup ACK 15239#1] 22598 > http [ACK] Seq=338 Ack=11681 Win=64967 Len=0
15267   4.198987 77.197.210.51 -> 244.3.210.197 TCP 64 22598 > http [ACK] Seq=338 Ack=14569 Win=65535 Len=0
15745   4.248157 77.197.210.51 -> 244.3.210.197 TCP 64 22598 > http [RST, ACK] Seq=338 Ack=14569 Win=0 Len=0
