198944  68.388892 77.197.210.37 -> 41.177.26.91 TCP 66 51420 > http [SYN] Seq=0 Win=65535 Len=0 MSS=1460 SACK_PERM=1
199133  68.470537 77.197.210.37 -> 41.177.26.91 TCP 64 51420 > http [ACK] Seq=1 Ack=1 Win=65535 Len=0
199558  68.652338 77.197.210.37 -> 41.177.26.91 TCP 64 51420 > http [ACK] Seq=301 Ack=2921 Win=65535 Len=0
199742  68.734027 77.197.210.37 -> 41.177.26.91 TCP 64 51420 > http [ACK] Seq=301 Ack=5841 Win=65535 Len=0
199743  68.734032 77.197.210.37 -> 41.177.26.91 TCP 64 51420 > http [ACK] Seq=301 Ack=8761 Win=65535 Len=0
199857  68.815809 77.197.210.37 -> 41.177.26.91 TCP 64 51420 > http [ACK] Seq=301 Ack=11681 Win=65535 Len=0
199858  68.815833 77.197.210.37 -> 41.177.26.91 TCP 64 51420 > http [ACK] Seq=301 Ack=15286 Win=65535 Len=0
199867  68.818480 77.197.210.37 -> 41.177.26.91 TCP 64 51420 > http [RST, ACK] Seq=301 Ack=15286 Win=0 Len=0
225082  76.968315 77.197.210.37 -> 41.177.26.91 TCP 66 57202 > http [SYN] Seq=0 Win=65535 Len=0 MSS=1460 SACK_PERM=1
225421  77.049993 77.197.210.37 -> 41.177.26.91 TCP 64 57202 > http [ACK] Seq=1 Ack=1 Win=65535 Len=0
225776  77.279163 77.197.210.37 -> 41.177.26.91 TCP 64 57202 > http [ACK] Seq=310 Ack=4381 Win=65535 Len=0
226389  77.360853 77.197.210.37 -> 41.177.26.91 TCP 64 57202 > http [ACK] Seq=310 Ack=7301 Win=65535 Len=0
226390  77.360858 77.197.210.37 -> 41.177.26.91 TCP 64 57202 > http [ACK] Seq=310 Ack=10221 Win=65535 Len=0
226479  77.442579 77.197.210.37 -> 41.177.26.91 TCP 64 57202 > http [ACK] Seq=310 Ack=16061 Win=65535 Len=0
226895  77.538232 77.197.210.37 -> 41.177.26.91 TCP 64 57202 > http [RST, ACK] Seq=310 Ack=16788 Win=0 Len=0
691069 217.918663 77.197.210.37 -> 41.177.26.91 TCP 66 52940 > http [SYN] Seq=0 Win=65535 Len=0 MSS=1460 SACK_PERM=1
691240 218.002208 77.197.210.37 -> 41.177.26.91 TCP 64 52940 > http [ACK] Seq=1 Ack=1 Win=65535 Len=0
691508 218.144889 77.197.210.37 -> 41.177.26.91 TCP 64 52940 > http [ACK] Seq=311 Ack=2921 Win=65535 Len=0
691648 218.226752 77.197.210.37 -> 41.177.26.91 TCP 64 52940 > http [ACK] Seq=311 Ack=5841 Win=65535 Len=0
691649 218.226910 77.197.210.37 -> 41.177.26.91 TCP 64 52940 > http [ACK] Seq=311 Ack=8761 Win=65535 Len=0
691770 218.308926 77.197.210.37 -> 41.177.26.91 TCP 64 52940 > http [ACK] Seq=311 Ack=11681 Win=65535 Len=0
691771 218.309114 77.197.210.37 -> 41.177.26.91 TCP 64 52940 > http [ACK] Seq=311 Ack=14672 Win=65535 Len=0
691772 218.309937 77.197.210.37 -> 41.177.26.91 TCP 64 52940 > http [RST, ACK] Seq=311 Ack=14672 Win=0 Len=0
841263 276.007186 77.197.210.37 -> 41.177.26.15 TCP 66 18593 > http [SYN] Seq=0 Win=65535 Len=0 MSS=1460 SACK_PERM=1
841378 276.089313 77.197.210.37 -> 41.177.26.15 TCP 64 18593 > http [ACK] Seq=1 Ack=1 Win=65535 Len=0
841882 276.506642 77.197.210.37 -> 41.177.26.15 TCP 64 18593 > http [ACK] Seq=309 Ack=2921 Win=65535 Len=0
842034 276.588575 77.197.210.37 -> 41.177.26.15 TCP 64 18593 > http [ACK] Seq=309 Ack=5841 Win=65535 Len=0
842035 276.588665 77.197.210.37 -> 41.177.26.15 TCP 64 18593 > http [ACK] Seq=309 Ack=8465 Win=65535 Len=0
842102 276.670375 77.197.210.37 -> 41.177.26.15 TCP 64 18593 > http [ACK] Seq=309 Ack=11385 Win=65535 Len=0
842103 276.670379 77.197.210.37 -> 41.177.26.15 TCP 64 18593 > http [ACK] Seq=309 Ack=14305 Win=65535 Len=0
842104 276.670384 77.197.210.37 -> 41.177.26.15 TCP 64 18593 > http [ACK] Seq=309 Ack=16665 Win=65527 Len=0
842105 276.670388 77.197.210.37 -> 41.177.26.15 TCP 64 [TCP Dup ACK 842104#1] 18593 > http [ACK] Seq=309 Ack=16665 Win=65527 Len=0
842180 276.752263 77.197.210.37 -> 41.177.26.15 TCP 64 18593 > http [ACK] Seq=309 Ack=19585 Win=65535 Len=0
842181 276.752268 77.197.210.37 -> 41.177.26.15 TCP 64 18593 > http [ACK] Seq=309 Ack=22505 Win=65535 Len=0
842182 276.752280 77.197.210.37 -> 41.177.26.15 TCP 64 18593 > http [ACK] Seq=309 Ack=24865 Win=65527 Len=0
842183 276.752284 77.197.210.37 -> 41.177.26.15 TCP 64 [TCP Dup ACK 842182#1] 18593 > http [ACK] Seq=309 Ack=24865 Win=65527 Len=0
842184 276.752289 77.197.210.37 -> 41.177.26.15 TCP 64 18593 > http [ACK] Seq=309 Ack=27785 Win=65535 Len=0
842544 276.834030 77.197.210.37 -> 41.177.26.15 TCP 64 18593 > http [ACK] Seq=309 Ack=30705 Win=65535 Len=0
842545 276.834034 77.197.210.37 -> 41.177.26.15 TCP 64 18593 > http [ACK] Seq=309 Ack=33065 Win=65535 Len=0
842546 276.834039 77.197.210.37 -> 41.177.26.15 TCP 64 18593 > http [ACK] Seq=309 Ack=35985 Win=65535 Len=0
842547 276.834207 77.197.210.37 -> 41.177.26.15 TCP 64 18593 > http [ACK] Seq=309 Ack=37445 Win=65535 Len=0
842548 276.834211 77.197.210.37 -> 41.177.26.15 TCP 64 18593 > http [ACK] Seq=309 Ack=40365 Win=65535 Len=0
842549 276.834215 77.197.210.37 -> 41.177.26.15 TCP 64 18593 > http [ACK] Seq=309 Ack=42725 Win=65535 Len=0
842557 276.834408 77.197.210.37 -> 41.177.26.15 TCP 64 18593 > http [ACK] Seq=309 Ack=45645 Win=65535 Len=0
842700 276.915887 77.197.210.37 -> 41.177.26.15 TCP 64 18593 > http [ACK] Seq=309 Ack=47105 Win=65535 Len=0
842701 276.915891 77.197.210.37 -> 41.177.26.15 TCP 64 18593 > http [ACK] Seq=309 Ack=49465 Win=65535 Len=0
842702 276.916024 77.197.210.37 -> 41.177.26.15 TCP 64 18593 > http [ACK] Seq=309 Ack=52385 Win=65535 Len=0
842703 276.916050 77.197.210.37 -> 41.177.26.15 TCP 64 18593 > http [ACK] Seq=309 Ack=55305 Win=65535 Len=0
842704 276.916055 77.197.210.37 -> 41.177.26.15 TCP 64 18593 > http [ACK] Seq=309 Ack=57665 Win=63175 Len=0
842705 276.916097 77.197.210.37 -> 41.177.26.15 TCP 64 18593 > http [ACK] Seq=309 Ack=60585 Win=60255 Len=0
842706 276.916208 77.197.210.37 -> 41.177.26.15 TCP 64 18593 > http [ACK] Seq=309 Ack=63505 Win=57335 Len=0
842707 276.916213 77.197.210.37 -> 41.177.26.15 TCP 64 18593 > http [ACK] Seq=309 Ack=65865 Win=54975 Len=0
842712 276.916394 77.197.210.37 -> 41.177.26.15 TCP 64 18593 > http [ACK] Seq=309 Ack=68785 Win=52055 Len=0
842714 276.916420 77.197.210.37 -> 41.177.26.15 TCP 64 18593 > http [ACK] Seq=309 Ack=71705 Win=49135 Len=0
842720 276.916510 77.197.210.37 -> 41.177.26.15 TCP 64 18593 > http [ACK] Seq=309 Ack=74065 Win=46775 Len=0
842747 276.919420 77.197.210.37 -> 41.177.26.15 TCP 64 [TCP Window Update] 18593 > http [ACK] Seq=309 Ack=74065 Win=50247 Len=0
842748 276.919425 77.197.210.37 -> 41.177.26.15 TCP 64 [TCP Window Update] 18593 > http [ACK] Seq=309 Ack=74065 Win=65535 Len=0
842886 276.997902 77.197.210.37 -> 41.177.26.15 TCP 64 18593 > http [ACK] Seq=309 Ack=76985 Win=65535 Len=0
842887 276.998110 77.197.210.37 -> 41.177.26.15 TCP 64 18593 > http [ACK] Seq=309 Ack=79905 Win=65535 Len=0
842888 276.998345 77.197.210.37 -> 41.177.26.15 TCP 64 18593 > http [ACK] Seq=309 Ack=82265 Win=65527 Len=0
842889 276.998349 77.197.210.37 -> 41.177.26.15 TCP 64 [TCP Dup ACK 842888#1] 18593 > http [ACK] Seq=309 Ack=82265 Win=65527 Len=0
842890 276.998354 77.197.210.37 -> 41.177.26.15 TCP 64 18593 > http [ACK] Seq=309 Ack=85185 Win=65535 Len=0
842891 276.998358 77.197.210.37 -> 41.177.26.15 TCP 64 18593 > http [ACK] Seq=309 Ack=88105 Win=65535 Len=0
842896 276.998490 77.197.210.37 -> 41.177.26.15 TCP 64 18593 > http [ACK] Seq=309 Ack=90465 Win=65535 Len=0
842903 276.998627 77.197.210.37 -> 41.177.26.15 TCP 64 18593 > http [ACK] Seq=309 Ack=93385 Win=65535 Len=0
842904 276.998630 77.197.210.37 -> 41.177.26.15 TCP 64 18593 > http [ACK] Seq=309 Ack=96305 Win=65527 Len=0
842905 276.998634 77.197.210.37 -> 41.177.26.15 TCP 64 [TCP Dup ACK 842904#1] 18593 > http [ACK] Seq=309 Ack=96305 Win=65527 Len=0
842906 276.998639 77.197.210.37 -> 41.177.26.15 TCP 64 18593 > http [ACK] Seq=309 Ack=98665 Win=65535 Len=0
842913 276.998856 77.197.210.37 -> 41.177.26.15 TCP 64 18593 > http [ACK] Seq=309 Ack=101585 Win=65535 Len=0
842920 276.999116 77.197.210.37 -> 41.177.26.15 TCP 64 18593 > http [ACK] Seq=309 Ack=104505 Win=65527 Len=0
842921 276.999121 77.197.210.37 -> 41.177.26.15 TCP 64 [TCP Dup ACK 842920#1] 18593 > http [ACK] Seq=309 Ack=104505 Win=65527 Len=0
842922 276.999125 77.197.210.37 -> 41.177.26.15 TCP 64 18593 > http [ACK] Seq=309 Ack=106865 Win=65535 Len=0
842923 276.999129 77.197.210.37 -> 41.177.26.15 TCP 64 18593 > http [ACK] Seq=309 Ack=109785 Win=65535 Len=0
842924 276.999133 77.197.210.37 -> 41.177.26.15 TCP 64 18593 > http [ACK] Seq=309 Ack=112705 Win=65535 Len=0
842929 276.999417 77.197.210.37 -> 41.177.26.15 TCP 64 18593 > http [ACK] Seq=309 Ack=115065 Win=65535 Len=0
842930 276.999670 77.197.210.37 -> 41.177.26.15 TCP 64 18593 > http [ACK] Seq=309 Ack=116525 Win=65535 Len=0
843132 277.080039 77.197.210.37 -> 41.177.26.15 TCP 64 18593 > http [ACK] Seq=309 Ack=119445 Win=65535 Len=0
843133 277.080160 77.197.210.37 -> 41.177.26.15 TCP 64 18593 > http [ACK] Seq=309 Ack=123265 Win=65535 Len=0
843134 277.080309 77.197.210.37 -> 41.177.26.15 TCP 64 18593 > http [ACK] Seq=309 Ack=126185 Win=65527 Len=0
843135 277.080313 77.197.210.37 -> 41.177.26.15 TCP 64 [TCP Dup ACK 843134#1] 18593 > http [ACK] Seq=309 Ack=126185 Win=65527 Len=0
843136 277.080317 77.197.210.37 -> 41.177.26.15 TCP 64 18593 > http [ACK] Seq=309 Ack=129105 Win=65535 Len=0
843137 277.080321 77.197.210.37 -> 41.177.26.15 TCP 64 18593 > http [ACK] Seq=309 Ack=131465 Win=65535 Len=0
843138 277.080440 77.197.210.37 -> 41.177.26.15 TCP 64 18593 > http [ACK] Seq=309 Ack=134385 Win=65535 Len=0
843139 277.080589 77.197.210.37 -> 41.177.26.15 TCP 64 18593 > http [ACK] Seq=309 Ack=137305 Win=62615 Len=0
843140 277.080594 77.197.210.37 -> 41.177.26.15 TCP 64 18593 > http [ACK] Seq=309 Ack=139665 Win=60255 Len=0
843141 277.080690 77.197.210.37 -> 41.177.26.15 TCP 64 18593 > http [ACK] Seq=309 Ack=142585 Win=57335 Len=0
843142 277.080695 77.197.210.37 -> 41.177.26.15 TCP 64 18593 > http [ACK] Seq=309 Ack=145505 Win=54415 Len=0
843143 277.080879 77.197.210.37 -> 41.177.26.15 TCP 64 18593 > http [ACK] Seq=309 Ack=147865 Win=52055 Len=0
843144 277.081181 77.197.210.37 -> 41.177.26.15 TCP 64 18593 > http [ACK] Seq=309 Ack=151072 Win=48848 Len=0
843145 277.081290 77.197.210.37 -> 41.177.26.15 TCP 64 [TCP Window Update] 18593 > http [ACK] Seq=309 Ack=151072 Win=52320 Len=0
843146 277.081319 77.197.210.37 -> 41.177.26.15 TCP 64 [TCP Window Update] 18593 > http [ACK] Seq=309 Ack=151072 Win=65535 Len=0
843151 277.095911 77.197.210.37 -> 41.177.26.15 TCP 64 18593 > http [RST, ACK] Seq=309 Ack=151072 Win=0 Len=0
853323 282.038610 77.197.210.37 -> 41.177.26.15 TCP 66 21984 > http [SYN] Seq=0 Win=65535 Len=0 MSS=1460 SACK_PERM=1
853495 282.120646 77.197.210.37 -> 41.177.26.15 TCP 64 21984 > http [ACK] Seq=1 Ack=1 Win=65535 Len=0
854873 282.583589 77.197.210.37 -> 41.177.26.15 TCP 64 21984 > http [ACK] Seq=308 Ack=4381 Win=65535 Len=0
855166 282.665517 77.197.210.37 -> 41.177.26.15 TCP 64 21984 > http [ACK] Seq=308 Ack=8465 Win=65535 Len=0
855416 282.747661 77.197.210.37 -> 41.177.26.15 TCP 64 21984 > http [ACK] Seq=308 Ack=11385 Win=65535 Len=0
855417 282.747881 77.197.210.37 -> 41.177.26.15 TCP 64 21984 > http [ACK] Seq=308 Ack=12845 Win=65535 Len=0
855418 282.748038 77.197.210.37 -> 41.177.26.15 TCP 64 21984 > http [ACK] Seq=308 Ack=15765 Win=65535 Len=0
855664 282.829812 77.197.210.37 -> 41.177.26.15 TCP 64 21984 > http [ACK] Seq=308 Ack=18125 Win=65535 Len=0
855665 282.829816 77.197.210.37 -> 41.177.26.15 TCP 64 21984 > http [ACK] Seq=308 Ack=21045 Win=65535 Len=0
855666 282.829820 77.197.210.37 -> 41.177.26.15 TCP 64 21984 > http [ACK] Seq=308 Ack=23965 Win=65527 Len=0
855667 282.829835 77.197.210.37 -> 41.177.26.15 TCP 64 [TCP Dup ACK 855666#1] 21984 > http [ACK] Seq=308 Ack=23965 Win=65527 Len=0
855668 282.830038 77.197.210.37 -> 41.177.26.15 TCP 64 21984 > http [ACK] Seq=308 Ack=26325 Win=65535 Len=0
855910 282.911721 77.197.210.37 -> 41.177.26.15 TCP 64 21984 > http [ACK] Seq=308 Ack=29245 Win=65535 Len=0
855911 282.911726 77.197.210.37 -> 41.177.26.15 TCP 64 21984 > http [ACK] Seq=308 Ack=32165 Win=65535 Len=0
855912 282.911730 77.197.210.37 -> 41.177.26.15 TCP 64 21984 > http [ACK] Seq=308 Ack=34525 Win=65527 Len=0
855913 282.911734 77.197.210.37 -> 41.177.26.15 TCP 64 [TCP Dup ACK 855912#1] 21984 > http [ACK] Seq=308 Ack=34525 Win=65527 Len=0
855914 282.911865 77.197.210.37 -> 41.177.26.15 TCP 64 21984 > http [ACK] Seq=308 Ack=37445 Win=65535 Len=0
855917 282.912049 77.197.210.37 -> 41.177.26.15 TCP 64 21984 > http [ACK] Seq=308 Ack=40365 Win=65535 Len=0
855918 282.912053 77.197.210.37 -> 41.177.26.15 TCP 64 21984 > http [ACK] Seq=308 Ack=42725 Win=65535 Len=0
856240 282.994461 77.197.210.37 -> 41.177.26.15 TCP 64 21984 > http [ACK] Seq=308 Ack=45645 Win=65535 Len=0
856241 282.994467 77.197.210.37 -> 41.177.26.15 TCP 64 21984 > http [ACK] Seq=308 Ack=48565 Win=65535 Len=0
856242 282.994471 77.197.210.37 -> 41.177.26.15 TCP 64 21984 > http [ACK] Seq=308 Ack=49465 Win=64635 Len=0
856243 282.994611 77.197.210.37 -> 41.177.26.15 TCP 64 21984 > http [ACK] Seq=308 Ack=52385 Win=65535 Len=0
856244 282.994638 77.197.210.37 -> 41.177.26.15 TCP 64 21984 > http [ACK] Seq=308 Ack=55305 Win=65535 Len=0
856253 282.994845 77.197.210.37 -> 41.177.26.15 TCP 64 21984 > http [ACK] Seq=308 Ack=57665 Win=65535 Len=0
856254 282.994849 77.197.210.37 -> 41.177.26.15 TCP 64 21984 > http [ACK] Seq=308 Ack=60585 Win=62615 Len=0
856263 282.995045 77.197.210.37 -> 41.177.26.15 TCP 64 21984 > http [ACK] Seq=308 Ack=63505 Win=59695 Len=0
856264 282.995050 77.197.210.37 -> 41.177.26.15 TCP 64 21984 > http [ACK] Seq=308 Ack=65865 Win=57335 Len=0
856265 282.995285 77.197.210.37 -> 41.177.26.15 TCP 64 21984 > http [ACK] Seq=308 Ack=68785 Win=54415 Len=0
856274 282.997009 77.197.210.37 -> 41.177.26.15 TCP 64 [TCP Window Update] 21984 > http [ACK] Seq=308 Ack=68785 Win=57887 Len=0
856276 282.997299 77.197.210.37 -> 41.177.26.15 TCP 64 [TCP Window Update] 21984 > http [ACK] Seq=308 Ack=68785 Win=65535 Len=0
856553 283.077372 77.197.210.37 -> 41.177.26.15 TCP 64 21984 > http [ACK] Seq=308 Ack=71705 Win=65535 Len=0
856556 283.077496 77.197.210.37 -> 41.177.26.15 TCP 64 21984 > http [ACK] Seq=308 Ack=74065 Win=65535 Len=0
856557 283.077500 77.197.210.37 -> 41.177.26.15 TCP 64 21984 > http [ACK] Seq=308 Ack=76985 Win=65527 Len=0
856558 283.077504 77.197.210.37 -> 41.177.26.15 TCP 64 [TCP Dup ACK 856557#1] 21984 > http [ACK] Seq=308 Ack=76985 Win=65527 Len=0
856559 283.077508 77.197.210.37 -> 41.177.26.15 TCP 64 21984 > http [ACK] Seq=308 Ack=79905 Win=65535 Len=0
856562 283.077686 77.197.210.37 -> 41.177.26.15 TCP 64 21984 > http [ACK] Seq=308 Ack=82265 Win=65535 Len=0
856563 283.077690 77.197.210.37 -> 41.177.26.15 TCP 64 21984 > http [ACK] Seq=308 Ack=86645 Win=64075 Len=0
856601 283.098367 77.197.210.37 -> 41.177.26.15 TCP 64 21984 > http [ACK] Seq=308 Ack=88035 Win=65535 Len=0
856650 283.106701 77.197.210.37 -> 41.177.26.15 TCP 64 21984 > http [RST, ACK] Seq=308 Ack=88035 Win=0 Len=0
