877628 291.043444 77.139.161.186 -> 244.3.210.197 TCP 70 60640 > http [SYN] Seq=0 Win=8192 Len=0 MSS=1460 WS=4 SACK_PERM=1
877709 291.129404 77.139.161.186 -> 244.3.210.197 TCP 64 60640 > http [ACK] Seq=1 Ack=1 Win=17520 Len=0
878392 291.601326 77.139.161.186 -> 244.3.210.197 TCP 70 [TCP Dup ACK 878123#1] 60640 > http [ACK] Seq=689 Ack=1 Win=17520 Len=0 SLE=1461 SRE=2921
889449 294.631328 77.139.161.186 -> 244.3.210.197 TCP 64 60640 > http [ACK] Seq=689 Ack=2921 Win=17520 Len=0
890281 294.746369 77.139.161.186 -> 244.3.210.197 TCP 64 60640 > http [ACK] Seq=689 Ack=5841 Win=17520 Len=0
890413 294.761233 77.139.161.186 -> 244.3.210.197 TCP 70 60642 > http [SYN] Seq=0 Win=8192 Len=0 MSS=1460 WS=4 SACK_PERM=1
890460 294.765502 77.139.161.186 -> 244.3.210.197 TCP 70 60645 > http [SYN] Seq=0 Win=8192 Len=0 MSS=1460 WS=4 SACK_PERM=1
890461 294.765506 77.139.161.186 -> 244.3.210.197 TCP 70 60644 > http [SYN] Seq=0 Win=8192 Len=0 MSS=1460 WS=4 SACK_PERM=1
890462 294.765511 77.139.161.186 -> 244.3.210.197 TCP 70 60643 > http [SYN] Seq=0 Win=8192 Len=0 MSS=1460 WS=4 SACK_PERM=1
890467 294.765663 77.139.161.186 -> 244.3.210.197 TCP 70 60646 > http [SYN] Seq=0 Win=8192 Len=0 MSS=1460 WS=4 SACK_PERM=1
890537 294.779658 77.139.161.186 -> 244.3.210.197 TCP 70 60647 > http [SYN] Seq=0 Win=8192 Len=0 MSS=1460 WS=4 SACK_PERM=1
890907 294.866442 77.139.161.186 -> 244.3.210.197 TCP 64 60640 > http [ACK] Seq=689 Ack=8761 Win=17520 Len=0
890922 294.869819 77.139.161.186 -> 244.3.210.197 TCP 64 60642 > http [ACK] Seq=1 Ack=1 Win=17520 Len=0
890923 294.869824 77.139.161.186 -> 244.3.210.197 TCP 64 60642 > http [RST, ACK] Seq=1 Ack=1 Win=0 Len=0
890942 294.873281 77.139.161.186 -> 244.3.210.197 TCP 64 60645 > http [ACK] Seq=1 Ack=1 Win=17520 Len=0
890970 294.877900 77.139.161.186 -> 244.3.210.197 TCP 64 60643 > http [ACK] Seq=1 Ack=1 Win=17520 Len=0
890971 294.877957 77.139.161.186 -> 244.3.210.197 TCP 64 60644 > http [ACK] Seq=1 Ack=1 Win=17520 Len=0
891028 294.882699 77.139.161.186 -> 244.3.210.197 TCP 64 60646 > http [ACK] Seq=1 Ack=1 Win=17520 Len=0
891056 294.886017 77.139.161.186 -> 244.3.210.197 TCP 64 60647 > http [ACK] Seq=1 Ack=1 Win=17520 Len=0
891291 294.969081 77.139.161.186 -> 244.3.210.197 TCP 64 60645 > http [ACK] Seq=647 Ack=2921 Win=17520 Len=0
891331 294.973232 77.139.161.186 -> 244.3.210.197 TCP 64 60643 > http [ACK] Seq=637 Ack=2921 Win=17520 Len=0
891345 294.977628 77.139.161.186 -> 244.3.210.197 TCP 64 60644 > http [ACK] Seq=646 Ack=2921 Win=17520 Len=0
891352 294.977791 77.139.161.186 -> 244.3.210.197 TCP 64 60646 > http [ACK] Seq=643 Ack=2921 Win=17520 Len=0
891353 294.977795 77.139.161.186 -> 244.3.210.197 TCP 64 60647 > http [ACK] Seq=650 Ack=2669 Win=17520 Len=0
891565 295.071244 77.139.161.186 -> 244.3.210.197 TCP 70 [TCP Dup ACK 891291#1] 60645 > http [ACK] Seq=647 Ack=2921 Win=17520 Len=0 SLE=4381 SRE=5841
891566 295.071249 77.139.161.186 -> 244.3.210.197 TCP 70 [TCP Dup ACK 891291#2] 60645 > http [ACK] Seq=647 Ack=2921 Win=17520 Len=0 SLE=4381 SRE=7301
891583 295.075217 77.139.161.186 -> 244.3.210.197 TCP 64 60643 > http [ACK] Seq=637 Ack=5841 Win=17520 Len=0
891591 295.075434 77.139.161.186 -> 244.3.210.197 TCP 64 60647 > http [ACK] Seq=1295 Ack=5589 Win=17520 Len=0
891772 295.151352 77.139.161.186 -> 244.3.210.197 TCP 64 60640 > http [ACK] Seq=689 Ack=10221 Win=17520 Len=0
891795 295.159312 77.139.161.186 -> 244.3.210.197 TCP 64 60645 > http [ACK] Seq=647 Ack=7301 Win=17520 Len=0
891796 295.159317 77.139.161.186 -> 244.3.210.197 TCP 64 60643 > http [ACK] Seq=637 Ack=8761 Win=17520 Len=0
891825 295.166566 77.139.161.186 -> 244.3.210.197 TCP 64 60643 > http [ACK] Seq=637 Ack=11681 Win=17520 Len=0
891834 295.166780 77.139.161.186 -> 244.3.210.197 TCP 64 60647 > http [ACK] Seq=1295 Ack=8509 Win=17520 Len=0
891867 295.179528 77.139.161.186 -> 244.3.210.197 TCP 64 60647 > http [ACK] Seq=1295 Ack=11429 Win=17520 Len=0
891911 295.183188 77.139.161.186 -> 244.3.210.197 TCP 64 60644 > http [ACK] Seq=1303 Ack=6221 Win=17520 Len=0
891961 295.199275 77.139.161.186 -> 244.3.210.197 TCP 64 60644 > http [ACK] Seq=1303 Ack=8053 Win=17520 Len=0
891970 295.203910 77.139.161.186 -> 244.3.210.197 TCP 64 60646 > http [ACK] Seq=1290 Ack=6285 Win=17520 Len=0
892015 295.215392 77.139.161.186 -> 244.3.210.197 TCP 64 60646 > http [ACK] Seq=1290 Ack=9205 Win=17520 Len=0
892047 295.237538 77.139.161.186 -> 244.3.210.197 TCP 70 [TCP Dup ACK 891772#1] 60640 > http [ACK] Seq=689 Ack=10221 Win=17520 Len=0 SLE=11681 SRE=13141
892048 295.237542 77.139.161.186 -> 244.3.210.197 TCP 70 [TCP Dup ACK 891772#2] 60640 > http [ACK] Seq=689 Ack=10221 Win=17520 Len=0 SLE=11681 SRE=14601
892062 295.245130 77.139.161.186 -> 244.3.210.197 TCP 64 60645 > http [ACK] Seq=647 Ack=10221 Win=17520 Len=0
892070 295.249488 77.139.161.186 -> 244.3.210.197 TCP 64 60643 > http [ACK] Seq=637 Ack=14601 Win=17520 Len=0
892108 295.253196 77.139.161.186 -> 244.3.210.197 TCP 64 60643 > http [ACK] Seq=637 Ack=17521 Win=17520 Len=0
892127 295.258333 77.139.161.186 -> 244.3.210.197 TCP 64 60643 > http [ACK] Seq=637 Ack=20441 Win=17520 Len=0
892139 295.258605 77.139.161.186 -> 244.3.210.197 TCP 64 60647 > http [ACK] Seq=1295 Ack=14349 Win=17520 Len=0
892164 295.265547 77.139.161.186 -> 244.3.210.197 TCP 64 60647 > http [ACK] Seq=1295 Ack=17269 Win=17520 Len=0
892177 295.269440 77.139.161.186 -> 244.3.210.197 TCP 64 60647 > http [ACK] Seq=1295 Ack=20189 Win=17520 Len=0
892215 295.290029 77.139.161.186 -> 244.3.210.197 TCP 64 60646 > http [ACK] Seq=1290 Ack=12125 Win=17520 Len=0
892222 295.293115 77.139.161.186 -> 244.3.210.197 TCP 64 60644 > http [ACK] Seq=1948 Ack=10973 Win=17520 Len=0
892240 295.297148 77.139.161.186 -> 244.3.210.197 TCP 64 60644 > http [ACK] Seq=1948 Ack=13893 Win=17520 Len=0
892264 295.313166 77.139.161.186 -> 244.3.210.197 TCP 64 60644 > http [ACK] Seq=1948 Ack=16813 Win=17520 Len=0
892290 295.321303 77.139.161.186 -> 244.3.210.197 TCP 64 60646 > http [ACK] Seq=1290 Ack=14439 Win=17520 Len=0
892389 295.343445 77.139.161.186 -> 244.3.210.197 TCP 70 [TCP Dup ACK 891772#3] 60640 > http [ACK] Seq=689 Ack=10221 Win=17520 Len=0 SLE=11681 SRE=15420
892396 295.347375 77.139.161.186 -> 244.3.210.197 TCP 64 60640 > http [ACK] Seq=689 Ack=15420 Win=17520 Len=0
892573 295.413245 77.139.161.186 -> 244.3.210.197 TCP 70 60643 > http [ACK] Seq=637 Ack=21901 Win=17520 Len=0 SLE=24821 SRE=26281
892607 295.430083 77.139.161.186 -> 244.3.210.197 TCP 70 [TCP Dup ACK 892573#1] 60643 > http [ACK] Seq=637 Ack=21901 Win=17520 Len=0 SLE=24821 SRE=27741
892638 295.443187 77.139.161.186 -> 244.3.210.197 TCP 70 [TCP Dup ACK 892573#2] 60643 > http [ACK] Seq=637 Ack=21901 Win=17520 Len=0 SLE=24821 SRE=29201
892678 295.459262 77.139.161.186 -> 244.3.210.197 TCP 70 [TCP Dup ACK 892573#3] 60643 > http [ACK] Seq=637 Ack=21901 Win=17520 Len=0 SLE=24821 SRE=30661
892759 295.473333 77.139.161.186 -> 244.3.210.197 TCP 70 [TCP Dup ACK 892573#4] 60643 > http [ACK] Seq=637 Ack=21901 Win=17520 Len=0 SLE=24821 SRE=32121
892771 295.491215 77.139.161.186 -> 244.3.210.197 TCP 70 [TCP Dup ACK 892573#5] 60643 > http [ACK] Seq=637 Ack=21901 Win=17520 Len=0 SLE=24821 SRE=33581
892798 295.519354 77.139.161.186 -> 244.3.210.197 TCP 64 60647 > http [ACK] Seq=1295 Ack=23109 Win=17520 Len=0
892878 295.535341 77.139.161.186 -> 244.3.210.197 TCP 64 60647 > http [ACK] Seq=1295 Ack=26029 Win=17520 Len=0
892970 295.589762 77.139.161.186 -> 244.3.210.197 TCP 64 60647 > http [ACK] Seq=1295 Ack=28949 Win=17520 Len=0
892971 295.589767 77.139.161.186 -> 244.3.210.197 TCP 64 60647 > http [ACK] Seq=1295 Ack=31869 Win=17520 Len=0
893126 295.611323 77.139.161.186 -> 244.3.210.197 TCP 64 60646 > http [ACK] Seq=1931 Ack=17359 Win=17520 Len=0
893132 295.615324 77.139.161.186 -> 244.3.210.197 TCP 64 60646 > http [ACK] Seq=1931 Ack=20279 Win=17520 Len=0
893189 295.631526 77.139.161.186 -> 244.3.210.197 TCP 64 60640 > http [ACK] Seq=1331 Ack=18340 Win=17520 Len=0
893190 295.631532 77.139.161.186 -> 244.3.210.197 TCP 64 60646 > http [ACK] Seq=1931 Ack=23199 Win=17520 Len=0
893233 295.640021 77.139.161.186 -> 244.3.210.197 TCP 64 60645 > http [ACK] Seq=1293 Ack=13301 Win=17520 Len=0
893234 295.640027 77.139.161.186 -> 244.3.210.197 TCP 70 [TCP Dup ACK 892573#6] 60643 > http [ACK] Seq=637 Ack=21901 Win=17520 Len=0 SLE=24821 SRE=34242
893235 295.640030 77.139.161.186 -> 244.3.210.197 TCP 64 60643 > http [ACK] Seq=637 Ack=34242 Win=17520 Len=0
893242 295.640173 77.139.161.186 -> 244.3.210.197 TCP 64 60647 > http [ACK] Seq=1295 Ack=34789 Win=17520 Len=0
893243 295.640177 77.139.161.186 -> 244.3.210.197 TCP 64 60647 > http [ACK] Seq=1295 Ack=37709 Win=17520 Len=0
893281 295.646223 77.139.161.186 -> 244.3.210.197 TCP 64 60647 > http [ACK] Seq=1295 Ack=40629 Win=17520 Len=0
893372 295.675292 77.139.161.186 -> 244.3.210.197 TCP 64 60647 > http [ACK] Seq=1295 Ack=43549 Win=17520 Len=0
893398 295.679640 77.139.161.186 -> 244.3.210.197 TCP 64 60647 > http [ACK] Seq=1295 Ack=46469 Win=17520 Len=0
893399 295.679645 77.139.161.186 -> 244.3.210.197 TCP 64 60647 > http [ACK] Seq=1295 Ack=49389 Win=17520 Len=0
893430 295.697234 77.139.161.186 -> 244.3.210.197 TCP 64 60644 > http [ACK] Seq=2588 Ack=20725 Win=17520 Len=0
893431 295.697238 77.139.161.186 -> 244.3.210.197 TCP 64 60644 > http [ACK] Seq=2588 Ack=23645 Win=17520 Len=0
893449 295.701272 77.139.161.186 -> 244.3.210.197 TCP 64 60644 > http [ACK] Seq=2588 Ack=28583 Win=17520 Len=0
893462 295.705951 77.139.161.186 -> 244.3.210.197 TCP 64 [TCP Dup ACK 893449#1] 60644 > http [ACK] Seq=2588 Ack=28583 Win=17520 Len=0
893566 295.737360 77.139.161.186 -> 244.3.210.197 TCP 64 60646 > http [ACK] Seq=2574 Ack=26544 Win=17520 Len=0
893615 295.741319 77.139.161.186 -> 244.3.210.197 TCP 64 60646 > http [ACK] Seq=2574 Ack=29464 Win=17520 Len=0
893630 295.746086 77.139.161.186 -> 244.3.210.197 TCP 64 60646 > http [ACK] Seq=2574 Ack=32384 Win=17520 Len=0
893665 295.749478 77.139.161.186 -> 244.3.210.197 TCP 64 60646 > http [ACK] Seq=2574 Ack=35304 Win=17520 Len=0
893666 295.749483 77.139.161.186 -> 244.3.210.197 TCP 64 60646 > http [ACK] Seq=2574 Ack=38224 Win=17520 Len=0
893667 295.749487 77.139.161.186 -> 244.3.210.197 TCP 64 60647 > http [ACK] Seq=1295 Ack=55229 Win=17520 Len=0
893696 295.753950 77.139.161.186 -> 244.3.210.197 TCP 64 60647 > http [ACK] Seq=1295 Ack=58149 Win=17520 Len=0
893712 295.758023 77.139.161.186 -> 244.3.210.197 TCP 64 60643 > http [ACK] Seq=1279 Ack=40082 Win=17520 Len=0
893724 295.766195 77.139.161.186 -> 244.3.210.197 TCP 64 [TCP Dup ACK 893712#1] 60643 > http [ACK] Seq=1279 Ack=40082 Win=17520 Len=0
893737 295.769315 77.139.161.186 -> 244.3.210.197 TCP 64 60647 > http [ACK] Seq=1295 Ack=61069 Win=102200 Len=0
893754 295.773427 77.139.161.186 -> 244.3.210.197 TCP 64 60647 > http [ACK] Seq=1295 Ack=63989 Win=102200 Len=0
893766 295.778003 77.139.161.186 -> 244.3.210.197 TCP 64 60647 > http [ACK] Seq=1295 Ack=66909 Win=102200 Len=0
893787 295.781294 77.139.161.186 -> 244.3.210.197 TCP 64 [TCP Dup ACK 893766#1] 60647 > http [ACK] Seq=1295 Ack=66909 Win=102200 Len=0
893840 295.793357 77.139.161.186 -> 244.3.210.197 TCP 64 60644 > http [ACK] Seq=3238 Ack=31503 Win=17520 Len=0
893841 295.793362 77.139.161.186 -> 244.3.210.197 TCP 64 60644 > http [ACK] Seq=3238 Ack=34423 Win=17520 Len=0
893852 295.807338 77.139.161.186 -> 244.3.210.197 TCP 64 60640 > http [ACK] Seq=1977 Ack=21897 Win=17520 Len=0
893966 295.826269 77.139.161.186 -> 244.3.210.197 TCP 64 60646 > http [ACK] Seq=2574 Ack=41144 Win=17520 Len=0
893974 295.829403 77.139.161.186 -> 244.3.210.197 TCP 64 60646 > http [ACK] Seq=2574 Ack=44064 Win=17520 Len=0
893975 295.829408 77.139.161.186 -> 244.3.210.197 TCP 64 60646 > http [ACK] Seq=2574 Ack=49904 Win=17520 Len=0
893991 295.833290 77.139.161.186 -> 244.3.210.197 TCP 64 60646 > http [ACK] Seq=2574 Ack=55744 Win=17520 Len=0
893997 295.837315 77.139.161.186 -> 244.3.210.197 TCP 64 [TCP Dup ACK 893991#1] 60646 > http [ACK] Seq=2574 Ack=55744 Win=17520 Len=0
894036 295.856080 77.139.161.186 -> 244.3.210.197 TCP 64 60647 > http [ACK] Seq=1295 Ack=69829 Win=100740 Len=0
894063 295.871899 77.139.161.186 -> 244.3.210.197 TCP 64 60647 > http [ACK] Seq=1295 Ack=72749 Win=100740 Len=0
894602 296.031310 77.139.161.186 -> 244.3.210.197 TCP 64 60643 > http [ACK] Seq=1279 Ack=41542 Win=17520 Len=0
894608 296.035856 77.139.161.186 -> 244.3.210.197 TCP 64 60644 > http [ACK] Seq=3238 Ack=34445 Win=17496 Len=0
894614 296.036043 77.139.161.186 -> 244.3.210.197 TCP 64 60640 > http [ACK] Seq=1977 Ack=22433 Win=16984 Len=0
895503 296.231576 77.139.161.186 -> 244.3.210.197 TCP 70 60647 > http [ACK] Seq=1295 Ack=74209 Win=99280 Len=0 SLE=77129 SRE=78589
895504 296.231581 77.139.161.186 -> 244.3.210.197 TCP 70 [TCP Dup ACK 895503#1] 60647 > http [ACK] Seq=1295 Ack=74209 Win=99280 Len=0 SLE=77129 SRE=80049
895505 296.231585 77.139.161.186 -> 244.3.210.197 TCP 70 [TCP Dup ACK 895503#2] 60647 > http [ACK] Seq=1295 Ack=74209 Win=99280 Len=0 SLE=77129 SRE=81509
895506 296.231589 77.139.161.186 -> 244.3.210.197 TCP 70 [TCP Dup ACK 895503#3] 60647 > http [ACK] Seq=1295 Ack=74209 Win=99280 Len=0 SLE=77129 SRE=82969
895542 296.235657 77.139.161.186 -> 244.3.210.197 TCP 70 [TCP Dup ACK 895503#4] 60647 > http [ACK] Seq=1295 Ack=74209 Win=99280 Len=0 SLE=77129 SRE=84429
895543 296.235662 77.139.161.186 -> 244.3.210.197 TCP 70 [TCP Dup ACK 895503#5] 60647 > http [ACK] Seq=1295 Ack=74209 Win=99280 Len=0 SLE=77129 SRE=85889
895544 296.235666 77.139.161.186 -> 244.3.210.197 TCP 70 [TCP Dup ACK 895503#6] 60647 > http [ACK] Seq=1295 Ack=74209 Win=99280 Len=0 SLE=77129 SRE=87349
895545 296.235670 77.139.161.186 -> 244.3.210.197 TCP 64 60646 > http [ACK] Seq=2574 Ack=58664 Win=17520 Len=0
895546 296.235674 77.139.161.186 -> 244.3.210.197 TCP 64 60646 > http [ACK] Seq=2574 Ack=61584 Win=17520 Len=0
895547 296.235678 77.139.161.186 -> 244.3.210.197 TCP 70 [TCP Dup ACK 895503#7] 60647 > http [ACK] Seq=1295 Ack=74209 Win=99280 Len=0 SLE=77129 SRE=88809
895593 296.239605 77.139.161.186 -> 244.3.210.197 TCP 70 [TCP Dup ACK 895503#8] 60647 > http [ACK] Seq=1295 Ack=74209 Win=99280 Len=0 SLE=77129 SRE=90269
895594 296.239610 77.139.161.186 -> 244.3.210.197 TCP 70 [TCP Dup ACK 895503#9] 60647 > http [ACK] Seq=1295 Ack=74209 Win=99280 Len=0 SLE=77129 SRE=91729
895595 296.239614 77.139.161.186 -> 244.3.210.197 TCP 70 [TCP Dup ACK 895503#10] 60647 > http [ACK] Seq=1295 Ack=74209 Win=99280 Len=0 SLE=77129 SRE=93189
895596 296.239618 77.139.161.186 -> 244.3.210.197 TCP 70 [TCP Dup ACK 895503#11] 60647 > http [ACK] Seq=1295 Ack=74209 Win=99280 Len=0 SLE=77129 SRE=94649
895597 296.239622 77.139.161.186 -> 244.3.210.197 TCP 70 [TCP Dup ACK 895503#12] 60647 > http [ACK] Seq=1295 Ack=74209 Win=99280 Len=0 SLE=77129 SRE=96109
895638 296.243952 77.139.161.186 -> 244.3.210.197 TCP 64 60646 > http [ACK] Seq=2574 Ack=61766 Win=17336 Len=0
896231 296.481338 77.139.161.186 -> 244.3.210.197 TCP 70 [TCP Dup ACK 895503#13] 60647 > http [ACK] Seq=1295 Ack=74209 Win=99280 Len=0 SLE=77129 SRE=97569
896299 296.509321 77.139.161.186 -> 244.3.210.197 TCP 70 [TCP Dup ACK 895503#14] 60647 > http [ACK] Seq=1295 Ack=74209 Win=99280 Len=0 SLE=77129 SRE=99029
896737 296.672348 77.139.161.186 -> 244.3.210.197 TCP 78 60647 > http [ACK] Seq=1295 Ack=75669 Win=97820 Len=0 SLE=106329 SRE=107789 SLE=77129 SRE=99029
896738 296.672353 77.139.161.186 -> 244.3.210.197 TCP 78 [TCP Dup ACK 896737#1] 60647 > http [ACK] Seq=1295 Ack=75669 Win=97820 Len=0 SLE=106329 SRE=109249 SLE=77129 SRE=99029
900665 297.289136 77.139.161.186 -> 244.3.210.197 TCP 64 60645 > http [ACK] Seq=1932 Ack=16190 Win=17520 Len=0
901070 297.373190 77.139.161.186 -> 244.3.210.197 TCP 64 60645 > http [ACK] Seq=1932 Ack=19110 Win=17520 Len=0
901482 297.459194 77.139.161.186 -> 244.3.210.197 TCP 64 60645 > http [ACK] Seq=1932 Ack=22030 Win=17520 Len=0
901596 297.491416 77.139.161.186 -> 244.3.210.197 TCP 64 60643 > http [ACK] Seq=1279 Ack=43002 Win=17520 Len=0
901788 297.545291 77.139.161.186 -> 244.3.210.197 TCP 64 60645 > http [ACK] Seq=1932 Ack=24950 Win=17520 Len=0
901861 297.579204 77.139.161.186 -> 244.3.210.197 TCP 64 60643 > http [ACK] Seq=1279 Ack=45922 Win=17520 Len=0
902325 297.687831 77.139.161.186 -> 244.3.210.197 TCP 64 60643 > http [ACK] Seq=1279 Ack=48842 Win=40880 Len=0
902615 297.759628 77.139.161.186 -> 244.3.210.197 TCP 64 60645 > http [ACK] Seq=1932 Ack=26062 Win=16408 Len=0
902624 297.763331 77.139.161.186 -> 244.3.210.197 TCP 70 60647 > http [ACK] Seq=1295 Ack=99029 Win=74460 Len=0 SLE=106329 SRE=109249
902648 297.773157 77.139.161.186 -> 244.3.210.197 TCP 64 60643 > http [ACK] Seq=1279 Ack=51762 Win=40880 Len=0
902963 297.849333 77.139.161.186 -> 244.3.210.197 TCP 70 60647 > http [ACK] Seq=1295 Ack=101949 Win=71540 Len=0 SLE=106329 SRE=109249
903006 297.857161 77.139.161.186 -> 244.3.210.197 TCP 64 60643 > http [ACK] Seq=1279 Ack=54682 Win=40880 Len=0
903234 297.937462 77.139.161.186 -> 244.3.210.197 TCP 70 60647 > http [ACK] Seq=1295 Ack=104869 Win=68620 Len=0 SLE=106329 SRE=109249
903235 297.937467 77.139.161.186 -> 244.3.210.197 TCP 64 60647 > http [ACK] Seq=1295 Ack=109249 Win=64240 Len=0
903464 297.952846 77.139.161.186 -> 244.3.210.197 TCP 64 60643 > http [ACK] Seq=1279 Ack=57602 Win=40880 Len=0
903703 298.023328 77.139.161.186 -> 244.3.210.197 TCP 70 [TCP Dup ACK 903235#1] 60647 > http [ACK] Seq=1295 Ack=109249 Win=64240 Len=0 SLE=106329 SRE=107789
903743 298.053361 77.139.161.186 -> 244.3.210.197 TCP 64 60647 > http [ACK] Seq=1295 Ack=112169 Win=61320 Len=0
903767 298.073505 77.139.161.186 -> 244.3.210.197 TCP 64 60643 > http [ACK] Seq=1279 Ack=60522 Win=40880 Len=0
903768 298.073510 77.139.161.186 -> 244.3.210.197 TCP 64 60643 > http [ACK] Seq=1279 Ack=63442 Win=40880 Len=0
903769 298.073606 77.139.161.186 -> 244.3.210.197 TCP 64 60647 > http [ACK] Seq=1295 Ack=115089 Win=58400 Len=0
904018 298.137320 77.139.161.186 -> 244.3.210.197 TCP 64 60647 > http [ACK] Seq=1295 Ack=118009 Win=55480 Len=0
904107 298.159209 77.139.161.186 -> 244.3.210.197 TCP 64 60643 > http [ACK] Seq=1279 Ack=66362 Win=43800 Len=0
904184 298.163345 77.139.161.186 -> 244.3.210.197 TCP 64 60643 > http [ACK] Seq=1279 Ack=69282 Win=43800 Len=0
904191 298.163505 77.139.161.186 -> 244.3.210.197 TCP 64 60647 > http [ACK] Seq=1295 Ack=120929 Win=52560 Len=0
904524 298.249315 77.139.161.186 -> 244.3.210.197 TCP 64 60647 > http [ACK] Seq=1295 Ack=123849 Win=51100 Len=0
904654 298.281398 77.139.161.186 -> 244.3.210.197 TCP 64 60643 > http [ACK] Seq=1279 Ack=72202 Win=48180 Len=0
904705 298.311135 77.139.161.186 -> 244.3.210.197 TCP 64 60643 > http [ACK] Seq=1279 Ack=75122 Win=45260 Len=0
904750 298.341321 77.139.161.186 -> 244.3.210.197 TCP 70 [TCP Dup ACK 904524#1] 60647 > http [ACK] Seq=1295 Ack=123849 Win=51100 Len=0 SLE=125309 SRE=126769
904765 298.357806 77.139.161.186 -> 244.3.210.197 TCP 70 [TCP Dup ACK 904524#2] 60647 > http [ACK] Seq=1295 Ack=123849 Win=51100 Len=0 SLE=125309 SRE=128229
904766 298.357811 77.139.161.186 -> 244.3.210.197 TCP 70 [TCP Dup ACK 904524#3] 60647 > http [ACK] Seq=1295 Ack=123849 Win=51100 Len=0 SLE=125309 SRE=129689
904780 298.361338 77.139.161.186 -> 244.3.210.197 TCP 70 [TCP Dup ACK 904524#4] 60647 > http [ACK] Seq=1295 Ack=123849 Win=51100 Len=0 SLE=125309 SRE=131149
904802 298.367866 77.139.161.186 -> 244.3.210.197 TCP 64 60643 > http [ACK] Seq=1279 Ack=78042 Win=42340 Len=0
904902 298.395377 77.139.161.186 -> 244.3.210.197 TCP 64 60643 > http [ACK] Seq=1279 Ack=80962 Win=39420 Len=0
905102 298.423342 77.139.161.186 -> 244.3.210.197 TCP 70 [TCP Dup ACK 904524#5] 60647 > http [ACK] Seq=1295 Ack=123849 Win=51100 Len=0 SLE=125309 SRE=132609
905197 298.445481 77.139.161.186 -> 244.3.210.197 TCP 64 60647 > http [ACK] Seq=1295 Ack=132609 Win=46720 Len=0
905198 298.445486 77.139.161.186 -> 244.3.210.197 TCP 64 60647 > http [ACK] Seq=1295 Ack=135529 Win=46720 Len=0
905304 298.457264 77.139.161.186 -> 244.3.210.197 TCP 64 60643 > http [ACK] Seq=1279 Ack=83882 Win=45260 Len=0
905419 298.479161 77.139.161.186 -> 244.3.210.197 TCP 64 60643 > http [ACK] Seq=1279 Ack=86802 Win=45260 Len=0
905584 298.539497 77.139.161.186 -> 244.3.210.197 TCP 64 60647 > http [ACK] Seq=1295 Ack=136993 Win=45256 Len=0
905595 298.543211 77.139.161.186 -> 244.3.210.197 TCP 64 60643 > http [ACK] Seq=1279 Ack=89722 Win=42340 Len=0
905696 298.566703 77.139.161.186 -> 244.3.210.197 TCP 64 60643 > http [ACK] Seq=1279 Ack=92642 Win=39420 Len=0
905697 298.566708 77.139.161.186 -> 244.3.210.197 TCP 64 60643 > http [ACK] Seq=1279 Ack=95562 Win=36500 Len=0
905956 298.634112 77.139.161.186 -> 244.3.210.197 TCP 64 60643 > http [ACK] Seq=1279 Ack=98482 Win=33580 Len=0
906149 298.713162 77.139.161.186 -> 244.3.210.197 TCP 64 60644 > http [ACK] Seq=3881 Ack=37365 Win=17520 Len=0
906174 298.723188 77.139.161.186 -> 244.3.210.197 TCP 64 60644 > http [ACK] Seq=3881 Ack=39348 Win=17520 Len=0
906185 298.727792 77.139.161.186 -> 244.3.210.197 TCP 64 60640 > http [ACK] Seq=2621 Ack=25353 Win=17520 Len=0
906285 298.770117 77.139.161.186 -> 244.3.210.197 TCP 70 [TCP Dup ACK 905962#1] 60646 > http [ACK] Seq=3218 Ack=61766 Win=17336 Len=0 SLE=63226 SRE=64686
906302 298.775404 77.139.161.186 -> 244.3.210.197 TCP 70 [TCP Dup ACK 905962#2] 60646 > http [ACK] Seq=3218 Ack=61766 Win=17336 Len=0 SLE=63226 SRE=66146
906320 298.779658 77.139.161.186 -> 244.3.210.197 TCP 70 [TCP Dup ACK 905962#3] 60646 > http [ACK] Seq=3218 Ack=61766 Win=17336 Len=0 SLE=63226 SRE=67606
906321 298.779663 77.139.161.186 -> 244.3.210.197 TCP 70 [TCP Dup ACK 905962#4] 60646 > http [ACK] Seq=3218 Ack=61766 Win=17336 Len=0 SLE=63226 SRE=69066
906322 298.779668 77.139.161.186 -> 244.3.210.197 TCP 70 [TCP Dup ACK 905962#5] 60646 > http [ACK] Seq=3218 Ack=61766 Win=17336 Len=0 SLE=63226 SRE=70526
906323 298.779672 77.139.161.186 -> 244.3.210.197 TCP 70 [TCP Dup ACK 905962#6] 60646 > http [ACK] Seq=3218 Ack=61766 Win=17336 Len=0 SLE=63226 SRE=71986
906324 298.779676 77.139.161.186 -> 244.3.210.197 TCP 70 [TCP Dup ACK 905962#7] 60646 > http [ACK] Seq=3218 Ack=61766 Win=17336 Len=0 SLE=63226 SRE=73446
906355 298.783470 77.139.161.186 -> 244.3.210.197 TCP 64 60645 > http [ACK] Seq=2574 Ack=28982 Win=17520 Len=0
906358 298.783585 77.139.161.186 -> 244.3.210.197 TCP 70 [TCP Dup ACK 905962#8] 60646 > http [ACK] Seq=3218 Ack=61766 Win=17336 Len=0 SLE=63226 SRE=74906
906363 298.783638 77.139.161.186 -> 244.3.210.197 TCP 70 [TCP Dup ACK 905962#9] 60646 > http [ACK] Seq=3218 Ack=61766 Win=17336 Len=0 SLE=63226 SRE=76366
906365 298.783647 77.139.161.186 -> 244.3.210.197 TCP 70 [TCP Dup ACK 905962#10] 60646 > http [ACK] Seq=3218 Ack=61766 Win=17336 Len=0 SLE=63226 SRE=77826
906448 298.813275 77.139.161.186 -> 244.3.210.197 TCP 64 60640 > http [ACK] Seq=2621 Ack=28273 Win=17520 Len=0
906547 298.831277 77.139.161.186 -> 244.3.210.197 TCP 64 60643 > http [ACK] Seq=1279 Ack=98831 Win=33228 Len=0
906620 298.859862 77.139.161.186 -> 244.3.210.197 TCP 64 60646 > http [ACK] Seq=3218 Ack=77826 Win=224840 Len=0
906704 298.877239 77.139.161.186 -> 244.3.210.197 TCP 64 60645 > http [ACK] Seq=2574 Ack=31902 Win=17520 Len=0
906836 298.897316 77.139.161.186 -> 244.3.210.197 TCP 64 60640 > http [ACK] Seq=2621 Ack=31193 Win=17520 Len=0
906865 298.901406 77.139.161.186 -> 244.3.210.197 TCP 64 60640 > http [ACK] Seq=2621 Ack=34113 Win=17520 Len=0
907065 298.961345 77.139.161.186 -> 244.3.210.197 TCP 64 60646 > http [ACK] Seq=3218 Ack=80746 Win=221920 Len=0
907078 298.965421 77.139.161.186 -> 244.3.210.197 TCP 64 60645 > http [ACK] Seq=2574 Ack=34822 Win=17520 Len=0
907079 298.965426 77.139.161.186 -> 244.3.210.197 TCP 64 60645 > http [ACK] Seq=2574 Ack=36730 Win=17520 Len=0
907088 298.965582 77.139.161.186 -> 244.3.210.197 TCP 64 60646 > http [ACK] Seq=3218 Ack=83666 Win=219000 Len=0
907177 298.983311 77.139.161.186 -> 244.3.210.197 TCP 64 60640 > http [ACK] Seq=2621 Ack=37033 Win=17520 Len=0
907217 298.987546 77.139.161.186 -> 244.3.210.197 TCP 64 60640 > http [ACK] Seq=2621 Ack=39953 Win=17520 Len=0
907339 299.047604 77.139.161.186 -> 244.3.210.197 TCP 64 60646 > http [ACK] Seq=3218 Ack=86586 Win=216080 Len=0
907379 299.063485 77.139.161.186 -> 244.3.210.197 TCP 70 60646 > http [ACK] Seq=3218 Ack=88046 Win=214620 Len=0 SLE=89506 SRE=90966
907380 299.063489 77.139.161.186 -> 244.3.210.197 TCP 70 [TCP Dup ACK 907379#1] 60646 > http [ACK] Seq=3218 Ack=88046 Win=214620 Len=0 SLE=89506 SRE=91012
907392 299.067603 77.139.161.186 -> 244.3.210.197 TCP 64 60640 > http [ACK] Seq=2621 Ack=42873 Win=17520 Len=0
907413 299.071350 77.139.161.186 -> 244.3.210.197 TCP 64 60640 > http [ACK] Seq=2621 Ack=45793 Win=17520 Len=0
907535 299.156228 77.139.161.186 -> 244.3.210.197 TCP 64 60640 > http [ACK] Seq=2621 Ack=48713 Win=17520 Len=0
907536 299.156232 77.139.161.186 -> 244.3.210.197 TCP 64 60640 > http [ACK] Seq=2621 Ack=51633 Win=17520 Len=0
907547 299.159327 77.139.161.186 -> 244.3.210.197 TCP 64 60640 > http [ACK] Seq=2621 Ack=53344 Win=17520 Len=0
909333 300.283409 77.139.161.186 -> 244.3.210.197 TCP 64 60646 > http [ACK] Seq=3218 Ack=91012 Win=211652 Len=0
909890 300.577159 77.139.161.186 -> 244.3.210.197 TCP 64 60643 > http [ACK] Seq=1914 Ack=101140 Win=30920 Len=0
910224 300.787509 77.139.161.186 -> 244.3.210.197 TCP 64 60647 > http [ACK] Seq=1940 Ack=138453 Win=45260 Len=0
912496 302.019354 77.139.161.186 -> 244.3.210.197 TCP 64 60647 > http [ACK] Seq=1940 Ack=139690 Win=44020 Len=0
912856 302.219127 77.139.161.186 -> 244.3.210.197 TCP 64 60644 > http [ACK] Seq=4548 Ack=42268 Win=20440 Len=0
912896 302.249238 77.139.161.186 -> 244.3.210.197 TCP 70 [TCP Dup ACK 912856#1] 60644 > http [ACK] Seq=4548 Ack=42268 Win=20440 Len=0 SLE=43728 SRE=45188
912916 302.263337 77.139.161.186 -> 244.3.210.197 TCP 70 [TCP Dup ACK 912856#2] 60644 > http [ACK] Seq=4548 Ack=42268 Win=20440 Len=0 SLE=43728 SRE=46648
912956 302.281141 77.139.161.186 -> 244.3.210.197 TCP 70 [TCP Dup ACK 912856#3] 60644 > http [ACK] Seq=4548 Ack=42268 Win=20440 Len=0 SLE=43728 SRE=48108
912999 302.295167 77.139.161.186 -> 244.3.210.197 TCP 70 [TCP Dup ACK 912856#4] 60644 > http [ACK] Seq=4548 Ack=42268 Win=20440 Len=0 SLE=43728 SRE=49568
913033 302.311148 77.139.161.186 -> 244.3.210.197 TCP 70 [TCP Dup ACK 912856#5] 60644 > http [ACK] Seq=4548 Ack=42268 Win=20440 Len=0 SLE=43728 SRE=51028
913082 302.337211 77.139.161.186 -> 244.3.210.197 TCP 70 [TCP Dup ACK 912856#6] 60644 > http [ACK] Seq=4548 Ack=42268 Win=20440 Len=0 SLE=43728 SRE=52488
913095 302.341144 77.139.161.186 -> 244.3.210.197 TCP 70 [TCP Dup ACK 912856#7] 60644 > http [ACK] Seq=4548 Ack=42268 Win=20440 Len=0 SLE=43728 SRE=53948
913110 302.357076 77.139.161.186 -> 244.3.210.197 TCP 70 [TCP Dup ACK 912856#8] 60644 > http [ACK] Seq=4548 Ack=42268 Win=20440 Len=0 SLE=43728 SRE=55408
913122 302.371233 77.139.161.186 -> 244.3.210.197 TCP 70 [TCP Dup ACK 912856#9] 60644 > http [ACK] Seq=4548 Ack=42268 Win=20440 Len=0 SLE=43728 SRE=56868
913256 302.445102 77.139.161.186 -> 244.3.210.197 TCP 64 60645 > http [ACK] Seq=3238 Ack=39650 Win=17520 Len=0
913291 302.463143 77.139.161.186 -> 244.3.210.197 TCP 64 60645 > http [ACK] Seq=3238 Ack=42570 Win=17520 Len=0
913349 302.486862 77.139.161.186 -> 244.3.210.197 TCP 70 [TCP Dup ACK 913212#1] 60640 > http [ACK] Seq=3287 Ack=53344 Win=17520 Len=0 SLE=54804 SRE=56264
913421 302.509275 77.139.161.186 -> 244.3.210.197 TCP 70 [TCP Dup ACK 913212#2] 60640 > http [ACK] Seq=3287 Ack=53344 Win=17520 Len=0 SLE=54804 SRE=57724
913451 302.517457 77.139.161.186 -> 244.3.210.197 TCP 70 [TCP Dup ACK 913212#3] 60640 > http [ACK] Seq=3287 Ack=53344 Win=17520 Len=0 SLE=54804 SRE=59184
913452 302.517462 77.139.161.186 -> 244.3.210.197 TCP 70 [TCP Dup ACK 913212#4] 60640 > http [ACK] Seq=3287 Ack=53344 Win=17520 Len=0 SLE=54804 SRE=60644
913587 302.562100 77.139.161.186 -> 244.3.210.197 TCP 78 [TCP Dup ACK 912856#10] 60644 > http [ACK] Seq=4548 Ack=42268 Win=20440 Len=0 SLE=58328 SRE=59788 SLE=43728 SRE=56868
913588 302.562104 77.139.161.186 -> 244.3.210.197 TCP 70 60644 > http [ACK] Seq=4548 Ack=56868 Win=17520 Len=0 SLE=58328 SRE=59788
913589 302.562108 77.139.161.186 -> 244.3.210.197 TCP 70 [TCP Dup ACK 913588#1] 60644 > http [ACK] Seq=4548 Ack=56868 Win=17520 Len=0 SLE=58328 SRE=61248
913590 302.562113 77.139.161.186 -> 244.3.210.197 TCP 70 [TCP Dup ACK 913588#2] 60644 > http [ACK] Seq=4548 Ack=56868 Win=17520 Len=0 SLE=58328 SRE=62708
913626 302.565354 77.139.161.186 -> 244.3.210.197 TCP 64 60645 > http [ACK] Seq=3238 Ack=45490 Win=17520 Len=0
913627 302.565359 77.139.161.186 -> 244.3.210.197 TCP 64 60645 > http [ACK] Seq=3238 Ack=48410 Win=17520 Len=0
913653 302.571505 77.139.161.186 -> 244.3.210.197 TCP 70 [TCP Dup ACK 913212#5] 60640 > http [ACK] Seq=3287 Ack=53344 Win=17520 Len=0 SLE=54804 SRE=62104
913730 302.595290 77.139.161.186 -> 244.3.210.197 TCP 64 60640 > http [ACK] Seq=3287 Ack=62104 Win=17520 Len=0
913759 302.603322 77.139.161.186 -> 244.3.210.197 TCP 64 60640 > http [ACK] Seq=3287 Ack=65024 Win=17520 Len=0
913776 302.611348 77.139.161.186 -> 244.3.210.197 TCP 64 60646 > http [ACK] Seq=4517 Ack=93172 Win=209492 Len=0
913800 302.615258 77.139.161.186 -> 244.3.210.197 TCP 64 60643 > http [ACK] Seq=3201 Ack=103507 Win=30660 Len=0
913848 302.649304 77.139.161.186 -> 244.3.210.197 TCP 70 [TCP Dup ACK 913588#3] 60644 > http [ACK] Seq=4548 Ack=56868 Win=17520 Len=0 SLE=58328 SRE=64168
913849 302.649309 77.139.161.186 -> 244.3.210.197 TCP 70 [TCP Dup ACK 913588#4] 60644 > http [ACK] Seq=4548 Ack=56868 Win=17520 Len=0 SLE=58328 SRE=65628
913864 302.653390 77.139.161.186 -> 244.3.210.197 TCP 64 60644 > http [ACK] Seq=4548 Ack=65628 Win=17520 Len=0
913868 302.653496 77.139.161.186 -> 244.3.210.197 TCP 64 60647 > http [ACK] Seq=3225 Ack=142838 Win=56940 Len=0
913887 302.670461 77.139.161.186 -> 244.3.210.197 TCP 64 60645 > http [ACK] Seq=3238 Ack=50162 Win=17520 Len=0
913986 302.725342 77.139.161.186 -> 244.3.210.197 TCP 64 60646 > http [ACK] Seq=5160 Ack=95985 Win=206680 Len=0
914014 302.733147 77.139.161.186 -> 244.3.210.197 TCP 64 60643 > http [ACK] Seq=3843 Ack=106427 Win=29200 Len=0
914039 302.743170 77.139.161.186 -> 244.3.210.197 TCP 64 60644 > http [ACK] Seq=4548 Ack=68548 Win=18980 Len=0
914054 302.761140 77.139.161.186 -> 244.3.210.197 TCP 64 60645 > http [ACK] Seq=3892 Ack=52744 Win=17520 Len=0
914071 302.766197 77.139.161.186 -> 244.3.210.197 TCP 64 60647 > http [ACK] Seq=3868 Ack=145758 Win=54020 Len=0
914072 302.766261 77.139.161.186 -> 244.3.210.197 TCP 64 60640 > http [ACK] Seq=3940 Ack=69304 Win=17520 Len=0
914073 302.766265 77.139.161.186 -> 244.3.210.197 TCP 64 60640 > http [ACK] Seq=3940 Ack=71438 Win=17520 Len=0
914210 302.817428 77.139.161.186 -> 244.3.210.197 TCP 64 60646 > http [ACK] Seq=5813 Ack=98905 Win=203760 Len=0
914211 302.817432 77.139.161.186 -> 244.3.210.197 TCP 64 60646 > http [ACK] Seq=5813 Ack=101825 Win=200840 Len=0
914231 302.827153 77.139.161.186 -> 244.3.210.197 TCP 64 60644 > http [ACK] Seq=4548 Ack=71468 Win=21900 Len=0
914262 302.851343 77.139.161.186 -> 244.3.210.197 TCP 64 60647 > http [ACK] Seq=3868 Ack=147569 Win=52208 Len=0
914272 302.859197 77.139.161.186 -> 244.3.210.197 TCP 64 60645 > http [ACK] Seq=4541 Ack=55485 Win=17520 Len=0
914362 302.920035 77.139.161.186 -> 244.3.210.197 TCP 64 60646 > http [ACK] Seq=5813 Ack=104745 Win=197920 Len=0
914378 302.923234 77.139.161.186 -> 244.3.210.197 TCP 64 60644 > http [ACK] Seq=4548 Ack=74388 Win=21900 Len=0
914379 302.923239 77.139.161.186 -> 244.3.210.197 TCP 64 60643 > http [ACK] Seq=3843 Ack=107887 Win=29200 Len=0
914682 303.011156 77.139.161.186 -> 244.3.210.197 TCP 64 60644 > http [ACK] Seq=4548 Ack=77308 Win=23360 Len=0
914751 303.095337 77.139.161.186 -> 244.3.210.197 TCP 64 60646 > http [ACK] Seq=7127 Ack=109250 Win=193416 Len=0
914909 303.202205 77.139.161.186 -> 244.3.210.197 TCP 64 60644 > http [ACK] Seq=4548 Ack=77959 Win=22708 Len=0
914938 303.231242 77.139.161.186 -> 244.3.210.197 TCP 64 60645 > http [ACK] Seq=5863 Ack=56402 Win=16600 Len=0
914972 303.247424 77.139.161.186 -> 244.3.210.197 TCP 64 60640 > http [ACK] Seq=5920 Ack=72912 Win=17520 Len=0
914973 303.247432 77.139.161.186 -> 244.3.210.197 TCP 64 60647 > http [ACK] Seq=5160 Ack=148483 Win=51292 Len=0
915009 303.293332 77.139.161.186 -> 244.3.210.197 TCP 64 60646 > http [ACK] Seq=7127 Ack=109359 Win=193304 Len=0
915801 303.847398 77.139.161.186 -> 244.3.210.197 TCP 64 60643 > http [ACK] Seq=3843 Ack=108495 Win=28592 Len=0
922911 306.545253 77.139.161.186 -> 244.3.210.197 TCP 64 60644 > http [ACK] Seq=5398 Ack=80879 Win=23360 Len=0
922944 306.559282 77.139.161.186 -> 244.3.210.197 TCP 70 [TCP Dup ACK 922911#1] 60644 > http [ACK] Seq=5398 Ack=80879 Win=23360 Len=0 SLE=82339 SRE=83799
923071 306.645167 77.139.161.186 -> 244.3.210.197 TCP 70 [TCP Dup ACK 922911#2] 60644 > http [ACK] Seq=5398 Ack=80879 Win=23360 Len=0 SLE=82339 SRE=85259
923103 306.661294 77.139.161.186 -> 244.3.210.197 TCP 70 [TCP Dup ACK 922911#3] 60644 > http [ACK] Seq=5398 Ack=80879 Win=23360 Len=0 SLE=82339 SRE=86719
923116 306.673217 77.139.161.186 -> 244.3.210.197 TCP 70 [TCP Dup ACK 922911#4] 60644 > http [ACK] Seq=5398 Ack=80879 Win=23360 Len=0 SLE=82339 SRE=88179
923288 306.745346 77.139.161.186 -> 244.3.210.197 TCP 64 60644 > http [ACK] Seq=5398 Ack=88179 Win=27740 Len=0
923289 306.745350 77.139.161.186 -> 244.3.210.197 TCP 64 60644 > http [ACK] Seq=5398 Ack=89639 Win=27740 Len=0
923530 306.851205 77.139.161.186 -> 244.3.210.197 TCP 70 60644 > http [ACK] Seq=5398 Ack=91099 Win=27740 Len=0 SLE=92559 SRE=93337
923821 306.985294 77.139.161.186 -> 244.3.210.197 TCP 64 60647 > http [ACK] Seq=5892 Ack=151403 Win=48372 Len=0
923830 306.989223 77.139.161.186 -> 244.3.210.197 TCP 64 60645 > http [ACK] Seq=6596 Ack=59322 Win=17520 Len=0
923837 306.989404 77.139.161.186 -> 244.3.210.197 TCP 64 60647 > http [ACK] Seq=5892 Ack=154323 Win=48180 Len=0
923850 306.993276 77.139.161.186 -> 244.3.210.197 TCP 64 60645 > http [ACK] Seq=6596 Ack=62242 Win=17520 Len=0
923851 306.993281 77.139.161.186 -> 244.3.210.197 TCP 64 60645 > http [ACK] Seq=6596 Ack=65162 Win=17520 Len=0
923864 306.997391 77.139.161.186 -> 244.3.210.197 TCP 64 60640 > http [ACK] Seq=6667 Ack=75832 Win=17520 Len=0
923872 307.001365 77.139.161.186 -> 244.3.210.197 TCP 64 60640 > http [ACK] Seq=6667 Ack=78752 Win=17520 Len=0
923873 307.001370 77.139.161.186 -> 244.3.210.197 TCP 64 60646 > http [ACK] Seq=7872 Ack=111484 Win=191180 Len=0
923887 307.005149 77.139.161.186 -> 244.3.210.197 TCP 64 60643 > http [ACK] Seq=4588 Ack=110488 Win=29200 Len=0
923948 307.071421 77.139.161.186 -> 244.3.210.197 TCP 64 60647 > http [ACK] Seq=5892 Ack=157243 Win=46720 Len=0
923964 307.083311 77.139.161.186 -> 244.3.210.197 TCP 64 60645 > http [ACK] Seq=6596 Ack=68082 Win=17520 Len=0
923977 307.087534 77.139.161.186 -> 244.3.210.197 TCP 64 60645 > http [ACK] Seq=6596 Ack=70419 Win=17520 Len=0
923983 307.087726 77.139.161.186 -> 244.3.210.197 TCP 64 60647 > http [ACK] Seq=5892 Ack=160163 Win=46720 Len=0
924071 307.157260 77.139.161.186 -> 244.3.210.197 TCP 64 60647 > http [ACK] Seq=5892 Ack=163083 Win=48180 Len=0
924092 307.173379 77.139.161.186 -> 244.3.210.197 TCP 64 60647 > http [ACK] Seq=5892 Ack=166003 Win=46720 Len=0
924184 307.257265 77.139.161.186 -> 244.3.210.197 TCP 64 60647 > http [ACK] Seq=5892 Ack=168923 Win=46720 Len=0
924196 307.261293 77.139.161.186 -> 244.3.210.197 TCP 64 60647 > http [ACK] Seq=5892 Ack=171843 Win=46720 Len=0
924322 307.357232 77.139.161.186 -> 244.3.210.197 TCP 64 60647 > http [ACK] Seq=5892 Ack=174763 Win=48180 Len=0
924329 307.361879 77.139.161.186 -> 244.3.210.197 TCP 64 60643 > http [ACK] Seq=5333 Ack=112846 Win=29200 Len=0
924335 307.362055 77.139.161.186 -> 244.3.210.197 TCP 64 60647 > http [ACK] Seq=5892 Ack=177683 Win=46720 Len=0
924351 307.365266 77.139.161.186 -> 244.3.210.197 TCP 64 60640 > http [ACK] Seq=7412 Ack=82272 Win=17520 Len=0
924357 307.369068 77.139.161.186 -> 244.3.210.197 TCP 64 60645 > http [ACK] Seq=7341 Ack=72405 Win=17520 Len=0
924371 307.378306 77.139.161.186 -> 244.3.210.197 TCP 64 60646 > http [ACK] Seq=9333 Ack=114051 Win=188612 Len=0
925548 308.239272 77.139.161.186 -> 244.3.210.197 TCP 70 60647 > http [ACK] Seq=6612 Ack=182545 Win=45260 Len=0 SLE=177978 SRE=179438
928708 309.429426 77.139.161.186 -> 244.3.210.197 TCP 70 [TCP Dup ACK 928303#1] 60643 > http [ACK] Seq=6057 Ack=112846 Win=29200 Len=0 SLE=117226 SRE=118686
930724 310.093278 77.139.161.186 -> 244.3.210.197 TCP 70 60643 > http [ACK] Seq=6057 Ack=114306 Win=29200 Len=0 SLE=117226 SRE=118686
931063 310.233191 77.139.161.186 -> 244.3.210.197 TCP 64 60643 > http [ACK] Seq=6057 Ack=118686 Win=27740 Len=0
931444 310.349093 77.139.161.186 -> 244.3.210.197 TCP 64 60643 > http [ACK] Seq=6057 Ack=121606 Win=26280 Len=0
931920 310.463162 77.139.161.186 -> 244.3.210.197 TCP 64 60643 > http [ACK] Seq=6057 Ack=124526 Win=26280 Len=0
932299 310.603271 77.139.161.186 -> 244.3.210.197 TCP 64 60643 > http [ACK] Seq=6057 Ack=127446 Win=24820 Len=0
932716 310.715192 77.139.161.186 -> 244.3.210.197 TCP 64 60643 > http [ACK] Seq=6057 Ack=130366 Win=24660 Len=0
933071 310.817120 77.139.161.186 -> 244.3.210.197 TCP 64 60643 > http [ACK] Seq=6057 Ack=133286 Win=21740 Len=0
933436 311.013167 77.139.161.186 -> 244.3.210.197 TCP 64 60643 > http [ACK] Seq=6057 Ack=133718 Win=21308 Len=0
948554 314.631107 77.139.161.186 -> 244.3.210.197 TCP 70 60644 > http [ACK] Seq=5398 Ack=93337 Win=27740 Len=0 SLE=91099 SRE=92559
969768 323.087415 77.139.161.186 -> 244.3.210.197 TCP 64 60645 > http [RST, ACK] Seq=7341 Ack=72405 Win=0 Len=0
969774 323.087622 77.139.161.186 -> 244.3.210.197 TCP 64 60640 > http [RST, ACK] Seq=7412 Ack=82272 Win=0 Len=0
969791 323.095259 77.139.161.186 -> 244.3.210.197 TCP 64 60644 > http [RST, ACK] Seq=5398 Ack=93337 Win=0 Len=0
969814 323.099304 77.139.161.186 -> 244.3.210.197 TCP 64 60643 > http [RST, ACK] Seq=6057 Ack=133718 Win=0 Len=0
969820 323.099508 77.139.161.186 -> 244.3.210.197 TCP 64 60647 > http [RST, ACK] Seq=6612 Ack=182545 Win=0 Len=0
969821 323.099512 77.139.161.186 -> 244.3.210.197 TCP 64 60646 > http [RST, ACK] Seq=9333 Ack=114051 Win=0 Len=0
991965 330.893280 77.139.161.186 -> 244.3.210.197 TCP 70 60661 > http [SYN] Seq=0 Win=8192 Len=0 MSS=1460 WS=4 SACK_PERM=1
992041 330.979271 77.139.161.186 -> 244.3.210.197 TCP 64 60661 > http [ACK] Seq=1 Ack=1 Win=17520 Len=0
994272 331.809400 77.139.161.186 -> 244.3.210.197 TCP 64 60661 > http [ACK] Seq=677 Ack=1461 Win=17520 Len=0
994639 331.911326 77.139.161.186 -> 244.3.210.197 TCP 70 [TCP Dup ACK 994272#1] 60661 > http [ACK] Seq=677 Ack=1461 Win=17520 Len=0 SLE=2921 SRE=4381
994712 331.927558 77.139.161.186 -> 244.3.210.197 TCP 70 [TCP Dup ACK 994272#2] 60661 > http [ACK] Seq=677 Ack=1461 Win=17520 Len=0 SLE=2921 SRE=5841
1000842 334.939320 77.139.161.186 -> 244.3.210.197 TCP 64 60661 > http [ACK] Seq=677 Ack=5841 Win=17520 Len=0
1000866 334.946698 77.139.161.186 -> 244.3.210.197 TCP 70 60662 > http [SYN] Seq=0 Win=8192 Len=0 MSS=1460 WS=4 SACK_PERM=1
1000992 335.051296 77.139.161.186 -> 244.3.210.197 TCP 64 60661 > http [ACK] Seq=677 Ack=8761 Win=17520 Len=0
1001004 335.056148 77.139.161.186 -> 244.3.210.197 TCP 64 60662 > http [ACK] Seq=1 Ack=1 Win=17520 Len=0
1001097 335.167286 77.139.161.186 -> 244.3.210.197 TCP 64 60661 > http [ACK] Seq=677 Ack=11681 Win=17520 Len=0
1001150 335.199333 77.139.161.186 -> 244.3.210.197 TCP 64 60662 > http [ACK] Seq=784 Ack=2921 Win=17520 Len=0
1001268 335.307298 77.139.161.186 -> 244.3.210.197 TCP 64 60661 > http [ACK] Seq=677 Ack=14601 Win=17520 Len=0
1001292 335.329536 77.139.161.186 -> 244.3.210.197 TCP 70 [TCP Dup ACK 1001150#1] 60662 > http [ACK] Seq=784 Ack=2921 Win=17520 Len=0 SLE=5841 SRE=6468
1001568 335.552762 77.139.161.186 -> 244.3.210.197 TCP 64 60661 > http [ACK] Seq=1405 Ack=18332 Win=17520 Len=0
1001725 335.690184 77.139.161.186 -> 244.3.210.197 TCP 64 60662 > http [RST, ACK] Seq=784 Ack=2921 Win=0 Len=0
1001731 335.693452 77.139.161.186 -> 244.3.210.197 TCP 64 60661 > http [ACK] Seq=1405 Ack=21252 Win=17520 Len=0
1001732 335.693457 77.139.161.186 -> 244.3.210.197 TCP 64 60661 > http [ACK] Seq=1405 Ack=24172 Win=17520 Len=0
1001895 335.787609 77.139.161.186 -> 244.3.210.197 TCP 64 60661 > http [ACK] Seq=1405 Ack=27092 Win=17520 Len=0
1001909 335.791899 77.139.161.186 -> 244.3.210.197 TCP 64 60661 > http [ACK] Seq=1405 Ack=30012 Win=17520 Len=0
1002121 335.875225 77.139.161.186 -> 244.3.210.197 TCP 64 60661 > http [ACK] Seq=1405 Ack=32932 Win=17520 Len=0
1002164 335.879275 77.139.161.186 -> 244.3.210.197 TCP 64 60661 > http [ACK] Seq=1405 Ack=35852 Win=17520 Len=0
1002398 335.966395 77.139.161.186 -> 244.3.210.197 TCP 64 60661 > http [ACK] Seq=1405 Ack=38772 Win=17520 Len=0
1002410 335.969266 77.139.161.186 -> 244.3.210.197 TCP 64 60661 > http [ACK] Seq=1405 Ack=40330 Win=17520 Len=0
1008721 337.946835 77.139.161.186 -> 244.3.210.197 TCP 64 60661 > http [ACK] Seq=2282 Ack=43250 Win=17520 Len=0
1008982 338.129692 77.139.161.186 -> 244.3.210.197 TCP 64 60661 > http [ACK] Seq=2282 Ack=46170 Win=17520 Len=0
1009054 338.161418 77.139.161.186 -> 244.3.210.197 TCP 70 [TCP Dup ACK 1008982#1] 60661 > http [ACK] Seq=2282 Ack=46170 Win=17520 Len=0 SLE=47630 SRE=49090
1009055 338.161423 77.139.161.186 -> 244.3.210.197 TCP 70 [TCP Dup ACK 1008982#2] 60661 > http [ACK] Seq=2282 Ack=46170 Win=17520 Len=0 SLE=47630 SRE=50550
1009056 338.161426 77.139.161.186 -> 244.3.210.197 TCP 70 60667 > http [SYN] Seq=0 Win=8192 Len=0 MSS=1460 WS=4 SACK_PERM=1
1009140 338.229258 77.139.161.186 -> 244.3.210.197 TCP 70 [TCP Dup ACK 1008982#3] 60661 > http [ACK] Seq=2282 Ack=46170 Win=17520 Len=0 SLE=47630 SRE=52010
1009200 338.265564 77.139.161.186 -> 244.3.210.197 TCP 70 [TCP Dup ACK 1008982#4] 60661 > http [ACK] Seq=2282 Ack=46170 Win=17520 Len=0 SLE=47630 SRE=53470
1009201 338.265568 77.139.161.186 -> 244.3.210.197 TCP 70 [TCP Dup ACK 1008982#5] 60661 > http [ACK] Seq=2282 Ack=46170 Win=17520 Len=0 SLE=47630 SRE=54930
1009202 338.265573 77.139.161.186 -> 244.3.210.197 TCP 70 [TCP Dup ACK 1008982#6] 60661 > http [ACK] Seq=2282 Ack=46170 Win=17520 Len=0 SLE=47630 SRE=56390
1009203 338.265577 77.139.161.186 -> 244.3.210.197 TCP 64 60661 > http [ACK] Seq=2282 Ack=56390 Win=17520 Len=0
1009226 338.269296 77.139.161.186 -> 244.3.210.197 TCP 64 60667 > http [ACK] Seq=1 Ack=1 Win=17520 Len=0
1009361 338.351322 77.139.161.186 -> 244.3.210.197 TCP 64 60661 > http [ACK] Seq=2282 Ack=59310 Win=17520 Len=0
1009404 338.382702 77.139.161.186 -> 244.3.210.197 TCP 64 60667 > http [ACK] Seq=733 Ack=2921 Win=17520 Len=0
1009480 338.445264 77.139.161.186 -> 244.3.210.197 TCP 64 60661 > http [ACK] Seq=3002 Ack=62679 Win=17520 Len=0
1009506 338.473265 77.139.161.186 -> 244.3.210.197 TCP 64 60667 > http [ACK] Seq=733 Ack=5841 Win=17520 Len=0
1009660 338.531293 77.139.161.186 -> 244.3.210.197 TCP 64 60661 > http [ACK] Seq=3002 Ack=65599 Win=40880 Len=0
1009703 338.559492 77.139.161.186 -> 244.3.210.197 TCP 64 60667 > http [ACK] Seq=733 Ack=8761 Win=17520 Len=0
1009704 338.559497 77.139.161.186 -> 244.3.210.197 TCP 64 60667 > http [ACK] Seq=733 Ack=11681 Win=17520 Len=0
1009804 338.617429 77.139.161.186 -> 244.3.210.197 TCP 64 60661 > http [ACK] Seq=3002 Ack=68519 Win=40880 Len=0
1009805 338.617433 77.139.161.186 -> 244.3.210.197 TCP 64 60661 > http [ACK] Seq=3002 Ack=71439 Win=40880 Len=0
1009894 338.665248 77.139.161.186 -> 244.3.210.197 TCP 64 60667 > http [ACK] Seq=733 Ack=14601 Win=17520 Len=0
1009989 338.709331 77.139.161.186 -> 244.3.210.197 TCP 64 60667 > http [ACK] Seq=733 Ack=17521 Win=17520 Len=0
1009990 338.709336 77.139.161.186 -> 244.3.210.197 TCP 64 60667 > http [ACK] Seq=733 Ack=20441 Win=17520 Len=0
1010016 338.717293 77.139.161.186 -> 244.3.210.197 TCP 64 60661 > http [ACK] Seq=3002 Ack=73894 Win=43800 Len=0
1010307 338.849525 77.139.161.186 -> 244.3.210.197 TCP 64 60667 > http [ACK] Seq=733 Ack=23361 Win=17520 Len=0
1010308 338.849530 77.139.161.186 -> 244.3.210.197 TCP 64 60667 > http [ACK] Seq=733 Ack=26125 Win=17520 Len=0
1010370 338.867397 77.139.161.186 -> 244.3.210.197 TCP 64 60661 > http [ACK] Seq=3743 Ack=76814 Win=48180 Len=0
1010371 338.867401 77.139.161.186 -> 244.3.210.197 TCP 64 60661 > http [ACK] Seq=3743 Ack=78696 Win=48180 Len=0
1010640 338.971316 77.139.161.186 -> 244.3.210.197 TCP 64 60667 > http [ACK] Seq=1472 Ack=28217 Win=17520 Len=0
1010701 338.993299 77.139.161.186 -> 244.3.210.197 TCP 64 60661 > http [ACK] Seq=4482 Ack=80784 Win=48180 Len=0
1010837 339.075244 77.139.161.186 -> 244.3.210.197 TCP 64 60667 > http [ACK] Seq=2211 Ack=30423 Win=17520 Len=0
1010870 339.103320 77.139.161.186 -> 244.3.210.197 TCP 64 60661 > http [ACK] Seq=5221 Ack=82756 Win=48180 Len=0
1011030 339.169269 77.139.161.186 -> 244.3.210.197 TCP 64 60667 > http [ACK] Seq=2950 Ack=32762 Win=17520 Len=0
1011111 339.199201 77.139.161.186 -> 244.3.210.197 TCP 64 60661 > http [ACK] Seq=5960 Ack=84834 Win=46100 Len=0
1011300 339.269227 77.139.161.186 -> 244.3.210.197 TCP 64 60667 > http [ACK] Seq=3668 Ack=35682 Win=17520 Len=0
1011321 339.273246 77.139.161.186 -> 244.3.210.197 TCP 64 60667 > http [ACK] Seq=3668 Ack=38602 Win=17520 Len=0
1011348 339.287501 77.139.161.186 -> 244.3.210.197 TCP 64 60667 > http [ACK] Seq=3668 Ack=41522 Win=17520 Len=0
1011386 339.291538 77.139.161.186 -> 244.3.210.197 TCP 64 60667 > http [ACK] Seq=3668 Ack=44442 Win=17520 Len=0
1011436 339.312499 77.139.161.186 -> 244.3.210.197 TCP 64 60667 > http [ACK] Seq=3668 Ack=47362 Win=17520 Len=0
1011437 339.312504 77.139.161.186 -> 244.3.210.197 TCP 64 60667 > http [ACK] Seq=3668 Ack=50282 Win=17520 Len=0
1011511 339.356054 77.139.161.186 -> 244.3.210.197 TCP 64 60667 > http [ACK] Seq=3668 Ack=53202 Win=17520 Len=0
1011746 339.553552 77.139.161.186 -> 244.3.210.197 TCP 64 60667 > http [ACK] Seq=3668 Ack=53634 Win=17088 Len=0
