725   0.175851 77.197.128.18 -> 41.177.26.176 TCP 64 39756 > http [ACK] Seq=1 Ack=3855 Win=65535 Len=0
786   0.185380 77.197.128.18 -> 41.177.26.176 TCP 64 39756 > http [ACK] Seq=1 Ack=3902 Win=65488 Len=0
958   0.257607 77.197.128.18 -> 41.177.26.176 TCP 64 39756 > http [ACK] Seq=1 Ack=6076 Win=65535 Len=0
959   0.257711 77.197.128.18 -> 41.177.26.176 TCP 64 39756 > http [ACK] Seq=1 Ack=8237 Win=65535 Len=0
1002   0.267176 77.197.128.18 -> 41.177.26.176 TCP 64 39756 > http [ACK] Seq=1 Ack=10605 Win=65535 Len=0
1268   0.339472 77.197.128.18 -> 41.177.26.176 TCP 64 39756 > http [RST, ACK] Seq=1 Ack=11287 Win=0 Len=0
1554   0.451991 77.197.128.18 -> 41.177.26.176 TCP 66 39982 > http [SYN] Seq=0 Win=65535 Len=0 MSS=1460 SACK_PERM=1
1834   0.533739 77.197.128.18 -> 41.177.26.176 TCP 64 39982 > http [ACK] Seq=1 Ack=1 Win=65535 Len=0
2879   0.944042 77.197.128.18 -> 41.177.26.176 TCP 64 39982 > http [ACK] Seq=353 Ack=2431 Win=65535 Len=0
2881   0.944197 77.197.128.18 -> 41.177.26.176 TCP 64 39982 > http [ACK] Seq=353 Ack=4052 Win=65535 Len=0
3077   1.025819 77.197.128.18 -> 41.177.26.176 TCP 64 39982 > http [ACK] Seq=353 Ack=6216 Win=65535 Len=0
3078   1.025986 77.197.128.18 -> 41.177.26.176 TCP 64 39982 > http [ACK] Seq=353 Ack=8481 Win=65535 Len=0
3079   1.025990 77.197.128.18 -> 41.177.26.176 TCP 64 39982 > http [ACK] Seq=353 Ack=11327 Win=65535 Len=0
3080   1.026305 77.197.128.18 -> 41.177.26.176 TCP 64 39982 > http [RST, ACK] Seq=353 Ack=11327 Win=0 Len=0
3165   1.061390 77.197.128.18 -> 41.177.26.176 TCP 66 40135 > http [SYN] Seq=0 Win=65535 Len=0 MSS=1460 SACK_PERM=1
3518   1.143147 77.197.128.18 -> 41.177.26.176 TCP 64 40135 > http [ACK] Seq=1 Ack=1 Win=65535 Len=0
4974   1.517296 77.197.128.18 -> 41.177.26.176 TCP 64 40135 > http [ACK] Seq=309 Ack=2431 Win=65535 Len=0
5130   1.599149 77.197.128.18 -> 41.177.26.176 TCP 64 40135 > http [ACK] Seq=309 Ack=6067 Win=65535 Len=0
5280   1.680705 77.197.128.18 -> 41.177.26.176 TCP 64 40135 > http [ACK] Seq=309 Ack=7904 Win=65535 Len=0
5281   1.680971 77.197.128.18 -> 41.177.26.176 TCP 64 40135 > http [ACK] Seq=309 Ack=10501 Win=65535 Len=0
5282   1.681064 77.197.128.18 -> 41.177.26.176 TCP 64 40135 > http [ACK] Seq=309 Ack=11183 Win=64853 Len=0
5283   1.681261 77.197.128.18 -> 41.177.26.176 TCP 64 40135 > http [RST, ACK] Seq=309 Ack=11183 Win=0 Len=0
6037   1.890012 77.197.128.18 -> 41.177.26.176 TCP 66 40372 > http [SYN] Seq=0 Win=65535 Len=0 MSS=1460 SACK_PERM=1
6278   1.971669 77.197.128.18 -> 41.177.26.176 TCP 64 40372 > http [ACK] Seq=1 Ack=1 Win=65535 Len=0
7127   2.377846 77.197.128.18 -> 41.177.26.176 TCP 64 40372 > http [ACK] Seq=305 Ack=2429 Win=65535 Len=0
7129   2.377980 77.197.128.18 -> 41.177.26.176 TCP 64 40372 > http [ACK] Seq=305 Ack=3900 Win=65535 Len=0
7328   2.459673 77.197.128.18 -> 41.177.26.176 TCP 64 40372 > http [ACK] Seq=305 Ack=6074 Win=65535 Len=0
7329   2.459737 77.197.128.18 -> 41.177.26.176 TCP 64 40372 > http [ACK] Seq=305 Ack=8280 Win=65535 Len=0
7330   2.459864 77.197.128.18 -> 41.177.26.176 TCP 64 40372 > http [ACK] Seq=305 Ack=10881 Win=65535 Len=0
7534   2.541907 77.197.128.18 -> 41.177.26.176 TCP 64 40372 > http [RST, ACK] Seq=305 Ack=11563 Win=0 Len=0
9834   3.467213 77.197.128.18 -> 41.177.26.176 TCP 66 40580 > http [SYN] Seq=0 Win=65535 Len=0 MSS=1460 SACK_PERM=1
10295   3.548968 77.197.128.18 -> 41.177.26.176 TCP 64 40580 > http [ACK] Seq=1 Ack=1 Win=65535 Len=0
16508   4.542374 77.197.128.18 -> 41.177.26.176 TCP 64 40580 > http [ACK] Seq=317 Ack=1544 Win=65535 Len=0
16515   4.553043 77.197.128.18 -> 41.177.26.176 TCP 64 40580 > http [ACK] Seq=317 Ack=2431 Win=64648 Len=0
16518   4.553228 77.197.128.18 -> 41.177.26.176 TCP 64 40580 > http [ACK] Seq=317 Ack=2744 Win=64335 Len=0
16519   4.553234 77.197.128.18 -> 41.177.26.176 TCP 64 40580 > http [ACK] Seq=317 Ack=3720 Win=65535 Len=0
16774   4.624447 77.197.128.18 -> 41.177.26.176 TCP 64 40580 > http [ACK] Seq=317 Ack=6310 Win=65535 Len=0
16783   4.635053 77.197.128.18 -> 41.177.26.176 TCP 64 40580 > http [ACK] Seq=317 Ack=10396 Win=65535 Len=0
16784   4.635057 77.197.128.18 -> 41.177.26.176 TCP 64 40580 > http [RST, ACK] Seq=317 Ack=10396 Win=0 Len=0
55179  22.794373 77.197.128.18 -> 41.177.26.176 TCP 66 48574 > http [SYN] Seq=0 Win=65535 Len=0 MSS=1460 SACK_PERM=1
55355  22.876221 77.197.128.18 -> 41.177.26.176 TCP 64 48574 > http [ACK] Seq=1 Ack=1 Win=65535 Len=0
56585  23.232163 77.197.128.18 -> 41.177.26.176 TCP 64 48574 > http [ACK] Seq=303 Ack=3897 Win=65535 Len=0
56796  23.313854 77.197.128.18 -> 41.177.26.176 TCP 64 48574 > http [ACK] Seq=303 Ack=6057 Win=65535 Len=0
56798  23.314049 77.197.128.18 -> 41.177.26.176 TCP 64 48574 > http [ACK] Seq=303 Ack=8977 Win=65535 Len=0
57081  23.395628 77.197.128.18 -> 41.177.26.176 TCP 64 48574 > http [ACK] Seq=303 Ack=11306 Win=65535 Len=0
57084  23.395861 77.197.128.18 -> 41.177.26.176 TCP 64 48574 > http [RST, ACK] Seq=303 Ack=11306 Win=0 Len=0
78065  31.084803 77.197.128.18 -> 41.177.26.176 TCP 66 51115 > http [SYN] Seq=0 Win=65535 Len=0 MSS=1460 SACK_PERM=1
78506  31.166479 77.197.128.18 -> 41.177.26.176 TCP 64 51115 > http [ACK] Seq=1 Ack=1 Win=65535 Len=0
80045  31.593365 77.197.128.18 -> 41.177.26.176 TCP 64 51115 > http [ACK] Seq=318 Ack=2431 Win=65535 Len=0
80046  31.593493 77.197.128.18 -> 41.177.26.176 TCP 64 51115 > http [ACK] Seq=318 Ack=3896 Win=65535 Len=0
80801  31.675139 77.197.128.18 -> 41.177.26.176 TCP 64 51115 > http [ACK] Seq=318 Ack=8351 Win=65535 Len=0
80853  31.700984 77.197.128.18 -> 41.177.26.176 TCP 64 51115 > http [ACK] Seq=318 Ack=9811 Win=65535 Len=0
81060  31.757249 77.197.128.18 -> 41.177.26.176 TCP 64 51115 > http [RST, ACK] Seq=318 Ack=11200 Win=0 Len=0
85836  33.352312 77.197.128.18 -> 41.177.26.176 TCP 66 51981 > http [SYN] Seq=0 Win=65535 Len=0 MSS=1460 SACK_PERM=1
86038  33.433983 77.197.128.18 -> 41.177.26.176 TCP 64 51981 > http [ACK] Seq=1 Ack=1 Win=65535 Len=0
87429  33.825392 77.197.128.18 -> 41.177.26.176 TCP 64 51981 > http [ACK] Seq=309 Ack=2245 Win=65535 Len=0
87641  33.907044 77.197.128.18 -> 41.177.26.176 TCP 64 51981 > http [ACK] Seq=309 Ack=6068 Win=65535 Len=0
87813  33.988913 77.197.128.18 -> 41.177.26.176 TCP 64 51981 > http [ACK] Seq=309 Ack=8024 Win=65535 Len=0
87814  33.989076 77.197.128.18 -> 41.177.26.176 TCP 64 51981 > http [ACK] Seq=309 Ack=11070 Win=65535 Len=0
87815  33.989147 77.197.128.18 -> 41.177.26.176 TCP 64 51981 > http [RST, ACK] Seq=309 Ack=11070 Win=0 Len=0
137697  47.823156 77.197.128.18 -> 41.177.26.176 TCP 66 59734 > http [SYN] Seq=0 Win=65535 Len=0 MSS=1460 SACK_PERM=1
138032  47.905392 77.197.128.18 -> 41.177.26.176 TCP 64 59734 > http [ACK] Seq=1 Ack=1 Win=65535 Len=0
142329  48.911198 77.197.128.18 -> 41.177.26.176 TCP 64 59734 > http [ACK] Seq=340 Ack=1513 Win=65535 Len=0
142352  48.920738 77.197.128.18 -> 41.177.26.176 TCP 64 59734 > http [ACK] Seq=340 Ack=2514 Win=64534 Len=0
142354  48.920886 77.197.128.18 -> 41.177.26.176 TCP 64 59734 > http [ACK] Seq=340 Ack=3007 Win=65535 Len=0
142590  48.993514 77.197.128.18 -> 41.177.26.176 TCP 64 59734 > http [ACK] Seq=340 Ack=5472 Win=65535 Len=0
142621  49.002491 77.197.128.18 -> 41.177.26.176 TCP 64 59734 > http [ACK] Seq=340 Ack=8371 Win=65535 Len=0
142623  49.002718 77.197.128.18 -> 41.177.26.176 TCP 64 59734 > http [ACK] Seq=340 Ack=11088 Win=65535 Len=0
142624  49.002931 77.197.128.18 -> 41.177.26.176 TCP 64 59734 > http [RST, ACK] Seq=340 Ack=11088 Win=0 Len=0
151114  51.843149 77.197.128.18 -> 41.177.26.176 TCP 66 63621 > http [SYN] Seq=0 Win=65535 Len=0 MSS=1460 SACK_PERM=1
151424  51.925688 77.197.128.18 -> 41.177.26.176 TCP 64 63621 > http [ACK] Seq=1 Ack=1 Win=65535 Len=0
152721  52.297263 77.197.128.18 -> 41.177.26.176 TCP 64 63621 > http [ACK] Seq=316 Ack=2431 Win=65535 Len=0
152982  52.379316 77.197.128.18 -> 41.177.26.176 TCP 64 63621 > http [ACK] Seq=316 Ack=6050 Win=65535 Len=0
153304  52.461265 77.197.128.18 -> 41.177.26.176 TCP 64 63621 > http [ACK] Seq=316 Ack=8826 Win=65535 Len=0
153305  52.461359 77.197.128.18 -> 41.177.26.176 TCP 64 63621 > http [ACK] Seq=316 Ack=11696 Win=65535 Len=0
153306  52.461553 77.197.128.18 -> 41.177.26.176 TCP 64 63621 > http [RST, ACK] Seq=316 Ack=11696 Win=0 Len=0
153536  52.509602 77.197.128.18 -> 41.177.26.176 TCP 66 64185 > http [SYN] Seq=0 Win=65535 Len=0 MSS=1460 SACK_PERM=1
153895  52.591334 77.197.128.18 -> 41.177.26.176 TCP 64 64185 > http [ACK] Seq=1 Ack=1 Win=65535 Len=0
155211  52.964824 77.197.128.18 -> 41.177.26.176 TCP 64 64185 > http [ACK] Seq=318 Ack=2916 Win=65535 Len=0
155628  53.046559 77.197.128.18 -> 41.177.26.176 TCP 64 64185 > http [ACK] Seq=318 Ack=7537 Win=65535 Len=0
155829  53.128352 77.197.128.18 -> 41.177.26.176 TCP 64 64185 > http [ACK] Seq=318 Ack=11136 Win=65535 Len=0
155830  53.128488 77.197.128.18 -> 41.177.26.176 TCP 64 64185 > http [RST, ACK] Seq=318 Ack=11136 Win=0 Len=0
156247  53.253494 77.197.128.18 -> 41.177.26.176 TCP 66 64673 > http [SYN] Seq=0 Win=65535 Len=0 MSS=1460 SACK_PERM=1
156633  53.335204 77.197.128.18 -> 41.177.26.176 TCP 64 64673 > http [ACK] Seq=1 Ack=1 Win=65535 Len=0
157734  53.732730 77.197.128.18 -> 41.177.26.176 TCP 64 64673 > http [ACK] Seq=308 Ack=2431 Win=65535 Len=0
157857  53.779473 77.197.128.18 -> 41.177.26.176 TCP 64 64673 > http [ACK] Seq=308 Ack=3891 Win=65535 Len=0
157977  53.814541 77.197.128.18 -> 41.177.26.176 TCP 64 64673 > http [ACK] Seq=308 Ack=6062 Win=65535 Len=0
158078  53.861274 77.197.128.18 -> 41.177.26.176 TCP 64 64673 > http [ACK] Seq=308 Ack=8581 Win=65535 Len=0
158194  53.896401 77.197.128.18 -> 41.177.26.176 TCP 64 64673 > http [ACK] Seq=308 Ack=11444 Win=64714 Len=0
158195  53.896405 77.197.128.18 -> 41.177.26.176 TCP 64 [TCP Dup ACK 158194#1] 64673 > http [ACK] Seq=308 Ack=11444 Win=64714 Len=0
158196  53.896650 77.197.128.18 -> 41.177.26.176 TCP 64 64673 > http [RST, ACK] Seq=308 Ack=11444 Win=0 Len=0
158743  54.053943 77.197.128.18 -> 41.177.26.176 TCP 66 65009 > http [SYN] Seq=0 Win=65535 Len=0 MSS=1460 SACK_PERM=1
158941  54.135746 77.197.128.18 -> 41.177.26.176 TCP 64 65009 > http [ACK] Seq=1 Ack=1 Win=65535 Len=0
163318  55.393085 77.197.128.18 -> 41.177.26.176 TCP 64 65009 > http [ACK] Seq=335 Ack=1657 Win=65535 Len=0
163366  55.405014 77.197.128.18 -> 41.177.26.176 TCP 64 65009 > http [ACK] Seq=335 Ack=2562 Win=64630 Len=0
163367  55.405051 77.197.128.18 -> 41.177.26.176 TCP 64 65009 > http [ACK] Seq=335 Ack=3131 Win=65535 Len=0
163632  55.477507 77.197.128.18 -> 41.177.26.176 TCP 64 65009 > http [ACK] Seq=335 Ack=5311 Win=65535 Len=0
163646  55.486724 77.197.128.18 -> 41.177.26.176 TCP 64 65009 > http [ACK] Seq=335 Ack=9616 Win=65535 Len=0
163648  55.486989 77.197.128.18 -> 41.177.26.176 TCP 64 65009 > http [RST, ACK] Seq=335 Ack=10700 Win=0 Len=0
164332  55.670789 77.197.128.18 -> 41.177.26.176 TCP 66 sgi-storman > http [SYN] Seq=0 Win=65535 Len=0 MSS=1460 SACK_PERM=1
164695  55.752907 77.197.128.18 -> 41.177.26.176 TCP 64 sgi-storman > http [ACK] Seq=1 Ack=1 Win=65535 Len=0
171105  56.815864 77.197.128.18 -> 41.177.26.176 TCP 64 sgi-storman > http [ACK] Seq=343 Ack=1515 Win=65535 Len=0
171135  56.826903 77.197.128.18 -> 41.177.26.176 TCP 64 sgi-storman > http [ACK] Seq=343 Ack=2271 Win=64779 Len=0
171138  56.827358 77.197.128.18 -> 41.177.26.176 TCP 64 sgi-storman > http [ACK] Seq=343 Ack=2775 Win=64275 Len=0
171139  56.827366 77.197.128.18 -> 41.177.26.176 TCP 64 sgi-storman > http [ACK] Seq=343 Ack=3561 Win=65535 Len=0
171376  56.898035 77.197.128.18 -> 41.177.26.176 TCP 64 sgi-storman > http [ACK] Seq=343 Ack=6128 Win=65535 Len=0
171413  56.908605 77.197.128.18 -> 41.177.26.176 TCP 64 sgi-storman > http [ACK] Seq=343 Ack=9048 Win=65535 Len=0
171414  56.909126 77.197.128.18 -> 41.177.26.176 TCP 64 sgi-storman > http [RST, ACK] Seq=343 Ack=10198 Win=0 Len=0
171419  56.920609 77.197.128.18 -> 41.177.26.176 TCP 66 vqp > http [SYN] Seq=0 Win=65535 Len=0 MSS=1460 SACK_PERM=1
171516  57.002418 77.197.128.18 -> 41.177.26.176 TCP 64 vqp > http [ACK] Seq=1 Ack=1 Win=65535 Len=0
172273  57.406084 77.197.128.18 -> 41.177.26.176 TCP 64 vqp > http [ACK] Seq=318 Ack=2431 Win=65535 Len=0
172668  57.487911 77.197.128.18 -> 41.177.26.176 TCP 64 vqp > http [ACK] Seq=318 Ack=6063 Win=65535 Len=0
173123  57.569482 77.197.128.18 -> 41.177.26.176 TCP 64 vqp > http [ACK] Seq=318 Ack=8150 Win=65535 Len=0
173124  57.569602 77.197.128.18 -> 41.177.26.176 TCP 64 vqp > http [ACK] Seq=318 Ack=11448 Win=64710 Len=0
173125  57.569606 77.197.128.18 -> 41.177.26.176 TCP 64 [TCP Dup ACK 173124#1] vqp > http [ACK] Seq=318 Ack=11448 Win=64710 Len=0
173126  57.569930 77.197.128.18 -> 41.177.26.176 TCP 64 vqp > http [RST, ACK] Seq=318 Ack=11448 Win=0 Len=0
173582  57.702754 77.197.128.18 -> 41.177.26.176 TCP 66 scientia-sdb > http [SYN] Seq=0 Win=65535 Len=0 MSS=1460 SACK_PERM=1
173771  57.784499 77.197.128.18 -> 41.177.26.176 TCP 64 scientia-sdb > http [ACK] Seq=1 Ack=1 Win=65535 Len=0
175118  58.224983 77.197.128.18 -> 41.177.26.176 TCP 64 scientia-sdb > http [ACK] Seq=301 Ack=2431 Win=65535 Len=0
175374  58.306731 77.197.128.18 -> 41.177.26.176 TCP 64 scientia-sdb > http [ACK] Seq=301 Ack=6075 Win=65535 Len=0
175679  58.388367 77.197.128.18 -> 41.177.26.176 TCP 64 scientia-sdb > http [ACK] Seq=301 Ack=8547 Win=65535 Len=0
175680  58.388469 77.197.128.18 -> 41.177.26.176 TCP 64 scientia-sdb > http [ACK] Seq=301 Ack=11653 Win=64505 Len=0
175681  58.388474 77.197.128.18 -> 41.177.26.176 TCP 64 [TCP Dup ACK 175680#1] scientia-sdb > http [ACK] Seq=301 Ack=11653 Win=64505 Len=0
175682  58.388815 77.197.128.18 -> 41.177.26.176 TCP 64 scientia-sdb > http [RST, ACK] Seq=301 Ack=11653 Win=0 Len=0
175915  58.514620 77.197.128.18 -> 41.177.26.176 TCP 66 snmp-tcp-port > http [SYN] Seq=0 Win=65535 Len=0 MSS=1460 SACK_PERM=1
176083  58.596224 77.197.128.18 -> 41.177.26.176 TCP 64 snmp-tcp-port > http [ACK] Seq=1 Ack=1 Win=65535 Len=0
176551  58.953037 77.197.128.18 -> 41.177.26.176 TCP 64 snmp-tcp-port > http [ACK] Seq=308 Ack=2929 Win=65535 Len=0
176642  59.034794 77.197.128.18 -> 41.177.26.176 TCP 64 snmp-tcp-port > http [ACK] Seq=308 Ack=5379 Win=65535 Len=0
176644  59.035002 77.197.128.18 -> 41.177.26.176 TCP 64 snmp-tcp-port > http [ACK] Seq=308 Ack=7543 Win=65535 Len=0
176765  59.116681 77.197.128.18 -> 41.177.26.176 TCP 64 snmp-tcp-port > http [ACK] Seq=308 Ack=11020 Win=65535 Len=0
176766  59.116779 77.197.128.18 -> 41.177.26.176 TCP 64 snmp-tcp-port > http [RST, ACK] Seq=308 Ack=11020 Win=0 Len=0
176769  59.123663 77.197.128.18 -> 41.177.26.176 TCP 66 vtr-emulator > http [SYN] Seq=0 Win=65535 Len=0 MSS=1460 SACK_PERM=1
176831  59.205461 77.197.128.18 -> 41.177.26.176 TCP 64 vtr-emulator > http [ACK] Seq=1 Ack=1 Win=65535 Len=0
177478  59.573102 77.197.128.18 -> 41.177.26.176 TCP 64 vtr-emulator > http [ACK] Seq=308 Ack=2431 Win=65535 Len=0
177630  59.654846 77.197.128.18 -> 41.177.26.176 TCP 64 vtr-emulator > http [ACK] Seq=308 Ack=6062 Win=65535 Len=0
177722  59.685661 77.197.128.18 -> 41.177.26.176 TCP 64 vtr-emulator > http [ACK] Seq=308 Ack=7522 Win=65535 Len=0
177910  59.736902 77.197.128.18 -> 41.177.26.176 TCP 64 vtr-emulator > http [ACK] Seq=308 Ack=11287 Win=64871 Len=0
177911  59.736907 77.197.128.18 -> 41.177.26.176 TCP 64 [TCP Dup ACK 177910#1] vtr-emulator > http [ACK] Seq=308 Ack=11287 Win=64871 Len=0
177913  59.737088 77.197.128.18 -> 41.177.26.176 TCP 64 vtr-emulator > http [RST, ACK] Seq=308 Ack=11287 Win=0 Len=0
178461  59.921031 77.197.128.18 -> 41.177.26.176 TCP 66 msft-gc-ssl > http [SYN] Seq=0 Win=65535 Len=0 MSS=1460 SACK_PERM=1
178683  60.003033 77.197.128.18 -> 41.177.26.176 TCP 64 msft-gc-ssl > http [ACK] Seq=1 Ack=1 Win=65535 Len=0
179434  60.393337 77.197.128.18 -> 41.177.26.176 TCP 64 msft-gc-ssl > http [ACK] Seq=308 Ack=2431 Win=65535 Len=0
179605  60.475214 77.197.128.18 -> 41.177.26.176 TCP 64 msft-gc-ssl > http [ACK] Seq=308 Ack=6062 Win=65535 Len=0
179823  60.557037 77.197.128.18 -> 41.177.26.176 TCP 64 msft-gc-ssl > http [ACK] Seq=308 Ack=7956 Win=65535 Len=0
179828  60.557336 77.197.128.18 -> 41.177.26.176 TCP 64 msft-gc-ssl > http [ACK] Seq=308 Ack=11032 Win=65126 Len=0
179829  60.557340 77.197.128.18 -> 41.177.26.176 TCP 64 [TCP Dup ACK 179828#1] msft-gc-ssl > http [ACK] Seq=308 Ack=11032 Win=65126 Len=0
179830  60.557476 77.197.128.18 -> 41.177.26.176 TCP 64 msft-gc-ssl > http [RST, ACK] Seq=308 Ack=11032 Win=0 Len=0
180309  60.719579 77.197.128.18 -> 41.177.26.176 TCP 66 tip2 > http [SYN] Seq=0 Win=65535 Len=0 MSS=1460 SACK_PERM=1
180530  60.801198 77.197.128.18 -> 41.177.26.176 TCP 64 tip2 > http [ACK] Seq=1 Ack=1 Win=65535 Len=0
185921  62.294948 77.197.128.18 -> 41.177.26.176 TCP 64 tip2 > http [ACK] Seq=317 Ack=1539 Win=65535 Len=0
185934  62.305467 77.197.128.18 -> 41.177.26.176 TCP 64 tip2 > http [ACK] Seq=317 Ack=2667 Win=64407 Len=0
185935  62.305581 77.197.128.18 -> 41.177.26.176 TCP 64 tip2 > http [ACK] Seq=317 Ack=3224 Win=65535 Len=0
186060  62.376810 77.197.128.18 -> 41.177.26.176 TCP 64 tip2 > http [ACK] Seq=317 Ack=5844 Win=65535 Len=0
186063  62.387094 77.197.128.18 -> 41.177.26.176 TCP 64 tip2 > http [ACK] Seq=317 Ack=8414 Win=65535 Len=0
186064  62.387212 77.197.128.18 -> 41.177.26.176 TCP 64 tip2 > http [ACK] Seq=317 Ack=10950 Win=65535 Len=0
186065  62.387502 77.197.128.18 -> 41.177.26.176 TCP 64 tip2 > http [RST, ACK] Seq=317 Ack=10950 Win=0 Len=0
186135  62.417231 77.197.128.18 -> 41.177.26.176 TCP 66 a14 > http [SYN] Seq=0 Win=65535 Len=0 MSS=1460 SACK_PERM=1
186253  62.498872 77.197.128.18 -> 41.177.26.176 TCP 64 a14 > http [ACK] Seq=1 Ack=1 Win=65535 Len=0
186768  62.895361 77.197.128.18 -> 41.177.26.176 TCP 64 a14 > http [ACK] Seq=354 Ack=4051 Win=65535 Len=0
186824  62.977231 77.197.128.18 -> 41.177.26.176 TCP 64 a14 > http [ACK] Seq=354 Ack=6221 Win=65535 Len=0
186825  62.977343 77.197.128.18 -> 41.177.26.176 TCP 64 a14 > http [ACK] Seq=354 Ack=9583 Win=65535 Len=0
186931  63.058927 77.197.128.18 -> 41.177.26.176 TCP 64 a14 > http [ACK] Seq=354 Ack=11206 Win=63912 Len=0
187122  63.169910 77.197.128.18 -> 41.177.26.176 TCP 64 [TCP Window Update] a14 > http [ACK] Seq=354 Ack=11206 Win=65535 Len=0
187124  63.170781 77.197.128.18 -> 41.177.26.176 TCP 64 a14 > http [RST, ACK] Seq=354 Ack=11206 Win=0 Len=0
188709  64.218079 77.197.128.18 -> 41.177.26.176 TCP 66 64680 > http [SYN] Seq=0 Win=65535 Len=0 MSS=1460 SACK_PERM=1
188846  64.299763 77.197.128.18 -> 41.177.26.176 TCP 64 64680 > http [ACK] Seq=1 Ack=1 Win=65535 Len=0
190742  65.589592 77.197.128.18 -> 41.177.26.176 TCP 64 64680 > http [ACK] Seq=325 Ack=2921 Win=65535 Len=0
190743  65.589881 77.197.128.18 -> 41.177.26.176 TCP 64 64680 > http [ACK] Seq=325 Ack=4203 Win=64253 Len=0
190888  65.671808 77.197.128.18 -> 41.177.26.176 TCP 64 64680 > http [ACK] Seq=325 Ack=9777 Win=65535 Len=0
191059  65.753952 77.197.128.18 -> 41.177.26.176 TCP 64 64680 > http [ACK] Seq=325 Ack=12504 Win=65426 Len=0
191060  65.753956 77.197.128.18 -> 41.177.26.176 TCP 64 [TCP Dup ACK 191059#1] 64680 > http [ACK] Seq=325 Ack=12504 Win=65426 Len=0
191061  65.754073 77.197.128.18 -> 41.177.26.176 TCP 64 64680 > http [ACK] Seq=325 Ack=16564 Win=65535 Len=0
191247  65.836728 77.197.128.18 -> 41.177.26.176 TCP 64 64680 > http [ACK] Seq=325 Ack=19296 Win=65535 Len=0
191248  65.836733 77.197.128.18 -> 41.177.26.176 TCP 64 64680 > http [ACK] Seq=325 Ack=20774 Win=65535 Len=0
191249  65.836839 77.197.128.18 -> 41.177.26.176 TCP 64 64680 > http [ACK] Seq=325 Ack=22234 Win=65535 Len=0
191253  65.837391 77.197.128.18 -> 41.177.26.176 TCP 64 64680 > http [RST, ACK] Seq=325 Ack=22459 Win=0 Len=0
203126  70.030743 77.197.128.18 -> 41.177.26.176 TCP 66 5381 > http [SYN] Seq=0 Win=65535 Len=0 MSS=1460 SACK_PERM=1
203367  70.112394 77.197.128.18 -> 41.177.26.176 TCP 64 5381 > http [ACK] Seq=1 Ack=1 Win=65535 Len=0
205008  70.491493 77.197.128.18 -> 41.177.26.176 TCP 64 5381 > http [ACK] Seq=309 Ack=2602 Win=65535 Len=0
205283  70.573305 77.197.128.18 -> 41.177.26.176 TCP 64 5381 > http [ACK] Seq=309 Ack=6082 Win=65535 Len=0
205645  70.655674 77.197.128.18 -> 41.177.26.176 TCP 64 5381 > http [ACK] Seq=309 Ack=9002 Win=65535 Len=0
205646  70.655784 77.197.128.18 -> 41.177.26.176 TCP 64 5381 > http [ACK] Seq=309 Ack=11483 Win=65535 Len=0
205647  70.655973 77.197.128.18 -> 41.177.26.176 TCP 64 5381 > http [RST, ACK] Seq=309 Ack=11483 Win=0 Len=0
209914  72.339004 77.197.128.18 -> 41.177.26.176 TCP 66 6574 > http [SYN] Seq=0 Win=65535 Len=0 MSS=1460 SACK_PERM=1
210157  72.421311 77.197.128.18 -> 41.177.26.176 TCP 64 6574 > http [ACK] Seq=1 Ack=1 Win=65535 Len=0
215397  73.940167 77.197.128.18 -> 41.177.26.176 TCP 64 6574 > http [ACK] Seq=302 Ack=1506 Win=65535 Len=0
215432  73.956113 77.197.128.18 -> 41.177.26.176 TCP 64 6574 > http [ACK] Seq=302 Ack=2473 Win=64568 Len=0
215435  73.956359 77.197.128.18 -> 41.177.26.176 TCP 64 6574 > http [ACK] Seq=302 Ack=2981 Win=65535 Len=0
215672  74.022100 77.197.128.18 -> 41.177.26.176 TCP 64 6574 > http [ACK] Seq=302 Ack=5122 Win=65535 Len=0
215703  74.038622 77.197.128.18 -> 41.177.26.176 TCP 64 6574 > http [ACK] Seq=302 Ack=9013 Win=65535 Len=0
215707  74.038862 77.197.128.18 -> 41.177.26.176 TCP 64 6574 > http [RST, ACK] Seq=302 Ack=10051 Win=0 Len=0
216957  74.195255 77.197.128.18 -> 41.177.26.176 TCP 66 15533 > http [SYN] Seq=0 Win=65535 Len=0 MSS=1460 SACK_PERM=1
217431  74.232195 77.197.128.18 -> 41.177.26.176 TCP 66 7805 > http [SYN] Seq=0 Win=65535 Len=0 MSS=1460 SACK_PERM=1
217750  74.316994 77.197.128.18 -> 41.177.26.176 TCP 64 7805 > http [ACK] Seq=1 Ack=1 Win=65535 Len=0
218849  74.689112 77.197.128.18 -> 41.177.26.176 TCP 64 7805 > http [ACK] Seq=316 Ack=2431 Win=65535 Len=0
219044  74.770907 77.197.128.18 -> 41.177.26.176 TCP 64 7805 > http [ACK] Seq=316 Ack=6050 Win=65535 Len=0
219168  74.852712 77.197.128.18 -> 41.177.26.176 TCP 64 7805 > http [ACK] Seq=316 Ack=7861 Win=65535 Len=0
219169  74.853010 77.197.128.18 -> 41.177.26.176 TCP 64 7805 > http [ACK] Seq=316 Ack=11147 Win=65011 Len=0
219170  74.853015 77.197.128.18 -> 41.177.26.176 TCP 64 [TCP Dup ACK 219169#1] 7805 > http [ACK] Seq=316 Ack=11147 Win=65011 Len=0
219171  74.853262 77.197.128.18 -> 41.177.26.176 TCP 64 7805 > http [RST, ACK] Seq=316 Ack=11147 Win=0 Len=0
219382  74.993156 77.197.128.18 -> 41.177.26.176 TCP 66 10606 > http [SYN] Seq=0 Win=65535 Len=0 MSS=1460 SACK_PERM=1
219562  75.075156 77.197.128.18 -> 41.177.26.176 TCP 64 10606 > http [ACK] Seq=1 Ack=1 Win=65535 Len=0
220596  75.532568 77.197.128.18 -> 41.177.26.176 TCP 64 10606 > http [ACK] Seq=310 Ack=2431 Win=65535 Len=0
220601  75.532838 77.197.128.18 -> 41.177.26.176 TCP 64 10606 > http [ACK] Seq=310 Ack=3907 Win=65535 Len=0
220813  75.615644 77.197.128.18 -> 41.177.26.176 TCP 64 10606 > http [ACK] Seq=310 Ack=6087 Win=65535 Len=0
220815  75.615842 77.197.128.18 -> 41.177.26.176 TCP 64 10606 > http [ACK] Seq=310 Ack=10467 Win=65535 Len=0
220946  75.698018 77.197.128.18 -> 41.177.26.176 TCP 64 10606 > http [ACK] Seq=310 Ack=12025 Win=65535 Len=0
220947  75.698191 77.197.128.18 -> 41.177.26.176 TCP 64 10606 > http [RST, ACK] Seq=310 Ack=12025 Win=0 Len=0
221220  75.836582 77.197.128.18 -> 41.177.26.176 TCP 66 10950 > http [SYN] Seq=0 Win=65535 Len=0 MSS=1460 SACK_PERM=1
221490  75.918726 77.197.128.18 -> 41.177.26.176 TCP 64 10950 > http [ACK] Seq=1 Ack=1 Win=65535 Len=0
222749  76.311123 77.197.128.18 -> 41.177.26.176 TCP 64 10950 > http [ACK] Seq=318 Ack=2431 Win=65535 Len=0
222981  76.393365 77.197.128.18 -> 41.177.26.176 TCP 64 10950 > http [ACK] Seq=318 Ack=5351 Win=65535 Len=0
222982  76.393445 77.197.128.18 -> 41.177.26.176 TCP 64 10950 > http [ACK] Seq=318 Ack=7523 Win=65535 Len=0
223380  76.475573 77.197.128.18 -> 41.177.26.176 TCP 64 10950 > http [ACK] Seq=318 Ack=11345 Win=64813 Len=0
223381  76.475578 77.197.128.18 -> 41.177.26.176 TCP 64 [TCP Dup ACK 223380#1] 10950 > http [ACK] Seq=318 Ack=11345 Win=64813 Len=0
223382  76.475782 77.197.128.18 -> 41.177.26.176 TCP 64 10950 > http [RST, ACK] Seq=318 Ack=11345 Win=0 Len=0
223886  76.613941 77.197.128.18 -> 41.177.26.176 TCP 66 11276 > http [SYN] Seq=0 Win=65535 Len=0 MSS=1460 SACK_PERM=1
224395  76.695729 77.197.128.18 -> 41.177.26.176 TCP 64 11276 > http [ACK] Seq=1 Ack=1 Win=65535 Len=0
225482  77.104054 77.197.128.18 -> 41.177.26.176 TCP 64 11276 > http [ACK] Seq=306 Ack=4060 Win=65535 Len=0
225560  77.185529 77.197.128.18 -> 41.177.26.176 TCP 66 [TCP Retransmission] 15533 > http [SYN] Seq=0 Win=65535 Len=0 MSS=1460 SACK_PERM=1
225562  77.186545 77.197.128.18 -> 41.177.26.176 TCP 64 11276 > http [ACK] Seq=306 Ack=6061 Win=65535 Len=0
225563  77.186753 77.197.128.18 -> 41.177.26.176 TCP 64 11276 > http [ACK] Seq=306 Ack=8981 Win=65535 Len=0
225730  77.269074 77.197.128.18 -> 41.177.26.176 TCP 64 11276 > http [ACK] Seq=306 Ack=12271 Win=65516 Len=0
225731  77.269079 77.197.128.18 -> 41.177.26.176 TCP 64 [TCP Dup ACK 225730#1] 11276 > http [ACK] Seq=306 Ack=12271 Win=65516 Len=0
225732  77.269362 77.197.128.18 -> 41.177.26.176 TCP 64 11276 > http [RST, ACK] Seq=306 Ack=12271 Win=0 Len=0
226446  77.430780 77.197.128.18 -> 41.177.26.176 TCP 66 11601 > http [SYN] Seq=0 Win=65535 Len=0 MSS=1460 SACK_PERM=1
226760  77.512502 77.197.128.18 -> 41.177.26.176 TCP 64 11601 > http [ACK] Seq=1 Ack=1 Win=65535 Len=0
227094  77.637619 77.197.128.18 -> 41.177.26.176 TCP 64 15533 > http [ACK] Seq=1 Ack=1 Win=65535 Len=0
227522  77.945545 77.197.128.18 -> 41.177.26.176 TCP 64 11601 > http [ACK] Seq=301 Ack=3913 Win=65535 Len=0
227705  78.027241 77.197.128.18 -> 41.177.26.176 TCP 64 11601 > http [ACK] Seq=301 Ack=6087 Win=65535 Len=0
227707  78.027340 77.197.128.18 -> 41.177.26.176 TCP 64 11601 > http [ACK] Seq=301 Ack=9494 Win=65535 Len=0
227870  78.109744 77.197.128.18 -> 41.177.26.176 TCP 64 11601 > http [ACK] Seq=301 Ack=11310 Win=65535 Len=0
227871  78.110043 77.197.128.18 -> 41.177.26.176 TCP 64 11601 > http [RST, ACK] Seq=301 Ack=11310 Win=0 Len=0
228077  78.258039 77.197.128.18 -> 41.177.26.176 TCP 66 xoraya > http [SYN] Seq=0 Win=65535 Len=0 MSS=1460 SACK_PERM=1
228120  78.279334 77.197.128.18 -> 41.177.26.176 TCP 64 15533 > http [ACK] Seq=309 Ack=1461 Win=65535 Len=0
228260  78.339747 77.197.128.18 -> 41.177.26.176 TCP 64 xoraya > http [ACK] Seq=1 Ack=1 Win=65535 Len=0
228305  78.361262 77.197.128.18 -> 41.177.26.176 TCP 64 15533 > http [ACK] Seq=309 Ack=2924 Win=65535 Len=0
228496  78.443589 77.197.128.18 -> 41.177.26.176 TCP 64 15533 > http [ACK] Seq=309 Ack=6089 Win=65535 Len=0
228687  78.525703 77.197.128.18 -> 41.177.26.176 TCP 64 15533 > http [ACK] Seq=309 Ack=10992 Win=64196 Len=0
228688  78.525708 77.197.128.18 -> 41.177.26.176 TCP 64 [TCP Dup ACK 228687#1] 15533 > http [ACK] Seq=309 Ack=10992 Win=64196 Len=0
228689  78.526080 77.197.128.18 -> 41.177.26.176 TCP 64 15533 > http [RST, ACK] Seq=309 Ack=11674 Win=0 Len=0
228923  78.671553 77.197.128.18 -> 41.177.26.176 TCP 66 18818 > http [SYN] Seq=0 Win=65535 Len=0 MSS=1460 SACK_PERM=1
229036  78.703020 77.197.128.18 -> 41.177.26.176 TCP 64 xoraya > http [ACK] Seq=316 Ack=2431 Win=65535 Len=0
229037  78.703024 77.197.128.18 -> 41.177.26.176 TCP 64 xoraya > http [ACK] Seq=316 Ack=3893 Win=65535 Len=0
229145  78.754483 77.197.128.18 -> 41.177.26.176 TCP 64 18818 > http [ACK] Seq=1 Ack=1 Win=65535 Len=0
229203  78.785008 77.197.128.18 -> 41.177.26.176 TCP 64 xoraya > http [ACK] Seq=316 Ack=6057 Win=65535 Len=0
229204  78.785133 77.197.128.18 -> 41.177.26.176 TCP 64 xoraya > http [ACK] Seq=316 Ack=8266 Win=65535 Len=0
229205  78.785137 77.197.128.18 -> 41.177.26.176 TCP 64 xoraya > http [ACK] Seq=316 Ack=10623 Win=65535 Len=0
229407  78.866842 77.197.128.18 -> 41.177.26.176 TCP 64 xoraya > http [RST, ACK] Seq=316 Ack=11305 Win=0 Len=0
229780  79.077558 77.197.128.18 -> 41.177.26.176 TCP 66 12097 > http [SYN] Seq=0 Win=65535 Len=0 MSS=1460 SACK_PERM=1
229858  79.159564 77.197.128.18 -> 41.177.26.176 TCP 64 12097 > http [ACK] Seq=1 Ack=1 Win=65535 Len=0
229863  79.162235 77.197.128.18 -> 41.177.26.176 TCP 64 18818 > http [ACK] Seq=353 Ack=2431 Win=65535 Len=0
229864  79.162239 77.197.128.18 -> 41.177.26.176 TCP 64 18818 > http [ACK] Seq=353 Ack=4052 Win=65535 Len=0
229934  79.244738 77.197.128.18 -> 41.177.26.176 TCP 64 18818 > http [ACK] Seq=353 Ack=6220 Win=65535 Len=0
229935  79.244896 77.197.128.18 -> 41.177.26.176 TCP 64 18818 > http [ACK] Seq=353 Ack=8490 Win=65535 Len=0
229936  79.245041 77.197.128.18 -> 41.177.26.176 TCP 64 18818 > http [ACK] Seq=353 Ack=11340 Win=65535 Len=0
229937  79.245302 77.197.128.18 -> 41.177.26.176 TCP 64 18818 > http [RST, ACK] Seq=353 Ack=11340 Win=0 Len=0
229998  79.278877 77.197.128.18 -> 41.177.26.176 TCP 66 19153 > http [SYN] Seq=0 Win=65535 Len=0 MSS=1460 SACK_PERM=1
230040  79.362939 77.197.128.18 -> 41.177.26.176 TCP 64 19153 > http [ACK] Seq=1 Ack=1 Win=65535 Len=0
230573  79.618911 77.197.128.18 -> 41.177.26.176 TCP 64 12097 > http [ACK] Seq=309 Ack=3908 Win=65535 Len=0
230791  79.700529 77.197.128.18 -> 41.177.26.176 TCP 64 12097 > http [ACK] Seq=309 Ack=6076 Win=65535 Len=0
230792  79.700685 77.197.128.18 -> 41.177.26.176 TCP 64 12097 > http [ACK] Seq=309 Ack=8609 Win=65535 Len=0
231000  79.782557 77.197.128.18 -> 41.177.26.176 TCP 64 12097 > http [ACK] Seq=309 Ack=11452 Win=65535 Len=0
231001  79.782682 77.197.128.18 -> 41.177.26.176 TCP 64 12097 > http [RST, ACK] Seq=309 Ack=11452 Win=0 Len=0
231082  79.818610 77.197.128.18 -> 41.177.26.176 TCP 64 19153 > http [ACK] Seq=305 Ack=2431 Win=65535 Len=0
231083  79.818615 77.197.128.18 -> 41.177.26.176 TCP 64 19153 > http [ACK] Seq=305 Ack=3896 Win=65535 Len=0
231176  79.863621 77.197.128.18 -> 41.177.26.176 TCP 66 12280 > http [SYN] Seq=0 Win=65535 Len=0 MSS=1460 SACK_PERM=1
231279  79.900483 77.197.128.18 -> 41.177.26.176 TCP 64 19153 > http [ACK] Seq=305 Ack=6070 Win=65535 Len=0
231280  79.900642 77.197.128.18 -> 41.177.26.176 TCP 64 19153 > http [ACK] Seq=305 Ack=10450 Win=65535 Len=0
231376  79.945683 77.197.128.18 -> 41.177.26.176 TCP 64 12280 > http [ACK] Seq=1 Ack=1 Win=65535 Len=0
231447  79.982383 77.197.128.18 -> 41.177.26.176 TCP 64 19153 > http [RST, ACK] Seq=305 Ack=11347 Win=0 Len=0
231656  80.069305 77.197.128.18 -> 41.177.26.176 TCP 66 19409 > http [SYN] Seq=0 Win=65535 Len=0 MSS=1460 SACK_PERM=1
231904  80.151064 77.197.128.18 -> 41.177.26.176 TCP 64 19409 > http [ACK] Seq=1 Ack=1 Win=65535 Len=0
232360  80.341675 77.197.128.18 -> 41.177.26.176 TCP 64 12280 > http [ACK] Seq=318 Ack=2428 Win=65535 Len=0
232361  80.341774 77.197.128.18 -> 41.177.26.176 TCP 64 12280 > http [ACK] Seq=318 Ack=3893 Win=65535 Len=0
232571  80.423455 77.197.128.18 -> 41.177.26.176 TCP 64 12280 > http [ACK] Seq=318 Ack=5782 Win=65535 Len=0
232572  80.423460 77.197.128.18 -> 41.177.26.176 TCP 64 12280 > http [ACK] Seq=318 Ack=7546 Win=65535 Len=0
232573  80.423668 77.197.128.18 -> 41.177.26.176 TCP 64 12280 > http [ACK] Seq=318 Ack=10544 Win=65535 Len=0
232574  80.423887 77.197.128.18 -> 41.177.26.176 TCP 64 12280 > http [RST, ACK] Seq=318 Ack=10544 Win=0 Len=0
232634  80.450189 77.197.128.18 -> 41.177.26.176 TCP 66 12389 > http [SYN] Seq=0 Win=65535 Len=0 MSS=1460 SACK_PERM=1
232874  80.512653 77.197.128.18 -> 41.177.26.176 TCP 64 19409 > http [ACK] Seq=316 Ack=2714 Win=65535 Len=0
232875  80.512658 77.197.128.18 -> 41.177.26.176 TCP 64 19409 > http [ACK] Seq=316 Ack=3904 Win=64345 Len=0
232947  80.531906 77.197.128.18 -> 41.177.26.176 TCP 64 12389 > http [ACK] Seq=1 Ack=1 Win=65535 Len=0
233161  80.594471 77.197.128.18 -> 41.177.26.176 TCP 64 19409 > http [ACK] Seq=316 Ack=6068 Win=65535 Len=0
233164  80.594739 77.197.128.18 -> 41.177.26.176 TCP 64 19409 > http [ACK] Seq=316 Ack=9012 Win=65535 Len=0
233296  80.676253 77.197.128.18 -> 41.177.26.176 TCP 64 19409 > http [ACK] Seq=316 Ack=12283 Win=65348 Len=0
233297  80.676258 77.197.128.18 -> 41.177.26.176 TCP 64 [TCP Dup ACK 233296#1] 19409 > http [ACK] Seq=316 Ack=12283 Win=65348 Len=0
233298  80.676381 77.197.128.18 -> 41.177.26.176 TCP 64 19409 > http [RST, ACK] Seq=316 Ack=12283 Win=0 Len=0
233304  80.679100 77.197.128.18 -> 41.177.26.176 TCP 66 19561 > http [SYN] Seq=0 Win=65535 Len=0 MSS=1460 SACK_PERM=1
233397  80.760827 77.197.128.18 -> 41.177.26.176 TCP 64 19561 > http [ACK] Seq=1 Ack=1 Win=65535 Len=0
233704  80.970133 77.197.128.18 -> 41.177.26.176 TCP 64 12389 > http [ACK] Seq=355 Ack=2431 Win=65535 Len=0
233847  81.052040 77.197.128.18 -> 41.177.26.176 TCP 64 12389 > http [ACK] Seq=355 Ack=5351 Win=65535 Len=0
233848  81.052113 77.197.128.18 -> 41.177.26.176 TCP 64 12389 > http [ACK] Seq=355 Ack=7685 Win=65535 Len=0
234028  81.133740 77.197.128.18 -> 41.177.26.176 TCP 64 12389 > http [ACK] Seq=355 Ack=11899 Win=64259 Len=0
234029  81.133745 77.197.128.18 -> 41.177.26.176 TCP 64 [TCP Dup ACK 234028#1] 12389 > http [ACK] Seq=355 Ack=11899 Win=64259 Len=0
234030  81.134241 77.197.128.18 -> 41.177.26.176 TCP 64 12389 > http [RST, ACK] Seq=355 Ack=11899 Win=0 Len=0
234080  81.168994 77.197.128.18 -> 41.177.26.176 TCP 64 19561 > http [ACK] Seq=318 Ack=2431 Win=65535 Len=0
234081  81.169000 77.197.128.18 -> 41.177.26.176 TCP 64 19561 > http [ACK] Seq=318 Ack=3896 Win=65535 Len=0
234145  81.250986 77.197.128.18 -> 41.177.26.176 TCP 64 19561 > http [ACK] Seq=318 Ack=6070 Win=65535 Len=0
234146  81.251009 77.197.128.18 -> 41.177.26.176 TCP 64 19561 > http [ACK] Seq=318 Ack=8220 Win=65535 Len=0
234149  81.251694 77.197.128.18 -> 41.177.26.176 TCP 64 19561 > http [ACK] Seq=318 Ack=11076 Win=65535 Len=0
234150  81.251699 77.197.128.18 -> 41.177.26.176 TCP 64 19561 > http [RST, ACK] Seq=318 Ack=11076 Win=0 Len=0
234180  81.278821 77.197.128.18 -> 41.177.26.176 TCP 66 19675 > http [SYN] Seq=0 Win=65535 Len=0 MSS=1460 SACK_PERM=1
234199  81.290109 77.197.128.18 -> 41.177.26.176 TCP 66 12544 > http [SYN] Seq=0 Win=65535 Len=0 MSS=1460 SACK_PERM=1
234312  81.360519 77.197.128.18 -> 41.177.26.176 TCP 64 19675 > http [ACK] Seq=1 Ack=1 Win=65535 Len=0
234337  81.371700 77.197.128.18 -> 41.177.26.176 TCP 64 12544 > http [ACK] Seq=1 Ack=1 Win=65535 Len=0
234983  81.737377 77.197.128.18 -> 41.177.26.176 TCP 64 19675 > http [ACK] Seq=353 Ack=2431 Win=65535 Len=0
235042  81.779502 77.197.128.18 -> 41.177.26.176 TCP 64 19675 > http [ACK] Seq=353 Ack=3891 Win=65535 Len=0
235053  81.792639 77.197.128.18 -> 41.177.26.176 TCP 64 12544 > http [ACK] Seq=318 Ack=2431 Win=65535 Len=0
235054  81.792644 77.197.128.18 -> 41.177.26.176 TCP 64 12544 > http [ACK] Seq=318 Ack=3896 Win=65535 Len=0
235100  81.819240 77.197.128.18 -> 41.177.26.176 TCP 64 19675 > http [ACK] Seq=353 Ack=6209 Win=65535 Len=0
235141  81.861201 77.197.128.18 -> 41.177.26.176 TCP 64 19675 > http [ACK] Seq=353 Ack=8025 Win=65535 Len=0
235142  81.861229 77.197.128.18 -> 41.177.26.176 TCP 64 19675 > http [ACK] Seq=353 Ack=10614 Win=65535 Len=0
235155  81.874406 77.197.128.18 -> 41.177.26.176 TCP 64 12544 > http [ACK] Seq=318 Ack=6070 Win=65535 Len=0
235156  81.874412 77.197.128.18 -> 41.177.26.176 TCP 64 12544 > http [ACK] Seq=318 Ack=7883 Win=65535 Len=0
235157  81.874783 77.197.128.18 -> 41.177.26.176 TCP 64 12544 > http [ACK] Seq=318 Ack=11159 Win=65535 Len=0
235158  81.875081 77.197.128.18 -> 41.177.26.176 TCP 64 12544 > http [RST, ACK] Seq=318 Ack=11159 Win=0 Len=0
235195  81.901078 77.197.128.18 -> 41.177.26.176 TCP 64 19675 > http [ACK] Seq=353 Ack=11296 Win=64853 Len=0
235196  81.901225 77.197.128.18 -> 41.177.26.176 TCP 64 19675 > http [RST, ACK] Seq=353 Ack=11296 Win=0 Len=0
235493  82.101326 77.197.128.18 -> 41.177.26.176 TCP 66 19825 > http [SYN] Seq=0 Win=65535 Len=0 MSS=1460 SACK_PERM=1
235499  82.103036 77.197.128.18 -> 41.177.26.176 TCP 66 12684 > http [SYN] Seq=0 Win=65535 Len=0 MSS=1460 SACK_PERM=1
235685  82.183026 77.197.128.18 -> 41.177.26.176 TCP 64 19825 > http [ACK] Seq=1 Ack=1 Win=65535 Len=0
235688  82.184848 77.197.128.18 -> 41.177.26.176 TCP 64 12684 > http [ACK] Seq=1 Ack=1 Win=65535 Len=0
237829  82.607280 77.197.128.18 -> 41.177.26.176 TCP 64 12684 > http [ACK] Seq=309 Ack=2431 Win=65535 Len=0
238288  82.689226 77.197.128.18 -> 41.177.26.176 TCP 64 12684 > http [ACK] Seq=309 Ack=6069 Win=65535 Len=0
238550  82.770978 77.197.128.18 -> 41.177.26.176 TCP 64 12684 > http [ACK] Seq=309 Ack=8604 Win=65535 Len=0
238551  82.770982 77.197.128.18 -> 41.177.26.176 TCP 64 12684 > http [ACK] Seq=309 Ack=11454 Win=64704 Len=0
238552  82.770986 77.197.128.18 -> 41.177.26.176 TCP 64 [TCP Dup ACK 238551#1] 12684 > http [ACK] Seq=309 Ack=11454 Win=64704 Len=0
238553  82.771308 77.197.128.18 -> 41.177.26.176 TCP 64 12684 > http [RST, ACK] Seq=309 Ack=11454 Win=0 Len=0
238832  82.899394 77.197.128.18 -> 41.177.26.176 TCP 66 12826 > http [SYN] Seq=0 Win=65535 Len=0 MSS=1460 SACK_PERM=1
239042  82.981067 77.197.128.18 -> 41.177.26.176 TCP 64 12826 > http [ACK] Seq=1 Ack=1 Win=65535 Len=0
240212  83.381658 77.197.128.18 -> 41.177.26.176 TCP 64 12826 > http [ACK] Seq=318 Ack=2431 Win=65535 Len=0
240213  83.381791 77.197.128.18 -> 41.177.26.176 TCP 64 12826 > http [ACK] Seq=318 Ack=3896 Win=65535 Len=0
240255  83.405463 77.197.128.18 -> 41.177.26.176 TCP 64 19825 > http [ACK] Seq=318 Ack=1469 Win=65535 Len=0
240274  83.415893 77.197.128.18 -> 41.177.26.176 TCP 64 19825 > http [ACK] Seq=318 Ack=2213 Win=64791 Len=0
240275  83.416092 77.197.128.18 -> 41.177.26.176 TCP 64 19825 > http [ACK] Seq=318 Ack=2659 Win=64345 Len=0
240278  83.416278 77.197.128.18 -> 41.177.26.176 TCP 64 19825 > http [ACK] Seq=318 Ack=3385 Win=65535 Len=0
240456  83.463871 77.197.128.18 -> 41.177.26.176 TCP 64 12826 > http [ACK] Seq=318 Ack=6070 Win=65535 Len=0
240457  83.464059 77.197.128.18 -> 41.177.26.176 TCP 64 12826 > http [ACK] Seq=318 Ack=9761 Win=65535 Len=0
240458  83.464313 77.197.128.18 -> 41.177.26.176 TCP 64 12826 > http [RST, ACK] Seq=318 Ack=11174 Win=0 Len=0
240521  83.487479 77.197.128.18 -> 41.177.26.176 TCP 64 19825 > http [ACK] Seq=318 Ack=5776 Win=65535 Len=0
240567  83.497637 77.197.128.18 -> 41.177.26.176 TCP 64 19825 > http [ACK] Seq=318 Ack=8696 Win=65535 Len=0
240569  83.497861 77.197.128.18 -> 41.177.26.176 TCP 64 19825 > http [RST, ACK] Seq=318 Ack=9853 Win=0 Len=0
240630  83.521213 77.197.128.18 -> 41.177.26.176 TCP 66 tmophl7mts > http [SYN] Seq=0 Win=65535 Len=0 MSS=1460 SACK_PERM=1
240638  83.526239 77.197.128.18 -> 41.177.26.176 TCP 66 12931 > http [SYN] Seq=0 Win=65535 Len=0 MSS=1460 SACK_PERM=1
240720  83.602954 77.197.128.18 -> 41.177.26.176 TCP 64 tmophl7mts > http [ACK] Seq=1 Ack=1 Win=65535 Len=0
240727  83.608101 77.197.128.18 -> 41.177.26.176 TCP 64 12931 > http [ACK] Seq=1 Ack=1 Win=65535 Len=0
241259  83.978142 77.197.128.18 -> 41.177.26.176 TCP 64 12931 > http [ACK] Seq=308 Ack=2431 Win=65535 Len=0
241315  84.018672 77.197.128.18 -> 41.177.26.176 TCP 64 tmophl7mts > http [ACK] Seq=301 Ack=2602 Win=65535 Len=0
241377  84.059910 77.197.128.18 -> 41.177.26.176 TCP 64 12931 > http [ACK] Seq=308 Ack=6062 Win=65535 Len=0
241446  84.100356 77.197.128.18 -> 41.177.26.176 TCP 64 tmophl7mts > http [ACK] Seq=301 Ack=6076 Win=65535 Len=0
241547  84.141665 77.197.128.18 -> 41.177.26.176 TCP 64 12931 > http [ACK] Seq=308 Ack=8615 Win=65535 Len=0
241548  84.141858 77.197.128.18 -> 41.177.26.176 TCP 64 12931 > http [ACK] Seq=308 Ack=11461 Win=64697 Len=0
241549  84.141863 77.197.128.18 -> 41.177.26.176 TCP 64 [TCP Dup ACK 241548#1] 12931 > http [ACK] Seq=308 Ack=11461 Win=64697 Len=0
241551  84.141975 77.197.128.18 -> 41.177.26.176 TCP 64 12931 > http [RST, ACK] Seq=308 Ack=11461 Win=0 Len=0
241623  84.182305 77.197.128.18 -> 41.177.26.176 TCP 64 tmophl7mts > http [ACK] Seq=301 Ack=10456 Win=65535 Len=0
241624  84.182621 77.197.128.18 -> 41.177.26.176 TCP 64 tmophl7mts > http [RST, ACK] Seq=301 Ack=11892 Win=0 Len=0
241980  84.297183 77.197.128.18 -> 41.177.26.176 TCP 66 13042 > http [SYN] Seq=0 Win=65535 Len=0 MSS=1460 SACK_PERM=1
242297  84.326773 77.197.128.18 -> 41.177.26.176 TCP 66 20151 > http [SYN] Seq=0 Win=65535 Len=0 MSS=1460 SACK_PERM=1
242532  84.378836 77.197.128.18 -> 41.177.26.176 TCP 64 13042 > http [ACK] Seq=1 Ack=1 Win=65535 Len=0
242617  84.408757 77.197.128.18 -> 41.177.26.176 TCP 64 20151 > http [ACK] Seq=1 Ack=1 Win=65535 Len=0
243321  84.748979 77.197.128.18 -> 41.177.26.176 TCP 64 13042 > http [ACK] Seq=308 Ack=2431 Win=65535 Len=0
