284623  95.254587 77.197.210.110 -> 41.177.26.15 TCP 66 46125 > http [SYN] Seq=0 Win=65535 Len=0 MSS=1460 SACK_PERM=1
284974  95.333637 77.197.210.110 -> 41.177.26.15 TCP 64 46125 > http [ACK] Seq=1 Ack=1 Win=65535 Len=0
286183  95.673129 77.197.210.110 -> 41.177.26.15 TCP 64 46125 > http [ACK] Seq=309 Ack=2921 Win=65535 Len=0
286407  95.752130 77.197.210.110 -> 41.177.26.15 TCP 64 46125 > http [ACK] Seq=309 Ack=5841 Win=65535 Len=0
286409  95.752270 77.197.210.110 -> 41.177.26.15 TCP 64 46125 > http [ACK] Seq=309 Ack=8465 Win=65535 Len=0
286779  95.831220 77.197.210.110 -> 41.177.26.15 TCP 64 46125 > http [ACK] Seq=309 Ack=12845 Win=65535 Len=0
286780  95.831225 77.197.210.110 -> 41.177.26.15 TCP 64 46125 > http [ACK] Seq=309 Ack=15765 Win=65535 Len=0
286782  95.831354 77.197.210.110 -> 41.177.26.15 TCP 64 46125 > http [ACK] Seq=309 Ack=16665 Win=64635 Len=0
287112  95.917820 77.197.210.110 -> 41.177.26.15 TCP 64 46125 > http [ACK] Seq=309 Ack=29245 Win=61147 Len=0
287113  95.917825 77.197.210.110 -> 41.177.26.15 TCP 64 [TCP Window Update] 46125 > http [ACK] Seq=309 Ack=29245 Win=65535 Len=0
287366  95.997384 77.197.210.110 -> 41.177.26.15 TCP 64 46125 > http [ACK] Seq=309 Ack=32165 Win=65535 Len=0
287370  95.997703 77.197.210.110 -> 41.177.26.15 TCP 64 46125 > http [ACK] Seq=309 Ack=35985 Win=65535 Len=0
287371  95.997707 77.197.210.110 -> 41.177.26.15 TCP 64 46125 > http [ACK] Seq=309 Ack=37445 Win=65535 Len=0
287372  95.997711 77.197.210.110 -> 41.177.26.15 TCP 64 46125 > http [ACK] Seq=309 Ack=40365 Win=65535 Len=0
287376  95.997919 77.197.210.110 -> 41.177.26.15 TCP 64 46125 > http [ACK] Seq=309 Ack=42725 Win=65535 Len=0
287643  96.077546 77.197.210.110 -> 41.177.26.15 TCP 64 46125 > http [ACK] Seq=309 Ack=45645 Win=65535 Len=0
287644  96.077551 77.197.210.110 -> 41.177.26.15 TCP 64 46125 > http [ACK] Seq=309 Ack=49465 Win=65535 Len=0
287645  96.077643 77.197.210.110 -> 41.177.26.15 TCP 64 46125 > http [ACK] Seq=309 Ack=50925 Win=65535 Len=0
287646  96.077648 77.197.210.110 -> 41.177.26.15 TCP 64 46125 > http [ACK] Seq=309 Ack=53845 Win=65535 Len=0
287647  96.077652 77.197.210.110 -> 41.177.26.15 TCP 64 46125 > http [ACK] Seq=309 Ack=57665 Win=65535 Len=0
287648  96.077656 77.197.210.110 -> 41.177.26.15 TCP 64 46125 > http [ACK] Seq=309 Ack=60585 Win=64075 Len=0
287649  96.077660 77.197.210.110 -> 41.177.26.15 TCP 64 46125 > http [ACK] Seq=309 Ack=63505 Win=61155 Len=0
287658  96.078156 77.197.210.110 -> 41.177.26.15 TCP 64 [TCP Window Update] 46125 > http [ACK] Seq=309 Ack=63505 Win=64627 Len=0
287659  96.078160 77.197.210.110 -> 41.177.26.15 TCP 64 [TCP Dup ACK 287658#1] 46125 > http [ACK] Seq=309 Ack=63505 Win=64627 Len=0
287904  96.156756 77.197.210.110 -> 41.177.26.15 TCP 64 46125 > http [ACK] Seq=309 Ack=65865 Win=65535 Len=0
287905  96.156899 77.197.210.110 -> 41.177.26.15 TCP 64 46125 > http [ACK] Seq=309 Ack=68785 Win=65535 Len=0
287909  96.157035 77.197.210.110 -> 41.177.26.15 TCP 64 46125 > http [ACK] Seq=309 Ack=71705 Win=65527 Len=0
287910  96.157039 77.197.210.110 -> 41.177.26.15 TCP 64 [TCP Dup ACK 287909#1] 46125 > http [ACK] Seq=309 Ack=71705 Win=65527 Len=0
287914  96.157170 77.197.210.110 -> 41.177.26.15 TCP 64 46125 > http [ACK] Seq=309 Ack=74065 Win=65535 Len=0
287921  96.157579 77.197.210.110 -> 41.177.26.15 TCP 64 46125 > http [ACK] Seq=309 Ack=76985 Win=65535 Len=0
287925  96.157870 77.197.210.110 -> 41.177.26.15 TCP 64 46125 > http [ACK] Seq=309 Ack=81365 Win=65535 Len=0
287926  96.157875 77.197.210.110 -> 41.177.26.15 TCP 64 46125 > http [ACK] Seq=309 Ack=83725 Win=65535 Len=0
287927  96.157879 77.197.210.110 -> 41.177.26.15 TCP 64 46125 > http [ACK] Seq=309 Ack=86645 Win=65535 Len=0
287928  96.157883 77.197.210.110 -> 41.177.26.15 TCP 64 46125 > http [ACK] Seq=309 Ack=90465 Win=65535 Len=0
287931  96.158085 77.197.210.110 -> 41.177.26.15 TCP 64 46125 > http [ACK] Seq=309 Ack=93385 Win=65535 Len=0
287947  96.159327 77.197.210.110 -> 41.177.26.15 TCP 64 46125 > http [ACK] Seq=309 Ack=94845 Win=65535 Len=0
288101  96.236339 77.197.210.110 -> 41.177.26.15 TCP 64 46125 > http [ACK] Seq=309 Ack=98665 Win=65535 Len=0
288105  96.238667 77.197.210.110 -> 41.177.26.15 TCP 64 46125 > http [ACK] Seq=309 Ack=138765 Win=29807 Len=0
288106  96.238780 77.197.210.110 -> 41.177.26.15 TCP 64 [TCP Window Update] 46125 > http [ACK] Seq=309 Ack=138765 Win=65535 Len=0
288120  96.239523 77.197.210.110 -> 41.177.26.15 TCP 64 46125 > http [ACK] Seq=309 Ack=141125 Win=63175 Len=0
288121  96.239528 77.197.210.110 -> 41.177.26.15 TCP 64 46125 > http [ACK] Seq=309 Ack=142585 Win=65187 Len=0
288122  96.239532 77.197.210.110 -> 41.177.26.15 TCP 64 [TCP Dup ACK 288121#1] 46125 > http [ACK] Seq=309 Ack=142585 Win=65187 Len=0
288315  96.316554 77.197.210.110 -> 41.177.26.15 TCP 64 46125 > http [ACK] Seq=309 Ack=146965 Win=65535 Len=0
288327  96.320049 77.197.210.110 -> 41.177.26.15 TCP 64 46125 > http [ACK] Seq=309 Ack=162057 Win=54255 Len=0
288328  96.320053 77.197.210.110 -> 41.177.26.15 TCP 64 [TCP Window Update] 46125 > http [ACK] Seq=309 Ack=162057 Win=65535 Len=0
288376  96.341672 77.197.210.110 -> 41.177.26.15 TCP 64 46125 > http [RST, ACK] Seq=309 Ack=162057 Win=0 Len=0
687795 216.139626 77.197.210.110 -> 41.177.26.91 TCP 66 34243 > http [SYN] Seq=0 Win=65535 Len=0 MSS=1460 SACK_PERM=1
687937 216.221335 77.197.210.110 -> 41.177.26.91 TCP 64 34243 > http [ACK] Seq=1 Ack=1 Win=65535 Len=0
688323 216.440605 77.197.210.110 -> 41.177.26.91 TCP 64 34243 > http [ACK] Seq=309 Ack=4381 Win=65535 Len=0
688519 216.522481 77.197.210.110 -> 41.177.26.91 TCP 64 34243 > http [ACK] Seq=309 Ack=10221 Win=65535 Len=0
688699 216.604218 77.197.210.110 -> 41.177.26.91 TCP 64 34243 > http [ACK] Seq=309 Ack=13141 Win=65535 Len=0
688701 216.604293 77.197.210.110 -> 41.177.26.91 TCP 64 34243 > http [ACK] Seq=309 Ack=16061 Win=65535 Len=0
688859 216.686029 77.197.210.110 -> 41.177.26.91 TCP 64 34243 > http [ACK] Seq=309 Ack=19401 Win=65535 Len=0
688871 216.694316 77.197.210.110 -> 41.177.26.91 TCP 64 34243 > http [RST, ACK] Seq=309 Ack=19401 Win=0 Len=0
700015 222.015246 77.197.210.110 -> 41.177.26.91 TCP 66 37528 > http [SYN] Seq=0 Win=65535 Len=0 MSS=1460 SACK_PERM=1
700191 222.096706 77.197.210.110 -> 41.177.26.91 TCP 64 37528 > http [ACK] Seq=1 Ack=1 Win=65535 Len=0
700393 222.260140 77.197.210.110 -> 41.177.26.91 TCP 64 37528 > http [ACK] Seq=305 Ack=4381 Win=65535 Len=0
700490 222.342062 77.197.210.110 -> 41.177.26.91 TCP 64 37528 > http [ACK] Seq=305 Ack=10221 Win=65535 Len=0
700610 222.424324 77.197.210.110 -> 41.177.26.91 TCP 64 37528 > http [ACK] Seq=305 Ack=13141 Win=65535 Len=0
700611 222.424328 77.197.210.110 -> 41.177.26.91 TCP 64 37528 > http [ACK] Seq=305 Ack=15432 Win=65535 Len=0
700654 222.464637 77.197.210.110 -> 41.177.26.91 TCP 64 37528 > http [RST, ACK] Seq=305 Ack=15432 Win=0 Len=0
705101 224.412544 77.197.210.110 -> 41.177.26.91 TCP 66 38846 > http [SYN] Seq=0 Win=65535 Len=0 MSS=1460 SACK_PERM=1
705477 224.495184 77.197.210.110 -> 41.177.26.91 TCP 64 38846 > http [ACK] Seq=1 Ack=1 Win=65535 Len=0
706018 224.676292 77.197.210.110 -> 41.177.26.91 TCP 64 38846 > http [ACK] Seq=276 Ack=2921 Win=65535 Len=0
706202 224.758102 77.197.210.110 -> 41.177.26.91 TCP 64 38846 > http [ACK] Seq=276 Ack=5841 Win=65535 Len=0
706203 224.758135 77.197.210.110 -> 41.177.26.91 TCP 64 38846 > http [ACK] Seq=276 Ack=8761 Win=65535 Len=0
706354 224.844788 77.197.210.110 -> 41.177.26.91 TCP 64 38846 > http [ACK] Seq=276 Ack=13390 Win=65535 Len=0
706355 224.845876 77.197.210.110 -> 41.177.26.91 TCP 64 38846 > http [RST, ACK] Seq=276 Ack=13390 Win=0 Len=0
919829 304.865310 77.197.210.110 -> 41.177.26.15 TCP 66 11808 > http [SYN] Seq=0 Win=65535 Len=0 MSS=1460 SACK_PERM=1
920004 304.944556 77.197.210.110 -> 41.177.26.15 TCP 64 11808 > http [ACK] Seq=1 Ack=1 Win=65535 Len=0
921074 305.514860 77.197.210.110 -> 41.177.26.15 TCP 64 11808 > http [ACK] Seq=307 Ack=4381 Win=65535 Len=0
921230 305.594393 77.197.210.110 -> 41.177.26.15 TCP 64 11808 > http [ACK] Seq=307 Ack=7301 Win=65535 Len=0
921231 305.594398 77.197.210.110 -> 41.177.26.15 TCP 64 11808 > http [ACK] Seq=307 Ack=9925 Win=65535 Len=0
921386 305.673610 77.197.210.110 -> 41.177.26.15 TCP 64 11808 > http [ACK] Seq=307 Ack=12845 Win=65263 Len=0
921387 305.673614 77.197.210.110 -> 41.177.26.15 TCP 64 [TCP Dup ACK 921386#1] 11808 > http [ACK] Seq=307 Ack=12845 Win=65263 Len=0
921388 305.673618 77.197.210.110 -> 41.177.26.15 TCP 64 11808 > http [ACK] Seq=307 Ack=15765 Win=65535 Len=0
921389 305.673668 77.197.210.110 -> 41.177.26.15 TCP 64 11808 > http [ACK] Seq=307 Ack=18125 Win=65535 Len=0
921528 305.753184 77.197.210.110 -> 41.177.26.15 TCP 64 11808 > http [ACK] Seq=307 Ack=21045 Win=65535 Len=0
921529 305.753327 77.197.210.110 -> 41.177.26.15 TCP 64 11808 > http [ACK] Seq=307 Ack=23965 Win=65535 Len=0
921530 305.753332 77.197.210.110 -> 41.177.26.15 TCP 64 11808 > http [ACK] Seq=307 Ack=26325 Win=65527 Len=0
921531 305.753337 77.197.210.110 -> 41.177.26.15 TCP 64 [TCP Dup ACK 921530#1] 11808 > http [ACK] Seq=307 Ack=26325 Win=65527 Len=0
921535 305.753451 77.197.210.110 -> 41.177.26.15 TCP 64 11808 > http [ACK] Seq=307 Ack=29245 Win=65535 Len=0
921669 305.832165 77.197.210.110 -> 41.177.26.15 TCP 64 11808 > http [ACK] Seq=307 Ack=32165 Win=65535 Len=0
921670 305.832170 77.197.210.110 -> 41.177.26.15 TCP 64 11808 > http [ACK] Seq=307 Ack=34525 Win=65535 Len=0
921671 305.832281 77.197.210.110 -> 41.177.26.15 TCP 64 11808 > http [ACK] Seq=307 Ack=37445 Win=65535 Len=0
921672 305.832409 77.197.210.110 -> 41.177.26.15 TCP 64 11808 > http [ACK] Seq=307 Ack=38905 Win=65535 Len=0
921673 305.832414 77.197.210.110 -> 41.177.26.15 TCP 64 11808 > http [ACK] Seq=307 Ack=41265 Win=65535 Len=0
921677 305.832550 77.197.210.110 -> 41.177.26.15 TCP 64 11808 > http [ACK] Seq=307 Ack=44185 Win=65535 Len=0
921680 305.832671 77.197.210.110 -> 41.177.26.15 TCP 64 11808 > http [ACK] Seq=307 Ack=47105 Win=65535 Len=0
921857 305.913894 77.197.210.110 -> 41.177.26.15 TCP 64 11808 > http [ACK] Seq=307 Ack=75525 Win=45307 Len=0
921858 305.913899 77.197.210.110 -> 41.177.26.15 TCP 64 [TCP Window Update] 11808 > http [ACK] Seq=307 Ack=75525 Win=65535 Len=0
921998 305.993011 77.197.210.110 -> 41.177.26.15 TCP 64 11808 > http [ACK] Seq=307 Ack=78445 Win=65535 Len=0
921999 305.993186 77.197.210.110 -> 41.177.26.15 TCP 64 11808 > http [ACK] Seq=307 Ack=82265 Win=65535 Len=0
922000 305.993190 77.197.210.110 -> 41.177.26.15 TCP 64 11808 > http [ACK] Seq=307 Ack=83725 Win=65535 Len=0
922096 306.011145 77.197.210.110 -> 41.177.26.15 TCP 64 11808 > http [RST, ACK] Seq=307 Ack=85002 Win=0 Len=0
