53320  22.170719 77.197.127.128 -> 41.177.26.176 TCP 66 61598 > http [SYN] Seq=0 Win=65535 Len=0 MSS=1460 SACK_PERM=1
53703  22.232446 77.197.127.128 -> 41.177.26.176 TCP 64 61598 > http [ACK] Seq=1 Ack=1 Win=65535 Len=0
54642  22.633719 77.197.127.128 -> 41.177.26.176 TCP 64 61598 > http [ACK] Seq=309 Ack=2431 Win=65535 Len=0
54643  22.633828 77.197.127.128 -> 41.177.26.176 TCP 64 61598 > http [ACK] Seq=309 Ack=3908 Win=65535 Len=0
54868  22.695629 77.197.127.128 -> 41.177.26.176 TCP 64 61598 > http [ACK] Seq=309 Ack=7542 Win=65535 Len=0
54869  22.695786 77.197.127.128 -> 41.177.26.176 TCP 64 61598 > http [ACK] Seq=309 Ack=9672 Win=65535 Len=0
54874  22.696068 77.197.127.128 -> 41.177.26.176 TCP 64 61598 > http [RST, ACK] Seq=309 Ack=11092 Win=0 Len=0
56813  23.318716 77.197.127.128 -> 41.177.26.91 TCP 66 63030 > http [SYN] Seq=0 Win=65535 Len=0 MSS=1460 SACK_PERM=1
56931  23.380565 77.197.127.128 -> 41.177.26.91 TCP 64 63030 > http [ACK] Seq=1 Ack=1 Win=65535 Len=0
57830  23.561982 77.197.127.128 -> 41.177.26.91 TCP 64 63030 > http [ACK] Seq=236 Ack=4381 Win=65535 Len=0
58180  23.623755 77.197.127.128 -> 41.177.26.91 TCP 64 63030 > http [ACK] Seq=236 Ack=7301 Win=65535 Len=0
58181  23.623783 77.197.127.128 -> 41.177.26.91 TCP 64 63030 > http [ACK] Seq=236 Ack=10221 Win=65535 Len=0
58535  23.685714 77.197.127.128 -> 41.177.26.91 TCP 64 63030 > http [RST, ACK] Seq=236 Ack=10308 Win=0 Len=0
435116 141.923415 77.197.127.128 -> 41.177.26.176 TCP 66 20793 > http [SYN] Seq=0 Win=65535 Len=0 MSS=1460 SACK_PERM=1
435310 141.985199 77.197.127.128 -> 41.177.26.176 TCP 64 20793 > http [ACK] Seq=1 Ack=1 Win=65535 Len=0
436894 142.413976 77.197.127.128 -> 41.177.26.176 TCP 64 20793 > http [ACK] Seq=356 Ack=2431 Win=65535 Len=0
437021 142.475818 77.197.127.128 -> 41.177.26.176 TCP 64 20793 > http [ACK] Seq=356 Ack=6230 Win=65535 Len=0
437174 142.537636 77.197.127.128 -> 41.177.26.176 TCP 64 20793 > http [ACK] Seq=356 Ack=11240 Win=65535 Len=0
437175 142.537955 77.197.127.128 -> 41.177.26.176 TCP 64 20793 > http [RST, ACK] Seq=356 Ack=11240 Win=0 Len=0
447455 145.362788 77.197.127.128 -> 41.177.26.176 TCP 66 24352 > http [SYN] Seq=0 Win=65535 Len=0 MSS=1460 SACK_PERM=1
447612 145.424462 77.197.127.128 -> 41.177.26.176 TCP 64 24352 > http [ACK] Seq=1 Ack=1 Win=65535 Len=0
448924 145.861065 77.197.127.128 -> 41.177.26.176 TCP 64 24352 > http [ACK] Seq=309 Ack=3908 Win=65535 Len=0
449037 145.922974 77.197.127.128 -> 41.177.26.176 TCP 64 24352 > http [ACK] Seq=309 Ack=6082 Win=65535 Len=0
449038 145.923032 77.197.127.128 -> 41.177.26.176 TCP 64 24352 > http [ACK] Seq=309 Ack=8501 Win=65535 Len=0
449181 145.984796 77.197.127.128 -> 41.177.26.176 TCP 64 24352 > http [ACK] Seq=309 Ack=11357 Win=65535 Len=0
449182 145.985020 77.197.127.128 -> 41.177.26.176 TCP 64 24352 > http [RST, ACK] Seq=309 Ack=11357 Win=0 Len=0
450335 146.478593 77.197.127.128 -> 41.177.26.176 TCP 66 25250 > http [SYN] Seq=0 Win=65535 Len=0 MSS=1460 SACK_PERM=1
450462 146.540334 77.197.127.128 -> 41.177.26.176 TCP 64 25250 > http [ACK] Seq=1 Ack=1 Win=65535 Len=0
451327 146.979438 77.197.127.128 -> 41.177.26.176 TCP 64 25250 > http [ACK] Seq=309 Ack=2431 Win=65535 Len=0
451457 147.041249 77.197.127.128 -> 41.177.26.176 TCP 64 25250 > http [ACK] Seq=309 Ack=6075 Win=65535 Len=0
451677 147.103096 77.197.127.128 -> 41.177.26.176 TCP 64 25250 > http [ACK] Seq=309 Ack=8995 Win=65535 Len=0
451678 147.103119 77.197.127.128 -> 41.177.26.176 TCP 64 25250 > http [ACK] Seq=309 Ack=11442 Win=64716 Len=0
451680 147.103162 77.197.127.128 -> 41.177.26.176 TCP 64 [TCP Dup ACK 451678#1] 25250 > http [ACK] Seq=309 Ack=11442 Win=64716 Len=0
451683 147.103432 77.197.127.128 -> 41.177.26.176 TCP 64 25250 > http [RST, ACK] Seq=309 Ack=11442 Win=0 Len=0
452251 147.284186 77.197.127.128 -> 41.177.26.176 TCP 66 25500 > http [SYN] Seq=0 Win=65535 Len=0 MSS=1460 SACK_PERM=1
452352 147.346056 77.197.127.128 -> 41.177.26.176 TCP 64 25500 > http [ACK] Seq=1 Ack=1 Win=65535 Len=0
453052 147.705630 77.197.127.128 -> 41.177.26.176 TCP 64 25500 > http [ACK] Seq=319 Ack=2431 Win=65535 Len=0
453053 147.705734 77.197.127.128 -> 41.177.26.176 TCP 64 25500 > http [ACK] Seq=319 Ack=3895 Win=65535 Len=0
453138 147.767468 77.197.127.128 -> 41.177.26.176 TCP 64 25500 > http [ACK] Seq=319 Ack=6075 Win=65535 Len=0
453139 147.767689 77.197.127.128 -> 41.177.26.176 TCP 64 25500 > http [ACK] Seq=319 Ack=8487 Win=65535 Len=0
453259 147.829598 77.197.127.128 -> 41.177.26.176 TCP 64 25500 > http [ACK] Seq=319 Ack=11349 Win=65535 Len=0
453260 147.829852 77.197.127.128 -> 41.177.26.176 TCP 64 25500 > http [RST, ACK] Seq=319 Ack=11349 Win=0 Len=0
