188720  64.221864 77.197.210.67 -> 244.3.210.197 TCP 66 24982 > http [SYN] Seq=0 Win=65535 Len=0 MSS=1460 SACK_PERM=1
188852  64.300781 77.197.210.67 -> 244.3.210.197 TCP 64 24982 > http [ACK] Seq=1 Ack=1 Win=65535 Len=0
189404  64.759641 77.197.210.67 -> 244.3.210.197 TCP 64 24982 > http [ACK] Seq=337 Ack=2921 Win=65535 Len=0
189511  64.838571 77.197.210.67 -> 244.3.210.197 TCP 64 24982 > http [ACK] Seq=337 Ack=5841 Win=65535 Len=0
189615  64.918702 77.197.210.67 -> 244.3.210.197 TCP 64 24982 > http [ACK] Seq=337 Ack=11681 Win=64967 Len=0
189616  64.918707 77.197.210.67 -> 244.3.210.197 TCP 64 [TCP Dup ACK 189615#1] 24982 > http [ACK] Seq=337 Ack=11681 Win=64967 Len=0
189721  64.997711 77.197.210.67 -> 244.3.210.197 TCP 64 24982 > http [ACK] Seq=337 Ack=14610 Win=65535 Len=0
189729  65.000541 77.197.210.67 -> 244.3.210.197 TCP 64 24982 > http [RST, ACK] Seq=337 Ack=14610 Win=0 Len=0
193428  66.527937 77.197.210.67 -> 41.177.26.91 TCP 66 30323 > http [SYN] Seq=0 Win=65535 Len=0 MSS=1460 SACK_PERM=1
193689  66.609910 77.197.210.67 -> 41.177.26.91 TCP 64 30323 > http [ACK] Seq=1 Ack=1 Win=65535 Len=0
194862  66.983996 77.197.210.67 -> 41.177.26.91 TCP 64 30323 > http [ACK] Seq=310 Ack=2921 Win=65535 Len=0
195172  67.065728 77.197.210.67 -> 41.177.26.91 TCP 64 30323 > http [ACK] Seq=310 Ack=5841 Win=65535 Len=0
195175  67.065943 77.197.210.67 -> 41.177.26.91 TCP 64 30323 > http [ACK] Seq=310 Ack=8761 Win=65535 Len=0
195360  67.149706 77.197.210.67 -> 41.177.26.91 TCP 64 30323 > http [ACK] Seq=310 Ack=15676 Win=65535 Len=0
195370  67.162202 77.197.210.67 -> 41.177.26.91 TCP 64 30323 > http [RST, ACK] Seq=310 Ack=15676 Win=0 Len=0
763484 246.383679 77.197.210.67 -> 41.177.26.15 TCP 66 21727 > http [SYN] Seq=0 Win=65535 Len=0 MSS=1460 SACK_PERM=1
763673 246.466884 77.197.210.67 -> 41.177.26.15 TCP 64 21727 > http [ACK] Seq=1 Ack=1 Win=65535 Len=0
764623 246.825547 77.197.210.67 -> 41.177.26.15 TCP 66 16155 > http [SYN] Seq=0 Win=65535 Len=0 MSS=1460 SACK_PERM=1
764695 246.872715 77.197.210.67 -> 41.177.26.15 TCP 64 21727 > http [ACK] Seq=308 Ack=4381 Win=64627 Len=0
764696 246.872719 77.197.210.67 -> 41.177.26.15 TCP 64 [TCP Dup ACK 764695#1] 21727 > http [ACK] Seq=308 Ack=4381 Win=64627 Len=0
764733 246.907870 77.197.210.67 -> 41.177.26.15 TCP 64 16155 > http [ACK] Seq=1 Ack=1 Win=65535 Len=0
764877 246.956268 77.197.210.67 -> 41.177.26.15 TCP 64 21727 > http [ACK] Seq=308 Ack=7301 Win=65535 Len=0
764878 246.956273 77.197.210.67 -> 41.177.26.15 TCP 64 21727 > http [ACK] Seq=308 Ack=9925 Win=65535 Len=0
765059 247.038184 77.197.210.67 -> 41.177.26.15 TCP 64 21727 > http [ACK] Seq=308 Ack=12845 Win=65263 Len=0
765060 247.038188 77.197.210.67 -> 41.177.26.15 TCP 64 [TCP Dup ACK 765059#1] 21727 > http [ACK] Seq=308 Ack=12845 Win=65263 Len=0
765061 247.038205 77.197.210.67 -> 41.177.26.15 TCP 64 21727 > http [ACK] Seq=308 Ack=16665 Win=65535 Len=0
765304 247.120442 77.197.210.67 -> 41.177.26.15 TCP 64 21727 > http [ACK] Seq=308 Ack=19585 Win=65535 Len=0
765305 247.120703 77.197.210.67 -> 41.177.26.15 TCP 64 21727 > http [ACK] Seq=308 Ack=22505 Win=65535 Len=0
765306 247.120708 77.197.210.67 -> 41.177.26.15 TCP 64 21727 > http [ACK] Seq=308 Ack=24865 Win=65535 Len=0
765307 247.120712 77.197.210.67 -> 41.177.26.15 TCP 64 21727 > http [ACK] Seq=308 Ack=26325 Win=65535 Len=0
765415 247.202321 77.197.210.67 -> 41.177.26.15 TCP 64 21727 > http [ACK] Seq=308 Ack=29245 Win=65535 Len=0
765416 247.202326 77.197.210.67 -> 41.177.26.15 TCP 64 21727 > http [ACK] Seq=308 Ack=32165 Win=65535 Len=0
765418 247.202607 77.197.210.67 -> 41.177.26.15 TCP 64 21727 > http [ACK] Seq=308 Ack=34525 Win=65535 Len=0
765419 247.202611 77.197.210.67 -> 41.177.26.15 TCP 64 21727 > http [ACK] Seq=308 Ack=35985 Win=65535 Len=0
765420 247.202615 77.197.210.67 -> 41.177.26.15 TCP 64 21727 > http [ACK] Seq=308 Ack=38905 Win=65535 Len=0
765422 247.202630 77.197.210.67 -> 41.177.26.15 TCP 64 21727 > http [ACK] Seq=308 Ack=41265 Win=65535 Len=0
765478 247.245473 77.197.210.67 -> 41.177.26.91 TCP 66 22377 > http [SYN] Seq=0 Win=65535 Len=0 MSS=1460 SACK_PERM=1
765525 247.284226 77.197.210.67 -> 41.177.26.15 TCP 64 21727 > http [ACK] Seq=308 Ack=44185 Win=65535 Len=0
765529 247.286980 77.197.210.67 -> 41.177.26.15 TCP 64 21727 > http [ACK] Seq=308 Ack=67325 Win=49127 Len=0
765530 247.286985 77.197.210.67 -> 41.177.26.15 TCP 64 [TCP Window Update] 21727 > http [ACK] Seq=308 Ack=67325 Win=65535 Len=0
765615 247.329383 77.197.210.67 -> 41.177.26.91 TCP 64 22377 > http [ACK] Seq=1 Ack=1 Win=65535 Len=0
765646 247.366115 77.197.210.67 -> 41.177.26.15 TCP 64 21727 > http [ACK] Seq=308 Ack=70245 Win=65535 Len=0
765654 247.368736 77.197.210.67 -> 41.177.26.15 TCP 64 21727 > http [ACK] Seq=308 Ack=73165 Win=65535 Len=0
765655 247.368741 77.197.210.67 -> 41.177.26.15 TCP 64 21727 > http [ACK] Seq=308 Ack=75525 Win=65535 Len=0
765656 247.368864 77.197.210.67 -> 41.177.26.15 TCP 64 21727 > http [ACK] Seq=308 Ack=78445 Win=65535 Len=0
765657 247.368868 77.197.210.67 -> 41.177.26.15 TCP 64 21727 > http [ACK] Seq=308 Ack=81365 Win=64075 Len=0
765658 247.368884 77.197.210.67 -> 41.177.26.15 TCP 64 21727 > http [ACK] Seq=308 Ack=83725 Win=61715 Len=0
765663 247.368986 77.197.210.67 -> 41.177.26.15 TCP 64 21727 > http [ACK] Seq=308 Ack=86645 Win=58795 Len=0
765664 247.368990 77.197.210.67 -> 41.177.26.15 TCP 64 21727 > http [ACK] Seq=308 Ack=89565 Win=55875 Len=0
765665 247.368994 77.197.210.67 -> 41.177.26.15 TCP 64 21727 > http [ACK] Seq=308 Ack=91925 Win=53515 Len=0
765672 247.369142 77.197.210.67 -> 41.177.26.15 TCP 64 21727 > http [ACK] Seq=308 Ack=94845 Win=50595 Len=0
765752 247.445761 77.197.210.67 -> 41.177.26.15 TCP 64 21727 > http [ACK] Seq=308 Ack=96305 Win=52607 Len=0
765753 247.445836 77.197.210.67 -> 41.177.26.15 TCP 64 [TCP Window Update] 21727 > http [ACK] Seq=308 Ack=96305 Win=65535 Len=0
765760 247.448244 77.197.210.67 -> 41.177.26.15 TCP 64 21727 > http [ACK] Seq=308 Ack=98665 Win=65535 Len=0
765768 247.450332 77.197.210.67 -> 41.177.26.15 TCP 64 21727 > http [ACK] Seq=308 Ack=101585 Win=65535 Len=0
765769 247.450470 77.197.210.67 -> 41.177.26.15 TCP 64 21727 > http [ACK] Seq=308 Ack=104505 Win=65527 Len=0
765770 247.450475 77.197.210.67 -> 41.177.26.15 TCP 64 [TCP Dup ACK 765769#1] 21727 > http [ACK] Seq=308 Ack=104505 Win=65527 Len=0
765775 247.450631 77.197.210.67 -> 41.177.26.15 TCP 64 21727 > http [ACK] Seq=308 Ack=106865 Win=65535 Len=0
765776 247.450636 77.197.210.67 -> 41.177.26.15 TCP 64 21727 > http [ACK] Seq=308 Ack=109785 Win=65535 Len=0
765777 247.450640 77.197.210.67 -> 41.177.26.15 TCP 64 21727 > http [ACK] Seq=308 Ack=112705 Win=65535 Len=0
765778 247.450644 77.197.210.67 -> 41.177.26.15 TCP 64 21727 > http [ACK] Seq=308 Ack=115065 Win=63175 Len=0
765779 247.450818 77.197.210.67 -> 41.177.26.15 TCP 64 21727 > http [ACK] Seq=308 Ack=117985 Win=60255 Len=0
765780 247.450823 77.197.210.67 -> 41.177.26.15 TCP 64 21727 > http [ACK] Seq=308 Ack=120905 Win=57335 Len=0
765781 247.450927 77.197.210.67 -> 41.177.26.15 TCP 64 21727 > http [ACK] Seq=308 Ack=123265 Win=54975 Len=0
765782 247.450932 77.197.210.67 -> 41.177.26.15 TCP 64 21727 > http [ACK] Seq=308 Ack=126185 Win=52055 Len=0
765783 247.451021 77.197.210.67 -> 41.177.26.15 TCP 64 21727 > http [ACK] Seq=308 Ack=129105 Win=49135 Len=0
765785 247.451164 77.197.210.67 -> 41.177.26.15 TCP 64 21727 > http [ACK] Seq=308 Ack=131465 Win=46775 Len=0
765786 247.451168 77.197.210.67 -> 41.177.26.15 TCP 64 21727 > http [ACK] Seq=308 Ack=134385 Win=43855 Len=0
765787 247.451172 77.197.210.67 -> 41.177.26.15 TCP 64 21727 > http [ACK] Seq=308 Ack=137305 Win=40935 Len=0
765851 247.497836 77.197.210.67 -> 41.177.26.15 TCP 64 [TCP Window Update] 21727 > http [ACK] Seq=308 Ack=137305 Win=44407 Len=0
765852 247.497840 77.197.210.67 -> 41.177.26.15 TCP 64 [TCP Window Update] 21727 > http [ACK] Seq=308 Ack=137305 Win=65535 Len=0
765862 247.502103 77.197.210.67 -> 41.177.26.15 TCP 64 16155 > http [ACK] Seq=309 Ack=4381 Win=65535 Len=0
765903 247.522443 77.197.210.67 -> 41.177.26.91 TCP 64 22377 > http [ACK] Seq=310 Ack=2921 Win=65535 Len=0
765912 247.527704 77.197.210.67 -> 41.177.26.15 TCP 64 21727 > http [ACK] Seq=308 Ack=139665 Win=65535 Len=0
765918 247.530005 77.197.210.67 -> 41.177.26.15 TCP 64 21727 > http [ACK] Seq=308 Ack=142585 Win=65535 Len=0
765922 247.532121 77.197.210.67 -> 41.177.26.15 TCP 64 21727 > http [ACK] Seq=308 Ack=146965 Win=64067 Len=0
765923 247.532126 77.197.210.67 -> 41.177.26.15 TCP 64 [TCP Window Update] 21727 > http [ACK] Seq=308 Ack=146965 Win=65535 Len=0
765924 247.532245 77.197.210.67 -> 41.177.26.15 TCP 64 21727 > http [ACK] Seq=308 Ack=149138 Win=65535 Len=0
765959 247.554307 77.197.210.67 -> 41.177.26.15 TCP 64 21727 > http [RST, ACK] Seq=308 Ack=149138 Win=0 Len=0
766043 247.585449 77.197.210.67 -> 41.177.26.15 TCP 64 16155 > http [ACK] Seq=309 Ack=8465 Win=65535 Len=0
766094 247.604447 77.197.210.67 -> 41.177.26.91 TCP 64 22377 > http [ACK] Seq=310 Ack=5841 Win=65535 Len=0
766095 247.604466 77.197.210.67 -> 41.177.26.91 TCP 64 22377 > http [ACK] Seq=310 Ack=8761 Win=65535 Len=0
766225 247.668404 77.197.210.67 -> 41.177.26.15 TCP 64 16155 > http [ACK] Seq=309 Ack=15765 Win=62343 Len=0
766226 247.668409 77.197.210.67 -> 41.177.26.15 TCP 64 [TCP Window Update] 16155 > http [ACK] Seq=309 Ack=15765 Win=65535 Len=0
766321 247.687866 77.197.210.67 -> 41.177.26.91 TCP 64 22377 > http [ACK] Seq=310 Ack=15571 Win=65535 Len=0
766329 247.691518 77.197.210.67 -> 41.177.26.91 TCP 64 22377 > http [RST, ACK] Seq=310 Ack=15571 Win=0 Len=0
766428 247.750235 77.197.210.67 -> 41.177.26.15 TCP 64 16155 > http [ACK] Seq=309 Ack=21045 Win=65535 Len=0
766429 247.750239 77.197.210.67 -> 41.177.26.15 TCP 64 16155 > http [ACK] Seq=309 Ack=23965 Win=65527 Len=0
766430 247.750244 77.197.210.67 -> 41.177.26.15 TCP 64 [TCP Dup ACK 766429#1] 16155 > http [ACK] Seq=309 Ack=23965 Win=65527 Len=0
766655 247.833008 77.197.210.67 -> 41.177.26.15 TCP 64 16155 > http [ACK] Seq=309 Ack=34525 Win=63167 Len=0
766656 247.833012 77.197.210.67 -> 41.177.26.15 TCP 64 [TCP Window Update] 16155 > http [ACK] Seq=309 Ack=34525 Win=65535 Len=0
766857 247.915454 77.197.210.67 -> 41.177.26.15 TCP 64 16155 > http [ACK] Seq=309 Ack=38905 Win=65535 Len=0
766858 247.915525 77.197.210.67 -> 41.177.26.15 TCP 64 16155 > http [ACK] Seq=309 Ack=41265 Win=65535 Len=0
766859 247.915529 77.197.210.67 -> 41.177.26.15 TCP 64 16155 > http [ACK] Seq=309 Ack=42725 Win=65535 Len=0
766860 247.915559 77.197.210.67 -> 41.177.26.15 TCP 64 16155 > http [ACK] Seq=309 Ack=45645 Win=65535 Len=0
767147 247.997772 77.197.210.67 -> 41.177.26.15 TCP 64 16155 > http [ACK] Seq=309 Ack=48565 Win=65535 Len=0
767149 247.997945 77.197.210.67 -> 41.177.26.15 TCP 64 16155 > http [ACK] Seq=309 Ack=50925 Win=65535 Len=0
767150 247.997950 77.197.210.67 -> 41.177.26.15 TCP 64 16155 > http [ACK] Seq=309 Ack=53845 Win=65535 Len=0
767152 247.998064 77.197.210.67 -> 41.177.26.15 TCP 64 16155 > http [ACK] Seq=309 Ack=55305 Win=65535 Len=0
767153 247.998068 77.197.210.67 -> 41.177.26.15 TCP 64 16155 > http [ACK] Seq=309 Ack=57665 Win=65535 Len=0
767154 247.998073 77.197.210.67 -> 41.177.26.15 TCP 64 16155 > http [ACK] Seq=309 Ack=60585 Win=65535 Len=0
767158 247.998239 77.197.210.67 -> 41.177.26.15 TCP 64 16155 > http [ACK] Seq=309 Ack=63505 Win=65535 Len=0
767417 248.079970 77.197.210.67 -> 41.177.26.15 TCP 64 16155 > http [ACK] Seq=309 Ack=65865 Win=65535 Len=0
767418 248.080184 77.197.210.67 -> 41.177.26.15 TCP 64 16155 > http [ACK] Seq=309 Ack=68785 Win=65535 Len=0
767420 248.080226 77.197.210.67 -> 41.177.26.15 TCP 64 16155 > http [ACK] Seq=309 Ack=70245 Win=65535 Len=0
767425 248.080373 77.197.210.67 -> 41.177.26.15 TCP 64 16155 > http [ACK] Seq=309 Ack=74065 Win=65535 Len=0
767434 248.080858 77.197.210.67 -> 41.177.26.15 TCP 64 16155 > http [ACK] Seq=309 Ack=76985 Win=65535 Len=0
767437 248.081067 77.197.210.67 -> 41.177.26.15 TCP 64 16155 > http [ACK] Seq=309 Ack=79905 Win=65535 Len=0
767440 248.081163 77.197.210.67 -> 41.177.26.15 TCP 64 16155 > http [ACK] Seq=309 Ack=82265 Win=65535 Len=0
767443 248.081280 77.197.210.67 -> 41.177.26.15 TCP 64 16155 > http [ACK] Seq=309 Ack=85185 Win=65535 Len=0
767451 248.081515 77.197.210.67 -> 41.177.26.15 TCP 64 16155 > http [ACK] Seq=309 Ack=88105 Win=65535 Len=0
767452 248.081520 77.197.210.67 -> 41.177.26.15 TCP 64 16155 > http [ACK] Seq=309 Ack=90465 Win=65535 Len=0
767707 248.164533 77.197.210.67 -> 41.177.26.15 TCP 64 16155 > http [ACK] Seq=309 Ack=111245 Win=52947 Len=0
767708 248.164538 77.197.210.67 -> 41.177.26.15 TCP 64 [TCP Window Update] 16155 > http [ACK] Seq=309 Ack=111245 Win=65535 Len=0
767715 248.164872 77.197.210.67 -> 41.177.26.15 TCP 64 16155 > http [ACK] Seq=309 Ack=115065 Win=61715 Len=0
767730 248.166268 77.197.210.67 -> 41.177.26.15 TCP 64 [TCP Window Update] 16155 > http [ACK] Seq=309 Ack=115065 Win=65187 Len=0
767731 248.166273 77.197.210.67 -> 41.177.26.15 TCP 64 [TCP Dup ACK 767730#1] 16155 > http [ACK] Seq=309 Ack=115065 Win=65187 Len=0
767746 248.169412 77.197.210.67 -> 41.177.26.15 TCP 64 16155 > http [ACK] Seq=309 Ack=132925 Win=55867 Len=0
767747 248.169417 77.197.210.67 -> 41.177.26.15 TCP 64 [TCP Window Update] 16155 > http [ACK] Seq=309 Ack=132925 Win=65535 Len=0
767895 248.250299 77.197.210.67 -> 41.177.26.15 TCP 64 16155 > http [ACK] Seq=309 Ack=160445 Win=46207 Len=0
767896 248.250304 77.197.210.67 -> 41.177.26.15 TCP 64 [TCP Window Update] 16155 > http [ACK] Seq=309 Ack=160445 Win=65535 Len=0
767919 248.252827 77.197.210.67 -> 41.177.26.15 TCP 64 16155 > http [ACK] Seq=309 Ack=178305 Win=55867 Len=0
767920 248.252832 77.197.210.67 -> 41.177.26.15 TCP 64 [TCP Window Update] 16155 > http [ACK] Seq=309 Ack=178305 Win=65535 Len=0
767930 248.253177 77.197.210.67 -> 41.177.26.15 TCP 64 16155 > http [ACK] Seq=309 Ack=179765 Win=65535 Len=0
768051 248.333524 77.197.210.67 -> 41.177.26.15 TCP 64 16155 > http [ACK] Seq=309 Ack=182125 Win=65535 Len=0
768055 248.333790 77.197.210.67 -> 41.177.26.15 TCP 64 16155 > http [ACK] Seq=309 Ack=185045 Win=65535 Len=0
768056 248.333794 77.197.210.67 -> 41.177.26.15 TCP 64 16155 > http [ACK] Seq=309 Ack=187965 Win=65527 Len=0
768057 248.333798 77.197.210.67 -> 41.177.26.15 TCP 64 [TCP Dup ACK 768056#1] 16155 > http [ACK] Seq=309 Ack=187965 Win=65527 Len=0
768058 248.333803 77.197.210.67 -> 41.177.26.15 TCP 64 16155 > http [ACK] Seq=309 Ack=190325 Win=65535 Len=0
768059 248.333946 77.197.210.67 -> 41.177.26.15 TCP 64 16155 > http [ACK] Seq=309 Ack=194705 Win=65535 Len=0
768061 248.333990 77.197.210.67 -> 41.177.26.15 TCP 64 16155 > http [ACK] Seq=309 Ack=197065 Win=64635 Len=0
768066 248.334123 77.197.210.67 -> 41.177.26.15 TCP 64 16155 > http [ACK] Seq=309 Ack=199985 Win=61715 Len=0
768067 248.334127 77.197.210.67 -> 41.177.26.15 TCP 64 16155 > http [ACK] Seq=309 Ack=202905 Win=58795 Len=0
768068 248.334131 77.197.210.67 -> 41.177.26.15 TCP 64 16155 > http [ACK] Seq=309 Ack=205265 Win=56435 Len=0
768070 248.334140 77.197.210.67 -> 41.177.26.15 TCP 64 16155 > http [ACK] Seq=309 Ack=208185 Win=53515 Len=0
768101 248.335067 77.197.210.67 -> 41.177.26.15 TCP 64 16155 > http [ACK] Seq=309 Ack=209645 Win=55527 Len=0
768102 248.335072 77.197.210.67 -> 41.177.26.15 TCP 64 [TCP Window Update] 16155 > http [ACK] Seq=309 Ack=209645 Win=65535 Len=0
768115 248.336670 77.197.210.67 -> 41.177.26.15 TCP 64 16155 > http [ACK] Seq=309 Ack=212565 Win=65535 Len=0
768118 248.336898 77.197.210.67 -> 41.177.26.15 TCP 70 [TCP Dup ACK 768115#1] 16155 > http [ACK] Seq=309 Ack=212565 Win=65535 Len=0 SLE=213465 SRE=214925
768119 248.336903 77.197.210.67 -> 41.177.26.15 TCP 70 [TCP Dup ACK 768115#2] 16155 > http [ACK] Seq=309 Ack=212565 Win=65535 Len=0 SLE=213465 SRE=216385
768120 248.336907 77.197.210.67 -> 41.177.26.15 TCP 70 [TCP Dup ACK 768115#3] 16155 > http [ACK] Seq=309 Ack=212565 Win=65535 Len=0 SLE=213465 SRE=217845
768121 248.336911 77.197.210.67 -> 41.177.26.15 TCP 70 [TCP Dup ACK 768115#4] 16155 > http [ACK] Seq=309 Ack=212565 Win=65535 Len=0 SLE=213465 SRE=219305
768124 248.337184 77.197.210.67 -> 41.177.26.15 TCP 70 [TCP Dup ACK 768115#5] 16155 > http [ACK] Seq=309 Ack=212565 Win=65535 Len=0 SLE=213465 SRE=220765
768125 248.337188 77.197.210.67 -> 41.177.26.15 TCP 70 [TCP Dup ACK 768115#6] 16155 > http [ACK] Seq=309 Ack=212565 Win=65535 Len=0 SLE=213465 SRE=221665
768126 248.337192 77.197.210.67 -> 41.177.26.15 TCP 70 [TCP Dup ACK 768115#7] 16155 > http [ACK] Seq=309 Ack=212565 Win=65535 Len=0 SLE=213465 SRE=223125
768127 248.337196 77.197.210.67 -> 41.177.26.15 TCP 70 [TCP Dup ACK 768115#8] 16155 > http [ACK] Seq=309 Ack=212565 Win=65535 Len=0 SLE=213465 SRE=224585
768128 248.337335 77.197.210.67 -> 41.177.26.15 TCP 70 [TCP Dup ACK 768115#9] 16155 > http [ACK] Seq=309 Ack=212565 Win=65535 Len=0 SLE=213465 SRE=226045
768129 248.337339 77.197.210.67 -> 41.177.26.15 TCP 70 [TCP Dup ACK 768115#10] 16155 > http [ACK] Seq=309 Ack=212565 Win=65535 Len=0 SLE=213465 SRE=227505
768130 248.337344 77.197.210.67 -> 41.177.26.15 TCP 70 [TCP Dup ACK 768115#11] 16155 > http [ACK] Seq=309 Ack=212565 Win=65535 Len=0 SLE=213465 SRE=228965
768131 248.337562 77.197.210.67 -> 41.177.26.15 TCP 70 [TCP Dup ACK 768115#12] 16155 > http [ACK] Seq=309 Ack=212565 Win=65535 Len=0 SLE=213465 SRE=229865
768132 248.337880 77.197.210.67 -> 41.177.26.15 TCP 70 [TCP Dup ACK 768115#13] 16155 > http [ACK] Seq=309 Ack=212565 Win=65535 Len=0 SLE=213465 SRE=231325
768240 248.415822 77.197.210.67 -> 41.177.26.15 TCP 70 [TCP Dup ACK 768115#14] 16155 > http [ACK] Seq=309 Ack=212565 Win=65535 Len=0 SLE=213465 SRE=232785
768241 248.415929 77.197.210.67 -> 41.177.26.15 TCP 70 [TCP Dup ACK 768115#15] 16155 > http [ACK] Seq=309 Ack=212565 Win=65535 Len=0 SLE=213465 SRE=234245
768242 248.415934 77.197.210.67 -> 41.177.26.15 TCP 70 [TCP Dup ACK 768115#16] 16155 > http [ACK] Seq=309 Ack=212565 Win=65535 Len=0 SLE=213465 SRE=235705
768243 248.416083 77.197.210.67 -> 41.177.26.15 TCP 70 [TCP Dup ACK 768115#17] 16155 > http [ACK] Seq=309 Ack=212565 Win=65535 Len=0 SLE=213465 SRE=237165
768244 248.416088 77.197.210.67 -> 41.177.26.15 TCP 70 [TCP Dup ACK 768115#18] 16155 > http [ACK] Seq=309 Ack=212565 Win=65535 Len=0 SLE=213465 SRE=238065
768245 248.416092 77.197.210.67 -> 41.177.26.15 TCP 70 [TCP Dup ACK 768115#19] 16155 > http [ACK] Seq=309 Ack=212565 Win=65535 Len=0 SLE=213465 SRE=239525
768246 248.416096 77.197.210.67 -> 41.177.26.15 TCP 70 [TCP Dup ACK 768115#20] 16155 > http [ACK] Seq=309 Ack=212565 Win=65535 Len=0 SLE=213465 SRE=240985
768247 248.416100 77.197.210.67 -> 41.177.26.15 TCP 70 [TCP Dup ACK 768115#21] 16155 > http [ACK] Seq=309 Ack=212565 Win=65535 Len=0 SLE=213465 SRE=242445
768248 248.416104 77.197.210.67 -> 41.177.26.15 TCP 70 [TCP Dup ACK 768115#22] 16155 > http [ACK] Seq=309 Ack=212565 Win=65535 Len=0 SLE=213465 SRE=243905
768249 248.416184 77.197.210.67 -> 41.177.26.15 TCP 70 [TCP Dup ACK 768115#23] 16155 > http [ACK] Seq=309 Ack=212565 Win=65535 Len=0 SLE=213465 SRE=245365
768250 248.416189 77.197.210.67 -> 41.177.26.15 TCP 70 [TCP Dup ACK 768115#24] 16155 > http [ACK] Seq=309 Ack=212565 Win=65535 Len=0 SLE=213465 SRE=246265
768251 248.416193 77.197.210.67 -> 41.177.26.15 TCP 70 [TCP Dup ACK 768115#25] 16155 > http [ACK] Seq=309 Ack=212565 Win=65535 Len=0 SLE=213465 SRE=247725
768252 248.416196 77.197.210.67 -> 41.177.26.15 TCP 70 [TCP Dup ACK 768115#26] 16155 > http [ACK] Seq=309 Ack=212565 Win=65535 Len=0 SLE=213465 SRE=249185
768253 248.416200 77.197.210.67 -> 41.177.26.15 TCP 70 [TCP Dup ACK 768115#27] 16155 > http [ACK] Seq=309 Ack=212565 Win=65535 Len=0 SLE=213465 SRE=250645
768254 248.416205 77.197.210.67 -> 41.177.26.15 TCP 70 [TCP Dup ACK 768115#28] 16155 > http [ACK] Seq=309 Ack=212565 Win=65535 Len=0 SLE=213465 SRE=252105
768255 248.416229 77.197.210.67 -> 41.177.26.15 TCP 70 [TCP Dup ACK 768115#29] 16155 > http [ACK] Seq=309 Ack=212565 Win=65535 Len=0 SLE=213465 SRE=253565
768256 248.416233 77.197.210.67 -> 41.177.26.15 TCP 70 [TCP Dup ACK 768115#30] 16155 > http [ACK] Seq=309 Ack=212565 Win=65535 Len=0 SLE=213465 SRE=254465
768257 248.416357 77.197.210.67 -> 41.177.26.15 TCP 70 [TCP Dup ACK 768115#31] 16155 > http [ACK] Seq=309 Ack=212565 Win=65535 Len=0 SLE=213465 SRE=255925
768258 248.416362 77.197.210.67 -> 41.177.26.15 TCP 70 [TCP Dup ACK 768115#32] 16155 > http [ACK] Seq=309 Ack=212565 Win=65535 Len=0 SLE=213465 SRE=257385
768259 248.416366 77.197.210.67 -> 41.177.26.15 TCP 70 [TCP Dup ACK 768115#33] 16155 > http [ACK] Seq=309 Ack=212565 Win=65535 Len=0 SLE=213465 SRE=258845
768260 248.416370 77.197.210.67 -> 41.177.26.15 TCP 70 [TCP Dup ACK 768115#34] 16155 > http [ACK] Seq=309 Ack=212565 Win=65535 Len=0 SLE=213465 SRE=260305
768261 248.416928 77.197.210.67 -> 41.177.26.15 TCP 70 [TCP Dup ACK 768115#35] 16155 > http [ACK] Seq=309 Ack=212565 Win=65535 Len=0 SLE=213465 SRE=261765
768262 248.416933 77.197.210.67 -> 41.177.26.15 TCP 70 [TCP Dup ACK 768115#36] 16155 > http [ACK] Seq=309 Ack=212565 Win=65535 Len=0 SLE=213465 SRE=262665
768263 248.416937 77.197.210.67 -> 41.177.26.15 TCP 70 [TCP Dup ACK 768115#37] 16155 > http [ACK] Seq=309 Ack=212565 Win=65535 Len=0 SLE=213465 SRE=264125
768264 248.417028 77.197.210.67 -> 41.177.26.15 TCP 70 [TCP Dup ACK 768115#38] 16155 > http [ACK] Seq=309 Ack=212565 Win=65535 Len=0 SLE=213465 SRE=265585
768265 248.417186 77.197.210.67 -> 41.177.26.15 TCP 70 [TCP Dup ACK 768115#39] 16155 > http [ACK] Seq=309 Ack=212565 Win=65535 Len=0 SLE=213465 SRE=267045
768266 248.417191 77.197.210.67 -> 41.177.26.15 TCP 70 [TCP Dup ACK 768115#40] 16155 > http [ACK] Seq=309 Ack=212565 Win=65535 Len=0 SLE=213465 SRE=268505
768267 248.417195 77.197.210.67 -> 41.177.26.15 TCP 70 [TCP Dup ACK 768115#41] 16155 > http [ACK] Seq=309 Ack=212565 Win=65535 Len=0 SLE=213465 SRE=269965
768268 248.417372 77.197.210.67 -> 41.177.26.15 TCP 70 [TCP Dup ACK 768115#42] 16155 > http [ACK] Seq=309 Ack=212565 Win=65535 Len=0 SLE=213465 SRE=270865
768269 248.417377 77.197.210.67 -> 41.177.26.15 TCP 70 [TCP Dup ACK 768115#43] 16155 > http [ACK] Seq=309 Ack=212565 Win=65535 Len=0 SLE=213465 SRE=272325
768270 248.417403 77.197.210.67 -> 41.177.26.15 TCP 70 [TCP Dup ACK 768115#44] 16155 > http [ACK] Seq=309 Ack=212565 Win=65535 Len=0 SLE=213465 SRE=273785
768273 248.419246 77.197.210.67 -> 41.177.26.15 TCP 70 [TCP Dup ACK 768115#45] 16155 > http [ACK] Seq=309 Ack=212565 Win=65535 Len=0 SLE=213465 SRE=275245
768274 248.419251 77.197.210.67 -> 41.177.26.15 TCP 70 [TCP Dup ACK 768115#46] 16155 > http [ACK] Seq=309 Ack=212565 Win=65535 Len=0 SLE=213465 SRE=276705
768275 248.419701 77.197.210.67 -> 41.177.26.15 TCP 64 16155 > http [ACK] Seq=309 Ack=276705 Win=6667 Len=0
768276 248.419705 77.197.210.67 -> 41.177.26.15 TCP 64 [TCP Window Update] 16155 > http [ACK] Seq=309 Ack=276705 Win=65535 Len=0
768408 248.502379 77.197.210.67 -> 41.177.26.15 TCP 64 16155 > http [ACK] Seq=309 Ack=279065 Win=65535 Len=0
768409 248.502835 77.197.210.67 -> 41.177.26.15 TCP 64 16155 > http [ACK] Seq=309 Ack=281985 Win=65535 Len=0
768410 248.502840 77.197.210.67 -> 41.177.26.15 TCP 64 16155 > http [ACK] Seq=309 Ack=285384 Win=65048 Len=0
768411 248.502844 77.197.210.67 -> 41.177.26.15 TCP 64 [TCP Dup ACK 768410#1] 16155 > http [ACK] Seq=309 Ack=285384 Win=65048 Len=0
768477 248.531188 77.197.210.67 -> 41.177.26.15 TCP 64 16155 > http [RST, ACK] Seq=309 Ack=285384 Win=0 Len=0
786152 255.043598 77.197.210.67 -> 41.177.26.91 TCP 66 27143 > http [SYN] Seq=0 Win=65535 Len=0 MSS=1460 SACK_PERM=1
786268 255.126136 77.197.210.67 -> 41.177.26.91 TCP 64 27143 > http [ACK] Seq=1 Ack=1 Win=65535 Len=0
786524 255.302405 77.197.210.67 -> 41.177.26.91 TCP 64 27143 > http [ACK] Seq=314 Ack=2921 Win=65535 Len=0
786811 255.384426 77.197.210.67 -> 41.177.26.91 TCP 64 27143 > http [ACK] Seq=314 Ack=5841 Win=65535 Len=0
786812 255.384460 77.197.210.67 -> 41.177.26.91 TCP 64 27143 > http [ACK] Seq=314 Ack=8761 Win=65535 Len=0
787037 255.466724 77.197.210.67 -> 41.177.26.91 TCP 64 27143 > http [ACK] Seq=314 Ack=11681 Win=65535 Len=0
787038 255.466747 77.197.210.67 -> 41.177.26.91 TCP 64 27143 > http [ACK] Seq=314 Ack=14601 Win=65535 Len=0
787045 255.469110 77.197.210.67 -> 41.177.26.91 TCP 64 27143 > http [RST, ACK] Seq=314 Ack=15609 Win=0 Len=0
