87083  33.705011 77.197.128.46 -> 41.177.26.176 TCP 66 6292 > http [SYN] Seq=0 Win=65535 Len=0 MSS=1460 SACK_PERM=1
87276  33.784095 77.197.128.46 -> 41.177.26.176 TCP 64 6292 > http [ACK] Seq=1 Ack=1 Win=65535 Len=0
88563  34.228313 77.197.128.46 -> 41.177.26.176 TCP 64 6292 > http [ACK] Seq=309 Ack=2431 Win=65535 Len=0
88566  34.228466 77.197.128.46 -> 41.177.26.176 TCP 64 6292 > http [ACK] Seq=309 Ack=3915 Win=65535 Len=0
88814  34.307401 77.197.128.46 -> 41.177.26.176 TCP 64 6292 > http [ACK] Seq=309 Ack=7549 Win=65535 Len=0
88815  34.307552 77.197.128.46 -> 41.177.26.176 TCP 64 6292 > http [ACK] Seq=309 Ack=10469 Win=65535 Len=0
89056  34.386561 77.197.128.46 -> 41.177.26.176 TCP 64 6292 > http [RST, ACK] Seq=309 Ack=11493 Win=0 Len=0
91200  35.055159 77.197.128.46 -> 41.177.26.176 TCP 66 7611 > http [SYN] Seq=0 Win=65535 Len=0 MSS=1460 SACK_PERM=1
91473  35.135158 77.197.128.46 -> 41.177.26.176 TCP 64 7611 > http [ACK] Seq=1 Ack=1 Win=65535 Len=0
93075  35.584355 77.197.128.46 -> 41.177.26.176 TCP 64 7611 > http [ACK] Seq=318 Ack=2431 Win=65535 Len=0
93077  35.584364 77.197.128.46 -> 41.177.26.176 TCP 64 7611 > http [ACK] Seq=318 Ack=3902 Win=65535 Len=0
93378  35.663629 77.197.128.46 -> 41.177.26.176 TCP 64 7611 > http [ACK] Seq=318 Ack=8218 Win=65535 Len=0
93379  35.663633 77.197.128.46 -> 41.177.26.176 TCP 64 7611 > http [ACK] Seq=318 Ack=11074 Win=65535 Len=0
93382  35.663798 77.197.128.46 -> 41.177.26.176 TCP 64 7611 > http [RST, ACK] Seq=318 Ack=11074 Win=0 Len=0
94737  35.881471 77.197.128.46 -> 41.177.26.176 TCP 66 10670 > http [SYN] Seq=0 Win=65535 Len=0 MSS=1460 SACK_PERM=1
95043  35.962700 77.197.128.46 -> 41.177.26.176 TCP 64 10670 > http [ACK] Seq=1 Ack=1 Win=65535 Len=0
96955  36.417752 77.197.128.46 -> 41.177.26.176 TCP 64 10670 > http [ACK] Seq=309 Ack=2924 Win=65535 Len=0
97250  36.496858 77.197.128.46 -> 41.177.26.176 TCP 64 10670 > http [ACK] Seq=309 Ack=6089 Win=65535 Len=0
97892  36.575954 77.197.128.46 -> 41.177.26.176 TCP 64 10670 > http [ACK] Seq=309 Ack=8276 Win=65535 Len=0
97893  36.575959 77.197.128.46 -> 41.177.26.176 TCP 64 10670 > http [ACK] Seq=309 Ack=11559 Win=65535 Len=0
97894  36.576152 77.197.128.46 -> 41.177.26.176 TCP 64 10670 > http [RST, ACK] Seq=309 Ack=11559 Win=0 Len=0
98392  36.709119 77.197.128.46 -> 41.177.26.176 TCP 66 11115 > http [SYN] Seq=0 Win=65535 Len=0 MSS=1460 SACK_PERM=1
98691  36.788595 77.197.128.46 -> 41.177.26.176 TCP 64 11115 > http [ACK] Seq=1 Ack=1 Win=65535 Len=0
100878  37.199234 77.197.128.46 -> 41.177.26.176 TCP 64 11115 > http [ACK] Seq=354 Ack=2431 Win=65535 Len=0
100879  37.199239 77.197.128.46 -> 41.177.26.176 TCP 64 11115 > http [ACK] Seq=354 Ack=4051 Win=65535 Len=0
101341  37.278296 77.197.128.46 -> 41.177.26.176 TCP 64 11115 > http [ACK] Seq=354 Ack=7938 Win=65535 Len=0
101345  37.278492 77.197.128.46 -> 41.177.26.176 TCP 64 11115 > http [ACK] Seq=354 Ack=11221 Win=65535 Len=0
101348  37.278666 77.197.128.46 -> 41.177.26.176 TCP 64 11115 > http [RST, ACK] Seq=354 Ack=11221 Win=0 Len=0
101580  37.314467 77.197.128.46 -> 41.177.26.176 TCP 66 11430 > http [SYN] Seq=0 Win=65535 Len=0 MSS=1460 SACK_PERM=1
102015  37.394095 77.197.128.46 -> 41.177.26.176 TCP 64 11430 > http [ACK] Seq=1 Ack=1 Win=65535 Len=0
104518  37.829853 77.197.128.46 -> 41.177.26.176 TCP 64 11430 > http [ACK] Seq=309 Ack=3914 Win=65535 Len=0
104789  37.908948 77.197.128.46 -> 41.177.26.176 TCP 64 11430 > http [ACK] Seq=309 Ack=6088 Win=65535 Len=0
104790  37.909113 77.197.128.46 -> 41.177.26.176 TCP 64 11430 > http [ACK] Seq=309 Ack=9547 Win=65535 Len=0
105198  37.989123 77.197.128.46 -> 41.177.26.176 TCP 64 11430 > http [ACK] Seq=309 Ack=11193 Win=65535 Len=0
105199  37.989254 77.197.128.46 -> 41.177.26.176 TCP 64 11430 > http [RST, ACK] Seq=309 Ack=11193 Win=0 Len=0
105653  38.109572 77.197.128.46 -> 41.177.26.176 TCP 66 11825 > http [SYN] Seq=0 Win=65535 Len=0 MSS=1460 SACK_PERM=1
105800  38.189041 77.197.128.46 -> 41.177.26.176 TCP 64 11825 > http [ACK] Seq=1 Ack=1 Win=65535 Len=0
109583  39.308993 77.197.128.46 -> 41.177.26.176 TCP 64 11825 > http [ACK] Seq=318 Ack=1639 Win=65535 Len=0
109637  39.320738 77.197.128.46 -> 41.177.26.176 TCP 64 11825 > http [ACK] Seq=318 Ack=2383 Win=64791 Len=0
109640  39.320988 77.197.128.46 -> 41.177.26.176 TCP 64 11825 > http [ACK] Seq=318 Ack=2829 Win=64345 Len=0
109642  39.321085 77.197.128.46 -> 41.177.26.176 TCP 64 11825 > http [ACK] Seq=318 Ack=3760 Win=65535 Len=0
109957  39.388088 77.197.128.46 -> 41.177.26.176 TCP 64 11825 > http [ACK] Seq=318 Ack=6548 Win=65535 Len=0
110006  39.400088 77.197.128.46 -> 41.177.26.176 TCP 64 11825 > http [ACK] Seq=318 Ack=9468 Win=65535 Len=0
110007  39.400310 77.197.128.46 -> 41.177.26.176 TCP 64 11825 > http [RST, ACK] Seq=318 Ack=10484 Win=0 Len=0
110012  39.403349 77.197.128.46 -> 41.177.26.176 TCP 66 12359 > http [SYN] Seq=0 Win=65535 Len=0 MSS=1460 SACK_PERM=1
110232  39.482637 77.197.128.46 -> 41.177.26.176 TCP 64 12359 > http [ACK] Seq=1 Ack=1 Win=65535 Len=0
111604  39.871830 77.197.128.46 -> 41.177.26.176 TCP 64 12359 > http [ACK] Seq=301 Ack=2431 Win=65535 Len=0
111605  39.871941 77.197.128.46 -> 41.177.26.176 TCP 64 12359 > http [ACK] Seq=301 Ack=3908 Win=65535 Len=0
111975  39.951198 77.197.128.46 -> 41.177.26.176 TCP 64 12359 > http [ACK] Seq=301 Ack=6082 Win=65535 Len=0
111976  39.951305 77.197.128.46 -> 41.177.26.176 TCP 64 12359 > http [ACK] Seq=301 Ack=11172 Win=65535 Len=0
111977  39.951575 77.197.128.46 -> 41.177.26.176 TCP 64 12359 > http [RST, ACK] Seq=301 Ack=11172 Win=0 Len=0
112129  40.002891 77.197.128.46 -> 41.177.26.176 TCP 66 12566 > http [SYN] Seq=0 Win=65535 Len=0 MSS=1460 SACK_PERM=1
112455  40.081892 77.197.128.46 -> 41.177.26.176 TCP 64 12566 > http [ACK] Seq=1 Ack=1 Win=65535 Len=0
113880  40.536510 77.197.128.46 -> 41.177.26.176 TCP 64 12566 > http [ACK] Seq=309 Ack=2431 Win=65535 Len=0
114001  40.615712 77.197.128.46 -> 41.177.26.176 TCP 64 12566 > http [ACK] Seq=309 Ack=5351 Win=65535 Len=0
114002  40.615841 77.197.128.46 -> 41.177.26.176 TCP 64 12566 > http [ACK] Seq=309 Ack=7529 Win=65535 Len=0
114148  40.695125 77.197.128.46 -> 41.177.26.176 TCP 64 12566 > http [ACK] Seq=309 Ack=11633 Win=64525 Len=0
114149  40.695251 77.197.128.46 -> 41.177.26.176 TCP 64 [TCP Dup ACK 114148#1] 12566 > http [ACK] Seq=309 Ack=11633 Win=64525 Len=0
114150  40.695371 77.197.128.46 -> 41.177.26.176 TCP 64 12566 > http [RST, ACK] Seq=309 Ack=11633 Win=0 Len=0
114325  40.806101 77.197.128.46 -> 41.177.26.176 TCP 66 12842 > http [SYN] Seq=0 Win=65535 Len=0 MSS=1460 SACK_PERM=1
114443  40.885286 77.197.128.46 -> 41.177.26.176 TCP 64 12842 > http [ACK] Seq=1 Ack=1 Win=65535 Len=0
116032  41.394857 77.197.128.46 -> 41.177.26.176 TCP 64 12842 > http [ACK] Seq=355 Ack=2429 Win=65535 Len=0
116033  41.394998 77.197.128.46 -> 41.177.26.176 TCP 64 12842 > http [ACK] Seq=355 Ack=4062 Win=65535 Len=0
116225  41.474801 77.197.128.46 -> 41.177.26.176 TCP 64 12842 > http [ACK] Seq=355 Ack=5949 Win=65535 Len=0
116226  41.474806 77.197.128.46 -> 41.177.26.176 TCP 64 12842 > http [ACK] Seq=355 Ack=8444 Win=65535 Len=0
116227  41.474905 77.197.128.46 -> 41.177.26.176 TCP 64 12842 > http [ACK] Seq=355 Ack=11006 Win=65535 Len=0
116228  41.475088 77.197.128.46 -> 41.177.26.176 TCP 64 12842 > http [RST, ACK] Seq=355 Ack=11006 Win=0 Len=0
116694  41.669727 77.197.128.46 -> 41.177.26.176 TCP 66 13113 > http [SYN] Seq=0 Win=65535 Len=0 MSS=1460 SACK_PERM=1
116794  41.748742 77.197.128.46 -> 41.177.26.176 TCP 64 13113 > http [ACK] Seq=1 Ack=1 Win=65535 Len=0
117506  42.148721 77.197.128.46 -> 41.177.26.176 TCP 64 13113 > http [ACK] Seq=310 Ack=2431 Win=65535 Len=0
117508  42.149001 77.197.128.46 -> 41.177.26.176 TCP 64 13113 > http [ACK] Seq=310 Ack=3907 Win=65535 Len=0
117746  42.227854 77.197.128.46 -> 41.177.26.176 TCP 64 13113 > http [ACK] Seq=310 Ack=7541 Win=65535 Len=0
117748  42.228126 77.197.128.46 -> 41.177.26.176 TCP 64 13113 > http [ACK] Seq=310 Ack=9367 Win=65535 Len=0
117749  42.228157 77.197.128.46 -> 41.177.26.176 TCP 64 13113 > http [ACK] Seq=310 Ack=11190 Win=65535 Len=0
117750  42.228273 77.197.128.46 -> 41.177.26.176 TCP 64 13113 > http [RST, ACK] Seq=310 Ack=11190 Win=0 Len=0
117770  42.237275 77.197.128.46 -> 41.177.26.176 TCP 66 13282 > http [SYN] Seq=0 Win=65535 Len=0 MSS=1460 SACK_PERM=1
117941  42.317279 77.197.128.46 -> 41.177.26.176 TCP 64 13282 > http [ACK] Seq=1 Ack=1 Win=65535 Len=0
119420  42.812692 77.197.128.46 -> 41.177.26.176 TCP 64 13282 > http [ACK] Seq=355 Ack=2431 Win=65535 Len=0
119421  42.812835 77.197.128.46 -> 41.177.26.176 TCP 64 13282 > http [ACK] Seq=355 Ack=4058 Win=65535 Len=0
119786  42.891961 77.197.128.46 -> 41.177.26.176 TCP 64 13282 > http [ACK] Seq=355 Ack=7692 Win=65535 Len=0
119787  42.892097 77.197.128.46 -> 41.177.26.176 TCP 64 13282 > http [ACK] Seq=355 Ack=11344 Win=65535 Len=0
119788  42.892478 77.197.128.46 -> 41.177.26.176 TCP 64 13282 > http [RST, ACK] Seq=355 Ack=11344 Win=0 Len=0
120717  43.047051 77.197.128.46 -> 41.177.26.176 TCP 66 13485 > http [SYN] Seq=0 Win=65535 Len=0 MSS=1460 SACK_PERM=1
121010  43.126438 77.197.128.46 -> 41.177.26.176 TCP 64 13485 > http [ACK] Seq=1 Ack=1 Win=65535 Len=0
123628  44.013929 77.197.128.46 -> 41.177.26.176 TCP 64 13485 > http [ACK] Seq=321 Ack=1482 Win=65535 Len=0
123633  44.024898 77.197.128.46 -> 41.177.26.176 TCP 64 13485 > http [ACK] Seq=321 Ack=2470 Win=64547 Len=0
123636  44.025186 77.197.128.46 -> 41.177.26.176 TCP 64 13485 > http [ACK] Seq=321 Ack=2925 Win=64092 Len=0
123723  44.092966 77.197.128.46 -> 41.177.26.176 TCP 64 13485 > http [ACK] Seq=321 Ack=4897 Win=65535 Len=0
123730  44.104674 77.197.128.46 -> 41.177.26.176 TCP 64 13485 > http [ACK] Seq=321 Ack=7499 Win=65535 Len=0
123731  44.104731 77.197.128.46 -> 41.177.26.176 TCP 64 13485 > http [ACK] Seq=321 Ack=10125 Win=65535 Len=0
123732  44.105105 77.197.128.46 -> 41.177.26.176 TCP 64 13485 > http [RST, ACK] Seq=321 Ack=10125 Win=0 Len=0
124133  44.261342 77.197.128.46 -> 41.177.26.176 TCP 66 13810 > http [SYN] Seq=0 Win=65535 Len=0 MSS=1460 SACK_PERM=1
124298  44.340342 77.197.128.46 -> 41.177.26.176 TCP 64 13810 > http [ACK] Seq=1 Ack=1 Win=65535 Len=0
125230  44.764396 77.197.128.46 -> 41.177.26.176 TCP 64 13810 > http [ACK] Seq=318 Ack=2431 Win=65535 Len=0
125231  44.764510 77.197.128.46 -> 41.177.26.176 TCP 64 13810 > http [ACK] Seq=318 Ack=3896 Win=65535 Len=0
125638  44.844221 77.197.128.46 -> 41.177.26.176 TCP 64 13810 > http [ACK] Seq=318 Ack=6070 Win=65535 Len=0
125639  44.844350 77.197.128.46 -> 41.177.26.176 TCP 64 13810 > http [ACK] Seq=318 Ack=8354 Win=65535 Len=0
126435  44.923495 77.197.128.46 -> 41.177.26.176 TCP 64 13810 > http [ACK] Seq=318 Ack=11210 Win=65535 Len=0
126442  44.923743 77.197.128.46 -> 41.177.26.176 TCP 64 13810 > http [RST, ACK] Seq=318 Ack=11210 Win=0 Len=0
128093  45.098961 77.197.128.46 -> 41.177.26.176 TCP 66 14006 > http [SYN] Seq=0 Win=65535 Len=0 MSS=1460 SACK_PERM=1
128725  45.179782 77.197.128.46 -> 41.177.26.176 TCP 64 14006 > http [ACK] Seq=1 Ack=1 Win=65535 Len=0
132362  46.113743 77.197.128.46 -> 41.177.26.176 TCP 64 14006 > http [ACK] Seq=328 Ack=1594 Win=65535 Len=0
132390  46.125060 77.197.128.46 -> 41.177.26.176 TCP 64 14006 > http [ACK] Seq=328 Ack=2492 Win=64637 Len=0
132394  46.125314 77.197.128.46 -> 41.177.26.176 TCP 64 14006 > http [ACK] Seq=328 Ack=3052 Win=64077 Len=0
132560  46.193581 77.197.128.46 -> 41.177.26.176 TCP 64 14006 > http [ACK] Seq=328 Ack=5254 Win=65535 Len=0
132597  46.204139 77.197.128.46 -> 41.177.26.176 TCP 64 14006 > http [ACK] Seq=328 Ack=7771 Win=65535 Len=0
132599  46.204494 77.197.128.46 -> 41.177.26.176 TCP 64 14006 > http [ACK] Seq=328 Ack=10303 Win=65535 Len=0
132600  46.204808 77.197.128.46 -> 41.177.26.176 TCP 64 14006 > http [RST, ACK] Seq=328 Ack=10303 Win=0 Len=0
132898  46.314871 77.197.128.46 -> 41.177.26.176 TCP 66 14263 > http [SYN] Seq=0 Win=65535 Len=0 MSS=1460 SACK_PERM=1
133116  46.393999 77.197.128.46 -> 41.177.26.176 TCP 64 14263 > http [ACK] Seq=1 Ack=1 Win=65535 Len=0
134750  46.840012 77.197.128.46 -> 41.177.26.176 TCP 64 14263 > http [ACK] Seq=353 Ack=2428 Win=65535 Len=0
134956  46.920091 77.197.128.46 -> 41.177.26.176 TCP 64 14263 > http [ACK] Seq=353 Ack=6175 Win=65535 Len=0
135185  47.000414 77.197.128.46 -> 41.177.26.176 TCP 64 14263 > http [ACK] Seq=353 Ack=9245 Win=65535 Len=0
135186  47.000523 77.197.128.46 -> 41.177.26.176 TCP 64 14263 > http [ACK] Seq=353 Ack=11571 Win=63209 Len=0
135187  47.000544 77.197.128.46 -> 41.177.26.176 TCP 64 [TCP Window Update] 14263 > http [ACK] Seq=353 Ack=11571 Win=65535 Len=0
135188  47.000902 77.197.128.46 -> 41.177.26.176 TCP 64 14263 > http [RST, ACK] Seq=353 Ack=12253 Win=0 Len=0
135422  47.109683 77.197.128.46 -> 41.177.26.176 TCP 66 14439 > http [SYN] Seq=0 Win=65535 Len=0 MSS=1460 SACK_PERM=1
135621  47.189925 77.197.128.46 -> 41.177.26.176 TCP 64 14439 > http [ACK] Seq=1 Ack=1 Win=65535 Len=0
136569  47.545270 77.197.128.46 -> 41.177.26.176 TCP 64 14439 > http [ACK] Seq=316 Ack=3893 Win=65535 Len=0
136893  47.625388 77.197.128.46 -> 41.177.26.176 TCP 64 14439 > http [ACK] Seq=316 Ack=6057 Win=65535 Len=0
136894  47.625393 77.197.128.46 -> 41.177.26.176 TCP 64 14439 > http [ACK] Seq=316 Ack=7878 Win=65535 Len=0
137264  47.705502 77.197.128.46 -> 41.177.26.176 TCP 64 14439 > http [ACK] Seq=316 Ack=11142 Win=65535 Len=0
137265  47.705764 77.197.128.46 -> 41.177.26.176 TCP 64 14439 > http [RST, ACK] Seq=316 Ack=11142 Win=0 Len=0
137292  47.718380 77.197.128.46 -> 41.177.26.176 TCP 66 14542 > http [SYN] Seq=0 Win=65535 Len=0 MSS=1460 SACK_PERM=1
137605  47.797840 77.197.128.46 -> 41.177.26.176 TCP 64 14542 > http [ACK] Seq=1 Ack=1 Win=65535 Len=0
143168  49.208541 77.197.128.46 -> 41.177.26.176 TCP 64 14542 > http [ACK] Seq=315 Ack=2271 Win=65535 Len=0
143170  49.208670 77.197.128.46 -> 41.177.26.176 TCP 64 14542 > http [ACK] Seq=315 Ack=2719 Win=65087 Len=0
143177  49.209011 77.197.128.46 -> 41.177.26.176 TCP 64 14542 > http [ACK] Seq=315 Ack=3659 Win=64147 Len=0
143420  49.288708 77.197.128.46 -> 41.177.26.176 TCP 64 14542 > http [ACK] Seq=315 Ack=6012 Win=65535 Len=0
143421  49.288942 77.197.128.46 -> 41.177.26.176 TCP 64 14542 > http [ACK] Seq=315 Ack=9837 Win=65535 Len=0
143422  49.289099 77.197.128.46 -> 41.177.26.176 TCP 64 14542 > http [RST, ACK] Seq=315 Ack=9837 Win=0 Len=0
143718  49.375197 77.197.128.46 -> 41.177.26.176 TCP 66 14915 > http [SYN] Seq=0 Win=65535 Len=0 MSS=1460 SACK_PERM=1
144012  49.454286 77.197.128.46 -> 41.177.26.176 TCP 64 14915 > http [ACK] Seq=1 Ack=1 Win=65535 Len=0
144357  49.541699 77.197.128.46 -> 41.177.26.176 TCP 64 14915 > http [ACK] Seq=297 Ack=277 Win=65259 Len=0
144358  49.541704 77.197.128.46 -> 41.177.26.176 TCP 64 14915 > http [ACK] Seq=297 Ack=924 Win=64612 Len=0
144362  49.542030 77.197.128.46 -> 41.177.26.176 TCP 64 14915 > http [ACK] Seq=297 Ack=3130 Win=65535 Len=0
144643  49.622279 77.197.128.46 -> 41.177.26.176 TCP 64 14915 > http [ACK] Seq=297 Ack=5758 Win=65535 Len=0
144644  49.622455 77.197.128.46 -> 41.177.26.176 TCP 64 14915 > http [ACK] Seq=297 Ack=8330 Win=65535 Len=0
144645  49.622647 77.197.128.46 -> 41.177.26.176 TCP 64 14915 > http [RST, ACK] Seq=297 Ack=8330 Win=0 Len=0
145160  49.768973 77.197.128.46 -> 41.177.26.176 TCP 66 14996 > http [SYN] Seq=0 Win=65535 Len=0 MSS=1460 SACK_PERM=1
145463  49.849179 77.197.128.46 -> 41.177.26.176 TCP 64 14996 > http [ACK] Seq=1 Ack=1 Win=65535 Len=0
146555  50.255737 77.197.128.46 -> 41.177.26.176 TCP 64 14996 > http [ACK] Seq=304 Ack=2431 Win=65535 Len=0
146664  50.336203 77.197.128.46 -> 41.177.26.176 TCP 64 14996 > http [ACK] Seq=304 Ack=6055 Win=65535 Len=0
146814  50.416614 77.197.128.46 -> 41.177.26.176 TCP 64 14996 > http [ACK] Seq=304 Ack=8179 Win=65535 Len=0
146815  50.416777 77.197.128.46 -> 41.177.26.176 TCP 64 14996 > http [ACK] Seq=304 Ack=11051 Win=65535 Len=0
146816  50.416952 77.197.128.46 -> 41.177.26.176 TCP 64 14996 > http [RST, ACK] Seq=304 Ack=11051 Win=0 Len=0
147484  50.611300 77.197.128.46 -> 41.177.26.176 TCP 66 15150 > http [SYN] Seq=0 Win=65535 Len=0 MSS=1460 SACK_PERM=1
147685  50.692497 77.197.128.46 -> 41.177.26.176 TCP 64 15150 > http [ACK] Seq=1 Ack=1 Win=65535 Len=0
151595  51.959233 77.197.128.46 -> 41.177.26.176 TCP 64 15150 > http [ACK] Seq=281 Ack=1506 Win=65535 Len=0
151629  51.982091 77.197.128.46 -> 41.177.26.176 TCP 64 15150 > http [ACK] Seq=281 Ack=2636 Win=64405 Len=0
151637  51.982386 77.197.128.46 -> 41.177.26.176 TCP 64 15150 > http [ACK] Seq=281 Ack=3203 Win=65535 Len=0
151638  51.982390 77.197.128.46 -> 41.177.26.176 TCP 64 15150 > http [ACK] Seq=281 Ack=4317 Win=64421 Len=0
151894  52.038527 77.197.128.46 -> 41.177.26.176 TCP 64 15150 > http [ACK] Seq=281 Ack=6699 Win=65535 Len=0
151962  52.061109 77.197.128.46 -> 41.177.26.176 TCP 64 15150 > http [ACK] Seq=281 Ack=9619 Win=65535 Len=0
151965  52.061639 77.197.128.46 -> 41.177.26.176 TCP 64 15150 > http [RST, ACK] Seq=281 Ack=10538 Win=0 Len=0
152452  52.213894 77.197.128.46 -> 41.177.26.176 TCP 66 15415 > http [SYN] Seq=0 Win=65535 Len=0 MSS=1460 SACK_PERM=1
152707  52.294678 77.197.128.46 -> 41.177.26.176 TCP 64 15415 > http [ACK] Seq=1 Ack=1 Win=65535 Len=0
157272  53.595567 77.197.128.46 -> 41.177.26.176 TCP 64 15415 > http [ACK] Seq=325 Ack=2235 Win=65535 Len=0
157274  53.595712 77.197.128.46 -> 41.177.26.176 TCP 64 15415 > http [ACK] Seq=325 Ack=4203 Win=65535 Len=0
157581  53.674996 77.197.128.46 -> 41.177.26.176 TCP 64 15415 > http [ACK] Seq=325 Ack=10380 Win=65535 Len=0
157791  53.754111 77.197.128.46 -> 41.177.26.176 TCP 64 15415 > http [ACK] Seq=325 Ack=12711 Win=65219 Len=0
157792  53.754115 77.197.128.46 -> 41.177.26.176 TCP 64 [TCP Dup ACK 157791#1] 15415 > http [ACK] Seq=325 Ack=12711 Win=65219 Len=0
157794  53.754319 77.197.128.46 -> 41.177.26.176 TCP 64 15415 > http [ACK] Seq=325 Ack=16789 Win=65535 Len=0
158017  53.833200 77.197.128.46 -> 41.177.26.176 TCP 64 15415 > http [ACK] Seq=325 Ack=19520 Win=65535 Len=0
158022  53.833610 77.197.128.46 -> 41.177.26.176 TCP 64 15415 > http [ACK] Seq=325 Ack=22412 Win=65383 Len=0
158023  53.833615 77.197.128.46 -> 41.177.26.176 TCP 64 [TCP Dup ACK 158022#1] 15415 > http [ACK] Seq=325 Ack=22412 Win=65383 Len=0
158024  53.834235 77.197.128.46 -> 41.177.26.176 TCP 64 15415 > http [RST, ACK] Seq=325 Ack=22412 Win=0 Len=0
158076  53.859679 77.197.128.46 -> 41.177.26.176 TCP 66 15611 > http [SYN] Seq=0 Win=65535 Len=0 MSS=1460 SACK_PERM=1
158406  53.938647 77.197.128.46 -> 41.177.26.176 TCP 64 15611 > http [ACK] Seq=1 Ack=1 Win=65535 Len=0
159708  54.377446 77.197.128.46 -> 41.177.26.176 TCP 64 15611 > http [ACK] Seq=355 Ack=2431 Win=65535 Len=0
159710  54.377623 77.197.128.46 -> 41.177.26.176 TCP 64 15611 > http [ACK] Seq=355 Ack=4058 Win=65535 Len=0
159860  54.456409 77.197.128.46 -> 41.177.26.176 TCP 64 15611 > http [ACK] Seq=355 Ack=6232 Win=65535 Len=0
159864  54.456611 77.197.128.46 -> 41.177.26.176 TCP 64 15611 > http [ACK] Seq=355 Ack=8590 Win=65535 Len=0
160197  54.535634 77.197.128.46 -> 41.177.26.176 TCP 64 15611 > http [ACK] Seq=355 Ack=11888 Win=65535 Len=0
160198  54.535778 77.197.128.46 -> 41.177.26.176 TCP 64 15611 > http [RST, ACK] Seq=355 Ack=11888 Win=0 Len=0
160558  54.673874 77.197.128.46 -> 41.177.26.176 TCP 66 15763 > http [SYN] Seq=0 Win=65535 Len=0 MSS=1460 SACK_PERM=1
160871  54.753097 77.197.128.46 -> 41.177.26.176 TCP 64 15763 > http [ACK] Seq=1 Ack=1 Win=65535 Len=0
161900  55.100295 77.197.128.46 -> 41.177.26.176 TCP 64 15763 > http [ACK] Seq=308 Ack=2431 Win=65535 Len=0
161901  55.100300 77.197.128.46 -> 41.177.26.176 TCP 64 15763 > http [ACK] Seq=308 Ack=3905 Win=65535 Len=0
162154  55.179390 77.197.128.46 -> 41.177.26.176 TCP 64 15763 > http [ACK] Seq=308 Ack=6069 Win=65535 Len=0
162155  55.179538 77.197.128.46 -> 41.177.26.176 TCP 64 15763 > http [ACK] Seq=308 Ack=8400 Win=65535 Len=0
162498  55.260355 77.197.128.46 -> 41.177.26.176 TCP 64 15763 > http [ACK] Seq=308 Ack=11246 Win=65535 Len=0
162499  55.260623 77.197.128.46 -> 41.177.26.176 TCP 64 15763 > http [RST, ACK] Seq=308 Ack=11246 Win=0 Len=0
163510  55.454938 77.197.128.46 -> 41.177.26.176 TCP 66 15891 > http [SYN] Seq=0 Win=65535 Len=0 MSS=1460 SACK_PERM=1
163807  55.534243 77.197.128.46 -> 41.177.26.176 TCP 64 15891 > http [ACK] Seq=1 Ack=1 Win=65535 Len=0
165855  55.927975 77.197.128.46 -> 41.177.26.176 TCP 64 15891 > http [ACK] Seq=316 Ack=2431 Win=65535 Len=0
166405  56.007045 77.197.128.46 -> 41.177.26.176 TCP 64 15891 > http [ACK] Seq=316 Ack=6050 Win=65535 Len=0
166997  56.085947 77.197.128.46 -> 41.177.26.176 TCP 64 15891 > http [ACK] Seq=316 Ack=7885 Win=65535 Len=0
167002  56.086173 77.197.128.46 -> 41.177.26.176 TCP 64 15891 > http [ACK] Seq=316 Ack=11149 Win=65009 Len=0
167003  56.086178 77.197.128.46 -> 41.177.26.176 TCP 64 [TCP Dup ACK 167002#1] 15891 > http [ACK] Seq=316 Ack=11149 Win=65009 Len=0
167007  56.086445 77.197.128.46 -> 41.177.26.176 TCP 64 15891 > http [RST, ACK] Seq=316 Ack=11149 Win=0 Len=0
168256  56.272250 77.197.128.46 -> 41.177.26.176 TCP 66 16024 > http [SYN] Seq=0 Win=65535 Len=0 MSS=1460 SACK_PERM=1
168770  56.351481 77.197.128.46 -> 41.177.26.176 TCP 64 16024 > http [ACK] Seq=1 Ack=1 Win=65535 Len=0
170644  56.729936 77.197.128.46 -> 41.177.26.176 TCP 64 16024 > http [ACK] Seq=353 Ack=3020 Win=65535 Len=0
171076  56.809082 77.197.128.46 -> 41.177.26.176 TCP 64 16024 > http [ACK] Seq=353 Ack=7676 Win=65535 Len=0
171363  56.888262 77.197.128.46 -> 41.177.26.176 TCP 64 16024 > http [ACK] Seq=353 Ack=12312 Win=64435 Len=0
171364  56.888267 77.197.128.46 -> 41.177.26.176 TCP 64 [TCP Dup ACK 171363#1] 16024 > http [ACK] Seq=353 Ack=12312 Win=64435 Len=0
171365  56.888427 77.197.128.46 -> 41.177.26.176 TCP 64 16024 > http [RST, ACK] Seq=353 Ack=12312 Win=0 Len=0
171611  57.083809 77.197.128.46 -> 41.177.26.176 TCP 66 16121 > http [SYN] Seq=0 Win=65535 Len=0 MSS=1460 SACK_PERM=1
171778  57.162791 77.197.128.46 -> 41.177.26.176 TCP 64 16121 > http [ACK] Seq=1 Ack=1 Win=65535 Len=0
173225  57.604552 77.197.128.46 -> 41.177.26.176 TCP 64 16121 > http [ACK] Seq=318 Ack=3894 Win=65535 Len=0
173531  57.684154 77.197.128.46 -> 41.177.26.176 TCP 64 16121 > http [ACK] Seq=318 Ack=8292 Win=65535 Len=0
173714  57.763438 77.197.128.46 -> 41.177.26.176 TCP 64 16121 > http [ACK] Seq=318 Ack=11568 Win=65535 Len=0
173715  57.763768 77.197.128.46 -> 41.177.26.176 TCP 64 16121 > http [RST, ACK] Seq=318 Ack=11568 Win=0 Len=0
174202  57.891918 77.197.128.46 -> 41.177.26.176 TCP 66 16187 > http [SYN] Seq=0 Win=65535 Len=0 MSS=1460 SACK_PERM=1
174490  57.971081 77.197.128.46 -> 41.177.26.176 TCP 64 16187 > http [ACK] Seq=1 Ack=1 Win=65535 Len=0
175640  58.359802 77.197.128.46 -> 41.177.26.176 TCP 64 16187 > http [ACK] Seq=309 Ack=2431 Win=65535 Len=0
175778  58.438740 77.197.128.46 -> 41.177.26.176 TCP 64 16187 > http [ACK] Seq=309 Ack=6069 Win=65535 Len=0
175917  58.517755 77.197.128.46 -> 41.177.26.176 TCP 64 16187 > http [ACK] Seq=309 Ack=8988 Win=65535 Len=0
175918  58.517775 77.197.128.46 -> 41.177.26.176 TCP 64 16187 > http [ACK] Seq=309 Ack=12031 Win=65535 Len=0
175919  58.518024 77.197.128.46 -> 41.177.26.176 TCP 64 16187 > http [RST, ACK] Seq=309 Ack=12031 Win=0 Len=0
176285  58.723904 77.197.128.46 -> 41.177.26.176 TCP 66 16245 > http [SYN] Seq=0 Win=65535 Len=0 MSS=1460 SACK_PERM=1
176350  58.803168 77.197.128.46 -> 41.177.26.176 TCP 64 16245 > http [ACK] Seq=1 Ack=1 Win=65535 Len=0
179252  60.271398 77.197.128.46 -> 41.177.26.176 TCP 64 16245 > http [ACK] Seq=322 Ack=1462 Win=65535 Len=0
179275  60.282014 77.197.128.46 -> 41.177.26.176 TCP 64 16245 > http [ACK] Seq=322 Ack=2452 Win=64545 Len=0
179276  60.282119 77.197.128.46 -> 41.177.26.176 TCP 64 16245 > http [ACK] Seq=322 Ack=3005 Win=65535 Len=0
179374  60.350382 77.197.128.46 -> 41.177.26.176 TCP 64 16245 > http [ACK] Seq=322 Ack=5416 Win=65535 Len=0
179394  60.361252 77.197.128.46 -> 41.177.26.176 TCP 64 16245 > http [ACK] Seq=322 Ack=8048 Win=65535 Len=0
179395  60.361257 77.197.128.46 -> 41.177.26.176 TCP 64 16245 > http [ACK] Seq=322 Ack=10698 Win=65535 Len=0
179396  60.361410 77.197.128.46 -> 41.177.26.176 TCP 64 16245 > http [RST, ACK] Seq=322 Ack=10698 Win=0 Len=0
179775  60.544675 77.197.128.46 -> 41.177.26.176 TCP 66 16452 > http [SYN] Seq=0 Win=65535 Len=0 MSS=1460 SACK_PERM=1
180057  60.623708 77.197.128.46 -> 41.177.26.176 TCP 64 16452 > http [ACK] Seq=1 Ack=1 Win=65535 Len=0
181403  61.003250 77.197.128.46 -> 41.177.26.176 TCP 64 16452 > http [ACK] Seq=318 Ack=2431 Win=65535 Len=0
181404  61.003255 77.197.128.46 -> 41.177.26.176 TCP 64 16452 > http [ACK] Seq=318 Ack=3896 Win=65535 Len=0
181707  61.082245 77.197.128.46 -> 41.177.26.176 TCP 64 16452 > http [ACK] Seq=318 Ack=6070 Win=65535 Len=0
181708  61.082251 77.197.128.46 -> 41.177.26.176 TCP 64 16452 > http [ACK] Seq=318 Ack=8223 Win=65535 Len=0
181710  61.082496 77.197.128.46 -> 41.177.26.176 TCP 64 16452 > http [ACK] Seq=318 Ack=11079 Win=65535 Len=0
181716  61.082709 77.197.128.46 -> 41.177.26.176 TCP 64 16452 > http [RST, ACK] Seq=318 Ack=11079 Win=0 Len=0
181932  61.160342 77.197.128.46 -> 41.177.26.176 TCP 66 16511 > http [SYN] Seq=0 Win=65535 Len=0 MSS=1460 SACK_PERM=1
182183  61.239237 77.197.128.46 -> 41.177.26.176 TCP 64 16511 > http [ACK] Seq=1 Ack=1 Win=65535 Len=0
186411  62.562226 77.197.128.46 -> 41.177.26.176 TCP 64 16511 > http [ACK] Seq=324 Ack=2592 Win=65535 Len=0
186412  62.562231 77.197.128.46 -> 41.177.26.176 TCP 64 16511 > http [ACK] Seq=324 Ack=4200 Win=65535 Len=0
186510  62.641579 77.197.128.46 -> 41.177.26.176 TCP 64 16511 > http [ACK] Seq=324 Ack=7088 Win=65535 Len=0
186512  62.641845 77.197.128.46 -> 41.177.26.176 TCP 64 16511 > http [ACK] Seq=324 Ack=9689 Win=65535 Len=0
186630  62.720650 77.197.128.46 -> 41.177.26.176 TCP 64 16511 > http [ACK] Seq=324 Ack=13673 Win=61551 Len=0
186632  62.720898 77.197.128.46 -> 41.177.26.176 TCP 64 16511 > http [ACK] Seq=324 Ack=18809 Win=56415 Len=0
186683  62.799752 77.197.128.46 -> 41.177.26.176 TCP 64 16511 > http [ACK] Seq=324 Ack=22394 Win=52830 Len=0
186684  62.799877 77.197.128.46 -> 41.177.26.176 TCP 64 16511 > http [ACK] Seq=324 Ack=27080 Win=48144 Len=0
186685  62.800032 77.197.128.46 -> 41.177.26.176 TCP 64 16511 > http [ACK] Seq=324 Ack=28638 Win=46586 Len=0
186686  62.800037 77.197.128.46 -> 41.177.26.176 TCP 64 16511 > http [ACK] Seq=324 Ack=30320 Win=44904 Len=0
187328  63.297685 77.197.128.46 -> 41.177.26.176 TCP 64 [TCP Window Update] 16511 > http [ACK] Seq=324 Ack=30320 Win=48376 Len=0
187329  63.297689 77.197.128.46 -> 41.177.26.176 TCP 64 [TCP Window Update] 16511 > http [ACK] Seq=324 Ack=30320 Win=65535 Len=0
187331  63.298477 77.197.128.46 -> 41.177.26.176 TCP 64 16511 > http [RST, ACK] Seq=324 Ack=30320 Win=0 Len=0
187760  63.563647 77.197.128.46 -> 41.177.26.176 TCP 66 16821 > http [SYN] Seq=0 Win=65535 Len=0 MSS=1460 SACK_PERM=1
187833  63.642628 77.197.128.46 -> 41.177.26.176 TCP 64 16821 > http [ACK] Seq=1 Ack=1 Win=65535 Len=0
188364  64.039619 77.197.128.46 -> 41.177.26.176 TCP 64 16821 > http [ACK] Seq=318 Ack=3902 Win=65535 Len=0
188556  64.118662 77.197.128.46 -> 41.177.26.176 TCP 64 16821 > http [ACK] Seq=318 Ack=7536 Win=65535 Len=0
188682  64.197684 77.197.128.46 -> 41.177.26.176 TCP 64 16821 > http [ACK] Seq=318 Ack=10456 Win=65535 Len=0
188683  64.198019 77.197.128.46 -> 41.177.26.176 TCP 64 16821 > http [RST, ACK] Seq=318 Ack=11619 Win=0 Len=0
203358  70.103145 77.197.128.46 -> 41.177.26.176 TCP 66 22341 > http [SYN] Seq=0 Win=65535 Len=0 MSS=1460 SACK_PERM=1
203576  70.182364 77.197.128.46 -> 41.177.26.176 TCP 64 22341 > http [ACK] Seq=1 Ack=1 Win=65535 Len=0
205382  70.592328 77.197.128.46 -> 41.177.26.176 TCP 64 22341 > http [ACK] Seq=319 Ack=2427 Win=65535 Len=0
205383  70.592386 77.197.128.46 -> 41.177.26.176 TCP 64 22341 > http [ACK] Seq=319 Ack=3891 Win=65535 Len=0
205702  70.673033 77.197.128.46 -> 41.177.26.176 TCP 64 22341 > http [ACK] Seq=319 Ack=9931 Win=65535 Len=0
206274  70.752349 77.197.128.46 -> 41.177.26.176 TCP 64 22341 > http [RST, ACK] Seq=319 Ack=11326 Win=0 Len=0
211600  72.854697 77.197.128.46 -> 41.177.26.176 TCP 66 24132 > http [SYN] Seq=0 Win=65535 Len=0 MSS=1460 SACK_PERM=1
211885  72.934284 77.197.128.46 -> 41.177.26.176 TCP 64 24132 > http [ACK] Seq=1 Ack=1 Win=65535 Len=0
213806  73.313422 77.197.128.46 -> 41.177.26.176 TCP 64 24132 > http [ACK] Seq=318 Ack=2431 Win=65535 Len=0
213807  73.313426 77.197.128.46 -> 41.177.26.176 TCP 64 24132 > http [ACK] Seq=318 Ack=3896 Win=65535 Len=0
213895  73.392498 77.197.128.46 -> 41.177.26.176 TCP 64 24132 > http [ACK] Seq=318 Ack=6070 Win=65535 Len=0
213896  73.392773 77.197.128.46 -> 41.177.26.176 TCP 64 24132 > http [ACK] Seq=318 Ack=11152 Win=65535 Len=0
213897  73.392909 77.197.128.46 -> 41.177.26.176 TCP 64 24132 > http [RST, ACK] Seq=318 Ack=11152 Win=0 Len=0
214830  73.731210 77.197.128.46 -> 41.177.26.176 TCP 66 24763 > http [SYN] Seq=0 Win=65535 Len=0 MSS=1460 SACK_PERM=1
215023  73.810141 77.197.128.46 -> 41.177.26.176 TCP 64 24763 > http [ACK] Seq=1 Ack=1 Win=65535 Len=0
216645  74.165669 77.197.128.46 -> 41.177.26.176 TCP 64 24763 > http [ACK] Seq=305 Ack=2431 Win=65535 Len=0
217526  74.246856 77.197.128.46 -> 41.177.26.176 TCP 64 24763 > http [ACK] Seq=305 Ack=6055 Win=65383 Len=0
217527  74.246860 77.197.128.46 -> 41.177.26.176 TCP 64 [TCP Dup ACK 217526#1] 24763 > http [ACK] Seq=305 Ack=6055 Win=65383 Len=0
217788  74.327763 77.197.128.46 -> 41.177.26.176 TCP 64 24763 > http [ACK] Seq=305 Ack=11852 Win=65535 Len=0
217789  74.328022 77.197.128.46 -> 41.177.26.176 TCP 64 24763 > http [RST, ACK] Seq=305 Ack=11852 Win=0 Len=0
218038  74.440332 77.197.128.46 -> 41.177.26.176 TCP 66 25175 > http [SYN] Seq=0 Win=65535 Len=0 MSS=1460 SACK_PERM=1
218358  74.520679 77.197.128.46 -> 41.177.26.176 TCP 64 25175 > http [ACK] Seq=1 Ack=1 Win=65535 Len=0
219402  75.001188 77.197.128.46 -> 41.177.26.176 TCP 64 25175 > http [ACK] Seq=305 Ack=3896 Win=65535 Len=0
219583  75.080312 77.197.128.46 -> 41.177.26.176 TCP 64 25175 > http [ACK] Seq=305 Ack=7530 Win=65535 Len=0
219745  75.159485 77.197.128.46 -> 41.177.26.176 TCP 64 25175 > http [ACK] Seq=305 Ack=11532 Win=65535 Len=0
219746  75.159645 77.197.128.46 -> 41.177.26.176 TCP 64 25175 > http [RST, ACK] Seq=305 Ack=11532 Win=0 Len=0
219949  75.266050 77.197.128.46 -> 41.177.26.176 TCP 66 25545 > http [SYN] Seq=0 Win=65535 Len=0 MSS=1460 SACK_PERM=1
220174  75.345959 77.197.128.46 -> 41.177.26.176 TCP 64 25545 > http [ACK] Seq=1 Ack=1 Win=65535 Len=0
225103  76.976978 77.197.128.46 -> 41.177.26.176 TCP 64 25545 > http [ACK] Seq=302 Ack=1713 Win=65535 Len=0
225145  76.986543 77.197.128.46 -> 41.177.26.176 TCP 64 25545 > http [ACK] Seq=302 Ack=2680 Win=64568 Len=0
225147  76.986552 77.197.128.46 -> 41.177.26.176 TCP 64 25545 > http [ACK] Seq=302 Ack=3188 Win=65535 Len=0
225429  77.056734 77.197.128.46 -> 41.177.26.176 TCP 64 25545 > http [ACK] Seq=302 Ack=5539 Win=65535 Len=0
225432  77.065704 77.197.128.46 -> 41.177.26.176 TCP 64 25545 > http [ACK] Seq=302 Ack=8276 Win=65535 Len=0
225433  77.065708 77.197.128.46 -> 41.177.26.176 TCP 64 25545 > http [ACK] Seq=302 Ack=10724 Win=65535 Len=0
225435  77.065851 77.197.128.46 -> 41.177.26.176 TCP 64 25545 > http [RST, ACK] Seq=302 Ack=10724 Win=0 Len=0
225556  77.177832 77.197.128.46 -> 41.177.26.176 TCP 66 26342 > http [SYN] Seq=0 Win=65535 Len=0 MSS=1460 SACK_PERM=1
225708  77.257027 77.197.128.46 -> 41.177.26.176 TCP 64 26342 > http [ACK] Seq=1 Ack=1 Win=65535 Len=0
227141  77.657124 77.197.128.46 -> 41.177.26.176 TCP 64 26342 > http [ACK] Seq=308 Ack=2431 Win=65535 Len=0
227201  77.736311 77.197.128.46 -> 41.177.26.176 TCP 64 26342 > http [ACK] Seq=308 Ack=6062 Win=65535 Len=0
227297  77.815407 77.197.128.46 -> 41.177.26.176 TCP 64 26342 > http [ACK] Seq=308 Ack=8030 Win=65535 Len=0
227298  77.815717 77.197.128.46 -> 41.177.26.176 TCP 64 26342 > http [ACK] Seq=308 Ack=11062 Win=65535 Len=0
227299  77.815899 77.197.128.46 -> 41.177.26.176 TCP 64 26342 > http [RST, ACK] Seq=308 Ack=11062 Win=0 Len=0
227694  78.019687 77.197.128.46 -> 41.177.26.176 TCP 66 26691 > http [SYN] Seq=0 Win=65535 Len=0 MSS=1460 SACK_PERM=1
227831  78.099626 77.197.128.46 -> 41.177.26.176 TCP 64 26691 > http [ACK] Seq=1 Ack=1 Win=65535 Len=0
229842  79.127478 77.197.128.46 -> 41.177.26.176 TCP 64 26691 > http [ACK] Seq=336 Ack=1486 Win=65535 Len=0
229847  79.141693 77.197.128.46 -> 41.177.26.176 TCP 64 26691 > http [ACK] Seq=336 Ack=2392 Win=64629 Len=0
229848  79.141698 77.197.128.46 -> 41.177.26.176 TCP 64 26691 > http [ACK] Seq=336 Ack=2724 Win=64297 Len=0
229849  79.141858 77.197.128.46 -> 41.177.26.176 TCP 64 26691 > http [ACK] Seq=336 Ack=3723 Win=65535 Len=0
229900  79.206529 77.197.128.46 -> 41.177.26.176 TCP 64 26691 > http [ACK] Seq=336 Ack=6318 Win=65535 Len=0
229918  79.220666 77.197.128.46 -> 41.177.26.176 TCP 64 26691 > http [ACK] Seq=336 Ack=10479 Win=65535 Len=0
229921  79.221065 77.197.128.46 -> 41.177.26.176 TCP 64 26691 > http [RST, ACK] Seq=336 Ack=10479 Win=0 Len=0
230103  79.409985 77.197.128.46 -> 41.177.26.176 TCP 66 27265 > http [SYN] Seq=0 Win=65535 Len=0 MSS=1460 SACK_PERM=1
230251  79.489121 77.197.128.46 -> 41.177.26.176 TCP 64 27265 > http [ACK] Seq=1 Ack=1 Win=65535 Len=0
231300  79.907239 77.197.128.46 -> 41.177.26.176 TCP 64 27265 > http [ACK] Seq=305 Ack=3896 Win=65535 Len=0
231458  79.986271 77.197.128.46 -> 41.177.26.176 TCP 64 27265 > http [ACK] Seq=305 Ack=6070 Win=65535 Len=0
231459  79.986276 77.197.128.46 -> 41.177.26.176 TCP 64 27265 > http [ACK] Seq=305 Ack=8047 Win=65535 Len=0
231649  80.065281 77.197.128.46 -> 41.177.26.176 TCP 64 27265 > http [ACK] Seq=305 Ack=11097 Win=65535 Len=0
231650  80.065708 77.197.128.46 -> 41.177.26.176 TCP 64 27265 > http [RST, ACK] Seq=305 Ack=11097 Win=0 Len=0
232096  80.229445 77.197.128.46 -> 41.177.26.176 TCP 66 27703 > http [SYN] Seq=0 Win=65535 Len=0 MSS=1460 SACK_PERM=1
232289  80.308485 77.197.128.46 -> 41.177.26.176 TCP 64 27703 > http [ACK] Seq=1 Ack=1 Win=65535 Len=0
233267  80.657954 77.197.128.46 -> 41.177.26.176 TCP 64 27703 > http [ACK] Seq=308 Ack=2431 Win=65535 Len=0
233272  80.658250 77.197.128.46 -> 41.177.26.176 TCP 64 27703 > http [ACK] Seq=308 Ack=3905 Win=65535 Len=0
233368  80.737103 77.197.128.46 -> 41.177.26.176 TCP 64 27703 > http [ACK] Seq=308 Ack=7529 Win=65535 Len=0
233370  80.737351 77.197.128.46 -> 41.177.26.176 TCP 64 27703 > http [ACK] Seq=308 Ack=10218 Win=65535 Len=0
233541  80.816296 77.197.128.46 -> 41.177.26.176 TCP 64 27703 > http [RST, ACK] Seq=308 Ack=11604 Win=0 Len=0
233550  80.823204 77.197.128.46 -> 41.177.26.176 TCP 66 27982 > http [SYN] Seq=0 Win=65535 Len=0 MSS=1460 SACK_PERM=1
233601  80.902162 77.197.128.46 -> 41.177.26.176 TCP 64 27982 > http [ACK] Seq=1 Ack=1 Win=65535 Len=0
234182  81.284331 77.197.128.46 -> 41.177.26.176 TCP 64 27982 > http [ACK] Seq=308 Ack=3134 Win=65535 Len=0
234321  81.363459 77.197.128.46 -> 41.177.26.176 TCP 64 27982 > http [ACK] Seq=308 Ack=7543 Win=65535 Len=0
234533  81.442678 77.197.128.46 -> 41.177.26.176 TCP 64 27982 > http [ACK] Seq=308 Ack=9367 Win=65535 Len=0
234534  81.442683 77.197.128.46 -> 41.177.26.176 TCP 64 27982 > http [ACK] Seq=308 Ack=11171 Win=65535 Len=0
234535  81.442827 77.197.128.46 -> 41.177.26.176 TCP 64 27982 > http [RST, ACK] Seq=308 Ack=11171 Win=0 Len=0
234571  81.462185 77.197.128.46 -> 41.177.26.176 TCP 66 28331 > http [SYN] Seq=0 Win=65535 Len=0 MSS=1460 SACK_PERM=1
234684  81.541155 77.197.128.46 -> 41.177.26.176 TCP 64 28331 > http [ACK] Seq=1 Ack=1 Win=65535 Len=0
235279  81.990091 77.197.128.46 -> 41.177.26.176 TCP 64 28331 > http [ACK] Seq=318 Ack=2916 Win=65535 Len=0
235432  82.069546 77.197.128.46 -> 41.177.26.176 TCP 64 28331 > http [ACK] Seq=318 Ack=6077 Win=65535 Len=0
235629  82.148533 77.197.128.46 -> 41.177.26.176 TCP 64 28331 > http [ACK] Seq=318 Ack=8371 Win=65535 Len=0
235630  82.148705 77.197.128.46 -> 41.177.26.176 TCP 64 28331 > http [ACK] Seq=318 Ack=11227 Win=65535 Len=0
235631  82.149173 77.197.128.46 -> 41.177.26.176 TCP 64 28331 > http [RST, ACK] Seq=318 Ack=11227 Win=0 Len=0
235846  82.267998 77.197.128.46 -> 41.177.26.176 TCP 66 28803 > http [SYN] Seq=0 Win=65535 Len=0 MSS=1460 SACK_PERM=1
236685  82.346953 77.197.128.46 -> 41.177.26.176 TCP 64 28803 > http [ACK] Seq=1 Ack=1 Win=65535 Len=0
238609  82.799788 77.197.128.46 -> 41.177.26.176 TCP 64 28803 > http [ACK] Seq=309 Ack=2431 Win=65535 Len=0
238773  82.878928 77.197.128.46 -> 41.177.26.176 TCP 64 28803 > http [ACK] Seq=309 Ack=6075 Win=65535 Len=0
238984  82.957820 77.197.128.46 -> 41.177.26.176 TCP 64 28803 > http [ACK] Seq=309 Ack=8012 Win=65535 Len=0
238985  82.957989 77.197.128.46 -> 41.177.26.176 TCP 64 28803 > http [ACK] Seq=309 Ack=11288 Win=65535 Len=0
238986  82.958327 77.197.128.46 -> 41.177.26.176 TCP 64 28803 > http [RST, ACK] Seq=309 Ack=11288 Win=0 Len=0
239194  83.069402 77.197.128.46 -> 41.177.26.176 TCP 66 29171 > http [SYN] Seq=0 Win=65535 Len=0 MSS=1460 SACK_PERM=1
239467  83.148598 77.197.128.46 -> 41.177.26.176 TCP 64 29171 > http [ACK] Seq=1 Ack=1 Win=65535 Len=0
240672  83.570353 77.197.128.46 -> 41.177.26.176 TCP 64 29171 > http [ACK] Seq=319 Ack=2431 Win=65535 Len=0
240673  83.570463 77.197.128.46 -> 41.177.26.176 TCP 64 29171 > http [ACK] Seq=319 Ack=3895 Win=65535 Len=0
240769  83.649350 77.197.128.46 -> 41.177.26.176 TCP 64 29171 > http [ACK] Seq=319 Ack=6075 Win=65535 Len=0
240770  83.649480 77.197.128.46 -> 41.177.26.176 TCP 64 29171 > http [ACK] Seq=319 Ack=8440 Win=65535 Len=0
240883  83.728481 77.197.128.46 -> 41.177.26.176 TCP 64 29171 > http [ACK] Seq=319 Ack=11724 Win=65535 Len=0
240884  83.728730 77.197.128.46 -> 41.177.26.176 TCP 64 29171 > http [RST, ACK] Seq=319 Ack=11724 Win=0 Len=0
240895  83.735666 77.197.128.46 -> 41.177.26.176 TCP 66 29490 > http [SYN] Seq=0 Win=65535 Len=0 MSS=1460 SACK_PERM=1
241057  83.814936 77.197.128.46 -> 41.177.26.176 TCP 64 29490 > http [ACK] Seq=1 Ack=1 Win=65535 Len=0
241687  84.216621 77.197.128.46 -> 41.177.26.176 TCP 64 29490 > http [ACK] Seq=318 Ack=2431 Win=65535 Len=0
241965  84.295658 77.197.128.46 -> 41.177.26.176 TCP 64 29490 > http [ACK] Seq=318 Ack=6057 Win=65535 Len=0
242516  84.374739 77.197.128.46 -> 41.177.26.176 TCP 64 29490 > http [ACK] Seq=318 Ack=8359 Win=65535 Len=0
242517  84.374863 77.197.128.46 -> 41.177.26.176 TCP 64 29490 > http [ACK] Seq=318 Ack=11627 Win=64531 Len=0
242518  84.374869 77.197.128.46 -> 41.177.26.176 TCP 64 [TCP Dup ACK 242517#1] 29490 > http [ACK] Seq=318 Ack=11627 Win=64531 Len=0
242519  84.375088 77.197.128.46 -> 41.177.26.176 TCP 64 29490 > http [RST, ACK] Seq=318 Ack=11627 Win=0 Len=0
243056  84.551637 77.197.128.46 -> 41.177.26.176 TCP 66 29722 > http [SYN] Seq=0 Win=65535 Len=0 MSS=1460 SACK_PERM=1
243171  84.630839 77.197.128.46 -> 41.177.26.176 TCP 64 29722 > http [ACK] Seq=1 Ack=1 Win=65535 Len=0
243828  85.011503 77.197.128.46 -> 41.177.26.176 TCP 64 29722 > http [ACK] Seq=308 Ack=2431 Win=65535 Len=0
243829  85.011648 77.197.128.46 -> 41.177.26.176 TCP 64 29722 > http [ACK] Seq=308 Ack=3905 Win=65535 Len=0
244010  85.090680 77.197.128.46 -> 41.177.26.176 TCP 64 29722 > http [ACK] Seq=308 Ack=6069 Win=65535 Len=0
244011  85.090961 77.197.128.46 -> 41.177.26.176 TCP 64 29722 > http [ACK] Seq=308 Ack=8225 Win=65535 Len=0
244012  85.090965 77.197.128.46 -> 41.177.26.176 TCP 64 29722 > http [ACK] Seq=308 Ack=11064 Win=65535 Len=0
244013  85.091397 77.197.128.46 -> 41.177.26.176 TCP 64 29722 > http [RST, ACK] Seq=308 Ack=11064 Win=0 Len=0
244168  85.144294 77.197.128.46 -> 41.177.26.176 TCP 66 29824 > http [SYN] Seq=0 Win=65535 Len=0 MSS=1460 SACK_PERM=1
244424  85.223298 77.197.128.46 -> 41.177.26.176 TCP 64 29824 > http [ACK] Seq=1 Ack=1 Win=65535 Len=0
245264  85.612116 77.197.128.46 -> 41.177.26.176 TCP 64 29824 > http [ACK] Seq=318 Ack=2424 Win=65535 Len=0
245442  85.691286 77.197.128.46 -> 41.177.26.176 TCP 64 29824 > http [ACK] Seq=318 Ack=5765 Win=65535 Len=0
245625  85.770395 77.197.128.46 -> 41.177.26.176 TCP 64 29824 > http [ACK] Seq=318 Ack=7901 Win=65535 Len=0
245626  85.770661 77.197.128.46 -> 41.177.26.176 TCP 64 29824 > http [ACK] Seq=318 Ack=10722 Win=65535 Len=0
