438191 142.913005 77.77.39.116 -> 244.3.210.197 TCP 70 57087 > http [SYN] Seq=0 Win=8192 Len=0 MSS=1380 WS=4 SACK_PERM=1
438842 142.984541 77.77.39.116 -> 244.3.210.197 TCP 64 57087 > http [ACK] Seq=1 Ack=1 Win=66240 Len=0
439747 143.241885 77.77.39.116 -> 244.3.210.197 TCP 70 57088 > http [SYN] Seq=0 Win=8192 Len=0 MSS=1380 WS=4 SACK_PERM=1
439761 143.244724 77.77.39.116 -> 244.3.210.197 TCP 64 57087 > http [ACK] Seq=754 Ack=351 Win=65888 Len=0
439866 143.313337 77.77.39.116 -> 244.3.210.197 TCP 64 57088 > http [ACK] Seq=1 Ack=1 Win=66240 Len=0
441447 143.717385 77.77.39.116 -> 244.3.210.197 TCP 64 57088 > http [ACK] Seq=931 Ack=2761 Win=66240 Len=0
441486 143.727096 77.77.39.116 -> 244.3.210.197 TCP 70 57089 > http [SYN] Seq=0 Win=8192 Len=0 MSS=1380 WS=4 SACK_PERM=1
441655 143.788909 77.77.39.116 -> 244.3.210.197 TCP 64 57088 > http [ACK] Seq=931 Ack=5521 Win=66240 Len=0
441691 143.798010 77.77.39.116 -> 244.3.210.197 TCP 64 57089 > http [ACK] Seq=1 Ack=1 Win=66240 Len=0
441873 143.860516 77.77.39.116 -> 244.3.210.197 TCP 64 57088 > http [ACK] Seq=931 Ack=9661 Win=66240 Len=0
441904 143.871472 77.77.39.116 -> 244.3.210.197 TCP 64 57089 > http [ACK] Seq=768 Ack=2761 Win=66240 Len=0
442074 143.932060 77.77.39.116 -> 244.3.210.197 TCP 64 57088 > http [ACK] Seq=931 Ack=13801 Win=66240 Len=0
442082 143.932525 77.77.39.116 -> 244.3.210.197 TCP 64 57088 > http [ACK] Seq=931 Ack=15420 Win=66240 Len=0
442146 143.942778 77.77.39.116 -> 244.3.210.197 TCP 64 57089 > http [ACK] Seq=768 Ack=5521 Win=66240 Len=0
442279 144.006283 77.77.39.116 -> 244.3.210.197 TCP 64 57088 > http [ACK] Seq=1688 Ack=18180 Win=66240 Len=0
442288 144.006838 77.77.39.116 -> 244.3.210.197 TCP 64 57088 > http [ACK] Seq=1688 Ack=22320 Win=66240 Len=0
442289 144.006843 77.77.39.116 -> 244.3.210.197 TCP 64 57088 > http [ACK] Seq=1688 Ack=25080 Win=66240 Len=0
442311 144.013992 77.77.39.116 -> 244.3.210.197 TCP 64 57089 > http [ACK] Seq=768 Ack=10381 Win=66240 Len=0
442613 144.078560 77.77.39.116 -> 244.3.210.197 TCP 64 57088 > http [ACK] Seq=1688 Ack=27840 Win=66240 Len=0
442614 144.078565 77.77.39.116 -> 244.3.210.197 TCP 64 57088 > http [ACK] Seq=1688 Ack=30600 Win=66240 Len=0
442632 144.078866 77.77.39.116 -> 244.3.210.197 TCP 64 57088 > http [ACK] Seq=1688 Ack=34740 Win=66240 Len=0
442640 144.079231 77.77.39.116 -> 244.3.210.197 TCP 64 57088 > http [ACK] Seq=1688 Ack=38880 Win=66240 Len=0
442670 144.087832 77.77.39.116 -> 244.3.210.197 TCP 64 57089 > http [ACK] Seq=1531 Ack=13745 Win=66240 Len=0
442768 144.150017 77.77.39.116 -> 244.3.210.197 TCP 64 57088 > http [ACK] Seq=1688 Ack=41640 Win=66240 Len=0
442780 144.150680 77.77.39.116 -> 244.3.210.197 TCP 64 57088 > http [ACK] Seq=1688 Ack=45780 Win=66240 Len=0
442781 144.150684 77.77.39.116 -> 244.3.210.197 TCP 64 57088 > http [ACK] Seq=1688 Ack=49661 Win=66240 Len=0
442888 144.162137 77.77.39.116 -> 244.3.210.197 TCP 64 57089 > http [ACK] Seq=2297 Ack=16505 Win=66240 Len=0
443007 144.224234 77.77.39.116 -> 244.3.210.197 TCP 64 57088 > http [ACK] Seq=2454 Ack=52421 Win=66240 Len=0
443008 144.224239 77.77.39.116 -> 244.3.210.197 TCP 64 57088 > http [ACK] Seq=2454 Ack=56561 Win=66240 Len=0
443028 144.224687 77.77.39.116 -> 244.3.210.197 TCP 64 57088 > http [ACK] Seq=2454 Ack=60701 Win=64860 Len=0
443039 144.225104 77.77.39.116 -> 244.3.210.197 TCP 64 57088 > http [ACK] Seq=2454 Ack=64841 Win=60720 Len=0
443052 144.225535 77.77.39.116 -> 244.3.210.197 TCP 64 57088 > http [ACK] Seq=2454 Ack=68981 Win=56580 Len=0
443064 144.226073 77.77.39.116 -> 244.3.210.197 TCP 64 57088 > http [ACK] Seq=2454 Ack=73121 Win=52440 Len=0
443067 144.226187 77.77.39.116 -> 244.3.210.197 TCP 64 [TCP Window Update] 57088 > http [ACK] Seq=2454 Ack=73121 Win=56192 Len=0
443069 144.226231 77.77.39.116 -> 244.3.210.197 TCP 64 [TCP Window Update] 57088 > http [ACK] Seq=2454 Ack=73121 Win=66240 Len=0
443203 144.295871 77.77.39.116 -> 244.3.210.197 TCP 64 57088 > http [ACK] Seq=2454 Ack=75881 Win=66240 Len=0
443210 144.296042 77.77.39.116 -> 244.3.210.197 TCP 64 57088 > http [ACK] Seq=2454 Ack=80021 Win=66240 Len=0
443223 144.296582 77.77.39.116 -> 244.3.210.197 TCP 64 57088 > http [ACK] Seq=2454 Ack=84161 Win=66240 Len=0
443235 144.297191 77.77.39.116 -> 244.3.210.197 TCP 64 57088 > http [ACK] Seq=2454 Ack=86921 Win=66240 Len=0
443236 144.297196 77.77.39.116 -> 244.3.210.197 TCP 64 57088 > http [ACK] Seq=2454 Ack=91061 Win=66240 Len=0
443257 144.297720 77.77.39.116 -> 244.3.210.197 TCP 64 57088 > http [ACK] Seq=2454 Ack=95201 Win=66240 Len=0
443265 144.297898 77.77.39.116 -> 244.3.210.197 TCP 64 57088 > http [ACK] Seq=2454 Ack=99341 Win=66240 Len=0
443280 144.298346 77.77.39.116 -> 244.3.210.197 TCP 64 57088 > http [ACK] Seq=2454 Ack=103481 Win=66240 Len=0
443424 144.351518 77.77.39.116 -> 244.3.210.197 TCP 64 57089 > http [ACK] Seq=2297 Ack=17045 Win=65700 Len=0
443484 144.367568 77.77.39.116 -> 244.3.210.197 TCP 64 57088 > http [ACK] Seq=2454 Ack=107621 Win=66240 Len=0
443488 144.367724 77.77.39.116 -> 244.3.210.197 TCP 64 57088 > http [ACK] Seq=2454 Ack=110381 Win=66240 Len=0
443504 144.368558 77.77.39.116 -> 244.3.210.197 TCP 64 57088 > http [ACK] Seq=2454 Ack=114521 Win=66240 Len=0
443505 144.368562 77.77.39.116 -> 244.3.210.197 TCP 64 57088 > http [ACK] Seq=2454 Ack=118661 Win=66240 Len=0
443506 144.368566 77.77.39.116 -> 244.3.210.197 TCP 64 57088 > http [ACK] Seq=2454 Ack=121421 Win=66240 Len=0
443517 144.368782 77.77.39.116 -> 244.3.210.197 TCP 64 57088 > http [ACK] Seq=2454 Ack=125561 Win=66240 Len=0
443544 144.369262 77.77.39.116 -> 244.3.210.197 TCP 64 57088 > http [ACK] Seq=2454 Ack=129701 Win=66240 Len=0
443556 144.369912 77.77.39.116 -> 244.3.210.197 TCP 64 57088 > http [ACK] Seq=2454 Ack=133841 Win=66240 Len=0
443557 144.369916 77.77.39.116 -> 244.3.210.197 TCP 64 57088 > http [ACK] Seq=2454 Ack=137981 Win=66240 Len=0
443576 144.370824 77.77.39.116 -> 244.3.210.197 TCP 64 57088 > http [ACK] Seq=2454 Ack=140741 Win=66240 Len=0
443577 144.370828 77.77.39.116 -> 244.3.210.197 TCP 64 57088 > http [ACK] Seq=2454 Ack=144881 Win=66240 Len=0
443728 144.439250 77.77.39.116 -> 244.3.210.197 TCP 64 57088 > http [ACK] Seq=2454 Ack=149021 Win=66240 Len=0
443734 144.439715 77.77.39.116 -> 244.3.210.197 TCP 64 57088 > http [ACK] Seq=2454 Ack=153161 Win=66240 Len=0
443735 144.439719 77.77.39.116 -> 244.3.210.197 TCP 64 57088 > http [ACK] Seq=2454 Ack=155921 Win=66240 Len=0
443749 144.440426 77.77.39.116 -> 244.3.210.197 TCP 64 57088 > http [ACK] Seq=2454 Ack=158681 Win=66240 Len=0
443752 144.440581 77.77.39.116 -> 244.3.210.197 TCP 64 57088 > http [ACK] Seq=2454 Ack=162821 Win=66240 Len=0
443761 144.440877 77.77.39.116 -> 244.3.210.197 TCP 64 57088 > http [ACK] Seq=2454 Ack=165581 Win=66240 Len=0
443767 144.441372 77.77.39.116 -> 244.3.210.197 TCP 64 57088 > http [ACK] Seq=2454 Ack=169721 Win=66240 Len=0
443773 144.441556 77.77.39.116 -> 244.3.210.197 TCP 64 57088 > http [ACK] Seq=2454 Ack=173861 Win=66240 Len=0
443779 144.441954 77.77.39.116 -> 244.3.210.197 TCP 64 57088 > http [ACK] Seq=2454 Ack=178001 Win=66240 Len=0
443780 144.441958 77.77.39.116 -> 244.3.210.197 TCP 64 57088 > http [ACK] Seq=2454 Ack=182141 Win=66240 Len=0
443791 144.442749 77.77.39.116 -> 244.3.210.197 TCP 64 57088 > http [ACK] Seq=2454 Ack=183985 Win=66240 Len=0
444072 144.569345 77.77.39.116 -> 244.3.210.197 TCP 64 57089 > http [ACK] Seq=3067 Ack=19713 Win=66240 Len=0
444267 144.648142 77.77.39.116 -> 244.3.210.197 TCP 64 57089 > http [ACK] Seq=3832 Ack=22473 Win=66240 Len=0
444276 144.648618 77.77.39.116 -> 244.3.210.197 TCP 64 57089 > http [ACK] Seq=3832 Ack=26613 Win=66240 Len=0
444286 144.649167 77.77.39.116 -> 244.3.210.197 TCP 64 57089 > http [ACK] Seq=3832 Ack=30753 Win=64860 Len=0
444308 144.649855 77.77.39.116 -> 244.3.210.197 TCP 64 57089 > http [ACK] Seq=3832 Ack=32133 Win=66240 Len=0
444309 144.649945 77.77.39.116 -> 244.3.210.197 TCP 64 57088 > http [ACK] Seq=3218 Ack=186745 Win=66240 Len=0
444310 144.649950 77.77.39.116 -> 244.3.210.197 TCP 64 57088 > http [ACK] Seq=3218 Ack=188888 Win=66240 Len=0
444457 144.719456 77.77.39.116 -> 244.3.210.197 TCP 64 57089 > http [ACK] Seq=3832 Ack=34893 Win=66240 Len=0
444463 144.719640 77.77.39.116 -> 244.3.210.197 TCP 64 57089 > http [ACK] Seq=3832 Ack=37653 Win=66240 Len=0
444470 144.719914 77.77.39.116 -> 244.3.210.197 TCP 64 57089 > http [ACK] Seq=3832 Ack=41793 Win=66240 Len=0
444476 144.720412 77.77.39.116 -> 244.3.210.197 TCP 64 57089 > http [ACK] Seq=3832 Ack=45933 Win=66240 Len=0
444482 144.720804 77.77.39.116 -> 244.3.210.197 TCP 64 57089 > http [ACK] Seq=3832 Ack=48693 Win=66240 Len=0
444488 144.724869 77.77.39.116 -> 244.3.210.197 TCP 64 57088 > http [ACK] Seq=3982 Ack=191648 Win=66240 Len=0
444493 144.725040 77.77.39.116 -> 244.3.210.197 TCP 64 57088 > http [ACK] Seq=3982 Ack=195788 Win=66240 Len=0
444500 144.725466 77.77.39.116 -> 244.3.210.197 TCP 64 57088 > http [ACK] Seq=3982 Ack=199928 Win=64860 Len=0
444506 144.726045 77.77.39.116 -> 244.3.210.197 TCP 64 57088 > http [ACK] Seq=3982 Ack=204068 Win=60720 Len=0
444512 144.726299 77.77.39.116 -> 244.3.210.197 TCP 64 57088 > http [ACK] Seq=3982 Ack=208208 Win=56580 Len=0
444518 144.726567 77.77.39.116 -> 244.3.210.197 TCP 64 57088 > http [ACK] Seq=3982 Ack=212348 Win=52440 Len=0
444519 144.726571 77.77.39.116 -> 244.3.210.197 TCP 64 [TCP Window Update] 57088 > http [ACK] Seq=3982 Ack=212348 Win=56192 Len=0
444520 144.726575 77.77.39.116 -> 244.3.210.197 TCP 64 [TCP Window Update] 57088 > http [ACK] Seq=3982 Ack=212348 Win=66240 Len=0
444521 144.726579 77.77.39.116 -> 244.3.210.197 TCP 64 57088 > http [ACK] Seq=3982 Ack=215108 Win=66240 Len=0
444542 144.727157 77.77.39.116 -> 244.3.210.197 TCP 64 57088 > http [ACK] Seq=3982 Ack=219248 Win=66240 Len=0
444543 144.727161 77.77.39.116 -> 244.3.210.197 TCP 64 57088 > http [ACK] Seq=3982 Ack=223388 Win=66240 Len=0
444554 144.727962 77.77.39.116 -> 244.3.210.197 TCP 64 57088 > http [ACK] Seq=3982 Ack=227030 Win=66240 Len=0
444883 144.790534 77.77.39.116 -> 244.3.210.197 TCP 64 57089 > http [ACK] Seq=3832 Ack=50624 Win=66240 Len=0
445037 144.800898 77.77.39.116 -> 244.3.210.197 TCP 64 57088 > http [ACK] Seq=4747 Ack=229790 Win=66240 Len=0
445048 144.801512 77.77.39.116 -> 244.3.210.197 TCP 64 57088 > http [ACK] Seq=4747 Ack=233930 Win=66240 Len=0
445049 144.801516 77.77.39.116 -> 244.3.210.197 TCP 64 57088 > http [ACK] Seq=4747 Ack=238070 Win=64860 Len=0
445072 144.802114 77.77.39.116 -> 244.3.210.197 TCP 64 57088 > http [ACK] Seq=4747 Ack=242210 Win=60720 Len=0
445095 144.802856 77.77.39.116 -> 244.3.210.197 TCP 64 57088 > http [ACK] Seq=4747 Ack=246350 Win=56580 Len=0
445096 144.802860 77.77.39.116 -> 244.3.210.197 TCP 64 [TCP Window Update] 57088 > http [ACK] Seq=4747 Ack=246350 Win=60332 Len=0
445097 144.802864 77.77.39.116 -> 244.3.210.197 TCP 64 [TCP Window Update] 57088 > http [ACK] Seq=4747 Ack=246350 Win=66240 Len=0
445098 144.802868 77.77.39.116 -> 244.3.210.197 TCP 64 57088 > http [ACK] Seq=4747 Ack=250490 Win=62100 Len=0
445099 144.802872 77.77.39.116 -> 244.3.210.197 TCP 64 [TCP Window Update] 57088 > http [ACK] Seq=4747 Ack=250490 Win=65852 Len=0
445127 144.803226 77.77.39.116 -> 244.3.210.197 TCP 64 57088 > http [ACK] Seq=4747 Ack=253250 Win=66240 Len=0
445143 144.803514 77.77.39.116 -> 244.3.210.197 TCP 64 57088 > http [ACK] Seq=4747 Ack=256276 Win=66240 Len=0
445925 144.863254 77.77.39.116 -> 244.3.210.197 TCP 64 57089 > http [ACK] Seq=4595 Ack=53384 Win=66240 Len=0
445937 144.863591 77.77.39.116 -> 244.3.210.197 TCP 64 57089 > http [ACK] Seq=4595 Ack=57524 Win=66240 Len=0
445954 144.864259 77.77.39.116 -> 244.3.210.197 TCP 64 57089 > http [ACK] Seq=4595 Ack=61292 Win=65232 Len=0
446530 144.954263 77.77.39.116 -> 244.3.210.197 TCP 64 57088 > http [ACK] Seq=5525 Ack=259036 Win=66240 Len=0
446531 144.954268 77.77.39.116 -> 244.3.210.197 TCP 64 57088 > http [ACK] Seq=5525 Ack=261028 Win=66240 Len=0
446707 145.034264 77.77.39.116 -> 244.3.210.197 TCP 64 57089 > http [ACK] Seq=5361 Ack=63989 Win=66240 Len=0
446714 145.035207 77.77.39.116 -> 244.3.210.197 TCP 64 57088 > http [ACK] Seq=6281 Ack=263337 Win=66240 Len=0
446865 145.111669 77.77.39.116 -> 244.3.210.197 TCP 64 57089 > http [ACK] Seq=6129 Ack=66749 Win=66240 Len=0
446869 145.111815 77.77.39.116 -> 244.3.210.197 TCP 64 57089 > http [ACK] Seq=6129 Ack=70889 Win=66240 Len=0
446879 145.112424 77.77.39.116 -> 244.3.210.197 TCP 64 57089 > http [ACK] Seq=6129 Ack=75063 Win=64824 Len=0
446887 145.113295 77.77.39.116 -> 244.3.210.197 TCP 64 [TCP Window Update] 57089 > http [ACK] Seq=6129 Ack=75063 Win=66240 Len=0
447089 145.193994 77.77.39.116 -> 244.3.210.197 TCP 64 57088 > http [ACK] Seq=7047 Ack=266097 Win=66240 Len=0
447099 145.194519 77.77.39.116 -> 244.3.210.197 TCP 64 57088 > http [ACK] Seq=7047 Ack=270237 Win=66240 Len=0
447105 145.194824 77.77.39.116 -> 244.3.210.197 TCP 64 57088 > http [ACK] Seq=7047 Ack=273089 Win=66148 Len=0
447198 145.274242 77.77.39.116 -> 244.3.210.197 TCP 64 57089 > http [ACK] Seq=6891 Ack=77823 Win=66240 Len=0
447199 145.274246 77.77.39.116 -> 244.3.210.197 TCP 64 57089 > http [ACK] Seq=6891 Ack=81963 Win=66240 Len=0
447210 145.274741 77.77.39.116 -> 244.3.210.197 TCP 64 57089 > http [ACK] Seq=6891 Ack=84248 Win=66240 Len=0
447411 145.355850 77.77.39.116 -> 244.3.210.197 TCP 64 57088 > http [ACK] Seq=7810 Ack=276646 Win=66240 Len=0
447626 145.432719 77.77.39.116 -> 244.3.210.197 TCP 64 57089 > http [ACK] Seq=7658 Ack=87008 Win=66240 Len=0
447631 145.432904 77.77.39.116 -> 244.3.210.197 TCP 64 57089 > http [ACK] Seq=7658 Ack=88597 Win=66240 Len=0
447810 145.511772 77.77.39.116 -> 244.3.210.197 TCP 64 57088 > http [ACK] Seq=8571 Ack=279406 Win=66240 Len=0
447816 145.512465 77.77.39.116 -> 244.3.210.197 TCP 64 57088 > http [ACK] Seq=8571 Ack=283546 Win=66240 Len=0
447822 145.512695 77.77.39.116 -> 244.3.210.197 TCP 64 57088 > http [ACK] Seq=8571 Ack=287424 Win=65120 Len=0
448072 145.596959 77.77.39.116 -> 244.3.210.197 TCP 64 57089 > http [ACK] Seq=8421 Ack=91357 Win=66240 Len=0
448081 145.597345 77.77.39.116 -> 244.3.210.197 TCP 64 57089 > http [ACK] Seq=8421 Ack=95497 Win=66240 Len=0
448082 145.597351 77.77.39.116 -> 244.3.210.197 TCP 64 57089 > http [ACK] Seq=8421 Ack=99637 Win=64860 Len=0
448101 145.597795 77.77.39.116 -> 244.3.210.197 TCP 64 57089 > http [ACK] Seq=8421 Ack=102397 Win=62100 Len=0
448110 145.598351 77.77.39.116 -> 244.3.210.197 TCP 64 57089 > http [ACK] Seq=8421 Ack=106537 Win=57960 Len=0
448111 145.598356 77.77.39.116 -> 244.3.210.197 TCP 64 57089 > http [ACK] Seq=8421 Ack=110677 Win=53820 Len=0
448112 145.598360 77.77.39.116 -> 244.3.210.197 TCP 64 [TCP Window Update] 57089 > http [ACK] Seq=8421 Ack=110677 Win=57572 Len=0
448113 145.598364 77.77.39.116 -> 244.3.210.197 TCP 64 [TCP Window Update] 57089 > http [ACK] Seq=8421 Ack=110677 Win=66240 Len=0
448136 145.598950 77.77.39.116 -> 244.3.210.197 TCP 64 57089 > http [ACK] Seq=8421 Ack=114817 Win=66240 Len=0
448137 145.599172 77.77.39.116 -> 244.3.210.197 TCP 64 57089 > http [ACK] Seq=8421 Ack=118957 Win=66240 Len=0
448145 145.599571 77.77.39.116 -> 244.3.210.197 TCP 64 57089 > http [ACK] Seq=8421 Ack=123097 Win=66240 Len=0
448155 145.600205 77.77.39.116 -> 244.3.210.197 TCP 64 57089 > http [ACK] Seq=8421 Ack=127237 Win=66240 Len=0
448161 145.600661 77.77.39.116 -> 244.3.210.197 TCP 64 57089 > http [ACK] Seq=8421 Ack=129997 Win=66240 Len=0
448336 145.668135 77.77.39.116 -> 244.3.210.197 TCP 64 57089 > http [ACK] Seq=8421 Ack=134137 Win=66240 Len=0
448344 145.668440 77.77.39.116 -> 244.3.210.197 TCP 64 57089 > http [ACK] Seq=8421 Ack=136897 Win=66240 Len=0
448350 145.668803 77.77.39.116 -> 244.3.210.197 TCP 64 57089 > http [ACK] Seq=8421 Ack=139657 Win=66240 Len=0
448356 145.669517 77.77.39.116 -> 244.3.210.197 TCP 64 57089 > http [ACK] Seq=8421 Ack=143797 Win=66240 Len=0
448357 145.669538 77.77.39.116 -> 244.3.210.197 TCP 64 57089 > http [ACK] Seq=8421 Ack=147937 Win=66240 Len=0
448360 145.669869 77.77.39.116 -> 244.3.210.197 TCP 64 57089 > http [ACK] Seq=8421 Ack=152077 Win=66240 Len=0
448647 145.761211 77.77.39.116 -> 244.3.210.197 TCP 64 57088 > http [ACK] Seq=9342 Ack=290184 Win=66240 Len=0
448655 145.761551 77.77.39.116 -> 244.3.210.197 TCP 64 57088 > http [ACK] Seq=9342 Ack=293286 Win=66240 Len=0
448869 145.839949 77.77.39.116 -> 244.3.210.197 TCP 64 57089 > http [ACK] Seq=9188 Ack=155946 Win=66240 Len=0
449012 145.919647 77.77.39.116 -> 244.3.210.197 TCP 64 57088 > http [ACK] Seq=10102 Ack=296046 Win=66240 Len=0
449018 145.920024 77.77.39.116 -> 244.3.210.197 TCP 64 57088 > http [ACK] Seq=10102 Ack=300186 Win=66240 Len=0
449019 145.920029 77.77.39.116 -> 244.3.210.197 TCP 64 57088 > http [ACK] Seq=10102 Ack=304326 Win=64860 Len=0
449030 145.920952 77.77.39.116 -> 244.3.210.197 TCP 64 57088 > http [ACK] Seq=10102 Ack=304618 Win=66240 Len=0
449188 146.001275 77.77.39.116 -> 244.3.210.197 TCP 64 57089 > http [ACK] Seq=9976 Ack=159402 Win=66240 Len=0
449195 146.001596 77.77.39.116 -> 244.3.210.197 TCP 64 57089 > http [ACK] Seq=9976 Ack=163542 Win=66240 Len=0
449201 146.001950 77.77.39.116 -> 244.3.210.197 TCP 64 57089 > http [ACK] Seq=9976 Ack=167682 Win=64860 Len=0
449207 146.002850 77.77.39.116 -> 244.3.210.197 TCP 64 57089 > http [ACK] Seq=9976 Ack=170442 Win=62100 Len=0
449208 146.002855 77.77.39.116 -> 244.3.210.197 TCP 64 57089 > http [ACK] Seq=9976 Ack=174582 Win=57960 Len=0
449209 146.002859 77.77.39.116 -> 244.3.210.197 TCP 64 [TCP Window Update] 57089 > http [ACK] Seq=9976 Ack=174582 Win=66240 Len=0
449210 146.002863 77.77.39.116 -> 244.3.210.197 TCP 64 57089 > http [ACK] Seq=9976 Ack=178722 Win=66240 Len=0
449231 146.003311 77.77.39.116 -> 244.3.210.197 TCP 64 57089 > http [ACK] Seq=9976 Ack=182862 Win=66240 Len=0
449232 146.003440 77.77.39.116 -> 244.3.210.197 TCP 64 57089 > http [ACK] Seq=9976 Ack=187002 Win=66240 Len=0
449243 146.003877 77.77.39.116 -> 244.3.210.197 TCP 64 57089 > http [ACK] Seq=9976 Ack=191142 Win=66240 Len=0
449244 146.004008 77.77.39.116 -> 244.3.210.197 TCP 64 57089 > http [ACK] Seq=9976 Ack=195253 Win=66240 Len=0
449256 146.004923 77.77.39.116 -> 244.3.210.197 TCP 64 57088 > http [ACK] Seq=10887 Ack=307378 Win=66240 Len=0
449258 146.005074 77.77.39.116 -> 244.3.210.197 TCP 64 57088 > http [ACK] Seq=10887 Ack=311518 Win=66240 Len=0
449264 146.005243 77.77.39.116 -> 244.3.210.197 TCP 64 57088 > http [ACK] Seq=10887 Ack=315658 Win=63480 Len=0
449279 146.005873 77.77.39.116 -> 244.3.210.197 TCP 64 57088 > http [ACK] Seq=10887 Ack=318050 Win=61088 Len=0
449299 146.007652 77.77.39.116 -> 244.3.210.197 TCP 64 [TCP Window Update] 57088 > http [ACK] Seq=10887 Ack=318050 Win=64840 Len=0
449309 146.008821 77.77.39.116 -> 244.3.210.197 TCP 64 [TCP Window Update] 57088 > http [ACK] Seq=10887 Ack=318050 Win=66240 Len=0
449466 146.080530 77.77.39.116 -> 244.3.210.197 TCP 64 57089 > http [ACK] Seq=10763 Ack=198013 Win=229080 Len=0
449467 146.080751 77.77.39.116 -> 244.3.210.197 TCP 64 57089 > http [ACK] Seq=10763 Ack=202153 Win=229080 Len=0
449468 146.080756 77.77.39.116 -> 244.3.210.197 TCP 64 57089 > http [ACK] Seq=10763 Ack=206293 Win=227700 Len=0
449484 146.081228 77.77.39.116 -> 244.3.210.197 TCP 64 57089 > http [ACK] Seq=10763 Ack=208293 Win=225700 Len=0
449485 146.081467 77.77.39.116 -> 244.3.210.197 TCP 64 [TCP Window Update] 57089 > http [ACK] Seq=10763 Ack=208293 Win=229080 Len=0
449802 146.228428 77.77.39.116 -> 244.3.210.197 TCP 64 57089 > http [ACK] Seq=12304 Ack=210410 Win=226960 Len=0
449816 146.238262 77.77.39.116 -> 244.3.210.197 TCP 64 57088 > http [ACK] Seq=13178 Ack=320949 Win=66240 Len=0
449917 146.303915 77.77.39.116 -> 244.3.210.197 TCP 64 57089 > http [ACK] Seq=13069 Ack=213069 Win=224304 Len=0
449938 146.313588 77.77.39.116 -> 244.3.210.197 TCP 64 57088 > http [ACK] Seq=13942 Ack=323762 Win=66240 Len=0
450061 146.379022 77.77.39.116 -> 244.3.210.197 TCP 64 57089 > http [ACK] Seq=13832 Ack=215829 Win=221544 Len=0
450065 146.379198 77.77.39.116 -> 244.3.210.197 TCP 64 57089 > http [ACK] Seq=13832 Ack=218057 Win=219316 Len=0
450099 146.389403 77.77.39.116 -> 244.3.210.197 TCP 64 57088 > http [ACK] Seq=14706 Ack=326522 Win=66240 Len=0
450100 146.389407 77.77.39.116 -> 244.3.210.197 TCP 64 57088 > http [ACK] Seq=14706 Ack=328493 Win=66240 Len=0
450279 146.453546 77.77.39.116 -> 244.3.210.197 TCP 64 57089 > http [ACK] Seq=14607 Ack=220639 Win=216732 Len=0
450301 146.465681 77.77.39.116 -> 244.3.210.197 TCP 64 57088 > http [ACK] Seq=15480 Ack=331253 Win=66240 Len=0
450302 146.465686 77.77.39.116 -> 244.3.210.197 TCP 64 57088 > http [ACK] Seq=15480 Ack=333547 Win=66240 Len=0
450430 146.528955 77.77.39.116 -> 244.3.210.197 TCP 64 57089 > http [ACK] Seq=15381 Ack=223399 Win=213972 Len=0
450433 146.529105 77.77.39.116 -> 244.3.210.197 TCP 64 57089 > http [ACK] Seq=15381 Ack=227539 Win=209832 Len=0
450442 146.529423 77.77.39.116 -> 244.3.210.197 TCP 64 57089 > http [ACK] Seq=15381 Ack=230545 Win=206828 Len=0
450465 146.540847 77.77.39.116 -> 244.3.210.197 TCP 64 57088 > http [ACK] Seq=16250 Ack=336288 Win=66240 Len=0
450923 146.750530 77.77.39.116 -> 244.3.210.197 TCP 64 57089 > http [ACK] Seq=17713 Ack=234550 Win=202820 Len=0
451349 146.987546 77.77.39.116 -> 244.3.210.197 TCP 64 57088 > http [ACK] Seq=20071 Ack=339711 Win=66240 Len=0
451668 147.097076 77.77.39.116 -> 244.3.210.197 TCP 64 57089 > http [ACK] Seq=19274 Ack=235554 Win=201816 Len=0
454078 148.152524 77.77.39.116 -> 244.3.210.197 TCP 64 57089 > http [ACK] Seq=20361 Ack=238314 Win=199056 Len=0
454084 148.152820 77.77.39.116 -> 244.3.210.197 TCP 64 57089 > http [ACK] Seq=20361 Ack=242454 Win=194916 Len=0
454090 148.153172 77.77.39.116 -> 244.3.210.197 TCP 64 57089 > http [ACK] Seq=20361 Ack=246594 Win=190776 Len=0
454096 148.153670 77.77.39.116 -> 244.3.210.197 TCP 64 57089 > http [ACK] Seq=20361 Ack=249354 Win=188016 Len=0
454105 148.154171 77.77.39.116 -> 244.3.210.197 TCP 64 57089 > http [ACK] Seq=20361 Ack=253494 Win=183876 Len=0
454109 148.154329 77.77.39.116 -> 244.3.210.197 TCP 64 57089 > http [ACK] Seq=20361 Ack=255008 Win=182364 Len=0
454667 148.424517 77.77.39.116 -> 244.3.210.197 TCP 64 57089 > http [ACK] Seq=21215 Ack=257768 Win=179604 Len=0
454673 148.424713 77.77.39.116 -> 244.3.210.197 TCP 64 57089 > http [ACK] Seq=21215 Ack=261908 Win=175464 Len=0
454674 148.424750 77.77.39.116 -> 244.3.210.197 TCP 64 57089 > http [ACK] Seq=21215 Ack=266048 Win=171324 Len=0
454685 148.425357 77.77.39.116 -> 244.3.210.197 TCP 64 57089 > http [ACK] Seq=21215 Ack=270188 Win=167184 Len=0
454691 148.425968 77.77.39.116 -> 244.3.210.197 TCP 64 57089 > http [ACK] Seq=21215 Ack=274328 Win=163044 Len=0
454692 148.425972 77.77.39.116 -> 244.3.210.197 TCP 64 57089 > http [ACK] Seq=21215 Ack=278468 Win=158904 Len=0
454703 148.426599 77.77.39.116 -> 244.3.210.197 TCP 64 57089 > http [ACK] Seq=21215 Ack=281132 Win=156240 Len=0
454709 148.426921 77.77.39.116 -> 244.3.210.197 TCP 64 57088 > http [ACK] Seq=20913 Ack=343851 Win=66240 Len=0
454718 148.427517 77.77.39.116 -> 244.3.210.197 TCP 64 57088 > http [ACK] Seq=20913 Ack=347991 Win=66240 Len=0
454724 148.427719 77.77.39.116 -> 244.3.210.197 TCP 64 57088 > http [ACK] Seq=20913 Ack=352131 Win=62100 Len=0
454730 148.428110 77.77.39.116 -> 244.3.210.197 TCP 64 57088 > http [ACK] Seq=20913 Ack=353846 Win=60384 Len=0
454736 148.429222 77.77.39.116 -> 244.3.210.197 TCP 64 [TCP Window Update] 57088 > http [ACK] Seq=20913 Ack=353846 Win=64136 Len=0
454744 148.430793 77.77.39.116 -> 244.3.210.197 TCP 64 [TCP Window Update] 57088 > http [ACK] Seq=20913 Ack=353846 Win=66240 Len=0
454954 148.505386 77.77.39.116 -> 244.3.210.197 TCP 64 57089 > http [ACK] Seq=22078 Ack=283892 Win=153480 Len=0
454964 148.505747 77.77.39.116 -> 244.3.210.197 TCP 64 57089 > http [ACK] Seq=22078 Ack=285934 Win=151436 Len=0
454976 148.506357 77.77.39.116 -> 244.3.210.197 TCP 64 57088 > http [ACK] Seq=21774 Ack=355934 Win=66240 Len=0
455325 148.607377 77.77.39.116 -> 244.3.210.197 TCP 64 57089 > http [ACK] Seq=22939 Ack=288026 Win=149344 Len=0
455356 148.610934 77.77.39.116 -> 244.3.210.197 TCP 64 57088 > http [ACK] Seq=22635 Ack=358140 Win=66240 Len=0
455513 148.684097 77.77.39.116 -> 244.3.210.197 TCP 64 57089 > http [ACK] Seq=23800 Ack=289998 Win=147372 Len=0
455530 148.687576 77.77.39.116 -> 244.3.210.197 TCP 64 57088 > http [ACK] Seq=23496 Ack=360218 Win=66240 Len=0
455739 148.759241 77.77.39.116 -> 244.3.210.197 TCP 64 57089 > http [ACK] Seq=24661 Ack=292337 Win=145036 Len=0
455754 148.761842 77.77.39.116 -> 244.3.210.197 TCP 64 57088 > http [ACK] Seq=24332 Ack=362978 Win=66240 Len=0
455762 148.762827 77.77.39.116 -> 244.3.210.197 TCP 64 57088 > http [ACK] Seq=24332 Ack=364785 Win=66240 Len=0
455984 148.836690 77.77.39.116 -> 244.3.210.197 TCP 64 57088 > http [ACK] Seq=25183 Ack=367545 Win=66240 Len=0
456000 148.837340 77.77.39.116 -> 244.3.210.197 TCP 64 57088 > http [ACK] Seq=25183 Ack=371685 Win=66240 Len=0
456001 148.837343 77.77.39.116 -> 244.3.210.197 TCP 64 57088 > http [ACK] Seq=25183 Ack=375825 Win=64860 Len=0
456015 148.837821 77.77.39.116 -> 244.3.210.197 TCP 64 [TCP Window Update] 57088 > http [ACK] Seq=25183 Ack=375825 Win=66240 Len=0
456016 148.837825 77.77.39.116 -> 244.3.210.197 TCP 64 57088 > http [ACK] Seq=25183 Ack=379965 Win=66240 Len=0
456017 148.837829 77.77.39.116 -> 244.3.210.197 TCP 64 57088 > http [ACK] Seq=25183 Ack=384105 Win=64860 Len=0
456033 148.838358 77.77.39.116 -> 244.3.210.197 TCP 64 57088 > http [ACK] Seq=25183 Ack=388245 Win=60720 Len=0
456035 148.838757 77.77.39.116 -> 244.3.210.197 TCP 64 57088 > http [ACK] Seq=25183 Ack=389673 Win=59292 Len=0
456061 148.842721 77.77.39.116 -> 244.3.210.197 TCP 64 [TCP Window Update] 57088 > http [ACK] Seq=25183 Ack=389673 Win=66240 Len=0
456531 149.031382 77.77.39.116 -> 244.3.210.197 TCP 64 57089 > http [ACK] Seq=25493 Ack=292675 Win=144696 Len=0
684442 214.657146 77.77.39.116 -> 244.3.210.197 TCP 64 57089 > http [RST, ACK] Seq=25493 Ack=292675 Win=0 Len=0
684450 214.657670 77.77.39.116 -> 244.3.210.197 TCP 64 57088 > http [RST, ACK] Seq=25183 Ack=389673 Win=0 Len=0
684453 214.657817 77.77.39.116 -> 244.3.210.197 TCP 64 57087 > http [RST, ACK] Seq=754 Ack=351 Win=0 Len=0
