408804 136.576948 81.67.217.159 -> 244.3.160.239 TCP 64 http > 34306 [SYN, ACK] Seq=0 Ack=1 Win=8767 Len=0 MSS=1460
409006 136.620095 81.67.217.159 -> 244.3.160.239 TCP 64 http > 34306 [ACK] Seq=1 Ack=975 Win=48666 Len=0
430302 140.621584 81.67.217.159 -> 244.3.160.239 TCP 78 [TCP Previous segment not captured] [TCP segment of a reassembled PDU]
431095 140.818869 81.67.217.159 -> 244.3.160.239 TCP 78 [TCP segment of a reassembled PDU]
438175 142.912330 81.67.217.159 -> 244.3.160.239 TCP 78 [TCP Previous segment not captured] [TCP segment of a reassembled PDU]
440026 143.355789 81.67.217.159 -> 244.3.160.239 TCP 64 http > 34306 [ACK] Seq=2716253 Ack=976 Win=49640 Len=0
440029 143.356095 81.67.217.159 -> 244.3.160.239 TCP 64 http > 34306 [FIN, ACK] Seq=2716253 Ack=976 Win=49640 Len=0
