475215 156.725686 82.181.188.253 -> 41.177.98.143 TCP 140 pe-mike > vcom-tunnel [PSH, ACK] Seq=1 Ack=1 Win=63985 Len=82
475290 156.776545 82.181.188.253 -> 41.177.98.143 TCP 64 pe-mike > vcom-tunnel [ACK] Seq=83 Ack=3328 Win=64512 Len=0
806056 263.399693 82.181.188.253 -> 41.177.98.143 TCP 143 pe-mike > vcom-tunnel [PSH, ACK] Seq=83 Ack=3328 Win=64512 Len=85
806184 263.437749 82.181.188.253 -> 41.177.98.143 TCP 65 pe-mike > vcom-tunnel [PSH, ACK] Seq=168 Ack=3339 Win=64501 Len=7
806522 263.526758 82.181.188.253 -> 41.177.98.143 TCP 64 pe-mike > vcom-tunnel [ACK] Seq=175 Ack=7280 Win=64512 Len=0
817506 266.743939 82.181.188.253 -> 41.177.98.143 TCP 140 pe-mike > vcom-tunnel [PSH, ACK] Seq=175 Ack=7280 Win=64512 Len=82
818167 266.952159 82.181.188.253 -> 41.177.98.143 TCP 64 pe-mike > vcom-tunnel [ACK] Seq=257 Ack=7719 Win=64073 Len=0
