112020  39.958338 82.242.98.106 -> 244.3.160.239 TCP 66 http > 33619 [SYN, ACK] Seq=0 Ack=1 Win=4380 Len=0 MSS=1460 SACK_PERM=1
112604  40.117109 82.242.98.106 -> 244.3.160.239 TCP 66 http > 33622 [SYN, ACK] Seq=0 Ack=1 Win=4380 Len=0 MSS=1460 SACK_PERM=1
112605  40.117114 82.242.98.106 -> 244.3.160.239 TCP 66 http > 33623 [SYN, ACK] Seq=0 Ack=1 Win=4380 Len=0 MSS=1460 SACK_PERM=1
112613  40.119986 82.242.98.106 -> 244.3.160.239 TCP 66 http > 33624 [SYN, ACK] Seq=0 Ack=1 Win=4380 Len=0 MSS=1460 SACK_PERM=1
113015  40.220437 82.242.98.106 -> 244.3.160.239 TCP 64 http > 33619 [ACK] Seq=994 Ack=952 Win=5330 Len=0
113016  40.221401 82.242.98.106 -> 244.3.160.239 TCP 64 http > 33619 [FIN, ACK] Seq=994 Ack=952 Win=5330 Len=0
113671  40.439804 82.242.98.106 -> 244.3.160.239 TCP 64 http > 33622 [ACK] Seq=994 Ack=953 Win=5331 Len=0
113673  40.440053 82.242.98.106 -> 244.3.160.239 TCP 64 http > 33623 [ACK] Seq=994 Ack=953 Win=5331 Len=0
113674  40.440602 82.242.98.106 -> 244.3.160.239 TCP 64 http > 33622 [FIN, ACK] Seq=994 Ack=953 Win=5331 Len=0
113676  40.441305 82.242.98.106 -> 244.3.160.239 TCP 64 http > 33623 [FIN, ACK] Seq=994 Ack=953 Win=5331 Len=0
113678  40.442155 82.242.98.106 -> 244.3.160.239 TCP 64 http > 33624 [ACK] Seq=994 Ack=953 Win=5331 Len=0
113679  40.442282 82.242.98.106 -> 244.3.160.239 TCP 64 http > 33624 [FIN, ACK] Seq=994 Ack=953 Win=5331 Len=0
157357  53.618620 82.242.98.106 -> 244.3.160.239 TCP 66 http > 33664 [SYN, ACK] Seq=0 Ack=1 Win=4380 Len=0 MSS=1460 SACK_PERM=1
158411  53.940036 82.242.98.106 -> 244.3.160.239 TCP 64 http > 33664 [ACK] Seq=1712 Ack=1004 Win=5382 Len=0
158414  53.941082 82.242.98.106 -> 244.3.160.239 TCP 64 http > 33664 [FIN, ACK] Seq=1712 Ack=1004 Win=5382 Len=0
385180 127.617013 82.242.98.106 -> 244.3.160.239 TCP 66 http > 34239 [SYN, ACK] Seq=0 Ack=1 Win=4380 Len=0 MSS=1460 SACK_PERM=1
385775 128.018638 82.242.98.106 -> 244.3.160.239 TCP 64 http > 34239 [ACK] Seq=19845 Ack=967 Win=5345 Len=0
385776 128.019316 82.242.98.106 -> 244.3.160.239 TCP 64 http > 34239 [FIN, ACK] Seq=19845 Ack=967 Win=5345 Len=0
457193 149.284203 82.242.98.106 -> 244.3.160.239 TCP 66 http > 34313 [SYN, ACK] Seq=0 Ack=1 Win=4380 Len=0 MSS=1460 SACK_PERM=1
457407 149.377347 82.242.98.106 -> 244.3.160.239 TCP 66 http > 34314 [SYN, ACK] Seq=0 Ack=1 Win=4380 Len=0 MSS=1460 SACK_PERM=1
457521 149.437602 82.242.98.106 -> 244.3.160.239 TCP 66 http > 34315 [SYN, ACK] Seq=0 Ack=1 Win=4380 Len=0 MSS=1460 SACK_PERM=1
457949 149.578283 82.242.98.106 -> 244.3.160.239 TCP 64 http > 34313 [ACK] Seq=994 Ack=1015 Win=5393 Len=0
457950 149.578955 82.242.98.106 -> 244.3.160.239 TCP 64 http > 34313 [FIN, ACK] Seq=994 Ack=1015 Win=5393 Len=0
458138 149.688340 82.242.98.106 -> 244.3.160.239 TCP 64 http > 34314 [ACK] Seq=994 Ack=1015 Win=5393 Len=0
458141 149.689154 82.242.98.106 -> 244.3.160.239 TCP 64 http > 34315 [ACK] Seq=994 Ack=1015 Win=5393 Len=0
458142 149.689159 82.242.98.106 -> 244.3.160.239 TCP 64 http > 34314 [FIN, ACK] Seq=994 Ack=1015 Win=5393 Len=0
458146 149.690574 82.242.98.106 -> 244.3.160.239 TCP 64 http > 34315 [FIN, ACK] Seq=994 Ack=1015 Win=5393 Len=0
522888 169.645157 82.242.98.106 -> 244.3.160.239 TCP 66 http > 34607 [SYN, ACK] Seq=0 Ack=1 Win=4380 Len=0 MSS=1460 SACK_PERM=1
522988 169.739004 82.242.98.106 -> 244.3.160.239 TCP 66 http > 34608 [SYN, ACK] Seq=0 Ack=1 Win=4380 Len=0 MSS=1460 SACK_PERM=1
523051 169.794351 82.242.98.106 -> 244.3.160.239 TCP 64 http > 34607 [ACK] Seq=1 Ack=972 Win=5351 Len=0
523226 169.851120 82.242.98.106 -> 244.3.160.239 TCP 66 http > 34609 [SYN, ACK] Seq=0 Ack=1 Win=4380 Len=0 MSS=1460 SACK_PERM=1
523229 169.851553 82.242.98.106 -> 244.3.160.239 TCP 66 http > 34610 [SYN, ACK] Seq=0 Ack=1 Win=4380 Len=0 MSS=1460 SACK_PERM=1
523235 169.852257 82.242.98.106 -> 244.3.160.239 TCP 66 http > 34611 [SYN, ACK] Seq=0 Ack=1 Win=4380 Len=0 MSS=1460 SACK_PERM=1
523238 169.852647 82.242.98.106 -> 244.3.160.239 TCP 66 http > 34612 [SYN, ACK] Seq=0 Ack=1 Win=4380 Len=0 MSS=1460 SACK_PERM=1
523306 169.891236 82.242.98.106 -> 244.3.160.239 TCP 64 http > 34608 [ACK] Seq=994 Ack=974 Win=5352 Len=0
523308 169.891915 82.242.98.106 -> 244.3.160.239 TCP 64 http > 34608 [FIN, ACK] Seq=994 Ack=974 Win=5352 Len=0
523344 169.913779 82.242.98.106 -> 244.3.160.239 TCP 66 http > 34613 [SYN, ACK] Seq=0 Ack=1 Win=4380 Len=0 MSS=1460 SACK_PERM=1
523477 169.986873 82.242.98.106 -> 244.3.160.239 TCP 66 http > 34615 [SYN, ACK] Seq=0 Ack=1 Win=4380 Len=0 MSS=1460 SACK_PERM=1
523504 170.016481 82.242.98.106 -> 244.3.160.239 TCP 66 http > 34616 [SYN, ACK] Seq=0 Ack=1 Win=4380 Len=0 MSS=1460 SACK_PERM=1
523505 170.016486 82.242.98.106 -> 244.3.160.239 TCP 66 http > 34617 [SYN, ACK] Seq=0 Ack=1 Win=4380 Len=0 MSS=1460 SACK_PERM=1
523661 170.100767 82.242.98.106 -> 244.3.160.239 TCP 64 http > 34607 [ACK] Seq=994 Ack=973 Win=5351 Len=0
523662 170.101050 82.242.98.106 -> 244.3.160.239 TCP 64 http > 34610 [ACK] Seq=994 Ack=974 Win=5352 Len=0
523663 170.101170 82.242.98.106 -> 244.3.160.239 TCP 64 http > 34611 [ACK] Seq=994 Ack=974 Win=5352 Len=0
523664 170.101212 82.242.98.106 -> 244.3.160.239 TCP 64 http > 34607 [FIN, ACK] Seq=994 Ack=973 Win=5351 Len=0
523666 170.101709 82.242.98.106 -> 244.3.160.239 TCP 64 http > 34610 [FIN, ACK] Seq=994 Ack=974 Win=5352 Len=0
523668 170.101804 82.242.98.106 -> 244.3.160.239 TCP 64 http > 34611 [FIN, ACK] Seq=994 Ack=974 Win=5352 Len=0
523943 170.209278 82.242.98.106 -> 244.3.160.239 TCP 64 http > 34613 [ACK] Seq=994 Ack=974 Win=5352 Len=0
523946 170.209522 82.242.98.106 -> 244.3.160.239 TCP 64 http > 34609 [ACK] Seq=994 Ack=974 Win=5352 Len=0
523947 170.209527 82.242.98.106 -> 244.3.160.239 TCP 64 http > 34613 [FIN, ACK] Seq=994 Ack=974 Win=5352 Len=0
523949 170.209803 82.242.98.106 -> 244.3.160.239 TCP 64 http > 34612 [ACK] Seq=994 Ack=974 Win=5352 Len=0
523950 170.210888 82.242.98.106 -> 244.3.160.239 TCP 64 http > 34612 [FIN, ACK] Seq=994 Ack=974 Win=5352 Len=0
523952 170.210987 82.242.98.106 -> 244.3.160.239 TCP 64 http > 34609 [FIN, ACK] Seq=994 Ack=974 Win=5352 Len=0
524215 170.318408 82.242.98.106 -> 244.3.160.239 TCP 64 http > 34616 [ACK] Seq=994 Ack=974 Win=5352 Len=0
524216 170.318413 82.242.98.106 -> 244.3.160.239 TCP 64 http > 34617 [ACK] Seq=994 Ack=974 Win=5352 Len=0
524218 170.319185 82.242.98.106 -> 244.3.160.239 TCP 64 http > 34615 [ACK] Seq=994 Ack=974 Win=5352 Len=0
524222 170.319374 82.242.98.106 -> 244.3.160.239 TCP 64 http > 34616 [FIN, ACK] Seq=994 Ack=974 Win=5352 Len=0
524224 170.319751 82.242.98.106 -> 244.3.160.239 TCP 64 http > 34617 [FIN, ACK] Seq=994 Ack=974 Win=5352 Len=0
524225 170.319817 82.242.98.106 -> 244.3.160.239 TCP 64 http > 34615 [FIN, ACK] Seq=994 Ack=974 Win=5352 Len=0
567508 181.372781 82.242.98.106 -> 244.3.160.239 TCP 66 http > 34731 [SYN, ACK] Seq=0 Ack=1 Win=4380 Len=0 MSS=1460 SACK_PERM=1
568805 181.729215 82.242.98.106 -> 244.3.160.239 TCP 64 http > 34731 [ACK] Seq=1712 Ack=983 Win=5361 Len=0
568806 181.729897 82.242.98.106 -> 244.3.160.239 TCP 64 http > 34731 [FIN, ACK] Seq=1712 Ack=983 Win=5361 Len=0
