28631  11.569587 82.242.77.108 -> 41.177.98.176 TCP 78 46996 > http [SYN] Seq=0 Win=5840 Len=0 MSS=1460 SACK_PERM=1 TSval=1799119489 TSecr=0 WS=4
28632  11.569620 82.242.77.108 -> 41.177.98.176 TCP 78 46995 > http [SYN] Seq=0 Win=5840 Len=0 MSS=1460 SACK_PERM=1 TSval=1799119489 TSecr=0 WS=4
28693  11.617593 82.242.77.108 -> 41.177.98.176 TCP 70 46996 > http [ACK] Seq=1 Ack=1 Win=5840 Len=0 TSval=1799119501 TSecr=1541715
28695  11.617761 82.242.77.108 -> 41.177.98.176 TCP 70 46995 > http [ACK] Seq=1 Ack=1 Win=5840 Len=0 TSval=1799119502 TSecr=1541716
32017  13.549837 82.242.77.108 -> 41.177.98.176 TCP 70 46995 > http [ACK] Seq=321 Ack=1449 Win=8736 Len=0 TSval=1799119984 TSecr=1541909
32018  13.549842 82.242.77.108 -> 41.177.98.176 TCP 70 46995 > http [ACK] Seq=321 Ack=2897 Win=11632 Len=0 TSval=1799119984 TSecr=1541909
32019  13.549846 82.242.77.108 -> 41.177.98.176 TCP 70 46995 > http [ACK] Seq=321 Ack=4345 Win=14528 Len=0 TSval=1799119984 TSecr=1541909
32077  13.598496 82.242.77.108 -> 41.177.98.176 TCP 70 46995 > http [ACK] Seq=321 Ack=5793 Win=17424 Len=0 TSval=1799119997 TSecr=1541914
32078  13.598552 82.242.77.108 -> 41.177.98.176 TCP 70 46995 > http [ACK] Seq=321 Ack=7241 Win=20320 Len=0 TSval=1799119997 TSecr=1541914
32081  13.598960 82.242.77.108 -> 41.177.98.176 TCP 70 46995 > http [ACK] Seq=321 Ack=8689 Win=23216 Len=0 TSval=1799119997 TSecr=1541914
32082  13.598964 82.242.77.108 -> 41.177.98.176 TCP 70 46995 > http [ACK] Seq=321 Ack=10137 Win=26112 Len=0 TSval=1799119997 TSecr=1541914
32083  13.598968 82.242.77.108 -> 41.177.98.176 TCP 70 46995 > http [ACK] Seq=321 Ack=11585 Win=29008 Len=0 TSval=1799119997 TSecr=1541914
32084  13.599002 82.242.77.108 -> 41.177.98.176 TCP 70 46995 > http [ACK] Seq=321 Ack=13033 Win=31904 Len=0 TSval=1799119997 TSecr=1541914
32160  13.646501 82.242.77.108 -> 41.177.98.176 TCP 70 46995 > http [ACK] Seq=321 Ack=14481 Win=34800 Len=0 TSval=1799120009 TSecr=1541918
32161  13.646506 82.242.77.108 -> 41.177.98.176 TCP 70 46995 > http [ACK] Seq=321 Ack=15929 Win=37696 Len=0 TSval=1799120009 TSecr=1541918
32164  13.647125 82.242.77.108 -> 41.177.98.176 TCP 70 46995 > http [ACK] Seq=321 Ack=17377 Win=40592 Len=0 TSval=1799120009 TSecr=1541918
32165  13.647130 82.242.77.108 -> 41.177.98.176 TCP 70 46995 > http [ACK] Seq=321 Ack=18825 Win=43488 Len=0 TSval=1799120009 TSecr=1541918
32167  13.648138 82.242.77.108 -> 41.177.98.176 TCP 70 46995 > http [ACK] Seq=321 Ack=20273 Win=46384 Len=0 TSval=1799120009 TSecr=1541918
32168  13.648142 82.242.77.108 -> 41.177.98.176 TCP 70 46995 > http [ACK] Seq=321 Ack=21657 Win=49280 Len=0 TSval=1799120009 TSecr=1541918
32716  13.876769 82.242.77.108 -> 41.177.98.176 TCP 70 46995 > http [ACK] Seq=766 Ack=24553 Win=55072 Len=0 TSval=1799120066 TSecr=1541941
32719  13.877332 82.242.77.108 -> 41.177.98.176 TCP 70 46995 > http [ACK] Seq=766 Ack=26990 Win=60864 Len=0 TSval=1799120066 TSecr=1541941
32755  13.887873 82.242.77.108 -> 41.177.98.176 TCP 70 46995 > http [ACK] Seq=766 Ack=27887 Win=63760 Len=0 TSval=1799120069 TSecr=1541942
32866  13.942163 82.242.77.108 -> 41.177.98.176 TCP 70 46995 > http [ACK] Seq=1006 Ack=30783 Win=64088 Len=0 TSval=1799120082 TSecr=1541948
32949  13.979561 82.242.77.108 -> 41.177.98.176 TCP 70 46995 > http [ACK] Seq=1006 Ack=31779 Win=64088 Len=0 TSval=1799120092 TSecr=1541948
33715  14.323401 82.242.77.108 -> 41.177.98.176 TCP 70 46996 > http [ACK] Seq=321 Ack=1449 Win=8736 Len=0 TSval=1799120178 TSecr=1541986
33717  14.323606 82.242.77.108 -> 41.177.98.176 TCP 70 46996 > http [ACK] Seq=321 Ack=2897 Win=11632 Len=0 TSval=1799120178 TSecr=1541986
33722  14.324706 82.242.77.108 -> 41.177.98.176 TCP 70 46996 > http [ACK] Seq=321 Ack=4345 Win=14528 Len=0 TSval=1799120178 TSecr=1541986
33887  14.372238 82.242.77.108 -> 41.177.98.176 TCP 70 46996 > http [ACK] Seq=321 Ack=5335 Win=17424 Len=0 TSval=1799120190 TSecr=1541991
33890  14.372896 82.242.77.108 -> 41.177.98.176 TCP 70 46996 > http [ACK] Seq=321 Ack=6783 Win=20320 Len=0 TSval=1799120190 TSecr=1541991
33891  14.372970 82.242.77.108 -> 41.177.98.176 TCP 70 46996 > http [ACK] Seq=321 Ack=8231 Win=23216 Len=0 TSval=1799120190 TSecr=1541991
33892  14.373009 82.242.77.108 -> 41.177.98.176 TCP 70 46996 > http [ACK] Seq=321 Ack=9679 Win=26112 Len=0 TSval=1799120190 TSecr=1541991
33903  14.377526 82.242.77.108 -> 41.177.98.176 TCP 70 46996 > http [ACK] Seq=321 Ack=10463 Win=29008 Len=0 TSval=1799120190 TSecr=1541991
33904  14.377932 82.242.77.108 -> 41.177.98.176 TCP 70 46996 > http [ACK] Seq=321 Ack=11911 Win=31904 Len=0 TSval=1799120190 TSecr=1541991
33972  14.420318 82.242.77.108 -> 41.177.98.176 TCP 70 46996 > http [ACK] Seq=321 Ack=13359 Win=34800 Len=0 TSval=1799120202 TSecr=1541996
33973  14.420322 82.242.77.108 -> 41.177.98.176 TCP 70 46996 > http [ACK] Seq=321 Ack=14807 Win=37696 Len=0 TSval=1799120202 TSecr=1541996
33974  14.420327 82.242.77.108 -> 41.177.98.176 TCP 70 46996 > http [ACK] Seq=321 Ack=15591 Win=40592 Len=0 TSval=1799120202 TSecr=1541996
33982  14.421952 82.242.77.108 -> 41.177.98.176 TCP 70 46996 > http [ACK] Seq=321 Ack=17039 Win=43488 Len=0 TSval=1799120202 TSecr=1541996
33983  14.421957 82.242.77.108 -> 41.177.98.176 TCP 70 46996 > http [ACK] Seq=321 Ack=18487 Win=46384 Len=0 TSval=1799120203 TSecr=1541996
33984  14.422371 82.242.77.108 -> 41.177.98.176 TCP 70 46996 > http [ACK] Seq=321 Ack=19557 Win=49280 Len=0 TSval=1799120203 TSecr=1541996
34882  14.645993 82.242.77.108 -> 41.177.98.176 TCP 70 46996 > http [ACK] Seq=766 Ack=22453 Win=55072 Len=0 TSval=1799120258 TSecr=1542018
34884  14.646670 82.242.77.108 -> 41.177.98.176 TCP 70 46996 > http [ACK] Seq=766 Ack=24890 Win=60864 Len=0 TSval=1799120259 TSecr=1542018
34913  14.655614 82.242.77.108 -> 41.177.98.176 TCP 70 46996 > http [ACK] Seq=766 Ack=25787 Win=63760 Len=0 TSval=1799120261 TSecr=1542019
35072  14.710122 82.242.77.108 -> 41.177.98.176 TCP 70 46996 > http [ACK] Seq=1006 Ack=28683 Win=64088 Len=0 TSval=1799120274 TSecr=1542025
40681  17.031948 82.242.77.108 -> 41.177.98.176 TCP 70 46996 > http [ACK] Seq=1326 Ack=32575 Win=64088 Len=0 TSval=1799120855 TSecr=1542257
40682  17.031953 82.242.77.108 -> 41.177.98.176 TCP 70 46996 > http [ACK] Seq=1326 Ack=35012 Win=64088 Len=0 TSval=1799120855 TSecr=1542257
40778  17.034598 82.242.77.108 -> 41.177.98.176 TCP 70 46996 > http [ACK] Seq=1326 Ack=37908 Win=64088 Len=0 TSval=1799120855 TSecr=1542257
40780  17.034640 82.242.77.108 -> 41.177.98.176 TCP 70 46996 > http [ACK] Seq=1326 Ack=40140 Win=64088 Len=0 TSval=1799120856 TSecr=1542257
40800  17.036938 82.242.77.108 -> 41.177.98.176 TCP 70 46996 > http [ACK] Seq=1326 Ack=43036 Win=64088 Len=0 TSval=1799120856 TSecr=1542257
40801  17.036963 82.242.77.108 -> 41.177.98.176 TCP 70 46996 > http [ACK] Seq=1326 Ack=45268 Win=64088 Len=0 TSval=1799120856 TSecr=1542257
40803  17.042516 82.242.77.108 -> 41.177.98.176 TCP 70 46996 > http [ACK] Seq=1326 Ack=48164 Win=64088 Len=0 TSval=1799120857 TSecr=1542258
40804  17.042521 82.242.77.108 -> 41.177.98.176 TCP 70 46996 > http [ACK] Seq=1326 Ack=49234 Win=64088 Len=0 TSval=1799120857 TSecr=1542258
70003  29.002034 82.242.77.108 -> 41.177.98.176 TCP 70 46995 > http [ACK] Seq=1006 Ack=31780 Win=64088 Len=0 TSval=1799123848 TSecr=1543449
81399  31.823108 82.242.77.108 -> 41.177.98.176 TCP 70 46995 > http [FIN, ACK] Seq=1006 Ack=31780 Win=64088 Len=0 TSval=1799124553 TSecr=1543449
82535  32.148958 82.242.77.108 -> 41.177.98.176 TCP 70 46996 > http [ACK] Seq=1326 Ack=49235 Win=64088 Len=0 TSval=1799124634 TSecr=1543765
98833  36.827476 82.242.77.108 -> 41.177.98.176 TCP 70 46996 > http [FIN, ACK] Seq=1326 Ack=49235 Win=64088 Len=0 TSval=1799125804 TSecr=1543765
