106777  38.484805 82.242.98.77 -> 244.3.160.239 TCP 66 http > 33588 [SYN, ACK] Seq=0 Ack=1 Win=4380 Len=0 MSS=1460 SACK_PERM=1
107215  38.620880 82.242.98.77 -> 244.3.160.239 TCP 64 http > 33588 [ACK] Seq=1 Ack=1314 Win=5693 Len=0
111122  39.720632 82.242.98.77 -> 244.3.160.239 TCP 64 http > 33588 [FIN, ACK] Seq=45439 Ack=1314 Win=5693 Len=0
111258  39.760110 82.242.98.77 -> 244.3.160.239 TCP 64 http > 33588 [ACK] Seq=45440 Ack=1315 Win=5693 Len=0
145199  49.781721 82.242.98.77 -> 244.3.160.239 TCP 66 http > 33633 [SYN, ACK] Seq=0 Ack=1 Win=4380 Len=0 MSS=1460 SACK_PERM=1
145319  49.818519 82.242.98.77 -> 244.3.160.239 TCP 64 http > 33633 [ACK] Seq=1 Ack=1501 Win=5880 Len=0
156600  53.325786 82.242.98.77 -> 244.3.160.239 TCP 64 http > 33633 [FIN, ACK] Seq=83626 Ack=1501 Win=5880 Len=0
156695  53.362174 82.242.98.77 -> 244.3.160.239 TCP 64 http > 33633 [ACK] Seq=83627 Ack=1502 Win=5880 Len=0
157636  53.694393 82.242.98.77 -> 244.3.160.239 TCP 66 http > 33665 [SYN, ACK] Seq=0 Ack=1 Win=4380 Len=0 MSS=1460 SACK_PERM=1
157728  53.730947 82.242.98.77 -> 244.3.160.239 TCP 64 http > 33665 [ACK] Seq=1 Ack=1488 Win=5867 Len=0
158081  53.864862 82.242.98.77 -> 244.3.160.239 TCP 64 http > 33665 [FIN, ACK] Seq=204 Ack=1488 Win=5867 Len=0
158231  53.900804 82.242.98.77 -> 244.3.160.239 TCP 64 http > 33665 [ACK] Seq=205 Ack=1489 Win=5867 Len=0
158842  54.075334 82.242.98.77 -> 244.3.160.239 TCP 66 http > 33670 [SYN, ACK] Seq=0 Ack=1 Win=4380 Len=0 MSS=1460 SACK_PERM=1
158844  54.075637 82.242.98.77 -> 244.3.160.239 TCP 66 http > 33669 [SYN, ACK] Seq=0 Ack=1 Win=4380 Len=0 MSS=1460 SACK_PERM=1
158848  54.076738 82.242.98.77 -> 244.3.160.239 TCP 66 http > 33671 [SYN, ACK] Seq=0 Ack=1 Win=4380 Len=0 MSS=1460 SACK_PERM=1
158851  54.078158 82.242.98.77 -> 244.3.160.239 TCP 66 http > 33672 [SYN, ACK] Seq=0 Ack=1 Win=4380 Len=0 MSS=1460 SACK_PERM=1
158853  54.078669 82.242.98.77 -> 244.3.160.239 TCP 66 http > 33674 [SYN, ACK] Seq=0 Ack=1 Win=4380 Len=0 MSS=1460 SACK_PERM=1
158909  54.126554 82.242.98.77 -> 244.3.160.239 TCP 64 http > 33674 [FIN, ACK] Seq=204 Ack=1259 Win=5638 Len=0
158925  54.128597 82.242.98.77 -> 244.3.160.239 TCP 64 http > 33671 [FIN, ACK] Seq=217 Ack=1272 Win=5651 Len=0
159073  54.161277 82.242.98.77 -> 244.3.160.239 TCP 64 http > 33674 [ACK] Seq=205 Ack=1260 Win=5638 Len=0
159156  54.181033 82.242.98.77 -> 244.3.160.239 TCP 64 http > 33670 [FIN, ACK] Seq=31003 Ack=1286 Win=5665 Len=0
159241  54.211970 82.242.98.77 -> 244.3.160.239 TCP 64 http > 33669 [ACK] Seq=1 Ack=1259 Win=5638 Len=0
159251  54.213846 82.242.98.77 -> 244.3.160.239 TCP 64 http > 33672 [ACK] Seq=1 Ack=1286 Win=5665 Len=0
159279  54.223623 82.242.98.77 -> 244.3.160.239 TCP 64 http > 33670 [ACK] Seq=31004 Ack=1287 Win=5665 Len=0
161166  54.853586 82.242.98.77 -> 244.3.160.239 TCP 64 http > 33672 [FIN, ACK] Seq=190 Ack=1286 Win=5665 Len=0
161265  54.889543 82.242.98.77 -> 244.3.160.239 TCP 64 http > 33672 [ACK] Seq=191 Ack=1287 Win=5665 Len=0
174892  58.137566 82.242.98.77 -> 244.3.160.239 TCP 64 http > 33669 [FIN, ACK] Seq=312 Ack=1259 Win=5638 Len=0
175398  58.319827 82.242.98.77 -> 244.3.160.239 TCP 64 http > 33669 [ACK] Seq=313 Ack=1260 Win=5638 Len=0
175669  58.378035 82.242.98.77 -> 244.3.160.239 TCP 64 http > 33671 [ACK] Seq=218 Ack=1273 Win=5651 Len=0
415190 138.560045 82.242.98.77 -> 244.3.160.239 TCP 66 http > 34308 [SYN, ACK] Seq=0 Ack=1 Win=4380 Len=0 MSS=1460 SACK_PERM=1
415345 138.595183 82.242.98.77 -> 244.3.160.239 TCP 64 http > 34308 [ACK] Seq=1 Ack=1482 Win=5861 Len=0
416314 138.746173 82.242.98.77 -> 244.3.160.239 TCP 64 http > 34308 [FIN, ACK] Seq=28619 Ack=1482 Win=5861 Len=0
416531 138.783602 82.242.98.77 -> 244.3.160.239 TCP 64 http > 34308 [ACK] Seq=28620 Ack=1483 Win=5861 Len=0
448489 145.706789 82.242.98.77 -> 244.3.160.239 TCP 66 http > 34312 [SYN, ACK] Seq=0 Ack=1 Win=4380 Len=0 MSS=1460 SACK_PERM=1
448555 145.744198 82.242.98.77 -> 244.3.160.239 TCP 64 http > 34312 [ACK] Seq=1 Ack=1519 Win=5898 Len=0
456515 149.026942 82.242.98.77 -> 244.3.160.239 TCP 64 http > 34312 [FIN, ACK] Seq=42030 Ack=1519 Win=5898 Len=0
456645 149.072029 82.242.98.77 -> 244.3.160.239 TCP 64 http > 34312 [ACK] Seq=42031 Ack=1520 Win=5898 Len=0
472811 156.006140 82.242.98.77 -> 244.3.160.239 TCP 66 http > 34342 [SYN, ACK] Seq=0 Ack=1 Win=4380 Len=0 MSS=1460 SACK_PERM=1
473032 156.042024 82.242.98.77 -> 244.3.160.239 TCP 64 http > 34342 [ACK] Seq=1 Ack=1486 Win=5865 Len=0
476175 157.154143 82.242.98.77 -> 244.3.160.239 TCP 64 http > 34342 [FIN, ACK] Seq=28414 Ack=1486 Win=5865 Len=0
476262 157.192281 82.242.98.77 -> 244.3.160.239 TCP 64 http > 34342 [ACK] Seq=28415 Ack=1487 Win=5865 Len=0
518445 167.694351 82.242.98.77 -> 244.3.160.239 TCP 66 http > 34578 [SYN, ACK] Seq=0 Ack=1 Win=4380 Len=0 MSS=1460 SACK_PERM=1
519117 167.831175 82.242.98.77 -> 244.3.160.239 TCP 64 http > 34578 [ACK] Seq=1 Ack=1460 Win=5839 Len=0
522610 169.462747 82.242.98.77 -> 244.3.160.239 TCP 64 http > 34578 [FIN, ACK] Seq=57434 Ack=1460 Win=5839 Len=0
522687 169.503220 82.242.98.77 -> 244.3.160.239 TCP 64 http > 34578 [ACK] Seq=57435 Ack=1461 Win=5839 Len=0
548411 176.889544 82.242.98.77 -> 244.3.160.239 TCP 66 http > 34713 [SYN, ACK] Seq=0 Ack=1 Win=4380 Len=0 MSS=1460 SACK_PERM=1
549454 177.025649 82.242.98.77 -> 244.3.160.239 TCP 64 http > 34713 [ACK] Seq=1 Ack=1348 Win=5727 Len=0
550287 177.178140 82.242.98.77 -> 244.3.160.239 TCP 64 http > 34713 [FIN, ACK] Seq=36163 Ack=1348 Win=5727 Len=0
550483 177.218903 82.242.98.77 -> 244.3.160.239 TCP 64 http > 34713 [ACK] Seq=36164 Ack=1349 Win=5727 Len=0
560041 179.865998 82.242.98.77 -> 244.3.160.239 TCP 66 http > 34725 [SYN, ACK] Seq=0 Ack=1 Win=4380 Len=0 MSS=1460 SACK_PERM=1
560457 180.003903 82.242.98.77 -> 244.3.160.239 TCP 64 http > 34725 [ACK] Seq=1 Ack=1414 Win=5793 Len=0
565849 180.955645 82.242.98.77 -> 244.3.160.239 TCP 64 http > 34725 [FIN, ACK] Seq=83702 Ack=1414 Win=5793 Len=0
566031 180.994101 82.242.98.77 -> 244.3.160.239 TCP 64 http > 34725 [ACK] Seq=83703 Ack=1415 Win=5793 Len=0
567777 181.428315 82.242.98.77 -> 244.3.160.239 TCP 66 http > 34732 [SYN, ACK] Seq=0 Ack=1 Win=4380 Len=0 MSS=1460 SACK_PERM=1
568323 181.563218 82.242.98.77 -> 244.3.160.239 TCP 64 http > 34732 [ACK] Seq=1 Ack=1433 Win=5812 Len=0
568427 181.620290 82.242.98.77 -> 244.3.160.239 TCP 64 http > 34732 [FIN, ACK] Seq=204 Ack=1433 Win=5812 Len=0
568570 181.656610 82.242.98.77 -> 244.3.160.239 TCP 64 http > 34732 [ACK] Seq=205 Ack=1434 Win=5812 Len=0
568585 181.663256 82.242.98.77 -> 244.3.160.239 TCP 66 http > 34734 [SYN, ACK] Seq=0 Ack=1 Win=4380 Len=0 MSS=1460 SACK_PERM=1
568703 181.712760 82.242.98.77 -> 244.3.160.239 TCP 64 http > 34734 [FIN, ACK] Seq=11453 Ack=1231 Win=5610 Len=0
568735 181.718678 82.242.98.77 -> 244.3.160.239 TCP 66 http > 34735 [SYN, ACK] Seq=0 Ack=1 Win=4380 Len=0 MSS=1460 SACK_PERM=1
568845 181.754057 82.242.98.77 -> 244.3.160.239 TCP 64 http > 34734 [ACK] Seq=11454 Ack=1232 Win=5610 Len=0
568849 181.757620 82.242.98.77 -> 244.3.160.239 TCP 66 http > 34737 [SYN, ACK] Seq=0 Ack=1 Win=4380 Len=0 MSS=1460 SACK_PERM=1
568853 181.758719 82.242.98.77 -> 244.3.160.239 TCP 66 http > 34738 [SYN, ACK] Seq=0 Ack=1 Win=4380 Len=0 MSS=1460 SACK_PERM=1
568859 181.759302 82.242.98.77 -> 244.3.160.239 TCP 66 http > 34739 [SYN, ACK] Seq=0 Ack=1 Win=4380 Len=0 MSS=1460 SACK_PERM=1
568931 181.802306 82.242.98.77 -> 244.3.160.239 TCP 64 http > 34737 [FIN, ACK] Seq=217 Ack=1217 Win=5596 Len=0
568938 181.802978 82.242.98.77 -> 244.3.160.239 TCP 64 http > 34739 [FIN, ACK] Seq=204 Ack=1204 Win=5583 Len=0
569122 181.837495 82.242.98.77 -> 244.3.160.239 TCP 64 http > 34737 [ACK] Seq=218 Ack=1218 Win=5596 Len=0
569123 181.837500 82.242.98.77 -> 244.3.160.239 TCP 64 http > 34739 [ACK] Seq=205 Ack=1205 Win=5583 Len=0
569178 181.854245 82.242.98.77 -> 244.3.160.239 TCP 64 http > 34735 [ACK] Seq=1 Ack=1204 Win=5583 Len=0
569182 181.861304 82.242.98.77 -> 244.3.160.239 TCP 64 http > 34738 [FIN, ACK] Seq=190 Ack=1231 Win=5610 Len=0
569196 181.877102 82.242.98.77 -> 244.3.160.239 TCP 64 http > 34735 [FIN, ACK] Seq=312 Ack=1204 Win=5583 Len=0
569222 181.896058 82.242.98.77 -> 244.3.160.239 TCP 64 http > 34738 [ACK] Seq=191 Ack=1232 Win=5610 Len=0
569682 182.045150 82.242.98.77 -> 244.3.160.239 TCP 64 http > 34735 [ACK] Seq=313 Ack=1205 Win=5583 Len=0
865585 286.147122 82.242.98.77 -> 244.3.160.239 TCP 66 http > 35359 [SYN, ACK] Seq=0 Ack=1 Win=4380 Len=0 MSS=1460 SACK_PERM=1
865979 286.283109 82.242.98.77 -> 244.3.160.239 TCP 64 http > 35359 [ACK] Seq=1 Ack=1358 Win=5737 Len=0
874282 289.310658 82.242.98.77 -> 244.3.160.239 TCP 64 http > 35359 [FIN, ACK] Seq=42096 Ack=1358 Win=5737 Len=0
874379 289.354738 82.242.98.77 -> 244.3.160.239 TCP 64 http > 35359 [ACK] Seq=42097 Ack=1359 Win=5737 Len=0
