6950   2.304836 85.186.40.192 -> 41.177.98.176 TCP 70 jerand-lm > http [ACK] Seq=862 Ack=2897 Win=32580 Len=0 TSval=442867842 TSecr=1540765
6956   2.305807 85.186.40.192 -> 41.177.98.176 TCP 70 jerand-lm > http [ACK] Seq=862 Ack=4345 Win=33304 Len=0 TSval=442867842 TSecr=1540765
6959   2.307328 85.186.40.192 -> 41.177.98.176 TCP 70 jerand-lm > http [ACK] Seq=862 Ack=5334 Win=32809 Len=0 TSval=442867842 TSecr=1540765
6963   2.308023 85.186.40.192 -> 41.177.98.176 TCP 70 jerand-lm > http [ACK] Seq=862 Ack=8230 Win=32580 Len=0 TSval=442867842 TSecr=1540765
7466   2.518807 85.186.40.192 -> 41.177.98.176 TCP 70 jerand-lm > http [ACK] Seq=862 Ack=9678 Win=33304 Len=0 TSval=442867844 TSecr=1540789
7484   2.531003 85.186.40.192 -> 41.177.98.176 TCP 70 jerand-lm > http [ACK] Seq=862 Ack=11126 Win=32580 Len=0 TSval=442867844 TSecr=1540789
7485   2.532392 85.186.40.192 -> 41.177.98.176 TCP 70 jerand-lm > http [ACK] Seq=862 Ack=12574 Win=33304 Len=0 TSval=442867844 TSecr=1540789
7488   2.533158 85.186.40.192 -> 41.177.98.176 TCP 70 jerand-lm > http [ACK] Seq=862 Ack=15470 Win=33304 Len=0 TSval=442867844 TSecr=1540789
7496   2.534610 85.186.40.192 -> 41.177.98.176 TCP 70 jerand-lm > http [ACK] Seq=862 Ack=18366 Win=32580 Len=0 TSval=442867844 TSecr=1540789
7501   2.535594 85.186.40.192 -> 41.177.98.176 TCP 70 jerand-lm > http [ACK] Seq=862 Ack=19814 Win=33304 Len=0 TSval=442867844 TSecr=1540789
7513   2.536757 85.186.40.192 -> 41.177.98.176 TCP 70 jerand-lm > http [ACK] Seq=862 Ack=19870 Win=33276 Len=0 TSval=442867844 TSecr=1540789
7586   2.561674 85.186.40.192 -> 41.177.98.176 TCP 70 jerand-lm > http [FIN, ACK] Seq=862 Ack=19870 Win=33304 Len=0 TSval=442867844 TSecr=1540789
7708   2.632233 85.186.40.192 -> 41.177.98.176 TCP 70 nessus > http [ACK] Seq=759 Ack=1534 Win=32537 Len=0 TSval=442867845 TSecr=1540799
7712   2.633226 85.186.40.192 -> 41.177.98.176 TCP 70 scientia-sdb > http [ACK] Seq=758 Ack=2202 Win=32927 Len=0 TSval=442867845 TSecr=1540800
7713   2.634296 85.186.40.192 -> 41.177.98.176 TCP 70 oracle-vp2 > http [ACK] Seq=758 Ack=298 Win=33155 Len=0 TSval=442867845 TSecr=1540801
7714   2.637575 85.186.40.192 -> 41.177.98.176 TCP 70 oracle-vp2 > http [ACK] Seq=758 Ack=3194 Win=32580 Len=0 TSval=442867845 TSecr=1540801
7717   2.639836 85.186.40.192 -> 41.177.98.176 TCP 70 oracle-vp2 > http [ACK] Seq=758 Ack=4642 Win=33304 Len=0 TSval=442867845 TSecr=1540801
7784   2.667119 85.186.40.192 -> 41.177.98.176 TCP 70 oracle-vp2 > http [ACK] Seq=758 Ack=6090 Win=32580 Len=0 TSval=442867845 TSecr=1540801
7789   2.669340 85.186.40.192 -> 41.177.98.176 TCP 70 oracle-vp2 > http [ACK] Seq=758 Ack=7538 Win=33304 Len=0 TSval=442867845 TSecr=1540801
7792   2.670214 85.186.40.192 -> 41.177.98.176 TCP 70 oracle-vp2 > http [ACK] Seq=758 Ack=8490 Win=32828 Len=0 TSval=442867845 TSecr=1540801
7795   2.671185 85.186.40.192 -> 41.177.98.176 TCP 70 oracle-vp2 > http [ACK] Seq=758 Ack=11386 Win=33304 Len=0 TSval=442867845 TSecr=1540801
7798   2.672267 85.186.40.192 -> 41.177.98.176 TCP 70 oracle-vp2 > http [ACK] Seq=758 Ack=11793 Win=33100 Len=0 TSval=442867845 TSecr=1540801
7877   2.755230 85.186.40.192 -> 41.177.98.176 TCP 82 [TCP Dup ACK 7478#1] enl-name > http [ACK] Seq=758 Ack=1 Win=33304 Len=0 TSval=442867846 TSecr=1540429 SLE=1449 SRE=2897
8010   2.798290 85.186.40.192 -> 41.177.98.176 TCP 70 [TCP Dup ACK 7586#1] jerand-lm > http [ACK] Seq=863 Ack=19870 Win=33304 Len=0 TSval=442867846 TSecr=1540815
8011   2.799740 85.186.40.192 -> 41.177.98.176 TCP 70 jerand-lm > http [ACK] Seq=863 Ack=19871 Win=33304 Len=0 TSval=442867846 TSecr=1540815
17743   5.377013 85.186.40.192 -> 41.177.98.176 TCP 70 enl-name > http [ACK] Seq=758 Ack=2897 Win=31856 Len=0 TSval=442867872 TSecr=1541077
17974   5.502907 85.186.40.192 -> 41.177.98.176 TCP 70 enl-name > http [ACK] Seq=758 Ack=4345 Win=32580 Len=0 TSval=442867873 TSecr=1541096
17976   5.505354 85.186.40.192 -> 41.177.98.176 TCP 70 enl-name > http [ACK] Seq=758 Ack=5430 Win=32761 Len=0 TSval=442867874 TSecr=1541096
18143   5.655392 85.186.40.192 -> 41.177.98.176 TCP 70 nessus > http [ACK] Seq=1552 Ack=2114 Win=33014 Len=0 TSval=442867875 TSecr=1541116
42298  17.665170 85.186.40.192 -> 41.177.98.176 TCP 70 scientia-sdb > http [ACK] Seq=758 Ack=2203 Win=33304 Len=0 TSval=442867995 TSecr=1542301
42299  17.666634 85.186.40.192 -> 41.177.98.176 TCP 70 oracle-vp2 > http [ACK] Seq=758 Ack=11794 Win=33304 Len=0 TSval=442867995 TSecr=1542303
42402  17.760569 85.186.40.192 -> 41.177.98.176 TCP 70 enl-name > http [ACK] Seq=758 Ack=5431 Win=33304 Len=0 TSval=442867996 TSecr=1542313
46003  19.261538 85.186.40.192 -> 41.177.98.176 TCP 70 scientia-sdb > http [FIN, ACK] Seq=758 Ack=2203 Win=33304 Len=0 TSval=442868011 TSecr=1542301
46005  19.262698 85.186.40.192 -> 41.177.98.176 TCP 70 enl-name > http [FIN, ACK] Seq=758 Ack=5431 Win=33304 Len=0 TSval=442868011 TSecr=1542313
46007  19.263880 85.186.40.192 -> 41.177.98.176 TCP 70 oracle-vp2 > http [FIN, ACK] Seq=758 Ack=11794 Win=33304 Len=0 TSval=442868011 TSecr=1542303
48205  19.778352 85.186.40.192 -> 41.177.98.176 TCP 70 nessus > http [ACK] Seq=2409 Ack=5010 Win=32580 Len=0 TSval=442868015 TSecr=1542507
48208  19.779225 85.186.40.192 -> 41.177.98.176 TCP 70 nessus > http [ACK] Seq=2409 Ack=6458 Win=33304 Len=0 TSval=442868015 TSecr=1542507
48211  19.780779 85.186.40.192 -> 41.177.98.176 TCP 70 nessus > http [ACK] Seq=2409 Ack=7447 Win=32809 Len=0 TSval=442868015 TSecr=1542507
48214  19.781705 85.186.40.192 -> 41.177.98.176 TCP 70 nessus > http [ACK] Seq=2409 Ack=10343 Win=32580 Len=0 TSval=442868015 TSecr=1542508
48217  19.782605 85.186.40.192 -> 41.177.98.176 TCP 70 nessus > http [ACK] Seq=2409 Ack=11841 Win=32646 Len=0 TSval=442868015 TSecr=1542508
48218  19.783932 85.186.40.192 -> 41.177.98.176 TCP 70 nessus > http [ACK] Seq=2409 Ack=11846 Win=33301 Len=0 TSval=442868015 TSecr=1542508
68089  28.030931 85.186.40.192 -> 41.177.98.176 TCP 70 nessus > http [ACK] Seq=3312 Ack=14742 Win=32580 Len=0 TSval=442868099 TSecr=1543347
68090  28.031923 85.186.40.192 -> 41.177.98.176 TCP 70 nessus > http [ACK] Seq=3312 Ack=16190 Win=33304 Len=0 TSval=442868099 TSecr=1543347
68093  28.033101 85.186.40.192 -> 41.177.98.176 TCP 70 nessus > http [ACK] Seq=3312 Ack=17179 Win=32809 Len=0 TSval=442868099 TSecr=1543347
68104  28.034037 85.186.40.192 -> 41.177.98.176 TCP 70 nessus > http [ACK] Seq=3312 Ack=20075 Win=32580 Len=0 TSval=442868099 TSecr=1543347
68107  28.035103 85.186.40.192 -> 41.177.98.176 TCP 70 nessus > http [ACK] Seq=3312 Ack=21523 Win=33304 Len=0 TSval=442868099 TSecr=1543347
68110  28.036320 85.186.40.192 -> 41.177.98.176 TCP 70 nessus > http [ACK] Seq=3312 Ack=22307 Win=32912 Len=0 TSval=442868099 TSecr=1543347
68111  28.037320 85.186.40.192 -> 41.177.98.176 TCP 70 nessus > http [ACK] Seq=3312 Ack=22490 Win=33212 Len=0 TSval=442868099 TSecr=1543348
68112  28.038376 85.186.40.192 -> 41.177.98.176 TCP 70 nessus > http [ACK] Seq=3312 Ack=22495 Win=33301 Len=0 TSval=442868099 TSecr=1543348
106193  38.327337 85.186.40.192 -> 41.177.98.176 TCP 70 nessus > http [ACK] Seq=4149 Ack=25391 Win=32580 Len=0 TSval=442868201 TSecr=1544387
106194  38.328558 85.186.40.192 -> 41.177.98.176 TCP 70 nessus > http [ACK] Seq=4149 Ack=26839 Win=33304 Len=0 TSval=442868201 TSecr=1544387
106195  38.329565 85.186.40.192 -> 41.177.98.176 TCP 70 nessus > http [ACK] Seq=4149 Ack=27828 Win=32809 Len=0 TSval=442868201 TSecr=1544387
106198  38.331625 85.186.40.192 -> 41.177.98.176 TCP 70 nessus > http [ACK] Seq=4149 Ack=30724 Win=32580 Len=0 TSval=442868201 TSecr=1544387
106222  38.342540 85.186.40.192 -> 41.177.98.176 TCP 70 nessus > http [ACK] Seq=4149 Ack=32172 Win=33304 Len=0 TSval=442868201 TSecr=1544387
106223  38.345213 85.186.40.192 -> 41.177.98.176 TCP 70 nessus > http [ACK] Seq=4149 Ack=32956 Win=32912 Len=0 TSval=442868202 TSecr=1544387
106224  38.346867 85.186.40.192 -> 41.177.98.176 TCP 70 nessus > http [ACK] Seq=4149 Ack=35852 Win=33304 Len=0 TSval=442868202 TSecr=1544387
106327  38.381476 85.186.40.192 -> 41.177.98.176 TCP 70 nessus > http [ACK] Seq=4149 Ack=38084 Win=32912 Len=0 TSval=442868202 TSecr=1544387
106331  38.382370 85.186.40.192 -> 41.177.98.176 TCP 70 nessus > http [ACK] Seq=4149 Ack=40980 Win=33304 Len=0 TSval=442868202 TSecr=1544387
106333  38.383658 85.186.40.192 -> 41.177.98.176 TCP 70 nessus > http [ACK] Seq=4149 Ack=41761 Win=32913 Len=0 TSval=442868202 TSecr=1544387
106337  38.384735 85.186.40.192 -> 41.177.98.176 TCP 70 nessus > http [ACK] Seq=4149 Ack=41766 Win=33301 Len=0 TSval=442868202 TSecr=1544387
156818  53.401876 85.186.40.192 -> 41.177.98.176 TCP 70 nessus > http [ACK] Seq=4149 Ack=41767 Win=33304 Len=0 TSval=442868352 TSecr=1545894
157258  53.591739 85.186.40.192 -> 41.177.98.176 TCP 70 nessus > http [FIN, ACK] Seq=4149 Ack=41767 Win=33304 Len=0 TSval=442868354 TSecr=1545894
244787  85.370482 85.186.40.192 -> 41.177.98.176 TCP 82 etftp > http [SYN] Seq=0 Win=65535 Len=0 MSS=1460 WS=8 TSval=442868671 TSecr=0 SACK_PERM=1
244856  85.412070 85.186.40.192 -> 41.177.98.176 TCP 70 etftp > http [ACK] Seq=1 Ack=1 Win=524280 Len=0 TSval=442868672 TSecr=1549096
245343  85.658305 85.186.40.192 -> 41.177.98.176 TCP 70 etftp > http [ACK] Seq=946 Ack=2897 Win=524176 Len=0 TSval=442868674 TSecr=1549119
245380  85.669559 85.186.40.192 -> 41.177.98.176 TCP 70 etftp > http [ACK] Seq=946 Ack=4345 Win=524176 Len=0 TSval=442868674 TSecr=1549119
245462  85.708435 85.186.40.192 -> 41.177.98.176 TCP 70 etftp > http [ACK] Seq=946 Ack=7241 Win=524176 Len=0 TSval=442868675 TSecr=1549125
245465  85.709492 85.186.40.192 -> 41.177.98.176 TCP 70 etftp > http [ACK] Seq=946 Ack=8689 Win=524176 Len=0 TSval=442868675 TSecr=1549125
245486  85.719275 85.186.40.192 -> 41.177.98.176 TCP 70 etftp > http [ACK] Seq=946 Ack=9268 Win=524280 Len=0 TSval=442868675 TSecr=1549126
275063  92.720582 85.186.40.192 -> 41.177.98.176 TCP 70 etftp > http [ACK] Seq=1725 Ack=12164 Win=524176 Len=0 TSval=442868745 TSecr=1549824
275079  92.723034 85.186.40.192 -> 41.177.98.176 TCP 70 etftp > http [ACK] Seq=1725 Ack=13612 Win=524176 Len=0 TSval=442868745 TSecr=1549824
275435  92.797924 85.186.40.192 -> 41.177.98.176 TCP 70 etftp > http [ACK] Seq=1725 Ack=16508 Win=524176 Len=0 TSval=442868746 TSecr=1549831
275454  92.802829 85.186.40.192 -> 41.177.98.176 TCP 70 etftp > http [ACK] Seq=1725 Ack=17956 Win=524176 Len=0 TSval=442868746 TSecr=1549831
275468  92.805882 85.186.40.192 -> 41.177.98.176 TCP 70 etftp > http [ACK] Seq=1725 Ack=20852 Win=524176 Len=0 TSval=442868746 TSecr=1549831
275673  92.857906 85.186.40.192 -> 41.177.98.176 TCP 70 etftp > http [ACK] Seq=1725 Ack=23748 Win=524280 Len=0 TSval=442868746 TSecr=1549839
275678  92.860745 85.186.40.192 -> 41.177.98.176 TCP 70 etftp > http [ACK] Seq=1725 Ack=25196 Win=524176 Len=0 TSval=442868746 TSecr=1549839
275696  92.875591 85.186.40.192 -> 41.177.98.176 TCP 70 etftp > http [ACK] Seq=1725 Ack=28092 Win=524176 Len=0 TSval=442868746 TSecr=1549839
275707  92.882813 85.186.40.192 -> 41.177.98.176 TCP 70 etftp > http [ACK] Seq=1725 Ack=29740 Win=524280 Len=0 TSval=442868746 TSecr=1549839
276169  93.139930 85.186.40.192 -> 41.177.98.176 TCP 70 etftp > http [ACK] Seq=2505 Ack=30320 Win=524280 Len=0 TSval=442868749 TSecr=1549867
285621  95.511105 85.186.40.192 -> 41.177.98.176 TCP 70 etftp > http [ACK] Seq=3349 Ack=33216 Win=524176 Len=0 TSval=442868773 TSecr=1550106
285623  95.513791 85.186.40.192 -> 41.177.98.176 TCP 70 etftp > http [ACK] Seq=3349 Ack=35653 Win=524280 Len=0 TSval=442868773 TSecr=1550106
285646  95.519457 85.186.40.192 -> 41.177.98.176 TCP 70 etftp > http [ACK] Seq=3349 Ack=38549 Win=524176 Len=0 TSval=442868773 TSecr=1550106
285686  95.523956 85.186.40.192 -> 41.177.98.176 TCP 70 etftp > http [ACK] Seq=3349 Ack=40781 Win=524280 Len=0 TSval=442868773 TSecr=1550106
285688  95.525723 85.186.40.192 -> 41.177.98.176 TCP 70 etftp > http [ACK] Seq=3349 Ack=40964 Win=524280 Len=0 TSval=442868773 TSecr=1550106
285689  95.526661 85.186.40.192 -> 41.177.98.176 TCP 70 etftp > http [ACK] Seq=3349 Ack=40969 Win=524280 Len=0 TSval=442868773 TSecr=1550106
323298 110.763832 85.186.40.192 -> 41.177.98.176 TCP 70 etftp > http [ACK] Seq=3349 Ack=40970 Win=524280 Len=0 TSval=442868925 TSecr=1551613
328003 113.558944 85.186.40.192 -> 41.177.98.176 TCP 70 etftp > http [FIN, ACK] Seq=3349 Ack=40970 Win=524280 Len=0 TSval=442868953 TSecr=1551613
365556 124.761739 85.186.40.192 -> 41.177.98.176 TCP 82 59701 > http [SYN] Seq=0 Win=65535 Len=0 MSS=1460 WS=8 TSval=442869065 TSecr=0 SACK_PERM=1
365634 124.825441 85.186.40.192 -> 41.177.98.176 TCP 70 59701 > http [ACK] Seq=1 Ack=1 Win=524280 Len=0 TSval=442869066 TSecr=1553035
366129 125.130797 85.186.40.192 -> 41.177.98.176 TCP 70 59701 > http [ACK] Seq=903 Ack=2897 Win=524176 Len=0 TSval=442869069 TSecr=1553065
366137 125.133697 85.186.40.192 -> 41.177.98.176 TCP 70 59701 > http [ACK] Seq=903 Ack=4345 Win=524176 Len=0 TSval=442869069 TSecr=1553065
366271 125.246712 85.186.40.192 -> 41.177.98.176 TCP 70 59701 > http [ACK] Seq=903 Ack=7241 Win=524176 Len=0 TSval=442869070 TSecr=1553072
366281 125.251657 85.186.40.192 -> 41.177.98.176 TCP 70 59701 > http [ACK] Seq=903 Ack=8689 Win=524176 Len=0 TSval=442869070 TSecr=1553072
366298 125.257158 85.186.40.192 -> 41.177.98.176 TCP 70 59701 > http [ACK] Seq=903 Ack=11585 Win=524176 Len=0 TSval=442869070 TSecr=1553072
366391 125.341479 85.186.40.192 -> 41.177.98.176 TCP 70 59701 > http [ACK] Seq=903 Ack=14481 Win=524280 Len=0 TSval=442869071 TSecr=1553084
366398 125.344423 85.186.40.192 -> 41.177.98.176 TCP 70 59701 > http [ACK] Seq=903 Ack=15929 Win=524176 Len=0 TSval=442869071 TSecr=1553084
366415 125.349939 85.186.40.192 -> 41.177.98.176 TCP 70 59701 > http [ACK] Seq=903 Ack=18825 Win=524176 Len=0 TSval=442869071 TSecr=1553084
366416 125.350933 85.186.40.192 -> 41.177.98.176 TCP 70 59701 > http [ACK] Seq=903 Ack=19273 Win=524280 Len=0 TSval=442869071 TSecr=1553085
429057 140.367629 85.186.40.192 -> 41.177.98.176 TCP 70 59701 > http [ACK] Seq=903 Ack=19274 Win=524280 Len=0 TSval=442869221 TSecr=1554573
439963 143.336196 85.186.40.192 -> 41.177.98.176 TCP 70 59701 > http [FIN, ACK] Seq=903 Ack=19274 Win=524280 Len=0 TSval=442869251 TSecr=1554573
439968 143.337584 85.186.40.192 -> 41.177.98.176 TCP 82 59706 > http [SYN] Seq=0 Win=65535 Len=0 MSS=1460 WS=8 TSval=442869251 TSecr=0 SACK_PERM=1
440551 143.444552 85.186.40.192 -> 41.177.98.176 TCP 70 59706 > http [ACK] Seq=1 Ack=1 Win=524280 Len=0 TSval=442869252 TSecr=1554893
441605 143.775527 85.186.40.192 -> 41.177.98.176 TCP 70 59706 > http [ACK] Seq=947 Ack=2897 Win=524176 Len=0 TSval=442869255 TSecr=1554932
441621 143.779722 85.186.40.192 -> 41.177.98.176 TCP 70 59706 > http [ACK] Seq=947 Ack=4345 Win=524176 Len=0 TSval=442869255 TSecr=1554932
441759 143.819188 85.186.40.192 -> 41.177.98.176 TCP 70 59706 > http [ACK] Seq=947 Ack=7241 Win=524176 Len=0 TSval=442869255 TSecr=1554937
441761 143.820591 85.186.40.192 -> 41.177.98.176 TCP 70 59706 > http [ACK] Seq=947 Ack=8689 Win=524176 Len=0 TSval=442869255 TSecr=1554937
441765 143.824141 85.186.40.192 -> 41.177.98.176 TCP 70 59706 > http [ACK] Seq=947 Ack=9161 Win=524280 Len=0 TSval=442869255 TSecr=1554937
462360 151.613602 85.186.40.192 -> 41.177.98.176 TCP 70 59706 > http [ACK] Seq=1625 Ack=12057 Win=524176 Len=0 TSval=442869333 TSecr=1555681
462374 151.614687 85.186.40.192 -> 41.177.98.176 TCP 70 59706 > http [ACK] Seq=1625 Ack=14953 Win=524176 Len=0 TSval=442869333 TSecr=1555681
462380 151.616216 85.186.40.192 -> 41.177.98.176 TCP 70 59706 > http [ACK] Seq=1625 Ack=17849 Win=524176 Len=0 TSval=442869333 TSecr=1555681
462381 151.620785 85.186.40.192 -> 41.177.98.176 TCP 70 59706 > http [ACK] Seq=1625 Ack=20745 Win=524176 Len=0 TSval=442869333 TSecr=1555681
463251 152.125683 85.186.40.192 -> 41.177.98.176 TCP 70 59706 > http [ACK] Seq=1625 Ack=22358 Win=524280 Len=0 TSval=442869338 TSecr=1555720
515842 166.394245 85.186.40.192 -> 41.177.98.176 TCP 70 59706 > http [ACK] Seq=1625 Ack=22359 Win=524280 Len=0 TSval=442869481 TSecr=1557182
535991 173.524914 85.186.40.192 -> 41.177.98.176 TCP 70 59706 > http [FIN, ACK] Seq=1625 Ack=22359 Win=524280 Len=0 TSval=442869552 TSecr=1557182
549357 177.004629 85.186.40.192 -> 41.177.98.176 TCP 82 roketz > http [SYN] Seq=0 Win=65535 Len=0 MSS=1460 WS=8 TSval=442869587 TSecr=0 SACK_PERM=1
549528 177.037103 85.186.40.192 -> 41.177.98.176 TCP 70 roketz > http [ACK] Seq=1 Ack=1 Win=524280 Len=0 TSval=442869587 TSecr=1558260
555794 178.960155 85.186.40.192 -> 41.177.98.176 TCP 70 roketz > http [ACK] Seq=665 Ack=2897 Win=524176 Len=0 TSval=442869607 TSecr=1558446
555800 178.961212 85.186.40.192 -> 41.177.98.176 TCP 70 roketz > http [ACK] Seq=665 Ack=4345 Win=524176 Len=0 TSval=442869607 TSecr=1558446
555895 178.999222 85.186.40.192 -> 41.177.98.176 TCP 70 roketz > http [ACK] Seq=665 Ack=7241 Win=524176 Len=0 TSval=442869607 TSecr=1558455
555898 179.003383 85.186.40.192 -> 41.177.98.176 TCP 70 roketz > http [ACK] Seq=665 Ack=8689 Win=524176 Len=0 TSval=442869607 TSecr=1558455
555900 179.004562 85.186.40.192 -> 41.177.98.176 TCP 70 roketz > http [ACK] Seq=665 Ack=9603 Win=524280 Len=0 TSval=442869607 TSecr=1558455
556315 179.119749 85.186.40.192 -> 41.177.98.176 TCP 70 roketz > http [ACK] Seq=1316 Ack=10704 Win=524280 Len=0 TSval=442869608 TSecr=1558465
585486 186.524197 85.186.40.192 -> 41.177.98.176 TCP 70 roketz > http [ACK] Seq=2160 Ack=13600 Win=524176 Len=0 TSval=442869682 TSecr=1559189
585493 186.525320 85.186.40.192 -> 41.177.98.176 TCP 70 roketz > http [ACK] Seq=2160 Ack=16037 Win=524280 Len=0 TSval=442869682 TSecr=1559189
585494 186.527157 85.186.40.192 -> 41.177.98.176 TCP 70 roketz > http [ACK] Seq=2160 Ack=18933 Win=524176 Len=0 TSval=442869682 TSecr=1559190
585495 186.528084 85.186.40.192 -> 41.177.98.176 TCP 70 roketz > http [ACK] Seq=2160 Ack=21165 Win=524280 Len=0 TSval=442869682 TSecr=1559190
585496 186.529032 85.186.40.192 -> 41.177.98.176 TCP 70 roketz > http [ACK] Seq=2160 Ack=23644 Win=524280 Len=0 TSval=442869682 TSecr=1559190
585500 186.530502 85.186.40.192 -> 41.177.98.176 TCP 70 roketz > http [ACK] Seq=2160 Ack=23649 Win=524280 Len=0 TSval=442869682 TSecr=1559191
585746 186.613993 85.186.40.192 -> 41.177.98.176 TCP 82 59719 > http [SYN] Seq=0 Win=65535 Len=0 MSS=1460 WS=8 TSval=442869683 TSecr=0 SACK_PERM=1
585758 186.615404 85.186.40.192 -> 41.177.98.176 TCP 82 59720 > http [SYN] Seq=0 Win=65535 Len=0 MSS=1460 WS=8 TSval=442869683 TSecr=0 SACK_PERM=1
585886 186.651899 85.186.40.192 -> 41.177.98.176 TCP 70 59719 > http [ACK] Seq=1 Ack=1 Win=524280 Len=0 TSval=442869683 TSecr=1559221
585908 186.661624 85.186.40.192 -> 41.177.98.176 TCP 70 roketz > http [ACK] Seq=2797 Ack=23946 Win=524280 Len=0 TSval=442869683 TSecr=1559221
585920 186.662993 85.186.40.192 -> 41.177.98.176 TCP 70 roketz > http [ACK] Seq=2797 Ack=26842 Win=524280 Len=0 TSval=442869683 TSecr=1559221
585921 186.663870 85.186.40.192 -> 41.177.98.176 TCP 70 roketz > http [ACK] Seq=2797 Ack=29738 Win=524280 Len=0 TSval=442869683 TSecr=1559221
585927 186.666593 85.186.40.192 -> 41.177.98.176 TCP 70 roketz > http [ACK] Seq=2797 Ack=31186 Win=524280 Len=0 TSval=442869683 TSecr=1559221
585929 186.667791 85.186.40.192 -> 41.177.98.176 TCP 70 roketz > http [ACK] Seq=2797 Ack=32138 Win=524280 Len=0 TSval=442869684 TSecr=1559221
585957 186.673956 85.186.40.192 -> 41.177.98.176 TCP 70 roketz > http [ACK] Seq=2797 Ack=35034 Win=524280 Len=0 TSval=442869684 TSecr=1559221
585964 186.674993 85.186.40.192 -> 41.177.98.176 TCP 70 roketz > http [ACK] Seq=2797 Ack=36035 Win=524280 Len=0 TSval=442869684 TSecr=1559221
585978 186.676195 85.186.40.192 -> 41.177.98.176 TCP 70 59720 > http [ACK] Seq=1 Ack=1 Win=524280 Len=0 TSval=442869684 TSecr=1559221
586085 186.704976 85.186.40.192 -> 41.177.98.176 TCP 70 59719 > http [ACK] Seq=638 Ack=299 Win=524280 Len=0 TSval=442869684 TSecr=1559226
586128 186.710888 85.186.40.192 -> 41.177.98.176 TCP 70 59719 > http [ACK] Seq=638 Ack=3195 Win=524176 Len=0 TSval=442869684 TSecr=1559226
586191 186.725324 85.186.40.192 -> 41.177.98.176 TCP 70 59720 > http [ACK] Seq=643 Ack=299 Win=524280 Len=0 TSval=442869684 TSecr=1559228
586202 186.730714 85.186.40.192 -> 41.177.98.176 TCP 70 59720 > http [ACK] Seq=643 Ack=3195 Win=524176 Len=0 TSval=442869684 TSecr=1559228
586237 186.744044 85.186.40.192 -> 41.177.98.176 TCP 70 59719 > http [ACK] Seq=638 Ack=6091 Win=524176 Len=0 TSval=442869684 TSecr=1559230
586245 186.749499 85.186.40.192 -> 41.177.98.176 TCP 70 59719 > http [ACK] Seq=638 Ack=8987 Win=524176 Len=0 TSval=442869684 TSecr=1559230
586267 186.752293 85.186.40.192 -> 41.177.98.176 TCP 70 59719 > http [ACK] Seq=638 Ack=10435 Win=524176 Len=0 TSval=442869684 TSecr=1559230
586297 186.764997 85.186.40.192 -> 41.177.98.176 TCP 70 59720 > http [ACK] Seq=643 Ack=6091 Win=524176 Len=0 TSval=442869684 TSecr=1559232
586320 186.770459 85.186.40.192 -> 41.177.98.176 TCP 70 59720 > http [ACK] Seq=643 Ack=8987 Win=524176 Len=0 TSval=442869685 TSecr=1559232
586342 186.774510 85.186.40.192 -> 41.177.98.176 TCP 70 59720 > http [ACK] Seq=643 Ack=10435 Win=524176 Len=0 TSval=442869685 TSecr=1559232
586354 186.781675 85.186.40.192 -> 41.177.98.176 TCP 70 59719 > http [ACK] Seq=638 Ack=11756 Win=524280 Len=0 TSval=442869685 TSecr=1559234
586453 186.806971 85.186.40.192 -> 41.177.98.176 TCP 70 59720 > http [ACK] Seq=643 Ack=12380 Win=524280 Len=0 TSval=442869685 TSecr=1559236
639383 201.795027 85.186.40.192 -> 41.177.98.176 TCP 70 roketz > http [ACK] Seq=2797 Ack=36036 Win=524280 Len=0 TSval=442869835 TSecr=1560722
639384 201.795936 85.186.40.192 -> 41.177.98.176 TCP 70 59719 > http [ACK] Seq=638 Ack=11757 Win=524280 Len=0 TSval=442869835 TSecr=1560727
639386 201.797274 85.186.40.192 -> 41.177.98.176 TCP 70 59720 > http [ACK] Seq=643 Ack=12381 Win=524280 Len=0 TSval=442869835 TSecr=1560729
647340 203.517659 85.186.40.192 -> 41.177.98.176 TCP 70 roketz > http [FIN, ACK] Seq=2797 Ack=36036 Win=524280 Len=0 TSval=442869852 TSecr=1560722
647357 203.519819 85.186.40.192 -> 41.177.98.176 TCP 70 59720 > http [FIN, ACK] Seq=643 Ack=12381 Win=524280 Len=0 TSval=442869852 TSecr=1560729
647368 203.520948 85.186.40.192 -> 41.177.98.176 TCP 70 59719 > http [FIN, ACK] Seq=638 Ack=11757 Win=524280 Len=0 TSval=442869852 TSecr=1560727
933306 310.953990 85.186.40.192 -> 41.177.98.176 TCP 82 [TCP Port numbers reused] etftp > http [SYN] Seq=0 Win=65535 Len=0 MSS=1460 WS=1 TSval=1553963915 TSecr=0 SACK_PERM=1
934070 311.224559 85.186.40.192 -> 41.177.98.176 TCP 70 etftp > http [ACK] Seq=1 Ack=1 Win=65535 Len=0 TSval=1553963916 TSecr=1571655
952019 315.743817 85.186.40.192 -> 41.177.98.176 TCP 70 etftp > http [ACK] Seq=652 Ack=2897 Win=65160 Len=0 TSval=1553963925 TSecr=1572114
955537 316.937975 85.186.40.192 -> 41.177.98.176 TCP 82 64590 > http [SYN] Seq=0 Win=65535 Len=0 MSS=1460 WS=1 TSval=1553963925 TSecr=0 SACK_PERM=1
955539 316.939047 85.186.40.192 -> 41.177.98.176 TCP 82 64591 > http [SYN] Seq=0 Win=65535 Len=0 MSS=1460 WS=1 TSval=1553963925 TSecr=0 SACK_PERM=1
955541 316.940180 85.186.40.192 -> 41.177.98.176 TCP 82 64592 > http [SYN] Seq=0 Win=65535 Len=0 MSS=1460 WS=1 TSval=1553963925 TSecr=0 SACK_PERM=1
955543 316.941554 85.186.40.192 -> 41.177.98.176 TCP 70 etftp > http [ACK] Seq=652 Ack=4345 Win=65160 Len=0 TSval=1553963925 TSecr=1572114
955548 316.942727 85.186.40.192 -> 41.177.98.176 TCP 70 etftp > http [ACK] Seq=652 Ack=8231 Win=65535 Len=0 TSval=1553963926 TSecr=1572134
956014 317.113791 85.186.40.192 -> 41.177.98.176 TCP 70 64590 > http [ACK] Seq=1 Ack=1 Win=65535 Len=0 TSval=1553963928 TSecr=1572253
956916 317.725919 85.186.40.192 -> 41.177.98.176 TCP 70 64591 > http [ACK] Seq=1 Ack=1 Win=65535 Len=0 TSval=1553963928 TSecr=1572254
956944 317.735882 85.186.40.192 -> 41.177.98.176 TCP 70 64592 > http [ACK] Seq=1 Ack=1 Win=65535 Len=0 TSval=1553963928 TSecr=1572254
956951 317.748216 85.186.40.192 -> 41.177.98.176 TCP 70 etftp > http [ACK] Seq=652 Ack=9679 Win=65160 Len=0 TSval=1553963928 TSecr=1572254
956956 317.749211 85.186.40.192 -> 41.177.98.176 TCP 70 etftp > http [ACK] Seq=652 Ack=11911 Win=65160 Len=0 TSval=1553963928 TSecr=1572254
956960 317.750355 85.186.40.192 -> 41.177.98.176 TCP 70 etftp > http [ACK] Seq=652 Ack=14807 Win=65535 Len=0 TSval=1553963928 TSecr=1572254
956965 317.751421 85.186.40.192 -> 41.177.98.176 TCP 70 etftp > http [ACK] Seq=652 Ack=15591 Win=65535 Len=0 TSval=1553963929 TSecr=1572254
957445 317.875985 85.186.40.192 -> 41.177.98.176 TCP 70 64590 > http [ACK] Seq=693 Ack=1118 Win=65491 Len=0 TSval=1553963930 TSecr=1572332
958174 318.121039 85.186.40.192 -> 41.177.98.176 TCP 70 64591 > http [ACK] Seq=684 Ack=1449 Win=65535 Len=0 TSval=1553963930 TSecr=1572333
958176 318.122397 85.186.40.192 -> 41.177.98.176 TCP 70 64591 > http [ACK] Seq=684 Ack=2897 Win=65535 Len=0 TSval=1553963930 TSecr=1572333
958177 318.126150 85.186.40.192 -> 41.177.98.176 TCP 70 64591 > http [ACK] Seq=684 Ack=4345 Win=65160 Len=0 TSval=1553963930 TSecr=1572333
959823 318.772603 85.186.40.192 -> 41.177.98.176 TCP 70 64592 > http [ACK] Seq=683 Ack=719 Win=65535 Len=0 TSval=1553963931 TSecr=1572334
959826 318.773744 85.186.40.192 -> 41.177.98.176 TCP 70 etftp > http [ACK] Seq=652 Ack=18487 Win=65160 Len=0 TSval=1553963931 TSecr=1572334
959851 318.776167 85.186.40.192 -> 41.177.98.176 TCP 70 etftp > http [ACK] Seq=652 Ack=19935 Win=65535 Len=0 TSval=1553963931 TSecr=1572335
960600 319.108381 85.186.40.192 -> 41.177.98.176 TCP 70 etftp > http [ACK] Seq=652 Ack=20719 Win=65535 Len=0 TSval=1553963932 TSecr=1572335
962349 319.879258 85.186.40.192 -> 41.177.98.176 TCP 70 etftp > http [ACK] Seq=652 Ack=23615 Win=65535 Len=0 TSval=1553963932 TSecr=1572335
962369 319.882552 85.186.40.192 -> 41.177.98.176 TCP 70 etftp > http [ACK] Seq=652 Ack=27295 Win=65535 Len=0 TSval=1553963932 TSecr=1572335
962385 319.884738 85.186.40.192 -> 41.177.98.176 TCP 70 64591 > http [ACK] Seq=684 Ack=5480 Win=65473 Len=0 TSval=1553963932 TSecr=1572372
962446 319.893362 85.186.40.192 -> 41.177.98.176 TCP 70 etftp > http [ACK] Seq=652 Ack=30191 Win=65535 Len=0 TSval=1553963932 TSecr=1572335
962566 319.932026 85.186.40.192 -> 41.177.98.176 TCP 70 etftp > http [ACK] Seq=652 Ack=33871 Win=65535 Len=0 TSval=1553963932 TSecr=1572437
962588 319.939257 85.186.40.192 -> 41.177.98.176 TCP 70 etftp > http [ACK] Seq=652 Ack=36103 Win=65535 Len=0 TSval=1553963932 TSecr=1572437
962591 319.940249 85.186.40.192 -> 41.177.98.176 TCP 70 etftp > http [ACK] Seq=652 Ack=38999 Win=65160 Len=0 TSval=1553963933 TSecr=1572470
962838 320.130993 85.186.40.192 -> 41.177.98.176 TCP 70 etftp > http [ACK] Seq=652 Ack=44127 Win=65535 Len=0 TSval=1553963934 TSecr=1572548
962844 320.131916 85.186.40.192 -> 41.177.98.176 TCP 70 etftp > http [ACK] Seq=652 Ack=47807 Win=65535 Len=0 TSval=1553963934 TSecr=1572548
962859 320.136265 85.186.40.192 -> 41.177.98.176 TCP 70 etftp > http [ACK] Seq=652 Ack=50703 Win=65535 Len=0 TSval=1553963934 TSecr=1572549
962863 320.140918 85.186.40.192 -> 41.177.98.176 TCP 70 etftp > http [ACK] Seq=652 Ack=52935 Win=65535 Len=0 TSval=1553963934 TSecr=1572549
962909 320.199417 85.186.40.192 -> 41.177.98.176 TCP 70 64590 > http [ACK] Seq=1359 Ack=1428 Win=65535 Len=0 TSval=1553963934 TSecr=1572551
962913 320.201329 85.186.40.192 -> 41.177.98.176 TCP 70 64590 > http [ACK] Seq=1359 Ack=4324 Win=65160 Len=0 TSval=1553963934 TSecr=1572551
963865 320.696645 85.186.40.192 -> 41.177.98.176 TCP 70 64591 > http [ACK] Seq=1360 Ack=6310 Win=65535 Len=0 TSval=1553963934 TSecr=1572552
963978 320.749634 85.186.40.192 -> 41.177.98.176 TCP 70 64592 > http [ACK] Seq=1348 Ack=1028 Win=65535 Len=0 TSval=1553963934 TSecr=1572553
963989 320.751045 85.186.40.192 -> 41.177.98.176 TCP 70 64592 > http [ACK] Seq=1348 Ack=3924 Win=65160 Len=0 TSval=1553963935 TSecr=1572553
963993 320.751924 85.186.40.192 -> 41.177.98.176 TCP 70 64592 > http [ACK] Seq=1348 Ack=5372 Win=65535 Len=0 TSval=1553963935 TSecr=1572553
963994 320.753009 85.186.40.192 -> 41.177.98.176 TCP 70 64590 > http [ACK] Seq=1359 Ack=5772 Win=65535 Len=0 TSval=1553963935 TSecr=1572551
964008 320.755174 85.186.40.192 -> 41.177.98.176 TCP 70 etftp > http [ACK] Seq=652 Ack=54383 Win=65535 Len=0 TSval=1553963935 TSecr=1572553
964028 320.758463 85.186.40.192 -> 41.177.98.176 TCP 70 etftp > http [ACK] Seq=652 Ack=56615 Win=65535 Len=0 TSval=1553963935 TSecr=1572553
964088 320.782282 85.186.40.192 -> 41.177.98.176 TCP 70 etftp > http [ACK] Seq=652 Ack=59511 Win=65535 Len=0 TSval=1553963935 TSecr=1572553
964138 320.804314 85.186.40.192 -> 41.177.98.176 TCP 70 etftp > http [ACK] Seq=652 Ack=63191 Win=65535 Len=0 TSval=1553963935 TSecr=1572554
964161 320.829179 85.186.40.192 -> 41.177.98.176 TCP 70 etftp > http [ACK] Seq=652 Ack=66087 Win=65535 Len=0 TSval=1553963935 TSecr=1572554
964165 320.831365 85.186.40.192 -> 41.177.98.176 TCP 70 etftp > http [ACK] Seq=652 Ack=69767 Win=65535 Len=0 TSval=1553963935 TSecr=1572573
964171 320.832657 85.186.40.192 -> 41.177.98.176 TCP 70 etftp > http [ACK] Seq=652 Ack=71999 Win=65535 Len=0 TSval=1553963935 TSecr=1572573
964173 320.833717 85.186.40.192 -> 41.177.98.176 TCP 70 etftp > http [ACK] Seq=652 Ack=74895 Win=65535 Len=0 TSval=1553963935 TSecr=1572573
964187 320.843256 85.186.40.192 -> 41.177.98.176 TCP 70 etftp > http [ACK] Seq=652 Ack=78575 Win=65535 Len=0 TSval=1553963935 TSecr=1572573
964189 320.844169 85.186.40.192 -> 41.177.98.176 TCP 70 etftp > http [ACK] Seq=652 Ack=81471 Win=65535 Len=0 TSval=1553963935 TSecr=1572573
964190 320.845073 85.186.40.192 -> 41.177.98.176 TCP 70 etftp > http [ACK] Seq=652 Ack=84367 Win=65535 Len=0 TSval=1553963935 TSecr=1572574
964196 320.846427 85.186.40.192 -> 41.177.98.176 TCP 70 etftp > http [ACK] Seq=652 Ack=85815 Win=65535 Len=0 TSval=1553963935 TSecr=1572574
964656 321.090340 85.186.40.192 -> 41.177.98.176 TCP 70 64590 > http [ACK] Seq=1359 Ack=8668 Win=65160 Len=0 TSval=1553963936 TSecr=1572580
964660 321.091127 85.186.40.192 -> 41.177.98.176 TCP 70 64590 > http [ACK] Seq=1359 Ack=11564 Win=65160 Len=0 TSval=1553963936 TSecr=1572580
965793 321.541387 85.186.40.192 -> 41.177.98.176 TCP 70 64591 > http [ACK] Seq=2038 Ack=6620 Win=65535 Len=0 TSval=1553963937 TSecr=1572635
966578 321.785763 85.186.40.192 -> 41.177.98.176 TCP 70 64590 > http [ACK] Seq=1359 Ack=13012 Win=65535 Len=0 TSval=1553963937 TSecr=1572580
966663 321.838930 85.186.40.192 -> 41.177.98.176 TCP 70 64591 > http [ACK] Seq=2038 Ack=9516 Win=65160 Len=0 TSval=1553963937 TSecr=1572635
966840 321.938425 85.186.40.192 -> 41.177.98.176 TCP 70 64591 > http [ACK] Seq=2038 Ack=12412 Win=65535 Len=0 TSval=1553963937 TSecr=1572635
966841 321.939651 85.186.40.192 -> 41.177.98.176 TCP 70 64591 > http [ACK] Seq=2038 Ack=13860 Win=65535 Len=0 TSval=1553963937 TSecr=1572635
966849 321.940816 85.186.40.192 -> 41.177.98.176 TCP 70 64591 > http [ACK] Seq=2038 Ack=14812 Win=65535 Len=0 TSval=1553963938 TSecr=1572635
968892 322.702775 85.186.40.192 -> 41.177.98.176 TCP 70 64592 > http [ACK] Seq=1348 Ack=8268 Win=65160 Len=0 TSval=1553963938 TSecr=1572635
969080 322.738569 85.186.40.192 -> 41.177.98.176 TCP 70 64592 > http [ACK] Seq=1348 Ack=8453 Win=65535 Len=0 TSval=1553963938 TSecr=1572635
969115 322.748880 85.186.40.192 -> 41.177.98.176 TCP 70 64590 > http [ACK] Seq=1359 Ack=15908 Win=65160 Len=0 TSval=1553963938 TSecr=1572635
969129 322.749803 85.186.40.192 -> 41.177.98.176 TCP 70 etftp > http [ACK] Seq=652 Ack=88711 Win=65160 Len=0 TSval=1553963938 TSecr=1572635
969134 322.751461 85.186.40.192 -> 41.177.98.176 TCP 70 etftp > http [ACK] Seq=652 Ack=91607 Win=65535 Len=0 TSval=1553963938 TSecr=1572636
969401 322.889073 85.186.40.192 -> 41.177.98.176 TCP 70 64591 > http [ACK] Seq=2714 Ack=19916 Win=65160 Len=0 TSval=1553963940 TSecr=1572830
969405 322.891054 85.186.40.192 -> 41.177.98.176 TCP 70 64591 > http [ACK] Seq=2714 Ack=22256 Win=65535 Len=0 TSval=1553963940 TSecr=1572830
969492 322.935869 85.186.40.192 -> 41.177.98.176 TCP 70 64592 > http [ACK] Seq=2035 Ack=11658 Win=65160 Len=0 TSval=1553963940 TSecr=1572835
969888 323.112187 85.186.40.192 -> 41.177.98.176 TCP 70 64592 > http [ACK] Seq=2035 Ack=13106 Win=65535 Len=0 TSval=1553963940 TSecr=1572835
971045 323.928081 85.186.40.192 -> 41.177.98.176 TCP 70 64592 > http [ACK] Seq=2035 Ack=16002 Win=65535 Len=0 TSval=1553963940 TSecr=1572835
971069 323.938658 85.186.40.192 -> 41.177.98.176 TCP 70 64590 > http [ACK] Seq=1359 Ack=30388 Win=65160 Len=0 TSval=1553963940 TSecr=1572835
971645 324.003094 85.186.40.192 -> 41.177.98.176 TCP 70 64590 > http [ACK] Seq=1359 Ack=31836 Win=65160 Len=0 TSval=1553963940 TSecr=1572835
972297 324.066712 85.186.40.192 -> 41.177.98.176 TCP 70 etftp > http [ACK] Seq=1324 Ack=98409 Win=65535 Len=0 TSval=1553963940 TSecr=1572836
972394 324.081767 85.186.40.192 -> 41.177.98.176 TCP 70 64591 > http [ACK] Seq=3402 Ack=24354 Win=65535 Len=0 TSval=1553963940 TSecr=1572853
972568 324.101898 85.186.40.192 -> 41.177.98.176 TCP 70 64590 > http [ACK] Seq=1359 Ack=34732 Win=65160 Len=0 TSval=1553963942 TSecr=1572954
972602 324.103749 85.186.40.192 -> 41.177.98.176 TCP 70 64590 > http [ACK] Seq=1359 Ack=37628 Win=65535 Len=0 TSval=1553963942 TSecr=1572954
972624 324.104646 85.186.40.192 -> 41.177.98.176 TCP 70 64590 > http [ACK] Seq=1359 Ack=40524 Win=65535 Len=0 TSval=1553963942 TSecr=1572954
973249 324.188667 85.186.40.192 -> 41.177.98.176 TCP 70 64590 > http [ACK] Seq=1359 Ack=43420 Win=65535 Len=0 TSval=1553963942 TSecr=1572954
973573 324.254986 85.186.40.192 -> 41.177.98.176 TCP 70 64590 > http [ACK] Seq=1359 Ack=46316 Win=65535 Len=0 TSval=1553963942 TSecr=1572954
975040 324.579772 85.186.40.192 -> 41.177.98.176 TCP 70 64592 > http [ACK] Seq=2706 Ack=20935 Win=65160 Len=0 TSval=1553963942 TSecr=1572954
975041 324.580720 85.186.40.192 -> 41.177.98.176 TCP 70 64590 > http [ACK] Seq=1359 Ack=47764 Win=65535 Len=0 TSval=1553963942 TSecr=1572954
975047 324.581720 85.186.40.192 -> 41.177.98.176 TCP 70 64592 > http [ACK] Seq=2706 Ack=23647 Win=65344 Len=0 TSval=1553963942 TSecr=1572954
975089 324.604225 85.186.40.192 -> 41.177.98.176 TCP 70 64590 > http [ACK] Seq=1359 Ack=50660 Win=65535 Len=0 TSval=1553963942 TSecr=1572960
975125 324.616461 85.186.40.192 -> 41.177.98.176 TCP 70 etftp > http [ACK] Seq=1994 Ack=98719 Win=65535 Len=0 TSval=1553963943 TSecr=1572968
975132 324.617747 85.186.40.192 -> 41.177.98.176 TCP 70 etftp > http [ACK] Seq=1994 Ack=101615 Win=65160 Len=0 TSval=1553963943 TSecr=1572968
975135 324.618677 85.186.40.192 -> 41.177.98.176 TCP 70 etftp > http [ACK] Seq=1994 Ack=104511 Win=65535 Len=0 TSval=1553963943 TSecr=1572968
975143 324.619863 85.186.40.192 -> 41.177.98.176 TCP 70 etftp > http [ACK] Seq=1994 Ack=108359 Win=65535 Len=0 TSval=1553963943 TSecr=1572968
975147 324.621042 85.186.40.192 -> 41.177.98.176 TCP 70 etftp > http [ACK] Seq=1994 Ack=111255 Win=65535 Len=0 TSval=1553963943 TSecr=1572968
975162 324.622413 85.186.40.192 -> 41.177.98.176 TCP 70 64591 > http [ACK] Seq=4070 Ack=24663 Win=65535 Len=0 TSval=1553963943 TSecr=1572970
975179 324.632081 85.186.40.192 -> 41.177.98.176 TCP 70 64591 > http [ACK] Seq=4070 Ack=27559 Win=65160 Len=0 TSval=1553963943 TSecr=1572970
975181 324.633125 85.186.40.192 -> 41.177.98.176 TCP 70 64591 > http [ACK] Seq=4070 Ack=29007 Win=65535 Len=0 TSval=1553963943 TSecr=1572970
975182 324.634178 85.186.40.192 -> 41.177.98.176 TCP 70 64591 > http [ACK] Seq=4070 Ack=31903 Win=65535 Len=0 TSval=1553963943 TSecr=1572970
976835 325.469585 85.186.40.192 -> 41.177.98.176 TCP 70 64590 > http [ACK] Seq=1359 Ack=52108 Win=65535 Len=0 TSval=1553963943 TSecr=1572970
976837 325.470560 85.186.40.192 -> 41.177.98.176 TCP 70 64590 > http [ACK] Seq=1359 Ack=55004 Win=65160 Len=0 TSval=1553963944 TSecr=1572970
976840 325.472071 85.186.40.192 -> 41.177.98.176 TCP 70 64590 > http [ACK] Seq=1359 Ack=57900 Win=65535 Len=0 TSval=1553963944 TSecr=1572970
976868 325.482724 85.186.40.192 -> 41.177.98.176 TCP 70 64592 > http [ACK] Seq=3372 Ack=23974 Win=65535 Len=0 TSval=1553963944 TSecr=1573020
977309 325.595959 85.186.40.192 -> 41.177.98.176 TCP 70 etftp > http [ACK] Seq=3335 Ack=114504 Win=65535 Len=0 TSval=1553963945 TSecr=1573109
979648 326.693548 85.186.40.192 -> 41.177.98.176 TCP 70 64590 > http [ACK] Seq=2030 Ack=62175 Win=65535 Len=0 TSval=1553963945 TSecr=1573108
981257 327.734629 85.186.40.192 -> 41.177.98.176 TCP 70 [TCP Previous segment not captured] 64591 > http [ACK] Seq=4742 Ack=33676 Win=65535 Len=0 TSval=1553963949 TSecr=1572970
985087 328.833923 85.186.40.192 -> 41.177.98.176 TCP 70 64591 > http [ACK] Seq=4742 Ack=34229 Win=65535 Len=0 TSval=1553963952 TSecr=1573436
1008826 337.992132 85.186.40.192 -> 41.177.98.176 TCP 70 etftp > http [FIN, ACK] Seq=3335 Ack=114504 Win=65535 Len=0 TSval=1553963970 TSecr=1573109
1008831 337.992834 85.186.40.192 -> 41.177.98.176 TCP 70 64590 > http [FIN, ACK] Seq=2030 Ack=62175 Win=65535 Len=0 TSval=1553963970 TSecr=1573108
1008836 337.994122 85.186.40.192 -> 41.177.98.176 TCP 70 64591 > http [FIN, ACK] Seq=4742 Ack=34229 Win=65535 Len=0 TSval=1553963970 TSecr=1573436
1008841 337.995444 85.186.40.192 -> 41.177.98.176 TCP 70 64592 > http [FIN, ACK] Seq=3372 Ack=23974 Win=65535 Len=0 TSval=1553963970 TSecr=1573020
1010836 339.074962 85.186.40.192 -> 41.177.98.176 TCP 70 etftp > http [ACK] Seq=3336 Ack=114505 Win=65535 Len=0 TSval=1553963970 TSecr=1574359
1010846 339.076209 85.186.40.192 -> 41.177.98.176 TCP 70 64590 > http [ACK] Seq=2031 Ack=62176 Win=65535 Len=0 TSval=1553963970 TSecr=1574359
1010847 339.077231 85.186.40.192 -> 41.177.98.176 TCP 70 64591 > http [ACK] Seq=4743 Ack=34230 Win=65535 Len=0 TSval=1553963970 TSecr=1574359
1010857 339.078648 85.186.40.192 -> 41.177.98.176 TCP 70 64592 > http [ACK] Seq=3373 Ack=23975 Win=65535 Len=0 TSval=1553963970 TSecr=1574359
