45091  18.872343 85.224.39.201 -> 244.3.210.197 TCP 70 40462 > http [SYN] Seq=0 Win=5840 Len=0 MSS=1460 SACK_PERM=1 WS=1
45212  18.912561 85.224.39.201 -> 244.3.210.197 TCP 64 40462 > http [ACK] Seq=1 Ack=1 Win=5840 Len=0
46725  19.434049 85.224.39.201 -> 244.3.210.197 TCP 64 40462 > http [ACK] Seq=1120 Ack=1461 Win=8760 Len=0
46735  19.434705 85.224.39.201 -> 244.3.210.197 TCP 64 40462 > http [ACK] Seq=1120 Ack=2921 Win=11680 Len=0
46789  19.451533 85.224.39.201 -> 244.3.210.197 TCP 70 40499 > http [SYN] Seq=0 Win=8192 Len=0 MSS=1460 WS=4 SACK_PERM=1
46853  19.479126 85.224.39.201 -> 244.3.210.197 TCP 64 40462 > http [ACK] Seq=1120 Ack=4381 Win=14600 Len=0
46854  19.479156 85.224.39.201 -> 244.3.210.197 TCP 64 40462 > http [ACK] Seq=1120 Ack=5841 Win=17520 Len=0
46855  19.479161 85.224.39.201 -> 244.3.210.197 TCP 64 40462 > http [ACK] Seq=1120 Ack=7301 Win=20440 Len=0
46856  19.479165 85.224.39.201 -> 244.3.210.197 TCP 64 40462 > http [ACK] Seq=1120 Ack=8761 Win=23360 Len=0
46970  19.494661 85.224.39.201 -> 244.3.210.197 TCP 64 40499 > http [ACK] Seq=1 Ack=1 Win=65700 Len=0
47183  19.524468 85.224.39.201 -> 244.3.210.197 TCP 64 40462 > http [ACK] Seq=1120 Ack=10221 Win=26280 Len=0
47201  19.525372 85.224.39.201 -> 244.3.210.197 TCP 64 40462 > http [ACK] Seq=1120 Ack=11681 Win=29200 Len=0
47208  19.525856 85.224.39.201 -> 244.3.210.197 TCP 64 40462 > http [ACK] Seq=1120 Ack=13141 Win=32120 Len=0
47214  19.526047 85.224.39.201 -> 244.3.210.197 TCP 64 40462 > http [ACK] Seq=1120 Ack=14601 Win=35040 Len=0
47215  19.526051 85.224.39.201 -> 244.3.210.197 TCP 64 40462 > http [ACK] Seq=1120 Ack=15290 Win=35040 Len=0
47280  19.547448 85.224.39.201 -> 244.3.210.197 TCP 64 40499 > http [ACK] Seq=814 Ack=2921 Win=65700 Len=0
47371  19.594544 85.224.39.201 -> 244.3.210.197 TCP 64 40462 > http [ACK] Seq=1923 Ack=18210 Win=40880 Len=0
47393  19.596098 85.224.39.201 -> 244.3.210.197 TCP 64 40462 > http [ACK] Seq=1923 Ack=21130 Win=46720 Len=0
47409  19.596818 85.224.39.201 -> 244.3.210.197 TCP 64 40462 > http [ACK] Seq=1923 Ack=24050 Win=52560 Len=0
47410  19.596845 85.224.39.201 -> 244.3.210.197 TCP 64 40462 > http [ACK] Seq=1923 Ack=26970 Win=58400 Len=0
47428  19.597608 85.224.39.201 -> 244.3.210.197 TCP 64 40462 > http [ACK] Seq=1923 Ack=29890 Win=62780 Len=0
47476  19.602799 85.224.39.201 -> 244.3.210.197 TCP 64 40462 > http [ACK] Seq=1923 Ack=34270 Win=61320 Len=0
47571  19.613886 85.224.39.201 -> 244.3.210.197 TCP 64 40499 > http [ACK] Seq=814 Ack=5841 Win=65700 Len=0
47662  19.636325 85.224.39.201 -> 244.3.210.197 TCP 64 40462 > http [ACK] Seq=1923 Ack=37190 Win=62780 Len=0
47668  19.638818 85.224.39.201 -> 244.3.210.197 TCP 64 40462 > http [ACK] Seq=1923 Ack=40110 Win=62780 Len=0
47674  19.639168 85.224.39.201 -> 244.3.210.197 TCP 64 40462 > http [ACK] Seq=1923 Ack=49532 Win=56940 Len=0
47736  19.669446 85.224.39.201 -> 244.3.210.197 TCP 64 40499 > http [ACK] Seq=814 Ack=8761 Win=65700 Len=0
47743  19.670395 85.224.39.201 -> 244.3.210.197 TCP 64 40499 > http [ACK] Seq=814 Ack=10382 Win=65700 Len=0
47936  19.712668 85.224.39.201 -> 244.3.210.197 TCP 64 40462 > http [ACK] Seq=2732 Ack=52452 Win=62780 Len=0
47970  19.715924 85.224.39.201 -> 244.3.210.197 TCP 64 40499 > http [ACK] Seq=1626 Ack=13302 Win=65700 Len=0
48136  19.771953 85.224.39.201 -> 244.3.210.197 TCP 64 40462 > http [ACK] Seq=3544 Ack=55817 Win=62780 Len=0
48148  19.774240 85.224.39.201 -> 244.3.210.197 TCP 64 40462 > http [ACK] Seq=3544 Ack=58737 Win=62780 Len=0
48157  19.775094 85.224.39.201 -> 244.3.210.197 TCP 64 40462 > http [ACK] Seq=3544 Ack=61657 Win=62780 Len=0
48166  19.775743 85.224.39.201 -> 244.3.210.197 TCP 64 40462 > http [ACK] Seq=3544 Ack=64577 Win=62780 Len=0
48167  19.775748 85.224.39.201 -> 244.3.210.197 TCP 64 40462 > http [ACK] Seq=3544 Ack=67497 Win=62780 Len=0
48187  19.776656 85.224.39.201 -> 244.3.210.197 TCP 64 40462 > http [ACK] Seq=3544 Ack=70417 Win=62780 Len=0
48188  19.776661 85.224.39.201 -> 244.3.210.197 TCP 64 40462 > http [ACK] Seq=3544 Ack=73337 Win=62780 Len=0
48224  19.786505 85.224.39.201 -> 244.3.210.197 TCP 64 40462 > http [ACK] Seq=3544 Ack=87937 Win=51100 Len=0
48421  19.820389 85.224.39.201 -> 244.3.210.197 TCP 64 40462 > http [ACK] Seq=3544 Ack=90857 Win=62780 Len=0
48430  19.820900 85.224.39.201 -> 244.3.210.197 TCP 64 40462 > http [ACK] Seq=3544 Ack=93777 Win=62780 Len=0
48439  19.821672 85.224.39.201 -> 244.3.210.197 TCP 64 40462 > http [ACK] Seq=3544 Ack=96697 Win=62780 Len=0
48450  19.822772 85.224.39.201 -> 244.3.210.197 TCP 64 40462 > http [ACK] Seq=3544 Ack=99617 Win=62780 Len=0
48459  19.823927 85.224.39.201 -> 244.3.210.197 TCP 64 40462 > http [ACK] Seq=3544 Ack=102537 Win=62780 Len=0
48476  19.825608 85.224.39.201 -> 244.3.210.197 TCP 64 40462 > http [ACK] Seq=3544 Ack=105457 Win=62780 Len=0
48485  19.826860 85.224.39.201 -> 244.3.210.197 TCP 64 40462 > http [ACK] Seq=3544 Ack=108377 Win=62780 Len=0
48486  19.826864 85.224.39.201 -> 244.3.210.197 TCP 64 40462 > http [ACK] Seq=3544 Ack=111297 Win=62780 Len=0
48487  19.826869 85.224.39.201 -> 244.3.210.197 TCP 64 40462 > http [ACK] Seq=3544 Ack=114217 Win=62780 Len=0
48544  19.835232 85.224.39.201 -> 244.3.210.197 TCP 64 40462 > http [ACK] Seq=3544 Ack=118597 Win=61320 Len=0
48555  19.838829 85.224.39.201 -> 244.3.210.197 TCP 64 40462 > http [ACK] Seq=3544 Ack=121517 Win=62780 Len=0
48565  19.840537 85.224.39.201 -> 244.3.210.197 TCP 64 40462 > http [ACK] Seq=3544 Ack=124437 Win=62780 Len=0
48573  19.841434 85.224.39.201 -> 244.3.210.197 TCP 64 40462 > http [ACK] Seq=3544 Ack=127357 Win=62780 Len=0
48580  19.843211 85.224.39.201 -> 244.3.210.197 TCP 64 40462 > http [ACK] Seq=3544 Ack=130277 Win=62780 Len=0
48586  19.843881 85.224.39.201 -> 244.3.210.197 TCP 64 40462 > http [ACK] Seq=3544 Ack=133197 Win=62780 Len=0
48617  19.868413 85.224.39.201 -> 244.3.210.197 TCP 64 40462 > http [ACK] Seq=3544 Ack=136117 Win=62780 Len=0
48623  19.869617 85.224.39.201 -> 244.3.210.197 TCP 64 40462 > http [ACK] Seq=3544 Ack=139037 Win=62780 Len=0
48643  19.871028 85.224.39.201 -> 244.3.210.197 TCP 64 40462 > http [ACK] Seq=3544 Ack=141957 Win=62780 Len=0
48651  19.872279 85.224.39.201 -> 244.3.210.197 TCP 64 40462 > http [ACK] Seq=3544 Ack=144877 Win=62780 Len=0
48657  19.873278 85.224.39.201 -> 244.3.210.197 TCP 64 40462 > http [ACK] Seq=3544 Ack=147797 Win=62780 Len=0
48663  19.876359 85.224.39.201 -> 244.3.210.197 TCP 64 40462 > http [ACK] Seq=3544 Ack=150717 Win=62780 Len=0
48669  19.877022 85.224.39.201 -> 244.3.210.197 TCP 64 40462 > http [ACK] Seq=3544 Ack=153637 Win=62780 Len=0
48704  19.886986 85.224.39.201 -> 244.3.210.197 TCP 64 40462 > http [ACK] Seq=3544 Ack=156557 Win=62780 Len=0
48711  19.888159 85.224.39.201 -> 244.3.210.197 TCP 64 40462 > http [ACK] Seq=3544 Ack=159477 Win=62780 Len=0
48712  19.888163 85.224.39.201 -> 244.3.210.197 TCP 64 40462 > http [ACK] Seq=3544 Ack=162397 Win=62780 Len=0
48722  19.888391 85.224.39.201 -> 244.3.210.197 TCP 64 40462 > http [ACK] Seq=3544 Ack=165317 Win=62780 Len=0
48723  19.888394 85.224.39.201 -> 244.3.210.197 TCP 64 40462 > http [ACK] Seq=3544 Ack=168237 Win=62780 Len=0
48728  19.888630 85.224.39.201 -> 244.3.210.197 TCP 64 40462 > http [ACK] Seq=3544 Ack=171157 Win=62780 Len=0
48729  19.888634 85.224.39.201 -> 244.3.210.197 TCP 64 40462 > http [ACK] Seq=3544 Ack=174077 Win=62780 Len=0
48787  19.897419 85.224.39.201 -> 244.3.210.197 TCP 64 40462 > http [ACK] Seq=3544 Ack=176997 Win=62780 Len=0
48795  19.897878 85.224.39.201 -> 244.3.210.197 TCP 64 40462 > http [ACK] Seq=3544 Ack=179917 Win=62780 Len=0
48872  19.911628 85.224.39.201 -> 244.3.210.197 TCP 64 40462 > http [ACK] Seq=3544 Ack=182837 Win=62780 Len=0
48879  19.912778 85.224.39.201 -> 244.3.210.197 TCP 64 40462 > http [ACK] Seq=3544 Ack=185757 Win=62780 Len=0
48885  19.913478 85.224.39.201 -> 244.3.210.197 TCP 64 40462 > http [ACK] Seq=3544 Ack=187222 Win=62780 Len=0
48976  19.926692 85.224.39.201 -> 244.3.210.197 TCP 64 40499 > http [ACK] Seq=1626 Ack=13683 Win=65316 Len=0
49125  19.999274 85.224.39.201 -> 244.3.210.197 TCP 64 40499 > http [ACK] Seq=2442 Ack=16352 Win=65700 Len=0
49340  20.061345 85.224.39.201 -> 244.3.210.197 TCP 64 40499 > http [ACK] Seq=3252 Ack=19272 Win=65700 Len=0
49349  20.062114 85.224.39.201 -> 244.3.210.197 TCP 64 40499 > http [ACK] Seq=3252 Ack=22192 Win=65700 Len=0
49358  20.064115 85.224.39.201 -> 244.3.210.197 TCP 64 40499 > http [ACK] Seq=3252 Ack=25112 Win=65700 Len=0
49367  20.064639 85.224.39.201 -> 244.3.210.197 TCP 64 40499 > http [ACK] Seq=3252 Ack=28032 Win=65700 Len=0
49376  20.067037 85.224.39.201 -> 244.3.210.197 TCP 64 40462 > http [ACK] Seq=4354 Ack=190142 Win=62780 Len=0
49382  20.067471 85.224.39.201 -> 244.3.210.197 TCP 64 40462 > http [ACK] Seq=4354 Ack=192126 Win=62780 Len=0
49432  20.102164 85.224.39.201 -> 244.3.210.197 TCP 64 40499 > http [ACK] Seq=3252 Ack=30952 Win=65700 Len=0
49441  20.103121 85.224.39.201 -> 244.3.210.197 TCP 64 40499 > http [ACK] Seq=3252 Ack=33872 Win=65700 Len=0
49456  20.103803 85.224.39.201 -> 244.3.210.197 TCP 64 40499 > http [ACK] Seq=3252 Ack=36792 Win=65700 Len=0
49465  20.105876 85.224.39.201 -> 244.3.210.197 TCP 64 40499 > http [ACK] Seq=3252 Ack=39712 Win=65700 Len=0
49466  20.106076 85.224.39.201 -> 244.3.210.197 TCP 64 40499 > http [ACK] Seq=3252 Ack=42632 Win=65700 Len=0
49467  20.106080 85.224.39.201 -> 244.3.210.197 TCP 64 40499 > http [ACK] Seq=3252 Ack=45552 Win=65700 Len=0
49582  20.143011 85.224.39.201 -> 244.3.210.197 TCP 64 40499 > http [ACK] Seq=3252 Ack=48472 Win=65700 Len=0
49588  20.143475 85.224.39.201 -> 244.3.210.197 TCP 64 40499 > http [ACK] Seq=3252 Ack=51392 Win=65700 Len=0
49594  20.144216 85.224.39.201 -> 244.3.210.197 TCP 64 40499 > http [ACK] Seq=3252 Ack=54495 Win=65700 Len=0
49671  20.188503 85.224.39.201 -> 244.3.210.197 TCP 64 40499 > http [ACK] Seq=4063 Ack=57415 Win=65700 Len=0
49679  20.197192 85.224.39.201 -> 244.3.210.197 TCP 64 40499 > http [ACK] Seq=4063 Ack=60335 Win=65700 Len=0
49685  20.197395 85.224.39.201 -> 244.3.210.197 TCP 64 40499 > http [ACK] Seq=4063 Ack=63255 Win=65700 Len=0
49686  20.197399 85.224.39.201 -> 244.3.210.197 TCP 64 40499 > http [ACK] Seq=4063 Ack=66175 Win=65276 Len=0
49687  20.197403 85.224.39.201 -> 244.3.210.197 TCP 64 40499 > http [ACK] Seq=4063 Ack=69095 Win=62356 Len=0
49688  20.197407 85.224.39.201 -> 244.3.210.197 TCP 64 [TCP Window Update] 40499 > http [ACK] Seq=4063 Ack=69095 Win=65700 Len=0
49689  20.197411 85.224.39.201 -> 244.3.210.197 TCP 64 40499 > http [ACK] Seq=4063 Ack=72015 Win=65700 Len=0
49690  20.197416 85.224.39.201 -> 244.3.210.197 TCP 64 40499 > http [ACK] Seq=4063 Ack=74935 Win=65700 Len=0
49691  20.197420 85.224.39.201 -> 244.3.210.197 TCP 64 40499 > http [ACK] Seq=4063 Ack=77855 Win=65700 Len=0
49699  20.197650 85.224.39.201 -> 244.3.210.197 TCP 64 40499 > http [ACK] Seq=4063 Ack=80775 Win=65700 Len=0
49700  20.197654 85.224.39.201 -> 244.3.210.197 TCP 64 40499 > http [ACK] Seq=4063 Ack=83695 Win=65700 Len=0
49706  20.197686 85.224.39.201 -> 244.3.210.197 TCP 64 40499 > http [ACK] Seq=4063 Ack=85407 Win=65700 Len=0
49822  20.242865 85.224.39.201 -> 244.3.210.197 TCP 64 40499 > http [ACK] Seq=4874 Ack=88327 Win=65700 Len=0
49828  20.243080 85.224.39.201 -> 244.3.210.197 TCP 64 40499 > http [ACK] Seq=4874 Ack=91247 Win=65700 Len=0
49834  20.243740 85.224.39.201 -> 244.3.210.197 TCP 64 40499 > http [ACK] Seq=4874 Ack=94167 Win=65700 Len=0
49840  20.244804 85.224.39.201 -> 244.3.210.197 TCP 64 40499 > http [ACK] Seq=4874 Ack=97087 Win=65700 Len=0
49851  20.247061 85.224.39.201 -> 244.3.210.197 TCP 64 40499 > http [ACK] Seq=4874 Ack=100007 Win=65700 Len=0
49857  20.247280 85.224.39.201 -> 244.3.210.197 TCP 64 40499 > http [ACK] Seq=4874 Ack=102927 Win=65700 Len=0
49863  20.247757 85.224.39.201 -> 244.3.210.197 TCP 64 40499 > http [ACK] Seq=4874 Ack=105847 Win=65700 Len=0
49869  20.248054 85.224.39.201 -> 244.3.210.197 TCP 64 40499 > http [ACK] Seq=4874 Ack=108767 Win=65700 Len=0
49873  20.248265 85.224.39.201 -> 244.3.210.197 TCP 64 40499 > http [ACK] Seq=4874 Ack=111687 Win=65700 Len=0
49882  20.248932 85.224.39.201 -> 244.3.210.197 TCP 64 40499 > http [ACK] Seq=4874 Ack=114607 Win=65700 Len=0
49980  20.293328 85.224.39.201 -> 244.3.210.197 TCP 64 40499 > http [ACK] Seq=5683 Ack=117574 Win=65700 Len=0
49981  20.293333 85.224.39.201 -> 244.3.210.197 TCP 64 40499 > http [ACK] Seq=5683 Ack=120494 Win=65700 Len=0
49982  20.293337 85.224.39.201 -> 244.3.210.197 TCP 64 40499 > http [ACK] Seq=5683 Ack=123414 Win=65700 Len=0
49983  20.293358 85.224.39.201 -> 244.3.210.197 TCP 64 40499 > http [ACK] Seq=5683 Ack=125323 Win=65700 Len=0
50186  20.428517 85.224.39.201 -> 244.3.210.197 TCP 64 40462 > http [ACK] Seq=5178 Ack=195046 Win=62780 Len=0
50193  20.429358 85.224.39.201 -> 244.3.210.197 TCP 64 40462 > http [ACK] Seq=5178 Ack=196879 Win=62780 Len=0
50372  20.508031 85.224.39.201 -> 244.3.210.197 TCP 64 40462 > http [ACK] Seq=5980 Ack=199189 Win=62780 Len=0
50375  20.508211 85.224.39.201 -> 244.3.210.197 TCP 64 40499 > http [ACK] Seq=6495 Ack=128021 Win=65700 Len=0
50463  20.554393 85.224.39.201 -> 244.3.210.197 TCP 64 40499 > http [ACK] Seq=7309 Ack=130941 Win=65700 Len=0
50464  20.554398 85.224.39.201 -> 244.3.210.197 TCP 64 40499 > http [ACK] Seq=7309 Ack=133861 Win=65700 Len=0
50465  20.554402 85.224.39.201 -> 244.3.210.197 TCP 64 40499 > http [ACK] Seq=7309 Ack=136781 Win=65700 Len=0
50466  20.554428 85.224.39.201 -> 244.3.210.197 TCP 64 40499 > http [ACK] Seq=7309 Ack=139096 Win=65700 Len=0
50602  20.628816 85.224.39.201 -> 244.3.210.197 TCP 64 40462 > http [ACK] Seq=6792 Ack=202109 Win=62780 Len=0
50613  20.629549 85.224.39.201 -> 244.3.210.197 TCP 64 40462 > http [ACK] Seq=6792 Ack=205029 Win=62780 Len=0
50620  20.630731 85.224.39.201 -> 244.3.210.197 TCP 64 40462 > http [ACK] Seq=6792 Ack=207949 Win=62780 Len=0
50675  20.666348 85.224.39.201 -> 244.3.210.197 TCP 64 40462 > http [ACK] Seq=6792 Ack=208942 Win=62780 Len=0
50695  20.706737 85.224.39.201 -> 244.3.210.197 TCP 64 40499 > http [ACK] Seq=8117 Ack=142016 Win=65700 Len=0
50701  20.707418 85.224.39.201 -> 244.3.210.197 TCP 64 40499 > http [ACK] Seq=8117 Ack=144936 Win=65700 Len=0
50707  20.707812 85.224.39.201 -> 244.3.210.197 TCP 64 40499 > http [ACK] Seq=8117 Ack=147856 Win=65700 Len=0
50788  20.788183 85.224.39.201 -> 244.3.210.197 TCP 64 40462 > http [ACK] Seq=7601 Ack=212500 Win=62780 Len=0
50804  20.799027 85.224.39.201 -> 244.3.210.197 TCP 64 40462 > http [ACK] Seq=7601 Ack=211862 Win=62780 Len=0
50878  20.849810 85.224.39.201 -> 244.3.210.197 TCP 64 40499 > http [ACK] Seq=8930 Ack=151202 Win=65700 Len=0
51016  20.943031 85.224.39.201 -> 244.3.210.197 TCP 64 40462 > http [ACK] Seq=8408 Ack=215420 Win=62780 Len=0
51022  20.944195 85.224.39.201 -> 244.3.210.197 TCP 64 40462 > http [ACK] Seq=8408 Ack=218340 Win=62780 Len=0
51028  20.945243 85.224.39.201 -> 244.3.210.197 TCP 64 40462 > http [ACK] Seq=8408 Ack=221260 Win=62780 Len=0
51034  20.945638 85.224.39.201 -> 244.3.210.197 TCP 64 40462 > http [ACK] Seq=8408 Ack=223279 Win=62780 Len=0
51162  21.035162 85.224.39.201 -> 244.3.210.197 TCP 64 40499 > http [ACK] Seq=9740 Ack=155552 Win=65700 Len=0
51163  21.035166 85.224.39.201 -> 244.3.210.197 TCP 64 40499 > http [ACK] Seq=9740 Ack=158472 Win=65700 Len=0
51164  21.035170 85.224.39.201 -> 244.3.210.197 TCP 64 40499 > http [ACK] Seq=9740 Ack=161392 Win=65700 Len=0
51165  21.035174 85.224.39.201 -> 244.3.210.197 TCP 64 40499 > http [ACK] Seq=9740 Ack=164312 Win=65276 Len=0
51166  21.035179 85.224.39.201 -> 244.3.210.197 TCP 64 40499 > http [ACK] Seq=9740 Ack=167232 Win=62356 Len=0
51175  21.035396 85.224.39.201 -> 244.3.210.197 TCP 64 [TCP Window Update] 40499 > http [ACK] Seq=9740 Ack=167232 Win=65700 Len=0
51177  21.035404 85.224.39.201 -> 244.3.210.197 TCP 64 40499 > http [ACK] Seq=9740 Ack=170152 Win=65700 Len=0
51178  21.035408 85.224.39.201 -> 244.3.210.197 TCP 64 40499 > http [ACK] Seq=9740 Ack=173072 Win=65700 Len=0
51179  21.035412 85.224.39.201 -> 244.3.210.197 TCP 64 40499 > http [ACK] Seq=9740 Ack=175992 Win=65700 Len=0
51180  21.035416 85.224.39.201 -> 244.3.210.197 TCP 64 40499 > http [ACK] Seq=9740 Ack=178912 Win=65700 Len=0
51181  21.035420 85.224.39.201 -> 244.3.210.197 TCP 64 40499 > http [ACK] Seq=9740 Ack=181832 Win=65700 Len=0
51184  21.035448 85.224.39.201 -> 244.3.210.197 TCP 64 40499 > http [ACK] Seq=9740 Ack=184752 Win=65700 Len=0
51186  21.035457 85.224.39.201 -> 244.3.210.197 TCP 64 40499 > http [ACK] Seq=9740 Ack=187672 Win=65700 Len=0
51187  21.035461 85.224.39.201 -> 244.3.210.197 TCP 64 40499 > http [ACK] Seq=9740 Ack=190775 Win=65700 Len=0
51387  21.101187 85.224.39.201 -> 244.3.210.197 TCP 64 40462 > http [ACK] Seq=9217 Ack=226199 Win=62780 Len=0
51402  21.110508 85.224.39.201 -> 244.3.210.197 TCP 64 40462 > http [ACK] Seq=9217 Ack=274379 Win=18980 Len=0
51423  21.112652 85.224.39.201 -> 244.3.210.197 TCP 64 40462 > http [ACK] Seq=9217 Ack=277299 Win=20440 Len=0
51428  21.113932 85.224.39.201 -> 244.3.210.197 TCP 64 40462 > http [ACK] Seq=9217 Ack=280219 Win=21900 Len=0
51429  21.113937 85.224.39.201 -> 244.3.210.197 TCP 64 40462 > http [ACK] Seq=9217 Ack=283139 Win=27740 Len=0
51438  21.114253 85.224.39.201 -> 244.3.210.197 TCP 64 40462 > http [ACK] Seq=9217 Ack=286059 Win=32120 Len=0
51488  21.143328 85.224.39.201 -> 244.3.210.197 TCP 64 40462 > http [ACK] Seq=9217 Ack=287869 Win=62780 Len=0
51609  21.214690 85.224.39.201 -> 244.3.210.197 TCP 64 40499 > http [ACK] Seq=10557 Ack=193695 Win=65700 Len=0
51612  21.214880 85.224.39.201 -> 244.3.210.197 TCP 64 40499 > http [ACK] Seq=10557 Ack=196638 Win=65700 Len=0
51720  21.281578 85.224.39.201 -> 244.3.210.197 TCP 64 40462 > http [ACK] Seq=10030 Ack=290789 Win=62780 Len=0
51727  21.284782 85.224.39.201 -> 244.3.210.197 TCP 64 40462 > http [ACK] Seq=10030 Ack=291326 Win=62780 Len=0
51845  21.358231 85.224.39.201 -> 244.3.210.197 TCP 64 40499 > http [ACK] Seq=11363 Ack=199558 Win=65700 Len=0
51850  21.358410 85.224.39.201 -> 244.3.210.197 TCP 64 40499 > http [ACK] Seq=11363 Ack=202478 Win=65700 Len=0
51851  21.358414 85.224.39.201 -> 244.3.210.197 TCP 64 40499 > http [ACK] Seq=11363 Ack=205398 Win=65700 Len=0
51852  21.358418 85.224.39.201 -> 244.3.210.197 TCP 64 40499 > http [ACK] Seq=11363 Ack=207971 Win=65620 Len=0
52097  21.459844 85.224.39.201 -> 244.3.210.197 TCP 64 40462 > http [ACK] Seq=10860 Ack=294246 Win=62780 Len=0
52103  21.460081 85.224.39.201 -> 244.3.210.197 TCP 64 40462 > http [ACK] Seq=10860 Ack=297166 Win=62780 Len=0
52109  21.461101 85.224.39.201 -> 244.3.210.197 TCP 64 40462 > http [ACK] Seq=10860 Ack=300086 Win=62780 Len=0
52110  21.461125 85.224.39.201 -> 244.3.210.197 TCP 64 40462 > http [ACK] Seq=10860 Ack=303006 Win=62780 Len=0
52121  21.462841 85.224.39.201 -> 244.3.210.197 TCP 64 40462 > http [ACK] Seq=10860 Ack=305926 Win=62780 Len=0
52122  21.462846 85.224.39.201 -> 244.3.210.197 TCP 64 40462 > http [ACK] Seq=10860 Ack=308846 Win=62780 Len=0
52133  21.463572 85.224.39.201 -> 244.3.210.197 TCP 64 40462 > http [ACK] Seq=10860 Ack=311766 Win=62780 Len=0
52139  21.464684 85.224.39.201 -> 244.3.210.197 TCP 64 40462 > http [ACK] Seq=10860 Ack=317606 Win=62780 Len=0
52145  21.465336 85.224.39.201 -> 244.3.210.197 TCP 64 40462 > http [ACK] Seq=10860 Ack=320823 Win=62780 Len=0
52200  21.498837 85.224.39.201 -> 244.3.210.197 TCP 64 40499 > http [ACK] Seq=12987 Ack=211183 Win=65700 Len=0
52201  21.498842 85.224.39.201 -> 244.3.210.197 TCP 64 40499 > http [ACK] Seq=12987 Ack=212831 Win=65700 Len=0
52260  21.545506 85.224.39.201 -> 244.3.210.197 TCP 64 40462 > http [ACK] Seq=11682 Ack=321404 Win=62780 Len=0
52423  21.623610 85.224.39.201 -> 244.3.210.197 TCP 64 40462 > http [ACK] Seq=12511 Ack=324324 Win=62780 Len=0
52429  21.624956 85.224.39.201 -> 244.3.210.197 TCP 64 40462 > http [ACK] Seq=12511 Ack=327244 Win=62780 Len=0
52435  21.625188 85.224.39.201 -> 244.3.210.197 TCP 64 40462 > http [ACK] Seq=12511 Ack=328950 Win=62780 Len=0
52467  21.670961 85.224.39.201 -> 244.3.210.197 TCP 64 40499 > http [ACK] Seq=15449 Ack=216831 Win=65700 Len=0
93180  35.618071 85.224.39.201 -> 244.3.210.197 TCP 64 40462 > http [ACK] Seq=13681 Ack=331870 Win=62780 Len=0
93193  35.620828 85.224.39.201 -> 244.3.210.197 TCP 64 40462 > http [ACK] Seq=13681 Ack=345276 Win=51100 Len=0
93529  35.709044 85.224.39.201 -> 244.3.210.197 TCP 64 40499 > http [ACK] Seq=16379 Ack=219751 Win=65700 Len=0
93530  35.709049 85.224.39.201 -> 244.3.210.197 TCP 64 40499 > http [ACK] Seq=16379 Ack=222671 Win=65700 Len=0
93531  35.709052 85.224.39.201 -> 244.3.210.197 TCP 64 40499 > http [ACK] Seq=16379 Ack=225591 Win=65700 Len=0
93533  35.709092 85.224.39.201 -> 244.3.210.197 TCP 64 40499 > http [ACK] Seq=16379 Ack=227212 Win=65700 Len=0
93592  35.714524 85.224.39.201 -> 244.3.210.197 TCP 64 40462 > http [ACK] Seq=14607 Ack=348196 Win=62780 Len=0
93780  35.752464 85.224.39.201 -> 244.3.210.197 TCP 64 40499 > http [ACK] Seq=17308 Ack=230132 Win=65700 Len=0
93843  35.769079 85.224.39.201 -> 244.3.210.197 TCP 64 40462 > http [ACK] Seq=15536 Ack=358861 Win=59860 Len=0
93856  35.770223 85.224.39.201 -> 244.3.210.197 TCP 64 40462 > http [ACK] Seq=15536 Ack=351561 Win=62780 Len=0
93862  35.770703 85.224.39.201 -> 244.3.210.197 TCP 64 40462 > http [ACK] Seq=15536 Ack=363241 Win=59860 Len=0
93877  35.772337 85.224.39.201 -> 244.3.210.197 TCP 64 40462 > http [ACK] Seq=15536 Ack=366161 Win=62780 Len=0
93887  35.772586 85.224.39.201 -> 244.3.210.197 TCP 64 40462 > http [ACK] Seq=15536 Ack=369081 Win=62780 Len=0
93888  35.772590 85.224.39.201 -> 244.3.210.197 TCP 64 40462 > http [ACK] Seq=15536 Ack=372001 Win=62780 Len=0
93903  35.773055 85.224.39.201 -> 244.3.210.197 TCP 64 40462 > http [ACK] Seq=15536 Ack=374921 Win=62780 Len=0
93913  35.773491 85.224.39.201 -> 244.3.210.197 TCP 64 40462 > http [ACK] Seq=15536 Ack=377841 Win=62780 Len=0
93922  35.773768 85.224.39.201 -> 244.3.210.197 TCP 64 40462 > http [ACK] Seq=15536 Ack=380761 Win=62780 Len=0
93938  35.774699 85.224.39.201 -> 244.3.210.197 TCP 64 40462 > http [ACK] Seq=15536 Ack=383681 Win=62780 Len=0
93939  35.774703 85.224.39.201 -> 244.3.210.197 TCP 64 40462 > http [ACK] Seq=15536 Ack=386601 Win=62780 Len=0
93956  35.775040 85.224.39.201 -> 244.3.210.197 TCP 64 40462 > http [ACK] Seq=15536 Ack=389521 Win=62780 Len=0
93984  35.780711 85.224.39.201 -> 244.3.210.197 TCP 64 40462 > http [ACK] Seq=15536 Ack=411421 Win=45260 Len=0
94143  35.797745 85.224.39.201 -> 244.3.210.197 TCP 64 40499 > http [ACK] Seq=18228 Ack=233433 Win=65700 Len=0
94150  35.798437 85.224.39.201 -> 244.3.210.197 TCP 64 40499 > http [ACK] Seq=18228 Ack=236353 Win=65700 Len=0
94159  35.798670 85.224.39.201 -> 244.3.210.197 TCP 64 40499 > http [ACK] Seq=18228 Ack=239273 Win=65700 Len=0
94160  35.798888 85.224.39.201 -> 244.3.210.197 TCP 64 40499 > http [ACK] Seq=18228 Ack=242193 Win=65276 Len=0
94169  35.799085 85.224.39.201 -> 244.3.210.197 TCP 64 40499 > http [ACK] Seq=18228 Ack=245113 Win=65700 Len=0
94179  35.802070 85.224.39.201 -> 244.3.210.197 TCP 64 40499 > http [ACK] Seq=18228 Ack=248033 Win=65700 Len=0
94180  35.802075 85.224.39.201 -> 244.3.210.197 TCP 64 40499 > http [ACK] Seq=18228 Ack=250953 Win=65700 Len=0
94181  35.802079 85.224.39.201 -> 244.3.210.197 TCP 64 40499 > http [ACK] Seq=18228 Ack=253873 Win=65700 Len=0
94189  35.802276 85.224.39.201 -> 244.3.210.197 TCP 64 40499 > http [ACK] Seq=18228 Ack=256793 Win=65700 Len=0
94190  35.802280 85.224.39.201 -> 244.3.210.197 TCP 64 40499 > http [ACK] Seq=18228 Ack=259713 Win=65700 Len=0
94191  35.802284 85.224.39.201 -> 244.3.210.197 TCP 64 40499 > http [ACK] Seq=18228 Ack=262633 Win=65700 Len=0
94192  35.802288 85.224.39.201 -> 244.3.210.197 TCP 64 40499 > http [ACK] Seq=18228 Ack=264755 Win=65700 Len=0
94297  35.810273 85.224.39.201 -> 244.3.210.197 TCP 64 40462 > http [ACK] Seq=15536 Ack=414341 Win=62780 Len=0
94317  35.811185 85.224.39.201 -> 244.3.210.197 TCP 64 40462 > http [ACK] Seq=15536 Ack=417261 Win=62780 Len=0
94348  35.813630 85.224.39.201 -> 244.3.210.197 TCP 64 40462 > http [ACK] Seq=15536 Ack=420181 Win=62780 Len=0
94358  35.814039 85.224.39.201 -> 244.3.210.197 TCP 64 40462 > http [ACK] Seq=15536 Ack=423101 Win=62780 Len=0
94373  35.815039 85.224.39.201 -> 244.3.210.197 TCP 64 40462 > http [ACK] Seq=15536 Ack=426021 Win=62780 Len=0
94391  35.815653 85.224.39.201 -> 244.3.210.197 TCP 64 40462 > http [ACK] Seq=15536 Ack=428941 Win=62780 Len=0
94400  35.816755 85.224.39.201 -> 244.3.210.197 TCP 64 40462 > http [ACK] Seq=15536 Ack=431861 Win=62780 Len=0
94407  35.817259 85.224.39.201 -> 244.3.210.197 TCP 64 40462 > http [ACK] Seq=15536 Ack=434781 Win=62780 Len=0
94414  35.819073 85.224.39.201 -> 244.3.210.197 TCP 64 40462 > http [ACK] Seq=15536 Ack=437701 Win=62780 Len=0
94421  35.819664 85.224.39.201 -> 244.3.210.197 TCP 64 40462 > http [ACK] Seq=15536 Ack=440621 Win=62780 Len=0
94430  35.820574 85.224.39.201 -> 244.3.210.197 TCP 64 40462 > http [ACK] Seq=15536 Ack=443541 Win=62780 Len=0
94438  35.821485 85.224.39.201 -> 244.3.210.197 TCP 64 40462 > http [ACK] Seq=15536 Ack=446461 Win=62780 Len=0
94439  35.821490 85.224.39.201 -> 244.3.210.197 TCP 64 40462 > http [ACK] Seq=15536 Ack=449381 Win=62780 Len=0
94456  35.821867 85.224.39.201 -> 244.3.210.197 TCP 64 40462 > http [ACK] Seq=15536 Ack=452301 Win=62780 Len=0
94462  35.822499 85.224.39.201 -> 244.3.210.197 TCP 64 40462 > http [ACK] Seq=15536 Ack=455221 Win=62780 Len=0
94554  35.851874 85.224.39.201 -> 244.3.210.197 TCP 64 40462 > http [ACK] Seq=15536 Ack=458141 Win=62780 Len=0
94555  35.851878 85.224.39.201 -> 244.3.210.197 TCP 64 40462 > http [ACK] Seq=15536 Ack=461061 Win=62780 Len=0
94573  35.855021 85.224.39.201 -> 244.3.210.197 TCP 64 40462 > http [ACK] Seq=15536 Ack=475661 Win=52560 Len=0
94581  35.855896 85.224.39.201 -> 244.3.210.197 TCP 64 40462 > http [ACK] Seq=15536 Ack=480041 Win=52560 Len=0
94603  35.857661 85.224.39.201 -> 244.3.210.197 TCP 64 40462 > http [ACK] Seq=15536 Ack=482961 Win=54020 Len=0
94772  35.902322 85.224.39.201 -> 244.3.210.197 TCP 64 40462 > http [ACK] Seq=15536 Ack=482966 Win=62780 Len=0
94950  35.949737 85.224.39.201 -> 244.3.210.197 TCP 64 40499 > http [ACK] Seq=19161 Ack=267424 Win=65700 Len=0
95204  36.012993 85.224.39.201 -> 244.3.210.197 TCP 64 40499 > http [ACK] Seq=20088 Ack=270344 Win=65700 Len=0
95210  36.013216 85.224.39.201 -> 244.3.210.197 TCP 64 40499 > http [ACK] Seq=20088 Ack=273264 Win=65700 Len=0
95223  36.014693 85.224.39.201 -> 244.3.210.197 TCP 64 40499 > http [ACK] Seq=20088 Ack=276184 Win=65700 Len=0
95229  36.014911 85.224.39.201 -> 244.3.210.197 TCP 64 40499 > http [ACK] Seq=20088 Ack=279104 Win=65700 Len=0
95235  36.016077 85.224.39.201 -> 244.3.210.197 TCP 64 40499 > http [ACK] Seq=20088 Ack=282024 Win=65700 Len=0
95241  36.016541 85.224.39.201 -> 244.3.210.197 TCP 64 40499 > http [ACK] Seq=20088 Ack=284944 Win=65700 Len=0
95247  36.017096 85.224.39.201 -> 244.3.210.197 TCP 64 40499 > http [ACK] Seq=20088 Ack=287864 Win=65700 Len=0
95253  36.017288 85.224.39.201 -> 244.3.210.197 TCP 64 40499 > http [ACK] Seq=20088 Ack=290784 Win=65700 Len=0
95259  36.017735 85.224.39.201 -> 244.3.210.197 TCP 64 40499 > http [ACK] Seq=20088 Ack=293704 Win=65700 Len=0
95276  36.020802 85.224.39.201 -> 244.3.210.197 TCP 64 40499 > http [ACK] Seq=20088 Ack=296624 Win=65700 Len=0
95277  36.020806 85.224.39.201 -> 244.3.210.197 TCP 64 40499 > http [ACK] Seq=20088 Ack=299544 Win=65700 Len=0
95278  36.020810 85.224.39.201 -> 244.3.210.197 TCP 64 40499 > http [ACK] Seq=20088 Ack=302464 Win=65700 Len=0
95279  36.020827 85.224.39.201 -> 244.3.210.197 TCP 64 40499 > http [ACK] Seq=20088 Ack=305567 Win=65700 Len=0
95343  36.024143 85.224.39.201 -> 244.3.210.197 TCP 64 40462 > http [ACK] Seq=16463 Ack=485886 Win=62780 Len=0
95349  36.024330 85.224.39.201 -> 244.3.210.197 TCP 64 40462 > http [ACK] Seq=16463 Ack=487870 Win=62780 Len=0
95562  36.065441 85.224.39.201 -> 244.3.210.197 TCP 64 40499 > http [ACK] Seq=21016 Ack=308487 Win=65700 Len=0
95568  36.066135 85.224.39.201 -> 244.3.210.197 TCP 64 40499 > http [ACK] Seq=21016 Ack=311407 Win=65700 Len=0
95575  36.068072 85.224.39.201 -> 244.3.210.197 TCP 64 40499 > http [ACK] Seq=21016 Ack=314327 Win=65700 Len=0
95581  36.069103 85.224.39.201 -> 244.3.210.197 TCP 64 40499 > http [ACK] Seq=21016 Ack=317247 Win=65700 Len=0
95587  36.069346 85.224.39.201 -> 244.3.210.197 TCP 64 40499 > http [ACK] Seq=21016 Ack=320167 Win=65700 Len=0
95596  36.070353 85.224.39.201 -> 244.3.210.197 TCP 64 40499 > http [ACK] Seq=21016 Ack=323087 Win=65700 Len=0
95608  36.071762 85.224.39.201 -> 244.3.210.197 TCP 64 40499 > http [ACK] Seq=21016 Ack=326007 Win=65700 Len=0
95614  36.072175 85.224.39.201 -> 244.3.210.197 TCP 64 40499 > http [ACK] Seq=21016 Ack=328927 Win=65700 Len=0
95615  36.072180 85.224.39.201 -> 244.3.210.197 TCP 64 40499 > http [ACK] Seq=21016 Ack=331847 Win=65700 Len=0
95632  36.073090 85.224.39.201 -> 244.3.210.197 TCP 64 40499 > http [ACK] Seq=21016 Ack=334767 Win=65700 Len=0
95638  36.073512 85.224.39.201 -> 244.3.210.197 TCP 64 40499 > http [ACK] Seq=21016 Ack=336479 Win=65700 Len=0
95822  36.120232 85.224.39.201 -> 244.3.210.197 TCP 64 40499 > http [ACK] Seq=21944 Ack=339399 Win=65700 Len=0
95872  36.123364 85.224.39.201 -> 244.3.210.197 TCP 64 40499 > http [ACK] Seq=21944 Ack=342319 Win=65700 Len=0
95873  36.123391 85.224.39.201 -> 244.3.210.197 TCP 64 40499 > http [ACK] Seq=21944 Ack=345239 Win=65700 Len=0
95874  36.123396 85.224.39.201 -> 244.3.210.197 TCP 64 40499 > http [ACK] Seq=21944 Ack=348159 Win=65276 Len=0
95887  36.123600 85.224.39.201 -> 244.3.210.197 TCP 64 40499 > http [ACK] Seq=21944 Ack=351079 Win=65700 Len=0
95888  36.123604 85.224.39.201 -> 244.3.210.197 TCP 64 40499 > http [ACK] Seq=21944 Ack=353999 Win=65700 Len=0
95889  36.123608 85.224.39.201 -> 244.3.210.197 TCP 64 40499 > http [ACK] Seq=21944 Ack=356919 Win=65700 Len=0
95890  36.123613 85.224.39.201 -> 244.3.210.197 TCP 64 40499 > http [ACK] Seq=21944 Ack=359839 Win=65700 Len=0
95891  36.123617 85.224.39.201 -> 244.3.210.197 TCP 64 40499 > http [ACK] Seq=21944 Ack=362759 Win=65700 Len=0
95895  36.123832 85.224.39.201 -> 244.3.210.197 TCP 64 40499 > http [ACK] Seq=21944 Ack=365726 Win=65700 Len=0
96138  36.167720 85.224.39.201 -> 244.3.210.197 TCP 64 40499 > http [ACK] Seq=22870 Ack=368646 Win=65700 Len=0
96139  36.167724 85.224.39.201 -> 244.3.210.197 TCP 64 40499 > http [ACK] Seq=22870 Ack=371566 Win=65700 Len=0
96140  36.167756 85.224.39.201 -> 244.3.210.197 TCP 64 40499 > http [ACK] Seq=22870 Ack=374486 Win=65700 Len=0
96157  36.168379 85.224.39.201 -> 244.3.210.197 TCP 64 40499 > http [ACK] Seq=22870 Ack=376395 Win=65700 Len=0
96721  36.343170 85.224.39.201 -> 244.3.210.197 TCP 64 40499 > http [ACK] Seq=23811 Ack=379315 Win=65700 Len=0
96722  36.343175 85.224.39.201 -> 244.3.210.197 TCP 64 40499 > http [ACK] Seq=23811 Ack=381148 Win=65700 Len=0
96904  36.406176 85.224.39.201 -> 244.3.210.197 TCP 64 40499 > http [ACK] Seq=24730 Ack=383458 Win=65700 Len=0
96935  36.412905 85.224.39.201 -> 244.3.210.197 TCP 64 40462 > http [ACK] Seq=17392 Ack=489330 Win=62780 Len=0
96936  36.412910 85.224.39.201 -> 244.3.210.197 TCP 64 40462 > http [ACK] Seq=17392 Ack=490568 Win=62780 Len=0
97045  36.453743 85.224.39.201 -> 244.3.210.197 TCP 64 40499 > http [ACK] Seq=25661 Ack=386378 Win=65700 Len=0
97046  36.453748 85.224.39.201 -> 244.3.210.197 TCP 64 40499 > http [ACK] Seq=25661 Ack=389298 Win=65700 Len=0
97047  36.453752 85.224.39.201 -> 244.3.210.197 TCP 64 40499 > http [ACK] Seq=25661 Ack=392218 Win=65700 Len=0
97048  36.453764 85.224.39.201 -> 244.3.210.197 TCP 64 40499 > http [ACK] Seq=25661 Ack=394533 Win=65700 Len=0
97775  36.563289 85.224.39.201 -> 244.3.210.197 TCP 64 40462 > http [ACK] Seq=18321 Ack=492028 Win=62780 Len=0
97782  36.563557 85.224.39.201 -> 244.3.210.197 TCP 64 40462 > http [ACK] Seq=18321 Ack=493488 Win=62780 Len=0
97793  36.564198 85.224.39.201 -> 244.3.210.197 TCP 64 40462 > http [ACK] Seq=18321 Ack=494948 Win=62780 Len=0
97807  36.564697 85.224.39.201 -> 244.3.210.197 TCP 64 40462 > http [ACK] Seq=18321 Ack=496408 Win=62780 Len=0
97823  36.565340 85.224.39.201 -> 244.3.210.197 TCP 64 40462 > http [ACK] Seq=18321 Ack=497868 Win=62780 Len=0
97845  36.566152 85.224.39.201 -> 244.3.210.197 TCP 64 40462 > http [ACK] Seq=18321 Ack=499328 Win=62780 Len=0
97861  36.566367 85.224.39.201 -> 244.3.210.197 TCP 64 40462 > http [ACK] Seq=18321 Ack=500321 Win=62780 Len=0
98159  36.645211 85.224.39.201 -> 244.3.210.197 TCP 64 40499 > http [ACK] Seq=26586 Ack=397453 Win=65700 Len=0
98160  36.645216 85.224.39.201 -> 244.3.210.197 TCP 64 40499 > http [ACK] Seq=26586 Ack=400373 Win=65700 Len=0
98161  36.645220 85.224.39.201 -> 244.3.210.197 TCP 64 40499 > http [ACK] Seq=26586 Ack=403293 Win=65700 Len=0
98408  36.722434 85.224.39.201 -> 244.3.210.197 TCP 64 40462 > http [ACK] Seq=19247 Ack=501781 Win=62780 Len=0
98409  36.722438 85.224.39.201 -> 244.3.210.197 TCP 64 40462 > http [ACK] Seq=19247 Ack=503241 Win=62780 Len=0
98410  36.722443 85.224.39.201 -> 244.3.210.197 TCP 64 40462 > http [ACK] Seq=19247 Ack=503879 Win=62780 Len=0
98677  36.784035 85.224.39.201 -> 244.3.210.197 TCP 64 40499 > http [ACK] Seq=27516 Ack=406639 Win=65700 Len=0
98917  36.853564 85.224.39.201 -> 244.3.210.197 TCP 64 40462 > http [ACK] Seq=20171 Ack=505339 Win=62780 Len=0
98924  36.854518 85.224.39.201 -> 244.3.210.197 TCP 64 40462 > http [ACK] Seq=20171 Ack=508259 Win=62780 Len=0
98932  36.855344 85.224.39.201 -> 244.3.210.197 TCP 64 40462 > http [ACK] Seq=20171 Ack=511179 Win=62780 Len=0
98945  36.856333 85.224.39.201 -> 244.3.210.197 TCP 64 40462 > http [ACK] Seq=20171 Ack=514099 Win=62780 Len=0
98951  36.856837 85.224.39.201 -> 244.3.210.197 TCP 64 40462 > http [ACK] Seq=20171 Ack=514658 Win=62780 Len=0
99398  36.928190 85.224.39.201 -> 244.3.210.197 TCP 64 40499 > http [ACK] Seq=28443 Ack=410989 Win=65700 Len=0
99403  36.928373 85.224.39.201 -> 244.3.210.197 TCP 64 40499 > http [ACK] Seq=28443 Ack=413909 Win=65700 Len=0
99404  36.928378 85.224.39.201 -> 244.3.210.197 TCP 64 40499 > http [ACK] Seq=28443 Ack=416829 Win=65700 Len=0
99405  36.928382 85.224.39.201 -> 244.3.210.197 TCP 64 40499 > http [ACK] Seq=28443 Ack=419749 Win=65276 Len=0
99407  36.928389 85.224.39.201 -> 244.3.210.197 TCP 64 40499 > http [ACK] Seq=28443 Ack=421209 Win=65700 Len=0
99408  36.928394 85.224.39.201 -> 244.3.210.197 TCP 64 40499 > http [ACK] Seq=28443 Ack=424129 Win=65700 Len=0
99415  36.928648 85.224.39.201 -> 244.3.210.197 TCP 64 40499 > http [ACK] Seq=28443 Ack=427049 Win=65700 Len=0
99416  36.928652 85.224.39.201 -> 244.3.210.197 TCP 64 40499 > http [ACK] Seq=28443 Ack=429969 Win=65700 Len=0
99417  36.928656 85.224.39.201 -> 244.3.210.197 TCP 64 40499 > http [ACK] Seq=28443 Ack=432889 Win=65700 Len=0
99418  36.928660 85.224.39.201 -> 244.3.210.197 TCP 64 40499 > http [ACK] Seq=28443 Ack=435809 Win=65700 Len=0
99419  36.928664 85.224.39.201 -> 244.3.210.197 TCP 64 40499 > http [ACK] Seq=28443 Ack=438729 Win=65700 Len=0
99420  36.928668 85.224.39.201 -> 244.3.210.197 TCP 64 40499 > http [ACK] Seq=28443 Ack=441649 Win=65700 Len=0
99421  36.928672 85.224.39.201 -> 244.3.210.197 TCP 64 40499 > http [ACK] Seq=28443 Ack=444569 Win=65700 Len=0
99422  36.928677 85.224.39.201 -> 244.3.210.197 TCP 64 40499 > http [ACK] Seq=28443 Ack=446212 Win=65700 Len=0
100115  37.029886 85.224.39.201 -> 244.3.210.197 TCP 64 40462 > http [ACK] Seq=21097 Ack=517578 Win=62780 Len=0
100130  37.031255 85.224.39.201 -> 244.3.210.197 TCP 64 40462 > http [ACK] Seq=21097 Ack=520498 Win=62780 Len=0
100138  37.032460 85.224.39.201 -> 244.3.210.197 TCP 64 40462 > http [ACK] Seq=21097 Ack=523418 Win=62780 Len=0
100151  37.033810 85.224.39.201 -> 244.3.210.197 TCP 64 40462 > http [ACK] Seq=21097 Ack=526338 Win=62780 Len=0
100157  37.035031 85.224.39.201 -> 244.3.210.197 TCP 64 40462 > http [ACK] Seq=21097 Ack=529258 Win=62780 Len=0
100171  37.036018 85.224.39.201 -> 244.3.210.197 TCP 64 40462 > http [ACK] Seq=21097 Ack=532178 Win=62780 Len=0
100179  37.036698 85.224.39.201 -> 244.3.210.197 TCP 64 40462 > http [ACK] Seq=21097 Ack=535098 Win=62780 Len=0
100185  37.037130 85.224.39.201 -> 244.3.210.197 TCP 64 40462 > http [ACK] Seq=21097 Ack=538018 Win=62780 Len=0
100198  37.037911 85.224.39.201 -> 244.3.210.197 TCP 64 40462 > http [ACK] Seq=21097 Ack=540938 Win=62780 Len=0
100208  37.038676 85.224.39.201 -> 244.3.210.197 TCP 64 40462 > http [ACK] Seq=21097 Ack=543858 Win=62780 Len=0
100214  37.039406 85.224.39.201 -> 244.3.210.197 TCP 64 40462 > http [ACK] Seq=21097 Ack=546778 Win=62780 Len=0
100228  37.039904 85.224.39.201 -> 244.3.210.197 TCP 64 40462 > http [ACK] Seq=21097 Ack=549698 Win=62780 Len=0
100239  37.040413 85.224.39.201 -> 244.3.210.197 TCP 64 40462 > http [ACK] Seq=21097 Ack=552618 Win=62780 Len=0
100246  37.041679 85.224.39.201 -> 244.3.210.197 TCP 64 40462 > http [ACK] Seq=21097 Ack=555538 Win=62780 Len=0
100256  37.041943 85.224.39.201 -> 244.3.210.197 TCP 64 40462 > http [ACK] Seq=21097 Ack=558458 Win=62780 Len=0
100277  37.046899 85.224.39.201 -> 244.3.210.197 TCP 64 40462 > http [ACK] Seq=21097 Ack=577438 Win=46720 Len=0
100516  37.108719 85.224.39.201 -> 244.3.210.197 TCP 64 40462 > http [ACK] Seq=21097 Ack=579248 Win=62780 Len=0
100800  37.177298 85.224.39.201 -> 244.3.210.197 TCP 64 40499 > http [ACK] Seq=29377 Ack=449132 Win=65700 Len=0
100815  37.178018 85.224.39.201 -> 244.3.210.197 TCP 64 40499 > http [ACK] Seq=29377 Ack=452052 Win=65700 Len=0
101188  37.254436 85.224.39.201 -> 244.3.210.197 TCP 64 40462 > http [ACK] Seq=22027 Ack=582168 Win=62780 Len=0
101194  37.256054 85.224.39.201 -> 244.3.210.197 TCP 64 40462 > http [ACK] Seq=22027 Ack=582705 Win=62780 Len=0
101605  37.318711 85.224.39.201 -> 244.3.210.197 TCP 64 40499 > http [ACK] Seq=30300 Ack=454995 Win=65700 Len=0
101606  37.318716 85.224.39.201 -> 244.3.210.197 TCP 64 40499 > http [ACK] Seq=30300 Ack=457915 Win=65700 Len=0
101607  37.318720 85.224.39.201 -> 244.3.210.197 TCP 64 40499 > http [ACK] Seq=30300 Ack=460835 Win=65700 Len=0
101624  37.319455 85.224.39.201 -> 244.3.210.197 TCP 64 40499 > http [ACK] Seq=30300 Ack=463408 Win=65620 Len=0
102002  37.391980 85.224.39.201 -> 244.3.210.197 TCP 64 40462 > http [ACK] Seq=22974 Ack=585625 Win=62780 Len=0
102009  37.392872 85.224.39.201 -> 244.3.210.197 TCP 64 40462 > http [ACK] Seq=22974 Ack=588545 Win=62780 Len=0
102021  37.394706 85.224.39.201 -> 244.3.210.197 TCP 64 40462 > http [ACK] Seq=22974 Ack=591465 Win=62780 Len=0
102032  37.395154 85.224.39.201 -> 244.3.210.197 TCP 64 40462 > http [ACK] Seq=22974 Ack=594385 Win=62780 Len=0
102041  37.396303 85.224.39.201 -> 244.3.210.197 TCP 64 40462 > http [ACK] Seq=22974 Ack=597305 Win=62780 Len=0
102054  37.397020 85.224.39.201 -> 244.3.210.197 TCP 64 40462 > http [ACK] Seq=22974 Ack=600225 Win=62780 Len=0
102063  37.397459 85.224.39.201 -> 244.3.210.197 TCP 64 40462 > http [ACK] Seq=22974 Ack=603145 Win=62780 Len=0
102071  37.397890 85.224.39.201 -> 244.3.210.197 TCP 64 40462 > http [ACK] Seq=22974 Ack=606065 Win=62780 Len=0
102078  37.398164 85.224.39.201 -> 244.3.210.197 TCP 64 40462 > http [ACK] Seq=22974 Ack=608985 Win=62780 Len=0
102086  37.398631 85.224.39.201 -> 244.3.210.197 TCP 64 40462 > http [ACK] Seq=22974 Ack=611905 Win=62780 Len=0
102087  37.398636 85.224.39.201 -> 244.3.210.197 TCP 64 40462 > http [ACK] Seq=22974 Ack=612202 Win=62780 Len=0
102543  37.466526 85.224.39.201 -> 244.3.210.197 TCP 64 40462 > http [ACK] Seq=24069 Ack=615122 Win=62780 Len=0
102768  37.505907 85.224.39.201 -> 244.3.210.197 TCP 64 40462 > http [ACK] Seq=24069 Ack=615232 Win=62780 Len=0
103610  37.636156 85.224.39.201 -> 244.3.210.197 TCP 64 40499 > http [ACK] Seq=32164 Ack=464331 Win=64700 Len=0
396741 133.082444 85.224.39.201 -> 244.3.210.197 TCP 64 40499 > http [RST, ACK] Seq=32164 Ack=464331 Win=0 Len=0
396747 133.082650 85.224.39.201 -> 244.3.210.197 TCP 64 40462 > http [FIN, ACK] Seq=24069 Ack=615232 Win=62780 Len=0
396803 133.122671 85.224.39.201 -> 244.3.210.197 TCP 64 40462 > http [ACK] Seq=24070 Ack=615233 Win=62780 Len=0
