910906 301.292730 89.197.47.247 -> 244.3.210.197 TCP 82 19555 > http [SYN] Seq=0 Win=65535 Len=0 MSS=1360 WS=4 TSval=840766946 TSecr=0 SACK_PERM=1
910936 301.308821 89.197.47.247 -> 244.3.210.197 TCP 82 19556 > http [SYN] Seq=0 Win=65535 Len=0 MSS=1360 WS=4 TSval=840766947 TSecr=0 SACK_PERM=1
911210 301.429486 89.197.47.247 -> 244.3.210.197 TCP 82 19557 > http [SYN] Seq=0 Win=65535 Len=0 MSS=1360 WS=4 TSval=840766948 TSecr=0 SACK_PERM=1
911409 301.509261 89.197.47.247 -> 244.3.210.197 TCP 82 19559 > http [SYN] Seq=0 Win=65535 Len=0 MSS=1360 WS=4 TSval=840766948 TSecr=0 SACK_PERM=1
911593 301.576268 89.197.47.247 -> 244.3.210.197 TCP 82 19561 > http [SYN] Seq=0 Win=65535 Len=0 MSS=1360 WS=4 TSval=840766949 TSecr=0 SACK_PERM=1
912266 301.857222 89.197.47.247 -> 244.3.210.197 TCP 70 19555 > http [ACK] Seq=1 Ack=1 Win=132104 Len=0 TSval=840766950 TSecr=0
912438 301.958134 89.197.47.247 -> 244.3.210.197 TCP 70 19556 > http [ACK] Seq=1 Ack=1 Win=132104 Len=0 TSval=840766951 TSecr=0
912444 301.959086 89.197.47.247 -> 244.3.210.197 TCP 70 19557 > http [ACK] Seq=1 Ack=1 Win=132104 Len=0 TSval=840766952 TSecr=0
912451 301.959532 89.197.47.247 -> 244.3.210.197 TCP 70 19561 > http [ACK] Seq=1 Ack=1 Win=132104 Len=0 TSval=840766953 TSecr=0
912454 301.959681 89.197.47.247 -> 244.3.210.197 TCP 70 19559 > http [ACK] Seq=1 Ack=1 Win=132104 Len=0 TSval=840766952 TSecr=0
912839 302.209855 89.197.47.247 -> 244.3.210.197 TCP 70 19559 > http [FIN, ACK] Seq=1 Ack=1 Win=132104 Len=0 TSval=840766954 TSecr=0
912844 302.209969 89.197.47.247 -> 244.3.210.197 TCP 70 19557 > http [FIN, ACK] Seq=393 Ack=1 Win=132104 Len=0 TSval=840766954 TSecr=0
913183 302.409436 89.197.47.247 -> 244.3.210.197 TCP 70 19555 > http [ACK] Seq=288 Ack=342 Win=131760 Len=0 TSval=840766957 TSecr=150407032
914117 302.775869 89.197.47.247 -> 244.3.210.197 TCP 70 [TCP Retransmission] 19557 > http [FIN, ACK] Seq=393 Ack=1 Win=132104 Len=0 TSval=840766958 TSecr=150407034
914119 302.776212 89.197.47.247 -> 244.3.210.197 TCP 70 [TCP Dup ACK 912839#1] 19559 > http [ACK] Seq=2 Ack=1 Win=132104 Len=0 TSval=840766959 TSecr=150407034
914121 302.776792 89.197.47.247 -> 244.3.210.197 TCP 70 19561 > http [FIN, ACK] Seq=1 Ack=1 Win=132104 Len=0 TSval=840766959 TSecr=0
914124 302.777519 89.197.47.247 -> 244.3.210.197 TCP 70 19555 > http [FIN, ACK] Seq=288 Ack=342 Win=132104 Len=0 TSval=840766959 TSecr=150407032
914144 302.777879 89.197.47.247 -> 244.3.210.197 TCP 70 [TCP Dup ACK 914117#1] 19557 > http [ACK] Seq=394 Ack=1 Win=132104 Len=0 TSval=840766959 TSecr=150407034
914145 302.777915 89.197.47.247 -> 244.3.210.197 TCP 70 19556 > http [FIN, ACK] Seq=1 Ack=1 Win=132104 Len=0 TSval=840766959 TSecr=0
914155 302.779320 89.197.47.247 -> 244.3.210.197 TCP 64 19557 > http [RST] Seq=394 Win=0 Len=0
914626 302.970191 89.197.47.247 -> 244.3.210.197 TCP 64 19557 > http [RST] Seq=394 Win=0 Len=0
914744 303.092296 89.197.47.247 -> 244.3.210.197 TCP 64 19557 > http [RST] Seq=394 Win=0 Len=0
914869 303.173258 89.197.47.247 -> 244.3.210.197 TCP 70 [TCP Dup ACK 914121#1] 19561 > http [ACK] Seq=2 Ack=1 Win=132104 Len=0 TSval=840766965 TSecr=150407039
914930 303.229127 89.197.47.247 -> 244.3.210.197 TCP 70 [TCP Dup ACK 914124#1] 19555 > http [ACK] Seq=289 Ack=342 Win=132104 Len=0 TSval=840766965 TSecr=150407039
915122 303.369984 89.197.47.247 -> 244.3.210.197 TCP 70 19555 > http [ACK] Seq=289 Ack=343 Win=132104 Len=0 TSval=840766965 TSecr=150407039
915152 303.401518 89.197.47.247 -> 244.3.210.197 TCP 70 [TCP Dup ACK 914145#1] 19556 > http [ACK] Seq=2 Ack=1 Win=132104 Len=0 TSval=840766965 TSecr=150407039
