852816 281.891112 89.47.253.220 -> 244.3.210.197 TCP 82 21129 > http [SYN] Seq=0 Win=65535 Len=0 MSS=1360 WS=4 TSval=847873859 TSecr=0 SACK_PERM=1
853002 281.931391 89.47.253.220 -> 244.3.210.197 TCP 82 21130 > http [SYN] Seq=0 Win=65535 Len=0 MSS=1360 WS=4 TSval=847873860 TSecr=0 SACK_PERM=1
853097 281.971280 89.47.253.220 -> 244.3.210.197 TCP 82 21131 > http [SYN] Seq=0 Win=65535 Len=0 MSS=1360 WS=4 TSval=847873860 TSecr=0 SACK_PERM=1
853284 282.010847 89.47.253.220 -> 244.3.210.197 TCP 82 21132 > http [SYN] Seq=0 Win=65535 Len=0 MSS=1360 WS=4 TSval=847873861 TSecr=0 SACK_PERM=1
853310 282.030939 89.47.253.220 -> 244.3.210.197 TCP 70 21129 > http [ACK] Seq=1 Ack=1 Win=132104 Len=0 TSval=847873861 TSecr=0
853527 282.131181 89.47.253.220 -> 244.3.210.197 TCP 70 21131 > http [ACK] Seq=1 Ack=1 Win=132104 Len=0 TSval=847873862 TSecr=0
853530 282.131246 89.47.253.220 -> 244.3.210.197 TCP 70 21130 > http [ACK] Seq=1 Ack=1 Win=132104 Len=0 TSval=847873861 TSecr=0
853641 282.150780 89.47.253.220 -> 244.3.210.197 TCP 70 21132 > http [ACK] Seq=1 Ack=1 Win=132104 Len=0 TSval=847873862 TSecr=0
854287 282.411179 89.47.253.220 -> 244.3.210.197 TCP 70 21130 > http [ACK] Seq=332 Ack=2697 Win=132104 Len=0 TSval=847873865 TSecr=150406835
854454 282.451510 89.47.253.220 -> 244.3.210.197 TCP 70 21131 > http [ACK] Seq=299 Ack=2697 Win=132104 Len=0 TSval=847873865 TSecr=150406835
854548 282.490827 89.47.253.220 -> 244.3.210.197 TCP 70 21132 > http [ACK] Seq=286 Ack=292 Win=131812 Len=0 TSval=847873866 TSecr=150406836
854767 282.551217 89.47.253.220 -> 244.3.210.197 TCP 70 21129 > http [ACK] Seq=393 Ack=396 Win=131708 Len=0 TSval=847873866 TSecr=150406836
854819 282.571158 89.47.253.220 -> 244.3.210.197 TCP 70 21130 > http [ACK] Seq=332 Ack=4045 Win=130756 Len=0 TSval=847873866 TSecr=150406836
854906 282.591332 89.47.253.220 -> 244.3.210.197 TCP 70 21131 > http [ACK] Seq=299 Ack=3342 Win=131456 Len=0 TSval=847873867 TSecr=150406837
854907 282.591336 89.47.253.220 -> 244.3.210.197 TCP 70 21130 > http [ACK] Seq=332 Ack=5393 Win=132104 Len=0 TSval=847873866 TSecr=150406836
854908 282.591340 89.47.253.220 -> 244.3.210.197 TCP 70 21130 > http [ACK] Seq=332 Ack=6741 Win=130756 Len=0 TSval=847873867 TSecr=150406836
855312 282.731322 89.47.253.220 -> 244.3.210.197 TCP 70 21130 > http [ACK] Seq=332 Ack=8089 Win=132104 Len=0 TSval=847873868 TSecr=150406838
855320 282.731559 89.47.253.220 -> 244.3.210.197 TCP 70 21130 > http [ACK] Seq=332 Ack=9437 Win=130756 Len=0 TSval=847873868 TSecr=150406838
855437 282.750778 89.47.253.220 -> 244.3.210.197 TCP 70 21130 > http [ACK] Seq=332 Ack=10785 Win=132104 Len=0 TSval=847873868 TSecr=150406838
855485 282.771203 89.47.253.220 -> 244.3.210.197 TCP 70 21130 > http [ACK] Seq=332 Ack=13481 Win=132104 Len=0 TSval=847873868 TSecr=150406838
855821 282.891172 89.47.253.220 -> 244.3.210.197 TCP 70 21130 > http [ACK] Seq=332 Ack=16177 Win=132104 Len=0 TSval=847873869 TSecr=150406838
855904 282.911253 89.47.253.220 -> 244.3.210.197 TCP 70 21130 > http [ACK] Seq=332 Ack=18873 Win=132104 Len=0 TSval=847873870 TSecr=150406839
856017 282.930865 89.47.253.220 -> 244.3.210.197 TCP 70 21130 > http [ACK] Seq=332 Ack=21569 Win=130756 Len=0 TSval=847873870 TSecr=150406839
856018 282.930896 89.47.253.220 -> 244.3.210.197 TCP 70 21130 > http [ACK] Seq=332 Ack=21679 Win=131992 Len=0 TSval=847873870 TSecr=150406839
862691 284.691277 89.47.253.220 -> 244.3.210.197 TCP 70 21131 > http [FIN, ACK] Seq=299 Ack=3342 Win=132104 Len=0 TSval=847873887 TSecr=150406837
862692 284.691327 89.47.253.220 -> 244.3.210.197 TCP 70 21132 > http [FIN, ACK] Seq=286 Ack=292 Win=132104 Len=0 TSval=847873888 TSecr=150406836
862704 284.691544 89.47.253.220 -> 244.3.210.197 TCP 70 21130 > http [FIN, ACK] Seq=332 Ack=21679 Win=132104 Len=0 TSval=847873887 TSecr=150406839
862752 284.710675 89.47.253.220 -> 244.3.210.197 TCP 70 21129 > http [FIN, ACK] Seq=393 Ack=396 Win=132104 Len=0 TSval=847873888 TSecr=150406836
862911 284.831316 89.47.253.220 -> 244.3.210.197 TCP 70 [TCP Dup ACK 862692#1] 21132 > http [ACK] Seq=287 Ack=292 Win=132104 Len=0 TSval=847873889 TSecr=150406859
862917 284.831917 89.47.253.220 -> 244.3.210.197 TCP 70 [TCP Dup ACK 862691#1] 21131 > http [ACK] Seq=300 Ack=3342 Win=132104 Len=0 TSval=847873889 TSecr=150406859
862962 284.851451 89.47.253.220 -> 244.3.210.197 TCP 70 21132 > http [ACK] Seq=287 Ack=293 Win=132104 Len=0 TSval=847873889 TSecr=150406859
862966 284.851624 89.47.253.220 -> 244.3.210.197 TCP 70 [TCP Dup ACK 862704#1] 21130 > http [ACK] Seq=333 Ack=21679 Win=132104 Len=0 TSval=847873889 TSecr=150406859
862969 284.851725 89.47.253.220 -> 244.3.210.197 TCP 70 21131 > http [ACK] Seq=300 Ack=3343 Win=132104 Len=0 TSval=847873889 TSecr=150406859
863020 284.870909 89.47.253.220 -> 244.3.210.197 TCP 70 [TCP Dup ACK 862752#1] 21129 > http [ACK] Seq=394 Ack=396 Win=132104 Len=0 TSval=847873889 TSecr=150406859
863021 284.870913 89.47.253.220 -> 244.3.210.197 TCP 70 21129 > http [ACK] Seq=394 Ack=397 Win=132104 Len=0 TSval=847873889 TSecr=150406859
863032 284.871399 89.47.253.220 -> 244.3.210.197 TCP 70 21130 > http [ACK] Seq=333 Ack=21680 Win=132104 Len=0 TSval=847873889 TSecr=150406859
