830985 271.729092 90.103.254.253 -> 41.177.26.46 TCP 66 silhouette > http [SYN] Seq=0 Win=65535 Len=0 MSS=1380
831010 271.739497 90.103.254.253 -> 41.177.26.46 TCP 64 silhouette > http [ACK] Seq=1 Ack=1 Win=65535 Len=0
831155 271.780509 90.103.254.253 -> 41.177.26.46 TCP 64 silhouette > http [ACK] Seq=973 Ack=1985 Win=65535 Len=0
831392 271.816060 90.103.254.253 -> 41.177.26.46 TCP 66 22822 > http [SYN] Seq=0 Win=65535 Len=0 MSS=1380
831424 271.826425 90.103.254.253 -> 41.177.26.46 TCP 64 22822 > http [ACK] Seq=1 Ack=1 Win=65535 Len=0
831602 271.869522 90.103.254.253 -> 41.177.26.46 TCP 64 silhouette > http [ACK] Seq=1754 Ack=4582 Win=65535 Len=0
831603 271.869619 90.103.254.253 -> 41.177.26.46 TCP 64 silhouette > http [ACK] Seq=1754 Ack=7342 Win=65535 Len=0
831649 271.881089 90.103.254.253 -> 41.177.26.46 TCP 64 silhouette > http [ACK] Seq=1754 Ack=10102 Win=65535 Len=0
831650 271.881094 90.103.254.253 -> 41.177.26.46 TCP 64 silhouette > http [ACK] Seq=1754 Ack=11394 Win=64243 Len=0
831651 271.881098 90.103.254.253 -> 41.177.26.46 TCP 64 silhouette > http [ACK] Seq=1754 Ack=14154 Win=65535 Len=0
831652 271.881102 90.103.254.253 -> 41.177.26.46 TCP 64 silhouette > http [ACK] Seq=1754 Ack=15534 Win=65535 Len=0
831685 271.891075 90.103.254.253 -> 41.177.26.46 TCP 64 silhouette > http [ACK] Seq=1754 Ack=18294 Win=65535 Len=0
831690 271.892444 90.103.254.253 -> 41.177.26.46 TCP 64 silhouette > http [ACK] Seq=1754 Ack=19586 Win=64243 Len=0
831693 271.892912 90.103.254.253 -> 41.177.26.46 TCP 64 silhouette > http [ACK] Seq=1754 Ack=22346 Win=65535 Len=0
831694 271.892916 90.103.254.253 -> 41.177.26.46 TCP 64 silhouette > http [ACK] Seq=1754 Ack=23726 Win=65535 Len=0
831695 271.892920 90.103.254.253 -> 41.177.26.46 TCP 64 silhouette > http [ACK] Seq=1754 Ack=26486 Win=62775 Len=0
831696 271.892924 90.103.254.253 -> 41.177.26.46 TCP 64 silhouette > http [ACK] Seq=1754 Ack=29158 Win=60103 Len=0
831697 271.892951 90.103.254.253 -> 41.177.26.46 TCP 64 [TCP Window Update] silhouette > http [ACK] Seq=1754 Ack=29158 Win=65535 Len=0
831725 271.899368 90.103.254.253 -> 41.177.26.46 TCP 64 [TCP Dup ACK 831697#1] silhouette > http [PSH, ACK] Seq=1754 Ack=29158 Win=65535 Len=0
831727 271.899737 90.103.254.253 -> 41.177.26.46 TCP 64 [TCP Dup ACK 831697#2] silhouette > http [PSH, ACK] Seq=1754 Ack=29158 Win=65535 Len=0
831728 271.899742 90.103.254.253 -> 41.177.26.46 TCP 64 [TCP Dup ACK 831697#3] silhouette > http [PSH, ACK] Seq=1754 Ack=29158 Win=65535 Len=0
831732 271.900620 90.103.254.253 -> 41.177.26.46 TCP 64 [TCP Dup ACK 831697#4] silhouette > http [PSH, ACK] Seq=1754 Ack=29158 Win=65535 Len=0
831733 271.900780 90.103.254.253 -> 41.177.26.46 TCP 64 [TCP Dup ACK 831697#5] silhouette > http [PSH, ACK] Seq=1754 Ack=29158 Win=65535 Len=0
831734 271.901163 90.103.254.253 -> 41.177.26.46 TCP 64 [TCP Dup ACK 831697#6] silhouette > http [PSH, ACK] Seq=1754 Ack=29158 Win=65535 Len=0
831735 271.901203 90.103.254.253 -> 41.177.26.46 TCP 64 [TCP Dup ACK 831697#7] silhouette > http [PSH, ACK] Seq=1754 Ack=29158 Win=65535 Len=0
831736 271.901388 90.103.254.253 -> 41.177.26.46 TCP 64 [TCP Dup ACK 831697#8] silhouette > http [PSH, ACK] Seq=1754 Ack=29158 Win=65535 Len=0
831737 271.901459 90.103.254.253 -> 41.177.26.46 TCP 64 [TCP Dup ACK 831697#9] silhouette > http [PSH, ACK] Seq=1754 Ack=29158 Win=65535 Len=0
831740 271.901568 90.103.254.253 -> 41.177.26.46 TCP 64 [TCP Dup ACK 831697#10] silhouette > http [PSH, ACK] Seq=1754 Ack=29158 Win=65535 Len=0
831741 271.901713 90.103.254.253 -> 41.177.26.46 TCP 64 [TCP Dup ACK 831697#11] silhouette > http [PSH, ACK] Seq=1754 Ack=29158 Win=65535 Len=0
831742 271.901814 90.103.254.253 -> 41.177.26.46 TCP 64 [TCP Dup ACK 831697#12] silhouette > http [PSH, ACK] Seq=1754 Ack=29158 Win=65535 Len=0
831744 271.901903 90.103.254.253 -> 41.177.26.46 TCP 64 [TCP Dup ACK 831697#13] silhouette > http [PSH, ACK] Seq=1754 Ack=29158 Win=65535 Len=0
831747 271.902665 90.103.254.253 -> 41.177.26.46 TCP 64 [TCP Dup ACK 831697#14] silhouette > http [PSH, ACK] Seq=1754 Ack=29158 Win=65535 Len=0
831748 271.902670 90.103.254.253 -> 41.177.26.46 TCP 64 [TCP Dup ACK 831697#15] silhouette > http [PSH, ACK] Seq=1754 Ack=29158 Win=65535 Len=0
831749 271.902673 90.103.254.253 -> 41.177.26.46 TCP 64 [TCP Dup ACK 831697#16] silhouette > http [PSH, ACK] Seq=1754 Ack=29158 Win=65535 Len=0
831755 271.908113 90.103.254.253 -> 41.177.26.46 TCP 64 [TCP Dup ACK 831697#17] silhouette > http [PSH, ACK] Seq=1754 Ack=29158 Win=65535 Len=0
831757 271.908332 90.103.254.253 -> 41.177.26.46 TCP 64 [TCP Dup ACK 831697#18] silhouette > http [PSH, ACK] Seq=1754 Ack=29158 Win=65535 Len=0
831767 271.912273 90.103.254.253 -> 41.177.26.46 TCP 64 silhouette > http [ACK] Seq=1754 Ack=31918 Win=65535 Len=0
831768 271.912277 90.103.254.253 -> 41.177.26.46 TCP 64 silhouette > http [ACK] Seq=1754 Ack=33298 Win=65535 Len=0
831769 271.912281 90.103.254.253 -> 41.177.26.46 TCP 64 silhouette > http [ACK] Seq=1754 Ack=35970 Win=65535 Len=0
831774 271.912534 90.103.254.253 -> 41.177.26.46 TCP 64 silhouette > http [ACK] Seq=1754 Ack=37350 Win=65535 Len=0
831775 271.912538 90.103.254.253 -> 41.177.26.46 TCP 64 silhouette > http [ACK] Seq=1754 Ack=40110 Win=65535 Len=0
831776 271.912542 90.103.254.253 -> 41.177.26.46 TCP 64 silhouette > http [ACK] Seq=1754 Ack=41490 Win=65535 Len=0
831777 271.912546 90.103.254.253 -> 41.177.26.46 TCP 64 silhouette > http [ACK] Seq=1754 Ack=44162 Win=65535 Len=0
831778 271.912550 90.103.254.253 -> 41.177.26.46 TCP 64 silhouette > http [ACK] Seq=1754 Ack=45542 Win=65535 Len=0
831779 271.912596 90.103.254.253 -> 41.177.26.46 TCP 64 silhouette > http [ACK] Seq=1754 Ack=48302 Win=65535 Len=0
831780 271.912600 90.103.254.253 -> 41.177.26.46 TCP 64 [TCP Dup ACK 831779#1] silhouette > http [ACK] Seq=1754 Ack=48302 Win=65535 Len=0
831782 271.912731 90.103.254.253 -> 41.177.26.46 TCP 64 [TCP Dup ACK 831779#2] silhouette > http [ACK] Seq=1754 Ack=48302 Win=65535 Len=0
831785 271.912776 90.103.254.253 -> 41.177.26.46 TCP 64 [TCP Dup ACK 831779#3] silhouette > http [ACK] Seq=1754 Ack=48302 Win=65535 Len=0
831789 271.912853 90.103.254.253 -> 41.177.26.46 TCP 64 [TCP Dup ACK 831779#4] silhouette > http [ACK] Seq=1754 Ack=48302 Win=65535 Len=0
831798 271.916388 90.103.254.253 -> 41.177.26.46 TCP 64 [TCP Dup ACK 831779#5] silhouette > http [ACK] Seq=1754 Ack=48302 Win=65535 Len=0
831799 271.916392 90.103.254.253 -> 41.177.26.46 TCP 64 [TCP Dup ACK 831779#6] silhouette > http [ACK] Seq=1754 Ack=48302 Win=65535 Len=0
831800 271.916396 90.103.254.253 -> 41.177.26.46 TCP 64 [TCP Dup ACK 831779#7] silhouette > http [ACK] Seq=1754 Ack=48302 Win=65535 Len=0
831881 271.920102 90.103.254.253 -> 41.177.26.46 TCP 64 [TCP Dup ACK 831779#8] silhouette > http [ACK] Seq=1754 Ack=48302 Win=65535 Len=0
831882 271.920107 90.103.254.253 -> 41.177.26.46 TCP 64 [TCP Dup ACK 831779#9] silhouette > http [ACK] Seq=1754 Ack=48302 Win=65535 Len=0
831899 271.923964 90.103.254.253 -> 41.177.26.46 TCP 64 [TCP Dup ACK 831779#10] silhouette > http [ACK] Seq=1754 Ack=48302 Win=65535 Len=0
831900 271.923968 90.103.254.253 -> 41.177.26.46 TCP 64 [TCP Dup ACK 831779#11] silhouette > http [ACK] Seq=1754 Ack=48302 Win=65535 Len=0
831901 271.923972 90.103.254.253 -> 41.177.26.46 TCP 64 [TCP Dup ACK 831779#12] silhouette > http [ACK] Seq=1754 Ack=48302 Win=65535 Len=0
831905 271.924170 90.103.254.253 -> 41.177.26.46 TCP 64 [TCP Dup ACK 831779#13] silhouette > http [ACK] Seq=1754 Ack=48302 Win=65535 Len=0
831906 271.924226 90.103.254.253 -> 41.177.26.46 TCP 64 [TCP Dup ACK 831779#14] silhouette > http [ACK] Seq=1754 Ack=48302 Win=65535 Len=0
831907 271.924230 90.103.254.253 -> 41.177.26.46 TCP 64 [TCP Dup ACK 831779#15] silhouette > http [ACK] Seq=1754 Ack=48302 Win=65535 Len=0
831908 271.924234 90.103.254.253 -> 41.177.26.46 TCP 64 [TCP Dup ACK 831779#16] silhouette > http [ACK] Seq=1754 Ack=48302 Win=65535 Len=0
831909 271.924238 90.103.254.253 -> 41.177.26.46 TCP 64 [TCP Dup ACK 831779#17] silhouette > http [ACK] Seq=1754 Ack=48302 Win=65535 Len=0
831910 271.924242 90.103.254.253 -> 41.177.26.46 TCP 64 silhouette > http [ACK] Seq=1754 Ack=49682 Win=65535 Len=0
831911 271.924254 90.103.254.253 -> 41.177.26.46 TCP 64 [TCP Dup ACK 831910#1] silhouette > http [ACK] Seq=1754 Ack=49682 Win=65535 Len=0
831921 271.924909 90.103.254.253 -> 41.177.26.46 TCP 64 [TCP Dup ACK 831910#2] silhouette > http [PSH, ACK] Seq=1754 Ack=49682 Win=65535 Len=0
831922 271.924914 90.103.254.253 -> 41.177.26.46 TCP 64 [TCP Dup ACK 831910#3] silhouette > http [PSH, ACK] Seq=1754 Ack=49682 Win=65535 Len=0
831923 271.924918 90.103.254.253 -> 41.177.26.46 TCP 64 [TCP Dup ACK 831910#4] silhouette > http [PSH, ACK] Seq=1754 Ack=49682 Win=65535 Len=0
831924 271.926151 90.103.254.253 -> 41.177.26.46 TCP 64 22822 > http [ACK] Seq=392 Ack=867 Win=64669 Len=0
831936 271.928732 90.103.254.253 -> 41.177.26.46 TCP 64 [TCP Dup ACK 831910#5] silhouette > http [PSH, ACK] Seq=1754 Ack=49682 Win=65535 Len=0
831937 271.928737 90.103.254.253 -> 41.177.26.46 TCP 64 [TCP Dup ACK 831910#6] silhouette > http [PSH, ACK] Seq=1754 Ack=49682 Win=65535 Len=0
831963 271.932348 90.103.254.253 -> 41.177.26.46 TCP 64 [TCP Dup ACK 831910#7] silhouette > http [PSH, ACK] Seq=1754 Ack=49682 Win=65535 Len=0
831964 271.932352 90.103.254.253 -> 41.177.26.46 TCP 64 [TCP Dup ACK 831910#8] silhouette > http [PSH, ACK] Seq=1754 Ack=49682 Win=65535 Len=0
831974 271.932661 90.103.254.253 -> 41.177.26.46 TCP 64 [TCP Dup ACK 831910#9] silhouette > http [PSH, ACK] Seq=1754 Ack=49682 Win=65535 Len=0
831976 271.932695 90.103.254.253 -> 41.177.26.46 TCP 64 [TCP Dup ACK 831910#10] silhouette > http [PSH, ACK] Seq=1754 Ack=49682 Win=65535 Len=0
831977 271.932707 90.103.254.253 -> 41.177.26.46 TCP 64 [TCP Dup ACK 831910#11] silhouette > http [PSH, ACK] Seq=1754 Ack=49682 Win=65535 Len=0
831978 271.932786 90.103.254.253 -> 41.177.26.46 TCP 64 [TCP Dup ACK 831910#12] silhouette > http [PSH, ACK] Seq=1754 Ack=49682 Win=65535 Len=0
831981 271.932852 90.103.254.253 -> 41.177.26.46 TCP 64 [TCP Dup ACK 831910#13] silhouette > http [PSH, ACK] Seq=1754 Ack=49682 Win=65535 Len=0
831982 271.933077 90.103.254.253 -> 41.177.26.46 TCP 64 [TCP Dup ACK 831910#14] silhouette > http [PSH, ACK] Seq=1754 Ack=49682 Win=65535 Len=0
831988 271.936041 90.103.254.253 -> 41.177.26.46 TCP 64 silhouette > http [ACK] Seq=1754 Ack=52354 Win=65535 Len=0
831991 271.947064 90.103.254.253 -> 41.177.26.46 TCP 64 silhouette > http [ACK] Seq=1754 Ack=53734 Win=65535 Len=0
832019 271.958365 90.103.254.253 -> 41.177.26.46 TCP 64 silhouette > http [ACK] Seq=1754 Ack=67446 Win=65535 Len=0
832748 272.383592 90.103.254.253 -> 41.177.26.46 TCP 64 silhouette > http [FIN, ACK] Seq=1754 Ack=67446 Win=65535 Len=0
832776 272.391971 90.103.254.253 -> 41.177.26.46 TCP 64 [TCP Dup ACK 832748#1] silhouette > http [PSH, ACK] Seq=1755 Ack=67446 Win=65535 Len=0
832777 272.394016 90.103.254.253 -> 41.177.26.46 TCP 64 22822 > http [ACK] Seq=1360 Ack=2522 Win=65535 Len=0
832782 272.395215 90.103.254.253 -> 41.177.26.46 TCP 64 22822 > http [ACK] Seq=1360 Ack=5282 Win=65535 Len=0
832790 272.405674 90.103.254.253 -> 41.177.26.46 TCP 64 22822 > http [ACK] Seq=1360 Ack=8042 Win=65535 Len=0
832791 272.405679 90.103.254.253 -> 41.177.26.46 TCP 64 22822 > http [ACK] Seq=1360 Ack=9422 Win=65535 Len=0
832797 272.406884 90.103.254.253 -> 41.177.26.46 TCP 64 22822 > http [ACK] Seq=1360 Ack=12182 Win=65535 Len=0
832798 272.406889 90.103.254.253 -> 41.177.26.46 TCP 64 22822 > http [ACK] Seq=1360 Ack=13562 Win=65535 Len=0
832824 272.417130 90.103.254.253 -> 41.177.26.46 TCP 64 22822 > http [ACK] Seq=1360 Ack=16322 Win=65535 Len=0
832825 272.417154 90.103.254.253 -> 41.177.26.46 TCP 64 22822 > http [ACK] Seq=1360 Ack=17702 Win=65535 Len=0
832831 272.417668 90.103.254.253 -> 41.177.26.46 TCP 64 22822 > http [ACK] Seq=1360 Ack=20462 Win=65535 Len=0
832836 272.418097 90.103.254.253 -> 41.177.26.46 TCP 64 22822 > http [ACK] Seq=1360 Ack=23222 Win=65535 Len=0
832837 272.418101 90.103.254.253 -> 41.177.26.46 TCP 64 22822 > http [ACK] Seq=1360 Ack=24602 Win=65535 Len=0
832840 272.418283 90.103.254.253 -> 41.177.26.46 TCP 64 22822 > http [ACK] Seq=1360 Ack=27362 Win=65535 Len=0
832866 272.428331 90.103.254.253 -> 41.177.26.46 TCP 64 22822 > http [ACK] Seq=1360 Ack=30122 Win=65535 Len=0
832871 272.428577 90.103.254.253 -> 41.177.26.46 TCP 64 22822 > http [ACK] Seq=1360 Ack=31502 Win=65535 Len=0
832872 272.428625 90.103.254.253 -> 41.177.26.46 TCP 64 22822 > http [ACK] Seq=1360 Ack=34262 Win=65535 Len=0
832873 272.428630 90.103.254.253 -> 41.177.26.46 TCP 64 22822 > http [ACK] Seq=1360 Ack=37022 Win=65535 Len=0
832874 272.428634 90.103.254.253 -> 41.177.26.46 TCP 64 22822 > http [ACK] Seq=1360 Ack=38402 Win=65535 Len=0
832876 272.428642 90.103.254.253 -> 41.177.26.46 TCP 64 22822 > http [ACK] Seq=1360 Ack=41162 Win=65535 Len=0
832896 272.429702 90.103.254.253 -> 41.177.26.46 TCP 64 22822 > http [ACK] Seq=1360 Ack=42542 Win=65535 Len=0
832897 272.429808 90.103.254.253 -> 41.177.26.46 TCP 64 22822 > http [ACK] Seq=1360 Ack=45302 Win=65535 Len=0
832898 272.429812 90.103.254.253 -> 41.177.26.46 TCP 64 22822 > http [ACK] Seq=1360 Ack=48062 Win=65535 Len=0
832901 272.429886 90.103.254.253 -> 41.177.26.46 TCP 64 22822 > http [ACK] Seq=1360 Ack=49442 Win=65535 Len=0
832948 272.438744 90.103.254.253 -> 41.177.26.46 TCP 64 [TCP Dup ACK 832901#1] 22822 > http [PSH, ACK] Seq=1360 Ack=49442 Win=65535 Len=0
832949 272.438749 90.103.254.253 -> 41.177.26.46 TCP 64 [TCP Dup ACK 832901#2] 22822 > http [PSH, ACK] Seq=1360 Ack=49442 Win=65535 Len=0
832952 272.439013 90.103.254.253 -> 41.177.26.46 TCP 64 [TCP Dup ACK 832901#3] 22822 > http [PSH, ACK] Seq=1360 Ack=49442 Win=65535 Len=0
832953 272.439018 90.103.254.253 -> 41.177.26.46 TCP 64 [TCP Dup ACK 832901#4] 22822 > http [PSH, ACK] Seq=1360 Ack=49442 Win=65535 Len=0
832954 272.439022 90.103.254.253 -> 41.177.26.46 TCP 64 [TCP Dup ACK 832901#5] 22822 > http [PSH, ACK] Seq=1360 Ack=49442 Win=65535 Len=0
832955 272.439094 90.103.254.253 -> 41.177.26.46 TCP 64 [TCP Dup ACK 832901#6] 22822 > http [PSH, ACK] Seq=1360 Ack=49442 Win=65535 Len=0
832957 272.439161 90.103.254.253 -> 41.177.26.46 TCP 64 [TCP Dup ACK 832901#7] 22822 > http [PSH, ACK] Seq=1360 Ack=49442 Win=65535 Len=0
832958 272.439527 90.103.254.253 -> 41.177.26.46 TCP 64 22822 > http [ACK] Seq=1360 Ack=52202 Win=65535 Len=0
832959 272.439532 90.103.254.253 -> 41.177.26.46 TCP 64 22822 > http [ACK] Seq=1360 Ack=53582 Win=65535 Len=0
832960 272.439569 90.103.254.253 -> 41.177.26.46 TCP 64 22822 > http [ACK] Seq=1360 Ack=56342 Win=65535 Len=0
832961 272.439611 90.103.254.253 -> 41.177.26.46 TCP 64 22822 > http [ACK] Seq=1360 Ack=59102 Win=65535 Len=0
832962 272.439616 90.103.254.253 -> 41.177.26.46 TCP 64 22822 > http [ACK] Seq=1360 Ack=60482 Win=65535 Len=0
832974 272.440756 90.103.254.253 -> 41.177.26.46 TCP 64 22822 > http [ACK] Seq=1360 Ack=63242 Win=65535 Len=0
832981 272.446939 90.103.254.253 -> 41.177.26.46 TCP 64 [TCP Dup ACK 832974#1] 22822 > http [PSH, ACK] Seq=1360 Ack=63242 Win=65535 Len=0
832982 272.447045 90.103.254.253 -> 41.177.26.46 TCP 64 [TCP Dup ACK 832974#2] 22822 > http [PSH, ACK] Seq=1360 Ack=63242 Win=65535 Len=0
832994 272.449870 90.103.254.253 -> 41.177.26.46 TCP 64 [TCP Dup ACK 832974#3] 22822 > http [ACK] Seq=1360 Ack=63242 Win=65535 Len=0
832995 272.449875 90.103.254.253 -> 41.177.26.46 TCP 64 [TCP Dup ACK 832974#4] 22822 > http [ACK] Seq=1360 Ack=63242 Win=65535 Len=0
832996 272.449975 90.103.254.253 -> 41.177.26.46 TCP 64 [TCP Dup ACK 832974#5] 22822 > http [ACK] Seq=1360 Ack=63242 Win=65535 Len=0
832997 272.449981 90.103.254.253 -> 41.177.26.46 TCP 64 [TCP Dup ACK 832974#6] 22822 > http [ACK] Seq=1360 Ack=63242 Win=65535 Len=0
832998 272.449985 90.103.254.253 -> 41.177.26.46 TCP 64 [TCP Dup ACK 832974#7] 22822 > http [ACK] Seq=1360 Ack=63242 Win=65535 Len=0
833005 272.451150 90.103.254.253 -> 41.177.26.46 TCP 64 [TCP Dup ACK 832974#8] 22822 > http [ACK] Seq=1360 Ack=63242 Win=65535 Len=0
833006 272.451209 90.103.254.253 -> 41.177.26.46 TCP 64 22822 > http [ACK] Seq=1360 Ack=64622 Win=64155 Len=0
833043 272.455910 90.103.254.253 -> 41.177.26.46 TCP 64 [TCP Dup ACK 833006#1] 22822 > http [PSH, ACK] Seq=1360 Ack=64622 Win=64155 Len=0
833049 272.458188 90.103.254.253 -> 41.177.26.46 TCP 64 [TCP Dup ACK 833006#2] 22822 > http [PSH, ACK] Seq=1360 Ack=64622 Win=64155 Len=0
833050 272.458207 90.103.254.253 -> 41.177.26.46 TCP 64 [TCP Dup ACK 833006#3] 22822 > http [PSH, ACK] Seq=1360 Ack=64622 Win=64155 Len=0
833051 272.458330 90.103.254.253 -> 41.177.26.46 TCP 64 [TCP Dup ACK 833006#4] 22822 > http [PSH, ACK] Seq=1360 Ack=64622 Win=64155 Len=0
833052 272.458445 90.103.254.253 -> 41.177.26.46 TCP 64 [TCP Dup ACK 833006#5] 22822 > http [PSH, ACK] Seq=1360 Ack=64622 Win=64155 Len=0
833055 272.458625 90.103.254.253 -> 41.177.26.46 TCP 64 [TCP Dup ACK 833006#6] 22822 > http [PSH, ACK] Seq=1360 Ack=64622 Win=64155 Len=0
833058 272.459429 90.103.254.253 -> 41.177.26.46 TCP 64 [TCP Dup ACK 833006#7] 22822 > http [PSH, ACK] Seq=1360 Ack=64622 Win=64155 Len=0
833149 272.489411 90.103.254.253 -> 41.177.26.46 TCP 64 22822 > http [ACK] Seq=1360 Ack=66002 Win=65535 Len=0
833440 272.629501 90.103.254.253 -> 41.177.26.46 TCP 64 22822 > http [ACK] Seq=1360 Ack=67382 Win=65535 Len=0
833455 272.641629 90.103.254.253 -> 41.177.26.46 TCP 64 22822 > http [ACK] Seq=1360 Ack=70142 Win=65535 Len=0
833470 272.652743 90.103.254.253 -> 41.177.26.46 TCP 64 22822 > http [ACK] Seq=1360 Ack=72902 Win=65535 Len=0
833471 272.652748 90.103.254.253 -> 41.177.26.46 TCP 64 22822 > http [ACK] Seq=1360 Ack=74282 Win=65535 Len=0
833474 272.652958 90.103.254.253 -> 41.177.26.46 TCP 64 22822 > http [ACK] Seq=1360 Ack=77042 Win=65535 Len=0
833475 272.652962 90.103.254.253 -> 41.177.26.46 TCP 64 22822 > http [ACK] Seq=1360 Ack=78422 Win=65535 Len=0
833536 272.661778 90.103.254.253 -> 41.177.26.46 TCP 64 [TCP Dup ACK 833475#1] 22822 > http [PSH, ACK] Seq=1360 Ack=78422 Win=65535 Len=0
833537 272.661782 90.103.254.253 -> 41.177.26.46 TCP 64 [TCP Dup ACK 833475#2] 22822 > http [PSH, ACK] Seq=1360 Ack=78422 Win=65535 Len=0
833538 272.661848 90.103.254.253 -> 41.177.26.46 TCP 64 [TCP Dup ACK 833475#3] 22822 > http [PSH, ACK] Seq=1360 Ack=78422 Win=65535 Len=0
833542 272.662801 90.103.254.253 -> 41.177.26.46 TCP 64 [TCP Dup ACK 833475#4] 22822 > http [ACK] Seq=1360 Ack=78422 Win=65535 Len=0
833544 272.663902 90.103.254.253 -> 41.177.26.46 TCP 64 [TCP Dup ACK 833475#5] 22822 > http [ACK] Seq=1360 Ack=78422 Win=65535 Len=0
833545 272.663906 90.103.254.253 -> 41.177.26.46 TCP 64 [TCP Dup ACK 833475#6] 22822 > http [ACK] Seq=1360 Ack=78422 Win=65535 Len=0
833552 272.670032 90.103.254.253 -> 41.177.26.46 TCP 64 [TCP Dup ACK 833475#7] 22822 > http [PSH, ACK] Seq=1360 Ack=78422 Win=65535 Len=0
833553 272.670114 90.103.254.253 -> 41.177.26.46 TCP 64 [TCP Dup ACK 833475#8] 22822 > http [PSH, ACK] Seq=1360 Ack=78422 Win=65535 Len=0
833556 272.670540 90.103.254.253 -> 41.177.26.46 TCP 64 [TCP Dup ACK 833475#9] 22822 > http [PSH, ACK] Seq=1360 Ack=78422 Win=65535 Len=0
833561 272.671701 90.103.254.253 -> 41.177.26.46 TCP 64 [TCP Dup ACK 833475#10] 22822 > http [PSH, ACK] Seq=1360 Ack=78422 Win=65535 Len=0
833563 272.672189 90.103.254.253 -> 41.177.26.46 TCP 64 [TCP Dup ACK 833475#11] 22822 > http [PSH, ACK] Seq=1360 Ack=78422 Win=65535 Len=0
833564 272.672293 90.103.254.253 -> 41.177.26.46 TCP 64 [TCP Dup ACK 833475#12] 22822 > http [PSH, ACK] Seq=1360 Ack=78422 Win=65535 Len=0
833570 272.678554 90.103.254.253 -> 41.177.26.46 TCP 64 [TCP Dup ACK 833475#13] 22822 > http [PSH, ACK] Seq=1360 Ack=78422 Win=65535 Len=0
833571 272.678578 90.103.254.253 -> 41.177.26.46 TCP 64 [TCP Dup ACK 833475#14] 22822 > http [PSH, ACK] Seq=1360 Ack=78422 Win=65535 Len=0
833574 272.678813 90.103.254.253 -> 41.177.26.46 TCP 64 [TCP Dup ACK 833475#15] 22822 > http [PSH, ACK] Seq=1360 Ack=78422 Win=65535 Len=0
833578 272.680003 90.103.254.253 -> 41.177.26.46 TCP 64 [TCP Dup ACK 833475#16] 22822 > http [PSH, ACK] Seq=1360 Ack=78422 Win=65535 Len=0
833580 272.680357 90.103.254.253 -> 41.177.26.46 TCP 64 [TCP Dup ACK 833475#17] 22822 > http [PSH, ACK] Seq=1360 Ack=78422 Win=65535 Len=0
833584 272.681064 90.103.254.253 -> 41.177.26.46 TCP 64 [TCP Dup ACK 833475#18] 22822 > http [PSH, ACK] Seq=1360 Ack=78422 Win=65535 Len=0
833620 272.687366 90.103.254.253 -> 41.177.26.46 TCP 64 [TCP Dup ACK 833475#19] 22822 > http [PSH, ACK] Seq=1360 Ack=78422 Win=65535 Len=0
833622 272.687748 90.103.254.253 -> 41.177.26.46 TCP 64 [TCP Dup ACK 833475#20] 22822 > http [PSH, ACK] Seq=1360 Ack=78422 Win=65535 Len=0
833623 272.687753 90.103.254.253 -> 41.177.26.46 TCP 64 [TCP Dup ACK 833475#21] 22822 > http [PSH, ACK] Seq=1360 Ack=78422 Win=65535 Len=0
833630 272.688399 90.103.254.253 -> 41.177.26.46 TCP 64 [TCP Dup ACK 833475#22] 22822 > http [PSH, ACK] Seq=1360 Ack=78422 Win=65535 Len=0
833631 272.688543 90.103.254.253 -> 41.177.26.46 TCP 64 [TCP Dup ACK 833475#23] 22822 > http [PSH, ACK] Seq=1360 Ack=78422 Win=65535 Len=0
833635 272.689530 90.103.254.253 -> 41.177.26.46 TCP 64 [TCP Dup ACK 833475#24] 22822 > http [PSH, ACK] Seq=1360 Ack=78422 Win=65535 Len=0
833638 272.695983 90.103.254.253 -> 41.177.26.46 TCP 64 [TCP Dup ACK 833475#25] 22822 > http [PSH, ACK] Seq=1360 Ack=78422 Win=65535 Len=0
833640 272.696376 90.103.254.253 -> 41.177.26.46 TCP 64 [TCP Dup ACK 833475#26] 22822 > http [PSH, ACK] Seq=1360 Ack=78422 Win=65535 Len=0
833641 272.696381 90.103.254.253 -> 41.177.26.46 TCP 64 [TCP Dup ACK 833475#27] 22822 > http [PSH, ACK] Seq=1360 Ack=78422 Win=65535 Len=0
833644 272.696809 90.103.254.253 -> 41.177.26.46 TCP 64 [TCP Dup ACK 833475#28] 22822 > http [PSH, ACK] Seq=1360 Ack=78422 Win=65535 Len=0
833645 272.696815 90.103.254.253 -> 41.177.26.46 TCP 64 [TCP Dup ACK 833475#29] 22822 > http [PSH, ACK] Seq=1360 Ack=78422 Win=65535 Len=0
833650 272.697967 90.103.254.253 -> 41.177.26.46 TCP 64 [TCP Dup ACK 833475#30] 22822 > http [PSH, ACK] Seq=1360 Ack=78422 Win=65535 Len=0
833654 272.704278 90.103.254.253 -> 41.177.26.46 TCP 64 [TCP Dup ACK 833475#31] 22822 > http [PSH, ACK] Seq=1360 Ack=78422 Win=65535 Len=0
833655 272.704830 90.103.254.253 -> 41.177.26.46 TCP 64 [TCP Dup ACK 833475#32] 22822 > http [PSH, ACK] Seq=1360 Ack=78422 Win=65535 Len=0
833656 272.704834 90.103.254.253 -> 41.177.26.46 TCP 64 [TCP Dup ACK 833475#33] 22822 > http [PSH, ACK] Seq=1360 Ack=78422 Win=65535 Len=0
833657 272.705185 90.103.254.253 -> 41.177.26.46 TCP 64 [TCP Dup ACK 833475#34] 22822 > http [PSH, ACK] Seq=1360 Ack=78422 Win=65535 Len=0
833658 272.705229 90.103.254.253 -> 41.177.26.46 TCP 64 [TCP Dup ACK 833475#35] 22822 > http [PSH, ACK] Seq=1360 Ack=78422 Win=65535 Len=0
833659 272.706339 90.103.254.253 -> 41.177.26.46 TCP 64 [TCP Dup ACK 833475#36] 22822 > http [PSH, ACK] Seq=1360 Ack=78422 Win=65535 Len=0
834155 272.957229 90.103.254.253 -> 41.177.26.46 TCP 64 22822 > http [ACK] Seq=1360 Ack=79802 Win=65535 Len=0
834172 272.968332 90.103.254.253 -> 41.177.26.46 TCP 64 22822 > http [ACK] Seq=1360 Ack=82562 Win=65535 Len=0
834749 273.285333 90.103.254.253 -> 41.177.26.46 TCP 64 22822 > http [ACK] Seq=1360 Ack=83942 Win=65535 Len=0
834764 273.296763 90.103.254.253 -> 41.177.26.46 TCP 64 22822 > http [ACK] Seq=1360 Ack=86702 Win=65535 Len=0
834765 273.296768 90.103.254.253 -> 41.177.26.46 TCP 64 22822 > http [ACK] Seq=1360 Ack=89462 Win=65535 Len=0
834766 273.296772 90.103.254.253 -> 41.177.26.46 TCP 64 22822 > http [ACK] Seq=1360 Ack=92222 Win=65535 Len=0
834767 273.296776 90.103.254.253 -> 41.177.26.46 TCP 64 22822 > http [ACK] Seq=1360 Ack=94982 Win=65535 Len=0
834768 273.296780 90.103.254.253 -> 41.177.26.46 TCP 64 22822 > http [ACK] Seq=1360 Ack=97742 Win=65535 Len=0
834772 273.297792 90.103.254.253 -> 41.177.26.46 TCP 64 22822 > http [ACK] Seq=1360 Ack=100502 Win=65535 Len=0
834773 273.297849 90.103.254.253 -> 41.177.26.46 TCP 64 22822 > http [ACK] Seq=1360 Ack=101882 Win=65535 Len=0
834774 273.297854 90.103.254.253 -> 41.177.26.46 TCP 64 [TCP Dup ACK 834773#1] 22822 > http [ACK] Seq=1360 Ack=101882 Win=65535 Len=0
834775 273.297858 90.103.254.253 -> 41.177.26.46 TCP 64 [TCP Dup ACK 834773#2] 22822 > http [ACK] Seq=1360 Ack=101882 Win=65535 Len=0
834776 273.297933 90.103.254.253 -> 41.177.26.46 TCP 64 [TCP Dup ACK 834773#3] 22822 > http [ACK] Seq=1360 Ack=101882 Win=65535 Len=0
834777 273.297938 90.103.254.253 -> 41.177.26.46 TCP 64 [TCP Dup ACK 834773#4] 22822 > http [ACK] Seq=1360 Ack=101882 Win=65535 Len=0
834778 273.297942 90.103.254.253 -> 41.177.26.46 TCP 64 [TCP Dup ACK 834773#5] 22822 > http [ACK] Seq=1360 Ack=101882 Win=65535 Len=0
834779 273.298045 90.103.254.253 -> 41.177.26.46 TCP 64 [TCP Dup ACK 834773#6] 22822 > http [ACK] Seq=1360 Ack=101882 Win=65535 Len=0
834780 273.298050 90.103.254.253 -> 41.177.26.46 TCP 64 [TCP Dup ACK 834773#7] 22822 > http [ACK] Seq=1360 Ack=101882 Win=65535 Len=0
834781 273.298054 90.103.254.253 -> 41.177.26.46 TCP 64 [TCP Dup ACK 834773#8] 22822 > http [ACK] Seq=1360 Ack=101882 Win=65535 Len=0
834783 273.299026 90.103.254.253 -> 41.177.26.46 TCP 64 [TCP Dup ACK 834773#9] 22822 > http [ACK] Seq=1360 Ack=101882 Win=65535 Len=0
834900 273.307812 90.103.254.253 -> 41.177.26.46 TCP 64 [TCP Dup ACK 834773#10] 22822 > http [ACK] Seq=1360 Ack=101882 Win=65535 Len=0
835575 273.504209 90.103.254.253 -> 41.177.26.46 TCP 64 22822 > http [ACK] Seq=1360 Ack=103262 Win=65535 Len=0
835589 273.515485 90.103.254.253 -> 41.177.26.46 TCP 64 22822 > http [ACK] Seq=1360 Ack=106022 Win=65535 Len=0
836287 273.832311 90.103.254.253 -> 41.177.26.46 TCP 64 22822 > http [ACK] Seq=1360 Ack=107402 Win=65535 Len=0
836310 273.843817 90.103.254.253 -> 41.177.26.46 TCP 64 22822 > http [ACK] Seq=1360 Ack=110162 Win=65535 Len=0
836516 273.941569 90.103.254.253 -> 41.177.26.46 TCP 64 [TCP Retransmission] silhouette > http [FIN, ACK] Seq=1754 Ack=67446 Win=65535 Len=0
836524 273.949960 90.103.254.253 -> 41.177.26.46 TCP 64 [TCP Dup ACK 836516#1] silhouette > http [PSH, ACK] Seq=1755 Ack=67446 Win=65535 Len=0
836526 273.952692 90.103.254.253 -> 41.177.26.46 TCP 64 silhouette > http [RST, ACK] Seq=1755 Ack=68826 Win=0 Len=0
837025 274.160610 90.103.254.253 -> 41.177.26.46 TCP 64 22822 > http [ACK] Seq=1360 Ack=111542 Win=65535 Len=0
837040 274.171846 90.103.254.253 -> 41.177.26.46 TCP 64 22822 > http [ACK] Seq=1360 Ack=114302 Win=65535 Len=0
837059 274.183461 90.103.254.253 -> 41.177.26.46 TCP 64 22822 > http [ACK] Seq=1360 Ack=117062 Win=65535 Len=0
837748 274.488738 90.103.254.253 -> 41.177.26.46 TCP 64 22822 > http [ACK] Seq=1360 Ack=118442 Win=65535 Len=0
837765 274.500608 90.103.254.253 -> 41.177.26.46 TCP 64 22822 > http [ACK] Seq=1360 Ack=121202 Win=65535 Len=0
837797 274.512259 90.103.254.253 -> 41.177.26.46 TCP 64 22822 > http [ACK] Seq=1360 Ack=122582 Win=65535 Len=0
837798 274.512290 90.103.254.253 -> 41.177.26.46 TCP 64 [TCP Dup ACK 837797#1] 22822 > http [ACK] Seq=1360 Ack=122582 Win=65535 Len=0
837852 274.523453 90.103.254.253 -> 41.177.26.46 TCP 64 22822 > http [ACK] Seq=1360 Ack=125342 Win=65535 Len=0
837853 274.523457 90.103.254.253 -> 41.177.26.46 TCP 64 [TCP Dup ACK 837852#1] 22822 > http [ACK] Seq=1360 Ack=125342 Win=65535 Len=0
837854 274.523464 90.103.254.253 -> 41.177.26.46 TCP 64 [TCP Dup ACK 837852#2] 22822 > http [ACK] Seq=1360 Ack=125342 Win=65535 Len=0
837888 274.535671 90.103.254.253 -> 41.177.26.46 TCP 64 22822 > http [ACK] Seq=1360 Ack=128102 Win=65535 Len=0
837889 274.535676 90.103.254.253 -> 41.177.26.46 TCP 64 [TCP Dup ACK 837888#1] 22822 > http [ACK] Seq=1360 Ack=128102 Win=65535 Len=0
837890 274.535680 90.103.254.253 -> 41.177.26.46 TCP 64 [TCP Dup ACK 837888#2] 22822 > http [ACK] Seq=1360 Ack=128102 Win=65535 Len=0
837891 274.535684 90.103.254.253 -> 41.177.26.46 TCP 64 [TCP Dup ACK 837888#3] 22822 > http [ACK] Seq=1360 Ack=128102 Win=65535 Len=0
837933 274.546935 90.103.254.253 -> 41.177.26.46 TCP 64 22822 > http [ACK] Seq=1360 Ack=129482 Win=65535 Len=0
837934 274.546966 90.103.254.253 -> 41.177.26.46 TCP 64 [TCP Dup ACK 837933#1] 22822 > http [ACK] Seq=1360 Ack=129482 Win=65535 Len=0
837935 274.546971 90.103.254.253 -> 41.177.26.46 TCP 64 [TCP Dup ACK 837933#2] 22822 > http [ACK] Seq=1360 Ack=129482 Win=65535 Len=0
837988 274.557944 90.103.254.253 -> 41.177.26.46 TCP 64 22822 > http [ACK] Seq=1360 Ack=132242 Win=65535 Len=0
838534 274.816602 90.103.254.253 -> 41.177.26.46 TCP 64 22822 > http [ACK] Seq=1360 Ack=133622 Win=65535 Len=0
838575 274.827614 90.103.254.253 -> 41.177.26.46 TCP 64 22822 > http [ACK] Seq=1360 Ack=136382 Win=65535 Len=0
838576 274.827619 90.103.254.253 -> 41.177.26.46 TCP 64 [TCP Dup ACK 838575#1] 22822 > http [ACK] Seq=1360 Ack=136382 Win=65535 Len=0
838605 274.838880 90.103.254.253 -> 41.177.26.46 TCP 64 22822 > http [ACK] Seq=1360 Ack=137762 Win=65535 Len=0
838606 274.838885 90.103.254.253 -> 41.177.26.46 TCP 64 [TCP Dup ACK 838605#1] 22822 > http [ACK] Seq=1360 Ack=137762 Win=65535 Len=0
838607 274.838889 90.103.254.253 -> 41.177.26.46 TCP 64 [TCP Dup ACK 838605#2] 22822 > http [ACK] Seq=1360 Ack=137762 Win=65535 Len=0
838625 274.849866 90.103.254.253 -> 41.177.26.46 TCP 64 22822 > http [ACK] Seq=1360 Ack=140522 Win=65535 Len=0
838626 274.849874 90.103.254.253 -> 41.177.26.46 TCP 64 [TCP Dup ACK 838625#1] 22822 > http [ACK] Seq=1360 Ack=140522 Win=65535 Len=0
838629 274.850070 90.103.254.253 -> 41.177.26.46 TCP 64 [TCP Dup ACK 838625#2] 22822 > http [ACK] Seq=1360 Ack=140522 Win=65535 Len=0
838635 274.860880 90.103.254.253 -> 41.177.26.46 TCP 64 22822 > http [ACK] Seq=1360 Ack=141902 Win=65535 Len=0
838636 274.860908 90.103.254.253 -> 41.177.26.46 TCP 64 [TCP Dup ACK 838635#1] 22822 > http [ACK] Seq=1360 Ack=141902 Win=65535 Len=0
838653 274.872060 90.103.254.253 -> 41.177.26.46 TCP 64 22822 > http [ACK] Seq=1360 Ack=168122 Win=65535 Len=0
838665 274.883424 90.103.254.253 -> 41.177.26.46 TCP 64 22822 > http [ACK] Seq=1360 Ack=170882 Win=65535 Len=0
838666 274.883429 90.103.254.253 -> 41.177.26.46 TCP 64 22822 > http [ACK] Seq=1360 Ack=172262 Win=65535 Len=0
838667 274.883433 90.103.254.253 -> 41.177.26.46 TCP 64 22822 > http [ACK] Seq=1360 Ack=175022 Win=65535 Len=0
838703 274.894053 90.103.254.253 -> 41.177.26.46 TCP 64 [TCP Dup ACK 838667#1] 22822 > http [PSH, ACK] Seq=1360 Ack=175022 Win=65535 Len=0
838704 274.894177 90.103.254.253 -> 41.177.26.46 TCP 64 [TCP Dup ACK 838667#2] 22822 > http [PSH, ACK] Seq=1360 Ack=175022 Win=65535 Len=0
838708 274.895191 90.103.254.253 -> 41.177.26.46 TCP 64 22822 > http [ACK] Seq=1360 Ack=176402 Win=65535 Len=0
838709 274.895196 90.103.254.253 -> 41.177.26.46 TCP 64 22822 > http [ACK] Seq=1360 Ack=179162 Win=65535 Len=0
838710 274.895200 90.103.254.253 -> 41.177.26.46 TCP 64 22822 > http [ACK] Seq=1360 Ack=180542 Win=65535 Len=0
838711 274.895204 90.103.254.253 -> 41.177.26.46 TCP 64 22822 > http [ACK] Seq=1360 Ack=183302 Win=65535 Len=0
838716 274.895501 90.103.254.253 -> 41.177.26.46 TCP 64 22822 > http [ACK] Seq=1360 Ack=184682 Win=65535 Len=0
838717 274.895507 90.103.254.253 -> 41.177.26.46 TCP 64 22822 > http [ACK] Seq=1360 Ack=187442 Win=65535 Len=0
838725 274.902496 90.103.254.253 -> 41.177.26.46 TCP 64 [TCP Dup ACK 838717#1] 22822 > http [PSH, ACK] Seq=1360 Ack=187442 Win=65535 Len=0
838730 274.902856 90.103.254.253 -> 41.177.26.46 TCP 64 [TCP Dup ACK 838717#2] 22822 > http [PSH, ACK] Seq=1360 Ack=187442 Win=65535 Len=0
838731 274.902860 90.103.254.253 -> 41.177.26.46 TCP 64 [TCP Dup ACK 838717#3] 22822 > http [PSH, ACK] Seq=1360 Ack=187442 Win=65535 Len=0
838734 274.903442 90.103.254.253 -> 41.177.26.46 TCP 64 [TCP Dup ACK 838717#4] 22822 > http [PSH, ACK] Seq=1360 Ack=187442 Win=65535 Len=0
838735 274.903662 90.103.254.253 -> 41.177.26.46 TCP 64 [TCP Dup ACK 838717#5] 22822 > http [PSH, ACK] Seq=1360 Ack=187442 Win=65535 Len=0
838736 274.903771 90.103.254.253 -> 41.177.26.46 TCP 64 [TCP Dup ACK 838717#6] 22822 > http [PSH, ACK] Seq=1360 Ack=187442 Win=65535 Len=0
838737 274.903887 90.103.254.253 -> 41.177.26.46 TCP 64 [TCP Dup ACK 838717#7] 22822 > http [PSH, ACK] Seq=1360 Ack=187442 Win=65535 Len=0
838754 274.905114 90.103.254.253 -> 41.177.26.46 TCP 64 [TCP Dup ACK 838717#8] 22822 > http [PSH, ACK] Seq=1360 Ack=187442 Win=65535 Len=0
838755 274.905308 90.103.254.253 -> 41.177.26.46 TCP 64 [TCP Dup ACK 838717#9] 22822 > http [PSH, ACK] Seq=1360 Ack=187442 Win=65535 Len=0
838756 274.905472 90.103.254.253 -> 41.177.26.46 TCP 64 [TCP Dup ACK 838717#10] 22822 > http [PSH, ACK] Seq=1360 Ack=187442 Win=65535 Len=0
838761 274.910799 90.103.254.253 -> 41.177.26.46 TCP 64 [TCP Dup ACK 838717#11] 22822 > http [PSH, ACK] Seq=1360 Ack=187442 Win=65535 Len=0
838763 274.911153 90.103.254.253 -> 41.177.26.46 TCP 64 [TCP Dup ACK 838717#12] 22822 > http [PSH, ACK] Seq=1360 Ack=187442 Win=65535 Len=0
838766 274.912906 90.103.254.253 -> 41.177.26.46 TCP 64 22822 > http [ACK] Seq=1360 Ack=188822 Win=65535 Len=0
838771 274.913799 90.103.254.253 -> 41.177.26.46 TCP 64 [TCP Dup ACK 838766#1] 22822 > http [PSH, ACK] Seq=1360 Ack=188822 Win=65535 Len=0
838802 274.919377 90.103.254.253 -> 41.177.26.46 TCP 64 [TCP Dup ACK 838766#2] 22822 > http [PSH, ACK] Seq=1360 Ack=188822 Win=65535 Len=0
838803 274.919740 90.103.254.253 -> 41.177.26.46 TCP 64 [TCP Dup ACK 838766#3] 22822 > http [PSH, ACK] Seq=1360 Ack=188822 Win=65535 Len=0
838814 274.924144 90.103.254.253 -> 41.177.26.46 TCP 64 22822 > http [ACK] Seq=1360 Ack=191582 Win=65535 Len=0
838841 274.935773 90.103.254.253 -> 41.177.26.46 TCP 64 22822 > http [ACK] Seq=1360 Ack=192962 Win=65535 Len=0
838848 274.947613 90.103.254.253 -> 41.177.26.46 TCP 64 22822 > http [ACK] Seq=1360 Ack=195722 Win=65535 Len=0
838849 274.947662 90.103.254.253 -> 41.177.26.46 TCP 64 22822 > http [ACK] Seq=1360 Ack=197102 Win=65535 Len=0
838854 274.947944 90.103.254.253 -> 41.177.26.46 TCP 64 22822 > http [ACK] Seq=1360 Ack=199862 Win=65535 Len=0
838855 274.947949 90.103.254.253 -> 41.177.26.46 TCP 64 22822 > http [ACK] Seq=1360 Ack=202622 Win=65535 Len=0
838856 274.947953 90.103.254.253 -> 41.177.26.46 TCP 64 22822 > http [ACK] Seq=1360 Ack=205382 Win=65535 Len=0
838865 274.949054 90.103.254.253 -> 41.177.26.46 TCP 64 22822 > http [ACK] Seq=1360 Ack=208142 Win=65535 Len=0
838866 274.949059 90.103.254.253 -> 41.177.26.46 TCP 64 22822 > http [ACK] Seq=1360 Ack=210902 Win=65535 Len=0
838867 274.949063 90.103.254.253 -> 41.177.26.46 TCP 64 22822 > http [ACK] Seq=1360 Ack=213662 Win=62775 Len=0
838891 274.957437 90.103.254.253 -> 41.177.26.46 TCP 64 22822 > http [ACK] Seq=1360 Ack=215042 Win=65155 Len=0
838895 274.959808 90.103.254.253 -> 41.177.26.46 TCP 64 [TCP Dup ACK 838891#1] 22822 > http [ACK] Seq=1360 Ack=215042 Win=65155 Len=0
838896 274.959813 90.103.254.253 -> 41.177.26.46 TCP 64 [TCP Dup ACK 838891#2] 22822 > http [ACK] Seq=1360 Ack=215042 Win=65155 Len=0
838897 274.959817 90.103.254.253 -> 41.177.26.46 TCP 64 [TCP Dup ACK 838891#3] 22822 > http [ACK] Seq=1360 Ack=215042 Win=65155 Len=0
838898 274.959927 90.103.254.253 -> 41.177.26.46 TCP 64 [TCP Dup ACK 838891#4] 22822 > http [ACK] Seq=1360 Ack=215042 Win=65155 Len=0
838899 274.959932 90.103.254.253 -> 41.177.26.46 TCP 64 [TCP Dup ACK 838891#5] 22822 > http [ACK] Seq=1360 Ack=215042 Win=65155 Len=0
838900 274.959936 90.103.254.253 -> 41.177.26.46 TCP 64 [TCP Dup ACK 838891#6] 22822 > http [ACK] Seq=1360 Ack=215042 Win=65155 Len=0
838903 274.960017 90.103.254.253 -> 41.177.26.46 TCP 64 [TCP Dup ACK 838891#7] 22822 > http [ACK] Seq=1360 Ack=215042 Win=65155 Len=0
838904 274.960021 90.103.254.253 -> 41.177.26.46 TCP 64 [TCP Dup ACK 838891#8] 22822 > http [ACK] Seq=1360 Ack=215042 Win=65155 Len=0
838906 274.960107 90.103.254.253 -> 41.177.26.46 TCP 64 [TCP Dup ACK 838891#9] 22822 > http [ACK] Seq=1360 Ack=215042 Win=65155 Len=0
838909 274.960204 90.103.254.253 -> 41.177.26.46 TCP 64 [TCP Dup ACK 838891#10] 22822 > http [ACK] Seq=1360 Ack=215042 Win=65155 Len=0
838910 274.960208 90.103.254.253 -> 41.177.26.46 TCP 64 [TCP Dup ACK 838891#11] 22822 > http [ACK] Seq=1360 Ack=215042 Win=65155 Len=0
838911 274.960212 90.103.254.253 -> 41.177.26.46 TCP 64 [TCP Dup ACK 838891#12] 22822 > http [ACK] Seq=1360 Ack=215042 Win=65155 Len=0
838912 274.960216 90.103.254.253 -> 41.177.26.46 TCP 64 [TCP Dup ACK 838891#13] 22822 > http [ACK] Seq=1360 Ack=215042 Win=65155 Len=0
838913 274.960230 90.103.254.253 -> 41.177.26.46 TCP 64 [TCP Dup ACK 838891#14] 22822 > http [ACK] Seq=1360 Ack=215042 Win=65155 Len=0
838920 274.960465 90.103.254.253 -> 41.177.26.46 TCP 64 [TCP Dup ACK 838891#15] 22822 > http [ACK] Seq=1360 Ack=215042 Win=65155 Len=0
838927 274.967536 90.103.254.253 -> 41.177.26.46 TCP 64 [TCP Dup ACK 838891#16] 22822 > http [ACK] Seq=1360 Ack=215042 Win=65155 Len=0
838930 274.971555 90.103.254.253 -> 41.177.26.46 TCP 64 [TCP Dup ACK 838891#17] 22822 > http [ACK] Seq=1360 Ack=215042 Win=65155 Len=0
838931 274.971560 90.103.254.253 -> 41.177.26.46 TCP 64 [TCP Dup ACK 838891#18] 22822 > http [ACK] Seq=1360 Ack=215042 Win=65155 Len=0
838932 274.971564 90.103.254.253 -> 41.177.26.46 TCP 64 22822 > http [ACK] Seq=1360 Ack=231602 Win=65535 Len=0
838933 274.971568 90.103.254.253 -> 41.177.26.46 TCP 64 22822 > http [ACK] Seq=1360 Ack=234362 Win=62775 Len=0
838934 274.971578 90.103.254.253 -> 41.177.26.46 TCP 64 22822 > http [ACK] Seq=1360 Ack=237122 Win=63775 Len=0
838935 274.971607 90.103.254.253 -> 41.177.26.46 TCP 64 22822 > http [ACK] Seq=1360 Ack=238502 Win=65535 Len=0
838938 274.972485 90.103.254.253 -> 41.177.26.46 TCP 64 22822 > http [ACK] Seq=1360 Ack=241262 Win=65535 Len=0
838939 274.972490 90.103.254.253 -> 41.177.26.46 TCP 64 22822 > http [ACK] Seq=1360 Ack=244022 Win=65535 Len=0
838947 274.981926 90.103.254.253 -> 41.177.26.46 TCP 64 [TCP Dup ACK 838939#1] 22822 > http [PSH, ACK] Seq=1360 Ack=244022 Win=65535 Len=0
838951 274.982541 90.103.254.253 -> 41.177.26.46 TCP 64 [TCP Dup ACK 838939#2] 22822 > http [PSH, ACK] Seq=1360 Ack=244022 Win=65535 Len=0
838952 274.982545 90.103.254.253 -> 41.177.26.46 TCP 64 [TCP Dup ACK 838939#3] 22822 > http [PSH, ACK] Seq=1360 Ack=244022 Win=65535 Len=0
838953 274.982549 90.103.254.253 -> 41.177.26.46 TCP 64 [TCP Dup ACK 838939#4] 22822 > http [PSH, ACK] Seq=1360 Ack=244022 Win=65535 Len=0
838954 274.982553 90.103.254.253 -> 41.177.26.46 TCP 64 [TCP Dup ACK 838939#5] 22822 > http [PSH, ACK] Seq=1360 Ack=244022 Win=65535 Len=0
838979 274.990414 90.103.254.253 -> 41.177.26.46 TCP 64 [TCP Dup ACK 838939#6] 22822 > http [PSH, ACK] Seq=1360 Ack=244022 Win=65535 Len=0
838984 274.991124 90.103.254.253 -> 41.177.26.46 TCP 64 [TCP Dup ACK 838939#7] 22822 > http [PSH, ACK] Seq=1360 Ack=244022 Win=65535 Len=0
838996 274.994949 90.103.254.253 -> 41.177.26.46 TCP 64 22822 > http [ACK] Seq=1360 Ack=246782 Win=65535 Len=0
839035 274.999690 90.103.254.253 -> 41.177.26.46 TCP 64 [TCP Dup ACK 838996#1] 22822 > http [PSH, ACK] Seq=1360 Ack=246782 Win=65535 Len=0
839036 275.000244 90.103.254.253 -> 41.177.26.46 TCP 64 [TCP Dup ACK 838996#2] 22822 > http [PSH, ACK] Seq=1360 Ack=246782 Win=65535 Len=0
839041 275.006200 90.103.254.253 -> 41.177.26.46 TCP 64 22822 > http [ACK] Seq=1360 Ack=249542 Win=65535 Len=0
839043 275.006714 90.103.254.253 -> 41.177.26.46 TCP 64 22822 > http [ACK] Seq=1360 Ack=250922 Win=65535 Len=0
839044 275.006719 90.103.254.253 -> 41.177.26.46 TCP 64 22822 > http [ACK] Seq=1360 Ack=253682 Win=65535 Len=0
839045 275.006722 90.103.254.253 -> 41.177.26.46 TCP 64 22822 > http [ACK] Seq=1360 Ack=256442 Win=65535 Len=0
839046 275.006727 90.103.254.253 -> 41.177.26.46 TCP 64 22822 > http [ACK] Seq=1360 Ack=259202 Win=65535 Len=0
839079 275.016250 90.103.254.253 -> 41.177.26.46 TCP 64 [TCP Dup ACK 839046#1] 22822 > http [ACK] Seq=1360 Ack=259202 Win=65535 Len=0
839082 275.017352 90.103.254.253 -> 41.177.26.46 TCP 64 [TCP Dup ACK 839046#2] 22822 > http [ACK] Seq=1360 Ack=259202 Win=65535 Len=0
839084 275.017447 90.103.254.253 -> 41.177.26.46 TCP 64 22822 > http [ACK] Seq=1360 Ack=260582 Win=65535 Len=0
839085 275.017451 90.103.254.253 -> 41.177.26.46 TCP 64 22822 > http [ACK] Seq=1360 Ack=263342 Win=65535 Len=0
839089 275.018821 90.103.254.253 -> 41.177.26.46 TCP 64 22822 > http [ACK] Seq=1360 Ack=266102 Win=65535 Len=0
839107 275.028954 90.103.254.253 -> 41.177.26.46 TCP 64 22822 > http [ACK] Seq=1360 Ack=268862 Win=65535 Len=0
839108 275.029022 90.103.254.253 -> 41.177.26.46 TCP 64 22822 > http [ACK] Seq=1360 Ack=271622 Win=65535 Len=0
839127 275.038790 90.103.254.253 -> 41.177.26.46 TCP 64 22822 > http [ACK] Seq=1360 Ack=274382 Win=65535 Len=0
839134 275.041321 90.103.254.253 -> 41.177.26.46 TCP 64 22822 > http [ACK] Seq=1360 Ack=277142 Win=65535 Len=0
839135 275.041326 90.103.254.253 -> 41.177.26.46 TCP 64 22822 > http [ACK] Seq=1360 Ack=279902 Win=65535 Len=0
839169 275.049817 90.103.254.253 -> 41.177.26.46 TCP 64 22822 > http [ACK] Seq=1360 Ack=282662 Win=65535 Len=0
839264 275.078516 90.103.254.253 -> 41.177.26.46 TCP 64 22822 > http [ACK] Seq=1662 Ack=286392 Win=65535 Len=0
839265 275.078521 90.103.254.253 -> 41.177.26.46 TCP 64 22822 > http [ACK] Seq=1662 Ack=287543 Win=64384 Len=0
875983 290.078459 90.103.254.253 -> 41.177.26.46 TCP 64 22822 > http [ACK] Seq=1662 Ack=287544 Win=64384 Len=0
875984 290.078581 90.103.254.253 -> 41.177.26.46 TCP 64 22822 > http [FIN, ACK] Seq=1662 Ack=287544 Win=64384 Len=0
