402606 135.059279 90.108.77.177 -> 244.3.160.239 TCP 82 10954 > http [SYN] Seq=0 Win=65535 Len=0 MSS=1460 WS=2 TSval=716891924 TSecr=0 SACK_PERM=1
402661 135.069507 90.108.77.177 -> 244.3.160.239 TCP 70 10954 > http [ACK] Seq=1 Ack=1 Win=66608 Len=0 TSval=716891925 TSecr=1511948006
402709 135.087354 90.108.77.177 -> 244.3.160.239 TCP 70 10954 > http [ACK] Seq=825 Ack=736 Win=65874 Len=0 TSval=716891925 TSecr=1511948008
402736 135.092666 90.108.77.177 -> 244.3.160.239 TCP 70 10954 > http [FIN, ACK] Seq=825 Ack=736 Win=66608 Len=0 TSval=716891925 TSecr=1511948008
760848 245.418224 90.108.77.177 -> 41.177.98.176 TCP 82 50447 > http [SYN] Seq=0 Win=65535 Len=0 MSS=1460 WS=2 TSval=716893027 TSecr=0 SACK_PERM=1
760880 245.428656 90.108.77.177 -> 41.177.98.176 TCP 70 50447 > http [ACK] Seq=1 Ack=1 Win=66608 Len=0 TSval=716893027 TSecr=1565101
760956 245.453230 90.108.77.177 -> 41.177.98.176 TCP 70 50447 > http [ACK] Seq=778 Ack=298 Win=66310 Len=0 TSval=716893027 TSecr=1565102
760957 245.453253 90.108.77.177 -> 41.177.98.176 TCP 82 [TCP Window Update] 50447 > http [ACK] Seq=778 Ack=298 Win=66608 Len=0 TSval=716893027 TSecr=1565102 SLE=1746 SRE=3194
760988 245.465657 90.108.77.177 -> 41.177.98.176 TCP 82 [TCP Dup ACK 760957#1] 50447 > http [ACK] Seq=778 Ack=298 Win=66608 Len=0 TSval=716893027 TSecr=1565102 SLE=1746 SRE=4642
760989 245.465662 90.108.77.177 -> 41.177.98.176 TCP 82 [TCP Dup ACK 760957#2] 50447 > http [ACK] Seq=778 Ack=298 Win=66608 Len=0 TSval=716893027 TSecr=1565102 SLE=1746 SRE=6090
761043 245.477525 90.108.77.177 -> 41.177.98.176 TCP 82 [TCP Dup ACK 760957#3] 50447 > http [ACK] Seq=778 Ack=298 Win=66608 Len=0 TSval=716893027 TSecr=1565102 SLE=1746 SRE=6808
761058 245.487628 90.108.77.177 -> 41.177.98.176 TCP 70 50447 > http [ACK] Seq=778 Ack=6808 Win=60098 Len=0 TSval=716893027 TSecr=1565107
761059 245.487633 90.108.77.177 -> 41.177.98.176 TCP 70 50447 > http [FIN, ACK] Seq=778 Ack=6808 Win=66608 Len=0 TSval=716893027 TSecr=1565107
761076 245.495689 90.108.77.177 -> 41.177.98.176 TCP 70 50447 > http [ACK] Seq=779 Ack=6809 Win=66608 Len=0 TSval=716893027 TSecr=1565108
761092 245.501617 90.108.77.177 -> 41.177.98.176 TCP 70 [TCP Dup ACK 761076#1] 50447 > http [ACK] Seq=779 Ack=6809 Win=66608 Len=0 TSval=716893027 TSecr=1565108
763000 246.248217 90.108.77.177 -> 41.177.98.176 TCP 70 [TCP Dup ACK 761076#2] 50447 > http [ACK] Seq=779 Ack=6809 Win=66608 Len=0 TSval=716893035 TSecr=1565108
