723881 231.614431 90.218.82.164 -> 41.177.98.176 TCP 82 60102 > http [SYN] Seq=0 Win=65535 Len=0 MSS=1460 WS=8 TSval=745642358 TSecr=0 SACK_PERM=1
723891 231.618045 90.218.82.164 -> 41.177.98.176 TCP 70 60102 > http [ACK] Seq=1 Ack=1 Win=524280 Len=0 TSval=745642358 TSecr=1563721
727692 233.467354 90.218.82.164 -> 41.177.98.176 TCP 70 60102 > http [ACK] Seq=761 Ack=2897 Win=524176 Len=0 TSval=745642377 TSecr=1563906
727693 233.467516 90.218.82.164 -> 41.177.98.176 TCP 70 60102 > http [ACK] Seq=761 Ack=4345 Win=524176 Len=0 TSval=745642377 TSecr=1563906
727702 233.472386 90.218.82.164 -> 41.177.98.176 TCP 70 60102 > http [ACK] Seq=761 Ack=6783 Win=524176 Len=0 TSval=745642377 TSecr=1563906
727705 233.473043 90.218.82.164 -> 41.177.98.176 TCP 70 60102 > http [ACK] Seq=761 Ack=9612 Win=524240 Len=0 TSval=745642377 TSecr=1563906
727764 233.506372 90.218.82.164 -> 41.177.98.176 TCP 82 60109 > http [SYN] Seq=0 Win=65535 Len=0 MSS=1460 WS=8 TSval=745642377 TSecr=0 SACK_PERM=1
727769 233.507313 90.218.82.164 -> 41.177.98.176 TCP 82 60110 > http [SYN] Seq=0 Win=65535 Len=0 MSS=1460 WS=8 TSval=745642377 TSecr=0 SACK_PERM=1
727785 233.509794 90.218.82.164 -> 41.177.98.176 TCP 70 60109 > http [ACK] Seq=1 Ack=1 Win=524280 Len=0 TSval=745642377 TSecr=1563910
727794 233.512914 90.218.82.164 -> 41.177.98.176 TCP 70 60110 > http [ACK] Seq=1 Ack=1 Win=524280 Len=0 TSval=745642377 TSecr=1563910
727809 233.520885 90.218.82.164 -> 41.177.98.176 TCP 70 60109 > http [ACK] Seq=772 Ack=2897 Win=524176 Len=0 TSval=745642377 TSecr=1563910
727810 233.520908 90.218.82.164 -> 41.177.98.176 TCP 70 60109 > http [ACK] Seq=772 Ack=4345 Win=524176 Len=0 TSval=745642377 TSecr=1563910
727815 233.523238 90.218.82.164 -> 41.177.98.176 TCP 70 60110 > http [ACK] Seq=771 Ack=719 Win=524280 Len=0 TSval=745642377 TSecr=1563911
727816 233.525273 90.218.82.164 -> 41.177.98.176 TCP 70 60109 > http [ACK] Seq=772 Ack=5480 Win=524280 Len=0 TSval=745642377 TSecr=1563911
727817 233.526807 90.218.82.164 -> 41.177.98.176 TCP 70 60102 > http [ACK] Seq=1541 Ack=10728 Win=524280 Len=0 TSval=745642377 TSecr=1563912
727936 233.594475 90.218.82.164 -> 41.177.98.176 TCP 70 60110 > http [ACK] Seq=1525 Ack=1029 Win=524280 Len=0 TSval=745642378 TSecr=1563918
727948 233.596359 90.218.82.164 -> 41.177.98.176 TCP 70 60110 > http [ACK] Seq=1525 Ack=3925 Win=524176 Len=0 TSval=745642378 TSecr=1563918
727958 233.599553 90.218.82.164 -> 41.177.98.176 TCP 70 60110 > http [ACK] Seq=1525 Ack=6821 Win=524176 Len=0 TSval=745642378 TSecr=1563918
727959 233.599678 90.218.82.164 -> 41.177.98.176 TCP 70 60110 > http [ACK] Seq=1525 Ack=8269 Win=524176 Len=0 TSval=745642378 TSecr=1563919
727968 233.601689 90.218.82.164 -> 41.177.98.176 TCP 70 60110 > http [ACK] Seq=1525 Ack=11165 Win=524176 Len=0 TSval=745642378 TSecr=1563919
727974 233.602342 90.218.82.164 -> 41.177.98.176 TCP 70 60110 > http [ACK] Seq=1525 Ack=12613 Win=524176 Len=0 TSval=745642378 TSecr=1563919
728003 233.607965 90.218.82.164 -> 41.177.98.176 TCP 70 60110 > http [ACK] Seq=1525 Ack=15509 Win=524280 Len=0 TSval=745642378 TSecr=1563919
728004 233.608096 90.218.82.164 -> 41.177.98.176 TCP 70 60110 > http [ACK] Seq=1525 Ack=16957 Win=524176 Len=0 TSval=745642378 TSecr=1563919
728012 233.609800 90.218.82.164 -> 41.177.98.176 TCP 70 60110 > http [ACK] Seq=1525 Ack=19853 Win=524176 Len=0 TSval=745642378 TSecr=1563919
728017 233.610921 90.218.82.164 -> 41.177.98.176 TCP 70 60110 > http [ACK] Seq=1525 Ack=22749 Win=524280 Len=0 TSval=745642378 TSecr=1563920
728018 233.610926 90.218.82.164 -> 41.177.98.176 TCP 70 60110 > http [ACK] Seq=1525 Ack=24197 Win=524176 Len=0 TSval=745642378 TSecr=1563920
728026 233.612013 90.218.82.164 -> 41.177.98.176 TCP 70 60110 > http [ACK] Seq=1525 Ack=27093 Win=524176 Len=0 TSval=745642378 TSecr=1563920
728034 233.613723 90.218.82.164 -> 41.177.98.176 TCP 70 60110 > http [ACK] Seq=1525 Ack=29989 Win=524280 Len=0 TSval=745642378 TSecr=1563920
728035 233.613844 90.218.82.164 -> 41.177.98.176 TCP 70 60110 > http [ACK] Seq=1525 Ack=31437 Win=524176 Len=0 TSval=745642378 TSecr=1563920
728054 233.619574 90.218.82.164 -> 41.177.98.176 TCP 70 60110 > http [ACK] Seq=1525 Ack=34333 Win=524176 Len=0 TSval=745642378 TSecr=1563920
728059 233.621227 90.218.82.164 -> 41.177.98.176 TCP 70 60110 > http [ACK] Seq=1525 Ack=37229 Win=524280 Len=0 TSval=745642378 TSecr=1563920
728070 233.626063 90.218.82.164 -> 41.177.98.176 TCP 70 60110 > http [ACK] Seq=1525 Ack=38677 Win=524176 Len=0 TSval=745642378 TSecr=1563920
728073 233.627113 90.218.82.164 -> 41.177.98.176 TCP 70 60110 > http [ACK] Seq=1525 Ack=41573 Win=524280 Len=0 TSval=745642378 TSecr=1563920
728075 233.627299 90.218.82.164 -> 41.177.98.176 TCP 70 60110 > http [ACK] Seq=1525 Ack=43021 Win=524176 Len=0 TSval=745642378 TSecr=1563920
728078 233.628559 90.218.82.164 -> 41.177.98.176 TCP 70 60110 > http [ACK] Seq=1525 Ack=45917 Win=524176 Len=0 TSval=745642378 TSecr=1563920
728085 233.629763 90.218.82.164 -> 41.177.98.176 TCP 70 60110 > http [ACK] Seq=1525 Ack=48813 Win=524280 Len=0 TSval=745642378 TSecr=1563921
728086 233.629768 90.218.82.164 -> 41.177.98.176 TCP 70 60110 > http [ACK] Seq=1525 Ack=50261 Win=524176 Len=0 TSval=745642378 TSecr=1563921
728117 233.639911 90.218.82.164 -> 41.177.98.176 TCP 70 60110 > http [ACK] Seq=1525 Ack=53157 Win=524280 Len=0 TSval=745642378 TSecr=1563921
728120 233.640618 90.218.82.164 -> 41.177.98.176 TCP 70 60110 > http [ACK] Seq=1525 Ack=54605 Win=524176 Len=0 TSval=745642378 TSecr=1563921
728122 233.641327 90.218.82.164 -> 41.177.98.176 TCP 70 60110 > http [ACK] Seq=1525 Ack=57501 Win=524176 Len=0 TSval=745642378 TSecr=1563921
728190 233.671613 90.218.82.164 -> 41.177.98.176 TCP 70 60110 > http [ACK] Seq=1525 Ack=60387 Win=524184 Len=0 TSval=745642379 TSecr=1563921
728229 233.690475 90.218.82.164 -> 41.177.98.176 TCP 70 60109 > http [ACK] Seq=1536 Ack=6310 Win=524280 Len=0 TSval=745642379 TSecr=1563928
728257 233.698058 90.218.82.164 -> 41.177.98.176 TCP 70 60102 > http [ACK] Seq=2294 Ack=11037 Win=524280 Len=0 TSval=745642379 TSecr=1563929
728258 233.700214 90.218.82.164 -> 41.177.98.176 TCP 70 60102 > http [ACK] Seq=2294 Ack=13933 Win=524280 Len=0 TSval=745642379 TSecr=1563929
728259 233.700767 90.218.82.164 -> 41.177.98.176 TCP 70 60102 > http [ACK] Seq=2294 Ack=16829 Win=524280 Len=0 TSval=745642379 TSecr=1563929
728260 233.700869 90.218.82.164 -> 41.177.98.176 TCP 70 60102 > http [ACK] Seq=2294 Ack=18462 Win=524280 Len=0 TSval=745642379 TSecr=1563929
728269 233.711174 90.218.82.164 -> 41.177.98.176 TCP 70 60110 > http [ACK] Seq=2285 Ack=63283 Win=524280 Len=0 TSval=745642379 TSecr=1563930
728270 233.711819 90.218.82.164 -> 41.177.98.176 TCP 70 60110 > http [ACK] Seq=2285 Ack=66079 Win=524272 Len=0 TSval=745642379 TSecr=1563930
728291 233.722567 90.218.82.164 -> 41.177.98.176 TCP 70 60109 > http [ACK] Seq=2302 Ack=6620 Win=524280 Len=0 TSval=745642379 TSecr=1563931
728297 233.725059 90.218.82.164 -> 41.177.98.176 TCP 70 60109 > http [ACK] Seq=2302 Ack=9516 Win=524176 Len=0 TSval=745642379 TSecr=1563931
728299 233.725662 90.218.82.164 -> 41.177.98.176 TCP 70 60109 > http [ACK] Seq=2302 Ack=12412 Win=524280 Len=0 TSval=745642379 TSecr=1563931
728300 233.726450 90.218.82.164 -> 41.177.98.176 TCP 70 60109 > http [ACK] Seq=2302 Ack=14812 Win=524280 Len=0 TSval=745642379 TSecr=1563931
728303 233.727283 90.218.82.164 -> 41.177.98.176 TCP 70 60109 > http [ACK] Seq=2302 Ack=17020 Win=524280 Len=0 TSval=745642379 TSecr=1563931
728336 233.738726 90.218.82.164 -> 41.177.98.176 TCP 70 60102 > http [ACK] Seq=3058 Ack=21358 Win=524280 Len=0 TSval=745642379 TSecr=1563933
728337 233.739852 90.218.82.164 -> 41.177.98.176 TCP 70 60102 > http [ACK] Seq=3058 Ack=23698 Win=524280 Len=0 TSval=745642379 TSecr=1563933
728371 233.750136 90.218.82.164 -> 41.177.98.176 TCP 70 60110 > http [ACK] Seq=3060 Ack=66388 Win=524280 Len=0 TSval=745642380 TSecr=1563934
728372 233.750924 90.218.82.164 -> 41.177.98.176 TCP 70 60110 > http [ACK] Seq=3060 Ack=69284 Win=524280 Len=0 TSval=745642380 TSecr=1563934
728373 233.753182 90.218.82.164 -> 41.177.98.176 TCP 70 60110 > http [ACK] Seq=3060 Ack=72180 Win=524280 Len=0 TSval=745642380 TSecr=1563934
728374 233.753702 90.218.82.164 -> 41.177.98.176 TCP 70 60110 > http [ACK] Seq=3060 Ack=74580 Win=524280 Len=0 TSval=745642380 TSecr=1563934
728375 233.753799 90.218.82.164 -> 41.177.98.176 TCP 70 60110 > http [ACK] Seq=3060 Ack=75665 Win=524280 Len=0 TSval=745642380 TSecr=1563934
728404 233.768281 90.218.82.164 -> 41.177.98.176 TCP 70 60109 > http [ACK] Seq=3078 Ack=19118 Win=524280 Len=0 TSval=745642380 TSecr=1563936
728420 233.778232 90.218.82.164 -> 41.177.98.176 TCP 70 60102 > http [ACK] Seq=3817 Ack=26594 Win=524280 Len=0 TSval=745642380 TSecr=1563937
728422 233.778592 90.218.82.164 -> 41.177.98.176 TCP 70 60102 > http [ACK] Seq=3817 Ack=29306 Win=524280 Len=0 TSval=745642380 TSecr=1563937
728451 233.786739 90.218.82.164 -> 41.177.98.176 TCP 70 60110 > http [ACK] Seq=3818 Ack=75975 Win=524280 Len=0 TSval=745642380 TSecr=1563938
728470 233.790211 90.218.82.164 -> 41.177.98.176 TCP 70 60110 > http [ACK] Seq=3818 Ack=78871 Win=524280 Len=0 TSval=745642380 TSecr=1563938
728471 233.790215 90.218.82.164 -> 41.177.98.176 TCP 70 60110 > http [ACK] Seq=3818 Ack=81767 Win=524280 Len=0 TSval=745642380 TSecr=1563938
728472 233.791078 90.218.82.164 -> 41.177.98.176 TCP 70 60110 > http [ACK] Seq=3818 Ack=84167 Win=524280 Len=0 TSval=745642380 TSecr=1563938
728473 233.792048 90.218.82.164 -> 41.177.98.176 TCP 70 60110 > http [ACK] Seq=3818 Ack=87063 Win=524280 Len=0 TSval=745642380 TSecr=1563938
728474 233.792960 90.218.82.164 -> 41.177.98.176 TCP 70 60110 > http [ACK] Seq=3818 Ack=89959 Win=524280 Len=0 TSval=745642380 TSecr=1563938
728475 233.793064 90.218.82.164 -> 41.177.98.176 TCP 70 60110 > http [ACK] Seq=3818 Ack=90870 Win=524280 Len=0 TSval=745642380 TSecr=1563938
728521 233.808159 90.218.82.164 -> 41.177.98.176 TCP 70 60109 > http [ACK] Seq=3834 Ack=19427 Win=524280 Len=0 TSval=745642380 TSecr=1563940
728522 233.814263 90.218.82.164 -> 41.177.98.176 TCP 70 60109 > http [ACK] Seq=3834 Ack=22323 Win=524280 Len=0 TSval=745642380 TSecr=1563940
728523 233.814488 90.218.82.164 -> 41.177.98.176 TCP 70 60109 > http [ACK] Seq=3834 Ack=25219 Win=524280 Len=0 TSval=745642380 TSecr=1563940
728524 233.814679 90.218.82.164 -> 41.177.98.176 TCP 70 60109 > http [ACK] Seq=3834 Ack=27619 Win=524280 Len=0 TSval=745642380 TSecr=1563940
728525 233.814845 90.218.82.164 -> 41.177.98.176 TCP 70 60109 > http [ACK] Seq=3834 Ack=28440 Win=524280 Len=0 TSval=745642380 TSecr=1563940
728546 233.825562 90.218.82.164 -> 41.177.98.176 TCP 70 60102 > http [ACK] Seq=4571 Ack=29633 Win=524280 Len=0 TSval=745642380 TSecr=1563941
728578 233.855946 90.218.82.164 -> 41.177.98.176 TCP 70 60110 > http [ACK] Seq=4604 Ack=91971 Win=524280 Len=0 TSval=745642381 TSecr=1563944
728587 233.859718 90.218.82.164 -> 41.177.98.176 TCP 70 60109 > http [ACK] Seq=4621 Ack=28775 Win=524280 Len=0 TSval=745642381 TSecr=1563944
729449 234.177083 90.218.82.164 -> 41.177.98.176 TCP 70 60102 > http [ACK] Seq=5269 Ack=29926 Win=524280 Len=0 TSval=745642384 TSecr=1563977
769113 248.854629 90.218.82.164 -> 41.177.98.176 TCP 70 60109 > http [ACK] Seq=4621 Ack=28776 Win=524280 Len=0 TSval=745642530 TSecr=1565445
769114 248.854800 90.218.82.164 -> 41.177.98.176 TCP 70 60110 > http [ACK] Seq=4604 Ack=91972 Win=524280 Len=0 TSval=745642530 TSecr=1565445
769739 249.184422 90.218.82.164 -> 41.177.98.176 TCP 70 60102 > http [ACK] Seq=5269 Ack=29927 Win=524280 Len=0 TSval=745642534 TSecr=1565478
775882 249.693832 90.218.82.164 -> 41.177.98.176 TCP 70 60110 > http [FIN, ACK] Seq=4604 Ack=91972 Win=524280 Len=0 TSval=745642539 TSecr=1565445
775884 249.693992 90.218.82.164 -> 41.177.98.176 TCP 70 60102 > http [FIN, ACK] Seq=5269 Ack=29927 Win=524280 Len=0 TSval=745642539 TSecr=1565478
775885 249.694154 90.218.82.164 -> 41.177.98.176 TCP 70 60109 > http [FIN, ACK] Seq=4621 Ack=28776 Win=524280 Len=0 TSval=745642539 TSecr=1565445
775888 249.695495 90.218.82.164 -> 41.177.98.176 TCP 82 60159 > http [SYN] Seq=0 Win=65535 Len=0 MSS=1460 WS=8 TSval=745642539 TSecr=0 SACK_PERM=1
775890 249.698844 90.218.82.164 -> 41.177.98.176 TCP 70 60159 > http [ACK] Seq=1 Ack=1 Win=524280 Len=0 TSval=745642539 TSecr=1565529
777166 250.398768 90.218.82.164 -> 41.177.98.176 TCP 70 60159 > http [ACK] Seq=980 Ack=2897 Win=524176 Len=0 TSval=745642546 TSecr=1565599
777170 250.399192 90.218.82.164 -> 41.177.98.176 TCP 70 60159 > http [ACK] Seq=980 Ack=4345 Win=524176 Len=0 TSval=745642546 TSecr=1565599
777198 250.411080 90.218.82.164 -> 41.177.98.176 TCP 70 60159 > http [ACK] Seq=980 Ack=7241 Win=524176 Len=0 TSval=745642546 TSecr=1565599
777200 250.411240 90.218.82.164 -> 41.177.98.176 TCP 70 60159 > http [ACK] Seq=980 Ack=8689 Win=524176 Len=0 TSval=745642546 TSecr=1565599
777201 250.412323 90.218.82.164 -> 41.177.98.176 TCP 70 60159 > http [ACK] Seq=980 Ack=11585 Win=524176 Len=0 TSval=745642546 TSecr=1565599
777213 250.414418 90.218.82.164 -> 41.177.98.176 TCP 70 60159 > http [ACK] Seq=980 Ack=11854 Win=524280 Len=0 TSval=745642546 TSecr=1565601
777511 250.515361 90.218.82.164 -> 41.177.98.176 TCP 82 60160 > http [SYN] Seq=0 Win=65535 Len=0 MSS=1460 WS=8 TSval=745642547 TSecr=0 SACK_PERM=1
777526 250.516340 90.218.82.164 -> 41.177.98.176 TCP 82 60163 > http [SYN] Seq=0 Win=65535 Len=0 MSS=1460 WS=8 TSval=745642547 TSecr=0 SACK_PERM=1
777545 250.519257 90.218.82.164 -> 41.177.98.176 TCP 70 60160 > http [ACK] Seq=1 Ack=1 Win=524280 Len=0 TSval=745642547 TSecr=1565611
777548 250.520338 90.218.82.164 -> 41.177.98.176 TCP 70 60159 > http [ACK] Seq=1752 Ack=12151 Win=524280 Len=0 TSval=745642547 TSecr=1565611
777555 250.522566 90.218.82.164 -> 41.177.98.176 TCP 70 60159 > http [ACK] Seq=1752 Ack=15047 Win=524280 Len=0 TSval=745642547 TSecr=1565611
777556 250.522853 90.218.82.164 -> 41.177.98.176 TCP 70 60159 > http [ACK] Seq=1752 Ack=17943 Win=524280 Len=0 TSval=745642547 TSecr=1565611
777557 250.523073 90.218.82.164 -> 41.177.98.176 TCP 70 60159 > http [ACK] Seq=1752 Ack=20343 Win=524280 Len=0 TSval=745642547 TSecr=1565611
777561 250.524121 90.218.82.164 -> 41.177.98.176 TCP 70 60159 > http [ACK] Seq=1752 Ack=23239 Win=524280 Len=0 TSval=745642547 TSecr=1565611
777565 250.524233 90.218.82.164 -> 41.177.98.176 TCP 70 60159 > http [ACK] Seq=1752 Ack=24240 Win=524280 Len=0 TSval=745642547 TSecr=1565611
777566 250.524357 90.218.82.164 -> 41.177.98.176 TCP 70 60163 > http [ACK] Seq=1 Ack=1 Win=524280 Len=0 TSval=745642547 TSecr=1565611
777570 250.526003 90.218.82.164 -> 41.177.98.176 TCP 70 60160 > http [ACK] Seq=773 Ack=299 Win=524280 Len=0 TSval=745642547 TSecr=1565612
777575 250.526645 90.218.82.164 -> 41.177.98.176 TCP 70 60160 > http [ACK] Seq=773 Ack=3195 Win=524176 Len=0 TSval=745642547 TSecr=1565612
777582 250.529150 90.218.82.164 -> 41.177.98.176 TCP 70 60163 > http [ACK] Seq=778 Ack=299 Win=524280 Len=0 TSval=745642547 TSecr=1565612
777595 250.531941 90.218.82.164 -> 41.177.98.176 TCP 70 60163 > http [ACK] Seq=778 Ack=3195 Win=524176 Len=0 TSval=745642547 TSecr=1565612
777596 250.532151 90.218.82.164 -> 41.177.98.176 TCP 70 60160 > http [ACK] Seq=773 Ack=6091 Win=524176 Len=0 TSval=745642547 TSecr=1565612
777601 250.533746 90.218.82.164 -> 41.177.98.176 TCP 70 60160 > http [ACK] Seq=773 Ack=8987 Win=524176 Len=0 TSval=745642547 TSecr=1565612
777602 250.533952 90.218.82.164 -> 41.177.98.176 TCP 70 60160 > http [ACK] Seq=773 Ack=10435 Win=524176 Len=0 TSval=745642547 TSecr=1565612
777603 250.534218 90.218.82.164 -> 41.177.98.176 TCP 70 60163 > http [ACK] Seq=778 Ack=6091 Win=524176 Len=0 TSval=745642547 TSecr=1565612
777612 250.537480 90.218.82.164 -> 41.177.98.176 TCP 70 60163 > http [ACK] Seq=778 Ack=8987 Win=524176 Len=0 TSval=745642547 TSecr=1565613
777616 250.537960 90.218.82.164 -> 41.177.98.176 TCP 70 60163 > http [ACK] Seq=778 Ack=10435 Win=524176 Len=0 TSval=745642547 TSecr=1565613
777619 250.538256 90.218.82.164 -> 41.177.98.176 TCP 70 60160 > http [ACK] Seq=773 Ack=11756 Win=524280 Len=0 TSval=745642547 TSecr=1565613
777622 250.539591 90.218.82.164 -> 41.177.98.176 TCP 70 60163 > http [ACK] Seq=778 Ack=12380 Win=524280 Len=0 TSval=745642547 TSecr=1565613
790803 256.914021 90.218.82.164 -> 41.177.98.176 TCP 70 60159 > http [ACK] Seq=2692 Ack=27136 Win=524176 Len=0 TSval=745642611 TSecr=1566250
790804 256.914121 90.218.82.164 -> 41.177.98.176 TCP 70 60159 > http [ACK] Seq=2692 Ack=28584 Win=524176 Len=0 TSval=745642611 TSecr=1566250
790825 256.919868 90.218.82.164 -> 41.177.98.176 TCP 70 60159 > http [ACK] Seq=2692 Ack=31480 Win=524176 Len=0 TSval=745642611 TSecr=1566251
790827 256.920081 90.218.82.164 -> 41.177.98.176 TCP 70 60159 > http [ACK] Seq=2692 Ack=32928 Win=524176 Len=0 TSval=745642611 TSecr=1566251
790830 256.921056 90.218.82.164 -> 41.177.98.176 TCP 70 60159 > http [ACK] Seq=2692 Ack=35824 Win=524176 Len=0 TSval=745642611 TSecr=1566251
790835 256.924702 90.218.82.164 -> 41.177.98.176 TCP 70 60159 > http [ACK] Seq=2692 Ack=36438 Win=524280 Len=0 TSval=745642611 TSecr=1566251
814209 265.534937 90.218.82.164 -> 41.177.98.176 TCP 70 60163 > http [ACK] Seq=778 Ack=12381 Win=524280 Len=0 TSval=745642697 TSecr=1567113
814225 265.539040 90.218.82.164 -> 41.177.98.176 TCP 70 60160 > http [ACK] Seq=773 Ack=11757 Win=524280 Len=0 TSval=745642697 TSecr=1567113
829336 270.717119 90.218.82.164 -> 41.177.98.176 TCP 70 60160 > http [FIN, ACK] Seq=773 Ack=11757 Win=524280 Len=0 TSval=745642749 TSecr=1567113
829338 270.717277 90.218.82.164 -> 41.177.98.176 TCP 70 60163 > http [FIN, ACK] Seq=778 Ack=12381 Win=524280 Len=0 TSval=745642749 TSecr=1567113
832040 271.973794 90.218.82.164 -> 41.177.98.176 TCP 70 60159 > http [ACK] Seq=2692 Ack=36439 Win=524280 Len=0 TSval=745642761 TSecr=1567757
864607 285.720175 90.218.82.164 -> 41.177.98.176 TCP 70 60159 > http [FIN, ACK] Seq=2692 Ack=36439 Win=524280 Len=0 TSval=745642899 TSecr=1567757
