398862 134.231869 90.24.123.155 -> 244.3.210.197 TCP 70 36487 > http [SYN] Seq=0 Win=16384 Len=0 MSS=1440 WS=4 SACK_PERM=1
398916 134.254148 90.24.123.155 -> 244.3.210.197 TCP 64 36487 > http [ACK] Seq=1 Ack=1 Win=65792 Len=0
399821 134.557714 90.24.123.155 -> 244.3.210.197 TCP 64 36487 > http [ACK] Seq=908 Ack=2881 Win=65792 Len=0
399848 134.577721 90.24.123.155 -> 244.3.210.197 TCP 64 36487 > http [ACK] Seq=908 Ack=5761 Win=65792 Len=0
399859 134.590595 90.24.123.155 -> 244.3.210.197 TCP 70 36488 > http [SYN] Seq=0 Win=16384 Len=0 MSS=1440 WS=4 SACK_PERM=1
399889 134.595672 90.24.123.155 -> 244.3.210.197 TCP 70 36489 > http [SYN] Seq=0 Win=16384 Len=0 MSS=1440 WS=4 SACK_PERM=1
399923 134.599533 90.24.123.155 -> 244.3.210.197 TCP 70 36490 > http [SYN] Seq=0 Win=16384 Len=0 MSS=1440 WS=4 SACK_PERM=1
399950 134.605019 90.24.123.155 -> 244.3.210.197 TCP 70 36491 > http [SYN] Seq=0 Win=16384 Len=0 MSS=1440 WS=4 SACK_PERM=1
399973 134.609487 90.24.123.155 -> 244.3.210.197 TCP 70 36492 > http [SYN] Seq=0 Win=16384 Len=0 MSS=1440 WS=4 SACK_PERM=1
400005 134.613728 90.24.123.155 -> 244.3.210.197 TCP 70 36493 > http [SYN] Seq=0 Win=16384 Len=0 MSS=1440 WS=4 SACK_PERM=1
400006 134.613733 90.24.123.155 -> 244.3.210.197 TCP 64 36487 > http [ACK] Seq=908 Ack=8641 Win=65792 Len=0
400026 134.617695 90.24.123.155 -> 244.3.210.197 TCP 64 36487 > http [ACK] Seq=908 Ack=11521 Win=65792 Len=0
400027 134.617700 90.24.123.155 -> 244.3.210.197 TCP 64 36488 > http [ACK] Seq=1 Ack=1 Win=65792 Len=0
400042 134.622491 90.24.123.155 -> 244.3.210.197 TCP 64 36488 > http [RST, ACK] Seq=1 Ack=1 Win=0 Len=0
400043 134.622496 90.24.123.155 -> 244.3.210.197 TCP 64 36489 > http [ACK] Seq=1 Ack=1 Win=65792 Len=0
400072 134.629311 90.24.123.155 -> 244.3.210.197 TCP 64 36490 > http [ACK] Seq=1 Ack=1 Win=65792 Len=0
400080 134.629666 90.24.123.155 -> 244.3.210.197 TCP 64 36491 > http [ACK] Seq=1 Ack=1 Win=65792 Len=0
400106 134.634589 90.24.123.155 -> 244.3.210.197 TCP 64 36492 > http [ACK] Seq=1 Ack=1 Win=65792 Len=0
400163 134.644658 90.24.123.155 -> 244.3.210.197 TCP 64 36493 > http [ACK] Seq=1 Ack=1 Win=65792 Len=0
400197 134.650570 90.24.123.155 -> 244.3.210.197 TCP 64 36487 > http [ACK] Seq=908 Ack=14401 Win=65792 Len=0
400225 134.655772 90.24.123.155 -> 244.3.210.197 TCP 64 36489 > http [ACK] Seq=789 Ack=2881 Win=65792 Len=0
400226 134.655777 90.24.123.155 -> 244.3.210.197 TCP 64 36490 > http [ACK] Seq=785 Ack=2881 Win=65792 Len=0
400251 134.659648 90.24.123.155 -> 244.3.210.197 TCP 64 36491 > http [ACK] Seq=788 Ack=2881 Win=65792 Len=0
400281 134.667862 90.24.123.155 -> 244.3.210.197 TCP 64 36492 > http [ACK] Seq=792 Ack=2669 Win=65792 Len=0
400360 134.677503 90.24.123.155 -> 244.3.210.197 TCP 64 36493 > http [ACK] Seq=790 Ack=2881 Win=65792 Len=0
400400 134.681515 90.24.123.155 -> 244.3.210.197 TCP 64 36487 > http [ACK] Seq=1695 Ack=18300 Win=65792 Len=0
400461 134.687767 90.24.123.155 -> 244.3.210.197 TCP 64 36487 > http [ACK] Seq=1695 Ack=21180 Win=65792 Len=0
400499 134.691496 90.24.123.155 -> 244.3.210.197 TCP 64 36487 > http [ACK] Seq=1695 Ack=24060 Win=65792 Len=0
400515 134.695890 90.24.123.155 -> 244.3.210.197 TCP 64 36489 > http [ACK] Seq=789 Ack=5761 Win=65792 Len=0
400630 134.716781 90.24.123.155 -> 244.3.210.197 TCP 64 36492 > http [ACK] Seq=1575 Ack=5549 Win=65792 Len=0
400678 134.721584 90.24.123.155 -> 244.3.210.197 TCP 64 36493 > http [ACK] Seq=790 Ack=5761 Win=65792 Len=0
400711 134.727916 90.24.123.155 -> 244.3.210.197 TCP 64 36489 > http [ACK] Seq=789 Ack=10381 Win=65792 Len=0
400733 134.737771 90.24.123.155 -> 244.3.210.197 TCP 64 36487 > http [ACK] Seq=2479 Ack=28729 Win=65792 Len=0
400765 134.747779 90.24.123.155 -> 244.3.210.197 TCP 64 36490 > http [ACK] Seq=1563 Ack=6245 Win=65792 Len=0
400792 134.751704 90.24.123.155 -> 244.3.210.197 TCP 64 36490 > http [ACK] Seq=1563 Ack=9125 Win=65792 Len=0
400827 134.755793 90.24.123.155 -> 244.3.210.197 TCP 64 36492 > http [ACK] Seq=1575 Ack=8429 Win=65792 Len=0
400845 134.760252 90.24.123.155 -> 244.3.210.197 TCP 64 36492 > http [ACK] Seq=1575 Ack=11309 Win=65792 Len=0
400846 134.760257 90.24.123.155 -> 244.3.210.197 TCP 64 36491 > http [ACK] Seq=1575 Ack=6181 Win=65792 Len=0
400847 134.760261 90.24.123.155 -> 244.3.210.197 TCP 64 36491 > http [ACK] Seq=1575 Ack=9061 Win=65792 Len=0
400848 134.760264 90.24.123.155 -> 244.3.210.197 TCP 64 36493 > http [ACK] Seq=790 Ack=8641 Win=65792 Len=0
400901 134.768465 90.24.123.155 -> 244.3.210.197 TCP 64 36493 > http [ACK] Seq=790 Ack=11075 Win=65792 Len=0
400908 134.768814 90.24.123.155 -> 244.3.210.197 TCP 64 36489 > http [ACK] Seq=1588 Ack=13261 Win=65792 Len=0
400909 134.768818 90.24.123.155 -> 244.3.210.197 TCP 64 36489 > http [ACK] Seq=1588 Ack=15133 Win=65792 Len=0
400938 134.774661 90.24.123.155 -> 244.3.210.197 TCP 64 36487 > http [ACK] Seq=3267 Ack=32481 Win=65792 Len=0
400964 134.780926 90.24.123.155 -> 244.3.210.197 TCP 64 36487 > http [ACK] Seq=3267 Ack=33078 Win=65792 Len=0
400966 134.781002 90.24.123.155 -> 244.3.210.197 TCP 64 36490 > http [ACK] Seq=1563 Ack=12005 Win=65792 Len=0
400967 134.781006 90.24.123.155 -> 244.3.210.197 TCP 64 36490 > http [ACK] Seq=1563 Ack=14885 Win=65792 Len=0
400968 134.781010 90.24.123.155 -> 244.3.210.197 TCP 64 36490 > http [ACK] Seq=1563 Ack=17765 Win=65792 Len=0
401090 134.793821 90.24.123.155 -> 244.3.210.197 TCP 64 36491 > http [ACK] Seq=1575 Ack=11941 Win=65792 Len=0
401091 134.793825 90.24.123.155 -> 244.3.210.197 TCP 64 36491 > http [ACK] Seq=1575 Ack=14821 Win=65792 Len=0
401092 134.793830 90.24.123.155 -> 244.3.210.197 TCP 64 36491 > http [ACK] Seq=1575 Ack=17701 Win=65792 Len=0
401093 134.793834 90.24.123.155 -> 244.3.210.197 TCP 64 36493 > http [ACK] Seq=1572 Ack=13955 Win=65792 Len=0
401131 134.797765 90.24.123.155 -> 244.3.210.197 TCP 64 36493 > http [ACK] Seq=1572 Ack=16835 Win=65792 Len=0
401132 134.797770 90.24.123.155 -> 244.3.210.197 TCP 64 36493 > http [ACK] Seq=1572 Ack=19715 Win=65792 Len=0
401133 134.797774 90.24.123.155 -> 244.3.210.197 TCP 64 36489 > http [ACK] Seq=2373 Ack=18885 Win=65792 Len=0
401155 134.804030 90.24.123.155 -> 244.3.210.197 TCP 64 36489 > http [ACK] Seq=2373 Ack=22637 Win=65792 Len=0
401156 134.804035 90.24.123.155 -> 244.3.210.197 TCP 64 36489 > http [ACK] Seq=2373 Ack=25213 Win=65792 Len=0
401157 134.804039 90.24.123.155 -> 244.3.210.197 TCP 64 36490 > http [ACK] Seq=1563 Ack=22085 Win=65792 Len=0
401203 134.808539 90.24.123.155 -> 244.3.210.197 TCP 64 36490 > http [ACK] Seq=1563 Ack=24965 Win=65792 Len=0
401238 134.813500 90.24.123.155 -> 244.3.210.197 TCP 64 36490 > http [ACK] Seq=1563 Ack=27845 Win=65792 Len=0
401284 134.825163 90.24.123.155 -> 244.3.210.197 TCP 64 36490 > http [ACK] Seq=1563 Ack=30725 Win=65792 Len=0
401285 134.825168 90.24.123.155 -> 244.3.210.197 TCP 64 36487 > http [ACK] Seq=4051 Ack=35958 Win=65792 Len=0
401286 134.825172 90.24.123.155 -> 244.3.210.197 TCP 64 36487 > http [ACK] Seq=4051 Ack=38838 Win=65792 Len=0
401287 134.825176 90.24.123.155 -> 244.3.210.197 TCP 64 36487 > http [ACK] Seq=4051 Ack=41718 Win=65792 Len=0
401288 134.825180 90.24.123.155 -> 244.3.210.197 TCP 64 36487 > http [ACK] Seq=4051 Ack=44598 Win=65792 Len=0
401289 134.825195 90.24.123.155 -> 244.3.210.197 TCP 64 36487 > http [ACK] Seq=4051 Ack=47478 Win=65792 Len=0
401290 134.825199 90.24.123.155 -> 244.3.210.197 TCP 64 36487 > http [ACK] Seq=4051 Ack=50358 Win=65792 Len=0
401291 134.825204 90.24.123.155 -> 244.3.210.197 TCP 64 36487 > http [ACK] Seq=4051 Ack=53238 Win=65792 Len=0
401292 134.825208 90.24.123.155 -> 244.3.210.197 TCP 64 36487 > http [ACK] Seq=4051 Ack=54678 Win=65792 Len=0
401293 134.825212 90.24.123.155 -> 244.3.210.197 TCP 64 [TCP Dup ACK 401292#1] 36487 > http [ACK] Seq=4051 Ack=54678 Win=65792 Len=0
401294 134.825248 90.24.123.155 -> 244.3.210.197 TCP 64 36492 > http [ACK] Seq=2367 Ack=15606 Win=65792 Len=0
401295 134.825252 90.24.123.155 -> 244.3.210.197 TCP 64 36492 > http [ACK] Seq=2367 Ack=17716 Win=65792 Len=0
401443 134.844053 90.24.123.155 -> 244.3.210.197 TCP 64 36491 > http [ACK] Seq=1575 Ack=22021 Win=65792 Len=0
401444 134.844058 90.24.123.155 -> 244.3.210.197 TCP 64 36491 > http [ACK] Seq=1575 Ack=26341 Win=65792 Len=0
401445 134.844062 90.24.123.155 -> 244.3.210.197 TCP 64 36491 > http [ACK] Seq=1575 Ack=29221 Win=65792 Len=0
401446 134.844067 90.24.123.155 -> 244.3.210.197 TCP 64 36493 > http [ACK] Seq=1572 Ack=21853 Win=65792 Len=0
401478 134.845063 90.24.123.155 -> 244.3.210.197 TCP 64 36491 > http [ACK] Seq=1575 Ack=30661 Win=65792 Len=0
401482 134.845355 90.24.123.155 -> 244.3.210.197 TCP 64 36489 > http [ACK] Seq=2373 Ack=29533 Win=65792 Len=0
401483 134.845359 90.24.123.155 -> 244.3.210.197 TCP 64 36489 > http [ACK] Seq=2373 Ack=35293 Win=65792 Len=0
401484 134.845363 90.24.123.155 -> 244.3.210.197 TCP 64 36489 > http [ACK] Seq=2373 Ack=39613 Win=65792 Len=0
401485 134.845367 90.24.123.155 -> 244.3.210.197 TCP 64 36490 > http [ACK] Seq=1563 Ack=37606 Win=65792 Len=0
401534 134.849912 90.24.123.155 -> 244.3.210.197 TCP 64 [TCP Dup ACK 401484#1] 36489 > http [ACK] Seq=2373 Ack=39613 Win=65792 Len=0
401535 134.849917 90.24.123.155 -> 244.3.210.197 TCP 64 [TCP Dup ACK 401484#2] 36489 > http [ACK] Seq=2373 Ack=39613 Win=65792 Len=0
401577 134.868539 90.24.123.155 -> 244.3.210.197 TCP 64 36487 > http [ACK] Seq=4051 Ack=57558 Win=65792 Len=0
401578 134.868544 90.24.123.155 -> 244.3.210.197 TCP 64 36487 > http [ACK] Seq=4051 Ack=61878 Win=65792 Len=0
401579 134.868548 90.24.123.155 -> 244.3.210.197 TCP 64 36487 > http [ACK] Seq=4051 Ack=64758 Win=65792 Len=0
401580 134.868552 90.24.123.155 -> 244.3.210.197 TCP 64 36487 > http [ACK] Seq=4051 Ack=67638 Win=65792 Len=0
401581 134.868556 90.24.123.155 -> 244.3.210.197 TCP 64 36487 > http [ACK] Seq=4051 Ack=70518 Win=65792 Len=0
401582 134.868570 90.24.123.155 -> 244.3.210.197 TCP 64 36487 > http [ACK] Seq=4051 Ack=73398 Win=65792 Len=0
401583 134.868574 90.24.123.155 -> 244.3.210.197 TCP 64 36487 > http [ACK] Seq=4051 Ack=80598 Win=65792 Len=0
401584 134.868578 90.24.123.155 -> 244.3.210.197 TCP 64 36487 > http [ACK] Seq=4051 Ack=87798 Win=65792 Len=0
401585 134.868582 90.24.123.155 -> 244.3.210.197 TCP 64 36492 > http [ACK] Seq=3155 Ack=21172 Win=65792 Len=0
401586 134.868586 90.24.123.155 -> 244.3.210.197 TCP 64 [TCP Dup ACK 401584#1] 36487 > http [ACK] Seq=4051 Ack=87798 Win=65792 Len=0
401587 134.868628 90.24.123.155 -> 244.3.210.197 TCP 64 [TCP Dup ACK 401584#2] 36487 > http [ACK] Seq=4051 Ack=87798 Win=65792 Len=0
401588 134.868631 90.24.123.155 -> 244.3.210.197 TCP 64 36491 > http [ACK] Seq=1575 Ack=33541 Win=65792 Len=0
401677 134.882540 90.24.123.155 -> 244.3.210.197 TCP 64 36491 > http [ACK] Seq=1575 Ack=36421 Win=65792 Len=0
401678 134.882545 90.24.123.155 -> 244.3.210.197 TCP 64 36491 > http [ACK] Seq=1575 Ack=39301 Win=65792 Len=0
401679 134.882550 90.24.123.155 -> 244.3.210.197 TCP 64 36491 > http [ACK] Seq=1575 Ack=42181 Win=65792 Len=0
401680 134.882554 90.24.123.155 -> 244.3.210.197 TCP 64 36491 > http [ACK] Seq=1575 Ack=46501 Win=65792 Len=0
401681 134.882558 90.24.123.155 -> 244.3.210.197 TCP 64 36491 > http [ACK] Seq=1575 Ack=49381 Win=65792 Len=0
401682 134.882585 90.24.123.155 -> 244.3.210.197 TCP 64 36489 > http [ACK] Seq=2373 Ack=43933 Win=65792 Len=0
401683 134.882589 90.24.123.155 -> 244.3.210.197 TCP 64 36489 > http [ACK] Seq=2373 Ack=48253 Win=65792 Len=0
401684 134.882593 90.24.123.155 -> 244.3.210.197 TCP 64 36489 > http [ACK] Seq=2373 Ack=52573 Win=65792 Len=0
401685 134.882607 90.24.123.155 -> 244.3.210.197 TCP 64 36493 > http [ACK] Seq=2353 Ack=24733 Win=65792 Len=0
401686 134.882611 90.24.123.155 -> 244.3.210.197 TCP 64 36493 > http [ACK] Seq=2353 Ack=29357 Win=65792 Len=0
401687 134.882615 90.24.123.155 -> 244.3.210.197 TCP 64 36493 > http [ACK] Seq=2353 Ack=31933 Win=65792 Len=0
401688 134.882619 90.24.123.155 -> 244.3.210.197 TCP 64 36489 > http [ACK] Seq=2373 Ack=53275 Win=65792 Len=0
401797 134.892431 90.24.123.155 -> 244.3.210.197 TCP 70 [TCP Dup ACK 401688#1] 36489 > http [ACK] Seq=2373 Ack=53275 Win=65792 Len=0 SLE=39613 SRE=41053
401798 134.892436 90.24.123.155 -> 244.3.210.197 TCP 64 36487 > http [ACK] Seq=4051 Ack=90678 Win=65792 Len=0
401816 134.897702 90.24.123.155 -> 244.3.210.197 TCP 64 36487 > http [ACK] Seq=4051 Ack=93558 Win=65792 Len=0
401838 134.901750 90.24.123.155 -> 244.3.210.197 TCP 64 36487 > http [ACK] Seq=4051 Ack=96438 Win=65792 Len=0
401846 134.907718 90.24.123.155 -> 244.3.210.197 TCP 70 36487 > http [ACK] Seq=4051 Ack=97667 Win=65792 Len=0 SLE=87798 SRE=89238
401856 134.911930 90.24.123.155 -> 244.3.210.197 TCP 64 36491 > http [ACK] Seq=1575 Ack=53701 Win=65792 Len=0
401857 134.911935 90.24.123.155 -> 244.3.210.197 TCP 64 36491 > http [ACK] Seq=1575 Ack=56581 Win=65792 Len=0
401899 134.915890 90.24.123.155 -> 244.3.210.197 TCP 64 36491 > http [ACK] Seq=1575 Ack=59461 Win=65792 Len=0
401911 134.920150 90.24.123.155 -> 244.3.210.197 TCP 64 36491 > http [ACK] Seq=1575 Ack=62341 Win=65792 Len=0
401912 134.920156 90.24.123.155 -> 244.3.210.197 TCP 64 36491 > http [ACK] Seq=1575 Ack=65221 Win=65792 Len=0
401962 134.933912 90.24.123.155 -> 244.3.210.197 TCP 64 36491 > http [ACK] Seq=1575 Ack=68101 Win=65792 Len=0
401963 134.933916 90.24.123.155 -> 244.3.210.197 TCP 64 36491 > http [ACK] Seq=1575 Ack=70981 Win=65792 Len=0
401964 134.933920 90.24.123.155 -> 244.3.210.197 TCP 64 36491 > http [ACK] Seq=1575 Ack=73861 Win=65792 Len=0
401965 134.933924 90.24.123.155 -> 244.3.210.197 TCP 64 36491 > http [ACK] Seq=1575 Ack=76741 Win=65792 Len=0
401966 134.933928 90.24.123.155 -> 244.3.210.197 TCP 64 36491 > http [ACK] Seq=1575 Ack=79621 Win=65792 Len=0
402023 134.941960 90.24.123.155 -> 244.3.210.197 TCP 64 36491 > http [ACK] Seq=1575 Ack=82501 Win=65792 Len=0
402024 134.941965 90.24.123.155 -> 244.3.210.197 TCP 64 36491 > http [ACK] Seq=1575 Ack=85381 Win=65792 Len=0
402025 134.941969 90.24.123.155 -> 244.3.210.197 TCP 64 36491 > http [ACK] Seq=1575 Ack=88261 Win=65792 Len=0
402026 134.941973 90.24.123.155 -> 244.3.210.197 TCP 64 36491 > http [ACK] Seq=1575 Ack=91141 Win=65792 Len=0
402027 134.941976 90.24.123.155 -> 244.3.210.197 TCP 64 36491 > http [ACK] Seq=1575 Ack=94021 Win=65792 Len=0
402098 134.955672 90.24.123.155 -> 244.3.210.197 TCP 64 36491 > http [ACK] Seq=1575 Ack=96901 Win=65792 Len=0
402099 134.955677 90.24.123.155 -> 244.3.210.197 TCP 64 36491 > http [ACK] Seq=1575 Ack=99781 Win=65792 Len=0
402100 134.955681 90.24.123.155 -> 244.3.210.197 TCP 64 36491 > http [ACK] Seq=1575 Ack=102661 Win=65792 Len=0
402148 134.959827 90.24.123.155 -> 244.3.210.197 TCP 64 36491 > http [ACK] Seq=1575 Ack=105541 Win=65792 Len=0
402161 134.963682 90.24.123.155 -> 244.3.210.197 TCP 64 36491 > http [ACK] Seq=1575 Ack=109861 Win=65792 Len=0
402181 134.968070 90.24.123.155 -> 244.3.210.197 TCP 64 36491 > http [ACK] Seq=1575 Ack=114181 Win=65792 Len=0
402182 134.968074 90.24.123.155 -> 244.3.210.197 TCP 64 36491 > http [ACK] Seq=1575 Ack=117061 Win=65792 Len=0
402194 134.968437 90.24.123.155 -> 244.3.210.197 TCP 64 36491 > http [ACK] Seq=1575 Ack=119941 Win=65792 Len=0
402195 134.968442 90.24.123.155 -> 244.3.210.197 TCP 64 36491 > http [ACK] Seq=1575 Ack=122821 Win=65792 Len=0
402196 134.968446 90.24.123.155 -> 244.3.210.197 TCP 64 36491 > http [ACK] Seq=1575 Ack=127117 Win=65792 Len=0
402216 134.977719 90.24.123.155 -> 244.3.210.197 TCP 64 36491 > http [ACK] Seq=1575 Ack=131461 Win=65792 Len=0
402217 134.977723 90.24.123.155 -> 244.3.210.197 TCP 64 36491 > http [ACK] Seq=1575 Ack=137625 Win=65792 Len=0
402218 134.977728 90.24.123.155 -> 244.3.210.197 TCP 64 [TCP Dup ACK 402217#1] 36491 > http [ACK] Seq=1575 Ack=137625 Win=65792 Len=0
402219 134.977732 90.24.123.155 -> 244.3.210.197 TCP 64 [TCP Dup ACK 402217#2] 36491 > http [ACK] Seq=1575 Ack=137625 Win=65792 Len=0
402405 135.015685 90.24.123.155 -> 244.3.210.197 TCP 64 36490 > http [ACK] Seq=2348 Ack=40486 Win=65792 Len=0
402432 135.019737 90.24.123.155 -> 244.3.210.197 TCP 64 36490 > http [ACK] Seq=2348 Ack=42509 Win=65792 Len=0
402443 135.024113 90.24.123.155 -> 244.3.210.197 TCP 64 36492 > http [ACK] Seq=3941 Ack=24052 Win=65792 Len=0
402458 135.027788 90.24.123.155 -> 244.3.210.197 TCP 64 36492 > http [ACK] Seq=3941 Ack=26932 Win=65792 Len=0
402475 135.031742 90.24.123.155 -> 244.3.210.197 TCP 64 36492 > http [ACK] Seq=3941 Ack=31252 Win=65792 Len=0
402485 135.035798 90.24.123.155 -> 244.3.210.197 TCP 64 36492 > http [ACK] Seq=3941 Ack=35572 Win=65792 Len=0
402501 135.039635 90.24.123.155 -> 244.3.210.197 TCP 64 36489 > http [ACK] Seq=3159 Ack=56155 Win=65792 Len=0
402533 135.043926 90.24.123.155 -> 244.3.210.197 TCP 64 36489 > http [ACK] Seq=3159 Ack=59035 Win=65792 Len=0
402542 135.047866 90.24.123.155 -> 244.3.210.197 TCP 64 36489 > http [ACK] Seq=3159 Ack=61915 Win=65792 Len=0
402543 135.047870 90.24.123.155 -> 244.3.210.197 TCP 64 36493 > http [ACK] Seq=3137 Ack=36937 Win=65792 Len=0
402556 135.052140 90.24.123.155 -> 244.3.210.197 TCP 64 36493 > http [ACK] Seq=3137 Ack=40385 Win=65792 Len=0
402557 135.052145 90.24.123.155 -> 244.3.210.197 TCP 64 36493 > http [ACK] Seq=3137 Ack=43265 Win=65792 Len=0
402558 135.052149 90.24.123.155 -> 244.3.210.197 TCP 64 36492 > http [ACK] Seq=3941 Ack=38452 Win=65792 Len=0
402575 135.057866 90.24.123.155 -> 244.3.210.197 TCP 64 36492 > http [ACK] Seq=3941 Ack=41332 Win=65792 Len=0
402576 135.057870 90.24.123.155 -> 244.3.210.197 TCP 64 36492 > http [ACK] Seq=3941 Ack=44212 Win=65792 Len=0
402577 135.057874 90.24.123.155 -> 244.3.210.197 TCP 64 36492 > http [ACK] Seq=3941 Ack=47092 Win=65792 Len=0
402578 135.057878 90.24.123.155 -> 244.3.210.197 TCP 64 36492 > http [ACK] Seq=3941 Ack=49972 Win=65792 Len=0
402579 135.057883 90.24.123.155 -> 244.3.210.197 TCP 64 36492 > http [ACK] Seq=3941 Ack=52083 Win=65792 Len=0
402643 135.067722 90.24.123.155 -> 244.3.210.197 TCP 64 36489 > http [ACK] Seq=3159 Ack=64795 Win=65792 Len=0
402644 135.067727 90.24.123.155 -> 244.3.210.197 TCP 64 36489 > http [ACK] Seq=3159 Ack=68283 Win=65792 Len=0
402664 135.071514 90.24.123.155 -> 244.3.210.197 TCP 64 36489 > http [ACK] Seq=3159 Ack=70555 Win=65792 Len=0
402717 135.089555 90.24.123.155 -> 244.3.210.197 TCP 64 36489 > http [ACK] Seq=3159 Ack=73435 Win=65792 Len=0
402741 135.093785 90.24.123.155 -> 244.3.210.197 TCP 64 36489 > http [ACK] Seq=3159 Ack=77755 Win=65792 Len=0
402754 135.098504 90.24.123.155 -> 244.3.210.197 TCP 64 36489 > http [ACK] Seq=3159 Ack=80635 Win=65792 Len=0
402773 135.111518 90.24.123.155 -> 244.3.210.197 TCP 64 36489 > http [ACK] Seq=3159 Ack=82521 Win=65792 Len=0
402852 135.147693 90.24.123.155 -> 244.3.210.197 TCP 64 36487 > http [ACK] Seq=4838 Ack=100364 Win=65792 Len=0
402865 135.151734 90.24.123.155 -> 244.3.210.197 TCP 64 36491 > http [ACK] Seq=2352 Ack=139934 Win=65792 Len=0
403275 135.240366 90.24.123.155 -> 244.3.210.197 TCP 64 36490 > http [ACK] Seq=3157 Ack=45389 Win=65792 Len=0
403276 135.240370 90.24.123.155 -> 244.3.210.197 TCP 64 36490 > http [ACK] Seq=3157 Ack=48269 Win=65792 Len=0
403277 135.240374 90.24.123.155 -> 244.3.210.197 TCP 64 36490 > http [ACK] Seq=3157 Ack=51149 Win=65792 Len=0
403278 135.240379 90.24.123.155 -> 244.3.210.197 TCP 64 36490 > http [ACK] Seq=3157 Ack=54029 Win=65792 Len=0
403279 135.240383 90.24.123.155 -> 244.3.210.197 TCP 64 36490 > http [ACK] Seq=3157 Ack=55469 Win=65792 Len=0
403280 135.240401 90.24.123.155 -> 244.3.210.197 TCP 64 36490 > http [ACK] Seq=3157 Ack=58349 Win=65792 Len=0
403281 135.240405 90.24.123.155 -> 244.3.210.197 TCP 64 36490 > http [ACK] Seq=3157 Ack=61229 Win=65792 Len=0
403282 135.240409 90.24.123.155 -> 244.3.210.197 TCP 64 36490 > http [ACK] Seq=3157 Ack=64109 Win=65792 Len=0
403283 135.240413 90.24.123.155 -> 244.3.210.197 TCP 64 36493 > http [ACK] Seq=3943 Ack=46733 Win=65792 Len=0
403284 135.240417 90.24.123.155 -> 244.3.210.197 TCP 64 36493 > http [ACK] Seq=3943 Ack=49613 Win=65792 Len=0
403285 135.240432 90.24.123.155 -> 244.3.210.197 TCP 64 36493 > http [ACK] Seq=3943 Ack=52493 Win=65792 Len=0
403286 135.240436 90.24.123.155 -> 244.3.210.197 TCP 64 36493 > http [ACK] Seq=3943 Ack=57285 Win=65792 Len=0
403386 135.249076 90.24.123.155 -> 244.3.210.197 TCP 64 36492 > http [ACK] Seq=4749 Ack=55835 Win=65792 Len=0
403387 135.249080 90.24.123.155 -> 244.3.210.197 TCP 64 36492 > http [ACK] Seq=4749 Ack=59587 Win=65792 Len=0
403388 135.249084 90.24.123.155 -> 244.3.210.197 TCP 64 36492 > http [ACK] Seq=4749 Ack=62163 Win=65792 Len=0
403389 135.249088 90.24.123.155 -> 244.3.210.197 TCP 64 36492 > http [ACK] Seq=4749 Ack=65123 Win=65792 Len=0
403390 135.249092 90.24.123.155 -> 244.3.210.197 TCP 64 [TCP Dup ACK 403389#1] 36492 > http [ACK] Seq=4749 Ack=65123 Win=65792 Len=0
403522 135.283792 90.24.123.155 -> 244.3.210.197 TCP 64 36490 > http [ACK] Seq=3157 Ack=66989 Win=65792 Len=0
403523 135.283796 90.24.123.155 -> 244.3.210.197 TCP 64 36490 > http [ACK] Seq=3157 Ack=69869 Win=65792 Len=0
403524 135.283800 90.24.123.155 -> 244.3.210.197 TCP 64 36490 > http [ACK] Seq=3157 Ack=72749 Win=65792 Len=0
403525 135.283804 90.24.123.155 -> 244.3.210.197 TCP 64 36490 > http [ACK] Seq=3157 Ack=75629 Win=65792 Len=0
403526 135.283808 90.24.123.155 -> 244.3.210.197 TCP 64 36490 > http [ACK] Seq=3157 Ack=78509 Win=65792 Len=0
403587 135.292612 90.24.123.155 -> 244.3.210.197 TCP 64 36490 > http [ACK] Seq=3157 Ack=81120 Win=65792 Len=0
403594 135.292828 90.24.123.155 -> 244.3.210.197 TCP 64 36493 > http [ACK] Seq=4741 Ack=58983 Win=65792 Len=0
403595 135.292832 90.24.123.155 -> 244.3.210.197 TCP 64 36489 > http [ACK] Seq=4730 Ack=84931 Win=65792 Len=0
403596 135.292836 90.24.123.155 -> 244.3.210.197 TCP 64 36487 > http [ACK] Seq=6409 Ack=103442 Win=65792 Len=0
403666 135.304614 90.24.123.155 -> 244.3.210.197 TCP 64 36492 > http [ACK] Seq=5534 Ack=67936 Win=65792 Len=0
403727 135.316164 90.24.123.155 -> 244.3.210.197 TCP 64 36491 > http [ACK] Seq=3930 Ack=143303 Win=65792 Len=0
403728 135.316168 90.24.123.155 -> 244.3.210.197 TCP 64 36491 > http [ACK] Seq=3930 Ack=145477 Win=65792 Len=0
403796 135.333577 90.24.123.155 -> 244.3.210.197 TCP 64 36493 > http [ACK] Seq=5536 Ack=62735 Win=65792 Len=0
403797 135.333582 90.24.123.155 -> 244.3.210.197 TCP 64 36493 > http [ACK] Seq=5536 Ack=66183 Win=65792 Len=0
403815 135.340386 90.24.123.155 -> 244.3.210.197 TCP 64 36493 > http [ACK] Seq=5536 Ack=68889 Win=65792 Len=0
403822 135.340712 90.24.123.155 -> 244.3.210.197 TCP 64 36489 > http [ACK] Seq=5521 Ack=87672 Win=65792 Len=0
403899 135.358727 90.24.123.155 -> 244.3.210.197 TCP 64 36491 > http [ACK] Seq=4728 Ack=148506 Win=65792 Len=0
403983 135.381601 90.24.123.155 -> 244.3.210.197 TCP 64 36492 > http [ACK] Seq=7124 Ack=71145 Win=65792 Len=0
403999 135.387597 90.24.123.155 -> 244.3.210.197 TCP 64 36492 > http [ACK] Seq=7124 Ack=73253 Win=65792 Len=0
404011 135.391491 90.24.123.155 -> 244.3.210.197 TCP 64 36491 > http [ACK] Seq=5524 Ack=151088 Win=65792 Len=0
404019 135.395558 90.24.123.155 -> 244.3.210.197 TCP 64 36490 > http [ACK] Seq=5539 Ack=85019 Win=65792 Len=0
404064 135.399598 90.24.123.155 -> 244.3.210.197 TCP 64 36490 > http [ACK] Seq=5539 Ack=86870 Win=65792 Len=0
404556 135.563683 90.24.123.155 -> 244.3.210.197 TCP 64 36489 > http [ACK] Seq=6324 Ack=88213 Win=65792 Len=0
404582 135.568032 90.24.123.155 -> 244.3.210.197 TCP 64 36487 > http [ACK] Seq=8015 Ack=104383 Win=65792 Len=0
404699 135.595670 90.24.123.155 -> 244.3.210.197 TCP 64 36493 > http [ACK] Seq=7112 Ack=69803 Win=65792 Len=0
413246 137.983960 90.24.123.155 -> 244.3.210.197 TCP 64 36489 > http [ACK] Seq=7387 Ack=91093 Win=65792 Len=0
413257 137.987719 90.24.123.155 -> 244.3.210.197 TCP 64 36489 > http [ACK] Seq=7387 Ack=93973 Win=65792 Len=0
413271 137.991960 90.24.123.155 -> 244.3.210.197 TCP 64 36489 > http [ACK] Seq=7387 Ack=96853 Win=65792 Len=0
413279 137.995567 90.24.123.155 -> 244.3.210.197 TCP 64 36489 > http [ACK] Seq=7387 Ack=99733 Win=65792 Len=0
413300 138.007921 90.24.123.155 -> 244.3.210.197 TCP 64 36489 > http [ACK] Seq=7387 Ack=102613 Win=65792 Len=0
413307 138.011555 90.24.123.155 -> 244.3.210.197 TCP 64 36489 > http [ACK] Seq=7387 Ack=105493 Win=65792 Len=0
413327 138.015712 90.24.123.155 -> 244.3.210.197 TCP 64 36489 > http [ACK] Seq=7387 Ack=107642 Win=65792 Len=0
413557 138.163526 90.24.123.155 -> 244.3.210.197 TCP 64 36487 > http [ACK] Seq=8889 Ack=107263 Win=65792 Len=0
413572 138.167805 90.24.123.155 -> 244.3.210.197 TCP 64 36487 > http [ACK] Seq=8889 Ack=110143 Win=65792 Len=0
413584 138.171607 90.24.123.155 -> 244.3.210.197 TCP 64 36487 > http [ACK] Seq=8889 Ack=113023 Win=65792 Len=0
413604 138.175562 90.24.123.155 -> 244.3.210.197 TCP 64 36487 > http [ACK] Seq=8889 Ack=115903 Win=65792 Len=0
413618 138.179750 90.24.123.155 -> 244.3.210.197 TCP 64 36487 > http [ACK] Seq=8889 Ack=118783 Win=65792 Len=0
413634 138.183574 90.24.123.155 -> 244.3.210.197 TCP 64 36487 > http [ACK] Seq=8889 Ack=123103 Win=65792 Len=0
413653 138.188198 90.24.123.155 -> 244.3.210.197 TCP 64 36487 > http [ACK] Seq=8889 Ack=125983 Win=65792 Len=0
413654 138.188203 90.24.123.155 -> 244.3.210.197 TCP 64 36492 > http [ACK] Seq=7986 Ack=76133 Win=65792 Len=0
413672 138.191930 90.24.123.155 -> 244.3.210.197 TCP 64 36492 > http [ACK] Seq=7986 Ack=79013 Win=65792 Len=0
413673 138.191935 90.24.123.155 -> 244.3.210.197 TCP 64 36492 > http [ACK] Seq=7986 Ack=83333 Win=65792 Len=0
413674 138.191939 90.24.123.155 -> 244.3.210.197 TCP 64 36492 > http [ACK] Seq=7986 Ack=87388 Win=65792 Len=0
413742 138.212123 90.24.123.155 -> 244.3.210.197 TCP 64 [TCP Dup ACK 413674#1] 36492 > http [ACK] Seq=7986 Ack=87388 Win=65792 Len=0
413743 138.212128 90.24.123.155 -> 244.3.210.197 TCP 64 36487 > http [ACK] Seq=8889 Ack=128863 Win=65792 Len=0
413744 138.212132 90.24.123.155 -> 244.3.210.197 TCP 64 36487 > http [ACK] Seq=8889 Ack=130507 Win=65792 Len=0
414181 138.338669 90.24.123.155 -> 244.3.210.197 TCP 64 36491 > http [ACK] Seq=6407 Ack=153968 Win=65792 Len=0
414182 138.338673 90.24.123.155 -> 244.3.210.197 TCP 64 36491 > http [ACK] Seq=6407 Ack=155890 Win=65792 Len=0
414227 138.348728 90.24.123.155 -> 244.3.210.197 TCP 64 36493 > http [ACK] Seq=7993 Ack=71891 Win=65792 Len=0
414236 138.348960 90.24.123.155 -> 244.3.210.197 TCP 64 36490 > http [ACK] Seq=6420 Ack=88962 Win=65792 Len=0
414289 138.354914 90.24.123.155 -> 244.3.210.197 TCP 64 36489 > http [ACK] Seq=8268 Ack=109848 Win=65792 Len=0
414319 138.360718 90.24.123.155 -> 244.3.210.197 TCP 64 36492 > http [ACK] Seq=8867 Ack=89360 Win=65792 Len=0
414373 138.367847 90.24.123.155 -> 244.3.210.197 TCP 64 36487 > http [ACK] Seq=9745 Ack=133387 Win=65792 Len=0
414374 138.367852 90.24.123.155 -> 244.3.210.197 TCP 64 36487 > http [ACK] Seq=9745 Ack=135074 Win=65792 Len=0
414414 138.375695 90.24.123.155 -> 244.3.210.197 TCP 64 36491 > http [ACK] Seq=7288 Ack=158229 Win=65792 Len=0
414439 138.379773 90.24.123.155 -> 244.3.210.197 TCP 64 36493 > http [ACK] Seq=8874 Ack=73969 Win=65792 Len=0
414461 138.387792 90.24.123.155 -> 244.3.210.197 TCP 64 36489 > http [ACK] Seq=9128 Ack=112728 Win=65792 Len=0
414520 138.391502 90.24.123.155 -> 244.3.210.197 TCP 64 36489 > http [ACK] Seq=9128 Ack=115608 Win=65792 Len=0
414548 138.396083 90.24.123.155 -> 244.3.210.197 TCP 64 36489 > http [ACK] Seq=9128 Ack=119928 Win=65792 Len=0
414561 138.399789 90.24.123.155 -> 244.3.210.197 TCP 64 36489 > http [ACK] Seq=9128 Ack=122808 Win=65792 Len=0
414598 138.416373 90.24.123.155 -> 244.3.210.197 TCP 64 36489 > http [ACK] Seq=9128 Ack=125688 Win=65792 Len=0
414619 138.424290 90.24.123.155 -> 244.3.210.197 TCP 64 36489 > http [ACK] Seq=9128 Ack=128568 Win=65792 Len=0
414620 138.424322 90.24.123.155 -> 244.3.210.197 TCP 64 36489 > http [ACK] Seq=9128 Ack=131448 Win=65792 Len=0
414654 138.429835 90.24.123.155 -> 244.3.210.197 TCP 64 36489 > http [ACK] Seq=9128 Ack=134275 Win=65792 Len=0
415205 138.567897 90.24.123.155 -> 244.3.210.197 TCP 64 36490 > http [ACK] Seq=7272 Ack=89300 Win=65792 Len=0
476015 157.095607 90.24.123.155 -> 244.3.210.197 TCP 64 36493 > http [RST, ACK] Seq=8874 Ack=73969 Win=0 Len=0
476027 157.099641 90.24.123.155 -> 244.3.210.197 TCP 64 36492 > http [RST, ACK] Seq=8867 Ack=89360 Win=0 Len=0
476033 157.103606 90.24.123.155 -> 244.3.210.197 TCP 64 36491 > http [RST, ACK] Seq=7288 Ack=158229 Win=0 Len=0
476041 157.107691 90.24.123.155 -> 244.3.210.197 TCP 64 36490 > http [RST, ACK] Seq=7272 Ack=89300 Win=0 Len=0
476049 157.111852 90.24.123.155 -> 244.3.210.197 TCP 64 36487 > http [RST, ACK] Seq=9745 Ack=135074 Win=0 Len=0
476109 157.121038 90.24.123.155 -> 244.3.210.197 TCP 64 36489 > http [RST, ACK] Seq=9128 Ack=134275 Win=0 Len=0
