198994  68.412717 90.218.164.67 -> 41.177.98.176 TCP 82 54187 > http [SYN] Seq=0 Win=65535 Len=0 MSS=1460 WS=8 TSval=321448506 TSecr=0 SACK_PERM=1
199021  68.424845 90.218.164.67 -> 41.177.98.176 TCP 70 54187 > http [ACK] Seq=1 Ack=1 Win=524280 Len=0 TSval=321448506 TSecr=1547400
199067  68.442706 90.218.164.67 -> 41.177.98.176 TCP 70 54187 > http [ACK] Seq=514 Ack=298 Win=524280 Len=0 TSval=321448506 TSecr=1547402
199077  68.445336 90.218.164.67 -> 41.177.98.176 TCP 70 54187 > http [ACK] Seq=514 Ack=3194 Win=524176 Len=0 TSval=321448507 TSecr=1547402
199089  68.452973 90.218.164.67 -> 41.177.98.176 TCP 70 54187 > http [ACK] Seq=514 Ack=6090 Win=524176 Len=0 TSval=321448507 TSecr=1547403
199102  68.456995 90.218.164.67 -> 41.177.98.176 TCP 70 54187 > http [ACK] Seq=514 Ack=6808 Win=524280 Len=0 TSval=321448507 TSecr=1547403
200019  68.909121 90.218.164.67 -> 41.177.98.176 TCP 82 54192 > http [SYN] Seq=0 Win=65535 Len=0 MSS=1460 WS=8 TSval=321448511 TSecr=0 SACK_PERM=1
200024  68.916987 90.218.164.67 -> 41.177.98.176 TCP 70 54187 > http [ACK] Seq=1008 Ack=8118 Win=524280 Len=0 TSval=321448511 TSecr=1547448
200062  68.938835 90.218.164.67 -> 41.177.98.176 TCP 70 54192 > http [ACK] Seq=1 Ack=1 Win=524280 Len=0 TSval=321448511 TSecr=1547450
200082  68.951854 90.218.164.67 -> 41.177.98.176 TCP 70 54192 > http [ACK] Seq=569 Ack=2897 Win=524176 Len=0 TSval=321448512 TSecr=1547453
200093  68.969492 90.218.164.67 -> 41.177.98.176 TCP 70 54192 > http [ACK] Seq=569 Ack=3894 Win=524280 Len=0 TSval=321448512 TSecr=1547453
200244  69.030974 90.218.164.67 -> 41.177.98.176 TCP 70 54187 > http [ACK] Seq=1487 Ack=8411 Win=524280 Len=0 TSval=321448512 TSecr=1547461
241239  83.965731 90.218.164.67 -> 41.177.98.176 TCP 70 54192 > http [ACK] Seq=569 Ack=3895 Win=524280 Len=0 TSval=321448662 TSecr=1548954
241333  84.036217 90.218.164.67 -> 41.177.98.176 TCP 70 54187 > http [ACK] Seq=1487 Ack=8412 Win=524280 Len=0 TSval=321448662 TSecr=1548962
463558 152.258919 90.218.164.67 -> 41.177.98.176 TCP 70 54187 > http [FIN, ACK] Seq=1487 Ack=8412 Win=524280 Len=0 TSval=321449344 TSecr=1548962
463559 152.258923 90.218.164.67 -> 41.177.98.176 TCP 70 54192 > http [FIN, ACK] Seq=569 Ack=3895 Win=524280 Len=0 TSval=321449344 TSecr=1548954
