667908 208.155168 90.224.98.55 -> 41.177.98.142 TCP 70 63604 > http [SYN] Seq=0 Win=8192 Len=0 MSS=1260 WS=4 SACK_PERM=1
668222 208.265236 90.224.98.55 -> 41.177.98.142 TCP 64 63604 > http [ACK] Seq=1 Ack=1 Win=66780 Len=0
673327 210.039215 90.224.98.55 -> 41.177.98.142 TCP 64 63604 > http [ACK] Seq=275 Ack=2521 Win=66780 Len=0
673610 210.162497 90.224.98.55 -> 41.177.98.142 TCP 64 63604 > http [ACK] Seq=275 Ack=5041 Win=66780 Len=0
673615 210.167797 90.224.98.55 -> 41.177.98.142 TCP 64 63604 > http [ACK] Seq=275 Ack=6519 Win=66780 Len=0
673855 210.292086 90.224.98.55 -> 41.177.98.142 TCP 64 63604 > http [ACK] Seq=275 Ack=7579 Win=65720 Len=0
673987 210.380586 90.224.98.55 -> 41.177.98.142 TCP 64 63604 > http [FIN, ACK] Seq=275 Ack=7579 Win=65720 Len=0
