822548 268.544764 90.210.106.93 -> 244.3.160.239 TCP 82 16138 > http [SYN] Seq=0 Win=65535 Len=0 MSS=1460 WS=8 TSval=1046180947 TSecr=0 SACK_PERM=1
822574 268.553275 90.210.106.93 -> 244.3.160.239 TCP 70 16138 > http [ACK] Seq=1 Ack=1 Win=524280 Len=0 TSval=1046180947 TSecr=1511961355
822591 268.565286 90.210.106.93 -> 244.3.160.239 TCP 70 16138 > http [ACK] Seq=453 Ack=498 Win=524280 Len=0 TSval=1046180947 TSecr=1511961356
822592 268.565291 90.210.106.93 -> 244.3.160.239 TCP 70 16138 > http [ACK] Seq=453 Ack=499 Win=524280 Len=0 TSval=1046180947 TSecr=1511961356
822593 268.565295 90.210.106.93 -> 244.3.160.239 TCP 70 16138 > http [FIN, ACK] Seq=453 Ack=499 Win=524280 Len=0 TSval=1046180947 TSecr=1511961356
822626 268.578811 90.210.106.93 -> 244.3.160.239 TCP 82 15300 > http [SYN] Seq=0 Win=65535 Len=0 MSS=1460 WS=8 TSval=1046180947 TSecr=0 SACK_PERM=1
822671 268.589156 90.210.106.93 -> 244.3.160.239 TCP 70 15300 > http [ACK] Seq=1 Ack=1 Win=524280 Len=0 TSval=1046180947 TSecr=1511961358
822750 268.618874 90.210.106.93 -> 244.3.160.239 TCP 70 15300 > http [ACK] Seq=448 Ack=615 Win=524280 Len=0 TSval=1046180947 TSecr=1511961361
822751 268.618878 90.210.106.93 -> 244.3.160.239 TCP 70 15300 > http [ACK] Seq=448 Ack=616 Win=524280 Len=0 TSval=1046180947 TSecr=1511961361
822753 268.619136 90.210.106.93 -> 244.3.160.239 TCP 70 15300 > http [FIN, ACK] Seq=448 Ack=616 Win=524280 Len=0 TSval=1046180947 TSecr=1511961361
