143884  49.424082 90.38.138.121 -> 244.3.160.239 TCP 82 lanner-lm > http [SYN] Seq=0 Win=65535 Len=0 MSS=1460 WS=8 TSval=819112572 TSecr=0 SACK_PERM=1
143972  49.444926 90.38.138.121 -> 244.3.160.239 TCP 70 lanner-lm > http [ACK] Seq=1 Ack=1 Win=524280 Len=0 TSval=819112572 TSecr=1511939443
146729  50.362681 90.38.138.121 -> 244.3.160.239 TCP 70 lanner-lm > http [ACK] Seq=1023 Ack=4099 Win=524280 Len=0 TSval=819112581 TSecr=1511939535
146737  50.366837 90.38.138.121 -> 244.3.160.239 TCP 70 [TCP Dup ACK 146729#1] lanner-lm > http [ACK] Seq=1023 Ack=4099 Win=524280 Len=0 TSval=819112581 TSecr=1511939535
146774  50.384004 90.38.138.121 -> 244.3.160.239 TCP 70 lanner-lm > http [ACK] Seq=1023 Ack=4448 Win=524280 Len=0 TSval=819112582 TSecr=1511939537
146775  50.384009 90.38.138.121 -> 244.3.160.239 TCP 70 lanner-lm > http [FIN, ACK] Seq=1023 Ack=4448 Win=524280 Len=0 TSval=819112582 TSecr=1511939537
171294  56.869975 90.38.138.121 -> 244.3.160.239 TCP 82 9168 > http [SYN] Seq=0 Win=65535 Len=0 MSS=1460 WS=8 TSval=819112646 TSecr=0 SACK_PERM=1
171333  56.883086 90.38.138.121 -> 244.3.160.239 TCP 70 9168 > http [ACK] Seq=1 Ack=1 Win=524280 Len=0 TSval=819112647 TSecr=1511940187
171865  57.214102 90.38.138.121 -> 244.3.160.239 TCP 70 9168 > http [ACK] Seq=1414 Ack=2173 Win=523448 Len=0 TSval=819112650 TSecr=1511940220
172117  57.332513 90.38.138.121 -> 244.3.160.239 TCP 70 9168 > http [ACK] Seq=1414 Ack=6272 Win=523568 Len=0 TSval=819112651 TSecr=1511940232
172123  57.336730 90.38.138.121 -> 244.3.160.239 TCP 70 [TCP Dup ACK 172117#1] 9168 > http [ACK] Seq=1414 Ack=6272 Win=523568 Len=0 TSval=819112651 TSecr=1511940232
172138  57.353496 90.38.138.121 -> 244.3.160.239 TCP 70 9168 > http [ACK] Seq=1414 Ack=10375 Win=523568 Len=0 TSval=819112651 TSecr=1511940234
172144  57.356892 90.38.138.121 -> 244.3.160.239 TCP 70 [TCP Dup ACK 172138#1] 9168 > http [ACK] Seq=1414 Ack=10375 Win=523568 Len=0 TSval=819112651 TSecr=1511940234
172155  57.368088 90.38.138.121 -> 244.3.160.239 TCP 70 9168 > http [ACK] Seq=1414 Ack=13880 Win=524280 Len=0 TSval=819112651 TSecr=1511940234
172162  57.372736 90.38.138.121 -> 244.3.160.239 TCP 82 abatjss > http [SYN] Seq=0 Win=65535 Len=0 MSS=1460 WS=8 TSval=819112651 TSecr=0 SACK_PERM=1
172243  57.401158 90.38.138.121 -> 244.3.160.239 TCP 70 abatjss > http [ACK] Seq=1 Ack=1 Win=524280 Len=0 TSval=819112652 TSecr=1511940238
172315  57.428242 90.38.138.121 -> 244.3.160.239 TCP 70 abatjss > http [ACK] Seq=1030 Ack=242 Win=524280 Len=0 TSval=819112652 TSecr=1511940242
172599  57.472957 90.38.138.121 -> 244.3.160.239 TCP 70 abatjss > http [ACK] Seq=1030 Ack=6034 Win=524176 Len=0 TSval=819112652 TSecr=1511940246
172653  57.485956 90.38.138.121 -> 244.3.160.239 TCP 70 abatjss > http [ACK] Seq=1030 Ack=12814 Win=524280 Len=0 TSval=819112653 TSecr=1511940248
172677  57.489917 90.38.138.121 -> 244.3.160.239 TCP 70 [TCP Dup ACK 172653#1] abatjss > http [ACK] Seq=1030 Ack=12814 Win=524280 Len=0 TSval=819112653 TSecr=1511940248
172732  57.500154 90.38.138.121 -> 244.3.160.239 TCP 70 abatjss > http [ACK] Seq=1030 Ack=19522 Win=524280 Len=0 TSval=819112653 TSecr=1511940249
172826  57.514376 90.38.138.121 -> 244.3.160.239 TCP 70 abatjss > http [ACK] Seq=1030 Ack=29658 Win=524176 Len=0 TSval=819112653 TSecr=1511940250
172886  57.518155 90.38.138.121 -> 244.3.160.239 TCP 70 [TCP Dup ACK 172826#1] abatjss > http [ACK] Seq=1030 Ack=29658 Win=524176 Len=0 TSval=819112653 TSecr=1511940250
172937  57.527981 90.38.138.121 -> 244.3.160.239 TCP 70 abatjss > http [ACK] Seq=1030 Ack=38802 Win=523720 Len=0 TSval=819112653 TSecr=1511940252
172948  57.531913 90.38.138.121 -> 244.3.160.239 TCP 70 [TCP Dup ACK 172937#1] abatjss > http [ACK] Seq=1030 Ack=38802 Win=523720 Len=0 TSval=819112653 TSecr=1511940252
172993  57.542223 90.38.138.121 -> 244.3.160.239 TCP 70 abatjss > http [ACK] Seq=1030 Ack=51834 Win=524176 Len=0 TSval=819112653 TSecr=1511940253
173006  57.545938 90.38.138.121 -> 244.3.160.239 TCP 70 [TCP Dup ACK 172993#1] abatjss > http [ACK] Seq=1030 Ack=51834 Win=524176 Len=0 TSval=819112653 TSecr=1511940253
173089  57.564641 90.38.138.121 -> 244.3.160.239 TCP 70 abatjss > http [ACK] Seq=1030 Ack=63874 Win=524176 Len=0 TSval=819112653 TSecr=1511940254
173115  57.568918 90.38.138.121 -> 244.3.160.239 TCP 70 abatjss > http [ACK] Seq=1030 Ack=65322 Win=524280 Len=0 TSval=819112653 TSecr=1511940254
173127  57.573048 90.38.138.121 -> 244.3.160.239 TCP 70 [TCP Dup ACK 173115#1] abatjss > http [ACK] Seq=1030 Ack=65322 Win=524280 Len=0 TSval=819112653 TSecr=1511940254
173133  57.576019 90.38.138.121 -> 244.3.160.239 TCP 70 9168 > http [ACK] Seq=1414 Ack=14481 Win=524280 Len=0 TSval=819112653 TSecr=1511940237
173148  57.580434 90.38.138.121 -> 244.3.160.239 TCP 70 abatjss > http [ACK] Seq=1030 Ack=80258 Win=524280 Len=0 TSval=819112654 TSecr=1511940257
173161  57.584231 90.38.138.121 -> 244.3.160.239 TCP 70 [TCP Dup ACK 173148#1] abatjss > http [ACK] Seq=1030 Ack=80258 Win=524280 Len=0 TSval=819112654 TSecr=1511940257
173274  57.615930 90.38.138.121 -> 244.3.160.239 TCP 70 9168 > http [ACK] Seq=1414 Ack=15547 Win=524280 Len=0 TSval=819112654 TSecr=1511940258
173292  57.620279 90.38.138.121 -> 244.3.160.239 TCP 70 9168 > http [FIN, ACK] Seq=1414 Ack=15547 Win=524280 Len=0 TSval=819112654 TSecr=1511940258
173293  57.620283 90.38.138.121 -> 244.3.160.239 TCP 70 abatjss > http [ACK] Seq=1030 Ack=90372 Win=524192 Len=0 TSval=819112654 TSecr=1511940258
173294  57.620287 90.38.138.121 -> 244.3.160.239 TCP 70 abatjss > http [FIN, ACK] Seq=1030 Ack=90372 Win=524280 Len=0 TSval=819112654 TSecr=1511940258
173326  57.632156 90.38.138.121 -> 244.3.160.239 TCP 70 [TCP Dup ACK 173294#1] abatjss > http [ACK] Seq=1031 Ack=90372 Win=524280 Len=0 TSval=819112654 TSecr=1511940262
173579  57.702078 90.38.138.121 -> 244.3.160.239 TCP 70 abatjss > http [ACK] Seq=1031 Ack=90373 Win=524280 Len=0 TSval=819112655 TSecr=1511940268
184619  62.070403 90.38.138.121 -> 244.3.160.239 TCP 82 beorl > http [SYN] Seq=0 Win=65535 Len=0 MSS=1460 WS=8 TSval=819112698 TSecr=0 SACK_PERM=1
184750  62.082625 90.38.138.121 -> 244.3.160.239 TCP 70 beorl > http [ACK] Seq=1 Ack=1 Win=524280 Len=0 TSval=819112699 TSecr=1511940707
186199  62.456357 90.38.138.121 -> 244.3.160.239 TCP 70 beorl > http [ACK] Seq=1022 Ack=4099 Win=523568 Len=0 TSval=819112702 TSecr=1511940744
186217  62.486192 90.38.138.121 -> 244.3.160.239 TCP 70 beorl > http [ACK] Seq=1022 Ack=4481 Win=524280 Len=0 TSval=819112702 TSecr=1511940746
186218  62.486197 90.38.138.121 -> 244.3.160.239 TCP 70 beorl > http [FIN, ACK] Seq=1022 Ack=4481 Win=524280 Len=0 TSval=819112702 TSecr=1511940746
201251  69.438088 90.38.138.121 -> 244.3.160.239 TCP 82 4366 > http [SYN] Seq=0 Win=65535 Len=0 MSS=1460 WS=8 TSval=819112772 TSecr=0 SACK_PERM=1
201298  69.450576 90.38.138.121 -> 244.3.160.239 TCP 70 4366 > http [ACK] Seq=1 Ack=1 Win=524280 Len=0 TSval=819112772 TSecr=1511941444
202126  69.787987 90.38.138.121 -> 244.3.160.239 TCP 70 4366 > http [ACK] Seq=1414 Ack=2173 Win=524280 Len=0 TSval=819112775 TSecr=1511941477
202601  69.920248 90.38.138.121 -> 244.3.160.239 TCP 70 4366 > http [ACK] Seq=1414 Ack=6272 Win=523568 Len=0 TSval=819112777 TSecr=1511941491
202605  69.924857 90.38.138.121 -> 244.3.160.239 TCP 70 [TCP Dup ACK 202601#1] 4366 > http [ACK] Seq=1414 Ack=6272 Win=523568 Len=0 TSval=819112777 TSecr=1511941491
202609  69.932484 90.38.138.121 -> 244.3.160.239 TCP 70 4366 > http [ACK] Seq=1414 Ack=10370 Win=523568 Len=0 TSval=819112777 TSecr=1511941492
202631  69.935988 90.38.138.121 -> 244.3.160.239 TCP 70 [TCP Dup ACK 202609#1] 4366 > http [ACK] Seq=1414 Ack=10370 Win=523568 Len=0 TSval=819112777 TSecr=1511941492
202665  69.946301 90.38.138.121 -> 244.3.160.239 TCP 70 4366 > http [ACK] Seq=1414 Ack=13239 Win=524200 Len=0 TSval=819112777 TSecr=1511941494
202666  69.946306 90.38.138.121 -> 244.3.160.239 TCP 70 4366 > http [FIN, ACK] Seq=1414 Ack=13239 Win=524280 Len=0 TSval=819112777 TSecr=1511941494
202689  69.950897 90.38.138.121 -> 244.3.160.239 TCP 82 gradecam > http [SYN] Seq=0 Win=65535 Len=0 MSS=1460 WS=8 TSval=819112777 TSecr=0 SACK_PERM=1
202758  69.964608 90.38.138.121 -> 244.3.160.239 TCP 70 gradecam > http [ACK] Seq=1 Ack=1 Win=524280 Len=0 TSval=819112777 TSecr=1511941495
202880  69.986078 90.38.138.121 -> 244.3.160.239 TCP 70 gradecam > http [ACK] Seq=1031 Ack=242 Win=524280 Len=0 TSval=819112778 TSecr=1511941498
203061  70.016049 90.38.138.121 -> 244.3.160.239 TCP 70 gradecam > http [ACK] Seq=1031 Ack=6034 Win=522728 Len=0 TSval=819112778 TSecr=1511941501
203077  70.019983 90.38.138.121 -> 244.3.160.239 TCP 70 [TCP Dup ACK 203061#1] gradecam > http [ACK] Seq=1031 Ack=6034 Win=522728 Len=0 TSval=819112778 TSecr=1511941501
203165  70.040708 90.38.138.121 -> 244.3.160.239 TCP 70 gradecam > http [ACK] Seq=1031 Ack=12802 Win=524280 Len=0 TSval=819112778 TSecr=1511941502
203200  70.044071 90.38.138.121 -> 244.3.160.239 TCP 70 [TCP Dup ACK 203165#1] gradecam > http [ACK] Seq=1031 Ack=12802 Win=524280 Len=0 TSval=819112778 TSecr=1511941502
203216  70.055884 90.38.138.121 -> 244.3.160.239 TCP 70 gradecam > http [ACK] Seq=1031 Ack=20994 Win=524280 Len=0 TSval=819112778 TSecr=1511941504
203239  70.059874 90.38.138.121 -> 244.3.160.239 TCP 70 [TCP Dup ACK 203216#1] gradecam > http [ACK] Seq=1031 Ack=20994 Win=524280 Len=0 TSval=819112778 TSecr=1511941504
203317  70.082031 90.38.138.121 -> 244.3.160.239 TCP 70 gradecam > http [ACK] Seq=1031 Ack=31130 Win=524176 Len=0 TSval=819112778 TSecr=1511941506
203348  70.097980 90.38.138.121 -> 244.3.160.239 TCP 70 gradecam > http [ACK] Seq=1031 Ack=41722 Win=524176 Len=0 TSval=819112779 TSecr=1511941508
203364  70.111976 90.38.138.121 -> 244.3.160.239 TCP 70 gradecam > http [ACK] Seq=1031 Ack=47634 Win=524056 Len=0 TSval=819112779 TSecr=1511941510
203365  70.111981 90.38.138.121 -> 244.3.160.239 TCP 70 gradecam > http [FIN, ACK] Seq=1031 Ack=47634 Win=524280 Len=0 TSval=819112779 TSecr=1511941510
203418  70.123994 90.38.138.121 -> 244.3.160.239 TCP 70 [TCP Dup ACK 203365#1] gradecam > http [ACK] Seq=1032 Ack=47634 Win=524280 Len=0 TSval=819112779 TSecr=1511941511
203787  70.195999 90.38.138.121 -> 244.3.160.239 TCP 70 gradecam > http [ACK] Seq=1032 Ack=47635 Win=524280 Len=0 TSval=819112780 TSecr=1511941519
214714  73.688029 90.38.138.121 -> 244.3.160.239 TCP 82 12018 > http [SYN] Seq=0 Win=65535 Len=0 MSS=1460 WS=8 TSval=819112814 TSecr=0 SACK_PERM=1
214757  73.700596 90.38.138.121 -> 244.3.160.239 TCP 70 12018 > http [ACK] Seq=1 Ack=1 Win=524280 Len=0 TSval=819112815 TSecr=1511941869
215787  74.074368 90.38.138.121 -> 244.3.160.239 TCP 70 12018 > http [ACK] Seq=1023 Ack=4099 Win=524280 Len=0 TSval=819112818 TSecr=1511941906
215798  74.078075 90.38.138.121 -> 244.3.160.239 TCP 70 [TCP Dup ACK 215787#1] 12018 > http [ACK] Seq=1023 Ack=4099 Win=524280 Len=0 TSval=819112818 TSecr=1511941906
215843  74.086365 90.38.138.121 -> 244.3.160.239 TCP 70 12018 > http [ACK] Seq=1023 Ack=4508 Win=524280 Len=0 TSval=819112818 TSecr=1511941908
215870  74.090058 90.38.138.121 -> 244.3.160.239 TCP 70 12018 > http [FIN, ACK] Seq=1023 Ack=4508 Win=524280 Len=0 TSval=819112818 TSecr=1511941908
235269  81.973998 90.38.138.121 -> 244.3.160.239 TCP 82 bv-ds > http [SYN] Seq=0 Win=65535 Len=0 MSS=1460 WS=8 TSval=819112897 TSecr=0 SACK_PERM=1
235276  81.985932 90.38.138.121 -> 244.3.160.239 TCP 70 bv-ds > http [ACK] Seq=1 Ack=1 Win=524280 Len=0 TSval=819112897 TSecr=1511942698
236718  82.350382 90.38.138.121 -> 244.3.160.239 TCP 70 bv-ds > http [ACK] Seq=1424 Ack=4105 Win=523568 Len=0 TSval=819112901 TSecr=1511942734
236765  82.354561 90.38.138.121 -> 244.3.160.239 TCP 70 [TCP Dup ACK 236718#1] bv-ds > http [ACK] Seq=1424 Ack=4105 Win=523568 Len=0 TSval=819112901 TSecr=1511942734
236873  82.364151 90.38.138.121 -> 244.3.160.239 TCP 70 bv-ds > http [ACK] Seq=1424 Ack=6154 Win=523568 Len=0 TSval=819112901 TSecr=1511942735
237086  82.379001 90.38.138.121 -> 244.3.160.239 TCP 70 bv-ds > http [ACK] Seq=1424 Ack=7339 Win=524280 Len=0 TSval=819112901 TSecr=1511942737
237087  82.379004 90.38.138.121 -> 244.3.160.239 TCP 70 bv-ds > http [FIN, ACK] Seq=1424 Ack=7339 Win=524280 Len=0 TSval=819112901 TSecr=1511942737
240924  83.765295 90.38.138.121 -> 244.3.160.239 TCP 82 7931 > http [SYN] Seq=0 Win=65535 Len=0 MSS=1460 WS=8 TSval=819112915 TSecr=0 SACK_PERM=1
240983  83.787210 90.38.138.121 -> 244.3.160.239 TCP 70 7931 > http [ACK] Seq=1 Ack=1 Win=524280 Len=0 TSval=819112915 TSecr=1511942877
241487  84.116371 90.38.138.121 -> 244.3.160.239 TCP 70 7931 > http [ACK] Seq=1429 Ack=2173 Win=523448 Len=0 TSval=819112919 TSecr=1511942911
241804  84.250175 90.38.138.121 -> 244.3.160.239 TCP 70 7931 > http [ACK] Seq=1429 Ack=6276 Win=524280 Len=0 TSval=819112920 TSecr=1511942924
241818  84.254415 90.38.138.121 -> 244.3.160.239 TCP 70 [TCP Dup ACK 241804#1] 7931 > http [ACK] Seq=1429 Ack=6276 Win=524280 Len=0 TSval=819112920 TSecr=1511942924
241854  84.262396 90.38.138.121 -> 244.3.160.239 TCP 70 7931 > http [ACK] Seq=1429 Ack=10374 Win=523568 Len=0 TSval=819112920 TSecr=1511942925
241899  84.275994 90.38.138.121 -> 244.3.160.239 TCP 70 7931 > http [ACK] Seq=1429 Ack=12992 Win=524280 Len=0 TSval=819112920 TSecr=1511942927
241900  84.275999 90.38.138.121 -> 244.3.160.239 TCP 70 7931 > http [FIN, ACK] Seq=1429 Ack=12992 Win=524280 Len=0 TSval=819112920 TSecr=1511942927
241905  84.280054 90.38.138.121 -> 244.3.160.239 TCP 82 15329 > http [SYN] Seq=0 Win=65535 Len=0 MSS=1460 WS=8 TSval=819112920 TSecr=0 SACK_PERM=1
241952  84.292968 90.38.138.121 -> 244.3.160.239 TCP 70 15329 > http [ACK] Seq=1 Ack=1 Win=524280 Len=0 TSval=819112920 TSecr=1511942928
242062  84.314028 90.38.138.121 -> 244.3.160.239 TCP 70 15329 > http [ACK] Seq=1028 Ack=243 Win=524280 Len=0 TSval=819112921 TSecr=1511942930
242299  84.327895 90.38.138.121 -> 244.3.160.239 TCP 70 15329 > http [ACK] Seq=1028 Ack=3163 Win=524280 Len=0 TSval=819112921 TSecr=1511942932
242306  84.332009 90.38.138.121 -> 244.3.160.239 TCP 70 [TCP Dup ACK 242299#1] 15329 > http [ACK] Seq=1028 Ack=3163 Win=524280 Len=0 TSval=819112921 TSecr=1511942932
242404  84.349983 90.38.138.121 -> 244.3.160.239 TCP 70 15329 > http [ACK] Seq=1028 Ack=9883 Win=524176 Len=0 TSval=819112921 TSecr=1511942933
242431  84.354159 90.38.138.121 -> 244.3.160.239 TCP 70 [TCP Dup ACK 242404#1] 15329 > http [ACK] Seq=1028 Ack=9883 Win=524176 Len=0 TSval=819112921 TSecr=1511942933
242457  84.364114 90.38.138.121 -> 244.3.160.239 TCP 70 15329 > http [ACK] Seq=1028 Ack=15723 Win=524280 Len=0 TSval=819112921 TSecr=1511942935
242528  84.378292 90.38.138.121 -> 244.3.160.239 TCP 70 15329 > http [ACK] Seq=1028 Ack=25339 Win=524176 Len=0 TSval=819112921 TSecr=1511942937
242546  84.382263 90.38.138.121 -> 244.3.160.239 TCP 70 [TCP Dup ACK 242528#1] 15329 > http [ACK] Seq=1028 Ack=25339 Win=524176 Len=0 TSval=819112921 TSecr=1511942937
242588  84.392195 90.38.138.121 -> 244.3.160.239 TCP 70 15329 > http [ACK] Seq=1028 Ack=36923 Win=522728 Len=0 TSval=819112922 TSecr=1511942938
242605  84.395919 90.38.138.121 -> 244.3.160.239 TCP 70 [TCP Dup ACK 242588#1] 15329 > http [ACK] Seq=1028 Ack=36923 Win=522728 Len=0 TSval=819112922 TSecr=1511942938
242620  84.409334 90.38.138.121 -> 244.3.160.239 TCP 70 15329 > http [ACK] Seq=1028 Ack=48963 Win=524280 Len=0 TSval=819112922 TSecr=1511942940
242640  84.412961 90.38.138.121 -> 244.3.160.239 TCP 70 [TCP Dup ACK 242620#1] 15329 > http [ACK] Seq=1028 Ack=48963 Win=524280 Len=0 TSval=819112922 TSecr=1511942940
242663  84.424764 90.38.138.121 -> 244.3.160.239 TCP 70 15329 > http [ACK] Seq=1028 Ack=62451 Win=524280 Len=0 TSval=819112922 TSecr=1511942941
242736  84.428917 90.38.138.121 -> 244.3.160.239 TCP 70 [TCP Dup ACK 242663#1] 15329 > http [ACK] Seq=1028 Ack=62451 Win=524280 Len=0 TSval=819112922 TSecr=1511942941
242770  84.440717 90.38.138.121 -> 244.3.160.239 TCP 70 15329 > http [ACK] Seq=1028 Ack=78379 Win=522728 Len=0 TSval=819112922 TSecr=1511942943
242803  84.444667 90.38.138.121 -> 244.3.160.239 TCP 70 [TCP Dup ACK 242770#1] 15329 > http [ACK] Seq=1028 Ack=78379 Win=522728 Len=0 TSval=819112922 TSecr=1511942943
242811  84.453935 90.38.138.121 -> 244.3.160.239 TCP 70 15329 > http [ACK] Seq=1028 Ack=93275 Win=524280 Len=0 TSval=819112922 TSecr=1511942944
242864  84.457890 90.38.138.121 -> 244.3.160.239 TCP 70 [TCP Dup ACK 242811#1] 15329 > http [ACK] Seq=1028 Ack=93275 Win=524280 Len=0 TSval=819112922 TSecr=1511942944
242883  84.468239 90.38.138.121 -> 244.3.160.239 TCP 70 15329 > http [ACK] Seq=1028 Ack=112099 Win=519832 Len=0 TSval=819112922 TSecr=1511942946
242902  84.472331 90.38.138.121 -> 244.3.160.239 TCP 70 [TCP Dup ACK 242883#1] 15329 > http [ACK] Seq=1028 Ack=112099 Win=519832 Len=0 TSval=819112922 TSecr=1511942946
242944  84.479917 90.38.138.121 -> 244.3.160.239 TCP 70 15329 > http [ACK] Seq=1028 Ack=127892 Win=520416 Len=0 TSval=819112922 TSecr=1511942947
242952  84.484088 90.38.138.121 -> 244.3.160.239 TCP 70 [TCP Dup ACK 242944#1] 15329 > http [ACK] Seq=1028 Ack=127892 Win=520416 Len=0 TSval=819112922 TSecr=1511942947
242965  84.487920 90.38.138.121 -> 244.3.160.239 TCP 70 [TCP Dup ACK 242944#2] 15329 > http [ACK] Seq=1028 Ack=127892 Win=520416 Len=0 TSval=819112922 TSecr=1511942947
242966  84.488034 90.38.138.121 -> 244.3.160.239 TCP 70 15329 > http [FIN, ACK] Seq=1028 Ack=127892 Win=524280 Len=0 TSval=819112922 TSecr=1511942947
243020  84.508204 90.38.138.121 -> 244.3.160.239 TCP 70 [TCP Dup ACK 242966#1] 15329 > http [ACK] Seq=1029 Ack=127892 Win=524280 Len=0 TSval=819112923 TSecr=1511942949
243072  84.582223 90.38.138.121 -> 244.3.160.239 TCP 70 15329 > http [ACK] Seq=1029 Ack=127893 Win=524280 Len=0 TSval=819112923 TSecr=1511942957
249664  88.068443 90.38.138.121 -> 244.3.160.239 TCP 82 6717 > http [SYN] Seq=0 Win=65535 Len=0 MSS=1460 WS=8 TSval=819112958 TSecr=0 SACK_PERM=1
249691  88.080160 90.38.138.121 -> 244.3.160.239 TCP 70 6717 > http [ACK] Seq=1 Ack=1 Win=524280 Len=0 TSval=819112958 TSecr=1511943307
250593  88.448105 90.38.138.121 -> 244.3.160.239 TCP 70 6717 > http [ACK] Seq=1021 Ack=4099 Win=524280 Len=0 TSval=819112962 TSecr=1511943344
250600  88.452091 90.38.138.121 -> 244.3.160.239 TCP 70 [TCP Dup ACK 250593#1] 6717 > http [ACK] Seq=1021 Ack=4099 Win=524280 Len=0 TSval=819112962 TSecr=1511943344
250609  88.459890 90.38.138.121 -> 244.3.160.239 TCP 70 6717 > http [ACK] Seq=1021 Ack=4443 Win=524280 Len=0 TSval=819112962 TSecr=1511943345
250611  88.464095 90.38.138.121 -> 244.3.160.239 TCP 70 6717 > http [FIN, ACK] Seq=1021 Ack=4443 Win=524280 Len=0 TSval=819112962 TSecr=1511943345
265992  92.006864 90.38.138.121 -> 244.3.160.239 TCP 82 4729 > http [SYN] Seq=0 Win=65535 Len=0 MSS=1460 WS=8 TSval=819112997 TSecr=0 SACK_PERM=1
266268  92.021023 90.38.138.121 -> 244.3.160.239 TCP 70 4729 > http [ACK] Seq=1 Ack=1 Win=524280 Len=0 TSval=819112998 TSecr=1511943701
274175  92.372224 90.38.138.121 -> 244.3.160.239 TCP 70 4729 > http [ACK] Seq=1386 Ack=2173 Win=524280 Len=0 TSval=819113001 TSecr=1511943736
274313  92.497874 90.38.138.121 -> 244.3.160.239 TCP 70 4729 > http [ACK] Seq=1386 Ack=6276 Win=524280 Len=0 TSval=819113003 TSecr=1511943749
274348  92.502059 90.38.138.121 -> 244.3.160.239 TCP 70 [TCP Dup ACK 274313#1] 4729 > http [ACK] Seq=1386 Ack=6276 Win=524280 Len=0 TSval=819113003 TSecr=1511943749
274423  92.520680 90.38.138.121 -> 244.3.160.239 TCP 70 4729 > http [ACK] Seq=1386 Ack=10395 Win=524280 Len=0 TSval=819113003 TSecr=1511943750
274465  92.534124 90.38.138.121 -> 244.3.160.239 TCP 70 4729 > http [ACK] Seq=1386 Ack=13892 Win=524280 Len=0 TSval=819113003 TSecr=1511943750
274469  92.538254 90.38.138.121 -> 244.3.160.239 TCP 82 11271 > http [SYN] Seq=0 Win=65535 Len=0 MSS=1460 WS=8 TSval=819113003 TSecr=0 SACK_PERM=1
274493  92.558307 90.38.138.121 -> 244.3.160.239 TCP 70 4729 > http [ACK] Seq=1386 Ack=15251 Win=524264 Len=0 TSval=819113003 TSecr=1511943754
274494  92.558312 90.38.138.121 -> 244.3.160.239 TCP 70 4729 > http [FIN, ACK] Seq=1386 Ack=15251 Win=524280 Len=0 TSval=819113003 TSecr=1511943754
274508  92.563155 90.38.138.121 -> 244.3.160.239 TCP 70 11271 > http [ACK] Seq=1 Ack=1 Win=524280 Len=0 TSval=819113003 TSecr=1511943754
274597  92.589897 90.38.138.121 -> 244.3.160.239 TCP 70 11271 > http [ACK] Seq=1029 Ack=243 Win=524280 Len=0 TSval=819113003 TSecr=1511943757
274800  92.656373 90.38.138.121 -> 244.3.160.239 TCP 70 11271 > http [ACK] Seq=1029 Ack=6035 Win=524176 Len=0 TSval=819113004 TSecr=1511943765
274810  92.660339 90.38.138.121 -> 244.3.160.239 TCP 70 [TCP Dup ACK 274800#1] 11271 > http [ACK] Seq=1029 Ack=6035 Win=524176 Len=0 TSval=819113004 TSecr=1511943765
274885  92.670072 90.38.138.121 -> 244.3.160.239 TCP 70 11271 > http [ACK] Seq=1029 Ack=13275 Win=524176 Len=0 TSval=819113004 TSecr=1511943766
274896  92.674005 90.38.138.121 -> 244.3.160.239 TCP 70 [TCP Dup ACK 274885#1] 11271 > http [ACK] Seq=1029 Ack=13275 Win=524176 Len=0 TSval=819113004 TSecr=1511943766
274942  92.692491 90.38.138.121 -> 244.3.160.239 TCP 70 11271 > http [ACK] Seq=1029 Ack=20971 Win=524280 Len=0 TSval=819113004 TSecr=1511943767
274952  92.697032 90.38.138.121 -> 244.3.160.239 TCP 70 [TCP Dup ACK 274942#1] 11271 > http [ACK] Seq=1029 Ack=20971 Win=524280 Len=0 TSval=819113004 TSecr=1511943767
275024  92.707926 90.38.138.121 -> 244.3.160.239 TCP 70 11271 > http [ACK] Seq=1029 Ack=31107 Win=524176 Len=0 TSval=819113005 TSecr=1511943770
275071  92.721936 90.38.138.121 -> 244.3.160.239 TCP 70 11271 > http [ACK] Seq=1029 Ack=41699 Win=522728 Len=0 TSval=819113005 TSecr=1511943771
275138  92.726077 90.38.138.121 -> 244.3.160.239 TCP 70 [TCP Dup ACK 275071#1] 11271 > http [ACK] Seq=1029 Ack=41699 Win=522728 Len=0 TSval=819113005 TSecr=1511943771
275154  92.736288 90.38.138.121 -> 244.3.160.239 TCP 70 11271 > http [ACK] Seq=1029 Ack=54731 Win=524176 Len=0 TSval=819113005 TSecr=1511943772
275180  92.739968 90.38.138.121 -> 244.3.160.239 TCP 70 [TCP Dup ACK 275154#1] 11271 > http [ACK] Seq=1029 Ack=54731 Win=524176 Len=0 TSval=819113005 TSecr=1511943772
275242  92.750247 90.38.138.121 -> 244.3.160.239 TCP 70 11271 > http [ACK] Seq=1029 Ack=68219 Win=524280 Len=0 TSval=819113005 TSecr=1511943774
275260  92.754278 90.38.138.121 -> 244.3.160.239 TCP 70 [TCP Dup ACK 275242#1] 11271 > http [ACK] Seq=1029 Ack=68219 Win=524280 Len=0 TSval=819113005 TSecr=1511943774
275291  92.764172 90.38.138.121 -> 244.3.160.239 TCP 70 11271 > http [ACK] Seq=1029 Ack=84147 Win=518384 Len=0 TSval=819113005 TSecr=1511943775
275309  92.768086 90.38.138.121 -> 244.3.160.239 TCP 70 [TCP Dup ACK 275291#1] 11271 > http [ACK] Seq=1029 Ack=84147 Win=518384 Len=0 TSval=819113005 TSecr=1511943775
275358  92.787941 90.38.138.121 -> 244.3.160.239 TCP 70 11271 > http [ACK] Seq=1029 Ack=100531 Win=524176 Len=0 TSval=819113005 TSecr=1511943777
275409  92.792212 90.38.138.121 -> 244.3.160.239 TCP 70 [TCP Dup ACK 275358#1] 11271 > http [ACK] Seq=1029 Ack=100531 Win=524176 Len=0 TSval=819113005 TSecr=1511943777
275447  92.801996 90.38.138.121 -> 244.3.160.239 TCP 70 11271 > http [ACK] Seq=1029 Ack=118363 Win=524280 Len=0 TSval=819113006 TSecr=1511943779
275491  92.808642 90.38.138.121 -> 244.3.160.239 TCP 70 [TCP Dup ACK 275447#1] 11271 > http [ACK] Seq=1029 Ack=118363 Win=524280 Len=0 TSval=819113006 TSecr=1511943779
275574  92.824270 90.38.138.121 -> 244.3.160.239 TCP 70 11271 > http [ACK] Seq=1029 Ack=137460 Win=522904 Len=0 TSval=819113006 TSecr=1511943781
275599  92.828945 90.38.138.121 -> 244.3.160.239 TCP 70 [TCP Dup ACK 275574#1] 11271 > http [ACK] Seq=1029 Ack=137460 Win=522904 Len=0 TSval=819113006 TSecr=1511943781
275600  92.828949 90.38.138.121 -> 244.3.160.239 TCP 70 11271 > http [FIN, ACK] Seq=1029 Ack=137460 Win=524280 Len=0 TSval=819113006 TSecr=1511943781
275628  92.843009 90.38.138.121 -> 244.3.160.239 TCP 70 [TCP Dup ACK 275600#1] 11271 > http [ACK] Seq=1030 Ack=137460 Win=524280 Len=0 TSval=819113006 TSecr=1511943783
275664  92.855495 90.38.138.121 -> 244.3.160.239 TCP 70 11271 > http [ACK] Seq=1030 Ack=137461 Win=524280 Len=0 TSval=819113006 TSecr=1511943785
285418  95.458134 90.38.138.121 -> 244.3.160.239 TCP 82 6650 > http [SYN] Seq=0 Win=65535 Len=0 MSS=1460 WS=8 TSval=819113032 TSecr=0 SACK_PERM=1
285539  95.488735 90.38.138.121 -> 244.3.160.239 TCP 70 6650 > http [ACK] Seq=1 Ack=1 Win=524280 Len=0 TSval=819113032 TSecr=1511944046
286902  95.856631 90.38.138.121 -> 244.3.160.239 TCP 70 6650 > http [ACK] Seq=1023 Ack=4099 Win=524280 Len=0 TSval=819113036 TSecr=1511944084
286909  95.860311 90.38.138.121 -> 244.3.160.239 TCP 70 [TCP Dup ACK 286902#1] 6650 > http [ACK] Seq=1023 Ack=4099 Win=524280 Len=0 TSval=819113036 TSecr=1511944084
286941  95.873345 90.38.138.121 -> 244.3.160.239 TCP 70 6650 > http [ACK] Seq=1023 Ack=4422 Win=524280 Len=0 TSval=819113036 TSecr=1511944086
286942  95.873350 90.38.138.121 -> 244.3.160.239 TCP 70 6650 > http [FIN, ACK] Seq=1023 Ack=4422 Win=524280 Len=0 TSval=819113036 TSecr=1511944086
295938  99.880655 90.38.138.121 -> 244.3.160.239 TCP 82 13790 > http [SYN] Seq=0 Win=65535 Len=0 MSS=1460 WS=8 TSval=819113076 TSecr=0 SACK_PERM=1
295977  99.892722 90.38.138.121 -> 244.3.160.239 TCP 70 13790 > http [ACK] Seq=1 Ack=1 Win=524280 Len=0 TSval=819113076 TSecr=1511944488
296765 100.225966 90.38.138.121 -> 244.3.160.239 TCP 70 13790 > http [ACK] Seq=1388 Ack=2173 Win=524280 Len=0 TSval=819113080 TSecr=1511944521
297461 100.347896 90.38.138.121 -> 244.3.160.239 TCP 70 13790 > http [ACK] Seq=1388 Ack=6276 Win=524280 Len=0 TSval=819113081 TSecr=1511944534
297471 100.351939 90.38.138.121 -> 244.3.160.239 TCP 70 [TCP Dup ACK 297461#1] 13790 > http [ACK] Seq=1388 Ack=6276 Win=524280 Len=0 TSval=819113081 TSecr=1511944534
297509 100.362620 90.38.138.121 -> 244.3.160.239 TCP 70 13790 > http [ACK] Seq=1388 Ack=10395 Win=524280 Len=0 TSval=819113081 TSecr=1511944535
297554 100.377105 90.38.138.121 -> 244.3.160.239 TCP 70 13790 > http [ACK] Seq=1388 Ack=13892 Win=524280 Len=0 TSval=819113081 TSecr=1511944535
297566 100.380315 90.38.138.121 -> 244.3.160.239 TCP 82 10457 > http [SYN] Seq=0 Win=65535 Len=0 MSS=1460 WS=8 TSval=819113081 TSecr=0 SACK_PERM=1
297598 100.390934 90.38.138.121 -> 244.3.160.239 TCP 70 13790 > http [ACK] Seq=1388 Ack=15253 Win=524264 Len=0 TSval=819113081 TSecr=1511944538
297599 100.390939 90.38.138.121 -> 244.3.160.239 TCP 70 13790 > http [FIN, ACK] Seq=1388 Ack=15253 Win=524280 Len=0 TSval=819113081 TSecr=1511944538
297608 100.395057 90.38.138.121 -> 244.3.160.239 TCP 70 10457 > http [ACK] Seq=1 Ack=1 Win=524280 Len=0 TSval=819113081 TSecr=1511944538
297710 100.416264 90.38.138.121 -> 244.3.160.239 TCP 70 10457 > http [ACK] Seq=1029 Ack=243 Win=524280 Len=0 TSval=819113082 TSecr=1511944541
298016 100.477988 90.38.138.121 -> 244.3.160.239 TCP 70 10457 > http [ACK] Seq=1029 Ack=6035 Win=524176 Len=0 TSval=819113082 TSecr=1511944547
298022 100.482063 90.38.138.121 -> 244.3.160.239 TCP 70 [TCP Dup ACK 298016#1] 10457 > http [ACK] Seq=1029 Ack=6035 Win=524176 Len=0 TSval=819113082 TSecr=1511944547
298101 100.491952 90.38.138.121 -> 244.3.160.239 TCP 70 10457 > http [ACK] Seq=1029 Ack=13275 Win=524176 Len=0 TSval=819113082 TSecr=1511944548
298224 100.505873 90.38.138.121 -> 244.3.160.239 TCP 70 10457 > http [ACK] Seq=1029 Ack=19547 Win=524280 Len=0 TSval=819113083 TSecr=1511944550
298265 100.520013 90.38.138.121 -> 244.3.160.239 TCP 70 10457 > http [ACK] Seq=1029 Ack=29683 Win=524176 Len=0 TSval=819113083 TSecr=1511944551
298298 100.523979 90.38.138.121 -> 244.3.160.239 TCP 70 [TCP Dup ACK 298265#1] 10457 > http [ACK] Seq=1029 Ack=29683 Win=524176 Len=0 TSval=819113083 TSecr=1511944551
298320 100.534367 90.38.138.121 -> 244.3.160.239 TCP 70 10457 > http [ACK] Seq=1029 Ack=38827 Win=523720 Len=0 TSval=819113083 TSecr=1511944552
298341 100.548165 90.38.138.121 -> 244.3.160.239 TCP 70 10457 > http [ACK] Seq=1029 Ack=51859 Win=524176 Len=0 TSval=819113083 TSecr=1511944554
298374 100.552679 90.38.138.121 -> 244.3.160.239 TCP 70 [TCP Dup ACK 298341#1] 10457 > http [ACK] Seq=1029 Ack=51859 Win=524176 Len=0 TSval=819113083 TSecr=1511944554
298387 100.562047 90.38.138.121 -> 244.3.160.239 TCP 70 10457 > http [ACK] Seq=1029 Ack=63899 Win=524176 Len=0 TSval=819113083 TSecr=1511944555
298406 100.566905 90.38.138.121 -> 244.3.160.239 TCP 70 [TCP Dup ACK 298387#1] 10457 > http [ACK] Seq=1029 Ack=63899 Win=524176 Len=0 TSval=819113083 TSecr=1511944555
298422 100.576303 90.38.138.121 -> 244.3.160.239 TCP 70 10457 > http [ACK] Seq=1029 Ack=78835 Win=524280 Len=0 TSval=819113083 TSecr=1511944557
298447 100.579975 90.38.138.121 -> 244.3.160.239 TCP 70 [TCP Dup ACK 298422#1] 10457 > http [ACK] Seq=1029 Ack=78835 Win=524280 Len=0 TSval=819113083 TSecr=1511944557
298466 100.590182 90.38.138.121 -> 244.3.160.239 TCP 70 10457 > http [ACK] Seq=1029 Ack=96211 Win=524176 Len=0 TSval=819113083 TSecr=1511944558
298480 100.594241 90.38.138.121 -> 244.3.160.239 TCP 70 [TCP Dup ACK 298466#1] 10457 > http [ACK] Seq=1029 Ack=96211 Win=524176 Len=0 TSval=819113083 TSecr=1511944558
298513 100.604434 90.38.138.121 -> 244.3.160.239 TCP 70 10457 > http [ACK] Seq=1029 Ack=101762 Win=523424 Len=0 TSval=819113083 TSecr=1511944559
298514 100.604439 90.38.138.121 -> 244.3.160.239 TCP 70 10457 > http [FIN, ACK] Seq=1029 Ack=101762 Win=524280 Len=0 TSval=819113083 TSecr=1511944559
298542 100.616240 90.38.138.121 -> 244.3.160.239 TCP 70 [TCP Dup ACK 298514#1] 10457 > http [ACK] Seq=1030 Ack=101762 Win=524280 Len=0 TSval=819113084 TSecr=1511944561
298740 100.694163 90.38.138.121 -> 244.3.160.239 TCP 70 10457 > http [ACK] Seq=1030 Ack=101763 Win=524280 Len=0 TSval=819113084 TSecr=1511944569
303129 102.500262 90.38.138.121 -> 244.3.160.239 TCP 82 12307 > http [SYN] Seq=0 Win=65535 Len=0 MSS=1460 WS=8 TSval=819113102 TSecr=0 SACK_PERM=1
303218 102.512111 90.38.138.121 -> 244.3.160.239 TCP 70 12307 > http [ACK] Seq=1 Ack=1 Win=524280 Len=0 TSval=819113103 TSecr=1511944750
304076 102.891906 90.38.138.121 -> 244.3.160.239 TCP 70 12307 > http [ACK] Seq=1023 Ack=4099 Win=524280 Len=0 TSval=819113106 TSecr=1511944787
304083 102.895882 90.38.138.121 -> 244.3.160.239 TCP 70 [TCP Dup ACK 304076#1] 12307 > http [ACK] Seq=1023 Ack=4099 Win=524280 Len=0 TSval=819113106 TSecr=1511944787
304165 102.903956 90.38.138.121 -> 244.3.160.239 TCP 70 12307 > http [ACK] Seq=1023 Ack=4424 Win=524280 Len=0 TSval=819113106 TSecr=1511944790
304172 102.908083 90.38.138.121 -> 244.3.160.239 TCP 70 12307 > http [FIN, ACK] Seq=1023 Ack=4424 Win=524280 Len=0 TSval=819113106 TSecr=1511944790
310574 105.982082 90.38.138.121 -> 244.3.160.239 TCP 82 groove > http [SYN] Seq=0 Win=65535 Len=0 MSS=1460 WS=8 TSval=819113137 TSecr=0 SACK_PERM=1
310627 105.996575 90.38.138.121 -> 244.3.160.239 TCP 70 groove > http [ACK] Seq=1 Ack=1 Win=524280 Len=0 TSval=819113137 TSecr=1511945099
311459 106.324190 90.38.138.121 -> 244.3.160.239 TCP 70 groove > http [ACK] Seq=1388 Ack=2173 Win=524280 Len=0 TSval=819113141 TSecr=1511945131
311671 106.446031 90.38.138.121 -> 244.3.160.239 TCP 70 groove > http [ACK] Seq=1388 Ack=6276 Win=524280 Len=0 TSval=819113142 TSecr=1511945144
311676 106.450144 90.38.138.121 -> 244.3.160.239 TCP 70 [TCP Dup ACK 311671#1] groove > http [ACK] Seq=1388 Ack=6276 Win=524280 Len=0 TSval=819113142 TSecr=1511945144
311697 106.467917 90.38.138.121 -> 244.3.160.239 TCP 70 groove > http [ACK] Seq=1388 Ack=10395 Win=523552 Len=0 TSval=819113142 TSecr=1511945145
311742 106.472023 90.38.138.121 -> 244.3.160.239 TCP 70 [TCP Dup ACK 311697#1] groove > http [ACK] Seq=1388 Ack=10395 Win=523552 Len=0 TSval=819113142 TSecr=1511945145
311775 106.480747 90.38.138.121 -> 244.3.160.239 TCP 70 groove > http [ACK] Seq=1388 Ack=13892 Win=524280 Len=0 TSval=819113142 TSecr=1511945145
311781 106.485193 90.38.138.121 -> 244.3.160.239 TCP 82 8816 > http [SYN] Seq=0 Win=65535 Len=0 MSS=1460 WS=8 TSval=819113142 TSecr=0 SACK_PERM=1
311803 106.494203 90.38.138.121 -> 244.3.160.239 TCP 70 groove > http [ACK] Seq=1388 Ack=15268 Win=524248 Len=0 TSval=819113142 TSecr=1511945148
311804 106.494370 90.38.138.121 -> 244.3.160.239 TCP 70 groove > http [FIN, ACK] Seq=1388 Ack=15268 Win=524280 Len=0 TSval=819113142 TSecr=1511945148
311812 106.498638 90.38.138.121 -> 244.3.160.239 TCP 70 8816 > http [ACK] Seq=1 Ack=1 Win=524280 Len=0 TSval=819113142 TSecr=1511945149
311951 106.520042 90.38.138.121 -> 244.3.160.239 TCP 70 8816 > http [ACK] Seq=1029 Ack=243 Win=524280 Len=0 TSval=819113143 TSecr=1511945151
312238 106.553173 90.38.138.121 -> 244.3.160.239 TCP 70 8816 > http [ACK] Seq=1029 Ack=6035 Win=524176 Len=0 TSval=819113143 TSecr=1511945154
312288 106.568252 90.38.138.121 -> 244.3.160.239 TCP 70 8816 > http [ACK] Seq=1029 Ack=12815 Win=524280 Len=0 TSval=819113143 TSecr=1511945156
312314 106.572386 90.38.138.121 -> 244.3.160.239 TCP 70 [TCP Dup ACK 312288#1] 8816 > http [ACK] Seq=1029 Ack=12815 Win=524280 Len=0 TSval=819113143 TSecr=1511945156
312357 106.582061 90.38.138.121 -> 244.3.160.239 TCP 70 8816 > http [ACK] Seq=1029 Ack=19547 Win=524280 Len=0 TSval=819113143 TSecr=1511945157
312370 106.586108 90.38.138.121 -> 244.3.160.239 TCP 70 [TCP Dup ACK 312357#1] 8816 > http [ACK] Seq=1029 Ack=19547 Win=524280 Len=0 TSval=819113143 TSecr=1511945157
312406 106.596042 90.38.138.121 -> 244.3.160.239 TCP 70 8816 > http [ACK] Seq=1029 Ack=29683 Win=524176 Len=0 TSval=819113143 TSecr=1511945159
312426 106.599930 90.38.138.121 -> 244.3.160.239 TCP 70 [TCP Dup ACK 312406#1] 8816 > http [ACK] Seq=1029 Ack=29683 Win=524176 Len=0 TSval=819113143 TSecr=1511945159
312465 106.611983 90.38.138.121 -> 244.3.160.239 TCP 70 8816 > http [ACK] Seq=1029 Ack=40275 Win=524280 Len=0 TSval=819113144 TSecr=1511945160
312490 106.626847 90.38.138.121 -> 244.3.160.239 TCP 70 8816 > http [ACK] Seq=1029 Ack=53307 Win=524176 Len=0 TSval=819113144 TSecr=1511945162
312504 106.630335 90.38.138.121 -> 244.3.160.239 TCP 70 [TCP Dup ACK 312490#1] 8816 > http [ACK] Seq=1029 Ack=53307 Win=524176 Len=0 TSval=819113144 TSecr=1511945162
312520 106.642429 90.38.138.121 -> 244.3.160.239 TCP 70 8816 > http [ACK] Seq=1029 Ack=66795 Win=524176 Len=0 TSval=819113144 TSecr=1511945163
312548 106.646093 90.38.138.121 -> 244.3.160.239 TCP 70 [TCP Dup ACK 312520#1] 8816 > http [ACK] Seq=1029 Ack=66795 Win=524176 Len=0 TSval=819113144 TSecr=1511945163
312583 106.656863 90.38.138.121 -> 244.3.160.239 TCP 70 8816 > http [ACK] Seq=1029 Ack=81731 Win=524280 Len=0 TSval=819113144 TSecr=1511945165
312603 106.660148 90.38.138.121 -> 244.3.160.239 TCP 70 [TCP Dup ACK 312583#1] 8816 > http [ACK] Seq=1029 Ack=81731 Win=524280 Len=0 TSval=819113144 TSecr=1511945165
312649 106.672237 90.38.138.121 -> 244.3.160.239 TCP 70 8816 > http [ACK] Seq=1029 Ack=99107 Win=524176 Len=0 TSval=819113144 TSecr=1511945166
312674 106.676009 90.38.138.121 -> 244.3.160.239 TCP 70 [TCP Dup ACK 312649#1] 8816 > http [ACK] Seq=1029 Ack=99107 Win=524176 Len=0 TSval=819113144 TSecr=1511945166
312702 106.688056 90.38.138.121 -> 244.3.160.239 TCP 70 8816 > http [ACK] Seq=1029 Ack=105759 Win=523768 Len=0 TSval=819113144 TSecr=1511945168
312703 106.688061 90.38.138.121 -> 244.3.160.239 TCP 70 8816 > http [FIN, ACK] Seq=1029 Ack=105759 Win=524280 Len=0 TSval=819113144 TSecr=1511945168
312713 106.700077 90.38.138.121 -> 244.3.160.239 TCP 70 [TCP Dup ACK 312703#1] 8816 > http [ACK] Seq=1030 Ack=105759 Win=524280 Len=0 TSval=819113144 TSecr=1511945169
312811 106.774505 90.38.138.121 -> 244.3.160.239 TCP 70 8816 > http [ACK] Seq=1030 Ack=105760 Win=524280 Len=0 TSval=819113145 TSecr=1511945177
323832 111.034915 90.38.138.121 -> 244.3.160.239 TCP 82 12236 > http [SYN] Seq=0 Win=65535 Len=0 MSS=1460 WS=8 TSval=819113188 TSecr=0 SACK_PERM=1
323861 111.055094 90.38.138.121 -> 244.3.160.239 TCP 70 12236 > http [ACK] Seq=1 Ack=1 Win=524280 Len=0 TSval=819113188 TSecr=1511945604
323940 111.114114 90.38.138.121 -> 244.3.160.239 TCP 70 12236 > http [ACK] Seq=1023 Ack=4099 Win=524280 Len=0 TSval=819113188 TSecr=1511945610
323945 111.126105 90.38.138.121 -> 244.3.160.239 TCP 70 12236 > http [ACK] Seq=1023 Ack=4450 Win=524280 Len=0 TSval=819113189 TSecr=1511945612
323946 111.130125 90.38.138.121 -> 244.3.160.239 TCP 70 12236 > http [FIN, ACK] Seq=1023 Ack=4450 Win=524280 Len=0 TSval=819113189 TSecr=1511945612
338173 117.687092 90.38.138.121 -> 244.3.160.239 TCP 82 14935 > http [SYN] Seq=0 Win=65535 Len=0 MSS=1460 WS=8 TSval=819113254 TSecr=0 SACK_PERM=1
338587 117.701333 90.38.138.121 -> 244.3.160.239 TCP 70 14935 > http [ACK] Seq=1 Ack=1 Win=524280 Len=0 TSval=819113254 TSecr=1511946269
348495 118.050209 90.38.138.121 -> 244.3.160.239 TCP 70 14935 > http [ACK] Seq=1388 Ack=2173 Win=523448 Len=0 TSval=819113258 TSecr=1511946304
349651 118.183928 90.38.138.121 -> 244.3.160.239 TCP 70 14935 > http [ACK] Seq=1388 Ack=6276 Win=523568 Len=0 TSval=819113259 TSecr=1511946317
349656 118.188704 90.38.138.121 -> 244.3.160.239 TCP 70 [TCP Dup ACK 349651#1] 14935 > http [ACK] Seq=1388 Ack=6276 Win=523568 Len=0 TSval=819113259 TSecr=1511946317
349665 118.197987 90.38.138.121 -> 244.3.160.239 TCP 70 14935 > http [ACK] Seq=1388 Ack=10395 Win=523552 Len=0 TSval=819113259 TSecr=1511946319
349679 118.210989 90.38.138.121 -> 244.3.160.239 TCP 70 14935 > http [ACK] Seq=1388 Ack=13892 Win=524280 Len=0 TSval=819113259 TSecr=1511946319
349690 118.214879 90.38.138.121 -> 244.3.160.239 TCP 82 11054 > http [SYN] Seq=0 Win=65535 Len=0 MSS=1460 WS=8 TSval=819113259 TSecr=0 SACK_PERM=1
349699 118.224143 90.38.138.121 -> 244.3.160.239 TCP 70 14935 > http [ACK] Seq=1388 Ack=15285 Win=524232 Len=0 TSval=819113260 TSecr=1511946321
349700 118.224148 90.38.138.121 -> 244.3.160.239 TCP 70 14935 > http [FIN, ACK] Seq=1388 Ack=15285 Win=524280 Len=0 TSval=819113260 TSecr=1511946321
349712 118.228542 90.38.138.121 -> 244.3.160.239 TCP 70 11054 > http [ACK] Seq=1 Ack=1 Win=524280 Len=0 TSval=819113260 TSecr=1511946322
349788 118.250227 90.38.138.121 -> 244.3.160.239 TCP 70 11054 > http [ACK] Seq=1030 Ack=243 Win=524280 Len=0 TSval=819113260 TSecr=1511946324
350068 118.346307 90.38.138.121 -> 244.3.160.239 TCP 70 11054 > http [ACK] Seq=1030 Ack=6035 Win=524176 Len=0 TSval=819113261 TSecr=1511946334
350176 118.359953 90.38.138.121 -> 244.3.160.239 TCP 70 11054 > http [ACK] Seq=1030 Ack=13275 Win=524176 Len=0 TSval=819113261 TSecr=1511946335
350184 118.363972 90.38.138.121 -> 244.3.160.239 TCP 70 [TCP Dup ACK 350176#1] 11054 > http [ACK] Seq=1030 Ack=13275 Win=524176 Len=0 TSval=819113261 TSecr=1511946335
350214 118.373957 90.38.138.121 -> 244.3.160.239 TCP 70 11054 > http [ACK] Seq=1030 Ack=19523 Win=524280 Len=0 TSval=819113261 TSecr=1511946336
350243 118.387990 90.38.138.121 -> 244.3.160.239 TCP 70 11054 > http [ACK] Seq=1030 Ack=29659 Win=524176 Len=0 TSval=819113261 TSecr=1511946338
350265 118.392175 90.38.138.121 -> 244.3.160.239 TCP 70 [TCP Dup ACK 350243#1] 11054 > http [ACK] Seq=1030 Ack=29659 Win=524176 Len=0 TSval=819113261 TSecr=1511946338
350291 118.401975 90.38.138.121 -> 244.3.160.239 TCP 70 11054 > http [ACK] Seq=1030 Ack=38803 Win=523720 Len=0 TSval=819113261 TSecr=1511946339
350303 118.405906 90.38.138.121 -> 244.3.160.239 TCP 70 [TCP Dup ACK 350291#1] 11054 > http [ACK] Seq=1030 Ack=38803 Win=523720 Len=0 TSval=819113261 TSecr=1511946339
350314 118.416909 90.38.138.121 -> 244.3.160.239 TCP 70 11054 > http [ACK] Seq=1030 Ack=51835 Win=524176 Len=0 TSval=819113261 TSecr=1511946341
350398 118.421313 90.38.138.121 -> 244.3.160.239 TCP 70 [TCP Dup ACK 350314#1] 11054 > http [ACK] Seq=1030 Ack=51835 Win=524176 Len=0 TSval=819113261 TSecr=1511946341
350421 118.432165 90.38.138.121 -> 244.3.160.239 TCP 70 11054 > http [ACK] Seq=1030 Ack=63875 Win=524176 Len=0 TSval=819113262 TSecr=1511946342
350509 118.458160 90.38.138.121 -> 244.3.160.239 TCP 70 11054 > http [ACK] Seq=1030 Ack=78811 Win=524280 Len=0 TSval=819113262 TSecr=1511946344
350527 118.463236 90.38.138.121 -> 244.3.160.239 TCP 70 [TCP Dup ACK 350509#1] 11054 > http [ACK] Seq=1030 Ack=78811 Win=524280 Len=0 TSval=819113262 TSecr=1511946344
350547 118.473556 90.38.138.121 -> 244.3.160.239 TCP 70 11054 > http [ACK] Seq=1030 Ack=96187 Win=524176 Len=0 TSval=819113262 TSecr=1511946346
350576 118.477997 90.38.138.121 -> 244.3.160.239 TCP 70 [TCP Dup ACK 350547#1] 11054 > http [ACK] Seq=1030 Ack=96187 Win=524176 Len=0 TSval=819113262 TSecr=1511946346
350646 118.488098 90.38.138.121 -> 244.3.160.239 TCP 70 11054 > http [ACK] Seq=1030 Ack=114019 Win=524176 Len=0 TSval=819113262 TSecr=1511946348
350665 118.492877 90.38.138.121 -> 244.3.160.239 TCP 70 [TCP Dup ACK 350646#1] 11054 > http [ACK] Seq=1030 Ack=114019 Win=524176 Len=0 TSval=819113262 TSecr=1511946348
350687 118.502122 90.38.138.121 -> 244.3.160.239 TCP 70 11054 > http [ACK] Seq=1030 Ack=130403 Win=523720 Len=0 TSval=819113262 TSecr=1511946349
350728 118.506035 90.38.138.121 -> 244.3.160.239 TCP 70 [TCP Dup ACK 350687#1] 11054 > http [ACK] Seq=1030 Ack=130403 Win=523720 Len=0 TSval=819113262 TSecr=1511946349
350964 118.595968 90.38.138.121 -> 244.3.160.239 TCP 70 11054 > http [ACK] Seq=1030 Ack=131918 Win=524104 Len=0 TSval=819113263 TSecr=1511946359
350965 118.595990 90.38.138.121 -> 244.3.160.239 TCP 70 11054 > http [FIN, ACK] Seq=1030 Ack=131918 Win=524280 Len=0 TSval=819113263 TSecr=1511946359
350996 118.609535 90.38.138.121 -> 244.3.160.239 TCP 70 [TCP Dup ACK 350965#1] 11054 > http [ACK] Seq=1031 Ack=131918 Win=524280 Len=0 TSval=819113263 TSecr=1511946360
351148 118.704352 90.38.138.121 -> 244.3.160.239 TCP 70 11054 > http [ACK] Seq=1031 Ack=131919 Win=524280 Len=0 TSval=819113264 TSecr=1511946370
354929 120.944692 90.38.138.121 -> 244.3.160.239 TCP 82 8973 > http [SYN] Seq=0 Win=65535 Len=0 MSS=1460 WS=8 TSval=819113287 TSecr=0 SACK_PERM=1
354948 120.959850 90.38.138.121 -> 244.3.160.239 TCP 70 8973 > http [ACK] Seq=1 Ack=1 Win=524280 Len=0 TSval=819113287 TSecr=1511946595
355824 121.322031 90.38.138.121 -> 244.3.160.239 TCP 70 8973 > http [ACK] Seq=1023 Ack=4099 Win=524280 Len=0 TSval=819113291 TSecr=1511946631
355832 121.325914 90.38.138.121 -> 244.3.160.239 TCP 70 [TCP Dup ACK 355824#1] 8973 > http [ACK] Seq=1023 Ack=4099 Win=524280 Len=0 TSval=819113291 TSecr=1511946631
355878 121.344039 90.38.138.121 -> 244.3.160.239 TCP 70 8973 > http [ACK] Seq=1023 Ack=4467 Win=524280 Len=0 TSval=819113291 TSecr=1511946633
355879 121.344044 90.38.138.121 -> 244.3.160.239 TCP 70 8973 > http [FIN, ACK] Seq=1023 Ack=4467 Win=524280 Len=0 TSval=819113291 TSecr=1511946633
793788 258.553928 90.38.138.121 -> 244.3.160.239 TCP 82 sun-as-jpda > http [SYN] Seq=0 Win=65535 Len=0 MSS=1460 WS=8 TSval=819114662 TSecr=0 SACK_PERM=1
793810 258.566098 90.38.138.121 -> 244.3.160.239 TCP 70 sun-as-jpda > http [ACK] Seq=1 Ack=1 Win=524280 Len=0 TSval=819114662 TSecr=1511960356
794815 258.930972 90.38.138.121 -> 244.3.160.239 TCP 70 sun-as-jpda > http [ACK] Seq=1023 Ack=4099 Win=523568 Len=0 TSval=819114665 TSecr=1511960392
794823 258.934829 90.38.138.121 -> 244.3.160.239 TCP 70 [TCP Dup ACK 794815#1] sun-as-jpda > http [ACK] Seq=1023 Ack=4099 Win=523568 Len=0 TSval=819114665 TSecr=1511960392
794838 258.952193 90.38.138.121 -> 244.3.160.239 TCP 70 sun-as-jpda > http [ACK] Seq=1023 Ack=4467 Win=524280 Len=0 TSval=819114665 TSecr=1511960394
794848 258.957358 90.38.138.121 -> 244.3.160.239 TCP 70 sun-as-jpda > http [FIN, ACK] Seq=1023 Ack=4467 Win=524280 Len=0 TSval=819114665 TSecr=1511960394
808932 263.906058 90.38.138.121 -> 244.3.160.239 TCP 82 4459 > http [SYN] Seq=0 Win=65535 Len=0 MSS=1460 WS=8 TSval=819114715 TSecr=0 SACK_PERM=1
808965 263.918134 90.38.138.121 -> 244.3.160.239 TCP 70 4459 > http [ACK] Seq=1 Ack=1 Win=524280 Len=0 TSval=819114715 TSecr=1511960891
810493 264.257219 90.38.138.121 -> 244.3.160.239 TCP 70 4459 > http [ACK] Seq=1388 Ack=2173 Win=523448 Len=0 TSval=819114718 TSecr=1511960925
810770 264.378277 90.38.138.121 -> 244.3.160.239 TCP 70 4459 > http [ACK] Seq=1388 Ack=6276 Win=524280 Len=0 TSval=819114720 TSecr=1511960937
810788 264.382363 90.38.138.121 -> 244.3.160.239 TCP 70 [TCP Dup ACK 810770#1] 4459 > http [ACK] Seq=1388 Ack=6276 Win=524280 Len=0 TSval=819114720 TSecr=1511960937
810800 264.390001 90.38.138.121 -> 244.3.160.239 TCP 70 4459 > http [ACK] Seq=1388 Ack=10395 Win=523552 Len=0 TSval=819114720 TSecr=1511960938
810804 264.394043 90.38.138.121 -> 244.3.160.239 TCP 70 [TCP Dup ACK 810800#1] 4459 > http [ACK] Seq=1388 Ack=10395 Win=523552 Len=0 TSval=819114720 TSecr=1511960938
810826 264.404221 90.38.138.121 -> 244.3.160.239 TCP 70 4459 > http [ACK] Seq=1388 Ack=13892 Win=524280 Len=0 TSval=819114720 TSecr=1511960938
810828 264.407960 90.38.138.121 -> 244.3.160.239 TCP 82 8597 > http [SYN] Seq=0 Win=65535 Len=0 MSS=1460 WS=8 TSval=819114720 TSecr=0 SACK_PERM=1
810844 264.418378 90.38.138.121 -> 244.3.160.239 TCP 70 4459 > http [ACK] Seq=1388 Ack=15245 Win=524272 Len=0 TSval=819114720 TSecr=1511960941
810845 264.418383 90.38.138.121 -> 244.3.160.239 TCP 70 4459 > http [FIN, ACK] Seq=1388 Ack=15245 Win=524280 Len=0 TSval=819114720 TSecr=1511960941
810860 264.422822 90.38.138.121 -> 244.3.160.239 TCP 70 8597 > http [ACK] Seq=1 Ack=1 Win=524280 Len=0 TSval=819114720 TSecr=1511960941
810993 264.452016 90.38.138.121 -> 244.3.160.239 TCP 70 8597 > http [ACK] Seq=1029 Ack=243 Win=524280 Len=0 TSval=819114720 TSecr=1511960944
811329 264.554118 90.38.138.121 -> 244.3.160.239 TCP 70 8597 > http [ACK] Seq=1029 Ack=6035 Win=524176 Len=0 TSval=819114721 TSecr=1511960955
811347 264.558145 90.38.138.121 -> 244.3.160.239 TCP 70 [TCP Dup ACK 811329#1] 8597 > http [ACK] Seq=1029 Ack=6035 Win=524176 Len=0 TSval=819114721 TSecr=1511960955
811396 264.568128 90.38.138.121 -> 244.3.160.239 TCP 70 8597 > http [ACK] Seq=1029 Ack=13275 Win=524176 Len=0 TSval=819114722 TSecr=1511960956
811403 264.571948 90.38.138.121 -> 244.3.160.239 TCP 70 [TCP Dup ACK 811396#1] 8597 > http [ACK] Seq=1029 Ack=13275 Win=524176 Len=0 TSval=819114722 TSecr=1511960956
811438 264.582321 90.38.138.121 -> 244.3.160.239 TCP 70 8597 > http [ACK] Seq=1029 Ack=19523 Win=524280 Len=0 TSval=819114722 TSecr=1511960957
811449 264.587293 90.38.138.121 -> 244.3.160.239 TCP 70 [TCP Dup ACK 811438#1] 8597 > http [ACK] Seq=1029 Ack=19523 Win=524280 Len=0 TSval=819114722 TSecr=1511960957
811474 264.596333 90.38.138.121 -> 244.3.160.239 TCP 70 8597 > http [ACK] Seq=1029 Ack=29659 Win=524176 Len=0 TSval=819114722 TSecr=1511960959
811514 264.600305 90.38.138.121 -> 244.3.160.239 TCP 70 [TCP Dup ACK 811474#1] 8597 > http [ACK] Seq=1029 Ack=29659 Win=524176 Len=0 TSval=819114722 TSecr=1511960959
811574 264.610102 90.38.138.121 -> 244.3.160.239 TCP 70 8597 > http [ACK] Seq=1029 Ack=38803 Win=524280 Len=0 TSval=819114722 TSecr=1511960960
811617 264.614536 90.38.138.121 -> 244.3.160.239 TCP 70 [TCP Dup ACK 811574#1] 8597 > http [ACK] Seq=1029 Ack=38803 Win=524280 Len=0 TSval=819114722 TSecr=1511960960
811639 264.625338 90.38.138.121 -> 244.3.160.239 TCP 70 8597 > http [ACK] Seq=1029 Ack=51835 Win=521280 Len=0 TSval=819114722 TSecr=1511960962
811670 264.628399 90.38.138.121 -> 244.3.160.239 TCP 70 [TCP Dup ACK 811639#1] 8597 > http [ACK] Seq=1029 Ack=51835 Win=521280 Len=0 TSval=819114722 TSecr=1511960962
811737 264.648576 90.38.138.121 -> 244.3.160.239 TCP 70 8597 > http [ACK] Seq=1029 Ack=63875 Win=524176 Len=0 TSval=819114722 TSecr=1511960963
811748 264.652061 90.38.138.121 -> 244.3.160.239 TCP 70 [TCP Dup ACK 811737#1] 8597 > http [ACK] Seq=1029 Ack=63875 Win=524176 Len=0 TSval=819114722 TSecr=1511960963
811763 264.661867 90.38.138.121 -> 244.3.160.239 TCP 70 8597 > http [ACK] Seq=1029 Ack=75915 Win=523720 Len=0 TSval=819114723 TSecr=1511960965
811778 264.666778 90.38.138.121 -> 244.3.160.239 TCP 70 8597 > http [ACK] Seq=1029 Ack=78811 Win=524280 Len=0 TSval=819114723 TSecr=1511960965
811784 264.670266 90.38.138.121 -> 244.3.160.239 TCP 70 [TCP Dup ACK 811778#1] 8597 > http [ACK] Seq=1029 Ack=78811 Win=524280 Len=0 TSval=819114723 TSecr=1511960965
811789 264.676172 90.38.138.121 -> 244.3.160.239 TCP 70 8597 > http [ACK] Seq=1029 Ack=93291 Win=518384 Len=0 TSval=819114723 TSecr=1511960967
811844 264.680348 90.38.138.121 -> 244.3.160.239 TCP 70 8597 > http [ACK] Seq=1029 Ack=97635 Win=524176 Len=0 TSval=819114723 TSecr=1511960967
811858 264.683993 90.38.138.121 -> 244.3.160.239 TCP 70 [TCP Dup ACK 811844#1] 8597 > http [ACK] Seq=1029 Ack=97635 Win=524176 Len=0 TSval=819114723 TSecr=1511960967
811877 264.692343 90.38.138.121 -> 244.3.160.239 TCP 70 8597 > http [ACK] Seq=1029 Ack=118363 Win=524280 Len=0 TSval=819114723 TSecr=1511960969
811903 264.695980 90.38.138.121 -> 244.3.160.239 TCP 70 [TCP Dup ACK 811877#1] 8597 > http [ACK] Seq=1029 Ack=118363 Win=524280 Len=0 TSval=819114723 TSecr=1511960969
811918 264.705887 90.38.138.121 -> 244.3.160.239 TCP 70 8597 > http [ACK] Seq=1029 Ack=134747 Win=524280 Len=0 TSval=819114723 TSecr=1511960970
811935 264.710974 90.38.138.121 -> 244.3.160.239 TCP 70 8597 > http [ACK] Seq=1029 Ack=139091 Win=524176 Len=0 TSval=819114723 TSecr=1511960970
811941 264.715637 90.38.138.121 -> 244.3.160.239 TCP 70 8597 > http [ACK] Seq=1029 Ack=144883 Win=524280 Len=0 TSval=819114723 TSecr=1511960971
811961 264.719386 90.38.138.121 -> 244.3.160.239 TCP 70 8597 > http [ACK] Seq=1029 Ack=158371 Win=524176 Len=0 TSval=819114723 TSecr=1511960971
811968 264.721985 90.38.138.121 -> 244.3.160.239 TCP 70 8597 > http [ACK] Seq=1029 Ack=161727 Win=523712 Len=0 TSval=819114723 TSecr=1511960972
811989 264.725900 90.38.138.121 -> 244.3.160.239 TCP 70 [TCP Dup ACK 811968#1] 8597 > http [ACK] Seq=1029 Ack=161727 Win=523712 Len=0 TSval=819114723 TSecr=1511960972
811990 264.725905 90.38.138.121 -> 244.3.160.239 TCP 70 8597 > http [FIN, ACK] Seq=1029 Ack=161727 Win=524280 Len=0 TSval=819114723 TSecr=1511960972
811998 264.738310 90.38.138.121 -> 244.3.160.239 TCP 70 [TCP Dup ACK 811990#1] 8597 > http [ACK] Seq=1030 Ack=161727 Win=524280 Len=0 TSval=819114723 TSecr=1511960973
812212 264.806326 90.38.138.121 -> 244.3.160.239 TCP 70 8597 > http [ACK] Seq=1030 Ack=161728 Win=524280 Len=0 TSval=819114724 TSecr=1511960979
817089 266.542673 90.38.138.121 -> 244.3.160.239 TCP 82 8583 > http [SYN] Seq=0 Win=65535 Len=0 MSS=1460 WS=8 TSval=819114741 TSecr=0 SACK_PERM=1
817115 266.564717 90.38.138.121 -> 244.3.160.239 TCP 70 8583 > http [ACK] Seq=1 Ack=1 Win=524280 Len=0 TSval=819114741 TSecr=1511961155
818216 266.965098 90.38.138.121 -> 244.3.160.239 TCP 70 8583 > http [ACK] Seq=1022 Ack=4099 Win=524280 Len=0 TSval=819114745 TSecr=1511961195
818282 266.984690 90.38.138.121 -> 244.3.160.239 TCP 70 8583 > http [ACK] Seq=1022 Ack=4404 Win=524280 Len=0 TSval=819114746 TSecr=1511961197
818301 266.989679 90.38.138.121 -> 244.3.160.239 TCP 70 8583 > http [FIN, ACK] Seq=1022 Ack=4404 Win=524280 Len=0 TSval=819114746 TSecr=1511961197
830219 271.218260 90.38.138.121 -> 244.3.160.239 TCP 82 5734 > http [SYN] Seq=0 Win=65535 Len=0 MSS=1460 WS=8 TSval=819114788 TSecr=0 SACK_PERM=1
830231 271.231555 90.38.138.121 -> 244.3.160.239 TCP 70 5734 > http [ACK] Seq=1 Ack=1 Win=524280 Len=0 TSval=819114788 TSecr=1511961622
830687 271.562088 90.38.138.121 -> 244.3.160.239 TCP 70 5734 > http [ACK] Seq=1388 Ack=2173 Win=524280 Len=0 TSval=819114791 TSecr=1511961655
830870 271.688221 90.38.138.121 -> 244.3.160.239 TCP 70 5734 > http [ACK] Seq=1388 Ack=6276 Win=524280 Len=0 TSval=819114793 TSecr=1511961668
830879 271.692261 90.38.138.121 -> 244.3.160.239 TCP 70 [TCP Dup ACK 830870#1] 5734 > http [ACK] Seq=1388 Ack=6276 Win=524280 Len=0 TSval=819114793 TSecr=1511961668
830883 271.701914 90.38.138.121 -> 244.3.160.239 TCP 70 5734 > http [ACK] Seq=1388 Ack=10395 Win=523552 Len=0 TSval=819114793 TSecr=1511961669
830911 271.716072 90.38.138.121 -> 244.3.160.239 TCP 70 5734 > http [ACK] Seq=1388 Ack=13892 Win=524280 Len=0 TSval=819114793 TSecr=1511961669
830943 271.722214 90.38.138.121 -> 244.3.160.239 TCP 82 14431 > http [SYN] Seq=0 Win=65535 Len=0 MSS=1460 WS=8 TSval=819114793 TSecr=0 SACK_PERM=1
830994 271.733001 90.38.138.121 -> 244.3.160.239 TCP 70 5734 > http [ACK] Seq=1388 Ack=15280 Win=524232 Len=0 TSval=819114793 TSecr=1511961672
830995 271.733005 90.38.138.121 -> 244.3.160.239 TCP 70 5734 > http [FIN, ACK] Seq=1388 Ack=15280 Win=524280 Len=0 TSval=819114793 TSecr=1511961672
831003 271.736124 90.38.138.121 -> 244.3.160.239 TCP 70 14431 > http [ACK] Seq=1 Ack=1 Win=524280 Len=0 TSval=819114793 TSecr=1511961673
831093 271.762146 90.38.138.121 -> 244.3.160.239 TCP 70 14431 > http [ACK] Seq=1029 Ack=243 Win=524280 Len=0 TSval=819114793 TSecr=1511961675
831306 271.806492 90.38.138.121 -> 244.3.160.239 TCP 70 14431 > http [ACK] Seq=1029 Ack=6035 Win=524176 Len=0 TSval=819114794 TSecr=1511961680
831403 271.822634 90.38.138.121 -> 244.3.160.239 TCP 70 14431 > http [ACK] Seq=1029 Ack=12815 Win=524280 Len=0 TSval=819114794 TSecr=1511961681
831502 271.835947 90.38.138.121 -> 244.3.160.239 TCP 70 14431 > http [ACK] Seq=1029 Ack=19547 Win=524280 Len=0 TSval=819114794 TSecr=1511961683
831511 271.840084 90.38.138.121 -> 244.3.160.239 TCP 70 [TCP Dup ACK 831502#1] 14431 > http [ACK] Seq=1029 Ack=19547 Win=524280 Len=0 TSval=819114794 TSecr=1511961683
831552 271.852312 90.38.138.121 -> 244.3.160.239 TCP 70 14431 > http [ACK] Seq=1029 Ack=29683 Win=524176 Len=0 TSval=819114794 TSecr=1511961684
831589 271.865890 90.38.138.121 -> 244.3.160.239 TCP 70 14431 > http [ACK] Seq=1029 Ack=38827 Win=523720 Len=0 TSval=819114795 TSecr=1511961686
831618 271.870849 90.38.138.121 -> 244.3.160.239 TCP 70 [TCP Dup ACK 831589#1] 14431 > http [ACK] Seq=1029 Ack=38827 Win=523720 Len=0 TSval=819114795 TSecr=1511961686
831666 271.883280 90.38.138.121 -> 244.3.160.239 TCP 70 14431 > http [ACK] Seq=1029 Ack=51859 Win=524176 Len=0 TSval=819114795 TSecr=1511961687
831679 271.886381 90.38.138.121 -> 244.3.160.239 TCP 70 [TCP Dup ACK 831666#1] 14431 > http [ACK] Seq=1029 Ack=51859 Win=524176 Len=0 TSval=819114795 TSecr=1511961687
831711 271.897077 90.38.138.121 -> 244.3.160.239 TCP 70 14431 > http [ACK] Seq=1029 Ack=63899 Win=524176 Len=0 TSval=819114795 TSecr=1511961689
831731 271.900025 90.38.138.121 -> 244.3.160.239 TCP 70 [TCP Dup ACK 831711#1] 14431 > http [ACK] Seq=1029 Ack=63899 Win=524176 Len=0 TSval=819114795 TSecr=1511961689
831796 271.916092 90.38.138.121 -> 244.3.160.239 TCP 70 14431 > http [ACK] Seq=1029 Ack=78835 Win=524280 Len=0 TSval=819114795 TSecr=1511961690
831884 271.920263 90.38.138.121 -> 244.3.160.239 TCP 70 [TCP Dup ACK 831796#1] 14431 > http [ACK] Seq=1029 Ack=78835 Win=524280 Len=0 TSval=819114795 TSecr=1511961690
831949 271.930773 90.38.138.121 -> 244.3.160.239 TCP 70 14431 > http [ACK] Seq=1029 Ack=96211 Win=524176 Len=0 TSval=819114795 TSecr=1511961692
831987 271.935001 90.38.138.121 -> 244.3.160.239 TCP 70 [TCP Dup ACK 831949#1] 14431 > http [ACK] Seq=1029 Ack=96211 Win=524176 Len=0 TSval=819114795 TSecr=1511961692
831990 271.946915 90.38.138.121 -> 244.3.160.239 TCP 70 14431 > http [ACK] Seq=1029 Ack=112579 Win=524280 Len=0 TSval=819114795 TSecr=1511961694
832011 271.950631 90.38.138.121 -> 244.3.160.239 TCP 70 [TCP Dup ACK 831990#1] 14431 > http [ACK] Seq=1029 Ack=112579 Win=524280 Len=0 TSval=819114795 TSecr=1511961694
832023 271.963054 90.38.138.121 -> 244.3.160.239 TCP 70 14431 > http [ACK] Seq=1029 Ack=128507 Win=524280 Len=0 TSval=819114796 TSecr=1511961695
832033 271.969310 90.38.138.121 -> 244.3.160.239 TCP 70 14431 > http [ACK] Seq=1029 Ack=131859 Win=523720 Len=0 TSval=819114796 TSecr=1511961695
832035 271.972944 90.38.138.121 -> 244.3.160.239 TCP 70 [TCP Dup ACK 832033#1] 14431 > http [ACK] Seq=1029 Ack=131859 Win=523720 Len=0 TSval=819114796 TSecr=1511961695
832041 271.978192 90.38.138.121 -> 244.3.160.239 TCP 70 14431 > http [ACK] Seq=1029 Ack=143312 Win=524280 Len=0 TSval=819114796 TSecr=1511961697
832044 271.982018 90.38.138.121 -> 244.3.160.239 TCP 70 [TCP Dup ACK 832041#1] 14431 > http [ACK] Seq=1029 Ack=143312 Win=524280 Len=0 TSval=819114796 TSecr=1511961697
832045 271.982022 90.38.138.121 -> 244.3.160.239 TCP 70 14431 > http [FIN, ACK] Seq=1029 Ack=143312 Win=524280 Len=0 TSval=819114796 TSecr=1511961697
832064 271.994579 90.38.138.121 -> 244.3.160.239 TCP 70 [TCP Dup ACK 832045#1] 14431 > http [ACK] Seq=1030 Ack=143312 Win=524280 Len=0 TSval=819114796 TSecr=1511961699
832180 272.064634 90.38.138.121 -> 244.3.160.239 TCP 70 14431 > http [ACK] Seq=1030 Ack=143313 Win=524280 Len=0 TSval=819114796 TSecr=1511961706
840050 275.386033 90.38.138.121 -> 244.3.160.239 TCP 82 15042 > http [SYN] Seq=0 Win=65535 Len=0 MSS=1460 WS=8 TSval=819114830 TSecr=0 SACK_PERM=1
840066 275.398773 90.38.138.121 -> 244.3.160.239 TCP 70 15042 > http [ACK] Seq=1 Ack=1 Win=524280 Len=0 TSval=819114830 TSecr=1511962039
840777 275.773970 90.38.138.121 -> 244.3.160.239 TCP 70 15042 > http [ACK] Seq=1023 Ack=4099 Win=524280 Len=0 TSval=819114834 TSecr=1511962077
840790 275.777838 90.38.138.121 -> 244.3.160.239 TCP 70 [TCP Dup ACK 840777#1] 15042 > http [ACK] Seq=1023 Ack=4099 Win=524280 Len=0 TSval=819114834 TSecr=1511962077
840822 275.786361 90.38.138.121 -> 244.3.160.239 TCP 70 15042 > http [ACK] Seq=1023 Ack=4461 Win=524280 Len=0 TSval=819114834 TSecr=1511962078
840824 275.789894 90.38.138.121 -> 244.3.160.239 TCP 70 15042 > http [FIN, ACK] Seq=1023 Ack=4461 Win=524280 Len=0 TSval=819114834 TSecr=1511962078
