52227  21.505169 90.38.224.130 -> 41.177.98.176 TCP 82 60011 > http [SYN] Seq=0 Win=65535 Len=0 MSS=1460 WS=2 TSval=899492997 TSecr=0 SACK_PERM=1
52523  21.781744 90.38.224.130 -> 41.177.98.176 TCP 70 60011 > http [ACK] Seq=1 Ack=1 Win=66608 Len=0 TSval=899492999 TSecr=1542709
55816  22.952466 90.38.224.130 -> 41.177.98.176 TCP 70 60011 > http [ACK] Seq=894 Ack=4345 Win=65160 Len=0 TSval=899493011 TSecr=1542837
55900  22.973197 90.38.224.130 -> 41.177.98.176 TCP 70 60011 > http [ACK] Seq=894 Ack=9679 Win=65160 Len=0 TSval=899493011 TSecr=1542854
55935  22.987301 90.38.224.130 -> 41.177.98.176 TCP 70 60011 > http [ACK] Seq=894 Ack=14807 Win=66608 Len=0 TSval=899493011 TSecr=1542856
55958  22.999365 90.38.224.130 -> 41.177.98.176 TCP 70 60011 > http [ACK] Seq=894 Ack=19753 Win=63894 Len=0 TSval=899493012 TSecr=1542857
55969  23.003172 90.38.224.130 -> 41.177.98.176 TCP 70 [TCP Dup ACK 55958#1] 60011 > http [ACK] Seq=894 Ack=19753 Win=63894 Len=0 TSval=899493012 TSecr=1542857
55970  23.003177 90.38.224.130 -> 41.177.98.176 TCP 70 60011 > http [FIN, ACK] Seq=894 Ack=19753 Win=66608 Len=0 TSval=899493012 TSecr=1542857
55999  23.016526 90.38.224.130 -> 41.177.98.176 TCP 70 60011 > http [ACK] Seq=895 Ack=19754 Win=66608 Len=0 TSval=899493012 TSecr=1542859
56793  23.313337 90.38.224.130 -> 41.177.98.176 TCP 82 60017 > http [SYN] Seq=0 Win=65535 Len=0 MSS=1460 WS=2 TSval=899493015 TSecr=0 SACK_PERM=1
59051  23.825823 90.38.224.130 -> 41.177.98.176 TCP 70 60017 > http [ACK] Seq=1 Ack=1 Win=66608 Len=0 TSval=899493020 TSecr=1542890
59624  24.002663 90.38.224.130 -> 41.177.98.176 TCP 70 60017 > http [ACK] Seq=727 Ack=1462 Win=65146 Len=0 TSval=899493021 TSecr=1542957
59625  24.002668 90.38.224.130 -> 41.177.98.176 TCP 70 60017 > http [FIN, ACK] Seq=727 Ack=1462 Win=66608 Len=0 TSval=899493021 TSecr=1542957
59668  24.017430 90.38.224.130 -> 41.177.98.176 TCP 70 60017 > http [ACK] Seq=728 Ack=1463 Win=66608 Len=0 TSval=899493022 TSecr=1542959
61499  25.169065 90.38.224.130 -> 41.177.98.176 TCP 82 60049 > http [SYN] Seq=0 Win=65535 Len=0 MSS=1460 WS=2 TSval=899493033 TSecr=0 SACK_PERM=1
61547  25.183324 90.38.224.130 -> 41.177.98.176 TCP 70 60049 > http [ACK] Seq=1 Ack=1 Win=66608 Len=0 TSval=899493033 TSecr=1543075
66236  27.298704 90.38.224.130 -> 41.177.98.176 TCP 70 60049 > http [ACK] Seq=730 Ack=4345 Win=65160 Len=0 TSval=899493054 TSecr=1543287
67690  27.858470 90.38.224.130 -> 41.177.98.176 TCP 70 60049 > http [ACK] Seq=730 Ack=10137 Win=65160 Len=0 TSval=899493060 TSecr=1543288
67698  27.862620 90.38.224.130 -> 41.177.98.176 TCP 70 [TCP Dup ACK 67690#1] 60049 > http [ACK] Seq=730 Ack=10137 Win=65160 Len=0 TSval=899493060 TSecr=1543288
67715  27.872482 90.38.224.130 -> 41.177.98.176 TCP 70 60049 > http [ACK] Seq=730 Ack=17377 Win=65160 Len=0 TSval=899493060 TSecr=1543344
67743  27.885314 90.38.224.130 -> 41.177.98.176 TCP 70 60049 > http [ACK] Seq=730 Ack=26065 Win=65160 Len=0 TSval=899493060 TSecr=1543346
67766  27.889924 90.38.224.130 -> 41.177.98.176 TCP 70 [TCP Dup ACK 67743#1] 60049 > http [ACK] Seq=730 Ack=26065 Win=65160 Len=0 TSval=899493060 TSecr=1543346
67788  27.900493 90.38.224.130 -> 41.177.98.176 TCP 70 60049 > http [ACK] Seq=730 Ack=36201 Win=65160 Len=0 TSval=899493060 TSecr=1543347
67808  27.904471 90.38.224.130 -> 41.177.98.176 TCP 70 [TCP Dup ACK 67788#1] 60049 > http [ACK] Seq=730 Ack=36201 Win=65160 Len=0 TSval=899493060 TSecr=1543347
67834  27.916427 90.38.224.130 -> 41.177.98.176 TCP 70 60049 > http [ACK] Seq=730 Ack=47785 Win=65160 Len=0 TSval=899493061 TSecr=1543349
67848  27.921008 90.38.224.130 -> 41.177.98.176 TCP 70 [TCP Dup ACK 67834#1] 60049 > http [ACK] Seq=730 Ack=47785 Win=65160 Len=0 TSval=899493061 TSecr=1543349
67888  27.932599 90.38.224.130 -> 41.177.98.176 TCP 70 60049 > http [ACK] Seq=730 Ack=60817 Win=65160 Len=0 TSval=899493061 TSecr=1543350
67908  27.937408 90.38.224.130 -> 41.177.98.176 TCP 70 [TCP Dup ACK 67888#1] 60049 > http [ACK] Seq=730 Ack=60817 Win=65160 Len=0 TSval=899493061 TSecr=1543350
67923  27.945754 90.38.224.130 -> 41.177.98.176 TCP 70 60049 > http [ACK] Seq=730 Ack=75297 Win=65160 Len=0 TSval=899493061 TSecr=1543352
67942  27.949226 90.38.224.130 -> 41.177.98.176 TCP 70 [TCP Dup ACK 67923#1] 60049 > http [ACK] Seq=730 Ack=75297 Win=65160 Len=0 TSval=899493061 TSecr=1543352
67947  27.953157 90.38.224.130 -> 41.177.98.176 TCP 70 [TCP Dup ACK 67923#2] 60049 > http [ACK] Seq=730 Ack=75297 Win=65160 Len=0 TSval=899493061 TSecr=1543352
67961  27.959724 90.38.224.130 -> 41.177.98.176 TCP 70 60049 > http [ACK] Seq=730 Ack=82537 Win=66608 Len=0 TSval=899493061 TSecr=1543353
67978  27.963356 90.38.224.130 -> 41.177.98.176 TCP 70 60049 > http [ACK] Seq=730 Ack=91225 Win=65160 Len=0 TSval=899493061 TSecr=1543353
67989  27.967399 90.38.224.130 -> 41.177.98.176 TCP 70 [TCP Dup ACK 67978#1] 60049 > http [ACK] Seq=730 Ack=91225 Win=65160 Len=0 TSval=899493061 TSecr=1543353
68004  27.972538 90.38.224.130 -> 41.177.98.176 TCP 70 60049 > http [ACK] Seq=730 Ack=95777 Win=66400 Len=0 TSval=899493061 TSecr=1543355
68013  27.976639 90.38.224.130 -> 41.177.98.176 TCP 70 [TCP Dup ACK 68004#1] 60049 > http [ACK] Seq=730 Ack=95777 Win=66400 Len=0 TSval=899493061 TSecr=1543355
68014  27.976644 90.38.224.130 -> 41.177.98.176 TCP 70 60049 > http [FIN, ACK] Seq=730 Ack=95777 Win=66608 Len=0 TSval=899493061 TSecr=1543355
68027  27.988987 90.38.224.130 -> 41.177.98.176 TCP 70 60049 > http [ACK] Seq=731 Ack=95778 Win=66608 Len=0 TSval=899493061 TSecr=1543356
145503  49.860433 90.38.224.130 -> 41.177.98.176 TCP 82 60055 > http [SYN] Seq=0 Win=65535 Len=0 MSS=1460 WS=2 TSval=899493280 TSecr=0 SACK_PERM=1
145575  49.888117 90.38.224.130 -> 41.177.98.176 TCP 70 60055 > http [ACK] Seq=1 Ack=1 Win=66608 Len=0 TSval=899493280 TSecr=1545545
154848  52.894661 90.38.224.130 -> 41.177.98.176 TCP 70 60055 > http [ACK] Seq=754 Ack=4345 Win=65160 Len=0 TSval=899493310 TSecr=1545807
154929  52.910479 90.38.224.130 -> 41.177.98.176 TCP 70 60055 > http [ACK] Seq=754 Ack=9679 Win=65160 Len=0 TSval=899493310 TSecr=1545848
154942  52.914645 90.38.224.130 -> 41.177.98.176 TCP 70 [TCP Dup ACK 154929#1] 60055 > http [ACK] Seq=754 Ack=9679 Win=65160 Len=0 TSval=899493310 TSecr=1545848
155044  52.924454 90.38.224.130 -> 41.177.98.176 TCP 70 60055 > http [ACK] Seq=754 Ack=14807 Win=66608 Len=0 TSval=899493310 TSecr=1545850
155051  52.928557 90.38.224.130 -> 41.177.98.176 TCP 70 [TCP Dup ACK 155044#1] 60055 > http [ACK] Seq=754 Ack=14807 Win=66608 Len=0 TSval=899493310 TSecr=1545850
155139  52.937952 90.38.224.130 -> 41.177.98.176 TCP 70 60055 > http [ACK] Seq=754 Ack=18591 Win=66504 Len=0 TSval=899493310 TSecr=1545851
155140  52.937957 90.38.224.130 -> 41.177.98.176 TCP 70 60055 > http [FIN, ACK] Seq=754 Ack=18591 Win=66608 Len=0 TSval=899493310 TSecr=1545851
155156  52.949132 90.38.224.130 -> 41.177.98.176 TCP 70 60055 > http [ACK] Seq=755 Ack=18592 Win=66608 Len=0 TSval=899493311 TSecr=1545852
155166  52.952764 90.38.224.130 -> 41.177.98.176 TCP 70 [TCP Dup ACK 155156#1] 60055 > http [ACK] Seq=755 Ack=18592 Win=66608 Len=0 TSval=899493311 TSecr=1545852
155880  53.143461 90.38.224.130 -> 41.177.98.176 TCP 82 60057 > http [SYN] Seq=0 Win=65535 Len=0 MSS=1460 WS=2 TSval=899493312 TSecr=0 SACK_PERM=1
155901  53.163369 90.38.224.130 -> 41.177.98.176 TCP 70 60057 > http [ACK] Seq=1 Ack=1 Win=66608 Len=0 TSval=899493313 TSecr=1545873
156413  53.284192 90.38.224.130 -> 41.177.98.176 TCP 70 60057 > http [ACK] Seq=686 Ack=882 Win=65726 Len=0 TSval=899493314 TSecr=1545885
156415  53.284218 90.38.224.130 -> 41.177.98.176 TCP 70 60057 > http [FIN, ACK] Seq=686 Ack=882 Win=66608 Len=0 TSval=899493314 TSecr=1545885
156463  53.295631 90.38.224.130 -> 41.177.98.176 TCP 70 60057 > http [ACK] Seq=687 Ack=883 Win=66608 Len=0 TSval=899493314 TSecr=1545887
