841125 275.899985 90.38.224.197 -> 41.177.98.176 TCP 82 50216 > http [SYN] Seq=0 Win=65535 Len=0 MSS=1460 WS=8 TSval=470284572 TSecr=0 SACK_PERM=1
841142 275.914496 90.38.224.197 -> 41.177.98.176 TCP 70 50216 > http [ACK] Seq=1 Ack=1 Win=524280 Len=0 TSval=470284572 TSecr=1568149
841204 275.950056 90.38.224.197 -> 41.177.98.176 TCP 70 50216 > http [ACK] Seq=656 Ack=170 Win=524280 Len=0 TSval=470284573 TSecr=1568151
877561 290.988065 90.38.224.197 -> 41.177.98.176 TCP 70 50216 > http [ACK] Seq=656 Ack=171 Win=524280 Len=0 TSval=470284723 TSecr=1569652
921665 305.829775 90.38.224.197 -> 41.177.98.176 TCP 70 50216 > http [FIN, ACK] Seq=656 Ack=171 Win=524280 Len=0 TSval=470284871 TSecr=1569652
