913542 302.545417 90.41.116.68 -> 41.177.98.127 TCP 78 39834 > z39-50 [SYN] Seq=0 Win=5840 Len=0 MSS=1380 SACK_PERM=1 TSval=1786642432 TSecr=0 WS=4
913732 302.595369 90.41.116.68 -> 41.177.98.127 TCP 70 39834 > z39-50 [ACK] Seq=1 Ack=1 Win=5840 Len=0 TSval=1786642486 TSecr=1595288
913982 302.717478 90.41.116.68 -> 41.177.98.127 TCP 122 39834 > z39-50 [PSH, ACK] Seq=1 Ack=1 Win=5840 Len=52 TSval=1786642604 TSecr=1595288
916147 304.045294 90.41.116.68 -> 41.177.98.127 TCP 70 39834 > z39-50 [ACK] Seq=53 Ack=77 Win=5840 Len=0 TSval=1786643938 TSecr=1595434
916346 304.219344 90.41.116.68 -> 41.177.98.127 TCP 148 39834 > z39-50 [PSH, ACK] Seq=53 Ack=77 Win=5840 Len=78 TSval=1786644110 TSecr=1595434
916455 304.293525 90.41.116.68 -> 41.177.98.127 TCP 70 39834 > z39-50 [ACK] Seq=131 Ack=100 Win=5840 Len=0 TSval=1786644188 TSecr=1595459
916753 304.469535 90.41.116.68 -> 41.177.98.127 TCP 109 39834 > z39-50 [PSH, ACK] Seq=131 Ack=100 Win=5840 Len=39 TSval=1786644364 TSecr=1595459
916979 304.577298 90.41.116.68 -> 41.177.98.127 TCP 70 39834 > z39-50 [ACK] Seq=170 Ack=1247 Win=8136 Len=0 TSval=1786644472 TSecr=1595487
917370 304.615254 90.41.116.68 -> 41.177.98.127 TCP 70 39834 > z39-50 [FIN, ACK] Seq=170 Ack=1247 Win=8136 Len=0 TSval=1786644510 TSecr=1595487
917708 304.659623 90.41.116.68 -> 41.177.98.127 TCP 70 39834 > z39-50 [ACK] Seq=171 Ack=1248 Win=8136 Len=0 TSval=1786644556 TSecr=1595495
