187820  63.630603 90.80.188.164 -> 41.177.98.79 TCP 66 spocp > http [SYN] Seq=0 Win=16384 Len=0 MSS=1460 SACK_PERM=1
187935  63.716855 90.80.188.164 -> 41.177.98.79 TCP 64 spocp > http [ACK] Seq=1 Ack=1 Win=17520 Len=0
188062  63.846818 90.80.188.164 -> 41.177.98.79 TCP 64 spocp > http [ACK] Seq=696 Ack=2921 Win=17520 Len=0
188092  63.868683 90.80.188.164 -> 41.177.98.79 TCP 66 snap > http [SYN] Seq=0 Win=16384 Len=0 MSS=1460 SACK_PERM=1
188106  63.872642 90.80.188.164 -> 41.177.98.79 TCP 66 simon > http [SYN] Seq=0 Win=16384 Len=0 MSS=1460 SACK_PERM=1
188115  63.876885 90.80.188.164 -> 41.177.98.79 TCP 66 4755 > http [SYN] Seq=0 Win=16384 Len=0 MSS=1460 SACK_PERM=1
188116  63.876890 90.80.188.164 -> 41.177.98.79 TCP 66 4754 > http [SYN] Seq=0 Win=16384 Len=0 MSS=1460 SACK_PERM=1
188230  63.956542 90.80.188.164 -> 41.177.98.79 TCP 64 snap > http [ACK] Seq=1 Ack=1 Win=17520 Len=0
188256  63.966953 90.80.188.164 -> 41.177.98.79 TCP 64 simon > http [ACK] Seq=1 Ack=1 Win=17520 Len=0
188266  63.970993 90.80.188.164 -> 41.177.98.79 TCP 64 4755 > http [ACK] Seq=1 Ack=1 Win=17520 Len=0
188271  63.976313 90.80.188.164 -> 41.177.98.79 TCP 64 4754 > http [ACK] Seq=1 Ack=1 Win=17520 Len=0
188458  64.086723 90.80.188.164 -> 41.177.98.79 TCP 64 simon > http [ACK] Seq=512 Ack=2921 Win=17520 Len=0
188554  64.117123 90.80.188.164 -> 41.177.98.79 TCP 64 spocp > http [ACK] Seq=696 Ack=3364 Win=17077 Len=0
188602  64.130686 90.80.188.164 -> 41.177.98.79 TCP 64 4755 > http [ACK] Seq=538 Ack=2921 Win=17520 Len=0
188681  64.197449 90.80.188.164 -> 41.177.98.79 TCP 64 simon > http [ACK] Seq=512 Ack=5841 Win=17520 Len=0
188703  64.215875 90.80.188.164 -> 41.177.98.79 TCP 64 snap > http [ACK] Seq=512 Ack=1075 Win=16446 Len=0
188753  64.248320 90.80.188.164 -> 41.177.98.79 TCP 64 4755 > http [ACK] Seq=538 Ack=5841 Win=17520 Len=0
188890  64.315696 90.80.188.164 -> 41.177.98.79 TCP 64 simon > http [ACK] Seq=512 Ack=6797 Win=16564 Len=0
188892  64.320393 90.80.188.164 -> 41.177.98.79 TCP 64 4754 > http [ACK] Seq=510 Ack=987 Win=16534 Len=0
188918  64.346370 90.80.188.164 -> 41.177.98.79 TCP 64 4755 > http [ACK] Seq=538 Ack=8761 Win=17520 Len=0
188959  64.386542 90.80.188.164 -> 41.177.98.79 TCP 64 4755 > http [ACK] Seq=538 Ack=11681 Win=17520 Len=0
189029  64.455850 90.80.188.164 -> 41.177.98.79 TCP 64 4755 > http [ACK] Seq=538 Ack=14601 Win=17520 Len=0
189120  64.504524 90.80.188.164 -> 41.177.98.79 TCP 64 4755 > http [ACK] Seq=538 Ack=17521 Win=17520 Len=0
189150  64.516432 90.80.188.164 -> 41.177.98.79 TCP 64 snap > http [ACK] Seq=1041 Ack=2423 Win=17520 Len=0
189171  64.537560 90.80.188.164 -> 41.177.98.79 TCP 64 4755 > http [ACK] Seq=538 Ack=20441 Win=17520 Len=0
189205  64.577287 90.80.188.164 -> 41.177.98.79 TCP 64 4755 > http [ACK] Seq=538 Ack=23361 Win=17520 Len=0
189284  64.626647 90.80.188.164 -> 41.177.98.79 TCP 64 4755 > http [ACK] Seq=538 Ack=26281 Win=17520 Len=0
189301  64.646636 90.80.188.164 -> 41.177.98.79 TCP 70 [TCP Dup ACK 189284#1] 4755 > http [ACK] Seq=538 Ack=26281 Win=17520 Len=0 SLE=27741 SRE=29201
189322  64.667732 90.80.188.164 -> 41.177.98.79 TCP 64 4755 > http [ACK] Seq=538 Ack=29201 Win=17520 Len=0
189360  64.708435 90.80.188.164 -> 41.177.98.79 TCP 70 4755 > http [ACK] Seq=538 Ack=30661 Win=17520 Len=0 SLE=32121 SRE=33072
189377  64.720584 90.80.188.164 -> 41.177.98.79 TCP 64 4755 > http [ACK] Seq=538 Ack=33072 Win=17520 Len=0
189414  64.760403 90.80.188.164 -> 41.177.98.79 TCP 64 4755 > http [ACK] Seq=538 Ack=35992 Win=17520 Len=0
189456  64.804447 90.80.188.164 -> 41.177.98.79 TCP 64 4755 > http [ACK] Seq=538 Ack=38912 Win=17520 Len=0
189475  64.815754 90.80.188.164 -> 41.177.98.79 TCP 64 spocp > http [ACK] Seq=1148 Ack=4013 Win=16428 Len=0
189485  64.822663 90.80.188.164 -> 41.177.98.79 TCP 70 [TCP Dup ACK 189456#1] 4755 > http [ACK] Seq=538 Ack=38912 Win=17520 Len=0 SLE=40372 SRE=41832
189520  64.842696 90.80.188.164 -> 41.177.98.79 TCP 64 4755 > http [ACK] Seq=538 Ack=41832 Win=17520 Len=0
189565  64.864510 90.80.188.164 -> 41.177.98.79 TCP 64 4755 > http [ACK] Seq=538 Ack=43292 Win=17520 Len=0
189609  64.909007 90.80.188.164 -> 41.177.98.79 TCP 64 4755 > http [ACK] Seq=538 Ack=46212 Win=17520 Len=0
189680  64.944470 90.80.188.164 -> 41.177.98.79 TCP 64 4755 > http [ACK] Seq=538 Ack=49132 Win=17520 Len=0
189717  64.986601 90.80.188.164 -> 41.177.98.79 TCP 64 4755 > http [ACK] Seq=538 Ack=52052 Win=17520 Len=0
189762  65.026589 90.80.188.164 -> 41.177.98.79 TCP 64 4755 > http [ACK] Seq=538 Ack=54972 Win=17520 Len=0
189814  65.066654 90.80.188.164 -> 41.177.98.79 TCP 64 4755 > http [ACK] Seq=538 Ack=57892 Win=17520 Len=0
189852  65.108456 90.80.188.164 -> 41.177.98.79 TCP 64 4755 > http [ACK] Seq=538 Ack=60812 Win=17520 Len=0
189907  65.148911 90.80.188.164 -> 41.177.98.79 TCP 64 4755 > http [ACK] Seq=538 Ack=63732 Win=17520 Len=0
189957  65.190863 90.80.188.164 -> 41.177.98.79 TCP 64 4755 > http [ACK] Seq=538 Ack=66652 Win=17520 Len=0
190041  65.230840 90.80.188.164 -> 41.177.98.79 TCP 64 4755 > http [ACK] Seq=538 Ack=69572 Win=17520 Len=0
190163  65.270630 90.80.188.164 -> 41.177.98.79 TCP 64 4755 > http [ACK] Seq=538 Ack=72492 Win=17520 Len=0
190242  65.310766 90.80.188.164 -> 41.177.98.79 TCP 64 4755 > http [ACK] Seq=538 Ack=75412 Win=17520 Len=0
190310  65.352411 90.80.188.164 -> 41.177.98.79 TCP 64 4755 > http [ACK] Seq=538 Ack=78332 Win=17520 Len=0
190382  65.396689 90.80.188.164 -> 41.177.98.79 TCP 64 4755 > http [ACK] Seq=538 Ack=81252 Win=17520 Len=0
190450  65.433945 90.80.188.164 -> 41.177.98.79 TCP 64 4755 > http [ACK] Seq=538 Ack=84172 Win=17520 Len=0
190537  65.475754 90.80.188.164 -> 41.177.98.79 TCP 64 4755 > http [ACK] Seq=538 Ack=87092 Win=17520 Len=0
190627  65.516608 90.80.188.164 -> 41.177.98.79 TCP 64 4755 > http [ACK] Seq=538 Ack=90012 Win=17520 Len=0
190703  65.556473 90.80.188.164 -> 41.177.98.79 TCP 64 4755 > http [ACK] Seq=538 Ack=92932 Win=17520 Len=0
190767  65.597378 90.80.188.164 -> 41.177.98.79 TCP 64 4755 > http [ACK] Seq=538 Ack=95852 Win=17520 Len=0
190850  65.640353 90.80.188.164 -> 41.177.98.79 TCP 64 4755 > http [ACK] Seq=538 Ack=98772 Win=17520 Len=0
190935  65.680441 90.80.188.164 -> 41.177.98.79 TCP 64 4755 > http [ACK] Seq=538 Ack=101692 Win=17520 Len=0
191013  65.720571 90.80.188.164 -> 41.177.98.79 TCP 64 4755 > http [ACK] Seq=538 Ack=104612 Win=17520 Len=0
191067  65.758916 90.80.188.164 -> 41.177.98.79 TCP 64 4755 > http [ACK] Seq=538 Ack=107532 Win=17520 Len=0
191552  65.918569 90.80.188.164 -> 41.177.98.79 TCP 64 4755 > http [ACK] Seq=538 Ack=108198 Win=16854 Len=0
192519  66.318883 90.80.188.164 -> 41.177.98.79 TCP 64 4754 > http [ACK] Seq=893 Ack=1633 Win=17520 Len=0
195301  67.119732 90.80.188.164 -> 41.177.98.79 TCP 64 simon > http [ACK] Seq=925 Ack=7443 Win=17520 Len=0
230364  79.526657 90.80.188.164 -> 41.177.98.79 TCP 64 snap > http [ACK] Seq=1041 Ack=2424 Win=17520 Len=0
230468  79.576547 90.80.188.164 -> 41.177.98.79 TCP 64 spocp > http [ACK] Seq=1148 Ack=4014 Win=16428 Len=0
233251  80.650773 90.80.188.164 -> 41.177.98.79 TCP 64 4755 > http [ACK] Seq=538 Ack=108199 Win=16854 Len=0
233990  81.122301 90.80.188.164 -> 41.177.98.79 TCP 64 4754 > http [ACK] Seq=893 Ack=1634 Win=17520 Len=0
235260  81.959172 90.80.188.164 -> 41.177.98.79 TCP 64 simon > http [ACK] Seq=925 Ack=7444 Win=17520 Len=0
244251  85.176023 90.80.188.164 -> 41.177.98.79 TCP 64 snap > http [FIN, ACK] Seq=1041 Ack=2424 Win=17520 Len=0
244288  85.182749 90.80.188.164 -> 41.177.98.79 TCP 64 spocp > http [FIN, ACK] Seq=1148 Ack=4014 Win=16428 Len=0
244297  85.186747 90.80.188.164 -> 41.177.98.79 TCP 64 4755 > http [FIN, ACK] Seq=538 Ack=108199 Win=16854 Len=0
244629  85.288624 90.80.188.164 -> 41.177.98.79 TCP 64 4754 > http [FIN, ACK] Seq=893 Ack=1634 Win=17520 Len=0
245490  85.720677 90.80.188.164 -> 41.177.98.79 TCP 64 simon > http [FIN, ACK] Seq=925 Ack=7444 Win=17520 Len=0
