172309  57.417170 90.91.84.180 -> 41.177.26.176 TCP 78 39509 > http [SYN] Seq=0 Win=5840 Len=0 MSS=1460 SACK_PERM=1 TSval=565729296 TSecr=0 WS=128
172749  57.501359 90.91.84.180 -> 41.177.26.176 TCP 70 39509 > http [ACK] Seq=1 Ack=1 Win=5888 Len=0 TSval=565729304 TSecr=140347338
173182  57.589706 90.91.84.180 -> 41.177.26.176 TCP 70 39509 > http [ACK] Seq=374 Ack=674 Win=7296 Len=0 TSval=565729313 TSecr=140347347
173183  57.589711 90.91.84.180 -> 41.177.26.176 TCP 70 39509 > http [FIN, ACK] Seq=374 Ack=675 Win=7296 Len=0 TSval=565729313 TSecr=140347347
457200 149.287887 90.91.84.180 -> 41.177.26.176 TCP 78 39909 > http [SYN] Seq=0 Win=5840 Len=0 MSS=1460 SACK_PERM=1 TSval=565738482 TSecr=0 WS=128
457391 149.372066 90.91.84.180 -> 41.177.26.176 TCP 70 39909 > http [ACK] Seq=1 Ack=1 Win=5888 Len=0 TSval=565738491 TSecr=140356525
457600 149.470029 90.91.84.180 -> 41.177.26.176 TCP 70 39909 > http [ACK] Seq=378 Ack=688 Win=7296 Len=0 TSval=565738500 TSecr=140356534
457601 149.470051 90.91.84.180 -> 41.177.26.176 TCP 70 39909 > http [FIN, ACK] Seq=378 Ack=689 Win=7296 Len=0 TSval=565738500 TSecr=140356534
