5269   1.673214 92.194.214.155 -> 244.3.210.197 TCP 64 netview-aix-9 > http [RST, ACK] Seq=1 Ack=1 Win=0 Len=0
20222   6.672258 92.194.214.155 -> 244.3.210.197 TCP 64 netview-aix-8 > http [RST, ACK] Seq=1 Ack=1 Win=0 Len=0
145956  50.028406 92.194.214.155 -> 244.3.210.197 TCP 66 prolink > http [SYN] Seq=0 Win=64512 Len=0 MSS=1452 SACK_PERM=1
145966  50.030215 92.194.214.155 -> 244.3.210.197 TCP 66 darcorp-lm > http [SYN] Seq=0 Win=64512 Len=0 MSS=1452 SACK_PERM=1
146314  50.175251 92.194.214.155 -> 244.3.210.197 TCP 64 prolink > http [ACK] Seq=1 Ack=1 Win=64512 Len=0
146368  50.186186 92.194.214.155 -> 244.3.210.197 TCP 64 darcorp-lm > http [ACK] Seq=1 Ack=1 Win=64512 Len=0
146685  50.345948 92.194.214.155 -> 244.3.210.197 TCP 64 prolink > http [ACK] Seq=369 Ack=2905 Win=64512 Len=0
146723  50.360683 92.194.214.155 -> 244.3.210.197 TCP 64 darcorp-lm > http [ACK] Seq=361 Ack=2693 Win=64512 Len=0
147113  50.503965 92.194.214.155 -> 244.3.210.197 TCP 64 prolink > http [ACK] Seq=369 Ack=5809 Win=64512 Len=0
147566  50.649205 92.194.214.155 -> 244.3.210.197 TCP 64 prolink > http [ACK] Seq=369 Ack=7261 Win=64512 Len=0
147597  50.661780 92.194.214.155 -> 244.3.210.197 TCP 64 prolink > http [ACK] Seq=369 Ack=10165 Win=64512 Len=0
148116  50.850248 92.194.214.155 -> 244.3.210.197 TCP 64 prolink > http [ACK] Seq=369 Ack=10707 Win=63970 Len=0
148359  50.951059 92.194.214.155 -> 244.3.210.197 TCP 64 darcorp-lm > http [ACK] Seq=805 Ack=3088 Win=64117 Len=0
323634 110.923090 92.194.214.155 -> 244.3.210.197 TCP 64 prolink > http [RST, ACK] Seq=369 Ack=10707 Win=0 Len=0
323647 110.925043 92.194.214.155 -> 244.3.210.197 TCP 64 darcorp-lm > http [RST, ACK] Seq=805 Ack=3088 Win=0 Len=0
639945 201.998827 92.194.214.155 -> 244.3.210.197 TCP 66 deskshare > http [SYN] Seq=0 Win=64512 Len=0 MSS=1452 SACK_PERM=1
639977 202.006984 92.194.214.155 -> 244.3.210.197 TCP 66 hb-engine > http [SYN] Seq=0 Win=64512 Len=0 MSS=1452 SACK_PERM=1
640461 202.151150 92.194.214.155 -> 244.3.210.197 TCP 64 deskshare > http [ACK] Seq=1 Ack=1 Win=64512 Len=0
640508 202.162233 92.194.214.155 -> 244.3.210.197 TCP 64 hb-engine > http [ACK] Seq=1 Ack=1 Win=64512 Len=0
641098 202.326292 92.194.214.155 -> 244.3.210.197 TCP 64 deskshare > http [ACK] Seq=371 Ack=2905 Win=64512 Len=0
641141 202.338797 92.194.214.155 -> 244.3.210.197 TCP 64 hb-engine > http [ACK] Seq=367 Ack=2905 Win=64512 Len=0
641961 202.487228 92.194.214.155 -> 244.3.210.197 TCP 64 deskshare > http [ACK] Seq=371 Ack=5809 Win=64512 Len=0
642077 202.505099 92.194.214.155 -> 244.3.210.197 TCP 64 hb-engine > http [ACK] Seq=367 Ack=5809 Win=64512 Len=0
643769 202.634741 92.194.214.155 -> 244.3.210.197 TCP 64 hb-engine > http [ACK] Seq=367 Ack=7261 Win=64512 Len=0
643792 202.636765 92.194.214.155 -> 244.3.210.197 TCP 64 deskshare > http [ACK] Seq=371 Ack=7261 Win=64512 Len=0
643894 202.648118 92.194.214.155 -> 244.3.210.197 TCP 64 deskshare > http [ACK] Seq=371 Ack=10165 Win=64512 Len=0
646199 203.237956 92.194.214.155 -> 244.3.210.197 TCP 64 deskshare > http [ACK] Seq=815 Ack=11181 Win=63496 Len=0
655197 205.149901 92.194.214.155 -> 244.3.210.197 TCP 64 hb-engine > http [ACK] Seq=367 Ack=7840 Win=63933 Len=0
721666 230.407826 92.194.214.155 -> 244.3.210.197 TCP 64 hb-engine > http [ACK] Seq=733 Ack=10744 Win=64512 Len=0
721984 230.563731 92.194.214.155 -> 244.3.210.197 TCP 64 hb-engine > http [ACK] Seq=733 Ack=13648 Win=64512 Len=0
722157 230.698163 92.194.214.155 -> 244.3.210.197 TCP 64 hb-engine > http [ACK] Seq=733 Ack=15100 Win=64512 Len=0
722188 230.719915 92.194.214.155 -> 244.3.210.197 TCP 64 hb-engine > http [ACK] Seq=733 Ack=18004 Win=64512 Len=0
722372 230.799099 92.194.214.155 -> 244.3.210.197 TCP 64 deskshare > http [ACK] Seq=1259 Ack=11576 Win=63101 Len=0
722478 230.871283 92.194.214.155 -> 244.3.210.197 TCP 64 hb-engine > http [ACK] Seq=733 Ack=20908 Win=64512 Len=0
722606 230.999823 92.194.214.155 -> 244.3.210.197 TCP 64 hb-engine > http [ACK] Seq=733 Ack=22360 Win=64512 Len=0
722657 231.030376 92.194.214.155 -> 244.3.210.197 TCP 64 hb-engine > http [ACK] Seq=733 Ack=25264 Win=64512 Len=0
723049 231.200787 92.194.214.155 -> 244.3.210.197 TCP 64 hb-engine > http [ACK] Seq=733 Ack=26323 Win=63453 Len=0
851332 281.313331 92.194.214.155 -> 244.3.210.197 TCP 64 deskshare > http [ACK] Seq=1630 Ack=14480 Win=64512 Len=0
851350 281.325951 92.194.214.155 -> 244.3.210.197 TCP 64 deskshare > http [ACK] Seq=1630 Ack=17384 Win=64512 Len=0
851378 281.337126 92.194.214.155 -> 244.3.210.197 TCP 64 deskshare > http [ACK] Seq=1630 Ack=20288 Win=64512 Len=0
851393 281.348381 92.194.214.155 -> 244.3.210.197 TCP 64 deskshare > http [ACK] Seq=1630 Ack=23192 Win=64512 Len=0
851740 281.470319 92.194.214.155 -> 244.3.210.197 TCP 64 deskshare > http [ACK] Seq=1630 Ack=26096 Win=64512 Len=0
851760 281.482077 92.194.214.155 -> 244.3.210.197 TCP 64 deskshare > http [ACK] Seq=1630 Ack=29000 Win=64512 Len=0
851768 281.494885 92.194.214.155 -> 244.3.210.197 TCP 64 deskshare > http [ACK] Seq=1630 Ack=31904 Win=64512 Len=0
852420 281.695084 92.194.214.155 -> 244.3.210.197 TCP 64 hb-engine > http [ACK] Seq=1177 Ack=26718 Win=64512 Len=0
852433 281.697301 92.194.214.155 -> 244.3.210.197 TCP 64 deskshare > http [ACK] Seq=1630 Ack=32346 Win=64070 Len=0
