516692 166.847967 94.145.155.55 -> 244.3.41.84  TCP 64 vrxpservman > telnet [ACK] Seq=11 Ack=207 Win=65317 Len=0
532498 172.687283 94.145.155.55 -> 244.3.41.84  TCP 64 vrxpservman > telnet [ACK] Seq=35 Ack=2621 Win=65535 Len=0
545691 176.633986 94.145.155.55 -> 244.3.41.84  TCP 64 vrxpservman > telnet [ACK] Seq=118 Ack=5113 Win=65535 Len=0
557683 179.424153 94.145.155.55 -> 244.3.41.84  TCP 64 vrxpservman > telnet [ACK] Seq=844 Ack=7527 Win=65535 Len=0
571107 182.379788 94.145.155.55 -> 244.3.41.84  TCP 64 vrxpservman > telnet [ACK] Seq=927 Ack=10019 Win=65535 Len=0
589091 187.714599 94.145.155.55 -> 244.3.41.84  TCP 64 vrxpservman > telnet [ACK] Seq=1649 Ack=10225 Win=65329 Len=0
605618 192.028369 94.145.155.55 -> 244.3.41.84  TCP 64 vrxpservman > telnet [ACK] Seq=1666 Ack=10999 Win=64555 Len=0
623958 198.047645 94.145.155.55 -> 244.3.41.84  TCP 64 vrxpservman > telnet [ACK] Seq=1692 Ack=12242 Win=65535 Len=0
643919 202.662482 94.145.155.55 -> 244.3.41.84  TCP 64 vrxpservman > telnet [ACK] Seq=1702 Ack=13021 Win=64756 Len=0
674969 210.832325 94.145.155.55 -> 244.3.41.84  TCP 64 vrxpservman > telnet [ACK] Seq=1726 Ack=14522 Win=65535 Len=0
693636 219.215508 94.145.155.55 -> 244.3.41.84  TCP 64 vrxpservman > telnet [ACK] Seq=1736 Ack=15301 Win=64756 Len=0
707727 225.347555 94.145.155.55 -> 244.3.41.84  TCP 64 vrxpservman > telnet [ACK] Seq=1751 Ack=16751 Win=65535 Len=0
717708 229.046794 94.145.155.55 -> 244.3.41.84  TCP 64 vrxpservman > telnet [ACK] Seq=1761 Ack=17414 Win=64872 Len=0
722276 230.752259 94.145.155.55 -> 244.3.41.84  TCP 64 vrxpservman > telnet [ACK] Seq=1771 Ack=18081 Win=64205 Len=0
740077 236.169554 94.145.155.55 -> 244.3.41.84  TCP 64 vrxpservman > telnet [ACK] Seq=1781 Ack=18766 Win=65535 Len=0
742706 237.574050 94.145.155.55 -> 244.3.41.84  TCP 64 vrxpservman > telnet [ACK] Seq=1791 Ack=19291 Win=65010 Len=0
957241 317.830658 94.145.155.55 -> 244.3.41.84  TCP 64 vrxpservman > telnet [ACK] Seq=1801 Ack=19528 Win=64773 Len=0
