780 0.185190 10.0.0.4 -> 10.0.0.8 TCP 64 7772 > http [ACK] Seq=1 Ack=1 Win=64512 Len=01414 0.403761 10.0.0.4 -> 10.0.0.8 TCP 64 7773 > http [ACK] Seq=513 Ack=329 Win=63970 Len=068980 28.533497 10.0.0.4 -> 10.0.0.8 TCP 64 7773 > http [ACK] Seq=974 Ack=3031 Win=64512 Len=073924 30.065299 10.0.0.4 -> 10.0.0.8 TCP 64 7772 > http [ACK] Seq=7552 Ack=3102 Win=64512 Len=077819 31.029960 10.0.0.4 -> 10.0.0.8 TCP 64 7773 > http [ACK] Seq=2052 Ack=3457 Win=64086 Len=0255659 90.812377 10.0.0.4 -> 10.0.0.8 TCP 64 7772 > http [RST, ACK] Seq=7552 Ack=3102 Win=0 Len=0286672 95.812655 10.0.0.4 -> 10.0.0.8 TCP 64 7773 > http [RST, ACK] Seq=2052 Ack=3457 Win=0 Len=0