141224 48.632069 10.0.0.8 -> 10.0.0.33 TCP 66 z39-50 > plbserve-port [SYN, ACK] Seq=0 Ack=1 Win=49640 Len=0 MSS=1460 SACK_PERM=1141493 48.683781 10.0.0.8 -> 10.0.0.33 TCP 64 z39-50 > plbserve-port [ACK] Seq=1 Ack=92 Win=49549 Len=0145894 49.993253 10.0.0.8 -> 10.0.0.33 TCP 128 z39-50 > plbserve-port [PSH, ACK] Seq=1 Ack=92 Win=49640 Len=70146013 50.044991 10.0.0.8 -> 10.0.0.33 TCP 64 z39-50 > plbserve-port [ACK] Seq=71 Ack=183 Win=49640 Len=0146014 50.045487 10.0.0.8 -> 10.0.0.33 TCP 98 z39-50 > plbserve-port [PSH, ACK] Seq=71 Ack=183 Win=49640 Len=40146099 50.102058 10.0.0.8 -> 10.0.0.33 TCP 64 z39-50 > plbserve-port [FIN, ACK] Seq=111 Ack=191 Win=49640 Len=0146238 50.154273 10.0.0.8 -> 10.0.0.33 TCP 64 z39-50 > plbserve-port [ACK] Seq=112 Ack=192 Win=49640 Len=0146239 50.154403 10.0.0.8 -> 10.0.0.33 TCP 66 z39-50 > sunfm-port [SYN, ACK] Seq=0 Ack=1 Win=49640 Len=0 MSS=1460 SACK_PERM=1146428 50.206214 10.0.0.8 -> 10.0.0.33 TCP 64 z39-50 > sunfm-port [ACK] Seq=1 Ack=92 Win=49549 Len=0150063 51.517699 10.0.0.8 -> 10.0.0.33 TCP 128 z39-50 > sunfm-port [PSH, ACK] Seq=1 Ack=92 Win=49640 Len=70150174 51.569147 10.0.0.8 -> 10.0.0.33 TCP 64 z39-50 > sunfm-port [ACK] Seq=71 Ack=183 Win=49640 Len=0150175 51.569856 10.0.0.8 -> 10.0.0.33 TCP 98 z39-50 > sunfm-port [PSH, ACK] Seq=71 Ack=183 Win=49640 Len=40150409 51.627591 10.0.0.8 -> 10.0.0.33 TCP 64 z39-50 > sunfm-port [FIN, ACK] Seq=111 Ack=191 Win=49640 Len=0150600 51.679579 10.0.0.8 -> 10.0.0.33 TCP 64 z39-50 > sunfm-port [ACK] Seq=112 Ack=192 Win=49640 Len=0171495 56.985612 10.0.0.8 -> 10.0.0.33 TCP 66 z39-50 > treehopper [SYN, ACK] Seq=0 Ack=1 Win=49640 Len=0 MSS=1460 SACK_PERM=1171574 57.037583 10.0.0.8 -> 10.0.0.33 TCP 64 z39-50 > treehopper [ACK] Seq=1 Ack=116 Win=49640 Len=0175633 58.353064 10.0.0.8 -> 10.0.0.33 TCP 128 z39-50 > treehopper [PSH, ACK] Seq=1 Ack=116 Win=49640 Len=70175715 58.404533 10.0.0.8 -> 10.0.0.33 TCP 64 z39-50 > treehopper [ACK] Seq=71 Ack=210 Win=49640 Len=0175716 58.405059 10.0.0.8 -> 10.0.0.33 TCP 98 z39-50 > treehopper [PSH, ACK] Seq=71 Ack=210 Win=49640 Len=40175801 58.461548 10.0.0.8 -> 10.0.0.33 TCP 64 z39-50 > treehopper [FIN, ACK] Seq=111 Ack=218 Win=49640 Len=0175911 58.512111 10.0.0.8 -> 10.0.0.33 TCP 64 z39-50 > treehopper [ACK] Seq=112 Ack=219 Win=49640 Len=0175913 58.512365 10.0.0.8 -> 10.0.0.33 TCP 66 z39-50 > sbi-agent [SYN, ACK] Seq=0 Ack=1 Win=49640 Len=0 MSS=1460 SACK_PERM=1176018 58.564164 10.0.0.8 -> 10.0.0.33 TCP 64 z39-50 > sbi-agent [ACK] Seq=1 Ack=116 Win=49525 Len=0178412 59.894347 10.0.0.8 -> 10.0.0.33 TCP 128 z39-50 > sbi-agent [PSH, ACK] Seq=1 Ack=116 Win=49640 Len=70178520 59.945797 10.0.0.8 -> 10.0.0.33 TCP 64 z39-50 > sbi-agent [ACK] Seq=71 Ack=210 Win=49640 Len=0178521 59.946246 10.0.0.8 -> 10.0.0.33 TCP 98 z39-50 > sbi-agent [PSH, ACK] Seq=71 Ack=210 Win=49640 Len=40178682 60.002901 10.0.0.8 -> 10.0.0.33 TCP 64 z39-50 > sbi-agent [FIN, ACK] Seq=111 Ack=218 Win=49640 Len=0178786 60.054155 10.0.0.8 -> 10.0.0.33 TCP 64 z39-50 > sbi-agent [ACK] Seq=112 Ack=219 Win=49640 Len=0189075 64.488608 10.0.0.8 -> 10.0.0.33 TCP 66 z39-50 > acms [SYN, ACK] Seq=0 Ack=1 Win=49640 Len=0 MSS=1460 SACK_PERM=1189177 64.540300 10.0.0.8 -> 10.0.0.33 TCP 64 z39-50 > acms [ACK] Seq=1 Ack=92 Win=49549 Len=0191349 65.849063 10.0.0.8 -> 10.0.0.33 TCP 128 z39-50 > acms [PSH, ACK] Seq=1 Ack=92 Win=49640 Len=70191504 65.899869 10.0.0.8 -> 10.0.0.33 TCP 64 z39-50 > acms [ACK] Seq=71 Ack=183 Win=49640 Len=0191505 65.900642 10.0.0.8 -> 10.0.0.33 TCP 98 z39-50 > acms [PSH, ACK] Seq=71 Ack=183 Win=49640 Len=40191676 65.957353 10.0.0.8 -> 10.0.0.33 TCP 64 z39-50 > acms [FIN, ACK] Seq=111 Ack=191 Win=49640 Len=0191777 66.008396 10.0.0.8 -> 10.0.0.33 TCP 64 z39-50 > acms [ACK] Seq=112 Ack=192 Win=49640 Len=0191779 66.009371 10.0.0.8 -> 10.0.0.33 TCP 66 z39-50 > starfish [SYN, ACK] Seq=0 Ack=1 Win=49640 Len=0 MSS=1460 SACK_PERM=1191891 66.060469 10.0.0.8 -> 10.0.0.33 TCP 64 z39-50 > starfish [ACK] Seq=1 Ack=92 Win=49549 Len=0196310 67.360054 10.0.0.8 -> 10.0.0.33 TCP 128 z39-50 > starfish [PSH, ACK] Seq=1 Ack=92 Win=49640 Len=70196396 67.411367 10.0.0.8 -> 10.0.0.33 TCP 64 z39-50 > starfish [ACK] Seq=71 Ack=183 Win=49640 Len=0196397 67.411768 10.0.0.8 -> 10.0.0.33 TCP 98 z39-50 > starfish [PSH, ACK] Seq=71 Ack=183 Win=49640 Len=40196642 67.469162 10.0.0.8 -> 10.0.0.33 TCP 64 z39-50 > starfish [FIN, ACK] Seq=111 Ack=191 Win=49640 Len=0196808 67.521791 10.0.0.8 -> 10.0.0.33 TCP 64 z39-50 > starfish [ACK] Seq=112 Ack=192 Win=49640 Len=0307562 104.594855 10.0.0.8 -> 10.0.0.33 TCP 66 z39-50 > drmsfsd [SYN, ACK] Seq=0 Ack=1 Win=49640 Len=0 MSS=1460 SACK_PERM=1307731 104.646662 10.0.0.8 -> 10.0.0.33 TCP 64 z39-50 > drmsfsd [ACK] Seq=1 Ack=92 Win=49549 Len=0310337 105.918332 10.0.0.8 -> 10.0.0.33 TCP 128 z39-50 > drmsfsd [PSH, ACK] Seq=1 Ack=92 Win=49640 Len=70310529 105.969134 10.0.0.8 -> 10.0.0.33 TCP 64 z39-50 > drmsfsd [ACK] Seq=71 Ack=196 Win=49640 Len=0310530 105.969552 10.0.0.8 -> 10.0.0.33 TCP 98 z39-50 > drmsfsd [PSH, ACK] Seq=71 Ack=196 Win=49640 Len=40310745 106.026281 10.0.0.8 -> 10.0.0.33 TCP 64 z39-50 > drmsfsd [FIN, ACK] Seq=111 Ack=204 Win=49640 Len=0310978 106.078271 10.0.0.8 -> 10.0.0.33 TCP 64 z39-50 > drmsfsd [ACK] Seq=112 Ack=205 Win=49640 Len=0310980 106.078844 10.0.0.8 -> 10.0.0.33 TCP 66 z39-50 > dpcp [SYN, ACK] Seq=0 Ack=1 Win=49640 Len=0 MSS=1460 SACK_PERM=1311167 106.130800 10.0.0.8 -> 10.0.0.33 TCP 64 z39-50 > dpcp [ACK] Seq=1 Ack=92 Win=49549 Len=0314654 107.397294 10.0.0.8 -> 10.0.0.33 TCP 128 z39-50 > dpcp [PSH, ACK] Seq=1 Ack=92 Win=49640 Len=70315018 107.546675 10.0.0.8 -> 10.0.0.33 TCP 64 z39-50 > dpcp [ACK] Seq=71 Ack=196 Win=49640 Len=0315020 107.547054 10.0.0.8 -> 10.0.0.33 TCP 98 z39-50 > dpcp [PSH, ACK] Seq=71 Ack=196 Win=49640 Len=40315110 107.604330 10.0.0.8 -> 10.0.0.33 TCP 64 z39-50 > dpcp [FIN, ACK] Seq=111 Ack=204 Win=49640 Len=0315255 107.656390 10.0.0.8 -> 10.0.0.33 TCP 64 z39-50 > dpcp [ACK] Seq=112 Ack=205 Win=49640 Len=0599493 190.094054 10.0.0.8 -> 10.0.0.33 TCP 66 z39-50 > ddrepl [SYN, ACK] Seq=0 Ack=1 Win=49640 Len=0 MSS=1460 SACK_PERM=1599614 190.146005 10.0.0.8 -> 10.0.0.33 TCP 64 z39-50 > ddrepl [ACK] Seq=1 Ack=92 Win=49549 Len=0603383 191.444947 10.0.0.8 -> 10.0.0.33 TCP 128 z39-50 > ddrepl [PSH, ACK] Seq=1 Ack=92 Win=49640 Len=70603478 191.496816 10.0.0.8 -> 10.0.0.33 TCP 64 z39-50 > ddrepl [ACK] Seq=71 Ack=190 Win=49640 Len=0603486 191.497257 10.0.0.8 -> 10.0.0.33 TCP 98 z39-50 > ddrepl [PSH, ACK] Seq=71 Ack=190 Win=49640 Len=40603655 191.554206 10.0.0.8 -> 10.0.0.33 TCP 64 z39-50 > ddrepl [FIN, ACK] Seq=111 Ack=198 Win=49640 Len=0603789 191.605635 10.0.0.8 -> 10.0.0.33 TCP 66 z39-50 > unikeypro [SYN, ACK] Seq=0 Ack=1 Win=49640 Len=0 MSS=1460 SACK_PERM=1603790 191.605701 10.0.0.8 -> 10.0.0.33 TCP 64 z39-50 > ddrepl [ACK] Seq=112 Ack=199 Win=49640 Len=0603863 191.657073 10.0.0.8 -> 10.0.0.33 TCP 64 z39-50 > unikeypro [ACK] Seq=1 Ack=92 Win=49549 Len=0607853 192.950074 10.0.0.8 -> 10.0.0.33 TCP 128 z39-50 > unikeypro [PSH, ACK] Seq=1 Ack=92 Win=49640 Len=70607935 193.000817 10.0.0.8 -> 10.0.0.33 TCP 64 z39-50 > unikeypro [ACK] Seq=71 Ack=190 Win=49640 Len=0607948 193.001179 10.0.0.8 -> 10.0.0.33 TCP 98 z39-50 > unikeypro [PSH, ACK] Seq=71 Ack=190 Win=49640 Len=40608047 193.057866 10.0.0.8 -> 10.0.0.33 TCP 64 z39-50 > unikeypro [FIN, ACK] Seq=111 Ack=198 Win=49640 Len=0608178 193.109162 10.0.0.8 -> 10.0.0.33 TCP 64 z39-50 > unikeypro [ACK] Seq=112 Ack=199 Win=49640 Len=0690026 217.404485 10.0.0.8 -> 10.0.0.33 TCP 66 z39-50 > bzr [SYN, ACK] Seq=0 Ack=1 Win=49640 Len=0 MSS=1460 SACK_PERM=1690109 217.456297 10.0.0.8 -> 10.0.0.33 TCP 64 z39-50 > bzr [ACK] Seq=1 Ack=92 Win=49549 Len=0692830 218.834659 10.0.0.8 -> 10.0.0.33 TCP 64 z39-50 > bzr [ACK] Seq=71 Ack=196 Win=49640 Len=0692955 218.892787 10.0.0.8 -> 10.0.0.33 TCP 64 z39-50 > bzr [FIN, ACK] Seq=111 Ack=204 Win=49640 Len=0693076 218.944880 10.0.0.8 -> 10.0.0.33 TCP 64 z39-50 > bzr [ACK] Seq=112 Ack=205 Win=49640 Len=0693081 218.945419 10.0.0.8 -> 10.0.0.33 TCP 66 z39-50 > stat-results [SYN, ACK] Seq=0 Ack=1 Win=49640 Len=0 MSS=1460 SACK_PERM=1693184 218.996242 10.0.0.8 -> 10.0.0.33 TCP 64 z39-50 > stat-results [ACK] Seq=1 Ack=92 Win=49549 Len=0695679 220.279192 10.0.0.8 -> 10.0.0.33 TCP 128 z39-50 > stat-results [PSH, ACK] Seq=1 Ack=92 Win=49640 Len=70695755 220.331563 10.0.0.8 -> 10.0.0.33 TCP 64 z39-50 > stat-results [ACK] Seq=71 Ack=196 Win=49640 Len=0695756 220.331926 10.0.0.8 -> 10.0.0.33 TCP 98 z39-50 > stat-results [PSH, ACK] Seq=71 Ack=196 Win=49640 Len=40695882 220.388405 10.0.0.8 -> 10.0.0.33 TCP 64 z39-50 > stat-results [FIN, ACK] Seq=111 Ack=204 Win=49640 Len=0695956 220.440058 10.0.0.8 -> 10.0.0.33 TCP 64 z39-50 > stat-results [ACK] Seq=112 Ack=205 Win=49640 Len=0717007 228.821202 10.0.0.8 -> 10.0.0.33 TCP 66 z39-50 > bccp [SYN, ACK] Seq=0 Ack=1 Win=49640 Len=0 MSS=1460 SACK_PERM=1717176 228.872919 10.0.0.8 -> 10.0.0.33 TCP 64 z39-50 > bccp [ACK] Seq=1 Ack=92 Win=49640 Len=0721047 230.160012 10.0.0.8 -> 10.0.0.33 TCP 128 z39-50 > bccp [PSH, ACK] Seq=1 Ack=92 Win=49640 Len=70721164 230.212173 10.0.0.8 -> 10.0.0.33 TCP 64 z39-50 > bccp [ACK] Seq=71 Ack=196 Win=49640 Len=0721165 230.212573 10.0.0.8 -> 10.0.0.33 TCP 98 z39-50 > bccp [PSH, ACK] Seq=71 Ack=196 Win=49640 Len=40721362 230.269803 10.0.0.8 -> 10.0.0.33 TCP 64 z39-50 > bccp [FIN, ACK] Seq=111 Ack=204 Win=49640 Len=0721454 230.321677 10.0.0.8 -> 10.0.0.33 TCP 64 z39-50 > bccp [ACK] Seq=112 Ack=205 Win=49640 Len=0721456 230.323120 10.0.0.8 -> 10.0.0.33 TCP 66 z39-50 > wello [SYN, ACK] Seq=0 Ack=1 Win=49640 Len=0 MSS=1460 SACK_PERM=1721598 230.374857 10.0.0.8 -> 10.0.0.33 TCP 64 z39-50 > wello [ACK] Seq=1 Ack=92 Win=49549 Len=0724001 231.677894 10.0.0.8 -> 10.0.0.33 TCP 128 z39-50 > wello [PSH, ACK] Seq=1 Ack=92 Win=49640 Len=70724114 231.729861 10.0.0.8 -> 10.0.0.33 TCP 64 z39-50 > wello [ACK] Seq=71 Ack=196 Win=49640 Len=0724115 231.730214 10.0.0.8 -> 10.0.0.33 TCP 98 z39-50 > wello [PSH, ACK] Seq=71 Ack=196 Win=49640 Len=40724294 231.786432 10.0.0.8 -> 10.0.0.33 TCP 64 z39-50 > wello [FIN, ACK] Seq=111 Ack=204 Win=49640 Len=0724472 231.838265 10.0.0.8 -> 10.0.0.33 TCP 64 z39-50 > wello [ACK] Seq=112 Ack=205 Win=49640 Len=0829560 270.927752 10.0.0.8 -> 10.0.0.33 TCP 66 z39-50 > 4209 [SYN, ACK] Seq=0 Ack=1 Win=49640 Len=0 MSS=1460 SACK_PERM=1829685 270.978124 10.0.0.8 -> 10.0.0.33 TCP 64 z39-50 > 4209 [ACK] Seq=1 Ack=92 Win=49549 Len=0832611 272.273449 10.0.0.8 -> 10.0.0.33 TCP 128 z39-50 > 4209 [PSH, ACK] Seq=1 Ack=92 Win=49640 Len=70832678 272.324842 10.0.0.8 -> 10.0.0.33 TCP 64 z39-50 > 4209 [ACK] Seq=71 Ack=186 Win=49640 Len=0832679 272.325224 10.0.0.8 -> 10.0.0.33 TCP 98 z39-50 > 4209 [PSH, ACK] Seq=71 Ack=186 Win=49640 Len=40832744 272.382077 10.0.0.8 -> 10.0.0.33 TCP 64 z39-50 > 4209 [FIN, ACK] Seq=111 Ack=194 Win=49640 Len=0832920 272.434147 10.0.0.8 -> 10.0.0.33 TCP 64 z39-50 > 4209 [ACK] Seq=112 Ack=195 Win=49640 Len=0832932 272.434697 10.0.0.8 -> 10.0.0.33 TCP 66 z39-50 > 4210 [SYN, ACK] Seq=0 Ack=1 Win=49640 Len=0 MSS=1460 SACK_PERM=1833134 272.486511 10.0.0.8 -> 10.0.0.33 TCP 64 z39-50 > 4210 [ACK] Seq=1 Ack=92 Win=49549 Len=0836201 273.793498 10.0.0.8 -> 10.0.0.33 TCP 128 z39-50 > 4210 [PSH, ACK] Seq=1 Ack=92 Win=49640 Len=70836315 273.845704 10.0.0.8 -> 10.0.0.33 TCP 64 z39-50 > 4210 [ACK] Seq=71 Ack=186 Win=49640 Len=0836317 273.846090 10.0.0.8 -> 10.0.0.33 TCP 98 z39-50 > 4210 [PSH, ACK] Seq=71 Ack=186 Win=49640 Len=40836425 273.904442 10.0.0.8 -> 10.0.0.33 TCP 64 z39-50 > 4210 [FIN, ACK] Seq=111 Ack=194 Win=49640 Len=0836543 273.967082 10.0.0.8 -> 10.0.0.33 TCP 64 z39-50 > 4210 [ACK] Seq=112 Ack=195 Win=49640 Len=0946302 314.094306 10.0.0.8 -> 10.0.0.33 TCP 66 z39-50 > 4235 [SYN, ACK] Seq=0 Ack=1 Win=49640 Len=0 MSS=1460 SACK_PERM=1946468 314.145908 10.0.0.8 -> 10.0.0.33 TCP 64 z39-50 > 4235 [ACK] Seq=1 Ack=116 Win=49525 Len=0951078 315.443775 10.0.0.8 -> 10.0.0.33 TCP 128 z39-50 > 4235 [PSH, ACK] Seq=1 Ack=116 Win=49640 Len=70951256 315.495462 10.0.0.8 -> 10.0.0.33 TCP 64 z39-50 > 4235 [ACK] Seq=71 Ack=208 Win=49640 Len=0951261 315.495938 10.0.0.8 -> 10.0.0.33 TCP 98 z39-50 > 4235 [PSH, ACK] Seq=71 Ack=208 Win=49640 Len=40951489 315.553088 10.0.0.8 -> 10.0.0.33 TCP 64 z39-50 > 4235 [FIN, ACK] Seq=111 Ack=216 Win=49640 Len=0951594 315.605107 10.0.0.8 -> 10.0.0.33 TCP 64 z39-50 > 4235 [ACK] Seq=112 Ack=217 Win=49640 Len=0951597 315.606184 10.0.0.8 -> 10.0.0.33 TCP 66 z39-50 > 4236 [SYN, ACK] Seq=0 Ack=1 Win=49640 Len=0 MSS=1460 SACK_PERM=1951786 315.657759 10.0.0.8 -> 10.0.0.33 TCP 64 z39-50 > 4236 [ACK] Seq=1 Ack=116 Win=49640 Len=0955557 316.951747 10.0.0.8 -> 10.0.0.33 TCP 128 z39-50 > 4236 [PSH, ACK] Seq=1 Ack=116 Win=49640 Len=70955704 317.003686 10.0.0.8 -> 10.0.0.33 TCP 64 z39-50 > 4236 [ACK] Seq=71 Ack=208 Win=49640 Len=0955708 317.004129 10.0.0.8 -> 10.0.0.33 TCP 98 z39-50 > 4236 [PSH, ACK] Seq=71 Ack=208 Win=49640 Len=40955930 317.060914 10.0.0.8 -> 10.0.0.33 TCP 64 z39-50 > 4236 [FIN, ACK] Seq=111 Ack=216 Win=49640 Len=0956013 317.112163 10.0.0.8 -> 10.0.0.33 TCP 64 z39-50 > 4236 [ACK] Seq=112 Ack=217 Win=49640 Len=0964636 321.081857 10.0.0.8 -> 10.0.0.33 TCP 66 z39-50 > 4255 [SYN, ACK] Seq=0 Ack=1 Win=49640 Len=0 MSS=1460 SACK_PERM=1964735 321.133654 10.0.0.8 -> 10.0.0.33 TCP 64 z39-50 > 4255 [ACK] Seq=1 Ack=116 Win=49525 Len=0968330 322.470616 10.0.0.8 -> 10.0.0.33 TCP 128 z39-50 > 4255 [PSH, ACK] Seq=1 Ack=116 Win=49640 Len=70968424 322.522409 10.0.0.8 -> 10.0.0.33 TCP 64 z39-50 > 4255 [ACK] Seq=71 Ack=209 Win=49640 Len=0968433 322.523251 10.0.0.8 -> 10.0.0.33 TCP 98 z39-50 > 4255 [PSH, ACK] Seq=71 Ack=209 Win=49640 Len=40968521 322.580416 10.0.0.8 -> 10.0.0.33 TCP 64 z39-50 > 4255 [FIN, ACK] Seq=111 Ack=217 Win=49640 Len=0968703 322.632960 10.0.0.8 -> 10.0.0.33 TCP 64 z39-50 > 4255 [ACK] Seq=112 Ack=218 Win=49640 Len=0968709 322.635970 10.0.0.8 -> 10.0.0.33 TCP 66 z39-50 > 4256 [SYN, ACK] Seq=0 Ack=1 Win=49640 Len=0 MSS=1460 SACK_PERM=1968830 322.687385 10.0.0.8 -> 10.0.0.33 TCP 64 z39-50 > 4256 [ACK] Seq=1 Ack=116 Win=49525 Len=0971510 323.982268 10.0.0.8 -> 10.0.0.33 TCP 128 z39-50 > 4256 [PSH, ACK] Seq=1 Ack=116 Win=49640 Len=70972030 324.033938 10.0.0.8 -> 10.0.0.33 TCP 64 z39-50 > 4256 [ACK] Seq=71 Ack=209 Win=49640 Len=0972036 324.034512 10.0.0.8 -> 10.0.0.33 TCP 98 z39-50 > 4256 [PSH, ACK] Seq=71 Ack=209 Win=49640 Len=40972406 324.090615 10.0.0.8 -> 10.0.0.33 TCP 64 z39-50 > 4256 [FIN, ACK] Seq=111 Ack=217 Win=49640 Len=0972942 324.141829 10.0.0.8 -> 10.0.0.33 TCP 64 z39-50 > 4256 [ACK] Seq=112 Ack=218 Win=49640 Len=0985537 329.043822 10.0.0.8 -> 10.0.0.33 TCP 66 z39-50 > 4282 [SYN, ACK] Seq=0 Ack=1 Win=49640 Len=0 MSS=1460 SACK_PERM=1985696 329.095435 10.0.0.8 -> 10.0.0.33 TCP 64 z39-50 > 4282 [ACK] Seq=1 Ack=92 Win=49549 Len=0990594 330.400244 10.0.0.8 -> 10.0.0.33 TCP 128 z39-50 > 4282 [PSH, ACK] Seq=1 Ack=92 Win=49640 Len=70990754 330.451823 10.0.0.8 -> 10.0.0.33 TCP 64 z39-50 > 4282 [ACK] Seq=71 Ack=197 Win=49640 Len=0990755 330.452313 10.0.0.8 -> 10.0.0.33 TCP 98 z39-50 > 4282 [PSH, ACK] Seq=71 Ack=197 Win=49640 Len=40990866 330.509966 10.0.0.8 -> 10.0.0.33 TCP 64 z39-50 > 4282 [FIN, ACK] Seq=111 Ack=205 Win=49640 Len=0991167 330.561694 10.0.0.8 -> 10.0.0.33 TCP 64 z39-50 > 4282 [ACK] Seq=112 Ack=206 Win=49640 Len=0991169 330.563927 10.0.0.8 -> 10.0.0.33 TCP 66 z39-50 > 4291 [SYN, ACK] Seq=0 Ack=1 Win=49640 Len=0 MSS=1460 SACK_PERM=1991228 330.615662 10.0.0.8 -> 10.0.0.33 TCP 64 z39-50 > 4291 [ACK] Seq=1 Ack=92 Win=49549 Len=0994598 331.894375 10.0.0.8 -> 10.0.0.33 TCP 128 z39-50 > 4291 [PSH, ACK] Seq=1 Ack=92 Win=49640 Len=70994800 331.945768 10.0.0.8 -> 10.0.0.33 TCP 64 z39-50 > 4291 [ACK] Seq=71 Ack=197 Win=49640 Len=0994801 331.946231 10.0.0.8 -> 10.0.0.33 TCP 98 z39-50 > 4291 [PSH, ACK] Seq=71 Ack=197 Win=49640 Len=40995006 332.002825 10.0.0.8 -> 10.0.0.33 TCP 64 z39-50 > 4291 [FIN, ACK] Seq=111 Ack=205 Win=49640 Len=0995214 332.056585 10.0.0.8 -> 10.0.0.33 TCP 64 z39-50 > 4291 [ACK] Seq=112 Ack=206 Win=49640 Len=0