6941   2.299000 244.3.106.254 -> 244.3.210.254 TCP 64 4227 > 19813 [ACK] Seq=1 Ack=13 Win=64239 Len=0
117944  42.318411 244.3.106.254 -> 244.3.210.254 TCP 70 4227 > 19813 [PSH, ACK] Seq=1 Ack=13 Win=64239 Len=12
237417  82.460970 244.3.106.254 -> 244.3.210.254 TCP 64 4227 > 19813 [ACK] Seq=13 Ack=25 Win=64227 Len=0
358612 122.455652 244.3.106.254 -> 244.3.210.254 TCP 70 4227 > 19813 [PSH, ACK] Seq=13 Ack=25 Win=64227 Len=12
493053 162.729996 244.3.106.254 -> 244.3.210.254 TCP 64 4227 > 19813 [ACK] Seq=25 Ack=37 Win=64215 Len=0
643914 202.661149 244.3.106.254 -> 244.3.210.254 TCP 70 4227 > 19813 [PSH, ACK] Seq=25 Ack=37 Win=64215 Len=12
755304 242.795619 244.3.106.254 -> 244.3.210.254 TCP 64 4227 > 19813 [ACK] Seq=37 Ack=49 Win=64203 Len=0
855606 282.815965 244.3.106.254 -> 244.3.210.254 TCP 70 4227 > 19813 [PSH, ACK] Seq=37 Ack=49 Win=64203 Len=12
969545 322.960156 244.3.106.254 -> 244.3.210.254 TCP 64 4227 > 19813 [ACK] Seq=49 Ack=61 Win=64191 Len=0
