319736 109.058838 68.33.203.201 -> 244.3.210.197 TCP 70 49160 > http [SYN] Seq=0 Win=8192 Len=0 MSS=1460 WS=4 SACK_PERM=1
319824 109.080603 68.33.203.201 -> 244.3.210.197 TCP 64 49160 > http [ACK] Seq=1 Ack=1 Win=17520 Len=0
320863 109.560890 68.33.203.201 -> 244.3.210.197 TCP 64 49160 > http [ACK] Seq=719 Ack=2921 Win=17520 Len=0
320892 109.574827 68.33.203.201 -> 244.3.210.197 TCP 64 49160 > http [ACK] Seq=719 Ack=5841 Win=17520 Len=0
320917 109.586829 68.33.203.201 -> 244.3.210.197 TCP 64 49160 > http [ACK] Seq=719 Ack=11681 Win=16060 Len=0
320945 109.590928 68.33.203.201 -> 244.3.210.197 TCP 64 [TCP Dup ACK 320917#1] 49160 > http [ACK] Seq=719 Ack=11681 Win=16060 Len=0
320956 109.596612 68.33.203.201 -> 244.3.210.197 TCP 64 49160 > http [ACK] Seq=719 Ack=17521 Win=10220 Len=0
320970 109.600562 68.33.203.201 -> 244.3.210.197 TCP 64 [TCP Dup ACK 320956#1] 49160 > http [ACK] Seq=719 Ack=17521 Win=10220 Len=0
320985 109.606935 68.33.203.201 -> 244.3.210.197 TCP 64 49160 > http [ACK] Seq=719 Ack=19455 Win=8284 Len=0
328120 113.635269 68.33.203.201 -> 244.3.210.197 TCP 64 [TCP Window Update] 49160 > http [ACK] Seq=719 Ack=19455 Win=17520 Len=0
329721 114.851300 68.33.203.201 -> 244.3.210.197 TCP 70 49161 > http [SYN] Seq=0 Win=8192 Len=0 MSS=1460 WS=4 SACK_PERM=1
329757 114.856178 68.33.203.201 -> 244.3.210.197 TCP 70 hostkey > http [SYN] Seq=0 Win=8192 Len=0 MSS=1460 WS=4 SACK_PERM=1
329758 114.856183 68.33.203.201 -> 244.3.210.197 TCP 70 sstat > http [SYN] Seq=0 Win=8192 Len=0 MSS=1460 WS=4 SACK_PERM=1
329759 114.856187 68.33.203.201 -> 244.3.210.197 TCP 70 rbiff > http [SYN] Seq=0 Win=8192 Len=0 MSS=1460 WS=4 SACK_PERM=1
329760 114.856191 68.33.203.201 -> 244.3.210.197 TCP 70 lp-acct > http [SYN] Seq=0 Win=8192 Len=0 MSS=1460 WS=4 SACK_PERM=1
329802 114.870987 68.33.203.201 -> 244.3.210.197 TCP 64 49161 > http [ACK] Seq=1 Ack=1 Win=17520 Len=0
329821 114.875514 68.33.203.201 -> 244.3.210.197 TCP 64 49160 > http [ACK] Seq=1511 Ack=28215 Win=17520 Len=0
329822 114.875519 68.33.203.201 -> 244.3.210.197 TCP 64 lp-acct > http [ACK] Seq=1 Ack=1 Win=17520 Len=0
329823 114.875523 68.33.203.201 -> 244.3.210.197 TCP 64 rbiff > http [ACK] Seq=1 Ack=1 Win=17520 Len=0
329824 114.875561 68.33.203.201 -> 244.3.210.197 TCP 64 sstat > http [ACK] Seq=1 Ack=1 Win=17520 Len=0
329825 114.875566 68.33.203.201 -> 244.3.210.197 TCP 64 hostkey > http [ACK] Seq=1 Ack=1 Win=17520 Len=0
329918 114.890305 68.33.203.201 -> 244.3.210.197 TCP 64 49161 > http [ACK] Seq=783 Ack=2921 Win=17520 Len=0
329919 114.890309 68.33.203.201 -> 244.3.210.197 TCP 64 49160 > http [ACK] Seq=1511 Ack=29836 Win=17356 Len=0
329942 114.894833 68.33.203.201 -> 244.3.210.197 TCP 64 rbiff > http [ACK] Seq=793 Ack=2921 Win=17520 Len=0
329943 114.894838 68.33.203.201 -> 244.3.210.197 TCP 64 lp-acct > http [ACK] Seq=797 Ack=2921 Win=17520 Len=0
329944 114.894842 68.33.203.201 -> 244.3.210.197 TCP 64 sstat > http [ACK] Seq=792 Ack=2921 Win=17520 Len=0
329971 114.898628 68.33.203.201 -> 244.3.210.197 TCP 64 hostkey > http [ACK] Seq=792 Ack=2921 Win=17520 Len=0
329986 114.902530 68.33.203.201 -> 244.3.210.197 TCP 64 49161 > http [ACK] Seq=783 Ack=5841 Win=17520 Len=0
330005 114.906857 68.33.203.201 -> 244.3.210.197 TCP 64 lp-acct > http [ACK] Seq=797 Ack=5841 Win=17520 Len=0
330023 114.910503 68.33.203.201 -> 244.3.210.197 TCP 64 hostkey > http [ACK] Seq=792 Ack=5841 Win=17520 Len=0
330036 114.915207 68.33.203.201 -> 244.3.210.197 TCP 64 49161 > http [ACK] Seq=783 Ack=11681 Win=16060 Len=0
330049 114.923031 68.33.203.201 -> 244.3.210.197 TCP 64 hostkey > http [ACK] Seq=792 Ack=8761 Win=17520 Len=0
330056 114.926538 68.33.203.201 -> 244.3.210.197 TCP 64 49161 > http [ACK] Seq=783 Ack=17521 Win=10220 Len=0
330073 114.930806 68.33.203.201 -> 244.3.210.197 TCP 64 [TCP Dup ACK 330056#1] 49161 > http [ACK] Seq=783 Ack=17521 Win=10220 Len=0
330099 114.940773 68.33.203.201 -> 244.3.210.197 TCP 64 49161 > http [ACK] Seq=783 Ack=23361 Win=4380 Len=0
330100 114.940777 68.33.203.201 -> 244.3.210.197 TCP 64 49161 > http [ACK] Seq=783 Ack=26281 Win=1460 Len=0
330210 115.015192 68.33.203.201 -> 244.3.210.197 TCP 64 49161 > http [RST, ACK] Seq=783 Ack=27741 Win=0 Len=0
330212 115.015201 68.33.203.201 -> 244.3.210.197 TCP 64 49160 > http [RST, ACK] Seq=1511 Ack=29836 Win=0 Len=0
330213 115.015247 68.33.203.201 -> 244.3.210.197 TCP 64 lp-acct > http [RST, ACK] Seq=797 Ack=5864 Win=0 Len=0
330214 115.015252 68.33.203.201 -> 244.3.210.197 TCP 64 rbiff > http [RST, ACK] Seq=793 Ack=3458 Win=0 Len=0
330215 115.015256 68.33.203.201 -> 244.3.210.197 TCP 64 sstat > http [RST, ACK] Seq=792 Ack=3302 Win=0 Len=0
330216 115.015260 68.33.203.201 -> 244.3.210.197 TCP 64 hostkey > http [RST, ACK] Seq=792 Ack=9754 Win=0 Len=0
330256 115.018797 68.33.203.201 -> 244.3.210.197 TCP 70 uwcount > http [SYN] Seq=0 Win=8192 Len=0 MSS=1460 WS=4 SACK_PERM=1
330257 115.018801 68.33.203.201 -> 244.3.210.197 TCP 70 serverstat > http [SYN] Seq=0 Win=8192 Len=0 MSS=1460 WS=4 SACK_PERM=1
330258 115.018805 68.33.203.201 -> 244.3.210.197 TCP 70 csdbsoap > http [SYN] Seq=0 Win=8192 Len=0 MSS=1460 WS=4 SACK_PERM=1
330304 115.022993 68.33.203.201 -> 244.3.210.197 TCP 70 passwdsize > http [SYN] Seq=0 Win=8192 Len=0 MSS=1460 WS=4 SACK_PERM=1
330305 115.022997 68.33.203.201 -> 244.3.210.197 TCP 70 localstat > http [SYN] Seq=0 Win=8192 Len=0 MSS=1460 WS=4 SACK_PERM=1
330306 115.023001 68.33.203.201 -> 244.3.210.197 TCP 70 csdbpsql > http [SYN] Seq=0 Win=8192 Len=0 MSS=1460 WS=4 SACK_PERM=1
330350 115.030852 68.33.203.201 -> 244.3.210.197 TCP 64 serverstat > http [ACK] Seq=1 Ack=1 Win=17520 Len=0
330351 115.030856 68.33.203.201 -> 244.3.210.197 TCP 64 uwcount > http [ACK] Seq=1 Ack=1 Win=17520 Len=0
330352 115.030860 68.33.203.201 -> 244.3.210.197 TCP 64 csdbsoap > http [ACK] Seq=1 Ack=1 Win=17520 Len=0
330397 115.036411 68.33.203.201 -> 244.3.210.197 TCP 64 csdbpsql > http [ACK] Seq=1 Ack=1 Win=17520 Len=0
330427 115.042054 68.33.203.201 -> 244.3.210.197 TCP 64 localstat > http [ACK] Seq=1 Ack=1 Win=17520 Len=0
330428 115.042084 68.33.203.201 -> 244.3.210.197 TCP 64 passwdsize > http [ACK] Seq=1 Ack=1 Win=17520 Len=0
330499 115.054789 68.33.203.201 -> 244.3.210.197 TCP 64 serverstat > http [ACK] Seq=783 Ack=2921 Win=17520 Len=0
330500 115.054793 68.33.203.201 -> 244.3.210.197 TCP 64 uwcount > http [ACK] Seq=793 Ack=2921 Win=17520 Len=0
330519 115.058603 68.33.203.201 -> 244.3.210.197 TCP 64 csdbsoap > http [ACK] Seq=789 Ack=2921 Win=17520 Len=0
330520 115.058608 68.33.203.201 -> 244.3.210.197 TCP 64 csdbpsql > http [ACK] Seq=792 Ack=2921 Win=17520 Len=0
330544 115.062567 68.33.203.201 -> 244.3.210.197 TCP 64 localstat > http [ACK] Seq=796 Ack=2670 Win=17520 Len=0
330559 115.066709 68.33.203.201 -> 244.3.210.197 TCP 64 passwdsize > http [ACK] Seq=792 Ack=2921 Win=17520 Len=0
330568 115.071008 68.33.203.201 -> 244.3.210.197 TCP 64 serverstat > http [ACK] Seq=783 Ack=5841 Win=17520 Len=0
330569 115.071013 68.33.203.201 -> 244.3.210.197 TCP 64 uwcount > http [ACK] Seq=793 Ack=5841 Win=17520 Len=0
330570 115.071017 68.33.203.201 -> 244.3.210.197 TCP 64 csdbpsql > http [ACK] Seq=792 Ack=5841 Win=17520 Len=0
330642 115.095280 68.33.203.201 -> 244.3.210.197 TCP 64 serverstat > http [ACK] Seq=783 Ack=11681 Win=16060 Len=0
330657 115.098802 68.33.203.201 -> 244.3.210.197 TCP 64 [TCP Dup ACK 330642#1] serverstat > http [ACK] Seq=783 Ack=11681 Win=16060 Len=0
330658 115.098807 68.33.203.201 -> 244.3.210.197 TCP 64 uwcount > http [ACK] Seq=793 Ack=10382 Win=17356 Len=0
330659 115.098811 68.33.203.201 -> 244.3.210.197 TCP 64 csdbpsql > http [ACK] Seq=792 Ack=11681 Win=16060 Len=0
330730 115.110145 68.33.203.201 -> 244.3.210.197 TCP 64 serverstat > http [ACK] Seq=783 Ack=17521 Win=10220 Len=0
330745 115.114682 68.33.203.201 -> 244.3.210.197 TCP 64 csdbpsql > http [ACK] Seq=792 Ack=17521 Win=10220 Len=0
330758 115.122634 68.33.203.201 -> 244.3.210.197 TCP 64 serverstat > http [ACK] Seq=783 Ack=26281 Win=1460 Len=0
330767 115.126618 68.33.203.201 -> 244.3.210.197 TCP 64 csdbpsql > http [ACK] Seq=792 Ack=26281 Win=1460 Len=0
330777 115.131783 68.33.203.201 -> 244.3.210.197 TCP 64 [TCP Dup ACK 330767#1] csdbpsql > http [ACK] Seq=792 Ack=26281 Win=1460 Len=0
330931 115.262867 68.33.203.201 -> 244.3.210.197 TCP 64 csdbsoap > http [ACK] Seq=789 Ack=3366 Win=17072 Len=0
330932 115.262872 68.33.203.201 -> 244.3.210.197 TCP 64 passwdsize > http [ACK] Seq=792 Ack=3302 Win=17136 Len=0
331078 115.327035 68.33.203.201 -> 244.3.210.197 TCP 64 [TCP ZeroWindow] serverstat > http [ACK] Seq=783 Ack=27741 Win=0 Len=0
331079 115.327040 68.33.203.201 -> 244.3.210.197 TCP 64 [TCP ZeroWindow] csdbpsql > http [ACK] Seq=792 Ack=27741 Win=0 Len=0
331547 115.616609 68.33.203.201 -> 244.3.210.197 TCP 64 [TCP Window Update] csdbpsql > http [ACK] Seq=792 Ack=27741 Win=17520 Len=0
331548 115.616614 68.33.203.201 -> 244.3.210.197 TCP 64 [TCP Window Update] serverstat > http [ACK] Seq=783 Ack=27741 Win=17520 Len=0
331610 115.637553 68.33.203.201 -> 244.3.210.197 TCP 64 csdbpsql > http [ACK] Seq=792 Ack=39421 Win=75920 Len=0
331611 115.637558 68.33.203.201 -> 244.3.210.197 TCP 64 serverstat > http [ACK] Seq=783 Ack=33581 Win=17520 Len=0
331670 115.640622 68.33.203.201 -> 244.3.210.197 TCP 64 localstat > http [ACK] Seq=1599 Ack=5590 Win=17520 Len=0
331693 115.651503 68.33.203.201 -> 244.3.210.197 TCP 64 uwcount > http [ACK] Seq=1586 Ack=16222 Win=17520 Len=0
331704 115.655949 68.33.203.201 -> 244.3.210.197 TCP 64 csdbsoap > http [ACK] Seq=1580 Ack=9206 Win=17520 Len=0
331705 115.655953 68.33.203.201 -> 244.3.210.197 TCP 64 csdbpsql > http [ACK] Seq=792 Ack=51101 Win=74460 Len=0
331730 115.658950 68.33.203.201 -> 244.3.210.197 TCP 64 passwdsize > http [ACK] Seq=1578 Ack=9142 Win=17520 Len=0
331731 115.658955 68.33.203.201 -> 244.3.210.197 TCP 64 serverstat > http [ACK] Seq=1572 Ack=48843 Win=13140 Len=0
331770 115.662561 68.33.203.201 -> 244.3.210.197 TCP 64 [TCP Dup ACK 331731#1] serverstat > http [ACK] Seq=1572 Ack=48843 Win=13140 Len=0
331776 115.666836 68.33.203.201 -> 244.3.210.197 TCP 64 localstat > http [ACK] Seq=1599 Ack=7423 Win=17520 Len=0
331777 115.666841 68.33.203.201 -> 244.3.210.197 TCP 64 uwcount > http [ACK] Seq=1586 Ack=21457 Win=16664 Len=0
331797 115.670665 68.33.203.201 -> 244.3.210.197 TCP 64 csdbsoap > http [ACK] Seq=1580 Ack=12126 Win=17520 Len=0
331798 115.670670 68.33.203.201 -> 244.3.210.197 TCP 64 csdbpsql > http [ACK] Seq=792 Ack=65701 Win=74460 Len=0
331831 115.674914 68.33.203.201 -> 244.3.210.197 TCP 64 [TCP Dup ACK 331798#1] csdbpsql > http [ACK] Seq=792 Ack=65701 Win=74460 Len=0
331843 115.678926 68.33.203.201 -> 244.3.210.197 TCP 64 passwdsize > http [ACK] Seq=1578 Ack=14081 Win=16960 Len=0
331844 115.678931 68.33.203.201 -> 244.3.210.197 TCP 64 serverstat > http [ACK] Seq=1572 Ack=60523 Win=1460 Len=0
331855 115.682529 68.33.203.201 -> 244.3.210.197 TCP 64 csdbpsql > http [ACK] Seq=792 Ack=77381 Win=71540 Len=0
331882 115.686909 68.33.203.201 -> 244.3.210.197 TCP 64 csdbpsql > http [ACK] Seq=792 Ack=80301 Win=71540 Len=0
331898 115.691164 68.33.203.201 -> 244.3.210.197 TCP 64 csdbpsql > http [ACK] Seq=792 Ack=86141 Win=70080 Len=0
331910 115.694658 68.33.203.201 -> 244.3.210.197 TCP 64 csdbpsql > http [ACK] Seq=792 Ack=97821 Win=68620 Len=0
331930 115.698804 68.33.203.201 -> 244.3.210.197 TCP 64 csdbpsql > http [ACK] Seq=792 Ack=100741 Win=68620 Len=0
331939 115.702813 68.33.203.201 -> 244.3.210.197 TCP 64 csdbpsql > http [ACK] Seq=792 Ack=109501 Win=67160 Len=0
331954 115.706590 68.33.203.201 -> 244.3.210.197 TCP 64 csdbpsql > http [ACK] Seq=792 Ack=124101 Win=65700 Len=0
331964 115.710649 68.33.203.201 -> 244.3.210.197 TCP 64 csdbpsql > http [ACK] Seq=792 Ack=127021 Win=65700 Len=0
331970 115.714874 68.33.203.201 -> 244.3.210.197 TCP 64 csdbpsql > http [ACK] Seq=792 Ack=134326 Win=65700 Len=0
331977 115.718507 68.33.203.201 -> 244.3.210.197 TCP 64 [TCP Dup ACK 331970#1] csdbpsql > http [ACK] Seq=792 Ack=134326 Win=65700 Len=0
332156 115.776164 68.33.203.201 -> 244.3.210.197 TCP 64 csdbpsql > http [ACK] Seq=1580 Ack=157686 Win=51100 Len=0
332182 115.780948 68.33.203.201 -> 244.3.210.197 TCP 64 csdbpsql > http [ACK] Seq=1580 Ack=163526 Win=45260 Len=0
332207 115.784645 68.33.203.201 -> 244.3.210.197 TCP 64 csdbpsql > http [ACK] Seq=1580 Ack=169366 Win=39420 Len=0
332220 115.790216 68.33.203.201 -> 244.3.210.197 TCP 64 csdbpsql > http [ACK] Seq=1580 Ack=183966 Win=24820 Len=0
332226 115.794527 68.33.203.201 -> 244.3.210.197 TCP 64 csdbpsql > http [ACK] Seq=1580 Ack=195646 Win=13140 Len=0
332236 115.798807 68.33.203.201 -> 244.3.210.197 TCP 64 csdbpsql > http [ACK] Seq=1580 Ack=198566 Win=10220 Len=0
332257 115.802786 68.33.203.201 -> 244.3.210.197 TCP 64 csdbpsql > http [ACK] Seq=1580 Ack=198916 Win=32320 Len=0
332266 115.806956 68.33.203.201 -> 244.3.210.197 TCP 64 [TCP Dup ACK 332257#1] csdbpsql > http [ACK] Seq=1580 Ack=198916 Win=32320 Len=0
332345 115.865024 68.33.203.201 -> 244.3.210.197 TCP 64 csdbsoap > http [ACK] Seq=1580 Ack=13119 Win=16524 Len=0
332353 115.871041 68.33.203.201 -> 244.3.210.197 TCP 64 [TCP ZeroWindow] serverstat > http [ACK] Seq=1572 Ack=61983 Win=0 Len=0
332507 115.984627 68.33.203.201 -> 244.3.210.197 TCP 64 localstat > http [ACK] Seq=2395 Ack=13263 Win=17520 Len=0
332516 115.990235 68.33.203.201 -> 244.3.210.197 TCP 64 [TCP Dup ACK 332507#1] localstat > http [ACK] Seq=2395 Ack=13263 Win=17520 Len=0
332530 116.006688 68.33.203.201 -> 244.3.210.197 TCP 64 [TCP Window Update] serverstat > http [ACK] Seq=1572 Ack=61983 Win=122640 Len=0
332552 116.010513 68.33.203.201 -> 244.3.210.197 TCP 64 [TCP Dup ACK 332530#1] serverstat > http [ACK] Seq=1572 Ack=61983 Win=122640 Len=0
332582 116.021331 68.33.203.201 -> 244.3.210.197 TCP 64 serverstat > http [ACK] Seq=1572 Ack=72386 Win=122640 Len=0
332607 116.025286 68.33.203.201 -> 244.3.210.197 TCP 64 [TCP Dup ACK 332582#1] serverstat > http [ACK] Seq=1572 Ack=72386 Win=122640 Len=0
332622 116.031396 68.33.203.201 -> 244.3.210.197 TCP 64 uwcount > http [ACK] Seq=2378 Ack=24377 Win=17520 Len=0
332628 116.034785 68.33.203.201 -> 244.3.210.197 TCP 64 csdbsoap > http [ACK] Seq=2365 Ack=21879 Win=17520 Len=0
332635 116.038927 68.33.203.201 -> 244.3.210.197 TCP 64 passwdsize > http [ACK] Seq=2365 Ack=22841 Win=17520 Len=0
332645 116.042541 68.33.203.201 -> 244.3.210.197 TCP 64 serverstat > http [ACK] Seq=2360 Ack=75306 Win=148920 Len=0
332651 116.046552 68.33.203.201 -> 244.3.210.197 TCP 64 csdbsoap > http [ACK] Seq=2365 Ack=24452 Win=16404 Len=0
332685 116.079600 68.33.203.201 -> 244.3.210.197 TCP 64 [TCP Window Update] csdbpsql > http [ACK] Seq=1580 Ack=198916 Win=84680 Len=0
332716 116.100578 68.33.203.201 -> 244.3.210.197 TCP 64 csdbpsql > http [ACK] Seq=2372 Ack=201836 Win=84680 Len=0
332796 116.184701 68.33.203.201 -> 244.3.210.197 TCP 64 localstat > http [ACK] Seq=2395 Ack=13286 Win=17496 Len=0
332830 116.230946 68.33.203.201 -> 244.3.210.197 TCP 64 uwcount > http [ACK] Seq=2378 Ack=24914 Win=16980 Len=0
332831 116.230951 68.33.203.201 -> 244.3.210.197 TCP 64 serverstat > http [ACK] Seq=2360 Ack=75944 Win=148280 Len=0
332871 116.250101 68.33.203.201 -> 244.3.210.197 TCP 64 passwdsize > http [ACK] Seq=2365 Ack=23267 Win=17092 Len=0
332962 116.294832 68.33.203.201 -> 244.3.210.197 TCP 64 csdbpsql > http [ACK] Seq=2372 Ack=203266 Win=83248 Len=0
333884 116.718532 68.33.203.201 -> 244.3.210.197 TCP 64 uwcount > http [ACK] Seq=3167 Ack=29818 Win=17520 Len=0
333917 116.730923 68.33.203.201 -> 244.3.210.197 TCP 64 localstat > http [ACK] Seq=3185 Ack=22046 Win=17520 Len=0
333947 116.734901 68.33.203.201 -> 244.3.210.197 TCP 64 [TCP Dup ACK 333917#1] localstat > http [ACK] Seq=3185 Ack=22046 Win=17520 Len=0
333948 116.734912 68.33.203.201 -> 244.3.210.197 TCP 64 csdbsoap > http [ACK] Seq=3155 Ack=36132 Win=16060 Len=0
333978 116.738500 68.33.203.201 -> 244.3.210.197 TCP 64 [TCP Dup ACK 333948#1] csdbsoap > http [ACK] Seq=3155 Ack=36132 Win=16060 Len=0
333989 116.742601 68.33.203.201 -> 244.3.210.197 TCP 64 passwdsize > http [ACK] Seq=3153 Ack=32027 Win=17520 Len=0
334001 116.747181 68.33.203.201 -> 244.3.210.197 TCP 64 passwdsize > http [ACK] Seq=3153 Ack=33936 Win=17068 Len=0
334007 116.750804 68.33.203.201 -> 244.3.210.197 TCP 64 [TCP Dup ACK 334001#1] passwdsize > http [ACK] Seq=3153 Ack=33936 Win=17068 Len=0
334008 116.750809 68.33.203.201 -> 244.3.210.197 TCP 64 localstat > http [ACK] Seq=3185 Ack=24966 Win=16060 Len=0
334009 116.750813 68.33.203.201 -> 244.3.210.197 TCP 64 localstat > http [ACK] Seq=3185 Ack=33726 Win=7300 Len=0
334037 116.756140 68.33.203.201 -> 244.3.210.197 TCP 64 csdbsoap > http [ACK] Seq=3155 Ack=50732 Win=1460 Len=0
334057 116.764784 68.33.203.201 -> 244.3.210.197 TCP 64 localstat > http [ACK] Seq=3185 Ack=39566 Win=1460 Len=0
334076 116.770138 68.33.203.201 -> 244.3.210.197 TCP 64 [TCP Dup ACK 334057#1] localstat > http [ACK] Seq=3185 Ack=39566 Win=1460 Len=0
334112 116.810514 68.33.203.201 -> 244.3.210.197 TCP 64 localstat > http [ACK] Seq=3185 Ack=41026 Win=17520 Len=0
334133 116.814960 68.33.203.201 -> 244.3.210.197 TCP 64 csdbsoap > http [ACK] Seq=3155 Ack=52192 Win=17520 Len=0
334162 116.822850 68.33.203.201 -> 244.3.210.197 TCP 64 localstat > http [ACK] Seq=3185 Ack=43946 Win=17520 Len=0
334177 116.826516 68.33.203.201 -> 244.3.210.197 TCP 64 csdbsoap > http [ACK] Seq=3155 Ack=53699 Win=17520 Len=0
334554 116.958857 68.33.203.201 -> 244.3.210.197 TCP 64 serverstat > http [ACK] Seq=3151 Ack=78642 Win=145584 Len=0
334555 116.958862 68.33.203.201 -> 244.3.210.197 TCP 64 csdbpsql > http [ACK] Seq=3153 Ack=205576 Win=84680 Len=0
334663 117.010988 68.33.203.201 -> 244.3.210.197 TCP 64 localstat > http [ACK] Seq=3185 Ack=44198 Win=17268 Len=0
334988 117.122504 68.33.203.201 -> 244.3.210.197 TCP 64 uwcount > http [ACK] Seq=3982 Ack=38578 Win=17520 Len=0
335013 117.126650 68.33.203.201 -> 244.3.210.197 TCP 64 uwcount > http [ACK] Seq=3982 Ack=44418 Win=13140 Len=0
335014 117.126655 68.33.203.201 -> 244.3.210.197 TCP 64 passwdsize > http [ACK] Seq=3956 Ack=48071 Win=13604 Len=0
335032 117.130806 68.33.203.201 -> 244.3.210.197 TCP 64 uwcount > http [ACK] Seq=3982 Ack=47338 Win=10220 Len=0
335033 117.130811 68.33.203.201 -> 244.3.210.197 TCP 64 [TCP Dup ACK 335014#1] passwdsize > http [ACK] Seq=3956 Ack=48071 Win=13604 Len=0
335047 117.134810 68.33.203.201 -> 244.3.210.197 TCP 64 uwcount > http [ACK] Seq=3982 Ack=55940 Win=1616 Len=0
335059 117.138498 68.33.203.201 -> 244.3.210.197 TCP 64 [TCP Dup ACK 335047#1] uwcount > http [ACK] Seq=3982 Ack=55940 Win=1616 Len=0
335463 117.379242 68.33.203.201 -> 244.3.210.197 TCP 64 [TCP Window Update] passwdsize > http [ACK] Seq=3956 Ack=48071 Win=17520 Len=0
335464 117.379246 68.33.203.201 -> 244.3.210.197 TCP 64 [TCP Window Update] uwcount > http [ACK] Seq=3982 Ack=55940 Win=17520 Len=0
338124 117.664689 68.33.203.201 -> 244.3.210.197 TCP 64 localstat > http [ACK] Seq=3986 Ack=44779 Win=16684 Len=0
345687 117.961355 68.33.203.201 -> 244.3.210.197 TCP 64 csdbsoap > http [ACK] Seq=3979 Ack=58499 Win=17520 Len=0
345838 117.964817 68.33.203.201 -> 244.3.210.197 TCP 64 serverstat > http [ACK] Seq=3973 Ack=80735 Win=146000 Len=0
346002 117.970264 68.33.203.201 -> 244.3.210.197 TCP 64 csdbpsql > http [ACK] Seq=3975 Ack=207664 Win=84680 Len=0
346004 117.970297 68.33.203.201 -> 244.3.210.197 TCP 64 passwdsize > http [ACK] Seq=4778 Ack=50277 Win=17520 Len=0
346377 117.978880 68.33.203.201 -> 244.3.210.197 TCP 64 localstat > http [ACK] Seq=4808 Ack=47119 Win=17520 Len=0
346929 117.994828 68.33.203.201 -> 244.3.210.197 TCP 64 uwcount > http [ACK] Seq=5597 Ack=58251 Win=17520 Len=0
349570 118.134814 68.33.203.201 -> 244.3.210.197 TCP 64 serverstat > http [ACK] Seq=4770 Ack=85303 Win=146000 Len=0
349571 118.134819 68.33.203.201 -> 244.3.210.197 TCP 64 csdbsoap > http [ACK] Seq=4801 Ack=60577 Win=17520 Len=0
364341 124.080659 68.33.203.201 -> 244.3.210.197 TCP 64 csdbpsql > http [ACK] Seq=4787 Ack=219344 Win=134320 Len=0
364367 124.084662 68.33.203.201 -> 244.3.210.197 TCP 64 csdbpsql > http [ACK] Seq=4787 Ack=232554 Win=121108 Len=0
364400 124.090128 68.33.203.201 -> 244.3.210.197 TCP 64 [TCP Dup ACK 364367#1] csdbpsql > http [ACK] Seq=4787 Ack=232554 Win=121108 Len=0
364570 124.150819 68.33.203.201 -> 244.3.210.197 TCP 64 [TCP Window Update] csdbpsql > http [ACK] Seq=4787 Ack=232554 Win=137240 Len=0
367754 125.884705 68.33.203.201 -> 244.3.210.197 TCP 64 passwdsize > http [ACK] Seq=5580 Ack=53197 Win=17520 Len=0
368001 126.075204 68.33.203.201 -> 244.3.210.197 TCP 64 passwdsize > http [ACK] Seq=5580 Ack=53307 Win=17408 Len=0
569722 182.058988 68.33.203.201 -> 244.3.210.197 TCP 64 localstat > http [RST, ACK] Seq=4808 Ack=47119 Win=0 Len=0
569723 182.058993 68.33.203.201 -> 244.3.210.197 TCP 64 uwcount > http [RST, ACK] Seq=5597 Ack=58251 Win=0 Len=0
569772 182.062763 68.33.203.201 -> 244.3.210.197 TCP 64 serverstat > http [RST, ACK] Seq=4770 Ack=85303 Win=0 Len=0
569773 182.062767 68.33.203.201 -> 244.3.210.197 TCP 64 csdbsoap > http [RST, ACK] Seq=4801 Ack=60577 Win=0 Len=0
587350 187.067083 68.33.203.201 -> 244.3.210.197 TCP 64 csdbpsql > http [RST, ACK] Seq=4787 Ack=232554 Win=0 Len=0
587351 187.067110 68.33.203.201 -> 244.3.210.197 TCP 64 passwdsize > http [RST, ACK] Seq=5580 Ack=53307 Win=0 Len=0
