926567 308.741067 10.0.0.2 -> 10.0.0.4 TCP 66 47924 > http [SYN] Seq=0 Win=65535 Len=0 MSS=1460 SACK_PERM=1
926795 308.825402 10.0.0.2 -> 10.0.0.4 TCP 64 47924 > http [ACK] Seq=1 Ack=1 Win=1460 Len=0
928631 309.377673 10.0.0.2 -> 10.0.0.4 TCP 64 47924 > http [ACK] Seq=947 Ack=2921 Win=65535 Len=0
928660 309.386758 10.0.0.2 -> 10.0.0.4 TCP 66 14269 > http [SYN] Seq=0 Win=65535 Len=0 MSS=1460 SACK_PERM=1
928774 309.478192 10.0.0.2 -> 10.0.0.4 TCP 64 14269 > http [ACK] Seq=1 Ack=1 Win=1460 Len=0
928777 309.478309 10.0.0.2 -> 10.0.0.4 TCP 64 47924 > http [ACK] Seq=947 Ack=5841 Win=65535 Len=0
929042 309.563516 10.0.0.2 -> 10.0.0.4 TCP 64 47924 > http [ACK] Seq=947 Ack=8761 Win=65535 Len=0
929060 309.569099 10.0.0.2 -> 10.0.0.4 TCP 64 47924 > http [ACK] Seq=947 Ack=11681 Win=65535 Len=0
929066 309.569529 10.0.0.2 -> 10.0.0.4 TCP 64 14269 > http [ACK] Seq=811 Ack=2921 Win=65535 Len=0
929425 309.689148 10.0.0.2 -> 10.0.0.4 TCP 64 47924 > http [ACK] Seq=947 Ack=14601 Win=65535 Len=0
929476 309.697337 10.0.0.2 -> 10.0.0.4 TCP 64 14269 > http [ACK] Seq=811 Ack=5841 Win=65535 Len=0
929838 309.803117 10.0.0.2 -> 10.0.0.4 TCP 64 47924 > http [ACK] Seq=1747 Ack=18340 Win=65535 Len=0
929849 309.805986 10.0.0.2 -> 10.0.0.4 TCP 64 47924 > http [ACK] Seq=1747 Ack=21260 Win=65535 Len=0
929860 309.809973 10.0.0.2 -> 10.0.0.4 TCP 64 47924 > http [ACK] Seq=1747 Ack=24180 Win=65535 Len=0
929869 309.812671 10.0.0.2 -> 10.0.0.4 TCP 64 47924 > http [ACK] Seq=1747 Ack=27100 Win=65535 Len=0
929886 309.823471 10.0.0.2 -> 10.0.0.4 TCP 64 14269 > http [ACK] Seq=811 Ack=8761 Win=65535 Len=0
929901 309.826536 10.0.0.2 -> 10.0.0.4 TCP 64 14269 > http [ACK] Seq=811 Ack=10382 Win=65535 Len=0
930302 309.932741 10.0.0.2 -> 10.0.0.4 TCP 64 47924 > http [ACK] Seq=1747 Ack=30020 Win=65535 Len=0
930323 309.935874 10.0.0.2 -> 10.0.0.4 TCP 64 47924 > http [ACK] Seq=1747 Ack=32940 Win=65535 Len=0
930337 309.939408 10.0.0.2 -> 10.0.0.4 TCP 64 47924 > http [ACK] Seq=1747 Ack=35860 Win=65535 Len=0
930402 309.951599 10.0.0.2 -> 10.0.0.4 TCP 64 47924 > http [ACK] Seq=1747 Ack=38780 Win=65535 Len=0
930417 309.961238 10.0.0.2 -> 10.0.0.4 TCP 64 47924 > http [ACK] Seq=1747 Ack=41700 Win=65535 Len=0
930423 309.964747 10.0.0.2 -> 10.0.0.4 TCP 64 47924 > http [ACK] Seq=1747 Ack=44620 Win=65535 Len=0
930429 309.971359 10.0.0.2 -> 10.0.0.4 TCP 64 14269 > http [ACK] Seq=1617 Ack=13302 Win=65535 Len=0
930598 310.046466 10.0.0.2 -> 10.0.0.4 TCP 64 47924 > http [ACK] Seq=1747 Ack=47540 Win=65535 Len=0
930616 310.052565 10.0.0.2 -> 10.0.0.4 TCP 64 47924 > http [ACK] Seq=1747 Ack=49662 Win=65535 Len=0
930691 310.076544 10.0.0.2 -> 10.0.0.4 TCP 64 14269 > http [ACK] Seq=2426 Ack=16667 Win=65535 Len=0
930738 310.102858 10.0.0.2 -> 10.0.0.4 TCP 64 14269 > http [ACK] Seq=2426 Ack=17048 Win=65154 Len=0
930894 310.182635 10.0.0.2 -> 10.0.0.4 TCP 64 47924 > http [ACK] Seq=2556 Ack=52582 Win=65535 Len=0
930922 310.186784 10.0.0.2 -> 10.0.0.4 TCP 64 47924 > http [ACK] Seq=2556 Ack=55502 Win=65535 Len=0
930943 310.190830 10.0.0.2 -> 10.0.0.4 TCP 64 47924 > http [ACK] Seq=2556 Ack=58422 Win=65535 Len=0
930958 310.194969 10.0.0.2 -> 10.0.0.4 TCP 64 47924 > http [ACK] Seq=2556 Ack=61342 Win=65535 Len=0
930971 310.199250 10.0.0.2 -> 10.0.0.4 TCP 64 47924 > http [ACK] Seq=2556 Ack=64262 Win=65535 Len=0
930982 310.203620 10.0.0.2 -> 10.0.0.4 TCP 64 47924 > http [ACK] Seq=2556 Ack=67182 Win=65535 Len=0
930993 310.207385 10.0.0.2 -> 10.0.0.4 TCP 64 47924 > http [ACK] Seq=2556 Ack=70102 Win=65535 Len=0
931009 310.211781 10.0.0.2 -> 10.0.0.4 TCP 64 47924 > http [ACK] Seq=2556 Ack=73022 Win=65535 Len=0
931022 310.216097 10.0.0.2 -> 10.0.0.4 TCP 64 47924 > http [ACK] Seq=2556 Ack=75942 Win=65535 Len=0
931031 310.220049 10.0.0.2 -> 10.0.0.4 TCP 64 47924 > http [ACK] Seq=2556 Ack=78862 Win=65535 Len=0
931135 310.268465 10.0.0.2 -> 10.0.0.4 TCP 64 47924 > http [ACK] Seq=2556 Ack=81782 Win=65535 Len=0
931156 310.273602 10.0.0.2 -> 10.0.0.4 TCP 64 47924 > http [ACK] Seq=2556 Ack=84702 Win=65535 Len=0
931176 310.278838 10.0.0.2 -> 10.0.0.4 TCP 64 47924 > http [ACK] Seq=2556 Ack=87622 Win=65535 Len=0
931210 310.288735 10.0.0.2 -> 10.0.0.4 TCP 64 47924 > http [ACK] Seq=2556 Ack=90542 Win=65535 Len=0
931232 310.293942 10.0.0.2 -> 10.0.0.4 TCP 64 47924 > http [ACK] Seq=2556 Ack=93462 Win=65535 Len=0
931254 310.299187 10.0.0.2 -> 10.0.0.4 TCP 64 47924 > http [ACK] Seq=2556 Ack=96382 Win=65535 Len=0
931276 310.304519 10.0.0.2 -> 10.0.0.4 TCP 64 47924 > http [ACK] Seq=2556 Ack=99302 Win=65535 Len=0
931285 310.309573 10.0.0.2 -> 10.0.0.4 TCP 64 47924 > http [ACK] Seq=2556 Ack=102222 Win=65535 Len=0
931295 310.315162 10.0.0.2 -> 10.0.0.4 TCP 64 47924 > http [ACK] Seq=2556 Ack=105142 Win=65535 Len=0
931345 310.327272 10.0.0.2 -> 10.0.0.4 TCP 64 47924 > http [ACK] Seq=2556 Ack=108062 Win=65535 Len=0
931385 310.332617 10.0.0.2 -> 10.0.0.4 TCP 64 47924 > http [ACK] Seq=2556 Ack=110982 Win=65535 Len=0
931398 310.337525 10.0.0.2 -> 10.0.0.4 TCP 64 47924 > http [ACK] Seq=2556 Ack=113902 Win=65535 Len=0
931429 310.342520 10.0.0.2 -> 10.0.0.4 TCP 64 47924 > http [ACK] Seq=2556 Ack=115466 Win=65535 Len=0
931611 310.393196 10.0.0.2 -> 10.0.0.4 TCP 64 47924 > http [ACK] Seq=2556 Ack=118386 Win=65535 Len=0
931635 310.398363 10.0.0.2 -> 10.0.0.4 TCP 64 47924 > http [ACK] Seq=2556 Ack=121306 Win=65535 Len=0
931654 310.403809 10.0.0.2 -> 10.0.0.4 TCP 64 47924 > http [ACK] Seq=2556 Ack=124226 Win=65535 Len=0
931664 310.408887 10.0.0.2 -> 10.0.0.4 TCP 64 47924 > http [ACK] Seq=2556 Ack=127146 Win=65535 Len=0
931676 310.414506 10.0.0.2 -> 10.0.0.4 TCP 64 47924 > http [ACK] Seq=2556 Ack=130066 Win=65535 Len=0
931706 310.419538 10.0.0.2 -> 10.0.0.4 TCP 64 47924 > http [ACK] Seq=2556 Ack=132986 Win=65535 Len=0
931714 310.424837 10.0.0.2 -> 10.0.0.4 TCP 64 47924 > http [ACK] Seq=2556 Ack=135906 Win=65535 Len=0
931732 310.429841 10.0.0.2 -> 10.0.0.4 TCP 64 47924 > http [ACK] Seq=2556 Ack=138826 Win=65535 Len=0
931784 310.435180 10.0.0.2 -> 10.0.0.4 TCP 64 47924 > http [ACK] Seq=2556 Ack=141746 Win=65535 Len=0
931813 310.440468 10.0.0.2 -> 10.0.0.4 TCP 64 47924 > http [ACK] Seq=2556 Ack=144666 Win=65535 Len=0
931843 310.445848 10.0.0.2 -> 10.0.0.4 TCP 64 47924 > http [ACK] Seq=2556 Ack=147586 Win=65535 Len=0
931886 310.453791 10.0.0.2 -> 10.0.0.4 TCP 64 47924 > http [ACK] Seq=2556 Ack=150506 Win=65535 Len=0
931904 310.459699 10.0.0.2 -> 10.0.0.4 TCP 64 47924 > http [ACK] Seq=2556 Ack=153426 Win=65535 Len=0
931937 310.464961 10.0.0.2 -> 10.0.0.4 TCP 64 47924 > http [ACK] Seq=2556 Ack=156346 Win=65535 Len=0
931961 310.470541 10.0.0.2 -> 10.0.0.4 TCP 64 47924 > http [ACK] Seq=2556 Ack=159266 Win=65535 Len=0
931986 310.475890 10.0.0.2 -> 10.0.0.4 TCP 64 47924 > http [ACK] Seq=2556 Ack=162186 Win=65535 Len=0
932001 310.481636 10.0.0.2 -> 10.0.0.4 TCP 64 47924 > http [ACK] Seq=2556 Ack=165106 Win=65535 Len=0
932031 310.493488 10.0.0.2 -> 10.0.0.4 TCP 64 47924 > http [ACK] Seq=2556 Ack=168026 Win=65535 Len=0
932040 310.499568 10.0.0.2 -> 10.0.0.4 TCP 64 47924 > http [ACK] Seq=2556 Ack=170946 Win=65535 Len=0
932048 310.504046 10.0.0.2 -> 10.0.0.4 TCP 64 47924 > http [ACK] Seq=2556 Ack=173866 Win=65535 Len=0
932055 310.509398 10.0.0.2 -> 10.0.0.4 TCP 64 47924 > http [ACK] Seq=2556 Ack=176786 Win=65535 Len=0
932147 310.542566 10.0.0.2 -> 10.0.0.4 TCP 64 47924 > http [ACK] Seq=2556 Ack=179706 Win=65535 Len=0
932459 310.629182 10.0.0.2 -> 10.0.0.4 TCP 64 47924 > http [ACK] Seq=2556 Ack=182462 Win=65535 Len=0
932489 310.639919 10.0.0.2 -> 10.0.0.4 TCP 64 47924 > http [ACK] Seq=2556 Ack=183987 Win=65535 Len=0
933090 310.831071 10.0.0.2 -> 10.0.0.4 TCP 64 14269 > http [ACK] Seq=3239 Ack=19717 Win=65535 Len=0
933698 311.113597 10.0.0.2 -> 10.0.0.4 TCP 64 47924 > http [ACK] Seq=3363 Ack=186907 Win=65535 Len=0
933722 311.117271 10.0.0.2 -> 10.0.0.4 TCP 64 47924 > http [ACK] Seq=3363 Ack=188891 Win=65535 Len=0
933734 311.119782 10.0.0.2 -> 10.0.0.4 TCP 64 14269 > http [ACK] Seq=4046 Ack=22637 Win=65535 Len=0
933770 311.123663 10.0.0.2 -> 10.0.0.4 TCP 64 14269 > http [ACK] Seq=4046 Ack=25557 Win=65535 Len=0
933796 311.127246 10.0.0.2 -> 10.0.0.4 TCP 64 14269 > http [ACK] Seq=4046 Ack=28477 Win=65535 Len=0
933807 311.132056 10.0.0.2 -> 10.0.0.4 TCP 64 14269 > http [ACK] Seq=4046 Ack=31397 Win=65535 Len=0
933818 311.135028 10.0.0.2 -> 10.0.0.4 TCP 64 14269 > http [ACK] Seq=4046 Ack=34317 Win=65535 Len=0
934093 311.248006 10.0.0.2 -> 10.0.0.4 TCP 64 14269 > http [ACK] Seq=4046 Ack=37237 Win=65535 Len=0
934128 311.251792 10.0.0.2 -> 10.0.0.4 TCP 64 14269 > http [ACK] Seq=4046 Ack=40157 Win=65535 Len=0
934150 311.255707 10.0.0.2 -> 10.0.0.4 TCP 64 47924 > http [ACK] Seq=4171 Ack=191811 Win=65535 Len=0
934190 311.259233 10.0.0.2 -> 10.0.0.4 TCP 64 47924 > http [ACK] Seq=4171 Ack=194731 Win=65535 Len=0
934231 311.263067 10.0.0.2 -> 10.0.0.4 TCP 64 47924 > http [ACK] Seq=4171 Ack=197651 Win=65535 Len=0
934283 311.266329 10.0.0.2 -> 10.0.0.4 TCP 64 47924 > http [ACK] Seq=4171 Ack=200571 Win=65535 Len=0
934313 311.269140 10.0.0.2 -> 10.0.0.4 TCP 64 47924 > http [ACK] Seq=4171 Ack=203491 Win=65535 Len=0
934349 311.272263 10.0.0.2 -> 10.0.0.4 TCP 64 47924 > http [ACK] Seq=4171 Ack=206411 Win=65535 Len=0
934372 311.275504 10.0.0.2 -> 10.0.0.4 TCP 64 47924 > http [ACK] Seq=4171 Ack=209331 Win=65535 Len=0
934378 311.279687 10.0.0.2 -> 10.0.0.4 TCP 64 47924 > http [ACK] Seq=4171 Ack=212251 Win=65535 Len=0
934396 311.282445 10.0.0.2 -> 10.0.0.4 TCP 64 47924 > http [ACK] Seq=4171 Ack=215171 Win=65535 Len=0
934403 311.284968 10.0.0.2 -> 10.0.0.4 TCP 64 47924 > http [ACK] Seq=4171 Ack=218091 Win=65535 Len=0
934404 311.287768 10.0.0.2 -> 10.0.0.4 TCP 64 47924 > http [ACK] Seq=4171 Ack=219803 Win=65535 Len=0
934408 311.289660 10.0.0.2 -> 10.0.0.4 TCP 64 14269 > http [ACK] Seq=4046 Ack=43077 Win=65535 Len=0
934471 311.292779 10.0.0.2 -> 10.0.0.4 TCP 64 14269 > http [ACK] Seq=4046 Ack=45997 Win=65535 Len=0
934474 311.296423 10.0.0.2 -> 10.0.0.4 TCP 64 14269 > http [ACK] Seq=4046 Ack=48917 Win=65535 Len=0
934476 311.298790 10.0.0.2 -> 10.0.0.4 TCP 64 14269 > http [ACK] Seq=4046 Ack=51837 Win=65535 Len=0
934493 311.302104 10.0.0.2 -> 10.0.0.4 TCP 64 14269 > http [ACK] Seq=4046 Ack=54757 Win=65535 Len=0
934504 311.305612 10.0.0.2 -> 10.0.0.4 TCP 64 14269 > http [ACK] Seq=4046 Ack=57677 Win=65535 Len=0
934635 311.379585 10.0.0.2 -> 10.0.0.4 TCP 64 47924 > http [ACK] Seq=4979 Ack=222723 Win=65535 Len=0
934655 311.380793 10.0.0.2 -> 10.0.0.4 TCP 64 47924 > http [ACK] Seq=4979 Ack=225643 Win=65535 Len=0
934672 311.382169 10.0.0.2 -> 10.0.0.4 TCP 64 47924 > http [ACK] Seq=4979 Ack=228563 Win=65535 Len=0
934682 311.384925 10.0.0.2 -> 10.0.0.4 TCP 64 47924 > http [ACK] Seq=4979 Ack=231483 Win=65535 Len=0
934688 311.388136 10.0.0.2 -> 10.0.0.4 TCP 64 47924 > http [ACK] Seq=4979 Ack=234403 Win=65535 Len=0
934697 311.390972 10.0.0.2 -> 10.0.0.4 TCP 64 47924 > http [ACK] Seq=4979 Ack=237323 Win=65535 Len=0
934732 311.394205 10.0.0.2 -> 10.0.0.4 TCP 64 47924 > http [ACK] Seq=4979 Ack=240243 Win=65535 Len=0
934738 311.398671 10.0.0.2 -> 10.0.0.4 TCP 64 47924 > http [ACK] Seq=4979 Ack=243163 Win=65535 Len=0
934745 311.400627 10.0.0.2 -> 10.0.0.4 TCP 64 47924 > http [ACK] Seq=4979 Ack=246083 Win=65535 Len=0
934754 311.404312 10.0.0.2 -> 10.0.0.4 TCP 64 47924 > http [ACK] Seq=4979 Ack=249003 Win=65535 Len=0
934853 311.453203 10.0.0.2 -> 10.0.0.4 TCP 64 14269 > http [ACK] Seq=4852 Ack=60780 Win=65535 Len=0
934859 311.454405 10.0.0.2 -> 10.0.0.4 TCP 64 14269 > http [ACK] Seq=4852 Ack=63700 Win=65535 Len=0
934866 311.455569 10.0.0.2 -> 10.0.0.4 TCP 64 14269 > http [ACK] Seq=4852 Ack=66620 Win=65535 Len=0
934872 311.456473 10.0.0.2 -> 10.0.0.4 TCP 64 14269 > http [ACK] Seq=4852 Ack=68529 Win=65535 Len=0
935092 311.564497 10.0.0.2 -> 10.0.0.4 TCP 64 47924 > http [ACK] Seq=5800 Ack=251970 Win=65535 Len=0
935105 311.567217 10.0.0.2 -> 10.0.0.4 TCP 64 47924 > http [ACK] Seq=5800 Ack=253803 Win=65535 Len=0
935381 311.661930 10.0.0.2 -> 10.0.0.4 TCP 64 14269 > http [ACK] Seq=5661 Ack=71227 Win=65535 Len=0
935398 311.664552 10.0.0.2 -> 10.0.0.4 TCP 64 47924 > http [ACK] Seq=6599 Ack=256113 Win=65535 Len=0
935816 311.770583 10.0.0.2 -> 10.0.0.4 TCP 64 14269 > http [ACK] Seq=6472 Ack=74147 Win=65535 Len=0
935864 311.775788 10.0.0.2 -> 10.0.0.4 TCP 64 14269 > http [ACK] Seq=6472 Ack=77067 Win=65535 Len=0
935889 311.779645 10.0.0.2 -> 10.0.0.4 TCP 64 14269 > http [ACK] Seq=6472 Ack=79987 Win=65535 Len=0
935908 311.784679 10.0.0.2 -> 10.0.0.4 TCP 64 14269 > http [ACK] Seq=6472 Ack=82302 Win=65535 Len=0
936272 311.879732 10.0.0.2 -> 10.0.0.4 TCP 64 47924 > http [ACK] Seq=7408 Ack=259033 Win=65535 Len=0
936308 311.884299 10.0.0.2 -> 10.0.0.4 TCP 64 47924 > http [ACK] Seq=7408 Ack=261953 Win=65535 Len=0
936335 311.888563 10.0.0.2 -> 10.0.0.4 TCP 64 47924 > http [ACK] Seq=7408 Ack=264873 Win=65535 Len=0
936782 311.995689 10.0.0.2 -> 10.0.0.4 TCP 64 14269 > http [ACK] Seq=7277 Ack=85222 Win=65535 Len=0
936795 311.999955 10.0.0.2 -> 10.0.0.4 TCP 64 14269 > http [ACK] Seq=7277 Ack=88142 Win=65535 Len=0
936838 312.005129 10.0.0.2 -> 10.0.0.4 TCP 64 14269 > http [ACK] Seq=7277 Ack=91062 Win=65535 Len=0
937270 312.107640 10.0.0.2 -> 10.0.0.4 TCP 64 47924 > http [ACK] Seq=8214 Ack=268786 Win=65535 Len=0
937537 312.208781 10.0.0.2 -> 10.0.0.4 TCP 64 14269 > http [ACK] Seq=8087 Ack=94408 Win=65535 Len=0
937802 312.307761 10.0.0.2 -> 10.0.0.4 TCP 64 47924 > http [ACK] Seq=9018 Ack=272344 Win=65535 Len=0
937825 312.318797 10.0.0.2 -> 10.0.0.4 TCP 64 47924 > http [ACK] Seq=9018 Ack=275264 Win=65535 Len=0
937867 312.335822 10.0.0.2 -> 10.0.0.4 TCP 64 47924 > http [ACK] Seq=9018 Ack=278184 Win=65535 Len=0
937906 312.347082 10.0.0.2 -> 10.0.0.4 TCP 64 47924 > http [ACK] Seq=9018 Ack=280203 Win=65535 Len=0
938236 312.452498 10.0.0.2 -> 10.0.0.4 TCP 64 14269 > http [ACK] Seq=8893 Ack=98758 Win=65535 Len=0
938247 312.453838 10.0.0.2 -> 10.0.0.4 TCP 64 14269 > http [ACK] Seq=8893 Ack=101678 Win=65535 Len=0
938257 312.455314 10.0.0.2 -> 10.0.0.4 TCP 64 14269 > http [ACK] Seq=8893 Ack=104598 Win=65535 Len=0
938264 312.456536 10.0.0.2 -> 10.0.0.4 TCP 64 14269 > http [ACK] Seq=8893 Ack=107518 Win=65535 Len=0
938272 312.457804 10.0.0.2 -> 10.0.0.4 TCP 64 14269 > http [ACK] Seq=8893 Ack=110438 Win=65535 Len=0
938279 312.459228 10.0.0.2 -> 10.0.0.4 TCP 64 14269 > http [ACK] Seq=8893 Ack=113358 Win=65535 Len=0
938287 312.460693 10.0.0.2 -> 10.0.0.4 TCP 64 14269 > http [ACK] Seq=8893 Ack=116278 Win=65535 Len=0
938295 312.461827 10.0.0.2 -> 10.0.0.4 TCP 64 14269 > http [ACK] Seq=8893 Ack=119198 Win=65535 Len=0
938333 312.472465 10.0.0.2 -> 10.0.0.4 TCP 64 14269 > http [ACK] Seq=8893 Ack=122118 Win=65535 Len=0
938364 312.483834 10.0.0.2 -> 10.0.0.4 TCP 64 14269 > http [ACK] Seq=8893 Ack=125038 Win=65535 Len=0
938414 312.496286 10.0.0.2 -> 10.0.0.4 TCP 64 14269 > http [ACK] Seq=8893 Ack=127958 Win=65535 Len=0
938426 312.506060 10.0.0.2 -> 10.0.0.4 TCP 64 14269 > http [ACK] Seq=8893 Ack=130878 Win=65535 Len=0
938459 312.517900 10.0.0.2 -> 10.0.0.4 TCP 64 14269 > http [ACK] Seq=8893 Ack=133798 Win=65535 Len=0
938526 312.528894 10.0.0.2 -> 10.0.0.4 TCP 64 14269 > http [ACK] Seq=8893 Ack=136718 Win=65535 Len=0
938576 312.538190 10.0.0.2 -> 10.0.0.4 TCP 64 14269 > http [ACK] Seq=8893 Ack=139638 Win=65535 Len=0
938610 312.545394 10.0.0.2 -> 10.0.0.4 TCP 64 14269 > http [ACK] Seq=8893 Ack=142558 Win=65535 Len=0
938616 312.552858 10.0.0.2 -> 10.0.0.4 TCP 64 14269 > http [ACK] Seq=8893 Ack=145478 Win=65535 Len=0
938634 312.560009 10.0.0.2 -> 10.0.0.4 TCP 64 14269 > http [ACK] Seq=8893 Ack=148398 Win=65535 Len=0
938669 312.567169 10.0.0.2 -> 10.0.0.4 TCP 64 14269 > http [ACK] Seq=8893 Ack=151318 Win=65535 Len=0
938681 312.574477 10.0.0.2 -> 10.0.0.4 TCP 64 14269 > http [ACK] Seq=8893 Ack=154238 Win=65535 Len=0
938775 312.593645 10.0.0.2 -> 10.0.0.4 TCP 64 14269 > http [ACK] Seq=8893 Ack=157158 Win=65535 Len=0
938794 312.601021 10.0.0.2 -> 10.0.0.4 TCP 64 14269 > http [ACK] Seq=8893 Ack=160078 Win=65535 Len=0
939163 312.703817 10.0.0.2 -> 10.0.0.4 TCP 64 47924 > http [ACK] Seq=9832 Ack=283123 Win=65535 Len=0
939218 312.710963 10.0.0.2 -> 10.0.0.4 TCP 64 47924 > http [ACK] Seq=9832 Ack=286043 Win=65535 Len=0
939662 312.810420 10.0.0.2 -> 10.0.0.4 TCP 64 14269 > http [ACK] Seq=9703 Ack=163348 Win=65535 Len=0
940039 312.904114 10.0.0.2 -> 10.0.0.4 TCP 64 47924 > http [ACK] Seq=10635 Ack=288986 Win=65535 Len=0
940046 312.905453 10.0.0.2 -> 10.0.0.4 TCP 64 47924 > http [ACK] Seq=10635 Ack=291906 Win=65535 Len=0
940060 312.906834 10.0.0.2 -> 10.0.0.4 TCP 64 47924 > http [ACK] Seq=10635 Ack=294826 Win=65535 Len=0
940098 312.908667 10.0.0.2 -> 10.0.0.4 TCP 64 47924 > http [ACK] Seq=10635 Ack=297399 Win=65535 Len=0
940618 313.001844 10.0.0.2 -> 10.0.0.4 TCP 64 47924 > http [ACK] Seq=11463 Ack=300319 Win=65535 Len=0
940624 313.003154 10.0.0.2 -> 10.0.0.4 TCP 64 47924 > http [ACK] Seq=11463 Ack=303239 Win=65535 Len=0
940630 313.004567 10.0.0.2 -> 10.0.0.4 TCP 64 47924 > http [ACK] Seq=11463 Ack=306159 Win=65535 Len=0
940639 313.006614 10.0.0.2 -> 10.0.0.4 TCP 64 47924 > http [ACK] Seq=11463 Ack=309079 Win=65535 Len=0
940640 313.006618 10.0.0.2 -> 10.0.0.4 TCP 64 47924 > http [ACK] Seq=11463 Ack=310830 Win=65535 Len=0
940759 313.010878 10.0.0.2 -> 10.0.0.4 TCP 64 14269 > http [ACK] Seq=10534 Ack=166805 Win=65535 Len=0
940777 313.012506 10.0.0.2 -> 10.0.0.4 TCP 64 14269 > http [ACK] Seq=10534 Ack=169725 Win=65535 Len=0
940783 313.013665 10.0.0.2 -> 10.0.0.4 TCP 64 14269 > http [ACK] Seq=10534 Ack=172645 Win=65535 Len=0
940789 313.015058 10.0.0.2 -> 10.0.0.4 TCP 64 14269 > http [ACK] Seq=10534 Ack=175565 Win=65535 Len=0
940795 313.016316 10.0.0.2 -> 10.0.0.4 TCP 64 14269 > http [ACK] Seq=10534 Ack=178485 Win=65535 Len=0
940803 313.017567 10.0.0.2 -> 10.0.0.4 TCP 64 14269 > http [ACK] Seq=10534 Ack=181405 Win=65535 Len=0
940814 313.018944 10.0.0.2 -> 10.0.0.4 TCP 64 14269 > http [ACK] Seq=10534 Ack=184325 Win=65535 Len=0
940820 313.020477 10.0.0.2 -> 10.0.0.4 TCP 64 14269 > http [ACK] Seq=10534 Ack=187245 Win=65535 Len=0
940853 313.024047 10.0.0.2 -> 10.0.0.4 TCP 64 14269 > http [ACK] Seq=10534 Ack=190165 Win=65535 Len=0
940918 313.030869 10.0.0.2 -> 10.0.0.4 TCP 64 14269 > http [ACK] Seq=10534 Ack=193085 Win=65535 Len=0
940924 313.036387 10.0.0.2 -> 10.0.0.4 TCP 64 14269 > http [ACK] Seq=10534 Ack=196005 Win=65535 Len=0
940961 313.042485 10.0.0.2 -> 10.0.0.4 TCP 64 14269 > http [ACK] Seq=10534 Ack=198925 Win=65535 Len=0
941089 313.048577 10.0.0.2 -> 10.0.0.4 TCP 64 14269 > http [ACK] Seq=10534 Ack=201845 Win=65535 Len=0
941444 313.099855 10.0.0.2 -> 10.0.0.4 TCP 64 47924 > http [ACK] Seq=12293 Ack=313750 Win=65535 Len=0
941474 313.101354 10.0.0.2 -> 10.0.0.4 TCP 64 47924 > http [ACK] Seq=12293 Ack=316670 Win=65535 Len=0
941485 313.103698 10.0.0.2 -> 10.0.0.4 TCP 64 47924 > http [ACK] Seq=12293 Ack=319590 Win=65535 Len=0
941491 313.104125 10.0.0.2 -> 10.0.0.4 TCP 64 47924 > http [ACK] Seq=12293 Ack=322510 Win=65535 Len=0
942573 313.279886 10.0.0.2 -> 10.0.0.4 TCP 64 47924 > http [ACK] Seq=13920 Ack=325989 Win=65535 Len=0
943123 313.354309 10.0.0.2 -> 10.0.0.4 TCP 64 14269 > http [ACK] Seq=12954 Ack=205398 Win=65535 Len=0
943176 313.367460 10.0.0.2 -> 10.0.0.4 TCP 64 47924 > http [ACK] Seq=14728 Ack=328649 Win=65535 Len=0
943552 313.441225 10.0.0.2 -> 10.0.0.4 TCP 64 14269 > http [ACK] Seq=13761 Ack=208212 Win=65535 Len=0
943637 313.454553 10.0.0.2 -> 10.0.0.4 TCP 64 47924 > http [ACK] Seq=15534 Ack=331569 Win=65535 Len=0
943643 313.457630 10.0.0.2 -> 10.0.0.4 TCP 64 47924 > http [ACK] Seq=15534 Ack=333637 Win=65535 Len=0
943752 313.531272 10.0.0.2 -> 10.0.0.4 TCP 64 14269 > http [ACK] Seq=14568 Ack=211132 Win=65535 Len=0
943761 313.533183 10.0.0.2 -> 10.0.0.4 TCP 64 14269 > http [ACK] Seq=14568 Ack=212944 Win=65535 Len=0
943837 313.545052 10.0.0.2 -> 10.0.0.4 TCP 64 47924 > http [ACK] Seq=16352 Ack=336220 Win=65535 Len=0
944159 313.620162 10.0.0.2 -> 10.0.0.4 TCP 64 14269 > http [ACK] Seq=15385 Ack=215864 Win=65535 Len=0
944166 313.621129 10.0.0.2 -> 10.0.0.4 TCP 64 14269 > http [ACK] Seq=15385 Ack=217999 Win=65535 Len=0
944240 313.644465 10.0.0.2 -> 10.0.0.4 TCP 64 47924 > http [ACK] Seq=17169 Ack=339140 Win=65535 Len=0
944249 313.645579 10.0.0.2 -> 10.0.0.4 TCP 64 47924 > http [ACK] Seq=17169 Ack=342060 Win=65535 Len=0
944259 313.647345 10.0.0.2 -> 10.0.0.4 TCP 64 47924 > http [ACK] Seq=17169 Ack=344980 Win=65535 Len=0
944442 313.709414 10.0.0.2 -> 10.0.0.4 TCP 64 14269 > http [ACK] Seq=16198 Ack=220741 Win=65535 Len=0
945691 313.928060 10.0.0.2 -> 10.0.0.4 TCP 64 47924 > http [ACK] Seq=19633 Ack=350005 Win=65535 Len=0
946694 314.225909 10.0.0.2 -> 10.0.0.4 TCP 64 14269 > http [ACK] Seq=20254 Ack=224110 Win=65535 Len=0
946851 314.258999 10.0.0.2 -> 10.0.0.4 TCP 64 47924 > http [ACK] Seq=21256 Ack=351200 Win=64340 Len=0
950987 315.415438 10.0.0.2 -> 10.0.0.4 TCP 64 47924 > http [ACK] Seq=22358 Ack=354120 Win=65535 Len=0
950993 315.415830 10.0.0.2 -> 10.0.0.4 TCP 64 47924 > http [ACK] Seq=22358 Ack=357040 Win=65535 Len=0
951001 315.417278 10.0.0.2 -> 10.0.0.4 TCP 64 47924 > http [ACK] Seq=22358 Ack=359960 Win=65535 Len=0
951007 315.418801 10.0.0.2 -> 10.0.0.4 TCP 64 47924 > http [ACK] Seq=22358 Ack=362880 Win=65535 Len=0
951024 315.421067 10.0.0.2 -> 10.0.0.4 TCP 64 47924 > http [ACK] Seq=22358 Ack=365800 Win=65535 Len=0
951030 315.424243 10.0.0.2 -> 10.0.0.4 TCP 64 47924 > http [ACK] Seq=22358 Ack=368720 Win=65535 Len=0
951036 315.427089 10.0.0.2 -> 10.0.0.4 TCP 64 47924 > http [ACK] Seq=22358 Ack=370662 Win=65535 Len=0
951659 315.633408 10.0.0.2 -> 10.0.0.4 TCP 64 14269 > http [ACK] Seq=21150 Ack=227030 Win=65535 Len=0
951665 315.634890 10.0.0.2 -> 10.0.0.4 TCP 64 14269 > http [ACK] Seq=21150 Ack=229950 Win=65535 Len=0
951674 315.636150 10.0.0.2 -> 10.0.0.4 TCP 64 14269 > http [ACK] Seq=21150 Ack=232870 Win=65535 Len=0
951680 315.637569 10.0.0.2 -> 10.0.0.4 TCP 64 14269 > http [ACK] Seq=21150 Ack=235790 Win=65535 Len=0
951686 315.638768 10.0.0.2 -> 10.0.0.4 TCP 64 14269 > http [ACK] Seq=21150 Ack=238710 Win=65535 Len=0
951692 315.640136 10.0.0.2 -> 10.0.0.4 TCP 64 14269 > http [ACK] Seq=21150 Ack=241630 Win=65535 Len=0
951701 315.641997 10.0.0.2 -> 10.0.0.4 TCP 64 14269 > http [ACK] Seq=21150 Ack=244550 Win=65535 Len=0
951728 315.642934 10.0.0.2 -> 10.0.0.4 TCP 64 14269 > http [ACK] Seq=21150 Ack=247470 Win=65535 Len=0
951735 315.644372 10.0.0.2 -> 10.0.0.4 TCP 64 14269 > http [ACK] Seq=21150 Ack=250232 Win=65535 Len=0
951742 315.645591 10.0.0.2 -> 10.0.0.4 TCP 64 47924 > http [ACK] Seq=23242 Ack=373582 Win=65535 Len=0
951748 315.647294 10.0.0.2 -> 10.0.0.4 TCP 64 47924 > http [ACK] Seq=23242 Ack=376502 Win=65535 Len=0
951754 315.648302 10.0.0.2 -> 10.0.0.4 TCP 64 47924 > http [ACK] Seq=23242 Ack=379422 Win=65535 Len=0
951763 315.649536 10.0.0.2 -> 10.0.0.4 TCP 64 47924 > http [ACK] Seq=23242 Ack=382342 Win=65535 Len=0
951769 315.650814 10.0.0.2 -> 10.0.0.4 TCP 64 47924 > http [ACK] Seq=23242 Ack=384797 Win=65535 Len=0
952528 315.886971 10.0.0.2 -> 10.0.0.4 TCP 64 14269 > http [ACK] Seq=22055 Ack=253152 Win=65535 Len=0
952543 315.888296 10.0.0.2 -> 10.0.0.4 TCP 64 14269 > http [ACK] Seq=22055 Ack=255032 Win=65535 Len=0
952553 315.889085 10.0.0.2 -> 10.0.0.4 TCP 64 47924 > http [ACK] Seq=24145 Ack=386890 Win=65535 Len=0
952920 315.988703 10.0.0.2 -> 10.0.0.4 TCP 64 47924 > http [ACK] Seq=25048 Ack=388978 Win=65535 Len=0
953113 316.068712 10.0.0.2 -> 10.0.0.4 TCP 64 14269 > http [ACK] Seq=23832 Ack=257577 Win=65535 Len=0
953170 316.084149 10.0.0.2 -> 10.0.0.4 TCP 64 47924 > http [ACK] Seq=25951 Ack=390950 Win=65535 Len=0
953403 316.158211 10.0.0.2 -> 10.0.0.4 TCP 64 14269 > http [ACK] Seq=24735 Ack=259917 Win=65535 Len=0
953490 316.179406 10.0.0.2 -> 10.0.0.4 TCP 64 47924 > http [ACK] Seq=26854 Ack=393028 Win=65535 Len=0
953748 316.256946 10.0.0.2 -> 10.0.0.4 TCP 64 14269 > http [ACK] Seq=25613 Ack=262837 Win=65535 Len=0
953793 316.262024 10.0.0.2 -> 10.0.0.4 TCP 64 14269 > http [ACK] Seq=25613 Ack=264485 Win=65535 Len=0
953854 316.282756 10.0.0.2 -> 10.0.0.4 TCP 64 47924 > http [ACK] Seq=27740 Ack=395948 Win=65535 Len=0
953868 316.286768 10.0.0.2 -> 10.0.0.4 TCP 64 47924 > http [ACK] Seq=27740 Ack=398868 Win=65535 Len=0
953881 316.292522 10.0.0.2 -> 10.0.0.4 TCP 64 47924 > http [ACK] Seq=27740 Ack=401788 Win=65535 Len=0
953900 316.297990 10.0.0.2 -> 10.0.0.4 TCP 64 47924 > http [ACK] Seq=27740 Ack=404708 Win=65535 Len=0
953922 316.303115 10.0.0.2 -> 10.0.0.4 TCP 64 47924 > http [ACK] Seq=27740 Ack=407628 Win=65535 Len=0
953928 316.308698 10.0.0.2 -> 10.0.0.4 TCP 64 47924 > http [ACK] Seq=27740 Ack=410548 Win=65535 Len=0
953940 316.313934 10.0.0.2 -> 10.0.0.4 TCP 64 47924 > http [ACK] Seq=27740 Ack=413468 Win=65535 Len=0
953948 316.319354 10.0.0.2 -> 10.0.0.4 TCP 64 47924 > http [ACK] Seq=27740 Ack=416388 Win=65535 Len=0
953959 316.325695 10.0.0.2 -> 10.0.0.4 TCP 64 47924 > http [ACK] Seq=27740 Ack=417945 Win=65535 Len=0
